{
  "metadata": {
    "title": "Thermocatalytic decomposition of methane to low-carbon hydrogen using LaNi<ce:inf loc=post>1-x</ce:inf>Cu<ce:inf loc=post>x</ce:inf>O<ce:inf loc=post>3</ce:inf> perovskite catalysts",
    "authors": "; ; ",
    "journal": "Applied Catalysis A: General",
    "date": "2024-05-05",
    "doi": "10.1016/j.apcata.2024.119703",
    "abstract": "",
    "uri": "https://api.elsevier.com/content/article/pii/S0926860X24001479",
    "pii": "S0926860X24001479"
  },
  "fulltext": {
    "full-text-retrieval-response": {
      "scopus-eid": "2-s2.0-85188543229",
      "originalText": "serial JL 271346 291210 291744 291809 31 90 Applied Catalysis A: General APPLIEDCATALYSISAGENERAL 2024-03-21 2024-03-21 2024-03-23 2024-03-23 2024-04-05T08:53:41 1-s2.0-S0926860X24001479 S0926-860X(24)00147-9 S0926860X24001479 10.1016/j.apcata.2024.119703 S300 S300.1 FULL-TEXT 1-s2.0-S0926860X24X00058 2024-05-08T01:43:36.115141Z 0 0 20240505 2024 2024-03-22T00:26:06.70919Z absattachment articleinfo articlenumber articletitlenorm authfirstinitialnorm authfirstsurnamenorm cid cids contenttype copyright crossmark dateloaded dateloadedtxt datesearch datesort dateupdated dco docsubtype doctype doi eid ewtransactionid fundingbodyid hubeid indexeddate issn issnnorm itemstage itemtransactionid itemweight oauserlicense openaccess openarchive pg pgfirst pii piinorm pubdatestart pubdatetxt pubyr sortorder sponsoredaccesstype srctitle srctitlenorm srctype ssids alllist content oa subj subheadings suppl tomb volfirst volissue volumelist webpdf webpdfpagecount yearnav figure table e-component body mmlmath acknowledge affil appendices articletitle auth authfirstini authfull authkeywords authlast grantnumber grantsponsor grantsponsorid highlightsabst primabst ref specialabst 0926-860X 0926860X UNLIMITED SANHYB2023 true 677 677 C Volume 677 9 119703 119703 119703 20240505 5 May 2024 2024-05-05 2024 article fla © 2024 The Authors. Published by Elsevier B.V. THERMOCATALYTICDECOMPOSITIONMETHANELOWCARBONHYDROGENUSINGLANI1XCUXO3PEROVSKITECATALYSTS DUMA Z 1 Introduction 2 Methods and materials 2.1 Catalyst synthesis 2.2 Characterization 2.3 Catalysts testing 3 Results and discussion 3.1 Powder X-Ray diffraction 3.2 Elemental composition 3.3 Electron microscopy 3.4 Hydrogen Temperature Programmed Reduction (H2-TPR) 3.5 Catalytic performances 3.5.1 Effect of partial substitution of Ni with Cu 3.5.2 Effect of GHSV 3.5.3 Effect of temperature 4 Conclusion CRediT authorship contribution statement Acknowledgements Appendix A Supplementary material References POTO 2021 121080 S PONTZEN 2011 242 250 F DEFALCO 2016 400 409 M KORANYI 2022 6342 T BIAN 2020 110291 Z SARASWAT 2011 13352 13360 S VENUGOPAL 2007 1782 1788 A GUEVARA 2010 3509 3521 J ASHOK 2008 4809 4818 J WANG 2002 1911 1917 H AIELLO 2000 227 234 R MSHEIK 2021 3107 M AMIN 2011 12460 12470 A AMIN 2011 2904 2935 A WEGER 2017 720 731 L MCCONNACHIE 2023 M ARANDIYAN 2023 7879 7916 H GOMEZCUASPUD 2017 167 179 J MOOGI 2022 135348 S MORADI 2012 797 801 G MANEERUNG 2015 13399 13411 T GALLEGO 2010 365 371 G TOUAHRA 2016 2477 2486 F MORADI 2012 797 801 G MORADI 2014 7 11 G DUMA 2022 401 Z PERENIGUEZ 2012 324 332 R ZHU 2014 2917 2940 J JURADO 2021 120687 L SHAHNAZI 2021 101455 A MANEERUNG 2011 24 35 T HU 2012 38 41 R DUMA 2022 1104 Z GUILLOPEZ 2011 40 51 R DUNKER 2006 1989 1998 A KRZYZYNSKI 2008 6172 6177 S SUELVES 2009 35 42 I RIVAS 2008 265 275 M LOBO 1990 247 256 L LIU 2020 96 106 Q NOLAN 1998 4165 4175 P KUKOVITSKII 1997 323 328 E BAYAT 2016 13039 13049 N CHEN 2005 82 96 D YI 2019 511 521 Y DENG 2016 113630 113647 C SUELVES 2005 1555 1567 I GAO 2013 2223 2229 B TARJOMANNEJAD 2016 1544 1551 A AHMED 2009 1 24 S DUMAX2024X119703 DUMAX2024X119703XZ Full 2024-03-22T15:59:49Z FundingBody SANLIC (South African Consortium) – Hybrid http://creativecommons.org/licenses/by-nc/4.0/ 2026-03-23T00:00:00.000Z 2026-03-23T00:00:00.000Z http://creativecommons.org/licenses/by-nc-nd/4.0/ This is an open access article under the CC BY-NC license. © 2024 The Authors. Published by Elsevier B.V. 2024-04-04T00:49:37.149Z http://vtw.elsevier.com/data/voc/AddOnTypes/50.7/aggregated-refined Department of Science and Innovation’s Hydrogen South Africa DSI Department of Science and Innovation, South Africa http://data.elsevier.com/vocabulary/SciValFunders/100016962 http://sws.geonames.org/953987/ Council for Scientific and Industrial Research CSIR Council of Scientific and Industrial Research, India http://data.elsevier.com/vocabulary/SciValFunders/501100001412 http://sws.geonames.org/1269750/ C6G0097 DST Republic of South Africa Department of Science and Innovation http://data.elsevier.com/vocabulary/SciValFunders/501100001342 http://sws.geonames.org/953987 The authors would like to thank the Council for Scientific and Industrial Research, and the Department of Science and Innovation’s Hydrogen South Africa (DSI-HySA) Infrastructure for the funding of the biogas-to-hydrogen project (Grant number: C6G0097). The authors would like to extend gratitude to the Energy and Fuels for a Sustainable Environment Team, Institut de Chimie et Procédés pour l’Energie, l’Environnement et la Santé, Université de Strasbourg for the access to advanced H 2 -TPR analyses. item S0926-860X(24)00147-9 S0926860X24001479 1-s2.0-S0926860X24001479 10.1016/j.apcata.2024.119703 271346 2024-05-08T01:43:36.115141Z 2024-05-05 UNLIMITED SANHYB2023 1-s2.0-S0926860X24001479-main.pdf https://s3-eu-west-1.amazonaws.com/prod-ucs-content-store-eu-west/content/pii:S0926860X24001479/MAIN/application/pdf/47b4ec13a8836b3c4f3ead08549e8d20/main.pdf main.pdf pdf true 4248090 MAIN 9 1-s2.0-S0926860X24001479-main_1.png https://s3-eu-west-1.amazonaws.com/prod-ucs-content-store-eu-west/content/pii:S0926860X24001479/PREVIEW/image/png/16982c99390d603dd45f871eb97efe5a/main_1.png main_1.png png 58834 849 656 IMAGE-WEB-PDF 1 1-s2.0-S0926860X24001479-gr9.jpg https://s3-eu-west-1.amazonaws.com/prod-ucs-content-store-eu-west/content/pii:S0926860X24001479/gr9/DOWNSAMPLED/image/jpeg/c559725b284f8baaf25540e77f4268dd/gr9.jpg gr9 gr9.jpg jpg 24481 312 376 IMAGE-DOWNSAMPLED 1-s2.0-S0926860X24001479-gr8.jpg https://s3-eu-west-1.amazonaws.com/prod-ucs-content-store-eu-west/content/pii:S0926860X24001479/gr8/DOWNSAMPLED/image/jpeg/5132126eda0e826165ad73c247779edb/gr8.jpg gr8 gr8.jpg jpg 73129 550 751 IMAGE-DOWNSAMPLED 1-s2.0-S0926860X24001479-gr1.jpg https://s3-eu-west-1.amazonaws.com/prod-ucs-content-store-eu-west/content/pii:S0926860X24001479/gr1/DOWNSAMPLED/image/jpeg/7150eb8ab8bbec1dd9f414cc13387ccd/gr1.jpg gr1 gr1.jpg jpg 25623 297 376 IMAGE-DOWNSAMPLED 1-s2.0-S0926860X24001479-gr3.jpg https://s3-eu-west-1.amazonaws.com/prod-ucs-content-store-eu-west/content/pii:S0926860X24001479/gr3/DOWNSAMPLED/image/jpeg/acdeb6ba277e3b2977ceda03b935f88f/gr3.jpg gr3 gr3.jpg jpg 23350 294 376 IMAGE-DOWNSAMPLED 1-s2.0-S0926860X24001479-gr2.jpg https://s3-eu-west-1.amazonaws.com/prod-ucs-content-store-eu-west/content/pii:S0926860X24001479/gr2/DOWNSAMPLED/image/jpeg/94d35f49a5aaa2547c69958ebb517e65/gr2.jpg gr2 gr2.jpg jpg 130557 783 565 IMAGE-DOWNSAMPLED 1-s2.0-S0926860X24001479-gr10.jpg https://s3-eu-west-1.amazonaws.com/prod-ucs-content-store-eu-west/content/pii:S0926860X24001479/gr10/DOWNSAMPLED/image/jpeg/289470a498c16a601634ea2284d4d0bd/gr10.jpg gr10 gr10.jpg jpg 16330 300 376 IMAGE-DOWNSAMPLED 1-s2.0-S0926860X24001479-ga1.jpg https://s3-eu-west-1.amazonaws.com/prod-ucs-content-store-eu-west/content/pii:S0926860X24001479/ga1/DOWNSAMPLED/image/jpeg/84b28bf15dc3d7d6910753afddbbf473/ga1.jpg ga1 true ga1.jpg jpg 17253 200 407 IMAGE-DOWNSAMPLED 1-s2.0-S0926860X24001479-gr5.jpg https://s3-eu-west-1.amazonaws.com/prod-ucs-content-store-eu-west/content/pii:S0926860X24001479/gr5/DOWNSAMPLED/image/jpeg/8d1150ad129f8926cfe64de00178080b/gr5.jpg gr5 gr5.jpg jpg 19786 312 376 IMAGE-DOWNSAMPLED 1-s2.0-S0926860X24001479-gr4.jpg https://s3-eu-west-1.amazonaws.com/prod-ucs-content-store-eu-west/content/pii:S0926860X24001479/gr4/DOWNSAMPLED/image/jpeg/a64ce736221a5e97fe11478825bc5d0d/gr4.jpg gr4 gr4.jpg jpg 24046 300 376 IMAGE-DOWNSAMPLED 1-s2.0-S0926860X24001479-gr7.jpg https://s3-eu-west-1.amazonaws.com/prod-ucs-content-store-eu-west/content/pii:S0926860X24001479/gr7/DOWNSAMPLED/image/jpeg/4f2d3022d7471cf9b351ec9c1aa7ff7d/gr7.jpg gr7 gr7.jpg jpg 20460 250 376 IMAGE-DOWNSAMPLED 1-s2.0-S0926860X24001479-gr6.jpg https://s3-eu-west-1.amazonaws.com/prod-ucs-content-store-eu-west/content/pii:S0926860X24001479/gr6/DOWNSAMPLED/image/jpeg/54212923334a12e247ae1739a9afc23a/gr6.jpg gr6 gr6.jpg jpg 46033 195 565 IMAGE-DOWNSAMPLED 1-s2.0-S0926860X24001479-gr9.sml https://s3-eu-west-1.amazonaws.com/prod-ucs-content-store-eu-west/content/pii:S0926860X24001479/gr9/THUMBNAIL/image/gif/504a9d8257386071bca15dfbca516dee/gr9.sml gr9 gr9.sml sml 6967 164 198 IMAGE-THUMBNAIL 1-s2.0-S0926860X24001479-gr8.sml https://s3-eu-west-1.amazonaws.com/prod-ucs-content-store-eu-west/content/pii:S0926860X24001479/gr8/THUMBNAIL/image/gif/18009d405db5295f730a847a281cfb94/gr8.sml gr8 gr8.sml sml 8540 160 219 IMAGE-THUMBNAIL 1-s2.0-S0926860X24001479-gr1.sml https://s3-eu-west-1.amazonaws.com/prod-ucs-content-store-eu-west/content/pii:S0926860X24001479/gr1/THUMBNAIL/image/gif/24713f703effc5aa4b83683cb99b0a6f/gr1.sml gr1 gr1.sml sml 7738 164 208 IMAGE-THUMBNAIL 1-s2.0-S0926860X24001479-gr3.sml https://s3-eu-west-1.amazonaws.com/prod-ucs-content-store-eu-west/content/pii:S0926860X24001479/gr3/THUMBNAIL/image/gif/f93da5fad1736804160a22ecc7cb9c3c/gr3.sml gr3 gr3.sml sml 6989 164 210 IMAGE-THUMBNAIL 1-s2.0-S0926860X24001479-gr2.sml https://s3-eu-west-1.amazonaws.com/prod-ucs-content-store-eu-west/content/pii:S0926860X24001479/gr2/THUMBNAIL/image/gif/56e7bcc1eb4d87126f9bbdba4beb34cd/gr2.sml gr2 gr2.sml sml 13195 164 118 IMAGE-THUMBNAIL 1-s2.0-S0926860X24001479-gr10.sml https://s3-eu-west-1.amazonaws.com/prod-ucs-content-store-eu-west/content/pii:S0926860X24001479/gr10/THUMBNAIL/image/gif/ff4f99e57702c6afbe02297b8ec3faaa/gr10.sml gr10 gr10.sml sml 5364 163 205 IMAGE-THUMBNAIL 1-s2.0-S0926860X24001479-ga1.sml https://s3-eu-west-1.amazonaws.com/prod-ucs-content-store-eu-west/content/pii:S0926860X24001479/ga1/THUMBNAIL/image/gif/e4e0a9e89c282d01e1ba009d599a541a/ga1.sml ga1 true ga1.sml sml 6163 108 219 IMAGE-THUMBNAIL 1-s2.0-S0926860X24001479-gr5.sml https://s3-eu-west-1.amazonaws.com/prod-ucs-content-store-eu-west/content/pii:S0926860X24001479/gr5/THUMBNAIL/image/gif/f65013c25068f79adfa4ea8b7140a20b/gr5.sml gr5 gr5.sml sml 6084 164 198 IMAGE-THUMBNAIL 1-s2.0-S0926860X24001479-gr4.sml https://s3-eu-west-1.amazonaws.com/prod-ucs-content-store-eu-west/content/pii:S0926860X24001479/gr4/THUMBNAIL/image/gif/04be7abe1aec7b6866ed4518a3a7dc07/gr4.sml gr4 gr4.sml sml 7800 164 205 IMAGE-THUMBNAIL 1-s2.0-S0926860X24001479-gr7.sml https://s3-eu-west-1.amazonaws.com/prod-ucs-content-store-eu-west/content/pii:S0926860X24001479/gr7/THUMBNAIL/image/gif/f934e2f2ad761e3ef299dea9efcf97df/gr7.sml gr7 gr7.sml sml 7084 146 219 IMAGE-THUMBNAIL 1-s2.0-S0926860X24001479-gr6.sml https://s3-eu-west-1.amazonaws.com/prod-ucs-content-store-eu-west/content/pii:S0926860X24001479/gr6/THUMBNAIL/image/gif/4b063b758c38b55fc10d89c31b1f0990/gr6.sml gr6 gr6.sml sml 11954 75 219 IMAGE-THUMBNAIL 1-s2.0-S0926860X24001479-gr9_lrg.jpg https://s3-eu-west-1.amazonaws.com/prod-ucs-content-store-eu-west/content/pii:S0926860X24001479/HIGHRES/image/jpeg/b61cfec951330abc28836011fc387cf7/gr9_lrg.jpg gr9 gr9_lrg.jpg jpg 123140 1378 1663 IMAGE-HIGH-RES 1-s2.0-S0926860X24001479-gr8_lrg.jpg https://s3-eu-west-1.amazonaws.com/prod-ucs-content-store-eu-west/content/pii:S0926860X24001479/HIGHRES/image/jpeg/b45f64fab34ea5c9326d7a6f42ff5fad/gr8_lrg.jpg gr8 gr8_lrg.jpg jpg 320106 2437 3326 IMAGE-HIGH-RES 1-s2.0-S0926860X24001479-gr1_lrg.jpg https://s3-eu-west-1.amazonaws.com/prod-ucs-content-store-eu-west/content/pii:S0926860X24001479/HIGHRES/image/jpeg/abeeefcda5e991f3f2ac31673ac1d68d/gr1_lrg.jpg gr1 gr1_lrg.jpg jpg 144056 1313 1663 IMAGE-HIGH-RES 1-s2.0-S0926860X24001479-gr3_lrg.jpg https://s3-eu-west-1.amazonaws.com/prod-ucs-content-store-eu-west/content/pii:S0926860X24001479/HIGHRES/image/jpeg/82ed27067c84a2862dc2ec07e88c9388/gr3_lrg.jpg gr3 gr3_lrg.jpg jpg 118321 1299 1663 IMAGE-HIGH-RES 1-s2.0-S0926860X24001479-gr2_lrg.jpg https://s3-eu-west-1.amazonaws.com/prod-ucs-content-store-eu-west/content/pii:S0926860X24001479/HIGHRES/image/jpeg/07baf81f315c3f9e824937c1c159b27e/gr2_lrg.jpg gr2 gr2_lrg.jpg jpg 580602 3459 2495 IMAGE-HIGH-RES 1-s2.0-S0926860X24001479-gr10_lrg.jpg https://s3-eu-west-1.amazonaws.com/prod-ucs-content-store-eu-west/content/pii:S0926860X24001479/HIGHRES/image/jpeg/cd8c12188ec6b4e2f411201688570056/gr10_lrg.jpg gr10 gr10_lrg.jpg jpg 87778 1326 1663 IMAGE-HIGH-RES 1-s2.0-S0926860X24001479-ga1_lrg.jpg https://s3-eu-west-1.amazonaws.com/prod-ucs-content-store-eu-west/content/pii:S0926860X24001479/HIGHRES/image/jpeg/cb83a0e5d63deccc1450479592fd4c20/ga1_lrg.jpg ga1 true ga1_lrg.jpg jpg 148419 886 1802 IMAGE-HIGH-RES 1-s2.0-S0926860X24001479-gr5_lrg.jpg https://s3-eu-west-1.amazonaws.com/prod-ucs-content-store-eu-west/content/pii:S0926860X24001479/HIGHRES/image/jpeg/10820c4cdc42ab5cbb7a06871140c168/gr5_lrg.jpg gr5 gr5_lrg.jpg jpg 106511 1378 1663 IMAGE-HIGH-RES 1-s2.0-S0926860X24001479-gr4_lrg.jpg https://s3-eu-west-1.amazonaws.com/prod-ucs-content-store-eu-west/content/pii:S0926860X24001479/HIGHRES/image/jpeg/29cff6d4b4e70f9e1f8b0f56b8c8dc37/gr4_lrg.jpg gr4 gr4_lrg.jpg jpg 128015 1329 1663 IMAGE-HIGH-RES 1-s2.0-S0926860X24001479-gr7_lrg.jpg https://s3-eu-west-1.amazonaws.com/prod-ucs-content-store-eu-west/content/pii:S0926860X24001479/HIGHRES/image/jpeg/3e253d619c6d5a1c61dc3392e5ff91f3/gr7_lrg.jpg gr7 gr7_lrg.jpg jpg 108272 1106 1663 IMAGE-HIGH-RES 1-s2.0-S0926860X24001479-gr6_lrg.jpg https://s3-eu-west-1.amazonaws.com/prod-ucs-content-store-eu-west/content/pii:S0926860X24001479/HIGHRES/image/jpeg/2d5275d6d33e5de1241006c696cbb54b/gr6_lrg.jpg gr6 gr6_lrg.jpg jpg 227586 859 2495 IMAGE-HIGH-RES 1-s2.0-S0926860X24001479-mmc1.docx https://s3-eu-west-1.amazonaws.com/prod-ucs-content-store-eu-west/content/pii:S0926860X24001479/mmc1/MAIN/application/vnd.openxmlformats-officedocument.wordprocessingml.document/f5e6e2c36bc384e2c3fe1993d86cc2dd/mmc1.docx mmc1 mmc1.docx docx 944876 APPLICATION 1-s2.0-S0926860X24001479-si0001.svg https://s3-eu-west-1.amazonaws.com/prod-ucs-content-store-eu-west/content/pii:S0926860X24001479/image/svg+xml/36dade52b819aa8afcee21540991e58c/si0001.svg si0001 si0001.svg svg 4181 ALTIMG 1-s2.0-S0926860X24001479-si0002.svg https://s3-eu-west-1.amazonaws.com/prod-ucs-content-store-eu-west/content/pii:S0926860X24001479/image/svg+xml/a2a7b094da254e73dfb4a90f7516671f/si0002.svg si0002 si0002.svg svg 2686 ALTIMG 1-s2.0-S0926860X24001479-si0003.svg https://s3-eu-west-1.amazonaws.com/prod-ucs-content-store-eu-west/content/pii:S0926860X24001479/image/svg+xml/bd22ee810db46955253606ee4a00fece/si0003.svg si0003 si0003.svg svg 2990 ALTIMG 1-s2.0-S0926860X24001479-si0004.svg https://s3-eu-west-1.amazonaws.com/prod-ucs-content-store-eu-west/content/pii:S0926860X24001479/image/svg+xml/88c79ef21799335b950a037efcd89e51/si0004.svg si0004 si0004.svg svg 3116 ALTIMG 1-s2.0-S0926860X24001479-si0005.svg https://s3-eu-west-1.amazonaws.com/prod-ucs-content-store-eu-west/content/pii:S0926860X24001479/image/svg+xml/2454f826cbf186a1881b1350a5f10aa1/si0005.svg si0005 si0005.svg svg 2467 ALTIMG 1-s2.0-S0926860X24001479-si0006.svg https://s3-eu-west-1.amazonaws.com/prod-ucs-content-store-eu-west/content/pii:S0926860X24001479/image/svg+xml/adb2bc5e81818cb7b81475d955f3be7e/si0006.svg si0006 si0006.svg svg 2423 ALTIMG 1-s2.0-S0926860X24001479-si0007.svg https://s3-eu-west-1.amazonaws.com/prod-ucs-content-store-eu-west/content/pii:S0926860X24001479/image/svg+xml/2757d68cf0d3f0b61d4b4905e8d75521/si0007.svg si0007 si0007.svg svg 2281 ALTIMG 1-s2.0-S0926860X24001479-si0008.svg https://s3-eu-west-1.amazonaws.com/prod-ucs-content-store-eu-west/content/pii:S0926860X24001479/image/svg+xml/3e2648dd097b105704cabfe0666912c1/si0008.svg si0008 si0008.svg svg 2179 ALTIMG 1-s2.0-S0926860X24001479-si0009.svg https://s3-eu-west-1.amazonaws.com/prod-ucs-content-store-eu-west/content/pii:S0926860X24001479/image/svg+xml/0ab80736769059c96cfc6c966ad1e537/si0009.svg si0009 si0009.svg svg 2042 ALTIMG 1-s2.0-S0926860X24001479-si0010.svg https://s3-eu-west-1.amazonaws.com/prod-ucs-content-store-eu-west/content/pii:S0926860X24001479/image/svg+xml/e9ca79ccb8cf861f9fb10bb0a6703991/si0010.svg si0010 si0010.svg svg 1989 ALTIMG 1-s2.0-S0926860X24001479-si0011.svg https://s3-eu-west-1.amazonaws.com/prod-ucs-content-store-eu-west/content/pii:S0926860X24001479/image/svg+xml/d63a86c91f37f00f0b190cbd80885cb8/si0011.svg si0011 si0011.svg svg 1916 ALTIMG 1-s2.0-S0926860X24001479-si0012.svg https://s3-eu-west-1.amazonaws.com/prod-ucs-content-store-eu-west/content/pii:S0926860X24001479/image/svg+xml/7e74ea53ac69e38a73dd35a80353263e/si0012.svg si0012 si0012.svg svg 1718 ALTIMG 1-s2.0-S0926860X24001479-si0013.svg https://s3-eu-west-1.amazonaws.com/prod-ucs-content-store-eu-west/content/pii:S0926860X24001479/image/svg+xml/7afad5ec16a55098a44ea5f61542f622/si0013.svg si0013 si0013.svg svg 2483 ALTIMG 1-s2.0-S0926860X24001479-si0014.svg https://s3-eu-west-1.amazonaws.com/prod-ucs-content-store-eu-west/content/pii:S0926860X24001479/image/svg+xml/4b44967d13ab4ffc2898902fdee5ebce/si0014.svg si0014 si0014.svg svg 2990 ALTIMG 1-s2.0-S0926860X24001479-am.pdf am am.pdf pdf 3570304 AAM-PDF https://s3-eu-west-1.amazonaws.com/prod-ucs-content-store-eu-west/content/egi:10QFW8KFH5T/MAIN/application/pdf/4d3d2e10636253f5ba999a8cef1f6057/am.pdf APCATA 119703 119703 S0926-860X(24)00147-9 10.1016/j.apcata.2024.119703 Fig. 1 XRD diffraction patterns of LaNi0.95Cu0.05O3, LaNi0.9Cu0.1O3, LaNi0.8Cu0.2O3, and LaNi0.5Cu0.5O3 catalysts. LaNiO3 = ◆; La2CuO4 = □; CuO = ●. Fig. 1 Fig. 2 SEM micrographs of: (a-b) LaCu0.05Ni0.95O3; (c-d) LaCu0.1Ni0.9O3; (e-f) LaCu0.2Ni0.8O3; and (g-h) LaCu0.5Ni0.5O3. Fig. 2 Fig. 3 H2-TPR profiles of LaNi0.95Cu0.05O3, LaNi0.9Cu0.1O3, LaNi0.8Cu0.2O3, and LaNi0.5Cu0.5O3 catalysts. Fig. 3 Fig. 4 CH4 conversions of the perovskite catalysts at various Cu loading. GHSV = 8400 ml/gcat.h, T = 900 °C. Fig. 4 Fig. 5 CH4 conversions of LaNi0.5Cu0.5O3 catalyst at GHSVs = 2400, 4200, and 6000 ml/gcat.h. Fig. 5 Fig. 6 SEM micrographs of spent LaNi0.5Cu0.5O3 catalyst evaluated at GHSV = 2400 ml/gcat.h, and T = 900 °C. Fig. 6 Fig. 7 (a) TGA, and (b) Derivate TGA profiles of spent LaNi0.5Cu0.5O3 catalyst. Fig. 7 Fig. 8 XPS spectra of (a) La 3d in fresh and spent catalyst, (b) Cu 2p in fresh catalyst, (c) O 1 s in fresh catalyst, and (d) C 1 s in spent catalyst. Fig. 8 Fig. 9 CH4 conversions of LaNi0.5Cu0.5O3 catalysts at various temperatures. GHSV = 2400 ml/gcat.h. Fig. 9 Fig. 10 Experimental and equilibrium conversions of CH4 at various temperatures. Fig. 10 Table 1 Elemental loading of LaNi1-xCuxO3 catalysts. Table 1 Catalyst Theoretical loading (Cu/Ni) Experimental loading (Cu/Ni) LaNi0.95Cu0.05O3 0.05 0.052 LaNi0.9Cu0.1O3 0.1 0.11 LaNi0.8Cu0.2O3 0.2 0.19 LaNi0.5Cu0.5O3 1 0.99 Table 2 Reduction temperature and hydrogen consumption of the perovskite catalysts. Table 2 Perovskite catalyst Peak Reduction temperature (°C) Hydrogen consumption (mmol/g) LaNi0.95Cu0.05O3 α 390 3.13 β 528 4.66 LaNi0.9Cu0.1O3 α 371 3.14 β 524 4.39 La Ni0.8Cu0.2O3 α 336 2.91 β 522 4.03 LaNi0.5Cu0.5O3 α 364 5.44 β 537 1.39 Table 3 XPS surface composition and oxygen ratio of fresh and spent LaNi0.5Cu0.5O3 catalyst. Table 3 LaNi0.5Cu0.5O3 catalyst At (%) Surface oxygen percentage (at%) a La Ni Cu O C Oads/Oall Fresh 11.2 nd b 4.8 46.7 37.3 61.1 Spent 1.3 nd nd 6.4 92 100 a Oall = Omoisture + Oads + Olatt b nd = not detected Table 4 Comparison of CH4 conversions of LaNiO3-type catalysts with the LaNi0.5Cu0.5O3 catalyst reported in this work. Table 4 Catalyst Temperature (°C) GHSV Maximum CH4 conversion (%) Reference LaNi0.5Cu0.5O3 700 2 400 ml/g.h 74 This work 800 89 900 92 LaNiO3 600 8.2 L/g.h 65 [22] 700 7.5 L/g.h 80 LaNiO3 600 12 000 h−1 42 [31] 650 60 700 65 750 80 800 92 LaNiO3-sg a 450 200 h−1 15 [38] 650 100 h−1 30 LaNi0.95Rh0.05O3-cp b 450 200 h−1 28 650 100 h−1 50 a sg = Sol-gel preparation method b cp = Co-precipitation preparation method Thermocatalytic decomposition of methane to low-carbon hydrogen using LaNi1-xCuxO3 perovskite catalysts Zama G. Duma Writing – review & editing Writing – original draft Investigation Formal analysis Data curation a ⁎ Ashton Swartbooi Writing – review & editing Investigation Formal analysis Data curation Conceptualization a Nicholas M. Musyoka Supervision Project administration Funding acquisition b ⁎ a HySA Infrastructure Centre of Competence, Centre for Nanostructures and Advanced Materials (CeNAM), Council for Scientific and Industrial Research (CSIR), Pretoria 0001, South Africa HySA Infrastructure Centre of Competence, Centre for Nanostructures and Advanced Materials (CeNAM), Council for Scientific and Industrial Research (CSIR) Pretoria 0001 South Africa HySA Infrastructure Centre of Competence, Centre for Nanostructures and Advanced Materials (CeNAM), Council for Scientific and Industrial Research (CSIR), Pretoria 0001, South Africa b Nottingham Ningbo China Beacons of Excellence Research and Innovation Institute, University of Nottingham Ningbo China, Ningbo, Zhejiang 315100, China Nottingham Ningbo China Beacons of Excellence Research and Innovation Institute, University of Nottingham Ningbo China Ningbo Zhejiang 315100 China Nottingham Ningbo China Beacons of Excellence Research and Innovation Institute, University of Nottingham Ningbo China, Ningbo 315100, Zhejiang, China ⁎ Corresponding authors. The thermocatalytic decomposition (TCD) of methane is an attractive alternative to produce low-carbon hydrogen and solid carbonaceous materials. In this study, substituted LaNi1-xCuxO3 perovskite catalysts prepared via self-combustion method were investigated for methane TCD. The effect of Ni partial substitution with Cu, varying gas hourly space velocity, temperature and stability on methane conversions were evaluated. PXRD, H2-TPR, SEM-EDS, TGA, and XPS were used to characterize the catalysts. An increase in Cu loading to 50%, increase in temperature and decrease in GHSV resulted in an improvement in methane conversions to 92%. At a GHSV of 2400 ml/gcat.h, no significant deactivation was observed as the stability of the LaNi0.5Cu0.5O3 catalyst increased from 6 to 20 hours’ TOS with methane conversions maintained at 92% where carbon nanofibers were observed on the surface of the spent catalysts. The study demonstrates the potential to prepare LaNi1-xCuxO3 catalysts and identify optimal testing conditions for the novel production of low-carbon hydrogen with minimal catalyst deactivation. Graphical Abstract Keywords Methane TCD Low-carbon hydrogen Perovskite Gas Hourly Space Velocity LaNiCuO3 Data Availability Data will be made available on request. 1 Introduction The production of hydrogen from natural gas, which consists mostly of methane (CH4), is often associated with the simultaneous formation of carbon monoxide (CO) and carbon dioxide (CO2). Whilst the former may be readily used in conversion processes to produce methanol, dimethyl ether, olefins, synthetic fuels, and other value-added compounds, CO2 is a potent greenhouse gas that has been reported to contribute to climate change due to global warming. The current state-of-the-art route to produce hydrogen is the multistep steam methane reforming (SMR) process [1–3]. Conventionally, the process involves the use of steam to convert methane to synthesis gas, a mixture of hydrogen and carbon monoxide, at temperatures of 800–900 °C [4]. Thereafter, low-temperature and high-temperature water-gas shift catalytic reactions are carried out to convert carbon monoxide to carbon dioxide and hydrogen. The products are then separated using pressure-swing adsorption (PSA) and/or cryogenic distillation, among other methods [5]. Other processes employed to produce hydrogen include: autothermal reforming (ATR), where steam and oxygen are reacted with methane to form syngas; and partial oxidation (POx), where syngas is produced from methane and hydrogen [5]. However, all the processes listed have the drawback of producing hydrogen that is not COx-free. Furthermore, such mature processes are associated with high economic and operational costs. As such, the hydrogen produced cannot be used directly in Proton Exchange Membrane hydrogen fuel cells (PEM) because the COx contaminants poison the Pt electrode [6,7]. Also, due to side reactions, the nickel-based catalysts conventionally used in these processes suffer from deactivation due to coke formation which covers the active catalytic sites. On the contrary, the thermocatalytic decomposition (TCD) of methane is a viable alternative and sustainable route to produce low-carbon or turquoise hydrogen. The latter refers to hydrogen produced directly from methane TCD [8]. Due to the anaerobic nature of the processes, TCD of methane has been reported to produce COx-free H2 [9]. In addition, the process is associated with the simultaneous production of solid carbons such as nanocarbons as well as graphitic and amorphous carbons [8]. Albeit, carbon deposition often deactivates the catalyst, in TCD of methane, it can be fine-tuned to produce high-value carbons, thereby increasing the economic viability of the process [10]. While many catalysts have been investigated for the use in the TCD process, the optimal catalyst should ideally be able to operate for suitably long periods on stream under the formation of solids carbons [11–15]. In literature, it has been discussed that mixed-metal catalysts have synergistic advantages where one metal acts as the hydrogen production site, while the other eases carbon diffusion to minimize deactivation [16]. An alternative method is to develop catalysts that have oxygen vacancies on the surface, which allow for the carbon species to be oxidized as they are formed on the catalyst surface, through the movement of oxygen in the crystal lattice. Perovskite catalysts, usually of the form ABO3, allow partial substitutions of the A and B sites, which can result in the formation of oxygen vacancies. This class of catalysts has a tunable, diverse structure as the A, B or O sites in the structure may be occupied by over 90% of the elements in the periodic table [17]. Perovskite catalysts have also been extensively investigated for the dry reforming of methane reactions but very few in literature have investigated perovskites for the methane TCD process [5,18–21]. Therefore, the focus of this article is the development of substituted perovskite catalysts of the form LaNi1-xCuxO3 with improved catalytic performance for the formation of COx-free, low-carbon or “turquoise” hydrogen. 2 Methods and materials 2.1 Catalyst synthesis The perovskite catalyst in the form LaNi1-xCuxO3, where x denotes the percentage loading of Cu, was prepared by the self-combustion method as described by Gallego et al. [22]. In short, glycine (>98.5% purity, NH2CH2COOH, Associated Chemical Enterprises, Johannesburg, South Africa), used as ignition promoter, was added to an aqueous solution of the metal nitrates with the appropriate stoichiometry. The following nitrate salts were used: Cupric nitrate trihydrate (99.9% purity, Cu(NO3)2.3 H2O, Associated Chemical Enterprises, Johannesburg, South Africa), lanthanum nitrate hexahydrate (98% purity, La(NO3)3.6 H2O, Associated Chemical Enterprises, Johannesburg, South Africa), and nickel nitrate hexahydrate (98% purity, Ni(NO3)2.6 H2O, Laboratory BDH Reagents). Demineralized water was obtained from a water demineralization system (Thermo Fischer Barnstead Smart2Pure). The glycine amount was added to get a ratio of NO3/NH2 = 1. The resulting solution was slowly evaporated until a thick gel was obtained. Thereafter, the gel was heated, and subsequently ignited in a muffle furnace at 250 °C. The catalysts were then calcined at 700 °C for 8 h at a ramp rate of = 10 °C/min, which led to the formation of the perovskite structure. The catalysts were labelled according to the ratio of Ni to Cu i.e. LaNi0.5Cu0.5O3 denotes 50 wt% loading of both Ni and Cu whereas LaNi0.9Cu0.1O3 has 90 wt% loading of Ni and 10 wt% of Cu, respectively. 2.2 Characterization Powder X-Ray Diffraction (PXRD) was used to determine the crystallinity of the catalysts using a Panalytical X’pert PRO PW 3040/60 diffractometer with a Cu Kα anode (λ = 0.1542 nm) operated at a generator voltage of 40 kV and tube current of 30 mA. The diffraction pattern was obtained at 3–90 ° at steps of 0.026 °/s. Scanning Electron Microscopy (SEM) was used for morphological analyses of the catalysts using an Auriga Cobra focused-ion beam Zeiss Ultra operated at an accelerating voltage of 2 kV. The samples were coated with carbon to prevent charging prior to analysis. For SEM-EDS, the accelerating voltage was increased to 15 kV. Hydrogen Temperature Programmed Reduction (H2-TPR) was performed using a Micromeritics AutoChem II 2920 analyzer (Micromeritics Instrument Corporation, Norcross, GA, USA). Each catalyst, 50 mg, was placed between two-pieces of quartz wool in a U-shaped quartz tube. Thereafter, the catalysts were degassed at 150 °C at 10 °C/min with a hold time of 15 minutes under a constant flow of argon at 50 ml/min. After degassing, the temperature was decreased to 50 °C and then a 10% H2/Ar mixture at 50 ml/min was introduced. The temperature was then increased to 900 °C at 10 °C/min and H2 consumption monitored using a calibrated thermal conductivity detector (TCD). The thermal stability of the fresh and spent catalysts was analysed using a Mettler-Toledo TGA/SDTA 851e analytical instrument where up to 10 mg of sample was loaded onto a platinum pan. Thereafter, the catalysts were heated at 10 °C/min from ambient temperature to 1000 °C in air at 90 ml/min and a nitrogen balance of 10 ml/min. X-Ray Photoelectron Spectroscopy (XPS) analysis was performed using a Thermo model ESCAlab 250 Xi instrument with a monochromatic Al Kα (1486.7 eV), 300 W X-ray power at < 10−8 mBar pressure. 2.3 Catalysts testing The catalysts were evaluated in a horizontal packed fixed-bed reactor, externally heated in a tube furnace. The reactor was made of stainless steel, with OD = 14 mm, ID = 12 mm and length 15 mm. Each catalyst was weighed out to 0.5 g and dispersed onto quartz wool, which acted as a stopper as well as gas dispersant. Argon was used as an inert gas to flush the system whilst the reactor attained the required temperature. The reactor was heated at 10 °C/min up to the required reaction temperature. Prior to activity tests, the catalysts were reduced under a pure stream of hydrogen for 1.5 hours at 700 °C. After reduction, the system was flushed with Argon until the set reaction temperature was reached. After the operating temperature was reached, the gas was switched over to a stream of 95% methane at the required gas flow for the experiments. Argon was used a diluent at 5% as well as acting as an internal reference standard. The outgoing gas concentrations were measured with an online GC, model SCION 456 equipped with a flame ionization detector (FID) and thermal conductivity detector (TCD) using nitrogen as a carrier gas. Methane conversion was calculated based on the results from the GC according to the following equation: (1) CH 4 conversion % = [ CH 4 ] in − [ CH 4 ] out [ CH 4 ] in * 100 Where [CH4]in and [CH4]out denote the inlet and outlet molar concentrations of CH4. 3 Results and discussion 3.1 Powder X-Ray diffraction The XRD diffractograms of the calcined LaNi1-xCuxO3 catalysts are shown in Fig. 1. The catalysts show diffraction peaks at 2θ = 23.4°, 33°, 40.7°, 47.6°, 53.3°, 58.9°, 68.9°, and 78.9° which are indicative of the LaNiO3-like perovskite structure [23,24]. The diffraction pattern confirm the formation of rhombohedral LaNiO3 structure [25]. The partial substitution of Ni with Cu in the perovskites becomes apparent when the Cu loading is increased to 50% (x = 0.5), in the LaNi0.5Cu0.5O3 catalyst, where the additional peaks at 2θ = 27° and 44.6° indicate the presence of La2CuO4 crystalline phases [24]. Furthermore, the peaks at 2θ = 35.8° and 38.9° suggest the presence of CuO phases which indicate that the increase in Cu loading results in the formation of CuO nanoparticles in the perovskite structure [26]. As such, albeit all the calcined catalysts exhibit the LaNiO3 perovskite-type phase, additional La2CuO4 and CuO phases are formed upon calcination when the Cu loading is increased to 50%, respectively. 3.2 Elemental composition The theoretical and experimental composition of the catalysts, determined using SEM-EDS, are shown in Table 1. For all the LaNi1-xCuxO3 samples the theoretical and nominal composition were in close agreement. For instance, the LaNi0.9Cu0.1O3 had a loading of 10 wt% Cu and 90 wt% Ni whereas the SEM-EDS analysis showed that there was a nominal loading of 9.5 wt% Cu and 90.5 wt% Ni, respectively. Similarly, the LaNi0.5Cu0.5O3 catalyst had a theoretical loading of 50 wt% Cu and 50 wt% Ni whereas the nominal loading was found to be 49.8 wt% Cu and 50.2 Ni wt%. The SEM-EDS spectra of all the catalysts are shown in Figs. S1-S4. 3.3 Electron microscopy The morphology of the catalysts is shown in the micrographs in Fig. 2 below. All the catalyst samples have similar consistent irregular shapes with interconnected channels. Furthermore, an increase in the Cu loading from 10% in LaCu0.1Ni0.9O3 to 20% in LaCu0.2Ni0.8O3 and 50% in LaCu0.5Ni0.5O3 results in the formation of spherical nanoparticles that are dispersed over the bulk phase framework of the perovskite catalysts, Fig. 2e-h. The morphology of the perovskite catalysts shown is consistent with agglomerates that have been reported previously [23,27]. 3.4 Hydrogen Temperature Programmed Reduction (H2-TPR) In the reduction of LaNiO3 typical perovskites, Ni cations are reduced to metallic Ni whereas La2O3 is formed after H2 reduction thereby essentially rendering Ni/La2O3 catalysts, as shown in Eq. 2-4 [5,28,29]. This is primarily because cations that occupy the A-sites in perovskite catalysts are less susceptible to reduction when compared to cations that occupy the B-sites. Furthermore, metallic Ni has been reported to be the active site for the decomposition of CH4 [23]. The reduction of Ni in perovskite catalysts has been proposed to occur via the following reactions [30]: (2) 2 LaNiO 3 + H 2 → La 2 Ni 2 O 5 + H 2 O (3) La 2 Ni 2 O 5 + 2 H 2 → La 2 O 3 + 2 Ni + 2 H 2 O (4) 2 LaNiO 3 + 3 H 2 → 2 Ni + La 2 O 3 + 3 H 2 O As such Ni3+ is reduced step wisely to Ni0 i.e., Ni3+ to Ni2+ then to Ni0 whereas La2O3 is formed as it occupies the A-site in the ABO3 perovskite structure and is thus difficult to reduce at the set experimental conditions [29]. Therefore, due to the stable valence of the La A-site, two reduction peaks are anticipated due to the redox changes from Ni3+ to Ni0 as corroborated by the TPR profiles in Fig. 3. The alpha (α) peaks between 336 °C and 390 °C in the LaNiCuO3 catalysts are attributed to the reduction of Ni3+ to Ni2+ to form the La2Ni2O5 phase shown in Eq. 2 whereas the beta (β) peaks between 522 °C and 537 °C correspond to the reduction of Ni2+ to the Ni0 metallic phase which is active for CH4 thermocatalytic decomposition [23,31]. The reduction of the catalysts results in Ni0 particles dispersed on a La2O3 support as shown in Eq. 3. In the LaNiCuO3 perovskite catalysts, the reduction of Cu does not follow the same redox properties in pristine CuO due to its stabilization in the perovskites structure [21]. As such, the reduction of Cu2+ to Cu0 overlaps with the reduction of Ni cations. Furthermore, the reduction of Cu0 occurs at lower temperatures thereby facilitating hydrogen spillover which enhances the reduction of Ni3+ to Ni2+ [24]. As such, the alpha peaks have been reported to be an overlap of Ni3+ to Ni2+ and Cu2+ to Cu+1 whereas the beta peaks represent an overlap of Ni2+ to Ni0 and Cu1+ to Cu0, respectively [32]. In all the catalysts, except LaCu0.5Ni0.5O3, an increase in the copper loading results in a shift to a lower reduction temperature of the α peaks from 390 °C to 336 °C probably due to the ease of reduction of Ni3+ species after the formation of Cu0. A similar trend can be observed in the β peaks where the reduction temperature decreases gradually from 528 °C to 522 °C with an increase in copper loading. In the case of LaCu0.5Ni0.5O3, which has the highest copper loading, a similar trend in the ease of reduction shown by lower reduction temperatures of the α and β peaks can be observed in Fig. 3 and Table 2. However, due to the highest copper loading relative to the other catalysts, the hydrogen consumption was highest in the α peak which alludes to the reduction of Cu which then facilitates hydrogen spillover to the Ni cationic phases as shown by the consumption of 5.44 mmol/g in the α peak compared to 1.39 mmol/g in the β peak [33]. In the other perovskite catalysts, the hydrogen consumption in the α peaks (2.91–3.14 mmol/g) was lower than in the β peaks (4.03–4.66 mmol/g), respectively. 3.5 Catalytic performances 3.5.1 Effect of partial substitution of Ni with Cu Previous studies such as the one conducted by Maneerung et al. varied the nickel content in perovskite catalyst with substitution by Co and Fe [21]. The study indicated, under pre-determined evaluation conditions, that the LaNi0.8Co0.2O3 catalysts exhibited good performance. Albeit nickel and cobalt are very good active sites for thermocatalytic cracking reactions, the cost of Co is usually exorbitant. Conversely, Cu has also been shown to be a good catalyst when trying to minimize the formation of coke in the reforming process. As shown in the H2-TPR data, Cu promoted Ni reduction and enhanced hydrogen spillover resulting in higher CH4 conversions. As shown in Fig. 4, there is a direct correlation between the Cu loading and CH4 conversions i.e., an increase in the Cu loading in the perovskite catalyst results in an increase in CH4 conversions. As such the catalysts with 5% and 10% Cu loading, LaCu0.05Ni0.95O3 and LaCu0.1Ni0.9O3, exhibited the lowest CH4 conversions which stabilized at 5% whereas the LaCu0.8Ni0.2O3 and LaCu0.5Ni0.5O3 had the highest comparative conversions at 10–20%, respectively. Furthermore, the catalysts had high initial CH4 conversions which dropped sharply within 25 minutes which indicates rapid deactivation of the perovskite catalysts which may be due to a high GHSV (8400 ml/gcat.h), low residence time of CH4 or coke deposition [31]. For catalytic evaluation, a relatively high GHSV was employed to observe the effect, in accordance with literature, on the stability of the perovskite catalysts. Furthermore, apart from produced hydrogen and unconverted CH4, no by-products were detected in the effluent streams. As such, the single carbon atom in the CH4 molecule results in the formation of solid carbon as the only by-product [34]. In addition, the rapid deactivation of the catalysts may be due to the encapsulation of Ni0 active sites by solid carbon formed during CH4 decomposition which may be circumvented by use of fluidized-bed reactors where there is a continuous replacement of spent catalysts [35,36]. Furthermore, a study by Suelvels et al. found that deactivation by thermal sintering in fixed bed reactors was less than that caused by the formation of highly-ordered carbons [37]. 3.5.2 Effect of GHSV Due to the relatively better catalytic performance by the LaCu0.5Ni0.5O3 catalyst observed in Fig. 4 at 8400 ml/gcat.h and 900 °C, the effect of GHSV on CH4 conversion was investigated using this catalyst. Three different GHSV’s were evaluated whereas the effect on CH4 conversion is shown in Fig. 5. As previously highlighted, the sharp decrease in initial CH4 conversions may be attributed to the formation of coke on the catalyst surface [38]. At high GHSVs, the diffusion of CH4 in the catalyst pores is superseded by the formation of carbon on the surface, resulting in the formation of solid carbon allotropes on the active sites [39]. At the lowest GHSV tested, close to 92% CH4 conversion was achieved for the full operation of up to 20 hours on stream. The stability of the catalyst is evident, as very little deactivation, with respect to CH4 conversion, occurred over the evaluation period. The stability of the catalyst is also attributed to the very stable La2O3 support, which assists with carbon formations and diffusion. The diffusion of carbon species onto the surface is a very important step when trying to produce valued-added carbons. Liu et al. have shown that a Ni-based catalyst contributes to very high hydrogen yields, but a different transition metal is required, such as Fe, to produce nanotubes [40]. This is due to the diffusion of carbon onto the Fe, which is faster than on Ni, respectively. However, SEM analysis of the spent LaCu0.5Ni0.5O3 catalyst evaluated at 2400 ml/gcat.h showed the formation of carbon fibres and filaments, Fig. 6. The simultaneous formation of solid carbons and sustained high CH4 conversion may be due to a tip growth mechanism where the reduced Ni0 active sites remain exposed and available for continuous CH4 decomposition [31,41]. The thermal stability of the spent LaNi0.5Cu0.5O3 perovskite catalyst was also tested as shown by the thermogram in Fig. 7. The TGA and derivative TGA profile exhibit three distinct weight loss steps. The 1.8% weight loss peak at 316 °C is due to the combustion of amorphous or less crystalline graphitic carbon whereas the minimal weight loss (0.2%) below 200 °C is due to physisorbed water or moisture [22]. The sharp weight change of 64.7% observed at 586 °C and 695 °C is attributed to the combustion of crystalline or highly ordered graphitic carbon. The TGA results further corroborate the SEM micrographs wherein filamentous carbon can be observed. Post 700 °C, complete oxidation of the solid carbon has occurred resulting in the perovskite-type catalyst which is stable up 1000 °C [42,43]. The TGA profiles of the pristine fresh catalysts in air are shown in Figure S5 where no more than 6% weight loss was observed which indicates that the perovskite catalysts have high thermal stability. The thermocatalytic decomposition of CH4 to hydrogen and solid carbons observed in Fig. 6 has been proposed to occur via a multistep process which can be broken down to elementary steps where there is dissociative adsorption of CH4 on the active sites of the catalyst. For instance, Chen et al. proposed the following mechanism: Methane dissociation: (5) CH 4 + 2 S ↔ CH 3 − S + H − S (6) CH 3 − S + S ↔ CH 2 − S + H − S (7) CH 2 − S + S ↔ CH − S + H − S (8) CH − S + S ↔ C − S + H − S (9) 2 H − S ↔ H 2 + 2 S Dissolution/Segregation: (10) C − S ↔ C Ni . f + S Diffusion of carbon through nickel: (11) C Ni . f ↔ C Ni , r . Precipitation/dissolution of carbon: (12) C Ni . r ↔ C f . Encapsulating carbon formation: (13) nC − S ↔ C encapsulating Where S refers to an adsorption site on the catalyst, CNi,f denotes carbon dissolved in the front part of a nickel particle, CNi,r refers to carbon dissolved in the portion of the nickel particle that is in contact with the support, and Cencapsulating represents the carbon that encapsulates the Ni particles thereby deactivating the catalyst [44]. Due to the little deactivation of the LaNi0.5Cu0.5O3 after 20 h online, Fig. 5., it may assumed that the carbonaceous deposits are of nanofiber morphology [38]. XPS analysis of the fresh and spent LaNi0.5Cu0.5O3 catalyst was used to discern the surface composition of the constituents. Fig. 8a shows the XPS spectrum of La 3d where the peaks at 838.6, 837.7, 835.1, and 833.1 eV binding energy (BE) are attributed to the La 3d5/2 orbitals [29,30,45]. The peaks are attributed to the La3+ state in A site of the perovskite. In the spent catalysts, a doublet peak can be observed at 836.7 and 840.2 eV which have been assigned to La 3d5/2 photoelectrons of the La2(C2O4)3 species. The shift in the photoelectrons may be due to the change in the coordination environment of La3+ as a result of the formed carbon filaments formed by the methane TCD reaction [29]. Due to the overlapping peaks of La 3d3/2 and Ni 2p3/2 peaks between 870 and 845 eV as well as the insertion if Ni2+ and Ni3+ into the perovskite structure, the photoelectron peaks of Ni species were not detected on the surface of the fresh and spent catalysts. It has, however, been reported in literature that the peaks between 855 and 853 eV belong to Ni2+ and Ni3+ species which in this instance overlaps with La 3d3/2 photoelectron peaks [45]. Furthermore, it can be seen from the spectrum in Fig. 8b that Cu 2p exhibits a photoelectron peak at 933.6 eV attributed to Cu 2p3/2. The satellite peak between 946 and 940 eV as well as the peak at 954 eV suggest that Cu2+ is the dominant species in the catalysts which is consistent with the H2-TPR results observed in Fig. 3 [46]. Interestingly, no Cu photoelectron peaks were observed in the spent LaNi0.5Cu0.5O3 catalyst which may allude to surface coverage by the carbon fibres observed in Fig. 6 [47]. Indeed, as shown in Table 3, 92% of the surface on the spent catalyst consists of atomic carbon compared to 37.3% in the fresh catalyst. The O 1 s spectrum of the fresh LaNi0.5Cu0.5O3 is shown in Fig. 8c. The spectrum was deconvoluted to four main peaks with distinct BEs: 533.3 eV which is due to the photoelectrons from O atoms in physisorbed moisture on the surface (Omoisture); 531.4 eV due to chemisorbed surface carbonate species in the basic A sites of the perovskite (Oads); 529.1 and 528.3 eV which are assigned to metal oxides where oxygen atoms in the lattice of the structure are bonded to the cations (Olatt) [30,45,48]. The Oads species, chemisorbed surface oxygen, are generally attributed to oxygen vacancies which are more reactive than Olatt species [49]. Therefore, the surface concentration ratio of the more reactive Oads was calculated as a proportion of the atomic concentration over the total oxygen concentration i.e. Oads/Oall. The latter was found to be 61.1% in comparison to a cumulative 33% (Olatt) and 5.9% physisorbed oxygen, Table 3. In the XPS spectrum of the spent catalyst, 100% of the O1s peaks belonged to the Oads species, at 532 eV, albeit the overall atomic concentration decreased to 6.4% from 46.7% in the fresh catalyst. Indeed, the Olatt species bonded to the cations were not detected on the surface which is consistent with the decrease in La3+ surface concentration from 21% to 1.4% whereas no Cu2+ was detected in the spent catalysts. The formation of the carbon nanofilaments observed in Figs. 6–7 are further corroborated by the C 1 s XPS spectrum in the spent catalyst where a well-defined peak at 284 eV indicative of sp2 hybridized graphitic-type carbon was observed, Fig. 8d [47]. This observation is consistent with the high surface composition of carbon as shown in Table 3. 3.5.3 Effect of temperature The decomposition of CH4 to H2 and solid nanocarbons is an endothermic reaction as can be seen from Eq. 5 [50]. As such, an increase in temperature is expected to result in an increase in CH4 conversions. As shown in Fig. 9, a decrease in reaction temperature had the expected result of a decline in CH4 conversion. The stability of the catalyst under these conditions is evident, with very little loss in activity. For the tests run at 700 °C, the conversion decreased from a peak of 74–69%, while in the test at 800 °C dropped from 89% to 82%. Interestingly, for the reaction at 900 °C, there was no decrease in the conversions, as it maintained the same conversion over the entire evaluation period. The effect of temperature on CH4 decomposition has also been investigated by Suelvels et al. where an increase in reaction temperature from 550 ºC to 700 ºC resulted in an increase in CH4 conversions from 10.2% to 31.2%. However, at higher temperatures, the rate of carbon deposition increases which deactivates the catalysts [37]. Furthermore, a similar effect of temperature on CH4 conversion has been previously observed i.e. using an LaNiO3 catalyst where Maneerung et al. reported that an increase in temperature increased CH4 conversions [31]. The study reported CH4 conversions of 42% at 600 ºC, 60% at 650 ºC, 65% at 700 ºC, 80% at 750 ºC, and 92 ºC at 800 ºC. In addition, Gallego et al. also reported CH4 conversion of 60% at 600 ºC which increased to 80% at 700 ºC using a LaNiO3 catalyst prepared using a self-combustion method, Table 4 [22]. Furthermore, Rivas et al. also noted an increase in CH4 conversion with temperature in LaNi0.95Rh0.05O3 catalysts from 28% at 450 ºC and 200 h−1 to 50% at 650 ºC and 100 h−1. A similar effect of temperature was observed for a co-precipitated LaNiO3 catalyst where CH4 conversion of 15% at 450 ºC increased to 30% at 650 ºC [38]. (14) CH 4 ↔ 2 H 2 + C s ∆ H = + 74.9 kJ / mol The thermodynamic limit for the decomposition of CH4 to H2 was modelled using HSC Chemistry software, 1 mol of CH4 was used as a feed, and stepwise increments for temperature up to 1000 ºC, Fig. 10. The data was compared with average conversion at each temperature from the experimental results, Fig. 9. The experimental conversions of catalysts tested was very close to the thermodynamic limit for the set temperature, at a given GHSV. 4 Conclusion In this work, the thermocatalytic decomposition of CH4 to produce COx-free H2 was studied by investigating the effect of partial substitution of Cu into a LaNiO3 perovskite catalyst which was tested under various Cu loadings, GHSV’s and temperatures. It was found that increasing Cu loading to 50% in LaNi0.5Cu0.5O3 catalysts and decreasing GHSV enhances CH4 conversion and stability with minimal deactivation. An increase in the testing temperature also increases CH4 conversions. Noteworthy, when compared to Cu loading and temperature, GHSV was found to have the most pronounced improvement in CH4 conversions. The conversion enhancement reached 92% which was sustained for over more than 20 hours of the catalyst on stream, even under a pure flow of CH4. Furthermore, XPS revealed high oxygen vacancies in the catalyst which may explain the comparatively large increase in CH4 conversions and stability which resulted in carbon nanofibers observed using SEM, XPS, and TGA. The results indicate that from a pure stream of CH4, sustainable, COx-free, low-carbon or “turquoise” hydrogen can be produced without significant deactivation of the perovskite catalyst. CRediT authorship contribution statement Zama Duma: Writing – review & editing, Writing – original draft, Investigation, Formal analysis, Data curation. Ashton Swartbooi: Writing – review & editing, Investigation, Formal analysis, Data curation, Conceptualization. Nicholas Musyoka: Supervision, Project administration, Funding acquisition. Declaration of Competing Interest The authors declare that they have no known competing financial interests or personal relationships that could have appeared to influence the work reported in this paper Acknowledgements The authors would like to thank the Council for Scientific and Industrial Research, and the Department of Science and Innovation’s Hydrogen South Africa (DSI-HySA) Infrastructure for the funding of the biogas-to-hydrogen project (Grant number: C6G0097). The authors would like to extend gratitude to the Energy and Fuels for a Sustainable Environment Team, Institut de Chimie et Procédés pour l’Energie, l’Environnement et la Santé, Université de Strasbourg for the access to advanced H2-TPR analyses. Appendix A Supporting information Supplementary data associated with this article can be found in the online version at doi:10.1016/j.apcata.2024.119703. Appendix A Supplementary material Supplementary material References [1] S. Poto F. Gallucci M. Fernanda Neira d′Angelo Direct conversion of CO2 to dimethyl ether in a fixed bed membrane reactor: Influence of membrane properties and process conditions Fuel 302 2021 121080 S. Poto, F. Gallucci, M. Fernanda Neira d′Angelo, Direct conversion of CO2 to dimethyl ether in a fixed bed membrane reactor: Influence of membrane properties and process conditions, Fuel, 302 (2021) 121080. [2] F. Pontzen W. Liebner V. Gronemann M. Rothaemel B. Ahlers CO2-based methanol and DME – Efficient technologies for industrial scale production Catal. Today 171 2011 242 250 F. Pontzen, W. Liebner, V. Gronemann, M. Rothaemel, B. Ahlers, CO2-based methanol and DME – Efficient technologies for industrial scale production, Catalysis Today, 171 (2011) 242-250. [3] M. De Falco M. Capocelli G. Centi Dimethyl ether production from CO2 rich feedstocks in a one-step process: Thermodynamic evaluation and reactor simulation Chem. Eng. J. 294 2016 400 409 M. De Falco, M. Capocelli, G. Centi, Dimethyl ether production from CO2 rich feedstocks in a one-step process: Thermodynamic evaluation and reactor simulation, Chemical Engineering Journal, 294 (2016) 400-409. [4] T.I. Korányi M. Németh A. Beck A. Horváth Recent advances in methane pyrolysis: turquoise hydrogen with solid carbon production Energies 15 2022 6342 T.I. Korányi, M. Németh, A. Beck, A. Horváth, Recent Advances in Methane Pyrolysis: Turquoise Hydrogen with Solid Carbon Production, Energies, 15 (2022) 6342. [5] Z. Bian Z. Wang B. Jiang P. Hongmanorom W. Zhong S. Kawi A review on perovskite catalysts for reforming of methane to hydrogen production Renew. Sustain. Energy Rev. 134 2020 110291 Z. Bian, Z. Wang, B. Jiang, P. Hongmanorom, W. Zhong, S. Kawi, A review on perovskite catalysts for reforming of methane to hydrogen production, Renewable and Sustainable Energy Reviews, 134 (2020) 110291. [6] S.K. Saraswat K.K. Pant Ni–Cu–Zn/MCM-22 catalysts for simultaneous production of hydrogen and multiwall carbon nanotubes via thermo-catalytic decomposition of methane Int. J. Hydrog. Energy 36 2011 13352 13360 S.K. Saraswat, K.K. Pant, Ni–Cu–Zn/MCM-22 catalysts for simultaneous production of hydrogen and multiwall carbon nanotubes via thermo-catalytic decomposition of methane, International Journal of Hydrogen Energy, 36 (2011) 13352-13360. [7] A. Venugopal S. Naveen Kumar J. Ashok D. Hari Prasad V. Durga Kumari K.B.S. Prasad M. Subrahmanyam Hydrogen production by catalytic decomposition of methane over Ni/SiO2 Int. J. Hydrog. Energy 32 2007 1782 1788 A. Venugopal, S. Naveen Kumar, J. Ashok, D. Hari Prasad, V. Durga Kumari, K.B.S. Prasad, M. Subrahmanyam, Hydrogen production by catalytic decomposition of methane over Ni/SiO2, International Journal of Hydrogen Energy, 32 (2007) 1782-1788. [8] J.C. Guevara J.A. Wang L.F. Chen M.A. Valenzuela P. Salas A. García-Ruiz J.A. Toledo M.A. Cortes-Jácome C. Angeles-Chavez O. Novaro Ni/Ce-MCM-41 mesostructured catalysts for simultaneous production of hydrogen and nanocarbon via methane decomposition Int. J. Hydrog. Energy 35 2010 3509 3521 J.C. Guevara, J.A. Wang, L.F. Chen, M.A. Valenzuela, P. Salas, A. García-Ruiz, J.A. Toledo, M.A. Cortes-Jácome, C. Angeles-Chavez, O. Novaro, Ni/Ce-MCM-41 mesostructured catalysts for simultaneous production of hydrogen and nanocarbon via methane decomposition, International Journal of Hydrogen Energy, 35 (2010) 3509-3521. [9] J. Ashok G. Raju P.S. Reddy M. Subrahmanyam A. Venugopal Catalytic decomposition of CH4 over NiO–Al2O3–SiO2 catalysts: Influence of catalyst preparation conditions on the production of H2 Int. J. Hydrog. Energy 33 2008 4809 4818 J. Ashok, G. Raju, P.S. Reddy, M. Subrahmanyam, A. Venugopal, Catalytic decomposition of CH4 over NiO–Al2O3–SiO2 catalysts: Influence of catalyst preparation conditions on the production of H2, International Journal of Hydrogen Energy, 33 (2008) 4809-4818. [10] H.Y. Wang E. Ruckenstein Formation of filamentous carbon during methane decomposition over Co–MgO catalysts Carbon 40 2002 1911 1917 H.Y. Wang, E. Ruckenstein, Formation of filamentous carbon during methane decomposition over Co–MgO catalysts, Carbon, 40 (2002) 1911-1917. [11] R. Aiello J.E. Fiscus H.-C. zur Loye M.D. Amiridis Hydrogen production via the direct cracking of methane over Ni/SiO2: catalyst deactivation and regeneration Appl. Catal. A: Gen. 192 2000 227 234 R. Aiello, J.E. Fiscus, H.-C. zur Loye, M.D. Amiridis, Hydrogen production via the direct cracking of methane over Ni/SiO2: catalyst deactivation and regeneration, Applied Catalysis A: General, 192 (2000) 227-234. [12] M. Msheik S. Rodat S. Abanades Methane cracking for hydrogen production: a review of catalytic and molten media pyrolysis Energies 14 2021 3107 M. Msheik, S. Rodat, S. Abanades, Methane Cracking for Hydrogen Production: A Review of Catalytic and Molten Media Pyrolysis, Energies, 14 (2021) 3107. [13] A. Amin W. Epling E. Croiset Reaction and deactivation rates of methane catalytic cracking over nickel Ind. Eng. Chem. Res. 50 2011 12460 12470 A. Amin, W. Epling, E. Croiset, Reaction and Deactivation Rates of Methane Catalytic Cracking over Nickel, Industrial & Engineering Chemistry Research, 50 (2011) 12460-12470. [14] A.M. Amin E. Croiset W. Epling Review of methane catalytic cracking for hydrogen production Int. J. Hydrog. Energy 36 2011 2904 2935 A.M. Amin, E. Croiset, W. Epling, Review of methane catalytic cracking for hydrogen production, International Journal of Hydrogen Energy, 36 (2011) 2904-2935. [15] L. Weger A. Abánades T. Butler Methane cracking as a bridge technology to the hydrogen economy Int. J. Hydrog. Energy 42 2017 720 731 L. Weger, A. Abánades, T. Butler, Methane cracking as a bridge technology to the hydrogen economy, International Journal of Hydrogen Energy, 42 (2017) 720-731. [16] M. McConnachie M. Konarova S. Smart Literature review of the catalytic pyrolysis of methane for hydrogen and carbon production Int. J. Hydrog. Energy 2023 M. McConnachie, M. Konarova, S. Smart, Literature review of the catalytic pyrolysis of methane for hydrogen and carbon production, International Journal of Hydrogen Energy, (2023). [17] H. Arandiyan P. Sudarsanam S.K. Bhargava A.F. Lee K. Wilson Perovskite catalysts for biomass valorization ACS Catal. 2023 7879 7916 H. Arandiyan, P. Sudarsanam, S.K. Bhargava, A.F. Lee, K. Wilson, Perovskite Catalysts for Biomass Valorization, ACS Catalysis, (2023) 7879-7916. [18] J.A. Gómez-Cuaspud E. Vera-López J.B. Carda-Castelló E. Barrachina-Albert One-step hydrothermal synthesis of LaFeO 3 perovskite for methane steam reforming React. Kinet., Mech. Catal. 120 2017 167 179 J.A. Gómez-Cuaspud, E. Vera-López, J.B. Carda-Castelló, E. Barrachina-Albert, One-step hydrothermal synthesis of LaFeO 3 perovskite for methane steam reforming, Reaction Kinetics, Mechanisms and Catalysis, 120 (2017) 167-179. [19] S. Moogi C. Hyun Ko G. Hoon Rhee B.-H. Jeon M. Ali Khan Y.-K. Park Influence of catalyst synthesis methods on anti-coking strength of perovskites derived catalysts in biogas dry reforming for syngas production Chem. Eng. J. 437 2022 135348 S. Moogi, C. Hyun Ko, G. Hoon Rhee, B.-H. Jeon, M. Ali Khan, Y.-K. Park, Influence of catalyst synthesis methods on anti-coking strength of perovskites derived catalysts in biogas dry reforming for syngas production, Chemical Engineering Journal, 437 (2022) 135348. [20] G.R. Moradi F. Khosravian M. Rahmanzadeh Effects of partial substitution of Ni by Cu in LaNiO3 perovskite catalyst for dry methane reforming Chin. J. Catal. 33 2012 797 801 G.R. Moradi, F. Khosravian, M. Rahmanzadeh, Effects of Partial Substitution of Ni by Cu in LaNiO3 Perovskite Catalyst for Dry Methane Reforming, Chinese Journal of Catalysis, 33 (2012) 797-801. [21] T. Maneerung K. Hidajat S. Kawi Co-production of hydrogen and carbon nanofibers from catalytic decomposition of methane over LaNi(1−x)Mx O3−α perovskite (where M = Co, Fe and X = 0, 0.2, 0.5, 0.8, 1) Int. J. Hydrog. Energy 40 2015 13399 13411 T. Maneerung, K. Hidajat, S. Kawi, Co-production of hydrogen and carbon nanofibers from catalytic decomposition of methane over LaNi(1−x)Mx O3−α perovskite (where M = Co, Fe and X = 0, 0.2, 0.5, 0.8, 1), International Journal of Hydrogen Energy, 40 (2015) 13399-13411. [22] G.Sierra Gallego J. Barrault C. Batiot-Dupeyrat F. Mondragón Production of hydrogen and MWCNTs by methane decomposition over catalysts originated from LaNiO3 perovskite Catal. Today 149 2010 365 371 G.Sierra Gallego, J. Barrault, C. Batiot-Dupeyrat, F. Mondragón, Production of hydrogen and MWCNTs by methane decomposition over catalysts originated from LaNiO3 perovskite, Catalysis Today, 149 (2010) 365-371. [23] F. Touahra A. Rabahi R. Chebout A. Boudjemaa D. Lerari M. Sehailia D. Halliche K. Bachari Enhanced catalytic behaviour of surface dispersed nickel on LaCuO3 perovskite in the production of syngas: an expedient approach to carbon resistance during CO2 reforming of methane Int. J. Hydrog. Energy 41 2016 2477 2486 F. Touahra, A. Rabahi, R. Chebout, A. Boudjemaa, D. Lerari, M. Sehailia, D. Halliche, K. Bachari, Enhanced catalytic behaviour of surface dispersed nickel on LaCuO3 perovskite in the production of syngas: An expedient approach to carbon resistance during CO2 reforming of methane, International Journal of Hydrogen Energy, 41 (2016) 2477-2486. [24] G. Moradi F. Khosravian M. Rahmanzadeh Effects of partial substitution of Ni by Cu in LaNiO3 perovskite catalyst for dry methane reforming Chin. J. Catal. 33 2012 797 801 G. Moradi, F. Khosravian, M. Rahmanzadeh, Effects of partial substitution of Ni by Cu in LaNiO3 perovskite catalyst for dry methane reforming, Chinese Journal of Catalysis, 33 (2012) 797-801. [25] G.R. Moradi M. Rahmanzadeh F. Khosravian The effects of partial substitution of Ni by Zn in LaNiO3 perovskite catalyst for methane dry reforming J. CO2 Util. 6 2014 7 11 G.R. Moradi, M. Rahmanzadeh, F. Khosravian, The effects of partial substitution of Ni by Zn in LaNiO3 perovskite catalyst for methane dry reforming, Journal of CO2 Utilization, 6 (2014) 7-11. [26] Z.G. Duma X. Dyosiba J. Moma H.W. Langmi B. Louis K. Parkhomenko N.M. Musyoka Thermocatalytic hydrogenation of CO2 to methanol using Cu-ZnO bimetallic catalysts supported on Metal–Organic frameworks Catalysts 12 2022 401 Z.G. Duma, X. Dyosiba, J. Moma, H.W. Langmi, B. Louis, K. Parkhomenko, N.M. Musyoka, Thermocatalytic Hydrogenation of CO2 to Methanol Using Cu-ZnO Bimetallic Catalysts Supported on Metal–Organic Frameworks, Catalysts, 12 (2022) 401. [27] R. Pereñiguez V.M. Gonzalez-delaCruz A. Caballero J.P. Holgado LaNiO3 as a precursor of Ni/La2O3 for CO2 reforming of CH4: Effect of the presence of an amorphous NiO phase Appl. Catal. B: Environ. 123-124 2012 324 332 R. Pereñiguez, V.M. Gonzalez-delaCruz, A. Caballero, J.P. Holgado, LaNiO3 as a precursor of Ni/La2O3 for CO2 reforming of CH4: Effect of the presence of an amorphous NiO phase, Applied Catalysis B: Environmental, 123-124 (2012) 324-332. [28] J. Zhu H. Li L. Zhong P. Xiao X. Xu X. Yang Z. Zhao J. Li Perovskite oxides: preparation, characterizations, and applications in heterogeneous catalysis ACS Catal. 4 2014 2917 2940 J. Zhu, H. Li, L. Zhong, P. Xiao, X. Xu, X. Yang, Z. Zhao, J. Li, Perovskite Oxides: Preparation, Characterizations, and Applications in Heterogeneous Catalysis, ACS Catalysis, 4 (2014) 2917-2940. [29] L. Jurado V. Papaefthimiou S. Thomas A.-C. Roger Upgrading syngas from wood gasification through steam reforming of tars over highly active Ni-perovskite catalysts at relatively low temperature Appl. Catal. B: Environ. 299 2021 120687 L. Jurado, V. Papaefthimiou, S. Thomas, A.-C. Roger, Upgrading syngas from wood gasification through steam reforming of tars over highly active Ni-perovskite catalysts at relatively low temperature, Applied Catalysis B: Environmental, 299 (2021) 120687. [30] A. Shahnazi S. Firoozi Improving the catalytic performance of LaNiO3 perovskite by manganese substitution via ultrasonic spray pyrolysis for dry reforming of methane J. CO2 Util. 45 2021 101455 A. Shahnazi, S. Firoozi, Improving the catalytic performance of LaNiO3 perovskite by manganese substitution via ultrasonic spray pyrolysis for dry reforming of methane, Journal of CO2 Utilization, 45 (2021) 101455. [31] T. Maneerung K. Hidajat S. Kawi LaNiO3 perovskite catalyst precursor for rapid decomposition of methane: Influence of temperature and presence of H2 in feed stream Catal. Today 171 2011 24 35 T. Maneerung, K. Hidajat, S. Kawi, LaNiO3 perovskite catalyst precursor for rapid decomposition of methane: Influence of temperature and presence of H2 in feed stream, Catalysis Today, 171 (2011) 24-35. [32] R. Hu R. Ding J. Chen J. Hu Y. Zhang Preparation and catalytic activities of the novel double perovskite-type oxide La2CuNiO6 for methane combustion Catal. Commun. 21 2012 38 41 R. Hu, R. Ding, J. Chen, J. Hu, Y. Zhang, Preparation and catalytic activities of the novel double perovskite-type oxide La2CuNiO6 for methane combustion, Catalysis Communications, 21 (2012) 38-41. [33] Z.G. Duma J. Moma H.W. Langmi B. Louis K. Parkhomenko N.M. Musyoka Towards high CO2 conversions using Cu/Zn catalysts supported on aluminum fumarate metal-organic framework for methanol synthesis Catalysts 12 2022 1104 Z.G. Duma, J. Moma, H.W. Langmi, B. Louis, K. Parkhomenko, N.M. Musyoka, Towards High CO2 Conversions Using Cu/Zn Catalysts Supported on Aluminum Fumarate Metal-Organic Framework for Methanol Synthesis, Catalysts, 12 (2022) 1104. [34] R. Guil-Lopez J.A. Botas J.L.G. Fierro D.P. Serrano Comparison of metal and carbon catalysts for hydrogen production by methane decomposition Appl. Catal. A: Gen. 396 2011 40 51 R. Guil-Lopez, J.A. Botas, J.L.G. Fierro, D.P. Serrano, Comparison of metal and carbon catalysts for hydrogen production by methane decomposition, Applied Catalysis A: General, 396 (2011) 40-51. [35] A.M. Dunker J.P. Ortmann Kinetic modeling of hydrogen production by thermal decomposition of methane Int. J. Hydrog. Energy 31 2006 1989 1998 A.M. Dunker, J.P. Ortmann, Kinetic modeling of hydrogen production by thermal decomposition of methane, International journal of hydrogen energy, 31 (2006) 1989-1998. [36] S. Krzyżyński M. Kozłowski Activated carbons as catalysts for hydrogen production via methane decomposition Int. J. Hydrog. Energy 33 2008 6172 6177 S. Krzyżyński, M. Kozłowski, Activated carbons as catalysts for hydrogen production via methane decomposition, International Journal of Hydrogen Energy, 33 (2008) 6172-6177. [37] I. Suelves J. Pinilla M. Lázaro R. Moliner J. Palacios Effects of reaction conditions on hydrogen production and carbon nanofiber properties generated by methane decomposition in a fixed bed reactor using a NiCuAl catalyst J. Power Sources 192 2009 35 42 I. Suelves, J. Pinilla, M. Lázaro, R. Moliner, J. Palacios, Effects of reaction conditions on hydrogen production and carbon nanofiber properties generated by methane decomposition in a fixed bed reactor using a NiCuAl catalyst, Journal of Power Sources, 192 (2009) 35-42. [38] M.E. Rivas C.E. Hori J.L.G. Fierro M.R. Goldwasser A. Griboval-Constant, H2 production from CH4 decomposition: regeneration capability and performance of nickel and rhodium oxide catalysts J. Power Sources 184 2008 265 275 M.E. Rivas, C.E. Hori, J.L.G. Fierro, M.R. Goldwasser, A. Griboval-Constant, H2 production from CH4 decomposition: Regeneration capability and performance of nickel and rhodium oxide catalysts, Journal of Power Sources, 184 (2008) 265-275. [39] L.S. Lobo M.D. Franco Kinetics of catalytic carbon formation on steel surfaces from light hydrocarbons Catal. Today 7 1990 247 256 L.S. Lobo, M.D. Franco, Kinetics of catalytic carbon formation on steel surfaces from light hydrocarbons, Catalysis Today, 7 (1990) 247-256. [40] Q. Liu P. Wu J. He C. Liu W. Jiang Catalytic decomposition of methane by two-step cascade catalytic process: simultaneous production of hydrogen and carbon nanotubes Chem. Eng. Res. Des. 163 2020 96 106 Q. Liu, P. Wu, J. He, C. Liu, W. Jiang, Catalytic decomposition of methane by two-step cascade catalytic process: Simultaneous production of hydrogen and carbon nanotubes, Chemical Engineering Research and Design, 163 (2020) 96-106. [41] P.E. Nolan D.C. Lynch A.H. Cutler Carbon deposition and hydrocarbon formation on group viii metal catalysts J. Phys. Chem. B 102 1998 4165 4175 P.E. Nolan, D.C. Lynch, A.H. Cutler, Carbon Deposition and Hydrocarbon Formation on Group VIII Metal Catalysts, The Journal of Physical Chemistry B, 102 (1998) 4165-4175. [42] E. Kukovitskii L. Chernozatonskii S. L'vov N. Mel'Nik Carbon nanotubes of polyethylene Chem. Phys. Lett. 266 1997 323 328 E. Kukovitskii, L. Chernozatonskii, S. L′vov, N. Mel'Nik, Carbon nanotubes of polyethylene, Chemical physics letters, 266 (1997) 323-328. [43] N. Bayat F. Meshkani M. Rezaei Thermocatalytic decomposition of methane to COx-free hydrogen and carbon over Ni–Fe–Cu/Al2O3 catalysts Int. J. Hydrog. Energy 41 2016 13039 13049 N. Bayat, F. Meshkani, M. Rezaei, Thermocatalytic decomposition of methane to COx-free hydrogen and carbon over Ni–Fe–Cu/Al2O3 catalysts, International Journal of Hydrogen Energy, 41 (2016) 13039-13049. [44] D. Chen K.O. Christensen E. Ochoa-Fernández Z. Yu B. Tøtdal N. Latorre A. Monzón A. Holmen Synthesis of carbon nanofibers: effects of Ni crystal size during methane decomposition J. Catal. 229 2005 82 96 D. Chen, K.O. Christensen, E. Ochoa-Fernández, Z. Yu, B. Tøtdal, N. Latorre, A. Monzón, A. Holmen, Synthesis of carbon nanofibers: effects of Ni crystal size during methane decomposition, Journal of Catalysis, 229 (2005) 82-96. [45] Y. Yi H. Liu B. Chu Z. Qin L. Dong H. He C. Tang M. Fan L. Bin Catalytic removal NO by CO over LaNi0.5M0.5O3 (M = Co, Mn, Cu) perovskite oxide catalysts: Tune surface chemical composition to improve N2 selectivity Chem. Eng. J. 369 2019 511 521 Y. Yi, H. Liu, B. Chu, Z. Qin, L. Dong, H. He, C. Tang, M. Fan, L. Bin, Catalytic removal NO by CO over LaNi0.5M0.5O3 (M = Co, Mn, Cu) perovskite oxide catalysts: Tune surface chemical composition to improve N2 selectivity, Chemical Engineering Journal, 369 (2019) 511-521. [46] C. Deng J. Qian C. Yu Y. Yi P. Zhang W. Li L. Dong B. Li M. Fan Influences of doping and thermal stability on the catalytic performance of CuO/Ce 20 M 1 O x (M= Zr, Cr, Mn, Fe, Co, Sn) catalysts for NO reduction by CO RSC Adv. 6 2016 113630 113647 C. Deng, J. Qian, C. Yu, Y. Yi, P. Zhang, W. Li, L. Dong, B. Li, M. Fan, Influences of doping and thermal stability on the catalytic performance of CuO/Ce 20 M 1 O x (M= Zr, Cr, Mn, Fe, Co, Sn) catalysts for NO reduction by CO, RSC Advances, 6 (2016) 113630-113647. [47] I. Suelves M.J. Lázaro R. Moliner B.M. Corbella J.M. Palacios Hydrogen production by thermo catalytic decomposition of methane on Ni-based catalysts: influence of operating conditions on catalyst deactivation and carbon characteristics Int. J. Hydrog. Energy 30 2005 1555 1567 I. Suelves, M.J. Lázaro, R. Moliner, B.M. Corbella, J.M. Palacios, Hydrogen production by thermo catalytic decomposition of methane on Ni-based catalysts: influence of operating conditions on catalyst deactivation and carbon characteristics, International Journal of Hydrogen Energy, 30 (2005) 1555-1567. [48] B. Gao J. Deng Y. Liu Z. Zhao X. Li Y. Wang H. Dai Mesoporous LaFeO3 catalysts for the oxidation of toluene and carbon monoxide Chin. J. Catal. 34 2013 2223 2229 B. Gao, J. Deng, Y. Liu, Z. Zhao, X. Li, Y. Wang, H. Dai, Mesoporous LaFeO3 catalysts for the oxidation of toluene and carbon monoxide, Chinese Journal of Catalysis, 34 (2013) 2223-2229. [49] A. Tarjomannejad A. Niaei A. Farzi D. Salari P.R. Zonouz Catalytic oxidation of CO over LaMn 1− x B x O 3 (B= Cu, Fe) Perovskite-type oxides Catal. Lett. 146 2016 1544 1551 A. Tarjomannejad, A. Niaei, A. Farzi, D. Salari, P.R. Zonouz, Catalytic Oxidation of CO Over LaMn 1− x B x O 3 (B= Cu, Fe) Perovskite-type Oxides, Catalysis Letters, 146 (2016) 1544-1551. [50] S. Ahmed A. Aitani F. Rahman A. Al-Dawood F. Al-Muhaish Decomposition of hydrocarbons to hydrogen and carbon Appl. Catal. A: Gen. 359 2009 1 24 S. Ahmed, A. Aitani, F. Rahman, A. Al-Dawood, F. Al-Muhaish, Decomposition of hydrocarbons to hydrogen and carbon, Applied Catalysis A: General, 359 (2009) 1-24.",
      "scopus-id": "85188543229",
      "coredata": {
        "eid": "1-s2.0-S0926860X24001479",
        "dc:description": "The thermocatalytic decomposition (TCD) of methane is an attractive alternative to produce low-carbon hydrogen and solid carbonaceous materials. In this study, substituted LaNi1-xCuxO3 perovskite catalysts prepared via self-combustion method were investigated for methane TCD. The effect of Ni partial substitution with Cu, varying gas hourly space velocity, temperature and stability on methane conversions were evaluated. PXRD, H2-TPR, SEM-EDS, TGA, and XPS were used to characterize the catalysts. An increase in Cu loading to 50%, increase in temperature and decrease in GHSV resulted in an improvement in methane conversions to 92%. At a GHSV of 2400 ml/gcat.h, no significant deactivation was observed as the stability of the LaNi0.5Cu0.5O3 catalyst increased from 6 to 20 hours’ TOS with methane conversions maintained at 92% where carbon nanofibers were observed on the surface of the spent catalysts. The study demonstrates the potential to prepare LaNi1-xCuxO3 catalysts and identify optimal testing conditions for the novel production of low-carbon hydrogen with minimal catalyst deactivation.",
        "openArchiveArticle": "false",
        "prism:coverDate": "2024-05-05",
        "openaccessUserLicense": "http://creativecommons.org/licenses/by-nc/4.0/",
        "prism:aggregationType": "Journal",
        "prism:url": "https://api.elsevier.com/content/article/pii/S0926860X24001479",
        "dc:creator": [
          {
            "@_fa": "true",
            "$": "Duma, Zama G."
          },
          {
            "@_fa": "true",
            "$": "Swartbooi, Ashton"
          },
          {
            "@_fa": "true",
            "$": "Musyoka, Nicholas M."
          }
        ],
        "link": [
          {
            "@_fa": "true",
            "@rel": "self",
            "@href": "https://api.elsevier.com/content/article/pii/S0926860X24001479"
          },
          {
            "@_fa": "true",
            "@rel": "scidir",
            "@href": "https://www.sciencedirect.com/science/article/pii/S0926860X24001479"
          }
        ],
        "dc:format": "application/json",
        "openaccessType": "Full",
        "pii": "S0926-860X(24)00147-9",
        "prism:volume": "677",
        "articleNumber": "119703",
        "prism:publisher": "The Authors. Published by Elsevier B.V.",
        "dc:title": "Thermocatalytic decomposition of methane to low-carbon hydrogen using LaNi1-xCuxO3 perovskite catalysts",
        "prism:copyright": "© 2024 The Authors. Published by Elsevier B.V.",
        "openaccess": "1",
        "prism:issn": "0926860X",
        "dcterms:subject": [
          {
            "@_fa": "true",
            "$": "Methane TCD"
          },
          {
            "@_fa": "true",
            "$": "Low-carbon hydrogen"
          },
          {
            "@_fa": "true",
            "$": "Perovskite"
          },
          {
            "@_fa": "true",
            "$": "Gas Hourly Space Velocity"
          },
          {
            "@_fa": "true",
            "$": "LaNiCuO3"
          }
        ],
        "openaccessArticle": "true",
        "prism:publicationName": "Applied Catalysis A: General",
        "openaccessSponsorType": "FundingBody",
        "prism:pageRange": "119703",
        "pubType": "fla",
        "prism:coverDisplayDate": "5 May 2024",
        "prism:doi": "10.1016/j.apcata.2024.119703",
        "prism:startingPage": "119703",
        "dc:identifier": "doi:10.1016/j.apcata.2024.119703",
        "openaccessSponsorName": "SANLIC (South African Consortium) – Hybrid"
      },
      "objects": {
        "object": [
          {
            "@category": "standard",
            "@height": "312",
            "@width": "376",
            "@_fa": "true",
            "$": "https://api.elsevier.com/content/object/eid/1-s2.0-S0926860X24001479-gr9.jpg?httpAccept=%2A%2F%2A",
            "@multimediatype": "JPEG image file",
            "@type": "IMAGE-DOWNSAMPLED",
            "@size": "24481",
            "@ref": "gr9",
            "@mimetype": "image/jpeg"
          },
          {
            "@category": "standard",
            "@height": "550",
            "@width": "751",
            "@_fa": "true",
            "$": "https://api.elsevier.com/content/object/eid/1-s2.0-S0926860X24001479-gr8.jpg?httpAccept=%2A%2F%2A",
            "@multimediatype": "JPEG image file",
            "@type": "IMAGE-DOWNSAMPLED",
            "@size": "73129",
            "@ref": "gr8",
            "@mimetype": "image/jpeg"
          },
          {
            "@category": "standard",
            "@height": "297",
            "@width": "376",
            "@_fa": "true",
            "$": "https://api.elsevier.com/content/object/eid/1-s2.0-S0926860X24001479-gr1.jpg?httpAccept=%2A%2F%2A",
            "@multimediatype": "JPEG image file",
            "@type": "IMAGE-DOWNSAMPLED",
            "@size": "25623",
            "@ref": "gr1",
            "@mimetype": "image/jpeg"
          },
          {
            "@category": "standard",
            "@height": "294",
            "@width": "376",
            "@_fa": "true",
            "$": "https://api.elsevier.com/content/object/eid/1-s2.0-S0926860X24001479-gr3.jpg?httpAccept=%2A%2F%2A",
            "@multimediatype": "JPEG image file",
            "@type": "IMAGE-DOWNSAMPLED",
            "@size": "23350",
            "@ref": "gr3",
            "@mimetype": "image/jpeg"
          },
          {
            "@category": "standard",
            "@height": "783",
            "@width": "565",
            "@_fa": "true",
            "$": "https://api.elsevier.com/content/object/eid/1-s2.0-S0926860X24001479-gr2.jpg?httpAccept=%2A%2F%2A",
            "@multimediatype": "JPEG image file",
            "@type": "IMAGE-DOWNSAMPLED",
            "@size": "130557",
            "@ref": "gr2",
            "@mimetype": "image/jpeg"
          },
          {
            "@category": "standard",
            "@height": "300",
            "@width": "376",
            "@_fa": "true",
            "$": "https://api.elsevier.com/content/object/eid/1-s2.0-S0926860X24001479-gr10.jpg?httpAccept=%2A%2F%2A",
            "@multimediatype": "JPEG image file",
            "@type": "IMAGE-DOWNSAMPLED",
            "@size": "16330",
            "@ref": "gr10",
            "@mimetype": "image/jpeg"
          },
          {
            "@category": "standard",
            "@height": "200",
            "@width": "407",
            "@_fa": "true",
            "$": "https://api.elsevier.com/content/object/eid/1-s2.0-S0926860X24001479-ga1.jpg?httpAccept=%2A%2F%2A",
            "@multimediatype": "JPEG image file",
            "@type": "IMAGE-DOWNSAMPLED",
            "@size": "17253",
            "@ref": "ga1",
            "@mimetype": "image/jpeg"
          },
          {
            "@category": "standard",
            "@height": "312",
            "@width": "376",
            "@_fa": "true",
            "$": "https://api.elsevier.com/content/object/eid/1-s2.0-S0926860X24001479-gr5.jpg?httpAccept=%2A%2F%2A",
            "@multimediatype": "JPEG image file",
            "@type": "IMAGE-DOWNSAMPLED",
            "@size": "19786",
            "@ref": "gr5",
            "@mimetype": "image/jpeg"
          },
          {
            "@category": "standard",
            "@height": "300",
            "@width": "376",
            "@_fa": "true",
            "$": "https://api.elsevier.com/content/object/eid/1-s2.0-S0926860X24001479-gr4.jpg?httpAccept=%2A%2F%2A",
            "@multimediatype": "JPEG image file",
            "@type": "IMAGE-DOWNSAMPLED",
            "@size": "24046",
            "@ref": "gr4",
            "@mimetype": "image/jpeg"
          },
          {
            "@category": "standard",
            "@height": "250",
            "@width": "376",
            "@_fa": "true",
            "$": "https://api.elsevier.com/content/object/eid/1-s2.0-S0926860X24001479-gr7.jpg?httpAccept=%2A%2F%2A",
            "@multimediatype": "JPEG image file",
            "@type": "IMAGE-DOWNSAMPLED",
            "@size": "20460",
            "@ref": "gr7",
            "@mimetype": "image/jpeg"
          },
          {
            "@category": "standard",
            "@height": "195",
            "@width": "565",
            "@_fa": "true",
            "$": "https://api.elsevier.com/content/object/eid/1-s2.0-S0926860X24001479-gr6.jpg?httpAccept=%2A%2F%2A",
            "@multimediatype": "JPEG image file",
            "@type": "IMAGE-DOWNSAMPLED",
            "@size": "46033",
            "@ref": "gr6",
            "@mimetype": "image/jpeg"
          },
          {
            "@category": "thumbnail",
            "@height": "164",
            "@width": "198",
            "@_fa": "true",
            "$": "https://api.elsevier.com/content/object/eid/1-s2.0-S0926860X24001479-gr9.sml?httpAccept=%2A%2F%2A",
            "@multimediatype": "GIF image file",
            "@type": "IMAGE-THUMBNAIL",
            "@size": "6967",
            "@ref": "gr9",
            "@mimetype": "image/gif"
          },
          {
            "@category": "thumbnail",
            "@height": "160",
            "@width": "219",
            "@_fa": "true",
            "$": "https://api.elsevier.com/content/object/eid/1-s2.0-S0926860X24001479-gr8.sml?httpAccept=%2A%2F%2A",
            "@multimediatype": "GIF image file",
            "@type": "IMAGE-THUMBNAIL",
            "@size": "8540",
            "@ref": "gr8",
            "@mimetype": "image/gif"
          },
          {
            "@category": "thumbnail",
            "@height": "164",
            "@width": "208",
            "@_fa": "true",
            "$": "https://api.elsevier.com/content/object/eid/1-s2.0-S0926860X24001479-gr1.sml?httpAccept=%2A%2F%2A",
            "@multimediatype": "GIF image file",
            "@type": "IMAGE-THUMBNAIL",
            "@size": "7738",
            "@ref": "gr1",
            "@mimetype": "image/gif"
          },
          {
            "@category": "thumbnail",
            "@height": "164",
            "@width": "210",
            "@_fa": "true",
            "$": "https://api.elsevier.com/content/object/eid/1-s2.0-S0926860X24001479-gr3.sml?httpAccept=%2A%2F%2A",
            "@multimediatype": "GIF image file",
            "@type": "IMAGE-THUMBNAIL",
            "@size": "6989",
            "@ref": "gr3",
            "@mimetype": "image/gif"
          },
          {
            "@category": "thumbnail",
            "@height": "164",
            "@width": "118",
            "@_fa": "true",
            "$": "https://api.elsevier.com/content/object/eid/1-s2.0-S0926860X24001479-gr2.sml?httpAccept=%2A%2F%2A",
            "@multimediatype": "GIF image file",
            "@type": "IMAGE-THUMBNAIL",
            "@size": "13195",
            "@ref": "gr2",
            "@mimetype": "image/gif"
          },
          {
            "@category": "thumbnail",
            "@height": "163",
            "@width": "205",
            "@_fa": "true",
            "$": "https://api.elsevier.com/content/object/eid/1-s2.0-S0926860X24001479-gr10.sml?httpAccept=%2A%2F%2A",
            "@multimediatype": "GIF image file",
            "@type": "IMAGE-THUMBNAIL",
            "@size": "5364",
            "@ref": "gr10",
            "@mimetype": "image/gif"
          },
          {
            "@category": "thumbnail",
            "@height": "108",
            "@width": "219",
            "@_fa": "true",
            "$": "https://api.elsevier.com/content/object/eid/1-s2.0-S0926860X24001479-ga1.sml?httpAccept=%2A%2F%2A",
            "@multimediatype": "GIF image file",
            "@type": "IMAGE-THUMBNAIL",
            "@size": "6163",
            "@ref": "ga1",
            "@mimetype": "image/gif"
          },
          {
            "@category": "thumbnail",
            "@height": "164",
            "@width": "198",
            "@_fa": "true",
            "$": "https://api.elsevier.com/content/object/eid/1-s2.0-S0926860X24001479-gr5.sml?httpAccept=%2A%2F%2A",
            "@multimediatype": "GIF image file",
            "@type": "IMAGE-THUMBNAIL",
            "@size": "6084",
            "@ref": "gr5",
            "@mimetype": "image/gif"
          },
          {
            "@category": "thumbnail",
            "@height": "164",
            "@width": "205",
            "@_fa": "true",
            "$": "https://api.elsevier.com/content/object/eid/1-s2.0-S0926860X24001479-gr4.sml?httpAccept=%2A%2F%2A",
            "@multimediatype": "GIF image file",
            "@type": "IMAGE-THUMBNAIL",
            "@size": "7800",
            "@ref": "gr4",
            "@mimetype": "image/gif"
          },
          {
            "@category": "thumbnail",
            "@height": "146",
            "@width": "219",
            "@_fa": "true",
            "$": "https://api.elsevier.com/content/object/eid/1-s2.0-S0926860X24001479-gr7.sml?httpAccept=%2A%2F%2A",
            "@multimediatype": "GIF image file",
            "@type": "IMAGE-THUMBNAIL",
            "@size": "7084",
            "@ref": "gr7",
            "@mimetype": "image/gif"
          },
          {
            "@category": "thumbnail",
            "@height": "75",
            "@width": "219",
            "@_fa": "true",
            "$": "https://api.elsevier.com/content/object/eid/1-s2.0-S0926860X24001479-gr6.sml?httpAccept=%2A%2F%2A",
            "@multimediatype": "GIF image file",
            "@type": "IMAGE-THUMBNAIL",
            "@size": "11954",
            "@ref": "gr6",
            "@mimetype": "image/gif"
          },
          {
            "@category": "high",
            "@height": "1378",
            "@width": "1663",
            "@_fa": "true",
            "$": "https://api.elsevier.com/content/object/eid/1-s2.0-S0926860X24001479-gr9_lrg.jpg?httpAccept=%2A%2F%2A",
            "@multimediatype": "JPEG image file",
            "@type": "IMAGE-HIGH-RES",
            "@size": "123140",
            "@ref": "gr9",
            "@mimetype": "image/jpeg"
          },
          {
            "@category": "high",
            "@height": "2437",
            "@width": "3326",
            "@_fa": "true",
            "$": "https://api.elsevier.com/content/object/eid/1-s2.0-S0926860X24001479-gr8_lrg.jpg?httpAccept=%2A%2F%2A",
            "@multimediatype": "JPEG image file",
            "@type": "IMAGE-HIGH-RES",
            "@size": "320106",
            "@ref": "gr8",
            "@mimetype": "image/jpeg"
          },
          {
            "@category": "high",
            "@height": "1313",
            "@width": "1663",
            "@_fa": "true",
            "$": "https://api.elsevier.com/content/object/eid/1-s2.0-S0926860X24001479-gr1_lrg.jpg?httpAccept=%2A%2F%2A",
            "@multimediatype": "JPEG image file",
            "@type": "IMAGE-HIGH-RES",
            "@size": "144056",
            "@ref": "gr1",
            "@mimetype": "image/jpeg"
          },
          {
            "@category": "high",
            "@height": "1299",
            "@width": "1663",
            "@_fa": "true",
            "$": "https://api.elsevier.com/content/object/eid/1-s2.0-S0926860X24001479-gr3_lrg.jpg?httpAccept=%2A%2F%2A",
            "@multimediatype": "JPEG image file",
            "@type": "IMAGE-HIGH-RES",
            "@size": "118321",
            "@ref": "gr3",
            "@mimetype": "image/jpeg"
          },
          {
            "@category": "high",
            "@height": "3459",
            "@width": "2495",
            "@_fa": "true",
            "$": "https://api.elsevier.com/content/object/eid/1-s2.0-S0926860X24001479-gr2_lrg.jpg?httpAccept=%2A%2F%2A",
            "@multimediatype": "JPEG image file",
            "@type": "IMAGE-HIGH-RES",
            "@size": "580602",
            "@ref": "gr2",
            "@mimetype": "image/jpeg"
          },
          {
            "@category": "high",
            "@height": "1326",
            "@width": "1663",
            "@_fa": "true",
            "$": "https://api.elsevier.com/content/object/eid/1-s2.0-S0926860X24001479-gr10_lrg.jpg?httpAccept=%2A%2F%2A",
            "@multimediatype": "JPEG image file",
            "@type": "IMAGE-HIGH-RES",
            "@size": "87778",
            "@ref": "gr10",
            "@mimetype": "image/jpeg"
          },
          {
            "@category": "high",
            "@height": "886",
            "@width": "1802",
            "@_fa": "true",
            "$": "https://api.elsevier.com/content/object/eid/1-s2.0-S0926860X24001479-ga1_lrg.jpg?httpAccept=%2A%2F%2A",
            "@multimediatype": "JPEG image file",
            "@type": "IMAGE-HIGH-RES",
            "@size": "148419",
            "@ref": "ga1",
            "@mimetype": "image/jpeg"
          },
          {
            "@category": "high",
            "@height": "1378",
            "@width": "1663",
            "@_fa": "true",
            "$": "https://api.elsevier.com/content/object/eid/1-s2.0-S0926860X24001479-gr5_lrg.jpg?httpAccept=%2A%2F%2A",
            "@multimediatype": "JPEG image file",
            "@type": "IMAGE-HIGH-RES",
            "@size": "106511",
            "@ref": "gr5",
            "@mimetype": "image/jpeg"
          },
          {
            "@category": "high",
            "@height": "1329",
            "@width": "1663",
            "@_fa": "true",
            "$": "https://api.elsevier.com/content/object/eid/1-s2.0-S0926860X24001479-gr4_lrg.jpg?httpAccept=%2A%2F%2A",
            "@multimediatype": "JPEG image file",
            "@type": "IMAGE-HIGH-RES",
            "@size": "128015",
            "@ref": "gr4",
            "@mimetype": "image/jpeg"
          },
          {
            "@category": "high",
            "@height": "1106",
            "@width": "1663",
            "@_fa": "true",
            "$": "https://api.elsevier.com/content/object/eid/1-s2.0-S0926860X24001479-gr7_lrg.jpg?httpAccept=%2A%2F%2A",
            "@multimediatype": "JPEG image file",
            "@type": "IMAGE-HIGH-RES",
            "@size": "108272",
            "@ref": "gr7",
            "@mimetype": "image/jpeg"
          },
          {
            "@category": "high",
            "@height": "859",
            "@width": "2495",
            "@_fa": "true",
            "$": "https://api.elsevier.com/content/object/eid/1-s2.0-S0926860X24001479-gr6_lrg.jpg?httpAccept=%2A%2F%2A",
            "@multimediatype": "JPEG image file",
            "@type": "IMAGE-HIGH-RES",
            "@size": "227586",
            "@ref": "gr6",
            "@mimetype": "image/jpeg"
          },
          {
            "@category": "standard",
            "@_fa": "true",
            "$": "https://api.elsevier.com/content/object/eid/1-s2.0-S0926860X24001479-mmc1.docx?httpAccept=%2A%2F%2A",
            "@multimediatype": "Microsoft Word file",
            "@type": "APPLICATION",
            "@size": "944876",
            "@ref": "mmc1",
            "@mimetype": "application/word"
          },
          {
            "@category": "thumbnail",
            "@_fa": "true",
            "$": "https://api.elsevier.com/content/object/eid/1-s2.0-S0926860X24001479-si0001.svg?httpAccept=%2A%2F%2A",
            "@multimediatype": "Scalable Vector Graphics file",
            "@type": "ALTIMG",
            "@size": "4181",
            "@ref": "si0001",
            "@mimetype": "image/svg+xml"
          },
          {
            "@category": "thumbnail",
            "@_fa": "true",
            "$": "https://api.elsevier.com/content/object/eid/1-s2.0-S0926860X24001479-si0002.svg?httpAccept=%2A%2F%2A",
            "@multimediatype": "Scalable Vector Graphics file",
            "@type": "ALTIMG",
            "@size": "2686",
            "@ref": "si0002",
            "@mimetype": "image/svg+xml"
          },
          {
            "@category": "thumbnail",
            "@_fa": "true",
            "$": "https://api.elsevier.com/content/object/eid/1-s2.0-S0926860X24001479-si0003.svg?httpAccept=%2A%2F%2A",
            "@multimediatype": "Scalable Vector Graphics file",
            "@type": "ALTIMG",
            "@size": "2990",
            "@ref": "si0003",
            "@mimetype": "image/svg+xml"
          },
          {
            "@category": "thumbnail",
            "@_fa": "true",
            "$": "https://api.elsevier.com/content/object/eid/1-s2.0-S0926860X24001479-si0004.svg?httpAccept=%2A%2F%2A",
            "@multimediatype": "Scalable Vector Graphics file",
            "@type": "ALTIMG",
            "@size": "3116",
            "@ref": "si0004",
            "@mimetype": "image/svg+xml"
          },
          {
            "@category": "thumbnail",
            "@_fa": "true",
            "$": "https://api.elsevier.com/content/object/eid/1-s2.0-S0926860X24001479-si0005.svg?httpAccept=%2A%2F%2A",
            "@multimediatype": "Scalable Vector Graphics file",
            "@type": "ALTIMG",
            "@size": "2467",
            "@ref": "si0005",
            "@mimetype": "image/svg+xml"
          },
          {
            "@category": "thumbnail",
            "@_fa": "true",
            "$": "https://api.elsevier.com/content/object/eid/1-s2.0-S0926860X24001479-si0006.svg?httpAccept=%2A%2F%2A",
            "@multimediatype": "Scalable Vector Graphics file",
            "@type": "ALTIMG",
            "@size": "2423",
            "@ref": "si0006",
            "@mimetype": "image/svg+xml"
          },
          {
            "@category": "thumbnail",
            "@_fa": "true",
            "$": "https://api.elsevier.com/content/object/eid/1-s2.0-S0926860X24001479-si0007.svg?httpAccept=%2A%2F%2A",
            "@multimediatype": "Scalable Vector Graphics file",
            "@type": "ALTIMG",
            "@size": "2281",
            "@ref": "si0007",
            "@mimetype": "image/svg+xml"
          },
          {
            "@category": "thumbnail",
            "@_fa": "true",
            "$": "https://api.elsevier.com/content/object/eid/1-s2.0-S0926860X24001479-si0008.svg?httpAccept=%2A%2F%2A",
            "@multimediatype": "Scalable Vector Graphics file",
            "@type": "ALTIMG",
            "@size": "2179",
            "@ref": "si0008",
            "@mimetype": "image/svg+xml"
          },
          {
            "@category": "thumbnail",
            "@_fa": "true",
            "$": "https://api.elsevier.com/content/object/eid/1-s2.0-S0926860X24001479-si0009.svg?httpAccept=%2A%2F%2A",
            "@multimediatype": "Scalable Vector Graphics file",
            "@type": "ALTIMG",
            "@size": "2042",
            "@ref": "si0009",
            "@mimetype": "image/svg+xml"
          },
          {
            "@category": "thumbnail",
            "@_fa": "true",
            "$": "https://api.elsevier.com/content/object/eid/1-s2.0-S0926860X24001479-si0010.svg?httpAccept=%2A%2F%2A",
            "@multimediatype": "Scalable Vector Graphics file",
            "@type": "ALTIMG",
            "@size": "1989",
            "@ref": "si0010",
            "@mimetype": "image/svg+xml"
          },
          {
            "@category": "thumbnail",
            "@_fa": "true",
            "$": "https://api.elsevier.com/content/object/eid/1-s2.0-S0926860X24001479-si0011.svg?httpAccept=%2A%2F%2A",
            "@multimediatype": "Scalable Vector Graphics file",
            "@type": "ALTIMG",
            "@size": "1916",
            "@ref": "si0011",
            "@mimetype": "image/svg+xml"
          },
          {
            "@category": "thumbnail",
            "@_fa": "true",
            "$": "https://api.elsevier.com/content/object/eid/1-s2.0-S0926860X24001479-si0012.svg?httpAccept=%2A%2F%2A",
            "@multimediatype": "Scalable Vector Graphics file",
            "@type": "ALTIMG",
            "@size": "1718",
            "@ref": "si0012",
            "@mimetype": "image/svg+xml"
          },
          {
            "@category": "thumbnail",
            "@_fa": "true",
            "$": "https://api.elsevier.com/content/object/eid/1-s2.0-S0926860X24001479-si0013.svg?httpAccept=%2A%2F%2A",
            "@multimediatype": "Scalable Vector Graphics file",
            "@type": "ALTIMG",
            "@size": "2483",
            "@ref": "si0013",
            "@mimetype": "image/svg+xml"
          },
          {
            "@category": "thumbnail",
            "@_fa": "true",
            "$": "https://api.elsevier.com/content/object/eid/1-s2.0-S0926860X24001479-si0014.svg?httpAccept=%2A%2F%2A",
            "@multimediatype": "Scalable Vector Graphics file",
            "@type": "ALTIMG",
            "@size": "2990",
            "@ref": "si0014",
            "@mimetype": "image/svg+xml"
          },
          {
            "@category": "standard",
            "@_fa": "true",
            "$": "https://api.elsevier.com/content/object/eid/1-s2.0-S0926860X24001479-am.pdf?httpAccept=%2A%2F%2A",
            "@multimediatype": "Acrobat PDF file",
            "@type": "AAM-PDF",
            "@size": "3570304",
            "@ref": "am",
            "@mimetype": "application/pdf"
          }
        ]
      },
      "link": {
        "@rel": "abstract",
        "@href": "https://api.elsevier.com/content/abstract/scopus_id/85188543229"
      }
    }
  }
}