{
  "metadata": {
    "title": "Bi-reforming of methane on Ni-based pyrochlore catalyst",
    "authors": "; ; ",
    "journal": "Applied Catalysis A: General",
    "date": "2016-05-05",
    "doi": "10.1016/j.apcata.2016.03.016",
    "abstract": "",
    "uri": "https://api.elsevier.com/content/article/pii/S0926860X16301260",
    "pii": "S0926860X16301260"
  },
  "fulltext": {
    "full-text-retrieval-response": {
      "scopus-eid": "2-s2.0-84961627476",
      "originalText": "serial JL 271346 291210 291744 291809 31 Applied Catalysis A: General APPLIEDCATALYSISAGENERAL 2016-03-15 2016-03-15 2016-03-23 2016-03-23 2019-10-29T07:41:49 1-s2.0-S0926860X16301260 S0926-860X(16)30126-0 S0926860X16301260 10.1016/j.apcata.2016.03.016 S300 S300.4 FULL-TEXT 1-s2.0-S0926860X16X00051 2024-01-01T12:31:47.592716Z 0 0 20160505 2016 2016-03-15T16:39:02.858215Z absattachment articleinfo articletitlenorm authfirstinitialnorm authfirstsurnamenorm cid cids contenttype copyright crossmark dateloaded dateloadedtxt datesearch datesort dateupdated dco docsubtype doctype doi eid ewtransactionid hubeid indexeddate issn issnnorm itemstage itemtransactionid itemweight openaccess openarchive pg pgfirst pglast pii piinorm pubdatestart pubdatetxt pubyr sectiontitle sortorder srctitle srctitlenorm srctype ssids alllist content subj subheadings suppl tomb volfirst volissue volumelist webpdf webpdfpagecount yearnav figure table body mmlmath acknowledge affil articletitle auth authfirstini authfull authkeywords authlast highlightsabst primabst ref specialabst 0926-860X 0926860X true 517 517 C Volume 517 25 211 216 211 216 20160505 5 May 2016 2016-05-05 2016 Articles article fla Copyright © 2016 Elsevier B.V. Published by Elsevier B.V. All rights reserved. BIREFORMINGMETHANENIBASEDPYROCHLORECATALYST KUMAR N 1 Introduction 2 Experimental 2.1 Catalyst preparation 2.2 Temperature programmed reduction (TPR) 2.3 X-ray characterizations 2.4 Catalyst activity test 3 Results and discussion 3.1 Temperature programmed reduction 3.2 X-ray absorption spectroscopy (XAS) 3.3 X-ray diffraction (XRD) 3.4 Catalyst activity 3.4.1 Blank runs for bi-reforming 3.4.2 Time-on-stream studies 3.4.3 Catalyst activity for bi-reforming 3.5 Carbon deposition studies 4 Conclusions Acknowledgements References KUMAR 2015 8 15 N YORK 2003 345 358 A BLANCHARD 2007 889 899 J KUMAR 2012 218 226 N KUMAR 2011 14735 14741 N KUMAR 2011 990 998 N SPIVEY 2007 1514 1528 J PAKHARE 2014 7813 7837 D PAKHARE 2013 117 129 D PAKHARE 2012 27 35 D GAUR 2011 142 151 S RAMACHANDRAN 2013 1413 1431 C LIU 2011 529 541 C HAYNES 2008 206 213 D TIETZ 2004 745 751 F MAJID 2005 48 54 A LEPE 2005 74 78 F RAVEL 2005 537 541 B RESSLER 1998 118 122 T BAI 1992 307 312 C RODULFOBAECHLER 2006 231 237 S MARIADELIMA 2002 329 335 S MILE 1988 217 229 B CHOUDHARY 2006 1024 1032 V CHOUDHARY 2006 2484 2488 V CHOUDHARY 2006 1753 1756 V CHOUDHARY 1996 3934 3939 V CHOUDHARY 1998 33 46 V OLAH 2012 648 650 G OLAH 2015 8720 8729 G ITKULOVA 2014 194 198 S KOO 2014 151 157 K KOO 2012 126 130 K TRIMM 1997 233 238 D KUMARX2016X211 KUMARX2016X211X216 KUMARX2016X211XN KUMARX2016X211X216XN 2018-03-23T00:00:00Z http://creativecommons.org/licenses/by-nc-nd/4.0/ 2019-03-25T17:34:04.813Z http://vtw.elsevier.com/data/voc/AddOnTypes/50.7/nlp S0926860X16301260 Climate Change and Emissions Management Corporation Climate Change and Emissions Management Corporation http://data.elsevier.com/vocabulary/SciValFunders/100010624 http://sws.geonames.org/6251999/ We acknowledge financial support from Climate Change and Emissions Management Corporation (CCEMC), Canada. Dr. Arun Raju at UC, Riverside is gratefully acknowledged for bi-reforming process development. item S0926-860X(16)30126-0 S0926860X16301260 1-s2.0-S0926860X16301260 10.1016/j.apcata.2016.03.016 271346 2024-01-01T12:31:47.592716Z 2016-05-05 1-s2.0-S0926860X16301260-main.pdf https://s3.amazonaws.com/prod-ucs-content-store-us-east/content/pii:S0926860X16301260/MAIN/application/pdf/b4070a4e134b96eae6c91c504b6e9ab8/main.pdf main.pdf pdf true 1194701 MAIN 6 1-s2.0-S0926860X16301260-main_1.png https://s3.amazonaws.com/prod-ucs-content-store-us-east/content/pii:S0926860X16301260/PREVIEW/image/png/42d0874e44c5e3d5ce0ca707fa7018d7/main_1.png main_1.png png 51788 849 656 IMAGE-WEB-PDF 1 1-s2.0-S0926860X16301260-fx1.sml https://s3.amazonaws.com/prod-ucs-content-store-us-east/content/pii:S0926860X16301260/fx1/THUMBNAIL/image/gif/57352cf75689d2548e54676fb0f8348c/fx1.sml fx1 true fx1.sml sml 4589 88 219 IMAGE-THUMBNAIL 1-s2.0-S0926860X16301260-gr1.sml https://s3.amazonaws.com/prod-ucs-content-store-us-east/content/pii:S0926860X16301260/gr1/THUMBNAIL/image/gif/09a1a878f600876e907d7ab2899186ba/gr1.sml gr1 gr1.sml sml 11857 114 219 IMAGE-THUMBNAIL 1-s2.0-S0926860X16301260-gr2.sml https://s3.amazonaws.com/prod-ucs-content-store-us-east/content/pii:S0926860X16301260/gr2/THUMBNAIL/image/gif/121a4d473ee0779b7dfb31aa040fb3e8/gr2.sml gr2 gr2.sml sml 13451 164 209 IMAGE-THUMBNAIL 1-s2.0-S0926860X16301260-gr3.sml https://s3.amazonaws.com/prod-ucs-content-store-us-east/content/pii:S0926860X16301260/gr3/THUMBNAIL/image/gif/7ed23eb41b8791e379b2b1f8b5016f3a/gr3.sml gr3 gr3.sml sml 20714 157 219 IMAGE-THUMBNAIL 1-s2.0-S0926860X16301260-gr4.sml https://s3.amazonaws.com/prod-ucs-content-store-us-east/content/pii:S0926860X16301260/gr4/THUMBNAIL/image/gif/3aee5f680760aa9fe87dad92d573cb6a/gr4.sml gr4 gr4.sml sml 17324 146 219 IMAGE-THUMBNAIL 1-s2.0-S0926860X16301260-gr5.sml https://s3.amazonaws.com/prod-ucs-content-store-us-east/content/pii:S0926860X16301260/gr5/THUMBNAIL/image/gif/7fc7f2bf52366c3c7a410390b46c29cd/gr5.sml gr5 gr5.sml sml 17424 124 219 IMAGE-THUMBNAIL 1-s2.0-S0926860X16301260-gr6.sml https://s3.amazonaws.com/prod-ucs-content-store-us-east/content/pii:S0926860X16301260/gr6/THUMBNAIL/image/gif/321f7422f95bad241c0ca76e71a2db61/gr6.sml gr6 gr6.sml sml 12150 113 219 IMAGE-THUMBNAIL 1-s2.0-S0926860X16301260-gr7.sml https://s3.amazonaws.com/prod-ucs-content-store-us-east/content/pii:S0926860X16301260/gr7/THUMBNAIL/image/gif/c866901310767bf9ddfe92484b14d0d0/gr7.sml gr7 gr7.sml sml 14986 120 219 IMAGE-THUMBNAIL 1-s2.0-S0926860X16301260-fx1.jpg https://s3.amazonaws.com/prod-ucs-content-store-us-east/content/pii:S0926860X16301260/fx1/DOWNSAMPLED/image/jpeg/6b893586ba420ff8c766b42e14b749a2/fx1.jpg fx1 true fx1.jpg jpg 19248 200 500 IMAGE-DOWNSAMPLED 1-s2.0-S0926860X16301260-gr1.jpg https://s3.amazonaws.com/prod-ucs-content-store-us-east/content/pii:S0926860X16301260/gr1/DOWNSAMPLED/image/jpeg/dbaedea311ff5e52976483a612f0fed1/gr1.jpg gr1 gr1.jpg jpg 34405 201 386 IMAGE-DOWNSAMPLED 1-s2.0-S0926860X16301260-gr2.jpg https://s3.amazonaws.com/prod-ucs-content-store-us-east/content/pii:S0926860X16301260/gr2/DOWNSAMPLED/image/jpeg/6fedb68d8935b78953f1feeecaa2aca1/gr2.jpg gr2 gr2.jpg jpg 37429 302 386 IMAGE-DOWNSAMPLED 1-s2.0-S0926860X16301260-gr3.jpg https://s3.amazonaws.com/prod-ucs-content-store-us-east/content/pii:S0926860X16301260/gr3/DOWNSAMPLED/image/jpeg/584c42882b19b913730b1ef106e9f6ce/gr3.jpg gr3 gr3.jpg jpg 72412 276 386 IMAGE-DOWNSAMPLED 1-s2.0-S0926860X16301260-gr4.jpg https://s3.amazonaws.com/prod-ucs-content-store-us-east/content/pii:S0926860X16301260/gr4/DOWNSAMPLED/image/jpeg/8dd02d0d85ad22d4cf9d53ab2aa69215/gr4.jpg gr4 gr4.jpg jpg 43735 257 386 IMAGE-DOWNSAMPLED 1-s2.0-S0926860X16301260-gr5.jpg https://s3.amazonaws.com/prod-ucs-content-store-us-east/content/pii:S0926860X16301260/gr5/DOWNSAMPLED/image/jpeg/4b437b54a687ae64a51fdfe19174b5b2/gr5.jpg gr5 gr5.jpg jpg 46917 219 386 IMAGE-DOWNSAMPLED 1-s2.0-S0926860X16301260-gr6.jpg https://s3.amazonaws.com/prod-ucs-content-store-us-east/content/pii:S0926860X16301260/gr6/DOWNSAMPLED/image/jpeg/f756fbad0de95a2fccc836b6a85640ad/gr6.jpg gr6 gr6.jpg jpg 34495 199 386 IMAGE-DOWNSAMPLED 1-s2.0-S0926860X16301260-gr7.jpg https://s3.amazonaws.com/prod-ucs-content-store-us-east/content/pii:S0926860X16301260/gr7/DOWNSAMPLED/image/jpeg/66ce816cd296081c1731f3253a467090/gr7.jpg gr7 gr7.jpg jpg 42746 211 386 IMAGE-DOWNSAMPLED 1-s2.0-S0926860X16301260-fx1_lrg.jpg https://s3.amazonaws.com/prod-ucs-content-store-us-east/content/pii:S0926860X16301260/fx1/HIGHRES/image/jpeg/9c44f80d50117c44cd303c5b7ea380b5/fx1_lrg.jpg fx1 true fx1_lrg.jpg jpg 120720 886 2213 IMAGE-HIGH-RES 1-s2.0-S0926860X16301260-gr1_lrg.jpg https://s3.amazonaws.com/prod-ucs-content-store-us-east/content/pii:S0926860X16301260/gr1/HIGHRES/image/jpeg/dba7ef47eec91fccb08ac3abf896e7d9/gr1_lrg.jpg gr1 gr1_lrg.jpg jpg 172644 889 1708 IMAGE-HIGH-RES 1-s2.0-S0926860X16301260-gr2_lrg.jpg https://s3.amazonaws.com/prod-ucs-content-store-us-east/content/pii:S0926860X16301260/gr2/HIGHRES/image/jpeg/0b6067e83fea00d86a5c69e573a4a259/gr2_lrg.jpg gr2 gr2_lrg.jpg jpg 174958 1337 1708 IMAGE-HIGH-RES 1-s2.0-S0926860X16301260-gr3_lrg.jpg https://s3.amazonaws.com/prod-ucs-content-store-us-east/content/pii:S0926860X16301260/gr3/HIGHRES/image/jpeg/43c1e90133052373b65d971407bfbccd/gr3_lrg.jpg gr3 gr3_lrg.jpg jpg 351728 1223 1708 IMAGE-HIGH-RES 1-s2.0-S0926860X16301260-gr4_lrg.jpg https://s3.amazonaws.com/prod-ucs-content-store-us-east/content/pii:S0926860X16301260/gr4/HIGHRES/image/jpeg/4870e994212ad8ff89641af976eb6621/gr4_lrg.jpg gr4 gr4_lrg.jpg jpg 182904 1136 1708 IMAGE-HIGH-RES 1-s2.0-S0926860X16301260-gr5_lrg.jpg https://s3.amazonaws.com/prod-ucs-content-store-us-east/content/pii:S0926860X16301260/gr5/HIGHRES/image/jpeg/dde8ed7a679933f975fd2f5f0ac54677/gr5_lrg.jpg gr5 gr5_lrg.jpg jpg 187133 970 1708 IMAGE-HIGH-RES 1-s2.0-S0926860X16301260-gr6_lrg.jpg https://s3.amazonaws.com/prod-ucs-content-store-us-east/content/pii:S0926860X16301260/gr6/HIGHRES/image/jpeg/3c3cdf9f97914ecfb4a42e5841fbf0c1/gr6_lrg.jpg gr6 gr6_lrg.jpg jpg 159068 882 1708 IMAGE-HIGH-RES 1-s2.0-S0926860X16301260-gr7_lrg.jpg https://s3.amazonaws.com/prod-ucs-content-store-us-east/content/pii:S0926860X16301260/gr7/HIGHRES/image/jpeg/5871e4d887e4078d556b904d59d791bd/gr7_lrg.jpg gr7 gr7_lrg.jpg jpg 229816 935 1708 IMAGE-HIGH-RES 1-s2.0-S0926860X16301260-si1.gif https://s3.amazonaws.com/prod-ucs-content-store-us-east/content/pii:S0926860X16301260/STRIPIN/image/gif/f5d527008d4e055f6b26176d00f13dff/si1.gif si1 true si1.gif gif 795 14 231 ALTIMG 1-s2.0-S0926860X16301260-si10.gif https://s3.amazonaws.com/prod-ucs-content-store-us-east/content/pii:S0926860X16301260/STRIPIN/image/gif/fca2ef054f7c3bef025e0911e65b2dc7/si10.gif si10 si10.gif gif 1812 35 407 ALTIMG 1-s2.0-S0926860X16301260-si11.gif https://s3.amazonaws.com/prod-ucs-content-store-us-east/content/pii:S0926860X16301260/STRIPIN/image/gif/8ec78247652004370382c5106edadea2/si11.gif si11 si11.gif gif 1873 35 395 ALTIMG 1-s2.0-S0926860X16301260-si12.gif https://s3.amazonaws.com/prod-ucs-content-store-us-east/content/pii:S0926860X16301260/STRIPIN/image/gif/48cf2b5b4301ef24ed62c12e4f8c4603/si12.gif si12 si12.gif gif 570 16 144 ALTIMG 1-s2.0-S0926860X16301260-si13.gif https://s3.amazonaws.com/prod-ucs-content-store-us-east/content/pii:S0926860X16301260/STRIPIN/image/gif/b8bf811870169f5eb9aca56fd8b908c0/si13.gif si13 si13.gif gif 1126 16 305 ALTIMG 1-s2.0-S0926860X16301260-si2.gif https://s3.amazonaws.com/prod-ucs-content-store-us-east/content/pii:S0926860X16301260/STRIPIN/image/gif/b5a2daef121d7161766710acf75cc9ff/si2.gif si2 si2.gif gif 1039 15 308 ALTIMG 1-s2.0-S0926860X16301260-si3.gif https://s3.amazonaws.com/prod-ucs-content-store-us-east/content/pii:S0926860X16301260/STRIPIN/image/gif/800f8b2c7a1780ea41257a9016722fdc/si3.gif si3 si3.gif gif 1183 16 315 ALTIMG 1-s2.0-S0926860X16301260-si4.gif https://s3.amazonaws.com/prod-ucs-content-store-us-east/content/pii:S0926860X16301260/STRIPIN/image/gif/cad72ac4d5ac228348a6881361fe4aaf/si4.gif si4 si4.gif gif 1175 15 377 ALTIMG 1-s2.0-S0926860X16301260-si5.gif https://s3.amazonaws.com/prod-ucs-content-store-us-east/content/pii:S0926860X16301260/STRIPIN/image/gif/f87239321e7eba6d94667ede85b715fd/si5.gif si5 si5.gif gif 1082 16 289 ALTIMG 1-s2.0-S0926860X16301260-si6.gif https://s3.amazonaws.com/prod-ucs-content-store-us-east/content/pii:S0926860X16301260/STRIPIN/image/gif/6d760930155a32ff1cbd8c43faea5c30/si6.gif si6 si6.gif gif 1176 15 357 ALTIMG 1-s2.0-S0926860X16301260-si7.gif https://s3.amazonaws.com/prod-ucs-content-store-us-east/content/pii:S0926860X16301260/STRIPIN/image/gif/372b7e0ab7ec3ba04db9641dcf901e7e/si7.gif si7 si7.gif gif 1196 16 315 ALTIMG 1-s2.0-S0926860X16301260-si8.gif https://s3.amazonaws.com/prod-ucs-content-store-us-east/content/pii:S0926860X16301260/STRIPIN/image/gif/fd7326c631e1c16977273983f45edafc/si8.gif si8 si8.gif gif 1526 36 317 ALTIMG 1-s2.0-S0926860X16301260-si9.gif https://s3.amazonaws.com/prod-ucs-content-store-us-east/content/pii:S0926860X16301260/STRIPIN/image/gif/7da7181af30e161724a28e9d79d1ae8d/si9.gif si9 si9.gif gif 1512 36 314 ALTIMG APCATA 15808 S0926-860X(16)30126-0 10.1016/j.apcata.2016.03.016 Elsevier B.V. Fig. 1 Schematic diagram of experimental setup for bi-reforming reaction. The dotted lines are heat traced to avoid condensation of steam. Fig. 1 Fig. 2 Temperature programmed reduction (TPR) results for 1% LNZ catalyst. The two curves represent two consecutive TPRs with an oxidation step in-between. Fig. 2 Fig. 3 (a) XANES spectra and (b) Fourier transform magnitude of EXAFS for 1%LNZ catalyst in comparison with standards NiO and Ni. Fig. 3 Fig. 4 XRD patterns for fresh and spent 1% LNZ catalyst. The spent catalyst was obtained after bi-reforming reaction at different conditions. Fig. 4 Fig. 5 Time on stream tests under bi-reforming conditions at 750°C and 1atm pressure for 1% LNZ catalyst. Fig. 5 Fig. 6 Activity of 1% LNZ catalyst for bi-reforming reaction at different temperatures. Catalyst was held at each temperature for 24h. The equilibrium conversions are calculated using HSC Chemistry software. Fig. 6 Fig. 7 Temperature programmed oxidation results for spent catalysts after bi-reforming reaction. Fig. 7 Table 1 Hydrogen uptake calculation by deconvoluting the TPR peaks in Fig. 2. Table 1 Peak Temperature (°C) H2 uptake (mg H2/g-cat) 1 305 0.0124 2 352 0.0110 3 411 0.0225 4 550 0.2948 Table 2 EXAFS analysis results summary. Table 2 Ni-O Ni-Ni N* R (Å) σ2 (x10−3) E0 (eV) N* R (Å) σ2 (x10−3) E0 (eV) S0 2 Reduced χ2 NiO Standard 5.63 2.08 5.0±0.001 −1.49±0.11 12.10 2.93 6.0±0.03 −5.36±0.04 0.89 6.67 After TPR/TPO 6.63 2.07 1.3±0.001 0.69±0.11 8.55 2.92 6.0±0.05 −8.33±0.05 0.89 10.85 Fresh Catalyst 6.93 2.00 1.4±0.08 −5.34±0.05 7.48 2.93 8.0±0.03 −9.05±0.02 0.89 10.84 Spent Catalyst 10.32 2.48 6.0±0.10 −3.30±0.01 0.84 12.63 Nickel Foil 11.91 2.47 5.0±0.02 5.82±0.03 0.84 5.18 N—coordination number; R—bond distance (±0.02Å); σ2—Debye-Waller factor; * within ±20%. Table 3 Summary of results for bi-reforming reaction at different temperatures. * Table 3 Temperature (°C) CH4 Conversion (%) CO2 Conversion (%) CO Selectivity (%) CO Yield (%) H2/CO ratio 700 46.9 41.9 95.8 43.5 2.2 750 52.6 48.6 97.3 50.2 2.1 800 60.3 52.1 99.7 58.1 2.3 850 86.7 90.8 99.8 87.6 1.9 900 92.9 98.0 99.8 94.0 1.8 950 96.6 99.1 99.5 96.8 1.9 * All values are reported as within 95% confidence limits. Bi-reforming of methane on Ni-based pyrochlore catalyst Nitin Kumar a Amitava Roy a Zi Wang a Enrico Mario L’Abbate b Daniel Haynes c Dushyant Shekhawat c J.J. Spivey a ⁎ a Louisiana State University, Baton Rouge, LA 70803, USA Louisiana State University Baton Rouge LA 70803 USA b KTH Royal Institute of Technology, Stockholm, Sweden KTH Royal Institute of Technology Stockholm Sweden c National Energy Technology Laboratory, U.S. Department of Energy, Morgantown, WV 26507, USA National Energy Technology Laboratory U.S. Department of Energy Morgantown WV 26507 USA ⁎ Corresponding author. Graphical abstract A Ni-based pyrochlore catalyst was synthesized using the modified Pechini method. In this method, 1wt% Ni was doped into the La2Zr2O7 pyrochlore structure. The catalyst was characterized by H2-TPR, TPO, XRD, and EXAFS, and tested for its methane reforming activity under bi-reforming reaction conditions; i.e., in the presence of CO2 and steam: 3 C H 4 + C O 2 + 2 H 2 O ⇌ 4 CO + 8 H 2 Repeated TPR/TPO cycles showed that the two consecutive TPR spectra do not change, showing that the catalyst is stable at high temperatures, and that the nickel oxidation/reduction process is reversible. The catalyst showed constant activity with time at all temperatures in the range of 700–950°C over a cumulative period of 170h. After this series of bi-reforming tests, TPO of the spent catalyst was carried out, which showed detectable but unquantifiable carbon deposition. The presence of steam in bi-reforming greatly limits carbon deposition compared to directly related dry-reforming tests on this same catalyst. Keywords Reforming Dry-reforming Bi-reforming Pyrochlore Syngas Methane activation 1 Introduction Methane and CO2 are two major greenhouse gases, and converting them to higher value products is still a major challenge, mainly because these compounds are relatively chemically inactive. Moreover, the production and emission of these gases are predicted to increase in the near future [1], suggesting the importance of reactions of these compounds. Catalytic conversion of these gases to produce syngas is a viable option [2,3]. Syngas, a mixture of CO and H2, can be used as an intermediate to produce high value chemicals, such as methanol, higher oxygenates, and Fischer-Tropsch products [4–7]. There are several options to directly convert CH4 and CO2 to syngas: (1) D r y − r e f o r min g : C H 4 + C O 2 ⇌ 2 C O + 2 H 2 Δ H 298 K = + 247 k J / m o l , Δ G 298 K = + 170 k J / m o l (2) O x y − C O 2 r e f o r min g : 3 C H 4 + C O 2 + O 2 ⇌ 4 C O + 6 H 2 Δ H 298 K = + 58 k J / m o l , Δ G 298 K = − 1 k J / m o l (3) B i − r e f o r min g : 3 C H 4 + C O 2 + 2 H 2 O ⇌ 4 C O + 8 H 2 Δ H 298 K = + 220 k J / m o l , Δ G 298 K = + 151 k J / m o l Among these reactions, bi-reforming has attracted interest because it has several advantages, e.g. the 2/1 H2/CO syngas from bi-reforming can be directly converted into products such as methanol and Fischer-Tropsch fuels, eliminating the need to add H2 from external sources. There are many challenges in direct conversion of CH4 and CO2 to syngas, including the highly endothermic nature of the reaction itself, requiring temperatures of ∼800–1000°C. At these demanding conditions, many catalysts are not stable, resulting in collapse of the support structure or severe sintering of the active metal. Another major problem is due to carbon deposition, which results in inevitable deactivation of the catalyst. Therefore, the reforming catalyst must meet at least three criteria: (a) thermal stability of the support, (b) resistance to sintering of the active metal, and (c) high activity with time-on-stream to reach equilibrium conversions. Recent work shows the potential for active metals to be doped into thermally stable crystalline oxides for dry reforming [8–11]. Pyrochlores are one example. These are highly crystalline materials with a general formula of A2B2O7. They have proven high temperature stability in various applications, such as in gas turbine thermal barrier coatings [12]. The pyrochlore structure, in principle, can incorporate active metals such as Ni in the structure at low loadings. This provides a strong interaction between the active metal and the support, which can significantly improve the resistance to carbon deposition [13]. The first report of pyrochlore as catalysts for reforming was by Ashcroft et al. [14], where they tested the structure with several active metals. However, their pyrochlore structure collapsed at dry reforming conditions. The objective of the present work is to test a Ni-based La2Zr2O7 pyrochlore catalyst for bi-reforming of methane. The catalyst was synthesized by modified Pechini method [15,16] and characterized using TPR/TPO, XRD, and EXAFS. The catalyst activity, stability, and selectivity were tested for bi-reforming reaction at temperatures in the range of 700–950°C, with 24h time-on-stream at each temperature. Finally, the carbon deposition for the spent catalyst was studied by TPO. 2 Experimental 2.1 Catalyst preparation The 1% LNZ pyrochlore catalyst was prepared by using a modified Pechini method. The preparation method produces highly uniform pyrochlore crystallites and is explained in detail in the literature [11,15–19]. The precursors used for La, Ni, and Zr were Lanthanum nitrate [La(NO3)3·6H2O] (GFS Chemicals), Nickel nitrate [Ni(NO3)2·6H2O], and Zirconium nitrate [ZrO(NO3)2.nH2O] (Alfa Aesar) respectively. The nitrate salts were separately dissolved in de-ionized water and then mixed with a citric acid (CA) solution in a molar ratio of CA:metal=1.2:1. The solution was continuously stirred and heated to 75°C to ensure complete metal complexation. At 75°C, a 1:1 molar ratio of ethylene glycol (EG) to CA was added to the solution. The solution was kept stirred on the hot plate until most of the water had evaporated and a transparent, viscous gel was obtained. After this the stirring was stopped and the gel was left on the hot plate to promote the polyesterification reaction between EG and CA to form an organic polymeric network. The nitrate precursors started to decompose at this condition, which was evident from the large plumes of NOx and bubbling in the gel. The resulting mixture foam was placed in an oven at 110°C to dry overnight. The mixture was then calcined at 1000°C for 8h to oxidize the organic precursors to form the pyrochlore catalyst. The bulk density of the catalyst was measured to be 0.77g/cc. 2.2 Temperature programmed reduction (TPR) Temperature programmed reduction (TPR) profiles of the calcined catalyst were recorded using an Altamira AMI 200 unit equipped with a thermal conductivity detector (TCD). 50mg of catalyst sample was first oxidized in a fixed-bed micro-reactor system under flowing 5% O2/He at 950°C. It was then cooled to 25°C under helium flow. TPR was performed using a 10% H2/Ar mixture at a flow rate of 50cm3/min while the temperature was linearly ramped from 25°C to 950°C at 10°C/min. The catalyst was then cooled to 25°C under helium flow and then again oxidized under 5% O2/He at 950°C. The catalyst was again cooled to back 25°C under helium flow. A second TPR was carried out under the same conditions as those of the first TPR mentioned above. The hydrogen consumptions under different peaks were calculated by deconvoluting the TPR profile and calculating the areas under the individual peaks, which directly correspond to hydrogen consumption. The thermal conductivity detector was calibrated with a standard silver oxide sample, where area under the peak was correlated to the H2 consumption. 2.3 X-ray characterizations X-ray absorption (XAS) spectra were measured at the electron storage ring of the Center for Advanced Microstructures and Devices (CAMD), Louisiana State University, USA. This synchrotron light source operates the storage ring at 1.3GeV with a ring current between 50 and 150mA. The measurements were made at the High Energy X-Ray Absorption Spectroscopy Beamline located on an 11-pole, 7.5T multi-pole wiggler. The edge was calibrated to 8333eV with a nickel foil. XAS spectra were collected for the Ni K-edge in fluorescence mode from −200eV to 14k relative to the Ni K-edge energy. The steps were 5eV from −200eV to −30eV, 0.3eV from −30eV to 30eV around the edge, and 0.05k up to 14k. Fluorescence spectra were obtained with an 80mm2 Ketek silicon drift detector by averaging at least four to five scans. XAS spectra were also collected for reagent grade NiO (Alfa Aesar) and nickel foil in transmission. Spectra were analyzed with Athena [20] in Demeter and WinXAS [21]. In extended X-ray absorption fine structure (EXAFS) analysis the amplitude reduction factor (S0 2) was obtained from standards and kept fixed for the catalyst spectra. X-ray diffraction (XRD) experiments were carried out using Empyrean x-ray diffractometer (PANalytical) using Cu Kα radiation (λ=1.5406Å). The scan angle was varied from 0° to 90° with a step size of 0.017°. Data analysis was done using the software X’Pert HighScorePlus (v3.0). 2.4 Catalyst activity test Catalytic activity tests were carried out in a ¼” size flow reactor made of quartz, which can withstand up to 1200°C under 1atm. The pretreatment of the catalyst involved oxidation under 10% O2/He flow at a temperature of 800°C before cooling down to room temperature under pure helium. The catalyst was then reduced under 10% H2/He flow at 800°C. After the reduction, the catalyst was cooled to the reaction temperature under helium flow. The schematic of the reactor and gas analysis system is presented in Fig. 1 . The reactor system consists of various mass flow controllers for metered flow of gases. The water was fed to the reactor using a HPLC pump. The water flows through a vaporizer where steam is formed, which is later mixed with other gases before flowing through the catalyst bed. The dotted lines in Fig. 1 represent heat-traced lines, which were typically kept at 200°C to avoid any condensation of steam. The reactor is equipped with a thermocouple that is inserted directly into the catalyst bed to measure the actual temperature of the catalyst. Both ends of the catalyst bed were plugged with quartz wool to avoid entrainment of any catalyst particles with the gas stream. Outlet gases were analyzed using an inline gas chromatograph (GC) equipped with a flame ionization detector (FID). The GC uses a Restek™ RT-Q Bond column (25m), where helium is used as a carrier gas. Part of the gases coming out of the GC column was split and fed to a mass spectrometer (MS) at the same time as FID to check the reproducibility of the analysis. Both, FID and MS detectors were calibrated with standard gas mixtures using a minimum of 3-point calibration, corresponding to 3 different concentrations. A calibration curve was made for each component and used for the reaction data analysis. Mass spectrometer was calibrated with various concentrations of water, since it cannot be detected in the FID. The GC/FID system (Shimadzu GC-2014) is also equipped with two thermal conductivity detectors (TCD), used to analyze CO, CO2 and H2. The bi-reforming reaction was carried out at temperatures starting from 700°C till 950°C, in the increment of 50°C. The catalyst was kept for 24h at each temperature to reach the steady state. At the end of the reaction, the temperature was brought back to 750°C in order to have a comparison with the previous results and see the deactivation of the catalyst after high temperature runs. A temperature programmed oxidation (TPO) was carried out on the spent catalyst after the reaction. For TPO, the catalyst was heated from room temperature to 950°C under 10%O2/He mixture and CO2 signal was recorded in a mass spectrometer. A blank experiment was carried out at bi-reforming conditions to see the activity of the reactor without the catalyst. For blank experiment, quartz wool was used in the quartz tube and temperature was increased from 700°C till 950°C in the increment of 50°C. The gas and water flow rates were kept the same as those of the experimental conditions and samples were taken at each temperature. The results presented in this work are after subtraction of the blank experiment results at the corresponding conditions. The carbon balance is within 95% confidence limits. The gases used for the reactions were 10%CO2/He, and 10%CH4/He. The experiments were carried out at 1atm pressure and space velocity of 98,700scch−1 g-cat−1. The following molar ratios of various gases were used for the bi-reforming reaction on a helium free basis. All in mol%: CO2 =16, CH4 =51, H2O=33. The molar ratios were kept close to the stoichiometric ratios for the bi-reforming reaction (Reaction (3)). Following relations were used for calculating various parameters. C H 4 Conversion ( % ) = [ C H 4 ] in − [ C H 4 ] out [ C H 4 ] in × 100 C O 2 Conversion ( % ) = [ C O 2 ] i n − [ C O 2 ] out [ C O 2 ] in × 100 CO Selectivity ( % ) = moles of CO produced Total moles of carbon produced × 100 CO Yield ( % ) = Actual amount of CO formed Theoretical amount of CO expected × 100 For CO selectivity calculations, total moles of carbon produced was calculated by counting all the carbons in the product, except those in the unconverted CH4 and CO2. For yield calculations, the theoretical amount of product was calculated from the stoichiometry of the bi-reforming reaction. 3 Results and discussion 3.1 Temperature programmed reduction The TPR results are shown in Fig. 2 . The two spectra represent two consecutive identical TPRs with an intermediate oxidation step. The reason is to determine the reproducibility of the reduction process and to investigate whether the catalyst retains its structure in the second TPR after the high temperature treatment in the first TPR. Fig. 2 shows that these two successive TPR profiles are fully reproducible, which indicates that the reduction of NiO and oxidation of metallic Ni are completely reversible. At least as measured by TPRs, there is no detectable change in the structure of the catalyst, nor any sintering of the metal as a result of exposure to hydrogen up to 950°C. Fig. 2 also shows a series of reduction steps from nickel oxide to metallic nickel. These four steps correspond to four peaks in the TPR. The peak at 305°C can be attributed to the reduction of bulk NiO [22,23]. The two peaks at 352°C and 411°C can be assigned due to the sequential reduction of Ni3+ to Ni2+ and Ni2+ to Ni0, respectively [24]. Finally, most of the nickel in the catalyst is reduced under the peak at 550°C, which can be attributed to the reduction of highly dispersed NiO species, which appear to be interacting strongly with the pyrochlore structure [25]. This could be the result of initial stage of crystal formation between the Ni and the La, which is known to form mixed oxides at the temperatures used for the calcination of these catalysts (e.g. La2NiO4). Another alternative explanation has been suggested by Rodulfo et al. [23], who assigned the high temperature peak at 565°C due to the reduction of a new phase formed by solid-state reaction of NiO with the La2O3 support. In our case, however, this does not seem like a possibility because the EXAFS results (discussed in the next section) clearly show the presence of NiO species. The amount of H2 consumed by reducible nickel species per gram of catalyst is shown in Table 1 . Although there are several distinct transitions of the nickel, the greatest proportion is due to relatively dispersed clusters, which interact closely with the support. It can also be seen from Table 1 that the ratio of peak 3 to peak 2 is approximately 2, which corresponds to the stoichiometry for the reduction of Ni3+ →Ni2+ (under peak 2) and Ni2+ →Ni0 (under peak 3). This supports these peak assignments. 3.2 X-ray absorption spectroscopy (XAS) X-ray absorption near edge structure (XANES) Ni K-edge spectra of the catalyst in various states along with those of the standards are shown in Fig. 3 . After the TPR/TPO cycle, the catalyst is left in an oxidized state with TPO being the last treatment. There is a strong similarity between the NiO standard, the fresh catalyst, and the catalyst after the TPR/TPO cycle. The peaks, for example, the white line A and higher energy peak B in Fig. 3a are at identical energies, suggesting that the nickel in the catalyst is in the form of NiO. This also suggests that no new phase of nickel is formed by the solid state reaction with the support. However, the peak intensities are weaker, indicating a lower degree of crystallinity. The catalyst after TPR/TPO cycle does not change with respect to the fresh catalyst, suggesting that the catalyst is not affected by the cycles of heat treatments under these cyclic reducing and oxidizing conditions. In contrast, the spent catalyst after the bi-reforming reaction is very similar to metallic Ni with reduced amplitudes, indicating poor crystallinity. The white line for the spent catalyst (peakC) is slightly different. Linear combination fitting (by Athena [20]) shows a small amount of NiO (13%), while the rest of the Ni is still in the metallic form after bi-reforming reaction. Results from EXAFS analysis using WinXAS [21] are shown in Table 2 and the Fourier transform magnitude are shown in Fig. 3b. Only the first shell (Ni–Ni) was fitted for the spent catalyst while first two shells were fitted for the NiO catalyst. Qualitatively the higher shells of all the catalysts show reduced amplitude, indicative of degree of crystallinity (Fig. 3b). The goodness of fit criterion (χ2) is higher for the catalyst compared to those of the standards due to higher noise in the spectra. Ni-O first shell for the fresh catalyst and the one after the TPR/TPO cycle shows a slightly higher coordination and a high Debye-Waller factor. The higher values are within error, however. The first shell appears slightly contracted in the fresh catalyst, but is quite similar to that of the crystalline NiO after the TPR/TPO cycle. In these catalysts, the second shell (Ni-Ni) distance is identical to that of crystalline NiO, but the coordination is reduced. The Ni–Ni shell for the spent catalyst is similar to that of the metallic nickel with a slightly reduced coordination, suggesting a higher dispersion. From the EXAFS results it is clear that reduction and oxidation are reversible and has no effect on the bond distances of Ni-O or Ni–Ni species. This is consistent with the TPR results discussed above. 3.3 X-ray diffraction (XRD) The XRD results for the fresh 1%LNZ and the spent catalysts are shown in Fig. 4 . The spent catalyst was obtained after the bi-reforming reaction, during which the catalyst underwent temperatures from 700°C to 950°C for a cumulative period of 170h. Fig. 4 shows that there is no change in the peak ratios or positions for the fresh and spent catalysts, which indicates that the crystalline structure of the catalyst does not change under bi-reforming conditions. All the peaks seen in Fig. 4 correspond to that of the La2Zr2O7. No peaks corresponding to NiO or metallic Ni phases are observed, due to low metal loading and high dispersion of Ni in the catalyst. These results also support the argument that the pyrochlore structure is unaffected as a result of reforming at high temperatures. Ashcroft et al. [14] also used pyrochlore catalysts containing rare earth metals to study dry reforming, but their structure was not stable and they observed a breakdown of the pyrochlore structure during the dry reforming at 660°C. In our case, on the other hand, the XRD pattern for spent catalyst was not affected by the bi-reforming tests, indicating a high degree of thermal resistance of the catalyst. 3.4 Catalyst activity Results for the activity of 1%LNZ catalyst for bi-reforming reaction are discussed in the following sections. 3.4.1 Blank runs for bi-reforming Blank runs were carried out under bi-reforming conditions at different temperatures (700–950°C). The CO2 and CH4 conversions were calculated corresponding to each temperature. Methane conversion in the absence of catalyst was below 0.75% at 950°C and was less than detectable limit below 750°C. 3.4.2 Time-on-stream studies The results for 1%LNZ catalyst tested under bi-reforming conditions are presented in Fig. 5 . Here, CO2 and CH4 conversions are plotted as a function of time-on-stream at 750°C. The catalyst does not deactivate for at least 24h time on stream at 750°C under bi-reforming conditions. The same catalyst has been studied for dry-reforming of methane [11] and deactivated rapidly at 750°C. It has been reported [26–30] that the presence of oxidizing agents, such as O2 or H2O, can help remove surface carbon deposited during the reaction. The mechanism of carbon removal is generally thought to be due to the oxidation of the carbon precursor species (partially dehydrogenated CHx species and/or C(s)) in the presence of H2O [26]. The following example illustrates these types of reactions. C ( s ) + H 2 O ⇌ C O + H 2 Δ H 750 C = + 132 k J / m o l , Δ G 750 C = − 60 k J / m o l 3.4.3 Catalyst activity for bi-reforming The activity of 1%LNZ catalyst as a function of temperature under bi-reforming conditions is shown in Fig. 6 . Both CH4 and CO2 conversions increase rapidly when temperature is increased from 800°C to 850°C. Fig. 6 also compares the equilibrium conversions for CH4 and CO2 with that of the experimental conversions. Both CH4 and CO2 conversions approach near equilibrium at temperatures ≥850°C. Table 3 summarizes the results obtained for the bi-reforming reaction at different temperatures. The CO selectivity was greater than 95% at all the conditions, while the CO yield increased with temperature. The H2/CO ratio was found to be close to 2/1at all temperatures. This agrees with the literature on bi-reforming [29,31]. There are very few reports in the literature on the bi-reforming reaction, and none directly comparable to those presented here. Olah et al. [31,32] performed the bi-reforming reaction over 15%NiO/MgO catalyst at 7atm pressure and 830°C and showed constant activity of the catalyst for about 320h. The activities reported in the present work, although cannot be directly compared due to different conditions, are comparable to that reported by Olah et al. Chaudhary et al. [29] carried out bi-reforming tests on Ni OCaO (Ni/Ca=3) catalyst at 850°C at GHSV=32,250cm3 g−1 h−1 and reported no deactivation of the catalyst after 10h time-on-stream. Their H2/CO ratio was similar to what we report here at the comparable feed ratio of H2O/CO2. The H2/CO ratio has been found to be a strong function of the feed composition, particularly the ratio of H2O/CO2 [29]. Another report [33] shows that 5% Co-Pt/Al2O3 catalyst is active and stable for bi-reforming at much lower temperatures than those studied here. Koo et al. [34] used Ni-Ce/MgAl2O4 (Ce/Ni=0.25) catalyst for bi-reforming and their CH4 and CO2 conversions at 700°C were significantly higher than those reported here, probably because of a highly active catalyst and different feed ratios. Their catalyst was also found to be resistant to carbon deposition. They attributed this due to the high Ni dispersion and high oxygen storage capacity resulting from the intimate contact between Ni and CeO2 on the surface of the catalyst [35]. 3.5 Carbon deposition studies The carbon deposition was studied using temperature programmed oxidation (TPO) for the spent catalysts from bi-reforming reaction. The results for CO2 signal (mass 44) are plotted in Fig. 7 . Fig. 7 shows a very small peak at around 500°C that can be assigned due to atomic carbon, Cα, which can be relatively easily oxidized [1,33,36]. The amount of carbon is too small to quantify within error limits, but is apparent, as noted in the greatly expanded y-axis of Fig. 7. The presence of a negligible amount of carbon indicates that the catalyst is resistant to carbon deposition under bi-reforming reaction conditions. This can explain the lack of measurable deactivation during bi-reforming, as seen in Figs. 5 and 6. As previously shown, the catalyst retains its activity under bi-reforming conditions. This is consistent with both, the lack of any significant carbon deposition, and the fact that nickel remains in the active, metallic state with no sign of oxidation, as shown in Fig. 3, at least at the conditions studied here. 4 Conclusions The results presented here show that the Ni-based pyrochlore catalysts prepared by modified Pechini method is active and stable under bi-reforming conditions. The repeated TPRs with an intermediate TPO confirm that the reduction and oxidation of nickel is fully reversible, and there is no sintering of the active metal. XRD of fresh and spent catalysts also indicate that the pyrochlore structure is maintained throughout the tests reported here. The EXAFS results show that nickel in the spent pyrochlore catalyst is in the reduced state, consistent with its activity during the reaction. TPO of the spent catalyst shows only very little carbon deposition, consistent with the lack of deactivation at least over a cumulative period of 170h. Under bi-reforming conditions, the H2/CO ratio was close to 2/1 for all temperatures in the range of 700–950°C. The conversions approach equilibrium values for temperatures at and above 850°C. The 1% Ni pyrochlore catalyst shows promising results for bi-reforming with virtually no carbon deposition and stable activity. It is likely that steam concentrations greater than the stoichiometric in bi-reforming would oxidize Ni because of an overall oxidative atmosphere, deactivating the catalyst. Acknowledgements We acknowledge financial support from Climate Change and Emissions Management Corporation (CCEMC), Canada. Dr. Arun Raju at UC, Riverside is gratefully acknowledged for bi-reforming process development. References [1] Nitin Kumar Maryam Shojaee J.J. Spivey Curr. Opin. Chem. Eng. 9 2015 8 15 [2] Andrew P.E. York Tiancun Xiao Malcom L.H. Green Top. Catal. 22 3–4 2003 345 358 [3] Jasmin Blanchard Ana Julia Nsungui Nicolas Abatzoglou Francois Gitzhofer Can. J. Chem. Eng. 85 6 2007 889 899 [4] N. Kumar M.L. Smith J.J. Spivey J. Catal. 289 2012 218 226 [5] Nitin Kumar E.A. Payzant K. Jothimurugesan J.J. Spivey Phys. Chem. Chem. Phys. 13 2011 14735 14741 [6] Nitin Kumar K. Jothimurugesan George G. Stanley Viviane Schwartz J.J. Spivey J. Phys. Chem. C 115 4 2011 990 998 [7] James J. Spivey Adefemi Egbebi Chem. Soc. Rev. 36 2007 1514 1528 [8] Devendra Pakhare James Spivey Chem. Soc. Rev. 43 22 2014 7813 7837 [9] Devendra Pakhare Hongyi Wu Savinay Narendra Victor Abdelsayed Daniel Haynes Dushyant Shekhawat David Berry James Spivey Appl. Petrochem. Res. 3 3–4 2013 117 129 [10] Devendra Pakhare Daniel Haynes Dushyant Shekhawat James Spivey Appl. Petrochem. Res. 2 1–2 2012 27 35 [11] Sarthak Gaur Daniel J. Haynes James J. Spivey Appl. Cata. A: Gen. 403 1–2 2011 142 151 [12] C.S. Ramachandran V. Balasubramanian P.V. Ananthapadmanabhan Ceram. Int. 39 2 2013 1413 1431 [13] Chang-jun Liu Jingyun Ye Jiaojun Jiang Yunxiang Pan ChemCatChem 3 3 2011 529 541 [14] A.T. Ashcroft, A.K. Cheetham, R.H. Jones, S. Natarajan, J.M. Thomas, D. Waller, Soc.f Chem. (1992). 114 (Catalysis and Surface Characterisation), 184–189. [15] P.M. Pechini, U. Patents, Editor. 1967, Sprague Electric Co.: USA. [16] Daniel J. Haynes David A. Berry Dushyant Shekhawat James J. Spivey Catal. Today 136 3–4 2008 206 213 [17] F. Tietz A. Schmidt M. Zahid J. Solid State Chem. 177 3 2004 745 751 [18] Abdul Majid Jim Tunney Steve Argue Dashan Wang Mike Post Jim Margeson J. Alloys Compd. 398 1–2 2005 48 54 [19] F.J. Lepe J. Fernández-Urbán L. Mestres M.L. Martínez-Sarrión J. Power Sources 151 2005 74 78 [20] B. Ravel M. Newville J. Synchrotron Radiat. (Wiley—Blackwell) 12 4 2005 537 541 [21] T. Ressler J. Synchrotron Radiat. 5 2 1998 118 122 [22] C.S. Bai S. Soled R. Kershaw K. Dwight A. Wold J. Solid State Chem. 100 2 1992 307 312 [23] Serbia M.A. Rodulfo-Baechler Wilfredo Pernía Ismael Aray Humberto Figueroa Sergio L. González-Cortés Catal. Lett. 112 3–4 2006 231 237 [24] Sania Maria de Lima Mansur Assaf Jose Mater. Res. 5 No. 3 2002 329 335 [25] Brynmor Mile Diane Stirling Michael A. Zammitt Antony Lovell Maurice Webb J. Catal. 114 2 1988 217 229 [26] V.R. Choudhary K.C. Mondal Appl. Energ. 83 9 2006 1024 1032 [27] V.R. Choudhary K.C. Mondal T.V. Choudhary Fuel 85 17–18 2006 2484 2488 [28] V.R. Choudhary K.C. Mondal T.V. Choudhary Energy Fuels 20 5 2006 1753 1756 [29] V.R. Choudhary A.M. Rajput Ind. Eng. Chem. Res. 35 11 1996 3934 3939 [30] V.R. Choudhary B.S. Uphade A.S. Mamman Appl. Cata. A: Gen. 168 1 1998 33 46 [31] George A. Olah Alain Goeppert Miklos Czaun G.K. Surya Prakash J. Amer. Chem. Soc. 135 2 2012 648 650 [32] George A. Olah Alain Goeppert Miklos Czaun Thomas Mathew Robert B. May G.K. Surya Prakash J. Amer. Chem. Soc. 137 27 2015 8720 8729 [33] S.S. Itkulova G.D. Zakumbaeva Y.Y. Nurmakanov A.A. Mukazhanova A.K. Yermaganbetova Catal. Today 228 0 2014 194 198 [34] Kee Young Koo Sung-hun Lee Un-Ho Jung Hyun-Seog Roh Wang Lai Yoon Fuel Process. Technol. 119 0 2014 151 157 [35] Kee Young Koo Hyun-Seog Roh Un-Ho Jung Wang Lai Yoon Catal. Today 185 1 2012 126 130 [36] D.L. Trimm Catal. Today 37 3 1997 233 238",
      "scopus-id": "84961627476",
      "coredata": {
        "eid": "1-s2.0-S0926860X16301260",
        "dc:description": "A Ni-based pyrochlore catalyst was synthesized using the modified Pechini method. In this method, 1wt% Ni was doped into the La2Zr2O7 pyrochlore structure. The catalyst was characterized by H2-TPR, TPO, XRD, and EXAFS, and tested for its methane reforming activity under bi-reforming reaction conditions; i.e., in the presence of CO2 and steam: 3 C H 4 + C O 2 + 2 H 2 O ⇌ 4 CO + 8 H 2 Repeated TPR/TPO cycles showed that the two consecutive TPR spectra do not change, showing that the catalyst is stable at high temperatures, and that the nickel oxidation/reduction process is reversible. The catalyst showed constant activity with time at all temperatures in the range of 700–950°C over a cumulative period of 170h. After this series of bi-reforming tests, TPO of the spent catalyst was carried out, which showed detectable but unquantifiable carbon deposition. The presence of steam in bi-reforming greatly limits carbon deposition compared to directly related dry-reforming tests on this same catalyst.",
        "openArchiveArticle": "false",
        "prism:coverDate": "2016-05-05",
        "openaccessUserLicense": null,
        "prism:aggregationType": "Journal",
        "prism:url": "https://api.elsevier.com/content/article/pii/S0926860X16301260",
        "dc:creator": [
          {
            "@_fa": "true",
            "$": "Kumar, Nitin"
          },
          {
            "@_fa": "true",
            "$": "Roy, Amitava"
          },
          {
            "@_fa": "true",
            "$": "Wang, Zi"
          },
          {
            "@_fa": "true",
            "$": "L’Abbate, Enrico Mario"
          },
          {
            "@_fa": "true",
            "$": "Haynes, Daniel"
          },
          {
            "@_fa": "true",
            "$": "Shekhawat, Dushyant"
          },
          {
            "@_fa": "true",
            "$": "Spivey, J.J."
          }
        ],
        "link": [
          {
            "@_fa": "true",
            "@rel": "self",
            "@href": "https://api.elsevier.com/content/article/pii/S0926860X16301260"
          },
          {
            "@_fa": "true",
            "@rel": "scidir",
            "@href": "https://www.sciencedirect.com/science/article/pii/S0926860X16301260"
          }
        ],
        "dc:format": "application/json",
        "openaccessType": null,
        "pii": "S0926-860X(16)30126-0",
        "prism:volume": "517",
        "prism:publisher": "Elsevier B.V. Published by Elsevier B.V.",
        "dc:title": "Bi-reforming of methane on Ni-based pyrochlore catalyst",
        "prism:copyright": "Copyright © 2016 Elsevier B.V. Published by Elsevier B.V. All rights reserved.",
        "openaccess": "0",
        "prism:issn": "0926860X",
        "dcterms:subject": [
          {
            "@_fa": "true",
            "$": "Reforming"
          },
          {
            "@_fa": "true",
            "$": "Dry-reforming"
          },
          {
            "@_fa": "true",
            "$": "Bi-reforming"
          },
          {
            "@_fa": "true",
            "$": "Pyrochlore"
          },
          {
            "@_fa": "true",
            "$": "Syngas"
          },
          {
            "@_fa": "true",
            "$": "Methane activation"
          }
        ],
        "openaccessArticle": "false",
        "prism:publicationName": "Applied Catalysis A: General",
        "openaccessSponsorType": null,
        "prism:pageRange": "211-216",
        "prism:endingPage": "216",
        "pubType": "fla",
        "prism:coverDisplayDate": "5 May 2016",
        "prism:doi": "10.1016/j.apcata.2016.03.016",
        "prism:startingPage": "211",
        "dc:identifier": "doi:10.1016/j.apcata.2016.03.016",
        "openaccessSponsorName": null
      },
      "objects": {
        "object": [
          {
            "@category": "thumbnail",
            "@height": "88",
            "@width": "219",
            "@_fa": "true",
            "$": "https://api.elsevier.com/content/object/eid/1-s2.0-S0926860X16301260-fx1.sml?httpAccept=%2A%2F%2A",
            "@multimediatype": "GIF image file",
            "@type": "IMAGE-THUMBNAIL",
            "@size": "4589",
            "@ref": "fx1",
            "@mimetype": "image/gif"
          },
          {
            "@category": "thumbnail",
            "@height": "114",
            "@width": "219",
            "@_fa": "true",
            "$": "https://api.elsevier.com/content/object/eid/1-s2.0-S0926860X16301260-gr1.sml?httpAccept=%2A%2F%2A",
            "@multimediatype": "GIF image file",
            "@type": "IMAGE-THUMBNAIL",
            "@size": "11857",
            "@ref": "gr1",
            "@mimetype": "image/gif"
          },
          {
            "@category": "thumbnail",
            "@height": "164",
            "@width": "209",
            "@_fa": "true",
            "$": "https://api.elsevier.com/content/object/eid/1-s2.0-S0926860X16301260-gr2.sml?httpAccept=%2A%2F%2A",
            "@multimediatype": "GIF image file",
            "@type": "IMAGE-THUMBNAIL",
            "@size": "13451",
            "@ref": "gr2",
            "@mimetype": "image/gif"
          },
          {
            "@category": "thumbnail",
            "@height": "157",
            "@width": "219",
            "@_fa": "true",
            "$": "https://api.elsevier.com/content/object/eid/1-s2.0-S0926860X16301260-gr3.sml?httpAccept=%2A%2F%2A",
            "@multimediatype": "GIF image file",
            "@type": "IMAGE-THUMBNAIL",
            "@size": "20714",
            "@ref": "gr3",
            "@mimetype": "image/gif"
          },
          {
            "@category": "thumbnail",
            "@height": "146",
            "@width": "219",
            "@_fa": "true",
            "$": "https://api.elsevier.com/content/object/eid/1-s2.0-S0926860X16301260-gr4.sml?httpAccept=%2A%2F%2A",
            "@multimediatype": "GIF image file",
            "@type": "IMAGE-THUMBNAIL",
            "@size": "17324",
            "@ref": "gr4",
            "@mimetype": "image/gif"
          },
          {
            "@category": "thumbnail",
            "@height": "124",
            "@width": "219",
            "@_fa": "true",
            "$": "https://api.elsevier.com/content/object/eid/1-s2.0-S0926860X16301260-gr5.sml?httpAccept=%2A%2F%2A",
            "@multimediatype": "GIF image file",
            "@type": "IMAGE-THUMBNAIL",
            "@size": "17424",
            "@ref": "gr5",
            "@mimetype": "image/gif"
          },
          {
            "@category": "thumbnail",
            "@height": "113",
            "@width": "219",
            "@_fa": "true",
            "$": "https://api.elsevier.com/content/object/eid/1-s2.0-S0926860X16301260-gr6.sml?httpAccept=%2A%2F%2A",
            "@multimediatype": "GIF image file",
            "@type": "IMAGE-THUMBNAIL",
            "@size": "12150",
            "@ref": "gr6",
            "@mimetype": "image/gif"
          },
          {
            "@category": "thumbnail",
            "@height": "120",
            "@width": "219",
            "@_fa": "true",
            "$": "https://api.elsevier.com/content/object/eid/1-s2.0-S0926860X16301260-gr7.sml?httpAccept=%2A%2F%2A",
            "@multimediatype": "GIF image file",
            "@type": "IMAGE-THUMBNAIL",
            "@size": "14986",
            "@ref": "gr7",
            "@mimetype": "image/gif"
          },
          {
            "@category": "standard",
            "@height": "200",
            "@width": "500",
            "@_fa": "true",
            "$": "https://api.elsevier.com/content/object/eid/1-s2.0-S0926860X16301260-fx1.jpg?httpAccept=%2A%2F%2A",
            "@multimediatype": "JPEG image file",
            "@type": "IMAGE-DOWNSAMPLED",
            "@size": "19248",
            "@ref": "fx1",
            "@mimetype": "image/jpeg"
          },
          {
            "@category": "standard",
            "@height": "201",
            "@width": "386",
            "@_fa": "true",
            "$": "https://api.elsevier.com/content/object/eid/1-s2.0-S0926860X16301260-gr1.jpg?httpAccept=%2A%2F%2A",
            "@multimediatype": "JPEG image file",
            "@type": "IMAGE-DOWNSAMPLED",
            "@size": "34405",
            "@ref": "gr1",
            "@mimetype": "image/jpeg"
          },
          {
            "@category": "standard",
            "@height": "302",
            "@width": "386",
            "@_fa": "true",
            "$": "https://api.elsevier.com/content/object/eid/1-s2.0-S0926860X16301260-gr2.jpg?httpAccept=%2A%2F%2A",
            "@multimediatype": "JPEG image file",
            "@type": "IMAGE-DOWNSAMPLED",
            "@size": "37429",
            "@ref": "gr2",
            "@mimetype": "image/jpeg"
          },
          {
            "@category": "standard",
            "@height": "276",
            "@width": "386",
            "@_fa": "true",
            "$": "https://api.elsevier.com/content/object/eid/1-s2.0-S0926860X16301260-gr3.jpg?httpAccept=%2A%2F%2A",
            "@multimediatype": "JPEG image file",
            "@type": "IMAGE-DOWNSAMPLED",
            "@size": "72412",
            "@ref": "gr3",
            "@mimetype": "image/jpeg"
          },
          {
            "@category": "standard",
            "@height": "257",
            "@width": "386",
            "@_fa": "true",
            "$": "https://api.elsevier.com/content/object/eid/1-s2.0-S0926860X16301260-gr4.jpg?httpAccept=%2A%2F%2A",
            "@multimediatype": "JPEG image file",
            "@type": "IMAGE-DOWNSAMPLED",
            "@size": "43735",
            "@ref": "gr4",
            "@mimetype": "image/jpeg"
          },
          {
            "@category": "standard",
            "@height": "219",
            "@width": "386",
            "@_fa": "true",
            "$": "https://api.elsevier.com/content/object/eid/1-s2.0-S0926860X16301260-gr5.jpg?httpAccept=%2A%2F%2A",
            "@multimediatype": "JPEG image file",
            "@type": "IMAGE-DOWNSAMPLED",
            "@size": "46917",
            "@ref": "gr5",
            "@mimetype": "image/jpeg"
          },
          {
            "@category": "standard",
            "@height": "199",
            "@width": "386",
            "@_fa": "true",
            "$": "https://api.elsevier.com/content/object/eid/1-s2.0-S0926860X16301260-gr6.jpg?httpAccept=%2A%2F%2A",
            "@multimediatype": "JPEG image file",
            "@type": "IMAGE-DOWNSAMPLED",
            "@size": "34495",
            "@ref": "gr6",
            "@mimetype": "image/jpeg"
          },
          {
            "@category": "standard",
            "@height": "211",
            "@width": "386",
            "@_fa": "true",
            "$": "https://api.elsevier.com/content/object/eid/1-s2.0-S0926860X16301260-gr7.jpg?httpAccept=%2A%2F%2A",
            "@multimediatype": "JPEG image file",
            "@type": "IMAGE-DOWNSAMPLED",
            "@size": "42746",
            "@ref": "gr7",
            "@mimetype": "image/jpeg"
          },
          {
            "@category": "high",
            "@height": "886",
            "@width": "2213",
            "@_fa": "true",
            "$": "https://api.elsevier.com/content/object/eid/1-s2.0-S0926860X16301260-fx1_lrg.jpg?httpAccept=%2A%2F%2A",
            "@multimediatype": "JPEG image file",
            "@type": "IMAGE-HIGH-RES",
            "@size": "120720",
            "@ref": "fx1",
            "@mimetype": "image/jpeg"
          },
          {
            "@category": "high",
            "@height": "889",
            "@width": "1708",
            "@_fa": "true",
            "$": "https://api.elsevier.com/content/object/eid/1-s2.0-S0926860X16301260-gr1_lrg.jpg?httpAccept=%2A%2F%2A",
            "@multimediatype": "JPEG image file",
            "@type": "IMAGE-HIGH-RES",
            "@size": "172644",
            "@ref": "gr1",
            "@mimetype": "image/jpeg"
          },
          {
            "@category": "high",
            "@height": "1337",
            "@width": "1708",
            "@_fa": "true",
            "$": "https://api.elsevier.com/content/object/eid/1-s2.0-S0926860X16301260-gr2_lrg.jpg?httpAccept=%2A%2F%2A",
            "@multimediatype": "JPEG image file",
            "@type": "IMAGE-HIGH-RES",
            "@size": "174958",
            "@ref": "gr2",
            "@mimetype": "image/jpeg"
          },
          {
            "@category": "high",
            "@height": "1223",
            "@width": "1708",
            "@_fa": "true",
            "$": "https://api.elsevier.com/content/object/eid/1-s2.0-S0926860X16301260-gr3_lrg.jpg?httpAccept=%2A%2F%2A",
            "@multimediatype": "JPEG image file",
            "@type": "IMAGE-HIGH-RES",
            "@size": "351728",
            "@ref": "gr3",
            "@mimetype": "image/jpeg"
          },
          {
            "@category": "high",
            "@height": "1136",
            "@width": "1708",
            "@_fa": "true",
            "$": "https://api.elsevier.com/content/object/eid/1-s2.0-S0926860X16301260-gr4_lrg.jpg?httpAccept=%2A%2F%2A",
            "@multimediatype": "JPEG image file",
            "@type": "IMAGE-HIGH-RES",
            "@size": "182904",
            "@ref": "gr4",
            "@mimetype": "image/jpeg"
          },
          {
            "@category": "high",
            "@height": "970",
            "@width": "1708",
            "@_fa": "true",
            "$": "https://api.elsevier.com/content/object/eid/1-s2.0-S0926860X16301260-gr5_lrg.jpg?httpAccept=%2A%2F%2A",
            "@multimediatype": "JPEG image file",
            "@type": "IMAGE-HIGH-RES",
            "@size": "187133",
            "@ref": "gr5",
            "@mimetype": "image/jpeg"
          },
          {
            "@category": "high",
            "@height": "882",
            "@width": "1708",
            "@_fa": "true",
            "$": "https://api.elsevier.com/content/object/eid/1-s2.0-S0926860X16301260-gr6_lrg.jpg?httpAccept=%2A%2F%2A",
            "@multimediatype": "JPEG image file",
            "@type": "IMAGE-HIGH-RES",
            "@size": "159068",
            "@ref": "gr6",
            "@mimetype": "image/jpeg"
          },
          {
            "@category": "high",
            "@height": "935",
            "@width": "1708",
            "@_fa": "true",
            "$": "https://api.elsevier.com/content/object/eid/1-s2.0-S0926860X16301260-gr7_lrg.jpg?httpAccept=%2A%2F%2A",
            "@multimediatype": "JPEG image file",
            "@type": "IMAGE-HIGH-RES",
            "@size": "229816",
            "@ref": "gr7",
            "@mimetype": "image/jpeg"
          },
          {
            "@category": "thumbnail",
            "@height": "14",
            "@width": "231",
            "@_fa": "true",
            "$": "https://api.elsevier.com/content/object/eid/1-s2.0-S0926860X16301260-si1.gif?httpAccept=%2A%2F%2A",
            "@multimediatype": "GIF image file",
            "@type": "ALTIMG",
            "@size": "795",
            "@ref": "si1",
            "@mimetype": "image/gif"
          },
          {
            "@category": "thumbnail",
            "@height": "35",
            "@width": "407",
            "@_fa": "true",
            "$": "https://api.elsevier.com/content/object/eid/1-s2.0-S0926860X16301260-si10.gif?httpAccept=%2A%2F%2A",
            "@multimediatype": "GIF image file",
            "@type": "ALTIMG",
            "@size": "1812",
            "@ref": "si10",
            "@mimetype": "image/gif"
          },
          {
            "@category": "thumbnail",
            "@height": "35",
            "@width": "395",
            "@_fa": "true",
            "$": "https://api.elsevier.com/content/object/eid/1-s2.0-S0926860X16301260-si11.gif?httpAccept=%2A%2F%2A",
            "@multimediatype": "GIF image file",
            "@type": "ALTIMG",
            "@size": "1873",
            "@ref": "si11",
            "@mimetype": "image/gif"
          },
          {
            "@category": "thumbnail",
            "@height": "16",
            "@width": "144",
            "@_fa": "true",
            "$": "https://api.elsevier.com/content/object/eid/1-s2.0-S0926860X16301260-si12.gif?httpAccept=%2A%2F%2A",
            "@multimediatype": "GIF image file",
            "@type": "ALTIMG",
            "@size": "570",
            "@ref": "si12",
            "@mimetype": "image/gif"
          },
          {
            "@category": "thumbnail",
            "@height": "16",
            "@width": "305",
            "@_fa": "true",
            "$": "https://api.elsevier.com/content/object/eid/1-s2.0-S0926860X16301260-si13.gif?httpAccept=%2A%2F%2A",
            "@multimediatype": "GIF image file",
            "@type": "ALTIMG",
            "@size": "1126",
            "@ref": "si13",
            "@mimetype": "image/gif"
          },
          {
            "@category": "thumbnail",
            "@height": "15",
            "@width": "308",
            "@_fa": "true",
            "$": "https://api.elsevier.com/content/object/eid/1-s2.0-S0926860X16301260-si2.gif?httpAccept=%2A%2F%2A",
            "@multimediatype": "GIF image file",
            "@type": "ALTIMG",
            "@size": "1039",
            "@ref": "si2",
            "@mimetype": "image/gif"
          },
          {
            "@category": "thumbnail",
            "@height": "16",
            "@width": "315",
            "@_fa": "true",
            "$": "https://api.elsevier.com/content/object/eid/1-s2.0-S0926860X16301260-si3.gif?httpAccept=%2A%2F%2A",
            "@multimediatype": "GIF image file",
            "@type": "ALTIMG",
            "@size": "1183",
            "@ref": "si3",
            "@mimetype": "image/gif"
          },
          {
            "@category": "thumbnail",
            "@height": "15",
            "@width": "377",
            "@_fa": "true",
            "$": "https://api.elsevier.com/content/object/eid/1-s2.0-S0926860X16301260-si4.gif?httpAccept=%2A%2F%2A",
            "@multimediatype": "GIF image file",
            "@type": "ALTIMG",
            "@size": "1175",
            "@ref": "si4",
            "@mimetype": "image/gif"
          },
          {
            "@category": "thumbnail",
            "@height": "16",
            "@width": "289",
            "@_fa": "true",
            "$": "https://api.elsevier.com/content/object/eid/1-s2.0-S0926860X16301260-si5.gif?httpAccept=%2A%2F%2A",
            "@multimediatype": "GIF image file",
            "@type": "ALTIMG",
            "@size": "1082",
            "@ref": "si5",
            "@mimetype": "image/gif"
          },
          {
            "@category": "thumbnail",
            "@height": "15",
            "@width": "357",
            "@_fa": "true",
            "$": "https://api.elsevier.com/content/object/eid/1-s2.0-S0926860X16301260-si6.gif?httpAccept=%2A%2F%2A",
            "@multimediatype": "GIF image file",
            "@type": "ALTIMG",
            "@size": "1176",
            "@ref": "si6",
            "@mimetype": "image/gif"
          },
          {
            "@category": "thumbnail",
            "@height": "16",
            "@width": "315",
            "@_fa": "true",
            "$": "https://api.elsevier.com/content/object/eid/1-s2.0-S0926860X16301260-si7.gif?httpAccept=%2A%2F%2A",
            "@multimediatype": "GIF image file",
            "@type": "ALTIMG",
            "@size": "1196",
            "@ref": "si7",
            "@mimetype": "image/gif"
          },
          {
            "@category": "thumbnail",
            "@height": "36",
            "@width": "317",
            "@_fa": "true",
            "$": "https://api.elsevier.com/content/object/eid/1-s2.0-S0926860X16301260-si8.gif?httpAccept=%2A%2F%2A",
            "@multimediatype": "GIF image file",
            "@type": "ALTIMG",
            "@size": "1526",
            "@ref": "si8",
            "@mimetype": "image/gif"
          },
          {
            "@category": "thumbnail",
            "@height": "36",
            "@width": "314",
            "@_fa": "true",
            "$": "https://api.elsevier.com/content/object/eid/1-s2.0-S0926860X16301260-si9.gif?httpAccept=%2A%2F%2A",
            "@multimediatype": "GIF image file",
            "@type": "ALTIMG",
            "@size": "1512",
            "@ref": "si9",
            "@mimetype": "image/gif"
          }
        ]
      },
      "link": {
        "@rel": "abstract",
        "@href": "https://api.elsevier.com/content/abstract/scopus_id/84961627476"
      }
    }
  }
}