{
  "metadata": {
    "title": "Enhanced catalytic performance for gas phase epoxidation of propylene with H<ce:inf loc=post>2</ce:inf> and O<ce:inf loc=post>2</ce:inf> by multiple pretreated Au/TS-1 catalysts",
    "authors": "; ; ",
    "journal": "Applied Catalysis A: General",
    "date": "2024-09-25",
    "doi": "10.1016/j.apcata.2024.119895",
    "abstract": "",
    "uri": "https://api.elsevier.com/content/article/pii/S0926860X24003405",
    "pii": "S0926860X24003405"
  },
  "fulltext": {
    "full-text-retrieval-response": {
      "scopus-eid": "2-s2.0-85199883016",
      "originalText": "serial JL 271346 291210 291744 291809 31 Applied Catalysis A: General APPLIEDCATALYSISAGENERAL 2024-07-30 2024-07-30 2024-07-31 2024-07-31 2025-01-28T12:54:02 1-s2.0-S0926860X24003405 S0926-860X(24)00340-5 S0926860X24003405 10.1016/j.apcata.2024.119895 S300 S300.1 FULL-TEXT 1-s2.0-S0926860X24X00137 2025-01-28T13:20:03.648712Z 0 0 20240925 2024 2024-07-30T15:48:29.268969Z absattachment articleinfo articlenumber articletitlenorm authfirstinitialnorm authfirstsurnamenorm cid cids contenttype copyright crossmark dateloaded dateloadedtxt datesearch datesort dateupdated dco docsubtype doctype doi eid ewtransactionid hubeid indexeddate issn issnnorm itemstage itemtransactionid itemweight openaccess openarchive pg pgfirst pii piinorm pubdatestart pubdatetxt pubyr sortorder srctitle srctitlenorm srctype ssids alllist content subj subheadings suppl tomb volfirst volissue volumelist webpdf webpdfpagecount yearnav figure table e-component body acknowledge affil appendices articletitle auth authfirstini authfull authkeywords authlast grantnumber grantsponsor grantsponsorid highlightsabst primabst ref specialabst 0926-860X 0926860X true 685 685 C Volume 685 25 119895 119895 119895 20240925 25 September 2024 2024-09-25 2024 article fla © 2024 Elsevier B.V. All rights are reserved, including those for text and data mining, AI training, and similar technologies. ENHANCEDCATALYTICPERFORMANCEFORGASPHASEEPOXIDATIONPROPYLENEH2O2BYMULTIPLEPRETREATEDAUTS1CATALYSTS ZHAO C 1 Introduction 2 Experimental 2.1 Synthesis of TS-1 zeolite 2.2 Au nanoparticle deposition 2.3 Catalyst pretreatment 2.4 Characterizations 2.5 Catalytic testing 3 Result and discussion 3.1 Fundamental property and characterization of Au/TS-1 3.2 Effect of alkali metal promoters 3.3 Effect of alkaline gases pretreatment 3.4 Effect of silane coupling pretreatment 3.5 Stability test on Au/TS-1 catalyst 4 Conclusion CRediT authorship contribution statement Acknowledgment Appendix A Supplementary material References ZHAO 2022 117574 C WANG 2020 4428 4436 L LIU 2021 118329 Y ZHANG 2019 16815 Z LEE 2012 31 42 W LIU 2011 94 102 C SINHA 2003 243 252 A UPHADE 2002 331 340 B WANG 2021 1 11 G XU 2020 115907 J SANKAR 2020 3890 3938 M ISHIDA 2020 464 525 T ZHAO 2023 100037 C YU 2019 304 312 B SHENG 2022 9515 9524 N LI 2023 10487 10499 W SONG 2019 119927 Z ZHU 2019 307 313 Q FENG 2017 2668 2675 X REN 2020 8155 8163 Y LEE 2012 178 189 W FENG 2018 7799 7808 X LIN 2020 433 443 D LEE 2013 98 113 W LU 2009 186 195 J SINHA 2004 1546 1548 A REN 2019 117172 Y STANGLAND 2005 2321 2330 E KHOMANE 2002 99 103 R CUNDY 2004 67 80 C TAYLOR 2005 188 198 B LIN 2014 104 108 J ZHU 2019 307 313 Q SERRANO 2014 35 42 D SHENG 2019 119954 N FENG 2014 396 401 X CUNDY 2003 143 156 C FENG 2015 234 239 X FENG 2015 128 135 X DU 2011 192 201 M QI 2004 19 26 C CHOWDHURY 2012 21 27 B YAO 2018 144 152 S XIONG 2016 190 196 G ZHAOX2024X119895 ZHAOX2024X119895XC 2026-07-31T00:00:00.000Z 2026-07-31T00:00:00.000Z http://creativecommons.org/licenses/by-nc-nd/4.0/ © 2024 Elsevier B.V. All rights are reserved, including those for text and data mining, AI training, and similar technologies. 2024-08-03T00:28:08.534Z http://vtw.elsevier.com/data/voc/AddOnTypes/50.7/aggregated-refined National Natural Science Foundation of China 22208382 22278452 NSFC National Natural Science Foundation of China http://data.elsevier.com/vocabulary/SciValFunders/501100001809 http://sws.geonames.org/1814991 This work was financially supported by the National Natural Science Foundation of China (22208382 and 22278452). https://doi.org/10.15223/policy-017 https://doi.org/10.15223/policy-037 https://doi.org/10.15223/policy-012 https://doi.org/10.15223/policy-029 https://doi.org/10.15223/policy-004 item S0926-860X(24)00340-5 S0926860X24003405 1-s2.0-S0926860X24003405 10.1016/j.apcata.2024.119895 271346 2025-01-28T13:20:03.648712Z 2024-09-25 1-s2.0-S0926860X24003405-main.pdf https://s3-eu-west-1.amazonaws.com/prod-ucs-content-store-eu-west/content/pii:S0926860X24003405/MAIN/application/pdf/1cf296c4075941a70f1358163919a8f8/main.pdf main.pdf pdf true 6444103 MAIN 8 1-s2.0-S0926860X24003405-main_1.png https://s3-eu-west-1.amazonaws.com/prod-ucs-content-store-eu-west/content/pii:S0926860X24003405/PREVIEW/image/png/f189e93467ee179aa00ecb213d5fbd11/main_1.png main_1.png png 59594 849 656 IMAGE-WEB-PDF 1 1-s2.0-S0926860X24003405-gr9.jpg https://s3-eu-west-1.amazonaws.com/prod-ucs-content-store-eu-west/content/pii:S0926860X24003405/gr9/DOWNSAMPLED/image/jpeg/4d6209fea0d92728990ba06590168dbe/gr9.jpg gr9 gr9.jpg jpg 97837 500 678 IMAGE-DOWNSAMPLED 1-s2.0-S0926860X24003405-gr8.jpg https://s3-eu-west-1.amazonaws.com/prod-ucs-content-store-eu-west/content/pii:S0926860X24003405/gr8/DOWNSAMPLED/image/jpeg/8223aede334ebc0a6242806b4a73e473/gr8.jpg gr8 gr8.jpg jpg 25778 284 339 IMAGE-DOWNSAMPLED 1-s2.0-S0926860X24003405-gr7.jpg https://s3-eu-west-1.amazonaws.com/prod-ucs-content-store-eu-west/content/pii:S0926860X24003405/gr7/DOWNSAMPLED/image/jpeg/64dd8b7a25348cd7a345daf7fd0fb73f/gr7.jpg gr7 gr7.jpg jpg 25018 292 339 IMAGE-DOWNSAMPLED 1-s2.0-S0926860X24003405-gr10.jpg https://s3-eu-west-1.amazonaws.com/prod-ucs-content-store-eu-west/content/pii:S0926860X24003405/gr10/DOWNSAMPLED/image/jpeg/8780c08d1aa0d45d3f21fed624b3a255/gr10.jpg gr10 gr10.jpg jpg 27363 276 339 IMAGE-DOWNSAMPLED 1-s2.0-S0926860X24003405-gr2.jpg https://s3-eu-west-1.amazonaws.com/prod-ucs-content-store-eu-west/content/pii:S0926860X24003405/gr2/DOWNSAMPLED/image/jpeg/5cbee9b7c1595b1e06bfd4f0f6c8e227/gr2.jpg gr2 gr2.jpg jpg 26163 288 339 IMAGE-DOWNSAMPLED 1-s2.0-S0926860X24003405-ga1.jpg https://s3-eu-west-1.amazonaws.com/prod-ucs-content-store-eu-west/content/pii:S0926860X24003405/ga1/DOWNSAMPLED/image/jpeg/d26dfc77de0a459bc93391d7978ab6fe/ga1.jpg ga1 true ga1.jpg jpg 19940 199 251 IMAGE-DOWNSAMPLED 1-s2.0-S0926860X24003405-gr1.jpg https://s3-eu-west-1.amazonaws.com/prod-ucs-content-store-eu-west/content/pii:S0926860X24003405/gr1/DOWNSAMPLED/image/jpeg/4cd6a69ffce338c1439d44b9d45e6e2c/gr1.jpg gr1 gr1.jpg jpg 28704 286 339 IMAGE-DOWNSAMPLED 1-s2.0-S0926860X24003405-gr6.jpg https://s3-eu-west-1.amazonaws.com/prod-ucs-content-store-eu-west/content/pii:S0926860X24003405/gr6/DOWNSAMPLED/image/jpeg/a3998b365ee0bfcab4d4c4ead1c04146/gr6.jpg gr6 gr6.jpg jpg 22513 277 339 IMAGE-DOWNSAMPLED 1-s2.0-S0926860X24003405-gr5.jpg https://s3-eu-west-1.amazonaws.com/prod-ucs-content-store-eu-west/content/pii:S0926860X24003405/gr5/DOWNSAMPLED/image/jpeg/f95d03d66c3874470ee6c7ea7360a94c/gr5.jpg gr5 gr5.jpg jpg 147546 782 791 IMAGE-DOWNSAMPLED 1-s2.0-S0926860X24003405-gr4.jpg https://s3-eu-west-1.amazonaws.com/prod-ucs-content-store-eu-west/content/pii:S0926860X24003405/gr4/DOWNSAMPLED/image/jpeg/d3e7ee8db3eb309e4833c771878c6b16/gr4.jpg gr4 gr4.jpg jpg 29041 269 339 IMAGE-DOWNSAMPLED 1-s2.0-S0926860X24003405-gr3.jpg https://s3-eu-west-1.amazonaws.com/prod-ucs-content-store-eu-west/content/pii:S0926860X24003405/gr3/DOWNSAMPLED/image/jpeg/29f0e87043b40ca0449e25b659cb79ff/gr3.jpg gr3 gr3.jpg jpg 19115 287 376 IMAGE-DOWNSAMPLED 1-s2.0-S0926860X24003405-gr9.sml https://s3-eu-west-1.amazonaws.com/prod-ucs-content-store-eu-west/content/pii:S0926860X24003405/gr9/THUMBNAIL/image/gif/10c454797901dbe4b4b96c0b42f57d55/gr9.sml gr9 gr9.sml sml 13721 161 219 IMAGE-THUMBNAIL 1-s2.0-S0926860X24003405-gr8.sml https://s3-eu-west-1.amazonaws.com/prod-ucs-content-store-eu-west/content/pii:S0926860X24003405/gr8/THUMBNAIL/image/gif/48239cdfb182e13f5be4f3609230c44f/gr8.sml gr8 gr8.sml sml 9269 164 196 IMAGE-THUMBNAIL 1-s2.0-S0926860X24003405-gr7.sml https://s3-eu-west-1.amazonaws.com/prod-ucs-content-store-eu-west/content/pii:S0926860X24003405/gr7/THUMBNAIL/image/gif/94243ab91614fbbca99f296d998b7721/gr7.sml gr7 gr7.sml sml 9264 164 190 IMAGE-THUMBNAIL 1-s2.0-S0926860X24003405-gr10.sml https://s3-eu-west-1.amazonaws.com/prod-ucs-content-store-eu-west/content/pii:S0926860X24003405/gr10/THUMBNAIL/image/gif/e9ab5820ce60dc4895bc983456338c82/gr10.sml gr10 gr10.sml sml 9761 164 202 IMAGE-THUMBNAIL 1-s2.0-S0926860X24003405-gr2.sml https://s3-eu-west-1.amazonaws.com/prod-ucs-content-store-eu-west/content/pii:S0926860X24003405/gr2/THUMBNAIL/image/gif/1836be41c6bb6b75fb0ed9d968478769/gr2.sml gr2 gr2.sml sml 10306 164 193 IMAGE-THUMBNAIL 1-s2.0-S0926860X24003405-ga1.sml https://s3-eu-west-1.amazonaws.com/prod-ucs-content-store-eu-west/content/pii:S0926860X24003405/ga1/THUMBNAIL/image/gif/64c4d4671729d54a7d992c65419a7af2/ga1.sml ga1 true ga1.sml sml 10236 164 206 IMAGE-THUMBNAIL 1-s2.0-S0926860X24003405-gr1.sml https://s3-eu-west-1.amazonaws.com/prod-ucs-content-store-eu-west/content/pii:S0926860X24003405/gr1/THUMBNAIL/image/gif/8dd93f4f2d1e55006bd0b71f3a10bba9/gr1.sml gr1 gr1.sml sml 10844 164 194 IMAGE-THUMBNAIL 1-s2.0-S0926860X24003405-gr6.sml https://s3-eu-west-1.amazonaws.com/prod-ucs-content-store-eu-west/content/pii:S0926860X24003405/gr6/THUMBNAIL/image/gif/949dc8fd527242df2638b9e59cc00b6a/gr6.sml gr6 gr6.sml sml 8213 164 200 IMAGE-THUMBNAIL 1-s2.0-S0926860X24003405-gr5.sml https://s3-eu-west-1.amazonaws.com/prod-ucs-content-store-eu-west/content/pii:S0926860X24003429/gr5/THUMBNAIL/image/gif/d142293399851bcd2f6cab5596c560a5/gr5.sml gr5 gr5.sml sml 17595 164 166 IMAGE-THUMBNAIL 1-s2.0-S0926860X24003405-gr4.sml https://s3-eu-west-1.amazonaws.com/prod-ucs-content-store-eu-west/content/pii:S0926860X24003405/gr4/THUMBNAIL/image/gif/4f3c4a978b462a1886bae4c5f18127c8/gr4.sml gr4 gr4.sml sml 13148 164 206 IMAGE-THUMBNAIL 1-s2.0-S0926860X24003405-gr3.sml https://s3-eu-west-1.amazonaws.com/prod-ucs-content-store-eu-west/content/pii:S0926860X24003405/gr3/THUMBNAIL/image/gif/cf501093609e644f32774327ac1bc837/gr3.sml gr3 gr3.sml sml 7429 164 215 IMAGE-THUMBNAIL 1-s2.0-S0926860X24003405-gr9_lrg.jpg https://s3-eu-west-1.amazonaws.com/prod-ucs-content-store-eu-west/content/pii:S0926860X24003405/HIGHRES/image/jpeg/02c834cdf2b07425df1187e43f4dfae8/gr9_lrg.jpg gr9 gr9_lrg.jpg jpg 404159 2207 2994 IMAGE-HIGH-RES 1-s2.0-S0926860X24003405-gr8_lrg.jpg https://s3-eu-west-1.amazonaws.com/prod-ucs-content-store-eu-west/content/pii:S0926860X24003405/HIGHRES/image/jpeg/9564e585d8a8dffe80d491f364456591/gr8_lrg.jpg gr8 gr8_lrg.jpg jpg 124497 1254 1497 IMAGE-HIGH-RES 1-s2.0-S0926860X24003405-gr7_lrg.jpg https://s3-eu-west-1.amazonaws.com/prod-ucs-content-store-eu-west/content/pii:S0926860X24003405/HIGHRES/image/jpeg/74b8ac4f263a168e3ad65594c18574b1/gr7_lrg.jpg gr7 gr7_lrg.jpg jpg 123698 1290 1497 IMAGE-HIGH-RES 1-s2.0-S0926860X24003405-gr10_lrg.jpg https://s3-eu-west-1.amazonaws.com/prod-ucs-content-store-eu-west/content/pii:S0926860X24003405/HIGHRES/image/jpeg/419e322913dff2475a0e55f85e48755c/gr10_lrg.jpg gr10 gr10_lrg.jpg jpg 132419 1217 1497 IMAGE-HIGH-RES 1-s2.0-S0926860X24003405-gr2_lrg.jpg https://s3-eu-west-1.amazonaws.com/prod-ucs-content-store-eu-west/content/pii:S0926860X24003405/HIGHRES/image/jpeg/e13528d563a2dbc3df4000948ba8a118/gr2_lrg.jpg gr2 gr2_lrg.jpg jpg 116571 1273 1497 IMAGE-HIGH-RES 1-s2.0-S0926860X24003405-ga1_lrg.jpg https://s3-eu-west-1.amazonaws.com/prod-ucs-content-store-eu-west/content/pii:S0926860X24003405/HIGHRES/image/jpeg/1fa06cc2d0d598eb77059ba01ba0e1ca/ga1_lrg.jpg ga1 true ga1_lrg.jpg jpg 142489 886 1115 IMAGE-HIGH-RES 1-s2.0-S0926860X24003405-gr1_lrg.jpg https://s3-eu-west-1.amazonaws.com/prod-ucs-content-store-eu-west/content/pii:S0926860X24003405/HIGHRES/image/jpeg/b62cb6b765ec14d6928b9c2dec0a821c/gr1_lrg.jpg gr1 gr1_lrg.jpg jpg 142815 1262 1497 IMAGE-HIGH-RES 1-s2.0-S0926860X24003405-gr6_lrg.jpg https://s3-eu-west-1.amazonaws.com/prod-ucs-content-store-eu-west/content/pii:S0926860X24003405/HIGHRES/image/jpeg/86824584fbf1452d2942e916745feeea/gr6_lrg.jpg gr6 gr6_lrg.jpg jpg 110573 1224 1497 IMAGE-HIGH-RES 1-s2.0-S0926860X24003405-gr5_lrg.jpg https://s3-eu-west-1.amazonaws.com/prod-ucs-content-store-eu-west/content/pii:S0926860X24003429/HIGHRES/image/jpeg/2eea6c0f234ba5e19278ab8a44f3281b/gr5_lrg.jpg gr5 gr5_lrg.jpg jpg 652769 3454 3493 IMAGE-HIGH-RES 1-s2.0-S0926860X24003405-gr4_lrg.jpg https://s3-eu-west-1.amazonaws.com/prod-ucs-content-store-eu-west/content/pii:S0926860X24003405/HIGHRES/image/jpeg/13008c5cea7a6500e3306fd991a2d519/gr4_lrg.jpg gr4 gr4_lrg.jpg jpg 135745 1190 1497 IMAGE-HIGH-RES 1-s2.0-S0926860X24003405-gr3_lrg.jpg https://s3-eu-west-1.amazonaws.com/prod-ucs-content-store-eu-west/content/pii:S0926860X24003429/HIGHRES/image/jpeg/ee568845a6c44804b3143734d5587f5f/gr3_lrg.jpg gr3 gr3_lrg.jpg jpg 101042 1270 1663 IMAGE-HIGH-RES 1-s2.0-S0926860X24003405-mmc1.doc https://s3-eu-west-1.amazonaws.com/prod-ucs-content-store-eu-west/content/pii:S0926860X24003405/mmc1/MAIN/application/msword/7fcf6da9bf5fed83d34ffae592394bbf/mmc1.doc mmc1 mmc1.doc doc 1106944 APPLICATION 1-s2.0-S0926860X24003405-am.pdf https://s3-eu-west-1.amazonaws.com/prod-ucs-content-store-eu-west/content/egi:10SBTW18CRX/MAIN/application/pdf/5f4f4d36995c20027de923b7933e7f57/am.pdf am am.pdf pdf false 1690142 AAM-PDF APCATA 119895 119895 S0926-860X(24)00340-5 10.1016/j.apcata.2024.119895 Elsevier B.V. Fig. 1 IR spectra of Cat-1, Cat-4, Cat-5 and Cat-6. Fig. 1 Fig. 2 X-ray diffraction patterns of Cat-1, Cat-4, Cat-5 and Cat-6. Fig. 2 Fig. 3 UV–vis spectra of Cat-1, Cat-4, Cat-5 and Cat-6. Fig. 3 Fig. 4 Gas phase epoxidation of propylene test over different samples (Cat-1 to Cat-10). Data were collected after 15 h reaction. Reaction condition: 0.3 g catalyst, 180 ℃, GHSV = 10000 ml gcat −1 h−1, H2: O2: C3H6: N2 = 10: 10: 10: 70 in vol%. Fig. 4 Fig. 5 HRTEM images and Au nanoparticle size distribution of Au/TS-1 from Cat-1 to Cat-10. The scale bar represents 10 nm. The bottom right corner of this picture showed the statistics of the relevant information. Where size was calculated on samples from Cat-1 to Cat-10. Numbers were count on per 0.01 square nanometers under visible area. Fig. 5 Fig. 6 NH3-TPD-MS of Au/TS-1 samples (Cat-1, Cat-4, Cat-5, Cat-6, Cat-9, and Cat-10). Fig. 6 Fig. 7 FTIR spectra of Au/TS-1 samples in the region of silanol groups. Fig. 7 Fig. 8 29Si MAS NMR spectra of Au/TS-1 samples (Cat-1, Cat-4, Cat-5, Cat-6). Fig. 8 Fig. 9 Catalytic performance of samples as function of time on stream. Reaction condition: 0.3 g catalyst, 180 ℃, GHSV = 10000 ml gcat −1 h−1, H2: O2: C3H6: N2 = 10: 10: 10: 70 in vol%. Fig. 9 Fig. 10 Weight loss of samples after 100 h catalytic performances testing. Fig. 10 Table 1 Fundamental property of Au/TS-1 samples. Table 1 Samples (Au/TS-1) Precipitation agent Final pH Pretreatment Au loading a (%) Au surface loading b (%) Cat−1 NaOH 7.58 100 % N2 0.05 0.06 Cat−2 Na2CO3 7.56 100 % N2 0.09 0.11 Cat−3 K2CO3 7.60 100 % N2 0.10 0.11 Cat−4 Cs2CO3 7.62 100 % N2 0.15 0.17 Cat−5 NaOH 7.58 1 % NH3+99 % N2 0.05 0.09 Cat−6 NaOH 7.58 1 % SBA c +99 % N2 0.05 0.10 Cat−7 Cs2CO3 7.62 1 % NH3+99 % N2 0.15 0.25 Cat−8 Cs2CO3 7.62 1 % SBA+99 % N2 0.15 0.26 Cat−9 NaOH 7.58 1 % NH3+1 % SBA+99 % N2 0.05 0.13 Cat−10 Cs2CO3 7.62 1 % NH3+1 % SBA+99 % N2 0.15 0.37 a result from ICP-OES, b result from XPS, c Silylation reagent (triethoxyvinylsilane). Enhanced catalytic performance for gas phase epoxidation of propylene with H2 and O2 by multiple pretreated Au/TS-1 catalysts Chenyang Zhao Writing – review & editing Writing – original draft Formal analysis Data curation Conceptualization a b Yujia Liu Investigation Formal analysis Data curation a b Yupeng Tian Formal analysis Data curation b Yahui Li Formal analysis a b Junjie Feng Formal analysis a b Wei Xu Supervision Project administration Investigation a b ⁎ Ning Shi Investigation Formal analysis b Zhe Yang Supervision Project administration Funding acquisition a b ⁎ Bing Sun a b ⁎ a State Key Laboratory of Chemical Safety, 339th Songling Road, Qingdao 266071, China State Key Laboratory of Chemical Safety 339th Songling Road Qingdao 266071 China State Key Laboratory of Chemical Safety, 339th Songling Road, Qingdao, 266071, China b SINOPEC Research Institute of Safety Engineering Co., Ltd., 339th Songling Road, Qingdao 266071, China SINOPEC Research Institute of Safety Engineering Co., Ltd. 339th Songling Road Qingdao 266071 China SINOPEC Research Institute of Safety Engineering Co., Ltd., 339th Songling Road, Qingdao, 266071, China ⁎ Corresponding authors at: State Key Laboratory of Chemical Safety, 339th Songling Road, Qingdao 266071, China. State Key Laboratory of Chemical Safety 339th Songling Road Qingdao 266071 China Direct epoxidation of propylene (C3H6) with hydrogen (H2) and oxygen (O2) over Au/TS-1 catalyst was promising way for the synthesis of propylene oxide (PO). However, high selectivity of PO (>95 %) and conversion of C3H6 (>5 %) cannot be achieved at the same time. The industrialization process was severely restricted. In this paper, Au/TS-1 catalysts were synthesized by deposition precipitation method with alkali metal promoter. And alkaline gases and silane coupling post-treatment were performed to promote the catalytic activity. The prepared samples exhibited a much better C3H6 conversion (6.5 %) and PO selectivity (95.1 %) compared with general catalyst using normal synthetic technology. Cs2CO3 was beneficial to increasing Au nanoparticles uptake efficiency. Both NH3 and triethoxyvinylsilane post-treatment were good for smaller and more uniform loading of Au nanoparticles. The decreasing in surface hydroxyl density effectively alleviated the occurrence of PO ring opening isomerization. The increased hydrophobicity of TS-1 surface was conducive to the rapid desorption of generated PO and significantly increased PO selectivity. Multiple pretreatment was also favorable for extending the lifetime of Au/TS-1 catalyst. Graphical Abstract Combination of alkali metal promoters, alkaline gases and silane coupling pretreatment, excellent catalytic performance of Au/TS-1 was obtained. CC3H6, SPO, EH2 and RPO were almost constant after 100 h stability test. Keywords Gas phase epoxidation Au/TS-1 Alkali metal promoter Alkaline gases pretreatment Silane coupling post-treatment Data availability The authors do not have permission to share data. 1 Introduction As an important bulk chemical propylene oxide (PO) is widely used in polyetheropolyol, polyurethane synthesizing and further applied in chemical industry, cosmetics and medicine field [1]. Normally, PO was produced by the chlorohydrin, organic hydroperoxide and the hydrogene peroxide propylene oxide (HPPO) process. Because of environment pollution, instrument corrosion, mismatching of co-products and poor stability of H2O2. These routes could not meet the safe, green and waste-less needs of chemical production [2]. Gas phase epoxidation of propylene (C3H6) with H2 and O2 to produce PO showed advantages of easy operation, environmental protection and satisfied cost-efficiency. Which has long been considered as a dream reaction [3]. It is widely accepted that Ti-containing zeolites (such as TS-1, TS-2 and Ti-MCM-48) supported Au cluster could catalyze propylene to PO with the help of H2 and O2 [4–9]. Where Au could active H2 and O2 to generate H2O2. H2O2 was converted in-situ in the epoxidation of C3H6 adsorbed on the framework Ti4+ of Ti-zeolites. Therefore, it is necessary to balance the distribution of the Au nanoparticles and Ti4+ for better PO selectivity (SPO) and C3H6 conversion (CC3H6)[10]. In the past decades, an ever-expanding effort of Au loaded catalyst has been explored, Au/TS-1 play a synergistic catalytic role, which showed good catalytic performance in the gas phase epoxidation of propylene with H2 and O2 [3,11–14]. Nevertheless, the industrialization of gas-phase epoxidation was severely restricted by catalytic materials. For Au/TS-1 system, high CC3H6 (>5 %) and better SPO (>95 %) cannot be achieved at the same time. [15,16]. For solving the above problem, Au/TS-1 catalyst has been optimized to further improve its catalytic performance from modification strategies of TS-1 synthesis to Au deposition method [5,17–21]. A series of comparative studies showed that stable and uniformly distributed Au nano-particles, especially those nearing framework Ti4+ were favorable for better SPO [22,23]. Whereas, highly dispersed Au clusters was not easy to be prepared by normal deposition-precipitation method. Owing to the inter-metallic interaction, researchers found that alkali metal such as Cs or Ba is proposed to help stabilize Au particle and restrain the isomerization of PO [20,24–26]. The distribution of Au nanoparticles is also affected by the pre-treatment conditions during the synthesis process. Few reports have discussed the aforementioned impacts, except that Ren et al. had mentioned that owing to the formation of hydrophobic surface, H2-C3H6 pretreated Au/TS-1 exhibited much better catalytic performance [27]. Stangland et al. demonstrated that Au/TS-1 had better catalytic performance when drying under vacuum at room temperature [28]. Although predecessors have done a lot of work, the synthesis of Au/TS-1 catalysts in different pre-treatment scenarios was quite complicated and the mechanisms of different feed treat were still remained unclear. In this paper, we focus on the effects of both alkali metal promoters and different types of pretreatment for Au/TS-1. Generally, distribution of acidic sites on the catalysts and the characterization of hydrophobicity have been carefully investigated. It is found that acidic sites of Au/TS-1 catalysts induced by TiOx or extra-framework of Ti species have been diminished by alkaline gas (NH3) and silanization pretreatment. With the increase the hydrophobicity by reducing the hydroxyl density on the surface of TS-1, PO was easily desorbed and effectively alleviated the occurrence of ring opening isomerization. At the same time, lower density of hydroxyl groups could slow down the possibility of Au nanoparticles flowing on the surface of TS-1 at high temperatures, which will be leading to Ostwald ripening. Consequently, the selectivity of propylene oxide in gas phase epoxidation has been greatly enhanced. 2 Experimental 2.1 Synthesis of TS-1 zeolite Traditional hydrothermal method was carried out for TS-1 zeolites synthesizing. In details, 0.51 g tetrabutyl titanate (> 99.9 %, Aladdin) was added to 62.4 g tetraethyl orthosilicate (> 99.9 %, Aladdin). Then 48.8 g tetrapropylammonium hydroxide (25 wt%, Aladdin) and 44.4 g deionized water were mixed with the above mentioned solutions with a stirring rate at 300 r/min for 2 h at 30 ℃. Next, the mixture was heated up to 80 ℃ for another 6 h with a stirring rate at 500 r/min. Then crystallized at 170 ℃ for at least 2 days to producing TS-1 crystals. The TS-1 was washed by distilled water to pH=7. Finally, after going through drying at 100 ℃ for 4 h and calcining at 550 ℃ for 6 h the sample was obtained. 2.2 Au nanoparticle deposition Au nanoparticles were loaded by the deposition precipitation. Firstly, 0.5 g HAuCl4·3 H2O (> 99.9 %, Aladdin) was mixed with 300 ml of deionized water at 30 ℃ with a stirring rate at 300 r/min (solution A). Secondly, 3.0 g TS-1 zeolite was added into solution A and stirring rate increased to 600 r/min for at least 30 min (slurry A). Thirdly, slurry A was then adjusted to pH = 6.6 ∼ 7.0 by adding 0.05 mol L−1 NaOH aqueous solution and further aged for at least 6 h (slurry B). Then 0.01 mol L−1 Cs2CO3, K2CO3 and Na2CO3 aqueous solutions were added to slurry B for another aging 6 h. The pH value was adjusted to 7.4–7.8 (slurry C). Afterward, slurry C was centrifuged with distilled water until the pH value of supernatant near 7.0. Finally, products on the bottom were dried at 25 ℃ and 2 kPa overnight. For comparison, Au/TS-1 catalyst without Cs2CO3, K2CO3 and Na2CO3 treated was also prepared. 2.3 Catalyst pretreatment Au/TS-1 samples were treated with different feed gases before catalytic testing. The pretreatment gases included 1 % NH3, 1 % triethoxyvinylsilane and 98 % N2. For comparison, 1 % NH3+99 % N2, 1 % triethoxyvinylsilane+99 % N2 and pure N2 were also used to treat Au/ TS-1 before catalytic testing. For details, 0.6 g of fresh sample was placed in the middle of a tubular fixed-bed reactor (i.d.=4.6 mm, o.d.=6.6 mm). Both ends of the tube were filled with quartz sand and quartz wool in a sandwich-like packing mode. Then, samples were heated from ambient temperature to 200 ℃ in hydrogen (ramping rate: 1 ℃ min−1) for 4 h. Finally, sweep gas was changed to N2 (99.999 %) for another 60 min treat before C3H6 epoxidation. 2.4 Characterizations The Au/TS-1 samples dispersed in ethanol solution were dried for morphological analyses with FEI Quanta 200 F scanning electron microscope and JEOL JEM-2100 F scanning transmission electron microscopy. The crystal structures of TS-1 zeolites were performed by Bruker D8 Advance X-ray diffraction measurements. UltraViolet–visible spectroscopy was carried out for identifying Ti coordination state in Agilent Cary 5000 UV-Vis-NIR spectrophotometer. IR spectroscopy analysis was performed by the Bruker INVENIO R total reflectance infrared spectrometer. The content of Au, O and Ti element was determined by Agilent 5100 inductively coupled plasma emission spectrometer. X-ray photoelectron spectroscopy data were collected by ESCALab250 Thermo Fisher electron spectrometer. Thermal gravimetric analysis (PerkinElmer TGA Pyris 1) was carried out from 25 ℃ to 800 ℃ with a heating rate of 10 ℃ min−1 in a flow of air. N2 physisorption was performed on a Micromeritics ASAP-2010 instrument at −196 ℃. The NH3-TPD-MS test was performed by homemade chemical adsorption instrument. The 29Si MAS NMR spectra were performed on nuclear magnetic resonance spectrometer (Varian VNMRS 400WB) at a frequency of 79.43 MHz using one pulse method, a spinning rate of 3 kHz, a recycling delay of 60 s, and (CH3)3Si(CH2)3SO3Na as a chemical shift reference. 2.5 Catalytic testing The direct propylene epoxidation was carried out in a continuous-flow fixed-bed reactor at 180 ℃ and 0.1 MPa. 0.3 g Au/TS-1 catalyst mixed with 1.5–2.5 g quartz sand (50–70 mesh size) were placed in the above reactor with a feed flow of 50 ml min−1 (H2: O2: C3H6: N2 = 10: 10: 10: 70 in vol%). The reactants and products were analyzed by on-line GC (Agilent 7890B) equipped with HP-AL\\S, PoraBOUND U, HayeSep Q and Molsieve 5 A column. For the stability test, CC3H6, SPO, H2 efficiency (EH2), PO formation rate (RPO) and carbon balance (Cb) of samples were tested every 30 min. Catalytic performance was calculated by normalization methods defined as follows: (1) CC3H6 = mols of (C3 species except propylene +2/3 C2 species + CO2/3 + CO/3) / mols of feed propylene × 100% (2) SPO = mols of PO / mols of (C3 species except propylene +2/3 C2 species + CO2/3 + CO/3) × 100% (3) EH2 = mols of PO / mols of H2 converted × 100% (4) RPO = mols of PO / mCat × 58.08 (5) Cb = (3 × C3 species + 2 × C2 species + CO2 + CO) / (3 × feed C3H6) 3 Result and discussion 3.1 Fundamental property and characterization of Au/TS-1 Table 1 listed fundamental property of Au/TS-1 samples, from different precipitation agent, final pH by deposition precipitation method to multiple pretreatments. Au loading on the surface and whole Au/TS-1 catalysts were detected by XPS and ICP-OES respectively. Results of ICP-OES showed that the content of Au species in Cat-1 is less than 0.05 wt%. But Au takes over 0.15 wt% on the Cat-4. Cat-2 and Cat-3 also exhibited better Au loading efficiency. Therefore, it can be inferred that the addition of alkali metal carbonate additives helps to increase the loading amount of Au on TS-1. Based on the data in the last two columns of the Table 1, both alkaline gas and silane coupling pretreatments of Au/TS-1 will promote the surface segregation of Au nano-particles. The surface loading of Au in Cat-1 was similar with whole Au loading. However, the ratio of surface to whole of Cat-5 and Cat-6 was nearly doubled. Not to mention the Cat-9 and Cat-10, these two samples were both posts treated by NH3 and SBA. The relevant conclusions could also be obtained from the comparison of Cat-4 and Cat-7, Cat-8, Cat-10. Fundamental pore structural property of Au/TS-1 samples was exhibited in Table S1, the changing in surface area, pore size and volume distribution indicating that micropores blocking happened to a certain extent after Au loading. For further excluding influence from other factors and verifying the positive effect of multiple pretreatment methods on improving catalyst performance, characterization was employed to confirm that the synthesized Au/TS-1 samples had the same MFI structure, titanium framework and similar tetrahedrally coordinated Ti4+ species. Fig. 1 showed IR spectra of samples with different pretreatment. In the range of 400 cm−1∼1800 cm−1, the IR spectrum profiles of Cat-1, Cat-4, Cat-5 and Cat-6 were almost the same. The weak band around 978 cm−1 could be attributed to the stretching vibration of the Si-O bond perturbed by the presence of Ti atom in zeolite framework [29–32]. Peaks around 800 cm−1, 1090 cm−1 and 1230 cm−1 were belonged to the asymmetrical and symmetric stretching vibration of SiO4. Band approximately at 550 cm−1 could be identified as five-membered ring [33,34]. The XRD patterns ( Fig. 2) showed that Cat-1, Cat-4, Cat-5 and Cat-6 were fully crystalline and overlapped with major diffraction peaks (2θ) at 23.2°, 24.0° and 24.5°, corresponding to the cross-channels in the double ten-membered ring [10,29–31]. The single diffraction peak at 24.5° was believed to arise from the presence of Ti in the framework and indicated the formation of orthorhombic symmetry [27,29,30,33,35–37]. XRD patterns of Cat-2, Cat-3 and Cat-7 to Cat-10 were provided in Figure S3 for further demonstrating that all of the samples were successfully synthesized including the presence of Au nanoparticles. As shown in Fig. 3, all samples exhibited a strong adsorption peak around 210 nm, indicating that a distinguishing characteristic of tetrahedrally coordinated Ti4+ species presented in the framework [29,38,39]. Non-framework TiO2 absent in Cat-1, Cat-4, Cat-5 and Cat-6, because no peak was observed in the region of 250 nm to 350 nm [40,41]. Fig. 4 illustrated gas phase epoxidation of propylene test over different samples (Cat-1 to Cat-10). All data were collected after reaction happened for 15 h. It could be intuitively perceived that under the combined action of Cs2CO3 promoters, NH3 and triethoxyvinylsilane pretreatment, PO selectivity and propylene conversion rate dramatically increased from 86.2 %, 4.4 % (Cat-1) to 95.1 %, 6.5 % (Cat-10) respectively. The major function of alkali metal promoters was to improve the conversion rate of propylene. Based on the results in Table 1, it could be concluded that the addition of Cs effectively increased the loading amount of Au nanoparticles, thereby increasing the catalytic active sites. Ultimately, the result reflected on the catalyst was a remarkable increase in propylene conversion rate. Details could be got when comparing the result between Cat-1 and Cat-4. In Fig. 4, SPO changed from 86.2 % (Cat-1) to 92.7 % (Cat-5) when treated with NH3 and converted from 86.2 % (Cat-1) to 92.4 % (Cat-6) when treated with triethoxyvinylsilane before reaction. Actions of alkaline gases and silane coupling pretreatment could be attributed to improving the surface hydrophobicity and reducing the acidic catalytic sites of catalyst. With the effect of the two aspects, generated PO could rapidly desorb from Au/TS-1 and reduce the residence time of PO on catalyst. Due to the weakening of acidic catalytic sites that cause side reactions such as PO ring opening isomerization and oligomerization, the possibility of catalyst carbon deactivation was reduced and SPO was increased as well. 3.2 Effect of alkali metal promoters Fig. 5 showed HRTEM images and particle size distribution of Au/TS-1 from Cat-1 to Cat-10. The table on the bottom right corner of this picture exhibited the statistics of Au nanoparticle size and numbers. The Au particle size was given as an average of at least 500 random manually measured from the HRTEM image. Au nano-particle numbers counted on per 0.01 square micrometers. The Au/TS-1 catalyst prepared by normal deposition precipitation method had a low loading amount and uneven distribution of Au nanoparticles (Cat-1). Due to a strong interaction between Cs and Au, the precipitation agent Cs2CO3 caused a four to five times increase in Au nanoparticle uptake efficiency (Cat-4). Results consistent with what W.-S. Lee et al. had reported [24]. It is generally acknowledged that higher Au loading was propitious to enhance the density of active species and hence increasing reaction rate [20]. This phenomenon also directly explained in Fig. 4. With the addition of Cs2CO3 promoters, the density of “Au-Ti” active centers increased, and propylene conversion was significantly improved from 4.4 % (Cat-1) to 5.8 % (Cat-6). And RPO also increased from 98.8 gPO kgCat −1 h−1 (Cat-1) to 135.8 gPO kgCat −1 h−1 (Cat-6). With the help of alkaline gases and silane coupling pretreatment, the surface hydroxyl of TS-1 was converted into oxygen vacancies, which was more conducive to the loading of Au(OH)x nanoparticles. Therefore, the size control and uniform dispersion of gold nanoparticles were guaranteed (Cat-5, Cat-6). In order to further exhibiting the changes of the catalyst micro-structure after alkaline gases and silane coupling pretreatment, the oxygen vacancies in samples are tested by EPR (Figure S4). And the deviation of the magnetic field indicates a density change between surface hydroxyl species and oxygen vacancies of the catalyst. When combined the addition of Cs2CO3 promoters, NH3 and triethoxyvinylsilane pretreatment, both Au nanoparticle dispersity and uptake efficiency had reached an optimal level for catalyzing propylene epoxidation (Cat-10). And unexpected improvement in the catalytic performance of Au/TS-1 was obtained (Fig. 4, Cat-10). 3.3 Effect of alkaline gases pretreatment Even though alkaline gas and silane coupling pretreatments of Au/TS-1 had little significant effect on the increase of Au load capacity, the particle size was well controlled. As exhibited in Fig. 5, owing to the stabilizing effect between NH3, SBA and Au, the average size of Au nanoparticles decreased from 4.5 nm (Cat-1) to 3.1 nm (Cat-5), 3.2 nm (Cat-6) and 2.6 nm (Cat-9). Similar results also could be obtained when compared Cat-4 (3.3 nm), Cat-7 (2.9 nm), Cat-8 (2.8 nm) and Cat-10 (3.0 nm). Generally, the surface acidity of Au/TS-1 played a crucial role in direct epoxidation of propylene. Minor acidic sites were favorable for stabilizing H2O2 catalyzed by Au cluster. But excessive acidic species were bad for propylene epoxidation [7,42–44]. As previously discussed, unnecessary acidic species would trigger the isomerization or/and oligomerization of PO, consequently resulting in the deactivation of catalyst. Detailed information of different acidity on Au/TS-1 samples provided by the intensity of ammonia mass signal in NH3-TPD-MS. The strong NH3 desorption peak at 184 ℃ (Cat-1) could be ascribed to the acidic species of TiOx or extra-framework of Ti [44]. Peaks of the similar intensity on Cat-4 was found at 180 ℃. This implied that the addition of Cs additives did not make big difference on the distribution of acidic sites and related chemical environment around Au/TS-1 catalyst. However, under the influence of NH3 and triethoxyvinylsilane, the desorption peaks of ammonia on Cat-5, Cat-6 shifted to 170 and 162 ℃ respectively. Since NH3could partially react with extra-framework Ti or TiOx, and change the distribution of acidic species in Au/TS-1. Samples treated by alkaline gases (Cat-5, Cat-9 and Cat-10) exhibited much weak peak intensity. Furthermore, numbers of hydroxyl groups gradually reduced with the introducing silane coupling to Au/TS-1 sample (Cat-6). Due to the decrease in the number of hydroxyl groups, the adsorption and desorption of NH3 on the surface of Au/TS-1 also changed. The shift in peak position towards lower temperature region was specifically displayed in Fig. 6. As a result, with the multiple pretreatments of Cs, NH3 and triethoxyvinylsilane, Cat-10 showed the weakest acidity. 3.4 Effect of silane coupling pretreatment Due to the strong interaction between silane coupling and surface hydroxyl, the number of hydroxyl groups on samples could greatly reduce when treated with triethoxyvinylsilane. Fourier transform infrared (FTIR) and 29Si MAS NMR spectra were performed for further explanation of the changing on surface chemical environment and hydrophobicity. FTIR spectra in hydroxyl stretching vibration regions of Cat-1, Cat-4, Cat-5 and Cat-6 were shown in Fig. 7. Two peaks around 3520 cm−1 and 3735 cm−1 were represented silanol groups under different chemical atmosphere. The successful removal of both terminal silanol and silanol nests groups after triethoxyvinylsilane pretreatment on Au/TS-1 (Cat-6) was confirmed by the disappearance of the broad absorbance IR signal around 3520 cm−1 and the obvious weakening of the sharp peak around 3735 cm−1. Because the addition of Cs could effectively increase the loading amount of Au, partial silanol groups were occupied by abundant Au nanoparticles. Cat-4 also exhibited a better control of excessive silanol groups. For Cat-5, NH3 could react with acidic species. The interaction between extra-framework Ti species and ammonia would change the amount of acidity. Meanwhile, A hydrogen bonding structure will be formed between NH3 and silanol groups. This also partially changed the distribution of hydroxyl groups in Au/TS-1. Therefore, two peaks around 3520 cm−1 and 3735 cm−1 were correspondingly weakened. As shown in Fig. 8, 29Si MAS NMR spectroscopy could provide a direct proof on the coordination states of Si species in Au/TS-1 samples. All samples gave main resonance signals at −113 ppm and −103 ppm, corresponding to typical Si(OSi)4 (Q4) and Si(OSi)3OH (Q3) species in tetrahedral coordination. Owing to the addition of alkali metal promoters, alkaline gas and silane coupling pretreatments, Si(OSi)3OH species decreased a lot. As a result, the ratio between Q4 and Q3 signals was increased from 5.126 (Cat-1) to 10.594 (Cat-6). The trend of peak intensity variation exhibited in NMR spectroscopy were coordinate with results revealed in FTIR spectra. In order to further demonstrate intuitively that silane coupling treatment could enhance the hydrophilicity of Au/TS-1 samples, liquid contact angle tests were performed on Cat-1 and Cat-6 (See Figure S2). 3.5 Stability test on Au/TS-1 catalyst Catalytic performance of samples as function of time on stream was exhibited in Fig. 9. Values in this report were measured for three times and the mean values with error bar were presented. CC3H6, SPO, EH2 and RPO on Cat-1, Cat-4, Cat-5 and Cat-10 were compared in same reaction condition (180 ℃, GHSV = 10000 ml gcat −1 h−1, H2: O2: C3H6: N2 = 10: 10: 10: 70 in vol%). As showed in Cat-1, Au/TS-1 synthesized by normal deposition precipitation method without special pretreatment, did not have good performance on catalyzing direct epoxidation on C3H6 with O2 and H2. Cat-1 deactivated after 25 h testing. CC3H6 and SPO decreased with time from initial 4.4 %, 86.2 % to 3.4 %, 78.6 %. Correspondingly, EH2 and RPO decreased from 26.8 %, 98.8 gPO kgCat −1 h−1 to 17.0 %, 68.3 gPO kgCat −1 h−1. For Cat-4, although the addition of Cs could effectively improve the catalytic activity, it might only delay the deactivation of the catalyst and did not fundamentally prolong the catalytic activity. On the contrary, due to the high reaction activity, the generated PO could not be desorbed from the catalyst surface in time, which exacerbated the occurrence of side reactions such as ring opening isomerization and oligomerization, ultimately leading to carbon deposition and pore blockage, resulting in catalyst deactivation. As displayed in Fig. 9, CC3H6 and SPO of Cat-4 decreased from 5.8 %, 89.8 % to 4.5 %, 79.6 %. Accordingly, EH2 and RPO decreased from 33.7 %, 135.8 gPO kgCat −1 h−1 to 19.6 %, 92.0 gPO kgCat −1 h−1. The changing trend of Cat-4 catalytic performance was similar with Cat-1. Deactivation also happened after 20–30 h testing. Considering to the catalytic performance of Cat-5, alkaline gas post-treatment, represented by NH3, could effectively reduce acidic catalytic sites. Excessive acidity could lead to PO ring opening isomerization on the catalyst surface. With the help of alkaline gas pretreatment, the occurrence of side reactions was much reduced, and SPO was much improved when compared with Cat-1. Also, the deactivation of the catalyst due to carbon deposition and pore blockage could be delayed. CC3H6 and SPO decreased slowly with time from initial 5.4 %, 92.7 % to 5.1 %, 91.8 %. Correspondingly, EH2 and RPO changed from 30.5 %, 128.9 gPO kgCat −1 h−1 to 27.7 %, 120.3 gPO kgCat −1 h−1. Cat-6 exhibited similar changing trends on catalytic performance to Cat-5 and details were showed in Figure S1. Silane coupling post-treatment, represented by triethoxyvinylsilane, could improve the surface hydrophobicity of the catalyst, promote the rapid desorption of generated PO, and reduce the residence time of PO on the catalyst surface. Thus, inhibiting the occurrence of side reactions such as PO ring opening isomerization or oligomerization, and improving SPO. Therefore, AuTS-1 deactivation caused by carbon deposition and pore blockage could also be suppressed. When combined the addition of alkali metal promoters, alkaline gases and silane coupling pretreatment together, both Au nanoparticle dispersity and uptake efficiency had become more suitable for this catalytic system. And excessive acidic species was eliminated by NH3, hydrophobic surface of Au/TS-1 was favorable for C3H6 adsorption and PO desorption. After multiple post-treatment of Au/TS-1 (Cat-10), unexpected catalytic performance was obtained. Initial CC3H6, SPO, EH2 and RPO was 6.5 %, 95.1 %, 49.5 % and 160.3 gPO kgCat −1 h−1. All the factors were kept at a high level after 100 h stability test. TG analysis of Au/TS-1 samples after 100 h testing was then carried out in the temperature range of 30–800 ℃. As showed in Fig. 10, the percentage of total coke weight in Cat-1 (8.16 wt%) was 8 times that in Cat-10 (1.02 wt%), indicating that catalyst after multiple pretreatment was beneficial for the inhibition of the coke formation. Samples after the addition of Cs2CO3 promoter (Cat-4) and NH3 post-treatment (Cat-5), could also suppress the deactivation caused by carbon deposition and pore blockage to a certain degree. On the other hand, It should be noted that the 1.02 wt% weight loss in Cat-10 included the residual template. The characterizations of pore structural property and crystalline structure of the recycled samples were presented in Table S2 and Figure S5 correspondingly. 4 Conclusion Gas phase epoxidation of propylene with H2 and O2 has attracted great attention due to its efficient and environmental merit. This report focused on multiple pretreatment for Au/TS-1. Effect of alkali metal promoters, alkaline gases and silane coupling pretreatments had been carefully investigated. Cs2CO3 promoter was beneficial to increasing Au nanoparticles uptake efficiency. Both NH3 and triethoxyvinylsilane post-treatment were good for smaller and more uniform loading of Au nanoparticles. The decreasing in surface hydroxyl density effectively alleviated the occurrence of PO ring opening isomerization. At the same time, silane coupling treatment increased the hydrophobicity of TS-1 surface, which was conducive to the rapid desorption of generated PO and significantly increases SPO. When combined the addition of alkali metal promoters, alkaline gases and silane coupling pretreatment, excellent catalytic performance of Au/TS-1 was obtained. CC3H6, SPO, EH2 and RPO were almost constant after 100 h stability test. This also proved that multiple pretreatment strategy used in this report was effective in improving the catalytic performance of Au/TS-1 and provides a new idea for the theoretical research of heterogeneous synergistic catalysis by exploring the mechanism of adsorption, desorption, dispersion, migration and transformation mechanism of complex catalytic system. CRediT authorship contribution statement Chenyang Zhao: Writing – review & editing, Writing – original draft, Formal analysis, Data curation, Conceptualization. Yujia Liu: Investigation, Formal analysis, Data curation. Yupeng Tian: Formal analysis, Data curation. Yahui Li: Formal analysis. Junjie Feng: Formal analysis. Wei Xu: Supervision, Project administration, Investigation. Ning Shi: Investigation, Formal analysis. Zhe Yang: Supervision, Project administration, Funding acquisition. bing sun: Writing – review & editing, Writing – original draft, Supervision, Methodology, Data curation. Declaration of Competing Interest The authors declare that they have no known competing financial interests or personal relationships that could have appeared to influence the work reported in this paper. Acknowledgment This work was financially supported by the National Natural Science Foundation of China (22208382 and 22278452). Appendix A Supporting information Fundamental pore structural property of Au/TS-1 samples (Cat-1 to Cat-10), pore structural property of Au/TS-1 samples after stability testing were shown in Table S1 and S2. Catalytic performance of samples (Cat-1, Cat-4, Cat-6, Cat-10) as function of time on stream, liquid contact angle tests on Cat-1 (a) and Cat-6 (b), X-ray diffraction patterns of Cat-2 to Cat-10, EPR spectrums between Cat-1 and Cat-9 and XRD patterns of Au/TS-1 samples after stability testing were exhibited in Figure S1 to S5. Supplementary data associated with this article can be found in the online version at doi:10.1016/j.apcata.2024.119895. Appendix A Supplementary material Supplementary material References [1] C. Zhao H. Zhu Y. Liu J. Feng X. Feng W. Xu Z. Yang B. Sun Micropore blocking strategy for mitigating adsorption and diffusion limitations in the direct epoxidation of propylene Chem. Eng. Sci. 253 2022 117574 C. Zhao, H. Zhu, Y. Liu, J. Feng, X. Feng, W. Xu, Z. Yang, B. Sun, Micropore blocking strategy for mitigating adsorption and diffusion limitations in the direct epoxidation of propylene, Chem. Eng. Sci. 253 (2022) 117574. [2] L. Wang J. Dai Y. Xu Y. Hong J. Huang D. Sun Q. Li Titanium silicalite-1 zeolite encapsulating Au particles as a catalyst for vapor phase propylene epoxidation with H2/O2: a matter of Au–Ti synergic interaction J. Mater. Chem. A 8 2020 4428 4436 L. Wang, J. Dai, Y. Xu, Y. Hong, J. Huang, D. Sun, Q. Li, Titanium silicalite-1 zeolite encapsulating Au particles as a catalyst for vapor phase propylene epoxidation with H2/O2: a matter of Au–Ti synergic interaction, J. Mater. Chem. A. 8 (2020) 4428-4436. [3] Y. Liu C. Zhao B. Sun H. Zhu W. Xu Preparation and modification of Au/TS-1 catalyst in the direct epoxidation of propylene with H2 and O2 Appl. Catal. A Gen. 624 2021 118329 Y. Liu, C. Zhao, B. Sun, H. Zhu, W. Xu, Preparation and modification of Au/TS-1 catalyst in the direct epoxidation of propylene with H2 and O2, Appl. Catal. A-Gen. 624 (2021) 118329. [4] Z. Zhang X. Zhao G. Wang J. Xu M. Lu Y. Tang W. Fu X. Duan G. Qian D. Chen X. Zhou Uncalcined TS-2 immobilized Au nanoparticles as a bifunctional catalyst to boost direct propylene epoxidation with H2 and O2 AIChE J. 66 2019 16815 Z. Zhang, X. Zhao, G. Wang, J. Xu, M. Lu, Y. Tang, W. Fu, X. Duan, G. Qian, D. Chen, X. Zhou, Uncalcined TS-2 immobilized Au nanoparticles as a bifunctional catalyst to boost direct propylene epoxidation with H2 and O2, AIChE J. 66 (2019) 16815. [5] W.S. Lee L.C. Lai M.C. Akatay E.A. Stach F.H. Ribeiro W.N. Delgass Probing the gold active sites in Au/TS-1 for gas-phase epoxidation of propylene in the presence of hydrogen and oxygen J. Catal. 296 2012 31 42 W.S. Lee, L.C. Lai, M.C. Akatay, E.A. Stach, F.H. Ribeiro, W.N. Delgass, Probing the gold active sites in Au/TS-1 for gas-phase epoxidation of propylene in the presence of hydrogen and oxygen, J. Catal. 296 (2012) 31-42. [6] C.H. Liu Y. Guan E.J.M. Hensen J.F. Lee C.M. Yang Au/TiO2@SBA-15 nanocomposites as catalysts for direct propylene epoxidation with O2 and H2 mixtures J. Catal. 282 2011 94 102 C.H. Liu, Y. Guan, E.J.M. Hensen, J.F. Lee, C.M. Yang, Au/TiO2@SBA-15 nanocomposites as catalysts for direct propylene epoxidation with O2 and H2 mixtures, J. Catal. 282 (2011) 94-102. [7] A.K. Sinha S. Seelan T. Akita S. Tsubota M. Haruta Vapor phase propylene epoxidation over Au/Ti-MCM-41catalysts prepared by different Ti incorporation modes Appl. Catal. A Gen. 240 2003 243 252 A.K. Sinha, S. Seelan, T. Akita, S. Tsubota, M. Haruta, Vapor phase propylene epoxidation over Au/Ti-MCM-41catalysts prepared by different Ti incorporation modes, Appl. Catal. A-Gen. 240 (2003) 243–252. [8] B.S. Uphade T. Akita T. Nakamura M. Haruta Vapor-phase epoxidation of propene Using H2 and O2 over Au/Ti–MCM-48 J. Catal. 209 2002 331 340 B.S. Uphade, T. Akita, T. Nakamura, M. Haruta, Vapor-Phase Epoxidation of Propene Using H2 and O2 over Au/Ti–MCM-48, J. Catal. 209 (2002) 331-340. [9] G. Wang W. Du X. Duan Y. Cao Z. Zhang J. Xu W. Chen G. Qian W. Yuan X. Zhou D. Chen Mechanism-guided elaboration of ternary Au–Ti–Si sites to boost propylene oxide formation Chem. Catal. 1 2021 1 11 G. Wang, W. Du, X. Duan, Y. Cao, Z. Zhang, J. Xu, W. Chen, G. Qian, W. Yuan, X. Zhou, D. Chen, Mechanism-guided elaboration of ternary Au–Ti–Si sites to boost propylene oxide formation, Chem Catal. 1 (2021) 1-11. [10] J. Xu Z. Zhang G. Wang X. Duan G. Qian X. Zhou Zeolite crystal size effects of Au/uncalcined TS-1 bifunctional catalysts on direct propylene epoxidation with H2 and O2 Chem. Eng. Sci. 227 2020 115907 J. Xu, Z. Zhang, G. Wang, X. Duan, G. Qian, X. Zhou, Zeolite crystal size effects of Au/uncalcined TS-1 bifunctional catalysts on direct propylene epoxidation with H2 and O2. Chem. Eng. Sci. 227 (2020) 115907. [11] M. Sankar Q. He R.V. Engel M.A. Sainna A.J. Logsdail A. Roldan D.J. Willock N. Agarwal C.J. Kiely G.J. Hutchings Role of the support in gold-containing nanoparticles as heterogeneous catalysts Chem. Rev. 120 2020 3890 3938 M. Sankar, Q. He, R.V. Engel, M.A. Sainna, A.J. Logsdail, A. Roldan, D.J. Willock, N. Agarwal, C.J. Kiely, G.J. Hutchings, Role of the Support in Gold-Containing Nanoparticles as Heterogeneous Catalysts, Chem. Rev. 120 (2020) 3890-3938. [12] T. Ishida T. Murayama A. Taketoshi M. Haruta Importance of size and contact structure of gold nanoparticles for the genesis of unique catalytic processes Chem. Rev. 120 2020 464 525 T. Ishida, T. Murayama, A. Taketoshi, M. Haruta, Importance of Size and Contact Structure of Gold Nanoparticles for the Genesis of Unique Catalytic Processes, Chem. Rev. 120 (2020) 464-525. [13] C. Zhao Y. Liu H. Li F. An W. Xu Z. Yang B. Sun Sulfur-resistant MoO2/TS-1 zeolite armored PdCu alloy composite membrane for hydrogen separation under H2S containing steam J. Membr. Sci. Lett. 3 2023 100037 C. Zhao, Y. Liu, H. Li, F. An, W. Xu, Z. Yang, B. Sun, Sulfur-resistant MoO2/TS-1 zeolite armored PdCu alloy composite membrane for hydrogen separation under H2S containing steam, J. Membr. Sci. Lett. 3 (2023) 100037. [14] B. Yu T. Ayvalı E. Raine T. Li M.M.J. Li J. Zheng S. Wu A.A. Bagabas S.C.E. Tsang Enhanced propylene oxide selectivity for gas phase direct propylene epoxidation by lattice expansion of silver atoms on nickel nanoparticles Appl. Catal. B Environ. 243 2019 304 312 B. Yu, T. Ayvalı, E. Raine, T. Li, M.M.J. Li, J. Zheng, S. Wu, A.A. Bagabas, S.C.E. Tsang, Enhanced propylene oxide selectivity for gas phase direct propylene epoxidation by lattice expansion of silver atoms on nickel nanoparticles, Appl. Catal. B-Environ. 243 (2019) 304-312. [15] N. Sheng Z. Song J. Yuan W. Liang J. Zhao J. Zhang W. Xu B. Sun X. Feng Z. Yang C. Yang Effective regulation of the Au spatial position in a hierarchically structured Au/HTS-1 catalyst: to boost the catalytic performance of propene epoxidation with H2 and O2 ACS Sustain. Chem. Eng. 10 2022 9515 9524 N. Sheng, Z. Song, J. Yuan, W. Liang, J. Zhao, J. Zhang, W. Xu, B. Sun, X. Feng, Z. Yang, C. Yang, Effective Regulation of the Au Spatial Position in a Hierarchically Structured Au/HTS-1 Catalyst: To Boost the Catalytic Performance of Propene Epoxidation with H2 and O2, ACS Sustain. Chem. Eng. 10 (2022) 9515-9524. [16] W. Li L. Chen M. Qiu W. Li Y. Zhang Y. Zhu J. Li X. Chen Highly efficient epoxidation of propylene with in situ-generated H2O2 over a hierarchical TS-1 zeolite-supported non-noble nickel catalyst ACS Catal. 13 2023 10487 10499 W. Li, L. Chen, M. Qiu, W. Li, Y. Zhang, Y. Zhu, J. Li, X. Chen, Highly Efficient Epoxidation of Propylene with In Situ-Generated H2O2 over a Hierarchical TS-1 Zeolite-Supported Non-Noble Nickel Catalyst, ACS Catal. 13 (2023) 10487-10499. [17] Z. Song X. Feng N. Sheng D. Lin Y. Li Y. Liu X. Chen D. Chen X. Zhou C. Yang Cost-efficient core-shell TS-1/silicalite-1 supported Au catalysts: towards enhanced stability for propene epoxidation with H2 and O2 Chem. Eng. J. 377 2019 119927 Z. Song, X. Feng, N. Sheng, D. Lin, Y. Li, Y. Liu, X. Chen, D. Chen, X. Zhou, C. Yang, Cost-efficient core-shell TS-1/silicalite-1 supported Au catalysts: Towards enhanced stability for propene epoxidation with H2 and O2, Chem. Eng. J. 377 (2019) 119927. [18] Q. Zhu M. Liang W. Yan W. Ma Effective hierarchization of TS-1 and its catalytic performance in propene epoxidation Micro Mesopor. Mat. 278 2019 307 313 Q. Zhu, M. Liang, W. Yan, W. Ma, Effective hierarchization of TS-1 and its catalytic performance in propene epoxidation, Micropor. Mesopor. Mat. 278 (2019) 307-313. [19] X. Feng N. Sheng Y. Liu X. Chen D. Chen C. Yang X. Zhou Simultaneously enhanced stability and selectivity for propene epoxidation with H2 and O2 on Au catalysts supported on nano-crystalline mesoporous TS-1 ACS Catal. 7 2017 2668 2675 X. Feng, N. Sheng, Y. Liu, X. Chen, D. Chen, C. Yang, X. Zhou, Simultaneously Enhanced Stability and Selectivity for Propene Epoxidation with H2 and O2 on Au Catalysts Supported on Nano-Crystalline Mesoporous TS-1, ACS Catal. 7 (2017) 2668-2675. [20] Y. Ren X. Sun J. Huang L. Zhang B. Zhang M. Haruta A. Lu Dual-component sodium and cesium promoters for Au/TS-1: enhancement of propene epoxidation with hydrogen and oxygen Ind. Eng. Chem. Res. 59 2020 8155 8163 Y. Ren, X. Sun, J. Huang, L. Zhang, B. Zhang, M. Haruta, A. Lu, Dual-Component Sodium and Cesium Promoters for Au/TS-1: Enhancement of Propene Epoxidation with Hydrogen and Oxygen. Ind. Eng. Chem. Res. 59 (2020) 8155-8163. [21] W.S. Lee M.C. Akatay E.A. Stach F.H. Ribeiro W.N. Delgass Reproducible preparation of Au/TS-1 with high reaction rate for gas phase epoxidation of propylene J. Catal. 287 2012 178 189 W.S. Lee, M.C. Akatay, E.A. Stach, F.H. Ribeiro, W.N. Delgass, Reproducible preparation of Au/TS-1 with high reaction rate for gas phase epoxidation of propylene, J. Catal. 287 (2012) 178-189. [22] X. Feng J. Yang X. Duan Y. Cao B. Chen W. Chen D. Lin G. Qian D. Chen C. Yang X. Zhou Enhanced catalytic performance for propene eposidation with H2 and O2 over bimetallic Au-Ag uncalined TS-1 catalysts ACS Catal. 8 2018 7799 7808 X. Feng, J. Yang, X. Duan, Y. Cao, B. Chen, W. Chen, D. Lin, G. Qian, D. Chen, C. Yang, X. Zhou, Enhanced catalytic performance for propene eposidation with H2 and O2 over bimetallic Au-Ag uncalined TS-1 catalysts, ACS Catal. 8 (2018) 7799–7808. [23] D. Lin X. Zheng X. Feng N. Sheng Z. Song Y. Liu X. Chen Z. Cai D. Chen C. Yang Enhancing the dynamic electron transfer of Au species on wormhole-like TS-1 for boosting propene epoxidation performance with H2 and O2 Green. Energy Environ. 5 2020 433 443 D. Lin, X. Zheng, X. Feng, N. Sheng, Z. Song, Y. Liu, X. Chen, Z. Cai, D. Chen, C. Yang, Enhancing the dynamic electron transfer of Au species on wormhole-like TS-1 for boosting propene epoxidation performance with H2 and O2, Green Energy Environ. 5 (2020) 433-443. [24] W.S. Lee M.C. Akatay E.A. Stach F.H. Ribeiro W.N. Delgass Enhanced reaction rate for gas-phase epoxidation of propylene using H2 and O2 by Cs promotion of Au/TS-1 J. Catal. 308 2013 98 113 W.S. Lee, M.C. Akatay, E.A. Stach, F.H. Ribeiro, W.N. Delgass, Enhanced reaction rate for gas-phase epoxidation of propylene using H2 and O2 by Cs promotion of Au/TS-1, J. Catal. 308 (2013) 98-113. [25] J. Lu X. Zhang J.J. Bravo-Suárez T. Fujitani S.T. Oyama Effect of composition and promoters in Au/TS-1 catalysts for direct propylene epoxidation using H2 and O2 Catal. Today 147 2009 186 195 J. Lu, X. Zhang, J.J. Bravo-Suárez, T. Fujitani, S.T. Oyama, Effect of composition and promoters in Au/TS-1 catalysts for direct propylene epoxidation using H2 and O2, Catal. Today 147 (2009) 186-195. [26] A.K. Sinha S. Seelan S. Tsubota M. Haruta A three-dimensional mesoporous titanosilicate support for gold nanoparticles: vapor-phase epoxidation of propene with high conversion Angew. Chem. Int. Ed. 43 2004 1546 1548 A.K. Sinha, S. Seelan, S. Tsubota, M. Haruta, A Three-Dimensional Mesoporous Titanosilicate Support for Gold Nanoparticles: Vapor-Phase Epoxidation of Propene with High Conversion, Angew. Chem. Int. Ed. 43 (2004) 1546-1548. [27] Y. Ren J. Huang Q. Lv Y. Xie A. Lu M. Haruta Dual-component gas pretreatment for Au/TS-1: enhanced propylene epoxidation with oxygen and hydrogen Appl. Catal. A-Gen. 584 2019 117172 Y. Ren, J. Huang, Q. Lv, Y. Xie, A. Lu, M. Haruta, Dual-component gas pretreatment for Au/TS-1: Enhanced propylene epoxidation with oxygen and hydrogen. Appl. Catal. A-Gen. 584 (2019) 117172. [28] E.E. Stangland B. Taylor R.P. Andres W.N. Delgass Direct vapor phase propylene epoxidation over deposition-precipitation gold-titania catalysts in the presence of H2/O2 effects of support, neutralizing agent, and pretreatment J. Phys. Chem. B 109 2005 2321 2330 E.E. Stangland, B. Taylor, R.P. Andres, W.N. Delgass, Direct Vapor Phase Propylene Epoxidation over Deposition-Precipitation Gold-Titania Catalysts in the Presence of H2/O2 Effects of Support, Neutralizing Agent, and Pretreatment, J. Phys. Chem. B 109 (2005) 2321-2330. [29] R.B. Khomane B.D. Kulkarni A. Paraskar S.R. Sainkar Synthesis, characterization and catalytic performance of titanium silicalite-1 prepared in micellar media Mater. Chem. Phys. 76 2002 99 103 R.B. Khomane, B.D. Kulkarni, A. Paraskar, S.R. Sainkar, Synthesis, characterization and catalytic performance of titanium silicalite-1 prepared in micellar media. Mater. Chem. Phys. 76 (2002) 99-103. [30] C.S. Cundy J.O. Forrest Some observations on the preparation and properties of colloidal silicalites Part II: preparation, characterisation and properties of colloidal silicalite-1, TS-1, silicalite-2 and TS-2 Microporous Mesoporous Mater. 72 2004 67 80 C.S. Cundy, J.O. Forrest, Some observations on the preparation and properties of colloidal silicalites Part II: Preparation, characterisation and properties of colloidal silicalite-1, TS-1, silicalite-2 and TS-2. Microporous Mesoporous Mater. 72 (2004) 67-80. [31] B. Taylor J. Lauterbach W.N. Delgass Gas-phase epoxidation of propylene over small gold ensembles on TS-1 Appl. Catal. A Gen. 291 2005 188 198 B. Taylor, J. Lauterbach, W.N. Delgass, Gas-phase epoxidation of propylene over small gold ensembles on TS-1. Appl. Catal. A-Gen. 291 (2005) 188-198. [32] J. Lin F. Xin L. Yang Z. Zhuang Synthesis, characterization of hierarchical TS-1 and its catalytic performance for cyclohexanone ammoximation Catal. Commun. 45 2014 104 108 J. Lin, F. Xin, L. Yang, Z. Zhuang, Synthesis, characterization of hierarchical TS-1 and its catalytic performance for cyclohexanone ammoximation. Catal. Commun. 45 (2014) 104-108. [33] Q. Zhu M. Liang W. Yan W. Ma Effective hierarchization of TS-1 and its catalytic performance in propene epoxidation Microporous Mesoporous Mater. 278 2019 307 313 Q. Zhu, M. Liang, W. Yan, W. Ma, Effective hierarchization of TS-1 and its catalytic performance in propene epoxidation. Microporous Mesoporous Mater. 278 (2019) 307-313. [34] D.P. Serrano R. Sanz P. Pizarro I. Moreno S. Medina Hierarchical TS-1 zeolite as an efficient catalyst for oxidative desulphurization of hydrocarbon fractions Appl. Catal. B Environ. 146 2014 35 42 D.P. Serrano, R. Sanz, P. Pizarro, I. Moreno, S. Medina, Hierarchical TS-1 zeolite as an efficient catalyst for oxidative desulphurization of hydrocarbon fractions. Appl. Catal. B-Environ. 146 (2014) 35-42. [35] N. Sheng Z. Liu Z. Song D. Lin X. Feng Y. Liu X. Chen D. Chen X. Zhou C. Yang Enhanced stability for propene epoxidation with H2 and O2 over wormholelike hierarchical TS-1 supported Au nanocatalyst Chem. Eng. J. 377 2019 119954 N. Sheng, Z. Liu, Z. Song, D. Lin, X. Feng, Y. Liu, X. Chen, D. Chen, X. Zhou, C. Yang, Enhanced stability for propene epoxidation with H2 and O2 over wormholelike hierarchical TS-1 supported Au nanocatalyst. Chem. Eng. J. 377 (2019) 119954. [36] X. Feng X. Duan G. Qian X. Zhou D. Chen W. Yuan Au nanoparticles deposited on the external surfaces of TS-1: enhanced stability and activity for direct propylene epoxidation with H2 and O2 Appl. Catal. B Environ. 150-151 2014 396 401 X. Feng, X. Duan, G. Qian, X. Zhou, D. Chen, W. Yuan, Au nanoparticles deposited on the external surfaces of TS-1: Enhanced stability and activity for direct propylene epoxidation with H2 and O2. Appl. Catal. B-Environ. 150-151 (2014) 396-401. [37] C.S. Cundy J.O. Forrest R.J. Plaisted Some observations on the preparation and properties of colloidal silicalites. Part I: synthesis of colloidal silicalite-1 and titanosilicalite-1 (TS-1) Microporous Mesoporous Mater. 66 2003 143 156 C.S. Cundy, J.O. Forrest, R.J. Plaisted, Some observations on the preparation and properties of colloidal silicalites. Part I: synthesis of colloidal silicalite-1 and titanosilicalite-1 (TS-1). Microporous Mesoporous Mater. 66 (2003) 143-156. [38] X. Feng X. Duan J. Yang G. Qian X. Zhou D. Chen W. Yuan Au/uncalcined TS-1 catalysts for direct propene epoxidation with H2 and O2: effects of Si/Ti molar ratio and Au loading Chem. Eng. J. 278 2015 234 239 X. Feng, X. Duan, J. Yang, G. Qian, X. Zhou, D. Chen, W. Yuan, Au/uncalcined TS-1 catalysts for direct propene epoxidation with H2 and O2: Effects of Si/Ti molar ratio and Au loading. Chem. Eng. J. 278 (2015) 234-239. [39] X. Feng X. Duan H. Cheng G. Qian D. Chen W. Yuan X. Zhou Au/TS-1 catalyst prepared by deposition–precipitation method for propene epoxidation with H2/O2: insights into the effects of slurry aging time and Si/Ti molar ratio J. Catal. 325 2015 128 135 X. Feng, X. Duan, H. Cheng, G. Qian, D. Chen, W. Yuan, X. Zhou, Au/TS-1 catalyst prepared by deposition–precipitation method for propene epoxidation with H2/O2: Insights into the effects of slurry aging time and Si/Ti molar ratio. J. Catal. 325 (2015) 128-135. [40] M. Du G. Zhan X. Yang H. Wang W. Lin Y. Zhou J. Zhu L. Lin J. Huang D. Sun L. Jia Q. Li Ionic liquid-enhanced immobilization of biosynthesized Au nanoparticles on TS-1 toward efficient catalysts for propylene epoxidation J. Catal. 283 2011 192 201 M. Du, G. Zhan, X. Yang, H. Wang, W. Lin, Y. Zhou, J. Zhu, L. Lin, J. Huang, D. Sun, L. Jia, Q. Li, Ionic liquid-enhanced immobilization of biosynthesized Au nanoparticles on TS-1 toward efficient catalysts for propylene epoxidation. J. Catal. 283 (2011) 192-201. [41] C. Qi M. Okumura T. Akita M. Haruta Vapor-phase epoxidation of propylene using H2/O2 mixture over gold catalysts supported on non-porous and mesoporous titania-silica: effect of preparation conditions and pretreatments prior to reaction Appl. Catal. A Gen. 263 2004 19 26 C. Qi, M. Okumura, T. Akita, M. Haruta, Vapor-phase epoxidation of propylene using H2/O2 mixture over gold catalysts supported on non-porous and mesoporous titania-silica: effect of preparation conditions and pretreatments prior to reaction. Appl. Catal. A-Gen. 263 (2004) 19-26. [42] B. Chowdhury K.K. Bando J.J. Bravo-Suarez S. Tsuboto M. Haruta Activity of silylated titanosilicate supported gold nanoparticles towards direct propylene epoxidation reaction in the presence of trimethylamine J. Mol. Catal. A Chem. 359 2012 21 27 B. Chowdhury, K.K. Bando, J.J. Bravo-Suarez, S. Tsuboto, M. Haruta, Activity of silylated titanosilicate supported gold nanoparticles towards direct propylene epoxidation reaction in the presence of trimethylamine. J. Mol. Catal. A: Chem. 359 (2012) 21-27. [43] S. Yao L. Xu J. Wang X. Jing T. Odoom-Wubah D. Sun J. Huang Q. Li Activity and stability of titanosilicate supported Au catalyst for propylene epoxidation with H2 and O2 Mol. Catal. 448 2018 144 152 S. Yao, L. Xu, J. Wang, X. Jing,T. Odoom-Wubah, D. Sun, J. Huang, Q. Li, Activity and stability of titanosilicate supported Au catalyst for propylene epoxidation with H2 and O2. Mol. Catal. 448 (2018) 144-152. [44] G. Xiong Y. Cao Z. Guo Q. Jia F. Tian L. Liu The roles of different titanium species in TS-1 zeolite in ptopylene epoxidation studied by in situ UV Raman spectroscopy Phys. Chem. Chem. Phys. 18 2016 190 196 G. Xiong, Y. Cao, Z. Guo, Q. Jia, F. Tian, L. Liu, The roles of different titanium species in TS-1 zeolite in ptopylene epoxidation studied by in situ UV Raman spectroscopy. Phys. Chem. Chem. Phys. 18 (2016) 190-196.",
      "scopus-id": "85199883016",
      "coredata": {
        "eid": "1-s2.0-S0926860X24003405",
        "dc:description": "Direct epoxidation of propylene (C3H6) with hydrogen (H2) and oxygen (O2) over Au/TS-1 catalyst was promising way for the synthesis of propylene oxide (PO). However, high selectivity of PO (>95 %) and conversion of C3H6 (>5 %) cannot be achieved at the same time. The industrialization process was severely restricted. In this paper, Au/TS-1 catalysts were synthesized by deposition precipitation method with alkali metal promoter. And alkaline gases and silane coupling post-treatment were performed to promote the catalytic activity. The prepared samples exhibited a much better C3H6 conversion (6.5 %) and PO selectivity (95.1 %) compared with general catalyst using normal synthetic technology. Cs2CO3 was beneficial to increasing Au nanoparticles uptake efficiency. Both NH3 and triethoxyvinylsilane post-treatment were good for smaller and more uniform loading of Au nanoparticles. The decreasing in surface hydroxyl density effectively alleviated the occurrence of PO ring opening isomerization. The increased hydrophobicity of TS-1 surface was conducive to the rapid desorption of generated PO and significantly increased PO selectivity. Multiple pretreatment was also favorable for extending the lifetime of Au/TS-1 catalyst.",
        "openArchiveArticle": "false",
        "prism:coverDate": "2024-09-25",
        "openaccessUserLicense": null,
        "prism:aggregationType": "Journal",
        "prism:url": "https://api.elsevier.com/content/article/pii/S0926860X24003405",
        "dc:creator": [
          {
            "@_fa": "true",
            "$": "Zhao, Chenyang"
          },
          {
            "@_fa": "true",
            "$": "Liu, Yujia"
          },
          {
            "@_fa": "true",
            "$": "Tian, Yupeng"
          },
          {
            "@_fa": "true",
            "$": "Li, Yahui"
          },
          {
            "@_fa": "true",
            "$": "Feng, Junjie"
          },
          {
            "@_fa": "true",
            "$": "Xu, Wei"
          },
          {
            "@_fa": "true",
            "$": "Shi, Ning"
          },
          {
            "@_fa": "true",
            "$": "Yang, Zhe"
          },
          {
            "@_fa": "true",
            "$": "Sun, Bing"
          }
        ],
        "link": [
          {
            "@_fa": "true",
            "@rel": "self",
            "@href": "https://api.elsevier.com/content/article/pii/S0926860X24003405"
          },
          {
            "@_fa": "true",
            "@rel": "scidir",
            "@href": "https://www.sciencedirect.com/science/article/pii/S0926860X24003405"
          }
        ],
        "dc:format": "application/json",
        "openaccessType": null,
        "pii": "S0926-860X(24)00340-5",
        "prism:volume": "685",
        "articleNumber": "119895",
        "prism:publisher": "Elsevier B.V. All rights are reserved, including those for text and data mining, AI training, and similar technologies.",
        "dc:title": "Enhanced catalytic performance for gas phase epoxidation of propylene with H2 and O2 by multiple pretreated Au/TS-1 catalysts",
        "prism:copyright": "© 2024 Elsevier B.V. All rights are reserved, including those for text and data mining, AI training, and similar technologies.",
        "openaccess": "0",
        "prism:issn": "0926860X",
        "dcterms:subject": [
          {
            "@_fa": "true",
            "$": "Gas phase epoxidation"
          },
          {
            "@_fa": "true",
            "$": "Au/TS-1"
          },
          {
            "@_fa": "true",
            "$": "Alkali metal promoter"
          },
          {
            "@_fa": "true",
            "$": "Alkaline gases pretreatment"
          },
          {
            "@_fa": "true",
            "$": "Silane coupling post-treatment"
          }
        ],
        "openaccessArticle": "false",
        "prism:publicationName": "Applied Catalysis A: General",
        "openaccessSponsorType": null,
        "prism:pageRange": "119895",
        "pubType": "fla",
        "prism:coverDisplayDate": "25 September 2024",
        "prism:doi": "10.1016/j.apcata.2024.119895",
        "prism:startingPage": "119895",
        "dc:identifier": "doi:10.1016/j.apcata.2024.119895",
        "openaccessSponsorName": null
      },
      "objects": {
        "object": [
          {
            "@category": "standard",
            "@height": "500",
            "@width": "678",
            "@_fa": "true",
            "$": "https://api.elsevier.com/content/object/eid/1-s2.0-S0926860X24003405-gr9.jpg?httpAccept=%2A%2F%2A",
            "@multimediatype": "JPEG image file",
            "@type": "IMAGE-DOWNSAMPLED",
            "@size": "97837",
            "@ref": "gr9",
            "@mimetype": "image/jpeg"
          },
          {
            "@category": "standard",
            "@height": "284",
            "@width": "339",
            "@_fa": "true",
            "$": "https://api.elsevier.com/content/object/eid/1-s2.0-S0926860X24003405-gr8.jpg?httpAccept=%2A%2F%2A",
            "@multimediatype": "JPEG image file",
            "@type": "IMAGE-DOWNSAMPLED",
            "@size": "25778",
            "@ref": "gr8",
            "@mimetype": "image/jpeg"
          },
          {
            "@category": "standard",
            "@height": "292",
            "@width": "339",
            "@_fa": "true",
            "$": "https://api.elsevier.com/content/object/eid/1-s2.0-S0926860X24003405-gr7.jpg?httpAccept=%2A%2F%2A",
            "@multimediatype": "JPEG image file",
            "@type": "IMAGE-DOWNSAMPLED",
            "@size": "25018",
            "@ref": "gr7",
            "@mimetype": "image/jpeg"
          },
          {
            "@category": "standard",
            "@height": "276",
            "@width": "339",
            "@_fa": "true",
            "$": "https://api.elsevier.com/content/object/eid/1-s2.0-S0926860X24003405-gr10.jpg?httpAccept=%2A%2F%2A",
            "@multimediatype": "JPEG image file",
            "@type": "IMAGE-DOWNSAMPLED",
            "@size": "27363",
            "@ref": "gr10",
            "@mimetype": "image/jpeg"
          },
          {
            "@category": "standard",
            "@height": "288",
            "@width": "339",
            "@_fa": "true",
            "$": "https://api.elsevier.com/content/object/eid/1-s2.0-S0926860X24003405-gr2.jpg?httpAccept=%2A%2F%2A",
            "@multimediatype": "JPEG image file",
            "@type": "IMAGE-DOWNSAMPLED",
            "@size": "26163",
            "@ref": "gr2",
            "@mimetype": "image/jpeg"
          },
          {
            "@category": "standard",
            "@height": "199",
            "@width": "251",
            "@_fa": "true",
            "$": "https://api.elsevier.com/content/object/eid/1-s2.0-S0926860X24003405-ga1.jpg?httpAccept=%2A%2F%2A",
            "@multimediatype": "JPEG image file",
            "@type": "IMAGE-DOWNSAMPLED",
            "@size": "19940",
            "@ref": "ga1",
            "@mimetype": "image/jpeg"
          },
          {
            "@category": "standard",
            "@height": "286",
            "@width": "339",
            "@_fa": "true",
            "$": "https://api.elsevier.com/content/object/eid/1-s2.0-S0926860X24003405-gr1.jpg?httpAccept=%2A%2F%2A",
            "@multimediatype": "JPEG image file",
            "@type": "IMAGE-DOWNSAMPLED",
            "@size": "28704",
            "@ref": "gr1",
            "@mimetype": "image/jpeg"
          },
          {
            "@category": "standard",
            "@height": "277",
            "@width": "339",
            "@_fa": "true",
            "$": "https://api.elsevier.com/content/object/eid/1-s2.0-S0926860X24003405-gr6.jpg?httpAccept=%2A%2F%2A",
            "@multimediatype": "JPEG image file",
            "@type": "IMAGE-DOWNSAMPLED",
            "@size": "22513",
            "@ref": "gr6",
            "@mimetype": "image/jpeg"
          },
          {
            "@category": "standard",
            "@height": "782",
            "@width": "791",
            "@_fa": "true",
            "$": "https://api.elsevier.com/content/object/eid/1-s2.0-S0926860X24003405-gr5.jpg?httpAccept=%2A%2F%2A",
            "@multimediatype": "JPEG image file",
            "@type": "IMAGE-DOWNSAMPLED",
            "@size": "147546",
            "@ref": "gr5",
            "@mimetype": "image/jpeg"
          },
          {
            "@category": "standard",
            "@height": "269",
            "@width": "339",
            "@_fa": "true",
            "$": "https://api.elsevier.com/content/object/eid/1-s2.0-S0926860X24003405-gr4.jpg?httpAccept=%2A%2F%2A",
            "@multimediatype": "JPEG image file",
            "@type": "IMAGE-DOWNSAMPLED",
            "@size": "29041",
            "@ref": "gr4",
            "@mimetype": "image/jpeg"
          },
          {
            "@category": "standard",
            "@height": "287",
            "@width": "376",
            "@_fa": "true",
            "$": "https://api.elsevier.com/content/object/eid/1-s2.0-S0926860X24003405-gr3.jpg?httpAccept=%2A%2F%2A",
            "@multimediatype": "JPEG image file",
            "@type": "IMAGE-DOWNSAMPLED",
            "@size": "19115",
            "@ref": "gr3",
            "@mimetype": "image/jpeg"
          },
          {
            "@category": "thumbnail",
            "@height": "161",
            "@width": "219",
            "@_fa": "true",
            "$": "https://api.elsevier.com/content/object/eid/1-s2.0-S0926860X24003405-gr9.sml?httpAccept=%2A%2F%2A",
            "@multimediatype": "GIF image file",
            "@type": "IMAGE-THUMBNAIL",
            "@size": "13721",
            "@ref": "gr9",
            "@mimetype": "image/gif"
          },
          {
            "@category": "thumbnail",
            "@height": "164",
            "@width": "196",
            "@_fa": "true",
            "$": "https://api.elsevier.com/content/object/eid/1-s2.0-S0926860X24003405-gr8.sml?httpAccept=%2A%2F%2A",
            "@multimediatype": "GIF image file",
            "@type": "IMAGE-THUMBNAIL",
            "@size": "9269",
            "@ref": "gr8",
            "@mimetype": "image/gif"
          },
          {
            "@category": "thumbnail",
            "@height": "164",
            "@width": "190",
            "@_fa": "true",
            "$": "https://api.elsevier.com/content/object/eid/1-s2.0-S0926860X24003405-gr7.sml?httpAccept=%2A%2F%2A",
            "@multimediatype": "GIF image file",
            "@type": "IMAGE-THUMBNAIL",
            "@size": "9264",
            "@ref": "gr7",
            "@mimetype": "image/gif"
          },
          {
            "@category": "thumbnail",
            "@height": "164",
            "@width": "202",
            "@_fa": "true",
            "$": "https://api.elsevier.com/content/object/eid/1-s2.0-S0926860X24003405-gr10.sml?httpAccept=%2A%2F%2A",
            "@multimediatype": "GIF image file",
            "@type": "IMAGE-THUMBNAIL",
            "@size": "9761",
            "@ref": "gr10",
            "@mimetype": "image/gif"
          },
          {
            "@category": "thumbnail",
            "@height": "164",
            "@width": "193",
            "@_fa": "true",
            "$": "https://api.elsevier.com/content/object/eid/1-s2.0-S0926860X24003405-gr2.sml?httpAccept=%2A%2F%2A",
            "@multimediatype": "GIF image file",
            "@type": "IMAGE-THUMBNAIL",
            "@size": "10306",
            "@ref": "gr2",
            "@mimetype": "image/gif"
          },
          {
            "@category": "thumbnail",
            "@height": "164",
            "@width": "206",
            "@_fa": "true",
            "$": "https://api.elsevier.com/content/object/eid/1-s2.0-S0926860X24003405-ga1.sml?httpAccept=%2A%2F%2A",
            "@multimediatype": "GIF image file",
            "@type": "IMAGE-THUMBNAIL",
            "@size": "10236",
            "@ref": "ga1",
            "@mimetype": "image/gif"
          },
          {
            "@category": "thumbnail",
            "@height": "164",
            "@width": "194",
            "@_fa": "true",
            "$": "https://api.elsevier.com/content/object/eid/1-s2.0-S0926860X24003405-gr1.sml?httpAccept=%2A%2F%2A",
            "@multimediatype": "GIF image file",
            "@type": "IMAGE-THUMBNAIL",
            "@size": "10844",
            "@ref": "gr1",
            "@mimetype": "image/gif"
          },
          {
            "@category": "thumbnail",
            "@height": "164",
            "@width": "200",
            "@_fa": "true",
            "$": "https://api.elsevier.com/content/object/eid/1-s2.0-S0926860X24003405-gr6.sml?httpAccept=%2A%2F%2A",
            "@multimediatype": "GIF image file",
            "@type": "IMAGE-THUMBNAIL",
            "@size": "8213",
            "@ref": "gr6",
            "@mimetype": "image/gif"
          },
          {
            "@category": "thumbnail",
            "@height": "164",
            "@width": "166",
            "@_fa": "true",
            "$": "https://api.elsevier.com/content/object/eid/1-s2.0-S0926860X24003405-gr5.sml?httpAccept=%2A%2F%2A",
            "@multimediatype": "GIF image file",
            "@type": "IMAGE-THUMBNAIL",
            "@size": "17595",
            "@ref": "gr5",
            "@mimetype": "image/gif"
          },
          {
            "@category": "thumbnail",
            "@height": "164",
            "@width": "206",
            "@_fa": "true",
            "$": "https://api.elsevier.com/content/object/eid/1-s2.0-S0926860X24003405-gr4.sml?httpAccept=%2A%2F%2A",
            "@multimediatype": "GIF image file",
            "@type": "IMAGE-THUMBNAIL",
            "@size": "13148",
            "@ref": "gr4",
            "@mimetype": "image/gif"
          },
          {
            "@category": "thumbnail",
            "@height": "164",
            "@width": "215",
            "@_fa": "true",
            "$": "https://api.elsevier.com/content/object/eid/1-s2.0-S0926860X24003405-gr3.sml?httpAccept=%2A%2F%2A",
            "@multimediatype": "GIF image file",
            "@type": "IMAGE-THUMBNAIL",
            "@size": "7429",
            "@ref": "gr3",
            "@mimetype": "image/gif"
          },
          {
            "@category": "high",
            "@height": "2207",
            "@width": "2994",
            "@_fa": "true",
            "$": "https://api.elsevier.com/content/object/eid/1-s2.0-S0926860X24003405-gr9_lrg.jpg?httpAccept=%2A%2F%2A",
            "@multimediatype": "JPEG image file",
            "@type": "IMAGE-HIGH-RES",
            "@size": "404159",
            "@ref": "gr9",
            "@mimetype": "image/jpeg"
          },
          {
            "@category": "high",
            "@height": "1254",
            "@width": "1497",
            "@_fa": "true",
            "$": "https://api.elsevier.com/content/object/eid/1-s2.0-S0926860X24003405-gr8_lrg.jpg?httpAccept=%2A%2F%2A",
            "@multimediatype": "JPEG image file",
            "@type": "IMAGE-HIGH-RES",
            "@size": "124497",
            "@ref": "gr8",
            "@mimetype": "image/jpeg"
          },
          {
            "@category": "high",
            "@height": "1290",
            "@width": "1497",
            "@_fa": "true",
            "$": "https://api.elsevier.com/content/object/eid/1-s2.0-S0926860X24003405-gr7_lrg.jpg?httpAccept=%2A%2F%2A",
            "@multimediatype": "JPEG image file",
            "@type": "IMAGE-HIGH-RES",
            "@size": "123698",
            "@ref": "gr7",
            "@mimetype": "image/jpeg"
          },
          {
            "@category": "high",
            "@height": "1217",
            "@width": "1497",
            "@_fa": "true",
            "$": "https://api.elsevier.com/content/object/eid/1-s2.0-S0926860X24003405-gr10_lrg.jpg?httpAccept=%2A%2F%2A",
            "@multimediatype": "JPEG image file",
            "@type": "IMAGE-HIGH-RES",
            "@size": "132419",
            "@ref": "gr10",
            "@mimetype": "image/jpeg"
          },
          {
            "@category": "high",
            "@height": "1273",
            "@width": "1497",
            "@_fa": "true",
            "$": "https://api.elsevier.com/content/object/eid/1-s2.0-S0926860X24003405-gr2_lrg.jpg?httpAccept=%2A%2F%2A",
            "@multimediatype": "JPEG image file",
            "@type": "IMAGE-HIGH-RES",
            "@size": "116571",
            "@ref": "gr2",
            "@mimetype": "image/jpeg"
          },
          {
            "@category": "high",
            "@height": "886",
            "@width": "1115",
            "@_fa": "true",
            "$": "https://api.elsevier.com/content/object/eid/1-s2.0-S0926860X24003405-ga1_lrg.jpg?httpAccept=%2A%2F%2A",
            "@multimediatype": "JPEG image file",
            "@type": "IMAGE-HIGH-RES",
            "@size": "142489",
            "@ref": "ga1",
            "@mimetype": "image/jpeg"
          },
          {
            "@category": "high",
            "@height": "1262",
            "@width": "1497",
            "@_fa": "true",
            "$": "https://api.elsevier.com/content/object/eid/1-s2.0-S0926860X24003405-gr1_lrg.jpg?httpAccept=%2A%2F%2A",
            "@multimediatype": "JPEG image file",
            "@type": "IMAGE-HIGH-RES",
            "@size": "142815",
            "@ref": "gr1",
            "@mimetype": "image/jpeg"
          },
          {
            "@category": "high",
            "@height": "1224",
            "@width": "1497",
            "@_fa": "true",
            "$": "https://api.elsevier.com/content/object/eid/1-s2.0-S0926860X24003405-gr6_lrg.jpg?httpAccept=%2A%2F%2A",
            "@multimediatype": "JPEG image file",
            "@type": "IMAGE-HIGH-RES",
            "@size": "110573",
            "@ref": "gr6",
            "@mimetype": "image/jpeg"
          },
          {
            "@category": "high",
            "@height": "3454",
            "@width": "3493",
            "@_fa": "true",
            "$": "https://api.elsevier.com/content/object/eid/1-s2.0-S0926860X24003405-gr5_lrg.jpg?httpAccept=%2A%2F%2A",
            "@multimediatype": "JPEG image file",
            "@type": "IMAGE-HIGH-RES",
            "@size": "652769",
            "@ref": "gr5",
            "@mimetype": "image/jpeg"
          },
          {
            "@category": "high",
            "@height": "1190",
            "@width": "1497",
            "@_fa": "true",
            "$": "https://api.elsevier.com/content/object/eid/1-s2.0-S0926860X24003405-gr4_lrg.jpg?httpAccept=%2A%2F%2A",
            "@multimediatype": "JPEG image file",
            "@type": "IMAGE-HIGH-RES",
            "@size": "135745",
            "@ref": "gr4",
            "@mimetype": "image/jpeg"
          },
          {
            "@category": "high",
            "@height": "1270",
            "@width": "1663",
            "@_fa": "true",
            "$": "https://api.elsevier.com/content/object/eid/1-s2.0-S0926860X24003405-gr3_lrg.jpg?httpAccept=%2A%2F%2A",
            "@multimediatype": "JPEG image file",
            "@type": "IMAGE-HIGH-RES",
            "@size": "101042",
            "@ref": "gr3",
            "@mimetype": "image/jpeg"
          },
          {
            "@category": "standard",
            "@_fa": "true",
            "$": "https://api.elsevier.com/content/object/eid/1-s2.0-S0926860X24003405-mmc1.doc?httpAccept=%2A%2F%2A",
            "@multimediatype": "Microsoft Word file",
            "@type": "APPLICATION",
            "@size": "1106944",
            "@ref": "mmc1",
            "@mimetype": "application/word"
          },
          {
            "@category": "standard",
            "@_fa": "true",
            "$": "https://api.elsevier.com/content/object/eid/1-s2.0-S0926860X24003405-am.pdf?httpAccept=%2A%2F%2A",
            "@multimediatype": "Acrobat PDF file",
            "@type": "AAM-PDF",
            "@size": "1690142",
            "@ref": "am",
            "@mimetype": "application/pdf"
          }
        ]
      },
      "link": {
        "@rel": "abstract",
        "@href": "https://api.elsevier.com/content/abstract/scopus_id/85199883016"
      }
    }
  }
}