{
  "metadata": {
    "title": "Molybdenum phosphide-graphite nanomaterials for efficient electrocatalytic hydrogen production",
    "authors": "; ; ",
    "journal": "Applied Catalysis A: General",
    "date": "2015-01-25",
    "doi": "10.1016/j.apcata.2014.11.003",
    "abstract": "",
    "uri": "https://api.elsevier.com/content/article/pii/S0926860X14006875",
    "pii": "S0926860X14006875"
  },
  "fulltext": {
    "full-text-retrieval-response": {
      "scopus-eid": "2-s2.0-84916631545",
      "originalText": "serial JL 271346 291210 291744 291809 31 Applied Catalysis A: General APPLIEDCATALYSISAGENERAL 2014-11-18 2014-11-18 2018-04-14T00:57:11 1-s2.0-S0926860X14006875 S0926-860X(14)00687-5 S0926860X14006875 10.1016/j.apcata.2014.11.003 S300 S300.2 FULL-TEXT 1-s2.0-S0926860X14X00219 2024-01-01T12:30:29.635264Z 0 0 20150125 2015 2014-11-18T08:50:09.546474Z absattachment articleinfo articletitlenorm authfirstinitialnorm authfirstsurnamenorm cid cids contenttype copyright crossmark dateloaded dateloadedtxt datesearch datesort dateupdated dco docsubtype doctype doi eid ewtransactionid hubeid indexeddate issn issnnorm itemstage itemtransactionid itemweight openaccess openarchive pg pgfirst pglast pii piinorm pubdatestart pubdatetxt pubyr sectiontitle sortorder srctitle srctitlenorm srctype ssids alllist content subj subheadings suppl tomb volfirst volissue volumelist webpdf webpdfpagecount yearnav figure table e-component body mmlmath acknowledge affil appendices articletitle auth authfirstini authfull authkeywords authlast highlightsabst primabst ref specialabst 0926-860X 0926860X true 490 490 C Volume 490 15 101 107 101 107 20150125 25 January 2015 2015-01-25 2015 Articles article fla Copyright © 2014 Elsevier B.V. All rights reserved. MOLYBDENUMPHOSPHIDEGRAPHITENANOMATERIALSFOREFFICIENTELECTROCATALYTICHYDROGENPRODUCTION JYOTHIRMAYEEARAVIND S 1 Introduction 2 Experimental 3 Results and discussion 4 Conclusions Acknowledgment Appendix A Supplementary data References GREELEY 2006 909 913 J HINNEMANN 2005 5308 5309 B STINNER 2000 438 444 C KARUNADASA 2012 698 702 H POPCZUN 2013 9267 9270 E POPCZUN 2014 5531 5534 E XIAO 2014 2624 2629 P MCENANEY 2014 4826 J CHEN 2014 11683 X XING 2014 5702 Z YAMAMOTO 2009 397 402 K KHAN 2013 7284 7297 S ENZHOU 2014 165401 L CHANDRA 2007 135 142 M XING 2013 7970 7976 T WANG 2013 219 222 D TANAKA 2001 931 U ORTMANN 2005 186101 F KALAITZIDOU 2007 1675 K ANTISARI 2006 1047 1050 M JEON 2013 1386 I WU 2013 426 432 H LI 2011 7296 Y ARAVIND 2014 11528 11536 S SCHERRER 1918 98 100 P SURYANARAYANA 2001 1 184 C HERMANN 1997 215 H LIAO 2014 387 392 L KOTOBUKI 2013 5 M JARAMILLO 2007 100 102 T GE 2014 182 186 C JYOTHIRMAYEEARAVINDX2015X101 JYOTHIRMAYEEARAVINDX2015X101X107 JYOTHIRMAYEEARAVINDX2015X101XS JYOTHIRMAYEEARAVINDX2015X101X107XS item S0926-860X(14)00687-5 S0926860X14006875 1-s2.0-S0926860X14006875 10.1016/j.apcata.2014.11.003 271346 2024-01-01T12:30:29.635264Z 2015-01-25 1-s2.0-S0926860X14006875-main.pdf https://s3-eu-west-1.amazonaws.com/prod-ucs-content-store-eu-west/content/pii:S0926860X14006875/MAIN/application/pdf/f23f66f6f02c6e3c09d338fdbe09c5e1/main.pdf https://s3.amazonaws.com/prod-ucs-content-store-us-east/content/pii:S0926860X14006875/MAIN/application/pdf/f23f66f6f02c6e3c09d338fdbe09c5e1/main.pdf main.pdf pdf true 1715425 MAIN 7 1-s2.0-S0926860X14006875-main_1.png https://s3-eu-west-1.amazonaws.com/prod-ucs-content-store-eu-west/content/pii:S0926860X14006875/PREVIEW/image/png/c239afb97f05073e6614b084d4691aca/main_1.png https://s3.amazonaws.com/prod-ucs-content-store-us-east/content/pii:S0926860X14006875/PREVIEW/image/png/c239afb97f05073e6614b084d4691aca/main_1.png main_1.png png 58395 849 656 IMAGE-WEB-PDF 1 1-s2.0-S0926860X14006875-fx1.sml https://s3-eu-west-1.amazonaws.com/prod-ucs-content-store-eu-west/content/pii:S0926860X14006875/fx1/THUMBNAIL/image/gif/9b7420f166c4092cef87a1959f9a479c/fx1.sml https://s3.amazonaws.com/prod-ucs-content-store-us-east/content/pii:S0926860X14006875/fx1/THUMBNAIL/image/gif/9b7420f166c4092cef87a1959f9a479c/fx1.sml fx1 true fx1.sml sml 15862 164 215 IMAGE-THUMBNAIL 1-s2.0-S0926860X14006875-gr1.sml https://s3-eu-west-1.amazonaws.com/prod-ucs-content-store-eu-west/content/pii:S0926860X14006875/gr1/THUMBNAIL/image/gif/119224ca0e8e65d622169b8afcdf0267/gr1.sml https://s3.amazonaws.com/prod-ucs-content-store-us-east/content/pii:S0926860X14006875/gr1/THUMBNAIL/image/gif/119224ca0e8e65d622169b8afcdf0267/gr1.sml gr1 gr1.sml sml 20230 153 219 IMAGE-THUMBNAIL 1-s2.0-S0926860X14006875-gr2.sml https://s3-eu-west-1.amazonaws.com/prod-ucs-content-store-eu-west/content/pii:S0926860X14006875/gr2/THUMBNAIL/image/gif/5af7aea8e12404f44d3b6673f036e86d/gr2.sml https://s3.amazonaws.com/prod-ucs-content-store-us-east/content/pii:S0926860X14006875/gr2/THUMBNAIL/image/gif/5af7aea8e12404f44d3b6673f036e86d/gr2.sml gr2 gr2.sml sml 13434 164 154 IMAGE-THUMBNAIL 1-s2.0-S0926860X14006875-gr3.sml https://s3-eu-west-1.amazonaws.com/prod-ucs-content-store-eu-west/content/pii:S0926860X14006875/gr3/THUMBNAIL/image/gif/ba7aa0bc9e0f5d6d7e971ef6276c34ff/gr3.sml https://s3.amazonaws.com/prod-ucs-content-store-us-east/content/pii:S0926860X14006875/gr3/THUMBNAIL/image/gif/ba7aa0bc9e0f5d6d7e971ef6276c34ff/gr3.sml gr3 gr3.sml sml 43932 164 213 IMAGE-THUMBNAIL 1-s2.0-S0926860X14006875-gr4.sml https://s3-eu-west-1.amazonaws.com/prod-ucs-content-store-eu-west/content/pii:S0926860X14006875/gr4/THUMBNAIL/image/gif/b487ebe03899790a73743e3f9a79f99e/gr4.sml https://s3.amazonaws.com/prod-ucs-content-store-us-east/content/pii:S0926860X14006875/gr4/THUMBNAIL/image/gif/b487ebe03899790a73743e3f9a79f99e/gr4.sml gr4 gr4.sml sml 14587 91 219 IMAGE-THUMBNAIL 1-s2.0-S0926860X14006875-gr5.sml https://s3-eu-west-1.amazonaws.com/prod-ucs-content-store-eu-west/content/pii:S0926860X14006875/gr5/THUMBNAIL/image/gif/e128e3969cf5817f31b4fee2fd5518c5/gr5.sml https://s3.amazonaws.com/prod-ucs-content-store-us-east/content/pii:S0926860X14006875/gr5/THUMBNAIL/image/gif/e128e3969cf5817f31b4fee2fd5518c5/gr5.sml gr5 gr5.sml sml 14214 86 219 IMAGE-THUMBNAIL 1-s2.0-S0926860X14006875-gr6.sml https://s3-eu-west-1.amazonaws.com/prod-ucs-content-store-eu-west/content/pii:S0926860X14006875/gr6/THUMBNAIL/image/gif/7eb29736224f7c7c86af65877f1f44a6/gr6.sml https://s3.amazonaws.com/prod-ucs-content-store-us-east/content/pii:S0926860X14006875/gr6/THUMBNAIL/image/gif/7eb29736224f7c7c86af65877f1f44a6/gr6.sml gr6 gr6.sml sml 12530 164 193 IMAGE-THUMBNAIL 1-s2.0-S0926860X14006875-gr7.sml https://s3-eu-west-1.amazonaws.com/prod-ucs-content-store-eu-west/content/pii:S0926860X14006875/gr7/THUMBNAIL/image/gif/65e41eb72c1c69c62154c85ffd1759a5/gr7.sml https://s3.amazonaws.com/prod-ucs-content-store-us-east/content/pii:S0926860X14006875/gr7/THUMBNAIL/image/gif/65e41eb72c1c69c62154c85ffd1759a5/gr7.sml gr7 gr7.sml sml 21936 164 215 IMAGE-THUMBNAIL 1-s2.0-S0926860X14006875-gr8.sml https://s3-eu-west-1.amazonaws.com/prod-ucs-content-store-eu-west/content/pii:S0926860X14006875/gr8/THUMBNAIL/image/gif/deb097131b199b012b0756251d35c1b3/gr8.sml https://s3.amazonaws.com/prod-ucs-content-store-us-east/content/pii:S0926860X14006875/gr8/THUMBNAIL/image/gif/deb097131b199b012b0756251d35c1b3/gr8.sml gr8 gr8.sml sml 10340 86 219 IMAGE-THUMBNAIL 1-s2.0-S0926860X14006875-fx1.jpg https://s3-eu-west-1.amazonaws.com/prod-ucs-content-store-eu-west/content/pii:S0926860X14006875/fx1/DOWNSAMPLED/image/jpeg/907c5cddb99a2d88360e41bdc162d204/fx1.jpg https://s3.amazonaws.com/prod-ucs-content-store-us-east/content/pii:S0926860X14006875/fx1/DOWNSAMPLED/image/jpeg/907c5cddb99a2d88360e41bdc162d204/fx1.jpg fx1 true fx1.jpg jpg 21135 200 262 IMAGE-DOWNSAMPLED 1-s2.0-S0926860X14006875-gr1.jpg https://s3-eu-west-1.amazonaws.com/prod-ucs-content-store-eu-west/content/pii:S0926860X14006875/gr1/DOWNSAMPLED/image/jpeg/6f251542648e092d250fe5a71ed51a44/gr1.jpg https://s3.amazonaws.com/prod-ucs-content-store-us-east/content/pii:S0926860X14006875/gr1/DOWNSAMPLED/image/jpeg/6f251542648e092d250fe5a71ed51a44/gr1.jpg gr1 gr1.jpg jpg 75837 342 488 IMAGE-DOWNSAMPLED 1-s2.0-S0926860X14006875-gr2.jpg https://s3-eu-west-1.amazonaws.com/prod-ucs-content-store-eu-west/content/pii:S0926860X14006875/gr2/DOWNSAMPLED/image/jpeg/96f298f900eaf6957e0ea6fcdfe8c495/gr2.jpg https://s3.amazonaws.com/prod-ucs-content-store-us-east/content/pii:S0926860X14006875/gr2/DOWNSAMPLED/image/jpeg/96f298f900eaf6957e0ea6fcdfe8c495/gr2.jpg gr2 gr2.jpg jpg 38812 300 282 IMAGE-DOWNSAMPLED 1-s2.0-S0926860X14006875-gr3.jpg https://s3-eu-west-1.amazonaws.com/prod-ucs-content-store-eu-west/content/pii:S0926860X14006875/gr3/DOWNSAMPLED/image/jpeg/eeae892ec281c29673019a6ec6562dcf/gr3.jpg https://s3.amazonaws.com/prod-ucs-content-store-us-east/content/pii:S0926860X14006875/gr3/DOWNSAMPLED/image/jpeg/eeae892ec281c29673019a6ec6562dcf/gr3.jpg gr3 gr3.jpg jpg 113875 435 565 IMAGE-DOWNSAMPLED 1-s2.0-S0926860X14006875-gr4.jpg https://s3-eu-west-1.amazonaws.com/prod-ucs-content-store-eu-west/content/pii:S0926860X14006875/gr4/DOWNSAMPLED/image/jpeg/9c3b9e88980c87e380ecbe031f70ad8d/gr4.jpg https://s3.amazonaws.com/prod-ucs-content-store-us-east/content/pii:S0926860X14006875/gr4/DOWNSAMPLED/image/jpeg/9c3b9e88980c87e380ecbe031f70ad8d/gr4.jpg gr4 gr4.jpg jpg 57988 219 527 IMAGE-DOWNSAMPLED 1-s2.0-S0926860X14006875-gr5.jpg https://s3-eu-west-1.amazonaws.com/prod-ucs-content-store-eu-west/content/pii:S0926860X14006875/gr5/DOWNSAMPLED/image/jpeg/2ca598e768a79dab808cc9c7ee34570c/gr5.jpg https://s3.amazonaws.com/prod-ucs-content-store-us-east/content/pii:S0926860X14006875/gr5/DOWNSAMPLED/image/jpeg/2ca598e768a79dab808cc9c7ee34570c/gr5.jpg gr5 gr5.jpg jpg 54308 207 525 IMAGE-DOWNSAMPLED 1-s2.0-S0926860X14006875-gr6.jpg https://s3-eu-west-1.amazonaws.com/prod-ucs-content-store-eu-west/content/pii:S0926860X14006875/gr6/DOWNSAMPLED/image/jpeg/66795c8e49dea179bb035dc8a74d1879/gr6.jpg https://s3.amazonaws.com/prod-ucs-content-store-us-east/content/pii:S0926860X14006875/gr6/DOWNSAMPLED/image/jpeg/66795c8e49dea179bb035dc8a74d1879/gr6.jpg gr6 gr6.jpg jpg 38702 318 375 IMAGE-DOWNSAMPLED 1-s2.0-S0926860X14006875-gr7.jpg https://s3-eu-west-1.amazonaws.com/prod-ucs-content-store-eu-west/content/pii:S0926860X14006875/gr7/DOWNSAMPLED/image/jpeg/8528dfa9eda99e0971880c03fdde1f67/gr7.jpg https://s3.amazonaws.com/prod-ucs-content-store-us-east/content/pii:S0926860X14006875/gr7/DOWNSAMPLED/image/jpeg/8528dfa9eda99e0971880c03fdde1f67/gr7.jpg gr7 gr7.jpg jpg 38072 171 225 IMAGE-DOWNSAMPLED 1-s2.0-S0926860X14006875-gr8.jpg https://s3-eu-west-1.amazonaws.com/prod-ucs-content-store-eu-west/content/pii:S0926860X14006875/gr8/DOWNSAMPLED/image/jpeg/7a190fa26336c5ab537bf1e51d612d85/gr8.jpg https://s3.amazonaws.com/prod-ucs-content-store-us-east/content/pii:S0926860X14006875/gr8/DOWNSAMPLED/image/jpeg/7a190fa26336c5ab537bf1e51d612d85/gr8.jpg gr8 gr8.jpg jpg 37243 200 508 IMAGE-DOWNSAMPLED 1-s2.0-S0926860X14006875-fx1_lrg.jpg https://s3-eu-west-1.amazonaws.com/prod-ucs-content-store-eu-west/content/pii:S0926860X14006875/fx1/HIGHRES/image/jpeg/8fd4df3f2d5c6080eadc5d671fccc2e3/fx1_lrg.jpg https://s3.amazonaws.com/prod-ucs-content-store-us-east/content/pii:S0926860X14006875/fx1/HIGHRES/image/jpeg/8fd4df3f2d5c6080eadc5d671fccc2e3/fx1_lrg.jpg fx1 true fx1_lrg.jpg jpg 149850 886 1162 IMAGE-HIGH-RES 1-s2.0-S0926860X14006875-gr1_lrg.jpg https://s3-eu-west-1.amazonaws.com/prod-ucs-content-store-eu-west/content/pii:S0926860X14006875/gr1/HIGHRES/image/jpeg/b5990c4b3c001a99e59770180f2b378c/gr1_lrg.jpg https://s3.amazonaws.com/prod-ucs-content-store-us-east/content/pii:S0926860X14006875/gr1/HIGHRES/image/jpeg/b5990c4b3c001a99e59770180f2b378c/gr1_lrg.jpg gr1 gr1_lrg.jpg jpg 359185 1515 2162 IMAGE-HIGH-RES 1-s2.0-S0926860X14006875-gr2_lrg.jpg https://s3-eu-west-1.amazonaws.com/prod-ucs-content-store-eu-west/content/pii:S0926860X14006875/gr2/HIGHRES/image/jpeg/12cf8646e57bc0ebb7ec30479fd502d0/gr2_lrg.jpg https://s3.amazonaws.com/prod-ucs-content-store-us-east/content/pii:S0926860X14006875/gr2/HIGHRES/image/jpeg/12cf8646e57bc0ebb7ec30479fd502d0/gr2_lrg.jpg gr2 gr2_lrg.jpg jpg 161128 1330 1249 IMAGE-HIGH-RES 1-s2.0-S0926860X14006875-gr3_lrg.jpg https://s3-eu-west-1.amazonaws.com/prod-ucs-content-store-eu-west/content/pii:S0926860X14006875/gr3/HIGHRES/image/jpeg/7412c32f4a0c58443d093d75c4402429/gr3_lrg.jpg https://s3.amazonaws.com/prod-ucs-content-store-us-east/content/pii:S0926860X14006875/gr3/HIGHRES/image/jpeg/7412c32f4a0c58443d093d75c4402429/gr3_lrg.jpg gr3 gr3_lrg.jpg jpg 359542 1156 1500 IMAGE-HIGH-RES 1-s2.0-S0926860X14006875-gr4_lrg.jpg https://s3-eu-west-1.amazonaws.com/prod-ucs-content-store-eu-west/content/pii:S0926860X14006875/gr4/HIGHRES/image/jpeg/c3df23669c80a8536e293453d5e86a97/gr4_lrg.jpg https://s3.amazonaws.com/prod-ucs-content-store-us-east/content/pii:S0926860X14006875/gr4/HIGHRES/image/jpeg/c3df23669c80a8536e293453d5e86a97/gr4_lrg.jpg gr4 gr4_lrg.jpg jpg 333642 971 2333 IMAGE-HIGH-RES 1-s2.0-S0926860X14006875-gr5_lrg.jpg https://s3-eu-west-1.amazonaws.com/prod-ucs-content-store-eu-west/content/pii:S0926860X14006875/gr5/HIGHRES/image/jpeg/311cda6abceff5485452beee3985f29c/gr5_lrg.jpg https://s3.amazonaws.com/prod-ucs-content-store-us-east/content/pii:S0926860X14006875/gr5/HIGHRES/image/jpeg/311cda6abceff5485452beee3985f29c/gr5_lrg.jpg gr5 gr5_lrg.jpg jpg 312634 917 2327 IMAGE-HIGH-RES 1-s2.0-S0926860X14006875-gr6_lrg.jpg https://s3-eu-west-1.amazonaws.com/prod-ucs-content-store-eu-west/content/pii:S0926860X14006875/gr6/HIGHRES/image/jpeg/79bfa8e8ba1101c405e11ef3cb292c20/gr6_lrg.jpg https://s3.amazonaws.com/prod-ucs-content-store-us-east/content/pii:S0926860X14006875/gr6/HIGHRES/image/jpeg/79bfa8e8ba1101c405e11ef3cb292c20/gr6_lrg.jpg gr6 gr6_lrg.jpg jpg 167596 1408 1662 IMAGE-HIGH-RES 1-s2.0-S0926860X14006875-gr7_lrg.jpg https://s3-eu-west-1.amazonaws.com/prod-ucs-content-store-eu-west/content/pii:S0926860X14006875/gr7/HIGHRES/image/jpeg/05f7fe0cb93feb9332de75f80b141e24/gr7_lrg.jpg https://s3.amazonaws.com/prod-ucs-content-store-us-east/content/pii:S0926860X14006875/gr7/HIGHRES/image/jpeg/05f7fe0cb93feb9332de75f80b141e24/gr7_lrg.jpg gr7 gr7_lrg.jpg jpg 145814 760 998 IMAGE-HIGH-RES 1-s2.0-S0926860X14006875-gr8_lrg.jpg https://s3-eu-west-1.amazonaws.com/prod-ucs-content-store-eu-west/content/pii:S0926860X14006875/gr8/HIGHRES/image/jpeg/060a8a784031b5701cd1b44006b81170/gr8_lrg.jpg https://s3.amazonaws.com/prod-ucs-content-store-us-east/content/pii:S0926860X14006875/gr8/HIGHRES/image/jpeg/060a8a784031b5701cd1b44006b81170/gr8_lrg.jpg gr8 gr8_lrg.jpg jpg 187689 885 2248 IMAGE-HIGH-RES 1-s2.0-S0926860X14006875-mmc1.pdf https://s3-eu-west-1.amazonaws.com/prod-ucs-content-store-eu-west/content/pii:S0926860X14006875/mmc1/MAIN/application/pdf/b164455152512fc1557d1128942f87c6/mmc1.pdf https://s3.amazonaws.com/prod-ucs-content-store-us-east/content/pii:S0926860X14006875/mmc1/MAIN/application/pdf/b164455152512fc1557d1128942f87c6/mmc1.pdf mmc1 mmc1.pdf pdf false 143489 APPLICATION 1-s2.0-S0926860X14006875-si1.gif https://s3-eu-west-1.amazonaws.com/prod-ucs-content-store-eu-west/content/pii:S0926860X14006875/STRIPIN/image/gif/1e6bb291f0a26a24a96658b7e18fddd2/si1.gif https://s3.amazonaws.com/prod-ucs-content-store-us-east/content/pii:S0926860X14006875/STRIPIN/image/gif/1e6bb291f0a26a24a96658b7e18fddd2/si1.gif si1 si1.gif gif 503 36 90 ALTIMG 1-s2.0-S0926860X14006875-si2.gif https://s3-eu-west-1.amazonaws.com/prod-ucs-content-store-eu-west/content/pii:S0926860X14006875/STRIPIN/image/gif/7062636586ce47b578ea74fec221c717/si2.gif https://s3.amazonaws.com/prod-ucs-content-store-us-east/content/pii:S0926860X14006875/STRIPIN/image/gif/7062636586ce47b578ea74fec221c717/si2.gif si2 si2.gif gif 363 15 103 ALTIMG APCATA 15096 S0926-860X(14)00687-5 10.1016/j.apcata.2014.11.003 Elsevier B.V. Fig. 1 (a) Powder X-ray diffraction patterns of C-MoP and ball-milled MoPs, showing the peak broadening with milling time. (b) Stick pattern showing peak positions of C-MoP material. (c) Structure of MoP (molybdenum—blue; phosphorous—pink). Fig. 2 Powder X-ray diffraction patterns of MoP-G-11 and MoP-G-60-11. The average crystallite size of MoP was calculated using Scherrer's equation. Fig. 3 SEM images of (a) C-MoP, (b) MoP-60, (c) graphite and (d) MoP-G-60-11. Fig. 4 Cyclic voltammograms of (a) C-MoP and ball-milled MoP compounds, (b) MoP-graphite compounds in 0.5M H2SO4 solution at 50mV/s scan rate. Fig. 5 (a) Linear sweep voltammograms of MoP-G compounds compared with that of bare GCE, graphite and Pt/C and (b) Tafel slopes of MoP compounds versus Pt/C. Fig. 6 Nyquist plots of MoP-60 and MoP-G-60-11 catalysts in 0.5M H2SO4with overpotential of −0.35V. The inset shows the Nyquist plot of MoP-G-60-11. Note that the inset scale is in Ω while the main plot scale is in kΩ; the MoP-G-60-11 is clearly more conductive. Fig. 7 Gas chromatograms of MoP-G-60-11 electrode at (a) −0.45, (b) −0.5 and (c) −0.55V. Inset shows hydrogen generated bubbles during HER on catalyst coated carbon fiber paper. Fig. 8 (a) Linear sweep voltammograms at 2mV/s of MoP-G-60-11: first scan and recorded after 20h of continuous measurement and (b) amperometric analysis for a period of 20h at constant applied potential measured in sulfate buffer (pH=1) solution. Table 1 Average MoP crystallite size calculated using Scherrer's formula. Compound L α (nm) C-MoP 395.3 MoP-15 40.7 MoP-30 15.2 MoP-40 8.9 MoP-60 8.5 MoP-90 8.7 MoP-120 9.9 MoP-G-60-11 8.9 Table 2 BET surface areas of MoP and graphite compounds. Material BET surface area (m2/g) Graphite 9.6 C-MoP 1.8 MoP-40 15 MoP-60 25.1 MoP-90 5.3 MoP-120 4.3 MoP-G-11 7.6 MoP-G-60-11 68.2 Table 3 A summary of catalyst loading, Tafel slopes and exchange current densities of recently reported materials. Catalyst Mass loading(mg/cm2) Tafel slope (mV/dec) Current density (mA/cm2) Exchange current density (×10−6 A/cm2) Reference MA-MoS2 0.269 104 0.9 a 14 [16] MoP 0.071 60 – 4.15 [9] MoP-CA2 0.36 54 100 b 86 [10] Amorphous-MoP 1.0 45 20 120 [8] MoP-graphite nanosheets 0.64 63 30 c 63.67 This work a Measured at 200mV overpotential [16]. b Measured at 271mV overpotential [10]. c Value reported for MoP-G-60-11. Molybdenum phosphide-graphite nanomaterials for efficient electrocatalytic hydrogen production S.S. Jyothirmayee Aravind Kandalam Ramanujachary Amos Mugweru Timothy D. Vaden ⁎ Department of Chemistry and Biochemistry, Rowan University, 201 Mullica Hill Road, Glassboro, NJ 08028, USA ⁎ Corresponding author. Tel.: +1-856-256-5457. Graphical abstract Clean hydrogen energy technology is an alternative to a fossil fuel-based energy economy. Efficient and economical catalysts are necessary for large-scale hydrogen generation. We report MoP and MoP-graphite nanosheets prepared by ball milling commercial compounds as efficient electrocatalytic materials for hydrogen generation via the hydrogen reduction mechanism. The hydrogen generated through electrochemical catalysis was evaluated using gas chromatography. The effects of ball milling time and proportions of MoP-graphite nanosheets on electrocatalytic activity were investigated. The new nanomaterials were characterized using powder XRD, SEM and BET surface area measurements. The results suggest superior electrocatalytic performance with a balance of ball-milled MoP and graphite. A Tafel slope of 63mV/dec was obtained for this new material. Keywords Molybdenum phosphide Graphite nanosheets Hydrogen evolution reaction Ball milling Electrochemical catalysts. 1 Introduction Electrocatalytic hydrogen generation is a promising area of research aimed to support the development of a robust hydrogen-based energy economy. Hydrogen can be generated via reduction of hydronium ions on electrode surface. This hydrogen evolution reaction (HER) requires a high overpotential. Currently, platinum-based catalysts offer the best performance for lowering the HER overpotential [1,2]. The high cost and low earth abundance of Pt and Pt group metals hinder their use and present an economic obstacle to widespread application. Therefore, significant research effort has been focused on finding cheap, efficient HER catalytic materials. Transition metal phosphides are important due to their advanced catalytic and electronic applications. Stinner et al. [3] investigated a series of transition metal phosphides for hydro-denitrogenation and found that MoP is an active catalyst for this application. Recently, it was established that most of the hydrodesulfurization (HDS) catalysts can be good HER catalysts as well. For instance, MoS2, a well-known HDS catalyst, was investigated for hydrogen evolution reaction. It was found that the HER activity of MoS2 stems from the more active edge sites rather than the stable basal planes [4]. Based on this fact, and the evaluation of HER activity by DFT on transition metal phosphides, Ni2P was identified as a good HER catalyst material [5]. The same group evaluated the HER activity of cobalt phosphide recently [6]. In contrast to the extensive research on sulfides, research on transition metal phosphide HER catalysis is relatively new. Several recent reports have demonstrated the electrocatalytic HER activity of molybdenum phosphide (MoP) materials [7–10]. In the present contribution, we report the effect of particle size and electrochemical synergy between molybdenum phosphide and graphite materials towards HER electrocatalysis. The effects of reduction in particle size in electrocatalytic applications especially in the fields of fuel cells have been investigated [11]. Improved performance due to reduced particle size has been observed due to the enhanced surface area and reactivity at the nanoscale [12]. Nanomaterials are increasingly utilized in the field of clean hydrogen energy technology. Silver nanoparticles coated on TiO2 nanosheet films are reported to exhibit improved photo-catalytic production of hydrogen than pure TiO2 nanosheet films [13]. Nanoclusters of Pt, Ru and Rh also exhibit high activities and also generate stoichiometric amount of hydrogen [14]. In order to be useful as an HER catalyst, bulk MoP materials must be doped and ground to reduce the size. In the current work, we utilize mechanical ball milling technique to reduce the MoP particle size and synthesize MoP nanoparticles for increased HER activity. In the process of ball milling, moving balls apply their kinetic energy to the material thereby breaking inter- and intra-particulate interactions and producing fresh surfaces by fracturing the material particles. The uncompensated bonds on the newly formed surfaces are normally chemically reactive. In the literature, ball milling has been reported as a mechano-chemical synthesis method for the production of unique nanostructures with new chemical properties. Large-scale synthesis of nitrogen-doped carbon nanomaterials have been prepared by ball milling followed by annealing for electrochemical applications [15]. Wang et al. [16] utilized high energy ball milling to convert commercial microcrystalline MoS2 into distorted MoS2 nanostructures and report improved HER catalytic performance. Hence it is clear that reducing the particle size favorably affects the HER activity. A detailed characterization of MoP compounds along with their electrochemical studies is reported in the present work. Ball-milled MoP particles are at a risk of agglomeration due to high surface area. Incorporating high surface area materials such as graphite can help in the preparation of highly dispersed MoP nanoparticles. Graphite has garnered wide interest in the last few years due to its unusual combination of properties arising from the high degree of anisotropy that has been attributed to its hexagonal crystal structure. Graphite nanoparticles and nanosheets have been utilized as electrodes in lithium recharged batteries [17], adsorption substrates [18], and as a reinforcing material in nanocomposites [19], and they can be produced by chemical or mechanical methods. The most common experimental method to produce graphite nanosheets [20] or graphene nanoplatelets [21] is mechanical milling. The milling process brings about structural transformations in graphite and generates different defects [20], which can be exploited to anchor nanoparticles towards graphite planes. Ball milling has also been investigated as an alternative process to enhance the adhesion between Polyetherimide and exfoliated graphite nanoplatelets particles and also to reduce the particle size. High electrical conductivity and enhancement in modulus are achieved by this approach along with improved strength properties [22]. The performance of electrocatalytic materials can be further improved by the synergetic combination of electrocatalytic components, often by the use of carbon nanomaterials for superior conductivity and simplified substrate architecture. The electrical coupling between MoS2 nanoparticles and graphene is found to improve the electrocatalytic hydrogen production [23]. Recently, we have reported the combination of MoO2 and graphene as highly efficient HER catalytic material [24]. In the current work, we report the HER catalytic activity of new MoP-graphite nanocomposite materials prepared by ball milling. 2 Experimental Molybdenum phosphide (MoP, 99.5%) and graphite (crystalline, 300 mesh, 99%) were purchased from Alfa Aesar and used without further purification. Nanocrystalline molybdenum phosphide was prepared by ball milling the commercial MoP (referred to as C-MoP below) in a high-energy ball mill SPEX 8000M mixer/mill using tungsten carbide balls (10.74g). MoP samples were milled for different periods of 0, 15, 30, 40, 60, 90, and 120min to obtain samples labeled C-MoP, MoP-15, MoP-30, MoP-40, MoP-60, MoP-90, and MoP-120, respectively. In order to prevent compound overheating, a 15min time delay was provided at 15min intervals. We have termed the graphite after ball milling as graphite nanosheets, following the terminology employed previously for ball-milled graphite [20]. MoP-graphite nanosheets were prepared by mixing C-MoP and commercial graphite in different weight ratios in concentrated H2SO4 by stirring for nearly 1h and then washing with water several times until the pH was neutral. The material obtained after vacuum filtration was dried in air at 60°C overnight. The compounds obtained by mixing C-MoP and graphite in 1:1, 1:2, and 2:1 mass ratios are termed as MoP-G-11, MoP-G-12, and MoP-G-21, respectively. These compounds were then ball milled for 60min and labeled as MoP-G-60-11, MoP-G-60-12, and MoP-G-60-21. The MoP compounds were characterized with powder X-ray diffraction (XRD), scanning electron microscopy (SEM) and Brunauer–Emmett–Teller (BET) surface area analysis. The powder XRD of the materials were acquired with PANalytical Empyrean X-ray diffractometer after spreading the powder samples over glass slides and scanning with a 0.013° step size. The crystallite sizes were estimated with Scherrer's approximation [25]. SEM images were collected by a Leo Zeiss 1530 VP scanning electron microscope operated at 10kV. BET surface areas were obtained with a Quanta chrome instruments Nova 2200e Surface area and pore size analyzer. For the HER activity studies, 1.5mg of the catalyst was dispersed in 100μL of Nafion (prepared by mixing 1mL of 2wt% Nafion solution and 9mL of ethanol) by ultrasonication. Subsequently, 3μL of the slurry was drop-casted on a clean glassy carbon electrode (GCE, 0.07cm2 area). The modified GCE was allowed to dry under ambient conditions. Each modified electrode was fabricated with identical loading. Electrochemical characterization was performed using a CH Instruments 660C electrochemical work station using a standard three-electrode setup. The electrocatalytic activity of the materials was evaluated using both linear sweep voltammetry (LSV) and cyclic voltammetry (CV). The electrochemical impedance spectroscopy measurements were carried out using a similar three electrode system. The impedance spectra were recorded under a perturbation signal of 0.5V amplitude over a frequency range of 0.1Hz–1kHz. Gas chromatographic analysis of hydrogen evolved was carried out using Varian CP 3800 Gas chromatograph. The electrochemical cell was purged with nitrogen gas which also served as the carrier gas. The GC instrument was equipped with a thermal conductivity detector and a purge trap. For the GC experiments, another type of working electrode was prepared by coating 1mg/cm2 of material dispersed in Nafion solution over carbon fiber paper (Fuel Cell Stores) using a paint brush. All the measurements were carried out in 0.5M H2SO4 solution. 3 Results and discussion The powder X-ray diffraction pattern of C-MoP is shown in Fig. 1a. The stick pattern shows a perfect match with MoP with JCPDS No. 98-009-0157 (Fig. 1b). Molybdenum phosphide crystallizes in the hexagonal tungsten carbide (WC) structure in which each molybdenum atom is trigonal-prismatically surrounded by six phosphorus atoms, and vice versa (Fig. 1c). The MoP XRD pattern shows significant peak broadening and reduction in intensity with increased milling time. The diffraction peak broadening and intensity reduction in ball-milled powders are associated with the changes in crystallite size, lattice internal strain, and the instrumental effects [26]. We also characterized the mixed MoP-graphite materials before and after ball milling. We focus most of our analyses on the material prepared by mixing MoP and graphite in a 1:1 ratio (MoP-G-11). The XRD of MoP-G-11 (Fig. 2 ) before ball milling shows sharp peaks corresponding to C(002) crystalline reflections (2θ =26°) of graphite. After 60min of ball milling (to correspond with the “optimum” MoP-60 in Fig. 1), the sharp C(002) peaks are significantly reduced in intensity with increased width. The peak width is a probe of structural disorder: narrow peaks are an indication that sp2 clusters possess less defects and strain. Defect aggregation causes bond distortions at sp2C=C sites, thus in-plane sp2 bonds become strained and distorted and get converted to sp3 bonds and consequently sp2/sp3 carbon ratio decreases with the increase in lattice defects. These lattice distortions disturb the conjugation of double in-plane bonds and also the spacing of the sp2 carbon sites inducing microstructural and dimensional changes to the graphitic lattice. Thus the increase in width of the C(002) peak in MoP-G-60-11 in Fig. 2 indicates a decrease in overall crystallite size. This could be due to amorphitization of graphite via theC-C bond breaking. (1) L α = k λ β cos θ where L α is the average crystallite size, k =0.9, λ is the wavelength of Cu Kα radiation (1.54Å), β is the full width at half maximum (FWHM), and θ is the Bragg diffraction angle. The average crystallite sizes of MoP compounds based on Eq. (1) are given in Table 1 . The effectiveness of the milling process to deform the compound is evident from the large changes to crystallite thickness after the samples were milled for only a short period of time. It is also notable from Table 1 that the average sizes of the MoP-60 nanomaterial and the MoP-G-60-11 material are very similar. This indicates that the decrease in size by ball milling is the same regardless of the presence or absence of graphite in the sample. Fig. 3 shows the SEM images of MoP, graphite, and MoP-G compounds. Large MoP particles are observed with C-MoP before ball milling (Fig. 3a), while after 60-min ball milling (Fig. 3b) the particle sizes are clearly smaller. Thus, ball milling produces sub-micron agglomerates that corroborate the observations of the reduced crystallite size from the XRD results of milled MoP compared to C-MoP. Similar results are obtained for the graphite-containing materials. The SEM image of commercial graphite shows thick micrometer-sized flakes (Fig. 3c). On the other hand, the SEM image of MoP-G-60-11 shows a reduced size for graphite flakes along with nanoparticles of MoP dispersed on graphite nanosheets (Fig. 3d). The BET surface areas of different MoP samples are summarized in Table 2 . The ball milling of MoP initially results in an increased surface area. For example, BET surface areas of MoP-40 and MoP-60 are 15 and and 25m2/g, respectively. With further increase in milling time, the BET surface area decreases, which could be due to the agglomeration of nanoparticles. The lowest value, 4.3m2/g, is obtained for the MoP-120 (sample obtained by 120min of ball milling). This shows that a variation of 1h of milling time (from 60 to 120min) diminishes the surface area by nearly 6%. This is in agreement with previous observations that the specific surface area decreases as a function of milling time, and hence milling time control is crucial to obtain the desired specific surface area [27]. The C-MoP has a surface area of 1.8m2/g, in agreement with the reported literature value of 2m2/g [3]. On the otherhand, the surface areas of MoP-G-11 before and after milling are 7.6 and 68, respectively. Hence, a nearly 9-fold enhancement in surface area corroborates the reduced crystallite size measurements from XRD. By comparing Tables 1 and 2, it is clear that the decrease in crystallite size coincides roughly with the increase in the BET specific surface area. We have also evaluated the electrochemical activity of the MoP compounds for HER. The CV results for MoP compounds and MoP-graphite compounds, recorded at 50mV/s, are shown in Fig. 4 . For both sets of data, the results demonstrate an increased current response for ball-milled compounds relative to those without milling. The results show that the MoP-60 provides the highest current while the commercial MoP provides the lowest current. The current density measurements yield a clear trend that activity increases with ball milling time up to 60min. This trend in electrochemical activity is consistent with the trends in surface areas and particle sizes. Compared to MoP-60 (Fig. 4a), MoP-G compounds after ball milling (Fig. 4b) show better current responses. The highest current and lowest potential window of MoP-G-60-11 is indicative of its superior catalytic activity over other MoP-G compounds. Fig. 5a shows the polarization curves of coated electrodes. Polarization studies were carried out on Pt/C (10wt% loading of Pt on Vulcan carbon) as a reference point. The bare GCE does not show any activity for H2 production. However, for the 60-min ball-milled compound (MoP-60), the catalytic current is observed at a low onset reduction potential of about −0.32V (vs. Ag/AgCl). Above −0.32V, the cathodic current rises rapidly at more negative potentials with considerable current density of 9mA/cm2 at 500mV overpotential. Commercial MoP coated electrodes display much lower HER activities, with a current density of only 0.9mA/cm2 at 500mV (Fig. S1). This is 10 times lower than the MoP-60 modified GCE. The current density of graphite is 0.07mA/cm2 at 500mV, which is much lower than that commercial MoP. Similarly, other ball-milled MoP compounds (except MoP-40) exhibit lower current densities at 500mV (Fig. S1). The commercial and ball-milled MoP BET surface area analyses (Table 2) show an increase in surface area with up to 60min of milling time and a decline with longer times. There is a correlation between the surface area and electrocatalytic activity, indicating that the surface area is a significant parameter dominating the HER, as reported extensively in the literature [28]. The increase in surface area of the electrode with reduced particle size in turn leads to large contact area between electrolyte and electrode. This enlargement of electrode area would also help improved performance of milled samples [29]. However, the catalytic current densities obtained from MoP-G compounds are higher than that of the MoP-60 compound. Among the three different MoP-G composites, the one with 1:1 mixing of C-MoP and graphite stands out with lower onset reduction potential and higher current density. The onset reduction potentials with Pt/C, MoP-G-60-11, MoP-G-60-12, and MoP-G-60-21 are respectively −277, −460, −486, and −478mV at 10mA/cm2 current density. Because of the high surface energy resulting from the dangling bonds produced during ball milling, MoP nanoparticles could have a tendency to agglomerate. The existence of conducting graphite can prevent aggregation and also enhance the electron transport by acting as a conducting substrate. This implies that conductivity was another factor influencing the HER catalysis. Based on the above factors, it can be concluded that the improved catalytic activity of the MoP-G-60 compound modified GCE results from a right combination of specific structural properties, such as large surface area, which in turn leads to more catalytically active sites and less particle aggregation. To obtain further insight into the HER on various MoP catalysts, we performed Tafel analysis from the linear-sweep voltammetry data. Tafel plots of various catalyst materials were formulated from the polarization curves and are shown in Fig. 5b. The linear region of Tafel plots were fitted into the Tafel equation: (2) η = b log j + a where η (mV) represents the applied overpotential, b (mV/dec) is the Tafel slope and j (mA/cm2) is the resulting (measured) current density, and a (mV) is the intercept related to the exchange current density j 0 (mA/cm2). The resulting Tafel slopes of MoP-60, MoP-G-12, MoP-G-21, MoP-G-11, and Pt/C are respectively 85, 82, 69, 63, and 35mV/dec. The smaller Tafel slope for MoP-G-60-11 compared to MoP-60 may be explained by the fact that more accessible catalytically active edges are created in MoP-G-60-11 because of the incorporation of conducting graphite nanoplatelets. This view was further corroborated by the larger BET surface area of the MoP-G-60-11 (68m2/g) in comparison to MoP-60 (25m2/g), since higher surface area of the MoP-graphite nanosheets can result in a higher density of accessible reactive sites. The Tafel slope of 63mV/dec is close to other recently reported molybdenum-based HER evolution catalysts, such as Mo2C/carbon nanotubes (55mV/dec), core/shell MoO3-MoS2 nanowires (about 50–60mV/dec), and MoS2 crystals (55–60mV/dec) [30]. The Tafel slope is also close to recently reported MoP catalysts while the exchange current is higher that most materials reported. For instance, Chen et al. [9] reported a Tafel slope of 60mV/dec with pure MoP. Also, MoP prepared by temperature programmed reduction technique exhibits a Tafel slope of 54mV/dec [10]. McEnaney et al. [8] reported amorphous molybdenum phosphide nanoparticles for hydrogen production. With MoP nanoparticles coated over Ti foil, they reported a Tafel slope of 45mV/dec. Table 3 gives a direct comparison between HER catalytic activities of reported MoP catalysts with the present MoP-G-60-11 nanomaterial catalyst. The enhanced HER activity with the MoP-G materials could be attributed to the improved electrical conductivity compared to bare MoP-60 because the presence of graphite induces fast electron transport from the less conductive MoP nanoparticles to the electrode. To investigate this hypothesis, we performed AC impedance analyses. Fig. 6 compares the AC impedance spectra of the MoP-60 and MoP-G-60-11 composites. Note that the plot axes units are kΩ, while the inset units are Ω. It is clearly observed from Fig. 6 that the MoP-G-60-11 (inset) compound has a smaller radius of semicircle than MoP-60 in the Nyquist plots, implying lower charge-transfer impedance and thus more facile electrode kinetics [31]. The catalyst prepared by mixing and ball milling MoP and pure graphite (MoP-G-60-11) was investigated for H2 production. Hydrogen gas produced with MoP-G-60-11, was collected and evaluated using gas chromatography with thermal conductivity detection. Hydrogen gas generated at the electrode (inset photo) was collected over the solution and injected onto a special hydrogen column. As shown in Fig. 7 , with more applied potential, the reaction rate increases and hence the amount of hydrogen evolved increases. Note that hydrogen gas starts evolving at −0.35V applied potential, but is not detectable until −0.45V is applied. We also evaluated the stability of the MoP-G-60-11 catalyst in acidic solution using material coated on glassy carbon electrode. In Fig. 8a, linear sweep voltammograms of the material coated onto a glassy carbon electrode are shown before and after 20h of continuous operation. Fig. 8b shows the amperometric curve recorded at a constant applied potential during the 20h of operation. It is observed that the cathodic current decay is negligible even over 20h, indicating a good stability of this material for long-time hydrogen production under strongly acidic conditions. Indeed, Fig. 8a suggests slightly improved activity after 20h, confirming the high electrocatalytic material stability and reproducibility. 4 Conclusions We have demonstrated the electrocatalytic activity of the ball-milled MoP and MoP-graphite for the production of hydrogen. XRD and SEM measurements show a reduction in MoP size with ball milling time up to 1h of milling of MoP with an enhanced BET surface area, after ball milling. The electrocatalytic performance of the MoP improves with decreased particle size. After 1h of milling, the particle sizes increase, likely due to agglomeration. With the incorporation of graphite to MoP, the onset reduction potential for hydrogen production decreases and the current density increases. We attribute the improved electrocatalytic activity of MoP-G compound to a better dispersion of MoP nanoparticles over high surface area graphite which in turn possesses more active sites and also to the improved electron transfer brought about by conducting graphite. The evolved hydrogen gas was characterized using gas chromatograms at different applied voltages. The stability measurements show that the MoP-graphite is highly stable under continuous as well as repeated operation, which is highly desirable for an efficient HER catalyst material. This study offers a new method for the development of highly active non-noble electrocatalysts by simple solid state ball milling for hydrogen production from water splitting. Acknowledgment This work was supported by a research grant from NATCO Pharmaceuticals, Hyderabad, India. Appendix A Supplementary data Supplementary data associated with this article can be found, in the online version, at http://dx.doi.org/10.1016/j.apcata.2014.11.003. Appendix A Supplementary data Supplementary material related to this article can be found, in the online version, at References [1] J. Greeley T.F. Jaramillo J. Bonde I. Chorkendorff J.K. Norskov Computational high-throughput screening of electrocatalytic materials for hydrogen evolution Nat. Mater. 5 2006 909 913 [2] B. Hinnemann P.G. Moses J. Bonde K.P. Jørgensen J.H. Nielsen S. Horch I. Chorkendorff J.K. Nørskov Biomimetic hydrogen evolution: MoS2 nanoparticles as catalyst for hydrogen evolution J. Amer. Chem. Soc. 127 2005 5308 5309 [3] C. Stinner R. Prins T. Weber Formation, structure, and HDN activity of unsupported molybdenum phosphide J. Catal. 191 2000 438 444 [4] H.I. Karunadasa E. Montalvo Y. Sun M. Majda J.R. Long C.J. Chang A molecular MoS2 edge site mimic for catalytic hydrogen generation Science 335 2012 698 702 [5] E.J. Popczun J.R. McKone C.G. Read A.J. Biacchi A.M. Wiltrout N.S. Lewis R.E. Schaak Nanostructured nickel phosphide as an electrocatalyst for the hydrogen evolution reaction J. Amer. Chem. Soc. 135 2013 9267 9270 [6] E.J. Popczun C.G. Read C.W. Roske N.S. Lewis R.E. Schaak Highly active electrocatalysis of the hydrogen evolution reaction by cobalt phosphide nanoparticles Angew. Chem. 126 2014 5531 5534 [7] P. Xiao M.A. Sk L. Thia X. Ge R.J. Lim J.-Y. Wang K.H. Lim X. Wang Molybdenum phosphide as an efficient electrocatalyst for the hydrogen evolution reaction Energy Environ. Sci. 7 2014 2624 2629 [8] J.M. McEnaney J.C. Crompton J.F. Callejas E.J. Popczun A.J. Biacchi N.S. Lewis R.E. Schaak Amorphous molybdenum phosphide nanoparticles for electrocatalytic hydrogen evolution Chem. Mater. 26 2014 4826 [9] X. Chen D. Wang Z. Wang P. Zhou Z. Wu F. Jiang Molybdenum phosphide: a new highly efficient catalyst for the electrochemical hydrogen evolution reaction Chem. Commun. 50 2014 11683 [10] Z. Xing Q. Liu A.M. Asiri X. Sun Closely interconnected network of molybdenum phosphide nanoparticles: a highly efficient electrocatalyst for generating hydrogen from water Adv. Mater. 26 2014 5702 [11] K. Yamamoto T. Imaoka W.-J. Chun O. Enoki H. Katoh M. Takenaga A. Sonoi Size-specific catalytic activity of platinum clusters enhances oxygen reduction reactions Nat. Chem. 1 2009 397 402 [12] S.B. Khan M. Faisal M.M. Rahman K. Akhtar A.M. Asiri A. Khan K.A. Alamry Effect of particle size on the photocatalytic activity and sensing properties of CeO2 nanoparticles J. Electrochem. Sci. 8 2013 7284 7297 [13] L. Enzhou K. Limin Y. Yuhao S. Tao H. Xiaoyun Z. Changjun L. Hanchen W. Qiuping L. Xinghua F. Jun Plasmonic Ag deposited TiO2 nano-sheet film for enhanced photocatalytic hydrogen production by water splitting Nanotechnology 25 2014 165401 [14] M. Chandra Q. Xu Room temperature hydrogen generation from aqueous ammonia-borane using noble metal nano-clusters as highly active catalysts J. Power Sources 168 2007 135 142 [15] T. Xing J. Sunarso W. Yang Y. Yin A.M. Glushenkov L.H. Li P.C. Howlett Y. Chen Ball milling: a green mechanochemical approach for synthesis of nitrogen doped carbon nanoparticles Nanoscale 5 2013 7970 7976 [16] D. Wang Z. Wang C. Wang P. Zhou Z. Wu Z. Liu Distorted MoS2 nanostructures: an efficient catalyst for the electrochemical hydrogen evolution reaction Electrochem. Commun. 34 2013 219 222 [17] U. Tanaka T. Sogabe H. Sakagoshi M. Ito T. Tojo Anode property of boron-doped graphite materials for rechargeable lithium-ion batteries Carbon 39 2001 931 [18] F. Ortmann W.G. Schmidt F. Bechstedt Attracted by long-range electron correlation: adenine on graphite Phys. Rev. Lett. 95 2005 186101 [19] K. Kalaitzidou H. Fukushima L.T. Drzal Mechanical properties and morphological characterization of exfoliated graphite–polypropylene nanocomposites Comp. Part A: Appl. Sci. Manuf. 38 2007 1675 [20] M.V. Antisari A. Montone N. Jovica E. Piscopiello C. Alvani L. Pilloni Low energy pure shear milling: a method for the preparation of graphite nano-sheets Scripta Mater. 55 2006 1047 1050 [21] I.-Y. Jeon H.-J. Choi S.-M. Jung J.-M. Seo M.-J. Kim L. Dai J.-B. Baek Large-scale production of edge-selectively functionalized graphene nanoplatelets via ball milling and their use as metal-free electrocatalysts for oxygen reduction reaction J. Am. Chem. Soc. 135 2013 1386 [22] H. Wu B. Rook L.T. Drzal Dispersion optimization of exfoliated graphite nanoplatelets in polyetherimide nanocomposites: extrusion vs precoating vs solid state ball milling Polym. Compos. 34 2013 426 432 [23] Y. Li H. Wang L. Xie Y. Liang G. Hong H. Dai MoS2 nanoparticles grown on graphene: an advanced catalyst for the hydrogen evolution reaction J. Am. Chem. Soc. 133 2011 7296 [24] S.S.J. Aravind M. Costa V. Pereira A. Mugweru K. Ramanujachary T.D. Vaden Molybdenum/graphene based catalyst for hydrogen evolution reaction synthesized by a rapid photothermal method Int. J. Hydrogen Energy 39 2014 11528 11536 [25] P. Scherrer Bestimmung der Grösse und der inneren Struktur von Kolloidteilchen mittels Röntgenstrahlen Nachr. Ges. Wiss. Göttingen 26 1918 98 100 [26] C. Suryanarayana Mechanical alloying and milling Prog. Mater. Sci. 46 2001 1 184 [27] H. Hermann T. Schubert W. Gruner N. Mattern Structure and chemical reactivity of ball-milled graphite Nanostruct. Mater. 8 1997 215 [28] L. Liao S. Wang J. Xiao X. Bian Y. Zhang M.D. Scanlon X. Hu Y. Tang B. Liu H.H. Girault A nanoporous molybdenum carbide nanowire as an electrocatalyst for hydrogen evolution reaction Energy Environ. Sci. 7 2014 387 392 [29] M. Kotobuki Improved performance of hydrothermally synthesized by ball milling as a positive electrode for Li ion battery ISRN Electrochem. 2013 2013 5 [30] T.F. Jaramillo K.P. Jørgensen J. Bonde J.H. Nielsen S. Horch I. Chorkendorff Identification of active edge sites for electrochemical H2 evolution from MoS2 nanocatalysts Science 317 2007 100 102 [31] C. Ge P. Jiang W. Cui Z. Pu Z. Xing A.M. Asiri A.Y. Obaid X. Sun J. Tian Shape-controllable synthesis of Mo2C nanostructures as hydrogen evolution reaction electrocatalysts with high activity Electrochim. Acta 134 2014 182 186",
      "scopus-id": "84916631545",
      "coredata": {
        "eid": "1-s2.0-S0926860X14006875",
        "dc:description": "Clean hydrogen energy technology is an alternative to a fossil fuel-based energy economy. Efficient and economical catalysts are necessary for large-scale hydrogen generation. We report MoP and MoP-graphite nanosheets prepared by ball milling commercial compounds as efficient electrocatalytic materials for hydrogen generation via the hydrogen reduction mechanism. The hydrogen generated through electrochemical catalysis was evaluated using gas chromatography. The effects of ball milling time and proportions of MoP-graphite nanosheets on electrocatalytic activity were investigated. The new nanomaterials were characterized using powder XRD, SEM and BET surface area measurements. The results suggest superior electrocatalytic performance with a balance of ball-milled MoP and graphite. A Tafel slope of 63mV/dec was obtained for this new material.",
        "openArchiveArticle": "false",
        "prism:coverDate": "2015-01-25",
        "openaccessUserLicense": null,
        "prism:aggregationType": "Journal",
        "prism:url": "https://api.elsevier.com/content/article/pii/S0926860X14006875",
        "dc:creator": [
          {
            "@_fa": "true",
            "$": "Jyothirmayee Aravind, S.S."
          },
          {
            "@_fa": "true",
            "$": "Ramanujachary, Kandalam"
          },
          {
            "@_fa": "true",
            "$": "Mugweru, Amos"
          },
          {
            "@_fa": "true",
            "$": "Vaden, Timothy D."
          }
        ],
        "link": [
          {
            "@_fa": "true",
            "@rel": "self",
            "@href": "https://api.elsevier.com/content/article/pii/S0926860X14006875"
          },
          {
            "@_fa": "true",
            "@rel": "scidir",
            "@href": "https://www.sciencedirect.com/science/article/pii/S0926860X14006875"
          }
        ],
        "dc:format": "application/json",
        "openaccessType": null,
        "pii": "S0926-860X(14)00687-5",
        "prism:volume": "490",
        "prism:publisher": "Elsevier B.V.",
        "dc:title": "Molybdenum phosphide-graphite nanomaterials for efficient electrocatalytic hydrogen production",
        "prism:copyright": "Copyright © 2014 Elsevier B.V. All rights reserved.",
        "openaccess": "0",
        "prism:issn": "0926860X",
        "dcterms:subject": [
          {
            "@_fa": "true",
            "$": "Molybdenum phosphide"
          },
          {
            "@_fa": "true",
            "$": "Graphite nanosheets"
          },
          {
            "@_fa": "true",
            "$": "Hydrogen evolution reaction"
          },
          {
            "@_fa": "true",
            "$": "Ball milling"
          },
          {
            "@_fa": "true",
            "$": "Electrochemical catalysts."
          }
        ],
        "openaccessArticle": "false",
        "prism:publicationName": "Applied Catalysis A: General",
        "openaccessSponsorType": null,
        "prism:pageRange": "101-107",
        "prism:endingPage": "107",
        "pubType": "fla",
        "prism:coverDisplayDate": "25 January 2015",
        "prism:doi": "10.1016/j.apcata.2014.11.003",
        "prism:startingPage": "101",
        "dc:identifier": "doi:10.1016/j.apcata.2014.11.003",
        "openaccessSponsorName": null
      },
      "objects": {
        "object": [
          {
            "@category": "thumbnail",
            "@height": "164",
            "@width": "215",
            "@_fa": "true",
            "$": "https://api.elsevier.com/content/object/eid/1-s2.0-S0926860X14006875-fx1.sml?httpAccept=%2A%2F%2A",
            "@multimediatype": "GIF image file",
            "@type": "IMAGE-THUMBNAIL",
            "@size": "15862",
            "@ref": "fx1",
            "@mimetype": "image/gif"
          },
          {
            "@category": "thumbnail",
            "@height": "153",
            "@width": "219",
            "@_fa": "true",
            "$": "https://api.elsevier.com/content/object/eid/1-s2.0-S0926860X14006875-gr1.sml?httpAccept=%2A%2F%2A",
            "@multimediatype": "GIF image file",
            "@type": "IMAGE-THUMBNAIL",
            "@size": "20230",
            "@ref": "gr1",
            "@mimetype": "image/gif"
          },
          {
            "@category": "thumbnail",
            "@height": "164",
            "@width": "154",
            "@_fa": "true",
            "$": "https://api.elsevier.com/content/object/eid/1-s2.0-S0926860X14006875-gr2.sml?httpAccept=%2A%2F%2A",
            "@multimediatype": "GIF image file",
            "@type": "IMAGE-THUMBNAIL",
            "@size": "13434",
            "@ref": "gr2",
            "@mimetype": "image/gif"
          },
          {
            "@category": "thumbnail",
            "@height": "164",
            "@width": "213",
            "@_fa": "true",
            "$": "https://api.elsevier.com/content/object/eid/1-s2.0-S0926860X14006875-gr3.sml?httpAccept=%2A%2F%2A",
            "@multimediatype": "GIF image file",
            "@type": "IMAGE-THUMBNAIL",
            "@size": "43932",
            "@ref": "gr3",
            "@mimetype": "image/gif"
          },
          {
            "@category": "thumbnail",
            "@height": "91",
            "@width": "219",
            "@_fa": "true",
            "$": "https://api.elsevier.com/content/object/eid/1-s2.0-S0926860X14006875-gr4.sml?httpAccept=%2A%2F%2A",
            "@multimediatype": "GIF image file",
            "@type": "IMAGE-THUMBNAIL",
            "@size": "14587",
            "@ref": "gr4",
            "@mimetype": "image/gif"
          },
          {
            "@category": "thumbnail",
            "@height": "86",
            "@width": "219",
            "@_fa": "true",
            "$": "https://api.elsevier.com/content/object/eid/1-s2.0-S0926860X14006875-gr5.sml?httpAccept=%2A%2F%2A",
            "@multimediatype": "GIF image file",
            "@type": "IMAGE-THUMBNAIL",
            "@size": "14214",
            "@ref": "gr5",
            "@mimetype": "image/gif"
          },
          {
            "@category": "thumbnail",
            "@height": "164",
            "@width": "193",
            "@_fa": "true",
            "$": "https://api.elsevier.com/content/object/eid/1-s2.0-S0926860X14006875-gr6.sml?httpAccept=%2A%2F%2A",
            "@multimediatype": "GIF image file",
            "@type": "IMAGE-THUMBNAIL",
            "@size": "12530",
            "@ref": "gr6",
            "@mimetype": "image/gif"
          },
          {
            "@category": "thumbnail",
            "@height": "164",
            "@width": "215",
            "@_fa": "true",
            "$": "https://api.elsevier.com/content/object/eid/1-s2.0-S0926860X14006875-gr7.sml?httpAccept=%2A%2F%2A",
            "@multimediatype": "GIF image file",
            "@type": "IMAGE-THUMBNAIL",
            "@size": "21936",
            "@ref": "gr7",
            "@mimetype": "image/gif"
          },
          {
            "@category": "thumbnail",
            "@height": "86",
            "@width": "219",
            "@_fa": "true",
            "$": "https://api.elsevier.com/content/object/eid/1-s2.0-S0926860X14006875-gr8.sml?httpAccept=%2A%2F%2A",
            "@multimediatype": "GIF image file",
            "@type": "IMAGE-THUMBNAIL",
            "@size": "10340",
            "@ref": "gr8",
            "@mimetype": "image/gif"
          },
          {
            "@category": "standard",
            "@height": "200",
            "@width": "262",
            "@_fa": "true",
            "$": "https://api.elsevier.com/content/object/eid/1-s2.0-S0926860X14006875-fx1.jpg?httpAccept=%2A%2F%2A",
            "@multimediatype": "JPEG image file",
            "@type": "IMAGE-DOWNSAMPLED",
            "@size": "21135",
            "@ref": "fx1",
            "@mimetype": "image/jpeg"
          },
          {
            "@category": "standard",
            "@height": "342",
            "@width": "488",
            "@_fa": "true",
            "$": "https://api.elsevier.com/content/object/eid/1-s2.0-S0926860X14006875-gr1.jpg?httpAccept=%2A%2F%2A",
            "@multimediatype": "JPEG image file",
            "@type": "IMAGE-DOWNSAMPLED",
            "@size": "75837",
            "@ref": "gr1",
            "@mimetype": "image/jpeg"
          },
          {
            "@category": "standard",
            "@height": "300",
            "@width": "282",
            "@_fa": "true",
            "$": "https://api.elsevier.com/content/object/eid/1-s2.0-S0926860X14006875-gr2.jpg?httpAccept=%2A%2F%2A",
            "@multimediatype": "JPEG image file",
            "@type": "IMAGE-DOWNSAMPLED",
            "@size": "38812",
            "@ref": "gr2",
            "@mimetype": "image/jpeg"
          },
          {
            "@category": "standard",
            "@height": "435",
            "@width": "565",
            "@_fa": "true",
            "$": "https://api.elsevier.com/content/object/eid/1-s2.0-S0926860X14006875-gr3.jpg?httpAccept=%2A%2F%2A",
            "@multimediatype": "JPEG image file",
            "@type": "IMAGE-DOWNSAMPLED",
            "@size": "113875",
            "@ref": "gr3",
            "@mimetype": "image/jpeg"
          },
          {
            "@category": "standard",
            "@height": "219",
            "@width": "527",
            "@_fa": "true",
            "$": "https://api.elsevier.com/content/object/eid/1-s2.0-S0926860X14006875-gr4.jpg?httpAccept=%2A%2F%2A",
            "@multimediatype": "JPEG image file",
            "@type": "IMAGE-DOWNSAMPLED",
            "@size": "57988",
            "@ref": "gr4",
            "@mimetype": "image/jpeg"
          },
          {
            "@category": "standard",
            "@height": "207",
            "@width": "525",
            "@_fa": "true",
            "$": "https://api.elsevier.com/content/object/eid/1-s2.0-S0926860X14006875-gr5.jpg?httpAccept=%2A%2F%2A",
            "@multimediatype": "JPEG image file",
            "@type": "IMAGE-DOWNSAMPLED",
            "@size": "54308",
            "@ref": "gr5",
            "@mimetype": "image/jpeg"
          },
          {
            "@category": "standard",
            "@height": "318",
            "@width": "375",
            "@_fa": "true",
            "$": "https://api.elsevier.com/content/object/eid/1-s2.0-S0926860X14006875-gr6.jpg?httpAccept=%2A%2F%2A",
            "@multimediatype": "JPEG image file",
            "@type": "IMAGE-DOWNSAMPLED",
            "@size": "38702",
            "@ref": "gr6",
            "@mimetype": "image/jpeg"
          },
          {
            "@category": "standard",
            "@height": "171",
            "@width": "225",
            "@_fa": "true",
            "$": "https://api.elsevier.com/content/object/eid/1-s2.0-S0926860X14006875-gr7.jpg?httpAccept=%2A%2F%2A",
            "@multimediatype": "JPEG image file",
            "@type": "IMAGE-DOWNSAMPLED",
            "@size": "38072",
            "@ref": "gr7",
            "@mimetype": "image/jpeg"
          },
          {
            "@category": "standard",
            "@height": "200",
            "@width": "508",
            "@_fa": "true",
            "$": "https://api.elsevier.com/content/object/eid/1-s2.0-S0926860X14006875-gr8.jpg?httpAccept=%2A%2F%2A",
            "@multimediatype": "JPEG image file",
            "@type": "IMAGE-DOWNSAMPLED",
            "@size": "37243",
            "@ref": "gr8",
            "@mimetype": "image/jpeg"
          },
          {
            "@category": "high",
            "@height": "886",
            "@width": "1162",
            "@_fa": "true",
            "$": "https://api.elsevier.com/content/object/eid/1-s2.0-S0926860X14006875-fx1_lrg.jpg?httpAccept=%2A%2F%2A",
            "@multimediatype": "JPEG image file",
            "@type": "IMAGE-HIGH-RES",
            "@size": "149850",
            "@ref": "fx1",
            "@mimetype": "image/jpeg"
          },
          {
            "@category": "high",
            "@height": "1515",
            "@width": "2162",
            "@_fa": "true",
            "$": "https://api.elsevier.com/content/object/eid/1-s2.0-S0926860X14006875-gr1_lrg.jpg?httpAccept=%2A%2F%2A",
            "@multimediatype": "JPEG image file",
            "@type": "IMAGE-HIGH-RES",
            "@size": "359185",
            "@ref": "gr1",
            "@mimetype": "image/jpeg"
          },
          {
            "@category": "high",
            "@height": "1330",
            "@width": "1249",
            "@_fa": "true",
            "$": "https://api.elsevier.com/content/object/eid/1-s2.0-S0926860X14006875-gr2_lrg.jpg?httpAccept=%2A%2F%2A",
            "@multimediatype": "JPEG image file",
            "@type": "IMAGE-HIGH-RES",
            "@size": "161128",
            "@ref": "gr2",
            "@mimetype": "image/jpeg"
          },
          {
            "@category": "high",
            "@height": "1156",
            "@width": "1500",
            "@_fa": "true",
            "$": "https://api.elsevier.com/content/object/eid/1-s2.0-S0926860X14006875-gr3_lrg.jpg?httpAccept=%2A%2F%2A",
            "@multimediatype": "JPEG image file",
            "@type": "IMAGE-HIGH-RES",
            "@size": "359542",
            "@ref": "gr3",
            "@mimetype": "image/jpeg"
          },
          {
            "@category": "high",
            "@height": "971",
            "@width": "2333",
            "@_fa": "true",
            "$": "https://api.elsevier.com/content/object/eid/1-s2.0-S0926860X14006875-gr4_lrg.jpg?httpAccept=%2A%2F%2A",
            "@multimediatype": "JPEG image file",
            "@type": "IMAGE-HIGH-RES",
            "@size": "333642",
            "@ref": "gr4",
            "@mimetype": "image/jpeg"
          },
          {
            "@category": "high",
            "@height": "917",
            "@width": "2327",
            "@_fa": "true",
            "$": "https://api.elsevier.com/content/object/eid/1-s2.0-S0926860X14006875-gr5_lrg.jpg?httpAccept=%2A%2F%2A",
            "@multimediatype": "JPEG image file",
            "@type": "IMAGE-HIGH-RES",
            "@size": "312634",
            "@ref": "gr5",
            "@mimetype": "image/jpeg"
          },
          {
            "@category": "high",
            "@height": "1408",
            "@width": "1662",
            "@_fa": "true",
            "$": "https://api.elsevier.com/content/object/eid/1-s2.0-S0926860X14006875-gr6_lrg.jpg?httpAccept=%2A%2F%2A",
            "@multimediatype": "JPEG image file",
            "@type": "IMAGE-HIGH-RES",
            "@size": "167596",
            "@ref": "gr6",
            "@mimetype": "image/jpeg"
          },
          {
            "@category": "high",
            "@height": "760",
            "@width": "998",
            "@_fa": "true",
            "$": "https://api.elsevier.com/content/object/eid/1-s2.0-S0926860X14006875-gr7_lrg.jpg?httpAccept=%2A%2F%2A",
            "@multimediatype": "JPEG image file",
            "@type": "IMAGE-HIGH-RES",
            "@size": "145814",
            "@ref": "gr7",
            "@mimetype": "image/jpeg"
          },
          {
            "@category": "high",
            "@height": "885",
            "@width": "2248",
            "@_fa": "true",
            "$": "https://api.elsevier.com/content/object/eid/1-s2.0-S0926860X14006875-gr8_lrg.jpg?httpAccept=%2A%2F%2A",
            "@multimediatype": "JPEG image file",
            "@type": "IMAGE-HIGH-RES",
            "@size": "187689",
            "@ref": "gr8",
            "@mimetype": "image/jpeg"
          },
          {
            "@category": "standard",
            "@_fa": "true",
            "$": "https://api.elsevier.com/content/object/eid/1-s2.0-S0926860X14006875-mmc1.pdf?httpAccept=%2A%2F%2A",
            "@multimediatype": "Acrobat PDF file",
            "@type": "APPLICATION",
            "@size": "143489",
            "@ref": "mmc1",
            "@mimetype": "application/pdf"
          },
          {
            "@category": "thumbnail",
            "@height": "36",
            "@width": "90",
            "@_fa": "true",
            "$": "https://api.elsevier.com/content/object/eid/1-s2.0-S0926860X14006875-si1.gif?httpAccept=%2A%2F%2A",
            "@multimediatype": "GIF image file",
            "@type": "ALTIMG",
            "@size": "503",
            "@ref": "si1",
            "@mimetype": "image/gif"
          },
          {
            "@category": "thumbnail",
            "@height": "15",
            "@width": "103",
            "@_fa": "true",
            "$": "https://api.elsevier.com/content/object/eid/1-s2.0-S0926860X14006875-si2.gif?httpAccept=%2A%2F%2A",
            "@multimediatype": "GIF image file",
            "@type": "ALTIMG",
            "@size": "363",
            "@ref": "si2",
            "@mimetype": "image/gif"
          }
        ]
      },
      "link": {
        "@rel": "abstract",
        "@href": "https://api.elsevier.com/content/abstract/scopus_id/84916631545"
      }
    }
  }
}