{
  "metadata": {
    "title": "Heterogeneous palladium catalyst constructed with cross-linked hyperbranched poly(phenylacetylene) as polymer support: A reusable highly active ppm-level catalyst for multiple cross-coupling reactions",
    "authors": "; ",
    "journal": "Applied Catalysis A: General",
    "date": "2015-01-31",
    "doi": "10.1016/j.apcata.2014.10.009",
    "abstract": "",
    "uri": "https://api.elsevier.com/content/article/pii/S0926860X14006218",
    "pii": "S0926860X14006218"
  },
  "fulltext": {
    "full-text-retrieval-response": {
      "scopus-eid": "2-s2.0-84949117500",
      "originalText": "serial JL 271346 291210 291744 291809 31 Applied Catalysis A: General APPLIEDCATALYSISAGENERAL 2014-10-12 2014-10-12 2019-10-30T03:10:36 1-s2.0-S0926860X14006218 S0926-860X(14)00621-8 S0926860X14006218 10.1016/j.apcata.2014.10.009 S300 S300.2 FULL-TEXT 1-s2.0-S0926860X14X00207 2024-01-01T12:30:29.635264Z 0 0 20150101 20150131 2015 2014-10-12T14:39:21.568074Z absattachment articleinfo articletitlenorm authfirstinitialnorm authfirstsurnamenorm cid cids contenttype copyright crossmark dateloaded dateloadedtxt datesearch datesort dateupdated dco docsubtype doctype doi eid ewtransactionid hubeid indexeddate issn issnnorm itemstage itemtransactionid itemweight openaccess openarchive pg pgfirst pglast pii piinorm pubdateend pubdatestart pubdatetxt pubyr sectiontitle sortorder srctitle srctitlenorm srctype ssids alllist content subj subheadings suppl tomb volfirst volissue volumelist webpdf webpdfpagecount yearnav figure table body acknowledge affil articletitle auth authfirstini authfull authkeywords authlast grantsponsor grantsponsorid highlightsabst primabst ref specialabst 0926-860X 0926860X true 489 489 C Volume 489 9 61 71 61 71 201501 January 2015 2015-01-01 2015-01-31 2015 Articles article fla Copyright © 2014 Elsevier B.V. All rights reserved. HETEROGENEOUSPALLADIUMCATALYSTCONSTRUCTEDCROSSLINKEDHYPERBRANCHEDPOLYPHENYLACETYLENEPOLYMERSUPPORTAREUSABLEHIGHLYACTIVEPPMLEVELCATALYSTFORMULTIPLECROSSCOUPLINGREACTIONS DONG Z 1 Introduction 2 Experimental 2.1 Materials 2.2 Measurements and characterizations 2.3 Synthesis of hyperbranched polyphenylacetylene (HBPPA) 2.4 Synthesis of heterogeneous Pd catalysts with cross-linked HBPPA as polymer support 2.5 Synthesis of Si-ArI for 3-phase tests 2.6 Mizoroki–Heck reactions catalyzed with heterogeneous Pd catalysts 2.7 Suzuki–Miyaura reactions catalyzed with HBPPA-Pd-2 2.8 Allylic arylation reactions catalyzed with HBPPA-Pd-2 2.9 Reusability test 2.10 Hot filtration test 2.11 3-Phase tests 3 Results and discussion 3.1 Synthesis of heterogeneous Pd catalysts by catalytic cross-linking of HBPPA 3.2 Mizoroki–Heck reactions with various heterogeneous catalysts 3.3 Suzuki–Miyaura reactions catalyzed with HBPPA-Pd-2 3.4 Allylic arylation reactions catalyzed with HBPPA-Pd-2 3.5 Reusability of HBPPA-Pd and Pd leaching during cross-coupling reactions 4 Conclusions Acknowledgements References 2004 METALCATALYZEDCROSSCOUPLINGREACTIONS 2002 HANDBOOKORGANOPALLADIUMCHEMISTRYFORORGANICSYNTHESIS SEECHURN 2012 5062 5085 C MIYAURA 1979 866 867 N MIYAURA 1995 2457 2483 N SUZUKI 1999 147 168 A MIYAURA 2002 11 59 N HECK 1972 2320 2322 R MIZOROKI 1971 581 T HECK 1982 345 390 R DEMEIJERE 1995 2379 2411 A BELETSKAYA 2000 3009 3066 I OESTREICH 2009 M MIZOROKIHECKREACTION MOLNAR 2011 2251 2320 A YIN 2007 133 173 L UOZUMI 2004 77 112 Y AKIYAMA 2009 594 642 R KOBAYASHI 2013 3 19 S ALBENIZ 2011 2347 2360 A BALANTA 2011 4973 4985 A POLSHETTIWAR 2009 2599 2626 V PAGLIARO 2012 432 445 M FARINA 2004 1553 1582 V BERGBREITER 2002 3345 3384 D BERGBREITER 2009 530 582 D LU 2009 815 838 J DICKERSON 2002 3325 3344 T VANDECOEVERING 2005 474 490 R ASTRUC 2001 2991 3023 D CROOKS 2000 181 190 R VANHEERBEEK 2002 3717 3756 R SABLONG 2003 333 336 R LIU 2013 72 82 P IKEGAMI 2009 583 593 S AKIYAMA 2001 3469 3471 R AKIYAMA 2003 3412 3413 R OKAMOTO 2005 2125 2135 K BIFFIS 2003 1551 1555 A CAPORUSSO 2005 1 13 A UOZUMI 2003 194 197 Y CHO 2006 6276 6277 J GLEGOLA 2006 1728 1733 K OGASAWARA 2010 4608 4613 S RAMARO 2002 1132 1133 C LEY 2002 1134 1135 S SARKAR 2011 9437 9441 S YAMADA 2012 3190 3198 Y LIU 2013 15469 15478 P HASELL 2010 557 564 T ZHANG 2011 5243 5249 P LI 2012 3390 3395 B PRICE 2005 1714 1716 K INADA 2000 8661 8664 K GROPPO 2010 2297 2308 E SCHWEIZER 2007 3777 3780 S WEN 2008 2144 2150 F YU 2011 3592 3594 Y LIU 2010 65 69 G WANG 2011 1587 1591 Y WANG 2009 1923 1931 Y SIVUDU 2008 10 17 K CRAVOTTO 2012 1304 1307 G MARTINA 2011 60 64 K DONG 2014 Z JOHNSON 1995 6414 6415 L DONG 2012 5020 5031 Z YU 2004 101 110 K YE 2013 6235 6255 Z DONG 2012 286 301 Z YE 2010 319 332 Z ZHANG 2007 2185 2191 K WANG 2008 2290 2293 J ZHANG 2008 1178 1180 Y ZHANG 2008 6331 6338 Y XU 2010 8026 8038 Y ZHANG 2012 7940 7942 Z XU 2013 8800 8802 L LANDRY 2013 1493 1498 E LAPOINTE 1998 1530 1537 A HUBER 2006 6314 6317 J HUBER 2010 8718 8723 J MACQUARRIE 2010 57 64 S BENDAVID 1992 1995 1996 Y PORTNOY 1993 4734 4735 M PORTNOY 1993 1665 1673 M PORTNOY 1994 3465 3479 M GRASA 2001 1077 1080 G GRASA 2003 269 279 G YAMADA 2014 127 131 Y GE 2012 12837 12841 S MOLANDER 2003 4302 4314 G KUDO 2006 1282 1284 N BILLINGSLEY 2006 3484 3488 K BILLINGSLEY 2007 3358 3366 K MOLANDER 2009 973 980 G KINZEL 2010 14073 14075 T DUFERT 2013 12877 12885 M NOEL 2011 5180 5183 T FLECKENSTEIN 2008 3236 3244 C GURAM 2006 1787 1789 A GURAM 2007 5104 5112 A KIM 2002 7642 7643 S KITAMURA 2007 5069 5071 Y KITAMURA 2010 718 730 Y LEE 2009 2912 2920 D LEE 2010 2024 2029 D LITTKE 2002 4176 4211 A TSUKAMOTO 2004 1200 1201 H MANABE 2005 1499 1503 K OHMIYA 2010 879 889 H OHMIYA 2008 17276 17277 H UOZUMI 1999 3384 3388 Y PHAN 2006 609 679 N ZHAO 2000 479 483 F KOHLER 2002 622 631 K BERGBREITER 2005 172 184 D DAVIES 2001 10139 10140 I BROADWATER 2006 2131 2134 S DONGX2015X61 DONGX2015X61X71 DONGX2015X61XZ DONGX2015X61X71XZ item S0926-860X(14)00621-8 S0926860X14006218 1-s2.0-S0926860X14006218 10.1016/j.apcata.2014.10.009 271346 2024-01-01T12:30:29.635264Z 2015-01-01 2015-01-31 1-s2.0-S0926860X14006218-main.pdf https://s3.amazonaws.com/prod-ucs-content-store-us-east/content/pii:S0926860X14006218/MAIN/application/pdf/46e27900880cf1c4b46eef1d0b2e8f4a/main.pdf main.pdf pdf true 1813868 MAIN 11 1-s2.0-S0926860X14006218-main_1.png https://s3.amazonaws.com/prod-ucs-content-store-us-east/content/pii:S0926860X14006218/PREVIEW/image/png/9e3207fb5b80812887cca169fd9e8815/main_1.png main_1.png png 57436 849 656 IMAGE-WEB-PDF 1 1-s2.0-S0926860X14006218-fx1.sml https://s3.amazonaws.com/prod-ucs-content-store-us-east/content/pii:S0926860X14006218/fx1/THUMBNAIL/image/gif/294ea3827c77d94cb33a4cd38c760c93/fx1.sml fx1 true fx1.sml sml 8983 91 219 IMAGE-THUMBNAIL 1-s2.0-S0926860X14006218-fx10.sml https://s3.amazonaws.com/prod-ucs-content-store-us-east/content/pii:S0926860X14006218/fx10/THUMBNAIL/image/gif/a3a3a1526f3429b1a276013580c9d90c/fx10.sml fx10 fx10.sml sml 3201 72 219 IMAGE-THUMBNAIL 1-s2.0-S0926860X14006218-fx11.sml https://s3.amazonaws.com/prod-ucs-content-store-us-east/content/pii:S0926860X14006218/fx11/THUMBNAIL/image/gif/26a64c50f4e85d48a92d6de3fa5f4e54/fx11.sml fx11 fx11.sml sml 2594 81 219 IMAGE-THUMBNAIL 1-s2.0-S0926860X14006218-fx12.sml https://s3.amazonaws.com/prod-ucs-content-store-us-east/content/pii:S0926860X14006218/fx12/THUMBNAIL/image/gif/31cf53e7fa4696a10fa659abb4b57a39/fx12.sml fx12 fx12.sml sml 4272 124 219 IMAGE-THUMBNAIL 1-s2.0-S0926860X14006218-fx13.sml https://s3.amazonaws.com/prod-ucs-content-store-us-east/content/pii:S0926860X14006218/fx13/THUMBNAIL/image/gif/92afb9c30c1b8966d0bd3a417830fafb/fx13.sml fx13 fx13.sml sml 3043 79 219 IMAGE-THUMBNAIL 1-s2.0-S0926860X14006218-fx2.sml https://s3.amazonaws.com/prod-ucs-content-store-us-east/content/pii:S0926860X14006218/fx2/THUMBNAIL/image/gif/69699e5cccb28c423ecb425be25d0ea7/fx2.sml fx2 fx2.sml sml 1548 21 219 IMAGE-THUMBNAIL 1-s2.0-S0926860X14006218-fx3.sml https://s3.amazonaws.com/prod-ucs-content-store-us-east/content/pii:S0926860X14006218/fx3/THUMBNAIL/image/gif/a78480dc01e27e205c3dfca871f5d2ba/fx3.sml fx3 fx3.sml sml 1853 19 219 IMAGE-THUMBNAIL 1-s2.0-S0926860X14006218-fx4.sml https://s3.amazonaws.com/prod-ucs-content-store-us-east/content/pii:S0926860X14006218/fx4/THUMBNAIL/image/gif/047fe4e7c7260e9f8cb70666745fada1/fx4.sml fx4 fx4.sml sml 1837 31 219 IMAGE-THUMBNAIL 1-s2.0-S0926860X14006218-fx5.sml https://s3.amazonaws.com/prod-ucs-content-store-us-east/content/pii:S0926860X14006218/fx5/THUMBNAIL/image/gif/6f8c2089fd89e9f9bf83fb852fb94fc8/fx5.sml fx5 fx5.sml sml 3085 105 219 IMAGE-THUMBNAIL 1-s2.0-S0926860X14006218-fx6.sml https://s3.amazonaws.com/prod-ucs-content-store-us-east/content/pii:S0926860X14006218/fx6/THUMBNAIL/image/gif/ffafe600c9de0769a8fef7cbae48e082/fx6.sml fx6 fx6.sml sml 3112 69 219 IMAGE-THUMBNAIL 1-s2.0-S0926860X14006218-fx7.sml https://s3.amazonaws.com/prod-ucs-content-store-us-east/content/pii:S0926860X14006218/fx7/THUMBNAIL/image/gif/83c8772ebbcb3e480baebb757b0a8f82/fx7.sml fx7 fx7.sml sml 3108 73 219 IMAGE-THUMBNAIL 1-s2.0-S0926860X14006218-fx8.sml https://s3.amazonaws.com/prod-ucs-content-store-us-east/content/pii:S0926860X14006218/fx8/THUMBNAIL/image/gif/e2ae53861b75d44cd54012e10d3c1426/fx8.sml fx8 fx8.sml sml 2910 100 219 IMAGE-THUMBNAIL 1-s2.0-S0926860X14006218-fx9.sml https://s3.amazonaws.com/prod-ucs-content-store-us-east/content/pii:S0926860X14006218/fx9/THUMBNAIL/image/gif/2cd3d764f057de07ef0312458aca8524/fx9.sml fx9 fx9.sml sml 3413 85 219 IMAGE-THUMBNAIL 1-s2.0-S0926860X14006218-gr1.sml https://s3.amazonaws.com/prod-ucs-content-store-us-east/content/pii:S0926860X14006218/gr1/THUMBNAIL/image/gif/638d7115a69fbb57ebf8a259c4241585/gr1.sml gr1 gr1.sml sml 16077 91 219 IMAGE-THUMBNAIL 1-s2.0-S0926860X14006218-gr2.sml https://s3.amazonaws.com/prod-ucs-content-store-us-east/content/pii:S0926860X14006218/gr2/THUMBNAIL/image/gif/6dea57d6f82ef3791720af8164641ff2/gr2.sml gr2 gr2.sml sml 9343 142 219 IMAGE-THUMBNAIL 1-s2.0-S0926860X14006218-gr3.sml https://s3.amazonaws.com/prod-ucs-content-store-us-east/content/pii:S0926860X14006218/gr3/THUMBNAIL/image/gif/5ee1ac2c8d327ccb4e7170e2d29770f1/gr3.sml gr3 gr3.sml sml 7871 136 219 IMAGE-THUMBNAIL 1-s2.0-S0926860X14006218-gr4.sml https://s3.amazonaws.com/prod-ucs-content-store-us-east/content/pii:S0926860X14006218/gr4/THUMBNAIL/image/gif/d869eaaffd4b7ff3e97ead580deaaf76/gr4.sml gr4 gr4.sml sml 6068 164 211 IMAGE-THUMBNAIL 1-s2.0-S0926860X14006218-gr5.sml https://s3.amazonaws.com/prod-ucs-content-store-us-east/content/pii:S0926860X14006218/gr5/THUMBNAIL/image/gif/1359cdff51637668a47b0366323306b0/gr5.sml gr5 gr5.sml sml 4716 162 219 IMAGE-THUMBNAIL 1-s2.0-S0926860X14006218-sc1.sml https://s3.amazonaws.com/prod-ucs-content-store-us-east/content/pii:S0926860X14006218/sc1/THUMBNAIL/image/gif/d0aa0c96e578bd2470afa2a4f9a1a706/sc1.sml sc1 sc1.sml sml 8647 150 219 IMAGE-THUMBNAIL 1-s2.0-S0926860X14006218-sc2.sml https://s3.amazonaws.com/prod-ucs-content-store-us-east/content/pii:S0926860X14006218/sc2/THUMBNAIL/image/gif/19e5ffe9ff787402773d6233fa186a50/sc2.sml sc2 sc2.sml sml 11748 104 219 IMAGE-THUMBNAIL 1-s2.0-S0926860X14006218-fx1.jpg https://s3.amazonaws.com/prod-ucs-content-store-us-east/content/pii:S0926860X14006218/fx1/DOWNSAMPLED/image/jpeg/2bb6f6e9cde6ffb044b2e2c5e96a058c/fx1.jpg fx1 true fx1.jpg jpg 38623 200 480 IMAGE-DOWNSAMPLED 1-s2.0-S0926860X14006218-fx10.jpg https://s3.amazonaws.com/prod-ucs-content-store-us-east/content/pii:S0926860X14006218/fx10/DOWNSAMPLED/image/jpeg/c64b9d09b78894e0818c918d782634c4/fx10.jpg fx10 fx10.jpg jpg 1327 26 78 IMAGE-DOWNSAMPLED 1-s2.0-S0926860X14006218-fx11.jpg https://s3.amazonaws.com/prod-ucs-content-store-us-east/content/pii:S0926860X14006218/fx11/DOWNSAMPLED/image/jpeg/e17f3858ae2c2c7d7a4ac4314546a07a/fx11.jpg fx11 fx11.jpg jpg 1305 32 87 IMAGE-DOWNSAMPLED 1-s2.0-S0926860X14006218-fx12.jpg https://s3.amazonaws.com/prod-ucs-content-store-us-east/content/pii:S0926860X14006218/fx12/DOWNSAMPLED/image/jpeg/04c67de810b4a2872bbe6431929e3a67/fx12.jpg fx12 fx12.jpg jpg 3003 66 117 IMAGE-DOWNSAMPLED 1-s2.0-S0926860X14006218-fx13.jpg https://s3.amazonaws.com/prod-ucs-content-store-us-east/content/pii:S0926860X14006218/fx13/DOWNSAMPLED/image/jpeg/24971cc862b3c207e44fc47a8027c2bb/fx13.jpg fx13 fx13.jpg jpg 1241 28 77 IMAGE-DOWNSAMPLED 1-s2.0-S0926860X14006218-fx2.jpg https://s3.amazonaws.com/prod-ucs-content-store-us-east/content/pii:S0926860X14006218/fx2/DOWNSAMPLED/image/jpeg/e902ffbc34109397370b557d3ff177f4/fx2.jpg fx2 fx2.jpg jpg 4048 31 318 IMAGE-DOWNSAMPLED 1-s2.0-S0926860X14006218-fx3.jpg https://s3.amazonaws.com/prod-ucs-content-store-us-east/content/pii:S0926860X14006218/fx3/DOWNSAMPLED/image/jpeg/573ebbcd01f35969c296b02e2b83ae49/fx3.jpg fx3 fx3.jpg jpg 5755 32 367 IMAGE-DOWNSAMPLED 1-s2.0-S0926860X14006218-fx4.jpg https://s3.amazonaws.com/prod-ucs-content-store-us-east/content/pii:S0926860X14006218/fx4/DOWNSAMPLED/image/jpeg/1a99faa3b933d044061801def578c4b5/fx4.jpg fx4 fx4.jpg jpg 5023 46 329 IMAGE-DOWNSAMPLED 1-s2.0-S0926860X14006218-fx5.jpg https://s3.amazonaws.com/prod-ucs-content-store-us-east/content/pii:S0926860X14006218/fx5/DOWNSAMPLED/image/jpeg/7433e071482b60b130146fae31447080/fx5.jpg fx5 fx5.jpg jpg 1358 39 81 IMAGE-DOWNSAMPLED 1-s2.0-S0926860X14006218-fx6.jpg https://s3.amazonaws.com/prod-ucs-content-store-us-east/content/pii:S0926860X14006218/fx6/DOWNSAMPLED/image/jpeg/36c23d7b5882cd6848f159dbb12ad38f/fx6.jpg fx6 fx6.jpg jpg 1529 29 92 IMAGE-DOWNSAMPLED 1-s2.0-S0926860X14006218-fx7.jpg https://s3.amazonaws.com/prod-ucs-content-store-us-east/content/pii:S0926860X14006218/fx7/DOWNSAMPLED/image/jpeg/a0325e955965d471cfc89bd9c8f9d56c/fx7.jpg fx7 fx7.jpg jpg 1409 27 80 IMAGE-DOWNSAMPLED 1-s2.0-S0926860X14006218-fx8.jpg https://s3.amazonaws.com/prod-ucs-content-store-us-east/content/pii:S0926860X14006218/fx8/DOWNSAMPLED/image/jpeg/17256403fac8d40dee2109cd5e95bc05/fx8.jpg fx8 fx8.jpg jpg 1374 39 85 IMAGE-DOWNSAMPLED 1-s2.0-S0926860X14006218-fx9.jpg https://s3.amazonaws.com/prod-ucs-content-store-us-east/content/pii:S0926860X14006218/fx9/DOWNSAMPLED/image/jpeg/bdbea0e3f98499bb4977acf0ca730b60/fx9.jpg fx9 fx9.jpg jpg 1410 32 82 IMAGE-DOWNSAMPLED 1-s2.0-S0926860X14006218-gr1.jpg https://s3.amazonaws.com/prod-ucs-content-store-us-east/content/pii:S0926860X14006218/gr1/DOWNSAMPLED/image/jpeg/bfa9d2ede1f707b8bc3eee42f180a04c/gr1.jpg gr1 gr1.jpg jpg 62427 275 662 IMAGE-DOWNSAMPLED 1-s2.0-S0926860X14006218-gr2.jpg https://s3.amazonaws.com/prod-ucs-content-store-us-east/content/pii:S0926860X14006218/gr2/DOWNSAMPLED/image/jpeg/6e5378f32f9df5a3a4f3bf6060a92383/gr2.jpg gr2 gr2.jpg jpg 18951 183 282 IMAGE-DOWNSAMPLED 1-s2.0-S0926860X14006218-gr3.jpg https://s3.amazonaws.com/prod-ucs-content-store-us-east/content/pii:S0926860X14006218/gr3/DOWNSAMPLED/image/jpeg/2ec03569a7eafd35974d6701c1b8142b/gr3.jpg gr3 gr3.jpg jpg 19800 210 338 IMAGE-DOWNSAMPLED 1-s2.0-S0926860X14006218-gr4.jpg https://s3.amazonaws.com/prod-ucs-content-store-us-east/content/pii:S0926860X14006218/gr4/DOWNSAMPLED/image/jpeg/58b08336d71339979b059215218aa773/gr4.jpg gr4 gr4.jpg jpg 12634 219 282 IMAGE-DOWNSAMPLED 1-s2.0-S0926860X14006218-gr5.jpg https://s3.amazonaws.com/prod-ucs-content-store-us-east/content/pii:S0926860X14006218/gr5/DOWNSAMPLED/image/jpeg/71cd9839712b89624533f6b33f6d24bd/gr5.jpg gr5 gr5.jpg jpg 12881 226 305 IMAGE-DOWNSAMPLED 1-s2.0-S0926860X14006218-sc1.jpg https://s3.amazonaws.com/prod-ucs-content-store-us-east/content/pii:S0926860X14006218/sc1/DOWNSAMPLED/image/jpeg/58be7e94f53fc183d0b921091e7939fe/sc1.jpg sc1 sc1.jpg jpg 24191 263 383 IMAGE-DOWNSAMPLED 1-s2.0-S0926860X14006218-sc2.jpg https://s3.amazonaws.com/prod-ucs-content-store-us-east/content/pii:S0926860X14006218/sc2/DOWNSAMPLED/image/jpeg/f8e67df94eccaddfbf89f13f7d71e442/sc2.jpg sc2 sc2.jpg jpg 43707 286 602 IMAGE-DOWNSAMPLED 1-s2.0-S0926860X14006218-fx1_lrg.jpg https://s3.amazonaws.com/prod-ucs-content-store-us-east/content/pii:S0926860X14006218/fx1/HIGHRES/image/jpeg/d45f460bc04374a1e207efcbcaab8ed8/fx1_lrg.jpg fx1 true fx1_lrg.jpg jpg 258766 886 2124 IMAGE-HIGH-RES 1-s2.0-S0926860X14006218-fx10_lrg.jpg https://s3.amazonaws.com/prod-ucs-content-store-us-east/content/pii:S0926860X14006218/fx10/HIGHRES/image/jpeg/e5bd4fd24588bc80bfb42a57946a7f45/fx10_lrg.jpg fx10 fx10_lrg.jpg jpg 8282 114 346 IMAGE-HIGH-RES 1-s2.0-S0926860X14006218-fx11_lrg.jpg https://s3.amazonaws.com/prod-ucs-content-store-us-east/content/pii:S0926860X14006218/fx11/HIGHRES/image/jpeg/13631f2798f70aaf7678bec639e705a2/fx11_lrg.jpg fx11 fx11_lrg.jpg jpg 7302 142 385 IMAGE-HIGH-RES 1-s2.0-S0926860X14006218-fx12_lrg.jpg https://s3.amazonaws.com/prod-ucs-content-store-us-east/content/pii:S0926860X14006218/fx12/HIGHRES/image/jpeg/02806785071a4ac80ef72530dd6bd19b/fx12_lrg.jpg fx12 fx12_lrg.jpg jpg 19970 295 522 IMAGE-HIGH-RES 1-s2.0-S0926860X14006218-fx13_lrg.jpg https://s3.amazonaws.com/prod-ucs-content-store-us-east/content/pii:S0926860X14006218/fx13/HIGHRES/image/jpeg/94ef0bf4c0d1252713899087d66c500e/fx13_lrg.jpg fx13 fx13_lrg.jpg jpg 7300 124 344 IMAGE-HIGH-RES 1-s2.0-S0926860X14006218-fx2_lrg.jpg https://s3.amazonaws.com/prod-ucs-content-store-us-east/content/pii:S0926860X14006218/fx2/HIGHRES/image/jpeg/58e038a374098923116905418e8663ca/fx2_lrg.jpg fx2 fx2_lrg.jpg jpg 27391 136 1411 IMAGE-HIGH-RES 1-s2.0-S0926860X14006218-fx3_lrg.jpg https://s3.amazonaws.com/prod-ucs-content-store-us-east/content/pii:S0926860X14006218/fx3/HIGHRES/image/jpeg/56e664e55f3fdf2b32ed5ad24f909e59/fx3_lrg.jpg fx3 fx3_lrg.jpg jpg 42171 143 1628 IMAGE-HIGH-RES 1-s2.0-S0926860X14006218-fx4_lrg.jpg https://s3.amazonaws.com/prod-ucs-content-store-us-east/content/pii:S0926860X14006218/fx4/HIGHRES/image/jpeg/fc297d414a5b60c9b2cb1120114172e0/fx4_lrg.jpg fx4 fx4_lrg.jpg jpg 35028 204 1456 IMAGE-HIGH-RES 1-s2.0-S0926860X14006218-fx5_lrg.jpg https://s3.amazonaws.com/prod-ucs-content-store-us-east/content/pii:S0926860X14006218/fx5/HIGHRES/image/jpeg/15afa11791d352bab03677fbe0ebfa12/fx5_lrg.jpg fx5 fx5_lrg.jpg jpg 7817 172 360 IMAGE-HIGH-RES 1-s2.0-S0926860X14006218-fx6_lrg.jpg https://s3.amazonaws.com/prod-ucs-content-store-us-east/content/pii:S0926860X14006218/fx6/HIGHRES/image/jpeg/6a791517e110678a6877af1640dbb997/fx6_lrg.jpg fx6 fx6_lrg.jpg jpg 9646 128 409 IMAGE-HIGH-RES 1-s2.0-S0926860X14006218-fx7_lrg.jpg https://s3.amazonaws.com/prod-ucs-content-store-us-east/content/pii:S0926860X14006218/fx7/HIGHRES/image/jpeg/25dcec5bb73151c5cc964f141b6f2822/fx7_lrg.jpg fx7 fx7_lrg.jpg jpg 8427 118 355 IMAGE-HIGH-RES 1-s2.0-S0926860X14006218-fx8_lrg.jpg https://s3.amazonaws.com/prod-ucs-content-store-us-east/content/pii:S0926860X14006218/fx8/HIGHRES/image/jpeg/e43caf61ce3fafc123af758adc2d565a/fx8_lrg.jpg fx8 fx8_lrg.jpg jpg 8164 172 378 IMAGE-HIGH-RES 1-s2.0-S0926860X14006218-fx9_lrg.jpg https://s3.amazonaws.com/prod-ucs-content-store-us-east/content/pii:S0926860X14006218/fx9/HIGHRES/image/jpeg/5ad6f3a31dc09cdb6d9f6078c45f5a9b/fx9_lrg.jpg fx9 fx9_lrg.jpg jpg 8899 141 363 IMAGE-HIGH-RES 1-s2.0-S0926860X14006218-gr1_lrg.jpg https://s3.amazonaws.com/prod-ucs-content-store-us-east/content/pii:S0926860X14006218/gr1/HIGHRES/image/jpeg/18b198314a2186f9b8cd94e84a29b6dd/gr1_lrg.jpg gr1 gr1_lrg.jpg jpg 266271 730 1758 IMAGE-HIGH-RES 1-s2.0-S0926860X14006218-gr2_lrg.jpg https://s3.amazonaws.com/prod-ucs-content-store-us-east/content/pii:S0926860X14006218/gr2/HIGHRES/image/jpeg/60e93cdd92e7a5f947165b45243db58a/gr2_lrg.jpg gr2 gr2_lrg.jpg jpg 138110 811 1250 IMAGE-HIGH-RES 1-s2.0-S0926860X14006218-gr3_lrg.jpg https://s3.amazonaws.com/prod-ucs-content-store-us-east/content/pii:S0926860X14006218/gr3/HIGHRES/image/jpeg/312b8f22da24e4ee2a1745d3b8ea21a6/gr3_lrg.jpg gr3 gr3_lrg.jpg jpg 135739 931 1497 IMAGE-HIGH-RES 1-s2.0-S0926860X14006218-gr4_lrg.jpg https://s3.amazonaws.com/prod-ucs-content-store-us-east/content/pii:S0926860X14006218/gr4/HIGHRES/image/jpeg/bf1d3aa54542ecabb51dd43cc19fbe5e/gr4_lrg.jpg gr4 gr4_lrg.jpg jpg 83603 970 1250 IMAGE-HIGH-RES 1-s2.0-S0926860X14006218-gr5_lrg.jpg https://s3.amazonaws.com/prod-ucs-content-store-us-east/content/pii:S0926860X14006218/gr5/HIGHRES/image/jpeg/38b483c1d064258d5728ccd397bb6ed3/gr5_lrg.jpg gr5 gr5_lrg.jpg jpg 83583 1001 1353 IMAGE-HIGH-RES 1-s2.0-S0926860X14006218-sc1_lrg.jpg https://s3.amazonaws.com/prod-ucs-content-store-us-east/content/pii:S0926860X14006218/sc1/HIGHRES/image/jpeg/25d275a581b5b5637dd4c79a53f3f8f0/sc1_lrg.jpg sc1 sc1_lrg.jpg jpg 200548 1164 1696 IMAGE-HIGH-RES 1-s2.0-S0926860X14006218-sc2_lrg.jpg https://s3.amazonaws.com/prod-ucs-content-store-us-east/content/pii:S0926860X14006218/sc2/HIGHRES/image/jpeg/fe9e252a9d25c66d2e42e11a8e4352bd/sc2_lrg.jpg sc2 sc2_lrg.jpg jpg 266235 1265 2667 IMAGE-HIGH-RES APCATA 15040 S0926-860X(14)00621-8 10.1016/j.apcata.2014.10.009 Elsevier B.V. Fig. 1 TEM image of HBPPA-Pd-2 (a) and XPS Pd 3d spectra of HBPPA-Pd-1 and HBPPA-Pd-2 (b). Fig. 2 Mizoroki–Heck reaction between PhI and BA catalyzed with various heterogeneous catalysts. Reaction conditions: [PhI]=0.6mol/L, [PhI]:[BA]:[Et3N]=1:1.3:1.5, Pd loading relative to PhI=100molppm, DMF as solvent at 100°C. Fig. 3 PhBr conversion and percentage of leached Pd in the reusability test of HBPPA-Pd-2 in the Suzuki–Miyaura reaction between PhBr and PBA. Other reaction conditions: [PhBr]=0.6mol/L, [PhBr]:[PBA]:[K2CO3]=1:1.3:1.5, Pd loading relative to PhBr=0.1mol%. Fig. 4 Conversion curves of the Suzuki–Miyaura reaction between PhBr and PBA involving hot filtration and the control run without hot filtration. Reaction conditions: [PhBr]=0.6mol/L, [PhBr]:[PBA]:[K2CO3]=1:1.3:1.5, Pd loading relative to [PhBr]=0.1mol%, water as solvent at 100°C. Fig. 5 Conversion plots of homogeneous (COMePhI) and heterogeneous (Si-PhI) aryl iodides in the 3-phase test. Reaction conditions: [ArI]=0.6mol/L, [ArI]:[BA]:[Et3N]=1:1.3:1.5, Pd loading relative to [ArI]=0.1mol%, DMF as solvent at 100°C. Scheme 1 Synthesis of heterogeneous Pd catalysts (HBPPA-Pd) containing different Pd complexes by Pd-catalyzed cross-linking of HBPPA. Scheme 2 Synthesis of heterogeneous Si-ArI and its possible reaction in 3-phase test. Table 1 Heterogeneous Pd catalysts by Pd-catalyzed cross-linking of HBPPA. a Heterogeneous Pd catalyst Catalyst for cross-linking [alkyne]/[Pd] yield% b Pdenc% c Pd% c HBPPA-Pd-1 L1-Pd 4.4 93 75 2.6 HBPPA-Pd-2 L1-Pd 8.8 96 97 1.9 HBPPA-Pd-3 L1-Pd 26 98 97 0.6 HBPPA-Pd-4 L2-Pd 8.8 77 68 1.7 HBPPA-Pd-5 L3-Pd 8.8 88 92 1.9 a Other conditions: [alkyne]=0.14M (HBPPA: 0.52g), CH2Cl2/MeOH (v/v=10:1) as solvent (5.5mL), reaction at room temperature. L1-Pd:Pd(OAc)2/triphenylphosphine (L1) at the [Pd]/[L1] ratio of 1: 6; L2-Pd: Pd(OAc)2/diphosphine (L2) at the [Pd]:[L2] ratio of=1: 3; L3-Pd: acetonitrile Pd–diimine catalyst. b Yield of the heterogeneous catalyst calculated on the basis of weight relative to HBPPA. c Percentage of encapsulated Pd relative to the feed Pd(Pdenc%) and weight content of Pd in the heterogeneous catalysts (Pd%) were determined via atom absorption analysis of each heterogeneous catalyst. Table 2 Mizoroki–Heck reactions carried out with the various heterogeneous catalysts. a Run Cat. R1 X R2 Pd% b (molppm) t (h) conv. c (%) TON (×103) TOF (×103 h−1) H1 HBPPA-Pd-1 H I CO2Bu 100 5 >99 10 2 H2 HBPPA-Pd-2 H I CO2Bu 100 4 >99 10 2.5 H3 HBPPA-Pd-3 H I CO2Bu 100 6 >99 10 1.7 H4 HBPPA-Pd-4 H I CO2Bu 100 24 94 9.4 0.4 H5 HBPPA-Pd-5 H I CO2Bu 100 20 >99 10 0.5 H6 HBPPA-Pd-2 H I CO2Bu 10 48 86 86 1.8 H7 HBPPA-Pd-2 COMe Br CO2Bu 100 20 >99 10 0.5 H8 HBPPA-Pd-2 COMe Br CO2Bu 50 24 93 19 0.8 H9 HBPPA-Pd-2 COMe Br St 100 24 94 9.4 0.4 H10 HBPPA-Pd-2 CN Br CO2Bu 100 20 >99 10 0.5 H11 HBPPA-Pd-2 H Br CO2Bu 100 24 >99 10 0.4 H12 HBPPA-Pd-2 Me Br CO2Bu 100 24 23 2.3 0.1 H13 HBPPA-Pd-2 OMe Br CO2Bu 100 24 17 1.7 0.07 a Other reaction conditions: [ArX]:[alkene]:[base]=1:1.3:1.5; [ArX]=0.6mmol/mL, DMF (4mL) as the solvent for all reactions; in the reactions between PhI and BA (H1–H6), Et3N was the base and reaction temperature was 100°C; in the reactions (H7–H13) with aryl bomides, K2CO3 was the base and reaction temperature was 130°C. b Pd molar loading relative to ArX. c Conversion of ArX determined with 1H NMR spectroscopy. Table 3 Suzuki–Miyaura reactions catalyzed with HBPPA-Pd-2. a Run R1 X R2 Pd% b (molppm) t (h) conv. c (%) TON (×103) TOF (×103 h−1) S1 H Br H 10 4 >99 100 25 S2 H Br H 1 10 >99 1000 100 S3 H Br H 0.3 17 96 3200 187 S4 4-COMe Br H 10 1 >99 100 100 S5 4-CN Br H 10 1 >99 100 100 S6 4-Me Br H 10 8 >99 100 13 S7 3-Me Br H 10 8 >99 100 13 S8 2-Me Br H 10 10 90 90 9 S9 4-OMe Br H 10 8 95 95 12 S10 1-bromonaphthalene d Br H 50 8 93 47 5.8 S11 2-bromomesitylene e Br H 50 24 85 43 1.8 S12 H Br OMe 10 4 >99 100 25 S13 H Br COMe 10 4 >99 100 25 S14 4-Me Br OMe 10 6 88 88 15 S15 4-Me Br COMe 10 8 >99 100 13 S16 2-bromopyridine f Br H 5000 24 96 0.19 0.01 S17 2-bromothianaphthene g Br H 5000 20 >99 0.2 0.01 S18 4-COMe Cl H 1000 8 >99 1 0.13 S19 CN Cl H 1000 8 >99 1 0.13 S20 H Cl H 1000 20 >99 1 0.05 S21 4-Me Cl H 1000 24 >99 1 0.04 S22 4-OMe Cl H 1000 28 >99 1 0.04 a Other reaction conditions: [ArX]:[R2-PBA]:[base]=1: 1.3: 1.5; T =100°C; in the reactions with ArBrs (S1–S15), [ArBr]=0.6mmol/mL, K2CO3 was the base and water was the solvent; in the reactions with heteroaryl bromides (S16 and S17), [ArBr]=0.6mmol/mL, K3PO4 was the base and water/ethanol (v/v=2:1) was the solvent; in the reactions with ArCls (S18–22), [ArCl]=0.4mol/L, CsF was the base, water was the solvent along with TBAB as phase transfer agent at [TBAB]:[ArX]=1:1. b Pd molar loading relative to ArX. c Conversion of ArX determined with 1H NMR spectroscopy. d 1-Bromonaphthalene was used as the reactant. e 2-Bromomesitylene was used as the reactant. f 2-Bromopyridine was used as the reactant. g 2-Bromothianaphthene was used as the reactant. Table 4 Allylic arylation reactions catalyzed with HBPPA-Pd-2 a . Run A B Pd% (mol ppm) C Time (h) Conv. b (%) TON (×103) TOF (×103 h−1) A1 50 6 >99 20 3.3 A2 10 24 >99 100 4.2 A3 1 48 64 640 13 A4 50 8 >99 20 2.5 A5 10 24 >99 100 4.2 A6 50 24 >99 20 0.83 A7 50 24 90 18 0.75 a Other reaction conditions: for all reactions, the solvent was water/DMF mixture (v/v=1:1; total 1mL); T=100°C; [allylic acetate (A)]=0.6mmol/mL; for reactions with NaBPh4, [A]:[NaBPh4]=1:1.3; for reactions with PBA, KF was used as base, [A]:[PBA]:[KF]=1:1.3:1.5. b Conversion of allylic acetate determined with 1H NMR spectroscopy. Heterogeneous palladium catalyst constructed with cross-linked hyperbranched poly(phenylacetylene) as polymer support: A reusable highly active ppm-level catalyst for multiple cross-coupling reactions Zhongmin Dong Zhibin Ye ⁎ Bharti School of Engineering, Laurentian University, Sudbury, Ontario P3E 2C6, Canada Bharti School of Engineering, Laurentian University Sudbury Ontario P3E 2C6 Canada ⁎ Corresponding author. Tel.: +1 705 675 1151 2343; fax: +1 705 675 4862. Graphical abstract We demonstrate in this work a unique strategy for the synthesis of heterogeneous Pd catalysts with the use of a hyperbranched poly(phenylacetylene) containing pendant alkyne groups as the cross-linkable polymer substrate. It utilizes the dual functions of Pd-based catalysts in catalyzing both alkyne polymerization/oligomerization and coupling reactions. In the synthesis, a homogeneous Pd(II) catalyst catalyzes the cross-linking of the hyperbranched polymer and simultaneously encapsulates itself into the cross-linked polymer matrix, rendering the heterogeneous catalyst at high yield and high percentage of Pd encapsulation. Three homogeneous catalysts having different ligands (triphenylphosphine, a diphosphine ligand, and a diimine ligand) have been examined for the cross-linking encapsulation and the resulting heterogeneous catalysts have been evaluated for their catalytic performance in coupling reactions. Among the various heterogeneous catalysts obtained, a triphenylphosphine-ligated catalyst, HBPPA-Pd-2, appears to be the optimum one. It shows high activity in catalyzing the Suzuki–Miyaura reactions, the Mizoroki–Heck reactions, and the allylic arylation reactions under air with the Pd loading at as low as mol ppm or even mol ppb levels relative to the reactants. Meanwhile, it facilitates the Suzuki–Miyaura reactions of challenging less reactive aryl chlorides/heteroaryl bromides and the Mizoroki–Heck reactions of aryl bromides as reactants. In addition, it behaves truly as a heterogeneous catalyst with high reusability and low catalyst leaching during the reactions. Keywords Heterogeneous Pd catalyst Cross-coupling reactions Hyperbranched polymer Suzuki–Miyaura reactions Mizoroki–Heck reactions Allylic arylation reactions 1 Introduction Palladium-catalyzed carbon–carbon cross-coupling reactions [1–3], including the notable Suzuki–Miyaura [4–7] and Mizoroki–Heck reactions [8–13], have played an important role in modern organic synthesis by enabling many valuable organic transformations. Due to the high cost of Pd as well as environmental and health issues, reusable heterogeneous Pd catalysts have drawn increasing attention for the industrial applications of these coupling reactions since homogeneous Pd catalysts are difficult to recover and reuse. Numerous heterogeneous catalysts have been developed with the use of various organic polymeric and inorganic supports through different catalyst immobilization/encapsulation strategies [14–22]. But the search is continuing for high-performance heterogeneous catalysts of high activity with Pd loading needed at as low as ppm levels, high reusability with minimum/negligible catalyst leaching during reactions, and high versatility with broad applicability to multiple types of coupling reactions and to difficult precursors such as aryl chlorides [23]. Such heterogeneous catalysts of combined performance properties are still limited despite the enormous investigations in the area. Relative to the inorganic supports, organic polymer supports show the advantage in their convenient synthesis and the versatility in tuning their composition/functionality for controllable catalyst immobilization/encapsulation. A great variety of polymers, including both soluble polymers [24–28] with controllable linear [16,19,24–28] or dendritic/hyperbranched architectures [29–33] and insoluble polymers [14–22], have been used as the substrate for the immobilization/encapsulation of various Pd complexes or Pd nanoparticles. With soluble polymer substrates, high catalyst activity can be achieved due to their soluble nature, but at the compromise of relatively higher catalyst leaching and the requirement of special catalyst recovery methods such as biphasic solvent systems and polymer precipitation with proper solvents [24–28]. On the contrary, heterogeneous catalysts on insoluble polymers offer much more convenient catalyst recovery and reuse through simple procedures like filtration. In particular, insoluble cross-linked polymers show the further added advantage of reduced catalyst leaching because the tightly cross-linked 3-dimensional networks minimize the aggregation and leaching of the encapsulated catalyst species. Due to these advantages, various insoluble cross-linked polymers have been developed and used to immobilize/encapsulate Pd nanoparticles and Pd complexes as heterogeneous catalysts [17,18,34]. They include broadly cross-linked amphiphilic copolymer micelles [17,18,35–37], cross-linked polymethacrylates [38,39], cross-linked polystyrene-poly(ethylene glycol) resins [40–42], cross-linked poly(amidoamine) dendrimers [43], polyurea [44,45], self-assembled poly(imidazole) via binding with Pd species [46,47], cross-linked hyperbranched polyethylenes with self-supported Pd nanoparticles [48], cross-linked microporous polymers [49–51], cross-linked reverse micelle [52], cross-linked polystyrenes with different covalently tethered functionalities [53–56], cross-linked ionic copolymers [57–59], hydrogels [60,61], cross-linked chitosan [62,63], cross-linked poly(1,3-diethynylbenzene) [64], etc. The majority of heterogeneous Pd catalysts on cross-linked polymer supports have been synthesized via stepwise procedures comprised of the synthesis of the cross-linked polymers with desired functionalities followed with catalyst immobilization. With this synthetic strategy, the immobilized Pd catalysts are thus bound either covalently or noncovalently on the internal surface of the cross-linked polymer substrates instead of being incorporated within the polymer matrix. This increases the risk of catalyst leaching. Only in some cases [35–37,41,43–48,52,62–64] the Pd catalysts are embedded desirably within the cross-linked polymer matrix wherein Pd encapsulation occurs during or prior to polymer cross-linking in the synthesis. Meanwhile, the majority of the heterogeneous catalysts on cross-linked polymer supports show relatively low activity with a large Pd loading often required to facilitate the coupling reactions, and often have limited applicability to only one or two types of couple reactions. In this article, we report a convenient alternative one-step synthetic strategy that leads to a reusable, high-activity, high-versatility heterogeneous catalyst with Pd species encapsulated within a cross-linked hyperbranched poly(phenylacetylene) (HBPPA) matrix. Different from all other previously reported syntheses, a triphenylphosphine-ligated cationic Pd catalyst is herein used as an alkyne polymerization catalyst to cross-link the hyperbranched poly(phenylacetylene) having pendant alkyne groups. During the cross-linking, the Pd catalytic species are simultaneously embedded within the formed polymer networks, turning themselves uniquely from a homogeneous polymerization catalyst into a heterogeneous cross-coupling catalyst. The heterogeneous catalyst synthesized herein has been found to efficiently catalyze the Suzuki–Miyaura, Mizoroki–Heck, and allylic arylation reactions at the Pd loadings of as low as ppm levels relative to reactants, as well as good reusability with low catalyst leaching during the reactions. 2 Experimental 2.1 Materials All manipulations and reactions were performed under atmospheric conditions unless otherwise noted. In order to avoid the influence of any residual Pd species absorbed on the surface, all the glassware and magnetic stirrers used for cross-coupling reactions were pre-treated with aqua regia, then washed with distilled water before being dried. The acetonitrile Pd-diimine catalyst, [(ArNC(Me)–(Me)CNAr)Pd(CH3) (NCMe)]+SbF6ˉ (Ar=2,6-(iPr)2C6H3), was synthesized according to a literature procedure [65]. HPLC-grade CH2Cl2 (99.5%, Fisher Scientific) was deoxygenated and dried by using a solvent purification system (Innovative Technology) before use. Methanol (ACS reagent, Fisher Scientific) was dried with 3Å/5Å molecular sieves before use. Deionized Water was obtained from a Barnstead/SynbronNanopure II water purification system. A palladium atomic absorption standard solution, containing 1011ppm of Pd in 5.1wt% HCl, was purchased from Aldrich. N,N-dimethylformamide (DMF, certified ACS grade), tetrahydrofuran (THF, certified grade), hydrochloric acid (35–38wt.% in water), KF (granular powder, certified ACS grade) and K2CO3 (granular powder, certified ACS grade) were received from Fisher Scientific and used without further purification. Palladium (II) acetate (Pd(OAc)2, 98%) and α,α’-bis(di-t-butylphosphino)-o-xylene (97%) were obtained from Strem Chemicals and used as received. Mesoporous silica SBA-15 was purchased from Claytec Inc., and was vacuum dried at 160°C for 8h before use. All other chemicals or solvents, including 1-methyl-2-pyrrolidinone (NMP, ReagentPlus), CsF (>99%), 1,3-diethynylbenzene (DEB, 96%), methanesulfonic acid (MSA, 99.5%), triphenyl phosphine (PPh3, 99%), iodobenzene (PhI, 98%), 4’-iodoacetophenone (98%), bromobenzene (PhBr, 99%), 1-bromo-4-nitrobenzene (99%), 4-bromobenzonitrile (99%), 4’-bromoacetophenone (98%), 4-bromoanisole (99%), 4-bromotoluene (98%), 2-bromotoluene (99%), 3-bromotoluene (98%), 2-bromomesitylene (98%), 1-bromonaphthalene (97%), 2-bromopyridine (99%), 3-bromothianaphthene (95%), chlorobenzene (PhCl, ReagentPlus), 4’-chloroacetophenone (97%), 4-chlorotoluene (98%), 4-chloroanisole (99%), 4-chlorobenzonitrile (99%), 4-methoxyphenylboronic acid (≥95%), 4-acetylphenylboronic acid, n-butyl acrylate (BA, >99%), styrene (99%), triethyl amine (Et3N, 99%), phenylboronic acid (PBA, >97%), cinnamyl acetate (99%), prenyl acetate (≥98%), sodium tetraphenylborate (NaBPh4, ACS Reagent), nitric acid (HNO3, 70%), and hydrogen peroxide (H2O2, 50wt.% in water), were all purchased from Aldrich and used as received. 2.2 Measurements and characterizations The characterization of HBPPA with gel permeation chromatography (GPC) was carried out on a Polymer Laboratories PL-GPC220 system equipped with a triple-detection array comprising of a differential refractive index (DRI) detector (from Polymer Laboratories), a three-angle (45, 90, and 135°) light scattering (LS) detector (from Wyatt Technology) at a laser wavelength of 687nm, and a four-bridge capillary viscosity detector (from Polymer Laboratories). Details in the characterization have been reported in our earlier paper [66]. All measurements with proton nuclear magnetic resonance (1H NMR) spectroscopy were carried out on a Bruker AV500 spectrometer (500MHz) at ambient temperature with CDCl3 as solvent. Atomic absorption (AA) spectroscopy was performed on a Perkin Elmer Precisely AAnalyst 400 spectrometer (Perkin Elmer) equipped with a Pd element lamp (max. 30mA, Perkin Elmer). The data was collected with a WinLab32 software (Perkin Elmer). The blank solution for the preparation of the standard Pd solutions and sample dilution was composed of 11.1vol% THF, 6.7vol% HCl, and 3.4vol% H2O2 in deionized water. For all the analyses, a calibration curve was first established with Pd standard solutions with [Pd] in the range of 0.25–10mg/L. X-ray photoelectron spectroscopy (XPS) measurements of the heterogeneous Pd catalysts were carried out on a Thermo Scientific Theta Probe XPS spectrometer (ThermoFisher). A monochromatic Al Kα X-ray source was used, with a spot area 400μm. The samples were run in a standard mode, i.e., all angle collected (60° angular acceptance) for the survey spectra, and for the region spectra. Transition electron microscopy (TEM) images were collected on a JEOL 2010F field emission electron microscope operated at 200keV. 2.3 Synthesis of hyperbranched polyphenylacetylene (HBPPA) The HBPPA containing pendant alkyne groups was synthesized according to our earlier paper [66]. Under N2 protection, Pd(OAc)2 (7.1mg, 32μmol), α,α’-bis(di-t-butylphosphino)-o-xylene (38mg, 96μmol), and methanol (8mL) were mixed in a sealed 20mL glass vial and sonicated at room temperature until all the solids were dissolved to form the catalyst solution. In the meantime, a flame-dried Schlenk flask was charged with PA (1.02g, 10mmol), DEB (0.374g, 3mmol), one drop of methanesulfonic acid (MSA, ca. 0.05mL), and CH2Cl2 (30mL) under nitrogen protection. The flask was shielded with aluminum foil before the catalyst solution was injected. The mixture was stirred under N2 atmosphere for 3h at room temperature. At the completion of the polymerization, the reaction mixture was poured into 2%-acidified methanol (ca. 300mL) to terminate the polymerization and precipitate out the polymer. The orange polymer precipitate underwent a redissolution–precipitation procedure for 3 cycles to remove the catalyst and monomer residues. Finally, the polymer was dried under vacuum at room temperature for 24h and then weighed (0.84g, yield: 60%). Triple-detection GPC characterization: number-average molecular weight, M n =27.2kg/mol; polydispersity index, PDI=1.57 (both measured with light scattering detector); Mark–Houwink exponent, α =0.20. 1H NMR characterization: DEB content in the copolymer, 23mol%; percentage of dual-inserted DEB, 29%; content of the pendent alkyne groups, 41 alkyne group per chain or 1.5mmol/g; branching density, 6.7mol% (number of dual-inserted DEB/the number of all inserted monomer units×100%). 2.4 Synthesis of heterogeneous Pd catalysts with cross-linked HBPPA as polymer support A typical synthetic procedure (for HBPPA-Pd-2 in Table 1 ) is as follows. HBPPA (0.52g, containing 0.9mmol alkyne groups), PPh3 (0.142g, 0.54mmol), Pd(OAc)2 (20mg, 0.09mmol), CH2Cl2 (5mL) and MeOH (0.5mL) were combined in a test tube under N2 protection. Then one drop of MSA (ca. 0.05mL) was added into the system to start the cross-linking reaction. The mixture was stirred at room temperature overnight. Visible brown insoluble precipitates formed gradually during the reaction. At the completion of the reaction, the mixture was filtrated and the insoluble cross-linked polymer gels were washed with excessive DMF then THF to remove any residual soluble catalyst and ligand before being dried at 60°C overnight. Yield: 0.5506g; percentage of Pd encapsulation: 90.8%; Pd content in the heterogeneous catalyst: 1.9wt.% or 0.18mmol Pd/g of catalyst. 2.5 Synthesis of Si-ArI for 3-phase tests A similar procedure used by Jones et al. [67] was employed for the synthesis of heterogeneous mesoporous silica-supported aryl iodide, Si-ArI. An aryl iodide-containing trimethoxysilane compound (1 in Scheme 2) was first synthesized by reacting 4-iodoacetophenone (1.35g, 5.5mmol) and 3-aminopropyltrimethoxylsilane (0.895g, 5mmol) in 20mL dry MeOH under reflux at 75°C for 20h. After being cooled to room temperature, MeOH was evaporated under reduced pressure and the product was extracted with CH2Cl2. The mixture was then concentrated and washed with cold hexane to afford 1. Yield: 1.87g (92%).1H NMR (CDCl3): 0.78 (m, 2H, –CH 2Si), 1.84 [m, 4H,–(CH 2)2CH2Si], 2.07 [s, 3H, NC(Me)], 3,34–3.52 [m, 9H, Si(OMe)3], 7.44–7.63, (m, 4H, ArH). Subsequently, 1 (1.63g, 4mmol) was added into a toluene (20mL) suspension of dry mesoporous silica SBA-15 (1.0g) and the mixture was stirred at 70°C for 24h under N2 protection. After cooling to room temperature, the mixture was filtered and the solid was washed with CH2Cl2 then hexane. After being dried under high vacuum at 80°C overnight, the silica-supported aryl iodide (Si-ArI) was obtained as white powder. Yield: 1.258g. Aryl iodine content (based on TGA analysis): 22wt%. 2.6 Mizoroki–Heck reactions catalyzed with heterogeneous Pd catalysts A typical procedure (for run H7 in Table 2 ) for Mizoroki–Heck reactions of different aryl halides is as follows. The heterogeneous catalyst HBPPA-Pd-2 (0.2mg, containing 0.036μmol of Pd), 4′-bromoacetophenone (72mg, 0.36mmol), n-butyl acrylate (60mg, 0.47mmol), K2CO3 (75mg, 0.54mmol), and DMF (0.6mL) were combined in a clean test tube with a magnetic stirrer. The sealed test tube was immersed into an oil bath set at 130°C and was stirred. The conversion of the reaction was monitored with 1H NMR spectroscopy. At the completion of the reaction, the insoluble salts and heterogeneous catalyst were separated from the organic solution by filtration. Water was used to wash off the inorganic salts and the catalyst was recovered. 2.7 Suzuki–Miyaura reactions catalyzed with HBPPA-Pd-2 A typical procedure (for run S2 in Table 3 ) for the Suzuki–Miyaura reactions of different aryl bromides is as follows. HBPPA-Pd-2 (0.06mg, contain 0.011μmol of Pd), PhBr (1.70g, 11mmol), PBA (1.58g, 13mmol), K2CO3 (2.24g, 16mmol), and water (18mL) were combined in a clean test tube with a magnetic stirrer. The test tube was sealed and placed in an oil base set at 100°C and was stirred until the reaction reached completion. During the reaction, the conversion of PhBr was monitored by 1H NMR spectroscopy. At the completion of the reaction, the mixture was cooled down to room temperature and washed with ethyl acetate 3 times (2mL×3). The insoluble heterogeneous catalyst was recovered by filtration. As for the Suzuki–Miyaura reactions with heteroaryl halides, the following is a typical procedure (for S16 in Table 3). 2-Bromopyridine (0.095g, 0.6mmol), PBA (0.088g, 0.72mmol), HBPPA-Pd-2 (16.5mg, contain 3μmol of Pd), K3PO4 (0.191g, 0.9mmol), and water/ethanol mixture (v/v=2:1, 1mL) were combined in a clean test tube having a magnetic stirring bar. The test tube was sealed and placed in an oil bath set at 100°C. At the completion of the reaction, the mixture was cooled to room temperature and washed with ethyl acetate/water 3 times to extract the organic product. A typical procedure (for run S18 in Table 3) for the Suzuki–Miyaura reactions of PBA with various aryl chlorides is as follows. HBPPA-Pd-2 (3.3mg, contain 0.6μmol of Pd), PBA (0.088g, 0.72mmol), CsF (0.137g, 0.9mmol), and water (1.5mL) were combined in a clean test tube with a magnetic stirrer. The mixture was heated in an oil bath set at 100°C until the solids were dissolved. Then 4′-chloroacetophenone (93mg, 0.6mmol) and tetra-n-butylammonium bromide (0.19g, 0.6mmol) were added to the system. The test tube was sealed and placed in the oil base at 100°C. The reaction was monitored by 1H NMR spectroscopy. At the completion of the reaction, the mixture was cooled down to room temperature and diluted with ethyl acetate (1mL) and water (4mL). The insoluble heterogeneous catalyst was recovered by filtration. 2.8 Allylic arylation reactions catalyzed with HBPPA-Pd-2 A typical procedure (for run A4 in Table 4 ) for the allylic arylation reactions is as follows. HBPPA-Pd-2 (0.15mg, containing 0.027μmol of Pd), cinnamyl acetate (95.2mg, 0.54mmol), PBA (85.5mg, 0.7mmol), KF (47.1mg, 0.81mmol), DMF (0.5mL) and water (0.5mL) were combined in a clean test tube with a magnetic stirrer. The sealed test tube was placed in an oil bath set at 100°C and was stirred for a predetermined reaction time. The conversion of acetate was monitored with 1H NMR spectroscopy. After the reaction, the heterogeneous catalyst was recovered by filtration. 2.9 Reusability test The reusability of HBPPA-Pd-2 in the Suzuki–Miyaura reaction between PhBr and PBA was carried out at the higher Pd loading of 0.1mol% relative to PhBr. The procedure is as follows. HBPPA-Pd-2 (16.5mg, containing 3μmol of Pd), PhBr (0.47g, 3mmol), PBA (0.44g, 3.6mmol), K2CO3 (0.62g, 4.5mmol) and water (5mL) were combined in a clean test tube with a magnetic stirrer. The tube was then sealed and the mixture was stirred at 100°C for 3h. The conversion of PhBr was determined with 1H NMR spectroscopy. At the completion of the reaction, the heterogeneous catalyst was separated from the reaction mixture by filtration. While the filtrate was characterized with atomic absorption spectroscopy, the heterogeneous catalyst was washed with acetone for 4 times (10mL×4) and was used to catalyze the next cycle of reaction following drying. 2.10 Hot filtration test In the hot filtration test, two Suzuki–Miyaura reactions (a control run and a hot filtration run) were simultaneously carried out under exactly the same conditions. Each of two test tubes was charged with HBPPA-Pd-2 (16.5mg, containing 3μmol of Pd), PhBr (0.47g, 3mmol), PBA (0.44g, 3.6mmol), K2CO3 (0.62g, 4.5mmol), and water (5mL). The two test tubes were then sealed and heated at 100°C to start the reaction. The conversion of both reactions was monitored with 1H NMR spectroscopy. The control run did not involve hot filtration and was terminated after PhBr conversion reached 100%. For the other run involving hot filtration, the reaction mixture was quickly filtered with a syringe filter after 0.5h of reaction (PhBr conversion: 71%) to remove the heterogeneous catalyst. The filtrate was immediately injected into another clean test tube, which was stirred at 100°C for 40h with the conversion of PhBr monitored with 1H NMR spectroscopy. 2.11 3-Phase tests 3-Phase tests using immobilized aryl halide Si-ArI were performed for Mizoroki–Heck reaction. All the liquid reagents and solvents involved were dried with 4Å molecular sieves before use to avoid possible hydrolysis of Si-ArI. In the typical reaction, 4-iodoacetophenone (0.295g, 1.2mmol), n-butyl acrylate (0.2g, 1.6mmol), Et3N (0.18g, 1.8mmol), Si-ArI (0.15g, containing ca. 0.12mmol ArI), HBPPA-Pd-2 (6.7mg, containing 1.2μmol of Pd) and DMF (2mL) were combined in a clean test tube having a magnetic stirring bar. The test tube was sealed and placed in an oil bath set at 100°C. After a pre-determined reaction time, the catalyst was picked out and the insoluble Si-ArR was recovered by filtration and washed with large amount of dry DMF/THF to remove all the soluble small molecules. Subsequently, Si-ArR was hydrolyzed with 1mol/L HCl solution overnight and extracted by CH2Cl2 (2mL×3 times). The solvent was then removed and the resulting compound 2 by hydrolysis (see Scheme 2) was characterized by NMR. 3 Results and discussion 3.1 Synthesis of heterogeneous Pd catalysts by catalytic cross-linking of HBPPA Our concept for the synthesis of the heterogeneous Pd catalysts benefits from the unique dual capability of Pd-based catalysts in catalyzing both alkyne polymerization/oligomerization and cross-coupling reactions [64]. We employ a hyperbranched poly(phenylacetylene) (HBPPA) containing pendant alkyne groups (at a content of 1.5mmol/g) as the cross-linkable polymer substrate to construct the heterogeneous Pd catalysts by simultaneous Pd-catalyzed cross-linking and encapsulation of the Pd species. This HBPPA was synthesized by copolymerization of phenylacetylene and 1,3-diethynylbenzene with the use of an in situ generated cationic Pd(II) catalyst system, Pd(OAc)2/α,α′-bis(di-tert-butylphosphino)-o-xylene/methanesulfonic acid (MSA), a synthetic methodology developed in our earlier work [66]. The cross-linking of HBPPA is achieved herein through the polymerization/oligomerization of its pendant alkyne groups with the homogeneous cationic Pd(II) catalyst to be encapsulated [64]. During the cross-linking, the homogeneous Pd(II) catalyst, along with its ligand, is simultaneously encapsulated into the cross-linked polymer network via physical entrapment and/or coordinative binding to the pendant alkyne groups, turning itself successfully into supported ligated Pd catalyst for coupling reactions (see Scheme 1 ). In this way, the structure of the polymer matrix is better controlled and different ligated Pd complexes can be employed. The catalytic performance of the ligated Pd catalysts in cross-coupling reactions is heavily related to their ligands [23]. Considering this, we have chosen to use three different homogeneous Pd(II) catalysts with varying ligands, triphenylphosphine (L1), α,α′-bis(di-tert-butylphosphino)-o-xylene (L2) as a diphosphine ligand, and a bidentate diimine ligand (L3), for the cross-linking reaction and encapsulation so as to study the effect of the ligand on catalytic performance of the resulting heterogeneous catalysts and to obtain high-performance catalysts. The two phosphine-ligated catalysts (L1-Pd and L2-Pd) were in situ generated by mixing Pd(OAc)2 with the corresponding ligands (L1 or L2) in the presence of a catalytic amount of methanesulfonic acid (MSA), which generates cationic Pd(II) centers [66]. A cationic acetonitrile Pd–diimine complex (L3-Pd), a well-known ethylene polymerization catalyst [65,68–78] also shown to effectively oligomerize alkynes [79], was used as the single-component diimine-ligated catalyst. While the diphosphine-ligated catalyst L2-Pd has been well demonstrated to polymerize alkynes [66,80,81], we have found that the monophosphine-ligated catalyst L1-Pd is also highly efficient in facilitating the polymerization of phenylacetylene and 1,3-diethynylbenzene. In the case with L1-Pd, the cross-linking of HBPPA was carried out at different [alkyne]/[Pd] feed ratios (4.4:1, 8.8:1, and 26:1) while the ratio of 8.8:1 was used in those with L2-Pd and L3-Pd. The simultaneous cross-linking and catalyst encapsulation were accomplished conveniently by simply mixing and reacting HBPPA with the corresponding catalyst in solution. In all cases, successful cross-linking occurred with the gelled polymer precipitated out during the course of the reaction. At the completion of each reaction, the precipitate was thoroughly washed to remove possible non-cross-linked polymer as well as non-encapsulated Pd and ligand species, and was subsequently dried, rendering the corresponding heterogeneous supported Pd catalyst as dark or light brown particles. Table 1 lists the various heterogeneous catalysts synthesized with this strategy, along with their characterization results including yield of supported catalyst, Pd content, and percentage of Pd encapsulation. Generally, the heterogeneous catalyst was obtained at high yield (ca. 90%) in each case except that with L2-Pd possibly because of its lower activity. With L1-Pd, increasing the [alkyne]/[Pd] feed ratio by decreasing the amount of the Pd catalyst at the fixed [alkyne]=0.14M leads to the increase in both yield (from 93 to 98%) and percentage of Pd encapsulation (from 75 to 97%). This indicates that the cross-linking was less efficient at the low [alkyne]/[Pd] feed ratio of 4.4 since the catalyst was at the alkyne-starved state. Comparing the three heterogeneous catalysts (HBPPA-Pd-2, HBPPA-Pd-4, and HBPPA-Pd-5) obtained at the same [alkyne]/[Pd] ratio, the percentage of Pd encapsulation increases in the order HBPPA-Pd-4<HBPPA-Pd-5<HBPPA-Pd-2, indicating that L1-Pd is the optimum one for quantitative encapsulation. By observation with optical microscopy, the resulting heterogeneous catalysts all have an average particle size of around 0.7mm except HBPPA-Pd-2 whose average size is around 0.4mm. The catalysts were further characterized with TEM and XPS. No Pd(0) nanoparticles were observed in HBPPA-Pd-2 under TEM, as shown in Fig. 1(a). Meanwhile, Fig. 1(b) shows the XPS Pd 3d spectra for HBPPA-Pd-1 and HBPPA-Pd-2. Given the encapsulation of the Pd species within the cross-linked polymer matrices at low contents, the XPS peaks are generally very weak despite high numbers of scans applied. For both HBPPA-Pd-1 and HBPPA-Pd-2, their Pd 3d3/2 and Pd 3d5/2 peaks center at around 343 and 338eV, respectively. This reveals that the encapsulated Pd species are primarily Pd(II) rather than Pd(0) since Pd(II) typically has higher 3d binding energies (3d5/2 peak typically in the range of 336–339eV) than the Pd(0) (3d5/2 peak typically in the range of 334.6–335.7eV) [64,82]. Meanwhile, it also indicates the absence of the reduction of Pd(II) species during the polymerization and postpolymerization procedures. 3.2 Mizoroki–Heck reactions with various heterogeneous catalysts The five heterogeneous Pd catalysts were first evaluated and compared for their performance in catalyzing the Mizoroki–Heck reaction between iodobenzene (PhI) and n-butyl acrylate (BA) at the Pd loading of 100molppm relative to PhI at 100°C under air (see runs H1–H5 in Table 2). Fig. 2 compares the conversion curves of PhI in these runs. Though quantitative conversion of PhI was obtained with all five catalysts (turn-over number, TON=10,000), significant differences in their turn-over frequency (TOF) and conversion curves can be noted. The three heterogeneous catalysts (HBPPA-Pd-1 to HBPPA-Pd-3) synthesized with PPh3-ligated L1-Pd (TOF=2000, 2500, and 1700h−1, respectively) were clearly much more active with significantly shortened reaction time when compared to HBPPA-Pd-4 (TOF=500h−1) and HBPPA-Pd-5 (TOF=400h−1). With HBPPA-Pd-2, quantitative conversion was reached at as short as 4h while it took 20 and 28h with HBPPA-Pd-4 and HBPPA-Pd-5, respectively. Meanwhile, in the reactions with the latter two, a long initial induction period (ca. 6 and 4h, respectively) with no PhI conversion was noticed (see Fig. 2). Given their similar Pd content, the dramatic difference in the catalytic performance of these three heterogeneous catalysts reflects the significant effect of the ligand of the encapsulated Pd species on the reaction. The PPh3 ligand is a commonly used classical ligand for Pd catalysts in many cross-coupling reactions [64]. Several diphosphine ligands in combination with Pd(OAc)2 have been reported to efficiently catalyze the Mizoroki–Heck reactions of aryl chlorides [83–86]. Meanwhile, a range of diimine ligands in combination with Pd(OAc)2 or Pd(acetylacetonate)2 have also been shown to effectively facilitate both the Mizoroki–Heck and Suzuki–Miyaura reactions [87,88]. On the basis of the catalytic performance of these three heterogeneous catalysts, PPh3 is far more effective than the diphosphine and diimine ligands used herein for effecting the coupling reaction. Among the three PPh3-ligated heterogeneous catalysts (HBPPA-Pd-1 to HBPPA-Pd-3), HBPPA-Pd-3 having the lowest Pd content is least active with the presence of an initial induction period of 2h in the reaction. This is reasoned to result from its highest polymer content. Since the reactants have to diffuse through the polymer matrix to reach the catalytic Pd species for the reactions, increasing polymer content is expected to slow down the reaction due to enhanced diffusion resistance. In particular, HBPPA-1 and HBPPA-2 show similar conversion curves with HBPPA-2 being slightly more active. From this set of runs, we can conclude that PPh3-ligated HBPPA-2 is the most optimum catalyst among the five heterogeneous catalysts given its catalytic performance and high efficiency in Pd encapsulation. All subsequent investigations have thus been carried out exclusively with the use of HBPPA-2. Runs H6–H13 in Table 2 are other Mizoroki–Heck reactions carried out with HBPPA-Pd-2 using PhI and aryl bromides as the reactant. The highest TON (86,000) and TOF (1800h−1) were achieved in the reaction between PhI and BA (run H6) at the lowest Pd loading of 10molppm. Up to date, the highest TON (2×106) and TOF (40×103 h−1) values of Mizoroki–Heck reaction were recently achieved by Yamada et al. with a Si-nanowire array-stabilized Pd-nanoparticle catalyst [89]. Although lower than these values, the TON and TOF values we achieved are still among the highest reported for the Mizoroki–Heck reactions carried out with the use of heterogeneous Pd catalysts under similar conditions [14,15,64]. In the case with relatively less active aryl bromides as the reactant, the reactions were carried out at 130°C with K2CO3 as the base. Quantitative or nearly quantitative conversions were achieved in the reactions (runs H7–11) of phenyl bromide (PhBr) or activated aryl bromides (4′-bromoacetophenone and 4-bromobenzonitrile) with BA or styrene at the Pd loading of 100molppm. With deactivated aryl bromides (4-bromotoluene and 4-bromoanisole), the reactions (runs H12 and H13) were, however, much slower at the same condition. In the reactions of aryl bromides, the highest TON (19,000) and TOF (800h−1) were achieved with 4′-bromoacetophenone and BA as reactants at the Pd loading of 50molppm. All the products from the Mizoroki–Heck reactions were featured with high E-selectivity with no/negligible Z-isomers observed. These results confirm that HBPPA-Pd-2 is highly effective in catalyzing the Mizoroki–Heck reactions. 3.3 Suzuki–Miyaura reactions catalyzed with HBPPA-Pd-2 Suzuki–Miyaura reactions of various aryl/heteroaryl bromides and aryl chlorides with arylboronic acids were carried out with HBPPA-Pd-2 in water as the environmentally benign solvent under air at 100°C. Table 3 summarizes all the reactions. In the case with the relatively more active aryl bromides, reactions were performed with K2CO3 as the base without the use of any phase transfer agent. HBPPA-Pd-2 shows outstanding catalytic activity toward these reactions. In reactions employing more difficult aryl chlorides, tetra-n-butylammonium bromide (TBAB) was used as the phase transfer agent, along with CsF as the base, in order to enhance catalyst activity. In runs S1–S3, the reactions between PhBr and phenylboronic acid (PBA) were carried out at different Pd loadings (10, 1, 0.3molppm, respectively). Quantitative conversion of PhBr was successfully achieved even in run S3 undertaken at the lowest Pd loading of 0.3molppm, rendering the highest TON (3,200,000) and TOF (188,000h−1). To the best of our knowledge, these activity values are the highest compared to those achieved in the literature with heterogeneous Pd catalysts under similar conditions. The best results in the literature (TON=3,570,000; TOF: 119,000h−1) were achieved by Uozumi et al. in the reaction between aryl iodotoluene and PBA with their self-assembled heterogeneous poly(imidazole-Pd) catalyst at the Pd loading of 0.28molppm [46,47]. However, their results were achieved with the use of relatively more reactive aryl iodide in the presence a phase transfer agent that often improves catalyst activity. At the Pd loading of 10molppm, the reactions of various aryl bromides containing different substituting groups with PBA (runs S4–S9 in Table 3) were successfully accomplished with quantitative conversions achieved. The TOF values are high, ranging from about 10,000h−1for deactivated aryl bromides (methyl-substituted phenyl bromides and 4-bromoanisole in runs S6–S9) to 100,000h−1 for activated aryl bromides (4-bromobenzonitrile and 4′-bromoacetophenone in runs S4 and S5). Moreover, the reactions (S10 and S11) involving sterically hindering 1-bromonaphthalene and 2-bromomesitylene were also successfully accomplished with high conversions but at a slightly higher Pd loading of 50molppm. Similarly, quantitative conversions were also achieved in the reactions of aryl bromides with activated or deactivated substituted phenylboronic acids (runs S12–S15) at the Pd loading of 10molppm. We subsequently investigated the performance of HBPPA-Pd-2 in the heteroaryl bromide-involving Suzuki–Miyaura reactions, which are of vital importance in medicinal/agrochemical fields [90]. There are quite a few homogeneous Pd catalysts reported to be capable of catalyzing versatile Suzuki–Miyaura reactions of heteroaryl compounds with high Pd loadings (1mol% or even higher) [91–101]. However, only very limited heterogeneous Pd catalysts have been developed for such reactions [53,64,102–106]. Herein, we have found that HBPPA-Pd-2 is also efficient in catalyzing the reactions of representative heteroaryl bromide (2-bromopyridine and 3-bromothianaphthene) with PBA. Due to the lower activity of such compounds, a much higher Pd loading of 5000ppm was, however, needed, and the solvent was also changed to ethanol/water mixture with K3PO4 as the base. As shown in Table 3 (S16 and S17), quantitative or nearly quantitative conversions were achieved in such reactions, resulting a TON around 200 and TOF around 10h−1. This result ranks HBPPA-Pd within the very limited heterogeneous Pd catalysts that have been reported to facilitate Suzuki–Miyaura reactions of heteroaryl compounds [53,64,102–106]. Compared to aryl iodides and bromides, aryl chlorides are much more difficult to activate in cross-coupling reactions but highly desired due to their abundance and low cost. The coupling reactions of aryl chlorides with the use of heterogeneous catalysts are often challenging [107]. We find that HBPPA-Pd-2 is effective in catalyzing the reactions of various aryl chlorides with PBA at the Pd loading of 1000molppm (see runs S18–S22). The highest TOF value of 130h−1 was achieved with the activated aryl chlorides (4-chlorobenzonitrile and 4′-chloroacetophenone in runs S18 and S19). All these results confirm that HBPPA-Pd-2 is highly active in catalyzing the Suzuki–Miyaura reactions. 3.4 Allylic arylation reactions catalyzed with HBPPA-Pd-2 We have further investigated the performance of HBPPA-Pd-2 in catalyzing the allylic arylation reactions. Compared to aryl-aryl coupling, allylic arylation (i.e., allyl-aryl coupling) is less studied yet more challenging and often requires a large amount (1–10mol%) of catalyst [108–112], except few heterogeneous catalysts that can catalyze allylic arylation at ppm level of Pd [46,47,64]. Herein, the allylic-arylation reactions between two typical allylic acetates (cinnamyl acetate, CA, and prenyl acetate, PrA) and tetraphenylborate (NaBPh4)/PBA were carried out with HBPPA-Pd-2 in water/DMF mixture at 100°C under air. Table 4 summarizes these reactions. In the reactions (runs A1–A5) between CA and NaBPh4/PBA, quantitative conversions of CA were reached at the low Pd loadings of 10 and 50molppm. At the further reduced Pd loading of 1molppm (run A3), the reaction between CA and NaBPh4 still proceeded with a CA conversion of 64% reached after 48h of reaction, giving high TON (640,000) and TOF (13,000h−1) values. In the reactions with less reactive PrA (runs A6 and A7), quantitative conversions were reached within 24h at the Pd loading of 50molppm. These reactions thus confirm the high performance of HBPPA-Pd-2 in facilitating the allylic arylation reactions. 3.5 Reusability of HBPPA-Pd and Pd leaching during cross-coupling reactions Relative to the homogeneous catalysts, heterogeneous catalysts show the advantage in their easy recovery and reusability. To confirm the reusability of HBPPA-Pd-2 as a reusable heterogeneous catalyst, we carried out a six-cycle reusability test of HBPPA-Pd-2 in the Suzuki–Miyaura reaction between PhBr and PBA at the high Pd loading of 1000molppm at 100°C. After the first cycle of reaction, the same catalyst was recovered and reused for additional 5 times. Each cycle of reaction lasted for 3h. At the end of each cycle of reaction, the heterogeneous catalyst was recovered easily through filtration, washed, and dried before being used for next cycle of reaction. The reaction solution in each cycle was collected and analyzed for the conversion of PhBr and the concentration of leached Pd species. Fig. 3 summarizes the conversion of PhBr and the percentage of leached Pd species in each cycle. Quantitative conversion was maintained in the first 4 cycles of reaction, but the conversion dropped slightly to 81% in the 6th cycle of reaction. From AA measurements, the filtered reaction solution in each cycle contained leached Pd species at a concentration of around 2mg/L (i.e., 2ppm), indicating that about 2.8% of encapsulated Pd leached out during the reaction (see Fig. 3). In all 6 cycles of reactions, the total percentage of leached Pd is about 16.3%, which should still be considered low. Overall, this test indicates that the heterogeneous catalyst has good reusability and stability. Given the presence of low but appreciable Pd leaching, we further carried out a hot filtration test to investigate the catalytic mechanism. In many heterogeneous catalyst systems with significant catalyst leaching, it has been found that the leached-out homogeneous Pd species present in the solution are the ones effecting the coupling reactions instead of the heterogeneous Pd species [39,67,113–116]. In the test, the reaction solution of PhBr and PBA with HBPPA-Pd-2 at the Pd loading of 1000molppm was hot filtered after 0.5h of reaction at 100°C (PhBr conversion=71%). The filtered solution was continued for the reaction at 100°C. There is negligible increase of PhBr conversion in the filtered solution during the first 8h (from 71% to 72%). Then the conversion of PhBr showed a gradual increase to 81% after 20h and remained unchanged afterward despite being extended for another 20h. On the opposite, the control run undertaken at identical conditions but without involving hot filtration was completed within 1h of reaction with no induction period observed. See Fig. 4 for a comparison of their conversion curves. From this hot filtration test, it can be concluded that the leached-out homogeneous Pd species still have some activity, but considering the long induction period and the slow reaction speed compared with the heterogeneous catalyst, they have only small negligible contributions toward the reaction and the heterogeneous encapsulated Pd species play the key role [39,67,113–116]. Besides the hot-filtration test, the 3-phase test, which entails anchoring one of the reactants onto a solid support, is an alternative important technique in the determination of heterogeneity in cross-coupling reactions facilitated with solid-supported Pd catalysts [67,113,116–118]. If the cross-coupling reactivity results completely from the heterogeneous Pd species embedded in the solid support, no transformation should be observed with the anchored reactant. On the other hand, if the leached homogeneous Pd species have some activity, the anchored reactant will be converted to some degree. As shown in Scheme 2 , we designed a 3-phase test for the Mizoroki–Heck reaction in organic solvent, with the use of a mesoporous silica-supported aryl iodide (Si-ArI) as a part of the aryl halide [64]. In addition, 4-iodoacetophenone (COMePhI), which has similar reactivity relative to the heterogeneous counterpart, was used as the homogeneous aryl halide (Si-ArI:COMePhI=0.1). Similar to the hot-filtration test, the reaction was also undertaken at very high Pd loading (1000molppm relative to COMePhI). As shown in Fig. 5 , no appreciable transformation of heterogeneous aryl iodide was achieved after 2h of reaction, whereas the conversion the homogeneous COMePhI reached a high conversion of 70%. Subsequently, the homogeneous aryl iodide was quantitatively converted in 4h. But even after extended reaction time of 24h, the conversion of heterogeneous Si-PhI is only 40%. Considering that most cross-coupling reactions in this work were performed at Pd loadings less than 1000molppm and the reaction time were around or less than 24h, the 3-phase test further supports that HBPPA-Pd-2 catalyst is a heterogeneous catalyst and the leached homogeneous Pd species only have a small contribution compared to the immobilized Pd species. This differentiates HBPPA-Pd-2 catalyst from many other reported heterogeneous Pd catalysts where the leached homogeneous Pd species are in fact the true ones responsible for the reactions [39,67,113–118]. 4 Conclusions We have demonstrated in this work the synthesis of heterogeneous Pd catalysts for coupling reactions with the use of a HBPPA containing pendant alkyne groups as the cross-linkable polymer substrate via one-step encapsulation of the Pd species that catalyze the cross-linking reactions. The in situ generated triphenylphosphine-ligated Pd(II) catalyst (L2-Pd) has been identified to be the most optimum one for effecting the cross-linking and encapsulation. We have found that HBPPA-Pd-2 is efficient and highly active in facilitating the Mizoroki–Heck, Suzuki–Miyaura, and allylic arylation reactions with the relative molar Pd loading at ppm levels. A high TON of 86,000 and a high TOF of 1800h−1 have been achieved in the Mizoroki–Heck reaction between PhI and BA with HBPPA-Pd-2 at the low Pd loading of 10molppm. More notably, HBPPA-Pd-2 showed very high activity in Suzuki–Miyaura reactions with various aryl/heteroaryl bromides (Pd loading down to 10molppm with TON up to 100,000 and TOF up to 100,000h−1) and low-reactivity aryl chlorides (at the Pd loading of 1000molppm with TON=1000 and TOF up to 130h−1). In particular, the reaction between PhBr and PBA occurred quantitatively even at a very low Pd loading of 0.3ppm, rendering very high TON (3200,000) and TOF (188,000h−1) values that are comparable to or even better than the best values reported in the literature. The allylic arylation reactions were also successfully accomplished with HBPPA-Pd-2 at the Pd loading of as low as 1molppm (TON up to 640,000 and TOF up to 13,000h−1). The 6-cycle reusability test of HBPPA-Pd-2 in the Suzuki–Miyaura reaction between PhBr and PBA has confirmed that the heterogeneous catalyst is easily recyclable and reusable with well-retained catalytic activity and low Pd leaching. A hot filtration test, together with a 3-phase test, has also verified that the catalyst is truly a heterogeneous one with negligible contributions from the leached homogeneous Pd species toward the catalytic activity. The heterogeneous catalyst synthesized through this unique simultaneous cross-linking and encapsulation strategy thus has the good potential for applications in carbon–carbon cross-coupling reactions. Acknowledgements The financial support from the Natural Sciences and Engineering Research Council (NSERC) of Canada and Canada Research Chair (CRC) is greatly appreciated. ZD thanks the Ontario Ministry of Economic Development and Innovation for awarding a postdoctoral fellowship. References [1] 2nd ed. A. de Meijere F. Diederich Metal-Catalyzed Cross-Coupling Reactions vol. 2 2004 Wiley-VCH Weinheim [2] E. Negishi A. de Meijere Handbook of Organopalladium Chemistry for Organic Synthesis vol. 2 2002 Wiley New York [3] C.C.C.J. Seechurn M.O. Kitching T.J. Colacot V. Snieckus Angew. Chem. Int. Ed. 51 2012 5062 5085 [4] N. Miyaura A. Suzuki J. Chem. Soc. Chem. Commun. 1979 866 867 [5] N. Miyaura A. Suzuki Chem. Rev. 95 1995 2457 2483 [6] A. Suzuki J. Organomet. Chem. 576 1999 147 168 [7] N. Miyaura Top. Curr. Chem. 219 2002 11 59 [8] R.F. Heck J.P. Nolley J. Org. Chem. 37 1972 2320 2322 [9] T. Mizoroki K. Mori A. Ozaki Bull. Chem. Soc. Jpn. 44 1971 581 [10] R.F. Heck Org. React. 27 1982 345 390 [11] A. de Meijere F.E. Meyer Angew. Chem. Int. Ed. 33 1995 2379 2411 [12] I.P. Beletskaya A.V. Cheprakov Chem. Rev. 100 2000 3009 3066 [13] M. Oestreich The Mizoroki–Heck Reaction 2009 Wiley Chichester, UK [14] A. Molnár Chem. Rev. 111 2011 2251 2320 [15] L. Yin J. Liebscher Chem. Rev. 107 2007 133 173 [16] Y. Uozumi Top. Curr. Chem. 242 2004 77 112 [17] R. Akiyama S. Kobayashi Chem. Rev. 109 2009 594 642 [18] S. Kobayashi H. Miyamura Aldrichim. Acta 46 2013 3 19 [19] A.C. Albéniz N. Carrera Eur. J. Inorg. Chem. 2011 2011 2347 2360 [20] A. Balanta C. Godard C. Claver Chem. Soc. Rev. 40 2011 4973 4985 [21] V. Polshettiwar C. Len A. Fihri Coord. Chem. Rev. 253 2009 2599 2626 [22] M. Pagliaro V. Pandarus R. Ciriminna F. Béland P.D. Carà Chemcatchem 4 2012 432 445 [23] V. Farina Adv. Synth. Catal. 346 2004 1553 1582 [24] D.E. Bergbreiter Chem. Rev. 102 2002 3345 3384 [25] D.E. Bergbreiter J. Tian C. Hongfa Chem. Rev. 109 2009 530 582 [26] J. Lu P.H. Toy Chem. Rev. 109 2009 815 838 [27] T.J. Dickerson N.N. Reed K.D. Janda Chem. Rev. 102 2002 3325 3344 [28] R. van de Coevering R.J.M. Klein Gebbink G. van Koten Prog. Polym. Sci. 30 2005 474 490 [29] D. Astruc F. Chardac Chem. Rev. 101 2001 2991 3023 [30] R.M. Crooks M. Zhao L. Sun V. Chechik L.K. Yeung Acc. Chem. Res. 34 2000 181 190 [31] R. van Heerbeek P.C.J. Kamer P.W.N.M. van Leeuwen J.N.H. Reek Chem. Rev. 102 2002 3717 3756 [32] R. Sablong U. Schlotterbeck D. Vogt S. Mecking Adv. Synth. Catal. 345 2003 333 336 [33] P. Liu Z. Ye W.-J. Wang B.-G. Li Macromolecules 46 2013 72 82 [34] S. Ikegami H. Hamamoto Chem. Rev. 109 2009 583 593 [35] R. Akiyama S. Kobayashi Angew. Chem. Int. Ed. 40 2001 3469 3471 [36] R. Akiyama S. Kobayashi J. Am. Chem. Soc. 125 2003 3412 3413 [37] K. Okamoto R. Akiyama H. Yoshida T. Yoshida S. Kobayashi J. Am. Chem. Soc. 127 2005 2125 2135 [38] A. Biffis N. Orlandi B. Corain Adv. Mater. 15 2003 1551 1555 [39] A.M. Caporusso P. Innocenti L.A. Aronica G. Vitulli R. Gallina A. Biffis M. Zecca B. Corain J. Catal. 234 2005 1 13 [40] Y. Uozumi R. Nakao Angew. Chem. Int. Ed. 42 2003 194 197 [41] J.K. Cho R. Najman T.W. Dean O. Ichihara C. Muller M. Bradley J. Am. Chem. Soc. 128 2006 6276 6277 [42] K. Glegola E. Framery K.M. Pietrusiewicz D. Sinou Adv. Synth. Catal. 348 2006 1728 1733 [43] S. Ogasawara S. Kato J. Am. Chem. Soc. 132 2010 4608 4613 [44] C. Ramaro S.V. Ley S.C. Smith I.M. Shirley N. DeAlmeida Chem. Commun. 2002 1132 1133 [45] S.V. Ley C. Ramarao R.S. Gordon A.B. Holmes A.J. Morrison I.F. McConvey I.M. Shirley S.C. Smith M.D. Smith Chem. Commun. 2002 1134 1135 [46] S.M. Sarkar Y. Uozumi Y.M.A. Yamada Angew. Chem. Int. Ed. 50 2011 9437 9441 [47] Y.M.A. Yamada S.M. Sarkar Y. Uozumi J. Am. Chem. Soc. 134 2012 3190 3198 [48] P. Liu Z. Dong Z. Ye W.-J. Wang B.-G. Li J. Mater. Chem. A 1 2013 15469 15478 [49] T. Hasell C.D. Wood R. Clowes J.T.A. Jones Y.Z. Khimyak D.J. Adams A.I. Cooper Chem. Mater. 22 2010 557 564 [50] P. Zhang Z. Weng J. Guo C. Wang Chem. Mater. 23 2011 5243 5249 [51] B. Li Z. Guan W. Wang X. Yang J. Hu B. Tan T. Li Adv. Mater. 24 2012 3390 3395 [52] K.E. Price D.T. McQuade Chem. Commun. 2005 1714 1716 [53] K. Inada N. Miyaura Tetrahedron 56 2000 8661 8664 [54] E. Groppo W. Liu O. Zavorotynska G. Agostini G. Spoto S. Bordiga C. Lamberti A. Zecchina Chem. Mater. 22 2010 2297 2308 [55] S. Schweizer J.-M. Becht C. Le Drian Org. Lett. 9 2007 3777 3780 [56] F. Wen W. Zhang G. Wei Y. Wang J. Zhang M. Zhang L. Shi Chem. Mater. 20 2008 2144 2150 [57] Y. Yu T. Hu X. Chen K. Xu J. Zhang J. Huang Chem. Commun. 47 2011 3592 3594 [58] G. Liu M. Hou J. Song T. Jiang H. Fan Z. Zhang B. Han Green Chem. 12 2010 65 69 [59] Y. Wang J. Liu C. Xia Tetrahedron Lett. 52 2011 1587 1591 [60] Y. Wang J. Zhang W. Zhang M. Zhang J. Org. Chem. 74 2009 1923 1931 [61] K.S. Sivudu N.M. Reddy N.N. Prasad K.M. Raju Y.M. Mohan J.S. Yadav G. Sabitha D. Shailaja J. Mol. Catal. A: Chem. 295 2008 10 17 [62] G. Cravotto D. Garella S. Tagliapietra A. Stolle S. Schüler S.E.S. Leonhardt B. Ondruschka New J. Chem. 36 2012 1304 1307 [63] K. Martina S.E.S. Leonhardt B. Ondruschka M. Curini A. Binello G. Cravotto J. Mol. Catal. A: Chem. 334 2011 60 64 [64] Z. Dong Z. Ye Adv. Synth. Catal. 2014 10.1002/adsc.201400520 (in press) [65] L.K. Johnson C.M. Killian M. Brookhart J. Am. Chem. Soc. 117 1995 6414 6415 [66] Z. Dong Z. Ye Macromolecules 45 2012 5020 5031 [67] K. Yu W. Sommer M. Weck C.W. Jones J. Catal. 226 2004 101 110 [68] Z. Ye L. Xu Z. Dong P. Xiang Chem. Commun. 49 2013 6235 6255 [69] Z. Dong Z. Ye Polym. Chem. 3 2012 286 301 [70] Z. Ye S. Li Macromol. React. Eng. 4 2010 319 332 [71] K. Zhang J. Wang R. Subramanian Z. Ye J. Lu Q. Yu Macromol. Rapid Commun. 28 2007 2185 2191 [72] J. Wang K. Zhang Z. Ye Macromolecules 41 2008 2290 2293 [73] Y. Zhang Z. Ye Chem. Commun. 2008 1178 1180 [74] Y. Zhang Z. Ye Macromolecules 41 2008 6331 6338 [75] Y. Xu P. Xiang Z. Ye W.-J. Wang Macromolecules 43 2010 8026 8038 [76] Z. Zhang Z. Ye Chem. Commun. 48 2012 7940 7942 [77] L. Xu Z. Ye Chem. Commun. 49 2013 8800 8802 [78] E. Landry Z. Ye Macromol. Rapid Commun. 34 2013 1493 1498 [79] A.M. LaPointe M. Brookhart Organometallics 17 1998 1530 1537 [80] J. Huber S. Mecking Angew. Chem. Int. Ed. 45 2006 6314 6317 [81] J. Huber S. Mecking Macromolecules 43 2010 8718 8723 [82] S. MacQuarrie B. Nohair J.H. Hortons S. Kaliaguine C.M. Crudden J. Phys. Chem. C 114 2010 57 64 [83] Y. Ben-David M. Portnoy M. Gozin D. Milstein Organometallics 11 1992 1995 1996 [84] M. Portnoy Y. Ben-David D. Milstein Organometallics 12 1993 4734 4735 [85] M. Portnoy D. Milstein Organometallics 12 1993 1665 1673 [86] M. Portnoy Y. Ben-David I. Rousso D. Milstein Organometallics 13 1994 3465 3479 [87] G.A. Grasa A.C. Hillier S.P. Nolan Org. Lett. 3 2001 1077 1080 [88] G.A. Grasa R. Singh E.D. Stevens S.P. Nolan J. Organomet. Chem. 687 2003 269 279 [89] Y.M.A. Yamada Y. Yuyama T. Sato S. Fujikawa Y. Uozumi Angew. Chem. Int. Ed. 53 2014 127 131 [90] S. Ge J.F. Hartwig Angew. Chem. Int. Ed. 51 2012 12837 12841 [91] G.A. Molander B. Biolatto J. Org. Chem. 68 2003 4302 4314 [92] N. Kudo M. Perseghini G.C. Fu Angew. Chem. Int. Ed. 45 2006 1282 1284 [93] K.L. Billingsley K.W. Anderson S.L. Buchwald Angew. Chem. Int. Ed. 45 2006 3484 3488 [94] K. Billingsley S.L. Buchwald J. Am. Chem. Soc. 129 2007 3358 3366 [95] G.A. Molander B. Canturk L.E. Kennedy J. Org. Chem. 74 2009 973 980 [96] T. Kinzel Y. Zhang S.L. Buchwald J. Am. Chem. Soc. 132 2010 14073 14075 [97] M.A. Düfert K.L. Billingsley S.L. Buchwald J. Am. Chem. Soc. 135 2013 12877 12885 [98] T. Noël A.J. Musacchio Org. Lett. 13 2011 5180 5183 [99] C.A. Fleckenstein H. Plenio J. Org. Chem. 73 2008 3236 3244 [100] A.S. Guram A.O. King J.G. Allen X. Wang L.B. Schenkel J. Chan E.E. Bunel M.M. Faul R.D. Larsen M.J. Martinelli P.J. Reider Org. Lett. 8 2006 1787 1789 [101] A.S. Guram X. Wang E.E. Bunel M.M. Faul R.D. Larsen M.J. Martinelli J. Org. Chem. 72 2007 5104 5112 [102] S.-W. Kim M. Kim W.Y. Lee T. Hyeon J. Am. Chem. Soc. 124 2002 7642 7643 [103] Y. Kitamura S. Sako T. Udzu A. Tsutsui T. Maegawa Y. Monguchi H. Sajiki Chem. Commun. 2007 5069 5071 [104] Y. Kitamura S. Sako A. Tsutsui Y. Monguchi T. Maegawa Y. Kitade H. Sajiki Adv. Synth. Catal. 352 2010 718 730 [105] D.-H. Lee M. Choi B.-W. Yu R. Ryoo A. Taher S. Hossain M.-J. Jin Adv. Synth. Catal. 351 2009 2912 2920 [106] D.-H. Lee J.-Y. Jung M.-J. Jin Green Chem. 12 2010 2024 2029 [107] A.F. Littke G.C. Fu Angew. Chem. Int. Ed. 41 2002 4176 4211 [108] H. Tsukamoto M. Sato Y. Kondo Chem. Commun. 2004 1200 1201 [109] K. Manabe K. Nakada N. Aoyama S. Kobayashi Adv. Synth. Catal. 347 2005 1499 1503 [110] H. Ohmiya Y. Makida D. Li M. Tanabe M. Sawamura J. Am. Chem. Soc. 132 2010 879 889 [111] H. Ohmiya Y. Makida T. Tanaka M. Sawamura J. Am. Chem. Soc. 130 2008 17276 17277 [112] Y. Uozumi H. Danjo T. Hayashi J. Org. Chem. 64 1999 3384 3388 [113] N.T.S. Phan M. Van Der Sluys C.W. Jones Adv. Synth. Catal. 348 2006 609 679 [114] F. Zhao B.M. Bhanage M. Shirai M. Arai J. Catal. 194 2000 479 483 [115] K. Kohler R.G. Heidenreich J.G.E. Krauter J. Pietsch Chem. Eur. J. 8 2002 622 631 [116] D.E. Bergbreiter P.L. Osburn J.D. Frels Adv. Synth. Catal. 347 2005 172 184 [117] I.W. Davies L. Matty D.L. Hughes P.J. Reider J. Am. Chem. Soc. 123 2001 10139 10140 [118] S.J. Broadwater D.T. McQuade J. Org. Chem. 71 2006 2131 2134",
      "scopus-id": "84949117500",
      "coredata": {
        "eid": "1-s2.0-S0926860X14006218",
        "dc:description": "We demonstrate in this work a unique strategy for the synthesis of heterogeneous Pd catalysts with the use of a hyperbranched poly(phenylacetylene) containing pendant alkyne groups as the cross-linkable polymer substrate. It utilizes the dual functions of Pd-based catalysts in catalyzing both alkyne polymerization/oligomerization and coupling reactions. In the synthesis, a homogeneous Pd(II) catalyst catalyzes the cross-linking of the hyperbranched polymer and simultaneously encapsulates itself into the cross-linked polymer matrix, rendering the heterogeneous catalyst at high yield and high percentage of Pd encapsulation. Three homogeneous catalysts having different ligands (triphenylphosphine, a diphosphine ligand, and a diimine ligand) have been examined for the cross-linking encapsulation and the resulting heterogeneous catalysts have been evaluated for their catalytic performance in coupling reactions. Among the various heterogeneous catalysts obtained, a triphenylphosphine-ligated catalyst, HBPPA-Pd-2, appears to be the optimum one. It shows high activity in catalyzing the Suzuki–Miyaura reactions, the Mizoroki–Heck reactions, and the allylic arylation reactions under air with the Pd loading at as low as mol ppm or even mol ppb levels relative to the reactants. Meanwhile, it facilitates the Suzuki–Miyaura reactions of challenging less reactive aryl chlorides/heteroaryl bromides and the Mizoroki–Heck reactions of aryl bromides as reactants. In addition, it behaves truly as a heterogeneous catalyst with high reusability and low catalyst leaching during the reactions.",
        "openArchiveArticle": "false",
        "prism:coverDate": "2015-01-31",
        "openaccessUserLicense": null,
        "prism:aggregationType": "Journal",
        "prism:url": "https://api.elsevier.com/content/article/pii/S0926860X14006218",
        "dc:creator": [
          {
            "@_fa": "true",
            "$": "Dong, Zhongmin"
          },
          {
            "@_fa": "true",
            "$": "Ye, Zhibin"
          }
        ],
        "link": [
          {
            "@_fa": "true",
            "@rel": "self",
            "@href": "https://api.elsevier.com/content/article/pii/S0926860X14006218"
          },
          {
            "@_fa": "true",
            "@rel": "scidir",
            "@href": "https://www.sciencedirect.com/science/article/pii/S0926860X14006218"
          }
        ],
        "dc:format": "application/json",
        "openaccessType": null,
        "pii": "S0926-860X(14)00621-8",
        "prism:volume": "489",
        "prism:publisher": "Elsevier B.V.",
        "dc:title": "Heterogeneous palladium catalyst constructed with cross-linked hyperbranched poly(phenylacetylene) as polymer support: A reusable highly active ppm-level catalyst for multiple cross-coupling reactions",
        "prism:copyright": "Copyright © 2014 Elsevier B.V. All rights reserved.",
        "openaccess": "0",
        "prism:issn": "0926860X",
        "dcterms:subject": [
          {
            "@_fa": "true",
            "$": "Heterogeneous Pd catalyst"
          },
          {
            "@_fa": "true",
            "$": "Cross-coupling reactions"
          },
          {
            "@_fa": "true",
            "$": "Hyperbranched polymer"
          },
          {
            "@_fa": "true",
            "$": "Suzuki–Miyaura reactions"
          },
          {
            "@_fa": "true",
            "$": "Mizoroki–Heck reactions"
          },
          {
            "@_fa": "true",
            "$": "Allylic arylation reactions"
          }
        ],
        "openaccessArticle": "false",
        "prism:publicationName": "Applied Catalysis A: General",
        "openaccessSponsorType": null,
        "prism:pageRange": "61-71",
        "prism:endingPage": "71",
        "pubType": "fla",
        "prism:coverDisplayDate": "January 2015",
        "prism:doi": "10.1016/j.apcata.2014.10.009",
        "prism:startingPage": "61",
        "dc:identifier": "doi:10.1016/j.apcata.2014.10.009",
        "openaccessSponsorName": null
      },
      "objects": {
        "object": [
          {
            "@category": "thumbnail",
            "@height": "91",
            "@width": "219",
            "@_fa": "true",
            "$": "https://api.elsevier.com/content/object/eid/1-s2.0-S0926860X14006218-fx1.sml?httpAccept=%2A%2F%2A",
            "@multimediatype": "GIF image file",
            "@type": "IMAGE-THUMBNAIL",
            "@size": "8983",
            "@ref": "fx1",
            "@mimetype": "image/gif"
          },
          {
            "@category": "thumbnail",
            "@height": "72",
            "@width": "219",
            "@_fa": "true",
            "$": "https://api.elsevier.com/content/object/eid/1-s2.0-S0926860X14006218-fx10.sml?httpAccept=%2A%2F%2A",
            "@multimediatype": "GIF image file",
            "@type": "IMAGE-THUMBNAIL",
            "@size": "3201",
            "@ref": "fx10",
            "@mimetype": "image/gif"
          },
          {
            "@category": "thumbnail",
            "@height": "81",
            "@width": "219",
            "@_fa": "true",
            "$": "https://api.elsevier.com/content/object/eid/1-s2.0-S0926860X14006218-fx11.sml?httpAccept=%2A%2F%2A",
            "@multimediatype": "GIF image file",
            "@type": "IMAGE-THUMBNAIL",
            "@size": "2594",
            "@ref": "fx11",
            "@mimetype": "image/gif"
          },
          {
            "@category": "thumbnail",
            "@height": "124",
            "@width": "219",
            "@_fa": "true",
            "$": "https://api.elsevier.com/content/object/eid/1-s2.0-S0926860X14006218-fx12.sml?httpAccept=%2A%2F%2A",
            "@multimediatype": "GIF image file",
            "@type": "IMAGE-THUMBNAIL",
            "@size": "4272",
            "@ref": "fx12",
            "@mimetype": "image/gif"
          },
          {
            "@category": "thumbnail",
            "@height": "79",
            "@width": "219",
            "@_fa": "true",
            "$": "https://api.elsevier.com/content/object/eid/1-s2.0-S0926860X14006218-fx13.sml?httpAccept=%2A%2F%2A",
            "@multimediatype": "GIF image file",
            "@type": "IMAGE-THUMBNAIL",
            "@size": "3043",
            "@ref": "fx13",
            "@mimetype": "image/gif"
          },
          {
            "@category": "thumbnail",
            "@height": "21",
            "@width": "219",
            "@_fa": "true",
            "$": "https://api.elsevier.com/content/object/eid/1-s2.0-S0926860X14006218-fx2.sml?httpAccept=%2A%2F%2A",
            "@multimediatype": "GIF image file",
            "@type": "IMAGE-THUMBNAIL",
            "@size": "1548",
            "@ref": "fx2",
            "@mimetype": "image/gif"
          },
          {
            "@category": "thumbnail",
            "@height": "19",
            "@width": "219",
            "@_fa": "true",
            "$": "https://api.elsevier.com/content/object/eid/1-s2.0-S0926860X14006218-fx3.sml?httpAccept=%2A%2F%2A",
            "@multimediatype": "GIF image file",
            "@type": "IMAGE-THUMBNAIL",
            "@size": "1853",
            "@ref": "fx3",
            "@mimetype": "image/gif"
          },
          {
            "@category": "thumbnail",
            "@height": "31",
            "@width": "219",
            "@_fa": "true",
            "$": "https://api.elsevier.com/content/object/eid/1-s2.0-S0926860X14006218-fx4.sml?httpAccept=%2A%2F%2A",
            "@multimediatype": "GIF image file",
            "@type": "IMAGE-THUMBNAIL",
            "@size": "1837",
            "@ref": "fx4",
            "@mimetype": "image/gif"
          },
          {
            "@category": "thumbnail",
            "@height": "105",
            "@width": "219",
            "@_fa": "true",
            "$": "https://api.elsevier.com/content/object/eid/1-s2.0-S0926860X14006218-fx5.sml?httpAccept=%2A%2F%2A",
            "@multimediatype": "GIF image file",
            "@type": "IMAGE-THUMBNAIL",
            "@size": "3085",
            "@ref": "fx5",
            "@mimetype": "image/gif"
          },
          {
            "@category": "thumbnail",
            "@height": "69",
            "@width": "219",
            "@_fa": "true",
            "$": "https://api.elsevier.com/content/object/eid/1-s2.0-S0926860X14006218-fx6.sml?httpAccept=%2A%2F%2A",
            "@multimediatype": "GIF image file",
            "@type": "IMAGE-THUMBNAIL",
            "@size": "3112",
            "@ref": "fx6",
            "@mimetype": "image/gif"
          },
          {
            "@category": "thumbnail",
            "@height": "73",
            "@width": "219",
            "@_fa": "true",
            "$": "https://api.elsevier.com/content/object/eid/1-s2.0-S0926860X14006218-fx7.sml?httpAccept=%2A%2F%2A",
            "@multimediatype": "GIF image file",
            "@type": "IMAGE-THUMBNAIL",
            "@size": "3108",
            "@ref": "fx7",
            "@mimetype": "image/gif"
          },
          {
            "@category": "thumbnail",
            "@height": "100",
            "@width": "219",
            "@_fa": "true",
            "$": "https://api.elsevier.com/content/object/eid/1-s2.0-S0926860X14006218-fx8.sml?httpAccept=%2A%2F%2A",
            "@multimediatype": "GIF image file",
            "@type": "IMAGE-THUMBNAIL",
            "@size": "2910",
            "@ref": "fx8",
            "@mimetype": "image/gif"
          },
          {
            "@category": "thumbnail",
            "@height": "85",
            "@width": "219",
            "@_fa": "true",
            "$": "https://api.elsevier.com/content/object/eid/1-s2.0-S0926860X14006218-fx9.sml?httpAccept=%2A%2F%2A",
            "@multimediatype": "GIF image file",
            "@type": "IMAGE-THUMBNAIL",
            "@size": "3413",
            "@ref": "fx9",
            "@mimetype": "image/gif"
          },
          {
            "@category": "thumbnail",
            "@height": "91",
            "@width": "219",
            "@_fa": "true",
            "$": "https://api.elsevier.com/content/object/eid/1-s2.0-S0926860X14006218-gr1.sml?httpAccept=%2A%2F%2A",
            "@multimediatype": "GIF image file",
            "@type": "IMAGE-THUMBNAIL",
            "@size": "16077",
            "@ref": "gr1",
            "@mimetype": "image/gif"
          },
          {
            "@category": "thumbnail",
            "@height": "142",
            "@width": "219",
            "@_fa": "true",
            "$": "https://api.elsevier.com/content/object/eid/1-s2.0-S0926860X14006218-gr2.sml?httpAccept=%2A%2F%2A",
            "@multimediatype": "GIF image file",
            "@type": "IMAGE-THUMBNAIL",
            "@size": "9343",
            "@ref": "gr2",
            "@mimetype": "image/gif"
          },
          {
            "@category": "thumbnail",
            "@height": "136",
            "@width": "219",
            "@_fa": "true",
            "$": "https://api.elsevier.com/content/object/eid/1-s2.0-S0926860X14006218-gr3.sml?httpAccept=%2A%2F%2A",
            "@multimediatype": "GIF image file",
            "@type": "IMAGE-THUMBNAIL",
            "@size": "7871",
            "@ref": "gr3",
            "@mimetype": "image/gif"
          },
          {
            "@category": "thumbnail",
            "@height": "164",
            "@width": "211",
            "@_fa": "true",
            "$": "https://api.elsevier.com/content/object/eid/1-s2.0-S0926860X14006218-gr4.sml?httpAccept=%2A%2F%2A",
            "@multimediatype": "GIF image file",
            "@type": "IMAGE-THUMBNAIL",
            "@size": "6068",
            "@ref": "gr4",
            "@mimetype": "image/gif"
          },
          {
            "@category": "thumbnail",
            "@height": "162",
            "@width": "219",
            "@_fa": "true",
            "$": "https://api.elsevier.com/content/object/eid/1-s2.0-S0926860X14006218-gr5.sml?httpAccept=%2A%2F%2A",
            "@multimediatype": "GIF image file",
            "@type": "IMAGE-THUMBNAIL",
            "@size": "4716",
            "@ref": "gr5",
            "@mimetype": "image/gif"
          },
          {
            "@category": "thumbnail",
            "@height": "150",
            "@width": "219",
            "@_fa": "true",
            "$": "https://api.elsevier.com/content/object/eid/1-s2.0-S0926860X14006218-sc1.sml?httpAccept=%2A%2F%2A",
            "@multimediatype": "GIF image file",
            "@type": "IMAGE-THUMBNAIL",
            "@size": "8647",
            "@ref": "sc1",
            "@mimetype": "image/gif"
          },
          {
            "@category": "thumbnail",
            "@height": "104",
            "@width": "219",
            "@_fa": "true",
            "$": "https://api.elsevier.com/content/object/eid/1-s2.0-S0926860X14006218-sc2.sml?httpAccept=%2A%2F%2A",
            "@multimediatype": "GIF image file",
            "@type": "IMAGE-THUMBNAIL",
            "@size": "11748",
            "@ref": "sc2",
            "@mimetype": "image/gif"
          },
          {
            "@category": "standard",
            "@height": "200",
            "@width": "480",
            "@_fa": "true",
            "$": "https://api.elsevier.com/content/object/eid/1-s2.0-S0926860X14006218-fx1.jpg?httpAccept=%2A%2F%2A",
            "@multimediatype": "JPEG image file",
            "@type": "IMAGE-DOWNSAMPLED",
            "@size": "38623",
            "@ref": "fx1",
            "@mimetype": "image/jpeg"
          },
          {
            "@category": "standard",
            "@height": "26",
            "@width": "78",
            "@_fa": "true",
            "$": "https://api.elsevier.com/content/object/eid/1-s2.0-S0926860X14006218-fx10.jpg?httpAccept=%2A%2F%2A",
            "@multimediatype": "JPEG image file",
            "@type": "IMAGE-DOWNSAMPLED",
            "@size": "1327",
            "@ref": "fx10",
            "@mimetype": "image/jpeg"
          },
          {
            "@category": "standard",
            "@height": "32",
            "@width": "87",
            "@_fa": "true",
            "$": "https://api.elsevier.com/content/object/eid/1-s2.0-S0926860X14006218-fx11.jpg?httpAccept=%2A%2F%2A",
            "@multimediatype": "JPEG image file",
            "@type": "IMAGE-DOWNSAMPLED",
            "@size": "1305",
            "@ref": "fx11",
            "@mimetype": "image/jpeg"
          },
          {
            "@category": "standard",
            "@height": "66",
            "@width": "117",
            "@_fa": "true",
            "$": "https://api.elsevier.com/content/object/eid/1-s2.0-S0926860X14006218-fx12.jpg?httpAccept=%2A%2F%2A",
            "@multimediatype": "JPEG image file",
            "@type": "IMAGE-DOWNSAMPLED",
            "@size": "3003",
            "@ref": "fx12",
            "@mimetype": "image/jpeg"
          },
          {
            "@category": "standard",
            "@height": "28",
            "@width": "77",
            "@_fa": "true",
            "$": "https://api.elsevier.com/content/object/eid/1-s2.0-S0926860X14006218-fx13.jpg?httpAccept=%2A%2F%2A",
            "@multimediatype": "JPEG image file",
            "@type": "IMAGE-DOWNSAMPLED",
            "@size": "1241",
            "@ref": "fx13",
            "@mimetype": "image/jpeg"
          },
          {
            "@category": "standard",
            "@height": "31",
            "@width": "318",
            "@_fa": "true",
            "$": "https://api.elsevier.com/content/object/eid/1-s2.0-S0926860X14006218-fx2.jpg?httpAccept=%2A%2F%2A",
            "@multimediatype": "JPEG image file",
            "@type": "IMAGE-DOWNSAMPLED",
            "@size": "4048",
            "@ref": "fx2",
            "@mimetype": "image/jpeg"
          },
          {
            "@category": "standard",
            "@height": "32",
            "@width": "367",
            "@_fa": "true",
            "$": "https://api.elsevier.com/content/object/eid/1-s2.0-S0926860X14006218-fx3.jpg?httpAccept=%2A%2F%2A",
            "@multimediatype": "JPEG image file",
            "@type": "IMAGE-DOWNSAMPLED",
            "@size": "5755",
            "@ref": "fx3",
            "@mimetype": "image/jpeg"
          },
          {
            "@category": "standard",
            "@height": "46",
            "@width": "329",
            "@_fa": "true",
            "$": "https://api.elsevier.com/content/object/eid/1-s2.0-S0926860X14006218-fx4.jpg?httpAccept=%2A%2F%2A",
            "@multimediatype": "JPEG image file",
            "@type": "IMAGE-DOWNSAMPLED",
            "@size": "5023",
            "@ref": "fx4",
            "@mimetype": "image/jpeg"
          },
          {
            "@category": "standard",
            "@height": "39",
            "@width": "81",
            "@_fa": "true",
            "$": "https://api.elsevier.com/content/object/eid/1-s2.0-S0926860X14006218-fx5.jpg?httpAccept=%2A%2F%2A",
            "@multimediatype": "JPEG image file",
            "@type": "IMAGE-DOWNSAMPLED",
            "@size": "1358",
            "@ref": "fx5",
            "@mimetype": "image/jpeg"
          },
          {
            "@category": "standard",
            "@height": "29",
            "@width": "92",
            "@_fa": "true",
            "$": "https://api.elsevier.com/content/object/eid/1-s2.0-S0926860X14006218-fx6.jpg?httpAccept=%2A%2F%2A",
            "@multimediatype": "JPEG image file",
            "@type": "IMAGE-DOWNSAMPLED",
            "@size": "1529",
            "@ref": "fx6",
            "@mimetype": "image/jpeg"
          },
          {
            "@category": "standard",
            "@height": "27",
            "@width": "80",
            "@_fa": "true",
            "$": "https://api.elsevier.com/content/object/eid/1-s2.0-S0926860X14006218-fx7.jpg?httpAccept=%2A%2F%2A",
            "@multimediatype": "JPEG image file",
            "@type": "IMAGE-DOWNSAMPLED",
            "@size": "1409",
            "@ref": "fx7",
            "@mimetype": "image/jpeg"
          },
          {
            "@category": "standard",
            "@height": "39",
            "@width": "85",
            "@_fa": "true",
            "$": "https://api.elsevier.com/content/object/eid/1-s2.0-S0926860X14006218-fx8.jpg?httpAccept=%2A%2F%2A",
            "@multimediatype": "JPEG image file",
            "@type": "IMAGE-DOWNSAMPLED",
            "@size": "1374",
            "@ref": "fx8",
            "@mimetype": "image/jpeg"
          },
          {
            "@category": "standard",
            "@height": "32",
            "@width": "82",
            "@_fa": "true",
            "$": "https://api.elsevier.com/content/object/eid/1-s2.0-S0926860X14006218-fx9.jpg?httpAccept=%2A%2F%2A",
            "@multimediatype": "JPEG image file",
            "@type": "IMAGE-DOWNSAMPLED",
            "@size": "1410",
            "@ref": "fx9",
            "@mimetype": "image/jpeg"
          },
          {
            "@category": "standard",
            "@height": "275",
            "@width": "662",
            "@_fa": "true",
            "$": "https://api.elsevier.com/content/object/eid/1-s2.0-S0926860X14006218-gr1.jpg?httpAccept=%2A%2F%2A",
            "@multimediatype": "JPEG image file",
            "@type": "IMAGE-DOWNSAMPLED",
            "@size": "62427",
            "@ref": "gr1",
            "@mimetype": "image/jpeg"
          },
          {
            "@category": "standard",
            "@height": "183",
            "@width": "282",
            "@_fa": "true",
            "$": "https://api.elsevier.com/content/object/eid/1-s2.0-S0926860X14006218-gr2.jpg?httpAccept=%2A%2F%2A",
            "@multimediatype": "JPEG image file",
            "@type": "IMAGE-DOWNSAMPLED",
            "@size": "18951",
            "@ref": "gr2",
            "@mimetype": "image/jpeg"
          },
          {
            "@category": "standard",
            "@height": "210",
            "@width": "338",
            "@_fa": "true",
            "$": "https://api.elsevier.com/content/object/eid/1-s2.0-S0926860X14006218-gr3.jpg?httpAccept=%2A%2F%2A",
            "@multimediatype": "JPEG image file",
            "@type": "IMAGE-DOWNSAMPLED",
            "@size": "19800",
            "@ref": "gr3",
            "@mimetype": "image/jpeg"
          },
          {
            "@category": "standard",
            "@height": "219",
            "@width": "282",
            "@_fa": "true",
            "$": "https://api.elsevier.com/content/object/eid/1-s2.0-S0926860X14006218-gr4.jpg?httpAccept=%2A%2F%2A",
            "@multimediatype": "JPEG image file",
            "@type": "IMAGE-DOWNSAMPLED",
            "@size": "12634",
            "@ref": "gr4",
            "@mimetype": "image/jpeg"
          },
          {
            "@category": "standard",
            "@height": "226",
            "@width": "305",
            "@_fa": "true",
            "$": "https://api.elsevier.com/content/object/eid/1-s2.0-S0926860X14006218-gr5.jpg?httpAccept=%2A%2F%2A",
            "@multimediatype": "JPEG image file",
            "@type": "IMAGE-DOWNSAMPLED",
            "@size": "12881",
            "@ref": "gr5",
            "@mimetype": "image/jpeg"
          },
          {
            "@category": "standard",
            "@height": "263",
            "@width": "383",
            "@_fa": "true",
            "$": "https://api.elsevier.com/content/object/eid/1-s2.0-S0926860X14006218-sc1.jpg?httpAccept=%2A%2F%2A",
            "@multimediatype": "JPEG image file",
            "@type": "IMAGE-DOWNSAMPLED",
            "@size": "24191",
            "@ref": "sc1",
            "@mimetype": "image/jpeg"
          },
          {
            "@category": "standard",
            "@height": "286",
            "@width": "602",
            "@_fa": "true",
            "$": "https://api.elsevier.com/content/object/eid/1-s2.0-S0926860X14006218-sc2.jpg?httpAccept=%2A%2F%2A",
            "@multimediatype": "JPEG image file",
            "@type": "IMAGE-DOWNSAMPLED",
            "@size": "43707",
            "@ref": "sc2",
            "@mimetype": "image/jpeg"
          },
          {
            "@category": "high",
            "@height": "886",
            "@width": "2124",
            "@_fa": "true",
            "$": "https://api.elsevier.com/content/object/eid/1-s2.0-S0926860X14006218-fx1_lrg.jpg?httpAccept=%2A%2F%2A",
            "@multimediatype": "JPEG image file",
            "@type": "IMAGE-HIGH-RES",
            "@size": "258766",
            "@ref": "fx1",
            "@mimetype": "image/jpeg"
          },
          {
            "@category": "high",
            "@height": "114",
            "@width": "346",
            "@_fa": "true",
            "$": "https://api.elsevier.com/content/object/eid/1-s2.0-S0926860X14006218-fx10_lrg.jpg?httpAccept=%2A%2F%2A",
            "@multimediatype": "JPEG image file",
            "@type": "IMAGE-HIGH-RES",
            "@size": "8282",
            "@ref": "fx10",
            "@mimetype": "image/jpeg"
          },
          {
            "@category": "high",
            "@height": "142",
            "@width": "385",
            "@_fa": "true",
            "$": "https://api.elsevier.com/content/object/eid/1-s2.0-S0926860X14006218-fx11_lrg.jpg?httpAccept=%2A%2F%2A",
            "@multimediatype": "JPEG image file",
            "@type": "IMAGE-HIGH-RES",
            "@size": "7302",
            "@ref": "fx11",
            "@mimetype": "image/jpeg"
          },
          {
            "@category": "high",
            "@height": "295",
            "@width": "522",
            "@_fa": "true",
            "$": "https://api.elsevier.com/content/object/eid/1-s2.0-S0926860X14006218-fx12_lrg.jpg?httpAccept=%2A%2F%2A",
            "@multimediatype": "JPEG image file",
            "@type": "IMAGE-HIGH-RES",
            "@size": "19970",
            "@ref": "fx12",
            "@mimetype": "image/jpeg"
          },
          {
            "@category": "high",
            "@height": "124",
            "@width": "344",
            "@_fa": "true",
            "$": "https://api.elsevier.com/content/object/eid/1-s2.0-S0926860X14006218-fx13_lrg.jpg?httpAccept=%2A%2F%2A",
            "@multimediatype": "JPEG image file",
            "@type": "IMAGE-HIGH-RES",
            "@size": "7300",
            "@ref": "fx13",
            "@mimetype": "image/jpeg"
          },
          {
            "@category": "high",
            "@height": "136",
            "@width": "1411",
            "@_fa": "true",
            "$": "https://api.elsevier.com/content/object/eid/1-s2.0-S0926860X14006218-fx2_lrg.jpg?httpAccept=%2A%2F%2A",
            "@multimediatype": "JPEG image file",
            "@type": "IMAGE-HIGH-RES",
            "@size": "27391",
            "@ref": "fx2",
            "@mimetype": "image/jpeg"
          },
          {
            "@category": "high",
            "@height": "143",
            "@width": "1628",
            "@_fa": "true",
            "$": "https://api.elsevier.com/content/object/eid/1-s2.0-S0926860X14006218-fx3_lrg.jpg?httpAccept=%2A%2F%2A",
            "@multimediatype": "JPEG image file",
            "@type": "IMAGE-HIGH-RES",
            "@size": "42171",
            "@ref": "fx3",
            "@mimetype": "image/jpeg"
          },
          {
            "@category": "high",
            "@height": "204",
            "@width": "1456",
            "@_fa": "true",
            "$": "https://api.elsevier.com/content/object/eid/1-s2.0-S0926860X14006218-fx4_lrg.jpg?httpAccept=%2A%2F%2A",
            "@multimediatype": "JPEG image file",
            "@type": "IMAGE-HIGH-RES",
            "@size": "35028",
            "@ref": "fx4",
            "@mimetype": "image/jpeg"
          },
          {
            "@category": "high",
            "@height": "172",
            "@width": "360",
            "@_fa": "true",
            "$": "https://api.elsevier.com/content/object/eid/1-s2.0-S0926860X14006218-fx5_lrg.jpg?httpAccept=%2A%2F%2A",
            "@multimediatype": "JPEG image file",
            "@type": "IMAGE-HIGH-RES",
            "@size": "7817",
            "@ref": "fx5",
            "@mimetype": "image/jpeg"
          },
          {
            "@category": "high",
            "@height": "128",
            "@width": "409",
            "@_fa": "true",
            "$": "https://api.elsevier.com/content/object/eid/1-s2.0-S0926860X14006218-fx6_lrg.jpg?httpAccept=%2A%2F%2A",
            "@multimediatype": "JPEG image file",
            "@type": "IMAGE-HIGH-RES",
            "@size": "9646",
            "@ref": "fx6",
            "@mimetype": "image/jpeg"
          },
          {
            "@category": "high",
            "@height": "118",
            "@width": "355",
            "@_fa": "true",
            "$": "https://api.elsevier.com/content/object/eid/1-s2.0-S0926860X14006218-fx7_lrg.jpg?httpAccept=%2A%2F%2A",
            "@multimediatype": "JPEG image file",
            "@type": "IMAGE-HIGH-RES",
            "@size": "8427",
            "@ref": "fx7",
            "@mimetype": "image/jpeg"
          },
          {
            "@category": "high",
            "@height": "172",
            "@width": "378",
            "@_fa": "true",
            "$": "https://api.elsevier.com/content/object/eid/1-s2.0-S0926860X14006218-fx8_lrg.jpg?httpAccept=%2A%2F%2A",
            "@multimediatype": "JPEG image file",
            "@type": "IMAGE-HIGH-RES",
            "@size": "8164",
            "@ref": "fx8",
            "@mimetype": "image/jpeg"
          },
          {
            "@category": "high",
            "@height": "141",
            "@width": "363",
            "@_fa": "true",
            "$": "https://api.elsevier.com/content/object/eid/1-s2.0-S0926860X14006218-fx9_lrg.jpg?httpAccept=%2A%2F%2A",
            "@multimediatype": "JPEG image file",
            "@type": "IMAGE-HIGH-RES",
            "@size": "8899",
            "@ref": "fx9",
            "@mimetype": "image/jpeg"
          },
          {
            "@category": "high",
            "@height": "730",
            "@width": "1758",
            "@_fa": "true",
            "$": "https://api.elsevier.com/content/object/eid/1-s2.0-S0926860X14006218-gr1_lrg.jpg?httpAccept=%2A%2F%2A",
            "@multimediatype": "JPEG image file",
            "@type": "IMAGE-HIGH-RES",
            "@size": "266271",
            "@ref": "gr1",
            "@mimetype": "image/jpeg"
          },
          {
            "@category": "high",
            "@height": "811",
            "@width": "1250",
            "@_fa": "true",
            "$": "https://api.elsevier.com/content/object/eid/1-s2.0-S0926860X14006218-gr2_lrg.jpg?httpAccept=%2A%2F%2A",
            "@multimediatype": "JPEG image file",
            "@type": "IMAGE-HIGH-RES",
            "@size": "138110",
            "@ref": "gr2",
            "@mimetype": "image/jpeg"
          },
          {
            "@category": "high",
            "@height": "931",
            "@width": "1497",
            "@_fa": "true",
            "$": "https://api.elsevier.com/content/object/eid/1-s2.0-S0926860X14006218-gr3_lrg.jpg?httpAccept=%2A%2F%2A",
            "@multimediatype": "JPEG image file",
            "@type": "IMAGE-HIGH-RES",
            "@size": "135739",
            "@ref": "gr3",
            "@mimetype": "image/jpeg"
          },
          {
            "@category": "high",
            "@height": "970",
            "@width": "1250",
            "@_fa": "true",
            "$": "https://api.elsevier.com/content/object/eid/1-s2.0-S0926860X14006218-gr4_lrg.jpg?httpAccept=%2A%2F%2A",
            "@multimediatype": "JPEG image file",
            "@type": "IMAGE-HIGH-RES",
            "@size": "83603",
            "@ref": "gr4",
            "@mimetype": "image/jpeg"
          },
          {
            "@category": "high",
            "@height": "1001",
            "@width": "1353",
            "@_fa": "true",
            "$": "https://api.elsevier.com/content/object/eid/1-s2.0-S0926860X14006218-gr5_lrg.jpg?httpAccept=%2A%2F%2A",
            "@multimediatype": "JPEG image file",
            "@type": "IMAGE-HIGH-RES",
            "@size": "83583",
            "@ref": "gr5",
            "@mimetype": "image/jpeg"
          },
          {
            "@category": "high",
            "@height": "1164",
            "@width": "1696",
            "@_fa": "true",
            "$": "https://api.elsevier.com/content/object/eid/1-s2.0-S0926860X14006218-sc1_lrg.jpg?httpAccept=%2A%2F%2A",
            "@multimediatype": "JPEG image file",
            "@type": "IMAGE-HIGH-RES",
            "@size": "200548",
            "@ref": "sc1",
            "@mimetype": "image/jpeg"
          },
          {
            "@category": "high",
            "@height": "1265",
            "@width": "2667",
            "@_fa": "true",
            "$": "https://api.elsevier.com/content/object/eid/1-s2.0-S0926860X14006218-sc2_lrg.jpg?httpAccept=%2A%2F%2A",
            "@multimediatype": "JPEG image file",
            "@type": "IMAGE-HIGH-RES",
            "@size": "266235",
            "@ref": "sc2",
            "@mimetype": "image/jpeg"
          }
        ]
      },
      "link": {
        "@rel": "abstract",
        "@href": "https://api.elsevier.com/content/abstract/scopus_id/84949117500"
      }
    }
  }
}