{
  "metadata": {
    "title": "Dehydrogenation of methyl glycolate to methyl glyoxylate over a Cu/SiO<ce:inf loc=post>2</ce:inf> catalyst",
    "authors": "; ; ",
    "journal": "Applied Catalysis A: General",
    "date": "2025-05-05",
    "doi": "10.1016/j.apcata.2025.120219",
    "abstract": "",
    "uri": "https://api.elsevier.com/content/article/pii/S0926860X25001206",
    "pii": "S0926860X25001206"
  },
  "fulltext": {
    "full-text-retrieval-response": {
      "scopus-eid": "2-s2.0-86000780368",
      "originalText": "serial JL 271346 291210 291744 291809 31 Applied Catalysis A: General APPLIEDCATALYSISAGENERAL 2025-03-12 2025-03-12 2025-03-18 2025-03-18 2025-03-26T08:53:07 1-s2.0-S0926860X25001206 S0926-860X(25)00120-6 S0926860X25001206 10.1016/j.apcata.2025.120219 S300 S300.1 FULL-TEXT 1-s2.0-S0926860X25X00053 2025-03-26T09:54:55.965889Z 0 0 20250505 2025 2025-03-12T07:48:57.224765Z absattachment articleinfo articlenumber articletitlenorm authfirstinitialnorm authfirstsurnamenorm cid cids contenttype copyright crossmark dateloaded dateloadedtxt datesearch datesort dateupdated dco docsubtype doctype doi eid ewtransactionid hubeid indexeddate issn issnnorm itemstage itemtransactionid itemweight openaccess openarchive pg pgfirst pii piinorm pubdatestart pubdatetxt pubyr sortorder srctitle srctitlenorm srctype ssids alllist content subj subheadings suppl tomb volfirst volissue volumelist webpdf webpdfpagecount yearnav figure e-component body mmlmath acknowledge affil appendices articletitle auth authfirstini authfull authkeywords authlast footnotes grantnumber grantsponsor grantsponsorid highlightsabst orcid primabst ref specialabst 0926-860X 0926860X true 697 697 C Volume 697 14 120219 120219 120219 20250505 5 May 2025 2025-05-05 2025 article fla © 2025 Elsevier B.V. All rights are reserved, including those for text and data mining, AI training, and similar technologies. DEHYDROGENATIONMETHYLGLYCOLATEMETHYLGLYOXYLATEOVERACUSIO2CATALYST GONG Z 1 Introduction 2 Experimental 2.1 Catalyst preparation 2.1.1 Materials 2.1.2 Catalyst synthesis 2.2 Catalyst characterization 2.3 Catalyst evaluation 2.4 Density functional theory (DFT) calculations 3 Results and discussion 3.1 DFT calculation of thermodynamic equilibrium 3.2 Catalytic performance 3.3 Structural and textural properties 3.4 Reducibility and surface Cu+/Cu0 pair 3.5 Insight into the synergistic catalysis of Cu+/Cu0 pair 3.6 Deactivation and regeneration 4 Conclusions CRediT authorship contribution statement Acknowledgments Appendix A Supplementary material References JAKOB 2021 6340 6346 B FAN 2014 10116 10123 B NIU 2021 16820 16828 K DONOHOE 2008 285 288 T HORNE 1984 3529 3532 D KELLY 1972 544 545 T VARGHA 1951 1068 1069 L ZHU 2019 37635 37643 J SUN 2009 678 681 Y WENG 2023 4340 4343 Y XU 2017 1390 1394 G REN 2024 4646 4655 X WANG 2024 728 740 H HE 2013 9620 9633 M HE 2022 e202112835 M NELSON 2017 180 187 N SILVA 2013 273 281 A PANG 2021 7902 7916 J HUANG 2021 1652 1664 Y HE 2023 11291 11304 L KUMAR 2021 16561 16576 A WANG 2015 2846 2852 Q BEHRENS 2012 893 897 M CHEONG 2016 4887 4894 J KUMAR 2016 778 787 A GAO 2024 153775 X LUO 2022 3704 3715 X PANG 2020 13624 13629 J JIANG 2023 12270 12280 F LU 2023 122329 S HE 2019 2213 2221 X YUAN 2019 1854 1860 D WANG 2021 111514 N YANG 2018 1836 1840 H YUAN 2020 256 268 E JI 2007 1891 1895 D WITZKE 2017 597 600 M CHEN 2008 172 180 L FRISCH 2016 M GAUSSIAN16REVISIONA03 STEPHENS 1994 11623 11627 P LU 2021 113249 T PALANYCHAMY 2022 1487 P XU 2016 918 926 Y CLERCQ 2018 5649 5655 R TOUPANCE 2002 2277 2286 T CLAUSE 1992 4709 4717 O MARCHI 1996 375 386 A VANDERGRIFT 1990 95 113 C LIU 2023 140059 K WANG 2014 534 545 Y XU 2018 3367 C MAKSHINA 2022 6196 6204 E QIAN 1997 596 601 K WANG 2018 8647 8654 H GONGX2025X120219 GONGX2025X120219XZ 2027-03-18T00:00:00.000Z 2027-03-18T00:00:00.000Z http://creativecommons.org/licenses/by-nc-nd/4.0/ © 2025 Elsevier B.V. All rights are reserved, including those for text and data mining, AI training, and similar technologies. 2025-03-19T05:36:31.994Z http://vtw.elsevier.com/data/voc/AddOnTypes/50.7/aggregated-refined 2023YFA1507903 National Key Research and Development Program of China http://data.elsevier.com/vocabulary/SciValFunders/501100012166 http://sws.geonames.org/1814991 22272053 22072043 National Natural Science Foundation of China http://data.elsevier.com/vocabulary/SciValFunders/501100001809 http://sws.geonames.org/1814991 Research Funds of Happiness Flower ECNU Ministry of Science and Technology of People's Republic of China MOST Ministry of Science and Technology of the People's Republic of China http://data.elsevier.com/vocabulary/SciValFunders/501100002855 http://sws.geonames.org/1814991/ 2020ST2203 East China Normal University http://data.elsevier.com/vocabulary/SciValFunders/501100004106 http://sws.geonames.org/1814991 We gratefully acknowledge funding supports from the National Natural Science Foundation of China (22272053, 22072043), the National Key Research and Development Program of China (2023YFA1507903) from the Ministry of Science and Technology of People's Republic of China, and the Research Funds of Happiness Flower ECNU (2020ST2203). We gratefully acknowledge funding supports from the National Natural Science Foundation of China (22272053, 22072043), the National Key Research and Development Program of China (2023YFA1507903) from the Ministry of Science and Technology of People\\u2019s Republic of China, and the Research Funds of Happiness Flower ECNU (2020ST2203). https://doi.org/10.15223/policy-017 https://doi.org/10.15223/policy-037 https://doi.org/10.15223/policy-012 https://doi.org/10.15223/policy-029 https://doi.org/10.15223/policy-004 item S0926-860X(25)00120-6 S0926860X25001206 1-s2.0-S0926860X25001206 10.1016/j.apcata.2025.120219 271346 2025-03-26T09:54:55.965889Z 2025-05-05 1-s2.0-S0926860X25001206-main.pdf https://s3-eu-west-1.amazonaws.com/prod-ucs-content-store-eu-west/content/pii:S0926860X25001206/MAIN/application/pdf/11cd874b82907acc8b37feca5fa25411/main.pdf main.pdf pdf true 6659308 MAIN 10 1-s2.0-S0926860X25001206-main_1.png https://s3-eu-west-1.amazonaws.com/prod-ucs-content-store-eu-west/content/pii:S0926860X25001206/PREVIEW/image/png/351626e621d1f3f1b79bc4d27630cf5f/main_1.png main_1.png png 59055 849 656 IMAGE-WEB-PDF 1 1-s2.0-S0926860X25001206-gr6.jpg https://s3-eu-west-1.amazonaws.com/prod-ucs-content-store-eu-west/content/pii:S0926860X25001206/gr6/DOWNSAMPLED/image/jpeg/8b518578438145d7a5326404567ede29/gr6.jpg gr6 gr6.jpg jpg 101680 842 282 IMAGE-DOWNSAMPLED 1-s2.0-S0926860X25001206-gr5.jpg https://s3-eu-west-1.amazonaws.com/prod-ucs-content-store-eu-west/content/pii:S0926860X25001206/gr5/DOWNSAMPLED/image/jpeg/fd428b67cd8a01dff253e1e550bf0d96/gr5.jpg gr5 gr5.jpg jpg 17119 291 339 IMAGE-DOWNSAMPLED 1-s2.0-S0926860X25001206-gr8.jpg https://s3-eu-west-1.amazonaws.com/prod-ucs-content-store-eu-west/content/pii:S0926860X25001206/gr8/DOWNSAMPLED/image/jpeg/c8e421165dab404dfdca9b7e9783f490/gr8.jpg gr8 gr8.jpg jpg 95074 554 678 IMAGE-DOWNSAMPLED 1-s2.0-S0926860X25001206-gr7.jpg https://s3-eu-west-1.amazonaws.com/prod-ucs-content-store-eu-west/content/pii:S0926860X25001206/gr7/DOWNSAMPLED/image/jpeg/fef6db39d13d1fce262607e453fd3cf6/gr7.jpg gr7 gr7.jpg jpg 46544 307 678 IMAGE-DOWNSAMPLED 1-s2.0-S0926860X25001206-gr9.jpg https://s3-eu-west-1.amazonaws.com/prod-ucs-content-store-eu-west/content/pii:S0926860X25001206/gr9/DOWNSAMPLED/image/jpeg/769d19d8b6fe164720ff30baeb3665d6/gr9.jpg gr9 gr9.jpg jpg 19766 257 338 IMAGE-DOWNSAMPLED 1-s2.0-S0926860X25001206-gr2.jpg https://s3-eu-west-1.amazonaws.com/prod-ucs-content-store-eu-west/content/pii:S0926860X25001206/gr2/DOWNSAMPLED/image/jpeg/3bb9591faa42154434f153e3147de284/gr2.jpg gr2 gr2.jpg jpg 38118 267 676 IMAGE-DOWNSAMPLED 1-s2.0-S0926860X25001206-ga1.jpg https://s3-eu-west-1.amazonaws.com/prod-ucs-content-store-eu-west/content/pii:S0926860X25001206/ga1/DOWNSAMPLED/image/jpeg/1f01b3c1e5257f43382cd8355dd659dd/ga1.jpg ga1 true ga1.jpg jpg 22604 200 330 IMAGE-DOWNSAMPLED 1-s2.0-S0926860X25001206-gr1.jpg https://s3-eu-west-1.amazonaws.com/prod-ucs-content-store-eu-west/content/pii:S0926860X25001206/gr1/DOWNSAMPLED/image/jpeg/e7a8ef19c951a142b304683991be1287/gr1.jpg gr1 gr1.jpg jpg 15827 255 338 IMAGE-DOWNSAMPLED 1-s2.0-S0926860X25001206-gr4.jpg https://s3-eu-west-1.amazonaws.com/prod-ucs-content-store-eu-west/content/pii:S0926860X25001206/gr4/DOWNSAMPLED/image/jpeg/266af7d5dbfa668205f538c57dc2161a/gr4.jpg gr4 gr4.jpg jpg 76980 547 678 IMAGE-DOWNSAMPLED 1-s2.0-S0926860X25001206-gr3.jpg https://s3-eu-west-1.amazonaws.com/prod-ucs-content-store-eu-west/content/pii:S0926860X25001206/gr3/DOWNSAMPLED/image/jpeg/008b2ebd19aad5ebb11ee2a9990dafc0/gr3.jpg gr3 gr3.jpg jpg 79969 529 678 IMAGE-DOWNSAMPLED 1-s2.0-S0926860X25001206-gr6.sml https://s3-eu-west-1.amazonaws.com/prod-ucs-content-store-eu-west/content/pii:S0926860X25001206/gr6/THUMBNAIL/image/gif/101985bd0f331bf4aa7d6054ae9c7345/gr6.sml gr6 gr6.sml sml 6660 161 54 IMAGE-THUMBNAIL 1-s2.0-S0926860X25001206-gr5.sml https://s3-eu-west-1.amazonaws.com/prod-ucs-content-store-eu-west/content/pii:S0926860X25001206/gr5/THUMBNAIL/image/gif/e3ab65d578dbcc61df109fc3c6796e10/gr5.sml gr5 gr5.sml sml 6366 164 191 IMAGE-THUMBNAIL 1-s2.0-S0926860X25001206-gr8.sml https://s3-eu-west-1.amazonaws.com/prod-ucs-content-store-eu-west/content/pii:S0926860X25001206/gr8/THUMBNAIL/image/gif/c0e328f457d4ad15e4acb92ab30d0886/gr8.sml gr8 gr8.sml sml 12432 164 201 IMAGE-THUMBNAIL 1-s2.0-S0926860X25001206-gr7.sml https://s3-eu-west-1.amazonaws.com/prod-ucs-content-store-eu-west/content/pii:S0926860X25001206/gr7/THUMBNAIL/image/gif/0099991d6bf57005c08a9abb7fd47154/gr7.sml gr7 gr7.sml sml 8440 99 219 IMAGE-THUMBNAIL 1-s2.0-S0926860X25001206-gr9.sml https://s3-eu-west-1.amazonaws.com/prod-ucs-content-store-eu-west/content/pii:S0926860X25001206/gr9/THUMBNAIL/image/gif/bf000e13aae6ae0378da9a9e54dd1c6c/gr9.sml gr9 gr9.sml sml 7058 164 215 IMAGE-THUMBNAIL 1-s2.0-S0926860X25001206-gr2.sml https://s3-eu-west-1.amazonaws.com/prod-ucs-content-store-eu-west/content/pii:S0926860X25001206/gr2/THUMBNAIL/image/gif/5b7c20d4ffe912f6b72cd6ea4e5aebfc/gr2.sml gr2 gr2.sml sml 6582 87 219 IMAGE-THUMBNAIL 1-s2.0-S0926860X25001206-ga1.sml https://s3-eu-west-1.amazonaws.com/prod-ucs-content-store-eu-west/content/pii:S0926860X25001206/ga1/THUMBNAIL/image/gif/2395225142fdd078b9ef626cbf62085e/ga1.sml ga1 true ga1.sml sml 16158 133 219 IMAGE-THUMBNAIL 1-s2.0-S0926860X25001206-gr1.sml https://s3-eu-west-1.amazonaws.com/prod-ucs-content-store-eu-west/content/pii:S0926860X25001206/gr1/THUMBNAIL/image/gif/84ec27753b00e9a6edca9cf110296a66/gr1.sml gr1 gr1.sml sml 6338 164 217 IMAGE-THUMBNAIL 1-s2.0-S0926860X25001206-gr4.sml https://s3-eu-west-1.amazonaws.com/prod-ucs-content-store-eu-west/content/pii:S0926860X25001309/gr4/THUMBNAIL/image/gif/3edfaf5a7f4bc3da2ce786389556b3ae/gr4.sml gr4 gr4.sml sml 10645 164 203 IMAGE-THUMBNAIL 1-s2.0-S0926860X25001206-gr3.sml https://s3-eu-west-1.amazonaws.com/prod-ucs-content-store-eu-west/content/pii:S0926860X25001309/gr3/THUMBNAIL/image/gif/6c30832f1e3a70f5b388d425f81e15a9/gr3.sml gr3 gr3.sml sml 13752 164 210 IMAGE-THUMBNAIL 1-s2.0-S0926860X25001206-gr6_lrg.jpg https://s3-eu-west-1.amazonaws.com/prod-ucs-content-store-eu-west/content/pii:S0926860X25001206/HIGHRES/image/jpeg/737a04d39dc8eae500586e58669ecef8/gr6_lrg.jpg gr6 gr6_lrg.jpg jpg 567101 3724 1247 IMAGE-HIGH-RES 1-s2.0-S0926860X25001206-gr5_lrg.jpg https://s3-eu-west-1.amazonaws.com/prod-ucs-content-store-eu-west/content/pii:S0926860X25001206/HIGHRES/image/jpeg/4597acf3161631f25242c7d6ee7ea9f9/gr5_lrg.jpg gr5 gr5_lrg.jpg jpg 104166 1286 1498 IMAGE-HIGH-RES 1-s2.0-S0926860X25001206-gr8_lrg.jpg https://s3-eu-west-1.amazonaws.com/prod-ucs-content-store-eu-west/content/pii:S0926860X25001206/HIGHRES/image/jpeg/8674dd0356f28ac4383a4375b1f9ff7d/gr8_lrg.jpg gr8 gr8_lrg.jpg jpg 419683 2445 2994 IMAGE-HIGH-RES 1-s2.0-S0926860X25001206-gr7_lrg.jpg https://s3-eu-west-1.amazonaws.com/prod-ucs-content-store-eu-west/content/pii:S0926860X25001206/HIGHRES/image/jpeg/3241bcbeba735541999619a5a97f74aa/gr7_lrg.jpg gr7 gr7_lrg.jpg jpg 213090 1357 2995 IMAGE-HIGH-RES 1-s2.0-S0926860X25001206-gr9_lrg.jpg https://s3-eu-west-1.amazonaws.com/prod-ucs-content-store-eu-west/content/pii:S0926860X25001206/HIGHRES/image/jpeg/72a7bb7c8c7b11e0e1b7fa5c58e1d05e/gr9_lrg.jpg gr9 gr9_lrg.jpg jpg 101397 1140 1499 IMAGE-HIGH-RES 1-s2.0-S0926860X25001206-gr2_lrg.jpg https://s3-eu-west-1.amazonaws.com/prod-ucs-content-store-eu-west/content/pii:S0926860X25001206/HIGHRES/image/jpeg/5613f886ef693d0be25e66d06a3e83bd/gr2_lrg.jpg gr2 gr2_lrg.jpg jpg 176250 1183 2993 IMAGE-HIGH-RES 1-s2.0-S0926860X25001206-ga1_lrg.jpg https://s3-eu-west-1.amazonaws.com/prod-ucs-content-store-eu-west/content/pii:S0926860X25001206/HIGHRES/image/jpeg/b90e3f7dc276fd474313a14b88041aed/ga1_lrg.jpg ga1 true ga1_lrg.jpg jpg 181579 886 1464 IMAGE-HIGH-RES 1-s2.0-S0926860X25001206-gr1_lrg.jpg https://s3-eu-west-1.amazonaws.com/prod-ucs-content-store-eu-west/content/pii:S0926860X25001206/HIGHRES/image/jpeg/3d57b935d65dbf6474a1fa0c73e5c503/gr1_lrg.jpg gr1 gr1_lrg.jpg jpg 70538 1132 1499 IMAGE-HIGH-RES 1-s2.0-S0926860X25001206-gr4_lrg.jpg https://s3-eu-west-1.amazonaws.com/prod-ucs-content-store-eu-west/content/pii:S0926860X25001309/HIGHRES/image/jpeg/b06c229e17004f470a377011a16c39b3/gr4_lrg.jpg gr4 gr4_lrg.jpg jpg 345994 2417 2994 IMAGE-HIGH-RES 1-s2.0-S0926860X25001206-gr3_lrg.jpg https://s3-eu-west-1.amazonaws.com/prod-ucs-content-store-eu-west/content/pii:S0926860X25001309/HIGHRES/image/jpeg/be94fad618909e3518941d8d61070f11/gr3_lrg.jpg gr3 gr3_lrg.jpg jpg 360545 2337 2995 IMAGE-HIGH-RES 1-s2.0-S0926860X25001206-mmc1.docx https://s3-eu-west-1.amazonaws.com/prod-ucs-content-store-eu-west/content/pii:S0926860X25001206/mmc1/MAIN/application/vnd.openxmlformats-officedocument.wordprocessingml.document/745ca9aab2f87ca6f5457c53c4ae9e5f/mmc1.docx mmc1 mmc1.docx docx 2183768 APPLICATION 1-s2.0-S0926860X25001206-si0001.svg https://s3-eu-west-1.amazonaws.com/prod-ucs-content-store-eu-west/content/pii:S0926860X25001206/image/svg+xml/a18ac019a05e2a62ece5447ca1323fce/si0001.svg si0001 si0001.svg svg 5730 ALTIMG 1-s2.0-S0926860X25001206-si0002.svg https://s3-eu-west-1.amazonaws.com/prod-ucs-content-store-eu-west/content/pii:S0926860X25001206/image/svg+xml/d815f053c35bc7009284bdda41212294/si0002.svg si0002 si0002.svg svg 5239 ALTIMG 1-s2.0-S0926860X25001206-si0003.svg https://s3-eu-west-1.amazonaws.com/prod-ucs-content-store-eu-west/content/pii:S0926860X25001206/image/svg+xml/6b57fee1b824475dcca220d6a7860a99/si0003.svg si0003 si0003.svg svg 6994 ALTIMG 1-s2.0-S0926860X25001206-si0004.svg https://s3-eu-west-1.amazonaws.com/prod-ucs-content-store-eu-west/content/pii:S0926860X25001206/image/svg+xml/3d67308b7425bc3660725399b7991c5c/si0004.svg si0004 si0004.svg svg 1272 ALTIMG APCATA 120219 120219 S0926-860X(25)00120-6 10.1016/j.apcata.2025.120219 Elsevier B.V. Fig. 1 Thermodynamic equilibrium of the dehydrogenation of MG to MGO, calculated by DFT method. Fig. 1 Fig. 2 Temperature dependent reaction results for the catalytic MG dehydrogenation to MGO over the 15Cu/SiO2-80AE (a, b) and 15Cu/SiO2-IWI (a) catalysts, using a WHSV of 1.0 gMG gcat −1 h−1. Fig. 2 Fig. 3 Effects of the preparation/activation parameters of Cu/SiO2-xAE catalysts on their performance for the catalytic dehydrogenation of MG to MGO. (a) AE temperature (x), (b) Calcination temperature, (c) Reduction temperature, and (d) Cu loading. Reaction conditions: 400 °C, WHSV of 1.0 gMG gcat −1 h−1. Fig. 3 Fig. 4 Structural and textural properties for the fresh 15Cu/SiO2-xAE (x = 70, 80, 90) and 15Cu/SiO2-IWI. (a) XRD patterns, (b) FT-IR spectra, (c) I 670/I 800 intensity ratio, calculated using the data deduced from the FT-IR spectra in (b), (d) N2 adsorption-desorption isotherms (inset: pore diameter distribution). Fig. 4 Fig. 5 H2-TPR profiles of the 15Cu/SiO2-xAE and 15Cu/SiO2-IWI catalysts. Fig. 5 Fig. 6 TEM images and Cu nanoparticle size distributions for the reduced catalysts of (a) 15Cu/SiO2-70AE, (b) 15Cu/SiO2-80AE, and (c) 15Cu/SiO2-90AE. Fig. 6 Fig. 7 Cu 2p XPS (a) and Cu LMM Auger (b) spectra of the reduced 15Cu/SiO2-xAE catalysts. Fig. 7 Fig. 8 In-situ DRIFTS spectra for the MG adsorption and desorption on the reduced catalysts of (a) 15Cu/SiO2-70AE, (b) 15Cu/SiO2-80AE, and (c) 15Cu/SiO2-90AE. Note: using a heating rate of 10 °C min−1 for MG desorption. (d) MG-TPSR profiles of H2 signal (m/z = 2) for the reduced 15Cu/SiO2-xAE catalysts. Fig. 8 Fig. 9 Reaction stability and regeneration test of the 15Cu/SiO2-80AE stability for the catalytic dehydrogenation of MG to MGO. Reaction conditions: 400 °C, WHSV of 1.0 gMG gcat −1 h−1. Regeneration conditions: calcination in air at 500 °C for 2 h, subsequent reduction in H2 at 300 °C for 1 h. Fig. 9 Dehydrogenation of methyl glycolate to methyl glyoxylate over a Cu/SiO2 catalyst Zixuan Gong Writing – original draft Investigation Formal analysis Conceptualization a 1 Hao Wang Validation Methodology Conceptualization a 1 Tian Lan Visualization Project administration a Zhongchen Ma Visualization Methodology a Shaolin Wang Methodology Formal analysis a Yong Lu Writing – review & editing Supervision Resources Funding acquisition a b ⁎ a State Key Laboratory of Petroleum Molecular & Process Engineering, Shanghai Key Laboratory of Green Chemistry and Chemical Processes, School of Chemistry and Molecular Engineering, East China Normal University, Shanghai 200062, China State Key Laboratory of Petroleum Molecular & Process Engineering, Shanghai Key Laboratory of Green Chemistry and Chemical Processes, School of Chemistry and Molecular Engineering, East China Normal University Shanghai 200062 China State Key Laboratory of Petroleum Molecular & Process Engineering, Shanghai Key Laboratory of Green Chemistry and Chemical Processes, School of Chemistry and Molecular Engineering, East China Normal University, Shanghai 200062, China b Institute of Eco-Chongming, Shanghai 202162, China Institute of Eco-Chongming Shanghai 202162 China Institute of Eco-Chongming, Shanghai 202162, China ⁎ Corresponding author at: State Key Laboratory of Petroleum Molecular & Process Engineering, Shanghai Key Laboratory of Green Chemistry and Chemical Processes, School of Chemistry and Molecular Engineering, East China Normal University, Shanghai 200062, China. State Key Laboratory of Petroleum Molecular & Process Engineering, Shanghai Key Laboratory of Green Chemistry and Chemical Processes, School of Chemistry and Molecular Engineering, East China Normal University Shanghai 200062 China 1 Equal contribution. Dehydrogenation of methyl glycolate (MG) is an attractive method for synthesizing methyl glyoxylate (MGO, an important high-value chemical and pharmaceutical intermediate), which is calling for a qualified catalyst. Cu/SiO2-AE catalysts were prepared via the ammonia evaporation method for the title reaction, showing the catalytic performance strongly dependent on their preparation/activation parameters as well as the reaction conditions. The preferable 15Cu/SiO2-80AE (15 wt% Cu-loading; AE-treatment at 80 °C; calcined at 500 °C) after H2-reduction at 300 °C achieved a high MG conversion of 38.5 % with MGO selectivity of 79.0 % at 400 °C. The Cu/SiO₂-AE catalyst demonstrates promising catalytic performance, achieving 38.5 % MG conversion with 79.0 % MGO selectivity at 400 °C. The Cu⁺/Cu⁰ ratio plays a crucial role in catalytic activity, as revealed by XPS, FTIR, and MG-TPSR. Deactivation mechanisms were studied, and catalyst regeneration was explored, offering insights for industrial application in green MGO synthesis. Graphical Abstract Keywords Methyl glycolate Methyl glyoxylate Dehydrogenation Cu catalyst Ammonia evaporation method Data availability No data was used for the research described in the article. 1 Introduction Methyl glyoxylate (MGO), an archetype of α-oxocarboxylates due to its simplest structural complexity, has become a significant role within the realms of chemical production and pharmaceutical synthesis [1,2]. In recent years, there has an ever-increasing demand for the MGO in application for efficient and effective synthesis of various high value-added chemicals, such as glyoxylic acid, cyclandelate, and Quinalphos MGO, which leads to a significant gap in the supply [3]. Hence, it is particularly desirable to render an efficient, low-cost and environmental-friendly method for the mass production of MGO. Traditional production of MGO is primarily constrained by the selection of raw materials and synthesis methods. Conventional MGO synthesis via selective oxidation of α-unsaturated carboxylates (e.g., acrylates) necessitates toxic oxidants (e.g., nitric acid, periodate, ozone, hydrogen peroxide) and produces hazardous waste [4–7]. In contrast, methyl glycolate (MG), in principle, can be efficiently converted to MGO through a straightforward dehydrogenation process. Specially, the MG can be synthesized via selective hydrogenation of dimethyl oxalate (DMO) [8], carbonylation-hydrolysis of acetaldehyde [9], and other methods [10–12]. Research on catalysts and industrial development have reached a mature stage, making MG a readily available and cost-effective raw material for the MGO synthesis. The dehydrogenation of alcohol molecules can be divided into two types: oxidative dehydrogenation and catalytic dehydrogenation. Recently, Wang et al. [13] made progress on the oxidative dehydrogenation of methyl glycolate (MG) to produce MGO over a hydroxyl-deficient α‑Fe2O3 catalyst using the O2 molecule, achieving a high intrinsic activity of 0.26 gMG gcat −1 h−1. The suggested dehydrogenation pathway obviates the requirement for stoichiometric oxidants, thus reducing wastewater production compared to the existing methods. However, the highly unsaturated nature of the MG molecule results in a significant tendency to over-oxidation, even achieving a CO2 selectivity of 8 % under the most favorable conditions [13]. This significantly diminishes the atomic economy of the MG-to-MGO process, conflicting with the principles of green chemistry and today's carbon neutrality targets [14,15]. Consequently, the catalytic dehydrogenation of MG stands out as a more promising approach for the synthesis of MGO, but is urgently calling for a qualified catalyst. Catalysts for gas-phase alcohol dehydrogenation can be classified into two categories: those comprising noble metals and those comprising transition metals. The noble catalysts (e.g., Pd, Ru, Rh, Ag, Au) exhibited exemplary performance in alcohol dehydrogenation, yet their high cost represents a considerable obstacle to their broader implementation [16–21]. The copper-based catalysts have gained considerable acceptance in the conversion of alcohols to their corresponding aldehydes, due to their exceptional ability to cleave O−H and C−H bonds while remaining inert towards C−C bond dissociation [22–25]. Wang et al. [26] synthesized highly dispersed Cu/γ-Al2O3 catalysts via the initial wetness impregnation method for the dehydrogenation of 5-hydroxymethylfurfural (HMF) to 2,5-diformylfuran (DFF), resulting in 69.8 % conversion of HMF and 44.9 % yield of DFF at 130 °C. Luo et al. [27] developed a Cu/Al@SBA-15 catalyst with high CuO dispersion and small particle size through a bimetallic synergistic effect, enabling the efficient dehydrogenation coupling of o-aminophenol and benzyl alcohol to produce benzothiazoles with yield up to 99 % at 110 °C. Zhang et al. [28] synthesized a hierarchical echinus-like Cu-MFI-AE catalyst for the catalytic dehydrogenation of ethanol, being capable of converting 97 % ethanol into acetaldehyde with 93 % selectivity while showing good activity/selectivity maintenance throughout 500 h test at 250 °C using a weight hourly space velocity (WHSV) of 0.53 h−1. Jiang et al. [29] used a complexation-impregnation method to prepare an active and stable silica-encapsulated nano Cu catalyst (Cu@SiO2/SiO2) for the gas-phase dehydrogenation of 1,6-hexanediol (1,6-HDO) to ε-caprolactone (ε-CL), which achieves 95.3 % 1,6-HDO conversion with 80 % ε-CL selectivity and is stable for at least 100 h. Xiao et al. [30] synthesized a Cu/SiO2 catalyst with plentiful Cu0/Cu+ interfaces via the hydrolysis-precipitation method for potential use in the direct dehydrogenation of ethyl lactate to ethyl pyruvate, showing that the intrinsic activity of such catalyst is almost linearly increased with the Cu0/Cu+ interface length. With regard to the catalytic dehydrogenation mechanism of the Cu-base catalysts, a minority viewpoint posits that the activity for the catalytic dehydrogenation of alcohols is commensurate with the proportion of the monophase copper [31,32]. The prevailing view is that the synergistic effect between the Cu+ and Cu0 species significantly enhances the catalytic activity for the dehydrogenation of alcohols. Specifically, Cu+ plays a key role in absorbing alcohol and weakening O−H to facilitate its cleavage while dissociating the α-C−H with the aid of Cu0 to produce CO [28,33,34]; the H atoms formed in the aforementioned steps will migrate to Cu0 via spillover and subsequently bonds together to H2 [35–37]. Such new insights on the synergistic catalytic mechanism of copper-based catalysts for the alcohol dehydrogenation shed a light on design and tailoring of a highly effective dehydrogenation catalyst. The ammonia evaporation (AE) method yields Cu/SiO₂ catalysts with an optimized Cu⁺/Cu⁰ ratio [38]. This method has been successfully commercialized for the hydrogenation of dimethyl oxalate (DMO) to ethylene glycol (EG), making it a promising candidate for MGO synthesis. In the light of this, it seems prudent to investigate the potential of employing a Cu-based catalyst of the kind described in the title reaction. To accomplish this goal, a series of Cu/SiO2 catalysts were synthesized by the ammonia evaporation method with varied Cu-loading and AE temperature and examined in the dehydrogenation of MG to MGO reaction. The resulting catalysts showed catalytic performance strongly dependent on their preparation/activation parameters as well as the reaction conditions. The catalysts were carefully characterized by means such as X-ray photoelectron spectroscopy (XPS), infrared spectroscopy for MG adsorption-desorption, and temperature-programmed surface reaction with MG (MG-TPSR), to gain insight into the mechanism of Cu+/Cu0 involved synergistic catalysis in the MG dehydrogenation to MGO reaction. The Cu+ sites were responsible for the adsorption/activation of MG and the Cu0 sites facilitated the hydrogen formation, while an optimal Cu+/Cu0 ratio was a guarantee for the Cu+ and Cu0 working in a highly synergistic manner. 2 Experimental 2.1 Catalyst preparation 2.1.1 Materials The Cu(NO3)3·3 H2O (99 wt% purity) and 25–28 wt% ammonia solution were purchased from Sinopharm Chemical Reagent Co., Ltd. The SiO2 was purchased from Aldrich Co., Ltd. All chemicals were directly used as received without further treatment. 2.1.2 Catalyst synthesis The Cu/SiO2 catalysts were synthesized by the ammonia evaporation method [28]. Taking the synthesis of catalysts with 15 % copper loading as an example, Cu(NO3)2·3 H2O of 1.877 g was dissolved into 50 mL deionized water, followed by adjusting the solution pH to 11 by dropwise adding 25–28 wt% ammonia solution under vigorous stirring. After that, SiO2 of 2 g was added into the as-obtained copper ammonia solution at room temperature while holding stirring for 30 min. The resulting suspension underwent ammonia evaporation under stirring at 70, 80, and 90 °C. The evaporation process was terminated until the pH reached 6–7. The mixture was then filtered and washed three times with deionized water. The filter cake was dried overnight at 120 °C and calcined in air at 500 °C for 4 h to obtained the catalyst product. As-synthesized catalysts were denoted as 15Cu/SiO2-xAE, where x represents the evaporation temperature and AE stands for the ammonia evaporation. For comparison, a 15Cu/SiO2-IWI catalyst with Cu loading of 15 wt% was prepared by the incipient wetness impregnation (IWI) method, followed by drying overnight at 120 °C and calcining in air at 500 °C for 4 h. The rationale behind the utilization of the IWI method for the preparation of a contrastive catalyst is attributable to two key factors: its simplicity and its cost-effectiveness in industrial contexts. 2.2 Catalyst characterization X-ray powder diffraction (XRD) patterns were acquired on a Rigaku Ultima IV diffractometer (Japan) from 10 to 80° at a 2θ scanning speed of 10° min−1, using Cu Kα radiation (λ = 1.542 nm) generated at 30 kV and 25 mA. Nitrogen adsorption-desorption measurements were carried out on a BELSORP-MAX gas adsorption analyzer at −196 °C to determine the specific surface area (SSA) and porosity of the prepared catalysts. Transmission electron microscopy (TEM, JEOL JEM-2100F, Japan) was used to investigate the morphological and nano-structural features of the catalysts. Inductively coupled plasma-atomic emission spectroscopy (ICP-AES) was performed for quantitative determination of the Cu loading in the catalysts on a Thermo IRIS Intrepid IIXSP ICP spectrometer (USA). X-ray photoelectron spectroscopy (XPS) and Auger electron spectroscopy (AES) were used to characterize the valence state of surface Cu species in catalysts. Both the XPS and Auger spectra were acquired on an AXIS SUPRA spectrometer (Kratos Analytical Inc.) with monochromatic Al Kα radiation at 1486.69 eV (300 W), using an analyzer pass energy of 40.0 eV. The binding energies were calibrated by C 1 s core level of the contaminated carbon at 284.8 eV. Prior to the XPS analyses, all samples were pre-treated with H2 gas flow at 300 °C for 1 h in the pretreatment chamber connected with the XPS chamber. H2-temperature programmed reduction (H2-TPR) and MG-temperature programmed surface reaction (MG-TPSR) were all conducted on a TP 5080 adsorption/desorption instrument (Xianquan Industrial and Trading Co. Ltd., China) equiped with a thermal conductivity detector (TCD) and an online mass spectrometer (Proline Dycor, AMETEK Process Instrument, USA). The H2-TPR profiles were acquired using the TCD by heating the fresh catalyst sample (0.1 g) in a 10 % H2/N2 carrier gas (30 mL min−1) from 25 to 500 °C at a heating rate of 10 °C min−1. For the MG-TPSR, the catalyst sample was firstly reduced in a H2 flow (30 mL min−1) at 300 °C for 1 h (if not specified) and then cooled down to 20 °C. The resulting sample was then transferred into a round-bottom flask that had been thoroughly purged with argon and filled with 5 mL of MG. After soaking the catalyst in the MG liquid, the sample was evacuated at 60 °C for 1 h to ensure the thorough removal of any excess MG, including that physically adsorbed on the sample surface. Such sample of 0.1 g was taken and packed into the quartz tube reactor of the TP 5080 adsorption/desorption instrument, followed by purging for 1 h with He. Finally, the MG-TPSR was carried out in a He flow (30 mL min−1) from 20 to 450 °C at a heating rate of 10 °C min−1 while the effluents were detected by the on-line MS spectrometer to monitor the dehydrogenation of pre-adsorbed MG on the catalyst surface against the temperature. Diffuse reflectance infrared Fourier transform spectroscopy (DRIFTS) experiments on MG adsorption-desorption were conducted on a Nicolet Nexus 670 spectrometer (USA), equipped with a mercury-cadmium-telluride (MCT) detector and a high temperature transmission cell rigged with CaF2 windows. The catalysts diluted in KBr (catalyst/KBr mass ratio was 1:1) were pressed to be a wafer, placed into the cell chamber, reduced with H2 (30 mL min−1) at 300 °C for 1 h, and cooled down to 25 °C in a N2 flow while taking a reference spectrum. For the MG adsorption, a N2 flow saturated with MG vapor by bubbling method at room temperature was introduced into the cell chamber to pass through the catalyst wafer for 30 min, followed by purging for 30 min with N2 to remove the gaseous MG. After that, the FT-IR spectra were acquired continuously to capture the dynamic change of the MG molecule pre-adsorbed on the catalyst wafer with rising temperature from 25 to 400 °C. This was accomplished by collecting 64 scans per spectrum at a resolution of 4 cm−1. Carbon deposition on the spent catalyst was measured by thermogravimetric analysis (TGA) on a Rigaku Thermo plus Evo TG 8120 instrument. Briefly, the spent catalyst sample (10 mg) was heated from 25 to 800 °C at a rate of 10 °C min−1 in an air flow (30 mL min−1). 2.3 Catalyst evaluation Anaerobic catalytic dehydrogenation of MG was performed in an electrically heated fixed-bed quartz tubular reactor (8 mm i.d.,700 mm length) at 340–400 °C, using a weight hourly space velocity (WHSV) of 1.0 gMG gcat −1 h−1. The mixture of 0.4 g Cu/SiO2-xAE catalyst (100–125 μm) and 0.4 g quartz sand (100–125 μm) was loaded into the reactor and kept in place by placing quartz wool at both ends. Before the catalytic evaluation, the catalyst was reduced with H2 at 300 °C for 1 h. The MG, together with a N2 flow controlled by a mass flow controller, was introduced into the reactor via a peristaltic pump (Fire Track, 102S/R, USA). The liquid effluent captured by a cold trap (5 °C) was analyzed using a Shimadzu 2014 C gas chromatograph fitted with a 30 m HP-INNO-Wax capillary column (DIMKA) and a flame ionization detector (FID). Given the fact that no carbon-containing gaseous products were detected in the off-gas from the reactor, the MG conversion and product distribution were calculated based on the equations defined as follows: (1) Conversion MG ( % ) = n MG , 0 − ∑ n MG − i ( i = MGO , GA , MMOA , DMDG ) n MG , 0 × 100 % (2) Selectivity i ( i = MGO , GA , MMOA , DMDG ) ( % ) = n MG − i ∑ n MG − i × 100 % where n MG,0 is molar amount of intake MG, n MG-i is molar amount of MG converted into i (i = MGO (Methyl glyoxylate), GA (glycolic acid), MMOA (Methyl Methoxyacetate), or DMDG (Dimethyl Diglycolate)). The reaction rate was calculated based on the following equation: (3) Reaction rate ( mol MGO g Cu − 1 h − 1 ) = WHSV × Conversion MG × Selectivity MGO n MGO , 0 * Cu loading Regenerability of the spent catalysts was also investigated. In brief, the spent catalysts were calcined in air at 500 °C for 1 h and subsequently reduced with H2 at 300 °C for 1 h. The regenerated catalysts were examined in the title reaction under identical reaction conditions. 2.4 Density functional theory (DFT) calculations Considering the lack of thermodynamic parameters (i.e., standard enthalpies of formation (H0), standard entropy ( S m θ ), etc.) of the MG and MGO molecules, a simple quantum chemistry calculation was conducted for a preliminary understanding of the thermodynamic equilibrium of the dehydrogenation of MG to MGO reaction. The structures of MG and MGO molecules (Fig. S1) were built in Gaussian View 5.0 and the calculations were conducted employing the Gaussian 16 program package [39], including a structure optimization and frequency calculation using B3LYP method and 6–31 G* basis [40], as well as a zero point energy calculation using CCSD(T) method. The fundamental thermodynamic parameters were analyzed by the Shermo code [41] to obtain the Gibbs free energy change (ΔG) and MG equilibrium conversion. 3 Results and discussion 3.1 DFT calculation of thermodynamic equilibrium As shown in Fig. 1, the anaerobic catalytic dehydrogenation of MG to MGO is thermodynamically unfavorable when considered in the context of the positive ΔG. The ΔG decreases linearly with rising the temperature, in association with an obvious increase of the MG equilibrium conversion, indicating that this reaction becomes favorable at elevated temperatures. However, undesirable side reactions such as pyrolysis and condensation will tend to occur if implementing the reaction at excessively high temperatures. Therefore, a qualified catalyst for this reaction should be active and selective at relatively low temperatures. 3.2 Catalytic performance Indeed, pyrolysis of the reagent and products became unacceptably serious at or over 420 °C (not shown). In the present work, therefore, the catalyst evaluation was carried out at temperature in range from 340 to 400 °C using the representative 15Cu/SiO2-80AE (15 wt% Cu loading; AE treatment at 80 °C; calcined at 500 °C) and Cu/SiO2-IWI for comparison. In Fig. 2a, the reaction results for their catalytic dehydrogenation of MG are plotted against the reaction temperature. As can be seen, the contrastive Cu/SiO2-IWI catalyst was completely inert for this reaction in the whole temperature range studied. In contrast, over our Cu/SiO2-80AE catalyst the MG conversion and MGO yield showed almost a linearly upward trend with rising temperature from 340 to 400 °C. Moreover, the effect of reaction temperature was studied on the product distribution resulting from the MG dehydrogenation catalyzed by the 15Cu/SiO2-80AE (Fig. 2b). The MGO selectivity was increased progressively from 57.3 % to 79.0 % with rising temperature from 340 to 400 °C in association with the increase in the MG conversion from 14.2 % to 38.5 %. Undesirable byproducts were also inevitably yielded, including methyl methoxyacetate (MMOA), dimethyl diglycolate (DMDG), and glycolic acid (GA). The possible side reaction pathways were summarized in Fig. S2. The MMOA and DMDG are from the etherification reaction on the acidic sites [42], GA is a hydrolysis product [43], and glycolide (GC) is a self-condensation product of MG [44]. As shown in Fig. 2b, the GA formation was markedly suppressed (selectivity declined from 31.3 % to 7.0 %) with rising temperature from 340 to 400 °C whereas the MMOA and DMDG formation was oppositely increased slightly. Fig. 3 shows the effects of the preparation/activation parameters of Cu/SiO2-xAE catalysts on their performance for the catalytic dehydrogenation of MG to MGO. The MG conversion and MGO selectivity both showed a volcano-shaped evolution against the AE temperature (x, from 70 to 100 °C), Cu-loading (from 7.5 wt% to 30 wt%), calcination temperature (from 300 to 600 °C), and H2-reduction temperature (from 200 to 400 °C). The MG conversion and MGO selectivity achieved top over the 15Cu/SiO2-80AE catalyst with a Cu-loading of 15 wt%, which was obtained after AE-treating at 80 °C, calcining at 500 °C, and subsequently reducing with H2 at 300 °C. The catalyst preparation parameters lower or higher than the optimal values (i.e., 15 wt% Cu-loading, AE-temperature of 80 °C, calcination temperature of 500 °C, and reduction temperature of 300 °C) made the catalysts favorable for the formation of byproducts (Fig. 3), because of the negative impacts such as difficult reduction, decreased Cu dispersion, and unsuitable Cu+/Cu0 ratio (to see posterior sections). As well known, the Cu/SiO2 synthesized by AE method is characteristic of the copper phyllosilicate (Cu2Si2O5(OH)2, a copper silicate with lamellar structure). In combining this information with the fact that the Cu/SiO2-IWI was inactive for the catalytic dehydrogenation of MG to MGO (Fig. 2), it is reasonably safe to say that the copper phyllosilicate played a vital role in deriving highly active sites for this reaction. Among the catalyst preparation/activation parameters studied, the formation of copper phyllosilicate was governed by the AE temperature. Therefore, the further exploration herein was focused on the structural and chemical origin of AE temperature (x) dependent catalytic performance of the 15Cu/SiO2-xAE catalysts. 3.3 Structural and textural properties Fig. 4a shows the XRD patterns of fresh 15Cu/SiO2-xAE (x = 70, 80, 90) and 15Cu/SiO2-IWI catalysts. The 15Cu/SiO2-xAE catalysts all exhibited broad and weak peaks at 2θ of 30.8°, 35.0°, 57.5° and 62.4°, being assigned to the copper phyllosilicate (JCPDS #27–0188). In contrast, very strong CuO diffraction peaks (JCPDS #48–1548) were detected for the 15Cu/SiO2-IWI. A broad peak of amorphous silica was detected at 2θ of about 21.2° on all catalysts. Moreover, irregular needle-like structures in the TEM images of the 15Cu/SiO2-xAE, being indicative of formation of the copper phyllosilicate (Fig. S3) [38]. Fig. 4b shows the FT-IR spectra of the 15Cu/SiO2-xAE catalysts, in which the characteristic band assigned to the vibrational mode of O−H bonds (δO−H) in the copper phyllosilicate was detected at 670 cm−1 [45,46] in association with two broad bands at 1100 cm−1 and 800 cm−1 for the asymmetric and symmetric stretching of Si−O bonds in SiO2. According to the report by Toupance et al. [45], the relative amount of copper phyllosilicates in the Cu/SiO2 can be measured by calculating the ratio of the intensity of the δO−H band at 670 cm−1 to that of the νSi−O band at 800 cm−1 (I 670/I 800). In Fig. 4c, the I 670/I 800 was plotted against the 15Cu/SiO2-xAE and 15Cu/SiO2-IWI catalysts, showing that rising the AE-temperature in range studied was conducive to the formation of copper phyllosilicate while no copper phyllosilicate was presented in the 15Cu/SiO2-IWI. The textural properties were measured by nitrogen adsorption/desorption, with the results shown in Fig. 4d and Table S1. As can be seen, our 15Cu/SiO2-xAE all showed high S BET (419–433 m2 g−1) and similar type IV nitrogen adsorption-desorption isotherms with H3-type hysteresis loops at P/P0 = 0.6–1.0, indicating the presence of agglomerates of plate-like particles thereby leading to formation of slit-shaped mesopores with BJH pore size of ∼25 nm (inset in Fig. 4d). However, the 15Cu/SiO2-IWI with a S BET of 189 m2 g−1 also showed type IV nitrogen adsorption-desorption isotherms with H3-type hysteresis loops at P/P0 = 0.8–1.0 and large BJH pore size of over 100 nm (Fig. S4; Table S1). 3.4 Reducibility and surface Cu+/Cu0 pair As previously noted, the formation of copper phyllosilicate enhances the interaction between copper ions and SiO2 support, facilitating the selective reduction of Cu2+ to Cu+ [47,48]. The coexistence of Cu0 and Cu+ in the catalyst is considered to be a synergistic catalytic active site for hydrogenation and dehydrogenation reactions [28,33–37]. Thus, the reduction behavior of our 15Cu/SiO2-xAE was investigated by using H2-TPR as well as the 15Cu/SiO2-IWI for comparison, with the results shown in Fig. 5. In the H2-TPR profile for each 15Cu/SiO2-xAE sample, a large H2 consumption peak was observed at below 200 °C in association with a very small peak centered at ∼240 °C, being assigned to the stepwise reduction (Cu2+→Cu+→Cu0) of the copper phyllosilicate (Fig. 4a-c) and some other copper oxide such as bulk CuO, respectively. The contrastive 15Cu/SiO2-IWI showed a single H2 consumption peak centered at 206 °C, being assigned to the CuO dispersed on the SiO2 [47]. Notably, a split evolution of the H2 consumption peak was observed for the reduction of copper phyllosilicate in the 15Cu/SiO2-xAE (Fig. 5). The extent of peak splitting was observed to reach its maximum when the AE temperature (x) was increased from 70 to 80 °C. However, a further increase of 10 °C in the AE temperature resulted in a reduction in the degree of peak splitting. The above observation indicated that the further reduction of Cu+ species to Cu0 became relatively difficult in case of the 15Cu/SiO2-80AE in comparison with the 15Cu/SiO2-70AE and -90AE samples. Thus, the Cu+ species in the 15Cu/SiO2-80AE is more stable. The TEM images of the 15Cu/SiO2-xAE catalysts after H2-reduction at 300 °C are illustrated in Fig. 6, showing that the Cu particles were sized at ∼4 nm (being consistent to that from XRD measurement, Table S2). By comparison, the Cu particles seemed to be dispersed on the SiO2 more uniformly for the 15Cu/SiO2-80AE. In addition, the 15Cu/SiO2-xAE catalysts showed quite similar textural properties (S BET: 284–290 m2 g−1, V p: 0.60–0.71 cm3 g−1; Table S2). In contrast, the reduced 15Cu/SiO2-IWI catalyst was featured by a large Cu particle size of ∼15 nm and a small S BET of 167 m2 g−1 but a large V p of 0.91 cm3 g−1 (Table S2). The chemical state of surface Cu species for the reduced 15Cu/SiO2-xAE catalysts was analyzed by XPS/AES spectroscopy, with the results shown in Fig. 7. On the surfaces of all three reduced 15Cu/SiO2-xAE catalysts, two clear peaks at binding energy (B.E.) of 932.9 eV (Cu 2p3/2) and 952.6 eV (Cu 2p1/2) were detected in their Cu 2p XPS spectra, being assigned to both Cu0 and Cu+ species (indistinguishable); besides, a quite weak satellite peak at about 944.4 eV was also detectable (Fig. 7a), being ascribed to the cuprous oxide [49]. Although the Cu0 and Cu+ species were unable to be distinguished by XPS, two clear peaks at kinetic energy (K.E.) of 915.6 eV (Cu0) and 912.1 eV (Cu+) [50,51] could be detected in their Cu LMM Auger spectra (Fig. 7b). The ratio of Cu+ to Cu0 (Cu+/Cu0) on the surfaces of the reduced 15Cu/SiO2-xAE catalysts was calculated to be 0.37 (x = 70), 0.43 (x = 80), and 0.65 (x = 90), using the corresponding peak areas deduced from the Auger spectra (Fig. 7b). Of interest is that the apparent reaction rate appears to be well-correlated with the Cu+/Cu0 ratio, suggesting that an optimal Cu+/Cu0 ratio is critical for achieving a high reaction rate (Fig. S5). Note that the reduced 15Cu/SiO2-80AE catalyst achieved an appropriate Cu+/Cu0 ratio close to 0.5, that might be the reason why the 15Cu/SiO2-80AE catalyst achieved the activity/selectivity for the dehydrogenation of MG to MGO reaction superior over the 15Cu/SiO2-70AE and -90AE catalysts (Fig. 2b). Not surprisingly, no any Cu+ species were detected on the surface of the reduced 15Cu/SiO2-IWI (Fig. S6, Table S2), being in line with its inertness in this reaction (Fig. 2a). On the basis of above results, we are confident that the Cu+/Cu0 pair showed synergistic catalysis for the dehydrogenation of MG to MGO reaction over a Cu/SiO2 catalyst. 3.5 Insight into the synergistic catalysis of Cu+/Cu0 pair It is plausible that the dehydrogenation of MG to MGO reaction catalyzed by our 15Cu/SiO2-xAE proceeded via an analogous mechanism previously reported for the dehydrogenation of ethyl lactate to ethyl pyruvate over a Cu-based catalyst [30]. In that case, the Cu+ was responsible for the O−H cleavage and subsequent α-C−H cleavage while the Cu0 served as the receptor of H atoms (from O−H and C−H cleaved on Cu+) and charged the bonding of them to form H2 [30]. To check this speculation, in-situ DRIFTS experiments on MG adsorption and desorption were performed to monitor the interaction with the Cu+/Cu0 pair. Fig. S7 shows the DRIFTS spectra of MG adsorption on the reduced 15Cu/SiO2-xAE catalysts. After saturation adsorption of MG at 25 °C, a strong IR band appeared at ∼1754 cm−1, due to the vibration of CO bond in the ester group of the adsorbed MG molecule. Besides, the νs(O−H) and ν(C−H) vibrational bands of the adsorbed MG molecule were detected on all three 15Cu/SiO2-xAE catalysts, evidenced by the broad band appeared at 3640–3050 cm−1 and the several sharp bands in range of 3020–2840 cm−1 [13]. Interestingly, the adsorption amount of MG on the 15Cu/SiO2-xAE catalysts showed an upward trend with rising the AE temperature (x) from 70 to 90 °C, being in line with their Cu+/Cu0 ratio (Fig. 7b, Table S2). This observation indicated that the adsorption of MG molecule took place on the Cu+ species, being in good agreement with the report for the ethyl lactate (having an analogous molecule structure) adsorption on a Cu/SiO2 [30]. The DRIFTS spectra were then acquired by heating the 15Cu/SiO2-xAE catalysts with adsorbed MG molecule in a N2 carrier gas, with the results shown in Fig. 8. On all three 15Cu/SiO2-xAE catalysts, adsorbed MG molecule showed a quite similar desorption evolution against the temperature, which implied the interaction of MG with the Cu+/Cu0 pair. With rising the temperature, the νs(O−H) and ν(C−H) vibrational bands were weakened, indicating that the cleavage of the O−H and C−H bonds of the adsorbed MG proceeded on the Cu+/Cu0 pair to form CO. It is not surprising that the ν(CO) vibrational band stemmed from both aldehyde group and ester group showed a marked decline with rising the temperature, because dehydrogenation of MG to MGO as well as their desorption and leaving with N2 carrier gas became more and more favorable. Notably, the IR signals relevant to MG and MGO became almost undetectable at above 250 °C in case of the 15Cu/SiO2-70AE, reasonably due to the less Cu+ sites (Cu+/Cu0 ratio of only 0.37, Table S2) for MG adsorption (Fig. 8a). With the increase in the Cu+/Cu0 ratio, the adsorption strength of MG increases; notably, the vibrational IR bands disappear at 150 °C for the 15Cu/SiO2-80AE, whereas they could persist up to 250 °C for the 15Cu/SiO2-90AE (Fig. 8b,c, and Table S2). On the 15Cu/SiO2-80AE with a moderate Cu+/Cu0 ratio of 0.43 (Table S2), more MG was adsorbed than on the 15Cu/SiO2-70AE (Fig. S7) but the νs(O−H) and ν(C−H) vibrational bands disappeared at only 150 °C (Fig. 8a). On the 15Cu/SiO2-90AE with a high Cu+/Cu0 ratio of 0.65 (Table S2), the νs(O−H) vibrational band was still detected at 250 °C while the ν(C−H) bond even at 400 °C. In addition, MG-TPSR experiments were carried out to monitor the MG dehydrogenation over the 15Cu/SiO2-xAE catalysts, with the H2-MS signal evolutions also shown in Fig. 8d. As expected, the 15Cu/SiO2-80AE showed a H2-MS signal curve with a bigger slope in association with a lower initial temperature for H2 generation, in comparison with the 15Cu/SiO2-70AE and -90AE. The above results confirmed again the synergistic catalysis of Cu+/Cu0 pair in the catalytic dehydrogenation of MG to MGO reaction, that is, the O−H and α-C−H of MG molecule was stepwise cleaved on the Cu+ while formed H atoms were transferred onto Cu0 and bonded to form H2. This finding is in line with other study on the Cu/SiO2 catalysts for dimethyl oxalate (DMO) hydrogenation [38]. In that study [38], the yield of ethylene glycol reached its highest point when there was a Cu+/Cu0 ratio of 0.54, indicating that an appropriate Cu+/Cu0 ratio is responsible for high reaction activity. In accordance, it is easy to understand why the 15Cu/SiO2-80AE achieved superior catalytic performance for this reaction over the two others. In nature, this catalyst possessed an appropriate Cu+/Cu0 ratio (0.43) thereby leading to a good balance between the Cu+-mediated cleavage of O−H and α-C−H and Cu0-mediated reception and bonding of H atoms. Proposed reaction mechanism diagram is shown in Fig. S8. A too low Cu+/Cu0 ratio signified a poor adsorption capacity of MG while a too high Cu+/Cu0 ratio made Cu0 site not enough to take over and bond the H atoms in time. In other word, under such scenarios (for example, 15Cu/SiO2-70AE and -90AE) it is difficult to achieve optimal synergistic catalysis thereby showing an unsatisfying catalytic performance. 3.6 Deactivation and regeneration The catalyst stability, an important consideration for a heterogeneous catalyst in practical application, was tested in this reaction using the 15Cu/SiO2-80AE at 400 °C and a WHSV of 1.0 gMG gcat −1 h−1. As we can see from Fig. 9, the MG conversion and MGO selectivity both showed a fast decline within 10 h of running, dropping from 36.4 % and 78.1 to 21.5 % and 70.6 %. The reaction was then aborted and the spent catalyst was calcined in an air flow at 500 °C for 2 h and subsequently reduced in a H2 flow at 300 °C for 1 h. After that, second reaction test was performed to evaluate the catalyst regenerability. By air oxidation and subsequent H2 reduction, the spent catalyst could be fully recovered to its initial activity/selectivity level whereas it still experienced a similar fast deactivation within another 10 h of running. A third regeneration-reaction cycle was performed, showing a similarity of the conversion/selectivity evolution against the time on stream. To gain insight into the cause of catalyst deactivation, the used 15Cu/SiO2-80AE catalyst (i.e., that in Fig. 9) was characterized by XRD, TEM, AES, XPS, TGA, and DRIFTS, with the results shown in Figs. S9-S11. As we can see from Fig. S9a, a strong XRD pattern consisting of characteristic peaks for metallic Cu at 2θ of 43.2°, 50.4°, and 74.1° was detected (PDF #99–0034); the Cu particle was grown from 4.1 nm (freshly reduced, Table S2) to 4.7 nm after only 10 h reaction. The Cu particle size was also detected by TEM (Fig. S10) to be 4.7 nm for the used 15Cu/SiO2-80AE catalyst (being consistent to that (4.7 nm) by XRD measurement). Such slight growth of Cu paricles led to a slight decrease of the copper dispersion from 25.0 % to 21.3 % (Table S2). No Cu2+ species were detected by XPS on the surface of the used 15Cu/SiO2-80AE catalyst (Fig. S11), but the Auger spectrum in Fig. S9b showed that the Cu0 species were much more than the Cu+ species on the surface of such used catalyst while deducing a low Cu+/Cu0 ratio of 0.24 (almost a half of that (0.43, Table S2) before used). The above results indicated that slight sintering of Cu nanoparticles took place as well as the obvious reduction of Cu+ species. Moreover, severe coking also inevitably occurred on such catalyst, reaching a high coke amount of 7.9 wt% even after 10 h of running (Fig. S9c). In the DRIFTS spectra of the used catalyst (Fig. S9d), a series of bands were detected at 3750–3150 (O−H), 2962 (C−H), 1810–1700 (CO), and 1670–1560 (CC) cm−1, most likely due to the condensation of MG with MGO and aromatization [52–54]. In sum, rapid deactivation of such catalyst was caused by the reduction of Cu+ species, sintering of Cu nanoparticles, and ease of coking. Note that the spent catalysts could be recovered fully by air-oxidation and subsequent H2-reduction. 4 Conclusions The catalytic dehydrogenation of MG is an attractive route for the synthesis of MGO, but lack of qualified catalyst presents a grand challenge. Promising Cu/SiO2 catalysts have been developed for this reaction process, which are obtained by the ammonia evaporation method. The catalyst performance is found to be strongly dependent on their preparation and activation parameters as well as the reaction conditions, which is closely related to the Cu+/Cu0 ratio in the catalysts. The standout catalyst is the one with 15 wt% Cu loading, obtained by ammonia evaporation at 80 °C after calcining in air at 500 °C and subsequently reducing in H2 at 300 °C. Over this catalyst, a high MG conversion of 38.5 % is achieved with a MGO selectivity of 79.0 % at 400 °C and a WHSV of 1.0 gMG gcat −1 h−1. This catalyst achieves an optimal Cu+/Cu0 ratio of 0.43, which facilitates the balance between the Cu+-mediated cleavage of O−H and α-C−H and Cu0-mediated reception and bonding of H atoms. A Cu+/Cu0 ratio that is too low resulted in a diminished adsorption capacity for MG, while a ratio that is too high prevented the Cu0 site from effectively taking over and bonding of H atoms. Such catalyst is rapidly deactivated against the time on stream, which is mainly caused by the reduction of Cu+ species, Cu sintering, and coking. By air oxidation and subsequent H2 reduction, the catalytic performance of spent catalysts can be restored to its initial level. This study opens up new ways for the preparation of MGO while our findings will shed a light on rational design of more advanced catalysts for this reaction process. The Cu/SiO2-AE catalyst demonstrates potential in the dehydrogenation of MG to MGO. This catalytic approach adheres to green chemistry principles by eliminating the need for hazardous oxidants, thus offering a potentially environmentally friendly synthetic pathway for MGO production. Subsequent endeavors should concentrate on the development of low-temperature active/selective, coking-resistant catalysts for this reaction, with the objective of achieving a seamless transition to the large-scale production of MGO. CRediT authorship contribution statement Lan Tian: Visualization, Project administration. Wang Hao: Validation, Methodology, Conceptualization. Gong Zixuan: Writing – original draft, Investigation, Formal analysis, Conceptualization. Lu Yong: Writing – review & editing, Supervision, Resources, Funding acquisition. Wang Shaolin: Methodology, Formal analysis. Ma Zhongchen: Visualization, Methodology. Declaration of Competing Interest The authors declare that they have no known competing financial interests or personal relationships that could have appeared to influence the work reported in this paper. Acknowledgments We gratefully acknowledge funding supports from the National Natural Science Foundation of China (22272053, 22072043), the National Key Research and Development Program of China (2023YFA1507903) from the Ministry of Science and Technology of People’s Republic of China, and the Research Funds of Happiness Flower ECNU (2020ST2203). Appendix A Supporting information Supplementary data associated with this article can be found in the online version at doi:10.1016/j.apcata.2025.120219. Appendix A Supplementary material Supplementary material References [1] B. Jakob I. Slimani A. Diehl N. Hamdi G. Manolikakes Palladium-catalyzed decarboxylative 1,2-addition of carboxylic acids to glyoxylic acid esters Eur. J. Org. Chem. 2021 2021 6340 6346 10.1002/ejoc.202100919 B. Jakob, I. Slimani, A. Diehl, N. Hamdi, G. Manolikakes, Palladium-catalyzed decarboxylative 1,2-addition of carboxylic acids to glyoxylic acid esters, Eur. J. Org. Chem. 2021 (2021) 6340-6346. https://doi.org/10.1002/ejoc.202100919 [2] B. Fan J. Trant A. Wong E. Gillies Polyglyoxylates: a versatile class of triggerable self-immolative polymers from readily accessible monomers J. Am. Chem. Soc. 136 2014 10116 10123 10.1021/ja504727u B. Fan, J. Trant, A. Wong, E. Gillies, Polyglyoxylates: A versatile class of triggerable self-immolative polymers from readily accessible monomers, J. Am. Chem. Soc. 136 (2014) 10116-10123. https://doi.org/10.1021/ja504727u [3] K. Niu P. Zhou L. Ding Y. Hao Y. Liu H. Song Q. Wang Photoelectrochemical decarboxylative C-H alkylation of quinoxalin-2(1h)-ones ACS Sustain. Chem. Eng. 9 2021 16820 16828 10.1021/acssuschemeng.1c06702 K. Niu, P. Zhou, L. Ding, Y. Hao, Y. Liu, H. Song, Q. Wang, Photoelectrochemical decarboxylative C-H alkylation of quinoxalin-2(1h)-ones, ACS Sustainable Chem. Eng. 9 (2021) 16820-16828. https://doi.org/ 10.1021/acssuschemeng.1c06702 [4] T. Donohoe L. Fishlock P. Procopiou A metathesis-based approach to the synthesis of 2-pyridones and pyridines Org. Lett. 10 2008 285 288 10.1021/ol702684d T. Donohoe, L. Fishlock, P. Procopiou, A metathesis-based approach to the synthesis of 2-pyridones and pyridines, Org. Lett. 10 (2008) 285-288. https://doi.org/10.1021/ol702684d [5] D. Horne J. Gaudino W. Thompson A convenient method for the synthesis of α-ketoesters from aldehydes Tetrahedron Lett. 25 1984 3529 3532 10.1016/s0040-4039(01)91067-6 D. Horne, J. Gaudino, W. Thompson, A convenient method for the synthesis of α-ketoesters from aldehydes, Tetrahedron Lett. 25 (1984) 3529-3532. https://doi.org/10.1016/s0040-4039(01)91067-6 [6] T.R. Kelly T.E. Schmidt J.G. Haggerty A convenient preparation of methyl and ethyl glyoxylate Synthesis 10 1972 544 545 10.1055/s-1972-21915 T.R. Kelly, T.E. Schmidt, J.G. Haggerty, A convenient preparation of methyl and ethyl glyoxylate, Synthesis 10 (1972) 544-545. https://doi.org/10.1055/s-1972-21915 [7] L. Vargha M. Reményi Selective oxidations with red lead J. Chem. Soc. 12 1951 1068 1069 10.1039/jr9510001068 L. Vargha, M. Reményi, Selective oxidations with red lead, J. Chem. Soc. 12 (1951) 1068-1069. https://doi.org/10.1039/jr9510001068 [8] J. Zhu L. Cao C. Li G. Zhao T. Zhu W. Hu W. Sun Y. Lu Nanoporous Ni3P evolutionarily structured onto a Ni foam for highly selective hydrogenation of dimethyl oxalate to methyl glycolate ACS Appl. Mater. Interfaces 11 2019 37635 37643 10.1021/acsami.9b11703 J. Zhu, L. Cao, C. Li, G. Zhao, T. Zhu, W. Hu, W. Sun, Y. Lu, Nanoporous Ni3P evolutionarily structured onto a Ni foam for highly selective hydrogenation of dimethyl oxalate to methyl glycolate, ACS Appl. Mater. Interfaces 11 (2019) 37635-37643. https://doi.org/10.1021/acsami.9b11703 [9] Y. Sun H. Wang J. Shen H. Liu Z. Liu Highly effective synthesis of methyl glycolate with heteropolyacids as catalysts Catal. Commun. 10 2009 678 681 10.1016/j.catcom.2008.11.015 Y. Sun, H. Wang, J. Shen, H. Liu, Z. Liu, Highly effective synthesis of methyl glycolate with heteropolyacids as catalysts, Catal. Commun. 10 (2009) 678-681. https://doi.org/10.1016/j.catcom.2008.11.015 [10] Y. Weng M. Zou X. Liu J. Gu Z. Liu Y. Fan Y. Zhang Y. Liao Conversion of glucose to methyl glycolate in subcritical methanol Chem. Commun. 59 2023 4340 4343 10.1039/d3cc00303e Y. Weng, M. Zou, X. Liu, J. Gu, Z. Liu, Y. Fan, Y. Zhang, Y. Liao, Conversion of glucose to methyl glycolate in subcritical methanol, Chem. Commun. 59 (2023) 4340-4343. https://doi.org/10.1039/d3cc00303e [11] G. Xu A. Wang J. Pang X. Zhao J. Xu N. Lei J. Wang M. Zheng J. Yin T. Zhang Chemocatalytic conversion of cellulosic biomass to methyl glycolate, ethylene glycol, and ethanol ChemSusChem 10 2017 1390 1394 10.1002/cssc.201601714 G. Xu, A. Wang, J. Pang, X. Zhao, J. Xu, N. Lei, J. Wang, M. Zheng, J. Yin, T. Zhang, Chemocatalytic conversion of cellulosic biomass to methyl glycolate, ethylene glycol, and ethanol, ChemSusChem 10 (2017) 1390-1394. https://doi.org/10.1002/cssc.201601714 [12] X. Ren J. Zheng J. Zhao Y. Quan J. Ren Oxidative esterification of ethylene glycol in methanol to methyl glycolate over Au/ZnO catalysts: effect of preparation methods Sustain. Energy Fuels 8 2024 4646 4655 10.1039/d4se00746h X. Ren, J. Zheng, J. Zhao, Y. Quan, J. Ren, Oxidative esterification of ethylene glycol in methanol to methyl glycolate over Au/ZnO catalysts: effect of preparation methods, Sustainable Energy & Fuels 8 (2024) 4646-4655. https://doi.org/10.1039/d4se00746h [13] H. Wang T. Lan G. Zhao G. Chen Y. Lu aerobic oxidation of methyl glycolate by α-Fe2O3 for the eco-friendly synthesis of methyl glyoxylate ACS Catal. 14 2024 728 740 10.1021/acscatal.3c05587 H. Wang, T. Lan, G. Zhao, G. Chen, Y. Lu, aerobic oxidation of methyl glycolate by α-Fe2O3 for the eco-friendly synthesis of methyl glyoxylate, ACS Catal. 14 (2024) 728-740. https://doi.org/10.1021/acscatal.3c05587 [14] M. He Y. Sun B. Han Green carbon science: scientific basis for integrating carbon resource processing, utilization, and recycling Angew. Chem. Int. Ed. 52 2013 9620 9633 10.1039/d4se00746h M. He, Y. Sun, B. Han, Green carbon science: scientific basis for integrating carbon resource processing, utilization, and recycling, Angew. Chem. Int. Ed. 52 (2013) 9620-9633. https://doi.org/10.1039/d4se00746h [15] M. He Y. Sun B. Han Green carbon science: efficient carbon resource processing, utilization, and recycling towards carbon neutrality Angew. Chem. Int. Ed. 61 2022 e202112835 10.1002/anie.202112835 M. He, Y. Sun, B. Han, Green carbon science: efficient carbon resource processing, utilization, and recycling towards carbon neutrality, Angew. Chem. Int. Ed. 61 (2022) e202112835. https://doi.org/10.1002/anie.202112835 [16] N. Nelson B. Boote P. Naik A. Rossini E. Smith I. Slowing Transfer hydrogenation over sodium-modified ceria: enrichment of redox sites active for alcohol dehydrogenation J. Catal. 346 2017 180 187 10.1016/jjcat.2016.12.018 N. Nelson, B. Boote, P. Naik, A. Rossini, E. Smith, I. Slowing, Transfer hydrogenation over sodium-modified ceria: Enrichment of redox sites active for alcohol dehydrogenation, J. Catal. 346 (2017) 180-187. https://doi.org/10.1016/jjcat.2016.12.018 [17] A. Silva P. Robles-Dutenhefner A. Dias H. Fajardo A. Lovón J. Lovón-Quintana G. Valença Gold, palladium and gold–palladium supported on silica catalysts prepared by sol–gel method: synthesis, characterization and catalytic behavior in the ethanol steam reforming J. Sol. -Gel Sci. Technol. 67 2013 273 281 10.1007/s10971-013-3076-8 A. Silva, P. Robles-Dutenhefner, A. Dias, H. Fajardo, A. Lovón, J. Lovón-Quintana, G. Valença, Gold, palladium and gold–palladium supported on silica catalysts prepared by sol–gel method: synthesis, characterization and catalytic behavior in the ethanol steam reforming, J. Sol-Gel Sci. Technol. 67 (2013) 273-281. https://doi.org/10.1007/s10971-013-3076-8 [18] J. Pang M. Yin P. Wu X. Li H. Li M. Zheng T. Zhang Advances in catalytic dehydrogenation of ethanol to acetaldehyde Green. Chem. 23 2021 7902 7916 10.1039/d1gc02799a J. Pang, M. Yin, P. Wu, X. Li, H. Li, M. Zheng, T. Zhang, Advances in catalytic dehydrogenation of ethanol to acetaldehyde, Green Chem. 23 (2021) 7902-7916. https://doi.org/10.1039/d1gc02799a [19] Y. Huang B. Wang H. Yuan Y. Sun D. Yang X. Cui F. Shi The catalytic dehydrogenation of ethanol by heterogeneous catalysts Catal. Sci. Technol. 11 2021 1652 1664 10.1039/d0cy02479a Y. Huang, B. Wang, H. Yuan, Y. Sun, D. Yang, X. Cui, F. Shi, The catalytic dehydrogenation of ethanol by heterogeneous catalysts, Catal. Sci. Technol. 11 (2021) 1652-1664. https://doi.org/10.1039/d0cy02479a [20] L. He B. Zhou D. Sun W. Li W. Lv J. Wang Y. Liang A. Lu Catalytic conversion of ethanol to oxygen-containing value-added chemicals ACS Catal. 13 2023 11291 11304 10.1021/acscatal.3c01481 L. He, B. Zhou, D. Sun, W. Li, W. Lv, J. Wang, Y. Liang, A. Lu, Catalytic conversion of ethanol to oxygen-containing value-added chemicals, ACS Catal. 13 (2023) 11291-11304. https://doi.org/10.1021/acscatal.3c01481 [21] A. Kumar Ethanol decomposition and dehydrogenation for hydrogen production: a review of heterogeneous catalysts Ind. Eng. Chem. Res. 60 2021 16561 16576 10.1021/acs.iecr.1c02557 A. Kumar, Ethanol decomposition and dehydrogenation for hydrogen production: A review of heterogeneous catalysts, Ind. Eng. Chem. Res. 60 (2021) 16561-16576. https://doi.org/10.1021/acs.iecr.1c02557 [22] Q. Wang L. Shi A. Lu Highly selective copper catalyst supported on mesoporous carbon for the dehydrogenation of ethanol to acetaldehyde ChemCatChem 7 2015 2846 2852 10.1002/cctc.201500501 Q. Wang, L. Shi, A. Lu, Highly selective copper catalyst supported on mesoporous carbon for the dehydrogenation of ethanol to acetaldehyde, ChemCatChem 7 (2015) 2846-2852. https://doi.org/10.1002/cctc.201500501 [23] M. Behrens F. Studt I. Kasatkin S. Kühl M. Hävecker F. Abild-Pedersen S. Zander F. Girgsdies P. Kurr B. Kniep M. Tovar R. Fischer J. Nørskov R. Schlögl The active site of methanol synthesis over Cu/ZnO/Al2O3 industrial catalysts Science 336 2012 893 897 10.1126/science.1219831 M. Behrens, F. Studt, I. Kasatkin, S. Kühl, M. Hävecker, F. Abild-Pedersen, S. Zander, F. Girgsdies, P. Kurr, B. Kniep, M. Tovar, R. Fischer, J. Nørskov, R. Schlögl, The active site of methanol synthesis over Cu/ZnO/Al2O3 Industrial Catalysts, Science 336 (2012) 893-897. https://doi.org/10.1126/science.1219831 [24] J. Cheong Y. Shao S. Tan X. Li Y. Zhang S. Lee Highly active and selective Zr/MCF catalyst for production of 1,3-butadiene from ethanol in a dual fixed bed reactor system ACS Sustain. Chem. Eng. 4 2016 4887 4894 10.1021/acssuschemeng.6b01193 J. Cheong, Y. Shao, S. Tan, X. Li, Y. Zhang, S. Lee, Highly active and selective Zr/MCF catalyst for production of 1,3-butadiene from ethanol in a dual fixed bed reactor system, ACS Sustainable Chem. Eng. 4 (2016) 4887-4894. https://doi.org/10.1021/acssuschemeng.6b01193 [25] A. Kumar A. Ashok R. Bhosale M. Saleh F. Almomani M. Al-Marri M. Khader F. Tarlochan In situ DRIFTS studies on Cu, Ni and CuNi catalysts for ethanol decomposition reaction Catal. Lett. 146 2016 778 787 10.1007/s10562-016-1706-9 A. Kumar, A. Ashok, R. Bhosale, M. Saleh, F. Almomani, M. Al-Marri, M. Khader, F. Tarlochan, In situ DRIFTS studies on Cu, Ni and CuNi catalysts for ethanol decomposition reaction, Catal. Lett. 146 (2016) 778-787. https://doi.org/10.1007/s10562-016-1706-9 [26] X. Gao Z. Li S. Zhang D. Zhang X. Zhao B. Zhang Y. Wang Advancements in biomass conversion: copper-catalyzed anaerobic dehydrogenation of 5-hydroxymethylfurfural to 2,5-diformylfuran Chem. Eng. J. 496 2024 153775 10.1016/j.cej.2024.153775 X. Gao, Z. Li, S. Zhang, D. Zhang, X. Zhao, B. Zhang, Y. Wang, Advancements in biomass conversion: Copper-catalyzed anaerobic dehydrogenation of 5-hydroxymethylfurfural to 2,5-diformylfuran, Chem. Eng. J. 496 (2024) 153775. https://doi.org/10.1016/j.cej.2024.153775 [27] X. Luo A. Tian Z. Ren H. Kong L. Wang Study on the bimetallic synergistic effect of Cu/Al@SBA-15 nanocomposite on dehydrogenation coupling strategy Catal. Lett. 152 2022 3704 3715 10.1007/s10562-022-03929-0 X. Luo, A. Tian, Z. Ren, H. Kong, L. Wang, Study on the Bimetallic Synergistic Effect of Cu/Al@SBA-15 Nanocomposite on Dehydrogenation Coupling Strategy, Catal. Lett. 152 (2022) 3704-3715. https://doi.org/10.1007/s10562-022-03929-0 [28] J. Pang M. Zheng C. Wang X. Yang H. Liu X. Liu J. Sun Y. Wang T. Zhang Hierarchical echinus-like Cu-MFI catalysts for ethanol dehydrogenation ACS Catal. 10 2020 13624 13629 10.1021/acscatal.0c03860 J. Pang, M. Zheng, C. Wang, X. Yang, H. Liu, X. Liu, J. Sun, Y. Wang, T. Zhang, Hierarchical echinus-like Cu-MFI catalysts for ethanol dehydrogenation, ACS Catal. 10 (2020) 13624-13629. https://doi.org/10.1021/acscatal.0c03860 [29] F. Jiang T. Lan J. Sun G. Zhao Y. Lu Core-shell Cu@SiO2/SiO2 catalyst for 1,6-hexanediol dehydrogenation to ε-caprolactone: high activity and stability from core-shell nanostructure Nano Res 16 2023 12270 12280 10.1007/s12274-023-5891-8 F. Jiang, T. Lan, J. Sun, G. Zhao, Y. Lu, Core-shell Cu@SiO2/SiO2 catalyst for 1,6-hexanediol dehydrogenation to ε-caprolactone: High activity and stability from core-shell nanostructure, Nano Res. 16 (2023) 12270-12280. https://doi.org/10.1007/s12274-023-5891-8 [30] S. Lu J. Zhang H. Meng X. Qin J. Huang Y. Liang F. Xiao Catalytic direct dehydrogenation of ethyl lactate to produce ethyl pyruvate over a synergetic Cu0/Cu+ interface Appl. Catal. B: Environ. 325 2023 122329 10.1016/j.apcatb.2022.122329 S. Lu, J. Zhang, H. Meng, X. Qin, J. Huang, Y. Liang, F. Xiao, Catalytic direct dehydrogenation of ethyl lactate to produce ethyl pyruvate over a synergetic Cu0/Cu+ interface, Appl. Catal. B: Environ. 325 (2023) 122329. https://doi.org/10.1016/j.apcatb.2022.122329 [31] X. He Y. Wang X. Zhang M. Dong G. Wang B. Zhang Y. Niu S. Yao X. He H. Liu Controllable in situ surface restructuring of Cu catalysts and remarkable enhancement of their catalytic activity ACS Catal. 9 2019 2213 2221 10.1021/acscatal.8b04812 X. He, Y. Wang, X. Zhang, M. Dong, G. Wang, B. Zhang, Y. Niu, S. Yao, X. He, H. Liu, Controllable in situ surface restructuring of Cu catalysts and remarkable enhancement of their catalytic activity, ACS Catal. 9 (2019) 2213-2221. https://doi.org/10.1021/acscatal.8b04812 [32] D. Yuan A. Hengne Y. Saih K. Huang Nonoxidative dehydrogenation of methanol to methyl formate through highly stable and reusable CuMgO-based catalysts ACS Omega 4 2019 1854 1860 10.1021/acsomega.8b03069 D. Yuan, A. Hengne, Y. Saih, K. Huang, Nonoxidative dehydrogenation of methanol to methyl formate through highly stable and reusable CuMgO-based catalysts, ACS Omega 4 (2019) 1854-1860. https://doi.org/10.1021/acsomega.8b03069 [33] N. Wang Y. Quan J. Zhao H. Li J. Ren Highly active CuZn/SBA-15 catalyst for methanol dehydrogenation to methyl formate: Influence of ZnO promoter Mol. Catal. 505 2021 111514 10.1016/j.mcat.2021.111514 N. Wang, Y. Quan, J. Zhao, H. Li, J. Ren, Highly active CuZn/SBA-15 catalyst for methanol dehydrogenation to methyl formate: Influence of ZnO promoter, Mol. Catal. 505 (2021) 111514. https://doi.org/10.1016/j.mcat.2021.111514 [34] H. Yang Y. Chen X. Cui G. Wang Y. Cen T. Deng W. Yan J. Gao S. Zhu U. Olsbye J. Wang W. Fan A Highly stable copper-based catalyst for clarifying the catalytic roles of Cu0 and Cu+ species in methanol dehydrogenation Angew. Chem. Int. Ed. 57 2018 1836 1840 10.1002/anie.201710605 H. Yang, Y. Chen, X. Cui, G. Wang, Y. Cen, T. Deng, W. Yan, J. Gao, S. Zhu, U. Olsbye, J. Wang, W. Fan, A Highly stable copper-based catalyst for clarifying the catalytic roles of Cu0 and Cu+ species in methanol dehydrogenation, Angew. Chem. Int. Ed. 57 (2018) 1836-1840. https://doi.org/10.1002/anie.201710605 [35] E. Yuan P. Ni W. Zhuang R. Jian P. Jian Synergic catalysis by a CuO-like phase and Cu0 for anaerobic dehydrogenation of 2,3-butanediol J. Catal. 382 2020 256 268 10.1016/jjcat.2019.12.016 E. Yuan, P. Ni, W. Zhuang, R. Jian, P. Jian, Synergic catalysis by a CuO-like phase and Cu0 for anaerobic dehydrogenation of 2,3-butanediol, J. Catal. 382 (2020) 256-268. https://doi.org/10.1016/jjcat.2019.12.016 [36] D. Ji W. Zhu Z. Wang G. Wang Dehydrogenation of cyclohexanol on Cu–ZnO/SiO2 catalysts: the role of copper species Catal. Commun. 8 2007 1891 1895 10.1016/j.catcom.2007.03.001 D. Ji, W. Zhu, Z. Wang, G. Wang, Dehydrogenation of cyclohexanol on Cu–ZnO/SiO2 catalysts: The role of copper species, Catal. Commun. 8 (2007) 1891-1895. https://doi.org/10.1016/j.catcom.2007.03.001 [37] M. Witzke P. Dietrich M. Ibrahim K. Al-Bardan M. Triezenberg D. Flaherty Spectroscopic evidence for origins of size and support effects on selectivity of Cu nanoparticle dehydrogenation catalysts Chem. Commun. 53 2017 597 600 10.1039/c6cc08305f M. Witzke, P. Dietrich, M. Ibrahim, K. Al-Bardan, M. Triezenberg, D. Flaherty, Spectroscopic evidence for origins of size and support effects on selectivity of Cu nanoparticle dehydrogenation catalysts, Chem. Commun. 53 (2017) 597-600. https://doi.org/10.1039/c6cc08305f [38] L. Chen P. Guo M. Qiao S. Yan H. Li W. Shen H. Xu K. Fan Cu/SiO2 catalysts prepared by the ammonia-evaporation method: texture, structure, and catalytic performance in hydrogenation of dimethyl oxalate to ethylene glycol J. Catal. 257 2008 172 180 10.1016/jjcat.2008.04.021 L. Chen, P. Guo, M. Qiao, S. Yan, H. Li, W. Shen, H. Xu, K. Fan, Cu/SiO2 catalysts prepared by the ammonia-evaporation method: Texture, structure, and catalytic performance in hydrogenation of dimethyl oxalate to ethylene glycol, J. Catal. 257 (2008) 172-180. https://doi.org/10.1016/jjcat.2008.04.021 [39] M. Frisch G. Trucks H. Schlegel G. Scuseria M. Robb J. Cheeseman G. Scalmani V. Barone G. Petersson H. Nakatsuji X. Li M. Caricato A. Marenich J. Bloino B. Janesko R. Gomperts B. Mennucci J. Ortiz A. Izmaylov J. Sonnenberg D. Williams-Young F. Ding F. Lipparini F. Egidi J. Goings B. Peng A. Petrone T. Henderson D. Ranasinghe V. Zakrzewski J. Gao N. Rega G. Zheng W. Liang M. Hada M. Ehara K. Toyota R. Fukuda J. Hasegawa M. Ishida T. Nakajima Y. Honda O. Kitao H. Nakai T. Vreven K. Throssell J. Montgomery Jr. J. Peralta F. Ogliaro M. Bearpark J. Heyd E. Brothers K. Kudin V. Staroverov T. Keith R. Kobayashi J. Normand K. Raghavachari A. Rendell J. Burant S. Iyengar J. Tomasi M. Cossi J. Millam M. Klene C. Adamo R. Cammi R. Martin K. Morokuma O. Farkas J. Foresman D. Fox Gaussian 16, Revision A.03 2016 Gaussian, Inc. Wallingford C. T M. Frisch, G. Trucks, H. Schlegel, G. Scuseria, M. Robb, J. Cheeseman, G. Scalmani, V. Barone, G. Petersson, H. Nakatsuji, X. Li, M. Caricato, A. Marenich, J. Bloino, B. Janesko, R. Gomperts, B. Mennucci, J. Ortiz, A. Izmaylov, J. Sonnenberg, D. Williams-Young, F. Ding, F. Lipparini, F. Egidi, J. Goings, B. Peng, A. Petrone, T. Henderson, D. Ranasinghe, V. Zakrzewski, J. Gao, N. Rega, G. Zheng, W. Liang, M. Hada, M. Ehara, K. Toyota, R. Fukuda, J. Hasegawa, M. Ishida, T. Nakajima, Y. Honda, O. Kitao, H. Nakai, T. Vreven, K. Throssell, J. Montgomery Jr., J. Peralta, F. Ogliaro, M. Bearpark, J. Heyd, E. Brothers, K. Kudin, V. Staroverov, T. Keith, R. Kobayashi, J. Normand, K. Raghavachari, A. Rendell, J. Burant, S. Iyengar, J. Tomasi, M. Cossi, J. Millam, M. Klene, C. Adamo, R. Cammi, R. Martin, K. Morokuma, O. Farkas, J. Foresman, D. Fox, Gaussian 16, Revision A.03, Gaussian, Inc., Wallingford C. T., 2016. [40] P. Stephens F. Devlin C. Chabalowski M. Frisch Ab initio calculation of vibrational absorption and circular dichroism spectra using density functional force fields J. Phys. Chem. 98 1994 11623 11627 10.1021/j100096a001 P. Stephens, F. Devlin, C. Chabalowski, M. Frisch, Ab initio calculation of vibrational absorption and circular dichroism spectra using density functional force fields, J. Phys. Chem. 98 (1994) 11623-11627. https://doi.org/10.1021/j100096a001 [41] T. Lu Q. Chen Shermo: a general code for calculating molecular thermochemistry properties Theor. Chem. 1200 2021 113249 10.1016/j.comptc.2021.113249 T. Lu, Q. Chen, Shermo: A general code for calculating molecular thermochemistry properties, Theor. Chem. 1200 (2021) 113249. https://doi.org/10.1016/j.comptc.2021.113249 [42] P. Palanychamy S. Lim Y. Yap L. Leong Critical review of the various reaction mechanisms for glycerol etherification Catalysts 12 2022 1487 10.3390/catal12111487 P. Palanychamy, S. Lim, Y. Yap, L. Leong, Critical review of the various reaction mechanisms for glycerol etherification, Catalysts 12 (2022) 1487. https://doi.org/10.3390/catal12111487 [43] Y. Xu A. Meh G. Yang Y. Zhao Q. Chen Z. Li X. Ma Homogeneous catalytic kinetics of methyl glycolate hydrolysis Chem. Eng. Technol. 39 2016 918 926 10.1002/ceat.201500649 Y. Xu, A. Meh, G. Yang, Y. Zhao, Q. Chen, Z. Li, X. Ma, Homogeneous catalytic kinetics of methyl glycolate hydrolysis, Chem. Eng. Technol. 39 (2016) 918-926. https://doi.org/10.1002/ceat.201500649 [44] R. Clercq E. Makshina B. Sels M. Dusselier Catalytic gas-phase cyclization of glycolate esters: a novel route toward glycolide-based bioplastics ChemCatChem 10 2018 5649 5655 10.1002/cctc.201801469 R. Clercq, E. Makshina, B. Sels, M. Dusselier, Catalytic gas-phase cyclization of glycolate esters: A novel route toward glycolide-based bioplastics, ChemCatChem 10 (2018) 5649-5655. https://doi.org/10.1002/cctc.201801469 [45] T. Toupance M. Kermarec J. Lambert C. Louis Conditions of formation of copper phyllosilicates in silica-supported copper catalysts prepared by selective adsorption J. Phys. Chem. B 106 2002 2277 2286 10.1021/jp013153x T. Toupance, M. Kermarec, J. Lambert, C. Louis, Conditions of formation of copper phyllosilicates in silica-supported copper catalysts prepared by selective adsorption, J. Phys. Chem. B 106 (2002) 2277-2286. https://doi.org/10.1021/jp013153x [46] O. Clause M. Kermarec L. Bonneviot F. Villain M. Che Nickel(II) ion-support interactions as a function of preparation method of silica-supported nickel materials J. Am. Chem. Soc. 114 1992 4709 4717 10.1021/ja00038a038 O. Clause, M. Kermarec, L. Bonneviot, F. Villain, M. Che, Nickel(II) ion-support interactions as a function of preparation method of silica-supported nickel materials, J. Am. Chem. Soc. 114 (1992) 4709-4717. https://doi.org/10.1021/ja00038a038 [47] A. Marchi J. Fierro J. Santamaría A. Monzón Dehydrogenation of isopropylic alcohol on a Cu/SiO2 catalyst: a study of the activity evolution and reactivation of the catalyst Appl. Catal. A: Gen. 142 1996 375 386 10.1016/0926-860x(96)00087-7 A. Marchi, J. Fierro, J. Santamaría, A. Monzón, Dehydrogenation of isopropylic alcohol on a Cu/SiO2 catalyst: a study of the activity evolution and reactivation of the catalyst, Appl. Catal. A: Gen. 142 (1996) 375-386. https://doi.org/10.1016/0926-860x(96)00087-7 [48] C. Van Der Grift A. Wielers A. Mulder J. Geus The reduction behaviour of silica-supported copper catalysts prepared by deposition-precipitation Thermochim. Acta 171 1990 95 113 10.1016/0040-6031(90)87011-z C. Van Der Grift, A. Wielers, A. Mulder, J. Geus, The reduction behaviour of silica-supported copper catalysts prepared by deposition-precipitation, Thermochim. Acta 171 (1990) 95-113. https://doi.org/10.1016/0040-6031(90)87011-z [49] K. Liu Y. Sun J. Feng Y. Liu J. Zhu C. Han C. Chen T. Bao X. Cao X. Zhao Y. Yang G. Zhao Intensified gas-phase hydrogenation of acetone to isopropanol catalyzed at metal-oxide interfacial sites Chem. Eng. J. 454 2023 140059 10.1016/j.cej.2022.140059 K. Liu, Y. Sun, J. Feng, Y. Liu, J. Zhu, C. Han, C. Chen, T. Bao, X. Cao, X. Zhao, Y. Yang, G. Zhao, Intensified gas-phase hydrogenation of acetone to isopropanol catalyzed at metal-oxide interfacial sites, Chem. Eng. J. 454 (2023) 140059. https://doi.org/10.1016/j.cej.2022.140059 [50] Y. Wang H. Zhao M. Li J. Fan G. Zhao Magnetic ordered mesoporous copper ferrite as a heterogeneous Fenton catalyst for the degradation of imidacloprid Appl. Catal. B: Environ. 147 2014 534 545 10.1016/j.apcatb.2013.09.017 Y. Wang, H. Zhao, M. Li, J. Fan, G. Zhao, Magnetic ordered mesoporous copper ferrite as a heterogeneous Fenton catalyst for the degradation of imidacloprid, Appl. Catal. B: Environ. 147 (2014) 534-545. https://doi.org/10.1016/j.apcatb.2013.09.017 [51] C. Xu G. Chen Y. Zhao P. Liu X. Duan L. Gu G. Fu Y. Yuan N. Zheng Interfacing with silica boosts the catalysis of copper Nat. Commun. 9 2018 3367 10.1038/s41467-018-05757-6 C. Xu, G. Chen, Y. Zhao, P. Liu, X. Duan, L. Gu, G. Fu, Y. Yuan, N. Zheng, Interfacing with silica boosts the catalysis of copper, Nat. Commun. 9 (2018) 3367. https://doi.org/10.1038/s41467-018-05757-6 [52] E. Makshina J. Canadell J. van Krieken B. Sels Potassium-modified ZSM-5 catalysts for methyl acrylate formation from methyl lactate: the impact of the intrinsic properties on their stability and selectivity ACS Sustain. Chem. Eng. 10 2022 6196 6204 10.1021/acssuschemeng.1c08391 E. Makshina, J. Canadell, J. van Krieken, B. Sels, Potassium-modified ZSM-5 catalysts for methyl acrylate formation from methyl lactate: The impact of the intrinsic properties on their stability and selectivity, ACS Sustainable Chem. Eng. 10 (2022) 6196-6204. https://doi.org/10.1021/acssuschemeng.1c08391 [53] K. Qian D. Tomczak E. Rakiewicz R. Harding G. Yaluris Cheng X. Zhao A. Peters Coke formation in the fluid catalytic cracking process by combined analytical techniques Energy Fuel 11 1997 596 601 10.1021/ef960204u K. Qian, D. Tomczak, E. Rakiewicz, R. Harding, G. Yaluris, Cheng, X. Zhao, A. Peters, Coke formation in the fluid catalytic cracking process by combined analytical techniques, Energy & Fuel 11 (1997) 596-601. https://doi.org/10.1021/ef960204u [54] H. Wang L. Sun Z. Sui Y. Zhu G. Ye D. Chen X. Zhou W. Yuan Coke formation on Pt–Sn/Al2O3 catalyst for propane dehydrogenation Ind. Eng. Chem. Res. 57 2018 8647 8654 10.1021/acs.iecr.8b01313 H. Wang, L. Sun, Z. Sui, Y. Zhu, G. Ye, D. Chen, X. Zhou, W. Yuan, Coke formation on Pt–Sn/Al2O3 catalyst for propane dehydrogenation, Ind. Eng. Chem. Res. 57 (2018) 8647-8654. https://doi.org/10.1021/acs.iecr.8b01313",
      "scopus-id": "86000780368",
      "coredata": {
        "eid": "1-s2.0-S0926860X25001206",
        "dc:description": "Dehydrogenation of methyl glycolate (MG) is an attractive method for synthesizing methyl glyoxylate (MGO, an important high-value chemical and pharmaceutical intermediate), which is calling for a qualified catalyst. Cu/SiO2-AE catalysts were prepared via the ammonia evaporation method for the title reaction, showing the catalytic performance strongly dependent on their preparation/activation parameters as well as the reaction conditions. The preferable 15Cu/SiO2-80AE (15 wt% Cu-loading; AE-treatment at 80 °C; calcined at 500 °C) after H2-reduction at 300 °C achieved a high MG conversion of 38.5 % with MGO selectivity of 79.0 % at 400 °C. The Cu/SiO₂-AE catalyst demonstrates promising catalytic performance, achieving 38.5 % MG conversion with 79.0 % MGO selectivity at 400 °C. The Cu⁺/Cu⁰ ratio plays a crucial role in catalytic activity, as revealed by XPS, FTIR, and MG-TPSR. Deactivation mechanisms were studied, and catalyst regeneration was explored, offering insights for industrial application in green MGO synthesis.",
        "openArchiveArticle": "false",
        "prism:coverDate": "2025-05-05",
        "openaccessUserLicense": null,
        "prism:aggregationType": "Journal",
        "prism:url": "https://api.elsevier.com/content/article/pii/S0926860X25001206",
        "dc:creator": [
          {
            "@_fa": "true",
            "$": "Gong, Zixuan"
          },
          {
            "@_fa": "true",
            "$": "Wang, Hao"
          },
          {
            "@_fa": "true",
            "$": "Lan, Tian"
          },
          {
            "@_fa": "true",
            "$": "Ma, Zhongchen"
          },
          {
            "@_fa": "true",
            "$": "Wang, Shaolin"
          },
          {
            "@_fa": "true",
            "$": "Lu, Yong"
          }
        ],
        "link": [
          {
            "@_fa": "true",
            "@rel": "self",
            "@href": "https://api.elsevier.com/content/article/pii/S0926860X25001206"
          },
          {
            "@_fa": "true",
            "@rel": "scidir",
            "@href": "https://www.sciencedirect.com/science/article/pii/S0926860X25001206"
          }
        ],
        "dc:format": "application/json",
        "openaccessType": null,
        "pii": "S0926-860X(25)00120-6",
        "prism:volume": "697",
        "articleNumber": "120219",
        "prism:publisher": "Elsevier B.V. All rights are reserved, including those for text and data mining, AI training, and similar technologies.",
        "dc:title": "Dehydrogenation of methyl glycolate to methyl glyoxylate over a Cu/SiO2 catalyst",
        "prism:copyright": "© 2025 Elsevier B.V. All rights are reserved, including those for text and data mining, AI training, and similar technologies.",
        "openaccess": "0",
        "prism:issn": "0926860X",
        "dcterms:subject": [
          {
            "@_fa": "true",
            "$": "Methyl glycolate"
          },
          {
            "@_fa": "true",
            "$": "Methyl glyoxylate"
          },
          {
            "@_fa": "true",
            "$": "Dehydrogenation"
          },
          {
            "@_fa": "true",
            "$": "Cu catalyst"
          },
          {
            "@_fa": "true",
            "$": "Ammonia evaporation method"
          }
        ],
        "openaccessArticle": "false",
        "prism:publicationName": "Applied Catalysis A: General",
        "openaccessSponsorType": null,
        "prism:pageRange": "120219",
        "pubType": "fla",
        "prism:coverDisplayDate": "5 May 2025",
        "prism:doi": "10.1016/j.apcata.2025.120219",
        "prism:startingPage": "120219",
        "dc:identifier": "doi:10.1016/j.apcata.2025.120219",
        "openaccessSponsorName": null
      },
      "objects": {
        "object": [
          {
            "@category": "standard",
            "@height": "842",
            "@width": "282",
            "@_fa": "true",
            "$": "https://api.elsevier.com/content/object/eid/1-s2.0-S0926860X25001206-gr6.jpg?httpAccept=%2A%2F%2A",
            "@multimediatype": "JPEG image file",
            "@type": "IMAGE-DOWNSAMPLED",
            "@size": "101680",
            "@ref": "gr6",
            "@mimetype": "image/jpeg"
          },
          {
            "@category": "standard",
            "@height": "291",
            "@width": "339",
            "@_fa": "true",
            "$": "https://api.elsevier.com/content/object/eid/1-s2.0-S0926860X25001206-gr5.jpg?httpAccept=%2A%2F%2A",
            "@multimediatype": "JPEG image file",
            "@type": "IMAGE-DOWNSAMPLED",
            "@size": "17119",
            "@ref": "gr5",
            "@mimetype": "image/jpeg"
          },
          {
            "@category": "standard",
            "@height": "554",
            "@width": "678",
            "@_fa": "true",
            "$": "https://api.elsevier.com/content/object/eid/1-s2.0-S0926860X25001206-gr8.jpg?httpAccept=%2A%2F%2A",
            "@multimediatype": "JPEG image file",
            "@type": "IMAGE-DOWNSAMPLED",
            "@size": "95074",
            "@ref": "gr8",
            "@mimetype": "image/jpeg"
          },
          {
            "@category": "standard",
            "@height": "307",
            "@width": "678",
            "@_fa": "true",
            "$": "https://api.elsevier.com/content/object/eid/1-s2.0-S0926860X25001206-gr7.jpg?httpAccept=%2A%2F%2A",
            "@multimediatype": "JPEG image file",
            "@type": "IMAGE-DOWNSAMPLED",
            "@size": "46544",
            "@ref": "gr7",
            "@mimetype": "image/jpeg"
          },
          {
            "@category": "standard",
            "@height": "257",
            "@width": "338",
            "@_fa": "true",
            "$": "https://api.elsevier.com/content/object/eid/1-s2.0-S0926860X25001206-gr9.jpg?httpAccept=%2A%2F%2A",
            "@multimediatype": "JPEG image file",
            "@type": "IMAGE-DOWNSAMPLED",
            "@size": "19766",
            "@ref": "gr9",
            "@mimetype": "image/jpeg"
          },
          {
            "@category": "standard",
            "@height": "267",
            "@width": "676",
            "@_fa": "true",
            "$": "https://api.elsevier.com/content/object/eid/1-s2.0-S0926860X25001206-gr2.jpg?httpAccept=%2A%2F%2A",
            "@multimediatype": "JPEG image file",
            "@type": "IMAGE-DOWNSAMPLED",
            "@size": "38118",
            "@ref": "gr2",
            "@mimetype": "image/jpeg"
          },
          {
            "@category": "standard",
            "@height": "200",
            "@width": "330",
            "@_fa": "true",
            "$": "https://api.elsevier.com/content/object/eid/1-s2.0-S0926860X25001206-ga1.jpg?httpAccept=%2A%2F%2A",
            "@multimediatype": "JPEG image file",
            "@type": "IMAGE-DOWNSAMPLED",
            "@size": "22604",
            "@ref": "ga1",
            "@mimetype": "image/jpeg"
          },
          {
            "@category": "standard",
            "@height": "255",
            "@width": "338",
            "@_fa": "true",
            "$": "https://api.elsevier.com/content/object/eid/1-s2.0-S0926860X25001206-gr1.jpg?httpAccept=%2A%2F%2A",
            "@multimediatype": "JPEG image file",
            "@type": "IMAGE-DOWNSAMPLED",
            "@size": "15827",
            "@ref": "gr1",
            "@mimetype": "image/jpeg"
          },
          {
            "@category": "standard",
            "@height": "547",
            "@width": "678",
            "@_fa": "true",
            "$": "https://api.elsevier.com/content/object/eid/1-s2.0-S0926860X25001206-gr4.jpg?httpAccept=%2A%2F%2A",
            "@multimediatype": "JPEG image file",
            "@type": "IMAGE-DOWNSAMPLED",
            "@size": "76980",
            "@ref": "gr4",
            "@mimetype": "image/jpeg"
          },
          {
            "@category": "standard",
            "@height": "529",
            "@width": "678",
            "@_fa": "true",
            "$": "https://api.elsevier.com/content/object/eid/1-s2.0-S0926860X25001206-gr3.jpg?httpAccept=%2A%2F%2A",
            "@multimediatype": "JPEG image file",
            "@type": "IMAGE-DOWNSAMPLED",
            "@size": "79969",
            "@ref": "gr3",
            "@mimetype": "image/jpeg"
          },
          {
            "@category": "thumbnail",
            "@height": "161",
            "@width": "54",
            "@_fa": "true",
            "$": "https://api.elsevier.com/content/object/eid/1-s2.0-S0926860X25001206-gr6.sml?httpAccept=%2A%2F%2A",
            "@multimediatype": "GIF image file",
            "@type": "IMAGE-THUMBNAIL",
            "@size": "6660",
            "@ref": "gr6",
            "@mimetype": "image/gif"
          },
          {
            "@category": "thumbnail",
            "@height": "164",
            "@width": "191",
            "@_fa": "true",
            "$": "https://api.elsevier.com/content/object/eid/1-s2.0-S0926860X25001206-gr5.sml?httpAccept=%2A%2F%2A",
            "@multimediatype": "GIF image file",
            "@type": "IMAGE-THUMBNAIL",
            "@size": "6366",
            "@ref": "gr5",
            "@mimetype": "image/gif"
          },
          {
            "@category": "thumbnail",
            "@height": "164",
            "@width": "201",
            "@_fa": "true",
            "$": "https://api.elsevier.com/content/object/eid/1-s2.0-S0926860X25001206-gr8.sml?httpAccept=%2A%2F%2A",
            "@multimediatype": "GIF image file",
            "@type": "IMAGE-THUMBNAIL",
            "@size": "12432",
            "@ref": "gr8",
            "@mimetype": "image/gif"
          },
          {
            "@category": "thumbnail",
            "@height": "99",
            "@width": "219",
            "@_fa": "true",
            "$": "https://api.elsevier.com/content/object/eid/1-s2.0-S0926860X25001206-gr7.sml?httpAccept=%2A%2F%2A",
            "@multimediatype": "GIF image file",
            "@type": "IMAGE-THUMBNAIL",
            "@size": "8440",
            "@ref": "gr7",
            "@mimetype": "image/gif"
          },
          {
            "@category": "thumbnail",
            "@height": "164",
            "@width": "215",
            "@_fa": "true",
            "$": "https://api.elsevier.com/content/object/eid/1-s2.0-S0926860X25001206-gr9.sml?httpAccept=%2A%2F%2A",
            "@multimediatype": "GIF image file",
            "@type": "IMAGE-THUMBNAIL",
            "@size": "7058",
            "@ref": "gr9",
            "@mimetype": "image/gif"
          },
          {
            "@category": "thumbnail",
            "@height": "87",
            "@width": "219",
            "@_fa": "true",
            "$": "https://api.elsevier.com/content/object/eid/1-s2.0-S0926860X25001206-gr2.sml?httpAccept=%2A%2F%2A",
            "@multimediatype": "GIF image file",
            "@type": "IMAGE-THUMBNAIL",
            "@size": "6582",
            "@ref": "gr2",
            "@mimetype": "image/gif"
          },
          {
            "@category": "thumbnail",
            "@height": "133",
            "@width": "219",
            "@_fa": "true",
            "$": "https://api.elsevier.com/content/object/eid/1-s2.0-S0926860X25001206-ga1.sml?httpAccept=%2A%2F%2A",
            "@multimediatype": "GIF image file",
            "@type": "IMAGE-THUMBNAIL",
            "@size": "16158",
            "@ref": "ga1",
            "@mimetype": "image/gif"
          },
          {
            "@category": "thumbnail",
            "@height": "164",
            "@width": "217",
            "@_fa": "true",
            "$": "https://api.elsevier.com/content/object/eid/1-s2.0-S0926860X25001206-gr1.sml?httpAccept=%2A%2F%2A",
            "@multimediatype": "GIF image file",
            "@type": "IMAGE-THUMBNAIL",
            "@size": "6338",
            "@ref": "gr1",
            "@mimetype": "image/gif"
          },
          {
            "@category": "thumbnail",
            "@height": "164",
            "@width": "203",
            "@_fa": "true",
            "$": "https://api.elsevier.com/content/object/eid/1-s2.0-S0926860X25001206-gr4.sml?httpAccept=%2A%2F%2A",
            "@multimediatype": "GIF image file",
            "@type": "IMAGE-THUMBNAIL",
            "@size": "10645",
            "@ref": "gr4",
            "@mimetype": "image/gif"
          },
          {
            "@category": "thumbnail",
            "@height": "164",
            "@width": "210",
            "@_fa": "true",
            "$": "https://api.elsevier.com/content/object/eid/1-s2.0-S0926860X25001206-gr3.sml?httpAccept=%2A%2F%2A",
            "@multimediatype": "GIF image file",
            "@type": "IMAGE-THUMBNAIL",
            "@size": "13752",
            "@ref": "gr3",
            "@mimetype": "image/gif"
          },
          {
            "@category": "high",
            "@height": "3724",
            "@width": "1247",
            "@_fa": "true",
            "$": "https://api.elsevier.com/content/object/eid/1-s2.0-S0926860X25001206-gr6_lrg.jpg?httpAccept=%2A%2F%2A",
            "@multimediatype": "JPEG image file",
            "@type": "IMAGE-HIGH-RES",
            "@size": "567101",
            "@ref": "gr6",
            "@mimetype": "image/jpeg"
          },
          {
            "@category": "high",
            "@height": "1286",
            "@width": "1498",
            "@_fa": "true",
            "$": "https://api.elsevier.com/content/object/eid/1-s2.0-S0926860X25001206-gr5_lrg.jpg?httpAccept=%2A%2F%2A",
            "@multimediatype": "JPEG image file",
            "@type": "IMAGE-HIGH-RES",
            "@size": "104166",
            "@ref": "gr5",
            "@mimetype": "image/jpeg"
          },
          {
            "@category": "high",
            "@height": "2445",
            "@width": "2994",
            "@_fa": "true",
            "$": "https://api.elsevier.com/content/object/eid/1-s2.0-S0926860X25001206-gr8_lrg.jpg?httpAccept=%2A%2F%2A",
            "@multimediatype": "JPEG image file",
            "@type": "IMAGE-HIGH-RES",
            "@size": "419683",
            "@ref": "gr8",
            "@mimetype": "image/jpeg"
          },
          {
            "@category": "high",
            "@height": "1357",
            "@width": "2995",
            "@_fa": "true",
            "$": "https://api.elsevier.com/content/object/eid/1-s2.0-S0926860X25001206-gr7_lrg.jpg?httpAccept=%2A%2F%2A",
            "@multimediatype": "JPEG image file",
            "@type": "IMAGE-HIGH-RES",
            "@size": "213090",
            "@ref": "gr7",
            "@mimetype": "image/jpeg"
          },
          {
            "@category": "high",
            "@height": "1140",
            "@width": "1499",
            "@_fa": "true",
            "$": "https://api.elsevier.com/content/object/eid/1-s2.0-S0926860X25001206-gr9_lrg.jpg?httpAccept=%2A%2F%2A",
            "@multimediatype": "JPEG image file",
            "@type": "IMAGE-HIGH-RES",
            "@size": "101397",
            "@ref": "gr9",
            "@mimetype": "image/jpeg"
          },
          {
            "@category": "high",
            "@height": "1183",
            "@width": "2993",
            "@_fa": "true",
            "$": "https://api.elsevier.com/content/object/eid/1-s2.0-S0926860X25001206-gr2_lrg.jpg?httpAccept=%2A%2F%2A",
            "@multimediatype": "JPEG image file",
            "@type": "IMAGE-HIGH-RES",
            "@size": "176250",
            "@ref": "gr2",
            "@mimetype": "image/jpeg"
          },
          {
            "@category": "high",
            "@height": "886",
            "@width": "1464",
            "@_fa": "true",
            "$": "https://api.elsevier.com/content/object/eid/1-s2.0-S0926860X25001206-ga1_lrg.jpg?httpAccept=%2A%2F%2A",
            "@multimediatype": "JPEG image file",
            "@type": "IMAGE-HIGH-RES",
            "@size": "181579",
            "@ref": "ga1",
            "@mimetype": "image/jpeg"
          },
          {
            "@category": "high",
            "@height": "1132",
            "@width": "1499",
            "@_fa": "true",
            "$": "https://api.elsevier.com/content/object/eid/1-s2.0-S0926860X25001206-gr1_lrg.jpg?httpAccept=%2A%2F%2A",
            "@multimediatype": "JPEG image file",
            "@type": "IMAGE-HIGH-RES",
            "@size": "70538",
            "@ref": "gr1",
            "@mimetype": "image/jpeg"
          },
          {
            "@category": "high",
            "@height": "2417",
            "@width": "2994",
            "@_fa": "true",
            "$": "https://api.elsevier.com/content/object/eid/1-s2.0-S0926860X25001206-gr4_lrg.jpg?httpAccept=%2A%2F%2A",
            "@multimediatype": "JPEG image file",
            "@type": "IMAGE-HIGH-RES",
            "@size": "345994",
            "@ref": "gr4",
            "@mimetype": "image/jpeg"
          },
          {
            "@category": "high",
            "@height": "2337",
            "@width": "2995",
            "@_fa": "true",
            "$": "https://api.elsevier.com/content/object/eid/1-s2.0-S0926860X25001206-gr3_lrg.jpg?httpAccept=%2A%2F%2A",
            "@multimediatype": "JPEG image file",
            "@type": "IMAGE-HIGH-RES",
            "@size": "360545",
            "@ref": "gr3",
            "@mimetype": "image/jpeg"
          },
          {
            "@category": "standard",
            "@_fa": "true",
            "$": "https://api.elsevier.com/content/object/eid/1-s2.0-S0926860X25001206-mmc1.docx?httpAccept=%2A%2F%2A",
            "@multimediatype": "Microsoft Word file",
            "@type": "APPLICATION",
            "@size": "2183768",
            "@ref": "mmc1",
            "@mimetype": "application/word"
          },
          {
            "@category": "thumbnail",
            "@_fa": "true",
            "$": "https://api.elsevier.com/content/object/eid/1-s2.0-S0926860X25001206-si0001.svg?httpAccept=%2A%2F%2A",
            "@multimediatype": "Scalable Vector Graphics file",
            "@type": "ALTIMG",
            "@size": "5730",
            "@ref": "si0001",
            "@mimetype": "image/svg+xml"
          },
          {
            "@category": "thumbnail",
            "@_fa": "true",
            "$": "https://api.elsevier.com/content/object/eid/1-s2.0-S0926860X25001206-si0002.svg?httpAccept=%2A%2F%2A",
            "@multimediatype": "Scalable Vector Graphics file",
            "@type": "ALTIMG",
            "@size": "5239",
            "@ref": "si0002",
            "@mimetype": "image/svg+xml"
          },
          {
            "@category": "thumbnail",
            "@_fa": "true",
            "$": "https://api.elsevier.com/content/object/eid/1-s2.0-S0926860X25001206-si0003.svg?httpAccept=%2A%2F%2A",
            "@multimediatype": "Scalable Vector Graphics file",
            "@type": "ALTIMG",
            "@size": "6994",
            "@ref": "si0003",
            "@mimetype": "image/svg+xml"
          },
          {
            "@category": "thumbnail",
            "@_fa": "true",
            "$": "https://api.elsevier.com/content/object/eid/1-s2.0-S0926860X25001206-si0004.svg?httpAccept=%2A%2F%2A",
            "@multimediatype": "Scalable Vector Graphics file",
            "@type": "ALTIMG",
            "@size": "1272",
            "@ref": "si0004",
            "@mimetype": "image/svg+xml"
          }
        ]
      },
      "link": {
        "@rel": "abstract",
        "@href": "https://api.elsevier.com/content/abstract/scopus_id/86000780368"
      }
    }
  }
}