{
  "metadata": {
    "title": "Steam reforming of the alcohols with varied structures: Impacts of acidic sites of Ni catalysts on coking",
    "authors": "; ; ",
    "journal": "Applied Catalysis A: General",
    "date": "2019-08-25",
    "doi": "10.1016/j.apcata.2019.117162",
    "abstract": "",
    "uri": "https://api.elsevier.com/content/article/pii/S0926860X19303175",
    "pii": "S0926860X19303175"
  },
  "fulltext": {
    "full-text-retrieval-response": {
      "scopus-eid": "2-s2.0-85069879642",
      "originalText": "serial JL 271346 291210 291744 291809 31 Applied Catalysis A: General APPLIEDCATALYSISAGENERAL 2019-07-20 2019-07-20 2019-07-29 2019-07-29 2019-08-26T16:52:39 1-s2.0-S0926860X19303175 S0926-860X(19)30317-5 S0926860X19303175 10.1016/j.apcata.2019.117162 S300 S300.1 FULL-TEXT 1-s2.0-S0926860X19X00137 2024-01-01T12:33:10.553292Z 0 0 20190825 2019 2019-07-20T14:53:17.266246Z absattachment articleinfo articlenumber articletitlenorm authfirstinitialnorm authfirstsurnamenorm cid cids contenttype copyright crossmark dateloaded dateloadedtxt datesearch datesort dateupdated dco docsubtype doctype doi eid ewtransactionid hubeid indexeddate issn issnnorm itemstage itemtransactionid itemweight openaccess openarchive pg pgfirst pii piinorm pubdatestart pubdatetxt pubyr sectiontitle sortorder srctitle srctitlenorm srctype ssids alllist content subj subheadings suppl tomb volfirst volissue volumelist webpdf webpdfpagecount yearnav figure table e-component body mmlmath acknowledge affil appendices articletitle auth authfirstini authfull authkeywords authlast grantnumber grantsponsor grantsponsorid highlightsabst orcid primabst ref specialabst 0926-860X 0926860X true 584 584 C Volume 584 13 117162 117162 117162 20190825 25 August 2019 2019-08-25 2019 Regular papers article fla © 2019 Elsevier B.V. All rights reserved. STEAMREFORMINGALCOHOLSVARIEDSTRUCTURESIMPACTSACIDICSITESNICATALYSTSCOKING LI Y 1 Introduction 2 Experimental 2.1 Catalysts preparation 2.2 Characterization of catalysts 2.3 Catalytic tests 3 Results and discussion 3.1 Catalysts characterization 3.1.1 BET analysis 3.1.2 H2-TPR characterization 3.1.3 XRD characterization 3.1.4 TPD analysis 3.1.4.1 CO2-TPD characterization 3.1.4.2 NH3-TPD characterization 3.1.4.3 Pyridine-DRIFTS characterization 3.2 Catalysts tests 3.2.1 Evaluation of activities of the catalysts 3.2.2 In-situ DRIFTS of steam reforming of the alcohols 3.3 Evaluation of the catalysts versus prolonged reaction time 3.3.1 Catalytic performance 3.3.2 Characterization of the spent catalysts 3.3.2.1 TEM characterizations 3.3.2.2 TG characterizations 3.3.2.3 TG-MS characterizations 3.3.2.4 TPO-MS characterizations 3.3.2.5 FT-IR characterizations 3.3.2.6 Raman characterizations 3.3.2.7 XRD characterizations 3.3.3 Discussion on the characterization results of spent catalysts 4 Conclusions Acknowledgements Appendix A Supplementary data References AZENHA 2017 400 407 C WURZLER 2016 115 128 G ZHANG 2018 137 156 L HU 2009 926 933 X MA 2016 321 331 H MONTERO 2015 15963 15971 C MONTERO 2018 207 216 C BOSSOLA 2016 599 611 F YU 2018 538 553 Z CESAR 2016 22000 22008 D MEI 2015 315 325 D WU 2013 1052 1062 G KOUSI 2017 201 211 K WANG 2014 18675 18687 S JACOBS 2007 326 337 G PALMERI 2008 6627 6634 N LEVALANT 2011 311 318 A DOU 2014 950 960 B POMPEO 2010 8912 8920 F LARMIER 2015 4423 4437 K BOBADILLA 2014 5704 5712 L DEREZENDE 2015 108 118 S CIFTCI 2012 113 119 A SANCHEZSANCHEZ 2007 1462 1471 M BRACCIALE 2019 48 59 M HU 2010 7169 7176 X VICENTE 2014 18820 18834 J CHARISIOU 2019 206 219 N ZHANG 2019 566 579 Z RICHARDSON 2004 35 46 J BURATTIN 1997 7060 7074 P BURATTIN 1998 2722 2732 P FENG 2009 351 358 J XU 2011 177 190 L YUAN 2011 431 440 Z REDDY 2005 81 89 B NIE 2012 419 425 R FEI 2006 49 54 J STEVENS 2003 61 71 R JANKOVIC 2003 227 233 L KALITA 2007 338 347 P STEVENS 2003 57 74 R LOVELESS 2008 591 597 B KUMAR 2017 169 176 V LEFRANCOIS 1971 350 358 M LAGO 2018 16 27 C ZANG 2017 1583 1592 Y LEI 2016 3457 3460 Y HERNANDEZ 2017 5269 5302 W GAO 2012 2358 2368 J SHUI 2015 e1400129 J FENG 2016 355 361 L MONTERO 2015 181 192 C LI 2019 Y ZHANG 2018 389 403 Z DASILVA 2011 94 109 A YERMAN 2014 5225 5233 L LUCREDIO 2011 1424 1430 A FENG 2016 422 432 D WANG 2014 269 275 F ZHAO 2016 54 60 Y ZHANG 2019 176 193 Z ZHANG 2019 138 151 Z LIX2019X117162 LIX2019X117162XY 2021-07-29T00:00:00.000Z 2021-07-29T00:00:00.000Z http://creativecommons.org/licenses/by-nc-nd/4.0/ © 2019 Elsevier B.V. All rights reserved. 2019-07-18T08:27:39.490Z http://vtw.elsevier.com/data/voc/AddOnTypes/50.7/eoas NSFC National Natural Science Foundation of China http://data.elsevier.com/vocabulary/SciValFunders/501100001809 http://sws.geonames.org/1814991 Key Technology Research and Development Program of Shandong http://data.elsevier.com/vocabulary/SciValFunders/100014103 http://sws.geonames.org/1814991 item S0926-860X(19)30317-5 S0926860X19303175 1-s2.0-S0926860X19303175 10.1016/j.apcata.2019.117162 271346 2024-01-01T12:33:10.553292Z 2019-08-25 1-s2.0-S0926860X19303175-main.pdf https://s3.amazonaws.com/prod-ucs-content-store-us-east/content/pii:S0926860X19303175/MAIN/application/pdf/840c2f4e6cbf9a6f765617703245d38f/main.pdf main.pdf pdf true 10856874 MAIN 19 1-s2.0-S0926860X19303175-main_1.png https://s3.amazonaws.com/prod-ucs-content-store-us-east/content/pii:S0926860X19303175/PREVIEW/image/png/39c3d56fc0ed3b36fc13fc0dd24b95a1/main_1.png main_1.png png 53383 849 656 IMAGE-WEB-PDF 1 1-s2.0-S0926860X19303175-gr2.sml https://s3.amazonaws.com/prod-ucs-content-store-us-east/content/pii:S0926860X19303175/gr2/THUMBNAIL/image/gif/f90d9092f47145ea32a4f861196e9c65/gr2.sml gr2 gr2.sml sml 12430 163 142 IMAGE-THUMBNAIL 1-s2.0-S0926860X19303175-gr3.sml https://s3.amazonaws.com/prod-ucs-content-store-us-east/content/pii:S0926860X19303175/gr3/THUMBNAIL/image/gif/da1ea6e568e6e0923ebd11b9cf6e6fba/gr3.sml gr3 gr3.sml sml 8597 163 110 IMAGE-THUMBNAIL 1-s2.0-S0926860X19303175-gr4.sml https://s3.amazonaws.com/prod-ucs-content-store-us-east/content/pii:S0926860X19303175/gr4/THUMBNAIL/image/gif/7f3829577f440db5783dd16c3246cbef/gr4.sml gr4 gr4.sml sml 8150 163 103 IMAGE-THUMBNAIL 1-s2.0-S0926860X19303175-gr5.sml https://s3.amazonaws.com/prod-ucs-content-store-us-east/content/pii:S0926860X19303175/gr5/THUMBNAIL/image/gif/f8f3fe5e7e97cbbe7150972a77442b9c/gr5.sml gr5 gr5.sml sml 8224 164 106 IMAGE-THUMBNAIL 1-s2.0-S0926860X19303175-gr1.sml https://s3.amazonaws.com/prod-ucs-content-store-us-east/content/pii:S0926860X19303175/gr1/THUMBNAIL/image/gif/f4e161f02b730bac1672aa8a9222a66b/gr1.sml gr1 gr1.sml sml 11531 164 204 IMAGE-THUMBNAIL 1-s2.0-S0926860X19303175-gr6.sml https://s3.amazonaws.com/prod-ucs-content-store-us-east/content/pii:S0926860X19303175/gr6/THUMBNAIL/image/gif/bd9db11ad62f9494ae8566178e85a7cc/gr6.sml gr6 gr6.sml sml 10425 163 85 IMAGE-THUMBNAIL 1-s2.0-S0926860X19303175-gr7.sml https://s3.amazonaws.com/prod-ucs-content-store-us-east/content/pii:S0926860X19303175/gr7/THUMBNAIL/image/gif/b13b59a94ac3b03c0f694002c46f966f/gr7.sml gr7 gr7.sml sml 7038 164 114 IMAGE-THUMBNAIL 1-s2.0-S0926860X19303175-gr8.sml https://s3.amazonaws.com/prod-ucs-content-store-us-east/content/pii:S0926860X19303175/gr8/THUMBNAIL/image/gif/c69b6c4befda503b25f1846c299a5195/gr8.sml gr8 gr8.sml sml 6875 164 117 IMAGE-THUMBNAIL 1-s2.0-S0926860X19303175-gr9.sml https://s3.amazonaws.com/prod-ucs-content-store-us-east/content/pii:S0926860X19303175/gr9/THUMBNAIL/image/gif/2a4e288536950b712f41668f113897de/gr9.sml gr9 gr9.sml sml 6903 164 98 IMAGE-THUMBNAIL 1-s2.0-S0926860X19303175-ga1.sml https://s3.amazonaws.com/prod-ucs-content-store-us-east/content/pii:S0926860X19303175/ga1/THUMBNAIL/image/gif/a6dadf57a423fb285a475ac983f6813b/ga1.sml ga1 true ga1.sml sml 22629 163 219 IMAGE-THUMBNAIL 1-s2.0-S0926860X19303175-gr10.sml https://s3.amazonaws.com/prod-ucs-content-store-us-east/content/pii:S0926860X19303175/gr10/THUMBNAIL/image/gif/8f140fdccbb3093d06badb28384c5380/gr10.sml gr10 gr10.sml sml 10086 164 147 IMAGE-THUMBNAIL 1-s2.0-S0926860X19303175-sc1.sml https://s3.amazonaws.com/prod-ucs-content-store-us-east/content/pii:S0926860X19303175/sc1/THUMBNAIL/image/gif/04504a938f7e39a8285c5b1785a5b406/sc1.sml sc1 sc1.sml sml 6421 164 196 IMAGE-THUMBNAIL 1-s2.0-S0926860X19303175-gr2.jpg https://s3.amazonaws.com/prod-ucs-content-store-us-east/content/pii:S0926860X19303175/gr2/DOWNSAMPLED/image/jpeg/81c394f97afafb4460e31cb1881c270e/gr2.jpg gr2 gr2.jpg jpg 192715 822 715 IMAGE-DOWNSAMPLED 1-s2.0-S0926860X19303175-gr3.jpg https://s3.amazonaws.com/prod-ucs-content-store-us-east/content/pii:S0926860X19303175/gr3/DOWNSAMPLED/image/jpeg/531bb55a757ef6d03c4787b92b474597/gr3.jpg gr3 gr3.jpg jpg 193560 979 659 IMAGE-DOWNSAMPLED 1-s2.0-S0926860X19303175-gr4.jpg https://s3.amazonaws.com/prod-ucs-content-store-us-east/content/pii:S0926860X19303175/gr4/DOWNSAMPLED/image/jpeg/f7c6c0f1554eb94485ec9a08c2a50c5b/gr4.jpg gr4 gr4.jpg jpg 202850 955 602 IMAGE-DOWNSAMPLED 1-s2.0-S0926860X19303175-gr5.jpg https://s3.amazonaws.com/prod-ucs-content-store-us-east/content/pii:S0926860X19303175/gr5/DOWNSAMPLED/image/jpeg/20575e186569914a8606d874e7a4098c/gr5.jpg gr5 gr5.jpg jpg 174752 958 621 IMAGE-DOWNSAMPLED 1-s2.0-S0926860X19303175-gr1.jpg https://s3.amazonaws.com/prod-ucs-content-store-us-east/content/pii:S0926860X19303175/gr1/DOWNSAMPLED/image/jpeg/3b3506a95b4b67f22de79f38b3b57da1/gr1.jpg gr1 gr1.jpg jpg 122271 604 753 IMAGE-DOWNSAMPLED 1-s2.0-S0926860X19303175-gr6.jpg https://s3.amazonaws.com/prod-ucs-content-store-us-east/content/pii:S0926860X19303175/gr6/DOWNSAMPLED/image/jpeg/c92d67d2634ce0f5f185adade0131b9e/gr6.jpg gr6 gr6.jpg jpg 204022 976 508 IMAGE-DOWNSAMPLED 1-s2.0-S0926860X19303175-gr7.jpg https://s3.amazonaws.com/prod-ucs-content-store-us-east/content/pii:S0926860X19303175/gr7/DOWNSAMPLED/image/jpeg/ce7dfee02f3457130eb8e9ff8c7e24ec/gr7.jpg gr7 gr7.jpg jpg 155639 947 659 IMAGE-DOWNSAMPLED 1-s2.0-S0926860X19303175-gr8.jpg https://s3.amazonaws.com/prod-ucs-content-store-us-east/content/pii:S0926860X19303175/gr8/DOWNSAMPLED/image/jpeg/671cb4bd71854543c966b0fcce97f8e4/gr8.jpg gr8 gr8.jpg jpg 130220 925 659 IMAGE-DOWNSAMPLED 1-s2.0-S0926860X19303175-gr9.jpg https://s3.amazonaws.com/prod-ucs-content-store-us-east/content/pii:S0926860X19303175/gr9/DOWNSAMPLED/image/jpeg/1555340799f6cf8afac3455807e1e807/gr9.jpg gr9 gr9.jpg jpg 147120 944 565 IMAGE-DOWNSAMPLED 1-s2.0-S0926860X19303175-ga1.jpg https://s3.amazonaws.com/prod-ucs-content-store-us-east/content/pii:S0926860X19303175/ga1/DOWNSAMPLED/image/jpeg/024db723b848ddd366d4a57a271c461f/ga1.jpg ga1 true ga1.jpg jpg 18364 200 268 IMAGE-DOWNSAMPLED 1-s2.0-S0926860X19303175-gr10.jpg https://s3.amazonaws.com/prod-ucs-content-store-us-east/content/pii:S0926860X19303175/gr10/DOWNSAMPLED/image/jpeg/f144ccf97576666daf92785cf6efc3c3/gr10.jpg gr10 gr10.jpg jpg 181788 839 753 IMAGE-DOWNSAMPLED 1-s2.0-S0926860X19303175-sc1.jpg https://s3.amazonaws.com/prod-ucs-content-store-us-east/content/pii:S0926860X19303175/sc1/DOWNSAMPLED/image/jpeg/79ae79a3a9cc9c1a1b76e04bb5160627/sc1.jpg sc1 sc1.jpg jpg 47121 473 565 IMAGE-DOWNSAMPLED 1-s2.0-S0926860X19303175-gr2_lrg.jpg https://s3.amazonaws.com/prod-ucs-content-store-us-east/content/pii:S0926860X19303175/gr2/HIGHRES/image/jpeg/e09e7df5f19729811013a84b121ef2ca/gr2_lrg.jpg gr2 gr2_lrg.jpg jpg 1571231 3642 3167 IMAGE-HIGH-RES 1-s2.0-S0926860X19303175-gr3_lrg.jpg https://s3.amazonaws.com/prod-ucs-content-store-us-east/content/pii:S0926860X19303175/gr3/HIGHRES/image/jpeg/bef3c1d2b44f9bcb00b6fa141d52ec9a/gr3_lrg.jpg gr3 gr3_lrg.jpg jpg 1356983 4335 2917 IMAGE-HIGH-RES 1-s2.0-S0926860X19303175-gr4_lrg.jpg https://s3.amazonaws.com/prod-ucs-content-store-us-east/content/pii:S0926860X19303175/gr4/HIGHRES/image/jpeg/d6b4975b2e153d9fc28d04951039a49c/gr4_lrg.jpg gr4 gr4_lrg.jpg jpg 1605305 4232 2667 IMAGE-HIGH-RES 1-s2.0-S0926860X19303175-gr5_lrg.jpg https://s3.amazonaws.com/prod-ucs-content-store-us-east/content/pii:S0926860X19303175/gr5/HIGHRES/image/jpeg/d2c6f3306a6d771a69754306dff4f792/gr5_lrg.jpg gr5 gr5_lrg.jpg jpg 1264776 4244 2750 IMAGE-HIGH-RES 1-s2.0-S0926860X19303175-gr1_lrg.jpg https://s3.amazonaws.com/prod-ucs-content-store-us-east/content/pii:S0926860X19303175/gr1/HIGHRES/image/jpeg/f8d930bf5e7ca3ebeab10a635e25ab54/gr1_lrg.jpg gr1 gr1_lrg.jpg jpg 859431 2672 3333 IMAGE-HIGH-RES 1-s2.0-S0926860X19303175-gr6_lrg.jpg https://s3.amazonaws.com/prod-ucs-content-store-us-east/content/pii:S0926860X19303175/gr6/HIGHRES/image/jpeg/5614f5139605653956034265a5ec3f0d/gr6_lrg.jpg gr6 gr6_lrg.jpg jpg 2637062 4324 2250 IMAGE-HIGH-RES 1-s2.0-S0926860X19303175-gr7_lrg.jpg https://s3.amazonaws.com/prod-ucs-content-store-us-east/content/pii:S0926860X19303175/gr7/HIGHRES/image/jpeg/9b9b41e2db0f2c7e5816bbd388141527/gr7_lrg.jpg gr7 gr7_lrg.jpg jpg 1142690 4193 2917 IMAGE-HIGH-RES 1-s2.0-S0926860X19303175-gr8_lrg.jpg https://s3.amazonaws.com/prod-ucs-content-store-us-east/content/pii:S0926860X19303175/gr8/HIGHRES/image/jpeg/33fcc8f6b3ca2e93a0d650bb9078cad5/gr8_lrg.jpg gr8 gr8_lrg.jpg jpg 1057024 4093 2917 IMAGE-HIGH-RES 1-s2.0-S0926860X19303175-gr9_lrg.jpg https://s3.amazonaws.com/prod-ucs-content-store-us-east/content/pii:S0926860X19303175/gr9/HIGHRES/image/jpeg/0c54cc71018f02d910a0c9cb921f65fa/gr9_lrg.jpg gr9 gr9_lrg.jpg jpg 1127898 4175 2500 IMAGE-HIGH-RES 1-s2.0-S0926860X19303175-ga1_lrg.jpg https://s3.amazonaws.com/prod-ucs-content-store-us-east/content/pii:S0926860X19303175/ga1/HIGHRES/image/jpeg/9e7dc3ec56135bfce4e4eb63dbd13ea1/ga1_lrg.jpg ga1 true ga1_lrg.jpg jpg 147543 886 1187 IMAGE-HIGH-RES 1-s2.0-S0926860X19303175-gr10_lrg.jpg https://s3.amazonaws.com/prod-ucs-content-store-us-east/content/pii:S0926860X19303175/gr10/HIGHRES/image/jpeg/c9c6cad1af0044d55caa36f2822cef7c/gr10_lrg.jpg gr10 gr10_lrg.jpg jpg 1356777 3712 3333 IMAGE-HIGH-RES 1-s2.0-S0926860X19303175-sc1_lrg.jpg https://s3.amazonaws.com/prod-ucs-content-store-us-east/content/pii:S0926860X19303175/sc1/HIGHRES/image/jpeg/5e8b037ce4636f5a083da1cdbc814300/sc1_lrg.jpg sc1 sc1_lrg.jpg jpg 350714 2095 2500 IMAGE-HIGH-RES 1-s2.0-S0926860X19303175-mmc1.docx https://s3.amazonaws.com/prod-ucs-content-store-us-east/content/pii:S0926860X19303175/mmc1/MAIN/application/vnd.openxmlformats-officedocument.wordprocessingml.document/f82327f3be73186f83eed8bf811108df/mmc1.docx mmc1 mmc1.docx docx 21176158 APPLICATION 1-s2.0-S0926860X19303175-si3.gif https://s3.amazonaws.com/prod-ucs-content-store-us-east/content/pii:S0926860X19303175/STRIPIN/image/gif/daf77c22d056ca9766226e60fdce3a30/si3.gif si3 si3.gif gif 1341 31 503 ALTIMG 1-s2.0-S0926860X19303175-si4.gif https://s3.amazonaws.com/prod-ucs-content-store-us-east/content/pii:S0926860X19303175/STRIPIN/image/gif/470c27195505a2b5c198b423d2e1a7d6/si4.gif si4 si4.gif gif 1409 31 525 ALTIMG 1-s2.0-S0926860X19303175-si5.gif https://s3.amazonaws.com/prod-ucs-content-store-us-east/content/pii:S0926860X19303175/STRIPIN/image/gif/87c49514ec22750a724cca6546caeb8e/si5.gif si5 si5.gif gif 1820 46 556 ALTIMG 1-s2.0-S0926860X19303175-si2.gif https://s3.amazonaws.com/prod-ucs-content-store-us-east/content/pii:S0926860X19303175/STRIPIN/image/gif/6ca43720ee73c48d42191882645ce23c/si2.gif si2 si2.gif gif 1304 31 476 ALTIMG 1-s2.0-S0926860X19303175-si1.gif https://s3.amazonaws.com/prod-ucs-content-store-us-east/content/pii:S0926860X19303175/STRIPIN/image/gif/49f4386f5c0d41e61398b12ca034344c/si1.gif si1 si1.gif gif 1312 31 488 ALTIMG 1-s2.0-S0926860X19303175-si6.gif https://s3.amazonaws.com/prod-ucs-content-store-us-east/content/pii:S0926860X19303175/STRIPIN/image/gif/718c825b97ed2a015418f28638bc929b/si6.gif si6 si6.gif gif 1449 46 420 ALTIMG 1-s2.0-S0926860X19303175-si7.gif https://s3.amazonaws.com/prod-ucs-content-store-us-east/content/pii:S0926860X19303175/STRIPIN/image/gif/ff2b0ae5cc3d052db3e1804af8e1dff9/si7.gif si7 si7.gif gif 1718 46 594 ALTIMG 1-s2.0-S0926860X19303175-am.pdf am am.pdf pdf 3396333 AAM-PDF https://s3-eu-west-1.amazonaws.com/prod-ucs-content-store-eu-west/content/egi:10BLVNM9LRS/MAIN/application/pdf/8ecb84218bc55a5a2cb911a935e4e3d7/am.pdf APCATA 117162 117162 S0926-860X(19)30317-5 10.1016/j.apcata.2019.117162 Elsevier B.V. Scheme 1 The proposed reaction pathways of glycerol steam reforming. Scheme 1 Fig. 1 (a) Volume distribution diagram of BJH adsorption hole of samples; (b): nitrogen adsorption–desorption isotherms curves of the samples; (c): H2-TPR spectra for the Ni-Al2O3 and Ni-SiO2 catalysts; (d): XRD patterns for calcined and reduced catalysts. Fig. 1 Fig. 2 (a) The CO2-TPD patterns of Ni-Al2O3 and Ni-SiO2 catalysts; (b) the NH3-TPD patterns of Ni-Al2O3 and Ni-SiO2 catalysts; (c) in-situ DRIFTS of desorption of pyridine on Ni-Al2O3 catalyst; (c*) 3D image of DRIFTS-pyridine of Ni-Al2O3 catalyst; (d) in-situ DRIFTS of desorption of pyridine on Ni-SiO2 catalyst; (c*) 3D image of DRIFTS-pyridine of Ni-SiO2 catalyst. Fig. 2 Fig. 3 The yield of the H2, CO2, CO and CH4 and the conversion of 1-propanol, 2-propanol, 1,2-propanediol and glycerol over Ni-Al2O3 and Ni-SiO2 steam reforming reaction process. Reaction conditions on the S/C = 5, liquid flow rate was 0.12 mL/min. Fig. 3 Fig. 4 In-situ DRIFTS study of the reaction intermediates in the steam reforming. (a) and (b): Ni-Al2O3 and Ni-SiO2 steam reforming 1-propanol; (c) and (d): Ni-Al2O3 and Ni-SiO2 steam reforming 2-propanol; (e) and (f): Ni-Al2O3 and Ni-SiO2 steam reforming 1,2-propanediol; (g) and (h): Ni-Al2O3 and Ni-SiO2 steam reforming glycerol. Fig. 4 Fig. 5 The tests of the catalysts under severe conditions for a prolonged time. Reaction conditions: T =600 °C, S/C = 1.5, liquid flow rate = 0.12 mL/min. Fig. 5 Fig. 6 TEM patterns of spent catalysts. (a) and (b): Ni-Al2O3 and Ni-SiO2 steam reforming 1-propanol; (c) and (d): Ni-Al2O3 and Ni-SiO2 steam reforming 2-propanol; (e) and (f): Ni-Al2O3 and Ni-SiO2 steam reforming 1,2-propanediol; (g) and (h): Ni-Al2O3 and Ni-SiO2 steam reforming glycerol. Fig. 6 Fig. 7 TG and DTG curves of the spent catalysts under air condition. Fig. 7 Fig. 8 TG-MS curves of the spent catalysts under N2 condition. Fig. 8 Fig. 9 TPO-MS curves of the spent catalysts. (a) and (b): thermal conductivity detector (TCD) curves; (c)-(j): MS curves. Fig. 9 Fig. 10 The analysis of spent catalysts. (a) and (b): FT-IR spectra; (c) and (d): Raman spectra; (e) and (f): XRD diffraction patterns. Fig. 10 Table 1 Pore volume, mean pore diameter, surface area and reduction degree for Al2O3 and SiO2 carriers, Ni-Al2O3 and Ni-SiO2 catalysts. Table 1 Samples Pore volume (cm3/g) Mean pore diameter(nm) Surface area(m2/g) Reduction degree(%) Al2O3 0.53 9.0 163.7 – Ni-Al2O3 0.43 9.2 123.5 60.0 SiO2 0.75 4.8 470.0 – Ni-SiO2 0.62 5.2 367.8 60.6 Table 2 The NiO grain sizes of the calcined Ni-Al2O3 and Ni-SiO2 catalysts, the Ni grain sizes of the reducted Ni-Al2O3 and Ni-SiO2 catalysts, the Ni and C grain sizes of spent catalysts. Table 2 Catalysts Feedstock Grain size (nm) Fresh catalysts Spent catalysts NiO Ni Ni C Ni-Al2O3 1-propanol 12.0 13.3 13.2 8.6 2-propanol 12.0 13.3 13.0 8.9 1,2-propanediol 12.0 13.3 13.9 9.6 glycerol 12.0 13.3 14.5 8.9 Ni-SiO2 1-propanol 13.3 14.6 13.7 8.3 2-propanol 13.3 14.6 11.8 8.6 1,2-propanediol 13.3 14.6 15.4 8.2 glycerol 13.3 14.6 15.3 7.8 Table 3 The relative amount of acid-basic sites measured based on NH3-TPD and CO2-TPD. Table 3 Catalysts Acid sites distribution based on NH3-TPD data a Weak Medium Strong Total Ni-Al2O3 0.32 0.41 0.27 1.0 Ni-SiO2 0.58 0.34 0.13 1.05 Catalysts Basic sites distribution based on CO2-TPD data b Weak Strong Total Ni-Al2O3 0.26 0.74 1.0 Ni-SiO2 0.05 0.44 0.49 a The total area of NH3-TPD pattern of Ni–Al2O3 was assigned as 1.0, and compared with the other samples. The 12a, 34bc and 5de desorption peaks were classified as weak, medium and strong acid sites. b The total area of CO2-TPD pattern of Ni–Al2O3 was assigned as 1.0, and compared with the other samples. The 12a desorption peaks were classified as weak basic sites, and 3–6 and b–f were classified as strong basic sites. Table 4 The weight loss and ratio of weight loss of spent catalysts in TG and TG-MS tests. Table 4 Feedstock Weight loss (%) a Ratio of weight loss (%) b Ni-Al2O3 Ni-SiO2 Ni-Al2O3 Ni-SiO2 1-propanol 60 42 46 42 2-propanol 41 42 58 39 1,2-propanediol 27 48 69 33 glycerol 38 65 52 71 a The weight loss of spent catalysts in the TG test (the mass lost in the balance test of the spent catalyst reduction has been added). b The ratio of the weight loss of the spent catalysts in the TG-MS tests (N2) to the TG tests (Air). Table 5 The relative area of the Raman fitted peaks of the spent catalysts. Table 5 Catalysts Feedstock S D GR G D/G Total a Ni-Al2O3 1-propanol 0.48 0.25 0.12 0.15 1.67 1.0 2-propanol 0.62 0.32 0.16 0.19 1.68 1.29 1,2-propanediol 0.88 0.42 0.31 0.25 1.68 1.86 glycerol 0.71 0.33 0.21 0.21 1.57 1.46 Ni-SiO2 1-propanol 0.23 0.1 0.1 0.06 1.67 0.49 2-propanol 0.5 0.26 0.15 0.15 1.73 1.06 1,2-propanediol 0.29 0.14 0.09 0.08 1.75 0.6 glycerol 0.1 0.14 0.23 0.09 1.56 0.56 a The Raman cumulative fitting peak of the spent catalys of Ni-Al2O3 catalyzed 1-propanol was regarded as 1.0, and compared with other fitted peaks. Steam reforming of the alcohols with varied structures: Impacts of acidic sites of Ni catalysts on coking Yuhang Li a Lijun Zhang a Zhanming Zhang a Qianhe Liu a Shu Zhang b Qing Liu c Guangzhi Hu d ⁎ Yi Wang e ⁎ Xun Hu a ⁎ a School of Material Science and Engineering, University of Jinan, Jinan 250022, PR China School of Material Science and Engineering University of Jinan Jinan 250022 PR China b College of Materials Science and Engineering, Nanjing Forestry University, Nanjing 210037, PR China College of Materials Science and Engineering Nanjing Forestry University Nanjing 210037 PR China c Key Laboratory of Low Carbon Energy and Chemical Engineering, College of Chemical and Environmental Engineering, Shandong University of Science and Technology, Qingdao 266590, PR China Key Laboratory of Low Carbon Energy and Chemical Engineering College of Chemical and Environmental Engineering Shandong University of Science and Technology Qingdao 266590 PR China d School of Chemical Science and Technology, Key Laboratory of Medicinal Chemistry for Nature Resource, Ministry of Education, Yunnan University, Kunming 650091, PR China School of Chemical Science and Technology Key Laboratory of Medicinal Chemistry for Nature Resource Ministry of Education Yunnan University Kunming 650091 PR China e School of Energy and Power Engineering, Huazhong University of Science and Technology, Wuhan, 430074, PR China School of Energy and Power Engineering Huazhong University of Science and Technology Wuhan 430074 PR China ⁎ Corresponding authors. Graphical abstract In this study, steam reforming of the alcohols with varied number of hydroxyl groups (1-propanol, 2-propanol, 1,2-propanediol and glycerol) were conducted over the Ni-Al2O3 and Ni-SiO2 catalysts with varied distribution of acid types. The results showed that the increase of number of hydroxyl groups in the alcohols suppressed the formation of CH4, but promoted the production of CO and the organic by-products. Both Lewis and Brønsted acidic sites were observed over Ni-Al2O3 catalyst, while Lewis acidic sites were dominated over Ni-SiO2 catalyst. The different reaction intermediates resulted in the formation of mainly amorphous coke over Ni-Al2O3 catalyst with some Ni grains were encapsulated by amorphous coke. In comparison, the coke over the Ni-SiO2 was mainly nanotube form. The varied reaction intermediates formed were observed with the in-situ Diffuse Reflectance Infrared Fourier Transform Spectroscopy studies of steam reforming of the alcohols. Keywords Acid-basic sites Alcohols steam reforming Nickel catalysts Coke properties In-situ DRIFTS studies 1 Introduction Hydrogen has long been used as a raw feedstock for chemical industry, while the rapidly developing fuel cell industry in recent years has further driven the interest in production of hydrogen [1–3]. At present, hydrogen is mainly produced in large scale from fossil fuels, while fossil fuels are nonrenewable and their use is associated with greenhouse gas emissions [4]. Hence, steam reforming of the organics having the renewability and carbon neutrality has attracted great attention in these years, such as ethanol [5–7], acetic acid [3,8,9], ethylene glycol [10,11] and glycerin [12,13]. Hu et al. [4] studied the impacts of the molecular structures of the reaction substrates such as methanol, ethanol, propanol, propylene glycol and glycerol on their catalytic behaviors during steam reforming. They found that long carbon chains promote coke deposition, and an increase in the number of hydroxyl groups inhibits CH4 and promotes CO production. Ma et al. [5] utilized ordered mesoporous materials to support Ni to improve the catalytic performance of ethanol steam reforming. The results showed that the added La element could increase the alkalinity of the catalyst for inhibiting coke deposition. Yu et al. [9] and Wu et al. [12] investigated the effects of precursors of Ni catalyst on the catalytic performances in steam reforming of acetic acid and glycerol, respectively. Their results showed that Cl element can poison Ni catalyst, thereby decreasing the catalytic performances. Organic compounds such as alcohols and acids have various molecular structures that could have a great impact on steam reforming in terms of distribution of the products and the properties of the coke formed [4,14–17]. For example, hydroxyl group is the functionality of alcohols. The location of hydroxyl group in alcohols with three or more carbon chains affects the abundance of the oxygen-containing intermediates formed and their reactivities towards dehydration reactions [17–20]. The acid-basic sites on the surface of the catalysts affect the dehydration of alcohols [21,22], the deposition of coke [21–24] and the gasification of coke [21,25–27]. Therefore, it is necessary to study the effects of the acid-basic sites on surface of reforming catalysts on the tendency of the coking as well as the properties of the coke formed from steam reforming of alcohols with varied molecular structure. Further to this, the understanding of the correlation of molecular structures of alcohols with their tendency to coking also helps to optimize the reforming process parameters to minimize coking and to design the effective catalyst to tackle the coking issue. In this study, Al2O3 and SiO2 carriers were used as the support of nickel species for the reforming of 1-propanol, 2-propanol, 1,2-propanediol and glycerol. The two different carriers contain different abundance/strength of acid-basic sites, which were analyzed by CO2-TPD, NH3-TPD, and pyridine-DRIFTS study. 1-Propanol, 2-propanol, 1,2-propanediol and glycerol are the alcohols with three carbon atoms but have varied number of hydroxyl group or the location of the hydroxyl groups. Understanding their reaction behaviors, especially the tendencies towards coke formation, would be of importance for probing the coking mechanism in steam reforming of alcohols. 2 Experimental 2.1 Catalysts preparation Ni-Al2O3 and Ni-SiO2 catalysts were prepared via an incipient wetness method. A certain amount of nickel nitrate hexahydrate was dissolved in double distilled water to achieve the Ni loading of 15 wt% to the carrier. The gamma alumina (ShangHai Hushi, surface area: 163.7 m2/g) and silica gel (ShangHai Hushi, surface area: 470.0 m2/g) carriers were calcined for 4 h at 600 °C before the impregnation. The impregnated samples were aged overnight at room temperature for 24 h and transferred to an oven set at 100 °C for further drying. Finally, the samples were placed in a muffle furnace and calcined for 4 h at 600 °C in static air. 2.2 Characterization of catalysts The BET tests were carried out on the SSA-6000 apparatus at 77 K using N2 (assuming a cross-sectional area of N2 of 16.2 Å2) as the absorption gas. Prior to the test, the samples were degassed for 4 h at 200 °C to remove moisture from the porous structures of the samples. The Brunauer–Emmet–Teller (BET) method was used to measure the pore distributions, pore volumes and specific surface areas of the reduced catalysts or carriers. The power X-ray diffraction (XRD) technique was used to measure diffraction patterns of the calcined, reduced (The sample was pre-reduced under a mixed atmosphere at 600 °C for 1 h in a mixed gases of N2/H2 with the flow rate of 60 mL/min) and spent catalysts to determine the characteristic and grain size of the catalysts. The fully ground samples were measured using a UItima IV diffractometer with a Cu K α irradiation source (λ = 1.5406 Å) at 40 kV and 40 mA with a step size of 0.02° and in the 2θ range from 10 to 90°. Temperature programmed reduction in hydrogen (H2-TPR) was used to determine the reduction behaviors of nickel oxides of the calcined catalysts. Approximately 40 mg (precisely weighed) of the catalysts were placed in a nitrogen stream at 150 °C for 1 h to remove the physically adsorbed moisture and other gas molecules for the pretreatment. After cooling, the H2-TPR tests were performed on Biaode PCA-1200 instrument. The measurements were carried out by using a 5% H2/Ar mixed gas with a flow rate of 20 mL/min and the heating from room temperature to 900 °C at a ramping rate of 10 °C/min. The signal changes were recorded by using a thermal conductivity detector (TCD). Temperature programmed desorption (TPD) with NH3 or CO2 as the absorption gas was used to measure the acid-basic sites of the catalysts. The NH3-TPD and CO2-TPD tests were performed on the Biaode PCA-1200 instrument. Accurately weighed 100.0 mg of the reduced catalysts were placed in a NH3 (CO2) atmosphere at a flow rate of 30 mL/min, and purged at 150 °C for 30 min to remove the gases or moisture adsorbed on the catalysts surface. After cooling to room temperature, the catalysts were further purged for 30 min to adsorb NH3 (CO2) gas. The catalysts were then continuously purged with helium gas at a flow rate of 30 mL/min, and the temperature were raised from room temperature to 900 °C at a heating rate of 10 °C/min, and the signal changes were measured by TCD. In-situ Diffuse Reflectance Infrared Fourier Transform Spectroscopy (DRIFTS) was used to detect the desorption of pyridine versus the increasing temperature (Pyridine-DRIFTS) to study the acidic sites of the catalysts. The tests were performed on a Nicolet iS50 spectrometer equipped with a liquid–nitrogen–cooled MCT detector and a modified Harrick Praying Mantis DRIFT cell. The reduced catalysts were thoroughly ground and placed in the DRIFT cell for the characterization. After background collection was carried out, pyridine was introduced into the DRIFT cell by N2 bubbling (20 mL/min, 60 °C) for 30 min to complete the adsorption. The catalysts were further purged with N2 at room temperature for 20 min, after which the catalysts were heated at a rate of 10 °C/min to 500 °C to desorb pyridine from surface of the catalyst. DRIFTS was used to measure the functionalities of the reactive intermediates during steam reforming of the alcohols by using a Nicolet iS50 spectrometer. The reduced and ground catalysts were placed in a DRIFTS cell and flattened. The 1-propanol, 2-propanol, 1,2-propanediol and glycerol reaction solution with a steam to carbon ratio (S/C) of 5 was heated at 87 °C, 72 °C, 80 °C and 80 °C in an oil bath and was introduced into the DRIFTS cell by bubbling N2 at a flow rate of 50 mL/min. The tests were performed via heating the sample to 600 °C at a heating rate of 10 °C/min. Transmission electron microscopy (TEM) was used to observe the morphology of coke in the spent catalysts. The tests were performed on the JEOL2010 instrument. The ground spent catalysts were ultrasonically dispersed into ethanol, and the supernatant was taken for the analysis. Thermogravimetric analyses (TGA) were used to determine the stability of the coke in the spent catalysts. The tests were performed in the TG8121 Riguku Corp instrument. The spent catalysts were thoroughly ground, weighed about 10 mg (precisely weighed), and heated from room temperature to 750 °C at a rate of 10 °C/min in an air flow of 40 mL/min. The temperature was kept at 150 °C for 5 min to remove the moisture contained in the catalysts. After the TG tests, the spent catalysts were reduced by introducing a H2/He (5%) mixed gas having a flow rate of 40 mL/min to balance the quality of the spent catalysts due to oxidation. The thermogravimetric analyses associated with mass spectra measurement (TG-MS) was used to determine the composition of the gaseous products produced during pyrolysis of the coke in the spent catalysts. The tests were performed on a TG8121 Riguku Corp instrument with an exhaust port connected to the in-situ mass spectrometer apparatus (Pfeiffer, MS GSD 320). Around 4 mg (precisely weighed) thoroughly ground spent catalysts were heated to 900 °C at a heating rate of 10 °C/min under a N2 flow of 20 mL/min. The temperature programmed oxidation and in-situ mass spectra measurement (TPO-MS) was used to determine the oxidation behaviors of the coke in the spent catalysts. The tests were performed on a Biaode PCA-1200 instrument. Approximately 10 mg (precisely weighed) spent catalysts were heated from room temperature to 850 °C at a heating rate of 10 °C/min. A 5% O2/He mixed gas with a flow rate of 20 mL/min was introduced, and the exhaust gas was measured with an in-situ mass spectrometer apparatus (Pfeiffer, MS GSD 320). Fourier Transform infrared spectroscopy (FT-IR) was used to determine the functionalities in the coke of the spent catalysts. The tests were performed on a Nicolet iS50 spectrometer. The spent catalysts were mixed with KBr (the weight ratio was 1 : 200) and thoroughly ground, and then dried in an oven at 120 °C. The dried sample was pressed under a pressure of 15 MPa into a transparent tablet with a thickness of ca. 0.8 mm for the test. Raman spectra were used to detect the aromatic ring structure of coke in the spent catalysts. The tests were performed on the Horiba LabRam HR Evolution apparatus. Scanning in the range of 100-3000 cm−1 was performed using a 532 nm laser. 2.3 Catalytic tests Catalytic experiments were performed in a fixed-bed quartz reactor connecting to a gas chromatograph (GC) equipped with TCD for analysis of the gases. Approximately 0.5 g of the calcined catalyst was reduced at 600 °C for 1 h by using a H2/N2 mixed gas (N2 = 60 mL/min, H2 = 60 mL/min). After cooling down to room temperature, the reactor was heated from 300 to 600 °C with a step of 50 °C, and kept at each temperature for 30 min to evaluate the catalytic activity of the catalysts. N2 was used as a carrier gas at a flow rate of 60 mL/min, and the reaction liquid (The ratio of water to carbon (S/C) = 5) of 0.12 mL/min was used for the experiments. To further evaluate the catalytic performance, the test was carried out under severe conditions (T = 600 °C, S/C = 1.5, liquid flow rate = 0.12 mL/min) in a time-on-stream of 240 min. The liquid products were collected using a condenser for further analysis. High performance liquid chromatography (HPLC) was used to determine the amount of the remaining reactants after steam reforming to calculate the conversion of the reactants. The tests were performed in a SHIMADZU LC-20A liquid chromatograph equipped with a refractive index detector (RID-20A). The liquid collected after the reaction was carried into the column by a 0.01 mol/L H2SO4 mobile phase (600 μL/min) for the detection. The organic products were also analyzed by using gas chromatography and mass spectrometry (GC–MS, Shimadzu GCMS–QP2020). The sample was diluted with acetone, and the injection volume was 0.5 μL, and the carrier gas was helium. The temperature was increased from 35 °C to 250 °C at a rate of 10 °C /min, and the retention time at 250 °C was 17 min. The components were identified by standard spectra of the NIST 2014 library. The reaction formula for steam reforming of the alcohols were shown below [4]: (R1) C H 3 C H 2 C H 2 OH + 5 H 2 O → 3C O 2 + 9 H 2 , Δ H 298 = 285 .2 kJ/mol (R2) C H 3 CHOHC H 3 + 5 H 2 O → 3C O 2 + 9 H 2 , Δ H 298 = 301 .2 kJ/mol (R3) C H 3 CHOHC H 2 OH + 4 H 2 O → 3C O 2 + 8 H 2 , Δ H 298 = 2 11.0 kJ/mol (R4) C H 2 OHCHOHC H 2 OH + 3 H 2 O → 3C O 2 + 7 H 2 , Δ H 298 = 1 30.3 kJ/mol Conversion of the alcohol was calculated by the following formula: C C 3 H 8 O 1/2/3 = C 3 H 8 O 1/2/3 in the feedstock - C 3 H 8 O 1/2/3 in the residual C 3 H 8 O 1/2/3 in the feedstock × 100 % The gas yields were calculated by the following formula: Y C O 2 /CO/C H 4 = moles of C O 2 /CO/C H 4 produced 3 × moles of C 3 H 8 O 1/2/3 × 100 % Y H 2 = moles of H 2 produced 9 × moles of C 3 H 8 O or 8 × moles of C 3 H 8 O 2 or 7 × moles of C 3 H 8 O 3 × 100 % 3 Results and discussion 3.1 Catalysts characterization 3.1.1 BET analysis The BET results of the catalysts and carriers were shown in Table 1 and Fig. 1 , respectively. The results in Table 1 indicated that the loading of nickel could reduce the pore volumes and the specific surface areas, and increase the mean pore diameter of the carriers. The reduction in pore volumes may be due to the filling of the pores by the Ni grains. The reduction of pore volumes of Al2O3 support was smaller than that of SiO2, which was likely due to the preferable deposition of some nickel species outside the pores of Al2O3 surface. Fig. 1a showed, the Ni grains mainly filled the mesopores of the SiO2 support with the diameters of 2–5 nm. Over alumina, nickel could fill the pores in the carrier in the whole range. Table 1 showed that the specific surface areas of SiO2 was about 2.9 times higher than that of Al2O3. After supporting Ni, the percentage decrease in specific surface area value is almost the same for Ni-Al2O3 and Ni-SiO2 (Ni-Al2O3 was 25%, Ni-SiO2 was 22%). As shown in Fig. 1b, the relative height of the adsorption-desorption isotherms demonstrates the varied specific surface areas. The isotherms of Al2O3 and SiO2 were type IV, and the hysteresis loop of SiO2 belonged to H2 type and Al2O3 belonged to H4 type [28,29]. There was a saturated adsorption platform on the SiO2 isotherm, indicating that the pore size distribution was relatively uniform (Fig. 1a). In comparison, the pore size distribution of Al2O3 or Ni-Al2O3 was irregular. 3.1.2 H2-TPR characterization Fig. 1c showed the TPR patterns for the calcined catalysts. After subtracting the background, the TPR patterns were further processed using a Gaussian function. The Ni-Al2O3 catalyst exhibited a broad reduction peak at 450–900 °C. The fitting condition of the reduction peak indicated that NiO may be reduced stepwisely on the surface of Al2O3 [30]. The reduction temperature in the varied region of temperature indicated the distinct degree of interaction between NiO and Al2O3. The nickel oxides in Ni-SiO2 catalyst were mainly reduced at the lower temperatures [31,32]. The reduction peak was sharp and concentrated at ca. 400 °C. The reduction temperature of the nickel oxide in Ni-SiO2 catalyst was similar to that of unsupported NiO, indicating the relatively mild interaction between NiO and SiO2. Although the interactions between NiO and the carriers were different, the degree of reduction was similar (60%, Table 1). The unreduced nickel oxides might be those distributed in the inner pores of the carriers. In addition to the characterisation of nickel species, the distribution of the acid-basic sites on the surface of the catalysts were further investigated. 3.1.3 XRD characterization The XRD patterns of the catalysts after calcination or reduction were shown in Fig. 1d. The grain sizes of metallic nickel calculated by the Scherrer formula were shown in Table 2 . The diffraction peaks at 2θ of 37.7°, 45.9° and 66.9° were assigned to the Al2O3 phase [JCPD 77-0403], and that at 22.2° was assigned to the SiO2 phase [JCPD 82-1554]. The diffraction peaks at the 37.2°, 43.3°, 62.8°, 75.3° and 79.3° were assigned to the cubic NiO phase [JCPD 73-1523], which belonged to the Fm-3 m (225) space group. The diffraction peaks of NiO on SiO2 were sharper than that of NiO on Al2O3. As shown in Table 2, the grain size of the NiO supported on the Al2O3 carrier was slightly smaller, even though the specific area of SiO2 was remarkably higher than that of Al2O3. This might be due to the stronger interaction between NiO and Al2O3, as evidenced by the characterization of H2-TPR (Fig. 1c). After the reduction at 600 °C under H2/N2 mixed gas (H2 = 60 mL/min, N2 = 60 mL/min) for 1 h, the diffraction peaks at 44.5°, 51.8° and 76.4° were indexed to cubic Ni phase [JCPD 87-0712], and also belonged to Fm-3 m (225) space group. As shown in Table 2, it was interesting to note that after the reduction of NiO to metallic Ni species, the grain size of nickel increased, and the extent of the increase over Al2O3 and SiO2 was similar. This may be due to the fact that the small-sized NiO grains migrated and aggregated during the reduction to Ni species [33]. 3.1.4 TPD analysis 3.1.4.1 CO2-TPD characterization The basic sites of the catalysts surface were measured using CO2 as a probe molecule [34]. As shown in Fig. 2 a, at 250–600 °C the CO2 desorption peaks could be observed over both the Ni-Al2O3 and Ni-SiO2 catalysts. The Ni-SiO2 showed a sharp desorption peak at 350 °C, while the desorption peak for the Ni-Al2O3 catalyst was much broader. The position the CO2 desorption peak were related to the strength of the basic sites across the surface of the catalysts [34]. The CO2-TPD curves were processed by Gaussian function, and the desorption peaks were classified as weak, medium and strong basic sites, depending on their desorption temperature [34,35]. The relative abundance of the basic sites calculated in Table 3 indicated that the total amount of basic sites on the surface of the Ni-Al2O3 catalyst was about twice times more than that of Ni-SiO2, whether for the weak or the strong basic sites. 3.1.4.2 NH3-TPD characterization NH3 has basicity and a small molecular size, which was reported to be an excellent probe molecule for testing the acidic sites on the surface of the catalysts [36]. The NH3-TPD curves of the reduced catalysts were shown in Fig. 2b. The acidic sites were mainly distributed in two temperature zones. The NH3 desorption peaks of the Ni-Al2O3 catalyst appeared at a medium to high temperature regions, and even a desorption peak appeared at near 745 °C, indicating that the catalyst mainly contained the medium and strong acidic sites. The desorption peaks of the Ni-SiO2 catalyst was sharp and distributed in the relatively lower temperature regions. The NH3-TPD curves of the Ni-Al2O3 and Ni-SiO2 catalysts were further processed via Gaussian function to obtain a profiles for the detailed desorption peaks. The sub-desorption peaks were assigned, and their relative abundance were calculated and shown in in Table 3 [36,37]. As shown in Table 3, the total acid numbers over the two catalysts were similar, but the surface of the Ni-Al2O3 catalyst contained more abundant medium and strong acidic sites. The surface of the Ni-SiO2 catalyst contained more weak acidic sites, which exceeded half of the total acid number. In addition, the relative abundance of the Lewis acidic sites and the Brønsted acidic sites on surface of the catalysts were further investigated with pyridine-DRIFTS study, which would be discussed further below. 3.1.4.3 Pyridine-DRIFTS characterization According to the bands exhibited by the adsorbed pyridine at different wavenumbers, the Lewis (Lw) and Brønsted (Br) acidic sites on the catalysts surface could be distinguished, as shown in Fig. 2c and d. It was generally considered that the absorption bands of the Lw acidic sites distributed at 1612 cm−1 [38–41], 1590 cm−1 [38,41], 1575 cm−1 [38,42], 1448 and 1444 cm−1 [38–46]. The bands the Br acidic sites appeared at 1560 and 1545 cm−1 [38–46]. The bands near 1490 cm−1 were produced by the pyridine adsorbed by both the Br and Lw acidic sites [41,43,45–47]. Ni-Al2O3 catalyst contained both Br acidic sites and the Lw acidic sites. As the temperature rose, the intensity of the bands at the Lw acidic sites decreased, mainly due to the desorption of the pyridine adsorbed at the acidic sites during the heating process. The bands around 1575, 1490 and 1448 cm−1 disappeared at around 250 °C. In contrast, the band at 1590 cm−1 weakened above 400 °C, while the band at 1612 cm−1 weakened at 500 °C. This may be due to the different bonding modes of pyridine to acidic sites. Jankovič et al. reported that the 1575 cm−1 band was due to the physically adsorbed pyridine, and the 1590, 1490 and 1448 cm−1 bands were assigned to Lewis-bonded pyridine, and the 1590 cm−1 band also contained hydrogen-bonded pyridine. The 1612 cm−1 band was assigned to aromatic π-electrons coordinated pyridine [40]. The adsorbed pyridine at the Br acidic sites had not been completely desorbed yet at 500 °C (1560 and 1545 cm−1), which indicated that the Br acidic sites had strong acidity. The bands near 1444 and 1486 cm−1 showed a blue shift during the heating process, indicating that the pyridine adsorbed at this acidic sites tended to bond in the Lewis-bound form, and the adsorbed pyridine molecules were relatively unstable. The pyridine-DRIFTS of the Ni-SiO2 catalyst was shown in Fig. 2d. The 1595 and 1444 cm−1 bands representing the Lw acidic sites were observed [38–46], while the characteristic bands representing the Br acidic sites were not present, indicating that the Ni-SiO2 catalyst contained mainly the Lw acidic sites. During the heating process, the Lw bands disappeared at 200 °C, which also proved the fact that Lewis-bonded pyridine was unstable. Compared with that of the Ni-Al2O3 catalyst, the band at 1444 cm−1 over Ni-SiO2 did not undergo a blue shift, indicating that the Lw acidic sites on the two catalysts may be different. It should be noted that both catalysts had relatively strong absorption bands around 1595 and 1444 cm−1, indicating that Lewis-bound pyridine was the predominant adsorption form of pyridine on the catalysts. The distinct distribution of the acidic and basic sites, associated with other properties of the catalysts, would significantly impact the catalytic activities, which will be further investigated. 3.2 Catalysts tests 3.2.1 Evaluation of activities of the catalysts The steam reforming of alcohols involves a complex reaction network, including the cracking of the CH, CC, and/or CO, HO bonds to produce the radicals that can be further transformed into the gaseous products [4,16,21,48]. In addition, dehydrogenation and dehydration of alcohols could also be included in the reaction network, occurrence of which depends on the synergistic catalysis of the Ni metal sites and the acid-basic sites [49]. These reactions all could significantly affect the distribution of the products and the tendency for the formation of coke on surface of the catalysts. The distribution of the main gaseous products in steam reforming of the alcohols over the Ni-Al2O3 catalyst were shown in Fig. 3 a,c,e and g, respectively. The yields of H2 and CO2 and conversion of the alcohols increased with the increasing temperature, and the trend for the increase was similar. The increase in terms of the yields of the gaseous products was not significant before 350 °C but then increased rapidly above 400 °C. With the increase of the number of hydroxyl groups, steam reforming of the alcohols tended to be more difficult, as could be seen from the conversion and the yields of H2 and CO2. Steam reforming of the alcohols with multiple hydroxyl groups involved probably more dehydration reactions, which seemed not to be a favorable factor for the reforming reactions. The yield of CH4 underwent a maximum in the middle range of the temperature over the Ni-Al2O3 catalyst, which was mainly due to the occurrence of the methanation reactions [50]. Interestingly, with the increase in the number of hydroxyl groups in the alcohols, the yield of CH4 decreased, and the temperature corresponding to the maximum yields also increased: from about 450 °C of 1-propanol and 2-propanol to 500 °C of 1,2-propanediol and 550 °C of glycerol. Over the Ni-Al2O3 catalyst, the increase in the number of hydroxyl groups was advantageous for suppressing the formation of CH4. In addition to methanation, the cracking of the alcohols could also produce the reaction intermediates such as CHx*. The integration of this radical with H* would also produce methane. The alcohols with multiple hydroxyl groups probably tended to form more COH* species, while less CHx* via cracking over nickel sites, which might be responsible for the less methane formation in steam reforming of the alcohols with multiple hydroxyl group. In addition, the CO yields versus the reaction temperature in steam reforming of 1-propanol and glycerol showed the different patterns with that in steam reforming of 2-propanol and 1,2-propanediol, indicating the varied mechanism for the formation of CO in reforming of the alcohols with the varied structures. The results of steam reforming of the alcohols over Ni-SiO2 catalyst were shown in Fig. 3b,d, and h. The conversion of the alcohols increased approximately linearly with increasing temperature. Similar to that over the Ni-Al2O3 catalyst, the formation of methane also decreased in steam reforming of the alcohols with multiple hydroxyl groups. Unfortunately, as the number of hydroxyl groups increased in the alcohols, the yield of CO increased significantly, which was disadvantageous for the use of the gases in fuel cells [51,52]. The cracking of the alcohols with the multiple hydroxyl groups possibly formed more CO* species, the ineffective gasification of which with the hydroxyl group would form more CO in the gaseous products. The results herein also indicated the pathways for the formation of CO over Ni-Al2O3 or Ni-SiO2 catalyst were different. The organic products formed during the steam reforming reactions were further characterized. The organic by-products formed in steam reforming of the alcohols at 400 °C were tested by using GC–MS. The organic by-products in steam reforming of 1-propanol or 2-propanol were not detected. The alcohols with one hydroxyl groups did not form much organic by-products. This was understandable as the cracking of them mainly form carbonaceous species. In steam reforming of 1,2-propanediol, hydroxyacetone was formed via dehydrogenation reactions as the main organic by-products over both Ni-Al2O3 and Ni-SiO2 (Fig. S1a). Hydroxyacetone contains the ketone functionality and could react with each other via the intermolecular Aldol condensation reactions, formation of which might contribute to coking in steam reforming. This will be discussed later. The organic by-products in steam reforming of glycerol were more complicated. As shown in Fig. S1b, the by-products included 1,3-propanediol, phenol, ethylene glycol, dihydroxyacetone, hydroxyacetone and glycolaldehyde, which were marked by the numbers inside the figure. The production of 1,3-propanediol (1) indicated the occurrence of the removal of hydroxyl groups via the hydrogenlysis reactions or the dehydration reactions followed by the hydrogenations. The Br acidic sites on the surface of Ni-Al2O3 probably facilitated the dehydration reactions. Since the surface of Ni-SiO2 did not contain the Br acidic sites, it did not promote the formation of 1,3-propanediol (1), but promoted the production of dihydroxyacetone (4) via the dehydrogenation reactions. Phenol was a product from the aromatization of the aliphatic structures, formation of which over the Ni-Al2O3 indicated that phenol was probably an important reaction intermediates for the formation of coke over the catalysts. In addition, the cracking of the CC bond of glycerol over the Ni metal sites also took place, forming ethylene glycol. Further dehydrogenation of ethylene glycol (3) could be form glycolaldehyde (6), which was mainly formed over Ni-SiO2 catalysts. The reaction pathway of glycerol steam reforming was shown in Scheme 1 . The formation of these varied organic by-products indicated the different reaction network with the different feedstock and over the different catalysts, which were further investigated with in situ DRIFTS of steam reforming of the alcohols. 3.2.2 In-situ DRIFTS of steam reforming of the alcohols The results for the in-situ DRIFTS studies of steam reforming over Ni-Al2O3 or Ni-SiO2 catalysts were shown in Fig. 4 . Over the Ni-Al2O3 catalyst, the infrared spectra during the steam reforming reaction of 1-propanol were similar to that of 2-propanol, and those of 1,2-propanediol were similar to that of glycerol. And a similar phenomenon was observed over the Ni-SiO2 catalyst. This indicated that the position of the hydroxyl group had a smaller effect on the formation of the reaction intermediates. Over the Ni-Al2O3 catalyst, the absorption band at 2960 cm−1 was attributed to the CH bond. The CO2 adsorbed on surface of the catalyst showed the absorption bands at 2373 and 2314 cm−1, which appeared at around 400 °C. The catalyst showed appreciable activity for the production of CO2 from steam reforming at this temperature, as indicated in Fig. 3a. The absorbed CO2 could come from the gasification of the carbonaceous species, especially at the high temperatures [26]. The CO bond at 1740 cm−1 was mainly attributed to the carbonyl functionalities, formed probably by the dehydrogenation of 1-propanol. The CC bond had three absorption bands at 1582, 1491 and 979 cm−1, indicating the formation of the CC bond from different reaction intermediates. The formation of the CC bond was related to the dehydration of 1-propanol, over the acidic sites of the catalysts. In addition, the recombination of the reaction radicals could also lead to the formation of CC bond. The absorption bands in the range of 1440–1310 cm−1 could be assigned to hydroxyl groups. The absorption bands in the range of 1275-1000 cm−1 could be classified as a CO bond, wherein the band at the 1168 cm−1 disappeared at 300 °C, which might be derived from the absorption of 1-propanol. The absorption bands at 1243 cm−1 produced in the higher temperature ranges may come from ethers. In addition, as shown in Fig. 4c, the intensity of the absorption band of the CC bond at 1491 cm−1 was stronger when 2-propanol was used as a reactant. This was possibly due to that the hydroxyl group in 2-propanol could dehydrate easier to form the CC bond. The number of absorption bands of 1,2-propanediol and glycerol was less than that of the alcohol containing one hydroxyl group, which seemed to be contrary to expectations. As shown in Fig. 4e and g, the absorption intensity of the bands corresponding to the OH bond (1440 cm−1) and the CO bond (1020 cm−1) was remarkably enhanced, which may be related to an increase in the number of hydroxyl groups in the alcohol that led to a high viscosity of the alcohols. This is because the higher viscosity would make it more difficult for bubbling the reactants into the cell for the characterization. The reasons for the disappearance of some absorption bands are for further study. Compared to Ni-Al2O3 catalyst, Ni-SiO2 catalyst seemed to have little activity in catalyzing the formation of olefins from the alcohols. As shown in Fig. 4b, the absorption band representing the CC bond at 1582 cm−1 was weaker, and the absorption band at the 979 cm−1 was completely submerged by the CO absorption band. However, the absorption band representing the CO bond at 1266 cm−1 was sharper, indicating that the dehydration of alcohols was not favored over the Ni-SiO2, which might be related to the absence of the Br acidic sites on surface of this catalyst. In addition, it was found that the CC functionality could be found over all the catalysts at the temperature as low as 100 °C, indicating the occurrence of the dissociative absorption of the alcohols. At such a low temperature, the steam reforming had not initiated yet. The accumulation of the species containing the unsaturated functionalities might become the precursor of coke. Coking of the catalysts were subsequently investigated in reforming tests with prolonged reaction time. 3.3 Evaluation of the catalysts versus prolonged reaction time 3.3.1 Catalytic performance As shown in Fig. 5 a, for steam reforming of 1-propanol over Ni-Al2O3, although its conversion reached almost 100%, while the yields of H2 and CO2 were only 40 and 30%, respectively. This was due to the formation of significant amount of CH4 and CO under the decreased ratio of S/C. The catalysts did not show the sign of deactivation for steam reforming of 1-propanol (Fig. 5a), 2-propanol (Fig. 5c) or 1,2-propanediol (Fig. 5e). However, the conversion of 1,2-propanediol and the yields of H2, CO2 and CH4 decreased significantly compared with the catalytic 1-propanol and 2-propanol, indicating that Ni-Al2O3 had limited capability for catalyzing the conversion of the alcohols with multiple hydroxyl groups. In addition, the conversion of glycerol and the yields of H2, CO2 and CO decreased significantly, indicating that the Ni-Al2O3 catalyst underwent a certain degree of deactivation. The reason for the deactivation might be due to the mask of the active sites with coke, which would be investigated later. As for Ni-SiO2 catalyst (Fig. 5b), the yields of H2, CO2 and CO were significantly improved as CH4 formation was suppressed in steam reforming of 1-propanol, which was probably due to the presence of less basic sites or the absence of Br acidic sites over Ni-SiO2 catalyst. This requires further research to prove. Furthermore, the yields of the gaseous products were similar to that at S/C = 5 (Fig. 3b), which indicated that the decrease in S/C ratio had little effect on the catalytic performance over Ni-SiO2. Ni-SiO2 were more active than Ni-Al2O3 catalyst. In addition, Ni-SiO2 catalyst did not deactivate in steam reforming of 1-propanol and 2-propanol but showed a clear sign of deactivation in steam reforming of 1,2-propanediol or glycerin. The number of hydroxyl groups in the alcohols clearly impacted the stability of the catalysts via such as formation of varied amount of coke, which was further investigated via characterization of the spent catalysts. 3.3.2 Characterization of the spent catalysts 3.3.2.1 TEM characterizations The morphologies of the spent catalysts were investigated by TEM and the results were shown in Fig. 6 . Both the Ni-Al2O3 and Ni-SiO2 spent catalysts contained amorphous coke and carbon nanotubes, but the contents of the two types of cokes were different. When steam reforming alcohol containing 1 hydroxyl group, the spent catalysts of Ni-Al2O3 contained more amorphous coke, and Ni-SiO2 was the opposite. The diameter and length of the carbon nanotubes of the Ni-SiO2 spent catalysts were higher or longer than that of the Ni-Al2O3 spent catalysts. This may be affected by the acid-basic sites of the catalysts surface, and the Ni-SiO2 catalysts were more favorable for promoting the formation of carbon nanotubes. Furthermore, the Ni-Al2O3 spent catalysts mainly contained hollow carbon nanotubes (Fig. 6c, S3c,d, S5c and d), and the Ni-SiO2 spent catalysts contained not only nanotubes but also nanofibers (Fig. 6b,d, S4b and S6b). For the Ni-SiO2 spent catalysts, the finer carbon nanotubes were mostly hollow, while the thicker ones were mainly solid. This might be due to the different growth mechanisms of carbon nanotubes at different growth stages: in the early growth stage, coke was deposited from the inside until the filling was complete; in the later stages of growth, the coke was deposited from the outside to increase the diameter of the carbon nanotubes. The wall of the carbon nanotubes obtained by Ni-SiO2 catalyzing 1-propanol was smoother than that in the reforming of 2-propanol (Fig. 6b and d). This may be because the coke of from the steam reforming of 2-propanol was more likely to deposit on the Ni grains, which resulted in a rougher surface of the carbon nanotubes. However, no Ni grains were observed on the wall of carbon nanotubes in the spent catalyst obtained by Ni-SiO2 in steam reforming of 1-propanol, which also suggested the difference in the growth mechanism of the two carbon nanotubes in Ni-SiO2 spent catalysts. When steam reforming alcohol containing 2 or 3 hydroxyl groups, the content of fibrous coke in the Ni-Al2O3 spent catalysts was significantly increased (Fig. 6e and g), while Ni-SiO2 contained more amorphous coke instead of carbon nanotubes (Fig. 6f and h). For the Ni-Al2O3 spent catalysts, some Ni grains were encapsulated by amorphous coke (Figs. S7c, S9a, c and d). Compared with fibrous coke, encapsulated amorphous coke hindered the contact of Ni active sites with reactants, which was the main cause of catalyst deactivation, while fibrous coke had little effect on catalytic activity [53]. The encapsulation effect of amorphous coke provided evidence for the deactivation of Ni-Al2O3 steam reforming glycerol (Fig. 5g). In the Ni-SiO2 spent catalysts, the amorphous coke seemed to be composed of carbon nanofibers (Fig. S8b, d). Moreover, amorphous coke appeared to have a certain orientation, which was particularly evident in the spent catalysts obtained by Ni-SiO2 in steam reforming of glycerol (Fig. S10). The reason for the deactivation of Ni-SiO2 catalyst in steam reforming of 1,2-propanediol and glycerol may be related to the high tendency of the catalyst for forming amorphous coke. 3.3.2.2 TG characterizations The amount of coke formed in the short-term stability tests were characterized with TG, and the results were shown in Fig. 7 . The weight loss of the spent catalysts occurred mainly in the range of 480–580 °C, including two DTG peaks. The DTG peak at the lower temperature might be due to the combustion of amorphous coke, while higher temperature peak might be related to filamentous coke [54]. The results of TEM characterization demonstrated the existence of these two types of coke (Fig. 6). For the Ni-Al2O3 catalyst, as the number of hydroxyl groups in the alcohols increased, the DTG peaks appeared to move toward the higher temperatures (Fig. 7a,c,e and g). The coke formed in steam reforming of the alcohols with multiple hydroxyl group was probably more stable, which was related to an increase in the content of fibrous coke. Nevertheless, for steam reforming of the alcohols over the Ni-SiO2 catalyst, an increase in the number of hydroxyl groups did not seem to promote the shift of the DTG peaks to a higher temperature region, which may be due to an increase in the amorphous coke content in the spent catalyst (Fig. 6f and h). The weight loss of the spent catalysts was shown in Table 4 . The weight loss of Ni-Al2O3 catalysts in steam reforming of 1-propanol and 2-propanol reached 60% and 41%, respectively, although the catalyst showed no clear sign of deactivation (Fig. 5a and c). This may be due to that the coke did not mask or partially masked Ni metal sites and acid-basic sites (Fig. 6a and c). In the steam reforming of 1,2-propanediol, there were only 27% of coke formed, which might be due to the low yield of CH4 (Fig. 5e), as CH4 was an important source of coke via decomposition. In steam reforming of glycerol, the amount of coke was lower than that over in steam reforming of 1-propanol, while led to a higher extent deactivation of the catalyst, which clearly was related to the effect of amorphous coke on Ni grain encapsulation (Fig. S9). The degree of coking of the Ni-SiO2 catalysts appeared to be positively correlated with the number of hydroxyl groups. The position of hydroxyl group in the alcohols did not affect much the coking, as the amounts of coke formed in steam reforming of 1-propanol and 2-propanol were basically the same. Nevertheless, with the increase of the number of the hydroxyl group in the alcohols, the amounts of coke increased substantially, which was related to an increase in the amorphous carbon content. Molecular structures clearly affected the tendency of coking. In fact, molecular structures also affected the properties of the coke, which was further investigated. 3.3.2.3 TG-MS characterizations Thermal stability of the coke was measured with TG-MS in nitrogen atmosphere, the results of which were shown in Fig. 8 . The gaseous products formed during the coke pyrolysis were mainly H2 and CO2. Dehydrogenation of the aliphatic structures in the coke produced H2, which initiated from around 600 °C. The pyrolysis of the spent Ni-Al2O3 catalyst that catalyzed the steam reforming of glycerol showed two H2 peaks at 450–750 °C (Fig. 8g), indicating that H2 may be derived from at least two different types of aliphatic structures in coke. The H2 peak of the Ni-SiO2 spent catalyst for steam reforming of glycerol appeared near 670 °C (Fig. 8h), and the peak area was much smaller, indicating clearly the different aliphatic structures formed over Ni-Al2O3 and Ni-SiO2. The CO2 might come from two pathways: one was the CO2 adsorbed from the basic sites on the catalysts, corresponding to the peaks near 270 °C; the other was the dissociation of the carbonyl or carboxylic functionalities in the coke, corresponding to the formation of CO2 near 600 °C. In Fig. 8h, there was no CO2 peak near 270 °C. which may be related to the properties of the reaction substrates and the structure of the coke species (Fig. S10). The ratio of the weight loss of the spent catalysts in the TG-MS tests (N2) to that in the TG tests (Air) was shown in Table 4. The weight loss ratio directly related to the thermal stability of the coke. Over the Ni-Al2O3 catalysts, it was clear that the weight loss ratio was affected by the location of the hydroxyl group and the number of hydroxyl groups in the alcohols. Similarly, the thermal stability of the coke formed over Ni-SiO2 catalyst were also significantly affected by the molecular structures of the coke. The coke formed in steam reforming of glycerol over the Ni-SiO2 catalyst showed the lowest thermal stability. Generally, for steam reforming of the same alcohols, the thermal stability of the coke was very different over Ni-Al2O3 and Ni-SiO2 catalysts. The properties of the coke were further analyzed. 3.3.2.4 TPO-MS characterizations The results of TPO-MS tests of the spent catalysts were shown in Fig. 9 . The oxidation peaks of the spent Ni-Al2O3 catalysts after the steam reforming of 1-propanol and 2-propanol appeared at 680 °C, while that of 1,2-propanediol appeared between 680 and 710 °C, and that of glycerol appeared at 710 °C. This indicated that the coke properties tended to be stable, which was consistent with the conclusions in the TG characterization. As shown in Fig. 9b, 1-propanol and 2-propanol had two peaks, while 1,2-propanediol and glycerol had only one, which might be related to the presence of the different coke species over the spent catalysts [55]. The elution of the gases measured with MS were shown in Fig. 9c-j. The gases produced from the spent catalysts were mainly CO2 and CO. The production of CO indicated that coke might not be completely oxidized, which could be related to the deficiency of oxygen during the characterization. There were some shoulder peaks formed over the spent Ni-SiO2 catalysts (Fig. 9d and f), suggesting the presence of the different types of coke species. The structure of coke was further investigated with FT-IR, Raman and XRD techniques. 3.3.2.5 FT-IR characterizations The FT-IR results of the spent catalysts were shown in Fig. 10 a and b. The spent Ni-Al2O3 catalysts contained the functional groups such as CH, CO, CC, OH and CO, which was consistent with the functional groups detected in the DRIFTS studies (Fig. 4a). These functionalities were, in fact, belonged to the coke deposits or the precursors of coke. The distribution of the functionalities of the coke over Ni-Al2O3 or Ni-SiO2 catalysts did not differ much, which was mainly determined by the structures of the alcohols. 3.3.2.6 Raman characterizations The results for Raman characterization of the spent catalysts were shown in Fig. 10c and d. The D band representing the carbon defect located at 1340 cm−1, and the G band representing the graphitization of carbon located at 1580 cm−1 [56]. An increase in the degree of disorder of carbon led to an increase in the intensity of the D band and also in the width of the D band and G band [57,58]. There was a difference in the total area of Raman curves of different spent catalysts, which might be related to the degree of aromaticity of coke and the number of oxygen-containing functional groups. It had been reported that oxygen-containing functional groups promoted the scattering ability and thereby increasing the intensity of the Raman signal, while the aromatic ring structure promoted the absorption of strong light by the sample and reduce the Raman signal [59]. The Raman curves of the spent catalysts were also further processed by Gaussian function, and the results were shown in Fig. S11. The S band might be associated with aliphatic ethers and CC functional groups, and the GR band might be associated with aromatic rings and amorphous carbon structures [60,61]. The relative areas of the fitted peaks were shown in Table 5 . When catalyzing the reforming of the same alcohol, the total area of the Raman curves of the Ni-Al2O3 spent catalysts were larger than that of Ni-SiO2, and a similar phenomenon was observed in the S band. This indicated that the Ni-Al2O3 spent catalysts may contain more oxygen-containing functional groups [62,63]. When catalyzing the steam reforming of 1-propanol, 2-propanol and glycerol, the area of the GR band of Ni-Al2O3 and Ni-SiO2 spent catalysts was similar. However, in the spent catalysts obtained by catalyzing 1,2-propanediol, the GR band area of Ni-Al2O3 was about three times that of Ni-SiO2. This may be due to the fact that the coke obtained by Ni-Al2O3 catalyzing 1,2-propanediol contained less aromatic rings. The ratio of the D band to the G band of the spent Ni-Al2O3 for catalyzing the steam reforming of 1-propanol, 2-propanol and 1,2-propanediol was almost the same, which indicated that the degree of disorder of carbon in these spent catalysts was similar. This phenomenon could also be observed from the Ni-SiO2 spent catalysts. The ratio of D/G of the spent catalysts obtained in the steam reforming of glycerol was 1.57 and 1.56, respectively, indicating that the degree of graphitization of carbon was higher. For Ni-Al2O3, this may be related to an increase in the content of fibrous coke (Fig. S9); for Ni-SiO2, this may be related to the ordering of amorphous coke (Fig. S10). In order to study the degree of crystallization of carbon and the grain sizes, the spent catalysts were further tested with XRD. 3.3.2.7 XRD characterizations The diffraction patterns of the spent catalysts were shown in Fig. 10e and f, the 2θ diffraction peak of 25.9° was directed to the graphitized carbon species [JCPD 75-0444]. It was worth noting that the 2θ diffraction peak of the carbon species corresponding to the PDF card should be at 26.3°, which may be originated from the formation of more defects in the graphitized carbon, shifting the angle of 2θ to a small angle. The grain sizes of C and Ni were calculated by the Scherrer formula, and the results were shown in Table 2. When catalyzing the reforming of the same alcohol, the grain sizes of C in the Ni-Al2O3 spent catalysts were larger than that of Ni-SiO2, especially in the spent catalysts obtained by catalyzing the steam reforming of 1,2-propanediol and glycerol. In the spent Ni-Al2O3 after catalyzing the steam reforming of 1,2-propanediol, the obtained C species showed the largest average grain size of 9.6 nm. In addition, the average grain sizes of Ni also changed. When Ni-Al2O3 catalyzed the steam reforming of 1-propanol and 2-propanol, the grain sizes of Ni decreased to 13.2 and 13.0 nm, respectively. In comparison, the grain size increased to 13.9 and 14.5 nm in catalyzing the steam reforming of 1,2-propanediol and glycerol. A similar phenomenon was observed in Ni-SiO2. The size reduction of Ni grains may be related to carbon nanotubes, which resulted in separation of Ni grains from the catalyst support and even grain splitting [53]. The grain sizes growth of Ni might be affected by the coverage of coke formed in steam reforming of the alcohols, such as the encapsulation of Ni grains by amorphous coke. 3.3.3 Discussion on the characterization results of spent catalysts The number of hydroxyl groups and the acid-basic sites affected the type of coke, which further affected the stability of the catalysts. As the number of hydroxyl groups increased, the content of fibrous coke in Ni-Al2O3 increased, so that the tendency of catalysts deactivation was slowed down. In addition, the increase in fibrous coke content promoted the stability of coke and the degree of graphitization (Raman characterization), shifting the maximum weight loss peaks of TG and the oxidation peaks of TPO-MS to a higher temperature. At the same time, the increase in fibrous coke content also reduced the total weight loss of the spent catalysts in the TG test. However, an increase in the number of hydroxyl groups promoted the encapsulation of some Ni grains in Ni-Al2O3 by amorphous coke, which directly led to the deactivation of the catalysts, and the encapsulation may also lead to the growth of Ni grains (XRD characterization). The increase in the number of hydroxyl groups increased the amount of amorphous coke in Ni-SiO2 and accelerated the deactivation of the catalysts. The increase in amorphous coke content resulted in an increase in the total weight loss of the spent catalysts in the TG tests. The orientation of coke made the degree of graphitization of coke higher (Raman characterization). 4 Conclusions In summary, the characteristics of steam reforming of alcohols were affected by both the structural configuration of the alcohol feedstock and the acidity/alkalinity of the catalysts. With the increase of the number of hydroxyl groups (from 1-propanol to glycerol), the formation of CH4 was suppressed, while the production of CO was promoted. The increase of hydroxyl groups probably facilitated the formation of the reaction intermediates containing more oxygen, while suppressed the formation of CHx species that were the precursor of CH4. Further to this, the organic by-products in steam reforming of 1-propanol were very simple, while that from glycerol with multiple hydroxyl groups were much more complicated. The dehydration, dehydrogenation, hydrogenlysis, or aromatization reactions all could take place, producing a complicated mixture of organic by-products such as 1,3-propanediol, glycolaldehyde, hydroxyl acetone, phenol, etc. The distribution of the Lewis and Brønsted acidic sites over the Ni-Al2O3 and Ni-SiO2 catalysts significantly impacted not only the formation of the organic by-products, but also the tendency to coking. Coking in steam reforming was more serious in reforming of the alcohols with less hydroxyl group (i.e. 1-propanol) over Ni-Al2O3 catalyst, while was more serious in reforming of the alcohols with more hydroxyl group (i.e. glycerol) over Ni-SiO2 catalyst. The Ni-Al2O3 catalyst contained both Lewis and Brønsted acidic sites, while Ni-SiO2 catalyst contained mainly Lewis acidic sites. The Brønsted acidic sites over Ni-Al2O3 promoted the dehydration reactions, which was probably responsible for the serious coking in the reforming of 1-propanpol. The Lewis acidic sites promoted the dehydrogenation reactions, forming more aldehydes/ketones, which was probably responsible for the formation of serious coking in steam reforming of glycerol over Ni-SiO2 catalyst. In addition, coke formed over both Ni-Al2O3 or Ni-SiO2 catalysts showed amorphous or nanotube forms, but the contents of the two types of cokes were different. When catalyzing propanol, coke mainly exhibited an amorphous state on Ni-Al2O3, and a nanotube state in Ni-SiO2. When catalyzing 1,2-propanediol and glycerol, the content of fibrous coke in Ni-Al2O3 increased, while Ni-SiO2 mainly contained amorphous coke. The in-situ DRIFTS studies of steam reforming of 1-propanol or 2-propanol confirmed that Ni-Al2O3 catalyst catalyzed the formation of olefins via dehydration at the temperature even as low as 100 °C, while Ni-SiO2 catalyst tended to catalyzed the formation of ketones and ethers. The distinct reaction intermediates formed led to the formation of the different form of coke species. The detailed mechanism for the acid types over the heterogeneous catalysts on distribution of the products in steam reforming needs further investigation. Acknowledgements This work was supported by the National Natural Science Foundation of China (No. 51876080), the Strategic International Scientific and Technological Innovation Cooperation Special Funds of National Key R&D Program of China (No. 2016YFE0204000), the Program for Taishan Scholars of Shandong Province Government, the Recruitment Program of Global Young Experts (Thousand Youth Talents Plan), the Natural Science Fund of Shandong Province (ZR2017BB002) and the Key R&D Program of Shandong Province (2018GSF116014). Appendix A Supplementary data Supplementary material related to this article can be found, in the online version, at doi:https://doi.org/10.1016/j.apcata.2019.117162. Appendix A Supplementary data The following is Supplementary data to this article: References [1] C.S.R. Azenha C. Mateos-Pedrero S. Queirós P. Concepción A. Mendes Appl. Catal. B-Environ. 203 2017 400 407 [2] G.T. Wurzler R.C. Rabelo-Neto L.V. Mattos M.A. Fraga F.B. Noronha Appl. Catal. A-Gen. 518 2016 115 128 [3] L. Zhang X. Hu K. Hu C. Hu Z. Zhang Q. Liu S. Hu J. Xiang Y. Wang S. Zhang J. Power Sources 403 2018 137 156 [4] X. Hu G. Lu Energy Fuel 23 2 2009 926 933 [5] H. Ma L. Zeng H. Tian D. Li X. Wang X. Li J. Gong Appl. Catal. B-Environ. 181 2016 321 331 [6] C. Montero L. Oar-Arteta A. Remiro A. Arandia J. Bilbao A.G. Gayubo Int. J. Hydrogen Energy 40 46 2015 15963 15971 [7] C. Montero A. Remiro P.L. Benito J. Bilbao A.G. Gayubo Fuel Process. Technol. 169 2018 207 216 [8] F. Bossola C. Evangelisti M. Allieta R. Psaro S. Recchia V. Dal Santo Appl. Catal. B-Environ. 181 2016 599 611 [9] Z. Yu X. Hu P. Jia Z. Zhang D. Dong G. Hu S. Hu Y. Wang J. Xiang Appl. Catal. B-Environ. 237 2018 538 553 [10] D.V. Cesar G.F. Santori F. Pompeo M.A. Baldanza C.A. Henriques E. Lombardo M. Schmal L. Cornaglia N.N. Nichio Int. J. Hydrogen Energy 41 47 2016 22000 22008 [11] D. Mei V. Lebarbier Dagle R. Xing K.O. Albrecht R.A. Dagle ACS Catal. 6 1 2015 315 325 [12] G. Wu C. Zhang S. Li Z. Han T. Wang X. Ma J. Gong ACS Sustain. Chem. Eng. 1 8 2013 1052 1062 [13] K. Kousi D.I. Kondarides X.E. Verykios C. Papadopoulou Appl. Catal. A-Gen. 452 2017 201 211 [14] S. Wang Q. Cai F. Zhang X. Li L. Zhang Z. Luo Int. J. Hydrogen Energy 39 32 2014 18675 18687 [15] G. Jacobs R.A. Keogh B.H. Davis J. Catal. 245 2 2007 326 337 [16] N. Palmeri V. Chiodo S. Freni F. Frusteri J.C.J. Bart S. Cavallaro Int. J. Hydrogen Energy 33 22 2008 6627 6634 [17] A. Le Valant A. Garron N. Bion D. Duprez F. Epron Int. J. Hydrogen Energy 36 1 2011 311 318 [18] B. Dou Y. Song C. Wang H. Chen Y. Xu Renew. Sustain. Energy Rev. 30 2014 950 960 [19] F. Pompeo G. Santori N.N. Nichio Int. J. Hydrogen Energy 35 17 2010 8912 8920 [20] K. Larmier C. Chizallet N. Cadran S. Maury J. Abboud A.F. Lamic-Humblot E. Marceau H. Lauron-Pernot ACS Catal. 5 7 2015 4423 4437 [21] L.F. Bobadilla A. Penkova F. Romero-Sarria M.A. Centeno J.A. Odriozola Int. J. Hydrogen Energy 39 11 2014 5704 5712 [22] S.M. de Rezende C.A. Franchini M.L. Dieuzeide A.M.D. de Farias N. Amadeo M.A. Fraga Chem. Eng. J. 272 2015 108 118 [23] A. Ciftci B. Peng A. Jentys J.A. Lercher E.J. Hensen Appl. Catal. A-Gen. 431 2012 113 119 [24] M.C. Sánchez-Sánchez R.M. Navarro J.L.G. Fierro Int. J. Hydrogen Energy 32 10-11 2007 1462 1471 [25] M.P. Bracciale B. de Caprariis P. De Filippis A.D. Hernandez M. Scarsella Appl. Catal. A-Gen. 574 2019 48 59 [26] X. Hu G. Lu Int. J. Hydrogen Energy 35 13 2010 7169 7176 [27] J. Vicente J. Ereña C. Montero M.J. Azkoiti J. Bilbao A.G. Gayubo Int. J. Hydrogen Energy 39 33 2014 18820 18834 [28] N.D. Charisiou K.N. Papageridis G. Siakavelas V. Sebastian S.J. Hinder M.A. Baker K. Polychronopoulou M.A. Goula Catal. Today 319 2019 206 219 [29] Z. Zhang X. Hu Y. Wang S. Hu J. Xiang C. Li G. Chen Q. Liu T. Wei D. Dong Fuel 237 2019 566 579 [30] J.T. Richardson R.M. Scates M.V. Twigg Appl. Catal. A-Gen. 267 1-2 2004 35 46 [31] P. Burattin M. Che C. Louis J. Phys. Chem. B 101 36 1997 7060 7074 [32] P. Burattin M. Che C. Louis J. Phys. Chem. B 102 15 1998 2722 2732 [33] J.T. Feng Y.J. Lin D.G. Evans X. Duan D.Q. Li J. Catal. 266 2 2009 351 358 [34] L. Xu H. Song L. Chou Appl. Catal. B-Environ. 108 2011 177 190 [35] Z. Yuan L. Wang J. Wang S. Xia P. Chen Z. Hou X. Zheng Appl. Catal. B-Environ. 101 3-4 2011 431 440 [36] B.M. Reddy P.M. Sreekanth Y. Yamada T. Kobayashi J. Mol. Catal. A-Chem. 227 1-2 2005 81 89 [37] R. Nie H. Lei S. Pan L. Wang J. Fei Z. Hou Fuel 96 2012 419 425 [38] J. Fei Z. Hou B. Zhu H. Lou X. Zheng Appl. Catal. A-Gen. 304 2006 49 54 [39] R.W. Stevens Jr S.S. Chuang B.H. Davis Thermochim Acta 407 1-2 2003 61 71 [40] Ľ. Jankovič P. Komadel J. Catal. 218 1 2003 227 233 [41] P. Kalita N.M. Gupta R. Kumar J. Catal. 245 2 2007 338 347 [42] R.W. Stevens Jr S.S. Chuang B.H. Davis Appl. Catal. A-Gen. 252 1 2003 57 74 [43] B.T. Loveless A. Gyanani D.S. Muggli Appl. Catal. B-Environ. 84 3-4 2008 591 597 [44] V.V. Kumar G. Naresh S. Deepa P.G. Bhavani M. Nagaraju M. Sudhakar K.V.R. Chary J. Tardio S.K. Bhargava A. Venugopal Appl. Catal. A-Gen. 531 2017 169 176 [45] M. Lefrancois G. Malbois J. Catal. 20 3 1971 350 358 [46] C.D. Lago H.P. Decolatti L.G. Tonutti B.O. Dalla Costa C.A. Querini J. Catal. 366 2018 16 27 [47] Y. Zang X. Dong C. Wang Chem. Eng. J. 313 2017 1583 1592 [48] Y. Lei S. Lee K.B. Low C.L. Marshall J.W. Elam ACS Catal. 6 6 2016 3457 3460 [49] W.Y. Hernández J. Lauwaert P. Van Der Voort A. Verberckmoes Green Chem. 19 22 2017 5269 5302 [50] J. Gao Y. Wang Y. Ping D. Hu G. Xu F. Gu F. Su RSC Adv. 2 6 2012 2358 2368 [51] J. Shui M. Wang F. Du L. Dai Sci. Adv. 1 1 2015 e1400129 [52] L. Feng J. Chang K. Jiang H. Xue C. Liu W.B. Cai W. Xing J. Zhang Nano Energy 30 2016 355 361 [53] C. Montero A. Ochoa P. Castaño J. Bilbao A.G. Gayubo J. Catal. 331 2015 181 192 [54] Yu Li Z. Zhang P. Jia D. Dong Y. Wang S. Hu J. Xiang Q. Liu X. Hu J Energy Inst. 2019 10.1016/j.joei.2019.04.001 [55] Z. Zhang X. Hu J. Li G. Gao D. Dong R. Westerhof S. Hu J. Xiang Y. Wang Fuel 217 2018 389 403 [56] A.M. Da Silva K.R. De Souza G. Jacobs U.M. Graham B.H. Davis L.V. Mattos F.B. Noronha Appl. Catal. B-Environ. 102 1-2 2011 94 109 [57] L. Yerman N. Homs E.B. Pereira P.R. de la Piscina Int. J. Hydrogen Energy 39 10 2014 5225 5233 [58] A.F. Lucredio J.D.A. Bellido A. Zawadzki E.M. Assaf Fuel 90 4 2011 1424 1430 [59] D. Feng Y. Zhao Y. Zhang S. Sun S. Meng Y. Guo Y. Huang Chem. Eng. J. 306 2016 422 432 [60] F.J. Wang S. Zhang Z.D. Chen C. Liu Y.G. Wang J. Anal. Appl. Pyrol. 105 2014 269 275 [61] Y. Zhao D. Feng Y. Zhang Y. Huang S. Sun Fuel Process. Technol. 141 2016 54 60 [62] Z. Zhang T. Wei G. Chen C. Li D. Dong W. Wu X. Hu Fuel 250 2019 176 193 [63] Z. Zhang X. Hu L. Zhang Y. Yang Q. Li H. Fan C.Z. Li Fuel Process. Technol. 191 2019 138 151",
      "scopus-id": "85069879642",
      "coredata": {
        "eid": "1-s2.0-S0926860X19303175",
        "dc:description": "In this study, steam reforming of the alcohols with varied number of hydroxyl groups (1-propanol, 2-propanol, 1,2-propanediol and glycerol) were conducted over the Ni-Al2O3 and Ni-SiO2 catalysts with varied distribution of acid types. The results showed that the increase of number of hydroxyl groups in the alcohols suppressed the formation of CH4, but promoted the production of CO and the organic by-products. Both Lewis and Brønsted acidic sites were observed over Ni-Al2O3 catalyst, while Lewis acidic sites were dominated over Ni-SiO2 catalyst. The different reaction intermediates resulted in the formation of mainly amorphous coke over Ni-Al2O3 catalyst with some Ni grains were encapsulated by amorphous coke. In comparison, the coke over the Ni-SiO2 was mainly nanotube form. The varied reaction intermediates formed were observed with the in-situ Diffuse Reflectance Infrared Fourier Transform Spectroscopy studies of steam reforming of the alcohols.",
        "openArchiveArticle": "false",
        "prism:coverDate": "2019-08-25",
        "openaccessUserLicense": null,
        "prism:aggregationType": "Journal",
        "prism:url": "https://api.elsevier.com/content/article/pii/S0926860X19303175",
        "dc:creator": [
          {
            "@_fa": "true",
            "$": "Li, Yuhang"
          },
          {
            "@_fa": "true",
            "$": "Zhang, Lijun"
          },
          {
            "@_fa": "true",
            "$": "Zhang, Zhanming"
          },
          {
            "@_fa": "true",
            "$": "Liu, Qianhe"
          },
          {
            "@_fa": "true",
            "$": "Zhang, Shu"
          },
          {
            "@_fa": "true",
            "$": "Liu, Qing"
          },
          {
            "@_fa": "true",
            "$": "Hu, Guangzhi"
          },
          {
            "@_fa": "true",
            "$": "Wang, Yi"
          },
          {
            "@_fa": "true",
            "$": "Hu, Xun"
          }
        ],
        "link": [
          {
            "@_fa": "true",
            "@rel": "self",
            "@href": "https://api.elsevier.com/content/article/pii/S0926860X19303175"
          },
          {
            "@_fa": "true",
            "@rel": "scidir",
            "@href": "https://www.sciencedirect.com/science/article/pii/S0926860X19303175"
          }
        ],
        "dc:format": "application/json",
        "openaccessType": null,
        "pii": "S0926-860X(19)30317-5",
        "prism:volume": "584",
        "articleNumber": "117162",
        "prism:publisher": "Elsevier B.V.",
        "dc:title": "Steam reforming of the alcohols with varied structures: Impacts of acidic sites of Ni catalysts on coking",
        "prism:copyright": "© 2019 Elsevier B.V. All rights reserved.",
        "openaccess": "0",
        "prism:issn": "0926860X",
        "dcterms:subject": [
          {
            "@_fa": "true",
            "$": "Acid-basic sites"
          },
          {
            "@_fa": "true",
            "$": "Alcohols steam reforming"
          },
          {
            "@_fa": "true",
            "$": "Nickel catalysts"
          },
          {
            "@_fa": "true",
            "$": "Coke properties"
          },
          {
            "@_fa": "true",
            "$": "In-situ DRIFTS studies"
          }
        ],
        "openaccessArticle": "false",
        "prism:publicationName": "Applied Catalysis A: General",
        "openaccessSponsorType": null,
        "prism:pageRange": "117162",
        "pubType": "fla",
        "prism:coverDisplayDate": "25 August 2019",
        "prism:doi": "10.1016/j.apcata.2019.117162",
        "prism:startingPage": "117162",
        "dc:identifier": "doi:10.1016/j.apcata.2019.117162",
        "openaccessSponsorName": null
      },
      "objects": {
        "object": [
          {
            "@category": "thumbnail",
            "@height": "163",
            "@width": "142",
            "@_fa": "true",
            "$": "https://api.elsevier.com/content/object/eid/1-s2.0-S0926860X19303175-gr2.sml?httpAccept=%2A%2F%2A",
            "@multimediatype": "GIF image file",
            "@type": "IMAGE-THUMBNAIL",
            "@size": "12430",
            "@ref": "gr2",
            "@mimetype": "image/gif"
          },
          {
            "@category": "thumbnail",
            "@height": "163",
            "@width": "110",
            "@_fa": "true",
            "$": "https://api.elsevier.com/content/object/eid/1-s2.0-S0926860X19303175-gr3.sml?httpAccept=%2A%2F%2A",
            "@multimediatype": "GIF image file",
            "@type": "IMAGE-THUMBNAIL",
            "@size": "8597",
            "@ref": "gr3",
            "@mimetype": "image/gif"
          },
          {
            "@category": "thumbnail",
            "@height": "163",
            "@width": "103",
            "@_fa": "true",
            "$": "https://api.elsevier.com/content/object/eid/1-s2.0-S0926860X19303175-gr4.sml?httpAccept=%2A%2F%2A",
            "@multimediatype": "GIF image file",
            "@type": "IMAGE-THUMBNAIL",
            "@size": "8150",
            "@ref": "gr4",
            "@mimetype": "image/gif"
          },
          {
            "@category": "thumbnail",
            "@height": "164",
            "@width": "106",
            "@_fa": "true",
            "$": "https://api.elsevier.com/content/object/eid/1-s2.0-S0926860X19303175-gr5.sml?httpAccept=%2A%2F%2A",
            "@multimediatype": "GIF image file",
            "@type": "IMAGE-THUMBNAIL",
            "@size": "8224",
            "@ref": "gr5",
            "@mimetype": "image/gif"
          },
          {
            "@category": "thumbnail",
            "@height": "164",
            "@width": "204",
            "@_fa": "true",
            "$": "https://api.elsevier.com/content/object/eid/1-s2.0-S0926860X19303175-gr1.sml?httpAccept=%2A%2F%2A",
            "@multimediatype": "GIF image file",
            "@type": "IMAGE-THUMBNAIL",
            "@size": "11531",
            "@ref": "gr1",
            "@mimetype": "image/gif"
          },
          {
            "@category": "thumbnail",
            "@height": "163",
            "@width": "85",
            "@_fa": "true",
            "$": "https://api.elsevier.com/content/object/eid/1-s2.0-S0926860X19303175-gr6.sml?httpAccept=%2A%2F%2A",
            "@multimediatype": "GIF image file",
            "@type": "IMAGE-THUMBNAIL",
            "@size": "10425",
            "@ref": "gr6",
            "@mimetype": "image/gif"
          },
          {
            "@category": "thumbnail",
            "@height": "164",
            "@width": "114",
            "@_fa": "true",
            "$": "https://api.elsevier.com/content/object/eid/1-s2.0-S0926860X19303175-gr7.sml?httpAccept=%2A%2F%2A",
            "@multimediatype": "GIF image file",
            "@type": "IMAGE-THUMBNAIL",
            "@size": "7038",
            "@ref": "gr7",
            "@mimetype": "image/gif"
          },
          {
            "@category": "thumbnail",
            "@height": "164",
            "@width": "117",
            "@_fa": "true",
            "$": "https://api.elsevier.com/content/object/eid/1-s2.0-S0926860X19303175-gr8.sml?httpAccept=%2A%2F%2A",
            "@multimediatype": "GIF image file",
            "@type": "IMAGE-THUMBNAIL",
            "@size": "6875",
            "@ref": "gr8",
            "@mimetype": "image/gif"
          },
          {
            "@category": "thumbnail",
            "@height": "164",
            "@width": "98",
            "@_fa": "true",
            "$": "https://api.elsevier.com/content/object/eid/1-s2.0-S0926860X19303175-gr9.sml?httpAccept=%2A%2F%2A",
            "@multimediatype": "GIF image file",
            "@type": "IMAGE-THUMBNAIL",
            "@size": "6903",
            "@ref": "gr9",
            "@mimetype": "image/gif"
          },
          {
            "@category": "thumbnail",
            "@height": "163",
            "@width": "219",
            "@_fa": "true",
            "$": "https://api.elsevier.com/content/object/eid/1-s2.0-S0926860X19303175-ga1.sml?httpAccept=%2A%2F%2A",
            "@multimediatype": "GIF image file",
            "@type": "IMAGE-THUMBNAIL",
            "@size": "22629",
            "@ref": "ga1",
            "@mimetype": "image/gif"
          },
          {
            "@category": "thumbnail",
            "@height": "164",
            "@width": "147",
            "@_fa": "true",
            "$": "https://api.elsevier.com/content/object/eid/1-s2.0-S0926860X19303175-gr10.sml?httpAccept=%2A%2F%2A",
            "@multimediatype": "GIF image file",
            "@type": "IMAGE-THUMBNAIL",
            "@size": "10086",
            "@ref": "gr10",
            "@mimetype": "image/gif"
          },
          {
            "@category": "thumbnail",
            "@height": "164",
            "@width": "196",
            "@_fa": "true",
            "$": "https://api.elsevier.com/content/object/eid/1-s2.0-S0926860X19303175-sc1.sml?httpAccept=%2A%2F%2A",
            "@multimediatype": "GIF image file",
            "@type": "IMAGE-THUMBNAIL",
            "@size": "6421",
            "@ref": "sc1",
            "@mimetype": "image/gif"
          },
          {
            "@category": "standard",
            "@height": "822",
            "@width": "715",
            "@_fa": "true",
            "$": "https://api.elsevier.com/content/object/eid/1-s2.0-S0926860X19303175-gr2.jpg?httpAccept=%2A%2F%2A",
            "@multimediatype": "JPEG image file",
            "@type": "IMAGE-DOWNSAMPLED",
            "@size": "192715",
            "@ref": "gr2",
            "@mimetype": "image/jpeg"
          },
          {
            "@category": "standard",
            "@height": "979",
            "@width": "659",
            "@_fa": "true",
            "$": "https://api.elsevier.com/content/object/eid/1-s2.0-S0926860X19303175-gr3.jpg?httpAccept=%2A%2F%2A",
            "@multimediatype": "JPEG image file",
            "@type": "IMAGE-DOWNSAMPLED",
            "@size": "193560",
            "@ref": "gr3",
            "@mimetype": "image/jpeg"
          },
          {
            "@category": "standard",
            "@height": "955",
            "@width": "602",
            "@_fa": "true",
            "$": "https://api.elsevier.com/content/object/eid/1-s2.0-S0926860X19303175-gr4.jpg?httpAccept=%2A%2F%2A",
            "@multimediatype": "JPEG image file",
            "@type": "IMAGE-DOWNSAMPLED",
            "@size": "202850",
            "@ref": "gr4",
            "@mimetype": "image/jpeg"
          },
          {
            "@category": "standard",
            "@height": "958",
            "@width": "621",
            "@_fa": "true",
            "$": "https://api.elsevier.com/content/object/eid/1-s2.0-S0926860X19303175-gr5.jpg?httpAccept=%2A%2F%2A",
            "@multimediatype": "JPEG image file",
            "@type": "IMAGE-DOWNSAMPLED",
            "@size": "174752",
            "@ref": "gr5",
            "@mimetype": "image/jpeg"
          },
          {
            "@category": "standard",
            "@height": "604",
            "@width": "753",
            "@_fa": "true",
            "$": "https://api.elsevier.com/content/object/eid/1-s2.0-S0926860X19303175-gr1.jpg?httpAccept=%2A%2F%2A",
            "@multimediatype": "JPEG image file",
            "@type": "IMAGE-DOWNSAMPLED",
            "@size": "122271",
            "@ref": "gr1",
            "@mimetype": "image/jpeg"
          },
          {
            "@category": "standard",
            "@height": "976",
            "@width": "508",
            "@_fa": "true",
            "$": "https://api.elsevier.com/content/object/eid/1-s2.0-S0926860X19303175-gr6.jpg?httpAccept=%2A%2F%2A",
            "@multimediatype": "JPEG image file",
            "@type": "IMAGE-DOWNSAMPLED",
            "@size": "204022",
            "@ref": "gr6",
            "@mimetype": "image/jpeg"
          },
          {
            "@category": "standard",
            "@height": "947",
            "@width": "659",
            "@_fa": "true",
            "$": "https://api.elsevier.com/content/object/eid/1-s2.0-S0926860X19303175-gr7.jpg?httpAccept=%2A%2F%2A",
            "@multimediatype": "JPEG image file",
            "@type": "IMAGE-DOWNSAMPLED",
            "@size": "155639",
            "@ref": "gr7",
            "@mimetype": "image/jpeg"
          },
          {
            "@category": "standard",
            "@height": "925",
            "@width": "659",
            "@_fa": "true",
            "$": "https://api.elsevier.com/content/object/eid/1-s2.0-S0926860X19303175-gr8.jpg?httpAccept=%2A%2F%2A",
            "@multimediatype": "JPEG image file",
            "@type": "IMAGE-DOWNSAMPLED",
            "@size": "130220",
            "@ref": "gr8",
            "@mimetype": "image/jpeg"
          },
          {
            "@category": "standard",
            "@height": "944",
            "@width": "565",
            "@_fa": "true",
            "$": "https://api.elsevier.com/content/object/eid/1-s2.0-S0926860X19303175-gr9.jpg?httpAccept=%2A%2F%2A",
            "@multimediatype": "JPEG image file",
            "@type": "IMAGE-DOWNSAMPLED",
            "@size": "147120",
            "@ref": "gr9",
            "@mimetype": "image/jpeg"
          },
          {
            "@category": "standard",
            "@height": "200",
            "@width": "268",
            "@_fa": "true",
            "$": "https://api.elsevier.com/content/object/eid/1-s2.0-S0926860X19303175-ga1.jpg?httpAccept=%2A%2F%2A",
            "@multimediatype": "JPEG image file",
            "@type": "IMAGE-DOWNSAMPLED",
            "@size": "18364",
            "@ref": "ga1",
            "@mimetype": "image/jpeg"
          },
          {
            "@category": "standard",
            "@height": "839",
            "@width": "753",
            "@_fa": "true",
            "$": "https://api.elsevier.com/content/object/eid/1-s2.0-S0926860X19303175-gr10.jpg?httpAccept=%2A%2F%2A",
            "@multimediatype": "JPEG image file",
            "@type": "IMAGE-DOWNSAMPLED",
            "@size": "181788",
            "@ref": "gr10",
            "@mimetype": "image/jpeg"
          },
          {
            "@category": "standard",
            "@height": "473",
            "@width": "565",
            "@_fa": "true",
            "$": "https://api.elsevier.com/content/object/eid/1-s2.0-S0926860X19303175-sc1.jpg?httpAccept=%2A%2F%2A",
            "@multimediatype": "JPEG image file",
            "@type": "IMAGE-DOWNSAMPLED",
            "@size": "47121",
            "@ref": "sc1",
            "@mimetype": "image/jpeg"
          },
          {
            "@category": "high",
            "@height": "3642",
            "@width": "3167",
            "@_fa": "true",
            "$": "https://api.elsevier.com/content/object/eid/1-s2.0-S0926860X19303175-gr2_lrg.jpg?httpAccept=%2A%2F%2A",
            "@multimediatype": "JPEG image file",
            "@type": "IMAGE-HIGH-RES",
            "@size": "1571231",
            "@ref": "gr2",
            "@mimetype": "image/jpeg"
          },
          {
            "@category": "high",
            "@height": "4335",
            "@width": "2917",
            "@_fa": "true",
            "$": "https://api.elsevier.com/content/object/eid/1-s2.0-S0926860X19303175-gr3_lrg.jpg?httpAccept=%2A%2F%2A",
            "@multimediatype": "JPEG image file",
            "@type": "IMAGE-HIGH-RES",
            "@size": "1356983",
            "@ref": "gr3",
            "@mimetype": "image/jpeg"
          },
          {
            "@category": "high",
            "@height": "4232",
            "@width": "2667",
            "@_fa": "true",
            "$": "https://api.elsevier.com/content/object/eid/1-s2.0-S0926860X19303175-gr4_lrg.jpg?httpAccept=%2A%2F%2A",
            "@multimediatype": "JPEG image file",
            "@type": "IMAGE-HIGH-RES",
            "@size": "1605305",
            "@ref": "gr4",
            "@mimetype": "image/jpeg"
          },
          {
            "@category": "high",
            "@height": "4244",
            "@width": "2750",
            "@_fa": "true",
            "$": "https://api.elsevier.com/content/object/eid/1-s2.0-S0926860X19303175-gr5_lrg.jpg?httpAccept=%2A%2F%2A",
            "@multimediatype": "JPEG image file",
            "@type": "IMAGE-HIGH-RES",
            "@size": "1264776",
            "@ref": "gr5",
            "@mimetype": "image/jpeg"
          },
          {
            "@category": "high",
            "@height": "2672",
            "@width": "3333",
            "@_fa": "true",
            "$": "https://api.elsevier.com/content/object/eid/1-s2.0-S0926860X19303175-gr1_lrg.jpg?httpAccept=%2A%2F%2A",
            "@multimediatype": "JPEG image file",
            "@type": "IMAGE-HIGH-RES",
            "@size": "859431",
            "@ref": "gr1",
            "@mimetype": "image/jpeg"
          },
          {
            "@category": "high",
            "@height": "4324",
            "@width": "2250",
            "@_fa": "true",
            "$": "https://api.elsevier.com/content/object/eid/1-s2.0-S0926860X19303175-gr6_lrg.jpg?httpAccept=%2A%2F%2A",
            "@multimediatype": "JPEG image file",
            "@type": "IMAGE-HIGH-RES",
            "@size": "2637062",
            "@ref": "gr6",
            "@mimetype": "image/jpeg"
          },
          {
            "@category": "high",
            "@height": "4193",
            "@width": "2917",
            "@_fa": "true",
            "$": "https://api.elsevier.com/content/object/eid/1-s2.0-S0926860X19303175-gr7_lrg.jpg?httpAccept=%2A%2F%2A",
            "@multimediatype": "JPEG image file",
            "@type": "IMAGE-HIGH-RES",
            "@size": "1142690",
            "@ref": "gr7",
            "@mimetype": "image/jpeg"
          },
          {
            "@category": "high",
            "@height": "4093",
            "@width": "2917",
            "@_fa": "true",
            "$": "https://api.elsevier.com/content/object/eid/1-s2.0-S0926860X19303175-gr8_lrg.jpg?httpAccept=%2A%2F%2A",
            "@multimediatype": "JPEG image file",
            "@type": "IMAGE-HIGH-RES",
            "@size": "1057024",
            "@ref": "gr8",
            "@mimetype": "image/jpeg"
          },
          {
            "@category": "high",
            "@height": "4175",
            "@width": "2500",
            "@_fa": "true",
            "$": "https://api.elsevier.com/content/object/eid/1-s2.0-S0926860X19303175-gr9_lrg.jpg?httpAccept=%2A%2F%2A",
            "@multimediatype": "JPEG image file",
            "@type": "IMAGE-HIGH-RES",
            "@size": "1127898",
            "@ref": "gr9",
            "@mimetype": "image/jpeg"
          },
          {
            "@category": "high",
            "@height": "886",
            "@width": "1187",
            "@_fa": "true",
            "$": "https://api.elsevier.com/content/object/eid/1-s2.0-S0926860X19303175-ga1_lrg.jpg?httpAccept=%2A%2F%2A",
            "@multimediatype": "JPEG image file",
            "@type": "IMAGE-HIGH-RES",
            "@size": "147543",
            "@ref": "ga1",
            "@mimetype": "image/jpeg"
          },
          {
            "@category": "high",
            "@height": "3712",
            "@width": "3333",
            "@_fa": "true",
            "$": "https://api.elsevier.com/content/object/eid/1-s2.0-S0926860X19303175-gr10_lrg.jpg?httpAccept=%2A%2F%2A",
            "@multimediatype": "JPEG image file",
            "@type": "IMAGE-HIGH-RES",
            "@size": "1356777",
            "@ref": "gr10",
            "@mimetype": "image/jpeg"
          },
          {
            "@category": "high",
            "@height": "2095",
            "@width": "2500",
            "@_fa": "true",
            "$": "https://api.elsevier.com/content/object/eid/1-s2.0-S0926860X19303175-sc1_lrg.jpg?httpAccept=%2A%2F%2A",
            "@multimediatype": "JPEG image file",
            "@type": "IMAGE-HIGH-RES",
            "@size": "350714",
            "@ref": "sc1",
            "@mimetype": "image/jpeg"
          },
          {
            "@category": "standard",
            "@_fa": "true",
            "$": "https://api.elsevier.com/content/object/eid/1-s2.0-S0926860X19303175-mmc1.docx?httpAccept=%2A%2F%2A",
            "@multimediatype": "Microsoft Word file",
            "@type": "APPLICATION",
            "@size": "21176158",
            "@ref": "mmc1",
            "@mimetype": "application/word"
          },
          {
            "@category": "thumbnail",
            "@height": "31",
            "@width": "503",
            "@_fa": "true",
            "$": "https://api.elsevier.com/content/object/eid/1-s2.0-S0926860X19303175-si3.gif?httpAccept=%2A%2F%2A",
            "@multimediatype": "GIF image file",
            "@type": "ALTIMG",
            "@size": "1341",
            "@ref": "si3",
            "@mimetype": "image/gif"
          },
          {
            "@category": "thumbnail",
            "@height": "31",
            "@width": "525",
            "@_fa": "true",
            "$": "https://api.elsevier.com/content/object/eid/1-s2.0-S0926860X19303175-si4.gif?httpAccept=%2A%2F%2A",
            "@multimediatype": "GIF image file",
            "@type": "ALTIMG",
            "@size": "1409",
            "@ref": "si4",
            "@mimetype": "image/gif"
          },
          {
            "@category": "thumbnail",
            "@height": "46",
            "@width": "556",
            "@_fa": "true",
            "$": "https://api.elsevier.com/content/object/eid/1-s2.0-S0926860X19303175-si5.gif?httpAccept=%2A%2F%2A",
            "@multimediatype": "GIF image file",
            "@type": "ALTIMG",
            "@size": "1820",
            "@ref": "si5",
            "@mimetype": "image/gif"
          },
          {
            "@category": "thumbnail",
            "@height": "31",
            "@width": "476",
            "@_fa": "true",
            "$": "https://api.elsevier.com/content/object/eid/1-s2.0-S0926860X19303175-si2.gif?httpAccept=%2A%2F%2A",
            "@multimediatype": "GIF image file",
            "@type": "ALTIMG",
            "@size": "1304",
            "@ref": "si2",
            "@mimetype": "image/gif"
          },
          {
            "@category": "thumbnail",
            "@height": "31",
            "@width": "488",
            "@_fa": "true",
            "$": "https://api.elsevier.com/content/object/eid/1-s2.0-S0926860X19303175-si1.gif?httpAccept=%2A%2F%2A",
            "@multimediatype": "GIF image file",
            "@type": "ALTIMG",
            "@size": "1312",
            "@ref": "si1",
            "@mimetype": "image/gif"
          },
          {
            "@category": "thumbnail",
            "@height": "46",
            "@width": "420",
            "@_fa": "true",
            "$": "https://api.elsevier.com/content/object/eid/1-s2.0-S0926860X19303175-si6.gif?httpAccept=%2A%2F%2A",
            "@multimediatype": "GIF image file",
            "@type": "ALTIMG",
            "@size": "1449",
            "@ref": "si6",
            "@mimetype": "image/gif"
          },
          {
            "@category": "thumbnail",
            "@height": "46",
            "@width": "594",
            "@_fa": "true",
            "$": "https://api.elsevier.com/content/object/eid/1-s2.0-S0926860X19303175-si7.gif?httpAccept=%2A%2F%2A",
            "@multimediatype": "GIF image file",
            "@type": "ALTIMG",
            "@size": "1718",
            "@ref": "si7",
            "@mimetype": "image/gif"
          },
          {
            "@category": "standard",
            "@_fa": "true",
            "$": "https://api.elsevier.com/content/object/eid/1-s2.0-S0926860X19303175-am.pdf?httpAccept=%2A%2F%2A",
            "@multimediatype": "Acrobat PDF file",
            "@type": "AAM-PDF",
            "@size": "3396333",
            "@ref": "am",
            "@mimetype": "application/pdf"
          }
        ]
      },
      "link": {
        "@rel": "abstract",
        "@href": "https://api.elsevier.com/content/abstract/scopus_id/85069879642"
      }
    }
  }
}