{
  "metadata": {
    "title": "Doped barium cerate perovskite catalysts for simultaneous NO<ce:inf loc=post>x</ce:inf> storage and soot oxidation",
    "authors": "; ; ",
    "journal": "Applied Catalysis A: General",
    "date": "2020-06-25",
    "doi": "10.1016/j.apcata.2020.117465",
    "abstract": "",
    "uri": "https://api.elsevier.com/content/article/pii/S0926860X20300582",
    "pii": "S0926860X20300582"
  },
  "fulltext": {
    "full-text-retrieval-response": {
      "scopus-eid": "2-s2.0-85084442293",
      "originalText": "serial JL 271346 291210 291744 291809 31 Applied Catalysis A: General APPLIEDCATALYSISAGENERAL 2020-02-12 2020-02-12 2020-06-04 2020-06-04 2020-06-04T08:53:04 1-s2.0-S0926860X20300582 S0926-860X(20)30058-2 S0926860X20300582 10.1016/j.apcata.2020.117465 S300 S300.1 FULL-TEXT 1-s2.0-S0926860X20X0010X 2024-01-01T12:33:10.553292Z 0 0 20200625 2020 2020-02-12T17:28:13.95522Z absattachment articleinfo articlenumber articletitlenorm authfirstinitialnorm authfirstsurnamenorm cid cids contenttype copyright crossmark dateloaded dateloadedtxt datesearch datesort dateupdated dco docsubtype doctype doi eid ewtransactionid hubeid indexeddate issn issnnorm itemstage itemtransactionid itemweight openaccess openarchive pg pgfirst pii piinorm pubdatestart pubdatetxt pubyr sortorder srctitle srctitlenorm srctype ssids alllist content subj subheadings suppl tomb volfirst volissue volumelist webpdf webpdfpagecount yearnav figure table e-component body mmlmath acknowledge affil appendices articletitle auth authfirstini authfull authkeywords authlast grantsponsor highlightsabst orcid primabst ref specialabst 0926-860X 0926860X true 600 600 C Volume 600 11 117465 117465 117465 20200625 25 June 2020 2020-06-25 2020 article fla Crown Copyright © 2020 Published by Elsevier B.V. All rights reserved. DOPEDBARIUMCERATEPEROVSKITECATALYSTSFORSIMULTANEOUSNOXSTORAGESOOTOXIDATION MAFFEI N 1 Introduction 2 Experimental 2.1 Catalyst preparation 2.2 Catalyst characterization 2.3 Catalytic activity tests 3 Results and discussion 3.1 XRD characterization 3.2 XPS characterization 3.3 H2-TPR 3.4 Catalyst activity: NOx storage and soot oxidation 4 Conclusions CRediT authorship contribution statement Acknowledgements Appendix A Supplementary data References TWIGG 2007 2 15 M RESITOGLU 2015 15 27 I ROYER 2014 10292 10368 S LABHASETWAR 2015 36002 36014 N DHAL 2017 37 42 G LI 2018 11778 11784 X DHAL 2018 144 154 G ONRUBIA 2017 198 210 J YANG 2017 52352 52356 L PENG 2016 6442 6448 Y YOON 2014 182 193 D MAO 2019 1087 1099 L ZHAOQIANG 2012 121 122 Z WANG 2012 288 300 H MA 2012 817 821 Z KIM 2010 1624 1627 C LI 2010 98 105 Z LIU 2010 1104 1109 J WANG 2010 423 426 K ZHAO 2009 1029 1033 B ZHAO 2009 41 49 B DACQUIN 2009 596 604 J YAO 2009 613 621 W LIU 2008 5930 5941 J LIU 2008 61 72 J PENG 2001 157 161 X LIU 2007 267 272 J KALIAGUINE 2001 345 358 S TERAOKA 2001 73 78 Y HONG 2000 397 404 S TOFAN 2002 225 240 C TORREGROSARIVERO 2017 35228 35238 V STAMMMASIAS 2016 85434 85439 K ALBALADEJOFUENTES 2016 7 15 V ALBALADEJOFUENTES 2014 189 199 V SINGH 2007 349 358 U LI 2007 1418 1426 J MILT 2005 13 21 V JIAFU 2003 429 432 C HODJATI 2000 5 16 S ARVANITIDIS 1996 409 416 I DAVIES 1998 177 182 T BRIGGS 2003 31 56 D SURFACEANALYSISBYAUGERXRAYPHOTOELECTRONSPECTROSCOPY XPSBASICPRINCIPLESSPECTRALFEATURESQUALITATIVEANALYSIS MOULDER 1992 J HANDBOOKXRAYPHOTOELECTRONSPECTROSCOPY BAGUS 2013 273 304 P CHANNEI 2013 484831 D VITOVA 2017 16053 T RADUTOIU 2013 1535 1549 N BIESINGER 2011 2717 2730 M JACOBS 2007 177 191 G XU 2017 1 8 J JAMES 2016 1 12 O LIU 2008 185 195 J RAO 1999 89 94 G TROVARELLI 1997 490 502 A PIUMETTI 2016 35 46 M BENSAID 2016 494 508 S DELEITENBURG 1996 161 173 C LPEZSUREZ 2009 82 89 F LIETTI 2001 175 191 L KABIN 2004 79 89 K LINDHOLM 2007 78 87 A MAFFEIX2020X117465 MAFFEIX2020X117465XN 2022-06-04T00:00:00.000Z 2022-06-04T00:00:00.000Z http://creativecommons.org/licenses/by-nc-nd/4.0/ Crown Copyright © 2020 Published by Elsevier B.V. All rights reserved. 2020-05-16T22:07:56.035Z http://vtw.elsevier.com/data/voc/AddOnTypes/50.7/nlp S0926860X20300582 The authors would like to thank Ms. Valerie Omatsu-Baas for the XRD data. Natural Resources Canada’s Program of Energy Research and Development provided funding for this work. item S0926-860X(20)30058-2 S0926860X20300582 1-s2.0-S0926860X20300582 10.1016/j.apcata.2020.117465 271346 2024-01-01T12:33:10.553292Z 2020-06-25 1-s2.0-S0926860X20300582-main.pdf https://s3-eu-west-1.amazonaws.com/prod-ucs-content-store-eu-west/content/pii:S0926860X20300582/MAIN/application/pdf/392a9a4c712534017e23c1919523ad1e/main.pdf main.pdf pdf true 6869185 MAIN 10 1-s2.0-S0926860X20300582-main_1.png https://s3-eu-west-1.amazonaws.com/prod-ucs-content-store-eu-west/content/pii:S0926860X20300582/PREVIEW/image/png/ed377a60bb70c644b525ec654ccac437/main_1.png main_1.png png 54622 849 656 IMAGE-WEB-PDF 1 1-s2.0-S0926860X20300582-gr4.jpg https://s3-eu-west-1.amazonaws.com/prod-ucs-content-store-eu-west/content/pii:S0926860X20300582/gr4/DOWNSAMPLED/image/jpeg/755b34459fd36a99eafa16e5aebebfc6/gr4.jpg gr4 gr4.jpg jpg 98958 886 717 IMAGE-DOWNSAMPLED 1-s2.0-S0926860X20300582-gr3.jpg https://s3-eu-west-1.amazonaws.com/prod-ucs-content-store-eu-west/content/pii:S0926860X20300582/gr3/DOWNSAMPLED/image/jpeg/3c728abaeb16a25c7f929ecd29811ce8/gr3.jpg gr3 gr3.jpg jpg 98369 886 717 IMAGE-DOWNSAMPLED 1-s2.0-S0926860X20300582-gr2.jpg https://s3-eu-west-1.amazonaws.com/prod-ucs-content-store-eu-west/content/pii:S0926860X20300582/gr2/DOWNSAMPLED/image/jpeg/88742e43e979ccdc43068eda8454f00e/gr2.jpg gr2 gr2.jpg jpg 98740 893 717 IMAGE-DOWNSAMPLED 1-s2.0-S0926860X20300582-ga1.jpg https://s3-eu-west-1.amazonaws.com/prod-ucs-content-store-eu-west/content/pii:S0926860X20300582/ga1/DOWNSAMPLED/image/jpeg/455d2df0c529fed7d3a6fb4ae1f2b471/ga1.jpg ga1 true ga1.jpg jpg 30702 198 500 IMAGE-DOWNSAMPLED 1-s2.0-S0926860X20300582-gr1.jpg https://s3-eu-west-1.amazonaws.com/prod-ucs-content-store-eu-west/content/pii:S0926860X20300582/gr1/DOWNSAMPLED/image/jpeg/eb0b82636f47956c69602a7f83c55187/gr1.jpg gr1 gr1.jpg jpg 32665 508 341 IMAGE-DOWNSAMPLED 1-s2.0-S0926860X20300582-gr8.jpg https://s3-eu-west-1.amazonaws.com/prod-ucs-content-store-eu-west/content/pii:S0926860X20300582/gr8/DOWNSAMPLED/image/jpeg/bedc0672235c325259d3c21889af4fed/gr8.jpg gr8 gr8.jpg jpg 25801 259 378 IMAGE-DOWNSAMPLED 1-s2.0-S0926860X20300582-gr7.jpg https://s3-eu-west-1.amazonaws.com/prod-ucs-content-store-eu-west/content/pii:S0926860X20300582/gr7/DOWNSAMPLED/image/jpeg/c742f739ba0da9e87c70aa8fada8c0e7/gr7.jpg gr7 gr7.jpg jpg 29228 262 378 IMAGE-DOWNSAMPLED 1-s2.0-S0926860X20300582-gr6.jpg https://s3-eu-west-1.amazonaws.com/prod-ucs-content-store-eu-west/content/pii:S0926860X20300582/gr6/DOWNSAMPLED/image/jpeg/e241000724ddd44c2064e3480b4bdac7/gr6.jpg gr6 gr6.jpg jpg 40857 556 378 IMAGE-DOWNSAMPLED 1-s2.0-S0926860X20300582-gr5.jpg https://s3-eu-west-1.amazonaws.com/prod-ucs-content-store-eu-west/content/pii:S0926860X20300582/gr5/DOWNSAMPLED/image/jpeg/7ba554ae59831ad486ae36268f819030/gr5.jpg gr5 gr5.jpg jpg 53908 804 341 IMAGE-DOWNSAMPLED 1-s2.0-S0926860X20300582-gr9.jpg https://s3-eu-west-1.amazonaws.com/prod-ucs-content-store-eu-west/content/pii:S0926860X20300582/gr9/DOWNSAMPLED/image/jpeg/f08f6d94c6665cfa9b3ad28e86700cdf/gr9.jpg gr9 gr9.jpg jpg 26958 258 378 IMAGE-DOWNSAMPLED 1-s2.0-S0926860X20300582-gr4.sml https://s3-eu-west-1.amazonaws.com/prod-ucs-content-store-eu-west/content/pii:S0926860X20300582/gr4/THUMBNAIL/image/gif/9b186707668f7a41e8bb8ea3e162f69b/gr4.sml gr4 gr4.sml sml 6269 163 132 IMAGE-THUMBNAIL 1-s2.0-S0926860X20300582-gr3.sml https://s3-eu-west-1.amazonaws.com/prod-ucs-content-store-eu-west/content/pii:S0926860X20300582/gr3/THUMBNAIL/image/gif/2181897792e3095cfc366d399b857718/gr3.sml gr3 gr3.sml sml 6295 163 132 IMAGE-THUMBNAIL 1-s2.0-S0926860X20300582-gr2.sml https://s3-eu-west-1.amazonaws.com/prod-ucs-content-store-eu-west/content/pii:S0926860X20300582/gr2/THUMBNAIL/image/gif/23ae120f986b766b6a74d1a643499ee1/gr2.sml gr2 gr2.sml sml 6299 163 131 IMAGE-THUMBNAIL 1-s2.0-S0926860X20300582-ga1.sml https://s3-eu-west-1.amazonaws.com/prod-ucs-content-store-eu-west/content/pii:S0926860X20300582/ga1/THUMBNAIL/image/gif/d45df89d0b5ec880bdd08ee58866d598/ga1.sml ga1 true ga1.sml sml 6291 87 219 IMAGE-THUMBNAIL 1-s2.0-S0926860X20300582-gr1.sml https://s3-eu-west-1.amazonaws.com/prod-ucs-content-store-eu-west/content/pii:S0926860X20300582/gr1/THUMBNAIL/image/gif/3139d14c2542f9670311459a1f8a9d3e/gr1.sml gr1 gr1.sml sml 4962 164 110 IMAGE-THUMBNAIL 1-s2.0-S0926860X20300582-gr8.sml https://s3-eu-west-1.amazonaws.com/prod-ucs-content-store-eu-west/content/pii:S0926860X20300582/gr8/THUMBNAIL/image/gif/56ee7406016999121a16fb462b2cb79c/gr8.sml gr8 gr8.sml sml 7810 150 219 IMAGE-THUMBNAIL 1-s2.0-S0926860X20300582-gr7.sml https://s3-eu-west-1.amazonaws.com/prod-ucs-content-store-eu-west/content/pii:S0926860X20300582/gr7/THUMBNAIL/image/gif/27e63e585359fc5c08231102fdb4ed30/gr7.sml gr7 gr7.sml sml 10209 152 219 IMAGE-THUMBNAIL 1-s2.0-S0926860X20300582-gr6.sml https://s3-eu-west-1.amazonaws.com/prod-ucs-content-store-eu-west/content/pii:S0926860X20300582/gr6/THUMBNAIL/image/gif/b0738f04d0beddf5f2861f650c3d2602/gr6.sml gr6 gr6.sml sml 4655 163 111 IMAGE-THUMBNAIL 1-s2.0-S0926860X20300582-gr5.sml https://s3-eu-west-1.amazonaws.com/prod-ucs-content-store-eu-west/content/pii:S0926860X20300582/gr5/THUMBNAIL/image/gif/bcd9fd98e02756d20a79e93352488694/gr5.sml gr5 gr5.sml sml 3949 163 69 IMAGE-THUMBNAIL 1-s2.0-S0926860X20300582-gr9.sml https://s3-eu-west-1.amazonaws.com/prod-ucs-content-store-eu-west/content/pii:S0926860X20300582/gr9/THUMBNAIL/image/gif/4128ad20c11e7195a46c1440972da8af/gr9.sml gr9 gr9.sml sml 8180 150 219 IMAGE-THUMBNAIL 1-s2.0-S0926860X20300582-gr4_lrg.jpg https://s3-eu-west-1.amazonaws.com/prod-ucs-content-store-eu-west/content/pii:S0926860X20300582/gr4/HIGHRES/image/jpeg/a33491e7bdb5306ce02d6c62d4d31206/gr4_lrg.jpg gr4 gr4_lrg.jpg jpg 832336 3923 3176 IMAGE-HIGH-RES 1-s2.0-S0926860X20300582-gr3_lrg.jpg https://s3-eu-west-1.amazonaws.com/prod-ucs-content-store-eu-west/content/pii:S0926860X20300582/gr3/HIGHRES/image/jpeg/204a0aa29b2a82542f00ebc778da1a11/gr3_lrg.jpg gr3 gr3_lrg.jpg jpg 836897 3926 3176 IMAGE-HIGH-RES 1-s2.0-S0926860X20300582-gr2_lrg.jpg https://s3-eu-west-1.amazonaws.com/prod-ucs-content-store-eu-west/content/pii:S0926860X20300582/gr2/HIGHRES/image/jpeg/f25b241e0ba32b922b4977efa39c88e8/gr2_lrg.jpg gr2 gr2_lrg.jpg jpg 851191 3955 3176 IMAGE-HIGH-RES 1-s2.0-S0926860X20300582-ga1_lrg.jpg https://s3-eu-west-1.amazonaws.com/prod-ucs-content-store-eu-west/content/pii:S0926860X20300582/ga1/HIGHRES/image/jpeg/d3d0b8e52a3d9b48113e9c304345161f/ga1_lrg.jpg ga1 true ga1_lrg.jpg jpg 224027 878 2213 IMAGE-HIGH-RES 1-s2.0-S0926860X20300582-gr1_lrg.jpg https://s3-eu-west-1.amazonaws.com/prod-ucs-content-store-eu-west/content/pii:S0926860X20300582/gr1/HIGHRES/image/jpeg/faab1b42a2f3a01b22d2c58db74fc19d/gr1_lrg.jpg gr1 gr1_lrg.jpg jpg 254534 2246 1509 IMAGE-HIGH-RES 1-s2.0-S0926860X20300582-gr8_lrg.jpg https://s3-eu-west-1.amazonaws.com/prod-ucs-content-store-eu-west/content/pii:S0926860X20300582/gr8/HIGHRES/image/jpeg/f8f842a96f122757b93ac135503bbf1f/gr8_lrg.jpg gr8 gr8_lrg.jpg jpg 205051 1150 1676 IMAGE-HIGH-RES 1-s2.0-S0926860X20300582-gr7_lrg.jpg https://s3-eu-west-1.amazonaws.com/prod-ucs-content-store-eu-west/content/pii:S0926860X20300582/gr7/HIGHRES/image/jpeg/b800157b0e6db03676609436b9389bea/gr7_lrg.jpg gr7 gr7_lrg.jpg jpg 261313 1161 1676 IMAGE-HIGH-RES 1-s2.0-S0926860X20300582-gr6_lrg.jpg https://s3-eu-west-1.amazonaws.com/prod-ucs-content-store-eu-west/content/pii:S0926860X20300582/gr6/HIGHRES/image/jpeg/7b9823ee3ac014ca00eff2231d5c6b0a/gr6_lrg.jpg gr6 gr6_lrg.jpg jpg 338545 2465 1676 IMAGE-HIGH-RES 1-s2.0-S0926860X20300582-gr5_lrg.jpg https://s3-eu-west-1.amazonaws.com/prod-ucs-content-store-eu-west/content/pii:S0926860X20300582/gr5/HIGHRES/image/jpeg/feb8ca7b30ee7da4094eb85384510dbf/gr5_lrg.jpg gr5 gr5_lrg.jpg jpg 440199 3560 1509 IMAGE-HIGH-RES 1-s2.0-S0926860X20300582-gr9_lrg.jpg https://s3-eu-west-1.amazonaws.com/prod-ucs-content-store-eu-west/content/pii:S0926860X20300582/gr9/HIGHRES/image/jpeg/24885aecb4bfac9efaf97a965658eb0d/gr9_lrg.jpg gr9 gr9_lrg.jpg jpg 211897 1146 1676 IMAGE-HIGH-RES 1-s2.0-S0926860X20300582-mmc1.docx https://s3-eu-west-1.amazonaws.com/prod-ucs-content-store-eu-west/content/pii:S0926860X20300582/mmc1/MAIN/application/vnd.openxmlformats-officedocument.wordprocessingml.document/ac693c9de5b436f7abc2ae0a810d9f0b/mmc1.docx mmc1 mmc1.docx docx 385434 APPLICATION 1-s2.0-S0926860X20300582-mmc2.zip https://s3-eu-west-1.amazonaws.com/prod-ucs-content-store-eu-west/content/pii:S0926860X20300582/mmc2/MAIN/application/zip/8670c35cc8dd551e3b3b6092a83e7f5b/mmc2.zip mmc2 mmc2.zip zip 395 APPLICATION 1-s2.0-S0926860X20300582-am.pdf am am.pdf pdf 1399306 AAM-PDF https://s3-eu-west-1.amazonaws.com/prod-ucs-content-store-eu-west/content/egi:100TVHXP3HN/MAIN/application/pdf/92632f6e679f603f47e1bd8c619c07ac/am.pdf APCATA 117465 117465 S0926-860X(20)30058-2 10.1016/j.apcata.2020.117465 Fig. 1 XRD patterns of the various perovskite catalysts prepared by SSS (Fig. 1A) and SSS + HEBM (Fig. 1B): (a) BaCe O3-δ, (b) BaCe0.8Zr0.2O3-δ and (c) BaCe0.8Zr0.1Co0.1O3-δ. The * denotes impurity phases. The impurity phases are identified in Table 1. Fig. 1 Fig. 2 XPS spectra of BaCeO3-δ (SSS): a) Ba 3d high-resolution spectra, b) Ce 3d high-resolution spectra and c) O 1s high-resolution spectra. XPS spectra of BaCeO3-δ (SSS+HEBM): d) Ba 3d high-resolution spectra, e) Ce 3d high-resolution spectra and f) O 1s high-resolution spectra. Fig. 2 Fig. 3 XPS spectra of BaCe0.8Zr0.2O3-δ (SSS): a) Ba 3d high-resolution spectra, b) Ce 3d high-resolution spectra and c) O 1s high-resolution spectra. XPS spectra of BaCe0.8Zr0.2O3-δ (SSS+HEBM): d) Ba 3d high-resolution spectra, e) Ce 3d high-resolution spectra and f) O 1s high-resolution spectra. Fig. 3 Fig. 4 XPS spectra of BaCe0.8Zr0.1Co0.1O3-δ (SSS): a) Ba 3d high-resolution spectra, b) Ce 3d high-resolution spectra and c) O 1s high-resolution spectra. XPS spectra of BaCe0.8Zr0.1Co0.1O3-δ (SSS+HEBM): d) Ba 3d high-resolution spectra, e) Ce 3d high-resolution spectra and f) O 1s high-resolution spectra. Fig. 4 Fig. 5 H2-TPR of Co3O4 (a); CeO2, BaCeO3-δ (SSS), BaCe0.8Zr0.2O3-δ (SSS) and BaCe0.8Zr0.1Co0.1O3-δ (SSS) (b); and CeO2, BaCeO3-δ (SSS + HEBM), BaCe0.8Zr0.2O3-δ (SSS + HEBM) and BaCe0.8Zr0.1Co0.1O3-δ (SSS + HEBM) (c). Fig. 5 Fig. 6 NOx concentration in the outlet gas versus temperature for (a) samples processed by SSS and (b) samples processed by SSS + HEBM under a gas flow of 500 ml min−1 and a gas composition containing 10 vol. % O2, 5 vol. % H2O, 500 ppm NO balance nitrogen. Fig. 6 Fig. 7 CO2 concentration in the outlet gas versus temperature for the various perovskite catalysts and a commercial CeO2 sample under a gas flow of 500 ml min−1 and a gas composition containing 10 vol. % O2, 5 vol. % H2O, 500 ppm NO balance nitrogen. Fig. 7 Fig. 8 NO2 generation profile versus temperature for the various perovskite catalyst samples under a gas flow of 500 ml min−1 and a gas composition containing 10 vol. % O2, 5 vol. % H2O, 500 ppm NO balance nitrogen. Fig. 8 Fig. 9 NOx concentration in the outlet gas versus temperature for BaCe0.8Zr0.1Co0.1O3-δ (SSS + HEBM) in the absence and presence of soot under a gas flow of 500 ml min−1 and a gas composition containing 10 vol. % O2, 5 vol. % H2O, 500 ppm NO balance nitrogen. Superimposed on the figure is the CO2 concentration in the outlet gas versus temperature. Fig. 9 Table 1 Lattice parameter and crystallite size for the various perovskite catalysts. Table 1 Catalysts Lattice Parameter(nm) Crystallite size(nm) Impurity Phases a BaCeO3-δ a = 0.62308 54.7 BaCO3 b = 0.87786 c = 0.61828 a BaCe0.8Zr0.2O3-δ a = 0.62015 49.4 BaZrO3, ZrO2 b = 0.87537 c = 0.62230 a BaCe0.8Zr0.1Co0.1O3-δ a = 0.62168 25.5 BaCoO3 b = 0.86744 c = 0.61773 b BaCeO3-δ 0.43985 13.2 BaCO3 b BaCe0.8Zr0.2O3-δ 0.43926 11.5 BaZrO3, ZrO2 b BaCe0.8Zr0.1Co0.1O3-δ 0.43742 9.4 BaCoO3 a SSS. b SSS + HEBM. Table 2 Hydrogen consumption for the various catalysts. Table 2 Sample H2 consumed (μmol/g) CeO2 679 Co3O4 14170 ZrO2 nil BaCeO3-δ (SSS) 57 BaCeO3-δ (SSS + HEBM) 1237 BaCe0.8Zr0.2O3-δ (SSS) 29 BaCe0.8Zr0.2O3-δ (SSS + HEBM) 651 BaCe0.8Zr0.1Co0.1O3-δ (SSS) 462 BaCe0.8Zr0.1Co0.1O3-δ (SSS + HEBM) 961 Doped barium cerate perovskite catalysts for simultaneous NOx storage and soot oxidation N. Maffei Conceptualization Methodology Validation Investigation Writing - original draft Writing - review & editing a * L. Nossova Formal analysis Writing - review & editing a M.J. Turnbull Investigation Formal analysis Writing - review & editing b G. Caravaggio Writing - review & editing a R. Burich Investigation Formal analysis a a Natural Resources Canada, CanmetENERGY-Ottawa, 1 Haanel Drive, Ottawa, ON K1A 1M1 Canada Natural Resources Canada CanmetENERGY-Ottawa 1 Haanel Drive Ottawa ON K1A 1M1 Canada Natural Resources Canada, CanmetENERGY-Ottawa, 1 Haanel Drive, Ottawa, ON K1A 1M1 Canada b National Research Council Canada, Energy, Mining and Environment Research Centre, 1200 Montreal Road, Ottawa, ON K1A 0R6 Canada National Research Council Canada Energy, Mining and Environment Research Centre 1200 Montreal Road Ottawa ON K1A 0R6 Canada National Research Council Canada, Energy, Mining and Environment Research Centre, 1200 Montreal Road, Ottawa, ON K1A 0R6 Canada ⁎ Corresponding author. Graphical abstract A series of doped barium cerate perovskite catalysts (BaCeO3-δ, BaCe0.8Zr0.2O3-δ and BaCe0.8Zr0.1Co0.1O3-δ) were prepared by a two-step process consisting of solid-state synthesis followed by high-energy ball milling. X-ray diffraction studies showed that the dopants (Zr and Co) were incorporated into the perovskite lattice. TPR studies revealed that the high-energy ball milling process significantly enhanced the reducibility of the catalysts. XPS data indicated a shift in electron density away from the metal centres and an increase in defect oxides, for the high-energy ball milled catalysts, which led to enhanced activity of the catalysts. The catalytic performance was evaluated in a fixed bed reactor system under simulated diesel exhaust conditions, including water. The high-energy ball milled barium cerate sample co-doped with Zr and Co exhibited NOx storage of ∼228 μmol/g at 380 °C and a Tmax, at which the rate of soot oxidation reaction was maximum, of 436 °C. Keywords Barium cerate NOx storage Soot oxidation High-energy ball milling 1 Introduction Diesel engines are highly efficient, durable and have relatively low operating cost. They are the preferred engine for heavy-duty transport vehicles. The main pollutants emitted by diesel engines are nitrous oxides (NOx) and particulate matter (PM), which have adverse environmental impact and are deleterious to human health [1,2]. Diesel particulate filters (DPF) are used to eliminate particulate matter from diesel exhaust [1]. Elimination of NOx under the lean operating conditions of diesel engines is difficult. Selective catalytic reduction (SCR), using either urea, hydrocarbons, carbon monoxide or hydrogen as a reductant, is one method used to convert NOx to N2. NOx storage and reduction (NSR), also referred to as lean NOx trap (LNT), is an alternative to SCR technology [1]. State-of-the art LNTs employ Pt, which reduces NOx to N2 under rich (low oxygen concentration) operating conditions, in combination with barium compounds, which store the NOx during lean operating cycles [1]. The use of precious metals makes these LNTs relatively expensive. In addition, Pt is susceptible to sulfur poisoning [1,2]. Perovskite and perovskite-like materials, chemical formula ABO3 and A2BO4, respectively, are low cost, thermally and hydrothermally stable alternative LNT materials with good catalytic performance [3,4]. Substitution of the cation ion (B) creates oxygen vacancies (ABO3-δ) within the perovskite structure that can alter the catalytic properties. The type of ions substituted into the cation B sites in the perovskite structure are restricted by the Goldschmidt tolerance factor (t) such that 0.75 < t < 1.0, where (1) t = r A + r O 2 r B + r O rA, rB, and rO are the respective ion radii, ABO3 [3]. Lanthanum-based perovskites for the simultaneous elimination of NOx and PM from diesel exhaust have been extensively studied [5–30]. Lanthanum based perovskites have been shown to decompose NO to N2, however, their activity decreased when large amounts of oxygen was present [31]. Barium-based perovskites have, however, received considerably less attention for use as LNTs and for soot oxidation [32–40]. Barium is routinely used as the NOx storage component in precious metal based LNTs [1]. Palladium doped barium cerate perovskites were shown to be excellent CO oxidation catalysts [36,37]. Recently, precious metal-doped barium cerate was shown to be effective for simultaneous conversion of NOx, CO and propylene in lean burn engines [33]. In this paper, simultaneous NOx storage and soot oxidation performance of doped barium cerate perovskite materials are reported. The catalysts were prepared by a two-step process consisting of solid-state synthesis (SSS) followed by high-energy ball milling (HEBM). X-ray diffraction (XRD) was used to study the effect of metal dopants on crystal structure. The surface area was determined by the Brunauer–Emmett–Teller (BET) method. The catalytic performance for simultaneous NOx storage and soot oxidation was evaluated in a fixed bed reactor system, under simulated diesel exhaust conditions, including water. Temperature programmed reduction (TPR) in hydrogen was used to study the reducibility of the metals in the catalysts. Surface analysis of the catalysts was done by X-ray photoelectron spectroscopy (XPS). 2 Experimental 2.1 Catalyst preparation BaCeO3-δ, BaCe0.8Zr0.2O3-δ and BaCe0.8Zr0.1Co0.1O3-δ perovskite catalysts were prepared by SSS using high purity oxide and carbonate precursors (>99.9%). Appropriate amounts of precursor powders were mixed (Turbula Type T2 F shaker mixer) for approximately 0.5 h. Batch sizes were approximately 15 g. After mixing, the powders were calcined at 1000 °C for 2 h. The powders were crushed in an agate mortar with a pestle and then fired at 1350 °C for 10 h [40–43]. The powders were subjected to a post firing treatment in a HEBM for 24 h (Planetary Ball Mill QM-3SP04). The ball to powder ratio was approximately 10:1. The balls and jar (100 mL) were made of yttria-stabilized zirconia. The ball mill frequency was 600 rotations min−1. 2.2 Catalyst characterization The specific surface area was measured by the BET N2 adsorption method using a TriStar II 3020 instrument (Micromeritics Inc.). The samples were degassed at 250 °C for 5 h and N2 adsorption was carried out at 77 K. Crystal structures of the barium cerate based catalyst powders were determined by XRD. Diffractograms were recorded on a Rigaku Ultima IV XRD spectrometer using Cu Kα radiation (λ = 0.154 nm) and equipped with a diffracted-beam monochromator and a high-speed semiconductor one-dimensional x-ray detector (D/teX Ultra). XRD patterns were collected over the 2θ angular range of 20–90° at a scanning rate of 1° min−1 and 0.01° intervals. Diffraction peaks of crystalline phases were identified using the International Center for Diffraction Data (ICDD) database. The average crystallite size was calculated based on the Scherrer equation using the Rigaku PDXL Diffraction software’s whole pattern profile fitting program. A Micromeritics AutoChem II 2920 Analyzer equipped with a thermal conductivity detector was used for H2-TPR studies. The catalyst was pretreated in He flow of 30 mL min−1 at 400 °C for 30 min. The sample was then cooled to room temperature in the same He flow. The H2-TPR profile was obtained when the catalyst was heated to 900 °C at a heating rate of 10 °C min−1 in a 50 mL min−1 flow of 10 vol% H2 balance argon gas mixture. The chemical surface properties of the samples (∼3-7 nm) were analyzed by XPS using a Kratos Axis Ultra XPS equipped with a monochromated Al X-ray source. Three analyses were performed on each sample. Analyses were carried out using an accelerating voltage of 14 kV and a current of 10 mA. The analysis area is 300 x 700 μm. Charge build-up was compensated for using the Axis charge balancing system. Analyses consisted first of a survey scan performed at a pass energy of 160 eV to identify all the species present, followed by high-resolution scans (20 eV) of the species identified by the survey scan. Peak assignments were based on the NIST database (http://srdata.nist.gov/xps/Bind_E.asp) and relevant publications. Peak fitting was performed using CasaXPS (ver. 23.16dev92) data processing software. Shirley background correction procedures were used as provided by CasaXPS. High-resolution analyses were calibrated to the C 1s signal, at 284.8 eV. Quantification was performed using sensitivity factors provided by CasaXPS’s Scofield element library. 2.3 Catalytic activity tests Catalysts were tested under simulated diesel exhaust conditions using a fixed bed reactor system. Carbon, (Monarch 120 from Cabot) as a model soot compound, was added to the catalyst in a weight ratio of 1:30 carbon:catalyst. The carbon and catalyst were mixed with a mortar and pestle to obtain a tight contact that was easy to reproduce and allowed for performance screening studies based on the intrinsic catalyst activity. To prevent excessive backpressure all catalyst-carbon mixtures were pelletized and sieved to a particle size in the range of 125–180 μm prior to testing. The test sample of 500 mg (±10 mg) was loaded in a 6 mm quartz reactor tube between two pieces of quartz wool. Samples were pretreated as follows: under a nitrogen flow of 500 mL min−1 the temperature was ramped from 75 to 400 °C at a rate of 3 °C min−1, the sample was held at 400 °C for 0.5 h and then allowed to cool to 75 °C. The process gas composition used for catalytic activity tests was 10 vol. % O2, 5 vol. % H2O, 500 ppm NO balance nitrogen, the reaction gas flow rate was 500 mL min−1. The temperature was ramped from 75 to 600 °C at a rate of 3 °C min−1. The effluent gas was analyzed using an MKS Multi Gas 2030 FTIR analyzer. The change in NOx concentration in the outlet was plotted against temperature and the relative change of NOx concentration (ΔNOx) was calculated as follows: (2) ΔNOx (%) = [(NOx-in-NOx-out)/NOx-in] x100 where NOx=NO + NO2. The NOx storage capacity was determined under isothermal conditions by consecutive NOx storage-reduction cycles. The storage capacity was calculated by integrating the area under the curve during the NOx storage cycle, see Fig. S1. The samples were pretreated at 400 °C for 0.5 h under a nitrogen flow of 500 mL min−1. During the storage cycle (10 min) the gas composition was 500 ppm NO, 10 vol. % O2, 5 vol. % H2O balance nitrogen. For the reduction cycle (10 min) the gas composition was 10 vol. % H2, 5 vol. % H2O balance nitrogen. The gas flow for both cycles was 500 mL min−1. The effluent gas was analyzed using an MKS Multi Gas 2030 FTIR analyzer. 3 Results and discussion 3.1 XRD characterization The XRD patterns for the BaCeO3-δ, BaCe0.8Zr0.2O3-δ and BaCe0.8Zr0.1Co0.1O3-δ catalysts prepared by SSS are shown in Fig. 1 A and those prepared by SSS + HEBM are shown in Fig. 1B. All the catalysts processed by SSS had orthorhombic perovskite structure similar to that reported for platinum group metal doped barium cerate [33], the lattice parameters are given in Table 1 . However, the catalyst samples prepared by SSS + HEBM had cubic perovskite structure, the lattice parameters are given in Table 1. The change in crystal structure for the SSS + HEBM processed samples can be ascribed to the HEBM step and are a consequence of the transfer of kinetic energy from the milling media to the catalyst samples during high energy impacts that occurred during the HEBM process. Some minor impurity peaks (marked with an asterisks in Fig. 1B) were detected, see Table 1. The same impurity phases were detected in the SSS and SSS + HEBM catalyst samples but are not as apparent in the SSS samples due to the larger peak intensities. The impurity phase detected in the BaCeO3-δ catalysts was assigned to BaCO3, the impurity phase detected in the BaCe0.8Zr0.2O3-δ samples was a combination of BaZrO3 and ZrO2 and the impurity phase in the BaCe0.8Zr0.1Co0.1O3-δ samples was assigned to BaCoO3. The appearance of the impurity phases are due to the fact that decomposition of barium carbonate is difficult [41–43] and the refractory nature of zirconia. The samples prepared by SSS had much sharper diffraction peaks, indicative of large crystallite size, and can be ascribed to the high temperature processing step. The peak intensities for the Zr and Co-doped barium cerate sample (c in Fig. 1A) are weaker due to the small sample size used. In addition, the peak widths for this catalyst are broader than for the other two (Fig. 1A) indicating this sample has smaller crystallite size (see Table 1). The peak widths for the catalysts prepared by SSS + HEBM are broader, Fig. 1B, indicating smaller crystallite size. The crystallite sizes determined from XRD data, using the Scherrer formula, are given in Table 1. The crystallite size for the various BaCeO3-δ based catalysts prepared by SSS only were much larger than those prepared by SSS + HEBM, as expected. The significant decrease in crystallite size indicated that HEBM was beneficial, at least in terms of crystallite size reduction. 3.2 XPS characterization The survey spectra for the BaCeO3-δ samples (not shown) were used to determine the chemical composition for the SSS and SSS + HEBM samples as Ba0.98Ce1.01O2.16 and Ba0.98Ce1.00O2.02, respectively. The Ba high-resolution spectra are shown in Fig. 2 a and d, respectively. Comparison of both images shows a change in the ratios of the three main Ba 3d peaks, labelled a, b and c, Table S1. Each spectra exhibits typical splitting of the d-orbitals with a, b and c representing the 3d5/2 peak and a’, b’, c’ denoting the corresponding 3d3/2 peak [44,45]. In the BaCeO3-δ SSS sample, the strongest of the three peaks is the a and a’ pair while for the SSS + HEBM sample the peak pair of b and b’ are the strongest. This shift in Ba states to higher binding energy indicates a decrease in the electron density around the Ba sites. The Ce high-resolution peaks show the same trends, as indicated in Fig. 2b and e. In the case of the Ce spectra, both the SSS (Fig. 2b) and SSS + HEBM (Fig. 2e) show multiple splitting of the peaks, Table S2, as a result of f-orbital availability [46]. This creates several apparently broad peak shapes, with small deviations and distinctions in each spectrum [46,47]. A similar pattern is noted to that reported in the Ba spectra, wherein the low binding energy peaks decrease and the high binding energy peaks increase. These spectra again confirm a decrease in electron density about the metal centre Ce, again indicating an increased presence of defect oxides associated with Ce. The complex nature of rare earth metal presence leads to a very broad oxygen peak [48] and the corresponding decrease in binding energy associated with the increased electron density around the oxygen, Fig. 2c and f. Both spectra contain a broad oxygen signal, with several very low binding energy peaks [49]. Neither the Ce or Ba spectra give any indication of excessive peak broadening, so the broadness of the oxygen peak has to be ascribed to some physical property inherent to only the oxygen. To do this without adding an excessive number of oxygen species, each of the expected peaks was doubled – one for the surface and one for the ‘bulk’ – with about 2 eV separation. The separation was intrinsically determined. This allows for fits that match the logical sense of the sample and maintain consistency within the XPS data. The lattice oxides [50] account for 23.08% of the signal in the SSS (Fig. 2c) sample and for 28.02% of the signal in the SSS + HEBM (Fig. 2f) sample, Table S3. Defect oxides and hydroxides [50], account for significantly more in both samples, with 42.13%, and 66.22% of the signal, respectively. This behavior indicates a decreased association between O and the f-orbitals of Ce [46,49], as denoted by the loss of some of the distinct low binding energy peaks seen in Fig. 2c. The sample compositions for the Zr-doped barium cerate samples were determined (from the survey spectra, not shown) to be Ba1.00Ce0.95Zr0.10O3.16 for the SSS sample and Ba1.00Ce0.84Zr0.10O1.90 for the SSS + HEBM sample. The oxygen appears under-represented and suggests potential oxygen loss at the surface. The amount of Ce is significantly greater in the SSS sample. The physical process of HEBM has a greater impact on the Ce centres in the Zr-doped samples than in the non-doped samples, allowing some of the Ce to be lost along with the O lost during this process. Whether this loss is as a weakly bound cerium oxide surface region, or a weakening association between cerium and the surrounding lattice remains unclear, but it is clear that the dopants appear to be more closely associated with the barium centre in the lattice. The Ba high-resolution scans of the BaCe0.8Zr0.2O3-δ samples, shown in Fig. 3 a and d, show similar features to those seen in the BaCeO3-δ samples (Fig. 2a and d). As with the previous sample set, a decrease in the a and a’ peak pair and increase in the b and b’ peak pair can be seen in the SSS + HEBM sample (Fig. 3d) as compared to the SSS sample (Fig. 3a). There is also a general decrease in the a and a’ peak pair in both BaCe0.8Zr0.2O3-δ samples (Fig. 3a and d) when compared against the corresponding peaks in the BaCeO3-δ samples from Fig. 2a and d. The peak positioning of this pair also moves to a higher binding energy. Another difference between the two sample sets is the appearance of the peak at position g. This peak is quite a bit lower than is normal for barium spectra and is associated with additional f-orbital overlap with some of the barium centres [48]. This suggests that some of the drastic difference in oxygen noted in the survey spectra is surface-state related [50]. The Ce spectra of the Zr-doped samples (Fig. 3b and e) show more of the same trend, both with respect to the SSS vs SSS + HEBM sample, and with respect to the Zr-doped vs non-doped sample set. The addition of the HEBM step reduces the low-binding energy peak at position s and position t, and enhances the peak seen at position v. This is in agreement with that seen in the non-doped samples (Fig. 2b and e) and is consistent with increased defect oxide formation, or lattice disruptions [46,50]. Compared to the non-doped samples, the Zr-doped samples have reduced low-binding energy character, as noted by the lower peak contribution at position s in Fig. 3b, as compared to that in Fig. 2b. There is a significantly more visible Ba MNN auger line at position u in the SSS + HEBM sample (Fig. 3e) and the Zr-doped samples appear to have a greater peak u than the non-doped samples, Fig. 2e. The O 1s spectra shown in Fig. 3c and f show the same trends as the non-doped samples, Fig. 2c and f. In this case, the defect oxide is significantly more prevalent in the SSS + HEBM sample (Fig. 3f) than in the SSS sample (Fig. 3c) and there is a distinct secondary oxide in the SSS sample that isn’t present in the SSS + HEBM sample. These features resemble those noted in the non-doped samples and gives strong support to the assertions that the HEBM process creates additional defect sites, as noted through increased electron density around the oxygen. Compared to the non-doped samples (Fig. 2c and f), the Zr-doped samples show additional defect oxide character, but with different association between the oxygen orbitals and the Ce f-orbitals. This is evident by the decrease in distinct peaks in the low binding energy region [46,48]. The presence of the Zr-dopant was observed in the XPS spectra (not shown), however, due to the extreme overlap between the Zr 3d, the Ba 4p and the Ce 4p peaks, no meaningful data could be extracted from these spectra. The composition of the Zr- and Co-doped barium cerate samples was determined (from the survey spectra, not shown) to be Ba1.00 Ce0.93Zr0.09Co0.09O2.65 for the SSS sample and Ba1.00Ce0.78Zr0.11Co0.09O2.02 for the SSS + HEBM sample. As with the Zr-doped samples, these samples also show significant oxygen loss compared to the expected atomic ratios. The high-resolution scans show the same trends seen in both the non-doped and the Zr-doped samples, with increased electron density on the oxygen and decreased density on the metals. The Ba high-resolution scans (Fig. 4 a and d) show a further shift in the peak pair at position a and a’, with an increase in both the b and b’ pair, and the c and c’ pair, relative to the other dopant levels, and after HEBM. The Ce 3d high-resolution spectra (Fig. 4b and e) show a significant increase in the prominence of the peak at position v in the SSS + HEBM sample (Fig. 4e) relative to the SSS sample (Fig. 4b). The peak in position t decreases significantly in Fig. 4e, which is again consistent with the proposed decreased electron density on the metal centres. The peak at position s is present in the SSS + HEBM sample (Fig. 4e) but not in the SSS sample (Fig. 4b). This suggests that the Co-dopant must therefore be returning some electron density to the Ce [46]. In the oxygen spectra (Fig. 4c and f), the addition of the cobalt dopant removes the second lattice oxide observed in the previous samples. The XPS data clearly show that the HEBM process increases the electron density around the oxygen centres in the SSS + HEBM samples and decreases the electron density around the metal centres. This behaviour is a result of increased defect oxide formation within the structure, with evidence of a potential separate surface structure difference due to the low oxygen percentages observed in most of the samples. The introduction of dopants (Co and Zr) also increased the electron density around the oxygen centre and decreased it around the metal centres. The Co-dopant was less effective at creating this electron density shift, as compared to the Zr-dopant, and resulted in the Zr- and Co-doped BaCeO3-δ sample yielding less defect oxides than the Zr-doped sample, but still significantly more than the non-doped sample. 3.3 H2-TPR TPR can provide information on the reduction behaviour of catalysts. Fig. 5 a shows the TPR profile for commercial Co3O4 powder (particle size < 50 nm) used as a precursor for the solid-state synthesis of the cobalt doped barium cerate samples. The profile shows a wide asymmetric reduction peak from approximately 300–500 °C. Previous studies [51–54] have shown that reduction of Co3O4 proceeds by a two step process as evidenced by two reduction peaks. The first reduction step is ascribed to reduction of Co3O4 to CoO and the second reduction step, usually occurring at higher temperature, to reduction of CoO to Co. The data in Fig. 5a suggest that both reduction processes are occurring within the temperature range of ∼300–500 °C. For small crystallite sizes, as for the current sample (particle size < 50 nm), the two stage reduction process can combine into one peak [53]. The hydrogen consumption was determined by integration of the area beneath the whole profile and the data are tabulated in Table 2 . The H2-TPR profile for commercial CeO2 powders is given in Fig. 5b and c. The same data was used but because the scales are different the CeO2 profile in Fig. 5c appears compressed relative to the profile in Fig. 5b. The profile indicates two reduction peaks at ∼500 and 800 °C. The two reduction regions are characteristic of ceria and are ascribed to surface and bulk reduction processes [55,56]. ZrO2 did not show any H2 consumption over the temperature range studied. ZrO2 only has one oxidation state, 4+, and is therefore a non-reducible oxide. The TPR profiles for BaCeO3-δ, BaCe0.8Zr0.2O3-δ and BaCe0.8Zr0.1Co0.1O3-δprepared by SSS are shown in Fig. 5b. The BaCeO3-δ sample showed one small reduction peak at ∼700-800 °C which can be ascribed to the bulk reduction of ceria, although the peak is shifted to slightly lower temperature than the peak for pure CeO2. The addition of zirconia into ceria affects the redox properties of ceria [56–58] and as shown in Fig. 5b this is manifest by a shift in the reduction peak to slightly lower temperatures (∼700-750 °C). Again, only one reduction peak is observed with a lower hydrogen consumption than for the BaCeO3-δ sample (Table 2). The absence of the first Ce reduction peak can be ascribed to the high processing temperatures (1350 °C for 10 h). This same behaviour was also observed for Zr-doped CeO2 powders subjected to high temperature treatment and was attributed to sintering of ceria [59]. The TPR profile for the BaCe0.8Zr0.1Co0.1O3-δ sample shows a broad reduction peak from ∼200-700 °C, the peak has two shoulders, one at ∼350 °C and another at ∼700 °C. The shoulder at low temperature can be ascribed to the reduction of Co3O4 and the shoulder at high temperature to the bulk reduction process for Ce4+. The large reduction peak from ∼400-600 °C seems to be due to reduction of Co in combination with the surface reduction process of Ce4+. The hydrogen consumption for this sample is significantly greater (Table 2) than the other two barium cerate samples even though all the samples were subjected to the same high temperature processing (1350 °C/10 h). The TPR profiles for BaCeO3-δ, BaCe0.8Zr0.2O3-δ and BaCe0.8Zr0.1Co0.1O3-δ prepared by SSS + HEBM are shown in Fig. 5c. The profiles are dramatically different than those for the samples processed by SSS alone. These data clearly show that the HEBM step affected the redox properties of the catalysts even though the surface areas were quite low (less than 1.5 m2/g for all the catalysts). Additionally, the XPS data showed the HEBM process induced a shift in electron density from the metal centres to the oxide centres resulting from an increased defect oxide formation within the structure which effect the catalytic behaviour. The profile for the BaCeO3-δ sample shows three peaks. The low temperature peak (∼400-600 °C) can be ascribed to the surface reduction process for Ce4+, although the peak is shifted to slightly higher temperatures than for the commercial CeO2 sample. The two high temperature peaks coincide with the high temperature bulk reduction peak for CeO2 but the process consisted of two peaks one occurring at slightly lower and one at higher temperatures than the peak for CeO2. The HEBM process, based on the data in Fig. 5, had a significant impact on the reducibility of the catalyst as evidenced by the significant increase in H2 consumption (∼20 times more, Table 2). The H2-TPR profile for BaCe0.8Zr0.2O3-δ sample is similar to the profile for BaCeO3-δ except that the peaks in the profile are shifted to slightly lower temperature. Additionally, the lower temperature peaks for the BaCe0.8Zr0.2O3-δ catalyst are not as well defined as for the BaCeO3-δ sample. The hydrogen consumption of the BaCe0.8Zr0.2O3-δ sample is ∼20 times more than the sample subjected to SSS (Table 2). The hydrogen consumption of the BaCe0.8Zr0.2O3-δ sample is less than the BaCeO3-δ and this can be ascribed to the lower cerium content of the sample. The H2-TPR profile for the BaCe0.8Zr0.1Co0.1O3-δ has an additional peak at ∼250-450 °C as compared to the BaCeO3-δ and BaCe0.8Zr0.2O3-δ samples, this peak can be ascribed to the reduction of Co. The hydrogen consumption is only ∼2 times more than the sample subjected to SSS but that sample already had a significant hydrogen consumption compared to the other two compositions. The H2-TPR data show that HEBM had a significant impact on the reducibility of the catalysts even though the surface area of the samples was quite low. 3.4 Catalyst activity: NOx storage and soot oxidation Fig. 6 a shows the NOx concentration in the outlet gas as a function of temperature for the samples prepared by SSS. Fig. 6b shows the data for the samples processed by SSS and HEBM. The NOx concentration included NO and NO2 concentration while no evolution of N2O was observed. These profiles provide information about changes in NOx concentration due to NO oxidation, NOx adsorption/desorption processes and soot oxidation occurring on the catalyst. For low temperatures (< ∼450 °C) there was no change in NOx concentration for the BaCeO3-δ (SSS) and BaCe0.8Zr0.2O3-δ (SSS) samples. The BaCeO3-δ (SSS + HEBM) and BaCe0.8Zr0.2O3-δ(SSS + HEBM) samples did show changes in NOx concentration (Fig. 6b). The decrease in NOx was due to adsorption while the increase in NOx concentration was due to desorption. The BaCeO3-δ (SSS) sample exhibited a large decrease in the relative change of NOx concentration (ΔNOx) of ∼13% at 520 °C (Fig. 6a). The ΔNOx almost doubled to ∼25% for the sample subjected to a post-processing HEBM treatment (Fig. 6b). Literature data suggest that the redox properties and thermal stability of ceria are enhanced by zirconia [56–58]. Introduction of zirconium into the barium cerate perovskite lattice, BaCe0.8Zr0.2O3-δ (Fig. 6a), did not, however, appear to have any beneficial effect at least in terms of the change in NOx concentration. When the BaCe0.8Zr0.2O3-δ sample was subjected to HEBM the NOx peak at ∼500 °C was shifted to lower temperature by ∼10 °C, Fig. 6b. The increase in NOx concentration in the outlet gas for temperatures >∼520 °C was due to desorption from the catalyst surface. NOx concentration in the outlet gas versus temperature for BaCe0.8Zr0.1Co0.1O3-δ (SSS) and (SSS + HEBM) catalysts is also shown in Fig. 6a and b, respectively. The data revealed a complex behaviour for the catalysts. Clearly, the HEBM process significantly changed the adsorption/desorption behaviour of the catalyst. In the low temperature regime (< ∼450 °C) the (SSS) sample exhibited only relatively weak adsorption and desorption peaks while the SSS + HEBM sample showed relatively large peaks corresponding to both decreases and increases in NOx concentration (due to adsorption/desorption). The co-doped Zr and Co catalyst subjected to a HEBM treatment showed a large decrease in NOx concentration for temperatures in the range of ∼420-500 °C (Fig. 6b). This catalyst had the highest ΔNOx of ∼49% at the lowest temperature (∼455 °C). The percent change in NOx concentration for the BaCe0.8Zr0.1Co0.1O3-δ perovskite catalysts is comparable to those reported in the literature, typical values range from 20 to 40% [13,14,17,32,34,35]. Beyond ∼500 °C the SSS and SSS + HEBM catalysts exhibited an increase in NOx concentration due to desorption of the adsorbed NOx species. These data show that the cation in the perovskite lattice influences the NOx adsorption/desorption properties of the catalysts to a certain extent but that the HEBM processing step significantly enhanced the adsorption/desorption behaviour. The CO2 concentration in the outlet gas stream due to soot oxidation versus temperature for the various catalysts is shown in Fig. 7 . The figure shows that all the catalysts were active for soot oxidation with Tmax, corresponding to the maximal rate of reaction for soot oxidation, in the range of 480–490 °C. The BaCe0.8Zr0.2O3-δ (SSS) was the worst performing catalyst, in terms of soot oxidation, with a Tmax of ∼530. Tmax values for other barium perovskite catalysts such as Cu-doped barium titanate [34] and Cu-doped barium manganite [32] were also in excess of 500 °C. The presence of zirconium in the lattice enhanced the redox properties [56–58] and had a beneficial effect in terms of soot oxidation as evidenced by the decrease in Tmax for the samples subjected to HEBM. The best performing catalyst for soot oxidation, in terms of Tmax, were the co-doped Zr and Co BaCeO3-δ samples, which exhibited the lowest Tmax value of ∼436 °C. The HEBM processing did not affect the soot oxidation behaviour for the co-doped Zr and Co samples suggesting that the presence of the Co cation in the perovskite lattice was responsible for the enhanced soot oxidation performance. For reference, the CO2 concentration in the outlet gas stream due to soot oxidation versus temperature for a commercial CeO2 sample is also shown in Fig. 7, the Tmax for this sample was ∼400 °C. The NO2/NOx ratio in the outlet gas versus temperature for the various perovskite catalysts is shown in Fig. 8 . The NO2 concentration in the feed gas was almost nil, within experimental error. All the catalysts were able to oxidize NO to NO2 until approximately 500 °C, beyond that temperature the NO2 percentage decreased due to thermodynamic limitations (dashed line). The BaCeO3-δ sample exhibited a very slight decrease in NO2 concentration for the sample subjected to HEBM. The BaCe0.8Zr0.2O3-δ sample, however, showed a significant increase in NO2 concentration for the HEBM processed sample. This behavior impacted the soot oxidation of these catalysts as shown in Fig. 7. The NO2 concentration profiles for the co-doped Zr and Co samples are similar but the HEBM sample was able to generate slightly more NO2 at lower temperatures compared to the SSS catalyst. The soot oxidation behavior of these two catalysts were very similar (Fig. 7). These data clearly show that the co-doped Zr and Co catalysts generated the most NO2 and were able to generate NO2 at lower temperatures than the other catalysts which, in part, would account for these catalysts being the best performing in terms of soot oxidation. The NOx concentration in the outlet gas versus temperature for the Co-doped sample with and without soot is shown in Fig. 9 . When the activity test was performed without soot, all changes in NOx concentration were due to adsorption/desorption phenomenon and oxidation of NO to NO2. The NOx concentration profile for the Co-doped sample tested in the presence of soot is very different from the NOx profile obtained without soot unlike López-Suárez et al. who found no difference in NOx conversion obtained with or without the presence of soot for a Cu-doped perovskite catalyst [60]. In our study, when soot was present in the sample, the first NOx uptake of the perovskite catalyst was due to NOx adsorption on the catalyst and its starting temperature coincided to the adsorption without soot. However, when the temperature reached ∼350 °C the NOx concentration started to increase without reaching the maximal adsorption and this increase continued until ∼430 °C. At ∼350 °C, the beginning of soot ignition was observed (Fig. 9, green curve) and NO2 appeared in the gas phase (Fig. 8). Oxidation of soot by NOx intermediates led to the increase of NOx concentration in the outlet gas. When the temperature reached ∼430 °C a second decrease of NOx concentration was observed. This decrease could not be explained by adsorption because according to the run without soot NOx desorption occurred at a temperature close to 450 °C. Thus, the observed changes in NOx concentration might be associated with soot oxidation. If soot reduced NO2 only to NO, NOx concentration would be unchanged. Instead, a second peak in NOx concentration below 500 ppm appeared. This peak might be explained by formation of some products not registered as NOx. Furthermore, it should be noticed that at the same temperature when soot was totally oxidized (∼480 °C) NOx concentrations began to increase reflecting a simple NOx intermediate desorption. NOx storage ability of the BaCe0.8Zr0.1Co0.1O3-δ catalyst subjected to HEBM was investigated at ∼380 °C, Fig. S1 (the temperature at which maximum NOx adsorption was observed, see Fig. 6). The NOx storage capacity under isothermal conditions, and in the presence of water, was approximately 228 μmol/g, comparable to some Pt/Ba/Al2O3 precious metal based LNTs that have storage capacity in the range of 180-500 μmol/g [61–63]. 4 Conclusions Barium cerate based perovskite catalysts were prepared by a two-step process involving solid-state synthesis followed by high-energy ball milling. The conditioning of the samples by high-energy ball milling resulted in a dramatic reduction in crystallite size (∼75%). The addition of metal ion (Zr and Co) on catalytic performance was studied. The co-doped (Zr and Co) barium cerate sample exhibited the largest change in NOx concentration, measured in the outlet gas (∼49%) and the lowest Tmax for soot oxidation (∼436 °C). H-TPR studies revealed that high-energy ball milling significantly enhanced the reducibility of the catalysts. XPS data showed that the high-energy ball milling process increased the electron density around the oxygen centres, regardless of dopant presence, and decreased the electron density around the metal centres. XPS also revealed an increase in defect oxides relative to lattice oxides in the high-energy ball milled samples. The shift in electron density and increase in defect oxides enhanced the activity of the catalyst even though the surface areas were rather low. The NOx storage capacity of the co-doped (Zr and Co) barium cerate was ∼228 μmol/g at 380 °C, comparable to Pt-based lean NOx traps. These materials offer a low cost alternative to lean NOx traps based on platinum group metals. CRediT authorship contribution statement N. Maffei: Conceptualization, Methodology, Validation, Investigation, Writing - original draft, Writing - review & editing. L. Nossova: Formal analysis, Writing - review & editing. M.J. Turnbull: Investigation, Formal analysis, Writing - review & editing. G. Caravaggio: Writing - review & editing. R. Burich: Investigation, Formal analysis. Declaration of Competing Interest The authors declare that they have no conflict of interest. Acknowledgements The authors would like to thank Ms. Valerie Omatsu-Baas for the XRD data. Natural Resources Canada’s Program of Energy Research and Development provided funding for this work. Appendix A Supplementary data Supplementary material related to this article can be found, in the online version, at doi:https://doi.org/10.1016/j.apcata.2020.117465. Appendix A Supplementary data The following are Supplementary data to this article: References [1] M.V. Twigg Appl. Catal. B Environ. 70 2007 2 15 M.V. Twigg, Appl. Catal. B Environ. 70 (2007) 2-15. [2] I.A. Resitoglu K. Altinisik A. Keskin Clean Technol. Environ. Policy 17 2015 15 27 I.A. Resitoglu, K. Altinisik, A. Keskin, Clean Techn. Environ. Policy 17 (2015) 15-27. [3] S. Royer D. Duprez F. Can X. Courtois C. Batiot-Dupeyrat S. Laassiri H. Alamdari Chem. Rev. 114 2014 10292 10368 S. Royer, D. Duprez, F. Can, X. Courtois, C. Batiot-Dupeyrat, S. Laassiri, H. Alamdari, Chem. Rev. 114 (2014) 10292-10368. [4] N. Labhasetwar G. Saravanan S.K. Megarajan N. Manwar R. Khobragade P. Doggali F. Grasset Adv. Mater. 16 2015 36002 36014 N. Labhasetwar, G. Saravanan, S.K. Megarajan, N. Manwar, R. Khobragade, P. Doggali, F. Grasset, Adv. Mater. 16 (2015) 36002-36014. [5] G. Dhal S. Dey D. Mohan R. Prasad Mater. Discov. 10 2017 37 42 G. Dhal, S. Dey, D. Mohan, R. Prasad, Materials Discovery 10 (2017) 37-42. [6] X. Li H. Gao RSC Adv. 8 2018 11778 11784 X. Li, H. Gao, RSC Adv. 8 (2018) 11778-11784. [7] G. Dhal S. Dey D. Mohan R. Prasad Bull. Chem. Reaction Eng. Catal. 13 2018 144 154 G. Dhal, S. Dey, D. Mohan, R. Prasad, Bull. Chem. Reaction Eng. Catal. 13 (2018) 144-154. [8] J.A. Onrubia B. Perada-Ayo U. De-La-Torre J.R. González-Velasco Appl. Catal. B Environ. 213 2017 198 210 J.A. Onrubia, B. Perada-Ayo, U. De-La-Torre, J.R. Gonzxlez-Velasco, Appl. Catal. B Environ. 213 (2017) 198-210. [9] L. Yang G. Li G. Gao R. Xu S. Zhu X. Shu S. Wang Z. Deng P. Wang RSC Adv. 7 2017 52352 52356 L. Yang, G. Li, G. Gao, R. Xu, S. Zhu, X. Shu, S. Wang, Z. Deng, P. Wang, RSC Adv. 7 (2017) 52352-52356. [10] Y. Peng W. Si J. Luo W. Su H. Chang J. Li J. Hao J. Crittenden Environ. Sci. Technol. 50 2016 6442 6448 Y. Peng, W. Si, J. Luo, W. Su, H. Chang, J. Li, J. Hao, J. Crittenden, Environ. Sci. Technol. 50 (2016) 6442-6448. [11] D.Y. Yoon E. Lim Y.J. Kim J.H. Kim T. Ryu S. Lee B.K. Cho I. Nam J.W. Choung S. Yoo J. Catal. 319 2014 182 193 D.Y. Yoon, E. Lim, Y.J. Kim, J.H. Kim, T. Ryu, S. Lee, B.K. Cho, I. Nam, J.W. Choung, S. Yoo, J. Catal. 319 (2014) 182-193. [12] L. Mao Y. Yan X. Zhao M. Fu Y. Xiao G. Dong Catal. Lett. 149 2019 1087 1099 L. Mao, Y. Yan, X. Zhao, M. Fu, Y. Xiao, G. Dong, Catal. Lett. 149 (2019) 1087-1099. [13] Z. Zhaoqiang M. Meng Y. Zha F. Dai T. Hu Y. Xie J. Zhang Appl. Catal. B Environ. 2012 121 122 Z. Zhaoqiang, M. Meng, Y. Zha, F. Dai, T. Hu, Y. Xie, J. Zhang, Appl. Catal. B Environ. 121-122 (2012) 65-74. [14] H. Wang J. Liu Z. Zhao Y. Wei C. Xu Catal. Today 184 2012 288 300 H. Wang, J. Liu, Z. Zhao, Y. Wei, C. Xu, Catal. Today 184 (2012) 288-300. [15] Z. Ma X. Gao X. Yuan L. Zhang Y. Zhu Z. Li Catal. Commun. 12 2012 817 821 Z. Ma, X. Gao, X. Yuan, L. Zhang, Y. Zhu, Z. Li, Catal. Comm. 12 (2012) 817-821. [16] C.H. Kim G. Qi K. Dahlberg W. Li Science 327 2010 1624 1627 C.H. Kim, G. Qi, K. Dahlberg, W. Li, Science 327 (2010) 1624-1627. [17] Z. Li M. Meng Q. Li Y. Xie T. Hu J. Zhang Chem. Eng. J. 164 2010 98 105 Z. Li, M. Meng, Q. Li, Y. Xie, T. Hu, J. Zhang, Chem. Eng. J. 164 (2010) 98-105. [18] J. Liu J. Xu Z. Zhao A. Duan G. Jiang Y. Jing J. Environ. Sci. 22 2010 1104 1109 J. Liu, J. Xu, Z. Zhao, A. Duan, G. Jiang, Y. Jing Y, J. Environ. Sci. 22 (2010) 1104-1109. [19] K. Wang L. Qian L. Zhang H. Liu Z. Yan Catal. Today 158 2010 423 426 K. Wang, L. Qian, L. Zhang, H. Liu, Z. Yan, Catal. Today 158 (2010) 423-426. [20] B. Zhao R. Wang X. Yang Catal. Commun. 10 2009 1029 1033 B. Zhao, R. Wang, X. Yang, Catal. Comm. 10 (2009) 1029-1033. [21] B. Zhao R. Wang W. Yao X. Yang B. Zhou Catal. Lett. 132 2009 41 49 B. Zhao, R. Wang, W. Yao, X. Yang, B. Zhou, Catal. Lett. 132 (2009) 41-49. [22] J.P. Dacquin C. Lancelot C. Dujardin P. Da Costa G. Djega-Mariadassou P. Beaunier S. Kaliaguine S. Vaudreuil S. Royer P. Granger Appl. Catal. B Environ. 91 2009 596 604 J.P. Dacquin, C. Lancelot, C. Dujardin, P. Da Costa, G. Djega-Mariadassou, P. Beaunier, S. Kaliaguine, S. Vaudreuil, S. Royer, P. Granger, Appl. Catal. B Environ. 91 (2009) 596-604. [23] W. Yao R. Wang X. Yang Catal. Lett. 130 2009 613 621 W. Yao, R. Wang, X. Yang, Catal. Lett. 130 (2009) 613-621. [24] J. Liu Z. Zhao C. Xu A. Duan G. Jiang J. Phys. Chem. C 112 2008 5930 5941 J. Liu, Z. Zhao, C. Xu, A. Duan, G. Jiang, J. Phys. Chem. C 112 (2008) 5930-5941. [25] J. Liu Z. Zhao C. Xu A. Duan Appl. Catal. B Environ. 18 2008 61 72 J. Liu, Z. Zhao, C. Xu, A. Duan, Appl. Catal. B Environ. 18 (2008) 61-72. [26] X. Peng H. Lin W. Shangguan Z. Huang Catal. Commun. 8 2001 157 161 X. Peng, H. Lin, W. Shangguan, Z. Huang, Catal. Comm. 8 (2001) 157-161. [27] J. Liu Z. Zhao C. Xu Z. Duan T. Meng Z. Bao Catal. Today 119 2007 267 272 J. Liu, Z. Zhao, C. Xu, Z. Duan, T. Meng, Z. Bao, Catal. Today 119 (2007) 267-272. [28] S. Kaliaguine A. Van Neste V. Szabo J.E. Gallot M. Bassir R. Muzychuk Appl. Catal. A Gen. 209 2001 345 358 S. Kaliaguine, A. Van Neste, V. Szabo, J.E. Gallot, M. Bassir, R. Muzychuk, Appl. Catal. A Gen. 209 (2001) 345-358. [29] Y. Teraoka K. Kanada S. Kagawa Appl. Catal. B Environ. 34 2001 73 78 Y. Teraoka, K. Kanada, S. Kagawa, Appl. Catal. B Environ. 34 (2001) 73-78. [30] S.S. Hong G.D. Lee Catal. Today 63 2000 397 404 S.S. Hong, G.D. Lee, Catal. Today 63 (2000) 397-404. [31] C. Tofan D. Klvana J. Kirchnerova Appl. Catal. A Gen. 226 2002 225 240 C. Tofan, D. Klvana, J. Kirchnerova, Appl. Catal. A Gen. 226 (2002) 225-240. [32] V. Torregrosa-Rivero V. Albaladejo-Fuentes M.S. Sánchez-Adsuar M.J. Illán-Gómez RSC Adv. 7 2017 35228 35238 V. Torregrosa-Rivero, V. Albaladejo-Fuentes, M.S. Sxnchez-Adsuar, M.J. Illxn-Gxmez, RSC Adv. 7 (2017) 35228-35238. [33] K. Stamm Masias T.C. Peck P.T. Fanson RSC Adv. 6 2016 85434 85439 K. Stamm Masias, T.C. Peck, P.T. Fanson, RSC Adv. 6 (2016) 85434-85439. [34] V. Albaladejo-Fuentes F. López-Suárez M. Sánchez-Adsuar M. Illán-Gómez Appl. Catal. A Gen. 519 2016 7 15 V. Albaladejo-Fuentes, F. Lxpez-Suxrez, M. Sxnchez-Adsuar, M. Illxn-Gxmez, Appl. Catal. A Gen. 519 (2016) 7-15. [35] V. Albaladejo-Fuentes F. López-Suárez M. Sánchez-Adsuar M. Illán-Gómez Appl. Catal. A Gen. 488 2014 189 199 V. Albaladejo-Fuentes, F. Lxpez-Suxrez, M. Sxnchez-Adsuar, M. Illxn-Gxmez, Appl. Catal. A Gen. 488 (2014) 189-199. [36] U.G. Singh J. Li J.W. Bennett A.M. Rappe R. Seshadri S.L. Scott J. Catal. 249 2007 349 358 U.G. Singh, J. Li, J.W. Bennett, A.M. Rappe, R. Seshadri, S.L. Scott, J. Catal. 249 (2007) 349-358. [37] J. Li U.G. Singh J.W. Bennett K. Page J.C. Weaver J. Zhang T. Proffen A.M. Rappe S. Scott R. Seshadri Chem. Mater. 19 2007 1418 1426 J. Li, U.G. Singh, J.W. Bennett, K. Page, J.C. Weaver, J. Zhang, T. Proffen, A.M. Rappe, S. Scott, R. Seshadri, Chem. Mater. 19 (2007) 1418-1426. [38] V.G. Milt M.A. Ulla E.E. Miro Appl. Catal. B Environ. 57 2005 13 21 V.G. Milt, M.A. Ulla, E.E. Miro, Appl. Catal. B Environ. 57 (2005) 13-21. [39] C. Jiafu M. Ming L. Peiyan L. Xingang G. Aimei Y. Shouming Chin. J. Chem. Phys. 16 2003 429 432 C. Jiafu, M. Ming, L. Peiyan, L. Xingang, G. Aimei, Y. Shouming, Chinese J. Chem. Phys. 16 (2003) 429-432. [40] S. Hodjati K. Vaezzadeh C. Petit V. Pitchon A. Kiennemann Appl. Catal. B Environ. 26 2000 5 16 S. Hodjati, K. Vaezzadeh, C. Petit, V. Pitchon, A. Kiennemann, Appl. Catal. B Environ. 26 (2000) 5-16. [41] http://barium.atomistry.com/barium_carbonate.html. [42] I. Arvanitidis D. Sichen S. Seetharaman Metall. Mater. Trans. B 27B 1996 409 416 I. Arvanitidis, D. Sichen, S. Seetharaman, Metall. Mater. Trans. B 27B (1996) 409-416. [43] T.J. Davies M. Biedermann Q.-G. Chen H.G. Emblem W.A. Al-Douri Cerâmica 44 1998 177 182 T.J. Davies, M. Biedermann, Q-G. Chen, H.G. Emblem, W.A. Al-Douri, Cerâmica 44 (1998) 177-182. [44] D. Briggs XPS: Basic Principles, Spectral Features and Qualitative Analysis D. Briggs J.T. Grant Surface Analysis by Auger and X-Ray Photoelectron Spectroscopy 2003 IM Publications Chichester 31 56 D. Briggs, XPS: Basic Principles, Spectral Features and Qualitative Analysis, in: Surface Analysis by Auger and X-ray Photoelectron Spectroscopy, eds. D. Briggs and J.T. Grant (IM Publications, Chichester, 2003) pp. 31-56. [45] J.F. Moulder W.F. Stickle P.E. Sobol K.D. Bomben Handbook of X-ray Photoelectron Spectroscopy 1992 Perkin-Elmer Corp Eden Prairie, MN J.F. Moulder, W.F. Stickle, P.E. Sobol, K.D. Bomben, Handbook of X-ray Photoelectron Spectroscopy (Perkin-Elmer Corp, Eden Prairie, MN, 1992). [46] P.S. Bagus E.S. Ilton C.J. Nelin Surf. Sci. Rep. 68 2013 273 304 P.S. Bagus, E.S. Ilton, C.J. Nelin, Surf. Sci. Rep. 68 (2013) 273-304. [47] D. Channei B. Inceesungvorn N. Wetchakun S. Phanichphant Int. J. Photoenergy 2013 484831 D. Channei, B. Inceesungvorn, N. Wetchakun, S. Phanichphant, Int. J. Photoenergy (2013) 484831. [48] T. Vitova I. Pidchenko D. Fellhauer P.S. Bagus Y. Joly T. Pruessmann S. Bahl E. Gonzalez-Robles J. Rothe M. Altmaier M.A. Denecke H. Geckeis Nat. Commun. 8 2017 16053 T. Vitova, I. Pidchenko, D. Fellhauer, P.S. Bagus, Y. Joly, T. Pruessmann, S. Bahl, E. Gonzalez-Robles, J. Rothe, M. Altmaier, M.A. Denecke, H. Geckeis, Nat. Commun. 8 (2017) 16053. [49] N. Răduţoiu C.M. Teodorescu Dig. J. Nanomater. Bios. 6 2013 1535 1549 N. Rxduţoiu, C.M. Teodorescu, Dig. J. Nanomater. Bios. 6 (2013) 1535-1549. [50] M.C. Biesinger B.P. Payne A.P. Grosvenor L.W.M. Lau A.R. Gerson R.St.C. Smart Appl. Surf. Sci. 257 2011 2717 2730 M.C. Biesinger, B.P. Payne, A.P. Grosvenor, L.W.M. Lau, A.R. Gerson, R. St. C. Smart, Appl. Surf. Sci. 257 (2011) 2717-2730. [51] G. Jacobs Y. Ji B.H. Davis D. Cronauer A.J. Kropf C.L. Marchall Appl. Catal. A Gen. 333 2007 177 191 G. Jacobs, Y. Ji, B.H. Davis, D. Cronauer, A.J. Kropf, C.L. Marchall, Appl. Catal. A Gen. 333 (2007) 177-191. [52] J. Xu G. Lu Y. Guo Y. Guo X.-Q. Gong Appl. Catal. A Gen. 535 2017 1 8 J. Xu, G. Lu, Y. Guo, Y. Guo, X-Q. Gong, Appl. Catal. A Gen. 535 (2017) 1-8. [53] O. James S. Maity J. Petrol Tech. Alt. Fuels 7 2016 1 12 O. James, S. Maity, J. Petrol. Tech. Alt. Fuels 7 (2016) 1-12. [54] J. Liu Z. Zhao J. Wang C. Xu A. Duan G. Jiang Q. Yang Appl. Catal. B Environ. 84 2008 185 195 J. Liu, Z. Zhao, J. Wang, C. Xu, A. Duan, G. Jiang, Q. Yang, Appl. Catal. B Environ. 84 (2008) 185-195. [55] G.R. Rao Bull. Mat. Sci. 22 1999 89 94 G.R. Rao, Bull. Mat. Sci. 22 (1999) 89-94. [56] A. Trovarelli F. Zamar J. Llorca C. de Leitenburg G. Dolcetti J.T. Kiss J. Catal. 169 1997 490 502 A. Trovarelli, F. Zamar, J. Llorca, C. de Leitenburg, G. Dolcetti, J.T. Kiss, J. Catal. 169 (1997) 490–502. [57] M. Piumetti S. Bensaid D. Fino N. Russo Appl. Catal. B Environ. 197 2016 35 46 M. Piumetti, S. Bensaid, D. Fino, N. Russo, Appl. Catal. B Environ. 197 (2016) 35-46. [58] S. Bensaid M. Piumetti C. Novara F. Giorgis A. Chiodoni N. Russo D. Fino Nano Res. Lett. 11 2016 494 508 S. Bensaid, M. Piumetti, C. Novara, F. Giorgis, A. Chiodoni, N. Russo, D. Fino, Nano. Res. Lett. 11 (2016) 494-508. [59] C. de Leitenburg A. Trovarelli J. Llorca F. Cavani G. Bini Appl. Catal. A Gen. 139 1996 161 173 C. de Leitenburg, A. Trovarelli, J. Llorca, F. Cavani, G. Bini, Appl. Catal. A Gen. 139 (1996) 161-173. [60] F.R. Lpez-Surez S. Parres-Esclapez A. Bueno-Lpez M.J. Illn-Gmez B. Ura J. Trawczynski Appl. Catal. B Environ. 93 2009 82 89 F.R. Lxpez-Suxrez, S. Parres-Esclapez, A. Bueno-Lxpez, M.J. Illxn-Gxmez, B. Ura, J. Trawczynski, Appl. Catal. B Environ. 93 (2009) 82-89. [61] L. Lietti P. Forzatti I. Nova E. Tronconi J. Catal. 204 2001 175 191 L. Lietti, P. Forzatti, I. Nova, E. Tronconi, J. Catal. 204 (2001) 175-191. [62] K.S. Kabin R.L. Muncrief M.P. Harold Catal. Today 96 2004 79 89 K.S. Kabin, R.L. Muncrief, M.P. Harold, Catal. Today 96 (2004) 79-89. [63] A. Lindholm N.W. Currier E. Fridell A. Yezerets L. Olsson Appl. Catal. B Environ. 75 2007 78 87 A. Lindholm, N.W. Currier, E. Fridell, A. Yezerets, L. Olsson, Appl. Catal. B Environ. 75 (2007) 78-87.",
      "scopus-id": "85084442293",
      "coredata": {
        "eid": "1-s2.0-S0926860X20300582",
        "dc:description": "A series of doped barium cerate perovskite catalysts (BaCeO3-δ, BaCe0.8Zr0.2O3-δ and BaCe0.8Zr0.1Co0.1O3-δ) were prepared by a two-step process consisting of solid-state synthesis followed by high-energy ball milling. X-ray diffraction studies showed that the dopants (Zr and Co) were incorporated into the perovskite lattice. TPR studies revealed that the high-energy ball milling process significantly enhanced the reducibility of the catalysts. XPS data indicated a shift in electron density away from the metal centres and an increase in defect oxides, for the high-energy ball milled catalysts, which led to enhanced activity of the catalysts. The catalytic performance was evaluated in a fixed bed reactor system under simulated diesel exhaust conditions, including water. The high-energy ball milled barium cerate sample co-doped with Zr and Co exhibited NOx storage of ∼228 μmol/g at 380 °C and a Tmax, at which the rate of soot oxidation reaction was maximum, of 436 °C.",
        "openArchiveArticle": "false",
        "prism:coverDate": "2020-06-25",
        "openaccessUserLicense": null,
        "prism:aggregationType": "Journal",
        "prism:url": "https://api.elsevier.com/content/article/pii/S0926860X20300582",
        "dc:creator": [
          {
            "@_fa": "true",
            "$": "Maffei, N."
          },
          {
            "@_fa": "true",
            "$": "Nossova, L."
          },
          {
            "@_fa": "true",
            "$": "Turnbull, M.J."
          },
          {
            "@_fa": "true",
            "$": "Caravaggio, G."
          },
          {
            "@_fa": "true",
            "$": "Burich, R."
          }
        ],
        "link": [
          {
            "@_fa": "true",
            "@rel": "self",
            "@href": "https://api.elsevier.com/content/article/pii/S0926860X20300582"
          },
          {
            "@_fa": "true",
            "@rel": "scidir",
            "@href": "https://www.sciencedirect.com/science/article/pii/S0926860X20300582"
          }
        ],
        "dc:format": "application/json",
        "openaccessType": null,
        "pii": "S0926-860X(20)30058-2",
        "prism:volume": "600",
        "articleNumber": "117465",
        "prism:publisher": "Published by Elsevier B.V.",
        "dc:title": "Doped barium cerate perovskite catalysts for simultaneous NOx storage and soot oxidation",
        "prism:copyright": "Crown Copyright © 2020 Published by Elsevier B.V. All rights reserved.",
        "openaccess": "0",
        "prism:issn": "0926860X",
        "dcterms:subject": [
          {
            "@_fa": "true",
            "$": "Barium cerate"
          },
          {
            "@_fa": "true",
            "$": "NOx storage"
          },
          {
            "@_fa": "true",
            "$": "Soot oxidation"
          },
          {
            "@_fa": "true",
            "$": "High-energy ball milling"
          }
        ],
        "openaccessArticle": "false",
        "prism:publicationName": "Applied Catalysis A: General",
        "openaccessSponsorType": null,
        "prism:pageRange": "117465",
        "pubType": "fla",
        "prism:coverDisplayDate": "25 June 2020",
        "prism:doi": "10.1016/j.apcata.2020.117465",
        "prism:startingPage": "117465",
        "dc:identifier": "doi:10.1016/j.apcata.2020.117465",
        "openaccessSponsorName": null
      },
      "objects": {
        "object": [
          {
            "@category": "standard",
            "@height": "886",
            "@width": "717",
            "@_fa": "true",
            "$": "https://api.elsevier.com/content/object/eid/1-s2.0-S0926860X20300582-gr4.jpg?httpAccept=%2A%2F%2A",
            "@multimediatype": "JPEG image file",
            "@type": "IMAGE-DOWNSAMPLED",
            "@size": "98958",
            "@ref": "gr4",
            "@mimetype": "image/jpeg"
          },
          {
            "@category": "standard",
            "@height": "886",
            "@width": "717",
            "@_fa": "true",
            "$": "https://api.elsevier.com/content/object/eid/1-s2.0-S0926860X20300582-gr3.jpg?httpAccept=%2A%2F%2A",
            "@multimediatype": "JPEG image file",
            "@type": "IMAGE-DOWNSAMPLED",
            "@size": "98369",
            "@ref": "gr3",
            "@mimetype": "image/jpeg"
          },
          {
            "@category": "standard",
            "@height": "893",
            "@width": "717",
            "@_fa": "true",
            "$": "https://api.elsevier.com/content/object/eid/1-s2.0-S0926860X20300582-gr2.jpg?httpAccept=%2A%2F%2A",
            "@multimediatype": "JPEG image file",
            "@type": "IMAGE-DOWNSAMPLED",
            "@size": "98740",
            "@ref": "gr2",
            "@mimetype": "image/jpeg"
          },
          {
            "@category": "standard",
            "@height": "198",
            "@width": "500",
            "@_fa": "true",
            "$": "https://api.elsevier.com/content/object/eid/1-s2.0-S0926860X20300582-ga1.jpg?httpAccept=%2A%2F%2A",
            "@multimediatype": "JPEG image file",
            "@type": "IMAGE-DOWNSAMPLED",
            "@size": "30702",
            "@ref": "ga1",
            "@mimetype": "image/jpeg"
          },
          {
            "@category": "standard",
            "@height": "508",
            "@width": "341",
            "@_fa": "true",
            "$": "https://api.elsevier.com/content/object/eid/1-s2.0-S0926860X20300582-gr1.jpg?httpAccept=%2A%2F%2A",
            "@multimediatype": "JPEG image file",
            "@type": "IMAGE-DOWNSAMPLED",
            "@size": "32665",
            "@ref": "gr1",
            "@mimetype": "image/jpeg"
          },
          {
            "@category": "standard",
            "@height": "259",
            "@width": "378",
            "@_fa": "true",
            "$": "https://api.elsevier.com/content/object/eid/1-s2.0-S0926860X20300582-gr8.jpg?httpAccept=%2A%2F%2A",
            "@multimediatype": "JPEG image file",
            "@type": "IMAGE-DOWNSAMPLED",
            "@size": "25801",
            "@ref": "gr8",
            "@mimetype": "image/jpeg"
          },
          {
            "@category": "standard",
            "@height": "262",
            "@width": "378",
            "@_fa": "true",
            "$": "https://api.elsevier.com/content/object/eid/1-s2.0-S0926860X20300582-gr7.jpg?httpAccept=%2A%2F%2A",
            "@multimediatype": "JPEG image file",
            "@type": "IMAGE-DOWNSAMPLED",
            "@size": "29228",
            "@ref": "gr7",
            "@mimetype": "image/jpeg"
          },
          {
            "@category": "standard",
            "@height": "556",
            "@width": "378",
            "@_fa": "true",
            "$": "https://api.elsevier.com/content/object/eid/1-s2.0-S0926860X20300582-gr6.jpg?httpAccept=%2A%2F%2A",
            "@multimediatype": "JPEG image file",
            "@type": "IMAGE-DOWNSAMPLED",
            "@size": "40857",
            "@ref": "gr6",
            "@mimetype": "image/jpeg"
          },
          {
            "@category": "standard",
            "@height": "804",
            "@width": "341",
            "@_fa": "true",
            "$": "https://api.elsevier.com/content/object/eid/1-s2.0-S0926860X20300582-gr5.jpg?httpAccept=%2A%2F%2A",
            "@multimediatype": "JPEG image file",
            "@type": "IMAGE-DOWNSAMPLED",
            "@size": "53908",
            "@ref": "gr5",
            "@mimetype": "image/jpeg"
          },
          {
            "@category": "standard",
            "@height": "258",
            "@width": "378",
            "@_fa": "true",
            "$": "https://api.elsevier.com/content/object/eid/1-s2.0-S0926860X20300582-gr9.jpg?httpAccept=%2A%2F%2A",
            "@multimediatype": "JPEG image file",
            "@type": "IMAGE-DOWNSAMPLED",
            "@size": "26958",
            "@ref": "gr9",
            "@mimetype": "image/jpeg"
          },
          {
            "@category": "thumbnail",
            "@height": "163",
            "@width": "132",
            "@_fa": "true",
            "$": "https://api.elsevier.com/content/object/eid/1-s2.0-S0926860X20300582-gr4.sml?httpAccept=%2A%2F%2A",
            "@multimediatype": "GIF image file",
            "@type": "IMAGE-THUMBNAIL",
            "@size": "6269",
            "@ref": "gr4",
            "@mimetype": "image/gif"
          },
          {
            "@category": "thumbnail",
            "@height": "163",
            "@width": "132",
            "@_fa": "true",
            "$": "https://api.elsevier.com/content/object/eid/1-s2.0-S0926860X20300582-gr3.sml?httpAccept=%2A%2F%2A",
            "@multimediatype": "GIF image file",
            "@type": "IMAGE-THUMBNAIL",
            "@size": "6295",
            "@ref": "gr3",
            "@mimetype": "image/gif"
          },
          {
            "@category": "thumbnail",
            "@height": "163",
            "@width": "131",
            "@_fa": "true",
            "$": "https://api.elsevier.com/content/object/eid/1-s2.0-S0926860X20300582-gr2.sml?httpAccept=%2A%2F%2A",
            "@multimediatype": "GIF image file",
            "@type": "IMAGE-THUMBNAIL",
            "@size": "6299",
            "@ref": "gr2",
            "@mimetype": "image/gif"
          },
          {
            "@category": "thumbnail",
            "@height": "87",
            "@width": "219",
            "@_fa": "true",
            "$": "https://api.elsevier.com/content/object/eid/1-s2.0-S0926860X20300582-ga1.sml?httpAccept=%2A%2F%2A",
            "@multimediatype": "GIF image file",
            "@type": "IMAGE-THUMBNAIL",
            "@size": "6291",
            "@ref": "ga1",
            "@mimetype": "image/gif"
          },
          {
            "@category": "thumbnail",
            "@height": "164",
            "@width": "110",
            "@_fa": "true",
            "$": "https://api.elsevier.com/content/object/eid/1-s2.0-S0926860X20300582-gr1.sml?httpAccept=%2A%2F%2A",
            "@multimediatype": "GIF image file",
            "@type": "IMAGE-THUMBNAIL",
            "@size": "4962",
            "@ref": "gr1",
            "@mimetype": "image/gif"
          },
          {
            "@category": "thumbnail",
            "@height": "150",
            "@width": "219",
            "@_fa": "true",
            "$": "https://api.elsevier.com/content/object/eid/1-s2.0-S0926860X20300582-gr8.sml?httpAccept=%2A%2F%2A",
            "@multimediatype": "GIF image file",
            "@type": "IMAGE-THUMBNAIL",
            "@size": "7810",
            "@ref": "gr8",
            "@mimetype": "image/gif"
          },
          {
            "@category": "thumbnail",
            "@height": "152",
            "@width": "219",
            "@_fa": "true",
            "$": "https://api.elsevier.com/content/object/eid/1-s2.0-S0926860X20300582-gr7.sml?httpAccept=%2A%2F%2A",
            "@multimediatype": "GIF image file",
            "@type": "IMAGE-THUMBNAIL",
            "@size": "10209",
            "@ref": "gr7",
            "@mimetype": "image/gif"
          },
          {
            "@category": "thumbnail",
            "@height": "163",
            "@width": "111",
            "@_fa": "true",
            "$": "https://api.elsevier.com/content/object/eid/1-s2.0-S0926860X20300582-gr6.sml?httpAccept=%2A%2F%2A",
            "@multimediatype": "GIF image file",
            "@type": "IMAGE-THUMBNAIL",
            "@size": "4655",
            "@ref": "gr6",
            "@mimetype": "image/gif"
          },
          {
            "@category": "thumbnail",
            "@height": "163",
            "@width": "69",
            "@_fa": "true",
            "$": "https://api.elsevier.com/content/object/eid/1-s2.0-S0926860X20300582-gr5.sml?httpAccept=%2A%2F%2A",
            "@multimediatype": "GIF image file",
            "@type": "IMAGE-THUMBNAIL",
            "@size": "3949",
            "@ref": "gr5",
            "@mimetype": "image/gif"
          },
          {
            "@category": "thumbnail",
            "@height": "150",
            "@width": "219",
            "@_fa": "true",
            "$": "https://api.elsevier.com/content/object/eid/1-s2.0-S0926860X20300582-gr9.sml?httpAccept=%2A%2F%2A",
            "@multimediatype": "GIF image file",
            "@type": "IMAGE-THUMBNAIL",
            "@size": "8180",
            "@ref": "gr9",
            "@mimetype": "image/gif"
          },
          {
            "@category": "high",
            "@height": "3923",
            "@width": "3176",
            "@_fa": "true",
            "$": "https://api.elsevier.com/content/object/eid/1-s2.0-S0926860X20300582-gr4_lrg.jpg?httpAccept=%2A%2F%2A",
            "@multimediatype": "JPEG image file",
            "@type": "IMAGE-HIGH-RES",
            "@size": "832336",
            "@ref": "gr4",
            "@mimetype": "image/jpeg"
          },
          {
            "@category": "high",
            "@height": "3926",
            "@width": "3176",
            "@_fa": "true",
            "$": "https://api.elsevier.com/content/object/eid/1-s2.0-S0926860X20300582-gr3_lrg.jpg?httpAccept=%2A%2F%2A",
            "@multimediatype": "JPEG image file",
            "@type": "IMAGE-HIGH-RES",
            "@size": "836897",
            "@ref": "gr3",
            "@mimetype": "image/jpeg"
          },
          {
            "@category": "high",
            "@height": "3955",
            "@width": "3176",
            "@_fa": "true",
            "$": "https://api.elsevier.com/content/object/eid/1-s2.0-S0926860X20300582-gr2_lrg.jpg?httpAccept=%2A%2F%2A",
            "@multimediatype": "JPEG image file",
            "@type": "IMAGE-HIGH-RES",
            "@size": "851191",
            "@ref": "gr2",
            "@mimetype": "image/jpeg"
          },
          {
            "@category": "high",
            "@height": "878",
            "@width": "2213",
            "@_fa": "true",
            "$": "https://api.elsevier.com/content/object/eid/1-s2.0-S0926860X20300582-ga1_lrg.jpg?httpAccept=%2A%2F%2A",
            "@multimediatype": "JPEG image file",
            "@type": "IMAGE-HIGH-RES",
            "@size": "224027",
            "@ref": "ga1",
            "@mimetype": "image/jpeg"
          },
          {
            "@category": "high",
            "@height": "2246",
            "@width": "1509",
            "@_fa": "true",
            "$": "https://api.elsevier.com/content/object/eid/1-s2.0-S0926860X20300582-gr1_lrg.jpg?httpAccept=%2A%2F%2A",
            "@multimediatype": "JPEG image file",
            "@type": "IMAGE-HIGH-RES",
            "@size": "254534",
            "@ref": "gr1",
            "@mimetype": "image/jpeg"
          },
          {
            "@category": "high",
            "@height": "1150",
            "@width": "1676",
            "@_fa": "true",
            "$": "https://api.elsevier.com/content/object/eid/1-s2.0-S0926860X20300582-gr8_lrg.jpg?httpAccept=%2A%2F%2A",
            "@multimediatype": "JPEG image file",
            "@type": "IMAGE-HIGH-RES",
            "@size": "205051",
            "@ref": "gr8",
            "@mimetype": "image/jpeg"
          },
          {
            "@category": "high",
            "@height": "1161",
            "@width": "1676",
            "@_fa": "true",
            "$": "https://api.elsevier.com/content/object/eid/1-s2.0-S0926860X20300582-gr7_lrg.jpg?httpAccept=%2A%2F%2A",
            "@multimediatype": "JPEG image file",
            "@type": "IMAGE-HIGH-RES",
            "@size": "261313",
            "@ref": "gr7",
            "@mimetype": "image/jpeg"
          },
          {
            "@category": "high",
            "@height": "2465",
            "@width": "1676",
            "@_fa": "true",
            "$": "https://api.elsevier.com/content/object/eid/1-s2.0-S0926860X20300582-gr6_lrg.jpg?httpAccept=%2A%2F%2A",
            "@multimediatype": "JPEG image file",
            "@type": "IMAGE-HIGH-RES",
            "@size": "338545",
            "@ref": "gr6",
            "@mimetype": "image/jpeg"
          },
          {
            "@category": "high",
            "@height": "3560",
            "@width": "1509",
            "@_fa": "true",
            "$": "https://api.elsevier.com/content/object/eid/1-s2.0-S0926860X20300582-gr5_lrg.jpg?httpAccept=%2A%2F%2A",
            "@multimediatype": "JPEG image file",
            "@type": "IMAGE-HIGH-RES",
            "@size": "440199",
            "@ref": "gr5",
            "@mimetype": "image/jpeg"
          },
          {
            "@category": "high",
            "@height": "1146",
            "@width": "1676",
            "@_fa": "true",
            "$": "https://api.elsevier.com/content/object/eid/1-s2.0-S0926860X20300582-gr9_lrg.jpg?httpAccept=%2A%2F%2A",
            "@multimediatype": "JPEG image file",
            "@type": "IMAGE-HIGH-RES",
            "@size": "211897",
            "@ref": "gr9",
            "@mimetype": "image/jpeg"
          },
          {
            "@category": "standard",
            "@_fa": "true",
            "$": "https://api.elsevier.com/content/object/eid/1-s2.0-S0926860X20300582-mmc1.docx?httpAccept=%2A%2F%2A",
            "@multimediatype": "Microsoft Word file",
            "@type": "APPLICATION",
            "@size": "385434",
            "@ref": "mmc1",
            "@mimetype": "application/word"
          },
          {
            "@category": "standard",
            "@_fa": "true",
            "$": "https://api.elsevier.com/content/object/eid/1-s2.0-S0926860X20300582-mmc2.zip?httpAccept=%2A%2F%2A",
            "@multimediatype": "ZIP file",
            "@type": "APPLICATION",
            "@size": "395",
            "@ref": "mmc2",
            "@mimetype": "application/zip"
          },
          {
            "@category": "standard",
            "@_fa": "true",
            "$": "https://api.elsevier.com/content/object/eid/1-s2.0-S0926860X20300582-am.pdf?httpAccept=%2A%2F%2A",
            "@multimediatype": "Acrobat PDF file",
            "@type": "AAM-PDF",
            "@size": "1399306",
            "@ref": "am",
            "@mimetype": "application/pdf"
          }
        ]
      },
      "link": {
        "@rel": "abstract",
        "@href": "https://api.elsevier.com/content/abstract/scopus_id/85084442293"
      }
    }
  }
}