{
  "metadata": {
    "title": "Mechanochemical nitration of toluene with metal oxide catalysts",
    "authors": "; ; ",
    "journal": "Applied Catalysis A: General",
    "date": "2020-07-05",
    "doi": "10.1016/j.apcata.2020.117604",
    "abstract": "",
    "uri": "https://api.elsevier.com/content/article/pii/S0926860X20301976",
    "pii": "S0926860X20301976"
  },
  "fulltext": {
    "full-text-retrieval-response": {
      "scopus-eid": "2-s2.0-85085547893",
      "originalText": "serial JL 271346 291210 291744 291809 31 Applied Catalysis A: General APPLIEDCATALYSISAGENERAL 2020-05-05 2020-05-05 2020-06-01 2020-06-01 2020-06-09T12:52:51 1-s2.0-S0926860X20301976 S0926-860X(20)30197-6 S0926860X20301976 10.1016/j.apcata.2020.117604 S300 S300.1 FULL-TEXT 1-s2.0-S0926860X20X00111 2024-01-01T12:33:10.553292Z 0 0 20200705 2020 2020-05-05T02:20:07.226312Z absattachment articleinfo articlenumber articletitlenorm authfirstinitialnorm authfirstsurnamenorm cid cids contenttype copyright crossmark dateloaded dateloadedtxt datesearch datesort dateupdated dco docsubtype doctype doi eid ewtransactionid hubeid indexeddate issn issnnorm itemstage itemtransactionid itemweight openaccess openarchive pg pgfirst pii piinorm pubdatestart pubdatetxt pubyr sortorder srctitle srctitlenorm srctype ssids alllist content subj subheadings suppl tomb volfirst volissue volumelist webpdf webpdfpagecount yearnav figure table e-component body mmlmath acknowledge affil appendices articletitle auth authfirstini authfull authkeywords authlast grantsponsor highlightsabst orcid primabst ref specialabst 0926-860X 0926860X true 601 601 C Volume 601 2 117604 117604 117604 20200705 5 July 2020 2020-07-05 2020 article fla © 2020 Elsevier B.V. All rights reserved. MECHANOCHEMICALNITRATIONTOLUENEMETALOXIDECATALYSTS VASUDEVAN A 1 Introduction 2 Experimental 2.1 Reactants and catalysts 2.2 Reaction milling 2.3 Product extraction 2.4 GC–MS analysis 2.5 Sources of errors and uncertainties 3 Results 3.1 Surface area and structure of catalysts 3.2 MNT production 3.3 Effect of the reaction time on MNT yield 3.4 Effect of reactant ratio on MNT yield and reaction selectivity 4 Discussion 5 Conclusions CRediT authorship contribution statement Acknowledgments Appendix A Supplementary data References SHELDON 2007 R INTRODUCTIONGREENCHEMISTRYCATALYSIS ANASTAS 2010 301 312 P TOPCHIEV 1959 11 73 A NITRATIONHYDROCARBONSOTHERORGANICCOMPOUNDS DUEHR 2013 71 82 J CHEMISTRYPROCESSDESIGNSAFETYFORNITRATIONINDUSTRY DIEGOVASSENA 2000 275 287 A ADAMIAK 2011 62 69 J ADAMIAK 2012 92 95 J BIRADAR 2006 488 493 A KULAL 2019 105 113 A KEMDEO 2010 70 77 S KOSKIN 2016 118 125 A ADAMIAK 2015 175 181 J SATO 1998 473 480 H KWOK 1994 4939 4942 T JEERU 2018 L SMITH 2011 1579 1608 K KOGELBAUER 2000 151 160 A SATO 1999 359 366 H PATIL 2003 429 434 P SUNAJADEVI 2006 3813 3817 K MATHEW 2006 394 398 S SREEDHAR 2008 219 227 I MALYSHEVA 1995 179 226 L SMITH 2002 3285 3289 K QI 2008 537 545 X SHIRI 2010 9077 9106 M JIAO 2017 3961 3974 Y YOU 2015 73083 73090 K YANG 2005 8781 8783 X ANURADHA 2006 4933 4935 V RAJANNA 2015 50 55 K ALBADI 2017 S509 S513 J ZOLFIGOL 2004 1414 1416 M GUO 2018 453 F LAGOVIYER 2018 13690 13700 O LAGOVIYER 2017 191 201 O BUSCA 1999 723 736 G JEONG 2008 10128 10132 N CORA 2004 171 232 F PRINCIPLESAPPLICATIONSDENSITYFUNCTIONALTHEORYININORGANICCHEMISTRYII REESWINKEL 2009 145404 T BRUCKNER 2000 359 364 A STUDIESINSURFACESCIENCECATALYSIS BRUCKNER 2003 97 150 A VASUDEVANX2020X117604 VASUDEVANX2020X117604XA https://vtw.elsevier.com/content/oragreement/10130 CHU_DOD publishAcceptedManuscriptIndexable http://www.elsevier.com/open-access/userlicense/1.0/ 2021-06-01T00:00:00.000Z http://creativecommons.org/licenses/by-nc-nd/4.0/ © 2020 Elsevier B.V. All rights reserved. 2020-04-29T12:59:16.080Z http://vtw.elsevier.com/data/voc/AddOnTypes/50.7/eoas SERDP Strategic Environmental Research and Development Program http://data.elsevier.com/vocabulary/SciValFunders/100013316 http://sws.geonames.org/6252001 item S0926-860X(20)30197-6 S0926860X20301976 1-s2.0-S0926860X20301976 10.1016/j.apcata.2020.117604 271346 2024-01-01T12:33:10.553292Z 2020-07-05 1-s2.0-S0926860X20301976-main.pdf https://s3-eu-west-1.amazonaws.com/prod-ucs-content-store-eu-west/content/pii:S0926860X20301976/MAIN/application/pdf/79da117aa21d70709eb43fdbd5bb5ca7/main.pdf main.pdf pdf true 1010242 MAIN 7 1-s2.0-S0926860X20301976-main_1.png https://s3-eu-west-1.amazonaws.com/prod-ucs-content-store-eu-west/content/pii:S0926860X20301976/PREVIEW/image/png/05600244256e4640135d641aa4c920c1/main_1.png main_1.png png 53765 849 656 IMAGE-WEB-PDF 1 1-s2.0-S0926860X20301976-gr7.jpg https://s3-eu-west-1.amazonaws.com/prod-ucs-content-store-eu-west/content/pii:S0926860X20301976/gr7/DOWNSAMPLED/image/jpeg/e8cea4f0920a6e19bfccc0931f3113ad/gr7.jpg gr7 gr7.jpg jpg 21020 276 378 IMAGE-DOWNSAMPLED 1-s2.0-S0926860X20301976-gr8.jpg https://s3-eu-west-1.amazonaws.com/prod-ucs-content-store-eu-west/content/pii:S0926860X20301976/gr8/DOWNSAMPLED/image/jpeg/a86a21fd11f490552833962f00581e75/gr8.jpg gr8 gr8.jpg jpg 28691 389 363 IMAGE-DOWNSAMPLED 1-s2.0-S0926860X20301976-gr5.jpg https://s3-eu-west-1.amazonaws.com/prod-ucs-content-store-eu-west/content/pii:S0926860X20301976/gr5/DOWNSAMPLED/image/jpeg/86af10bd6ff55a38d1be4ed312a6b020/gr5.jpg gr5 gr5.jpg jpg 20101 319 376 IMAGE-DOWNSAMPLED 1-s2.0-S0926860X20301976-gr6.jpg https://s3-eu-west-1.amazonaws.com/prod-ucs-content-store-eu-west/content/pii:S0926860X20301976/gr6/DOWNSAMPLED/image/jpeg/4ea081765c2d0bc9695d92d28fc74708/gr6.jpg gr6 gr6.jpg jpg 20565 244 376 IMAGE-DOWNSAMPLED 1-s2.0-S0926860X20301976-gr3.jpg https://s3-eu-west-1.amazonaws.com/prod-ucs-content-store-eu-west/content/pii:S0926860X20301976/gr3/DOWNSAMPLED/image/jpeg/38123c81b7cc5b7942fd9f2b88e523a1/gr3.jpg gr3 gr3.jpg jpg 16007 216 376 IMAGE-DOWNSAMPLED 1-s2.0-S0926860X20301976-gr4.jpg https://s3-eu-west-1.amazonaws.com/prod-ucs-content-store-eu-west/content/pii:S0926860X20301976/gr4/DOWNSAMPLED/image/jpeg/6654c0321c6c5559ba8481b6f81bef39/gr4.jpg gr4 gr4.jpg jpg 20988 289 378 IMAGE-DOWNSAMPLED 1-s2.0-S0926860X20301976-gr1.jpg https://s3-eu-west-1.amazonaws.com/prod-ucs-content-store-eu-west/content/pii:S0926860X20301976/gr1/DOWNSAMPLED/image/jpeg/8311e02e8d5a378ea9a43197855562af/gr1.jpg gr1 gr1.jpg jpg 15595 189 376 IMAGE-DOWNSAMPLED 1-s2.0-S0926860X20301976-gr2.jpg https://s3-eu-west-1.amazonaws.com/prod-ucs-content-store-eu-west/content/pii:S0926860X20301976/gr2/DOWNSAMPLED/image/jpeg/47603a6b0ce37199e48dd9b9950eed0b/gr2.jpg gr2 gr2.jpg jpg 35672 265 376 IMAGE-DOWNSAMPLED 1-s2.0-S0926860X20301976-ga1.jpg https://s3-eu-west-1.amazonaws.com/prod-ucs-content-store-eu-west/content/pii:S0926860X20301976/ga1/DOWNSAMPLED/image/jpeg/dba512127cc101ecdd04508845d34880/ga1.jpg ga1 true ga1.jpg jpg 16205 200 370 IMAGE-DOWNSAMPLED 1-s2.0-S0926860X20301976-gr7.sml https://s3-eu-west-1.amazonaws.com/prod-ucs-content-store-eu-west/content/pii:S0926860X20301976/gr7/THUMBNAIL/image/gif/894099da232c60236e6e709179525f5f/gr7.sml gr7 gr7.sml sml 7014 160 219 IMAGE-THUMBNAIL 1-s2.0-S0926860X20301976-gr8.sml https://s3-eu-west-1.amazonaws.com/prod-ucs-content-store-eu-west/content/pii:S0926860X20301976/gr8/THUMBNAIL/image/gif/f3a78f6c905995f4647116794602261a/gr8.sml gr8 gr8.sml sml 5000 164 153 IMAGE-THUMBNAIL 1-s2.0-S0926860X20301976-gr5.sml https://s3-eu-west-1.amazonaws.com/prod-ucs-content-store-eu-west/content/pii:S0926860X20301976/gr5/THUMBNAIL/image/gif/0bf31df8ec0dc66062571cc05f63c3f6/gr5.sml gr5 gr5.sml sml 4623 164 193 IMAGE-THUMBNAIL 1-s2.0-S0926860X20301976-gr6.sml https://s3-eu-west-1.amazonaws.com/prod-ucs-content-store-eu-west/content/pii:S0926860X20301976/gr6/THUMBNAIL/image/gif/792a2fe85b9ba472c9f1452e28f2eb44/gr6.sml gr6 gr6.sml sml 6429 142 219 IMAGE-THUMBNAIL 1-s2.0-S0926860X20301976-gr3.sml https://s3-eu-west-1.amazonaws.com/prod-ucs-content-store-eu-west/content/pii:S0926860X20301976/gr3/THUMBNAIL/image/gif/488a1deb2246b6357d6341441cdc348f/gr3.sml gr3 gr3.sml sml 5302 126 219 IMAGE-THUMBNAIL 1-s2.0-S0926860X20301976-gr4.sml https://s3-eu-west-1.amazonaws.com/prod-ucs-content-store-eu-west/content/pii:S0926860X20301976/gr4/THUMBNAIL/image/gif/f6bd7bafd6ea3a2cda6f1fd9fd754022/gr4.sml gr4 gr4.sml sml 6529 164 214 IMAGE-THUMBNAIL 1-s2.0-S0926860X20301976-gr1.sml https://s3-eu-west-1.amazonaws.com/prod-ucs-content-store-eu-west/content/pii:S0926860X20301976/gr1/THUMBNAIL/image/gif/8b63a4e97ef90d7933d332a4f61c1d5f/gr1.sml gr1 gr1.sml sml 5187 110 219 IMAGE-THUMBNAIL 1-s2.0-S0926860X20301976-gr2.sml https://s3-eu-west-1.amazonaws.com/prod-ucs-content-store-eu-west/content/pii:S0926860X20301976/gr2/THUMBNAIL/image/gif/bb0417f89ffbc966edd4d5a3900313f3/gr2.sml gr2 gr2.sml sml 13189 154 219 IMAGE-THUMBNAIL 1-s2.0-S0926860X20301976-ga1.sml https://s3-eu-west-1.amazonaws.com/prod-ucs-content-store-eu-west/content/pii:S0926860X20301976/ga1/THUMBNAIL/image/gif/9ef19d00cd30a5529fef70f45bd9a100/ga1.sml ga1 true ga1.sml sml 7742 118 219 IMAGE-THUMBNAIL 1-s2.0-S0926860X20301976-gr7_lrg.jpg https://s3-eu-west-1.amazonaws.com/prod-ucs-content-store-eu-west/content/pii:S0926860X20301976/gr7/HIGHRES/image/jpeg/e5fed589b511e9fd454221a809e7b680/gr7_lrg.jpg gr7 gr7_lrg.jpg jpg 163073 1223 1675 IMAGE-HIGH-RES 1-s2.0-S0926860X20301976-gr8_lrg.jpg https://s3-eu-west-1.amazonaws.com/prod-ucs-content-store-eu-west/content/pii:S0926860X20301976/gr8/HIGHRES/image/jpeg/5acaa032d9f9721ad42cc7b82fdf594d/gr8_lrg.jpg gr8 gr8_lrg.jpg jpg 205887 1722 1607 IMAGE-HIGH-RES 1-s2.0-S0926860X20301976-gr5_lrg.jpg https://s3-eu-west-1.amazonaws.com/prod-ucs-content-store-eu-west/content/pii:S0926860X20301976/gr5/HIGHRES/image/jpeg/f427d0574e6c3312e6aeabcaad458f4a/gr5_lrg.jpg gr5 gr5_lrg.jpg jpg 145515 1416 1667 IMAGE-HIGH-RES 1-s2.0-S0926860X20301976-gr6_lrg.jpg https://s3-eu-west-1.amazonaws.com/prod-ucs-content-store-eu-west/content/pii:S0926860X20301976/gr6/HIGHRES/image/jpeg/48e7283a1f6e10922af986af115676af/gr6_lrg.jpg gr6 gr6_lrg.jpg jpg 154601 1081 1667 IMAGE-HIGH-RES 1-s2.0-S0926860X20301976-gr3_lrg.jpg https://s3-eu-west-1.amazonaws.com/prod-ucs-content-store-eu-west/content/pii:S0926860X20301976/gr3/HIGHRES/image/jpeg/17d8d42081b19fcc157091d3f1a9f94e/gr3_lrg.jpg gr3 gr3_lrg.jpg jpg 123198 959 1667 IMAGE-HIGH-RES 1-s2.0-S0926860X20301976-gr4_lrg.jpg https://s3-eu-west-1.amazonaws.com/prod-ucs-content-store-eu-west/content/pii:S0926860X20301976/gr4/HIGHRES/image/jpeg/0bbafd82144ddc48c2fc7992c82bc8f0/gr4_lrg.jpg gr4 gr4_lrg.jpg jpg 172268 1281 1675 IMAGE-HIGH-RES 1-s2.0-S0926860X20301976-gr1_lrg.jpg https://s3-eu-west-1.amazonaws.com/prod-ucs-content-store-eu-west/content/pii:S0926860X20301976/gr1/HIGHRES/image/jpeg/2c5f0f04f87c602e984bf68535d5ecd5/gr1_lrg.jpg gr1 gr1_lrg.jpg jpg 125396 840 1667 IMAGE-HIGH-RES 1-s2.0-S0926860X20301976-gr2_lrg.jpg https://s3-eu-west-1.amazonaws.com/prod-ucs-content-store-eu-west/content/pii:S0926860X20301976/gr2/HIGHRES/image/jpeg/7c64653286c9ad3aac5f6da6ccc4eac8/gr2_lrg.jpg gr2 gr2_lrg.jpg jpg 309298 1173 1667 IMAGE-HIGH-RES 1-s2.0-S0926860X20301976-ga1_lrg.jpg https://s3-eu-west-1.amazonaws.com/prod-ucs-content-store-eu-west/content/pii:S0926860X20301976/ga1/HIGHRES/image/jpeg/eecc12593e7134355a476969b71ee35a/ga1_lrg.jpg ga1 true ga1_lrg.jpg jpg 119926 886 1638 IMAGE-HIGH-RES 1-s2.0-S0926860X20301976-mmc2.pdf https://s3-eu-west-1.amazonaws.com/prod-ucs-content-store-eu-west/content/pii:S0926860X20301976/mmc2/MAIN/application/pdf/f52896d964640bce5d4215b7b6b4952d/mmc2.pdf mmc2 mmc2.pdf pdf false 543436 APPLICATION 1-s2.0-S0926860X20301976-mmc1.zip https://s3-eu-west-1.amazonaws.com/prod-ucs-content-store-eu-west/content/pii:S0926860X20301976/mmc1/MAIN/application/zip/68ef2995e3ef0393317f2ae97757cdce/mmc1.zip mmc1 mmc1.zip zip 349 APPLICATION 1-s2.0-S0926860X20301976-am.pdf am am.pdf pdf 376190 AAM-PDF https://s3-eu-west-1.amazonaws.com/prod-ucs-content-store-eu-west/content/egi:100KXGR1MM8/MAIN/application/pdf/554e8a603411bc8bbfd95cd9bc831511/am.pdf APCATA 117604 117604 S0926-860X(20)30197-6 10.1016/j.apcata.2020.117604 Elsevier B.V. Fig. 1 Specific surface area of different powders as a function of the pre-milling time. Fig. 1 Fig. 2 Fig. 1. X-ray diffraction patterns for the catalyst powders based on MoO3. The times shown are for pre-milling with or without added NaNO3. Fig. 2 Fig. 3 Apparent crystallite sizes for different catalyst powders as a function of the pre-milling time. Fig. 3 Fig. 4 MNT yield for different catalysts plotted as a function of relative acidity scale: a. Yield of MNT; b. MNT normalized per catalyst surface area measured after run. Fig. 4 Fig. 5 Effect of pre-milling time on MNT production: a. Yield; b. MNT normalized per catalyst surface area measured after run. Fig. 5 Fig. 6 Effect of reaction time (milling pre-milled catalyst with toluene and NaNO3) on yield of MNT. Fig. 6 Fig. 7 Ternary plot with the molar fractions of catalyst, nitrate and toluene. Fig. 7 Fig. 8 Effect of nitrate to toluene mole ratio on yield of MNT, benzaldehyde, and p/o ratio. Fig. 8 Table 1 Materials tested as catalysts for mechanochemical nitration of toluene. Table 1 Material Supplier and nominal purity Relative Acidity, [38] Type of acidity [37] Molybdenum oxide, MoO3 Alfa Aesar, 99.95 % 5.35 Medium Bronsted + Strong Lewis sites Tungsten oxide, WO3 Alfa Aesar, 99.95 % 5.05 Vanadium oxide, V2O5 Acros organics, 99.6 % 4.54 Manganese oxide, MnO2 Alfa Aesar, 99.9 % 3.65 Not specified γ- alumina, Al2O3 Alfa Aesar, 99.9 % 2.28 Strong Lewis sites a Titanium oxide, TiO2 Alfa Aesar, 99.9 % 3.05 Medium Lewis sites Iron oxide, Fe2O3 Alfa Aesar, 99.5 % 2.5 Bismuth oxide, Bi2O3 Alfa Aesar, 99 % Medium Lewis + Basic sites b Zeolite HZSM-5, Si/Al 38 ACS chemicals Bronsted + Lewis sites b Zeolite HZSM-5, Si/Al 360 a Alumina phase was not specified in ref. [38]. b Acidity values not stated in literature. Table 2 Milling parameters pre-set for initial experiments comparing different catalysts. Table 2 Used in all experiments Varied in selected experiments, see text Milling Media (steel balls) diameter, mm Ball to powder ratio Milling speed (rpm) Mass of catalyst (g) Mass of sodium nitrate (g) Volume of toluene(ml) Reaction time(minutes) 12.7 3 350 41.63 1.67 0.5 30 Table 3 Specific surface areas measured for different catalysts prior to mechanochemical nitration and for respective solids recovered after the reaction. Table 3 Catalyst Surface area, m2/g Prior to reaction, pre-milling time, min Reaction time: 30 min, pre-milling time, min 0 15 30 105 120 0 15 30 105 120 MoO3 2.5 10.97 15.24 19.3 8.6 9.02 9.57 14.70 WO3 1.5 9.96 11.96 5.7 7.14 9.20 V2O5 4.91 21.35 37.54 37.54 26.65 34.12 MoO3 + NaNO3 5.46 6.8 7.66 9.74 12.26 14.85 Mechanochemical nitration of toluene with metal oxide catalysts Ashvin Kumar Vasudevan Methodology Validation Investigation Writing - original draft Mirko Schoenitz Investigation Resources Data curation Edward L. Dreizin Conceptualization Project administration Supervision Writing - review & editing * New Jersey Institute of Technology, Newark, NJ, 07103, United States New Jersey Institute of Technology Newark NJ 07103 United States New Jersey Institute of Technology ⁎ Corresponding author. Graphical abstract Results of an experimental study of the mechanochemical nitration of toluene are presented. The focus is on the effect of acidity of metal oxide catalysts on the yield of mononitrotoluene. No solvents were used during the reaction. Sodium nitrate served as a source of nitronium. Gas chromatography-mass spectrometry of the products showed that the nitration rate scaled with the catalyst’s acidity and specific surface area. Homogenizing NaNO3 with the catalyst by additional milling prior to reaction with toluene led to a rapid, nearly complete nitration. Distribution of nitrate over the surface of catalyst is likely rate limiting when toluene is mechanochemically nitrated without the preliminary milling step. The observed for varied reactant ratios trends in yield and isomer ratios suggest that nitronium participates in the nitration while localized on the active sites of the catalyst. Excess of toluene blocks acid sites, inhibiting the formation of nitronium and impeding the nitration. Keywords Heterogeneous reactions High-energy ball milling Energetic materials Acidity 1 Introduction There has been a significant rise in the use of green synthesis methods in the chemical industry with focus on using renewable raw materials, eliminating waste, and reducing use of hazardous reagents and solvents in the production of chemicals [1,2]. Nitration methods used in the industry commonly rely on mixed acids with an excess of nitric acid [3]. These methods have a number of drawbacks, such as low selectivity of desirable isomers, generation of waste acid and evolution of NOx fumes among other safety concerns [4]. Disposal of the produced waste acids is costly [4,5]. Heterogeneous catalysis of nitration of a variety of aromatics used gas-solid and liquid-solid systems. The solid catalysts used, which include metal oxides and zeolites, were found to be effective because of their acidity. The acid sites on the surface of a solid catalyst were required for generation of NO2 + (nitronium ion) from NO3 + (nitrate ion) [6,7]. Effectively, solid acids can play the role of sulfuric acid by assisting in the formation of the nitronium ion while providing easy separation of product and reduced quantities of hazardous waste [8]. Commonly used solid catalysts include Lewis acids, such as molybdenum and tungsten oxides on supports, such as silica and titanium oxide [8–13], or zeolites, such as HZSM-5, H-Y, H-beta, and H-mordenite [5,14–17]. Although the use of sulfuric acid can thus be avoided, the nitration still often requires nitric acid and associated wastes. Water generated through usage of nitric acid necessitated the use of acetic anhydride [12]. Liquid nitric acid is the most common source of the nitro group [5,9,18–22], although gaseous sources [13,23–29] and inorganic nitrates [23,30–,31,32,33] were also explored. Recently, mechanochemical nitration of aromatics was reported using a solid catalyst and an inorganic nitrate as the source for nitronium [34,35]. Reaction (1) was carried out in a high-energy ball mill producing mono-nitrotoluene (MNT). (1) C 7 H 8 + N a N O 3 → M o O 3 C 7 H 7 N O 2 + N a O H The mechanochemical process continuously generates fresh catalytic surface, and brings it in contact with the aromatic and the nitrate. It eliminates the need for liquid reagents other than the aromatic precursor. The solid catalyst and nitrates are environmentally benign. However, the mechanism of nitration in this process is not yet well understood. Previous work [35,36] explored the reaction of toluene and sodium nitrate, as shown in reaction (1), using molybdenum oxide as a catalyst. The effects of milling parameters, including the milling ball diameter, temperature, and milling time were initially characterized. The present experiments are focused on the catalyst acidity, surface area available, and distribution of the nitrate over the catalyst surface. 2 Experimental 2.1 Reactants and catalysts Starting chemical reactants were toluene (Startex, solvent grade) and sodium nitrate (Alfa Aesar, 99 %). Experiments were performed with a range of catalysts, which included metal oxides and zeolites listed in Table 1 . The catalysts were chosen based on the nature of acid sites (considering categories described in the literature [37]) and overall acidity as reported in Refs. [37,38]. The commercial availability of materials was also a factor when selecting catalysts in each category. Catalysts with minimal Bronsted acid sites (TiO2 and Fe2O3) were considered to elucidate the effect of Lewis vs. Bronsted acid sites. Some active catalysts, such as CrO3, were not included because of their toxicity and poor compatibility with the solvents. Because the minimum acid strength required to catalyze the reaction was not known a priori, tests were performed with materials with a broad range of acidities. In preliminary experiments in which the products were extracted and analyzed as described below, only the three catalysts with the highest relative acidity, MoO3, WO3, and V2O5, were identified as generating detectable amounts of MNT. Further experiments focused on these three materials. Surface area of the catalyst powders was measured by nitrogen adsorption using the Brunauer-Emmett-Teller (BET) method on a Quantochrome Instruments Autosorb IQ ASIQM000000-6. Surface area measurements were carried out also for the solid fraction extracted after milling. The powder was dried and degassed at 350 °C for 8 h to remove residual organics. Catalysts were also examined using x-ray diffraction (XRD). A Panalytical Empyrean x-ray diffractometer operated at 45 kV and 40 mA using unfiltered Cu Kα radiation (λ=1.5438 Å) was used. The effect of the catalyst surface area at the beginning of the reaction was tested by pre-milling the catalyst for a fixed time before adding the reactants toluene and sodium nitrate. The catalysts were pre-milled for 15, 30 and 120 min. In some experiments, as discussed further, the catalyst was pre-milled with sodium nitrate. Following pre-milling, the reactants toluene and sodium nitrate (unless the nitrate was introduced during pre-milling) were added and milled further. The milling time with toluene following pre-milling is referred to as reaction time. In one series of experiments, catalysts powders were pre-milled for 15, 30, and, in some cases, 120 min; the toluene was then added and the reaction time was fixed at 30 min. In separate experiments, the reaction times varied between 15 and 45 min for both pre-milled and as-received catalyst powders. In yet another set of experiments using MoO3 as a catalyst, the NaNO3/toluene ratio was changed while fixing the amount of either toluene or sodium nitrate and varying the amount of the other reactant; the reaction time was again fixed at 30 min. The same series of experiments was performed for sodium nitrate pre-milled with MoO3 for up to 120 min. 2.2 Reaction milling Milling was carried out in a Retsch PM 400MA planetary mill. An air conditioner set at 15.5 °C was installed to cool the compartment containing the milling vials. The rotation direction was changed every 15 min and regular, 500-cm3 hardened steel milling vials were used. For reactions using pre-milled catalysts, the vials were allowed to cool for 10 min before adding reactant(s). Milling parameters pre-set for the initial set of experiments are shown in Table 2 following Ref. [35]. The milling media, the mass of catalyst, ball to powder mass ratio, and milling speed shown in Table 2 were used throughout this study. The reaction time, mass of sodium nitrate and volume of toluene shown in Table 2 were used in most experiments; however, these parameters were varied in selected experiments. 2.3 Product extraction The products were extracted using ethyl acetate (ACS, 99.8 %), which dissolves MNT readily. Milling vials were opened in an argon-filled glovebox, 150 mL of ethyl acetate were added, and vials were closed and transferred back to the ball mill. The vials with added solvent were milled for one additional minute. Milling balls were separated from the resulting suspension using a No. 8 sieve (2.34 mm diameter openings). The suspension was allowed to settle for a day and centrifuged for 5 min in a LW Scientific Ultra 8F-centrifuge to remove all solids before its composition was analyzed using gas chromatography–mass spectrometry (GC–MS). 2.4 GC–MS analysis The yield of MNT and formed by-products were quantified using an HP 6890 gas chromatograph. The injection port was held at 200 °C, and the column was heated to 250 °C at 5 °C /min. An HP G2350A mass spectrometer was used to identify the species evolved using the in-built NIST 08 Mass spectral library. In all experiments, xylene (solvent grade, by Sunnyside) was added to the solution as internal standard with a concentration of 4.06 mmol/L. A commercially available MNT, 4-nitrotoluene (Sigma Aldrich, 99 %) served as an external standard to calibrate the GC–MS. A calibration curve was obtained comparing peak areas for MNT and xylene using a set of solutions with commercial MNT/xylene ratio varied from 0.2 to 2.2. The percentage of MNT present in a sample was calculated using the calibration curve. The detection limit for the GC–MS system used is specified as 1 pg/μl for octafluoronaphthalene for the signal to noise ratio of 60. Assuming this detection limit to remain approximately similar for different compounds, for a 1-ml sample, 1 ng of the product of interest could be detected. The catalysts without recognizable peaks for MNT were thus assumed to generate less than 1 ng of MNT or have less than 0.000027 % yield. 2.5 Sources of errors and uncertainties The inconsistencies in the reported results could be caused both by lack of reproducibility in the milling experiments and by measurement techniques used to characterize the nitration products. The reproducibility of the milling experiments could be affected by catalyst caked in selected runs, presence of iron impurities from the milling media, and slight differences between individual milling vials. These issues can be addressed by repeating multiple experiments. Indeed, some of our tests were repeated; in such cases, error bars showing standard deviations of results are shown. Generally, such error bars are smaller than the meaningful changes in the measured quantities reported and discussed here. Further reduction of the error bars could be achieved by additional experiments, which were outside the scope of this effort. The errors in the concentration measurements are first associated with the efficiency of extraction of the reaction products. This efficiency is hard to access; however, the procedure used here was refined to achieve reproducible results in multiple repeated experiments performed in this and previous similar studies [35,36]. The errors in GS-MS analysis can be assessed based on the relative standard deviation for selected repeated experiments as not exceeding 5% of the measured value for the signal to noise ratio of 60. 3 Results In initial experiments, all catalysts listed in Table 1 were tested. Detectable yields of MNT were obtained only for MoO3, WO3, and V2O5. Accordingly, these catalysts were used for further experiments. The complete summary of results for all performed experiments is given in the supplement, Tables S1 – S3. Most important results are discussed here with more details provided. 3.1 Surface area and structure of catalysts The specific surface area of the different catalysts as a function of pre-milling time is shown in Fig. 1 . Longer pre-milling results in a greater surface area for all three oxides. The greatest increase in surface area was observed for pre-milled V2O5. The change in the surface area caused by milling correlates with mechanical properties of oxides. For example, bulk modulus values calculated using density functional theory (BLYP method) for WO3, MoO3 [39], and V2O5 [40] were 257, 195.7, and 87 GPa, respectively. Greater bulk moduli thus correlate with the slower surface area increase during milling. Note that the observed surface increase for MoO3 is less significant if the reactant NaNO3 is added (in the amount shown in Table 2) before pre-milling. Surface areas for the recovered solids were also measured after the mechanochemical nitration of toluene. The results for all surface area measurements, before and after the reaction, are summarized in Table 3 . For pre-milled oxides, a relatively minor change in the specific surface area after nitration runs is observed. In most cases, the surface area is somewhat decreased. Conversely, samples with pre-milled MoO3 and NaNO3 show a noticeable increase in the solids’ surface area after the reaction. Initial experiments were carried out to test the effect of pre-milling sodium nitrate with all three oxides, MoO3, WO3 and V2O5 on the nitration rate. Results of these experiments shown in the supplement, Table S1 suggest that the MNT yield was higher for MoO3 than for the other two oxides. Respectively, further experiments involving pre-milled sodium nitrate and catalyst focused on using MoO3. XRD patterns for several MoO3- based powders used as catalysts are shown in Fig. 2 . The bottom pattern represents as-received MoO3. The second and third patterns from the bottom show powders pre-milled for 15 and 30 min. Finally, the top three patterns show MoO3 and NaNO3 powders pre-milled for different times. With the increase in milling time, the MoO3 peaks broaden suggesting a reduction in the crystallite sizes. No other changes in the XRD are noted, suggesting that any reaction occurring during pre-milling is negligible. Using Williamson-Hall method, crystallite sizes for some of the powders were evaluated as shown in Fig. 3 . The reduction in the crystallite size is noted for MoO3 milled with and without NaNO3. Extended milling times, in excess of ca. 100 min do not lead to further reduction in the crystallite sizes. 3.2 MNT production Results for a set of nitration experiments with 30-min reaction time employing the as-received and pre-milled catalysts V2O5, WO3, and MoO3 are shown in Fig. 4 . Yields are shown in Fig. 4a in terms of conversion of the initially used toluene. The yield is higher for MoO3 while the yields for V2O5 and WO3 are comparable to each other. For both, MoO3 and V2O5, pre-milling results in increased yield. However, this trend is not as clearly observed for WO3. The effect of acidity (quantified using the relative scale from Ref. [38], see Table 1) is not clearly observed either, at least comparing WO3 and V2O5. The same results are shown in Fig. 4b in terms of the absolute amount of MNT produced per unit of surface area of the catalyst. For this presentation, the surface areas were measured for solids recovered after the nitration runs (Table 3). Fig. 4b shows a clear correlation of amount of MNT produced and the catalyst’s relative acidity. For MoO3, showing the highest yield of MNT, the effect of pre-milling times longer than 30 min was further investigated. In addition, results compared yields of MNT for MoO3 pre-milled with NaNO3 for different times. These comparisons are shown in Fig. 5 ; as before, the reaction time was fixed at 30 min. Longer pre-milling does not result in significant increase in the surface area of MoO3 (cf. Table 3). The MNT yield is lower at 120 min pre-milling despite nearly the same surface areas observed for the solids after reaction for pre-milling times of 30 and 120 min. Conversely, for MoO3 pre-milled with NaNO3, the yield increases with an increase in the pre-milling time (as does the surface area, cf. Table 2). The amount of MNT produced per unit of the surface area also increases, nearly linearly. 3.3 Effect of the reaction time on MNT yield The effect of reaction time on MNT yield is shown in Fig. 6 ; the complete set of results is given in the supplement, Table S2. The error bars representing the relative standard deviations are shown for selected repeated measurements. For other measurements, as mentioned above, the error is expected to be within 5 %. Both as-received and pre-milled catalyst powders were used. It is observed that for MoO3 and WO3, the effect of pre-milling the catalyst is negligible. For these catalysts, there is a general, rather weak trend of yield increasing with the reaction time. For MoO3 pre-milled with NaNO3, the results look qualitatively different. First, there is a significant yield observed even without milling, when the composite MoO3/NaNO3 catalyst is brought in contact with toluene. In this case, the product was agitated for one minute when it was being extracted with ethyl acetate. The yield increases with the reaction time very rapidly reaching a relatively stable plateau after 15 min. The absolute yield observed in these experiments exceeds significantly that observed when the catalyst was not pre-milled with NaNO3. These results suggest that the distribution of the solid reactant NaNO3 over the catalyst during milling limits the MNT formation rate in the present experiments, in which MoO3 and NaNO3 are not pre-milled together. 3.4 Effect of reactant ratio on MNT yield and reaction selectivity The effect of NaNO3/toluene ratio on yield of MNT and on the reaction selectivity was investigated in three sets of experiments. First, the amount of toluene was kept constant at 1.5 mL and the amount of sodium nitrate varied from 0.305 to 4 g. Then, the amount of sodium nitrate was fixed at 1.67 g and the toluene amount varied from 0.1–8 ml. In both cases, pre-milled MoO3 served as catalyst in the amount shown in Table 2. Fig. 7 illustrates these experimental series. Finally, the third set of experiments used pre-milled NaNO3 and MoO3 (in the amounts shown in Table 2), and the amount of toluene varied from 0.305 to 4 g, just like in the first set. The complete set of results is shown in the supplement, Table S3. The results are shown in Fig. 8 in terms of MNT produced per surface area of the catalyst (measured after the run), para/ortho ratio for the produced MNT, and amount of benzaldehyde, a main byproduct of MNT oxidation observed in each run. In agreement with data shown in Fig. 6, the yield for the runs using NaNO3 pre-milled with MoO3 is much higher than for other conditions. In both cases where NaNO3 was held constant and the amount of toluene varied, the maximum yield is observed for the nitrate to toluene mole ratio in the range of 2 – 5. At higher ratios, the amount of MNT produced gradually decreases. No similar effect could be clearly detected when the amount of toluene remained constant, while the same range of the nitrate to toluene ratios was covered. It is interesting that using NaNO3 pre-milled with MoO3 leads not only to a greater yield but also to a minimized amount of benzaldehyde, an undesirable byproduct. In other words, the production of benzaldehyde does not directly correlate with production of MNT. Finally, the p/o ratio clearly increases when toluene was the limiting reactant, i.e., for nitrate to toluene ratios of 1 or more. It is also greater for the runs with higher yield per surface area of the catalyst. 4 Discussion Under the conditions tested here, toluene nitration occurred only for relative catalyst acidities of 4.5 and higher. Less acidic catalysts, including zeolites, showed no detectable nitration. The situation for zeolites may be confounded by the porosity restricting the bulk of the surface area [14]. For the three catalysts where nitration was observed (Fig. 4), the MNT yield scales with acidity and surface area of the catalyst. The catalyst and the nitrate reactant are solids, and for toluene nitration to occur, all reactants and the catalyst must be brought in contact with each other. During milling, the reaction mixture homogenizes, the reactants are brought in contact with the catalyst, and the reaction (1) occurs. Under conditions where all reactants are introduced in the mill simultaneously, the amount of MNT produced increases with reaction milling time (Fig. 6). If, however, the nitrate and the catalyst are milled prior to reaction with toluene, the yield becomes remarkably high after a much shorter milling time compared to previous work [35]. After that short milling time, the duration of reaction milling has virtually no effect on the amount of MNT observed after reaction. The above observations strongly suggest that among all the conceivable processes occurring during milling, the distribution of the nitrate over the catalyst surface has been rate limiting for mechanochemical nitration in this, as well as in earlier work [35,36]. Our results have several further implications. The near constant ∼70 % yield of MNT observed after reaction with pre-milled NaNO3 on the MoO3 catalyst, even at short reaction times (Fig. 6), likely represents the maximum observable amount under the current milling and extraction conditions, and therefore full conversion of the toluene. Indeed, at the temperature of ca. 50 °C in the milling vial, the toluene vapor pressure is close to 0.13 bar. For the toluene load of 0.5 mL (Table 2), and vial volume of 500 cm3, this would cause about 50 % of the loaded toluene to be in the gas phase, reacting less effectively. Estimating that approximately 10 % of toluene could have formed products other than MNT, e.g. benzaldehyde, or MNT that was not recovered, the full conversion of toluene is supported. Further, the MNT formation over the pre-milled NaNO3-MoO3 catalyst is not instantaneous, suggesting that the distribution of toluene over the available catalysts surface occurs at a finite rate. This rate is likely affected by the milling intensity. Additionally, the general notion that milling continuously generates fresh surface and therefore new catalytically active surface sites is challenged by the high yield observed when nitrate and catalyst are homogenized prior to reaction. Generation of additional catalytic surface sites appears to be secondary if the bulk of the nitrate is already in contact with the catalyst, and the gradual increase in MNT produced if all reactants are introduced at the same time is unlikely due to the generation of fresh catalyst surface. It is finally of interest to understand the mechanism of nitration in this system, and initial guidance is given by results shown in Fig. 8. The results can be considered in the context of previous reports, essentially identifying two distinct reaction pathways for catalytic nitration of toluene [7,41]. Toluene can be nitrated reacting with nitronium complexes attached to acid sites [7]. This preferentially produces the para isomer p-MNT. Conversely, toluene can be attached to a Lewis acid site prior to reaction [41,42] forming para and ortho isomers in equal proportions. In the present experiments, the p/o ratio is generally high (Fig. 8), particularly for conditions when toluene amounts were reduced while pre-milled NaNO3 and MoO3 were used. This observation points out to a preferential reaction pathway of toluene reacting with nitronium complexes attached to the acid sites. It is interesting that both yield of MNT and p-MNT selectivity are reduced simultaneously when the amounts of toluene are increased. The trend is qualitatively similar, although it is less well resolved for the experiments using MoO3 and NaNO3 without pre-milling. An explanation can be that excess of toluene may be blocking acid sites preventing attachment or formation of nitronium. Furthermore, formation of nitronium also involves interaction of dissolved NaNO3 with Bronsted acid sites similar to nitric acid [11,32]; thus, blocked acid sites may lead to a less effective production of nitronium slowing down nitration occurring by both catalytic pathways. The results shown in Fig. 8 for the formation of benzaldehyde suggest that it forms directly from toluene rather than from oxidized MNT. Indeed, such benzaldehyde formation accounting for toluene adsorbed to Lewis sites was described in Ref. [41]. This side reaction involving toluene adsorption onto the Lewis sites appears to be less favored with the pre-milled MoO3 and NaNO3 samples when amounts of the produced benzaldehyde are reduced. That is likely because NaNO3 is well distributed for the samples containing pre-milled MoO3 and NaNO3 making fewer Lewis sites available to adsorb toluene. The effect is stronger for smaller amounts of toluene used, clearly because fewer toluene molecules remain available to be adsorbed and oxidized. 5 Conclusions Effective mechanochemical nitration of toluene requires solid catalysts with high acidity and both, Bronsted and Lewis sites. Among several tested materials, molybdenum oxide was the preferred catalyst. High catalyst surface area available for mechanochemical nitration accelerates the reaction. When the catalyst and sodium nitrate are homogenized by a preliminary milling step, the reaction rate of the nitrate with toluene increases significantly. Nearly complete conversion of toluene to mononitrotoluene was readily achieved after the solid powders were homogenized. Effect of nitrate to toluene mole ratio and of the total amount of toluene used in the experiments on the yield, p/o ratio, and formation of byproducts suggests that the reaction primarily involves nitronium ions attached to acid sites of the catalyst. The amount of toluene in the reactor should be limited to avoid blocking catalyst’s acid sites required to generate nitronium and later retain it at the catalyst surface prior to the nitration reaction. CRediT authorship contribution statement Ashvin Kumar Vasudevan: Methodology, Validation, Investigation, Writing - original draft. Mirko Schoenitz: Investigation, Resources, Data curation. Edward L. Dreizin: Conceptualization, Project administration, Supervision, Writing - review & editing. Declaration of Competing Interest The authors declare no financial/personal interest or belief that could affect their objectivity. Acknowledgments This work was supported by Strategic Environmental Research and Development Program (SERDP), Contract W912HQ19P0007. Interest and encouragement of Dr. R. Nissan of SERDP is greatly appreciated. The authors also are grateful to Drs. N. Trivedi and L. Wingard of the US Army Research Laboratory for many fruitful discussions. Appendix A Supplementary data Supplementary material related to this article can be found, in the online version, at doi:https://doi.org/10.1016/j.apcata.2020.117604. Appendix A Supplementary data The following are Supplementary data to this article: References [1] R.A. Sheldon I.W.C.E. Arends U. Hanefeld Introduction: Green Chemistry and Catalysis 2007 Wiley‐VCH Verlag GmbH & Co. KGaA Weinheim, Germany 10.1002/9783527611003.ch1 R.A. Sheldon, I.W.C.E. Arends, U. Hanefeld, Introduction: Green Chemistry and Catalysis, Wiley‐VCH Verlag GmbH & Co. KGaA, Weinheim, Germany, 2007. https://doi.org/10.1002/9783527611003.ch1 [2] P. Anastas N. Eghbali Chem. Soc. Rev. 39 2010 301 312 10.1039/B918763B P. Anastas, N. Eghbali, Chemical Society Reviews, 39 (2010) 301-312. https://doi.org/10.1039/B918763B [3] A.V. Topchiev Nitration of Hydrocarbons and Other Organic Compounds 1959 Pergamon 11 73 A.V. Topchiev, in: A.V. Topchiev (Ed.) Nitration of Hydrocarbons and Other Organic Compounds, Pergamon 1959, pp. 11-73. [4] J. Duehr Chemistry, Process Design, and Safety for the Nitration Industry 2013 American Chemical Society 71 82 J. Duehr, Chemistry, Process Design, and Safety for the Nitration Industry, American Chemical Society 2013, pp. 71-82. [5] A.K. Diego Vassena Roel Prins Catal. Today 60 2000 275 287 10.1016/S0920-5861(00)00344-8 A.K. Diego Vassena, Roel Prins Catalysis today, 60 (2000) 275-287. https://doi.org/10.1016/S0920-5861(00)00344-8 [6] J. Adamiak D. Kalinowska-Alichnewicz P. Maksimowski W. Skupiński Mol. Catal. 351 2011 62 69 10.1016/j.molcata.2011.09.015 J. Adamiak, D. Kalinowska-Alichnewicz, P. Maksimowski, W. Skupiński, Molecular Catalysis, 351 (2011) 62-69. https://doi.org/10.1016/j.molcata.2011.09.015 [7] J. Adamiak W. Tomaszewski W. Skupiński Catal. Commun. 29 2012 92 95 10.1016/j.catcom.2012.09.026 J. Adamiak, W. Tomaszewski, W. Skupiński, Catalysis Communications, 29 (2012) 92-95. https://doi.org/10.1016/j.catcom.2012.09.026 [8] A.V. Biradar S.B. Umbarkar S.M. Mathew S.B. Shelke K.M. Malshe P.T. Patil S.P. Dagde S.P. Niphadkar M.K. Dongare Green Chem. 5 2006 488 493 10.1039/b600094k A.V. Biradar, S. B. Umbarkar, S. M. Mathew, S. B. Shelke, K. M. Malshe, P. T. Patil, S. P. Dagde, S. P. Niphadkar and M. K. Dongare, Green Chemistry, 5 (2006) 488-493 http://doi.org/10.1039/b600094k [9] A.B. Kulal M.M. Kasabe P.V. Jadhav M.K. Dongare S.B. Umbarkar Appl. Catal. A Gen. 574 2019 105 113 10.1016/j.apcata.2019.02.002 A.B. Kulal, M.M. Kasabe, P.V. Jadhav, M.K. Dongare, S.B. Umbarkar, Applied Catalysis A: General, 574 (2019) 105-113. http://doi.org/10.1016/j.apcata.2019.02.002 [10] S.M. Kemdeo V.S. Sapkal G.N. Chaudhari J. Mol. Catal. A Chem. 323 2010 70 77 10.1016/j.molcata.2010.03.017 S.M. Kemdeo, V.S. Sapkal, G.N. Chaudhari, Journal of Molecular Catalysis A: Chemical, 323 (2010) 70-77. https://doi.org/10.1016/j.molcata.2010.03.017 [11] A.P. Koskin I.V. Mishakov A.A. Vedyagin Resour. Technol. 2 2016 118 125 10.1016/j.reffit.2016.07.004 A.P. Koskin, I.V. Mishakov, A.A. Vedyagin, Resource-Efficient Technologies, 2 (2016) 118-125. https://doi.org/10.1016/j.reffit.2016.07.004 [12] J. Adamiak M. Chmielarek J. Ind. Eng. Chem. 27 2015 175 181 10.1016/j.jiec.2014.12.032 J. Adamiak, M. Chmielarek, Journal of Industrial and Engineering Chemistry, 27 (2015) 175-181. https://doi.org/10.1016/j.jiec.2014.12.032 [13] H. Sato K. Hirose Res. Chem. Intermed. 24 1998 473 480 10.1163/156856798X00519 H. Sato, K. Hirose, Research on Chemical Intermediates, 24 (1998) 473-480. http://doi.org/10.1163/156856798X00519 [14] T.J. Kwok K. Jayasuriya R. Damavarapu B.W. Brodman J. Org. Chem. 59 1994 4939 4942 10.1021/jo00096a042 T.J. Kwok, K. Jayasuriya, R. Damavarapu, B.W. Brodman, The Journal of Organic Chemistry, 59 (1994) 4939-4942. http://doi.org/10.1021/jo00096a042 [15] L.R. Jeeru R. V.S.Reddy S. Pradhan G. Kundu N.C. Pradhan Asia-pacific J. Chem. Eng. 13 2018 10.1002/apj.2158 L.R. Jeeru, V.S.Reddy, R., S. Pradhan, G. Kundu, N.C. Pradhan, Asia-Pacific Journal of Chemical Engineering, 13 (2018) https://doi.org/10.1002/apj.2158 [16] K. Smith G.A. El-Hiti Green Chem. 13 2011 1579 1608 10.1039/C0GC00689K K. Smith, G.A. El-Hiti, Green Chemistry, 13 (2011) 1579-1608. http://doi.org/10.1039/C0GC00689K [17] A. Kogelbauer D. Vassena R. Prins J.N. Armor Catal. Today 55 2000 151 160 10.1016/S0920-5861(99)00234-5 A. Kogelbauer, D. Vassena, R. Prins, J.N. Armor, Catalysis Today, 55 (2000) 151-160. https://doi.org/10.1016/S0920-5861(99)00234-5 [18] H. Sato K. Nagai H. Yoshioka Y. Nagaoka Appl. Catal. A Gen. 180 1999 359 366 10.1016/S0926-860X(98)00367-6 H. Sato, K. Nagai, H. Yoshioka, Y. Nagaoka, Applied Catalysis A: General, 180 (1999) 359-366. https://doi.org/10.1016/S0926-860X(98)00367-6 [19] P.T. Patil K.M. Malshe S.P. Dagade M.K. Dongare Catal. Commun. 4 2003 429 434 10.1016/S1566-7367(03)00097-9 P.T. Patil, K.M. Malshe, S.P. Dagade, M.K. Dongare, Catalysis Communications, 4 (2003) 429-434. https://doi.org/10.1016/S1566-7367(03)00097-9 [20] K.R. Sunajadevi S. Sugunan Mater. Lett. 60 2006 3813 3817 10.1016/j.matlet.2006.03.119 K.R. Sunajadevi, S. Sugunan, Materials Letters, 60 (2006) 3813-3817. https://doi.org/10.1016/j.matlet.2006.03.119 [21] S.M. Mathew A.V. Biradar S.B. Umbarkar M.K. Dongare Catal. Commun. 7 2006 394 398 10.1016/j.catcom.2005.12.022 S.M. Mathew, A.V. Biradar, S.B. Umbarkar, M.K. Dongare, Catalysis Communications, 7 (2006) 394-398. https://doi.org/10.1016/j.catcom.2005.12.022 [22] I. Sreedhar K.S.K. Reddy M. Ramakrishna S.J. Kulkarni K.V. Raghavan Can. J. Chem. Eng. 86 2008 219 227 10.1002/cjce.20016 I. Sreedhar, K.S.K. Reddy, M. Ramakrishna, S.J. Kulkarni, K.V. Raghavan, The Canadian Journal of Chemical Engineering, 86 (2008) 219-227. https://doi.org/10.1002/cjce.20016 [23] L.V. Malysheva E.A. Paukshtis K.G. Ione Catal. Rev. 37 1995 179 226 10.1080/01614949508007095 L.V. Malysheva, E.A. Paukshtis, K.G. Ione, Catalysis reviews, 37 (1995) 179-226. https://doi.org/10.1080/01614949508007095 [24] K. Smith S. Almeer S.J. Black C. Peters J. Mater. Chem. 12 2002 3285 3289 10.1039/b204088c K. Smith, S. Almeer, S.J. Black, C. Peters, J. Mater. Chem., 12 (2002) 3285-3289. http://doi.org/10.1039/b204088c [25] X. Qi G. Cheng C. Lu D. Qian Synth. Commun. 38 2008 537 545 10.1080/00397910701796758 X. Qi, G. Cheng, C. Lu, D. Qian, Synthetic Communications, 38 (2008) 537-545. http://doi.org/10.1080/00397910701796758 [26] M. Shiri M.A. Zolfigol G. Kruger Z. Tanbakouchian Tetrahedron 66 2010 9077 9106 10.1016/j.tet.2010.09.057 M. Shiri, M.A. Zolfigol, G. Kruger, Z. Tanbakouchian,, Tetrahedron 66 (2010) 9077-9106. https://doi.org/10.1016/j.tet.2010.09.057 [27] Y. Jiao M. Zhu R. Deng J. Jian Y. Yin K. You Res. Chem. Intermed. 43 2017 3961 3974 10.1007/s11164-016-2856-5 Y. Jiao, M. Zhu, R. Deng, J. Jian, Y. Yin, K. You, Research on Chemical Intermediates, 43 (2017) 3961-3974. http://doi.org/10.1007/s11164-016-2856-5 [28] K. You R. Deng J. Jian P. Liu Q. Ai H. Luo RSC Adv. 5 2015 73083 73090 10.1039/C5RA15679C K. You, R. Deng, J. Jian, P. Liu, Q. Ai, H. Luo, RSC Advances, 5 (2015) 73083-73090. http://doi.org/10.1039/C5RA15679C [29] X. Yang C. Xi Y. Jiang Tetrahedron Lett. 46 2005 8781 8783 10.1016/j.tetlet.2005.10.028 X. Yang, C. Xi, Y. Jiang, Tetrahedron Letters, 46 (2005) 8781-8783. https://doi.org/10.1016/j.tetlet.2005.10.028 [30] V. Anuradha P.V. Srinivas P. Aparna J.M. Rao Tetrahedron Lett. 47 2006 4933 4935 10.1016/j.tetlet.2006.05.017 V. Anuradha, P.V. Srinivas, P. Aparna, J.M. Rao, Tetrahedron Letters, 47 (2006) 4933-4935. https://doi.org/10.1016/j.tetlet.2006.05.017 [31] K.C. Rajanna V. Sudhakar Chary M. Satish Kumar G. Krishnaiah P. Srinivas P. Venkanna M. Venkateswarlu K. Ramesh K. Rajendar Reddy B. Suresh Green Chem. Lett. Rev. 8 2015 50 55 10.1080/17518253.2015.1105309 K.C. Rajanna, V. Sudhakar Chary, M. Satish Kumar, G. Krishnaiah, P. Srinivas, P. Venkanna, M. Venkateswarlu, K. Ramesh, K. Rajendar Reddy, B. Suresh, Green Chemistry Letters and Reviews, 8 (2015) 50-55. http://doi.org/10.1080/17518253.2015.1105309 [32] J. Albadi F. Shirini B. Ghabezi T. Seiadatnasab Arab. J. Chem. 10 2017 S509 S513 10.1016/j.arabjc.2012.10.011 J. Albadi, F. Shirini, B. Ghabezi, T. Seiadatnasab, Arabian Journal of Chemistry, 10 (2017) S509-S513. https://doi.org/10.1016/j.arabjc.2012.10.011 [33] M.A. Zolfigol B.F. Mirjalili A. Bamoniri M.A.K. Zarchi A. Zarei L. Khazdooz J. Noei 25 2004 1414 1416 10.5012/BKCS.2004.25.9.1414 M.A. Zolfigol, B.F. Mirjalili, A. Bamoniri, M.A.K. Zarchi, A. Zarei, L. Khazdooz, J. Noei, 25 (2004) 1414-1416. http://doi.org/10.5012/BKCS.2004.25.9.1414 [34] F.-C. Guo M.-Z. Ji P. Zhang Z.-X. Guo Green Process. Synth. 2018 453 10.1515/gps-2017-0069 F.-C. Guo, M.-Z. Ji, P. Zhang, Z.-X. Guo, Facile nitration of aromatic compounds using Bi(NO3)3·5H2O/MgSO4 under mechanochemical conditions, Green Processing and Synthesis, 2018, pp. 453. https://doi.org/10.1515/gps-2017-0069 [35] O.S. Lagoviyer M. Schoenitz E.L. Dreizin J. Mater. Sci. 53 2018 13690 13700 10.1007/s10853-018-2406-1 O.S. Lagoviyer, M. Schoenitz, E.L. Dreizin, Journal of Materials Science, 53 (2018) 13690-13700. http://doi.org/10.1007/s10853-018-2406-1 [36] O.S. Lagoviyer L. Krishtopa M. Schoenitz N.J. Trivedi E.L. Dreizin J. Energ. Mater. 36 2017 191 201 10.1080/07370652.2017.1343407 O.S. Lagoviyer, L. Krishtopa, M. Schoenitz, N.J. Trivedi, E.L. Dreizin, Journal of Energetic Materials, 36 (2017) 191-201. http://doi.org/10.1080/07370652.2017.1343407 [37] G. Busca J. Chem. Soc. Faraday Trans. 1 1999 723 736 10.1039/A808366E G. Busca, Physical Chemistry Chemical Physics, 1 (1999) 723-736. http://doi.org/10.1039/A808366E [38] N.C. Jeong J.S. Lee E.L. Tae Y.J. Lee K.B. Yoon Angew. Chem. Int. Ed. 47 2008 10128 10132 10.1002/anie.200803837 N.C. Jeong, J.S. Lee, E.L. Tae, Y.J. Lee, K.B. Yoon, Angewandte Chemie International Edition, 47 (2008) 10128-10132. https://doi.org/10.1002/anie.200803837 [39] F. Corà M. Alfredsson G. Mallia D.S. Middlemiss W.C. Mackrodt R. Dovesi R. Orlando Principles and Applications of Density Functional Theory in Inorganic Chemistry II 2004 Springer Berlin Heidelberg, Berlin, Heidelberg 171 232 F. Corà, M. Alfredsson, G. Mallia, D.S. Middlemiss, W.C. Mackrodt, R. Dovesi, R. Orlando, Principles and Applications of Density Functional Theory in Inorganic Chemistry II, Springer Berlin Heidelberg, Berlin, Heidelberg, 2004, pp. 171-232. [40] T. Reeswinkel D. Music J.M. Schneider J. Phys. Condens. Matter 21 2009 145404 10.1088/0953-8984/21/14/145404 T. Reeswinkel, D. Music, J.M. Schneider, Journal of Physics: Condensed Matter, 21 (2009) 145404. http://doi.org/10.1088/0953-8984/21/14/145404 [41] A. Brückner U. Bentrup A. Martin J. Radnik L. Wilde G.U. Wolf A. Corma F.V. Melo S. Mendioroz J.L.G. Fierro Studies in Surface Science and Catalysis 2000 Elsevier 359 364 A. Brückner, U. Bentrup, A. Martin, J. Radnik, L. Wilde, G.U. Wolf, in: A. Corma, F.V. Melo, S. Mendioroz, J.L.G. Fierro (Eds.) Studies in Surface Science and Catalysis, Elsevier 2000, pp. 359-364. [42] A. Brückner Catal. Rev. 45 2003 97 150 10.1081/CR-120015739 A. Brückner, Catalysis Reviews, 45 (2003) 97-150. https://doi.org/10.1081/CR-120015739",
      "scopus-id": "85085547893",
      "coredata": {
        "eid": "1-s2.0-S0926860X20301976",
        "dc:description": "Results of an experimental study of the mechanochemical nitration of toluene are presented. The focus is on the effect of acidity of metal oxide catalysts on the yield of mononitrotoluene. No solvents were used during the reaction. Sodium nitrate served as a source of nitronium. Gas chromatography-mass spectrometry of the products showed that the nitration rate scaled with the catalyst’s acidity and specific surface area. Homogenizing NaNO3 with the catalyst by additional milling prior to reaction with toluene led to a rapid, nearly complete nitration. Distribution of nitrate over the surface of catalyst is likely rate limiting when toluene is mechanochemically nitrated without the preliminary milling step. The observed for varied reactant ratios trends in yield and isomer ratios suggest that nitronium participates in the nitration while localized on the active sites of the catalyst. Excess of toluene blocks acid sites, inhibiting the formation of nitronium and impeding the nitration.",
        "openArchiveArticle": "false",
        "prism:coverDate": "2020-07-05",
        "openaccessUserLicense": null,
        "prism:aggregationType": "Journal",
        "prism:url": "https://api.elsevier.com/content/article/pii/S0926860X20301976",
        "dc:creator": [
          {
            "@_fa": "true",
            "$": "Vasudevan, Ashvin Kumar"
          },
          {
            "@_fa": "true",
            "$": "Schoenitz, Mirko"
          },
          {
            "@_fa": "true",
            "$": "Dreizin, Edward L."
          }
        ],
        "link": [
          {
            "@_fa": "true",
            "@rel": "self",
            "@href": "https://api.elsevier.com/content/article/pii/S0926860X20301976"
          },
          {
            "@_fa": "true",
            "@rel": "scidir",
            "@href": "https://www.sciencedirect.com/science/article/pii/S0926860X20301976"
          }
        ],
        "dc:format": "application/json",
        "openaccessType": null,
        "pii": "S0926-860X(20)30197-6",
        "prism:volume": "601",
        "articleNumber": "117604",
        "prism:publisher": "Elsevier B.V.",
        "dc:title": "Mechanochemical nitration of toluene with metal oxide catalysts",
        "prism:copyright": "© 2020 Elsevier B.V. All rights reserved.",
        "openaccess": "0",
        "prism:issn": "0926860X",
        "dcterms:subject": [
          {
            "@_fa": "true",
            "$": "Heterogeneous reactions"
          },
          {
            "@_fa": "true",
            "$": "High-energy ball milling"
          },
          {
            "@_fa": "true",
            "$": "Energetic materials"
          },
          {
            "@_fa": "true",
            "$": "Acidity"
          }
        ],
        "openaccessArticle": "false",
        "prism:publicationName": "Applied Catalysis A: General",
        "openaccessSponsorType": null,
        "prism:pageRange": "117604",
        "pubType": "fla",
        "prism:coverDisplayDate": "5 July 2020",
        "prism:doi": "10.1016/j.apcata.2020.117604",
        "prism:startingPage": "117604",
        "dc:identifier": "doi:10.1016/j.apcata.2020.117604",
        "openaccessSponsorName": null
      },
      "objects": {
        "object": [
          {
            "@category": "standard",
            "@height": "276",
            "@width": "378",
            "@_fa": "true",
            "$": "https://api.elsevier.com/content/object/eid/1-s2.0-S0926860X20301976-gr7.jpg?httpAccept=%2A%2F%2A",
            "@multimediatype": "JPEG image file",
            "@type": "IMAGE-DOWNSAMPLED",
            "@size": "21020",
            "@ref": "gr7",
            "@mimetype": "image/jpeg"
          },
          {
            "@category": "standard",
            "@height": "389",
            "@width": "363",
            "@_fa": "true",
            "$": "https://api.elsevier.com/content/object/eid/1-s2.0-S0926860X20301976-gr8.jpg?httpAccept=%2A%2F%2A",
            "@multimediatype": "JPEG image file",
            "@type": "IMAGE-DOWNSAMPLED",
            "@size": "28691",
            "@ref": "gr8",
            "@mimetype": "image/jpeg"
          },
          {
            "@category": "standard",
            "@height": "319",
            "@width": "376",
            "@_fa": "true",
            "$": "https://api.elsevier.com/content/object/eid/1-s2.0-S0926860X20301976-gr5.jpg?httpAccept=%2A%2F%2A",
            "@multimediatype": "JPEG image file",
            "@type": "IMAGE-DOWNSAMPLED",
            "@size": "20101",
            "@ref": "gr5",
            "@mimetype": "image/jpeg"
          },
          {
            "@category": "standard",
            "@height": "244",
            "@width": "376",
            "@_fa": "true",
            "$": "https://api.elsevier.com/content/object/eid/1-s2.0-S0926860X20301976-gr6.jpg?httpAccept=%2A%2F%2A",
            "@multimediatype": "JPEG image file",
            "@type": "IMAGE-DOWNSAMPLED",
            "@size": "20565",
            "@ref": "gr6",
            "@mimetype": "image/jpeg"
          },
          {
            "@category": "standard",
            "@height": "216",
            "@width": "376",
            "@_fa": "true",
            "$": "https://api.elsevier.com/content/object/eid/1-s2.0-S0926860X20301976-gr3.jpg?httpAccept=%2A%2F%2A",
            "@multimediatype": "JPEG image file",
            "@type": "IMAGE-DOWNSAMPLED",
            "@size": "16007",
            "@ref": "gr3",
            "@mimetype": "image/jpeg"
          },
          {
            "@category": "standard",
            "@height": "289",
            "@width": "378",
            "@_fa": "true",
            "$": "https://api.elsevier.com/content/object/eid/1-s2.0-S0926860X20301976-gr4.jpg?httpAccept=%2A%2F%2A",
            "@multimediatype": "JPEG image file",
            "@type": "IMAGE-DOWNSAMPLED",
            "@size": "20988",
            "@ref": "gr4",
            "@mimetype": "image/jpeg"
          },
          {
            "@category": "standard",
            "@height": "189",
            "@width": "376",
            "@_fa": "true",
            "$": "https://api.elsevier.com/content/object/eid/1-s2.0-S0926860X20301976-gr1.jpg?httpAccept=%2A%2F%2A",
            "@multimediatype": "JPEG image file",
            "@type": "IMAGE-DOWNSAMPLED",
            "@size": "15595",
            "@ref": "gr1",
            "@mimetype": "image/jpeg"
          },
          {
            "@category": "standard",
            "@height": "265",
            "@width": "376",
            "@_fa": "true",
            "$": "https://api.elsevier.com/content/object/eid/1-s2.0-S0926860X20301976-gr2.jpg?httpAccept=%2A%2F%2A",
            "@multimediatype": "JPEG image file",
            "@type": "IMAGE-DOWNSAMPLED",
            "@size": "35672",
            "@ref": "gr2",
            "@mimetype": "image/jpeg"
          },
          {
            "@category": "standard",
            "@height": "200",
            "@width": "370",
            "@_fa": "true",
            "$": "https://api.elsevier.com/content/object/eid/1-s2.0-S0926860X20301976-ga1.jpg?httpAccept=%2A%2F%2A",
            "@multimediatype": "JPEG image file",
            "@type": "IMAGE-DOWNSAMPLED",
            "@size": "16205",
            "@ref": "ga1",
            "@mimetype": "image/jpeg"
          },
          {
            "@category": "thumbnail",
            "@height": "160",
            "@width": "219",
            "@_fa": "true",
            "$": "https://api.elsevier.com/content/object/eid/1-s2.0-S0926860X20301976-gr7.sml?httpAccept=%2A%2F%2A",
            "@multimediatype": "GIF image file",
            "@type": "IMAGE-THUMBNAIL",
            "@size": "7014",
            "@ref": "gr7",
            "@mimetype": "image/gif"
          },
          {
            "@category": "thumbnail",
            "@height": "164",
            "@width": "153",
            "@_fa": "true",
            "$": "https://api.elsevier.com/content/object/eid/1-s2.0-S0926860X20301976-gr8.sml?httpAccept=%2A%2F%2A",
            "@multimediatype": "GIF image file",
            "@type": "IMAGE-THUMBNAIL",
            "@size": "5000",
            "@ref": "gr8",
            "@mimetype": "image/gif"
          },
          {
            "@category": "thumbnail",
            "@height": "164",
            "@width": "193",
            "@_fa": "true",
            "$": "https://api.elsevier.com/content/object/eid/1-s2.0-S0926860X20301976-gr5.sml?httpAccept=%2A%2F%2A",
            "@multimediatype": "GIF image file",
            "@type": "IMAGE-THUMBNAIL",
            "@size": "4623",
            "@ref": "gr5",
            "@mimetype": "image/gif"
          },
          {
            "@category": "thumbnail",
            "@height": "142",
            "@width": "219",
            "@_fa": "true",
            "$": "https://api.elsevier.com/content/object/eid/1-s2.0-S0926860X20301976-gr6.sml?httpAccept=%2A%2F%2A",
            "@multimediatype": "GIF image file",
            "@type": "IMAGE-THUMBNAIL",
            "@size": "6429",
            "@ref": "gr6",
            "@mimetype": "image/gif"
          },
          {
            "@category": "thumbnail",
            "@height": "126",
            "@width": "219",
            "@_fa": "true",
            "$": "https://api.elsevier.com/content/object/eid/1-s2.0-S0926860X20301976-gr3.sml?httpAccept=%2A%2F%2A",
            "@multimediatype": "GIF image file",
            "@type": "IMAGE-THUMBNAIL",
            "@size": "5302",
            "@ref": "gr3",
            "@mimetype": "image/gif"
          },
          {
            "@category": "thumbnail",
            "@height": "164",
            "@width": "214",
            "@_fa": "true",
            "$": "https://api.elsevier.com/content/object/eid/1-s2.0-S0926860X20301976-gr4.sml?httpAccept=%2A%2F%2A",
            "@multimediatype": "GIF image file",
            "@type": "IMAGE-THUMBNAIL",
            "@size": "6529",
            "@ref": "gr4",
            "@mimetype": "image/gif"
          },
          {
            "@category": "thumbnail",
            "@height": "110",
            "@width": "219",
            "@_fa": "true",
            "$": "https://api.elsevier.com/content/object/eid/1-s2.0-S0926860X20301976-gr1.sml?httpAccept=%2A%2F%2A",
            "@multimediatype": "GIF image file",
            "@type": "IMAGE-THUMBNAIL",
            "@size": "5187",
            "@ref": "gr1",
            "@mimetype": "image/gif"
          },
          {
            "@category": "thumbnail",
            "@height": "154",
            "@width": "219",
            "@_fa": "true",
            "$": "https://api.elsevier.com/content/object/eid/1-s2.0-S0926860X20301976-gr2.sml?httpAccept=%2A%2F%2A",
            "@multimediatype": "GIF image file",
            "@type": "IMAGE-THUMBNAIL",
            "@size": "13189",
            "@ref": "gr2",
            "@mimetype": "image/gif"
          },
          {
            "@category": "thumbnail",
            "@height": "118",
            "@width": "219",
            "@_fa": "true",
            "$": "https://api.elsevier.com/content/object/eid/1-s2.0-S0926860X20301976-ga1.sml?httpAccept=%2A%2F%2A",
            "@multimediatype": "GIF image file",
            "@type": "IMAGE-THUMBNAIL",
            "@size": "7742",
            "@ref": "ga1",
            "@mimetype": "image/gif"
          },
          {
            "@category": "high",
            "@height": "1223",
            "@width": "1675",
            "@_fa": "true",
            "$": "https://api.elsevier.com/content/object/eid/1-s2.0-S0926860X20301976-gr7_lrg.jpg?httpAccept=%2A%2F%2A",
            "@multimediatype": "JPEG image file",
            "@type": "IMAGE-HIGH-RES",
            "@size": "163073",
            "@ref": "gr7",
            "@mimetype": "image/jpeg"
          },
          {
            "@category": "high",
            "@height": "1722",
            "@width": "1607",
            "@_fa": "true",
            "$": "https://api.elsevier.com/content/object/eid/1-s2.0-S0926860X20301976-gr8_lrg.jpg?httpAccept=%2A%2F%2A",
            "@multimediatype": "JPEG image file",
            "@type": "IMAGE-HIGH-RES",
            "@size": "205887",
            "@ref": "gr8",
            "@mimetype": "image/jpeg"
          },
          {
            "@category": "high",
            "@height": "1416",
            "@width": "1667",
            "@_fa": "true",
            "$": "https://api.elsevier.com/content/object/eid/1-s2.0-S0926860X20301976-gr5_lrg.jpg?httpAccept=%2A%2F%2A",
            "@multimediatype": "JPEG image file",
            "@type": "IMAGE-HIGH-RES",
            "@size": "145515",
            "@ref": "gr5",
            "@mimetype": "image/jpeg"
          },
          {
            "@category": "high",
            "@height": "1081",
            "@width": "1667",
            "@_fa": "true",
            "$": "https://api.elsevier.com/content/object/eid/1-s2.0-S0926860X20301976-gr6_lrg.jpg?httpAccept=%2A%2F%2A",
            "@multimediatype": "JPEG image file",
            "@type": "IMAGE-HIGH-RES",
            "@size": "154601",
            "@ref": "gr6",
            "@mimetype": "image/jpeg"
          },
          {
            "@category": "high",
            "@height": "959",
            "@width": "1667",
            "@_fa": "true",
            "$": "https://api.elsevier.com/content/object/eid/1-s2.0-S0926860X20301976-gr3_lrg.jpg?httpAccept=%2A%2F%2A",
            "@multimediatype": "JPEG image file",
            "@type": "IMAGE-HIGH-RES",
            "@size": "123198",
            "@ref": "gr3",
            "@mimetype": "image/jpeg"
          },
          {
            "@category": "high",
            "@height": "1281",
            "@width": "1675",
            "@_fa": "true",
            "$": "https://api.elsevier.com/content/object/eid/1-s2.0-S0926860X20301976-gr4_lrg.jpg?httpAccept=%2A%2F%2A",
            "@multimediatype": "JPEG image file",
            "@type": "IMAGE-HIGH-RES",
            "@size": "172268",
            "@ref": "gr4",
            "@mimetype": "image/jpeg"
          },
          {
            "@category": "high",
            "@height": "840",
            "@width": "1667",
            "@_fa": "true",
            "$": "https://api.elsevier.com/content/object/eid/1-s2.0-S0926860X20301976-gr1_lrg.jpg?httpAccept=%2A%2F%2A",
            "@multimediatype": "JPEG image file",
            "@type": "IMAGE-HIGH-RES",
            "@size": "125396",
            "@ref": "gr1",
            "@mimetype": "image/jpeg"
          },
          {
            "@category": "high",
            "@height": "1173",
            "@width": "1667",
            "@_fa": "true",
            "$": "https://api.elsevier.com/content/object/eid/1-s2.0-S0926860X20301976-gr2_lrg.jpg?httpAccept=%2A%2F%2A",
            "@multimediatype": "JPEG image file",
            "@type": "IMAGE-HIGH-RES",
            "@size": "309298",
            "@ref": "gr2",
            "@mimetype": "image/jpeg"
          },
          {
            "@category": "high",
            "@height": "886",
            "@width": "1638",
            "@_fa": "true",
            "$": "https://api.elsevier.com/content/object/eid/1-s2.0-S0926860X20301976-ga1_lrg.jpg?httpAccept=%2A%2F%2A",
            "@multimediatype": "JPEG image file",
            "@type": "IMAGE-HIGH-RES",
            "@size": "119926",
            "@ref": "ga1",
            "@mimetype": "image/jpeg"
          },
          {
            "@category": "standard",
            "@_fa": "true",
            "$": "https://api.elsevier.com/content/object/eid/1-s2.0-S0926860X20301976-mmc2.pdf?httpAccept=%2A%2F%2A",
            "@multimediatype": "Acrobat PDF file",
            "@type": "APPLICATION",
            "@size": "543436",
            "@ref": "mmc2",
            "@mimetype": "application/pdf"
          },
          {
            "@category": "standard",
            "@_fa": "true",
            "$": "https://api.elsevier.com/content/object/eid/1-s2.0-S0926860X20301976-mmc1.zip?httpAccept=%2A%2F%2A",
            "@multimediatype": "ZIP file",
            "@type": "APPLICATION",
            "@size": "349",
            "@ref": "mmc1",
            "@mimetype": "application/zip"
          },
          {
            "@category": "standard",
            "@_fa": "true",
            "$": "https://api.elsevier.com/content/object/eid/1-s2.0-S0926860X20301976-am.pdf?httpAccept=%2A%2F%2A",
            "@multimediatype": "Acrobat PDF file",
            "@type": "AAM-PDF",
            "@size": "376190",
            "@ref": "am",
            "@mimetype": "application/pdf"
          }
        ]
      },
      "link": {
        "@rel": "abstract",
        "@href": "https://api.elsevier.com/content/abstract/scopus_id/85085547893"
      }
    }
  }
}