{
  "metadata": {
    "title": "Selective catalytic reduction of NO<ce:inf loc=post>x</ce:inf> with NH<ce:inf loc=post>3</ce:inf> over a novel MOF- derived MnO<ce:inf loc=post>x</ce:inf> catalyst",
    "authors": "; ; ",
    "journal": "Applied Catalysis A: General",
    "date": "2022-08-05",
    "doi": "10.1016/j.apcata.2022.118754",
    "abstract": "",
    "uri": "https://api.elsevier.com/content/article/pii/S0926860X22002770",
    "pii": "S0926860X22002770"
  },
  "fulltext": {
    "full-text-retrieval-response": {
      "scopus-eid": "2-s2.0-85133431942",
      "originalText": "serial JL 271346 291210 291744 291809 31 Applied Catalysis A: General APPLIEDCATALYSISAGENERAL 2022-06-30 2022-06-30 2022-07-04 2022-07-04 2022-10-16T00:55:09 1-s2.0-S0926860X22002770 S0926-860X(22)00277-0 S0926860X22002770 10.1016/j.apcata.2022.118754 S300 S300.1 FULL-TEXT 1-s2.0-S0926860X22X00148 2024-01-01T12:34:28.416125Z 0 0 20220805 2022 2022-06-30T02:18:20.76334Z absattachment articleinfo articlenumber articletitlenorm authfirstinitialnorm authfirstsurnamenorm cid cids contenttype copyright crossmark dateloaded dateloadedtxt datesearch datesort dateupdated dco docsubtype doctype doi eid ewtransactionid hubeid indexeddate issn issnnorm itemstage itemtransactionid itemweight openaccess openarchive pg pgfirst pii piinorm pubdatestart pubdatetxt pubyr sortorder srctitle srctitlenorm srctype ssids alllist content subj subheadings suppl tomb volfirst volissue volumelist webpdf webpdfpagecount yearnav figure e-component body mmlmath acknowledge affil appendices articletitle auth authfirstini authfull authkeywords authlast grantnumber grantsponsor grantsponsorid highlightsabst primabst ref specialabst 0926-860X 0926860X true 643 643 C Volume 643 22 118754 118754 118754 20220805 5 August 2022 2022-08-05 2022 article fla © 2022 Elsevier B.V. All rights reserved. SELECTIVECATALYTICREDUCTIONNOXNH3OVERANOVELMOFDERIVEDMNOXCATALYST CHEN R 1 Introduction 2 Experimental 2.1 Catalyst preparation 2.2 Catalytic performance test 2.3 Catalyst characterization 3 Results and discussion 3.1 NH3-SCR performance 3.2 Catalyst characterization 3.2.1 XRD analysis 3.2.2 SEM analysis 3.2.3 N2 adsorption 3.2.4 XPS analysis 3.2.5 H2-TPR analysis 3.2.6 NH3-TPD analysis 3.3 In situ DRIFTs studies 3.3.1 Adsorption of pyridine 3.3.2 Adsorption and reactivity of NH3 species 3.3.3 Adsorption and reactivity of NOx species 3.3.4 In situ DRIFTs analyses of SO2 resistance 4 Conclusions CRediT authorship contribution statement Acknowledgments Appendix A Supplementary material References LIU 2006 43 89 Z XIE 2020 48476 48485 S CHEN 2021 127071 J HAN 2019 10916 10976 L BUSCA 1998 1 36 G QI 2003 434 441 G LIU 2020 118731 Z HAN 2019 5946 5956 L LIU 2016 255 262 Z GU 2013 30 38 T ZHANG 2021 119542 Z LIU 2016 54 69 C WANG 2019 117983 R PENA 2004 421 431 D MENG 2018 652 663 D CUI 2020 119262 W JIANG 2020 8086 H LIU 2012 6182 6189 C FENG 2020 16381 16388 J YAO 2020 2357 2366 H CHEN 2020 125424 B JIANG 2016 17 19 H YAN 2017 2581 2593 L ZHANG 2014 1753 1763 L FAN 2020 125572 Z GAO 2019 55 67 C BITAR 2017 012045 Z CHEN 2018 64 70 G LI 2018 924 932 C LIU 2009 194 204 F SHI 2018 1 11 J WANG 2016 512 521 P GAO 2018 102 112 C SHAN 2012 100 106 W PENG 2013 483 492 Y FU 2021 131334 Z KAPTEIJN 1994 173 189 F FANG 2015 23 30 D FOO 2015 174 179 R CHEN 2010 9590 9596 L LIU 2018 289 301 J LIU 2016 1044 1050 Z SHU 2012 25319 25327 Y LIU 2016 6688 6696 Z HUANG 2021 129572 X HU 2015 22924 22933 H GAO 2019 411 424 F YU 2020 123011 C GUAN 2021 324 J LIU 2018 385 393 J JIANG 2014 14866 14875 B GAO 2017 20 31 F YE 2016 846 854 D CHENX2022X118754 CHENX2022X118754XR 2023-06-30T00:00:00.000Z http://www.elsevier.com/open-access/userlicense/1.0/ https://vtw.elsevier.com/content/oragreement/10137 CHU_NIST publishAcceptedManuscriptIndexable 2023-06-30T00:00:00.000Z http://creativecommons.org/licenses/by-nc-nd/4.0/ © 2022 Elsevier B.V. All rights reserved. 2022-07-09T02:51:15.219Z http://vtw.elsevier.com/data/voc/AddOnTypes/50.7/aggregated-refined 0 https://doi.org/10.15223/policy-017 https://doi.org/10.15223/policy-037 https://doi.org/10.15223/policy-012 https://doi.org/10.15223/policy-029 https://doi.org/10.15223/policy-004 item S0926-860X(22)00277-0 S0926860X22002770 1-s2.0-S0926860X22002770 10.1016/j.apcata.2022.118754 271346 2024-01-01T12:34:28.416125Z 2022-08-05 1-s2.0-S0926860X22002770-main.pdf https://s3-eu-west-1.amazonaws.com/prod-ucs-content-store-eu-west/content/pii:S0926860X22002770/MAIN/application/pdf/87bc425d7066987eeab3127cdadb9ec9/main.pdf main.pdf pdf true 5018540 MAIN 9 1-s2.0-S0926860X22002770-main_1.png https://s3-eu-west-1.amazonaws.com/prod-ucs-content-store-eu-west/content/pii:S0926860X22002770/PREVIEW/image/png/c2515f1f1f52a3a2542b3ea6016b0092/main_1.png main_1.png png 59202 849 656 IMAGE-WEB-PDF 1 1-s2.0-S0926860X22002770-gr9.jpg https://s3-eu-west-1.amazonaws.com/prod-ucs-content-store-eu-west/content/pii:S0926860X22002770/gr9/DOWNSAMPLED/image/jpeg/f403a42be0e2984a4eb7c02aebdd325b/gr9.jpg gr9 gr9.jpg jpg 27083 537 339 IMAGE-DOWNSAMPLED 1-s2.0-S0926860X22002770-gr3.jpg https://s3-eu-west-1.amazonaws.com/prod-ucs-content-store-eu-west/content/pii:S0926860X22002770/gr3/DOWNSAMPLED/image/jpeg/d6168d412532c093c9a3d8d18e52b85d/gr3.jpg gr3 gr3.jpg jpg 21481 252 339 IMAGE-DOWNSAMPLED 1-s2.0-S0926860X22002770-gr4.jpg https://s3-eu-west-1.amazonaws.com/prod-ucs-content-store-eu-west/content/pii:S0926860X22002770/gr4/DOWNSAMPLED/image/jpeg/e19850774ed961fd5b9d75ed70e6f801/gr4.jpg gr4 gr4.jpg jpg 30044 271 339 IMAGE-DOWNSAMPLED 1-s2.0-S0926860X22002770-gr1.jpg https://s3-eu-west-1.amazonaws.com/prod-ucs-content-store-eu-west/content/pii:S0926860X22002770/gr1/DOWNSAMPLED/image/jpeg/ecb71040212826700c7401889e45ee9e/gr1.jpg gr1 gr1.jpg jpg 21796 263 339 IMAGE-DOWNSAMPLED 1-s2.0-S0926860X22002770-gr2.jpg https://s3-eu-west-1.amazonaws.com/prod-ucs-content-store-eu-west/content/pii:S0926860X22002770/gr2/DOWNSAMPLED/image/jpeg/c2204dd2ef55fdc2dca9c2b897f2ed01/gr2.jpg gr2 gr2.jpg jpg 19477 252 339 IMAGE-DOWNSAMPLED 1-s2.0-S0926860X22002770-gr7.jpg https://s3-eu-west-1.amazonaws.com/prod-ucs-content-store-eu-west/content/pii:S0926860X22002770/gr7/DOWNSAMPLED/image/jpeg/27ccb54956fd32e2a4362b98ebb38b4c/gr7.jpg gr7 gr7.jpg jpg 12417 247 339 IMAGE-DOWNSAMPLED 1-s2.0-S0926860X22002770-gr8.jpg https://s3-eu-west-1.amazonaws.com/prod-ucs-content-store-eu-west/content/pii:S0926860X22002770/gr8/DOWNSAMPLED/image/jpeg/84d7cc8a8c039ebabf6cbddba7debf85/gr8.jpg gr8 gr8.jpg jpg 16549 241 282 IMAGE-DOWNSAMPLED 1-s2.0-S0926860X22002770-gr5.jpg https://s3-eu-west-1.amazonaws.com/prod-ucs-content-store-eu-west/content/pii:S0926860X22002770/gr5/DOWNSAMPLED/image/jpeg/f5b055e5d5367ce495f90205f622f89d/gr5.jpg gr5 gr5.jpg jpg 153743 806 659 IMAGE-DOWNSAMPLED 1-s2.0-S0926860X22002770-gr6.jpg https://s3-eu-west-1.amazonaws.com/prod-ucs-content-store-eu-west/content/pii:S0926860X22002770/gr6/DOWNSAMPLED/image/jpeg/1c0b3f15960c091d98da19f6ced6bd9d/gr6.jpg gr6 gr6.jpg jpg 49594 547 339 IMAGE-DOWNSAMPLED 1-s2.0-S0926860X22002770-sc1.jpg https://s3-eu-west-1.amazonaws.com/prod-ucs-content-store-eu-west/content/pii:S0926860X22002770/sc1/DOWNSAMPLED/image/jpeg/ac1691a0953df81bc56e55c4bacd8fd7/sc1.jpg sc1 sc1.jpg jpg 17375 215 508 IMAGE-DOWNSAMPLED 1-s2.0-S0926860X22002770-gr14.jpg https://s3-eu-west-1.amazonaws.com/prod-ucs-content-store-eu-west/content/pii:S0926860X22002770/gr14/DOWNSAMPLED/image/jpeg/eb8936c3b41dd15462bdbdc595070fc5/gr14.jpg gr14 gr14.jpg jpg 25149 267 339 IMAGE-DOWNSAMPLED 1-s2.0-S0926860X22002770-gr15.jpg https://s3-eu-west-1.amazonaws.com/prod-ucs-content-store-eu-west/content/pii:S0926860X22002770/gr15/DOWNSAMPLED/image/jpeg/1863df3d3b87fefd62cbf8a980d4d94f/gr15.jpg gr15 gr15.jpg jpg 50114 328 376 IMAGE-DOWNSAMPLED 1-s2.0-S0926860X22002770-gr12.jpg https://s3-eu-west-1.amazonaws.com/prod-ucs-content-store-eu-west/content/pii:S0926860X22002770/gr12/DOWNSAMPLED/image/jpeg/a61b0ca75a18979cc9e7ad774f4f7414/gr12.jpg gr12 gr12.jpg jpg 21106 274 339 IMAGE-DOWNSAMPLED 1-s2.0-S0926860X22002770-gr13.jpg https://s3-eu-west-1.amazonaws.com/prod-ucs-content-store-eu-west/content/pii:S0926860X22002770/gr13/DOWNSAMPLED/image/jpeg/7ea8e2f7ae433cf5f8c1e3ed11a253a7/gr13.jpg gr13 gr13.jpg jpg 29482 405 376 IMAGE-DOWNSAMPLED 1-s2.0-S0926860X22002770-gr10.jpg https://s3-eu-west-1.amazonaws.com/prod-ucs-content-store-eu-west/content/pii:S0926860X22002770/gr10/DOWNSAMPLED/image/jpeg/98ced561eecfd2c26438ea08678df123/gr10.jpg gr10 gr10.jpg jpg 15500 265 339 IMAGE-DOWNSAMPLED 1-s2.0-S0926860X22002770-gr11.jpg https://s3-eu-west-1.amazonaws.com/prod-ucs-content-store-eu-west/content/pii:S0926860X22002770/gr11/DOWNSAMPLED/image/jpeg/d2d95350d06f9817a4edf347226ee16b/gr11.jpg gr11 gr11.jpg jpg 20928 274 339 IMAGE-DOWNSAMPLED 1-s2.0-S0926860X22002770-ga1.jpg https://s3-eu-west-1.amazonaws.com/prod-ucs-content-store-eu-west/content/pii:S0926860X22002770/ga1/DOWNSAMPLED/image/jpeg/9d6ce41a0cd5bb4094ebda003ed0ffa8/ga1.jpg ga1 true ga1.jpg jpg 31637 245 280 IMAGE-DOWNSAMPLED 1-s2.0-S0926860X22002770-gr9.sml https://s3-eu-west-1.amazonaws.com/prod-ucs-content-store-eu-west/content/pii:S0926860X22002770/gr9/THUMBNAIL/image/gif/597ed8e30941ddc325c671b07f636ce8/gr9.sml gr9 gr9.sml sml 3062 163 103 IMAGE-THUMBNAIL 1-s2.0-S0926860X22002770-gr3.sml https://s3-eu-west-1.amazonaws.com/prod-ucs-content-store-eu-west/content/pii:S0926860X22002770/gr3/THUMBNAIL/image/gif/cdccdbb33c446f1555828b5e860ee1a0/gr3.sml gr3 gr3.sml sml 7756 163 219 IMAGE-THUMBNAIL 1-s2.0-S0926860X22002770-gr4.sml https://s3-eu-west-1.amazonaws.com/prod-ucs-content-store-eu-west/content/pii:S0926860X22002770/gr4/THUMBNAIL/image/gif/59a21e287473d70c6f50b166ab28f120/gr4.sml gr4 gr4.sml sml 10064 164 205 IMAGE-THUMBNAIL 1-s2.0-S0926860X22002770-gr1.sml https://s3-eu-west-1.amazonaws.com/prod-ucs-content-store-eu-west/content/pii:S0926860X22002770/gr1/THUMBNAIL/image/gif/3b32222f620496a19e7d62c3ed739800/gr1.sml gr1 gr1.sml sml 9193 164 211 IMAGE-THUMBNAIL 1-s2.0-S0926860X22002770-gr2.sml https://s3-eu-west-1.amazonaws.com/prod-ucs-content-store-eu-west/content/pii:S0926860X22002770/gr2/THUMBNAIL/image/gif/9fe19dea453f6d141371f68f15c31656/gr2.sml gr2 gr2.sml sml 6760 163 219 IMAGE-THUMBNAIL 1-s2.0-S0926860X22002770-gr7.sml https://s3-eu-west-1.amazonaws.com/prod-ucs-content-store-eu-west/content/pii:S0926860X22002770/gr7/THUMBNAIL/image/gif/7b3453be4d023b1418994e25374b9a9d/gr7.sml gr7 gr7.sml sml 4298 159 219 IMAGE-THUMBNAIL 1-s2.0-S0926860X22002770-gr8.sml https://s3-eu-west-1.amazonaws.com/prod-ucs-content-store-eu-west/content/pii:S0926860X22002770/gr8/THUMBNAIL/image/gif/dd925295349af61ab8183a8e33861b29/gr8.sml gr8 gr8.sml sml 6748 164 192 IMAGE-THUMBNAIL 1-s2.0-S0926860X22002770-gr5.sml https://s3-eu-west-1.amazonaws.com/prod-ucs-content-store-eu-west/content/pii:S0926860X22002770/gr5/THUMBNAIL/image/gif/354a08ca0531b24338b606db8d537ae8/gr5.sml gr5 gr5.sml sml 14918 164 134 IMAGE-THUMBNAIL 1-s2.0-S0926860X22002770-gr6.sml https://s3-eu-west-1.amazonaws.com/prod-ucs-content-store-eu-west/content/pii:S0926860X22002770/gr6/THUMBNAIL/image/gif/6a88cbba960cdd14a890fff5b17b67ef/gr6.sml gr6 gr6.sml sml 6069 163 101 IMAGE-THUMBNAIL 1-s2.0-S0926860X22002770-sc1.sml https://s3-eu-west-1.amazonaws.com/prod-ucs-content-store-eu-west/content/pii:S0926860X22002770/sc1/THUMBNAIL/image/gif/d9b47acefa233899c5834cd5663cd35e/sc1.sml sc1 sc1.sml sml 6637 93 219 IMAGE-THUMBNAIL 1-s2.0-S0926860X22002770-gr14.sml https://s3-eu-west-1.amazonaws.com/prod-ucs-content-store-eu-west/content/pii:S0926860X22002770/gr14/THUMBNAIL/image/gif/b4cce1e0bd022511b5d189bb9600aceb/gr14.sml gr14 gr14.sml sml 8456 164 208 IMAGE-THUMBNAIL 1-s2.0-S0926860X22002770-gr15.sml https://s3-eu-west-1.amazonaws.com/prod-ucs-content-store-eu-west/content/pii:S0926860X22002770/gr15/THUMBNAIL/image/gif/d60563a4075de7ce0d2393955ed2aa3b/gr15.sml gr15 gr15.sml sml 17028 164 188 IMAGE-THUMBNAIL 1-s2.0-S0926860X22002770-gr12.sml https://s3-eu-west-1.amazonaws.com/prod-ucs-content-store-eu-west/content/pii:S0926860X22002770/gr12/THUMBNAIL/image/gif/ad299adaec2dfa8b525320385b9ef79f/gr12.sml gr12 gr12.sml sml 7255 164 203 IMAGE-THUMBNAIL 1-s2.0-S0926860X22002770-gr13.sml https://s3-eu-west-1.amazonaws.com/prod-ucs-content-store-eu-west/content/pii:S0926860X22002770/gr13/THUMBNAIL/image/gif/6cbf0344f1ad40b2c0a417c290834300/gr13.sml gr13 gr13.sml sml 10137 164 152 IMAGE-THUMBNAIL 1-s2.0-S0926860X22002770-gr10.sml https://s3-eu-west-1.amazonaws.com/prod-ucs-content-store-eu-west/content/pii:S0926860X22002770/gr10/THUMBNAIL/image/gif/357ace2cfe3feb7db7880311cd2f07a5/gr10.sml gr10 gr10.sml sml 5154 163 209 IMAGE-THUMBNAIL 1-s2.0-S0926860X22002770-gr11.sml https://s3-eu-west-1.amazonaws.com/prod-ucs-content-store-eu-west/content/pii:S0926860X22002770/gr11/THUMBNAIL/image/gif/fb2173d1aaebb76ebc4f2afd4c2a36c9/gr11.sml gr11 gr11.sml sml 6801 164 202 IMAGE-THUMBNAIL 1-s2.0-S0926860X22002770-ga1.sml https://s3-eu-west-1.amazonaws.com/prod-ucs-content-store-eu-west/content/pii:S0926860X22002770/ga1/THUMBNAIL/image/gif/af495878874f6fcc69a0732c0d5be871/ga1.sml ga1 true ga1.sml sml 17428 163 187 IMAGE-THUMBNAIL 1-s2.0-S0926860X22002770-gr9_lrg.jpg https://s3-eu-west-1.amazonaws.com/prod-ucs-content-store-eu-west/content/pii:S0926860X22002770/gr9/HIGHRES/image/jpeg/6e2a8597252120e81c69b197edc70d2e/gr9_lrg.jpg gr9 gr9_lrg.jpg jpg 166952 2371 1497 IMAGE-HIGH-RES 1-s2.0-S0926860X22002770-gr3_lrg.jpg https://s3-eu-west-1.amazonaws.com/prod-ucs-content-store-eu-west/content/pii:S0926860X22002770/gr3/HIGHRES/image/jpeg/ebc55b8c88b0a6e174a1f0553821413c/gr3_lrg.jpg gr3 gr3_lrg.jpg jpg 124700 1112 1497 IMAGE-HIGH-RES 1-s2.0-S0926860X22002770-gr4_lrg.jpg https://s3-eu-west-1.amazonaws.com/prod-ucs-content-store-eu-west/content/pii:S0926860X22002770/gr4/HIGHRES/image/jpeg/18bda68c5990158547daffb63ad70947/gr4_lrg.jpg gr4 gr4_lrg.jpg jpg 207179 1196 1497 IMAGE-HIGH-RES 1-s2.0-S0926860X22002770-gr1_lrg.jpg https://s3-eu-west-1.amazonaws.com/prod-ucs-content-store-eu-west/content/pii:S0926860X22002770/gr1/HIGHRES/image/jpeg/eefbe5238515831ea22bb181c468460c/gr1_lrg.jpg gr1 gr1_lrg.jpg jpg 133732 1161 1497 IMAGE-HIGH-RES 1-s2.0-S0926860X22002770-gr2_lrg.jpg https://s3-eu-west-1.amazonaws.com/prod-ucs-content-store-eu-west/content/pii:S0926860X22002770/gr2/HIGHRES/image/jpeg/d8ed6e448f7d9faa67c72b67058d181b/gr2_lrg.jpg gr2 gr2_lrg.jpg jpg 115385 1111 1497 IMAGE-HIGH-RES 1-s2.0-S0926860X22002770-gr7_lrg.jpg https://s3-eu-west-1.amazonaws.com/prod-ucs-content-store-eu-west/content/pii:S0926860X22002770/gr7/HIGHRES/image/jpeg/0037c3b8900e4d2a04e642f4042105c4/gr7_lrg.jpg gr7 gr7_lrg.jpg jpg 65095 1089 1497 IMAGE-HIGH-RES 1-s2.0-S0926860X22002770-gr8_lrg.jpg https://s3-eu-west-1.amazonaws.com/prod-ucs-content-store-eu-west/content/pii:S0926860X22002770/gr8/HIGHRES/image/jpeg/3bb2097cedae02b6c7579930fbf75235/gr8_lrg.jpg gr8 gr8_lrg.jpg jpg 102582 1064 1247 IMAGE-HIGH-RES 1-s2.0-S0926860X22002770-gr5_lrg.jpg https://s3-eu-west-1.amazonaws.com/prod-ucs-content-store-eu-west/content/pii:S0926860X22002770/gr5/HIGHRES/image/jpeg/8a9dc6734f9618f3764f71662267bb10/gr5_lrg.jpg gr5 gr5_lrg.jpg jpg 734766 3560 2911 IMAGE-HIGH-RES 1-s2.0-S0926860X22002770-gr6_lrg.jpg https://s3-eu-west-1.amazonaws.com/prod-ucs-content-store-eu-west/content/pii:S0926860X22002770/gr6/HIGHRES/image/jpeg/080fe8dc46d295eeaf6cc807f7c22f5f/gr6_lrg.jpg gr6 gr6_lrg.jpg jpg 357744 2417 1497 IMAGE-HIGH-RES 1-s2.0-S0926860X22002770-sc1_lrg.jpg https://s3-eu-west-1.amazonaws.com/prod-ucs-content-store-eu-west/content/pii:S0926860X22002770/sc1/HIGHRES/image/jpeg/1968933d45ec2c914015d36dbe8d1f73/sc1_lrg.jpg sc1 sc1_lrg.jpg jpg 78295 950 2245 IMAGE-HIGH-RES 1-s2.0-S0926860X22002770-gr14_lrg.jpg https://s3-eu-west-1.amazonaws.com/prod-ucs-content-store-eu-west/content/pii:S0926860X22002770/gr14/HIGHRES/image/jpeg/42f9a21b9b82f2fe929133e3c239c205/gr14_lrg.jpg gr14 gr14_lrg.jpg jpg 160187 1178 1497 IMAGE-HIGH-RES 1-s2.0-S0926860X22002770-gr15_lrg.jpg https://s3-eu-west-1.amazonaws.com/prod-ucs-content-store-eu-west/content/pii:S0926860X22002770/gr15/HIGHRES/image/jpeg/5a55fa92c30d6ede230bca1a3693038f/gr15_lrg.jpg gr15 gr15_lrg.jpg jpg 259257 1451 1663 IMAGE-HIGH-RES 1-s2.0-S0926860X22002770-gr12_lrg.jpg https://s3-eu-west-1.amazonaws.com/prod-ucs-content-store-eu-west/content/pii:S0926860X22002770/gr12/HIGHRES/image/jpeg/e4447739899d7e4d07a872866d8d86ad/gr12_lrg.jpg gr12 gr12_lrg.jpg jpg 132194 1211 1497 IMAGE-HIGH-RES 1-s2.0-S0926860X22002770-gr13_lrg.jpg https://s3-eu-west-1.amazonaws.com/prod-ucs-content-store-eu-west/content/pii:S0926860X22002770/gr13/HIGHRES/image/jpeg/2dfd8fa8ed0ce4a60d4fb92155a1b78a/gr13_lrg.jpg gr13 gr13_lrg.jpg jpg 179177 1792 1663 IMAGE-HIGH-RES 1-s2.0-S0926860X22002770-gr10_lrg.jpg https://s3-eu-west-1.amazonaws.com/prod-ucs-content-store-eu-west/content/pii:S0926860X22002770/gr10/HIGHRES/image/jpeg/d7f72c8c7369aa9ca27f5b15360651d9/gr10_lrg.jpg gr10 gr10_lrg.jpg jpg 91979 1171 1497 IMAGE-HIGH-RES 1-s2.0-S0926860X22002770-gr11_lrg.jpg https://s3-eu-west-1.amazonaws.com/prod-ucs-content-store-eu-west/content/pii:S0926860X22002770/gr11/HIGHRES/image/jpeg/caa4dd7970c12fa651da2ee4463e1865/gr11_lrg.jpg gr11 gr11_lrg.jpg jpg 135081 1212 1497 IMAGE-HIGH-RES 1-s2.0-S0926860X22002770-ga1_lrg.jpg https://s3-eu-west-1.amazonaws.com/prod-ucs-content-store-eu-west/content/pii:S0926860X22002770/ga1/HIGHRES/image/jpeg/ff77f4dcad337bb39578babf4ddce579/ga1_lrg.jpg ga1 true ga1_lrg.jpg jpg 237177 1085 1241 IMAGE-HIGH-RES 1-s2.0-S0926860X22002770-mmc1.docx https://s3-eu-west-1.amazonaws.com/prod-ucs-content-store-eu-west/content/pii:S0926860X22002770/mmc1/MAIN/application/vnd.openxmlformats-officedocument.wordprocessingml.document/26bd0393e5b295f7cf71f06ada1e34aa/mmc1.docx mmc1 mmc1.docx docx 3112672 APPLICATION 1-s2.0-S0926860X22002770-si0001.svg https://s3-eu-west-1.amazonaws.com/prod-ucs-content-store-eu-west/content/pii:S0926860X22002770/STRIPIN/image/svg+xml/da1f62651e79dab5f8a0a152d5485c48/si0001.svg si0001 si0001.svg svg 3817 ALTIMG 1-s2.0-S0926860X22002770-si0002.svg https://s3-eu-west-1.amazonaws.com/prod-ucs-content-store-eu-west/content/pii:S0926860X22002770/STRIPIN/image/svg+xml/07bb4fd60f7b9cbfa37d90ce3691dddc/si0002.svg si0002 si0002.svg svg 5961 ALTIMG 1-s2.0-S0926860X22002770-si0003.svg https://s3-eu-west-1.amazonaws.com/prod-ucs-content-store-eu-west/content/pii:S0926860X22002770/STRIPIN/image/svg+xml/98b1ddfda66aee83367f28d802cd4aa0/si0003.svg si0003 si0003.svg svg 3051 ALTIMG 1-s2.0-S0926860X22002770-si0004.svg https://s3-eu-west-1.amazonaws.com/prod-ucs-content-store-eu-west/content/pii:S0926860X22002770/STRIPIN/image/svg+xml/eb8db34cdd77a879860ae2a73290f0f9/si0004.svg si0004 si0004.svg svg 1989 ALTIMG 1-s2.0-S0926860X22002770-am.pdf https://s3-eu-west-1.amazonaws.com/prod-ucs-content-store-eu-west/content/egi:10P1WWB50VQ/MAIN/application/pdf/57183307cc701608c735db4748e5613f/am.pdf am am.pdf pdf false 1366053 AAM-PDF APCATA 118754 118754 S0926-860X(22)00277-0 10.1016/j.apcata.2022.118754 Elsevier B.V. Fig. 1 Catalytic performance of NH3-SCR over Mn-A, Mn-M and Mn-MP catalysts. Reaction conditions: [NO] = [NH3] = 500 ppm, [O2] = 5%, N2 balance, and GHSV = 140,000 h−1. Fig. 1 Fig. 2 Temperature dependence of NH3-SCR reaction rate constant over Mn-A, Mn-M and Mn-MP catalysts. Fig. 2 Fig. 3 The effect of SO2/H2O on low-temperature SCR performance over Mn-A, Mn-M and Mn-MP catalysts at 175 °C. Fig. 3 Fig. 4 XRD patterns of Mn-A, Mn-M, Mn-MP and the precursor of Mn-MP catalysts. Fig. 4 Fig. 5 SEM images of (a) Mn-A, (b) precursor of Mn-M, (c) Mn-M, (d) precursor of Mn-MP and (e) Mn-MP. Fig. 5 Fig. 6 XPS spectra of (a) Mn 2p and (b) O 1 s of different catalysts. Fig. 6 Fig. 7 Relationship between the NH3-SCR reaction rate constant (K) and the Mn4+/Mn ratio at 110 °C. Fig. 7 Fig. 8 H2-TPR over Mn-A, Mn-M and Mn-MP catalysts. Fig. 8 Fig. 9 NH3-TPD (a) and normalized NH3 desorption amount (b) over Mn-A and Mn-MP catalysts. Fig. 9 Fig. 10 DRIFTs of pyridine adsorption on Mn-A and Mn-MP at 175 °C. Fig. 10 Fig. 11 In situ DRIFTs of NH3 adsorption on Mn-A, Mn-M and Mn-MP at 175 °C. Fig. 11 Fig. 12 In situ DRIFTs of NO + O2 adsorption on Mn-A, Mn-M and Mn-MP at 175 °C. Fig. 12 Fig. 13 The in situ DRIFTs of SO2 + O2 adsorption over (a) Mn-A and (b) Mn-MP catalyst at 175 °C. Fig. 13 Fig. 14 Dynamic changes of the in situ DRIFTs over S-Mn-MP catalyst in a flow of NO + O2 after pre-exposed to NH3 for 60 min at 175 °C. Fig. 14 Fig. 15 The illustration of the NH3-SCR reaction and the SO2 tolerance mechanism over Mn-A and Mn-MP catalysts. Fig. 15 Scheme 1 Synthesis process of the porous Mn-MP catalyst. Scheme 1 Selective catalytic reduction of NOx with NH3 over a novel MOF- derived MnOx catalyst Ruiyang Chen Investigation Writing – original draft a b Xiaoyu Fang Investigation a b Zhenguo Li Formal analysis c Zhiming Liu Conceptualization Writing – review & editing Supervision Project administration a b ⁎ a State Key Laboratory of Chemical Resource Engineering, Beijing University of Chemical Technology, Beijing 100029, China State Key Laboratory of Chemical Resource Engineering, Beijing University of Chemical Technology Beijing 100029 China State Key Laboratory of Chemical Resource Engineering, Beijing University of Chemical Technology, Beijing 100029, China b Beijing Key Laboratory of Energy Environmental Catalysis, Beijing University of Chemical Technology, Beijing 100029, China Beijing Key Laboratory of Energy Environmental Catalysis, Beijing University of Chemical Technology Beijing 100029 China Beijing Key Laboratory of Energy Environmental Catalysis, Beijing University of Chemical Technology, Beijing 100029, China c National Engineering Laboratory for Mobile Source Emission Control Technology, China Automotive Technology & Research Center, Tianjin 300300, China National Engineering Laboratory for Mobile Source Emission Control Technology, China Automotive Technology & Research Center Tianjin 300300 China National Engineering Laboratory for Mobile Source Emission Control Technology, China Automotive Technology & Research Center, Tianjin 300300, China ⁎ Corresponding author at: State Key Laboratory of Chemical Resource Engineering, Beijing University of Chemical Technology, Beijing 100029, China. State Key Laboratory of Chemical Resource Engineering, Beijing University of Chemical Technology Beijing 100029 China A novel MnOx catalyst (Mn-MP) derived from MOF-Mn3(BTC)2(H2O)6 was fabricated and investigated for the selective catalytic reduction of NOx by NH3 at low temperatures. Mn-MP catalyst showed a superior activity and noticeably improved tolerance to SO2. The MOF precursor and doping PVP led to large surface area, small particle size and more crystalline defects of Mn-MP catalyst. The formation of abundant acid sites, Mn4+ and surface chemical oxygen would promote the NH3-SCR reaction. In situ DRIFTs demonstrated the high SO2 tolerance over the Mn-MP catalyst not only results from the reduced irreversible sulfurization rate, but also the promoting adsorption of active bidentate nitrates and NH4 + in the coexistence of sulfates. Our work shed light on the design of porous MOF-derived MnOx catalysts with high SO2 resistance at low temperatures. Graphical Abstract ga1 Keywords Nitrogen oxides NH3-SCR MOF-derived MnOx 1 Introduction Nitrogen oxide (NOx) emission from stationary sources and vehicle exhaust can cause serious environmental issues, such as the formation of photochemical smog and acid rain, and is very harmful to human health [1–3]. Different methods have been developed to control NOx emission, and selective catalytic reduction of NOx with NH3 (NH3-SCR) is considered to be one of the most efficient technologies [4,5]. For the NH3-SCR process, the highly active catalyst plays a key role in the removal of NOx. Nowadays, the commercial catalyst for the NH3-SCR of NOx is mainly V2O5-WO3 (MoO3)/TiO2, whose active temperature window is 300 ~ 400 °C [4]. V has a toxic effect on the ecological environment, and this catalyst is efficient only when it is placed upstream of the electric precipitator. However, the catalyst is susceptible to be deactivated due to the massive dust and the high concentration of SO2 [6]. Therefore, it is urgent to develop a highly active NH3-SCR catalyst at low temperatures (< 200 °C), which then can be installed after the electric precipitator. In this way, the lifetime of the NH3-SCR catalyst can be prolonged and the economy of the SCR process can be improved. To develop active low-temperature NH3-SCR catalysts, various transition metals have been investigated [7–11]. MnOx has attracted much attention owing to its environmental friendliness and high redox capacity [12–17], but they still face big challenges in SO2 resistance. It is generally accepted that the formation of (NH4)2SO4/NH4HSO4 and MnSO4 caused by SO2 oxidation are the primary reasons for catalyst deactivation [4,7]. Therefore, reducing the adsorption/oxidation of SO2 could be an effective approach to improve the SO2 tolerance. From the perspective of acidic/basic properties, enhancing the acidity of catalysts could reduce the SO2 adsorption to some extent [4], and it was further confirmed that the Brønsted (B)-acid sites rather than the Lewis (L)-acid sites contribute to the strong resistance to SO2 poisoning [18]. Metal-organic frameworks (MOFs)-derived metal oxides can not only introduce B acid sites, but also promote the high dispersion of acid sites due to their high porosity and large specific surface areas [19–24]. It was reported that MnxCo3−xO4 nanocages derived from the MOF of Mn3[Co(CN)6]2·nH2O exhibited much better SO2 tolerance at low temperatures, which was ascribed to the hierarchically porous structure, larger number of active sites and strong interaction between MnOx and CoOx [24]. However, the role of B acid sites in SO2 resistance hasn’t been addressed and the toxic cyanide ligands are used during the preparation, which is not friendly to the environment. Considering that 1,3,5-trimesic acid (H3BTC) is a cheap and green multidentate ligand, and the structure of MOFs can be regulated by the addition of polyvinylpyrrolidone (PVP), herein, we designed a novel porous MnOx catalyst (Mn-MP) by using Mn-H3BTC as a precursor and PVP as a structure-directing agent. This catalyst was active for the reduction of NOx by NH3 at low temperatures, and also showed high SO2 tolerance. The reasons for the high activity and strong SO2 resistance have been revealed by in situ DRIFTs studies. 2 Experimental 2.1 Catalyst preparation Synthesis of Mn-MP: A proper amount of Mn(CH3COO)2.4 H2O and polyvinyl pyrrolidone (PVP, 6.43 g) were dissolved in deionized water, then stirred to get the solution A. 1,3,5-trimesic acid (H3BTC, 18 mmol, 3.78 g) was dissolved in 30 ml N, N-dimethylformamide to form solution B. Subsequently, Solution A was directly added into solution B, the mixed solution was transferred into a Teflon-lined autoclave and held at 110 °C for 24 h. The precipitate was filtered, washed, and dried at 110 °C for 12 h. Then the solid was calcined in air at 300 °C for 4 h (see Scheme 1). The synthesis of Mn-M is similar to that of Mn-MP except PVP is absent in solution A. The Mn-A was also prepared through direct decomposition of Mn(CH3COO)2.4 H2O at 300 °C for 4 h in air. 2.2 Catalytic performance test The catalytic performance was tested in a fixed-bed quartz reactor with a 0.12 g catalyst. The reaction conditions were as follows: 500 ppm NO, 500 ppm NH3, 5% O2, 5 vol% H2O (when used), 50 ppm SO2 (when used), and N2 balance. The gas flow rate is 300 cm3·min−1, corresponding to the gaseous hourly space velocity (GHSV) of 140,000 h−1. The concentration of effluent gas was analyzed online by chemiluminescence NO/NO2 analyzer (Thermo Scientific, model 42i-HL) and a FITR spectrometer (Gasmet FTIR DX4000). The NOx conversion and N2 selectivity were calculated as follows: NO x conversion = NO x in - NO x out [NO x ] in × 100 N 2 selectivity = NO x in + NH 3 in - NO x out - NH 3 out - 2 N 2 O out NO x in - NO x out + NH 3 in - NH 3 out × 100 The reaction rate (K) for NH3-SCR of NOx was obtained using the differential reactor over which the NOx conversion was kept below 20%, it was calculated as following formula (1). And the Ea can be obtained from the formula (2). (1) K( μmol / g·s ) = F Y NOx C NOx m cat (2) ln K = - Ea RT + ln A Where F is the total molar flow rate (μmol s−1), YNOx is the molar fraction of NOx in the feed, CNOx is the conversion of NOx, and mcat is the weight of catalyst (g). 2.3 Catalyst characterization The powder X-ray diffraction (XRD) was recorded on a Bruker D8 ADVANCE system with Cu Kα radiation. Thermogravimetric analysis (TGA) was performed on a Netzsch STA 449 C instrument with a heating rate of 10 °C/min in an air atmosphere. X-ray photoelectron spectroscopy (XPS) analysis was carried out on the electron spectrometer (VG Scientific, ESCALab220i-XL) with Mg Kα radiation, in which C 1 s signal (284.8 eV) was used as the reference. Scanning electron microscopy (SEM) images were taken by a Hitachi S-4800 instrument. Texture properties were measured by N2 adsorption-desorption isotherms collected on the micrometric ASAP 2010 instrument. Both temperature-programmed reduction of H2 (H2-TPR) and temperature-programmed desorption of NH3 (NH3-TPD) were conducted on a Micrometrics Chemisorb 2720 analyzer, 0.1 g of catalysts was first pretreated with N2 at 300 °C, then for the H2-TPR experiment, the temperature was raised to 700 °C at a constant heating rate of 10 °C·min-1 in 10% H2/N2 flow. In the case of NH3-TPD experiment, the temperature was raised to 700 °C at a constant heating rate of 10 °C·min-1 in N2 flow after the catalyst was saturated by NH3/N2 flow at 100 °C. The H2 consumption or NH3 desorption with temperature was recorded continuously by the TCD detector. In-situ DRIFTs were recorded on a Nicolet iS50 FTIR spectrometer. The sample was first pretreated in N2 flow at 300 °C for 1 h, then take the background spectrum at the desired temperature. The sample spectrum was obtained by subtracting the corresponding background spectrum [24]. 3 Results and discussion 3.1 NH3-SCR performance The catalytic performance of Mn-A, Mn-M and Mn-MP catalysts are investigated and the NOx conversions are shown in Fig. 1. The conversion of NOx over the Mn-A catalyst is less than 80% below 175 °C. Compared with the Mn-A catalyst, both Mn-M and Mn-MP samples are more active for the NH3-SCR of NOx, and the Mn-MP is the most active catalyst, over which more than 85% NOx conversion can be achieved between 100 and 200 °C. This fact indicates that the MOF-derived samples can significantly boost the low-temperature NH3-SCR activity and the introduction of PVP in the MOF preparation process can further enhance the activity. Over the CeO2-MnOx (5:5) catalyst derived from the Ce-Mn coordination polymer, the NO conversion was lower than 80% below 200 °C [19]. In the case of MnOx prepared from the Mn-MOF-74, the conversion can’t reach 98% until the temperature increased to 220 °C [22]. Therefore, the catalytic activity of the Mn-MP catalyst in this work is superior to those reported previously [19,22]. In addition, the N2 selectivity (See Fig. S1) over the three catalysts also follows the order of Mn-MP > Mn-M > Mn-A. The main by-product is N2O, which results from the excess oxidation of NH3 species due to the strong oxidation ability of MnOx catalyst [4]. Fig. 2 shows the temperature dependence of NH3-SCR reaction rate constant over Mn-A, Mn-M and Mn-MP catalysts. It is found that the apparent activation energies (Ea) of the three catalysts decrease in the order of Mn-A > Mn-M > Mn-MP. This means NH3-SCR of NOx reaction proceeds more easily over the Mn-MP catalyst. The tolerance to H2O or SO2 is important for the practical application of the NH3-SCR catalyst. From Fig. 1, the NOx conversions of the catalysts at 175 °C were lower than 100%, which can eliminate the effect of supersaturation [25]. Thus the impacts of H2O or SO2 on Mn-A, Mn-M and Mn-MP catalysts were investigated at 175 °C and the results are illustrated in Fig. 3. We can see that the inhibition trend by H2O is reversible for all three catalysts, while the reversibility of SO2 poisoning depends on the catalyst. For Mn-A, the introduction of H2O or SO2 led to a remarkable decrease in the activity, and the activity can’t recover after cutting off the SO2. In contrast, Mn-M and Mn-MP catalysts showed excellent H2O or SO2 resistance, the NOx conversion can be maintained above 80% and 90%, respectively, and their activities can be restored when SO2 is excluded. After introduction of 50 ppm SO2 at 180 °C, the NOx conversion decreased with time over the Co7Mn3Ox catalyst prepared by the co-precipitation method [15]. And the NOx conversion over MnFeDy-0.1 dropped from 85% to 30% within 5 h, and then recovered to 40% after cutting off SO2 [26]. Compared with those low-temperature catalysts, the MOF-derived Mn-M and Mn-MP catalysts showed higher SO2 tolerance. 3.2 Catalyst characterization 3.2.1 XRD analysis XRD patterns of the Mn-MP and its precursor, Mn-M and Mn-A catalysts are shown in Fig. 4. The precursor of Mn-MP has the characteristic peaks assigned to Mn3(BTC)2(H2O)6 [7], suggesting the MOF-Mn was successfully synthesized. The crystal structure of Mn-MP differs from its precursor but presents active species of Mn3O4 (PDF#80–0382) and Mn2O3 (PDF#78–0390), indicating the complete removal of organic ligands and the transition from MOF to metal oxides. Mn-A mainly exhibits the characteristic peaks of MnO (PDF#71–1177) and hausmannite Mn3O4, while both the Mn-MP and Mn-M catalysts are dominated by Mn3O4 and Mn2O3. These results suggest that the MOF template can regulate the existence form of MnOx, and boost the formation of MnOx with higher valence states of Mn, which could contribute to their high low-temperature NH3-SCR activity. What’s more, it can be observed that the peak intensity of the Mn-MP catalyst is weaker than that of the Mn-M catalyst, indicating the particle size of Mn-MP is smaller than that of Mn-M and contains more defects, which is conducive to the activity of NH3-SCR catalysts [27]. 3.2.2 SEM analysis The morphology and structure of the studied samples were depicted by SEM (See Fig. 5). Mn-A shows a stack of particles with different sizes, and many particles are agglomerated into the solid block (Fig. 5(a)), which may lead to its smaller specific surface area and inferior activity for the NH3-SCR. The precursor of Mn-M has a structure composed of nanorods that are in an untidy pile (See Fig. 5(b)). After calcination, Mn-M is like porous monoliths and there are macropores between monoliths (See Fig. 5(c)). In comparison, the precursor of Mn-MP presents a neatly arranged belt structure (See Fig. 5(d)), which results from the structural direction of PVP through the interaction with metal ions [24,27]. After calcination, Mn-MP is composed of a 3D interconnected porous grid (See Fig. 5(e)). 3.2.3 N2 adsorption N2 physisorption isotherms of Mn-A, Mn-M and Mn-MP are displayed in Fig. S2. All samples show typical IV-type curves with an H3 type hysteresis loop over P/P0 between 0.8 and 0.95, indicating the presence of mesopores [21]. And the mesopores have broad pore size distributions (Fig. S2, inset). The specific BET surface area and total pore volume (Vt) of Mn-MP (51 m2/g and 0.5 cm3/g) and Mn-M (58 m2/g and 0.6 cm3/g) are much larger than Mn-A (19 m2/g and 0.13 cm3/g), which results from their porous structures. The porous structures with larger specific surface area are propitious to the exposure of active sites and the adsorption of reactants, affording the excellent catalytic activities of MOF-derived MnOx catalysts. 3.2.4 XPS analysis The surface composition and chemical nature of the catalysts are further investigated by XPS analysis (See Fig. 6). The peak of Mn 2p3/2 (See Fig. 6a) could be deconvoluted into three peaks centered at ~ 640.9 eV, 642.1 eV, and 643.4 eV, which are attributed to Mn2+, Mn3+ and Mn4+ species, respectively [28,29]. The ratio of Mn4+ over the three catalysts is decreased in the order of Mn-MP (25%) > Mn-M (21%) > Mn-A (19%). For O 1 s spectra (See Fig. 6b), it can be deconvoluted into two peaks: ~ 530 eV and 531.4 eV, which are ascribed to the lattice oxygen (denoted as OL) and surface oxygen (O2- or O- due to defect or hydroxyl-like group, denoted as OS), respectively [26,30]. The OS ratio over the three catalysts decreases in the order of Mn-MP (28%) > Mn-M (25%) > Mn-A (22%). It has been demonstrated that OS species are more active than OL species due to their higher mobility. In the process of calcination during the catalyst preparation, not only the MOF frameworks but also the structure of manganese acetate would undergo distortion with increasing the structure strain and reconstruction by relieving this strain, leading to the formation of -OH group [16,18,27]. Therefore, the amount of -OH could depend on the distortion extent of the structure in pyrolysis, which is significantly affected by the size of the removable ligands. It is obvious that the size of the three ligands follows the order of PVP > H3BTC > > HAc. Therefore, the Mn-MP catalyst can possess the most amount of -OH even though its surface area is slightly lower than that of Mn-M. A larger amount of surface -OH group could act as B acid sites to enhance the chemisorption of NH3 [24]. Both the Mn4+ and OS species are beneficial for the high activity in the NH3-SCR reaction at low temperatures via enhancing the oxidation of NO to NO2 [31–33]. It is evident that the fraction of OS correlates with the Mn4+/Mn ratio, which is in line with the results reported previously [29,34–36]. By quantitative correlation of the ratio of Mn4+/Mn with the reaction rate at 110 °C (See Fig. 7), it can be concluded that the reaction rate constant (K) increases linearly with increasing the Mn4+/Mn ratio, indicating that the Mn4+ plays a key role for the excellent low-temperature activity. Therefore, the enrichment of the Mn4+ and OS on the Mn-MP catalysts results in its superior low-temperature NH3-SCR activity. 3.2.5 H2-TPR analysis The redox performances of the three catalysts are investigated using H2-TPR, and the results are shown in Fig. 8. For all the catalysts, there are two main reduction peaks. The former one (low temperature) is ascribed to the reduction of MnO2 to Mn2O3 and the latter one (high temperature) is assigned to the reduction of Mn2O3 to MnO [37,38]. Compared with the Mn-A sample, not only both the reduction peaks of Mn-M and Mn-MP catalysts are much larger but also the high-temperature one shifts to the lower temperature, suggesting the improved reducibility and oxygen mobility of Mn-M and Mn-MP catalysts [3], which contributes to their excellent low-temperature NH3-SCR activity. 3.2.6 NH3-TPD analysis It is well acknowledged that the chemisorption and activation of NH3 on acid sites is crucial in the NH3-SCR reaction [29,30]. Then the acid amount of Mn-A and Mn-MP catalysts was investigated by the NH3-TPD experiment and the results are shown in Fig. 9. Both samples display a broad NH3 desorption band from 100 to 650 °C (See Fig. 9(a)), which can be divided into three desorption peaks. The desorption peaks below 200 °C, between 200 and 300 °C, and above 300 °C could be attributed to weak, medium and strong absorbed NH3, respectively [17]. NH4 + bound to B acid sites are usually more thermally unstable than NH3 coordinated to L acid sites. Thus, the weak acid sites are associated with B acid sites while the strong acid sites are due to L acid sites, and the medium acid sites could be related to B and L acid sites [29,31,33]. Fig. 9(b) shows the quantitative analyses of NH3-TPD. There are nearly no weak acid sites on the Mn-A, indicating the absence of B acid sites, while the MOF-derived Mn-MP is conducive to the formation of B acid sites as well as L acid sites, and the amount of acid sites on the Mn-MP is significantly enhanced. 3.3 In situ DRIFTs studies 3.3.1 Adsorption of pyridine The DRIFT spectra of pyridine adsorption on Mn-A and Mn-MP at 175 °C were illustrated in Fig. 10. Over Mn-A catalyst the bands corresponding to L acid sites at 1478 and 1443 cm−1 [9,39] were observed. Compared with Mn-A, over Mn-MP catalyst the intensities of the peaks ascribed to L acid sites are increased, and the band corresponding to B acid site appeared at 1541 cm−1 [9]. Therefore, both L and B acid sites are present over Mn-MP catalyst. 3.3.2 Adsorption and reactivity of NH3 species Fig. 11 shows the in situ DRIFTs of NH3 adsorption over the Mn-A, Mn-M and Mn-MP catalysts at 175 °C. The bands located at ~1605, 1267 and 1190 cm−1 are assigned to the coordinately NH3 related to L acid sites [39–41], while the peak at ~1500 cm−1 can be ascribed to the NH4 + species on B acid sites [34,42]. There are only L acid sites (1190 cm−1) on the Mn-A catalyst, while except for the adsorbed NH3 species on the L acid sites (1190, 1605 and 1267 cm−1), the NH3 species adsorbed on B acid sites (1500 cm−1) is also detected over the Mn-MP and Mn-M catalysts. And it is noted that the peak area of NH3 species of the three catalysts follows the order of Mn-MP ≈ Mn-M > > Mn-A, which is consistent with the NH3-TPD analysis. The reactivity of pre-adsorbed NH3 with NO + O2 was investigated at 175 °C over the Mn-MP catalyst, and the results are presented in Fig. S3. After NH3 is introduced for 30 min and then purged with N2, several peaks (1605, 1500, 1267 and 1190 cm−1) attributed to the adsorbed NH3 species appear [40–42]. When switching to NO + O2, it is observed that the intensities of bands ascribed to the adsorbed NH3 species on L acid sites (1605, 1267 and 1190 cm−1) decrease and finally disappear with increasing time, meanwhile, some bands assigned to the surface nitrate species (~1546, 1525, 1246 and 1005 cm−1) appear, indicating that these adsorbed NH3 species on L acid sites are main reactive species. 3.3.3 Adsorption and reactivity of NOx species Fig. 12 shows the DRIFTs of NO + O2 adsorption on the Mn-A, Mn-M and Mn-MP catalysts at 175 °C. The peaks located at ~1629, 1559, 1246 and 1011 cm−1 are assigned to gaseous NO2 molecules [43], bidentate nitrate [44], bridged nitrate [45,46] and trans-(N2O2)2− species [30], respectively. Peak intensities over the Mn-MP catalyst are higher than those over the Mn-M catalyst, followed by the Mn-A catalyst. These results confirm that more NOx can be adsorbed and activated over the Mn-MP catalyst due to its high oxidation ability. The reactions of NH3 with pre-adsorbed NO + O2 over Mn-MP catalysts were recorded at 175 °C by in-situ DRIFTs, and the dynamic changes are illustrated in Fig. S4. After being exposed to NO + O2 for 60 min and then purged with N2, the Mn-MP catalysts were mainly covered by bidentate nitrate (1559 cm−1) [43,44] and bridged nitrate (1246 cm−1) [45,46]. When the gas was switched to NH3, the peak intensity of bidentate nitrate decreased rapidly compared to that of bridged nitrate, and meanwhile, the peak intensities of the adsorbed NH3 species (1606, 1496 and 1272 cm−1) increased. These results indicate that the main active intermediate over the Mn-MP is the bidentate nitrate. 3.3.4 In situ DRIFTs analyses of SO2 resistance To reveal the high SO2 resistance of Mn-MP, the adsorption and activation of NH3 and NO + O2 over the SO2 + O2 pre-adsorbed Mn-MP and Mn-A catalysts were recorded by in-situ DRIFTs. Fig. 13 showed the in situ DRIFTs of SO2 + O2 adsorption over Mn-A and Mn-MP catalyst at 175 °C (The corresponding spectra collected at specified times are shown in Fig. S5). As shown in Fig. 13, there are mainly four adsorbed SO2 species over Mn-A catalyst, those are, 1336, 1261, 1125 and 996 cm−1 corresponding to coordinated sulfate species, asymmetric stretching vibration mode of O-S-O species of HSO4 -, bulk metal sulfate, and symmetric stretching vibration of O-S-O, respectively [47–49]. Over the Mn-MP catalyst, besides the above four adsorbed SO2 species located on 1334, 1251, 1092 and 993 cm−1, there are other two peaks of 1618 and 1544 cm−1, which are ascribed to the adsorbed HSO4 - generated by the interaction between SO2 and surface hydroxyl groups [47–49]. Notably, the peak intensity of bulk metal sulfate over the Mn-A catalyst increases markedly with time and finally is dominated on the catalyst, while that over the Mn-MP catalyst changes little and the final main sulfate species is HSO4 -, implying that the B acid sites such as hydroxyl groups can adsorb SO2 preferentially and form HSO4 -. To further reveal the poisoning effect of bulk sulfate and HSO4 - on the catalysts, the NO and NH3 adsorption DRIFTs experiments on SO2-poisoned Mn-A and Mn-MP catalysts were conducted, and the results are shown in Fig. S6 and Fig. S7, respectively. We can see that there are almost no peaks of NO or NH3 species over the SO2-poisoned Mn-A sample (S-Mn-A) (See Fig. S6 (a) and Fig. S7 (a)), indicating the Mn-A was inactivated irreversibly by the bulk MnSO4, which is in accordance with previous studies [47–49]. By contrast, there are still many adsorbed active NOx and NH3 species detected over SO2-poisoned Mn-MP catalysts (S-Mn-MP). As shown in Fig. S6 (b), the adsorbed NOx species over the S-Mn-MP catalyst are similar to those over the fresh Mn-MP catalyst and the bidentate nitrate is also the dominated species. The little effect of SO2 on the adsorption of NOx can be ascribed to the preferential adsorption of SO2 by surface hydroxyl groups so that the redox sites are free from the attack of SO2. For most catalysts, improving the adsorption of active NOx with the coexistence of sulfates is difficult because there is competition adsorption on the redox sites between NO and SO2 [4]. Nowadays the strategies to solve this problem focus on modifying the catalysts with another metal element, such as Eu [50], Zr [51], Ni and Co [52]. However, by pyrolysis of MOF materials to achieve this goal of promoting NO adsorption is scarcely reported as far as we know. As shown in Fig. S7 (b), besides the surface sulfates (1344, 1261 and 1023 cm−1) and a small number of bulk sulfates (1090 cm−1), the main adsorbed NH3 species are NH4 + (1400–1500 cm−1) linked to B acid sites of HSO4 - (1261 cm−1), namely NH4HSO4. These results suggest that not only the HSO4 - can’t poison the active sites of Mn-MP catalysts for the adsorption and activation of NOx, but also it can serve as B acid sites for capturing NH3. In order to reveal the role of NH4HSO4, we then introduced NO/O2 through the S-Mn-MP pre-adsorbed by NH3 to test the reactivity of NH4HSO4. As shown in Fig. 14, The bands at 1430 (NH4 +), 1341 (surface sulfates) and 1252 (HSO4 -) cm−1 gradually disappeared with prolonging the exposure time to NO + O2, and meanwhile new peaks (1566 and 1252 cm−1) ascribed to the nitrates appeared, implying that the NH4 + linked to HSO4 - was consumed by NO with the HSO4 - reconversion to the surface sulfate. Thus, here we confirm that the NH4HSO4 is a reactive species for NH3-SCR of NOx, and the poisoning effect of HSO4 - on the catalyst is reversible, which contributes to the high SO2 tolerance of Mn-MP catalysts. Ye et al. [53] also found that NH4HSO4 can act as a reductant to react with NO. Therefore, as depicted in Fig. 15, the Mn-MP catalyst with a 3D porous structure and more L/B acid sites has a higher adsorption capacity for active intermediates (i.e. bidentate nitrate and adsorbed NH3 species) than the Mn-A catalyst. After introducing SO2 + O2, many active sites of the Mn-A catalyst are poisoned by the bulk MnSO4, resulting in the loss of adsorption capacity for both NH3 and NO. By contrast, over Mn-MP catalyst, the existence of B acid sites forms a barrier for active sites against the attack of SO2, reducing the formation of bulk MnSO4, therefore the active nitrate (i.e. bidentate nitrate) and NH4 + species can be involved in the NH3-SCR reaction. 4 Conclusions Herein we have developed a highly active low-temperature deNOx catalyst (Mn-MP) using PVP doping MOF as the precursor, and it also exhibited high SO2/H2O tolerance. Over the Mn-MP catalyst, more than 85% NOx conversion was achieved in the temperature range of 100–200 °C, and the NOx conversion can be maintained after exposure to SO2 or H2O. The formation of abundant acid sites, Mn4+ and surface chemical oxygen account for the enhanced catalytic activity of the Mn-MP catalyst. The formation of less bulk MnSO4 due to the B acid sites improves the adsorption of active intermediates (bidentate nitrate and NH4 +) in the presence of sulfate species, which is responsible for the high SO2 resistance of the Mn-MP catalyst in the SCR reaction. The present research provides new sights on the synthesis of MOF-Mn-derived materials with remarkable low-temperature NH3-SCR activity and high tolerance to SO2/H2O. CRediT authorship contribution statement Ruiyang Chen: Investigation, Writing – original draft; Xiaoyu Fang: Investigation; Zhenguo Li: Formal analysis; Zhiming Liu: Conceptualization, Writing – review & editing，Supervision，Project administration. Declaration of Competing Interest The authors declare that they have no known competing financial interests or personal relationships that could have appeared to influence the work reported in this paper. Acknowledgments This work was financially supported by the National Natural Science Foundation of China (21876009, 21677008), National Engineering Laboratory for Mobile Source Emission Control Technology (NELMS2019A18), and the Fundamental Research Funds for the Central Universities (PY2103, JD2110). Appendix A Supporting information Supplementary data associated with this article can be found in the online version at doi:10.1016/j.apcata.2022.118754. Appendix A Supplementary material Supplementary material Supplementary material . References [1] Z. Liu S.Ihl Woo Catal. Rev. 48 2006 43 89 10.1080/01614940500439891 Z. Liu, S.Ihl Woo, Catal. Rev. 48 (2006) 43–89. https://doi.org/10.1080/01614940500439891. [2] S. Xie Q. Qin H. Liu L. Jin X. Wei J. Liu X. Liu Y. Yao L. Dong B. Li ACS Appl. Mater. Inter. 12 2020 48476 48485 10.1021/acsami.0c11035 S. Xie, Q. Qin, H. Liu, L. Jin, X. Wei, J. Liu, X. Liu, Y. Yao, L. Dong, B. Li, ACS Appl. Mater. Inter. 12 (2020) 48476–48485. https://doi.org/10.1021/acsami.0c11035. [3] J. Chen P. Fu D. Lv Y. Chen M. Fan J. Wu A. Meshram B. Mu X. Li Q. Xia Chem. Eng. J. 407 2021 127071 10.1016/j.cej.2020.127071 J. Chen, P. Fu, D. Lv, Y. Chen, M. Fan, J. Wu, A. Meshram, B. Mu, X. Li, Q. Xia, Chem. Eng. J. 407 (2021) 127071. https://doi.org/10.1016/j.cej.2020.127071. [4] L. Han S. Cai M. Gao J.Y. Hasegawa P. Wang J. Zhang L. Shi D. Zhang Chem. Rev. 119 2019 10916 10976 10.1021/acs.chemrev.9b00202 L. Han, S. Cai, M. Gao, J.Y. Hasegawa, P. Wang, J. Zhang, L. Shi, D. Zhang, Chem. Rev. 119 (2019) 10916–10976. https://doi.org/10.1021/acs.chemrev.9b00202. [5] G. Busca L. Lietti G. Ramis F. Berti Appl. Catal. B-Environ. 18 1998 1 36 10.1016/S0926-3373(98)00040-X G. Busca, L. Lietti, G. Ramis, F. Berti, Appl. Catal. B-Environ. 18 (1998) 1–36. https://doi.org/10.1016/S0926–3373(98)00040-X. [6] G. Qi R.T. Yang J. Catal. 217 2003 434 441 10.1016/S0021-9517(03)00081-2 G. Qi, R.T. Yang, J. Catal. 217 (2003) 434–441. https://doi.org/10.1016/S0021–9517(03)00081–2. [7] Z. Liu M. Wang S. Liu Z. Chen L. Yang K. Sun Y. Chen L. Zeng W. Wang J. Zhao G. Sun B. Liu Y. Pan Y. Liu C. Liu Appl. Catal. B-Environ. 269 2020 118731 10.1016/j.apcatb.2020.118731 Z. Liu, M. Wang, S. Liu, Z. Chen, L. Yang, K. Sun, Y. Chen, L. Zeng, W. Wang, J. Zhao, G. Sun, B. Liu, Y. Pan, Y. Liu, C. Liu, Appl. Catal. B-Environ. 269 (2020) 118731. https://doi.org/10.1016/j.apcatb.2020.118731. [8] L. Han M. Gao C. Feng L. Shi D. Zhang Environ. Sci. Technol. 53 2019 5946 5956 10.1021/acs.est.9b01217 L. Han, M. Gao, C. Feng, L. Shi, D. Zhang, Environ. Sci. Technol. 53 (2019) 5946–5956. https://doi.org/10.1021/acs.est.9b01217. [9] Z. Liu H. Su B. Chen J. Li S.I. Woo Chem. Eng. J. 299 2016 255 262 10.1016/j.cej.2016.04.100 Z. Liu, H. Su, B. Chen, J. Li, S.I. Woo, Chem. Eng. J. 299 (2016) 255–262. https://doi.org/10.1016/j.cej.2016.04.100. [10] T. Gu R. Jin Y. Liu H. Liu X. Weng Z. Wu Appl. Catal. B-Environ. 129 2013 30 38 10.1016/j.apcatb.2012.09.003 T. Gu, R. Jin, Y. Liu, H. Liu, X. Weng, Z. Wu, Appl. Catal. B-Environ. 129 (2013) 30–38. https://doi.org/10.1016/j.apcatb.2012.09.003. [11] Z. Zhang R. Li M. Wang Y. Li Y. Tong P. Yang Y. Zhu Appl. Catal. B-Environ. 282 2021 119542 10.1016/j.apcatb.2020.119542 Z. Zhang, R. Li, M. Wang, Y. Li, Y. Tong, P. Yang, Y. Zhu, Appl. Catal. B-Environ. 282 (2021) 119542. https://doi.org/10.1016/j.apcatb.2020.119542. [12] C. Liu J. Shi C. Gao C. Niu Appl. Catal. A 522 2016 54 69 10.1016/j.apcata.2016.04.023 C. Liu, J. Shi, C. Gao, C. Niu, Appl. Catal. A 522 (2016) 54–69. http://dx.doi.org/10.1016/j.apcata.2016.04.023. [13] R. Wang Z. Hao Y. Li G. Liu H. Zhang H. Wang Y. Xia S. Zhan Appl. Catal. B-Environ. 258 2019 117983 10.1016/j.apcatb.2019.117983 R. Wang, Z. Hao, Y. Li, G. Liu, H. Zhang, H. Wang, Y. Xia, S. Zhan, Appl. Catal. B-Environ. 258 (2019) 117983. https://doi.org/10.1016/j.apcatb.2019.117983. [14] D.A. Peña B.S. Uphade P.G. Smirniotis J. Catal. 221 2004 421 431 10.1016/j.jcat.2003.09.003 D.A. Peña, B.S. Uphade, P.G. Smirniotis, J. Catal. 221 (2004) 421–431. https://doi.org/10.1016/j.jcat.2003.09.003. [15] D. Meng Q. Xu Y. Jiao Y. Guo Y. Guo L. Wang G. Lu W. Zhan Appl. Catal. B: Environ. 221 2018 652 663 10.1016/j.apcatb.2017.09.034 D. Meng, Q. Xu, Y. Jiao, Y. Guo, Y. Guo, L. Wang, G. Lu, W. Zhan, Appl. Catal. B: Environ. 221 (2018) 652–663. https://doi.org/10.1016/j.apcatb.2017.09.034. [16] W. Cui Y. Li H. Zhang Z. Wei B. Gao J. Dai T. Hu Appl. Catal. B-Environ. 278 2020 119262 10.1016/j.apcatb.2020.119262 W. Cui, Y. Li, H. Zhang, Z. Wei, B. Gao, J. Dai, T. Hu, Appl. Catal. B-Environ. 278 (2020) 119262. https://doi.org/10.1016/j.apcatb.2020.119262. [17] H. Jiang D. Kong Y. Niu S. Wang Catal. Sci. Technol. 10 2020 8086 10.1039/d0cy01628d H. Jiang, D. Kong, Y. Niu, S. Wang, Catal. Sci. Technol. 10 (2020) 8086. https://doi.org/ 10.1039/d0cy01628d. [18] C. Liu L. Chen J. Li L. Ma H. Arandiyan Y. Du J. Xu J. Hao Environ. Sci. Technol. 46 2012 6182 6189 10.1021/es3001773 C. Liu, L. Chen, J. Li, L. Ma, H. Arandiyan, Y. Du, J. Xu, J. Hao, Environ. Sci. Technol. 46 (2012) 6182−6189. https://doi.org/10.1021/es3001773. [19] J. Feng Y. Wang D. Gao B. Kang S. Li C. Li G. Chen Nanoscale 12 2020 16381 16388 10.1039/d0nr03028g J. Feng, Y. Wang, D. Gao, B. Kang, S. Li, C. Li, G. Chen, Nanoscale 12 (2020) 16381–16388. https://doi.org/10.1039/d0nr03028g. [20] H. Yao S. Cai B. Yang L. Han P. Wang H. Li T. Yan L. Shi D. Zhang N. J. Chem. 44 2020 2357 2366 10.1039/c9nj05960a H. Yao, S. Cai, B. Yang, L. Han, P. Wang, H. Li, T. Yan, L. Shi, D. Zhang, New J. Chem. 44 (2020) 2357–2366. https://doi.org/10.1039/c9nj05960a. [21] B. Chen X. Yang X. Zeng Z. Huang J. Xiao J. Wang G. Zhan Chem. Eng. J. 397 2020 125424 10.1016/j.cej.2020.125424 B. Chen, X. Yang, X. Zeng, Z. Huang, J. Xiao, J. Wang, G. Zhan, Chem. Eng. J. 397 (2020) 125424. https://doi.org/10.1016/j.cej.2020.125424. [22] H. Jiang C. Wang H. Wang M. Zhang Mater. Lett. 168 2016 17 19 10.1016/j.matlet.2015.12.150 H. Jiang, C. Wang, H. Wang, M. Zhang, Mater. Lett. 168 (2016) 17–19. https://doi.org/10.1016/j.matlet.2015.12.150. [23] L. Yan Y. Liu K. Zha H. Li L. Shi D. Zhang ACS Appl. Mater. Inter. 9 2017 2581 2593 10.1021/acsami.6b15527 L. Yan, Y. Liu, K. Zha, H. Li, L. Shi, D. Zhang, ACS Appl. Mater. Inter. 9 (2017) 2581–2593. https://doi.org/10.1021/acsami.6b15527. [24] L. Zhang L. Shi L. Huang J. Zhang R. Gao D. Zhang ACS Catal. 4 2014 1753 1763 10.1021/cs401185c L. Zhang, L. Shi, L. Huang, J. Zhang, R. Gao, D. Zhang, ACS Catal. 4 (2014) 1753–1763. https://doi.org/10.1021/cs401185c. [25] Z. Fan J. Shi C. Niu B. Wang C. He Y. Cheng Chem. Eng. J. 398 2020 125572 10.1016/j.cej.2020.125572 Z. Fan, J. Shi, C. Niu, B. Wang, C. He, Y. Cheng, Chem. Eng. J. 398 (2020) 125572. https://doi.org/10.1016/j.cej.2020.125572. [26] C. Gao B. Xiao J. Shi C. He B. Wang D. Ma Y. Cheng C. Niu J. Catal. 380 2019 55 67 10.1016/j.jcat.2019.10.003 C. Gao, B. Xiao, J. Shi, C. He, B. Wang, D. Ma, Y. Cheng, C. Niu, J. Catal. 380 (2019) 55–67. https://doi.org/10.1016/j.jcat.2019.10.003. [27] Z. Bitar D. El-Said Bakeer R. Awad J. Phys -Conf. Ser. 869 2017 012045 10.1088/1742-6596/869/1/012045 Z. Bitar, D. El-Said Bakeer, R. Awad, J. Phys.-Conf. Ser. 869 (2017) 012045. https://doi.org/10.1088/1742–6596/869/1/012045. [28] G. Chen G. Song W. Zhao D. Gao Y. Wei C. Li Chem. Eng. J. 352 2018 64 70 10.1016/j.cej.2018.07.003 G. Chen, G. Song, W. Zhao, D. Gao, Y. Wei, C. Li, Chem. Eng. J. 352 (2018) 64–70. https://doi.org/10.1016/j.cej.2018.07.003. [29] C. Li X. Tang H. Yi L. Wang X. Cui C. Chu J. Li R. Zhang Q. Yu Appl. Surf. Sci. 428 2018 924 932 10.1016/j.apsusc.2017.09.131 C. Li, X. Tang, H. Yi, L. Wang, X. Cui, C. Chu, J. Li, R. Zhang, Q. Yu, Appl. Surf. Sci. 428 (2018) 924–932. https://doi.org/10.1016/j.apsusc.2017.09.131. [30] F. Liu H. He Y. Ding C. Zhang Appl. Catal. B-Environ. 93 2009 194 204 10.1016/j.apcatb.2009.09.029 F. Liu, H. He, Y. Ding, C. Zhang, Appl. Catalysis. B-Environ. 93 (2009) 194–204. https://doi.org/10.1016/j.apcatb.2009.09.029. [31] J. Shi G. Gao Z. Fan C. Gao B. Wang Y. Wang Z. Li C. He C. Niu Appl. Catal. A 560 2018 1 11 10.1016/j.apcata.2018.04.033 J. Shi, G. Gao, Z. Fan, C. Gao, B. Wang, Y. Wang, Z. Li, C. He, C. Niu, Appl. Catal. A 560 (2018) 1–11. https://doi.org/10.1016/j.apcata.2018.04.033. [32] P. Wang H. Sun X. Quan S. Chen J. Hazard. Mater. 301 2016 512 521 10.1016/j.jhazmat.2015.09.024 P. Wang, H. Sun, X. Quan, S. Chen, J. Hazard. Mater. 301 (2016) 512–521. https://doi.org/10.1016/j.jhazmat.2015.09.024. [33] C. Gao J. Shi Z. Fan B. Wang Y. Wang C. He X. Wang J. Li C. Niu Appl. Catal. A 564 2018 102 112 10.1016/j.apcata.2018.07.017 C. Gao, J. Shi, Z. Fan, B. Wang, Y. Wang, C. He, X. Wang, J. Li, C. Niu, Appl. Catal. A 564 (2018) 102–112. https://doi.org/10.1016/j.apcata.2018.07.017. [34] W. Shan F. Liu H. He X. Shi C. Zhang Appl. Catal. B-Environ. 115–116 2012 100 106 10.1016/j.apcatb.2011.12.019 W. Shan, F. Liu, H. He, X. Shi, C. Zhang, Appl. Catal. B-Environ. 115–116 (2012) 100–106. https://doi.org/10.1016/j.apcatb.2011.12.019. [35] Y. Peng K. Li J. Li Appl. Catal. B-Environ. 140–141 2013 483 492 10.1016/j.apcatb.2013.04.043 Y. Peng, K. Li, J. Li, Appl. Catal. B-Environ. 140–141 (2013) 483–492. https://doi.org/10.1016/j.apcatb.2013.04.043. [36] Z. Fu G. Zhang W. Han Z. Tang Chem. Eng. J. 426 2021 131334 10.1016/j.cej.2021.131334 Z. Fu, G. Zhang, W. Han, Z. Tang, Chem. Eng. J., 426 (2021) 131334. https://doi.org/10.1016/j.cej.2021.131334. [37] F. Kapteijn L. Singoredjo A. Andreini J.A. Moulijn Appl. Catal. B-Environ. 3 1994 173 189 10.1016/0926-3373(93)E0034-9 F. Kapteijn, L. Singoredjo, A. Andreini, J.A. Moulijn, Appl. Catal. B-Environ. 3 (1994) 173–189. https://doi.org/10.1016/0926–3373(93)E0034–9. [38] D. Fang J. Xie H. Hu H. Yang F. He Z. Fu Chem. Eng. J. 271 2015 23 30 10.1016/j.cej.2015.02.072 D. Fang, J. Xie, H. Hu, H. Yang, F. He, Z. Fu, Chem. Eng. J. 271 (2015) 23–30. https://doi.org/10.1016/j.cej.2015.02.072. [39] R. Foo T. Vazhnova D.B. Lukyanov P. Millington J. Collier R. Rajaram S. Golunski Appl. Catal. B-Environ. 162 2015 174 179 10.1016/j.apcatb.2014.06.034 R. Foo, T. Vazhnova, D.B. Lukyanov, P. Millington, J. Collier, R. Rajaram, S. Golunski, Appl. Catal. B-Environ. 162 (2015) 174–179. http://dx.doi.org/10.1016/j.apcatb.2014.06.034. [40] L. Chen J. Li M. Ge Environ. Sci. Technol. 44 2010 9590 9596 10.1021/es102692b L. Chen, J. Li, M. Ge, Environ. Sci. Technol. 44 (2010) 9590–9596. https://doi.org/10.1021/es102692b. [41] J. Liu X. Li R. Li Q. Zhao J. Ke H. Xiao L. Wang S. Liu M. Tadé S. Wang Appl. Catal. A-Gen. 549 2018 289 301 10.1016/j.apcata.2017.10.010 J. Liu, X. Li, R. Li, Q. Zhao, J. Ke, H. Xiao, L. Wang, S. Liu, M. Tadé, S. Wang, Appl. Catal. A-Gen. 549 (2018) 289–301. https://doi.org/10.1016/j.apcata.2017.10.010. [42] Z. Liu Y. Liu Y. Li H. Su L. Ma Chem. Eng. J. 283 2016 1044 1050 10.1016/j.cej.2015.08.040 Z. Liu, Y. Liu, Y. Li, H. Su, L. Ma, Chem. Eng. J. 283 (2016) 1044–1050. https://doi.org/10.1016/j.cej.2015.08.040. [43] Y. Shu H. Sun X. Quan S. Chen J. Phys. Chem. C. 116 2012 25319 25327 10.1021/jp307038q Y. Shu, H. Sun, X. Quan, S. Chen, J. Phys. Chem. C 116 (2012) 25319–25327. https://doi.org/10.1021/jp307038q. [44] Z. Liu Y. Liu B. Chen T. Zhu L. Ma Catal. Sci. Technol. 6 2016 6688 6696 10.1039/C5CY02278A Z. Liu, Y. Liu, B. Chen, T. Zhu, L. Ma, Catal. Sci. Technol. 6 (2016) 6688–6696. https://doi.org/10.1039/C5CY02278A. [45] X. Huang F. Dong G. Zhang Y. Guo Z. Tang Chem. Eng. J. 419 2021 129572 10.1016/j.cej.2021.129572 X. Huang, F. Dong, G. Zhang, Y. Guo, Z. Tang, Chem. Eng. J., 419 (2021) 129572. https://doi.org/10.1016/j.cej.2021.129572. [46] H. Hu S. Cai H. Li L. Huang L. Shi D. Zhang J. Phys. Chem. C. 119 2015 22924 22933 10.1021/acs.jpcc.5b06057 H. Hu, S. Cai, H. Li, L. Huang, L. Shi, D. Zhang, J. Phys. Chem. C 119 (2015) 22924–22933. https://doi.org/10.1021/acs.jpcc.5b06057. [47] F. Gao X. Tang H. Yi S. Zhao J. Wang T. Gu Appl. Surf. Sci. 466 2019 411 424 10.1016/j.apsusc.2018.09.227 F. Gao, X. Tang, H. Yi, S. Zhao, J. Wang, T. Gu, Appl. Surf. Sci. 466 (2019) 411–424. https://doi.org/10.1016/j.apsusc.2018.09.227. [48] C. Yu D. Hou B. Huang M. Lu R. Peng Z. Zhong J. Hazard. Mater. 399 2020 123011 10.1016/j.jhazmat.2020.123011 C. Yu, D. Hou, B. Huang, M. Lu, R. Peng, Z. Zhong, J. Hazard. Mater. 399 (2020) 123011. https://doi.org/10.1016/j.jhazmat.2020.123011. [49] J. Guan L. Zhou W. Li D. Hu J. Wen B. Huang Catal 11 2021 324 10.3390/catal11030324 J. Guan, L. Zhou, W. Li, D. Hu, J. Wen, B. Huang, Catal. 11 (2021) 324. https://doi.org/10.3390/catal11030324. [50] J. Liu R.-t Guo M.-y Li P. Sun S.-m Liu W.-g Pan S.-w Liu X. Sun Fuel 223 2018 385 393 10.1016/j.fuel.2018.03.062 J. Liu, R.-t Guo, M.-y Li, P. Sun, S.-m Liu, W.-g Pan, S.-w Liu, X. Sun, Fuel 223 (2018) 385–393. https://doi.org/10.1016/j.fuel.2018.03.062. [51] B. Jiang B. Deng Z. Zhang Z. Wu X. Tang S. Yao H. Lu J. Phys. Chem. C. 118 2014 14866 14875 10.1021/jp412828p B. Jiang, B. Deng, Z. Zhang, Z. Wu, X. Tang, S. Yao, H. Lu, J. Phys. Chem. C 118 (2014) 14866–14875. https://doi.org/10.1021/jp412828p. [52] F. Gao X. Tang H. Yi J. Li S. Zhao J. Wang C. Chu C. Li Chem. Eng. J. 317 2017 20 31 10.1016/j.cej.2017.02.042 F. Gao, X. Tang, H. Yi, J. Li, S. Zhao, J. Wang, C. Chu, C. Li, Chem. Eng. J. 317 (2017) 20–31. https://doi.org/10.1016/j.cej.2017.02.042. [53] D. Ye R. Qu H. Song X. Gao Z. Luo M. Ni K. Cen Chem. Eng. J. 283 2016 846 854 10.1016/j.cej.2015.08.020 D. Ye, R. Qu, H. Song, X. Gao, Z. Luo, M. Ni, K. Cen, Chem. Eng. J. 283 (2016) 846–854. http://dx.doi.org/10.1016/j.cej.2015.08.020.",
      "scopus-id": "85133431942",
      "coredata": {
        "eid": "1-s2.0-S0926860X22002770",
        "dc:description": "A novel MnOx catalyst (Mn-MP) derived from MOF-Mn3(BTC)2(H2O)6 was fabricated and investigated for the selective catalytic reduction of NOx by NH3 at low temperatures. Mn-MP catalyst showed a superior activity and noticeably improved tolerance to SO2. The MOF precursor and doping PVP led to large surface area, small particle size and more crystalline defects of Mn-MP catalyst. The formation of abundant acid sites, Mn4+ and surface chemical oxygen would promote the NH3-SCR reaction. In situ DRIFTs demonstrated the high SO2 tolerance over the Mn-MP catalyst not only results from the reduced irreversible sulfurization rate, but also the promoting adsorption of active bidentate nitrates and NH4 + in the coexistence of sulfates. Our work shed light on the design of porous MOF-derived MnOx catalysts with high SO2 resistance at low temperatures.",
        "openArchiveArticle": "false",
        "prism:coverDate": "2022-08-05",
        "openaccessUserLicense": null,
        "prism:aggregationType": "Journal",
        "prism:url": "https://api.elsevier.com/content/article/pii/S0926860X22002770",
        "dc:creator": [
          {
            "@_fa": "true",
            "$": "Chen, Ruiyang"
          },
          {
            "@_fa": "true",
            "$": "Fang, Xiaoyu"
          },
          {
            "@_fa": "true",
            "$": "Li, Zhenguo"
          },
          {
            "@_fa": "true",
            "$": "Liu, Zhiming"
          }
        ],
        "link": [
          {
            "@_fa": "true",
            "@rel": "self",
            "@href": "https://api.elsevier.com/content/article/pii/S0926860X22002770"
          },
          {
            "@_fa": "true",
            "@rel": "scidir",
            "@href": "https://www.sciencedirect.com/science/article/pii/S0926860X22002770"
          }
        ],
        "dc:format": "application/json",
        "openaccessType": null,
        "pii": "S0926-860X(22)00277-0",
        "prism:volume": "643",
        "articleNumber": "118754",
        "prism:publisher": "Elsevier B.V.",
        "dc:title": "Selective catalytic reduction of NOx with NH3 over a novel MOF- derived MnOx catalyst",
        "prism:copyright": "© 2022 Elsevier B.V. All rights reserved.",
        "openaccess": "0",
        "prism:issn": "0926860X",
        "dcterms:subject": [
          {
            "@_fa": "true",
            "$": "Nitrogen oxides"
          },
          {
            "@_fa": "true",
            "$": "NH3-SCR"
          },
          {
            "@_fa": "true",
            "$": "MOF-derived MnOx"
          }
        ],
        "openaccessArticle": "false",
        "prism:publicationName": "Applied Catalysis A: General",
        "openaccessSponsorType": null,
        "prism:pageRange": "118754",
        "pubType": "fla",
        "prism:coverDisplayDate": "5 August 2022",
        "prism:doi": "10.1016/j.apcata.2022.118754",
        "prism:startingPage": "118754",
        "dc:identifier": "doi:10.1016/j.apcata.2022.118754",
        "openaccessSponsorName": null
      },
      "objects": {
        "object": [
          {
            "@category": "standard",
            "@height": "537",
            "@width": "339",
            "@_fa": "true",
            "$": "https://api.elsevier.com/content/object/eid/1-s2.0-S0926860X22002770-gr9.jpg?httpAccept=%2A%2F%2A",
            "@multimediatype": "JPEG image file",
            "@type": "IMAGE-DOWNSAMPLED",
            "@size": "27083",
            "@ref": "gr9",
            "@mimetype": "image/jpeg"
          },
          {
            "@category": "standard",
            "@height": "252",
            "@width": "339",
            "@_fa": "true",
            "$": "https://api.elsevier.com/content/object/eid/1-s2.0-S0926860X22002770-gr3.jpg?httpAccept=%2A%2F%2A",
            "@multimediatype": "JPEG image file",
            "@type": "IMAGE-DOWNSAMPLED",
            "@size": "21481",
            "@ref": "gr3",
            "@mimetype": "image/jpeg"
          },
          {
            "@category": "standard",
            "@height": "271",
            "@width": "339",
            "@_fa": "true",
            "$": "https://api.elsevier.com/content/object/eid/1-s2.0-S0926860X22002770-gr4.jpg?httpAccept=%2A%2F%2A",
            "@multimediatype": "JPEG image file",
            "@type": "IMAGE-DOWNSAMPLED",
            "@size": "30044",
            "@ref": "gr4",
            "@mimetype": "image/jpeg"
          },
          {
            "@category": "standard",
            "@height": "263",
            "@width": "339",
            "@_fa": "true",
            "$": "https://api.elsevier.com/content/object/eid/1-s2.0-S0926860X22002770-gr1.jpg?httpAccept=%2A%2F%2A",
            "@multimediatype": "JPEG image file",
            "@type": "IMAGE-DOWNSAMPLED",
            "@size": "21796",
            "@ref": "gr1",
            "@mimetype": "image/jpeg"
          },
          {
            "@category": "standard",
            "@height": "252",
            "@width": "339",
            "@_fa": "true",
            "$": "https://api.elsevier.com/content/object/eid/1-s2.0-S0926860X22002770-gr2.jpg?httpAccept=%2A%2F%2A",
            "@multimediatype": "JPEG image file",
            "@type": "IMAGE-DOWNSAMPLED",
            "@size": "19477",
            "@ref": "gr2",
            "@mimetype": "image/jpeg"
          },
          {
            "@category": "standard",
            "@height": "247",
            "@width": "339",
            "@_fa": "true",
            "$": "https://api.elsevier.com/content/object/eid/1-s2.0-S0926860X22002770-gr7.jpg?httpAccept=%2A%2F%2A",
            "@multimediatype": "JPEG image file",
            "@type": "IMAGE-DOWNSAMPLED",
            "@size": "12417",
            "@ref": "gr7",
            "@mimetype": "image/jpeg"
          },
          {
            "@category": "standard",
            "@height": "241",
            "@width": "282",
            "@_fa": "true",
            "$": "https://api.elsevier.com/content/object/eid/1-s2.0-S0926860X22002770-gr8.jpg?httpAccept=%2A%2F%2A",
            "@multimediatype": "JPEG image file",
            "@type": "IMAGE-DOWNSAMPLED",
            "@size": "16549",
            "@ref": "gr8",
            "@mimetype": "image/jpeg"
          },
          {
            "@category": "standard",
            "@height": "806",
            "@width": "659",
            "@_fa": "true",
            "$": "https://api.elsevier.com/content/object/eid/1-s2.0-S0926860X22002770-gr5.jpg?httpAccept=%2A%2F%2A",
            "@multimediatype": "JPEG image file",
            "@type": "IMAGE-DOWNSAMPLED",
            "@size": "153743",
            "@ref": "gr5",
            "@mimetype": "image/jpeg"
          },
          {
            "@category": "standard",
            "@height": "547",
            "@width": "339",
            "@_fa": "true",
            "$": "https://api.elsevier.com/content/object/eid/1-s2.0-S0926860X22002770-gr6.jpg?httpAccept=%2A%2F%2A",
            "@multimediatype": "JPEG image file",
            "@type": "IMAGE-DOWNSAMPLED",
            "@size": "49594",
            "@ref": "gr6",
            "@mimetype": "image/jpeg"
          },
          {
            "@category": "standard",
            "@height": "215",
            "@width": "508",
            "@_fa": "true",
            "$": "https://api.elsevier.com/content/object/eid/1-s2.0-S0926860X22002770-sc1.jpg?httpAccept=%2A%2F%2A",
            "@multimediatype": "JPEG image file",
            "@type": "IMAGE-DOWNSAMPLED",
            "@size": "17375",
            "@ref": "sc1",
            "@mimetype": "image/jpeg"
          },
          {
            "@category": "standard",
            "@height": "267",
            "@width": "339",
            "@_fa": "true",
            "$": "https://api.elsevier.com/content/object/eid/1-s2.0-S0926860X22002770-gr14.jpg?httpAccept=%2A%2F%2A",
            "@multimediatype": "JPEG image file",
            "@type": "IMAGE-DOWNSAMPLED",
            "@size": "25149",
            "@ref": "gr14",
            "@mimetype": "image/jpeg"
          },
          {
            "@category": "standard",
            "@height": "328",
            "@width": "376",
            "@_fa": "true",
            "$": "https://api.elsevier.com/content/object/eid/1-s2.0-S0926860X22002770-gr15.jpg?httpAccept=%2A%2F%2A",
            "@multimediatype": "JPEG image file",
            "@type": "IMAGE-DOWNSAMPLED",
            "@size": "50114",
            "@ref": "gr15",
            "@mimetype": "image/jpeg"
          },
          {
            "@category": "standard",
            "@height": "274",
            "@width": "339",
            "@_fa": "true",
            "$": "https://api.elsevier.com/content/object/eid/1-s2.0-S0926860X22002770-gr12.jpg?httpAccept=%2A%2F%2A",
            "@multimediatype": "JPEG image file",
            "@type": "IMAGE-DOWNSAMPLED",
            "@size": "21106",
            "@ref": "gr12",
            "@mimetype": "image/jpeg"
          },
          {
            "@category": "standard",
            "@height": "405",
            "@width": "376",
            "@_fa": "true",
            "$": "https://api.elsevier.com/content/object/eid/1-s2.0-S0926860X22002770-gr13.jpg?httpAccept=%2A%2F%2A",
            "@multimediatype": "JPEG image file",
            "@type": "IMAGE-DOWNSAMPLED",
            "@size": "29482",
            "@ref": "gr13",
            "@mimetype": "image/jpeg"
          },
          {
            "@category": "standard",
            "@height": "265",
            "@width": "339",
            "@_fa": "true",
            "$": "https://api.elsevier.com/content/object/eid/1-s2.0-S0926860X22002770-gr10.jpg?httpAccept=%2A%2F%2A",
            "@multimediatype": "JPEG image file",
            "@type": "IMAGE-DOWNSAMPLED",
            "@size": "15500",
            "@ref": "gr10",
            "@mimetype": "image/jpeg"
          },
          {
            "@category": "standard",
            "@height": "274",
            "@width": "339",
            "@_fa": "true",
            "$": "https://api.elsevier.com/content/object/eid/1-s2.0-S0926860X22002770-gr11.jpg?httpAccept=%2A%2F%2A",
            "@multimediatype": "JPEG image file",
            "@type": "IMAGE-DOWNSAMPLED",
            "@size": "20928",
            "@ref": "gr11",
            "@mimetype": "image/jpeg"
          },
          {
            "@category": "standard",
            "@height": "245",
            "@width": "280",
            "@_fa": "true",
            "$": "https://api.elsevier.com/content/object/eid/1-s2.0-S0926860X22002770-ga1.jpg?httpAccept=%2A%2F%2A",
            "@multimediatype": "JPEG image file",
            "@type": "IMAGE-DOWNSAMPLED",
            "@size": "31637",
            "@ref": "ga1",
            "@mimetype": "image/jpeg"
          },
          {
            "@category": "thumbnail",
            "@height": "163",
            "@width": "103",
            "@_fa": "true",
            "$": "https://api.elsevier.com/content/object/eid/1-s2.0-S0926860X22002770-gr9.sml?httpAccept=%2A%2F%2A",
            "@multimediatype": "GIF image file",
            "@type": "IMAGE-THUMBNAIL",
            "@size": "3062",
            "@ref": "gr9",
            "@mimetype": "image/gif"
          },
          {
            "@category": "thumbnail",
            "@height": "163",
            "@width": "219",
            "@_fa": "true",
            "$": "https://api.elsevier.com/content/object/eid/1-s2.0-S0926860X22002770-gr3.sml?httpAccept=%2A%2F%2A",
            "@multimediatype": "GIF image file",
            "@type": "IMAGE-THUMBNAIL",
            "@size": "7756",
            "@ref": "gr3",
            "@mimetype": "image/gif"
          },
          {
            "@category": "thumbnail",
            "@height": "164",
            "@width": "205",
            "@_fa": "true",
            "$": "https://api.elsevier.com/content/object/eid/1-s2.0-S0926860X22002770-gr4.sml?httpAccept=%2A%2F%2A",
            "@multimediatype": "GIF image file",
            "@type": "IMAGE-THUMBNAIL",
            "@size": "10064",
            "@ref": "gr4",
            "@mimetype": "image/gif"
          },
          {
            "@category": "thumbnail",
            "@height": "164",
            "@width": "211",
            "@_fa": "true",
            "$": "https://api.elsevier.com/content/object/eid/1-s2.0-S0926860X22002770-gr1.sml?httpAccept=%2A%2F%2A",
            "@multimediatype": "GIF image file",
            "@type": "IMAGE-THUMBNAIL",
            "@size": "9193",
            "@ref": "gr1",
            "@mimetype": "image/gif"
          },
          {
            "@category": "thumbnail",
            "@height": "163",
            "@width": "219",
            "@_fa": "true",
            "$": "https://api.elsevier.com/content/object/eid/1-s2.0-S0926860X22002770-gr2.sml?httpAccept=%2A%2F%2A",
            "@multimediatype": "GIF image file",
            "@type": "IMAGE-THUMBNAIL",
            "@size": "6760",
            "@ref": "gr2",
            "@mimetype": "image/gif"
          },
          {
            "@category": "thumbnail",
            "@height": "159",
            "@width": "219",
            "@_fa": "true",
            "$": "https://api.elsevier.com/content/object/eid/1-s2.0-S0926860X22002770-gr7.sml?httpAccept=%2A%2F%2A",
            "@multimediatype": "GIF image file",
            "@type": "IMAGE-THUMBNAIL",
            "@size": "4298",
            "@ref": "gr7",
            "@mimetype": "image/gif"
          },
          {
            "@category": "thumbnail",
            "@height": "164",
            "@width": "192",
            "@_fa": "true",
            "$": "https://api.elsevier.com/content/object/eid/1-s2.0-S0926860X22002770-gr8.sml?httpAccept=%2A%2F%2A",
            "@multimediatype": "GIF image file",
            "@type": "IMAGE-THUMBNAIL",
            "@size": "6748",
            "@ref": "gr8",
            "@mimetype": "image/gif"
          },
          {
            "@category": "thumbnail",
            "@height": "164",
            "@width": "134",
            "@_fa": "true",
            "$": "https://api.elsevier.com/content/object/eid/1-s2.0-S0926860X22002770-gr5.sml?httpAccept=%2A%2F%2A",
            "@multimediatype": "GIF image file",
            "@type": "IMAGE-THUMBNAIL",
            "@size": "14918",
            "@ref": "gr5",
            "@mimetype": "image/gif"
          },
          {
            "@category": "thumbnail",
            "@height": "163",
            "@width": "101",
            "@_fa": "true",
            "$": "https://api.elsevier.com/content/object/eid/1-s2.0-S0926860X22002770-gr6.sml?httpAccept=%2A%2F%2A",
            "@multimediatype": "GIF image file",
            "@type": "IMAGE-THUMBNAIL",
            "@size": "6069",
            "@ref": "gr6",
            "@mimetype": "image/gif"
          },
          {
            "@category": "thumbnail",
            "@height": "93",
            "@width": "219",
            "@_fa": "true",
            "$": "https://api.elsevier.com/content/object/eid/1-s2.0-S0926860X22002770-sc1.sml?httpAccept=%2A%2F%2A",
            "@multimediatype": "GIF image file",
            "@type": "IMAGE-THUMBNAIL",
            "@size": "6637",
            "@ref": "sc1",
            "@mimetype": "image/gif"
          },
          {
            "@category": "thumbnail",
            "@height": "164",
            "@width": "208",
            "@_fa": "true",
            "$": "https://api.elsevier.com/content/object/eid/1-s2.0-S0926860X22002770-gr14.sml?httpAccept=%2A%2F%2A",
            "@multimediatype": "GIF image file",
            "@type": "IMAGE-THUMBNAIL",
            "@size": "8456",
            "@ref": "gr14",
            "@mimetype": "image/gif"
          },
          {
            "@category": "thumbnail",
            "@height": "164",
            "@width": "188",
            "@_fa": "true",
            "$": "https://api.elsevier.com/content/object/eid/1-s2.0-S0926860X22002770-gr15.sml?httpAccept=%2A%2F%2A",
            "@multimediatype": "GIF image file",
            "@type": "IMAGE-THUMBNAIL",
            "@size": "17028",
            "@ref": "gr15",
            "@mimetype": "image/gif"
          },
          {
            "@category": "thumbnail",
            "@height": "164",
            "@width": "203",
            "@_fa": "true",
            "$": "https://api.elsevier.com/content/object/eid/1-s2.0-S0926860X22002770-gr12.sml?httpAccept=%2A%2F%2A",
            "@multimediatype": "GIF image file",
            "@type": "IMAGE-THUMBNAIL",
            "@size": "7255",
            "@ref": "gr12",
            "@mimetype": "image/gif"
          },
          {
            "@category": "thumbnail",
            "@height": "164",
            "@width": "152",
            "@_fa": "true",
            "$": "https://api.elsevier.com/content/object/eid/1-s2.0-S0926860X22002770-gr13.sml?httpAccept=%2A%2F%2A",
            "@multimediatype": "GIF image file",
            "@type": "IMAGE-THUMBNAIL",
            "@size": "10137",
            "@ref": "gr13",
            "@mimetype": "image/gif"
          },
          {
            "@category": "thumbnail",
            "@height": "163",
            "@width": "209",
            "@_fa": "true",
            "$": "https://api.elsevier.com/content/object/eid/1-s2.0-S0926860X22002770-gr10.sml?httpAccept=%2A%2F%2A",
            "@multimediatype": "GIF image file",
            "@type": "IMAGE-THUMBNAIL",
            "@size": "5154",
            "@ref": "gr10",
            "@mimetype": "image/gif"
          },
          {
            "@category": "thumbnail",
            "@height": "164",
            "@width": "202",
            "@_fa": "true",
            "$": "https://api.elsevier.com/content/object/eid/1-s2.0-S0926860X22002770-gr11.sml?httpAccept=%2A%2F%2A",
            "@multimediatype": "GIF image file",
            "@type": "IMAGE-THUMBNAIL",
            "@size": "6801",
            "@ref": "gr11",
            "@mimetype": "image/gif"
          },
          {
            "@category": "thumbnail",
            "@height": "163",
            "@width": "187",
            "@_fa": "true",
            "$": "https://api.elsevier.com/content/object/eid/1-s2.0-S0926860X22002770-ga1.sml?httpAccept=%2A%2F%2A",
            "@multimediatype": "GIF image file",
            "@type": "IMAGE-THUMBNAIL",
            "@size": "17428",
            "@ref": "ga1",
            "@mimetype": "image/gif"
          },
          {
            "@category": "high",
            "@height": "2371",
            "@width": "1497",
            "@_fa": "true",
            "$": "https://api.elsevier.com/content/object/eid/1-s2.0-S0926860X22002770-gr9_lrg.jpg?httpAccept=%2A%2F%2A",
            "@multimediatype": "JPEG image file",
            "@type": "IMAGE-HIGH-RES",
            "@size": "166952",
            "@ref": "gr9",
            "@mimetype": "image/jpeg"
          },
          {
            "@category": "high",
            "@height": "1112",
            "@width": "1497",
            "@_fa": "true",
            "$": "https://api.elsevier.com/content/object/eid/1-s2.0-S0926860X22002770-gr3_lrg.jpg?httpAccept=%2A%2F%2A",
            "@multimediatype": "JPEG image file",
            "@type": "IMAGE-HIGH-RES",
            "@size": "124700",
            "@ref": "gr3",
            "@mimetype": "image/jpeg"
          },
          {
            "@category": "high",
            "@height": "1196",
            "@width": "1497",
            "@_fa": "true",
            "$": "https://api.elsevier.com/content/object/eid/1-s2.0-S0926860X22002770-gr4_lrg.jpg?httpAccept=%2A%2F%2A",
            "@multimediatype": "JPEG image file",
            "@type": "IMAGE-HIGH-RES",
            "@size": "207179",
            "@ref": "gr4",
            "@mimetype": "image/jpeg"
          },
          {
            "@category": "high",
            "@height": "1161",
            "@width": "1497",
            "@_fa": "true",
            "$": "https://api.elsevier.com/content/object/eid/1-s2.0-S0926860X22002770-gr1_lrg.jpg?httpAccept=%2A%2F%2A",
            "@multimediatype": "JPEG image file",
            "@type": "IMAGE-HIGH-RES",
            "@size": "133732",
            "@ref": "gr1",
            "@mimetype": "image/jpeg"
          },
          {
            "@category": "high",
            "@height": "1111",
            "@width": "1497",
            "@_fa": "true",
            "$": "https://api.elsevier.com/content/object/eid/1-s2.0-S0926860X22002770-gr2_lrg.jpg?httpAccept=%2A%2F%2A",
            "@multimediatype": "JPEG image file",
            "@type": "IMAGE-HIGH-RES",
            "@size": "115385",
            "@ref": "gr2",
            "@mimetype": "image/jpeg"
          },
          {
            "@category": "high",
            "@height": "1089",
            "@width": "1497",
            "@_fa": "true",
            "$": "https://api.elsevier.com/content/object/eid/1-s2.0-S0926860X22002770-gr7_lrg.jpg?httpAccept=%2A%2F%2A",
            "@multimediatype": "JPEG image file",
            "@type": "IMAGE-HIGH-RES",
            "@size": "65095",
            "@ref": "gr7",
            "@mimetype": "image/jpeg"
          },
          {
            "@category": "high",
            "@height": "1064",
            "@width": "1247",
            "@_fa": "true",
            "$": "https://api.elsevier.com/content/object/eid/1-s2.0-S0926860X22002770-gr8_lrg.jpg?httpAccept=%2A%2F%2A",
            "@multimediatype": "JPEG image file",
            "@type": "IMAGE-HIGH-RES",
            "@size": "102582",
            "@ref": "gr8",
            "@mimetype": "image/jpeg"
          },
          {
            "@category": "high",
            "@height": "3560",
            "@width": "2911",
            "@_fa": "true",
            "$": "https://api.elsevier.com/content/object/eid/1-s2.0-S0926860X22002770-gr5_lrg.jpg?httpAccept=%2A%2F%2A",
            "@multimediatype": "JPEG image file",
            "@type": "IMAGE-HIGH-RES",
            "@size": "734766",
            "@ref": "gr5",
            "@mimetype": "image/jpeg"
          },
          {
            "@category": "high",
            "@height": "2417",
            "@width": "1497",
            "@_fa": "true",
            "$": "https://api.elsevier.com/content/object/eid/1-s2.0-S0926860X22002770-gr6_lrg.jpg?httpAccept=%2A%2F%2A",
            "@multimediatype": "JPEG image file",
            "@type": "IMAGE-HIGH-RES",
            "@size": "357744",
            "@ref": "gr6",
            "@mimetype": "image/jpeg"
          },
          {
            "@category": "high",
            "@height": "950",
            "@width": "2245",
            "@_fa": "true",
            "$": "https://api.elsevier.com/content/object/eid/1-s2.0-S0926860X22002770-sc1_lrg.jpg?httpAccept=%2A%2F%2A",
            "@multimediatype": "JPEG image file",
            "@type": "IMAGE-HIGH-RES",
            "@size": "78295",
            "@ref": "sc1",
            "@mimetype": "image/jpeg"
          },
          {
            "@category": "high",
            "@height": "1178",
            "@width": "1497",
            "@_fa": "true",
            "$": "https://api.elsevier.com/content/object/eid/1-s2.0-S0926860X22002770-gr14_lrg.jpg?httpAccept=%2A%2F%2A",
            "@multimediatype": "JPEG image file",
            "@type": "IMAGE-HIGH-RES",
            "@size": "160187",
            "@ref": "gr14",
            "@mimetype": "image/jpeg"
          },
          {
            "@category": "high",
            "@height": "1451",
            "@width": "1663",
            "@_fa": "true",
            "$": "https://api.elsevier.com/content/object/eid/1-s2.0-S0926860X22002770-gr15_lrg.jpg?httpAccept=%2A%2F%2A",
            "@multimediatype": "JPEG image file",
            "@type": "IMAGE-HIGH-RES",
            "@size": "259257",
            "@ref": "gr15",
            "@mimetype": "image/jpeg"
          },
          {
            "@category": "high",
            "@height": "1211",
            "@width": "1497",
            "@_fa": "true",
            "$": "https://api.elsevier.com/content/object/eid/1-s2.0-S0926860X22002770-gr12_lrg.jpg?httpAccept=%2A%2F%2A",
            "@multimediatype": "JPEG image file",
            "@type": "IMAGE-HIGH-RES",
            "@size": "132194",
            "@ref": "gr12",
            "@mimetype": "image/jpeg"
          },
          {
            "@category": "high",
            "@height": "1792",
            "@width": "1663",
            "@_fa": "true",
            "$": "https://api.elsevier.com/content/object/eid/1-s2.0-S0926860X22002770-gr13_lrg.jpg?httpAccept=%2A%2F%2A",
            "@multimediatype": "JPEG image file",
            "@type": "IMAGE-HIGH-RES",
            "@size": "179177",
            "@ref": "gr13",
            "@mimetype": "image/jpeg"
          },
          {
            "@category": "high",
            "@height": "1171",
            "@width": "1497",
            "@_fa": "true",
            "$": "https://api.elsevier.com/content/object/eid/1-s2.0-S0926860X22002770-gr10_lrg.jpg?httpAccept=%2A%2F%2A",
            "@multimediatype": "JPEG image file",
            "@type": "IMAGE-HIGH-RES",
            "@size": "91979",
            "@ref": "gr10",
            "@mimetype": "image/jpeg"
          },
          {
            "@category": "high",
            "@height": "1212",
            "@width": "1497",
            "@_fa": "true",
            "$": "https://api.elsevier.com/content/object/eid/1-s2.0-S0926860X22002770-gr11_lrg.jpg?httpAccept=%2A%2F%2A",
            "@multimediatype": "JPEG image file",
            "@type": "IMAGE-HIGH-RES",
            "@size": "135081",
            "@ref": "gr11",
            "@mimetype": "image/jpeg"
          },
          {
            "@category": "high",
            "@height": "1085",
            "@width": "1241",
            "@_fa": "true",
            "$": "https://api.elsevier.com/content/object/eid/1-s2.0-S0926860X22002770-ga1_lrg.jpg?httpAccept=%2A%2F%2A",
            "@multimediatype": "JPEG image file",
            "@type": "IMAGE-HIGH-RES",
            "@size": "237177",
            "@ref": "ga1",
            "@mimetype": "image/jpeg"
          },
          {
            "@category": "standard",
            "@_fa": "true",
            "$": "https://api.elsevier.com/content/object/eid/1-s2.0-S0926860X22002770-mmc1.docx?httpAccept=%2A%2F%2A",
            "@multimediatype": "Microsoft Word file",
            "@type": "APPLICATION",
            "@size": "3112672",
            "@ref": "mmc1",
            "@mimetype": "application/word"
          },
          {
            "@category": "thumbnail",
            "@_fa": "true",
            "$": "https://api.elsevier.com/content/object/eid/1-s2.0-S0926860X22002770-si0001.svg?httpAccept=%2A%2F%2A",
            "@multimediatype": "Scalable Vector Graphics file",
            "@type": "ALTIMG",
            "@size": "3817",
            "@ref": "si0001",
            "@mimetype": "image/svg+xml"
          },
          {
            "@category": "thumbnail",
            "@_fa": "true",
            "$": "https://api.elsevier.com/content/object/eid/1-s2.0-S0926860X22002770-si0002.svg?httpAccept=%2A%2F%2A",
            "@multimediatype": "Scalable Vector Graphics file",
            "@type": "ALTIMG",
            "@size": "5961",
            "@ref": "si0002",
            "@mimetype": "image/svg+xml"
          },
          {
            "@category": "thumbnail",
            "@_fa": "true",
            "$": "https://api.elsevier.com/content/object/eid/1-s2.0-S0926860X22002770-si0003.svg?httpAccept=%2A%2F%2A",
            "@multimediatype": "Scalable Vector Graphics file",
            "@type": "ALTIMG",
            "@size": "3051",
            "@ref": "si0003",
            "@mimetype": "image/svg+xml"
          },
          {
            "@category": "thumbnail",
            "@_fa": "true",
            "$": "https://api.elsevier.com/content/object/eid/1-s2.0-S0926860X22002770-si0004.svg?httpAccept=%2A%2F%2A",
            "@multimediatype": "Scalable Vector Graphics file",
            "@type": "ALTIMG",
            "@size": "1989",
            "@ref": "si0004",
            "@mimetype": "image/svg+xml"
          },
          {
            "@category": "standard",
            "@_fa": "true",
            "$": "https://api.elsevier.com/content/object/eid/1-s2.0-S0926860X22002770-am.pdf?httpAccept=%2A%2F%2A",
            "@multimediatype": "Acrobat PDF file",
            "@type": "AAM-PDF",
            "@size": "1366053",
            "@ref": "am",
            "@mimetype": "application/pdf"
          }
        ]
      },
      "link": {
        "@rel": "abstract",
        "@href": "https://api.elsevier.com/content/abstract/scopus_id/85133431942"
      }
    }
  }
}