{
  "metadata": {
    "title": "High value utilization of inferior diesel for BTX production: Mechanisms, catalysts, conditions and challenges",
    "authors": "; ; ",
    "journal": "Applied Catalysis A: General",
    "date": "2021-04-25",
    "doi": "10.1016/j.apcata.2021.118095",
    "abstract": "",
    "uri": "https://api.elsevier.com/content/article/pii/S0926860X21001095",
    "pii": "S0926860X21001095"
  },
  "fulltext": {
    "full-text-retrieval-response": {
      "scopus-eid": "2-s2.0-85102870779",
      "originalText": "serial JL 271346 291210 291744 291809 31 Applied Catalysis A: General APPLIEDCATALYSISAGENERAL 2021-03-15 2021-03-15 2021-03-19 2021-03-19 2021-04-14T00:52:17 1-s2.0-S0926860X21001095 S0926-860X(21)00109-5 S0926860X21001095 10.1016/j.apcata.2021.118095 S300 S300.1 FULL-TEXT 1-s2.0-S0926860X21X00063 2024-01-01T12:34:28.416125Z 0 0 20210425 2021 2021-03-15T16:20:24.883372Z absattachment articleinfo articlenumber articletitlenorm authfirstinitialnorm authfirstsurnamenorm cid cids contenttype copyright crossmark dateloaded dateloadedtxt datesearch datesort dateupdated dco docsubtype doctype doi eid ewtransactionid hubeid indexeddate issn issnnorm itemstage itemtransactionid itemweight openaccess openarchive pg pgfirst pii piinorm pubdatestart pubdatetxt pubyr sortorder srctitle srctitlenorm srctype ssids alllist content subj subheadings suppl tomb volfirst volissue volumelist webpdf webpdfpagecount yearnav figure table body acknowledge affil articletitle auth authfirstini authfull authkeywords authlast grantnumber grantsponsor grantsponsorid highlightsabst primabst ref specialabst 0926-860X 0926860X true 616 616 C Volume 616 10 118095 118095 118095 20210425 25 April 2021 2021-04-25 2021 article rev © 2021 Elsevier B.V. All rights reserved. HIGHVALUEUTILIZATIONINFERIORDIESELFORBTXPRODUCTIONMECHANISMSCATALYSTSCONDITIONSCHALLENGES CHEN F 1 Introduction 2 Hydrocracking reaction 2.1 Components in LCO 2.2 Effects of nitrogen compounds on the hydrocracking reaction 2.3 Hydrocracking reaction network of components to produce BTX 2.3.1 Hydrocracking reaction network of aromatics to produce BTX 2.3.2 Hydrocracking reaction network of cycloalkane to help to produce BTX 3 Development of hydrocracking catalysts 3.1 Catalyst components 3.2 Active phase 3.2.1 Noble metal catalyst 3.2.2 Non-noble metal catalyst 3.3 Supports 3.4 Modification of supports 3.5 The interaction between metal and support 4 Improved process conditions for hydrocracking and related technologies 4.1 Effect of temperature 4.2 Effect of pressure 4.3 Effect of space velocity 4.4 Hydrocracking technology 5 Current problems and the development of diesel hydrocracking 6 Conclusion Acknowledgements References AKLILU 2020 109530 A ZHOU 2018 171 181 W CORMA 2007 3 16 A YIN 2011 441 448 H SINTARAKO 2015 89 94 P JU 2012 538 543 X 2020 UNITEDSTATESENVIRONMENTALPROTECTIONAGENCY SONG 2018 540 544 H 2014 WORLDWIDEFUELSPECIFICATIONS RICARDO 2014 A 2012SUMMARYREPORTEUFUELQUALITYMONITORING PALOS 2019 13064 13075 R REN 2020 104958 X WANG 2021 106600 Y LAREDO 2017 10939 10948 G GIM 2019 6285 6296 M SANHOOB 2020 116624 M GALADIMA 2016 618 629 A LAREDO 2018 7315 7321 G KIM 2016 1715 1719 E CALEMMA 2010 770 776 V JAROSZEWSKA 2015 116 130 K PENG 2020 123461 C PENG 2016 149 153 C GUTIERREZ 2012 504 515 A ESCALONA 2018 270 278 G CELISCORNEJO 2016 012010 C WIWEL 2020 3184 3193 P CHAHEN 2017 10752 10759 L PENG 2019 1090 1097 C CHO 2014 35 42 K LIU 2008 860 866 Z HABAKI 2019 1159 1166 H KIM 2004 1093 1109 S KIM 2003 179 199 S SHENG 2018 4979 4987 Q NGUYEN 2019 1467 1472 M CELISCORNEJO 2019 2602 C RAITH 1982 169 J SAU 2005 112 119 M NAGAI 1986 52 M LAVOPA 1988 375 V GUTBERLET 1983 246 L GALPERIN 2001 257 L MIGNARD 1997 271 S KOBAYASHI 2007 44 M ARGYLE 2015 145 M RIBEIRO 1982 267 F MENDES 2019 167 176 P LEE 2014 237 243 S FURIMSKY 1999 381 E LAREDO 2001 103 G HUGHES 1989 1747 1748 R GAEIRO 2007 8 15 G BETANCOURT 2013 21 25 P DING 2009 17 23 L YUN 2014 647 655 G AZIZI 2013 172 178 N DING 2007 229 238 L SULLIVAN 1964 183 195 R KIM 2014 133 138 Y FAN 2013 42 46 H RESTREPOGARCIA 2016 98 109 J YANG 2010 232 237 J ISHIHARA 2013 222 227 A SHEN 2019 469 477 Z ZHAO 2016 1324 1330 M CHOI 2015 140 150 Y CALEMMA 2013 763 770 V INFANTESMOLINA 2005 239 248 A CORMA 2001 34 44 A SATO 1999 45 K MOSTAD 1990 119 141 H ABBOT 1989 833 J CORMA 1991 307 A FERRAZ 2010 51 57 S WEITKAMP 1982 550 J MIKI 1995 137 146 Y PARK 2013 627 632 J WU 2018 1015 1025 T SAPRE 1981 68 73 A BANERJEE 2011 152 169 S YANG 2014 12264 12269 H KORRE 1997 2041 2050 S CHAREONPANICH 1996 927 931 M LEITE 2001 241 247 L BELTRAMONE 2008 7161 7166 A KORRE 1995 101 117 S QIAN 1999 81 88 W CELISCORNEJO 2018 8715 8726 C PINILLA 2013 303 308 J PINILLA 2014 729 735 J FAN 2011 1474 1479 H LIU 2018 222 229 Z ZHANG 1998 361 366 Z MCVICKER 2002 137 148 G ALSABAWI 2012 511 523 M ALSABAWI 2009 1538 1558 M WANG 2012 1152 1158 Q ZHANG 2009 3057 3062 S KUBICKA 2004 65 79 D KANGAS 2010 1172 1175 M ALSABAWI 2010 626 644 M HAYES 1983 401 409 H ZHANG 2016 703 711 H JAROSZEWSKA 2003 376 387 K DING 2006 435 445 L USMAN 2015 M HERNANDEZHUESCA 2001 122 132 R ARRIBAS 2004 111 119 M ARRIBAS 2002 203 217 M JACQUIN 2003 131 141 M ARDAKANI 2011 36 47 S RODRIGUEZCASTELLON 2004 9 18 E CASTANO 2012 1509 1519 P SAMOILA 2013 207 219 P SANTI 2013 46 57 D DU 2010 1655 1661 M DELDARI 2005 1 10 H WARD 1993 55 85 J KIRUMAKKI 2006 319 331 S SCHWARZ 1995 477 510 J REYESDELATORRE 2009 55 62 A RAN 2009 55 59 T ARDAKANI 2007 9 19 S LIU 2011 454 458 X SHIN 2017 12 21 J UPARE 2016 99 107 D LEE 2016 144 153 J MOULI 2009 77 84 K KIM 2017 67 78 Y SAAB 2020 83 103 R ELANGOVAN 2003 388 395 S SATO 1998 367 374 K MOSTAD 1990 105 117 H TANG 2012 721 726 J LIN 2021 116105 Y CIFUENTES 2020 117568 B ZHANG 2019 110567 Y KONNO 2013 25 33 H PUJRO 2015 123 130 R OH 2019 86 98 Y BARBOSA 2004 109 113 F CORMA 1996 375 382 A XIN 2017 6968 6976 L REN 2019 7886 7891 S LEE 2016 1715 1719 Y LIU 2011 454 458 X CHENG 2009 1061 1065 Y JIAO 2017 269 282 J BENAZZI 2003 376 387 E AGUILARTAPIA 2016 515 523 A WANG 2016 95 106 Z SAYED 2017 127 131 H LV 2018 13889 13894 L MAMUN 2018 06JF02 M LEE 2003 171 180 J LIANG 2018 155 167 J ZHANG 2016 20 23 Y WU 2020 5546 5556 T XU 2017 839 850 J QIU 2013 73 78 S ZHANG 2019 8185 8197 B OCONNOR 2018 531 539 N ZECEVIC 2015 245 254 J GUTIERREZ 2012 653 660 A CHAREONPANICH 1995 1636 1640 M DING 2007 25 37 L SANTIKUNAPORN 2004 100 113 M GUTIERREZ 2012 5897 5904 A ISHIGAKI 1999 31 40 S UPARE 2017 356 363 D GUTIERREZ 2012 8 15 A BISTH 2014 321 335 D JOHNSON 2007 J AM0740 SIMANZHENKOV 2010 953 963 V HUANG 2013 2263 2266 X WANG 2018 605 612 Q MANEK 2019 298 304 E CHENX2021X118095 CHENX2021X118095XF 2023-03-19T00:00:00.000Z 2023-03-19T00:00:00.000Z http://creativecommons.org/licenses/by-nc-nd/4.0/ © 2021 Elsevier B.V. All rights reserved. 2021-03-17T02:24:02.910Z http://vtw.elsevier.com/data/voc/AddOnTypes/50.7/eoas NSFC National Natural Science Foundation of China http://data.elsevier.com/vocabulary/SciValFunders/501100001809 http://sws.geonames.org/1814991 National Postdoctoral Program for Innovative Talents http://data.elsevier.com/vocabulary/SciValFunders/501100012152 http://sws.geonames.org/1814991 https://doi.org/10.15223/policy-017 https://doi.org/10.15223/policy-037 https://doi.org/10.15223/policy-012 https://doi.org/10.15223/policy-029 https://doi.org/10.15223/policy-004 item S0926-860X(21)00109-5 S0926860X21001095 1-s2.0-S0926860X21001095 10.1016/j.apcata.2021.118095 271346 2024-01-01T12:34:28.416125Z 2021-04-25 1-s2.0-S0926860X21001095-main.pdf https://s3-eu-west-1.amazonaws.com/prod-ucs-content-store-eu-west/content/pii:S0926860X21001095/MAIN/application/pdf/f8a9b9cf3b299477603aa2c1cca038a8/main.pdf main.pdf pdf true 2755023 MAIN 15 1-s2.0-S0926860X21001095-main_1.png https://s3-eu-west-1.amazonaws.com/prod-ucs-content-store-eu-west/content/pii:S0926860X21001095/PREVIEW/image/png/8103b0ebc872aa7bd68fde6ea42f23f6/main_1.png main_1.png png 55066 849 656 IMAGE-WEB-PDF 1 1-s2.0-S0926860X21001095-gr5.jpg https://s3-eu-west-1.amazonaws.com/prod-ucs-content-store-eu-west/content/pii:S0926860X21001095/gr5/DOWNSAMPLED/image/jpeg/234c9a68fe45eb4184142500818620a2/gr5.jpg gr5 gr5.jpg jpg 23790 305 565 IMAGE-DOWNSAMPLED 1-s2.0-S0926860X21001095-gr6.jpg https://s3-eu-west-1.amazonaws.com/prod-ucs-content-store-eu-west/content/pii:S0926860X21001095/gr6/DOWNSAMPLED/image/jpeg/7498a982d5f926dd5127d5076ec6dabe/gr6.jpg gr6 gr6.jpg jpg 35616 359 565 IMAGE-DOWNSAMPLED 1-s2.0-S0926860X21001095-gr7.jpg https://s3-eu-west-1.amazonaws.com/prod-ucs-content-store-eu-west/content/pii:S0926860X21001095/gr7/DOWNSAMPLED/image/jpeg/3abff8c856e391b62026d5df7eb60d96/gr7.jpg gr7 gr7.jpg jpg 17054 157 470 IMAGE-DOWNSAMPLED 1-s2.0-S0926860X21001095-gr8.jpg https://s3-eu-west-1.amazonaws.com/prod-ucs-content-store-eu-west/content/pii:S0926860X21001095/gr8/DOWNSAMPLED/image/jpeg/66938d6300ebf3c2f5c497f424111bf6/gr8.jpg gr8 gr8.jpg jpg 31323 254 470 IMAGE-DOWNSAMPLED 1-s2.0-S0926860X21001095-gr1.jpg https://s3-eu-west-1.amazonaws.com/prod-ucs-content-store-eu-west/content/pii:S0926860X21001095/gr1/DOWNSAMPLED/image/jpeg/41b2603038cb17c4670c0e50d6c016b0/gr1.jpg gr1 gr1.jpg jpg 15663 163 565 IMAGE-DOWNSAMPLED 1-s2.0-S0926860X21001095-gr2.jpg https://s3-eu-west-1.amazonaws.com/prod-ucs-content-store-eu-west/content/pii:S0926860X21001095/gr2/DOWNSAMPLED/image/jpeg/3c6958fe238bf29e289ccf849eb76b2c/gr2.jpg gr2 gr2.jpg jpg 37424 342 565 IMAGE-DOWNSAMPLED 1-s2.0-S0926860X21001095-ga1.jpg https://s3-eu-west-1.amazonaws.com/prod-ucs-content-store-eu-west/content/pii:S0926860X21001095/ga1/DOWNSAMPLED/image/jpeg/f3f83528833ab15129905e839f20234f/ga1.jpg ga1 true ga1.jpg jpg 19706 200 385 IMAGE-DOWNSAMPLED 1-s2.0-S0926860X21001095-gr3.jpg https://s3-eu-west-1.amazonaws.com/prod-ucs-content-store-eu-west/content/pii:S0926860X21001095/gr3/DOWNSAMPLED/image/jpeg/172258c6a30344a28259e74ad1d1d458/gr3.jpg gr3 gr3.jpg jpg 34109 376 565 IMAGE-DOWNSAMPLED 1-s2.0-S0926860X21001095-gr4.jpg https://s3-eu-west-1.amazonaws.com/prod-ucs-content-store-eu-west/content/pii:S0926860X21001095/gr4/DOWNSAMPLED/image/jpeg/2891c6652746a601c6b3690d61760600/gr4.jpg gr4 gr4.jpg jpg 55865 500 565 IMAGE-DOWNSAMPLED 1-s2.0-S0926860X21001095-gr5.sml https://s3-eu-west-1.amazonaws.com/prod-ucs-content-store-eu-west/content/pii:S0926860X21001095/gr5/THUMBNAIL/image/gif/755a6761b24144edc3998d70c417f50d/gr5.sml gr5 gr5.sml sml 3840 118 219 IMAGE-THUMBNAIL 1-s2.0-S0926860X21001095-gr6.sml https://s3-eu-west-1.amazonaws.com/prod-ucs-content-store-eu-west/content/pii:S0926860X21001095/gr6/THUMBNAIL/image/gif/7c6b53d540f1caa73082741461301fc6/gr6.sml gr6 gr6.sml sml 5202 139 219 IMAGE-THUMBNAIL 1-s2.0-S0926860X21001095-gr7.sml https://s3-eu-west-1.amazonaws.com/prod-ucs-content-store-eu-west/content/pii:S0926860X21001095/gr7/THUMBNAIL/image/gif/8a36b8ef6eaf9072d8ab5de25dccee21/gr7.sml gr7 gr7.sml sml 6320 73 219 IMAGE-THUMBNAIL 1-s2.0-S0926860X21001095-gr8.sml https://s3-eu-west-1.amazonaws.com/prod-ucs-content-store-eu-west/content/pii:S0926860X21001095/gr8/THUMBNAIL/image/gif/1a84b6b6d70eafe6bbfb50ee123347fb/gr8.sml gr8 gr8.sml sml 5157 118 219 IMAGE-THUMBNAIL 1-s2.0-S0926860X21001095-gr1.sml https://s3-eu-west-1.amazonaws.com/prod-ucs-content-store-eu-west/content/pii:S0926860X21001095/gr1/THUMBNAIL/image/gif/88ec8bad3043d307568d5666b9711fab/gr1.sml gr1 gr1.sml sml 2987 63 219 IMAGE-THUMBNAIL 1-s2.0-S0926860X21001095-gr2.sml https://s3-eu-west-1.amazonaws.com/prod-ucs-content-store-eu-west/content/pii:S0926860X21001095/gr2/THUMBNAIL/image/gif/e3b524cb9ecf76a5844b0aac64d7936d/gr2.sml gr2 gr2.sml sml 5808 133 219 IMAGE-THUMBNAIL 1-s2.0-S0926860X21001095-ga1.sml https://s3-eu-west-1.amazonaws.com/prod-ucs-content-store-eu-west/content/pii:S0926860X21001095/ga1/THUMBNAIL/image/gif/d03d40e782070cf0e693b25d7d8e9a13/ga1.sml ga1 true ga1.sml sml 6106 114 219 IMAGE-THUMBNAIL 1-s2.0-S0926860X21001095-gr3.sml https://s3-eu-west-1.amazonaws.com/prod-ucs-content-store-eu-west/content/pii:S0926860X21001095/gr3/THUMBNAIL/image/gif/c0e0cad515ae198c4cb0d3cb83f5af2f/gr3.sml gr3 gr3.sml sml 5630 146 219 IMAGE-THUMBNAIL 1-s2.0-S0926860X21001095-gr4.sml https://s3-eu-west-1.amazonaws.com/prod-ucs-content-store-eu-west/content/pii:S0926860X21001095/gr4/THUMBNAIL/image/gif/cc7ed2d47cbd62a81a8d34ba8f65c651/gr4.sml gr4 gr4.sml sml 6513 164 185 IMAGE-THUMBNAIL 1-s2.0-S0926860X21001095-gr5_lrg.jpg https://s3-eu-west-1.amazonaws.com/prod-ucs-content-store-eu-west/content/pii:S0926860X21001095/gr5/HIGHRES/image/jpeg/071b06783938485d64b81431640f5af2/gr5_lrg.jpg gr5 gr5_lrg.jpg jpg 173029 1348 2500 IMAGE-HIGH-RES 1-s2.0-S0926860X21001095-gr6_lrg.jpg https://s3-eu-west-1.amazonaws.com/prod-ucs-content-store-eu-west/content/pii:S0926860X21001095/gr6/HIGHRES/image/jpeg/ae708e7d46f6a94174ec878093db8b7d/gr6_lrg.jpg gr6 gr6_lrg.jpg jpg 246643 1588 2500 IMAGE-HIGH-RES 1-s2.0-S0926860X21001095-gr7_lrg.jpg https://s3-eu-west-1.amazonaws.com/prod-ucs-content-store-eu-west/content/pii:S0926860X21001095/gr7/HIGHRES/image/jpeg/00e555b30be669e9d6711346625d1e5a/gr7_lrg.jpg gr7 gr7_lrg.jpg jpg 152326 698 2083 IMAGE-HIGH-RES 1-s2.0-S0926860X21001095-gr8_lrg.jpg https://s3-eu-west-1.amazonaws.com/prod-ucs-content-store-eu-west/content/pii:S0926860X21001095/gr8/HIGHRES/image/jpeg/143bfbb661ff56e91d3960144e56e995/gr8_lrg.jpg gr8 gr8_lrg.jpg jpg 198221 1126 2083 IMAGE-HIGH-RES 1-s2.0-S0926860X21001095-gr1_lrg.jpg https://s3-eu-west-1.amazonaws.com/prod-ucs-content-store-eu-west/content/pii:S0926860X21001095/gr1/HIGHRES/image/jpeg/4c061e37228bdabb71d1080f33ac6def/gr1_lrg.jpg gr1 gr1_lrg.jpg jpg 107781 722 2500 IMAGE-HIGH-RES 1-s2.0-S0926860X21001095-gr2_lrg.jpg https://s3-eu-west-1.amazonaws.com/prod-ucs-content-store-eu-west/content/pii:S0926860X21001095/gr2/HIGHRES/image/jpeg/7a31cd7715ed970c4da006f3d4d405d6/gr2_lrg.jpg gr2 gr2_lrg.jpg jpg 250831 1515 2500 IMAGE-HIGH-RES 1-s2.0-S0926860X21001095-ga1_lrg.jpg https://s3-eu-west-1.amazonaws.com/prod-ucs-content-store-eu-west/content/pii:S0926860X21001095/ga1/HIGHRES/image/jpeg/a477bddd32cd1a8e881e00658f44f8a1/ga1_lrg.jpg ga1 true ga1_lrg.jpg jpg 148953 886 1707 IMAGE-HIGH-RES 1-s2.0-S0926860X21001095-gr3_lrg.jpg https://s3-eu-west-1.amazonaws.com/prod-ucs-content-store-eu-west/content/pii:S0926860X21001095/gr3/HIGHRES/image/jpeg/615404409926c753e9afd55e9509fcc5/gr3_lrg.jpg gr3 gr3_lrg.jpg jpg 223563 1664 2500 IMAGE-HIGH-RES 1-s2.0-S0926860X21001095-gr4_lrg.jpg https://s3-eu-west-1.amazonaws.com/prod-ucs-content-store-eu-west/content/pii:S0926860X21001095/gr4/HIGHRES/image/jpeg/30b2c9fbf12b1293696bc9c4d0ec3004/gr4_lrg.jpg gr4 gr4_lrg.jpg jpg 379793 2212 2500 IMAGE-HIGH-RES 1-s2.0-S0926860X21001095-am.pdf am am.pdf pdf 1418700 AAM-PDF https://s3-eu-west-1.amazonaws.com/prod-ucs-content-store-eu-west/content/egi:104L5VB6MG7/MAIN/application/pdf/12250ad3e2f28af5a16e15cdd3cc9f87/am.pdf APCATA 118095 118095 S0926-860X(21)00109-5 10.1016/j.apcata.2021.118095 Elsevier B.V. Fig. 1 Reaction network of naphthalene hydrocracking system [67]. Fig. 1 Fig. 2 Reaction network of tetralin hydrocracking system [70]. Fig. 2 Fig. 3 Reaction network of methylnaphthalene hydrocracking system [77]. Fig. 3 Fig. 4 Reaction network of phenanthrene hydrogenation and hydrocracking system [88]. Fig. 4 Fig. 5 Reaction network of anthracene hydrogenation and hydrocracking system [90–92]. Fig. 5 Fig. 6 Reaction network of decalin hydrocracking system [100]. Fig. 6 Fig. 7 Composition of hydrocracking catalysts. Fig. 7 Fig. 8 Scheme of 1-methylnaphthalene hydrocracking reactions that use a bifunctional catalyst [164]. Fig. 8 Table 1 Physical properties and chemical composition of LCO from different refineries. Table 1 Items Maoming LCO [22] Zhenhai LCO [23] Repsol YPF LCO [24] Density, g/cm3 0.950 0.961 0.936 Distillation range, °C IBP- T50 157−273 195−284 101−277 T95- FBP 365−371 379−389 392−466 Chemical analysis, wt% C 87.54 89.14 88.70 H 10.94 9.96 10.20 S 1.48 0.79 0.50 N 0.040 0.11 0.20 Alkanes content, wt% 23.7 13.4 18.9 Cycloalkanes content, wt% 11.8 8.3 14.3 Aromatics content, wt% 64.5 78.3 66.8 Cetane number 27.5 21.5 27 Table 2 The content distribution of aromatics with different cyclic numbers in LCO (wt%). Table 2 Aromatics Reference [29] Reference [30] Reference [31] Mono-Aromatics 24.0 14.3 19.0 Di-Aromatics 46.9 40.6 46.5 Tri-Aromatics 7.4 19.4 5.8 Total 78.3 74.3 71.3 Table 3 Mass fractions of identified aromatics in different LCO. Table 3 Reference [32] Reference [33] Reference [34] Di-aromatics Mass fraction Di-aromatics Mass fraction Di-aromatics Mass fraction Naphthalene 0.00646 Naphthalene 0.015 Naphthalene 0.01218 2-Methylnaphthalene 0.0374 2-Methylnaphthalene 0.030 2-Methylnaphthalene 0.01165 1-Methylnaphthalene 0.0217 1-Methylnaphthalene 0.018 1-Methylnaphthalene 0.02604 Fluorene 0.00424 Dimethylnaphthalene 0.091 Dimethylnaphthalene 0.05120 Tri-aromatics Mass fraction Tri-aromatics Mass fraction Phenylnaphthalene 0.0038 Phenanthrene 0.005 Phenanthrene 0.00975 Anthracene 0.00227 2-Methylanthracene 0.00508 9-Methylanthracene 0.00319 Table 4 Categories of nitrogen compounds existed in LCO [38]. Table 4 Neutral organic nitrogen Basic organic nitrogen Weakly basic organic nitrogen Phenenthridines Pyridines Indoles Quinolines Carbazoles Anilines Derivatives of alkyl, phenyl and naphthyl Table 5 The industrial data of technologies for hydrocracking inferior diesel to produce BTX. Table 5 Items LCO-X [173,174] ARO [175] FD2G [176] LTAG RLG Country America Canada China China China Company UOP NOVA Sinopec Sinopec Sinopec Raw materials LCO LCO FCC diesel FCC diesel LCO Bifunctional catalysts Active phase Mo, Fe Pd Ni, W Ni, W Ni, Mo, W Support — Molecular sieves Y, Al2O3 USY, ZHP — Temperature, °C — 350−410 390−400 390−405 380−420 Pressure, MPa — 3−5 8−10 8−10 4.9−6.0 Space velocity, h−1 — — LHSV = 0.6−1.0 LHSV = 0.7−0.8 — Aromatics yield, % ∼44 19 32 17 35 Note: “—” means no available data in published literatures. Table 6 The data of processes for hydrocracking inferior diesel to produce BTX. Table 6 Items Reference [177] Reference [178] Reference [179] Reference [180] Reference [181] Reference [182] Raw materials Model LCO Hydrogenated LCO LCO LCO LCO LCO/HDT oil Bifuncational catalysts Active phase Cu, Cr, Ag, Pd, Pt — Pt, Pb, Sn and In Ca, Sr Ga, Zn, P Support Mordenite, silica and alumina MCM-22 Y, Al, Si Rare earth Faujasite mordenite and Beta Beta ZSM-5 Temperature, °C 430 315−538 600 549 400−650 540 Pressure, MPa 6.9 0.34−3.4 0.24 0.2 0.1−2.0 0.3 Space velocity, h−1 LHSV = 2.0 LHSV = 0.5−10.0 WHSV = 27.2 WHSV = 27.2 — LHSV = 0.4 Aromatics yield, % −29 33 43.6 21 45 49−51 High value utilization of inferior diesel for BTX production: Mechanisms, catalysts, conditions and challenges Feng Chen a Guohao Zhang a XiaoYi Weng a Yuhao Zhang a Liang Zhao a * Liyuan Cao a Jinsen Gao a Chunming Xu a Xiangqi Liu b Xuhui Gao b a State Key Laboratory of Heavy Oil Processing, China University of Petroleum, Beijing, 102249, PR China State Key Laboratory of Heavy Oil Processing China University of Petroleum Beijing 102249 PR China 1State Key Laboratory of Heavy Oil Processing, China University of Petroleum, Beijing 102249, PR China b Hebei Jingzhi Technology Co., LTD, Hebei, 061000, PR China Hebei Jingzhi Technology Co., LTD Hebei 061000 PR China 2Hebei Jingzhi Technology Co., LTD, Hei bei 061000, PR China ⁎ Corresponding author at: State Key Laboratory of Heavy Oil Processing, China University of Petroleum (Beijing), 18 Fuxue Road, Beijing, 102249, PR China. State Key Laboratory of Heavy Oil Processing China University of Petroleum (Beijing) 18 Fuxue Road Beijing 102249 PR China Graphical abstract With the peak in diesel consumption and the impact of new energy in the coming years, research will be focused on the treatment of excess diesel. In addition, low carbon aromatics such as benzene, toluene, and xylene (BTX) are important chemical raw materials that will be in high demand in the next few years but are still in short supply. Thus, many researchers have proposed the use of excess diesel, especially the inferior diesel-like light cycle oil (LCO) to produce BTX. The hydrocracking process is typically used to convert LCO to BTX. To provide some guidance on this topic, this review summarizes the typical group compositions in LCO from different refineries, hydrocracking reaction mechanisms of aromatics and cycloalkanes in LCO, hydrocracking catalysts, improved hydrocracking conditions, related hydrocracking technologies, and future developments in the production of BTX. The amount of aromatics with different ring numbers in LCO has been clearly analyzed, and their part types have also been studied. However, some complex types of aromatics in LCO remain unknown. In addition, the hydrocracking mechanisms and pathways of aromatics in LCO to produce BTX have garnered great attention since the 1990s. Based on this, hydrocracking catalysts and related technologies have been developed by many institutions and corporations to convert aromatics to BTX; however, there are still some problems including an insufficient selectivity of BTX, low yield of liquid products, and excessive energy consumption. In the future, more advanced technologies can be applied to analyze all types of aromatics in LCO, which, along with the aid and application of computational chemistry tools, could help deepen the understanding of the reaction pathways of aromatics and develop more efficient catalysts by balancing the properties of the active phase and supporting the surmounting of current shortcomings. Owing to this high value utilization of inferior diesel, the upcoming problem of diesel surplus can be solved effectively, and the utilization of LCO to produce BTX is one possible path. Keywords Inferior diesel LCO BTX Reaction mechanism Catalysts Technology 1 Introduction In recent years, the output of refined oil has increased significantly with increases in the refinement capacity of many countries. However, a problem arises with this improvement in petroleum product production. That is, the worldwide production of diesel will be excessive in the next few years. At the same time, petroleum resources are becoming increasingly tight. Moreover, the rise of new energy has had a huge impact on traditional fuel oil; thus, fully treating the coming excessive diesel is a key point in the rational utilization of resources [1]. Catalytic diesel, especially for light cycle oil (LCO), which is the light diesel fraction from catalytic cracking units, is a typical inferior diesel because it has high sulfur (up to 40000 ppm), nitrogen (higher than 600 ppm), and aromatic (up to 90 wt%) contents and a low cetane number (approximately 27, far less than the lowest standard, which is 51 in America) [2–4]. SOx and NOx are formed when sulfur and nitrogen compounds are burned in engines, which leads to air pollution and shortens the life of the engine [5]. In addition, aromatics not only decrease the cetane number of diesel but also increase the difficulty and energy consumption of other relative pretreatment processes for the inferior diesel [6]. Environmental protection has recently become a vital issue in industrial production. Thus, a new standard for commercial diesel has been implemented in many countries and regions [7–10], which further limits the content of aromatics in LCO, especially that of polycyclic aromatic hydrocarbons (PAHs), because their existence in inferior diesel will increase particulate emissions when burned and simultaneously decrease the stability, ignition performance, combustion performance, and cetane number of the diesel [11]. In conclusion, the industrial structure must be adjusted to realize a high value and clean utilization of LCO. Low-carbon aromatics such as benzene, toluene, and xylene (BTX) are important chemical raw materials, and their demand will continue to increase in the coming years [12,13]. The worldwide increase in paraxylene (PX) demand, for example, will remain at a rate of 3.5 % over the next five years, especially in the Asia-Pacific region, because it is a major producer of plastics and synthetic fibers [14]. Because of the increasing demand for downstream products, the BTX growth rate of need is much higher than the demand for refined oil [15]. The high content of potential aromatics in LCO and its inferior properties make it a good candidate for the production of light aromatics. Therefore, upgrading LCO to BTX through hydrocracking has attracted great interest as chemical materials are currently more valuable than liquid fuels [16]. To optimize a refinery’s product distribution, the use of the surplus diesel capacity to increase the production of chemical materials such as BTX, which are in short supply, and to realize the high value utilization of diesel has become a hot research topic. In 2016, Laredo et al. [14] presented a review of the hydrocracking process for obtaining fuel-enriched BTX from model mixtures under different experimental conditions and summarized the distribution of products after hydrocracking using different catalysts. In the same year, Galadima et al. [17] reviewed the design of suitable catalysts for the hydrocracking of PAHs in LCO and the production of light aromatics. Another review, also written by Laredo and his colleagues in 2018 [18], presented related content about using LCO to produce BTX. They clearly summarized the hydrotreating-hydrocracking procedure for producing light aromatics from real feed. However, the reaction mechanism and catalysts have not been systematically demonstrated, especially for catalysts. It is widely acknowledged that the properties of catalysts, such as acidity, porosity, and metal properties, exert a prominent influence on the reaction. It is worth mentioning that most of the current research is primarily focused on these areas [19–21]. To clarify the entire LCO hydrocracking process to produce BTX, starting from an analysis of the properties of LCO, this paper systematically reviews the current high-value technologies to produce BTX from diesel from the aspects of reaction mechanism, catalysts, improved conditions, and technical advantages and disadvantages, and further analyzes the key points for the future development of these technologies, which may help researchers to understand the current status in this area. 2 Hydrocracking reaction 2.1 Components in LCO The physical properties and chemical compositions of LCO produced by different refineries vary. Table 1 shows the physical properties and composition of LCO from the three refineries [22–24]. It can be seen that the components in LCO can be classified into alkanes, cycloalkanes, aromatics, and impurities (sulfur and nitrogen compounds). It is worth mentioning that the aromatic content of LCO is higher than 60 wt%, which significantly reduces the quality and cetane number of commercial diesel after blending [25]. Moreover, there are relatively high amounts of sulfur (higher than 0.05 wt%) and nitrogen (higher than 0.086 wt%) in LCO, which pollutes the environment when it is burned. In addition, the existence of nitrogen compounds (especially basic nitrogen compounds) leads to the inactivation of catalysts because the catalysts used in hydrocracking usually possess acidic properties [26–28]. Many researchers [29–31] have analyzed the distribution of aromatics with different cyclic numbers in LCO, and the results are shown in Table 2 . It is obvious that mono-aromatics and di-aromatics constitute most of the aromatics in LCO and that the mono-aromatic side chain can be easily broken to generate light aromatics. Therefore, the conversion of di-aromatics to BTX has become the main challenge for researchers. In addition, the di-aromatic types in LCO have been evaluated by some scholars [32–34] using gas chromatography mass spectrometry (GC–MS) or other technologies. It can be seen from Table 3 that the di-aromatics in LCO are mainly composed of naphthalene and its derivatives, of which methylnaphthalene consists most, so they are usually used as model compounds by researchers when studying hydrocracking. In addition, phenanthrene, anthracene, and their derivatives are the typical tri-aromatics; thus, many scholars are also studying their hydrocracking. In summary, LCO is a typical inferior diesel, and it has many potential aromatics from which to produce BTX. It is worthy studying the hydrocracking mechanism of its components, especially the di-aromatics, and the effect of nitrogen compounds on hydrocracking catalysts to maximize the productivity of BTX. 2.2 Effects of nitrogen compounds on the hydrocracking reaction The catalysts used in the process of hydrocracking are mainly bifunctional catalysts that consist of an active phase and support, which is usually a molecular sieve with acid sites [35,36]. It is well known that organic nitrogen, especially the basic nitrogen compounds in LCO, has a strong adsorption effect on the acid center of supports [37], which leads to a deactivation of the catalysts. Thus, the nitrogen content of the feedstock should be strictly limited. To protect hydrocracking catalysts, it is of great significance to study the influence of nitrogen compounds, the understanding of which can provide direct theoretical guidance for the development of new nitrogen compound-resistant hydrocracking catalysts. Until now, studies on the influence of nitrogen compounds on catalysts have mainly focused on two aspects. The adsorption properties of different types of organic nitrogen on hydrocracking catalysts have been studied. Nitrogen compounds are broadly classified into three categories, as shown in Table 4 [38]. The results of GC–MS, et al. showed that indoles and carbazoles account for the majority of LCO, while anilines and quinolines constitute a small part [39]. Because hydrocracking catalysts have acid sites, basic organic nitrogen could exert a strong inhibitory effect on the catalysts [40–42]. Typically, basic organic nitrogen is first converted to NH3, which is less basic, by hydrotreatment. Several studies have found a substantial reduction in the activity of molecular sieve catalysts in the presence of NH3 [43–45] by the neutralization of Brønsted acid sites. This is because the adsorption of nitrogen-containing molecules on Brønsted acid sites is stronger than that of hydrocarbons [46,47]. Research by Mendes et al. [48] also proved this result, and they found that the fraction of Brønsted acid sites that was inhibited was larger than 98 % because of the adsorption of NH3, indicating that the Brønsted acid sites are nearly saturated by NH3 molecules when using NiMo/USY catalysts in hydrocracking vacuum gas oil. Moreover, Lee et al. [49] found that an increase in the concentration of Lewis acid sites helps to improve the resistance to poisoning by nitrogen compounds when using Pt–Mg/ZSM-23 and Pt–Pd–Mg/ZSM-23 to hydrocrack n-hexadecane. Thus, basic organic nitrogen seems to have a larger influence on Brønsted acid sites than Lewis acid sites. However, the hydrocracking reaction usually requires a relatively strong Brønsted acid; therefore, it is desirable to remove the basic nitrogen compounds from the feed before hydrocracking. Some studies on the inhibition of neutral organic nitrogen compounds have been reported [50,51]. Laredo et al. [51] reported that the inhibiting effect of non-basic compounds is also very strong, even at concentrations as low as 5 ppm. This is because these nitrogen compounds directly absorb on the hydrocracking catalyst in the reaction without being converted to NH3. The influence mechanism of nitrogen compounds on the hydrocracking reaction can be further understood by studying the reaction performance of nitrogen compounds on different catalysts. Scherzer and Butt et al. [52] attributed the poisoning of hydrocracking catalysts to the deactivation of the active metals caused by the adsorption of nitrogen compounds on the active phase of the catalysts. Corma et al. [53] studied the poisoning mechanism of alkaline nitrogen compounds on hydrocracking catalysts and reported that alkaline nitrogen compounds are not only adsorbed on the acid center but also induce the adsorption of other alkaline nitrogen compounds, leading to a deactivation of the catalyst. To prevent the catalysts from being poisoned by nitrogen compounds, a hydrotreating process is often used to remove the nitrogen compounds from the feed. However, aromatics are usually significantly saturated by traditional hydrogenation, leading to a loss of BTX yield. For example, Betancourt et al. [54] used NiMoV series catalysts to remove nitrogen compounds from LCO by hydrotreating. The results showed that although approximately 95 % of the nitrogen compounds were removed, nearly 33 % of the aromatics were saturated after the hydrotreatment process. Ding et al. [55] used a hydrotreating process to decrease the content of nitrogen compounds from 495.6 ppm to as low as 1.45 ppm; however, the mass fraction of aromatics in LCO decreased from 72.8 % to 87.6 %. The same phenomenon has also been observed in other studies [56–58]. From these studies, it was found that the aromatics will suffer a loss through the hydrotreating process to remove the nitrogen compounds from LCO. In fact, aromatics are inevitably saturated during the hydrotreatment process. To avoid such a loss, some researchers have developed nitrogen-compound-resistant catalysts to convert LCO to BTX without a hydrotreating process, and these catalysts are clearly introduced in Section 3.3. In conclusion, nitrogen compounds have a significant influence on hydrocracking catalysts. Although the types and reaction mechanisms of nitrogen compounds on the catalysts have been well studied, catalysts being developed to resist the nitrogen compounds are still in laboratory research; therefore, the LCO used to produce BTX still requires hydrotreating to remove the nitrogen compounds, which adds to the cost and complexity of the entire process. In the future, more nitrogen-compound-resistant catalysts should be developed to help produce BTX. In the development of catalysts, researchers should pay more attention to the protection of Brønsted acid from poisoning by nitrogen compounds. 2.3 Hydrocracking reaction network of components to produce BTX 2.3.1 Hydrocracking reaction network of aromatics to produce BTX Studies on the reaction mechanism and pathways of reactants can maximize the yields of ideal products. Control of the direction of the reaction also helps to reduce its energy consumption. Aromatics are the main resource in LCO to produce BTX; therefore, research on the reaction network of aromatics to produce BTX is important. The content of PAHs in LCO is higher than that of monocyclic aromatic hydrocarbons (MAHs) [59]; therefore, studies on the hydrocracking of aromatics to BTX mainly consider PAHs (such as naphthalene, anthracene, and phenanthrene) as model compounds [60–62]. The hydrocracking reaction of PAHs to BTX is an essentially catalytic cracking carbocation reaction, and it generally includes hydrogenation, isomerization, hydrogen transfer, ring opening, cracking, and dehydrogenation condensation coking, in which the hydrogenation and cracking reactions are predominant [63]. Next, the hydrocracking mechanism and pathways of bicyclic and tricyclic aromatic hydrocarbons are introduced. Diaromatics (mainly including naphthalene and its derivatives) are the major constituent of PAHs; therefore, the hydrocracking network of diaromatics is fundamentally considered by researchers [64–66]. Choi et al. [67] used naphthalene as a model compound to describe the hydrogenation and hydrocracking reactions of bicyclic aromatic hydrocarbons, as shown in Fig. 1 . To produce BTX from naphthalene hydrocracking, it is necessary to hydrogenate naphthalene to tetralin. Then, the tetralin is converted to BTX by hydrocracking. The side reaction is that tetralin can be further hydrogenated to decalin and then cracked to diesel, liquefied petroleum gas (LPG), and naphtha. Calemma et al. [68] also believed that naphthalene could be hydrogenated to tetralin, and tetralin could be further hydrogenated to decalin, or it could be opened to form alkylbenzene, LPG, and naphtha. Infantes-Molina et al. [69] reported the first generation of tetralin in the hydrogenation and hydrocracking of naphthalene. To study the subsequent path of the tetralin hydrocracking reaction, Corma et al. [70] studied the cracking and hydrogenation of tetralin. From their research, hydrocracking tetralin reactions include dealkylation, transalkylation, isomerization, cracking, and hydrogen transfer reactions, of which the cracking reaction obeys the carbon ion reaction mechanism. The literature [71] affirmed that the tetralin hydrocracking reaction can be initiated by bimolecular and unimolecular mechanisms, of which the former accounts for the formation of phenylbutyl tetralin (PBT). At a relatively high temperature, the formation of PBT is negligible, and, as a result, the unimolecular mechanism takes charge, covering the attack of a Brønsted site on the aromatic ring [72] or naphthenic ring [73,74]. The opening of the naphthenic ring to form alkenyl and alkyl-benzenes can be explained by the β-Scission and protolytic cracking reactions of the resultant carbenium and carbonium ions. Ferraz et al. [75] also proved that the cracking of the naphthenic ring opening begins at the β position. It is worth mentioning that the isomerization reaction can be initiated through the PCP mechanism [76], which may account for the contraction of the ring and formation of methylindanes and methylindenes. In conclusion, the β-Scission reaction is key for producing alkyl benzene and further generating BTX in the hydrocracking of tetralin. The hydrocracking network of tetralin, illustrated by Corma et al., is shown in Fig. 2 . For naphthalene derivatives, the hydrocracking mechanism and pathway of methylnaphthalene have been studied by many researchers. Miki et al. [77] clearly illustrated the reaction pathways of 1-methylnaphthalene and 2-methylnaphthalene. The results showed that the hydrocracking of methylnaphthalene involves a series of complex parallel reactions with more than 100 products, mainly including the following six types: (1) isomerization products; (2) partial hydrogenation products: methyl tetrahydronaphthalene and its isomers; (3) complete hydrogenation products: methyl decarbonaphthalene and its isomers; (4) ring-opening products: C11 alkyl benzene; (5) broken side chain after ring-opening products: low-carbon alkyl benzene; (6) isomerization and ring-unopened products: indene and alkyl-substituted indene. The entire methylnaphthalene pathway is shown in Fig. 3 . Park et al. [78] pointed out that the benzene ring without methyl is first hydrogenated because of the low steric stabilization. Then, hydrogenation and hydrocracking reactions occur on the hydrogenated products to form saturated hydrocarbons of methyl benzene. Wu et al. [79] believed that there is a transition state with a five-membered ring between the hydrogenated products and alkyl benzene, which is similar to the pathway of hydrocracking tetralin through the PCP mechanism. Moreover, some studies [80,81] proved that the hydrogenation of the first benzene ring in PAHs (e.g., naphthalene, 1-methylnaphthalene) is thermodynamically more likely to occur than the hydrogenation saturation of a single cyclic aromatic hydrocarbon (e.g., tetrahydronaphthalene, ninhydrin, and alkylbenzene). As expected, the first step was observed during the hydrogenation of methylnaphthalene, and naphthalene hydrogenation followed a similar pathway. Currently, it is generally believed that the hydrocracking reaction of tricyclic aromatics (such as anthracene, phenanthrene, and their homologs) also occurs in stages. The hydrogenation reaction of phenanthrene has been studied since 1990 [82–85]. The hydrogenation network of phenanthrene can be divided into three types: reaction network 1 proposed by Beltramone et al. [86], reaction network 2 proposed by Korre et al. [87], and reaction network 3 proposed by Qian et al. [88], as shown in Fig. 4 . From their research, it was found that the hydrogenation reaction of phenanthrene is a reversible reaction, and hydrogenation products are converted between the five substances (left-side pathway shown in Fig. 4). For the hydrocracking reaction of phenanthrene, Celis-Cornejo et al. [89] studied the three hydrocracking reaction paths of phenanthrene: (1) hydrocracking of the middle ring, (2) isomerization, ring-opening, and cracking of phenanthrene through complete hydrogenation; and (3) hydrocracking of the side ring. Phenanthrene is prioritized in the third reaction pathway; that is, one of the side rings of phenanthrene is hydrogenated and then cracked to generate dicyclic aromatics, or both end rings are hydrogenated and then cracked to generate monocyclic aromatics (right-side pathway shown in Fig. 4). It is a pity that no further hydrogenation and cracking reactions were introduced to form a total hydrocracking network of hydrophenanthrene to produce BTX. Anthracene is another type of tricyclic aromatic hydrocarbon that is typically used to research hydrocracking networks. The hydrogenation and cracking of anthracene involve three pathways. Pinilla et al. [90,91] found that anthracene can be translated to biphenyl by turning the middle ring into a transition state, or it can be translated to naphthalene by the hydrogenation and cracking of the side ring, as shown in Fig. 5 . Han et al. [92] thought that the middle ring of anthracene could be directly hydrogenated and cracked to form alkyl benzene, and Liu et al. [93] and Zhang et al. [94] used different catalyst systems to prove the existence of the ring-opening reaction after the hydrogenation of the middle ring. Obviously, the pathway of the middle ring hydrogenation and cracking consumes the least amount of hydrogen. Therefore, if the catalytic reaction process of anthracene can be accurately controlled, it can improve the yield of BTX and greatly reduce the consumption of hydrogen and energy. 2.3.2 Hydrocracking reaction network of cycloalkane to help to produce BTX It is of great importance to study the hydrocracking reaction mechanism of cycloalkanes because the PAHs will be hydrogenated to the corresponding cycloalkane before cracking to BTX. The study of the hydrocracking network of cycloalkanes can help researchers to develop catalysts for hydrocracking PAHs to BTX, and their hydrocracking mechanism has been studied for many years. For different carbon numbers of the one-ring cycloalkane, it is recognized that the inner stress of the ternary and quaternary rings is high, and the ring opening can easily occur. The study found that the internal stress of the five-membered ring cycloalkane is 6–7 kcal/mol and that of the six-membered ring cycloalkane is 1 kcal/mol, which indicates that the six-membered ring cycloalkane is relatively stable. The sequence of internal stress in different ring numbers of cycloalkanes is C3 > C4 > > C5–C7 > > C6 [95]. Al-sabawi et al. [96,97] studied the reaction of cyclohexane on auria-acid bifunctional catalysts, and they considered that the acid sites promote the isomerism of six-membered rings to five-membered rings, followed by an acceleration of the ring-opening reaction. On the acid supports, a six-membered ring on the Brønsted sites of the support carry forward the plasmolysis (PC), which follows the positive carbon ion mechanism, and then develops the contraction ring (RC), which is the cracking reaction [70]. The reaction mechanism and pathway of the one-ring cycloalkane are the same as those of the ring-opening reaction of tetralin to produce BTX. To further study the reaction pathway of the cycloalkane mechanism, the hydrocracking pathway of dicyclic cycloalkanes, whose structure is similar to that of naphthalene, has been studied. The ring-opening reaction of the double-ring cycloalkane was found to be more effective for bifunctional catalysts [98,99]. In addition, the ring-opening reaction of dicyclic cycloalkanes follows the positive carbon ion mechanism, which is identical to the hydrocracking of tetralin to produce BTX. Kubicka et al. [100] clearly discussed the hydrogenation and ring-opening reactions of decalin molecules on bifunctional catalysts and proposed a reaction pathway, as shown in Fig. 6 . As shown in the reaction process in Fig. 6, decalin undergoes a series of reactions during hydrocracking. The dehydrogenation of decalin on the metal site first forms an olefin before desorption, then moves to the nearby acid site to form positive carbon ions. The formed positive carbon ions undergo skeleton isomerization, hydrogen transfer, olefin desorption-adsorption, β-fracture, and ring opening. The product leaves the acid site and moves to the metal site for hydrogenation, and finally detaches from the catalyst. In addition, the ring-opening products can only be detected when the isomerization reaction is carried out, which indicates that the initial reaction of the hydrocracking process of decalin is the isomerization reaction, and the subsequent reaction is the ring-opening reaction. Their research showed that the isomerization reaction of decalin plays an important role in the initial reaction. The same results were reported by Kangas et al. [101], who studied the reaction path of the decalin open-loop reaction under a bifunctional catalyst (Pt/H-Beta), modeled the open-loop reaction, and proposed the relevant reaction path. The model shows that the ring-opening products are mainly generated by the isomers of decalin. The main intermediate in the open-ring reaction is the 2-D shrinkage isomer, and the isomer with the highest activation energy is the 3-D isomer. Al-sabawi et al. [102] theoretically proved that the isomerization reaction plays an important role in the initial reaction. It is clear that the hydrocracking reaction networks of naphthalene, methylnaphthalene, and tetralin to produce BTX have been fully studied. However, side reactions such as coking are rarely taken into consideration, as the entire reaction networks of the di-aromatics have not been proposed; therefore, research on molecular dynamics and lump kinetics is rare. In future research, more studies that combine the reaction network and kinetics could be considered for researchers to design the catalysts more reasonably. Catalysts play an important role in catalytic reactions. The development of suitable catalysts (including adjustments in acid and pores) can facilitate the hydrocracking reaction proceeding in the desired direction according to the reaction networks. In the next section, we introduce the catalysts currently used in the hydrocracking of aromatics to produce BTX. 3 Development of hydrocracking catalysts 3.1 Catalyst components Generally, the catalysts used are bifunctional owing to hydrogenation and crack activity and are mainly composed of an active phase and support. The components of the hydrocracking catalysts are shown in Fig. 7 . The hydrogenation activity of the catalyst mainly comes from the active phase, and it can also stabilize the acid sites [103,104], which can be divided into precious metals (Pt, Pd, etc.) and non-precious metals (metal oxides or sulfides of group VIB and VIII elements). Acid sites are the source of the cracking and isomerization activity of hydrocracking catalysts and are mainly provided by supports (usually molecular sieves such as Y, Beta, et al.). The supports include weak acid and acid supports, which mainly have the functions of increasing the effective surface area of the catalysts to attach the reactants, providing an appropriate pore structure for reactants and products, offering acid centers to realize the cracking reaction, improving the mechanical strength and thermal stability of the catalyst, and increasing the anti-toxic ability of the catalyst [70]. The weak acid support is mainly oxide alumina, and the acid supports are aluminum silicate, magnesium silicate, and some kinds of molecular sieves, which are often used together to regulate the acid properties of catalysts [105]. It is worth mentioning that molecular sieves with medium and strong acids are generally used as supports for the hydrocracking of aromatic hydrocarbons. In addition, some types of additives are often used to improve the dispersity of the active phase on the supports, modify the acid properties, and improve the pore structure of the catalysts. To achieve selective hydrogenation and cracking reactions, the active phase and support of the catalyst must be well matched [106]. 3.2 Active phase To obtain a high BTX yield, it is necessary to control the hydrogenation depth of the catalysts. The main factors affecting the hydrogenation depth are the type and amount of metal, the bimetallic ratio, and the dispersion state of the metal on the support. The hydrogenation activity of metals is most closely related to their type and chemical properties, because the electronic properties of metals determine the binding strength between the reactants and surface metal atoms. The metals used in hydrocracking include noble metals and non-noble metals [107,108]. 3.2.1 Noble metal catalyst Noble metals such as Pt, Pd, Ru, and Rh have been used in the hydrocracking of PAHs for many years. The carbon-carbon double bond of aromatic molecules can be activated by noble metals with lattice spacings of 0.36–0.38 nm. These noble metal catalysts are widely used because of their high efficiency in deep hydrogenation [108]. For example, Arribas [109] used Pt as the active phase for hydrocracking tetralin, and a yield of 35 % aromatics could be obtained at 325 °C, 3 MPa, and a H2/tetralin molar ratio of 10. Arribas and Martinez [110] used Pt supported on H-USY with different Si/Al ratios (2.6–27.6) as catalysts to convert methylnaphthalene to low carbon aromatics, and they compared the reaction activity of these catalysts. The results showed that the Pt/H-USY (Si/Al = 6.0) catalyst had a high light aromatic selectivity (approximately 50 %) due to its moderate acidity. Jacquin et al. [111] found that the hydrogenation and cracking activities of naphthalene on Rh and Ru catalysts were higher than those of Pt and Ir at 300 °C, and a relatively high yield of ring-opening products such as alkyl-benzene could be obtained. Noble metals have a higher hydrogenation activity than non-noble metals. Ardakani et al. [112] compared the hydrogenation and ring opening of naphthalene, tetralin, and decalin over Mo2C/HY and Pd/HY catalysts. The results showed that the conversion rates of all reactants on the Pd/HY catalyst were higher than those on the Mo2C/HY catalyst under the same conditions. However, the over-hydrogenation of PAHs to polycycloalkanes occurs because of the high hydrogenation activity of noble metals, which reduces the yield of BTX. Thus, it is desirable to cut the hydrogenation activity of noble metals reasonably. In fact, the introduction of noble metals can modify the acid properties of the supports. Rodriguez-Castellon et al. [113] researched the ring opening reaction of tetralin on a noble metal catalyst supported on ZrO2/SiO2 under the conditions of 350 °C and hydrogen pressure of 6 MPa and found that the acid properties of the catalysts and relative selectivity were closely related to the noble metal. All metals, including Pt, Pd, Rh, and Pd-Pt alloys, could decrease the acidity of the support after loading, and the Pd-Pt alloy could reduce the acid content of the support from 1048 to 778 μmol/g, which was due to the load of metal particles covering the acid sites of the support. With the improved acidity, the catalysts of Pd-Pt alloys supported on ZrO2/SiO2 exhibited better BTX selectivity, and the yield of BTX was 23 %. However, the sulfur content in inferior diesel should be limited when using Pt, Pd, and other noble metals as the active phase, because the noble metals are poisoned by sulfur compounds [114]. In addition, noble metal catalysts used in naphthalene hydrocracking give a high selectivity to decalin rather than tetralin when the conversion rate of naphthalene is high owing to the high hydrogenation activity of noble metals [115–117], which leads to a low yield of BTX. The price of noble metals is high, which limits their application in industry [118]. Thus, non-noble metals have been developed as the active phase owing to their high resistance to sulfur compounds, moderate hydrogenation activity, and low price. 3.2.2 Non-noble metal catalyst Non-noble metal catalysts mainly include supported metal sulfides, nitrogen compounds, carbides, phosphides, and non-supported catalysts [119–121]. Transition metal sulfides are the main active phases of hydrocracking catalysts. Commonly, the transition metals used include Ni, Co, Mo, W, and their mixtures (NiW, NiMo, CoMo, CoW) [122,123]. The main goal of the utilization of non-noble metals is to offer the hydrogenation activity of catalysts and modify the acidity of the supports. The use of a single metal as the active phase can also offer hydrogenation activity, and different amounts of metal have a strong influence on the acid of the supports. Ardakani et al. [124] supported Mo2C on H–Y molecular sieves with different Si/Al ratios. They found that unsupported Mo2C particles were inactive and non-selective. In addition, the ring-opening reaction activity of the H–Y molecular sieve was very low under the same reaction conditions. However, when 7.4 wt% Mo2C was loaded on the H–Y molecular sieve, the yield of ring-opening products reached 33 %. The modified catalyst has a bifunctional effect because the reaction takes place on the Mo2C metal particles and H–Y support. The acid content of the H–Y molecular sieve decreased after loading the Mo2C metal particles. Liu and Smith [125] prepared Mo2C/H–Y catalysts with different amounts of Mo2C (7–27 wt%) using the impregnation method. Naphthalene was used as the reactant, and the activity of the catalyst was investigated at 300 °C and 3 MPa. The acid content of the H–Y molecular sieve decreased from 0.84 mmol/g to 0.32 mmol/g after loading 27 % of Mo2C, and the yield of ring opening products showed a similar downward trend. The main reason for the decrease in acid content is the ion exchange between Mo and the H–Y molecular sieve. Usually, a single metal is not sufficient to offer hydrogenation activity and modify the acid properties of the support, and the metallic function and acidity must be further controlled [126]. Thus, bi-metals such as Ni-Sn, Ni-Mo, Co-Mo, and Ni-W have been developed. Upare et al. [127] studied the synergistic effect of Co addition in a Mo/H-beta catalyst. The total acid content of Mo/H-Beta and CoMo/H-Beta catalysts decreased from 1.36 mmol/g to 1.17 and 1.12 mmol/g, respectively. Therefore, the addition of Co further modified the acidity of the catalyst, which improved the conversion rate of tetralin and the yield of BTX. After the Co modification, the conversion rate of tetralin increased from 93.7 to 99.5 % at 370 °C and 8 MPa. The yield of BTX also increased from 61.1. to 62.6 %. The reasons for the above results were that the introduction of Co enhanced the hydrogenation activity of the catalyst and inhibited the formation of coking products. Lee et al. [128] found that the hydrocracking of tetralin over Ni/H-Beta catalysts was non-selective, and a low yield of BTX but high yields of gas and paraffin products were obtained owing to the strong hydrogenation activity of the catalysts. They added some Sn content to suppress the hydrogenation activity by forming Ni-Sn intermetallic compounds, and the catalysts showed yields of BTX and BTX + C9 aromatics as high as 48.1 wt% and 53.1 wt%, respectively. With the use of a polymetallic catalyst, the effect of non-noble catalysts can be equivalent to that of noble catalysts. Mouli et al. [129] found that the yield of ring-opening products of dechydronaphthene on a NiMoC/HY catalyst was 33.7 % at 240 °C, which was equivalent to that of the Pt-Ir/HY catalyst (about 32 %) at 220 °C. Ni2P is considered to be the most active phosphide for the hydrocracking of PAHs to BTX. Kim et al. [130] found that the conversion rate of naphthalene on the Ni2P catalyst was 99 %, and the yield of BTX reached 94.4 %. In conclusion, a poor toxicity resistance, high price, and high hydrogenation activity are disadvantages of noble metal catalysts. Future research may focus on enhancing the anti-poisoning ability of precious metals, increasing the life of noble metal catalysts, and modifying their hydrogenation activity. Non-noble metal catalysts have received more attention due to their good selectivity for BTX, low price, and high toxicity resistance; to further increase the yield of BTX, the support should have a certain structure and acidity to match with the metal. 3.3 Supports The supports also significantly affect the activity and selectivity of the catalysts. The supports used in hydrocracking usually include non-zeolites (such as γ-Al2O3 and ZrO2/SiO2) and molecular sieves (aluminum silicate materials such as Beta, USY, and MCM-41 molecular sieves). Non-zeolite catalysts have many problems. For example, the optimum amount of metal loading is used to determine the effects of crude oil upgrading, and catalyst calcination conditions have a huge influence on the acid properties of the support, dispersion of metal, and stability of the catalysts. Thus, non-zeolite catalysts have received little attention in recent years, and studies have shown that some kinds of bimetallic non-zeolite catalysts, such as Pd-Pt/ZrO2-SiO2 and CoMoS/ZrO2-SiO2, are the most stable non-zeolite catalysts for BTX production through diaromatic hydrocracking. Molecular sieves can provide acid sites for catalysts, which influence the reaction in two ways. On the one hand, isomerization reactions occur on the hydrogenation products of dicyclic aromatics from six-membered rings to five-membered rings, and the five-membered rings are further broken. On the other hand, the side chains of long-chain monocyclic aromatics are broken to generate light aromatics. The molecular sieves commonly used in the production of BTX are USY, HY, MCM-41, ITQ-21, ZSM-5, H-Beta, and MCM-22 [70,109,131,132]. Different molecular sieves have various pore structures, specific surface areas, and acid properties (including acid strength and type); thus, they also have different catalytic performances. In the hydrocracking reaction, a Brønsted acid is usually required. Sato et al. [133] used tetralin as a probe molecule to study the ring-opening reactions of aromatics. The results showed that the ring-opening of tetralin requires a relatively strong Brønsted acid. Arribas et al. [109,110] believed that the concentration of the Brønsted acid should not be too high and that reducing the concentration of the Brønsted acid could reasonably inhibit the secondary cracking or dealkylation reaction. Chareonpanich et al. [84] used Al2O3 to load Mo, W, Co-Mo, Ni-Mo, and Ni-W when hydrocracking PAHs to produce BTX. After a certain amount of USY was added, the number of Brønsted acid sites on the catalyst increased. Sato et al. [40] used NiW as the active phase, and tetralin was used as a probe molecule to study the ring-opening reaction of aromatics on the supports of USY, HY, and mordenite. The results showed that the conversion rate of tetralin decreases in the following order: USY > HY > mordenite, and the yield of BTX is in the order of USY > mordenite > HY. The USY support showed excellent performance in the hydrocracking of tetralin to produce BTX, which is due to the suitable amount of Brønsted acids in USY compared with the other two supports. It can be seen from the above studies that the hydrocracking of PAHs to produce BTX requires a strong and suitable concentration of Brønsted acid. The pore structure of the supports has a significant influence on the diffusion and shape selectivity of the reactants and products. Corma et al. [74] studied the influence of the support pore structure on the PAHs hydrocracking reaction. They found that on ZSM-5 and MCM-22 molecular sieves with a 10-element ring, reactant molecules could enter the pores; however, the diffusion of products with alkyl side chains was restricted after ring opening, so the reaction of secondary cracking occurred easily. Kim et al. [60] used ZSM-5-, Beta-, and USY-supported Ni2P as catalysts to study the hydrocracking reaction of naphthalene. The results showed that the Ni2P/Beta catalyst showed the highest yield of BTX due to its large pore structure. Mostad et al. [134] studied the conversion of decalin on different molecular sieves under the same conditions. The results showed that the conversion rate of decalin on the H–Y molecular sieve was the highest (90 %), while that on the H-ZSM-5 molecular sieve was the lowest (21 %). The activity order of the four supports is H–Y > H-MOR > H-FER > H-ZSM-5, and the pore sizes of the four molecular sieves are 0.74, 0.67 × 0.7, 0.64 and 0.54 × 0.56 nm, respectively, which indicates that the activity of the catalysts increases with the increase in pore size. Tang et al. [135] studied the catalytic effect of H–Y and H-ZSM-5 molecular sieves on the ring opening of phenanthrene at different temperatures. The results indicated that the BTX produced by the catalysts is mainly related to their two-dimensional structures (0.53 × 0.56 nm and 0.51 × 0.55 nm). At the same time, H–Y molecular sieves (pore size of 0.74 nm) have a higher selectivity for heavy aromatics because of the larger pore diameter and structure of the twelve-membered ring cage, which inhibits the over-cracking reaction of heavy aromatics and, in turn, increases the ability to resist coke [136]. Thus, the yield of BTX can be increased by molecular sieves with mesopore and macropore sizes. The size of the support particles also affected the selectivity of BTX. Nanocatalysts show better performance in terms of activity, selectivity, and stability. The use of nanoscale catalysts is beneficial for eliminating the influence of diffusion, reducing coking, and enhancing the stability of the catalyst [137,138]. Konno et al. [139] studied the effect of supports with nanoparticle size on the activity of the ring-opening reaction and the yield of BTX. For the catalyst with large particles of H-ZSM-5, the selectivity of BTX decreased from 40 to 20 %, and that for the nanoscale H-ZSM-5 catalyst increased from 30 to 35 % with a reaction time of 4.5 h. The results show that the large particle catalyst produces more coking products than does the nanocatalyst. Kim et al. [130] also agreed with this result. They used Ni2P supported on nano-sized Beta to treat 1-methylnaphalene to BTX at 380 °C and 6.0 MPa, and the nanocatalysts showed a better selectivity for BTX than did traditional catalysts with Beta molecular sieves, because the nano-sized Beta has abundant intercrystalline mesopores to provide a better dispersion for reactants and products, offering their proximity to the center of hydrogenation and cracking. The large specific surface area of the supports is conducive to the adsorption and desorption of reactants and products. Pujro et al. [140] studied the effect of microstructure on the hydrocracking of LCO using H–Y molecular sieves with different specific surface areas (243, 191, and 181 m2/g). The feed conversion on the H–Y molecular sieve with the largest specific surface area (243 m2/g) was the highest (30 %), while those for the other two types of H–Y were 25 % and 20 %, respectively. The selectivity of BTX also showed the same trend. Hybrid molecular sieves have attracted considerable attention for modifying the properties of supports because they have the advantages of different molecular sieves used in the reaction. Oh et al. [141] used hybrid molecular sieves to study the hydrocracking activity of LCO into light-aromatic-enriched BTX. The results showed that MoS/BYZ (80:10:10), which contained 10 wt% mesoporous H–Y, 80 wt% H-Beta, and 10 wt% H-ZSM-5, produced a high yield of BTX-rich light aromatics because of its strong acid strength (afforded by H–Y) and the ability to enhance the conversion efficiency of C11+ heavy aromatics (afforded by H-Beta and H-ZSM-5). Moreover, some researchers have developed new supports that resist the influence of nitrogen compounds on hydrocracking catalysts. Barbosa et al. [142] prepared a series of NiMo catalysts supported on Al-MCM-41 with different ratios of SiO2/Al2O3 to hydrocracking cumene, and they found that Al–MCM–41-based catalysts lost only 4–7 % of their activity to produce BTX when the nitrogen content in the feed was 150 ppm. The resistance to poisoning by nitrogen compounds is most likely related to the hydrodenitrification capability of these catalysts, and their Brønsted sites are of medium strength, which may be another reason. Corma et al. [143] also found that NiMo/MCM-41 catalysts showed higher hydrocracking activities for BTX production from naphthalene than did catalysts based on Al2O3 or USY molecular sieves in the presence of a nitrogen content of 2900 ppm. It seems that the MCM-41 molecular sieve has a high resistance to nitrogen compounds; however, the crystallinity of the MCM-41 molecular sieve is not very good, and lattice collapse occurs easily under roasting at high temperatures. Thus, the MCM-41 molecular sieve is not widely used in hydrocracking reactions. Based on the above studies, the supports used in hydrocracking di-aromatics should have a moderate number of Brønsted sites to obtain the ring-opening ability and to inhibit the secondary cracking or dealkylation reaction. However, the influence of the acid amount and strength of the catalyst on the hydrocracking reaction of LCO is still not clear at present, mainly because the hydrocracking reaction of LCO is a complex process, and the role of the acid center in each step of the acid catalytic reaction cannot be quantitatively determined. Moreover, LCO is a complicated system, and the adsorption of alkanes and cycloalkanes on acid sites leads to the low reactive activity of aromatics. In this situation, researchers should pay more attention to the competitive adsorption of aromatics and other components on acid sites. The pore structure of the support could also be modified to match with aromatics to maximize the yield of BTX. 3.4 Modification of supports To increase the yield of target products or maintain the stability of catalysts, approaches for adding other materials to the catalysts and treatment of supports are usually introduced in the preparation of catalysts. Researchers usually improve the selectivity of the target product by adjusting the acid properties and pore structure of the catalyst. Xin et al. [144] used a 0.2 mol/L NaOH solution to treat a ZSM-5 molecular sieve at 80 °C for 6 h to obtain meso-ZSM-5, which is usually called alkali treatment. The results showed that for the ring-opening selectivity of tetralin to produce alkylbenzene, which can be further cracked to BTX, the meso-ZSM-5 catalyst exhibited a high value of 79 − 84 wt% selectivity for alkylbenzene. However, the ring-opening ability of tetralin on the ZSM-5 catalyst was much lower, at 45–63 wt% under the same conditions. The reasons for the improved performance of the meso-ZSM-5 catalyst are its large pore structure, good dispersion of products, and acid accessibility of the reactants. Ren et al. [145] used a fluorine–alkaline treatment to prepare mesoporous Y molecular sieves (USY-F-AT). They compared the hydrocracking ability of NiMo/(Al2O3 + USY) and NiMo/(Al2O3 + USY-F-AT) using naphthalene as a model compound. It was found that NiMo/(Al2O3 + USY-F-AT) showed a similar hydrogenation activity but much higher ring opening ability compared with NiMo/(Al2O3 + USY). The yield of ring opening products for NiMo/(Al2O3 + USY) was 7.6 wt% at 400 °C, and that for NiMo/(Al2O3 + USY-F-AT) could reach 26.2 wt% at the same temperature. Fluorination–alkaline treatment can increase the mesopore volume, pore diameter, and acid amount of the catalysts, especially Brønsted acid. Kim et al. [19] used a weak acid treatment to process nanopore Beta molecular sieves to reduce the acid amount by dealumination. They found that NiW supported on a dealuminated Beta molecular sieve exhibited the highest selectivity for ring-opening products due to its higher SiO2/Al2O3 ratio (around 55) and smaller acid amount than its parents. The yield of BTEX (where ‘E’ represents ethylbenzene) was 44.9 wt% after hydrocracking by the catalysts after acid treatment, while that of catalysts without acid treatment was 39.5 wt%. Other materials are usually introduced to modify the catalysts to disperse the active phase and reduce the acid strength, which can restrain the formation of carbon deposition and increase the yield of BTX. Lee et al. [146] found that the addition of K to a NiW/HY catalyst can moderate its acidity. The yield of BTEX can be increased by 8.3 wt% for the NiW/HY catalysts with the addition of 0.3 wt% K compared with that without K addition. Ardakani et al. [112] also found that K or Mg could improve the dispersion of Mo2C on HY, and K could also moderate the Brønsted acid of the catalyst. Through a modification by Mg or K, the conversion of naphthalene was reduced using the modified catalysts due to a carbon deposition on the Brønsted acid sites. Another study [147] agreed that the acidity of the catalysts was not influenced by the addition of Mg, whereas the addition of K decreased the acidity of the catalysts by 30 %. In addition, their research found that the addition of Mg and K could increase the hydrogenation activity of catalysts over naphthalene; however, the ring-opening selectivity to generate BTX was reduced compared with the original catalysts. Cheng et al. [148] studied the effect of water on the hydrogenation of naphthalene to tetralin using formic acid as the H2 and water source. The results showed that the addition of water effectively inhibited the formation of coke and increased the yield of tetralin. To maintain the stability of the catalysts, the addition of other materials to increase the dispersion of the active phase requires further research. Evidently, support modification is a direct way to change the acid properties and pore structure of the catalyst. Acid treatment, alkali treatment, and the addition of other materials are the conventional processes used to adjust the properties of the catalysts. However, these treatment methods are catalyst after-treatments, and it is difficult to efficiently obtain the properties of the catalysts in demand. It is more effective to synthesize molecular sieves or other materials according to the pore structure and acid properties, because the Si/Al, pore size, and channel structure can be effectively adjusted. Therefore, there may be more new molecular sieves and other materials applied in the hydrocracking of LCO to BTX in the next few years. 3.5 The interaction between metal and support Hydrocracking catalysts have an active phase and support to exert different functions. Because of a further understanding of the hydrocracking reaction, some researchers believe that to achieve a high feed conversion rate and high selectivity of BTX, it is necessary to promote the balance between the metal center and acid [149]. This includes both the balance of the amount and proximity of the metal center to the acid center. The yield of BTX could be improved by controlling the following areas [150]: (1) the hydrogenation activity of the metal (inhibiting the hydrocracking activity), (2) the acidity of the support for the cracking activity, and (3) the balance of metal and acid. A greater amount of metal loaded on the supports can usually obtain higher hydrogenation activity, but it could exert some influence on the support and increase the cost of catalysts. Many researchers have explored catalysts with highly dispersed metals to achieve high reactivity. In some ways, deposition-precipitation [151,152], equilibrium deposition filtration [153,154], chemical vapor deposition [155], and sonochemical [156], are used to achieve this purpose. However, a catalyst with a well-dispersed metal has a large defect, which is the strong interaction between the support and metal. The stacking form and sulfidation of metal are decreased by strong metal–acid interactions [157]. Thus, the hydrogenation activity of the catalysts is also inhibited. This is usually not a good way to reduce the acidity of the support because the hydrocracking activity of the catalyst may be decreased and a metal with a large particle size may be generated, resulting in a reduced amount of metal on the support [158]. It is still difficult to balance the activity of the metal and the support. A few researchers have studied this interaction and made some adjustments. Wu et al. [159] studied the metal − support balance and influence of metal on the yield of BTX, and they found that the interaction of metal − acid, ratio of metal − acid, and dispersion of metal exerted a significant effect on the hydrocracking activity of the catalysts. In addition, their research showed that a highly selective hydrogenation activity could be obtained by dispersing the metal oxides on the support, and the yield of BTX was dependent on the ratio of metal − acid. The interaction between the metal and support also influences the selective hydrogenation activity. A large amount of coke products or by-products may be obtained with an unsuitable ratio of metal to support. Xu et al. [160] prepared a NiMo/SiO2-Al2O3 hydrodesulfurization catalyst by synthesizing a new tungsten precursor. The results showed that the tungsten precursor could adjust the strength of the interaction between the metal and support, thus improving the dispersion of the metal on the surface of the support and regulating the catalytic performance of the catalyst. By adding ethylene glycol to a metal precursor solution to regulate the metal-support interaction, Qiu et al. [161] studied its influence on the hydrogenation of naphthalene. When the molar ratio of ethylene glycol to Ni atoms is 1, the interaction between the metal and support is appropriate, resulting in a high NiO dispersion (small particles) and many effective active sites; thus, naphthalene can be completely hydrogenated to produce decalin at 55 °C. Zhang et al. [162] studied the influence of metal-support interactions on the reaction performance using a monatomic catalyst of Pt/Carbon. They found that enhancing the surface acidity of the support is conducive to improving the metal-support interaction, inhibiting the sintering of metals, and reducing the hydrogenation activity of metals. In recent years, it has been difficult to prepare hydrocracking catalysts with a high hydrogenation activity on strong acid supports. Owing to the strong metal-support interaction, metal oxides are difficult to reduce, and the hydrogenation activity of the catalyst is inhibited [163]. The proximity between the center of the metal and the acid also has a strong influence on the distribution of products. As shown in Fig. 8 , the two active sites of the catalyst play different roles in 1-methylnaphthalene hydrocracking. If the centers of the metal are too close, over-hydrogenation of 1-methylnaphthalene will occur, leading to a low selectivity for BTX, and the dehydrogenation reaction results in a low conversion rate of 1-methylnaphthalene. However, few studies have focused on the proximity of two types of centers when hydrocracking LCO to produce BTX. Researchers should pay more attention to this topic in the future. Currently, there are many studies on hydrocracking catalysts, including the influence of metal characteristics (metal type, metal load, metal dispersity, etc.) on the hydrocracking activity and the influence of molecular sieve properties (acid type and pore structure, etc.) on cracking activity. However, it is not clear how the components, load, and dispersion of metals affect the selective hydrogenation ability of the catalyst. There are also few reports on how the LCO hydrocracking catalyst achieves a quantitative matching of the two types of active centers [111]. In addition, there are no studies on the structure-activity relationship between the mesoporous properties (including mesoporous size and volume) of mesoporous molecular sieves and the LCO hydrocracking reaction performance. The main reason is that LCO hydrocracking is a complex reaction process, and the yield of BTX is the result of the reaction of LCO on two active centers. It is difficult to judge the performance of the two active centers in each step of the reaction from the yield of BTX and the conversion rate of LCO; therefore, it is difficult to establish the structure-activity relationship between the properties of the catalyst and the reaction performance. More high technologies, such as synchrotron radiation, could be used to study the role of the two active centers in the hydrocracking of LCO to BTX. 4 Improved process conditions for hydrocracking and related technologies With the development of catalysts, researchers need to adjust the BTX production process to match the catalysts. The following sections detail the impact of each factor on the hydrocracking of di-aromatics. 4.1 Effect of temperature In the hydrocracking reaction, the reaction temperature is an important factor. The appropriate reaction temperature usually depends on the hydrogenation reaction and ring opening reaction, which is also related to other process parameters such as pressure, type of feedstock, and catalyst. It is acknowledged that the hydrogenation reaction is usually exothermic, whereas the ring-opening reaction is endothermic. Changes in temperature affect the chemical equilibrium and reaction rate of the two reactions [165]. From a thermodynamic perspective, an increase in temperature is beneficial to the endothermic reaction but not to the exothermic reaction; thus, a high temperature is beneficial to the ring-opening reaction rather than the hydrogenation reaction. Chareonpanich et al. [166] found that when the temperature increased from 400 to 600 °C at 5 MPa, the conversion rates of naphthalene, tetralin, and 2-methylnaphthalene on USY increased and even exceeded 100 % because LPG was generated. It is worth mentioning that the yield of BTX in the generated products was always lower than 50 %, and C1-C7 comprised the remainder of the products, which indicates that the cracking reaction dominates at high temperatures. A similar phenomenon was observed for the hydrocracking of tetralin and 2-methylnaphthalene. In another related study, Shin et al. [126] found that an increase in temperature (from 375 to 450 °C) can reduce the yield of alkylbenzenes and increase the yield of BTX when using H-ZSM-5 catalysts for hydrocracking tetralin. However, when the temperature was greater than 425 °C, the yield of BTX began to decrease. The reason was that the increase in temperature promoted the breakage of the alkyl chain of alkyl benzene, which is the cracking reaction; however, the tetralin hydrogenation reaction was restrained at high temperatures, leading to a reduction in the BTX yield. As mentioned above, the hydrogenation of methylnaphthalene is a reversible reaction, which means that the hydrogenated products will undergo a dehydrogenation reaction, which is an endothermic reaction; therefore, an increase in temperature will increase the amount of methylnaphthalene in the products. Miki et al. [77] used Ni-Mo/Al2O3 to study the effect of temperature on the distribution of products when hydrocracking 1-methylnaphthalene and 2-methylnaphthalene at 6 MPa. When the temperature was increased from 390 to 450 °C, the amount of hydrogenated product decreased, while that of the cracking product increased significantly. In addition, the yield of 1-methylnaphthalene in the products increased by nearly 15 wt%, and the same phenomenon was observed in the hydrocracking of 2-methylnaphthalene. Thus, at higher reaction temperatures, the hydrogenation of aromatics does not proceed smoothly, which has a significant influence on the product distribution. From the above studies, a suitable reaction temperature is closely related to the feed, catalysts, and thermodynamics. A relatively high temperature can increase the reaction rate of PAHs hydrocracking; however, the hydrogenation rate is restrained by thermodynamics, which may lead to excessive cracking and a decrease in the amount of MAHs. In addition, a low temperature not only decreases the reaction rate of the whole system but also reduces the hydrogenation activity of the catalysts, which is not ideal for treating PAHs to BTX. Many studies [167,168] indicated that the suitable reaction temperature is approximately 400 °C, and researchers could select this reaction temperature when developing new catalysts. 4.2 Effect of pressure Pressure is another important index of the hydrocracking process. Usually, the hydrogenation of PAHs is a reaction in which multiple molecules form a single molecule, so an increase in pressure will promote the hydrogenation reaction from the viewpoint of physical chemistry. However, excessively high pressures lead to the oversaturation of PAHs to form cycloalkanes. Gutierrez et al. [169] found that hydrogen pressures of 3.5 − 7.5 MPa could significantly affect the hydrocracking of LCO over Pt − Pd/HY. The yield of naphtha increased greatly with increasing pressure. However, the amount of aromatics decreased from 60 wt% to 30 wt% as the pressure increased, which proved that a large amount of the aromatics was hydrogenated. In another study, Ishigaki et al. [170] studied the hydrogenation of 1-methylnaphthalene on CoMo/Al2O3 under pressures of 3.1–7.5 MPa, and the results showed that the amount of methyl-tetralin decreased from 88 to 60 %, while that of methyl-decalin increased from 12 to 40 %, indicating that the 1-methylnaphthalene was completely saturated. Therefore, excessively high pressure is not desirable for producing BTX, because an excessive saturation of PAHs occurs and cycloalkanes are formed. Therefore, a certain pressure value is needed to ensure the saturation of one ring of di-cyclic aromatics, and the over-saturation of di-cyclic aromatics should be controlled. Researchers and producers can reasonably increase the reaction pressure to maintain an aromatic ring. 4.3 Effect of space velocity Space velocity is the flow rate of the feed into the reactor relative to the catalyst and can be represented as the liquid hourly space velocity (LHSV) or weight hourly space velocity (WHSV). The former represents the volume ratio of the feed oil to the catalysts, and the latter is the mass ratio of the feed oil to the catalysts. The reciprocal of the space velocity is generally referred to as the residence time. Increasing the space velocity usually reduces the contact time between the feed and catalyst, which may decrease the production of secondary products. Upare et al. [171] studied the influence of space velocity on tetralin hydrocracking over CoMo/Beta, and the results showed that the yield of C1-C4 gas decreased from 60 to 20 % as the space velocity increased from 0.4 to 1.6 h−1, while the yield of MAHs increased from 33 to 60 %. It seems that an increase in the space velocity has a desirable effect on the production of BTX. However, the conversion rate of the feed will decrease while continuing to increase the space velocity due to an incomplete feed reaction on the catalysts, and the distribution of products will be changed. Gutierrez et al. [172] studied the effect of space velocity on LCO hydrocracking using a Pt-Pd/HY catalyst at 350 °C and 4.5 MPa. The results showed that the conversion rate of LCO declined from 84 to 2 % as the space velocity increased from 1 to 8 h-1. In addition, the content of aromatics in the gasoline fraction increased from 5 to 30 wt% with the increasing space velocity. Thus, to obtain a high yield of BTX, it is usually necessary to reasonably increase the space velocity; however, a high space velocity also means that less feed can be converted to BTX. To maintain the production and ensure the conversion rate, the catalyst volume (or reactor volume) needs to be increased, which is a relatively simple and beneficial retrofit solution. As a suggestion, the optimal conditions for hydrocracking LCO to produce BTX are suggested as temperature (370–450 °C), pressure (4–10 MPa), and space time (0.5–2 h−1). 4.4 Hydrocracking technology Currently, there are several worldwide technologies for converting aromatics in LCO into light aromatics by hydrocracking reactions. The technologies currently used in hydrocracking inferior diesel to produce BTX are listed in Table 5 . As shown in Table 5, the technologies are mainly distributed in America (LCO-X technology [173,174]), Canada (ARO technology [175]), and China (FD2G [176], LTAG, and BLG technologies). Of these, the LTAG and BLG technologies have not been introduced internationally. The feedstocks for these technologies are typical inferior diesel, including LCO and FCC diesel. For catalysts used in these technologies, the ARO technology adopts noble-metal Pd as the active phase, which is different from other technologies. Ni, Mo, and W are generally used as active components in the other four technologies. It is worth mentioning that Fe is used as the active phase for LCO-X technology, and the speculation is that the aim of this method is to reduce the cost of catalysts. The supports for these technologies are molecular sieves such as Y and USY, which can afford macropores and strong Brønsted acids on the catalysts. The optimal conditions for BTX production from LCO hydrocracking conform to the conditions described in the section above. The temperature range is 350–420 °C. The optimal pressure is in the range of 3–10 MPa, and the space velocity is relatively low (0.6–10 h−1). As for the products, the LCO-X technology from UOP cooperation has the highest BTX yield (approximately 44 %). The RLG and FD2G technologies also have favorable BTX yields of 32 % and 35 %, respectively, while the ARO and LTAG technologies are at a disadvantage. Although these technologies have been widely applied in the industry for many years, they also have some problems. The LCO-X technology has a high yield of BTX, but the entire operation process is complex, so the equipment cost and energy consumption are large. The ARO technology is simpler than the LCO-X technology; thus, the equipment investment is small. However, precious metals with high prices are used as the active phase in this process. Moreover, the yield of BTX in the products is relatively low, and the yield of alkanes in liquid products is relatively high, which results in poor economic benefits. The RLG and LCO-X technologies have the same problem; that is, they require catalytic reforming to obtain a higher yield of light aromatics; thus, it also has a complicated process, high equipment cost, and high energy consumption. As for the other two technologies, the LTAG technology has a low yield of BTX, and the main purpose of the FD2G technology is to produce high-quality diesel and by-product BTX, so the yield of BTX is actually low. In summary, the technologies have some problems, and the companies could make some improvements in these areas. In addition to these industrial technologies, many researchers have proposed hydrocracking processes for BTX using inferior diesel, as shown in Table 6 . It can be seen that the feed is usually LCO, and the catalysts are bifunctional catalysts with different compositions. For the metal of the catalysts, noble metals such as Pt and Pd are widely used due to their high hydrogenation activity, but they will increase the cost of catalysts. Various supports are adopted by these processes, and it is speculated that researchers are about to utilize the suitable pore structures and acidity of the different supports, but there is a huge difference in their costs. Because of the use of different catalysts, the optimal conditions for these processes are different, and most of them are in the range of our recommended conditions. In addition, some issues block the industrialization of these processes, such as low BTX yield, high catalyst cost, and utilization of model LCO. If these problems can be solved effectively, these processes can be industrial in the future. 5 Current problems and the development of diesel hydrocracking The current technologies for using inferior diesel to produce fuel oil are very mature; however, the consumption of refined oil will reach its peak, so the production of BTX has become a hot direction for diesel hydrocracking. However, there are still some problems in this area, such as product property issues and increased production costs [97,100,103,183,184]. First, hydrocracking catalysts should be improved. For the current hydrocracking technologies, part of the inferior diesel is returned to the hydrocracking unit because of the low one-way conversion rate, resulting in a relatively large recovery, and in turn, the economic benefits are affected. Thus, the low conversion rate of feed and low selectivity for BTX hinder the hydrocracking technology for inferior diesel. It is still urgent to modify the catalysts and adjust the optimal conditions to handle these problems. On the one hand, the modification of catalysts can effectively improve their hydrogenation activity by reducing the particle size of the metal and creating a mesoporous structure to increase the surface area of the support. On the other hand, a support with a strong Brønsted acid can enable the hydrocracking activity of the catalyst. As advice, the work on catalysts could be dedicated to the following areas in the coming years: (I) create a specific architecture to expose high-density surface active sites and increase the specific surface area to obtain better hydrogenation, (II) use supports with special mesopore channel structures to accelerate the reactant diffusion and increase the shape-selectivity for BTX, thereby reducing kinetic reaction obstacles and increasing the selectivity of BTX; (III) synthesize new molecular sieves or combine different molecular sieves to adjust the electronic configuration and optimize the acid properties of the catalyst surface, and (IV) further study the match relationship between the metal and supports to coordinate the hydrogenation and hydrocracking activity. In addition, the hydrocracking process should be improved. Despite the application of these catalysts in industrial fields, there are still some problems and challenges in the process. Owing to the treatment of the full fraction of diesel in some technologies, saturated hydrocarbon components with high cetane numbers undergo cracking reactions, resulting in a high yield of gas by-products and high hydrogen consumption. The cost of diesel hydrocracking is first reflected in the hydrogen consumption. Moreover, the over-hydrogenation of PAHs leads to a reduction in BTX production and increases the hydrogen consumption and cost. It is worth mentioning that the aromatic content in the catalytic reforming technology product can reach more than 95 %; thus, aromatic extraction technology is not needed. However, owing to the low yield of light aromatics in the liquid product, aromatic extraction is still necessary for hydrocracking technology. These problems affect the economy of the technology and hinder its large-scale application. To address the problem of high hydrogen consumption, researchers can improve the process in several areas. First, hydrocracking devices are usually coupled with a hydrotreatment device owing to the hydrocracking catalyst poisoning by nitrogen compounds. The entire procedure is complicated and expensive. Companies can develop high-nitrogen compound-resistance catalysts to remove the hydrotreatment device, which can significantly reduce the cost of the entire process. Second, despite the improved hydrogenation activity of the catalysts, the over-hydrogenation of PAHs will inevitably occur, which will increase the hydrogen consumption and result in the loss of PAHs. The main direction for researchers is still to improve existing bifunctional catalysts or develop new catalysts. Finally, in addition to the cost of BTX hydrocracking catalysts, the low conversion rate of feeds and selectivity of BTX are other major obstacles for BTX production. A high LCO conversion rate also requires suitable reaction process conditions such as temperature and pressure; therefore, companies must upgrade existing equipment, which may also increase certain costs. Finally, the model compounds used in hydrocracking research are usually pure components. However, LCO has thousands of components. Different components may be absorbed on the metal and acid centers and then react. In addition, hydrogenated products such as tetralin and alkylbenzene will also absorb on the two kinds of centers, which leads to a low reactivity of the fresh feeds. Another direction that researchers should consider is to increase the adsorption selectivity of PAHs on the active center. In the future, more advanced technologies, such as the aid and application of computational chemistry tools, can be applied to analyze all the types of aromatics in LCO and their reaction activity. This could help to deepen the understanding of the reactions and pathways of complicated systems and obtain the development of more efficient catalysts by balancing the properties of the active phase and surmounting current shortcomings. 6 Conclusion With the consumption peak of diesel and the impact of new energy sources, the utilization of excessive diesel, especially inferior diesel such as LCO, has attracted increasing attention. For the treatment of LCO, it is desirable to produce chemical materials, such as BTX, because their demand is sustainable for a few years. The hydrocracking reaction mechanisms and pathways of naphthalene, alkylnaphthalene, and tetralin in LCO to produce BTX have been well researched for many years. In addition, bifunctional catalysts have been developed to hydrocrack PAHs to BTX. However, the relationship between the amount of acid and the active phase in the catalysts has attracted little attention, and the interaction of metal and supports, the structure of pores, and the influence of surface properties on the hydrocracking reaction have not been well studied. The competitive reaction of each component in LCO on the active center of the catalyst is not clear. Although a large number of experiments have been conducted to explore the optimal conditions for hydrocracking naphthalene, there are few studies on the kinetics of hydrocracking inferior diesel, and the technologies of hydrocracking for BTX production need to be improved. The development of nitrogen-compound-resistant catalysts with excellent performance to reduce the process energy and hydrogen consumptions and increase the selectivity of BTX is the future development direction of LCO hydrocracking. Under the condition of increasingly tight petroleum resources, the utilization of inferior diesel to produce BTX will attract increasing attention in the next decade. Declaration of Competing Interest The authors report no declarations of interest. Acknowledgements This work was supported by the National Key Research and Development Program of China (No. 2018YFC1902603), the National Natural Science Foundation of China (21822810, 21838011, 22021004) and National Postdoctoral Program for Innovative Talent (BX20200383). References [1] A.Z. Aklilu Renew. Sust. Energ. Rev. 118 2020 109530 A.Z. Aklilu, Renew. Sust. Energ. Rev. 118 (2020) 109530. [2] W.W. Zhou Q. Zhang Y.S. Zhou Catal. Today 305 2018 171 181 W.W. Zhou, Q. Zhang, Y.S. Zhou, Catal. Today 305 (2018) 171-181. [3] A. Corma C. Martinez L. Sauvanaud Catal. Today 127 2007 3 16 A. Corma, C. Martinez, L. Sauvanaud, Catal. Today 127 (2007) 3-16. [4] H.L. Yin T.N. Zhou Y.Q. Liu J. Nat. Gas. Chem. 20 2011 441 448 H.L. Yin, T.N. Zhou, Y.Q. Liu, et al., J. Nat. Gas. Chem., 20 (2011) 441-448. [5] P. Sintarako P. Praserthdam V. Thammongkol Catal. Commun. 62 2015 89 94 P. Sintarako, P. Praserthdam, V. Thammongkol, et al., Catal. Commun., 62 (2015) 89-94. [6] X. Ju Y. Zhang Z. Hu Acta. Petrolei. Sinica. 28 2012 538 543 X. Ju, Y. Zhang, Z. Hu, et al., Acta. Petrolei. Sinica. 28 (2012) 538-543. [7] United States Environmental Protection Agency 2020 https://www.epa.gov/regulations-emissions-vehicles-and-engines/improvements-heavy-duty-engine-and-vehicle-test,regulated United States Environmental Protection Agency, https://www.epa.gov/regulations-emissions-vehicles-and-engines/improvements-heavy-duty-engine-and-vehicle-test, regulated (2020). [8] H. Song O. Yu Y.G. Chen Chinese J. Chem. Eng. 26 2018 540 544 H. Song, O. Yu, Y.G. Chen, et al., Chinese J. Chem. Eng. 26 (2018) 540-544. [9] Worldwide Fuel Specifications 2014 International Fuel Quality Center International Fuel Quality Center, Worldwide Fuel Specifications (2014). [10] A.E.A. Ricardo 2012 Summary Report: EU Fuel Quality Monitoring 2014 A.E.A. Ricardo, 2012 Summary Report: EU Fuel Quality Monitoring (2014) [11] R. Palos A. Gutierrez I. Hita Ind. Eng. Chem. Res. 58 2019 13064 13075 R. Palos, A. Gutierrez, I. Hita, et al., Ind. Eng. Chem. Res. 58 (2019)13064-13075. [12] X.Y. Ren S.X. Zhao J.P. Cao J. Anal. Appl. Pyrol. 24 2020 104958 X.Y. Ren, S.X. Zhao, J.P. Cao, et al., J. Anal. Appl. Pyrol. 24 (2020) 104958. [13] Y.L. Wang J.P. Yu H.H. An Fuel Process. Technol. 211 2021 106600 Y.L. Wang, J.P. Yu, H.H. An, et al., Fuel Process. Technol. 211 (2021) 106600. [14] G.C. Laredo P. Perez-Romo J. Escobar Ind. Eng. Chem. Res. 56 2017 10939 10948 G.C. Laredo, P. Perez-Romo, J. Escobar, et al., Ind. Eng. Chem. Res. 56 (2017) 10939-10948. [15] M.Y. Gim C. Song Y.H. Lima Catal. Sci. Technol. 9 2019 6285 6296 M.Y. Gim, C. Song, Y.H. Lima, et al., Catal. Sci. Technol. 9 (2019) 6285-6296. [16] M.A. Sanhoob U. Khalil E.N. Shafei Fuel 263 2020 116624 M.A. Sanhoob, U. Khalil, E.N. Shafei, Fuel 263 (2020) 116624. [17] A. Galadima O. Muraza Fuel 181 2016 618 629 A. Galadima, O. Muraza, Fuel 181 (2016) 618-629. [18] G.C. Laredo P.M. Vega-Merino P.S. Hernandez Ind. Eng. Chem. Res. 57 2018 7315 7321 G.C. Laredo, P.M. Vega-Merino, P.S. Hernandez, et al., Ind. Eng. Chem. Res. 57 (2018) 7315-7321. [19] E.S. Kim Y.J. Lee J.R. Kim J. Nanosci. Nanotechno. 16 2016 1715 1719 E.S. Kim, Y.J. Lee, J.R. Kim, et al., J. Nanosci. Nanotechno. 16 (2016) 1715-1719. [20] V. Calemma R. Giardino M. Ferrari Fuel Process. Techno. 91 2010 770 776 V. Calemma, R. Giardino, M. Ferrari, Fuel Process. Techno. 91 (2010) 770-776. [21] K. Jaroszewska A. Masalska J.R. Grzechowiak Appl. Catal. A-Gen 505 2015 116 130 K. Jaroszewska, A. Masalska, J.R. Grzechowiak, et al., Appl. Catal. A-Gen 505 (2015) 116-130. [22] C. Peng B. Liu X. Feng Chem. Eng. J. 389 2020 123461 C. Peng, B. Liu, X. Feng, et al., Chem. Eng. J. 389 (2020) 123461. [23] C. Peng X.L. Huang X.Z. Duan Catal. Today 271 2016 149 153 C. Peng, X.L. Huang, X.Z. Duan, et al., Catal. Today 271 (2016) 149-153. [24] A. Gutierrez J.M. Arandes P. Castano Fuel 94 2012 504 515 A. Gutierrez, J.M. Arandes, P. Castano, et al. Fuel 94 (2012) 504-515. [25] G. Escalona A. Rai P. Betancourt Fuel 219 2018 270 278 G. Escalona, A. Rai, P. Betancourt, et al., Fuel 219 (2018) 270-278. [26] C.M. Celis-Cornejo M.M.G. Mantilla V.G. Baldovino-Medrano J. Phys. Conference Ser. 743 2016 012010 C.M. Celis-Cornejo, M.M.G. Mantilla, V.G. Baldovino-Medrano, et al., J. Phys. Conference Ser. 743 (2016) 012010. [27] P. Wiwel B. Hinnemann A. Hidalgo-Vivas Ind. Eng. Chem. Res. 49 2020 3184 3193 P. Wiwel, B. Hinnemann, A. Hidalgo-Vivas, Ind. Eng. Chem. Res. 49 (2020) 3184-3193. [28] L. Chahen A.A. Quoineaud D. Proriol Energ. Fuel 31 2017 10752 10759 L. Chahen, A.A. Quoineaud, D. Proriol, Energ. Fuel 31 (2017) 10752-10759. [29] C. Peng Z.M. Zhou Z.M. Cheng Energ. Fuel 33 2019 1090 1097 C. Peng, Z.M. Zhou, Z.M. Cheng, et al., Energ. Fuel 33 (2019) 1090-1097. [30] K.S. Cho Y.K. Lee Appl. Catal. B-Environ. 147 2014 35 42 K.S. Cho, Y.K. Lee, Appl. Catal. B-Environ. 147 (2014) 35-42. [31] Z.L. Liu Q.K. Zhang Y. Zheng Energ. Fuel 22 2008 860 866 Z.L. Liu, Q.K. Zhang, Y. Zheng, et al., Energ. Fuel 22 (2008) 860-866. [32] H. Habaki Y. Yoshimura R. Egashira Sep. Sci. Technol. 54 2019 1159 1166 H. Habaki, Y. Yoshimura, R. Egashira, Sep. Sci. Technol. 54 (2019) 1159-1166. [33] S.J. Kim S.C. Kim Sep. Sci. Technol. 39 2004 1093 1109 S.J. Kim, S.C. Kim, Sep. Sci. Technol. 39 (2004) 1093-1109. [34] S.J. Kim S.C. Kim Sep. Sci. Technol. 38 2003 179 199 S.J. Kim, S.C. Kim, Sep. Sci. Technol. 38 (2003) 179-199. [35] Q. Sheng G. Wang Y.J. Liu Energ. Fuel 32 2018 4979 4987 Q. Sheng, G. Wang, Y.J. Liu, et al., Energ. Fuel 32 (2018) 4979-4987. [36] M.T. Nguyen G.D. Pirngruber F. Albrieux Energ. Fuel 33 2019 1467 1472 M.T. Nguyen, G.D. Pirngruber, F. Albrieux, Energ. Fuel 33 (2019) 1467-1472. [37] C.M. Celis-Cornejo D.J. Perez-Martinez J.A. Orrego-Ruiz Energ. Fuel 33 2019 2602 C.M. Celis-Cornejo, D.J. Perez-Martinez, J.A. Orrego-Ruiz, Energ. Fuel 33 (2019) 2602. [38] J. Raith A. Lanik Erdoel-Erdgas Zeitscheift 98 1982 169 J. Raith, A. Lanik, Erdoel-Erdgas Zeitscheift 98 (1982) 169. [39] M. Sau K. Basak U. Manna Catal. Today 109 2005 112 119 M. Sau, K. Basak, U. Manna, Catal. Today 109 (2005) 112-119. [40] M. Nagai T. Sato A. Aiba J. Catal. 97 1986 52 M. Nagai, T. Sato, A. Aiba, J. Catal. 97 (1986) 52. [41] V. Lavopa C.N. Sattarfield Catal. J. 110 1988 375 V. Lavopa, C.N. Sattarfield, Catal. J. 110 (1988) 375. [42] L.C. Gutberlet R.J. Bertolacini Ind. Eng. Chem. Proc. Des. Dev. 22 1983 246 L.C. Gutberlet, R.J. Bertolacini, Ind. Eng. Chem. Proc. Des. Dev. 22 (1983) 246. [43] L.B. Galperin Appl. Catal. A-Gen 209 2001 257 L.B. Galperin, Appl. Catal. A-Gen 209 (2001) 257. [44] S. Mignard O. Beroudiaux C.R. Acad Sci. Ser. IIb Mec. Phys. Chim. Astorn. 325 1997 271 S. Mignard, O. Beroudiaux, C. R. Acad., Sci. Ser. IIb Mec. Phys. Chim. Astorn. 325 (1997) 271. [45] M. Kobayashi S. Togawa K. Ishida J. Jpn. Pet. Inst. 50 2007 44 M. Kobayashi, S. Togawa, K. Ishida, J. Jpn. Pet. Inst. 50 (2007) 44. [46] M. Argyle C. Bartholomew Catalysts 5 2015 145 M. Argyle, C. Bartholomew, Catalysts 5 (2015) 145. [47] F. Ribeiro C. Marcilly M. Guisnet J. Catal. 78 1982 267 F. Ribeiro, C. Marcilly, M. Guisnet, J. Catal. 78 (1982) 267. [48] P.S.F. Mendes J.M. Silva M.F. Ribeiro J. Ind. Eng. Chem. 71 2019 167 176 P.S.F. Mendes, J.M. Silva, M.F. Ribeiro, J. Ind. Eng. Chem. 71 (2019) 167-176. [49] S.W. Lee S.K. Ihm Fuel 134 2014 237 243 S.W. Lee, S.K. Ihm, Fuel 134 (2014) 237-243. [50] E. Furimsky F.E. Massoth Catal. Today 52 1999 381 E. Furimsky, F.E. Massoth, Catal. Today 52 (1999) 381. [51] G.C. Laredo J.A.D. Reyesw J.L. Cano J.J. Castillo Appl. Catal. A-Gen 207 2001 103 G.C. Laredo, J.A.D. Reyesw, J.L. Cano, J.J. Castillo, Appl. Catal. A-Gen 207 (2001) 103. [52] R. Hughes Chem. Eng. Sci. 44 1989 1747 1748 J.B. Butt, E.E. Petersen. New York: Academic Press (1988). [53] G. Gaeiro A.F. Costa H.S. Cerqueira Appl. Catal. A-Gen. 320 2007 8 15 G. Gaeiro, A.F. Costa, H.S. Cerqueira, et al., Appl. Catal. A-Gen. 320 (2007) 8-15. [54] P. Betancourt S. Marrero S. Pinto-Castilla Fuel Process. Technol. 114 2013 21 25 P. Betancourt, S. Marrero, S. Pinto-Castilla, Fuel Process. Technol. 114 (2013) 21-25. [55] L.H. Ding Y. Zheng H. Yang Appl. Catal. A-Gen. 353 2009 17 23 L.H. Ding, Y. Zheng, H. Yang, et al., Appl. Catal. A-Gen. 353 (2009) 17-23. [56] G.N. Yun Y.K. Lee Appl. Catal. B-Environ. 150–151 2014 647 655 G.N. Yun, Y.K. Lee, Appl. Catal. B-Environ. 150–151 (2014) 647–655. [57] N. Azizi S.A. Ali K. Alhooshani Fuel Process. Technol. 109 2013 172 178 N. Azizi, S.A. Ali, K. Alhooshani, et al., Fuel Process. Technol. 109 (2013) 172-178. [58] L.H. Ding Y. Zheng Z.S. Zhang Catal. Today 125 2007 229 238 L.H. Ding, Y. Zheng, Z.S. Zhang, et al., Catal. Today 125 (2007) 229-238. [59] R.F. Sullivan C.J. Egan G.E. Langlois J. Catal. 3 1964 183 195 R.F. Sullivan, C.J. Egan, G.E. Langlois, J. Catal. 3 (1964) 183-195. [60] Y.S. Kim G.N. Yun Y.K. Lee Catal. Commun. 45 2014 133 138 Y.S. Kim, G.N. Yun, Y.K. Lee, Catal. Commun. 45 (2014) 133-138. [61] H.L. Fan T.B. Wu G.Y. Yang Catal. Commun. 33 2013 42 46 H.L. Fan, T.B. Wu, G.Y. Yang, et al., Catal. Commun. 33 (2013) 42-46. [62] J.R. Restrepo-Garcia V.G. Baldovino-Medrano S.A. Giraldo Appl. Catal. A-Gen. 510 2016 98 109 J.R. Restrepo-Garcia, V.G. Baldovino-Medrano, S.A. Giraldo, Appl. Catal. A-Gen. 510 (2016) 98-109. [63] J. Yang X.G. Wang L. Li Appl. Catal. B-Environ. 96 2010 232 237 J. Yang, X.G. Wang, L. Li, et al., Appl. Catal. B-Environ. 96 (2010) 232-237. [64] A. Ishihara T. Itoh H. Nasu Fuel Process. Technol. 116 2013 222 227 A. Ishihara, T. Itoh, H. Nasu, Fuel Process. Technol. 116 (2013) 222-227. [65] Z.B. Shen P. He A.G. Wang Fuel 243 2019 469 477 Z.B. Shen, P. He, A.G. Wang, et al., Fuel 243 (2019) 469-477. [66] M.X. Zhao X.Y. Wei Z.M. Zong Chinese J. Catal. 37 2016 1324 1330 M.X. Zhao, X.Y. Wei, Z.M. Zong, Chinese J. Catal. 37 (2016) 1324-1330. [67] Y. Choi J.H. Lee J. Shin Appl. Catal. A-Gen. 492 2015 140 150 Y. Choi, J.H. Lee, J. Shin, et al., Appl. Catal. A-Gen. 492 (2015) 140-150. [68] V. Calemma M. Ferrari S. Rabl Fuel 111 2013 763 770 V. Calemma, M. Ferrari, S. Rabl, et al., Fuel 111 (2013) 763-770. [69] A. Infantes-Molina J. Merida-Robles E. Rodrigues-Castellon Appl. Catal. A-Gen. 286 2005 239 248 A. Infantes-Molina, J. Merida-Robles, E. Rodrigues-Castellon, et al., Appl. Catal. A-Gen. 286 (2005) 239-248. [70] A. Corma V. Gonzalez-Alfaro A.V. Orchilles J. Catal. 200 2001 34 44 A. Corma, V. Gonzalez-Alfaro, A.V. Orchilles, J. Catal. 200 (2001) 34-44. [71] K. Sato Y. Iwata Y. Miki J. Catal. 186 1999 45 K. Sato, Y. Iwata,.Y. Miki., et al., J. Catal. 186 (1999) 45. [72] H.B. Mostad T.U. Riis O.H. Ellestad Appl. Catal. 64 1990 119 141 H.B. Mostad, T.U. Riis, O.H. Ellestad, Appl. Catal. 64 (1990) 119-141. [73] J. Abbot B.W. Wojciechowski Can. J. Chem. Eng. 67 1989 833 J. Abbot, B.W. Wojciechowski, Can. J. Chem. Eng. 67 (1989) 833. [74] A. Corma F. Mocholi A.V. Orchilles Appl. Catal. 67 1991 307 A. Corma, F. Mocholi, A.V. Orchilles, Appl. Catal. 67 (1991) 307. [75] S.G.A. Ferraz F.M.Z. Zotin L.R.R. Araujo Appl. Catal. A-Gen. 384 2010 51 57 S.G.A. Ferraz, F.M.Z. Zotin, L.R.R. Araujo, et al., Appl. Catal. A-Gen. 384 (2010) 51-57. [76] J. Weitkamp Ind. Eng. Chem. Prod. Des. Dev. 21 1982 550 J. Weitkamp, Ind. Eng. Chem. Prod. Des. Dev. 21, 550 (1982). [77] Y. Miki Y. Sugimoto Fuel Process. Technol. 43 1995 137 146 Y. Miki, Y. Sugimoto, Fuel Process. Technol. 43 (1995) 137-146. [78] J.I. Park S.A. Ali K. Alhooshani J. Ind. Eng. Chem. 19 2013 627 632 J.I Park, S.A. Ali, K. Alhooshani, et al., J. Ind. Eng. Chem. 19 (2013) 627-632. [79] T. Wu S.L. Chen G.M. Yuan Fuel 234 2018 1015 1025 T. Wu, S.L. Chen, G.M. Yuan, et al., Fuel 234 (2018) 1015-1025. [80] A.V. Sapre B.C. Gates Ind. Eng. Chem. Process. Des. Develop. 20 1981 68 73 A.V. Sapre, B.C. Gates, Ind. Eng. Chem. Process. Des. Develop. 20 (1981) 68-73. [81] S. Banerjee K. Mani L. Leonard Indian Chem. Eng. 53 2011 152 169 S. Banerjee, K. Mani, L. Leonard, et al., Indian Chem. Eng. 53 (2011) 152-169. [82] H.B. Yang Y.C. Wang H.B. Jiang Ind. Eng. Chem. Res. 53 2014 12264 12269 H.B. Yang, Y.C. Wang, H.B. Jiang, et al., Ind. Eng. Chem. Res. 53 (2014) 12264-12269. [83] S.C. Korre M.T. Klein R.J. Quann Ind. Eng. Chem. Res. 36 1997 2041 2050 S.C. Korre, M.T. Klein, R.J. Quann, Ind. Eng. Chem. Res. 36 (1997) 2041-2050. [84] M. Chareonpanich Z.G. Zhang A. Tomita Ind. Eng. Chem. Res. 10 1996 927 931 M. Chareonpanich, Z.G. Zhang, A. Tomita, Ind. Eng. Chem. Res. 10 (1996) 927-931. [85] L. Leite E. Benazzi N. Marchal-George Catal. Today 65 2001 241 247 L. Leite, E. Benazzi, N. Marchal-George, Catal. Today 65 (2001) 241-247. [86] A.R. Beltramone D.E. Resasco W.E. Alvarez Ind. Eng. Chem. Res. 47 2008 7161 7166 A.R. Beltramone, D.E. Resasco, W.E. Alvarez, et al., Ind. Eng. Chem. Res. 47 (2008)7161-7166. [87] S.C. Korre M.T. Klein R.J. Quann Ind. Eng. Chem. Res. 34 1995 101 117 S.C. Korre, M.T. Klein, R.J. Quann, Ind. Eng. Chem. Res. 34 (1995) 101-117. [88] W. Qian Y. Yoda Y. Hirai Appl. Catal. A-Gen. 184 1999 81 88 W. Qian, Y. Yoda, Y. Hirai, et al., Appl. Catal. A-Gen. 184 (1999) 81-88. [89] C.M. Celis-Cornejo D.J. Perez-Martinez J.A. Orrego-Ruiz Energ. Fuel 32 2018 8715 8726 C.M. Celis-Cornejo, D.J. Perez-Martinez, J.A. Orrego-Ruiz, et al., Energ. Fuel 32 (2018) 8715-8726. [90] J.L. Pinilla P. Arcelus-Arrillaga H. Puron Fuel 109 2013 303 308 J.L. Pinilla, P. Arcelus-Arrillaga, H. Puron, et al., Fuel 109 (2013) 303-308. [91] J.L. Pinilla A.B. Garcia K. Philippot Fuel 116 2014 729 735 J.L. Pinilla, A.B. Garcia, K. Philippot, et al., Fuel 116 (2014) 729-735. [92] H. Fan B. Han T. Jiang Chemcatchem 3 2011 1474 1479 H. Fan, B. Han, T. Jiang, et al., Chemcatchem, 3 (2011) 1474-1479. [93] Z.Q. Liu X.Y. Wei F.J. Liu Fuel 223 2018 222 229 Z.Q. Liu, X.Y. Wei, F.J. Liu, et al., Fuel 223 (2018) 222-229. [94] Z.G. Zhang K. Okada T. Yoshida Catal. Today 45 1998 361 366 Z.G. Zhang, K. Okada, T. Yoshida, Catal. Today, 45 (1998) 361-366. [95] G.B. McVicker M. Daage M.S. Touvelle J. Catal. 210 2002 137 148 G.B. McVicker, M. Daage, M.S. Touvelle, et al., J. Catal. 210 (2002) 137-148. [96] M. Al-Sabawi H.D. Lasa Fuel 96 2012 511 523 M. Al-Sabawi, H.D. Lasa, Fuel 96 (2012) 511-523. [97] M. Al-Sabawi H.D. Lasa AIChE J. 55 2009 1538 1558 M. Al-Sabawi, H.D. Lasa, AIChE J. 55 (2009) 1538-1558. [98] Q. Wang H. Fan S. Wu Green Chem. Eng. 14 2012 1152 1158 Q.Wang, H. Fan, S. Wu, et al., Green Chem. Eng. 14 (2012) 1152-1158. [99] S. Zhang D. Liu W. Deng Energ. Fuel 21 2009 3057 3062 S. Zhang, D. Liu, W. Deng, et al., Energ. Fuel 21 (2009) 3057-3062. [100] D. Kubicka N. Kumar P. Maki-Arvela J. Catal. 222 2004 65 79 D. Kubicka, N. Kumar, P. Maki-Arvela, et al., J. Catal. 222 (2004) 65-79. [101] M. Kangas D. Kubicka T. Salmi Top. Cat. 53 2010 1172 1175 M. Kangas, D. Kubicka, T. Salmi, Top. Cat. 53 (2010) 1172-1175. [102] M. Al-Sabawi H.D. Lasa Chem. Eng. Sci. 65 2010 626 644 M. Al-Sabawi, H.D. Lasa, Chem. Eng. Sci. 65 (2010) 626-644. [103] H.W. Hayes J.F. Parcher N.E. Heimer Ind. Eng. Chem. Process Des. Develop. 22 1983 401 409 H.W. Hayes, J.F. Parcher, N.E. Heimer, Ind. Eng. Chem. Process Des. Develop. 22 (1983) 401-409. [104] H. Zhang H. Lin Y. Zhang Int. J. Chem. Reach. Eng. 14 2016 703 711 H. Zhang, H. Lin, Y. Zhang, Int. J. Chem. Reach. Eng. 14 (2016) 703-711. [105] K. Jaroszewska A. Masalska J.R. Grzechowiak J. Catal. 217 2003 376 387 K. Jaroszewska, A. Masalska, J.R. Grzechowiak, et al., J. Catal. 217 (2003) 376-387. [106] L. Ding Y. Zheng Z. Zhang J. Catal. 241 2006 435 445 L. Ding, Y. Zheng, Z. Zhang, J. Catal. 241 (2006) 435-445. [107] M. Usman D. Li R. Razzaq J. Ind. Eng. Chem. 23 2015 21-16 M. Usman, D. Li, R. Razzaq, et al., J. Ind. Eng. Chem. 23 (2015) 21-16. [108] R. Hernandez-Huesca J. Merida-Robles P. Maireles-Torres J. Catal. 203 2001 122 132 R. Hernandez-Huesca, J. Merida-Robles, P. Maireles-Torres, et al., J. Catal. 203 (2001) 122-132. [109] M.A. Arribas P. Concepcion A. Martinez Appl. Catal. A-Gen. 267 2004 111 119 M.A. Arribas, P. Concepcion, A. Martinez, Appl. Catal. A-Gen. 267 (2004) 111-119. [110] M.A. Arribas A. Martinez Appl. Catal. A-Gen. 230 2002 203 217 M.A. Arribas, A. Martinez, Appl. Catal. A-Gen. 230 (2002) 203-217. [111] M. Jacquin D.J. Jones J. Roziere Appl. Catal. A-Gen. 251 2003 131 141 M. Jacquin, D.J. Jones, J. Roziere, et al. Appl. Catal. A-Gen. 251 (2003) 131-141. [112] S.J. Ardakani K.J. Smith Appl. Catal. A-Gen. 403 2011 36 47 S.J. Ardakani, K.J. Smith, Appl. Catal. A-Gen. 403 (2011) 36-47. [113] E. Rodriguez-Castellon J. Merida-Robles L. Diaz Appl. Catal. A-Gen. 260 2004 9 18 E. Rodriguez-Castellon, J. Merida-Robles, L. Diaz, et al., Appl. Catal. A-Gen. 260 (2004) 9-18. [114] P. Castano A. Gutierrez I. Hita Energ. Fuel 26 2012 1509 1519 P. Castano, A. Gutierrez, I. Hita, et al., Energ. Fuel 26 (2012) 1509-1519. [115] P. Samoila F. Epron P. Marecot Appl. Catal. A-Gen. 462-463 2013 207 219 P, Samoila, F. Epron. P. Marecot, et al., Appl. Catal. A-Gen. 462-463 (2013) 207-219. [116] D. Santi T. Holl V. Calemma Appl. Catal. A-Gen. 455 2013 46 57 D. Santi, T. Holl, V. Calemma, et al., Appl. Catal. A-Gen. 455 (2013) 46-57. [117] M. Du Z. Qin H. Ge Fuel Process. Technol. 91 2010 1655 1661 M. Du, Z. Qin, H. Ge, et al., Fuel Process. Technol. 91 (2010) 1655-1661. [118] H. Deldari Appl. Catal. A-Gen. 293 2005 1 10 H. Deldari, Appl. Catal. A-Gen. 293 (2005) 1-10. [119] J.W. Ward Fuel Process. Technol. 35 1993 55 85 J.W. Ward, Fuel Process. Technol. 35 (1993) 55-85. [120] S.R. Kirumakki B.G. Shpeizer G.V. Sagar J. Catal. 242 2006 319 331 S.R. Kirumakki, B.G. Shpeizer, G.V. Sagar, et al., J. Catal. 242 (2006) 319-331. [121] J.A. Schwarz C. Contescu A. Contescu Chem. Rev. 95 1995 477 510 J.A. Schwarz, C. Contescu, A. Contescu, Chem. Rev. 95 (1995) 477-510. [122] A.I. Reyes De La Torre J.M. Dominguze Catal. Today 148 2009 55 62 A.I. Reyes De La Torre, J.M. Dominguze, Catal. Today 148 (2009) 55-62. [123] T. Ran B.J. Shen F.C. Wang Energ. Fuel 23 2009 55 59 T. Ran, B.J. Shen, F.C. Wang, et al., Energ. Fuel 23 (2009) 55-59. [124] S.J. Ardakani X. Liu K.J. Smith Appl. Catal. A-Gen. 324 2007 9 19 S.J. Ardakani, X. Liu, K.J. Smith, Appl. Catal. A-Gen. 324 (2007) 9-19. [125] X. Liu S.J. Ardakani K.J. Smith Catal. Commun. 12 2011 454 458 X. Liu, S.J. Ardakani, K.J. Smith, Catal. Commun. 12 (2011) 454-458. [126] J. Shin Y. Oh Y. Choi Appl. Catal. A-Gen. 547 2017 12 21 J. Shin, Y. Oh, Y. Choi, et al., Appl. Catal. A-Gen. 547 (2017) 12-21. [127] D.P. Upare S. Park M.S. Kim J. Ind. Eng. Chem. 35 2016 99 107 D.P. Upare, S. Park, M.S. Kim, et al., J. Ind. Eng. Chem. 35 (2016) 99-107. [128] J. Lee Y. Choi J. Shin Catal. Today 265 2016 144 153 J. Lee, Y. Choi, J. Shin, et al., Catal. Today 265 (2016) 144-153. [129] K.C. Mouli V. Sundaramurthy A.K. Dalai J. Mol. Catal. A-Chem. 304 2009 77 84 K.C. Mouli, V. Sundaramurthy, A.K. Dalai, J. Mol. Catal. A-Chem. 304 (2009) 77-84. [130] Y.S. Kim K.S. Cho Y.K. Lee J. Catal. 351 2017 67 78 Y.S. Kim, K.S. Cho, Y.K. Lee, J. Catal. 351 (2017) 67-78. [131] R. Saab K. Polychronopoulou L.X. Zheng J. Ind. Eng. Chem. 89 2020 83 103 R. Saab, K. Polychronopoulou, L.X. Zheng, et al., J. Ind. Eng. Chem. 89 (2020) 83-103. [132] S.P. Elangovan M. Hartmann J. Catal. 217 2003 388 395 S.P. Elangovan, M. Hartmann, J. Catal. 217 (2003) 388-395. [133] K. Sato Y. Iwata Y. Miki Catal. Today 45 1998 367 374 K. Sato, Y. Iwata, Y. Miki, et al., Catal. Today 45 (1998) 367-374. [134] H.B. Mostad T.U. Riis O.H. Ellestad Appl. Catal. 58 1990 105 117 H.B. Mostad, T.U. Riis, O.H. Ellestad, Appl. Catal. 58 (1990) 105-117. [135] J.L. Tang Y.H. Xu X.Q. Wang J. Fuel Chem. Technol. 40 2012 721 726 J.L. Tang, Y.H. Xu, X.Q. Wang, et al., J. Fuel Chem. Technol. 40 (2012) 721-726. [136] Y.X. Lin C. Yang C. Choi Chem. Eng. Sci. 229 2021 116105 Y.X. Lin, C. Yang, C. Choi, Chem. Eng. Sci. 229 (2021) 116105. [137] B. Cifuentes F. Bustamante D.G. Araiza Appl. Catal. A-Gen. 598 2020 117568 B. Cifuentes, F. Bustamante, D.G. Araiza, et al., Appl. Catal. A-Gen. 598 (2020) 117568. [138] Y.J. Zhang J.C. Zhou K. Li Mol. Catal. 478 2019 110567 Y.J. Zhang, J.C. Zhou, K. Li, et al., Mol. Catal. 2019 (478) 110567. [139] H. Konno T. Tago Y. Nakasaka Micro. Meso. Mat. 175 2013 25 33 H. Konno, T. Tago, Y. Nakasaka, et al., Micro. Meso. Mat. 175 (2013) 25-33. [140] R. Pujro M. Falco U. Sedran Appl. Catal. A-Gen. 489 2015 123 130 R. Pujro, M. Falco, U. Sedran, et al., Appl. Catal. A-Gen. 489 (2015) 123-130. [141] Y. Oh J. Shin H. Noh Appl. Catal. A-Gen. 577 2019 86 98 Y. Oh, J. Shin, H. Noh, et al., Appl. Catal. A-Gen. 577 (2019) 86-98. [142] F.A. Barbosa A.C.B.D. Santos M.I.P.D. Silva Catal. Today 98 2004 109 113 F.A. Barbosa, A.C.B.D. Santos, M.I.P.D. Silva, et al., Catal. Today 98 (2004) 109-113. [143] A. Corma M.S. Grande V. Gonzalez-Alfaro J. Catal. 159 1996 375 382 A. Corma, M.S. Grande, V. Gonzalez-Alfaro, et al., J. Catal. 159 (1996) 375-382. [144] L. Xin X.X. Liu X.B. Chen Energ. Fuel 31 2017 6968 6976 L. Xin, X.X. Liu, X.B. Chen, et al., Energ. Fuel 31 (2017) 6968-6976. [145] S.Y. Ren B. Meng X. Sui Ind. Eng. Chem. Res. 58 2019 7886 7891 S.Y. Ren, B. Meng, X. Sui, et al., Ind. Eng. Chem. Res. 58 (2019) 7886-7891. [146] Y.J. Lee E.S. Kim J.R. Kim J. Nanosci. Nanotechno. 16 2016 1715 1719 Y.J. Lee, E.S. Kim, J.R. Kim, et al., J. Nanosci. Nanotechno. 16 (2016) 1715-1719. [147] X.B. Liu S.J. Ardakani K.J. Smith Catal. Commun. 12 2011 454 458 X.B. Liu, S.J. Ardakani, K.J. Smith, Catal. Commun. 12 (2011) 454-458. [148] Y. Cheng H.F. Fan S.X. Wu Green Chem. 11 2009 1061 1065 Y. Cheng, H.F. Fan, S.X. Wu, et al., Green Chem. 11 (2009) 1061-1065. [149] J. Jiao J. Fu Y. Wei J. Catal. 356 2017 269 282 J. Jiao, J. Fu, Y. Wei, et al., J. Catal. 356 (2017) 269-282. [150] E. Benazzi L. Leite N. Marchal-George J. Catal. 217 2003 376 387 E. Benazzi, L. Leite, N. Marchal-George, et al., J. Catal. 217 (2003) 376-387. [151] A. Aguilar-Tapia L. Delannoy C. Louis J. Catal. 344 2016 515 523 A. Aguilar-Tapia, L. Delannoy, C. Louis, et al., J. Catal. 344 (2016) 515-523 [152] Z. Wang D. Brouri S. Casale J. Catal. 340 2016 95 106 Z. Wang, D. Brouri, S. Casale, J. Catal. 340 (2016) 95-106. [153] H.A.E. Sayed A.M.A.E. Naggar B.H. Heakal Fuel 209 2017 127 131 H.A.E. Sayed, A.M.A.E. Naggar, B.H. Heakal, et al., Fuel 209 (2017) 127-131. [154] L. Lv Y. Bo D. Ji Ind. Eng. Chem. Res. 57 2018 13889 13894 L. Lv, Y. Bo, D. Ji, et al., Ind. Eng. Chem. Res. 57 (2018) 13889-13894. [155] M.A.A. Mamun H. Furuta A. Hatta Jpn. J. Appl. Phys. 57 2018 06JF02 M.A.A. Mamun, H. Furuta, A. Hatta, Jpn. J. Appl. Phys. 57 (2018) 06JF02. [156] J.J. Lee H. Kim S.H. Moon Appl. Catal. B-Environ. 41 2003 171 180 J.J. Lee, H. Kim, S.H. Moon, Appl. Catal. B-Environ. 41 (2003) 171-180. [157] J. Liang M. Wu P. Wei J. Catal. 358 2018 155 167 J. Liang, M. Wu, P. Wei, et al., J. Catal. 358 (2018) 155-167. [158] Y. Zhang W. Han X. Long Catal. Commun. 82 2016 20 23 Y. Zhang, W. Han, X. Long, et al., Catal. Commun. 82 (2016) 20-23. [159] T. Wu S.L. Chen G.M. Yuan Ind. Eng. Chem. Res. 59 2020 5546 5556 T. Wu, S.L. Chen, G.M. Yuan, et al., Ind. Eng. Chem. Res. 59 (2020) 5546-5556. [160] J. Xu T. Huang Y. Fan Appl. Catal. B-Environ. 203 2017 839 850 J. Xu, T, Huang, Y. Fan, Appl. Catal. B-Environ. 203 (2017) 839-850. [161] S. Qiu X. Zhang Q. Liu Catal. Commun. 42 2013 73 78 S. Qiu, X. Zhang, Q. Liu, et al., Catal. Commun. 42 (2013) 73-78. [162] B. Zhang G. Sun S. Ding J. Am. Chem. Soc. 141 2019 8185 8197 B. Zhang, G. Sun, S. Ding, et al., J. Am. Chem. Soc. 141 (2019) 8185-8197. [163] N.J. O’connor A.S.M. Jonayat M.J. Janik Nat. Catal. 1 2018 531 539 N.J. O’connor. A.S.M. Jonayat, M.J. Janik, et al., Nat. Catal. 1 (2018) 531-539. [164] J. Zecevic G. Vanbutsele K.P. de Jong Nat. 258 2015 245 254 J. Zecevic, G. Vanbutsele, K.P. de Jong, et al., Nat. 258 (2015) 245-254. [165] A. Gutierrez J.M. Arandes P. Castano Fuel Production. Chem. Eng. Technol. 35 2012 653 660 A. Gutierrez, J.M. Arandes, P. Castano, et al., Fuel Production. Chem. Eng. Technol. 35 (2012) 653-660. [166] M. Chareonpanich Z.G. Zhang A. Nishijima Fuel 74 1995 1636 1640 M. Chareonpanich, Z.G. Zhang, A. Nishijima, et al., Fuel 74 (1995) 1636-1640. [167] L. Ding Y. Zheng Z. Zhang Appl. Catal. A-Gen. 319 2007 25 37 L. Ding, Y. Zheng, Z. Zhang, et al., Appl. Catal. A-Gen. 319 (2007) 25-37. [168] M. Santikunaporn J.E. Herrera S. Jongpatiwut J. Catal. 228 2004 100 113 M. Santikunaporn, J.E. Herrera, S. Jongpatiwut, et al., J. Catal. 228 (2004) 100-113. [169] A. Gutierrez J.M. Arandes P. Castano Energ. Fuel 26 2012 5897 5904 A. Gutierrez, J.M. Arandes, P. Castano, et al., Energ. Fuel 26 (2012) 5897-5904. [170] S. Ishigaki S. Goto Catal. Today 48 1999 31 40 S. Ishigaki, S. Goto, Catal. Today 48 (1999) 31-40. [171] D.P. Upare S. Park M.S. Kim J. Ind. Eng. Chem. 46 2017 356 363 D.P. Upare, S. Park, M.S. Kim, et al., J. Ind. Eng. Chem. 46 (2017) 356-363. [172] A. Gutierrez J.M. Arandes P. Castano Fuel Process. Technol. 95 2012 8 15 A. Gutierrez, J.M. Arandes, P. Castano, et al., Fuel Process. Technol. 95 (2012) 8-15. [173] D. Bisth J. Petri Indian Chem. Eng. 56 2014 321 335 D. Bisth, J. Petri, Indian Chem. Eng. 56 (2014) 321-335. [174] J.A. Johnson S.J. Frey V.P. Thakkar AM-07-40 2007 UOP LLC. Des Plaines, IL J.A. Johnson, S.J. Frey, V.P. Thakkar, AM-07-40, UOP LLC., Des Plaines, IL (2007). [175] V. Simanzhenkov M.C. Oballa G. Kim Ind. Eng. Chem. Res. 49 2010 953 963 V. Simanzhenkov, M.C. Oballa, G. Kim, Ind. Eng. Chem. Res. 49 (2010) 953-963. [176] X. Huang Chem. Ind. Eng. Progress 32 2013 2263 2266 X. Huang, Chem. Ind. Eng. Progress 32 (2013) 2263-2266. [177] M. N. Sheng, W.A. Mameniskis, P.W. Ryan, US 4,022,681 (1977). [178] P.A. Howley, S.S. Shin, US 5001296 (1991). [179] C.J. Kim, T.J. Kim, D.W. Kim, et al., EP 2351820A2 (2011). [180] H.C. Kim, S.W. Kim, Y.S. Kim, et al., US 2013/0253242 (2013). [181] M.K. Iwasa, US 2016/0024400A1 (2016). [182] S. Yanagawa, Y. Aoki, K. Hayasaka, US 9,243,192 (2016). [183] Q. Wang Z.G. Hou B. Zhang Petrol. Sci. 15 2018 605 612 Q. Wang, Z.G. Hou, B. Zhang, et al., Petrol. Sci. 15 (2018) 605-612. [184] E. Manek J. Haydary Chinese J. Chem. Eng. 27 2019 298 304 E. Manek, J. Haydary, Chinese J. Chem. Eng. 27 (2019) 298-304.",
      "scopus-id": "85102870779",
      "coredata": {
        "eid": "1-s2.0-S0926860X21001095",
        "dc:description": "With the peak in diesel consumption and the impact of new energy in the coming years, research will be focused on the treatment of excess diesel. In addition, low carbon aromatics such as benzene, toluene, and xylene (BTX) are important chemical raw materials that will be in high demand in the next few years but are still in short supply. Thus, many researchers have proposed the use of excess diesel, especially the inferior diesel-like light cycle oil (LCO) to produce BTX. The hydrocracking process is typically used to convert LCO to BTX. To provide some guidance on this topic, this review summarizes the typical group compositions in LCO from different refineries, hydrocracking reaction mechanisms of aromatics and cycloalkanes in LCO, hydrocracking catalysts, improved hydrocracking conditions, related hydrocracking technologies, and future developments in the production of BTX. The amount of aromatics with different ring numbers in LCO has been clearly analyzed, and their part types have also been studied. However, some complex types of aromatics in LCO remain unknown. In addition, the hydrocracking mechanisms and pathways of aromatics in LCO to produce BTX have garnered great attention since the 1990s. Based on this, hydrocracking catalysts and related technologies have been developed by many institutions and corporations to convert aromatics to BTX; however, there are still some problems including an insufficient selectivity of BTX, low yield of liquid products, and excessive energy consumption. In the future, more advanced technologies can be applied to analyze all types of aromatics in LCO, which, along with the aid and application of computational chemistry tools, could help deepen the understanding of the reaction pathways of aromatics and develop more efficient catalysts by balancing the properties of the active phase and supporting the surmounting of current shortcomings. Owing to this high value utilization of inferior diesel, the upcoming problem of diesel surplus can be solved effectively, and the utilization of LCO to produce BTX is one possible path.",
        "openArchiveArticle": "false",
        "prism:coverDate": "2021-04-25",
        "openaccessUserLicense": null,
        "prism:aggregationType": "Journal",
        "prism:url": "https://api.elsevier.com/content/article/pii/S0926860X21001095",
        "dc:creator": [
          {
            "@_fa": "true",
            "$": "Chen, Feng"
          },
          {
            "@_fa": "true",
            "$": "Zhang, Guohao"
          },
          {
            "@_fa": "true",
            "$": "Weng, XiaoYi"
          },
          {
            "@_fa": "true",
            "$": "Zhang, Yuhao"
          },
          {
            "@_fa": "true",
            "$": "Zhao, Liang"
          },
          {
            "@_fa": "true",
            "$": "Cao, Liyuan"
          },
          {
            "@_fa": "true",
            "$": "Gao, Jinsen"
          },
          {
            "@_fa": "true",
            "$": "Xu, Chunming"
          },
          {
            "@_fa": "true",
            "$": "Liu, Xiangqi"
          },
          {
            "@_fa": "true",
            "$": "Gao, Xuhui"
          }
        ],
        "link": [
          {
            "@_fa": "true",
            "@rel": "self",
            "@href": "https://api.elsevier.com/content/article/pii/S0926860X21001095"
          },
          {
            "@_fa": "true",
            "@rel": "scidir",
            "@href": "https://www.sciencedirect.com/science/article/pii/S0926860X21001095"
          }
        ],
        "dc:format": "application/json",
        "openaccessType": null,
        "pii": "S0926-860X(21)00109-5",
        "prism:volume": "616",
        "articleNumber": "118095",
        "prism:publisher": "Elsevier B.V.",
        "dc:title": "High value utilization of inferior diesel for BTX production: Mechanisms, catalysts, conditions and challenges",
        "prism:copyright": "© 2021 Elsevier B.V. All rights reserved.",
        "openaccess": "0",
        "prism:issn": "0926860X",
        "dcterms:subject": [
          {
            "@_fa": "true",
            "$": "Inferior diesel"
          },
          {
            "@_fa": "true",
            "$": "LCO"
          },
          {
            "@_fa": "true",
            "$": "BTX"
          },
          {
            "@_fa": "true",
            "$": "Reaction mechanism"
          },
          {
            "@_fa": "true",
            "$": "Catalysts"
          },
          {
            "@_fa": "true",
            "$": "Technology"
          }
        ],
        "openaccessArticle": "false",
        "prism:publicationName": "Applied Catalysis A: General",
        "openaccessSponsorType": null,
        "prism:pageRange": "118095",
        "pubType": "rev",
        "prism:coverDisplayDate": "25 April 2021",
        "prism:doi": "10.1016/j.apcata.2021.118095",
        "prism:startingPage": "118095",
        "dc:identifier": "doi:10.1016/j.apcata.2021.118095",
        "openaccessSponsorName": null
      },
      "objects": {
        "object": [
          {
            "@category": "standard",
            "@height": "305",
            "@width": "565",
            "@_fa": "true",
            "$": "https://api.elsevier.com/content/object/eid/1-s2.0-S0926860X21001095-gr5.jpg?httpAccept=%2A%2F%2A",
            "@multimediatype": "JPEG image file",
            "@type": "IMAGE-DOWNSAMPLED",
            "@size": "23790",
            "@ref": "gr5",
            "@mimetype": "image/jpeg"
          },
          {
            "@category": "standard",
            "@height": "359",
            "@width": "565",
            "@_fa": "true",
            "$": "https://api.elsevier.com/content/object/eid/1-s2.0-S0926860X21001095-gr6.jpg?httpAccept=%2A%2F%2A",
            "@multimediatype": "JPEG image file",
            "@type": "IMAGE-DOWNSAMPLED",
            "@size": "35616",
            "@ref": "gr6",
            "@mimetype": "image/jpeg"
          },
          {
            "@category": "standard",
            "@height": "157",
            "@width": "470",
            "@_fa": "true",
            "$": "https://api.elsevier.com/content/object/eid/1-s2.0-S0926860X21001095-gr7.jpg?httpAccept=%2A%2F%2A",
            "@multimediatype": "JPEG image file",
            "@type": "IMAGE-DOWNSAMPLED",
            "@size": "17054",
            "@ref": "gr7",
            "@mimetype": "image/jpeg"
          },
          {
            "@category": "standard",
            "@height": "254",
            "@width": "470",
            "@_fa": "true",
            "$": "https://api.elsevier.com/content/object/eid/1-s2.0-S0926860X21001095-gr8.jpg?httpAccept=%2A%2F%2A",
            "@multimediatype": "JPEG image file",
            "@type": "IMAGE-DOWNSAMPLED",
            "@size": "31323",
            "@ref": "gr8",
            "@mimetype": "image/jpeg"
          },
          {
            "@category": "standard",
            "@height": "163",
            "@width": "565",
            "@_fa": "true",
            "$": "https://api.elsevier.com/content/object/eid/1-s2.0-S0926860X21001095-gr1.jpg?httpAccept=%2A%2F%2A",
            "@multimediatype": "JPEG image file",
            "@type": "IMAGE-DOWNSAMPLED",
            "@size": "15663",
            "@ref": "gr1",
            "@mimetype": "image/jpeg"
          },
          {
            "@category": "standard",
            "@height": "342",
            "@width": "565",
            "@_fa": "true",
            "$": "https://api.elsevier.com/content/object/eid/1-s2.0-S0926860X21001095-gr2.jpg?httpAccept=%2A%2F%2A",
            "@multimediatype": "JPEG image file",
            "@type": "IMAGE-DOWNSAMPLED",
            "@size": "37424",
            "@ref": "gr2",
            "@mimetype": "image/jpeg"
          },
          {
            "@category": "standard",
            "@height": "200",
            "@width": "385",
            "@_fa": "true",
            "$": "https://api.elsevier.com/content/object/eid/1-s2.0-S0926860X21001095-ga1.jpg?httpAccept=%2A%2F%2A",
            "@multimediatype": "JPEG image file",
            "@type": "IMAGE-DOWNSAMPLED",
            "@size": "19706",
            "@ref": "ga1",
            "@mimetype": "image/jpeg"
          },
          {
            "@category": "standard",
            "@height": "376",
            "@width": "565",
            "@_fa": "true",
            "$": "https://api.elsevier.com/content/object/eid/1-s2.0-S0926860X21001095-gr3.jpg?httpAccept=%2A%2F%2A",
            "@multimediatype": "JPEG image file",
            "@type": "IMAGE-DOWNSAMPLED",
            "@size": "34109",
            "@ref": "gr3",
            "@mimetype": "image/jpeg"
          },
          {
            "@category": "standard",
            "@height": "500",
            "@width": "565",
            "@_fa": "true",
            "$": "https://api.elsevier.com/content/object/eid/1-s2.0-S0926860X21001095-gr4.jpg?httpAccept=%2A%2F%2A",
            "@multimediatype": "JPEG image file",
            "@type": "IMAGE-DOWNSAMPLED",
            "@size": "55865",
            "@ref": "gr4",
            "@mimetype": "image/jpeg"
          },
          {
            "@category": "thumbnail",
            "@height": "118",
            "@width": "219",
            "@_fa": "true",
            "$": "https://api.elsevier.com/content/object/eid/1-s2.0-S0926860X21001095-gr5.sml?httpAccept=%2A%2F%2A",
            "@multimediatype": "GIF image file",
            "@type": "IMAGE-THUMBNAIL",
            "@size": "3840",
            "@ref": "gr5",
            "@mimetype": "image/gif"
          },
          {
            "@category": "thumbnail",
            "@height": "139",
            "@width": "219",
            "@_fa": "true",
            "$": "https://api.elsevier.com/content/object/eid/1-s2.0-S0926860X21001095-gr6.sml?httpAccept=%2A%2F%2A",
            "@multimediatype": "GIF image file",
            "@type": "IMAGE-THUMBNAIL",
            "@size": "5202",
            "@ref": "gr6",
            "@mimetype": "image/gif"
          },
          {
            "@category": "thumbnail",
            "@height": "73",
            "@width": "219",
            "@_fa": "true",
            "$": "https://api.elsevier.com/content/object/eid/1-s2.0-S0926860X21001095-gr7.sml?httpAccept=%2A%2F%2A",
            "@multimediatype": "GIF image file",
            "@type": "IMAGE-THUMBNAIL",
            "@size": "6320",
            "@ref": "gr7",
            "@mimetype": "image/gif"
          },
          {
            "@category": "thumbnail",
            "@height": "118",
            "@width": "219",
            "@_fa": "true",
            "$": "https://api.elsevier.com/content/object/eid/1-s2.0-S0926860X21001095-gr8.sml?httpAccept=%2A%2F%2A",
            "@multimediatype": "GIF image file",
            "@type": "IMAGE-THUMBNAIL",
            "@size": "5157",
            "@ref": "gr8",
            "@mimetype": "image/gif"
          },
          {
            "@category": "thumbnail",
            "@height": "63",
            "@width": "219",
            "@_fa": "true",
            "$": "https://api.elsevier.com/content/object/eid/1-s2.0-S0926860X21001095-gr1.sml?httpAccept=%2A%2F%2A",
            "@multimediatype": "GIF image file",
            "@type": "IMAGE-THUMBNAIL",
            "@size": "2987",
            "@ref": "gr1",
            "@mimetype": "image/gif"
          },
          {
            "@category": "thumbnail",
            "@height": "133",
            "@width": "219",
            "@_fa": "true",
            "$": "https://api.elsevier.com/content/object/eid/1-s2.0-S0926860X21001095-gr2.sml?httpAccept=%2A%2F%2A",
            "@multimediatype": "GIF image file",
            "@type": "IMAGE-THUMBNAIL",
            "@size": "5808",
            "@ref": "gr2",
            "@mimetype": "image/gif"
          },
          {
            "@category": "thumbnail",
            "@height": "114",
            "@width": "219",
            "@_fa": "true",
            "$": "https://api.elsevier.com/content/object/eid/1-s2.0-S0926860X21001095-ga1.sml?httpAccept=%2A%2F%2A",
            "@multimediatype": "GIF image file",
            "@type": "IMAGE-THUMBNAIL",
            "@size": "6106",
            "@ref": "ga1",
            "@mimetype": "image/gif"
          },
          {
            "@category": "thumbnail",
            "@height": "146",
            "@width": "219",
            "@_fa": "true",
            "$": "https://api.elsevier.com/content/object/eid/1-s2.0-S0926860X21001095-gr3.sml?httpAccept=%2A%2F%2A",
            "@multimediatype": "GIF image file",
            "@type": "IMAGE-THUMBNAIL",
            "@size": "5630",
            "@ref": "gr3",
            "@mimetype": "image/gif"
          },
          {
            "@category": "thumbnail",
            "@height": "164",
            "@width": "185",
            "@_fa": "true",
            "$": "https://api.elsevier.com/content/object/eid/1-s2.0-S0926860X21001095-gr4.sml?httpAccept=%2A%2F%2A",
            "@multimediatype": "GIF image file",
            "@type": "IMAGE-THUMBNAIL",
            "@size": "6513",
            "@ref": "gr4",
            "@mimetype": "image/gif"
          },
          {
            "@category": "high",
            "@height": "1348",
            "@width": "2500",
            "@_fa": "true",
            "$": "https://api.elsevier.com/content/object/eid/1-s2.0-S0926860X21001095-gr5_lrg.jpg?httpAccept=%2A%2F%2A",
            "@multimediatype": "JPEG image file",
            "@type": "IMAGE-HIGH-RES",
            "@size": "173029",
            "@ref": "gr5",
            "@mimetype": "image/jpeg"
          },
          {
            "@category": "high",
            "@height": "1588",
            "@width": "2500",
            "@_fa": "true",
            "$": "https://api.elsevier.com/content/object/eid/1-s2.0-S0926860X21001095-gr6_lrg.jpg?httpAccept=%2A%2F%2A",
            "@multimediatype": "JPEG image file",
            "@type": "IMAGE-HIGH-RES",
            "@size": "246643",
            "@ref": "gr6",
            "@mimetype": "image/jpeg"
          },
          {
            "@category": "high",
            "@height": "698",
            "@width": "2083",
            "@_fa": "true",
            "$": "https://api.elsevier.com/content/object/eid/1-s2.0-S0926860X21001095-gr7_lrg.jpg?httpAccept=%2A%2F%2A",
            "@multimediatype": "JPEG image file",
            "@type": "IMAGE-HIGH-RES",
            "@size": "152326",
            "@ref": "gr7",
            "@mimetype": "image/jpeg"
          },
          {
            "@category": "high",
            "@height": "1126",
            "@width": "2083",
            "@_fa": "true",
            "$": "https://api.elsevier.com/content/object/eid/1-s2.0-S0926860X21001095-gr8_lrg.jpg?httpAccept=%2A%2F%2A",
            "@multimediatype": "JPEG image file",
            "@type": "IMAGE-HIGH-RES",
            "@size": "198221",
            "@ref": "gr8",
            "@mimetype": "image/jpeg"
          },
          {
            "@category": "high",
            "@height": "722",
            "@width": "2500",
            "@_fa": "true",
            "$": "https://api.elsevier.com/content/object/eid/1-s2.0-S0926860X21001095-gr1_lrg.jpg?httpAccept=%2A%2F%2A",
            "@multimediatype": "JPEG image file",
            "@type": "IMAGE-HIGH-RES",
            "@size": "107781",
            "@ref": "gr1",
            "@mimetype": "image/jpeg"
          },
          {
            "@category": "high",
            "@height": "1515",
            "@width": "2500",
            "@_fa": "true",
            "$": "https://api.elsevier.com/content/object/eid/1-s2.0-S0926860X21001095-gr2_lrg.jpg?httpAccept=%2A%2F%2A",
            "@multimediatype": "JPEG image file",
            "@type": "IMAGE-HIGH-RES",
            "@size": "250831",
            "@ref": "gr2",
            "@mimetype": "image/jpeg"
          },
          {
            "@category": "high",
            "@height": "886",
            "@width": "1707",
            "@_fa": "true",
            "$": "https://api.elsevier.com/content/object/eid/1-s2.0-S0926860X21001095-ga1_lrg.jpg?httpAccept=%2A%2F%2A",
            "@multimediatype": "JPEG image file",
            "@type": "IMAGE-HIGH-RES",
            "@size": "148953",
            "@ref": "ga1",
            "@mimetype": "image/jpeg"
          },
          {
            "@category": "high",
            "@height": "1664",
            "@width": "2500",
            "@_fa": "true",
            "$": "https://api.elsevier.com/content/object/eid/1-s2.0-S0926860X21001095-gr3_lrg.jpg?httpAccept=%2A%2F%2A",
            "@multimediatype": "JPEG image file",
            "@type": "IMAGE-HIGH-RES",
            "@size": "223563",
            "@ref": "gr3",
            "@mimetype": "image/jpeg"
          },
          {
            "@category": "high",
            "@height": "2212",
            "@width": "2500",
            "@_fa": "true",
            "$": "https://api.elsevier.com/content/object/eid/1-s2.0-S0926860X21001095-gr4_lrg.jpg?httpAccept=%2A%2F%2A",
            "@multimediatype": "JPEG image file",
            "@type": "IMAGE-HIGH-RES",
            "@size": "379793",
            "@ref": "gr4",
            "@mimetype": "image/jpeg"
          },
          {
            "@category": "standard",
            "@_fa": "true",
            "$": "https://api.elsevier.com/content/object/eid/1-s2.0-S0926860X21001095-am.pdf?httpAccept=%2A%2F%2A",
            "@multimediatype": "Acrobat PDF file",
            "@type": "AAM-PDF",
            "@size": "1418700",
            "@ref": "am",
            "@mimetype": "application/pdf"
          }
        ]
      },
      "link": {
        "@rel": "abstract",
        "@href": "https://api.elsevier.com/content/abstract/scopus_id/85102870779"
      }
    }
  }
}