{
  "metadata": {
    "title": "Direct and easily prepared nanocomposite impurity-free hydroxyapatite derived from CKD as an effective catalyst for trans-2-butene production",
    "authors": "; ; ",
    "journal": "Applied Catalysis A: General",
    "date": "2023-02-25",
    "doi": "10.1016/j.apcata.2023.119039",
    "abstract": "",
    "uri": "https://api.elsevier.com/content/article/pii/S0926860X23000194",
    "pii": "S0926860X23000194"
  },
  "fulltext": {
    "full-text-retrieval-response": {
      "scopus-eid": "2-s2.0-85146872339",
      "originalText": "serial JL 271346 291210 291744 291809 31 90 Applied Catalysis A: General APPLIEDCATALYSISAGENERAL 2023-01-15 2023-01-15 2023-01-25 2023-01-25 2023-12-07T20:52:57 1-s2.0-S0926860X23000194 S0926-860X(23)00019-4 S0926860X23000194 10.1016/j.apcata.2023.119039 S300 S300.1 FULL-TEXT 1-s2.0-S0926860X23X00039 2024-01-01T12:35:59.692098Z 0 0 20230225 2023 2023-01-15T15:17:32.402677Z absattachment articleinfo articlenumber articletitlenorm authfirstinitialnorm authfirstsurnamenorm cid cids contenttype copyright crossmark dateloaded dateloadedtxt datesearch datesort dateupdated dco docsubtype doctype doi eid ewtransactionid fundingbodyid hubeid indexeddate issn issnnorm itemstage itemtransactionid itemweight oauserlicense openaccess openarchive pg pgfirst pii piinorm pubdatestart pubdatetxt pubyr sortorder sponsoredaccesstype srctitle srctitlenorm srctype ssids alllist content oa subj subheadings suppl tomb volfirst volissue volumelist webpdf webpdfpagecount yearnav figure table e-component body mmlmath acknowledge affil appendices articletitle auth authfirstini authfull authkeywords authlast grantnumber grantsponsor highlightsabst primabst ref specialabst 0926-860X 0926860X UNLIMITED JISC2022 true 652 652 C Volume 652 15 119039 119039 119039 20230225 25 February 2023 2023-02-25 2023 article fla © 2023 The Author(s). Published by Elsevier B.V. DIRECTEASILYPREPAREDNANOCOMPOSITEIMPURITYFREEHYDROXYAPATITEDERIVEDCKDEFFECTIVECATALYSTFORTRANS2BUTENEPRODUCTION NASR M 1 Introduction 2 Experimental section 2.1 Materials and preparation 2.2 Estimating Ca-ions recovered as CaO from the delivered CKD sample, and Ca-hydroxyapatite (HAPT) preparation from cement kiln dust (CKD) 2.3 Characterization 2.4 Catalytic activity of HAPT at 500 °C during the decomposition of sec-butanol 3 Results and discussion 3.1 Characterization 3.1.1 Thermal analyses 3.1.2 XRD and FT-IR analyses 3.1.3 Surface properties and morphology of HAPT at 500 °C 3.2 Decomposition of sec-butanol over HAPT 4 Conclusions CRediT authorship contribution statement Acknowledgement Appendix A Supplementary material References DRACK 2018 571 577 J SEO 2019 M PACEWSKA 2020 371 393 B FAISAL 2021 A BINMOBARAK 2022 M MUTHU 2022 1326 1339 D AKPAN 2021 2291 2294 E HAN 2022 K MATHINA 2022 1817 1820 M SHARIFIANJAZI 2021 F BORGES 2022 S MTAVANGU 2022 S ZULIANTONI 2022 Z CHEN 2022 5289 5298 H BRAHIMI 2022 S XU 2022 320 328 W COLLINSARUNPRAKASH 2022 1788 1792 V FADLI 2021 357 366 A DIXIT 2022 14672 14683 K XIN 2021 7512 Y JOSE 2021 3428 3436 T HAJIMIRZAEE 2019 345 351 S BRASIL 2021 802 813 H REGODEVASCONCELOS 2020 18502 18518 B VISHWAKARMA 2022 50 R DOBOSZ 2018 215 237 J ELKATATNY 2000 394 402 E ELKATATNY 2002 1721 1728 E ELKATATNY 2003 137 144 E ELKATATNY 2000 83 92 E KARAMPOUR 2022 656 674 H MEKHEMER 2004 13379 13386 G OSMAN 2012 307 315 A HALAWY 2022 e202200021 S HALAWY 2021 2200 2214 S KANIEWSKI 2019 M FAN 2021 X SCHRAUT 2021 K GARCIALODEIRO 2021 I LEFOJANE 2021 30 R ALI 2021 3928 3937 A PADMANABHAN 2019 171 178 V RODRIGUES 2022 14606 14617 A NOSRATI 2020 8552 H OSUCHUKWU 2021 O LONDONORESTREPO 2020 24454 24461 S AQUILANO 2014 2846 2852 D ASHRAF 2016 6173 6191 W BIEDRZYCKA 2021 102401 A YU 2004 742 748 P TANGBORIBOON 2012 313 322 N GAO 2013 1003 1006 S WANG 2006 1484 1487 Y LIU 2021 9366 9372 Y IYYAPPAN 2013 771 777 E FATEMEH 2021 152 162 M GALVANRUIZ 2007 169 175 M FOREROSOSSA 2021 P ASHOKAN 2022 12164 A MA 2021 K LI 2021 4307 4316 X ASHOKAN 2021 18575 18583 A SCALERA 2021 5071 5081 F HALAWY 2018 991 999 S ZHANG 2012 314 321 Y BITTENCOURT 2021 075003 A EMAMI 2021 Z GNANAMANI 2020 M NASH 2016 110 124 C BARNETT 2019 18325 18333 B CUKROWSKI 2016 2783 2798 I SOTO 2018 16772 16778 J BEDIA 2009 1557 1568 J LI 2017 403 411 Y FENARD 2015 317 324 Y SCHENK 2013 487 503 M HELVACI 2017 493 510 H JIANG 2021 1173 1180 W HALAWY 2022 2827 2841 S NASRX2023X119039 NASRX2023X119039XM Full 2023-01-15T09:15:37Z FundingBody JISC UK 2022: Hybrid journals http://creativecommons.org/licenses/by/4.0/ 2025-01-25T00:00:00.000Z 2025-01-25T00:00:00.000Z http://creativecommons.org/licenses/by-nc-nd/4.0/ This is an open access article under the CC BY license. © 2023 The Author(s). Published by Elsevier B.V. 2023-01-31T19:09:43.405Z http://vtw.elsevier.com/data/voc/AddOnTypes/50.7/aggregated-refined SEUPB Bryden Centre VA5048 Bryden Centre, Queen's University Belfast http://data.elsevier.com/vocabulary/SciValFunders/501100021777 http://sws.geonames.org/2635167/ EU Programmes Body The authors wish to dedicate this work to the spirit of the distinguished Egyptian professor Dr Samih A. Halawy who passed away on the 2nd of September 2022. The authors wish to acknowledge the support of The Bryden Centre project (Project ID VA5048 ). The Bryden Centre project is supported by the European Union’s INTERREG VA Programme , managed by the Special EU Programmes Body ( SEUPB ). The authors thank Dr Charlie Farrell for proofreading the revised manuscript. item S0926-860X(23)00019-4 S0926860X23000194 1-s2.0-S0926860X23000194 10.1016/j.apcata.2023.119039 271346 2024-01-01T12:35:59.692098Z 2023-02-25 UNLIMITED JISC2022 1-s2.0-S0926860X23000194-main.pdf https://s3-eu-west-1.amazonaws.com/prod-ucs-content-store-eu-west/content/pii:S0926860X23000194/MAIN/application/pdf/6e6a67ef5079188f4c65ca36fde42bf3/main.pdf main.pdf pdf true 8794556 MAIN 12 1-s2.0-S0926860X23000194-main_1.png https://s3-eu-west-1.amazonaws.com/prod-ucs-content-store-eu-west/content/pii:S0926860X23000194/PREVIEW/image/png/d9b9b738fe3a3810f36e1dec1902e86b/main_1.png main_1.png png 60105 849 656 IMAGE-WEB-PDF 1 1-s2.0-S0926860X23000194-gr1.jpg https://s3-eu-west-1.amazonaws.com/prod-ucs-content-store-eu-west/content/pii:S0926860X23000194/gr1/DOWNSAMPLED/image/jpeg/dfab185437b6dbf44dba06db598d381d/gr1.jpg gr1 gr1.jpg jpg 58176 485 376 IMAGE-DOWNSAMPLED 1-s2.0-S0926860X23000194-gr5.jpg https://s3-eu-west-1.amazonaws.com/prod-ucs-content-store-eu-west/content/pii:S0926860X23000194/gr5/DOWNSAMPLED/image/jpeg/c3160abc1589c29515735f3ee84792eb/gr5.jpg gr5 gr5.jpg jpg 66704 628 339 IMAGE-DOWNSAMPLED 1-s2.0-S0926860X23000194-gr4.jpg https://s3-eu-west-1.amazonaws.com/prod-ucs-content-store-eu-west/content/pii:S0926860X23000194/gr4/DOWNSAMPLED/image/jpeg/5164f5c5c21771de5936fefe578ba783/gr4.jpg gr4 gr4.jpg jpg 74674 514 565 IMAGE-DOWNSAMPLED 1-s2.0-S0926860X23000194-gr3.jpg https://s3-eu-west-1.amazonaws.com/prod-ucs-content-store-eu-west/content/pii:S0926860X23000194/gr3/DOWNSAMPLED/image/jpeg/091c319de46035fdd08730f43f5c3d62/gr3.jpg gr3 gr3.jpg jpg 177601 850 678 IMAGE-DOWNSAMPLED 1-s2.0-S0926860X23000194-gr2.jpg https://s3-eu-west-1.amazonaws.com/prod-ucs-content-store-eu-west/content/pii:S0926860X23000194/gr2/DOWNSAMPLED/image/jpeg/ec8ed42f0eb6dbb5639393fd1aca55f0/gr2.jpg gr2 gr2.jpg jpg 57590 369 565 IMAGE-DOWNSAMPLED 1-s2.0-S0926860X23000194-ga1.jpg https://s3-eu-west-1.amazonaws.com/prod-ucs-content-store-eu-west/content/pii:S0926860X23000194/ga1/DOWNSAMPLED/image/jpeg/081ce5fb80140aa35166a6464e2ba1d9/ga1.jpg ga1 true ga1.jpg jpg 26345 200 354 IMAGE-DOWNSAMPLED 1-s2.0-S0926860X23000194-gr9.jpg https://s3-eu-west-1.amazonaws.com/prod-ucs-content-store-eu-west/content/pii:S0926860X23000194/gr9/DOWNSAMPLED/image/jpeg/7ce718a953d7cf9c01c65c7c2a6107d4/gr9.jpg gr9 gr9.jpg jpg 57063 496 376 IMAGE-DOWNSAMPLED 1-s2.0-S0926860X23000194-gr8.jpg https://s3-eu-west-1.amazonaws.com/prod-ucs-content-store-eu-west/content/pii:S0926860X23000194/gr8/DOWNSAMPLED/image/jpeg/db4762ba133f7a9a105218ef92f71db8/gr8.jpg gr8 gr8.jpg jpg 70708 529 565 IMAGE-DOWNSAMPLED 1-s2.0-S0926860X23000194-gr7.jpg https://s3-eu-west-1.amazonaws.com/prod-ucs-content-store-eu-west/content/pii:S0926860X23000194/gr7/DOWNSAMPLED/image/jpeg/61fd15918f68603a1d07077c13dc039f/gr7.jpg gr7 gr7.jpg jpg 67505 645 339 IMAGE-DOWNSAMPLED 1-s2.0-S0926860X23000194-gr6.jpg https://s3-eu-west-1.amazonaws.com/prod-ucs-content-store-eu-west/content/pii:S0926860X23000194/gr6/DOWNSAMPLED/image/jpeg/27e52f61784dcb991c925ec89a761f82/gr6.jpg gr6 gr6.jpg jpg 20666 244 339 IMAGE-DOWNSAMPLED 1-s2.0-S0926860X23000194-gr1.sml https://s3-eu-west-1.amazonaws.com/prod-ucs-content-store-eu-west/content/pii:S0926860X23000194/gr1/THUMBNAIL/image/gif/79f2610a816281b5d4576e409ffb25df/gr1.sml gr1 gr1.sml sml 8628 164 127 IMAGE-THUMBNAIL 1-s2.0-S0926860X23000194-gr5.sml https://s3-eu-west-1.amazonaws.com/prod-ucs-content-store-eu-west/content/pii:S0926860X23000194/gr5/THUMBNAIL/image/gif/f0850ea409ba4e5cf72f12eb6debb126/gr5.sml gr5 gr5.sml sml 6895 163 88 IMAGE-THUMBNAIL 1-s2.0-S0926860X23000194-gr4.sml https://s3-eu-west-1.amazonaws.com/prod-ucs-content-store-eu-west/content/pii:S0926860X23000194/gr4/THUMBNAIL/image/gif/97b39bb894a59dc67ace75ea72ea03e9/gr4.sml gr4 gr4.sml sml 15206 164 180 IMAGE-THUMBNAIL 1-s2.0-S0926860X23000194-gr3.sml https://s3-eu-west-1.amazonaws.com/prod-ucs-content-store-eu-west/content/pii:S0926860X23000194/gr3/THUMBNAIL/image/gif/0d89b693dcd0d98ccbafcf0af01d99e1/gr3.sml gr3 gr3.sml sml 12316 164 131 IMAGE-THUMBNAIL 1-s2.0-S0926860X23000194-gr2.sml https://s3-eu-west-1.amazonaws.com/prod-ucs-content-store-eu-west/content/pii:S0926860X23000194/gr2/THUMBNAIL/image/gif/9f2404882c37a0233bb79807c4ddd0e2/gr2.sml gr2 gr2.sml sml 11369 143 219 IMAGE-THUMBNAIL 1-s2.0-S0926860X23000194-ga1.sml https://s3-eu-west-1.amazonaws.com/prod-ucs-content-store-eu-west/content/pii:S0926860X23000194/ga1/THUMBNAIL/image/gif/bd4d760f415f4136427cadb2f8e3af5c/ga1.sml ga1 true ga1.sml sml 14998 124 219 IMAGE-THUMBNAIL 1-s2.0-S0926860X23000194-gr9.sml https://s3-eu-west-1.amazonaws.com/prod-ucs-content-store-eu-west/content/pii:S0926860X23000194/gr9/THUMBNAIL/image/gif/f8d4f725c392e43985259b116b077c13/gr9.sml gr9 gr9.sml sml 8290 164 124 IMAGE-THUMBNAIL 1-s2.0-S0926860X23000194-gr8.sml https://s3-eu-west-1.amazonaws.com/prod-ucs-content-store-eu-west/content/pii:S0926860X23000194/gr8/THUMBNAIL/image/gif/677af75eefe2609eaae0e3b2fcecd506/gr8.sml gr8 gr8.sml sml 14562 164 175 IMAGE-THUMBNAIL 1-s2.0-S0926860X23000194-gr7.sml https://s3-eu-west-1.amazonaws.com/prod-ucs-content-store-eu-west/content/pii:S0926860X23000194/gr7/THUMBNAIL/image/gif/b7017abe9000b21c59915df70c8d2baf/gr7.sml gr7 gr7.sml sml 7409 164 86 IMAGE-THUMBNAIL 1-s2.0-S0926860X23000194-gr6.sml https://s3-eu-west-1.amazonaws.com/prod-ucs-content-store-eu-west/content/pii:S0926860X23000194/gr6/THUMBNAIL/image/gif/22458c472a314da97f1cd639645b9ead/gr6.sml gr6 gr6.sml sml 9531 158 219 IMAGE-THUMBNAIL 1-s2.0-S0926860X23000194-gr1_lrg.jpg https://s3-eu-west-1.amazonaws.com/prod-ucs-content-store-eu-west/content/pii:S0926860X23000194/HIGHRES/image/jpeg/bb8e47c9b5d1a688beb40350173df1a2/gr1_lrg.jpg gr1 gr1_lrg.jpg jpg 345535 2146 1663 IMAGE-HIGH-RES 1-s2.0-S0926860X23000194-gr5_lrg.jpg https://s3-eu-west-1.amazonaws.com/prod-ucs-content-store-eu-west/content/pii:S0926860X23000194/HIGHRES/image/jpeg/76128912ca9826621b79907e09f6b1e1/gr5_lrg.jpg gr5 gr5_lrg.jpg jpg 404362 2772 1497 IMAGE-HIGH-RES 1-s2.0-S0926860X23000194-gr4_lrg.jpg https://s3-eu-west-1.amazonaws.com/prod-ucs-content-store-eu-west/content/pii:S0926860X23000194/HIGHRES/image/jpeg/6fa63482bea0f143fbb0913f368bdb44/gr4_lrg.jpg gr4 gr4_lrg.jpg jpg 404458 2269 2495 IMAGE-HIGH-RES 1-s2.0-S0926860X23000194-gr3_lrg.jpg https://s3-eu-west-1.amazonaws.com/prod-ucs-content-store-eu-west/content/pii:S0926860X23000194/HIGHRES/image/jpeg/9f6168c174d1abd1ba7c03abc3b21ba1/gr3_lrg.jpg gr3 gr3_lrg.jpg jpg 1007217 3753 2994 IMAGE-HIGH-RES 1-s2.0-S0926860X23000194-gr2_lrg.jpg https://s3-eu-west-1.amazonaws.com/prod-ucs-content-store-eu-west/content/pii:S0926860X23000194/HIGHRES/image/jpeg/766032eb5802405eb71687b005938ab5/gr2_lrg.jpg gr2 gr2_lrg.jpg jpg 333134 1631 2495 IMAGE-HIGH-RES 1-s2.0-S0926860X23000194-ga1_lrg.jpg https://s3-eu-west-1.amazonaws.com/prod-ucs-content-store-eu-west/content/pii:S0926860X23000194/HIGHRES/image/jpeg/30736b868d258ef781c2da18fb8c8d3c/ga1_lrg.jpg ga1 true ga1_lrg.jpg jpg 209629 886 1570 IMAGE-HIGH-RES 1-s2.0-S0926860X23000194-gr9_lrg.jpg https://s3-eu-west-1.amazonaws.com/prod-ucs-content-store-eu-west/content/pii:S0926860X23000194/HIGHRES/image/jpeg/6ccaade51ab2e70dd06a0a488ba67be2/gr9_lrg.jpg gr9 gr9_lrg.jpg jpg 365072 2193 1663 IMAGE-HIGH-RES 1-s2.0-S0926860X23000194-gr8_lrg.jpg https://s3-eu-west-1.amazonaws.com/prod-ucs-content-store-eu-west/content/pii:S0926860X23000194/HIGHRES/image/jpeg/47e156592dc0a3761b2120e30be1553d/gr8_lrg.jpg gr8 gr8_lrg.jpg jpg 293817 2336 2495 IMAGE-HIGH-RES 1-s2.0-S0926860X23000194-gr7_lrg.jpg https://s3-eu-west-1.amazonaws.com/prod-ucs-content-store-eu-west/content/pii:S0926860X23000194/HIGHRES/image/jpeg/69bd6fad15f91b13f1e993261dec6997/gr7_lrg.jpg gr7 gr7_lrg.jpg jpg 411873 2847 1497 IMAGE-HIGH-RES 1-s2.0-S0926860X23000194-gr6_lrg.jpg https://s3-eu-west-1.amazonaws.com/prod-ucs-content-store-eu-west/content/pii:S0926860X23000194/HIGHRES/image/jpeg/e6ac4a53fd2600445e9d4f27b80711f4/gr6_lrg.jpg gr6 gr6_lrg.jpg jpg 115363 1079 1497 IMAGE-HIGH-RES 1-s2.0-S0926860X23000194-mmc1.docx https://s3-eu-west-1.amazonaws.com/prod-ucs-content-store-eu-west/content/pii:S0926860X23000194/mmc1/MAIN/application/vnd.openxmlformats-officedocument.wordprocessingml.document/5afc46cad69ea8139f03fc7642a47b29/mmc1.docx mmc1 mmc1.docx docx 141709 APPLICATION 1-s2.0-S0926860X23000194-si0001.svg https://s3-eu-west-1.amazonaws.com/prod-ucs-content-store-eu-west/content/pii:S0926860X23000194/image/svg+xml/70b1a413f19b59f4eb6a916020abfc1a/si0001.svg si0001 si0001.svg svg 7116 ALTIMG 1-s2.0-S0926860X23000194-si0002.svg https://s3-eu-west-1.amazonaws.com/prod-ucs-content-store-eu-west/content/pii:S0926860X23000194/image/svg+xml/ebb90f0c450d20c42881e2a013314dd3/si0002.svg si0002 si0002.svg svg 5016 ALTIMG 1-s2.0-S0926860X23000194-si0003.svg https://s3-eu-west-1.amazonaws.com/prod-ucs-content-store-eu-west/content/pii:S0926860X23000194/image/svg+xml/bfc838578f4b2faaf6eaca35c976a293/si0003.svg si0003 si0003.svg svg 5786 ALTIMG 1-s2.0-S0926860X23000194-am.pdf https://s3-eu-west-1.amazonaws.com/prod-ucs-content-store-eu-west/content/egi:10QC097ST3S/MAIN/application/pdf/6efeb820b85c5d229d5aaacc79d9f9ee/am.pdf am am.pdf pdf false 47165732 AAM-PDF APCATA 119039 119039 S0926-860X(23)00019-4 10.1016/j.apcata.2023.119039 The Authors Fig. 1 (a) TG and DSC profiles of the prepared hydroxyapatite (HAPT), performed in 40 mL.min−1 N2, with 10 °C.min−1 heating rate, and (b) XRD diffraction patterns of CKD as delivered and HAPT calcined at 500 °C for 3 h in an oxygen flow. Fig. 1 Fig. 2 XRD diffraction patterns of HAPT samples at 500 and 600 °C prepared from CKD and HAPT-NO3 from Ca(NO3)2 at 500 °C in comparison with HAPT-CKD in the range of 2θ = 24–35°. Fig. 2 Fig. 3 (a) FT-IR spectra of CKD as delivered, HAPT as prepared and HAPT calcined at 500 °C in oxygen, (b) IR-spectrum enlargement of HAPT-CKD at 500 °C, in the range of 1250–500 cm−1, (c) N2 adsorption/desorption isotherm and pore diameter profile of HAPT at 500 °C, (d) EDX spectrum of HAPT and (e) SEM images of HAPT with different magnifications. Fig. 3 Fig. 4 Elemental mapping of HAPT-CKD at 500 °C. Fig. 4 Fig. 5 (a) Effect of airflow and N2 as carriers during the conversion of sec-butanol (SB) over HAPT calcined at 500 °C, (b) Effect of reaction temperature on the distribution of all products and % conversion of SB using airflow as a carrier, and (c) Effect of reactant space velocity on the % conversion of SB over HAPT calcined at 500 °C. The error bars represent the standard deviation from two trials. Fig. 5 Fig. 6 Comparison between the catalytic activity of HAPT-CKD and another sample of HAPT-NO3 during the conversion of SB at different reaction temperatures using airflow. The error bars represent the standard deviation from two trials. Fig. 6 Fig. 7 (a) TG-TPD and (b-c) DSC-TPD profiles of HAPT were prepared from CKD, and that prepared from Ca(NO3)2, both calcined at 500 °C for 3 h in an oxygen atmosphere of 100 mL.min−1 . Fig. 7 Fig. 8 (a) Structural network of hydroxyapatite (HAPT), (b) The proposed direct interaction of THF vapour molecules with Lewis acidic Ca2+ cationic centers over the HAPT surface, and (c) the dehydration activity of the acidic sites over HAPT towards dehydration of sec-butanol to t-2-butene. Fig. 8 Fig. 9 (a) Reusability and durability of HAPT during conversion of SB at all reaction temperatures: over the fresh and reused sample, and (b) in four successive cycles over the same catalyst sample. The error bars represent the standard deviation from two trials. Fig. 9 Table 1 Chemical composition of CKD as received from Misr Cement-Qena Factory (Data obtained from x-ray fluorescence, XRF, analysis in wt%). Table 1 wt% 13.7 ± 0.32 5.29 ± 0.07 3.38 ± 0.14 63.14 ± 0.25 0.66 ± 0.01 1.13 ± 0.03 4.06 ± 0.26 0.9 ± 0.04 Compound or element SiO2 Al2O3 Fe2O3 CaO MgO K2O SO3 Cl Direct and easily prepared nanocomposite impurity-free hydroxyapatite derived from CKD as an effective catalyst for trans-2-butene production Mahmoud Nasr Visualization Conceptualization Formal analysis Investigation Methodology Software Writing – original draft Writing – review & editing a Samih A. Halawy Supervision Writing – review & editing, Formal analysis, Validation Project administration, Supervision a Safaa El-Nahas Writing – review & editing, Software, Project administration, Supervision a Adel Abdelkader Writing – review & editing, Software, Project administration, Supervision a Ahmed I. Osman Writing – review & editing, Conceptualization, Methodology, Proofreading, Project administration a b ⁎ a Nanocomposite Catalysts Lab., Chemistry Department, Faculty of Science at Qena, South Valley University, Qena 83523, Egypt Nanocomposite Catalysts Lab., Chemistry Department, Faculty of Science at Qena, South Valley University Qena 83523 Egypt Nanocomposite Catalysts Lab., Chemistry Department, Faculty of Science at Qena, South Valley University, Qena 83523, Egypt. b School of Chemistry and Chemical Engineering, Queen’s University Belfast, Belfast BT9 5AG, Northern Ireland, UK School of Chemistry and Chemical Engineering, Queen’s University Belfast Belfast Northern Ireland BT9 5AG UK School of Chemistry and Chemical Engineering, Queen’s University Belfast, Belfast BT9 5AG, Northern Ireland, UK. ⁎ Correspondence to: School of Chemistry and Chemical Engineering, Queen's University Belfast, David Keir Building, Stranmillis Road, Belfast BT9 5AG, Northern Ireland, UK. School of Chemistry and Chemical Engineering, Queen's University Belfast David Keir Building, Stranmillis Road Belfast Northern Ireland BT9 5AG UK This research is regarded as the first successful attempt at directly producing highly pure nanocomposite hydroxyapatite (HAPT) from cement kiln dust (CKD) using a cost-effective preparation method. The crystallite size of HAPT was 23.6 nm and showed a hierarchical mesoporous unit with a Ca-deficient structure according to SEM-EDX analyses. HAPT exhibits a high population of different acidic sites, i.e. weak, moderate and strong acidic sites, as determined by TG and DSC-TPD experiments using tetrahydrofuran as a probe molecule. The wide range of acidic sites over HAPT is clearly and positively enhanced its catalytic activity during the conversion of sec-butanol to trans-2-butene. In addition, our prepared HAPT demonstrated greater catalytic activity when sec-butanol was converted using air as a carrier rather than N2-gas. A comparison between the catalytic activity of HAPT prepared from the waste CKD and pure Ca(NO3)2 was also conducted, showing HAPT derived from waste streams with higher catalytic activity. Graphical Abstract ga1 Keywords Catalysis Cement Kiln Dust Hydroxyapatite Secondary butanol Trans-2-butene Data Availability No data was used for the research described in the article. 1 Introduction While the cement sector is critical for sustainable growth in many countries, it generates large volumes of toxic waste on a daily basis, including CO2 emissions and cement kiln dust (CKD). Toxic waste, such as CKD, may be very harmful to human life, animals, and plants, regardless of whether it reaches the ground, streams, or even air. The dangers associated with CKD arise from its high alkalinity and high concentration of heavy metals [1]. Daily, massive amounts of CKD are generated at two cement plants located in the vicinity of Qena city (Upper Egypt). Additionally, for every ton of cement clinker produced [2], around 54–200 kg of CKD is generated, and 600–700 kg of CO2 gas is released into the environment [3]. Herein, we attempt to suggest successful solutions and safe ways for eliminating this type of industrial waste (CKD) that contributes to environmental pollution while maintaining a balance between the environment and natural resources through waste recycling and mitigating the cement industry's negative environmental impact. Additionally, examining the economic benefits of converting CKD, a potentially harmful byproduct, into a useful material such as impurity-free hydroxyapatite (HAPT). During our literature survey, only one published article was found explaining the formation of HAPT from CKD [4], but their product was found to be mixed with several elements and SiO2. Numerous recently published articles detailed the methods for preparing HAPT from a variety of natural sources, including eggshell [5,6], catfish bones and animal bones [7], cuttlebone and bovine bone waste [8,9], pigeon bone waste [10], porcine byproducts [11], cockle shells or snail shell waste [12,13], turtle shell [14] and natural phosphate rocks [15]. On the other hand, several articles are concerned with the preparation methods of hydroxyapatite, including solid-state and wet chemical precipitation methods [5], hydrothermal porous hydroxyapatite preparation [16], the microemulsion method [17] and replica method [18]. Finally, HAPT with angiogenic-osteogenic properties was prepared for biomedical applications in bone repair via direct refluxing of the cuttlebone with (NH4)2HPO4 [9] or via HAPT modification with gum tragacanth [19]. Apart from its biomedical applications, HAPT has a variety of industrial applications as an active compound or catalyst, including catalytic oxidation of volatile organic compounds [20], solventless self-aldol condensation of butyraldehyde to 2-ethylhexenal [21], CO-oxidation reaction [22] and ethanol conversion [23]. Furthermore, HAPT is widely used as catalyst support in many reactions, such as: dry reforming of methane using HAPT-supported nickel catalysts [24], N-oxidation of tertiary amines with H2O2 by W/HAPT [25], and steam reforming of ethanol over cobalt-supported HAPT [26]. Based on our tracing about the different uses of HAPT, as a heterogeneous catalyst, during the conversion of sec-butanol to trans-2-butene or any other products. We were unable to locate any published article that examined this reaction in conjunction with HAPT under any conditions. As a result, our research herein is regarded as the first successful scientific attempt to produce trans-2-butene directly from sec-butanol at relatively low temperatures in a single step. We converted several industrial wastes into pure catalysts early on, such as aluminum dross tailings (ADT) to high surface area γ-Al2O3 [27–29], via γ-AlOOH boehmite, using a variety of precipitation methods and techniques. Additionally, we prepared a series of 1–10 wt% FeOx/Al2O3 catalysts, based on γ-AlOOH recovered from (ADT) and another waste (SPW) steel-pickling chemical waste [30]. These catalysts (1–10 wt% FeOx/Al2O3) calcined at 600 °C demonstrated high activity in ethanol dehydration to diethyl ether and ethene production [30]. This ground-breaking work exemplifies a contemporary and relevant set of points, which include the following: (1) For the first time, hydroxyapatite (HAPT) was prepared easily and directly from cement kiln dust (CKD) as industrial waste at 500 °C. As a result, our work herein aims to identify the economic benefits associated with CKD as a harmful byproduct through its conversion into a value-added material. (2) Our simple method results in a HAPT with a hierarchical mesopore structure composed of thin sheets and flakes. Additionally, it is characterized by a dense population of surface acidic sites of varying strength that is uniformly generated and distributed across its surface. (3) This wide range of mesopores and the strong surface acidity of HAPT enabled it to be used as a potent catalyst for the first time during the conversion of sec-butanol (SB). The catalyst showed superior activity in converting SB to t-2-butene with a selectivity of 99% at a low-temperature range of 200–300 °C. 2 Experimental section 2.1 Materials and preparation A CKD sample was obtained from Misr Qena Cement Plant- Qeft at Qena governorate - Egypt, with a greyish-green colour, where its chemical composition was analyzed by the producer and presented in Table 1. The total wt% of analyzed items in (Table 1) was equal to 92.26%. TG analysis of an original sample of CKD from RT up to 500 °C showed three successive steps with about 7.4% mass loss, Fig. S1 (supplementary information). This could be related to the removal of moisture as well as the desorption of CO2 that is linked to the sample's surface during the storage of CKD in the air for a long time. TG-curve and FT-IR spectrum of original CKD, each one interprets the other and both match well together; see Fig. S1. Furthermore, the clinker in the cement industry contains SO3 and Cl in the form of K2SO4, while chloride form stable compounds with alkalies such as K2O but more volatile than sulphate. Most of the chemicals herein were purchased as analytical grade pure chemicals from El Nasr Pharmaceutical Chemicals Co. Egypt-ADWIC, including nitric acid (HNO3, 50–55%), oxalic acid [H2C2O4.2 H2O], ammonia solution (25%) and diammonium hydrogen phosphate [(NH4)2HPO4]. 2.2 Estimating Ca-ions recovered as CaO from the delivered CKD sample, and Ca-hydroxyapatite (HAPT) preparation from cement kiln dust (CKD) Before HAPT preparation, an estimation of the extent of Ca-ions that would be recovered using the locally delivered CKD was performed. 5 g of CKD sample was added to 50 mL deionized water with continuous stirring using a magnetic stirrer (1500 RPM at room temperature). Then, 12.5 mL of (50–55%) HNO3 was added dropwise until effervescences ceased. The resulting mixture was filtered off through crucible Gooch (Sintered Glass-G3), and the solid residue was washed with deionized water several times. The dissolved portion of CKD in the filtrate was calculated as 4.57 g concerning the weighed undissolved part after the complete dryness of the crucible. The filtrate was kept for use in the next step. Following that, 100 mL of 4% oxalic acid was added to the filtrate, followed by diluted aqueous ammonia solution until the pH reached 8.5–9.0 to precipitate calcium as CaC2O4·H2O. The precipitate boiled, settled, and filtered immediately through ashless filter paper. Finally, after complete dryness of the ashless filter paper, the precipitate was calcined at 500 °C for 2 h in a muffle furnace, then cooled and weighed as = 4.463 g of CaCO3. According to the obtained gravimetric analysis results, we recovered approximately 54.7% of CaO from the dissolved portion, while CaO was calculated to be 50% of the original CKD sample. According to these findings, Ca-hydroxyapatite (HAPT) sample was prepared in a new experiment from cement kiln dust as follows: 10 g of CKD was dissolved in the required volume of nitric acid (H2O: HNO3; 4:1) with continuous stirring and gentle heating of the mixture at 60 °C. To eliminate the undissolved part (UDP) of CKD from the clear solution of Ca-ions, filtration was applied through crucible Gooch Sintered Glass-G3. The calculated amount of (NH4)2HPO4 was dissolved in deionized water and added to Ca-solution in a 250 mL beaker. The resulting mixture was heated at 60 °C over a hot-plate, and then aqueous ammonia solution was added from a burette with continuous stirring until the complete precipitation of Ca-HAPT in a strong basic medium [31] as shown in (Eq.1). (1) 10Ca(NO3)2·4 H2O + 6(NH4)2HPO4 + 8NH4OH →Ca10(PO4)6(OH)2 + 20NH4NO3+ 46 H2O The white precipitate of HAPT was washed several times with deionized water, dried in an oven at 120 °C for 12 h, then ground in a mortar and stored. The obtained HAPT was calcined at 500 °C for 3 h in a 100 mL.min−1 oxygen flow. 2.3 Characterization Thermal analyses of HAPT as prepared were carried out using thermogravimetric (TG) and differential scanning calorimetric (DSC) techniques. These experiments were performed at a 10 °C.min−1 heating rate in 40 mL.min−1 N2-gas flow rate, using a 50 H Shimadzu thermal analyzer-Japan. The instrument is equipped with data acquisition and handling system (TA-50WSI), and highly sintered α–Al2O3 was applied as reference material in DSC experiments. X-ray Diffraction analysis (XRD) of the calcined samples at 500 °C, as well as the original CKD sample, were analyzed by X-ray powder diffraction (XRD) using a Brucker AXS-D8 Advance diffractometer (Germany), equipped with a copper anode generating Ni-filtered CuKa radiation (k = 1.5406 Å) from a generator operating at 40 kV and 40 mA, in the 2θ range between 20°− 80°. The instrument is supported by interfaces of DIFFRAC plus SEARCH and DIFFRAC plus EVA to facilitate an automatic search and match of the crystalline phases for identification purposes with the COD crystallographic database. The FTIR spectra were recorded using a Magna-FTIR 500 (USA), between 4000 and 250 cm−1, operating Nicolet Omnic software and adopting the KBr disk technique. Surface textural properties of HAPT samples that were calcined at 500 °C (viz. specific surface area, pore volume, and mean pore radius) were calculated from nitrogen adsorption-desorption isotherms recorded at liquid nitrogen temperature (i.e.–196 °C) using automatic Micromeritics ASAP2010 (U.S.) equipped with online data acquisition and handling system operating BET and BJH analytical software. All samples were degassed at 200 °C and 10−5 Torr for 2 h before measurements (1 Torr = 133.3 Pa). The morphological characterization of the prepared samples was performed by Scanning Electron Microscopy (SEM) using a FEI Quanta 250 FEG MKII with a high-resolution environmental microscope (ESEM) using XT microscope Control software. EDX dot mapping analysis combined with FESEM was used to determine the homogeneous dispersion of sample constituents. Scanning Electron Microscopy (SEM) images of samples were carried out on a FEI Quanta 250 FEG MKII with a high-resolution environmental microscope (ESEM) using XT Microscope Control software linked to an Electron Dispersive X-ray (EDX) detector. The EDX used was a 10 mm2 SDD Detector-x-act from Oxford Instruments, which utilizes Aztec® EDX analysis software. The total number of acidic sites (sites.g−1) over HAPT at 500 °C was measured using the temperature-programmed desorption (TPD) of tetrahydrofuran (THF, 99 +%, stabilized with 0.025% butylated hydroxytoluene-Sigma) condensed phase, as a probe molecule. The experimental details can be explained as follows [32,33]. 50 mg of sample preheated at 350 °C for 1 h in the air before the probe molecule is exposed. 20 ± 2 mg covered sample with THF were subjected to thermogravimetric analysis (TGA) and differential scanning calorimetry (DSC) analyses at a heating rate of (10 °C.min−1) in dry N2 flowing (40 mL.min−1), using a 50 H Shimadzu thermal analyzer (Japan). The thermal analyzer is equipped with a data acquisition and handling system (TA-50WSI). α–Al2O3 was used as the reference material in DSC measurements. The mass loss due to desorption of THF during TG experiments from the acidic sites was determined to measure the total surface acidity as sites.g−1. The following (Eq.2) is used to estimate the total number of surface acidic sites [34]. (2) Total No . of surface acidic sites ( sites / g ) = moles of desorbed THF x Avogadro ′ s number ( sites / mol ) weight of TG sample ( g ) 2.4 Catalytic activity of HAPT at 500 °C during the decomposition of sec-butanol Catalyst activity experiments were performed at atmospheric pressure in a conventional fixed bed U-shaped quartz reactor. The catalytic activity and selectivity of catalyst samples for decomposing sec-butanol (SB) to products, mostly in the temperature range of 200–300 °C, were investigated. In each experiment, 0.2 g of catalyst sample was preheated at 400 °C inside a fixed-bed continuous flow reactor for 1 h in an airflow (100 mL.min−1) before measurements; then, the temperature was gradually decreased to 200 °C. Sec-butanol (SB) (Fluka, ≥99%) vapors were generated by passing a stream of air (100 mL.min−1) through the liquid SB in a glass saturator thermostatically stabilized at 5, 10 and 15 °C. The gas hourly space velocity of 30 L.gcat −1.h−1 was used in all the experiments. The expected reaction products as cis-2-butene (c-2-butene), trans-2-butene (t-2-butene), and methyl ethyl ketone (MEK) were analyzed and detected using an online gas chromatograph (Shimadzu GC-14), equipped with a data processor model Shimadzu Chromatopac C-R4AD. An automatic sampling was continuously performed using a heated gas sampling cock, type HGS-2, at 140 °C, using a hydrogen flame ionization detector (FID) and a stainless-steel column (PEG20 M 20% on Chrmosorb W, 60/80 mesh, 3 m × 3 mm) at 75 °C. The % conversion of SB and % selectivity of products were calculated [35] using the following (Eqs.3 and 4):- (3) % SB conversion = [ No . moles SB ] i n − [ No . moles SB ] o u t [ No . moles SB ] i n × 100 % (4) Product selectivity ( % ) = [ No . moles of product ] [ Total no . moles of products ] × 100 % [No. moles SB]in and [No. moles SB]out = the number of SB moles in the feed and outlet streams, respectively. 3 Results and discussion 3.1 Characterization 3.1.1 Thermal analyses The thermal decomposition behavior of precipitated HAPT was investigated using TG and DSC techniques, as presented in ( Fig. 1(a)). Starting from RT and increasing to 500 °C, the TG profile exhibited consecutive steps with % mass loss equal to 24.89%. Additionally, a very small weight loss step between 500 and 600 °C was monitored, associated with a 1.75% weight loss. The corresponding DSC profile recorded for HAPT revealed a series of endothermic peaks in the temperature range of RT-179 °C, due to the slow dehydration step of the precipitated HAPT, followed by a strong endothermic peak associated with the main thermal decomposition process of the prepared HAPT. This enormous step may be ascribed to the decomposition of NH4NO3 [36] that formed between HAPT particles, as presented in (Eq.1), during the precipitation process. Besides, there are two small broad endothermic peaks at 329 and 474 °C. These peaks may be due to the decomposition of the residual traces of NH4NO3 in depth inside the bulk of HAPT particles. Thermal analyses results of precipitated HAPT indicate that calcination at 500 °C for 3 h in oxygen is suitable for preparing well-defined HAPT, as will be discussed later by XRD and FT-IR analyses. 3.1.2 XRD and FT-IR analyses To compare the original CKD and the purified obtained HAPT sample, XRD analysis of both samples was employed, as shown in Fig. 1(b). The primary constituent of CKD was tricalcium silicate (C3S) [Ca3(SiO4)O], as confirmed by the most intense Miller index (312) at 2θ = 29.2°, besides other six planes at (013), (203), (101), (204), (313) and (431) which correspond to 2θ = 22.8, 26.3, 31.2, 32.2, 33.8 and 39.1°, respectively (COD 9014362). The second compound in CKD was identified as dicalcium silicate (C2S) [Ca2SiO4] based on a group of diffraction peaks at 2θ = 32.8° (111), 35.7° (122), 41.0° (221), 43.0° (230), 48.3° (240), 56.2° (062), 57.0° (223), 60.6° (170), 64.5° (243) and 72.8° (115) (COD 1546025). The last five diffraction peaks are extremely faint, see Fig. 1(b)-CKD. These results are consistent with data published recently [37,38]. Finally, two diffraction peaks associated with Ca(OH)2 were observed in the XRD pattern of CKD at 2θ = 46.9° (102) and at 50.7° (110) [39]. The X-ray diffraction pattern of HAPT at 500 °C clearly revealed 26 diffraction peaks (Fig. 1(b)), six of which are the most intense peaks for a highly crystalline mixture of both Ca10(PO4)6(OH)2 (COD 1100066) and Ca5(PO4)3(OH) (COD 9002213) at 2θ = 25.2, 26.6, 28.1, 28.9, 42.4 and 45.3° which correspond to (201), (002), (012), (210), (302) and (023), respectively. Additionally, two additional Ca-compounds were identified in the XRD pattern of HAPT prepared at 500 °C, i.e. Ca3(PO4)2 with two diffraction peaks at 30.1° (012) and 33.4° (110) (COD 1521426) as well as a single diffraction peak related to the presence of Ca(OH)2 at 36.6° (002) (COD 9009098). The XRD analysis (Fig. 1(b)) demonstrated that the prepared sample of HAPT was free from any compounds of other elements detected in the XRF of the original CKD, as shown in Table 1. The most intense diffraction line (002) at 26.6°, in the case of HAPT, was used to calculate the crystallite size to be 23.6 nm using the Scherrer equation [40]. Our XRD analysis of HAPT prepared at 500 °C is consistent with results from recent publications [41–43]. According to many authors [44–46], the XRD patterns of the prepared HAPT mostly exhibited three main planes (002), (211), and (300) as the main growth planes of HAPT crystals. The plane (211) is greatly sensitive and influenced by calcination temperature as well as the Ca-source used to prepare HAPT [46]. An interesting paper should be considered carefully [46] that recently explained the stepwise growth of the different planes of HAPT, especially plane (211), during heating HAPT with different heating rates, i.e. 3, 6, and 9 °C.min−1. and in-situ recording X-ray diffractograms in the temperature range of 400–900 °C. Therefore, with enlargement of the area in the range of 2θ = 24–35°, in a new window ( Fig. 2), the XRD pattern of HAPT at 600 °C prepared from CKD (sample not included) showed a strong (211) plane, in comparison with the faint very weak plane in case of HAPT at 500 °C (the subject of this paper). On the other side, both (002) and (300) planes sharply appeared in diffractogram of HAPT at 500 °C. Furthermore, to prove that Ca-source plays an important role in the type and structure of the resulting HAPT, we used the same applied precipitating agent, i.e. (NH4)2HPO4 diammonium hydrogen phosphate, and different sources. The other sample of HAPT-NO3 at 500 °C we used as a comparative catalyst from a pure Ca-source (Ca(NO3)2) (in the section of decomposition of sec-butanol) exhibited a completely different XRD pattern from that of HAPT-CKD at 500 °C, see Fig. 2. An attention should be made to the following observations: i) HAPT-NO3 at 500 °C was characterized essentially by the polymorph hydroxyapatite structure [47] with formula Ca5(PO4)3(OH) according to (COD- 9002213). ii) The three main planes (002), (211) and (300) sharply and easily distinguished in XRD pattern of HAPT-NO3. iii) at 500 °C, at the same calcination temperature, the XRD pattern of the corresponding HAPT-CKD gave a very faint plane at (211), as explained earlier, with two sharp planes at (002) and (300). Our prepared HAPT-CKD at 500 °C was identified by matching the recorded diffractogram with standard card (COD-1100066) and was mainly composed of Ca10(PO4)6(OH)2 with little traces of polymorph Ca5(PO4)3(OH). The positions of the recorded planes in the two diffractograms are quite different due to matching each one with a different standard card, i.e. (COD- 9002213) and (COD-1100066). Fig. 3(a) exhibits the FT-IR analysis of the original CKD, as delivered, the precipitated HAPT and HAPT calcined at 500 °C. The spectrum of CKD is completely different from the spectra of HAPT samples. Furthermore, the three spectra have a complex group of bands, especially in the range of 500–1700 cm−1, as shown in Fig. 3(a). In the case of CKD, its spectrum contains a group of bands in the range of 800–1200 cm−1, related to the asymmetric and symmetric stretching vibrations of Si-O bonds [48], due to the presence of both C2S and C3S, as confirmed by XRD analysis (Fig. 1(b)). The bands at 3645, 3432 and 1644 cm−1 are associated with the stretching and bending vibrations of O-H due to adsorbed water and the presence of Ca(OH)2 in CKD [48,49]. A strong absorption band at 1419 cm−1 corresponds to the asymmetric stretching vibration of V 3 C-O due to the formation of CaCO3 in CKD, which is present in atmospheric CO2 [48,50,51]. Moreover, a sharp and small absorption band at 1385 cm−1 could be assigned to the vibration of nitrate [49] that is still adsorbed between CKD particles. Finally, an absorption band appeared at 517 cm−1 that was assigned to Ca-O symmetric stretching vibrations [52] in the spectrum of CKD. The spectra of HAPT as prepared and after calcination at 500 °C for 3 h in oxygen are quite similar and have the same features. Typical absorption bands of phosphate groups were observed in spectra of HAPT in the range of 1112–985 cm−1 that were assigned to ν(PO4 3-) [53], while bands at 662 and 579 cm−1 related to the ν4 bending vibrations of P-O mode in the crystalline HAPT network and the band at 916 cm−1 resulted from the ν1 symmetric P-O stretching vibration [54]. These bands are assigned to the stretching vibrations, symmetric bending and asymmetric bending of vibrations of PO4 3 - [55]. In addition, the broad bands centered at 3445 and 1632 cm−1 indicate the presence of adsorbed water, especially in the fresh precipitated HAPT [56]. Moreover, a broad band at about 1300 cm−1 due to δ(NH4 +) appeared in spectra of HAPT at 500 °C [53], besides a sharp band at 1386 cm−1 that ascribed to the vibration of nitrate [49] as traces that formed during the preparation of HAPT using HNO3. Finally, an absorption band located at 754 cm−1 could be assigned to (P2O7 2-) [57] , and another band related to the symmetric stretching vibrations of Ca-O [58] is shifted to 530 cm−1. Based on the XRD and FT-IR analysis results discussed above, one can conclude that the prepared HAPT at 500 °C is quite an impurity-free sample, as no silicate or other elemental compounds were detected. To get a deep look at the absorption bands, those reflect the structure of the resulting HAPT from CKD, which is not clearly observed in the spectra presented in Fig. 3(a). IR-spectrum enlargement of HAPT-CKD at 500 °C, in the range of 1250–500 cm−1, presented in Fig. 3(b). The expanded spectrum showed a group of stretching vibrations of the phosphate group in HAPT-CKD at 1112 and 1059 cm−1 [53], at 1030 and 983 cm−1 for ν3 vibrational modes of (PO4 3-) [59,60], as well as ν4-mode at 535 cm−1 [59]. Furthermore, the bending vibration modes (ν4) of PO4 3- functional groups were recorded at 662, 603 and 579 cm−1 [31,54]. The stretching vibration of P=O and the bending vibration of P-O are located at 1044, 916 and 559 cm−1, respectively [54,61]. 3.1.3 Surface properties and morphology of HAPT at 500 °C The surface characteristics of the HAPT at 500 °C, such as surface area and porosity, were studied using nitrogen adsorption/desorption isotherm, as shown in Fig. 3(c). The figure shows a type-IV isotherm with an H3-hysteresis loop (p/p° >0.9) [62,63]. This clearly indicates the formation of secondary slit-shaped pores of increased size in nanoparticle aggregates [62]. The corresponding pore size distribution calculated using the BJH method from the desorption branch of the isotherm clearly demonstrated the presence of major pores in the range of 2.4 – 6.8 nm with a few pores slightly larger than 11 nm, indicating the evident hierarchical mesoporous characteristics of HAPT, see Fig. 3(c). However, the calculated surface area of HAPT prepared at 500 °C from CKD was 3 m2.g−1. As fundamentals, the abundant mesopores and the hierarchical structure of the HAPT sample would facilitate effective contact of active sites across its surface as a catalyst, as well as mass transport during the catalytic reaction that will be discussed later. The calculated surface area (SBET) of our sample HAPT at 500 °C agrees with recently published values for various HAPT samples prepared from eggshells [64]. Fig. 3(e) exhibits the SEM images of HAPT at 500 °C with different magnifications. At low magnification, the SEM image reveals that the HAPT surface is composed of brittle particles; however, as the magnification increases, more details become visible. Furthermore, the microstructure of HAPT contains a diverse array of mesopores with different pore diameters (as indicated by the yellow arrows in Fig. 3(e). In addition, HAPT particles have a microstructure of transparent thin sheets and flakes (as indicated by red arrows). Each sheet or flake is self-assembled from a large number of loosely packed nanoparticles that connect to form a layered structure, see Fig. 3(e). This distinctive morphology of HAPT particles, as determined from SEM images in Fig. 3(e), offers additional support to the reaction's expected high catalytic properties. The corresponding EDX spectrum obtained from the surface of HAPT confirms the presence of only the Ca, P and O elements, as illustrated in Fig. 3(d). In addition, these results indicated the formation of Ca-deficient hydroxyapatite. Moreover, the calculated weight ratio and a molar ratio of Ca: P elements were 0.78 and 0.61, respectively, compared to the stoichiometric HAPT’s (Ca/P) molar ratio [65] of 1.67. It is worth noting that EDX is a surface technique that reveals only a 10 nm depth below the catalyst's surface, resulting in the discrepancy between the measure and stoichiometric calculation. In order to confirm further the purity of the prepared HAPT from CKD, by a simple method, depending on the dissolution of Ca2+ in a diluted HNO3 followed by separation of this clear solution of Ca(NO3)2 and precipitating HAPT using (NH4)2HPO4 with adjusting the pH of the medium. In addition to the EDX-spectrum (see Fig. 3(d)) that revealed the purity of HAPT-CKD. We performed another accurate technique for the HAPT-CKD, i.e., elemental mapping, as presented in Fig. 4. As an accurate and modern analysis technique, the obtained results of the elemental mapping strongly supported the formation of a pure sample of hydroxyapatite (HAPT-CKD at 500 °C). The whole spectrum revealed that only P, Ca, and O were recorded as only constituents in HAPT at 500 °C (see Fig. 4). 3.2 Decomposition of sec-butanol over HAPT Over the last two decades, considerable research has been conducted on the use of HAPT as an active catalyst, either pure or as a catalyst support, in a variety of chemical reactions [20–26]. While none was conducted on the decomposition reactions of sec-butanol (SB), as a result, the work herein represents the first successful attempt to use HAPT as an acidic catalyst to convert SB to trans-2-butene (t-2-butene) via single-step alcohol dehydration. Whether considering the catalyst preparation or the catalytic activity findings, a very high degree of reproducibility has been observed, and the carbon mass balance was almost 100% in all catalytic tests, with no carbon coke formation observed in the spent catalysts. To economically produce t-2-butene from SB in a single step, the following experiments were conducted: (1) The effect of air and N2-gas as carriers To compare the effect of a costless carrier, such as air and a known-cost carrier, such as N2-gas, on the dehydration reaction. The conversion of SB was studied using 0.2 g of HAPT and Vp of SB of 0.93 kPa in the temperature range of 200–300 °C, using 100 mL.min−1 of air or N2-gas as carriers in two separate experiments with gas hourly space velocity (GHSV) = 30 L.gcat −1.h−1, as shown in Fig. 5(a). At all reaction temperatures, using air as a carrier had a beneficial effect on SB conversion. It increases by approximately 5.2–8.7% with the increasing reaction temperature from 200 to 300 °C, see Fig. 5(a). Furthermore, at a reaction temperature of 200 °C, the % conversion was 40%, then gradually and steadily increased to 91.4 ± 1.8% at 300 °C using an air carrier. As a result, air was used as a costless and effective carrier in all experiments herein. Fig. 5(b) presents the distribution of all products produced during the conversion of SB at the corresponding reaction temperature. The obtained results indicated that the major product was t-2-butene, which had a higher and constant % selectivity of 99%, whereas the other products, c-2-butene and MEK, had a selectivity of less than 1%. Finally, N2-gas, as an inert carrier in catalysis, sometimes do not activate the surface sites over the catalyst responsible for producing the desired product. Therefore, using air as a carrier reduces the reaction costs and initiates the active sites to perform high alcohol conversion at a low temperature, as we studied in Fig. 5(a). Air is superior to nitrogen as a carrier gas in this reaction due to the dissimilar properties of the two gases. Unlike air, which is a mixture of inert and active gases, N2 is an inert gas, and its inertness is due to the covalent bonds formed by the three lone pairs of electrons in its molecule [66]. Thus, the potential of air to initiate the active sites of the catalyst and regenerate the used active sites responsible for producing the desired product is greater than that of nitrogen. Furthermore, GC analysis identified only the product trans-2-butene and unreacted SB in each injection during the reaction in the temperature range of 200–300 °C (see Figs. 5,6,9). (2) Effect of the reactant space velocities on the catalyst reactivity Three different reactant space velocities were used during the dehydration of SB over HAPT, namely 20, 30 and 60 L.gcat −1.h−1, in the temperature range of 200–300 °C. As shown in Fig. 5(c), increasing the space velocity resulted in a gradual and significant decrease in % of the conversion of SB at all reaction temperatures. This decrease in the % conversion is readily apparent when WHSV is increased from 30 to 60 L.gcat −1.h−1. This phenomenon obviously indicates that at a higher GHSV value (60 L.gcat −1.h−1), insufficient time was allowed for the reacting molecules of SB to convert to products [67]. Furthermore, the WHSV has a significant effect on reaction kinetics, and the high value of WHSV results in a rate-limited conversion [68]. Therefore, we utilized the intermediate value (30 L.gcat −1.h−1) in all experiment, which produced favorable results. (3) Comparison of HAPT-CKD derived from CKD and HAPT-NO3 derived from Ca(NO3)2 To demonstrate the validity of CKD as a Ca-rich source for preparing HAPT, as a benefit of that huge industrial waste-CKD, we prepared another sample of HAPT-NO3 under the same conditions using pure Ca(NO3)2 (BDH-analytical grade). A comparison of the catalytic activities of both samples was performed during the conversion of SB, in the temperature range of 200–300 °C, using WHSV = 30 L.gcat −1.h−1, as shown in Fig. 6. At all reaction temperatures, HAPT-CKD exhibited incomparable activity towards the conversion of SB to t-2-butene. The % conversion of SB using HAPT-CKD, in the temperature range of 200–250 °C, was 9.2–9.8 times that of HAPT-NO3, see Fig. 6. As the reaction temperature increased gradually to 275 and 300 °C, a significant activation occurred for HAPT-NO3. This could be attributed to the distribution of different acidic sites over both samples, as discussed in the following paragraph, as well as the crystallite size of both samples that were determined by XRD analysis (HAPT-NO3 XRD is not shown). The crystallite size of HAPT-CKD and HAPT-NO3 samples were 23.64 and 32.09 nm, respectively. As a result, the crystallite size of HAPT-CKD is smaller than that of HAPT-NO3. To obtain information about the acidic site's capacity and the distribution of these sites over each sample, temperature-programmed desorption (TPD) of tetrahydrofuran (THF) was performed using TG and DSC techniques [34], as shown in Fig. 7. The use of tetrahydrofuran as acidity-probe molecule instead of the known acidity probe molecules such as pyridine and ammonia is due the low surface area of the prepared HAPT catalysts. According to our recent publication [34], the accurate measurement of surface acidity of the catalysts with limited values of surface area requires a relatively moderate basic molecule as THF with pKb = 16.08, rather than strong basic molecules such as NH3 (pKb = 4.75) or pyridine (pKb = 8.77). In the case of HAPT-CKD, the % mass loss due to desorption of THF from the total acidic sites, in the temperature range of 125–500 °C, was 39.43% see Fig. 7(a). This is approximately 1.77 times the calculated value for HAPT-NO3. This clearly indicates that the acidic sites density is higher in the case of HAPT-CKD, with a total no. of acidic sites of 3.29 × 1021 sites.g−1, while it was 1.84 × 1021 sites.g−1 for HAPT-NO3. The DSC-TPD analysis of THF from both samples revealed important information about the distribution of these acidic sites over their surfaces. Fig. 7(c), the DSC-TPD profile of HAPT-CKD showed the presence of weak acidic sites maximized at 148 °C, a big peak of the moderate acidic sites from 163 °C up to 350 °C, and a small peak due to strong sites maximized at 395 °C. On the other hand, DSC-TPD profile of HAPT-NO3 exhibited a very faint peak maximized at 154 °C related to weak acidic sites, a strong peak maximized at 263 °C associated with the presence of moderate acidic sites, followed by a weak peak at 368 °C ascribed for strong sites, as shown in Fig. 7(c). This broad range of acidic sites over the surface of HAPT, including weak, moderate and strong sites, has been previously observed [22] using the NH3-TPD technique. Consideration should be given to the big peak of the moderate acidic sites in both DSC-TPD profiles of the two samples, as shown in Fig. 7(c). In the case of HAPT-CKD, this massive peak can be divided into two sub-acidic sites using Gaussian line profiles, see Fig. 7(b). Furthermore, the calculated no. of moderately acidic sites under this peak was 2.77 × 1021 sites.g−1 in the case of HAPT-CKD, while it is estimated to be 1.53 × 1021 sites.g−1 in the case of HAPT-NO3. As previously explained and illustrated in Fig. 6, this obvious difference in the number of moderately acidic sites present in each sample will significantly affect the catalytic activity of each sample during the conversion of SB to t-2-butene. It is known that the main adsorption sites of HAPT particles are Ca2+ ions as Lewis acidic sites and O atoms of PO4 3- as Lewis basic sites, and the existence of these sites in different proportions is the dominant factor regulating the catalytic activity and selectivity of HAPT [22–24,69]. Bittencourt et al. [69] studied the adsorption properties of a wide range of probe molecules, including CO, CO2, C2H2, CH4, H2, H2O, NH3, SO2, and BCl3, on the surface of HAPT. They found that all the selected probe molecules are adsorbed preferentially close to the most exposed Ca2+ ions. Thus, we believe that the acidic sites involved in the adsorption of THF molecules and in the dehydration of sec-butanol are mainly the Lewis acidic sites (i.e. Ca2+ ions). As a result of the preceding discussion, THF can accurately and quantitatively count the surface acidic sites [34] over HAPT molecules as we proposed based on the published chemical structure of HAPT [70], see Fig. 8(a). The vapour molecules of THF will directly interact with Lewis acidic Ca2+ cationic centers that are abundantly available over its surface, see Fig. 8(b). Our proposed mechanism is quite similar to one recently published [71] for pyridine adsorption over H2-treated CeO2-MeOx samples. As proposed in Fig. 8(c), these acidic sites over the prepared HAPT-CKD catalyst are responsible for the dehydration of SB to t-2-butene [72], with superior activity and selectivity starting from 200 °C up to 300 °C, see Fig. 5(b). Additionally, the perfect distribution of surface moderate acidic sites on HAPT-CKD makes it easy to snipe and firmly bond water molecules over these sites, see Fig. 8(c). This facilitates the dehydration reaction, and the catalyst became more active as the reaction temperature increased from 200° to 300°C. The produced t-2-butene exhibits superior properties to c-2-butene [73], with known values such as kinetic diameter = 4.31 Å, dipole moment (D) = 0.00 and polarizability equal to 81.8 × 10−25 cm−1. Likewise, it was established in a recent study that c-2-butene is consistently less stable than t-2-butene [74] by 0.9–1.4 kcal.mol−1. Soto et al. [75] and Bedia et al. [76] stated that sec-butanol could attack the active sites over the catalyst surface from different directions, giving multiple adsorption complexes. Therefore, the formation of 1-butene, cis-2-butene and trans-2-butene and their abundances depend on the acid-base properties of each catalyst [75,76]. Furthermore, they calculated the equilibrium (cis/trans) ratio in the homogeneous phase to be approximately 0.6. This value showed that trans-isomer formation is favored because it is thermodynamically more stable [75]. Numerous articles examined the kinetics of t-2-butene ignition in a jet-stirred reactor and a combustion bomb [77,78], while others investigated and studied the isomeric flames of butene isomers [79] using in situ molecular-beam mass spectroscopy and gas chromatography techniques. Furthermore, t-2-butene and c-2-butene showed promising thermal performance in the solar organic Rankine cycle (ORC) [80]. A recent article also studied the catalytic isomerization and hydroformylation of butenes [81]. Due to the widespread use of 2-butene isomers as chemical intermediates, the global 2-butene market is expected to expand significantly [82] between 2022 and 2028. As a result, the advancement of numerous industries necessitates additional research into producing more low-cost, high-productivity t-2-butene. This is the major merit of the work herein. (4) Stability and reusability of the catalyst HAPT-CKD Two distinct experiments were conducted to determine the stability and reusability of the catalyst HAPT-CKD at 500 ℃ during the conversion of SB to t-2-butene: (i) A fresh sample was tested under the same conditions, as previously described using an air-carrier and demonstrated conversion of SB ranging from 40 ± 0.8 to 91.4 ± 1.8% in the temperature range of 200–300 °C, see Fig. 9(a). The % selectivity for t-2-butene was always 99%. Following that, the same sample was regenerated for 1 hr by heating at 350–400 °C in air flow (100 mL.min−1). The temperature is then reduced, and the experiment is repeated using the regenerated sample under the same conditions. The used catalyst after regeneration exhibited increased activity towards the conversion of SB at all reaction temperatures, see Fig. 9(a), while the % selectivity toward t-2-butene remained constant. This phenomenon could be explained by increased activation of acidic sites over the catalyst surface in the range of 200–300 °C. (ii) To confirm the catalyst's robustness and stability, a subsequent four-cycle experiment was performed on the same sample under the same conditions, as shown in Fig. 9(b), in the temperature range of 200–300 °C. In the second cycle, the results showed that the sample attained its maximum catalytic activity at all reaction temperatures. After that, the activity of HAPT gradually decreased in the range of 200–250 °C before slightly increasing again. The trend in catalytic activity observed in Fig. 9(b) over the course of the four cycles is likely the result of two opposing effects on the catalyst surface. The first is the effect of exposing the catalyst to air as an active carrier gas, which activates the acidic sites on the surface of the catalyst and increases its catalytic activity. The second factor is exposure to the reaction feed, which exhausts acidic sites and reduces catalytic activity. In cycle 2, the combination of the two effects appears optimal. The primary objective of these successive cycles is to avoid changes in any of the reaction conditions [83], including a) the catalyst weight, b) the distribution of the sample on the catalyst bed, and c) the exact position at which the catalyst is inside the reactor in the vertical furnace during the reaction. Finally, these experiments demonstrated the durability and reusability of the prepared HAPT-CKD, at 500 °C, as a costless catalyst during the conversion of SB to t-2-butene with a high % selectivity of 99%. Furthermore, the stability of any catalyst can be observed during the applied catalytic reaction. The catalyst loses its reactivity due to coke deposition during the applied reaction or poisoning of the active sites by poisoning molecules. In our case, the stability of our catalyst was tested by a simple experiment. Thermogravimetric analysis of the used catalyst, after four cycles of SB-reaction over it, was done twice compared to a fresh sample (see Fig. S2). Due to the strong dehydration activity of the catalyst (HAPT-CKD at 500 °C), the sample lost about 2.3% of its weight on average, while the fresh sample lost only 0.4% of its weight. This is considered good evidence for the stability and constant reactivity of HAPT-CKD at 500 °C, where no coke is deposited over the catalyst's surface. 4 Conclusions Hydroxyapatite (HAPT) was successfully prepared as a pure nanocrystalline compound at 500 °C from cement kiln dust (CKD) as industrial waste using a simple and cost-effective method. According to EDX, elemental mapping, and SEM analyses, the resulting HAPT at 500 °C is a Ca-deficient structural sample. Moreover, its surface morphology is characterized by thin sheets and flakes, as well as a significant hierarchical distribution of mesopores. This distinguished structure enhances the catalytic activity of HAPT when used as an active catalyst in the conversion of sec-butanol (SB) to t-2-butene at relatively low temperatures in the temperature range of 200–300 °C. Air was utilized as a carrier rather than N2-gas during the conversion of SB to t-2-butene over the HAPT catalyst. The catalyst demonstrated remarkable activity at relatively low temperatures with an extremely high selectivity of 99% towards t-2-butene. The perfect distribution of acidic sites positively reflected on the catalytic activity of HAPT in comparison with another sample prepared from Ca(NO3)2 under the same conditions. We strongly recommend that HAPT be prepared from CKD as a cost-effective and calcium-rich source. Additionally, as demonstrated by SEM micrographs, due to its distinct surface morphology. We invite our colleagues and researchers to utilize our HAPT-CKD sample in biomedical applications involving bone repair. CRediT authorship contribution statement Mahmoud Nasr: Visualization, Conceptualization, Formal analysis, Investigation, Methodology, Software, Writing – original draft, Writing – review & editing. Samih A. Halawy: Writing – review & editing, Formal analysis, Validation Project administration, Supervision. Safaa El-Nahas: Writing – review & editing, Software, Project administration, Supervision. Adel Abdelkader: Writing – review & editing, Software, Project administration, Supervision. Ahmed I. Osman: Writing – review & editing, Conceptualization, Methodology, Proofreading, Project administration. Declaration of Competing Interest The authors declare that they have no known competing financial interests or personal relationships that could have appeared to influence the work reported in this paper. Acknowledgement The authors wish to dedicate this work to the spirit of the distinguished Egyptian professor Dr Samih A. Halawy who passed away on the 2nd of September 2022. The authors wish to acknowledge the support of The Bryden Centre project (Project ID VA5048). The Bryden Centre project is supported by the European Union’s INTERREG VA Programme, managed by the Special EU Programmes Body (SEUPB). The authors thank Dr Charlie Farrell for proofreading the revised manuscript. Appendix A Supporting information Supplementary data associated with this article can be found in the online version at doi:10.1016/j.apcata.2023.119039. Appendix A Supplementary material Supplementary material . References [1] J.M.E. Drack D.P. Vazquez Morphological response of a cactus to cement dust pollution Ecotoxicol. Environ. Saf. 148 2018 571 577 J.M.E. Drack, D.P. Vazquez, Morphological response of a cactus to cement dust pollution, Ecotox Environ Safe, 148 (2018) 571–577. [2] M. Seo S.-Y. Lee C. Lee S.-S. Cho Recycling of Cement Kiln Dust as a Raw Material for Cement Environments 6 2019 M. Seo, S.-Y. Lee, C. Lee, S.-S. Cho, Recycling of Cement Kiln Dust as a Raw Material for Cement, Environments, 6 (2019). [3] B. Pacewska I. Wilińska Usage of supplementary cementitious materials: advantages and limitations J. Therm. Anal. Calorim. 142 2020 371 393 B. Pacewska, I. Wilińska, Usage of supplementary cementitious materials: advantages and limitations, Journal of Thermal Analysis and Calorimetry, 142 (2020) 371–393. [4] A.A.H. Faisal D.N. Ahmed M. Rezakazemi N. Sivarajasekar G. Sharma Cost-effective composite prepared from sewage sludge waste and cement kiln dust as permeable reactive barrier to remediate simulated groundwater polluted with tetracycline J. Environ. Chem. Eng. 9 2021 A.A.H. Faisal, D.N. Ahmed, M. Rezakazemi, N. Sivarajasekar, G. Sharma, Cost-effective composite prepared from sewage sludge waste and cement kiln dust as permeable reactive barrier to remediate simulated groundwater polluted with tetracycline, Journal of Environmental Chemical Engineering, 9 (2021). [5] M. Bin Mobarak M.S. Hossain Z. Yeasmin M. Mahmud M.M. Rahman S. Sultana S.M. Masum S. Ahmed Probing the photocatalytic competency of hydroxyapatite synthesized by solid state and wet chemical precipitation method J. Mol. Struct. 1252 2022 M. Bin Mobarak, M.S. Hossain, Z. Yeasmin, M. Mahmud, M.M. Rahman, S. Sultana, S.M. Masum, S. Ahmed, Probing the photocatalytic competency of hydroxyapatite synthesized by solid state and wet chemical precipitation method, Journal of Molecular Structure, 1252 (2022). [6] D. Muthu G. Suresh Kumar M. Gowri M. Prasath V. Viswabaskaran V.S. Kattimani E.K. Girija Rapid synthesis of eggshell derived hydroxyapatite with nanoscale characteristics for biomedical applications Ceram. Int. 48 2022 1326 1339 D. Muthu, G. Suresh Kumar, M. Gowri, M. Prasath, V. Viswabaskaran, V.S. Kattimani, E.K. Girija, Rapid synthesis of eggshell derived hydroxyapatite with nanoscale characteristics for biomedical applications, Ceramics International, 48 (2022) 1326–1339. [7] E.S. Akpan M. Dauda L.S. Kuburi D.O. Obada N.D. Bansod D. Dodoo-Arhin Hydroxyapatite ceramics prepared from two natural sources by direct thermal conversion: From material processing to mechanical measurements Mater. Today.: Proc. 38 2021 2291 2294 E.S. Akpan, M. Dauda, L.S. Kuburi, D.O. Obada, N.D. Bansod, D. Dodoo-Arhin, Hydroxyapatite ceramics prepared from two natural sources by direct thermal conversion: From material processing to mechanical measurements, Materials Today: Proceedings, 38 (2021) 2291–2294. [8] K.-S. Han A. Sathiyaseelan K. Saravanakumar M.-H. Wang Wound healing efficacy of biocompatible hydroxyapatite from bovine bone waste for bone tissue engineering application J. Environ. Chem. Eng. 10 2022 K.-S. Han, A. Sathiyaseelan, K. Saravanakumar, M.-H. Wang, Wound healing efficacy of biocompatible hydroxyapatite from bovine bone waste for bone tissue engineering application, Journal of Environmental Chemical Engineering, 10 (2022). [9] M. Mathina E. Shinyjoy L. Kavitha D. Gopi A preliminary study on the synthesis of biogenic derived hydroxyapatite /medicinal plant extracts composite for potential bone tissue engineering applications Mater. Today.: Proc. 51 2022 1817 1820 M. Mathina, E. Shinyjoy, L. Kavitha, D. Gopi, A preliminary study on the synthesis of biogenic derived hydroxyapatite /medicinal plant extracts composite for potential bone tissue engineering applications, Materials Today: Proceedings, 51 (2022) 1817–1820. [10] F. Sharifianjazi A. Esmaeilkhanian M. Moradi A. Pakseresht M.S. Asl H. Karimi-Maleh H.W. Jang M. Shokouhimehr R.S. Varma Biocompatibility and mechanical properties of pigeon bone waste extracted natural nano-hydroxyapatite for bone tissue engineering Mater. Sci. Eng.: B 264 2021 F. Sharifianjazi, A. Esmaeilkhanian, M. Moradi, A. Pakseresht, M.S. Asl, H. Karimi-Maleh, H.W. Jang, M. Shokouhimehr, R.S. Varma, Biocompatibility and mechanical properties of pigeon bone waste extracted natural nano-hydroxyapatite for bone tissue engineering, Materials Science and Engineering: B, 264 (2021). [11] S. Borges C. Piccirillo F. Scalera R. Martins A. Rosa J.A. Couto A. Almeida M. Pintado, Valorization of porcine by-products: a combined process for protein hydrolysates and hydroxyapatite production Bioresour. Bioprocess. 9 2022 S. Borges, C. Piccirillo, F. Scalera, R. Martins, A. Rosa, J.A. Couto, A. Almeida, M. Pintado, Valorization of porcine by-products: a combined process for protein hydrolysates and hydroxyapatite production, Bioresources and Bioprocessing, 9 (2022). [12] S.G. Mtavangu W. Mahene R.L. Machunda B. van der Bruggen K.N. Njau Cockle (Anadara granosa) shells-based hydroxyapatite and its potential for defluoridation of drinking water Results Eng. 13 2022 S.G. Mtavangu, W. Mahene, R.L. Machunda, B. van der Bruggen, K.N. Njau, Cockle (Anadara granosa) shells-based hydroxyapatite and its potential for defluoridation of drinking water, Results in Engineering, 13 (2022). [13] Z. Zuliantoni W. Suprapto P.H. Setyarini F. Gapsari Extraction and characterization of snail shell waste hydroxyapatite Results Eng. 14 2022 Z. Zuliantoni, W. Suprapto, P.H. Setyarini, F. Gapsari, Extraction and characterization of snail shell waste hydroxyapatite, Results in Engineering, 14 (2022). [14] H. Chen X. Lei T. Yu X. Guan H. Yuan Ultra-high specific capacitance of self-doped 3D hierarchical porous turtle shell-derived activated carbon for high-performance supercapacitors Ceram. Int. 48 2022 5289 5298 H. Chen, X. Lei, T. Yu, X. Guan, H. Yuan, Ultra-high specific capacitance of self-doped 3D hierarchical porous turtle shell-derived activated carbon for high-performance supercapacitors, Ceramics International, 48 (2022) 5289–5298. [15] S. Brahimi A. Ressler K. Boumchedda M. Hamidouche A. Kenzour R. Djafar M. Antunović L. Bauer P. Hvizdoš H. Ivanković Preparation and characterization of biocomposites based on chitosan and biomimetic hydroxyapatite derived from natural phosphate rocks Mater. Chem. Phys. 276 2022 S. Brahimi, A. Ressler, K. Boumchedda, M. Hamidouche, A. Kenzour, R. Djafar, M. Antunović, L. Bauer, P. Hvizdoš, H. Ivanković, Preparation and characterization of biocomposites based on chitosan and biomimetic hydroxyapatite derived from natural phosphate rocks, Materials Chemistry and Physics, 276 (2022). [16] W.-l Xu B. Liu Y.-c Wang G.-y Xiao X. Chen W.-h Xu Y.-p Lu A facile strategy for one-step hydrothermal preparation of porous hydroxyapatite microspheres with core–shell structure J. Mater. Res. Technol. 17 2022 320 328 W.-l Xu, B. Liu, Y.-c Wang, G.-y Xiao, X. Chen, W.-h Xu, Y.-p Lu, A facile strategy for one-step hydrothermal preparation of porous hydroxyapatite microspheres with core–shell structure, Journal of Materials Research and Technology, 17 (2022) 320–328. [17] V. Collins Arun Prakash I. Venda V. Thamizharasi Synthesis and characterization of surfactant assisted hydroxyapatite powder using microemulsion method Mater. Today.: Proc. 51 2022 1788 1792 V. Collins Arun Prakash, I. Venda, V. Thamizharasi, Synthesis and characterization of surfactant assisted hydroxyapatite powder using microemulsion method, Materials Today: Proceedings, 51 (2022) 1788–1792. [18] A. Fadli P. Widiyanti D. Noviana A. Prabowo A. Mulyadi Deska, Porous hydroxyapatite scaffold produced using Musa paradisiaca template and its in vitro bioactivity J. Aust. Ceram. Soc. 58 2021 357 366 A. Fadli, P. Widiyanti, D. Noviana, A. Prabowo, A. Mulyadi, Deska, Porous hydroxyapatite scaffold produced using Musa paradisiaca template and its in vitro bioactivity, Journal of the Australian Ceramic Society, 58 (2021) 357–366. [19] K. Dixit S. Kulanthaivel T. Agarwal K. Pal S. Giri T.K. Maiti I. Banerjee Gum tragacanth modified nano-hydroxyapatite: An angiogenic- osteogenic biomaterial for bone tissue engineering Ceram. Int. 48 2022 14672 14683 K. Dixit, S. Kulanthaivel, T. Agarwal, K. Pal, S. Giri, T.K. Maiti, I. Banerjee, Gum tragacanth modified nano-hydroxyapatite: An angiogenic- osteogenic biomaterial for bone tissue engineering, Ceramics International, 48 (2022) 14672–14683. [20] Y. Xin T. Shirai Noble-metal-free hydroxyapatite activated by facile mechanochemical treatment towards highly-efficient catalytic oxidation of volatile organic compound Sci. Rep. 11 2021 7512 Y. Xin, T. Shirai, Noble-metal-free hydroxyapatite activated by facile mechanochemical treatment towards highly-efficient catalytic oxidation of volatile organic compound, Sci Rep, 11 (2021) 7512. [21] T. Jose J. Ftouni P.C.A. Bruijnincx Structured hydroxyapatite composites as efficient solid base catalysts for condensation reactions Catal. Sci. Technol. 11 2021 3428 3436 T. Jose, J. Ftouni, P.C.A. Bruijnincx, Structured hydroxyapatite composites as efficient solid base catalysts for condensation reactions, Catalysis Science & Technology, 11 (2021) 3428–3436. [22] S. Hajimirzaee S. Chansai C. Hardacre C.E. Banks A.M. Doyle Effects of surfactant on morphology, chemical properties and catalytic activity of hydroxyapatite J. Solid State Chem. 276 2019 345 351 S. Hajimirzaee, S. Chansai, C. Hardacre, C.E. Banks, A.M. Doyle, Effects of surfactant on morphology, chemical properties and catalytic activity of hydroxyapatite, Journal of Solid State Chemistry, 276 (2019) 345–351. [23] H. Brasil A.F.B. Bittencourt K.C.E.S. Yokoo P.C.D. Mendes L.G. Verga K.F. Andriani R. Landers J.L.F. Da Silva G.P. Valença Synthesis modification of hydroxyapatite surface for ethanol conversion: the role of the acidic/basic sites ratio J. Catal. 404 2021 802 813 H. Brasil, A.F.B. Bittencourt, K.C.E.S. Yokoo, P.C.D. Mendes, L.G. Verga, K.F. Andriani, R. Landers, J.L.F. Da Silva, G.P. Valença, Synthesis modification of hydroxyapatite surface for ethanol conversion: The role of the acidic/basic sites ratio, Journal of Catalysis, 404 (2021) 802–813. [24] B. Rego de Vasconcelos D. Pham Minh E. Martins A. Germeau P. Sharrock A. Nzihou Highly-efficient hydroxyapatite-supported nickel catalysts for dry reforming of methane Int. J. Hydrog. Energy 45 2020 18502 18518 B. Rego de Vasconcelos, D. Pham Minh, E. Martins, A. Germeau, P. Sharrock, A. Nzihou, Highly-efficient hydroxyapatite-supported nickel catalysts for dry reforming of methane, International Journal of Hydrogen Energy, 45 (2020) 18502–18518. [25] R. Vishwakarma V. Rathod L.K. Mannepalli W/HAP catalysed N-oxidation of tertiary amines with H2O2 as an oxidant J. Chem. Sci. (Bangalore) 134 2022 50 R. Vishwakarma, V. Rathod, L.K. Mannepalli, W/HAP catalysed N-oxidation of tertiary amines with H2O2 as an oxidant, J Chem Sci (Bangalore), 134 (2022) 50. [26] J. Dobosz S. Hull M. Zawadzki Calcium hydroxyapatite supported cobalt catalysts for ethanol steam reforming: effect of the incorporation method of active phase Stud. U Babes Bol. Che 63 2018 215 237 J. Dobosz, S. Hull, M. Zawadzki, Calcium Hydroxyapatite Supported Cobalt Catalysts for Ethanol Steam Reforming: Effect of the Incorporation Method of Active Phase, Stud U Babes-Bol Che, 63 (2018) 215–237. [27] E.A. El-Katatny S.A. Halawy M.A. Mohamed M.I. Zaki Recovery of high surface area alumina from aluminium dross tailings J. Chem. Technol. Biotechnol. 75 2000 394 402 E.A. Ei-Katatny, S.A. Halawy, M.A. Mohamed, M.I. Zaki, Recovery of high surface area alumina from aluminium dross tailings, Journal of Chemical Technology & Biotechnology, 75 (2000) 394–402. [28] E.A. El-Katatny S.A. Halawy M.A. Mohamed M.I. Zaki Surface and bulk properties of alumina-recovered under various conditions from aluminum-dross tailings chemical waste versus bauxite ore J. Mater. Res 17 2002 1721 1728 E.A. El-Katatny, S.A. Halawy, M.A. Mohamed, M.I. Zaki, Surface and bulk properties of alumina-recovered under various conditions from aluminum-dross tailings chemical waste versus bauxite ore, J Mater Res, 17 (2002) 1721–1728. [29] E.A. El-Katatny S.A. Halawy M.A. Mohamed M.I. Zaki Surface composition, charge and texture of active alumina powders recovered from aluminum dross tailings chemical waste Powder Technol. 132 2003 137 144 E.A. El-Katatny, S.A. Halawy, M.A. Mohamed, M.I. Zaki, Surface composition, charge and texture of active alumina powders recovered from aluminum dross tailings chemical waste, Powder Technology, 132 (2003) 137–144. [30] E.A. El-Katatny S.A. Halawy M.A. Mohamed M.I. Zaki Recovery of ethene-selective FeOx/Al2O3 ethanol dehydration catalyst from industrial chemical wastes Appl. Catal. A Gen. 199 2000 83 92 E.A. El-Katatny, S.A. Halawy, M.A. Mohamed, M.I. Zaki, Recovery of ethene-selective FeOx/Al2O3 ethanol dehydration catalyst from industrial chemical wastes, Appl Catal a-Gen, 199 (2000) 83–92. [31] H. Karampour M.A. Parsa A.H. Moghadam B. Pourhasan R. Ashiri Facile solution-based synthesis of impurity-free hydroxyapatite nanocrystals at ambient conditions J. Mater. Res. Technol. 16 2022 656 674 H. Karampour, M.A. Parsa, A.H. Moghadam, B. Pourhasan, R. Ashiri, Facile solution-based synthesis of impurity-free hydroxyapatite nanocrystals at ambient conditions, Journal of Materials Research and Technology, 16 (2022) 656–674. [32] G.A.H. Mekhemer S.A. Halawy M.A. Mohamed M.I. Zaki Qualitative and quantitative assessments of acid and base sites exposed on polycrystalline MgO surfaces: thermogravimetric, calorimetric, and in-situ FTIR spectroscopic study combination J. Phys. Chem. B 108 2004 13379 13386 G.A.H. Mekhemer, S.A. Halawy, M.A. Mohamed, M.I. Zaki, Qualitative and quantitative assessments of acid and base sites exposed on polycrystalline MgO surfaces: Thermogravimetric, calorimetric, and in-situ FTIR spectroscopic study combination, J Phys Chem B, 108 (2004) 13379–13386. [33] A.I. Osman J.K. Abu-Dahrieh D.W. Rooney S.A. Halawy M.A. Mohamed A. Abdelkader Effect of precursor on the performance of alumina for the dehydration of methanol to dimethyl ether Appl. Catal. B Environ. 127 2012 307 315 A.I. Osman, J.K. Abu-Dahrieh, D.W. Rooney, S.A. Halawy, M.A. Mohamed, A. Abdelkader, Effect of precursor on the performance of alumina for the dehydration of methanol to dimethyl ether, Applied Catalysis B: Environmental, 127 (2012) 307–315. [34] S.A. Halawy A.I. Osman A. Abdelkader M. Nasr D.W. Rooney Assessment of lewis-acidic surface sites using tetrahydrofuran as a suitable and smart probe molecule ChemistryOpen 11 2022 e202200021 S.A. Halawy, A.I. Osman, A. Abdelkader, M. Nasr, D.W. Rooney, Assessment of Lewis-Acidic Surface Sites Using Tetrahydrofuran as a Suitable and Smart Probe Molecule, ChemistryOpen, 11 (2022) e202200021. [35] S.A. Halawy A.I. Osman A. Abdelkader H. Yang Boosting NiO catalytic activity by x wt% F-ions and K2O for the production of methyl ethyl ketone (MEK) via catalytic dehydrogenation of 2-butanol ChemCatChem 13 2021 2200 2214 S.A. Halawy, A.I. Osman, A. Abdelkader, H. Yang, Boosting NiO Catalytic Activity by x wt% F-ions and K2O for the Production of Methyl Ethyl Ketone (MEK) via Catalytic Dehydrogenation of 2-Butanol, ChemCatChem, 13 (2021) 2200–2214. [36] M. Kaniewski K. Hoffmann J. Hoffmann Influence of selected potassium salts on thermal stability of ammonium nitrate Thermochim. Acta 678 2019 M. Kaniewski, K. Hoffmann, J. Hoffmann, Influence of selected potassium salts on thermal stability of ammonium nitrate, Thermochimica Acta, 678 (2019). [37] X. Fan W. Zhang F. Lu Y. Sui J. Wang Z. Xu Research of Fluorescent Properties of a New Type of Phosphor with Mn(2+)-Doped Ca2SiO4 Sensors 21 2021 X. Fan, W. Zhang, F. Lu, Y. Sui, J. Wang, Z. Xu, Research of Fluorescent Properties of a New Type of Phosphor with Mn(2+)-Doped Ca2SiO4, Sensors (Basel), 21 (2021). [38] K. Schraut F. Kargl C. Adam O. Ivashko In situsynchrotron XRD measurements during solidification of a melt in the CaO-SiO2system using an aerodynamic levitation system J. Phys. Condens Matter 33 2021 K. Schraut, F. Kargl, C. Adam, O. Ivashko, In situsynchrotron XRD measurements during solidification of a melt in the CaO-SiO2system using an aerodynamic levitation system, J Phys Condens Matter, 33 (2021). [39] I. Garcia-Lodeiro P.M. Carmona-Quiroga R. Zarzuela M.J. Mosquera M.T. Blanco-Varela Chemistry of the interaction between an alkoxysilane-based impregnation treatment and cementitious phases Cem. Concr. Res. 142 2021 I. Garcia-Lodeiro, P.M. Carmona-Quiroga, R. Zarzuela, M.J. Mosquera, M.T. Blanco-Varela, Chemistry of the interaction between an alkoxysilane-based impregnation treatment and cementitious phases, Cement and Concrete Research, 142 (2021). [40] R.P. Lefojane B.T. Sone N. Matinise K. Saleh P. Direko P. Mfengwana S. Mashele M. Maaza M.P. Sekhoacha CdO/CdCO3 nanocomposite physical properties and cytotoxicity against selected breast cancer cell lines Sci. Rep. 11 2021 30 R.P. Lefojane, B.T. Sone, N. Matinise, K. Saleh, P. Direko, P. Mfengwana, S. Mashele, M. Maaza, M.P. Sekhoacha, CdO/CdCO3 nanocomposite physical properties and cytotoxicity against selected breast cancer cell lines, Sci Rep, 11 (2021) 30. [41] A.F. Ali Z.A. Alrowaili E.M. El-Giar M.M. Ahmed A.M. El-Kady Novel green synthesis of hydroxyapatite uniform nanorods via microwave-hydrothermal route using licorice root extract as template Ceram. Int. 47 2021 3928 3937 A.F. Ali, Z.A. Alrowaili, E.M. El-Giar, M.M. Ahmed, A.M. El-Kady, Novel green synthesis of hydroxyapatite uniform nanorods via microwave-hydrothermal route using licorice root extract as template, Ceramics International, 47 (2021) 3928–3937. [42] V.P. Padmanabhan R. Kulandaivelu D. Santhana Panneer S. Vivekananthan S. Sagadevan J. Anita Lett, Microwave synthesis of hydroxyapatite encumbered with ascorbic acid intended for drug leaching studies Mater. Res. Innov. 24 2019 171 178 V.P. Padmanabhan, R. Kulandaivelu, D. Santhana Panneer, S. Vivekananthan, S. Sagadevan, J. Anita Lett, Microwave synthesis of hydroxyapatite encumbered with ascorbic acid intended for drug leaching studies, Materials Research Innovations, 24 (2019) 171–178. [43] A. Rodrigues B. Sena da Fonseca A.P. Ferreira Pinto S. Piçarra M.F. Montemor Synthesis and application of hydroxyapatite nanorods for improving properties of stone consolidants Ceram. Int. 48 2022 14606 14617 A. Rodrigues, B. Sena da Fonseca, A.P. Ferreira Pinto, S. Piçarra, M.F. Montemor, Synthesis and application of hydroxyapatite nanorods for improving properties of stone consolidants, Ceramics International, 48 (2022) 14606–14617. [44] H. Nosrati R. Sarraf-Mamoory D.Q.S. Le R. Zolfaghari Emameh M. Canillas Perez C.E. Bunger Improving the mechanical behavior of reduced graphene oxide/hydroxyapatite nanocomposites using gas injection into powders synthesis autoclave Sci. Rep. 10 2020 8552 H. Nosrati, R. Sarraf-Mamoory, D.Q.S. Le, R. Zolfaghari Emameh, M. Canillas Perez, C.E. Bunger, Improving the mechanical behavior of reduced graphene oxide/hydroxyapatite nanocomposites using gas injection into powders synthesis autoclave, Sci Rep, 10 (2020) 8552. [45] O.A. Osuchukwu A. Salihi I. Abdullahi B. Abdulkareem C.S. Nwannenna Synthesis techniques, characterization and mechanical properties of natural derived hydroxyapatite scaffolds for bone implants: a review SN Appl. Sci. 3 2021 O.A. Osuchukwu, A. Salihi, I. Abdullahi, B. Abdulkareem, C.S. Nwannenna, Synthesis techniques, characterization and mechanical properties of natural derived hydroxyapatite scaffolds for bone implants: a review, SN Applied Sciences, 3 (2021). [46] S.M. Londoño-Restrepo M. Herrera-Lara L.R. Bernal-Alvarez E.M. Rivera-Muñoz M.E. Rodriguez-García In-situ XRD study of the crystal size transition of hydroxyapatite from swine bone Ceram. Int. 46 2020 24454 24461 S.M. Londoño-Restrepo, M. Herrera-Lara, L.R. Bernal-Alvarez, E.M. Rivera-Muñoz, M.E. Rodriguez-García, In-situ XRD study of the crystal size transition of hydroxyapatite from swine bone, Ceramics International, 46 (2020) 24454–24461. [47] D. Aquilano M. Bruno M. Rubbo F.R. Massaro L. Pastero Low symmetry polymorph of hydroxyapatite. theoretical equilibrium morphology of the monoclinic Ca5(OH)(PO4)3 Cryst. Growth Des. 14 2014 2846 2852 D. Aquilano, M. Bruno, M. Rubbo, F.R. Massaro, L. Pastero, Low Symmetry Polymorph of Hydroxyapatite. Theoretical Equilibrium Morphology of the Monoclinic Ca5(OH)(PO4)3, Crystal Growth & Design, 14 (2014) 2846–2852. [48] W. Ashraf J. Olek Carbonation behavior of hydraulic and non-hydraulic calcium silicates: potential of utilizing low-lime calcium silicates in cement-based materials J. Mater. Sci. 51 2016 6173 6191 W. Ashraf, J. Olek, Carbonation behavior of hydraulic and non-hydraulic calcium silicates: potential of utilizing low-lime calcium silicates in cement-based materials, Journal of Materials Science, 51 (2016) 6173–6191. [49] A. Biedrzycka E. Skwarek U.M. Hanna Hydroxyapatite with magnetic core: synthesis methods, properties, adsorption and medical applications Adv. Colloid Interface Sci. 291 2021 102401 A. Biedrzycka, E. Skwarek, U.M. Hanna, Hydroxyapatite with magnetic core: Synthesis methods, properties, adsorption and medical applications, Advances in Colloid and Interface Science, 291 (2021) 102401. [50] P. Yu R.J. Kirkpatrick B. Poe P.F. McMillan X. Cong Structure of calcium silicate hydrate (C-S-H): near-, mid-, and far-infrared spectroscopy J. Am. Ceram. Soc. 82 2004 742 748 P. Yu, R.J. Kirkpatrick, B. Poe, P.F. McMillan, X. Cong, Structure of Calcium Silicate Hydrate (C-S-H): Near-, Mid-, and Far-Infrared Spectroscopy, Journal of the American Ceramic Society, 82 (2004) 742–748. [51] L. Fernández-Carrasco, D. Torrens-Martín, L. Morales, S. Martínez-Ramírez, Infrared spectroscopy in the analysis of building and construction materials, 2012. [52] N. Tangboriboon R. Kunanuruksapong A. Sirivat Preparation and properties of calcium oxide from eggshells via calcination Mater. Sci. -Pol. 30 2012 313 322 N. Tangboriboon, R. Kunanuruksapong, A. Sirivat, Preparation and properties of calcium oxide from eggshells via calcination, Materials Science-Poland, 30 (2012) 313–322. [53] S. Gao K. Sun A. Li H. Wang Synthesis and characterization of hydroxyapatite nanofiber by chemical precipitation method using surfactants Mater. Res. Bull. 48 2013 1003 1006 S. Gao, K. Sun, A. Li, H. Wang, Synthesis and characterization of hydroxyapatite nanofiber by chemical precipitation method using surfactants, Materials Research Bulletin, 48 (2013) 1003–1006. [54] Y. Wang S. Zhang K. Wei N. Zhao J. Chen X. Wang Hydrothermal synthesis of hydroxyapatite nanopowders using cationic surfactant as a template Mater. Lett. 60 2006 1484 1487 Y. Wang, S. Zhang, K. Wei, N. Zhao, J. Chen, X. Wang, Hydrothermal synthesis of hydroxyapatite nanopowders using cationic surfactant as a template, Materials Letters, 60 (2006) 1484–1487. [55] Y. Liu M. Liu S. Ji L. Zhang W. Cao H. Wang S. Wang Preparation and application of hydroxyapatite extracted from fish scale waste using deep eutectic solvents Ceram. Int. 47 2021 9366 9372 Y. Liu, M. Liu, S. Ji, L. Zhang, W. Cao, H. Wang, S. Wang, Preparation and application of hydroxyapatite extracted from fish scale waste using deep eutectic solvents, Ceramics International, 47 (2021) 9366–9372. [56] E. Iyyappan P. Wilson Synthesis of nanoscale hydroxyapatite particles using triton X-100 as an organic modifier Ceram. Int. 39 2013 771 777 E. Iyyappan, P. Wilson, Synthesis of nanoscale hydroxyapatite particles using triton X-100 as an organic modifier, Ceramics International, 39 (2013) 771–777. [57] M. Fatemeh A. Navabazam N. Samanizadeh Preparation of hydroxyapatite nanoparticles from natural teeth Russ. J. Nondestruct. Test. 57 2021 152 162 M. Fatemeh, A. Navabazam, N. Samanizadeh, Preparation of Hydroxyapatite Nanoparticles from Natural Teeth, Russian Journal of Nondestructive Testing, 57 (2021) 152–162. [58] M. Galvan-Ruiz L. Baños M.E. Rodriguez-Garcia Lime characterization as a food additive Sens. Instrum. Food Qual. Saf. 1 2007 169 175 M. Galvan-Ruiz, L. Baños, M.E. Rodriguez-Garcia, Lime characterization as a food additive, Sensing and Instrumentation for Food Quality and Safety, 1 (2007) 169–175. [59] P.A. Forero-Sossa I.U. Olvera-Alvarez J.D. Salazar-Martinez D.G. Espinosa-Arbelaez B. Segura-Giraldo A.L. Giraldo-Betancur Biogenic hydroxyapatite powders: effects of source and processing methodologies on physicochemical properties and bioactive response Mater. Charact. 173 2021 P.A. Forero-Sossa, I.U. Olvera-Alvarez, J.D. Salazar-Martinez, D.G. Espinosa-Arbelaez, B. Segura-Giraldo, A.L. Giraldo-Betancur, Biogenic hydroxyapatite powders: Effects of source and processing methodologies on physicochemical properties and bioactive response, Materials Characterization, 173 (2021). [60] A. Ashokan T.S.S. Kumar G. Jayaraman Process optimization for the rapid conversion of calcite into hydroxyapatite microspheres for chromatographic applications Sci. Rep. 12 2022 12164 A. Ashokan, T.S.S. Kumar, G. Jayaraman, Process optimization for the rapid conversion of calcite into hydroxyapatite microspheres for chromatographic applications, Sci Rep, 12 (2022) 12164. [61] K. Ma H. Cui A. Zhou H. Wu X. Dong F. Zu J. Yi R. Wang Q. Xu Mesoporous hydroxyapatite: synthesis in molecular self-assembly and adsorption properties Microporous Mesoporous Mater. 323 2021 K. Ma, H. Cui, A. Zhou, H. Wu, X. Dong, F. Zu, J. Yi, R. Wang, Q. Xu, Mesoporous hydroxyapatite: Synthesis in molecular self-assembly and adsorption properties, Microporous and Mesoporous Materials, 323 (2021). [62] X. Li D. Zeng L. Chen P. Ke Y. Tian G. Wang Preparation and characterization of magnetic chitosan hydroxyapatite nanoparticles for protein drug delivery and antibacterial activity J. Mater. Sci. Res. 36 2021 4307 4316 Li X., Zeng D., Chen L., Ke P., Tian Y., Wang G., Preparation and characterization of magnetic chitosan hydroxyapatite nanoparticles for protein drug delivery and antibacterial activity, J. Mater. Sci. Res. 36 (2021) 4307–4316. [63] M. Thommes, K. Kaneko, A.V. Neimark, J.P. Olivier, F. Rodriguez-Reinoso, J. Rouquerol, K.S.J.P. Sing, a. chemistry, Physisorption of gases, with special reference to the evaluation of surface area and pore size distribution (IUPAC Technical Report), 87 (2015) 1051–1069. [64] A. Ashokan V. Rajendran T.S. Sampath Kumar G. Jayaraman Eggshell derived hydroxyapatite microspheres for chromatographic applications by a novel dissolution - precipitation method Ceram. Int. 47 2021 18575 18583 A. Ashokan, V. Rajendran, T.S. Sampath Kumar, G. Jayaraman, Eggshell derived hydroxyapatite microspheres for chromatographic applications by a novel dissolution - precipitation method, Ceramics International, 47 (2021) 18575–18583. [65] F. Scalera A. Quarta D.M. Tobaldi R.C. Pullar C. Piccirillo Cork-derived hierarchically porous hydroxyapatite with different stoichiometries for biomedical and environmental applications Mater. Chem. Front. 5 2021 5071 5081 F. Scalera, A. Quarta, D.M. Tobaldi, R.C. Pullar, C. Piccirillo, Cork-derived hierarchically porous hydroxyapatite with different stoichiometries for biomedical and environmental applications, Materials Chemistry Frontiers, 5 (2021) 5071–5081. [66] D. Ariyani, K.D. Nugrahaningtyas, E. Heraldy, The Variation of Catalyst and Carrier Gas on Anisole Deoxygenation Reaction, IOP Conference Series: Materials Science and Engineering, IOP Publishing, 2018, pp. 012058. [67] S.A. Halawy M.A. Mohamed A. Abdelkader Hierarchical nanocrystalline NiO with coral-like structure derived from nickel galactarate dihydrate: An active mesoporous catalyst for methyl ethyl ketone production Arab. J. Chem. 11 2018 991 999 S.A. Halawy, M.A. Mohamed, A. Abdelkader, Hierarchical nanocrystalline NiO with coral-like structure derived from nickel galactarate dihydrate: An active mesoporous catalyst for methyl ethyl ketone production, Arabian Journal of Chemistry, 11 (2018) 991–999. [68] Y. Zhang Z. Wu Z. Hong X. Gu N. Xu Hydrogen-selective zeolite membrane reactor for low temperature water gas shift reaction Chem. Eng. J. 197 2012 314 321 Y. Zhang, Z. Wu, Z. Hong, X. Gu, N. Xu, Hydrogen-selective zeolite membrane reactor for low temperature water gas shift reaction, Chemical Engineering Journal, 197 (2012) 314–321. [69] A.F. Bittencourt P.C. Mendes G.P. Valença J.L. Da Silva Acid-base properties of hydroxyapatite (0001) by the adsorption of probe molecules: An ab initio investigation Phys. Rev. Mater. 5 2021 075003 A.F. Bittencourt, P.C. Mendes, G.P. Valença, J.L.J.P.R.M. Da Silva, Acid-base properties of hydroxyapatite (0001) by the adsorption of probe molecules: An ab initio investigation, Physical Review Materials,5 (2021) 075003. [70] Z. Emami M. Ehsani M. Zandi H. Daemi M.-H. Ghanian R. Foudazi Modified hydroxyapatite nanoparticles reinforced nanocomposite hydrogels based on gelatin/oxidized alginate via Schiff base reaction Carbohydr. Polym. Technol. Appl. 2 2021 Z. Emami, M. Ehsani, M. Zandi, H. Daemi, M.-H. Ghanian, R. Foudazi, Modified hydroxyapatite nanoparticles reinforced nanocomposite hydrogels based on gelatin/oxidized alginate via Schiff base reaction, Carbohydrate Polymer Technologies and Applications, 2 (2021). [71] M.K. Gnanamani R. Garcia G. Jacobs K. Góra-Marek D.C. Cronauer A.J. Kropf C.L. Marshall Effect of pretreatment conditions on acidity and dehydration activity of CeO2-MeOx catalysts Appl. Catal. A: Gen. 602 2020 M.K. Gnanamani, R. Garcia, G. Jacobs, K. Góra-Marek, D.C. Cronauer, A.J. Kropf, C.L. Marshall, Effect of pretreatment conditions on acidity and dehydration activity of CeO2-MeOx catalysts, Applied Catalysis A: General, 602 (2020). [72] C.P. Nash A. Ramanathan D.A. Ruddy M. Behl E. Gjersing M. Griffin H. Zhu B. Subramaniam J.A. Schaidle J.E. Hensley Mixed alcohol dehydration over Brønsted and Lewis acidic catalysts Appl. Catal. A Gen. 510 2016 110 124 C.P. Nash, A. Ramanathan, D.A. Ruddy, M. Behl, E. Gjersing, M. Griffin, H. Zhu, B. Subramaniam, J.A. Schaidle, J.E. Hensley, Mixed alcohol dehydration over Brønsted and Lewis acidic catalysts, Applied Catalysis A: General, 510 (2016) 110–124. [73] B.R. Barnett S.T. Parker M.V. Paley M.I. Gonzalez N. Biggins J. Oktawiec J.R. Long Thermodynamic separation of 1-butene from 2-butene in metal-organic frameworks with open metal sites J. Am. Chem. Soc. 141 2019 18325 18333 B.R. Barnett, S.T. Parker, M.V. Paley, M.I. Gonzalez, N. Biggins, J. Oktawiec, J.R. Long, Thermodynamic Separation of 1-Butene from 2-Butene in Metal-Organic Frameworks with Open Metal Sites, J Am Chem Soc, 141 (2019) 18325–18333. [74] I. Cukrowski F. Sagan M.P. Mitoraj On the stability of cis- and trans-2-butene isomers. an insight based on the FAMSEC, IQA, and ETS-NOCV schemes J. Comput. Chem. 37 2016 2783 2798 I. Cukrowski, F. Sagan, M.P. Mitoraj, On the Stability of Cis- and Trans-2-Butene Isomers. An Insight Based on the FAMSEC, IQA, and ETS-NOCV Schemes, J Comput Chem, 37 (2016) 2783–2798. [75] J. Soto J.M. Rosas J.C. Otero J. Rodriguez-Mirasol T. Cordero Reaction mechanisms of 2-butanol dehydration over a phosphorus-containing activated carbon acid catalyst J. Phys. Chem. C. 122 2018 16772 16778 J. Soto, J.M. Rosas, J.C. Otero, J. Rodriguez-Mirasol, T. Cordero, Reaction Mechanisms of 2-Butanol Dehydration over a Phosphorus-Containing Activated Carbon Acid Catalyst, Journal of Physical Chemistry C, 122 (2018) 16772–16778. [76] J. Bedia R. Ruiz‐Rosas J. Rodríguez‐Mirasol T. Cordero Kinetic study of the decomposition of 2–butanol on carbon‐based acid catalyst AIChE J. 56 2009 1557 1568 J. Bedia, R. Ruiz‐Rosas, J. Rodríguez‐Mirasol, T. Cordero, Kinetic study of the decomposition of 2–butanol on carbon‐based acid catalyst, AIChE Journal, 56 (2009) 1557–1568. [77] Y. Li C.-W. Zhou K.P. Somers K. Zhang H.J. Curran The oxidation of 2-butene: A high pressure ignition delay, kinetic modeling study and reactivity comparison with isobutene and 1-butene Proc. Combust. Inst. 36 2017 403 411 Y. Li, C.-W. Zhou, K.P. Somers, K. Zhang, H.J. Curran, The oxidation of 2-butene: A high pressure ignition delay, kinetic modeling study and reactivity comparison with isobutene and 1-butene, Proceedings of the Combustion Institute, 36 (2017) 403–411. [78] Y. Fenard P. Dagaut G. Dayma F. Halter F. Foucher Experimental and kinetic modeling study of trans-2-butene oxidation in a jet-stirred reactor and a combustion bomb Proc. Combust. Inst. 35 2015 317 324 Y. Fenard, P. Dagaut, G. Dayma, F. Halter, F. Foucher, Experimental and kinetic modeling study of trans-2-butene oxidation in a jet-stirred reactor and a combustion bomb, Proceedings of the Combustion Institute, 35 (2015) 317–324. [79] M. Schenk L. Leon K. Moshammer P. Oßwald T. Zeuch L. Seidel F. Mauss K. Kohse-Höinghaus Detailed mass spectrometric and modeling study of isomeric butene flames Combust. Flame 160 2013 487 503 M. Schenk, L. Leon, K. Moshammer, P. Oßwald, T. Zeuch, L. Seidel, F. Mauss, K. Kohse-Höinghaus, Detailed mass spectrometric and modeling study of isomeric butene flames, Combustion and Flame, 160 (2013) 487–503. [80] H.U. Helvaci Z.A. Khan Thermodynamic modelling and analysis of a solar organic Rankine cycle employing thermofluids Energy Convers. Manag. 138 2017 493 510 H.U. Helvaci, Z.A. Khan, Thermodynamic modelling and analysis of a solar organic Rankine cycle employing thermofluids, Energy Conversion and Management, 138 (2017) 493–510. [81] W.-l Jiang L.-m He B. Huang Y.-q Chen G.-l Zhou H.-j Zhou Isomerization and hydroformylation of butenes under the catalysis of Rh-BIPHEPHOS J. Fuel Chem. Technol. 49 2021 1173 1180 W.-l Jiang, L.-m He, B. Huang, Y.-q Chen, G.-l Zhou, H.-j Zhou, Isomerization and hydroformylation of butenes under the catalysis of Rh-BIPHEPHOS, Journal of Fuel Chemistry and Technology, 49 (2021) 1173–1180. [82] https://www.marketresearchintellect.com/product/global-2-butene-market-size-and-forecast/?utm_source=Deportes2&utm_medium=019 (accessed). [83] S.A. Halawy A.I. Osman D.W. Rooney Highly basic and active ZnO–x%K2O nanocomposite catalysts for the production ofmethyl ethyl ketone biofuel Energy Sci. Eng. 10 2022 2827 2841 S.A. Halawy, A.I. Osman, D.W. Rooney, Highly basic and active ZnO–x%K2O nanocomposite catalysts for the production ofmethyl ethyl ketone biofuel, Energy Science & Engineering, 10 (2022) 2827–2841.",
      "scopus-id": "85146872339",
      "coredata": {
        "eid": "1-s2.0-S0926860X23000194",
        "dc:description": "This research is regarded as the first successful attempt at directly producing highly pure nanocomposite hydroxyapatite (HAPT) from cement kiln dust (CKD) using a cost-effective preparation method. The crystallite size of HAPT was 23.6 nm and showed a hierarchical mesoporous unit with a Ca-deficient structure according to SEM-EDX analyses. HAPT exhibits a high population of different acidic sites, i.e. weak, moderate and strong acidic sites, as determined by TG and DSC-TPD experiments using tetrahydrofuran as a probe molecule. The wide range of acidic sites over HAPT is clearly and positively enhanced its catalytic activity during the conversion of sec-butanol to trans-2-butene. In addition, our prepared HAPT demonstrated greater catalytic activity when sec-butanol was converted using air as a carrier rather than N2-gas. A comparison between the catalytic activity of HAPT prepared from the waste CKD and pure Ca(NO3)2 was also conducted, showing HAPT derived from waste streams with higher catalytic activity.",
        "openArchiveArticle": "false",
        "prism:coverDate": "2023-02-25",
        "openaccessUserLicense": "http://creativecommons.org/licenses/by/4.0/",
        "prism:aggregationType": "Journal",
        "prism:url": "https://api.elsevier.com/content/article/pii/S0926860X23000194",
        "dc:creator": [
          {
            "@_fa": "true",
            "$": "Nasr, Mahmoud"
          },
          {
            "@_fa": "true",
            "$": "Halawy, Samih A."
          },
          {
            "@_fa": "true",
            "$": "El-Nahas, Safaa"
          },
          {
            "@_fa": "true",
            "$": "Abdelkader, Adel"
          },
          {
            "@_fa": "true",
            "$": "Osman, Ahmed I."
          }
        ],
        "link": [
          {
            "@_fa": "true",
            "@rel": "self",
            "@href": "https://api.elsevier.com/content/article/pii/S0926860X23000194"
          },
          {
            "@_fa": "true",
            "@rel": "scidir",
            "@href": "https://www.sciencedirect.com/science/article/pii/S0926860X23000194"
          }
        ],
        "dc:format": "application/json",
        "openaccessType": "Full",
        "pii": "S0926-860X(23)00019-4",
        "prism:volume": "652",
        "articleNumber": "119039",
        "prism:publisher": "The Author(s). Published by Elsevier B.V.",
        "dc:title": "Direct and easily prepared nanocomposite impurity-free hydroxyapatite derived from CKD as an effective catalyst for trans-2-butene production",
        "prism:copyright": "© 2023 The Author(s). Published by Elsevier B.V.",
        "openaccess": "1",
        "prism:issn": "0926860X",
        "dcterms:subject": [
          {
            "@_fa": "true",
            "$": "Catalysis"
          },
          {
            "@_fa": "true",
            "$": "Cement Kiln Dust"
          },
          {
            "@_fa": "true",
            "$": "Hydroxyapatite"
          },
          {
            "@_fa": "true",
            "$": "Secondary butanol"
          },
          {
            "@_fa": "true",
            "$": "Trans-2-butene"
          }
        ],
        "openaccessArticle": "true",
        "prism:publicationName": "Applied Catalysis A: General",
        "openaccessSponsorType": "FundingBody",
        "prism:pageRange": "119039",
        "pubType": "fla",
        "prism:coverDisplayDate": "25 February 2023",
        "prism:doi": "10.1016/j.apcata.2023.119039",
        "prism:startingPage": "119039",
        "dc:identifier": "doi:10.1016/j.apcata.2023.119039",
        "openaccessSponsorName": "JISC UK 2022: Hybrid journals"
      },
      "objects": {
        "object": [
          {
            "@category": "standard",
            "@height": "485",
            "@width": "376",
            "@_fa": "true",
            "$": "https://api.elsevier.com/content/object/eid/1-s2.0-S0926860X23000194-gr1.jpg?httpAccept=%2A%2F%2A",
            "@multimediatype": "JPEG image file",
            "@type": "IMAGE-DOWNSAMPLED",
            "@size": "58176",
            "@ref": "gr1",
            "@mimetype": "image/jpeg"
          },
          {
            "@category": "standard",
            "@height": "628",
            "@width": "339",
            "@_fa": "true",
            "$": "https://api.elsevier.com/content/object/eid/1-s2.0-S0926860X23000194-gr5.jpg?httpAccept=%2A%2F%2A",
            "@multimediatype": "JPEG image file",
            "@type": "IMAGE-DOWNSAMPLED",
            "@size": "66704",
            "@ref": "gr5",
            "@mimetype": "image/jpeg"
          },
          {
            "@category": "standard",
            "@height": "514",
            "@width": "565",
            "@_fa": "true",
            "$": "https://api.elsevier.com/content/object/eid/1-s2.0-S0926860X23000194-gr4.jpg?httpAccept=%2A%2F%2A",
            "@multimediatype": "JPEG image file",
            "@type": "IMAGE-DOWNSAMPLED",
            "@size": "74674",
            "@ref": "gr4",
            "@mimetype": "image/jpeg"
          },
          {
            "@category": "standard",
            "@height": "850",
            "@width": "678",
            "@_fa": "true",
            "$": "https://api.elsevier.com/content/object/eid/1-s2.0-S0926860X23000194-gr3.jpg?httpAccept=%2A%2F%2A",
            "@multimediatype": "JPEG image file",
            "@type": "IMAGE-DOWNSAMPLED",
            "@size": "177601",
            "@ref": "gr3",
            "@mimetype": "image/jpeg"
          },
          {
            "@category": "standard",
            "@height": "369",
            "@width": "565",
            "@_fa": "true",
            "$": "https://api.elsevier.com/content/object/eid/1-s2.0-S0926860X23000194-gr2.jpg?httpAccept=%2A%2F%2A",
            "@multimediatype": "JPEG image file",
            "@type": "IMAGE-DOWNSAMPLED",
            "@size": "57590",
            "@ref": "gr2",
            "@mimetype": "image/jpeg"
          },
          {
            "@category": "standard",
            "@height": "200",
            "@width": "354",
            "@_fa": "true",
            "$": "https://api.elsevier.com/content/object/eid/1-s2.0-S0926860X23000194-ga1.jpg?httpAccept=%2A%2F%2A",
            "@multimediatype": "JPEG image file",
            "@type": "IMAGE-DOWNSAMPLED",
            "@size": "26345",
            "@ref": "ga1",
            "@mimetype": "image/jpeg"
          },
          {
            "@category": "standard",
            "@height": "496",
            "@width": "376",
            "@_fa": "true",
            "$": "https://api.elsevier.com/content/object/eid/1-s2.0-S0926860X23000194-gr9.jpg?httpAccept=%2A%2F%2A",
            "@multimediatype": "JPEG image file",
            "@type": "IMAGE-DOWNSAMPLED",
            "@size": "57063",
            "@ref": "gr9",
            "@mimetype": "image/jpeg"
          },
          {
            "@category": "standard",
            "@height": "529",
            "@width": "565",
            "@_fa": "true",
            "$": "https://api.elsevier.com/content/object/eid/1-s2.0-S0926860X23000194-gr8.jpg?httpAccept=%2A%2F%2A",
            "@multimediatype": "JPEG image file",
            "@type": "IMAGE-DOWNSAMPLED",
            "@size": "70708",
            "@ref": "gr8",
            "@mimetype": "image/jpeg"
          },
          {
            "@category": "standard",
            "@height": "645",
            "@width": "339",
            "@_fa": "true",
            "$": "https://api.elsevier.com/content/object/eid/1-s2.0-S0926860X23000194-gr7.jpg?httpAccept=%2A%2F%2A",
            "@multimediatype": "JPEG image file",
            "@type": "IMAGE-DOWNSAMPLED",
            "@size": "67505",
            "@ref": "gr7",
            "@mimetype": "image/jpeg"
          },
          {
            "@category": "standard",
            "@height": "244",
            "@width": "339",
            "@_fa": "true",
            "$": "https://api.elsevier.com/content/object/eid/1-s2.0-S0926860X23000194-gr6.jpg?httpAccept=%2A%2F%2A",
            "@multimediatype": "JPEG image file",
            "@type": "IMAGE-DOWNSAMPLED",
            "@size": "20666",
            "@ref": "gr6",
            "@mimetype": "image/jpeg"
          },
          {
            "@category": "thumbnail",
            "@height": "164",
            "@width": "127",
            "@_fa": "true",
            "$": "https://api.elsevier.com/content/object/eid/1-s2.0-S0926860X23000194-gr1.sml?httpAccept=%2A%2F%2A",
            "@multimediatype": "GIF image file",
            "@type": "IMAGE-THUMBNAIL",
            "@size": "8628",
            "@ref": "gr1",
            "@mimetype": "image/gif"
          },
          {
            "@category": "thumbnail",
            "@height": "163",
            "@width": "88",
            "@_fa": "true",
            "$": "https://api.elsevier.com/content/object/eid/1-s2.0-S0926860X23000194-gr5.sml?httpAccept=%2A%2F%2A",
            "@multimediatype": "GIF image file",
            "@type": "IMAGE-THUMBNAIL",
            "@size": "6895",
            "@ref": "gr5",
            "@mimetype": "image/gif"
          },
          {
            "@category": "thumbnail",
            "@height": "164",
            "@width": "180",
            "@_fa": "true",
            "$": "https://api.elsevier.com/content/object/eid/1-s2.0-S0926860X23000194-gr4.sml?httpAccept=%2A%2F%2A",
            "@multimediatype": "GIF image file",
            "@type": "IMAGE-THUMBNAIL",
            "@size": "15206",
            "@ref": "gr4",
            "@mimetype": "image/gif"
          },
          {
            "@category": "thumbnail",
            "@height": "164",
            "@width": "131",
            "@_fa": "true",
            "$": "https://api.elsevier.com/content/object/eid/1-s2.0-S0926860X23000194-gr3.sml?httpAccept=%2A%2F%2A",
            "@multimediatype": "GIF image file",
            "@type": "IMAGE-THUMBNAIL",
            "@size": "12316",
            "@ref": "gr3",
            "@mimetype": "image/gif"
          },
          {
            "@category": "thumbnail",
            "@height": "143",
            "@width": "219",
            "@_fa": "true",
            "$": "https://api.elsevier.com/content/object/eid/1-s2.0-S0926860X23000194-gr2.sml?httpAccept=%2A%2F%2A",
            "@multimediatype": "GIF image file",
            "@type": "IMAGE-THUMBNAIL",
            "@size": "11369",
            "@ref": "gr2",
            "@mimetype": "image/gif"
          },
          {
            "@category": "thumbnail",
            "@height": "124",
            "@width": "219",
            "@_fa": "true",
            "$": "https://api.elsevier.com/content/object/eid/1-s2.0-S0926860X23000194-ga1.sml?httpAccept=%2A%2F%2A",
            "@multimediatype": "GIF image file",
            "@type": "IMAGE-THUMBNAIL",
            "@size": "14998",
            "@ref": "ga1",
            "@mimetype": "image/gif"
          },
          {
            "@category": "thumbnail",
            "@height": "164",
            "@width": "124",
            "@_fa": "true",
            "$": "https://api.elsevier.com/content/object/eid/1-s2.0-S0926860X23000194-gr9.sml?httpAccept=%2A%2F%2A",
            "@multimediatype": "GIF image file",
            "@type": "IMAGE-THUMBNAIL",
            "@size": "8290",
            "@ref": "gr9",
            "@mimetype": "image/gif"
          },
          {
            "@category": "thumbnail",
            "@height": "164",
            "@width": "175",
            "@_fa": "true",
            "$": "https://api.elsevier.com/content/object/eid/1-s2.0-S0926860X23000194-gr8.sml?httpAccept=%2A%2F%2A",
            "@multimediatype": "GIF image file",
            "@type": "IMAGE-THUMBNAIL",
            "@size": "14562",
            "@ref": "gr8",
            "@mimetype": "image/gif"
          },
          {
            "@category": "thumbnail",
            "@height": "164",
            "@width": "86",
            "@_fa": "true",
            "$": "https://api.elsevier.com/content/object/eid/1-s2.0-S0926860X23000194-gr7.sml?httpAccept=%2A%2F%2A",
            "@multimediatype": "GIF image file",
            "@type": "IMAGE-THUMBNAIL",
            "@size": "7409",
            "@ref": "gr7",
            "@mimetype": "image/gif"
          },
          {
            "@category": "thumbnail",
            "@height": "158",
            "@width": "219",
            "@_fa": "true",
            "$": "https://api.elsevier.com/content/object/eid/1-s2.0-S0926860X23000194-gr6.sml?httpAccept=%2A%2F%2A",
            "@multimediatype": "GIF image file",
            "@type": "IMAGE-THUMBNAIL",
            "@size": "9531",
            "@ref": "gr6",
            "@mimetype": "image/gif"
          },
          {
            "@category": "high",
            "@height": "2146",
            "@width": "1663",
            "@_fa": "true",
            "$": "https://api.elsevier.com/content/object/eid/1-s2.0-S0926860X23000194-gr1_lrg.jpg?httpAccept=%2A%2F%2A",
            "@multimediatype": "JPEG image file",
            "@type": "IMAGE-HIGH-RES",
            "@size": "345535",
            "@ref": "gr1",
            "@mimetype": "image/jpeg"
          },
          {
            "@category": "high",
            "@height": "2772",
            "@width": "1497",
            "@_fa": "true",
            "$": "https://api.elsevier.com/content/object/eid/1-s2.0-S0926860X23000194-gr5_lrg.jpg?httpAccept=%2A%2F%2A",
            "@multimediatype": "JPEG image file",
            "@type": "IMAGE-HIGH-RES",
            "@size": "404362",
            "@ref": "gr5",
            "@mimetype": "image/jpeg"
          },
          {
            "@category": "high",
            "@height": "2269",
            "@width": "2495",
            "@_fa": "true",
            "$": "https://api.elsevier.com/content/object/eid/1-s2.0-S0926860X23000194-gr4_lrg.jpg?httpAccept=%2A%2F%2A",
            "@multimediatype": "JPEG image file",
            "@type": "IMAGE-HIGH-RES",
            "@size": "404458",
            "@ref": "gr4",
            "@mimetype": "image/jpeg"
          },
          {
            "@category": "high",
            "@height": "3753",
            "@width": "2994",
            "@_fa": "true",
            "$": "https://api.elsevier.com/content/object/eid/1-s2.0-S0926860X23000194-gr3_lrg.jpg?httpAccept=%2A%2F%2A",
            "@multimediatype": "JPEG image file",
            "@type": "IMAGE-HIGH-RES",
            "@size": "1007217",
            "@ref": "gr3",
            "@mimetype": "image/jpeg"
          },
          {
            "@category": "high",
            "@height": "1631",
            "@width": "2495",
            "@_fa": "true",
            "$": "https://api.elsevier.com/content/object/eid/1-s2.0-S0926860X23000194-gr2_lrg.jpg?httpAccept=%2A%2F%2A",
            "@multimediatype": "JPEG image file",
            "@type": "IMAGE-HIGH-RES",
            "@size": "333134",
            "@ref": "gr2",
            "@mimetype": "image/jpeg"
          },
          {
            "@category": "high",
            "@height": "886",
            "@width": "1570",
            "@_fa": "true",
            "$": "https://api.elsevier.com/content/object/eid/1-s2.0-S0926860X23000194-ga1_lrg.jpg?httpAccept=%2A%2F%2A",
            "@multimediatype": "JPEG image file",
            "@type": "IMAGE-HIGH-RES",
            "@size": "209629",
            "@ref": "ga1",
            "@mimetype": "image/jpeg"
          },
          {
            "@category": "high",
            "@height": "2193",
            "@width": "1663",
            "@_fa": "true",
            "$": "https://api.elsevier.com/content/object/eid/1-s2.0-S0926860X23000194-gr9_lrg.jpg?httpAccept=%2A%2F%2A",
            "@multimediatype": "JPEG image file",
            "@type": "IMAGE-HIGH-RES",
            "@size": "365072",
            "@ref": "gr9",
            "@mimetype": "image/jpeg"
          },
          {
            "@category": "high",
            "@height": "2336",
            "@width": "2495",
            "@_fa": "true",
            "$": "https://api.elsevier.com/content/object/eid/1-s2.0-S0926860X23000194-gr8_lrg.jpg?httpAccept=%2A%2F%2A",
            "@multimediatype": "JPEG image file",
            "@type": "IMAGE-HIGH-RES",
            "@size": "293817",
            "@ref": "gr8",
            "@mimetype": "image/jpeg"
          },
          {
            "@category": "high",
            "@height": "2847",
            "@width": "1497",
            "@_fa": "true",
            "$": "https://api.elsevier.com/content/object/eid/1-s2.0-S0926860X23000194-gr7_lrg.jpg?httpAccept=%2A%2F%2A",
            "@multimediatype": "JPEG image file",
            "@type": "IMAGE-HIGH-RES",
            "@size": "411873",
            "@ref": "gr7",
            "@mimetype": "image/jpeg"
          },
          {
            "@category": "high",
            "@height": "1079",
            "@width": "1497",
            "@_fa": "true",
            "$": "https://api.elsevier.com/content/object/eid/1-s2.0-S0926860X23000194-gr6_lrg.jpg?httpAccept=%2A%2F%2A",
            "@multimediatype": "JPEG image file",
            "@type": "IMAGE-HIGH-RES",
            "@size": "115363",
            "@ref": "gr6",
            "@mimetype": "image/jpeg"
          },
          {
            "@category": "standard",
            "@_fa": "true",
            "$": "https://api.elsevier.com/content/object/eid/1-s2.0-S0926860X23000194-mmc1.docx?httpAccept=%2A%2F%2A",
            "@multimediatype": "Microsoft Word file",
            "@type": "APPLICATION",
            "@size": "141709",
            "@ref": "mmc1",
            "@mimetype": "application/word"
          },
          {
            "@category": "thumbnail",
            "@_fa": "true",
            "$": "https://api.elsevier.com/content/object/eid/1-s2.0-S0926860X23000194-si0001.svg?httpAccept=%2A%2F%2A",
            "@multimediatype": "Scalable Vector Graphics file",
            "@type": "ALTIMG",
            "@size": "7116",
            "@ref": "si0001",
            "@mimetype": "image/svg+xml"
          },
          {
            "@category": "thumbnail",
            "@_fa": "true",
            "$": "https://api.elsevier.com/content/object/eid/1-s2.0-S0926860X23000194-si0002.svg?httpAccept=%2A%2F%2A",
            "@multimediatype": "Scalable Vector Graphics file",
            "@type": "ALTIMG",
            "@size": "5016",
            "@ref": "si0002",
            "@mimetype": "image/svg+xml"
          },
          {
            "@category": "thumbnail",
            "@_fa": "true",
            "$": "https://api.elsevier.com/content/object/eid/1-s2.0-S0926860X23000194-si0003.svg?httpAccept=%2A%2F%2A",
            "@multimediatype": "Scalable Vector Graphics file",
            "@type": "ALTIMG",
            "@size": "5786",
            "@ref": "si0003",
            "@mimetype": "image/svg+xml"
          },
          {
            "@category": "standard",
            "@_fa": "true",
            "$": "https://api.elsevier.com/content/object/eid/1-s2.0-S0926860X23000194-am.pdf?httpAccept=%2A%2F%2A",
            "@multimediatype": "Acrobat PDF file",
            "@type": "AAM-PDF",
            "@size": "47165732",
            "@ref": "am",
            "@mimetype": "application/pdf"
          }
        ]
      },
      "link": {
        "@rel": "abstract",
        "@href": "https://api.elsevier.com/content/abstract/scopus_id/85146872339"
      }
    }
  }
}