{
  "metadata": {
    "title": "Bimetallic MNi/Al<ce:inf loc=post>2</ce:inf>O<ce:inf loc=post>3</ce:inf>-La catalysts (M<ce:hsp sp=0.25></ce:hsp>=<ce:hsp sp=0.25></ce:hsp>Pt, Cu) for acetone steam reforming: Role of M on catalyst structure and activity",
    "authors": "; ; ",
    "journal": "Applied Catalysis A: General",
    "date": "2014-03-22",
    "doi": "10.1016/j.apcata.2013.09.056",
    "abstract": "",
    "uri": "https://api.elsevier.com/content/article/pii/S0926860X13006649",
    "pii": "S0926860X13006649"
  },
  "fulltext": {
    "full-text-retrieval-response": {
      "scopus-eid": "2-s2.0-84898901466",
      "originalText": "serial JL 271346 291210 291744 291809 31 Applied Catalysis A: General APPLIEDCATALYSISAGENERAL 2013-11-01 2013-11-01 2014-04-16T00:54:16 1-s2.0-S0926860X13006649 S0926-860X(13)00664-9 S0926860X13006649 10.1016/j.apcata.2013.09.056 S300 S300.2 FULL-TEXT 1-s2.0-S0926860X14X00037 2024-01-01T12:29:14.622205Z 0 0 20140322 2014 2013-11-01T00:00:00Z articleinfo crossmark dco dateupdated tomb dateloaded datesearch indexeddate volumelist yearnav absattachment articletitlenorm authfirstinitialnorm authfirstsurnamenorm cid cids confeditor contenttype copyright dateloadedtxt docsubtype doctype doi eid ewtransactionid hubeid issn issnnorm itemstage itemtransactionid itemweight openaccess openarchive pg pgfirst pglast pii piinorm pubdatestart pubdatetxt pubyr sectiontitle sortorder srctitle srctitlenorm srctype subheadings suppl vol volfirst volissue webpdf webpdfpagecount figure table body mmlmath acknowledge affil articletitle auth authfirstini authfull authkeywords authlast highlightsabst primabst ref specialabst alllist content subj ssids 0926-860X 0926860X true 474 474 C Volume 474 23 168 177 168 177 20140322 22 March 2014 2014-03-22 2014 B. Delmon Honor Special Issue Prof Eric Gaigneaux Prof Patricio Ruiz Articles article fla Copyright © 2013 Elsevier B.V. All rights reserved. BIMETALLICMNIAL2O3LACATALYSTSMPTCUFORACETONESTEAMREFORMINGROLEMCATALYSTSTRUCTUREACTIVITY NAVARRO R 1 Introduction 2 Experimental 2.1 Catalyst preparation 2.2 Catalyst characterization 2.3 Catalytic activity measurements 3 Results 3.1 Characterization of fresh catalysts 3.1.1 Chemical composition and textural properties 3.1.2 Temperature programmed reduction 3.1.3 X-ray diffraction (XRD) 3.1.4 X-ray photoelectron spectroscopy (XPS) 4 Catalytic activity 5 Characterization of used catalysts 5.1 X-ray diffraction 5.2 Thermogravimetric oxidation 6 Discussion 7 Conclusions Acknowledgements References HU 2012 49 X VAGIA 2008 111 121 E VAGIA 2006 212 223 E TAKANABE 2006 1133 1137 K RIOCHE 2005 130 139 C RESINI 2006 13 19 C KECHAGIOPOULOS 2006 2155 2163 P BARATTINI 2009 43 49 L LI 2012 281 289 Z HU 2010 50 53 X MATASGUELL 2009 38 44 B TAKANABE 2004 101 108 K TAKANABE 2006 263 269 K TAKANABE 2008 68 72 K RODRIGUEZ 1996 225 287 J ZHANG 2003 251 259 J ARAI 1999 155 163 M CHOUDHARY 1995 752 754 V REICHLE 1980 295 306 W IRIONDO 2009 1275 1278 A IRIONDO 2008 46 58 A SANCHEZSANCHEZ 2007 336 345 M BETTMAN 1989 447 454 M RYNKOWSKI 1993 73 80 J ICHIKUNI 2000 33 37 N RICHARDSON 1998 57 69 J TU 2006 40 51 C ZHENG 2005 217 226 X HWANG 1996 295 303 C RYNKOWSKI 1995 3481 3492 J SALAGRE 1996 125 132 P 2002 NISTXRAYPHOTOELECTRONSPECTROSCOPYDATABASEVERSION34NATIONALINSTITUTESTANDARDSTECHNOLOGYGAITHERSBURG IVANOVA 2010 57 66 A HUIZINGA 1984 199 211 T DEVRED 2009 154 162 F CHUSUEI 1999 2806 2808 C HUANG 1988 229 234 Y NIKOLOPOULOS 2005 128 136 A HIGASHIO 1996 127 136 Y DAS 2002 283 292 N WANG 1998 267 277 S NATESAKHAWAT 2005 496 508 S TRIMM 1977 155 D HU 1996 145 152 Y ZHANG 1996 744 751 Z ROSTRUPNIELSEN 1984 J CATALYSISSCIENCETECHNOLOGY XIE 2006 1056 1061 Z LEE 2004 1 6 J SIN 2007 300 305 A CUNNINGHAM 1996 763 766 J CUNNINGHAM 1993 743 750 J SANCHEZSANCHEZ 2010 3873 3879 M NAVARROX2014X168 NAVARROX2014X168X177 NAVARROX2014X168XR NAVARROX2014X168X177XR item S0926-860X(13)00664-9 S0926860X13006649 1-s2.0-S0926860X13006649 10.1016/j.apcata.2013.09.056 271346 2024-01-01T12:29:14.622205Z 2014-03-22 1-s2.0-S0926860X13006649-main.pdf https://s3.amazonaws.com/prod-ucs-content-store-us-east/content/pii:S0926860X13006649/MAIN/application/pdf/3e5fe97ee647260c45db3ea40b959f8a/main.pdf https://s3-eu-west-1.amazonaws.com/prod-ucs-content-store-eu-west/content/pii:S0926860X13006649/MAIN/application/pdf/3e5fe97ee647260c45db3ea40b959f8a/main.pdf main.pdf pdf true 1132386 MAIN 10 1-s2.0-S0926860X13006649-main_1.png https://s3-eu-west-1.amazonaws.com/prod-ucs-content-store-eu-west/content/pii:S0926860X13006649/PREVIEW/image/png/730a416fe7bcc500d24b09ac2cbfd10a/main_1.png https://s3.amazonaws.com/prod-ucs-content-store-us-east/content/pii:S0926860X13006649/PREVIEW/image/png/730a416fe7bcc500d24b09ac2cbfd10a/main_1.png main_1.png png 56958 849 656 IMAGE-WEB-PDF 1 1-s2.0-S0926860X13006649-si5.gif https://s3.amazonaws.com/prod-ucs-content-store-us-east/content/pii:S0926860X13006649/STRIPIN/image/gif/7ce5730c30323cf959b42c5ef1b4de62/si5.gif https://s3-eu-west-1.amazonaws.com/prod-ucs-content-store-eu-west/content/pii:S0926860X13006649/STRIPIN/image/gif/7ce5730c30323cf959b42c5ef1b4de62/si5.gif si5 si5.gif gif 2002 65 321 ALTIMG 1-s2.0-S0926860X13006649-si4.gif https://s3.amazonaws.com/prod-ucs-content-store-us-east/content/pii:S0926860X13006649/STRIPIN/image/gif/4862dbe51d087e5ed61f7a0e07c1cb25/si4.gif https://s3-eu-west-1.amazonaws.com/prod-ucs-content-store-eu-west/content/pii:S0926860X13006649/STRIPIN/image/gif/4862dbe51d087e5ed61f7a0e07c1cb25/si4.gif si4 si4.gif gif 2049 40 442 ALTIMG 1-s2.0-S0926860X13006649-si3.gif https://s3.amazonaws.com/prod-ucs-content-store-us-east/content/pii:S0926860X13006649/STRIPIN/image/gif/0ae894da1c163e18d8aa5cc524f1384b/si3.gif https://s3-eu-west-1.amazonaws.com/prod-ucs-content-store-eu-west/content/pii:S0926860X13006649/STRIPIN/image/gif/0ae894da1c163e18d8aa5cc524f1384b/si3.gif si3 si3.gif gif 1854 36 379 ALTIMG 1-s2.0-S0926860X13006649-si2.gif https://s3.amazonaws.com/prod-ucs-content-store-us-east/content/pii:S0926860X13006649/STRIPIN/image/gif/aaa18a703635ea71dae3bf5c1726def1/si2.gif https://s3-eu-west-1.amazonaws.com/prod-ucs-content-store-eu-west/content/pii:S0926860X13006649/STRIPIN/image/gif/aaa18a703635ea71dae3bf5c1726def1/si2.gif si2 si2.gif gif 235 16 43 ALTIMG 1-s2.0-S0926860X13006649-si1.gif https://s3.amazonaws.com/prod-ucs-content-store-us-east/content/pii:S0926860X13006649/STRIPIN/image/gif/a62685021cb7b5f3291bc938777f9490/si1.gif https://s3-eu-west-1.amazonaws.com/prod-ucs-content-store-eu-west/content/pii:S0926860X13006649/STRIPIN/image/gif/a62685021cb7b5f3291bc938777f9490/si1.gif si1 si1.gif gif 497 20 104 ALTIMG 1-s2.0-S0926860X13006649-gr8_lrg.jpg https://s3.amazonaws.com/prod-ucs-content-store-us-east/content/pii:S0926860X13006649/gr8/HIGHRES/image/jpeg/4091878543c8d294ea389b9c807685a7/gr8_lrg.jpg https://s3-eu-west-1.amazonaws.com/prod-ucs-content-store-eu-west/content/pii:S0926860X13006649/gr8/HIGHRES/image/jpeg/4091878543c8d294ea389b9c807685a7/gr8_lrg.jpg gr8 gr8_lrg.jpg jpg 162585 1838 1252 IMAGE-HIGH-RES 1-s2.0-S0926860X13006649-gr7_lrg.jpg https://s3.amazonaws.com/prod-ucs-content-store-us-east/content/pii:S0926860X13006649/gr7/HIGHRES/image/jpeg/215f9a658cbcb5735618f199ad0b259c/gr7_lrg.jpg https://s3-eu-west-1.amazonaws.com/prod-ucs-content-store-eu-west/content/pii:S0926860X13006649/gr7/HIGHRES/image/jpeg/215f9a658cbcb5735618f199ad0b259c/gr7_lrg.jpg gr7 gr7_lrg.jpg jpg 167983 1207 1508 IMAGE-HIGH-RES 1-s2.0-S0926860X13006649-gr6_lrg.jpg https://s3.amazonaws.com/prod-ucs-content-store-us-east/content/pii:S0926860X13006649/gr6/HIGHRES/image/jpeg/c042557dd0275d59543341cc44a03b12/gr6_lrg.jpg https://s3-eu-west-1.amazonaws.com/prod-ucs-content-store-eu-west/content/pii:S0926860X13006649/gr6/HIGHRES/image/jpeg/c042557dd0275d59543341cc44a03b12/gr6_lrg.jpg gr6 gr6_lrg.jpg jpg 196101 2592 1544 IMAGE-HIGH-RES 1-s2.0-S0926860X13006649-gr5_lrg.jpg https://s3.amazonaws.com/prod-ucs-content-store-us-east/content/pii:S0926860X13006649/gr5/HIGHRES/image/jpeg/d5f77bd2840a666d8d180baa5e967ea0/gr5_lrg.jpg https://s3-eu-west-1.amazonaws.com/prod-ucs-content-store-eu-west/content/pii:S0926860X13006649/gr5/HIGHRES/image/jpeg/d5f77bd2840a666d8d180baa5e967ea0/gr5_lrg.jpg gr5 gr5_lrg.jpg jpg 95732 1693 1250 IMAGE-HIGH-RES 1-s2.0-S0926860X13006649-gr4_lrg.jpg https://s3.amazonaws.com/prod-ucs-content-store-us-east/content/pii:S0926860X13006649/gr4/HIGHRES/image/jpeg/82662a7283b0c8e2c4518ce0e901e31b/gr4_lrg.jpg https://s3-eu-west-1.amazonaws.com/prod-ucs-content-store-eu-west/content/pii:S0926860X13006649/gr4/HIGHRES/image/jpeg/82662a7283b0c8e2c4518ce0e901e31b/gr4_lrg.jpg gr4 gr4_lrg.jpg jpg 500383 2554 1419 IMAGE-HIGH-RES 1-s2.0-S0926860X13006649-gr3_lrg.jpg https://s3.amazonaws.com/prod-ucs-content-store-us-east/content/pii:S0926860X13006649/gr3/HIGHRES/image/jpeg/1cf7226b37201c4222a647fc0297d47b/gr3_lrg.jpg https://s3-eu-west-1.amazonaws.com/prod-ucs-content-store-eu-west/content/pii:S0926860X13006649/gr3/HIGHRES/image/jpeg/1cf7226b37201c4222a647fc0297d47b/gr3_lrg.jpg gr3 gr3_lrg.jpg jpg 192106 1344 1583 IMAGE-HIGH-RES 1-s2.0-S0926860X13006649-gr2_lrg.jpg https://s3.amazonaws.com/prod-ucs-content-store-us-east/content/pii:S0926860X13006649/gr2/HIGHRES/image/jpeg/c80f0a342dca9b9ae1a70c1eaac993f4/gr2_lrg.jpg https://s3-eu-west-1.amazonaws.com/prod-ucs-content-store-eu-west/content/pii:S0926860X13006649/gr2/HIGHRES/image/jpeg/c80f0a342dca9b9ae1a70c1eaac993f4/gr2_lrg.jpg gr2 gr2_lrg.jpg jpg 242232 1748 1735 IMAGE-HIGH-RES 1-s2.0-S0926860X13006649-gr1_lrg.jpg https://s3.amazonaws.com/prod-ucs-content-store-us-east/content/pii:S0926860X13006649/gr1/HIGHRES/image/jpeg/8f7a874fee10dc2d8cc8ccb6b7ddee68/gr1_lrg.jpg https://s3-eu-west-1.amazonaws.com/prod-ucs-content-store-eu-west/content/pii:S0926860X13006649/gr1/HIGHRES/image/jpeg/8f7a874fee10dc2d8cc8ccb6b7ddee68/gr1_lrg.jpg gr1 gr1_lrg.jpg jpg 190434 1881 1257 IMAGE-HIGH-RES 1-s2.0-S0926860X13006649-fx1_lrg.jpg https://s3.amazonaws.com/prod-ucs-content-store-us-east/content/pii:S0926860X13006649/fx1/HIGHRES/image/jpeg/7761a46b36436fdd37341870f920ea41/fx1_lrg.jpg https://s3-eu-west-1.amazonaws.com/prod-ucs-content-store-eu-west/content/pii:S0926860X13006649/fx1/HIGHRES/image/jpeg/7761a46b36436fdd37341870f920ea41/fx1_lrg.jpg fx1 true fx1_lrg.jpg jpg 115355 854 2213 IMAGE-HIGH-RES 1-s2.0-S0926860X13006649-gr8.jpg https://s3.amazonaws.com/prod-ucs-content-store-us-east/content/pii:S0926860X13006649/gr8/DOWNSAMPLED/image/jpeg/9e97cb6fd86ea969302f44f0bfeaee0b/gr8.jpg https://s3-eu-west-1.amazonaws.com/prod-ucs-content-store-eu-west/content/pii:S0926860X13006649/gr8/DOWNSAMPLED/image/jpeg/9e97cb6fd86ea969302f44f0bfeaee0b/gr8.jpg gr8 gr8.jpg jpg 19592 414 282 IMAGE-DOWNSAMPLED 1-s2.0-S0926860X13006649-gr7.jpg https://s3.amazonaws.com/prod-ucs-content-store-us-east/content/pii:S0926860X13006649/gr7/DOWNSAMPLED/image/jpeg/acaa8ecd07263895b212ebb38b9a9a8c/gr7.jpg https://s3-eu-west-1.amazonaws.com/prod-ucs-content-store-eu-west/content/pii:S0926860X13006649/gr7/DOWNSAMPLED/image/jpeg/acaa8ecd07263895b212ebb38b9a9a8c/gr7.jpg gr7 gr7.jpg jpg 19684 272 340 IMAGE-DOWNSAMPLED 1-s2.0-S0926860X13006649-gr6.jpg https://s3.amazonaws.com/prod-ucs-content-store-us-east/content/pii:S0926860X13006649/gr6/DOWNSAMPLED/image/jpeg/e75876cc25d08dc789e8e0819e8327be/gr6.jpg https://s3-eu-west-1.amazonaws.com/prod-ucs-content-store-eu-west/content/pii:S0926860X13006649/gr6/DOWNSAMPLED/image/jpeg/e75876cc25d08dc789e8e0819e8327be/gr6.jpg gr6 gr6.jpg jpg 28990 584 348 IMAGE-DOWNSAMPLED 1-s2.0-S0926860X13006649-gr5.jpg https://s3.amazonaws.com/prod-ucs-content-store-us-east/content/pii:S0926860X13006649/gr5/DOWNSAMPLED/image/jpeg/c3433157a9dd674f6e1a3148e3b92ad3/gr5.jpg https://s3-eu-west-1.amazonaws.com/prod-ucs-content-store-eu-west/content/pii:S0926860X13006649/gr5/DOWNSAMPLED/image/jpeg/c3433157a9dd674f6e1a3148e3b92ad3/gr5.jpg gr5 gr5.jpg jpg 13361 382 282 IMAGE-DOWNSAMPLED 1-s2.0-S0926860X13006649-gr4.jpg https://s3.amazonaws.com/prod-ucs-content-store-us-east/content/pii:S0926860X13006649/gr4/DOWNSAMPLED/image/jpeg/2e1901e40d03ec2d3b6f3e0dc2d53d8e/gr4.jpg https://s3-eu-west-1.amazonaws.com/prod-ucs-content-store-eu-west/content/pii:S0926860X13006649/gr4/DOWNSAMPLED/image/jpeg/2e1901e40d03ec2d3b6f3e0dc2d53d8e/gr4.jpg gr4 gr4.jpg jpg 48967 576 320 IMAGE-DOWNSAMPLED 1-s2.0-S0926860X13006649-gr3.jpg https://s3.amazonaws.com/prod-ucs-content-store-us-east/content/pii:S0926860X13006649/gr3/DOWNSAMPLED/image/jpeg/ce5fc585f3c3c47d5c90080085708490/gr3.jpg https://s3-eu-west-1.amazonaws.com/prod-ucs-content-store-eu-west/content/pii:S0926860X13006649/gr3/DOWNSAMPLED/image/jpeg/ce5fc585f3c3c47d5c90080085708490/gr3.jpg gr3 gr3.jpg jpg 22564 303 357 IMAGE-DOWNSAMPLED 1-s2.0-S0926860X13006649-gr2.jpg https://s3.amazonaws.com/prod-ucs-content-store-us-east/content/pii:S0926860X13006649/gr2/DOWNSAMPLED/image/jpeg/385313485385dcb14dfed2fed65114f5/gr2.jpg https://s3-eu-west-1.amazonaws.com/prod-ucs-content-store-eu-west/content/pii:S0926860X13006649/gr2/DOWNSAMPLED/image/jpeg/385313485385dcb14dfed2fed65114f5/gr2.jpg gr2 gr2.jpg jpg 28417 395 392 IMAGE-DOWNSAMPLED 1-s2.0-S0926860X13006649-gr1.jpg https://s3.amazonaws.com/prod-ucs-content-store-us-east/content/pii:S0926860X13006649/gr1/DOWNSAMPLED/image/jpeg/9ac5901a6270ebc624cf00f2ce9d3985/gr1.jpg https://s3-eu-west-1.amazonaws.com/prod-ucs-content-store-eu-west/content/pii:S0926860X13006649/gr1/DOWNSAMPLED/image/jpeg/9ac5901a6270ebc624cf00f2ce9d3985/gr1.jpg gr1 gr1.jpg jpg 23822 425 284 IMAGE-DOWNSAMPLED 1-s2.0-S0926860X13006649-fx1.jpg https://s3.amazonaws.com/prod-ucs-content-store-us-east/content/pii:S0926860X13006649/fx1/DOWNSAMPLED/image/jpeg/100867b0f50b4ad8b519d17f9f6af8aa/fx1.jpg https://s3-eu-west-1.amazonaws.com/prod-ucs-content-store-eu-west/content/pii:S0926860X13006649/fx1/DOWNSAMPLED/image/jpeg/100867b0f50b4ad8b519d17f9f6af8aa/fx1.jpg fx1 true fx1.jpg jpg 16186 193 500 IMAGE-DOWNSAMPLED 1-s2.0-S0926860X13006649-gr8.sml https://s3.amazonaws.com/prod-ucs-content-store-us-east/content/pii:S0926860X13006649/gr8/THUMBNAIL/image/gif/fbda551f426d3e35295df949d9b8d801/gr8.sml https://s3-eu-west-1.amazonaws.com/prod-ucs-content-store-eu-west/content/pii:S0926860X13006649/gr8/THUMBNAIL/image/gif/fbda551f426d3e35295df949d9b8d801/gr8.sml gr8 gr8.sml sml 3244 163 111 IMAGE-THUMBNAIL 1-s2.0-S0926860X13006649-gr7.sml https://s3.amazonaws.com/prod-ucs-content-store-us-east/content/pii:S0926860X13006649/gr7/THUMBNAIL/image/gif/77a59df0475e421db93de1d34a71814e/gr7.sml https://s3-eu-west-1.amazonaws.com/prod-ucs-content-store-eu-west/content/pii:S0926860X13006649/gr7/THUMBNAIL/image/gif/77a59df0475e421db93de1d34a71814e/gr7.sml gr7 gr7.sml sml 4793 164 205 IMAGE-THUMBNAIL 1-s2.0-S0926860X13006649-gr6.sml https://s3.amazonaws.com/prod-ucs-content-store-us-east/content/pii:S0926860X13006649/gr6/THUMBNAIL/image/gif/158789809b32df32227a648fe4a0c21c/gr6.sml https://s3-eu-west-1.amazonaws.com/prod-ucs-content-store-eu-west/content/pii:S0926860X13006649/gr6/THUMBNAIL/image/gif/158789809b32df32227a648fe4a0c21c/gr6.sml gr6 gr6.sml sml 2513 163 97 IMAGE-THUMBNAIL 1-s2.0-S0926860X13006649-gr5.sml https://s3.amazonaws.com/prod-ucs-content-store-us-east/content/pii:S0926860X13006649/gr5/THUMBNAIL/image/gif/64a8217db58cd06cd42e6edeca98938f/gr5.sml https://s3-eu-west-1.amazonaws.com/prod-ucs-content-store-eu-west/content/pii:S0926860X13006649/gr5/THUMBNAIL/image/gif/64a8217db58cd06cd42e6edeca98938f/gr5.sml gr5 gr5.sml sml 3977 164 121 IMAGE-THUMBNAIL 1-s2.0-S0926860X13006649-gr4.sml https://s3.amazonaws.com/prod-ucs-content-store-us-east/content/pii:S0926860X13006649/gr4/THUMBNAIL/image/gif/323a7d64cfb12322e94ce45197a8c28d/gr4.sml https://s3-eu-west-1.amazonaws.com/prod-ucs-content-store-eu-west/content/pii:S0926860X13006649/gr4/THUMBNAIL/image/gif/323a7d64cfb12322e94ce45197a8c28d/gr4.sml gr4 gr4.sml sml 4464 164 91 IMAGE-THUMBNAIL 1-s2.0-S0926860X13006649-gr3.sml https://s3.amazonaws.com/prod-ucs-content-store-us-east/content/pii:S0926860X13006649/gr3/THUMBNAIL/image/gif/cceb56073c71867fbb628f91b09f97cb/gr3.sml https://s3-eu-west-1.amazonaws.com/prod-ucs-content-store-eu-west/content/pii:S0926860X13006649/gr3/THUMBNAIL/image/gif/cceb56073c71867fbb628f91b09f97cb/gr3.sml gr3 gr3.sml sml 4726 164 193 IMAGE-THUMBNAIL 1-s2.0-S0926860X13006649-gr2.sml https://s3.amazonaws.com/prod-ucs-content-store-us-east/content/pii:S0926860X13006649/gr2/THUMBNAIL/image/gif/cec1b68a076ab06588c464eab31dda11/gr2.sml https://s3-eu-west-1.amazonaws.com/prod-ucs-content-store-eu-west/content/pii:S0926860X13006649/gr2/THUMBNAIL/image/gif/cec1b68a076ab06588c464eab31dda11/gr2.sml gr2 gr2.sml sml 4368 164 163 IMAGE-THUMBNAIL 1-s2.0-S0926860X13006649-gr1.sml https://s3.amazonaws.com/prod-ucs-content-store-us-east/content/pii:S0926860X13006649/gr1/THUMBNAIL/image/gif/d817172f1ff2e1b9935464edf0821a49/gr1.sml https://s3-eu-west-1.amazonaws.com/prod-ucs-content-store-eu-west/content/pii:S0926860X13006649/gr1/THUMBNAIL/image/gif/d817172f1ff2e1b9935464edf0821a49/gr1.sml gr1 gr1.sml sml 3604 163 109 IMAGE-THUMBNAIL 1-s2.0-S0926860X13006649-fx1.sml https://s3.amazonaws.com/prod-ucs-content-store-us-east/content/pii:S0926860X13006649/fx1/THUMBNAIL/image/gif/0780bff07915feac5436e9bd219afaee/fx1.sml https://s3-eu-west-1.amazonaws.com/prod-ucs-content-store-eu-west/content/pii:S0926860X13006649/fx1/THUMBNAIL/image/gif/0780bff07915feac5436e9bd219afaee/fx1.sml fx1 true fx1.sml sml 2987 85 219 IMAGE-THUMBNAIL APCATA 14540 S0926-860X(13)00664-9 10.1016/j.apcata.2013.09.056 Elsevier B.V. Fig. 1 Temperature-programmed reduction profiles of bimetallic MNi/A-La (M=Cu or Pt) and Ni/A-La (reference) (10vol% H2/Ar, heating rate 10K/min). Fig. 2 XRD patterns of bimetallic MNi/A-La (M=Cu or Pt) and Ni/A-La (reference) in calcined state. (o, γ-Al2O3; +, θ-Al2O3; ^, NiO). Fig. 3 XRD patterns of bimetallic MNi/A-La (M=Cu or Pt) and Ni/A-La (reference) after reduction. (o, γ-Al2O3; +, θ-Al2O3, ×, Ni0). Fig. 4 La3d–Ni2p binding energy region of NiM/A-La and Ni/A-La calcined catalysts. Fig. 5 Gasification of acetone (to H2, CO2, CO and CH4) in the acetone steam reforming (873K, H2O/CH3COCH3 =6.0, GHSV=10,180h−1). Fig. 6 Selectivity to gas products in acetone steam reforming (873K, H2O/CH3COCH3 =6.0, GHSV=10,180h−1) over catalysts: (A) Ni/A-La, (B) PtNi/A-La and (C) CuNi/A-La. Selectivity to products (●) H2, (■) CO2, (▴) CH4 and (▾) CO. Fig. 7 X-ray diffraction patterns of used catalysts in acetone steam reforming (o, γ-Al2O3; +, θ-Al2O3; ×, Ni0; *, graphite; ♦, Cu0). Fig. 8 TG-TPO profiles of used catalysts in acetone steam reforming. Table 1 Chemical composition (TXRF) and textural properties (N2 adsorption–desorption isotherms at 77K) of calcined supports and catalysts. Ni (at%) M (Pt or Cu) (at%) La (at%) S BET (m2/g Al2O3) V pore (cm3/g Al2O3) D pore (nm) A – – – 160 0.845 20 A-La – – 5.9 147 0.757 21 Ni/A-La 9.2 – 4.2 157 0.694 18 CuNi/A-La 9.2 1.0 4.5 166 0.554 14 PtNi/A-La 9.0 0.2 4.4 166 0.476 12 Table 2 Average crystallite size of the crystalline phases detected on calcined, fresh reduced and used catalysts from XRD. Calcined Reduced Used NiO (nm) MO x (M=Pt,Cu) (nm) Ni0 (nm) M0 (M=Cu, Pt) (nm) Ni0 (nm) M0 (M=Cu, Pt) (nm) Ni/A-La 8.8 – 9.3 – 15 – CuNi/A-La 9.9 n.d. 10 n.d. 18 6 PtNi/A-La 9.3 n.d. 9.3 n.d. 11 n.d. Table 3 Binding energies (eV) of core-levels and surface atomic percentages derived from XPS measurements of calcined catalysts. Al 2p La 3d5/2 Ni 2p3/2 M a Al (at%) (from nom. comp.) La (at%) (from nom. comp.) Ni (at%) (from nom. comp.) M (at%) (from nom. comp.) A-La 74.5 835.8 – – 90.4 (93.9) 9.6 (6.1) – – Ni/A-La 74.5 835.8 856.0 – 72.1 (85.0) 15.9 (5.4) 11.9 (9.6) – PtNi/A-La 74.5 835.6 856.1 315.4 (38)318.0 (62) 73.0 (84.5) 7.1 (5.5) 19.6 (9.6) 0.3 (0.3) CuNi/A-La 74.5 835.5 855.9 934.7 75.0 (84.0) 7.3 (5.5) 13.7 (9.6) 3.9 (0.9) a Pt 4d5/2 or Cu 2p3/2. Table 4 Binding energies (eV) of core-levels and surface atomic ratios from XPS analysis of H2-reduced catalysts. Al 2p La 3d5/2 Ni 2p3/2 M a Al (at%) (from nom. comp.) La (at%) (from nom. comp.) Ni/Ni0 (at%) (from nom. comp.) M (at%) (from nom. comp.) Ni/A-La 74.5 835.3 852.8 (41)856.0 (59) – 83.5 (85.0) 9.6 (5.4) 6.9/2.8 (9.6) – CuNi/A-La 74.5 835.3 852.7 (47)855.9 (53) 932.0 86.2 (84.0) 6.2 (5.5) 5.5/2.6 (9.6) 2.0 (0.9) PtNi/A-La 74.5 835.3 852.8 (61)855.7 (39) 314.8 83.1 (84.5) 9.4 (5.5) 7.4/4.5 (9.6) 0.12 (0.3) a Pt 4d5/2 or Cu 2p3/2. Table 5 Acetone conversion and gasification percentage (to H2, CO, CO2 and CH4) in acetone steam reforming after 10h on-stream (873K, H2O/CH3COCH3 =6.0, GHSV=10,180h−1). Acetone conv. (%) Gasification (%) Ni/A-La 100 94.1 PtNi/A-La 100 99.8 CuNi-/A-La 100 56.5 Table 6 Carbon deposits on used catalysts after 24h in acetone steam reforming quantified by TG-TPO analysis. mol coke formed/mol C fed (%) Ni/A-La 1.3 PtNi/A-La 0.6 CuNi/A-La 1.1 Bimetallic MNi/Al2O3-La catalysts (M=Pt, Cu) for acetone steam reforming: Role of M on catalyst structure and activity R.M. Navarro a ⁎ R. Guil-Lopez a J.M. Gonzalez-Carballo a A. Cubero a A.A. Ismail b c S.A. Al-Sayari b J.L.G. Fierro a ⁎ a Grupo de Energía y Química Sostenibles, ICP-CSIC, C/ Marie Curie 2, Cantoblanco, 28049 Madrid, Spain Grupo de Energía y Química Sostenibles, ICP-CSIC C/ Marie Curie 2, Cantoblanco Madrid 28049 Spain b Advanced Materials and Nano Research Centre, Najran University, Najran 11001, Saudi Arabia Advanced Materials and Nano Research Centre, Najran University Najran 11001 Saudi Arabia c Advanced Materials Department, Central Metallurgical R&D Institute, CMRDI, Helwan 11421, Egypt Advanced Materials Department, Central Metallurgical R&D Institute, CMRDI Helwan 11421 Egypt ⁎ Corresponding authors. Graphical abstract The effect of Pt and Cu addition on the behaviour of Ni catalysts supported on Al2O3 modified with La for acetone steam reforming (as model molecule of bio-oil) was studied. Catalytic activity was found to depend strongly on the bimetallic formulation, achieving the bimetallic PtNi catalyst almost complete gasification of the acetone. The characterization results achieved with XRD, TPR and XPS showed differences in surface metal concentrations which depend on the presence of Pt or Cu in catalysts composition. The decrease in activity observed for the bimetallic CuNi catalyst is associated with changes in the acetone reaction mechanism due to the presence of metallic copper since formation of CuNi alloy was not formed in this catalyst. In the case of bimetallic PtNi catalyst, a lower carbon deposition and a higher thermal stability of the Ni crystallites under reaction conditions was observed with respect to monometallic Ni reference catalyst. It is suggested that the better dispersion of metallic nickel crystallites together with the enhanced H-atom mobility on Pt are responsible of the better catalytic behaviour of the bimetallic PtNi formulation in the steam reforming of acetone. Keywords Nickel catalysts Platinum Copper Alumina Lanthanum Hydrogen production Bio-oil Acetone Steam reforming 1 Introduction There is an increasing interest in the development of technologies for the conversion of biomass derived hydrocarbons in hydrogen rich gas mixtures as a way to overcome the current technical limitations in hydrogen supply and storage. Recent developments in flash pyrolysis technologies make it possible to convert lignocellulosic biomass efficiently to a bio-oil (a mixture of aliphatic and aromatic oxygenates: aldehydes, ketones, acids, esters, alcohols, sugars, furans, etc.) which is easier for handling and transport [1]. Steam reforming of aqueous bio-oil fractions is therefore an interesting alternative to produce hydrogen in a renewable way. The direct steam reforming of bio-oil generates high amount of undesirable by-products and high coke/oligomer deposition on catalyst, which quickly deactivates it. Therefore, the successful extraction of hydrogen from bio-oils mainly depends on the development of new catalysts with high thermal stability and improved resistance towards coke formation. Given the influence of the nature of both the metal and support on the catalytic characteristics of supported metals and to fulfil the above requirements, a careful choice of these elements is essential to develop supported catalysts. Due to complexity of steam reforming of bio-oils, reforming of model oxygenate components has been studied in last decades, focusing on acetic acid, acetone or ethylene glycol as the most representative compounds [2–6] in order to establish more clearly the structure-activity correlations on reforming catalysts. Most of the studies reported in literature have been focused on the reforming of acetic acid, whereas acetone steam reforming (Eq. (1)) has been less studied in spite that this compound could be the model of the carbonyl-containing compounds present in bio-oils (ketones and aldehydes). (1) CH3COCH3 +5H2O→3CO2 +8H2 According to the literature, different catalysts have been used in steam reforming of oxygenated compounds: Ni/CaO–Al2O3 [2], Ni/Al2O3 [7] Ni–Zn–Al [8], Ni/ZrO2 [9], Co–Ce/Al2O3 and Co–La/Al2O3 [10], Pt/CeO2 and Pt/ZrO2 [11–14]. Platinum-based catalysts have been the most used systems, however their high cost limit their practical application. Apart of Pt based catalysts, the high CC bond-breaking activity and the relatively low cost of Ni make it a suitable active phase for oxygenates reforming reactions. However coke formation is an important problem in bio-oil reforming on Ni based catalysts. The platinum group metals have been reported to be more effective catalysts by preventing coke deposition since Pt crystallites do not dissolve carbon. Several authors have reported that the addition of small amounts of noble or semi-noble metals to Ni catalysts improve their catalytic performance decreasing the coke formation on the Ni surfaces [15–18]. The high hydrogenation activity of Pt or Cu could also help the formation of molecular H2 from atomic H, improving the activity of nickel catalyst in the reforming of bio-oil. The nature of support also influences the catalytic performance of supported metal catalyst for the steam reforming of oxygenated compounds since it affects both the dispersion and stability of the metal as well as it may participate in the reaction. Among oxide supports, alumina-based supports are often used as a substrate for the reforming catalysts because of their mechanical and chemical resistance under reaction conditions. However, the acid sites of alumina could participate in undesirable reactions during the acetone reforming such as aldol condensation [19] and oligomerization [12] that could form deposits on the catalyst surface. Thus, additives or promoters are often used in reforming catalyst formulations. For this purpose, rare earth elements are extensively used as promoters in the catalysts used in the reforming of oxygenated compounds. In particular, it is described the beneficial effect of lanthanum oxide in the stability of catalysts for steam reforming due to its known capability to remove carbon formation from metallic surfaces [20–22]. Additionally, lanthanum has been reported to prevent the thermal sintering of bare alumina [23]. With this background, in this contribution we study the effect of Pt and Cu addition on the behaviour of Ni catalysts supported on Al2O3 modified with lanthanum for acetone reforming (as model molecule of bio-oil). Careful investigation of the structure of catalysts were done in an attempt to establish a relationship between activity and the changes in structural and surface characteristics induced by Pt or Cu addition to Ni catalysts. 2 Experimental 2.1 Catalyst preparation Lanthanum modified-Al2O3 support (15wt% La2O3) was prepared by impregnation of a commercial γ-Al2O3 (Alfa Aesar, S BET 235m2/g) with 0.09M aqueous solution of La(NO3)3·xH2O (Aldrich 99.9%) using 10mL/gsupport as impregnation ratio. Previous to lanthanum impregnation, the Al2O3 support was previously stabilized by treating in static air in an oven at 1073K for 12h (A). The La-impregnated support (A-La) was dried under static air at 393K for 3h and subsequently calcined at 1073K for 8h. Monometallic Ni reference catalyst (Ni/A-La, 12wt% NiO) was prepared by impregnation of the lanthanum modified-Al2O3 support, with 0.16M aqueous solutions of Ni(NO3)2 using 10mL/gsupport as impregnation ratio. The sample was impregnated for 5h, subsequently dried at 393K for 2h, and finally calcined in air at 773K for 4h. MNi bimetallic catalysts (MNi/A-La, M=Pt or Cu, 1wt%) were prepared by wet impregnation of the calcined Ni/A-La catalyst with aqueous solutions of the corresponding metal precursors (0.005M of Pt(NH3)4(NO3)2 or 0.015 MCu(NO3)2), using 10mL/gNicatalyst as impregnation ratio during 2h. After drying at 383K for 14h, the impregnated bimetallic samples were calcined under air at 773K for 4h. 2.2 Catalyst characterization The chemical composition of the catalysts was determined by inductively coupled plasma atomic emission spectroscopy (ICP-AES), using a Perkin-Elmer Optima 3300DV apparatus. The samples were first dissolved in acid solutions (a mixture of HF, HCl and HNO3), microwaved for 15min, and diluted to concentrations within the detection range of the instrument. N2 adsorption–desorption isotherms were obtained at 77K over the whole range of relative pressures, using a Micromeritics ASAP 2100 automatic device on samples previously degassed at 423K for 12h. BET specific areas were calculated from these isotherms using the BET method and taking a value of 0.162nm2 for the cross-section of the physically adsorbed N2 molecule. The pore size distribution was calculated by applying the Barrer–Joyner–Halenda method (BJH) to the adsorption branch of the N2 isotherm. The total pore volume was calculated from the adsorption isotherms at P/P 0 =0.98. Temperature-programmed reduction experiments were carried out on a semiautomatic Micromeritics TPD/TPR 2900 apparatus equipped with a TC detector. Prior to reduction experiments, the samples (about 30mg) were treated thermally under an air stream at 573K to remove water and other adsorbed contaminants. TPR profiles were obtained by heating the samples under a 10% H2/Ar flow (50mL/min) from 233 to 1173K at a linearly programmed rate of 10K/min. The effluent gas was passed through a cold trap to remove water before measuring the amount of hydrogen consumed during reduction by the TC detector. The TCD signals were normalized by the measured weight of each sample. X-ray powder diffraction patterns were recorded following the step-scanning procedure (step size 0.02°, 2θ scanning from 5° to 90°) using a computerized Seifert XRD 3000P diffractometer (Cu Kα radiation, λ =0.15418nm). A rate of 500s per step was used during a continuous scan in the above mentioned range. Volume-averaged crystallite sizes were determined by applying the Debye–Scherrer equation from the line broadening (β r) of the characteristic (200) NiO peak at 2θ =43.3° and the (200) Ni-metal peak at 2θ =53.8° after subtracting the instrument effect ( β r = β 0 2 − β i 2 ); β 0 =total line broadening, β i =instrumental broadening=0.058rad). X-ray photoelectron spectroscopy (XPS) was used to study the chemical composition and oxidation state of the catalyst surfaces. Photoelectron spectra were recorded with a VG Escalab 200R electron spectrometer equipped with a Mg Kα X-ray source (hν =1253.6eV) and a hemispherical electron analyser operating at constant transmission energy (50eV). The areas of the peaks were estimated by calculating the integral of each peak after subtracting a Shirley background and fitting the experimental peak to a combination of Lorentzian/Gaussian lines of variable proportions. The reduction treatment was carried out ex situ at 823K in H2/N2 (1/9vol) flow for 90min followed by re-reduction in situ at 773K for 30min. The C 1s, Al 2p, Pt 4d, Ce 3d and Ni 2p core-level spectra were recorded. Differential charging was observed in all samples. This charging effect was corrected by referencing the binding energies (accuracy±0.1eV) to the C 1s signal arising from carbon contamination at 284.8eV. Temperature programmed oxidation analyses of spent catalysts were carried out using a thermo-gravimetric analyser (Mettler Toledo TGA/SDTA 851e) to determine the amount of coke deposited on catalysts. The standard protocol involved the weight change of the sample (20mg) during its heating in 200mL/min of N2 as purge gas and 50mL/min of O2 as reactive gas from 298 to 1123K at a heating rate of 10K/min. 2.3 Catalytic activity measurements The samples in reduced form were tested in the steam reforming of acetone (Eq. (1)) under a GHSV=10,180h−1 at atmospheric pressure with H2O/CH3COCH3 =6.0 and N2 =41vol%. Activity tests were performed using 0.5cm3 of catalyst diluted with SiC (both in the 0.4–0.5mm particle size range) at a volume ratio of 3:1 to avoid adverse thermal effects. The catalyst bed was supported over a frit quartz plate fixed to the reactor walls. Reaction conditions for catalysts testing were selected in order to achieve high acetone conversion level to know the evolution of the catalyst towards carbon deposits, that is the main phenomenon responsible for catalysts deactivation in this reaction, in a short period of time (24h). The catalyst bed was placed in a 6mm ID quartz tubular reactor with a coaxially centred thermocouple. Prior to reaction, the catalysts were flushed in nitrogen at 473K, followed by reduction in situ at 873K for 2h (heating rate 5K/min) with 50mL(STP)/min of a 10vol% H2/N2 mixture. The pre-treating gases were flushed from the reactor with N2 before admission of the acetone/water/N2 reaction mixture. Acetone–water mixture was fed into the pre-heater by means of syringe pump (Becton-Dickinson) before mixing with a N2 stream controlled with Brooks model 5850E mass flow controller. Activity was measured at 873K maintaining the reaction for 12h in order to check if there was any deactivation of the catalysts. The reaction gas products were analysed on-line by GC with TCD (Agilent) equipped with Porapack Q (CO2, C2H6, C2H4, CH2CO, water and acetone) and molecular sieve 5A (H2, O2, N2, CO) packed columns connected in series, using He as carrier gas. Liquid products were analysed by GC with FID (Varian) and porapack Q capillary column using He as carrier gas. Activity data were reported as acetone conversion ( X C 3 H 6 O ), acetone gasification and selectivity to the different gasification products (S i), which are defined as follows: (2) X C 3 H 6 O ( % ) : ( mole C 3 H 6 O ) in − ( mole C 3 H 6 O ) out ( mole C 3 H 6 O ) in × 100 (3) Gasification ( % ) : ∑ mol i out ( 3 mole C 3 H 6 O ) in × 100 , i = CO , CO 2 , CH 4 (4) Si ( % ) = ( mole i ) out ∑ mol i out × 100 , i = H 2 , CO , CO 2 , CH 4 , C 2 H 4 , C 2 H 6 CH 2 CO 3 Results 3.1 Characterization of fresh catalysts 3.1.1 Chemical composition and textural properties Table 1 summarizes the chemical composition, expressed as atomic percentages, and the textural properties measured by N2 adsorption–desorption isotherms for the as-prepared catalysts and supports. For both A-La support and MNi/A-La catalyst, the atomic percentages of La determined by ICP-AES are well correlated with the theoretical values derived from nominal composition (5.2at% in A-La support and 4.7at% in MNi/A-La catalysts). Atomic percentages of Ni, Pt and Cu are also close to that expected from nominal composition (Ni=9.3at%, Cu=0.92at% and Pt=0.2at%). The close composition of the catalysts to nominal values indicates the effectiveness of the impregnation method used in the preparation of catalysts. For the sake of a valid comparison, the N2 adsorption–desorption data were normalized to unit weight of Al2O3 support. As observed in Table 1, the incorporation of a 15wt% of lanthanum oxide causes a slight decrease in both surface area and pore volume indicative of a partial blockage of the original pores of the Al2O3 by lanthanum species. However, the low decrease in surface area observed confirms the capacity of the alumina support to disperse the high lanthanum loading used in the study [23]. The incorporation of Ni to A-La support provokes a slight decrease in pore volume with simultaneous increase in surface area respect to that observed on bare A-La support. This fact indicates a partial blocking of the alumina pores by nickel entities. The increase in the specific area and the simultaneous pore blocking following the addition of nickel suggests that the nickel phase deposited on the alumina support develops some porosity and contributes to the measured specific area. The Cu or Pt incorporation involves a decrease of the pore volume maintaining similar BET surface areas than monometallic Ni/A-La. This fact is indicative of a partial blockage of the mesoporous structure of Ni/A-La with small Cu or Pt particles not affecting to the surface area exposition. 3.1.2 Temperature programmed reduction The results of the TPR experiments performed on the monometallic and bimetallic catalysts are shown in Fig. 1 . The momometallic Ni/A-La reference catalyst showed a broad reduction peak in the 650–1150K range, which could be decomposed into four components at reduction temperatures of 673, 776, 863 and 1027K. According to literature studies [24–26], the reduction peak at 673K is attributed to reduction of NiO species with weak interaction with alumina support, while the reduction peaks appearing at higher temperatures are related to the reduction of highly dispersed non-stoichiometric amorphous nickel aluminate spinels and to a diluted NiAl2O4-like phase respectively (bulk spinel typically reduces at 1093K). Apart from these Ni2+ species, the Ni/A-La catalyst showed additional hydrogen consumption peaks at 540K, which could be ascribed to the reduction of small NiO species with weak interaction with the A-La support. For bimetallic CuNi/A-La catalyst, a complex TPR profile is observed in the temperature range of 373–1173K. The reduction peaks are associated to the reduction of nickel and copper oxides of different dispersions and interactions with the A-La support. The reduction peak at 479K is attributed to the reduction of Cu2+ species. According to the literature, the reduction of CuO depends on the particle size and dispersion, being lower reduction temperatures to higher dispersion [27,28]. Therefore the reduction peak at 479K is indicative of the CuO particles highly dispersed on A-La support. The second group of peaks observed at higher temperatures is assigned to the reduction of Ni2+ species with different degrees of interaction with the Al2O3, as well as surface NiAl x O y . The relative amount of the Ni2+ species that can be already reduced at ca. 673K increases in the proportion with the loading of Cu. However, the reduction temperature of these species does not change significantly respect to that observed on reference Ni/A-La, indicating that the presence of Cu on the surface did not affect significantly the reducibility of Ni2+ species. The reduction profile of bimetallic PtNi/A-La catalyst shows changes respect to the Ni/A-La reference. For the PtNi/A-La catalyst, the most intense H2 consumption peak is centred at 600K with a shoulder additional peak at 500K and a broad peak in the region 743–1100K. The reduction peak at low temperature comprises the reduction of PtO x over Al2O3 [29]. The consumption peaks observed in the region 600–923K include the reduction of Ni species with different degrees of interaction with the Al2O3, as well as surface NiAl x O y . It is remarkable that the reduction of this type of Ni2+ species was recorded at temperatures ca. 120K lower than in the Ni/A-La reference catalyst. This phenomenon is attributed to a promoting effect of Pt on the reducibility of Ni species, in good agreement with the literature [30]. Finally, the hydrogen consumption centred at ca. 1050K appeared unchanged in all the catalysts, indicating that the presence of Pt on the surface did not affect the reducibility of bulk NiAl2O4. From the TPR of the catalysts, the activation temperature of catalysts was set at 873K in order to reduce an important proportion of the Ni2+ species with weak and medium interaction with the support and to prevent sintering of Ni metal particles. 3.1.3 X-ray diffraction (XRD) Fig. 2 shows the XRD patterns of support and as-prepared catalysts. The characteristic peaks of poorly crystalline γ-Al2O3 (at 37.4, 46.0 and 68.8 JCPD 29-063) and traces of θ-Al2O3 phase (at 31.2°, 36.6° and 67.4° JCPDS 86-1410) were detected in the XRD pattern of the A-La support. No diffraction peaks corresponding to crystalline species of either La2O3 (JCPDS 83-1355) or LaAlO3 (JCPDS 85-1071) were observed in the A-La support. This is not surprising because lanthanum exists in the form of a two-dimensional overlayer on alumina, which cannot by detected by XRD for lanthanum loadings up to 8.5μmol La/m2 [23]. XRD pattern of the calcined bimetallic catalysts and the Ni/A-La reference showed reflections at 43.3 characteristic of the most intense reflection (200) of crystalline phase of NiO (JCPDS 78-643). The presence of NiAl2O4 would be difficult to determine by this technique, since the diffraction lines of this spinel phase are coincident with those of the γ-Al2O3 (with pseudospinel structure). No diffraction peaks related to Pt or Cu phases were detected in the bimetallic Pt and CuNi/A-La calcined catalysts. This is due to the low concentration of Pt and Cu in the samples (Table 1) but it could also be a sign of the high dispersion of Pt or Cu species, since no periodic structures higher than 4nm could be observed by XRD. The crystalline structure of the reduced catalysts has been also analysed by XRD and the diffraction patterns are displayed in Fig. 3 . The XRD profiles of reduced catalysts present reflections corresponding to γ- and θ-Al2O3 phases detected in calcined samples. In addition to these phases, the diffraction patterns of the reduced catalysts showed lines at 2θ angles of 44.4 and 53.8 attributed to metallic Ni phase (JCPDS 04-850). On all reduced catalysts, the NiO phase has completely disappeared which indicates the total reduction of the NiO crystallites detected in the calcined catalysts. The XRD patterns of the reduced bimetallic catalysts did not show diffraction peaks related to crystalline reduced phases neither platinum nor copper. As indicated previously, this fact could be associated to the low concentration of Pt and Cu in the samples or be a sign of the high dispersion of Pt or Cu species. The crystallite size of the phases detected by XRD has been calculated for the catalysts before and after reduction (Table 2 ). The crystallite size values were estimated by application of Scherrer equation to the most intense diffraction peak of each phase involved (43.3 for NiO and 53.8 for Ni0). The low XRD reflections corresponding to metallic Ni phases may lead to some inaccuracies in the determination of absolute crystalline sizes. Nevertheless, quantitative estimation of crystallite sizes by applying the Scherrer equation after a careful mathematical treatment of diffraction patterns allows achieving the accuracy degree necessary for comparative purposes. A careful deconvolution of the range 2θ 40–50° was done in order to subtract the contribution of diffraction peaks of alumina support to the NiO peak. It can be observed (Table 2) that crystallite size of NiO formed on A-La support was close to 9nm. The presence of Pt or Cu in bimetallic catalysts did not change the NiO crystallite size observed on monometallic Ni/A-La reference. After reduction, the metallic Ni crystallite sizes are similar to the original NiO crystallites for all the catalysts, not showing therefore sintering of Ni particles during the reduction treatment. 3.1.4 X-ray photoelectron spectroscopy (XPS) The nature of surface species and composition of the catalysts were evaluated by photoelectron spectroscopy (XPS). The binding energies of Al 2p, La 3d, Cu 2p, Pt 4d, and C 1s core-levels have been recorded for the calcined catalysts and the results are summarized in Table 3 . For all catalysts, the La 3d5/2 peak envelopes were centred at 835.6–835.8eV. The observed binding energies of La 3d5/2 are close to the values reported in those studies for well-dispersed lanthanum species on alumina. The XPS spectra of Ni 2p level showed for all the catalysts the characteristic profile of Ni2+ species (Fig. 4 ). As can be seen in Fig. 4, there is partial overlapping between the La 3d and Ni 2p energy regions. Notwithstanding peak deconvolution allowed measure the area of the Ni 2p (and satellite) lines and therefore quantitative measurements were also performed. It can be noted that the two Ni 2p peaks show satellite lines placed on the high binding energy side of the principal lines. As these satellites are the fingerprints of Ni2+ ions we can state unambiguously that nickel is incorporated as Ni2+ species. In all the samples, Ni 2p3/2 binding energy is shifted to higher values than that of NiO (854.0eV). This could be the result of the strong interaction between Ni2+ species and the support surface. As it has been observed for other Ni catalysts supported on Al2O3, some Ni2+ ions react on the alumina surface forming a NiAl x O y like-spinel structure [31]. The binding energy of Ni 2p3/2 level for NiAl2O4 compound is reported in the literature near to 856.9eV [32], which is a value much closer to our experimental results. Therefore, an important contribution for the Ni 2p surface signal is due to this like-spinel type species. For the CuNi/A-La catalyst, the most intense peak (Cu 2p3/2) of the Cu 2p line at a binding energy of 934.7eV and the appearance of satellite lines on each component of the Cu 2p doublet are conclusive that copper is present as CuO oxide. For the PtNi/A-La catalyst, the Pt 4d level was recorded because the most intense peak (Pt 4f) overlaps with the Al 2p level. As shown in Table 3, the Pt 4d5/2 peak displays a minor component at 315.4eV associated to a metal phase (Pt0) [33], and a major one located at 318.0eV originated from oxidic platinum species, likely PtO2 [34]. No interaction between Pt and Cu or Pt and Ni phases was detected by XPS since Ni 2p and Pt 4d or Cu 2p binding energies measured were similar to those registered for monometallic counterparts. The surface atomic ratios of the calcined samples, calculated from the intensities of the XPS peaks are also summarized in Table 3. The homogeneous dispersion of lanthanum on the alumina surface observed for the A-La support is corroborated by the close atomic percentage of La obtained from XPS with respect to the predicted value derived from their nominal composition. The surface XPS La atomic percentage for the Ni/A-La catalyst was substantially higher than in the A-La support, indicating solubilization of a minor fraction of the La-phase along the impregnation with Ni and further precipitation on the external surface during the drying step. In the Ni/A-La catalyst, the calculated Ni atomic surface concentration was similar to the expected value derived from its chemical composition, indicating the homogeneous dispersion of nickel on the A-La support surface. The value of this XPS Ni surface concentration increases for the bimetallic PtNi/A-La catalyst, indicating some redistribution of Ni species on the external surface of catalyst during the second impregnation with Pt. In this sample, it was observed a homogeneous dispersion of Pt achieving a surface concentration close to the value expected from its Pt nominal concentration. In contrast, the bimetallic CuNi/A-La catalyst showed similar Ni surface concentration than that observed on monometallic reference and a Cu surface concentration higher than the expected value, indicating the presence of an overlayer of copper species. The chemical state and relative proportion of catalysts constituents after reduction were also determined by photoelectron spectroscopy (Table 4 ). Ni 2p level in reduced samples showed binding energies characteristic of Ni0 (852.6eV) [35] and Ni2+ ions in nickel aluminate entities (856.2eV). It can be observed that the amount of metallic Ni at the surface slightly increases in the bimetallic CuNi catalyst. A significant increment was achieved in the bimetallic Pt–Ni catalyst, in good agreement with TPR results. For reduced PtNi catalyst, the binding energy of Pt 4d5/2 level was observed at 314.8eV which is a value characteristic of metallic Pt. The peak fit of the Cu 2p3/2 core level revealed a binding energy at 932.0, which it is assigned to a Cu(0/+1) state [36]. No shift in the binding energy or Pt 4d or Cu 2p levels was observed, and therefore effects like metal–support interaction, i.e., the electron transfer between the Pt or Cu metals and the support or nickel can be ruled out. The surface atomic ratios on reduced catalysts, calculated from the intensities of the peak normalized by atomic sensitivity factors are also summarized in Table 4. After reduction, it is observed in all catalysts that the Ni surface concentration decreased respect to the values observed in calcined state. This effect has been typically observed for Ni catalysts supported on Al2O3, and it is explained by a ‘decoration’ of metallic particles by dispersed species from alumina support after reduction of surface NiAl x O y layer covering the NiO crystallites [37]. It can be observed that the surface concentration of Ni0 species at the surface varies in bimetallic samples. A significant increase in Ni surface concentration is observed in bimetallic PtNi catalysts while in the case of bimetallic CuNi sample, the surface concentration of metallic Ni was lower than those calculated for the monometallic Ni/A-La reference. After reduction, the XPS Pt and Cu surface concentrations were slightly lower than those obtained from the fresh calcined samples indicating some transformation in particle size or shape of the Pt and Cu oxides during the reduction process. 4 Catalytic activity To evaluate the contribution of the thermal decomposition of acetone, the homogeneous (non-catalytic) steam reforming of acetone at 873K was firstly investigated. Under the steam reforming conditions, acetone was converted in small extent (3.3%). The main products observed from the thermal conversion of acetone were methane and ketene (results not shown here). The presence of both products suggests the small participation of the cracking process (Eq. (2)) at the reaction temperature of 873K in the presence of steam. Small amount of coke (<0.05%) was observed demonstrating that acetone was thermally decomposed to coke to a limited extent under steam reforming conditions used in this study. (5) CH3COCH3 →CH2CO+CH4 The conversion and gasification percentage of acetone for the steam reforming of acetone over monometallic Ni/A-La and bimetallic MNi/A-La catalysts are summarized in Table 5 and plotted in Fig. 5 . All catalysts showed complete conversion of acetone being H2, CO, CO2 and CH4 the only gas products detected. The higher gasification capacity observed over all catalysts respect to that corresponding to homogeneous thermal reforming remarks the active role of metal sites (Ni, Cu or Pt) in the mechanism of the reforming of acetone. Nevertheless, differences on gasification capacity and gas product distribution were observed on tested catalysts. It was observed that the monometallic Ni/A-La reference catalyst converted acetone into H2, CO2, CO and CH4 in great extent (94.1%) with some formation of coke/oligomer products (5.9%). On comparing with Ni/A-La reference catalyst, the bimetallic PtNi/A-La sample showed almost complete transformation of acetone (99.8%) into H2, CO, CO2 and CH4 with low coke/oligomer formation (0.2%). On the contrary, the addition of Cu to Ni/A-La catalyst decreases the capacity of the catalysts to transform the acetone into H2, CO, CO2 and CH4, with only the 56.5% of acetone gasified to reforming products. Analysis of liquid products obtained on CuNi catalysts shows the formation of isopropanol, C6, C9 and C12 ketones. The differences in the gasification capacity of the tested catalysts (Fig. 5) imply that incorporation of Pt- and Cu- to Ni modifies in different way the routes of formation of coke/oligomer products observed on monometallic Ni reference catalyst. Formation of coke/oligomer products during the acetone steam reforming arises mainly from catalytic routes since, as indicated previously, coke formation from homogeneous thermal routes is produced at limited extent. Acetone can undergo aldol condensation and oligomerization reactions on catalysts with acidic and/or basic sites as well as hydrogenation metallic sites [38]. Aldol condensation of acetone to diacetone alcohol (DAA) is catalysed by either basic or acid sites, while the dehydration of diacetone alcohol (DAA) to mesityl oxide (MO) is acid-catalysed and the selective hydrogenation of mesityl oxide (MO) requires metal sites [39,40]. At high temperatures, these products can suffer secondary oligomerization reactions leading to numerous higher condensation products which form deposits on the catalysts surface. Evolution of the selectivity to gas products also depends on catalyst formulation (Fig. 6 ). Gas produced over Ni/A-La catalyst was a mixture of H2, CO2, CO and CH4 whose composition was approached the values predicted from equilibrium calculations [3]. This indicates that reforming and water gas shift are the main reactions operating over this catalyst. The bimetallic PtNi catalyst showed lower hydrogen selectivity with higher selectivity to CO and CH4 than that observed for the monometallic Ni/A-La reference catalyst (Fig. 6). This product distribution was indicative of the lower water gas shift capacity of the bimetallic PtNi catalyst respect to the monometallic Ni counterpart. On the other hand, the bimetallic CuNi catalyst showed the highest hydrogen selectivity with lower selectivity to C1 products among the catalyst tested. This fact indicates that in spite of the lower gasification capacity showed by the CuNi/A-La catalyst, the presence of Cu improves the production of hydrogen indicative of an enhancement in the CH bond breaking and water gas shift capacity respect to the monometallic Ni reference catalyst. 5 Characterization of used catalysts 5.1 X-ray diffraction The X-ray diffraction profiles of catalysts used for 12h in the steam reforming of acetone are displayed in Fig. 7 . The XRD profiles of used catalysts present reflections corresponding to γ-Al2O3, θ-Al2O3 and reduced Ni0 phases which were previously detected in fresh reduced catalysts (Fig. 3). In addition to these phases, the diffraction patterns of the used Ni/A-La and CuNi/A-La catalysts showed lines at 2θ =26° characteristic of graphitic carbon (JCPDS 75-1621). This fact indicates that coke deposition took place during the acetone steam reforming over these catalysts, especially in the case of the bimetallic NiCu catalyst. On the contrary, the bimetallic PtNi catalyst did not show diffraction peaks related to graphitic carbon indicating the limited amount of carbon formed on this sample. Regarding to evolution of Ni0 species in reaction, it is observed that the corresponding (111) diffraction lines of metallic nickel at 2θ =44.8° are more intense after reaction. Based on this observation, some sintering of the Ni0 crystallites under reaction conditions can be expected. Crystallite sizes of metallic nickel in the used catalysts obtained by applying the Scherrer equation are summarized in Table 2. The size of metallic Ni crystallites observed for monometallic Ni- and bimetallic CuNi-catalysts showed a crystalline size larger than reduced fresh samples, pointing that sintering of metallic Ni crystallites has occurred under reforming conditions on these catalysts. In the case of bimetallic PtNi, the size of Ni crystallites did not significantly change during reaction indicating that the presence of platinum on catalysts prevents sintering of Ni crystallites during the steam reforming reaction. 5.2 Thermogravimetric oxidation Thermogravimetric analyses of the used catalysts were carried out to calculate the amount of carbonaceous residues retained in the catalysts after reaction by measuring the weight loss during its temperature-programmed oxidation under a 20% O2 gas flow. In Fig. 8 are represented the TG-TPO profiles (as derivative of the weight loss) of the catalysts used in acetone steam reforming reaction. The derivative TG-TGO profile observed on all used catalysts, with two main contributions, indicates that carbon deposits of different nature were formed on used catalysts. All the used catalysts showed a weight loss in the temperature range 673–973K. TPO-TG analyses of used catalysts, represented in Fig. 8, show two main oxidation peaks at 773 and 853K. Oxidation peaks at low temperature can be ascribed to filamentous carbon on metal surfaces [41] whereas the peaks at temperatures higher than 823K are ascribed to oxidation of more ordered carbon in the form of uniform coke coatings on support [42]. As it is observed in Fig. 8, most of the coke deposited on Ni/A-La catalyst was in the form of graphitic coke (872K) while for bimetallic CuNi/A-La one it was in the form of filamentous coke on metal surfaces (773K). For PtNi/A-La catalyst, the formation of carbon is markedly suppressed as indicated by the lower intensity of its oxidation peaks. Coke deposits on used catalysts, summarized in Table 6 , show that total amount of coke deposited on catalyst only significantly decreases in the case of the bimetallic PtNi catalyst formulation. 6 Discussion The acidic/basic properties of the A-La support may participate in the reforming mechanism of acetone since this molecule could react on these sites and reacts towards to diacetone alcohol, mesityl oxide or other products by means of condensation/oligomerization reactions [38–40]. Nevertheless taking into account that all catalysts are supported on the same support, the differences in the characteristics of active metals supported on A-La play an essential role in the catalytic behaviour of the studied samples. The role of metallic sites on reforming reactions of organic molecules is to activate the molecules though OH, CH2 , CC and CH2 bond breaking, and to promote the reaction between the organic fragments with the OH groups from the water reagent. Monometallic Ni/A-La catalyst showed high reforming capacity as it gasifies 94% of the acetone feed (Table 5 and Fig. 5). The high extent of the gasification reactions indicates that reaction routes based on condensation/oligomerization of acetone on support neither proceed to a great extent nor the products formed by these reactions are sequentially fully reformed. Characterization results on Ni/A-La catalyst showed homogeneous dispersion of La2O3 on the Al2O3 support with good metallic Ni surface exposure, which according to reforming chemistry on Ni catalysts, may be the cause of the high reforming activity of this catalyst as consequence of the enhancement in the CH and CC bond activation associated with low size metal crystallites [43] and the assistance of lanthanum species in preventing coke deposition [44,45]. According to XRD and XPS results, interactions between Pt or Cu and Ni phases are very weak in the reduced bimetallic catalysts. In spite of this fact, when bimetallic catalysts are compared with monometallic Ni counterpart (Figs. 5 and 6), it is observed that the presence of Cu and Pt has an important effect in the gasification capacity and selectivity of the catalysts. TPR profiles (Fig. 1) showed enhanced reducibility of Ni species on bimetallic catalyst containing platinum. This phenomenon has been observed by several authors and could be explained by hydrogen-spillover on metallic surfaces which may provide high mobility of H-atoms along the catalyst surface that favours the reduction of oxidized species of Ni [33]. XPS analyses on fresh reduced catalysts are in line with above commented TPR results. As observed in Table 4, the bimetallic PtNi catalyst showed higher percentage of metallic nickel species compared with the monometallic counterpart. The changes in the reducibility and exposure of metallic Ni in the bimetallic samples imply variations in the surface Ni0 content of the catalysts after reduction. A significant increase in Ni0 surface concentration is observed in bimetallic PtNi catalysts while in the case of bimetallic CuNi sample, the surface concentration of metallic Ni was lower than that determined for the monometallic Ni/A-La reference. The gasification capacity of bimetallic catalysts (Table 5 and Fig. 5) clearly indicated a better performance of the bimetallic PtNi catalyst as compared to bimetallic CuNi counterpart. A much lower degree of gasification was observed for the bimetallic CuNi catalyst respect to the monometallic Ni counterpart. According to the literature, the activity for hydrocarbon reforming reactions on Ni based catalysts is roughly proportional to metallic nickel surface area for a wide number of supports [46]. However, if a comparison is made between the gasification capability of the bimetallic catalyst with the exposure of metallic Ni in reduced catalysts, it can be inferred that properties other than surface exposure of metallic Ni affect the reforming activity of bimetallic catalysts. In this scenario, the intrinsic reforming activity of Pt and Cu might play a role in the catalytic behaviour of the bimetallic catalysts studied here. Studies on reforming over CuNi catalysts have shown that the promotion of activity in is associated with the modification of the Ni ensemble environment by forming NiCu alloy [47–49]. The TPR profile, XRD and XPS analyses of the reduced CuNi/A-La catalyst did not reveal the formation of CuNi alloy. Therefore, the low gasification capacity of the bimetallic CuNi catalyst suggests changes in the acetone reaction mechanism associated to the presence of metallic Cu since this metal is not active for CC bond breaking as Ni or Pt are. The lower reforming capacity of the CuNi catalysts is hypothesized to be associated with the a loss of selectivity due to the formation of isopropanol by direct hydrogenation of acetone under metallic copper sites because it is known that acetone undergoes this hydrogenation reaction easily in the presence of metallic copper [50,51]. Analysis of liquid products obtained over this catalyst confirms this fact. The reforming activity of bimetallic PtNi catalyst shows that addition of platinum enhances the gasification capacity respect to monometallic Ni counterpart (Table 5, Figs. 5 and 6) achieving the bimetallic formulation almost complete gasification of acetone. The higher gasification activity observed for PtNi sample suggests that the capacity of this catalyst in the CC and CH bond activation is higher than that of monometallic counterpart. According to the TPR and XPS analyses, the presence of Pt modifies the interactions between nickel species and A-La support, leading to differences in the reducibility and surface concentration of reduced nickel species. As discussed above, higher nickel surface concentration implies higher number of sites for CC and CH bond activation during hydrocarbon steam reforming and therefore this fact is, in part, responsible of the better reforming behaviour observed for the bimetallic PtNi catalyst. The improvement in reforming activity can be also originated by the differences in coke formation and resistance to thermal sintering observed when Pt is present in the catalyst formulation. As observed from XRD profiles of used catalysts (Fig. 7 and Table 2), the degree of sintering of nickel crystallites after reaction is substantially lower in the case of the bimetallic PtNi catalyst respect to monometallic Ni one. As it is seen in Table 6, a lower amount of carbonaceous deposit was observed in bimetallic PtNi formulation. This observation indicates that Pt species are involved in the gasification of coke precursors. It is know that both the metallic Ni particle size ant the Pt play a major role in assisting coke removal. In this sense, Ni particles of larger size favour carbon deposition while platinum assists in coke removal by means of a cooperative effect of both Pt and Ni phases [52]: Ni provides activity in CC and CH bond activation and Pt particles enhance the mobility of the H-atoms formed in the reaction, helping the gasification of coke intermediates (C x H y ) formed during the reforming. 7 Conclusions The steam reforming of acetone (as model molecule of bio-oil) over bimetallic PtNi and CuNi catalysts supported on La-modified Al2O3 has been investigated with respect to the structural and morphological characteristics of the dispersed metallic phases. The activity of bimetallic catalysts clearly indicated the better performance of bimetallic PtNi catalyst in terms of gasification capacity and resistance to coke deposits as compared to the bimetallic CuNi counterpart. A much lower degree of gasification as well as lower selectivity to CO and CO2 was observed for Cu-based bimetallic catalyst respect to monometallic Ni one. Characterization analyses of the reduced CuNi/A-La catalysts revealed a poor interaction Cu-Ni with no formation of CuNi alloy. Therefore, the low gasification capacity of the bimetallic CuNi catalyst suggests changes in the acetone reaction mechanism due to the formation of isopropanol by direct hydrogenation of acetone under metallic copper. The reforming activity of bimetallic PtNi catalyst shows that addition of platinum to nickel enhances the gasification capacity respect to the monometallic Ni counterpart, achieving the bimetallic catalyst almost complete gasification of the acetone. The characterization results over bimetallic PtNi catalyst revealed that the presence of platinum increases the reducibility and surface exposure of metallic Ni. Additionally, the better ability of Pt to enhance the mobility of the H-atoms formed in the reaction could help the gasification of carbon precursors. The combination of both effects is interpreted as responsible for the higher reforming capacity of the bimetallic PtNi catalyst. Acknowledgements This research was supported by the Ministry of Science and Innovation (Spain) and the Autonomous Government of Madrid, Madrid (Spain) under grants ENE2010-21198-C04-01 and S2009ENE-1743, respectively. Partial support to this work came from Najran University, The Kingdom of Saudi Arabia. References [1] X. Hu L. Zhang G. Lu Appl. Catal. A: Gen. 427 2012 49 [2] E.Ch. Vagia A.A. Lemonidou Appl. Catal. A: Gen. 351 2008 111 121 [3] E.Ch. Vagia A.A. Lemonidou Int. J. Hydrogen Energy 32 2 2006 212 223 [4] K. Takanabe K. Aika K. Seshan L. Lefferts Chem. Eng. J. 120 2006 1133 1137 [5] C. Rioche S. Kulkarni F.C. Meunier J.P. Breen R. Burch Appl. Catal. B: Environ. 61 2005 130 139 [6] C. Resini L. Arrighi M.C.H. Delgado M.A.L. Vargas L.J. Alemany P. Riany R.M. Berardinelli G. Busca Int. J. Hydrogen Energy 31 1 2006 13 19 [7] P.N. Kechagiopoulos S.S. Voutetakis A.A. Lemonidou I.A. Vasalos Energy Fuels 20 2006 2155 2163 [8] L. Barattini G. Ramis C. Resini G. Busca M. Sisani U. Costantino Chem. Eng. J. 153 2009 43 49 [9] Z. Li X. Hu L. Zhang S. Liu G. Lu Appl. Catal. A: Gen. 417–418 2012 281 289 [10] X. Hu G. Lu Catal. Commun. 12 2010 50 53 [11] B. Matas Güell I. Babich K.P. Nichols J.G.E. Gardeniers L. Lefferts K. Seshan Appl. Catal. B: Environ. 90 2009 38 44 [12] K. Takanabe K. Aika K. Seshan L. Lefferts J. Catal. 227 2004 101 108 [13] K. Takanabe K. Aika K. Inazu T. Baba K. Seshan L. Lefferts J. Catal. 243 2006 263 269 [14] K. Takanabe K. Aika K. Seshan L. Lefferts Top. Catal. 49 2008 68 72 [15] J.A. Rodriguez Surf. Sci. Rep. 24 1996 225 287 [16] J.C. Zhang Y.H. Wang R.Y. Ma D.Y. Wu Appl. Catal. A: Gen 243 2003 251 259 [17] M. Arai T. Ebina M. Shirai Appl. Surf. Sci. 148 1999 155 163 [18] V.R. Choudhary B. Prabhakar A.M. Rajput J. Catal. 157 1995 752 754 [19] W.T. Reichle J. Catal. 63 1980 295 306 [20] A. Iriondo V.L. Barrio J.F. Cambra P.L. Arias M.B. Güemez R.M. Navarro M.C. Sanchez-Sanchez J.L.G. Fierro Catal. Commun. 10 8 2009 1275 1278 [21] A. Iriondo V.L. Barrio J.F. Cambra P.L. Arias M.B. Guemez R.M. Navarro M.C. Sanchez-Sanchez J.L.G. Fierro Top. Catal. 49 1–2 2008 46 58 [22] M.C. Sanchez-Sanchez R.M. Navarro J.L.G. Fierro Catal. Today 129 3–4 2007 336 345 [23] M. Bettman R.E. Chase K. Otto W.H. Weber J. Catal. 117 1989 447 454 [24] J.M. Rynkowski T. Paryjczak M. Lenik Appl. Catal. A: Gen. 106 1993 73 80 [25] N. Ichikuni D. Murata S. Shimazu T. Uematsu Catal. Lett. 69 2000 33 37 [26] J.T. Richardson M.W. Twigg Appl. Catal. A: Gen. 167 1998 57 69 [27] C.H. Tu A.Q. Wang M.Y. Zheng X.D. Wang T. Zhang Appl. Catal. A: Gen. 297 2006 40 51 [28] X.C. Zheng S.H. Wu S.P. Wang S.R. Wang S.M. Zhang P. Huang Appl. Catal. A: Gen. 283 2005 217 226 [29] C. Hwang C. Yeh J. Mol. Catal. A: Chem. 112 1996 295 303 [30] J.M. Rynkowski T. Paryjczak M. Lenik M. Farbotko J. Goralski J. Chem. Soc. Faraday Trans. 91 1995 3481 3492 [31] P. Salagre J.L.G. Fierro F. Medina J.E. Sueiras J. Mol. Catal. A: Chem. 106 1996 125 132 [32] NIST X-ray Photoelectron Spectroscopy Database: Version 3.4. National Institute of Standards and Technology, Gaithersburg 2002 Available in: http://srdata.nist.gov/xp [33] A.S. Ivanova S.M. Slavinskaya R.V. Gulyaev V.I. Zaikovskii O.A. Stonkus I.G. Danilova L.M. Plyasova I.A. Polukhina A.I. Boronin Appl. Catal. B: Environ. 97 1–2 2010 57 66 [34] T. Huizinga J. Vangrondelle R. Prins Appl. Catal. 10 1984 199 211 [35] F. Devred A.H. Gieske N. Adkins U. Dahlborg C.M. Bao M. Calvo-Dahlborg J.W. Bakker B.E. Nieuwenhuys Appl. Catal. A: Gen. 356 2009 154 162 [36] C.C. Chusuei M.A. Brookshier D.W. Goodman Langmuir 15 1999 2806 2808 [37] Y.J. Huang J.A. Schwarz J.R. Diehl J.P. Baltrus Appl. Catal. 37 1988 229 234 [38] A.A. Nikolopoulos B.W.-L. Jang J.J. Spivey Appl. Catal. A: Gen. 296 1 2005 128 136 [39] Y. Higashio T. Nakayama Catal. Today 28 1996 127 136 [40] N.N. Das S.C. Srivastava Bull. Mater. Sci. 25 4 2002 283 292 [41] S. Wang G.Q.M. Lu Appl. Catal. B: Environ. 16 3 1998 267 277 [42] S. Natesakhawat R.B. Watson X. Wang U.S. Ozkan J. Catal. 234 2 2005 496 508 [43] D.L. Trimm Cat. Rev.-Sci. Eng. 16 1977 155 [44] Y.H. Hu E. Ruchenstein Catal. Lett. 36 1996 145 152 [45] Z.L. Zhang X.E. Verykios J.M. MacDonald S. Affrosman J. Phys. Chem. 100 1996 744 751 [46] J.R. Rostrup-Nielsen J.R. Anderson M. Boudart Catalysis, Science and Technology vol. 5 1984 Springer-Verlag Berlin [47] Z. Xie C. Xia M. Zhang W. Zhu H. Wang J. Power Sources 161 2006 1056 1061 [48] J.-H. Lee E.-G. Lee O.-S. Joo K.-D. Jung Appl. Catal. A 269 2004 1 6 [49] A. Sin E. Kopnin Y. Dubitsky A. Zaopo A.S. Aricò D. La Rosa L.R. Gullo V. Antonucci J. Power Sources 164 2007 300 305 [50] J. Cunningham J.N. Hickey Z. Wang Int. J. Energy Res. 20 1996 763 766 [51] J. Cunningham J.N. Hickey M.M.D. Brown B.J. Meenan J. Mater. Chem. 7 1993 743 750 [52] M.C. Sanchez-Sanchez R.M. Navarro D.I. Kondarides X.E. Verykios J.L.G. Fierro J. Phys. Chem. A 113 2010 3873 3879",
      "scopus-id": "84898901466",
      "coredata": {
        "eid": "1-s2.0-S0926860X13006649",
        "dc:description": "The effect of Pt and Cu addition on the behaviour of Ni catalysts supported on Al2O3 modified with La for acetone steam reforming (as model molecule of bio-oil) was studied. Catalytic activity was found to depend strongly on the bimetallic formulation, achieving the bimetallic PtNi catalyst almost complete gasification of the acetone. The characterization results achieved with XRD, TPR and XPS showed differences in surface metal concentrations which depend on the presence of Pt or Cu in catalysts composition. The decrease in activity observed for the bimetallic CuNi catalyst is associated with changes in the acetone reaction mechanism due to the presence of metallic copper since formation of CuNi alloy was not formed in this catalyst. In the case of bimetallic PtNi catalyst, a lower carbon deposition and a higher thermal stability of the Ni crystallites under reaction conditions was observed with respect to monometallic Ni reference catalyst. It is suggested that the better dispersion of metallic nickel crystallites together with the enhanced H-atom mobility on Pt are responsible of the better catalytic behaviour of the bimetallic PtNi formulation in the steam reforming of acetone.",
        "openArchiveArticle": "false",
        "prism:coverDate": "2014-03-22",
        "openaccessUserLicense": null,
        "prism:aggregationType": "Journal",
        "prism:url": "https://api.elsevier.com/content/article/pii/S0926860X13006649",
        "dc:creator": [
          {
            "@_fa": "true",
            "$": "Navarro, R.M."
          },
          {
            "@_fa": "true",
            "$": "Guil-Lopez, R."
          },
          {
            "@_fa": "true",
            "$": "Gonzalez-Carballo, J.M."
          },
          {
            "@_fa": "true",
            "$": "Cubero, A."
          },
          {
            "@_fa": "true",
            "$": "Ismail, A.A."
          },
          {
            "@_fa": "true",
            "$": "Al-Sayari, S.A."
          },
          {
            "@_fa": "true",
            "$": "Fierro, J.L.G."
          }
        ],
        "link": [
          {
            "@_fa": "true",
            "@rel": "self",
            "@href": "https://api.elsevier.com/content/article/pii/S0926860X13006649"
          },
          {
            "@_fa": "true",
            "@rel": "scidir",
            "@href": "https://www.sciencedirect.com/science/article/pii/S0926860X13006649"
          }
        ],
        "dc:format": "application/json",
        "openaccessType": null,
        "pii": "S0926-860X(13)00664-9",
        "prism:volume": "474",
        "prism:publisher": "Elsevier B.V.",
        "dc:title": "Bimetallic MNi/Al2O3-La catalysts (M=Pt, Cu) for acetone steam reforming: Role of M on catalyst structure and activity",
        "prism:copyright": "Copyright © 2013 Elsevier B.V. All rights reserved.",
        "prism:issueName": "B. Delmon Honor Special Issue",
        "openaccess": "0",
        "prism:issn": "0926860X",
        "dcterms:subject": [
          {
            "@_fa": "true",
            "$": "Nickel catalysts"
          },
          {
            "@_fa": "true",
            "$": "Platinum"
          },
          {
            "@_fa": "true",
            "$": "Copper"
          },
          {
            "@_fa": "true",
            "$": "Alumina"
          },
          {
            "@_fa": "true",
            "$": "Lanthanum"
          },
          {
            "@_fa": "true",
            "$": "Hydrogen production"
          },
          {
            "@_fa": "true",
            "$": "Bio-oil"
          },
          {
            "@_fa": "true",
            "$": "Acetone"
          },
          {
            "@_fa": "true",
            "$": "Steam reforming"
          }
        ],
        "openaccessArticle": "false",
        "prism:publicationName": "Applied Catalysis A: General",
        "openaccessSponsorType": null,
        "prism:pageRange": "168-177",
        "prism:endingPage": "177",
        "pubType": "fla",
        "prism:coverDisplayDate": "22 March 2014",
        "prism:doi": "10.1016/j.apcata.2013.09.056",
        "prism:startingPage": "168",
        "dc:identifier": "doi:10.1016/j.apcata.2013.09.056",
        "openaccessSponsorName": null
      },
      "objects": {
        "object": [
          {
            "@category": "thumbnail",
            "@height": "65",
            "@width": "321",
            "@_fa": "true",
            "$": "https://api.elsevier.com/content/object/eid/1-s2.0-S0926860X13006649-si5.gif?httpAccept=%2A%2F%2A",
            "@multimediatype": "GIF image file",
            "@type": "ALTIMG",
            "@size": "2002",
            "@ref": "si5",
            "@mimetype": "image/gif"
          },
          {
            "@category": "thumbnail",
            "@height": "40",
            "@width": "442",
            "@_fa": "true",
            "$": "https://api.elsevier.com/content/object/eid/1-s2.0-S0926860X13006649-si4.gif?httpAccept=%2A%2F%2A",
            "@multimediatype": "GIF image file",
            "@type": "ALTIMG",
            "@size": "2049",
            "@ref": "si4",
            "@mimetype": "image/gif"
          },
          {
            "@category": "thumbnail",
            "@height": "36",
            "@width": "379",
            "@_fa": "true",
            "$": "https://api.elsevier.com/content/object/eid/1-s2.0-S0926860X13006649-si3.gif?httpAccept=%2A%2F%2A",
            "@multimediatype": "GIF image file",
            "@type": "ALTIMG",
            "@size": "1854",
            "@ref": "si3",
            "@mimetype": "image/gif"
          },
          {
            "@category": "thumbnail",
            "@height": "16",
            "@width": "43",
            "@_fa": "true",
            "$": "https://api.elsevier.com/content/object/eid/1-s2.0-S0926860X13006649-si2.gif?httpAccept=%2A%2F%2A",
            "@multimediatype": "GIF image file",
            "@type": "ALTIMG",
            "@size": "235",
            "@ref": "si2",
            "@mimetype": "image/gif"
          },
          {
            "@category": "thumbnail",
            "@height": "20",
            "@width": "104",
            "@_fa": "true",
            "$": "https://api.elsevier.com/content/object/eid/1-s2.0-S0926860X13006649-si1.gif?httpAccept=%2A%2F%2A",
            "@multimediatype": "GIF image file",
            "@type": "ALTIMG",
            "@size": "497",
            "@ref": "si1",
            "@mimetype": "image/gif"
          },
          {
            "@category": "high",
            "@height": "1838",
            "@width": "1252",
            "@_fa": "true",
            "$": "https://api.elsevier.com/content/object/eid/1-s2.0-S0926860X13006649-gr8_lrg.jpg?httpAccept=%2A%2F%2A",
            "@multimediatype": "JPEG image file",
            "@type": "IMAGE-HIGH-RES",
            "@size": "162585",
            "@ref": "gr8",
            "@mimetype": "image/jpeg"
          },
          {
            "@category": "high",
            "@height": "1207",
            "@width": "1508",
            "@_fa": "true",
            "$": "https://api.elsevier.com/content/object/eid/1-s2.0-S0926860X13006649-gr7_lrg.jpg?httpAccept=%2A%2F%2A",
            "@multimediatype": "JPEG image file",
            "@type": "IMAGE-HIGH-RES",
            "@size": "167983",
            "@ref": "gr7",
            "@mimetype": "image/jpeg"
          },
          {
            "@category": "high",
            "@height": "2592",
            "@width": "1544",
            "@_fa": "true",
            "$": "https://api.elsevier.com/content/object/eid/1-s2.0-S0926860X13006649-gr6_lrg.jpg?httpAccept=%2A%2F%2A",
            "@multimediatype": "JPEG image file",
            "@type": "IMAGE-HIGH-RES",
            "@size": "196101",
            "@ref": "gr6",
            "@mimetype": "image/jpeg"
          },
          {
            "@category": "high",
            "@height": "1693",
            "@width": "1250",
            "@_fa": "true",
            "$": "https://api.elsevier.com/content/object/eid/1-s2.0-S0926860X13006649-gr5_lrg.jpg?httpAccept=%2A%2F%2A",
            "@multimediatype": "JPEG image file",
            "@type": "IMAGE-HIGH-RES",
            "@size": "95732",
            "@ref": "gr5",
            "@mimetype": "image/jpeg"
          },
          {
            "@category": "high",
            "@height": "2554",
            "@width": "1419",
            "@_fa": "true",
            "$": "https://api.elsevier.com/content/object/eid/1-s2.0-S0926860X13006649-gr4_lrg.jpg?httpAccept=%2A%2F%2A",
            "@multimediatype": "JPEG image file",
            "@type": "IMAGE-HIGH-RES",
            "@size": "500383",
            "@ref": "gr4",
            "@mimetype": "image/jpeg"
          },
          {
            "@category": "high",
            "@height": "1344",
            "@width": "1583",
            "@_fa": "true",
            "$": "https://api.elsevier.com/content/object/eid/1-s2.0-S0926860X13006649-gr3_lrg.jpg?httpAccept=%2A%2F%2A",
            "@multimediatype": "JPEG image file",
            "@type": "IMAGE-HIGH-RES",
            "@size": "192106",
            "@ref": "gr3",
            "@mimetype": "image/jpeg"
          },
          {
            "@category": "high",
            "@height": "1748",
            "@width": "1735",
            "@_fa": "true",
            "$": "https://api.elsevier.com/content/object/eid/1-s2.0-S0926860X13006649-gr2_lrg.jpg?httpAccept=%2A%2F%2A",
            "@multimediatype": "JPEG image file",
            "@type": "IMAGE-HIGH-RES",
            "@size": "242232",
            "@ref": "gr2",
            "@mimetype": "image/jpeg"
          },
          {
            "@category": "high",
            "@height": "1881",
            "@width": "1257",
            "@_fa": "true",
            "$": "https://api.elsevier.com/content/object/eid/1-s2.0-S0926860X13006649-gr1_lrg.jpg?httpAccept=%2A%2F%2A",
            "@multimediatype": "JPEG image file",
            "@type": "IMAGE-HIGH-RES",
            "@size": "190434",
            "@ref": "gr1",
            "@mimetype": "image/jpeg"
          },
          {
            "@category": "high",
            "@height": "854",
            "@width": "2213",
            "@_fa": "true",
            "$": "https://api.elsevier.com/content/object/eid/1-s2.0-S0926860X13006649-fx1_lrg.jpg?httpAccept=%2A%2F%2A",
            "@multimediatype": "JPEG image file",
            "@type": "IMAGE-HIGH-RES",
            "@size": "115355",
            "@ref": "fx1",
            "@mimetype": "image/jpeg"
          },
          {
            "@category": "standard",
            "@height": "414",
            "@width": "282",
            "@_fa": "true",
            "$": "https://api.elsevier.com/content/object/eid/1-s2.0-S0926860X13006649-gr8.jpg?httpAccept=%2A%2F%2A",
            "@multimediatype": "JPEG image file",
            "@type": "IMAGE-DOWNSAMPLED",
            "@size": "19592",
            "@ref": "gr8",
            "@mimetype": "image/jpeg"
          },
          {
            "@category": "standard",
            "@height": "272",
            "@width": "340",
            "@_fa": "true",
            "$": "https://api.elsevier.com/content/object/eid/1-s2.0-S0926860X13006649-gr7.jpg?httpAccept=%2A%2F%2A",
            "@multimediatype": "JPEG image file",
            "@type": "IMAGE-DOWNSAMPLED",
            "@size": "19684",
            "@ref": "gr7",
            "@mimetype": "image/jpeg"
          },
          {
            "@category": "standard",
            "@height": "584",
            "@width": "348",
            "@_fa": "true",
            "$": "https://api.elsevier.com/content/object/eid/1-s2.0-S0926860X13006649-gr6.jpg?httpAccept=%2A%2F%2A",
            "@multimediatype": "JPEG image file",
            "@type": "IMAGE-DOWNSAMPLED",
            "@size": "28990",
            "@ref": "gr6",
            "@mimetype": "image/jpeg"
          },
          {
            "@category": "standard",
            "@height": "382",
            "@width": "282",
            "@_fa": "true",
            "$": "https://api.elsevier.com/content/object/eid/1-s2.0-S0926860X13006649-gr5.jpg?httpAccept=%2A%2F%2A",
            "@multimediatype": "JPEG image file",
            "@type": "IMAGE-DOWNSAMPLED",
            "@size": "13361",
            "@ref": "gr5",
            "@mimetype": "image/jpeg"
          },
          {
            "@category": "standard",
            "@height": "576",
            "@width": "320",
            "@_fa": "true",
            "$": "https://api.elsevier.com/content/object/eid/1-s2.0-S0926860X13006649-gr4.jpg?httpAccept=%2A%2F%2A",
            "@multimediatype": "JPEG image file",
            "@type": "IMAGE-DOWNSAMPLED",
            "@size": "48967",
            "@ref": "gr4",
            "@mimetype": "image/jpeg"
          },
          {
            "@category": "standard",
            "@height": "303",
            "@width": "357",
            "@_fa": "true",
            "$": "https://api.elsevier.com/content/object/eid/1-s2.0-S0926860X13006649-gr3.jpg?httpAccept=%2A%2F%2A",
            "@multimediatype": "JPEG image file",
            "@type": "IMAGE-DOWNSAMPLED",
            "@size": "22564",
            "@ref": "gr3",
            "@mimetype": "image/jpeg"
          },
          {
            "@category": "standard",
            "@height": "395",
            "@width": "392",
            "@_fa": "true",
            "$": "https://api.elsevier.com/content/object/eid/1-s2.0-S0926860X13006649-gr2.jpg?httpAccept=%2A%2F%2A",
            "@multimediatype": "JPEG image file",
            "@type": "IMAGE-DOWNSAMPLED",
            "@size": "28417",
            "@ref": "gr2",
            "@mimetype": "image/jpeg"
          },
          {
            "@category": "standard",
            "@height": "425",
            "@width": "284",
            "@_fa": "true",
            "$": "https://api.elsevier.com/content/object/eid/1-s2.0-S0926860X13006649-gr1.jpg?httpAccept=%2A%2F%2A",
            "@multimediatype": "JPEG image file",
            "@type": "IMAGE-DOWNSAMPLED",
            "@size": "23822",
            "@ref": "gr1",
            "@mimetype": "image/jpeg"
          },
          {
            "@category": "standard",
            "@height": "193",
            "@width": "500",
            "@_fa": "true",
            "$": "https://api.elsevier.com/content/object/eid/1-s2.0-S0926860X13006649-fx1.jpg?httpAccept=%2A%2F%2A",
            "@multimediatype": "JPEG image file",
            "@type": "IMAGE-DOWNSAMPLED",
            "@size": "16186",
            "@ref": "fx1",
            "@mimetype": "image/jpeg"
          },
          {
            "@category": "thumbnail",
            "@height": "163",
            "@width": "111",
            "@_fa": "true",
            "$": "https://api.elsevier.com/content/object/eid/1-s2.0-S0926860X13006649-gr8.sml?httpAccept=%2A%2F%2A",
            "@multimediatype": "GIF image file",
            "@type": "IMAGE-THUMBNAIL",
            "@size": "3244",
            "@ref": "gr8",
            "@mimetype": "image/gif"
          },
          {
            "@category": "thumbnail",
            "@height": "164",
            "@width": "205",
            "@_fa": "true",
            "$": "https://api.elsevier.com/content/object/eid/1-s2.0-S0926860X13006649-gr7.sml?httpAccept=%2A%2F%2A",
            "@multimediatype": "GIF image file",
            "@type": "IMAGE-THUMBNAIL",
            "@size": "4793",
            "@ref": "gr7",
            "@mimetype": "image/gif"
          },
          {
            "@category": "thumbnail",
            "@height": "163",
            "@width": "97",
            "@_fa": "true",
            "$": "https://api.elsevier.com/content/object/eid/1-s2.0-S0926860X13006649-gr6.sml?httpAccept=%2A%2F%2A",
            "@multimediatype": "GIF image file",
            "@type": "IMAGE-THUMBNAIL",
            "@size": "2513",
            "@ref": "gr6",
            "@mimetype": "image/gif"
          },
          {
            "@category": "thumbnail",
            "@height": "164",
            "@width": "121",
            "@_fa": "true",
            "$": "https://api.elsevier.com/content/object/eid/1-s2.0-S0926860X13006649-gr5.sml?httpAccept=%2A%2F%2A",
            "@multimediatype": "GIF image file",
            "@type": "IMAGE-THUMBNAIL",
            "@size": "3977",
            "@ref": "gr5",
            "@mimetype": "image/gif"
          },
          {
            "@category": "thumbnail",
            "@height": "164",
            "@width": "91",
            "@_fa": "true",
            "$": "https://api.elsevier.com/content/object/eid/1-s2.0-S0926860X13006649-gr4.sml?httpAccept=%2A%2F%2A",
            "@multimediatype": "GIF image file",
            "@type": "IMAGE-THUMBNAIL",
            "@size": "4464",
            "@ref": "gr4",
            "@mimetype": "image/gif"
          },
          {
            "@category": "thumbnail",
            "@height": "164",
            "@width": "193",
            "@_fa": "true",
            "$": "https://api.elsevier.com/content/object/eid/1-s2.0-S0926860X13006649-gr3.sml?httpAccept=%2A%2F%2A",
            "@multimediatype": "GIF image file",
            "@type": "IMAGE-THUMBNAIL",
            "@size": "4726",
            "@ref": "gr3",
            "@mimetype": "image/gif"
          },
          {
            "@category": "thumbnail",
            "@height": "164",
            "@width": "163",
            "@_fa": "true",
            "$": "https://api.elsevier.com/content/object/eid/1-s2.0-S0926860X13006649-gr2.sml?httpAccept=%2A%2F%2A",
            "@multimediatype": "GIF image file",
            "@type": "IMAGE-THUMBNAIL",
            "@size": "4368",
            "@ref": "gr2",
            "@mimetype": "image/gif"
          },
          {
            "@category": "thumbnail",
            "@height": "163",
            "@width": "109",
            "@_fa": "true",
            "$": "https://api.elsevier.com/content/object/eid/1-s2.0-S0926860X13006649-gr1.sml?httpAccept=%2A%2F%2A",
            "@multimediatype": "GIF image file",
            "@type": "IMAGE-THUMBNAIL",
            "@size": "3604",
            "@ref": "gr1",
            "@mimetype": "image/gif"
          },
          {
            "@category": "thumbnail",
            "@height": "85",
            "@width": "219",
            "@_fa": "true",
            "$": "https://api.elsevier.com/content/object/eid/1-s2.0-S0926860X13006649-fx1.sml?httpAccept=%2A%2F%2A",
            "@multimediatype": "GIF image file",
            "@type": "IMAGE-THUMBNAIL",
            "@size": "2987",
            "@ref": "fx1",
            "@mimetype": "image/gif"
          }
        ]
      },
      "link": {
        "@rel": "abstract",
        "@href": "https://api.elsevier.com/content/abstract/scopus_id/84898901466"
      }
    }
  }
}