{
  "metadata": {
    "title": "Zirconium-tin phosphate as an efficient catalyst for renewable p-xylene synthesis from biobased 2,5-dimethylfuran and ethylene",
    "authors": "; ; ",
    "journal": "Applied Catalysis A: General",
    "date": "2024-01-25",
    "doi": "10.1016/j.apcata.2023.119521",
    "abstract": "",
    "uri": "https://api.elsevier.com/content/article/pii/S0926860X2300501X",
    "pii": "S0926860X2300501X"
  },
  "fulltext": {
    "full-text-retrieval-response": {
      "scopus-eid": "2-s2.0-85178567713",
      "originalText": "serial JL 271346 291210 291744 291809 31 Applied Catalysis A: General APPLIEDCATALYSISAGENERAL 2023-11-29 2023-11-29 2023-12-02 2023-12-02 2024-01-19T20:53:16 1-s2.0-S0926860X2300501X S0926-860X(23)00501-X S0926860X2300501X 10.1016/j.apcata.2023.119521 S300 S300.1 FULL-TEXT 1-s2.0-S0926860X23X00210 2024-01-19T21:05:05.023404Z 0 0 20240125 2024 2023-11-29T13:20:28.812797Z absattachment articleinfo articlenumber articletitlenorm authfirstinitialnorm authfirstsurnamenorm cid cids contenttype copyright crossmark dateloaded dateloadedtxt datesearch datesort dateupdated dco docsubtype doctype doi eid ewtransactionid hubeid indexeddate issn issnnorm itemstage itemtransactionid itemweight openaccess openarchive pg pgfirst pii piinorm pubdatestart pubdatetxt pubyr sortorder srctitle srctitlenorm srctype ssids alllist content subj subheadings suppl tomb volfirst volissue volumelist webpdf webpdfpagecount yearnav figure table e-component body mmlmath acknowledge affil appendices articletitle auth authfirstini authfull authkeywords authlast grantnumber grantsponsor grantsponsorid highlightsabst primabst ref specialabst 0926-860X 0926860X true 670 670 C Volume 670 6 119521 119521 119521 20240125 25 January 2024 2024-01-25 2024 article fla © 2023 Elsevier B.V. All rights reserved. ZIRCONIUMTINPHOSPHATEEFFICIENTCATALYSTFORRENEWABLEPXYLENESYNTHESISBIOBASED25DIMETHYLFURANETHYLENE WU C 1 Introduction 2 Experimental 2.1 Materials 2.2 Catalyst synthesis 2.3 Catalyst characterization 2.4 Catalyst tests 3 Results and discussion 3.1 Characterization of the catalysts 3.2 Catalytic activity 3.3 Optimization of reaction conditions 3.4 Kinetic analysis 3.5 Catalyst stability 3.6 Surface reaction mechanism 4 Conclusion CRediT authorship contribution statement Acknowledgments Appendix A Supplementary material References CHAKINALA 2021 5331 5351 N CHO 2017 398 402 H LIN 2021 11270 11292 L LYONS 2012 15708 15711 T MANEFFA 2016 2736 2748 A LIN 2014 10688 10699 Z LIN 2013 2079 2087 Z RAVASCO 2021 3047 3053 J LI 2022 1902 1921 Z DO 2013 41 46 P PATET 2015 2367 2375 R FENG 2017 5540 5549 X SONG 2016 134 141 S ROHLING 2018 760 769 R KIM 2017 490 500 J WIJAYA 2017 167 175 Y FENG 2017 5852 5859 X YIN 2017 1891 1899 J ZHAO 2018 3803 3811 R KIM 2021 1074 1085 H ZHAO 2019 5676 5685 R FENG 2021 214 223 X CHANG 2016 1368 1376 C MA 2023 200 213 D WU 2022 4458 4469 C SHIVHARE 2021 3818 3841 A LIU 2021 1353 1360 X BASHIR 2020 22353 22397 A XU 2019 8931 8942 H MIAO 2018 145 157 Z FENG 2019 118108 118120 X KASIPANDI 2020 10 20 S FANG 2023 121936 121946 W WU 2022 108073 108081 Y CHANDANE 2022 1 18 W ORDOMSKY 2013 37 46 V THOMMES 2015 1051 1069 M WEINGARTEN 2013 123 134 R LIU 2023 588 601 D HOU 2018 183 193 Q WANG 2015 4410 4421 X NIKBIN 2013 35 43 N YUAN 2005 647 654 Z SINHAMAHAPATRA 2010 22 30 A SEGAWA 1986 81 89 K GUO 2022 10157 10168 W BHATTACHARYYA 2009 5917 5928 K GAO 2020 2449 2454 Z RAWAT 2022 134130 134141 S WILLIAMS 2016 178 187 C YU 2016 5729 5736 J WU 2023 119323 119334 C PATET 2017 13666 13679 R CUI 2020 115942 115950 Z WUX2024X119521 WUX2024X119521XC 2025-12-02T00:00:00.000Z 2025-12-02T00:00:00.000Z http://creativecommons.org/licenses/by-nc-nd/4.0/ © 2023 Elsevier B.V. All rights reserved. 2023-12-07T03:58:04.392Z http://vtw.elsevier.com/data/voc/AddOnTypes/50.7/aggregated-refined Fundamental Research Funds for the Central Universities 2020CBLZ004 Fundamental Research Funds for the Central Universities http://data.elsevier.com/vocabulary/SciValFunders/501100012226 http://sws.geonames.org/1814991/ Hubei Provincial Department of Education of China Q20193101 Hubei Provincial Department of Education http://data.elsevier.com/vocabulary/SciValFunders/100012554 http://sws.geonames.org/1814991/ National Natural Science Foundation of China 22178212 NSFC National Natural Science Foundation of China http://data.elsevier.com/vocabulary/SciValFunders/501100001809 http://sws.geonames.org/1814991/ This work was financially supported by the National Natural Science Foundation of China ( 22178212 ), the Fundamental Research Funds for the Central Universities ( 2020CBLZ004 ) and the Science and Technology Research Project of Hubei Provincial Department of Education of China ( Q20193101 ). https://doi.org/10.15223/policy-017 https://doi.org/10.15223/policy-037 https://doi.org/10.15223/policy-012 https://doi.org/10.15223/policy-029 https://doi.org/10.15223/policy-004 item S0926-860X(23)00501-X S0926860X2300501X 1-s2.0-S0926860X2300501X 10.1016/j.apcata.2023.119521 271346 2024-01-19T21:05:05.023404Z 2024-01-25 1-s2.0-S0926860X2300501X-main.pdf https://s3-eu-west-1.amazonaws.com/prod-ucs-content-store-eu-west/content/pii:S0926860X2300501X/MAIN/application/pdf/11aa881078af10351359c14773fcbb05/main.pdf main.pdf pdf true 13268073 MAIN 12 1-s2.0-S0926860X2300501X-main_1.png https://s3-eu-west-1.amazonaws.com/prod-ucs-content-store-eu-west/content/pii:S0926860X2300501X/PREVIEW/image/png/1c5cb36e39249192da8f2cc0edbd85c6/main_1.png main_1.png png 59927 849 656 IMAGE-WEB-PDF 1 1-s2.0-S0926860X2300501X-fx1.jpg https://s3-eu-west-1.amazonaws.com/prod-ucs-content-store-eu-west/content/pii:S0926860X2300501X/fx1/DOWNSAMPLED/image/jpeg/74b7d39204a0acd0e85f467b74df1f46/fx1.jpg fx1 fx1.jpg jpg 12459 76 678 IMAGE-DOWNSAMPLED 1-s2.0-S0926860X2300501X-ga1.jpg https://s3-eu-west-1.amazonaws.com/prod-ucs-content-store-eu-west/content/pii:S0926860X2300501X/ga1/DOWNSAMPLED/image/jpeg/614c26715353505bf824c1f6ffa02c34/ga1.jpg ga1 true ga1.jpg jpg 28755 200 359 IMAGE-DOWNSAMPLED 1-s2.0-S0926860X2300501X-gr9.jpg https://s3-eu-west-1.amazonaws.com/prod-ucs-content-store-eu-west/content/pii:S0926860X2300501X/gr9/DOWNSAMPLED/image/jpeg/a92fc1e2eefba65fc862707204cb35a1/gr9.jpg gr9 gr9.jpg jpg 77236 530 678 IMAGE-DOWNSAMPLED 1-s2.0-S0926860X2300501X-gr8.jpg https://s3-eu-west-1.amazonaws.com/prod-ucs-content-store-eu-west/content/pii:S0926860X2300501X/gr8/DOWNSAMPLED/image/jpeg/2206d2b321db98fb243fad1d4543b522/gr8.jpg gr8 gr8.jpg jpg 51964 281 678 IMAGE-DOWNSAMPLED 1-s2.0-S0926860X2300501X-gr5.jpg https://s3-eu-west-1.amazonaws.com/prod-ucs-content-store-eu-west/content/pii:S0926860X2300501X/gr5/DOWNSAMPLED/image/jpeg/c4db6710239cc2ac6682fc6a4a44f531/gr5.jpg gr5 gr5.jpg jpg 39300 262 678 IMAGE-DOWNSAMPLED 1-s2.0-S0926860X2300501X-gr4.jpg https://s3-eu-west-1.amazonaws.com/prod-ucs-content-store-eu-west/content/pii:S0926860X2300501X/gr4/DOWNSAMPLED/image/jpeg/fd4393d91ab9f644c7a1c3f8bbe95d39/gr4.jpg gr4 gr4.jpg jpg 64694 280 751 IMAGE-DOWNSAMPLED 1-s2.0-S0926860X2300501X-gr7.jpg https://s3-eu-west-1.amazonaws.com/prod-ucs-content-store-eu-west/content/pii:S0926860X2300501X/gr7/DOWNSAMPLED/image/jpeg/d28690acaceca05f2856ff8dc1716fc0/gr7.jpg gr7 gr7.jpg jpg 33662 285 678 IMAGE-DOWNSAMPLED 1-s2.0-S0926860X2300501X-gr6.jpg https://s3-eu-west-1.amazonaws.com/prod-ucs-content-store-eu-west/content/pii:S0926860X2300501X/gr6/DOWNSAMPLED/image/jpeg/f5e313d1ea3050f7ff936402c9b822d4/gr6.jpg gr6 gr6.jpg jpg 106628 538 678 IMAGE-DOWNSAMPLED 1-s2.0-S0926860X2300501X-gr1.jpg https://s3-eu-west-1.amazonaws.com/prod-ucs-content-store-eu-west/content/pii:S0926860X2300501X/gr1/DOWNSAMPLED/image/jpeg/17bbfd55b614a48f2c4fda5c35c340a2/gr1.jpg gr1 gr1.jpg jpg 62463 238 678 IMAGE-DOWNSAMPLED 1-s2.0-S0926860X2300501X-gr3.jpg https://s3-eu-west-1.amazonaws.com/prod-ucs-content-store-eu-west/content/pii:S0926860X2300501X/gr3/DOWNSAMPLED/image/jpeg/1e2c8b1542d23acabd871137fe50371b/gr3.jpg gr3 gr3.jpg jpg 113018 535 678 IMAGE-DOWNSAMPLED 1-s2.0-S0926860X2300501X-gr2.jpg https://s3-eu-west-1.amazonaws.com/prod-ucs-content-store-eu-west/content/pii:S0926860X2300501X/gr2/DOWNSAMPLED/image/jpeg/3f5cbca752e56f6afff2473fb79b5890/gr2.jpg gr2 gr2.jpg jpg 120448 421 751 IMAGE-DOWNSAMPLED 1-s2.0-S0926860X2300501X-sc2.jpg https://s3-eu-west-1.amazonaws.com/prod-ucs-content-store-eu-west/content/pii:S0926860X2300501X/sc2/DOWNSAMPLED/image/jpeg/6e17f398874033d5633385773a3dbfcc/sc2.jpg sc2 sc2.jpg jpg 39533 292 678 IMAGE-DOWNSAMPLED 1-s2.0-S0926860X2300501X-sc1.jpg https://s3-eu-west-1.amazonaws.com/prod-ucs-content-store-eu-west/content/pii:S0926860X2300501X/sc1/DOWNSAMPLED/image/jpeg/8ae8f53380c688ecbfd95f32255eb66b/sc1.jpg sc1 sc1.jpg jpg 65128 480 678 IMAGE-DOWNSAMPLED 1-s2.0-S0926860X2300501X-fx1.sml https://s3-eu-west-1.amazonaws.com/prod-ucs-content-store-eu-west/content/pii:S0926860X2300501X/fx1/THUMBNAIL/image/gif/f67e085b56e977797c9618ca170050a9/fx1.sml fx1 fx1.sml sml 1718 25 219 IMAGE-THUMBNAIL 1-s2.0-S0926860X2300501X-ga1.sml https://s3-eu-west-1.amazonaws.com/prod-ucs-content-store-eu-west/content/pii:S0926860X2300501X/ga1/THUMBNAIL/image/gif/06a81cef30a24025555d0aca13e60ae6/ga1.sml ga1 true ga1.sml sml 20902 122 219 IMAGE-THUMBNAIL 1-s2.0-S0926860X2300501X-gr9.sml https://s3-eu-west-1.amazonaws.com/prod-ucs-content-store-eu-west/content/pii:S0926860X2300501X/gr9/THUMBNAIL/image/gif/8f33eb18040d9abc068413215e0b9dc4/gr9.sml gr9 gr9.sml sml 10383 164 210 IMAGE-THUMBNAIL 1-s2.0-S0926860X2300501X-gr8.sml https://s3-eu-west-1.amazonaws.com/prod-ucs-content-store-eu-west/content/pii:S0926860X2300501X/gr8/THUMBNAIL/image/gif/ca61d4daab88ab0617cbaaf2e299ebc2/gr8.sml gr8 gr8.sml sml 7925 91 219 IMAGE-THUMBNAIL 1-s2.0-S0926860X2300501X-gr5.sml https://s3-eu-west-1.amazonaws.com/prod-ucs-content-store-eu-west/content/pii:S0926860X2300501X/gr5/THUMBNAIL/image/gif/c9fce951087d47fd0e7be70bf1fea8dd/gr5.sml gr5 gr5.sml sml 5819 85 219 IMAGE-THUMBNAIL 1-s2.0-S0926860X2300501X-gr4.sml https://s3-eu-west-1.amazonaws.com/prod-ucs-content-store-eu-west/content/pii:S0926860X2300501X/gr4/THUMBNAIL/image/gif/13d706eda50f31ab9b3c2c7a0ce52a55/gr4.sml gr4 gr4.sml sml 8711 82 219 IMAGE-THUMBNAIL 1-s2.0-S0926860X2300501X-gr7.sml https://s3-eu-west-1.amazonaws.com/prod-ucs-content-store-eu-west/content/pii:S0926860X2300501X/gr7/THUMBNAIL/image/gif/0c0bd9489f19cfcaadaffd38ec9b4afe/gr7.sml gr7 gr7.sml sml 4813 92 219 IMAGE-THUMBNAIL 1-s2.0-S0926860X2300501X-gr6.sml https://s3-eu-west-1.amazonaws.com/prod-ucs-content-store-eu-west/content/pii:S0926860X2300501X/gr6/THUMBNAIL/image/gif/92fae6e3e8ae7846ee2053f49de10cbb/gr6.sml gr6 gr6.sml sml 17001 164 206 IMAGE-THUMBNAIL 1-s2.0-S0926860X2300501X-gr1.sml https://s3-eu-west-1.amazonaws.com/prod-ucs-content-store-eu-west/content/pii:S0926860X2300501X/gr1/THUMBNAIL/image/gif/9d6a2f418dd4ae6f47b297e4da8a759b/gr1.sml gr1 gr1.sml sml 8324 77 219 IMAGE-THUMBNAIL 1-s2.0-S0926860X2300501X-gr3.sml https://s3-eu-west-1.amazonaws.com/prod-ucs-content-store-eu-west/content/pii:S0926860X2300501X/gr3/THUMBNAIL/image/gif/ab54e42e4c2b83eb0baf1d0b2e3fca69/gr3.sml gr3 gr3.sml sml 14099 164 208 IMAGE-THUMBNAIL 1-s2.0-S0926860X2300501X-gr2.sml https://s3-eu-west-1.amazonaws.com/prod-ucs-content-store-eu-west/content/pii:S0926860X2300501X/gr2/THUMBNAIL/image/gif/bf83b005253f9c3f370f506251e91885/gr2.sml gr2 gr2.sml sml 19758 123 219 IMAGE-THUMBNAIL 1-s2.0-S0926860X2300501X-sc2.sml https://s3-eu-west-1.amazonaws.com/prod-ucs-content-store-eu-west/content/pii:S0926860X2300501X/sc2/THUMBNAIL/image/gif/01ec8ad6449408ed591535855962118a/sc2.sml sc2 sc2.sml sml 5066 94 219 IMAGE-THUMBNAIL 1-s2.0-S0926860X2300501X-sc1.sml https://s3-eu-west-1.amazonaws.com/prod-ucs-content-store-eu-west/content/pii:S0926860X2300501X/sc1/THUMBNAIL/image/gif/e94c1100c67ecb59769bd871d6d554a6/sc1.sml sc1 sc1.sml sml 7898 155 219 IMAGE-THUMBNAIL 1-s2.0-S0926860X2300501X-fx1_lrg.jpg https://s3-eu-west-1.amazonaws.com/prod-ucs-content-store-eu-west/content/pii:S0926860X2300501X/HIGHRES/image/jpeg/e3183b60f4a2997dae52e0a284488baa/fx1_lrg.jpg fx1 fx1_lrg.jpg jpg 62598 335 2994 IMAGE-HIGH-RES 1-s2.0-S0926860X2300501X-ga1_lrg.jpg https://s3-eu-west-1.amazonaws.com/prod-ucs-content-store-eu-west/content/pii:S0926860X2300501X/HIGHRES/image/jpeg/dffe761542f408e517ce034b755757bb/ga1_lrg.jpg ga1 true ga1_lrg.jpg jpg 310975 886 1591 IMAGE-HIGH-RES 1-s2.0-S0926860X2300501X-gr9_lrg.jpg https://s3-eu-west-1.amazonaws.com/prod-ucs-content-store-eu-west/content/pii:S0926860X2300501X/HIGHRES/image/jpeg/d56be73db0ff3a25ab51dea5600a3783/gr9_lrg.jpg gr9 gr9_lrg.jpg jpg 447057 2340 2994 IMAGE-HIGH-RES 1-s2.0-S0926860X2300501X-gr8_lrg.jpg https://s3-eu-west-1.amazonaws.com/prod-ucs-content-store-eu-west/content/pii:S0926860X2300501X/HIGHRES/image/jpeg/65cc6081a3edbce928ea0f88e8171010/gr8_lrg.jpg gr8 gr8_lrg.jpg jpg 384734 1242 2994 IMAGE-HIGH-RES 1-s2.0-S0926860X2300501X-gr5_lrg.jpg https://s3-eu-west-1.amazonaws.com/prod-ucs-content-store-eu-west/content/pii:S0926860X2300501X/HIGHRES/image/jpeg/a7802416c92f0a547a6f13b9999d1ae7/gr5_lrg.jpg gr5 gr5_lrg.jpg jpg 236667 1156 2994 IMAGE-HIGH-RES 1-s2.0-S0926860X2300501X-gr4_lrg.jpg https://s3-eu-west-1.amazonaws.com/prod-ucs-content-store-eu-west/content/pii:S0926860X2300501X/HIGHRES/image/jpeg/963116e6a9401cd1cebad63490ee33cd/gr4_lrg.jpg gr4 gr4_lrg.jpg jpg 354136 1240 3326 IMAGE-HIGH-RES 1-s2.0-S0926860X2300501X-gr7_lrg.jpg https://s3-eu-west-1.amazonaws.com/prod-ucs-content-store-eu-west/content/pii:S0926860X2300501X/HIGHRES/image/jpeg/e3d398ebfa1ae3c06f752f05192a1d60/gr7_lrg.jpg gr7 gr7_lrg.jpg jpg 190721 1257 2994 IMAGE-HIGH-RES 1-s2.0-S0926860X2300501X-gr6_lrg.jpg https://s3-eu-west-1.amazonaws.com/prod-ucs-content-store-eu-west/content/pii:S0926860X2300501X/HIGHRES/image/jpeg/1951066afcbd1990ede21301eea87c66/gr6_lrg.jpg gr6 gr6_lrg.jpg jpg 874864 2377 2994 IMAGE-HIGH-RES 1-s2.0-S0926860X2300501X-gr1_lrg.jpg https://s3-eu-west-1.amazonaws.com/prod-ucs-content-store-eu-west/content/pii:S0926860X2300501X/HIGHRES/image/jpeg/9f856004f257d576c9ea66aa9a03fa45/gr1_lrg.jpg gr1 gr1_lrg.jpg jpg 341979 1049 2994 IMAGE-HIGH-RES 1-s2.0-S0926860X2300501X-gr3_lrg.jpg https://s3-eu-west-1.amazonaws.com/prod-ucs-content-store-eu-west/content/pii:S0926860X2300501X/HIGHRES/image/jpeg/02cb67a459d5a7c1a938d6b6f0ef0e39/gr3_lrg.jpg gr3 gr3_lrg.jpg jpg 616236 2362 2994 IMAGE-HIGH-RES 1-s2.0-S0926860X2300501X-gr2_lrg.jpg https://s3-eu-west-1.amazonaws.com/prod-ucs-content-store-eu-west/content/pii:S0926860X2300501X/HIGHRES/image/jpeg/923ebf99f9f86f0fe1f74411e696d557/gr2_lrg.jpg gr2 gr2_lrg.jpg jpg 787259 1864 3326 IMAGE-HIGH-RES 1-s2.0-S0926860X2300501X-sc2_lrg.jpg https://s3-eu-west-1.amazonaws.com/prod-ucs-content-store-eu-west/content/pii:S0926860X2300501X/HIGHRES/image/jpeg/476223733cc784dc3027279973ab85ea/sc2_lrg.jpg sc2 sc2_lrg.jpg jpg 216304 1290 2994 IMAGE-HIGH-RES 1-s2.0-S0926860X2300501X-sc1_lrg.jpg https://s3-eu-west-1.amazonaws.com/prod-ucs-content-store-eu-west/content/pii:S0926860X2300501X/HIGHRES/image/jpeg/9c0fd77e18cfac7a72a712be2ab5c34a/sc1_lrg.jpg sc1 sc1_lrg.jpg jpg 346587 2121 2994 IMAGE-HIGH-RES 1-s2.0-S0926860X2300501X-mmc1.docx https://s3-eu-west-1.amazonaws.com/prod-ucs-content-store-eu-west/content/pii:S0926860X2300501X/mmc1/MAIN/application/vnd.openxmlformats-officedocument.wordprocessingml.document/f37924f1494089c7fc03558207bca02f/mmc1.docx mmc1 mmc1.docx docx 2233856 APPLICATION 1-s2.0-S0926860X2300501X-si0001.svg https://s3-eu-west-1.amazonaws.com/prod-ucs-content-store-eu-west/content/pii:S0926860X2300501X/image/svg+xml/fbdd7462869e5fc3afafcfb3ff8bb140/si0001.svg si0001 si0001.svg svg 3983 ALTIMG 1-s2.0-S0926860X2300501X-si0002.svg https://s3-eu-west-1.amazonaws.com/prod-ucs-content-store-eu-west/content/pii:S0926860X2300501X/image/svg+xml/4bb3f308d5507eacf505f8f95d9eda8d/si0002.svg si0002 si0002.svg svg 3788 ALTIMG 1-s2.0-S0926860X2300501X-si0003.svg https://s3-eu-west-1.amazonaws.com/prod-ucs-content-store-eu-west/content/pii:S0926860X2300501X/image/svg+xml/c364084392a2f89352ed3952d9fe3115/si0003.svg si0003 si0003.svg svg 3886 ALTIMG 1-s2.0-S0926860X2300501X-si0004.svg https://s3-eu-west-1.amazonaws.com/prod-ucs-content-store-eu-west/content/pii:S0926860X2300501X/image/svg+xml/1a76af5837bf93b9e8be38cb473bf806/si0004.svg si0004 si0004.svg svg 1247 ALTIMG 1-s2.0-S0926860X2300501X-si0005.svg https://s3-eu-west-1.amazonaws.com/prod-ucs-content-store-eu-west/content/pii:S0926860X2300501X/image/svg+xml/9867c68a65c7fc1f06c94a99030d7a39/si0005.svg si0005 si0005.svg svg 1268 ALTIMG 1-s2.0-S0926860X2300501X-si0006.svg https://s3-eu-west-1.amazonaws.com/prod-ucs-content-store-eu-west/content/pii:S0926860X2300501X/image/svg+xml/551ae06b80d7eb8e98286eef80ffa418/si0006.svg si0006 si0006.svg svg 1247 ALTIMG 1-s2.0-S0926860X2300501X-si0007.svg https://s3-eu-west-1.amazonaws.com/prod-ucs-content-store-eu-west/content/pii:S0926860X2300501X/image/svg+xml/551ae06b80d7eb8e98286eef80ffa418/si0007.svg si0007 si0007.svg svg 1247 ALTIMG 1-s2.0-S0926860X2300501X-am.pdf https://s3-eu-west-1.amazonaws.com/prod-ucs-content-store-eu-west/content/egi:10D07013R3V/MAIN/application/pdf/f7a791c5036bc93ac454f4a185533818/am.pdf am am.pdf pdf false 2516779 AAM-PDF APCATA 119521 119521 S0926-860X(23)00501-X 10.1016/j.apcata.2023.119521 Elsevier B.V. Fig. 1 X-ray diffraction patterns (a) and FT-IR spectra (b) of the zirconium-tin phosphate catalysts. Fig. 1 Fig. 2 TEM images of (a) ZrP, (b) Zr0.6Sn0.4P, (c) Zr0.5Sn0.5P, (d) Zr0.4Sn0.6P and (e) SnP. (f) HAADF-STEM image and (g-j) corresponding EDS elemental mappings of Zr0.6Sn0.4P. Fig. 2 Fig. 3 XPS profiles of the zirconium-tin phosphate catalysts: (a) survey scan, (b) Zr 3d, (c) Sn 3d and (d) P2p. Fig. 3 Fig. 4 NH3-TPD profiles (a and b) and FT-IR spectra for adsorbed pyridine (c) of the catalysts. Fig. 4 Fig. 5 C2H4-TPD (a) and DMF-TPD (b) curves of the zirconium-tin phosphate catalysts. Fig. 5 Fig. 6 Effect of reaction conditions on the catalytic performance of Zr0.6Sn0.4P. Reaction conditions: DMF, 1.92 g; n-decane, 16.70 g; stirring speed, 800 rpm; (a) catalyst, 2.5 wt% DMF; 4 MPa C2H4; 4 h; (b) catalyst, 2.5 wt% DMF; 260 °C, 4 h; (c) 4 MPa C2H4, 260 °C, 4 h; (d) catalyst, 2.5 wt% DMF; 260 °C; 4 MPa C2H4. Fig. 6 Fig. 7 Variation in the production of PX with time at different reaction temperatures over Zr0.6Sn0.4P (a), Arrhenius plot (b). Reaction conditions: DMF, 1.92 g; n-decane 16.70 g; acid site concentration, 1.0 mM; 4 MPa C2H4; stirring speed, 800 rpm. Fig. 7 Fig. 8 Heterogeneity (a) and reusability (b) of Zr0.6Sn0.4P. Reaction conditions: DMF, 1.92 g; n-decane, 16.70 g; catalyst, 2.5 wt% DMF; 4 MPa C2H4; 260 °C; stirring speed, 800 rpm; 4 h (b). Fig. 8 Fig. 9 The desorption curves of DMF (a), ethylene (b) and the products (PX, HDO, CH, AP and CP) (c-d) on the Zr0.6Sn0.4P catalyst in the TPSR-DMF-C2H4 and TPSR-C2H4-DMF process. Fig. 9 Scheme 1 Reaction pathway for the conversion of DMF and ethylene to PX. L acid: Lewis acid sites, B acid: Brønsted acid sites. Scheme 1 Scheme 2 Reaction mechanism for the conversion of DMF and ethylene to PX over Zr0.6Sn0.4P. Scheme 2 Table 1 Compositions and textural parameters of the zirconium-tin phosphate catalysts. Table 1 Catalyst Zr/Sn mole ratio a SBET (m2/g) Smicro (m2/g) VPore (cm3/g) Vmicro (cm3/g) D (nm) ZrP - 411 9 0.70 0.0030 7.8 Zr0.6Sn0.4P 1.48 302 6 0.65 0.0019 5.0 Zr0.5Sn0.5P 0.95 249 8 0.62 0.0031 5.1 Zr0.4Sn0.6P 0.59 217 8 0.70 0.0032 5.5 SnP - 169 1 0.48 0.0020 5.8 a Determined by XRF. Table 2 Acidic properties of the zirconium-tin phosphate catalysts. Table 2 Catalyst Acidic sites a (μmol/g) S/ (W+M) b L/B c Weak (W) Moderate (M) Strong (S) Total (T) ZrP 527 696 834 2057 0.68 1.03 Zr0.6Sn0.4P 351 508 656 1515 0.76 1.26 Zr0.5Sn0.5P 342 468 547 1357 0.68 1.08 Zr0.4Sn0.6P 334 426 473 1232 0.62 0.99 SnP 211 287 609 1107 1.22 1.68 a Acidic site numbers were calculated from NH3-TPD results. b The S/(W+M) is the ratio of the strong acid sites to the sum of weak and moderate acid sites. c The ratio of L/B were obtained from pyridine adsorbed FT-IR results. Table 3 Catalytic performance of various catalysts in the conversion of DMF to PX. a . Table 3 Image 1 Catalyst XDMF (%) YPX (%) Selectivity b (%) PX Productivity c (mmolPX·gcat·h−1) PX AP CH HDO CP DM Others Blank ˂1 - - - - - - - - - ZrP 86 73.5 85.5 0.8 1.1 0.7 3.0 0.6 8.3 276.5 Zr0.6Sn0.4P 85 77.3 90.9 0.9 0.9 0.8 0.3 1.0 5.2 325.6 Zr0.5Sn0.5P 83 74.2 89.4 1.0 0.8 0.8 0.4 1.0 6.6 278.5 Zr0.4Sn0.6P 79 70.0 88.6 1.2 0.8 0.9 0.3 1.1 7.1 252.9 SnP 68 52.5 77.2 3.2 1.5 0.2 0 0.8 17.1 163.2 Zr0.6Ce0.4P 87 75.2 86.4 1.0 1.4 0.6 2.6 0.5 7.5 285.5 Zr0.6Al0.4P 89 67.4 75.7 0.9 4.5 0.2 3.7 0.5 14.5 206.3 Zr0.6Ti0.4P 85 74.3 87.4 1.3 1.8 0.9 1.8 0.6 6.2 282.9 a Reaction conditions: DMF, 1.92 g; n-decane, 16.70 g; catalyst, 2 wt% DMF; 4 MPa C2H4; 250 °C for 4 h; stirring speed, 800 rpm. b PX: p-xylene; AP: 1-methyl-4-propylbenzene; CH: 1,4-dimethyl-7-oxabicyclo[2.2.1]hept-2-ene; HDO: 2,5-hexanedione; CP: 3-methyl-2-cyclopentenone; DM: dimers; Others: unknown byproducts. c PX productivity is defined as (mmol of formed PX)/(catalyst amount ×time) at 0.5 h for the reaction. Zirconium-tin phosphate as an efficient catalyst for renewable p-xylene synthesis from biobased 2,5-dimethylfuran and ethylene Chengming Wu Data curation Investigation Writing – original draft a b Hongbo Chen Data curation a Jifan Li Writing – review & editing a Chun-Ling Liu Funding acquisition Writing – review & editing a ⁎ Wen-Sheng Dong Data curation Supervision Writing – review & editing Funding acquisition a ⁎ a Key Laboratory of Applied Surface and Colloid Chemistry (SNNU), MOE, School of Chemistry and Chemical Engineering, Shaanxi Normal University, Xi’an 710062, China Key Laboratory of Applied Surface and Colloid Chemistry (SNNU), MOE, School of Chemistry and Chemical Engineering, Shaanxi Normal University Xi’an 710062 China Key Laboratory of Applied Surface and Colloid Chemistry (SNNU), MOE, School of Chemistry and Chemical Engineering, Shaanxi Normal University, Xi’an 710062, China b School of Chemistry and Environmental Engineering, Hanjiang Normal University, Shiyan 442000, China School of Chemistry and Environmental Engineering, Hanjiang Normal University Shiyan 442000 China School of Chemistry and Environmental Engineering, Hanjiang Normal University, Shiyan 442000, China ⁎ Corresponding authors. Efficient production of renewable p-xylene (PX) from bio-based 2,5-dimethylfuran (DMF) and ethylene is challenging. Herein, novel nanoflake-like zirconium-tin phosphate catalysts were synthesized, and their catalytic performance was evaluated in the conversion of DMF and ethylene to PX. The DMF conversion, PX selectivity and PX yield reached up to 99%, 95.2% and 94.2%, respectively over Zr0.6Sn0.4P under relatively mild conditions. The PX productivity was 61.1 mmolPX·gcat −1·h−1, which is better than that of previously reported catalysts. By combining characterization with activity test, it was found that enhanced DMF and ethylene adsorption is beneficial to promoting the reaction between DMF and ethylene. Precise regulation of acid sites is crucial for inhibiting the occurrence of side reactions and improving the selectivity of PX. The kinetic analysis revealed that Zr0.6Sn0.4P had a relatively low apparent activation energy (39 kJ·mol−1) for this reaction than previously reported catalysts. In addition, the Zr0.6Sn0.4P catalyst exhibited an excellent reusability. Graphical Abstract ga1 Keywords Biomass 2,5-Dimethylfuran Zirconium-tin phosphate Reaction mechanism p-Xylene Data Availability Data will be made available on request. 1 Introduction p-Xylene (PX), as an important raw material for the preparation of terephthalic acid (PTA) and polyethylene terephthalate (PET), has received great attention because of its increasing demand (6–8% per year) [1,2]. Currently, PX is mainly produced through the catalytic reforming and cracking of non-renewable petroleum [2]. To alleviate environmental problems and achieve sustainable development, the production of PX and its derivatives from biomass resources instead of traditional fossil feedstocks has great attraction in the areas of renewable biomass conversion and green chemistry [3]. Although significant progress has been made in the production of PX through catalytic conversion of cellulose derivatives (bio-ethanol and bio-isobutanol) or pyrolysis (or reforming) of biomass materials, all of these processes suffer from disadvantages, such as low PX yields (40%), requiring complex multi-step reaction pathways, and more energy consumption for PX separation and purification [4–7]. Recently, the synthesis of renewable PX using bio-based 2,5-dimethylfuran (DMF) and ethylene as raw materials has attained much attention [8,9]. However, the exploitation of highly efficient solid acid catalysts for the preparation of PX from DMF and ethylene with desired yields is a great challenge because of the tandem reaction including Diels-Alder reaction and dehydration reaction as well as inevitable side reactions to form byproducts and undetectable oligomers ( Scheme 1) [10–14]. Especially for solid acid catalysts with high acid strength, side reactions such as PX alkylation, DMF hydrolysis and subsequent condensation, are prone to occur, which greatly reduces the PX selectivity, and accelerates the deactivation of the catalysts because of the deposition of oligomers on the surface. So far, various solid acid catalysts have been designed and applied to synthesize PX from DMF and ethylene [15–25]. For example, Kim et al. [15] reported that a PX yield of 75.8% was obtained using mesoporous ZSM-5 catalysts under 250 °C for 24 h. Wijaya et al. [16] reported that HPW/SiO2 and HSiW/SiO2 catalysts exhibited a high DMF conversion of 91–94% with a PX selectivity of 82–85%. Yin et al. [18] found that NbOx catalysts with a B/L ratio of 2.9 and large mesopores exhibited good catalytic activity, giving 87.2% DMF conversion and 76.3% PX yield, respectively at 250 °C for 6 h. Zhao et al. [19] prepared dealuminated H-Beta zeolite by treating the aluminum-rich H-Beta with HNO3 aqueous solution, and obtained a DMF conversion of 99% and a PX yield of 97% after reaction at 300 °C for 24 h. Jae et al. [20] found that phosphated TiO2 with abundant weak acid sites was more efficient to catalyze the transformation of DMF and ethylene into PX. Chang et al. [23] achieved 99% DMF conversion and 90.0% PX selectivity on Zr-BEA zeolite catalyst within 24 h at 250 °C. Most recently, Ma et al. [24] reported that a PX yield of 91.1% was obtained over SCM-36 zeolite at 250 °C for 24 h. Although remarkable progress has been achieved in the synthesis of PX from DMF and ethylene, unfortunately, most of these catalysts suffered from issues such as low PX yield or productivity and long reaction time. Therefore, the development of highly efficient solid acid catalysts with well-controlled quantity and strength of Brønsted and Lewis acid sites, and large mesoporosity is still urgently needed for synthesizing PX with high yield and productivity. Metal phosphates with large specific surface area, abundant mesopores, appropriate acidity, and good stability exhibit excellent catalytic performance for various biomass related chemical transformations [26–31]. Despite significant efforts in synthesizing highly active metal phosphates with controllable acidity and textural properties, their relatively low surface area and acid site concentration limit their application in the PX synthesis from DMF and ethylene [32]. Recently, Bae et al. [32] prepared a range of mesoporous zirconium phosphate (ZrP) grafted on the high specific area silicas to address the above challenges, a high PX yield (87.1%) was obtained on ZrP1.5-SBA at 250 °C for 24 h. In this work, we prepared a series of high specific area and mesoporous zirconium-tin phosphates using a simple hydrothermal method. By adjusting the doping amount of tin, the acidic properties of the catalysts and adsorption properties for the reactant molecules can be finely regulated. The optimized Zr0.6Sn0.4P catalyst showed excellent catalytic activity. In the presence of small amount of catalyst (2.5 wt% DMF), the DMF conversion and PX yield were 99% and 94.2% at 260 °C for 12 h, respectively. Furthermore, Zr0.6Sn0.4P catalyst can be easily regenerated by calcination and exhibited an excellent catalytic stability. 2 Experimental 2.1 Materials 2,5-hexanedione (HDO, 97%), 2.5-Dimethylfuran (DMF, 99%), p-xylene (PX, 99%), 1,4-dioxane (99%) and n-decane (99%) were bought from Aladdin (Shanghai, China). SnCl4·5 H2O (99%) was obtained from Macklin (Shanghai, China). NH4H2PO4 (99%), ZrOCl2·8 H2O (99%), AlCl3·6 H2O (97%), CeCl3·7 H2O (99%) and TiCl4 (98%) were provided by Sinopharm (Shanghai, China). Ethylene (99.5%) and nitrogen (99.99%) were supplied by Tenglong Chemical Co., Ltd (Xi'an, China). All the chemicals were used as received. 2.2 Catalyst synthesis The zirconium-tin phosphate catalysts were synthesized via a simple hydrothermal method. In a typical synthesis, 20 mmol mixed ZrOCl2·8 H2O and SnCl4·5 H2O were firstly dissolved in 40 ml deionized water. Then, the above solution was added dropwise to an aqueous solution of NH4H2PO4 (50 mmol in 20 ml deionized water) under vigorous stirring. After 6 h, the resulting sol solution was transferred into a Teflon-lined stainless steel autoclave (100 ml), followed by hydrothermal treatment at 100 °C for 24 h. Afterwards, the white precipitate was isolated by centrifuge, washed thoroughly with deionized water and ethanol, and then dried at 100 °C for 12 h. Finally, the power was calcined in static air at 500 °C (4 h) with a heating rate of 5 °C/min. The as-prepared catalysts were denoted as Zr1-x Sn x P (x = 0, 0.4, 0.5, 0.6 and 1). In addition, Zr0.6M0.4P catalysts (M = Al, Ti, Ce) were also prepared using the same procedure with the addition of different metal precursors. 2.3 Catalyst characterization X-ray diffraction (XRD) patterns were obtained on a Bruker D8 Advance X-ray diffractometer with Cu Kα radiation (tube voltage: 40 kV and tube current: 40 mA). Fourier transform infrared (FT-IR) spectra were acquired on a Thermo Fisher Nicolet IS10 spectrometer using the KBr pellet method. The metal contents of the catalysts were measured by the X-ray fluorescence spectrometer (Shimadzu XRF 1800). The textural properties of the catalysts were analyzed using an ASAP 2020 PLUS HD88 surface and porosity analyzer (Micromeritics, USA). The morphology of the catalysts was observed using a JEOL JSM-6010/LA schottky field emission scanning electron microscope (SEM) at 1 kV and a FEI Tecnai G2 F20 high-resolution transmission electron microscope (TEM) at 200 kV. High-angel annular dark-file scanning transmission electron microscopy (HAADF-STEM) and EDS mapping were obtained using an FEI Talos F200X at 200 kV. X-ray photoelectron spectroscopy (XPS) measurements were conducted using a Kratos Axis Ultra electron spectrometer with monochromated Al Kα radiation. Thermogravimetric analysis (TG) of the used catalyst was conducted on the TA-Q600SDT Thermogravimetric Analyzer from 30 to 800 °C with a ramp rate of 10 °C/min under a 100 ml/min air flow. The quantity and strength of acid sites on the catalysts were determined by temperature-programmed desorption of ammonia (NH3-TPD) using an AutoChem 2920 instrument (Micromeritics, American) equipped with a mass spectrometer (MS). The acidity properties of catalysts were identified by pyridine adsorption infrared spectroscopy on Nicolet IS10 spectrometer under vacuum at 150 °C (Thermo Fisher Scientific, American). The 31P solid-state NMR experiments were recorded on a Bruker Avance III HD 400WB spectrometer, and 31P chemical shifts were referenced using NH4H2PO4 (ADP) as an external reference (0.81 ppm). The adsorption properties of reactants (DMF and ethylene) on the catalysts surface were evaluated on an AutoChem 2920 instrument (equipped with a mass spectrometer) through the temperature-programmed desorption technique (TPD). About 50 mg catalyst was loaded in a quartz reactor and pretreated at 400 °C for 60 min in He. Subsequently, the reactor was cooled to 50 °C and ethylene was introduced for 30 min for C2H4-TPD; in the case of DMF-TPD, DMF vapor was introduced by 25 pulses using a steam generator. Then, the catalyst was purged with He flow for 30 min and then heated to 500 °C in He flow at a ramping rate of 10 °C/min. The temperature-programmed surface reaction (TPSR) of DMF and ethylene on the catalyst surface was also investigated using the same procedure, in which the DMF and ethylene were successively introduced onto the catalyst surface with different order. Finally, the products such as PX, HDO, CH, AP and CP were detected by a mass spectrometer. During the TPSR-DMF-C2H4 process, the DMF was firstly introduced, followed by ethylene. On the contrary, for the TPSR-C2H4-DMF process, the ethylene was firstly introduced, followed by DMF. 2.4 Catalyst tests All reactions were conducted in a 50 ml micro-autoclave reactor (Shanghai Rock Experimental Instrument Co., Ltd). For a typical run, the quantitative catalyst and DMF were loaded into the reactor with n-decane (16.7 g) as the solvent. The reactor was sealed, and the air inside the reactor was replaced with N2, followed by pressurization with 4 MPa ethylene. Afterward, the reaction mixture was heated to the predetermined temperature for the desired time at a stirring rate of 800 rpm. After the reaction, the reactor was quenched in an ice-water bath immediately. The catalyst was removed from the solution by centrifuge, and the liquid sample was analyzed by Agilent GC-7820A gas chromatography equipped with a flame ionization detector (FID). All samples were analyzed three times by the gas chromatography, and mean values were quoted as results. Furthermore, to check the reproducibility, some experiments were repeated three times, and the results (DMF conversion and PX selectivity) exhibited high consistency with a relative standard deviation less than 2%. The DMF conversion (X DMF), product selectivity (S i) and PX yield (Y PX) were calculated as follows: (1) X D M F = moles of converted DMF moles of initial DMF × 100 % (2) S i = moles of product i moles of converted DMF × 100 % (3) Y PX = moles of product PX moles of initial DMF × 100 % 3 Results and discussion 3.1 Characterization of the catalysts The compositions of the zirconium-tin phosphates were measured by XRF, and the results are presented in Table 1. The mole ratio of Zr to Sn is close to the theoretical value, suggesting that tin species were successfully incorporated into the zirconium phosphate. XRD patterns of the zirconium-tin phosphate catalysts ( Fig. 1a) show several broad, weak diffraction peaks, and no peaks from either zirconium or tin phosphate crystals were detected, suggesting that all of the catalysts are amorphous [29,33,34]. FT-IR spectra of the zirconium-tin phosphates are presented in Fig. 1b. Compared with ZrP, a new adsorption peak appears at 603 cm−1 for the zirconium-tin phosphates, which is caused by the vibration of the Sn-O bond [35]. The peak is intensified with the addition of tin, indicating an increase in the amount of Sn-O bonds. In addition, with the addition of tin in the zirconium-tin phosphates, the peak value of asymmetric P-O-M stretching vibration shifts from 1085 cm−1 for ZrP to 1022 cm−1 for Zr0.4Sn0.6P, which could be caused by the high electronegativity of tin [27,36]. The incorporation of tin species in the zirconium phosphate framework enhances the polarity of P-O-M bonds and then reduces the vibration frequency of P-O-M. The enhancement of P-O-M bond polarity contributes to improve the Lewis acid strength of metal species [22,36]. The N2 adsorption-desorption isotherms results are displayed in Fig. S1. According to IUPAC classification, all the catalysts possess the type IV adsorption isotherm with a H4 type hysteresis loop [37]. The results indicate that the synthesized catalysts are mesoporous material with a layered structure, which can also be verified by the pore size distribution curves (Fig. S1b) and SEM images (Fig. S2). The detailed textural parameters of the catalysts are summarized in Table 1. The specific surface area, pore volume and average pore diameter of the ZrP catalyst is 411 m2/g, 0.70 cm3/g and 7.8 nm, respectively. As the content of Sn in the zirconium-tin phosphates increases, the specific surface area gradually decreases, while the average pore diameter increases slightly from 5.0 nm for Zr0.6Sn0.4P to 5.5 nm for Zr0.4Sn0.6P, which is still lower than that of ZrP. The introduction of tin species has a certain impact on the texture properties of materials, while the zirconium-tin phosphates still have high specific surface area and mesoporous structure, which can greatly facilitate the transport of reactants and products [15–17]. The morphology and microstructure of the zirconium-tin phosphates are displayed in Fig. 2 and Fig. S2. The ZrP is composed of nano-sheets with a thickness of ∼3 nm. As the tin content increases, the zirconium-tin phosphates maintain a nanosheet-like morphology, while the thickness of the sheets gradually increases, which may lead to a decrease in the specific surface area of the materials. The results are consistent with the N2 absorption/desorption analysis data. The elemental mapping of Zr0.6Sn0.4P indicates that all the elements i.e. Zr, Sn, P and O are distributed uniformly in the catalyst (Fig. 2g-j). The surface element composition and chemical state of the zirconium-tin phosphates were investigated by XPS. The survey scan profiles in Fig. 3a further confirm that the zirconium-tin phosphates are composed of Zr, Sn, P and O. As shown in Fig. 3b, the Zr 3d line consists of two peaks attributed to Zr 3d3/2 at ∼186 eV and Zr 3d5/2 at ∼183 eV, which are the characteristics of tetravalent zirconium (Zr4+) [38,39]. For the Sn 3d profile (Fig. 3c), two peaks were found at ∼496 eV for Sn 3d3/2 and ∼487 eV for Sn 3d5/2, indicating that the tin species mainly exist in Sn4+ state in the zirconium-tin phosphate [40,41]. The peak intensity of Sn element increases with the addition of tin, while the peak intensity of Zr element decreases gradually. The binding energies of Zr and Sn in the zirconium-tin phosphates are all higher than those in ZrP and SnP, indicating that the electron density of Zr and Sn species in the zirconium-tin phosphates decreased, which results in stronger Lewis acidity of Zr(IV) and Sn(IV) [29,40]. The binding energy of P in the zirconium-tin phosphates also shifts to higher values (Fig. 3d), indicating an increased number of hydroxyl groups bound to P on the zirconium-tin phosphates surface [27]. The enhanced Lewis acidity and increased hydroxyl groups in zirconium-tin phosphates would lead to an increase in the adsorption capacity for the reactant ethylene and DMF molecules, respectively [11,24,42]. The surface Zr/Sn atomic ratios of the zirconium-tin phosphates obtained from XPS characterization are summarized in Table S1. For the Zr0.6Sn0.4P, Zr0.5Sn0.5P and Zr0.4Sn0.6P, the Zr/Sn atomic ratios are 1.46, 0.97 and 0.64, respectively, which are basically consistent with the XRF data, indicating that the tin species are uniformly dispersed in the materials. More accurate information on the local environment of phosphorus in the ZrP and Zr0.6Sn0.4P catalysts were characterized by the 31P solid-state MAS NMR, and the spectra are shown in Fig. S3. The ZrP and Zr0.6Sn0.4P catalysts exhibit relatively broad resonance peaks, indicating that they are amorphous [38,43], which is accordance with the XRD results. Moreover, the spectra of ZrP and Zr0.6Sn0.4P were deconvoluted, and both show four resonance positions, i.e. (M-O)-PO(OH)2 ( δ 31 P = −10), (M-O)2-PO(OH) ( δ 31 P = −16), (M-O)3-PO ( δ 31 P = −20) and P-O-P ( δ 31 P = −29, M = Zr or Sn) [38,43,44]. The relative amounts of different phosphate species for ZrP and Zr0.6Sn0.4P are shown in Fig. S3 (In parentheses). It can be found that the number of P-O-P species in Zr0.6Sn0.4P is lower than that in ZrP, indicating that the Brønsted acid sites in Zr0.6Sn0.4P should be lower than that in ZrP, as previous studies have confirmed that the more P-O-P species in zirconium phosphate, the more Brønsted acid sites in the catalysts [38,45]. The results suggest that the incorporation of tin changes the local environment of phosphorus, and then modulates the acidity of the catalysts. The acidic properties of the zirconium-tin phosphate were evaluated using NH3-TPD. As presented in Fig. 4a-b, a broad NH3 desorption peak located at 100–500 °C is observed, suggesting the existence of weak (W, 100–200 °C), moderate (M, 200–350 °C) and strong acid sites (S, 350–550 °C) in the catalysts [24,46]. The acidity data of the catalysts is presented in Table 2. With the addition of tin, the total acid amount of the catalysts gradually decreases from 2057 μmol/g for ZrP to 1232 μmol/g for Zr0.4Sn0.6P, while the ratio of strong acid sites to the sum of weak and moderate acid sites (S/(W+M)) increases first, and then decreases. The total acid amount of Zr0.6Sn0.4P is 1515 μmol/g, and the value of S/(W+M) is 0.76. When the Zr element in the zirconium-tin phosphates is completely replaced by Sn element, the synthesized SnP shows the lowest total acid amount (1107 μmol/g) and the maximum value of S/(W+M) (1.22). Pyridine-adsorption FTIR spectra were employed to identify the types of acid sites in the zirconium-tin phosphates. As displayed in Fig. 4c, the adsorption peaks at 1447 cm−1 and 1545 cm−1 are caused by the pyridine adsorbed on Lewis and Brønsted acid sites, respectively [24,31]. Clearly, ZrP, SnP and the zirconium-tin phosphates all contain Lewis and Brønsted acid sites. The Brønsted and Lewis acid sites in these catalysts arise from hydroxyl group (P-OH) and metal sites (Zr(IV), Sn(IV)), respectively [26,36,40]. The adsorption peaks at 1447 cm−1 shifts gradually to higher wavenumbers (∼1553 cm−1) with the addition of tin in the zirconium-tin phosphates, indicating an increased Lewis acid strength for the zirconium-tin phosphates, which is well in line with the XPS analysis. The mole ratios of Lewis to Brønsted acid sites (L/B) in the catalysts are listed in Table 2. With the addition of tin, the L/B mole ratio increases first, and then decreases. Compared with ZrP, the Zr0.6Sn0.4P achieves a higher value of L/B (1.26), which is in good agreement with that of 31P MAS NMR analysis. With further increasing the addition of tin, the L/B mole ratio of Zr046Sn0.4P decreases to 0.99. However, the SnP catalyst exhibits the maximum L/B mole ratio of 1.68. Based on the NH3-TPD and Pyridine adsorption FTIR, it can be concluded that the total acid amount, acid strength distribution and acid site types of the zirconium-tin phosphates can be well controlled via the addition of different amounts of tin species. The temperature-programmed desorption of DMF/ethylene (DMF/C2H4-TPD) were conducted on the zirconium-tin phosphate catalysts to evaluate the effect of the addition of Sn on the adsorption of DMF and ethylene molecules. As shown in Fig. 5a, ZrP exhibits a small C2H4 desorption peaks centered at 90 °C, implying the presence of the weaker interaction between C2H4 molecules and the catalyst. Whereas, for SnP, no C2H4 desorption peak was observed under the present experimental conditions. Even if the desorption temperature was raised to 700 °C, no C2H4 desorption was detected as shown in Fig. S4. These results suggest that there may be no interaction between the C2H4 molecules and the Sn sites of the catalyst [42,47]. Because it is generally believed that ethylene was adsorbed on the catalyst surface via the interaction of π-electrons of CC band of ethylene molecules with coordinately unsaturated metal sites of catalysts [47]. Compared to ZrP and SnP, the C2H4 desorption peaks on the zirconium-tin phosphates shift to higher temperature and remarkably increase in intensity, indicating that the incorporation of Sn into the ZrP is beneficial to improving the C2H4 adsorption capability of the zirconium phosphates. This is probably caused by the decreased electron density of Zr and Sn species in the zirconium-tin phosphates, as the previous studies have found that the decrease in electron density for metal species can lead to an enhancement of the interaction between C2H4 molecule and metal species in the catalysts [23,42,47]. Among the catalysts, Zr0.6Sn0.4P shows the highest capability of C2H4 adsorption, followed by Zr0.5Sn0.5P and Zr0.4Sn0.6P, which can be attributed to the presence of more metal species with lower electron density in Zr0.6Sn0.4P catalyst. The TPD-DMF profiles in Fig. 4b reveals that the addition of Sn also enhances the adsorption capability of DMF, which could be due to the increase in the number of surface hydroxyl groups in the zirconium-tin phosphates as confirmed by XPS analysis [11]. 3.2 Catalytic activity The activity of the various catalysts for the preparation of PX from DMF and ethylene were investigated at 250 °C in 4 h ( Table 3). Firstly, a blank experiment was performed without any catalyst, and the results showed that DMF conversion did not occur under these conditions. In the presence of ZrP, 86% of DMF was converted, with a PX selectivity of 85.5%. With the addition of tin into ZrP, the DMF conversion decreases slowly from 86% to 79%, while the total acid content in these catalysts decreases greatly from 2057 to 1232 μmol/g (Table 2). When the Zr element in the zirconium phosphate was completely replaced by the Sn element, the synthesized SnP with the lowest total acid content (1107 μmol/g) exhibited the minimum DMF conversion of 68%. The result further confirms that the increase of total acid amount of the catalysts contributes to DMF conversion. In contrast, the product selectivity shows different trends with the addition of tin. As increasing the doping amount of tin, the selectivity of PX increases first and then decreases slightly. Upon increasing the mole fraction of tin up to 0.4, the PX selectivity increases from 85.5% for ZrP to 90.9% for Zr0.6Sn0.4P. Previous studies [20–22] have found that the lower proportion of strong acid sites (S/(W+M)) is beneficial to inhibiting the formation of byproducts and unknown oligomers. However, the Zr0.6Sn0.4P catalyst with a higher S/(W+M) ratio (076) exhibits a better PX selectivity, which could be ascribed to its suitable L/B ratio (1.26) [21,24]. As shown in Scheme 1, the conversion of DMF and ethylene to PX contains two main reaction steps, including Diels-Alder reaction and the subsequent dehydration. For Zr0.6Sn0.4P, a high-content Lewis acid sites could efficiently promote the Diels-Alder reaction between DMF and ethylene to form cycloaddition intermediate (CH), then the CH undergoes quickly dehydration reaction to form PX in the presence of adjacent Brønsted acid sites. Although ZrP possesses a lower proportion of strong acid sites, the excessive Brønsted acid sites enhances the hydrolysis of DMF and the subsequent condenses intramolecular of HDO, as confirmed by the higher selectivity of CP and unknown byproducts. Especially for ZrP and Zr0.5Sn0.5P, both of them have the same proportion of strong acid sites, but the Zr0.5Sn0.5P with the higher L/B ratio exhibits a better PX selectivity, which further confirms that the synergistic effects between Lewis and Brønsted acid sites plays a vital role in the current catalytic system. With further increasing the mole fraction of tin to 0.6, the PX selectivity decreases slightly for the Zr0.4Sn0.6P catalyst, which could be attributed to the excessive Brønsted acid sites in the Zr0.4Sn0.6P catalyst. However, for SnP, the selectivity of PX decreases to 77.2%, and a high selectivity of CH, AP and unknown byproducts are observed in the Table 3, which could be caused by the overhigh proportion of strong acid sites and lower L/B mole ratio in the SnP catalyst. On the whole, as a good catalyst for the preparation of PX from DMF and ethylene, it is crucial to realize the subtle regulation for the acid strength and acid site types of catalysts. Eventually, the Zr0.6Sn0.4P catalyst with an appropriate distribution of acid strength and L/B ratio exhibits a moderate catalytic activity and the highest PX selectivity. Moreover, we also examined the catalytic performance of the ZrP material modified by other metals i.e. Ce, Al and Ti. The results found that a DMF conversion of 87% and a PX selectivity of 86.4% were obtained over Zr0.6Ce0.4P, indicating that the incorporation of Ce into the ZrP has no remarkable promoting effect on the production of PX from DMF and ethylene. For Zr0.6Al0.4P, the DMF conversion was 89%, while the PX selectivity decreased to 75.7%, and the selectivity of CP and unknown byproducts increased to 3.7% and 14.5%, respectively. This may be due to the increase of strong Brønsted acid sites in the Zr0.6Al0.4P catalyst caused by the addition of Al into ZrP [49], which could help to enhance the hydrolysis of DMF and subsequent condensation, thereby greatly reducing the selectivity of PX. The Zr0.6Ti0.4P catalyst gave 85% DMF conversion and 87.4% PX selectivity, suggesting that the incorporation of Ti into ZrP can lead to a slight increase of PX selectivity. 3.3 Optimization of reaction conditions In order to further improve the conversion of DMF and obtain a higher yield of PX, Zr0.6Sn0.4P was selected as the catalyst to investigate the effects of reaction conditions on the conversion of DMF and ethylene. As shown in Fig. 6, as the reaction temperature rises from 230 to 260 °C, the conversion of DMF improves from 70% to 88%. Whereas, the selectivity of HDO and unknown byproducts decrease remarkably; while the CP and AP selectivity remains at lower values. The maximum PX selectivity of 91.2% is achieved at 260 °C. The results indicate that a higher reaction temperature helps to accelerate the Diels-Alder reaction and subsequent dehydration to produce PX [18]. However, when the reaction temperature is further improved to 270 °C, the conversion of DMF slightly rises, while the PX selectivity declines with the increase of unknown byproducts, indicating that high reaction temperature promotes side reactions [48]. Thus, the optimal reaction temperature is 260 °C for the current catalytic system. Fig. 6b shows that initial ethylene pressure has a large impact on the DMF conversion and product distribution. When ethylene pressure improves from 1 MPa to 4 MPa, DMF conversion and PX selectivity remarkably improves from 54% to 88%, and from 74.1% to 91.2%, respectively, which is likely caused by the fact that high ethylene pressure can enhance the Diels-Alder cycloaddition reaction rate, and then promotes the formation of PX [21,32]. As ethylene pressure continually rises, PX selectivity declines slightly, while the AP selectivity increases, indicating that the excessive ethylene promotes the alkylation reaction between PX and ethylene. Hence, the optimal ethylene pressure is 4 MPa. As presented in Fig. 6c, DMF conversion slowly goes up with increasing catalyst dosage. While, the PX selectivity reaches the highest value of 92.8% at a catalyst dosage of 2.5 wt% (based on the DMF mass), then decreases with further increasing the catalyst dosage. Hence, in the following tests, the catalyst dosage was fixed at 2.5 wt% of DMF. From the Fig. 6d, it is obvious that DMF conversion increases greatly from 59% to 96% with prolonging reaction time from 1 to 6 h. Within a 12 h reaction time, the DMF conversion, PX selectivity and PX yield reach up to 99%, 95.2% and 94.2%, respectively. In the light of the above experimental results, the optimum reaction conditions for the PX production are 2.5 wt% Zr0.6Sn0.4P catalyst dosage, 4 MPa ethylene, 260 °C for 12 h. By comparing the catalytic performance of Zr0.6Sn0.4P with other catalysts reported in the literature (Table S2), it was found that this catalyst exhibited better performance in converting DMF and ethylene to PX under moderate reaction conditions. As shown in Table S2, the catalytic conversion of DMF using Zr0.6Sn0.4P catalyst exhibits almost the highest PX productivity and yield. In addition, compared to most systems using other solid acid catalysts, the conversion of DMF and ethylene in this study was performed under milder reaction conditions with shorter reaction time and lower catalyst dosage. 3.4 Kinetic analysis To further gain insight into the superior catalytic performance of the Zr0.6Sn0.4P catalyst, the kinetic experiments for the conversion of DMF and ethylene to PX over Zr0.6Sn0.4P were performed at 220–250 °C. A low catalyst dosage (0.0154 g, acid concentration ∼1 mM) was applied in the kinetic experiments to achieve a low DMF conversion and to obtain more accurate data. The kinetic plots of PX production on the catalyst are displayed in Fig. 7a. Clearly, the PX production has a well linear relationship with the reaction time. According to the data in Fig. 7a, the initial formation rate of PX (r 0) at various reaction temperatures was achieved. On the basis of reported studies [11,13,23,50], the formation rate of PX can be expressed as zero order kinetics models at lower acid site concentrations due to the use of a vast excessive ethylene and a constant amount of catalyst in the kinetic experiments. Therefore, the effect of acid site concentration on PX productivity on Zr0.6Sn0.4P was carried out. As presented in Fig S5, it is clear that the acid site concentration in the current reaction kinetics experiment is within the low acid site concentration range (< 2.9 mM). Hence, the Arrhenius diagram based on the linear relationship between lnr 0 and 1/T is displayed in Fig. 7b. As presented in Fig. 7b, the liner fitting curve fits well with the date points obtained in the experiments. The value of apparent activation energy (Ea) of Zr0.6Sn0.4P is 39 kJ·mol−1, much smaller than 45.1 kJ·mol−1 over HY zeolite [11], 48.9 kJ·mol−1 over H-BEA zeolite [50] and 68.0 kJ·mol−1 over Zr-Beta zeolite [51]. This result indicates that, compared to the catalysts reported above, a large number of active sites with lower reaction barriers were achieved on the surface of Zr0.6Sn0.4P. Obviously, the active sites with lower reaction barrier contributes to improve the reaction rate for the conversion of DMF and ethylene to PX [25], thereby resulting in a higher catalytic activity for Zr0.6Sn0.4P in PX production from DMF and ethylene than other solid acid catalysts. The catalytic performance of Zr0.6Sn0.4P and the reported catalysts in the literatures for the conversion of DMF and ethylene to PX is presented in Table S2. From the Table S2, it can be clearly seen that a higher PX production rate and PX yield were achieved on the Zr0.6Sn0.4P catalyst with a shorter reaction time and a lower catalyst usage than other solid acid catalysts. 3.5 Catalyst stability The catalyst stability is of great significance for practical application, thus the recyclability of the Zr0.6Sn0.4P catalyst was explored in the conversion of DMF and ethylene to PX. As displayed in Fig. 8a, after reaction at 250 °C for 2 h the reaction was stopped and the Zr0.6Sn0.4P catalyst was removed by filtration from the reaction mixture. Then, the resulting filtrate was re-added into the autoclave, followed by further reaction for 10 h under the same reaction conditions. It is evident that the conversion of DMF remained unchanged after removing the catalyst. Moreover, none of Zr, Sn and P elements were detected in the filtrate by ICP-OES analysis, confirming that no catalyst leaching occurred and the reaction was indeed heterogeneous. In recycling test, the used catalyst was washed with water and ethanol, dried at 100 °C overnight, and then subjected to the next run. As displayed in Fig. 8b, the DMF conversion gradually decreases from 90% to 78% after the fourth use, while the PX selectivity decreases relatively small. To investigate the reasons for the decrease in catalytic activity, FT-IR and TG analyses were conducted using the fresh and used catalyst. FT-IR spectra in Fig. S6a confirmed that some carbonaceous species were adsorbed on the surface of the used catalyst. TG curves in Fig. S6b exhibits a significant weight loss of Zr0.6Sn0.4P from 350 to 600 °C, which can be attributed to the burning of organic compounds deposited on the catalyst surface. Therefore, the main factor causing the decrease in catalytic activity is the formation of carbon deposits. In the subsequent runs, the used catalyst was washed with water and ethanol, dried at 100 °C overnight, and finally regenerated by calcination at 500 °C for 4 h. As can be seen from the Fig. 8b, the regenerated catalyst gave a DMF conversion of 89% and a PX selectivity of 93.1% after six consecutive reaction cycles, which are comparable to that of the fresh catalyst. These results indicates that the used Zr0.6Sn0.4P catalyst could be easily regenerated by calcination, and showed an excellent catalytic stability. Subsequently, the fresh and regenerated Zr0.6Sn0.4P catalyst (after the sixth runs) were characterized by various techniques. FT-IR spectra in Fig. S6a and XRD patterns in Fig. S6c reveal no significant changes between the fresh and regenerated Zr0.6Sn0.4P catalysts, implying that the structure of the catalyst is not altered during the regeneration. N2 physical adsorption and NH3-TPD profiles in Fig. S6d-e show that compared with fresh catalysts, the specific surface area and acidic density of the regenerated catalyst declines slightly from 302.1 m2/g and 1515 μmol/g to 296.7 m2/g and 1456 μmol/g, respectively. These results demonstrate that the Zr0.6Sn0.4P catalyst has stable structure and surface properties. 3.6 Surface reaction mechanism To gain further insight into the adsorption and reaction of DMF and ethylene molecules on the catalyst surface, the temperature-programmed surface reaction (TPSR) of DMF and ethylene on the Zr0.6Sn0.4P catalyst was investigated. As shown in Fig. 9a-b, the partial adsorbed DMF and ethylene molecules on the catalyst surface were desorbed during the temperature-programmed process. The desorption peaks of DMF are quite similar whether DMF or ethylene was firstly introduced onto the catalyst surface (Fig. 9a), and the DMF desorption peaks in TPSR are also close with the result of TPD-DMF on Zr0.6Sn0.4P catalyst as shown in Fig. 5a. The desorption of ethylene in the Fig. 9b also exhibit the similar phenomenon. These results suggest that the DMF and ethylene molecules are adsorbed on the different active sites on catalysts surface and does not affect each other. Similar results were also observed during in-situ FT-IR adsorption of DMF and ethylene on the ZrP-2.5 catalyst in our previous study [52]. The in-situ FT-IR characterization of the ZrP-2.5 catalyst confirmed the presence of interaction between the oxygen atoms of DMF and P-OH, and the coordinately unsaturated Zr(IV) in ZrP-2.5 interacted with the π - electrons of the ethylene CC bond. Thereby, it can be concluded that, for the Zr0.6Sn0.4P catalyst, the DMF molecules should be adsorbed on the catalyst surface via the interaction between P-OH in catalyst and oxygen atom of furan; while the ethylene molecules should be adsorbed on the catalyst surface via the interaction between the π-electrons of ethylene CC bond and metal sites of catalyst. Furthermore, TPSR-DMF-C2H4 and TPSR-C2H4-DMF profiles in the Fig. 9c-d reveal that CH intermediate and a small amount of PX and HDO were generated during the temperature-programmed process, indicating that the adsorbed DMF and ethylene molecules on the Zr0.6Sn0.4P catalyst surface all undergo the Diels-Alder and dehydration reaction, regardless of the order of introduction of DMF and ethylene. The results further confirm that DMF and ethylene molecule should be adsorbed on the different active sites of the catalyst because the product PX can be formed whether the DMF or ethylene was firstly introduced onto the catalyst surface. According to the preceding results and the previously reported studies on the reaction of DMF and ethylene [11,42,52–54], a reasonable reaction mechanism for the reaction of DMF and ethylene in the presence of Zr0.6Sn0.4P was proposed ( Scheme 2). In the Diels-Alder reaction step, DMF molecules are firstly adsorbed and activated on the catalyst surface via the interaction between furan oxygen of DMF and P-OH in the catalyst to form complex, and then the complex formed a six-membered ring transition state (a0) with the adjacent CC of ethylene adsorbed on the coordinately unsaturated metal sites. Afterwards, a stable cycloadduct intermediate (a1) is quickly produced through the electron rearrangement of the six-membered ring species. Therefore, the active sites P-OH (Brønsted acid sites) and metal sites (Lewis acids sites) play a vital role for the adsorption and activation of DMF and ethylene molecule. The enhanced DMF and ethylene adsorption on the Zr0.6Sn0.4P catalyst is beneficial to enriching a higher concentration DMF and ethylene on the catalyst surface, and then promoting the Diels-Alder reaction to produce more cycloadduct intermediate. Subsequently, the produced cycloadduct intermediate undergoes the dehydration reaction to generate PX and equal molecule of H2O in the presence of either Brønsted or Lewis acid sites. The dehydration reaction step mainly includes three elementary reactions: (1) C4-Of (furan oxygen) bond cleavage, (2) 1st proton transfer and (3) 2nd proton transfer. By combining the present experiment results and previous studies [18,20,24,52], it can be concluded that the Brønsted acid sites is more active for the dehydration reaction than Lewis acid sites. However, the excessive Brønsted acid sites also enhance the hydrolysis of DMF and subsequent condensation of HDO, which leads to a reduction of the PX selectivity, especially for the Brønsted acid sites with high acid strength. In conclusion, catalysts with appropriate Brønsted/Lewis acid site ratio and acid strength distribution are very important for the efficient and highly selective production of PX from DMF and ethylene. 4 Conclusion In this study, a series of zirconium-tin phosphate solid acids were prepared via a hydrothermal method. These catalysts exhibited excellent catalytic activity and stability for the conversion of DMF and ethylene to PX. With Zr0.6Sn0.4P as the catalyst, 99% DMF conversion, 95.2% PX selectivity and 94.2% PX yield were achieved at 260 °C for 12 h with 4 MPa ethylene and 2.5 wt% catalyst dosage (based on the DMF mass). Compared with other reported solid acid catalyst, the Zr0.6Sn0.4P catalyst achieved a higher PX yield in a shorter reaction time. The addition of Sn adjusted the acid properties of the catalyst and enhanced the adsorption of reactant molecules, which are beneficial to the generation of PX. Thus, this study provides a stable and simple solid acid catalyst for the efficient and highly selective production of PX from biobased DMF and ethylene, which has a good potential for practical applications. CRediT authorship contribution statement Chengming Wu: Data curation, Investigation, Writing – original draft. Hongbo Chen: Data curation. Jifan Li: Writing – review & editing. Chun- Ling Liu: Supervision, Writing – review & editing, Funding acquisition. Wen-Sheng Dong: Data curation, Supervision, Writing – review & editing, Funding acquisition. Declaration of Competing Interest The authors declare that they have no known competing financial interests or personal relationships that could have appeared to influence the work reported in this paper. Acknowledgments This work was financially supported by the National Natural Science Foundation of China (22178212), the Fundamental Research Funds for the Central Universities (2020CBLZ004) and the Science and Technology Research Project of Hubei Provincial Department of Education of China (Q20193101). Appendix A Supporting information Supplementary data associated with this article can be found in the online version at doi:10.1016/j.apcata.2023.119521. Appendix A Supplementary material Supplementary material . References [1] N. Chakinala A.G. Chakinala Process design strategies to produce p-xylene via toluene methylation: a review Ind. Eng. Chem. Res. 60 2021 5331 5351 N. Chakinala, A.G. Chakinala, Process design strategies to produce p-xylene via toluene methylation: a review, Ind. Eng. Chem. Res. 60 (2021) 5331–5351. [2] H.J. Cho L. Ren V. Vattipalli Y.H. Yeh N. Gould B. Xu R.J. Gorte R. Lobo P.J. Dauenhauer M. Tsapatsis W. Fan Renewable p-xylene from 2,5-dimethylfuran and ethylene using phosphorus-containing zeolite catalysts ChemCatChem 9 2017 398 402 H.J. Cho, L. Ren, V. Vattipalli, Y.H. Yeh, N. Gould, B. Xu, R.J. Gorte, R. Lobo, P.J. Dauenhauer, M. Tsapatsis, W. Fan, Renewable p-xylene from 2,5-dimethylfuran and ethylene using phosphorus-containing zeolite catalysts, ChemCatChem 9 (2017) 398–402. [3] L. Lin X. Han B. Han S. Yang Emerging heterogeneous catalysts for biomass conversion: studies of the reaction mechanism Chem. Soc. Rev. 50 2021 11270 11292 L. Lin, X. Han, B. Han, S. Yang, Emerging heterogeneous catalysts for biomass conversion: studies of the reaction mechanism, Chem. Soc. Rev. 50 (2021) 11270–11292. [4] T.W. Lyons D. Guironnet M. Findlater M. Brookhart Synthesis of p-xylene from ethylene J. Am. Chem. Soc. 134 2012 15708 15711 T.W. Lyons, D. Guironnet, M. Findlater, M. Brookhart, Synthesis of p-xylene from ethylene, J. Am. Chem. Soc. 134 (2012) 15708–15711. [5] A. Maneffa P. Priecel J.A. Lopez-Sanchez Biomass-derived renewable aromatics: selective routes and outlook for p-xylene commercialization ChemSusChem 9 2016 2736 2748 A. Maneffa, P. Priecel and J.A. Lopez-Sanchez, Biomass-derived renewable aromatics: selective routes and outlook for p -xylene commercialization, ChemSusChem 9 (2016) 2736–2748. [6] Z. Lin V. Nikolakis M. Lerapetritou Alternative approaches for p-xylene production from starch: techno-economic analysis Ind. Eng. Chem. Res. 53 2014 10688 10699 Z. Lin, V. Nikolakis, M. Lerapetritou, Alternative approaches for p-xylene production from starch: techno-economic analysis, Ind. Eng. Chem. Res. 53 (2014) 10688–10699. [7] Z. Lin M. Ierapetritou V. Nikolakis Aromatics from lignocellulosic biomass: economic analysis of the production of p-xylene from 5-hydroxymethylfurfural AIChE J. 59 2013 2079 2087 Z. Lin, M. Ierapetritou and V. Nikolakis, Aromatics from lignocellulosic biomass: economic analysis of the production of p-xylene from 5-hydroxymethylfurfural, AIChE J. 59 (2013) 2079–2087. [8] J.M.J.M. Ravasco R.F.A. Gomes Recent advances on Diels-Alder-driven preparation of bio-based aromatics ChemSusChem 14 2021 3047 3053 J.M.J.M. Ravasco, R.F.A. Gomes, Recent advances on Diels-Alder-driven preparation of bio-based aromatics, ChemSusChem 14 (2021) 3047–3053. [9] Z. Li Y. Jiang Y. Li H. Zhang, Li H. Li S. Yang Advances in Diels-Alder/aromatization of biomass furan derivatives towards renewable aromatic hydrocarbons Catal. Sci. Technol. 12 2022 1902 1921 Z. Li, Y. Jiang, Y. Li, H. Zhang, Li, H. Li, S. Yang, Advances in Diels-Alder/aromatization of biomass furan derivatives towards renewable aromatic hydrocarbons, Catal. Sci. Technol. 12 (2022) 1902–1921. [10] P.T.M. Do J.R. McAtee D.A. Watson R.F. Lobo Elucidation of Diels-Alder reaction network of 2,5-dimethylfuran and ethylene on HY zeolite catalyst ACS Catal. 3 2013 41 46 P.T.M.Do, J.R. McAtee, D.A. Watson, R.F. Lobo, Elucidation of Diels-Alder reaction network of 2,5-dimethylfuran and ethylene on HY zeolite catalyst, ACS Catal. 3 (2013) 41–46. [11] R.E. Patet N. Nikbin C.L. Williams S.K. Green C.-C. Chang W. Fan S. Caratzoulas P.J. Dauenhauer D.G. Vlachos Kinetic regime change in the tandem dehydrative aromatization of furan Diels-Alder products ACS Catal. 5 2015 2367 2375 R.E. Patet, N. Nikbin, C.L. Williams, S.K. Green, C.-C. Chang, W. Fan, S. Caratzoulas, P.J. Dauenhauer, D.G. Vlachos, Kinetic regime change in the tandem dehydrative aromatization of furan Diels-Alder products, ACS Catal. 5 (2015) 2367–2375. [12] X. Feng C. Shen K. Ji J. Yin T. Tan Production of p-xylene from bio-based 2,5-dimethylfuran over high performance catalyst WO3/SBA-15 Catal. Sci. Technol. 7 2017 5540 5549 X. Feng, C. Shen, K. Ji, J. Yin, T. Tan, Production of p-xylene from bio-based 2,5-dimethylfuran over high performance catalyst WO3/SBA-15, Catal. Sci. Technol. 7(2017) 5540–5549. [13] S. Song G. Wu W. Dai N. Guan L. Li Diels-Alder and dehydration reactions of furan derivatives with ethylene catalyzed by liquid Brønsted acids and Lewis Acids, J. Mol. Catal. A: Chem. 420 2016 134 141 S. Song, G. Wu, W. Dai, N. Guan, L. Li, Diels-Alder and dehydration reactions of furan derivatives with ethylene catalyzed by liquid Brønsted acids and Lewis acids, J. Mol. Catal. A: Chem. 420 (2016) 134–141. [14] R.Y. Rohling E. Uslamin B. Zijlstra I.C. Tranca I.A.W. Filot E.J.M. Hensen E.A. Pidko An active alkali-exchanged faujasite catalyst for p-xylene production via the one-pot Diels-Alder cycloaddition/dehydration reaction of 2,5-dimethylfuran with ethylene ACS Catal. 8 2018 760 769 R.Y. Rohling, E. Uslamin, B. Zijlstra, I.C. Tranca, I.A.W. Filot, E.J.M. Hensen, E.A. Pidko, An active alkali-exchanged faujasite catalyst for p-xylene production via the one-pot Diels-Alder cycloaddition/dehydration reaction of 2,5-dimethylfuran with ethylene, ACS Catal. 8 (2018) 760–769. [15] J.-C. Kim T.-W. Kim Y. Kim R. Ryoo S.-Y. Jeong C.-U. Kim Mesoporous MFI zeolites as high performance catalysts for Diels-Alder cycloaddition of bio-derived dimethylfuran and ethylene to renewable p-xylene Appl. Catal. B: Environ. 206 2017 490 500 J.-C. Kim, T.-W. Kim, Y. Kim, R. Ryoo, S.-Y. Jeong, C.-U. Kim, Mesoporous MFI zeolites as high performance catalysts for Diels-Alder cycloaddition of bio-derived dimethylfuran and ethylene to renewable p-xylene, Appl. Catal. B: Environ. 206 (2017) 490–500. [16] Y.P. Wijaya H.P. Winoto Y.K. Park D.J. Suh H. Lee J.M. Ha J. Jae Heteropolyacid catalysts for Diels-Alder cycloaddition of 2,5-dimethylfuran and ethylene to renewable p-xylene Catal. Today 293 2017 167 175 Y.P. Wijaya, H.P. Winoto, Y.K. Park, D.J. Suh, H. Lee, J.M. Ha, J. Jae, Heteropolyacid catalysts for Diels-Alder cycloaddition of 2,5-dimethylfuran and ethylene to renewable p-xylene, Catal. Today 293 (2017) 167–175. [17] X. Feng C. Shen C. Tian T. Tan Highly selective production of biobased p-xylene from 2,5-dimethylfuran over SiO2-SO3H catalysts Ind. Eng. Chem. Res. 56 2017 5852 5859 X. Feng, C. Shen, C. Tian, T. Tan, Highly selective production of biobased p-xylene from 2,5-dimethylfuran over SiO2-SO3H catalysts, Ind. Eng. Chem. Res. 56 (2017) 5852–5859. [18] J. Yin C. Shen X. Feng K. Ji L. Du Highly selective production of p-xylene from 2,5-dimethylfuran over hierarchical NbOx-based catalyst ACS Sustain. Chem. Eng. 6 2017 1891 1899 J. Yin, C. Shen, X. Feng, K. Ji, L. Du, Highly selective production of p-Xylene from 2,5-dimethylfuran over hierarchical NbOx-based catalyst, ACS Sustainable Chem. Eng. 6 (2017) 1891–1899. [19] R. Zhao Z. Zhao S. Li A.-N. Parvulescu U. Müller W. Zhang Excellent performances of dealuminated H-Beta zeolites from organotemplate-free synthesis in conversion of biomass-derived 2,5-dimethylfuran to renewable p-xylene ChemSusChem 11 2018 3803 3811 R. Zhao, Z. Zhao, S. Li, A.-N. Parvulescu, U. Müller, W. Zhang, Excellent performances of dealuminated H-Beta zeolites from organotemplate-free synthesis in conversion of biomass-derived 2,5-dimethylfuran to renewable p-Xylene, ChemSusChem 11 (2018) 3803–3811. [20] H. Kim J. Jae Catalysts, Diels-Alder cycloaddition of biomass-derived 2,5-dimethylfuran and ethylene over sulfated and phosphated metal oxides for renewable p-xylene Catalysts 11 2021 1074 1085 H. Kim, J. Jae, Catalysts, Diels-Alder cycloaddition of biomass-derived 2,5-dimethylfuran and ethylene over sulfated and phosphated metal oxides for renewable p-xylene, Catalysts 11 (2021) 1074–1085. [21] R. Zhao L. Xu S. Huang W. Zhang Highly selective production of renewable p-xylene from bio-based 2,5-dimethylfuran and ethylene over Al-modified H-Beta zeolites Catal. Sci. Technol. 9 2019 5676 5685 R. Zhao, L. Xu, S. Huang, W. Zhang, Highly selective production of renewable p-xylene from bio-based 2,5-dimethylfuran and ethylene over Al-modified H-Beta zeolites, Catal. Sci. Technol. 9 (2019) 5676–5685. [22] X. Feng Z. Cui Y. Bao H. Chu X. Wu C. Shen T. Tan Is hydrolysis a bad news for p-xylene production from 2,5-dimethylfuran and ethylene? Mechanism investigation into the role of acid strength during 2,5-hexanedione conversion J. Catal. 401 2021 214 223 X. Feng, Z. Cui, Y. Bao, H. Chu, X. Wu, C. Shen, T. Tan, Is hydrolysis a bad news for p-xylene production from 2,5-dimethylfuran and ethylene? Mechanism investigation into the role of acid strength during 2,5-hexanedione conversion, J. Catal. 401 (2021) 214–223. [23] C.-C. Chang H. Je Cho J. Yu R.J. Gorte J. Gulbinski P. Dauenhauer W. Fan Lewis acid zeolites for tandem Diels-Alder cycloaddition and dehydration of biomass-derived dimethylfuran and ethylene to renewable p-xylene Green. Chem. 18 2016 1368 1376 C.-C. Chang, H. Je Cho, J. Yu, R.J. Gorte, J. Gulbinski, P. Dauenhauer, W. Fan, Lewis acid zeolites for tandem Diels-Alder cycloaddition and dehydration of biomass-derived dimethylfuran and ethylene to renewable p-xylene, Green Chem. 18 (2016) 1368–1376. [24] D. Ma X. Li C. Liu C. Versluis Y. Ye Z. Wang E.T.C. Vogt B.M. Weckhuysen W. Yang SCM-36 zeolite nanosheets applied in the production of renewable p-xylene from ethylene and 2,5-dimethylfuran Chin. J. Cata. 47 2023 200 213 D. Ma, X. Li, C. Liu, C. Versluis, Y. Ye, Z. Wang, E.T.C. Vogt, B.M. Weckhuysen, W. Yang, SCM-36 zeolite nanosheets applied in the production of renewable p-xylene from ethylene and 2,5-dimethylfuran, Chin. J. Cata. 47 (2023) 200–213. [25] C. Wu Z. Yang J. Li C.-L. Liu W.-S. Dong Efficient and sustainable production of p-xylene from biomass-derived 2,5-dimethylfuran and ethylene using alkali metal doped phosphotungstic acid catalysts Sustain. Energ. Fuel 6 2022 4458 4469 C. Wu, Z. Yang, J. Li, C.-L. Liu, W.-S. Dong, Efficient and sustainable production of p-xylene from biomass-derived 2,5-dimethylfuran and ethylene using alkali metal doped phosphotungstic acid catalysts, Sustain. Energ. Fuel 6 (2022) 4458–4469. [26] A. Shivhare A. Kumar R. Srivastava Metal phosphate catalysts to upgrade lignocellulose biomass into value-added chemicals and biofuels Green. Chem. 23 2021 3818 3841 A. Shivhare, A. Kumar, R. Srivastava, Metal phosphate catalysts to upgrade lignocellulose biomass into value-added chemicals and biofuels, Green Chem. 23 (2021) 3818–3841. [27] X. Liu X. Liu N. Li P. Ma Y. Zhang Direct synthesis of hexitols from microcrystalline cellulose and birch over zirconium(IV) phosphate supported nickel catalysts and the mechanism study Green. Chem. 23 2021 1353 1360 X. Liu, X. Liu, N. Li, P. Ma, Y. Zhang, Direct synthesis of hexitols from microcrystalline cellulose and birch over zirconium(IV) phosphate supported nickel catalysts and the mechanism study, Green Chem. 23 (2021) 1353–1360. [28] A. Bashir S. Ahad L.A. Malik A. Qureashi T. Manzoor G.N. Dar A.H. Pandith Revisiting the old and golden inorganic material, zirconium phosphate: synthesis, intercalation, surface functionalization, and metal ion uptake Ind. Eng. Chem. Res. 59 2020 22353 22397 A. Bashir, S. Ahad, L.A. Malik, A. Qureashi, T. Manzoor, G.N. Dar, A.H. Pandith, Revisiting the old and golden inorganic material, zirconium phosphate: synthesis, intercalation, surface functionalization, and metal ion uptake, Ind. Eng. Chem. Res. 59 (2020) 22353–22397. [29] H. Xu Z. Wang Z. Miao Y. Zhu A. Marianov L. Wang P. Castignolles M. Gaborieau J. Huang Y. Jiang Correlation between acidity and catalytic performance of mesoporous zirconium oxophosphate in phenylglyoxal conversion ACS Sustain. Chem. Eng. 7 2019 8931 8942 H. Xu, Z. Wang, Z. Miao, Y. Zhu, A. Marianov, L. Wang, P. Castignolles, M. Gaborieau, J. Huang, Y. Jiang, Correlation between acidity and catalytic performance of mesoporous zirconium oxophosphate in phenylglyoxal conversion, ACS Sustainable Chem. Eng. 7 (2019) 8931–8942. [30] Z. Miao Z. Li D. Liu J. Zhao L. Chou J. Zhou S. Zhuo An efficient ordered mesoporous molybdate-zirconium oxophosphate solid acid catalyst with homogeneously dispersed active sites: synthesis, characterization and application J. Colloid Interface Sci. 526 2018 145 157 Z. Miao, Z. Li, D. Liu, J. Zhao, L. Chou, J. Zhou, S. Zhuo, An efficient ordered mesoporous molybdate-zirconium oxophosphate solid acid catalyst with homogeneously dispersed active sites: synthesis, characterization and application, J. Colloid Interface Sci. 526 (2018) 145–157. [31] X. Feng Z. Cui K. Ji C. Shen T. Tan Ultra-selective p-xylene production through cycloaddition and dehydration of 2,5-dimethylfuran and ethylene over tin phosphate Appl. Catal. B Environ. 259 2019 118108 118120 X. Feng, Z. Cui, K. Ji, C. Shen, T. Tan, Ultra-selective p-xylene production through cycloaddition and dehydration of 2,5-dimethylfuran and ethylene over tin phosphate, Appl. Catal. B Environ. 259 (2019) 118108–118120. [32] S. Kasipandi J.M. Cho K.S. Park C.-H. Shin J.W. Bae Unprecedented activity and stability on zirconium phosphates grafted mesoporous silicas for renewable aromatics production from furans J. Catal. 385 2020 10 20 S. Kasipandi, J.M. Cho, K.S. Park, C.-H. Shin, J.W. Bae, Unprecedented activity and stability on zirconium phosphates grafted mesoporous silicas for renewable aromatics production from furans, J. Catal. 385 (2020) 10–20. [33] W. Fang S. Liu L. Schill M. Kubus T. Bligaard A. Riisager On the role of Zr to facilitate the synthesis of diesel and jet fuel range intermediates from biomass-derived carbonyl compounds over aluminum phosphate Appl. Catal. B Environ. 320 2023 121936 121946 W. Fang, S. Liu, L. Schill, M. Kubus, T. Bligaard, A. Riisager, On the role of Zr to facilitate the synthesis of diesel and jet fuel range intermediates from biomass-derived carbonyl compounds over aluminum phosphate, Appl. Catal. B Environ. 320 (2023) 121936–121946. [34] Y. Wu J. Chen Z. Liu P. Na Z. Zhang Removal of trace radioactive Cs+ by zirconium titanium phosphate: From bench-scale to pilot-scale J. Environ. Chem. Eng. 10 2022 108073 108081 Y. Wu, J. Chen, Z. Liu, P. Na, Z. Zhang, Removal of trace radioactive Cs+ by zirconium titanium phosphate: From bench-scale to pilot-scale, J. Environ. Chem. Eng. 10 (2022) 108073–108081. [35] W. Chandane S. Gajare R. Kagne M. Kukade A. Pawar G. Rashinkar B. Tamhankar Sulfated tin oxide (SO4 −2/SnO2): an efficient heterogeneous solid superacid catalyst for the facile synthesis of 2,3-dihydroquinazolin-4(1H)-ones Res Chem. Inter. 48 2022 1 18 W. Chandane, S. Gajare, R. Kagne, M. Kukade, A. Pawar, G. Rashinkar, B. Tamhankar, Sulfated tin oxide (SO4–2/SnO2): an efficient heterogeneous solid superacid catalyst for the facile synthesis of 2,3-dihydroquinazolin-4(1H)-ones, Res Chem Intermed. 48 (2022) 1–18. [36] V.V. Ordomsky V.L. Sushkevich J.C. Schouten J. van der Schaaf T.A. Nijhuis Glucose dehydration to 5-hydroxymethylfurfural over phosphate catalysts J. Catal. 300 2013 37 46 V.V. Ordomsky, V.L. Sushkevich, J.C. Schouten, J. van der Schaaf, T.A. Nijhuis, Glucose dehydration to 5-hydroxymethylfurfural over phosphate catalysts, J. Catal. 300 (2013) 37–46. [37] M. Thommes K. Kaneko A.V. Neimark J.P. Olivier F. Rodriguez-Reinoso J. Rouquerol K.S.W. Sing Physisorption of gases, with special reference to the evaluation of surface area and pore size distribution (IUPAC Technical Report) Pure. Appl. Chem. 87 2015 1051 1069 M. Thommes, K. Kaneko, A.V. Neimark, J.P. Olivier, F. Rodriguez-Reinoso, J. Rouquerol, K.S.W. Sing, Physisorption of gases, with special reference to the evaluation of surface area and pore size distribution (IUPAC Technical Report), Pure. Appl. Chem. 87 (2015) 1051–1069. [38] R. Weingarten Y.T. Kim G.A. Tompsett A. Fernández K.S. Han E.W. Hagaman W.C. Connerm J.A. Dumesic G.W. Huber Conversion of glucose into levulinic acid with solid metal(IV) phosphate catalysts J. Catal. 304 2013 123 134 R. Weingarten, Y.T. Kim, G.A. Tompsett, A. Fernández, K.S. Han, E.W. Hagaman, W.C. Connerm, J.A. Dumesic, G.W. Huber, Conversion of glucose into levulinic acid with solid metal(IV) phosphate catalysts, J. Catal. 304 (2013) 123–134. [39] D. Liu Y. Li C. Liu B. Li Porous lanthanum-zirconium phosphate with superior adsorption capability of fluorine for water treatment J. Colloid Interface Sci. 636 2023 588 601 D. Liu, Y. Li, C. Liu, B. Li, Porous lanthanum-zirconium phosphate with superior adsorption capability of fluorine for water treatment, J. Colloid Interface Sci. 636 (2023) 588–601. [40] Q. Hou M. Zhen L. Liu Y. Chen F. Huang S. Zhang W. Li M. Ju Tin phosphate as a heterogeneous catalyst for efficient dehydration of glucose into 5-hydroxymethylfurfural in ionic liquid Appl. Catal. B: Environ. 224 2018 183 193 Q. Hou, M. Zhen, L. Liu, Y. Chen, F. Huang, S. Zhang, W. Li, M. Ju, Tin phosphate as a heterogeneous catalyst for efficient dehydration of glucose into 5-hydroxymethylfurfural in ionic liquid, Appl. Catal. B: Environ. 224 (2018) 183–193. [41] X. Wang F. Liang C. Huang Y. Li B. Chen Highly active tin(IV) phosphate phase transfer catalysts for the production of lactic acid from triose sugars Catal. Sci. Technol. 5 2015 4410 4421 X. Wang, F. Liang, C. Huang, Y. Li, B. Chen, Highly active tin(IV) phosphate phase transfer catalysts for the production of lactic acid from triose sugars, Catal. Sci. Technol. 5 (2015) 4410–4421. [42] N. Nikbin P.T. Do S. Caratzoulas R.F. Lobo P.J. Dauenhauer D.G. Vlachos A DFT study of the acid-catalyzed conversion of 2,5-dimethylfuran and ethylene to p-xylene J. Catal. 297 2013 35 43 N. Nikbin, P.T. Do, S. Caratzoulas, R.F. Lobo, P.J. Dauenhauer, D.G. Vlachos, A DFT study of the acid-catalyzed conversion of 2,5-dimethylfuran and ethylene to p-xylene, J. Catal. 297 (2013) 35–43. [43] Z.-Y. Yuan T.-Z. Ren A. Azioune J.-J. Pireaux B.-L. Su Marvelous self-assembly of hierarchically nanostructured porous zirconium phosphate solid acids with high thermal stability Catal. Today 105 2005 647 654 Z.-Y. Yuan, T.-Z. Ren, A. Azioune, J.-J. Pireaux, B.-L. Su, Marvelous self-assembly of hierarchically nanostructured porous zirconium phosphate solid acids with high thermal stability, Catal. Today 105 (2005) 647–654. [44] A. Sinhamahapatra N. Sutradhar B. Roy A. Tarafdar H.C. Bajaj A.B. Panda Mesoporous zirconium phosphate catalyzed reactions: synthesis of industrially important chemicals in solvent-free conditions Appl. Catal. A Gen. 385 2010 22 30 A. Sinhamahapatra, N. Sutradhar, B. Roy, A. Tarafdar, H.C. Bajaj, A.B. Panda, Mesoporous zirconium phosphate catalyzed reactions: synthesis of industrially important chemicals in solvent-free conditions, Appl. Catal. A Gen. 385 (2010) 22–30. [45] K.-I. Segawa Y. Nakajima S.-I. Nakata S. Asaoka H. Takahashi 31P-MAS NMR spectroscopic studies with zirconium phosphate catalysts J. Catal. 101 1986 81 89 K.-I. Segawa, Y. Nakajima, S.-I. Nakata, S. Asaoka, H. Takahashi, 31P-MAS NMR spectroscopic studies with zirconium phosphate catalysts, J. Catal. 101 (1986) 81–89. [46] W. Guo E.J.M. Hensen W. Qi H.J. Heeres J. Yue Titanium phosphate grafted on mesoporous SBA-15 silica as a solid acid catalyst for the synthesis of 5-hydroxymethylfurfural from glucose ACS Sustain. Chem. Eng. 10 2022 10157 10168 W. Guo, E.J.M. Hensen, W. Qi, H.J. Heeres, J. Yue, Titanium phosphate grafted on mesoporous SBA-15 silica as a solid acid catalyst for the synthesis of 5-hydroxymethylfurfural from glucose, ACS Sustain. Chem. Eng. 10 (2022) 10157–10168. [47] K. Bhattacharyya S. Varma A.K. Tripathi S.R. Bharadwaj A.K. Tyagi Mechanistic insight by in situ FTIR for the gas phase photo-oxidation of ethylene by V-doped titania and nano titania J. Phys. Chem. B. 113 2009 5917 5928 K. Bhattacharyya, S. Varma, A.K. Tripathi, S.R. Bharadwaj, A.K. Tyagi, Mechanistic insight by in situ FTIR for the gas phase photo-oxidation of ethylene by V-doped titania and nano titania, J. Phys. Chem. B. 113 (2009) 5917–5928. [48] Z. Gao Y. Feng L. Zhang X. Zeng Y. Sun X. Tang T. Lei L. Lin Catalytic conversion of biomass-derived 2,5-dimethylfuran into renewable p-xylene over SAPO-34 catalyst ChemistrySelect 5 2020 2449 2454 Z. Gao, Y. Feng, L. Zhang, X. Zeng, Y. Sun, X. Tang, T. Lei, L. Lin, Catalytic conversion of biomass-derived 2,5-dimethylfuran into renewable p-xylene over SAPO-34 catalyst, ChemistrySelect 5 (2020) 2449–2454. [49] S. Rawat B. Singh R. Kumar C. Pendem S. Bhandari K. Natte A. Narani Value addition of lignin to zingerone using recyclable AlPO4 and Ni/LRC catalysts Chem. Eng. J. 431 2022 134130 134141 S. Rawat, B. Singh, R. Kumar, C. Pendem, S. Bhandari, K. Natte, A. Narani, Value addition of lignin to zingerone using recyclable AlPO4 and Ni/LRC catalysts, Chem. Eng. J. 431 (2022) 134130–134141. [50] C.L. Williams K.P. Vinter C.C. Chang R. Xiong S.K. Green S.I. Sandler D.G. Vlachos W. Fan P.J. Dauenhauer Kinetic regimes in the tandem reactions of H-BEA catalyzed formation of p-xylene from dimethylfuran Catal. Sci. Technol. 6 2016 178 187 C.L. Williams, K.P. Vinter, C.C. Chang, R. Xiong, S.K. Green, S.I. Sandler, D.G. Vlachos, W. Fan, P.J. Dauenhauer, Kinetic regimes in the tandem reactions of H-BEA catalyzed formation of p-xylene from dimethylfuran, Catal. Sci. Technol. 6 (2016) 178–187. [51] J. Yu S. Zhu P.J. Dauenhauer H.J. Cho W. Fan R.J. Gorte Adsorption and reaction properties of SnBEA, ZrBEA and H-BEA for the formation of p-xylene from DMF and ethylene Catal. Sci. Technol. 6 2016 5729 5736 J. Yu, S. Zhu, P.J. Dauenhauer, H.J. Cho, W. Fan, R.J. Gorte, Adsorption and reaction properties of SnBEA, ZrBEA and H-BEA for the formation of p-xylene from DMF and ethylene, Catal. Sci. Technol. 6 (2016) 5729–5736. [52] C. Wu T. Wu J. Li C.-L. Liu W.-S. Dong Highly efficient catalytic conversion of biomass-derived 2,5-dimethylfuran into renewable p-xylene over zirconium phosphate catalysts Appl. Catal. A Gen. 663 2023 119323 119334 C. Wu, T. Wu, J. Li, C.-L. Liu, W.-S. Dong, Highly efficient catalytic conversion of biomass-derived 2,5-dimethylfuran into renewable p-xylene over zirconium phosphate catalysts, Appl. Catal. A Gen. 663 (2023) 119323–119334. [53] R.E. Patet M. Koehle R.F. Lobo S. Caratzoulas D.G. Vlachos General acid-type catalysis in the dehydrative aromatization of furans to aromatics in H-[Al]-BEA, H-[Fe]-BEA, H-[Ga]-BEA, and H-[B]-BEA zeolites J. Phys. Chem. C. 121 2017 13666 13679 R.E. Patet, M. Koehle, R.F. Lobo, S. Caratzoulas, D.G. Vlachos, General acid-type catalysis in the dehydrative aromatization of furans to aromatics in H-[Al]-BEA, H-[Fe]-BEA, H-[Ga]-BEA, and H-[B]-BEA zeolites, J. Phys. Chem. C. 121 (2017) 13666–13679. [54] Z. Cui X. Feng H. Li T. Tan Interconversion of Lewis acid and Brønsted acid catalysts in biomass-derived paraxylene synthesis Chem. Eng. Sci. 227 2020 115942 115950 Z. Cui, X. Feng, H. Li, T. Tan, Interconversion of Lewis acid and Brønsted acid catalysts in biomass-derived paraxylene synthesis, Chem. Eng. Sci. 227 (2020) 115942–115950.",
      "scopus-id": "85178567713",
      "coredata": {
        "eid": "1-s2.0-S0926860X2300501X",
        "dc:description": "Efficient production of renewable p-xylene (PX) from bio-based 2,5-dimethylfuran (DMF) and ethylene is challenging. Herein, novel nanoflake-like zirconium-tin phosphate catalysts were synthesized, and their catalytic performance was evaluated in the conversion of DMF and ethylene to PX. The DMF conversion, PX selectivity and PX yield reached up to 99%, 95.2% and 94.2%, respectively over Zr0.6Sn0.4P under relatively mild conditions. The PX productivity was 61.1 mmolPX·gcat −1·h−1, which is better than that of previously reported catalysts. By combining characterization with activity test, it was found that enhanced DMF and ethylene adsorption is beneficial to promoting the reaction between DMF and ethylene. Precise regulation of acid sites is crucial for inhibiting the occurrence of side reactions and improving the selectivity of PX. The kinetic analysis revealed that Zr0.6Sn0.4P had a relatively low apparent activation energy (39 kJ·mol−1) for this reaction than previously reported catalysts. In addition, the Zr0.6Sn0.4P catalyst exhibited an excellent reusability.",
        "openArchiveArticle": "false",
        "prism:coverDate": "2024-01-25",
        "openaccessUserLicense": null,
        "prism:aggregationType": "Journal",
        "prism:url": "https://api.elsevier.com/content/article/pii/S0926860X2300501X",
        "dc:creator": [
          {
            "@_fa": "true",
            "$": "Wu, Chengming"
          },
          {
            "@_fa": "true",
            "$": "Chen, Hongbo"
          },
          {
            "@_fa": "true",
            "$": "Li, Jifan"
          },
          {
            "@_fa": "true",
            "$": "Liu, Chun-Ling"
          },
          {
            "@_fa": "true",
            "$": "Dong, Wen-Sheng"
          }
        ],
        "link": [
          {
            "@_fa": "true",
            "@rel": "self",
            "@href": "https://api.elsevier.com/content/article/pii/S0926860X2300501X"
          },
          {
            "@_fa": "true",
            "@rel": "scidir",
            "@href": "https://www.sciencedirect.com/science/article/pii/S0926860X2300501X"
          }
        ],
        "dc:format": "application/json",
        "openaccessType": null,
        "pii": "S0926-860X(23)00501-X",
        "prism:volume": "670",
        "articleNumber": "119521",
        "prism:publisher": "Elsevier B.V.",
        "dc:title": "Zirconium-tin phosphate as an efficient catalyst for renewable p-xylene synthesis from biobased 2,5-dimethylfuran and ethylene",
        "prism:copyright": "© 2023 Elsevier B.V. All rights reserved.",
        "openaccess": "0",
        "prism:issn": "0926860X",
        "dcterms:subject": [
          {
            "@_fa": "true",
            "$": "Biomass"
          },
          {
            "@_fa": "true",
            "$": "2,5-Dimethylfuran"
          },
          {
            "@_fa": "true",
            "$": "Zirconium-tin phosphate"
          },
          {
            "@_fa": "true",
            "$": "Reaction mechanism"
          },
          {
            "@_fa": "true",
            "$": "p-Xylene"
          }
        ],
        "openaccessArticle": "false",
        "prism:publicationName": "Applied Catalysis A: General",
        "openaccessSponsorType": null,
        "prism:pageRange": "119521",
        "pubType": "fla",
        "prism:coverDisplayDate": "25 January 2024",
        "prism:doi": "10.1016/j.apcata.2023.119521",
        "prism:startingPage": "119521",
        "dc:identifier": "doi:10.1016/j.apcata.2023.119521",
        "openaccessSponsorName": null
      },
      "objects": {
        "object": [
          {
            "@category": "standard",
            "@height": "76",
            "@width": "678",
            "@_fa": "true",
            "$": "https://api.elsevier.com/content/object/eid/1-s2.0-S0926860X2300501X-fx1.jpg?httpAccept=%2A%2F%2A",
            "@multimediatype": "JPEG image file",
            "@type": "IMAGE-DOWNSAMPLED",
            "@size": "12459",
            "@ref": "fx1",
            "@mimetype": "image/jpeg"
          },
          {
            "@category": "standard",
            "@height": "200",
            "@width": "359",
            "@_fa": "true",
            "$": "https://api.elsevier.com/content/object/eid/1-s2.0-S0926860X2300501X-ga1.jpg?httpAccept=%2A%2F%2A",
            "@multimediatype": "JPEG image file",
            "@type": "IMAGE-DOWNSAMPLED",
            "@size": "28755",
            "@ref": "ga1",
            "@mimetype": "image/jpeg"
          },
          {
            "@category": "standard",
            "@height": "530",
            "@width": "678",
            "@_fa": "true",
            "$": "https://api.elsevier.com/content/object/eid/1-s2.0-S0926860X2300501X-gr9.jpg?httpAccept=%2A%2F%2A",
            "@multimediatype": "JPEG image file",
            "@type": "IMAGE-DOWNSAMPLED",
            "@size": "77236",
            "@ref": "gr9",
            "@mimetype": "image/jpeg"
          },
          {
            "@category": "standard",
            "@height": "281",
            "@width": "678",
            "@_fa": "true",
            "$": "https://api.elsevier.com/content/object/eid/1-s2.0-S0926860X2300501X-gr8.jpg?httpAccept=%2A%2F%2A",
            "@multimediatype": "JPEG image file",
            "@type": "IMAGE-DOWNSAMPLED",
            "@size": "51964",
            "@ref": "gr8",
            "@mimetype": "image/jpeg"
          },
          {
            "@category": "standard",
            "@height": "262",
            "@width": "678",
            "@_fa": "true",
            "$": "https://api.elsevier.com/content/object/eid/1-s2.0-S0926860X2300501X-gr5.jpg?httpAccept=%2A%2F%2A",
            "@multimediatype": "JPEG image file",
            "@type": "IMAGE-DOWNSAMPLED",
            "@size": "39300",
            "@ref": "gr5",
            "@mimetype": "image/jpeg"
          },
          {
            "@category": "standard",
            "@height": "280",
            "@width": "751",
            "@_fa": "true",
            "$": "https://api.elsevier.com/content/object/eid/1-s2.0-S0926860X2300501X-gr4.jpg?httpAccept=%2A%2F%2A",
            "@multimediatype": "JPEG image file",
            "@type": "IMAGE-DOWNSAMPLED",
            "@size": "64694",
            "@ref": "gr4",
            "@mimetype": "image/jpeg"
          },
          {
            "@category": "standard",
            "@height": "285",
            "@width": "678",
            "@_fa": "true",
            "$": "https://api.elsevier.com/content/object/eid/1-s2.0-S0926860X2300501X-gr7.jpg?httpAccept=%2A%2F%2A",
            "@multimediatype": "JPEG image file",
            "@type": "IMAGE-DOWNSAMPLED",
            "@size": "33662",
            "@ref": "gr7",
            "@mimetype": "image/jpeg"
          },
          {
            "@category": "standard",
            "@height": "538",
            "@width": "678",
            "@_fa": "true",
            "$": "https://api.elsevier.com/content/object/eid/1-s2.0-S0926860X2300501X-gr6.jpg?httpAccept=%2A%2F%2A",
            "@multimediatype": "JPEG image file",
            "@type": "IMAGE-DOWNSAMPLED",
            "@size": "106628",
            "@ref": "gr6",
            "@mimetype": "image/jpeg"
          },
          {
            "@category": "standard",
            "@height": "238",
            "@width": "678",
            "@_fa": "true",
            "$": "https://api.elsevier.com/content/object/eid/1-s2.0-S0926860X2300501X-gr1.jpg?httpAccept=%2A%2F%2A",
            "@multimediatype": "JPEG image file",
            "@type": "IMAGE-DOWNSAMPLED",
            "@size": "62463",
            "@ref": "gr1",
            "@mimetype": "image/jpeg"
          },
          {
            "@category": "standard",
            "@height": "535",
            "@width": "678",
            "@_fa": "true",
            "$": "https://api.elsevier.com/content/object/eid/1-s2.0-S0926860X2300501X-gr3.jpg?httpAccept=%2A%2F%2A",
            "@multimediatype": "JPEG image file",
            "@type": "IMAGE-DOWNSAMPLED",
            "@size": "113018",
            "@ref": "gr3",
            "@mimetype": "image/jpeg"
          },
          {
            "@category": "standard",
            "@height": "421",
            "@width": "751",
            "@_fa": "true",
            "$": "https://api.elsevier.com/content/object/eid/1-s2.0-S0926860X2300501X-gr2.jpg?httpAccept=%2A%2F%2A",
            "@multimediatype": "JPEG image file",
            "@type": "IMAGE-DOWNSAMPLED",
            "@size": "120448",
            "@ref": "gr2",
            "@mimetype": "image/jpeg"
          },
          {
            "@category": "standard",
            "@height": "292",
            "@width": "678",
            "@_fa": "true",
            "$": "https://api.elsevier.com/content/object/eid/1-s2.0-S0926860X2300501X-sc2.jpg?httpAccept=%2A%2F%2A",
            "@multimediatype": "JPEG image file",
            "@type": "IMAGE-DOWNSAMPLED",
            "@size": "39533",
            "@ref": "sc2",
            "@mimetype": "image/jpeg"
          },
          {
            "@category": "standard",
            "@height": "480",
            "@width": "678",
            "@_fa": "true",
            "$": "https://api.elsevier.com/content/object/eid/1-s2.0-S0926860X2300501X-sc1.jpg?httpAccept=%2A%2F%2A",
            "@multimediatype": "JPEG image file",
            "@type": "IMAGE-DOWNSAMPLED",
            "@size": "65128",
            "@ref": "sc1",
            "@mimetype": "image/jpeg"
          },
          {
            "@category": "thumbnail",
            "@height": "25",
            "@width": "219",
            "@_fa": "true",
            "$": "https://api.elsevier.com/content/object/eid/1-s2.0-S0926860X2300501X-fx1.sml?httpAccept=%2A%2F%2A",
            "@multimediatype": "GIF image file",
            "@type": "IMAGE-THUMBNAIL",
            "@size": "1718",
            "@ref": "fx1",
            "@mimetype": "image/gif"
          },
          {
            "@category": "thumbnail",
            "@height": "122",
            "@width": "219",
            "@_fa": "true",
            "$": "https://api.elsevier.com/content/object/eid/1-s2.0-S0926860X2300501X-ga1.sml?httpAccept=%2A%2F%2A",
            "@multimediatype": "GIF image file",
            "@type": "IMAGE-THUMBNAIL",
            "@size": "20902",
            "@ref": "ga1",
            "@mimetype": "image/gif"
          },
          {
            "@category": "thumbnail",
            "@height": "164",
            "@width": "210",
            "@_fa": "true",
            "$": "https://api.elsevier.com/content/object/eid/1-s2.0-S0926860X2300501X-gr9.sml?httpAccept=%2A%2F%2A",
            "@multimediatype": "GIF image file",
            "@type": "IMAGE-THUMBNAIL",
            "@size": "10383",
            "@ref": "gr9",
            "@mimetype": "image/gif"
          },
          {
            "@category": "thumbnail",
            "@height": "91",
            "@width": "219",
            "@_fa": "true",
            "$": "https://api.elsevier.com/content/object/eid/1-s2.0-S0926860X2300501X-gr8.sml?httpAccept=%2A%2F%2A",
            "@multimediatype": "GIF image file",
            "@type": "IMAGE-THUMBNAIL",
            "@size": "7925",
            "@ref": "gr8",
            "@mimetype": "image/gif"
          },
          {
            "@category": "thumbnail",
            "@height": "85",
            "@width": "219",
            "@_fa": "true",
            "$": "https://api.elsevier.com/content/object/eid/1-s2.0-S0926860X2300501X-gr5.sml?httpAccept=%2A%2F%2A",
            "@multimediatype": "GIF image file",
            "@type": "IMAGE-THUMBNAIL",
            "@size": "5819",
            "@ref": "gr5",
            "@mimetype": "image/gif"
          },
          {
            "@category": "thumbnail",
            "@height": "82",
            "@width": "219",
            "@_fa": "true",
            "$": "https://api.elsevier.com/content/object/eid/1-s2.0-S0926860X2300501X-gr4.sml?httpAccept=%2A%2F%2A",
            "@multimediatype": "GIF image file",
            "@type": "IMAGE-THUMBNAIL",
            "@size": "8711",
            "@ref": "gr4",
            "@mimetype": "image/gif"
          },
          {
            "@category": "thumbnail",
            "@height": "92",
            "@width": "219",
            "@_fa": "true",
            "$": "https://api.elsevier.com/content/object/eid/1-s2.0-S0926860X2300501X-gr7.sml?httpAccept=%2A%2F%2A",
            "@multimediatype": "GIF image file",
            "@type": "IMAGE-THUMBNAIL",
            "@size": "4813",
            "@ref": "gr7",
            "@mimetype": "image/gif"
          },
          {
            "@category": "thumbnail",
            "@height": "164",
            "@width": "206",
            "@_fa": "true",
            "$": "https://api.elsevier.com/content/object/eid/1-s2.0-S0926860X2300501X-gr6.sml?httpAccept=%2A%2F%2A",
            "@multimediatype": "GIF image file",
            "@type": "IMAGE-THUMBNAIL",
            "@size": "17001",
            "@ref": "gr6",
            "@mimetype": "image/gif"
          },
          {
            "@category": "thumbnail",
            "@height": "77",
            "@width": "219",
            "@_fa": "true",
            "$": "https://api.elsevier.com/content/object/eid/1-s2.0-S0926860X2300501X-gr1.sml?httpAccept=%2A%2F%2A",
            "@multimediatype": "GIF image file",
            "@type": "IMAGE-THUMBNAIL",
            "@size": "8324",
            "@ref": "gr1",
            "@mimetype": "image/gif"
          },
          {
            "@category": "thumbnail",
            "@height": "164",
            "@width": "208",
            "@_fa": "true",
            "$": "https://api.elsevier.com/content/object/eid/1-s2.0-S0926860X2300501X-gr3.sml?httpAccept=%2A%2F%2A",
            "@multimediatype": "GIF image file",
            "@type": "IMAGE-THUMBNAIL",
            "@size": "14099",
            "@ref": "gr3",
            "@mimetype": "image/gif"
          },
          {
            "@category": "thumbnail",
            "@height": "123",
            "@width": "219",
            "@_fa": "true",
            "$": "https://api.elsevier.com/content/object/eid/1-s2.0-S0926860X2300501X-gr2.sml?httpAccept=%2A%2F%2A",
            "@multimediatype": "GIF image file",
            "@type": "IMAGE-THUMBNAIL",
            "@size": "19758",
            "@ref": "gr2",
            "@mimetype": "image/gif"
          },
          {
            "@category": "thumbnail",
            "@height": "94",
            "@width": "219",
            "@_fa": "true",
            "$": "https://api.elsevier.com/content/object/eid/1-s2.0-S0926860X2300501X-sc2.sml?httpAccept=%2A%2F%2A",
            "@multimediatype": "GIF image file",
            "@type": "IMAGE-THUMBNAIL",
            "@size": "5066",
            "@ref": "sc2",
            "@mimetype": "image/gif"
          },
          {
            "@category": "thumbnail",
            "@height": "155",
            "@width": "219",
            "@_fa": "true",
            "$": "https://api.elsevier.com/content/object/eid/1-s2.0-S0926860X2300501X-sc1.sml?httpAccept=%2A%2F%2A",
            "@multimediatype": "GIF image file",
            "@type": "IMAGE-THUMBNAIL",
            "@size": "7898",
            "@ref": "sc1",
            "@mimetype": "image/gif"
          },
          {
            "@category": "high",
            "@height": "335",
            "@width": "2994",
            "@_fa": "true",
            "$": "https://api.elsevier.com/content/object/eid/1-s2.0-S0926860X2300501X-fx1_lrg.jpg?httpAccept=%2A%2F%2A",
            "@multimediatype": "JPEG image file",
            "@type": "IMAGE-HIGH-RES",
            "@size": "62598",
            "@ref": "fx1",
            "@mimetype": "image/jpeg"
          },
          {
            "@category": "high",
            "@height": "886",
            "@width": "1591",
            "@_fa": "true",
            "$": "https://api.elsevier.com/content/object/eid/1-s2.0-S0926860X2300501X-ga1_lrg.jpg?httpAccept=%2A%2F%2A",
            "@multimediatype": "JPEG image file",
            "@type": "IMAGE-HIGH-RES",
            "@size": "310975",
            "@ref": "ga1",
            "@mimetype": "image/jpeg"
          },
          {
            "@category": "high",
            "@height": "2340",
            "@width": "2994",
            "@_fa": "true",
            "$": "https://api.elsevier.com/content/object/eid/1-s2.0-S0926860X2300501X-gr9_lrg.jpg?httpAccept=%2A%2F%2A",
            "@multimediatype": "JPEG image file",
            "@type": "IMAGE-HIGH-RES",
            "@size": "447057",
            "@ref": "gr9",
            "@mimetype": "image/jpeg"
          },
          {
            "@category": "high",
            "@height": "1242",
            "@width": "2994",
            "@_fa": "true",
            "$": "https://api.elsevier.com/content/object/eid/1-s2.0-S0926860X2300501X-gr8_lrg.jpg?httpAccept=%2A%2F%2A",
            "@multimediatype": "JPEG image file",
            "@type": "IMAGE-HIGH-RES",
            "@size": "384734",
            "@ref": "gr8",
            "@mimetype": "image/jpeg"
          },
          {
            "@category": "high",
            "@height": "1156",
            "@width": "2994",
            "@_fa": "true",
            "$": "https://api.elsevier.com/content/object/eid/1-s2.0-S0926860X2300501X-gr5_lrg.jpg?httpAccept=%2A%2F%2A",
            "@multimediatype": "JPEG image file",
            "@type": "IMAGE-HIGH-RES",
            "@size": "236667",
            "@ref": "gr5",
            "@mimetype": "image/jpeg"
          },
          {
            "@category": "high",
            "@height": "1240",
            "@width": "3326",
            "@_fa": "true",
            "$": "https://api.elsevier.com/content/object/eid/1-s2.0-S0926860X2300501X-gr4_lrg.jpg?httpAccept=%2A%2F%2A",
            "@multimediatype": "JPEG image file",
            "@type": "IMAGE-HIGH-RES",
            "@size": "354136",
            "@ref": "gr4",
            "@mimetype": "image/jpeg"
          },
          {
            "@category": "high",
            "@height": "1257",
            "@width": "2994",
            "@_fa": "true",
            "$": "https://api.elsevier.com/content/object/eid/1-s2.0-S0926860X2300501X-gr7_lrg.jpg?httpAccept=%2A%2F%2A",
            "@multimediatype": "JPEG image file",
            "@type": "IMAGE-HIGH-RES",
            "@size": "190721",
            "@ref": "gr7",
            "@mimetype": "image/jpeg"
          },
          {
            "@category": "high",
            "@height": "2377",
            "@width": "2994",
            "@_fa": "true",
            "$": "https://api.elsevier.com/content/object/eid/1-s2.0-S0926860X2300501X-gr6_lrg.jpg?httpAccept=%2A%2F%2A",
            "@multimediatype": "JPEG image file",
            "@type": "IMAGE-HIGH-RES",
            "@size": "874864",
            "@ref": "gr6",
            "@mimetype": "image/jpeg"
          },
          {
            "@category": "high",
            "@height": "1049",
            "@width": "2994",
            "@_fa": "true",
            "$": "https://api.elsevier.com/content/object/eid/1-s2.0-S0926860X2300501X-gr1_lrg.jpg?httpAccept=%2A%2F%2A",
            "@multimediatype": "JPEG image file",
            "@type": "IMAGE-HIGH-RES",
            "@size": "341979",
            "@ref": "gr1",
            "@mimetype": "image/jpeg"
          },
          {
            "@category": "high",
            "@height": "2362",
            "@width": "2994",
            "@_fa": "true",
            "$": "https://api.elsevier.com/content/object/eid/1-s2.0-S0926860X2300501X-gr3_lrg.jpg?httpAccept=%2A%2F%2A",
            "@multimediatype": "JPEG image file",
            "@type": "IMAGE-HIGH-RES",
            "@size": "616236",
            "@ref": "gr3",
            "@mimetype": "image/jpeg"
          },
          {
            "@category": "high",
            "@height": "1864",
            "@width": "3326",
            "@_fa": "true",
            "$": "https://api.elsevier.com/content/object/eid/1-s2.0-S0926860X2300501X-gr2_lrg.jpg?httpAccept=%2A%2F%2A",
            "@multimediatype": "JPEG image file",
            "@type": "IMAGE-HIGH-RES",
            "@size": "787259",
            "@ref": "gr2",
            "@mimetype": "image/jpeg"
          },
          {
            "@category": "high",
            "@height": "1290",
            "@width": "2994",
            "@_fa": "true",
            "$": "https://api.elsevier.com/content/object/eid/1-s2.0-S0926860X2300501X-sc2_lrg.jpg?httpAccept=%2A%2F%2A",
            "@multimediatype": "JPEG image file",
            "@type": "IMAGE-HIGH-RES",
            "@size": "216304",
            "@ref": "sc2",
            "@mimetype": "image/jpeg"
          },
          {
            "@category": "high",
            "@height": "2121",
            "@width": "2994",
            "@_fa": "true",
            "$": "https://api.elsevier.com/content/object/eid/1-s2.0-S0926860X2300501X-sc1_lrg.jpg?httpAccept=%2A%2F%2A",
            "@multimediatype": "JPEG image file",
            "@type": "IMAGE-HIGH-RES",
            "@size": "346587",
            "@ref": "sc1",
            "@mimetype": "image/jpeg"
          },
          {
            "@category": "standard",
            "@_fa": "true",
            "$": "https://api.elsevier.com/content/object/eid/1-s2.0-S0926860X2300501X-mmc1.docx?httpAccept=%2A%2F%2A",
            "@multimediatype": "Microsoft Word file",
            "@type": "APPLICATION",
            "@size": "2233856",
            "@ref": "mmc1",
            "@mimetype": "application/word"
          },
          {
            "@category": "thumbnail",
            "@_fa": "true",
            "$": "https://api.elsevier.com/content/object/eid/1-s2.0-S0926860X2300501X-si0001.svg?httpAccept=%2A%2F%2A",
            "@multimediatype": "Scalable Vector Graphics file",
            "@type": "ALTIMG",
            "@size": "3983",
            "@ref": "si0001",
            "@mimetype": "image/svg+xml"
          },
          {
            "@category": "thumbnail",
            "@_fa": "true",
            "$": "https://api.elsevier.com/content/object/eid/1-s2.0-S0926860X2300501X-si0002.svg?httpAccept=%2A%2F%2A",
            "@multimediatype": "Scalable Vector Graphics file",
            "@type": "ALTIMG",
            "@size": "3788",
            "@ref": "si0002",
            "@mimetype": "image/svg+xml"
          },
          {
            "@category": "thumbnail",
            "@_fa": "true",
            "$": "https://api.elsevier.com/content/object/eid/1-s2.0-S0926860X2300501X-si0003.svg?httpAccept=%2A%2F%2A",
            "@multimediatype": "Scalable Vector Graphics file",
            "@type": "ALTIMG",
            "@size": "3886",
            "@ref": "si0003",
            "@mimetype": "image/svg+xml"
          },
          {
            "@category": "thumbnail",
            "@_fa": "true",
            "$": "https://api.elsevier.com/content/object/eid/1-s2.0-S0926860X2300501X-si0004.svg?httpAccept=%2A%2F%2A",
            "@multimediatype": "Scalable Vector Graphics file",
            "@type": "ALTIMG",
            "@size": "1247",
            "@ref": "si0004",
            "@mimetype": "image/svg+xml"
          },
          {
            "@category": "thumbnail",
            "@_fa": "true",
            "$": "https://api.elsevier.com/content/object/eid/1-s2.0-S0926860X2300501X-si0005.svg?httpAccept=%2A%2F%2A",
            "@multimediatype": "Scalable Vector Graphics file",
            "@type": "ALTIMG",
            "@size": "1268",
            "@ref": "si0005",
            "@mimetype": "image/svg+xml"
          },
          {
            "@category": "thumbnail",
            "@_fa": "true",
            "$": "https://api.elsevier.com/content/object/eid/1-s2.0-S0926860X2300501X-si0006.svg?httpAccept=%2A%2F%2A",
            "@multimediatype": "Scalable Vector Graphics file",
            "@type": "ALTIMG",
            "@size": "1247",
            "@ref": "si0006",
            "@mimetype": "image/svg+xml"
          },
          {
            "@category": "thumbnail",
            "@_fa": "true",
            "$": "https://api.elsevier.com/content/object/eid/1-s2.0-S0926860X2300501X-si0007.svg?httpAccept=%2A%2F%2A",
            "@multimediatype": "Scalable Vector Graphics file",
            "@type": "ALTIMG",
            "@size": "1247",
            "@ref": "si0007",
            "@mimetype": "image/svg+xml"
          },
          {
            "@category": "standard",
            "@_fa": "true",
            "$": "https://api.elsevier.com/content/object/eid/1-s2.0-S0926860X2300501X-am.pdf?httpAccept=%2A%2F%2A",
            "@multimediatype": "Acrobat PDF file",
            "@type": "AAM-PDF",
            "@size": "2516779",
            "@ref": "am",
            "@mimetype": "application/pdf"
          }
        ]
      },
      "link": {
        "@rel": "abstract",
        "@href": "https://api.elsevier.com/content/abstract/scopus_id/85178567713"
      }
    }
  }
}