{
  "metadata": {
    "title": "Superb three-dimensional porous-structured metal foam-supported Ni/Ce/Al-CF ensemble as an active structured catalyst for hydrogen production via methanol decomposition",
    "authors": "; ; ",
    "journal": "Applied Catalysis A: General",
    "date": "2025-09-25",
    "doi": "10.1016/j.apcata.2025.120450",
    "abstract": "",
    "uri": "https://api.elsevier.com/content/article/pii/S0926860X25003515",
    "pii": "S0926860X25003515"
  },
  "fulltext": {
    "full-text-retrieval-response": {
      "scopus-eid": "2-s2.0-105010522310",
      "originalText": "serial JL 271346 291210 291744 291809 31 Applied Catalysis A: General APPLIEDCATALYSISAGENERAL 2025-07-13 2025-07-13 2025-07-15 2025-07-15 2025-08-02T16:52:27 1-s2.0-S0926860X25003515 S0926-860X(25)00351-5 S0926860X25003515 10.1016/j.apcata.2025.120450 S300 S300.1 FULL-TEXT 1-s2.0-S0926860X25X00132 2025-08-02T15:56:28.100008Z 0 0 20250925 2025 2025-07-13T14:21:59.076521Z absattachment articleinfo articlenumber articletitlenorm authfirstinitialnorm authfirstsurnamenorm cid cids contenttype copyright crossmark dateloaded dateloadedtxt datesearch datesort dateupdated dco docsubtype doctype doi eid ewtransactionid hubeid indexeddate issn issnnorm itemstage itemtransactionid itemweight openaccess openarchive pg pgfirst pii piinorm pubdatestart pubdatetxt pubyr sortorder srctitle srctitlenorm srctype ssids alllist content subj subheadings suppl tomb volfirst volissue volumelist webpdf webpdfpagecount yearnav figure table e-component body mmlmath acknowledge affil appendices articletitle auth authfirstini authfull authkeywords authlast grantnumber grantsponsor grantsponsorid orcid primabst ref specialabst 0926-860X 0926860X true 705 705 C Volume 705 19 120450 120450 120450 20250925 25 September 2025 2025-09-25 2025 article fla © 2025 Elsevier B.V. All rights are reserved, including those for text and data mining, AI training, and similar technologies. SUPERBTHREEDIMENSIONALPOROUSSTRUCTUREDMETALFOAMSUPPORTEDNICEALCFENSEMBLEACTIVESTRUCTUREDCATALYSTFORHYDROGENPRODUCTIONVIAMETHANOLDECOMPOSITION FU L 1 Introduction 2 Experimental section 2.1 Chemical reagents 2.2 Catalysts synthesis 2.3 Characterization techniques 2.4 Catalytic activity tests 3 Results and discussion 3.1 SEM imaging 3.2 BET 3.3 X-ray diffraction 3.4 XPS 3.5 H2-TPR 3.6 CH3OH-TPD 3.7 MD Performance analysis of catalysts 3.8 Discussion 4 Conclusion CRediT authorship contribution statement Acknowledgements Appendix A Supplementary material References GUNATHILAKE 2024 10900 10969 C SUN 2024 151041 X MAZZONE 2022 118484 S SHI 2024 198 211 W VERHELST 2009 490 527 S ZHANG 2022 118481 Y SHAN 2025 162801 P KEMSHETTI 2023 2584 2587 P BIAN 2024 124020 J STEPIEN 2021 6504 Z LIAO 2024 132221 L ANAND 2025 319 341 C YOUNAS 2022 123317 M CAI 2021 120648 F CARRARO 2018 1492 1501 F WANG 2023 25100 25118 K TANG 2009 7656 7665 H CHEN 2011 3397 3408 W LI 2018 415 423 G QING 2019 16667 16674 S LI 2021 43 55 X POMPE 2018 1 9 C MITANI 2017 669 676 H XU 2014 13156 13163 Y MICHALSKADOMANSKA 2014 169 176 M ROJAS 2020 111262 H LI 2021 120206 Y WANG 2021 121388 K HU 2024 1311 1321 Y MAKHANIA 2022 591 604 M TANG 2024 3115 X YANG 2022 125036 H LI 2015 1427 1431 Y ROY 2025 C ALWU 2020 2067 2072 Y ZHAO 2023 1499 1503 D LIU 2023 12946 12958 Q LIU 2016 21990 21999 D LIU 2017 341 350 X DAO 2021 14537 14549 D LU 2024 6376 6388 S ZHANG 2022 121818 Y BAO 2020 498 508 S LUNA 2016 18 28 A RUI 2021 119581 N ZHANG 2023 122876 F LU 2024 158648 J CHEN 2024 12 22 Z HONGMANOROM 2021 120454 P SUN 2023 13974 13984 Y ZHANG 2024 118577 118599 J SONG 2020 9592 9602 Q HU 2016 2265 2279 Z GAO 2020 1006 1016 Y ZHANG 2020 14560 14566 Z SU 2023 3444 3455 Z ZHANG 2016 48 55 H ALKHOORI 2023 8550 8571 A SUTTON 2016 7241 7247 J KAITHAL 2021 26500 26505 A HOU 2024 e202402053 G YIN 2025 158723 S CHOI 2002 259 269 Y BROWN 2004 431 436 J FAN 2014 843 849 M ZHOU 2006 203 215 Y BARE 1985 L281 L291 S MAVRIKAKIS 1998 135 147 M LI 2019 709 719 N CAREY 2018 10089 10095 S WANG 2021 5771 5777 M LIU 2023 e12644 F RUAN 2023 100362 P HAN 2024 15670 15678 J FUX2025X120450 FUX2025X120450XL 2027-07-15T00:00:00.000Z 2027-07-15T00:00:00.000Z http://creativecommons.org/licenses/by-nc-nd/4.0/ © 2025 Elsevier B.V. All rights are reserved, including those for text and data mining, AI training, and similar technologies. 2025-07-17T02:48:16.407Z http://vtw.elsevier.com/data/voc/AddOnTypes/50.7/aggregated-refined National Natural Science Foundation of China 22306118 22076117 22179081 National Natural Science Foundation of China http://data.elsevier.com/vocabulary/SciValFunders/501100001809 http://sws.geonames.org/1814991 Shanghai Municipal Education Commission Shanghai Municipal Education Commission http://data.elsevier.com/vocabulary/SciValFunders/501100003395 http://sws.geonames.org/1814991/ Shanghai Education Development Foundation 21SG52 SEDF Shanghai Education Development Foundation http://data.elsevier.com/vocabulary/SciValFunders/501100003024 http://sws.geonames.org/1814991/ Program for Professor of Special Appointment Eastern Scholar at Shanghai Institutions of Higher Learning http://data.elsevier.com/vocabulary/SciValFunders/501100013285 http://sws.geonames.org/1814991 The authors are grateful to National Natural Science Foundation of China (22179081, 22076117, 22306118), ShuGuang project of Shanghai Municipal Education Commission, Shanghai Education Development Foundation (Grant No.21SG52) and the Program for Professor of Special Appointment (Eastern Scholar) at Shanghai Institutions of Higher Learning for their support on catalyst research. https://doi.org/10.15223/policy-017 https://doi.org/10.15223/policy-037 https://doi.org/10.15223/policy-012 https://doi.org/10.15223/policy-029 https://doi.org/10.15223/policy-004 item S0926-860X(25)00351-5 S0926860X25003515 1-s2.0-S0926860X25003515 10.1016/j.apcata.2025.120450 271346 2025-08-02T15:56:28.100008Z 2025-09-25 1-s2.0-S0926860X25003515-main.pdf https://s3-eu-west-1.amazonaws.com/prod-ucs-content-store-eu-west/content/pii:S0926860X25003515/MAIN/application/pdf/113371759b008eb7c01c5c8cd082da17/main.pdf main.pdf pdf true 8292965 MAIN 13 1-s2.0-S0926860X25003515-main_1.png https://s3-eu-west-1.amazonaws.com/prod-ucs-content-store-eu-west/content/pii:S0926860X25003515/PREVIEW/image/png/60ca84b75fbfcfe177894e781f0376c7/main_1.png main_1.png png 57835 928 656 IMAGE-WEB-PDF 1 1-s2.0-S0926860X25003515-gr2.jpg https://s3-eu-west-1.amazonaws.com/prod-ucs-content-store-eu-west/content/pii:S0926860X25003515/gr2/DOWNSAMPLED/image/jpeg/1012c19bbce8e393a8fc718862cdd366/gr2.jpg gr2 gr2.jpg jpg 68693 232 565 IMAGE-DOWNSAMPLED 1-s2.0-S0926860X25003515-ga1.jpg https://s3-eu-west-1.amazonaws.com/prod-ucs-content-store-eu-west/content/pii:S0926860X25003515/ga1/DOWNSAMPLED/image/jpeg/72269d448ab5f63f02bb54a0a65f5f02/ga1.jpg ga1 true ga1.jpg jpg 17206 200 296 IMAGE-DOWNSAMPLED 1-s2.0-S0926860X25003515-gr3.jpg https://s3-eu-west-1.amazonaws.com/prod-ucs-content-store-eu-west/content/pii:S0926860X25003515/gr3/DOWNSAMPLED/image/jpeg/15102bd0ba2c0c748a24d493aaedf65f/gr3.jpg gr3 gr3.jpg jpg 45088 280 715 IMAGE-DOWNSAMPLED 1-s2.0-S0926860X25003515-gr4.jpg https://s3-eu-west-1.amazonaws.com/prod-ucs-content-store-eu-west/content/pii:S0926860X25003515/gr4/DOWNSAMPLED/image/jpeg/66e7a0a365586287e3ad329c73182b7a/gr4.jpg gr4 gr4.jpg jpg 26272 329 376 IMAGE-DOWNSAMPLED 1-s2.0-S0926860X25003515-gr5.jpg https://s3-eu-west-1.amazonaws.com/prod-ucs-content-store-eu-west/content/pii:S0926860X25003515/gr5/DOWNSAMPLED/image/jpeg/05e39e75660d896fc6b4124139cdbc7a/gr5.jpg gr5 gr5.jpg jpg 139041 920 791 IMAGE-DOWNSAMPLED 1-s2.0-S0926860X25003515-gr1.jpg https://s3-eu-west-1.amazonaws.com/prod-ucs-content-store-eu-west/content/pii:S0926860X25003515/gr1/DOWNSAMPLED/image/jpeg/68d4171d75e98d358cb15965dbfcb8fa/gr1.jpg gr1 gr1.jpg jpg 122008 647 562 IMAGE-DOWNSAMPLED 1-s2.0-S0926860X25003515-gr6.jpg https://s3-eu-west-1.amazonaws.com/prod-ucs-content-store-eu-west/content/pii:S0926860X25003515/gr6/DOWNSAMPLED/image/jpeg/ca77ed903aa03ef2177d005b5cace954/gr6.jpg gr6 gr6.jpg jpg 17321 240 299 IMAGE-DOWNSAMPLED 1-s2.0-S0926860X25003515-gr7.jpg https://s3-eu-west-1.amazonaws.com/prod-ucs-content-store-eu-west/content/pii:S0926860X25003515/gr7/DOWNSAMPLED/image/jpeg/d475a70cee4ac24271988806db2e565c/gr7.jpg gr7 gr7.jpg jpg 72982 539 659 IMAGE-DOWNSAMPLED 1-s2.0-S0926860X25003515-gr8.jpg https://s3-eu-west-1.amazonaws.com/prod-ucs-content-store-eu-west/content/pii:S0926860X25003515/gr8/DOWNSAMPLED/image/jpeg/ba8d87771f9171f73532204f80817748/gr8.jpg gr8 gr8.jpg jpg 115170 852 791 IMAGE-DOWNSAMPLED 1-s2.0-S0926860X25003515-gr9.jpg https://s3-eu-west-1.amazonaws.com/prod-ucs-content-store-eu-west/content/pii:S0926860X25003515/gr9/DOWNSAMPLED/image/jpeg/5cab6665bb04fb4c0f9341833b8d4c34/gr9.jpg gr9 gr9.jpg jpg 40288 269 715 IMAGE-DOWNSAMPLED 1-s2.0-S0926860X25003515-gr2.sml https://s3-eu-west-1.amazonaws.com/prod-ucs-content-store-eu-west/content/pii:S0926860X25003515/gr2/THUMBNAIL/image/gif/6e7794cf6bae928e9372b27426bf429e/gr2.sml gr2 gr2.sml sml 16158 90 219 IMAGE-THUMBNAIL 1-s2.0-S0926860X25003515-ga1.sml https://s3-eu-west-1.amazonaws.com/prod-ucs-content-store-eu-west/content/pii:S0926860X25003515/ga1/THUMBNAIL/image/gif/19e4193b2d13811f9e0be37a3c0a4e2d/ga1.sml ga1 true ga1.sml sml 11775 148 219 IMAGE-THUMBNAIL 1-s2.0-S0926860X25003515-gr3.sml https://s3-eu-west-1.amazonaws.com/prod-ucs-content-store-eu-west/content/pii:S0926860X25003515/gr3/THUMBNAIL/image/gif/5156258801c772b5f307cd0c1f79e34f/gr3.sml gr3 gr3.sml sml 6370 86 219 IMAGE-THUMBNAIL 1-s2.0-S0926860X25003515-gr4.sml https://s3-eu-west-1.amazonaws.com/prod-ucs-content-store-eu-west/content/pii:S0926860X25003515/gr4/THUMBNAIL/image/gif/e558b3a4bdb7e63fc2bfea82f2859941/gr4.sml gr4 gr4.sml sml 7374 164 187 IMAGE-THUMBNAIL 1-s2.0-S0926860X25003515-gr5.sml https://s3-eu-west-1.amazonaws.com/prod-ucs-content-store-eu-west/content/pii:S0926860X25003515/gr5/THUMBNAIL/image/gif/2dafcb0c0e3399dd95d896b1d8168b3f/gr5.sml gr5 gr5.sml sml 9520 164 141 IMAGE-THUMBNAIL 1-s2.0-S0926860X25003515-gr1.sml https://s3-eu-west-1.amazonaws.com/prod-ucs-content-store-eu-west/content/pii:S0926860X25003515/gr1/THUMBNAIL/image/gif/b2e67015beed65d8c8ca2f36f5a0d3bb/gr1.sml gr1 gr1.sml sml 15324 163 142 IMAGE-THUMBNAIL 1-s2.0-S0926860X25003515-gr6.sml https://s3-eu-west-1.amazonaws.com/prod-ucs-content-store-eu-west/content/pii:S0926860X25003515/gr6/THUMBNAIL/image/gif/e8ff0a037251864a410ddc23df391f80/gr6.sml gr6 gr6.sml sml 7561 164 204 IMAGE-THUMBNAIL 1-s2.0-S0926860X25003515-gr7.sml https://s3-eu-west-1.amazonaws.com/prod-ucs-content-store-eu-west/content/pii:S0926860X25003515/gr7/THUMBNAIL/image/gif/fc4126b2c448ada1e63cf4e8cc76eb62/gr7.sml gr7 gr7.sml sml 10396 164 200 IMAGE-THUMBNAIL 1-s2.0-S0926860X25003515-gr8.sml https://s3-eu-west-1.amazonaws.com/prod-ucs-content-store-eu-west/content/pii:S0926860X25003515/gr8/THUMBNAIL/image/gif/a82a6b3efdcf4a20ba7cfee853264f1f/gr8.sml gr8 gr8.sml sml 8301 164 152 IMAGE-THUMBNAIL 1-s2.0-S0926860X25003515-gr9.sml https://s3-eu-west-1.amazonaws.com/prod-ucs-content-store-eu-west/content/pii:S0926860X25003515/gr9/THUMBNAIL/image/gif/11a1dd288515521c749db30717281acd/gr9.sml gr9 gr9.sml sml 5994 82 219 IMAGE-THUMBNAIL 1-s2.0-S0926860X25003515-gr2_lrg.jpg https://s3-eu-west-1.amazonaws.com/prod-ucs-content-store-eu-west/content/pii:S0926860X25003515/HIGHRES/image/jpeg/11c53436b6fca0f7f26ba101100f5ab5/gr2_lrg.jpg gr2 gr2_lrg.jpg jpg 536927 1025 2495 IMAGE-HIGH-RES 1-s2.0-S0926860X25003515-ga1_lrg.jpg https://s3-eu-west-1.amazonaws.com/prod-ucs-content-store-eu-west/content/pii:S0926860X25003515/HIGHRES/image/jpeg/cfd895357f1317f0d24603fad65387a0/ga1_lrg.jpg ga1 true ga1_lrg.jpg jpg 134065 886 1313 IMAGE-HIGH-RES 1-s2.0-S0926860X25003515-gr3_lrg.jpg https://s3-eu-west-1.amazonaws.com/prod-ucs-content-store-eu-west/content/pii:S0926860X25003515/HIGHRES/image/jpeg/451995eebc9a6f5c5dbe421be0bfd2d2/gr3_lrg.jpg gr3 gr3_lrg.jpg jpg 195644 1237 3160 IMAGE-HIGH-RES 1-s2.0-S0926860X25003515-gr4_lrg.jpg https://s3-eu-west-1.amazonaws.com/prod-ucs-content-store-eu-west/content/pii:S0926860X25003515/HIGHRES/image/jpeg/478d956ed4f99a81ea83813216823b93/gr4_lrg.jpg gr4 gr4_lrg.jpg jpg 127429 1456 1663 IMAGE-HIGH-RES 1-s2.0-S0926860X25003515-gr5_lrg.jpg https://s3-eu-west-1.amazonaws.com/prod-ucs-content-store-eu-west/content/pii:S1932620323173925/HIGHRES/image/jpeg/e90cfdfc1b3208e2c2c2aa0fabd34036/gr5_lrg.jpg gr5 gr5_lrg.jpg jpg 664924 4062 3493 IMAGE-HIGH-RES 1-s2.0-S0926860X25003515-gr1_lrg.jpg https://s3-eu-west-1.amazonaws.com/prod-ucs-content-store-eu-west/content/pii:S0926860X25003515/HIGHRES/image/jpeg/0040c0b5f9e8c782010765e0859c2c17/gr1_lrg.jpg gr1 gr1_lrg.jpg jpg 634229 2861 2487 IMAGE-HIGH-RES 1-s2.0-S0926860X25003515-gr6_lrg.jpg https://s3-eu-west-1.amazonaws.com/prod-ucs-content-store-eu-west/content/pii:S0926860X25003515/HIGHRES/image/jpeg/8127ad1a7c71e903a139cef1157ff083/gr6_lrg.jpg gr6 gr6_lrg.jpg jpg 88472 1066 1330 IMAGE-HIGH-RES 1-s2.0-S0926860X25003515-gr7_lrg.jpg https://s3-eu-west-1.amazonaws.com/prod-ucs-content-store-eu-west/content/pii:S0926860X25003515/HIGHRES/image/jpeg/87d650252392b7d555c727a7c3432831/gr7_lrg.jpg gr7 gr7_lrg.jpg jpg 336876 2383 2911 IMAGE-HIGH-RES 1-s2.0-S0926860X25003515-gr8_lrg.jpg https://s3-eu-west-1.amazonaws.com/prod-ucs-content-store-eu-west/content/pii:S1932620323173925/HIGHRES/image/jpeg/817321250eb8f583515952a3b2f529ce/gr8_lrg.jpg gr8 gr8_lrg.jpg jpg 518742 3764 3493 IMAGE-HIGH-RES 1-s2.0-S0926860X25003515-gr9_lrg.jpg https://s3-eu-west-1.amazonaws.com/prod-ucs-content-store-eu-west/content/pii:S0926860X25003515/HIGHRES/image/jpeg/13940449b32a58f817e74f7787509d34/gr9_lrg.jpg gr9 gr9_lrg.jpg jpg 175052 1188 3160 IMAGE-HIGH-RES 1-s2.0-S0926860X25003515-mmc1.docx https://s3-eu-west-1.amazonaws.com/prod-ucs-content-store-eu-west/content/pii:S0926860X25003515/mmc1/MAIN/application/vnd.openxmlformats-officedocument.wordprocessingml.document/c12ca4ef4ee4a7c548c9297c77ab01a9/mmc1.docx mmc1 mmc1.docx docx 300258 APPLICATION 1-s2.0-S0926860X25003515-si0001.svg https://s3-eu-west-1.amazonaws.com/prod-ucs-content-store-eu-west/content/pii:S0926860X25003515/image/svg+xml/c5ae3cd8db16a1610a0d7a5e278c5f52/si0001.svg si0001 si0001.svg svg 4684 ALTIMG 1-s2.0-S0926860X25003515-si0002.svg https://s3-eu-west-1.amazonaws.com/prod-ucs-content-store-eu-west/content/pii:S0926860X25003515/image/svg+xml/db7ea018ecfa0c29c692857c67490c06/si0002.svg si0002 si0002.svg svg 4575 ALTIMG 1-s2.0-S0926860X25003515-si0003.svg https://s3-eu-west-1.amazonaws.com/prod-ucs-content-store-eu-west/content/pii:S0926860X25003515/image/svg+xml/5d54c0cbd7255878838483325bf2436e/si0003.svg si0003 si0003.svg svg 4449 ALTIMG APCATA 120450 120450 S0926-860X(25)00351-5 10.1016/j.apcata.2025.120450 Elsevier B.V. Fig. 1 SEM images of blank CF(A1–A3), 2Ni-CF catalyst (B1–B3), 2Ni/3Al-CF catalyst (C1–C3), 2Ni/3Ce-CF catalyst (D1–D3), 2Ni/3Ce/3Al-CF catalyst (E1–E3). Fig. 1 Fig. 2 EDS mapping of 2Ni/3Ce/3Al-CF catalyst. Fig. 2 Fig. 3 N2 adsorption and desorption curves and pore size distribution curves of the etched catalyst (A) and the unetched catalyst (B). Fig. 3 Fig. 4 XRD patterns of the reduced catalysts. Fig. 4 Fig. 5 The XPS spectra of Ni 2p (A), O 1 s(B)and Ce 3d(C) of catalysts. Fig. 5 Fig. 6 H2-TPR profiles of all catalysts. Fig. 6 Fig. 7 Spectra of CH3OH desorption products CH3OH, H2, CO and CO2. (A) Spectrum of CH3OH, (B) Spectrum of H2, (C) Spectrum of CO, (D) Spectrum of CO2. Fig. 7 Fig. 8 Methanol conversion over different catalysts (A), H2 selectivity(B), CH4 selectivity (C) and CO selectivity of catalysts(D). Arrhenius plots of Ni-CF catalysts in CH3OH decomposition(E), activity test of 2Ni/3Ce/3Al–CF catalysts at different space velocities(F). Fig. 8 Fig. 9 Stability test (A) and Cyclic stability test (B) of 2Ni/3Ce/3Al-CF catalyst. Fig. 9 Table 1 Textural characteristics of catalysts. Table 1 Catalysts SBET(m2/g) Dp(nm) Vp(cm3/g) 2Ni/3Ce/3Al-CF 19.2621 6.4191 0.038313 CF 0.2465 8.0021 0.001318 Table 2 XPS analysis of catalysts. Table 2 Catalysts Ce3+/Ce4+ (%) Ni2+/NiTotal (%) OVac/OTotal (%) 2Ni/3Ce/3Al-CF 21.86 71.89 58.71 2Ni/3Ce-CF 15.51 66.13 48.46 2Ni/3Al-CF - 89.03 56.43 2Ni-CF - 100 44.13 Table 3 Comparison of catalytic performance and economic factors for methanol decomposition over various catalysts. Table 3 Catalyst Temp (℃) Conversion (%) H2 Selectivity (%) STY (mol H2·gcat −1·h−1) Ea (kJ·mol−1) Metal cost 2Ni/3Ce/3Al–CF (This work) 275 56.3 93.3 0.467 84.5 Low Commercial CZA [63] 290 100 - 0.099 - Low 9 %Pt–Ce/Al2O3 [64] 315 100 ∼99 0.533 - Very High Ni−15Fe−13Mg [23] ∼322 ∼7 - ∼0.5 - Low Ni3Sn [65] 600 ∼55 ＞99 0.320 - Low Superb three-dimensional porous-structured metal foam-supported Ni/Ce/Al-CF ensemble as an active structured catalyst for hydrogen production via methanol decomposition Lijie Fu Writing – original draft Validation Methodology Investigation Formal analysis a Yong Men Writing – review & editing Writing – original draft Supervision Resources Project administration Methodology Funding acquisition Conceptualization a b ⁎ Shuya Wu Validation a Shuyi Xu Validation a Guohong Wang Validation a Chongchong Kong Validation a Jinguo Wang Writing – review & editing a Feng Shi Writing – review & editing a Zhenrong Yan Writing – review & editing b c Xuelong Miao Writing – review & editing c a School of Chemistry and Chemical Engineering, Shanghai University of Engineering Science, Shanghai 201620, PR China School of Chemistry and Chemical Engineering, Shanghai University of Engineering Science Shanghai 201620 PR China School of Chemistry and Chemical Engineering, Shanghai University of Engineering Science, Shanghai, 201620, PR China b Mechanical Industrial Key Laboratory of Boiler Low-Carbon Technology, Shanghai University of Engineering Science, Shanghai 201620, PR China Mechanical Industrial Key Laboratory of Boiler Low-Carbon Technology, Shanghai University of Engineering Science Shanghai 201620 PR China Mechanical Industrial Key Laboratory of Boiler Low-Carbon Technology, Shanghai University of Engineering Science, Shanghai, 201620, PR China c School of Mechanical and Automotive Engineering, Shanghai University of Engineering Science, Shanghai 201620, PR China School of Mechanical and Automotive Engineering, Shanghai University of Engineering Science Shanghai 201620 PR China School of Mechanical and Automotive Engineering, Shanghai University of Engineering Science, Shanghai 201620, PR China ⁎ Corresponding author at: School of Chemistry and Chemical Engineering, Shanghai University of Engineering Science, Shanghai 201620, PR China. School of Chemistry and Chemical Engineering, Shanghai University of Engineering Science Shanghai 201620 PR China A series of metal foam-supported Ni-based catalysts-monometallic Ni-CF, bimetallic Ni/Ce-CF, Ni/Al-CF and trimetallic Ni/Ce/Al-CF-were prepared by modified wet chemical etching (MWCE) and employed for hydrogen production via methanol decomposition (MD) in the temperature range of 200–325 ℃. Among those catalysts, the 2Ni/3Ce/3Al-Cu foam (CF) catalyst shows the superior catalytic performance for hydrogen production, achieving a remarkable activity of almost complete methanol conversion (99.3 %) and high H2 selectivity of 91.8 % at 300 ℃. Moreover, the performance of 2Ni/3Ce/3Al-CF catalyst remained stable during the stability test for up to 40 h at 275 ℃. SEM and BET characterization show that etched copper foam can remarkably enlarge the specific surface area of the structured catalyst, provide more active sites, and enhance its catalytic activity. The strong interaction among Ni, Ce and Al induce the synergistic effect by creating abundant oxygen vacancies in the trimetallic system as evidenced by XPS. H2-TPR and XPS further revealed a crucial balance between reducibility and metal-support interactions: Al-containing catalysts like 2Ni/3Ce/3Al-CF exhibit higher reduction thresholds and confirming the role of Al in stabilizing oxidized Ni species via strong metal-support interactions. And CH3OH-TPD analysis indicated the catalyst had much higher low-temperature hydrogen production than other catalysts because of the synergistic effect of three metals, consistent with the catalyst activity test results. The developed strategy may provide insights into the development of the design principles for high-performance structured catalysts for hydrogen production via methanol decomposition. Graphical Abstract Keywords Methanol decomposition Ni-based catalysts Structured catalysts Synergy effect Hydrogen production Data Availability The authors do not have permission to share data. 1 Introduction The over-reliance on fossil fuels to sustain the economic growth and development of human society has led to extensive environmental and societal challenges, including climate change, air pollution and energy scarcity [1,2]. Consequently, there is an urgent need to transition to sustainable, efficient and low-carbon energy sources [3,4]. Hydrogen has emerged as a promising clean energy carrier for sustainable energy solutions, particularly in applications such as internal combustion engines[5]. Pure hydrogen engines offer significant environmental advantages, as hydrogen combustion produces virtually no carbon-related emissions—eliminating carbon monoxide (CO) and carbon dioxide(CO2) [6]. This positions hydrogen as a key solution for mitigating climate change and improving air quality[7]. The automotive industry faces growing pressure to comply with stringent emission regulations, such as those set by the European Union. Consequently, major manufacturers, including Cummins, Reliance, and Ashok Leyland, are investing in hydrogen engine research and development (R&D), particularly for heavy-duty vehicles, to achieve zero-carbon emissions [8]. However, the widespread adoption of pure hydrogen engines is hindered by significant technical challenges, including abnormal combustion phenomena such as pre-ignition, knocking, and backfire; material compatibility issues such as hydrogen embrittlement and lubrication system degradation; and the requirement for efficient high-pressure storage or cryogenic systems [9]. These challenges collectively necessitate innovative engineering solutions to advance the practical implementation of hydrogen engine technology. Hydrogen, as a pure fuel for internal combustion engines, faces significant challenges faces significant challenges: its low reactivity and delayed ignition may lead to inefficient combustion processes and inherent drawbacks in terms of engine compatibility [10]. These limitations restrict the direct application of pure hydrogen as a feasible fuel for conventional internal combustion systems. Recently, hydrogen-blended fuels, such as ammonia-hydrogen mixtures, have demonstrated superior combustion performance through optimized fuel reactivity and energy density [9]. Lately using methanol as a clean energy carrier has gained increasing attention, as methanol can be produced from renewable resources such as biomass or captured carbon dioxide, offering a potentially sustainable and carbon-neutral fuel source [11]. The synergistic effects of hydrogen blending with liquid fuels such as methanol not only enhance flame propagation and ignition characteristics but also mitigate thermodynamic challenges associated with pure hydrogen combustion, thereby enabling more efficient energy conversion and reduced operational demands on engine components. The integration of methanol-to-hydrogen production with internal combustion engine requirements can enable on-board hydrogen production. Methanol decomposition is a promising technological approach to the on-board production of hydrogen fuel for internal combustion engines, a versatile fuel recognized as a viable alternative to conventional fossil fuels [12,13]. This reaction involves the cleavage of carbon-hydrogen bonds in the molecule to produce hydrogen and carbon monoxide, a process that can be facilitated by various noble metal and transition metal catalysts. Cai et al. [14] synthesized Pt/MoC catalysts with different Pt loads, and catalysts with lower Pt loads promoted the formation of more α-MoC1-x. This results in a highly dispersed Pt active substance and an enhanced interaction between the active substance and the carrier, leading to 88.2 % methanol conversion at 240 ℃. Carraro et al. [15] designed a Pd/CeO2 catalyst using nanostructured ceria supports to enhance methanol decomposition performance. The 5 wt% Pd/CeO2 small nanorods achieved a 50 % methanol conversion at 150 ℃ with 99.8 % CO selectivity and an activation energy of 41 kJ/mol, outperforming previously reported Pd-based catalysts. However, despite its exceptional low-temperature activity and selectivity, the use of large amount of expensive group VIII precious metals (e.g., Pt and Pd) introduces significant cost barriers, limiting its practical application despite its superior performance [16]. To address this cost issue and make the technology more viable for widespread use, researchers have turned their attention to alternative catalysts. Transition metal Cu-based catalysts have emerged as a promising solution. Previous studies have indicated that Cu-based catalysts [17–19], like CuAl and CuZnAl, typically exhibit high catalytic activity for hydrogen generation through methanol decomposition in the temperature interval of 200–300 ℃.Wang et al. [19] found that all the CuAl catalysts prepared by different methods exhibited serious activity loss for methanol decomposition at 270 ℃ over 70 h time on stream, attributable to the sintering of Cu particles. Qing et al. [20] prepared a Cu/SiO2 catalyst via impregnation using starch-modified SiO2. The initial methanol conversion rate of the catalyst was 98.4 % at 300 ℃. However, at elevated temperature of 300 ℃, irreversible copper sintering occurred due to its low Tammann temperature (405 ℃), with decreasing hydrogen production rates over time. Coking may also occur in an irregular trend in Cu-based catalysts, accelerating the catalyst deactivation in the initial and final stages due to support impurities and structural changes. These combined factors caused distinct deactivation patterns at different reaction stages. Herein, motivated by the challenges of cost barriers inherent in noble metal systems and structural instability in Cu-based catalysts, considerable efforts have been devoted to designing and developing cost-effective and robust alternative nickel-based catalysts for sustainable hydrogen production via methanol decomposition by synergistically addressing thermal degradation limitations through enhanced metal-support interactions [21,22]. Nickel-based catalysts demonstrate superior performance in methanol decomposition compared to conventional hydrogen production technologies. Mitani et al. [23] studied Ni-25Fe and Ni-15Fe-13Mg alloy nanoparticles for methanol decomposition, and found that the Ni-15Fe-13Mg catalyst achieved 90 % methanol conversion (vs. 60 % for Ni-25Fe catalysts) with lower carbon deposition at 753 K. The enhanced activity of Ni-15Fe-13Mg originates from Mg segregating, which forms a surface MgO shell, which suppresses nanoparticle coarsening, maintains a high active surface area and provides structural stability through synergistic effects. Xu et al. [24] engineered Ni-Al nanoparticles via arc plasma evaporation. These Ni-based catalysts achieved near-complete methanol conversion (> 98 % hydrogen selectivity) at 713 K. The synergistic metal-support interaction between Ni phases and Al2O3 matrices confers exceptional structural stability, effectively suppressing carbon deposition while maintaining catalytic activity over 200 h of continuous operation. Michalska-Domańska et al. [25] reported that the microcrystalline Ni3Al thin foils exhibited good catalytic properties in methanol decomposition, with a conversion rate of 94 % at 500 ℃. The catalyst retained high efficiency despite carbon deposition, forming multi-walled carbon nanotubes and nanofibers that encapsulated Ni nanoparticles, maintaining active sites. Rojas et al. [26] reported that Ni/LDO and Ni/B-LDO catalysts featuring 5 %, 10 %, and 20 % nickel loadings on boron-modified hydrotalcite-derived mixed oxides exhibited 90–100 % methanol conversion at 450 ℃ during decomposition, with Ni/B-LDO catalysts demonstrating nearly 100 % conversion at 350 ℃. To sum up, a major limitation of these Ni-based catalysts is the requirement of high reaction temperature[27–29]. Therefore, developing low-temperature Ni-based catalysts for methanol decomposition to achieve more energy-efficient and cost-effective hydrogen production is urgently needed. Catalytic systems utilizing metallic foam substrates have garnered significant attention in recent years as a promising alternative to conventional catalyst supports, driven by the growing demand for efficient heterogeneous catalysts in energy conversion and environmental remediation applications [30]. This emerging interest stems from the unique structural advantages offered by three-dimensional porous metallic frameworks, which combine high surface-to-volume ratios with exceptional thermal/electrical conductivity and mechanical durability-properties that address critical limitations of traditional pellet or powder catalysts while enabling novel reactor design possibilities. Tang et al. [31] engineered a hierarchical CeAlOx/Ni/Ni-foam catalyst for CO2 methanation, capitalizing on the intrinsic thermal conductivity and continuous porosity of Ni foam to mitigate thermal gradients in exothermic reactions. At 240 ℃ and a GHSV of 80,000 h−1, the system achieved 80 % CO2 conversion with 98.6 % CH4 selectivity, delivering a 14-fold enhancement in space-time yield relative to conventional Ni/CeAlOx pellets. Yang et al. [32] developed silver-modified NiCo2O4 nanosheets supported on 3D microporous Ni foam for soot combustion, leveraging the interconnected structure of the foam to enhance gas-solid contact. The high porosity (>98 %) and mechanical robustness of the nickel foam provided a stable platform for cross-linked NiCo2O4 nanosheets, creating abundant contact points with soot particles and facilitating mass transfer. The catalyst maintained high stability over five cycles, retaining T50 (temperature for 50 % soot conversion) within 333–336 ℃ minimal structural degradation. These results highlight the synergistic benefits the 3D architecture of Ni foam and Ag modification for efficient soot oxidation. Li et al. [33] developed a structured Ni-CeO2-Al2O3/Ni-foam catalyst via modified wet-chemical etching, leveraging the high thermal conductivity of Ni foam to address heat transfer limitations in syngas methanation. This catalyst achieved > 99 % CO conversion and 93 % methane selectivity at 300 ℃ under a GHSV of 5000 h−1, comparable to particulate Ni-CeO2-Al2O3 catalysts but with superior thermal stability. After 1500 h of operation, it retained > 99 % CO conversion and showed minimal sintering, with Ni particles (8–10 nm) uniformly distributed on the foam structures. The aforementioned metal foams are offer a promising avenue for developing of novel monolithic catalysts and reactor technologies for hydrogen production via methanol decomposition. However, achieving effective and efficient coating methods to load catalytic active sites onto metal-foam structures remains highly desirable and significantly challenging. Herein, we propose a facile protocol to catalytically functionalize monolithic copper foams via a modified wet chemical etching method to directly synthesizing 2Ni/3Ce/3Al-Cu foam catalysts on their structures. To further enhance the activity and stability of Ni-based catalysts for low-temperature methanol decomposition, cerium and aluminum were deliberately selected as co-modifiers. CeO2 is well known for its high oxygen storage capacity and facile Ce4+/Ce3+ redox cycling, promotes the formation of oxygen vacancies and improves the activation of methanol molecules [34]. Al2O3 provides a high surface area support and contributes to the structural stabilization of the catalyst, suppressing Ni particle sintering during high-temperature operation [35]. More importantly, the interaction between Ce and Al can create a more defective lattice that promotes synergistic effects among the three metal components. These unique features underpin the novelty of the trimetallic 2Ni/3Ce/3Al-CF system in the context of efficient hydrogen production under mild conditions. The representative 2Ni/3Ce/3Al-Cu foam catalyst not only exhibits activity and selectivity comparable to conventional Ni/Al2O3 catalyst, along with excellent stability, high permeability and enhanced heat transfer. 2 Experimental section 2.1 Chemical reagents Ce(NO3)3•6 H2O (ALDRICH Chemistry, purity 99 %), Al(NO3)3•9 H2O (ALDRICH Chemistry, purity 99 %), Ni(NO3)3•6 H2O (ALDRICH Chemistry, purity 99 %) were used as precursors in the synthesis of the catalysts. The Cu foam (copper content 99.8 %;130 pores per inch (PPI); 1.5 mm thickness, 6.0 mm diameter equal to the reactor inner diameter of quartz tube (6.0 mm) respectively. And sodium dodecyl sulphate (SDS, ALDRICH Chemistry), Acetic acid (ALDRICH Chemistry, purity 99.7 %), acetone (ALDRICH Chemistry, purity 99.7 %), Hydrochloric acid (ALDRICH Chemistry, purity 99.7 %), GC-grade methanol (ALDRICH Chemistry, purity 99.9 %) and high-purity gases supplied by Air Liquide (N2, Ar, He and H2) were used in the catalytic activity tests. 2.2 Catalysts synthesis The thin-sheet metal-foam-structured catalysts were fabricated on a macro-scale using our MWCE method followed by thermal treatment for activation [33]. This method was developed based on the wet chemical etching technique. Metal foam chips of copper (Cu) were obtained from their large parent sheets by mechanical cutting and sonicated in acetone for 10 min to remove residual surface organic impurities. These circular slices were then immersed in a 3 M HCl solution at room temperature for an additional 10 min of sonication to remove the surface copper oxide layer from the Cu foam, followed by thorough rinsing with deionized water. These metal-foam chips were respectively immersed into the chemical etching solutions and held at 65 ℃ for 3 h. The chemical etching solution consisting of 1.0 mmol L−1 sodium dodecyl sulphate (SDS, C12H25-OSO3Na), 0.2 mol L−1 acetic acid (CH3COOH),0.3 mol L−1 aluminum nitrate (Al(NO3)3),0.3 mol L−1 cerous nitrate (Ce(NO3)3) and such solution with nickel nitrate (Ni(NO3)2) adding to a concentration of 0.2 mol L−1 was utilized for the Cu-foam. After wet chemical etching, the resulting foams were dried overnight at 80 ℃, followed by calcining in air at 350 ℃ for 2 h. The corresponding catalysts are denoted as 2Ni/3Ce/3Al-CF. The synthesized catalysts were designated as Ni-CF, Ni/Ce-CF, Ni/Al-CF, and Ni/Ce/Al-CF, where CF denotes the copper foam support matrix and numerical indices specify the molar ratio of promoter metals. A uniform synthesis protocol was employed to fabricate these metallic foam-supported Ni-based catalysts with varying promoter metal compositions. Specifically, the nomenclature convention adopts the following format: Ni-(Promoter1/Promoter2)-CF, where the absence of promoter designation indicates a monometallic system, while the inclusion of dual promoters (e.g., Ce/Al) signifies their co-existence with specified molar ratios. 2.3 Characterization techniques The structures of the synthesized catalysts were characterized by various physicochemical methods. (a) Scanning electron microscope (SEM) were tested by ZEISS in Germany. (b) X-ray diffraction (XRD): Powder XRD patterns were recorded on a Bruker D2 Phaser diffractometer (Germany) equipped with Cu Kα radiation (λ = 1.5418 Å, 40 kV, 40 mA). Data were collected in the 2θ range of 20–90° with a step size of 0.02° and a scan rate of 0.1°·min−1. Phase identification was performed using Jade 6.5 software, and crystallite sizes were calculated via the Scherrer equation. (c) The N2 adsorption-desorption isotherms were determined on a Micromeritics ASAP 2460 at 77 K. The specific surface areas (SBET), pore volume (VP) and pore diameter (DP) were calculated from the Brunauer-Emmett-Teller (BET) and Barrett-Joyner Halenda (BJH) models. The catalysts pretreatment were degassed at 350 ℃ for 4 h to remove the adsorbed surface residues. (d) The X-ray photoelectron spectroscopy (XPS) was performed using Thermo Scientific K-Alpha spectrometer with an Cu Kα source. The XPS spectra were analyzed using the Avantage software package and all the binding energies of elements were referenced to the C1s peak at 284.8 eV. (e) The H2 temperature programmed reduction (H2-TPR) determined the catalysts reducibility by using chemical adsorption instrument (Micromeritics Autochem II 2920). Ten chips of catalysts were charged into a U-shaped fixed-bed quartz microreactor and preheated at 300 ℃ with Ar (30 ml·min−1) for 30 min, then cooled to 50 ℃. Thereafter, the catalyst was exposed to 10 % H2/Ar (30 ml·min−1), and heated from 50 to 900 ℃ (10 ℃·min−1). A cold trap was placed before TCD and the variation in H2 uptake was monitored using TCD as a function of temperature. (f) Temperature programmed desorption of CH3OH (CH3OH-TPD) was tested by means of chemical adsorption instrument coupled with a mass spectrometry (Hiden HPR20). Catalyst was charged into a U-shaped fixed-bed quartz microreactor, pretreated at 350 ℃ for 0.5 h in 10 % H2/Ar (30 ml·min−1), and cooled to RT, and then continue to purge for 40 min (30 ml·min−1). Thereafter, the pretreated catalysts were exposed to 4.5 % CH3OH/Ar, purged with He at RT for 30 min, and then heated to 900 ℃ at a heating rate of 10 ℃·min−1 with. The products were detected by mass spectrometry based on their characteristic mass fragmentations, corresponding to the m/e values of 60 (CH3OOCH), 46 (HCOOH), 45 (CH3OCH3), 44 (CO2), 31 (CH3OH), 30 (H2CO), 28 (CO), 18 (H2O), 15 (CH4) and 2 (H2). (g) Thermogravimetric analysis (TGA) of the used catalysts was performed on a Simultaneous TG-DTA/DSC Apparatus (High Temperature Platform 400, STA 449 F3 Jupiter, NETZSCH-Gerätebau GmbH). 2.4 Catalytic activity tests Gas chromatography at normal atmospheric pressure was used to evaluate the catalytic activity of the catalyst for MD. Ten Cu foam catalysts were placed in a quartz tube with a flowing inner diameter of 6.0 mm. The activity test was conducted by gradually increasing the temperature within the range of 200–325 ℃. The liquid pump continuously fed the methanol in the required molar ratio and reacted with the catalyst after gasification in the vaporization chamber. The temperature of the evaporator and the temperature of the heating zone used in the reaction pipeline were maintained at 120 ℃. The reactants and products in the system were analyzed online by the gas chromatograph. Reproducibility was within an acceptable range (±2.0 %) with each temperature point tested twice. The reactor products underwent quantitative analysis using a gas chromatograph (GC9800). The following formulae were used to calculate methanol conversion, product selectivity, and space-time yield (STY): (1) X C H 3 OH ( % ) = C in ( C H 3 OH ) − C out ( C H 3 OH ) C in ( C H 3 OH ) × 100 (2) Product selectivity ( % ) = v i C i ∑ all production species v i C j × 100 (3) STY ( mol H 2 g cat − 1 · h − 1 ) = F CH 3 OH × X CH 3 OH × n H 2 × S H 2 m cat Cin (CH3OH) represents the molar flux of CH3OH at the inlet, while Cout (CH3OH) represents the molar flux of CH3OH at the outlet. The molar flux of the product is represented by Vi (mol⋅min−1), and Ci represents the quantity of C or H atoms. F(CH3OH) represents the molar feed rate of methanol (mol·h−1); X(CH3OH) is the methanol conversion; n(H2) represents the number of H2 molecules theoretically generated per CH3OH molecule; S(H2) represents the selectivity of hydrogen; m(cat) stands for the mass of catalyst used in the reaction (g). 3 Results and discussion 3.1 SEM imaging The catalyst morphology was characterized by SEM analysis. Fig. 1 presents the SEM images of the foam structure and the as-prepared 2Ni/3Ce/3Al-CF catalyst. As shown in Fig. A1–A3, the untreated CF catalyst showed well-preserved monolithic structure with a smooth surface, and its textural features were characteristic of 130 PPI, surface density of 650 g·m−2. In Fig. B1–B3, the surface of the monometallic 2Ni-CF catalyst appears rather smooth. In contrast, the surfaces of the bimetallic 2Ni/3 Al-CF (Fig. C1-C3) and 2Ni/3Ce-CF (Fig. D1-D2) catalysts became rougher. Notably, the trimetallic 2Ni/3Ce/3Al-CF catalyst (Fig. E1-E3) exhibits an even greater surface roughness than the bimetallic counterparts. Apparently, after undergoing wet chemical etching and calcination, the foam structure surface exhibits roughness and is fully covered by a highly uniform porous layer made of cube-like nanocrystals (scale bars: 2 μm). The roughening of the surface and the formation of a porous layer can provide more active sites for catalytic reactions by increasing the specific surface area of the catalyst, thereby significantly enhancing catalytic activity. The enhanced surface roughness and porosity align with pore-engineering strategies reported for MOFs [36], where optimized mass transfer pathways improve catalytic efficiency. Furthermore, the nanocrystalline porous layer contributes to structural stability [37]. Elemental mapping ( Fig. 2) confirmed the homogeneous distribution of Ni, Ce, and Al across the 2Ni/3Ce/3Al-CF catalyst, indicating successful integration of all metallic components. 3.2 BET Fig. 3 shows the N2 adsorption-desorption isotherms and pore size distribution of the 2Ni/3Ce/3Al-CF catalysts, with detailed textural parameters summarized in Table 1. Fig. 3A (etched) and Fig. 3B (unetched) show the etched 2Ni/3Ce/3Al-CF and the unetched copper foam catalyst and the N2 adsorption-desorption isotherm. The catalysts show a typical type IV isotherm classified according to the International Union of Pure and Applied Chemistry (IUPAC), as demonstrated by the presence of a clear capillary condensation step in the P/P 0 region of 0.4–0.5 [38]. In addition, hysteresis loops with adsorption and desorption branches indicate a narrow pore size distribution (4–8 nm) calculated from the desorption branch using the BJH model [39]. It can be seen from Fig. 3 that the etched catalysts have mesoporous structures with uniform pore size distribution, indicating that the mesoporous structure of the catalyst has been created resulting from etching treatment [40]. In addition, Table 1 summarizes the SBET, VP, and DP calculated by BET and BJH models of the two catalysts respectively. As can be observed from Table 1, The etched catalyst demonstrates a significantly higher specific surface area (SBET=19.2621 m2·g−1) compared to the unetched counterpart (SBET=0.2465 m2·g−1), accompanied by increased pore volume (VP: 0.038313 vs. 0.001318 cm3·g−1) and uniform mesopores (DP: 6.4191 vs. 8.0021 nm). This finding is consistent with the SEM results (Fig. 1E), suggesting that in the presence of Ni, Ce, Al, and other substances, the etching treatment effectively enhances the specific surface area and pore volume of the catalysts [41]. A higher specific surface area generally facilitates the formation of active sites [42], which is beneficial for the occurrence of heterogeneous reactions [43]. 3.3 X-ray diffraction XRD analysis was performed to identify crystalline phases and evaluate the dispersion state of metallic components in the catalysts. The XRD patterns were analyzed to investigate the phase structures of the blank copper foam and the prepared catalysts. For the blank copper foam, characteristic diffraction peaks were observed at 43.32 °, 50.36 °, and 74.04 °, which can be indexed to the (111), (200), and (220) crystal planes of face-centered cubic copper (PDF No. 65–9026), respectively. When examining the monometallic, bimetallic, and trimetallic catalysts, no additional diffraction peaks other than those from the copper foam substrate were detected. The absence of distinct diffraction signals for Al and Ce species suggests that these elements are highly dispersed at the nanoscale or exist in an amorphous state within the catalyst structure, preventing the formation of crystalline phases with detectable sizes [44]. Notably, the diffraction features of Ni (PDF No. 01–3035) and Cu exhibit significant overlap due to their similar face-centered cubic crystal structures, making it difficult to distinguish individual contributions from these two metals through XRD alone. This observation is consistent with the EDS results presented in Fig. 2, which confirm the homogeneous distribution of Ni, Ce, and Al across the catalyst surface [45]. The complementary characterization techniques collectively indicate that the introduced metal species maintain a well-dispersed state without forming large crystalline aggregates, which is crucial for maximizing their catalytic active sites and reactivity [46]. 3.4 XPS XPS analysis ( Fig. 5) was performed to probe the surface chemical states of Ni/Ce/Al-CF catalysts, with quantitative peak fitting applied to deconvolute species. The Ni 2p XPS spectra presented in Fig. 5A distinctly reveal the valence state evolution of nickel species across the catalyst surfaces. As quantified by the Ni2+/NiTotal ratios summarized in Table 3, the 2Ni/3Ce/3Al-CF catalyst exhibits a Ni2+ proportion of 71.89 %, intermediate between the 66.13 % of 2Ni/3Al-CF and 89.03 % of 2Ni/3Ce-CF, while the 2Ni-CF catalyst shows 100 % Ni2+ content. Notably, the 100 % Ni2+ content in the 2Ni-CF catalyst may be attributed to rapid reoxidation of reduced Ni0 species upon exposure to air in short time prior to XPS measurement, even the catalyst was pre-reduced under hydrogen atmosphere. Although our current XPS analysis provides evidence of Ni2+ and Ni0 species on the catalyst surface, it does not capture dynamic valence state changes during the reaction. The dynamic valence state transitions between Ni2+ and Ni0 may enable surface regeneration and redox cycling, and merit further investigation through in-situ or near-ambient pressure spectroscopic techniques. In Fig. 5B, the O 1 s spectra of 2Ni-CF catalysts were fitted into three peaks, respectively, centered at about 533.28, 531.37 and 529.69 eV [47,48]. Based on the literature, the peak near at 529 eV was assigned to the surface lattice oxygen (Olattice) in the oxygen form, the peak near at 531 eV was assigned to the surface vacancy oxygen(Ovacancy) in the oxygen form and the peak near at 533 eV was assigned to the weakly bound oxygen(OH) in the oxygen form [49]. The density of oxygen vacancies on the catalyst can also be calculated from the O 1 s spectra in terms of Ovacancy/ (Ovacancy+ Olattice+OH). Table 3 shows that the percentage of oxygen vacancies is 2Ni/3Ce/3Al-CF > 2Ni/3Al-CF > 2Ni/3Ce-CF > 2Ni-CF. As shown in the electron paramagnetic resonance (EPR) spectra (Fig. S1), the relative intensity of oxygen vacancies exhibits a consistent trend. As has been reported in many literatures, the surface oxygen vacancy concentration of catalysts can be deduced from the fitted Ce 3d XPS spectra. As shown in Fig. 5C, the Ce 3d spectra can be decomposed into 10 groups, because the electronic structure of the Ce 3d orbitals is affected by the hybridization between the Ce 4 f orbitals and the O 2p valence band [50]. The five peaks labeled 1(880.8 eV), 2 (882.4 eV), 3(885.3 eV), 4(889.0 eV) and 5 (898.4 eV) belong to Ce 3d5/2, The other five peaks labeled 1’ (899.1 eV), 2’(900.7 eV), 3’(903.6 eV), 4’(907.3 eV), and 5’ (916.7 eV) are assigned to Ce 3d3/2 [51,52]. Of these ten peaks, 1, 1’, 3, and 3’ are derived from the Ce3+ species (Ce2O3), while the remaining six peaks correspond to the Ce4+ species (CeO2) [53]. The surface Ce3+ density can be calculated based on the relationship Ce3+/Ce4+ between Ce4+ and Ce3+ peak area, and are presented in Table 3 [54,55]. Ce3+ concentration is related to surface oxygen vacancy, so the formation of oxygen vacancies is always accompanied by the formation of Ce3+ [56], and the Ce3+/Ce4+ ratio in the CeO2 catalyst follows the order of 2Ni/3Ce/3Al-CF> 2Ni/3Ce-CF, implying that the presence of Al favors the formation of the abundant surface Ce3+ species and surface oxygen vacancies. 3.5 H2-TPR H2-TPR analysis was used to examine the critical balance between reducibility and metal-support interactions that governs the catalytic functionality. As illustrated in Fig. 6, while 2Ni/3Ce-CF exhibits the lowest reduction temperature due to CeO2-mediated oxygen vacancies formation facilitating interfacial electron transfer, its comparatively lower hydrogen consumption suggests partial reduction limitation. Conversely, Al-containing catalysts demonstrate elevated reduction thresholds, aligning with XPS-derived Ni2+ content trends, which confirms the role of Al in stabilizing oxidized Ni species through strong metal-support interactions. Notably, Ce and Al co-promoted 2Ni/3Ce/3Al-CF achieve an optimal compromise with moderate reduction temperature and maximal hydrogen uptake [57]. This synergism likely originates from Ce-Al cooperative effects: Ce promotes reducibility via oxygen mobility while Al anchors Ni2+ species, preventing over-reduction to metallic Ni [58]. Such balanced redox behavior enables efficient activation of reactive intermediates while maintaining structural integrity during catalytic cycles. The structure-activity correlation is further supported by the inverse relationship between Ni2+ content and reducibility. Higher Ni2+ stabilization in Al-rich systems necessitates stronger driving forces for reduction, yet the intermediate reduction temperature in Ce-Al co-modified systems ensures sufficient active site availability. These findings underscore the importance of tailoring reducibility through promoters engineering to optimize active site accessibility and stability, thereby achieving superior catalytic functionality. Combined with the XPS results, the content of divalent nickel in the catalysts shows the following order: 2Ni-CF > 2Ni/3Al-CF > 2Ni/3Ce/3Al-CF > 2Ni/3Ce-CF. This indicates that the presence of Al may stabilize the divalent nickel in the catalysts. The catalysts containing Al are more difficult to reduce in H2-TPR, which is corroborated by the result of the relatively high content of divalent nickel in Al-containing catalysts in XPS. 3.6 CH3OH-TPD CH3OH-TPD was employed to investigate the influence of each component on the surface sites of the Ni/Ce/Al-CF series catalysts and to explore the methanol transformation process during methanol decomposition, as depicted in Fig. 7. In the low temperature range, CH3OH, H2, CO and CO2 were identified as the main desorption species, in which the desorbed methanol in its physical adsorption state was released quickly after thermal activation at low temperature of 49–62.7 ℃ over bimetallic and trimetallic catalysts. The generation of CO, CO2, and H2 in this interval indicates that the catalyst surface exhibits activity toward the cleavage of C–H bond [59]. At about 125 ℃, H2 and CO peak showed up simultaneously, indicating the reaction pathway of methanol decomposition at this temperature. In this figure, the peak intensities of H2 and CO over the 2Ni/3Ce/3Al-CF catalyst are significantly higher than those of other catalysts, suggesting that this catalyst exhibits superior capability for hydrogen production at lower temperatures. Moreover, the formation of CO2 and CO can be attributed to the different reaction paths of methanol molecules over catalyst surface. CO and H2 were the decomposition product of gaseous formaldehyde which was generated from dehydrogenation of methoxy [60]. In contrast, CO2 may be derived from the product of adsorbed formaldehyde as formyl group reacting with surface hydroxyl group or originated from methoxy reacting with surface oxygen-containing species [61]. Undoubtedly, the surface hydroxyl in 2Ni/3Ce/3Al-CF catalyst is more reactive in the study of methanol desorption, and Ce addition promotes oxygen transfer from the ceria bulk to its surface and subsequently from the support surface to adjacent metal particles, thereby sustaining a high population of catalytically active partially oxidized metal species. 3.7 MD Performance analysis of catalysts The catalytic reactivity measurement was performed over a temperature range of 200–325 ℃, with the gas hourly space velocity (GHSV) of 2727 h−1. The methanol conversions are displayed in Fig. 8A. The selectivity of H2, CH4 and CO is depicted in Figs. 8B, 8C, 8D. The trimetallic catalyst and bimetallic catalysts revealed a higher methanol conversion than 2Ni-CF catalyst at all operating temperatures. For 2Ni/3Al-CF catalyst, the methanol conversion increased slowly from 42 % at 250 ℃ to 52 % at 275 ℃, then it showed an increase up to 81 % at 300 ℃. The 2Ni/3Ce-CF catalyst showed a steady increase in methanol conversion from 200 to 300 ℃, followed by a slower rise between 300 and 325 ℃. The difference of methanol conversion between the two bimetallic catalysts containing Ni is 2 %–12 % at low temperature of 200–275 ℃, and 13 %-30 % at high temperature of 300–325 ℃, indicating that the interaction between Ni and Al is more beneficial to methanol decomposition than the interaction between Ni and Ce [62]. Moreover, the interaction between Ni and Al at high temperature further promotes the reaction. Both 2Ni/3Al-CF and 2Ni/3Ce-CF catalysts showed an increase in methanol conversion with increasing the reaction temperature (4.9 %–97.6 % for 2Ni/3Al-CF and 3.0 %–67.4 % for 2Ni/3Ce-CF). Compared with bimetal catalysts, the trimetallic catalyst has a much higher methanol decomposition efficiency in the range of 200–325 ℃ at all test temperatures, and it is worth mentioning that the decomposition rate of 250–275 ℃ is significantly increased, and the methanol decomposition rate can reach 99.3 % at a lower temperature of 300 ℃. The 2Ni-CF catalysts prepared with different metal additives were subjected to low-temperature kinetic tests to exclude mass- and heat-transfer effects in the methanol decomposition reaction when the methanol conversion was less than 10 %, as shown in Fig. 8E. The apparent activation energy was calculated using the Arrhenius formula for the reaction temperature of 130–190 ℃ and GHSV of 2727 h−1. From the figure, it can be observed that the apparent activation energies for methanol decomposition over Ni-based catalysts prepared with different metal precursors are significantly different. The results showed that the following order was followed by the apparent activation energies: 2Ni-CF (108.34 kJ·mol−1)> 2Ni/3Ce-CF (97.18 kJ·mol−1)> 2Ni/3Al-CF (91.93 kJ·mol−1)> 2Ni/3Ce/3Al-CF (84.52 kJ·mol−1), which is inversely correlates with the activity of methanol decomposition for hydrogen production. The activation energy of 2Ni/3Ce/3Al-CF catalysts is the lowest, which indicates that the intrinsic kinetics is the fastest in methanol decomposition for hydrogen production. GHSV is also an important factor affecting the catalytic performance of 2Ni/3Ce/3Al-CF catalysts. In order to investigate the effect of different space velocities on the catalytic performance of the 2Ni-CF catalyst, the methanol decomposition for hydrogen production was carried out over the 2Ni/3Ce/3Al-CF catalyst at 275 ℃ with a constant methanol partial pressure and varying total flow rate of methanol and N2, as shown in Fig. 8F. The results showed that the methanol conversion and CH4 selectivity gradually decreased with the increase of space velocities, and the hydrogen selectivity significantly increased with the shorter residence time of the reactants in the catalyst bed. At the lowest GHSV, CO methanation occurs appreciably at the expense of lower CO selectivity, suggesting that CH4 is formed as secondary product in methanol decomposition. In summary, in the range of space velocity of 1363–6815 h−1, the methanol conversion was higher at 2727 h−1 with higher H2 selectivity and lower CH4 selectivity, and therefore the use of the space velocity above 2727 h−1 was the more preferred to suppress the formation of CH4 secondary byproduct. Fig. 9(A) showed the stability of 2Ni/3Ce/3Al-CF catalyst was tested under the conditions of atmospheric pressure, temperature of 275 ℃, and space velocity of 2727 h−1. During the continuous test of 40 h, the methanol conversion rate of 2Ni/3Ce/3Al-CF catalyst remained at a high level of 85 %, the selectivity of methane kept at about 4.6 %, and the H2 selectivity was always kept at 91.5 %. The stability test results indicate that the methanol conversion and CH4 selectivity remained in a relatively stable state. As shown in Fig. 9(B), the catalyst maintained stable activity and excellent reusability even under simulated dynamic stop-start conditions. In addition, thermogravimetric analysis (TGA, Fig. S2) and X-ray diffraction (XRD, Fig. S3) of the used catalyst revealed negligible coke formation and no evidence of sintering, further confirming the structural and chemical stability of the catalyst. Therefore, 2Ni/3Ce/3Al-CF catalyst is expected to be applicable for methanol decomposition. To better demonstrate the practical advantages of our 2Ni/3Ce/3Al-CF catalyst, has been added a comparative analysis of representative catalysts reported in the literature. According to the comparative data in Table 3, 2Ni/3Ce/3Al-CF catalyst ranks among the best-performing catalysts reported to date for methanol decomposition. 3.8 Discussion In this study, we draw on previous research results to explore the complex relationship between the catalytic performance and structure of nickel-based catalysts for hydrogen production via methanol decomposition. It is well documented that methanol decomposition is a structure-sensitive reaction, in which varying the type of metal promoters may play a critical role in the distribution of active Ni species and the concentration of surface oxygen vacancy to facilitate their synergistic effects on the catalytic process. It is widely accepted that there are two pathways occurring on different Ni crystal facets for hydrogen production in the reaction of methanol decomposition [66–68]. (1) CH3OH→CH3OH*→CH3O*→CH2O*→CHO*→CO+H2 (2) CH3OH→CH3OH*→*CH2OH→*CH2O→*CHO→CO+H2 The reaction initiates with molecular adsorption of CH3OH at nickel sites, where the first step involves preferential cleavage of the O–H bond to form methoxy (CH3O*) and adsorbed hydrogen (H*)-a process energetically favorable on Ni (111) surfaces but with distinct kinetic behaviors due to surface coordination differences. On Ni (100), the open surface structure allows for both O-H and C-H bond scissions, generating intermediates like hydroxymethyl (*CH2OH) alongside methoxy (2), whereas Ni (111) favors exclusive O-H activation (1). The subsequent abstraction of hydrogen from of methoxy to CH2O* via C-H bond breaking acts as the rate-limiting step, a key kinetic feature conserved across Ni facets but influenced by metal valence states and oxygen vacancies interactions [67,68]. These intermediates further decompose through successive hydrogen abstractions, ultimately yielding CO and H2. The structure-sensitive nature of the methanol decomposition reaction implies that nanoscale Ni dispersion and promoter-induced surface reconstruction can alter adsorption energies and reaction barriers, aligning with the observed correlation between surface area, active site density, and product selectivity in this study. In this work, the concentration of surface oxygen vacancy can be effectively tuned by adjusting the types of metal promoters to enhance their synergistic effects, and the catalytic performance of nickel-based catalysts for methanol decomposition in relation to the species distribution of Ni. A series of catalysts, including 2Ni/3Ce/3Al-CF, 2Ni/3Al-CF, 2Ni/3Ce-CF, and 2Ni-CF were synthesized to systematically investigate composition-dependent catalytic activities influence on H2 and CO production from methanol decomposition. SEM characterization indicated that the 2Ni/3Ce/3Al-CF catalyst has revealed distinct signs of roughness by chemical etching on the CF surface and featured a uniform nanocrystalline porous layer, facilitating efficient mass transport. This etching phenomenon significantly increases the surface area of the catalyst. This finding is in accordance with the SBET, which also indicates an increase in the surface area. The enlarged surface area provides more active sites for the enhancement of the catalytic reaction. XPS analysis uncovered a strong correlation among oxygen vacancy concentration, the distribution of Ni species and catalytic activity, where the gradient of oxygen defect density directly mirrored the observed activity trend. This relationship followed a characteristic volcano-shaped curve, with optimal activity occurring at a 71.89 % Ni2+ ratio in the trimetallic 2Ni/3Ce/3Al-CF catalyst-a finding consistent with the established role of metal valence state balance in methanol decomposition [69]. The superior performance originated from the subtle balance of surface metallic Ni0 domains, which facilitated C–H bond scission, and Ni δ+ species, which favor the adsorption of methanol molecule and activation of oxygen-containing functional groups and intermediates. Past study on surface science has demonstrated that methanol interacts very weakly on single crystal of Ni(111) surface and the coverage of permanently adsorbed methanol is much higher in the presence of surface oxygen, allowing methanol decomposition to proceed more efficiently on oxygen predisposed surfaces [70]. In this sense, the methanol sticking probability may be enhanced over the cationic Ni2+ sites to promote the initial methanol adsorption. In this work, insufficient or excessive Ni2+ in 2Ni/3Ce-CF disrupted the balance of surface Ni species required for optimum catalyst, underscoring the importance of precise ternary interface engineering to optimize the Ni0/Ni2+ ratio for efficient methanol decomposition [71,72]. H2-TPR results indicated that a moderate reducibility in 2Ni/3Ce/3Al-CF promoted the suitable surface redox properties, characterized by high hydrogen consumption and optimal reduction kinetics—key parameters for forming stable active sites [73]. The strong correlation between metal reducibility and catalytic performance highlighted the critical role of Ni-Ce-Al interactions in shaping the redox properties of the catalyst, which in turn influenced active site formation and stability. Integrating XPS and H2-TPR data revealed a complex structure-activity relationship, where oxygen vacancies, Ni valence states, and ternary metal synergies collectively governed catalytic efficiency [74]. According to the results of CH3OH-TPD, the methanol decomposition on these four catalysts proceeds in the order of 2Ni-CF< 2Ni/3CE-CF< 2Ni/3Al-CF< 2Ni/3Ce/3Al-CF, which is fully consistent with their activity as shown in Fig. 8A. To sum up, the outstanding of superior activity and stability of 2Ni/3Ce/3Al-CF arise from the synergistic effect of (1) a nanocrystalline porous structure for efficient mass transfer, (2) a balanced Ni0/NiTotal ratio to enable dual-functionality in initial methanol adsorption and C-H bond scission in rate-controlling step of methanol decomposition, and (3) abundant oxygen vacancies to enhance surface reactivity. 4 Conclusion In summary, this study reported the preparation of mono-, bi-, and trimetallic Ni-based catalysts, which are three-dimensional porous metal foam structures prepared by the chemical wet-etching method, and their application in hydrogen production via methanol decomposition within the temperature range of 200–325 ℃. The trimetallic 2Ni/3Ce/3Al-CF exhibited optimal activity, achieving 99.3 % methanol conversion and 91.8 % H2 selectivity at 300 ℃, outperforming bimetallic and monometallic counterparts. Characterizations revealed that etched copper foam increased surface area for active sites and synergistic Ni-Ce-Al interactions generated abundant oxygen vacancies and optimized surface Ni2+ to metallic Ni0 ratios presenting a typical volcano-type activity dependence. H2-TPR and CH3OH-TPD confirmed balanced reducibility and enhanced low-temperature methanol decomposition for hydrogen production via three-metal synergy. Stability tests showed 40 h durability at 275 ℃. The work highlights multi-metal synergies and structural optimization as key design principles for efficient methanol decomposition catalysts, providing insights for high-performance hydrogen production systems. CRediT authorship contribution statement Lijie Fu: Writing – original draft, Validation, Methodology, Investigation, Formal analysis. Yong Men: Writing – review & editing, Writing – original draft, Supervision, Resources, Project administration, Methodology, Funding acquisition, Conceptualization. Shuya Wu: Validation. Shuyi Xu: Validation. Guohong Wang: Validation. Chongchong Kong: Validation. Jinguo Wang: Writing – review & editing. Feng Shi: Writing – review & editing. Zhenrong Yan: Writing – review & editing. Xuelong Miao: Writing – review & editing. Declaration of Competing Interest The authors declare that they have no known competing financial interests or personal relationships that could have appeared to influence the work reported in this paper. Acknowledgements The authors are grateful to National Natural Science Foundation of China (22179081, 22076117, 22306118), ShuGuang project of Shanghai Municipal Education Commission, Shanghai Education Development Foundation (Grant No.21SG52) and the Program for Professor of Special Appointment (Eastern Scholar) at Shanghai Institutions of Higher Learning for their support on catalyst research. Appendix A Supporting information Supplementary data associated with this article can be found in the online version at doi:10.1016/j.apcata.2025.120450. Appendix A Supplementary material Supplementary material References [1] C. Gunathilake I. Soliman D. Panthi A comprehensive review on hydrogen production, storage, and applications Chem. Soc. Rev. 53 22 2024 10900 10969 Gunathilake C., Soliman I., Panthi D., et al. A comprehensive review on hydrogen production, storage, and applications [J]. Chemical Society Reviews, 2024, 53(22): 10900-10969. [2] X. Sun Z. Chen Y. Shen Efficient photothermal-assisted photocatalytic H2 production using carbon dots-infused g-C3N4 nanoreactors synthesized via one-step template-free thermal polymerization Chem. Eng. J. 488 2024 151041 Sun X., Chen Z., Shen Y., et al. Efficient photothermal-assisted photocatalytic H2 production using carbon dots-infused g-C3N4 nanoreactors synthesized via one-step template-free thermal polymerization[J]. Chemical Engineering Journal, 2024, 488: 151041. [3] S. Mazzone T. Goklany G. Zhang Ruthenium-based catalysts supported on carbon xerogels for hydrogen production via ammonia decomposition Appl. Catal. A Gen. 632 2022 118484 Mazzone S., Goklany T., Zhang G., et al. Ruthenium-based catalysts supported on carbon xerogels for hydrogen production via ammonia decomposition[J]. Applied Catalysis A: General, 2022, 632: 118484. [4] W.L. Shi Z. Xu Y.X. Shi Constructing S-scheme charge separation in cobalt phthalocyanine/oxygen-doped g-C3N4 heterojunction with enhanced photothermal-assisted photocatalytic H2 evolution Rare Met. 43 1 2024 198 211 Shi W.L., Xu Z., Shi Y.X., et al. Constructing S-scheme charge separation in cobalt phthalocyanine/oxygen-doped g-C3N4 heterojunction with enhanced photothermal-assisted photocatalytic H2 evolution[J]. Rare Metals, 2024, 43(1): 198-211. [5] S. Verhelst T. Wallner Hydrogen-fueled internal combustion engines Prog. Energy Combust. Sci. 35 6 2009 490 527 Verhelst S., Wallner T. Hydrogen-fueled internal combustion engines [J]. Progress in Energy and Combustion Science, 2009, 35(6): 490-527. [6] Y. Zhang G. Fan Y. Lin Synergies of surface-interface multiple active sites over Al-Zr oxide solid solution supported nickel catalysts for enhancing the hydrodeoxygenation of anisole Appl. Catal. A Gen. 631 2022 118481 Zhang Y., Fan G., Lin Y., et al. Synergies of surface-interface multiple active sites over Al-Zr oxide solid solution supported nickel catalysts for enhancing the hydrodeoxygenation of anisole[J]. Applied Catalysis A: General, 2022, 631: 118481. [7] P. Shan K. Geng L. Guo Synergistic effects of photothermal response and Schottky junction for enhanced photothermal-assisted photocatalytic hydrogen production Chem. Eng. J. 2025 162801 Shan P., Geng K., Guo L., et al. Synergistic effects of photothermal response and Schottky junction for enhanced photothermal-assisted photocatalytic hydrogen production[J]. Chemical Engineering Journal, 2025: 162801. [8] P. Kemshetti Revolutionizing transportation: a comprehensive review of hydrogen-powered engines Int. J. Res. Appl. Sci. Eng. Technol. 11 11 2023 2584 2587 Kemshetti P. Revolutionizing Transportation: A Comprehensive Review of Hydrogen-Powered Engines [J]. International Journal for Research in Applied Science and Engineering Technology, 2023, 11(11): 2584-2587. [9] J. Bian X. Zhang R. Zhang Conceptual design and analysis of a new hydrogen liquefaction process based on heat pump systems Appl. Energy 374 2024 124020 Bian J., Zhang X., Zhang R., et al. Conceptual design and analysis of a new hydrogen liquefaction process based on heat pump systems [J]. Applied Energy, 2024, 374:124020. [10] Z. Stępień A comprehensive overview of hydrogen-fueled internal combustion engines: achievements and future challenges Energies 14 20 2021 6504 Stępień Z. A Comprehensive Overview of Hydrogen-Fueled Internal Combustion Engines: Achievements and Future Challenges [J]. Energies, 2021, 14(20): 6504. [11] L. Liao Y. Men Y. Wang Unravelling the morphology effect of Pt/In2O3 catalysts for highly efficient hydrogen production by methanol steam reforming Fuel 372 2024 132221 Liao L., Men Y., Wang Y., et al. Unravelling the morphology effect of Pt/In2O3 catalysts for highly efficient hydrogen production by methanol steam reforming [J]. Fuel, 2024, 372: 132221. [12] C. Anand B. Chandraja P. Nithiya Green hydrogen for a sustainable future: A review of production methods, innovations, and applications Int. J. Hydrog. Energy 111 2025 319 341 Anand C., Chandraja B., Nithiya P., et al. Green hydrogen for a sustainable future: A review of production methods, innovations, and applications [J]. International Journal of Hydrogen Energy, 2025, 111: 319-341. [13] M. Younas S. Shafique A. Hafeez An overview of hydrogen production: current status, potential, and challenges Fuel 316 2022 123317 Younas M., Shafique S., Hafeez A., et al. An Overview of Hydrogen Production: Current Status, Potential, and Challenges [J]. Fuel, 2022, 316: 123317. [14] F. Cai Y. Guo J.J. Ibrahim A highly active and stable Pd/MoC catalyst for hydrogen production from methanol decomposition Appl. Catal. B Environ. 299 2021 120648 Cai F., Guo Y., Ibrahim J.J., et al. A highly active and stable Pd/MoC catalyst for hydrogen production from methanol decomposition [J]. Applied Catalysis B: Environmental, 2021, 299: 120648. [15] F. Carraro A. Fapohunda M.C. Paganini Morphology and size effect of ceria nanostructures on the catalytic performances of Pd/CeO2 catalysts for methanol decomposition to syngas ACS Appl. Nano Mater. 1 4 2018 1492 1501 Carraro F., Fapohunda A., Paganini M.C., et al. Morphology and Size Effect of Ceria Nanostructures on the Catalytic Performances of Pd/CeO2 Catalysts for Methanol Decomposition to Syngas [J]. ACS Applied Nano Materials, 2018, 1(4): 1492-1501. [16] K. Wang Y. Men W. Liu Recent progress in catalytical CO purification of H2-rich reformate for proton exchange membrane fuel cells Int. J. Hydrog. Energy 48 64 2023 25100 25118 Wang K., Men Y., Liu W., et al. Recent progress in catalytical CO purification of H2-rich reformate for proton exchange membrane fuel cells [J]. International Journal of Hydrogen Energy, 2023, 48(64): 25100-25118. [17] H.-Y. Tang P. Erickson H.C. Yoon Comparison of steam and autothermal reforming of methanol using a packed-bed low-cost copper catalyst Int. J. Hydrog. Energy 34 18 2009 7656 7665 Tang H.-Y., Erickson P., Yoon H.C., et al. Comparison of steam and autothermal reforming of methanol using a packed-bed low-cost copper catalyst [J]. International Journal of Hydrogen Energy, 2009, 34(18): 7656-7665. [18] W.-H. Chen Y.-J. Syu Thermal behavior and hydrogen production of methanol steam reforming and autothermal reforming with spiral preheating Int. J. Hydrog. Energy 36 5 2011 3397 3408 Chen W.-H., Syu Y.-J. Thermal behavior and hydrogen production of methanol steam reforming and autothermal reforming with spiral preheating [J]. International Journal of Hydrogen Energy, 2011, 36(5): 3397-3408. [19] G. Li C. Gu W. Zhu Hydrogen production from methanol decomposition using Cu-Al spinel catalysts J. Clean. Prod. 183 2018 415 423 Li G., Gu C., Zhu W., et al. Hydrogen production from methanol decomposition using Cu-Al spinel catalysts [J]. Journal of Cleaner Production, 2018, 183: 415-423. [20] S. Qing X. Hou L. Li Deactivation feature of Cu/SiO2 catalyst in methanol decomposition Int. J. Hydrog. Energy 44 31 2019 16667 16674 Qing S., Hou X., Li L., et al. Deactivation feature of Cu/SiO2 catalyst in methanol decomposition [J]. International Journal of Hydrogen Energy, 2019, 44(31): 16667-16674. [21] X. Li X. Zhou L. Wang Mechanistic studies and kinetics of the desulfurization of 2-phenylcyclohexanethiol over sulfided Mo, Ni-Mo, and Co-Mo on γ-Al2O3 J. Catal. 403 2021 43 55 Li X., Zhou X., Wang L., et al. Mechanistic studies and kinetics of the desulfurization of 2-phenylcyclohexanethiol over sulfided Mo, Ni-Mo, and Co-Mo on γ-Al2O3 [J]. Journal of Catalysis, 2021, 403: 43-55. [22] C.E. Pompe M. Slagter P.E. de Jongh Impact of heterogeneities in silica-supported copper catalysts on their stability for methanol synthesis J. Catal. 365 2018 1 9 Pompe C.E., Slagter M., de Jongh P.E., et al. Impact of heterogeneities in silica-supported copper catalysts on their stability for methanol synthesis [J]. Journal of Catalysis, 2018, 365: 1-9. [23] H. Mitani Y. Xu T. Hirano Catalytic properties of Ni-Fe-Mg alloy nanoparticle catalysts for methanol decomposition Catal. Today 281 2017 669 676 Mitani H., Xu Y., Hirano T., et al. Catalytic properties of Ni-Fe-Mg alloy nanoparticle catalysts for methanol decomposition [J]. Catalysis Today, 2017, 281: 669-676. [24] Y. Xu J. Yang M. Demura Catalytic performance of Ni–Al nanoparticles fabricated by arc plasma evaporation for methanol decomposition Int. J. Hydrog. Energy 39 25 2014 13156 13163 Xu Y., Yang J., Demura M., et al. Catalytic performance of Ni–Al nanoparticles fabricated by arc plasma evaporation for methanol decomposition [J]. International Journal of Hydrogen Energy, 2014, 39(25): 13156-13163. [25] M. Michalska-Domańska M. Norek P. Jóźwik Catalytic stability and surface analysis of microcrystalline Ni3Al thin foils in methanol decomposition Appl. Surf. Sci. 293 2014 169 176 Michalska-Domańska M., Norek M., Jóźwik P., et al. Catalytic stability and surface analysis of microcrystalline Ni3Al thin foils in methanol decomposition [J]. Applied Surface Science, 2014, 293: 169-176. [26] H.A. Rojas V.P. López M.H. Brijaldo Effect of boron on the surface properties of nickel supported on hydrotalcite-type mixed oxides in methanol decomposition Mol. Catal. 498 2020 111262 Rojas H.A., López V.P., Brijaldo M.H., et al. Effect of boron on the surface properties of nickel supported on hydrotalcite-type mixed oxides in methanol decomposition [J]. Molecular Catalysis, 2020, 498: 111262. [27] Y. Li Y. Men S. Liu Remarkably efficient and stable Ni/Y2O3 catalysts for CO2 methanation: effect of citric acid addition Appl. Catal. B Environ. 293 2021 120206 Li Y., Men Y., Liu S., et al. Remarkably efficient and stable Ni/Y2O3 catalysts for CO2 methanation: Effect of citric acid addition [J]. Applied Catalysis B: Environmental, 2021, 293: 120206. [28] K. Wang Y. Men S. Liu Decoupling the size and support/metal loadings effect of Ni/SiO2 catalysts for CO2 methanation Fuel 304 2021 121388 Wang K., Men Y., Liu S., et al. Decoupling the size and support/metal loadings effect of Ni/SiO2 catalysts for CO2 methanation [J]. Fuel, 2021, 304: 121388. [29] Y. Hu Y. Men S. Xu Modulating nickel precursors to construct highly active Ni/Y2O3 catalysts for CO2 methanation Int. J. Hydrog. Energy 81 2024 1311 1321 Hu Y., Men Y., Xu S., et al. Modulating nickel precursors to construct highly active Ni/Y2O3 catalysts for CO2 methanation [J]. International Journal of Hydrogen Energy, 2024, 81: 1311-1321. [30] M. Makhania S. Upadhyayula Foam: imparting structure to heterogeneous catalysis ChemBioEng Rev. 9 6 2022 591 604 Makhania M., Upadhyayula S. Foam: Imparting Structure to Heterogeneous Catalysis [J]. ChemBioEng Reviews, 2022, 9(6): 591-604. [31] X. Tang C. Song H. Li Thermally stable Ni foam-supported inverse CeAlOx/Ni ensemble as an active structured catalyst for CO2 hydrogenation to methane Nat. Commun. 15 1 2024 3115 Tang X., Song C., Li H., et al. Thermally stable Ni foam-supported inverse CeAlOx/Ni ensemble as an active structured catalyst for CO2 hydrogenation to methane [J]. Nature Communications, 2024, 15(1): 3115. [32] H. Yang X. Yang J. Xiao Silver-modified NiCo2O4 nanosheets monolithic catalysts used for catalytic soot elimination Fuel 326 2022 125036 Yang H., Yang X., Xiao J., et al. Silver-modified NiCo2O4 nanosheets monolithic catalysts used for catalytic soot elimination [J]. Fuel, 2022, 326: 125036. [33] Y. Li Q. Zhang R. Chai Structured Ni-CeO2-Al2O3/Ni-foam catalyst with enhanced heat transfer for substitute natural gas production by syngas methanation ChemCatChem 7 9 2015 1427 1431 Li Y., Zhang Q., Chai R., et al. Structured Ni-CeO2-Al2O3/Ni-Foam Catalyst with Enhanced Heat Transfer for Substitute Natural Gas Production by Syngas Methanation [J]. ChemCatChem, 2015, 7(9): 1427-1431. [34] Ce Roy S. Roy S. Oxygen vacancy assisted hydrogen evolution reaction over CeO2-based solid solutions Energy Adv. 2025 Ce Roy S., Roy S. Oxygen vacancy assisted hydrogen evolution reaction over CeO2-based solid solutions[J]. Energy Advances, 2025. [35] Y. Al Wu J. Lin G. Ma Ni nanocatalysts supported on mesoporous Al2O3–CeO2 for CO2 methanation at low temperature RSC Adv. 10 4 2020 2067 2072 Al Wu Y., Lin J., Ma G., et al. Ni nanocatalysts supported on mesoporous Al2O3–CeO2 for CO2 methanation at low temperature[J]. RSC advances, 2020, 10(4): 2067-2072. [36] D. Zhao T. Zhao Pore engineering for high performance porous materials ACS Cent. Sci. 9 8 2023 1499 1503 Zhao D., Zhao T. Pore Engineering for High Performance Porous Materials [J]. ACS Cent Sci, 2023, 9(8): 1499-1503. [37] Q. Liu S. Wang S. Lv High stability of the Ni–YCe/diatomite catalyst for CO2 methanation: the synergistic coupling of citric acid and Y2O3 ACS Sustain. Chem. Eng. 11 35 2023 12946 12958 Liu Q., Wang S., Lv S., et al. High Stability of the Ni–YCe/Diatomite Catalyst for CO2 Methanation: The Synergistic Coupling of Citric Acid and Y2O3 [J]. ACS Sustainable Chemistry & Engineering, 2023, 11(35): 12946-12958. [38] D. Liu Y. Men J. Wang Highly active and durable Pt/In2O3/Al2O3 catalysts in methanol steam reforming Int. J. Hydrog. Energy 41 47 2016 21990 21999 Liu D., Men Y., Wang J., et al. Highly active and durable Pt/In2O3/Al2O3 catalysts in methanol steam reforming [J]. International Journal of Hydrogen Energy, 2016, 41(47): 21990-21999. [39] X. Liu Y. Men J. Wang Remarkable support effect on the reactivity of Pt/In2O3/MOx catalysts for methanol steam reforming J. Power Sources 364 2017 341 350 Liu X., Men Y., Wang J., et al. Remarkable support effect on the reactivity of Pt/In2O3/MOx catalysts for methanol steam reforming [J]. Journal of Power Sources, 2017, 364: 341-350. [40] D.Q. Dao T.K. Anh Nguyen S.G. Kang Engineering oxidation states of a platinum cocatalyst over chemically oxidized graphitic carbon nitride photocatalysts for photocatalytic hydrogen evolution ACS Sustain. Chem. Eng. 9 43 2021 14537 14549 Dao D.Q., Anh Nguyen T.K., Kang S.G., et al. Engineering Oxidation States of a Platinum Cocatalyst over Chemically Oxidized Graphitic Carbon Nitride Photocatalysts for Photocatalytic Hydrogen Evolution [J]. ACS Sustainable Chemistry & Engineering, 2021, 9(43): 14537-14549. [41] S.-Y. Lu L. Wang C. Wu Constructing nickel phosphate polymorph heterojunctions by in situ Cr-induced structural transition for enhanced bifunctional electrochemical water splitting ACS Sustain. Chem. Eng. 12 16 2024 6376 6388 Lu S.-Y., Wang L., Wu C., et al. Constructing Nickel Phosphate Polymorph Heterojunctions by In Situ Cr-Induced Structural Transition for Enhanced Bifunctional Electrochemical Water Splitting [J]. ACS Sustainable Chemistry & Engineering, 2024, 12(16): 6376-6388. [42] Y. Zhang Y. Sun Y. Man Construction of a controllable and dispersed Fe3O4-based catalyst using ZIFs as a spatial support for highly catalytic degradation of aﬂatoxin B1 Appl. Catal. B Environ. 318 2022 121818 Zhang Y., Sun Y., Man Y., et al. Construction of a controllable and dispersed Fe3O4-based catalyst using ZIFs as a spatial support for highly catalytic degradation of aﬂatoxin B1 [J]. Applied Catalysis B: Environmental, 2022, 318: 121818. [43] S. Bao J. Li B. Guan A green selective water-etching approach to MOF@Mesoporous SiO2 yolk-shell nanoreactors with enhanced catalytic stabilities Matter 3 2 2020 498 508 Bao S., Li J., Guan B., et al. A Green Selective Water-Etching Approach to MOF@Mesoporous SiO2 Yolk-Shell Nanoreactors with Enhanced Catalytic Stabilities [J]. Matter, 2020, 3(2): 498-508. [44] A.L. Luna E. Novoseltceva E. Louarn Synergetic effect of Ni and Au nanoparticles synthesized on titania particles for efficient photocatalytic hydrogen production Appl. Catal. B Environ. 191 2016 18 28 Luna A.L., Novoseltceva E., Louarn E., et al. Synergetic effect of Ni and Au nanoparticles synthesized on titania particles for efficient photocatalytic hydrogen production [J]. Applied Catalysis B: Environmental, 2016, 191: 18-28. [45] N. Rui X. Zhang F. Zhang Highly active Ni/CeO2 catalyst for CO2 methanation: preparation and characterization Appl. Catal. B Environ. 282 2021 119581 Rui N., Zhang X., Zhang F., et al. Highly active Ni/CeO2 catalyst for CO2 methanation: Preparation and characterization [J]. Applied Catalysis B: Environmental, 2021, 282: 119581. [46] F. Zhang Z. Tang L. Zheng Edge-distributed iron single-atom moiety with efficient “trapping-conversion” for polysulfides driving high-performance of Li-S battery Appl. Catal. B Environ. 334 2023 122876 Zhang F., Tang Z., Zheng L., et al. Edge-distributed iron single-atom moiety with efficient “trapping-conversion” for polysulfides driving high-performance of Li-S battery [J]. Applied Catalysis B: Environmental, 2023, 334:122876. [47] J. Lu X. Sun Z. Chen Construction of S-scheme heterojunction catalytic nanoreactor for boosted photothermal-assisted photocatalytic H2 production Appl. Surf. Sci. 642 2024 158648 Lu J., Sun X., Chen Z., et al. Construction of S-scheme heterojunction catalytic nanoreactor for boosted photothermal-assisted photocatalytic H2 production[J]. Applied Surface Science, 2024, 642: 158648. [48] Z. Chen Y. Yan K. Sun Plasmonic coupling-boosted photothermal composite photocatalyst for achieving near-infrared photocatalytic hydrogen production J. Colloid Interface Sci. 661 2024 12 22 Chen Z., Yan Y., Sun K., et al. Plasmonic coupling-boosted photothermal composite photocatalyst for achieving near-infrared photocatalytic hydrogen production[J]. Journal of Colloid and Interface Science, 2024, 661: 12-22. [49] P. Hongmanorom J. Ashok P. Chirawatkul Interfacial synergistic catalysis over Ni nanoparticles encapsulated in mesoporous ceria for CO2 methanation Appl. Catal. B Environ. 297 2021 120454 Hongmanorom P., Ashok J., Chirawatkul P., et al. Interfacial synergistic catalysis over Ni nanoparticles encapsulated in mesoporous ceria for CO2 methanation [J]. Applied Catalysis B: Environmental, 2021, 297: 120454. [50] Y. Sun J. Xie Z. Fu Boosting CO2 electroreduction to C2H4 via unconventional hybridization: high-order Ce4+ 4f and O 2p interaction in Ce-Cu2O for stabilizing Cu+ ACS Nano 17 14 2023 13974 13984 Sun Y., Xie J., Fu Z., et al. Boosting CO2 Electroreduction to C2H4 via Unconventional Hybridization: High-Order Ce4+ 4f and O 2p Interaction in Ce-Cu2O for Stabilizing Cu+ [J]. ACS Nano, 2023, 17(14): 13974-13984. [51] J. Zhang Y. Men Y. Wang Morphology effect of Pd/In2O3/CeO2 catalysts on methanol steam reforming for hydrogen production Int. J. Hydrog. Energy 51 2024 118577 118599 Zhang J., Men Y., Wang Y., et al. Morphology effect of Pd/In2O3/CeO2 catalysts on methanol steam reforming for hydrogen production [J]. International Journal of Hydrogen Energy, 2024, 51: 118577-118599. [52] Q. Song Y. Men J. Wang Methanol steam reforming for hydrogen production over ternary composite ZnyCe1Zr9Ox catalysts Int. J. Hydrog. Energy 45 16 2020 9592 9602 Song Q., Men Y., Wang J., et al. Methanol steam reforming for hydrogen production over ternary composite ZnyCe1Zr9Ox catalysts [J]. International Journal of Hydrogen Energy, 2020, 45(16): 9592-9602. [53] Z. Hu X. Liu D. Meng Effect of ceria crystal plane on the physicochemical and catalytic properties of Pd/Ceria for CO and propane oxidation ACS Catal. 6 4 2016 2265 2279 Hu Z., Liu X., Meng D., et al. Effect of Ceria Crystal Plane on the Physicochemical and Catalytic Properties of Pd/Ceria for CO and Propane Oxidation [J]. Acs Catal, 2016, 6(4): 2265-2279. [54] Y. Gao Z. Zhang Z. Li Understanding morphology-dependent CuO-CeO2 interactions from the very beginning Chin. J. Catal. 41 6 2020 1006 1016 Gao Y., Zhang Z., Li Z., et al. Understanding morphology-dependent CuO-CeO2 interactions from the very beginning [J]. Chinese Journal of Catalysis, 2020, 41(6): 1006-1016. [55] Z. Zhang Z.-Q. Wang Z. Li Metal-free ceria catalysis for selective hydrogenation of crotonaldehyde Acs Catal. 10 24 2020 14560 14566 Zhang Z., Wang Z.-Q., Li Z., et al. Metal-Free Ceria Catalysis for Selective Hydrogenation of Crotonaldehyde [J]. Acs Catal, 2020, 10(24): 14560-14566. [56] Z. Su X. Li W. Si Probing the actual role and activity of oxygen vacancies in toluene catalytic oxidation: evidence from in situ XPS/NEXAFS and DFT +UCalculation ACS Catal. 13 6 2023 3444 3455 Su Z., Li X., Si W., et al. Probing the Actual Role and Activity of Oxygen Vacancies in Toluene Catalytic Oxidation: Evidence from In Situ XPS/NEXAFS and DFT +UCalculation [J]. Acs Catal, 2023, 13(6): 3444-3455. [57] H. Zhang J. Wang Y. Zhang A study on H2-TPR of Pt/Ce0.27Zr0.73O2 and Pt/Ce0.27Zr0.70La0.03Ox for soot oxidation Appl. Surf. Sci. 377 2016 48 55 Zhang H., Wang J., Zhang Y., et al. A study on H2-TPR of Pt/Ce0.27Zr0.73O2 and Pt/Ce0.27Zr0.70La0.03Ox for soot oxidation [J]. Applied Surface Science, 2016, 377: 48-55. [58] A.A. Alkhoori O. Elmutasim A.A. Dabbawala Mechanistic features of the CeO2-modified Ni/Al2O3 catalysts for the CO2 methanation reaction: experimental and Ab initio studies ACS Appl. Energy Mater. 6 16 2023 8550 8571 Alkhoori A.A., Elmutasim O., Dabbawala A.A., et al. Mechanistic Features of the CeO2-Modified Ni/Al2O3 Catalysts for the CO2 Methanation Reaction: Experimental and Ab Initio Studies [J]. ACS Applied Energy Materials, 2023, 6(16): 8550-8571. [59] J.E. Sutton S.H. Overbury A. Beste Coadsorbed species explain the mechanism of methanol temperature-programmed desorption on CeO2(111) J. Phys. Chem. C 120 13 2016 7241 7247 Sutton J.E., Overbury S.H., Beste A. Coadsorbed Species Explain the Mechanism of Methanol Temperature-Programmed Desorption on CeO2(111) [J]. The Journal of Physical Chemistry C, 2016, 120(13): 7241-7247. [60] A. Kaithal B. Chatterjee C. Werle Acceptorless dehydrogenation of methanol to carbon monoxide and hydrogen using molecular catalysts Angew. Chem. Int Ed. Engl. 60 51 2021 26500 26505 Kaithal A., Chatterjee B., Werle C., et al. Acceptorless Dehydrogenation of Methanol to Carbon Monoxide and Hydrogen using Molecular Catalysts [J]. Angew Chem Int Ed Engl, 2021, 60(51): 26500-26505. [61] G. Hou Q. Wang D. Xu DimethyL CARBONATE SYNTHESIS FROm CO2 over CeO2 with electron-enriched lattice oxygen species Angew. Chem. Int Ed. Engl. 63 19 2024 e202402053 Hou G., Wang Q., Xu D., et al. Dimethyl Carbonate Synthesis from CO2 over CeO2 with Electron-Enriched Lattice Oxygen Species [J]. Angew Chem Int Ed Engl, 2024, 63(19): e202402053. [62] S.-n Yin J. Zhao S. Wu Fabrication of highly efficient Ni/Al2O3 catalysts for the CO2 methanation reaction using atomic layer deposition technology Chem. Eng. J. 504 2025 158723 Yin S.-n, Zhao J., Wu S., et al. Fabrication of highly efficient Ni/Al2O3 catalysts for the CO2 methanation reaction using atomic layer deposition technology [J]. Chemical Engineering Journal, 2025, 504: 158723. [63] Y. Choi H.G. Stenger Fuel cell grade hydrogen from methanol on a commercial Cu/ZnO/Al2O3 catalyst Appl. Catal. B Environ. 38 4 2002 259 269 Choi Y., Stenger H.G. Fuel cell grade hydrogen from methanol on a commercial Cu/ZnO/Al2O3 catalyst [J]. Applied Catalysis B: Environmental, 2002, 38(4): 259-269. [64] J.C. Brown E. Gulari Hydrogen production from methanol decomposition over Pt/Al2O3 and ceria promoted Pt/Al2O3 catalysts Catal. Commun. 5 8 2004 431 436 Brown J.C., Gulari E. Hydrogen production from methanol decomposition over Pt/Al2O3 and ceria promoted Pt/Al2O3 catalysts [J]. Catalysis Communications, 2004, 5(8): 431-436. [65] M. Fan Y. Xu J. Sakurai Catalytic performance of Ni3Sn and Ni3Sn2 for hydrogen production from methanol decomposition Catal. Lett. 144 5 2014 843 849 Fan M., Xu Y., Sakurai J., et al. Catalytic Performance of Ni3Sn and Ni3Sn2 for Hydrogen Production from Methanol Decomposition [J]. Catalysis Letters, 2014, 144(5): 843-849. [66] Y.-H. Zhou P.-H. Lv G.-C. Wang DFT studies of methanol decomposition on Ni(100) surface: compared with Ni(111) surface J. Mol. Catal. A Chem. 258 1-2 2006 203 215 Zhou Y.-H., Lv P.-H., Wang G.-C. DFT studies of methanol decomposition on Ni(100) surface: Compared with Ni(111) surface [J]. Journal of Molecular Catalysis A: Chemical, 2006, 258(1-2): 203-215. [67] S.R. Bare J.A. Stroscio W. Ho The effects of preadsorbed oxygen on the adsorption and decomposition of methanol on Ni(110) Surf. Sci. Lett. 155 2-3 1985 L281 L291 Bare S.R., Stroscio J.A., Ho W. The effects of preadsorbed oxygen on the adsorption and decomposition of methanol on Ni(110) [J]. Surface Science Letters, 1985, 155(2-3): L281-L291. [68] M. Mavrikakis M.A. Barteau Oxygenate reaction pathways on transition metal surfaces J. Mol. Catal. A Chem. 131 1-3 1998 135 147 Mavrikakis M., Barteau M.A. Oxygenate reaction pathways on transition metal surfaces [J]. Journal of Molecular Catalysis A: Chemical, 1998, 131(1-3): 135-147. [69] N. Li Q. Zhang R. Bibi Catalytic hydrogenation of acetic acid to acetaldehyde: synergistic effect of bifunctional Co/Ce-Fe oxide solid solution catalysts Chin. J. Chem. 37 7 2019 709 719 Li N., Zhang Q., Bibi R., et al. Catalytic Hydrogenation of Acetic Acid to Acetaldehyde: Synergistic Effect of Bifunctional Co/Ce-Fe Oxide Solid Solution Catalysts [J]. Chinese Journal of Chemistry, 2019, 37(7): 709-719. [70] S.J. Carey W. Zhao E. Harman Energetics of adsorbed methanol and methoxy on Ni(111): Comparisons to Pt(111) ACS Catal. 8 11 2018 10089 10095 Carey S.J., Zhao W., Harman E., et al. Energetics of Adsorbed Methanol and Methoxy on Ni(111): Comparisons to Pt(111) [J]. Acs Catal, 2018, 8(11): 10089-10095. [71] M. Wang H. Yang J. Shi Alloying nickel with molybdenum significantly accelerates alkaline hydrogen electrocatalysis Angew. Chem. Int Ed. Engl. 60 11 2021 5771 5777 Wang M., Yang H., Shi J., et al. Alloying Nickel with Molybdenum Significantly Accelerates Alkaline Hydrogen Electrocatalysis [J]. Angew Chem Int Ed Engl, 2021, 60(11): 5771-5777. [72] F. Liu X. Cai Y. Tang Nano-Ni-Induced electronic modulation of mos2 nanosheets enables energy-saving H2 production and sulfide degradation Energy Environ. Mater. 7 3 2023 e12644 Liu F., Cai X., Tang Y., et al. Nano-Ni-Induced Electronic Modulation of MoS2 Nanosheets Enables Energy-Saving H2 Production and Sulfide Degradation [J]. Energy & Environmental Materials, 2023, 7(3): e12644. [73] P. Ruan B. Chen Q. Zhou Upgrading heterogeneous Ni catalysts with thiol modification Innovation 4 1 2023 100362 Ruan P., Chen B., Zhou Q., et al. Upgrading heterogeneous Ni catalysts with thiol modification [J]. Innovation, 2023, 4(1): 100362. [74] J. Han Q. Xu F. Tian Graphite conjugated nickel phthalocyanine for efficient CO2 electroreduction and Zn-CO2 batteries Chem. Sci. 15 38 2024 15670 15678 Han J., Xu Q., Tian F., et al. Graphite conjugated nickel phthalocyanine for efficient CO2 electroreduction and Zn-CO2 batteries [J]. Chem Sci, 2024, 15(38): 15670-15678.",
      "scopus-id": "105010522310",
      "coredata": {
        "eid": "1-s2.0-S0926860X25003515",
        "dc:description": "A series of metal foam-supported Ni-based catalysts-monometallic Ni-CF, bimetallic Ni/Ce-CF, Ni/Al-CF and trimetallic Ni/Ce/Al-CF-were prepared by modified wet chemical etching (MWCE) and employed for hydrogen production via methanol decomposition (MD) in the temperature range of 200–325 ℃. Among those catalysts, the 2Ni/3Ce/3Al-Cu foam (CF) catalyst shows the superior catalytic performance for hydrogen production, achieving a remarkable activity of almost complete methanol conversion (99.3 %) and high H2 selectivity of 91.8 % at 300 ℃. Moreover, the performance of 2Ni/3Ce/3Al-CF catalyst remained stable during the stability test for up to 40 h at 275 ℃. SEM and BET characterization show that etched copper foam can remarkably enlarge the specific surface area of the structured catalyst, provide more active sites, and enhance its catalytic activity. The strong interaction among Ni, Ce and Al induce the synergistic effect by creating abundant oxygen vacancies in the trimetallic system as evidenced by XPS. H2-TPR and XPS further revealed a crucial balance between reducibility and metal-support interactions: Al-containing catalysts like 2Ni/3Ce/3Al-CF exhibit higher reduction thresholds and confirming the role of Al in stabilizing oxidized Ni species via strong metal-support interactions. And CH3OH-TPD analysis indicated the catalyst had much higher low-temperature hydrogen production than other catalysts because of the synergistic effect of three metals, consistent with the catalyst activity test results. The developed strategy may provide insights into the development of the design principles for high-performance structured catalysts for hydrogen production via methanol decomposition.",
        "openArchiveArticle": "false",
        "prism:coverDate": "2025-09-25",
        "openaccessUserLicense": null,
        "prism:aggregationType": "Journal",
        "prism:url": "https://api.elsevier.com/content/article/pii/S0926860X25003515",
        "dc:creator": [
          {
            "@_fa": "true",
            "$": "Fu, Lijie"
          },
          {
            "@_fa": "true",
            "$": "Men, Yong"
          },
          {
            "@_fa": "true",
            "$": "Wu, Shuya"
          },
          {
            "@_fa": "true",
            "$": "Xu, Shuyi"
          },
          {
            "@_fa": "true",
            "$": "Wang, Guohong"
          },
          {
            "@_fa": "true",
            "$": "Kong, Chongchong"
          },
          {
            "@_fa": "true",
            "$": "Wang, Jinguo"
          },
          {
            "@_fa": "true",
            "$": "Shi, Feng"
          },
          {
            "@_fa": "true",
            "$": "Yan, Zhenrong"
          },
          {
            "@_fa": "true",
            "$": "Miao, Xuelong"
          }
        ],
        "link": [
          {
            "@_fa": "true",
            "@rel": "self",
            "@href": "https://api.elsevier.com/content/article/pii/S0926860X25003515"
          },
          {
            "@_fa": "true",
            "@rel": "scidir",
            "@href": "https://www.sciencedirect.com/science/article/pii/S0926860X25003515"
          }
        ],
        "dc:format": "application/json",
        "openaccessType": null,
        "pii": "S0926-860X(25)00351-5",
        "prism:volume": "705",
        "articleNumber": "120450",
        "prism:publisher": "Elsevier B.V. All rights are reserved, including those for text and data mining, AI training, and similar technologies.",
        "dc:title": "Superb three-dimensional porous-structured metal foam-supported Ni/Ce/Al-CF ensemble as an active structured catalyst for hydrogen production via methanol decomposition",
        "prism:copyright": "© 2025 Elsevier B.V. All rights are reserved, including those for text and data mining, AI training, and similar technologies.",
        "openaccess": "0",
        "prism:issn": "0926860X",
        "dcterms:subject": [
          {
            "@_fa": "true",
            "$": "Methanol decomposition"
          },
          {
            "@_fa": "true",
            "$": "Ni-based catalysts"
          },
          {
            "@_fa": "true",
            "$": "Structured catalysts"
          },
          {
            "@_fa": "true",
            "$": "Synergy effect"
          },
          {
            "@_fa": "true",
            "$": "Hydrogen production"
          }
        ],
        "openaccessArticle": "false",
        "prism:publicationName": "Applied Catalysis A: General",
        "openaccessSponsorType": null,
        "prism:pageRange": "120450",
        "pubType": "fla",
        "prism:coverDisplayDate": "25 September 2025",
        "prism:doi": "10.1016/j.apcata.2025.120450",
        "prism:startingPage": "120450",
        "dc:identifier": "doi:10.1016/j.apcata.2025.120450",
        "openaccessSponsorName": null
      },
      "objects": {
        "object": [
          {
            "@category": "standard",
            "@height": "232",
            "@width": "565",
            "@_fa": "true",
            "$": "https://api.elsevier.com/content/object/eid/1-s2.0-S0926860X25003515-gr2.jpg?httpAccept=%2A%2F%2A",
            "@multimediatype": "JPEG image file",
            "@type": "IMAGE-DOWNSAMPLED",
            "@size": "68693",
            "@ref": "gr2",
            "@mimetype": "image/jpeg"
          },
          {
            "@category": "standard",
            "@height": "200",
            "@width": "296",
            "@_fa": "true",
            "$": "https://api.elsevier.com/content/object/eid/1-s2.0-S0926860X25003515-ga1.jpg?httpAccept=%2A%2F%2A",
            "@multimediatype": "JPEG image file",
            "@type": "IMAGE-DOWNSAMPLED",
            "@size": "17206",
            "@ref": "ga1",
            "@mimetype": "image/jpeg"
          },
          {
            "@category": "standard",
            "@height": "280",
            "@width": "715",
            "@_fa": "true",
            "$": "https://api.elsevier.com/content/object/eid/1-s2.0-S0926860X25003515-gr3.jpg?httpAccept=%2A%2F%2A",
            "@multimediatype": "JPEG image file",
            "@type": "IMAGE-DOWNSAMPLED",
            "@size": "45088",
            "@ref": "gr3",
            "@mimetype": "image/jpeg"
          },
          {
            "@category": "standard",
            "@height": "329",
            "@width": "376",
            "@_fa": "true",
            "$": "https://api.elsevier.com/content/object/eid/1-s2.0-S0926860X25003515-gr4.jpg?httpAccept=%2A%2F%2A",
            "@multimediatype": "JPEG image file",
            "@type": "IMAGE-DOWNSAMPLED",
            "@size": "26272",
            "@ref": "gr4",
            "@mimetype": "image/jpeg"
          },
          {
            "@category": "standard",
            "@height": "920",
            "@width": "791",
            "@_fa": "true",
            "$": "https://api.elsevier.com/content/object/eid/1-s2.0-S0926860X25003515-gr5.jpg?httpAccept=%2A%2F%2A",
            "@multimediatype": "JPEG image file",
            "@type": "IMAGE-DOWNSAMPLED",
            "@size": "139041",
            "@ref": "gr5",
            "@mimetype": "image/jpeg"
          },
          {
            "@category": "standard",
            "@height": "647",
            "@width": "562",
            "@_fa": "true",
            "$": "https://api.elsevier.com/content/object/eid/1-s2.0-S0926860X25003515-gr1.jpg?httpAccept=%2A%2F%2A",
            "@multimediatype": "JPEG image file",
            "@type": "IMAGE-DOWNSAMPLED",
            "@size": "122008",
            "@ref": "gr1",
            "@mimetype": "image/jpeg"
          },
          {
            "@category": "standard",
            "@height": "240",
            "@width": "299",
            "@_fa": "true",
            "$": "https://api.elsevier.com/content/object/eid/1-s2.0-S0926860X25003515-gr6.jpg?httpAccept=%2A%2F%2A",
            "@multimediatype": "JPEG image file",
            "@type": "IMAGE-DOWNSAMPLED",
            "@size": "17321",
            "@ref": "gr6",
            "@mimetype": "image/jpeg"
          },
          {
            "@category": "standard",
            "@height": "539",
            "@width": "659",
            "@_fa": "true",
            "$": "https://api.elsevier.com/content/object/eid/1-s2.0-S0926860X25003515-gr7.jpg?httpAccept=%2A%2F%2A",
            "@multimediatype": "JPEG image file",
            "@type": "IMAGE-DOWNSAMPLED",
            "@size": "72982",
            "@ref": "gr7",
            "@mimetype": "image/jpeg"
          },
          {
            "@category": "standard",
            "@height": "852",
            "@width": "791",
            "@_fa": "true",
            "$": "https://api.elsevier.com/content/object/eid/1-s2.0-S0926860X25003515-gr8.jpg?httpAccept=%2A%2F%2A",
            "@multimediatype": "JPEG image file",
            "@type": "IMAGE-DOWNSAMPLED",
            "@size": "115170",
            "@ref": "gr8",
            "@mimetype": "image/jpeg"
          },
          {
            "@category": "standard",
            "@height": "269",
            "@width": "715",
            "@_fa": "true",
            "$": "https://api.elsevier.com/content/object/eid/1-s2.0-S0926860X25003515-gr9.jpg?httpAccept=%2A%2F%2A",
            "@multimediatype": "JPEG image file",
            "@type": "IMAGE-DOWNSAMPLED",
            "@size": "40288",
            "@ref": "gr9",
            "@mimetype": "image/jpeg"
          },
          {
            "@category": "thumbnail",
            "@height": "90",
            "@width": "219",
            "@_fa": "true",
            "$": "https://api.elsevier.com/content/object/eid/1-s2.0-S0926860X25003515-gr2.sml?httpAccept=%2A%2F%2A",
            "@multimediatype": "GIF image file",
            "@type": "IMAGE-THUMBNAIL",
            "@size": "16158",
            "@ref": "gr2",
            "@mimetype": "image/gif"
          },
          {
            "@category": "thumbnail",
            "@height": "148",
            "@width": "219",
            "@_fa": "true",
            "$": "https://api.elsevier.com/content/object/eid/1-s2.0-S0926860X25003515-ga1.sml?httpAccept=%2A%2F%2A",
            "@multimediatype": "GIF image file",
            "@type": "IMAGE-THUMBNAIL",
            "@size": "11775",
            "@ref": "ga1",
            "@mimetype": "image/gif"
          },
          {
            "@category": "thumbnail",
            "@height": "86",
            "@width": "219",
            "@_fa": "true",
            "$": "https://api.elsevier.com/content/object/eid/1-s2.0-S0926860X25003515-gr3.sml?httpAccept=%2A%2F%2A",
            "@multimediatype": "GIF image file",
            "@type": "IMAGE-THUMBNAIL",
            "@size": "6370",
            "@ref": "gr3",
            "@mimetype": "image/gif"
          },
          {
            "@category": "thumbnail",
            "@height": "164",
            "@width": "187",
            "@_fa": "true",
            "$": "https://api.elsevier.com/content/object/eid/1-s2.0-S0926860X25003515-gr4.sml?httpAccept=%2A%2F%2A",
            "@multimediatype": "GIF image file",
            "@type": "IMAGE-THUMBNAIL",
            "@size": "7374",
            "@ref": "gr4",
            "@mimetype": "image/gif"
          },
          {
            "@category": "thumbnail",
            "@height": "164",
            "@width": "141",
            "@_fa": "true",
            "$": "https://api.elsevier.com/content/object/eid/1-s2.0-S0926860X25003515-gr5.sml?httpAccept=%2A%2F%2A",
            "@multimediatype": "GIF image file",
            "@type": "IMAGE-THUMBNAIL",
            "@size": "9520",
            "@ref": "gr5",
            "@mimetype": "image/gif"
          },
          {
            "@category": "thumbnail",
            "@height": "163",
            "@width": "142",
            "@_fa": "true",
            "$": "https://api.elsevier.com/content/object/eid/1-s2.0-S0926860X25003515-gr1.sml?httpAccept=%2A%2F%2A",
            "@multimediatype": "GIF image file",
            "@type": "IMAGE-THUMBNAIL",
            "@size": "15324",
            "@ref": "gr1",
            "@mimetype": "image/gif"
          },
          {
            "@category": "thumbnail",
            "@height": "164",
            "@width": "204",
            "@_fa": "true",
            "$": "https://api.elsevier.com/content/object/eid/1-s2.0-S0926860X25003515-gr6.sml?httpAccept=%2A%2F%2A",
            "@multimediatype": "GIF image file",
            "@type": "IMAGE-THUMBNAIL",
            "@size": "7561",
            "@ref": "gr6",
            "@mimetype": "image/gif"
          },
          {
            "@category": "thumbnail",
            "@height": "164",
            "@width": "200",
            "@_fa": "true",
            "$": "https://api.elsevier.com/content/object/eid/1-s2.0-S0926860X25003515-gr7.sml?httpAccept=%2A%2F%2A",
            "@multimediatype": "GIF image file",
            "@type": "IMAGE-THUMBNAIL",
            "@size": "10396",
            "@ref": "gr7",
            "@mimetype": "image/gif"
          },
          {
            "@category": "thumbnail",
            "@height": "164",
            "@width": "152",
            "@_fa": "true",
            "$": "https://api.elsevier.com/content/object/eid/1-s2.0-S0926860X25003515-gr8.sml?httpAccept=%2A%2F%2A",
            "@multimediatype": "GIF image file",
            "@type": "IMAGE-THUMBNAIL",
            "@size": "8301",
            "@ref": "gr8",
            "@mimetype": "image/gif"
          },
          {
            "@category": "thumbnail",
            "@height": "82",
            "@width": "219",
            "@_fa": "true",
            "$": "https://api.elsevier.com/content/object/eid/1-s2.0-S0926860X25003515-gr9.sml?httpAccept=%2A%2F%2A",
            "@multimediatype": "GIF image file",
            "@type": "IMAGE-THUMBNAIL",
            "@size": "5994",
            "@ref": "gr9",
            "@mimetype": "image/gif"
          },
          {
            "@category": "high",
            "@height": "1025",
            "@width": "2495",
            "@_fa": "true",
            "$": "https://api.elsevier.com/content/object/eid/1-s2.0-S0926860X25003515-gr2_lrg.jpg?httpAccept=%2A%2F%2A",
            "@multimediatype": "JPEG image file",
            "@type": "IMAGE-HIGH-RES",
            "@size": "536927",
            "@ref": "gr2",
            "@mimetype": "image/jpeg"
          },
          {
            "@category": "high",
            "@height": "886",
            "@width": "1313",
            "@_fa": "true",
            "$": "https://api.elsevier.com/content/object/eid/1-s2.0-S0926860X25003515-ga1_lrg.jpg?httpAccept=%2A%2F%2A",
            "@multimediatype": "JPEG image file",
            "@type": "IMAGE-HIGH-RES",
            "@size": "134065",
            "@ref": "ga1",
            "@mimetype": "image/jpeg"
          },
          {
            "@category": "high",
            "@height": "1237",
            "@width": "3160",
            "@_fa": "true",
            "$": "https://api.elsevier.com/content/object/eid/1-s2.0-S0926860X25003515-gr3_lrg.jpg?httpAccept=%2A%2F%2A",
            "@multimediatype": "JPEG image file",
            "@type": "IMAGE-HIGH-RES",
            "@size": "195644",
            "@ref": "gr3",
            "@mimetype": "image/jpeg"
          },
          {
            "@category": "high",
            "@height": "1456",
            "@width": "1663",
            "@_fa": "true",
            "$": "https://api.elsevier.com/content/object/eid/1-s2.0-S0926860X25003515-gr4_lrg.jpg?httpAccept=%2A%2F%2A",
            "@multimediatype": "JPEG image file",
            "@type": "IMAGE-HIGH-RES",
            "@size": "127429",
            "@ref": "gr4",
            "@mimetype": "image/jpeg"
          },
          {
            "@category": "high",
            "@height": "4062",
            "@width": "3493",
            "@_fa": "true",
            "$": "https://api.elsevier.com/content/object/eid/1-s2.0-S0926860X25003515-gr5_lrg.jpg?httpAccept=%2A%2F%2A",
            "@multimediatype": "JPEG image file",
            "@type": "IMAGE-HIGH-RES",
            "@size": "664924",
            "@ref": "gr5",
            "@mimetype": "image/jpeg"
          },
          {
            "@category": "high",
            "@height": "2861",
            "@width": "2487",
            "@_fa": "true",
            "$": "https://api.elsevier.com/content/object/eid/1-s2.0-S0926860X25003515-gr1_lrg.jpg?httpAccept=%2A%2F%2A",
            "@multimediatype": "JPEG image file",
            "@type": "IMAGE-HIGH-RES",
            "@size": "634229",
            "@ref": "gr1",
            "@mimetype": "image/jpeg"
          },
          {
            "@category": "high",
            "@height": "1066",
            "@width": "1330",
            "@_fa": "true",
            "$": "https://api.elsevier.com/content/object/eid/1-s2.0-S0926860X25003515-gr6_lrg.jpg?httpAccept=%2A%2F%2A",
            "@multimediatype": "JPEG image file",
            "@type": "IMAGE-HIGH-RES",
            "@size": "88472",
            "@ref": "gr6",
            "@mimetype": "image/jpeg"
          },
          {
            "@category": "high",
            "@height": "2383",
            "@width": "2911",
            "@_fa": "true",
            "$": "https://api.elsevier.com/content/object/eid/1-s2.0-S0926860X25003515-gr7_lrg.jpg?httpAccept=%2A%2F%2A",
            "@multimediatype": "JPEG image file",
            "@type": "IMAGE-HIGH-RES",
            "@size": "336876",
            "@ref": "gr7",
            "@mimetype": "image/jpeg"
          },
          {
            "@category": "high",
            "@height": "3764",
            "@width": "3493",
            "@_fa": "true",
            "$": "https://api.elsevier.com/content/object/eid/1-s2.0-S0926860X25003515-gr8_lrg.jpg?httpAccept=%2A%2F%2A",
            "@multimediatype": "JPEG image file",
            "@type": "IMAGE-HIGH-RES",
            "@size": "518742",
            "@ref": "gr8",
            "@mimetype": "image/jpeg"
          },
          {
            "@category": "high",
            "@height": "1188",
            "@width": "3160",
            "@_fa": "true",
            "$": "https://api.elsevier.com/content/object/eid/1-s2.0-S0926860X25003515-gr9_lrg.jpg?httpAccept=%2A%2F%2A",
            "@multimediatype": "JPEG image file",
            "@type": "IMAGE-HIGH-RES",
            "@size": "175052",
            "@ref": "gr9",
            "@mimetype": "image/jpeg"
          },
          {
            "@category": "standard",
            "@_fa": "true",
            "$": "https://api.elsevier.com/content/object/eid/1-s2.0-S0926860X25003515-mmc1.docx?httpAccept=%2A%2F%2A",
            "@multimediatype": "Microsoft Word file",
            "@type": "APPLICATION",
            "@size": "300258",
            "@ref": "mmc1",
            "@mimetype": "application/word"
          },
          {
            "@category": "thumbnail",
            "@_fa": "true",
            "$": "https://api.elsevier.com/content/object/eid/1-s2.0-S0926860X25003515-si0001.svg?httpAccept=%2A%2F%2A",
            "@multimediatype": "Scalable Vector Graphics file",
            "@type": "ALTIMG",
            "@size": "4684",
            "@ref": "si0001",
            "@mimetype": "image/svg+xml"
          },
          {
            "@category": "thumbnail",
            "@_fa": "true",
            "$": "https://api.elsevier.com/content/object/eid/1-s2.0-S0926860X25003515-si0002.svg?httpAccept=%2A%2F%2A",
            "@multimediatype": "Scalable Vector Graphics file",
            "@type": "ALTIMG",
            "@size": "4575",
            "@ref": "si0002",
            "@mimetype": "image/svg+xml"
          },
          {
            "@category": "thumbnail",
            "@_fa": "true",
            "$": "https://api.elsevier.com/content/object/eid/1-s2.0-S0926860X25003515-si0003.svg?httpAccept=%2A%2F%2A",
            "@multimediatype": "Scalable Vector Graphics file",
            "@type": "ALTIMG",
            "@size": "4449",
            "@ref": "si0003",
            "@mimetype": "image/svg+xml"
          }
        ]
      },
      "link": {
        "@rel": "abstract",
        "@href": "https://api.elsevier.com/content/abstract/scopus_id/105010522310"
      }
    }
  }
}