{
  "metadata": {
    "title": "Fabricating highly dispersed and stable LaMnO<ce:inf loc=post>3</ce:inf> perovskite oxide catalysts for selective aerobic oxidation of toluene to benzoic acid under solvent-free conditions",
    "authors": "; ; ",
    "journal": "Applied Catalysis A: General",
    "date": "2025-05-05",
    "doi": "10.1016/j.apcata.2025.120218",
    "abstract": "",
    "uri": "https://api.elsevier.com/content/article/pii/S0926860X2500119X",
    "pii": "S0926860X2500119X"
  },
  "fulltext": {
    "full-text-retrieval-response": {
      "scopus-eid": "2-s2.0-86000733882",
      "originalText": "serial JL 271346 291210 291744 291809 31 Applied Catalysis A: General APPLIEDCATALYSISAGENERAL 2025-03-11 2025-03-11 2025-03-13 2025-03-13 2025-03-26T08:53:07 1-s2.0-S0926860X2500119X S0926-860X(25)00119-X S0926860X2500119X 10.1016/j.apcata.2025.120218 S300 S300.1 FULL-TEXT 1-s2.0-S0926860X25X00053 2025-03-26T09:54:55.959173Z 0 0 20250505 2025 2025-03-11T16:19:33.417395Z absattachment articleinfo articlenumber articletitlenorm authfirstinitialnorm authfirstsurnamenorm cid cids contenttype copyright crossmark dateloaded dateloadedtxt datesearch datesort dateupdated dco docsubtype doctype doi eid ewtransactionid hubeid indexeddate issn issnnorm itemstage itemtransactionid itemweight openaccess openarchive pg pgfirst pii piinorm pubdatestart pubdatetxt pubyr sortorder srctitle srctitlenorm srctype ssids alllist content subj subheadings suppl tomb volfirst volissue volumelist webpdf webpdfpagecount yearnav figure table e-component body mmlmath acknowledge affil appendices articletitle auth authfirstini authfull authkeywords authlast grantnumber grantsponsor highlightsabst orcid primabst ref specialabst 0926-860X 0926860X true 697 697 C Volume 697 11 120218 120218 120218 20250505 5 May 2025 2025-05-05 2025 article fla © 2025 Elsevier B.V. All rights are reserved, including those for text and data mining, AI training, and similar technologies. FABRICATINGHIGHLYDISPERSEDSTABLELAMNO3PEROVSKITEOXIDECATALYSTSFORSELECTIVEAEROBICOXIDATIONTOLUENEBENZOICACIDUNDERSOLVENTFREECONDITIONS SHAN J 1 Introduction 2 Experimental section 2.1 Synthesis of catalysts 2.2 Characterization of catalysts 2.3 Evaluation of catalyst activity 2.4 Evaluation of catalyst reusability 3 Properties and performance of catalysts 3.1 Structural and texture properties 3.2 Redox properties and dispersity 3.3 Chemical states of the elements 3.4 Catalytic performance of toluene selective oxidation 3.4.1 The effects of preparation conditions on the oxidation of toluene 3.4.2 Influence of reaction conditions on the oxidation of toluene 3.4.3 Reusability of catalysts 4 Reaction mechanism 5 Conclusions CRediT authorship contribution statement Acknowledgements Appendix A Supplementary material References WANG 2010 394 400 H BERNE 2015 4264 4276 S SATRIO 2001 4356 J ROMERO 2008 775 779 A DENG 2020 341 349 C CUI 2024 4310 4313 J SHI 2025 177219 M WANG 2010 220 224 H ALHUNAITI 2020 4945 4953 A XIA 2016 72 76 H AMIN 2020 1 8 E XU 2019 4441 4450 C KARUEHANON 2012 9423 9428 W SHIJINA 2008 261 270 A FAN 2017 20 26 S KAUR 2018 239 246 M CHEN 2021 2881 2891 L PETA 2018 34 41 S MOHAMMADPOUR 2020 23543 23553 P SUBRAHMANYAM 2005 67 71 C GU 2021 0022 4596 X XU 2021 0254 0584 S WU 2016 311 322 Z LI 2006 137 140 X LI 2006 255 260 X JIN 2009 169 175 L PETTITI 2004 1350 1358 I BILKOVA 2021 257 266 T LI 2019 92 99 B OTURAN 2014 2577 2641 M MISTRI 2016 4469 R ZHAO 2016 69855 69860 B CHEN 2020 144112 H ZHAO 2018 26 30 B PATHREEKER 2020 114453 S LI 2023 118947 L YUASA 2011 4 M MAJEE 2020 40355 40363 R WANG 2019 190 195 L DELIMA 2009 441 450 R HUANG 2021 117633 Z GAO 2025 124745 H LIU 2012 149 160 Y GU 2021 124458 W ZHANG 2020 6652 6662 C LI 2024 159272 H HUANG 2024 43 56 Z CHEN 2013 105 108 J CHEN 2013 251 257 J SONG 2024 1693 1703 Z CHENG 2024 131641 G JOSHI 2005 325 333 S HUANG 2013 217 226 X SU 2020 1324 1333 K MIAO 2022 118787 S LUO 2023 10051 10056 H SHANX2025X120218 SHANX2025X120218XJ 2027-03-13T00:00:00.000Z 2027-03-13T00:00:00.000Z http://creativecommons.org/licenses/by-nc-nd/4.0/ © 2025 Elsevier B.V. All rights are reserved, including those for text and data mining, AI training, and similar technologies. 2025-03-19T01:50:27.075Z http://vtw.elsevier.com/data/voc/AddOnTypes/50.7/aggregated-refined YZ2024229 Yangzhou Science and Technology Bureau http://data.elsevier.com/vocabulary/SciValFunders/501100014862 http://sws.geonames.org/1814991 SJCX23_1919 Jiangsu Province Department of Education http://data.elsevier.com/vocabulary/SciValFunders/501100007166 http://sws.geonames.org/1814991 Yangzhou Science and Technology Program Funds Postgraduate Research & Practice Innovation Program of Jiangsu Province Yangzhou University YZU Yangzhou University http://data.elsevier.com/vocabulary/SciValFunders/501100007062 http://sws.geonames.org/1814991/ The authors are grateful for the supports from Postgraduate Research & Practice Innovation Program of Jiangsu Province (Yangzhou University, SJCX23_1919) and Yangzhou Science and Technology Program Funds (YZ2024229). The authors sincerely thank Prof. Jianyi Shen for the constructive suggestions, and wish to acknowledge the assistance provided by Ms. Jingwen Gao as a postgraduate. This work contained no animal experiment. The authors are grateful for the supports from Postgraduate Research & Practice Innovation Program of Jiangsu Province (Yangzhou University, SJCX23_1919) and Yangzhou Science and Technology Program Funds (YZ2024229). The authors sincerely thank Prof. Jianyi Shen for the constructive suggestions, and wish to acknowledge the assistance provided by Ms. Jingwen Gao as a postgraduate. https://doi.org/10.15223/policy-017 https://doi.org/10.15223/policy-037 https://doi.org/10.15223/policy-012 https://doi.org/10.15223/policy-029 https://doi.org/10.15223/policy-004 item S0926-860X(25)00119-X S0926860X2500119X 1-s2.0-S0926860X2500119X 10.1016/j.apcata.2025.120218 271346 2025-03-26T09:54:55.959173Z 2025-05-05 1-s2.0-S0926860X2500119X-main.pdf https://s3-eu-west-1.amazonaws.com/prod-ucs-content-store-eu-west/content/pii:S0926860X2500119X/MAIN/application/pdf/a71599b7a4b1d261d8d8a882714d6ebc/main.pdf main.pdf pdf true 7017587 MAIN 14 1-s2.0-S0926860X2500119X-main_1.png https://s3-eu-west-1.amazonaws.com/prod-ucs-content-store-eu-west/content/pii:S0926860X2500119X/PREVIEW/image/png/9fbd1fe99907761c9273c65034ba542f/main_1.png main_1.png png 57351 849 656 IMAGE-WEB-PDF 1 1-s2.0-S0926860X2500119X-gr8.jpg https://s3-eu-west-1.amazonaws.com/prod-ucs-content-store-eu-west/content/pii:S0926860X2500119X/gr8/DOWNSAMPLED/image/jpeg/3dc8193e77f61d3bf1b58bd2a819cb20/gr8.jpg gr8 gr8.jpg jpg 41611 276 678 IMAGE-DOWNSAMPLED 1-s2.0-S0926860X2500119X-gr7.jpg https://s3-eu-west-1.amazonaws.com/prod-ucs-content-store-eu-west/content/pii:S0926860X2500119X/gr7/DOWNSAMPLED/image/jpeg/c8332913a9f0d3469e595835ff8ff4dd/gr7.jpg gr7 gr7.jpg jpg 54091 248 678 IMAGE-DOWNSAMPLED 1-s2.0-S0926860X2500119X-fx15.jpg https://s3-eu-west-1.amazonaws.com/prod-ucs-content-store-eu-west/content/pii:S0926860X2500119X/fx15/DOWNSAMPLED/image/jpeg/312e06110437431aea65bd42e65a6d3e/fx15.jpg fx15 fx15.jpg jpg 5855 46 439 IMAGE-DOWNSAMPLED 1-s2.0-S0926860X2500119X-gr6.jpg https://s3-eu-west-1.amazonaws.com/prod-ucs-content-store-eu-west/content/pii:S0926860X2500119X/gr6/DOWNSAMPLED/image/jpeg/5dac4b0b346aa8f020dd95004c0d4a7e/gr6.jpg gr6 gr6.jpg jpg 47603 274 678 IMAGE-DOWNSAMPLED 1-s2.0-S0926860X2500119X-fx16.jpg https://s3-eu-west-1.amazonaws.com/prod-ucs-content-store-eu-west/content/pii:S0926860X2500119X/fx16/DOWNSAMPLED/image/jpeg/5f68c959f4dffc2cf5149c21a1c9ef49/fx16.jpg fx16 fx16.jpg jpg 7107 49 530 IMAGE-DOWNSAMPLED 1-s2.0-S0926860X2500119X-gr5.jpg https://s3-eu-west-1.amazonaws.com/prod-ucs-content-store-eu-west/content/pii:S0926860X2500119X/gr5/DOWNSAMPLED/image/jpeg/b1cb30429f0adbf2322fb780a84b2de8/gr5.jpg gr5 gr5.jpg jpg 39306 268 678 IMAGE-DOWNSAMPLED 1-s2.0-S0926860X2500119X-fx7.jpg https://s3-eu-west-1.amazonaws.com/prod-ucs-content-store-eu-west/content/pii:S0926860X2500119X/fx7/DOWNSAMPLED/image/jpeg/5c90abc300305a67b9fabd40755fbca7/fx7.jpg fx7 fx7.jpg jpg 4191 47 337 IMAGE-DOWNSAMPLED 1-s2.0-S0926860X2500119X-fx6.jpg https://s3-eu-west-1.amazonaws.com/prod-ucs-content-store-eu-west/content/pii:S0926860X2500119X/fx6/DOWNSAMPLED/image/jpeg/979920dba74bebf38e246c3614e494cb/fx6.jpg fx6 fx6.jpg jpg 4128 48 327 IMAGE-DOWNSAMPLED 1-s2.0-S0926860X2500119X-fx10.jpg https://s3-eu-west-1.amazonaws.com/prod-ucs-content-store-eu-west/content/pii:S0926860X2500119X/fx10/DOWNSAMPLED/image/jpeg/96e55ee6cb12e49ca6605a43e51ceea8/fx10.jpg fx10 fx10.jpg jpg 6972 50 544 IMAGE-DOWNSAMPLED 1-s2.0-S0926860X2500119X-fx5.jpg https://s3-eu-west-1.amazonaws.com/prod-ucs-content-store-eu-west/content/pii:S0926860X2500119X/fx5/DOWNSAMPLED/image/jpeg/d8798c8fc495b50dde9e80c71204859f/fx5.jpg fx5 fx5.jpg jpg 6120 48 521 IMAGE-DOWNSAMPLED 1-s2.0-S0926860X2500119X-fx4.jpg https://s3-eu-west-1.amazonaws.com/prod-ucs-content-store-eu-west/content/pii:S0926860X2500119X/fx4/DOWNSAMPLED/image/jpeg/6f70bb44860f131b5ec0df65298ad572/fx4.jpg fx4 fx4.jpg jpg 4921 50 392 IMAGE-DOWNSAMPLED 1-s2.0-S0926860X2500119X-fx13.jpg https://s3-eu-west-1.amazonaws.com/prod-ucs-content-store-eu-west/content/pii:S0926860X2500119X/fx13/DOWNSAMPLED/image/jpeg/e152856698dff5a8a06f3a4136342a69/fx13.jpg fx13 fx13.jpg jpg 4602 47 365 IMAGE-DOWNSAMPLED 1-s2.0-S0926860X2500119X-gr4.jpg https://s3-eu-west-1.amazonaws.com/prod-ucs-content-store-eu-west/content/pii:S0926860X2500119X/gr4/DOWNSAMPLED/image/jpeg/6313d9ace0889ea86dd46e62bfdea064/gr4.jpg gr4 gr4.jpg jpg 101289 583 565 IMAGE-DOWNSAMPLED 1-s2.0-S0926860X2500119X-fx14.jpg https://s3-eu-west-1.amazonaws.com/prod-ucs-content-store-eu-west/content/pii:S0926860X2500119X/fx14/DOWNSAMPLED/image/jpeg/f66e44c2e608bd81c48ecd9e87acbee4/fx14.jpg fx14 fx14.jpg jpg 5467 47 469 IMAGE-DOWNSAMPLED 1-s2.0-S0926860X2500119X-gr3.jpg https://s3-eu-west-1.amazonaws.com/prod-ucs-content-store-eu-west/content/pii:S0926860X2500119X/gr3/DOWNSAMPLED/image/jpeg/abcd09386ebd7e0bfe1af79d02b8c937/gr3.jpg gr3 gr3.jpg jpg 161158 719 678 IMAGE-DOWNSAMPLED 1-s2.0-S0926860X2500119X-fx9.jpg https://s3-eu-west-1.amazonaws.com/prod-ucs-content-store-eu-west/content/pii:S0926860X2500119X/fx9/DOWNSAMPLED/image/jpeg/4aa9f40e114746c1b76811d85f4b206d/fx9.jpg fx9 fx9.jpg jpg 4585 48 368 IMAGE-DOWNSAMPLED 1-s2.0-S0926860X2500119X-fx11.jpg https://s3-eu-west-1.amazonaws.com/prod-ucs-content-store-eu-west/content/pii:S0926860X2500119X/fx11/DOWNSAMPLED/image/jpeg/4e2731448b5d092ede51243542e84dbb/fx11.jpg fx11 fx11.jpg jpg 4265 48 320 IMAGE-DOWNSAMPLED 1-s2.0-S0926860X2500119X-gr2.jpg https://s3-eu-west-1.amazonaws.com/prod-ucs-content-store-eu-west/content/pii:S0926860X2500119X/gr2/DOWNSAMPLED/image/jpeg/ee7ea96a8fc0e5a928a8e8f2a620a89b/gr2.jpg gr2 gr2.jpg jpg 37878 268 678 IMAGE-DOWNSAMPLED 1-s2.0-S0926860X2500119X-fx8.jpg https://s3-eu-west-1.amazonaws.com/prod-ucs-content-store-eu-west/content/pii:S0926860X2500119X/fx8/DOWNSAMPLED/image/jpeg/661f845cbc0e460250ea2e89ddc3b6f1/fx8.jpg fx8 fx8.jpg jpg 7323 50 553 IMAGE-DOWNSAMPLED 1-s2.0-S0926860X2500119X-fx12.jpg https://s3-eu-west-1.amazonaws.com/prod-ucs-content-store-eu-west/content/pii:S0926860X2500119X/fx12/DOWNSAMPLED/image/jpeg/4ec433d75b615c09e572a510c6e8792f/fx12.jpg fx12 fx12.jpg jpg 6089 47 502 IMAGE-DOWNSAMPLED 1-s2.0-S0926860X2500119X-gr1.jpg https://s3-eu-west-1.amazonaws.com/prod-ucs-content-store-eu-west/content/pii:S0926860X2500119X/gr1/DOWNSAMPLED/image/jpeg/d8f53137e5e27ec71ea765eacb389452/gr1.jpg gr1 gr1.jpg jpg 44522 249 678 IMAGE-DOWNSAMPLED 1-s2.0-S0926860X2500119X-fx3.jpg https://s3-eu-west-1.amazonaws.com/prod-ucs-content-store-eu-west/content/pii:S0926860X2500119X/fx3/DOWNSAMPLED/image/jpeg/bb4417437cd131bbdc4159b12477438f/fx3.jpg fx3 fx3.jpg jpg 7902 50 574 IMAGE-DOWNSAMPLED 1-s2.0-S0926860X2500119X-sc1.jpg https://s3-eu-west-1.amazonaws.com/prod-ucs-content-store-eu-west/content/pii:S0926860X2500119X/sc1/DOWNSAMPLED/image/jpeg/1a6c5dcc56d0c8efb30d8b3866f90781/sc1.jpg sc1 sc1.jpg jpg 17741 257 564 IMAGE-DOWNSAMPLED 1-s2.0-S0926860X2500119X-fx2.jpg https://s3-eu-west-1.amazonaws.com/prod-ucs-content-store-eu-west/content/pii:S0926860X2500119X/fx2/DOWNSAMPLED/image/jpeg/c1af9853dd3d311977a8eb95d38b96f9/fx2.jpg fx2 fx2.jpg jpg 4511 48 361 IMAGE-DOWNSAMPLED 1-s2.0-S0926860X2500119X-fx1.jpg https://s3-eu-west-1.amazonaws.com/prod-ucs-content-store-eu-west/content/pii:S0926860X2500119X/fx1/DOWNSAMPLED/image/jpeg/0af74913bb529fa09b1dc7c23c81936a/fx1.jpg fx1 fx1.jpg jpg 6509 50 496 IMAGE-DOWNSAMPLED 1-s2.0-S0926860X2500119X-ga1.jpg https://s3-eu-west-1.amazonaws.com/prod-ucs-content-store-eu-west/content/pii:S0926860X2500119X/ga1/DOWNSAMPLED/image/jpeg/221edcb48712bd4048026c12f4d017a4/ga1.jpg ga1 true ga1.jpg jpg 26339 200 449 IMAGE-DOWNSAMPLED 1-s2.0-S0926860X2500119X-gr8.sml https://s3-eu-west-1.amazonaws.com/prod-ucs-content-store-eu-west/content/pii:S0926860X2500119X/gr8/THUMBNAIL/image/gif/cc8f42ab5b345f6e6ec9125c8df26de0/gr8.sml gr8 gr8.sml sml 6687 89 219 IMAGE-THUMBNAIL 1-s2.0-S0926860X2500119X-gr7.sml https://s3-eu-west-1.amazonaws.com/prod-ucs-content-store-eu-west/content/pii:S0926860X2500119X/gr7/THUMBNAIL/image/gif/0a6bca6391891e4c91d81df7f0b5d429/gr7.sml gr7 gr7.sml sml 6473 80 219 IMAGE-THUMBNAIL 1-s2.0-S0926860X2500119X-fx15.sml https://s3-eu-west-1.amazonaws.com/prod-ucs-content-store-eu-west/content/pii:S0926860X2500119X/fx15/THUMBNAIL/image/gif/d8da95f3b9616c76041e8012e3c04818/fx15.sml fx15 fx15.sml sml 1993 23 219 IMAGE-THUMBNAIL 1-s2.0-S0926860X2500119X-gr6.sml https://s3-eu-west-1.amazonaws.com/prod-ucs-content-store-eu-west/content/pii:S0926860X2500119X/gr6/THUMBNAIL/image/gif/1ae0b0cc9a5bcc1ef9a586895a922ef4/gr6.sml gr6 gr6.sml sml 7033 88 219 IMAGE-THUMBNAIL 1-s2.0-S0926860X2500119X-fx16.sml https://s3-eu-west-1.amazonaws.com/prod-ucs-content-store-eu-west/content/pii:S0926860X2500119X/fx16/THUMBNAIL/image/gif/77c10cf636948f28eefa2643a5475361/fx16.sml fx16 fx16.sml sml 1956 20 219 IMAGE-THUMBNAIL 1-s2.0-S0926860X2500119X-gr5.sml https://s3-eu-west-1.amazonaws.com/prod-ucs-content-store-eu-west/content/pii:S0926860X2500119X/gr5/THUMBNAIL/image/gif/a22b74c6356496e3d490f9123fdb9b8a/gr5.sml gr5 gr5.sml sml 5120 86 219 IMAGE-THUMBNAIL 1-s2.0-S0926860X2500119X-fx7.sml https://s3-eu-west-1.amazonaws.com/prod-ucs-content-store-eu-west/content/pii:S0926860X2500119X/fx7/THUMBNAIL/image/gif/6326f3c3cf7bfb792be7f6f1c7c386d6/fx7.sml fx7 fx7.sml sml 2003 30 219 IMAGE-THUMBNAIL 1-s2.0-S0926860X2500119X-fx6.sml https://s3-eu-west-1.amazonaws.com/prod-ucs-content-store-eu-west/content/pii:S0926860X2500119X/fx6/THUMBNAIL/image/gif/9c0032d1b423d224c058fbee44a1e7fc/fx6.sml fx6 fx6.sml sml 2123 32 219 IMAGE-THUMBNAIL 1-s2.0-S0926860X2500119X-fx10.sml https://s3-eu-west-1.amazonaws.com/prod-ucs-content-store-eu-west/content/pii:S0926860X2500119X/fx10/THUMBNAIL/image/gif/5f8654f156ff726649178e6d2e7b9366/fx10.sml fx10 fx10.sml sml 1854 20 219 IMAGE-THUMBNAIL 1-s2.0-S0926860X2500119X-fx5.sml https://s3-eu-west-1.amazonaws.com/prod-ucs-content-store-eu-west/content/pii:S0926860X2500119X/fx5/THUMBNAIL/image/gif/9717c3c7c16597f7781b05cb7e0b340a/fx5.sml fx5 fx5.sml sml 1815 20 219 IMAGE-THUMBNAIL 1-s2.0-S0926860X2500119X-fx4.sml https://s3-eu-west-1.amazonaws.com/prod-ucs-content-store-eu-west/content/pii:S0926860X2500119X/fx4/THUMBNAIL/image/gif/c314a5344d7e9dc12b8520eccb344349/fx4.sml fx4 fx4.sml sml 2025 28 219 IMAGE-THUMBNAIL 1-s2.0-S0926860X2500119X-fx13.sml https://s3-eu-west-1.amazonaws.com/prod-ucs-content-store-eu-west/content/pii:S0926860X2500119X/fx13/THUMBNAIL/image/gif/5dab1a6bc88af527afd5deded0359f13/fx13.sml fx13 fx13.sml sml 2059 28 219 IMAGE-THUMBNAIL 1-s2.0-S0926860X2500119X-gr4.sml https://s3-eu-west-1.amazonaws.com/prod-ucs-content-store-eu-west/content/pii:S0926860X2500119X/gr4/THUMBNAIL/image/gif/c82858da5f8e3443d6754545b329f5f6/gr4.sml gr4 gr4.sml sml 17135 164 159 IMAGE-THUMBNAIL 1-s2.0-S0926860X2500119X-fx14.sml https://s3-eu-west-1.amazonaws.com/prod-ucs-content-store-eu-west/content/pii:S0926860X2500119X/fx14/THUMBNAIL/image/gif/68ac57281dc74dbc3d536a4d68c2e2f6/fx14.sml fx14 fx14.sml sml 1911 22 219 IMAGE-THUMBNAIL 1-s2.0-S0926860X2500119X-gr3.sml https://s3-eu-west-1.amazonaws.com/prod-ucs-content-store-eu-west/content/pii:S0926860X2500119X/gr3/THUMBNAIL/image/gif/4c08841ddb7a17f54f6fe0168df9c560/gr3.sml gr3 gr3.sml sml 13285 163 154 IMAGE-THUMBNAIL 1-s2.0-S0926860X2500119X-fx9.sml https://s3-eu-west-1.amazonaws.com/prod-ucs-content-store-eu-west/content/pii:S0926860X2500119X/fx9/THUMBNAIL/image/gif/fd7044ea50a3558e643ec9d8e54f823c/fx9.sml fx9 fx9.sml sml 2032 29 219 IMAGE-THUMBNAIL 1-s2.0-S0926860X2500119X-fx11.sml https://s3-eu-west-1.amazonaws.com/prod-ucs-content-store-eu-west/content/pii:S0926860X2500119X/fx11/THUMBNAIL/image/gif/604dffd1d1fda1a5a795d9d00454a862/fx11.sml fx11 fx11.sml sml 2207 33 219 IMAGE-THUMBNAIL 1-s2.0-S0926860X2500119X-gr2.sml https://s3-eu-west-1.amazonaws.com/prod-ucs-content-store-eu-west/content/pii:S0926860X2500119X/gr2/THUMBNAIL/image/gif/e3e213ffb3cefd6cef82afd9240dd9f2/gr2.sml gr2 gr2.sml sml 5155 87 219 IMAGE-THUMBNAIL 1-s2.0-S0926860X2500119X-fx8.sml https://s3-eu-west-1.amazonaws.com/prod-ucs-content-store-eu-west/content/pii:S0926860X2500119X/fx8/THUMBNAIL/image/gif/5ee440884ee035022dc1a63119f2a428/fx8.sml fx8 fx8.sml sml 1941 20 219 IMAGE-THUMBNAIL 1-s2.0-S0926860X2500119X-fx12.sml https://s3-eu-west-1.amazonaws.com/prod-ucs-content-store-eu-west/content/pii:S0926860X2500119X/fx12/THUMBNAIL/image/gif/3e0a6324365a4fcc0910215cae2e11e9/fx12.sml fx12 fx12.sml sml 1909 21 219 IMAGE-THUMBNAIL 1-s2.0-S0926860X2500119X-gr1.sml https://s3-eu-west-1.amazonaws.com/prod-ucs-content-store-eu-west/content/pii:S0926860X2500119X/gr1/THUMBNAIL/image/gif/fadbd4a96b79429e1fde4d491af47b3e/gr1.sml gr1 gr1.sml sml 5923 81 219 IMAGE-THUMBNAIL 1-s2.0-S0926860X2500119X-fx3.sml https://s3-eu-west-1.amazonaws.com/prod-ucs-content-store-eu-west/content/pii:S0926860X2500119X/fx3/THUMBNAIL/image/gif/97caefdeaef0e40dbe2c42611e1d67aa/fx3.sml fx3 fx3.sml sml 1874 19 219 IMAGE-THUMBNAIL 1-s2.0-S0926860X2500119X-sc1.sml https://s3-eu-west-1.amazonaws.com/prod-ucs-content-store-eu-west/content/pii:S0926860X2500119X/sc1/THUMBNAIL/image/gif/04a92df60de7786f925218fc537be325/sc1.sml sc1 sc1.sml sml 3166 100 219 IMAGE-THUMBNAIL 1-s2.0-S0926860X2500119X-fx2.sml https://s3-eu-west-1.amazonaws.com/prod-ucs-content-store-eu-west/content/pii:S0926860X2500119X/fx2/THUMBNAIL/image/gif/856798e5cc32d11f21e32ca78bc8d3f8/fx2.sml fx2 fx2.sml sml 1955 29 219 IMAGE-THUMBNAIL 1-s2.0-S0926860X2500119X-fx1.sml https://s3-eu-west-1.amazonaws.com/prod-ucs-content-store-eu-west/content/pii:S0926860X2500119X/fx1/THUMBNAIL/image/gif/2fd61a257f586711b475cb3cf72eddfb/fx1.sml fx1 fx1.sml sml 1955 22 219 IMAGE-THUMBNAIL 1-s2.0-S0926860X2500119X-ga1.sml https://s3-eu-west-1.amazonaws.com/prod-ucs-content-store-eu-west/content/pii:S0926860X2500119X/ga1/THUMBNAIL/image/gif/1813555f40682077d626e00b52b87092/ga1.sml ga1 true ga1.sml sml 7642 97 219 IMAGE-THUMBNAIL 1-s2.0-S0926860X2500119X-gr8_lrg.jpg https://s3-eu-west-1.amazonaws.com/prod-ucs-content-store-eu-west/content/pii:S0926860X2500119X/HIGHRES/image/jpeg/0ce85af3e223b20aa7086472f401e3b4/gr8_lrg.jpg gr8 gr8_lrg.jpg jpg 280219 1218 2994 IMAGE-HIGH-RES 1-s2.0-S0926860X2500119X-gr7_lrg.jpg https://s3-eu-west-1.amazonaws.com/prod-ucs-content-store-eu-west/content/pii:S0926860X2500119X/HIGHRES/image/jpeg/b806dd304202e4f60220fe804bc23d4a/gr7_lrg.jpg gr7 gr7_lrg.jpg jpg 369579 1097 2994 IMAGE-HIGH-RES 1-s2.0-S0926860X2500119X-fx15_lrg.jpg https://s3-eu-west-1.amazonaws.com/prod-ucs-content-store-eu-west/content/pii:S0926860X2500119X/HIGHRES/image/jpeg/a3963e0826ba7435687c414fe48c2c1b/fx15_lrg.jpg fx15 fx15_lrg.jpg jpg 33492 204 1945 IMAGE-HIGH-RES 1-s2.0-S0926860X2500119X-gr6_lrg.jpg https://s3-eu-west-1.amazonaws.com/prod-ucs-content-store-eu-west/content/pii:S0926860X2500119X/HIGHRES/image/jpeg/d0d254c3c39dee5fd5180d195fdaf2a0/gr6_lrg.jpg gr6 gr6_lrg.jpg jpg 297323 1209 2994 IMAGE-HIGH-RES 1-s2.0-S0926860X2500119X-fx16_lrg.jpg https://s3-eu-west-1.amazonaws.com/prod-ucs-content-store-eu-west/content/pii:S0926860X2500119X/HIGHRES/image/jpeg/9c85469e5a08fc22e9cd94980806c1f5/fx16_lrg.jpg fx16 fx16_lrg.jpg jpg 41841 219 2349 IMAGE-HIGH-RES 1-s2.0-S0926860X2500119X-gr5_lrg.jpg https://s3-eu-west-1.amazonaws.com/prod-ucs-content-store-eu-west/content/pii:S0926860X2500119X/HIGHRES/image/jpeg/89cbd714adb44871e4aa91f99cad7713/gr5_lrg.jpg gr5 gr5_lrg.jpg jpg 250686 1182 2994 IMAGE-HIGH-RES 1-s2.0-S0926860X2500119X-fx7_lrg.jpg https://s3-eu-west-1.amazonaws.com/prod-ucs-content-store-eu-west/content/pii:S0926860X2500119X/HIGHRES/image/jpeg/7cbed9cea2ad166ee900a4877eb4a4fe/fx7_lrg.jpg fx7 fx7_lrg.jpg jpg 22396 207 1491 IMAGE-HIGH-RES 1-s2.0-S0926860X2500119X-fx6_lrg.jpg https://s3-eu-west-1.amazonaws.com/prod-ucs-content-store-eu-west/content/pii:S0926860X2500119X/HIGHRES/image/jpeg/6b034d8d157caf47be409ecf75377184/fx6_lrg.jpg fx6 fx6_lrg.jpg jpg 22843 213 1453 IMAGE-HIGH-RES 1-s2.0-S0926860X2500119X-fx10_lrg.jpg https://s3-eu-west-1.amazonaws.com/prod-ucs-content-store-eu-west/content/pii:S0926860X2500119X/HIGHRES/image/jpeg/210d5c1dcc435d4a79a435ef5d3695e5/fx10_lrg.jpg fx10 fx10_lrg.jpg jpg 41032 222 2408 IMAGE-HIGH-RES 1-s2.0-S0926860X2500119X-fx5_lrg.jpg https://s3-eu-west-1.amazonaws.com/prod-ucs-content-store-eu-west/content/pii:S0926860X2500119X/HIGHRES/image/jpeg/d9a6a58e60aed100154aa0343f0e9a60/fx5_lrg.jpg fx5 fx5_lrg.jpg jpg 33977 210 2303 IMAGE-HIGH-RES 1-s2.0-S0926860X2500119X-fx4_lrg.jpg https://s3-eu-west-1.amazonaws.com/prod-ucs-content-store-eu-west/content/pii:S0926860X2500119X/HIGHRES/image/jpeg/9db8281ed2a9fd7de465db929cb99ded/fx4_lrg.jpg fx4 fx4_lrg.jpg jpg 26779 219 1734 IMAGE-HIGH-RES 1-s2.0-S0926860X2500119X-fx13_lrg.jpg https://s3-eu-west-1.amazonaws.com/prod-ucs-content-store-eu-west/content/pii:S0926860X2500119X/HIGHRES/image/jpeg/f9ec7151cc3c0d9cd78a6308f568fcbe/fx13_lrg.jpg fx13 fx13_lrg.jpg jpg 24743 210 1618 IMAGE-HIGH-RES 1-s2.0-S0926860X2500119X-gr4_lrg.jpg https://s3-eu-west-1.amazonaws.com/prod-ucs-content-store-eu-west/content/pii:S0926860X2500119X/HIGHRES/image/jpeg/6564bbf5aa8e903e2cc2a036cbe66e15/gr4_lrg.jpg gr4 gr4_lrg.jpg jpg 559910 2576 2495 IMAGE-HIGH-RES 1-s2.0-S0926860X2500119X-fx14_lrg.jpg https://s3-eu-west-1.amazonaws.com/prod-ucs-content-store-eu-west/content/pii:S0926860X2500119X/HIGHRES/image/jpeg/abe87b04b8762ec6c6372a5c69d93251/fx14_lrg.jpg fx14 fx14_lrg.jpg jpg 30541 210 2076 IMAGE-HIGH-RES 1-s2.0-S0926860X2500119X-gr3_lrg.jpg https://s3-eu-west-1.amazonaws.com/prod-ucs-content-store-eu-west/content/pii:S0926860X2500119X/HIGHRES/image/jpeg/b04084cea8f3412f0f6d28e61b017684/gr3_lrg.jpg gr3 gr3_lrg.jpg jpg 843707 3175 2994 IMAGE-HIGH-RES 1-s2.0-S0926860X2500119X-fx9_lrg.jpg https://s3-eu-west-1.amazonaws.com/prod-ucs-content-store-eu-west/content/pii:S0926860X2500119X/HIGHRES/image/jpeg/2e54fafc5b41eaacbae53a599f0a3674/fx9_lrg.jpg fx9 fx9_lrg.jpg jpg 25700 213 1629 IMAGE-HIGH-RES 1-s2.0-S0926860X2500119X-fx11_lrg.jpg https://s3-eu-west-1.amazonaws.com/prod-ucs-content-store-eu-west/content/pii:S0926860X2500119X/HIGHRES/image/jpeg/680bb8ad7173b55a7c5b8be8b236d973/fx11_lrg.jpg fx11 fx11_lrg.jpg jpg 22523 212 1417 IMAGE-HIGH-RES 1-s2.0-S0926860X2500119X-gr2_lrg.jpg https://s3-eu-west-1.amazonaws.com/prod-ucs-content-store-eu-west/content/pii:S0926860X2500119X/HIGHRES/image/jpeg/00b552e98a0de477a578e119beb080ea/gr2_lrg.jpg gr2 gr2_lrg.jpg jpg 237854 1184 2995 IMAGE-HIGH-RES 1-s2.0-S0926860X2500119X-fx8_lrg.jpg https://s3-eu-west-1.amazonaws.com/prod-ucs-content-store-eu-west/content/pii:S0926860X2500119X/HIGHRES/image/jpeg/5477f6546814d148681995ce7cc7e815/fx8_lrg.jpg fx8 fx8_lrg.jpg jpg 43218 222 2450 IMAGE-HIGH-RES 1-s2.0-S0926860X2500119X-fx12_lrg.jpg https://s3-eu-west-1.amazonaws.com/prod-ucs-content-store-eu-west/content/pii:S0926860X2500119X/HIGHRES/image/jpeg/de09f0ecba91e4a46202831181566084/fx12_lrg.jpg fx12 fx12_lrg.jpg jpg 35198 210 2222 IMAGE-HIGH-RES 1-s2.0-S0926860X2500119X-gr1_lrg.jpg https://s3-eu-west-1.amazonaws.com/prod-ucs-content-store-eu-west/content/pii:S0926860X2500119X/HIGHRES/image/jpeg/fe57af2b3a8a1a46a6d0ae5a7ccd1754/gr1_lrg.jpg gr1 gr1_lrg.jpg jpg 313484 1101 2994 IMAGE-HIGH-RES 1-s2.0-S0926860X2500119X-fx3_lrg.jpg https://s3-eu-west-1.amazonaws.com/prod-ucs-content-store-eu-west/content/pii:S0926860X2500119X/HIGHRES/image/jpeg/ed0b08de645cdf953c5d6231eaace796/fx3_lrg.jpg fx3 fx3_lrg.jpg jpg 43452 222 2540 IMAGE-HIGH-RES 1-s2.0-S0926860X2500119X-sc1_lrg.jpg https://s3-eu-west-1.amazonaws.com/prod-ucs-content-store-eu-west/content/pii:S0926860X2500119X/HIGHRES/image/jpeg/a8a5c56f45cab12df8690e80f0efe6a9/sc1_lrg.jpg sc1 sc1_lrg.jpg jpg 106694 1138 2498 IMAGE-HIGH-RES 1-s2.0-S0926860X2500119X-fx2_lrg.jpg https://s3-eu-west-1.amazonaws.com/prod-ucs-content-store-eu-west/content/pii:S0926860X2500119X/HIGHRES/image/jpeg/775f7117191713acb221013057042b3c/fx2_lrg.jpg fx2 fx2_lrg.jpg jpg 24197 210 1595 IMAGE-HIGH-RES 1-s2.0-S0926860X2500119X-fx1_lrg.jpg https://s3-eu-west-1.amazonaws.com/prod-ucs-content-store-eu-west/content/pii:S0926860X2500119X/HIGHRES/image/jpeg/1edb093b63edd485446078da3d09977c/fx1_lrg.jpg fx1 fx1_lrg.jpg jpg 34487 219 2191 IMAGE-HIGH-RES 1-s2.0-S0926860X2500119X-ga1_lrg.jpg https://s3-eu-west-1.amazonaws.com/prod-ucs-content-store-eu-west/content/pii:S0926860X25001243/HIGHRES/image/jpeg/852cd6d480970173d2e4b51064ebe19c/ga1_lrg.jpg ga1 true ga1_lrg.jpg jpg 185629 886 1991 IMAGE-HIGH-RES 1-s2.0-S0926860X2500119X-mmc1.docx https://s3-eu-west-1.amazonaws.com/prod-ucs-content-store-eu-west/content/pii:S0926860X2500119X/mmc1/MAIN/application/vnd.openxmlformats-officedocument.wordprocessingml.document/9b7cb507fb47e3a73bbd1f56692854b7/mmc1.docx mmc1 mmc1.docx docx 271146 APPLICATION 1-s2.0-S0926860X2500119X-si0001.svg https://s3-eu-west-1.amazonaws.com/prod-ucs-content-store-eu-west/content/pii:S0926860X2500119X/image/svg+xml/21090fdc62d228bdfa9b2a39c3e90dc4/si0001.svg si0001 si0001.svg svg 1588 ALTIMG 1-s2.0-S0926860X2500119X-si0002.svg https://s3-eu-west-1.amazonaws.com/prod-ucs-content-store-eu-west/content/pii:S0926860X2500119X/image/svg+xml/73cfd63568eba4cba42944cbba4dc580/si0002.svg si0002 si0002.svg svg 1559 ALTIMG 1-s2.0-S0926860X2500119X-si0003.svg https://s3-eu-west-1.amazonaws.com/prod-ucs-content-store-eu-west/content/pii:S0926860X2500119X/image/svg+xml/283dc41ab3b690b94608917fef66477a/si0003.svg si0003 si0003.svg svg 1965 ALTIMG 1-s2.0-S0926860X2500119X-si0004.svg https://s3-eu-west-1.amazonaws.com/prod-ucs-content-store-eu-west/content/pii:S0926860X2500119X/image/svg+xml/b85a750b38ab522c209956ff7dfc95b1/si0004.svg si0004 si0004.svg svg 2325 ALTIMG 1-s2.0-S0926860X2500119X-si0005.svg https://s3-eu-west-1.amazonaws.com/prod-ucs-content-store-eu-west/content/pii:S0926860X2500119X/image/svg+xml/2b0c7ba9c0a87931a0958044a3f816c1/si0005.svg si0005 si0005.svg svg 2208 ALTIMG 1-s2.0-S0926860X2500119X-si0006.svg https://s3-eu-west-1.amazonaws.com/prod-ucs-content-store-eu-west/content/pii:S0926860X2500119X/image/svg+xml/6db819b87616e5b1df9079b508d4e6aa/si0006.svg si0006 si0006.svg svg 2321 ALTIMG APCATA 120218 120218 S0926-860X(25)00119-X 10.1016/j.apcata.2025.120218 Elsevier B.V. Fig. 1 XRD patterns of (A) LMO and LMO-NA-230, (B) LMO-NA-230–500-B characterized by varied thermal treatment duration. Fig. 1 Fig. 2 (A) N2 adsorption-desorption isotherms and (B) pore-size distributions of LMO, LMO-NA-230 and LMO-NA-230–500–24. Fig. 2 Fig. 3 SEM images of catalyst LMO (A), LMO-NA-230 (C) and LMO-NA-230–500–24 (E), and TEM images of catalyst LMO (B), LMO-NA-230 (D) and LMO-NA-230–500–24 (F). Fig. 3 Fig. 4 HRTEM (A, B) images and SAED (C) pattern of LMO-NA-230–500–24 and EDS mapping images of the elements La, Mn, O in LMO-NA-230–500–24 (D). Fig. 4 Fig. 5 H2-TPR (A) and O2-TPD (B) profiles of LMO, LMO-NA-230 and LMO-NA-230–500–24. Fig. 5 Fig. 6 La 2p (A) and O1s (B) XPS spectra of LMO, LMO-NA-230–500–24 and the spent catalyst LMO-NA-230–500–24-R6 retrieved from the 6th evaluation. Fig. 6 Fig. 7 XRD patterns of the spent LMO-NA-230 catalysts with post-treatment at varied temperatures (A) and duration (B). Fig. 7 Fig. 8 Catalytic stability of LMO-230-500-24 (A), XRD spectra of LMO-NA-230-500-24 and LMO-NA-230-500-24-R6 (B). Fig. 8 Scheme 1 A possible reaction network for the preparation of benzoic acid by solvent-free oxidation of toluene over the LMO-NA-230–500–24 catalyst. Scheme 1 Table 1 Grain size, elemental composition and textural properties of the catalysts LMO, LMO-NA-230 and LMO-NA-230–500-24. Table 1 Catalyst Grain size a (nm) La/Mn b (Atomic) SBET c (m2/g) Pore volume d (cm3/g) Average pore diameter d (nm) LMO 40.5 0.98 13.3 0.04 16.1 (12.0) LMO-NA−230 20.4 0.35 140 0.41 12.5 (11.7) LMO-NA−230–500–24 24.2 0.32 62.1 0.42 30.9 (27.1) a Calculated by Scherrer equation, b Determined by ICP-OES, c Determined by the BET method, d Pore volume and average pore diameter determined by desorption branch of their adsorption isotherms according to the BJH method. The values in the brackets is calculated according to the equation: D(BJH)= 4 V / S BET , where V is the average pore volume and SBET is the specific surface area. LMO: LaMnO3; LMO-NA-230: LaMnO3 was etched in HNO3 (0.5 mol/L) for 230 min; LMO-NA-230–500–24: LaMnO3 was etched in HNO3 (0.5 mol/L) for 230 min followed by a calcination at 500 ℃ in static air for 24 h. Table 2 H2 consumption of the catalysts LMO, LMO-NA-230 and LMO-NA-230–500-24 by integration of their H2-TPR profiles. Table 2 Catalyst a Peak area (A•℃×10−12) b First peak Second peak Third peak LMO - 6.81 (343) 36.7 (706) LMO-NA−230 54.4 (190) 35.5 (315) 21.4 (696) LMO-NA−230–500–24 40.9 (250) 16.9 (343) 15.1 (700) a LMO: LaMnO3, LMO-NA-230: LaMnO3 was etched at 0.5 M HNO3 for 230 min, LMO-NA-230–500–24: LaMnO3 was etched at 0.5 M HNO3 for 230 min and calcined at 500 ℃ for 24 h. b The values in the brackets are the reduction temperature (℃). Table 3 O2 desorption peak area of LMO, LMO-NA-230 and LMO-NA-230–500-24. Data obtained from the O2-TPD. Table 3 Catalyst a Peak area (A•℃×10−12) 50 −350 °C 350 −550 °C 550 −900 °C LMO 10.9 14.2 22.7 LMO-NA−230 12.8 37.7 42.9 LMO-NA−230–500–24 11.9 34.9 39.7 a LMO: LaMnO3, LMO-NA-230: LaMnO3 was etched at 0.5 M HNO3 for 230 min, LMO-NA-230–500–24: LaMnO3 was etched at 0.5 M HNO3 for 230 min and calcined at 500 ℃ for 24 h. Table 4 The electron states on the catalyst surface of LMO and the spent LMO-NA-230–500-24 catalyst retrieved from the sixth catalytic test compared with its fresh counterpart. Table 4 Catalyst Mn4+/(Mn3++Mn4+) (%) Oads/(Olat+Oads) (%) LMO 5.09 17.2 LMO-NA−230–500–24 12.5 39.4 LMO-NA−230–500–24-R6 7.18 32.2 LMO: LaMnO3, LMO-NA-230–500–24: LaMnO3 was etched at 0.5 M HNO3 for 230 min and calcined at 500 ℃ for 24 h. Table 5 Catalytic performance of LMO-NA-X catalysts for solvent-free aerobic oxidation of toluene. Table 5 Entry Catalyst Conversion of toluene (%) Selectivity (%) BAL BOL BAC BB Others 1 None 4.09 33.4 11.9 44.1 1.18 9.42 2 LMO 15.1 14.8 0.94 80.4 2.57 1.29 3 LMO-NA−200 18.9 14.6 1.28 80.2 3.67 0.25 4 LMO-NA−210 21.2 13.9 1.27 81.4 3.06 0.37 5 LMO-NA−230 29.6 7.71 0.42 89.3 2.15 0.42 6 LMO-NA−250 15.2 15.1 0.98 79.6 3.84 0.48 7 LMO-NA−280 10.6 19.4 1.32 74.8 2.69 1.79 Reaction conditions: Toluene (94 mmol), Nitrobenzene (9.4 mmol), catalysts (0.2 g), O2 (3 MPa), 1000 r/min, 170 ℃, 24 h. BAL: Benzaldehyde, BOL: Benzyl alcohol, BAC: Benzoic acid, BB: Benzyl benzoate, Others: May contain 2-phenyltoluene, methyl benzoate and benzyl acetate. Table 6 Effect of heat treatment temperature on catalytic performance of LMO-NA-230 catalyst. Table 6 Entry Catalyst Conv. of toluene (%) Selectivity (%) BAL BOL BAC BB Others 1 LMO-NA−230–400–24 18.3 15.6 0.58 80.5 2.11 1.21 2 LMO-NA−230–500–24 24.8 10.2 1.37 82.7 5.14 0.59 3 LMO-NA−230–600–24 19.8 10.7 1.19 82.9 4.48 0.73 4 LMO-NA−230–700–24 19.9 11.5 1.10 81.8 4.766 0.84 Reaction conditions: Toluene (94 mmol), Nitrobenzene (9.4 mmol), catalysts (0.2 g), O2 (3 MPa), 1000 r/min, 170 ℃, 24 h. BAL: Benzaldehyde, BOL: Benzyl alcohol, BAC: Benzoic acid, BB: Benzyl benzoate, Others: May contain 2-phenyltoluene, methyl benzoate and benzyl acetate. Table 7 Influence of heat treatment time on catalytic performance of LMO-NA-230 catalyst. Table 7 Entry Catalyst Conv. of toluene (%) Sel. (%) BAL BOL BAC BB Others 1 LMO-NA−230-500-1 27.4 8.37 0.59 87.8 2.67 0.57 2 LMO-NA−230-500-3 26.1 13.7 1.69 80.1 3.95 0.56 3 LMO-NA−230-500-6 25.6 7.71 0.26 89.5 2.11 0.42 4 LMO-NA−230-500-12 25.1 10.6 0.98 83.8 4.05 0.57 5 LMO-NA−230-500-24 24.8 10.2 1.37 82.7 5.14 0.59 6 LMO-NA−230-500-48 20.6 10.1 1.45 83.2 4.52 0.73 Reaction conditions: Toluene (94 mmol), Nitrobenzene (9.4 mmol), catalysts (0.2 g), O2 (3 MPa), 1000 r/min, 170 ℃, 24 h. BAL: Benzaldehyde, BOL: Benzyl alcohol, BAC: Benzoic acid, BB: Benzyl benzoate, Others: May contain 2-phenyltoluene, methyl benzoate and benzyl acetate. Table 8 Effect of reaction temperature on catalytic performance of LMO-NA-230–500-24 catalyst. Table 8 Entry Temperature(℃) Conversion of toluene (%) Selectivity (%) BAL BOL BAC BB Others 1 150 10.7 13.8 2.65 80.5 2.39 0.66 2 160 18.8 13.2 1.91 83.2 1.48 0.21 3 170 24.8 10.2 1.37 82.7 5.14 0.59 4 180 25.7 8.93 1.06 83.3 4.94 1.27 Reaction conditions: Toluene (94 mmol), Nitrobenzene (9.4 mmol), catalysts (0.2 g), O2 (3 MPa), 1000 r/min, 24 h. BAL: Benzaldehyde, BOL: Benzyl alcohol, BAC: Benzoic acid, BB: Benzyl benzoate, Others: May contain 2-phenyltoluene, methyl benzoate and benzyl acetate. Table 9 Effect of oxygen pressure on catalytic performance of LMO-NA-230–500-24 catalyst. Table 9 Entry Pressure(MPa) Conv. of toluene (%) Sel. (%) BAL BOL BAC BB Others 1 1 12.8 16.8 2.41 75.6 5.11 0.08 2 2 19.4 11.3 1.83 81.1 5.19 0.58 3 2.5 22.9 10.7 1.56 82.2 5.13 0.41 4 3 24.8 10.2 1.37 82.7 5.14 0.59 Reaction conditions: Toluene (94 mmol), Nitrobenzene (9.4 mmol), catalysts (0.2 g), O2, 1000 r/min, 170 ℃, 24 h. BAL: Benzaldehyde, BOL: Benzyl alcohol, BAC: Benzoic acid, BB: Benzyl benzoate, Others: May contain 2-phenyltoluene, methyl benzoate and benzyl acetate. Table 10 Effect of reaction time on catalytic performance of LMO-NA-230-500-24 catalyst. Table 10 Entry Time (h) Conv. of toluene (%) Sel. (%) BAL BOL BAC BB Others 1 1 1.51 53.9 2.03 38.8 2.38 2.89 2 3 2.74 42.5 9.62 45.7 1.16 1.02 3 6 4.61 22.3 5.62 70.2 1.37 0.51 4 12 7.04 21.7 3.69 72.3 2.18 0.13 5 18 14.3 13.2 1.90 83.2 1.48 0.22 6 24 24.8 10.2 1.37 82.7 5.14 0.59 7 30 25.6 7.72 1.50 85.1 5.45 0.23 8 48 28.1 7.91 2.16 83.8 5.49 0.64 Reaction conditions: Toluene (94 mmol), Nitrobenzene (9.4 mmol), catalysts (0.2 g), O2 (3 MPa), 1000 r/min, 170 ℃. BAL: Benzaldehyde, BOL: Benzyl alcohol, BAC: Benzoic acid, BB: Benzyl benzoate, Others: May contain 2-phenyltoluene, methyl benzoate and benzyl acetate. Table 11 Effect of stirring speed on catalytic performance of LMO-NA-230–500-24 catalyst. Table 11 Entry Rotational Speed (r/min) Conv. of toluene (%) Sel. (%) BAL BOL BAC BB Others 1 200 11.5 15.9 2.03 76.8 2.38 2.89 2 400 13.6 14.3 1.78 79.3 2.75 1.87 3 600 17.8 13.6 0.91 81.3 3.36 0.83 4 800 22.7 12.5 1.62 81.2 4.16 1.02 5 1000 24.8 10.2 1.37 82.7 5.14 0.59 6 1200 25.1 11.7 1.69 82.3 2.18 2.13 Reaction conditions: Toluene (94 mmol), Nitrobenzene (9.4 mmol), catalysts (0.2 g), O2 (3 MPa), 170 ℃, 24 h. BAL: Benzaldehyde, BOL: Benzyl alcohol, BAC: Benzoic acid, BB: Benzyl benzoate, Others: May contain 2-phenyltoluene, methyl benzoate and benzyl acetate. Table 12 Effect of catalyst amounts on catalytic performance of toluene. Table 12 Entry Catalyst mass (g) Conv. of toluene (%) Sel. (%) BAL BOL BAC BB Others 1 0.10 9.78 18.5 1.57 77.4 2.24 0.29 2 0.15 15.1 15.1 1.03 80.8 2.54 0.53 3 0.20 24.8 10.2 1.37 82.7 5.14 0.59 4 0.25 25.9 9.55 1.54 84.4 3.94 0.57 Reaction conditions: Toluene (94 mmol), Nitrobenzene (9.4 mmol), catalysts, O2 (3 MPa), 1000 r/min, 170 ℃, 24 h. BAL: Benzaldehyde, BOL: Benzyl alcohol, BAC: Benzoic acid, BB: Benzyl benzoate, Others: May contain 2-phenyltoluene, methyl benzoate and benzyl acetate. Table 13 The reactivity of LMO-NA-230-500-24 on catalytic products and the effect of free radical quencher Tempo on the reaction. Table 13 Entry Starting material Catalyst Conv. of toluene (%) Sel. (%) BAL BOL BAC BB Others 1 a BAL LMO-NA−230-500-24 97.4 - 5.83 74.3 5.57 14.3 2 a BOL LMO-NA−230-500-24 64.1 66.3 - 10.5 2.10 21.1 3 a BAC LMO-NA−230-500-24 8.54 0.59 0.83 - 0.78 97.8 4 a BB LMO-NA−230-500-24 3.69 11.3 22.8 46.1 - 19.8 5 b Toluene None 4.09 33.4 11.9 44.1 1.18 9.42 6 b Toluene LMO-NA−230-500-24 24.8 10.2 1.37 82.7 5.14 0.59 7 c Toluene LMO-NA−230-500-24 6.15 20.1 1.78 38.2 0.72 39.2 a Reaction conditions: Substrate (1 mL), Acetonitrile (9 mL), Nitrobenzene (9.4 mmol), catalysts (0.02 g), O2 (3 MPa), 1000 r/min, 170 ℃, 24 h. b Reaction conditions: Toluene (94 mmol), Nitrobenzene (9.4 mmol), catalysts (0.2 g), O2 (3 MPa), 1000 r/min, 170 ℃, 24 h. c Reaction conditions: Toluene (9.4 mmol), Nitrobenzene (9.4 mmol), Tempo (9.4 mmol), catalysts (0.2 g), O2 (3 MPa), 1000 r/min, 170 ℃, 24 h. c Reaction conditions: Substrate (1 mL), Acetonitrile (9 mL), Nitrobenzene (9.4 mmol), catalysts (0.02 g), O2 (3 MPa), 1000 r/min, 170 ℃, 24 h. BAL: Benzaldehyde, BOL: Benzyl alcohol, BAC: Benzoic acid, BB: Benzyl benzoate, Others: May contain 2-phenyltoluene, methyl benzoate and benzyl acetate. Fabricating highly dispersed and stable LaMnO3 perovskite oxide catalysts for selective aerobic oxidation of toluene to benzoic acid under solvent-free conditions Jiahe Shan Writing – original draft Investigation Xuemei Jing Investigation Chuchu Zhang Investigation Enxian Yuan Funding acquisition Guojun Shi Writing – review & editing Funding acquisition Conceptualization ⁎ School of Chemistry and Chemical Engineering, Yangzhou University, Yangzhou, Jiangsu Province 225002, People's Republic of China School of Chemistry and Chemical Engineering, Yangzhou University Yangzhou Jiangsu Province 225002 People's Republic of China School of Chemistry and Chemical Engineering, Yangzhou University, Yangzhou 225002, Jiangsu Province, PR China ⁎ Corresponding author. Chlorination-hydrolysis of toluene or homogeneous Co/Mn/Br catalyzed liquid phase oxidation of toluene to produce benzoic acid suffers from product halogen-contamination, severe equipment corrosion, and costly wastewater treatment industrially. Direct selective oxidation of toluene to benzoic acid under non-homogeneous catalyst, molecular oxygen, and solvent-free conditions will make this transformation more efficient and environmentally friendly. In this work, LaMnO3 perovskite oxide catalysts were fabricated by sol-gel method followed by etching and heat treatment, and tested via selective aerobic oxidation of toluene to benzoic acid under solvent-free conditions. The etched LaMnO3 perovskite oxide catalyst possesses a good mesoporous structure, significantly increased specific surface area and pore volume, halved grain size, reduced reduction temperature, and increased density of Mn4 + ions and oxygen vacancies on the catalyst surface. Further heat treatment significantly improved the catalyst stability while sacrificing some textural properties. The LaMnO3 perovskite oxide catalyst fabricated under the best conditions achieved a toluene conversion of 24.8 % and a benzoic acid selectivity of 82.7 %, with stable structural properties and catalytic performance after multiple cycles of use. This study can provide beneficial exploration and thinking for the design of perovskite oxide catalysts and their application in selective toluene oxidation. Graphical Abstract Keywords Toluene Solvent-free oxidation Perovskite oxide catalyst Etching Data availability Data will be made available on request. 1 Introduction Benzoic acid is an important chemical intermediate, which can be used for the production of amides, esters, alcohols, etc [1]. Benzoic acid and its derivates are commonly used as food preservatives, and also as defoamers in crude oil extraction. Benzoic acid can also be applied in the synthesis of alkyd resins, polyesters, plasticizers, dyes, rubber activators, etc [2]. Currently, the industrial production of benzoic acid mainly adopts the chlorination-hydrolysis process of toluene. This process suffers from severe equipment corrosion, large amounts of wastewater containing chlorine, and chlorine-contamination in the product [3]. Liquid-phase air oxidation of toluene to produce benzoic acid utilizes acetic acid as a solvent and homogeneous Co/Mn/Br as catalyst, which also suffers from severe equipment corrosion, bromine contamination in the product, and complicated separation of homogeneous catalysts [4,5]. In view of this, the industry and academia have been continuously working on developing a green and efficient method for the liquid-phase oxidation of toluene to benzoic acid. Photocatalytic oxidation of toluene to value-added oxygen-containing compounds presents a high selectivity to the desired products under relatively milder conditions, and an enhanced activity and/or yield is being pursued [6,7]. The transformation from toluene to benzoic acid was probed via thermo-catalysis in the liquid phase using H2O2 as the oxidant, showing advantages such as low reaction temperature, easy catalyst recovery, and high selectivity for benzoic acid [8]. Hunaiti et al. [9] proposed a method for synthesizing CuFe2O4 magnetic nanoparticles using pomegranate leaf extracts, and realized a conversion of from toluene to benzoic acid up to 67 % using H₂O₂ as a oxidant at 60 ºC for 20 h under solvent-free conditions. V-Mo-Fe-O [10], Ag/ZrO [11], Cu-Cr/g-C3N4 [12], Fe(III)-PVPDVB [13] catalysts also have shown high activity and selectivity for the selective oxidation of toluene to benzoic acid [14–18]. Mohammadpour et al. [19] loaded VO2+on Fe3O4@SiO2, and the resulting catalyst possessed a toluene conversion of over 99 % using tert-butyl hydroperoxide as the oxidant at room temperature in H2O. In addition, vanadium-substituted mesoporous aluminum phosphate [20], Co-MOF-74@Mn-MOF-74 [21], CoOx/SiO2 [22], Au-Pd/Cr2O3 [23] all showed good results for the selective oxidation of toluene to benzaldehyde/benzoic acid with O2 or tert-butyl hydroperoxide (TBHP) as the oxidant. Most of the above methods were carried out in organic solvents, mainly using H2O2 or TBHP as the oxidant. Compared with solvent-free oxidation via molecular oxygen, these methods have a relatively low space-time yields and/or higher oxidant costs. Transition metal oxides are widely studied due to a low cost, strong resistance to poisoning, and high catalytic activity. Manganese, as a multi-valent active metal element, is often used as a component of heterogeneous catalysts for the oxidation of organic compounds via molecular oxygen, and its oxides are also commonly used for the low-temperature oxidation of hydrocarbons. In the study by Li et al. [24], molecular oxygen was used as the oxidant to catalytically oxidize toluene using Mn3O4 in a solvent-free and additive-free system, the reaction was carried out at a pressure of 1.0 MPa and a temperature of 195 °C for 3 h, achieving a toluene conversion of 39 % and a selectivity to benzaldehyde of 93 %. Building on this, they prepared copper-manganese oxides through the co-precipitation method. The catalyst with a copper/manganese ratio of 1:1 exhibited a high activity in the selective oxidation of toluene to benzaldehyde [25]. Jin et al. [26] synthesized octahedral MnO2 molecular sieves and found that the catalyst achieved a toluene conversion of 47.8 % and a selectivity to benzoic acid of 57 % at 110 °C under atmospheric reflux conditions for 20 h. Perovskite oxide catalysts as a potential alternative to precious metals have been extensively studied for their low cost, high chemical/thermal/structural stability, high oxidation activity, etc. Studies have been conducted on their application in CO oxidation [27], NOx reduction [28], oxidation of VOCs [29], sewage disposal [30], etc. Mistri et al. [31] synthesized copper-loaded LaMO3 (M=Mn, Fe, and Co) perovskites via a single-step solution combustion method, the conversion of and benzyl alcohol and the selectivity of benzaldehyde reached 98.7 % and 100 %, respectively, using TBHP as the oxidant at 80 °C under atmospheric pressure for 3 h. Perovskite oxides (ABO3) can be enhanced in terms of specific surface area and catalytic performance through acid etching [32]. During the etching process, the A-site cations is selectively removed from the perovskite structure, leading to the generation of more defects in the oxide, a higher specific surface area, abundant active oxygen, and oxygen vacancies. Meanwhile, the loss of A-site cations in the perovskite structure increases the valence state of the B-site cations. Chen et al. [33] successfully synthesized M nO x / LaMnO 3 catalysts for methane combustion via a selective etching method. They found that the modified LaMnO3 catalysts had a large specific surface area, a high Mn4+/(Mn4++Mn3+) molar ratio, and good low-temperature reducibility. Zhao et al. [34] synthesized a high specific surface area La 0.8 Ce 0.2 MnO 3 +δ catalyst using a sol-gel method, and then selectively removed part of the La3+ ions from the lattice via acid etching. The etched catalyst exhibited excellent performance in the oxidation of CO and C3H8, with conversion of 90 % for CO and C3H8 at temperatures of 73 ℃ and 196 ℃, respectively. The stability of perovskite oxide has always been a focus of attention. Pathreeker et al. [35] found that in the oxidation process of CaMnO3, changes in crystal structure may occur due to the migration of calcium ions and the rearrangement of oxygen atoms, leading to the coexistence of various phases such as CaxMnO3 and MnO2. Li et al. [36] found that the thermal deactivation of MnOx is mainly caused by structural changes of MnOx, and the structural stability can be enhanced through thermal treatment at an elevated temperature. Yuasa et al. [37] found that the stability of carbon-supported perovskite oxide can be improved by partially substituting the cations at A- or B-site. For example, the enhanced stability of the catalyst was achieved by partially substitution of B-site of LaMnO3 for iron ions. In addition, the partial substitution of calcium elements at the A-site of LaMn0.6Fe0.4O3 improved the average valence state at the B-site, thereby enhancing the stability and oxygen reduction activity of carbon-supported perovskite oxide [38]. In this work, the performance of perovskite oxide is investigated via oxidation of toluene under solvent-free conditions by tuning crystal structure and surface properties. The catalytic activity, selectivity, and stability of the catalyst are enhanced through etching and thermal treatment, providing new insights for designing high-performance catalysts and developing a green and efficient solvent-free toluene oxidation route. Perovskite-type oxide LaMnO3 was prepared by sol-gel method and its textural properties were improved by etching to promote the exposure of active sites and the generation of more oxygen vacancies. The etched samples were subjected to heat treatment to enhance their stability under reaction conditions. This work systematically explores the influence of etching and heat treatment conditions on the catalytic activity and stability of LaMnO3, as well as the structure-activity relationship. The mechanism of toluene oxidation to benzaldehyde in this catalytic system was also proposed. 2 Experimental section 2.1 Synthesis of catalysts Synthesis of LaMnO3. Using the sol-gel method to synthesize LaMnO3 catalyst. Firstly, La(NO3)2•6H2O (0.015 mol) and Mn(NO3)2•4H2O (0.015 mol) were dissolved in deionized water (100 mL) to obtain a mixed solution. Then, citric acid with a molar ratio of 1:1 to the metal ions was added as a chelating agent, and stirred until complete dissolution. The mixed solution was stirred in an oil bath at 80 ℃ for more than 5 h until the solution gradually became viscous, eventually forming a stable viscous gel. The obtained gel was dried in an oven at 100 ℃ in static air for 12 h to remove excess water. The dried gel was ground into powder, calcined in a muffle furnace at 400 ℃ in static air, further heated to 750 ℃, and then naturally cooled to room temperature to obtain the LaMnO3 sample, referred to as LMO. Etching of catalyst. A certain amount of LaMnO3 powder was added to the HNO3 solution (0.5 mol/L). Let it stand at room temperature for 200 min, 210 min, 230 min, 250 min, and 280 min, respectively. The suspends were filtrated and washed by deionized water repeatedly until the filtrate is neutral. The resulting powder were dried in static air at 120 ℃ overnight, and is designated as LMO-NA-X, where X is the etching duration (minutes). Thermal treatment of catalysts. The acid-treated catalyst was calcined in a muffle furnace to investigate the effects of different temperatures (300 ℃, 400 ℃, 500 ℃, 600 ℃, 700 ℃) and durations (1 h, 3 h, 6 h, 12 h, 24 h, 48 h). The samples after thermal treatment were denoted as LMO-NA-X-A-B, where A and B represent the treatment temperature (℃) and duration (h), respectively. 2.2 Characterization of catalysts The resulting catalysts and their precursor were detailedly characterized to discover their textural, structural, thermal, and reducible properties, etc., and the information is included in supplementary material. 2.3 Evaluation of catalyst activity Performance of catalysts was evaluated by selective oxidation of toluene to benzoic acid under solvent-free conditions. Toluene (94 mmol) and catalyst (0.2 g) were added to a 50 mL high-pressure reactor, which was then sealed. Prior to the reaction, 3 MPa of O2 (99.999 %) was introduced into the reactor to check the air tightness. After confirming good sealing, the reactors were purged 5 times with O2 at 3 MPa to remove any residual air. Catalytic tests were carried out at 170 ℃, 3 MPa O2, and vigorous magnetic stirring (1000 rpm) for 24 h. After the reaction, nitrobenzene (9.4 mmol) was added as an internal standard. The catalyst and reaction solution were separated by centrifugation, and the reaction liquid was qualitatively and quantitatively analyzed by a Shimadzu GC-2010 Pro AF gas chromatographer. The analyses were operated as follows: initial temperature of 80 ℃, retention time of 2.5 min, followed by an increase to 230 ℃ at a ramp of 40 ℃/min and held at this temperature for 7 min. Qualitative analysis was based on the retention time of standard substances. Quantitative analysis was carried out using normalization, and carbon balance was calculated using the nitrobenzene as internal standard. 2.4 Evaluation of catalyst reusability After the reaction, the catalyst is separated from the reaction solution by centrifugation, washed for 4 times with ethanol, and dried at 100°C in an oven for 12 h in static air. The recovered catalyst after drying is evaluated using the same method as the fresh catalyst described in 2.3. 3 Properties and performance of catalysts 3.1 Structural and texture properties The elemental composition of LaMnO3 (LMO) catalysts and samples after etching and thermal treatment was analyzed by ICP-OES, as shown in Table 1. The molar ratio of La to Mn in the LMO catalyst after etching decreased from 0.98 (LMO) to 0.35 (LMO-NA-230), indicating the in-situ selective etching of La ions in LaMnO3 by dilute nitric acid. The La/Mn ratio of the calcined catalyst (LMO-NA-230–500–24) was 0.32, indicating a negligible change compared to before calcination. Fig. 1A shows the spectra of LaMnO3 (LMO) and its etched sample LMO-NA-230. It can be found that the diffraction peaks of LMO are consistent with the standard LaMnO3 spectrum (JCPDS 54–1275), indicating that the perovskite structure of LaMnO3 is well constructed. The sample etched with 0.5 mol/L HNO3 for 230 min still maintains the perovskite-dominant structure. The intensity of the diffraction peaks of LMO-NA-230 is slightly weaker compared to before etching. Meanwhile, weak diffraction peaks belonging to orthorhombic phase MnO2 appear at 45.1° and 61.7° (JCPDS 44–0142). The crystal grain sizes of LMO and LMO-NA-230 catalysts were calculated using the Scherrer equation, with the results shown in Table 1. The crystal grain size of LMO is ca. 40.5 nm, while the crystal grain size of the etched catalyst LMO-NA-230 was decreased to 20.4 nm, indicating that dilute nitric acid selectively removed La ions in LMO, reduced the grain size, and increased the surface area. This could provide more possible active sites for catalytic reactions. Considering the stability issue of perovskite oxide catalysts under reaction conditions, heat treatment was employed to improve their stability, as shown in Fig. 1B, The phase of the etched catalysts showed no significant change after heat treatment, with a slight increase in grain size, where the dXRD of LMO-NA-230–500–24 increased from 20.4 nm to 24.2 nm after heat treatment. This could be attributed to the movement of metal ions and oxygen ions in the lattice under thermal treatment conditions, leading to the merging of adjacent small grains into larger ones and thus the growth of grain size. The characteristic diffraction peaks of MnO2 disappeared after heat treatment, possibly existing highly dispersed on the surface of LaMnO3 and not being detected. Furthermore, the catalystLMO-NA-230 was thermally treated at different temperatures for 24 h, and the resulting catalysts presented pure phase of LaMnO3 (Figure S1). Stronger characteristic diffraction peaks were observed at an elevated treatment temperature, suggesting a possible agglomeration of grains. Fig. 2 shows the N2 physical adsorption-desorption isotherms and pore size distribution curves of LMO and its modified catalysts. According to the IUPAC classification, all samples exhibit similar type IV isotherms and H3 hysteresis loops (Fig. 2A). The pre-etched LMO catalyst shows weak adsorption capacity and hysteresis loop, which may be due to the presence of a small number of pores formed by accumulation of particles. After etching treatment, both the adsorption capacity and hysteresis loop are significantly enhanced, forming obvious mesoporous structures. The specific surface area, pore volume, and average pore diameter of the catalysts LMO, LMO-NA-230, and LMO-NA-230–500–24 are listed in Table 1. It can be seen that the etching increased the specific surface area of the catalyst from 13.3 m2/g to 140 m2/g. Although there is not much change in pore diameter after etching, the pore volume was increased significantly (Fig. 2B). The main reason for the significant increase in specific surface area and pore volume may be related to the formation of more mesoporous structures after partial etching of La elements in the catalyst. The increased specific surface area and pore volume are not only beneficial for toluene to enter the interior of the catalyst, but also increases the contact between the catalyst and toluene. The increased specific surface area and pore structure may facilitate catalytic activity by providing more active sites and mass transfer channels. In addition, the pore diameters of the catalysts were also calculated according to a cylindrical mode and the resulting values are compared with experimental ones. The theoretical values are smaller than those obtained via N2 adsorption, which can be ascribed to their slit pore structure according to H3 hysteresis loops. After further heat treatment, the specific surface area of the catalyst decreased from 140 m2/g to 62.1 m2/g, but significantly higher than the unetched LMO catalyst. There was no significant change in pore volume observed after the heat treatment, but the average pore diameter increased by ca. 2 times. The pore size distribution of the catalyst narrowed after heat treatment, which is beneficial for maintaining the structural stability of the catalyst. The thermal treatment may induce phase transformation and structural adjustment in the crystal lattice, promoting pore expansion. Additionally, the post-etching LaMnO3 particles exhibit elevated surface energy, driving sintering-induced agglomeration during heat treatment. Smaller particles coalesce through fusion while pores merge, collectively manifesting as increased specific surface area and enlarged average pore diameter. Fig. 3 shows the scanning electron microscope (SEM) and transmission electron microscope (TEM) images of LMO, LMO-NA-230, and LMO-NA-230-500-24. The LMO sample exhibits an irregular shape with a size of approximately 30−50 nm. After etching in dilute HNO3 for 230 min, the originally smooth surface of LMO becomes rough. The La ions at site A were selectively removed and Mn ions were enriched on the catalyst surface, exposing more active sites. These changes collectively lead to an increase in the specific surface area, enhancing the possibility of toluene molecules contacting the catalyst surface. Fig. 4 shows the high-resolution transmission electron microscopy image of LMO-NA-230–500–24. The catalyst exhibits a uniform distribution of irregular particles and a porous microstructure, which should be related to the etching. From Fig. 4B, the obvious lattice structure on the surface of LMO-NA-230–500–24 is observed, consistent with its XRD pattern (Fig. 1). The lattice spacing of the sample after etching and heat treatment is mainly 0.256 nm and 0.286 nm, corresponding to the (204) and (212) crystal planes of LaMnO3. In Fig. 4B, disordered and blurry lattice stripes can also be observed, which may be attributed to the position of defects. These defects can be related to oxygen vacancies, which play an important role in the catalytic oxidation of toluene. The polycrystalline nature of the catalyst is also revealed by the corresponding selected area electron diffraction (SAED) pattern, consistent with XRD pattern of the catalyst. Additionally, the EDS element mapping of LMO-NA-230–500–24 shows a highly dispersed state of La, Mn, and O components in the sample, indicating a consistent pure phase structure of the LMO-NA-230-500-24 catalyst. 3.2 Redox properties and dispersity H2-TPR is used to analyze the redox properties of the catalyst, as shown in Fig. 5A. The H2 consumptions are quantitatively compared by integration of their H2-TPR profiles ( Table 2). There are two reduction peaks at 343 °C and 706 °C for the pristine LMO sample, probably corresponding to the reduction processes of Mn4+ to Mn3+ and Mn3+ to Mn2+ [39−42], respectively. The etched LMO-NA-230 catalyst presented hydrogen consumption at 190 °C, 343 °C and 696 °C, indicating more hydrogenation and lowered reduction temperature. This suggests that the LMO sample is easier to be reduced after etching. This enhancement in the redox properties of manganese species in the etched catalyst would be beneficial for the oxidation of toluene. Compared to the etched catalyst, the catalyst after heat treatment exhibited a decreases in hydrogenation consumption and an increase in reduction temperatures. This may be related to the agglomeration of grains, phase transformation and structural adjustment caused by the heat treatment (Table 1, Figs. 1, 2) [43,44]. Fig. 5B shows the oxygen desorption abilities of different catalysts. Three main oxygen desorption regions were observed for all LMO catalysts. The oxygen desorbed in the first region, within the range of 150−350 ℃, can be attributed to surface oxygen desorption. The oxygen desorbed in the second region, within the range of 350−550 ℃, can be assigned to oxygen vacancy desorption. The desorption range of the third region, in the range of 550−900 ℃, can be related to lattice oxygen desorption [45]. Considering that oxygen vacancies are the sites of oxygen activation, effects of etching and heat treatment on catalysts were investigated by integrating the desorption peak areas. As shown in Table 3, LMO-NA-230 exhibits the largest peak area at 350−550 ℃, indicating that it has the most oxygen vacancies, i.e., etching promotes the generation of oxygen vacancies, enhancing the migration of lattice oxygen. Further thermal treatment may reduce some surface adsorption sites, making the adsorption of surface oxygen molecules more difficult and requiring higher temperatures for desorption. 3.3 Chemical states of the elements Surface atomic concentration and chemical states of all LMO catalysts before and after etching and heat treatment were analyzed by XPS and shown in Fig. 6. As shown in Fig. 6A, two main asymmetric peaks were observed in all LMO samples, attributed to Mn 2p3/2 and Mn 2p1/2 [46,47]. Deconvolution revealed peaks of Mn4+ and Mn3+, with the corresponding area ratios listed in Table 4. The ratios of Mn4+/(Mn4++Mn3+) for the catalysts LMO, LMO-NA-230-500-24, and LMO-NA-230-500-24-R6 were 5.09 %, 12.5 %, and 7.18 %, respectively. It can be seen that the generation of MnO2 on the surface of LMO after etching and heat treatment promoted the formation of surface Mn4+, consistent with the results of H2-TPR. The ratio of the Mn4+/(Mn4++Mn3+) of the recovered catalyst was observed a decrease. As shown in Fig. 6B, the core-level XP spectra of LMO, LMO-NA-230–500–24 and LMO-NA-230–500–24-R6, two peaks can correspond to the chemisorbed oxygen (Oads) and lattice oxygen (Olat) on the surface [48,49]. Oxygen vacancy is important for perovskite oxides, and its generation is calculated by the ratio of Oads/(Olat+Oads), which reflects the percentage of lattice oxygen converted to oxygen vacancies (Table 4). During the nitric acid etching of perovskite oxide LaMnO₃ (LMO), the strongly oxidative nitric acid oxidizes Mn³ ⁺ to Mn⁴⁺. To maintain charge balance, oxygen ions escape as molecular oxygen, creating oxygen vacancies in the LaMnO₃ catalyst. Additionally, hydrogen ions from nitric acid ionization induce lattice distortion through cation exchange in LMO, while structural degradation caused by etching weakens metal-oxygen chemical bonds. Both mechanisms destabilize oxygen ions, promoting their release and oxygen vacancy formation [50,51]. It can be seen that after etching and calcination, the binding energy of chemisorbed oxygen (Oads) and lattice oxygen (Olat) on LMO decreased by approximately 0.4 eV, possibly due to the selective etching of La ions. The Oads/(Olat+Oads) ratio increased from 17.2 % to 39.4 % after etching-heat treatment, indicating that etching can increase the oxygen vacancies density of the catalyst. The Oads/(Olat+Oads) ratio of the recovered catalyst's oxygen elements remained relatively stable after catalytic test, indicating the relative stability of the catalyst fabricated. 3.4 Catalytic performance of toluene selective oxidation 3.4.1 The effects of preparation conditions on the oxidation of toluene Table 5 shows the catalytic performance of LaMnO3 (LMO) and LMO-NA-X prepared at different etching durations for the solvent-free oxidation of toluene in the liquid phase. In the absence of catalyst, the conversion of toluene was only 4.09 %, with benzoic acid as the predominant product. This indicates that toluene autoxidation needs to overcome a high activation energy and thus present a low reactivity in the absence of catalyst. When LaMnO3 catalyst was introduced, the toluene conversion and the selectivity to benzoic acid reached 15.1 % and 80.4 %, respectively, indicating that the perovskite oxide LaMnO3 is an active catalyst for the solvent-free aerobic oxidation of toluene to benzoic acid in liquid phase. To further improve the catalytic performance of LaMnO3, etching with HNO3 was performed. The etching treatment exposes more active sites on the surface of LaMnO3, which is beneficial for oxygen adsorption and activation, thereby enhancing the catalytic ability of the catalyst. With the extension of etching duration, the catalytic activity reached its maximum value at 230 min, with a toluene conversion of 29.6 % and benzoic acid as the major product. This may be attributed to the acid-etched catalyst having a larger specific surface area and more mesoporous structures, increasing the contact opportunities with reactants and improving catalytic performance. Additionally, the oxygen vacancy density of the etched catalyst significantly increased, promoting toluene activation and selective conversion to benzoic acid. Further prolonging the etching time led to a decrease in catalyst activity. When the etching time was extended to 280 min, the toluene conversion of LMO-NA-280 was only 10.6 %, even lower than that of the pristine LMO catalyst, possibly due to excessive etching causing loss of surface active sites and a decrease in catalyst activity. As shown in Fig. 1A, trace MnO2 species were formed on the perovskite oxide LaMnO3 after acid etching. To assess the contribution of MnO2 species to toluene oxidation, Table S1 compares the toluene selective oxidation activity between hydrothermally synthesized MnO2 and the acid-etched catalyst LMO-NA-230. Pure MnO2 exhibited significantly lower activity than the LMO-NA-230 catalyst. This indicates that although trace MnO2 species were generated during acid etching of LMO-NA-230, they are not responsible for the enhanced catalytic performance. The effects of heat treatment temperature and time on the stability of the catalyst were investigated. After heat treatment at different temperatures, the LMO-NA-230 catalyst still retained the perovskite phase of LaMnO3 oxide, but upon catalyst recovery after the reaction, it was found that the catalyst underwent different degrees of phase transformation ( Fig. 7). A comparison of the heating temperatures revealed that the catalyst treated at 500 ℃ for 24 h exhibited the main phase of LaMnO3 (JCPDS 54-1275), but characteristic diffraction peaks belonging to Mn2O3 (JCPDS 41-1442) were still observed at 2θ of 38.5°, 45.1°, 49.3°, 55.1°, 65.8°, which was superior to catalysts thermally treated at other temperatures. The catalytic activity of LMO-NA-230–500–24 was the highest, with a conversion rate of 24.8 % and selectivity for benzoic acid of 82.7 % ( Table 6). Compared with those reports, the perovskite oxide catalysts fabricated in this work exhibited an excellent activity of toluene oxidation and a high selectivity to the desired benzoic acid via molecular oxygen under solvent-free conditions (Table S2). As shown in Fig. 7A, the catalyst treated at 400 ℃ for 24 h after etching exhibited characteristic diffraction peaks of MnO2 (JCPDS 30–0820), with weak characteristic peak of perovskite LaMnO3 at 32.4°, and the toluene conversion rate was decreased to 18.3 %. With the increase in thermal treatment temperature, the catalyst thermally treated at 600 ℃ exhibited a transformation from LaMnO3 into Mn2O3 after the catalytic test. The catalyst baked at 700 ℃ further oxidized the phase into Mn3O4 (JCPDS 24–0734), with a toluene conversion lower than 20 %. In order to find the optimal preparation conditions for the catalyst, the influence of thermal treatment time on the solvent-free oxidation of toluene was further investigated. Table 7 shows the effect of heat treatment time on the catalytic performance of the LMO-NA-230 catalyst. It was found that at a calcination temperature of 500 ℃, the conversion gradually decreased with an increasing duration. From Fig. 7B, it was found that when the calcination time was short, the recovered catalyst could not maintain the perovskite phase and completely transformed into the Mn2O3 (JCPDS 41–1442) phase. When the calcination time was 12 h, the recovered catalyst showed diffraction peaks of LaMnO3 (JCPDS 54-1275). Only after calcination at 500 ℃ for 24 h, although the Mn2O3 phase still existed, the main phase of the recovered catalyst was LaMnO3, with a conversion rate of 24.8 % and a selectivity to benzoic acid of 82.7 %. However, prolonging the calcination time did not further improve the purity of the catalyst phase, and the catalytic performance continued to decrease, with the conversion of LMO-NA-230–500–48 decreasing to 20.6 %. This may be due to prolonged heat treatment causing catalyst sintering, resulting in decreased catalytic activity. The nitric acid etching alters the surface structure and chemical composition of perovskite oxide LaMnO₃, inducing partial La leaching and possible valence state changes of Mn, generating abundant oxygen vacancies and unstable manganese oxide species. These modifications could destabilize the post-etched catalyst under reaction conditions. In LaMnO₃, manganese exhibits multiple valence states, with its distribution potentially varying across catalysts due to different calcination temperatures and heat treatment durations. These metastable species may evolve toward thermodynamically stable phases under reaction conditions. 3.4.2 Influence of reaction conditions on the oxidation of toluene Influence of reaction temperature on the solvent-free oxidation of toluene was investigated and the results are shown in Table 8, The conversion of toluene and the selectivity to benzoic acid are 10.7 % and 80.5 %, respectively, at 150 ℃. When the reaction temperature was increased to 170 ℃, the conversion of toluene increased to 24.8 % and the selectivity to benzoic acid also increased to 82.7 %. However, as the reaction temperature rose to 180 ℃, the increase in the conversion of toluene is relatively slow, only increasing from 24.8 % to 25.7 % with a similar selectivity to benzoic acid. Table 9 shows effect of reaction pressure on the catalytic activity of the LMO-NA-230-500-24 catalyst. In the case of 1 MPa O2, the conversion of toluene and the selectivity to benzoic acid are 12.8 % and 75.6 %, respectively. As the oxygen pressure was increased to 2 MPa, the conversion of toluene significantly increased to 19.4 %. With a further increase in pressure to 2.5 MPa, the conversion of toluene continued to increase to 22.9 %. When the pressure was further increased to 3 MPa, the conversion reached 24.8 % with a selectivity to benzoic acid of 82.7 %. It can be seen that when the oxygen pressure is low, a low solubility of oxygen resulted insufficient contact between oxygen and the substrate molecule toluene. Thus, the transformation from toluene to benzoic acid was predominated by the diffusion and mass transfer of oxygen molecules, rendering a low reactivity of toluene. Enhanced oxygen pressure increases the amount of the concentration of oxygen molecules in the reaction solution and significantly weakened or remove the impact of oxygen molecule diffusion on the oxidation of toluene and thus enhanced the reactivity of toluene. Table 10 explores the effect of reaction time on the catalytic performance of LMO-NA-230-500-24 catalyst. Toluene showed a very low reactivity at the beginning (entry 1). The conversion of toluene increases to 2.74 % in 3 h (entry 2). When the reaction time was 24 h, the conversion of toluene increased to 24.8 %, and the selectivity of benzoic acid also increased to 82.7 %. Continuing to extend the reaction time, the conversion of toluene and the selectivity of benzoic acid did not present an apparent increase, possibly due to the gradual decrease in the concentration of toluene as the reaction progresses. It can be observed that the time curve for solvent-free oxidation of toluene is an S-shaped curve, indicating a typical characteristic of auto-oxidation reaction (Figure S2). Effect of stirring speed on the solvent-free oxidation of toluene was investigated, as shown in Table 11. When the rotation speed of magneton was in the range of 200−1000 r/min, the conversion of toluene increased with the increase of rotation speed, rising from 11.5 % to 24.8 %, while there was little change in the range of 1000−1200 r/min. This indicates that within the range of 1000−1200 r/min rotation speed, the influence of external diffusion can be excluded in the early stages of the reaction, and toluene oxidation is governed by chemical reaction [52]. Increasing the stirring speed can enhance the mixing effect of the reaction system, allowing oxygen to more fully contact with toluene molecules, thereby removing the restriction from of the diffusion molecular oxygen. The influence of catalyst dosage on the catalytic performance of toluene was finally investigated, as shown in Table 12. When the mass of catalyst LMO-NA-230–500–24 was 0.1 g, the conversion of toluene was 9.78 % and the selectivity to benzoic acid was 77.4 %. With the gradual increase of catalyst mass, the conversion rate of toluene showed an increasing trend, reaching 15.1 %, 24.8 %, and 25.9 %. It can be found that when the mass of toluene increased to 0.25 g, the conversion of toluene did not further improve. This indicates that the catalytic reaction activity of LMO-NA-230-500-24 is related to the amount of catalyst. When the amount of catalyst is too low, a low reactivity of toluene can be ascribed to insufficient active sites that catalyst provides. However, a superfluous amount of catalyst may result in a decrease of contact between the toluene and active sites of catalyst due to the increase of the concentration of solid particles and apparent viscosity. In consideration of the effects of oxygen pressure (Table 9) and stirring rate (Table 11), the catalyst dosage is roughly linearly related to the conversion of toluene before its critical value, indicating that the initial oxidation rate is controlled by the chemical reaction rather than diffusion mass transfer (Figure S3) [53]. 3.4.3 Reusability of catalysts LMO-NA-230–500–24 catalyst exhibited excellent catalytic performance in the solvent-free aerobic oxidation of toluene in a high-pressure reactor. Under the same experimental conditions, the activity stability of the LMO-NA-230–500–24 catalyst was evaluated. As shown in Fig. 8A, during the 6 cycles of the cycling test, both the toluene conversion rate (24.8 %) and the selectivity towards benzoic acid (82.7 %) of LMO-NA-230-500-24 remained relatively stable. Fig. 8B shows the XRD pattern of the fresh and the spent catalyst LMO-NA-230–500–24. Although there were some characteristic diffraction peaks of Mn2O3, the main phase of LMO-NA-230-500-24-R6 was LaMnO3 still. This indicates that the crystalline structure of the catalyst remained relatively stable after 6 cycles of catalytic performance evaluation, demonstrating good activity stability and recyclability of the catalyst treated at 500 ℃. 4 Reaction mechanism The product obtained is used as the raw material and catalytically oxidized under the same reaction conditions as toluene, with the results shown in Table 13. When benzaldehyde is used as the reactant, the conversion was as high as 97.4 %, with the main product being benzoic acid, indicating that benzaldehyde is easily oxidized to generate benzoic acid. When benzyl alcohol is used as the starting material, the conversion rate is 64.1 %, with a higher selectivity for benzaldehyde at 66.3 % and less selectivity for benzoic acid, indicating that the presence of benzyl alcohol may inhibit the over-oxidation of benzaldehyde to benzoic acid. When benzoic acid and benzyl benzoate are evaluated, both show low reaction activities. Accordingly, a reaction network of toluene under the reaction conditions is shown in Scheme 1. By adding the radical scavenger 2,2,6,6-tetramethylpiperidine oxide (TEMPO), it was found that the conversion rate of toluene (Entry 7) was significantly lower than the value without TEMPO (Entry 6), possessing a nearly same conversion to the blank experiment (Entry 5), indicating that the reaction may follow a radical mechanism [54]. Based on the XP spectra of the catalyst surface Mn4+ and Mn3+ after six catalytic cycles of LMO-NA-230–500–24, it was suggested that both stable Mn4+ and Mn3+ are beneficial for the oxidation reaction of toluene under solvent-free conditions. On the basis of catalytic test data and our previous work, a possible reaction mechanism was proposed, as shown in Eqs. 1−19 [55,56]. First, Mn3+ formed Mn4+ complex with surface oxygen (Eq. 1). This complex can abstract H atoms of the C−H bond of the toluene side chain, generating benzyl radical and metal peroxide and trigging the chain reaction (Eq. 2). Benzyl radical combined with a lone pair electron of O2 to form benzyl peroxyl radical (Eq. 3). The benzyl peroxyl radical grabbed a hydrogen atom from the starting material to produce benzyl hydroperoxide and benzyl radical (Eq. 4). According to Table 13, under suitable oxidation conditions with catalyst LMO-NA-230–500–24, benzyl hydroperoxide can be transformed into benzaldehyde and water (Eq. 5). Subsequently, the Mn4+ complex captured a hydrogen atom on the benzaldehyde side chain, generating a carbonyl radical and metal peroxide (Eq. 6). (1) LnMn III + O 2 → LnMn IV OO ⋅ (2) Image 1 (3) Image 2 (4) Image 3 (5) Image 4 (6) Image 5 Metal peroxide easily undergoes O−O bond cleavage under the action of metal ions, producing a strongly oxidizing metal intermediate and hydroxyl radical (Eq. 7). The carbonyl radical can react not only with the hydroxyl radical to produce benzoic acid (Eq. 8), but also with O2 to generate phenyl acyl peroxo radical (Eq. 9). The phenyl acyl peroxo radical captures of the H atoms the C−H bond of the toluene side chain, producing phenylperoxy acid and benzyl radical (Eq. 10). Phenylperoxy acid is activated under reaction conditions, leading to the cleavage of the peroxide bond and generating benzoylperoxy radical and hydroxyl radical (Eq. 11). The benzoylperoxy radical then generates benzoic acid and benzyl radical by abstracting a hydrogen atom from toluene (Eq. 12). (7) LnMn IV OOH → LnMn IV O ⋅ + ⋅ OH (8) Image 6 (9) Image 7 (10) Image 8 (11) Image 9 (12) Image 10 The benzyl radical reacts with the hydroxyl radical from the above reactions through radical coupling to produce benzyl alcohol (Eq. 13). The metal intermediate reacts with benzyl alcohol to produce metal hydroxide and benzyl radical (Eq. 14). The benzyl radical reacts with the hydroxyl radical through radical coupling to produce benzyl hydroperoxide (Eq. 15). Benzyl hydroperoxide can undergo intramolecular dehydration under reaction conditions to produce benzaldehyde (Eq. 5). The metal intermediate reacts with toluene to produce metal hydroxide and benzyl radical (Eq. 16). Under reaction conditions, the metal-hydroxide bond undergoes heterolytic cleavage, the metal ion gains electrons and is reduced to a lower oxidation state, and the O−H bond of the hydroxide ion cleaves, forming a hydroxyl radical (Eq. 17). Under strong basic conditions, benzaldehyde undergoes a Cannizzaro reaction, where two molecules of benzaldehyde interact, with one molecule being oxidized to produce benzoic acid, and the other molecule being reduced to produce benzyl alcohol (Eq. 18). Benzyl alcohol reacts with benzoic acid under reaction conditions to produce benzyl benzoate (Eq. 19), and the reaction terminates. (13) Image 11 (14) Image 12 (15) Image 13 (16) Image 14 (17) LnMn IV OH → LnMn III + ⋅ OH (18) Image 15 (19) Image 16 5 Conclusions This work focuses the fabrication and performance of perovskite oxide catalysts for the liquid-phase selective oxidation of toluene. The LaMnO3 perovskite oxide catalyst prepared by sol-gel method was etched to increase the density of active sites, and then heat-treated to improve stability. It was found that etching selectively removes some La ions, leading to significant enhancement in the specific surface area and pore volume. The catalyst prepared by etching LaMnO3 with 0.5 mol/L HNO3 for 230 min showed the highest activity under applied experimental conditions; further heat treatment at 500 ℃ for 24 h improved the stability of its structure and activity. Under optimized reaction conditions, the conversion of toluene and the selectivity to benzoic acid can reach 24.8 % and 82.7 %, respectively, with reliable stability. This can be attributed to its excellent textural properties, abundant surface oxygen concentration, and good low-temperature reducibility. It is suggested that LaMnO3 prepared by etching and heat treatment may be a potential low-cost, highly active, and stable method for the solvent-free aerobic oxidation of toluene. CRediT authorship contribution statement Shi Guojun: Writing – review & editing, Funding acquisition, Conceptualization. Yuan Enxian: Funding acquisition. Zhang Chuchu: Investigation. Jing Xuemei: Investigation. Shan Jiahe: Writing – original draft, Investigation. Declaration of Competing Interest The authors declare that they have no known competing financial interests or personal relationships that could have appeared to influence the work reported in this paper. Acknowledgements The authors are grateful for the supports from Postgraduate Research & Practice Innovation Program of Jiangsu Province (Yangzhou University, SJCX23_1919) and Yangzhou Science and Technology Program Funds (YZ2024229). The authors sincerely thank Prof. Jianyi Shen for the constructive suggestions, and wish to acknowledge the assistance provided by Ms. Jingwen Gao as a postgraduate. Declaration of ethical permit This work contained no animal experiment. Appendix A Supporting information Supplementary data associated with this article can be found in the online version at doi:10.1016/j.apcata.2025.120218. Appendix A Supplementary material Supplementary material References [1] H.-Z. Wang B.-Z. Chen X.-R. He J.-S. Zhao T. Qiu Numerical analysis tool for obtaining steady-state solutions and analyzing their stability characteristics for nonlinear dynamic systems J. Chem. Eng. Jpn. 43 2010 394 400 H.-Z. Wang, B.-Z. Chen, X.-R. He, J.-S. Zhao, T. Qiu, Numerical analysis tool for obtaining steady-state solutions and analyzing their stability characteristics for nonlinear dynamic systems, J. Chem. Eng. Jpn. 43 (2010) 394−400. [2] S. Berne L. Kovačič M. Sova N. Kraševec S. Gobec I. Križaj R. Komel Benzoic acid derivatives with improved antifungal activity: design, synthesis, structure-activity relationship (SAR) and CYP53 docking studies Bioorg. Med. Chem. 23 2015 4264 4276 S. Berne, L. Kovačič, M. Sova, N. Kraševec, S. Gobec, I. Križaj, R. Komel, Benzoic acid derivatives with improved antifungal activity: Design, synthesis, structure-activity relationship (SAR) and CYP53 docking studies, Bioorg. Med. Chem. 23 (2015) 4264−4276. [3] J.A.B. Satrio L.K. Doraiswamy Production of benzaldehyde: a case study in a possible industrial application of phase-transfer catalysis Chem. Eng. J. 82 2001 4356 J.A.B. Satrio, L.K. Doraiswamy, Production of benzaldehyde: A case study in a possible industrial application of phase-transfer catalysis, Chem. Eng. J. 82 (2001) 4356. [4] A. Romero B. Irigoyen S. Larrondo S. Jacobo N. Amadeo Effect of Fe doped over V-Sb oxide catalyst in toluene selective oxidation Catal. Today 133−135 2008 775 779 A. Romero, B. Irigoyen, S. Larrondo, S. Jacobo, N. Amadeo, Effect of Fe doped over V-Sb oxide catalyst in toluene selective oxidation, Catal. Today 133−135 (2008) 775−779. [5] C. Deng M. Xu Z. Dong L. Li J. Yang X. Guo L. Peng N. Xue Y. Zhu W. Ding Exclusively catalytic oxidation of toluene to benzaldehyde in an O/W emulsion stabilized by hexadecylphosphate acid terminated mixed-oxide nanoparticles Chin. J. Catal. 41 2020 341 349 C. Deng, M. Xu, Z. Dong, L. Li, J. Yang, X. Guo, L. Peng, N. Xue, Y. Zhu, W. Ding, Exclusively catalytic oxidation of toluene to benzaldehyde in an O/W emulsion stabilized by hexadecylphosphate acid terminated mixed-oxide nanoparticles, Chin. J. Catal. 41 (2020) 341−349. [6] J. Cui K.-K. Niu R.-Z. Zhang H. Liu S. Yu L.-B. Xing Photocatalytic selective oxidation of toluene under encapsulated air conditions Chem. Commun. 60 2024 4310 4313 J. Cui, K.-K. Niu, R.-Z. Zhang, H. Liu, S. Yu, L.-B. Xing, Photocatalytic selective oxidation of toluene under encapsulated air conditions, Chem. Commun. 60 (2024) 4310−4313. [7] M. Shi M. Li Y. Wang M. Yao Z. Zhang J. Wang C. Guo Surfactants govern the fabrication of sulfur-enriched heterojunction catalysts for highly selective photocatalytic conversion of toluene J. Alloy. Compd. 1010 2025 177219 M. Shi, M. Li, Y. Wang, M. Yao, Z. Zhang, J. Wang, C. Guo, Surfactants govern the fabrication of sulfur-enriched heterojunction catalysts for highly selective photocatalytic conversion of toluene, J. Alloys Compd. 1010 (2025) 177219. [8] H. Wang B. Chen X. He J. Zhao T. Qiu Modeling, simulation and analysis of the liquid-phase catalytic oxidation of toluene Chem. Eng. J. 158 2010 220 224 H. Wang, B. Chen, X. He, J. Zhao, T. Qiu, Modeling, simulation and analysis of the liquid-phase catalytic oxidation of toluene, Chem. Eng. J. 158 (2010) 220–224. [9] A. Al-Hunaiti N. Al-Said L. Halawani M. Haija R. Baqaien D. Taher Synthesis of magnetic CuFe2O4 nanoparticles as green catalyst for toluene oxidation under solvent-free conditions Arab. J. Chem. 13 2020 4945 4953 A. Al-Hunaiti, N. Al-Said, L. Halawani, M. Haija, R. Baqaien, D. Taher, Synthesis of magnetic CuFe2O4 nanoparticles as green catalyst for toluene oxidation under solvent-free conditions, Arabian J. Chem. 13 (2020) 4945-4953. [10] H. Xia Z. Liu Y. Xu J. Zuo Z. Qin Highly efficient V-Mo-Fe-O catalysts for selective oxidation of toluene to benzaldehyde Catal. Commun. 86 2016 72 76 H. Xia, Z. Liu, Y. Xu, J. Zuo, Z. Qin, Highly efficient V-Mo-Fe-O catalysts for selective oxidation of toluene to benzaldehyde, Catal. Commun. 86 (2016) 72–76. [11] E. Amin M. Majid Ag/ZnO nanocomposites: Preparation, characterization and investigation of the catalytic activity for oxidation of toluene in liquid phase Nanostruct 10 2020 1 8 E. Amin, M. Majid, Ag/ZnO nanocomposites: Preparation, characterization and investigation of the catalytic activity for oxidation of toluene in liquid phase, Nanostruct. 10 (2020) 1–8. [12] C. Xu X. Wang Y. Chen L. Dai Synergistic effect between Cu-Cr bimetallic oxides supported on g-C3N4 for the selective oxidation of toluene to benzaldehyde Catal. Sci. Technol. 9 2019 4441 4450 C. Xu, X. Wang, Y. Chen, L. Dai, Synergistic effect between Cu-Cr bimetallic oxides supported on g-C3N4 for the selective oxidation of toluene to benzaldehyde, Catal. Sci. Technol. 9 (2019) 4441–4450. [13] W. Karuehanon C. Sirathanyarote M. Pattarawarapan Poly(4-vinylpyridine-co- divinylbenzene) supported iron(III) catalyst for selective oxidation of toluene to benzoic acid with H2O2 Tetrahedron 68 2012 9423 9428 W. Karuehanon, C. Sirathanyarote, M. Pattarawarapan, Poly(4-vinylpyridine-co- divinylbenzene) supported iron(III) catalyst for selective oxidation of toluene to benzoic acid with H2O2, Tetrahedron, 68 (2012) 9423–9428. [14] A.V. Shijina N.K. Renuka Hydrogen peroxide oxidation of toluene over V/Al systems React. Kinet. Catal. Lett. 94 2008 261 270 A.V. Shijina, N.K. Renuka, Hydrogen peroxide oxidation of toluene over V/Al systems, React. Kinet. Catal. Lett. 94 (2008) 261–270. [15] S. Fan Y. Pan H. Wang B. Lu J. Zhao Q. Cai Effect of acidic and red-ox sites over modified ZSM-5 surface on selectivity in oxidation of toluene Mol. Catal. 442 2017 20 26 S. Fan, Y. Pan, H. Wang, B. Lu, J. Zhao, Q. Cai, Effect of acidic and red-ox sites over modified ZSM-5 surface on selectivity in oxidation of toluene, Mol. Catal. 442 (2017) 20–26. [16] M. Kaur A. Ratan S. Kunchakara M. Dutt V. Singh Cr doped MCM-41 nanocomposites: an efficient mesoporous catalyst facilitating conversion of toluene to benzaldehyde, an industrial precursor J. Porous Mater. 26 2018 239 246 M. Kaur, A. Ratan, S. Kunchakara, M. Dutt, V. Singh, Cr doped MCM-41 nanocomposites: An efficient mesoporous catalyst facilitating conversion of toluene to benzaldehyde, an industrial precursor, J. Porous Mater. 26 (2018) 239–246. [17] L. Chen Y. Chen X. Dai J. Guo X. Peng SBA-15 supported silver catalyst for the efficient aerobic oxidation of toluene under solvent-free conditions Catal. Lett. 152 2021 2881 2891 L. Chen, Y. Chen, X. Dai, J. Guo, X. Peng, SBA-15 supported silver catalyst for the efficient aerobic oxidation of toluene under solvent-free conditions, Catal. Lett. 152 (2021) 2881–2891. [18] S. Peta T. Zhang V. Dubovoy K. Koh M. Hu X. Wang T. Asefa Facile synthesis of efficient and selective Ti-containing mesoporous silica catalysts for toluene oxidation Mol. Catal. 444 2018 34 41 S. Peta, T. Zhang, V. Dubovoy, K. Koh, M. Hu, X. Wang, T. Asefa, Facile synthesis of efficient and selective Ti-containing mesoporous silica catalysts for toluene oxidation, Mol. Catal. 444 (2018) 34–41. [19] P. Mohammadpour E. Safaei Catalytic C–H aerobic and oxidant-induced oxidation of alkylbenzenes (including toluene derivatives) over VO2+ immobilized on core-shell Fe3O4@SiO2 at room temperature in water RSC Adv. 10 2020 23543 23553 P. Mohammadpour, E. Safaei, Catalytic C–H aerobic and oxidant-induced oxidation of alkylbenzenes (including toluene derivatives) over VO2+ immobilized on core-shell Fe3O4@SiO2 at room temperature in water, RSC Adv. 10 (2020) 23543–23553. [20] C. Subrahmanyam B. Louis B. Viswanathan A. Renken T.K. Varadarajan Synthesis, characterisation and catalytic properties of vanadium substituted mesoporous aluminophosphates Appl. Catal. A 282 2005 67 71 C. Subrahmanyam, B. Louis, B. Viswanathan, A. Renken, T.K. Varadarajan, Synthesis, characterisation and catalytic properties of vanadium substituted mesoporous aluminophosphates, Appl. Catal., A 282 (2005) 67–71. [21] X. Gu C. Huang Z. Xu H. Wu R. Dong R. Liu J. Chen H. Zhu Core-shell Co-MOF-74@Mn-MOF-74 catalysts with Controllable shell thickness and their enhanced catalytic activity for toluene oxidation J. Solid State Chem. 294 2021 0022 4596 X. Gu, C. Huang, Z. Xu, H. Wu, R. Dong, R. Liu, J. Chen, H. Zhu, Core-shell Co-MOF-74@Mn-MOF-74 catalysts with Controllable shell thickness and their enhanced catalytic activity for toluene oxidation, J. Solid State Chem. 294 (2021) 0022–4596. [22] S. Xu G. Shi Y. Feng L. Ji Synthesis and characterization of highly dispersed cobaltous silicate as a catalyst for selective oxidation of toluene to benzaldehyde Mater. Chem. Phys. 262 2021 0254 0584 S. Xu, G. Shi, Y. Feng, L. Ji, Synthesis and characterization of highly dispersed cobaltous silicate as a catalyst for selective oxidation of toluene to benzaldehyde, Mater. Chem. Phys. 262 (2021) 0254–0584. [23] Z. Wu J. Deng S. Xie H. Yang X. Zhao K. Zhang H. Lin H. Dai G. Guo Mesoporous Cr2O3-supported Au–Pd nanoparticles: high-performance catalysts for the oxidation of toluene Microporous Mesoporous Mater. 224 2016 311 322 Z. Wu, J. Deng, S. Xie, H. Yang, X. Zhao, K. Zhang, H. Lin, H. Dai, G. Guo, Mesoporous Cr2O3-supported Au–Pd nanoparticles: High-performance catalysts for the oxidation of toluene, Microporous Mesoporous Mater. 224 (2016) 311–322. [24] X. Li J. Xu F. Wang J. Gao Direct oxidation of toluene to benzoic acid with molecular oxygen over manganese oxides Catal. Lett. 108 2006 137 140 X. Li, J. Xu, F. Wang, J. Gao, Direct oxidation of toluene to benzoic acid with molecular oxygen over manganese oxides, Catal. Lett. 108 (2006) 137–140. [25] X. Li J. Xu L. Zhou F. Wang J. Gao C. Chen Liquid-phase oxidation of toluene by molecular oxygen over copper manganese oxides Catal. Lett. 110 2006 255 260 X. Li, J. Xu, L. Zhou, F. Wang, J. Gao, C. Chen, Liquid-phase oxidation of toluene by molecular oxygen over copper manganese oxides, Catal. Lett. 110 (2006) 255–260. [26] L. Jin C. Chen V.M.B. Crisostomo L.-P. Xu Y.C. Son S.L. Suib γ-MnO2 octahedral molecular sieve: Preparation, characterization, and catalytic activity in the atmospheric oxidation of toluene Appl. Catal. A 355 2009 169 175 L. Jin, C. Chen, V.M.B. Crisostomo, L.-P. Xu, Y.C. Son, S.L. Suib, γ-MnO2 octahedral molecular sieve: Preparation, characterization, and catalytic activity in the atmospheric oxidation of toluene, Appl. Catal., A 355 (2009) 169–175. [27] I. Pettiti S. Colonna S.D. Rossi M. Faticanti G. Minelli P. Porta XAS characterization and CO oxidation on δ-alumina supported La, Mn, Co and Fe oxides Phys. Chem. Chem. Phys. 6 2004 1350 1358 I. Pettiti, S. Colonna, S.D. Rossi, M. Faticanti, G. Minelli, P. Porta, XAS characterization and CO oxidation on δ-alumina supported La, Mn, Co and Fe oxides, Phys. Chem. Chem. Phys. 6 (2004) 1350–1358. [28] T. Bilkova D. Fridrichova K. Pacultová K. Karásková L. Obalová M. Haneda Reaction mechanism of NO direct decomposition over K-promoted Co-Mn-Al mixed oxides–DRIFTS, TPD and transient state studies J. Taiwan Inst. Chem. Eng. 120 2021 257 266 T. Bilkova, D. Fridrichova, K. Pacultová, K. Karásková, L. Obalová, M. Haneda, Reaction mechanism of NO direct decomposition over K-promoted Co-Mn-Al mixed oxides–DRIFTS, TPD and transient state studies, J. Taiwan Inst. Chem. Eng. 120 (2021) 257–266. [29] B. Li Q. Yang Y. Peng J. Chen L. Deng D. Wang X. Hong J. Li Enhanced low-temperature activity of LaMnO3 for toluene oxidation: the effect of treatment with an acidic KMnO4 Chem. Eng. J. 366 2019 92 99 B. Li, Q. Yang, Y. Peng, J. Chen, L. Deng, D. Wang, X. Hong, J. Li, Enhanced low-temperature activity of LaMnO3 for toluene oxidation: The effect of treatment with an acidic KMnO4, Chem. Eng. J. 366 (2019) 92–99. [30] M.A. Oturan J.-J. Aaron Advanced oxidation processes in water/wastewater treatment: Principles and applications, a review Crit. Rev. Environ. Sci. Technol. 44 2014 2577 2641 M.A. Oturan, J.-J. Aaron, Advanced oxidation processes in water/wastewater treatment: Principles and applications, A review, Crit. Rev. Environ. Sci. Technol. 44 (2014) 2577–2641. [31] R. Mistri D. Das J. Llorca M. Dominguez T.K. Mandal P. Mohanty B.C. Ray A. Gayen Selective liquid phase benzyl alcohol oxidation over Cu-loaded LaFeO3 perovskite RSC Adv. 6 2016 4469 R. Mistri, D. Das, J. Llorca, M. Dominguez, T.K. Mandal, P. Mohanty, B.C. Ray, A. Gayen, Selective liquid phase benzyl alcohol oxidation over Cu-loaded LaFeO3 perovskite, RSC Adv. 6 (2016) 4469. [32] B. Zhao R. Ran L. Sun D. Weng NO catalytic oxidation over an ultra-large surface area LaMnO3+δ perovskite synthesized by an acid-etching method RSC Adv. 6 2016 69855 69860 B. Zhao, R. Ran, L. Sun, D. Weng, NO catalytic oxidation over an ultra-large surface area LaMnO3+ δ perovskite synthesized by an acid-etching method, RSC Adv. 6 (2016) 69855–69860. [33] H. Chen J. Li W. Cui Z. Fei Q. Tian Q. Liu X. Chen M. Cui Z. Zhang J. Tang X. Qiao Precise fabrication of surface-reconstructed LaMnO3 perovskite with enhanced catalytic performance in CH4 oxidation Appl. Surf. Sci. 505 2020 144112 H. Chen, J. Li, W. Cui, Z. Fei, Q. Tian, Q. Liu, X. Chen, M. Cui, Z. Zhang, J. Tang, X. Qiao, Precise fabrication of surface-reconstructed LaMnO3 perovskite with enhanced catalytic performance in CH4 oxidation, Appl. Surf. Sci. 505 (2020) 144112. [34] B. Zhao R. Ran L. Sun Z. Yang X. Wu D. Weng A high-surface-area La-Ce-Mn mixed oxide with enhanced activity for CO and C3H8 oxidation Catal. Commun. 105 2018 26 30 B. Zhao, R. Ran, L. Sun, Z. Yang, X. Wu, D. Weng, A high-surface-area La-Ce-Mn mixed oxide with enhanced activity for CO and C3H8 oxidation, Catal. Commun. 105 (2018) 26–30. [35] S. Pathreeker S. Reed P. Chando I.D. Hosein A study of calcium ion intercalation in perovskite calcium manganese oxide J. Electroanal. Chem. 874 2020 114453 S. Pathreeker, S. Reed, P. Chando, I.D. Hosein, A study of calcium ion intercalation in perovskite calcium manganese oxide, J. Electroanal. Chem. 874 (2020) 114453. [36] L. Li J. Yan W. Ji Engineering the microenvironment of Pd nanoparticles on porous MnOx matrix to improve catalytic toluene combustion Appl. Catal. A 649 2023 118947 L. Li, J. Yan, W. Ji, Engineering the microenvironment of Pd nanoparticles on porous MnOx matrix to improve catalytic toluene combustion, Appl. Catal., A 649 (2023) 118947. [37] M. Yuasa N. Yamazoe K. Shimanoe Durability of carbon-supported La-Mn-based perovskite-type oxides as oxygen reduction catalysts in strong alkaline solution J. Electrochem. Soc. 158 2011 4 M. Yuasa, N. Yamazoe, K. Shimanoe, Durability of carbon-supported La-Mn-based perovskite-type oxides as oxygen reduction catalysts in strong alkaline solution, J. Electrochem. Soc.158 (2011) 4. [38] R. Majee T. Das S. Chakraborty S. Bhattacharyya Shaping a doped perovskite oxide with measured grain boundary defects to catalyze bifunctional oxygen activation for a rechargeable Zn-Air battery ACS Appl. Mater. Interfaces 12 2020 40355 40363 R. Majee, T. Das, S. Chakraborty, S. Bhattacharyya, Shaping a doped perovskite oxide with measured grain boundary defects to catalyze bifunctional oxygen activation for a rechargeable Zn-Air battery, ACS Appl. Mater. Interfaces 12 (2020) 40355−40363. [39] L. Wang C. Wang H. Xie W. Zhan Y. Guo Y. Guo Catalytic combustion of vinylchloride over Sr doped LaMnO3 Catal. Today 327 2019 190 195 L. Wang, C. Wang, H. Xie, W. Zhan, Y. Guo, Y. Guo, Catalytic combustion of vinylchloride over Sr doped LaMnO3, Catal. Today. 327 (2019) 190−195. [40] R.K.C. de Lima M.S. Batista M. Wallau E.A. Sanches Y.P. Mascarenhas E.A. Urquieta-González high specific surface area LaFeCo perovskites-synthesis by nanocasting and catalytic behavior in the reduction of NO with CO Appl. Catal. B 90 2009 441 450 R.K.C. de Lima, M.S. Batista, M. Wallau, E.A. Sanches, Y.P. Mascarenhas, E.A. Urquieta-González, high specific surface area LaFeCo perovskites-synthesis by nanocasting and catalytic behavior in the reduction of NO with CO, Appl. Catal., B 90 (2009) 441–450. [41] Z. Huang Y. Wei Z. Song J. Luo Y. Mao J. Gao X. Zhang C. Niu H. Kang Z. Wang Three-dimensional (3D) hierarchical Mn2O3 catalysts with the highly efficient purification of benzene combustion Sep. Purif. Technol. 255 2021 117633 Z. Huang, Y. Wei, Z. Song, J. Luo, Y. Mao, J. Gao, X. Zhang, C. Niu, H. Kang, Z. Wang, Three-dimensional (3D) hierarchical Mn2O3 catalysts with the highly efficient purification of benzene combustion, Sep. Purif. Technol. 255 (2021) 117633. [42] H. Gao Z. Song Y. Mao Y. Fan R. Li X. Chen W. Liu J. Zhang Z. Huang X. Zhang Tight coupling of oxygen vacancies and acidity on α-MnO2 through cerium doping engineering for efficient removal of multi-component VOCs Appl. Catal. B 362 2025 124745 H. Gao, Z. Song, Y. Mao, Y. Fan, R. Li, X. Chen, W. Liu, J. Zhang, Z. Huang, X. Zhang, Tight coupling of oxygen vacancies and acidity on α-MnO2 through cerium doping engineering for efficient removal of multi-component VOCs, Appl. Cata. B 362 (2025) 124745. [43] Y. Liu H. Dai Y. Du J. Deng L. Zhang Z. Zhao C.T. Au Controlled preparation and high catalytic performance of three-dimensionally ordered macroporous LaMnO3 with nanovoid skeletons for the combustion of toluene J. Catal. 287 2012 149 160 Y. Liu, H. Dai, Y. Du, J. Deng, L. Zhang, Z. Zhao, C.T. Au, Controlled preparation and high catalytic performance of three-dimensionally ordered macroporous LaMnO3 with nanovoid skeletons for the combustion of toluene, J. Catal. 287 (2012) 149−160. [44] W. Gu C. Li J. Qiu J. Yao Facile fabrication of flower-like MnO2 hollow microspheres as high-performance catalysts for toluene oxidation J. Hazard. Mater. 408 2021 124458 W. Gu, C. Li, J. Qiu, J. Yao, Facile fabrication of flower-like MnO2 hollow microspheres as high-performance catalysts for toluene oxidation, J. Hazard. Mater. 408 (2021) 124458. [45] C. Zhang K. Zeng C. Wang X. Liu G. Wu Z. Wang D. Wang LaMnO3 perovskites via a facile nickel substitution strategy for boosting propane combustion performance Ceram. Int. 46 2020 6652 6662 C. Zhang, K. Zeng, C. Wang, X. Liu, G. Wu, Z. Wang, D. Wang, LaMnO3 perovskites via a facile nickel substitution strategy for boosting propane combustion performance, Ceram. Int. 46 (2020) 6652–6662. [46] H. Li Z. Song Y. Mao X. Zhang Z. Huang W. Liu H. Gao D. Dong Degradation mechanism of toluene over Ce−M (Cu, Co and Fe) catalysts: effect of oxygen vacancies on reaction intermediates Appl. Surf. Sci. 652 2024 159272 H. Li, Z. Song, Y. Mao, X. Zhang, Z. Huang, W. Liu, H. Gao, D. Dong, Degradation mechanism of toluene over Ce−M (Cu, Co and Fe) catalysts: Effect of oxygen vacancies on reaction intermediates, Appl. Surf. Sci. 652 (2024) 159272. [47] Z. Huang H. Li X. Zhang Y. Mao Y. Wu W. Liu H. Gao M. Zhang Z. Song Catalytic oxidation of toluene by manganese oxides: effect of K+ doping on oxygen vacancy J. Environ. Sci. 142 2024 43 56 Z. Huang, H. Li, X. Zhang, Y. Mao, Y. Wu, W. Liu, H. Gao, M. Zhang, Z. Song, Catalytic oxidation of toluene by manganese oxides: effect of K+ doping on oxygen vacancy, J. Environ. Sci. 142 (2024) 43–56. [48] J. Chen M. Shen X. Wang J. Wang Y. Su Z. Zhao Catalytic performance of NO oxidation over LaMeO3 (Me=Mn, Fe, Co) perovskite prepared by the sol-gel method Catal. Commun. 37 2013 105 108 J. Chen, M. Shen, X. Wang, J. Wang, Y. Su, Z. Zhao, Catalytic performance of NO oxidation over LaMeO3 (Me=Mn, Fe, Co) perovskite prepared by the sol-gel method, Catal. Commun. 37 (2013) 105–108. [49] J. Chen M. Shen X. Wang G. Qi J. Wang W. Li The influence of nonstoichiometry on LaMnO3 perovskite for catalytic NO oxidation Appl. Catal. B 134–135 2013 251 257 J. Chen, M. Shen, X. Wang, G. Qi, J. Wang, W. Li, The influence of nonstoichiometry on LaMnO3 perovskite for catalytic NO oxidation, Appl. Catal., B 134–135 (2013) 251–257. [50] Z. Song Z. Liu X. Zhang Y. Mao W. Liu C. Gao H. Li X. Zhang C. Han Z. Huang Influence of surface acidity and chemical valence on low temperature activity over Pt-HSiW/CeO2 for catalytic combustion of chlorobenzene J. Rare Earths 42 2024 1693 1703 Z. Song, Z. Liu, X. Zhang, Y. Mao, W. Liu, C. Gao, H. Li, X. Zhang, C. Han, Z. Huang, Influence of surface acidity and chemical valence on low temperature activity over Pt-HSiW/CeO2 for catalytic combustion of chlorobenzene, J. Rare Earths 42 (2024) 1693−1703. [51] G. Cheng Z. Song Y. Mao J. Zhang K. Wang H. Li Z. Huang Effect of Ce2O3 phase transition on the catalytic oxidation for toluene over CeO2 catalysts Fuel 368 2024 131641 G. Cheng, Z. Song, Y. Mao, J. Zhang, K. Wang, H. Li, Z. Huang, Effect of Ce2O3 phase transition on the catalytic oxidation for toluene over CeO2 catalysts, Fuel 368 (2024) 131641. [52] S.R. Joshi K.L. Kataria S.B. Sawant J.B. Joshi Kinetics of oxidation of benzyl alcohol with dilute nitric acid Ind. Eng. Chem. Res. 44 2005 325 333 S.R. Joshi, K.L. Kataria, S.B. Sawant, J.B. Joshi, Kinetics of oxidation of benzyl alcohol with dilute nitric acid, Ind. Eng. Chem. Res. 44 (2005) 325–333. [53] X. Huang X. Wang X. Wang X. Wang M. Tan W. Ding X. Lu P123-stabilized Au-Ag alloy nanoparticles for kinetics of aerobic oxidation of benzyl alcohol in aqueous solution J. Catal. 301 2013 217 226 X. Huang, X. Wang, X. Wang, X. Wang, M. Tan, W. Ding, X. Lu, P123-stabilized Au-Ag alloy nanoparticles for kinetics of aerobic oxidation of benzyl alcohol in aqueous solution, J. Catal. 301 (2013) 217–226. [54] K. Su H. Liu B. Zeng Z. Zhang N. Luo Z. Huang Z. Gao F. Wang Visible-light-driven selective oxidation of toluene into benzaldehyde over nitrogen-modified Nb2O5 nanomeshes ACS Catal. 10 2020 1324 1333 K. Su, H. Liu, B. Zeng, Z. Zhang, N. Luo, Z. Huang, Z. Gao, F. Wang, Visible-light-driven selective oxidation of toluene into benzaldehyde over nitrogen-modified Nb2O5 nanomeshes, ACS Catal. 10 (2020) 1324−1333. [55] S. Miao F. Wang J. Liu Solvent-free toluene aerobic selective oxidation over Co(OH)2/Cr2O3: The effect of calcination temperature on product selectivity Appl. Catal. B 643 2022 118787 S. Miao, F. Wang,J. Liu, Solvent-free toluene aerobic selective oxidation over Co(OH)2/Cr2O3: The effect of calcination temperature on product selectivity, Appl. Catal., B 643 (2022) 118787. [56] H. Luo W. Chen J. Hu F. Zhang X. Hu Highly selective oxidation of toluene to benzaldehyde in alkaline systems Ind. Eng. Chem. Res. 62 2023 10051 10056 H. Luo, W. Chen, J. Hu, F. Zhang, X. Hu, Highly selective oxidation of toluene to benzaldehyde in alkaline systems, Ind. Eng. Chem. Res. 62 (2023) 10051−10056.",
      "scopus-id": "86000733882",
      "coredata": {
        "eid": "1-s2.0-S0926860X2500119X",
        "dc:description": "Chlorination-hydrolysis of toluene or homogeneous Co/Mn/Br catalyzed liquid phase oxidation of toluene to produce benzoic acid suffers from product halogen-contamination, severe equipment corrosion, and costly wastewater treatment industrially. Direct selective oxidation of toluene to benzoic acid under non-homogeneous catalyst, molecular oxygen, and solvent-free conditions will make this transformation more efficient and environmentally friendly. In this work, LaMnO3 perovskite oxide catalysts were fabricated by sol-gel method followed by etching and heat treatment, and tested via selective aerobic oxidation of toluene to benzoic acid under solvent-free conditions. The etched LaMnO3 perovskite oxide catalyst possesses a good mesoporous structure, significantly increased specific surface area and pore volume, halved grain size, reduced reduction temperature, and increased density of Mn4 + ions and oxygen vacancies on the catalyst surface. Further heat treatment significantly improved the catalyst stability while sacrificing some textural properties. The LaMnO3 perovskite oxide catalyst fabricated under the best conditions achieved a toluene conversion of 24.8 % and a benzoic acid selectivity of 82.7 %, with stable structural properties and catalytic performance after multiple cycles of use. This study can provide beneficial exploration and thinking for the design of perovskite oxide catalysts and their application in selective toluene oxidation.",
        "openArchiveArticle": "false",
        "prism:coverDate": "2025-05-05",
        "openaccessUserLicense": null,
        "prism:aggregationType": "Journal",
        "prism:url": "https://api.elsevier.com/content/article/pii/S0926860X2500119X",
        "dc:creator": [
          {
            "@_fa": "true",
            "$": "Shan, Jiahe"
          },
          {
            "@_fa": "true",
            "$": "Jing, Xuemei"
          },
          {
            "@_fa": "true",
            "$": "Zhang, Chuchu"
          },
          {
            "@_fa": "true",
            "$": "Yuan, Enxian"
          },
          {
            "@_fa": "true",
            "$": "Shi, Guojun"
          }
        ],
        "link": [
          {
            "@_fa": "true",
            "@rel": "self",
            "@href": "https://api.elsevier.com/content/article/pii/S0926860X2500119X"
          },
          {
            "@_fa": "true",
            "@rel": "scidir",
            "@href": "https://www.sciencedirect.com/science/article/pii/S0926860X2500119X"
          }
        ],
        "dc:format": "application/json",
        "openaccessType": null,
        "pii": "S0926-860X(25)00119-X",
        "prism:volume": "697",
        "articleNumber": "120218",
        "prism:publisher": "Elsevier B.V. All rights are reserved, including those for text and data mining, AI training, and similar technologies.",
        "dc:title": "Fabricating highly dispersed and stable LaMnO3 perovskite oxide catalysts for selective aerobic oxidation of toluene to benzoic acid under solvent-free conditions",
        "prism:copyright": "© 2025 Elsevier B.V. All rights are reserved, including those for text and data mining, AI training, and similar technologies.",
        "openaccess": "0",
        "prism:issn": "0926860X",
        "dcterms:subject": [
          {
            "@_fa": "true",
            "$": "Toluene"
          },
          {
            "@_fa": "true",
            "$": "Solvent-free oxidation"
          },
          {
            "@_fa": "true",
            "$": "Perovskite oxide catalyst"
          },
          {
            "@_fa": "true",
            "$": "Etching"
          }
        ],
        "openaccessArticle": "false",
        "prism:publicationName": "Applied Catalysis A: General",
        "openaccessSponsorType": null,
        "prism:pageRange": "120218",
        "pubType": "fla",
        "prism:coverDisplayDate": "5 May 2025",
        "prism:doi": "10.1016/j.apcata.2025.120218",
        "prism:startingPage": "120218",
        "dc:identifier": "doi:10.1016/j.apcata.2025.120218",
        "openaccessSponsorName": null
      },
      "objects": {
        "object": [
          {
            "@category": "standard",
            "@height": "276",
            "@width": "678",
            "@_fa": "true",
            "$": "https://api.elsevier.com/content/object/eid/1-s2.0-S0926860X2500119X-gr8.jpg?httpAccept=%2A%2F%2A",
            "@multimediatype": "JPEG image file",
            "@type": "IMAGE-DOWNSAMPLED",
            "@size": "41611",
            "@ref": "gr8",
            "@mimetype": "image/jpeg"
          },
          {
            "@category": "standard",
            "@height": "248",
            "@width": "678",
            "@_fa": "true",
            "$": "https://api.elsevier.com/content/object/eid/1-s2.0-S0926860X2500119X-gr7.jpg?httpAccept=%2A%2F%2A",
            "@multimediatype": "JPEG image file",
            "@type": "IMAGE-DOWNSAMPLED",
            "@size": "54091",
            "@ref": "gr7",
            "@mimetype": "image/jpeg"
          },
          {
            "@category": "standard",
            "@height": "46",
            "@width": "439",
            "@_fa": "true",
            "$": "https://api.elsevier.com/content/object/eid/1-s2.0-S0926860X2500119X-fx15.jpg?httpAccept=%2A%2F%2A",
            "@multimediatype": "JPEG image file",
            "@type": "IMAGE-DOWNSAMPLED",
            "@size": "5855",
            "@ref": "fx15",
            "@mimetype": "image/jpeg"
          },
          {
            "@category": "standard",
            "@height": "274",
            "@width": "678",
            "@_fa": "true",
            "$": "https://api.elsevier.com/content/object/eid/1-s2.0-S0926860X2500119X-gr6.jpg?httpAccept=%2A%2F%2A",
            "@multimediatype": "JPEG image file",
            "@type": "IMAGE-DOWNSAMPLED",
            "@size": "47603",
            "@ref": "gr6",
            "@mimetype": "image/jpeg"
          },
          {
            "@category": "standard",
            "@height": "49",
            "@width": "530",
            "@_fa": "true",
            "$": "https://api.elsevier.com/content/object/eid/1-s2.0-S0926860X2500119X-fx16.jpg?httpAccept=%2A%2F%2A",
            "@multimediatype": "JPEG image file",
            "@type": "IMAGE-DOWNSAMPLED",
            "@size": "7107",
            "@ref": "fx16",
            "@mimetype": "image/jpeg"
          },
          {
            "@category": "standard",
            "@height": "268",
            "@width": "678",
            "@_fa": "true",
            "$": "https://api.elsevier.com/content/object/eid/1-s2.0-S0926860X2500119X-gr5.jpg?httpAccept=%2A%2F%2A",
            "@multimediatype": "JPEG image file",
            "@type": "IMAGE-DOWNSAMPLED",
            "@size": "39306",
            "@ref": "gr5",
            "@mimetype": "image/jpeg"
          },
          {
            "@category": "standard",
            "@height": "47",
            "@width": "337",
            "@_fa": "true",
            "$": "https://api.elsevier.com/content/object/eid/1-s2.0-S0926860X2500119X-fx7.jpg?httpAccept=%2A%2F%2A",
            "@multimediatype": "JPEG image file",
            "@type": "IMAGE-DOWNSAMPLED",
            "@size": "4191",
            "@ref": "fx7",
            "@mimetype": "image/jpeg"
          },
          {
            "@category": "standard",
            "@height": "48",
            "@width": "327",
            "@_fa": "true",
            "$": "https://api.elsevier.com/content/object/eid/1-s2.0-S0926860X2500119X-fx6.jpg?httpAccept=%2A%2F%2A",
            "@multimediatype": "JPEG image file",
            "@type": "IMAGE-DOWNSAMPLED",
            "@size": "4128",
            "@ref": "fx6",
            "@mimetype": "image/jpeg"
          },
          {
            "@category": "standard",
            "@height": "50",
            "@width": "544",
            "@_fa": "true",
            "$": "https://api.elsevier.com/content/object/eid/1-s2.0-S0926860X2500119X-fx10.jpg?httpAccept=%2A%2F%2A",
            "@multimediatype": "JPEG image file",
            "@type": "IMAGE-DOWNSAMPLED",
            "@size": "6972",
            "@ref": "fx10",
            "@mimetype": "image/jpeg"
          },
          {
            "@category": "standard",
            "@height": "48",
            "@width": "521",
            "@_fa": "true",
            "$": "https://api.elsevier.com/content/object/eid/1-s2.0-S0926860X2500119X-fx5.jpg?httpAccept=%2A%2F%2A",
            "@multimediatype": "JPEG image file",
            "@type": "IMAGE-DOWNSAMPLED",
            "@size": "6120",
            "@ref": "fx5",
            "@mimetype": "image/jpeg"
          },
          {
            "@category": "standard",
            "@height": "50",
            "@width": "392",
            "@_fa": "true",
            "$": "https://api.elsevier.com/content/object/eid/1-s2.0-S0926860X2500119X-fx4.jpg?httpAccept=%2A%2F%2A",
            "@multimediatype": "JPEG image file",
            "@type": "IMAGE-DOWNSAMPLED",
            "@size": "4921",
            "@ref": "fx4",
            "@mimetype": "image/jpeg"
          },
          {
            "@category": "standard",
            "@height": "47",
            "@width": "365",
            "@_fa": "true",
            "$": "https://api.elsevier.com/content/object/eid/1-s2.0-S0926860X2500119X-fx13.jpg?httpAccept=%2A%2F%2A",
            "@multimediatype": "JPEG image file",
            "@type": "IMAGE-DOWNSAMPLED",
            "@size": "4602",
            "@ref": "fx13",
            "@mimetype": "image/jpeg"
          },
          {
            "@category": "standard",
            "@height": "583",
            "@width": "565",
            "@_fa": "true",
            "$": "https://api.elsevier.com/content/object/eid/1-s2.0-S0926860X2500119X-gr4.jpg?httpAccept=%2A%2F%2A",
            "@multimediatype": "JPEG image file",
            "@type": "IMAGE-DOWNSAMPLED",
            "@size": "101289",
            "@ref": "gr4",
            "@mimetype": "image/jpeg"
          },
          {
            "@category": "standard",
            "@height": "47",
            "@width": "469",
            "@_fa": "true",
            "$": "https://api.elsevier.com/content/object/eid/1-s2.0-S0926860X2500119X-fx14.jpg?httpAccept=%2A%2F%2A",
            "@multimediatype": "JPEG image file",
            "@type": "IMAGE-DOWNSAMPLED",
            "@size": "5467",
            "@ref": "fx14",
            "@mimetype": "image/jpeg"
          },
          {
            "@category": "standard",
            "@height": "719",
            "@width": "678",
            "@_fa": "true",
            "$": "https://api.elsevier.com/content/object/eid/1-s2.0-S0926860X2500119X-gr3.jpg?httpAccept=%2A%2F%2A",
            "@multimediatype": "JPEG image file",
            "@type": "IMAGE-DOWNSAMPLED",
            "@size": "161158",
            "@ref": "gr3",
            "@mimetype": "image/jpeg"
          },
          {
            "@category": "standard",
            "@height": "48",
            "@width": "368",
            "@_fa": "true",
            "$": "https://api.elsevier.com/content/object/eid/1-s2.0-S0926860X2500119X-fx9.jpg?httpAccept=%2A%2F%2A",
            "@multimediatype": "JPEG image file",
            "@type": "IMAGE-DOWNSAMPLED",
            "@size": "4585",
            "@ref": "fx9",
            "@mimetype": "image/jpeg"
          },
          {
            "@category": "standard",
            "@height": "48",
            "@width": "320",
            "@_fa": "true",
            "$": "https://api.elsevier.com/content/object/eid/1-s2.0-S0926860X2500119X-fx11.jpg?httpAccept=%2A%2F%2A",
            "@multimediatype": "JPEG image file",
            "@type": "IMAGE-DOWNSAMPLED",
            "@size": "4265",
            "@ref": "fx11",
            "@mimetype": "image/jpeg"
          },
          {
            "@category": "standard",
            "@height": "268",
            "@width": "678",
            "@_fa": "true",
            "$": "https://api.elsevier.com/content/object/eid/1-s2.0-S0926860X2500119X-gr2.jpg?httpAccept=%2A%2F%2A",
            "@multimediatype": "JPEG image file",
            "@type": "IMAGE-DOWNSAMPLED",
            "@size": "37878",
            "@ref": "gr2",
            "@mimetype": "image/jpeg"
          },
          {
            "@category": "standard",
            "@height": "50",
            "@width": "553",
            "@_fa": "true",
            "$": "https://api.elsevier.com/content/object/eid/1-s2.0-S0926860X2500119X-fx8.jpg?httpAccept=%2A%2F%2A",
            "@multimediatype": "JPEG image file",
            "@type": "IMAGE-DOWNSAMPLED",
            "@size": "7323",
            "@ref": "fx8",
            "@mimetype": "image/jpeg"
          },
          {
            "@category": "standard",
            "@height": "47",
            "@width": "502",
            "@_fa": "true",
            "$": "https://api.elsevier.com/content/object/eid/1-s2.0-S0926860X2500119X-fx12.jpg?httpAccept=%2A%2F%2A",
            "@multimediatype": "JPEG image file",
            "@type": "IMAGE-DOWNSAMPLED",
            "@size": "6089",
            "@ref": "fx12",
            "@mimetype": "image/jpeg"
          },
          {
            "@category": "standard",
            "@height": "249",
            "@width": "678",
            "@_fa": "true",
            "$": "https://api.elsevier.com/content/object/eid/1-s2.0-S0926860X2500119X-gr1.jpg?httpAccept=%2A%2F%2A",
            "@multimediatype": "JPEG image file",
            "@type": "IMAGE-DOWNSAMPLED",
            "@size": "44522",
            "@ref": "gr1",
            "@mimetype": "image/jpeg"
          },
          {
            "@category": "standard",
            "@height": "50",
            "@width": "574",
            "@_fa": "true",
            "$": "https://api.elsevier.com/content/object/eid/1-s2.0-S0926860X2500119X-fx3.jpg?httpAccept=%2A%2F%2A",
            "@multimediatype": "JPEG image file",
            "@type": "IMAGE-DOWNSAMPLED",
            "@size": "7902",
            "@ref": "fx3",
            "@mimetype": "image/jpeg"
          },
          {
            "@category": "standard",
            "@height": "257",
            "@width": "564",
            "@_fa": "true",
            "$": "https://api.elsevier.com/content/object/eid/1-s2.0-S0926860X2500119X-sc1.jpg?httpAccept=%2A%2F%2A",
            "@multimediatype": "JPEG image file",
            "@type": "IMAGE-DOWNSAMPLED",
            "@size": "17741",
            "@ref": "sc1",
            "@mimetype": "image/jpeg"
          },
          {
            "@category": "standard",
            "@height": "48",
            "@width": "361",
            "@_fa": "true",
            "$": "https://api.elsevier.com/content/object/eid/1-s2.0-S0926860X2500119X-fx2.jpg?httpAccept=%2A%2F%2A",
            "@multimediatype": "JPEG image file",
            "@type": "IMAGE-DOWNSAMPLED",
            "@size": "4511",
            "@ref": "fx2",
            "@mimetype": "image/jpeg"
          },
          {
            "@category": "standard",
            "@height": "50",
            "@width": "496",
            "@_fa": "true",
            "$": "https://api.elsevier.com/content/object/eid/1-s2.0-S0926860X2500119X-fx1.jpg?httpAccept=%2A%2F%2A",
            "@multimediatype": "JPEG image file",
            "@type": "IMAGE-DOWNSAMPLED",
            "@size": "6509",
            "@ref": "fx1",
            "@mimetype": "image/jpeg"
          },
          {
            "@category": "standard",
            "@height": "200",
            "@width": "449",
            "@_fa": "true",
            "$": "https://api.elsevier.com/content/object/eid/1-s2.0-S0926860X2500119X-ga1.jpg?httpAccept=%2A%2F%2A",
            "@multimediatype": "JPEG image file",
            "@type": "IMAGE-DOWNSAMPLED",
            "@size": "26339",
            "@ref": "ga1",
            "@mimetype": "image/jpeg"
          },
          {
            "@category": "thumbnail",
            "@height": "89",
            "@width": "219",
            "@_fa": "true",
            "$": "https://api.elsevier.com/content/object/eid/1-s2.0-S0926860X2500119X-gr8.sml?httpAccept=%2A%2F%2A",
            "@multimediatype": "GIF image file",
            "@type": "IMAGE-THUMBNAIL",
            "@size": "6687",
            "@ref": "gr8",
            "@mimetype": "image/gif"
          },
          {
            "@category": "thumbnail",
            "@height": "80",
            "@width": "219",
            "@_fa": "true",
            "$": "https://api.elsevier.com/content/object/eid/1-s2.0-S0926860X2500119X-gr7.sml?httpAccept=%2A%2F%2A",
            "@multimediatype": "GIF image file",
            "@type": "IMAGE-THUMBNAIL",
            "@size": "6473",
            "@ref": "gr7",
            "@mimetype": "image/gif"
          },
          {
            "@category": "thumbnail",
            "@height": "23",
            "@width": "219",
            "@_fa": "true",
            "$": "https://api.elsevier.com/content/object/eid/1-s2.0-S0926860X2500119X-fx15.sml?httpAccept=%2A%2F%2A",
            "@multimediatype": "GIF image file",
            "@type": "IMAGE-THUMBNAIL",
            "@size": "1993",
            "@ref": "fx15",
            "@mimetype": "image/gif"
          },
          {
            "@category": "thumbnail",
            "@height": "88",
            "@width": "219",
            "@_fa": "true",
            "$": "https://api.elsevier.com/content/object/eid/1-s2.0-S0926860X2500119X-gr6.sml?httpAccept=%2A%2F%2A",
            "@multimediatype": "GIF image file",
            "@type": "IMAGE-THUMBNAIL",
            "@size": "7033",
            "@ref": "gr6",
            "@mimetype": "image/gif"
          },
          {
            "@category": "thumbnail",
            "@height": "20",
            "@width": "219",
            "@_fa": "true",
            "$": "https://api.elsevier.com/content/object/eid/1-s2.0-S0926860X2500119X-fx16.sml?httpAccept=%2A%2F%2A",
            "@multimediatype": "GIF image file",
            "@type": "IMAGE-THUMBNAIL",
            "@size": "1956",
            "@ref": "fx16",
            "@mimetype": "image/gif"
          },
          {
            "@category": "thumbnail",
            "@height": "86",
            "@width": "219",
            "@_fa": "true",
            "$": "https://api.elsevier.com/content/object/eid/1-s2.0-S0926860X2500119X-gr5.sml?httpAccept=%2A%2F%2A",
            "@multimediatype": "GIF image file",
            "@type": "IMAGE-THUMBNAIL",
            "@size": "5120",
            "@ref": "gr5",
            "@mimetype": "image/gif"
          },
          {
            "@category": "thumbnail",
            "@height": "30",
            "@width": "219",
            "@_fa": "true",
            "$": "https://api.elsevier.com/content/object/eid/1-s2.0-S0926860X2500119X-fx7.sml?httpAccept=%2A%2F%2A",
            "@multimediatype": "GIF image file",
            "@type": "IMAGE-THUMBNAIL",
            "@size": "2003",
            "@ref": "fx7",
            "@mimetype": "image/gif"
          },
          {
            "@category": "thumbnail",
            "@height": "32",
            "@width": "219",
            "@_fa": "true",
            "$": "https://api.elsevier.com/content/object/eid/1-s2.0-S0926860X2500119X-fx6.sml?httpAccept=%2A%2F%2A",
            "@multimediatype": "GIF image file",
            "@type": "IMAGE-THUMBNAIL",
            "@size": "2123",
            "@ref": "fx6",
            "@mimetype": "image/gif"
          },
          {
            "@category": "thumbnail",
            "@height": "20",
            "@width": "219",
            "@_fa": "true",
            "$": "https://api.elsevier.com/content/object/eid/1-s2.0-S0926860X2500119X-fx10.sml?httpAccept=%2A%2F%2A",
            "@multimediatype": "GIF image file",
            "@type": "IMAGE-THUMBNAIL",
            "@size": "1854",
            "@ref": "fx10",
            "@mimetype": "image/gif"
          },
          {
            "@category": "thumbnail",
            "@height": "20",
            "@width": "219",
            "@_fa": "true",
            "$": "https://api.elsevier.com/content/object/eid/1-s2.0-S0926860X2500119X-fx5.sml?httpAccept=%2A%2F%2A",
            "@multimediatype": "GIF image file",
            "@type": "IMAGE-THUMBNAIL",
            "@size": "1815",
            "@ref": "fx5",
            "@mimetype": "image/gif"
          },
          {
            "@category": "thumbnail",
            "@height": "28",
            "@width": "219",
            "@_fa": "true",
            "$": "https://api.elsevier.com/content/object/eid/1-s2.0-S0926860X2500119X-fx4.sml?httpAccept=%2A%2F%2A",
            "@multimediatype": "GIF image file",
            "@type": "IMAGE-THUMBNAIL",
            "@size": "2025",
            "@ref": "fx4",
            "@mimetype": "image/gif"
          },
          {
            "@category": "thumbnail",
            "@height": "28",
            "@width": "219",
            "@_fa": "true",
            "$": "https://api.elsevier.com/content/object/eid/1-s2.0-S0926860X2500119X-fx13.sml?httpAccept=%2A%2F%2A",
            "@multimediatype": "GIF image file",
            "@type": "IMAGE-THUMBNAIL",
            "@size": "2059",
            "@ref": "fx13",
            "@mimetype": "image/gif"
          },
          {
            "@category": "thumbnail",
            "@height": "164",
            "@width": "159",
            "@_fa": "true",
            "$": "https://api.elsevier.com/content/object/eid/1-s2.0-S0926860X2500119X-gr4.sml?httpAccept=%2A%2F%2A",
            "@multimediatype": "GIF image file",
            "@type": "IMAGE-THUMBNAIL",
            "@size": "17135",
            "@ref": "gr4",
            "@mimetype": "image/gif"
          },
          {
            "@category": "thumbnail",
            "@height": "22",
            "@width": "219",
            "@_fa": "true",
            "$": "https://api.elsevier.com/content/object/eid/1-s2.0-S0926860X2500119X-fx14.sml?httpAccept=%2A%2F%2A",
            "@multimediatype": "GIF image file",
            "@type": "IMAGE-THUMBNAIL",
            "@size": "1911",
            "@ref": "fx14",
            "@mimetype": "image/gif"
          },
          {
            "@category": "thumbnail",
            "@height": "163",
            "@width": "154",
            "@_fa": "true",
            "$": "https://api.elsevier.com/content/object/eid/1-s2.0-S0926860X2500119X-gr3.sml?httpAccept=%2A%2F%2A",
            "@multimediatype": "GIF image file",
            "@type": "IMAGE-THUMBNAIL",
            "@size": "13285",
            "@ref": "gr3",
            "@mimetype": "image/gif"
          },
          {
            "@category": "thumbnail",
            "@height": "29",
            "@width": "219",
            "@_fa": "true",
            "$": "https://api.elsevier.com/content/object/eid/1-s2.0-S0926860X2500119X-fx9.sml?httpAccept=%2A%2F%2A",
            "@multimediatype": "GIF image file",
            "@type": "IMAGE-THUMBNAIL",
            "@size": "2032",
            "@ref": "fx9",
            "@mimetype": "image/gif"
          },
          {
            "@category": "thumbnail",
            "@height": "33",
            "@width": "219",
            "@_fa": "true",
            "$": "https://api.elsevier.com/content/object/eid/1-s2.0-S0926860X2500119X-fx11.sml?httpAccept=%2A%2F%2A",
            "@multimediatype": "GIF image file",
            "@type": "IMAGE-THUMBNAIL",
            "@size": "2207",
            "@ref": "fx11",
            "@mimetype": "image/gif"
          },
          {
            "@category": "thumbnail",
            "@height": "87",
            "@width": "219",
            "@_fa": "true",
            "$": "https://api.elsevier.com/content/object/eid/1-s2.0-S0926860X2500119X-gr2.sml?httpAccept=%2A%2F%2A",
            "@multimediatype": "GIF image file",
            "@type": "IMAGE-THUMBNAIL",
            "@size": "5155",
            "@ref": "gr2",
            "@mimetype": "image/gif"
          },
          {
            "@category": "thumbnail",
            "@height": "20",
            "@width": "219",
            "@_fa": "true",
            "$": "https://api.elsevier.com/content/object/eid/1-s2.0-S0926860X2500119X-fx8.sml?httpAccept=%2A%2F%2A",
            "@multimediatype": "GIF image file",
            "@type": "IMAGE-THUMBNAIL",
            "@size": "1941",
            "@ref": "fx8",
            "@mimetype": "image/gif"
          },
          {
            "@category": "thumbnail",
            "@height": "21",
            "@width": "219",
            "@_fa": "true",
            "$": "https://api.elsevier.com/content/object/eid/1-s2.0-S0926860X2500119X-fx12.sml?httpAccept=%2A%2F%2A",
            "@multimediatype": "GIF image file",
            "@type": "IMAGE-THUMBNAIL",
            "@size": "1909",
            "@ref": "fx12",
            "@mimetype": "image/gif"
          },
          {
            "@category": "thumbnail",
            "@height": "81",
            "@width": "219",
            "@_fa": "true",
            "$": "https://api.elsevier.com/content/object/eid/1-s2.0-S0926860X2500119X-gr1.sml?httpAccept=%2A%2F%2A",
            "@multimediatype": "GIF image file",
            "@type": "IMAGE-THUMBNAIL",
            "@size": "5923",
            "@ref": "gr1",
            "@mimetype": "image/gif"
          },
          {
            "@category": "thumbnail",
            "@height": "19",
            "@width": "219",
            "@_fa": "true",
            "$": "https://api.elsevier.com/content/object/eid/1-s2.0-S0926860X2500119X-fx3.sml?httpAccept=%2A%2F%2A",
            "@multimediatype": "GIF image file",
            "@type": "IMAGE-THUMBNAIL",
            "@size": "1874",
            "@ref": "fx3",
            "@mimetype": "image/gif"
          },
          {
            "@category": "thumbnail",
            "@height": "100",
            "@width": "219",
            "@_fa": "true",
            "$": "https://api.elsevier.com/content/object/eid/1-s2.0-S0926860X2500119X-sc1.sml?httpAccept=%2A%2F%2A",
            "@multimediatype": "GIF image file",
            "@type": "IMAGE-THUMBNAIL",
            "@size": "3166",
            "@ref": "sc1",
            "@mimetype": "image/gif"
          },
          {
            "@category": "thumbnail",
            "@height": "29",
            "@width": "219",
            "@_fa": "true",
            "$": "https://api.elsevier.com/content/object/eid/1-s2.0-S0926860X2500119X-fx2.sml?httpAccept=%2A%2F%2A",
            "@multimediatype": "GIF image file",
            "@type": "IMAGE-THUMBNAIL",
            "@size": "1955",
            "@ref": "fx2",
            "@mimetype": "image/gif"
          },
          {
            "@category": "thumbnail",
            "@height": "22",
            "@width": "219",
            "@_fa": "true",
            "$": "https://api.elsevier.com/content/object/eid/1-s2.0-S0926860X2500119X-fx1.sml?httpAccept=%2A%2F%2A",
            "@multimediatype": "GIF image file",
            "@type": "IMAGE-THUMBNAIL",
            "@size": "1955",
            "@ref": "fx1",
            "@mimetype": "image/gif"
          },
          {
            "@category": "thumbnail",
            "@height": "97",
            "@width": "219",
            "@_fa": "true",
            "$": "https://api.elsevier.com/content/object/eid/1-s2.0-S0926860X2500119X-ga1.sml?httpAccept=%2A%2F%2A",
            "@multimediatype": "GIF image file",
            "@type": "IMAGE-THUMBNAIL",
            "@size": "7642",
            "@ref": "ga1",
            "@mimetype": "image/gif"
          },
          {
            "@category": "high",
            "@height": "1218",
            "@width": "2994",
            "@_fa": "true",
            "$": "https://api.elsevier.com/content/object/eid/1-s2.0-S0926860X2500119X-gr8_lrg.jpg?httpAccept=%2A%2F%2A",
            "@multimediatype": "JPEG image file",
            "@type": "IMAGE-HIGH-RES",
            "@size": "280219",
            "@ref": "gr8",
            "@mimetype": "image/jpeg"
          },
          {
            "@category": "high",
            "@height": "1097",
            "@width": "2994",
            "@_fa": "true",
            "$": "https://api.elsevier.com/content/object/eid/1-s2.0-S0926860X2500119X-gr7_lrg.jpg?httpAccept=%2A%2F%2A",
            "@multimediatype": "JPEG image file",
            "@type": "IMAGE-HIGH-RES",
            "@size": "369579",
            "@ref": "gr7",
            "@mimetype": "image/jpeg"
          },
          {
            "@category": "high",
            "@height": "204",
            "@width": "1945",
            "@_fa": "true",
            "$": "https://api.elsevier.com/content/object/eid/1-s2.0-S0926860X2500119X-fx15_lrg.jpg?httpAccept=%2A%2F%2A",
            "@multimediatype": "JPEG image file",
            "@type": "IMAGE-HIGH-RES",
            "@size": "33492",
            "@ref": "fx15",
            "@mimetype": "image/jpeg"
          },
          {
            "@category": "high",
            "@height": "1209",
            "@width": "2994",
            "@_fa": "true",
            "$": "https://api.elsevier.com/content/object/eid/1-s2.0-S0926860X2500119X-gr6_lrg.jpg?httpAccept=%2A%2F%2A",
            "@multimediatype": "JPEG image file",
            "@type": "IMAGE-HIGH-RES",
            "@size": "297323",
            "@ref": "gr6",
            "@mimetype": "image/jpeg"
          },
          {
            "@category": "high",
            "@height": "219",
            "@width": "2349",
            "@_fa": "true",
            "$": "https://api.elsevier.com/content/object/eid/1-s2.0-S0926860X2500119X-fx16_lrg.jpg?httpAccept=%2A%2F%2A",
            "@multimediatype": "JPEG image file",
            "@type": "IMAGE-HIGH-RES",
            "@size": "41841",
            "@ref": "fx16",
            "@mimetype": "image/jpeg"
          },
          {
            "@category": "high",
            "@height": "1182",
            "@width": "2994",
            "@_fa": "true",
            "$": "https://api.elsevier.com/content/object/eid/1-s2.0-S0926860X2500119X-gr5_lrg.jpg?httpAccept=%2A%2F%2A",
            "@multimediatype": "JPEG image file",
            "@type": "IMAGE-HIGH-RES",
            "@size": "250686",
            "@ref": "gr5",
            "@mimetype": "image/jpeg"
          },
          {
            "@category": "high",
            "@height": "207",
            "@width": "1491",
            "@_fa": "true",
            "$": "https://api.elsevier.com/content/object/eid/1-s2.0-S0926860X2500119X-fx7_lrg.jpg?httpAccept=%2A%2F%2A",
            "@multimediatype": "JPEG image file",
            "@type": "IMAGE-HIGH-RES",
            "@size": "22396",
            "@ref": "fx7",
            "@mimetype": "image/jpeg"
          },
          {
            "@category": "high",
            "@height": "213",
            "@width": "1453",
            "@_fa": "true",
            "$": "https://api.elsevier.com/content/object/eid/1-s2.0-S0926860X2500119X-fx6_lrg.jpg?httpAccept=%2A%2F%2A",
            "@multimediatype": "JPEG image file",
            "@type": "IMAGE-HIGH-RES",
            "@size": "22843",
            "@ref": "fx6",
            "@mimetype": "image/jpeg"
          },
          {
            "@category": "high",
            "@height": "222",
            "@width": "2408",
            "@_fa": "true",
            "$": "https://api.elsevier.com/content/object/eid/1-s2.0-S0926860X2500119X-fx10_lrg.jpg?httpAccept=%2A%2F%2A",
            "@multimediatype": "JPEG image file",
            "@type": "IMAGE-HIGH-RES",
            "@size": "41032",
            "@ref": "fx10",
            "@mimetype": "image/jpeg"
          },
          {
            "@category": "high",
            "@height": "210",
            "@width": "2303",
            "@_fa": "true",
            "$": "https://api.elsevier.com/content/object/eid/1-s2.0-S0926860X2500119X-fx5_lrg.jpg?httpAccept=%2A%2F%2A",
            "@multimediatype": "JPEG image file",
            "@type": "IMAGE-HIGH-RES",
            "@size": "33977",
            "@ref": "fx5",
            "@mimetype": "image/jpeg"
          },
          {
            "@category": "high",
            "@height": "219",
            "@width": "1734",
            "@_fa": "true",
            "$": "https://api.elsevier.com/content/object/eid/1-s2.0-S0926860X2500119X-fx4_lrg.jpg?httpAccept=%2A%2F%2A",
            "@multimediatype": "JPEG image file",
            "@type": "IMAGE-HIGH-RES",
            "@size": "26779",
            "@ref": "fx4",
            "@mimetype": "image/jpeg"
          },
          {
            "@category": "high",
            "@height": "210",
            "@width": "1618",
            "@_fa": "true",
            "$": "https://api.elsevier.com/content/object/eid/1-s2.0-S0926860X2500119X-fx13_lrg.jpg?httpAccept=%2A%2F%2A",
            "@multimediatype": "JPEG image file",
            "@type": "IMAGE-HIGH-RES",
            "@size": "24743",
            "@ref": "fx13",
            "@mimetype": "image/jpeg"
          },
          {
            "@category": "high",
            "@height": "2576",
            "@width": "2495",
            "@_fa": "true",
            "$": "https://api.elsevier.com/content/object/eid/1-s2.0-S0926860X2500119X-gr4_lrg.jpg?httpAccept=%2A%2F%2A",
            "@multimediatype": "JPEG image file",
            "@type": "IMAGE-HIGH-RES",
            "@size": "559910",
            "@ref": "gr4",
            "@mimetype": "image/jpeg"
          },
          {
            "@category": "high",
            "@height": "210",
            "@width": "2076",
            "@_fa": "true",
            "$": "https://api.elsevier.com/content/object/eid/1-s2.0-S0926860X2500119X-fx14_lrg.jpg?httpAccept=%2A%2F%2A",
            "@multimediatype": "JPEG image file",
            "@type": "IMAGE-HIGH-RES",
            "@size": "30541",
            "@ref": "fx14",
            "@mimetype": "image/jpeg"
          },
          {
            "@category": "high",
            "@height": "3175",
            "@width": "2994",
            "@_fa": "true",
            "$": "https://api.elsevier.com/content/object/eid/1-s2.0-S0926860X2500119X-gr3_lrg.jpg?httpAccept=%2A%2F%2A",
            "@multimediatype": "JPEG image file",
            "@type": "IMAGE-HIGH-RES",
            "@size": "843707",
            "@ref": "gr3",
            "@mimetype": "image/jpeg"
          },
          {
            "@category": "high",
            "@height": "213",
            "@width": "1629",
            "@_fa": "true",
            "$": "https://api.elsevier.com/content/object/eid/1-s2.0-S0926860X2500119X-fx9_lrg.jpg?httpAccept=%2A%2F%2A",
            "@multimediatype": "JPEG image file",
            "@type": "IMAGE-HIGH-RES",
            "@size": "25700",
            "@ref": "fx9",
            "@mimetype": "image/jpeg"
          },
          {
            "@category": "high",
            "@height": "212",
            "@width": "1417",
            "@_fa": "true",
            "$": "https://api.elsevier.com/content/object/eid/1-s2.0-S0926860X2500119X-fx11_lrg.jpg?httpAccept=%2A%2F%2A",
            "@multimediatype": "JPEG image file",
            "@type": "IMAGE-HIGH-RES",
            "@size": "22523",
            "@ref": "fx11",
            "@mimetype": "image/jpeg"
          },
          {
            "@category": "high",
            "@height": "1184",
            "@width": "2995",
            "@_fa": "true",
            "$": "https://api.elsevier.com/content/object/eid/1-s2.0-S0926860X2500119X-gr2_lrg.jpg?httpAccept=%2A%2F%2A",
            "@multimediatype": "JPEG image file",
            "@type": "IMAGE-HIGH-RES",
            "@size": "237854",
            "@ref": "gr2",
            "@mimetype": "image/jpeg"
          },
          {
            "@category": "high",
            "@height": "222",
            "@width": "2450",
            "@_fa": "true",
            "$": "https://api.elsevier.com/content/object/eid/1-s2.0-S0926860X2500119X-fx8_lrg.jpg?httpAccept=%2A%2F%2A",
            "@multimediatype": "JPEG image file",
            "@type": "IMAGE-HIGH-RES",
            "@size": "43218",
            "@ref": "fx8",
            "@mimetype": "image/jpeg"
          },
          {
            "@category": "high",
            "@height": "210",
            "@width": "2222",
            "@_fa": "true",
            "$": "https://api.elsevier.com/content/object/eid/1-s2.0-S0926860X2500119X-fx12_lrg.jpg?httpAccept=%2A%2F%2A",
            "@multimediatype": "JPEG image file",
            "@type": "IMAGE-HIGH-RES",
            "@size": "35198",
            "@ref": "fx12",
            "@mimetype": "image/jpeg"
          },
          {
            "@category": "high",
            "@height": "1101",
            "@width": "2994",
            "@_fa": "true",
            "$": "https://api.elsevier.com/content/object/eid/1-s2.0-S0926860X2500119X-gr1_lrg.jpg?httpAccept=%2A%2F%2A",
            "@multimediatype": "JPEG image file",
            "@type": "IMAGE-HIGH-RES",
            "@size": "313484",
            "@ref": "gr1",
            "@mimetype": "image/jpeg"
          },
          {
            "@category": "high",
            "@height": "222",
            "@width": "2540",
            "@_fa": "true",
            "$": "https://api.elsevier.com/content/object/eid/1-s2.0-S0926860X2500119X-fx3_lrg.jpg?httpAccept=%2A%2F%2A",
            "@multimediatype": "JPEG image file",
            "@type": "IMAGE-HIGH-RES",
            "@size": "43452",
            "@ref": "fx3",
            "@mimetype": "image/jpeg"
          },
          {
            "@category": "high",
            "@height": "1138",
            "@width": "2498",
            "@_fa": "true",
            "$": "https://api.elsevier.com/content/object/eid/1-s2.0-S0926860X2500119X-sc1_lrg.jpg?httpAccept=%2A%2F%2A",
            "@multimediatype": "JPEG image file",
            "@type": "IMAGE-HIGH-RES",
            "@size": "106694",
            "@ref": "sc1",
            "@mimetype": "image/jpeg"
          },
          {
            "@category": "high",
            "@height": "210",
            "@width": "1595",
            "@_fa": "true",
            "$": "https://api.elsevier.com/content/object/eid/1-s2.0-S0926860X2500119X-fx2_lrg.jpg?httpAccept=%2A%2F%2A",
            "@multimediatype": "JPEG image file",
            "@type": "IMAGE-HIGH-RES",
            "@size": "24197",
            "@ref": "fx2",
            "@mimetype": "image/jpeg"
          },
          {
            "@category": "high",
            "@height": "219",
            "@width": "2191",
            "@_fa": "true",
            "$": "https://api.elsevier.com/content/object/eid/1-s2.0-S0926860X2500119X-fx1_lrg.jpg?httpAccept=%2A%2F%2A",
            "@multimediatype": "JPEG image file",
            "@type": "IMAGE-HIGH-RES",
            "@size": "34487",
            "@ref": "fx1",
            "@mimetype": "image/jpeg"
          },
          {
            "@category": "high",
            "@height": "886",
            "@width": "1991",
            "@_fa": "true",
            "$": "https://api.elsevier.com/content/object/eid/1-s2.0-S0926860X2500119X-ga1_lrg.jpg?httpAccept=%2A%2F%2A",
            "@multimediatype": "JPEG image file",
            "@type": "IMAGE-HIGH-RES",
            "@size": "185629",
            "@ref": "ga1",
            "@mimetype": "image/jpeg"
          },
          {
            "@category": "standard",
            "@_fa": "true",
            "$": "https://api.elsevier.com/content/object/eid/1-s2.0-S0926860X2500119X-mmc1.docx?httpAccept=%2A%2F%2A",
            "@multimediatype": "Microsoft Word file",
            "@type": "APPLICATION",
            "@size": "271146",
            "@ref": "mmc1",
            "@mimetype": "application/word"
          },
          {
            "@category": "thumbnail",
            "@_fa": "true",
            "$": "https://api.elsevier.com/content/object/eid/1-s2.0-S0926860X2500119X-si0001.svg?httpAccept=%2A%2F%2A",
            "@multimediatype": "Scalable Vector Graphics file",
            "@type": "ALTIMG",
            "@size": "1588",
            "@ref": "si0001",
            "@mimetype": "image/svg+xml"
          },
          {
            "@category": "thumbnail",
            "@_fa": "true",
            "$": "https://api.elsevier.com/content/object/eid/1-s2.0-S0926860X2500119X-si0002.svg?httpAccept=%2A%2F%2A",
            "@multimediatype": "Scalable Vector Graphics file",
            "@type": "ALTIMG",
            "@size": "1559",
            "@ref": "si0002",
            "@mimetype": "image/svg+xml"
          },
          {
            "@category": "thumbnail",
            "@_fa": "true",
            "$": "https://api.elsevier.com/content/object/eid/1-s2.0-S0926860X2500119X-si0003.svg?httpAccept=%2A%2F%2A",
            "@multimediatype": "Scalable Vector Graphics file",
            "@type": "ALTIMG",
            "@size": "1965",
            "@ref": "si0003",
            "@mimetype": "image/svg+xml"
          },
          {
            "@category": "thumbnail",
            "@_fa": "true",
            "$": "https://api.elsevier.com/content/object/eid/1-s2.0-S0926860X2500119X-si0004.svg?httpAccept=%2A%2F%2A",
            "@multimediatype": "Scalable Vector Graphics file",
            "@type": "ALTIMG",
            "@size": "2325",
            "@ref": "si0004",
            "@mimetype": "image/svg+xml"
          },
          {
            "@category": "thumbnail",
            "@_fa": "true",
            "$": "https://api.elsevier.com/content/object/eid/1-s2.0-S0926860X2500119X-si0005.svg?httpAccept=%2A%2F%2A",
            "@multimediatype": "Scalable Vector Graphics file",
            "@type": "ALTIMG",
            "@size": "2208",
            "@ref": "si0005",
            "@mimetype": "image/svg+xml"
          },
          {
            "@category": "thumbnail",
            "@_fa": "true",
            "$": "https://api.elsevier.com/content/object/eid/1-s2.0-S0926860X2500119X-si0006.svg?httpAccept=%2A%2F%2A",
            "@multimediatype": "Scalable Vector Graphics file",
            "@type": "ALTIMG",
            "@size": "2321",
            "@ref": "si0006",
            "@mimetype": "image/svg+xml"
          }
        ]
      },
      "link": {
        "@rel": "abstract",
        "@href": "https://api.elsevier.com/content/abstract/scopus_id/86000733882"
      }
    }
  }
}