{
  "metadata": {
    "title": "Bi-doped CuCeO<ce:inf loc=post>2−x</ce:inf> nanorod catalysts for photothermal CO-PROX in H<ce:inf loc=post>2</ce:inf>-rich streams: Enhanced oxygen vacancy and light absorption capacity",
    "authors": "; ; ",
    "journal": "Applied Catalysis A: General",
    "date": "2024-01-25",
    "doi": "10.1016/j.apcata.2023.119540",
    "abstract": "",
    "uri": "https://api.elsevier.com/content/article/pii/S0926860X23005203",
    "pii": "S0926860X23005203"
  },
  "fulltext": {
    "full-text-retrieval-response": {
      "scopus-eid": "2-s2.0-85181713498",
      "originalText": "serial JL 271346 291210 291744 291809 31 Applied Catalysis A: General APPLIEDCATALYSISAGENERAL 2023-12-14 2023-12-14 2023-12-16 2023-12-16 2024-01-19T20:53:16 1-s2.0-S0926860X23005203 S0926-860X(23)00520-3 S0926860X23005203 10.1016/j.apcata.2023.119540 S300 S300.1 FULL-TEXT 1-s2.0-S0926860X23X00210 2024-01-24T02:10:09.441472Z 0 0 20240125 2024 2023-12-14T22:35:35.39434Z absattachment articleinfo articlenumber articletitlenorm authfirstinitialnorm authfirstsurnamenorm cid cids contenttype copyright crossmark dateloaded dateloadedtxt datesearch datesort dateupdated dco docsubtype doctype doi eid ewtransactionid hubeid indexeddate issn issnnorm itemstage itemtransactionid itemweight openaccess openarchive pg pgfirst pii piinorm pubdatestart pubdatetxt pubyr sortorder srctitle srctitlenorm srctype ssids alllist content subj subheadings suppl tomb volfirst volissue volumelist webpdf webpdfpagecount yearnav figure table e-component body mmlmath acknowledge affil appendices articletitle auth authfirstini authfull authkeywords authlast footnotes grantnumber grantsponsor highlightsabst primabst ref specialabst 0926-860X 0926860X true 670 670 C Volume 670 15 119540 119540 119540 20240125 25 January 2024 2024-01-25 2024 article fla © 2023 Elsevier B.V. All rights reserved. BIDOPEDCUCEO2XNANORODCATALYSTSFORPHOTOTHERMALCOPROXINH2RICHSTREAMSENHANCEDOXYGENVACANCYLIGHTABSORPTIONCAPACITY CHENG W 1 Introduction 2 Experimental section 2.1 Chemicals and materials 2.2 Preparation of Bi-doped CeO2 (Bi/CeO2−x) nanorod supports 2.3 Loading of CuO on Bi/CeO2−x nanorod supports 2.4 Catalyst characterization 2.5 Catalyst performance 3 Results and discussion 3.1 Structural properties of catalysts 3.2 XPS and UV-Raman of catalysts 3.3 Redox properties and active oxygen species of catalysts 3.4 Optical properties of catalysts 3.5 Catalytic performance evaluation of catalysts 4 Conclusion CRediT authorship contribution statement Acknowledgements Appendix A Supplementary material References SHEN 2023 142326 Q PAN 2023 763 772 S MONTINI 2016 5987 6041 T BION 2008 76 88 N GUO 2017 39 53 X GUO 2017 119 128 X WANG 2017 21955 21968 J WANG 2017 241 252 J GUO 2016 3862 3871 X GUO 2020 4766 4775 X QIU 2021 9178 9189 Z GUO 2020 227757 X ZHAO 2021 229181 Y ZHOU 2023 144835 A YANG 2015 194 205 K WEI 2021 1078 1095 L SONG 2022 52 83 C XIONG 2022 4965 4972 Y LOU 2019 653 659 Z HUANG 2021 9618 9678 X LIU 2020 3794 3801 B WANG 2020 8280 8286 F GUO 2022 121334 X BHAT 2017 3001 3018 S WU 2011 4575 4582 Z MITTAL 2019 3186 3207 A CHEN 2018 442 448 T CHEN 2019 103375 J LINGXIA 2021 88 96 Z ZHANG 2019 21968 21974 T SAJJAD 2010 13795 13804 S QIU 2022 154100 Z XIONG 2017 21840 21847 Y WANG 2019 4573 4581 M LIOTTA 2006 217 227 L XIAOHONG 2007 167 171 W GUO 2020 110297 X YE 2023 862 869 Y LORIDANT 2020 98 111 S ANSARI 2023 122103 K GUO 2018 25983 25994 X SU 2016 231 240 Y HE 2021 26018 26029 J MOSTAFA 2022 1479 M JIANG 2020 122182 C SUN 2007 1785 1790 C GUO 2023 113416 X CHENGX2024X119540 CHENGX2024X119540XW 2025-12-16T00:00:00.000Z 2025-12-16T00:00:00.000Z http://creativecommons.org/licenses/by-nc-nd/4.0/ © 2023 Elsevier B.V. All rights reserved. 2024-01-12T12:40:22.148Z http://vtw.elsevier.com/data/voc/AddOnTypes/50.7/aggregated-refined Fundamental Research Funds for the Provincial Universities of Zhejiang Fundamental Research Funds for the Provincial Universities of Zhejiang http://data.elsevier.com/vocabulary/SciValFunders/100022955 http://sws.geonames.org/1814991/ Zhejiang Provincial Natural Science Foundation of China ZJNSF Natural Science Foundation of Zhejiang Province http://data.elsevier.com/vocabulary/SciValFunders/501100004731 http://sws.geonames.org/1814991/ We gratefully acknowledge the financial support from the Zhejiang Provincial Natural Science Foundation of China (No. LQ21B030012 ) and the Fundamental Research Funds for the Provincial Universities of Zhejiang (No. 2022YW56 ). https://doi.org/10.15223/policy-017 https://doi.org/10.15223/policy-037 https://doi.org/10.15223/policy-012 https://doi.org/10.15223/policy-029 https://doi.org/10.15223/policy-004 item S0926-860X(23)00520-3 S0926860X23005203 1-s2.0-S0926860X23005203 10.1016/j.apcata.2023.119540 271346 2024-01-24T02:10:09.441472Z 2024-01-25 1-s2.0-S0926860X23005203-main.pdf https://s3-eu-west-1.amazonaws.com/prod-ucs-content-store-eu-west/content/pii:S0926860X23005203/MAIN/application/pdf/c6464f279631981efcfe1e1e00d3a8f6/main.pdf main.pdf pdf true 9290948 MAIN 11 1-s2.0-S0926860X23005203-main_1.png https://s3-eu-west-1.amazonaws.com/prod-ucs-content-store-eu-west/content/pii:S0926860X23005203/PREVIEW/image/png/8e6b2fe38963d8a2833fd6c67b475e23/main_1.png main_1.png png 58163 849 656 IMAGE-WEB-PDF 1 1-s2.0-S0926860X23005203-gr6.jpg https://s3-eu-west-1.amazonaws.com/prod-ucs-content-store-eu-west/content/pii:S0926860X23005203/gr6/DOWNSAMPLED/image/jpeg/4fd976681b0b3f1c830e6588d5d17bdf/gr6.jpg gr6 gr6.jpg jpg 41519 279 750 IMAGE-DOWNSAMPLED 1-s2.0-S0926860X23005203-gr7.jpg https://s3-eu-west-1.amazonaws.com/prod-ucs-content-store-eu-west/content/pii:S0926860X23005203/gr7/DOWNSAMPLED/image/jpeg/c6d4d6477be5af12408196dd902b1a28/gr7.jpg gr7 gr7.jpg jpg 11113 234 376 IMAGE-DOWNSAMPLED 1-s2.0-S0926860X23005203-gr4.jpg https://s3-eu-west-1.amazonaws.com/prod-ucs-content-store-eu-west/content/pii:S0926860X23005203/gr4/DOWNSAMPLED/image/jpeg/f171d93f1e11267bbd65987b75f1e255/gr4.jpg gr4 gr4.jpg jpg 79567 620 751 IMAGE-DOWNSAMPLED 1-s2.0-S0926860X23005203-gr5.jpg https://s3-eu-west-1.amazonaws.com/prod-ucs-content-store-eu-west/content/pii:S0926860X23005203/gr5/DOWNSAMPLED/image/jpeg/566f2b32b1c998ca0d49ca1289b13802/gr5.jpg gr5 gr5.jpg jpg 44655 273 753 IMAGE-DOWNSAMPLED 1-s2.0-S0926860X23005203-gr2.jpg https://s3-eu-west-1.amazonaws.com/prod-ucs-content-store-eu-west/content/pii:S0926860X23005203/gr2/DOWNSAMPLED/image/jpeg/5851b3f6f41606480a3b0b37bc808482/gr2.jpg gr2 gr2.jpg jpg 108604 888 764 IMAGE-DOWNSAMPLED 1-s2.0-S0926860X23005203-ga1.jpg https://s3-eu-west-1.amazonaws.com/prod-ucs-content-store-eu-west/content/pii:S0926860X23005203/ga1/DOWNSAMPLED/image/jpeg/ca4ae6c91afd9e4c74ae86e8f414f317/ga1.jpg ga1 true ga1.jpg jpg 18757 245 231 IMAGE-DOWNSAMPLED 1-s2.0-S0926860X23005203-gr3.jpg https://s3-eu-west-1.amazonaws.com/prod-ucs-content-store-eu-west/content/pii:S0926860X23005203/gr3/DOWNSAMPLED/image/jpeg/53390cdbf55f7730176b2b4b6c455b68/gr3.jpg gr3 gr3.jpg jpg 61720 598 751 IMAGE-DOWNSAMPLED 1-s2.0-S0926860X23005203-gr1.jpg https://s3-eu-west-1.amazonaws.com/prod-ucs-content-store-eu-west/content/pii:S0926860X23005203/gr1/DOWNSAMPLED/image/jpeg/31e0521f471c40eb9a5f854bc4bf3d46/gr1.jpg gr1 gr1.jpg jpg 116670 583 753 IMAGE-DOWNSAMPLED 1-s2.0-S0926860X23005203-gr6.sml https://s3-eu-west-1.amazonaws.com/prod-ucs-content-store-eu-west/content/pii:S0926860X23005203/gr6/THUMBNAIL/image/gif/31971a4aa96eadc04296c9f4b32ffb09/gr6.sml gr6 gr6.sml sml 5031 82 219 IMAGE-THUMBNAIL 1-s2.0-S0926860X23005203-gr7.sml https://s3-eu-west-1.amazonaws.com/prod-ucs-content-store-eu-west/content/pii:S0926860X23005203/gr7/THUMBNAIL/image/gif/fdc9c4617188b4976c91ddb05a7fdf40/gr7.sml gr7 gr7.sml sml 3976 136 219 IMAGE-THUMBNAIL 1-s2.0-S0926860X23005203-gr4.sml https://s3-eu-west-1.amazonaws.com/prod-ucs-content-store-eu-west/content/pii:S0926860X23005203/gr4/THUMBNAIL/image/gif/964d0227c618638b6284fbbb7a8bc354/gr4.sml gr4 gr4.sml sml 9076 164 199 IMAGE-THUMBNAIL 1-s2.0-S0926860X23005203-gr5.sml https://s3-eu-west-1.amazonaws.com/prod-ucs-content-store-eu-west/content/pii:S0926860X23005203/gr5/THUMBNAIL/image/gif/c6a25abdb9ac66898634731f4df6ee79/gr5.sml gr5 gr5.sml sml 5392 79 219 IMAGE-THUMBNAIL 1-s2.0-S0926860X23005203-gr2.sml https://s3-eu-west-1.amazonaws.com/prod-ucs-content-store-eu-west/content/pii:S0926860X23005203/gr2/THUMBNAIL/image/gif/b95a839fc2940d3e56de48b4e49d71fd/gr2.sml gr2 gr2.sml sml 6507 164 141 IMAGE-THUMBNAIL 1-s2.0-S0926860X23005203-ga1.sml https://s3-eu-west-1.amazonaws.com/prod-ucs-content-store-eu-west/content/pii:S0926860X23005203/ga1/THUMBNAIL/image/gif/2e216c3add1baf097b4dd6408dedbf99/ga1.sml ga1 true ga1.sml sml 10814 164 155 IMAGE-THUMBNAIL 1-s2.0-S0926860X23005203-gr3.sml https://s3-eu-west-1.amazonaws.com/prod-ucs-content-store-eu-west/content/pii:S0926860X23005203/gr3/THUMBNAIL/image/gif/f7ec1bcf645b2affa7af724c366e6fb0/gr3.sml gr3 gr3.sml sml 6286 164 206 IMAGE-THUMBNAIL 1-s2.0-S0926860X23005203-gr1.sml https://s3-eu-west-1.amazonaws.com/prod-ucs-content-store-eu-west/content/pii:S0926860X23005203/gr1/THUMBNAIL/image/gif/84633c13b553160d8ee9dccc9a50f35d/gr1.sml gr1 gr1.sml sml 15637 164 212 IMAGE-THUMBNAIL 1-s2.0-S0926860X23005203-gr6_lrg.jpg https://s3-eu-west-1.amazonaws.com/prod-ucs-content-store-eu-west/content/pii:S0926860X23005203/HIGHRES/image/jpeg/a2b7c0afdd3adbd0d5aef82501edd784/gr6_lrg.jpg gr6 gr6_lrg.jpg jpg 255504 1234 3313 IMAGE-HIGH-RES 1-s2.0-S0926860X23005203-gr7_lrg.jpg https://s3-eu-west-1.amazonaws.com/prod-ucs-content-store-eu-west/content/pii:S0926860X23005203/HIGHRES/image/jpeg/2fe82fccb0a2a07abab4fe0100c5485f/gr7_lrg.jpg gr7 gr7_lrg.jpg jpg 62307 1036 1663 IMAGE-HIGH-RES 1-s2.0-S0926860X23005203-gr4_lrg.jpg https://s3-eu-west-1.amazonaws.com/prod-ucs-content-store-eu-west/content/pii:S0926860X23005203/HIGHRES/image/jpeg/e96d27179a2ccdb7a4edd84f5e92b232/gr4_lrg.jpg gr4 gr4_lrg.jpg jpg 524692 2743 3324 IMAGE-HIGH-RES 1-s2.0-S0926860X23005203-gr5_lrg.jpg https://s3-eu-west-1.amazonaws.com/prod-ucs-content-store-eu-west/content/pii:S0926860X23005203/HIGHRES/image/jpeg/f5ee39fee5aeec7086dc5760e841703b/gr5_lrg.jpg gr5 gr5_lrg.jpg jpg 271242 1205 3326 IMAGE-HIGH-RES 1-s2.0-S0926860X23005203-gr2_lrg.jpg https://s3-eu-west-1.amazonaws.com/prod-ucs-content-store-eu-west/content/pii:S0926860X23005203/HIGHRES/image/jpeg/eb47635e1b5c363f4ac4cb9b6eecd8bc/gr2_lrg.jpg gr2 gr2_lrg.jpg jpg 684976 3925 3376 IMAGE-HIGH-RES 1-s2.0-S0926860X23005203-ga1_lrg.jpg https://s3-eu-west-1.amazonaws.com/prod-ucs-content-store-eu-west/content/pii:S0926860X23005203/HIGHRES/image/jpeg/8ecd85850f923e37870db6563b27521b/ga1_lrg.jpg ga1 true ga1_lrg.jpg jpg 137383 1085 1025 IMAGE-HIGH-RES 1-s2.0-S0926860X23005203-gr3_lrg.jpg https://s3-eu-west-1.amazonaws.com/prod-ucs-content-store-eu-west/content/pii:S0926860X23005203/HIGHRES/image/jpeg/0a0c0cb386cb8f26c3c5d587cf23c28e/gr3_lrg.jpg gr3 gr3_lrg.jpg jpg 415184 2649 3325 IMAGE-HIGH-RES 1-s2.0-S0926860X23005203-gr1_lrg.jpg https://s3-eu-west-1.amazonaws.com/prod-ucs-content-store-eu-west/content/pii:S0926860X23005203/HIGHRES/image/jpeg/6a37b6aec4809762f09133f7e89b6e65/gr1_lrg.jpg gr1 gr1_lrg.jpg jpg 755946 2575 3326 IMAGE-HIGH-RES 1-s2.0-S0926860X23005203-mmc1.docx https://s3-eu-west-1.amazonaws.com/prod-ucs-content-store-eu-west/content/pii:S0926860X23005203/mmc1/MAIN/application/vnd.openxmlformats-officedocument.wordprocessingml.document/6e8293139ac2ad24d9ced9ebe70fb701/mmc1.docx mmc1 mmc1.docx docx 1849846 APPLICATION 1-s2.0-S0926860X23005203-si0001.svg https://s3-eu-west-1.amazonaws.com/prod-ucs-content-store-eu-west/content/pii:S0926860X23005203/image/svg+xml/522ae1b4d579a504bab7553f8b8bb331/si0001.svg si0001 si0001.svg svg 3306 ALTIMG 1-s2.0-S0926860X23005203-si0002.svg https://s3-eu-west-1.amazonaws.com/prod-ucs-content-store-eu-west/content/pii:S0926860X23005203/image/svg+xml/1857663738178e7e786c00e5de47224d/si0002.svg si0002 si0002.svg svg 4526 ALTIMG 1-s2.0-S0926860X23005203-am.pdf am am.pdf pdf 1328443 AAM-PDF https://s3-eu-west-1.amazonaws.com/prod-ucs-content-store-eu-west/content/egi:10P1PNS0HQR/MAIN/application/pdf/dd65177e7f26de5dfbbd94f722cb15bd/am.pdf APCATA 119540 119540 S0926-860X(23)00520-3 10.1016/j.apcata.2023.119540 Elsevier B.V. Fig. 1 (a-b) HRTEM images of Bi-CuCeO2−x-2.5 nanorod catalyst (c)XRD diffractograms and (d) N2 isothermal adsorption-desorption curves of Bi/CuCeO2−x nanorod catalysts. Fig. 1 Fig. 2 XPS spectra (a-d: Cu 2p, Ce 3d, Bi 4 f and O1s) and Raman spectra (e) of CuCeO2−x and Bi/CuCeO2−x catalysts. Fig. 2 Fig. 3 The H2-TPR profiles at 50–400 °C (a) and 350–900 °C (b) and O2-TPD profiles (c) of CuCeO2−x, Bi/CuCeO2−x-2.5 and Bi/CuCeO2−x-7.5. Fig. 3 Fig. 4 UV–vis-IR absorption spectrum (a) of each catalyst, Tauc plots (Ahυ)2 vs hυ of each catalyst (b) and Photoluminescence spectra under 330 nm excitation (c) The transient photocurrent curves of CuCeO2−x and Bi/CuCeO2−x catalysts. Fig. 4 Fig. 5 The CO conversion and O2 selectivity of (a) CuCeO2−x nanorod catalysts with different Bi dopant amounts ((Reaction condition: 1%CO/0.5%O2/25%H2 +Ar, Light intensity: 250 mW·cm−2；WHSV：60000 mL·h−1·gcat−1) (b) and Bi/CuCeO2−x-2.5 for photothermal CO-PROX at different oxygen and CO concentrations (Reaction condition: 1%CO/0.5%O2/25%H2 +Ar, or 0.5%CO/0.5%O2/25%H2 +Ar, or 0.5%CO/1%O2/25%H2 +Ar; Light intensity:250 mW·cm−2；WHSV：60000 mL·h−1·gcat−1). Fig. 5 Fig. 6 CO conversion and O2 selectivity of (a) Bi/CuCeO2−x-2.5 for photothermal CO-PROX with/without 7.5 vol% H2O in the reaction gas of 0.5%CO/0.5%O2/25%H2 +Ar, (Reaction condition: 250 mW·cm−2；WHSV：60000 mL·h−1·gcat−1) and (b) Bi/CuCeO2−x-2.5 for photothermal CO-PROX at different illumination intensities (Reaction condition: 0.5%CO/0.5%O2/25%H2 +7.5 vol% H2O +Ar；WHSV：60000 mL·h−1·gcat−1). Fig. 6 Fig. 7 CO conversion curves of Bi/CuCeO2−x-2.5 in long term stability test for photothermal CO-PROX (Reaction condition: 0.5%CO/0.5%O2/25%H2 +Ar；WHSV：60000 mL·h−1·gcat−1; Light intensity: 250 mW·cm−2). Fig. 7 Table 1 The phase composition and structural parameters of the catalysts. Table 1 catalysts CuO (wt%) CeO2 (wt%) Lattice parameters (Å) Grain size (Å) CuCeO2−x 7.2 92.8 5.415 76.5 Bi/CuCeO2−x-1 8.0 92.0 5.418 74.2 Bi/CuCeO2−x-2.5 3.5 96.5 5.422 82.9 Bi/CuCeO2−x-5 2.3 97.7 5.428 70.1 Bi/CuCeO2−x-7.5 5.1 94.9 5.428 70.0 Table 2 Surface elements and valence distribution of CuCeO2−x and Bi/CuCeO2−x catalysts. Table 2 Catalyst Surface composition (at%) Bi/ (Bi+Cu+Ce) Cu/ (Cu+Ce)(%) Isat/Ipp (%) Ce3+ in Ce (%) Ov/ (Olatt +Oads+Ov) (%) Cu2p Ce3d O1s C1s Bi4f (%) CuCeO2−x 5.95 14.18 48.79 31.08 None None 17.03 64.37 8.90 4.20 Bi/CuCeO2−x-2.5 5.60 13.35 48.82 31.45 0.78 9.30 19.17 41.96 12.58 15.80 Bi/CuCeO2−x-7.5 6.29 12.33 47.08 33.03 1.27 25.66 17.10 43.50 11.17 12.11 Table 3 The reduction temperature of each peak of 3DHP and 3DIP in H2-TPR and molar amount of H2 consumed per gram of catalyst. Table 3 Catalyst α peak β peak γ peak Total H 2 cons. (μmol/g cat ) peak temp. ( o C) H 2 cons. peak temp. ( o C) H 2 cons. peak temp. ( o C) H 2 cons. CuCeO2−x 198 608 221 469 231 304 1381 Bi/CuCeO2−x-2.5 180 697 212 1128 225 205 2051 Bi/CuCeO2−x-7.5 186 657 223 1063 238 193 1933 Bi-doped CuCeO2−x nanorod catalysts for photothermal CO-PROX in H2-rich streams: Enhanced oxygen vacancy and light absorption capacity Wan Cheng Formal analysis Data curation Investigation a 1 Dianyu Huang Formal analysis Data curation Investigation a 1 Jiayu Zeng Data curation a Meiqiang Fan Resources a Dingfeng Jin Resources a Tingli Ma Supervision a b Xiaolin Guo Conceptualization Supervision Funding acquisition Writing – original draft a c ⁎ a College of Materials and Chemistry, China Jiliang University, Hangzhou 310018, PR China College of Materials and Chemistry, China Jiliang University Hangzhou 310018 PR China College of Materials and Chemistry, China Jiliang University, Hangzhou 310018, P. R. China b Graduate School of Life Science and Systems Engineering, Kyushu Institute of Technology, 2-4 Hibikino, Wakamatsu, Kitakyushu, Japan Graduate School of Life Science and Systems Engineering, Kyushu Institute of Technology 2-4 Hibikino, Wakamatsu Kitakyushu Japan Graduate School of Life Science and Systems Engineering, Kyushu Institute of Technology 2–4 Hibikino, Wakamatsu, Kitakyushu, Japan c Institute of Catalysis, Zhejiang University, Hangzhou 310000, PR China Institute of Catalysis, Zhejiang University Hangzhou 310000 PR China Institute of Catalysis, Zhejiang University, Hangzhou 310000, P. R. China ⁎ Corresponding author at: College of Materials and Chemistry, China Jiliang University, Hangzhou 310018, PR China. College of Materials and Chemistry, China Jiliang University Hangzhou 310018 PR China 1 These authors contributed equally to this work. The wide band gap of ceria limited the light absorption and photothermal conversion of copper-ceria catalyst for photothermal preferential oxidation of CO (CO-PROX). In the present work, doping Bi element was adopted to regulate the energy band and catalytic performance of CuCeO2−x nanorod catalysts for photothermal CO-PROX. Bi/CuCeO2−x nanorods were synthesized by co-precipitation hydrothermal and deposition precipitation method. The Bi/CuCeO2−x catalyst with the molar ratio of Bi/Ce 2.5% exhibited the best catalytic performance and the CO conversion reached 90% under 2.5 suns with a surface temperature of 120 °C. The doped Bi species were incorporated into the CeO2 lattice and promoted the formation of oxygen vacancy sites and the strong Cu-Ce interaction, as revealed by XRD, XPS, Raman and H2-TPR results. In addition, doping Bi reduced the band gap of ceria nanorod from 2.77 to 2.47 eV and remarkably enhanced the UV–vis light response and photogenerated carrier separation of Bi/CuCeO2−x-2.5. Graphical Abstract ga1 Keywords Preferential oxidation of CO Photothermal CuCeO2−x nanorod catalyst Bi dopant Oxygen vacancy Data Availability Data will be made available on request. 1 Introduction Proton Exchange Membrane Fuel Cell (PEMFC) possesses the strengths of high energy density, mild working temperature, wide scope in the application, and meets the continuous needs of energy used in production and life [1]. Currently, the industrial H2 stream is mostly derived from the hydrocarbon reforming reaction. However, 0.3%− 1% CO is mixed in the produced hydrogen-rich stream due to the thermodynamic equilibrium. Pt-based electrodes of PEMFC can be poisoned by even a trace amount of CO, which shortens the service life [2]. CO preferential oxidation (CO-PROX) is an effective means to reduce CO content in hydrogen-rich hydrogen below 100 ppm. The ceria-based catalyst is a kind of promising candidates for highly efficient CO-PROX process. It is mainly due to that the unique electronic structure of rare earth cerium element ([Ce]−4 f15d16 s2) leads to its strong oxidation-reduction ability. The oxidation-reduction cycle behavior of cerium is based on the reversible transformation between Ce3+ and Ce4+, which leads to the change of oxygen coordination of cerium ions and the formation of oxygen vacancy in the CeO2 crystal lattice [3]. Marino et al. [4] compared the CO-PROX performances of Pt, Pd, and Ir-supported CeO2 catalysts. The experimental results showed that Pt-supported CeO2 nanocatalyst had the best performance, because Pt could form a strong interaction with CeO2, which significantly improved the CO-PROX activity of the Pt catalyst. Although Pt-based metal catalysts have good catalytic activity in CO oxidation reactions, the cost of platinum-based catalysts is too high and the resources are limited. In recent years, the CuO-CeO2 catalyst has attracted extensive attention in CO-PROX on account of its unusual oxygen storage capacity, excellent reducibility, and sufficient sites to support copper [5–7]. Wang et al. [8] used the urea grinding method to prepare CuO-CeO2, which revealed high catalytic performance and stability with a wider temperature window of 50 ℃ due to the more active sites and the synergistic effect between highly dispersed copper species and CeO2. Guo et al. [9–12] reported that CuO/CeO2-rod had superior catalytic performance, lower T50%, and a wider temperature window than CuO/CeO2-plate and CuO/CeO2-cube. In addition, Zhao et al. [13] found that doping Sn promotes the Cu-Ce catalyst to CO-PROX in the rich hydrogen, but the chlorine ion in the reaction process inhibited the CO-PROX activity of the catalyst in CO-PROX in the low-temperature range. The traditional thermal catalytic process costs lots of energy input which is difficult to be carried out at room temperature and often requires noble metals [14]. Simulated sunlight has been proposed to replace the thermal energy to drive the CO oxidation reaction. Dai et al. [15] prepared Cu-modified Au-TiO2 catalyst for photocatalytic oxidation of CO. It is reported that the CuO shell generates photoexcitation under visible light irradiation, enhances the electron transfer between Au and increases the carrier surface electron density, which notably accelerates the adsorption and activation of CO and O2. However, the photocatalytic process is limited by low light utilization efficiency and cannot fully utilize solar energy resources [16]. Recent researches [17,18] have confirmed that the photothermal catalytic reaction, which simultaneously utilizes the light and the heat derived from the sun, is promising to facilitate the catalytic reaction and overcome the deficiency of a single catalytic process. Zhu et al. [19] reported a Fe3Si assisted Co3O4 rhombus-shaped nanorods catalysts for efficient photothermal CO oxidation under solar irradiation, which can convert 0.3–0.35 kW·m−2 solar irradiation into a temperature as high as 160 °C that able to excite the activity of Co3O4 nanorods for complete CO oxidation. CeO2 has been widely used in both thermal catalytic and photocatalytic oxidation reactions [20], which is a promising candidate for the photothermal catalytic process [21]. Ma et al. [22] developed a MOF crystal engineering method to controllably synthesize a copper-ceria catalyst. They found that the well-dispersed photoactive Cu-[O]-Ce species make the catalyst remarkably efficient and stable in photothermal preferential oxidation of CO. They concluded that the coexistence of photochemistry and thermochemistry effects contributes to the high efficiency. Recently, our group [23] studied solar-driven photothermal CO-PROX on the CuCeO2−x nanorod catalysts synthesized by fast coprecipitation at room temperature. It is concluded that the catalytic activity for photothermal CO-PROX is both affected by the photo-to-thermal conversion and Cu-Ce synergy interaction, and the optimal copper dopant with weight content of Cu/(CuO+CeO2) of 10 wt% promotes visible light absorption and redox property of ceria. However, due to the wide band gap of ceria (∼3.2 eV), the light absorption is limited to the UV band with weak visible light, which leads to the insufficient light absorption and relatively low light-to-thermal conversion efficiency of ceria based photothermal catalysts. Bi2O3-based materials have received widespread concern because of their excellent optical and electrical properties, for example, a suitable energy gap, high refractive index, and excellent dielectric properties [24,25]. The electrons on the valence band (VB) of the Bi2O3 semiconductor photocatalyst are excited by light and transited to the conduction band (CB). After the electrons transition, holes with strong oxidation are left on the valence band [26]. Therefore, Bi2O3 is a desirable visible light-responsive semiconductor photocatalyst, which shows a rapid light response speed and high solar light utilization under sunlight [27,28]. In addition, Bi-doped suitable elements can expand the wavelength range of light absorption and improve the photocatalytic performance [29,30]. Zhang et al. [31] prepared Bi-doped ms-TiO2 photocatalyst that highly responsive to visible light. The spectral response was extended from UV to the visible region by Bi doping, and electron-hole recombination was significantly reduced. For the purpose to optimize the structure and properties of CuCeO2−x nanorod catalysts, Bi doping was chosen to regulate the oxygen vacancy concentration and photo-absorption capacity of CuCeO2−x nanorod catalysts. A set of Bi-doped CeO2 catalysts was prepared by the co-precipitation hydrothermal method and CuO was supported on Bi/CeO2−x nanorod by the precipitation-deposition method. XRD, HRTEM, N2-physysorption @ −196 °C, H2-TPR, O2-TPD, UV-Vis-IR, photoluminescence spectrum (PL), ICP, Raman and XPS were used to analyze the influence of Bi dopant amount on the structure and texture property, redox property, optical property and catalytic performance of the Bi/CuCeO2−x nanorod catalysts for photothermal CO-PROX. 2 Experimental section 2.1 Chemicals and materials All reagents utilized were AR analytical grade reagents obtained from Shanghai Macklin Biochemical Technology Co., LTD. These reagents of Ce(NO3)3·6 H2O (99.99%), Cu(NO3)2·3 H2O (98%), Bi(NO3)3·5 H2O (99%), NaOH (97%), Concentrated nitric acid and anhydrous ethanol were used without further purification. The solutions used in the experiment were all prepared using deionized water. 2.2 Preparation of Bi-doped CeO2 (Bi/CeO2−x) nanorod supports Bi-doped CeO2 supports and Bi2O3 samples were synthesized by the co-precipitation hydrothermal method. At room temperature, 4 mmol of Ce(NO3)3·6 H2O and Bi(NO3)3·5 H2O with the molar ratios of Bi/Ce of 0, 1%, 2.5%, 5% and 7.5% (the mole of Bi(NO3)3·5 H2O are 0, 0.04, 0.1, 0.2 and 0.3 mmol, respectively) were mixed in 5 mL of HNO3 solution. Under magnetic stirring, the mixed solution was dripped to 70 mL of NaOH solution of 8 mol/L, and the mixture was stirred for another 0.5 h to form a colloidal suspension. Subsequently, the suspension was decanted into a stainless-steel autoclave, which was put in a drying oven at 100 ℃ for 24 h[11]. After cooling naturally, the precipitate was centrifugalized and cleaned with deionized water and absolute ethanol by turns. At last, the precipitate was dried overnight in a drying oven at 60 °C. The series of Bi-doped CeO2 nanorod supports were labeled as CeO2, Bi/CeO2−x-1, Bi/CeO2−x-2.5, Bi/CeO2−x-5 and Bi/CeO2−x-7.5, respectively with the molar ratios of Bi/Ce of 0, 1%, 2.5%, 5% and 7.5%. The Bi2O3 samples was synthesized by the co-precipitation hydrothermal method as well. 4 mmol of Bi(NO3)3·5 H2O was dissolved in 10 mL of deionized water, then treated at the same condition, the catalyst was labeled as Bi2O3. 2.3 Loading of CuO on Bi/CeO2−x nanorod supports CuO was loaded on Bi/CeO2−x nanorod supports by the deposition-precipitation method. 0.5 g of Bi/CeO2−x nanorods supports were dispersed in 60 mL deionized water and a certain amount of Cu(NO3)2·3 H2O was added in the solution under magnetic stirring. Then the pH of the suspension was regulated to 8–10 by NaOH solution. After aging for 0.5 h, the precipitate was centrifugalized, dried overnight in a vacuum drying oven at 80 ℃, and finally calcined at a temperature of 500 °C for 2 h, the temperature ramp was 5 °C/min from the ambient temperature to 500 °C [11,32]. The obtained Bi-doped CuCeO2−x nanorod catalyst were labeled as CuCeO2−x, Bi/CuCeO2−x-1, Bi/CuCeO2−x-2.5, Bi/CuCeO2−x-5, and Bi/CuCeO2−x-7.5, respectively. The weight fraction of Cu in the catalyst was fixed at 10 w.t %. 2.4 Catalyst characterization The XRD diffractograms were operated to characterize the crystal phase structure and composition of the catalyst. The experimental apparatus was a Bruker D2 PHASER X-ray diffractometer from Germany. The ground powder sample was placed in a quartz sample holder for testing, under the 40 kV tube voltage and 40 mA tube current. The used excitation light source was Ni-filtered Cu Kα1 ray, the scanning speed was 4°/min and the scanning range was 20–100°(2θ). The Maud software was used to Rietveld refine the XRD diffractograms. The anisotropic size function and Popa rules that ascribed the broadening of the crystallite size to a linear combination of spherical harmonic functions were used to refine crystallite size and morphology [10,33]. The HRTEM images were used to study the morphologies, crystal size and Bi dopant distribution of the catalyst, and were conducted on the FEI Tecnai G2 F20 transmission electron microscope with 200 kV working voltage. A moderate amount of Bi/CuCeO2−x-2.5 catalyst was dissolved in absolute ethanol, and the mixture was dropwise onto the copper mesh. After drying naturally, the copper mesh with the catalyst was placed in the TEM sample holder. EDX elemental distribution mapping were characterized by FEI Talos F200S transmission electron microscope. The sample was loaded with molybdenum mesh, and the other preparation details were consistent with HRTEM. The N2 adsorption and desorption isotherm curves of the samples were measured using a TriStar II 3020 (Micromeritics Inc.) automatic physicochemical adsorption instrument at liquid nitrogen temperature (−196 ℃). The samples were pretreated at 200 ℃ in a high vacuum environment for 4 h. The specific surface area of the sample is calculated using the Barrett Emmett Teller (BET) formula, and the pore volume and pore size distribution are calculated using the Barrett Joyner Helenda (BJH) model. The Raman spectra of the catalysts were detected by a HORIBA Scientific LabRAM HR Evolution. The excitation wavelength was 514 nm, the excitation power was 5 mV and the scanning range was 100–2500 cm−1 and repeated three times. X-ray photoelectron spectroscopy (XPS) can be utilized for qualitative and semi-quantitative analyses. The details of the sample surface element composition, chemical state and concentration can be acquired from the peak position, shape and strength of the XPS spectrum. The temperature-programmed hydrogen reduction test (H2-TPR) was performed in a self-made quartz U-shaped tube, which was attached to the TCD detector to detect the concentration of H2 online. 50 mg of the sample with a particle size of 60–80 mesh was pretreated at 300 ℃ for half an hour under a nitrogen atmosphere. After cooling naturally, the N2 gas was shifted to 5% H2/Ar mixed gas with a flow velocity of 40 mL/min, and the temperature-programmed rate was 10 ℃/min from 30 ℃ to 400 ℃. Temperature-programmed desorption of oxygen (O2-TPD) profiles were performed in the self-made devices. The 100 mg sample with a 60–80 mesh particle size was pretreated at 300 ℃ for 0.5 h under pure He gas (40 mL/min). After cooling to 50 ℃, 20% O2/Ar (30 mL/min) was inlet to adsorb oxygen species at 50 ℃ for 1 h. Then, pure He (40 mL/min) was used to remove the excess O2 for 0.5 h. O2 desorption profiles were obtained by heating the catalyst from 50 ℃ to 700 ℃ at 10 ℃/min. The UV–vis-IR absorption of the samples was characterized by the UV-3600 PLUS at room temperature. The scanning speed was medium and the scanning range was 200–2500 nm. The transient photocurrent curves conducted on a CH660E electrochemical workstation. The sample was spin-coated in the FTO conductive glass to prepare the working electrode. Then a standard three-electrode system was used to complete the transient photocurrent test. The electrolyte was Na2SO4 solution (0.5 M), the reference electrode was Ag/AgCl, and the counter electrode was a 1 cm * 1 cm platinum sheet electrode. The light source was a xenon lamp, and the light intensity was adjusted to 250 mW/cm2. The photocurrent test was performed at an interval of 20 s The Photoluminescence spectrum (PL) is used to study charge transitions related to defects and evaluate the separation and recombination characteristics of photogenerated carriers in the samples. The experimental apparatus was Edinburgh FLS1000, UK. The excitation light wavelength was 330 nm, the emission light wavelength changed from 350 nm to 700 nm and the step was 1 nm. Inductively coupled plasma atomic emission spectrometer (ICP-OES) is an analytical instrument to determine the content of specific elements in samples. The principle of ICP-OES measurement is based on the fact that atoms and ions will absorb energy to make the contained electrons jump to the excited state and when the excited atoms return to the low energy level, the specific wavelength light is emitted. In ICP-OES, the experimental apparatus was Agilent 7800(MS), US, and the source of energy is the heat of argon plasma working at 10000 K. 2.5 Catalyst performance The photothermal catalytic performance of the catalysts was tested on a self-made cylindrical quartz gas-solid reactor (QR, height 65 mm, diameter 40 mm) with a quartz window of the diameter of 40 mm. 100 mg catalysts were uniformly dispersed on the porous quartz sand substrate with the diameter of 40 mm. The photothermal reaction temperature was monitored by contacting the catalyst surface with a thermocouple, and there was no external heating source during the test. The light illumination is obtained by a 300 W Xenon lamp and the light intensity was adjusted by the height of the light source and measured by CEL-NP2000 optical power meter. The feed gas with a total flow velocity of 100 mL/min and the mixture containing of 25% H2 + 0.5% O2 + 0.5% CO and Ar in balance entered the reaction device [22]. The outlet gas first passed through a cold trap to get rid of the water and the concentration was determined by GC1690 gas chromatography. A carbon molecular sieve (TDX-01) column was adopted to divide CO and CO2 in the outlet gas, and the separated CO and O2 were then converted to methane by virtue of a methanator, whose contents were finally determined by a FID detector with Ar (highly purified, 99.999%) as carrier gas and a limit of less than 3 ppm. H2 and O2 were detected by a TCD detector. The long term photothermocatalytic stability of Bi/CuCeO2−x-2.5 was tested at 250 mW·cm−2, and the feed gas was 25% H2 + 0.5% O2 + 0.5% CO and Ar in balance with a total flow velocity of 100 mL/min. The photothermal CO preferential oxidation catalytic performance for different oxygen and CO concentrations ((1%CO/0.5%O2/25%H2 +Ar, 0.5%CO/1%O2/25%H2 +Ar) was tested at 250 mW·cm−2, and the water resistance of the catalyst was tested at the 7.5 vol% H2O in the reaction gas of 0.5%CO/0.5%O2/25%H2 +Ar at 250 mW·cm−2. The addition of water vapor is achieved by bubbling the reaction gas, and the water vapor content is controlled by changing the water temperature to adjust its saturated vapor pressure. The CO conversion rate was obtained by the formula (CO in represented the CO content in the feed gas, CO out represented the CO content in the tail gas, O2 in represented the O2 content in the feed gas, and O2 out represented the O2 content in the tail gas): CO conversion = （ CO in − CO out ） / CO in × 100 % O 2 selectivity = 0.5 ( CO in − CO out ) / ( O 2 in − O 2 out ） × 100 ( % ) 3 Results and discussion 3.1 Structural properties of catalysts Fig. 1(a-b) presents the HRTEM images of the Bi-CuCeO2−x-2.5 nanorod catalyst. As Fig. 1(a-b) shows, the catalyst has an obvious nanorod morphology with a diameter of about 8–11 nm and a length distribution of 55–140 nm. Bi/CuCeO2−x-2.5 mainly exposes {111} crystal planes of ceria with the lattice spacing of 0.32 nm. EDS-Mapping images of Bi/CuCeO2−x-2.5 catalyst was performed to identify the high dispersion of Bi species in ceria species. As shown in Fig. S4, the signals of Bi, Ce and Cu elements are evenly distributed on EDS mapping images of the Bi/CuCeO2−x-2.5 catalyst without any aggregation, which indicates that Bi element is highly dispersed in the nanorod catalyst. To explore the effect of Bi dopant amount on the microstructure of CuCeO2−x nanorod catalysts, Fig. 1(c) displays the XRD diffractograms of CuCeO2−x nanorod catalysts with different Bi dopant amounts. The XRD diffractograms show the diffraction peaks at 28.5°, 33.1°, 47.5° and 56.4°, which are respectively attributed to the characteristic diffraction peaks of (111), (200), (220) and (311) crystal planes of cubic fluorite CeO2. In addition, the diffraction peaks at 35.6° and 38.7° are attributed to the characteristic diffraction peaks of crystal phase CuO that are caused by the agglomeration of copper oxide species on the surface of ceria nanorods. There are no diffraction peaks of crystal phase bismuth oxide species can be detected, indicating that the highly dispersion of Bi species on the surface or in the lattice of ceria form a solid solution structure. The Bi contents of series Bi/CuCeO2−x nanorod catalysts was confirmed by ICP-OES, which are 1.2%, 2.9%, 4.7% and 6.5% respectively for Bi/CuCeO2−x-1, Bi/CuCeO2−x-2.5, Bi/CuCeO2−x-5 and Bi/CuCeO2−x-7.5. Furthermore, the diffraction peak positions of the series Bi/CuCeO2−x catalysts are also observed in details. It is obvious that all peaks of ceria in the Bi doped samples present a negative shift compared with the undoped CuCeO2−x catalyst, which indicates that the Bi3+ was incorporated in the CeO2 lattice during the preparation process. The XRD patterns of the series catalysts were refined by Rietveld using Maud software. The refined XRD patterns are shown in Fig. S1 and the structural parameters of each catalyst are shown in Table 1. On one hand, the lower contents of bulk phase CuO in Bi/CuCeO2−x-2.5 and Bi/CuCeO2−x-5 demonstrate that appropriate Bi doping could enhance high dispersion of CuOx species on the nanorod support, which is beneficial to their catalytic activity for CO-PROX reaction. On the other hand, the lattice parameters of all the Bi-doped samples exhibited an expansion in the CeO2 lattice, demonstrating the successful doping of Bi3+, which has a cation radius (1.17 Å) larger than Ce4+ (0.97 Å). Moreover, the grain size listed in Table 1 indicates the basic grain size of ceria nanorods, which is composed by the oriented attachment of the cube-like basic grains with a [110] growth direction. Bi-doping significantly changes the grain sizes of CuCeO2−x nanorod catalysts and Bi/CuCeO2−x-2.5 shows the largest grain size. As reported in the literature [5], the ceria nanorod catalysts with larger basic grain size also shows much higher catalytic performance for CO-PROX, mainly attributed to the abundant oxygen vacancy and strong interaction between copper and ceria. It means that the basic grain size is not the key factor that determine the catalytic performance of the ceria-based catalysts. In addition, the N2 isotherms and their pore size distributions of CuCeO2−x, Bi/CuCeO2−x-5 and Bi/CuCeO2−x-7.5 (Fig. 1(d) and Table S1) were compared to explain the influence of Bi dopant on the texture property of copper-ceria nanorods catalysts. It can be seen that the SBET values of CuCeO2−x, Bi/CuCeO2−x-2.5 and Bi/CuCeO2−x-7.5 were respectively 63.1, 81.5 and 80.4 m2g−1, indicating that Bi doping could slightly increase the specific surface area of the catalysts and promote the high dispersion of CuOx species. The BJH pore size distribution of the catalysts demonstrates that the pore structure is also affected by the Bi doping, which leads to the reduced average pore size and larger pore volume. As the doping content of Bi reaches to 7.5%, a large portion of Bi elements might involve in the formation of Bi2O3 nanoparticles that dispersed on the surface of ceria nanorods (as identified by the following XPS spectra) with a slightly decreased SBET. The surface dispersed Bi species might cover the oxygen vacancy and hinder the interaction between copper and ceria interface, which adverse to the dispersion of copper species and leads to the increased crystal phase CuO. 3.2 XPS and UV-Raman of catalysts XPS spectra of CuCeO2−x and Bi/CuCeO2−x catalysts are given in Fig. 2(a-d) and their surface elements and valence distribution are shown in Table 2. The atomic ratio of Bi/(Bi+Cu+Ce) are 9.30 and 25.66 respectively for Bi/CuCeO2−x-2.5 and Bi/CuCeO2−x-7.5 catalysts. On account of that the detection depth of XPS is only 0.5–10 nm, the sharply increased surface content of Bi element in Bi/CuCeO2−x-7.5 indicates that a large portion of Bi elements are involved in the formation of Bi2O3 nanoparticles that dispersed on the surface of ceria nanorods, and only small amount of Bi3+ ions incorporate into the CeO2 lattice to form Ce-O-Bi solid solution in Bi/CuCeO2−x-7.5. Moreover, the larger copper content of Bi/CuCeO2−x-2.5 indicates the high dispersion of CuO species that strongly interacted with ceria support, which is also in accordance with XRD results. As shown in Fig. 2(a), two obvious peaks were detected at the position of 932.8–934.0 eV and 943.5 eV in the Cu 2p 2/3 XPS spectra, the former was the principal peaks of Cu 2p3/2 and the latter was the satellite peaks with shake-up structure [23,34]. It is obvious that the binding energy of Cu 2p3/2 shifts from 933.1 eV to 934.0 eV as 2.5% Bi doping in CuCeO2−x catalyst, which is attributed to the existence of highly dispersed CuO clusters with a portion of Cu2+ ions being unsaturated. The ratio of the intensity of the satellite peaks and the principal peaks (Isat/Ipp) could estimate the degree of the unsaturated Cu2+ ions and the lower Isat/Ipp indicates the higher degree of unsaturated Cu2+ ions. Compared with CuCeO2−x, Bi/CuCeO2−x-2.5 has a lower Isat/Ipp, which means the more unsaturated Cu2+ ions that caused by the stronger Cu-Ce interaction [6]. However, for Bi/CuCeO2−x-7.5, the Isat/Ipp value is slightly higher than that of Bi/CuCeO2−x-2.5, which is mainly resulted by the excessive Bi doping that dispersed on the surface of nanorod and impairs the copper-ceria interaction, as indicated by the surface Bi content. Fig. 2(b) is the Ce3d spectra of CuCeO2−x and Bi/CuCeO2−x catalysts. The u peak (900.60 eV), u’’ peak (907.50 eV), u’’’ peak (916.50 eV), v peak (882.00 eV), v’’ peak (889.10 eV), and v’’’ peak (898.00 eV) are attributed to Ce4+, while u′ peak (903.50 eV) and v′ peak (885.10 eV) are attributed to Ce3+ [23]. Compared with CuCeO2−x, the ratio of Ce3+/Ce for Bi/CuCeO2−x-2.5 is notably higher than the undoped catalyst. The higher ratio of Ce3+/Ce indicates the higher oxygen vacancy that is induced by the incorporation of Bi ions into ceria lattice, which contributes to promoting the oxygen mobility and improving the oxidation activity of the catalyst [35]. It can be seen that the Ce3+/Ce ratio of Bi/CuCeO2−x-7.5 is reduced than that of Bi/CuCeO2−x-2.5, which is as a consequence of the partial segregation of Bi species that dispersed on the surface of catalyst. As shown in Fig. 2(c) Two highly symmetric peaks present in Bi 4 f spectra, and the peak at 158.6 eV is related to Bi 4 f7/2 and that at 163.9 eV is related to Bi 4 f5/2 with spin-orbit separation of 5.3 eV, which is highly consistent with peaks of bismuth in the + 3 state in standard bismuth oxides [36,37]. The peak intensity of Bi 4 f in Bi/CuCeO2−x-7.5 are much larger than that in Bi/CuCeO2−x-2.5, indicating the higher doping amount of bismuth species. Fig. 2(d) shows the O1s spectrum, the Olatt peak (529.1 eV) belongs to the surface lattice oxygen, the Oads peak (531.2 eV) belongs to the surface adsorbed oxygen species and the Ov peak (530.4 eV) is ascribed to the surface oxygen vacancy. The ratio of Ov/(Olatt+Oads+Ov) indicates the surface oxygen vacancy concentration[38]. Notably, the ratio of Ov/(Olatt+Oads+Ov) in Bi/CuCeO2−x samples are significantly higher than the undoped CuCeO2−x catalyst, which indicates the important role of Bi doping in creating oxygen vacancy in ceria-related catalyst. These results demonstrate that doping optimal Bi elements could promote the substitution of Bi3+ ions to Ce4+ ions in the CeO2 lattice and form a solid solution structure, which causes the increased oxygen vacancy[29], which is also supported by the shift of the diffraction peaks in XRD diffractograms. Fig. 2(e) reveals the Raman spectra of CuCeO2−x, Bi/CuCeO2−x-2.5 and Bi/CuCeO2−x-7.5 nanorod catalysts. The Raman spectra of these three catalysts have obvious Raman peaks at 451 cm−1, which is the CeO2 fluorite structure characteristic vibration peak of F2 g vibration. The F2 g vibration peak value of CeO2 will shift due to the particle size inductive effect in the lattice caused by the disorder, doping or heating, or the existence of massive oxygen vacancy after CeO2 is reduced. And the change in oxygen vacancy concentration of CeO2 can be obtained by analyzing the shift of the Raman spectrum [39]. Compared with undoped CuCeO2−x nanorod catalyst, the F2 g peaks of Bi-doped CuCeO2−x nanorod catalysts move to the low-frequency band, which indicates that the symmetric stretching vibration of Ce[O]8 unit is distorted by Bi doping [40]. The ratio of A600/A451 of each sample is Bi/CuCeO2−x-2.5 (0.930) > CuCeO2−x (0.859) > Bi/CuCeO2−x-7.5 (0.682). The highest (A600/A451) value of Bi/CuCeO2−x-2.5 nanorod catalyst indicates that Bi3+enters the CeO2 lattice and weakens the Ce-O bond, which promotes the conversion of Ce4+ to Ce3+ and the formation of more oxygen vacancies. When the Bi dopant amount increases to 7.5%, the oxygen vacancy concentration of the catalyst is lower than that of the undoped CuCeO2−x nanorod catalyst, which is mainly caused by the partial segregation of Bi species that dispersed on the surface of catalyst and inhibits the formation of Ce-O-Bi solid solution. Generally, the existence of oxygen vacancy is beneficial to enhancing the mobility of lattice oxygen and Cu-Ce interaction. Therefore, doping appropriate amount of Bi in CuCeO2−x nanorods is able to promote the formation of oxygen vacancy and in favor to enhancing its catalytic performance in CO-PROX. 3.3 Redox properties and active oxygen species of catalysts To evaluate the redox properties of Bi-doped CuCeO2−x nanorod catalysts, Fig. 3 shows the H2-TPR and O2-TPD profiles of CuCeO2−x, Bi/CuCeO2−x-2.5 and Bi/CuCeO2−x-7.5 nanorod catalysts. As Fig. 3(a) shows, the catalysts have three reduction peaks (α, β and γ) between 100–300 ℃, which are respectively attributed to the reduction of highly dispersed CuO on the surface, the reduction of strongly bond Cu-[Ox]-Ce species that caused by the strong Cu-Ce interaction, and the reduction of bulk phase CuO [6,41]. The reduction temperatures and hydrogen consumptions of the reduction peaks are listed in Table 3. When an appropriate amount (2.5%) of Bi is doped into CuCeO2−x nanorod catalyst, the α peak and the β peak move to the low-temperature range with larger hydrogen consumptions. It indicates that the doped Bi species might enter the CeO2 lattice, causing the increase of lattice oxygen vacancy, which not only promotes the dispersion of CuOx species, but also enhance the formation of strongly bond Cu-[Ox]-Ce species (as also supported by XRD and Raman results) [11]. Compared with Bi/CuCeO2−x-7.5 nanorod catalyst, the α peak and β peak of Bi/CuCeO2−x-2.5 nanorod catalyst have lower temperature and larger hydrogen consumptions, indicating exceeded Bi dopant would decrease the redox property of Bi/CuCeO2−x. In addition, as shown in Fig. 3(b), two broad reduction peaks were related to the reduction of Ce4+ to Ce3+, one around 400–600 °C, associated to coordinately unsaturated surface capping oxygen, and a second peak around 700–900 °C, associated to reduction of bulk ceria that requires to be transported to the surface before their reduction. It can be seen that the reduction temperature of the surface lattice oxygen of ceria shifts from 503 °C to 473 and 485 °C respectively for Bi/CuCeO2-x-2.5 and Bi/CuCeO2-x-7.5. It indicates that Bi doping obviously reduced the reduction temperature of the surface lattice oxygen of ceria, and the optimum doping amount of Bi significantly accelerated the reducibility of Bi/CeO2-x nanorods support, which was attributed to the presence of more oxygen vacancy induced by the replacement of Bi3+ to Ce4+ in the CeO2 lattice. Fig. 3(c) presented the O2-TPD profiles in order to further demonstrate the effect of Bi doping on the formation of the active oxygen species. It can be seen that three desorption peaks are observed in these profiles: the first one (peak α) at 150–210 °C, which can be assigned to adsorbed molecular oxygen (adO2 -) on oxygen vacancies, and the second one (peak β) at 350–450 °C, which can be assigned to oxygen anion (O-), and the third one (peak γ) at 500–700 °C corresponding to atomic oxygen evolved from the bulk of CeO2 [42,43]. It is obvious that the surface density of oxygen vacancy estimated based on the amounts of adO2- follows the order: Bi/CuCeO2-x-2.5 > CuCeO2-x > Bi/CuCeO2-x-7.5. The largest amount of adO2- and the lowest peak temperature of peak α of Bi/CuCeO2-x-2.5 indicate the most higher surface density of oxygen vacancy and the oxygen in the gas phase could be activated and adsorbed onto Bi/CuCeO2-x-2.5 much easily. Moderate Bi doping increases the formation of lattice oxygen vacancy in CeO2, thereby promoting the interaction between copper oxide species. The excellent redox property would greatly promote the CO-PROX activity of the Bi/CuCeO2−x-2.5 nanorod catalyst. 3.4 Optical properties of catalysts To evaluate the influence of Bi dopant amount on the optical properties of CuCeO2−x nanorod catalysts, Fig. 4(a) shows the UV–vis-IR absorption spectrum of each catalyst. It can be seen that all catalysts have strong absorption in the range of 200–1200 nm, among them the Bi/CuCeO2−x-2.5 nanorod catalyst shows the strongest UV–vis absorption from 200 nm to 800 nm. The absorption intensity of Bi-doped CuCeO2−x nanorod catalysts in the IR range of 800 nm to 1200 nm decreases slightly but is higher than undoped CuCeO2−x nanorod catalysts in the range of 1300–2000 nm. Compared with the CuCeO2−x nanorod catalyst without doping Bi, the appropriate amount of Bi dopant enhances the UV–vis light response of the catalyst and increases the absorption of the UV–vis light bands [44]. The effective utilization of ultraviolet, visible and infrared energy in sunlight is increased, thus the photothermal conversion ability of the catalyst is enhanced, which benefits the higher surface temperature and CO oxidation ability of the catalyst under solar light irradiation. In Fig. 4(b), the optical band gaps (Eg) of the CuCeO2−x, Bi/CuCeO2−x-2.5 and Bi/CuCeO2−x-7.5 were calculated based on the Tauc Plot, and the results were approximately 2.77 eV, 2.50 eV and 2.47 eV, respectively. The narrower band gap means the catalyst is easier to absorb light. The results above indicate that Bi dopant could promote the formation of oxygen vacancy sites, which results in stronger light absorption ability [45]. The generation and separation efficiency of the photoinduced electron-hole pairs of CuCeO2−x and Bi/CuCeO2−x catalysts were also investigated by the on-off cyclic transient photocurrent experiment under full spectrum illumination, as shown in Fig. 4(c). It is obvious that the photocurrent intensity is significantly strengthened by Bi doping. The high photocurrent intensity of Bi/CuCeO2−x-2.5 and Bi/CuCeO2−x-7.5 indicates the efficient electron-hole separation and transfer process of these two catalysts under light illumination, which mainly caused by the enhanced oxygen vacancy that could efficiently promote the separation and interfacial transmission of photoexcited carriers [29]. Fig. S5 reveals the photoluminescence spectra of CuCeO2−x and Bi/CuCeO2−x-2.5. The emission peak around 385.3 nm is attributed to the charge transition from the Ce4f orbital to the O2p valence band [46]. We can see that CuCeO2−x exhibited an intensive PL peak due to the large recombination of the photogenerated charges. The photoluminescence peak intensity of Bi/CuCeO2−x-2.5 is significantly quenching, indicating that the doping Bi significantly increases the charge separation efficiency due to the oxygen vacancy that inhibits electron-hole recombination. 3.5 Catalytic performance evaluation of catalysts The CO conversion and O2 selectivity of the series Bi/CuCeO2-x catalyst for photothermal CO-PROX at 2.5 suns were exhibited in Fig. 5(a). It can be concluded that the sequence of CO conversion of Bi-doped CuCeO2−x nanorod catalysts in the CO-PROX reaction is Bi/CuCeO2−x-2.5 > Bi/CuCeO2−x-5 ≈ Bi/CuCeO2−x-7.5 > Bi/CuCeO2−x-1 ≈ CuCeO2−x. When the Bi dopant amount increases from 0% to 2.5%, the low-temperature catalytic performance of Bi/CuCeO2−x nanorod is significantly improved, the conversion of CO is increased from 81% to 90%, and the maximum surface temperature is up to 120 ℃. The photothermal CO-PROX performance of the catalyst is decreased significantly when the Bi dopant amount further increases to 7.5%. As Bi dopant amount increases from 0% to 7.5%, O2 selectivity of the series Bi/CuCeO2-x catalyst increases from 56% to 72% and then decreases to 56.8%. Bi/CuCeO2-x-2.5 catalyst shows much higher CO conversion and O2 selectivity than the other catalysts. As reported in literature [10], the decreased O2 selectivity is mainly caused by the competition oxidation of H2 with the CO oxidation. The higher CO conversion and O2 selectivity of Bi/CuCeO2-x-2.5 is mainly attributed to the following two reasons. The first one is that doping the optimum Bi element enhanced the formation of more oxygen vacancy that induces strong copper-ceria interaction, which benefits to the adsorption and activation of the CO and O2 molecular to participant to the oxidation reaction. And the other one is ascribed to the reduced band gap of ceria and lower combination of photogenerated electron-hole pairs that induced strong light absorption and higher photothermal conversion of Bi/CuCeO2-x-2.5 catalyst. It was also reported in the other literatures that the competition oxidation between CO and H2 exists in the thermal and photothermal CO-PROX of copper-ceria catalyst, and the O2 selectivity of Bi/CuCeO2-x-2.5 is comparable with that reported in the literature [47]. The above results show that doping the proper amount of Bi into the CuCeO2−x nanorods could help to promote the CO-PROX under light conditions, and excessive Bi dopant amount leads to the decline of CO-PROX performance. The decreased CO conversion in Bi/CuCeO2-x-7.5 could be attributed to the following reasons. On one hand, as the Bi doping amount reaches to 7.5%, from the N2-physysorption @ −196 °C and XRD, it is obvious that the SBET value of Bi/CuCeO2−x decreased with much more crystal phase CuO forming in the catalyst. The oxygen vacancy caused by the formation of Bi-O-Ce solid solution get decreased (indicated by the XRD, UV-Raman and XPS results), which mainly due to the segregation of Bi species on the surface of ceria nanorods in Bi/CuCeO2−x-7.5 and only a small amount of Bi entering the CeO2 lattice to form the solid solution. Caused by the above two reasons, the redox property and the copper-ceria interaction of Bi/CuCeO2−x become much weaken as indicated by the XPS and H2-TPR results, which is adverse to the catalytic activity for CO oxidation. On the other hand, the optical property of Bi/CuCeO2−x was also weakened by the over high Bi doping amount. The visible light absorption ability and separation efficiency of the photogenerated carriers of Bi/CuCeO2−x-7.5 is notably lower than that of Bi/CuCeO2−x-2.5 with much larger optical band gaps and lower photocurrent intensity than the latter. Therefore, ascribed to the above key factors, the 7.5% Bi doping in the CuCeO2−x catalyst results in a decrease in CO conversion. Fig. 5(b) shows the comparation of CO conversion and O2 selectivity of Bi/CuCeO2−x-2.5 for photothermal CO-PROX at different oxygen and CO concentrations. It can be seen that the CO conversion and O2 selectivity of Bi/CuCeO2−x-2.5 were significantly influenced by the oxygen and CO concentrations. As the ratio of oxygen and CO concentration increases from 1/2 to 2/1, on one hand, the O2 selectivity continues to increase from 37% to 98%, which is reasonable phenomenon that the adequate oxygen supply is beneficial for the selectivity oxidation of CO. On the other hand, the CO conversion first increase and then decrease, which is the highest at the reaction gas of 0.5%CO/0.5%O2/25%H2 +Ar. This result is mainly caused by the overhigh surface coverage of O2 or CO would both damage the CO oxidation activity of the Bi/CuCeO2−x-2.5 catalyst, and the optimum adsorption of O2 and CO molecules over the surface of catalyst is help of finishing the redox reaction. Fig. 6 shows comparation of CO conversion and O2 selectivity of Bi/CuCeO2−x-2.5 for photothermal CO-PROX with/without 7.5 vol% H2O in the reaction gas of 0.5%CO/0.5%O2/25%H2 +Ar. It is obvious that the addition of 7.5 vol% H2O significantly impairs the CO conversion but obviously increases the O2 selectivity of Bi/CuCeO2−x-2.5 for photothermal CO-PROX. It is reported in the literature [12] that the presence of adsorbed molecules water which blocks the active sites and leads to the negative effect of H2O to the CO conversion of copper-ceria catalyst during CO-PROX. The increased O2 selectivity with the addition of 7.5 vol% H2O is mainly due to the severely inhibition effect of H2O molecules for the H2 oxidation than CO oxidation, as a result of the increased O2 selectivity. Moreover, the result of the water resistance performance of Bi/CuCeO2−x-2.5 under different illumination intensity is also shown in Fig. 6. It is noticed that the CO conversion gradually increase and O2 selectivity becomes reduced along with the higher illumination intensity, and the catalytic performance maintains at the CO conversion of 85% and O2 selectivity of 65% under the illumination higher than 450 mW·cm−2, which indicates the unrecoverable catalytic performance caused by the block effect of water molecules on the active sites of the Bi/CuCeO2−x-2.5 catalyst. The long term photothermal catalytic stability of Bi/CuCeO2−x-2.5 has been tested and the result is shown in Fig. 7. It can be seen that the CO conversion maintains at 90% for 10 h without any degeneration. It indicates that Bi/CuCeO2−x-2.5 exhibits excellent photothermal stability in CO-PROX, which is mainly attributed to the high physicochemical stability of copper-ceria catalyst under the light illumination that has been reported by our previous work[23]. 4 Conclusion In the present work, a series of Bi/CuCeO2−x nanorod catalysts were synthesized with the co-precipitation hydrothermal and deposition-precipitation methods. The influence of Bi doping amount on the catalytic performance in photothermal CO-PROX in hydrogen-rich streams was mainly investigated. The structure and properties of the catalyst were analyzed by XRD, HRTEM, N2-physysorption @ −196 °C, H2-TPR, UV–vis-IR, photoluminescence spectrum, ICP, Raman and XPS. As the doping amount of Bi in the catalyst is 2.5%, the Bi/CuCeO2−x catalyst shows the best performance, and the conversion rate of CO reaches 90% in photothermal CO-PROX under 2.5 suns. Bismuth species are highly dispersed in the CeO2 lattice and Bi enters the CeO2 lattice to form Ce-O-Bi solid solution with abundant oxygen vacancy, promoting the catalytic activity in the CO-PROX. Moreover, Bi-doped CuCeO2−x nanorod catalyst has strong absorption in the whole solar spectrum. The Bi dopant enhances the light absorption ability and carrier separation of CuCeO2−x nanorod catalyst in the UV-Vis light bands, further promoting the photo-to-thermal conversion ability and the catalytic activity in photothermal CO-PROX. CRediT authorship contribution statement Xiaolin Guo: Conceptualization, Supervision, Funding acquisition, Writing – original draft. Wan Cheng: Formal analysis, Data curation, Investigation. Dianyu Huang: Formal analysis, Data curation, Investigation. Jiayu Zeng: Data curation. Meiqiang Fan: Resources. Dingfeng Jin: Resources. Tingli Ma: Supervision. Declaration of Competing Interest The authors declare that they have no known competing financial interests or personal relationships that could have appeared to influence the work reported in this paper. Acknowledgements We gratefully acknowledge the financial support from the Zhejiang Provincial Natural Science Foundation of China (No. LQ21B030012) and the Fundamental Research Funds for the Provincial Universities of Zhejiang (No. 2022YW56). Appendix A Supporting information Supplementary data associated with this article can be found in the online version at doi:10.1016/j.apcata.2023.119540. Appendix A Supplementary material Supplementary material. . References [1] Q.W. Shen S.S. Dong S. Li G.G. Yang Numerical study on performance of HT-PEMFC with gradient design of Pt loading Electrochim. Acta 454 2023 142326 Q.W. Shen, S.S. Dong, S. Li, G.G. Yang, Numerical study on performance of HT-PEMFC with gradient design of Pt loading, Electrochimica Acta, 454 (2023) 142326. [2] S.F. Pan Q.L. Wen X. Dan Y.L. Li F.D. Ning C. He W. Li M. Shen L. He B. Tian Y. Zhang W. Feng Y.C. Zou X.C. Zhou Enhanced triple-phase interface in PEMFC by proton conductor absorption on the Pt catalyst Acs Appl. Energy Mater. 6 2023 763 772 S.F. Pan, Q.L. Wen, X. Dan, Y.L. Li, F.D. Ning, C. He, W. Li, M. Shen, L. He, B. Tian, Y. Zhang, W. Feng, Y.C. Zou, X.C. Zhou, Enhanced Triple-Phase Interface in PEMFC by Proton Conductor Absorption on the Pt Catalyst, Acs Applied Energy Materials, 6 (2023) 763–772. [3] T. Montini M. Melchionna M. Monai P. Fornasiero Fundamentals and catalytic applications of CeO2-based materials Chem. Rev. 116 2016 5987 6041 T. Montini, M. Melchionna, M. Monai, P. Fornasiero, Fundamentals and Catalytic Applications of CeO2-Based Materials, Chemical Reviews, 116 (2016) 5987–6041. [4] N. Bion F. Epron M. Moreno F. Mariño D. Duprez Preferential oxidation of carbon monoxide in the presence of hydrogen (PROX) over noble metals and transition metal oxides: advantages and drawbacks Top. Catal. 51 2008 76 88 N. Bion, F. Epron, M. Moreno, F. Mariño, D. Duprez, Preferential Oxidation of Carbon Monoxide in the Presence of Hydrogen (PROX) over Noble Metals and Transition Metal Oxides: Advantages and Drawbacks, Topics in Catalysis, 51 (2008) 76–88. [5] X.L. Guo R.X. Zhou Identification of the nano/micro structure of CeO(rod) and the essential role of interfacial copper-ceria interaction in CuCe(rod) for selective oxidation of CO in H2-rich streams J. Power Sources 361 2017 39 53 X.L. Guo, R.X. Zhou, Identification of the nano/micro structure of CeO(rod) and the essential role of interfacial copper-ceria interaction in CuCe(rod) for selective oxidation of CO in H2-rich streams, Journal of Power Sources, 361 (2017) 39–53. [6] X.L. Guo J.X. Mao R.X. Zhou Influence of the copper coverage on the dispersion of copper oxide and the catalytic performance of CuO/CeO2(rod) catalysts in preferential oxidation of CO in excess hydrogen J. Power Sources 371 2017 119 128 X.L. Guo, J.X. Mao, R.X. Zhou, Influence of the copper coverage on the dispersion of copper oxide and the catalytic performance of CuO/CeO2(rod) catalysts in preferential oxidation of CO in excess hydrogen, Journal of Power Sources, 371 (2017) 119–128. [7] J. Wang H. Pu G. Wan K. Chen J. Lu Y. Lei L. Zhong S. He C. Han Y. Luo Promoted the reduction of Cu2+ to enhance CuO-CeO2 catalysts for CO preferential oxidation in H2-rich streams: effects of preparation methods and copper precursors Int. J. Hydrog. Energy 42 2017 21955 21968 J. Wang, H. Pu, G. Wan, K. Chen, J. Lu, Y. Lei, L. Zhong, S. He, C. Han, Y. Luo, Promoted the reduction of Cu2+ to enhance CuO-CeO2 catalysts for CO preferential oxidation in H2-rich streams: Effects of preparation methods and copper precursors, International Journal of Hydrogen Energy, 42 (2017) 21955–21968. [8] J. Wang L.P. Zhong J.C. Lu R. Chen Y.Q. Lei K.Z. Chen C.Y. Han S.F. He G.P. Wan Y.M. Luo A solvent-free method to rapidly synthesize CuO-CeO2 catalysts to enhance their CO preferential oxidation: effects of Cu loading and calcination temperature, Molecular Catalysis 443 2017 241 252 J. Wang, L.P. Zhong, J.C. Lu, R. Chen, Y.Q. Lei, K.Z. Chen, C.Y. Han, S.F. He, G.P. Wan, Y.M. Luo, A solvent-free method to rapidly synthesize CuO-CeO2 catalysts to enhance their CO preferential oxidation: Effects of Cu loading and calcination temperature, Molecular Catalysis, 443 (2017) 241–252. [9] X.L. Guo R.X. Zhou A new insight into the morphology effect of ceria on CuO/CeO2 catalysts for CO selective oxidation in hydrogen-rich gas Catal. Sci. Technol. 6 2016 3862 3871 X.L. Guo, R.X. Zhou, A new insight into the morphology effect of ceria on CuO/CeO2 catalysts for CO selective oxidation in hydrogen-rich gas, Catalysis Science & Technology, 6 (2016) 3862–3871. [10] X. Guo W. Ye T. Ma Investigation of the re-dispersion of matrix Cu species in CuxCe1−xO2 nanorod catalysts and its effect on the catalytic performance in CO-PROX Catal. Sci. Technol. 10 2020 4766 4775 X. Guo, W. Ye, T. Ma, Investigation of the re-dispersion of matrix Cu species in CuxCe1−xO2 nanorod catalysts and its effect on the catalytic performance in CO-PROX, Catalysis Science & Technology, 10 (2020) 4766–4775. [11] Z. Qiu X. Guo J. Mao R. Zhou New design and construction of abundant active surface interfacial copper entities in CuxCe1–xO2 nanorod catalysts for CO-PROX J. Phys. Chem. C. 125 2021 9178 9189 Z. Qiu, X. Guo, J. Mao, R. Zhou, New Design and Construction of Abundant Active Surface Interfacial Copper Entities in CuxCe1–xO2 Nanorod Catalysts for CO-PROX, The Journal of Physical Chemistry C, 125 (2021) 9178–9189. [12] X.L. Guo Z.H. Qiu J.X. Mao R.X. Zhou Shape-controlled CuxCe1−xO2 nanorods catalyst and the active components functioned in selective oxidation of CO in hydrogen-rich stream J. Power Sources 451 2020 227757 X.L. Guo, Z.H. Qiu, J.X. Mao, R.X. Zhou, Shape-controlled CuxCe1-xO2 nanorods catalyst and the active components functioned in selective oxidation of CO in hydrogen-rich stream, Journal of Power Sources, 451 (2020) 227757. [13] Y. Zhao K. Chen Q. Zou J. Fang S. Zhu S. He J. Lu Y. Luo Insights into the essential roles of tin and chloride species within Cu–CeO2 based catalysts for CO preferential oxidation in H2-rich stream J. Power Sources 484 2021 229181 Y. Zhao, K. Chen, Q. Zou, J. Fang, S. Zhu, S. He, J. Lu, Y. Luo, Insights into the essential roles of tin and chloride species within Cu–CeO2 based catalysts for CO preferential oxidation in H2-rich stream, Journal of Power Sources, 484 (2021) 229181. [14] A. Zhou X. Guo S. Zhong Q. Kang M. Chen D. Jin M. Fan R. Zhou T. Ma Three birds, one-stone strategy for synthesis of hierarchically arrayed defective MnCo2O4@ NF catalyst for photothermal preferential oxidation of CO in H2-rich streams Chem. Eng. J. 471 2023 144835 A. Zhou, X. Guo, S. Zhong, Q. Kang, M. Chen, D. Jin, M. Fan, R. Zhou, T. Ma, Three birds, one-stone strategy for synthesis of hierarchically arrayed defective MnCo2O4@ NF catalyst for photothermal preferential oxidation of CO in H2-rich streams, Chemical Engineering Journal, 471 (2023) 144835. [15] K. Yang K. Huang L.L. Lin X. Chen W.X. Dai X.Z. Fu Superior preferential oxidation of carbon monoxide in hydrogen-rich stream under visible light irradiation over gold loaded hedgehog-shaped titanium dioxide nanospheres: identification of copper oxide decoration as an efficient promoter J. Power Sources 284 2015 194 205 K. Yang, K. Huang, L.L. Lin, X. Chen, W.X. Dai, X.Z. Fu, Superior preferential oxidation of carbon monoxide in hydrogen-rich stream under visible light irradiation over gold loaded hedgehog-shaped titanium dioxide nanospheres: Identification of copper oxide decoration as an efficient promoter, Journal of Power Sources, 284 (2015) 194–205. [16] L.F. Wei C.L. Yu K. Yang Q.Z. Fan H.B. Ji Recent advances in VOCs and CO removal via photothermal synergistic catalysis Chin. J. Catal. 42 2021 1078 1095 L.F. Wei, C.L. Yu, K. Yang, Q.Z. Fan, H.B. Ji, Recent advances in VOCs and CO removal via photothermal synergistic catalysis, Chinese Journal of Catalysis, 42 (2021) 1078–1095. [17] C. Song Z. Wang Z. Yin D. Xiao D. Ma Principles and applications of photothermal catalysis Chem. Catal. 2 2022 52 83 C. Song, Z. Wang, Z. Yin, D. Xiao, D. Ma, Principles and applications of photothermal catalysis, Chem Catalysis, 2 (2022) 52–83. [18] Y. Xiong X. Liu Y. Hu D. Gu M.H. Jiang Z.X. Tie Z. Jin Ag24Au cluster decorated mesoporous Co3O4 for highly selective and efficient photothermal CO hydrogenation Nano Res. 15 2022 4965 4972 Y. Xiong, X. Liu, Y. Hu, D. Gu, M.H. Jiang, Z.X. Tie, Z. Jin, Ag24Au cluster decorated mesoporous Co3O4 for highly selective and efficient photothermal CO hydrogenation, Nano Research, 15 (2022) 4965–4972. [19] Z.R. Lou D.C. Yuan F.Y. Zhang Y.C. Wang Y.G. Li L.P. Zhu Fe3Si assisted Co3O4 nanorods: a case study of photothermal catalytic CO oxidation under ambient solar irradiation Nano Energy 62 2019 653 659 Z.R. Lou, D.C. Yuan, F.Y. Zhang, Y.C. Wang, Y.G. Li, L.P. Zhu, Fe3Si assisted Co3O4 nanorods: A case study of photothermal catalytic CO oxidation under ambient solar irradiation, Nano Energy, 62 (2019) 653–659. [20] X.B. Huang K.Y. Zhang B.X. Peng G. Wang M. Muhler F. Wang Ceria-based materials for thermocatalytic and photocatalytic organic synthesis ACS Catal. 11 2021 9618 9678 X.B. Huang, K.Y. Zhang, B.X. Peng, G. Wang, M. Muhler, F. Wang, Ceria-Based Materials for Thermocatalytic and Photocatalytic Organic Synthesis, Acs Catalysis, 11 (2021) 9618–9678. [21] B. Liu T. Xu C. Li J. Bai An effective photothermal dual-responsive Pd1Cu4/CexOy catalyst for Suzuki–Miyaura coupling reactions under mild conditions N. J. Chem. 44 2020 3794 3801 B. Liu, T. Xu, C. Li, J. Bai, An effective photothermal dual-responsive Pd1Cu4/CexOy catalyst for Suzuki–Miyaura coupling reactions under mild conditions, New Journal of Chemistry, 44 (2020) 3794–3801. [22] F. Wang J. Tian M. Li W. Li L. Chen X. Liu J. Li A. Muhetaer Q. Li Y. Wang A. Photoactivated Cu–CeO2 catalyst with Cu‐[O]‐Ce active species designed through MOF crystal engineering Angew. Chem. 132 2020 8280 8286 F. Wang, J. Tian, M. Li, W. Li, L. Chen, X. Liu, J. Li, A. Muhetaer, Q. Li, Y. Wang, A. Photoactivated Cu–CeO2 Catalyst with Cu‐[O]‐Ce Active Species Designed through MOF Crystal Engineering, Angewandte Chemie, 132 (2020) 8280–8286. [23] X. Guo W. Ye Za Chen A. Zhou D. Jin T. Ma Simulated solar light-driven photothermal preferential oxidation of carbon monoxide in H2-rich streams over fast-synthesized CuCeO2–x nanorods Appl. Catal. B: Environ. 310 2022 121334 X. Guo, W. Ye, Za Chen, A. Zhou, D. Jin, T. Ma, Simulated solar light-driven photothermal preferential oxidation of carbon monoxide in H2-rich streams over fast-synthesized CuCeO2–x nanorods, Applied Catalysis B: Environmental, 310 (2022) 121334. [24] S.S.M. Bhat H.W. Jang Recent advances in bismuth-based nanomaterials for photoelectrochemical water splitting Chemsuschem 10 2017 3001 3018 S.S.M. Bhat, H.W. Jang, Recent Advances in Bismuth-Based Nanomaterials for Photoelectrochemical Water Splitting, Chemsuschem, 10 (2017) 3001–3018. [25] Z. Wu F. Huang Y. Shen A. Xie X. Song Facile fabrication and optical property of β-Bi2O3 with novel porous nanoring and nanoplate superstructures J. Nanopart. Res.: Interdiscip. Forum Nanoscale Sci. Technol. 13 2011 4575 4582 Z. Wu, F. Huang, Y. Shen, A. Xie, X. Song, Facile fabrication and optical property of β-Bi2O3 with novel porous nanoring and nanoplate superstructures, Journal of nanoparticle research: An interdisciplinary forum for nanoscale science and technology, 13 (2011) 4575–4582. [26] A. Mittal B. Mari S. Sharma V. Kumari S. Maken K. Kumari N. Kumar Non-metal modified TiO2: a step towards visible light photocatalysis J. Mater. Sci. -Mater. Electron. 30 2019 3186 3207 A. Mittal, B. Mari, S. Sharma, V. Kumari, S. Maken, K. Kumari, N. Kumar, Non-metal modified TiO2: a step towards visible light photocatalysis, Journal of Materials Science-Materials in Electronics, 30 (2019) 3186–3207. [27] T. Chen Q. Hao W. Yang C. Xie D. Chen C. Ma W. Yao Y. Zhu A honeycomb multilevel structure Bi2O3 with highly efficient catalytic activity driven by bias voltage and oxygen defect Appl. Catal. B: Environ. 237 2018 442 448 T. Chen, Q. Hao, W. Yang, C. Xie, D. Chen, C. Ma, W. Yao, Y. Zhu, A honeycomb multilevel structure Bi2O3 with highly efficient catalytic activity driven by bias voltage and oxygen defect, Applied Catalysis B: Environmental, 237 (2018) 442–448. [28] J. Chen J. Zhan Q. Li Exploration and crystal phase engineering from bismuthinite ore to visible-light responsive photocatalyst of Bi2O3 J. Environ. Chem. Eng. 7 2019 103375 J. Chen, J. Zhan, Q. Li, Exploration and crystal phase engineering from bismuthinite ore to visible-light responsive photocatalyst of Bi2O3, Journal of Environmental Chemical Engineering, 7 (2019) 103375. [29] Z. Lingxia W. Qiang S. Meng W. Min L. Yaxin Bi-doped ceria with increased oxygen vacancy for enhanced CO2 photoreduction performance J. Inorg. Mater. 36 2021 88 96 Z. Lingxia, W. Qiang, S. Meng, W. Min, L. Yaxin, Bi-doped Ceria with Increased Oxygen Vacancy for Enhanced CO2 Photoreduction Performance, Journal of Inorganic Materials, 36 (2021) 88–96. [30] T. Zhang X.T. Zeng Y.D. Xia H. Zhang B. Sun H.Y. Wang Y. Zhao Morphology evolution and photocatalytic applications of W-doped Bi2O3 films prepared using unique oblique angle co-sputtering technology Ceram. Int. 45 2019 21968 21974 T. Zhang, X.T. Zeng, Y.D. Xia, H. Zhang, B. Sun, H.Y. Wang, Y. Zhao, Morphology evolution and photocatalytic applications of W-doped Bi2O3 films prepared using unique oblique angle co-sputtering technology, Ceramics International, 45 (2019) 21968–21974. [31] S. Sajjad S.A.K. Leghari F. Chen J.L. Zhang Bismuth-doped ordered mesoporous TiO2: visible-light catalyst for simultaneous degradation of phenol and chromium Chem. -a Eur. J. 16 2010 13795 13804 S. Sajjad, S.A.K. Leghari, F. Chen, J.L. Zhang, Bismuth-Doped Ordered Mesoporous TiO2: Visible-Light Catalyst for Simultaneous Degradation of Phenol and Chromium, Chemistry-a European Journal, 16 (2010) 13795–13804. [32] Z. Qiu X. Guo J. Mao R. Zhou Insights into the structure-performance relationship of CuOx-CeO2 catalysts for preferential oxidation of CO: Investigation on thermally induced copper migration process Appl. Surf. Sci. 600 2022 154100 Z. Qiu, X. Guo, J. Mao, R. Zhou, Insights into the structure-performance relationship of CuOx-CeO2 catalysts for preferential oxidation of CO: Investigation on thermally induced copper migration process, Applied Surface Science, 600 (2022) 154100. [33] Y. Xiong L. Li L. Zhang Y. Cao S. Yu C. Tang L. Dong Migration of copper species in CexCu1−xO2 catalyst driven by thermal treatment and the effect on CO oxidation Phys. Chem. Chem. Phys. 19 2017 21840 21847 Y. Xiong, L. Li, L. Zhang, Y. Cao, S. Yu, C. Tang, L. Dong, Migration of copper species in CexCu1−xO2 catalyst driven by thermal treatment and the effect on CO oxidation, Physical Chemistry Chemical Physics, 19 (2017) 21840–21847. [34] M. Wang M. Shen X. Jin J. Tian M. Li Y. Zhou L. Zhang Y. Li J. Shi Oxygen vacancy generation and stabilization in CeO2–x by Cu introduction with Improved CO2 photocatalytic reduction activity ACS Catal. 9 2019 4573 4581 M. Wang, M. Shen, X. Jin, J. Tian, M. Li, Y. Zhou, L. Zhang, Y. Li, J. Shi, Oxygen Vacancy Generation and Stabilization in CeO2–x by Cu Introduction with Improved CO2 Photocatalytic Reduction Activity, ACS Catalysis, 9 (2019) 4573–4581. [35] L.F. Liotta G. Di Carlo G. Pantaleo A.M. Venezia G. Deganello Co3O4/CeO2 composite oxides for methane emissions abatement: relationship between Co3O4–CeO2 interaction and catalytic activity Appl. Catal. B: Environ. 66 2006 217 227 L.F. Liotta, G. Di Carlo, G. Pantaleo, A.M. Venezia, G. Deganello, Co3O4/CeO2 composite oxides for methane emissions abatement: Relationship between Co3O4–CeO2 interaction and catalytic activity, Applied Catalysis B: Environmental, 66 (2006) 217–227. [36] W. Xiaohong Q. Wei H. Weidong Thin bismuth oxide films prepared through the sol–gel method as photocatalyst J. Mol. Catal. A: Chem. 261 2007 167 171 W. Xiaohong, Q. Wei, H. Weidong, Thin bismuth oxide films prepared through the sol–gel method as photocatalyst, Journal of Molecular Catalysis A: Chemical, 261 (2007) 167–171. [37] X.X. Guo D. Wu X. Long Z.H. Zhang F.L. Wang G.H. Ai X.H. Liu Nanosheets-assembled Bi2WO6 microspheres with efficient visible-light-driven photocatalytic activities Mater. Charact. 163 2020 110297 X.X. Guo, D. Wu, X. Long, Z.H. Zhang, F.L. Wang, G.H. Ai, X.H. Liu, Nanosheets-assembled Bi2WO6 microspheres with efficient visible-light-driven photocatalytic activities, Materials Characterization, 163 (2020) 110297. [38] Y. Ye L. Gao J. Xu L. Wang L. Mo X. Zhang Effect of CuO species and oxygen vacancies over CuO/CeO2 catalysts on low-temperature oxidation of ethyl acetate J. Rare Earths 41 2023 862 869 Y. Ye, L. Gao, J. Xu, L. Wang, L. Mo, X. Zhang, Effect of CuO species and oxygen vacancies over CuO/CeO2 catalysts on low-temperature oxidation of ethyl acetate, Journal of Rare Earths, 41 (2023) 862–869. [39] S. Loridant Raman spectroscopy as a powerful tool to characterize ceria-based catalysts Catal. Today 373 2020 98 111 S. Loridant, Raman spectroscopy as a powerful tool to characterize ceria-based catalysts, Catalysis Today, 373 (2020) 98–111. [40] K. Ansari S. Kumar A. Sato R. Hattori K. Matsuishi K. Marumoto N. Chouhan Reversible shuffling of the Ce3+↔Ce4+ through anion(O/P) for efficient overall photocatalytic water splitting with P-doped ceria bismuth oxide J. Mol. Liq. 383 2023 122103 K. Ansari, S. Kumar, A. Sato, R. Hattori, K. Matsuishi, K. Marumoto, N. Chouhan, Reversible shuffling of the Ce3+↔Ce4+ through anion(O/P) for efficient overall photocatalytic water splitting with P-doped ceria bismuth oxide, Journal of Molecular Liquids, 383 (2023) 122103. [41] X. Guo Z. Qiu J. Mao R. Zhou Doping effect of transition metals (Zr, Mn, Ti and Ni) on well-shaped CuO/CeO2 (rods): nano/micro structure and catalytic performance for selective oxidation of CO in excess H2 Phys. Chem. Chem. Phys. 20 2018 25983 25994 X. Guo, Z. Qiu, J. Mao, R. Zhou, Doping effect of transition metals (Zr, Mn, Ti and Ni) on well-shaped CuO/CeO2 (rods): nano/micro structure and catalytic performance for selective oxidation of CO in excess H2, Physical Chemistry Chemical Physics, 20 (2018) 25983–25994. [42] Y. Su L. Dai Q. Zhang Y. Li J. Peng Ra Wu W. Han Z. Tang Y. Wang Fabrication of Cu-doped CeO2 catalysts with different dimension pore structures for CO catalytic oxidation Catal. Surv. Asia 20 2016 231 240 Y. Su, L. Dai, Q. Zhang, Y. Li, J. Peng, Ra Wu, W. Han, Z. Tang, Y. Wang, Fabrication of Cu-doped CeO2 catalysts with different dimension pore structures for CO catalytic oxidation, Catalysis Surveys from Asia, 20 (2016) 231–240. [43] J. He H. Zhang W. Wang P. Yao Y. Jiao J. Wang Y. Chen Soot combustion over CeO2 catalyst: the influence of biodiesel impurities (Na, K, Ca, P) on surface chemical properties Environ. Sci. Pollut. Res. 28 2021 26018 26029 J. He, H. Zhang, W. Wang, P. Yao, Y. Jiao, J. Wang, Y. Chen, Soot combustion over CeO2 catalyst: the influence of biodiesel impurities (Na, K, Ca, P) on surface chemical properties, Environmental Science and Pollution Research, 28 (2021) 26018–26029. [44] M.M.M. Mostafa A. Shawky S.F. Zaman K. Narasimharao M.A. Salam A.A. Alshehri N.H. Khdary S. Al-Faifi A.D. Chowdhury Visible-light-driven CO reduction into methanol utilizing sol-gel-prepared CeO2-coupled Bi2O3 nanocomposite heterojunctions Catalysts 12 2022 1479 M.M.M. Mostafa, A. Shawky, S.F. Zaman, K. Narasimharao, M.A. Salam, A.A. Alshehri, N.H. Khdary, S. Al-Faifi, A.D. Chowdhury, Visible-Light-Driven CO Reduction into Methanol Utilizing Sol-Gel-Prepared CeO2-Coupled Bi2O3 Nanocomposite Heterojunctions, Catalysts, 12 (2022) 1479. [45] C. Jiang H. Wang Y. Wang C. Xue Z. Yang C. Yu H. Ji Modifying defect States in CeO2 by Fe doping: a strategy for low-temperature catalytic oxidation of toluene with sunlight J. Hazard. Mater. 390 2020 122182 C. Jiang, H. Wang, Y. Wang, C. Xue, Z. Yang, C. Yu, H. Ji, Modifying defect States in CeO2 by Fe doping: A strategy for low-temperature catalytic oxidation of toluene with sunlight, Journal of Hazardous Materials, 390 (2020) 122182. [46] C. Sun H. Li L. Chen Study of flowerlike CeO2 microspheres used as catalyst supports for CO oxidation reaction J. Phys. Chem. Solids 68 2007 1785 1790 C. Sun, H. Li, L. Chen, Study of flowerlike CeO2 microspheres used as catalyst supports for CO oxidation reaction, Journal of Physics and Chemistry of Solids, 68 (2007) 1785–1790. [47] X.L. Guo S.Y. Zhong W.X. Ye A. Zhou Z. Chen D.F. Jin Q.L. Kang M.Q. Fan T.L. Ma 3D homogeneous porous copper-ceria catalyst for solar light driven photothermal CO-PROX in H2-rich gas: Enhanced light absorption and abundant oxygen vacancy, Molecular Catalysis 547 2023 113416 X.L. Guo, S.Y. Zhong, W.X. Ye, A. Zhou, Z. Chen, D.F. Jin, Q.L. Kang, M.Q. Fan, T.L. Ma, 3D homogeneous porous copper-ceria catalyst for solar light driven photothermal CO-PROX in H2-rich gas: Enhanced light absorption and abundant oxygen vacancy, Molecular Catalysis, 547 (2023) 113416.",
      "scopus-id": "85181713498",
      "coredata": {
        "eid": "1-s2.0-S0926860X23005203",
        "dc:description": "The wide band gap of ceria limited the light absorption and photothermal conversion of copper-ceria catalyst for photothermal preferential oxidation of CO (CO-PROX). In the present work, doping Bi element was adopted to regulate the energy band and catalytic performance of CuCeO2−x nanorod catalysts for photothermal CO-PROX. Bi/CuCeO2−x nanorods were synthesized by co-precipitation hydrothermal and deposition precipitation method. The Bi/CuCeO2−x catalyst with the molar ratio of Bi/Ce 2.5% exhibited the best catalytic performance and the CO conversion reached 90% under 2.5 suns with a surface temperature of 120 °C. The doped Bi species were incorporated into the CeO2 lattice and promoted the formation of oxygen vacancy sites and the strong Cu-Ce interaction, as revealed by XRD, XPS, Raman and H2-TPR results. In addition, doping Bi reduced the band gap of ceria nanorod from 2.77 to 2.47 eV and remarkably enhanced the UV–vis light response and photogenerated carrier separation of Bi/CuCeO2−x-2.5.",
        "openArchiveArticle": "false",
        "prism:coverDate": "2024-01-25",
        "openaccessUserLicense": null,
        "prism:aggregationType": "Journal",
        "prism:url": "https://api.elsevier.com/content/article/pii/S0926860X23005203",
        "dc:creator": [
          {
            "@_fa": "true",
            "$": "Cheng, Wan"
          },
          {
            "@_fa": "true",
            "$": "Huang, Dianyu"
          },
          {
            "@_fa": "true",
            "$": "Zeng, Jiayu"
          },
          {
            "@_fa": "true",
            "$": "Fan, Meiqiang"
          },
          {
            "@_fa": "true",
            "$": "Jin, Dingfeng"
          },
          {
            "@_fa": "true",
            "$": "Ma, Tingli"
          },
          {
            "@_fa": "true",
            "$": "Guo, Xiaolin"
          }
        ],
        "link": [
          {
            "@_fa": "true",
            "@rel": "self",
            "@href": "https://api.elsevier.com/content/article/pii/S0926860X23005203"
          },
          {
            "@_fa": "true",
            "@rel": "scidir",
            "@href": "https://www.sciencedirect.com/science/article/pii/S0926860X23005203"
          }
        ],
        "dc:format": "application/json",
        "openaccessType": null,
        "pii": "S0926-860X(23)00520-3",
        "prism:volume": "670",
        "articleNumber": "119540",
        "prism:publisher": "Elsevier B.V.",
        "dc:title": "Bi-doped CuCeO2−x nanorod catalysts for photothermal CO-PROX in H2-rich streams: Enhanced oxygen vacancy and light absorption capacity",
        "prism:copyright": "© 2023 Elsevier B.V. All rights reserved.",
        "openaccess": "0",
        "prism:issn": "0926860X",
        "dcterms:subject": [
          {
            "@_fa": "true",
            "$": "Preferential oxidation of CO"
          },
          {
            "@_fa": "true",
            "$": "Photothermal"
          },
          {
            "@_fa": "true",
            "$": "CuCeO2−x nanorod catalyst"
          },
          {
            "@_fa": "true",
            "$": "Bi dopant"
          },
          {
            "@_fa": "true",
            "$": "Oxygen vacancy"
          }
        ],
        "openaccessArticle": "false",
        "prism:publicationName": "Applied Catalysis A: General",
        "openaccessSponsorType": null,
        "prism:pageRange": "119540",
        "pubType": "fla",
        "prism:coverDisplayDate": "25 January 2024",
        "prism:doi": "10.1016/j.apcata.2023.119540",
        "prism:startingPage": "119540",
        "dc:identifier": "doi:10.1016/j.apcata.2023.119540",
        "openaccessSponsorName": null
      },
      "objects": {
        "object": [
          {
            "@category": "standard",
            "@height": "279",
            "@width": "750",
            "@_fa": "true",
            "$": "https://api.elsevier.com/content/object/eid/1-s2.0-S0926860X23005203-gr6.jpg?httpAccept=%2A%2F%2A",
            "@multimediatype": "JPEG image file",
            "@type": "IMAGE-DOWNSAMPLED",
            "@size": "41519",
            "@ref": "gr6",
            "@mimetype": "image/jpeg"
          },
          {
            "@category": "standard",
            "@height": "234",
            "@width": "376",
            "@_fa": "true",
            "$": "https://api.elsevier.com/content/object/eid/1-s2.0-S0926860X23005203-gr7.jpg?httpAccept=%2A%2F%2A",
            "@multimediatype": "JPEG image file",
            "@type": "IMAGE-DOWNSAMPLED",
            "@size": "11113",
            "@ref": "gr7",
            "@mimetype": "image/jpeg"
          },
          {
            "@category": "standard",
            "@height": "620",
            "@width": "751",
            "@_fa": "true",
            "$": "https://api.elsevier.com/content/object/eid/1-s2.0-S0926860X23005203-gr4.jpg?httpAccept=%2A%2F%2A",
            "@multimediatype": "JPEG image file",
            "@type": "IMAGE-DOWNSAMPLED",
            "@size": "79567",
            "@ref": "gr4",
            "@mimetype": "image/jpeg"
          },
          {
            "@category": "standard",
            "@height": "273",
            "@width": "753",
            "@_fa": "true",
            "$": "https://api.elsevier.com/content/object/eid/1-s2.0-S0926860X23005203-gr5.jpg?httpAccept=%2A%2F%2A",
            "@multimediatype": "JPEG image file",
            "@type": "IMAGE-DOWNSAMPLED",
            "@size": "44655",
            "@ref": "gr5",
            "@mimetype": "image/jpeg"
          },
          {
            "@category": "standard",
            "@height": "888",
            "@width": "764",
            "@_fa": "true",
            "$": "https://api.elsevier.com/content/object/eid/1-s2.0-S0926860X23005203-gr2.jpg?httpAccept=%2A%2F%2A",
            "@multimediatype": "JPEG image file",
            "@type": "IMAGE-DOWNSAMPLED",
            "@size": "108604",
            "@ref": "gr2",
            "@mimetype": "image/jpeg"
          },
          {
            "@category": "standard",
            "@height": "245",
            "@width": "231",
            "@_fa": "true",
            "$": "https://api.elsevier.com/content/object/eid/1-s2.0-S0926860X23005203-ga1.jpg?httpAccept=%2A%2F%2A",
            "@multimediatype": "JPEG image file",
            "@type": "IMAGE-DOWNSAMPLED",
            "@size": "18757",
            "@ref": "ga1",
            "@mimetype": "image/jpeg"
          },
          {
            "@category": "standard",
            "@height": "598",
            "@width": "751",
            "@_fa": "true",
            "$": "https://api.elsevier.com/content/object/eid/1-s2.0-S0926860X23005203-gr3.jpg?httpAccept=%2A%2F%2A",
            "@multimediatype": "JPEG image file",
            "@type": "IMAGE-DOWNSAMPLED",
            "@size": "61720",
            "@ref": "gr3",
            "@mimetype": "image/jpeg"
          },
          {
            "@category": "standard",
            "@height": "583",
            "@width": "753",
            "@_fa": "true",
            "$": "https://api.elsevier.com/content/object/eid/1-s2.0-S0926860X23005203-gr1.jpg?httpAccept=%2A%2F%2A",
            "@multimediatype": "JPEG image file",
            "@type": "IMAGE-DOWNSAMPLED",
            "@size": "116670",
            "@ref": "gr1",
            "@mimetype": "image/jpeg"
          },
          {
            "@category": "thumbnail",
            "@height": "82",
            "@width": "219",
            "@_fa": "true",
            "$": "https://api.elsevier.com/content/object/eid/1-s2.0-S0926860X23005203-gr6.sml?httpAccept=%2A%2F%2A",
            "@multimediatype": "GIF image file",
            "@type": "IMAGE-THUMBNAIL",
            "@size": "5031",
            "@ref": "gr6",
            "@mimetype": "image/gif"
          },
          {
            "@category": "thumbnail",
            "@height": "136",
            "@width": "219",
            "@_fa": "true",
            "$": "https://api.elsevier.com/content/object/eid/1-s2.0-S0926860X23005203-gr7.sml?httpAccept=%2A%2F%2A",
            "@multimediatype": "GIF image file",
            "@type": "IMAGE-THUMBNAIL",
            "@size": "3976",
            "@ref": "gr7",
            "@mimetype": "image/gif"
          },
          {
            "@category": "thumbnail",
            "@height": "164",
            "@width": "199",
            "@_fa": "true",
            "$": "https://api.elsevier.com/content/object/eid/1-s2.0-S0926860X23005203-gr4.sml?httpAccept=%2A%2F%2A",
            "@multimediatype": "GIF image file",
            "@type": "IMAGE-THUMBNAIL",
            "@size": "9076",
            "@ref": "gr4",
            "@mimetype": "image/gif"
          },
          {
            "@category": "thumbnail",
            "@height": "79",
            "@width": "219",
            "@_fa": "true",
            "$": "https://api.elsevier.com/content/object/eid/1-s2.0-S0926860X23005203-gr5.sml?httpAccept=%2A%2F%2A",
            "@multimediatype": "GIF image file",
            "@type": "IMAGE-THUMBNAIL",
            "@size": "5392",
            "@ref": "gr5",
            "@mimetype": "image/gif"
          },
          {
            "@category": "thumbnail",
            "@height": "164",
            "@width": "141",
            "@_fa": "true",
            "$": "https://api.elsevier.com/content/object/eid/1-s2.0-S0926860X23005203-gr2.sml?httpAccept=%2A%2F%2A",
            "@multimediatype": "GIF image file",
            "@type": "IMAGE-THUMBNAIL",
            "@size": "6507",
            "@ref": "gr2",
            "@mimetype": "image/gif"
          },
          {
            "@category": "thumbnail",
            "@height": "164",
            "@width": "155",
            "@_fa": "true",
            "$": "https://api.elsevier.com/content/object/eid/1-s2.0-S0926860X23005203-ga1.sml?httpAccept=%2A%2F%2A",
            "@multimediatype": "GIF image file",
            "@type": "IMAGE-THUMBNAIL",
            "@size": "10814",
            "@ref": "ga1",
            "@mimetype": "image/gif"
          },
          {
            "@category": "thumbnail",
            "@height": "164",
            "@width": "206",
            "@_fa": "true",
            "$": "https://api.elsevier.com/content/object/eid/1-s2.0-S0926860X23005203-gr3.sml?httpAccept=%2A%2F%2A",
            "@multimediatype": "GIF image file",
            "@type": "IMAGE-THUMBNAIL",
            "@size": "6286",
            "@ref": "gr3",
            "@mimetype": "image/gif"
          },
          {
            "@category": "thumbnail",
            "@height": "164",
            "@width": "212",
            "@_fa": "true",
            "$": "https://api.elsevier.com/content/object/eid/1-s2.0-S0926860X23005203-gr1.sml?httpAccept=%2A%2F%2A",
            "@multimediatype": "GIF image file",
            "@type": "IMAGE-THUMBNAIL",
            "@size": "15637",
            "@ref": "gr1",
            "@mimetype": "image/gif"
          },
          {
            "@category": "high",
            "@height": "1234",
            "@width": "3313",
            "@_fa": "true",
            "$": "https://api.elsevier.com/content/object/eid/1-s2.0-S0926860X23005203-gr6_lrg.jpg?httpAccept=%2A%2F%2A",
            "@multimediatype": "JPEG image file",
            "@type": "IMAGE-HIGH-RES",
            "@size": "255504",
            "@ref": "gr6",
            "@mimetype": "image/jpeg"
          },
          {
            "@category": "high",
            "@height": "1036",
            "@width": "1663",
            "@_fa": "true",
            "$": "https://api.elsevier.com/content/object/eid/1-s2.0-S0926860X23005203-gr7_lrg.jpg?httpAccept=%2A%2F%2A",
            "@multimediatype": "JPEG image file",
            "@type": "IMAGE-HIGH-RES",
            "@size": "62307",
            "@ref": "gr7",
            "@mimetype": "image/jpeg"
          },
          {
            "@category": "high",
            "@height": "2743",
            "@width": "3324",
            "@_fa": "true",
            "$": "https://api.elsevier.com/content/object/eid/1-s2.0-S0926860X23005203-gr4_lrg.jpg?httpAccept=%2A%2F%2A",
            "@multimediatype": "JPEG image file",
            "@type": "IMAGE-HIGH-RES",
            "@size": "524692",
            "@ref": "gr4",
            "@mimetype": "image/jpeg"
          },
          {
            "@category": "high",
            "@height": "1205",
            "@width": "3326",
            "@_fa": "true",
            "$": "https://api.elsevier.com/content/object/eid/1-s2.0-S0926860X23005203-gr5_lrg.jpg?httpAccept=%2A%2F%2A",
            "@multimediatype": "JPEG image file",
            "@type": "IMAGE-HIGH-RES",
            "@size": "271242",
            "@ref": "gr5",
            "@mimetype": "image/jpeg"
          },
          {
            "@category": "high",
            "@height": "3925",
            "@width": "3376",
            "@_fa": "true",
            "$": "https://api.elsevier.com/content/object/eid/1-s2.0-S0926860X23005203-gr2_lrg.jpg?httpAccept=%2A%2F%2A",
            "@multimediatype": "JPEG image file",
            "@type": "IMAGE-HIGH-RES",
            "@size": "684976",
            "@ref": "gr2",
            "@mimetype": "image/jpeg"
          },
          {
            "@category": "high",
            "@height": "1085",
            "@width": "1025",
            "@_fa": "true",
            "$": "https://api.elsevier.com/content/object/eid/1-s2.0-S0926860X23005203-ga1_lrg.jpg?httpAccept=%2A%2F%2A",
            "@multimediatype": "JPEG image file",
            "@type": "IMAGE-HIGH-RES",
            "@size": "137383",
            "@ref": "ga1",
            "@mimetype": "image/jpeg"
          },
          {
            "@category": "high",
            "@height": "2649",
            "@width": "3325",
            "@_fa": "true",
            "$": "https://api.elsevier.com/content/object/eid/1-s2.0-S0926860X23005203-gr3_lrg.jpg?httpAccept=%2A%2F%2A",
            "@multimediatype": "JPEG image file",
            "@type": "IMAGE-HIGH-RES",
            "@size": "415184",
            "@ref": "gr3",
            "@mimetype": "image/jpeg"
          },
          {
            "@category": "high",
            "@height": "2575",
            "@width": "3326",
            "@_fa": "true",
            "$": "https://api.elsevier.com/content/object/eid/1-s2.0-S0926860X23005203-gr1_lrg.jpg?httpAccept=%2A%2F%2A",
            "@multimediatype": "JPEG image file",
            "@type": "IMAGE-HIGH-RES",
            "@size": "755946",
            "@ref": "gr1",
            "@mimetype": "image/jpeg"
          },
          {
            "@category": "standard",
            "@_fa": "true",
            "$": "https://api.elsevier.com/content/object/eid/1-s2.0-S0926860X23005203-mmc1.docx?httpAccept=%2A%2F%2A",
            "@multimediatype": "Microsoft Word file",
            "@type": "APPLICATION",
            "@size": "1849846",
            "@ref": "mmc1",
            "@mimetype": "application/word"
          },
          {
            "@category": "thumbnail",
            "@_fa": "true",
            "$": "https://api.elsevier.com/content/object/eid/1-s2.0-S0926860X23005203-si0001.svg?httpAccept=%2A%2F%2A",
            "@multimediatype": "Scalable Vector Graphics file",
            "@type": "ALTIMG",
            "@size": "3306",
            "@ref": "si0001",
            "@mimetype": "image/svg+xml"
          },
          {
            "@category": "thumbnail",
            "@_fa": "true",
            "$": "https://api.elsevier.com/content/object/eid/1-s2.0-S0926860X23005203-si0002.svg?httpAccept=%2A%2F%2A",
            "@multimediatype": "Scalable Vector Graphics file",
            "@type": "ALTIMG",
            "@size": "4526",
            "@ref": "si0002",
            "@mimetype": "image/svg+xml"
          },
          {
            "@category": "standard",
            "@_fa": "true",
            "$": "https://api.elsevier.com/content/object/eid/1-s2.0-S0926860X23005203-am.pdf?httpAccept=%2A%2F%2A",
            "@multimediatype": "Acrobat PDF file",
            "@type": "AAM-PDF",
            "@size": "1328443",
            "@ref": "am",
            "@mimetype": "application/pdf"
          }
        ]
      },
      "link": {
        "@rel": "abstract",
        "@href": "https://api.elsevier.com/content/abstract/scopus_id/85181713498"
      }
    }
  }
}