{
  "metadata": {
    "title": "Ethanol electro-oxidation using cadmium-doped cobalt/carbon nanoparticles as novel non precious electrocatalyst",
    "authors": "; ; ",
    "journal": "Applied Catalysis A: General",
    "date": "2013-03-30",
    "doi": "10.1016/j.apcata.2013.02.004",
    "abstract": "",
    "uri": "https://api.elsevier.com/content/article/pii/S0926860X13000823",
    "pii": "S0926860X13000823"
  },
  "fulltext": {
    "full-text-retrieval-response": {
      "scopus-eid": "2-s2.0-84875984321",
      "originalText": "serial JL 271346 291210 291744 291809 31 Applied Catalysis A: General APPLIEDCATALYSISAGENERAL 2013-02-20 2013-02-20 2013-04-06T22:29:10 1-s2.0-S0926860X13000823 S0926-860X(13)00082-3 S0926860X13000823 10.1016/j.apcata.2013.02.004 S300 S300.1 FULL-TEXT 1-s2.0-S0926860X13X00043 2024-01-01T12:29:14.622205Z 0 0 20130330 2013 2013-02-20T00:00:00Z articleinfo crossmark dco dateupdated tomb dateloaded datesearch indexeddate volumelist yearnav absattachment articletitlenorm authfirstinitialnorm authfirstsurnamenorm cid cids contenttype copyright dateloadedtxt docsubtype doctype doi eid ewtransactionid hubeid issn issnnorm itemstage itemtransactionid itemweight openaccess openarchive pg pgfirst pglast pii piinorm pubdatestart pubdatetxt pubyr sectiontitle sortorder srctitle srctitlenorm srctype subheadings suppl volfirst volissue webpdf webpdfpagecount figure body mmlmath acknowledge affil articletitle auth authfirstini authfull authkeywords authlast primabst ref specialabst alllist content subj ssids 0926-860X 0926860X true 455 455 C Volume 455 25 193 198 193 198 20130330 30 March 2013 2013-03-30 2013 Articles article fla Copyright © 2013 Elsevier B.V. All rights reserved. ETHANOLELECTROOXIDATIONUSINGCADMIUMDOPEDCOBALTCARBONNANOPARTICLESNOVELNONPRECIOUSELECTROCATALYST BARAKAT N 1 Introduction 2 Experimental 2.1 Materials 2.2 Procedures 2.3 Characterization 3 Results and discussion 4 Conclusion Acknowledgements References KAMARUDIN 2012 M ROELOFS 2011 727 735 K WONGYAO 2011 2676 2681 N LOPES 2008 5563 5570 T REN 2000 111 116 X LIU 2004 8234 8240 Z MU 2005 22212 22216 Y LI 2004 1045 1055 W SHEN 2008 7276 7280 J YEN 2007 2268 2271 C FRACKOWIAK 2006 129 132 E PAULUS 2002 4181 4191 U HAMPSON 1979 191 201 N GASTEIGER 1993 H WANG 2004 345 348 C LI 2002 787 790 W LI 2003 6292 6299 W STEIGERWALT 2001 8097 8101 E LU 2008 3930 3937 Y BARAKAT 2013 3387 3394 N RASHIDI 2009 509 516 R YOUSEF 2012 1668 1677 A BARAKAT 2009 7371 7378 N BARAKAT 2011 10957 10964 N WANJUN 2007 329 332 T MCINTYRE 1975 2208 2213 N HOTA 2007 5 12 G GULINO 2002 704 709 A CHANG 2007 695 699 J RAHIM 2004 160 169 A THALLER 1996 53 61 L FLEISCHMANN 1971 39 49 M VUKOVIC 1994 878 882 M ENEA 1990 375 378 O HASSAN 2011 5117 5127 H OLIVA 1982 229 255 P SAVADOGO 1998 361 388 O WANG 2006 37 43 Z GARCIARODRIGUEZ 2011 520 528 S AMMAM 2013 79 87 M GENG 2007 11897 11902 D SHUKLA 1995 87 91 A DINH 2000 222 233 H HAMNETT 1997 445 457 A BARAKATX2013X193 BARAKATX2013X193X198 BARAKATX2013X193XN BARAKATX2013X193X198XN item S0926-860X(13)00082-3 S0926860X13000823 1-s2.0-S0926860X13000823 10.1016/j.apcata.2013.02.004 271346 2024-01-01T12:29:14.622205Z 2013-03-30 1-s2.0-S0926860X13000823-main.pdf https://s3.amazonaws.com/prod-ucs-content-store-us-east/content/pii:S0926860X13000823/MAIN/application/pdf/4481f43065cd437b9ca30865615e00e3/main.pdf https://s3-eu-west-1.amazonaws.com/prod-ucs-content-store-eu-west/content/pii:S0926860X13000823/MAIN/application/pdf/4481f43065cd437b9ca30865615e00e3/main.pdf main.pdf pdf true 1003417 MAIN 6 1-s2.0-S0926860X13000823-main_1.png https://s3-eu-west-1.amazonaws.com/prod-ucs-content-store-eu-west/content/pii:S0926860X13000823/PREVIEW/image/png/7a41fbefdd90da5e54ec142764d7d655/main_1.png https://s3.amazonaws.com/prod-ucs-content-store-us-east/content/pii:S0926860X13000823/PREVIEW/image/png/7a41fbefdd90da5e54ec142764d7d655/main_1.png main_1.png png 61461 849 656 IMAGE-WEB-PDF 1 1-s2.0-S0926860X13000823-si2.gif https://s3.amazonaws.com/prod-ucs-content-store-us-east/content/pii:S0926860X13000823/STRIPIN/image/gif/13c70f1b29ded1f03aefe2b1798f65fa/si2.gif https://s3-eu-west-1.amazonaws.com/prod-ucs-content-store-eu-west/content/pii:S0926860X13000823/STRIPIN/image/gif/13c70f1b29ded1f03aefe2b1798f65fa/si2.gif si2 si2.gif gif 710 13 187 ALTIMG 1-s2.0-S0926860X13000823-si1.gif https://s3.amazonaws.com/prod-ucs-content-store-us-east/content/pii:S0926860X13000823/STRIPIN/image/gif/18d483d99c561b7353a809c3569e35bf/si1.gif https://s3-eu-west-1.amazonaws.com/prod-ucs-content-store-eu-west/content/pii:S0926860X13000823/STRIPIN/image/gif/18d483d99c561b7353a809c3569e35bf/si1.gif si1 si1.gif gif 929 16 261 ALTIMG 1-s2.0-S0926860X13000823-fx1_lrg.jpg https://s3.amazonaws.com/prod-ucs-content-store-us-east/content/pii:S0926860X13000823/fx1/HIGHRES/image/jpeg/cc7332f9007370fcf2427bf2002cabb7/fx1_lrg.jpg https://s3-eu-west-1.amazonaws.com/prod-ucs-content-store-eu-west/content/pii:S0926860X13000823/fx1/HIGHRES/image/jpeg/cc7332f9007370fcf2427bf2002cabb7/fx1_lrg.jpg fx1 true fx1_lrg.jpg jpg 144154 886 1162 IMAGE-HIGH-RES 1-s2.0-S0926860X13000823-gr9_lrg.jpg https://s3.amazonaws.com/prod-ucs-content-store-us-east/content/pii:S0926860X13000823/gr9/HIGHRES/image/jpeg/b14ad6865a79abf4b7345ac324df1f11/gr9_lrg.jpg https://s3-eu-west-1.amazonaws.com/prod-ucs-content-store-eu-west/content/pii:S0926860X13000823/gr9/HIGHRES/image/jpeg/b14ad6865a79abf4b7345ac324df1f11/gr9_lrg.jpg gr9 gr9_lrg.jpg jpg 112140 1205 1638 IMAGE-HIGH-RES 1-s2.0-S0926860X13000823-gr8_lrg.jpg https://s3.amazonaws.com/prod-ucs-content-store-us-east/content/pii:S0926860X13000823/gr8/HIGHRES/image/jpeg/45c86650d209f4ddaac1cb8240f84d29/gr8_lrg.jpg https://s3-eu-west-1.amazonaws.com/prod-ucs-content-store-eu-west/content/pii:S0926860X13000823/gr8/HIGHRES/image/jpeg/45c86650d209f4ddaac1cb8240f84d29/gr8_lrg.jpg gr8 gr8_lrg.jpg jpg 505390 2372 2142 IMAGE-HIGH-RES 1-s2.0-S0926860X13000823-gr7_lrg.jpg https://s3.amazonaws.com/prod-ucs-content-store-us-east/content/pii:S0926860X13000823/gr7/HIGHRES/image/jpeg/8bf48c2d3c9e3956954c0ebab628019a/gr7_lrg.jpg https://s3-eu-west-1.amazonaws.com/prod-ucs-content-store-eu-west/content/pii:S0926860X13000823/gr7/HIGHRES/image/jpeg/8bf48c2d3c9e3956954c0ebab628019a/gr7_lrg.jpg gr7 gr7_lrg.jpg jpg 180979 1275 1729 IMAGE-HIGH-RES 1-s2.0-S0926860X13000823-gr6_lrg.jpg https://s3.amazonaws.com/prod-ucs-content-store-us-east/content/pii:S0926860X13000823/gr6/HIGHRES/image/jpeg/04cad563a81e80c9f945240fc207f875/gr6_lrg.jpg https://s3-eu-west-1.amazonaws.com/prod-ucs-content-store-eu-west/content/pii:S0926860X13000823/gr6/HIGHRES/image/jpeg/04cad563a81e80c9f945240fc207f875/gr6_lrg.jpg gr6 gr6_lrg.jpg jpg 222602 1261 1663 IMAGE-HIGH-RES 1-s2.0-S0926860X13000823-gr5_lrg.jpg https://s3.amazonaws.com/prod-ucs-content-store-us-east/content/pii:S0926860X13000823/gr5/HIGHRES/image/jpeg/9f6bee7ca884101d8e4fa9dcf06c1f83/gr5_lrg.jpg https://s3-eu-west-1.amazonaws.com/prod-ucs-content-store-eu-west/content/pii:S0926860X13000823/gr5/HIGHRES/image/jpeg/9f6bee7ca884101d8e4fa9dcf06c1f83/gr5_lrg.jpg gr5 gr5_lrg.jpg jpg 327767 2427 1656 IMAGE-HIGH-RES 1-s2.0-S0926860X13000823-gr4_lrg.jpg https://s3.amazonaws.com/prod-ucs-content-store-us-east/content/pii:S0926860X13000823/gr4/HIGHRES/image/jpeg/3ab365c301a5dfe203bfea22fb9cbe2f/gr4_lrg.jpg https://s3-eu-west-1.amazonaws.com/prod-ucs-content-store-eu-west/content/pii:S0926860X13000823/gr4/HIGHRES/image/jpeg/3ab365c301a5dfe203bfea22fb9cbe2f/gr4_lrg.jpg gr4 gr4_lrg.jpg jpg 89120 1259 1646 IMAGE-HIGH-RES 1-s2.0-S0926860X13000823-gr3_lrg.jpg https://s3.amazonaws.com/prod-ucs-content-store-us-east/content/pii:S0926860X13000823/gr3/HIGHRES/image/jpeg/94f3f52949bec1601f5101c76dbfcf52/gr3_lrg.jpg https://s3-eu-west-1.amazonaws.com/prod-ucs-content-store-eu-west/content/pii:S0926860X13000823/gr3/HIGHRES/image/jpeg/94f3f52949bec1601f5101c76dbfcf52/gr3_lrg.jpg gr3 gr3_lrg.jpg jpg 215716 604 1750 IMAGE-HIGH-RES 1-s2.0-S0926860X13000823-gr2_lrg.jpg https://s3.amazonaws.com/prod-ucs-content-store-us-east/content/pii:S0926860X13000823/gr2/HIGHRES/image/jpeg/7ba35088a573cf89115f4d5bc81c74a6/gr2_lrg.jpg https://s3-eu-west-1.amazonaws.com/prod-ucs-content-store-eu-west/content/pii:S0926860X13000823/gr2/HIGHRES/image/jpeg/7ba35088a573cf89115f4d5bc81c74a6/gr2_lrg.jpg gr2 gr2_lrg.jpg jpg 256295 1271 1749 IMAGE-HIGH-RES 1-s2.0-S0926860X13000823-gr1_lrg.jpg https://s3.amazonaws.com/prod-ucs-content-store-us-east/content/pii:S0926860X13000823/gr1/HIGHRES/image/jpeg/1e8a417ac83b54569ff705335d6fd4db/gr1_lrg.jpg https://s3-eu-west-1.amazonaws.com/prod-ucs-content-store-eu-west/content/pii:S0926860X13000823/gr1/HIGHRES/image/jpeg/1e8a417ac83b54569ff705335d6fd4db/gr1_lrg.jpg gr1 gr1_lrg.jpg jpg 148414 1269 1722 IMAGE-HIGH-RES 1-s2.0-S0926860X13000823-fx2_lrg.gif https://s3.amazonaws.com/prod-ucs-content-store-us-east/content/pii:S0926860X13000823/fx2/HIGHRES/image/gif/72a1c8b66c6b361bc98cc77abb21a80b/fx2_lrg.gif https://s3-eu-west-1.amazonaws.com/prod-ucs-content-store-eu-west/content/pii:S0926860X13000823/fx2/HIGHRES/image/gif/72a1c8b66c6b361bc98cc77abb21a80b/fx2_lrg.gif fx2 fx2_lrg.gif gif 26919 1000 4314 IMAGE-HIGH-RES 1-s2.0-S0926860X13000823-fx1.jpg https://s3.amazonaws.com/prod-ucs-content-store-us-east/content/pii:S0926860X13000823/fx1/DOWNSAMPLED/image/jpeg/30485c0fdcaab339cbfb025e2e47248b/fx1.jpg https://s3-eu-west-1.amazonaws.com/prod-ucs-content-store-eu-west/content/pii:S0926860X13000823/fx1/DOWNSAMPLED/image/jpeg/30485c0fdcaab339cbfb025e2e47248b/fx1.jpg fx1 true fx1.jpg jpg 17416 200 262 IMAGE-DOWNSAMPLED 1-s2.0-S0926860X13000823-gr9.jpg https://s3.amazonaws.com/prod-ucs-content-store-us-east/content/pii:S0926860X13000823/gr9/DOWNSAMPLED/image/jpeg/1b9a0cdf33abe333adf7d8a338d73183/gr9.jpg https://s3-eu-west-1.amazonaws.com/prod-ucs-content-store-eu-west/content/pii:S0926860X13000823/gr9/DOWNSAMPLED/image/jpeg/1b9a0cdf33abe333adf7d8a338d73183/gr9.jpg gr9 gr9.jpg jpg 18793 272 370 IMAGE-DOWNSAMPLED 1-s2.0-S0926860X13000823-gr8.jpg https://s3.amazonaws.com/prod-ucs-content-store-us-east/content/pii:S0926860X13000823/gr8/DOWNSAMPLED/image/jpeg/4748969daeda531681ef695767e4fa76/gr8.jpg https://s3-eu-west-1.amazonaws.com/prod-ucs-content-store-eu-west/content/pii:S0926860X13000823/gr8/DOWNSAMPLED/image/jpeg/4748969daeda531681ef695767e4fa76/gr8.jpg gr8 gr8.jpg jpg 67012 536 484 IMAGE-DOWNSAMPLED 1-s2.0-S0926860X13000823-gr7.jpg https://s3.amazonaws.com/prod-ucs-content-store-us-east/content/pii:S0926860X13000823/gr7/DOWNSAMPLED/image/jpeg/a7bcc4c87de348397a7645f69634efaa/gr7.jpg https://s3-eu-west-1.amazonaws.com/prod-ucs-content-store-eu-west/content/pii:S0926860X13000823/gr7/DOWNSAMPLED/image/jpeg/a7bcc4c87de348397a7645f69634efaa/gr7.jpg gr7 gr7.jpg jpg 30105 288 390 IMAGE-DOWNSAMPLED 1-s2.0-S0926860X13000823-gr6.jpg https://s3.amazonaws.com/prod-ucs-content-store-us-east/content/pii:S0926860X13000823/gr6/DOWNSAMPLED/image/jpeg/88ae8ae145e83e1339477da05249696f/gr6.jpg https://s3-eu-west-1.amazonaws.com/prod-ucs-content-store-eu-west/content/pii:S0926860X13000823/gr6/DOWNSAMPLED/image/jpeg/88ae8ae145e83e1339477da05249696f/gr6.jpg gr6 gr6.jpg jpg 33616 284 375 IMAGE-DOWNSAMPLED 1-s2.0-S0926860X13000823-gr5.jpg https://s3.amazonaws.com/prod-ucs-content-store-us-east/content/pii:S0926860X13000823/gr5/DOWNSAMPLED/image/jpeg/9579e4ca4ec0bd5072f82a7c7eb48363/gr5.jpg https://s3-eu-west-1.amazonaws.com/prod-ucs-content-store-eu-west/content/pii:S0926860X13000823/gr5/DOWNSAMPLED/image/jpeg/9579e4ca4ec0bd5072f82a7c7eb48363/gr5.jpg gr5 gr5.jpg jpg 44346 548 374 IMAGE-DOWNSAMPLED 1-s2.0-S0926860X13000823-gr4.jpg https://s3.amazonaws.com/prod-ucs-content-store-us-east/content/pii:S0926860X13000823/gr4/DOWNSAMPLED/image/jpeg/6cfe833b8b9c3f2bd4ee7f379c1e11ce/gr4.jpg https://s3-eu-west-1.amazonaws.com/prod-ucs-content-store-eu-west/content/pii:S0926860X13000823/gr4/DOWNSAMPLED/image/jpeg/6cfe833b8b9c3f2bd4ee7f379c1e11ce/gr4.jpg gr4 gr4.jpg jpg 17829 284 371 IMAGE-DOWNSAMPLED 1-s2.0-S0926860X13000823-gr3.jpg https://s3.amazonaws.com/prod-ucs-content-store-us-east/content/pii:S0926860X13000823/gr3/DOWNSAMPLED/image/jpeg/79b09ec1268e0d7501d81a6c9c896868/gr3.jpg https://s3-eu-west-1.amazonaws.com/prod-ucs-content-store-eu-west/content/pii:S0926860X13000823/gr3/DOWNSAMPLED/image/jpeg/79b09ec1268e0d7501d81a6c9c896868/gr3.jpg gr3 gr3.jpg jpg 43079 227 659 IMAGE-DOWNSAMPLED 1-s2.0-S0926860X13000823-gr2.jpg https://s3.amazonaws.com/prod-ucs-content-store-us-east/content/pii:S0926860X13000823/gr2/DOWNSAMPLED/image/jpeg/3105eabc08d55f45d899913dde29b600/gr2.jpg https://s3-eu-west-1.amazonaws.com/prod-ucs-content-store-eu-west/content/pii:S0926860X13000823/gr2/DOWNSAMPLED/image/jpeg/3105eabc08d55f45d899913dde29b600/gr2.jpg gr2 gr2.jpg jpg 39548 287 395 IMAGE-DOWNSAMPLED 1-s2.0-S0926860X13000823-gr1.jpg https://s3.amazonaws.com/prod-ucs-content-store-us-east/content/pii:S0926860X13000823/gr1/DOWNSAMPLED/image/jpeg/4e226595389f40a82903cb6baf54ed5e/gr1.jpg https://s3-eu-west-1.amazonaws.com/prod-ucs-content-store-eu-west/content/pii:S0926860X13000823/gr1/DOWNSAMPLED/image/jpeg/4e226595389f40a82903cb6baf54ed5e/gr1.jpg gr1 gr1.jpg jpg 24339 287 389 IMAGE-DOWNSAMPLED 1-s2.0-S0926860X13000823-fx2.gif https://s3.amazonaws.com/prod-ucs-content-store-us-east/content/pii:S0926860X13000823/fx2/DOWNSAMPLED/image/gif/bf346670168822c4a9fc2f638e5781d0/fx2.gif https://s3-eu-west-1.amazonaws.com/prod-ucs-content-store-eu-west/content/pii:S0926860X13000823/fx2/DOWNSAMPLED/image/gif/bf346670168822c4a9fc2f638e5781d0/fx2.gif fx2 fx2.gif gif 3436 113 487 IMAGE-DOWNSAMPLED 1-s2.0-S0926860X13000823-fx2.sml https://s3.amazonaws.com/prod-ucs-content-store-us-east/content/pii:S0926860X13000823/fx2/THUMBNAIL/image/gif/d15b7e39975b2e7dde201753bac92685/fx2.sml https://s3-eu-west-1.amazonaws.com/prod-ucs-content-store-eu-west/content/pii:S0926860X13000823/fx2/THUMBNAIL/image/gif/d15b7e39975b2e7dde201753bac92685/fx2.sml fx2 fx2.sml sml 1318 51 219 IMAGE-THUMBNAIL 1-s2.0-S0926860X13000823-fx1.sml https://s3.amazonaws.com/prod-ucs-content-store-us-east/content/pii:S0926860X13000823/fx1/THUMBNAIL/image/gif/aed116400049c690e91a30ec1c763e58/fx1.sml https://s3-eu-west-1.amazonaws.com/prod-ucs-content-store-eu-west/content/pii:S0926860X13000823/fx1/THUMBNAIL/image/gif/aed116400049c690e91a30ec1c763e58/fx1.sml fx1 true fx1.sml sml 8132 164 215 IMAGE-THUMBNAIL 1-s2.0-S0926860X13000823-gr9.sml https://s3.amazonaws.com/prod-ucs-content-store-us-east/content/pii:S0926860X13000823/gr9/THUMBNAIL/image/gif/9d3c53c81ec4abbfcd0c64efd2be1ff1/gr9.sml https://s3-eu-west-1.amazonaws.com/prod-ucs-content-store-eu-west/content/pii:S0926860X13000823/gr9/THUMBNAIL/image/gif/9d3c53c81ec4abbfcd0c64efd2be1ff1/gr9.sml gr9 gr9.sml sml 3491 161 219 IMAGE-THUMBNAIL 1-s2.0-S0926860X13000823-gr8.sml https://s3.amazonaws.com/prod-ucs-content-store-us-east/content/pii:S0926860X13000823/gr8/THUMBNAIL/image/gif/3c216ae0875f8c520e5300dc7c537412/gr8.sml https://s3-eu-west-1.amazonaws.com/prod-ucs-content-store-eu-west/content/pii:S0926860X13000823/gr8/THUMBNAIL/image/gif/3c216ae0875f8c520e5300dc7c537412/gr8.sml gr8 gr8.sml sml 5131 164 148 IMAGE-THUMBNAIL 1-s2.0-S0926860X13000823-gr7.sml https://s3.amazonaws.com/prod-ucs-content-store-us-east/content/pii:S0926860X13000823/gr7/THUMBNAIL/image/gif/7841d9dd6bbf4c9e6098667061955b9f/gr7.sml https://s3-eu-west-1.amazonaws.com/prod-ucs-content-store-eu-west/content/pii:S0926860X13000823/gr7/THUMBNAIL/image/gif/7841d9dd6bbf4c9e6098667061955b9f/gr7.sml gr7 gr7.sml sml 4877 161 219 IMAGE-THUMBNAIL 1-s2.0-S0926860X13000823-gr6.sml https://s3.amazonaws.com/prod-ucs-content-store-us-east/content/pii:S0926860X13000823/gr6/THUMBNAIL/image/gif/5172e2d8dd25ca7e60a196f3c30f1eb1/gr6.sml https://s3-eu-west-1.amazonaws.com/prod-ucs-content-store-eu-west/content/pii:S0926860X13000823/gr6/THUMBNAIL/image/gif/5172e2d8dd25ca7e60a196f3c30f1eb1/gr6.sml gr6 gr6.sml sml 6103 164 216 IMAGE-THUMBNAIL 1-s2.0-S0926860X13000823-gr5.sml https://s3.amazonaws.com/prod-ucs-content-store-us-east/content/pii:S0926860X13000823/gr5/THUMBNAIL/image/gif/b1b8ea947a0605244c0fc31d0f6821c2/gr5.sml https://s3-eu-west-1.amazonaws.com/prod-ucs-content-store-eu-west/content/pii:S0926860X13000823/gr5/THUMBNAIL/image/gif/b1b8ea947a0605244c0fc31d0f6821c2/gr5.sml gr5 gr5.sml sml 4058 164 112 IMAGE-THUMBNAIL 1-s2.0-S0926860X13000823-gr4.sml https://s3.amazonaws.com/prod-ucs-content-store-us-east/content/pii:S0926860X13000823/gr4/THUMBNAIL/image/gif/e58a23899c05866c09c5cf7735dd330c/gr4.sml https://s3-eu-west-1.amazonaws.com/prod-ucs-content-store-eu-west/content/pii:S0926860X13000823/gr4/THUMBNAIL/image/gif/e58a23899c05866c09c5cf7735dd330c/gr4.sml gr4 gr4.sml sml 2491 164 214 IMAGE-THUMBNAIL 1-s2.0-S0926860X13000823-gr3.sml https://s3.amazonaws.com/prod-ucs-content-store-us-east/content/pii:S0926860X13000823/gr3/THUMBNAIL/image/gif/34e4477a2b2c83278c420c504b478997/gr3.sml https://s3-eu-west-1.amazonaws.com/prod-ucs-content-store-eu-west/content/pii:S0926860X13000823/gr3/THUMBNAIL/image/gif/34e4477a2b2c83278c420c504b478997/gr3.sml gr3 gr3.sml sml 5431 76 219 IMAGE-THUMBNAIL 1-s2.0-S0926860X13000823-gr2.sml https://s3.amazonaws.com/prod-ucs-content-store-us-east/content/pii:S0926860X13000823/gr2/THUMBNAIL/image/gif/e1736cb5ee46d1feb9a1d8a3571ad841/gr2.sml https://s3-eu-west-1.amazonaws.com/prod-ucs-content-store-eu-west/content/pii:S0926860X13000823/gr2/THUMBNAIL/image/gif/e1736cb5ee46d1feb9a1d8a3571ad841/gr2.sml gr2 gr2.sml sml 7440 159 219 IMAGE-THUMBNAIL 1-s2.0-S0926860X13000823-gr1.sml https://s3.amazonaws.com/prod-ucs-content-store-us-east/content/pii:S0926860X13000823/gr1/THUMBNAIL/image/gif/fae35b6895c5d5723ad7ac060e4f0f66/gr1.sml https://s3-eu-west-1.amazonaws.com/prod-ucs-content-store-eu-west/content/pii:S0926860X13000823/gr1/THUMBNAIL/image/gif/fae35b6895c5d5723ad7ac060e4f0f66/gr1.sml gr1 gr1.sml sml 4395 161 219 IMAGE-THUMBNAIL APCATA 14095 S0926-860X(13)00082-3 10.1016/j.apcata.2013.02.004 Elsevier B.V. Fig. 1 XRD analysis for the obtained powder after the calcination process. Fig. 2 XPS spectra for the obtained power. The insets represent the low scan rate analysis at the binding energies ranges for the C 1s, Cd 3d and O 1s orbits. Fig. 3 Low and high magnifications TEM images for the obtained powder after the calcination process. The inset displays the SAED pattern for the metallic nanoparticles. Fig. 4 The electrical conductivity measurement for the introduced nanoparticles. Fig. 5 Consecutive cyclic voltammogram of the introduced electrocatalyst, in 1M KOH for 50 cycles at a scan rate of 100mVs−1 for Co NPs (A), and Cd-doped Co/C NPs (B). Fig. 6 Cyclic voltammograms at a scan rate of 50mVs−1 and 25°C for the introduced electrocatalyst, Pt/c (40%) and pristine cobalt nanoparticles in 1M KOH and in presence of 1.0M ethanol. The arrow points to the oxidation peak of ethanol in the reverse scanning. Fig. 7 Study the influence ethanol concentration in 1M KOH. Scan rate 50mVs−1 at 25°C. Fig. 8 The linear sweep curves for ethanol oxidation on the introduced electrocatalyst at different scan rate in 1M KOH containing 1.0M methanol at 25°C; A. B and C represent the cathodic and anodic paths, respectively. Fig. 9 Constant voltage tests at a cell potential of 0.6V and 2.0M ethanol. The cell temperature was 25°C. Ethanol electro-oxidation using cadmium-doped cobalt/carbon nanoparticles as novel non precious electrocatalyst Nasser A.M. Barakat a b ⁎ Mohammad A. Abdelkareem b Hak Yong Kim a ⁎ a Organic Materials and Fiber Engineering Department, Chonbuk National University, Jeonju 561-756, Republic of Korea b Chemical Engineering Department, Faculty of Engineering, Minia University, El-Minia, Egypt ⁎ Corresponding authors at: Organic Materials and Fiber Engineering Department, Chonbuk National University, Jeonju 561-756, Republic of Korea. Tel.: +82 632702363; fax: +82 632702348. Graphical abstract Highlights ► The study introduces Co-mainly-based material as EOR electrocatalyst. ► Cd-doped Co nanoparticles encapsulated in graphite shell are introduced. ► The introduced NPs can be effectively used as electrocatalyst in ethanol oxidation. ► The introduced NPs reveal low onset potential and high current densities. Novel electrocatalyst based on non precious metals (Co and Cd) is introduced to be used as anode in the ethanol fuel cells. Cd-doped Cobalt nanoparticles encapsulated in graphite shell have been synthesized using simple sol–gel technique. The introduced electrocatalyst can be prepared from a sol–gel composed of cadmium acetate, cobalt acetate and poly(vinyl alcohol) based on the polycondensation possibility of the acetates. Grinding and calcination in Ar atmosphere of the prepared gel leads to produce Cd-doped Co nanoparticles encapsulated in a thin graphite layer. High current density (70mAcm−2) and considerably low onset potential (∼585mV vs. NHE) were obtained when the synthesized nanoparticles have been exploited as electrocatalyst for ethanol (concentration 1M) oxidation in basic media (1M KOH). Considering that the introduced nanoparticles composed of non precious metals and the obtained electrochemical results are satisfactory, the introduced study might open new avenues to the cobalt-based nanostructures to be used as novel electrocatalysts in the fuel cells applications. Keywords Direct ethanol fuel cells Non precious catalysts Cadmium-doped cobalt Sol–gel 1 Introduction Methanol, ethanol and 2-propanol are the main alcohols used directly as fuels in the direct alcohols fuel cells (DAFCs). Methanol is nonrenewable, volatile and a flammable substance; moreover it has a high toxicity. The use of methanol may result in major issues if applied to portable devices. On the other hand, ethanol is less toxic and has a higher energy density compared to methanol. Methanol and ethanol have energy densities of 6.09 and 8.00kWhkg−1, respectively [1]. Ethanol can be also produced from agricultural bioprocesses and is considered a renewable energy [2]. Electrochemically, the direct methanol fuel cells (DMFCs) have several disadvantages. The issues with DMFCs are their sluggish reaction kinetics for methanol oxidation, methanol crossover through Nafion membranes to the oxygen electrode and anode poisoning by strongly adsorbed intermediates (mainly CO) [3]. Ethanol is well known for having a lower crossover rate and affecting cathode performance less severely than methanol because of its smaller permeability through the Nafion membrane and its slower electrochemical oxidation kinetics on the Pt/C cathode [3,4]. Accordingly, ethanol is a good fuel choice for overcoming the problems with methanol. Moreover, the direct ethanol fuel cells (DEFCs) show better polarization characteristics in alkaline media, using alkali electrolytes allows for a greater possibility for application of non-noble and less expensive metal catalysts. At present, almost all pre-commercial low-temperature fuel cells use Pt-based electrocatalysts [5–8]. Consequently, the manufacturing cost is relatively high which constrains wide applications. Moreover, the catalyst poisoning by CO or CHO species is another real problem facing most of the Pt-based electrocatalysts [9–11]. Compared to the precious metals, transition metals are abundant and cheap. Although, among the transition metals, cobalt has a well known catalytic activity in many chemical reactions, cobalt was not used as a main catalyst in the DAFCs due to the low performance. However, it is used as a co-catalyst to annihilate the Pt poisoning. Pt–Co alloys have been found to be excellent CO-tolerant catalysts [12]. In the DEFCs, ethanol is oxidized to carbon dioxide at the anode according to the reaction: CH3CH2OH+3H2O=2CO2 +12H+ +12e. The reaction is considered to be a combination of adsorption and electrochemical reaction on the anode surface [13,14]. Accordingly, because of the adsorption capacity of carbon, the later has been incorporated in many recently reported electrocatalytic materials [15–19]. In the field of electrochemical energy generating devices, cadmium is a pioneer metal; it shows good catalytic activities in various kinds of instruments [20,21]. The sol–gel process is a wet-chemical technique used for the fabrication of both glassy and ceramic materials. In this process, the sol (or solution) evolves gradually towards the formation of a gel-like network containing both a liquid phase and a solid one. Typical precursors are metal alkoxides, which undergo hydrolysis and polycondensation reactions to form an integrated network. The basic structure or morphology of the solid phase can range anywhere from discrete colloidal particles to continuous chain-like polymer networks. Some metal salts such as chloride, nitrate and acetates can be hydrolyzed and polycondensate to form the gel network. With those salts, using of a viscous polymer can enhance formation of the gel formulation. In this study, cadmium-doped cobalt nanoparticles enveloped in graphite shells are introduced as novel non precious catalyst for the ethanol electrooxidation. The introduced catalyst has been synthesized by simple sol–gel technique using poly(vinyl alcohol), cobalt acetate and cadmium acetate as precursors. Investigation of the electrocatalytic performance of the proposed materials indicated very good activity towards ethanol oxidation. 2 Experimental 2.1 Materials Cobalt (II) acetate tetra-hydrate (CoAc, 98% assay Junsei Chemical Co., Ltd, Japan), cadmium acetate dihydrate (CdAc, 99.0% assay, Sigma Aldrich), and poly(vinyl alcohol) (PVA, molecular weight=65,000g/mol, DC Chemical Co., Ltd, South Korea) were utilized without any further modification. Distilled water was used as a solvent. 2.2 Procedures To prepare CdAc/CoAc/PVA sol–gel, 22.5g PVA (10wt%), 5g of CoAc (20wt%) and 2.5g of CdAc (20wt%) aqueous solutions were well mixed, the final colloid has been stirred at 50°C for 5h. The well mixed gel was dried in two successive steps. First, the gel was dried under atmospheric pressure at 60°C for 24h, and then under high vacuum atmosphere at 80°C for 48h. The obtained hard material was crushed and grinded. The calcination process was carried out under argon atmosphere at 1atm and 750°C. Heating from the room temperature to 750°C was done within 5h, and then the temperature was fixed at 750°C for 5h. 2.3 Characterization Information about the phase and crystallinity was obtained by using Rigaku X-ray diffractometer (XRD, Rigaku, Japan) with Cu Kα (λ =1.540Å) radiation over Bragg angle ranging from 10° to 100°. Normal and high resolution images were obtained with transmission electron microscope (TEM, JEOL JEM-2010, Japan) operated at 200kV equipped with EDX analysis. The surface composition was detected with an X-ray photoelectron spectroscopy analysis (XPS, AXIS-NOVA, Kratos Analytical, UK) with the following conditions: base pressure of 6.5×10−9 Torr, resolution (pass energy) of 20eV and scan step of 0.05eV/step. The electrochemical measurements were performed in a 1M KOH solution at room temperature. The measurements were performed on a VersaSTAT 4 (USA) electrochemical analyzer and a conventional three-electrode electrochemical cell. A Pt wire and an Ag/AgCl electrode were used as the auxiliary and reference electrodes, respectively. All potentials were quoted with regard to the Ag/AgCl electrode. High purity Ar was used before and during measurements to deaerate the electrolyte in all measurements. 3 Results and discussion As aforementioned in the introduction section, some metals acetate can be gelled especially in presence of a proper polymer solution. Accordingly, the acetate salts were utilized; typically cobalt and cadmium acetates, PVA was utilized a polymeric matrix. Polycondensation can be explained as follows [22]: (1) where M is Co or Cd. The utilized precursors formed good gel which was dried, grinded and calcined as aforementioned in the experimental section. Among the various analytical techniques, X-ray diffraction analysis (XRD) received the most confidence to investigate the composition of the crystalline materials. Fig. 1 displays XRD analysis pattern for the obtained powder after the proposed calcination process. The strong diffraction peaks at 2θ values of 44.35, 51.65, 75.95, 92.35 and 97.75° corresponding to (111), (200), (220) (311) and (222) crystal planes indicate the formation of cubic crystalline cobalt (JCDPS, card no. 15-0806). Formation of pure cobalt form calcination of cobalt acetate in an inert atmosphere was explained in details in other studies [23–25]. Additionally, the broad peak at 2θ of 26.3° corresponds to an experimental d spacing of 3.37Å indicating presence of graphite-like carbon (d (002), JCPDS; 41-1487). Fig. 2 displays the XPS analysis of the obtained powder. The survey scans were carried out to search for the presence of particular elements in the sample showed the presence of Co 3P3/2 (∼59eV) [26], C 1s (∼285eV) [27], O 1s and Cd 3d core levels. According to the XPS data, one can claim that the cadmium in the introduced powder is in the form of CdO. It can be seen in the inset that the Cd 3d region consists of the main 3d3/2 spin–orbit components at binding energies of 402 and 409eV, respectively [28,29]. Moreover appearance of the O 1s peak as shown in the second inset affirms formation of CdO, because the XRD analysis affirmed formation of cobalt metal. Maximum intensity is related to the carbon element as can be observed in the corresponding inset (C1s), it means that the synthesized nanoparticles have considerable amount of carbon. Moreover, from the intestines of Cd and Co peaks, it can be claimed that Cd content in the surface is higher than Co. Fig. 3 displays the TEM images of the obtained powder. As shown in the figures, metallic nanoparticles surrounded by graphite shell are obtained. The selected area electron pattern, as shown in the inset, demonstrates good crystallinity of the metallic nanoparticles. Moreover, from Fig. 3B, one can claim that the metallic nanoparticles are sheathed inside thin graphite layer. Enveloping the cobalt nanostructures in graphite shell was introduced by the same authors [23]. From the TEM results, one can claim that the thickness of the graphite shell is around 5nm. Fig. 4 reveals the IV plots for a thin film from the introduced material on the silicon substrate. Good electric conductivity is an important parameter for the electrocatalytic materials. Clearly, it can be observed that the IV plot resembles the metallic conductors with considerably low ohm resistance. Compared to nickel, pristine cobalt has low electrocatalytic activity because the former can be activated by forming electrochemically active compounds on the surface. For instance in case of nickel, NiOOH compound can be electrochemically synthesized on the surface which generate good electrochemical activity [30]. The cyclic voltammetric behaviour of cobalt and the introduced Cd-doped Co/C nanoparticles electrodes in 1M KOH solution are shown in Fig. 5 . Polarization was started by a potential scanning at a scan rate of 100mVs−1 from 800mV to 0mV (vs. Ag/AgCl reference electrode) in the cathodic direction and then the scan was reversed in the anodic direction back to 800mV. As shown in Fig. 5A, no redox peaks appear in case of pristine cobalt which may explain the corresponding low electrocatalytic activity. Fig. 5B displays the obtained results in case of utilizing the introduced nanoparticles. As shown in the figure, presence of carbon and cadmium strongly enhances the current density compared to the pristine cobalt. Appearing of redox peaks is an important finding can be observed in Fig. 5B. Considering that cobalt metal does not reveal any redox reactions (Fig. 5A), the appeared peaks in Fig. 5B can be assigned to CdO. According to our best knowledge, Cd-based materials were never used as electrodes in the direct alcohols fuel cells, however the nickel/cadmium batteries are well known electrochemical energy devices [31]. As aforementioned, the NiOOH represents the electoractive layer formed on the nickel surface. The active layer is formed at ∼580mV (vs. NHE) in accordance with the reaction [32–34]: (2) Ni ( OH ) 2 + OH ⇄ NiOOH + H 2 O + e Therefore, analogy to nickel, it can be claimed that cadmium oxide nanoparticles in the introduced electrocatalyst are subjected to following reaction: (3) CdO + OH ⇄ CdOOH + e Similar route of nickel is not applicable as pristine nickel converts to nickel hydroxide at the negative potential side (∼−650mV [30]) which is outside the utilized range in this study. Therefore, direct transformation of CdO to CdOOH (Eq. (3)) has high possibility. It is expected that CdOOH phase to be good electroactive material due to the lower interelectrode spacing that results in lower internal resistance and therefore better efficiency of the electrode [35,36]. It is noteworthy mentioning that, according to Pourbaix diagram [37], at high pH, cadmium oxide converts to cadmium hydroxide this supports the suggested reaction. Generally, the alcohol electrooxidation process is based on adsorption of the original reactants and the intermediates compounds, and then successive dissociation steps carry out. Typically, in case of ethanol dehydrogenation, the first step is the cleavage of OH bond, forming ethoxy species CH3CH2O. Further transformation of ethoxy species gives acetaldehyde CH3CHO, which then can be oxidized by numerous reactions, forming acetate ion CH3COO−, acetone CH3COCH3, crotonaldehyde CH3CHCHCHO, acetyl CH3CO, methane, other hydrocarbons, carbonate ion CO3 2−, CO and CO2 [38,39]. On the surface Pt, the efficiency for the electrooxidation of ethanol to CO2 is low due to incomplete dehydrogenation of the intermediate compounds [39]. The optimum dehydrogenation means releasing the maximum number of electrons (e.g. 12). In such a case, the CC bond is dissociated and the resulting C1 species are oxidized to CO2. Several elements were added to the conventional catalyst; Pt to improve the photocatalytic activity (e.g. Cu, Mn, Ru, Ni, Rh, Sn, etc. [38–40]). Generally, the main role of the dopant metals (M) is formation of MOH bond by dissociative adsorption of H2O on the catalyst surface, consequently the ethanol oxidation is distinctly enhanced. Therefore, the formed CdOOH in the introduced catalyst has an important function. Fig. 6 represents the cyclic voltammetry results for the Cd-doped Co/C, Pt/C (40%) and pristine Co NPs. As shown in the figure, the introduced electrocatalyst can successfully enhance ethanol oxidation. The oxidation process is observed during the positive potential. When the potential scanning is reversed, the strongly adsorbed OH is reduced with the potential lowering. Then ethanol oxidation occurs again, thus oxidation peaks are observed during negative potential scanning as shown in Fig. 6. The cyclic voltammograms (CV) data using Pt/C (40%) electrode are incorporated in Fig. 6. As shown in this figure, compared to the Pt/C, the introduced catalyst reveals high current density. Although Co has not observed role in the electrochemical reactions, it has very good contribution in enhancing the electrical conductivity of the introduced NPs (Fig. 4). Actually, Co-free Cd/C NPs were synthesized by the same procedure, the corresponding activity was very low (data not shown). The onset potential is the potential at which there exists a reaction pathway where all reaction steps have negative free energies. The onset potential indicates the electrode overpotential. In other words, it can be utilized to evaluate the efficacy of the electrocatalyst. Generally, more negative onset potential indicates high activity and less overpotential. The linear scan voltammograms for the ethanol oxidation in Fig. 6 indicates that the corresponding onset potential of the introduced material is ∼365mV (vs. Ag/AgCl, i.e. ∼585 vs. NHE). Moreover, the corresponding current density is high (70mA/cm2). The main reason behind increasing the onset potential is the OH and CO adsorped layer on the surface of the electrodes, this gas layer leads to overpotential [41]. Carbon monoxide accumulates on the surface of the electrode till further oxidation step to carbon dioxide. Adsorption of CO appears to take place with the formation of islands of adsorbate [42]; electroactivity appears to be restricted to the outsides of these islands. Accordingly, good catalytic activity is related with the rate of CO removal. Oxidation of the CO leads to appear a peak in the voltammogram at ∼550mV (vs. NHE) [43]. Generally, above 700mV, the surface is almost free of adsorped CO because of complete oxidation [44]. As shown in the obtained results, the aforementioned CO oxidation peak is not observed which indicates either instant oxidation and/or absence of CO as an intermediate compound. Considering that Co strongly enhances CO oxidation on Pt-Co catalyst [12], the first hypothesis can be understood. Moreover, presence of Cd may catalyze formation of CoOOH active layer (analogy to Eq. (1)) overcoming producing CO intermediate which supports the second hypothesis. Considering that the Co is relatively higher than Cd in the introduced catalyst, so the former should have distinct impact in the obtained high current density that further supports formation of CoOOH active layer. Concentrated ethanol solution is a targeted fuel in the DEFCs to reduce the volume. Increasing of ethanol can have negative influence on the current density, so each electrocatalyst corresponds to certain concentration. In this study, the ethanol concentration has been increased to investigate the influence of the solution concentration; Fig. 7 displays the obtained results. As shown in the figure, the onset potential is independent on the ethanol concentration. However, slight increase in the current density with increasing the ethanol concentration is observed. It is noteworthy mentioning that, more high concentration (>2M) revealed low current densities (data not shown), so it can be claimed that the optimum concentration lies within the introduced values. The effect of scan rate on the behaviour of ethanol oxidation at the introduced electrocatalyst was investigated (Fig. 8 ). It can be clearly seen in Fig. 8 that oxidation of the ethanol in the cathodic path is a scan rate dependent. In other words, increases the scan rate enhances the electrooxidation of the ethanol (Fig. 8B). To properly check the durability of the introduced NPs, constant voltage test was done at applied potential of 0.6V (Fig. 9 ). As shown in the figure, an initial current matching the corresponding value in the CV curves (Fig. 6) is observed. Later on, the current decay is relatively unnoticeable. It is noteworthy mentioning that, only one working electrode has been used in all the electrochemical analysis. Multiple use of the electrode did not affect the performance which supports the good stability of the introduced catalyst. The obtained good stability might be explained by the thin graphite layer enveloping the bimetallic nanoparticles (Fig. 3B). Overall, the present study introduces new class of electrocatalysts based on the transition metals to replace the conventional precious metals-based catalyst. The obtained performance strongly encourages completing the research in this new class of bimetallic catalysts. 4 Conclusion Calcination of well dried and finally grinded sol–gel composed of cobalt acetate, cadmium acetate and poly(vinyl alcohol) in argon atmosphere at 750°C leads to produce cadmium-doped cobalt nanoparticles encapsulated in graphite shell. The synthesized nanoparticles can be utilized as effective non precious catalyst in ethanol electro-oxidation. The corresponding current density and onset potential are very satisfactory. According to the results obtained from this study, the cost problem due to utilizing precious metals in the fuel cells can be overcome by more extensive research on the bimetallic transition metals nanostructures. Acknowledgements This work was financially supported by the Ministry of Education, Science Technology (MEST) and National Research Foundation of Korea (NRF) through the Human Resource Training Project for Regional Innovation and “Leaders in Industry-University Cooperation” Project. We thank Mr. T. S. Bae and J. C. Lim, KBSI, Jeonju branch, and Mr. Jong- Gyun Kang, Centre for University Research Facility, for taking high-quality images. References [1] M. Kamarudin S. Kamarudin M. Masdar W. Daud Int. J. Hydrogen Energy 1 2012 [2] K.S. Roelofs T. Hirth T. Schiestel Mater. Sci. Eng. B 176 2011 727 735 [3] N. Wongyao A. Therdthianwong S. Therdthianwong Energy Convers. Manage. 52 2011 2676 2681 [4] T. Lopes E. Antolini E. Gonzalez Int. J. Hydrogen Energy 33 2008 5563 5570 [5] X. Ren P. Zelenay S. Thomas J. Davey S. Gottesfeld J. Power Sources 86 2000 111 116 [6] Z. Liu X.Y. Ling X. Su J.Y. Lee J. Phys. Chem. B 108 2004 8234 8240 [7] Y. Mu H. Liang J. Hu L. Jiang L. Wan J. Phys. Chem. B 109 2005 22212 22216 [8] W. Li W. Zhou H. Li Z. Zhou B. Zhou G. Sun Q. Xin Electrochim. Acta 49 2004 1045 1055 [9] J. Shen Y. Hu C. Li C. Qin M. Ye Electrochim. Acta 53 2008 7276 7280 [10] C.H. Yen K. Shimizu Y.Y. Lin F. Bailey I.F. Cheng C.M. Wai Energy Fuels 21 2007 2268 2271 [11] E. Frackowiak G. Lota T. Cacciaguerra F. Béguin Electrochem. Commun. 8 2006 129 132 [12] U. Paulus A. Wokaun G. Scherer T. Schmidt V. Stamenkovic V. Radmilovic N. Markovic P. Ross J. Phys. Chem. B 106 2002 4181 4191 [13] N. Hampson M. Willars B. McNicol J. Power Sources 4 1979 191 201 [14] H.A. Gasteiger N. Markovic P.N. Ross Jr. E.J. Cairns J. Phys. Chem. (United States) 97 1993 [15] C. Wang M. Waje X. Wang J.M. Tang R.C. Haddon Y. Yan Nano Lett. 4 2004 345 348 [16] W. Li C. Liang J. Qiu W. Zhou H. Han Z. Wei G. Sun Q. Xin Carbon 40 2002 787 790 [17] W. Li C. Liang W. Zhou J. Qiu Z. Zhou G. Sun Q. Xin J. Phys. Chem. B 107 2003 6292 6299 [18] E.S. Steigerwalt G.A. Deluga D.E. Cliffel C. Lukehart J. Phys. Chem. B 105 2001 8097 8101 [19] Y. Lu R.G. Reddy Int. J. Hydrogen Energy 33 2008 3930 3937 [20] N.A.M. Barakat M.A. Abdelkareem A. Yousef S.S. Al-Deyab M. El-Newehy H.Y. Kim Int. J. Hydrogen Energy 38 2013 3387 3394 [21] R. Rashidi I. Dincer G. Naterer P. Berg J. Power Sources 187 2009 509 516 [22] A. Yousef N.A.M. Barakat T. Amna A.R. Unnithan S.S. Al-Deyab H. Yong Kim J. Lumin. 132 2012 1668 1677 [23] N.A.M. Barakat B. Kim S.J. Park Y. Jo M.-H. Jung H.Y. Kim J. Mater. Chem. 19 2009 7371 7378 [24] N.A.M. Barakat M.F. Abadir K.T. Nam A.M. Hamza S.S. Al-Deyab W.-i. Baek H.Y. Kim J. Mater. Chem. 21 2011 10957 10964 [25] T. Wanjun C. Donghua Chemical Papers 61 2007 329 332 [26] N. McIntyre M. Cook Anal. Chem. 47 1975 2208 2213 [27] G. Hota S. Idage K.C. Khilar Colloids Surf. A 293 2007 5 12 [28] A. Gulino F. Castelli P. Dapporto P. Rossi I. Fragalà Chem. Mater. 14 2002 704 709 [29] J. Chang R.S. Mane D. Ham W. Lee B.W. Cho J.K. Lee S.H. Han Electrochim. Acta 53 2007 695 699 [30] A. Rahim R. Abdel Hameed M. Khalil J. Power Sources 134 2004 160 169 [31] L.H. Thaller A.H. Zimmerman J. Power Sources 63 1996 53 61 [32] M. Fleischmann K. Korinek D. Pletcher J. Electroanal. Chem. Interfacial Electrochem. 31 1971 39 49 [33] M. Vuković J. Appl. Electrochem. 24 1994 878 882 [34] O. Enea Electrochim. Acta 35 1990 375 378 [35] H. Hassan Z.A. Hamid Int. J. Hydrogen Energy 36 2011 5117 5127 [36] P. Oliva J. Leonardi J. Laurent C. Delmas J. Braconnier M. Figlarz F. Fievet A. Guibert J. Power Sources 8 1982 229 255 [37] O. Savadogo Sol. Energy Mater. Sol. Cells 52 1998 361 388 [38] Z.B. Wang G.P. Yin J. Zhang Y.C. Sun P.F. Shi J. Power Sources 160 2006 37 43 [39] S. García-Rodríguez S. Rojas M. Peña J. Fierro S. Baranton J. Léger Appl. Catal. B 106 2011 520 528 [40] M. Ammam E.B. Easton J. Power Sources 222 2013 79 87 [41] D. Geng G. Lu J. Phys. Chem. C 111 2007 11897 11902 [42] A. Shukla P. Christensen A. Hamnett M. Hogarth J. Power Sources 55 1995 87 91 [43] H.N. Dinh X. Ren F.H. Garzon P. Zelenay S. Gottesfeld J. Electroanal. Chem. 491 2000 222 233 [44] A. Hamnett Catal. Today 38 1997 445 457",
      "scopus-id": "84875984321",
      "coredata": {
        "eid": "1-s2.0-S0926860X13000823",
        "dc:description": "Novel electrocatalyst based on non precious metals (Co and Cd) is introduced to be used as anode in the ethanol fuel cells. Cd-doped Cobalt nanoparticles encapsulated in graphite shell have been synthesized using simple sol–gel technique. The introduced electrocatalyst can be prepared from a sol–gel composed of cadmium acetate, cobalt acetate and poly(vinyl alcohol) based on the polycondensation possibility of the acetates. Grinding and calcination in Ar atmosphere of the prepared gel leads to produce Cd-doped Co nanoparticles encapsulated in a thin graphite layer. High current density (70mAcm−2) and considerably low onset potential (∼585mV vs. NHE) were obtained when the synthesized nanoparticles have been exploited as electrocatalyst for ethanol (concentration 1M) oxidation in basic media (1M KOH). Considering that the introduced nanoparticles composed of non precious metals and the obtained electrochemical results are satisfactory, the introduced study might open new avenues to the cobalt-based nanostructures to be used as novel electrocatalysts in the fuel cells applications.",
        "openArchiveArticle": "false",
        "prism:coverDate": "2013-03-30",
        "openaccessUserLicense": null,
        "prism:aggregationType": "Journal",
        "prism:url": "https://api.elsevier.com/content/article/pii/S0926860X13000823",
        "dc:creator": [
          {
            "@_fa": "true",
            "$": "Barakat, Nasser A.M."
          },
          {
            "@_fa": "true",
            "$": "Abdelkareem, Mohammad A."
          },
          {
            "@_fa": "true",
            "$": "Kim, Hak Yong"
          }
        ],
        "link": [
          {
            "@_fa": "true",
            "@rel": "self",
            "@href": "https://api.elsevier.com/content/article/pii/S0926860X13000823"
          },
          {
            "@_fa": "true",
            "@rel": "scidir",
            "@href": "https://www.sciencedirect.com/science/article/pii/S0926860X13000823"
          }
        ],
        "dc:format": "application/json",
        "openaccessType": null,
        "pii": "S0926-860X(13)00082-3",
        "prism:volume": "455",
        "prism:publisher": "Elsevier B.V.",
        "dc:title": "Ethanol electro-oxidation using cadmium-doped cobalt/carbon nanoparticles as novel non precious electrocatalyst",
        "prism:copyright": "Copyright © 2013 Elsevier B.V. All rights reserved.",
        "openaccess": "0",
        "prism:issn": "0926860X",
        "dcterms:subject": [
          {
            "@_fa": "true",
            "$": "Direct ethanol fuel cells"
          },
          {
            "@_fa": "true",
            "$": "Non precious catalysts"
          },
          {
            "@_fa": "true",
            "$": "Cadmium-doped cobalt"
          },
          {
            "@_fa": "true",
            "$": "Sol–gel"
          }
        ],
        "openaccessArticle": "false",
        "prism:publicationName": "Applied Catalysis A: General",
        "openaccessSponsorType": null,
        "prism:pageRange": "193-198",
        "prism:endingPage": "198",
        "pubType": "fla",
        "prism:coverDisplayDate": "30 March 2013",
        "prism:doi": "10.1016/j.apcata.2013.02.004",
        "prism:startingPage": "193",
        "dc:identifier": "doi:10.1016/j.apcata.2013.02.004",
        "openaccessSponsorName": null
      },
      "objects": {
        "object": [
          {
            "@category": "thumbnail",
            "@height": "13",
            "@width": "187",
            "@_fa": "true",
            "$": "https://api.elsevier.com/content/object/eid/1-s2.0-S0926860X13000823-si2.gif?httpAccept=%2A%2F%2A",
            "@multimediatype": "GIF image file",
            "@type": "ALTIMG",
            "@size": "710",
            "@ref": "si2",
            "@mimetype": "image/gif"
          },
          {
            "@category": "thumbnail",
            "@height": "16",
            "@width": "261",
            "@_fa": "true",
            "$": "https://api.elsevier.com/content/object/eid/1-s2.0-S0926860X13000823-si1.gif?httpAccept=%2A%2F%2A",
            "@multimediatype": "GIF image file",
            "@type": "ALTIMG",
            "@size": "929",
            "@ref": "si1",
            "@mimetype": "image/gif"
          },
          {
            "@category": "high",
            "@height": "886",
            "@width": "1162",
            "@_fa": "true",
            "$": "https://api.elsevier.com/content/object/eid/1-s2.0-S0926860X13000823-fx1_lrg.jpg?httpAccept=%2A%2F%2A",
            "@multimediatype": "JPEG image file",
            "@type": "IMAGE-HIGH-RES",
            "@size": "144154",
            "@ref": "fx1",
            "@mimetype": "image/jpeg"
          },
          {
            "@category": "high",
            "@height": "1205",
            "@width": "1638",
            "@_fa": "true",
            "$": "https://api.elsevier.com/content/object/eid/1-s2.0-S0926860X13000823-gr9_lrg.jpg?httpAccept=%2A%2F%2A",
            "@multimediatype": "JPEG image file",
            "@type": "IMAGE-HIGH-RES",
            "@size": "112140",
            "@ref": "gr9",
            "@mimetype": "image/jpeg"
          },
          {
            "@category": "high",
            "@height": "2372",
            "@width": "2142",
            "@_fa": "true",
            "$": "https://api.elsevier.com/content/object/eid/1-s2.0-S0926860X13000823-gr8_lrg.jpg?httpAccept=%2A%2F%2A",
            "@multimediatype": "JPEG image file",
            "@type": "IMAGE-HIGH-RES",
            "@size": "505390",
            "@ref": "gr8",
            "@mimetype": "image/jpeg"
          },
          {
            "@category": "high",
            "@height": "1275",
            "@width": "1729",
            "@_fa": "true",
            "$": "https://api.elsevier.com/content/object/eid/1-s2.0-S0926860X13000823-gr7_lrg.jpg?httpAccept=%2A%2F%2A",
            "@multimediatype": "JPEG image file",
            "@type": "IMAGE-HIGH-RES",
            "@size": "180979",
            "@ref": "gr7",
            "@mimetype": "image/jpeg"
          },
          {
            "@category": "high",
            "@height": "1261",
            "@width": "1663",
            "@_fa": "true",
            "$": "https://api.elsevier.com/content/object/eid/1-s2.0-S0926860X13000823-gr6_lrg.jpg?httpAccept=%2A%2F%2A",
            "@multimediatype": "JPEG image file",
            "@type": "IMAGE-HIGH-RES",
            "@size": "222602",
            "@ref": "gr6",
            "@mimetype": "image/jpeg"
          },
          {
            "@category": "high",
            "@height": "2427",
            "@width": "1656",
            "@_fa": "true",
            "$": "https://api.elsevier.com/content/object/eid/1-s2.0-S0926860X13000823-gr5_lrg.jpg?httpAccept=%2A%2F%2A",
            "@multimediatype": "JPEG image file",
            "@type": "IMAGE-HIGH-RES",
            "@size": "327767",
            "@ref": "gr5",
            "@mimetype": "image/jpeg"
          },
          {
            "@category": "high",
            "@height": "1259",
            "@width": "1646",
            "@_fa": "true",
            "$": "https://api.elsevier.com/content/object/eid/1-s2.0-S0926860X13000823-gr4_lrg.jpg?httpAccept=%2A%2F%2A",
            "@multimediatype": "JPEG image file",
            "@type": "IMAGE-HIGH-RES",
            "@size": "89120",
            "@ref": "gr4",
            "@mimetype": "image/jpeg"
          },
          {
            "@category": "high",
            "@height": "604",
            "@width": "1750",
            "@_fa": "true",
            "$": "https://api.elsevier.com/content/object/eid/1-s2.0-S0926860X13000823-gr3_lrg.jpg?httpAccept=%2A%2F%2A",
            "@multimediatype": "JPEG image file",
            "@type": "IMAGE-HIGH-RES",
            "@size": "215716",
            "@ref": "gr3",
            "@mimetype": "image/jpeg"
          },
          {
            "@category": "high",
            "@height": "1271",
            "@width": "1749",
            "@_fa": "true",
            "$": "https://api.elsevier.com/content/object/eid/1-s2.0-S0926860X13000823-gr2_lrg.jpg?httpAccept=%2A%2F%2A",
            "@multimediatype": "JPEG image file",
            "@type": "IMAGE-HIGH-RES",
            "@size": "256295",
            "@ref": "gr2",
            "@mimetype": "image/jpeg"
          },
          {
            "@category": "high",
            "@height": "1269",
            "@width": "1722",
            "@_fa": "true",
            "$": "https://api.elsevier.com/content/object/eid/1-s2.0-S0926860X13000823-gr1_lrg.jpg?httpAccept=%2A%2F%2A",
            "@multimediatype": "JPEG image file",
            "@type": "IMAGE-HIGH-RES",
            "@size": "148414",
            "@ref": "gr1",
            "@mimetype": "image/jpeg"
          },
          {
            "@category": "high",
            "@height": "1000",
            "@width": "4314",
            "@_fa": "true",
            "$": "https://api.elsevier.com/content/object/eid/1-s2.0-S0926860X13000823-fx2_lrg.gif?httpAccept=%2A%2F%2A",
            "@multimediatype": "GIF image file",
            "@type": "IMAGE-HIGH-RES",
            "@size": "26919",
            "@ref": "fx2",
            "@mimetype": "image/gif"
          },
          {
            "@category": "standard",
            "@height": "200",
            "@width": "262",
            "@_fa": "true",
            "$": "https://api.elsevier.com/content/object/eid/1-s2.0-S0926860X13000823-fx1.jpg?httpAccept=%2A%2F%2A",
            "@multimediatype": "JPEG image file",
            "@type": "IMAGE-DOWNSAMPLED",
            "@size": "17416",
            "@ref": "fx1",
            "@mimetype": "image/jpeg"
          },
          {
            "@category": "standard",
            "@height": "272",
            "@width": "370",
            "@_fa": "true",
            "$": "https://api.elsevier.com/content/object/eid/1-s2.0-S0926860X13000823-gr9.jpg?httpAccept=%2A%2F%2A",
            "@multimediatype": "JPEG image file",
            "@type": "IMAGE-DOWNSAMPLED",
            "@size": "18793",
            "@ref": "gr9",
            "@mimetype": "image/jpeg"
          },
          {
            "@category": "standard",
            "@height": "536",
            "@width": "484",
            "@_fa": "true",
            "$": "https://api.elsevier.com/content/object/eid/1-s2.0-S0926860X13000823-gr8.jpg?httpAccept=%2A%2F%2A",
            "@multimediatype": "JPEG image file",
            "@type": "IMAGE-DOWNSAMPLED",
            "@size": "67012",
            "@ref": "gr8",
            "@mimetype": "image/jpeg"
          },
          {
            "@category": "standard",
            "@height": "288",
            "@width": "390",
            "@_fa": "true",
            "$": "https://api.elsevier.com/content/object/eid/1-s2.0-S0926860X13000823-gr7.jpg?httpAccept=%2A%2F%2A",
            "@multimediatype": "JPEG image file",
            "@type": "IMAGE-DOWNSAMPLED",
            "@size": "30105",
            "@ref": "gr7",
            "@mimetype": "image/jpeg"
          },
          {
            "@category": "standard",
            "@height": "284",
            "@width": "375",
            "@_fa": "true",
            "$": "https://api.elsevier.com/content/object/eid/1-s2.0-S0926860X13000823-gr6.jpg?httpAccept=%2A%2F%2A",
            "@multimediatype": "JPEG image file",
            "@type": "IMAGE-DOWNSAMPLED",
            "@size": "33616",
            "@ref": "gr6",
            "@mimetype": "image/jpeg"
          },
          {
            "@category": "standard",
            "@height": "548",
            "@width": "374",
            "@_fa": "true",
            "$": "https://api.elsevier.com/content/object/eid/1-s2.0-S0926860X13000823-gr5.jpg?httpAccept=%2A%2F%2A",
            "@multimediatype": "JPEG image file",
            "@type": "IMAGE-DOWNSAMPLED",
            "@size": "44346",
            "@ref": "gr5",
            "@mimetype": "image/jpeg"
          },
          {
            "@category": "standard",
            "@height": "284",
            "@width": "371",
            "@_fa": "true",
            "$": "https://api.elsevier.com/content/object/eid/1-s2.0-S0926860X13000823-gr4.jpg?httpAccept=%2A%2F%2A",
            "@multimediatype": "JPEG image file",
            "@type": "IMAGE-DOWNSAMPLED",
            "@size": "17829",
            "@ref": "gr4",
            "@mimetype": "image/jpeg"
          },
          {
            "@category": "standard",
            "@height": "227",
            "@width": "659",
            "@_fa": "true",
            "$": "https://api.elsevier.com/content/object/eid/1-s2.0-S0926860X13000823-gr3.jpg?httpAccept=%2A%2F%2A",
            "@multimediatype": "JPEG image file",
            "@type": "IMAGE-DOWNSAMPLED",
            "@size": "43079",
            "@ref": "gr3",
            "@mimetype": "image/jpeg"
          },
          {
            "@category": "standard",
            "@height": "287",
            "@width": "395",
            "@_fa": "true",
            "$": "https://api.elsevier.com/content/object/eid/1-s2.0-S0926860X13000823-gr2.jpg?httpAccept=%2A%2F%2A",
            "@multimediatype": "JPEG image file",
            "@type": "IMAGE-DOWNSAMPLED",
            "@size": "39548",
            "@ref": "gr2",
            "@mimetype": "image/jpeg"
          },
          {
            "@category": "standard",
            "@height": "287",
            "@width": "389",
            "@_fa": "true",
            "$": "https://api.elsevier.com/content/object/eid/1-s2.0-S0926860X13000823-gr1.jpg?httpAccept=%2A%2F%2A",
            "@multimediatype": "JPEG image file",
            "@type": "IMAGE-DOWNSAMPLED",
            "@size": "24339",
            "@ref": "gr1",
            "@mimetype": "image/jpeg"
          },
          {
            "@category": "standard",
            "@height": "113",
            "@width": "487",
            "@_fa": "true",
            "$": "https://api.elsevier.com/content/object/eid/1-s2.0-S0926860X13000823-fx2.gif?httpAccept=%2A%2F%2A",
            "@multimediatype": "GIF image file",
            "@type": "IMAGE-DOWNSAMPLED",
            "@size": "3436",
            "@ref": "fx2",
            "@mimetype": "image/gif"
          },
          {
            "@category": "thumbnail",
            "@height": "51",
            "@width": "219",
            "@_fa": "true",
            "$": "https://api.elsevier.com/content/object/eid/1-s2.0-S0926860X13000823-fx2.sml?httpAccept=%2A%2F%2A",
            "@multimediatype": "GIF image file",
            "@type": "IMAGE-THUMBNAIL",
            "@size": "1318",
            "@ref": "fx2",
            "@mimetype": "image/gif"
          },
          {
            "@category": "thumbnail",
            "@height": "164",
            "@width": "215",
            "@_fa": "true",
            "$": "https://api.elsevier.com/content/object/eid/1-s2.0-S0926860X13000823-fx1.sml?httpAccept=%2A%2F%2A",
            "@multimediatype": "GIF image file",
            "@type": "IMAGE-THUMBNAIL",
            "@size": "8132",
            "@ref": "fx1",
            "@mimetype": "image/gif"
          },
          {
            "@category": "thumbnail",
            "@height": "161",
            "@width": "219",
            "@_fa": "true",
            "$": "https://api.elsevier.com/content/object/eid/1-s2.0-S0926860X13000823-gr9.sml?httpAccept=%2A%2F%2A",
            "@multimediatype": "GIF image file",
            "@type": "IMAGE-THUMBNAIL",
            "@size": "3491",
            "@ref": "gr9",
            "@mimetype": "image/gif"
          },
          {
            "@category": "thumbnail",
            "@height": "164",
            "@width": "148",
            "@_fa": "true",
            "$": "https://api.elsevier.com/content/object/eid/1-s2.0-S0926860X13000823-gr8.sml?httpAccept=%2A%2F%2A",
            "@multimediatype": "GIF image file",
            "@type": "IMAGE-THUMBNAIL",
            "@size": "5131",
            "@ref": "gr8",
            "@mimetype": "image/gif"
          },
          {
            "@category": "thumbnail",
            "@height": "161",
            "@width": "219",
            "@_fa": "true",
            "$": "https://api.elsevier.com/content/object/eid/1-s2.0-S0926860X13000823-gr7.sml?httpAccept=%2A%2F%2A",
            "@multimediatype": "GIF image file",
            "@type": "IMAGE-THUMBNAIL",
            "@size": "4877",
            "@ref": "gr7",
            "@mimetype": "image/gif"
          },
          {
            "@category": "thumbnail",
            "@height": "164",
            "@width": "216",
            "@_fa": "true",
            "$": "https://api.elsevier.com/content/object/eid/1-s2.0-S0926860X13000823-gr6.sml?httpAccept=%2A%2F%2A",
            "@multimediatype": "GIF image file",
            "@type": "IMAGE-THUMBNAIL",
            "@size": "6103",
            "@ref": "gr6",
            "@mimetype": "image/gif"
          },
          {
            "@category": "thumbnail",
            "@height": "164",
            "@width": "112",
            "@_fa": "true",
            "$": "https://api.elsevier.com/content/object/eid/1-s2.0-S0926860X13000823-gr5.sml?httpAccept=%2A%2F%2A",
            "@multimediatype": "GIF image file",
            "@type": "IMAGE-THUMBNAIL",
            "@size": "4058",
            "@ref": "gr5",
            "@mimetype": "image/gif"
          },
          {
            "@category": "thumbnail",
            "@height": "164",
            "@width": "214",
            "@_fa": "true",
            "$": "https://api.elsevier.com/content/object/eid/1-s2.0-S0926860X13000823-gr4.sml?httpAccept=%2A%2F%2A",
            "@multimediatype": "GIF image file",
            "@type": "IMAGE-THUMBNAIL",
            "@size": "2491",
            "@ref": "gr4",
            "@mimetype": "image/gif"
          },
          {
            "@category": "thumbnail",
            "@height": "76",
            "@width": "219",
            "@_fa": "true",
            "$": "https://api.elsevier.com/content/object/eid/1-s2.0-S0926860X13000823-gr3.sml?httpAccept=%2A%2F%2A",
            "@multimediatype": "GIF image file",
            "@type": "IMAGE-THUMBNAIL",
            "@size": "5431",
            "@ref": "gr3",
            "@mimetype": "image/gif"
          },
          {
            "@category": "thumbnail",
            "@height": "159",
            "@width": "219",
            "@_fa": "true",
            "$": "https://api.elsevier.com/content/object/eid/1-s2.0-S0926860X13000823-gr2.sml?httpAccept=%2A%2F%2A",
            "@multimediatype": "GIF image file",
            "@type": "IMAGE-THUMBNAIL",
            "@size": "7440",
            "@ref": "gr2",
            "@mimetype": "image/gif"
          },
          {
            "@category": "thumbnail",
            "@height": "161",
            "@width": "219",
            "@_fa": "true",
            "$": "https://api.elsevier.com/content/object/eid/1-s2.0-S0926860X13000823-gr1.sml?httpAccept=%2A%2F%2A",
            "@multimediatype": "GIF image file",
            "@type": "IMAGE-THUMBNAIL",
            "@size": "4395",
            "@ref": "gr1",
            "@mimetype": "image/gif"
          }
        ]
      },
      "link": {
        "@rel": "abstract",
        "@href": "https://api.elsevier.com/content/abstract/scopus_id/84875984321"
      }
    }
  }
}