{
  "metadata": {
    "title": "Noble metal free catalyst with High activity and stability for catalytic wet air oxidation of N, N-dimethylformamide",
    "authors": "; ; ",
    "journal": "Applied Catalysis A: General",
    "date": "2021-06-25",
    "doi": "10.1016/j.apcata.2021.118172",
    "abstract": "",
    "uri": "https://api.elsevier.com/content/article/pii/S0926860X21001861",
    "pii": "S0926860X21001861"
  },
  "fulltext": {
    "full-text-retrieval-response": {
      "scopus-eid": "2-s2.0-85105832970",
      "originalText": "serial JL 271346 291210 291744 291809 31 Applied Catalysis A: General APPLIEDCATALYSISAGENERAL 2021-04-20 2021-04-20 2021-04-27 2021-04-27 2021-05-13T20:52:17 1-s2.0-S0926860X21001861 S0926-860X(21)00186-1 S0926860X21001861 10.1016/j.apcata.2021.118172 S300 S300.1 FULL-TEXT 1-s2.0-S0926860X21X00105 2024-01-01T12:34:28.416125Z 0 0 20210625 2021 2021-04-20T17:42:29.548843Z absattachment articleinfo articlenumber articletitlenorm authfirstinitialnorm authfirstsurnamenorm cid cids contenttype copyright crossmark dateloaded dateloadedtxt datesearch datesort dateupdated dco docsubtype doctype doi eid ewtransactionid hubeid indexeddate issn issnnorm itemstage itemtransactionid itemweight openaccess openarchive pg pgfirst pii piinorm pubdatestart pubdatetxt pubyr sortorder srctitle srctitlenorm srctype ssids alllist content subj subheadings suppl tomb volfirst volissue volumelist webpdf webpdfpagecount yearnav figure table body acknowledge affil articletitle auth authfirstini authfull authkeywords authlast grantnumber grantsponsor highlightsabst orcid primabst ref specialabst 0926-860X 0926860X true 620 620 C Volume 620 3 118172 118172 118172 20210625 25 June 2021 2021-06-25 2021 article fla © 2021 Published by Elsevier B.V. NOBLEMETALFREECATALYSTHIGHACTIVITYSTABILITYFORCATALYTICWETAIROXIDATIONNNDIMETHYLFORMAMIDE ALI S 1 Introduction 2 Experimental 2.1 Reagents 2.2 Preparation of catalysts 2.2.1 Functionalization of CNTs 2.2.2 Preparation of CeO2/CNTs-M and CeO2/CNTs-Raw 2.3 Catalyst characterizations 2.4 Catalytic wet air oxidation of DMF 3 Results and discussion 3.1 Structural investigation of hybrid (CeO2/CNTs) CNTs catalysts 3.1.1 XRD 3.1.2 SEM and High-resolution transmission electron microscopy (HR-TEM) 3.1.3 BET 3.1.4 Thermogravimetric analysis 3.1.5 Raman 3.1.6 FT-IR 3.1.7 H2-TPR 3.1.8 O2-TPD 3.1.9 XPS 3.2 Catalytic wet air oxidation Reaction test 3.2.1 Catalytic reaction rate and activation energy 3.2.2 Catalytic stability and CeO2/CNTs leaching/deactivation test 4 Conclusion CRediT authorship contribution statement Acknowledgement References LEVEC 2007 172 184 J VASUDEVAN 2015 338 342 V HASEGAWA 1997 543 547 Y TWINER 1998 143 151 M KENNEDY 1986 129 182 G CHANG 2005 1071 1078 C OLIVIERO 2000 267 275 L MATATOVMEYTAL 1998 309 326 Y IMAMURA 1999 1743 1753 S ARENA 2012 336 345 F CYBULSKI 2007 4007 4033 A KIM 2011 16 34 K ARENA 2015 101 109 F GENG 2020 117774 L FU 2016 216 222 J FU 2018 4980 4985 J SUN 2008 335 341 G DOBRYNKIN 1998 257 260 N BATYGINA 2000 123 132 M GONG 2019 265 272 J GROSJEAN 2010 276 283 N MALI 2012 M15 M23 S TROVARELLI 1996 439 520 A KAISSOUNI 2020 F ZHENG 2005 142 149 X HOSOKAWA 2003 181 187 S SBERVEGLIERI 1995 103 109 G GOMEZCEREZO 2014 156 157 M LIU 2019 671 683 H ZENG 2019 1146 1153 Y ZUO 2016 13810 13813 Z SONG 2014 1212 1223 A YU 2011 7727 7731 C TESFAYE 2019 1 9 R RAO 2012 283 290 R FANG 2013 803 811 C VIJAYAKUMAR 2020 108006 S LIU 2018 6971 6977 X PENG 2020 122750 S CHANAPATTHARAPOL 2017 1197 1205 K GAALOVA 2010 633 639 J ZHANG 2006 H CAO 2018 464 473 Y AHMADPOOR 2013 113 117 F TESSONNIER 2009 2081 2089 J JIA 1999 903 906 Z ALOSAIMI 2013 77 79 J OVEJERO 2006 2206 2212 G YUAN 2011 529 545 C ETTIREDDY 2007 123 134 P JIANG 2020 23743 23753 H SORIASANCHEZ 2011 101 109 M STOBINSKI 2010 77 84 L YANG 2008 445 452 S SHI 2020 22 29 W LI 2002 313 318 Y ZHANG 2009 34 37 Z GAO 2010 255 258 X CHEN 2004 49 58 I YAO 1984 254 265 H KATSAOUNIS 2004 197 209 A LUO 2010 355 361 J XIAODONG 2013 1141 1147 W WANG 2017 147 155 J PANDIT 2019 1 13 B YE 2009 3684 3687 X ALIX2021X118172 ALIX2021X118172XS 2023-04-27T00:00:00.000Z 2023-04-27T00:00:00.000Z http://creativecommons.org/licenses/by-nc-nd/4.0/ © 2021 Published by Elsevier B.V. 2021-05-03T23:41:33.603Z http://vtw.elsevier.com/data/voc/AddOnTypes/50.7/nlp S0926860X21001861 Xiamen University Malaysia XMUMRF/2020-C5/IENG/0026 The authors would like to thank the financial support from Xiamen University Malaysia ( XMUMRF/2020-C5/IENG/0026 ). https://doi.org/10.15223/policy-017 https://doi.org/10.15223/policy-037 https://doi.org/10.15223/policy-012 https://doi.org/10.15223/policy-029 https://doi.org/10.15223/policy-004 item S0926-860X(21)00186-1 S0926860X21001861 1-s2.0-S0926860X21001861 10.1016/j.apcata.2021.118172 271346 2024-01-01T12:34:28.416125Z 2021-06-25 1-s2.0-S0926860X21001861-main.pdf https://s3-eu-west-1.amazonaws.com/prod-ucs-content-store-eu-west/content/pii:S0926860X21001861/MAIN/application/pdf/fe68d401bc7eb58b0ed8462aee7fb87f/main.pdf main.pdf pdf true 5992433 MAIN 9 1-s2.0-S0926860X21001861-main_1.png https://s3-eu-west-1.amazonaws.com/prod-ucs-content-store-eu-west/content/pii:S0926860X21001861/PREVIEW/image/png/07dfc58c4640c7f92de30965bbdef471/main_1.png main_1.png png 58683 849 656 IMAGE-WEB-PDF 1 1-s2.0-S0926860X21001861-gr5.jpg https://s3-eu-west-1.amazonaws.com/prod-ucs-content-store-eu-west/content/pii:S0926860X21001861/gr5/DOWNSAMPLED/image/jpeg/809828becf0ea9fd4964474c5d5268f7/gr5.jpg gr5 gr5.jpg jpg 52892 276 567 IMAGE-DOWNSAMPLED 1-s2.0-S0926860X21001861-gr4.jpg https://s3-eu-west-1.amazonaws.com/prod-ucs-content-store-eu-west/content/pii:S0926860X21001861/gr4/DOWNSAMPLED/image/jpeg/ec452c0be9ddb145bc2a1d9749dcf626/gr4.jpg gr4 gr4.jpg jpg 27753 243 341 IMAGE-DOWNSAMPLED 1-s2.0-S0926860X21001861-gr3.jpg https://s3-eu-west-1.amazonaws.com/prod-ucs-content-store-eu-west/content/pii:S0926860X21001861/gr3/DOWNSAMPLED/image/jpeg/6b78697a567b77d7b471bf6750d7b981/gr3.jpg gr3 gr3.jpg jpg 147613 722 680 IMAGE-DOWNSAMPLED 1-s2.0-S0926860X21001861-gr2.jpg https://s3-eu-west-1.amazonaws.com/prod-ucs-content-store-eu-west/content/pii:S0926860X21001861/gr2/DOWNSAMPLED/image/jpeg/b3ca3aee7f12d13b5e38b4c7d08684ed/gr2.jpg gr2 gr2.jpg jpg 29270 202 567 IMAGE-DOWNSAMPLED 1-s2.0-S0926860X21001861-ga1.jpg https://s3-eu-west-1.amazonaws.com/prod-ucs-content-store-eu-west/content/pii:S0926860X21001861/ga1/DOWNSAMPLED/image/jpeg/c8c20d9594e91e73404450f403ef95e5/ga1.jpg ga1 true ga1.jpg jpg 28326 160 500 IMAGE-DOWNSAMPLED 1-s2.0-S0926860X21001861-gr1.jpg https://s3-eu-west-1.amazonaws.com/prod-ucs-content-store-eu-west/content/pii:S0926860X21001861/gr1/DOWNSAMPLED/image/jpeg/d113a750f0483f75d058ac274c69e453/gr1.jpg gr1 gr1.jpg jpg 29747 294 341 IMAGE-DOWNSAMPLED 1-s2.0-S0926860X21001861-gr9.jpg https://s3-eu-west-1.amazonaws.com/prod-ucs-content-store-eu-west/content/pii:S0926860X21001861/gr9/DOWNSAMPLED/image/jpeg/af67c6190d6d56ad5fd055e6744aa203/gr9.jpg gr9 gr9.jpg jpg 24571 302 341 IMAGE-DOWNSAMPLED 1-s2.0-S0926860X21001861-gr8.jpg https://s3-eu-west-1.amazonaws.com/prod-ucs-content-store-eu-west/content/pii:S0926860X21001861/gr8/DOWNSAMPLED/image/jpeg/13dc4e9b96ef2d2fb8ee8d17229ce45e/gr8.jpg gr8 gr8.jpg jpg 29148 223 567 IMAGE-DOWNSAMPLED 1-s2.0-S0926860X21001861-gr7.jpg https://s3-eu-west-1.amazonaws.com/prod-ucs-content-store-eu-west/content/pii:S0926860X21001861/gr7/DOWNSAMPLED/image/jpeg/a7739204ce7f63128b8382cbe4bc4b45/gr7.jpg gr7 gr7.jpg jpg 89179 672 680 IMAGE-DOWNSAMPLED 1-s2.0-S0926860X21001861-gr6.jpg https://s3-eu-west-1.amazonaws.com/prod-ucs-content-store-eu-west/content/pii:S0926860X21001861/gr6/DOWNSAMPLED/image/jpeg/abbb4981e6ad2facebc2d6942ee4ceba/gr6.jpg gr6 gr6.jpg jpg 41247 260 567 IMAGE-DOWNSAMPLED 1-s2.0-S0926860X21001861-gr5.sml https://s3-eu-west-1.amazonaws.com/prod-ucs-content-store-eu-west/content/pii:S0926860X21001861/gr5/THUMBNAIL/image/gif/ae89c638f11f01503bfbe5a630b2e189/gr5.sml gr5 gr5.sml sml 10092 106 219 IMAGE-THUMBNAIL 1-s2.0-S0926860X21001861-gr4.sml https://s3-eu-west-1.amazonaws.com/prod-ucs-content-store-eu-west/content/pii:S0926860X21001861/gr4/THUMBNAIL/image/gif/147d1bb2b8c942974fad664afa0bf60c/gr4.sml gr4 gr4.sml sml 11273 156 219 IMAGE-THUMBNAIL 1-s2.0-S0926860X21001861-gr3.sml https://s3-eu-west-1.amazonaws.com/prod-ucs-content-store-eu-west/content/pii:S0926860X21001861/gr3/THUMBNAIL/image/gif/ffbb8780144920b2992cdfea2c702bd9/gr3.sml gr3 gr3.sml sml 13951 164 154 IMAGE-THUMBNAIL 1-s2.0-S0926860X21001861-gr2.sml https://s3-eu-west-1.amazonaws.com/prod-ucs-content-store-eu-west/content/pii:S0926860X21001861/gr2/THUMBNAIL/image/gif/3987ccd55c35914f0846a4c8e5e52bf4/gr2.sml gr2 gr2.sml sml 10456 78 219 IMAGE-THUMBNAIL 1-s2.0-S0926860X21001861-ga1.sml https://s3-eu-west-1.amazonaws.com/prod-ucs-content-store-eu-west/content/pii:S0926860X21001861/ga1/THUMBNAIL/image/gif/a88c201f123b2d26c53d5c909621e6cf/ga1.sml ga1 true ga1.sml sml 8098 70 219 IMAGE-THUMBNAIL 1-s2.0-S0926860X21001861-gr1.sml https://s3-eu-west-1.amazonaws.com/prod-ucs-content-store-eu-west/content/pii:S0926860X21001861/gr1/THUMBNAIL/image/gif/186c7386c75052888de372bf9c410325/gr1.sml gr1 gr1.sml sml 9479 164 190 IMAGE-THUMBNAIL 1-s2.0-S0926860X21001861-gr9.sml https://s3-eu-west-1.amazonaws.com/prod-ucs-content-store-eu-west/content/pii:S0926860X21001861/gr9/THUMBNAIL/image/gif/dcaaf7c4e3984df34f824968e4b5a35b/gr9.sml gr9 gr9.sml sml 7797 164 185 IMAGE-THUMBNAIL 1-s2.0-S0926860X21001861-gr8.sml https://s3-eu-west-1.amazonaws.com/prod-ucs-content-store-eu-west/content/pii:S0926860X21001861/gr8/THUMBNAIL/image/gif/c36b402329fe681f51300d12539fcb9c/gr8.sml gr8 gr8.sml sml 5606 86 219 IMAGE-THUMBNAIL 1-s2.0-S0926860X21001861-gr7.sml https://s3-eu-west-1.amazonaws.com/prod-ucs-content-store-eu-west/content/pii:S0926860X21001861/gr7/THUMBNAIL/image/gif/ffb3f66608449698afb6096f2ba0b2e6/gr7.sml gr7 gr7.sml sml 9353 164 166 IMAGE-THUMBNAIL 1-s2.0-S0926860X21001861-gr6.sml https://s3-eu-west-1.amazonaws.com/prod-ucs-content-store-eu-west/content/pii:S0926860X21001861/gr6/THUMBNAIL/image/gif/0b162eef065bd3324e13eba47ae10697/gr6.sml gr6 gr6.sml sml 8092 100 219 IMAGE-THUMBNAIL 1-s2.0-S0926860X21001861-gr5_lrg.jpg https://s3-eu-west-1.amazonaws.com/prod-ucs-content-store-eu-west/content/pii:S0926860X21001861/gr5/HIGHRES/image/jpeg/1415b04f09ced45a065265652fe88498/gr5_lrg.jpg gr5 gr5_lrg.jpg jpg 392207 1220 2510 IMAGE-HIGH-RES 1-s2.0-S0926860X21001861-gr4_lrg.jpg https://s3-eu-west-1.amazonaws.com/prod-ucs-content-store-eu-west/content/pii:S0926860X21001861/gr4/HIGHRES/image/jpeg/e5812385e5d0a1348c238dca4262cb8f/gr4_lrg.jpg gr4 gr4_lrg.jpg jpg 365498 1077 1510 IMAGE-HIGH-RES 1-s2.0-S0926860X21001861-gr3_lrg.jpg https://s3-eu-west-1.amazonaws.com/prod-ucs-content-store-eu-west/content/pii:S0926860X21001861/gr3/HIGHRES/image/jpeg/51232d01fe7b460b97455c830de6b545/gr3_lrg.jpg gr3 gr3_lrg.jpg jpg 1389130 3197 3010 IMAGE-HIGH-RES 1-s2.0-S0926860X21001861-gr2_lrg.jpg https://s3-eu-west-1.amazonaws.com/prod-ucs-content-store-eu-west/content/pii:S0926860X21001861/gr2/HIGHRES/image/jpeg/b978bce3ffef7668bbad44da33b59c33/gr2_lrg.jpg gr2 gr2_lrg.jpg jpg 413252 895 2510 IMAGE-HIGH-RES 1-s2.0-S0926860X21001861-ga1_lrg.jpg https://s3-eu-west-1.amazonaws.com/prod-ucs-content-store-eu-west/content/pii:S0926860X21001861/ga1/HIGHRES/image/jpeg/99ab14aec306eadd0663857986d1e94d/ga1_lrg.jpg ga1 true ga1_lrg.jpg jpg 248108 707 2213 IMAGE-HIGH-RES 1-s2.0-S0926860X21001861-gr1_lrg.jpg https://s3-eu-west-1.amazonaws.com/prod-ucs-content-store-eu-west/content/pii:S0926860X21001861/gr1/HIGHRES/image/jpeg/64aaf595a5803b949e771b7897a44b0b/gr1_lrg.jpg gr1 gr1_lrg.jpg jpg 243649 1304 1510 IMAGE-HIGH-RES 1-s2.0-S0926860X21001861-gr9_lrg.jpg https://s3-eu-west-1.amazonaws.com/prod-ucs-content-store-eu-west/content/pii:S0926860X21001861/gr9/HIGHRES/image/jpeg/a9b4b16863c84f014f5973bc98bfc4d7/gr9_lrg.jpg gr9 gr9_lrg.jpg jpg 388857 1337 1510 IMAGE-HIGH-RES 1-s2.0-S0926860X21001861-gr8_lrg.jpg https://s3-eu-west-1.amazonaws.com/prod-ucs-content-store-eu-west/content/pii:S0926860X21001861/gr8/HIGHRES/image/jpeg/7041a970d2b802c79cb6927badaac136/gr8_lrg.jpg gr8 gr8_lrg.jpg jpg 204957 988 2510 IMAGE-HIGH-RES 1-s2.0-S0926860X21001861-gr7_lrg.jpg https://s3-eu-west-1.amazonaws.com/prod-ucs-content-store-eu-west/content/pii:S0926860X21001861/gr7/HIGHRES/image/jpeg/5bb73953096808e8ebf1befbffef9cbc/gr7_lrg.jpg gr7 gr7_lrg.jpg jpg 683924 2973 3010 IMAGE-HIGH-RES 1-s2.0-S0926860X21001861-gr6_lrg.jpg https://s3-eu-west-1.amazonaws.com/prod-ucs-content-store-eu-west/content/pii:S0926860X21001861/gr6/HIGHRES/image/jpeg/9132977cbf313e4fca8cd9624140ddf9/gr6_lrg.jpg gr6 gr6_lrg.jpg jpg 298247 1151 2510 IMAGE-HIGH-RES 1-s2.0-S0926860X21001861-am.pdf am am.pdf pdf 2402592 AAM-PDF https://s3-eu-west-1.amazonaws.com/prod-ucs-content-store-eu-west/content/egi:10CFXRR4PBG/MAIN/application/pdf/6bc13d031b53ef7ae0a19891aea40f3e/am.pdf APCATA 118172 118172 S0926-860X(21)00186-1 10.1016/j.apcata.2021.118172 Fig. 1 Powder X-ray diffraction pattern of CNTs-Raw, CNTs-M, CeO2, CeO2/CNTs-Raw, and CeO2/CNTs-M, pretreated at 450 °C under N2. Fig. 1 Fig. 2 Scanning electron microscope (SEM) images of (a) CNTs-Raw (b) CNTs-M. Fig. 2 Fig. 3 Transmission electron microscope (TEM) images of CeO2/CNTs-Raw (a, b), CeO2/CNTs-M (d, e), and HR-TEM images of CeO2/CNTs-Raw (c), CeO2/CNTs-M (f), size distribution of CeO2 in CeO2/CNTs-M (g) and CeO2/CNTs-Raw (h). Fig. 3 Fig. 4 TGA curve of CNTs-Raw, CNTs-M, CeO2/CNTs-M, and CeO2/CNTs-Raw catalysts from 30 °C to 960 °C under air (30 mL/min) atmosphere. Fig. 4 Fig. 5 (a) Raman spectra, (b) FT-IR spectra of CNTs-Raw, CNTs-M, CeO2/CNTs-Raw, CeO2/CNTs-M catalyst. Fig. 5 Fig. 6 (a) H2-TPR; (b) O2-TPD profiles of CNTs-Raw, CNTs-M; CeO2/CNTs-Raw, CeO2/CNTs-M pretreated at 450 °C under N2. Fig. 6 Fig. 7 XPS core level spectra of CeO2/CNTs-Raw, CeO2/CNTs-M catalysts (a) O 1s (b) C 1s (c) Ce 3d. Fig. 7 Fig. 8 (a) Reaction rate of CeO2/CNTs-Raw and CeO2/CNT-M, (b) Arrhenius activation energy plot. Reaction Conditions: 140 °C, 160 °C,180 °C, 1.5 MPa O2 pressure, 0.1 g catalyst, 15 mL solution, 2500 ppm DMF in a batch reactor. Fig. 8 Fig. 9 Recycle experiments of CNTs-Raw, CNTs-M, CeO2/CNT-Raw, and CeO2/CNTs-M catalysts. Reaction conditions: 2500 ppm DMF, 180 °C, 1.5 MPa O2, 6 h. Fig. 9 Table 1 BET specific surface area of CNTs-Raw, CNTs-M, CeO2, CeO2/ CNTs-Raw, and CNTs-M catalyst. Table 1 Catalysts SBET m2/g Pore volume cm3/g Pore size (Ao) CNT-RawCNTs-M 82.51 0.2589 134.31 167.94 0.4734 145.87 CeO2 94.93 0.1315 53.48 CeO2/CNTs-Raw 75.75 0.1451 96.09 CeO2/CNTs-M 120.14 0.1904 73.40 SBET specific surface area calculated by the Braunauerr-Emmett-Teller (BET) equation. Table 2 Surface composition and oxidation states of O and Ce species by XPS analysis of CeO2/ CNTs-Raw and CeO2/CNTs-M. Table 2 Catalysts Oα % Ce3+ % Ce4+ % CeO2/CNTs-Raw 57.00 8.12 91.88 CeO2/CNTs-M 65.30 19.52 80.48 Table 3 Concentration of leached Cerium in liquid. Table 3 Catalysts Leached Cerium (%)1 st reaction Leached Cerium (%)5th reaction CeO2/CNTs-Raw undetected undetected CeO2/CNTs-M undetected undetected Noble metal free catalyst with High activity and stability for catalytic wet air oxidation of N, N-dimethylformamide Sajid Ali a b Wenting Xiong a b Zefeng Liao a b Muhammad Junaid Aslam a b Chenhong Zhou a b Kim Kek Seong a b Peipei Zhang a b Nuowei Zhang a b Jingbao Zheng a b Jile Fu a b * Binghui Chen a b * a Department of Chemical and Biochemical Engineering, National Engineering Laboratory for Green Productions of Alcohols-Ethers-Esters, College of Chemistry and Chemical Engineering, Xiamen University, Xiamen, 361005, China Department of Chemical and Biochemical Engineering National Engineering Laboratory for Green Productions of Alcohols-Ethers-Esters College of Chemistry and Chemical Engineering Xiamen University Xiamen 361005 China Department of Chemical and Biochemical Engineering, National Engineering Laboratory for Green Productions of Alcohols-Ethers-Esters, College of Chemistry and Chemical Engineering, Xiamen University, Xiamen, 361005, China b School of Energy and Chemical Engineering, Xiamen University Malaysia, Jalan Sunsuria, Bandar Sunsuria, 43900, Sepang, Malaysia School of Energy and Chemical Engineering Xiamen University Malaysia Jalan Sunsuria Bandar Sunsuria Sepang 43900 Malaysia School of Energy and Chemical Engineering, Xiamen University Malaysia, Jalan Sunsuria, Bandar Sunsuria, 43900, Sepang, Malaysia ⁎ Corresponding authors at: Department of Chemical and Biochemical Engineering, National Engineering Laboratory for Green Productions of Alcohols-Ethers-Esters, College of Chemistry and Chemical Engineering, Xiamen University, Xiamen, 361005, China. Department of Chemical and Biochemical Engineering National Engineering Laboratory for Green Productions of Alcohols-Ethers-Esters College of Chemistry and Chemical Engineering Xiamen University Xiamen 361005 China Graphical abstract In this study, we propose a simple strategy to prepare a noble-metal free catalyst, i.e., CeO2 supported on multi-wall carbon nanotube (CNTs). CNTs are treated by acid before the loading of CeO2, which is vital to the performance of catalysts. CeO2 on treated CNTs (CNTs-M) presents much higher TOC conversion and stability when compared with CeO2 on raw CNTs (CNTs-Raw). Kinetic study indicates that acid treatment greatly decreases the activation of the DMF oxidation. To investigate these phenomena, detailed characterizations are performed. We found that the acid treatment generated surface functional groups on CNTs which leads to the strong interaction between CNTs and CeO2. As a result, CeO2 on CNTs-M obtained better dispersion and higher amount of surface oxygen, which accounts for its superior performance. Keywords DMF Active oxygen Selective deposition CeO2 Carbon nanotubes 1 Introduction The rapid growth of populace and increasing number of chemical industries may generate hazardous and toxic organic compounds as by-products which are the key factors affecting the environment [1]. For instance, N, N-dimethylformamide (DMF) is widely used in laboratories and factories due to its outstanding solubility. DMF and its derivatives commonly present as a pollutant in industrial wastewater [2,3], posing potential risks to environment and health [4–6]. Therefore, some wastewater treatment technologies have been developed, such as bio-treatment, physical separation, and chemical oxidation (wet oxidation, wet peroxide oxidation, and supercritical wet oxidation) [7–9]. However, these techniques are not feasible for growing industrial demand because of the high operating costs or low efficiency. Therefore, the development of a superior technology is required to meet the mentioned challenges. Recently, catalytic wet air oxidation (CWAO) with the help of well-designed catalysts has attained significant scrutiny, as it provides a unique and highly efficient solution potent against industrial wastewater [10], which could directly oxidize the toxic pollutant into harmless products (CO2, N2, H2O). Besides, it uses undoubtable air, one of the cheapest and most convenient oxidants [11–13]. The benefits and efficiency of CWAO has been discussed quite thoroughly in our research group as well in others [8–10,14,15]. Noble metal-based catalysts have shown high efficiency in the removal of different forms of nitrogenous organic contaminants from wastewater. In a recent study, Fu et al. [16] found that 3%Pd based catalyst showed high stability and activity for DMF elimination. Sun et al. [17] depicted that the increase in surface area of ZrO2 supported catalyst could promote the DMF oxidation because of the enhanced metal dispersion. Nikolay et al. [18] applied several catalysts including Pt-Pd, Pt and Ru based catalysts to remove N-containing organic contaminants, among them Ru based catalyst showed better performance. Batygina et al. and Gong et al. [19,20] also reported the higher stability and activity of Ru based catalysts than that of Pt and Rh catalysts for the treatment of nitrogen-based organic substances. However, these catalysts are not recommended for the oxidation of DMF due to the extensive leaching of the active phase which is caused by the coordination with the lone-pair electrons in the intermediate compounds (e.g., amine) produced during the oxidation process [21]. Recently, our group has proposed a triple-layer structure to solve this problem [16]. Nevertheless, the high noble metal loading increases the catalyst synthesis cost, which is still a major challenge for its application. Cerium oxide, one of the most essential rare-earth metal oxides, is the most promising metal oxide with high oxygen storage capacity [22–24], which has been widely used in oxidation reactions [25,26] gas sensing [27], and photocatalysis [28]. Some recent studies show that the development of strong synergistic interaction between CeO2 and active metals can promote the activity in selective oxidation reaction [14,29–31]. Song et al. and Yu et al. [32,33] demonstrated that the presence of CeO2 could improve the dispersion of metal and provide oxygen thereby increasing the oxidation activity. Similar enhancement was also reported using CeOx-ZrOx in the CWAO of DMF [20]. However, the direct use of CeO2 as active sites for CWAO is rarely reported. With unique structure thermal stability and large specific surface area, multi-wall carbon nanotube (CNTs) are generally used to promote the dispersion of metals and metal oxides. Ni-Co supported on CNTs is considered as a highly efficient material for urea oxidation reaction (UOR) [34]. Rao et al., Fang et al. and Vijayakumar et al. [35–37] reported that CNTs improved the distortion and reducibility of CeO2 via strengthening the formation of active surface lattice oxygen. Liu et al. depicted that the addition of CeO2 increased the active surface area of CeO2-Pt/CNTs and CeO2/CNTs-Pt/CNTs thereby enhancing the methanol oxidation [38]. Peng et al. [39] performed DFT study and demonstrated that the electronic interactions between MnO2 and CNTs increased the activity of N-doped pristine CNTs. An important corollary of the above studies is metal oxides on the surface of CNTs prepared by different methods open a new window to noble metal free catalyst with low synthesis cost to fulfill the industries application. In this present study, we used pristine CNT (CNT-Raw) and treated/modified CNT (CNT-M) as support for CeO2. CeO2/CNT-Raw and CeO2/CNT-M were prepared using a simple two-step technique/wet chemistry method to enhance the metal support interaction. Their performance in the CWAO of DMF was examined by total organic carbon (TOC) instrument. The results showed that the modified CNTs with the inclusion of ceria performed significantly better than other prepared catalysts. Some reported results argue that the catalyst's activity is based on the amount of CeO2 [40,41]. However, this study discoveries that the total activity depends on the interaction between CeO2 and CNT, which directly affects the oxidizing ability of CeO2. 2 Experimental 2.1 Reagents Cerium nitrate hexahydrate (Ce(NO3)3·6H2O, Nitric acid (HNO3) (65–68 % pure), Xylene (C8H10), Phosphoric acid (H3PO4) were purchased from Sino-pharm-Chemical Reagent (SCR) Co. Ltd. (Shanghai China). CNTs used was prepared in our group. 2.2 Preparation of catalysts 2.2.1 Functionalization of CNTs CNTs were prepared in our group with outer diameter 28−38 nm [42]. Firstly, nanotubes were grinded well, and then treated with 68 % concentrated nitric acid (HNO3) at 100 °C for 5 h according to the mentioned method with a small modification to protect the CNTs structure [43]. After cooldown at room temperature under stirring, CNTs were washed with deionized water several times until pH of the solution reaches 7. Then, the obtained materials were dried at 100 °C for 12 h. 2.2.2 Preparation of CeO2/CNTs-M and CeO2/CNTs-Raw For the loading of CeO2 on the surface of the modified nanotubes, a combined two-step strategy was applied based on the previously reported methods with a small modification [44–46]. At first, xylene was used to fill in and protect the inner cavity of CNTs. The solution that contains both CNTs and xylene were sonicated for 1 h to ensure the xylene enters the CNT tunnel before introducing the Ce(NO3)3·6H2O. Then, 2.5 mL water and 0.538 g Cerium nitrate hexahydrate were mixed, and sonicated for 30 min. After that, it was added to the mixture that contains CNTs dropwise under stirring, followed by the sonification for 3 h. Eventually, the obtained material was dried at 100 °C for 12 h and then calcined in N2 for 1 h at 450 °C with 2 °C/min temperature ramp. The similar procedures were applied to make CeO2/CNTs-Raw using CNTs-Raw. 2.3 Catalyst characterizations The crystal phase measurements were performed using Rigaku X-ray diffractometer (XRD) with a filtered Cu-kα radiation at 40 kV and 30 mA with 2θ angular range between 10°-90°. The X-ray photoelectron spectroscopy (XPS) was obtained with PHI quantum 2000 scanning ESCA microprobe using monochromatic Al-kα radiation (1846.6 eV) as the X-ray source. The binding energy of spectra was calibrated using reference C 1s peak at 284.6 eV. Raman spectroscopy was obtained using confocal Raman microscope with an excitation of 532 nm laser light. High resolution transmission electron microscopy (HR-TEM) was performed on F-30-HRTEM (Netherland) using 200 kV voltage acceleration. Nitrogen adsorption desorption experiment was performed on micromeritics ASAP 2020 instrument, and the specific surface area was calculated using Brunauer-Emmett-Teller (BET) equation. Hydrogen temperature-programmed reduction (H2-TPR) and oxygen temperature-programmed desorption (O2-TPD) were performed on micromeritics Autochem II 2920 instrument. The signal was detected using TCD detector. Furthermore, the real loading of CeO2 was investigated using thermogravimetric analysis (TG-209-F1 Germany) under the air flow rate 30 mL/min from atmospheric temperature to 960 °C. The loading of CeO2 was determined using the following equation: CeO2 (%) = (residual weight/weight loss) ×100 Rate of reaction and Arrhenius plot activation energy equation were used to determine the reason behind the high activity and stability. 2.4 Catalytic wet air oxidation of DMF Catalytic wet air oxidation of N, N-Dimethyl formamide (DMF) was carried out in a stainless-steel batch reactor with a total reactor volume of 100 mL. The system is capable of running batch experiments at pressure up to 15 MPa and temperature up to 250 °C. 15 mL solution with 2500 ppm DMF concentration and 0.1 g catalyst were fed in the reactor, and then the solution was purged with N2 at least three times to remove all the oxygen. After that, the reactor was heated to 180 °C with the stirring rate of 750 rpm. When the reaction temperature reached 175 °C, the reactor was filled with oxygen to maintain the partial pressure of 1.5 MPa during oxidation process. After 6 h, used catalyst was carefully collected, washed and dried at 100 °C for 12 h for further reaction. Total organic carbon (TOC) was measured by Shimadzu TOC-L analyzer. To avoid the effect of mass transfer, the effect of stirring rate was studied at the range of 200–1000 rpm. The reaction rate increased gradually from 200 to 700 rpm. Above 700 rpm, no difference of the rate was observed. For the measurement of initial reaction rate, the conversion was controlled below 10 %. The corresponding activation energy was obtained from the reactions performed at 140–180 °C. 3 Results and discussion 3.1 Structural investigation of hybrid (CeO2/CNTs) CNTs catalysts 3.1.1 XRD X-ray diffraction patterns of mentioned materials (CNTs-Raw, CNTs-M, CeO2, CeO2/CNTs-Raw, and CeO2/CNTs-M) are shown in Fig. 1 . For CNTs-Raw, five peaks are observed at 26.25°, 43.30°, 77.60°, 44.70° and 51.80°. The peaks around 44.70° and 51.80° represent the impurities/catalytic particles remaining in the synthesis process; after the treatment with acid, the catalyst particles/impurities peaks almost disappeared with no effect on the CNTs structure. The rest peaks (26.25°, 43.30°, 77.60°) match well with the CNTs, indicating that the graphitization structure of CNTs remained during the acid treatment [47,48]. The addition of CeO2 on the surface of modified and un-modified CNTs can be confirmed by the peaks, which are well-matched with the patterns of CeO2 [38]. The full width at half maximum (FWHM) of the peaks of CeO2/CNTs-Raw is higher than that of CeO2/CNTs-M, indicating that sizes of CeO2 on these two types of supports are different. This has also been confirmed by the TEM results. 3.1.2 SEM and High-resolution transmission electron microscopy (HR-TEM) Scanning electron microscope (SEM) was also performed to investigate the microstructure of selected catalysts. Fig. 2 shows the SEM images for CNT-Raw and CNTs-M, which clearly demonstrates that structure of modified CNTs remained after treatment. HR-TEM was performed for CeO2/CNTs-Raw (Fig. 3 a-c) and CeO2/CNTs-M (Fig. 3d-f) to investigate the structural properties. The uniform distribution of CeO2 particles on the surface of CNTs-M is clearly shown in Fig. 3d-f, while CeO2 aggregates and forms big particles on CeO2/CNT-Raw (Fig. 3a-c). The deposition of ceria nanoparticles was strongly affected by the functional group of CNT. Aggregation of CeO2 in CeO2/CNTs-Raw probably results from the weak interaction between CeO2 and carbon surface. The corresponding activity may decrease because of the low amount of available active sites [49]. Fig. 3c shows the HR-TEM images of CeO2 in CeO2/CNTs-Raw. The observed inter planer space is 0.30 nm and 0.28 nm, which match with that of CeO2 [111] and CeO2 [200]. The dominant facets of CeO2/CNTs-M shown in Fig. 3f are CeO2 [111]. The size distribution of CeO2/CNTs-M and CeO2/CNTs-Raw can be found in Fig. 3g and h respectively. CeO2/CNT-M possesses narrow and uniform particle size distribution in the range between 1.8 nm and 4.38 nm (mean particle size 2.56 nm). The formation of large agglomerates (CeO2) on CNT-Raw was observed (Fig. 3a, b). The mean size of CeO2 is 18.0 nm. 3.1.3 BET Table 1 shows the BET surface area results of modified and unmodified samples. The surface area was calculated using the nitrogen adsorption isothermal method. CNTs-Raw and CeO2/CNTs-Raw exhibited a much lower surface area and pore volume than un-modified samples. This might result from the residual impurities generated during the synthesis process of CNTs-Raw, which could block the tubes thereby lowering the surface area of CNTs. The increase in surface area of CNTs-M was thought to be caused by the acid treatment [48], which removed the impurities and the metals (as catalyst for producing CNTs) on tubes. Furthermore, the addition of CeO2 on CNTs decreased the surface area of CNTs. This is caused by the entry of nanoparticles in the pores, leading to the reduction of volume. It is also a well-documented fact that the surface area of the material decreases with an increasing quantity of the active component until the impregnated component's monolayer coverage is completed [50,51]. 3.1.4 Thermogravimetric analysis Thermogravimetric analysis (TGA) was performed using TG apparatus for selected catalysts to verify the real and theoretical loading of CeO2 and combustion stability. The theoretical loading of ceria is 30 % for both catalysts, while the values obtained from TGA (Fig. 4 ) for CeO2/CNTs-M and CeO2/CNTs-Raw are 30.9 % and 33.8 % respectively. The higher mass loss of modified CeO2/CNTs-M than that of CeO2/CNTs-Raw results from the presence of functional groups. By contrast, the lower temperature and higher rate of mass loss was also observed for CeO2/CNTs-M. It is well documented that CeO2 can promote the reaction between carbon and oxygen [35]. Thus, the interaction, a kind of “contact”, between CeO2 and CTNs in CeO2/CNTs-M is stronger than that of CeO2/CNT-Raw. However, carbon nanotubes show the opposite trend. The combustion temperature of CNTs-M (730 °C) is higher than that of CNTs-Raw (700 °C). The main reason is the catalytic effect of the impurities/catalyst particles in CNT-Raw, which promotes the combustion. The acid treatment removed the impurities/catalyst from CNTs, which has been confirmed by the previous results [52]. 3.1.5 Raman Raman technique was used to investigate the surface properties of these materials. The band around 1346−1356 cm−1, called d-band, is associated with the disordered carbon and defects in CNTs, while the band around 1580−1587 cm−1, called G-band, is assigned to the well-ordered carbon related to a splitting of the E2g stretching mode of graphite and reflects the structural intensity of the sp2-hybridized carbon atoms. The band around 1609 cm−1 is the overtone of d-band [53]. The intensity ratio between the d-band (ID) and the G-band (IG) is sensitive to the chemical processing and is an index of the defects of the CNTs [54]. Two prominent characteristic bands for the CNTs-Raw and modified CNTs-M (Fig. 5 a) were detected, which are the D band (1346 cm−1, 1357 cm−1) and G band (1581 cm−1, 1587 cm−1) respectively. The small increment in ID/IG ratio is caused by impurities removal, meaning nearly no fundamental structure change from CNTs-Raw to CNTs-M. The wavenumber of G mode in CNTs-M is 10 cm-1 higher than that of CNTs-Raw, which is related to the change of electrochemical structure, e.g., the increase of functional groups attached to CNTs-M walls/edges or/and the increased oxygen content in the nanotube's framework. After the loading of CeO2 on the surface of CNTs, both CeO2/CNTs-M and CeO2/CNTs-Raw present lower ID/IG ratio, which is 1.06 and 0.99 respectively. These significant changes in band ratio directly confirm the interaction between CeO2 and CNTs. It is noticed that when CeO2 is introduced to the CNTs-M and CNTs-Raw wall to form CeO2–CNTs composites, the bonding state of CNTs would change. On the other hand, the feature peak of Ce-O vibrational mode of ceria (459 cm−1 and 570−640 cm−1) is evident for CeO2/CNTs-Raw but vanished for CeO2/CNTs-M. The much lower intensity of these peaks is attributed to Ce-CNTs bonding, indicating the high dispersion of ceria nanoparticles [55]. 3.1.6 FT-IR The FT-IR spectra of CeO2/CNTs-M, CeO2/CNTs-Raw, CNTs-M, and CNTs-Raw are shown in Fig. 5b. The broad peak at 3200−3550 cm−1 is attributed to the hydroxyl group's stretching vibration (free/bonded). The band around 1570 cm−1 is attributed to the graphitic structure of sp2-hybridized carbon in CNTs, while the band at 1160 cm−1 is assigned to sp3 carbon [53,54]. New peaks at around 1640 cm−1 and 2900 cm−1 in CNTs-M are attributed to the CO stretching vibrations of COOH group and hydroxyl moieties at carbon surface. The intensity of the peak at 1400 cm−1 increases after treatment, indicating the addition of the OH group [44,56]. In summary, much more functional groups are connected on CNTs-M than on CNTs-Raw. After CeO2 loading, in the range of wavenumber 1500−1650 cm−1, 1384 cm−1, and 1000−1100 cm–1 for CeO2/CNTs-M, small increment in intensity was observed, while the intensity of the peaks around 1400 cm−1 and 1641 cm−1 decreases. These clearly indicate the interaction between CeO2 and carbon tube wall, which is consistent with the reported results [51,57]. The IR spectra also show one significant peak located at 505 cm−1 for CeO2/CNTs-M catalyst. It represents the Ce-O vibration of the CeO2 nanoparticles on the surface of CNTs-M [55]. 3.1.7 H2-TPR The reducibility of selected catalysts (CNTs-Raw, CNTs-M, CeO2/CNTs-Raw, and CeO2/CNTs-M) were evaluated by H2-TPR, and the profile is shown in Fig. 6 a. For CNTs-Raw, the first peak at lower temperature (350 °C) represents the reduction of impurities, and 2nd peak at around 590 °C describes the methanation at high temperature. For CNTs-M, the first peak at around 490 °C indicates the reduction of functional group, and 2nd peak is also the methanation. There are no other peaks observed at lower temperatures, because, after treatment, impurities are removed. For CeO2/CNT-Raw, the temperature of the impurity’s reduction decreases to 300 °C, which is well documented that ceria's addition promotes the reduction. The interaction between impurities and CeO2 would produce a new type of oxygen species that can be reduced by hydrogen at a lower temperature [58]. The peak at 370 °C results from the surface oxygen of deposited CeO2 on carbon, while the peak that represents the bulk oxygen of CeO2 is located at 585 °C and cannot be distinguished from the methanation. By contrast, impurities related peaks cannot be observed for CeO2/CNTs-M. The reduction of surface oxygen of CeO2 occurred at 370 °C, while the peaks that represent bulk oxygen are located at around 535 °C [36,59]. Besides, methanation is greatly inhibited. 3.1.8 O2-TPD The oxygen mobility in the materials was further studied using O2-TPD (Fig. 6b). The peaks of CNTs-Raw and CNTs-M represent the impurities and functional group on the CNTs surface respectively. For both CeO2/CNTs-Raw and CeO2/CNTs-M, three oxygen desorption peaks are observed. Yao and Chen et al. [59,60] already described these three types of oxygen (surface capping oxygen/active surface oxygen, surface lattice oxygen, and bulk lattice oxygen/sharing oxygen) available in ceria structure. The peak at around 120 °C is the surface capping oxygen, while the peak at 300−450 °C is the surface lattice oxygen. Prominent peak with high intensity and area at around 120 °C for CeO2/CNTs-M means that it has more exchangeable structure oxygen. This is consistent with the higher DMF oxidation activity of CeO2/CNTs-M when compared with CeO2/CNTs-Raw. Katsaounis et al. [61] mentioned that surface lattice oxygen (medium temperature peak) also plays an important role in an oxidation reaction [62]. The strong interaction between CNTs-M and CeO2 oxides leads to more lattice defects and oxygen vacancies and promotes the mobility and desorption of capping oxygen at a lower temperature [63]. Ceria decorated CNTs-M with high pore diameter and surface area desorbed more surface lattice oxygen, which also accounts for its high activity. 3.1.9 XPS XPS were applied to analyze the surface composition and chemical state of selected catalysts. The O 1s spectra of CeO2/CNTs-M and CeO2/CNTs-Raw catalysts are shown in Fig. 7 a. The O 1s spectra deconvoluted by curve fitting procedure. The peak at lower binding energy (528.7–530.5 eV) corresponds to the lattice oxygen O2− (donated as Oβ) and peak at 531.2–532.4 eV illustrates the surface capping oxygen such as O- (donated as Oα). For CeO2/CNTs-M and CeO2/CNT-Raw, both of them were observed. Another peak at 533.5 eV represents the water or functional group. [64,65]. The Oα/(Oα+Oβ) clearly show that surface-active oxygen (67 %) is much more available on the surface of CeO2/CNTs-M. The surface oxygen is much more important than other kind of oxygen in catalytic oxidation [36,46]. The C 1s spectra of CeO2/CNTs-M and CeO2/CNTs-Raw present two prominent peaks at 284.5 eV and 285.5 eV (Fig. 7b). The peak at 284.4 eV illustrates the CC component of CNTs, and the observed peak around 285.5 eV is attributed to the presence of CO component [66]. In addition, the peak at 288.5 eV was only observed for CeO2/CNTs-M, and it can be attributed to the (Ce-C-O) and interaction between ceria and carbon wall [51]. Fig. 7c shows the Ce 3d spectra of CeO2/CNTs-M and CeO2/CNTs-Raw. The peaks around 885.0 eV and 903.8 eV are assigned to Ce3+, and the rest of the peaks can be illustrated as Ce4+. The relative concentration of Ce3+, Ce4+ and surface oxygen (Oα ) are summarized in Table 2 . The relative concentration of Ce3+ is much higher in CeO2/CNTs-M (19.52 %) when compared with that of CeO2/CNTs-Raw (8.12 %). This is consistent with the available surface oxygen (Oα ) in CeO2/CNTs-M catalyst. Fig. 3e demonstrates the uniform dispersion of CeO2 on CNTs-M, which is related to the surface functional group. After acid treatment, the newly formed function group (e.g., −COOH) on CNT-M can be used as a nucleation site for CeO2 nanoparticle. The cation in the solution of cerium nitrate can interact with carboxyl group (−COOH) on the surface of nanotubes. [36,44]. On the other hand, the improved surface area of CNTs-M was thought to be caused by the acid treatment [48], which removed the impurities (metal particles/as catalyst for producing CNTs) in the confined space of the CNTs, resulting in the increase of the space between tubes and surface area. Both the metal/support interaction and improved surface area are responsible for the uniform dispersion of CeO2. 3.2 Catalytic wet air oxidation Reaction test 3.2.1 Catalytic reaction rate and activation energy The reaction rates of CeO2/CNTs-Raw and CeO2/CNTs-M were measured based on conversion versus reaction time at different temperatures, and the results are shown in Fig. 8 a. The strategy of CeO2 inclusion on the surface of CNTs can significantly affect the rate of reaction that occurs on the catalyst surface. For the same reactant on the surface of two different prepared catalysts, the obtained results are illustrated in Fig. 8a. The corresponding activation energy reaction rate and the obtained results are demonstrated in Fig. 8b. According to the obtained results at the same reaction conditions, catalysts prepared by modified CNTs, CeO2/CNTs-M exhibited much higher reaction rate than CeO2/CNT-Raw. At 180 °C, the reaction rate of CeO2/CNT-Raw is 1152.9 (mmol L−1 h−1), while the rate of CeO2/CNT-M reaches 2117.6 (mmol L−1 h−1). At lower temperatures, the reaction rate of CeO2/CNTs-M is around two times higher than that of CeO2/CNTs-Raw. The corresponding activation energy (donated as Ea) that can be obtained from the Arrhenius equation is shown in Fig. 8b. The calculated Ea of CeO2/CNTs-Raw and CeO2/CNTs-M are 120.32 ± 10.98 kJ/mole and 72.97 ± 5.09 kJ/mole respectively. 3.2.2 Catalytic stability and CeO2/CNTs leaching/deactivation test Recycling experiments were also performed to investigate the stability of CNTs-Raw, CNTs-M, CeO2, CeO2/CNTs-Raw, and CeO2/CNTs-M. After each reaction, catalyst was washed and dried at 100 °C for 12 h and then used for the next reaction. The results are shown in Fig. 9 . Of all the catalysts, CeO2/CNTs-M shows the best activity and stability. The conversion reaches 75 %, and no deactivation was observed for five consecutive reactions. The first-time reaction TOC conversion for CeO2/CNTs-Raw is 62.5 %. After the fifth reaction, the value drops to 59.5 %. CeO2 presents a similar trend with CeO2/CNT-Raw during the stability test, and its activity is between CeO2/CNTs-M and CeO2/CNTs-Raw. The CNT-Raw also shows stable TOC conversion (%), and its activity is higher than that of modified CNT at the first-time reaction. The possible reason is that the impurities (metals for producing CNTs) promote the oxidation of DMF. Nevertheless, the activity of modified CNTs increases gradually from the first to third reaction. This is probably attributed to the generation of more functional groups on the surface of CNTs-M. The deactivation of CeO2/CNTs-M and CeO2/CNTs-Raw was also studied. Results show that no deactivation of CeO2/CNTs-M was observed and TOC conversion could be maintained up to 75 %. The leaching of the catalysts was determined by ICP-OES using the 1 st and 5th reaction solution, and the results are shown in Table 3 . No leaching was detected for any of the tested reaction solution. Thus, the main reason for the deactivation of CeO2/CNT-Raw is thought to be the agglomeration of nano CeO2 (Fig. 3a, b). As is mentioned above, aggregation of CeO2 in CeO2/CNTs-Raw resulted from the weak interaction between CeO2 and CNTs surface because of lower amounts of functional groups. After several reactions, the CeO2 on CNT-Raw would move over the surface of CNT and form big particles, resulting in the low activity. This is consistent with the reported results of Fang et al. [36]. Based on the results of characterizations, we have got a basic understanding of the properties of tested materials. The acid treatment has a strong influence on the surface of CNTs by producing oxygen-containing groups. Impurities were also removed, but this has a minor effect on the catalytic performance. The generated oxygen-containing groups play an important role in the process of the CeO2 deposition, as they can interact with the CeO2 nanoparticles. The dispersion of CeO2 is greatly improved on modified CNT, and is much better than that of CeO2 on raw CNT. Based on the results of XRD, TEM and Raman shift, we have confirmed that the size of CeO2 on CNTs-M is lower than that of CeO2 on CNT-Raw. Nevertheless, the high activity of CeO2/CNTs-M is not only related to the number of exposed active sites. The much lower Ea of CeO2/CNTs-M indicates that the property of active cites is also modified. According to the results of XPS, TPR and TPD, the amount of surface capping oxygen and surface lattice oxygen on CeO2/CNT-M is larger. We tend to believe that the higher amount of surface oxygen over CeO2/CNTs-M accounts for its high activity. Besides, the strong interaction between CeO2 and modified CNT also helps stabilize the CeO2 nanoparticles as no deactivation was observed in five consecutive runs. 4 Conclusion CeO2 nanoparticles supported on the CNTs-M and CNTs-Raw were synthesized via a facile strategy and evaluated in the catalytic wet air oxidation (CWAO) of DMF. Detailed characterizations were also performed to investigate the catalysts. These findings confirmed that the acid treatment generated surface functional groups on CNTs, which led to the enhanced interaction between CNTs and CeO2. This strong interaction not only improves the dispersion of CeO2 but also increases the surface oxygen in CeO2/CNTs-M. As a result, CeO2/CNTs-M shows much better catalytic activity and stability than CeO2/CNTs-Raw does. Kinetic results also confirmed that CeO2/CNTs-M had lower activation energy than CeO2/CNTs-Raw. All these experimental results suggest the potential application of CeO2-CNTs composite in catalytic wet air oxidation (CWAO) process. CRediT authorship contribution statement Sajid Ali, Wenting Xiong, Muhammad Junaid Aslam, Peipei Zhang, Chenhong Zhou: Synthesized the catalysts and conducted the catalytic experiments. Sajid Ali, JiLe Fu, Binghui Chen, Nuowei Zhang, J.B. Zheng, Kim Kek Seong: Conceived the experiments. Sajid Ali, Peipei Zhang, Zefeng Liao: Performed and analyzed the characterization. Sajid Ali, JiLe Fu: Writing- Original draft preparation. JiLe Fu, Binghui Chen: Writing- Reviewing and Editing. JiLe Fu, Binghui Chen: Supervision. Declaration of Competing Interest The authors report no declaration of interest. Acknowledgement The authors would like to thank the financial support from Xiamen University Malaysia (XMUMRF/2020-C5/IENG/0026). References [1] J. Levec A. Pintar Catal. Today 124 2007 172 184 J. Levec, A. Pintar, Catalytic wet-air oxidation processes: A review, Catal. Today, 124 (2007) 172-184. [2] V. Vasudevan S.H. Mushrif J. Mol. Liq. 206 2015 338 342 V. Vasudevan, S.H. Mushrif, Force field parameters for N, N-Dimethylformamide (DMF) revisited: Improved prediction of bulk properties and complete miscibility in water, J. Mol. Liq. 206 (2015) 338-342. [3] Y. Hasegawa M. Matsuo Y. Sigemoto T. Sakai T. Tokuyama J. Ferment. Bioeng. 84 1997 543 547 Y. Hasegawa, M. Matsuo, Y. Sigemoto, T. Sakai, T. Tokuyama, Purification and characterization of N, N-dimethylformamidase from Alcaligenes sp. KUFA-1, J. Ferment. Bioeng. 84 (1997) 543-547. [4] M.J. Twiner M. Hirst A. Valenciano T.R. Zacharewski S.J. Dixon Rev. Pure Appl. Pharmacol. Sci. 153 1998 143 151 M.J. Twiner, M. Hirst, A. Valenciano, T.R. Zacharewski, S.J. Dixon, N, N-Dimethylformamide modulates acid extrusion from murine hepatoma cells, Appl. Pharmacol. 153 (1998) 143-151. [5] G.L. Kennedy R.D. Short CRC Crit. Rev. Toxicol. 17 1986 129 182 G.L. Kennedy, R.D. Short, Biological effects of acetamide, formamide, and their monomethyl and dimethyl derivatives, CRC Crit. Rev. Toxicol. 17 (1986) 129-182. [6] C.-P. Chang J.-N. Chen M.-C. Lu H.-Y. Yang Chemosphere 58 2005 1071 1078 C.-P. Chang, J.-N. Chen, M.-C. Lu, H.-Y. Yang, Photocatalytic oxidation of gaseous DMF using thin film TiO2 photocatalyst, Chemosphere, 58 (2005) 1071-1078. [7] L. Oliviero J. Barbier Jr D. Duprez A. Guerrero-Ruiz B. Bachiller-Baeza I. Rodrı́guez-Ramos Appl. Catal. B Environ. 25 2000 267 275 L. Oliviero, J. Barbier Jr, D. Duprez, A. Guerrero-Ruiz, B. Bachiller-Baeza, I. Rodrı́guez-Ramos, Catalytic wet air oxidation of phenol and acrylic acid over Ru/C and Ru–CeO2/C catalysts, Appl. Catal. B Environ. 25 (2000) 267-275. [8] Y.I. Matatov-Meytal M. Sheintuch Ind. Eng. Chem. Res. 37 1998 309 326 Y.I. Matatov-Meytal, M. Sheintuch, Catalytic abatement of water pollutants, Ind. Eng. Chem. Res. 37 (1998) 309-326. [9] S. Imamura Ind. Eng. Chem. Res. 38 1999 1743 1753 S. Imamura, Catalytic and noncatalytic wet oxidation, Ind. Eng. Chem. Res. 38 (1999) 1743-1753. [10] F. Arena C. Italiano L. Spadaro Appl. Catal. B Environ. 115 2012 336 345 F. Arena, C. Italiano, L. Spadaro, Efficiency and reactivity pattern of ceria-based noble metal and transition metal-oxide catalysts in the wet air oxidation of phenol, Appl. Catal. B Environ. 115 (2012) 336-345. [11] A. Cybulski Ind. Eng. Chem. Res. 46 2007 4007 4033 A. Cybulski, Catalytic wet air oxidation: are monolithic catalysts and reactors feasible?, Ind. Eng. Chem. Res. 46 (2007) 4007-4033. [12] K.-H. Kim S.-K. Ihm J. Hazard. Mater. 186 2011 16 34 K.-H. Kim, S.-K. Ihm, Heterogeneous catalytic wet air oxidation of refractory organic pollutants in industrial wastewaters: a review, J. Hazard. Mater. 186 (2011) 16-34. [13] F. Arena R. Di Chio B. Gumina L. Spadaro G. Trunfio Inorganica Chim. Acta 431 2015 101 109 F. Arena, R. Di Chio, B. Gumina, L. Spadaro, G. Trunfio, Recent advances on wet air oxidation catalysts for treatment of industrial wastewaters, Inorganica Chim. Acta, 431 (2015) 101-109. [14] L. Geng B. Chen J. Yang C. Shui S. Ye J. Fu N. Zhang J. Xie B. Chen Appl. Catal. A Gen. 604 2020 117774 L. Geng, B. Chen, J. Yang, C. Shui, S. Ye, J. Fu, N. Zhang, J. Xie, B. Chen, Synergistic effect between Mn and Ce for active and stable catalytic wet air oxidation of phenol over MnCeOx, Appl. Catal. A Gen. 604 (2020) 117774. [15] J. Fu K. Yang C. Ma N. Zhang H. Gai J. Zheng B.H. Chen Appl. Catal. B Environ. 184 2016 216 222 J. Fu, K. Yang, C. Ma, N. Zhang, H. Gai, J. Zheng, B.H. Chen, Bimetallic Ru–Cu as a highly active, selective and stable catalyst for catalytic wet oxidation of aqueous ammonia to nitrogen, Appl. Catal. B Environ. 184 (2016) 216-222. [16] J. Fu Q. Yue H. Guo C. Ma Y. Wen H. Zhang N. Zhang Y. Zheng J. Zheng B.-H. Chen ACS Catal. 8 2018 4980 4985 J. Fu, Q. Yue, H. Guo, C. Ma, Y. Wen, H. Zhang, N. Zhang, Y. Zheng, J. Zheng, B.-H. Chen, Constructing Pd/CeO2/C to achieve high leaching resistance and activity for catalytic wet air oxidation of aqueous amide, ACS Catal. 8 (2018) 4980-4985. [17] G. Sun A. Xu Y. He M. Yang H. Du C. Sun J. Hazard. Mater. 156 2008 335 341 G. Sun, A. Xu, Y. He, M. Yang, H. Du, C. Sun, Ruthenium catalysts supported on high-surface-area zirconia for the catalytic wet oxidation of N, N-dimethyl formamide, J. Hazard. Mater. 156 (2008) 335-341. [18] N.M. Dobrynkin M.V. Batygina A.S. Noskov Catal. Today 45 1998 257 260 N.M. Dobrynkin, M.V. Batygina, A.S. Noskov, Solid catalysts for wet oxidation of nitrogen-containing organic compounds, Catal. Today, 45 (1998) 257-260. [19] M.V. Batygina N.M. Dobrynkin A.S. Noskov Adv. Environ. Res. 4 2000 123 132 M.V. Batygina, N.M. Dobrynkin, A.S. Noskov, Oxidation of organic substances in aqueous solutions over Ru catalysts by oxygen, Adv. Environ. Res. 4 (2000) 123-132. [20] J. Gong D. Li L. Wang W. Zhan Y. Guo Y. Wang Y. Guo J. Rare Earths 37 2019 265 272 J. Gong, D. Li, L. Wang, W. Zhan, Y. Guo, Y. Wang, Y. Guo, Catalytic wet oxidation of N, N-dimethyl formamide over ruthenium supported on CeO2 and Ce0. 7Zr0. 3O2 catalysts, J. Rare Earths, 37 (2019) 265-272. [21] N. Grosjean C. Descorme M. Besson Appl. Catal. B Environ. 97 2010 276 283 N. Grosjean, C.Descorme, M. Besson, Catalytic wet air oxidation of N, N-dimethylformamide aqueous solutions:deactivation of TiO2 and ZrO2-supported noble metal catalysts, Appl. Catal. B Environ. 97 (2010) 276-283. [22] S. Mali Ca. Betty P.N. Bhosale P.S. Patil ECS J. Solid State Sci. Technol. 1 2012 M15 M23 S. Mali, C. a. Betty, PN Bhosale, and PS Patil,“Synthesis, characterization of hydrothermally grown MWCNT-TiO2 photoelectrodes and their visible light absorption properties,” ECS J. Solid State Sci Technol, 1 (2012) M15-M23. [23] A. Trovarelli Catal. Rev. 38 1996 439 520 A. Trovarelli, Catalytic properties of ceria and CeO2-containing materials, Catal. Rev. 38 (1996) 439-520. [24] F. Kaissouni R. Brahmi M. Zbair G. Lafaye Z. El Assal L. Pirault-Roy J.B. Junior A. Elaissi M. Bensitel M. Baalala Environ. Sci. Pollut. Res. Int. 2020 F. Kaissouni, R. Brahmi, M. Zbair, G. Lafaye, Z. El Assal, L. Pirault-Roy, J.B. Junior, A. Elaissi, M. Bensitel, M. Baalala, Catalytic wet air oxidation of high BPA concentration over iron-based catalyst supported on orthophosphate, Environ. Sci. Pollut. Res. Int. (2020). [25] X. Zheng X. Zhang X. Wang S. Wang S. Wu Appl. Catal. A Gen. 295 2005 142 149 X. Zheng, X. Zhang, X. Wang, S. Wang, S. Wu, Preparation and characterization of CuO/CeO2 catalysts and their applications in low-temperature CO oxidation, Appl. Catal. A Gen. 295 (2005) 142-149. [26] S. Hosokawa H. Kanai K. Utani Y.-i. Taniguchi Y. Saito S. Imamura Appl. Catal. B Environ. 45 2003 181 187 S. Hosokawa, H. Kanai, K. Utani, Y.-i. Taniguchi, Y. Saito, S. Imamura, State of Ru on CeO2 and its catalytic activity in the wet oxidation of acetic acid, Appl. Catal. B Environ. 45 (2003) 181-187. [27] G. Sberveglieri Sensors Actuators B Chem. 23 1995 103 109 G. Sberveglieri, Recent developments in semiconducting thin-film gas sensors, Sensors Actuators B Chem. 23 (1995) 103-109. [28] M. Gómez-Cerezo M.J. Mu noz-Batista D. Tudela M. Fernández-García A. Kubacka ACS Catal. 2014 156 157 M. Gómez-Cerezo, MJ Mu noz-Batista, D. Tudela, M. Fernández-García, A. Kubacka, ACS Catal. (2014) 156-157. [29] H. Liu Z. Fan C. Sun S. Yu S. Feng W. Chen D. Chen C. Tang F. Gao L. Dong Appl. Catal. B Environ. 244 2019 671 683 H. Liu, Z. Fan, C. Sun, S. Yu, S. Feng, W. Chen, D. Chen, C. Tang, F. Gao, L. Dong, Improved activity and significant SO2 tolerance of samarium modified CeO2-TiO2 catalyst for NO selective catalytic reduction with NH3, Appl. Catal. B Environ. 244 (2019) 671-683. [30] Y. Zeng W. Song Y. Wang Y. Meng S. Zhang Q. Zhong Chemosphere 235 2019 1146 1153 Y. Zeng, W. Song, Y. Wang, Y. Meng, S. Zhang, Q. Zhong, The utilization of dye wastewater in enhancing catalytic activity of CeO2-TiO2 mixed oxide catalyst for NO reduction and dichloromethane oxidation, Chemosphere, 235 (2019) 1146-1153. [31] Z. Zuo P.J. Ramírez S.D. Senanayake P. Liu J.A. Rodriguez J. Am. Chem. Soc. 138 2016 13810 13813 Z. Zuo, P.J. Ramírez, S.D. Senanayake, P. Liu, J.A. Rodriguez, Low-temperature conversion of methane to methanol on CeOx/Cu2O catalysts: water controlled activation of the C–H bond, J. Am. Chem. Soc. 138 (2016) 13810-13813. [32] A. Song G. Lü Chin. J. Catal. 35 2014 1212 1223 A. Song, G. Lü, Study of catalytic activity and product selectivity of M/Al2O3-CeO2 (M= Pt-Ru, Ru, and Pt) in catalytic wet air oxidation of methylamine, Chinese J. Catal. 35 (2014) 1212-1223. [33] C. Yu P. Zhao G. Chen B. Hu Appl. Surf. Sci. 257 2011 7727 7731 C. Yu, P. Zhao, G. Chen, B. Hu, Al2O3 supported Ru catalysts prepared by thermolysis of Ru3 (CO)12 for catalytic wet air oxidation, Appl. Surf. Sci. 257 (2011) 7727-7731. [34] R.M. Tesfaye G. Das B.J. Park J. Kim H.H. Yoon Sci. Rep. 9 2019 1 9 R.M. Tesfaye, G. Das, B.J. Park, J. Kim, H.H. Yoon, Ni-Co bimetal decorated carbon nanotube aerogel as an efficient anode catalyst in urea fuel cells, Sci. Rep. 9 (2019) 1-9. [35] R. Rao Q. Zhang H. Liu H. Yang Q. Ling M. Yang A. Zhang W. Chen J. Mol. Catal. A Chem. 363 2012 283 290 R. Rao, Q. Zhang, H. Liu, H. Yang, Q. Ling, M. Yang, A. Zhang, W. Chen, Enhanced catalytic performance of CeO2 confined inside carbon nanotubes for dehydrogenation of ethylbenzene in the presence of CO2, J. Mol. Catal. A Chem. 363 (2012) 283-290. [36] C. Fang D. Zhang L. Shi R. Gao H. Li L. Ye J. Zhang Catal. Sci. Technol. 3 2013 803 811 C. Fang, D. Zhang, L. Shi, R. Gao, H. Li, L. Ye, J. Zhang, Highly dispersed CeO2 on carbon nanotubes for selective catalytic reduction of NO with NH3, Catal. Sci. Technol. 3 (2013) 803-811. [37] S. Vijayakumar S. Vadivel A. Biruntha T. Brindhasri P. Desika Diam. Relat. Mater. 109 2020 108006 S. Vijayakumar, S. Vadivel, A. Biruntha, T. Brindhasri, P. Desika, Design and fabrication of clad modified fiber optic gas sensor based CeO2/MWCNTs hybrid sensors by facile hydrothermal technique, Diam. Relat. Mater. 109 (2020) 108006. [38] X. Liu X. Jiang B. Sun Y. Song J. Ji F. Wang J. Nanosci. Nanotechnol. 18 2018 6971 6977 X. Liu, X. Jiang, B. Sun, Y. Song, J. Ji, F. Wang, High Efficiency CeO2/CNTs Modified Pt/CNTs Catalysts for Electrochemical Oxidation of Methanol, J. Nanosci. Nanotechnol. 18 (2018) 6971-6977. [39] S. Peng X. Yang J. Strong B. Sarkar Q. Jiang F. Peng D. Liu H. Wang J. Hazard. Mater. 2020 122750 S. Peng, X. Yang, J. Strong, B. Sarkar, Q. Jiang, F. Peng, D. Liu, H. Wang, MnO2-decorated N-doped carbon nanotube with boosted activity for low-temperature oxidation of formaldehyde, J. Hazard. Mater. (2020) 122750. [40] K.C. Chanapattharapol S. Krachuamram A. Makdee P. Unwiset S. Srikwanjai J. Rare Earths 35 2017 1197 1205 K.C. Chanapattharapol, S. Krachuamram, A. Makdee, P. Unwiset, S. Srikwanjai, Preparation and characterization of Ce1− xPrxO2 supports and their catalytic activities, J. Rare Earths, 35 (2017) 1197-1205. [41] J. Gaálová J. Barbier Jr S. Rossignol J. Hazard. Mater. 181 2010 633 639 J. Gaálová, J. Barbier Jr, S. Rossignol, Ruthenium versus platinum on cerium materials in wet air oxidation of acetic acid, J. Hazard. Mater. 181 (2010) 633-639. [42] H.B. Zhang G.D. Lin Y.Z. Yuan Chem. Inform. 37 2006 no-no H.B. Zhang, G.D. Lin, Y.Z. Yuan, Multiwalled carbon nanotubes as novel support or promoter of catalysts, ChemInform, 37 (2006) no-no. [43] Y. Cao B. Li G. Zhong Y. Li H. Wang H. Yu F. Peng Carbon 133 2018 464 473 Y. Cao, B. Li, G. Zhong, Y. Li, H. Wang, H. Yu, F. Peng, Catalytic wet air oxidation of phenol over carbon nanotubes: Synergistic effect of carboxyl groups and edge carbons, Carbon, 133 (2018) 464-473. [44] F. Ahmadpoor S.M. Zebarjad K. Janghorban Mater. Chem. Phys. 139 2013 113 117 F. Ahmadpoor, S.M. Zebarjad, K. Janghorban, Decoration of multi-walled carbon nanotubes with silver nanoparticles and investigation on its colloid stability, Mater. Chem. Phys. 139 (2013) 113-117. [45] J.-P. Tessonnier O. Ersen G. Weinberg C. Pham-Huu D.S. Su R. Schlogl ACS Nano 3 2009 2081 2089 J.-P. Tessonnier, O. Ersen, G. Weinberg, C. Pham-Huu, D.S. Su, R. Schlogl, Selective deposition of metal nanoparticles inside or outside multiwalled carbon nanotubes, ACS Nano, 3 (2009) 2081-2089. [46] Z. Jia Z. Wang J. Liang B. Wei D. Wu Carbon 37 1999 903 906 Z. Jia, Z. Wang, J. Liang, B. Wei, D. Wu, Production of short multi-walled carbon nanotubes, Carbon, 37 (1999) 903-906. [47] J. Al-Osaimi N. Alhosiny A. Badawi S. Abdallah Int. J. Eng. Technol. 13 2013 77 79 J. Al-Osaimi, N. Alhosiny, A. Badawi, S. Abdallah, The effects of CNTs types on the structural and electrical properties of CNTs/PMMA nanocomposite films, Int J Eng Technol, 13 (2013) 77-79. [48] G. Ovejero J. Sotelo M. Romero A. Rodríguez M. Ocana G. Rodríguez J. Garcia Ind. Eng. Chem. Res. 45 2006 2206 2212 G. Ovejero, J. Sotelo, M. Romero, A. Rodríguez, M. Ocana, G. Rodríguez, J. Garcia, Multiwalled carbon nanotubes for liquid-phase oxidation. Functionalization, characterization, and catalytic activity, Ind. Eng. Chem. Res. 45 (2006) 2206-2212. [49] C. Yuan B. Gao L. Shen S. Yang L. Hao X. Lu F. Zhang L. Zhang X. Zhang Nanoscale 3 2011 529 545 C. Yuan, B. Gao, L. Shen, S. Yang, L. Hao, X. Lu, F. Zhang, L. Zhang, X. Zhang, Hierarchically structured carbon-based composites: Design, synthesis and their application in electrochemical capacitors, Nanoscale, 3 (2011) 529-545. [50] P.R. Ettireddy N. Ettireddy S. Mamedov P. Boolchand P.G. Smirniotis Appl. Catal. B Environ. 76 2007 123 134 P.R. Ettireddy, N. Ettireddy, S. Mamedov, P. Boolchand, P.G. Smirniotis, Surface characterization studies of TiO2 supported manganese oxide catalysts for low temperature SCR of NO with NH3, Appl. Catal. B Environ. 76 (2007) 123-134. [51] H. Jiang S. Ge Y. Zhang M. Liu J. Zhang J. Lin M. Dong J. Wang Z. Guo Phys. Chem. Chem. Phys. 22 2020 23743 23753 H. Jiang, S. Ge, Y. Zhang, M. Liu, J. Zhang, J. Lin, M. Dong, J. Wang, Z. Guo, One-pot microwave-hydrothermally synthesized carbon nanotube-cerium oxide nanocomposites for enhanced visible photodegradation of acid orange 7, Phys. Chem. Chem. Phys. 22 (2020) 23743-23753. [52] M. Soria-Sánchez A. Maroto-Valiente J. Álvarez-Rodríguez V. Muñoz-Andrés I. Rodríguez-Ramos A. Guerrero-Ruíz Appl. Catal. B Environ. 104 2011 101 109 M. Soria-Sánchez, A. Maroto-Valiente, J. Álvarez-Rodríguez, V. Muñoz-Andrés, I. Rodríguez-Ramos, A. Guerrero-Ruíz, Carbon nanostrutured materials as direct catalysts for phenol oxidation in aqueous phase, Appl. Catal. B Environ. 104 (2011) 101-109. [53] L. Stobinski B. Lesiak L. Kövér J. Tóth S. Biniak G. Trykowski J. Judek J. Alloys. Compd. 501 2010 77 84 L. Stobinski, B. Lesiak, L. Kövér, J. Tóth, S. Biniak, G. Trykowski, J. Judek, Multiwall carbon nanotubes purification and oxidation by nitric acid studied by the FTIR and electron spectroscopy methods, J. Alloys Compd. 501 (2010) 77-84. [54] S. Yang X. Li W. Zhu J. Wang C. Descorme Carbon 46 2008 445 452 S. Yang, X. Li, W. Zhu, J. Wang, C. Descorme, Catalytic activity, stability and structure of multi-walled carbon nanotubes in the wet air oxidation of phenol, Carbon, 46 (2008) 445-452. [55] W. Shi A.-H. Park H.-U. Park Y.-U. Kwon J. Catal. 384 2020 22 29 W. Shi, A.-H. Park, H.-U. Park, Y.-U. Kwon, Enhancing activity and durability of Pd nanoparticle electrocatalyst by ceria undercoating on carbon support, J. Catal. 384 (2020) 22-29. [56] Y. Li J. Ding J. Chen C. Xu B. Wei J. Liang D. Wu Mater. Res. Bull. 37 2002 313 318 Y. Li, J. Ding, J. Chen, C. Xu, B. Wei, J. Liang, D. Wu, Preparation of ceria nanoparticles supported on carbon nanotubes, Mater. Res. Bull., 37 (2002) 313-318. [57] Z. Zhang C. Hu Y. Xiong C. Xia F. Li X. Wang J. Wuhan Univ. Technol. Sci Ed 24 2009 34 37 Z. Zhang, C. Hu, Y. Xiong, C. Xia, F. Li, X. Wang, Direct synthesis and spectrum analysis of CeO2 nanoparticles deposited on carbon nanotubes, Journal of Wuhan University of Technology-Mater. Sci. Ed., 24 (2009) 34-37. [58] X. Gao X.-s. Du L.-w. Cui Y.-c. Fu Z.-y. Luo K.-f. Cen Catal. Commun. 12 2010 255 258 X. Gao, X.-s. Du, L.-w. Cui, Y.-c. Fu, Z.-y. Luo, K.-f. Cen, A Ce–Cu–Ti oxide catalyst for the selective catalytic reduction of NO with NH3, Catal. Commun. 12 (2010) 255-258. [59] I.-P. Chen S.-S. Lin C.-H. Wang L. Chang J.-S. Chang Appl. Catal. B Environ. 50 2004 49 58 I.-P. Chen, S.-S. Lin, C.-H. Wang, L. Chang, J.-S. Chang, Preparing and characterizing an optimal supported ceria catalyst for the catalytic wet air oxidation of phenol, Appl. Catal. B Environ. 50 (2004) 49-58. [60] H. Yao Y.Y. Yao J. Catal. 86 1984 254 265 H. Yao, Y.Y. Yao, Ceria in automotive exhaust catalysts: I. Oxygen storage, J. Catal. 86 (1984) 254-265. [61] A. Katsaounis Z. Nikopoulou X. Verykios C. Vayenas J. Catal. 226 2004 197 209 A. Katsaounis, Z. Nikopoulou, X. Verykios, C. Vayenas, Comparative isotope-aided investigation of electrochemical promotion and metal–support interactions: 2. CO oxidation by 18O2 on electropromoted Pt films deposited on YSZ and on nanodispersed Pt/YSZ catalysts, J. Catal. 226 (2004) 197-209. [62] J. Luo W. Chu H. Xu C. Jiang T. Zhang J. Nat. Gas Chem. 19 2010 355 361 J. Luo, W. Chu, H. Xu, C. Jiang, T. Zhang, Low-temperature CO oxidation over CuO-CeO2/SiO2 catalysts: Effect of CeO2 content and carrier porosity, J. Nat. Gas Chem. 19 (2010) 355-361. [63] W. Xiaodong Y. Haining W. Duan L. Shuang F. Jun J. Rare Earths 31 2013 1141 1147 W. Xiaodong, Y. Haining, W. Duan, L. Shuang, F. Jun, Synergistic effect between MnO and CeO2 in the physical mixture: Electronic interaction and NO oxidation activity, J. Rare Earths, 31 (2013) 1141-1147. [64] J. Wang J. Li C. Jiang P. Zhou P. Zhang J. Yu Appl. Catal. B Environ. 204 2017 147 155 J. Wang, J. Li, C. Jiang, P. Zhou, P. Zhang, J. Yu, The effect of manganese vacancy in birnessite-type MnO2 on room-temperature oxidation of formaldehyde in air, Appl. Catal. B Environ. 204 (2017) 147-155. [65] B. Pandit B.R. Sankapal P.M. Koinkar Sci. Reports (Nature Publ. Group) 9 2019 1 13 B. Pandit, B.R. Sankapal, P.M. Koinkar, Novel chemical route for CeO2/MWCNTs composite towards highly bendable solid-state supercapacitor device, Sci. Reports (Nature Publ. Group) 9 (2019) 1-13. [66] X. Ye W. Zhong M. Xu X. Qi C. Au Y. Du Phys. Lett. 373 2009 3684 3687 X. Ye, W. Zhong, M. Xu, X. Qi, C. Au, Y. Du, The magnetic property of carbon-doped TiO2, Phys. Lett. 373 (2009) 3684-3687.",
      "scopus-id": "85105832970",
      "coredata": {
        "eid": "1-s2.0-S0926860X21001861",
        "dc:description": "In this study, we propose a simple strategy to prepare a noble-metal free catalyst, i.e., CeO2 supported on multi-wall carbon nanotube (CNTs). CNTs are treated by acid before the loading of CeO2, which is vital to the performance of catalysts. CeO2 on treated CNTs (CNTs-M) presents much higher TOC conversion and stability when compared with CeO2 on raw CNTs (CNTs-Raw). Kinetic study indicates that acid treatment greatly decreases the activation of the DMF oxidation. To investigate these phenomena, detailed characterizations are performed. We found that the acid treatment generated surface functional groups on CNTs which leads to the strong interaction between CNTs and CeO2. As a result, CeO2 on CNTs-M obtained better dispersion and higher amount of surface oxygen, which accounts for its superior performance.",
        "openArchiveArticle": "false",
        "prism:coverDate": "2021-06-25",
        "openaccessUserLicense": null,
        "prism:aggregationType": "Journal",
        "prism:url": "https://api.elsevier.com/content/article/pii/S0926860X21001861",
        "dc:creator": [
          {
            "@_fa": "true",
            "$": "Ali, Sajid"
          },
          {
            "@_fa": "true",
            "$": "Xiong, Wenting"
          },
          {
            "@_fa": "true",
            "$": "Liao, Zefeng"
          },
          {
            "@_fa": "true",
            "$": "Aslam, Muhammad Junaid"
          },
          {
            "@_fa": "true",
            "$": "Zhou, Chenhong"
          },
          {
            "@_fa": "true",
            "$": "Seong, Kim Kek"
          },
          {
            "@_fa": "true",
            "$": "Zhang, Peipei"
          },
          {
            "@_fa": "true",
            "$": "Zhang, Nuowei"
          },
          {
            "@_fa": "true",
            "$": "Zheng, Jingbao"
          },
          {
            "@_fa": "true",
            "$": "Fu, Jile"
          },
          {
            "@_fa": "true",
            "$": "Chen, Binghui"
          }
        ],
        "link": [
          {
            "@_fa": "true",
            "@rel": "self",
            "@href": "https://api.elsevier.com/content/article/pii/S0926860X21001861"
          },
          {
            "@_fa": "true",
            "@rel": "scidir",
            "@href": "https://www.sciencedirect.com/science/article/pii/S0926860X21001861"
          }
        ],
        "dc:format": "application/json",
        "openaccessType": null,
        "pii": "S0926-860X(21)00186-1",
        "prism:volume": "620",
        "articleNumber": "118172",
        "prism:publisher": "Published by Elsevier B.V.",
        "dc:title": "Noble metal free catalyst with High activity and stability for catalytic wet air oxidation of N, N-dimethylformamide",
        "prism:copyright": "© 2021 Published by Elsevier B.V.",
        "openaccess": "0",
        "prism:issn": "0926860X",
        "dcterms:subject": [
          {
            "@_fa": "true",
            "$": "DMF"
          },
          {
            "@_fa": "true",
            "$": "Active oxygen"
          },
          {
            "@_fa": "true",
            "$": "Selective deposition"
          },
          {
            "@_fa": "true",
            "$": "CeO2"
          },
          {
            "@_fa": "true",
            "$": "Carbon nanotubes"
          }
        ],
        "openaccessArticle": "false",
        "prism:publicationName": "Applied Catalysis A: General",
        "openaccessSponsorType": null,
        "prism:pageRange": "118172",
        "pubType": "fla",
        "prism:coverDisplayDate": "25 June 2021",
        "prism:doi": "10.1016/j.apcata.2021.118172",
        "prism:startingPage": "118172",
        "dc:identifier": "doi:10.1016/j.apcata.2021.118172",
        "openaccessSponsorName": null
      },
      "objects": {
        "object": [
          {
            "@category": "standard",
            "@height": "276",
            "@width": "567",
            "@_fa": "true",
            "$": "https://api.elsevier.com/content/object/eid/1-s2.0-S0926860X21001861-gr5.jpg?httpAccept=%2A%2F%2A",
            "@multimediatype": "JPEG image file",
            "@type": "IMAGE-DOWNSAMPLED",
            "@size": "52892",
            "@ref": "gr5",
            "@mimetype": "image/jpeg"
          },
          {
            "@category": "standard",
            "@height": "243",
            "@width": "341",
            "@_fa": "true",
            "$": "https://api.elsevier.com/content/object/eid/1-s2.0-S0926860X21001861-gr4.jpg?httpAccept=%2A%2F%2A",
            "@multimediatype": "JPEG image file",
            "@type": "IMAGE-DOWNSAMPLED",
            "@size": "27753",
            "@ref": "gr4",
            "@mimetype": "image/jpeg"
          },
          {
            "@category": "standard",
            "@height": "722",
            "@width": "680",
            "@_fa": "true",
            "$": "https://api.elsevier.com/content/object/eid/1-s2.0-S0926860X21001861-gr3.jpg?httpAccept=%2A%2F%2A",
            "@multimediatype": "JPEG image file",
            "@type": "IMAGE-DOWNSAMPLED",
            "@size": "147613",
            "@ref": "gr3",
            "@mimetype": "image/jpeg"
          },
          {
            "@category": "standard",
            "@height": "202",
            "@width": "567",
            "@_fa": "true",
            "$": "https://api.elsevier.com/content/object/eid/1-s2.0-S0926860X21001861-gr2.jpg?httpAccept=%2A%2F%2A",
            "@multimediatype": "JPEG image file",
            "@type": "IMAGE-DOWNSAMPLED",
            "@size": "29270",
            "@ref": "gr2",
            "@mimetype": "image/jpeg"
          },
          {
            "@category": "standard",
            "@height": "160",
            "@width": "500",
            "@_fa": "true",
            "$": "https://api.elsevier.com/content/object/eid/1-s2.0-S0926860X21001861-ga1.jpg?httpAccept=%2A%2F%2A",
            "@multimediatype": "JPEG image file",
            "@type": "IMAGE-DOWNSAMPLED",
            "@size": "28326",
            "@ref": "ga1",
            "@mimetype": "image/jpeg"
          },
          {
            "@category": "standard",
            "@height": "294",
            "@width": "341",
            "@_fa": "true",
            "$": "https://api.elsevier.com/content/object/eid/1-s2.0-S0926860X21001861-gr1.jpg?httpAccept=%2A%2F%2A",
            "@multimediatype": "JPEG image file",
            "@type": "IMAGE-DOWNSAMPLED",
            "@size": "29747",
            "@ref": "gr1",
            "@mimetype": "image/jpeg"
          },
          {
            "@category": "standard",
            "@height": "302",
            "@width": "341",
            "@_fa": "true",
            "$": "https://api.elsevier.com/content/object/eid/1-s2.0-S0926860X21001861-gr9.jpg?httpAccept=%2A%2F%2A",
            "@multimediatype": "JPEG image file",
            "@type": "IMAGE-DOWNSAMPLED",
            "@size": "24571",
            "@ref": "gr9",
            "@mimetype": "image/jpeg"
          },
          {
            "@category": "standard",
            "@height": "223",
            "@width": "567",
            "@_fa": "true",
            "$": "https://api.elsevier.com/content/object/eid/1-s2.0-S0926860X21001861-gr8.jpg?httpAccept=%2A%2F%2A",
            "@multimediatype": "JPEG image file",
            "@type": "IMAGE-DOWNSAMPLED",
            "@size": "29148",
            "@ref": "gr8",
            "@mimetype": "image/jpeg"
          },
          {
            "@category": "standard",
            "@height": "672",
            "@width": "680",
            "@_fa": "true",
            "$": "https://api.elsevier.com/content/object/eid/1-s2.0-S0926860X21001861-gr7.jpg?httpAccept=%2A%2F%2A",
            "@multimediatype": "JPEG image file",
            "@type": "IMAGE-DOWNSAMPLED",
            "@size": "89179",
            "@ref": "gr7",
            "@mimetype": "image/jpeg"
          },
          {
            "@category": "standard",
            "@height": "260",
            "@width": "567",
            "@_fa": "true",
            "$": "https://api.elsevier.com/content/object/eid/1-s2.0-S0926860X21001861-gr6.jpg?httpAccept=%2A%2F%2A",
            "@multimediatype": "JPEG image file",
            "@type": "IMAGE-DOWNSAMPLED",
            "@size": "41247",
            "@ref": "gr6",
            "@mimetype": "image/jpeg"
          },
          {
            "@category": "thumbnail",
            "@height": "106",
            "@width": "219",
            "@_fa": "true",
            "$": "https://api.elsevier.com/content/object/eid/1-s2.0-S0926860X21001861-gr5.sml?httpAccept=%2A%2F%2A",
            "@multimediatype": "GIF image file",
            "@type": "IMAGE-THUMBNAIL",
            "@size": "10092",
            "@ref": "gr5",
            "@mimetype": "image/gif"
          },
          {
            "@category": "thumbnail",
            "@height": "156",
            "@width": "219",
            "@_fa": "true",
            "$": "https://api.elsevier.com/content/object/eid/1-s2.0-S0926860X21001861-gr4.sml?httpAccept=%2A%2F%2A",
            "@multimediatype": "GIF image file",
            "@type": "IMAGE-THUMBNAIL",
            "@size": "11273",
            "@ref": "gr4",
            "@mimetype": "image/gif"
          },
          {
            "@category": "thumbnail",
            "@height": "164",
            "@width": "154",
            "@_fa": "true",
            "$": "https://api.elsevier.com/content/object/eid/1-s2.0-S0926860X21001861-gr3.sml?httpAccept=%2A%2F%2A",
            "@multimediatype": "GIF image file",
            "@type": "IMAGE-THUMBNAIL",
            "@size": "13951",
            "@ref": "gr3",
            "@mimetype": "image/gif"
          },
          {
            "@category": "thumbnail",
            "@height": "78",
            "@width": "219",
            "@_fa": "true",
            "$": "https://api.elsevier.com/content/object/eid/1-s2.0-S0926860X21001861-gr2.sml?httpAccept=%2A%2F%2A",
            "@multimediatype": "GIF image file",
            "@type": "IMAGE-THUMBNAIL",
            "@size": "10456",
            "@ref": "gr2",
            "@mimetype": "image/gif"
          },
          {
            "@category": "thumbnail",
            "@height": "70",
            "@width": "219",
            "@_fa": "true",
            "$": "https://api.elsevier.com/content/object/eid/1-s2.0-S0926860X21001861-ga1.sml?httpAccept=%2A%2F%2A",
            "@multimediatype": "GIF image file",
            "@type": "IMAGE-THUMBNAIL",
            "@size": "8098",
            "@ref": "ga1",
            "@mimetype": "image/gif"
          },
          {
            "@category": "thumbnail",
            "@height": "164",
            "@width": "190",
            "@_fa": "true",
            "$": "https://api.elsevier.com/content/object/eid/1-s2.0-S0926860X21001861-gr1.sml?httpAccept=%2A%2F%2A",
            "@multimediatype": "GIF image file",
            "@type": "IMAGE-THUMBNAIL",
            "@size": "9479",
            "@ref": "gr1",
            "@mimetype": "image/gif"
          },
          {
            "@category": "thumbnail",
            "@height": "164",
            "@width": "185",
            "@_fa": "true",
            "$": "https://api.elsevier.com/content/object/eid/1-s2.0-S0926860X21001861-gr9.sml?httpAccept=%2A%2F%2A",
            "@multimediatype": "GIF image file",
            "@type": "IMAGE-THUMBNAIL",
            "@size": "7797",
            "@ref": "gr9",
            "@mimetype": "image/gif"
          },
          {
            "@category": "thumbnail",
            "@height": "86",
            "@width": "219",
            "@_fa": "true",
            "$": "https://api.elsevier.com/content/object/eid/1-s2.0-S0926860X21001861-gr8.sml?httpAccept=%2A%2F%2A",
            "@multimediatype": "GIF image file",
            "@type": "IMAGE-THUMBNAIL",
            "@size": "5606",
            "@ref": "gr8",
            "@mimetype": "image/gif"
          },
          {
            "@category": "thumbnail",
            "@height": "164",
            "@width": "166",
            "@_fa": "true",
            "$": "https://api.elsevier.com/content/object/eid/1-s2.0-S0926860X21001861-gr7.sml?httpAccept=%2A%2F%2A",
            "@multimediatype": "GIF image file",
            "@type": "IMAGE-THUMBNAIL",
            "@size": "9353",
            "@ref": "gr7",
            "@mimetype": "image/gif"
          },
          {
            "@category": "thumbnail",
            "@height": "100",
            "@width": "219",
            "@_fa": "true",
            "$": "https://api.elsevier.com/content/object/eid/1-s2.0-S0926860X21001861-gr6.sml?httpAccept=%2A%2F%2A",
            "@multimediatype": "GIF image file",
            "@type": "IMAGE-THUMBNAIL",
            "@size": "8092",
            "@ref": "gr6",
            "@mimetype": "image/gif"
          },
          {
            "@category": "high",
            "@height": "1220",
            "@width": "2510",
            "@_fa": "true",
            "$": "https://api.elsevier.com/content/object/eid/1-s2.0-S0926860X21001861-gr5_lrg.jpg?httpAccept=%2A%2F%2A",
            "@multimediatype": "JPEG image file",
            "@type": "IMAGE-HIGH-RES",
            "@size": "392207",
            "@ref": "gr5",
            "@mimetype": "image/jpeg"
          },
          {
            "@category": "high",
            "@height": "1077",
            "@width": "1510",
            "@_fa": "true",
            "$": "https://api.elsevier.com/content/object/eid/1-s2.0-S0926860X21001861-gr4_lrg.jpg?httpAccept=%2A%2F%2A",
            "@multimediatype": "JPEG image file",
            "@type": "IMAGE-HIGH-RES",
            "@size": "365498",
            "@ref": "gr4",
            "@mimetype": "image/jpeg"
          },
          {
            "@category": "high",
            "@height": "3197",
            "@width": "3010",
            "@_fa": "true",
            "$": "https://api.elsevier.com/content/object/eid/1-s2.0-S0926860X21001861-gr3_lrg.jpg?httpAccept=%2A%2F%2A",
            "@multimediatype": "JPEG image file",
            "@type": "IMAGE-HIGH-RES",
            "@size": "1389130",
            "@ref": "gr3",
            "@mimetype": "image/jpeg"
          },
          {
            "@category": "high",
            "@height": "895",
            "@width": "2510",
            "@_fa": "true",
            "$": "https://api.elsevier.com/content/object/eid/1-s2.0-S0926860X21001861-gr2_lrg.jpg?httpAccept=%2A%2F%2A",
            "@multimediatype": "JPEG image file",
            "@type": "IMAGE-HIGH-RES",
            "@size": "413252",
            "@ref": "gr2",
            "@mimetype": "image/jpeg"
          },
          {
            "@category": "high",
            "@height": "707",
            "@width": "2213",
            "@_fa": "true",
            "$": "https://api.elsevier.com/content/object/eid/1-s2.0-S0926860X21001861-ga1_lrg.jpg?httpAccept=%2A%2F%2A",
            "@multimediatype": "JPEG image file",
            "@type": "IMAGE-HIGH-RES",
            "@size": "248108",
            "@ref": "ga1",
            "@mimetype": "image/jpeg"
          },
          {
            "@category": "high",
            "@height": "1304",
            "@width": "1510",
            "@_fa": "true",
            "$": "https://api.elsevier.com/content/object/eid/1-s2.0-S0926860X21001861-gr1_lrg.jpg?httpAccept=%2A%2F%2A",
            "@multimediatype": "JPEG image file",
            "@type": "IMAGE-HIGH-RES",
            "@size": "243649",
            "@ref": "gr1",
            "@mimetype": "image/jpeg"
          },
          {
            "@category": "high",
            "@height": "1337",
            "@width": "1510",
            "@_fa": "true",
            "$": "https://api.elsevier.com/content/object/eid/1-s2.0-S0926860X21001861-gr9_lrg.jpg?httpAccept=%2A%2F%2A",
            "@multimediatype": "JPEG image file",
            "@type": "IMAGE-HIGH-RES",
            "@size": "388857",
            "@ref": "gr9",
            "@mimetype": "image/jpeg"
          },
          {
            "@category": "high",
            "@height": "988",
            "@width": "2510",
            "@_fa": "true",
            "$": "https://api.elsevier.com/content/object/eid/1-s2.0-S0926860X21001861-gr8_lrg.jpg?httpAccept=%2A%2F%2A",
            "@multimediatype": "JPEG image file",
            "@type": "IMAGE-HIGH-RES",
            "@size": "204957",
            "@ref": "gr8",
            "@mimetype": "image/jpeg"
          },
          {
            "@category": "high",
            "@height": "2973",
            "@width": "3010",
            "@_fa": "true",
            "$": "https://api.elsevier.com/content/object/eid/1-s2.0-S0926860X21001861-gr7_lrg.jpg?httpAccept=%2A%2F%2A",
            "@multimediatype": "JPEG image file",
            "@type": "IMAGE-HIGH-RES",
            "@size": "683924",
            "@ref": "gr7",
            "@mimetype": "image/jpeg"
          },
          {
            "@category": "high",
            "@height": "1151",
            "@width": "2510",
            "@_fa": "true",
            "$": "https://api.elsevier.com/content/object/eid/1-s2.0-S0926860X21001861-gr6_lrg.jpg?httpAccept=%2A%2F%2A",
            "@multimediatype": "JPEG image file",
            "@type": "IMAGE-HIGH-RES",
            "@size": "298247",
            "@ref": "gr6",
            "@mimetype": "image/jpeg"
          },
          {
            "@category": "standard",
            "@_fa": "true",
            "$": "https://api.elsevier.com/content/object/eid/1-s2.0-S0926860X21001861-am.pdf?httpAccept=%2A%2F%2A",
            "@multimediatype": "Acrobat PDF file",
            "@type": "AAM-PDF",
            "@size": "2402592",
            "@ref": "am",
            "@mimetype": "application/pdf"
          }
        ]
      },
      "link": {
        "@rel": "abstract",
        "@href": "https://api.elsevier.com/content/abstract/scopus_id/85105832970"
      }
    }
  }
}