{
  "metadata": {
    "title": "CO<ce:inf loc=post>2</ce:inf> fixation reaction over pyrimidinium-based dicationic ionic liquid in MIL-101(Cr)",
    "authors": "; ; ",
    "journal": "Applied Catalysis A: General",
    "date": "2025-05-05",
    "doi": "10.1016/j.apcata.2025.120186",
    "abstract": "",
    "uri": "https://api.elsevier.com/content/article/pii/S0926860X25000870",
    "pii": "S0926860X25000870"
  },
  "fulltext": {
    "full-text-retrieval-response": {
      "scopus-eid": "2-s2.0-85219690087",
      "originalText": "serial JL 271346 291210 291744 291809 31 90 Applied Catalysis A: General APPLIEDCATALYSISAGENERAL 2025-02-24 2025-02-24 2025-03-07 2025-03-07 2025-03-26T08:53:07 1-s2.0-S0926860X25000870 S0926-860X(25)00087-0 S0926860X25000870 10.1016/j.apcata.2025.120186 S300 S300.1 FULL-TEXT 1-s2.0-S0926860X25X00053 2025-03-26T09:54:55.967542Z 0 0 20250505 2025 2025-02-25T00:36:49.192501Z absattachment articleinfo articlenumber articletitlenorm authfirstinitialnorm authfirstsurnamenorm cid cids contenttype copyright crossmark dateloaded dateloadedtxt datesearch datesort dateupdated dco docsubtype doctype doi eid ewtransactionid fundingbodyid hubeid indexeddate issn issnnorm itemstage itemtransactionid itemweight oauserlicense openaccess openarchive pg pgfirst pii piinorm pubdatestart pubdatetxt pubyr sortorder sponsoredaccesstype srctitle srctitlenorm srctype ssids alllist content oa subj subheadings suppl tomb volfirst volissue volumelist webpdf webpdfpagecount yearnav figure table e-component body acknowledge affil appendices articletitle auth authfirstini authfull authkeywords authlast grantsponsor highlightsabst primabst ref specialabst 0926-860X 0926860X UNLIMITED CRKNHY2024 true 697 697 C Volume 697 3 120186 120186 120186 20250505 5 May 2025 2025-05-05 2025 article fla © 2025 The Author(s). Published by Elsevier B.V. CO2FIXATIONREACTIONOVERPYRIMIDINIUMBASEDDICATIONICIONICLIQUIDINMIL101CR MASOOMNATAJ S 1 Introduction 2 Experimental section 2.1 Materials and instrumentation 2.2 Synthesis of catalysts 2.2.1 Synthesis of MIL-101(Cr) 2.2.2 Synthesis method of MIL101-2AMP-DBrP and MIL101-2AMP-DBrEE 2.2.3 Synthesis of quaternary bromide salts 2.2.3.1 1,5-Bis(2-aminopyrimidinium)pentane bromide (2AMP-DBrP) 2.2.3.2 1,5-Bis(2-aminopyrimidinium)ethyl ether bromide (2AMP-DBrEE) 2.3 General procedure of CO2 fixation with epoxides 3 Results and discussion 3.1 Material synthesis and characterization 3.2 Catalytic performance 3.3 Reusability of the MIL101-2AMP-DBrEE 3.4 Possible reaction mechanism 4 Conclusion CRediT authorship contribution statement Acknowledgement Appendix A Supplementary material References ARESTA 2014 1709 1742 M CENTI 2013 1711 1731 G HU 2016 382 385 J HU 2015 5489 5493 J WESSELBAUM 2015 693 704 S GOEPPERT 2014 7995 8048 A ARTZ 2018 434 504 J SONG 2015 821 827 Q WANG 2015 282 287 M LANG 2016 1337 1352 X XUAN 2020 2546 2556 J LYNCH 2021 J NORTH 2010 1514 1539 M LIU 2016 8959 8966 Y RAZAVI 2019 213023 S SHARIFZADEH 2023 8661 8678 Z FEREY 2005 2040 2042 C ZORAINY 2021 22159 22217 M LI 2019 1964 1988 L ZADEHAHMADI 2015 1 10 F KARDANPOUR 2015 262 272 R MIRALDA 2012 180 183 C CHO 2012 35 40 H ANSARI 2019 9723 9732 S JI 2018 1768 1771 X THARUN 2016 2479 2487 J DING 2017 2337 2344 L SUN 2018 27124 27130 Y SHARIFZADEH 2023 101971 Z DHARMAN 2011 544 547 M ZAKHAROVA 2017 1886 1890 M BOROUN 2021 27019 27028 S SUN 2012 654 660 J WANG 2020 109751 Y ZHENG 2009 X HAN 2012 67 72 L LIU 2022 17438 17447 Y LIU 2021 Y WANG 2018 2574 2582 T WANG 2022 1327 1339 T ZHOU 2008 52 57 Y LI 2004 8307 8310 F SUN 2011 502 507 J SUN 2008 3588 3591 J ROSHAN 2012 2933 2940 K MASOOMNATAJ 2023 e202300079 S NATAJ 2023 114216 S TAHERIMEHR 2017 1283 1291 M MA 2015 23136 23142 D LIU 2023 214921 X LIU 2022 44 48 X JAHANBANI 2022 M CREATINGCO2CAPTURERECOVERYVALORIZATIONPROCESSESWHILEAVOIDINGENVIRONMENTALBURDENSHIFTINGHOWINTEGRATELIFECYCLEANALYSISINITIALPROCESSDESIGNPHASE LI 2023 X XIA 2022 437 447 X YOO 2018 319 325 D SCHILTER 2010 239 247 D ZOU 2022 9396 M MAKSIMCHUK 2012 2017 2034 N HONG 2009 1537 1552 D QUAN 2019 5384 5396 X HWANG 2008 4212 4216 Y ROSTAMNIA 2018 e4370 S FANG 2017 51 57 Y LENG 2016 1168 1171 K ZHONG 2018 16493 16502 R CHEN 2020 G BARDESTANI 2019 2781 2791 R LIN 2013 Y CHOWDHURY 2009 6616 6621 P LIU 2007 4005 4010 Y ZHANG 2022 705 713 X ALIEV 2016 5306 5312 S JIANG 2021 3689 3698 Y ZHOU 2019 2202 2210 L DING 2018 3194 3201 M LIANG 2018 342 345 J JI 2020 24868 24876 H LIANG 2018 2584 2593 J LIANG 2017 1570 1575 J FOLTRAN 2013 1046 1055 S ZOU 2021 M GUO 2020 9935 9947 F MASOOMNATAJX2025X120186 MASOOMNATAJX2025X120186XS Full 2025-02-24T12:54:43Z ElsevierWaived CRKN 2024: Hybrid journals http://creativecommons.org/licenses/by-nc-nd/4.0/ 2027-03-07T00:00:00.000Z 2027-03-07T00:00:00.000Z http://creativecommons.org/licenses/by-nc-nd/4.0/ This is an open access article under the CC BY-NC-ND license. © 2025 The Author(s). Published by Elsevier B.V. 2025-03-09T03:02:18.407Z http://vtw.elsevier.com/data/voc/AddOnTypes/50.7/aggregated-refined Natural Science and Engineering Council Canada Research Chair in Green Catalysis and Metal-Free Processes MIL-101 MIL101\\u20132AMP-DBrP MIL101\\u20132AMP-DBrEE Consortium de Recherche en Biotechnologie Industrielle du Québec Centre for Innovation and Research on Carbon Utilization in Industrial Technologies Natural Sciences and Engineering Research Council of Canada http://data.elsevier.com/vocabulary/SciValFunders/501100000038 http://sws.geonames.org/6251999 The authors acknowledge the joint financial support of Natural Science and Engineering Council (NSERC), Consortium de Recherche en Biotechnologie Industrielle du Qu\\u00E9bec (CRIBIQ) and SOPREMA (Drummondville). The Centre for Innovation and Research on Carbon Utilization in Industrial Technologies (CIRCUIT) is also acknowledged. We also acknowledge the support of the Canada Research Chair in Green Catalysis and Metal-Free Processes. The Supporting Information is attached to this manuscript. It contains the EDS spectra of synthesized MIL-101(Cr), MIL101\\u20132AMP-DBrP and MIL101\\u20132AMP-DBrEE, and 1H NMR analysis of CO2 fixation reaction with different epoxides. item S0926-860X(25)00087-0 S0926860X25000870 1-s2.0-S0926860X25000870 10.1016/j.apcata.2025.120186 271346 2025-03-26T09:54:55.967542Z 2025-05-05 UNLIMITED CRKNHY2024 1-s2.0-S0926860X25000870-main.pdf https://s3-eu-west-1.amazonaws.com/prod-ucs-content-store-eu-west/content/pii:S0926860X25000870/MAIN/application/pdf/ac6c4941b355c23c55789b106bd570ba/main.pdf main.pdf pdf true 7919537 MAIN 14 1-s2.0-S0926860X25000870-main_1.png https://s3-eu-west-1.amazonaws.com/prod-ucs-content-store-eu-west/content/pii:S0926860X25000870/PREVIEW/image/png/341ec377bc855c41bc509ffa31956c70/main_1.png main_1.png png 58299 849 656 IMAGE-WEB-PDF 1 1-s2.0-S0926860X25000870-fx10.jpg https://s3-eu-west-1.amazonaws.com/prod-ucs-content-store-eu-west/content/pii:S0926860X25000870/fx10/DOWNSAMPLED/image/jpeg/dfe3bf120f1feffc3e74df318a5ebaf7/fx10.jpg fx10 fx10.jpg jpg 1972 61 105 IMAGE-DOWNSAMPLED 1-s2.0-S0926860X25000870-fx11.jpg https://s3-eu-west-1.amazonaws.com/prod-ucs-content-store-eu-west/content/pii:S0926860X25000870/fx11/DOWNSAMPLED/image/jpeg/ee9c151ce0f6528bc636887153fde78a/fx11.jpg fx11 fx11.jpg jpg 2833 86 120 IMAGE-DOWNSAMPLED 1-s2.0-S0926860X25000870-ga1.jpg https://s3-eu-west-1.amazonaws.com/prod-ucs-content-store-eu-west/content/pii:S0926860X25000870/ga1/DOWNSAMPLED/image/jpeg/f7a0d22e8906add9e3160a8709cec8a4/ga1.jpg ga1 true ga1.jpg jpg 25457 200 348 IMAGE-DOWNSAMPLED 1-s2.0-S0926860X25000870-fx12.jpg https://s3-eu-west-1.amazonaws.com/prod-ucs-content-store-eu-west/content/pii:S0926860X25000870/fx12/DOWNSAMPLED/image/jpeg/21ac7632e229371ae98c79f2082d1639/fx12.jpg fx12 fx12.jpg jpg 1953 38 131 IMAGE-DOWNSAMPLED 1-s2.0-S0926860X25000870-fx13.jpg https://s3-eu-west-1.amazonaws.com/prod-ucs-content-store-eu-west/content/pii:S0926860X25000870/fx13/DOWNSAMPLED/image/jpeg/2fbae50a28c625ff53ac2dc5f4fddff5/fx13.jpg fx13 fx13.jpg jpg 2468 58 136 IMAGE-DOWNSAMPLED 1-s2.0-S0926860X25000870-fx14.jpg https://s3-eu-west-1.amazonaws.com/prod-ucs-content-store-eu-west/content/pii:S0926860X25000870/fx14/DOWNSAMPLED/image/jpeg/6288f0ac8c71b5f9001bcfa19c90ed23/fx14.jpg fx14 fx14.jpg jpg 1452 47 64 IMAGE-DOWNSAMPLED 1-s2.0-S0926860X25000870-fx15.jpg https://s3-eu-west-1.amazonaws.com/prod-ucs-content-store-eu-west/content/pii:S0926860X25000870/fx15/DOWNSAMPLED/image/jpeg/2ee1ef228b9138917798cbf366fbcef5/fx15.jpg fx15 fx15.jpg jpg 2196 48 101 IMAGE-DOWNSAMPLED 1-s2.0-S0926860X25000870-fx1.jpg https://s3-eu-west-1.amazonaws.com/prod-ucs-content-store-eu-west/content/pii:S0926860X25000870/fx1/DOWNSAMPLED/image/jpeg/e658486a327d884cc792c7382eee4fcd/fx1.jpg fx1 fx1.jpg jpg 9504 119 508 IMAGE-DOWNSAMPLED 1-s2.0-S0926860X25000870-fx7.jpg https://s3-eu-west-1.amazonaws.com/prod-ucs-content-store-eu-west/content/pii:S0926860X25000870/fx7/DOWNSAMPLED/image/jpeg/08ce820607239383ec39e6d61fd84e4f/fx7.jpg fx7 fx7.jpg jpg 2222 48 120 IMAGE-DOWNSAMPLED 1-s2.0-S0926860X25000870-fx6.jpg https://s3-eu-west-1.amazonaws.com/prod-ucs-content-store-eu-west/content/pii:S0926860X25000870/fx6/DOWNSAMPLED/image/jpeg/77c2e25e2e1a9025e1f83adb5265676f/fx6.jpg fx6 fx6.jpg jpg 1461 42 89 IMAGE-DOWNSAMPLED 1-s2.0-S0926860X25000870-fx9.jpg https://s3-eu-west-1.amazonaws.com/prod-ucs-content-store-eu-west/content/pii:S0926860X25000870/fx9/DOWNSAMPLED/image/jpeg/0858b98acfd0f18111092eadf8ebb0a3/fx9.jpg fx9 fx9.jpg jpg 2596 70 109 IMAGE-DOWNSAMPLED 1-s2.0-S0926860X25000870-gr2.jpg https://s3-eu-west-1.amazonaws.com/prod-ucs-content-store-eu-west/content/pii:S0926860X25000870/gr2/DOWNSAMPLED/image/jpeg/7c47a158b749124799429d69834f71ba/gr2.jpg gr2 gr2.jpg jpg 26244 313 376 IMAGE-DOWNSAMPLED 1-s2.0-S0926860X25000870-fx8.jpg https://s3-eu-west-1.amazonaws.com/prod-ucs-content-store-eu-west/content/pii:S0926860X25000870/fx8/DOWNSAMPLED/image/jpeg/c5813457416cdc115bd2f8ced9637e90/fx8.jpg fx8 fx8.jpg jpg 1757 60 78 IMAGE-DOWNSAMPLED 1-s2.0-S0926860X25000870-gr1.jpg https://s3-eu-west-1.amazonaws.com/prod-ucs-content-store-eu-west/content/pii:S0926860X25000870/gr1/DOWNSAMPLED/image/jpeg/716f6fa84412c71dbd7bc826e1a8e36c/gr1.jpg gr1 gr1.jpg jpg 58316 269 659 IMAGE-DOWNSAMPLED 1-s2.0-S0926860X25000870-fx3.jpg https://s3-eu-west-1.amazonaws.com/prod-ucs-content-store-eu-west/content/pii:S0926860X25000870/fx3/DOWNSAMPLED/image/jpeg/b69667dc967d685d55d16a7cbaadd652/fx3.jpg fx3 fx3.jpg jpg 1791 46 86 IMAGE-DOWNSAMPLED 1-s2.0-S0926860X25000870-sc1.jpg https://s3-eu-west-1.amazonaws.com/prod-ucs-content-store-eu-west/content/pii:S0926860X25000870/sc1/DOWNSAMPLED/image/jpeg/164162da2addde362d34c1e6f0ecee89/sc1.jpg sc1 sc1.jpg jpg 31293 245 376 IMAGE-DOWNSAMPLED 1-s2.0-S0926860X25000870-fx2.jpg https://s3-eu-west-1.amazonaws.com/prod-ucs-content-store-eu-west/content/pii:S0926860X25000870/fx2/DOWNSAMPLED/image/jpeg/1f6c2112e7075e076272d1efeba15d41/fx2.jpg fx2 fx2.jpg jpg 926 33 54 IMAGE-DOWNSAMPLED 1-s2.0-S0926860X25000870-fx5.jpg https://s3-eu-west-1.amazonaws.com/prod-ucs-content-store-eu-west/content/pii:S0926860X25000870/fx5/DOWNSAMPLED/image/jpeg/bc57478958b17fc5f538d1cb73e81de9/fx5.jpg fx5 fx5.jpg jpg 2127 45 111 IMAGE-DOWNSAMPLED 1-s2.0-S0926860X25000870-fx4.jpg https://s3-eu-west-1.amazonaws.com/prod-ucs-content-store-eu-west/content/pii:S0926860X25000870/fx4/DOWNSAMPLED/image/jpeg/9572fdbd359357cc727cdf00eed6cdd7/fx4.jpg fx4 fx4.jpg jpg 1451 40 84 IMAGE-DOWNSAMPLED 1-s2.0-S0926860X25000870-sc2.jpg https://s3-eu-west-1.amazonaws.com/prod-ucs-content-store-eu-west/content/pii:S0926860X25000870/sc2/DOWNSAMPLED/image/jpeg/dafc984fb7f7ffb5ff9249f1757fb39e/sc2.jpg sc2 sc2.jpg jpg 61312 572 659 IMAGE-DOWNSAMPLED 1-s2.0-S0926860X25000870-gr8.jpg https://s3-eu-west-1.amazonaws.com/prod-ucs-content-store-eu-west/content/pii:S0926860X25000870/gr8/DOWNSAMPLED/image/jpeg/e5dfa415e820649dfd45147d3f719f88/gr8.jpg gr8 gr8.jpg jpg 36654 279 659 IMAGE-DOWNSAMPLED 1-s2.0-S0926860X25000870-gr7.jpg https://s3-eu-west-1.amazonaws.com/prod-ucs-content-store-eu-west/content/pii:S0926860X25000870/gr7/DOWNSAMPLED/image/jpeg/2839720947be7ab14242b4b47feee489/gr7.jpg gr7 gr7.jpg jpg 43678 278 659 IMAGE-DOWNSAMPLED 1-s2.0-S0926860X25000870-gr10.jpg https://s3-eu-west-1.amazonaws.com/prod-ucs-content-store-eu-west/content/pii:S0926860X25000870/gr10/DOWNSAMPLED/image/jpeg/e64dc2d501ccebb7171caa029ff61141/gr10.jpg gr10 gr10.jpg jpg 86482 619 659 IMAGE-DOWNSAMPLED 1-s2.0-S0926860X25000870-gr9.jpg https://s3-eu-west-1.amazonaws.com/prod-ucs-content-store-eu-west/content/pii:S0926860X25000870/gr9/DOWNSAMPLED/image/jpeg/afe21192a07a22f75a7d959ba020033b/gr9.jpg gr9 gr9.jpg jpg 33411 276 659 IMAGE-DOWNSAMPLED 1-s2.0-S0926860X25000870-gr4.jpg https://s3-eu-west-1.amazonaws.com/prod-ucs-content-store-eu-west/content/pii:S0926860X25000870/gr4/DOWNSAMPLED/image/jpeg/884c92eb0d7575298ae452c0ca9ed70a/gr4.jpg gr4 gr4.jpg jpg 18208 285 376 IMAGE-DOWNSAMPLED 1-s2.0-S0926860X25000870-gr3.jpg https://s3-eu-west-1.amazonaws.com/prod-ucs-content-store-eu-west/content/pii:S0926860X25000870/gr3/DOWNSAMPLED/image/jpeg/82a7c11d11c88f1e5ca394dc515c3428/gr3.jpg gr3 gr3.jpg jpg 118380 830 659 IMAGE-DOWNSAMPLED 1-s2.0-S0926860X25000870-gr6.jpg https://s3-eu-west-1.amazonaws.com/prod-ucs-content-store-eu-west/content/pii:S0926860X25000870/gr6/DOWNSAMPLED/image/jpeg/a7ec7fb0984c33f221fd9f609278a7a5/gr6.jpg gr6 gr6.jpg jpg 42773 260 659 IMAGE-DOWNSAMPLED 1-s2.0-S0926860X25000870-gr5.jpg https://s3-eu-west-1.amazonaws.com/prod-ucs-content-store-eu-west/content/pii:S0926860X25000870/gr5/DOWNSAMPLED/image/jpeg/62be44dc604ec71374ff465c858acb64/gr5.jpg gr5 gr5.jpg jpg 135541 719 565 IMAGE-DOWNSAMPLED 1-s2.0-S0926860X25000870-fx10.sml https://s3-eu-west-1.amazonaws.com/prod-ucs-content-store-eu-west/content/pii:S0926860X25000870/fx10/THUMBNAIL/image/gif/6519a26923677497963702fd5622540f/fx10.sml fx10 fx10.sml sml 4396 128 219 IMAGE-THUMBNAIL 1-s2.0-S0926860X25000870-fx11.sml https://s3-eu-west-1.amazonaws.com/prod-ucs-content-store-eu-west/content/pii:S0926860X25000870/fx11/THUMBNAIL/image/gif/51b4826b6c3565bf16bfaf989330373a/fx11.sml fx11 fx11.sml sml 5570 157 219 IMAGE-THUMBNAIL 1-s2.0-S0926860X25000870-ga1.sml https://s3-eu-west-1.amazonaws.com/prod-ucs-content-store-eu-west/content/pii:S0926860X25000870/ga1/THUMBNAIL/image/gif/d3f7ca117fec85e7b87a6458a65bff6e/ga1.sml ga1 true ga1.sml sml 13220 126 219 IMAGE-THUMBNAIL 1-s2.0-S0926860X25000870-fx12.sml https://s3-eu-west-1.amazonaws.com/prod-ucs-content-store-eu-west/content/pii:S0926860X25000870/fx12/THUMBNAIL/image/gif/2868f9df36f2cbb88acab1a0c10dd406/fx12.sml fx12 fx12.sml sml 2902 64 219 IMAGE-THUMBNAIL 1-s2.0-S0926860X25000870-fx13.sml https://s3-eu-west-1.amazonaws.com/prod-ucs-content-store-eu-west/content/pii:S0926860X25000870/fx13/THUMBNAIL/image/gif/595150c7302e2aa7999062090c79b532/fx13.sml fx13 fx13.sml sml 4009 94 219 IMAGE-THUMBNAIL 1-s2.0-S0926860X25000870-fx14.sml https://s3-eu-west-1.amazonaws.com/prod-ucs-content-store-eu-west/content/pii:S0926860X25000870/fx14/THUMBNAIL/image/gif/dce202b7a3e920ae220fbaff0c59c619/fx14.sml fx14 fx14.sml sml 6200 161 219 IMAGE-THUMBNAIL 1-s2.0-S0926860X25000870-fx15.sml https://s3-eu-west-1.amazonaws.com/prod-ucs-content-store-eu-west/content/pii:S0926860X25000870/fx15/THUMBNAIL/image/gif/866bcb48b13712d3b8b8dfa1a306dc05/fx15.sml fx15 fx15.sml sml 5756 103 219 IMAGE-THUMBNAIL 1-s2.0-S0926860X25000870-fx1.sml https://s3-eu-west-1.amazonaws.com/prod-ucs-content-store-eu-west/content/pii:S0926860X25000870/fx1/THUMBNAIL/image/gif/3add4e86d38a1f4f841708bc883d1b7c/fx1.sml fx1 fx1.sml sml 1963 51 219 IMAGE-THUMBNAIL 1-s2.0-S0926860X25000870-fx7.sml https://s3-eu-west-1.amazonaws.com/prod-ucs-content-store-eu-west/content/pii:S0926860X25000870/fx7/THUMBNAIL/image/gif/ab694d2f4cebe72fbdfa58028ae48733/fx7.sml fx7 fx7.sml sml 4772 88 219 IMAGE-THUMBNAIL 1-s2.0-S0926860X25000870-fx6.sml https://s3-eu-west-1.amazonaws.com/prod-ucs-content-store-eu-west/content/pii:S0926860X25000870/fx6/THUMBNAIL/image/gif/1d8994e6093617db8bd850706e43dd3a/fx6.sml fx6 fx6.sml sml 3726 102 219 IMAGE-THUMBNAIL 1-s2.0-S0926860X25000870-fx9.sml https://s3-eu-west-1.amazonaws.com/prod-ucs-content-store-eu-west/content/pii:S0926860X25000870/fx9/THUMBNAIL/image/gif/d29ea6ad9aa25ff1937c78513eea4992/fx9.sml fx9 fx9.sml sml 5727 141 219 IMAGE-THUMBNAIL 1-s2.0-S0926860X25000870-gr2.sml https://s3-eu-west-1.amazonaws.com/prod-ucs-content-store-eu-west/content/pii:S0926860X25000870/gr2/THUMBNAIL/image/gif/05045a294822ae825c117e2dc7eb4cdb/gr2.sml gr2 gr2.sml sml 8773 164 197 IMAGE-THUMBNAIL 1-s2.0-S0926860X25000870-fx8.sml https://s3-eu-west-1.amazonaws.com/prod-ucs-content-store-eu-west/content/pii:S0926860X25000870/fx8/THUMBNAIL/image/gif/b8d2d442590d1453cfc9254ae2021fb2/fx8.sml fx8 fx8.sml sml 5404 164 214 IMAGE-THUMBNAIL 1-s2.0-S0926860X25000870-gr1.sml https://s3-eu-west-1.amazonaws.com/prod-ucs-content-store-eu-west/content/pii:S0926860X25000870/gr1/THUMBNAIL/image/gif/4af1cf4a227b459ec548a914b34fcc75/gr1.sml gr1 gr1.sml sml 8643 89 219 IMAGE-THUMBNAIL 1-s2.0-S0926860X25000870-fx3.sml https://s3-eu-west-1.amazonaws.com/prod-ucs-content-store-eu-west/content/pii:S0926860X25000870/fx3/THUMBNAIL/image/gif/85adb57ca141384f625d66f806708cba/fx3.sml fx3 fx3.sml sml 6103 118 219 IMAGE-THUMBNAIL 1-s2.0-S0926860X25000870-sc1.sml https://s3-eu-west-1.amazonaws.com/prod-ucs-content-store-eu-west/content/pii:S0926860X25000870/sc1/THUMBNAIL/image/gif/ecbf0cc0bf6928fc6dc48c7c066e165f/sc1.sml sc1 sc1.sml sml 15439 143 219 IMAGE-THUMBNAIL 1-s2.0-S0926860X25000870-fx2.sml https://s3-eu-west-1.amazonaws.com/prod-ucs-content-store-eu-west/content/pii:S0926860X25000870/fx2/THUMBNAIL/image/gif/a2a23f861d04ae22b13b26ba565d5e34/fx2.sml fx2 fx2.sml sml 5042 133 219 IMAGE-THUMBNAIL 1-s2.0-S0926860X25000870-fx5.sml https://s3-eu-west-1.amazonaws.com/prod-ucs-content-store-eu-west/content/pii:S0926860X25000870/fx5/THUMBNAIL/image/gif/650a9b5f67997f872ccb816ed2094b54/fx5.sml fx5 fx5.sml sml 4724 88 219 IMAGE-THUMBNAIL 1-s2.0-S0926860X25000870-fx4.sml https://s3-eu-west-1.amazonaws.com/prod-ucs-content-store-eu-west/content/pii:S0926860X25000870/fx4/THUMBNAIL/image/gif/ad185bc16c78a38286e039dafd8b49f3/fx4.sml fx4 fx4.sml sml 3961 104 219 IMAGE-THUMBNAIL 1-s2.0-S0926860X25000870-sc2.sml https://s3-eu-west-1.amazonaws.com/prod-ucs-content-store-eu-west/content/pii:S0926860X25000870/sc2/THUMBNAIL/image/gif/5c52ab2a6cbc1866ff282ec8d791884c/sc2.sml sc2 sc2.sml sml 8113 164 189 IMAGE-THUMBNAIL 1-s2.0-S0926860X25000870-gr8.sml https://s3-eu-west-1.amazonaws.com/prod-ucs-content-store-eu-west/content/pii:S0926860X25000870/gr8/THUMBNAIL/image/gif/8ae90e1486645ca3d50c7c15c7831303/gr8.sml gr8 gr8.sml sml 6159 93 219 IMAGE-THUMBNAIL 1-s2.0-S0926860X25000870-gr7.sml https://s3-eu-west-1.amazonaws.com/prod-ucs-content-store-eu-west/content/pii:S0926860X25000870/gr7/THUMBNAIL/image/gif/2e2ba5d5c524d8a25de69bcbf29ce766/gr7.sml gr7 gr7.sml sml 5428 92 219 IMAGE-THUMBNAIL 1-s2.0-S0926860X25000870-gr10.sml https://s3-eu-west-1.amazonaws.com/prod-ucs-content-store-eu-west/content/pii:S0926860X25000870/gr10/THUMBNAIL/image/gif/69c3e751c8b91b37d4a143eff7cbe380/gr10.sml gr10 gr10.sml sml 9696 163 174 IMAGE-THUMBNAIL 1-s2.0-S0926860X25000870-gr9.sml https://s3-eu-west-1.amazonaws.com/prod-ucs-content-store-eu-west/content/pii:S0926860X25000870/gr9/THUMBNAIL/image/gif/9c24997c4a781cfade2f73e5a8c0a09a/gr9.sml gr9 gr9.sml sml 5750 92 219 IMAGE-THUMBNAIL 1-s2.0-S0926860X25000870-gr4.sml https://s3-eu-west-1.amazonaws.com/prod-ucs-content-store-eu-west/content/pii:S0926860X25000870/gr4/THUMBNAIL/image/gif/07baa1b9b33813d0ac9c436a108367c1/gr4.sml gr4 gr4.sml sml 6363 164 216 IMAGE-THUMBNAIL 1-s2.0-S0926860X25000870-gr3.sml https://s3-eu-west-1.amazonaws.com/prod-ucs-content-store-eu-west/content/pii:S0926860X25000870/gr3/THUMBNAIL/image/gif/cad712530dc5c90b6cbafb4d114175e4/gr3.sml gr3 gr3.sml sml 8334 164 130 IMAGE-THUMBNAIL 1-s2.0-S0926860X25000870-gr6.sml https://s3-eu-west-1.amazonaws.com/prod-ucs-content-store-eu-west/content/pii:S0926860X25000870/gr6/THUMBNAIL/image/gif/347c061a91b9785c2e50cce40ce9609b/gr6.sml gr6 gr6.sml sml 6018 86 219 IMAGE-THUMBNAIL 1-s2.0-S0926860X25000870-gr5.sml https://s3-eu-west-1.amazonaws.com/prod-ucs-content-store-eu-west/content/pii:S0926860X25001188/gr5/THUMBNAIL/image/gif/1d810b9f1b1d9ab8cc84a79f21d94dbb/gr5.sml gr5 gr5.sml sml 17299 164 129 IMAGE-THUMBNAIL 1-s2.0-S0926860X25000870-fx10_lrg.jpg https://s3-eu-west-1.amazonaws.com/prod-ucs-content-store-eu-west/content/pii:S0926860X25000870/HIGHRES/image/jpeg/d835504919d46c9700bfed634e89000c/fx10_lrg.jpg fx10 fx10_lrg.jpg jpg 11713 271 465 IMAGE-HIGH-RES 1-s2.0-S0926860X25000870-fx11_lrg.jpg https://s3-eu-west-1.amazonaws.com/prod-ucs-content-store-eu-west/content/pii:S0926860X25000870/HIGHRES/image/jpeg/416f6afe7590409f7043085ff0cfa849/fx11_lrg.jpg fx11 fx11_lrg.jpg jpg 17133 381 533 IMAGE-HIGH-RES 1-s2.0-S0926860X25000870-ga1_lrg.jpg https://s3-eu-west-1.amazonaws.com/prod-ucs-content-store-eu-west/content/pii:S0926860X25000870/HIGHRES/image/jpeg/7259ce3d7a89345e5ef755197b13b0e5/ga1_lrg.jpg ga1 true ga1_lrg.jpg jpg 205395 886 1544 IMAGE-HIGH-RES 1-s2.0-S0926860X25000870-fx12_lrg.jpg https://s3-eu-west-1.amazonaws.com/prod-ucs-content-store-eu-west/content/pii:S0926860X25000870/HIGHRES/image/jpeg/175eb5d5b12b86f1d605d57b97ab997d/fx12_lrg.jpg fx12 fx12_lrg.jpg jpg 10273 171 587 IMAGE-HIGH-RES 1-s2.0-S0926860X25000870-fx13_lrg.jpg https://s3-eu-west-1.amazonaws.com/prod-ucs-content-store-eu-west/content/pii:S0926860X25000870/HIGHRES/image/jpeg/b11db441d7bfe6d510506f18386b475e/fx13_lrg.jpg fx13 fx13_lrg.jpg jpg 14172 261 607 IMAGE-HIGH-RES 1-s2.0-S0926860X25000870-fx14_lrg.jpg https://s3-eu-west-1.amazonaws.com/prod-ucs-content-store-eu-west/content/pii:S0926860X25000870/HIGHRES/image/jpeg/b7ccfba47a6f09357161864a79b9f324/fx14_lrg.jpg fx14 fx14_lrg.jpg jpg 7851 210 286 IMAGE-HIGH-RES 1-s2.0-S0926860X25000870-fx15_lrg.jpg https://s3-eu-west-1.amazonaws.com/prod-ucs-content-store-eu-west/content/pii:S0926860X25000870/HIGHRES/image/jpeg/146e66d6ee6e0f05a079297b623c0d29/fx15_lrg.jpg fx15 fx15_lrg.jpg jpg 12861 214 454 IMAGE-HIGH-RES 1-s2.0-S0926860X25000870-fx1_lrg.jpg https://s3-eu-west-1.amazonaws.com/prod-ucs-content-store-eu-west/content/pii:S0926860X25000870/HIGHRES/image/jpeg/b82ddbc7d3158105e44740dbe2ce0900/fx1_lrg.jpg fx1 fx1_lrg.jpg jpg 60399 524 2245 IMAGE-HIGH-RES 1-s2.0-S0926860X25000870-fx7_lrg.jpg https://s3-eu-west-1.amazonaws.com/prod-ucs-content-store-eu-west/content/pii:S0926860X25000870/HIGHRES/image/jpeg/b6cdb8c26e9137ab1126f6a9936d200d/fx7_lrg.jpg fx7 fx7_lrg.jpg jpg 12763 213 533 IMAGE-HIGH-RES 1-s2.0-S0926860X25000870-fx6_lrg.jpg https://s3-eu-west-1.amazonaws.com/prod-ucs-content-store-eu-west/content/pii:S0926860X25000870/HIGHRES/image/jpeg/9a585648d86aba9d3d4725d0513da748/fx6_lrg.jpg fx6 fx6_lrg.jpg jpg 7288 185 396 IMAGE-HIGH-RES 1-s2.0-S0926860X25000870-fx9_lrg.jpg https://s3-eu-west-1.amazonaws.com/prod-ucs-content-store-eu-west/content/pii:S0926860X25000870/HIGHRES/image/jpeg/b88207503502c715b59b55354965219d/fx9_lrg.jpg fx9 fx9_lrg.jpg jpg 14825 313 486 IMAGE-HIGH-RES 1-s2.0-S0926860X25000870-gr2_lrg.jpg https://s3-eu-west-1.amazonaws.com/prod-ucs-content-store-eu-west/content/pii:S0926860X25000870/HIGHRES/image/jpeg/24b6f46f91b8c41b99c09d9da6ea38a6/gr2_lrg.jpg gr2 gr2_lrg.jpg jpg 140051 1384 1663 IMAGE-HIGH-RES 1-s2.0-S0926860X25000870-fx8_lrg.jpg https://s3-eu-west-1.amazonaws.com/prod-ucs-content-store-eu-west/content/pii:S0926860X25000870/HIGHRES/image/jpeg/ae9731a85f42c66712ecca92650e9c14/fx8_lrg.jpg fx8 fx8_lrg.jpg jpg 10339 270 352 IMAGE-HIGH-RES 1-s2.0-S0926860X25000870-gr1_lrg.jpg https://s3-eu-west-1.amazonaws.com/prod-ucs-content-store-eu-west/content/pii:S0926860X25000870/HIGHRES/image/jpeg/4c05258856021b59fad31fd61088ad6f/gr1_lrg.jpg gr1 gr1_lrg.jpg jpg 273604 1189 2911 IMAGE-HIGH-RES 1-s2.0-S0926860X25000870-fx3_lrg.jpg https://s3-eu-west-1.amazonaws.com/prod-ucs-content-store-eu-west/content/pii:S0926860X25000870/HIGHRES/image/jpeg/376f2a8650eaa55f6444949da7616300/fx3_lrg.jpg fx3 fx3_lrg.jpg jpg 9466 207 384 IMAGE-HIGH-RES 1-s2.0-S0926860X25000870-sc1_lrg.jpg https://s3-eu-west-1.amazonaws.com/prod-ucs-content-store-eu-west/content/pii:S0926860X25000870/HIGHRES/image/jpeg/ec945e34bac410874234ac568899158e/sc1_lrg.jpg sc1 sc1_lrg.jpg jpg 146901 1083 1663 IMAGE-HIGH-RES 1-s2.0-S0926860X25000870-fx2_lrg.jpg https://s3-eu-west-1.amazonaws.com/prod-ucs-content-store-eu-west/content/pii:S0926860X25000870/HIGHRES/image/jpeg/059a7d90f110e202302d6ebc91d12a50/fx2_lrg.jpg fx2 fx2_lrg.jpg jpg 4257 148 243 IMAGE-HIGH-RES 1-s2.0-S0926860X25000870-fx5_lrg.jpg https://s3-eu-west-1.amazonaws.com/prod-ucs-content-store-eu-west/content/pii:S0926860X25000870/HIGHRES/image/jpeg/2668e728b22cbe988c5172c8b619d660/fx5_lrg.jpg fx5 fx5_lrg.jpg jpg 11463 199 496 IMAGE-HIGH-RES 1-s2.0-S0926860X25000870-fx4_lrg.jpg https://s3-eu-west-1.amazonaws.com/prod-ucs-content-store-eu-west/content/pii:S0926860X25000870/HIGHRES/image/jpeg/514da784b7daa8b85356107748fcfda8/fx4_lrg.jpg fx4 fx4_lrg.jpg jpg 7080 180 378 IMAGE-HIGH-RES 1-s2.0-S0926860X25000870-sc2_lrg.jpg https://s3-eu-west-1.amazonaws.com/prod-ucs-content-store-eu-west/content/pii:S0926860X25000870/HIGHRES/image/jpeg/3ff422f372302c7e0cbab9762f33aeb9/sc2_lrg.jpg sc2 sc2_lrg.jpg jpg 255603 2527 2911 IMAGE-HIGH-RES 1-s2.0-S0926860X25000870-gr8_lrg.jpg https://s3-eu-west-1.amazonaws.com/prod-ucs-content-store-eu-west/content/pii:S0926860X25000870/HIGHRES/image/jpeg/6492d421e6c552db2baa170c7c6f4429/gr8_lrg.jpg gr8 gr8_lrg.jpg jpg 169992 1234 2911 IMAGE-HIGH-RES 1-s2.0-S0926860X25000870-gr7_lrg.jpg https://s3-eu-west-1.amazonaws.com/prod-ucs-content-store-eu-west/content/pii:S0926860X25000870/HIGHRES/image/jpeg/db14eed39f006a01e6fc290664e4b8cd/gr7_lrg.jpg gr7 gr7_lrg.jpg jpg 197789 1229 2911 IMAGE-HIGH-RES 1-s2.0-S0926860X25000870-gr10_lrg.jpg https://s3-eu-west-1.amazonaws.com/prod-ucs-content-store-eu-west/content/pii:S0926860X25000870/HIGHRES/image/jpeg/8075804b81fb672a16af28cb0b78af7d/gr10_lrg.jpg gr10 gr10_lrg.jpg jpg 440128 2733 2911 IMAGE-HIGH-RES 1-s2.0-S0926860X25000870-gr9_lrg.jpg https://s3-eu-west-1.amazonaws.com/prod-ucs-content-store-eu-west/content/pii:S0926860X25000870/HIGHRES/image/jpeg/9a0d194e0a27a7bf0b61fcfeddbe48bf/gr9_lrg.jpg gr9 gr9_lrg.jpg jpg 163567 1219 2911 IMAGE-HIGH-RES 1-s2.0-S0926860X25000870-gr4_lrg.jpg https://s3-eu-west-1.amazonaws.com/prod-ucs-content-store-eu-west/content/pii:S0926860X25000870/HIGHRES/image/jpeg/ab187e3d2bf71e33495b44ed7c8a2066/gr4_lrg.jpg gr4 gr4_lrg.jpg jpg 87735 1262 1663 IMAGE-HIGH-RES 1-s2.0-S0926860X25000870-gr3_lrg.jpg https://s3-eu-west-1.amazonaws.com/prod-ucs-content-store-eu-west/content/pii:S0926860X25001188/HIGHRES/image/jpeg/a286f90dd45102cae777fc147a8a66e5/gr3_lrg.jpg gr3 gr3_lrg.jpg jpg 574388 3668 2911 IMAGE-HIGH-RES 1-s2.0-S0926860X25000870-gr6_lrg.jpg https://s3-eu-west-1.amazonaws.com/prod-ucs-content-store-eu-west/content/pii:S0926860X25001188/HIGHRES/image/jpeg/ebb344a5e71ba7bfdbbac956f4748460/gr6_lrg.jpg gr6 gr6_lrg.jpg jpg 205687 1149 2911 IMAGE-HIGH-RES 1-s2.0-S0926860X25000870-gr5_lrg.jpg https://s3-eu-west-1.amazonaws.com/prod-ucs-content-store-eu-west/content/pii:S0926860X25001188/HIGHRES/image/jpeg/b7eb551a4d17719463bcd8e081768aa0/gr5_lrg.jpg gr5 gr5_lrg.jpg jpg 577596 3173 2495 IMAGE-HIGH-RES 1-s2.0-S0926860X25000870-mmc1.docx https://s3-eu-west-1.amazonaws.com/prod-ucs-content-store-eu-west/content/pii:S0926860X25000870/mmc1/MAIN/application/vnd.openxmlformats-officedocument.wordprocessingml.document/88fb8aa02a57b4064e2ea07280ddba07/mmc1.docx mmc1 mmc1.docx docx 9589216 APPLICATION APCATA 120186 120186 S0926-860X(25)00087-0 10.1016/j.apcata.2025.120186 The Authors Fig. 1 FTIR spectra of MIL-101(Cr), MIL101–2AMP-DBrP and 2AMP-DBrP (a); MIL-101(Cr), MIL101–2AMP-DBrEE and 2AMP-DBrEE (b). Fig. 1 Fig. 2 PXRD patterns of simulated MIL-101(Cr), activated MIL-101(Cr), MIL101–2AMP-DBrP and MIL101–2AMP-DBrEE. Fig. 2 Fig. 3 (a) XPS survey spectrum and XPS spectra of N1s (b and c), and Br 3d (d and e) for the MIL101–2AMP-DBrP and MIL101–2AMP-DBrEE samples. Fig. 3 Fig. 4 The thermogravimetric analysis (TGA) profiles of the MIL-101(Cr), MIL101–2AMP-DBrP and MIL101–2AMP-DBrEE. Fig. 4 Fig. 5 SEM images MIL-101(Cr) (a-b), MIL101–2AMP-DBrP (c-d) and MIL101–2AMP-DBrEE (e-f). Fig. 5 Fig. 6 (a) N2 adsorption−desorption isotherms collected at 77 K and (b) the pore size distribution for activated MIL-101(Cr), MIL101–2AMP-DBrP, and MIL101–2AMP-DBrEE, calculated from NLDFT analysis. Fig. 6 Fig. 7 CO2 adsorption isotherms collected at (a) 273 K and (b) 298 K for activated MIL-101(Cr), MIL101–2AMP-DBrP, and MIL101–2AMP-DBrEE. Fig. 7 Fig. 8 Conversion for the cycloaddition of CO2 with epichlorohydrin under solvent and co-catalyst-free conditions: (a) Effect of reaction temperature, conditions: ECH (10 mmol), MIL101–2AMP-DBrEE (0.47 mol%), 0.1 MPa, and 24 h. (b) Effect of reaction time, conditions: ECH (10 mmol), MIL101–2AMP-DBrEE (0.47 mol%), 0.1 MPa, and 90 °C. Fig. 8 Fig. 9 Recycling of MIL101–2AMP-DBrEE in the cycloaddition of CO2 with epichlorohydrin under optimized conditions; ECH (10 mmol), MIL101–2AMP-DBrEE (0.47 mol%), 0.1 MPa, 90 °C, and 12 h. Fig. 9 Fig. 10 (a) three dimensional in-situ FTIR spectra of the CO2 fixation reaction with epichlorohydrin using 2AMP-DBrP (0.3 mol%) under 0.1 MPa CO2 and 90 °C for 5 h, (b) spectra of epichlorohydrin and chloropropene carbonate, (c) deconvolution of the 1801 cm−1 peak into distinct peaks using Gaussian fitting model. Fig. 10 Scheme 1 Functionalization of MIL-101(Cr) using ship-in-bottle technique as the post-synthetic encapsulation. Scheme 1 Scheme 2 Suggested synergistic catalytic mechanism. Scheme 2 Table 1 Sorption data for MIL-101(Cr), MIL101-2AMP-DBrP, and MIL101-2AMP-DBrEE. Table 1 Sample SBET(m2g−1)(N2 adsorption at 77 K) Pore volume (cm3 g−1) N2 adsorption under 0.1 MPa CO2 adsorptionunder 0.1 MPa 77 K(cm3 g−1 STP) 298 K(mmol g−1) 273 K(mmol g−1) MIL-101(Cr)MIL101-2AMP-DBrPMIL101-2AMP-DBrEE 342524562408 1.781.441.41 1121913889 2.643.514.05 4.615.276.35 Table 2 Cycloaddition of CO2 to epichlorohydrin. Table 2 Image 1 E. Catalyst Catalyst (mol%) a X- (mol%) b M(mol%) c time (h) Yield(%) d TOFX - (h−1) e TOFM (h−1) f 1 - - - - 24 - - - 2 Cr(NO3)3 2.2 - 2.2 24 trace - - 3 MIL−101(Cr) 1.1 - 0.24 24 22 - 2.5 4 2AMP-DBrP 0.15 0.30 - 24 45 6.2 - 5 2AMP-DBrEE 0.15 0.30 - 24 56 7.8 - 6 Cr(NO3)3, 2AMP-DBrP 0.24 + 0.15 0.30 0.24 24 79 11.0 13.7 7 Cr(NO3)3, 2AMP-DBrEE 0.24 + 0.15 0.30 0.24 24 88 12.2 15.3 8 MIL−101(Cr), 2AMP-DBrP 1.1 + 0.15 0.30 0.24 24 77 10.7 13.4 9 MIL−101(Cr), 2AMP-DBrEE 1.1 + 0.15 0.30 0.24 24 86 11.9 14.9 10 MIL101–2AMP-DBrP 0.47 0.10 0.08 24 98 40.8 26.1 11 MIL101–2AMP-DBrP 0.47 0.10 0.08 6 71 118.3 75.5 12 MIL101–2AMP-DBrP 0.47 0.10 0.08 12 96 80.0 55.8 13 MIL101–2AMP-DBrEE 0.47 0.10 0.09 24 > 99 41.2 26.3 14 MIL101–2AMP-DBrEE 0.47 0.10 0.09 6 77 128.3 81.9 15 MIL101–2AMP-DBrEE 0.47 0.10 0.09 12 > 99 82.5 52.7 Reaction conditions: epichlorohydrin (10 mmol), co-catalyst and solvent-free. a Catalyst (Cr3O(OH)(H2O)2(C8O4H4)3-ILs) molar ratio relative to epoxide. b Halide amount relative to epoxide. c Metal ions amount relative to epoxide. d The yields were determined by 1H NMR spectra using deuterated chloroform (CDCl3) as solvent and mesitylene as internal standard. e TOF with respect to halide: yield/(time × (halide amount in mol%)). f TOF with respect to metal sites: yield/(time × (catalyst amount in mol%)/(number of metal ions in formula)). Table 3 Cycloaddition of CO2 to various epoxides catalyzed using pyrimidinium ionic MIL-101(Cr)-MOFs. Table 3 En. Epoxide product Catalyst Reaction results Yield a (%) Selectivity(%) TOF b (h−1) 1 Image 2 Image 3 MIL101–2AMP-DBrEE 99 > 99 82.5 2 MIL101–2AMP-DBrP 99 > 99 82.5 3 Image 4 Image 5 MIL101–2AMP-DBrEE 99 > 99 82.5 4 MIL101–2AMP-DBrP 96 > 99 80.0 5 Image 6 Image 7 MIL101–2AMP-DBrEE 99 > 99 82.5 6 MIL101–2AMP-DBrP 92 > 99 76.7 7 Image 8 Image 9 MIL101–2AMP-DBrEE 99 > 99 82.5 8 MIL101–2AMP-DBrP 90 > 99 74.2 10 Image 10 Image 11 MIL101–2AMP-DBrEE 94 > 99 78.3 11 MIL101–2AMP-DBrP 92 > 99 76.7 13 Image 12 Image 13 MIL101–2AMP-DBrEE 99 > 99 82.5 14 MIL101–2AMP-DBrP 93 > 99 77.5 16 Image 14 Image 15 MIL101–2AMP-DBrEE 25 > 99 8.3 17 MIL101–2AMP-DBrP 19 > 99 6.2 a The cyclic carbonate yields were determined by 1H NMR (500 MHz, CDCl3), and reported in Supporting Information. Reaction conditions: epoxide (10 mmol), catalyst amount (Cr3O(OH)(H2O)2(C8O4H4)3-ILs) relative to epoxide (0.47 mol%), 0.1 MPa, 90 °C, 12 h, and co-catalyst and solvent-free. b TOF with respect to halide: yield/ (time×(halide amount in mol%)). Table 4 Comparison of MIL101-2AMP-DBrP and MIL101-2AMP-DBrEE catalysts with reported MOFs for the CO2 fixation reaction that operate without co-catalysts. Table 4 En. Catalyst X- (mol%) a PCO2 (MPa) T(°C) Time(h) Yield (%) TOFX - (h−1) b Ref. 1 UiO67-[TBD]+Br- 0.86 0.1 80 18 98 6.3 [46] 2 (I−)Meim-UiO−66 0.74 0.1 120 24 93 5.2 [79] 3 UiO67-IL 1.5 0.1 90 12 95 5.3 [27] 4 UiO66Pym-MeI 0.44 0.5 100 24 99 9.4 [77] 5 UiO67BPym-MeI 0.23 0.5 100 24 87.5 16.0 [77] 6 ZnTCPP⊂(Br-)Etim-UiO−66 0.95 0.1 140 14 87 6.5 [78] 7 UiO66-DCCBr 0.83 0.5 90 16 95 7.2 [47] 8 UiO67-DICBr 0.97 0.5 90 12 99 8.5 [47] 9 FJI-C10 0.35 0.1 80 12 87 21 [76] 12 MIL−101-tzmOH-Br 0.25 1.0 120 2 97 193 [74] 13 MIL−101-tzmOH-Br 0.25 1.0 80 10 93 37 [74] 14 MIL−101-tzmOH-Br 0.42 0.1 80 12 91 18 [74] 15 PolyIL@MIL−101 5.10 0.1 70 24 94 0.77 [75] 16 MIL101–2AMP-DBrP 0.10 0.1 90 12 96 80.0 This work 17 MIL101–2AMP-DBrEE 0.10 0.1 90 12 99 82.5 This work a Halide/epoxide molar ratio. b TOF with respect to halide: yield/ (time × (halide mol%)). CO2 fixation reaction over pyrimidinium-based dicationic ionic liquid in MIL-101(Cr) Seyedeh Molood Masoom Nataj Writing – original draft Methodology Data curation Conceptualization a Serge Kaliaguine Writing – review & editing Supervision Project administration Funding acquisition Conceptualization a ⁎ Frédéric-Georges Fontaine Writing – review & editing Supervision Project administration Funding acquisition Conceptualization b ⁎ a Chemical Engineering Department, Université Laval, Québec City G1V 0A6, Canada Chemical Engineering Department, Université Laval Québec City G1V 0A6 Canada Chemical Engineering Department, Université Laval, Québec City, G1V 0A6, Canada b Chemistry Department, Université Laval, Québec City QC G1V 0A6, Canada Chemistry Department, Université Laval Québec City QC G1V 0A6 Canada Chemistry Department, Université Laval, Québec City, QC G1V 0A6, Canada ⁎ Corresponding authors. Modified metal-organic frameworks (MOFs) encapsulating new ionic N-heterocyclic-based functional groups, prepared via a ship-in-a-bottle approach, introduce a novel catalytic system for CO₂ conversion with epoxides. The MIL-101(Cr) framework was functionalized with novel ionic liquids (ILs) such as 1,5-bis(2-aminopyrimidinium)pentane bromide (2AMP-DBrP) and 1,5-bis(2-aminopyrimidinium)ethyl ether bromide (2AMP-DBrEE), resulting in cationic pyrimidinium-containing Cr-MOFs with free bromide ions, namely MIL101–2AMP-DBrP and MIL101–2AMP-DBrEE. Although the surface area (2456 and 2408 m²/g) and pore volume (1.44 and 1.41 cm³/g) of these encapsulated materials were reduced compared to pristine MIL-101(Cr) (3425 m²/g and 1.78 cm³/g), the CO₂ adsorption capacity at low pressure was notably increased (3.51 and 4.05 mmol g⁻¹ of CO₂). These modified MOFs demonstrated exceptional catalytic performance and stability in CO₂ fixation with various epoxides, achieving a high turnover frequency (TOF) of 82.5 h⁻¹ under mild conditions (0.1 MPa, 90 °C) without the need for co-catalysts or solvents, which are essential criteria for commercial viability. Moreover, in situ FTIR analysis suggests that the enhanced performance is due to CO₂ activation via carbamic acid formation facilitated by primary amino groups and epoxide activation through hydrogen bonding. This dual activation mechanism is critical for achieving high catalytic efficiency under mild conditions and underscores the innovative and significant advancements presented in this work compared to existing IL-MOFs. Graphical Abstract Keywords Metal-organic frameworks MIL-101(Cr) CO2 utilization Cyclic carbonate Data availability Data will be made available on request. 1 Introduction Technologies utilizing CO2 as a raw material for creating useful chemicals are seen as a viable approach to reduce the overall release of human-generated carbon dioxide into the atmosphere [1–7]. There are, however, many challenges to overcome for converting CO2 into valuable chemicals, with the most obvious being the high energy cost due to the inherent stability of CO2. An approach that has gained industrial importance in the past decade is the production of cyclic organic carbonates through the CO2 fixation reaction with epoxides [8–10]. This CO2 utilization process is a greener alternative to generate these useful molecules than typical carbonate synthesis industrial processes using phosgene and can be conducted under mild conditions of temperature and pressure, provided active catalysts are used. This cycloaddition reaction is particularly favorable from a thermodynamic standpoint, as the driving force relies on the release of the ring-strain energy present in the epoxide substrate [11]. Cyclic carbonates, which are typically in liquid form, exhibit high stability and serve as long-term reservoirs for CO2 sequestration when compared to other commonly used products like urea, which rapidly releases CO2 upon utilization in agricultural applications [12]. In addition, cyclic carbonates have various applications as electrolytes in batteries, serve as solvents in environmentally friendly chemical processes, contribute to the creation of eco-friendly polymers like polyurethanes and polycarbonates, and function as intermediates in diverse chemical reactions [13,14]. One class of highly active heterogeneous catalysts for CO2 fixation reactions is metal-organic frameworks (MOFs), which are crystalline materials created through the assembly of organic ligands with metal clusters or metal ions [15,16]. The distinguishing characteristics of MOFs include the ability to be structurally designed, the capacity to tune its porosity and to integrate task-specific functional groups into their framework, enabling catalysis for fine chemical synthesis. One of the most stable, tunable, and porous MOFs studied is MIL-101(Cr) [17,18], which has a rigid zeotype crystal structure comprised of two quasi-spherical cages of 34 Å and 29 Å in diameters with pentagonal and hexagonal windows of 16 Å and 12 Å in diameters, respectively [17–19]. The utilization of MIL-101(Cr) as a support for immobilizing homogeneous catalysts via chemical grafting has gained significant attention owing to its remarkable attributes, such as a high surface area and exceptional thermal stability [20,21]. It is therefore not surprising that many MOF catalysts have been used for CO2 fixation reactions [22–26]; however, the design of functional MOFs for CO2 fixation reactions under mild conditions, without the use of solvents and co-catalysts and operating at ambient pressure, remains a challenging endeavor [20,21,27–29]. One successful strategy for the formation of cyclic carbonate using CO2 is the immobilization of ionic liquids (IL) on heterogeneous structures, such as silica [30–32], chitosan [33], cross-linked polymers [34], magnetic nanoparticles [35], and carbon nanotubes [36]. The ILs consist of cationic and anionic moieties with various functional groups and possess interesting features, such as negligible vapor pressure and high thermal stability, which can enhance the efficiency of CO2 adsorption and capture [37–40]. However, IL-functionalized MOFs are particularly suitable since they can both adsorb large volumes of CO2 and exhibit high catalytic reactivity. [27,28] Imidazolium-based ILs featuring hydroxyl (-OH) and carboxylic (-COOH) groups exhibit remarkable catalytic efficiency in CO2 fixation with epoxides, attributed to their hydrogen bonding with the oxygen atom of epoxides, which leads to its activation and an increase in catalytic activity [41–45]. We reported recently guanidinium-based ionic liquid functionalized MOFs, which demonstrated effective heterogeneous catalytic performances in the CO2 fixation reaction with epoxides, with high yield and selectivity, under mild conditions without co-catalyst and solvent due to the hydrogen bonding and the presence of highly reactive nucleophiles [46,47]. Taherimehr et al. [48] demonstrated the remarkable characteristics of MOFs and ILs by combining MIL-100 with 1-ethyl-3-methylimidazolium bromide catalysts under 60 °C, 8.0 MPa for 18 h. This combination resulted in an impressive 94 % yield of styrene carbonate, implying a strong synergistic effect between IL and MOF for the cycloaddition reaction. In another study, Ma et al. [49] reported the successful use of tetrabutylammonium bromide-functionalized MIL-101(Cr) as a reusable catalyst. This catalyst proficiently converted CO2 and propylene oxide into propylene carbonate, achieving an outstanding 99 % yield under the reaction conditions of 2.0 MPa and 80 °C for 8 h. The post-synthetic encapsulation technique can be used to load guests or their precursors into the pre-formed cavities or channels of MOFs through exchange or diffusion processes. This technique is often referred to as \"ship-in-bottle\" encapsulation. The effectiveness of encapsulation relies on ensuring that the size and shape of the MOF pores align with the structure of the guests, along with establishing relatively strong supramolecular interactions between the two components [50]. For example, Liu et al. synthesized an innovative ionic liquid@MOF material by encapsulating an imidazole-based ionic liquid within a hierarchically porous MIL-101(Cr) through the ship-in-bottle approach. [51] Their study revealed that the mobility of active species plays a crucial role in the chemical fixation of CO2. Remarkably, this catalyst exhibited outstanding catalytic properties even without the presence of any co-catalysts, demonstrating its efficacy for the CO2 fixation reaction using acetonitrile as solvent under mild conditions (0.1 MPa, 80 °C). To improve on these catalytic systems, we synthesized novel catalytic materials for CO₂ conversion into cyclic carbonates under mild conditions using MIL-101(Cr) as a support. The parent structure was modified by incorporating newly designed 2-amino pyrimidine moieties linked by alkyl and ether chains. This modification enabled the successful encapsulation of novel ionic liquids (ILs) within the MIL-101(Cr) channels, creating a new catalytic system that enhances both structural integrity and catalytic stability. These newly synthesized materials exhibited exceptional catalytic activity and stability in the cycloaddition of CO₂ to epoxides under mild conditions (0.1 MPa CO₂, 90 °C) without the need for solvents or co-catalysts. While chromium in MIL-101 may raise concerns about cost and environmental impact, the life cycle analysis of the transformation from similar systems shows that these issues are minor compared to factors like energy use, purification, and CO₂ processing conditions [52]. Chromium, being more affordable than palladium, platinum, or rhodium, remains commercially viable if the catalyst is recyclable, energy-efficient, and effective at ambient pressure and low temperatures. Therefore, chromium does not hinder the potential for commercialization. 2 Experimental section 2.1 Materials and instrumentation All solvents and reagents were obtained from commercial sources and used without purification. The powder X-ray diffraction (PXRD) analysis was done using a Rigaku D-Max-Ultima III (Cu Kα, λ = 1.5406 Å) at 293 K. Thermogravimetric analysis (TGA) was performed using a Netzsch STA 449 C thermogravimetric analyzer at a heating rate of 5 °C/min with an air flow of 20 mL/min. The CHN elemental analysis was conducted using a Thermo Scientific™ FLASH 2000 CHNS/O analyzer. The infrared spectra were obtained using an ABB MB-3000 Fourier transform spectrometer in the range of 400–4000 cm−1 with a resolution of 4 cm−1 and 64 scans. The in-situ FTIR spectroscopy Model React IR15 equipped with MCT detector and DiCOMP probe was used for kinetic study in the scan region of 2500–650 cm−1. Scanning electron microscopy (SEM) was done using an Inspect F-50 after sputtering with palladium and gold. Energy-dispersive X-ray spectroscopy (EDS) analysis was executed by an Edax Ametek (Octane Super-A). Isotherms of nitrogen adsorption/desorption were achieved via an Autosorb-iQ1 analyzer after degassing at 180 °C for MIL-101(Cr) and 110 °C for functionalized MIL-101(Cr). The Brunauer−Emmett−Teller (BET) equation was employed to compute surface area from adsorption data at P/P0 ranging from 0.05 to 0.2, and the total volume of pores was found from nitrogen adsorption data at P/P0 = 0.95. The CO2 adsorption analysis was performed using a Tristar™ II 3020 at 273 K and 298 K in an ice water bath and a room-temperature water bath, respectively. For the quantification of bromide ions, ICP-MS/MS (Agilent 8900) was used with a helium flow rate of 4.8 mL/min to eliminate mass interferences. Rhodium (Rh) was employed as the internal standard. 2.2 Synthesis of catalysts 2.2.1 Synthesis of MIL-101(Cr) MIL-101(Cr) was synthesized following previously reported procedures [53,54]. In a typical procedure, 10.0 mmol (4.0 g) of Cr(NO3)3·9H2O and 0.6 mL of acetic acid were dissolved in 25 mL of deionized water and stirred for 30 min. Then, 9.87 mmol (1.7 g) of terephthalic acid (H2BDC) was dissolved in 25 mL of deionized water and mixed for 30 min. The two solutions were then combined, stirred for 30 minutes, and placed in a 250 mL Teflon-lined autoclave. The autoclave was then heated in an oven at 220 °C for 8 h. Following this step, a green powder was obtained by vacuum filtration. The product was subsequently purified and activated with 30 mL of deionized water at 80 °C for 4 h, washed with 30 mL of ethanol at 60 °C for 4 h, and heated in a vacuum at 180 °C for 24 h to obtain pure green MIL-101(Cr). The CHN elemental analysis (%) calculated for MIL-101(Cr) (C8H5.6Cr1O5.3): C 40.14, H 2.37. Found: C 40.17, H 2.39. 2.2.2 Synthesis method of MIL101-2AMP-DBrP and MIL101-2AMP-DBrEE The MIL101–2AMP-DBrP and MIL101–2AMP-DBrEE materials were created using the \"ship-in-bottle\" (SIB) method ( Scheme 1), which is like a previously reported incipient wetness technique [51,55]. Before loading the reagents, MIL-101(Cr) was activated by heating for 12 h at 180 °C under vacuum. 2-Aminopyrimidine (20.0 mmol, 1.9 g) was dissolved in DMF (14 mL) and added dropwise to MIL-101(Cr) (2.2 mmol, 1.6 g) at room temperature. The loaded MIL-101(Cr) was stirred for 24 h under nitrogen and then mixed in a three-necked round-bottom flask with a solution of 9.8 mmol of 1,5-dibromopentane (2.2 g) in 10 mL DMF to prepare MIL101–2AMP-DBrP, or a solution of 9.8 mmol of bis(2-bromoethyl) ether (2.3 g) in 10 mL DMF to prepare MIL101–2AMP-DBrEE. These mixtures were agitated in an oil bath at 80 °C for 48 h under nitrogen. The reaction mixtures were then cooled down to room temperature and the catalysts were segregated through centrifugation and washed with ethanol (3 × 25 mL). Eventually, the solids were dried in a vacuum oven for 24 h at 110 °C. The CHN elemental analysis (%) calculated for MIL101–2AMP-DBrEE (C12H11.66Cr1N2O5.66Br0.66): C 37.91, H 3.07, N 7.37, MIL101–2AMP-DBrEE with 32 % of 2AMP-DBrEE (C9.28H7.59Cr1N0.64O5.44Br0.21): C 39.21, H 2.67, N 3.15. Found: C 39.22, H 2.71, N 3.17. For MIL101–2AMP-DBrP (C12.33H12.33Cr1N2O5.33Br0.66): C 39.1, H 3.26, N 7.39, MIL101–2AMP-DBrP with 33 % of 2AMP-DBrP (C9.43H7.87Cr1N0.66O5.33Br0.22): C 39.69, H 2.76, N 3.24, Found: C 39.71, H 2.77, N 3.26. 2.2.3 Synthesis of quaternary bromide salts To synthesize the pyrimidinium salts, a mixture of 2-aminopyrimidine (12 mmol) and of the bis(alkyl bromide) derivative (6 mmol) was agitated overnight in DMF (10 mL) at 80 °C, leading to the creation of a white precipitate. The product was then isolated by filtration and washed with fresh DMF (2 × 10 mL) and ethanol (5 mL) after cooling to room-temperature [56]. 2.2.3.1 1,5-Bis(2-aminopyrimidinium)pentane bromide (2AMP-DBrP) This compound was prepared from 2-aminopyrimidine and 1,5- dibromopentane. Isolated yield of 72 % (1.81 g, 4.31 mmol). 1H NMR (500 MHz, DMSO): 8.21 (d, J = 4.8 Hz, 4H), 6.57 (s, 4H), 6.54 (dd, J = 4.8 Hz, 2H), 3.57 (t, J = 6.8 Hz, 4H), 1.83 (quin, J = 6.8 Hz, 4H), 1.51 (m, 2H). 2.2.3.2 1,5-Bis(2-aminopyrimidinium)ethyl ether bromide (2AMP-DBrEE) This compound was prepared from 2-aminopyrimidine and bis(2-bromoethyl)ether. Isolated yield of 67 % (1.72 g, 4.07 mmol). 1H NMR (500 MHz, CDCl3): 8.28 (d, J = 4.9 Hz, 4H), 6.59 (dd, J = 4.8 Hz, 2H), 5.38 (s, 4H), 3.83 (t, J = 6.3 Hz, 4H), 3.47 (t, J=6.3 Hz, 4H). 2.3 General procedure of CO2 fixation with epoxides To activate the functionalized MOF catalysts for catalytic testing, the guest solvent molecules were eliminated by heating at 100 °C in a vacuum oven for 24 h. Then, a 20 mL batch glass reactor with a magnetic stirring bar was loaded with the selected epoxide (10 mmol) and catalyst (mol%). The CO2 was then introduced into the reactor to achieve the desired pressure, and the mixture was agitated at a constant temperature (ranging from 25 °C to 100 °C) for the desired duration. After the specified time, the reactor was then cooled down to room temperature, the CO2 was removed, and deuterated chloroform was added as the solvent for 1H NMR spectroscopy. The solution was mixed for 30 minutes and then centrifuged to isolate the catalyst. Finally, the products were analyzed using 1H NMR spectroscopy with mesitylene as internal standard. The NMR yields with internal standard were used as they provide a reliable, non-invasive method to quantify both the product and any unreacted starting materials, offering an accurate reflection of the reaction's efficiency without the risk of losing volatile species. 3 Results and discussion 3.1 Material synthesis and characterization The MIL-101(Cr) framework, with the general formula Cr3O(OH)(H2O)2(C6H4(COO)2)3, is made up of Cr3O ionic trimeric clusters that coordinate through carboxylate moieties (–COO-) from the terephthalic carboxylate ligand [57,58]. The resultant 3-D structure possesses quasi-spherical cages of 29 Å and 34 Å in diameter that are accessed through apertures of 12 and 16 Å, respectively. MIL-101(Cr) with catalytically active and coordinatively unsaturated sites (CUSs) is formed through the elimination of water molecules that are linked to the metal ions using heat and vacuum treatment [59]. The post-modification of pristine material was done by the subsequent loading of 2-aminopyrimidine and bis(alkylbromide) derivatives into the pores of MIL-101(Cr). A slight heating allows the nucleophilic substitution to take place, creating an ionic liquid within the channels that is firmly enclosed within the pores, even after washing with solvents. The elemental analysis confirmed an incorporation rate of 33 wt% and 32 wt% for 2AMP-DBrP and 2AMP-DBrEE in MIL101–2AMP-DBrP and MIL101–2AMP-DBrEE, respectively. To accurately quantify the bromine ions in the catalyst frameworks, ICP-MS/MS (Agilent 8900) was used. The bromine ion content was 6.7 ± 0.7 % for MIL101–2AMP-DBrP and 5.8 ± 0.6 % for MIL101–2AMP-DBrEE. These results are consistent with those obtained from CHN analysis, confirming the reliable quantification of bromine in the catalysts. The existence of Lewis acidic sites in the MOF structure, hydrogen atoms capable of forming hydrogen bonds, and halide ions in the pores are all structural features required for improved catalytic efficiency in the reaction between CO2 and epoxides. FTIR spectroscopy was employed to investigate the integration of 2AMP-DBrP and 2AMP-DBrEE into MIL-101(Cr) ( Fig. 1). As shown, notable peaks at 1395 cm−1 (symmetric) and 1614 cm−1 (asymmetric) vibrations indicate the existence of carboxylates within both the MIL-101(Cr) framework and the functionalized structure [60,61]. This observation suggests that the structural integrity of MIL-101(Cr) was maintained following the functionalization process. Upon the addition of 2AMP-DBrP and 2AMP-DBrEE, two distinct bands emerge at 3166 and 3334 cm−1, which are characteristic of the N-H stretching of the 2-aminopyrimidinium cation moieties. Furthermore, the peaks observed at 1582 cm−1 and 1280 cm−1 suggest the presence of CN and C-N stretching vibrations in the functional groups, as demonstrated in the case of 2AMP-DBrP and 2AMP-DBrEE [62,63]. These pieces of evidence collectively confirm the formation of 2-amino-pyrimidinium salt derivatives within the structure of MIL-101(Cr). The wide-angle powder X-ray diffractograms of the pristine simulated MIL-101(Cr), synthesized MIL-101(Cr), and functionalized MIL101–2AMP-DBrP and MIL101–2AMP-DBrEE, were examined to confirm the structural integrity of the MOF structure after encapsulation ( Fig. 2). The existence of intense diffraction peaks indicates a proper degree of crystallinity, as anticipated. The PXRD pattern of MIL-101(Cr) exhibits major diffraction peaks at 2θ = 1.91 °, 2.91 °, 3.36 °, 5.23 °, 8.52 °, and 9.13 °, which are in agreement with the simulated PXRD pattern and previously reported data of MIL-101(Cr) [64,65]. The main peaks of the pyrimidinium-based ionic MOFs (MIL101–2AMP-DBrP and MIL101–2AMP-DBrEE) were found at 2θ = 1.81 °, 2.79 °, 3.26 °, 5.13 °, 8.41 °, and 9.02 °, indicating a slightly shifted position towards lower angles than the pristine MOF. The X-ray diffraction (XRD) patterns of the crystalline powder validate the preservation of MIL-101(Cr) crystalline structure but with a slightly larger unit cell size, probably because of the incorporation of pyrimidinium salt derivatives during post-synthetic modification. The surface of MIL101–2AMP-DBrP and MIL101–2AMP-DBrEE nanocrystals was characterized by XPS analysis to determine the chemical composition and the chemical state information. The survey scans depicted in Fig. 3a confirmed the presence of O, C, N, Cr, and Br atoms. The nitrogen 1s spectrum (Fig. 3(b and c)) shows distinct peaks at 399.9 eV, corresponding to non-ionic nitrogen atoms such as the NH₂ group and nitrogen within the pyrimidinium ring, and at 400.7 eV, attributed to the positively charged nitrogen atom in the pyrimidinium ring. [51,66]. Moreover, the bromine 3d spectrum displayed peaks at 69.1/67.9 eV and 67.1/66.0 eV (Fig. 3d and e), aligning with the binding energies of bromide ions. This collective evidence strongly suggests the successful synthesis and integration of ionic liquids (2AMP-DBrP and 2AMP-DBrEE) into the MIL-101(Cr) framework. The thermal stability of MIL-101(Cr), MIL101–2AMP-DBrP, and MIL101–2AMP-DBrEE was investigated using the thermogravimetric analysis (TGA) under air flow of 20 mL/min, as shown in Fig. 4. The TGA curves display weight loss occurring in three steps for functionalized Cr-MOFs. The first thermal event occurred at temperatures ranging from 242 °C to 353 °C, with weight losses of 16.1 % for MIL101–2AMP-DBrP and 15.6 % for MIL101–2AMP-DBrEE, attributed to the degradation of 2AMP-DBrP and 2AMP-DBrEE, respectively. The second thermal event occurs at 353 °C, with weight losses of 56.1 % and 57.7 % for MIL101–2AMP-DBrP and MIL101–2AMP-DBrEE, respectively. The same thermal process was observed for MIL-101(Cr), with a weight loss of 63.3 %. This second process can be associated to the degradation of the terephthalate linkers. These results indicate that the MIL101–2AMP-DBrP and MIL101–2AMP-DBrEE composites exhibit thermal stability below 240 °C. The pristine and modified MIL-101(Cr) catalysts were examined to assess their morphology and chemical composition using SEM images and EDS data, which are presented in Fig. 5. As shown, the MIL-101(Cr) exhibits an octahedral shape with particles of uniform size ranging from 250 to 340 nm. Importantly, even after incorporating 2AMP-DBrP and 2AMP-DBrEE, the framework integrity remains well-preserved with uniform size ranging from 190 to 306 nm, highlighting MIL-101(Cr) skeleton stability. The decrease in particle size of MIL-101(Cr) upon incorporation of 2AMP-DBrP and 2AMP-DBrEE likely originates from the intrinsic flexibility of the MIL-101(Cr) framework, which is known to undergo a 'breathing effect' in response to guest molecule interactions. This effect can lead to structural contraction due to the interaction between the MOF and the ionic liquid, which induces partial framework shrinkage while maintaining structural integrity. Specifically, the centrifugation step applies mechanical energy, which can fragment larger particles into smaller ones. Additionally, mixing during the modification process further contributes to size reduction. The successful introduction of pyrimidinium salt derivatives into MIL-101(Cr) is confirmed by comparing the EDS spectra of MIL-101(Cr) and functionalized MIL-101(Cr) (Fig. S3-S5). To assess the textural properties of the prepared materials, N2 adsorption-desorption isotherms were conducted at 77 K for activated MIL-101(Cr), MIL101–2AMP-DBrP, and MIL101–2AMP-DBrEE, as displayed in Fig. 6a and summarized in Table 1. The nitrogen adsorption isotherms for all the pristine and functionalized MIL-101(Cr) were fully reversible, with sharp N2 uptake at low partial relative pressures (P/P0 > 0.9) corresponding to a typical type I isotherm as expected for a microporous MOF [67]. Furthermore, the isotherms displayed secondary uptakes between partial relative pressures (P/P0) of 0.1 and 0.2, implying the presence of two nanoporous windows. The BET surface area and pore volume of MIL-101(Cr) were calculated to be 3425 m2 g−1 and 1.78 cm3 g−1, respectively, which are consistent with the reported values [68–70]. However, the incorporation of pyrimidinum-based ILs into the pristine MIL-101(Cr) structure led to a reduction in the surface area and available pore volume in MIL101–2AMP-DBrP (to 2456 m2 g−1 and 1.44 cm3 g−1, respectively) and MIL101–2AMP-DBrEE (to 2408 m2 g−1 and 1.41 cm3 g−1, respectively), as anticipated [55,71]. The nonlocal density functional theory (NLDFT) was employed to calculate the pore size distribution (PSD). Fig. 6b illustrates the PSD results for pristine MIL-101(Cr), MIL101–2AMP-DBrP and MIL101–2AMP-DBrEE. These materials exhibit micropores and mesopores within the 10–25 Å range. The MIL101-MOFs demonstrated pore sizes at 14.1, 17.7, 20.2 Å, and 24.19 Å. Importantly, all samples have similar pore size nodes, suggesting that during functionalization, some micropores were filled while others remained empty. The CO2 adsorption capacities of MIL-101(Cr) (pristine MIL-101(Cr), MIL101–2AMP-DBrP, and MIL101–2AMP-DBrEE) were compared at 298 K and 273 K under 0.1 MPa, as shown in Fig. 7 and summarized in Table 1. The results indicate that the functionalized MIL-101(Cr) had improved CO2 adsorption compared to the pristine MIL-101(Cr) at both temperatures. Furthermore, the adsorption of CO2 increased as the temperature decreased, which can be explained by the exothermic adsorption on a clean surface. Under 0.1 MPa at 298 K, MIL-101(Cr), MIL101–2AMP-DBrP, and MIL101–2AMP-DBrEE adsorbed 2.64, 3.51, and 4.05 mmol g−1 of CO2, respectively. Similarly, at 273 K, the same adsorbents adsorbed 4.61, 5.27, and 6.35 mmol g−1 of CO2, respectively. These results suggest that loading pyrimidinium salt derivatives (2AMP-DBrP and 2AMP-DBrEE) increased CO2 adsorption, even though the porosity of the MOF decreased. This indicates a favorable interaction between CO2 and loaded 2-amino-pyrimidinium salt derivatives, the basic sites of which are beneficial for CO2 capture. Similar results have been reported with basic moieties such as PEI [68] and PANI [72]. Since the loading of 2AMP-DBrEE and 2AMP-DBrP is approximately the same (32 wt% - 33 wt%), the higher adsorbed amount of CO2 over MIL101–2AMP-DBrEE than over MIL101–2AMP-DBrP suggests that the rise in adsorption capacity is related to the oxygen on the ether linkage. 3.2 Catalytic performance The multifunctional impact of pyrimidinium ionic MIL-101(Cr) was evaluated by testing its performance in catalyzing the cycloaddition reaction of CO2 with epoxides without any solvent and co-catalyst. To produce chloropropene carbonate (CPC), 10 mmol of epichlorohydrin (ECH) was used as a model substrate, and the reaction was conducted at 90 °C and a CO2 pressure of 0.1 MPa. The results, summarized in Table 2, demonstrate that without a catalyst or in the presence of Cr(NO3)3, the desired product cannot be produced (entries 1 and 2). Under similar conditions, the pristine MIL-101(Cr) or ILs (2AMP-DBrP, 2AMP-DBrEE) presents a relatively low yield of 22 %, 45 % and 56 %, respectively (Table 2, entries 2–4). When a physical mixture of 2AMP-DBrP or 2AMP-DBrEE with either Cr(NO3)3 or MIL-101(Cr), keeping the molar concentration of bromide and metal site constant, yields of the desired product ranging from 77 % to 88 % were obtained (entries 6–9). However, MIL101–2AMP-DBrP and MIL101–2AMP-DBrEE exhibited outstanding catalytic performance in the cycloaddition reaction under 0.1 MPa at 90 °C for 12 h, yielding 96 % and 99 %, respectively (Table 2, entries 12 and 15). While the ligand and the MOF structure are both catalytically active, the efficiency of MIL101–2AMP-DBrP and MIL101–2AMP-DBrEE illustrates that the framework, multifunctional sites from pyrimidinium cation, bromide anion and the Lewis acid sites from MIL-101(Cr) can work synergistically to improve the catalytic activity. To compare the performance of the catalytic material with previously reported catalysts in CO₂ fixation reactions, the turnover frequency (TOF) is calculated based on the metal sites and the amount of halide ions (Br⁻) present in the ionic liquid (IL) functionalized MOF. The halide ions (Br⁻), acting as the active sites in the MOF structure, were determined using CHN analysis. Running the reaction for various reaction time (6 h, 12 h and 24 h) did show that there is a slight increase in TOF for catalyst MIL101–2AMP-DBrEE and the corresponding ionic liquid 2AMP-DBrEE (entries 5, 13–15) than for catalyst MIL101–2AMP- DBrP and corresponding MIL101–2AMP- DBrP (entries 4, 10–12). These results suggest that the presence of the ether moiety in the ionic liquid plays a positive role in catalysis, probably by increasing the interaction with CO2, as shown in the CO2 adsorption studies. To optimize the reaction conditions for synthesizing chloropropene carbonate (CPC), MIL101–2AMP-DBrEE was utilized at 0.1 MPa CO2 while varying the temperature and reaction time. Fig. 8a displays the effect of temperature, revealing that the apparent CPC yield after 24 h improved from 24 % to > 99 % as the temperature increased from 30 to 90 °C. Raising the temperature to 110 °C did not impact the yield of CPC. Additionally, Fig. 8b demonstrates that extending the reaction duration up to 12 h at 90 °C increased the CPC yield, but no notable alteration in the yield was observed upon further extending the reaction time. Ultimately, the ideal reaction conditions for the CO2 cycloaddition reaction were determined to be 90 °C, 0.1 MPa CO2, and 12 h. To ensure the reliability of the catalytic data, CO₂ fixation reactions were performed using epichlorohydrin with MIL101–2AMP-DBr on a gram scale. Specifically, 1.4 g (1.64 mmol) of MIL101–2AMP-DBrP and 350 mmol of epichlorohydrin were used under 0.1 MPa, at 90 °C, for 12 hours. The in situ FTIR analysis confirmed the formation of cyclic carbonate, as evidenced by the appearance of new peaks at 1801 cm⁻¹ (ν(CO)), 1160 cm⁻¹ (ν(OCO)), and 1070 cm⁻¹ (ν(C–O)). The reaction yielded 99 %, ensuring the reliability of the catalytic data. The performance of the two catalysts was explored using different epoxides under the optimized conditions determined for the carbonation of epichlorohydrin (0.47 mol% of MIL101–2AMP-DBrP and MIL101–2AMP-DBrEE, 0.1 MPa CO2, 90 °C, 12 h). For terminal epoxides without activating groups, catalytic data for propylene oxide are presented, demonstrating the system's efficiency for these challenging substrates. The inclusion of additional epoxides such as ethylene oxide was not feasible due to safety or resource constraints ( Table 3, entries 1 and 2). As can be seen in Table 3, terminal epoxides bearing both electron-withdrawing and electron-donating groups can be transformed into their respective cyclic carbonates with elevated yields of > 94 % for MIL101–2AMP-DBrEE and > 92 % for MIL101–2AMP-DBrP within 12 h, at a temperature of 90 °C and under 0.1 MPa CO2 pressure (entries 3–6). However, for internal cyclohexene oxide, the conversion remains limited. The lower conversion of cyclohexene oxide in CO2 fixation reactions compared to terminal epoxides is due to several key factors. First, steric hindrance from its cyclic structure reduces access to the catalyst's active sites, unlike terminal epoxides, which have more open structures. Additionally, cyclohexene oxide has lower ring strain, making the epoxide ring less reactive and harder to open compared to terminal epoxides. Its electronic properties also contribute to reduced reactivity, as it lacks strong electron-withdrawing groups that can stabilize intermediates. Finally, diffusion limitations may arise due to its bulkier nature, making it harder for cyclohexene oxide to reach the active sites, particularly in porous catalysts like MOFs [34,47,73]. To further identify the potential of the MIL101–2AMP-DBrP and MIL101–2AMP-DBrEE for the synthesis of cyclic carbonates, their catalytic activity was compared with that of previously documented IL-supported MIL-101(Cr) and other typical MOF materials in the CO2 fixation reaction with epichlorohydrin. The comparative data are presented in Table 4, with the TOF values determined based on the molar ratio of epoxide to halide. As shown in Table 4, the cyclic carbonate can be effectively produced using MIL-101-tzmOH-Br and PolyIL@MIL-101 catalysts, achieving a favorable yield even at moderately mild reaction temperatures (80 and 70 °C) and low-pressure conditions (0.1 MPa). However, these reactions exhibited noticeably reduced TOF values (as shown in entries 12–15, Table 4) [74,75]. Several imidazolium and guanidinium-based IL functionalized UiO-66, UiO-67 and FJI-C10 were also used in this catalytic transformation [27,47,76–79]. Under almost the same conditions, MIL101–2AMP-DBrP and MIL101–2AMP-DBrEE demonstrated significantly higher catalytic activity compared to FJI-C10 and UiO67-IL (entries 3 and 9, Table 4). Similarly, UiO67-[TBD]+Br-, (I-)Meim-UiO-66, UiO66Pym-MeI and UiO67BPym-MeI required longer time for the conversion of epichlorohydrin (ECH) into the corresponding cyclic carbonate (entries 1, 2, 4 and 5, Table 4). The comparison suggested that MIL101–2AMP-DBrP and MIL101–2AMP-DBrEE have significantly higher catalytic activity, by almost an order of magnitude, under mild conditions (0.1 MPa, 90 °C, 12 h, without solvent and co-catalyst). 3.3 Reusability of the MIL101-2AMP-DBrEE The stability and recyclability of heterogeneous catalysts are fundamental features that are indispensable for their use in industrial applications. The reusability of MIL101–2AMP-DBrEE was evaluated by examining its ability to catalyze the cycloaddition reaction of CO2 with epichlorohydrin under optimal reaction conditions for 5 catalytic cycles. After each cycle, the reaction mixture was extracted with CDCl3 (3 mL) and the solid catalyst was recovered by centrifugation, washed with ethanol (3 × 10 mL), and dried at 90 °C for 12 h before being reused under similar reaction conditions. The results, illustrated in Fig. 9a, indicate that the catalyst retains its activity and remains stable even after 5 catalytic cycles, with yields and conversion being consistent throughout. Furthermore, comparison of the PXRD analysis of the fresh and reused samples showed a similar pattern, demonstrating the stability of MIL101–2AMP-DBrEE (Fig. 9b). To determine whether homogenous catalysis was involved, a leaching test was carried out during the first run. After 3 h, the catalytic CO2 fixation reaction was halted, and MIL101–2AMP-DBrEE was isolated from the reaction mixture. The filtrate was then agitated for an additional 12 h, and the filtrate showed no indication of any progress in the CO2 fixation reaction after 12 h. To confirm the stable encapsulation of the dicationic ionic liquid following the CO2 cycloaddition reaction, we also conducted elemental analysis. The recycled MIL101–2AMP-DBrEE exhibited a N element content of 3.11 wt%, which closely resembled the fresh catalyst's value of 3.17 wt%. These results suggest that there was almost no leaching of MIL101–2AMP-DBrEE nanocages over 5 reaction cycles. The obtained characterization results clearly demonstrate the encapsulation of the ionic liquid 2AMP-DBrEE within the MIL-101(Cr) nanocages, highlighting its stable confinement and confirming the heterogeneous nature of the reaction and its promising implications. To gain a deeper insight into the reaction mechanism, the CO2 fixation reaction with epichlorohydrin using 2AMP-DBrP as catalyst was monitored using in situ FTIR for 5 h at 90 °C and 0.1 MPa ( Fig. 10). As depicted in the Fig. 10a, the formation of cyclic carbonate is evidenced by the formation of new peaks at 1801 cm−1 (ν(CO)), 1160 cm−1 (ν(OCO)), and at 1070 cm−1 (ν(C–O)), which are well-matched with the spectrum of chloropropene carbonate in Fig. 10b [79,80]. To interpret the data accurately, the peak at 1801 cm−1 was deconvoluted into distinct peaks using Gaussian function as fitting model. Following this process, a new peak emerges at 1762 cm−1, indicating the formation of a new COOH group resulting from the interaction of CO2 with the primary amine of 2AMP-DBrP, which gradually increases during the reaction, suggesting the generation of carbamic acid. Notably, both the absorption peaks associated with the carbonyl group at 1762 cm−1, indicative of carbamic acid, and the peak at 1801 cm−1, associated with chloropropene carbonate, exhibit a gradual increase over the reaction time. This observation suggests the activation of CO2 by the primary amino group in the ionic liquid, thereby significantly enhancing the CO2 fixation reaction with epoxide. 3.4 Possible reaction mechanism According to the experimental evidence from in situ FTIR studies, catalytic data for various substrates (including terminal epoxide such as propylene oxide), structural features of MIL101–2AMP-DBrP, as well as previous reports [73,79,81], a mechanism for the cycloaddition of CO2 to epoxides over MIL101–2AMP-DBrP is proposed in Scheme 2. First, the primary amino groups in the pyrimidinium moiety of MIL101–2AMP-DBrP act as nitrogen-donor Lewis basic sites and coordinate to CO2 to afford the carbamic acid as an activated form of CO2 (a). As shown in the CO2 adsorption studies, the enhancement of CO2 capture within the MIL101–2AMP-DBrP framework results in an increased concentration of carbon dioxide within the porous structure [82]. Simultaneously, activation of the epoxide may occur through hydrogen bonding between the epoxide oxygen and the carbamic acid. The epoxide is further activated via coordination of its oxygen atom to the Lewis acid sites of Cr in MIL-101(Cr). The bromide anion (Br⁻) can then do a nucleophilic attack on the less sterically hindered carbon atom of the epoxide to open it, forming a bromoalcohol (b). Next, a hydrogen transfer from the alcohol to the nitrogen atom of 2AMP-DBrP is occurring as the alcoholate interacts with the CO2 of the carbamic moiety to generate the bromoalkylcarbonate anion (c). In the final step, an intramolecular ring-closing reaction occurs, leading to the formation of the cyclic carbonate product and the regeneration of MIL101–2AMP-DBrP catalyst (e), allowing it to be used again in the next catalytic cycle. The proposed mechanism, supported by consistent catalytic trends observed across various substrates, highlights its broad applicability. However, due to technical limitations, in situ FTIR measurements for more volatile substrates, such as propylene oxide, could not be performed. 4 Conclusion In summary, MIL-101(Cr) was utilized to encapsulate new ionic pyrimidinium salts via a ship-in-bottle synthetic method, marking a significant advancement in CO₂ conversion with an innovative and efficient catalyst design. The resulting modified MOFs, MIL101–2AMP-DBrP and MIL101–2AMP-DBrEE, exhibited enhanced CO2 adsorption at low pressures and demonstrated superior catalytic capabilities for CO2 conversion with various epoxides. Notably, these MOFs achieve a high turnover frequency (TOF) of 82.5 h⁻¹ under mild conditions (atmospheric pressure, 90 °C), without the need for co-catalysts or solvents, which are important criteria for the commercialization of such catalyst for industrial applications. The presence of bromide ions and hydrogen bonding within the pore structure facilitated epoxide ring opening, enhancing catalytic efficiency. In situ FTIR analysis revealed that primary amino groups activated CO₂ through carbamic acid formation, while the ionic liquid increased the density of CO2 in the vicinity of active sites. Additionally, the ether group slightly boosted activity, aiding CO₂ activation at atmospheric pressure. Furthermore, MIL-101–2AMP-DBrEE demonstrated excellent durability and ease of separation during repeated CO₂ cycloaddition cycles. This innovative approach holds promise for developing new and efficient catalysts for CO₂ utilization in various industrial applications. CRediT authorship contribution statement Frederic-Georges Fontaine: Writing – review & editing, Supervision, Project administration, Funding acquisition, Conceptualization. Seyedeh Molood Masoom Nataj: Writing – original draft, Methodology, Data curation, Conceptualization. Serge Kaliaguine: Writing – review & editing, Supervision, Project administration, Funding acquisition, Conceptualization. Declaration of Competing Interest The authors declare the following financial interests/personal relationships which may be considered as potential competing interests: Frederic-Georges Fontaine reports financial support was provided by Natural Sciences and Engineering Research Council of Canada. Serge Kaliaguine reports financial support was provided by Natural Sciences and Engineering Research Council of Canada. If there are other authors, they declare that they have no known competing financial interests or personal relationships that could have appeared to influence the work reported in this paper Acknowledgement The authors acknowledge the joint financial support of Natural Science and Engineering Council (NSERC), Consortium de Recherche en Biotechnologie Industrielle du Québec (CRIBIQ) and SOPREMA (Drummondville). The Centre for Innovation and Research on Carbon Utilization in Industrial Technologies (CIRCUIT) is also acknowledged. We also acknowledge the support of the Canada Research Chair in Green Catalysis and Metal-Free Processes. Supporting Information The Supporting Information is attached to this manuscript. It contains the EDS spectra of synthesized MIL-101(Cr), MIL101–2AMP-DBrP and MIL101–2AMP-DBrEE, and 1H NMR analysis of CO2 fixation reaction with different epoxides. Appendix A Supporting information Supplementary data associated with this article can be found in the online version at doi:10.1016/j.apcata.2025.120186. Appendix A Supplementary material Supplementary material References [1] M. Aresta A. Dibenedetto A. Angelini Catalysis for the valorization of exhaust carbon: from CO2 to chemicals, materials, and fuels. technological use of CO2 Chem. Rev. 114 2014 1709 1742 10.1021/cr4002758 M. Aresta, A. Dibenedetto, A. Angelini, Catalysis for the valorization of exhaust carbon: From CO2 to chemicals, materials, and fuels. technological use of CO2, Chem. Rev. 114 (2014) 1709–1742. https://doi.org/10.1021/cr4002758. [2] G. Centi E.A. Quadrelli S. Perathoner Catalysis for CO2 conversion: a key technology for rapid introduction of renewable energy in the value chain of chemical industries Energy Environ. Sci. 6 2013 1711 1731 10.1039/c3ee00056g G. Centi, E.A. Quadrelli, S. Perathoner, Catalysis for CO2 conversion: A key technology for rapid introduction of renewable energy in the value chain of chemical industries, Energy Environ. Sci. 6 (2013) 1711–1731. https://doi.org/10.1039/c3ee00056g. [3] J. Hu J. Ma Q. Zhu Q. Qian H. Han Q. Mei B. Han Zinc (II)-catalyzed reactions of carbon dioxide and propargylic alcohols to carbonates at room temperature Green Chem. 18 2016 382 385 10.1039/c5gc01870f J. Hu, J. Ma, Q. Zhu, Q. Qian, H. Han, Q. Mei, B. Han, Zinc (II)-catalyzed reactions of carbon dioxide and propargylic alcohols to carbonates at room temperature, Green Chem. 18 (2016) 382–385. https://doi.org/10.1039/c5gc01870f. [4] J. Hu J. Ma Q. Zhu Z. Zhang C. Wu B. Han Transformation of atmospheric CO2 catalyzed by protic ionic liquids: efficient synthesis of 2-oxazolidinones Angew. Chem. 127 2015 5489 5493 10.1002/ange.201411969 J. Hu, J. Ma, Q. Zhu, Z. Zhang, C. Wu, B. Han, Transformation of Atmospheric CO2 Catalyzed by Protic Ionic Liquids: Efficient Synthesis of 2-Oxazolidinones, Angew. Chem. 127 (2015) 5489–5493. https://doi.org/10.1002/ange.201411969. [5] S. Wesselbaum V. Moha M. Meuresch S. Brosinski K.M. Thenert J. Kothe T.Vom Stein U. Englert M. Hölscher J. Klankermayer W. Leitner Hydrogenation of carbon dioxide to methanol using a homogeneous ruthenium-triphos catalyst: from mechanistic investigations to multiphase catalysis Chem. Sci. 6 2015 693 704 10.1039/c4sc02087a S. Wesselbaum, V. Moha, M. Meuresch, S. Brosinski, K.M. Thenert, J. Kothe, T.Vom Stein, U. Englert, M. Hölscher, J. Klankermayer, W. Leitner, Hydrogenation of carbon dioxide to methanol using a homogeneous ruthenium-Triphos catalyst: From mechanistic investigations to multiphase catalysis, Chem. Sci. 6 (2015) 693–704. https://doi.org/10.1039/c4sc02087a. [6] A. Goeppert M. Czaun J.P. Jones G.K. Surya Prakash G.A. Olah Recycling of carbon dioxide to methanol and derived products-closing the loop Chem. Soc. Rev. 43 2014 7995 8048 10.1039/c4cs00122b A. Goeppert, M. Czaun, J.P. Jones, G.K. Surya Prakash, G.A. Olah, Recycling of carbon dioxide to methanol and derived products-closing the loop, Chem. Soc. Rev. 43 (2014) 7995–8048. https://doi.org/10.1039/c4cs00122b. [7] J. Artz T.E. Müller K. Thenert J. Kleinekorte R. Meys A. Sternberg A. Bardow W. Leitner Sustainable conversion of carbon dioxide: an integrated review of catalysis and life cycle assessment Chem. Rev. 118 2018 434 504 10.1021/acs.chemrev.7b00435 J. Artz, T.E. Müller, K. Thenert, J. Kleinekorte, R. Meys, A. Sternberg, A. Bardow, W. Leitner, Sustainable Conversion of Carbon Dioxide: An Integrated Review of Catalysis and Life Cycle Assessment, Chem. Rev. 118 (2018) 434–504. https://doi.org/10.1021/acs.chemrev.7b00435. [8] Q.W. Song W.Q. Chen R. Ma A. Yu Q.Y. Li Y. Chang L.N. He Bifunctional silver(I) complex-catalyzed CO2 conversion at ambient conditions: synthesis of α-methylene cyclic carbonates and derivatives ChemSusChem 8 2015 821 827 10.1002/cssc.201402921 Q.W. Song, W.Q. Chen, R. Ma, A. Yu, Q.Y. Li, Y. Chang, L.N. He, Bifunctional silver(I) complex-catalyzed CO2 conversion at ambient conditions: Synthesis of α-methylene cyclic carbonates and derivatives, ChemSusChem 8 (2015) 821–827. https://doi.org/10.1002/cssc.201402921. [9] M.Y. Wang Q.W. Song R. Ma J.N. Xie L.N. He Efficient conversion of carbon dioxide at atmospheric pressure to 2-oxazolidinones promoted by bifunctional Cu(ii)-substituted polyoxometalate-based ionic liquids Green Chem. 18 2015 282 287 10.1039/c5gc02311d M.Y. Wang, Q.W. Song, R. Ma, J.N. Xie, L.N. He, Efficient conversion of carbon dioxide at atmospheric pressure to 2-oxazolidinones promoted by bifunctional Cu(ii)-substituted polyoxometalate-based ionic liquids, Green Chem. 18 (2015) 282–287. https://doi.org/10.1039/c5gc02311d. [10] X.D. Lang L.N. He Green catalytic process for cyclic carbonate synthesis from carbon dioxide under mild conditions Chem. Rec. 2016 1337 1352 10.1002/tcr.201500293 X.D. Lang, L.N. He, Green Catalytic Process for Cyclic Carbonate Synthesis from Carbon Dioxide under Mild Conditions, Chem. Rec. (2016) 1337–1352. https://doi.org/10.1002/tcr.201500293. [11] J. Xuan X.K. He W.J. Xiao Visible light-promoted ring-opening functionalization of three-membered carbo- And heterocycles Chem. Soc. Rev. 49 2020 2546 2556 10.1039/c9cs00523d J. Xuan, X.K. He, W.J. Xiao, Visible light-promoted ring-opening functionalization of three-membered carbo- And heterocycles, Chem. Soc. Rev. 49 (2020) 2546–2556. https://doi.org/10.1039/c9cs00523d. [12] J. Lynch M. Cain D. Frame R. Pierrehumbert Agriculture’s contribution to climate change and role in mitigation is distinct from predominantly fossil CO2-emitting sectors Front. Sustain. Food Syst. 4 2021 10.3389/fsufs.2020.518039 J. Lynch, M. Cain, D. Frame, R. Pierrehumbert, Agriculture’s Contribution to Climate Change and Role in Mitigation Is Distinct From Predominantly Fossil CO2-Emitting Sectors, Front. Sustainable Food Syst. 4 (2021). https://doi.org/10.3389/fsufs.2020.518039. [13] M. North R. Pasquale C. Young Synthesis of cyclic carbonates from epoxides and CO2 Green. Chem. 12 2010 1514 1539 10.1039/c0gc00065e M. North, R. Pasquale, C. Young, Synthesis of cyclic carbonates from epoxides and CO2, Green Chem. 12 (2010) 1514–1539. https://doi.org/10.1039/c0gc00065e. [14] Y. Liu W.M. Ren K.K. He W.Z. Zhang W.B. Li M. Wang X.B. Lu CO2-Mediated Formation of Chiral Carbamates from meso-Epoxides via Polycarbonate Intermediates J. Org. Chem. 81 2016 8959 8966 10.1021/acs.joc.6b01616 Y. Liu, W.M. Ren, K.K. He, W.Z. Zhang, W.B. Li, M. Wang, X.B. Lu, CO2-Mediated Formation of Chiral Carbamates from meso-Epoxides via Polycarbonate Intermediates, J. Org. Chem. 81 (2016) 8959–8966. https://doi.org/10.1021/acs.joc.6b01616. [15] S.A.A. Razavi A. Morsali Linker functionalized metal-organic frameworks Coord. Chem. Rev. 399 2019 213023 10.1016/j.ccr.2019.213023 S.A. A. Razavi, A. Morsali, Linker functionalized metal-organic frameworks, Coord. Chem. Rev. 399 (2019) 213023. https://doi.org/10.1016/j.ccr.2019.213023. [16] Z. Sharifzadeh S.A.A. Razavi A. Morsali Construction of hierarchically chiral metal-organic frameworks for fast and mild asymmetric catalysis Green Chem. 25 2023 8661 8678 10.1039/d3gc02521g Z. Sharifzadeh, S.A.A. Razavi, A. Morsali, Construction of hierarchically chiral metal-organic frameworks for fast and mild asymmetric catalysis, Green Chemistry 25 (2023) 8661–8678. https://doi.org/10.1039/d3gc02521g. [17] C. Férey C. Mellot-Draznieks C. Serre F. Millange J. Dutour S. Surblé I. Margiolaki A chromium terephthalate-based solid with unusually large pore volumes and surface area Science 309 2005 2040 2042 10.1126/science.1116275 C. Férey, C. Mellot-Draznieks, C. Serre, F. Millange, J. Dutour, S. Surblé, I. Margiolaki, A chromium terephthalate-based solid with unusually large pore volumes and surface area, Science 309 (2005) 2040–2042. https://doi.org/10.1126/science.1116275. [18] M.Y. Zorainy M. Gar Alalm S. Kaliaguine D.C. Boffito Revisiting the MIL-101 metal-organic framework: design, synthesis, modifications, advances, and recent applications J. Mater. Chem. A 9 2021 22159 22217 10.1039/d1ta06238g M.Y. Zorainy, M. Gar Alalm, S. Kaliaguine, D.C. Boffito, Revisiting the MIL-101 metal-organic framework: design, synthesis, modifications, advances, and recent applications, J. Mater. Chem. A 9 (2021) 22159–22217. https://doi.org/10.1039/d1ta06238g. [19] L. Li J. He Y. Wang X. Lv X. Gu P. Dai D. Liu X. Zhao Metal-organic frameworks: a promising platform for constructing non-noble electrocatalysts for the oxygen-reduction reaction J. Mater. Chem. A 7 2019 1964 1988 10.1039/c8ta11704g L. Li, J. He, Y. Wang, X. Lv, X. Gu, P. Dai, D. Liu, X. Zhao, Metal-organic frameworks: a promising platform for constructing non-noble electrocatalysts for the oxygen-reduction reaction, J. Mater. Chem. A 7 (2019) 1964–1988. https://doi.org/10.1039/c8ta11704g. [20] F. Zadehahmadi F. Ahmadi S. Tangestaninejad M. Moghadam V. Mirkhani I. Mohammadpoor-Baltork R. Kardanpour Catalytic CO2 fixation using tin porphyrin supported on organic and inorganic materials under mild conditions J. Mol. Catal. A Chem. 398 2015 1 10 10.1016/j.molcata.2014.10.030 F. Zadehahmadi, F. Ahmadi, S. Tangestaninejad, M. Moghadam, V. Mirkhani, I. Mohammadpoor-Baltork, R. Kardanpour, Catalytic CO2 fixation using tin porphyrin supported on organic and inorganic materials under mild conditions, J. Mol. Catal. A Chem. 398 (2015) 1–10. https://doi.org/10.1016/j.molcata.2014.10.030. [21] R. Kardanpour S. Tangestaninejad V. Mirkhani M. Moghadam I. Mohammadpoor-Baltork F. Zadehahmadi Efficient alkene epoxidation catalyzed by molybdenyl acetylacetonate supported on aminated UiO-66 metal-organic framework J. Solid State Chem. 226 2015 262 272 10.1016/j.jssc.2014.11.020 R. Kardanpour, S. Tangestaninejad, V. Mirkhani, M. Moghadam, I. Mohammadpoor-Baltork, F. Zadehahmadi, Efficient alkene epoxidation catalyzed by molybdenyl acetylacetonate supported on aminated UiO-66 metal-organic framework, J. Solid State Chem. 226 (2015) 262–272. https://doi.org/10.1016/j.jssc.2014.11.020. [22] C.M. Miralda E.E. MacIas M. Zhu P. Ratnasamy M.A. Carreon Zeolitic imidazole framework-8 catalysts in the conversion of CO2 to chloropropene carbonate ACS Catal. 2 2012 180 183 10.1021/cs200638h C.M. Miralda, E.E. MacIas, M. Zhu, P. Ratnasamy, M.A. Carreon, Zeolitic imidazole framework-8 catalysts in the conversion of CO2 to chloropropene carbonate, ACS Catal. 2 (2012) 180–183. https://doi.org/10.1021/cs200638h. [23] H.Y. Cho D.A. Yang J. Kim S.Y. Jeong W.S. Ahn CO2 adsorption and catalytic application of Co-MOF-74 synthesized by microwave heating Catal. Today 185 2012 35 40 10.1016/j.cattod.2011.08.019 H.Y. Cho, D.A. Yang, J. Kim, S.Y. Jeong, W.S. Ahn, CO2 adsorption and catalytic application of Co-MOF-74 synthesized by microwave heating, Catal. Today 185 (2012) 35–40. https://doi.org/10.1016/j.cattod.2011.08.019. [24] S.N. Ansari P. Kumar A.K. Gupta P. Mathur S.M. Mobin Catalytic CO2 fixation over a robust lactam-functionalized Cu(II) metal organic framework Inorg. Chem. 58 2019 9723 9732 10.1021/acs.inorgchem.9b00684 S.N. Ansari, P. Kumar, A.K. Gupta, P. Mathur, S.M. Mobin, Catalytic CO2 Fixation over a Robust Lactam-Functionalized Cu(II) Metal Organic Framework, Inorg. Chem. 58 (2019) 9723–9732. https://doi.org/10.1021/acs.inorgchem.9b00684. [25] X.H. Ji N.N. Zhu J.G. Ma P. Cheng Conversion of CO2 into cyclic carbonates by a Co(ii) metal-organic framework and the improvement of catalytic activity: via nanocrystallization Dalton Trans. 47 2018 1768 1771 10.1039/c7dt04882c X.H. Ji, N.N. Zhu, J.G. Ma, P. Cheng, Conversion of CO2 into cyclic carbonates by a Co(ii) metal-organic framework and the improvement of catalytic activity: Via nanocrystallization, Dalton Trans. 47 (2018) 1768–1771. https://doi.org/10.1039/c7dt04882c. [26] J. Tharun K.M. Bhin R. Roshan D.W. Kim A.C. Kathalikkattil R. Babu H.Y. Ahn Y.S. Won D.W. Park Ionic liquid tethered post functionalized ZIF-90 framework for the cycloaddition of propylene oxide and CO2 Green Chem. 18 2016 2479 2487 10.1039/c5gc02153g J. Tharun, K.M. Bhin, R. Roshan, D.W. Kim, A.C. Kathalikkattil, R. Babu, H.Y. Ahn, Y.S. Won, D.W. Park, Ionic liquid tethered post functionalized ZIF-90 framework for the cycloaddition of propylene oxide and CO2, Green Chem. 18 (2016) 2479–2487. https://doi.org/10.1039/c5gc02153g. [27] L.G. Ding B.J. Yao W.L. Jiang J.T. Li Q.J. Fu Y.A. Li Z.H. Liu J.P. Ma Y.Bin Dong Bifunctional imidazolium-based ionic liquid decorated UiO-67 Type MOF for selective CO2 adsorption and catalytic property for CO2 cycloaddition with epoxides Inorg. Chem. 56 2017 2337 2344 10.1021/acs.inorgchem.6b03169 L.G. Ding, B.J. Yao, W.L. Jiang, J.T. Li, Q.J. Fu, Y.A. Li, Z.H. Liu, J.P. Ma, Y.Bin Dong, Bifunctional Imidazolium-Based Ionic Liquid Decorated UiO-67 Type MOF for Selective CO2 Adsorption and Catalytic Property for CO2 Cycloaddition with Epoxides, Inorg. Chem. 56 (2017) 2337–2344. https://doi.org/10.1021/acs.inorgchem.6b03169. [28] Y. Sun H. Huang H. Vardhan B. Aguila C. Zhong J.A. Perman A.M. Al-Enizi A. Nafady S. Ma Facile approach to graft ionic liquid into MOF for improving the efficiency of CO2 chemical fixation ACS Appl. Mater. Interfaces 10 2018 27124 27130 10.1021/acsami.8b08914 Y. Sun, H. Huang, H. Vardhan, B. Aguila, C. Zhong, J.A. Perman, A.M. Al-Enizi, A. Nafady, S. Ma, Facile Approach to Graft Ionic Liquid into MOF for Improving the Efficiency of CO2 Chemical Fixation, ACS Appl. Mater. Interfaces 10 (2018) 27124–27130. https://doi.org/10.1021/acsami.8b08914. [29] Z. Sharifzadeh A. Morsali Defect engineering enables synergistic action of hierarchical porosity and multifunctionality for efficient catalysis of diverse reactions Appl. Mater. Today 35 2023 101971 10.1016/j.apmt.2023.101971 Z. Sharifzadeh, A. Morsali, Defect engineering enables synergistic action of hierarchical porosity and multifunctionality for efficient catalysis of diverse reactions, Appl. Mater. Today 35 (2023) 101971. https://doi.org/10.1016/j.apmt.2023.101971. [30] M.M. Dharman H.J. Choi D.W. Kim D.W. Park Synthesis of cyclic carbonate through microwave irradiation using silica-supported ionic liquids: effect of variation in the silica support Catal. Today 164 2011 544 547 10.1016/j.cattod.2010.11.009 M.M. Dharman, H.J. Choi, D.W. Kim, D.W. Park, Synthesis of cyclic carbonate through microwave irradiation using silica-supported ionic liquids: Effect of variation in the silica support, Catal. Today 164 (2011) 544–547. https://doi.org/10.1016/j.cattod.2010.11.009. [31] M.V. Zakharova F. Kleitz F.G. Fontaine Carbon dioxide oversolubility in nanoconfined liquids for the synthesis of cyclic carbonates ChemCatChem 9 2017 1886 1890 10.1002/cctc.201700247 M.V. Zakharova, F. Kleitz, F.G. Fontaine, Carbon Dioxide Oversolubility in Nanoconfined Liquids for the Synthesis of Cyclic Carbonates, ChemCatChem 9 (2017) 1886–1890. https://doi.org/10.1002/cctc.201700247. [32] S. Boroun A.A. Sahraei A.H. Mokarizadeh H. Alamdari F.G. Fontaine F. Larachi Insights into the solubility of carbon dioxide in grafted mesoporous silica for the catalytic synthesis of cyclic carbonates by nanoconfinement ACS Appl. Mater. Interfaces 13 2021 27019 27028 10.1021/acsami.1c04620 S. Boroun, A.A. Sahraei, A.H. Mokarizadeh, H. Alamdari, F.G. Fontaine, F. Larachi, Insights into the Solubility of Carbon Dioxide in Grafted Mesoporous Silica for the Catalytic Synthesis of Cyclic Carbonates by Nanoconfinement, ACS Appl. Mater. Interfaces 13 (2021) 27019–27028. https://doi.org/10.1021/acsami.1c04620. [33] J. Sun J. Wang W. Cheng J. Zhang X. Li S. Zhang Y. She Chitosan functionalized ionic liquid as a recyclable biopolymer-supported catalyst for cycloaddition of CO2 Green Chem. 14 2012 654 660 10.1039/c2gc16335g J. Sun, J. Wang, W. Cheng, J. Zhang, X. Li, S. Zhang, Y. She, Chitosan functionalized ionic liquid as a recyclable biopolymer-supported catalyst for cycloaddition of CO2, Green Chem. 14 (2012) 654–660. https://doi.org/10.1039/c2gc16335g. [34] Y. Wang J. Nie C. Lu F. Wang C. Ma Z. Chen G. Yang Imidazolium-based polymeric ionic liquids for heterogeneous catalytic conversion of CO2 into cyclic carbonates Microporous Mesoporous Mater. 292 2020 109751 10.1016/j.micromeso Y. Wang, J. Nie, C. Lu, F. Wang, C. Ma, Z. Chen, G. Yang, Imidazolium-based polymeric ionic liquids for heterogeneous catalytic conversion of CO2 into cyclic carbonates, Microporous and Mesoporous Mater. 292 (2020) 109751. https://doi.org/10.1016/j.micromeso. [35] X. Zheng S. Luo L. Zhang J.P. Cheng Magnetic nanoparticle supported ionic liquid catalysts for CO2 cycloaddition reactions Green Chem. 11 2009 10.1039/b823123k 455-45 X. Zheng, S. Luo, L. Zhang, J.P. Cheng, Magnetic nanoparticle supported ionic liquid catalysts for CO2 cycloaddition reactions, Green Chem. 11 (2009) 455-45. https://doi.org/10.1039/b823123k. [36] L. Han H. Li S.J. Choi M.S. Park S.M. Lee Y.J. Kim D.W. Park Ionic liquids grafted on carbon nanotubes as highly efficient heterogeneous catalysts for the synthesis of cyclic carbonates Appl. Catal. A Gen. 430 2012 67 72 10.1016/j.apcata L. Han, H. Li, S.J. Choi, M.S. Park, S.M. Lee, Y.J. Kim, D.W. Park, Ionic liquids grafted on carbon nanotubes as highly efficient heterogeneous catalysts for the synthesis of cyclic carbonates, Appl. Catal. A Gen. 430 (2012) 67–72. https://doi.org/10.1016/j.apcata. [37] Y. Liu J. Li Z. Zhang Y. Hou L. Wang J. Zhang Hydroxyl-imidazolium ionic liquid-functionalized MIL-101(Cr): a bifunctional and highly efficient catalyst for the conversion of CO2 to styrene carbonate Inorg. Chem. 61 2022 17438 17447 10.1021/acs.inorgchem.2c02156 Y. Liu, J. Li, Z. Zhang, Y. Hou, L. Wang, J. Zhang, Hydroxyl-Imidazolium Ionic Liquid-Functionalized MIL-101(Cr): A Bifunctional and Highly Efficient Catalyst for the Conversion of CO2 to Styrene Carbonate, Inorg. Chem. 61 (2022) 17438–17447. https://doi.org/10.1021/acs.inorgchem.2c02156. [38] Y. Liu Y. Hu J. Zhou Z. Zhu Z. Zhang Y. Li L. Wang J. Zhang Polystyrene-supported novel imidazolium ionic liquids: highly efficient catalyst for the fixation of carbon dioxide under atmospheric pressure Fuel 305 2021 10.1016/j.fuel.2021.121495 Y. Liu, Y. Hu, J. Zhou, Z. Zhu, Z. Zhang, Y. Li, L. Wang, J. Zhang, Polystyrene-Supported Novel Imidazolium Ionic Liquids: Highly Efficient Catalyst for the Fixation of Carbon Dioxide under Atmospheric Pressure, Fuel 305 (2021). https://doi.org/10.1016/j.fuel.2021.121495. [39] T. Wang D. Zheng J. Zhang B. Fan Y. Ma T. Ren L. Wang J. Zhang Protic pyrazolium ionic liquids: an efficient catalyst for conversion of CO2 in the absence of metal and solvent ACS Sustain. Chem. Eng. 6 2018 2574 2582 10.1021/acssuschemeng.7b04051 T. Wang, D. Zheng, J. Zhang, B. Fan, Y. Ma, T. Ren, L. Wang, J. Zhang, Protic Pyrazolium Ionic Liquids: An Efficient Catalyst for Conversion of CO2 in the Absence of Metal and Solvent, ACS Sustain. Chem. Eng. 6 (2018) 2574–2582. https://doi.org/10.1021/acssuschemeng.7b04051. [40] T. Wang D. Zheng B. An Y. Liu T. Ren H. Ågren L. Wang J. Zhang M.S.G. Ahlquist Dual-ionic imidazolium salts to promote synthesis of cyclic carbonates at atmospheric pressure Green Energy Environ. 7 2022 1327 1339 10.1016/j.gee.2021.02.011 T. Wang, D. Zheng, B. An, Y. Liu, T. Ren, H. Ågren, L. Wang, J. Zhang, M.S.G. Ahlquist, Dual-Ionic Imidazolium Salts to Promote Synthesis of Cyclic Carbonates at Atmospheric Pressure, Green Energy Environ. 7 (2022) 1327–1339. https://doi.org/10.1016/j.gee.2021.02.011. [41] Y. Zhou S. Hu X. Ma S. Liang T. Jiang B. Han Synthesis of cyclic carbonates from carbon dioxide and epoxides over betaine-based catalysts J. Mol. Catal. A Chem. 284 2008 52 57 10.1016/j.molcata.2008.01.010 Y. Zhou, S. Hu, X. Ma, S. Liang, T. Jiang, B. Han, Synthesis of cyclic carbonates from carbon dioxide and epoxides over betaine-based catalysts, J. Mol. Catal. A Chem. 284 (2008) 52–57. https://doi.org/10.1016/j.molcata.2008.01.010. [42] F. Li L. Xiao C. Xia B. Hu Chemical fixation of CO2 with highly efficient ZnCl 2/[BMIm]Br catalyst system Tetrahedron Lett. 45 2004 8307 8310 10.1016/j.tetlet.2004.09.074 F. Li, L. Xiao, C. Xia, B. Hu, Chemical fixation of CO2 with highly efficient ZnCl 2/[BMIm]Br catalyst system, Tetrahedron Lett. 45 (2004) 8307–8310. https://doi.org/10.1016/j.tetlet.2004.09.074. [43] J. Sun L. Han W. Cheng J. Wang X. Zhang S. Zhang Efficient acid-base bifunctional catalysts for the fixation of CO2 with epoxides under metal- and solvent-free conditions ChemSusChem 4 2011 502 507 10.1002/cssc.201000305 J. Sun, L. Han, W. Cheng, J. Wang, X. Zhang, S. Zhang, Efficient acid-base bifunctional catalysts for the fixation of CO2 with epoxides under metal- and solvent-free conditions, ChemSusChem 4 (2011) 502–507. https://doi.org/10.1002/cssc.201000305. [44] J. Sun S. Zhang W. Cheng J. Ren Hydroxyl-functionalized ionic liquid: a novel efficient catalyst for chemical fixation of CO2 to cyclic carbonate Tetrahedron Lett. 49 2008 3588 3591 10.1016/j.tetlet.2008.04.022 J. Sun, S. Zhang, W. Cheng, J. Ren, Hydroxyl-functionalized ionic liquid: a novel efficient catalyst for chemical fixation of CO2 to cyclic carbonate, Tetrahedron Lett. 49 (2008) 3588–3591. https://doi.org/10.1016/j.tetlet.2008.04.022. [45] K.R. Roshan G. Mathai J. Kim J. Tharun G.A. Park D.W. Park A biopolymer mediated efficient synthesis of cyclic carbonates from epoxides and carbon dioxide Green. Chem. 14 2012 2933 2940 10.1039/c2gc35942a K.R. Roshan, G. Mathai, J. Kim, J. Tharun, G.A. Park, D.W. Park, A biopolymer mediated efficient synthesis of cyclic carbonates from epoxides and carbon dioxide, Green Chem. 14 (2012) 2933–2940. https://doi.org/10.1039/c2gc35942a. [46] S.M. Masoom Nataj S. Kaliaguine F.G. Fontaine Highly efficient catalysts for CO2 fixation using guanidinium-functionalized Zr-MOFs ChemCatChem 15 2023 e202300079 10.1002/cctc.202300079 S.M. Masoom Nataj, S. Kaliaguine, F.G. Fontaine, Highly Efficient Catalysts for CO2 Fixation using Guanidinium-Functionalized Zr-MOFs, ChemCatChem 15 (2023) e202300079. https://doi.org/10.1002/cctc.202300079. [47] S.M.Masoom Nataj S. Kaliaguine F.G. Fontaine Post-synthetic modification of Zr-MOFs using guanidine for cyclic carbonate formation catalysis Catal. Today 422 2023 114216 10.1016/j.cattod.2023.114216 S.M.Masoom Nataj, S. Kaliaguine, F.G. Fontaine, Post-synthetic modification of Zr-MOFs using guanidine for cyclic carbonate formation catalysis, Catal. Today 422 (2023) 114216. https://doi.org/10.1016/j.cattod.2023.114216. [48] M. Taherimehr B. Van de Voorde L.H. Wee J.A. Martens D.E. De Vos P.P. Pescarmona Strategies for enhancing the catalytic performance of metal–organic frameworks in the fixation of CO2 into cyclic carbonates ChemSusChem 10 2017 1283 1291 10.1002/cssc.201601768 M. Taherimehr, B. Van de Voorde, L.H. Wee, J.A. Martens, D.E. De Vos, P.P. Pescarmona, Strategies for Enhancing the Catalytic Performance of Metal–Organic Frameworks in the Fixation of CO2 into Cyclic Carbonates, ChemSusChem 10 (2017) 1283–1291. https://doi.org/10.1002/cssc.201601768. [49] D. Ma B. Li K. Liu X. Zhang W. Zou Y. Yang G. Li Z. Shi S. Feng Bifunctional MOF heterogeneous catalysts based on the synergy of dual functional sites for efficient conversion of CO2 under mild and co-catalyst free conditions J. Mater. Chem. A Mater. 3 2015 23136 23142 10.1039/c5ta07026k D. Ma, B. Li, K. Liu, X. Zhang, W. Zou, Y. Yang, G. Li, Z. Shi, S. Feng, Bifunctional MOF heterogeneous catalysts based on the synergy of dual functional sites for efficient conversion of CO2 under mild and co-catalyst free conditions, J. Mater. Chem. A Mater. 3 (2015) 23136–23142. https://doi.org/10.1039/c5ta07026k. [50] X.T. Liu B. Bin Qian D.S. Zhang M. Hui Yu Z. Chang X.H. Bu Recent progress in host–guest metal–organic frameworks: construction and emergent properties Coord. Chem. Rev. 476 2023 214921 10.1016/j.ccr.2022.214921 X.T. Liu, B. Bin Qian, D.S. Zhang, M. Hui Yu, Z. Chang, X.H. Bu, Recent progress in host–guest metal–organic frameworks: Construction and emergent properties, Coord. Chem. Rev. 476 (2023) 214921. https://doi.org/10.1016/j.ccr.2022.214921. [51] X. Liu M. Ding P. Ma J. Yao Optimizing the mobility of active species in ionic liquid/MIL-101 composites for boosting carbon dioxide conversion New J. Chem. 46 2022 44 48 10.1039/d1nj04914c X. Liu, M. Ding, P. Ma, J. Yao, Optimizing the mobility of active species in ionic liquid/MIL-101 composites for boosting carbon dioxide conversion, New J. Chem. 46 (2022) 44–48. https://doi.org/10.1039/d1nj04914c. [52] M. Jahanbani Creating CO2 Capture, Recovery and Valorization Processes While Avoiding Environmental Burden Shifting: How to Integrate Life Cycle Analysis from the Initial Process Design Phase 2022 Thesis Dissertation, Université du Québec à Montréal Jahanbani M. Creating CO2 capture, recovery and valorization processes while avoiding environmental burden shifting: how to integrate life cycle analysis from the initial process design phase, thesis dissertation, Université du Québec à Montréal, 2022. [53] X. Li H. Shao Q. Ma W. Yu X. Dong Water stable MIL-101(Cr)/polyacrylonitrile/agarose aerogel for efficient 2, 4-dichlorophenoxyacetic acid adsorption Colloids Surf. A Physicochem. Eng. Asp. 657 2023 10.1016/j.colsurfa.2022.130519 X. Li, H. Shao, Q. Ma, W. Yu, X. Dong, Water stable MIL-101(Cr)/polyacrylonitrile/agarose aerogel for efficient 2, 4-dichlorophenoxyacetic acid adsorption, Colloids Surf. A Physicochem. Eng. Asp. 657 (2023). https://doi.org/10.1016/j.colsurfa.2022.130519. [54] X. Xia S. Li Improved adsorption cooling performance of MIL-101(Cr)/GO composites by tuning the water adsorption rate Sustain. Energy Fuels 7 2022 437 447 10.1039/d2se01508k X. Xia, S. Li, Improved adsorption cooling performance of MIL-101(Cr)/GO composites by tuning the water adsorption rate, Sustainable Energy Fuels 7 (2022) 437–447. https://doi.org/10.1039/d2se01508k. [55] D.K. Yoo N. Abedin Khan S.H. Jhung Polyaniline-loaded metal-organic framework MIL-101(Cr): promising adsorbent for CO2 capture with increased capacity and selectivity by polyaniline introduction J. CO2 Util. 28 2018 319 325 10.1016/j.jcou.2018.10.012 D.K. Yoo, N. Abedin Khan, S.H. Jhung, Polyaniline-loaded metal-organic framework MIL-101(Cr): Promising adsorbent for CO2 capture with increased capacity and selectivity by polyaniline introduction, J. CO2 Util. 28 (2018) 319–325. https://doi.org/10.1016/j.jcou.2018.10.012. [56] D. Schilter J.K. Clegg M.M. Harding L.M. Rendina Platinum(II) and palladium(II) metallomacrocycles derived from cationic 4,4′-bipyridinium, 3-aminopyrazinium and 2-aminopyrimidinium ligands Dalton Trans. 39 2010 239 247 10.1039/b916579g D. Schilter, J.K. Clegg, M.M. Harding, L.M. Rendina, Platinum(II) and palladium(II) metallomacrocycles derived from cationic 4,4′-bipyridinium, 3-aminopyrazinium and 2-aminopyrimidinium ligands, Dalton Trans. 39 (2010) 239–247. https://doi.org/10.1039/b916579g. [57] M. Zou M. Dong T. Zhao Advances in metal-organic frameworks MIL-101(Cr) Int. J. Mol. Sci. 23 2022 9396 10.3390/ijms23169396 M. Zou, M. Dong, T. Zhao, Advances in Metal-Organic Frameworks MIL-101(Cr), Int. J. Mol. Sci. 23 (2022) 9396. https://doi.org/10.3390/ijms23169396. [58] N.V. Maksimchuk O.V. Zalomaeva I.Y. Skobelev K.A. Kovalenko V.P. Fedin O.A. Kholdeeva Metal-organic frameworks of the MIL-101 family as heterogeneous single-site catalysts Phys. Eng. Sci. 468 2012 2017 2034 10.1098/rspa.2012.0072 N.V. Maksimchuk, O.V. Zalomaeva, I.Y. Skobelev, K.A. Kovalenko, V.P. Fedin, O.A. Kholdeeva, Metal-organic frameworks of the MIL-101 family as heterogeneous single-site catalysts, Phys. Eng. Sci. 468 (2012) 2017–2034. https://doi.org/10.1098/rspa.2012.0072. [59] D.Y. Hong Y.K. Hwang C. Serre G. Férey J.S. Chang Porous chromium terephthalate MIL-101 with coordinatively unsaturated sites: surface functionalization, encapsulation, sorption and catalysis Adv. Funct. Mater. 19 2009 1537 1552 10.1002/adfm.200801130 D.Y. Hong, Y.K. Hwang, C. Serre, G. Férey, J.S. Chang, Porous chromium terephthalate MIL-101 with coordinatively unsaturated sites: Surface functionalization, encapsulation, sorption and catalysis, Adv. Funct. Mater. 19 (2009) 1537–1552. https://doi.org/10.1002/adfm.200801130. [60] X. Quan Z. Sun H. Meng Y. Han J. Wu J. Xu Y. Xu X. Zhang Surface functionalization of MIL-101(Cr) by aminated mesoporous silica and improved adsorption selectivity toward special metal ions Dalton Trans. 48 2019 5384 5396 10.1039/c9dt00501c X. Quan, Z. Sun, H. Meng, Y. Han, J. Wu, J. Xu, Y. Xu, X. Zhang, Surface functionalization of MIL-101(Cr) by aminated mesoporous silica and improved adsorption selectivity toward special metal ions, Dalton Trans. 48 (2019) 5384–5396. https://doi.org/10.1039/c9dt00501c. [61] Y.K. Hwang D.-Y. Hong J.-S. Chang S.H. Jhung Y.-K. Seo J. Kim A. Vimont M. Daturi C. Serre G. Férey Amine grafting on coordinatively unsaturated metal centers of MOFs: consequences for catalysis and metal encapsulation Angew. Chem. 120 2008 4212 4216 10.1002/ange.200705998 Y.K. Hwang, D.-Y. Hong, J.-S. Chang, S.H. Jhung, Y.-K. Seo, J. Kim, A. Vimont, M. Daturi, C. Serre, G. Férey, Amine Grafting on Coordinatively Unsaturated Metal Centers of MOFs: Consequences for Catalysis and Metal Encapsulation, Angew. Chem. 120 (2008) 4212–4216. https://doi.org/10.1002/ange.200705998. [62] S. Rostamnia H. Alamgholiloo M. Jafari Ethylene diamine post-synthesis modification on open metal site Cr-MOF to access efficient bifunctional catalyst for the Hantzsch condensation reaction Appl. Organomet. Chem. 32 2018 e4370 10.1002/aoc.4370 S. Rostamnia, H. Alamgholiloo, M. Jafari, Ethylene diamine post-synthesis modification on open metal site Cr-MOF to access efficient bifunctional catalyst for the Hantzsch condensation reaction, Appl. Organomet. Chem. 32 (2018) e4370. https://doi.org/10.1002/aoc.4370. [63] Y. Fang G. Zhao W. Dai L. Ma N. Ma Enhanced adsorption of rubidium ion by a phenol@MIL-101(Cr) composite material Microporous Mesoporous Mater. 251 2017 51 57 10.1016/j.micromeso.2017.05.048 Y. Fang, G. Zhao, W. Dai, L. Ma, N. Ma, Enhanced adsorption of rubidium ion by a phenol@MIL-101(Cr) composite material, Microporous and Mesoporous Mater. 251 (2017) 51–57. https://doi.org/10.1016/j.micromeso.2017.05.048. [64] K. Leng Y. Sun X. Li S. Sun W. Xu Rapid synthesis of metal-organic frameworks MIL-101(Cr) without the addition of solvent and hydrofluoric acid Cryst. Growth Des. 16 2016 1168 1171 10.1021/acs.cgd.5b01696 K. Leng, Y. Sun, X. Li, S. Sun, W. Xu, Rapid Synthesis of Metal-Organic Frameworks MIL-101(Cr) Without the Addition of Solvent and Hydrofluoric Acid, Cryst. Growth Des. 16 (2016) 1168–1171. https://doi.org/10.1021/acs.cgd.5b01696. [65] R. Zhong X. Yu W. Meng J. Liu C. Zhi R. Zou Amine-grafted MIL-101(Cr) via double-solvent incorporation for synergistic enhancement of CO2 uptake and selectivity ACS Sustain. Chem. Eng. 6 2018 16493 16502 10.1021/acssuschemeng.8b03597 R. Zhong, X. Yu, W. Meng, J. Liu, C. Zhi, R. Zou, Amine-Grafted MIL-101(Cr) via Double-Solvent Incorporation for Synergistic Enhancement of CO2 Uptake and Selectivity, ACS Sustainable Chem. Eng. 6 (2018) 16493–16502. https://doi.org/10.1021/acssuschemeng.8b03597. [66] G. Chen Y. Zhang J. Xu X. Liu K. Liu M. Tong Z. Long Imidazolium-based ionic porous hybrid polymers with POSS-derived silanols for efficient heterogeneous catalytic CO2 conversion under mild conditions Chem. Eng. J. 381 2020 10.1016/j.cej.2019.122765 G. Chen, Y. Zhang, J. Xu, X. Liu, K. Liu, M. Tong, Z. Long, Imidazolium-based ionic porous hybrid polymers with POSS-derived silanols for efficient heterogeneous catalytic CO2 conversion under mild conditions, Chemical Engineering Journal 381 (2020). https://doi.org/10.1016/j.cej.2019.122765. [67] R. Bardestani G.S. Patience S. Kaliaguine Experimental methods in chemical engineering: specific surface area and pore size distribution measurements—BET, BJH, and DFT Can. J. Chem. Eng. 97 2019 2781 2791 10.1002/cjce.23632 R. Bardestani, G.S. Patience, S. Kaliaguine, Experimental methods in chemical engineering: specific surface area and pore size distribution measurements—BET, BJH, and DFT, Can. J. Chem. Eng. 97 (2019) 2781–2791. https://doi.org/10.1002/cjce.23632. [68] Y. Lin Q. Yan C. Kong L. Chen Polyethyleneimine incorporated metal-organic frameworks adsorbent for highly selective CO2 capture Sci. Rep. 3 2013 10.1038/srep01859 Y. Lin, Q. Yan, C. Kong, L. Chen, Polyethyleneimine incorporated metal-organic frameworks adsorbent for highly selective CO2 capture, Sci. Rep. 3 (2013). https://doi.org/10.1038/srep01859. [69] P. Chowdhury C. Bikkina S. Gumma Gas adsorption properties of the chromium-based metal organic framework MIL-101 J. Phys. Chem. C 113 2009 6616 6621 10.1021/jp811418r P. Chowdhury, C. Bikkina, S. Gumma, Gas adsorption properties of the chromium-based metal organic framework MIL-101, J. Phys. Chem. C 113 (2009) 6616–6621. https://doi.org/10.1021/jp811418r. [70] Y.Y. Liu J.L. Zeng J. Zhang F. Xu L.X. Sun Improved hydrogen storage in the modified metal-organic frameworks by hydrogen spillover effect Int. J. Hydrogen Energy 32 2007 4005 4010 10.1016/j.ijhydene.2007.04.029 Y.Y. Liu, J.L. Zeng, J. Zhang, F. Xu, L.X. Sun, Improved hydrogen storage in the modified metal-organic frameworks by hydrogen spillover effect, Int. J. Hydrogen Energy 32 (2007) 4005–4010. https://doi.org/10.1016/j.ijhydene.2007.04.029. [71] X. Zhang X. Li S. Su M. Tan G. Liu Y. Wang M. Luo Ag nanoparticles in the cages of MIL-101(Cr) as an efficient and stable photocatalyst for nitrogen reduction reaction Catal. Sci. Technol. 13 2022 705 713 10.1039/d2cy01534j X. Zhang, X. Li, S. Su, M. Tan, G. Liu, Y. Wang, M. Luo, Ag nanoparticles in the cages of MIL-101(Cr) as an efficient and stable photocatalyst for nitrogen reduction reaction, Catal. Sci. Technol. 13 (2022) 705–713. https://doi.org/10.1039/d2cy01534j. [72] S.B. Aliev D.G. Samsonenko E.A. Maksimovskiy E.O. Fedorovskaya S.A. Sapchenko V.P. Fedin Polyaniline-intercalated MIL-101: selective CO2 sorption and supercapacitor properties New J. Chem. 40 2016 5306 5312 10.1039/c5nj03477a S.B. Aliev, D.G. Samsonenko, E.A. Maksimovskiy, E.O. Fedorovskaya, S.A. Sapchenko, V.P. Fedin, Polyaniline-intercalated MIL-101: Selective CO2 sorption and supercapacitor properties, New J. Chem. 40 (2016) 5306–5312. https://doi.org/10.1039/c5nj03477a. [73] Y. Jiang Z. Wang P. Xu J. Sun Dicationic ionic liquid @MIL-101 for the cycloaddition of CO2 and epoxides under cocatalyst-free conditions Cryst. Growth Des. 21 2021 3689 3698 10.1021/acs.cgd.0c01666 Y. Jiang, Z. Wang, P. Xu, J. Sun, Dicationic ionic liquid @MIL-101 for the cycloaddition of CO2 and epoxides under cocatalyst-free conditions, Cryst. Growth Des. 21 (2021) 3689–3698. https://doi.org/10.1021/acs.cgd.0c01666. [74] L.J. Zhou W. Sun N.N. Yang P. Li T. Gong W.J. Sun Q. Sui E.Q. Gao A facile and versatile “click” approach toward multifunctional ionic metal–organic frameworks for efficient conversion of CO2 ChemSusChem 12 2019 2202 2210 10.1002/cssc.201802990 L.J. Zhou, W. Sun, N.N. Yang, P. Li, T. Gong, W.J. Sun, Q. Sui, E.Q. Gao, A Facile and Versatile “Click” Approach Toward Multifunctional Ionic Metal–organic Frameworks for Efficient Conversion of CO2, ChemSusChem 12 (2019) 2202–2210. https://doi.org/10.1002/cssc.201802990. [75] M. Ding H.L. Jiang Incorporation of imidazolium-based poly(ionic liquid)s into a metal-organic framework for CO2 capture and conversion ACS Catal. 8 2018 3194 3201 10.1021/acscatal.7b03404 M. Ding, H.L. Jiang, Incorporation of Imidazolium-Based Poly(ionic liquid)s into a Metal-Organic Framework for CO2 Capture and Conversion, ACS Catal. 8 (2018) 3194–3201. https://doi.org/10.1021/acscatal.7b03404. [76] J. Liang Y.Q. Xie X.S. Wang Q. Wang T.T. Liu Y.B. Huang R. Cao An imidazolium-functionalized mesoporous cationic metal-organic framework for cooperative CO2 fixation into cyclic carbonate Chem. Commun. 54 2018 342 345 10.1039/c7cc08630j J. Liang, Y.Q. Xie, X.S. Wang, Q. Wang, T.T. Liu, Y.B. Huang, R. Cao, An imidazolium-functionalized mesoporous cationic metal-organic framework for cooperative CO2 fixation into cyclic carbonate, Chem. Commun. 54 (2018) 342–345. https://doi.org/10.1039/c7cc08630j. [77] H. Ji K. Naveen W. Lee T.S. Kim D. Kim D.H. Cho Pyridinium-functionalized ionic metal-organic frameworks designed as bifunctional catalysts for CO2 fixation into cyclic carbonates ACS Appl. Mater. Interfaces 12 2020 24868 24876 10.1021/acsami.0c05912 H. Ji, K. Naveen, W. Lee, T.S. Kim, D. Kim, D.H. Cho, Pyridinium-Functionalized Ionic Metal-Organic Frameworks Designed as Bifunctional Catalysts for CO2Fixation into Cyclic Carbonates, ACS Appl. Mater. Interfaces 12 (2020) 24868–24876. https://doi.org/10.1021/acsami.0c05912. [78] J. Liang Y.Q. Xie Q. Wu X.Y. Wang T.T. Liu H.F. Li Y.B. Huang R. Cao Zinc porphyrin/imidazolium integrated multivariate zirconium metal-organic frameworks for transformation of CO2 into cyclic carbonates Inorg. Chem. 57 2018 2584 2593 10.1021/acs.inorgchem.7b02983 J. Liang, Y.Q. Xie, Q. Wu, X.Y. Wang, T.T. Liu, H.F. Li, Y.B. Huang, R. Cao, Zinc Porphyrin/Imidazolium Integrated Multivariate Zirconium Metal-Organic Frameworks for Transformation of CO2 into Cyclic Carbonates, Inorg. Chem. 57 (2018) 2584–2593. https://doi.org/10.1021/acs.inorgchem.7b02983. [79] J. Liang R.P. Chen X.Y. Wang T.T. Liu X.S. Wang Y.B. Huang R. Cao Postsynthetic ionization of an imidazole-containing metal-organic framework for the cycloaddition of carbon dioxide and epoxides Chem. Sci. 8 2017 1570 1575 10.1039/c6sc04357g J. Liang, R.P. Chen, X.Y. Wang, T.T. Liu, X.S. Wang, Y.B. Huang, R. Cao, Postsynthetic ionization of an imidazole-containing metal-organic framework for the cycloaddition of carbon dioxide and epoxides, Chem. Sci. 8 (2017) 1570–1575. https://doi.org/10.1039/c6sc04357g. [80] S. Foltran J. Alsarraf F. Robert Y. Landais E. Cloutet H. Cramail T. Tassaing On the chemical fixation of supercritical carbon dioxide with epoxides catalyzed by ionic salts: an in situ FTIR and Raman study Catal. Sci. Technol. 3 2013 1046 1055 10.1039/c2cy20784b S. Foltran, J. Alsarraf, F. Robert, Y. Landais, E. Cloutet, H. Cramail, T. Tassaing, On the chemical fixation of supercritical carbon dioxide with epoxides catalyzed by ionic salts: An in situ FTIR and Raman study, Catal. Sci. Technol. 3 (2013) 1046–1055. https://doi.org/10.1039/c2cy20784b. [81] M. Zou W. Dai P. Mao B. Li J. Mao S. Zhang L. Yang S. Luo X. Luo J. Zou Integration of multifunctionalities on ionic liquid-anchored MIL-101(Cr): a robust and efficient heterogeneous catalyst for conversion of CO2 into cyclic carbonates Microporous Mesoporous Mater. 312 2021 10.1016/j.micromeso.2020.110750 M. Zou, W. Dai, P. Mao, B. Li, J. Mao, S. Zhang, L. Yang, S. Luo, X. Luo, J. Zou, Integration of multifunctionalities on ionic liquid-anchored MIL-101(Cr): A robust and efficient heterogeneous catalyst for conversion of CO2 into cyclic carbonates, Microporous Mesoporous Mater. 312 (2021). https://doi.org/10.1016/j.micromeso.2020.110750. [82] F. Guo X. Zhang Metal-organic frameworks for the energy-related conversion of CO2 into cyclic carbonates Dalton Trans. 49 2020 9935 9947 10.1039/d0dt01516d F. Guo, X. Zhang, Metal-organic frameworks for the energy-related conversion of CO2 into cyclic carbonates, Dalton Trans. 49 (2020) 9935–9947. https://doi.org/10.1039/d0dt01516d.",
      "scopus-id": "85219690087",
      "coredata": {
        "eid": "1-s2.0-S0926860X25000870",
        "dc:description": "Modified metal-organic frameworks (MOFs) encapsulating new ionic N-heterocyclic-based functional groups, prepared via a ship-in-a-bottle approach, introduce a novel catalytic system for CO₂ conversion with epoxides. The MIL-101(Cr) framework was functionalized with novel ionic liquids (ILs) such as 1,5-bis(2-aminopyrimidinium)pentane bromide (2AMP-DBrP) and 1,5-bis(2-aminopyrimidinium)ethyl ether bromide (2AMP-DBrEE), resulting in cationic pyrimidinium-containing Cr-MOFs with free bromide ions, namely MIL101–2AMP-DBrP and MIL101–2AMP-DBrEE. Although the surface area (2456 and 2408 m²/g) and pore volume (1.44 and 1.41 cm³/g) of these encapsulated materials were reduced compared to pristine MIL-101(Cr) (3425 m²/g and 1.78 cm³/g), the CO₂ adsorption capacity at low pressure was notably increased (3.51 and 4.05 mmol g⁻¹ of CO₂). These modified MOFs demonstrated exceptional catalytic performance and stability in CO₂ fixation with various epoxides, achieving a high turnover frequency (TOF) of 82.5 h⁻¹ under mild conditions (0.1 MPa, 90 °C) without the need for co-catalysts or solvents, which are essential criteria for commercial viability. Moreover, in situ FTIR analysis suggests that the enhanced performance is due to CO₂ activation via carbamic acid formation facilitated by primary amino groups and epoxide activation through hydrogen bonding. This dual activation mechanism is critical for achieving high catalytic efficiency under mild conditions and underscores the innovative and significant advancements presented in this work compared to existing IL-MOFs.",
        "openArchiveArticle": "false",
        "prism:coverDate": "2025-05-05",
        "openaccessUserLicense": "http://creativecommons.org/licenses/by-nc-nd/4.0/",
        "prism:aggregationType": "Journal",
        "prism:url": "https://api.elsevier.com/content/article/pii/S0926860X25000870",
        "dc:creator": [
          {
            "@_fa": "true",
            "$": "Masoom Nataj, Seyedeh Molood"
          },
          {
            "@_fa": "true",
            "$": "Kaliaguine, Serge"
          },
          {
            "@_fa": "true",
            "$": "Fontaine, Frédéric-Georges"
          }
        ],
        "link": [
          {
            "@_fa": "true",
            "@rel": "self",
            "@href": "https://api.elsevier.com/content/article/pii/S0926860X25000870"
          },
          {
            "@_fa": "true",
            "@rel": "scidir",
            "@href": "https://www.sciencedirect.com/science/article/pii/S0926860X25000870"
          }
        ],
        "dc:format": "application/json",
        "openaccessType": "Full",
        "pii": "S0926-860X(25)00087-0",
        "prism:volume": "697",
        "articleNumber": "120186",
        "prism:publisher": "The Author(s). Published by Elsevier B.V.",
        "dc:title": "CO2 fixation reaction over pyrimidinium-based dicationic ionic liquid in MIL-101(Cr)",
        "prism:copyright": "© 2025 The Author(s). Published by Elsevier B.V.",
        "openaccess": "1",
        "prism:issn": "0926860X",
        "dcterms:subject": [
          {
            "@_fa": "true",
            "$": "Metal-organic frameworks"
          },
          {
            "@_fa": "true",
            "$": "MIL-101(Cr)"
          },
          {
            "@_fa": "true",
            "$": "CO2 utilization"
          },
          {
            "@_fa": "true",
            "$": "Cyclic carbonate"
          }
        ],
        "openaccessArticle": "true",
        "prism:publicationName": "Applied Catalysis A: General",
        "openaccessSponsorType": "ElsevierWaived",
        "prism:pageRange": "120186",
        "pubType": "fla",
        "prism:coverDisplayDate": "5 May 2025",
        "prism:doi": "10.1016/j.apcata.2025.120186",
        "prism:startingPage": "120186",
        "dc:identifier": "doi:10.1016/j.apcata.2025.120186",
        "openaccessSponsorName": "CRKN 2024: Hybrid journals"
      },
      "objects": {
        "object": [
          {
            "@category": "standard",
            "@height": "61",
            "@width": "105",
            "@_fa": "true",
            "$": "https://api.elsevier.com/content/object/eid/1-s2.0-S0926860X25000870-fx10.jpg?httpAccept=%2A%2F%2A",
            "@multimediatype": "JPEG image file",
            "@type": "IMAGE-DOWNSAMPLED",
            "@size": "1972",
            "@ref": "fx10",
            "@mimetype": "image/jpeg"
          },
          {
            "@category": "standard",
            "@height": "86",
            "@width": "120",
            "@_fa": "true",
            "$": "https://api.elsevier.com/content/object/eid/1-s2.0-S0926860X25000870-fx11.jpg?httpAccept=%2A%2F%2A",
            "@multimediatype": "JPEG image file",
            "@type": "IMAGE-DOWNSAMPLED",
            "@size": "2833",
            "@ref": "fx11",
            "@mimetype": "image/jpeg"
          },
          {
            "@category": "standard",
            "@height": "200",
            "@width": "348",
            "@_fa": "true",
            "$": "https://api.elsevier.com/content/object/eid/1-s2.0-S0926860X25000870-ga1.jpg?httpAccept=%2A%2F%2A",
            "@multimediatype": "JPEG image file",
            "@type": "IMAGE-DOWNSAMPLED",
            "@size": "25457",
            "@ref": "ga1",
            "@mimetype": "image/jpeg"
          },
          {
            "@category": "standard",
            "@height": "38",
            "@width": "131",
            "@_fa": "true",
            "$": "https://api.elsevier.com/content/object/eid/1-s2.0-S0926860X25000870-fx12.jpg?httpAccept=%2A%2F%2A",
            "@multimediatype": "JPEG image file",
            "@type": "IMAGE-DOWNSAMPLED",
            "@size": "1953",
            "@ref": "fx12",
            "@mimetype": "image/jpeg"
          },
          {
            "@category": "standard",
            "@height": "58",
            "@width": "136",
            "@_fa": "true",
            "$": "https://api.elsevier.com/content/object/eid/1-s2.0-S0926860X25000870-fx13.jpg?httpAccept=%2A%2F%2A",
            "@multimediatype": "JPEG image file",
            "@type": "IMAGE-DOWNSAMPLED",
            "@size": "2468",
            "@ref": "fx13",
            "@mimetype": "image/jpeg"
          },
          {
            "@category": "standard",
            "@height": "47",
            "@width": "64",
            "@_fa": "true",
            "$": "https://api.elsevier.com/content/object/eid/1-s2.0-S0926860X25000870-fx14.jpg?httpAccept=%2A%2F%2A",
            "@multimediatype": "JPEG image file",
            "@type": "IMAGE-DOWNSAMPLED",
            "@size": "1452",
            "@ref": "fx14",
            "@mimetype": "image/jpeg"
          },
          {
            "@category": "standard",
            "@height": "48",
            "@width": "101",
            "@_fa": "true",
            "$": "https://api.elsevier.com/content/object/eid/1-s2.0-S0926860X25000870-fx15.jpg?httpAccept=%2A%2F%2A",
            "@multimediatype": "JPEG image file",
            "@type": "IMAGE-DOWNSAMPLED",
            "@size": "2196",
            "@ref": "fx15",
            "@mimetype": "image/jpeg"
          },
          {
            "@category": "standard",
            "@height": "119",
            "@width": "508",
            "@_fa": "true",
            "$": "https://api.elsevier.com/content/object/eid/1-s2.0-S0926860X25000870-fx1.jpg?httpAccept=%2A%2F%2A",
            "@multimediatype": "JPEG image file",
            "@type": "IMAGE-DOWNSAMPLED",
            "@size": "9504",
            "@ref": "fx1",
            "@mimetype": "image/jpeg"
          },
          {
            "@category": "standard",
            "@height": "48",
            "@width": "120",
            "@_fa": "true",
            "$": "https://api.elsevier.com/content/object/eid/1-s2.0-S0926860X25000870-fx7.jpg?httpAccept=%2A%2F%2A",
            "@multimediatype": "JPEG image file",
            "@type": "IMAGE-DOWNSAMPLED",
            "@size": "2222",
            "@ref": "fx7",
            "@mimetype": "image/jpeg"
          },
          {
            "@category": "standard",
            "@height": "42",
            "@width": "89",
            "@_fa": "true",
            "$": "https://api.elsevier.com/content/object/eid/1-s2.0-S0926860X25000870-fx6.jpg?httpAccept=%2A%2F%2A",
            "@multimediatype": "JPEG image file",
            "@type": "IMAGE-DOWNSAMPLED",
            "@size": "1461",
            "@ref": "fx6",
            "@mimetype": "image/jpeg"
          },
          {
            "@category": "standard",
            "@height": "70",
            "@width": "109",
            "@_fa": "true",
            "$": "https://api.elsevier.com/content/object/eid/1-s2.0-S0926860X25000870-fx9.jpg?httpAccept=%2A%2F%2A",
            "@multimediatype": "JPEG image file",
            "@type": "IMAGE-DOWNSAMPLED",
            "@size": "2596",
            "@ref": "fx9",
            "@mimetype": "image/jpeg"
          },
          {
            "@category": "standard",
            "@height": "313",
            "@width": "376",
            "@_fa": "true",
            "$": "https://api.elsevier.com/content/object/eid/1-s2.0-S0926860X25000870-gr2.jpg?httpAccept=%2A%2F%2A",
            "@multimediatype": "JPEG image file",
            "@type": "IMAGE-DOWNSAMPLED",
            "@size": "26244",
            "@ref": "gr2",
            "@mimetype": "image/jpeg"
          },
          {
            "@category": "standard",
            "@height": "60",
            "@width": "78",
            "@_fa": "true",
            "$": "https://api.elsevier.com/content/object/eid/1-s2.0-S0926860X25000870-fx8.jpg?httpAccept=%2A%2F%2A",
            "@multimediatype": "JPEG image file",
            "@type": "IMAGE-DOWNSAMPLED",
            "@size": "1757",
            "@ref": "fx8",
            "@mimetype": "image/jpeg"
          },
          {
            "@category": "standard",
            "@height": "269",
            "@width": "659",
            "@_fa": "true",
            "$": "https://api.elsevier.com/content/object/eid/1-s2.0-S0926860X25000870-gr1.jpg?httpAccept=%2A%2F%2A",
            "@multimediatype": "JPEG image file",
            "@type": "IMAGE-DOWNSAMPLED",
            "@size": "58316",
            "@ref": "gr1",
            "@mimetype": "image/jpeg"
          },
          {
            "@category": "standard",
            "@height": "46",
            "@width": "86",
            "@_fa": "true",
            "$": "https://api.elsevier.com/content/object/eid/1-s2.0-S0926860X25000870-fx3.jpg?httpAccept=%2A%2F%2A",
            "@multimediatype": "JPEG image file",
            "@type": "IMAGE-DOWNSAMPLED",
            "@size": "1791",
            "@ref": "fx3",
            "@mimetype": "image/jpeg"
          },
          {
            "@category": "standard",
            "@height": "245",
            "@width": "376",
            "@_fa": "true",
            "$": "https://api.elsevier.com/content/object/eid/1-s2.0-S0926860X25000870-sc1.jpg?httpAccept=%2A%2F%2A",
            "@multimediatype": "JPEG image file",
            "@type": "IMAGE-DOWNSAMPLED",
            "@size": "31293",
            "@ref": "sc1",
            "@mimetype": "image/jpeg"
          },
          {
            "@category": "standard",
            "@height": "33",
            "@width": "54",
            "@_fa": "true",
            "$": "https://api.elsevier.com/content/object/eid/1-s2.0-S0926860X25000870-fx2.jpg?httpAccept=%2A%2F%2A",
            "@multimediatype": "JPEG image file",
            "@type": "IMAGE-DOWNSAMPLED",
            "@size": "926",
            "@ref": "fx2",
            "@mimetype": "image/jpeg"
          },
          {
            "@category": "standard",
            "@height": "45",
            "@width": "111",
            "@_fa": "true",
            "$": "https://api.elsevier.com/content/object/eid/1-s2.0-S0926860X25000870-fx5.jpg?httpAccept=%2A%2F%2A",
            "@multimediatype": "JPEG image file",
            "@type": "IMAGE-DOWNSAMPLED",
            "@size": "2127",
            "@ref": "fx5",
            "@mimetype": "image/jpeg"
          },
          {
            "@category": "standard",
            "@height": "40",
            "@width": "84",
            "@_fa": "true",
            "$": "https://api.elsevier.com/content/object/eid/1-s2.0-S0926860X25000870-fx4.jpg?httpAccept=%2A%2F%2A",
            "@multimediatype": "JPEG image file",
            "@type": "IMAGE-DOWNSAMPLED",
            "@size": "1451",
            "@ref": "fx4",
            "@mimetype": "image/jpeg"
          },
          {
            "@category": "standard",
            "@height": "572",
            "@width": "659",
            "@_fa": "true",
            "$": "https://api.elsevier.com/content/object/eid/1-s2.0-S0926860X25000870-sc2.jpg?httpAccept=%2A%2F%2A",
            "@multimediatype": "JPEG image file",
            "@type": "IMAGE-DOWNSAMPLED",
            "@size": "61312",
            "@ref": "sc2",
            "@mimetype": "image/jpeg"
          },
          {
            "@category": "standard",
            "@height": "279",
            "@width": "659",
            "@_fa": "true",
            "$": "https://api.elsevier.com/content/object/eid/1-s2.0-S0926860X25000870-gr8.jpg?httpAccept=%2A%2F%2A",
            "@multimediatype": "JPEG image file",
            "@type": "IMAGE-DOWNSAMPLED",
            "@size": "36654",
            "@ref": "gr8",
            "@mimetype": "image/jpeg"
          },
          {
            "@category": "standard",
            "@height": "278",
            "@width": "659",
            "@_fa": "true",
            "$": "https://api.elsevier.com/content/object/eid/1-s2.0-S0926860X25000870-gr7.jpg?httpAccept=%2A%2F%2A",
            "@multimediatype": "JPEG image file",
            "@type": "IMAGE-DOWNSAMPLED",
            "@size": "43678",
            "@ref": "gr7",
            "@mimetype": "image/jpeg"
          },
          {
            "@category": "standard",
            "@height": "619",
            "@width": "659",
            "@_fa": "true",
            "$": "https://api.elsevier.com/content/object/eid/1-s2.0-S0926860X25000870-gr10.jpg?httpAccept=%2A%2F%2A",
            "@multimediatype": "JPEG image file",
            "@type": "IMAGE-DOWNSAMPLED",
            "@size": "86482",
            "@ref": "gr10",
            "@mimetype": "image/jpeg"
          },
          {
            "@category": "standard",
            "@height": "276",
            "@width": "659",
            "@_fa": "true",
            "$": "https://api.elsevier.com/content/object/eid/1-s2.0-S0926860X25000870-gr9.jpg?httpAccept=%2A%2F%2A",
            "@multimediatype": "JPEG image file",
            "@type": "IMAGE-DOWNSAMPLED",
            "@size": "33411",
            "@ref": "gr9",
            "@mimetype": "image/jpeg"
          },
          {
            "@category": "standard",
            "@height": "285",
            "@width": "376",
            "@_fa": "true",
            "$": "https://api.elsevier.com/content/object/eid/1-s2.0-S0926860X25000870-gr4.jpg?httpAccept=%2A%2F%2A",
            "@multimediatype": "JPEG image file",
            "@type": "IMAGE-DOWNSAMPLED",
            "@size": "18208",
            "@ref": "gr4",
            "@mimetype": "image/jpeg"
          },
          {
            "@category": "standard",
            "@height": "830",
            "@width": "659",
            "@_fa": "true",
            "$": "https://api.elsevier.com/content/object/eid/1-s2.0-S0926860X25000870-gr3.jpg?httpAccept=%2A%2F%2A",
            "@multimediatype": "JPEG image file",
            "@type": "IMAGE-DOWNSAMPLED",
            "@size": "118380",
            "@ref": "gr3",
            "@mimetype": "image/jpeg"
          },
          {
            "@category": "standard",
            "@height": "260",
            "@width": "659",
            "@_fa": "true",
            "$": "https://api.elsevier.com/content/object/eid/1-s2.0-S0926860X25000870-gr6.jpg?httpAccept=%2A%2F%2A",
            "@multimediatype": "JPEG image file",
            "@type": "IMAGE-DOWNSAMPLED",
            "@size": "42773",
            "@ref": "gr6",
            "@mimetype": "image/jpeg"
          },
          {
            "@category": "standard",
            "@height": "719",
            "@width": "565",
            "@_fa": "true",
            "$": "https://api.elsevier.com/content/object/eid/1-s2.0-S0926860X25000870-gr5.jpg?httpAccept=%2A%2F%2A",
            "@multimediatype": "JPEG image file",
            "@type": "IMAGE-DOWNSAMPLED",
            "@size": "135541",
            "@ref": "gr5",
            "@mimetype": "image/jpeg"
          },
          {
            "@category": "thumbnail",
            "@height": "128",
            "@width": "219",
            "@_fa": "true",
            "$": "https://api.elsevier.com/content/object/eid/1-s2.0-S0926860X25000870-fx10.sml?httpAccept=%2A%2F%2A",
            "@multimediatype": "GIF image file",
            "@type": "IMAGE-THUMBNAIL",
            "@size": "4396",
            "@ref": "fx10",
            "@mimetype": "image/gif"
          },
          {
            "@category": "thumbnail",
            "@height": "157",
            "@width": "219",
            "@_fa": "true",
            "$": "https://api.elsevier.com/content/object/eid/1-s2.0-S0926860X25000870-fx11.sml?httpAccept=%2A%2F%2A",
            "@multimediatype": "GIF image file",
            "@type": "IMAGE-THUMBNAIL",
            "@size": "5570",
            "@ref": "fx11",
            "@mimetype": "image/gif"
          },
          {
            "@category": "thumbnail",
            "@height": "126",
            "@width": "219",
            "@_fa": "true",
            "$": "https://api.elsevier.com/content/object/eid/1-s2.0-S0926860X25000870-ga1.sml?httpAccept=%2A%2F%2A",
            "@multimediatype": "GIF image file",
            "@type": "IMAGE-THUMBNAIL",
            "@size": "13220",
            "@ref": "ga1",
            "@mimetype": "image/gif"
          },
          {
            "@category": "thumbnail",
            "@height": "64",
            "@width": "219",
            "@_fa": "true",
            "$": "https://api.elsevier.com/content/object/eid/1-s2.0-S0926860X25000870-fx12.sml?httpAccept=%2A%2F%2A",
            "@multimediatype": "GIF image file",
            "@type": "IMAGE-THUMBNAIL",
            "@size": "2902",
            "@ref": "fx12",
            "@mimetype": "image/gif"
          },
          {
            "@category": "thumbnail",
            "@height": "94",
            "@width": "219",
            "@_fa": "true",
            "$": "https://api.elsevier.com/content/object/eid/1-s2.0-S0926860X25000870-fx13.sml?httpAccept=%2A%2F%2A",
            "@multimediatype": "GIF image file",
            "@type": "IMAGE-THUMBNAIL",
            "@size": "4009",
            "@ref": "fx13",
            "@mimetype": "image/gif"
          },
          {
            "@category": "thumbnail",
            "@height": "161",
            "@width": "219",
            "@_fa": "true",
            "$": "https://api.elsevier.com/content/object/eid/1-s2.0-S0926860X25000870-fx14.sml?httpAccept=%2A%2F%2A",
            "@multimediatype": "GIF image file",
            "@type": "IMAGE-THUMBNAIL",
            "@size": "6200",
            "@ref": "fx14",
            "@mimetype": "image/gif"
          },
          {
            "@category": "thumbnail",
            "@height": "103",
            "@width": "219",
            "@_fa": "true",
            "$": "https://api.elsevier.com/content/object/eid/1-s2.0-S0926860X25000870-fx15.sml?httpAccept=%2A%2F%2A",
            "@multimediatype": "GIF image file",
            "@type": "IMAGE-THUMBNAIL",
            "@size": "5756",
            "@ref": "fx15",
            "@mimetype": "image/gif"
          },
          {
            "@category": "thumbnail",
            "@height": "51",
            "@width": "219",
            "@_fa": "true",
            "$": "https://api.elsevier.com/content/object/eid/1-s2.0-S0926860X25000870-fx1.sml?httpAccept=%2A%2F%2A",
            "@multimediatype": "GIF image file",
            "@type": "IMAGE-THUMBNAIL",
            "@size": "1963",
            "@ref": "fx1",
            "@mimetype": "image/gif"
          },
          {
            "@category": "thumbnail",
            "@height": "88",
            "@width": "219",
            "@_fa": "true",
            "$": "https://api.elsevier.com/content/object/eid/1-s2.0-S0926860X25000870-fx7.sml?httpAccept=%2A%2F%2A",
            "@multimediatype": "GIF image file",
            "@type": "IMAGE-THUMBNAIL",
            "@size": "4772",
            "@ref": "fx7",
            "@mimetype": "image/gif"
          },
          {
            "@category": "thumbnail",
            "@height": "102",
            "@width": "219",
            "@_fa": "true",
            "$": "https://api.elsevier.com/content/object/eid/1-s2.0-S0926860X25000870-fx6.sml?httpAccept=%2A%2F%2A",
            "@multimediatype": "GIF image file",
            "@type": "IMAGE-THUMBNAIL",
            "@size": "3726",
            "@ref": "fx6",
            "@mimetype": "image/gif"
          },
          {
            "@category": "thumbnail",
            "@height": "141",
            "@width": "219",
            "@_fa": "true",
            "$": "https://api.elsevier.com/content/object/eid/1-s2.0-S0926860X25000870-fx9.sml?httpAccept=%2A%2F%2A",
            "@multimediatype": "GIF image file",
            "@type": "IMAGE-THUMBNAIL",
            "@size": "5727",
            "@ref": "fx9",
            "@mimetype": "image/gif"
          },
          {
            "@category": "thumbnail",
            "@height": "164",
            "@width": "197",
            "@_fa": "true",
            "$": "https://api.elsevier.com/content/object/eid/1-s2.0-S0926860X25000870-gr2.sml?httpAccept=%2A%2F%2A",
            "@multimediatype": "GIF image file",
            "@type": "IMAGE-THUMBNAIL",
            "@size": "8773",
            "@ref": "gr2",
            "@mimetype": "image/gif"
          },
          {
            "@category": "thumbnail",
            "@height": "164",
            "@width": "214",
            "@_fa": "true",
            "$": "https://api.elsevier.com/content/object/eid/1-s2.0-S0926860X25000870-fx8.sml?httpAccept=%2A%2F%2A",
            "@multimediatype": "GIF image file",
            "@type": "IMAGE-THUMBNAIL",
            "@size": "5404",
            "@ref": "fx8",
            "@mimetype": "image/gif"
          },
          {
            "@category": "thumbnail",
            "@height": "89",
            "@width": "219",
            "@_fa": "true",
            "$": "https://api.elsevier.com/content/object/eid/1-s2.0-S0926860X25000870-gr1.sml?httpAccept=%2A%2F%2A",
            "@multimediatype": "GIF image file",
            "@type": "IMAGE-THUMBNAIL",
            "@size": "8643",
            "@ref": "gr1",
            "@mimetype": "image/gif"
          },
          {
            "@category": "thumbnail",
            "@height": "118",
            "@width": "219",
            "@_fa": "true",
            "$": "https://api.elsevier.com/content/object/eid/1-s2.0-S0926860X25000870-fx3.sml?httpAccept=%2A%2F%2A",
            "@multimediatype": "GIF image file",
            "@type": "IMAGE-THUMBNAIL",
            "@size": "6103",
            "@ref": "fx3",
            "@mimetype": "image/gif"
          },
          {
            "@category": "thumbnail",
            "@height": "143",
            "@width": "219",
            "@_fa": "true",
            "$": "https://api.elsevier.com/content/object/eid/1-s2.0-S0926860X25000870-sc1.sml?httpAccept=%2A%2F%2A",
            "@multimediatype": "GIF image file",
            "@type": "IMAGE-THUMBNAIL",
            "@size": "15439",
            "@ref": "sc1",
            "@mimetype": "image/gif"
          },
          {
            "@category": "thumbnail",
            "@height": "133",
            "@width": "219",
            "@_fa": "true",
            "$": "https://api.elsevier.com/content/object/eid/1-s2.0-S0926860X25000870-fx2.sml?httpAccept=%2A%2F%2A",
            "@multimediatype": "GIF image file",
            "@type": "IMAGE-THUMBNAIL",
            "@size": "5042",
            "@ref": "fx2",
            "@mimetype": "image/gif"
          },
          {
            "@category": "thumbnail",
            "@height": "88",
            "@width": "219",
            "@_fa": "true",
            "$": "https://api.elsevier.com/content/object/eid/1-s2.0-S0926860X25000870-fx5.sml?httpAccept=%2A%2F%2A",
            "@multimediatype": "GIF image file",
            "@type": "IMAGE-THUMBNAIL",
            "@size": "4724",
            "@ref": "fx5",
            "@mimetype": "image/gif"
          },
          {
            "@category": "thumbnail",
            "@height": "104",
            "@width": "219",
            "@_fa": "true",
            "$": "https://api.elsevier.com/content/object/eid/1-s2.0-S0926860X25000870-fx4.sml?httpAccept=%2A%2F%2A",
            "@multimediatype": "GIF image file",
            "@type": "IMAGE-THUMBNAIL",
            "@size": "3961",
            "@ref": "fx4",
            "@mimetype": "image/gif"
          },
          {
            "@category": "thumbnail",
            "@height": "164",
            "@width": "189",
            "@_fa": "true",
            "$": "https://api.elsevier.com/content/object/eid/1-s2.0-S0926860X25000870-sc2.sml?httpAccept=%2A%2F%2A",
            "@multimediatype": "GIF image file",
            "@type": "IMAGE-THUMBNAIL",
            "@size": "8113",
            "@ref": "sc2",
            "@mimetype": "image/gif"
          },
          {
            "@category": "thumbnail",
            "@height": "93",
            "@width": "219",
            "@_fa": "true",
            "$": "https://api.elsevier.com/content/object/eid/1-s2.0-S0926860X25000870-gr8.sml?httpAccept=%2A%2F%2A",
            "@multimediatype": "GIF image file",
            "@type": "IMAGE-THUMBNAIL",
            "@size": "6159",
            "@ref": "gr8",
            "@mimetype": "image/gif"
          },
          {
            "@category": "thumbnail",
            "@height": "92",
            "@width": "219",
            "@_fa": "true",
            "$": "https://api.elsevier.com/content/object/eid/1-s2.0-S0926860X25000870-gr7.sml?httpAccept=%2A%2F%2A",
            "@multimediatype": "GIF image file",
            "@type": "IMAGE-THUMBNAIL",
            "@size": "5428",
            "@ref": "gr7",
            "@mimetype": "image/gif"
          },
          {
            "@category": "thumbnail",
            "@height": "163",
            "@width": "174",
            "@_fa": "true",
            "$": "https://api.elsevier.com/content/object/eid/1-s2.0-S0926860X25000870-gr10.sml?httpAccept=%2A%2F%2A",
            "@multimediatype": "GIF image file",
            "@type": "IMAGE-THUMBNAIL",
            "@size": "9696",
            "@ref": "gr10",
            "@mimetype": "image/gif"
          },
          {
            "@category": "thumbnail",
            "@height": "92",
            "@width": "219",
            "@_fa": "true",
            "$": "https://api.elsevier.com/content/object/eid/1-s2.0-S0926860X25000870-gr9.sml?httpAccept=%2A%2F%2A",
            "@multimediatype": "GIF image file",
            "@type": "IMAGE-THUMBNAIL",
            "@size": "5750",
            "@ref": "gr9",
            "@mimetype": "image/gif"
          },
          {
            "@category": "thumbnail",
            "@height": "164",
            "@width": "216",
            "@_fa": "true",
            "$": "https://api.elsevier.com/content/object/eid/1-s2.0-S0926860X25000870-gr4.sml?httpAccept=%2A%2F%2A",
            "@multimediatype": "GIF image file",
            "@type": "IMAGE-THUMBNAIL",
            "@size": "6363",
            "@ref": "gr4",
            "@mimetype": "image/gif"
          },
          {
            "@category": "thumbnail",
            "@height": "164",
            "@width": "130",
            "@_fa": "true",
            "$": "https://api.elsevier.com/content/object/eid/1-s2.0-S0926860X25000870-gr3.sml?httpAccept=%2A%2F%2A",
            "@multimediatype": "GIF image file",
            "@type": "IMAGE-THUMBNAIL",
            "@size": "8334",
            "@ref": "gr3",
            "@mimetype": "image/gif"
          },
          {
            "@category": "thumbnail",
            "@height": "86",
            "@width": "219",
            "@_fa": "true",
            "$": "https://api.elsevier.com/content/object/eid/1-s2.0-S0926860X25000870-gr6.sml?httpAccept=%2A%2F%2A",
            "@multimediatype": "GIF image file",
            "@type": "IMAGE-THUMBNAIL",
            "@size": "6018",
            "@ref": "gr6",
            "@mimetype": "image/gif"
          },
          {
            "@category": "thumbnail",
            "@height": "164",
            "@width": "129",
            "@_fa": "true",
            "$": "https://api.elsevier.com/content/object/eid/1-s2.0-S0926860X25000870-gr5.sml?httpAccept=%2A%2F%2A",
            "@multimediatype": "GIF image file",
            "@type": "IMAGE-THUMBNAIL",
            "@size": "17299",
            "@ref": "gr5",
            "@mimetype": "image/gif"
          },
          {
            "@category": "high",
            "@height": "271",
            "@width": "465",
            "@_fa": "true",
            "$": "https://api.elsevier.com/content/object/eid/1-s2.0-S0926860X25000870-fx10_lrg.jpg?httpAccept=%2A%2F%2A",
            "@multimediatype": "JPEG image file",
            "@type": "IMAGE-HIGH-RES",
            "@size": "11713",
            "@ref": "fx10",
            "@mimetype": "image/jpeg"
          },
          {
            "@category": "high",
            "@height": "381",
            "@width": "533",
            "@_fa": "true",
            "$": "https://api.elsevier.com/content/object/eid/1-s2.0-S0926860X25000870-fx11_lrg.jpg?httpAccept=%2A%2F%2A",
            "@multimediatype": "JPEG image file",
            "@type": "IMAGE-HIGH-RES",
            "@size": "17133",
            "@ref": "fx11",
            "@mimetype": "image/jpeg"
          },
          {
            "@category": "high",
            "@height": "886",
            "@width": "1544",
            "@_fa": "true",
            "$": "https://api.elsevier.com/content/object/eid/1-s2.0-S0926860X25000870-ga1_lrg.jpg?httpAccept=%2A%2F%2A",
            "@multimediatype": "JPEG image file",
            "@type": "IMAGE-HIGH-RES",
            "@size": "205395",
            "@ref": "ga1",
            "@mimetype": "image/jpeg"
          },
          {
            "@category": "high",
            "@height": "171",
            "@width": "587",
            "@_fa": "true",
            "$": "https://api.elsevier.com/content/object/eid/1-s2.0-S0926860X25000870-fx12_lrg.jpg?httpAccept=%2A%2F%2A",
            "@multimediatype": "JPEG image file",
            "@type": "IMAGE-HIGH-RES",
            "@size": "10273",
            "@ref": "fx12",
            "@mimetype": "image/jpeg"
          },
          {
            "@category": "high",
            "@height": "261",
            "@width": "607",
            "@_fa": "true",
            "$": "https://api.elsevier.com/content/object/eid/1-s2.0-S0926860X25000870-fx13_lrg.jpg?httpAccept=%2A%2F%2A",
            "@multimediatype": "JPEG image file",
            "@type": "IMAGE-HIGH-RES",
            "@size": "14172",
            "@ref": "fx13",
            "@mimetype": "image/jpeg"
          },
          {
            "@category": "high",
            "@height": "210",
            "@width": "286",
            "@_fa": "true",
            "$": "https://api.elsevier.com/content/object/eid/1-s2.0-S0926860X25000870-fx14_lrg.jpg?httpAccept=%2A%2F%2A",
            "@multimediatype": "JPEG image file",
            "@type": "IMAGE-HIGH-RES",
            "@size": "7851",
            "@ref": "fx14",
            "@mimetype": "image/jpeg"
          },
          {
            "@category": "high",
            "@height": "214",
            "@width": "454",
            "@_fa": "true",
            "$": "https://api.elsevier.com/content/object/eid/1-s2.0-S0926860X25000870-fx15_lrg.jpg?httpAccept=%2A%2F%2A",
            "@multimediatype": "JPEG image file",
            "@type": "IMAGE-HIGH-RES",
            "@size": "12861",
            "@ref": "fx15",
            "@mimetype": "image/jpeg"
          },
          {
            "@category": "high",
            "@height": "524",
            "@width": "2245",
            "@_fa": "true",
            "$": "https://api.elsevier.com/content/object/eid/1-s2.0-S0926860X25000870-fx1_lrg.jpg?httpAccept=%2A%2F%2A",
            "@multimediatype": "JPEG image file",
            "@type": "IMAGE-HIGH-RES",
            "@size": "60399",
            "@ref": "fx1",
            "@mimetype": "image/jpeg"
          },
          {
            "@category": "high",
            "@height": "213",
            "@width": "533",
            "@_fa": "true",
            "$": "https://api.elsevier.com/content/object/eid/1-s2.0-S0926860X25000870-fx7_lrg.jpg?httpAccept=%2A%2F%2A",
            "@multimediatype": "JPEG image file",
            "@type": "IMAGE-HIGH-RES",
            "@size": "12763",
            "@ref": "fx7",
            "@mimetype": "image/jpeg"
          },
          {
            "@category": "high",
            "@height": "185",
            "@width": "396",
            "@_fa": "true",
            "$": "https://api.elsevier.com/content/object/eid/1-s2.0-S0926860X25000870-fx6_lrg.jpg?httpAccept=%2A%2F%2A",
            "@multimediatype": "JPEG image file",
            "@type": "IMAGE-HIGH-RES",
            "@size": "7288",
            "@ref": "fx6",
            "@mimetype": "image/jpeg"
          },
          {
            "@category": "high",
            "@height": "313",
            "@width": "486",
            "@_fa": "true",
            "$": "https://api.elsevier.com/content/object/eid/1-s2.0-S0926860X25000870-fx9_lrg.jpg?httpAccept=%2A%2F%2A",
            "@multimediatype": "JPEG image file",
            "@type": "IMAGE-HIGH-RES",
            "@size": "14825",
            "@ref": "fx9",
            "@mimetype": "image/jpeg"
          },
          {
            "@category": "high",
            "@height": "1384",
            "@width": "1663",
            "@_fa": "true",
            "$": "https://api.elsevier.com/content/object/eid/1-s2.0-S0926860X25000870-gr2_lrg.jpg?httpAccept=%2A%2F%2A",
            "@multimediatype": "JPEG image file",
            "@type": "IMAGE-HIGH-RES",
            "@size": "140051",
            "@ref": "gr2",
            "@mimetype": "image/jpeg"
          },
          {
            "@category": "high",
            "@height": "270",
            "@width": "352",
            "@_fa": "true",
            "$": "https://api.elsevier.com/content/object/eid/1-s2.0-S0926860X25000870-fx8_lrg.jpg?httpAccept=%2A%2F%2A",
            "@multimediatype": "JPEG image file",
            "@type": "IMAGE-HIGH-RES",
            "@size": "10339",
            "@ref": "fx8",
            "@mimetype": "image/jpeg"
          },
          {
            "@category": "high",
            "@height": "1189",
            "@width": "2911",
            "@_fa": "true",
            "$": "https://api.elsevier.com/content/object/eid/1-s2.0-S0926860X25000870-gr1_lrg.jpg?httpAccept=%2A%2F%2A",
            "@multimediatype": "JPEG image file",
            "@type": "IMAGE-HIGH-RES",
            "@size": "273604",
            "@ref": "gr1",
            "@mimetype": "image/jpeg"
          },
          {
            "@category": "high",
            "@height": "207",
            "@width": "384",
            "@_fa": "true",
            "$": "https://api.elsevier.com/content/object/eid/1-s2.0-S0926860X25000870-fx3_lrg.jpg?httpAccept=%2A%2F%2A",
            "@multimediatype": "JPEG image file",
            "@type": "IMAGE-HIGH-RES",
            "@size": "9466",
            "@ref": "fx3",
            "@mimetype": "image/jpeg"
          },
          {
            "@category": "high",
            "@height": "1083",
            "@width": "1663",
            "@_fa": "true",
            "$": "https://api.elsevier.com/content/object/eid/1-s2.0-S0926860X25000870-sc1_lrg.jpg?httpAccept=%2A%2F%2A",
            "@multimediatype": "JPEG image file",
            "@type": "IMAGE-HIGH-RES",
            "@size": "146901",
            "@ref": "sc1",
            "@mimetype": "image/jpeg"
          },
          {
            "@category": "high",
            "@height": "148",
            "@width": "243",
            "@_fa": "true",
            "$": "https://api.elsevier.com/content/object/eid/1-s2.0-S0926860X25000870-fx2_lrg.jpg?httpAccept=%2A%2F%2A",
            "@multimediatype": "JPEG image file",
            "@type": "IMAGE-HIGH-RES",
            "@size": "4257",
            "@ref": "fx2",
            "@mimetype": "image/jpeg"
          },
          {
            "@category": "high",
            "@height": "199",
            "@width": "496",
            "@_fa": "true",
            "$": "https://api.elsevier.com/content/object/eid/1-s2.0-S0926860X25000870-fx5_lrg.jpg?httpAccept=%2A%2F%2A",
            "@multimediatype": "JPEG image file",
            "@type": "IMAGE-HIGH-RES",
            "@size": "11463",
            "@ref": "fx5",
            "@mimetype": "image/jpeg"
          },
          {
            "@category": "high",
            "@height": "180",
            "@width": "378",
            "@_fa": "true",
            "$": "https://api.elsevier.com/content/object/eid/1-s2.0-S0926860X25000870-fx4_lrg.jpg?httpAccept=%2A%2F%2A",
            "@multimediatype": "JPEG image file",
            "@type": "IMAGE-HIGH-RES",
            "@size": "7080",
            "@ref": "fx4",
            "@mimetype": "image/jpeg"
          },
          {
            "@category": "high",
            "@height": "2527",
            "@width": "2911",
            "@_fa": "true",
            "$": "https://api.elsevier.com/content/object/eid/1-s2.0-S0926860X25000870-sc2_lrg.jpg?httpAccept=%2A%2F%2A",
            "@multimediatype": "JPEG image file",
            "@type": "IMAGE-HIGH-RES",
            "@size": "255603",
            "@ref": "sc2",
            "@mimetype": "image/jpeg"
          },
          {
            "@category": "high",
            "@height": "1234",
            "@width": "2911",
            "@_fa": "true",
            "$": "https://api.elsevier.com/content/object/eid/1-s2.0-S0926860X25000870-gr8_lrg.jpg?httpAccept=%2A%2F%2A",
            "@multimediatype": "JPEG image file",
            "@type": "IMAGE-HIGH-RES",
            "@size": "169992",
            "@ref": "gr8",
            "@mimetype": "image/jpeg"
          },
          {
            "@category": "high",
            "@height": "1229",
            "@width": "2911",
            "@_fa": "true",
            "$": "https://api.elsevier.com/content/object/eid/1-s2.0-S0926860X25000870-gr7_lrg.jpg?httpAccept=%2A%2F%2A",
            "@multimediatype": "JPEG image file",
            "@type": "IMAGE-HIGH-RES",
            "@size": "197789",
            "@ref": "gr7",
            "@mimetype": "image/jpeg"
          },
          {
            "@category": "high",
            "@height": "2733",
            "@width": "2911",
            "@_fa": "true",
            "$": "https://api.elsevier.com/content/object/eid/1-s2.0-S0926860X25000870-gr10_lrg.jpg?httpAccept=%2A%2F%2A",
            "@multimediatype": "JPEG image file",
            "@type": "IMAGE-HIGH-RES",
            "@size": "440128",
            "@ref": "gr10",
            "@mimetype": "image/jpeg"
          },
          {
            "@category": "high",
            "@height": "1219",
            "@width": "2911",
            "@_fa": "true",
            "$": "https://api.elsevier.com/content/object/eid/1-s2.0-S0926860X25000870-gr9_lrg.jpg?httpAccept=%2A%2F%2A",
            "@multimediatype": "JPEG image file",
            "@type": "IMAGE-HIGH-RES",
            "@size": "163567",
            "@ref": "gr9",
            "@mimetype": "image/jpeg"
          },
          {
            "@category": "high",
            "@height": "1262",
            "@width": "1663",
            "@_fa": "true",
            "$": "https://api.elsevier.com/content/object/eid/1-s2.0-S0926860X25000870-gr4_lrg.jpg?httpAccept=%2A%2F%2A",
            "@multimediatype": "JPEG image file",
            "@type": "IMAGE-HIGH-RES",
            "@size": "87735",
            "@ref": "gr4",
            "@mimetype": "image/jpeg"
          },
          {
            "@category": "high",
            "@height": "3668",
            "@width": "2911",
            "@_fa": "true",
            "$": "https://api.elsevier.com/content/object/eid/1-s2.0-S0926860X25000870-gr3_lrg.jpg?httpAccept=%2A%2F%2A",
            "@multimediatype": "JPEG image file",
            "@type": "IMAGE-HIGH-RES",
            "@size": "574388",
            "@ref": "gr3",
            "@mimetype": "image/jpeg"
          },
          {
            "@category": "high",
            "@height": "1149",
            "@width": "2911",
            "@_fa": "true",
            "$": "https://api.elsevier.com/content/object/eid/1-s2.0-S0926860X25000870-gr6_lrg.jpg?httpAccept=%2A%2F%2A",
            "@multimediatype": "JPEG image file",
            "@type": "IMAGE-HIGH-RES",
            "@size": "205687",
            "@ref": "gr6",
            "@mimetype": "image/jpeg"
          },
          {
            "@category": "high",
            "@height": "3173",
            "@width": "2495",
            "@_fa": "true",
            "$": "https://api.elsevier.com/content/object/eid/1-s2.0-S0926860X25000870-gr5_lrg.jpg?httpAccept=%2A%2F%2A",
            "@multimediatype": "JPEG image file",
            "@type": "IMAGE-HIGH-RES",
            "@size": "577596",
            "@ref": "gr5",
            "@mimetype": "image/jpeg"
          },
          {
            "@category": "standard",
            "@_fa": "true",
            "$": "https://api.elsevier.com/content/object/eid/1-s2.0-S0926860X25000870-mmc1.docx?httpAccept=%2A%2F%2A",
            "@multimediatype": "Microsoft Word file",
            "@type": "APPLICATION",
            "@size": "9589216",
            "@ref": "mmc1",
            "@mimetype": "application/word"
          }
        ]
      },
      "link": {
        "@rel": "abstract",
        "@href": "https://api.elsevier.com/content/abstract/scopus_id/85219690087"
      }
    }
  }
}