{
  "metadata": {
    "title": "Methane dehydroaromatization (MDA) on VO<ce:inf loc=post><ce:italic>x</ce:italic></ce:inf>/HZSM-5 catalysts",
    "authors": "; ; ",
    "journal": "Applied Catalysis A: General",
    "date": "2024-04-25",
    "doi": "10.1016/j.apcata.2024.119662",
    "abstract": "",
    "uri": "https://api.elsevier.com/content/article/pii/S0926860X24001066",
    "pii": "S0926860X24001066"
  },
  "fulltext": {
    "full-text-retrieval-response": {
      "scopus-eid": "2-s2.0-85187654125",
      "originalText": "serial JL 271346 291210 291744 291809 31 Applied Catalysis A: General APPLIEDCATALYSISAGENERAL 2024-03-07 2024-03-07 2024-03-14 2024-03-14 2024-04-19T00:52:21 1-s2.0-S0926860X24001066 S0926-860X(24)00106-6 S0926860X24001066 10.1016/j.apcata.2024.119662 S300 S300.1 FULL-TEXT 1-s2.0-S0926860X24X00046 2024-04-26T09:30:59.069366Z 0 0 20240425 2024 2024-03-07T17:19:53.249347Z absattachment articleinfo articlenumber articletitlenorm authfirstinitialnorm authfirstsurnamenorm cid cids contenttype copyright crossmark dateloaded dateloadedtxt datesearch datesort dateupdated dco docsubtype doctype doi eid ewtransactionid hubeid indexeddate issn issnnorm itemstage itemtransactionid itemweight openaccess openarchive pg pgfirst pii piinorm pubdatestart pubdatetxt pubyr sortorder srctitle srctitlenorm srctype ssids alllist content subj subheadings suppl tomb volfirst volissue volumelist webpdf webpdfpagecount yearnav figure body mmlmath acknowledge affil articletitle auth authfirstini authfull authkeywords authlast grantnumber grantsponsor highlightsabst orcid primabst ref specialabst 0926-860X 0926860X true 676 676 C Volume 676 10 119662 119662 119662 20240425 25 April 2024 2024-04-25 2024 article fla © 2024 Elsevier B.V. All rights reserved. METHANEDEHYDROAROMATIZATIONMDAVOXHZSM5CATALYSTS JUNG H 1 Introduction 2 Experimental section 2.1 Materials 2.2 Preparation of the VOx/HZSM-5 catalysts 2.3 MDA reactions 2.4 Characterization 3 Results and discussion 3.1 MDA on VOx/HZSM-5 3.2 Role of catalyst supports in MDA reaction on VOx catalysts 3.3 Aromatization reaction of C2H4 3.4 Effect of H2 co-feeding 4 Conclusions CRediT authorship contribution statement Acknowledgment References GAO 2019 8592 8621 Y OLIVOSSUAREZ 2016 2965 2981 A WOLF 2014 986 988 E DIPU 2020 375 379 A GERCEKER 2017 2088 2100 D GUO 2014 616 619 X LI 2021 882 891 Z NISHIKAWA 2017 4572 4576 Y TAKAMURA 2023 162 170 R TOMONO 2023 4656 4664 T XIAO 2018 2735 2740 Y XIE 2018 4044 4048 P WANG 1993 35 41 L BORRY 1999 5787 5796 R DING 2001 506 513 W ISMAGILOV 2008 526 541 Z LEZCANOGONZALEZ 2016 5215 5219 I SOLYMOSI 1997 150 161 F WANG 1997 347 358 D SHU 2003 315 329 Y GU 2021 6771 6786 Y XU 2020 102 118 Y WECKHUYSEN 1998 338 346 B WECKHUYSEN 1998 347 351 B KIANI 2021 1251 1268 D MA 2013 1 20 S RAMASUBRAMANIAN 2019 20 32 V ZHANG 1998 207 213 C HUANG 2020 13583 13590 J SHIRAZI 2008 1300 1306 L MA 2000 105 114 D OLTHOF 2000 1516 1528 B HESS 2007 9471 9479 C RODRIGUEZGOMEZ 2020 6138 6150 A FERRARI 2007 47 57 A SHU 2000 161 167 Y LIU 2002 271 279 Z MA 2003 143 146 H OSAWA 2003 57 62 T SONG 2015 261 272 Y JUNGX2024X119662 JUNGX2024X119662XH CH_JST publishAcceptedManuscriptIndexable NR_JUSTICE publishAcceptedManuscriptIndexable http://www.elsevier.com/open-access/userlicense/1.0/ 2026-03-14T00:00:00.000Z http://creativecommons.org/licenses/by-nc-nd/4.0/ © 2024 Elsevier B.V. All rights reserved. 2024-03-19T02:20:36.455Z http://vtw.elsevier.com/data/voc/AddOnTypes/50.7/aggregated-refined Aichi Science & Technology Foundation 2022D5010 Aichi Science and Technology Foundation http://data.elsevier.com/vocabulary/SciValFunders/501100007816 http://sws.geonames.org/1861060/ Comprehensive Analysis Center for Science at Saitama University JST CREST http://data.elsevier.com/vocabulary/SciValFunders/501100002241 http://sws.geonames.org/1861060 JST CREST JPMJCR15P4 CREST Core Research for Evolutional Science and Technology http://data.elsevier.com/vocabulary/SciValFunders/501100003382 http://sws.geonames.org/1861060/ This work was supported by the JST CREST (grant number: JPMJCR15P4). We appreciate the technical support provided by the Comprehensive Analysis Center for Science at Saitama University for the Raman spectroscopy, XRD measurements, and XPS analysis. The XAFS experiments were conducted at the BL5S1 of Aichi Synchrotron Radiation Center, Aichi Science & Technology Foundation, Aichi, Japan (Proposal No. 2022D5010). https://doi.org/10.15223/policy-017 https://doi.org/10.15223/policy-037 https://doi.org/10.15223/policy-012 https://doi.org/10.15223/policy-029 https://doi.org/10.15223/policy-004 item S0926-860X(24)00106-6 S0926860X24001066 1-s2.0-S0926860X24001066 10.1016/j.apcata.2024.119662 271346 2024-04-26T09:30:59.069366Z 2024-04-25 1-s2.0-S0926860X24001066-main.pdf https://s3-eu-west-1.amazonaws.com/prod-ucs-content-store-eu-west/content/pii:S0926860X24001066/MAIN/application/pdf/fc26bb5ba5ac6c0259123461e252436e/main.pdf main.pdf pdf true 6842643 MAIN 11 1-s2.0-S0926860X24001066-main_1.png https://s3-eu-west-1.amazonaws.com/prod-ucs-content-store-eu-west/content/pii:S0926860X24001066/PREVIEW/image/png/d39643251f9888fc42358ec73c006b89/main_1.png main_1.png png 59763 849 656 IMAGE-WEB-PDF 1 1-s2.0-S0926860X24001066-gr11.jpg https://s3-eu-west-1.amazonaws.com/prod-ucs-content-store-eu-west/content/pii:S0926860X24001066/gr11/DOWNSAMPLED/image/jpeg/1c47d4acc89564927e1426e8e351f247/gr11.jpg gr11 gr11.jpg jpg 34045 285 602 IMAGE-DOWNSAMPLED 1-s2.0-S0926860X24001066-gr10.jpg https://s3-eu-west-1.amazonaws.com/prod-ucs-content-store-eu-west/content/pii:S0926860X24001066/gr10/DOWNSAMPLED/image/jpeg/e0f10341254bc3eaa83004a236a61511/gr10.jpg gr10 gr10.jpg jpg 19348 325 339 IMAGE-DOWNSAMPLED 1-s2.0-S0926860X24001066-gr6.jpg https://s3-eu-west-1.amazonaws.com/prod-ucs-content-store-eu-west/content/pii:S0926860X24001066/gr6/DOWNSAMPLED/image/jpeg/f7425e93cdbe72f788a31d353d7a5d0e/gr6.jpg gr6 gr6.jpg jpg 72257 602 602 IMAGE-DOWNSAMPLED 1-s2.0-S0926860X24001066-gr7.jpg https://s3-eu-west-1.amazonaws.com/prod-ucs-content-store-eu-west/content/pii:S0926860X24001066/gr7/DOWNSAMPLED/image/jpeg/9620bef220abe0db713449091d68c363/gr7.jpg gr7 gr7.jpg jpg 34740 279 602 IMAGE-DOWNSAMPLED 1-s2.0-S0926860X24001066-gr8.jpg https://s3-eu-west-1.amazonaws.com/prod-ucs-content-store-eu-west/content/pii:S0926860X24001066/gr8/DOWNSAMPLED/image/jpeg/c69f1eb02a78dc0126a242d65a3f46d3/gr8.jpg gr8 gr8.jpg jpg 42125 601 602 IMAGE-DOWNSAMPLED 1-s2.0-S0926860X24001066-gr9.jpg https://s3-eu-west-1.amazonaws.com/prod-ucs-content-store-eu-west/content/pii:S0926860X24001066/gr9/DOWNSAMPLED/image/jpeg/172b144eae5c5cbf974c7af2e1c4dee5/gr9.jpg gr9 gr9.jpg jpg 75361 583 602 IMAGE-DOWNSAMPLED 1-s2.0-S0926860X24001066-gr2.jpg https://s3-eu-west-1.amazonaws.com/prod-ucs-content-store-eu-west/content/pii:S0926860X24001066/gr2/DOWNSAMPLED/image/jpeg/cd1add9a3ce7a7a61b3a174dc1d1d07d/gr2.jpg gr2 gr2.jpg jpg 74062 598 602 IMAGE-DOWNSAMPLED 1-s2.0-S0926860X24001066-ga1.jpg https://s3-eu-west-1.amazonaws.com/prod-ucs-content-store-eu-west/content/pii:S0926860X24001066/ga1/DOWNSAMPLED/image/jpeg/9d90632057bad710aef904ce0ab576e0/ga1.jpg ga1 true ga1.jpg jpg 25012 185 500 IMAGE-DOWNSAMPLED 1-s2.0-S0926860X24001066-gr3.jpg https://s3-eu-west-1.amazonaws.com/prod-ucs-content-store-eu-west/content/pii:S0926860X24001066/gr3/DOWNSAMPLED/image/jpeg/ce8cdb06b20741cf700a82e66575cbcb/gr3.jpg gr3 gr3.jpg jpg 48431 425 602 IMAGE-DOWNSAMPLED 1-s2.0-S0926860X24001066-gr4.jpg https://s3-eu-west-1.amazonaws.com/prod-ucs-content-store-eu-west/content/pii:S0926860X24001066/gr4/DOWNSAMPLED/image/jpeg/76aaca4040ef1bdd2138fa26e0c63b42/gr4.jpg gr4 gr4.jpg jpg 74265 598 602 IMAGE-DOWNSAMPLED 1-s2.0-S0926860X24001066-gr5.jpg https://s3-eu-west-1.amazonaws.com/prod-ucs-content-store-eu-west/content/pii:S0926860X24001066/gr5/DOWNSAMPLED/image/jpeg/4f8ac11adc6bdd568186008eade93a55/gr5.jpg gr5 gr5.jpg jpg 72403 601 602 IMAGE-DOWNSAMPLED 1-s2.0-S0926860X24001066-gr1.jpg https://s3-eu-west-1.amazonaws.com/prod-ucs-content-store-eu-west/content/pii:S0926860X24001066/gr1/DOWNSAMPLED/image/jpeg/7d295348947283b00374c36ffcc14d85/gr1.jpg gr1 gr1.jpg jpg 57921 606 602 IMAGE-DOWNSAMPLED 1-s2.0-S0926860X24001066-gr11.sml https://s3-eu-west-1.amazonaws.com/prod-ucs-content-store-eu-west/content/pii:S0926860X24001066/gr11/THUMBNAIL/image/gif/334a1c08c6b89889480c66d7d73f0e99/gr11.sml gr11 gr11.sml sml 5070 104 219 IMAGE-THUMBNAIL 1-s2.0-S0926860X24001066-gr10.sml https://s3-eu-west-1.amazonaws.com/prod-ucs-content-store-eu-west/content/pii:S0926860X24001066/gr10/THUMBNAIL/image/gif/092090fedb81cd60b8820e571a97d75c/gr10.sml gr10 gr10.sml sml 5367 164 171 IMAGE-THUMBNAIL 1-s2.0-S0926860X24001066-gr6.sml https://s3-eu-west-1.amazonaws.com/prod-ucs-content-store-eu-west/content/pii:S0926860X24001066/gr6/THUMBNAIL/image/gif/e2adb3c3aa74ba467d558bd85892d44e/gr6.sml gr6 gr6.sml sml 7822 164 164 IMAGE-THUMBNAIL 1-s2.0-S0926860X24001066-gr7.sml https://s3-eu-west-1.amazonaws.com/prod-ucs-content-store-eu-west/content/pii:S0926860X24001066/gr7/THUMBNAIL/image/gif/7faf1e1f23c0bd54ad2679e855ccce0b/gr7.sml gr7 gr7.sml sml 5483 102 219 IMAGE-THUMBNAIL 1-s2.0-S0926860X24001066-gr8.sml https://s3-eu-west-1.amazonaws.com/prod-ucs-content-store-eu-west/content/pii:S0926860X24001066/gr8/THUMBNAIL/image/gif/476ac94b486ba5a263fd60e990ce6456/gr8.sml gr8 gr8.sml sml 4411 164 164 IMAGE-THUMBNAIL 1-s2.0-S0926860X24001066-gr9.sml https://s3-eu-west-1.amazonaws.com/prod-ucs-content-store-eu-west/content/pii:S0926860X24001066/gr9/THUMBNAIL/image/gif/3e2c69e4e15e53d5a94b31df62b42241/gr9.sml gr9 gr9.sml sml 8567 164 169 IMAGE-THUMBNAIL 1-s2.0-S0926860X24001066-gr2.sml https://s3-eu-west-1.amazonaws.com/prod-ucs-content-store-eu-west/content/pii:S0926860X24001066/gr2/THUMBNAIL/image/gif/9e92381f82194eb38cb290ad95de0dca/gr2.sml gr2 gr2.sml sml 7624 164 165 IMAGE-THUMBNAIL 1-s2.0-S0926860X24001066-ga1.sml https://s3-eu-west-1.amazonaws.com/prod-ucs-content-store-eu-west/content/pii:S0926860X24001066/ga1/THUMBNAIL/image/gif/65b6934c3fe2969491e8136c86b930e6/ga1.sml ga1 true ga1.sml sml 6687 81 219 IMAGE-THUMBNAIL 1-s2.0-S0926860X24001066-gr3.sml https://s3-eu-west-1.amazonaws.com/prod-ucs-content-store-eu-west/content/pii:S0926860X24001066/gr3/THUMBNAIL/image/gif/33cecffc70557b20e408b22ae499cdc0/gr3.sml gr3 gr3.sml sml 8278 155 219 IMAGE-THUMBNAIL 1-s2.0-S0926860X24001066-gr4.sml https://s3-eu-west-1.amazonaws.com/prod-ucs-content-store-eu-west/content/pii:S0926860X24001066/gr4/THUMBNAIL/image/gif/d587f97a40af84f9545e70701be4ceb9/gr4.sml gr4 gr4.sml sml 8859 164 165 IMAGE-THUMBNAIL 1-s2.0-S0926860X24001066-gr5.sml https://s3-eu-west-1.amazonaws.com/prod-ucs-content-store-eu-west/content/pii:S0926860X24001066/gr5/THUMBNAIL/image/gif/3757e3961823e54be1a52c9e1e7eeba5/gr5.sml gr5 gr5.sml sml 8070 164 164 IMAGE-THUMBNAIL 1-s2.0-S0926860X24001066-gr1.sml https://s3-eu-west-1.amazonaws.com/prod-ucs-content-store-eu-west/content/pii:S0926860X24001066/gr1/THUMBNAIL/image/gif/a65616fd797f7c6d211c5be0e7d09271/gr1.sml gr1 gr1.sml sml 6084 164 163 IMAGE-THUMBNAIL 1-s2.0-S0926860X24001066-gr11_lrg.jpg https://s3-eu-west-1.amazonaws.com/prod-ucs-content-store-eu-west/content/pii:S0926860X24001066/HIGHRES/image/jpeg/d7f9664a50c7bb1bb98670b4a7f1bc3d/gr11_lrg.jpg gr11 gr11_lrg.jpg jpg 153001 1260 2661 IMAGE-HIGH-RES 1-s2.0-S0926860X24001066-gr10_lrg.jpg https://s3-eu-west-1.amazonaws.com/prod-ucs-content-store-eu-west/content/pii:S0926860X24001066/HIGHRES/image/jpeg/081fbc23c5531fcc88ada13e918c83ca/gr10_lrg.jpg gr10 gr10_lrg.jpg jpg 86708 1434 1497 IMAGE-HIGH-RES 1-s2.0-S0926860X24001066-gr6_lrg.jpg https://s3-eu-west-1.amazonaws.com/prod-ucs-content-store-eu-west/content/pii:S0926860X24001066/HIGHRES/image/jpeg/ad8047f97851105726296ad7b93f0126/gr6_lrg.jpg gr6 gr6_lrg.jpg jpg 334365 2659 2661 IMAGE-HIGH-RES 1-s2.0-S0926860X24001066-gr7_lrg.jpg https://s3-eu-west-1.amazonaws.com/prod-ucs-content-store-eu-west/content/pii:S0926860X24001066/HIGHRES/image/jpeg/4fbf85284d4fce1186002522e425acc4/gr7_lrg.jpg gr7 gr7_lrg.jpg jpg 159199 1234 2661 IMAGE-HIGH-RES 1-s2.0-S0926860X24001066-gr8_lrg.jpg https://s3-eu-west-1.amazonaws.com/prod-ucs-content-store-eu-west/content/pii:S0926860X24001066/HIGHRES/image/jpeg/f5a32d7543d316bc3cef00be801be959/gr8_lrg.jpg gr8 gr8_lrg.jpg jpg 187319 2655 2661 IMAGE-HIGH-RES 1-s2.0-S0926860X24001066-gr9_lrg.jpg https://s3-eu-west-1.amazonaws.com/prod-ucs-content-store-eu-west/content/pii:S0926860X24001066/HIGHRES/image/jpeg/63757a261e8e32bbbf4b2311d94242ad/gr9_lrg.jpg gr9 gr9_lrg.jpg jpg 333050 2578 2661 IMAGE-HIGH-RES 1-s2.0-S0926860X24001066-gr2_lrg.jpg https://s3-eu-west-1.amazonaws.com/prod-ucs-content-store-eu-west/content/pii:S0926860X24001066/HIGHRES/image/jpeg/b54d3b1d57863be48118a7133ffb67bc/gr2_lrg.jpg gr2 gr2_lrg.jpg jpg 334784 2645 2661 IMAGE-HIGH-RES 1-s2.0-S0926860X24001066-ga1_lrg.jpg https://s3-eu-west-1.amazonaws.com/prod-ucs-content-store-eu-west/content/pii:S0926860X24001066/HIGHRES/image/jpeg/48cbf8bcca683eec6b2cce6c4ace3bee/ga1_lrg.jpg ga1 true ga1_lrg.jpg jpg 171952 818 2213 IMAGE-HIGH-RES 1-s2.0-S0926860X24001066-gr3_lrg.jpg https://s3-eu-west-1.amazonaws.com/prod-ucs-content-store-eu-west/content/pii:S0926860X24001066/HIGHRES/image/jpeg/0157f5a2c2d9f2a11e4799321dd075ec/gr3_lrg.jpg gr3 gr3_lrg.jpg jpg 217571 1878 2661 IMAGE-HIGH-RES 1-s2.0-S0926860X24001066-gr4_lrg.jpg https://s3-eu-west-1.amazonaws.com/prod-ucs-content-store-eu-west/content/pii:S0926860X24001066/HIGHRES/image/jpeg/a3af20c0cda546c0a002993fefe1b86f/gr4_lrg.jpg gr4 gr4_lrg.jpg jpg 327010 2642 2661 IMAGE-HIGH-RES 1-s2.0-S0926860X24001066-gr5_lrg.jpg https://s3-eu-west-1.amazonaws.com/prod-ucs-content-store-eu-west/content/pii:S0926860X24001066/HIGHRES/image/jpeg/a99d96284adcde337f732838ddaf6948/gr5_lrg.jpg gr5 gr5_lrg.jpg jpg 325610 2657 2661 IMAGE-HIGH-RES 1-s2.0-S0926860X24001066-gr1_lrg.jpg https://s3-eu-west-1.amazonaws.com/prod-ucs-content-store-eu-west/content/pii:S0926860X24001066/HIGHRES/image/jpeg/989b55ea69b1ce6740f0da53c2cc4ef9/gr1_lrg.jpg gr1 gr1_lrg.jpg jpg 249788 2679 2661 IMAGE-HIGH-RES 1-s2.0-S0926860X24001066-si0001.svg https://s3-eu-west-1.amazonaws.com/prod-ucs-content-store-eu-west/content/pii:S0926860X24001066/image/svg+xml/e52c4bb511e477e6d43cbb3916079bc6/si0001.svg si0001 si0001.svg svg 9819 ALTIMG 1-s2.0-S0926860X24001066-si0002.svg https://s3-eu-west-1.amazonaws.com/prod-ucs-content-store-eu-west/content/pii:S0926860X24001066/image/svg+xml/39a3032533059e53c654f5084050ec2c/si0002.svg si0002 si0002.svg svg 3987 ALTIMG 1-s2.0-S0926860X24001066-am.pdf am am.pdf pdf 1995727 AAM-PDF https://s3-eu-west-1.amazonaws.com/prod-ucs-content-store-eu-west/content/egi:10BL4QW4HJW/MAIN/application/pdf/426be4419115e71af93ef70436654052/am.pdf APCATA 119662 119662 S0926-860X(24)00106-6 10.1016/j.apcata.2024.119662 Elsevier B.V. Fig. 1 Time course of (a) CH4 conversion, (b) aromatics selectivity, and (c) C2 hydrocarbons selectivity for MDA reaction. (d) Product selectivity for MDA reaction. Catalyst: (a) VO x /HZSM-5 and HZSM-5 and (b, c, d) VO x /HZSM-5, temperature: 750 °C, flow rate: 20 mL min−1, and catalyst mass: 0.50 g. Fig. 1 Fig. 2 (a) XRD patterns, (b) Raman spectra, and (c) V 2p3/2 XPS spectra of HZSM-5, fresh VO x /HZSM-5, and spent VO x /HZSM-5 catalysts. (d) TG profile of a spent VO x /HZSM-5 catalyst. Fig. 2 Fig. 3 V K-edge XANES spectra of (a) VO x /HZSM-5 before and after MDA reaction and (b) reference samples. Fig. 3 Fig. 4 Time course of (a) CH4 conversion, (b) aromatics selectivity, and (c) C2 hydrocarbons selectivity for MDA reaction. (d) Product selectivity for MDA reaction. Temperature: 750 °C, flow rate: 20 mL min−1, and catalyst mass: 0.50 g. Fig. 4 Fig. 5 Time course of (a) CH4 conversion, (b) aromatics selectivity, and (c) C2 hydrocarbons selectivity for MDA reaction. (d) Product selectivity for MDA reaction. Catalyst: VO x /HZSM-5 with different SiO2/Al2O3 ratio, temperature: 750 °C, flow rate: 20 mL min−1, and catalyst mass: 0.50 g. Fig. 5 Fig. 6 Time course of (a) CH4 conversion, (b) aromatics selectivity, and (c) C2 hydrocarbons selectivity for MDA reaction. (d) Product selectivity for MDA reaction. Catalyst: zeolite-supported VO x , temperature: 750 °C, flow rate: 20 mL min−1, and catalyst mass: 0.50 g. Fig. 6 Fig. 7 Time course of (a) C2H4 conversion and (b) benzene selectivity for dehydrogenation reaction of C2H4 on zeolites. Temperature: 750 °C, flow rate: 0.3/1/20 (C2H4/H2/Ar) mL min−1, and catalyst mass: 0.50 g. Fig. 7 Fig. 8 Time course of (a) CH4 conversion, (b) C2 hydrocarbons selectivity, and (c) aromatics selectivity for MDA reaction using VO x /SiO2 or a physical mixture of VO x /SiO2 and HZSM-5. Temperature: 750 °C, flow rate: 20 mL min−1, and catalyst mass: 0.50 g (VO x /SiO2) and 1.0 g (a physical mixture of VO x /SiO2 and HZSM-5, where VO x /SiO2 and HZSM-5 are present in the same mass). Fig. 8 Fig. 9 Time course of (a) CH4 conversion, (b) aromatics selectivity, and (c) C2 hydrocarbons selectivity for MDA reaction. (d) Product selectivity for MDA reaction. Catalyst: VO x /HZSM-5, temperature: 750 °C, flow rate: 20 (CH4), 20/0.5 (CH4/H2), 20/1 (CH4/H2), and 20/2 (CH4/H2) mL min−1, and catalyst mass: 0.50 g. Fig. 9 Fig. 10 TG profiles of VO x /HZSM-5 catalysts after MDA reaction with and without H2 co-feeding. Fig. 10 Fig. 11 Time course of (a) C2H4 conversion and (b) aromatics selectivity for dehydrogenation reaction of C2H4 on VO x /HZSM-5. Temperature: 800 °C, flow rate: 0.3/1 or 2.5/20 (C2H4/H2/Ar) mL min−1, and catalyst mass: 0.50 g. Fig. 11 Methane dehydroaromatization (MDA) on VO x /HZSM-5 catalysts Hyunwoo Jung Writing – original draft Investigation Formal analysis Data curation Taisei Watashima Validation Investigation Data curation Hideki Kurokawa Supervision Hitoshi Ogihara Writing – review & editing Visualization Supervision Project administration Methodology Funding acquisition Conceptualization ⁎ Graduate School of Science and Engineering, Saitama University, 255 Shimo-Okubo, Sakura-ku, Saitama 338-8570, Japan Graduate School of Science and Engineering, Saitama University 255 Shimo-Okubo, Sakura-ku Saitama 338-8570 Japan Graduate School of Science and Engineering, Saitama University, 255 Shimo-Okubo, Sakura-ku, Saitama 338-8570, Japan. ⁎ Corresponding author. In this study, the methane dehydroaromatization (MDA) on vanadium oxide (VO x )-based catalysts was investigated. Using various catalyst supports, VO x /HZSM-5 exhibited the highest MDA activity. In MDA using VO x /HZSM-5, an induction period was observed. Raman spectroscopy and XPS analysis indicated that V2O5 species result in the highly dispersed state by the contact with CH4. X-ray absorption fine structure analysis suggested the formation of VC species. Such structural changes lead to the induction period for the MDA reaction. Based on the effect of the catalyst support and the aromatization reaction of ethylene, we propose a mechanism in which methane forms ethylene on the vanadium catalyst, and ethylene is then aromatized with the aid of the acid sites and micropore structure of HZSM-5. Additionally, the effect of hydrogen co-feeding on the MDA reaction was investigated, which revealed that catalyst deactivation due to coke formation was suppressed in the presence of hydrogen. Graphical Abstract Keywords Methane dehydroaromatization (MDA) VO x /HZSM-5 Zeolites Coke H2 co-feeding Data availability Data will be made available on request. 1 Introduction In the early 2000 s, the shale revolution significantly improved natural gas extraction methods, leading to an increased supply of natural gas. While natural gas is mainly used as a fuel, it can also serve as an alternative to petroleum for producing basic chemicals such as ethylene (C2H4) and benzene. The principal component of natural gas is methane (CH4), and to transform CH4 into basic chemicals, cleaving the C-H bonds in CH4 and forming C-C bonds are crucial. However, because CH4 has the highest C-H bond dissociation energy among all alkanes, its activation and subsequent C-C bond formation are not straightforward [1–3]. The dehydrogenative conversion of CH4 has been investigated, and numerous catalysts that facilitate this reaction have been reported [4–12]. CH4 dehydroaromatization (MDA) is a representative dehydrogenative conversion process. Several HZSM-5-supported transition-metal catalysts have been reported to be effective against MDA. Mo/HZSM-5 is a well-known catalyst that promotes MDA. Since the first report on MDA using Mo/HZSM-5 in 1993 [13], the development of MDA catalysts based on Mo/HZSM-5 has been pursued [14–19]. Molybdenum carbide species (MoC x ), which are believed to form upon the reduction of MoO x in contact with CH4, are considered the active sites for MDA [15,18,20]. Among others, for example, Fe/HZSM-5 has shown that iron carbide species and partially reduced Fe suboxides serve as active sites for MDA [21]. Another example is Co/HZSM-5, in which single-atom Co2+ anchored on the acid sites of the zeolite is believed to be the active site [22]. In 1998, Lunsford et al. reported that among various M/HZSM-5 catalysts (M=Mo, Fe, V, W, and Cr), VO x /HZSM-5 exhibited moderate MDA activity. A maximum CH4 conversion of 3% was achieved at 750°C with a benzene selectivity of approximately 30% [23]. Based on X-ray photoelectron spectroscopy (XPS) measurements, they proposed that V2O3, formed from the reduction of V2O5 upon contact with CH4, acts as an active site for MDA [24]. However, detailed investigations on MDA over VO x /HZSM-5 were not conducted in their studies, and since the studies by Lunsford et al., no other research has been reported on MDA using VO x /HZSM-5, leaving its catalytic performance and active site structure unclear. Kiani et al. also pointed out that only a limited number of studies have reported on the nature of the VO x site in supported VO x /HZSM-5 catalysts during MDA and the necessity for research on VO x /HZSM-5 as an MDA catalyst [25]; however, such studies have not been conducted. In this study, we examined the MDA reaction using VO x /HZSM-5 catalyst. Using X-ray diffraction (XRD), Raman spectroscopy, X-ray absorption fine structure (XAFS), XPS, and thermogravimetric (TG) analyses, we analyzed the structural change in VO x species during MDA. Additionally, it has been reported that HZSM-5 plays a crucial role in the formation of aromatics in MDA on HZSM-5-supported transition-metal catalysts [26–28]. However, the role of HZSM-5 in VOx/HZSM-5 has not yet been investigated; therefore, this study elucidates the effect of HZSM-5 on the MDA over VO x /HZSM-5. Based on these findings, a reaction mechanism for MDA over VO x /HZSM-5 is proposed. Finally, we demonstrate the suppression of catalyst deactivation by co-feeding H2 into the CH4 stream. 2 Experimental section 2.1 Materials Ammonium metavanadate (NH4VO3; Kanto Chemical Co., Inc.), ammonium nitrate (NH4NO3; Wako Pure Chemical Industries, Ltd.), tetraethyl orthosilicate (TEOS; Tokyo Chemical Industry Co., Ltd.), tetrapropylammonium hydroxide (TPAOH; Tokyo Chemical Industry Co., Ltd.), SiO2 (CAB-O-SIL M-5; Cabot Corp.), SiO2·Al2O3 (JRC-SAL-2; Catalysis Society of Japan), HZSM-5 (HSZ-822, HSZ-840, and HSZ-890; Tosoh Corp.), mordenite (JRC-Z-HM20; Catalysis Society of Japan), and NaBEA-25 (JRC-Z-B25; Catalysis Society of Japan) were used as received. For the preparation of silicalite-1, the hydrothermal synthesis method reported in the literature was followed [29]. A mixture of TEOS (10.4 mL), TPOAH (4.48 mL), and water (8.37 mL) was prepared in a 100 mL round-bottom flask. The mixture was stirred for 3 h at 50°C, followed by aging at 170°C for 72 h in a Teflon autoclave. The resultant solid was then filtered, washed with deionized water, dried overnight at 110°C, and calcined at 500°C for 2 h to obtain silicalite-1. Because JRC-Z-B25 (NaBEA-25) contains 0.15 wt% Na, a proton-exchange treatment was carried out to obtain HBEA, as described in the literature [30]. A 200 mL beaker was filled with a 1 M NH4NO3 aqueous solution, to which 6 g of JRC-Z-B25 was added. The mixture was stirred at 80°C for 24 h, filtered, and the resultant solid dried overnight at 110°C. The prepared samples were calcined at 550°C for 3.5 h to obtain HBEA. 2.2 Preparation of the VOx/HZSM-5 catalysts Supported VO x catalysts were prepared using an impregnation method. The vanadium loading was 3 wt%. First, NH4VO3 was dissolved in 70 mL deionized water. Under stirring, various supports were added to the solution, and water was evaporated on a hot plate. The obtained solid was calcined in a muffle furnace at 500°C for 2 h. The catalyst was then pelletized into discs approximately 20 mm in diameter and 2 mm in thickness using a compaction press at a pressure of 400 kg cm−2 for 10 min. Finally, the discs were ground using an agate mortar and the crushed powder was sieved to particle sizes between 355 and 710 µm. 2.3 MDA reactions A quartz reactor was packed with 50 mg of quartz wool and 0.50 g of the catalyst. The reactor was purged with Ar at 40 mL min−1, and the temperature was increased to 750°C. After 10 min at 750°C, CH4 was introduced at 20 mL min−1 and the outlet gas was analyzed. H2 and CH4 were analyzed using a GC-TCD (Shimadzu GC-8A; active carbon column), and C2 and C3 hydrocarbons and aromatics were analyzed using a GC-FID (Shimadzu GC-2014; SH-Rt-Q-Bond column). The flow rate of the outlet gas was measured using a soap-film flowmeter. The dehydrogenation of C2H4 was carried out using a similar procedure to that of the MDA reaction, with a flow of C2H4 (0.3 mL min−1), H2 (1 mL min−1), and Ar (20 mL min−1). The MDA reaction in the presence of H2 was performed by flowing CH4 at 20 mL min−1 and H2 at 0.5, 1, or 2 mL min−1. The CH4 conversion was calculated using Eq. (1). (1) C H 4 conversion / % = r ( converted CH 4 ) r ( CH 4 in ) × 100 = ( r ( C 2 H 6 ) × 2 + r ( C 2 H 4 ) × 2 + r ( C 3 H 8 ) × 3 + r ( C 3 H 6 ) × 3 + r ( C 6 H 6 ) × 6 + r ( C 7 H 8 ) × 7 + r ( C 10 H 8 ) × 10 + r ( coke ) ) r ( CH 4 in ) × 100 The coke formation rate was calculated using Eq. (2). (2) r(coke) / µmol min−1 = (r(H2) – r(C2H6) – r(C2H4)×2 – r(C3H8)×2 – r(C3H6)×3 – r(C6H6)×9 – r(C7H8)×10 - r(C10H8) ×16)×0.5 The product selectivity was calculated using Eq. (3). In Eq. (3), \"n\" represents the number of carbon atoms in each hydrocarbon product. (3) Selectivity / % = r product × n r ( converted CH 4 ) × 100 2.4 Characterization The XRD analysis was performed using a D2 Phaser (Bruker) with a Cu Kα radiation source. TG analysis was performed using a DTG-60 device (Shimadzu). The catalyst was set in a platinum cell, and the temperature was raised to 800°C at a rate of 10°C min−1 in an airflow of 100 mL min−1. V K-edge XAFS studies were conducted at the BL5S1 station of the Aichi Synchrotron Radiation Center in Aichi, Japan, utilizing a Si(111) monochromator and the transmission method. Raman spectra were acquired using an inVia Reflex Raman microscope from Renishaw. Excitation was provided by a 532 nm laser. A 50× objective lens was used for the measurements. The spectra were obtained over five scans. XPS measurements were performed with an AXIS-NOVA (Shimadzu) instrument using a monochromatic Al Kα source at 15 kV and 20 mA. The charge correction was performed by referencing the binding energy of C 1 s at 284.6 eV. 3 Results and discussion 3.1 MDA on VOx/HZSM-5 Fig. 1 shows the results of MDA on HZSM-5 and VO x /HZSM-5. C2 hydrocarbons (ethane and ethylene), C3 hydrocarbons (propane and propylene), aromatics (benzene, toluene, and naphthalene), and H2 were detected as the products. Because of their low selectivity for C3 hydrocarbons (∼ 1%), they were not the focus of this study. CH4 conversion as a function of time on stream is shown in Fig. 1a. For VO x /HZSM-5, a rapid increase in CH4 conversion was observed during the initial stage of the reaction, reaching a peak of 5% at 40 min. Subsequently, the CH4 conversion gradually declined and remained at approximately 3% after 280 min. In contrast, CH4 conversion was almost 0% when HZSM-5 was used as the catalyst, suggesting that VO x plays a crucial role in the activation of CH4 molecules. For the aromatics selectivity of VO x /HZSM-5 (Fig. 1b), a profile similar to that of CH4 conversion was observed, and the maximum aromatics selectivity reached 66%. The selectivity for C2 hydrocarbons increased with time on stream, reaching 15% at 280 min (Fig. 1c). The total selectivity of the products for MDA is shown in Fig. 1d. The primary products of C2 and the aromatic components were ethylene and benzene, respectively. The total selectivity for hydrocarbons was 67%, indicating that VO x /HZSM-5 can convert CH4 into valuable compounds. At the initial stage of the reaction, a sharp increase in the catalytic activity was observed, which can be attributed to the induction period of MDA on VO x /HZSM-5. The induction period suggests a structural change in the VO x /HZSM-5 catalyst due to the CH4 contact. It has been reported that in MDA using Mo/HZSM-5, MO x is converted into MoC x by contact with CH4, resulting in an induction period [31]. Thus, it is possible that a similar structural change occurred in the VO x /HZSM-5. This point will be discussed in detail later in this study. The characterization of VO x /HZSM-5 was conducted before and after the MDA reaction. Fig. 2a shows the XRD patterns of HZSM-5, fresh VO x /HZSM-5, and spent VO x /HZSM-5. The XRD patterns of fresh VO x /HZSM-5 and spent VO x /HZSM-5 were the same as those of HZSM-5, indicating that the structure of HZSM-5 remained intact during MDA reactions. Peaks due to VO x species could not be identified by the XRD analysis. The Raman spectra of HZSM-5, fresh VO x /HZSM-5, and spent VO x /HZSM-5 are shown in Fig. 2b. While no distinct peaks were identified for HZSM-5, several peaks attributed to V2O5 were observed for fresh VO x /HZSM-5 [32], and the peaks disappeared after 10 min of reaction. The change in the Raman spectra suggests that the V2O5 structure present in the fresh catalyst was drastically changed by the contact with CH4. Fig. 2c shows the V 2p3/2 XPS spectra of fresh VO x /HZSM-5 and spent VO x /HZSM-5. Peaks attributable to V5+ species at 517.3 eV and V4+ species at 516.3 eV were detected for fresh VO x /HZSM-5 [24]. Given the presence of V2O5, as indicated by the Raman spectra of the fresh catalyst, the V5+ species identified by XPS were considered to originate from V2O5. In the catalyst after 10 min of MDA reaction, a new peak was observed at 518.5 eV. It has been reported that the peak appearing at higher binding energies can be attributed to highly dispersed V5+ species interacting with the catalyst supports [33,34]. Raman spectroscopy indicates the disappearance of V2O5 upon the initiation of the MDA reaction. Considering the XPS analysis and Raman spectroscopy, it is suggested that contact with CH4 leads to the drastic structural change of V2O5 species into a highly dispersed vanadium state. In the Raman spectra, new peaks around 1380 cm−1 and 1597 cm−1 appeared after the reaction at 280 min, which were attributed to the D and G bands of the carbons [35]. In the MDA reaction, coke is formed from CH4 (CH4 → C + 2 H2) as well as hydrocarbon products; thus, peaks due to coke were detected after the reaction. Coke formation was confirmed using TG analysis. The TG profiles of the spent VO x /HZSM-5 are shown in Fig. 2d. A weight loss of 7% was observed between 350 °C and 650 °C, which can be attributed to the combustion of coke. Coke possibly covers the catalytically active sites, which is the reason for the gradual decrease in CH4 conversion observed in Fig. 1a. Fig. 3 shows the V K-edge XANES spectra of the VO x /HZSM-5 catalysts and reference samples. VO x /HZSM-5 before the reaction exhibited an XANES spectrum similar to that of V2O5. As suggested by the Raman spectrum, a V2O5 structure was formed in the catalyst prior to CH4 contact. As the MDA reaction proceeded, the shapes of the XANES spectra changed; the pre-edge became smaller. Compared with the reference samples, the spectrum of the spent catalysts was similar to that of either VC or V2O3. The pre-edge of V2O3 was very small, but the pre-edge of the spent catalyst was not as small. On the other hand, the pre-edge of VC is larger than that of V2O3. Additionally, considering the extensive research on Mo/HZSM-5, in which the formation of MoC x species is presumed, it is likely that vanadium carbide species were formed in VO x /HZSM-5 upon contact with CH4. 3.2 Role of catalyst supports in MDA reaction on VOx catalysts The effect of the catalyst support on the MDA reaction was investigated using VO x /HZSM-5, VO x /SiO2, VO x /SiO2-Al2O3, and VO x /silicalite-1. Fig. 4a shows the CH4 conversion as a function of time on stream for each catalyst. Although all catalysts converted CH4, the CH4 conversion depended on the type of support. The trend in CH4 conversion is as follows: VO x /HZSM-5 > VO x /SiO2 > VO x /SiO2-Al2O3 > VO x /silicalite-1. Figs. 4b and c show the selectivities for aromatics and C2 hydrocarbons, respectively. VO x /HZSM-5 reached up to 60% aromatics selectivity, significantly outperforming VO x /SiO2, VO x /SiO2-Al2O3, and VO x /silicalite-1, all of which achieved aromatics selectivity of less than 20%. The C2 selectivity also depended on the type of support, but the difference in C2 selectivity between the catalysts was small. The C2 selectivity remained within the range of 5–20%, indicating that the effect of the support on C2 formation was not as evident as that on aromatics formation. The total product selectivity for the MDA reactions is shown in Fig. 4d. VO x /HZSM-5 achieved the highest selectivity for hydrocarbons (67%), whereas the other catalysts showed approximately 20% hydrocarbon selectivity and mainly formed coke. The results shown in Fig. 4 indicate that the type of support profoundly affected MDA; specifically, VO x /HZSM-5 exhibited superior performance in the production of aromatics. HZSM-5 is an aluminosilicate zeolite with micropore (about 5 Å) and acid sites. Compared with HZSM-5, SiO2 lacked both acid sites and micropores, SiO2-Al2O3 had acid sites but no micropores, and silicalite-1 had a similar micropore to HZSM-5 but no acid sites. Given the properties of the supports, the lower aromatics selectivity of all supports except HZSM-5 suggests that both the acidity and micropore structure of HZSM-5 play important roles in the production of aromatics. Hence, hereafter, we will investigate the effects of the acidic properties and micropores on the MDA reaction in detail. The effect of acidic properties of HZSM-5 on the MDA reaction was investigated using different types of HZSM-5 (HSZ-822; SiO2/Al2O3 = 24, HSZ-840; SiO2/Al2O3 = 40, and HSZ-890; SiO2/Al2O3 = 1500). The results of this reaction are shown in Fig. 5. VO x /HZSM-5 (SiO2/Al2O3= 24) achieved the highest CH4 conversion, and as the SiO2/Al2O3 ratio increased, CH4 conversion decreased. It should be noted that the aromatics selectivity showed the same trend as CH4 conversion, that is, the aromatics selectivity decreased as the SiO2/Al2O3 ratio in VO x /HZSM-5 decreased. The C2 selectivity was lower than the aromatics selectivity and hardly affected by the SiO2/Al2O3 ratio. The results suggest that the SiO2/Al2O3 ratio, which corresponds to the number of acid sites in HZSM-5, affects the aromatics production in the MDA reaction. HZSM-5, which had a higher number of acid sites, was found to be effective for aromatics formation. In Mo/HZSM-5, CH4 is activated on MoC x , and the formed C2 hydrocarbons are subjected to oligomerization on the Brønsted acid sites of the zeolite to form benzene and naphthalene [16]. Similar to the Mo/HZSM-5, it was found that the role of HZSM-5 in VO x /HZSM-5 is to facilitate the aromatization of C2 hydrocarbons. As described above, the acidic sites of HZSM-5 were involved in the formation of aromatics. Previous studies have suggested that not only the acidic properties of zeolites, but also their micropores influence the formation of aromatics in MDA reactions on Mo/HZSM-5 [28,36]. To verify whether a similar mechanism was established in the case of VO x /HZSM-5, we investigated the effect of zeolite pore structure on the MDA reaction using different types of zeolites: MOR, HBEA, and HZSM-5. Note that the MOR, HBEA, and HZSM-5 used here possess similar acidic properties because their SiO2/Al2O3 ratios are similar to those of MOR (SiO2/Al2O3=20), HBEA (SiO2/Al2O3=25), and HZSM-5 (SiO2/Al2O3=24). The results are shown in Fig. 6. VO x /HZSM-5 showed the highest CH4 conversion (3–5%), followed by VO x /HBEA (3–3.5%) and VO x /MOR (1.5–3%). The C2 selectivity was consistently below 20% for all the catalysts. In contrast, aromatics selectivity varied significantly depending on the type of zeolite. VO x /HZSM-5 demonstrated a high aromatics selectivity of 40–60%, whereas VO x /HBEA was below 20%, and VO x /MOR produced almost no aromatics. Considering that HZSM-5, HBEA, and MOR possess almost the same SiO2/Al2O3 ratio, the aromatics selectivity depends on the type of zeolite, suggesting that the pore structure of the zeolite also has a strong influence on the formation of aromatics. Previous research on MDA with Mo-based catalysts found that zeolites with pore sizes close to the size of benzene molecules (about 6 Å) effectively produced aromatics [28]. Given the pore sizes of the zeolites used in this study (HZSM-5: 0.54–0.56 nm, HBEA: 0.55–0.70 nm, and MOR: 0.65–0.70 nm), HZSM-5 is believed to have been an effective catalyst support for VO x in producing aromatics, because its pore size is similar to that of benzene molecules. These findings suggest a mechanism wherein CH4 initially couples with V species to produce C2 hydrocarbons, which subsequently form aromatics with the aid of HZSM-5. To validate this mechanism, we examined the aromatization of C2 hydrocarbons over zeolites. 3.3 Aromatization reaction of C2H4 We examined the aromatization of C2H4 over HZSM-5, HBEA, and MOR. Note that only zeolites were used for the reaction, that is VO x was not included. The results are shown in Fig. 7. The aromatization of C2H4 proceeded and the type of zeolite influenced the aromatization reaction. The C2H4 conversion ranged from 30% to 80%, depending on the type of zeolite used. HZSM-5 exhibited the highest benzene selectivity, whereas benzene selectivity of HBEA and MOR was lower. At 100 min, the benzene selectivity decreased in the following order: HZSM-5 (33%) > HBEA (13%) > MOR (6%). As shown in Fig. 6, the aromatics selectivity for MDA on VO x /zeolite was as follows: VO x /HZSM-5 > VO x /HBEA > VO x /MOR. The benzene selectivity from C2H4 using zeolites showed the same trend as the aromatics selectivity from CH4 using VO x /zeolites, implying that zeolites play an important role in aromatization reactions. The MDA reaction was conducted using a physical mixture of VO x /SiO2 and HZSM-5, hereafter referred to as VO x /SiO2+HZSM-5 ( Fig. 8). As previously shown (Fig. 1), HZSM-5 alone achieved nearly 0% CH4 conversion, indicating that HZSM-5 could not activate the CH4 molecules. Notably, VO x /SiO2+HZSM-5 achieved higher CH4 conversion than VO x /SiO2 alone, suggesting that HZSM-5 contributed to the reaction. Although the selectivities for C2 hydrocarbons were similar for both catalysts, the selectivity for aromatics significantly increased in the presence of HZSM-5; indeed, the addition of HZSM-5 doubled the aromatics selectivity. This indicates that HZSM-5 enhances the aromatization of C2 hydrocarbons generated on VO x /SiO2. Based on these results, we proposed a mechanism for the MDA reaction using the VO x /HZSM-5 catalyst. In the fresh catalyst, V2O5 was present on the HZSM-5. Upon contact with CH4, V2O5 transforms into VC x species, which serve as active sites for the coupling of CH4 to produce C2 hydrocarbons, predominantly C2H4. The formed C2H4 was then converted into aromatics, facilitated by the acidic sites and micropores of HZSM-5. 3.4 Effect of H2 co-feeding As discussed thus far, although the VO x /HZSM-5 catalyst is effective for the MDA reaction, as shown by the total product selectivity, it also generates coke in addition to hydrocarbons. Coke formation was also demonstrated using Raman spectroscopy and TG analysis. It is believed that the gradual decrease in the production of aromatics during the MDA reaction is due to coke formation. In CH4 conversion using Mo/HZSM-5 and Pt/Al2O3 catalysts, H2 co-feeding mitigates catalyst deactivation because coke deposition is suppressed [10,37–40]. Therefore, we examined the effect of H2 co-feeding on the MDA reaction using the VO x /HZSM-5 catalyst. As shown in Fig. 9a, CH4 conversion decreased with increasing H2 co-feeding. This trend suggests that dehydrogenative conversion of CH4 is inhibited in the presence of H2. Under the condition of CH4-only feeding, there was a decline in CH4 conversion over time on stream. However, when co-fed with H2, the decline in CH4 conversion was more gradual, indicating that H2 co-feeding suppressed the catalyst deactivation. Aromatics selectivity exhibited a gradual decline under CH4-only feeding (Fig. 9b). In contrast, co-feeding H2 at 1 or 0.5 mL min−1 stabilized the aromatics selectivity, consistently maintaining a high selectivity level of 70–80%. However, at a co-feed rate of 2 mL min−1, aromatics selectivity decreased significantly. The C2 selectivity remained largely consistent regardless of H2 co-feeding, with a noticeable increase observed at a co-feed rate of 2 mL min−1 (Fig. 9c). Overall, the presence of H2 at 1 mL min−1 reduced coke formation, thereby boosting the selectivity towards both aromatics and C2H4 (Fig. 9d). Fig. 10 shows the TG profiles of the spent catalysts. The observed weight loss at 400–600℃ can be attributed to the combustion of the coke deposited on the catalysts. The TG profile indicates that the weight loss due to coke combustion was reduced by the H2 co-feed. This suggests that the H2 co-feed inhibits excessive CH4 dehydrogenation, which can lead to coke formation, thereby limiting catalyst deactivation. Stabilization of aromatics selectivity and suppression of coke deposition due to H2 co-feeding were also observed in the MDA reaction at a higher temperature (800°C). To confirm that H2 co-feeding did not influence the aromatization mechanism, we conducted an aromatization reaction of C2H4 in the presence of H2 (1 and 2.5 mL min−1). The results are shown in Fig. 11. C2H4 conversion slightly decreased at 2.5 mL min−1 of H2. Aromatics selectivity was lower with 2.5 mL min−1 of H2, suggesting that H2 co-feeding suppressed the aromatization of C2H4. The results can be understood because the aromatization of C2H4 is a dehydrogenation process. Therefore, it can be understood that H2 co-feeding did not enhance the aromatization of C2H4. These findings indicate that the stable aromatics selectivity under H2 co-feeding in MDA is not due to the direct influence of H2 on the reaction mechanism, but rather to the prevention of coke deposition on the catalytic active sites. 4 Conclusions While there has been extensive research on MDA reactions using HZSM-5-supported transition metals, there have been very few studies on VO x /HZSM-5. This study focused on the characteristics of the MDA reaction in VO x /HZSM-5 and the structural analysis of VO x species. VO x /HZSM-5 catalyzed the MDA reaction, demonstrating an aromatics selectivity of approximately 50%. Catalyst activity gradually decreased, and TG analysis and Raman spectroscopy suggested that coke deposition on the catalyst contributed to the decline in activity. The XRD patterns, Raman spectra, and XPS analysis revealed that V2O5 species were formed on the catalyst before the reaction, and the contact of CH4 with the V2O5 results in the highly dispersed V5+ species interacting with HZSM-5 supports. The contact of CH4 leading to the high dispersion of the active sites is a characteristic behavior for MDA on VO x /HZSM-5. Additionally, the XAFS analysis showed the formation of V2O5 species before the reaction and suggested the formation of VC species during the MDA reaction. It was found that this structural change in the V2O5 species upon contact with CH4 is responsible for the induction period of the MDA reaction. The role of the HZSM-5 support is similar to that of previously reported catalysts, where C2H4 produced by the catalysis of the transition metal is aromatized with the aid of HZSM-5. The VO x /HZSM-5 catalysts were gradually deactivated by coke, but co-feeding H2 with CH4 suppressed coke deposition and stabilized aromatics selectivity. H2 co-feeding did not affect the aromatization reaction mechanism but only suppressed coke formation on VO x /HZSM-5. Although the catalytic function of VO x /HZSM-5 in MDA was poorly understood, this study has elucidated its catalytic activity, reaction mechanism, and structure of V species. CRediT authorship contribution statement Hyunwoo Jung: Writing – original draft, Investigation, Formal analysis, Data curation. Taisei Watashima: Validation, Investigation, Data curation. Hideki Kurokawa: Supervision. Hitoshi Ogihara: Writing – review & editing, Visualization, Supervision, Project administration, Methodology, Funding acquisition, Conceptualization. Declaration of Competing Interest The authors declare that they have no known competing financial interests or personal relationships that could have appeared to influence the work reported in this paper. Acknowledgment This work was supported by the JST CREST (grant number: JPMJCR15P4). We appreciate the technical support provided by the Comprehensive Analysis Center for Science at Saitama University for the Raman spectroscopy, XRD measurements, and XPS analysis. The XAFS experiments were conducted at the BL5S1 of Aichi Synchrotron Radiation Center, Aichi Science & Technology Foundation, Aichi, Japan (Proposal No. 2022D5010). References [1] Y.F. Gao L. Neal D. Ding W. Wu C. Baroi A.M. Gaffney F.X. Li Recent advances in intensified ethylene production-a review ACS Catal. 9 2019 8592 8621 Y.F. Gao, L. Neal, D. Ding, W. Wu, C. Baroi, A.M. Gaffney, F.X. Li, Recent Advances in Intensified Ethylene Production-A Review, ACS Catal., 9 (2019) 8592-8621. [2] A.I. Olivos-Suarez A. Szecsenyi E.J.M. Hensen J. Ruiz-Martinez E.A. Pidko J. Gascon Strategies for the direct catalytic valorization of methane using heterogeneous catalysis: challenges and opportunities ACS Catal. 6 2016 2965 2981 A.I. Olivos-Suarez, A. Szecsenyi, E.J.M. Hensen, J. Ruiz-Martinez, E.A. Pidko, J. Gascon, Strategies for the Direct Catalytic Valorization of Methane Using Heterogeneous Catalysis: Challenges and Opportunities, ACS Catal., 6 (2016) 2965-2981. [3] E.E. Wolf Methane to light hydrocarbons via oxidative methane coupling: lessons from the past to search for a selective heterogeneous catalyst J. Phys. Chem. Lett. 5 2014 986 988 E.E. Wolf, Methane to Light Hydrocarbons via Oxidative Methane Coupling: Lessons from the Past to Search for a Selective Heterogeneous Catalyst, J. Phys. Chem. Lett., 5 (2014) 986-988. [4] A.L. Dipu S. Ohbuchi Y. Nishikawa S. Iguchi H. Ogihara I. Yamanaka Direct nonoxidative conversion of methane to higher hydrocarbons over silica-supported nickel phosphide catalyst ACS Catal. 10 2020 375 379 A.L. Dipu, S. Ohbuchi, Y. Nishikawa, S. Iguchi, H. Ogihara, I. Yamanaka, Direct Nonoxidative Conversion of Methane to Higher Hydrocarbons over Silica-Supported Nickel Phosphide Catalyst, ACS Catal., 10 (2020) 375-379. [5] D. Gerceker A.H. Motagamwala K.R. Rivera-Dones J.B. Miller G.W. Huber M. Mavrikakis J.A. Dumesic Methane conversion to ethylene and aromatics on PtSn catalysts ACS Catal. 7 2017 2088 2100 D. Gerceker, A.H. Motagamwala, K.R. Rivera-Dones, J.B. Miller, G.W. Huber, M. Mavrikakis, J.A. Dumesic, Methane Conversion to Ethylene and aromatics on PtSn Catalysts, ACS Catal., 7 (2017) 2088-2100. [6] X.G. Guo G.Z. Fang G. Li H. Ma H.J. Fan L. Yu C. Ma X. Wu D.H. Deng M.M. Wei D.L. Tan R. Si S. Zhang J.Q. Li L.T. Sun Z.C. Tang X.L. Pan X.H. Bao Direct, nonoxidative conversion of methane to ethylene, aromatics, and hydrogen Science 344 2014 616 619 X.G. Guo, G.Z. Fang, G. Li, H. Ma, H.J. Fan, L. Yu, C. Ma, X. Wu, D.H. Deng, M.M. Wei, D.L. Tan, R. Si, S. Zhang, J.Q. Li, L.T. Sun, Z.C. Tang, X.L. Pan, X.H. Bao, Direct, Nonoxidative Conversion of Methane to Ethylene, aromatics, and Hydrogen, Science, 344 (2014) 616-619. [7] Z. Li Y. Xiao P.R. Chowdhury Z.W. Wu T. Ma J.Z. Chen G. Wan T.H. Kim D.P. Jing P.L. He P.J. Potdar L. Zhou Z.H. Zeng X.L. Ruan J.T. Miller J.P. Greeley Y. Wu A. Varma Direct methane activation by atomically thin platinum nanolayers on two-dimensional metal carbides Nat. Catal. 4 2021 882 891 Z. Li, Y. Xiao, P.R. Chowdhury, Z.W. Wu, T. Ma, J.Z. Chen, G. Wan, T.H. Kim, D.P. Jing, P.L. He, P.J. Potdar, L. Zhou, Z.H. Zeng, X.L. Ruan, J.T. Miller, J.P. Greeley, Y. Wu, A. Varma, Direct methane activation by atomically thin platinum nanolayers on two-dimensional metal carbides, Nat. Catal., 4 (2021) 882-891. [8] Y. Nishikawa H. Ogihara I. Yamanaka Liquid-metal indium catalysis for direct dehydrogenative conversion of methane to higher hydrocarbons ChemistrySelect 2 2017 4572 4576 Y. Nishikawa, H. Ogihara, I. Yamanaka, Liquid-Metal Indium Catalysis for Direct Dehydrogenative Conversion of Methane to Higher Hydrocarbons, ChemistrySelect, 2 (2017) 4572-4576. [9] R. Takamura T. Tomono M. Yoshida-Hirahara H. Ogihara H. Kurokawa Dehydrogenative conversion of methane to C2 hydrocarbons and aromatics over Pt/A12O3 Catal., J. Jpn. Petrol. Inst. 66 2023 162 170 R. Takamura, T. Tomono, M. Yoshida-Hirahara, H. Ogihara, H. Kurokawa, Dehydrogenative Conversion of Methane to C2 Hydrocarbons and aromatics over Pt/A12O3 Catalysts, J. Jpn. Petrol. Inst., 66 (2023) 162-170. [10] T. Tomono R. Takamura M. Yoshida-Hirahara T. Yamamoto S. Matsumura H. Kurokawa H. Ogihara Dehydrogenative coupling of methane over Pt/Al2O3 catalysts: effect of hydrogen co-feeding Catal. Sci. Technol. 13 2023 4656 4664 T. Tomono, R. Takamura, M. Yoshida-Hirahara, T. Yamamoto, S. Matsumura, H. Kurokawa, H. Ogihara, Dehydrogenative coupling of methane over Pt/Al2O3 catalysts: effect of hydrogen co-feeding, Catal. Sci. Technol., 13 (2023) 4656-4664. [11] Y. Xiao A. Varma Highly selective nonoxidative coupling of methane over Pt-Bi Bimetallic catalysts ACS Catal. 8 2018 2735 2740 Y. Xiao, A. Varma, Highly Selective Nonoxidative Coupling of Methane over Pt-Bi Bimetallic Catalysts, ACS Catal., 8 (2018) 2735-2740. [12] P.F. Xie T.C. Pu A.M. Nie S. Hwang S.C. Purdy W.J. Yu D. Su J.T. Miller C. Wang Nanoceria-supported single-atom platinum catalysts for direct methane conversion ACS Catal. 8 2018 4044 4048 P.F. Xie, T.C. Pu, A.M. Nie, S. Hwang, S.C. Purdy, W.J. Yu, D. Su, J.T. Miller, C. Wang, Nanoceria-Supported Single-Atom Platinum Catalysts for Direct Methane Conversion, ACS Catal., 8 (2018) 4044-4048. [13] L.S. Wang L.X. Tao M.S. Xie G.F. Xu J.S. Huang Y.D. Xu Dehydrogenation and aromatization of methane under nonoxidizing conditions Catal. Lett. 21 1993 35 41 L.S. Wang, L.X. Tao, M.S. Xie, G.F. Xu, J.S. Huang, Y.D. Xu, Dehydrogenation and Aromatization of Methane under Nonoxidizing Conditions, Catal. Lett., 21 (1993) 35-41. [14] R.W. Borry Y.H. Kim A. Huffsmith J.A. Reimer E. Iglesia Structure and density of Mo and acid sites in Mo-exchanged H-ZSM5 Catal. nonoxidative methane Convers. J. Phys. Chem. B 103 1999 5787 5796 R.W. Borry, Y.H. Kim, A. Huffsmith, J.A. Reimer, E. Iglesia, Structure and density of Mo and acid sites in Mo-exchanged H-ZSM5 catalysts for nonoxidative methane conversion, J. Phys. Chem. B, 103 (1999) 5787-5796. [15] W.P. Ding S.Z. Li G.D. Meitzner E. Iglesia Methane conversion to aromatics on Mo/H-ZSM5 Struct. molybdenum Species Work. Catal., J. Phys. Chem. B 105 2001 506 513 W.P. Ding, S.Z. Li, G.D. Meitzner, E. Iglesia, Methane conversion to aromatics on Mo/H-ZSM5: Structure of molybdenum species in working catalysts, J. Phys. Chem. B, 105 (2001) 506-513. [16] Z.R. Ismagilov E.V. Matus L.T. Tsikoza Direct conversion of methane on Mo/ZSM-5 catalysts to produce benzene and hydrogen: achievements and perspectives Energy Environ. Sci. 1 2008 526 541 Z.R. Ismagilov, E.V. Matus, L.T. Tsikoza, Direct conversion of methane on Mo/ZSM-5 catalysts to produce benzene and hydrogen: achievements and perspectives, Energy Environ. Sci., 1 (2008) 526-541. [17] I. Lezcano-Gonzalez R. Oord M. Rovezzi P. Glatzel S.W. Botchway B.M. Weckhuysen A.M. Beale Molybdenum speciation and its impact on catalytic activity during methane dehydroaromatization in zeolite ZSM-5 as revealed by operando X-Ray methods Angew. Chem. Int. Ed. 55 2016 5215 5219 I. Lezcano-Gonzalez, R. Oord, M. Rovezzi, P. Glatzel, S.W. Botchway, B.M. Weckhuysen, A.M. Beale, Molybdenum Speciation and its Impact on Catalytic Activity during Methane Dehydroaromatization in Zeolite ZSM-5 as Revealed by Operando X-Ray Methods, Angew. Chem. Int. Edit., 55 (2016) 5215-5219. [18] F. Solymosi J. Cserenyi A. Szoke T. Bansagi A. Oszko Aromatization of methane over supported and unsupported Mo-based catalysts J. Catal. 165 1997 150 161 F. Solymosi, J. Cserenyi, A. Szoke, T. Bansagi, A. Oszko, Aromatization of methane over supported and unsupported Mo-based catalysts, J. Catal., 165 (1997) 150-161. [19] D.J. Wang J.H. Lunsford M.P. Rosynek Characterization of a Mo/ZSM-5 catalyst for the conversion of methane to benzene J. Catal. 169 1997 347 358 D.J. Wang, J.H. Lunsford, M.P. Rosynek, Characterization of a Mo/ZSM-5 catalyst for the conversion of methane to benzene, J. Catal., 169 (1997) 347-358. [20] Y. Shu R. Ohnishi M. Ichikawa Improved methane dehydrocondensation reaction on HMCM-22 and HZSM-5 supported rhenium and molybdenum catalysts Appl. Catal. A-Gen. 252 2003 315 329 Y. Shu, R. Ohnishi, M. Ichikawa, Improved methane dehydrocondensation reaction on HMCM-22 and HZSM-5 supported rhenium and molybdenum catalysts, Appl. Catal. A-Gen., 252 (2003) 315-329. [21] Y. Gu P.P. Chen X.H. Wang Y.C. Lyu W.R. Liu X.M. Liu Z.F. Yan Active sites and induction period of Fe/ZSM-5 catalyst in methane dehydroaromatization ACS Catal. 11 2021 6771 6786 Y. Gu, P.P. Chen, X.H. Wang, Y.C. Lyu, W.R. Liu, X.M. Liu, Z.F. Yan, Active Sites and Induction Period of Fe/ZSM-5 Catalyst in Methane Dehydroaromatization, ACS Catal., 11 (2021) 6771-6786. [22] Y.B. Xu M.Y. Chen T. Wang B. Liu F. Jiang X.H. Liu Probing cobalt localization on HZSM-5 for efficient methane dehydroaromatization catalysts J. Catal. 387 2020 102 118 Y.B. Xu, M.Y. Chen, T. Wang, B. Liu, F. Jiang, X.H. Liu, Probing cobalt localization on HZSM-5 for efficient methane dehydroaromatization catalysts, J. Catal., 387 (2020) 102-118. [23] B.M. Weckhuysen D.J. Wang M.P. Rosynek J.H. Lunsford Conversion of methane to benzene over transition metal ion ZSM-5 zeolites - I. Catalytic Characterization J. Catal. 175 1998 338 346 B.M. Weckhuysen, D.J. Wang, M.P. Rosynek, J.H. Lunsford, Conversion of methane to benzene over transition metal ion ZSM-5 zeolites - I. Catalytic Characterization, J. Catal., 175 (1998) 338-346. [24] B.M. Weckhuysen D.J. Wang M.P. Rosynek J.H. Lunsford Conversion of methane to benzene over transition metal ion ZSM-5 zeolites - II. catalyst characterization by X-ray photoelectron spectroscopy J. Catal. 175 1998 347 351 B.M. Weckhuysen, D.J. Wang, M.P. Rosynek, J.H. Lunsford, Conversion of methane to benzene over transition metal ion ZSM-5 zeolites - II. Catalyst characterization by X-ray photoelectron spectroscopy, J. Catal., 175 (1998) 347-351. [25] D. Kiani S. Sourav Y.D. Tang J. Baltrusaitis I.E. Wachs Methane activation by ZSM-5-supported transition metal centers Chem. Soc. Rev. 50 2021 1251 1268 D. Kiani, S. Sourav, Y.D. Tang, J. Baltrusaitis, I.E. Wachs, Methane activation by ZSM-5-supported transition metal centers, Chem. Soc. Rev., 50 (2021) 1251-1268. [26] S.Q. Ma X.G. Guo L.X. Zhao S. Scott X.H. Bao Recent progress in methane dehydroaromatization: from laboratory curiosities to promising technology J. Energy Chem. 22 2013 1 20 S.Q. Ma, X.G. Guo, L.X. Zhao, S. Scott, X.H. Bao, Recent progress in methane dehydroaromatization: From laboratory curiosities to promising technology, J Energy Chem., 22 (2013) 1-20. [27] V. Ramasubramanian H. Ramsurn G.L. Price Methane dehydroaromatization - A study on hydrogen use for catalyst reduction, role of molybdenum, the nature of catalyst support and significance of Bronsted acid sites J. Energy Chem. 34 2019 20 32 V. Ramasubramanian, H. Ramsurn, G.L. Price, Methane dehydroaromatization - A study on hydrogen use for catalyst reduction, role of molybdenum, the nature of catalyst support and significance of Bronsted acid sites, J Energy Chem., 34 (2019) 20-32. [28] C.L. Zhang S.A. Li Y. Yuan W.X. Zhang T.H. Wu L.W. Lin Aromatization of methane in the absence of oxygen over Mo-based catalysts supported on different types of zeolites Catal. Lett. 56 1998 207 213 C.L. Zhang, S.A. Li, Y. Yuan, W.X. Zhang, T.H. Wu, L.W. Lin, Aromatization of methane in the absence of oxygen over Mo-based catalysts supported on different types of zeolites, Catal. Lett., 56 (1998) 207-213. [29] J. Huang Y.Q. Fan G.Q. Zhang Y.H. Ma Protective dissolution: generating secondary pores in zeolite by mechanochemical reaction RSC Adv. 10 2020 13583 13590 J. Huang, Y.Q. Fan, G.Q. Zhang, Y.H. Ma, Protective dissolution: generating secondary pores in zeolite by mechanochemical reaction, RSC Adv., 10 (2020) 13583-13590. [30] L. Shirazi E. Jamshidi M.R. Ghasemi The effect of Si/Al ratio of ZSM-5 zeolite on its morphology, acidity and crystal size Cryst. Res. Technol. 43 2008 1300 1306 L. Shirazi, E. Jamshidi, M.R. Ghasemi, The effect of Si/Al ratio of ZSM-5 zeolite on its morphology, acidity and crystal size, Cryst. Res. Technol., 43 (2008) 1300-1306. [31] D. Ma Y.Y. Shu M.J. Cheng Y.D. Xu X.H. Bao On the induction period of methane aromatization over Mo-based catalysts J. Catal. 194 2000 105 114 D. Ma, Y.Y. Shu, M.J. Cheng, Y.D. Xu, X.H. Bao, On the induction period of methane aromatization over Mo-based catalysts, J. Catal., 194 (2000) 105-114. [32] B. Olthof A. Khodakov A.T. Bell E. Iglesia Effects of support composition and pretreatment conditions on the structure of vanadia dispersed on SiO2, Al2O3, TiO2, ZrO2, and HfO2 J. Phys. Chem. B 104 2000 1516 1528 B. Olthof, A. Khodakov, A.T. Bell, E. Iglesia, Effects of support composition and pretreatment conditions on the structure of vanadia dispersed on SiO2, Al2O3, TiO2, ZrO2, and HfO2, J. Phys. Chem. B, 104 (2000) 1516-1528. [33] C. Hess G. Tzolova-Müller R. Herbert The influence of water on the dispersion of vanadia supported on silica SBA-15: a combined XPS and Raman study J. Phys. Chem. C. 111 2007 9471 9479 C. Hess, G. Tzolova-Müller, R. Herbert, The influence of water on the dispersion of vanadia supported on silica SBA-15: A combined XPS and Raman study, J. Phys. Chem. C, 111 (2007) 9471-9479. [34] A. Rodriguez-Gomez A.D. Chowdhury M. Caglayan J.A. Bau E. Abou-Hamad J. Gascon Non-oxidative dehydrogenation of isobutane over supported vanadium oxide: nature of the active sites and coke formation Catal. Sci. Technol. 10 2020 6138 6150 A. Rodriguez-Gomez, A.D. Chowdhury, M. Caglayan, J.A. Bau, E. Abou-Hamad, J. Gascon, Non-oxidative dehydrogenation of isobutane over supported vanadium oxide: nature of the active sites and coke formation, Catal. Sci. Technol., 10 (2020) 6138-6150. [35] A.C. Ferrari Raman spectroscopy of graphene and graphite: disorder, electron-phonon coupling, doping and nonadiabatic effects Solid State Commun. 143 2007 47 57 A.C. Ferrari, Raman spectroscopy of graphene and graphite: Disorder, electron-phonon coupling, doping and nonadiabatic effects, Solid State Commun., 143 (2007) 47-57. [36] Y.Y. Shu D. Ma X.H. Bao Y.D. Xu Methane dehydro-aromatization over a Mo/phosphoric rare earth-containing penta-sil type zeolite in the absence of oxygen Catal. Lett. 66 2000 161 167 Y.Y. Shu, D. Ma, X.H. Bao, Y.D. Xu, Methane dehydro-aromatization over a Mo/phosphoric rare earth-containing penta-sil type zeolite in the absence of oxygen, Catal. Lett., 66 (2000) 161-167. [37] Z. Liu M.A. Nutt E. Iglesia The effects of CO2, CO and H2 co-reactants on methane reactions catalyzed by Mo/H-ZSM-5 Catal. Lett. 81 2002 271 279 Z. Liu, M.A. Nutt, E. Iglesia, The effects of CO2, CO and H2 co-reactants on methane reactions catalyzed by Mo/H-ZSM-5, Catal. Lett., 81 (2002) 271-279. [38] H.T. Ma R. Ohnishi M. Ichikawa Highly stable performance of methane dehydroaromatization on Mo/HZSM-5 catalyst with a small amount of H2 addition into methane feed Catal. Lett. 89 2003 143 146 H.T. Ma, R. Ohnishi, M. Ichikawa, Highly stable performance of methane dehydroaromatization on Mo/HZSM-5 catalyst with a small amount of H2 addition into methane feed, Catal. Lett., 89 (2003) 143-146. [39] T. Osawa I. Nakano O. Takayasu Dehydrogenation of methane over Mo/ZSM-5. Effects of additives in the methane stream Catal. Lett. 86 2003 57 62 T. Osawa, I. Nakano, O. Takayasu, Dehydrogenation of methane over Mo/ZSM-5. Effects of additives in the methane stream, Catal. Lett., 86 (2003) 57-62. [40] Y. Song Y.B. Xu Y. Suzuki H. Nakagome X.X. Ma Z.G. Zhang The distribution of coke formed over a multilayer Mo/HZSM-5 fixed bed in H2 co-fed methane aromatization at 1073 K: exploration of the coking pathway J. Catal. 330 2015 261 272 Y. Song, Y.B. Xu, Y. Suzuki, H. Nakagome, X.X. Ma, Z.G. Zhang, The distribution of coke formed over a multilayer Mo/HZSM-5 fixed bed in H2 co-fed methane aromatization at 1073 K: Exploration of the coking pathway, J. Catal., 330 (2015) 261-272.",
      "scopus-id": "85187654125",
      "coredata": {
        "eid": "1-s2.0-S0926860X24001066",
        "dc:description": "In this study, the methane dehydroaromatization (MDA) on vanadium oxide (VO x )-based catalysts was investigated. Using various catalyst supports, VO x /HZSM-5 exhibited the highest MDA activity. In MDA using VO x /HZSM-5, an induction period was observed. Raman spectroscopy and XPS analysis indicated that V2O5 species result in the highly dispersed state by the contact with CH4. X-ray absorption fine structure analysis suggested the formation of VC species. Such structural changes lead to the induction period for the MDA reaction. Based on the effect of the catalyst support and the aromatization reaction of ethylene, we propose a mechanism in which methane forms ethylene on the vanadium catalyst, and ethylene is then aromatized with the aid of the acid sites and micropore structure of HZSM-5. Additionally, the effect of hydrogen co-feeding on the MDA reaction was investigated, which revealed that catalyst deactivation due to coke formation was suppressed in the presence of hydrogen.",
        "openArchiveArticle": "false",
        "prism:coverDate": "2024-04-25",
        "openaccessUserLicense": null,
        "prism:aggregationType": "Journal",
        "prism:url": "https://api.elsevier.com/content/article/pii/S0926860X24001066",
        "dc:creator": [
          {
            "@_fa": "true",
            "$": "Jung, Hyunwoo"
          },
          {
            "@_fa": "true",
            "$": "Watashima, Taisei"
          },
          {
            "@_fa": "true",
            "$": "Kurokawa, Hideki"
          },
          {
            "@_fa": "true",
            "$": "Ogihara, Hitoshi"
          }
        ],
        "link": [
          {
            "@_fa": "true",
            "@rel": "self",
            "@href": "https://api.elsevier.com/content/article/pii/S0926860X24001066"
          },
          {
            "@_fa": "true",
            "@rel": "scidir",
            "@href": "https://www.sciencedirect.com/science/article/pii/S0926860X24001066"
          }
        ],
        "dc:format": "application/json",
        "openaccessType": null,
        "pii": "S0926-860X(24)00106-6",
        "prism:volume": "676",
        "articleNumber": "119662",
        "prism:publisher": "Elsevier B.V.",
        "dc:title": "Methane dehydroaromatization (MDA) on VO x /HZSM-5 catalysts",
        "prism:copyright": "© 2024 Elsevier B.V. All rights reserved.",
        "openaccess": "0",
        "prism:issn": "0926860X",
        "dcterms:subject": [
          {
            "@_fa": "true",
            "$": "Methane dehydroaromatization (MDA)"
          },
          {
            "@_fa": "true",
            "$": "VO x /HZSM-5"
          },
          {
            "@_fa": "true",
            "$": "Zeolites"
          },
          {
            "@_fa": "true",
            "$": "Coke"
          },
          {
            "@_fa": "true",
            "$": "H2 co-feeding"
          }
        ],
        "openaccessArticle": "false",
        "prism:publicationName": "Applied Catalysis A: General",
        "openaccessSponsorType": null,
        "prism:pageRange": "119662",
        "pubType": "fla",
        "prism:coverDisplayDate": "25 April 2024",
        "prism:doi": "10.1016/j.apcata.2024.119662",
        "prism:startingPage": "119662",
        "dc:identifier": "doi:10.1016/j.apcata.2024.119662",
        "openaccessSponsorName": null
      },
      "objects": {
        "object": [
          {
            "@category": "standard",
            "@height": "285",
            "@width": "602",
            "@_fa": "true",
            "$": "https://api.elsevier.com/content/object/eid/1-s2.0-S0926860X24001066-gr11.jpg?httpAccept=%2A%2F%2A",
            "@multimediatype": "JPEG image file",
            "@type": "IMAGE-DOWNSAMPLED",
            "@size": "34045",
            "@ref": "gr11",
            "@mimetype": "image/jpeg"
          },
          {
            "@category": "standard",
            "@height": "325",
            "@width": "339",
            "@_fa": "true",
            "$": "https://api.elsevier.com/content/object/eid/1-s2.0-S0926860X24001066-gr10.jpg?httpAccept=%2A%2F%2A",
            "@multimediatype": "JPEG image file",
            "@type": "IMAGE-DOWNSAMPLED",
            "@size": "19348",
            "@ref": "gr10",
            "@mimetype": "image/jpeg"
          },
          {
            "@category": "standard",
            "@height": "602",
            "@width": "602",
            "@_fa": "true",
            "$": "https://api.elsevier.com/content/object/eid/1-s2.0-S0926860X24001066-gr6.jpg?httpAccept=%2A%2F%2A",
            "@multimediatype": "JPEG image file",
            "@type": "IMAGE-DOWNSAMPLED",
            "@size": "72257",
            "@ref": "gr6",
            "@mimetype": "image/jpeg"
          },
          {
            "@category": "standard",
            "@height": "279",
            "@width": "602",
            "@_fa": "true",
            "$": "https://api.elsevier.com/content/object/eid/1-s2.0-S0926860X24001066-gr7.jpg?httpAccept=%2A%2F%2A",
            "@multimediatype": "JPEG image file",
            "@type": "IMAGE-DOWNSAMPLED",
            "@size": "34740",
            "@ref": "gr7",
            "@mimetype": "image/jpeg"
          },
          {
            "@category": "standard",
            "@height": "601",
            "@width": "602",
            "@_fa": "true",
            "$": "https://api.elsevier.com/content/object/eid/1-s2.0-S0926860X24001066-gr8.jpg?httpAccept=%2A%2F%2A",
            "@multimediatype": "JPEG image file",
            "@type": "IMAGE-DOWNSAMPLED",
            "@size": "42125",
            "@ref": "gr8",
            "@mimetype": "image/jpeg"
          },
          {
            "@category": "standard",
            "@height": "583",
            "@width": "602",
            "@_fa": "true",
            "$": "https://api.elsevier.com/content/object/eid/1-s2.0-S0926860X24001066-gr9.jpg?httpAccept=%2A%2F%2A",
            "@multimediatype": "JPEG image file",
            "@type": "IMAGE-DOWNSAMPLED",
            "@size": "75361",
            "@ref": "gr9",
            "@mimetype": "image/jpeg"
          },
          {
            "@category": "standard",
            "@height": "598",
            "@width": "602",
            "@_fa": "true",
            "$": "https://api.elsevier.com/content/object/eid/1-s2.0-S0926860X24001066-gr2.jpg?httpAccept=%2A%2F%2A",
            "@multimediatype": "JPEG image file",
            "@type": "IMAGE-DOWNSAMPLED",
            "@size": "74062",
            "@ref": "gr2",
            "@mimetype": "image/jpeg"
          },
          {
            "@category": "standard",
            "@height": "185",
            "@width": "500",
            "@_fa": "true",
            "$": "https://api.elsevier.com/content/object/eid/1-s2.0-S0926860X24001066-ga1.jpg?httpAccept=%2A%2F%2A",
            "@multimediatype": "JPEG image file",
            "@type": "IMAGE-DOWNSAMPLED",
            "@size": "25012",
            "@ref": "ga1",
            "@mimetype": "image/jpeg"
          },
          {
            "@category": "standard",
            "@height": "425",
            "@width": "602",
            "@_fa": "true",
            "$": "https://api.elsevier.com/content/object/eid/1-s2.0-S0926860X24001066-gr3.jpg?httpAccept=%2A%2F%2A",
            "@multimediatype": "JPEG image file",
            "@type": "IMAGE-DOWNSAMPLED",
            "@size": "48431",
            "@ref": "gr3",
            "@mimetype": "image/jpeg"
          },
          {
            "@category": "standard",
            "@height": "598",
            "@width": "602",
            "@_fa": "true",
            "$": "https://api.elsevier.com/content/object/eid/1-s2.0-S0926860X24001066-gr4.jpg?httpAccept=%2A%2F%2A",
            "@multimediatype": "JPEG image file",
            "@type": "IMAGE-DOWNSAMPLED",
            "@size": "74265",
            "@ref": "gr4",
            "@mimetype": "image/jpeg"
          },
          {
            "@category": "standard",
            "@height": "601",
            "@width": "602",
            "@_fa": "true",
            "$": "https://api.elsevier.com/content/object/eid/1-s2.0-S0926860X24001066-gr5.jpg?httpAccept=%2A%2F%2A",
            "@multimediatype": "JPEG image file",
            "@type": "IMAGE-DOWNSAMPLED",
            "@size": "72403",
            "@ref": "gr5",
            "@mimetype": "image/jpeg"
          },
          {
            "@category": "standard",
            "@height": "606",
            "@width": "602",
            "@_fa": "true",
            "$": "https://api.elsevier.com/content/object/eid/1-s2.0-S0926860X24001066-gr1.jpg?httpAccept=%2A%2F%2A",
            "@multimediatype": "JPEG image file",
            "@type": "IMAGE-DOWNSAMPLED",
            "@size": "57921",
            "@ref": "gr1",
            "@mimetype": "image/jpeg"
          },
          {
            "@category": "thumbnail",
            "@height": "104",
            "@width": "219",
            "@_fa": "true",
            "$": "https://api.elsevier.com/content/object/eid/1-s2.0-S0926860X24001066-gr11.sml?httpAccept=%2A%2F%2A",
            "@multimediatype": "GIF image file",
            "@type": "IMAGE-THUMBNAIL",
            "@size": "5070",
            "@ref": "gr11",
            "@mimetype": "image/gif"
          },
          {
            "@category": "thumbnail",
            "@height": "164",
            "@width": "171",
            "@_fa": "true",
            "$": "https://api.elsevier.com/content/object/eid/1-s2.0-S0926860X24001066-gr10.sml?httpAccept=%2A%2F%2A",
            "@multimediatype": "GIF image file",
            "@type": "IMAGE-THUMBNAIL",
            "@size": "5367",
            "@ref": "gr10",
            "@mimetype": "image/gif"
          },
          {
            "@category": "thumbnail",
            "@height": "164",
            "@width": "164",
            "@_fa": "true",
            "$": "https://api.elsevier.com/content/object/eid/1-s2.0-S0926860X24001066-gr6.sml?httpAccept=%2A%2F%2A",
            "@multimediatype": "GIF image file",
            "@type": "IMAGE-THUMBNAIL",
            "@size": "7822",
            "@ref": "gr6",
            "@mimetype": "image/gif"
          },
          {
            "@category": "thumbnail",
            "@height": "102",
            "@width": "219",
            "@_fa": "true",
            "$": "https://api.elsevier.com/content/object/eid/1-s2.0-S0926860X24001066-gr7.sml?httpAccept=%2A%2F%2A",
            "@multimediatype": "GIF image file",
            "@type": "IMAGE-THUMBNAIL",
            "@size": "5483",
            "@ref": "gr7",
            "@mimetype": "image/gif"
          },
          {
            "@category": "thumbnail",
            "@height": "164",
            "@width": "164",
            "@_fa": "true",
            "$": "https://api.elsevier.com/content/object/eid/1-s2.0-S0926860X24001066-gr8.sml?httpAccept=%2A%2F%2A",
            "@multimediatype": "GIF image file",
            "@type": "IMAGE-THUMBNAIL",
            "@size": "4411",
            "@ref": "gr8",
            "@mimetype": "image/gif"
          },
          {
            "@category": "thumbnail",
            "@height": "164",
            "@width": "169",
            "@_fa": "true",
            "$": "https://api.elsevier.com/content/object/eid/1-s2.0-S0926860X24001066-gr9.sml?httpAccept=%2A%2F%2A",
            "@multimediatype": "GIF image file",
            "@type": "IMAGE-THUMBNAIL",
            "@size": "8567",
            "@ref": "gr9",
            "@mimetype": "image/gif"
          },
          {
            "@category": "thumbnail",
            "@height": "164",
            "@width": "165",
            "@_fa": "true",
            "$": "https://api.elsevier.com/content/object/eid/1-s2.0-S0926860X24001066-gr2.sml?httpAccept=%2A%2F%2A",
            "@multimediatype": "GIF image file",
            "@type": "IMAGE-THUMBNAIL",
            "@size": "7624",
            "@ref": "gr2",
            "@mimetype": "image/gif"
          },
          {
            "@category": "thumbnail",
            "@height": "81",
            "@width": "219",
            "@_fa": "true",
            "$": "https://api.elsevier.com/content/object/eid/1-s2.0-S0926860X24001066-ga1.sml?httpAccept=%2A%2F%2A",
            "@multimediatype": "GIF image file",
            "@type": "IMAGE-THUMBNAIL",
            "@size": "6687",
            "@ref": "ga1",
            "@mimetype": "image/gif"
          },
          {
            "@category": "thumbnail",
            "@height": "155",
            "@width": "219",
            "@_fa": "true",
            "$": "https://api.elsevier.com/content/object/eid/1-s2.0-S0926860X24001066-gr3.sml?httpAccept=%2A%2F%2A",
            "@multimediatype": "GIF image file",
            "@type": "IMAGE-THUMBNAIL",
            "@size": "8278",
            "@ref": "gr3",
            "@mimetype": "image/gif"
          },
          {
            "@category": "thumbnail",
            "@height": "164",
            "@width": "165",
            "@_fa": "true",
            "$": "https://api.elsevier.com/content/object/eid/1-s2.0-S0926860X24001066-gr4.sml?httpAccept=%2A%2F%2A",
            "@multimediatype": "GIF image file",
            "@type": "IMAGE-THUMBNAIL",
            "@size": "8859",
            "@ref": "gr4",
            "@mimetype": "image/gif"
          },
          {
            "@category": "thumbnail",
            "@height": "164",
            "@width": "164",
            "@_fa": "true",
            "$": "https://api.elsevier.com/content/object/eid/1-s2.0-S0926860X24001066-gr5.sml?httpAccept=%2A%2F%2A",
            "@multimediatype": "GIF image file",
            "@type": "IMAGE-THUMBNAIL",
            "@size": "8070",
            "@ref": "gr5",
            "@mimetype": "image/gif"
          },
          {
            "@category": "thumbnail",
            "@height": "164",
            "@width": "163",
            "@_fa": "true",
            "$": "https://api.elsevier.com/content/object/eid/1-s2.0-S0926860X24001066-gr1.sml?httpAccept=%2A%2F%2A",
            "@multimediatype": "GIF image file",
            "@type": "IMAGE-THUMBNAIL",
            "@size": "6084",
            "@ref": "gr1",
            "@mimetype": "image/gif"
          },
          {
            "@category": "high",
            "@height": "1260",
            "@width": "2661",
            "@_fa": "true",
            "$": "https://api.elsevier.com/content/object/eid/1-s2.0-S0926860X24001066-gr11_lrg.jpg?httpAccept=%2A%2F%2A",
            "@multimediatype": "JPEG image file",
            "@type": "IMAGE-HIGH-RES",
            "@size": "153001",
            "@ref": "gr11",
            "@mimetype": "image/jpeg"
          },
          {
            "@category": "high",
            "@height": "1434",
            "@width": "1497",
            "@_fa": "true",
            "$": "https://api.elsevier.com/content/object/eid/1-s2.0-S0926860X24001066-gr10_lrg.jpg?httpAccept=%2A%2F%2A",
            "@multimediatype": "JPEG image file",
            "@type": "IMAGE-HIGH-RES",
            "@size": "86708",
            "@ref": "gr10",
            "@mimetype": "image/jpeg"
          },
          {
            "@category": "high",
            "@height": "2659",
            "@width": "2661",
            "@_fa": "true",
            "$": "https://api.elsevier.com/content/object/eid/1-s2.0-S0926860X24001066-gr6_lrg.jpg?httpAccept=%2A%2F%2A",
            "@multimediatype": "JPEG image file",
            "@type": "IMAGE-HIGH-RES",
            "@size": "334365",
            "@ref": "gr6",
            "@mimetype": "image/jpeg"
          },
          {
            "@category": "high",
            "@height": "1234",
            "@width": "2661",
            "@_fa": "true",
            "$": "https://api.elsevier.com/content/object/eid/1-s2.0-S0926860X24001066-gr7_lrg.jpg?httpAccept=%2A%2F%2A",
            "@multimediatype": "JPEG image file",
            "@type": "IMAGE-HIGH-RES",
            "@size": "159199",
            "@ref": "gr7",
            "@mimetype": "image/jpeg"
          },
          {
            "@category": "high",
            "@height": "2655",
            "@width": "2661",
            "@_fa": "true",
            "$": "https://api.elsevier.com/content/object/eid/1-s2.0-S0926860X24001066-gr8_lrg.jpg?httpAccept=%2A%2F%2A",
            "@multimediatype": "JPEG image file",
            "@type": "IMAGE-HIGH-RES",
            "@size": "187319",
            "@ref": "gr8",
            "@mimetype": "image/jpeg"
          },
          {
            "@category": "high",
            "@height": "2578",
            "@width": "2661",
            "@_fa": "true",
            "$": "https://api.elsevier.com/content/object/eid/1-s2.0-S0926860X24001066-gr9_lrg.jpg?httpAccept=%2A%2F%2A",
            "@multimediatype": "JPEG image file",
            "@type": "IMAGE-HIGH-RES",
            "@size": "333050",
            "@ref": "gr9",
            "@mimetype": "image/jpeg"
          },
          {
            "@category": "high",
            "@height": "2645",
            "@width": "2661",
            "@_fa": "true",
            "$": "https://api.elsevier.com/content/object/eid/1-s2.0-S0926860X24001066-gr2_lrg.jpg?httpAccept=%2A%2F%2A",
            "@multimediatype": "JPEG image file",
            "@type": "IMAGE-HIGH-RES",
            "@size": "334784",
            "@ref": "gr2",
            "@mimetype": "image/jpeg"
          },
          {
            "@category": "high",
            "@height": "818",
            "@width": "2213",
            "@_fa": "true",
            "$": "https://api.elsevier.com/content/object/eid/1-s2.0-S0926860X24001066-ga1_lrg.jpg?httpAccept=%2A%2F%2A",
            "@multimediatype": "JPEG image file",
            "@type": "IMAGE-HIGH-RES",
            "@size": "171952",
            "@ref": "ga1",
            "@mimetype": "image/jpeg"
          },
          {
            "@category": "high",
            "@height": "1878",
            "@width": "2661",
            "@_fa": "true",
            "$": "https://api.elsevier.com/content/object/eid/1-s2.0-S0926860X24001066-gr3_lrg.jpg?httpAccept=%2A%2F%2A",
            "@multimediatype": "JPEG image file",
            "@type": "IMAGE-HIGH-RES",
            "@size": "217571",
            "@ref": "gr3",
            "@mimetype": "image/jpeg"
          },
          {
            "@category": "high",
            "@height": "2642",
            "@width": "2661",
            "@_fa": "true",
            "$": "https://api.elsevier.com/content/object/eid/1-s2.0-S0926860X24001066-gr4_lrg.jpg?httpAccept=%2A%2F%2A",
            "@multimediatype": "JPEG image file",
            "@type": "IMAGE-HIGH-RES",
            "@size": "327010",
            "@ref": "gr4",
            "@mimetype": "image/jpeg"
          },
          {
            "@category": "high",
            "@height": "2657",
            "@width": "2661",
            "@_fa": "true",
            "$": "https://api.elsevier.com/content/object/eid/1-s2.0-S0926860X24001066-gr5_lrg.jpg?httpAccept=%2A%2F%2A",
            "@multimediatype": "JPEG image file",
            "@type": "IMAGE-HIGH-RES",
            "@size": "325610",
            "@ref": "gr5",
            "@mimetype": "image/jpeg"
          },
          {
            "@category": "high",
            "@height": "2679",
            "@width": "2661",
            "@_fa": "true",
            "$": "https://api.elsevier.com/content/object/eid/1-s2.0-S0926860X24001066-gr1_lrg.jpg?httpAccept=%2A%2F%2A",
            "@multimediatype": "JPEG image file",
            "@type": "IMAGE-HIGH-RES",
            "@size": "249788",
            "@ref": "gr1",
            "@mimetype": "image/jpeg"
          },
          {
            "@category": "thumbnail",
            "@_fa": "true",
            "$": "https://api.elsevier.com/content/object/eid/1-s2.0-S0926860X24001066-si0001.svg?httpAccept=%2A%2F%2A",
            "@multimediatype": "Scalable Vector Graphics file",
            "@type": "ALTIMG",
            "@size": "9819",
            "@ref": "si0001",
            "@mimetype": "image/svg+xml"
          },
          {
            "@category": "thumbnail",
            "@_fa": "true",
            "$": "https://api.elsevier.com/content/object/eid/1-s2.0-S0926860X24001066-si0002.svg?httpAccept=%2A%2F%2A",
            "@multimediatype": "Scalable Vector Graphics file",
            "@type": "ALTIMG",
            "@size": "3987",
            "@ref": "si0002",
            "@mimetype": "image/svg+xml"
          },
          {
            "@category": "standard",
            "@_fa": "true",
            "$": "https://api.elsevier.com/content/object/eid/1-s2.0-S0926860X24001066-am.pdf?httpAccept=%2A%2F%2A",
            "@multimediatype": "Acrobat PDF file",
            "@type": "AAM-PDF",
            "@size": "1995727",
            "@ref": "am",
            "@mimetype": "application/pdf"
          }
        ]
      },
      "link": {
        "@rel": "abstract",
        "@href": "https://api.elsevier.com/content/abstract/scopus_id/85187654125"
      }
    }
  }
}