{
  "metadata": {
    "title": "Oxygen vacancies promoted catalytic hydrodefluorination over Pd/La<ce:inf loc=post>2</ce:inf>O<ce:inf loc=post>3</ce:inf> catalyst for the efficient degradation of fluorophenols at mild condition",
    "authors": "; ; ",
    "journal": "Applied Catalysis A: General",
    "date": "2024-08-05",
    "doi": "10.1016/j.apcata.2024.119856",
    "abstract": "",
    "uri": "https://api.elsevier.com/content/article/pii/S0926860X24003016",
    "pii": "S0926860X24003016"
  },
  "fulltext": {
    "full-text-retrieval-response": {
      "scopus-eid": "2-s2.0-85197056057",
      "originalText": "serial JL 271346 291210 291744 291809 31 Applied Catalysis A: General APPLIEDCATALYSISAGENERAL 2024-06-24 2024-06-24 2024-07-02 2024-07-02 2024-07-10T08:53:26 1-s2.0-S0926860X24003016 S0926-860X(24)00301-6 S0926860X24003016 10.1016/j.apcata.2024.119856 S300 S300.1 FULL-TEXT 1-s2.0-S0926860X24X00113 2024-10-07T05:15:19.576028Z 0 0 20240805 2024 2024-06-24T16:54:53.489382Z absattachment articleinfo articlenumber articletitlenorm authfirstinitialnorm authfirstsurnamenorm cid cids contenttype copyright crossmark dateloaded dateloadedtxt datesearch datesort dateupdated dco docsubtype doctype doi eid ewtransactionid hubeid indexeddate issn issnnorm itemstage itemtransactionid itemweight openaccess openarchive pg pgfirst pii piinorm pubdatestart pubdatetxt pubyr sortorder srctitle srctitlenorm srctype ssids alllist content subj subheadings suppl tomb volfirst volissue volumelist webpdf webpdfpagecount yearnav figure table e-component body mmlmath acknowledge affil appendices articletitle auth authfirstini authfull authkeywords authlast grantnumber grantsponsor highlightsabst orcid primabst ref specialabst 0926-860X 0926860X true 683 683 C Volume 683 27 119856 119856 119856 20240805 5 August 2024 2024-08-05 2024 article fla © 2024 Elsevier B.V. All rights are reserved, including those for text and data mining, AI training, and similar technologies. OXYGENVACANCIESPROMOTEDCATALYTICHYDRODEFLUORINATIONOVERPDLA2O3CATALYSTFOREFFICIENTDEGRADATIONFLUOROPHENOLSMILDCONDITION LI L 1 Introduction 2 Experimental 2.1 Materials 2.2 Catalyst preparation 2.3 Catalyst characterization 2.4 Catalytic performance testing 3 Results and discussion 3.1 Catalyst characterization 3.2 HDF of 4-FP over supported Pd catalyst 3.3 Kinetic study 3.4 HDF mechanism of 4-FP over Pd/La2O3 catalyst 3.5 HDF optimization 4 Conclusions CRediT authorship contribution statement Acknowledgments Appendix A Supplementary material References HARKEY 2012 1725 1731 A CHENG 2023 13218 R WANG 2021 127577 X WANG 2021 124456 Q XIA 2009 1029 1033 C MA 2020 12520 X ZENG 2017 29 38 Z XU 2018 110 119 Y WANG 2021 125602 X RIVERA 2019 520 A LI 2023 146231 H LIU 2020 116311 X XU 2016 16 20 Y TIAN 2018 280 287 H XIONG 2021 125913 J MAHY 2019 103014 J MA 2016 25068 X MA 2022 133729 X WHITTLESEY 2014 3152 3159 M BAUMGARTNER 2013 6545 6553 R YANG 1999 2085 2087 H STANGER 2004 59 68 K XIONG 2018 89 95 J KEANE 2011 800 821 M LAN 2016 109023 109029 L YU 2020 16528 16539 Y HUANG 2019 928 936 C LI 2020 105845 W WANG 2016 3845 3853 Z WU 2019 3700 3715 Q TIAN 2022 741 753 L XU 2019 6938 6945 J MOLINA 2014 330 338 C ZHANG 2019 1506 1514 X XIAO 2020 215 M GU 2015 26914 26922 W PANG 2021 149214 Y LEVAN 1993 18 26 T PENG 2017 39 47 H BARRERA 2012 136 141 A LI 2017 683 694 X MATAM 2012 237 244 S ZHANG 2014 20229 20237 X SUN 2020 584 593 J BEJAR 2020 144898 J GU 2021 105415 M CHENAKIN 2014 1 11 S LI 2018 661 669 J SONG 2014 4350 H LI 2020 145133 J KUMAR 2021 149410 A NAIK 2021 10553 10564 P DING 2017 725 733 D DING 2018 336 344 X TRESSAUD 1986 291 299 A HUANG 2021 351 354 F LIU 2023 024101 D NAIK 2023 119007 P NELSON 2015 2051 2061 N ZIERKIEWICZ 2003 4547 4554 W LAACHIR 1991 1601 1609 A GUAN 2016 63 73 Q LIX2024X119856 LIX2024X119856XL 2026-07-02T00:00:00.000Z 2026-07-02T00:00:00.000Z http://creativecommons.org/licenses/by-nc-nd/4.0/ © 2024 Elsevier B.V. All rights are reserved, including those for text and data mining, AI training, and similar technologies. 2024-10-07T05:13:32.895Z http://vtw.elsevier.com/data/voc/AddOnTypes/50.7/aggregated-refined Guizhou Province Department of Science and Technology of China QKHJC-ZK2022-YB613 Guizhou Province Department of Science and Technology http://data.elsevier.com/vocabulary/SciValFunders/501100004001 http://sws.geonames.org/1814991 This work was supported by the Guizhou Province Department of Science and Technology of China [grant numbers QKHJC-ZK2022-YB613]. https://doi.org/10.15223/policy-017 https://doi.org/10.15223/policy-037 https://doi.org/10.15223/policy-012 https://doi.org/10.15223/policy-029 https://doi.org/10.15223/policy-004 item S0926-860X(24)00301-6 S0926860X24003016 1-s2.0-S0926860X24003016 10.1016/j.apcata.2024.119856 271346 2024-09-02T12:39:45.262355Z 2024-08-05 1-s2.0-S0926860X24003016-main.pdf https://s3-eu-west-1.amazonaws.com/prod-ucs-content-store-eu-west/content/pii:S0926860X24003016/MAIN/application/pdf/c410bdd9e2d24c4680dcce9b7dfeaee3/main.pdf main.pdf pdf true 9133534 MAIN 10 1-s2.0-S0926860X24003016-main_1.png https://s3-eu-west-1.amazonaws.com/prod-ucs-content-store-eu-west/content/pii:S0926860X24003016/PREVIEW/image/png/887f9bdaa11f2a4faf4d21d0709b50f2/main_1.png main_1.png png 59357 849 656 IMAGE-WEB-PDF 1 1-s2.0-S0926860X24003016-ga1.jpg https://s3-eu-west-1.amazonaws.com/prod-ucs-content-store-eu-west/content/pii:S0926860X24003016/ga1/DOWNSAMPLED/image/jpeg/a64b7f846696bc3b46653634e36562dc/ga1.jpg ga1 true ga1.jpg jpg 16941 200 297 IMAGE-DOWNSAMPLED 1-s2.0-S0926860X24003016-gr4.jpg https://s3-eu-west-1.amazonaws.com/prod-ucs-content-store-eu-west/content/pii:S0926860X24003016/gr4/DOWNSAMPLED/image/jpeg/f260776bc29f21068f54f85c90b41a2e/gr4.jpg gr4 gr4.jpg jpg 94776 361 791 IMAGE-DOWNSAMPLED 1-s2.0-S0926860X24003016-gr3.jpg https://s3-eu-west-1.amazonaws.com/prod-ucs-content-store-eu-west/content/pii:S0926860X24003016/gr3/DOWNSAMPLED/image/jpeg/74edf4e6268b54f2e30e2f2ffa270e62/gr3.jpg gr3 gr3.jpg jpg 152194 681 791 IMAGE-DOWNSAMPLED 1-s2.0-S0926860X24003016-gr6.jpg https://s3-eu-west-1.amazonaws.com/prod-ucs-content-store-eu-west/content/pii:S0926860X24003016/gr6/DOWNSAMPLED/image/jpeg/2d83694e0041123695edd9f820e28379/gr6.jpg gr6 gr6.jpg jpg 42349 245 678 IMAGE-DOWNSAMPLED 1-s2.0-S0926860X24003016-gr5.jpg https://s3-eu-west-1.amazonaws.com/prod-ucs-content-store-eu-west/content/pii:S0926860X24003016/gr5/DOWNSAMPLED/image/jpeg/eeb9142c85041dcdb28f5c0eb3aaebf9/gr5.jpg gr5 gr5.jpg jpg 19454 274 339 IMAGE-DOWNSAMPLED 1-s2.0-S0926860X24003016-gr8.jpg https://s3-eu-west-1.amazonaws.com/prod-ucs-content-store-eu-west/content/pii:S0926860X24003016/gr8/DOWNSAMPLED/image/jpeg/98abf6d2b19df2648cce73536d022f5c/gr8.jpg gr8 gr8.jpg jpg 75400 515 678 IMAGE-DOWNSAMPLED 1-s2.0-S0926860X24003016-gr7.jpg https://s3-eu-west-1.amazonaws.com/prod-ucs-content-store-eu-west/content/pii:S0926860X24003016/gr7/DOWNSAMPLED/image/jpeg/f18a435a792bb2f474c99be6508a996f/gr7.jpg gr7 gr7.jpg jpg 72860 497 678 IMAGE-DOWNSAMPLED 1-s2.0-S0926860X24003016-gr9.jpg https://s3-eu-west-1.amazonaws.com/prod-ucs-content-store-eu-west/content/pii:S0926860X24003016/gr9/DOWNSAMPLED/image/jpeg/53d9e6e1d65a119a01727ffcfd45be7b/gr9.jpg gr9 gr9.jpg jpg 33830 322 565 IMAGE-DOWNSAMPLED 1-s2.0-S0926860X24003016-sc1.jpg https://s3-eu-west-1.amazonaws.com/prod-ucs-content-store-eu-west/content/pii:S0926860X24003016/sc1/DOWNSAMPLED/image/jpeg/7a2763d1554dbb40c95251349278ef0c/sc1.jpg sc1 sc1.jpg jpg 5721 106 282 IMAGE-DOWNSAMPLED 1-s2.0-S0926860X24003016-gr10.jpg https://s3-eu-west-1.amazonaws.com/prod-ucs-content-store-eu-west/content/pii:S0926860X24003016/gr10/DOWNSAMPLED/image/jpeg/92385592c895f6828002e5beab8e6398/gr10.jpg gr10 gr10.jpg jpg 21925 256 339 IMAGE-DOWNSAMPLED 1-s2.0-S0926860X24003016-gr2.jpg https://s3-eu-west-1.amazonaws.com/prod-ucs-content-store-eu-west/content/pii:S0926860X24003016/gr2/DOWNSAMPLED/image/jpeg/78a5a4442fd16915741b53013808dcfd/gr2.jpg gr2 gr2.jpg jpg 22254 274 339 IMAGE-DOWNSAMPLED 1-s2.0-S0926860X24003016-gr1.jpg https://s3-eu-west-1.amazonaws.com/prod-ucs-content-store-eu-west/content/pii:S0926860X24003016/gr1/DOWNSAMPLED/image/jpeg/b077637f0acaae8fa229a36f17b260bc/gr1.jpg gr1 gr1.jpg jpg 29011 274 339 IMAGE-DOWNSAMPLED 1-s2.0-S0926860X24003016-ga1.sml https://s3-eu-west-1.amazonaws.com/prod-ucs-content-store-eu-west/content/pii:S0926860X24003016/ga1/THUMBNAIL/image/gif/c1c6c6adf36a6d46ae081af89c74e11f/ga1.sml ga1 true ga1.sml sml 15397 147 219 IMAGE-THUMBNAIL 1-s2.0-S0926860X24003016-gr4.sml https://s3-eu-west-1.amazonaws.com/prod-ucs-content-store-eu-west/content/pii:S0926860X24003016/gr4/THUMBNAIL/image/gif/fec1e66fc73b1b16faa5c3c181f8c58f/gr4.sml gr4 gr4.sml sml 11476 100 219 IMAGE-THUMBNAIL 1-s2.0-S0926860X24003016-gr3.sml https://s3-eu-west-1.amazonaws.com/prod-ucs-content-store-eu-west/content/pii:S0926860X24003016/gr3/THUMBNAIL/image/gif/c451ca566f8c9e44dba624d869fad999/gr3.sml gr3 gr3.sml sml 14950 164 190 IMAGE-THUMBNAIL 1-s2.0-S0926860X24003016-gr6.sml https://s3-eu-west-1.amazonaws.com/prod-ucs-content-store-eu-west/content/pii:S0926860X24003016/gr6/THUMBNAIL/image/gif/ca3cdc1475ca0d495a8f879d7faeb5b4/gr6.sml gr6 gr6.sml sml 6358 79 219 IMAGE-THUMBNAIL 1-s2.0-S0926860X24003016-gr5.sml https://s3-eu-west-1.amazonaws.com/prod-ucs-content-store-eu-west/content/pii:S0926860X24003016/gr5/THUMBNAIL/image/gif/051114f321345b21550994b23ccb9013/gr5.sml gr5 gr5.sml sml 7226 164 203 IMAGE-THUMBNAIL 1-s2.0-S0926860X24003016-gr8.sml https://s3-eu-west-1.amazonaws.com/prod-ucs-content-store-eu-west/content/pii:S0926860X24003016/gr8/THUMBNAIL/image/gif/101c24b71630c58e914bbf1e0fcd3023/gr8.sml gr8 gr8.sml sml 10773 164 216 IMAGE-THUMBNAIL 1-s2.0-S0926860X24003016-gr7.sml https://s3-eu-west-1.amazonaws.com/prod-ucs-content-store-eu-west/content/pii:S0926860X24003016/gr7/THUMBNAIL/image/gif/102212be74f8a93ecb2f9b9daad05a71/gr7.sml gr7 gr7.sml sml 10118 160 219 IMAGE-THUMBNAIL 1-s2.0-S0926860X24003016-gr9.sml https://s3-eu-west-1.amazonaws.com/prod-ucs-content-store-eu-west/content/pii:S0926860X24003016/gr9/THUMBNAIL/image/gif/db7ce5162b5e48bee17e8670307b7e73/gr9.sml gr9 gr9.sml sml 7774 125 219 IMAGE-THUMBNAIL 1-s2.0-S0926860X24003016-sc1.sml https://s3-eu-west-1.amazonaws.com/prod-ucs-content-store-eu-west/content/pii:S0926860X24003016/sc1/THUMBNAIL/image/gif/1eeeb1ed6ae7a546077b0c62f1e632cd/sc1.sml sc1 sc1.sml sml 3220 82 219 IMAGE-THUMBNAIL 1-s2.0-S0926860X24003016-gr10.sml https://s3-eu-west-1.amazonaws.com/prod-ucs-content-store-eu-west/content/pii:S0926860X24003016/gr10/THUMBNAIL/image/gif/80f4c711a79b14598fdfd77378c2dcb8/gr10.sml gr10 gr10.sml sml 12796 164 217 IMAGE-THUMBNAIL 1-s2.0-S0926860X24003016-gr2.sml https://s3-eu-west-1.amazonaws.com/prod-ucs-content-store-eu-west/content/pii:S0926860X24003016/gr2/THUMBNAIL/image/gif/1b0037b0c066784fd98632dab0a220d0/gr2.sml gr2 gr2.sml sml 8805 164 202 IMAGE-THUMBNAIL 1-s2.0-S0926860X24003016-gr1.sml https://s3-eu-west-1.amazonaws.com/prod-ucs-content-store-eu-west/content/pii:S0926860X24003016/gr1/THUMBNAIL/image/gif/488e93ccf42c49e95bdf9f31d2731a4e/gr1.sml gr1 gr1.sml sml 10497 164 203 IMAGE-THUMBNAIL 1-s2.0-S0926860X24003016-ga1_lrg.jpg https://s3-eu-west-1.amazonaws.com/prod-ucs-content-store-eu-west/content/pii:S0926860X24003016/HIGHRES/image/jpeg/4a3b641198f3e49243b6d57816294398/ga1_lrg.jpg ga1 true ga1_lrg.jpg jpg 137805 886 1317 IMAGE-HIGH-RES 1-s2.0-S0926860X24003016-gr4_lrg.jpg https://s3-eu-west-1.amazonaws.com/prod-ucs-content-store-eu-west/content/pii:S0926860X24003016/HIGHRES/image/jpeg/a857cc4384f3ba1126c9082d9b0fb9c2/gr4_lrg.jpg gr4 gr4_lrg.jpg jpg 478855 1593 3493 IMAGE-HIGH-RES 1-s2.0-S0926860X24003016-gr3_lrg.jpg https://s3-eu-west-1.amazonaws.com/prod-ucs-content-store-eu-west/content/pii:S0926860X24003016/HIGHRES/image/jpeg/04be4f85fdb1ee0df42dc3c1f2068703/gr3_lrg.jpg gr3 gr3_lrg.jpg jpg 979083 3008 3493 IMAGE-HIGH-RES 1-s2.0-S0926860X24003016-gr6_lrg.jpg https://s3-eu-west-1.amazonaws.com/prod-ucs-content-store-eu-west/content/pii:S0926860X24003016/HIGHRES/image/jpeg/615f92e3d55989c9271d09f768a91493/gr6_lrg.jpg gr6 gr6_lrg.jpg jpg 219262 1080 2994 IMAGE-HIGH-RES 1-s2.0-S0926860X24003016-gr5_lrg.jpg https://s3-eu-west-1.amazonaws.com/prod-ucs-content-store-eu-west/content/pii:S0926860X24003016/HIGHRES/image/jpeg/661be6cc0fdf6407536082c70cb8035c/gr5_lrg.jpg gr5 gr5_lrg.jpg jpg 105462 1210 1497 IMAGE-HIGH-RES 1-s2.0-S0926860X24003016-gr8_lrg.jpg https://s3-eu-west-1.amazonaws.com/prod-ucs-content-store-eu-west/content/pii:S0926860X24003016/HIGHRES/image/jpeg/32d0259169b337816c1ab0cd594f0037/gr8_lrg.jpg gr8 gr8_lrg.jpg jpg 372710 2273 2994 IMAGE-HIGH-RES 1-s2.0-S0926860X24003016-gr7_lrg.jpg https://s3-eu-west-1.amazonaws.com/prod-ucs-content-store-eu-west/content/pii:S0926860X24003016/HIGHRES/image/jpeg/63359c01b050420e897fdcc9164bde97/gr7_lrg.jpg gr7 gr7_lrg.jpg jpg 351591 2193 2994 IMAGE-HIGH-RES 1-s2.0-S0926860X24003016-gr9_lrg.jpg https://s3-eu-west-1.amazonaws.com/prod-ucs-content-store-eu-west/content/pii:S0926860X24003016/HIGHRES/image/jpeg/4d2e24d1a02caf214b793f1de4989bc9/gr9_lrg.jpg gr9 gr9_lrg.jpg jpg 157311 1420 2495 IMAGE-HIGH-RES 1-s2.0-S0926860X24003016-sc1_lrg.jpg https://s3-eu-west-1.amazonaws.com/prod-ucs-content-store-eu-west/content/pii:S0926860X24003016/HIGHRES/image/jpeg/c313f980d3e2e29b41bcc49abcdd9d21/sc1_lrg.jpg sc1 sc1_lrg.jpg jpg 30950 468 1247 IMAGE-HIGH-RES 1-s2.0-S0926860X24003016-gr10_lrg.jpg https://s3-eu-west-1.amazonaws.com/prod-ucs-content-store-eu-west/content/pii:S0926860X24003016/HIGHRES/image/jpeg/fff0b6d13ab5c0f0ebb8525f9bcea18c/gr10_lrg.jpg gr10 gr10_lrg.jpg jpg 206020 1130 1497 IMAGE-HIGH-RES 1-s2.0-S0926860X24003016-gr2_lrg.jpg https://s3-eu-west-1.amazonaws.com/prod-ucs-content-store-eu-west/content/pii:S0926860X24003016/HIGHRES/image/jpeg/893047c0b6111c03cb4ddcfb4e784339/gr2_lrg.jpg gr2 gr2_lrg.jpg jpg 103245 1212 1497 IMAGE-HIGH-RES 1-s2.0-S0926860X24003016-gr1_lrg.jpg https://s3-eu-west-1.amazonaws.com/prod-ucs-content-store-eu-west/content/pii:S0926860X24003016/HIGHRES/image/jpeg/b0939e7a1856e7282755ca01b374deda/gr1_lrg.jpg gr1 gr1_lrg.jpg jpg 159902 1211 1497 IMAGE-HIGH-RES 1-s2.0-S0926860X24003016-mmc1.docx https://s3-eu-west-1.amazonaws.com/prod-ucs-content-store-eu-west/content/pii:S0926860X24003016/mmc1/MAIN/application/vnd.openxmlformats-officedocument.wordprocessingml.document/bbcb0cbe8104fbb68f16b70391acbfa8/mmc1.docx mmc1 mmc1.docx docx 592224 APPLICATION 1-s2.0-S0926860X24003016-si0001.svg https://s3-eu-west-1.amazonaws.com/prod-ucs-content-store-eu-west/content/pii:S0926860X24003016/image/svg+xml/36779255c764fb1354d504faeb7bca11/si0001.svg si0001 si0001.svg svg 3476 ALTIMG 1-s2.0-S0926860X24003016-si0002.svg https://s3-eu-west-1.amazonaws.com/prod-ucs-content-store-eu-west/content/pii:S0926860X24003016/image/svg+xml/d719eccb6b58913669bc4f4401dd1464/si0002.svg si0002 si0002.svg svg 3116 ALTIMG 1-s2.0-S0926860X24003016-si0003.svg https://s3-eu-west-1.amazonaws.com/prod-ucs-content-store-eu-west/content/pii:S0926860X24003016/image/svg+xml/a0f1ddff217b923af11f015605860d4e/si0003.svg si0003 si0003.svg svg 2224 ALTIMG 1-s2.0-S0926860X24003016-si0004.svg https://s3-eu-west-1.amazonaws.com/prod-ucs-content-store-eu-west/content/pii:S0926860X24003016/image/svg+xml/ac7b3c99482c9d7cfabbc579b95cf33b/si0004.svg si0004 si0004.svg svg 2613 ALTIMG 1-s2.0-S0926860X24003016-si0005.svg https://s3-eu-west-1.amazonaws.com/prod-ucs-content-store-eu-west/content/pii:S0926860X24003016/image/svg+xml/72f1ef7c4529ae5b9e5541e4f42e23ef/si0005.svg si0005 si0005.svg svg 3282 ALTIMG 1-s2.0-S0926860X24003016-si0006.svg https://s3-eu-west-1.amazonaws.com/prod-ucs-content-store-eu-west/content/pii:S0926860X24003016/image/svg+xml/ec963c163773f18528aec9ebfc78578b/si0006.svg si0006 si0006.svg svg 3598 ALTIMG 1-s2.0-S0926860X24003016-si0007.svg https://s3-eu-west-1.amazonaws.com/prod-ucs-content-store-eu-west/content/pii:S0926860X24003016/image/svg+xml/2b9060b96444130fb49a4903350f1fc6/si0007.svg si0007 si0007.svg svg 2816 ALTIMG 1-s2.0-S0926860X24003016-si0008.svg https://s3-eu-west-1.amazonaws.com/prod-ucs-content-store-eu-west/content/pii:S0926860X24003016/image/svg+xml/03895818c5cca09382d03eb9fee2d8db/si0008.svg si0008 si0008.svg svg 4587 ALTIMG 1-s2.0-S0926860X24003016-si0009.svg https://s3-eu-west-1.amazonaws.com/prod-ucs-content-store-eu-west/content/pii:S0926860X24003016/image/svg+xml/f038f359726d1b6c5c4085e31fec8f65/si0009.svg si0009 si0009.svg svg 9041 ALTIMG 1-s2.0-S0926860X24003016-am.pdf am am.pdf pdf 7632098 AAM-PDF https://s3-eu-west-1.amazonaws.com/prod-ucs-content-store-eu-west/content/egi:108FK7JKF9K/MAIN/application/pdf/3cb1f7ab08af6d46bd0ed30c1b147060/am.pdf APCATA 119856 119856 S0926-860X(24)00301-6 10.1016/j.apcata.2024.119856 Elsevier B.V. Fig. 1 XRD patterns of 1 wt% Pd/SiO2 (a), 5 wt% Pd/La2O3 (b), 1 wt% Pd/La2O3 (c) and 0.2 wt% Pd/La2O3 (d) catalysts. Fig. 1 Fig. 2 TPR profiles of 1 wt% Pd/SiO2 (a), 5 wt% Pd/La2O3 (b), 1 wt% Pd/La2O3 (c) and 0.2 wt% Pd/La2O3 (d) catalysts. Fig. 2 Fig. 3 TEM images of 0.2 wt% Pd/La2O3 (a), 1 wt% Pd/La2O3 (b),5 wt% Pd/La2O3 (c) and 1 wt% Pd/SiO2 (d) catalysts, HAADF-STEM and element mapping images of 0.2 wt% Pd/La2O3 catalyst (e-i). The inset in (a) is the HRTEM image corresponding to the labeled regions. Fig. 3 Fig. 4 XPS spectra of C1s (a), O1s (b) and Pd 3d (c) of supported Pd catalysts. Fig. 4 Fig. 5 EPR spectra of supported Pd catalysts. Fig. 5 Fig. 6 Concentration-time curves of 4-FP during HDF over supported Pd catalysts (a), and the corresponding TOF values (b). Reaction conditions: temperature (25 °C), catalyst dosage (0.5 g/L), 4-FP concentration (0.5 mmol/L), reaction volume (40 mL). Fig. 6 Fig. 7 Concentration-time curves of 4-FP during HDF over 0.2 wt% Pd/La2O3 (a), 1 wt% Pd/La2O3 (b) and 5 wt% Pd/La2O3 (c), and the corresponding k values (d). Experimental (symbols) and predicted (dot lines) values.Reaction conditions: temperature (25 °C), catalyst dosage (0.5 g/L), 4-FP concentration (0.5 mmol/L), reaction volume (40 mL). Fig. 7 Fig. 8 F1 s of 1 wt% Pd/La2O3 with 4-FP adsorption (a), IR spectra of La2O2CO3 before and after 4-FP adsorption in hexane solution (b-d). Fig. 8 Fig. 9 HDF mechanism of 4-FP over Pd/La2O3 catalyst. Fig. 9 Fig. 10 HDF stability of 0.2 wt% Pd/La2O3 catalyst. Reaction conditions:temperature (25 °C), catalyst dosage (0.5 g/L), 4-FP concentration (0.5 mmol/L), reaction volume (40 mL). Fig. 10 Scheme 1 Reaction pathway during HDF of 4-FP. Scheme 1 Table 1 Physical properties of Pd/SiO2 and Pd/La2O3 samples. Table 1 Sample Pd content(wt%) Specific surface area (m2 g−1) Pd dispersion(%) Pd size (nm) a Oads/(Oads+Olatt)(%) Pd/SiO2 (1 wt%) 0.97 116.60 40.1 2.7 0 Pd/La2O3 (0.2 wt%) 0.21 6.2 35.8 3.1 62.1 Pd/La2O3 (1 wt%) 0.94 5.89 28.6 4.1 58.4 Pd/La2O3 (5 wt%) 4.91 5.74 14.3 --- 38.5 a Estimated values from the corresponding TEM images. Oxygen vacancies promoted catalytic hydrodefluorination over Pd/La2O3 catalyst for the efficient degradation of fluorophenols at mild condition Linyu Li Writing – original draft Investigation Data curation Haozhen Feng Investigation Lizhi Tan Methodology Investigation Hong Lin Formal analysis Jun Xiong Writing – review & editing Project administration Funding acquisition Conceptualization ⁎ Department of Pharmaceutical Engineering, School of Pharmacy and Key Laboratory of Basic Pharmacology of Guizhou Province, Zunyi Medical University, Zunyi, Guizhou 563000, China Department of Pharmaceutical Engineering, School of Pharmacy and Key Laboratory of Basic Pharmacology of Guizhou Province, Zunyi Medical University Zunyi Guizhou 563000 China Department of Pharmaceutical Engineering, School of Pharmacy and Key Laboratory of Basic Pharmacology of Guizhou Province, Zunyi Medical University, Zunyi, Guizhou, 563000, China ⁎ Corresponding author. The efficient hydrodefluorination at mild conditions is a huge challenge during catalytic hydrodefluorination for the treatment of wastewater containing fluorophenols. The application of lanthanum oxide as the catalyst support for the Pd-catalyzed hydrodefluorination of fluorophenols was proposed. It was found that the Pd/La2O3 catalyst exhibited a much higher HDF activity than other catalysts. Further investigation of the reaction kinetic and mechanism revealed that the oxygen vacancy promoting mechanism was dominant during HDF of 4-fluorophenol over Pd/La2O3 catalyst. The 0.2 wt% Pd/La2O3 catalyst with rich oxygen vacancies has a high HDF activity, fully degrading the 4-fluorophenol within 120 min at mild condition. The calculated TOF of this catalyst (0.34293 min−1) is more than 70 times that of 1 wt% Pd/SiO2 catalyst, making it to be a promising candidate for the hydrodefluorination of fluorophenols. Graphical Abstract Keywords Catalytic hydrodefluorination Pd/La2O3 catalyst Fluorophenols Oxygen vacancies Heterogeneous catalyst Data availability Data will be made available on request. 1 Introduction The environmental pollution issues related to the halogenated phenolic compounds have attracted increasing concern, due to their acute toxicity, serious bioaccumulation potential and poor biodegradability [1–6]. Fluorophenols (FPs), as a significant class of emerging environmental pollutants are frequently found in the wastewater effluents of pharmaceutical, pesticide, dyestuff and liquid crystal [7–10]. These compounds have also been listed in persistent organic pollutants (POPs) under the Stockholm Convention [11]. The FPs exhibit strong resistance to the traditional biodegradation and oxidation degradation, because of the high stability of the C-F bond [12–14]. It is urgent to develop effective methods for the safe disposal of wastewater containing fluorophenols. Catalytic hydrodehalogenation (HDH), using supported transition metal catalysts and molecular hydrogen (H2), is considered as a highly efficient and environmentally friendly method for degrading chlorophenols and bromophenols [15–17]. This technique has also been widely proposed for the defluorination of fluoroorganic compounds including fluorophenols [17–20]. Unfortunately, the strong C-F bonds are difficult to break, resulting in low defluorinating efficiency during catalytic hydrodefluorination (HDF) [8,17,21]. Although the enhanced HDF performance can be obtained under harsh reaction conditions (e.g. high temperature, high H2 pressure and toxic organic solvent) [21,22], achieving efficient hydrodefluorination of FPs at mild conditions remains a huge challenge. The catalyst is the key factor in determining the catalytic performance during HDH [15,23]. So far, the HDF activity of conventional supported transition metal catalysts (e.g. Pd/SiO2, Pd/C and Rh/SiO2) in the aqueous phase has been poor, especially at mild condition [17,21,22]. Further development of new catalysts with high HDF activity is required for the efficient degradation of FPs. The HDH performance is greatly influenced by the support properties of catalyst [24,25]. It is vital to achieve a high HDF performance, by employing a suitable catalyst support. Lanthanum oxide (La2O3) is well known as the catalyst support and catalytic promoter in heterogeneous catalysis, due to its unique chemical properties and strong interaction with active metal [15,26–28]. The relatively rich oxygen vacancies in this material may be crucial for many heterogeneous catalytic reactions [29,30]. More importantly, the presence of La in catalyst has been proved to be effective in enhancing the HDH activity of supported Pd and Rh catalysts [15,31]. Therefore, the application of lanthanum oxide as the catalyst support may be interesting for accelerating the HDF of FPs. In this work, we developed a series of Pd catalysts for the efficient degradation of FPs through HDF, utilizing La2O3 as the catalyst support. It was found that the La2O3 could serve as an excellent support for Pd-catalyzed HDF of FPs at mild conditions. The Pd/La2O3 catalyst exhibited significantly higher HDF activity, compared to the Pd/SiO2, Pd/Al2O3 and Pd/carbon nanotubes (Pd/CNTs) catalysts. The high HDF efficiency of Pd/La2O3 catalyst is closely related to the oxygen vacancies. Kinetics and mechanism studies were carried out to further investigate the oxygen vacancy promoting effect on the HDF of FPs over Pd/La2O3 catalyst. Finally, the HDF performances over Pd/La2O3 catalyst were optimized. 2 Experimental 2.1 Materials Palladium chloride (PdCl2, Sinopharm Chemical Reagent Co., Ltd), 4-Fluorophenol (4-FP, Sinopharm Chemical Reagent Co., Ltd) and other chemicals were used without further purification. The lanthanum oxide (La2O3), silicon oxide (SiO2) and aluminum oxide (Al2O3) were purchased from Xfnano Co., Ltd. The graphite multi-wall carbon nanotubes (MCNTs) were provided by Chengdu Organic Chemicals Co. Ltd. 2.2 Catalyst preparation All the supported Pd catalysts were prepared using the incipient wetness impregnation method. In the typical preparation of Pd/La2O3 catalyst, 100 mg La2O3 was added to 2 mL PdCl2 acidic solution containing a given amount of Pd. The slurry mixture was subjected to 30 mins ultrasonic treatment, then placed into a water-bathing constant temperature vibrator at 90 °C, and dried under a shaking speed of 100 rpm. Subsequently, the dried powder sample was calcined in air at 300 °C for 2 h and reduced by hydrogen gas (30 mL/min) at 450 °C for 1 h. The Pd/SiO2, Pd/Al2O3 and Pd/CNTs catalysts were also prepared, according to the similar preparation process. 2.3 Catalyst characterization X-ray diffraction (XRD) patterns were obtained using a SmartLab SE X-ray diffraction meter equipped with a Cu Ka radiation source. Transmission electron microscopy (TEM), High resolution transmission electron microscopy (HRTEM), High-angle annular dark field scanning transmission electron microscopy (HAADF-STEM) and Element mapping images were acquired by the JEOL-2100 F electron microscope. X-ray photoelectron spectroscopy (XPS) was recorded using a Thermo Scientific K-Alpha photoelectron spectrometer. XPS binding energies were calibrated by setting the C 1 s peak from adventitious carbon to 284.8 eV. Electron paramagnetic resonance (EPR) spectra were conducted at 100 K in liquid nitrogen on a Bruker EMXplus spectrometer. Pd contents in catalyst samples were measured by the inductively coupled plasma-optical emission spectrophotometer (ICP-OES) performed on an Agilent 5110 spectrometer. Infrared (IR) spectra between 400 and 4000 cm−1 were recorded on a Thermo Scientific Nicolet iS20 infrared spectrometer. Nitrogen adsorption-desorption isotherms were determined at −196 °C on the ASAP 2020 volumetric adsorption analyzers manufactured by Micromeritics. The specific surface area (SSA) of each sample was obtained by the Brunauer-Emmett-Teller (BET) method. The Pd dispersion (D) of catalyst was determined, based on the pulsed CO chemisorption result performed on a Micromeritics AutoChem II 2920. The Pd dispersion was calculated as follows: D ( % ) = S f × M A × V a d m × W × V m × 100 Where S f =stoichiometry factor (1); M A =the atomic mass of Pd (106.42 g/mol); V ad =the volume of chemisorbed CO at standard temperature and pressure conditions (mL); V m =the molar volume of CO (22.414 L/mol) at standard temperature and pressure conditions; m=the mass of the sample (g); W=the weight fraction of Pd in the sample determined by ICP-OES. 2.4 Catalytic performance testing The HDF activities of various Pd catalysts at mild conditions (25 °C and ambient pressure) were evaluated in a glass batch reactor with an inner diameter of 15 mm, using 4-FP as the model substrate. Initially, 20 mg catalyst was added to 38 mL water at 25 °C with a stirring speed of 1500 rpm. The H2 gas (0.3 MPa, 10 mL/min) was then continuously fed from the bottom of reactor. Prior to the addition of 2 mL aqueous 4-FP solution (10 mmol/L), the Pd catalyst was pre-saturated with hydrogen for 30 min. During the HDF process, the liquid mixture were sampled and analyzed by the high-performance liquid chromatography (HPLC) with an UV detector at 280 nm and a Kromstar C18 column. The mobile phase, consisting of 30 % methanol and 70 % water (v:v), flows at a rate of 1.0 mL/min. For a better comparison of HDF activities over different Pd catalysts, the turnover frequency (TOF) was calculated according to the following formulae [32,33]: T O F ( min − 1 ) = r 0 × M A × 10 − 3 D × 100 Where r 0 , D and M A are the initial HDF rate (mmol/min gmetal), Pd dispersion (%) and the atomic mass of Pd (106.42 g/mol), respectively. In the reusability evaluation, the used 0.2 wt% Pd/La2O3 catalyst was filtrated and washed with the deionized water, then dried at 40 °C under vacuum for the next run. 3 Results and discussion 3.1 Catalyst characterization Table 1 summarizes the physical properties of Pd/SiO2 and Pd/La2O3 catalysts. It was found that the Pd contents in all the catalysts were well consistent with the calculated values. The specific surface area of Pd/SiO2 sample (116.60 m2/g) is about 20 times of those of Pd/La2O3 catalysts, because of the high specific surface area property of SiO2 support. The higher Pd dispersion and smaller Pd particle size were also presented by the Pd/SiO2 catalyst. For the Pd/La2O3 catalysts, the Pd dispersion is influenced significantly by the Pd content in catalyst. The Pd dispersion of Pd/La2O3 catalyst decreases from 35.8 % to 14.3 % by increasing the Pd content from 0.2 to 5 wt%. Fig. 1 shows the XRD patterns of Pd/SiO2 and Pd/La2O3 catalysts. The diffraction peak of 40.1°, corresponding to the (111) plane of Pd, were observed in all XRD patterns, indicating the presence of metallic Pd in these catalysts [34,35]. In the XRD pattern of 0.2 wt% Pd/La2O3 catalyst, the peaks of La2O3 phase disappeared and the strong characteristic diffraction peaks corresponding to the hexagonal phase of La2O2CO3 were clearly observed (PDF:37–0804) [36]. The crystalline phase transfer from La2O3 to La2O2CO3 can be attributed to the reaction between La2O3 and CO2 in air during catalyst preparation [26,37,38]. The La2O3 is prone to strongly interact with the noble metals such as Pd, Rh and Pt [15,31,39]. The strong metal-support interaction (SMSI) in Pd/La2O3 catalysts may even results in the generation of lanthanum-palladium oxide (La2O3·xPdO) phase [31,40]. That is why the diffraction peaks of La2O3·xPdO phase were presented in the XRD pattern of 1 wt% Pd/La2O3 catalyst. In the case of 5 wt% Pd/La2O3 catalyst with a high Pd content, the La2O2CO3 phase vanished and was replaced by the La2O3·xPdO phase. These results suggested that the SMSI between Pd and La2O3 hindered the reaction of CO2 and La2O3, suppressing the formation of La2O2CO3 in the Pd/La2O3 catalyst with a high Pd loading. The suppression of high Pd content on the formation of La2O2CO3 in Pd/La2O3 catalyst was also found during the H2-TPR characterization ( Fig. 2). In the H2-TPR profile of 0.2 wt% Pd/La2O3 catalyst, a strong reduction peak at the high temperature of 750 °C, attributing to the hydrogen consumption of CO2 produced by the decomposition of La2O2CO3, was observed [30,41]. This reduction peak intensity decreased significantly with the increasing of Pd content, and vanished in the H2-TPR profile of 5 wt% Pd/La2O3 catalyst. The above H2-TPR analysis revealed that the formation of La2O2CO3 in Pd/La2O3 catalyst could be greatly hindered by enhancing the Pd content. Simultaneously, the active Pd-support interactions of Pd/SiO2 and Pd/La2O3 catalysts were investigated. Only a weak Pd2+ reduction peak centered around 150 °C was presented by the Pd/SiO2 catalyst, indicating a weak interaction between Pd and SiO2 support [2,42]. However, a strong Pd-support interaction occurs in Pd/La2O3 catalysts. For 0.2 wt% Pd/La2O3 catalyst, there are two other Pd2+ reduction peaks at higher temperatures of about 380 °C and 470 °C, in addition to the Pd2+ reduction peak at low temperature of about 150 °C. The former is associated with the reduction of Pd2+ species that strongly interact with support, while the latter can be assigned to the reduction of stable La2O3·xPdO phase [2,31]. The Pd2+ reduction peaks at higher temperature intensifies significantly, as the Pd content changes from 0.2 to 5 wt%, suggesting that the interaction between active Pd and support in Pd/La2O3 catalyst is greatly strengthened by enhancing the Pd content. Fig. 3a shows the TEM image of 0.2 wt% Pd/La2O3 catalyst. The nearly spherical nanoparticles, with a mean particle size of about 3.1 nm (Table 1), were clearly observed on support (La2O2CO3). HRTEM characterization revealed that the observed nanoparticles in this catalyst were crystalline Pd nanoparticles, which was consistent with the XRD analysis. The 0.2 wt% Pd/La2O3 catalyst sample was further characterized by the HAADF-STEM and element mapping. The presence of Pd, La, O and C elements in catalyst was established, and the active Pd element was highly dispersed (Fig. 3e-i). The similar morphology and Pd nanoparticles size were also presented by 1 wt% Pd/La2O3 catalyst (Fig. 3b). For the 5 wt% Pd/La2O3 catalyst, the formation of La2O2CO3 during catalyst preparation was almost entirely hindered by the generation of homogeneous La2O3·xPdO phase (Figs. 1 and 2). As expected, the typical morphology and structure of La2O2CO3 and Pd nanoparticles disappeared in Fig. 3c. In addition to Pd/La2O3 catalysts, 1 wt% Pd/SiO2 catalyst was characterized by TEM. As shown in Fig. 3d, the active Pd nanoparticles were finely dispersed on the SiO2 support with high specific surface area. XPS has been performed to characterize the Pd/SiO2 and Pd/La2O3 catalysts. There is no other carbon specie found in the C1s spectrum of Pd/SiO2, in addition to the reference adventitious carbon ( Fig. 4a). However, two other carbon group peaks, located at 288.8 and 289.6 eV, were observed in the C1s spectra of Pd/La2O3 catalysts. The peak at 289.6 eV is assigned to the CO3 2- specie of La2O2CO3, while the peak at 288.8 eV may be related to the C-O or O-CO species [36,43]. The CO3 2- specie in the C1s spectra of Pd/La2O3 catalysts originates from the La2O2CO3. As expected, the peak intensity of CO3 2- group decreased obviously with the increasing of Pd content, and almost disappeared in the C1s spectrum of 5 wt% Pd/La2O3 catalyst. The same change trend was also presented by the O group peak of CO3 2- in the O1s spectra of Pd/La2O3 catalysts (Fig. 4b). The recorded O 1 s spectra of Pd/La2O3 catalysts were well split into four group peaks at about 529.1, 531.1, 531.7 and 532.3 eV, which can be assigned to the lattice oxygen species (Olatt), the chemically adsorbed oxygen species (Oads), the oxygen species of CO3 2- and the physically adsorbed oxygen species (e.g. H2O), respectively [30,36,44–46]. Only one characteristic band of lattice oxygen species in SiO2 was found at about 533.0 eV in the O1s spectrum of Pd/SiO2 catalyst [47]. It was worth noting that the peak intensities corresponding to the Oads in these four catalysts were significantly different. The observed Oads peak intensity followed the order: 0.2 wt% Pd/La2O3> 1 wt% Pd/La2O3> 5 wt% Pd/La2O3> 1 wt% Pd/SiO2. Simultaneously, the ratios of Oads/(Oads+Olatt) in these four catalysts were calculated, and the results are shown in Table 1. It was found that the calculated Oads/(Oads+Olatt) values of Pd/La2O3 catalysts (38.5–62.1 %) were much higher than Pd/SiO2 catalyst. The Oads species are generally related to the chemically adsorbed oxygen on the oxygen vacancies in catalyst sample [29]. Thus, it can be inferred that there are more oxygen vacancies in Pd/La2O3 catalyst, compared to Pd/SiO2 catalyst. The Pd valence states in Pd/SiO2 and Pd/La2O3 catalysts were investigated. As shown in Fig. 4c, all the Pd 3d spectra of these samples can be well fitted to two group peaks. The peaks at the binding energies of 335.4 and 340.8 eV are indexed as the metallic Pd 3d5/2 and Pd 3d3/2, while the other two peaks are assigned to the Pd2+ specie [2]. Both the metallic Pd (Pd0) and oxidized Pd (Pd2+) exist in Pd/SiO2 and Pd/La2O3 catalysts. The active Pd mainly exists as the metallic Pd in 0.2 wt% Pd/La2O3, 1 wt% Pd/La2O3 and 1 wt% Pd/SiO2 catalysts. In contrast, the main Pd2+ specie was obtained in 5 wt% Pd/La2O3, due to the presence of large numbers of La2O3·xPdO phase. Fig. S2 shows the La 3d spectra of Pd/La2O3 catalysts. The typical doublet peaks of La3+ were found in all the spectra of Pd/La2O3 catalysts. The SMSI between Pd and La2O3 may induce the electron transfer from Pd to La [15]. Thus, the observed La 3d binding energy of 5 wt% Pd/La2O3 was slight lower than those of other two catalysts, because the strongest SMSI effect in this catalyst. EPR characterization is widely employed to determine the existence of oxygen vacancies in samples [48,49]. To further confirm the existence of oxygen vacancies in Pd/La2O3 catalysts, the EPR spectra were recorded ( Fig. 5). The EPR signal at the g-value of about 2.003, corresponding to the electron trapping on oxygen vacancies, was barely visible for 1 wt% Pd/SiO2 catalyst, indicating that the oxygen vacancies in this sample is negligible [48,50]. In comparison, the obvious signal peaks were observed in the EPR spectra of Pd/La2O3 catalysts. It was found that the EPR signal significantly weakened with the increase of Pd content in Pd/La2O3 catalysts. The oxygen vacancy concentration of Pd/La2O3 catalysts with lower Pd content is expected to higher than that of Pd/La2O3 catalysts with higher Pd content, because of the proportional relationship between the concentration of oxygen vacancy and the peak intensity of EPR signal [50]. This conclusion was supported by the above XPS analysis (Fig. 4b). 3.2 HDF of 4-FP over supported Pd catalyst HDF of 4-FP over 1 wt% Pd catalysts with different support were investigated at mild conditions, and the results are shown in Fig. 6a and S1. It was found that the 4-FP was degraded very slowly by 1 wt% Pd/SiO2 catalyst. The defluorination of 4-FP within 120 min reaction time was less than 20 %, suggesting a low HDF activity of Pd/SiO2 catalyst at mild conditions. The poor HDF abilities were also presented by the 1 wt% Pd/Al2O3 and Pd/CNTs catalysts. Surprisingly, the Pd/La2O3 catalyst with the same Pd content of 1 wt% showed a high HDF activity. The 4-FP can be degraded completely during 120 min at mild conditions. The TOF values of Pd/SiO2 and Pd/La2O3 catalysts were calculated. As shown in Fig. 6b, the calculated TOF value of 1 wt% Pd/SiO2 catalyst was very low (0.00485 min−1). In comparison, the TOF of 1 wt% Pd/La2O3 catalyst reached a high value of 0.08058 min−1, which is about 16 times of that of 1 wt% Pd/SiO2 catalyst. In order to explore the key factor which is responsible for the high HDF activity of Pd/La2O3 catalyst, the main physical and chemical properties of Pd/SiO2 and Pd/La2O3 catalysts with the same Pd content of 1 wt% were carefully compared. The 1 wt% Pd/SiO2 catalyst has higher specific surface area, higher Pd dispersion and smaller Pd particle size than 1 wt% Pd/La2O3 catalyst (Table 1). These properties are beneficial to the catalytic hydrodehalogenation process. The active Pd valence state of 1 wt% Pd/SiO2 catalyst is also similar to that of 1 wt% Pd/La2O3 catalyst (Fig. 4c). However, the observed HDF efficiency of 1 wt% Pd/SiO2 catalyst was far lower than 1 wt% Pd/La2O3 catalyst. There must be some other dominant factors resulting in the high HDF efficiency of 1 wt% Pd/La2O3 catalyst at mild conditions. XPS and EPR results confirmed a great concentration difference of oxygen vacancy in these two catalysts (Figs. 4b and 5). There are abundant oxygen vacancies in 1 wt% Pd/La2O3 catalyst, and the oxygen vacancies in 1 wt% Pd/SiO2 catalyst are negligible. It was well known that the oxygen vacancies in catalyst played an important promoting role in oxidation processes (e.g. photocatalytic oxidation) [29,50,51]. The oxygen atom can be facilely activated by the localized electrons at the surface oxygen vacancies [29]. Recently, a possible promoting effect of oxygen vacancies has also been reported during catalytic hydrodechlorination (HDC) of chlorophenols [52]. For the Pd/La2O3 catalyst, the oxygen vacancies (v o) are mainly generated from the interaction between the adsorbed CO2 and the lattice oxygen (Olatt) of La2O3 (Eq. (1)), accompanied by the formation of La2O2CO3 [53]. This process is hindered by the SMSI effect which depends on the Pd content in Pd/La2O3 catalyst. (1) C O 2 + O l a t t → C O 3 + v o Therefore, the oxygen vacancy concentration in Pd/La2O3 catalyst can be easily adjusted by changing the Pd loading. To confirm the relationship between the oxygen vacancies and HDF activity, the HDF performances of Pd/La2O3 catalysts with various Pd content were evaluated. As shown in Fig. 6a and b, both the defluorination of 4-FP and the calculated TOF value followed the order: 0.2 wt% Pd/La2O3 > 1 wt% Pd/La2O3> 5 wt% Pd/La2O3, which is consistent with the change trend of oxygen vacancies in these catalysts (Table 1 and Fig. 5). These results demonstrated that the HDF activity was positively correlated with the concentration of oxygen vacancies in catalyst. The same positive correlation was also observed, even considering the Pd/SiO2 catalyst. It can be concluded that the HDF activity was mainly determined by the oxygen vacancies in catalyst. The catalyst with rich oxygen vacancies exhibited a much higher HDF activity than the catalyst with poor oxygen vacancies. For the 0.2 wt% Pd/La2O3 with rich oxygen vacancies, the estimated TOF value (0.34293 min−1) is more than 70 times that of 1 wt% Pd/SiO2 catalyst. 3.3 Kinetic study In the HDH process, the halophenol is generally dehalogenated to phenol and then further hydrogenated to cyclohexanone and cyclohexanol [15]. Phenol is widely reported as the main product during Pd-catalyzed hydrodehalogenation, due to the relative low phenol hydrogenation ability of Pd [15,31]. Interestingly, the phenol produced during HDF of 4-FP is trace for 1 wt% and 5 wt% Pd/La2O3 catalysts, and even undetected for 0.2 wt% Pd/La2O3 catalyst ( Fig. 7a-c). The cyclohexanone, with an extremely high selectivity (>95 %), is the dominant product during HDF of 4-FP over Pd/La2O3 catalyst. Based on the above experimental results, we postulate that there maybe two pathways during HDF of 4-FP over Pd/La2O3 catalyst ( Scheme 1). The first route (denoted as Route I) is that the 4-FP is hydrodefluorinated to phenol and then hydrogenated to cyclohexanone. Another route (denoted as Route II) is the direct hydrodefluorination of 4-FP to form cyclohexanone. The kinetic study during HDF of 4-FP over Pd/La2O3 catalyst was conducted, relying on the reaction pathway outlined in Scheme 1. The catalytic hydrodehalogenation reaction well follows the pseudo-first-order kinetics [2,15,23]. Therefore, the HDF kinetic equations in this work are expressed as follows: (2) d C 4 − F P d t = − ( k 1 + k 2 ) C 4 − F P (3) d C p h e n o l d t = k 2 C 4 − F P − k 3 C p h e n o l (4) d C c y c l o h e x a n o n e d t = k 1 C 4 − F P + k 3 C p h e n o l Integrating the Eqs. (2)–(4) with the initial values, the rate constants could be calculated as follows: (5) C 4 − F P = C 4 − F P 0 exp ( − ( k 1 + k 2 ) t ) (6) C p h e n o l = k 2 C 4 − F P 0 k 3 − k 1 − k 2 ( exp ( − ( k 1 + k 2 ) t ) − exp ( − k 3 t ) ) (7) C c y c l o h e x a n o n e = k 2 k 3 C 4 − F P 0 k 3 − k 1 − k 2 ( − 1 k 1 + k 2 ( exp ( − ( k 1 + k 2 ) t ) − 1 ) + 1 k 3 ( exp ( − k 3 t ) − 1 ) ) − k 1 C 4 − F P 0 k 1 + k 2 ( exp ( − ( k 1 + k 2 ) t ) − 1 ) These equations were employed to fit the experimental data. A satisfactory agreement was obtained between the experimental and predicted concentration-time curves (Fig. 7a-c). The calculated kinetic constant values for each experiment are summarized in Table S1. All the estimated k1 values are far higher than the k2 values, revealing that the Route II is dominant during HDF of 4-FP over Pd/La2O3 catalyst. The calculated k1 value decreased with the increase of Pd content (Fig. 7d), which is well consistent with the change of oxygen vacancies in catalyst. However, the k2 value seemed to be independent to the oxygen vacancies and positively correlated with the Pd content. A higher k2 value was obtained for the catalyst with more active Pd. Therefore, the oxygen vacancies in Pd/La2O3 catalyst promote the HDF of 4-FP by accelerating the direct hydrodefluorination of 4-FP to form cyclohexanone (Route II). 3.4 HDF mechanism of 4-FP over Pd/La2O3 catalyst The hydrodehalogenation mechanism study of halophenols in literature focuses on the hydrodechlorination of chlorophenols. The mechanism, involving the direct oxidative addition of chlorophenols on the active metal (e.g. Pd) and reductive elimination with the adsorbed atomic hydrogen (Hads), was widely reported [52,54]. Its rate is determined by the number of active metal site, and the phenol is the main intermediate product or final product. This reaction mechanism should occur during HDF of 4-FP over Pd/La2O3 catalyst. In the F1s spectrum of Pd/La2O3 catalyst impregnated with 4-FP, the obviously binding energy located at about 685.5 eV, which can be indexed as Pd-bound F species, was observed ( Fig. 8a) [55,56]. The presence of Pd-bound F species in the Pd/La2O3 catalyst after 4-FP adsorption strongly suggested the occurrence of oxidative addition of 4-FP on the active Pd. The direct oxidative addition of 4-FP on the active Pd is expected to be the slow rate-limiting step in this mechanism, because of the high stability of C-F bond. By considering the intermediate product, the observed reaction rate, and the relationship between the reaction rate and the number of active Pd sites, there is a well consistency between the above reaction mechanism and the kinetic behavior of Route I. Recently, an F spillover mechanism also involving the oxidative addition of 4-FP on the Pd surface and the spillover of F onto the support (CeO2) was reported during HDF over Pd/CeO2 catalyst [57,58]. The spillover of F onto the CeO2 support is expected to result in the formation of CeFx species in catalyst. For the Pd/La2O3 catalyst impregnated with 4-FP, no peaks corresponding to LaFx phase were found in the XRD and La 3d spectrum (Fig. S3). Thus, the F spillover mechanism may not occur during HDF of FPs over Pd/La2O3 catalyst. The phenolic compounds may undergo the dissociative adsorption on the surface of metal oxide support (e.g. CeO2), generally accompanied by the color change of support [52,59]. An obvious color change was observed for the La2O2CO3 with the adsorption of 4-FP (Fig. S4). The La2O2CO3 before and after 4-FP adsorption in hexane solution were characterized by IR. As shown in Fig. 8b, three new bands, located at 1228, 1280 and 3623 cm−1, were found in the IR spectrum of 4-FP absorbed on La2O2CO3. The band at 1228 cm−1 matches the vibrational frequency of the C-F bond of pure 4-FP. For pure 4-FP, the vibrational frequencies of O-H and C-O bonds were observed at 3609 and 1260 cm−1, respectively [60]. It was worth noting that these two bands shifted to higher vibrational energy in the La2O2CO3 absorbed 4-FP (Fig. 8c-d). The band at 1280 cm−1 can be attributed to the C-O stretch of phenoxy species bonded to metal lanthanum cation [52,59], which is possibly formed by the strong Lewis acid-base interaction between cationic lanthanum and anionic oxygen [15]. The band at 3623 cm−1 is well assigned to the O-H stretch of bridged-bonded OH species with metal cation [61]. These results revealed that the 4-FP underwent the dissociative adsorption on the surface of La2O2CO3, leading to the formation of La-bound phenoxy species and La-bound hydroxyl groups. Previously study confirmed that the dissociative adsorption of halophenols occurred on the oxygen vacancy sites in catalyst, which greatly improved the hydrodehalogenation process [52]. The oxygen vacancies in Pd/La2O3 catalyst seemed to be beneficial to the oxidative addition step of 4-FP on active Pd, which was supported by the XPS results. The F1s spectrum of Pd/La2O3 catalyst with 4-FP adsorption can be split into the main peak of Pd-F and relatively weak peak of C-F (Fig. 8a), indicating that most of the C-F in the La-bound phenoxy species is oxidatively added on the active Pd. The produced new La-bound phenoxy species after reductive elimination is easily hydrogenated to cyclohexanone, since the La cation with an empty p orbital activates the phenolic ring for nucleophilic attack through the Lewis acid-aromatic ring interaction [15,59]. Additionally, the La cation can induce strong Lewis acid-base interaction with the carbonyl group of cyclohexanone, impeding further hydrogenation of cyclohexanone [15,62]. Therefore, the enhanced reaction rate and main product of cyclohexanone were obtained for the HDF mechanism involving the dissociative adsorption activation of 4-FP over Pd/La2O3 catalyst. This mechanism corresponds well to the kinetic behavior of Route II in which the 4-FP was directly hydrodefluorinated to cyclohexanone. As expected, the reaction rate (k1) of oxygen vacancy promoting mechanism presents a positive correlation with oxygen vacancies in catalyst. Based on the characterization results and kinetic study, it can be concluded that the 4-FP undergoes two different HDF mechanisms on the surface of Pd/La2O3 catalyst ( Fig. 9). In the mechanism not involving the dissociative adsorption activation of 4-FP (Route I), the 4-FP is directly oxidatively added on the active Pd, then reductively eliminated to form phenol by the adsorbed atomic hydrogen. The intermediate product phenol would be further hydrogenated to cyclohexanone. In the dominant oxygen vacancy promoting mechanism (Route II), the 4-FP is firstly activated on the oxygen vacancies in Pd/La2O3 catalyst through dissociative adsorption. The formed La-bound phenoxy species then undergo the oxidative addition, reductive elimination and are finally hydrogenated to cyclohexanone. 3.5 HDF optimization Pd is the active component during HDF, which is responsible for H2 activation and participates in oxidative addition-reductive elimination cycle of fluorophenols [15,52,54]. In the case of the sample without active Pd loading, the observed defluorination of 4-FP is negligible (Fig. S5). The HDF efficiency was enhanced remarkably after Pd loading. All the Pd/La2O3 catalysts exhibited much higher 4-FP defluorination than the pure support. It was clear that the HDF efficiency of Pd/La2O3 catalyst was greatly influenced by the Pd content in catalyst. The defluorination of 4-FP over Pd/La2O3 catalyst increased significantly with the increasing of Pd content from 0.1 to 0.2 wt%. However, the generation of oxygen vacancies is hindered by the SMSI effect in the Pd/La2O3 catalyst. The Pd/La2O3 catalyst with higher Pd content has fewer oxygen vacancies than that with lower Pd content. Therefore, further increasing Pd content in catalyst (> 0.2 wt%) would result in the decline of HDF efficiency, because the oxygen vacancy promoting reaction mechanism is dominant during HDF of 4-FP over Pd/La2O3 catalyst. Among all the prepared Pd/La2O3 catalysts, the 0.2 wt% Pd/La2O3 catalyst is the most promising choice for achieving high HDF efficiency. The influence of 4-FP concentration on the HDF performance over 0.2 wt% Pd/La2O3 catalyst was investigated. As shown in Table S2, the defluorination of 4-FP was improved dramatically by decreasing the initial 4-FP concentration. The 4-FP defluorination was only 23.3 % at the initial 4-FP concentration of 5 mmol/L. However, the complete defluorination of 4-FP can be obtained during 120 min, as the initial 4-FP concentration is lower than 0.5 mmol/L. The HDF efficiency is also affected by the catalyst dosage. As expected, the defluorination of 4-FP increased with the increasing of catalyst dosage. To achieve the complete defluorination of 4-FP during HDF over Pd/La2O3 catalyst, the conditions of 0.5 mmol/L 4-FP and 0.5 g/L catalyst dosage is recommended. Finally, three successive tests were carried out at the recommended reaction conditions for the catalytic stability evaluation. As shown in Fig. 10, a good HDF stability was presented by the Pd/La2O3 catalyst (0.2 wt%). The observed 4-FP defluorination was still a high value of about 93 % in the third run. The used Pd/La2O3 catalyst was also characterized by TEM and element mapping. No obvious structural change was found, by comparing the morphology, active Pd particle size and composition of fresh and used Pd/La2O3 catalyst (Fig. 3 and S6). These results indicate that the Pd/La2O3 catalyst is structurally stable during HDF. The slight decline of HDF efficiency during the recycling process may be attributed to the inevitable loss of catalyst in catalyst separation operation. 4 Conclusions A series of Pd/La2O3 catalysts were developed for the efficient hydrodefluorination of FPs at mild conditions, using La2O3 as the catalyst support. During the catalyst preparation, the La2O3 reacts with the CO2 in air, leading to the formation of La2O2CO3 and generation of oxygen vacancies. This reaction between La2O3 and CO2 is greatly hindered by the SMSI effect which depends on the Pd content in Pd/La2O3 catalyst. The Pd/La2O3 catalyst with a higher Pd content has fewer oxygen vacancies than that with lower Pd content. The HDF performance of fluorophenols (4-FP) was investigated in a batch reactor system. In comparison with other supported Pd catalysts (Pd/SiO2, Pd/Al2O3 and Pd/CNTs), the Pd/La2O3 catalyst with the same Pd content of 1 wt% exhibited significantly higher HDF activity. It was found that the HDF efficiency of Pd/La2O3 catalyst was mainly determined by the oxygen vacancies in catalyst. The 0.2 wt% Pd/La2O3 catalyst with rich oxygen vacancies has the highest HDF activity. The calculated TOF of this catalyst during HDF reaches to a extremely high value of 0.34293 min−1, which is more than 70 times of that of 1 wt% Pd/SiO2 catalyst. For achieving complete defluorination of 4-FP during HDF over 0.2 wt% Pd/La2O3 catalyst, the conditions of 0.5 mmol/L 4-FP and 0.5 g/L catalyst dosage are recommended. Kinetic and mechanism studies revealed that the 4-FP underwent two different HDF mechanisms on the surface of Pd/La2O3 catalyst. The mechanism, not involving the dissociative adsorption activation of 4-FP, proceeds very slowly. In contrast, the dominant oxygen vacancy promoting mechanism shows a far higher reaction rate. In the oxygen vacancy promoting mechanism, the 4-FP is dissociatively absorbed on the oxygen vacancies in the Pd/La2O3 catalyst, followed by the oxidative addition, reductive elimination and hydrogenation to form cyclohexanone. CRediT authorship contribution statement Hong Lin: Formal analysis. Jun Xiong: Writing – review & editing, Project administration, Funding acquisition, Conceptualization. Linyu Li: Writing – original draft, Investigation, Data curation. Haozhen Feng: Investigation. Lizhi Tan: Methodology, Investigation. Declaration of Competing Interest The authors declare that they have no known competing financial interests or personal relationships that could have appeared to influence the work reported in this paper. Acknowledgments This work was supported by the Guizhou Province Department of Science and Technology of China [grant numbers QKHJC-ZK2022-YB613]. Appendix A Supporting information Supplementary data associated with this article can be found in the online version at doi:10.1016/j.apcata.2024.119856. Appendix A Supplementary material Supplementary material References [1] A. Harkey S. Kandagatla H. Kim G.M. Raner Biotechnol. Lett. 34 2012 1725 1731 10.1007/s10529-012-0957-9 A. Harkey, S. Kandagatla, H. Kim, G.M. Raner, Biotechnol. Lett. 34 (2012) 1725-1731. https://doi.org/10.1007/s10529-012-0957-9 [2] R. Cheng L. Li L. Tan H. Feng G. Xiang J. Xiong New J. Chem. 47 2023 13218 10.1039/d3nj01468a R. Cheng, L. Li, L. Tan, H. Feng, G. Xiang, J. Xiong, New J. Chem. 47 (2023) 13218. https://doi.org/10.1039/d3nj01468a [3] X. Wang P. Wang Q. Wang P. Xu C. Yang Y. Xin G. Zhang Chem. Eng. J. 420 2021 127577 10.1016/j.cej.2020.127577 X. Wang, P. Wang, Q.Wang, P. Xu, C. Yang, Y. Xin, G. Zhang, Chem. Eng. J. 420 (2021), 127577. https://doi.org/10.1016/j.cej.2020.127577 [4] Q. Wang L. Zhou Q. Chen M. Mao W. Jiang Y. Long G. Fan J. Hazard. Mater. 408 2021 124456 10.1016/j.jhazmat.2020.124456 Q. Wang, L. Zhou, Q. Chen, M. Mao, W. Jiang, Y. Long, G. Fan, J. Hazard. Mater. 408 (2021) 124456. https://doi.org/10.1016/j.jhazmat.2020.124456 [5] C. Xia Y. Liu S. Zhou C. Yang S. Liu J. Xu J. Yu J. Chen X. Liang J. Hazard. Mater. 169 2009 1029 1033 10.1016/j.jhazmat.2009.04.043 C. Xia, Y. Liu, S. Zhou, C.Yang, S. Liu, J. Xu, J. Yu, J. Chen, X. Liang, J. Hazard. Mater. 169 (2009) 1029-1033. https://doi.org/10.1016/j.jhazmat.2009.04.043 [6] X. Ma S. Liu Y. Liu X. Li Q. Li G. Gu C. Xia Chemosphere 242 2020 12520 10.1016/j.chemosphere.2019.125202 X. Ma, S. Liu, Y. Liu, X. Li, Q. Li, G. Gu, C. Xia, Chemosphere 242 (2020) 12520. https://doi.org/10.1016/j.chemosphere.2019.125202 [7] Z. Zeng K. Li K. Wei Y. Dai L. Yan H. Guo X. Luo Chin. J. Catal. 38 2017 29 38 10.1016/S1872-2067(16)62589-5 Z. Zeng, K. Li, K. Wei, Y. Dai, L. Yan, H. Guo, X. Luo, Chinese J. Catal. 38 (2017) 29-38. https://doi.org/10.1016/S1872-2067(16)62589-5 [8] Y. Xu T. Ge H. Ma X. Ding X. Zhang Q. Liu Electrochim. Acta 270 2018 110 119 10.1016/j.electacta.2018.03.018 Y. Xu, T. Ge, H. Ma, X. Ding, X. Zhang, Q. Liu, Electrochim. Acta 270(2018) 110-119. https://doi.org/10.1016/j.electacta.2018.03.018 [9] X. Wang P. Xu C. Yang T. Shen J. Qu P. Wang G. Zhang J. Hazard. Mater. 414 2021 125602 10.1016/j.jhazmat.2021.125602 X. Wang, P. Xu, C. Yang, T. Shen, J. Qu, P. Wang, G. Zhang, J. Hazard. Mater. 414 (2021) 125602. https://doi.org/10.1016/j.jhazmat.2021.125602 [10] A. Rivera J. Sadat-Bernal J. Rios-Motta M. Bolte Crystals 10 2019 520 10.3390/cryst9100520 A. Rivera, J. Sadat-Bernal, J. Rios-Motta, M. Bolte, Crystals 10 (2019) 520. https://doi.org/10.3390/cryst9100520 [11] H. Li X. Gong T. Li S. Liu Y. Liu X. Ma Q. Li C. Xia Chem. Eng. J. 475 2023 146231 10.1016/j.cej.2023.146231 H. Li, X. Gong, T. Li, S. Liu, Y. Liu, X. Ma, Q. Li, C. Xia, Chem. Eng. J. 475 (2023) 146231. https://doi.org/10.1016/j.cej.2023.146231 [12] X. Liu W. Wei J. Xu D. Wang L. Song B.J. Ni Water Res. 186 2020 116311 10.1016/j.watres.2020.116311 X. Liu, W. Wei, J. Xu, D. Wang, L. Song, B.J. Ni, Water Res. 186 (2020) 116311. https://doi.org/10.1016/j.watres.2020.116311 [13] Y. Xu H. Ma T. Ge Y. Chu C.A. Ma Electrochem. Commun. 66 2016 16 20 10.1016/j.elecom.2016.02.012 Y. Xu, H. Ma, T. Ge, Y. Chu, C.A. Ma, Electrochem. Commun. 66 (2016) 16-20. https://doi.org/10.1016/j.elecom.2016.02.012 [14] H. Tian C. Gu Chemosphere 191 2018 280 287 https://doi.org/10.1016/j.chemosphere.2017.10.074 H. Tian, C. Gu, Chemosphere 191 (2018) 280-287, https://doi.org/10.1016/j.chemosphere.2017.10.074 [15] J. Xiong L. Tian R.J. Cheng J. Hazard. Mater. 416 2021 125913 10.1016/j.jhazmat.2021.125913 J. Xiong, L.Tian, R.J. Cheng, J. Hazard. Mater. 416 (2021) 125913. https://doi.org/10.1016/j.jhazmat.2021.125913 [16] J.G. Mahy L. Tasseroul O. Tromme B. Lavigne S.D. Lambert J. Environ. Chem. Eng. 7 2019 103014 10.1016/j.jece.2019.103014 J.G. Mahy, L. Tasseroul, O. Tromme, B. Lavigne, S.D. Lambert, J. Environ. Chem. Eng. 7 (2019) 103014. https://doi.org/10.1016/j.jece.2019.103014 [17] X. Ma S. Liu Y. Liu G. Gu C. Xia Sci. Rep. 6 2016 25068 10.1038/srep25068 X. Ma, S. Liu, Y. Liu, G., Gu, C., Xia, Sci. Rep. 6 (2016) 25068. https://doi.org/10.1038/srep25068 [18] X. Ma Y. Ma H. Su S. Liu Y. Liu Q. Li C. Xia Chem. Eng. J. 431 2022 133729 10.1016/j.cej.2021.133729 X. Ma, Y. Ma, H. Su, S. Liu, Y. Liu, Q. Li, C.Xia, Chem. Eng. J., 2022, 431, 133729. https://doi.org/10.1016/j.cej.2021.133729 [19] M.K. Whittlesey E. Peris ACS Catal. 4 2014 3152 3159 10.1021/cs500887p M.K. Whittlesey, E. Peris, ACS Catal. 4 (2014) 3152-3159. https://doi.org/10.1021/cs500887p [20] R. Baumgartner G.K. Stieger K. McNeill Environ. Sci. Technol. 47 2013 6545 6553 10.1021/es401183v R. Baumgartner, G.K. Stieger, K. McNeill, Environ. Sci. Technol. 47 (2013) 6545-6553. https://doi.org/10.1021/es401183v [21] H. Yang H. Gao R.J. Angelici Organometallics 18 1999 2085 2087 10.1021/om990151e H. Yang, H. Gao, R.J. Angelici, Organometallics 18 (1999) 2085-2087. https://doi.org/10.1021/om990151e [22] K.J. Stanger R.J. Angelici J. Mol. Catal. A Chem. 207 2004 59 68 10.1016/S1381-1169(03)00465-5 K.J. Stanger, R.J. Angelici, J. Mol. Catal. A Chem. 207 (2004) 59-68. https://doi.org/10.1016/S1381-1169(03)00465-5 [23] J. Xiong Y. Ma W. Yang L. Zhong J. Hazard. Mater. 355 2018 89 95 10.1016/j.jhazmat.2018.05.018 J. Xiong, Y. Ma, W. Yang, L. Zhong, J. Hazard. Mater. 355 (2018) 89-95. https://doi.org/ 10.1016/j.jhazmat.2018.05.018 [24] M.A. Keane ChemCatChem 3 2011 800 821 https://doi.org/10.1002/cctc. 201000432 M.A. Keane, ChemCatChem 3 (2011) 800-821. https://doi.org/10.1002/cctc. 201000432 [25] L. Lan F. Du C. Xia RSC Adv. 6 2016 109023 109029 10.1039/C6RA21213A L. Lan, F. Du, C. Xia, RSC Adv. 6 (2016) 109023-109029. https://doi.org/10.1039/C6RA21213A [26] Y. Yu Y.M. Gan C. Huang Z.H. Lu X. Wang R. Zhang G. Feng Int. J. Hydrog. Energy 45 2020 16528 16539 https://doi.org/10.1016/ j.ijhydene.2020.04.127 Y. Yu, Y.M. Gan, C. Huang, Z.H. Lu, X. Wang, R. Zhang, G. Feng, Int. J. Hydrogen Energ. 45 (2020) 16528-16539. https://doi.org/10.1016/ j.ijhydene.2020.04.127 [27] C. Huang Y. Yu J. Yang Y. Yan D. Wang F. Hu X. Wang R. Zhang G. Feng Appl. Surf. Sci. 476 2019 928 936 10.1016/j.apsusc.2019.01.112 C. Huang, Y. Yu, J. Yang, Y. Yan, D. Wang, F. Hu, X. Wang, R. Zhang, G. Feng, Appl. Surf. Sci. 476 (2019) 928-936. https://doi.org/10.1016/j.apsusc.2019.01.112 [28] W. Li S. Liu H. Wang B. Gao C. Tu Y. Luo Catal. Commun. 133 2020 105845 10.1016/j.catcom.2019.105845 W. Li, S. Liu, H. Wang, B. Gao, C. Tu, Y. Luo, Catal. Commun. 133 (2020) 105845. https://doi.org/10.1016/j.catcom.2019.105845 [29] Z. Wang W. Wang L. Zhang D. Jiang Catal. Sci. Technol. 6 2016 3845 3853 10.1039/C5CY01709B Z. Wang, W. Wang, L. Zhang, D. Jiang, Catal. Sci. Technol. 6 (2016) 3845-3853. https://doi.org/10.1039/C5CY01709B [30] Q. Wu J. Xiong Y. Zhang X. Mei Y. Wei Z. Zhao J. Liu J. Li ACS Catal. 9 2019 3700 3715 10.1021/acscatal.9b00107 Q. Wu, J. Xiong, Y. Zhang, X. Mei, Y. Wei, Z. Zhao, J. Liu, J. Li, ACS Catal. 9 (2019) 3700-3715. https://doi.org/10.1021/acscatal.9b00107 [31] L. Tian R.J. Cheng L. Li L. Tan G. Xiang J. Xiong React. Kinet. Mech. Catal. 135 2022 741 753 10.1007/s11144-022-02157-2 L. Tian, R.J. Cheng, L. Li, L. Tan, G. Xiang, J. Xiong, Reac. Kinet. Mech. Cat. 135 (2022) 741-753. https://doi.org/10.1007/s11144-022-02157-2 [32] J. Xu S. Zhang X. Liu F. Bian H. Jiang Environ. Sci. Technol. 9 2019 6938 6945 10.1039/c9cy01816f J. Xu, S. Zhang, X. Liu, F. Bian, H. Jiang, Environ. Sci. Technol. 9 (2019) 6938-6945. https://doi.org/10.1039/c9cy01816f [33] C.B. Molina A.H. Pizarro J.A. Casas J.J. Rodriguez Appl. Catal. B Environ. 148-149 2014 330 338 10.1016/j.apcatb.2013.11.010 C.B. Molina, A.H. Pizarro, J.A. Casas, J.J. Rodriguez, Appl. Catal. B Environ. 148-149 (2014) 330-338. https://doi.org/10.1016/j.apcatb.2013.11.010 [34] X. Zhang Z. Qu H. Jiang Y. Liu R. Chen Can. J. Chem. Eng. 97 2019 1506 1514 10.1002/cjce.23363 X. Zhang, Z. Qu, H. Jiang, Y. Liu, R. Chen, Can. J. Chem. Eng. 97 (2019) 1506-1514. https://doi.org/10.1002/cjce.23363 [35] M. Xiao Y. Peng M. Pang B. Hao Y. Wang Y. Zhang Y. Liao H. Mao Bull. Mater. Sci. 43 2020 215 https://doi.org/10.1007/s12034 -020-02214-3 M. Xiao, Y. Peng, M. Pang, B. Hao, Y. Wang, Y. Zhang, Y. Liao, H. Mao, Bull. Mater. Sci. 43 (2020) 215. https://doi.org/10.1007/s12034 -020-02214-3 [36] W. Gu J. Liu M. Hu F. Wang Y. Song ACS Appl. Mater. Interfaces 7 2015 26914 26922 10.1021/acsami.5b06100 W. Gu, J. Liu, M. Hu, F. Wang, Y. Song, ACS Appl. Mater. Interfaces 7 (2015) 26914-26922. https://doi.org/10.1021/acsami.5b06100 [37] Y. Pang X. Zhou E.I. Vovk C. Guan S. Li A.P. van Bavel Y. Yang Appl. Surf. Sci. 548 2021 149214 10.1016/j.apsusc.2021.149214 Y. Pang, X. Zhou, E.I. Vovk, C. Guan, S. Li, A.P. van Bavel, Y. Yang, Appl. Surf. Sci. 548 (2021) 149214, https://doi.org/10.1016/j.apsusc.2021.149214 [38] T. Levan M. Che J. Tatibouet M. Kermarec J. Catal. 142 1993 18 26 10.1006/jcat.1993.1185 T. Levan, M. Che, J. Tatibouet, M. Kermarec, J. Catal. 142 (1993) 18-26. https://doi.org/10.1006/jcat.1993.1185 [39] H. Peng J. Ying J. Zhang X. Zhang C. Peng C. Rao W. Liu N. Zhang X. Wang Chin. J. Catal. 38 2017 39 47 https://doi.org/10.1016/S1872-2067(16)62532-9 H. Peng, J. Ying, J. Zhang, X. Zhang, C. Peng, C. Rao, W. Liu, N. Zhang, X. Wang, Chinese J. Catal. 38 (2017) 39-47.https://doi.org/10.1016/S1872-2067(16)62532-9 [40] A. Barrera S. Fuentes G. Díaz A. Gómez-Cortés F. Tzompantzi J.C. Molina Fuel 93 2012 136 141 10.1016/j.fuel.2011.11.049 A. Barrera, S. Fuentes, G. Díaz, A. Gómez-Cortés, F. Tzompantzi, J.C. Molina, Fuel 93 (2012) 136-141. https://doi.org/10.1016/j.fuel.2011.11.049 [41] X. Li D. Li H. Tian L. Zeng Z. Zhao J. Gong Appl. Catal. B 202 2017 683 694 10.1016/j.apcatb.2016.09.071 X. Li, D. Li, H. Tian, L. Zeng, Z. Zhao, J. Gong, Appl. Catal. B 202 (2017) 683-694. http://dx.doi.org/10.1016/j.apcatb.2016.09.071 [42] S.K. Matam E.H. Otal M.H. Aguirre A. Winkler A. Ulrich D. Rentsch A. Weidenkaff D. Ferri Catal. Today 184 2012 237 244 10.1016/j.cattod.2011.09.030 S.K. Matam, E.H. Otal, M.H. Aguirre, A. Winkler, A. Ulrich, D. Rentsch, A. Weidenkaff, D. Ferri, Catal. Today. 184 (2012) 237-244. https://doi.org/10.1016/j.cattod.2011.09.030 [43] X. Zhang Q. Xiao Y. Zhang X. Jiang Z. Yang Y. Xue Y.M. Yan K. Sun J. Phys. Chem. C 118 2014 20229 20237 10.1021/jp506324j X. Zhang, Q. Xiao, Y. Zhang, X. Jiang, Z. Yang, Y. Xue, Y.M. Yan, K. Sun, J. Phys. Chem. C 2014, 118, 20229-20237. https://doi.org/10.1021/jp506324j [44] J. Sun Z. Zhao Y. Li X. Yu L. Zhao J. Li Y. Wei J. Liu J. Rare Earths 38 2020 584 593 10.1016/j.jre.2019.05.014 J. Sun, Z. Zhao, Y. Li, X. Yu, L. Zhao, J. Li, Y. Wei, J. Liu, J. Rare Earth. 38 (2020) 584-593. https://doi.org/10.1016/j.jre.2019.05.014 [45] J. Béjar L. Álvarez-Contreras M. Guerra-Balcázar J. Ledesma-García L.G. Arriaga N. Arjona Appl. Surf. Sci. 509 2020 144898 10.1016/j.apsusc.2019.144898 J. Béjar, L. Álvarez-Contreras, M. Guerra-Balcázar, J. Ledesma-García, L.G. Arriaga, N. Arjona, Appl. Surf. Sci. 509 (2020) 144898. https://doi.org/10.1016/j.apsusc.2019.144898 [46] M. Gu Y. Li M. Zhang X. Zhang Y. Shen Y. Liu F. Dong Nano Energy 80 2021 105415 10.1016/j.nanoen.2020.105415 M. Gu, Y. Li, M. Zhang, X. Zhang, Y. Shen, Y. Liu, F. Dong, Nano Energy, 80 (2021) 105415. https://doi.org/10.1016/j.nanoen.2020.105415 [47] S.P. Chenakin G. Melaet R. Szukiewicz N. Kruse J. Catal. 312 2014 1 11 10.1016/j.jcat.2014.01.008 S.P. Chenakin, G. Melaet, R. Szukiewicz, N. Kruse, J. Catal. 312 (2014) 1-11. http://dx.doi.org/10.1016/j.jcat.2014.01.008 [48] J.J. Li B. Weng S.C. Cai J. Chen H.P. Jia Y.J. Xu J. Hazard. Mater. 342 2018 661 669 10.1016/j.jhazmat.2017.08.077 J.J. Li, B. Weng, S.C. Cai, J. Chen, H.P. Jia, Y.J. Xu, J. Hazard. Mater. 342 (2018) 661-669. https://doi.org/10.1016/j.jhazmat.2017.08.077 [49] H. Song T.G. Jeong Y.H. Moon H.H. Chun K.Y. Chung H.S. Kim B.W. Cho Y.T. Kim Sci. Rep. 4 2014 4350 10.1038/srep04350 H. Song, T.G. Jeong, Y.H. Moon, H.H. Chun, K.Y. Chung, H.S. Kim, B.W. Cho, Y.T. Kim, Sci. Rep. 4 (2014) 4350. https://doi.org/10.1038/srep04350 [50] J.J. Li M. Zhang B. Weng X. Chen J. Chen H.P. Jia Appl. Surf. Sci. 507 2020 145133 10.1016/j.apsusc.2019.145133 J.J. Li, M. Zhang, B. Weng, X. Chen, J. Chen, H.P. Jia, Appl. Surf. Sci. 507 (2020) 145133. https://doi.org/10.1016/j.apsusc.2019.145133 [51] A. Kumar P. Raizada A.A.P. Khan V.H. Nguyen Q. Van Le A. Singh V. Saini R. Selvasembian T.T. Huynh P. Singh Sci. Total Environ. 800 2021 149410 10.1016/j.scitotenv.2021.149410 A. Kumar, P. Raizada, A.A.P. Khan, V.H. Nguyen, Q. Van Le, A. Singh, V. Saini, R. Selvasembian, T.T. Huynh, P. Singh, Sci. Total Environ. 800 (2021) 149410. https://doi.org/10.1016/j.scitotenv.2021.149410 [52] P.J. Naik Y. An S.L. Sedinkin H. Masching D. Freppon E.A. Smith V. Venditti I.I. Slowing ACS Catal. 11 2021 10553 10564 10.1021/acscatal.1c02716 P.J. Naik, Y. An, S.L. Sedinkin, H. Masching, D. Freppon, E.A. Smith, V. Venditti, I.I. Slowing, ACS Catal. 11 (2021) 10553-10564. https://doi.org/10.1021/acscatal.1c02716 [53] D. Ding W. Lu Y. Xiong X. Pan J. Zhang C. Ling Y. Du Q. Xue Appl. Surf. Sci. 426 2017 725 733 10.1016/j.apsusc.2017.07.126 D. Ding, W. Lu, Y. Xiong, X. Pan, J. Zhang, C. Ling, Y. Du, Q. Xue, Appl. Surf. Sci. 426 (2017) 725-733. https://doi.org/10.1016/j.apsusc.2017.07.126 [54] X. Ding Z. Yao Y. Xu B. Liu Q. Liu Y. She J. Catal. 368 2018 336 344 10.1016/j.jcat.2018.10.008 X. Ding, Z. Yao, Y. Xu, B. Liu, Q. Liu, Y. She, J. Catal. 368 (2018) 336-344. https://doi.org/10.1016/j.jcat.2018.10.008 [55] A. Tressaud S. Khairoun H. Touhara N. Watanabe Z. Anorg. Allg. Chem. 540 1986 291 299 10.1002/zaac.19865400932 A. Tressaud, S. Khairoun, H. Touhara, N. Watanabe, Z. Anorg. Allg. Chem. 540 (1986) 291-299. https://doi.org/10.1002/zaac.19865400932 [56] F. Huang Y. Li W. Lai X. Liu K. Fan X. Liu X. Wang Chem. Commun. 57 2021 351 354 10.1039/D0CC07651A F. Huang, Y. Li, W. Lai, X. Liu, K. Fan, X. Liu, X. Wang, Chem. Commun. 57 (2021) 351-354. https://doi.org/10.1039/D0CC07651A [57] D.J. Liu J.W. Evans J. Chem. Phys. 159 2023 024101 10.1063/5.0147132 D.J. Liu, J.W. Evans, J. Chem. Phys. 159 (2023) 024101. https://doi.org/10.1063/5.0147132 [58] P.J. Naik P. Kunal D.J. Liu J.W. Evans I.I. Slowing Appl. Catal. A Gen. 650 2023 119007 10.1016/j.apcata.2022.119007 P.J. Naik, P. Kunal, D.J. Liu, J.W. Evans, I.I. Slowing, Appl. Catal. A, Gen. 650 (2023) 119007. https://doi.org/10.1016/j.apcata.2022.119007 [59] N.C. Nelson J.S. Manzano A.D. Sadow S.H. Overbury I.I. Slowing ACS Catal. 5 2015 2051 2061 10.1021/cs502000j N.C. Nelson, J.S. Manzano, A.D. Sadow, S.H. Overbury, I.I. Slowing, ACS Catal. 5 (2015) 2051-2061. https://doi.org/10.1021/cs502000j [60] W. Zierkiewicz D. Michalska B. Czarnik-Matusewicz M. Rospenk J. Phys. Chem. A 107 2003 4547 4554 10.1021/jp022564q W. Zierkiewicz, D. Michalska, B. Czarnik-Matusewicz, M. Rospenk, J. Phys. Chem. A 107 (2003) 4547-4554. https://doi.org/10.1021/jp022564q [61] A. Laachir V. Perrichon A. Badri J. Lamotte E. Catherine J.C. Lavalley J.E. Fallah L. Hilaire F.L. Normand E. Quéméré G.N. Sauvion O. Touret J. Chem. Soc. Faraday Trans. 87 1991 1601 1609 10.1039/FT9918701601 A. Laachir, V. Perrichon, A. Badri, J. Lamotte, E. Catherine, J.C. Lavalley, J.E. Fallah, L. Hilaire, F.L. Normand, E. Quéméré, G.N. Sauvion, O. Touret, J. Chem. Soc. Faraday Trans. 87 (1991) 1601-1609. https://doi.org/10.1039/FT9918701601 [62] Q. Guan Y. Zeng J. Shen X.S. Chai J. Gu R. Miao B. Li P. Ning Chem. Eng. J. 299 2016 63 73 10.1016/j.cej.2016.03.105 Q. Guan, Y. Zeng, J. Shen, X.S. Chai, J. Gu, R. Miao, B. Li, P. Ning, Chem. Eng. J. 299 (2016) 63-73. https://doi.org/10.1016/j.cej.2016.03.105",
      "scopus-id": "85197056057",
      "coredata": {
        "eid": "1-s2.0-S0926860X24003016",
        "dc:description": "The efficient hydrodefluorination at mild conditions is a huge challenge during catalytic hydrodefluorination for the treatment of wastewater containing fluorophenols. The application of lanthanum oxide as the catalyst support for the Pd-catalyzed hydrodefluorination of fluorophenols was proposed. It was found that the Pd/La2O3 catalyst exhibited a much higher HDF activity than other catalysts. Further investigation of the reaction kinetic and mechanism revealed that the oxygen vacancy promoting mechanism was dominant during HDF of 4-fluorophenol over Pd/La2O3 catalyst. The 0.2 wt% Pd/La2O3 catalyst with rich oxygen vacancies has a high HDF activity, fully degrading the 4-fluorophenol within 120 min at mild condition. The calculated TOF of this catalyst (0.34293 min−1) is more than 70 times that of 1 wt% Pd/SiO2 catalyst, making it to be a promising candidate for the hydrodefluorination of fluorophenols.",
        "openArchiveArticle": "false",
        "prism:coverDate": "2024-08-05",
        "openaccessUserLicense": null,
        "prism:aggregationType": "Journal",
        "prism:url": "https://api.elsevier.com/content/article/pii/S0926860X24003016",
        "dc:creator": [
          {
            "@_fa": "true",
            "$": "Li, Linyu"
          },
          {
            "@_fa": "true",
            "$": "Feng, Haozhen"
          },
          {
            "@_fa": "true",
            "$": "Tan, Lizhi"
          },
          {
            "@_fa": "true",
            "$": "Lin, Hong"
          },
          {
            "@_fa": "true",
            "$": "Xiong, Jun"
          }
        ],
        "link": [
          {
            "@_fa": "true",
            "@rel": "self",
            "@href": "https://api.elsevier.com/content/article/pii/S0926860X24003016"
          },
          {
            "@_fa": "true",
            "@rel": "scidir",
            "@href": "https://www.sciencedirect.com/science/article/pii/S0926860X24003016"
          }
        ],
        "dc:format": "application/json",
        "openaccessType": null,
        "pii": "S0926-860X(24)00301-6",
        "prism:volume": "683",
        "articleNumber": "119856",
        "prism:publisher": "Elsevier B.V. All rights are reserved, including those for text and data mining, AI training, and similar technologies.",
        "dc:title": "Oxygen vacancies promoted catalytic hydrodefluorination over Pd/La2O3 catalyst for the efficient degradation of fluorophenols at mild condition",
        "prism:copyright": "© 2024 Elsevier B.V. All rights are reserved, including those for text and data mining, AI training, and similar technologies.",
        "openaccess": "0",
        "prism:issn": "0926860X",
        "dcterms:subject": [
          {
            "@_fa": "true",
            "$": "Catalytic hydrodefluorination"
          },
          {
            "@_fa": "true",
            "$": "Pd/La2O3 catalyst"
          },
          {
            "@_fa": "true",
            "$": "Fluorophenols"
          },
          {
            "@_fa": "true",
            "$": "Oxygen vacancies"
          },
          {
            "@_fa": "true",
            "$": "Heterogeneous catalyst"
          }
        ],
        "openaccessArticle": "false",
        "prism:publicationName": "Applied Catalysis A: General",
        "openaccessSponsorType": null,
        "prism:pageRange": "119856",
        "pubType": "fla",
        "prism:coverDisplayDate": "5 August 2024",
        "prism:doi": "10.1016/j.apcata.2024.119856",
        "prism:startingPage": "119856",
        "dc:identifier": "doi:10.1016/j.apcata.2024.119856",
        "openaccessSponsorName": null
      },
      "objects": {
        "object": [
          {
            "@category": "standard",
            "@height": "200",
            "@width": "297",
            "@_fa": "true",
            "$": "https://api.elsevier.com/content/object/eid/1-s2.0-S0926860X24003016-ga1.jpg?httpAccept=%2A%2F%2A",
            "@multimediatype": "JPEG image file",
            "@type": "IMAGE-DOWNSAMPLED",
            "@size": "16941",
            "@ref": "ga1",
            "@mimetype": "image/jpeg"
          },
          {
            "@category": "standard",
            "@height": "361",
            "@width": "791",
            "@_fa": "true",
            "$": "https://api.elsevier.com/content/object/eid/1-s2.0-S0926860X24003016-gr4.jpg?httpAccept=%2A%2F%2A",
            "@multimediatype": "JPEG image file",
            "@type": "IMAGE-DOWNSAMPLED",
            "@size": "94776",
            "@ref": "gr4",
            "@mimetype": "image/jpeg"
          },
          {
            "@category": "standard",
            "@height": "681",
            "@width": "791",
            "@_fa": "true",
            "$": "https://api.elsevier.com/content/object/eid/1-s2.0-S0926860X24003016-gr3.jpg?httpAccept=%2A%2F%2A",
            "@multimediatype": "JPEG image file",
            "@type": "IMAGE-DOWNSAMPLED",
            "@size": "152194",
            "@ref": "gr3",
            "@mimetype": "image/jpeg"
          },
          {
            "@category": "standard",
            "@height": "245",
            "@width": "678",
            "@_fa": "true",
            "$": "https://api.elsevier.com/content/object/eid/1-s2.0-S0926860X24003016-gr6.jpg?httpAccept=%2A%2F%2A",
            "@multimediatype": "JPEG image file",
            "@type": "IMAGE-DOWNSAMPLED",
            "@size": "42349",
            "@ref": "gr6",
            "@mimetype": "image/jpeg"
          },
          {
            "@category": "standard",
            "@height": "274",
            "@width": "339",
            "@_fa": "true",
            "$": "https://api.elsevier.com/content/object/eid/1-s2.0-S0926860X24003016-gr5.jpg?httpAccept=%2A%2F%2A",
            "@multimediatype": "JPEG image file",
            "@type": "IMAGE-DOWNSAMPLED",
            "@size": "19454",
            "@ref": "gr5",
            "@mimetype": "image/jpeg"
          },
          {
            "@category": "standard",
            "@height": "515",
            "@width": "678",
            "@_fa": "true",
            "$": "https://api.elsevier.com/content/object/eid/1-s2.0-S0926860X24003016-gr8.jpg?httpAccept=%2A%2F%2A",
            "@multimediatype": "JPEG image file",
            "@type": "IMAGE-DOWNSAMPLED",
            "@size": "75400",
            "@ref": "gr8",
            "@mimetype": "image/jpeg"
          },
          {
            "@category": "standard",
            "@height": "497",
            "@width": "678",
            "@_fa": "true",
            "$": "https://api.elsevier.com/content/object/eid/1-s2.0-S0926860X24003016-gr7.jpg?httpAccept=%2A%2F%2A",
            "@multimediatype": "JPEG image file",
            "@type": "IMAGE-DOWNSAMPLED",
            "@size": "72860",
            "@ref": "gr7",
            "@mimetype": "image/jpeg"
          },
          {
            "@category": "standard",
            "@height": "322",
            "@width": "565",
            "@_fa": "true",
            "$": "https://api.elsevier.com/content/object/eid/1-s2.0-S0926860X24003016-gr9.jpg?httpAccept=%2A%2F%2A",
            "@multimediatype": "JPEG image file",
            "@type": "IMAGE-DOWNSAMPLED",
            "@size": "33830",
            "@ref": "gr9",
            "@mimetype": "image/jpeg"
          },
          {
            "@category": "standard",
            "@height": "106",
            "@width": "282",
            "@_fa": "true",
            "$": "https://api.elsevier.com/content/object/eid/1-s2.0-S0926860X24003016-sc1.jpg?httpAccept=%2A%2F%2A",
            "@multimediatype": "JPEG image file",
            "@type": "IMAGE-DOWNSAMPLED",
            "@size": "5721",
            "@ref": "sc1",
            "@mimetype": "image/jpeg"
          },
          {
            "@category": "standard",
            "@height": "256",
            "@width": "339",
            "@_fa": "true",
            "$": "https://api.elsevier.com/content/object/eid/1-s2.0-S0926860X24003016-gr10.jpg?httpAccept=%2A%2F%2A",
            "@multimediatype": "JPEG image file",
            "@type": "IMAGE-DOWNSAMPLED",
            "@size": "21925",
            "@ref": "gr10",
            "@mimetype": "image/jpeg"
          },
          {
            "@category": "standard",
            "@height": "274",
            "@width": "339",
            "@_fa": "true",
            "$": "https://api.elsevier.com/content/object/eid/1-s2.0-S0926860X24003016-gr2.jpg?httpAccept=%2A%2F%2A",
            "@multimediatype": "JPEG image file",
            "@type": "IMAGE-DOWNSAMPLED",
            "@size": "22254",
            "@ref": "gr2",
            "@mimetype": "image/jpeg"
          },
          {
            "@category": "standard",
            "@height": "274",
            "@width": "339",
            "@_fa": "true",
            "$": "https://api.elsevier.com/content/object/eid/1-s2.0-S0926860X24003016-gr1.jpg?httpAccept=%2A%2F%2A",
            "@multimediatype": "JPEG image file",
            "@type": "IMAGE-DOWNSAMPLED",
            "@size": "29011",
            "@ref": "gr1",
            "@mimetype": "image/jpeg"
          },
          {
            "@category": "thumbnail",
            "@height": "147",
            "@width": "219",
            "@_fa": "true",
            "$": "https://api.elsevier.com/content/object/eid/1-s2.0-S0926860X24003016-ga1.sml?httpAccept=%2A%2F%2A",
            "@multimediatype": "GIF image file",
            "@type": "IMAGE-THUMBNAIL",
            "@size": "15397",
            "@ref": "ga1",
            "@mimetype": "image/gif"
          },
          {
            "@category": "thumbnail",
            "@height": "100",
            "@width": "219",
            "@_fa": "true",
            "$": "https://api.elsevier.com/content/object/eid/1-s2.0-S0926860X24003016-gr4.sml?httpAccept=%2A%2F%2A",
            "@multimediatype": "GIF image file",
            "@type": "IMAGE-THUMBNAIL",
            "@size": "11476",
            "@ref": "gr4",
            "@mimetype": "image/gif"
          },
          {
            "@category": "thumbnail",
            "@height": "164",
            "@width": "190",
            "@_fa": "true",
            "$": "https://api.elsevier.com/content/object/eid/1-s2.0-S0926860X24003016-gr3.sml?httpAccept=%2A%2F%2A",
            "@multimediatype": "GIF image file",
            "@type": "IMAGE-THUMBNAIL",
            "@size": "14950",
            "@ref": "gr3",
            "@mimetype": "image/gif"
          },
          {
            "@category": "thumbnail",
            "@height": "79",
            "@width": "219",
            "@_fa": "true",
            "$": "https://api.elsevier.com/content/object/eid/1-s2.0-S0926860X24003016-gr6.sml?httpAccept=%2A%2F%2A",
            "@multimediatype": "GIF image file",
            "@type": "IMAGE-THUMBNAIL",
            "@size": "6358",
            "@ref": "gr6",
            "@mimetype": "image/gif"
          },
          {
            "@category": "thumbnail",
            "@height": "164",
            "@width": "203",
            "@_fa": "true",
            "$": "https://api.elsevier.com/content/object/eid/1-s2.0-S0926860X24003016-gr5.sml?httpAccept=%2A%2F%2A",
            "@multimediatype": "GIF image file",
            "@type": "IMAGE-THUMBNAIL",
            "@size": "7226",
            "@ref": "gr5",
            "@mimetype": "image/gif"
          },
          {
            "@category": "thumbnail",
            "@height": "164",
            "@width": "216",
            "@_fa": "true",
            "$": "https://api.elsevier.com/content/object/eid/1-s2.0-S0926860X24003016-gr8.sml?httpAccept=%2A%2F%2A",
            "@multimediatype": "GIF image file",
            "@type": "IMAGE-THUMBNAIL",
            "@size": "10773",
            "@ref": "gr8",
            "@mimetype": "image/gif"
          },
          {
            "@category": "thumbnail",
            "@height": "160",
            "@width": "219",
            "@_fa": "true",
            "$": "https://api.elsevier.com/content/object/eid/1-s2.0-S0926860X24003016-gr7.sml?httpAccept=%2A%2F%2A",
            "@multimediatype": "GIF image file",
            "@type": "IMAGE-THUMBNAIL",
            "@size": "10118",
            "@ref": "gr7",
            "@mimetype": "image/gif"
          },
          {
            "@category": "thumbnail",
            "@height": "125",
            "@width": "219",
            "@_fa": "true",
            "$": "https://api.elsevier.com/content/object/eid/1-s2.0-S0926860X24003016-gr9.sml?httpAccept=%2A%2F%2A",
            "@multimediatype": "GIF image file",
            "@type": "IMAGE-THUMBNAIL",
            "@size": "7774",
            "@ref": "gr9",
            "@mimetype": "image/gif"
          },
          {
            "@category": "thumbnail",
            "@height": "82",
            "@width": "219",
            "@_fa": "true",
            "$": "https://api.elsevier.com/content/object/eid/1-s2.0-S0926860X24003016-sc1.sml?httpAccept=%2A%2F%2A",
            "@multimediatype": "GIF image file",
            "@type": "IMAGE-THUMBNAIL",
            "@size": "3220",
            "@ref": "sc1",
            "@mimetype": "image/gif"
          },
          {
            "@category": "thumbnail",
            "@height": "164",
            "@width": "217",
            "@_fa": "true",
            "$": "https://api.elsevier.com/content/object/eid/1-s2.0-S0926860X24003016-gr10.sml?httpAccept=%2A%2F%2A",
            "@multimediatype": "GIF image file",
            "@type": "IMAGE-THUMBNAIL",
            "@size": "12796",
            "@ref": "gr10",
            "@mimetype": "image/gif"
          },
          {
            "@category": "thumbnail",
            "@height": "164",
            "@width": "202",
            "@_fa": "true",
            "$": "https://api.elsevier.com/content/object/eid/1-s2.0-S0926860X24003016-gr2.sml?httpAccept=%2A%2F%2A",
            "@multimediatype": "GIF image file",
            "@type": "IMAGE-THUMBNAIL",
            "@size": "8805",
            "@ref": "gr2",
            "@mimetype": "image/gif"
          },
          {
            "@category": "thumbnail",
            "@height": "164",
            "@width": "203",
            "@_fa": "true",
            "$": "https://api.elsevier.com/content/object/eid/1-s2.0-S0926860X24003016-gr1.sml?httpAccept=%2A%2F%2A",
            "@multimediatype": "GIF image file",
            "@type": "IMAGE-THUMBNAIL",
            "@size": "10497",
            "@ref": "gr1",
            "@mimetype": "image/gif"
          },
          {
            "@category": "high",
            "@height": "886",
            "@width": "1317",
            "@_fa": "true",
            "$": "https://api.elsevier.com/content/object/eid/1-s2.0-S0926860X24003016-ga1_lrg.jpg?httpAccept=%2A%2F%2A",
            "@multimediatype": "JPEG image file",
            "@type": "IMAGE-HIGH-RES",
            "@size": "137805",
            "@ref": "ga1",
            "@mimetype": "image/jpeg"
          },
          {
            "@category": "high",
            "@height": "1593",
            "@width": "3493",
            "@_fa": "true",
            "$": "https://api.elsevier.com/content/object/eid/1-s2.0-S0926860X24003016-gr4_lrg.jpg?httpAccept=%2A%2F%2A",
            "@multimediatype": "JPEG image file",
            "@type": "IMAGE-HIGH-RES",
            "@size": "478855",
            "@ref": "gr4",
            "@mimetype": "image/jpeg"
          },
          {
            "@category": "high",
            "@height": "3008",
            "@width": "3493",
            "@_fa": "true",
            "$": "https://api.elsevier.com/content/object/eid/1-s2.0-S0926860X24003016-gr3_lrg.jpg?httpAccept=%2A%2F%2A",
            "@multimediatype": "JPEG image file",
            "@type": "IMAGE-HIGH-RES",
            "@size": "979083",
            "@ref": "gr3",
            "@mimetype": "image/jpeg"
          },
          {
            "@category": "high",
            "@height": "1080",
            "@width": "2994",
            "@_fa": "true",
            "$": "https://api.elsevier.com/content/object/eid/1-s2.0-S0926860X24003016-gr6_lrg.jpg?httpAccept=%2A%2F%2A",
            "@multimediatype": "JPEG image file",
            "@type": "IMAGE-HIGH-RES",
            "@size": "219262",
            "@ref": "gr6",
            "@mimetype": "image/jpeg"
          },
          {
            "@category": "high",
            "@height": "1210",
            "@width": "1497",
            "@_fa": "true",
            "$": "https://api.elsevier.com/content/object/eid/1-s2.0-S0926860X24003016-gr5_lrg.jpg?httpAccept=%2A%2F%2A",
            "@multimediatype": "JPEG image file",
            "@type": "IMAGE-HIGH-RES",
            "@size": "105462",
            "@ref": "gr5",
            "@mimetype": "image/jpeg"
          },
          {
            "@category": "high",
            "@height": "2273",
            "@width": "2994",
            "@_fa": "true",
            "$": "https://api.elsevier.com/content/object/eid/1-s2.0-S0926860X24003016-gr8_lrg.jpg?httpAccept=%2A%2F%2A",
            "@multimediatype": "JPEG image file",
            "@type": "IMAGE-HIGH-RES",
            "@size": "372710",
            "@ref": "gr8",
            "@mimetype": "image/jpeg"
          },
          {
            "@category": "high",
            "@height": "2193",
            "@width": "2994",
            "@_fa": "true",
            "$": "https://api.elsevier.com/content/object/eid/1-s2.0-S0926860X24003016-gr7_lrg.jpg?httpAccept=%2A%2F%2A",
            "@multimediatype": "JPEG image file",
            "@type": "IMAGE-HIGH-RES",
            "@size": "351591",
            "@ref": "gr7",
            "@mimetype": "image/jpeg"
          },
          {
            "@category": "high",
            "@height": "1420",
            "@width": "2495",
            "@_fa": "true",
            "$": "https://api.elsevier.com/content/object/eid/1-s2.0-S0926860X24003016-gr9_lrg.jpg?httpAccept=%2A%2F%2A",
            "@multimediatype": "JPEG image file",
            "@type": "IMAGE-HIGH-RES",
            "@size": "157311",
            "@ref": "gr9",
            "@mimetype": "image/jpeg"
          },
          {
            "@category": "high",
            "@height": "468",
            "@width": "1247",
            "@_fa": "true",
            "$": "https://api.elsevier.com/content/object/eid/1-s2.0-S0926860X24003016-sc1_lrg.jpg?httpAccept=%2A%2F%2A",
            "@multimediatype": "JPEG image file",
            "@type": "IMAGE-HIGH-RES",
            "@size": "30950",
            "@ref": "sc1",
            "@mimetype": "image/jpeg"
          },
          {
            "@category": "high",
            "@height": "1130",
            "@width": "1497",
            "@_fa": "true",
            "$": "https://api.elsevier.com/content/object/eid/1-s2.0-S0926860X24003016-gr10_lrg.jpg?httpAccept=%2A%2F%2A",
            "@multimediatype": "JPEG image file",
            "@type": "IMAGE-HIGH-RES",
            "@size": "206020",
            "@ref": "gr10",
            "@mimetype": "image/jpeg"
          },
          {
            "@category": "high",
            "@height": "1212",
            "@width": "1497",
            "@_fa": "true",
            "$": "https://api.elsevier.com/content/object/eid/1-s2.0-S0926860X24003016-gr2_lrg.jpg?httpAccept=%2A%2F%2A",
            "@multimediatype": "JPEG image file",
            "@type": "IMAGE-HIGH-RES",
            "@size": "103245",
            "@ref": "gr2",
            "@mimetype": "image/jpeg"
          },
          {
            "@category": "high",
            "@height": "1211",
            "@width": "1497",
            "@_fa": "true",
            "$": "https://api.elsevier.com/content/object/eid/1-s2.0-S0926860X24003016-gr1_lrg.jpg?httpAccept=%2A%2F%2A",
            "@multimediatype": "JPEG image file",
            "@type": "IMAGE-HIGH-RES",
            "@size": "159902",
            "@ref": "gr1",
            "@mimetype": "image/jpeg"
          },
          {
            "@category": "standard",
            "@_fa": "true",
            "$": "https://api.elsevier.com/content/object/eid/1-s2.0-S0926860X24003016-mmc1.docx?httpAccept=%2A%2F%2A",
            "@multimediatype": "Microsoft Word file",
            "@type": "APPLICATION",
            "@size": "592224",
            "@ref": "mmc1",
            "@mimetype": "application/word"
          },
          {
            "@category": "thumbnail",
            "@_fa": "true",
            "$": "https://api.elsevier.com/content/object/eid/1-s2.0-S0926860X24003016-si0001.svg?httpAccept=%2A%2F%2A",
            "@multimediatype": "Scalable Vector Graphics file",
            "@type": "ALTIMG",
            "@size": "3476",
            "@ref": "si0001",
            "@mimetype": "image/svg+xml"
          },
          {
            "@category": "thumbnail",
            "@_fa": "true",
            "$": "https://api.elsevier.com/content/object/eid/1-s2.0-S0926860X24003016-si0002.svg?httpAccept=%2A%2F%2A",
            "@multimediatype": "Scalable Vector Graphics file",
            "@type": "ALTIMG",
            "@size": "3116",
            "@ref": "si0002",
            "@mimetype": "image/svg+xml"
          },
          {
            "@category": "thumbnail",
            "@_fa": "true",
            "$": "https://api.elsevier.com/content/object/eid/1-s2.0-S0926860X24003016-si0003.svg?httpAccept=%2A%2F%2A",
            "@multimediatype": "Scalable Vector Graphics file",
            "@type": "ALTIMG",
            "@size": "2224",
            "@ref": "si0003",
            "@mimetype": "image/svg+xml"
          },
          {
            "@category": "thumbnail",
            "@_fa": "true",
            "$": "https://api.elsevier.com/content/object/eid/1-s2.0-S0926860X24003016-si0004.svg?httpAccept=%2A%2F%2A",
            "@multimediatype": "Scalable Vector Graphics file",
            "@type": "ALTIMG",
            "@size": "2613",
            "@ref": "si0004",
            "@mimetype": "image/svg+xml"
          },
          {
            "@category": "thumbnail",
            "@_fa": "true",
            "$": "https://api.elsevier.com/content/object/eid/1-s2.0-S0926860X24003016-si0005.svg?httpAccept=%2A%2F%2A",
            "@multimediatype": "Scalable Vector Graphics file",
            "@type": "ALTIMG",
            "@size": "3282",
            "@ref": "si0005",
            "@mimetype": "image/svg+xml"
          },
          {
            "@category": "thumbnail",
            "@_fa": "true",
            "$": "https://api.elsevier.com/content/object/eid/1-s2.0-S0926860X24003016-si0006.svg?httpAccept=%2A%2F%2A",
            "@multimediatype": "Scalable Vector Graphics file",
            "@type": "ALTIMG",
            "@size": "3598",
            "@ref": "si0006",
            "@mimetype": "image/svg+xml"
          },
          {
            "@category": "thumbnail",
            "@_fa": "true",
            "$": "https://api.elsevier.com/content/object/eid/1-s2.0-S0926860X24003016-si0007.svg?httpAccept=%2A%2F%2A",
            "@multimediatype": "Scalable Vector Graphics file",
            "@type": "ALTIMG",
            "@size": "2816",
            "@ref": "si0007",
            "@mimetype": "image/svg+xml"
          },
          {
            "@category": "thumbnail",
            "@_fa": "true",
            "$": "https://api.elsevier.com/content/object/eid/1-s2.0-S0926860X24003016-si0008.svg?httpAccept=%2A%2F%2A",
            "@multimediatype": "Scalable Vector Graphics file",
            "@type": "ALTIMG",
            "@size": "4587",
            "@ref": "si0008",
            "@mimetype": "image/svg+xml"
          },
          {
            "@category": "thumbnail",
            "@_fa": "true",
            "$": "https://api.elsevier.com/content/object/eid/1-s2.0-S0926860X24003016-si0009.svg?httpAccept=%2A%2F%2A",
            "@multimediatype": "Scalable Vector Graphics file",
            "@type": "ALTIMG",
            "@size": "9041",
            "@ref": "si0009",
            "@mimetype": "image/svg+xml"
          },
          {
            "@category": "standard",
            "@_fa": "true",
            "$": "https://api.elsevier.com/content/object/eid/1-s2.0-S0926860X24003016-am.pdf?httpAccept=%2A%2F%2A",
            "@multimediatype": "Acrobat PDF file",
            "@type": "AAM-PDF",
            "@size": "7632098",
            "@ref": "am",
            "@mimetype": "application/pdf"
          }
        ]
      },
      "link": {
        "@rel": "abstract",
        "@href": "https://api.elsevier.com/content/abstract/scopus_id/85197056057"
      }
    }
  }
}