{
  "metadata": {
    "title": "Mesoporous Ni/Al-MCM-41 catalysts for highly active and selective hydrodeoxygenation of anisole to cyclohexane",
    "authors": "; ; ",
    "journal": "Applied Catalysis A: General",
    "date": "2023-08-05",
    "doi": "10.1016/j.apcata.2023.119313",
    "abstract": "",
    "uri": "https://api.elsevier.com/content/article/pii/S0926860X23002934",
    "pii": "S0926860X23002934"
  },
  "fulltext": {
    "full-text-retrieval-response": {
      "scopus-eid": "2-s2.0-85164298624",
      "originalText": "serial JL 271346 291210 291744 291809 31 Applied Catalysis A: General APPLIEDCATALYSISAGENERAL 2023-06-27 2023-06-27 2023-07-07 2023-07-07 2023-07-18T16:52:29 1-s2.0-S0926860X23002934 S0926-860X(23)00293-4 S0926860X23002934 10.1016/j.apcata.2023.119313 S300 S300.1 FULL-TEXT 1-s2.0-S0926860X23X00143 2024-01-01T12:35:59.692098Z 0 0 20230805 2023 2023-06-27T06:36:02.595973Z absattachment articleinfo articlenumber articletitlenorm authfirstinitialnorm authfirstsurnamenorm cid cids contenttype copyright crossmark dateloaded dateloadedtxt datesearch datesort dateupdated dco docsubtype doctype doi eid ewtransactionid hubeid indexeddate issn issnnorm itemstage itemtransactionid itemweight openaccess openarchive pg pgfirst pii piinorm pubdatestart pubdatetxt pubyr sortorder srctitle srctitlenorm srctype ssids alllist content subj subheadings suppl tomb volfirst volissue volumelist webpdf webpdfpagecount yearnav figure table e-component body mmlmath acknowledge affil appendices articletitle auth authfirstini authfull authkeywords authlast grantnumber grantsponsor highlightsabst primabst ref specialabst 0926-860X 0926860X true 663 663 C Volume 663 27 119313 119313 119313 20230805 5 August 2023 2023-08-05 2023 article fla © 2023 Elsevier B.V. All rights reserved. MESOPOROUSNIALMCM41CATALYSTSFORHIGHLYACTIVESELECTIVEHYDRODEOXYGENATIONANISOLECYCLOHEXANE MOLINACONDE L 1 Introduction 2 Experimental 2.1 Synthesis of supports and catalysts 2.1.1 Chemicals 2.1.2 Synthesis of MCM-41 support 2.1.3 Synthesis of Al-MCM-41 supports 2.1.4 Preparation of Ni catalysts 2.2 Characterization of supports and catalysts 2.2.1 Nitrogen physisorption 2.2.2 X-ray diffraction 2.2.3 UV-Vis diffuse reflectance spectroscopy (DRS) 2.2.4 Elemental analysis 2.2.5 High resolution transmission electron microscopy (HRTEM) 2.2.6 Temperature-programmed reduction (H2-TPR) and temperature-programmed desorption of ammonia (NH3-TPD) 2.3 Catalytic activity tests 3 Results and discussion 3.1 Characterization of supports and calcined catalysts 3.1.1 SEM-EDX characterization 3.1.2 N2 physisorption 3.1.3 X-ray diffraction 3.1.4 Diffuse reflectance spectroscopy 3.1.5 Temperature-programmed reduction 3.1.6 Temperature-programmed desorption of ammonia 3.2 Characterization of reduced catalysts 3.2.1 Powder XRD characterization 3.2.2 HRTEM characterization 3.3 Catalytic evaluation in HDO of anisole 3.4 Effect of Al incorporation on the activity and selectivity of Ni catalysts in HDO of anisole 3.5 Catalyst recycling 4 Conclusions CRediT authorship contribution statement Acknowledgments Appendix A Supplementary material References DEMIRBAS 2017 47 55 A GARCIA 2016 85 118 I HANDBOOKBIOFUELSPRODUCTION HANDBOOKBIOFUELSPRODUCTION CHEN 2019 106180 X AMBURSA 2021 110667 M MARTINEZKLIMOV 2021 181 213 M VALLE 2019 670 689 B MORTENSEN 2011 1 19 P OCHOAHERNANDEZ 2013 81 88 C QU 2021 9348 9376 L TOBA 2011 533 537 M BUI 2011 239 245 V KALUZA 2019 887 902 L GUTIERREZ 2009 239 246 A BROGLIA 2019 501 508 F LEE 2020 5738 5741 H SHI 2020 20299 20310 Y VARGASVILLAGRAN 2020 26 41 H FENG 2021 124569 L AMBURSA 2019 236 243 M KOSSLICK 1999 49 60 H GEBRETATIOS 2023 136843 A BEDOYA 2022 55 62 J DING 2019 606 C HACHEMAOUI 2021 219 M TRAN 2022 111435 N BRAHMIA 2016 31 40 L CHEN 2020 e5396 S VISCARDI 2021 45 49 R DEHGHANI 2019 142 152 S NUGRAHA 2021 21885 21896 R TRAN 2016 1252 1258 N TRAN 2016 93 100 N TAGHVAEI 2021 120493 H MENDEZ 2013 93 100 F LENSVELD 2001 401 407 D FENELONOV 1999 57 72 V KLIMOVA 2003 29 40 T THOTA 2013 214307 S KOSSLICK 1999 49 60 H LOCUS 2016 7731 7743 R GAMLIEL 2018 20 29 D SMIRNOV 2014 69 78 A TRAN 2021 430 N SAIDI 2014 103 129 M LI 2020 110642 W LI 2018 75 83 F YUSUF 2023 1225 1237 M LI 2011 854 863 K FURIMSKY 2000 147 190 E HSU 2018 660 667 P SHIVHARE 2020 4945 4953 A SONG 2015 1204 1218 W MOLINACONDEX2023X119313 MOLINACONDEX2023X119313XL 2025-07-07T00:00:00.000Z 2025-07-07T00:00:00.000Z http://creativecommons.org/licenses/by-nc-nd/4.0/ © 2023 Elsevier B.V. All rights reserved. 2023-10-10T01:54:36.931Z http://vtw.elsevier.com/data/voc/AddOnTypes/50.7/aggregated-refined CONACYT-México 798446 CVU 995029 CONACYT Consejo Nacional de Ciencia y Tecnología http://data.elsevier.com/vocabulary/SciValFunders/501100003141 http://sws.geonames.org/3996063/ Dirección General de Asuntos de Personal Académico – Universidad Nacional Autónoma de México IN-114121 DGAPA, UNAM Dirección General de Asuntos del Personal Académico, Universidad Nacional Autónoma de México http://data.elsevier.com/vocabulary/SciValFunders/501100006087 http://sws.geonames.org/3996063/ This work was supported by Dirección General de Asuntos de Personal Académico – Universidad Nacional Autónoma de México, DGAPA-UNAM, México [grant IN-114121]. LHMC acknowledges CONACYT-México for scholarship No. 798446 through CVU 995029. The authors thank I. Puente Lee, C. Salcedo Luna and A. Morales Espino for performing characterization of supports and catalysts by electron microscopy, powder XRD and small-angle XRD, respectively. https://doi.org/10.15223/policy-017 https://doi.org/10.15223/policy-037 https://doi.org/10.15223/policy-012 https://doi.org/10.15223/policy-029 https://doi.org/10.15223/policy-004 item S0926-860X(23)00293-4 S0926860X23002934 1-s2.0-S0926860X23002934 10.1016/j.apcata.2023.119313 271346 2024-01-01T12:35:59.692098Z 2023-08-05 1-s2.0-S0926860X23002934-main.pdf https://s3-eu-west-1.amazonaws.com/prod-ucs-content-store-eu-west/content/pii:S0926860X23002934/MAIN/application/pdf/97088d90e90edb41b2a16f100e71fabd/main.pdf main.pdf pdf true 10282460 MAIN 15 1-s2.0-S0926860X23002934-main_1.png https://s3-eu-west-1.amazonaws.com/prod-ucs-content-store-eu-west/content/pii:S0926860X23002934/PREVIEW/image/png/918985869d963478f38c6dff9319792a/main_1.png main_1.png png 58566 849 656 IMAGE-WEB-PDF 1 1-s2.0-S0926860X23002934-gr1.jpg https://s3-eu-west-1.amazonaws.com/prod-ucs-content-store-eu-west/content/pii:S0926860X23002934/gr1/DOWNSAMPLED/image/jpeg/cecb9cc6b6af9b069b7748be534c55bc/gr1.jpg gr1 gr1.jpg jpg 153990 998 708 IMAGE-DOWNSAMPLED 1-s2.0-S0926860X23002934-gr4.jpg https://s3-eu-west-1.amazonaws.com/prod-ucs-content-store-eu-west/content/pii:S0926860X23002934/gr4/DOWNSAMPLED/image/jpeg/487aea3817b1cb54e5116fa5ad187fcd/gr4.jpg gr4 gr4.jpg jpg 53436 268 678 IMAGE-DOWNSAMPLED 1-s2.0-S0926860X23002934-gr5.jpg https://s3-eu-west-1.amazonaws.com/prod-ucs-content-store-eu-west/content/pii:S0926860X23002934/gr5/DOWNSAMPLED/image/jpeg/6bf1779d835914ed184f32793e1db6dd/gr5.jpg gr5 gr5.jpg jpg 29880 315 376 IMAGE-DOWNSAMPLED 1-s2.0-S0926860X23002934-gr2.jpg https://s3-eu-west-1.amazonaws.com/prod-ucs-content-store-eu-west/content/pii:S0926860X23002934/gr2/DOWNSAMPLED/image/jpeg/58f740a0b20943a09877b109688e1311/gr2.jpg gr2 gr2.jpg jpg 79020 515 678 IMAGE-DOWNSAMPLED 1-s2.0-S0926860X23002934-gr3.jpg https://s3-eu-west-1.amazonaws.com/prod-ucs-content-store-eu-west/content/pii:S0926860X23002934/gr3/DOWNSAMPLED/image/jpeg/dd26ef90859e3a9a405b9b778deb8392/gr3.jpg gr3 gr3.jpg jpg 39156 567 376 IMAGE-DOWNSAMPLED 1-s2.0-S0926860X23002934-gr11.jpg https://s3-eu-west-1.amazonaws.com/prod-ucs-content-store-eu-west/content/pii:S0926860X23002934/gr11/DOWNSAMPLED/image/jpeg/3b2b4ea32bb0472a0f47fa03fbfbbd46/gr11.jpg gr11 gr11.jpg jpg 14691 201 565 IMAGE-DOWNSAMPLED 1-s2.0-S0926860X23002934-sc1.jpg https://s3-eu-west-1.amazonaws.com/prod-ucs-content-store-eu-west/content/pii:S0926860X23002934/sc1/DOWNSAMPLED/image/jpeg/62b1edbc868b08e1c98dede621959847/sc1.jpg sc1 sc1.jpg jpg 30415 304 565 IMAGE-DOWNSAMPLED 1-s2.0-S0926860X23002934-gr12.jpg https://s3-eu-west-1.amazonaws.com/prod-ucs-content-store-eu-west/content/pii:S0926860X23002934/gr12/DOWNSAMPLED/image/jpeg/0983e9f5784b8ca96bb48fe5b4dafb63/gr12.jpg gr12 gr12.jpg jpg 16831 300 376 IMAGE-DOWNSAMPLED 1-s2.0-S0926860X23002934-sc2.jpg https://s3-eu-west-1.amazonaws.com/prod-ucs-content-store-eu-west/content/pii:S0926860X23002934/sc2/DOWNSAMPLED/image/jpeg/9f5b2f95ab854ccf8e1ae45c476874ac/sc2.jpg sc2 sc2.jpg jpg 53231 755 678 IMAGE-DOWNSAMPLED 1-s2.0-S0926860X23002934-gr10.jpg https://s3-eu-west-1.amazonaws.com/prod-ucs-content-store-eu-west/content/pii:S0926860X23002934/gr10/DOWNSAMPLED/image/jpeg/8f5c5b9a242e5b6a8497fc6384a4f363/gr10.jpg gr10 gr10.jpg jpg 24212 313 376 IMAGE-DOWNSAMPLED 1-s2.0-S0926860X23002934-ga1.jpg https://s3-eu-west-1.amazonaws.com/prod-ucs-content-store-eu-west/content/pii:S0926860X23002934/ga1/DOWNSAMPLED/image/jpeg/aab263b90e33652e3fb4e2b4ec64d2f5/ga1.jpg ga1 true ga1.jpg jpg 24579 200 500 IMAGE-DOWNSAMPLED 1-s2.0-S0926860X23002934-gr8.jpg https://s3-eu-west-1.amazonaws.com/prod-ucs-content-store-eu-west/content/pii:S0926860X23002934/gr8/DOWNSAMPLED/image/jpeg/75982464845973c37b7572b3915073da/gr8.jpg gr8 gr8.jpg jpg 28797 290 376 IMAGE-DOWNSAMPLED 1-s2.0-S0926860X23002934-gr9.jpg https://s3-eu-west-1.amazonaws.com/prod-ucs-content-store-eu-west/content/pii:S0926860X23002934/gr9/DOWNSAMPLED/image/jpeg/4e2f5019e9a8e0878909b7265ce2d5d5/gr9.jpg gr9 gr9.jpg jpg 224934 997 667 IMAGE-DOWNSAMPLED 1-s2.0-S0926860X23002934-gr6.jpg https://s3-eu-west-1.amazonaws.com/prod-ucs-content-store-eu-west/content/pii:S0926860X23002934/gr6/DOWNSAMPLED/image/jpeg/55f9b0e0f475408c8cd279b22f5bbd5f/gr6.jpg gr6 gr6.jpg jpg 27208 314 376 IMAGE-DOWNSAMPLED 1-s2.0-S0926860X23002934-gr7.jpg https://s3-eu-west-1.amazonaws.com/prod-ucs-content-store-eu-west/content/pii:S0926860X23002934/gr7/DOWNSAMPLED/image/jpeg/93b4457697e754e9362a29f5efc8b5ce/gr7.jpg gr7 gr7.jpg jpg 23744 311 376 IMAGE-DOWNSAMPLED 1-s2.0-S0926860X23002934-gr1.sml https://s3-eu-west-1.amazonaws.com/prod-ucs-content-store-eu-west/content/pii:S0926860X23002934/gr1/THUMBNAIL/image/gif/767cf7e1146a5915e84b3e82ca94b89d/gr1.sml gr1 gr1.sml sml 10880 163 116 IMAGE-THUMBNAIL 1-s2.0-S0926860X23002934-gr4.sml https://s3-eu-west-1.amazonaws.com/prod-ucs-content-store-eu-west/content/pii:S0926860X23002934/gr4/THUMBNAIL/image/gif/8cce797483d8c48672f47abd5ab988f0/gr4.sml gr4 gr4.sml sml 7087 86 219 IMAGE-THUMBNAIL 1-s2.0-S0926860X23002934-gr5.sml https://s3-eu-west-1.amazonaws.com/prod-ucs-content-store-eu-west/content/pii:S0926860X23002934/gr5/THUMBNAIL/image/gif/965275f15c5acf05e48d892dc16c9e2f/gr5.sml gr5 gr5.sml sml 8731 163 195 IMAGE-THUMBNAIL 1-s2.0-S0926860X23002934-gr2.sml https://s3-eu-west-1.amazonaws.com/prod-ucs-content-store-eu-west/content/pii:S0926860X23002934/gr2/THUMBNAIL/image/gif/3835712e7ae0f8b6ef65de9c698930b0/gr2.sml gr2 gr2.sml sml 10655 164 216 IMAGE-THUMBNAIL 1-s2.0-S0926860X23002934-gr3.sml https://s3-eu-west-1.amazonaws.com/prod-ucs-content-store-eu-west/content/pii:S0926860X23002934/gr3/THUMBNAIL/image/gif/54daf28078a7e7106c6dff55d84eeba3/gr3.sml gr3 gr3.sml sml 6419 163 108 IMAGE-THUMBNAIL 1-s2.0-S0926860X23002934-gr11.sml https://s3-eu-west-1.amazonaws.com/prod-ucs-content-store-eu-west/content/pii:S0926860X23002934/gr11/THUMBNAIL/image/gif/d313c87d429ed41f11464e2b98c6162b/gr11.sml gr11 gr11.sml sml 2171 78 219 IMAGE-THUMBNAIL 1-s2.0-S0926860X23002934-sc1.sml https://s3-eu-west-1.amazonaws.com/prod-ucs-content-store-eu-west/content/pii:S0926860X23002934/sc1/THUMBNAIL/image/gif/bb44640b1740c9551248ed71b48d8424/sc1.sml sc1 sc1.sml sml 4697 118 219 IMAGE-THUMBNAIL 1-s2.0-S0926860X23002934-gr12.sml https://s3-eu-west-1.amazonaws.com/prod-ucs-content-store-eu-west/content/pii:S0926860X23002934/gr12/THUMBNAIL/image/gif/d9fc7e695b74023f745f950f97f99f8e/gr12.sml gr12 gr12.sml sml 8340 164 205 IMAGE-THUMBNAIL 1-s2.0-S0926860X23002934-sc2.sml https://s3-eu-west-1.amazonaws.com/prod-ucs-content-store-eu-west/content/pii:S0926860X23002934/sc2/THUMBNAIL/image/gif/d6133a56434e78b315187c3608c06fac/sc2.sml sc2 sc2.sml sml 3893 164 147 IMAGE-THUMBNAIL 1-s2.0-S0926860X23002934-gr10.sml https://s3-eu-west-1.amazonaws.com/prod-ucs-content-store-eu-west/content/pii:S0926860X23002934/gr10/THUMBNAIL/image/gif/8f52aef2100b57b1b36abde73e1579b9/gr10.sml gr10 gr10.sml sml 7889 164 197 IMAGE-THUMBNAIL 1-s2.0-S0926860X23002934-ga1.sml https://s3-eu-west-1.amazonaws.com/prod-ucs-content-store-eu-west/content/pii:S0926860X23002934/ga1/THUMBNAIL/image/gif/68aa3f50d69798297a5a9efed9a4b052/ga1.sml ga1 true ga1.sml sml 7144 88 219 IMAGE-THUMBNAIL 1-s2.0-S0926860X23002934-gr8.sml https://s3-eu-west-1.amazonaws.com/prod-ucs-content-store-eu-west/content/pii:S0926860X23002934/gr8/THUMBNAIL/image/gif/5e53687ae24fbf276b3e443e45380db7/gr8.sml gr8 gr8.sml sml 9101 164 212 IMAGE-THUMBNAIL 1-s2.0-S0926860X23002934-gr9.sml https://s3-eu-west-1.amazonaws.com/prod-ucs-content-store-eu-west/content/pii:S0926860X23002934/gr9/THUMBNAIL/image/gif/bd1a7c2efefb6065cb8281bfc10e09e1/gr9.sml gr9 gr9.sml sml 10691 163 109 IMAGE-THUMBNAIL 1-s2.0-S0926860X23002934-gr6.sml https://s3-eu-west-1.amazonaws.com/prod-ucs-content-store-eu-west/content/pii:S0926860X23002934/gr6/THUMBNAIL/image/gif/277a806717cd3bb10d49e01b069da70a/gr6.sml gr6 gr6.sml sml 7483 163 196 IMAGE-THUMBNAIL 1-s2.0-S0926860X23002934-gr7.sml https://s3-eu-west-1.amazonaws.com/prod-ucs-content-store-eu-west/content/pii:S0926860X23002934/gr7/THUMBNAIL/image/gif/7436b8fd6b10d5fb0842d2bdb7546449/gr7.sml gr7 gr7.sml sml 7545 164 198 IMAGE-THUMBNAIL 1-s2.0-S0926860X23002934-gr1_lrg.jpg https://s3-eu-west-1.amazonaws.com/prod-ucs-content-store-eu-west/content/pii:S0926860X23002934/HIGHRES/image/jpeg/8de5fd7e163fa18da2247e0d558bd660/gr1_lrg.jpg gr1 gr1_lrg.jpg jpg 928523 4408 3128 IMAGE-HIGH-RES 1-s2.0-S0926860X23002934-gr4_lrg.jpg https://s3-eu-west-1.amazonaws.com/prod-ucs-content-store-eu-west/content/pii:S0926860X23002934/HIGHRES/image/jpeg/042882c3d0ef20cb03bf7a5098db68d9/gr4_lrg.jpg gr4 gr4_lrg.jpg jpg 224026 1182 2994 IMAGE-HIGH-RES 1-s2.0-S0926860X23002934-gr5_lrg.jpg https://s3-eu-west-1.amazonaws.com/prod-ucs-content-store-eu-west/content/pii:S0926860X23002934/HIGHRES/image/jpeg/76ef4327cd9fb46b6376dc160fb35271/gr5_lrg.jpg gr5 gr5_lrg.jpg jpg 281117 1394 1663 IMAGE-HIGH-RES 1-s2.0-S0926860X23002934-gr2_lrg.jpg https://s3-eu-west-1.amazonaws.com/prod-ucs-content-store-eu-west/content/pii:S0926860X23002934/HIGHRES/image/jpeg/e36b705883c2b8873b8904e15521809f/gr2_lrg.jpg gr2 gr2_lrg.jpg jpg 372603 2273 2994 IMAGE-HIGH-RES 1-s2.0-S0926860X23002934-gr3_lrg.jpg https://s3-eu-west-1.amazonaws.com/prod-ucs-content-store-eu-west/content/pii:S0926860X23002934/HIGHRES/image/jpeg/6d837e81362404a6a7a59d27097c6dff/gr3_lrg.jpg gr3 gr3_lrg.jpg jpg 203431 2506 1663 IMAGE-HIGH-RES 1-s2.0-S0926860X23002934-gr11_lrg.jpg https://s3-eu-west-1.amazonaws.com/prod-ucs-content-store-eu-west/content/pii:S0926860X23002934/HIGHRES/image/jpeg/cd823f36c546f636c059458c76f84252/gr11_lrg.jpg gr11 gr11_lrg.jpg jpg 76082 887 2495 IMAGE-HIGH-RES 1-s2.0-S0926860X23002934-sc1_lrg.jpg https://s3-eu-west-1.amazonaws.com/prod-ucs-content-store-eu-west/content/pii:S0926860X23002934/HIGHRES/image/jpeg/850f318252c0b1ec24b4fca6cd049b1e/sc1_lrg.jpg sc1 sc1_lrg.jpg jpg 129111 1342 2495 IMAGE-HIGH-RES 1-s2.0-S0926860X23002934-gr12_lrg.jpg https://s3-eu-west-1.amazonaws.com/prod-ucs-content-store-eu-west/content/pii:S0926860X23002934/HIGHRES/image/jpeg/aab889b956d0f6132b24d4e77d724404/gr12_lrg.jpg gr12 gr12_lrg.jpg jpg 72831 1329 1663 IMAGE-HIGH-RES 1-s2.0-S0926860X23002934-sc2_lrg.jpg https://s3-eu-west-1.amazonaws.com/prod-ucs-content-store-eu-west/content/pii:S0926860X23002934/HIGHRES/image/jpeg/b2139e76a37dcbf89e38663498328846/sc2_lrg.jpg sc2 sc2_lrg.jpg jpg 248127 3335 2994 IMAGE-HIGH-RES 1-s2.0-S0926860X23002934-gr10_lrg.jpg https://s3-eu-west-1.amazonaws.com/prod-ucs-content-store-eu-west/content/pii:S0926860X23002934/HIGHRES/image/jpeg/fcc7afa68e4aad4b98b22d7a5770ef18/gr10_lrg.jpg gr10 gr10_lrg.jpg jpg 106896 1386 1663 IMAGE-HIGH-RES 1-s2.0-S0926860X23002934-ga1_lrg.jpg https://s3-eu-west-1.amazonaws.com/prod-ucs-content-store-eu-west/content/pii:S0926860X23002934/HIGHRES/image/jpeg/50455b608bd3825ec85764f94b3d2592/ga1_lrg.jpg ga1 true ga1_lrg.jpg jpg 177165 885 2213 IMAGE-HIGH-RES 1-s2.0-S0926860X23002934-gr8_lrg.jpg https://s3-eu-west-1.amazonaws.com/prod-ucs-content-store-eu-west/content/pii:S0926860X23002934/HIGHRES/image/jpeg/e942aea70d141a95c8938b2880a7787b/gr8_lrg.jpg gr8 gr8_lrg.jpg jpg 119749 1283 1663 IMAGE-HIGH-RES 1-s2.0-S0926860X23002934-gr9_lrg.jpg https://s3-eu-west-1.amazonaws.com/prod-ucs-content-store-eu-west/content/pii:S0926860X23002934/HIGHRES/image/jpeg/579f835a4e114671142b56f094f7c9ea/gr9_lrg.jpg gr9 gr9_lrg.jpg jpg 1149263 4408 2948 IMAGE-HIGH-RES 1-s2.0-S0926860X23002934-gr6_lrg.jpg https://s3-eu-west-1.amazonaws.com/prod-ucs-content-store-eu-west/content/pii:S0926860X23002934/HIGHRES/image/jpeg/8da736817789d7b13f8392ec5a2663b6/gr6_lrg.jpg gr6 gr6_lrg.jpg jpg 152875 1387 1663 IMAGE-HIGH-RES 1-s2.0-S0926860X23002934-gr7_lrg.jpg https://s3-eu-west-1.amazonaws.com/prod-ucs-content-store-eu-west/content/pii:S0926860X23002934/HIGHRES/image/jpeg/5539a41e76948bf95e2cbd0ad73ac3cd/gr7_lrg.jpg gr7 gr7_lrg.jpg jpg 113805 1377 1663 IMAGE-HIGH-RES 1-s2.0-S0926860X23002934-mmc1.docx https://s3-eu-west-1.amazonaws.com/prod-ucs-content-store-eu-west/content/pii:S0926860X23002934/mmc1/MAIN/application/vnd.openxmlformats-officedocument.wordprocessingml.document/70f87747fbc565391fb5b30cb9027d15/mmc1.docx mmc1 mmc1.docx docx 2268279 APPLICATION 1-s2.0-S0926860X23002934-si0001.svg https://s3-eu-west-1.amazonaws.com/prod-ucs-content-store-eu-west/content/pii:S0926860X23002934/image/svg+xml/0e6439eb119bca29b1774eee2c9b0004/si0001.svg si0001 si0001.svg svg 1790 ALTIMG 1-s2.0-S0926860X23002934-si0002.svg https://s3-eu-west-1.amazonaws.com/prod-ucs-content-store-eu-west/content/pii:S0926860X23002934/image/svg+xml/0d1f271202fe3bba259071b2292eeb50/si0002.svg si0002 si0002.svg svg 1790 ALTIMG 1-s2.0-S0926860X23002934-si0003.svg https://s3-eu-west-1.amazonaws.com/prod-ucs-content-store-eu-west/content/pii:S0926860X23002934/image/svg+xml/004bdac9d857f407d540a8143194f53e/si0003.svg si0003 si0003.svg svg 3282 ALTIMG 1-s2.0-S0926860X23002934-si0004.svg https://s3-eu-west-1.amazonaws.com/prod-ucs-content-store-eu-west/content/pii:S0926860X23002934/image/svg+xml/bfef9a8db5627855bffff0cc2693b8cb/si0004.svg si0004 si0004.svg svg 1839 ALTIMG 1-s2.0-S0926860X23002934-si0005.svg https://s3-eu-west-1.amazonaws.com/prod-ucs-content-store-eu-west/content/pii:S0926860X23002934/image/svg+xml/03515c6cf93b431ddb50943b076aa289/si0005.svg si0005 si0005.svg svg 3108 ALTIMG 1-s2.0-S0926860X23002934-am.pdf am am.pdf pdf 2791923 AAM-PDF https://s3-eu-west-1.amazonaws.com/prod-ucs-content-store-eu-west/content/egi:10DNPDKZS0Q/MAIN/application/pdf/5192f8c5d5b7ad8d365815faa0bbd8ed/am.pdf APCATA 119313 119313 S0926-860X(23)00293-4 10.1016/j.apcata.2023.119313 Elsevier B.V. Fig. 1 SEM-EDX images of calcined Ni catalysts: (a) NiMCM, (b) NAM120, (c) NAM90, (d) NAM60, and (e) NAM30. Fig. 1 Fig. 2 N2 adsorption-desorption isotherms and pore size distributions of supports (a, c) and catalysts (b, d). Fig. 2 Fig. 3 Small-angle X-ray diffraction patterns of supports and catalysts. Fig. 3 Fig. 4 X-ray diffraction patterns of supports (a) and calcined catalysts (b). Characteristic signals of cubic NiO crystalline phase (ICDD card 01–071–1179) are shown by dashed lines in chart (b). Fig. 4 Fig. 5 UV-Vis diffuse reflectance spectra of calcined Ni catalysts. Fig. 5 Fig. 6 H2-TPR profiles of the calcined Ni catalysts supported on MCM-41 and Al-MCM-41. Fig. 6 Fig. 7 NH3-TPD profiles of the calcined catalysts. Fig. 7 Fig. 8 Powder X-ray diffraction patterns of the NiMCM, NAM90 and NAM30 catalysts after reduction at 400 oC for 4 h. Characteristic signals of cubic NiO crystalline phase (ICDD card 01–071–1179) and cubic Ni crystalline phase (ICDD card 01–071–14655) are shown as black circles and blue triangles, respectively. Fig. 8 Fig. 9 HRTEM micrographs and Ni or NiO particle size distributions in the reduced catalysts: (a) NiMCM, (b) NAM120, (c) NAM90, (d) NAM60, and (e) NAM30. Fig. 9 Fig. 10 Concentrations of intermediate reaction products obtained in the HDO of anisole with NAM30 catalyst as a function of reaction time. CME, cyclohexyl methyl ether; CHL, cyclohexanol; BEN, benzene. Fig. 10 Fig. 11 Correlations between catalytic activity (a) and selectivity to cyclohexane (at 40% of anisole conversion) and total amount of acid sites (TAS). Fig. 11 Fig. 12 Anisole conversions obtained with the NAM90 catalysts used in three reaction cycles. Fig. 12 Scheme 1 Proposed reaction mechanism for the HDO of anisole over reduced Ni/Al-MCM-41 catalysts. Phenol (PHE) was not detected in the reaction products. AN, anisole; BEN, benzene; CHA, cyclohexane; CHE, cyclohexene; CHL, cyclohexanol; CME, cyclohexyl methyl ether, DCH, dicyclohexyl; M-CHA, methylcyclohexane; MCP, methylcyclopentane. Scheme 1 Scheme 2 Schematic representation of different reaction steps of anisole hydrodeoxygenation: (a) anisole demethylation on proximal metal-acid sites, (b) phenol hydrogenation on large metallic Ni nanoparticles (very quick step), (c) cyclohexanol dehydration on proximal metal-acid sites, and (d) anisole hydrogenation on large metallic Ni nanoparticles, (e) cyclohexyl methyl ether demethylation on proximal metal-acid active sites, (f) anisole demethoxylation on proximal metal-acid sites, and (g) benzene hydrogenation on large metallic particles. Scheme 2 Table 1 Chemical composition a , pore wall thickness b and textural characteristics c of synthesized (Al)-MCM-41 supports. Table 1 Sample Chemical composition (wt%) Theoretical Si/Al molar ratio δ(nm) Textural characteristics c SiO2 Al2O3 Si/Al molar ratio SBET (m2/g) VP (cm3/g) DP (nm) MCM-41 100 0 ∞ ∞ 1.7 1079 1.04 2.60 AM120 99.3 ± 0.08 0.7 ± 0.08 121 120 2.1 815 1.00 2.59 AM90 99.0 ± 0.05 1.0 ± 0.05 85 90 2.1 816 0.95 2.59 AM60 98.5 ± 0.04 1.5 ± 0.04 56 60 2.2 785 0.93 2.60 AM30 97.2 ± 0.13 2.8 ± 0.13 30 30 2.3 669 0.89 2.59 a Determined by SEM-EDX. b δ, pore wall thickness calculated as δ = a0 -DP, where a0, unit-cell parameter, (a 0 = (2/√3)×d 100 , being d 100 interplanar distance) and DP, pore diameter. c SBET, BET surface area; VP, total pore volume; DP, pore diameter. Table 2 Chemical composition a , pore wall thickness b , textural characteristics c , degree of reduction d and band gap energy e of calcined Ni/(Al)-MCM-41 catalysts. Table 2 Sample Ni loading(wt%) b δ(nm) Textural characteristics α Eg (eV) SBET (m2/g) VP (cm3/g) DP (nm) NiMCM 4.96 ± 0.48 1.7 833 0.77 2.60 0.99 3.66 NAM120 4.93 ± 0.32 2.1 736 0.90 2.60 0.75 3.71 NAM90 4.96 ± 0.18 2.1 734 0.87 2.61 0.86 3.71 NAM60 4.99 ± 0.27 2.2 719 0.86 2.60 0.85 3.73 NAM30 5.12 ± 0.40 2.3 609 0.83 2.63 0.96 3.70 a Determined by SEM-EDX. Theoretical Ni loading in the catalysts was 5 wt%. b δ, pore wall thickness calculated as δ = a0 -DP, where a0, unit-cell parameter, and DP, pore diameter. c SBET, BET surface area; VP, total pore volume; DP, pore diameter. d α, degree of reduction of NiO species determined by H2-TPR e Eg, band gap energy determined from DRS results by Tauc method. Table 3 Acidity of the calcined Ni/(Al)-MCM-41 catalysts determined by NH3-TPD. Table 3 Catalyst Amount of acid sites (μmol/g) Total amount of acid sites Weak(120–200 °C) Medium(200–400 °C) Strong(400–500 °C) (μmol/g) (μmol/m2) NiMCM 25.7 45.6 6.5 77.9 0.09 NAM120 53.5 133.6 9.6 196.7 0.27 NAM90 48.9 160.7 12.3 222.0 0.30 NAM60 55.5 182.4 8.8 246.7 0.34 NAM30 98.5 232.0 12.8 343.3 0.56 Table 4 Catalytic activity and selectivity of the Ni/(Al)-MCM-41 catalysts in HDO of anisole. Table 4 Catalyst Catalytic activity XAN a (%) SCHA b (%) SHDO c GCLPA(%) d Initial reaction rate Reaction rate constant r 0 × 10 3 (mol×L-1 ×gcat -1 ×s-1) k (h-1) k’× 10 3 (s-1 ×gcat -1) NiMCM 0.98 0.48 1.33 38.6 11.8 11.8 64.5 NAM120 1.67 1.19 3.31 95.5 97.5 100 58.3 NAM90 2.31 1.80 5.00 96.5 97.6 100 67.3 NAM60 1.94 1.55 4.31 96.1 96.3 100 65.8 NAM30 1.88 1.44 4.00 96.2 96.9 99.2 67.1 Ni/Al2O3 Reference 1.15 0.54 1.50 63.4 0.7 0.7 n. d. a XAN, anisole conversion at 6 h of the reaction time. b SCHA, selectivity to cyclohexane determined at 6 h of the reaction time according to Eq. 3: S CHA = (C CHA / ∑ C products )× 100%. c SHDO, selectivity to hydrodeoxygenated products determined at 6 h of the reaction time as S HDO = [(C CHA + C BEN + C MCP + C M-CHA + C DCH )/ ∑ C products ]× 100%, where C i is the concentration of the product i (%). CHA, cyclohexane; BEN, benzene; MCP, methylcyclopentane; M-CHA, methyl-cyclohexane; DCH, dicyclohexyl. d Gas chromatography liquid phase analysis (GCLPA) is a mass balance approximation for the liquid phase. Theoretical GCLPA considering complete transformation of anisole to cyclohexane is 77.8%. Table 5 Compositions of liquid reaction products obtained with different Ni/(Al)-MCM-41 catalysts in HDO of anisole. Table 5 Catalyst XAN (%) Reaction products (%) a CME/CHA ratio CME CHL CHE BEN CHA MCP M-CHA DCH NiMCM 38.6 b 34.0 - - - 4.6 - - - 7.39 NAM120 40.0 3.1 3.8 0.9 2.0 29.9 0.3 - - 0.10 95.5 b - - - 0.3 93.1 0.7 0.3 1.1 - NAM90 40.0 1.8 1.2 0.3 0.9 35.2 0.3 - 0.3 0.05 96.5 b - - - 0.1 94.2 0.8 0.3 1.1 - NAM60 40.0 2.4 2.2 0.5 0.9 33.5 0.2 - 0.3 0.07 96.1 b - - - 0.1 92.5 0.9 0.6 2.0 - NAM30 40.0 10.7 3.8 0.8 1.0 23.5 0.2 - - 0.46 96.2 b 0.9 - - - 93.2 0.8 0.3 1.0 0.01 a Methanol was also detected in liquid phase products. However, it was not quantified because of its high volatility. CME, cyclohexyl methyl ether; CHL, cyclohexanol; CHE, cyclohexene; CHA, cyclohexane; BEN, benzene; MCP, methylcyclopentane; M-CHA, methylcyclohexane; DCH, dicyclohexyl. b Anisole conversion at 6 h reaction time. Mesoporous Ni/Al-MCM-41 catalysts for highly active and selective hydrodeoxygenation of anisole to cyclohexane Luis H. Molina-Conde Methodology Investigation Writing – review & editing Suarez-Mendez Alejandro Suárez-Méndez Conceptualization Validation Writing – original draft Investigation Visualization Perez-Estrada Daniel E. Pérez-Estrada Investigation Writing – review & editing Tatiana E. Klimova Conceptualization Formal analysis Resources Writing – review & editing Supervision Project administration Funding acquisition ⁎ Laboratorio de Nanocatálisis, Departamento de Ingeniería Química, Facultad de Química, Universidad Nacional Autónoma de México (UNAM), Cd. Universitaria, Coyoacán, Ciudad de México 04510, Mexico Laboratorio de Nanocatálisis, Departamento de Ingeniería Química, Facultad de Química, Universidad Nacional Autónoma de México (UNAM) Cd. Universitaria, Coyoacán Ciudad de México 04510 Mexico Laboratorio de Nanocatálisis, Departamento de Ingeniería Química, Facultad de Química, Universidad Nacional Autónoma de México (UNAM), Cd. Universitaria, Coyoacán, Ciudad de México, 04510, México ⁎ Corresponding author. Ni/Al-MCM-41(x) catalysts were synthesized and tested in the hydrodeoxygenation of anisole as a model compound of bio-oil. Prepared catalysts behave as bifunctional metal-acid catalysts combining the metal function of the reduced Ni nanoparticles with the acid function of the Al-MCM-41 supports. Nickel loading in the catalysts was maintained constant (5 wt%), while Al content in the supports was varied (Si/Al molar ratios x = 120, 90, 60 and 30). The Ni/Al-MCM-41(x) catalysts showed significantly higher hydrodeoxygenation activities than the reference Ni/Al2O3 and the Ni/MCM-41 catalyst without Al. In addition, they showed high selectivity towards the formation of the deoxygenated products, with more than 96% selectivity to cyclohexane. The best activity and selectivity results were obtained with the Ni/Al-MCM-41(90) catalyst. This result was attributed to an optimum balance of metal and acid sites, both of which participate in different steps of anisole hydrodeoxygenation and generate a synergistic effect. Graphical Abstract ga1 Keywords Hydrodeoxygenation Bifunctional catalysts Nickel Al-MCM-41 Anisole Data Availability The authors do not have permission to share data. 1 Introduction Nowadays, the global demand for fossil fuels impacts directly on the petroleum reserves and increases CO2 emissions. Consequently, there is a social, political, and environmental interest in the development of alternative energy sources, which must be sustainable, efficient, and economically competent to substitute fossil fuels [1]. In this sense, biofuels are an alternative to be employed in conventional transport. Second-generation biofuels are the most promising because they are produced from non-edible low-cost lignocellulosic biomass, such as forest and agricultural waste, fast-growing trees, etc., and do not compete with food production [2]. There are different techniques to generate biofuels from lignocellulosic biomass, where fast pyrolysis is the most efficient. In this case, biomass is transformed to bio-oil by thermal decomposition at mild conditions (450–600 °C) with low residence time (1–2 s) in the absence of oxygen [3,4]. Bio-oil is a viscous liquid composed by a mixture of several compounds that include mainly aromatics with methoxy- and hydroxy- substituents [5]. High oxygen content in the obtained bio-oil (ca. 40 wt%) [6] makes it corrosive and with lower heating value in comparison with conventional fuels. Therefore, an upgrading process is required to reduce the oxygen content in bio-oil, such as catalytic hydrotreatment (HDT) [7]. Hydrodeoxygenation (HDO) is one of the HDT processes aimed especially at reducing oxygen content. It can be used to produce renewable fuels with similar properties to diesel or gasoline [8,9]. Conventional sulfided NiMo and CoMo catalysts can be used for HDO. However, they require a sulfur source to avoid the deactivation and, generally, they can contaminate the final products with sulfur [10–12]. Among other catalysts, supported noble metals (Rh, Pd, or Pt) have been widely studied for HDO; nevertheless, their large-scale application is non-viable because of a high cost [5,13]. On the other side, supported Ni catalysts are characterized by being non-expensive and able to carry out hydrogenation and hydrodeoxygenation reactions [4]. Different supports have been tested for these applications of Ni catalysts, e.g., silica, alumina [5], alumina-silica [14], other mixed oxides or mesoporous silica-based materials, such as SBA-15 and MCM-41 [15–17], which can be modified by introducing heteroatoms (Al, Ti, etc.) in their structure, to generate acid sites [18,19]. It is known that there is a synergistic relationship between the metal active phase and the acidity of the support, which improves the HDO performance of the catalysts. HDO generally occurs through different reaction routes, namely, i) direct deoxygenation (DDO), consisting in the hydrogenolysis of the C–O bond, and ii) the hydrogenation-deoxygenation route. In that way, supported Ni particles allow the hydrogenation reactions, while acid sites can promote the C–O bond cleavage through dehydration or acid cracking [4,5,7]. Particularly, MCM-41 is a mesostructured two-dimensional material with a high specific surface area (ca. 1000 m2/g), a pore diameter of 2–4 nm, a pore volume of ca. 1 cm3/g and excellent thermal and chemical stability [20,21]. MCM-41 and Al-MCM-41 materials have been widely used as supports or catalysts for different catalytic reactions [22–29]. However, there are just a few studies involving Al-MCM-41 as a Ni support for HDO. Recently, Nugraha et al. [30] studied deoxygenation of Reutealis trisperma oil over Ni/Al-MCM-41 catalysts at atmospheric pressure and under H2-free conditions. They found that NiO supported on Al-MCM-41 (up to 10 wt% loading) improved the Lewis acidity and enhanced the catalyst’s activity and selectivity toward hydrocarbons within the diesel range (C11-C18). Impregnation with 10 wt% of NiO on Al-MCM-41 also reduced the products from the cracking reaction, enhancing the yields of green diesel. Tran et al. [31,32] tested Ni/Al-MCM-41 (10 wt% of Ni) in vapor-phase hydrodeoxygenation of guaiacol under atmospheric hydrogen pressure at different temperatures (300, 350, and 400 °C). Even though the catalyst showed a good conversion of guaiacol to aromatics, high temperatures were required, which increased the selectivity to gas-phase compounds. A comparison of Ni and Co catalysts supported on Al-MCM-41 in guaiacol HDO [32] revealed that the Ni catalyst showed a ring opening activity, while Co favored the deoxygenation activity. Results showed the bifunctional character of the Co/Al-MCM-41 catalyst which conducted the HDO of guaiacol by a combination of acidic and metallic functions. The acidic sites of the Al-MCM-41 support catalyzed the demethylation and transalkylation reactions, while metallic Co catalyzed the deoxygenation through hydrogenolysis of Caromatic-OR bond. On the other hand, Taghvaei et al. [33] tested Ni supported on Al-MCM-41 with different Si/Al molar ratios (10, 20, 40, and 60) in the HDO of anisole at atmospheric hydrogen pressure. All the catalysts showed high activity and selectivity under selected reaction conditions being phenol and benzene the main reaction products. Saturated products were not observed, due to the low hydrogen pressure. It was also shown that both Ni and Al are important for high catalytic activity. The catalyst´s acidity contributed to the hydrogenolysis of anisole and transalkylation reaction, whereas metallic Ni sites were able to contribute to further hydrodeoxygenation of the intermediate compounds. All the above-mentioned studies on the use of Ni/Al-MCM-41 catalysts in HDO were performed at atmospheric hydrogen pressure and pointed out to a bifunctional character of these catalytic systems. Herein, we report results on the use of Ni catalysts supported on mesoporous Al-modified MCM-41 with different Si/Al molar ratios (from 30 to 120) in the HDO of anisole at 300 oC and high H2 pressure (4.8 MPa). In these reaction conditions, reaction product distributions were completely different from those reported previously. The supports and catalysts were characterized by different techniques in order to elucidate the role of the acidic and metallic active sites on the activity and selectivity of the synthesized catalysts. 2 Experimental 2.1 Synthesis of supports and catalysts 2.1.1 Chemicals Sodium hydroxide (NaOH, ≥ 97%), fumed silica (particle size 0.2–0.3 µm), tetraethylammonium hydroxide (TEAOH, 20% wt. in H2O,), aluminum chloride (AlCl3, 99%), nickel nitrate hexahydrate (Ni(NO3)2· 6 H2O, 99%,), anisole (99%), and hexadecane (99%) were purchased from Merck. Sulfuric acid (H2SO4, 95–98%) was purchased from J. K. Baker. Deionized water was used to prepare all solutions. 2.1.2 Synthesis of MCM-41 support The MCM-41 support was synthesized according to Méndez et al. [34]. In a conventional synthesis, a sodium silicate solution (Na2SiO3) was prepared by diluting 16 g of NaOH in 80 mL of deionized water, followed by the addition of 12 g of fumed silica. The suspension was heated at 70 °C to obtain a homogeneous solution, and then the mixture was cold down to room temperature, maintaining magnetic stirring (SOL-1). The second solution (SOL-2) is an aqueous micellar mixture of 5.9 g of TEAOH in 150 mL of deionized water, followed by the addition of 18.2 g of CTMAB under magnetic stirring. The SOL-1 was added dropwise to SOL-2, the pH was adjusted to 9 with a 10 M H2SO4 solution, and it was maintained under magnetic stirring for 2 h. The resulting mixture was matured at 104 °C for 24 h without stirring in a 1 L stainless steel autoclave. Subsequently, the obtained solid was filtered, washed with deionized water and ethanol, and dried for 24 h at room temperature. Finally, it was calcined at 550 °C in a static air atmosphere for 8 h (0.8 °C/min ramp). This support was labeled as MCM-41. 2.1.3 Synthesis of Al-MCM-41 supports To obtain Al-containing MCM-41 supports with desired Si/Al molar ratios, a third solution (SOL-3) was prepared by dissolving a corresponding amount of AlCl3 in 20 mL of deionized water. AlCl3 amounts used were 0.2241, 0.2983, 0.4483, and 0.8967 g for Si/Al molar ratios of 120, 90, 60 and 30, respectively). This solution was added dropwise to SOL-2 before the SOL-1 addition. Subsequently, the stirring, maturation, filtration, washing, drying, and calcination processes were realized as mentioned in the previous section. The Al-containing supports were labeled as AMx (AM120, AM90, AM60, and AM30 for Si/Al molar ratios (x) of 120, 90, 60, and 30, respectively). 2.1.4 Preparation of Ni catalysts The catalysts with a theoretical nickel loading of 5 wt% were prepared by the incipient wetness impregnation method, using an aqueous solution of Ni(NO3)2·6 H2O as a precursor. After impregnation, the catalysts were dried at room temperature for 24 h, then dried at 100 °C for 12 h (0.8 °C/min ramp), and finally calcined at 500 °C in a static air atmosphere for 2 h (3 °C/min ramp). The prepared catalysts were labeled as NiMCM, employing the MCM-41 support, and NAMx, using AMx supports with Si/Al molar ratios x = 120, 90, 60, and 30. 2.2 Characterization of supports and catalysts 2.2.1 Nitrogen physisorption The textural properties of supports and catalysts were determined on a Micromeritics 3FLEX automatic analyzer at liquid N2 temperature (−197.5 °C). Previously, the samples were degassed in a N2 flow at 270 °C for 12 h. The specific surface areas (SBET) were calculated by the Brunauer-Emmett-Teller (BET) method, the total pore volume (VP) was determined by the N2 adsorption at a relative pressure of 0.99, and pore diameter was determined from the adsorption isotherms by the Barrett-Joyner-Halenda (BJH) method. 2.2.2 X-ray diffraction Small-angle X-ray diffraction patterns were obtained at room temperature on a Bruker D8 Advance diffractometer using small divergence and scattering slits of 0.05°, using CuKα radiation of λ = 1.5406 Å in the range of 0.6–10° (2θ). The wide-angle X-ray diffraction patterns were recorded on a Siemens D5000 diffractometer with a goniometer speed of 1° (2θ)/min, in the range of 3–80° (2θ). The crystalline phases observed in the diffraction patterns were identified with the Powder Diffraction File (PDF) card number of the Joint Committee of Powder Diffraction Standards-International Center of Diffraction Data (JCPDS-ICDD) library. 2.2.3 UV-Vis diffuse reflectance spectroscopy (DRS) UV-Vis diffuse reflectance spectra of the supports and catalysts were recorded in the wavelength range of 200–800 nm on a Varian Cary 100 Conc. spectrophotometer equipped with a diffuse reflectance attachment. The reference material was polytetrafluoroethylene. 2.2.4 Elemental analysis Chemical composition of supports and catalysts was determined by Scanning Electron Microscopy coupled to an Energy-Dispersive X-ray analyzer (SEM-EDX) using a JEOL 5900 LV microscope with an OXFORD ISIS microanalyzer. 2.2.5 High resolution transmission electron microscopy (HRTEM) The morphological characteristics of the reduced catalysts were obtained by HRTEM using a JEOL 2010 microscope (resolving power 1.9 Å at 200 kV). The solids were ultrasonically dispersed in heptane and the suspension was collected on a carbon coated grids. HRTEM pictures were taken from different parts of the same sample disperse on the microscope grid. For each catalyst, about 300 particles of the reduced nickel were counted to obtain a frequency histogram of the Ni particle size. 2.2.6 Temperature-programmed reduction (H2-TPR) and temperature-programmed desorption of ammonia (NH3-TPD) Both H2-TPR and NH3-TPD analyses were performed on a Micromeritics AutoChem II 2920 automatic analyzer equipped with a thermal conductivity detector. Prior to H2-TPR experiments, the catalysts were pretreated at 500 °C for 2 h and cooled down to room temperature in an Ar stream. The temperature-programmed reduction of the catalysts was carried out from 25° to 1000 °C with a heating rate of 10 °C/min, under a stream of H2/Ar mixture (10:90 molar ratio, 50 mL/min flow). The consumption of H2 at different temperatures was recorded. For the temperature-programmed desorption of ammonia, the samples were pretreated in situ at 500 °C for 30 min in a He flow, in order to remove water and other contaminants. Then the samples were cooled to 120 °C and contacted with a He/NH3 mixture (90/10 mol/mol, 20 mL/min flow) for 30 min. The desorption step was performed with a pure He stream (50 mL/min flow) from 120 °C to 500 °C with a heating rate of 10 °C/min, keeping the final temperature until the trace reached the baseline. 2.3 Catalytic activity tests Prior to the catalytic activity tests in HDO of anisole, the catalysts were activated by an ex situ reduction process in a U-s haped glass flow reactor at 400 °C for 4 h, under a stream of H2/Ar (70:30 molar ratio) at atmospheric pressure. The HDO reactions were performed in a 300 mL stainless-steel batch reactor (Parr) equipped with a thermocouple, a mechanical stirrer, a pressure sensor, a gas entrainment impeller and a system for controlling temperature, stirring rate, and pressure. For each experiment, 50 mL of a 5 wt% solution of anisole in hexadecane and 0.1 g of the reduced Ni catalyst were loaded into the reactor. In order to prevent re-oxidation, the reduced catalyst was transferred into the reactor in Ar atmosphere. The sealed reactor was purged with pure N2 and H2 at room temperature to evacuate air, then pressurized with H2 to 3.3 MPa and heated to the reaction temperature. At the reaction temperature, the pressure increased to 4.8 MPa, and time and stirring (500 rpm) were initiated. The reactions were performed at 280 °C for 6 h. To monitor the reaction progress, liquid samples of the reaction mixture (∼0.5 mL) were collected from the reactor using a custom-made sampling system. The samples were taken every 15 min in the first hour, 30 min in the second hour, and finally, every hour until the reaction finished. The samples were analyzed in an Agilent 6890 gas chromatograph equipped with an FID detector and non-polar methyl siloxane HP-1 capillary column (50 mm × 0.32 mm inner diameter and 0.52 µm film thickness). The products were identified by mass spectroscopy on an Agilent 7890 A GC system equipped with a 5975 C MS detector. The concentrations of compounds in the mixture were calculated by the internal normalization method. For each compound in the mixture, its concentration C i is proportional to the area of its chromatographic peak multiplied to the corresponding sensitivity factor. Sensitivity factors were determined for anisole and the reaction products detected in the mixture by the external calibration procedure using corresponding neat reagents. The catalytic activity was determined by measuring the anisole concentration at different reaction times. The conversion of anisole (X AN ) was calculated by Eq. 1. (1) X AN = C AN 0 − C AN C AN 0 × 100 % Where C AN0 is the initial anisole concentration (mol L-1) and C AN is the concentration of anisole (mol L-1) at time t (h). Initial reaction rates (r 0 ) were determined as the slopes of the anisole conversion curves at initial reaction time. The reaction rate constants were calculated assuming that anisole HDO reactions are of pseudo-first order using Eq. 2, where k is the pseudo-first order reaction constant expressed in (h−1), X AN is fractional anisole conversion and t the reaction time (h). Data from the first hour reaction time were used for the k calculations (see Fig. S3, Supporting information). Fitting parameters of the linear plots shown in Fig. S3 (b) are shown in Table S1 . (2) − ln 1 − X AN = kt The selectivity to cyclohexane (S CHA ) was calculated by Eq. 3. (3) S CHA = C CHA ∑ C products × 100 % Where C i is the concentration of the product i (mol L-1) at time t. 3 Results and discussion 3.1 Characterization of supports and calcined catalysts 3.1.1 SEM-EDX characterization SEM-EDX results showed that the chemical compositions of AMx supports (Si/Al molar ratio, Table 1) were close to the theoretically expected ones. Thus, Al-containing MCM-41 supports with the Si/Al molar ratios equal to 121, 85, 56 and 30 were successfully synthesized, which corresponds well to the expected ratios in AM120, AM90, AM60 and AM30 materials. The chemical compositions of the Ni/(Al)-MCM-41 catalysts were also determined by SEM-EDX. In all the cases, the real metal loadings were very close to the theoretical one (5 wt% of Ni, Table 2). Elemental mapping images of Al and Ni are shown in Fig. 1. It was observed that both Al and Ni species showed a good dispersion and a homogeneous distribution in all calcined Ni catalysts. As expected, Al loading in the catalysts increases with decreasing Si/Al molar ratio in the corresponding supports. 3.1.2 N2 physisorption The N2 adsorption-desorption isotherms of the supports and catalysts are shown in Fig. 2(a and b, respectively). All the supports exhibit type IV isotherms corresponding to mesoporous materials with a notorious increase in the adsorbed volume at relative pressures (P/P0) between 0.25 and 0.35. This increase corresponds to the capillary condensation of liquid nitrogen in the mesopores of (Al)-MCM-41 supports, as reported by Lensveld et al. [35]. On the other hand, the absence of a hysteresis loop in this relative pressure interval points out to a very regular uniform pore size in the synthesized supports. Addition of aluminum to the MCM-41 silica support produced a decrease in the amount of adsorbed nitrogen, as well as the appearance of the type H3 hysteresis at relative pressures 0.45–1.0. This hysteresis can be ascribed to free spaces between the support’s particles and indicates that the addition of Al produced some changes in the particles size and shape. The physisorption isotherms of the Ni/(Al)-MCM-41 catalysts (Fig. 2b) have the same shape as those of the respective supports indicating that the characteristic mesoporous structure of the supports was maintained after the impregnation of nickel nitrate precursor and calcination. Both (Al)-MCM-41 supports and Ni/(Al)-MCM-41 catalysts showed very narrow pore size distributions centered at 26 Å (Fig. 2, c and d). The only difference is that in the catalysts, pore volume was smaller than that in the corresponding supports. To compare quantitatively the textural characteristics of materials, Tables 1 and 2 show the textural properties of the supports and catalysts, respectively. Pure silica MCM-41 showed the highest specific surface area (1079 m2/g), which decreased with aluminum incorporation and increasing in its loading, to 815, 816, 785, and 669 m2/g, for AM120, AM90, AM60, and AM30, respectively (Table 1). Similar trends were also observed for the total pore volume (VP) of the supports. The surface area and the total pore volume of the (Al)-MCM-41 supports significantly decreased after the addition of nickel (Table 2). The above decrease in the SBET and VP values was larger for the pure silica MCM-41 support (23% and 26%, respectively), while it was less notorious for the Al-containing samples, suggesting that Al incorporation to the MCM-41 supports improved the dispersion of Ni oxide species in the catalysts. A strong decrease in the specific textural characteristics of the MCM-41 after the addition of nickel may be due to pore obstruction by the agglomerated NiO particles. 3.1.3 X-ray diffraction Fig. 3 shows small-angle diffractograms (2θ = 0.6–10°) of the supports and catalysts. MCM-41 exhibits the typical peaks of the hexagonal arrangement of mesopores at 2.34, 4.09, and 4.72°(2θ), related to (1 0 0), (1 1 0), and (2 0 0) planes, respectively [36]. These signals are also presented in the patterns of Al-modified supports and catalysts, although they are slightly shifted to smaller 2θ degrees compared to the pure silica MCM-41, indicating an increase in the interplanar distances d 100 after the incorporation of aluminum. The above results demonstrate that the characteristic hexagonal pore structure of the MCM-41 was maintained after the incorporation of aluminum and nickel. Pore wall thickness (δ) of the supports and catalysts was calculated using the position of the main (1 0 0) reflection observed in small-angle XRD patterns and pore diameter (DP) found by N2 physisorption (Tables 1 and 2). For the MCM-41 and NiMCM materials, pore wall thickness was 1.7 nm, while the Al-containing supports and catalysts had a pore wall thickness between 2.1 and 2.3 nm. These results are in line with our previous observations [37], where the increment of the pore wall thickness was ascribed to the isomorphous substitution of Si atoms by larger Al atoms. The wide-angle X-ray diffraction patterns of supports and catalysts are shown in Fig. 4a and b, respectively. MCM-41 exhibits a wide peak at 15–40°(2θ), which is characteristic of amorphous silica. Other signals related to any crystalline phase of Al2O3 were not observed in the XRD patterns of the AMx supports, indicating a good dispersion of aluminum in the AMx materials. Calcined Ni/(Al)-MCM-41 catalysts, in addition to the wide peak of the amorphous (Al)-MCM-41 supports, presented the characteristic diffraction signals of cubic NiO crystalline phase at 37.34, 43.28, 62.86 and 75.39°(2θ), which correspond to its (1 1 1), (2 0 0), (2 2 0) and (3 1 1) planes, respectively (Fig. 4b). The intensity of the NiO signals decreased with Al incorporation to the MCM-41 support. Thus, the lowest intensity wide NiO signals were observed for the NAM120 catalyst. The size of the NiO crystallites in this catalyst estimated with the Scherrer equation was 6.8 nm, while for the NiMCM reference it was near 14.8 nm. However, a further increase in the Al loading in the AMx supports to x = 90, 60 and 30, resulted in some increase of NiO crystallite size to 9–13 nm. This can be a result of two opposite effects: on the one side, a dispersion of NiO species should increase due to their interaction with Al species in the supports [37], but on the other side, the specific surface areas of the AMx supports decrease with increasing Al loading (Table 1). 3.1.4 Diffuse reflectance spectroscopy UV-Vis diffuse reflectance spectra of the calcined Ni/(Al)-MCM-41 catalysts are shown in Fig. 5. All catalysts exhibit the three characteristic bands of Ni2+ in octahedral coordination. The band at ∼200–350 nm is associated with ligand to metal charge transfer (LMTC) from the 2p orbitals of O2– to Ni2+, where the shoulder at ∼255 nm is related to NiO with a smaller particle size than that of the band at ∼290 nm. The signals at 430 and 750 nm are related to electronic transitions of the d–d orbitals of the Ni2+. In addition, the band gap energies of the NiO species in Al-modified catalysts were 3.71 ± 0.02 eV (Table 2), which is larger than that of the NiMCM reference (3.66 eV). These results also corroborate a better dispersion of NiO species in the catalysts supported on Al-containing MCM-41 supports [38], in line with observations made by N2 physisorption (changes in SBET and VP values of supports and catalysts) and XRD. 3.1.5 Temperature-programmed reduction H2-TPR characterization of calcined catalysts was performed to obtain information about reducibility of nickel oxide species in the prepared Ni/(Al)-MCM-41 catalysts. The acquired reduction profiles are shown in Fig. 6. The thermogram of the NiMCM catalyst shows the presence of only one well-defined reduction peak with the maximum at 394 oC. This signal can be attributed to the reduction of NiO species in weak interaction with the silica support [35]. On the other side, the reduction profiles of the NAMx catalysts exhibit two signals, indicating the presence of Ni oxide species of different characteristics [35]. The first peak of H2 consumption at 365–382 °C is related to the reduction of large NiO nanoparticles dispersed on the external surface of the Al-MCM-41 supports of different chemical compositions, previously detected by XRD. These particles are in low metal-support interaction, their reduction temperature is similar to that of bulk NiO [26] and almost does not depend on the support’s Si/Al ratio. The second reduction peak can be attributed to the reduction of dispersed NiO species located inside the hexagonal mesopores of the Al-MCM-41 supports. These species are reduced at higher temperatures (450–502 oC) due to a stronger metal-support interaction. The exact position of the second reduction signal is sensitive to the supports’ Si/Al ratio and their textural characteristics (SBET). In the case of NAM120, NAM90, and NAM60 catalysts, the second reduction peak was located at 475–502 oC and its intensity was larger than that of the first low-temperature reduction signal. This points out to an increase in the proportion of dispersed NiO species inside the mesopores of AM120, AM90 and AM60 supports. This result once again confirms an increase in NiO dispersion on the Al-containing MCM-41 supports. The reduction profile of the NAM30 catalyst showed a change in the proportion of NiO species located inside and outside the mesopore structure of Al-MCM-41 support. In this case, a larger amount of NiO species were observed on the external surface of the support’s particles compared to other Al-containing supports. Probably, this is due to the lowest surface area of the AM30 support (Table 1). The degrees of reduction of Ni2+ oxide species (α) in the different catalysts are shown in Table 2. NiMCM and NAM30 catalysts showed higher degrees of reduction (0.99 and 0.96, respectively) than other NAMx catalysts (α = 0.75 – 0.86). According to the estimated values of α, the proportion of reduced NiO species in the Ni catalysts supported on Al-containing MCM-41 supports increased in the order: NAM120 < NAM60 ≈ NAM90 < NAM30. This order is well in line with the increase in the aluminum loading in the supports, which indicates that the hydrogen consumption increases when the Si/Al molar ratio decreases. 3.1.6 Temperature-programmed desorption of ammonia Acidity of the synthesized Ni/(Al)-MCM-41 catalysts was characterized by temperature-programmed desorption of ammonia (NH3-TPD). This method allows determining the amount and the strength of acid sites in solid samples without distinguishing the acid sites’ nature (Brønsted or Lewis). The obtained NH3-TPD profiles of the catalysts ( Fig. 7) were deconvoluted into three or four signals as a function of the desorption temperature (see Fig. S1, Supporting information). Thus, the low-temperature deconvolution peak (maximum between 120 and 200 °C) was assigned to weak acid sites; the medium-temperature wide signal with the maximum located between 250 and 300 °C was assigned to medium-strength acid sites, and the signals with maxima between 400 and 500 °C to strong acid sites. Results of the quantification of acid sites of different strengths in the catalysts are shown in Table 3. NiMCM exhibits predominantly weak and medium acid sites, with the lowest total amount of acid sites among all synthesized catalysts. Addition of Al to the MCM-41 support and increase in its loading resulted in a progressive increase in the total amount of acid sites in the catalysts, as well as in their surface density. According to the total acidity (calculated per gram or m2), the catalysts can be ordered as NiMCM < < NAM120 < NAM90 < NAM60 < NAM30. This is in line with previous publication [39]. From the above results it can be concluded that the modification of MCM-41 materials by the isomorphous substitution of Si by Al atoms, as expected, improved the acidic properties of the prepared Ni catalysts. However, a more detailed analysis of the behavior of acid sites of different strengths shows that the amounts of weak and medium-strength acid sites increase in line with Al content in the supports. On the other hand, the amount of strong acid sites shows a different behavior. Thus, the NAM90 and NAM30 catalysts show higher amounts of strong acid sites than other catalysts. This is probably related to two opposite effects. The first one is an increment of the thickness (δ) of the Al-MCM-41 walls with increasing Al loading (from 2.1 to 2.3 nm) and a decrease in the specific surface area, SBET (Tables 1 and 2). Strong acid sites are generally related to the presence of tetrahedral framework Al species (Al(Td)) located on the pore wall surface, and as a result only ∼10–15% of the present aluminum gives rise to the acid sites [40]. In thicker walls, the relative proportion of tetrahedral Al species inaccessible to the interaction with ammonia molecules increases with increasing contents of aluminum, and, thus, the amount of strong acid sites decreases. On the other hand, a decrease in the Si/Al ratio could produce an increase in the surface density of Al(Td) species and, therefore, an increase in the acidity. Amount and strength of acid sites in the Ni/(Al)-MCM-41 catalysts is expected to affect their performance in the HDO of anisole. 3.2 Characterization of reduced catalysts 3.2.1 Powder XRD characterization Prior to the catalytic activity tests, the prepared nickel catalysts were reduced at 400 °C for 4 h. Fig. 8 shows X-ray diffraction patterns of reduced Ni catalysts supported on MCM-41 silica and Al-containing AM90 and AM30 materials. The XRD pattern of the reduced NiMCM catalyst showed the presence of only one crystalline phase. Thus, three reflections at 44.7°, 52.1° and 76.8° (2θ) correspond to the reduced metallic Ni0 crystals (JCPDS-ICDD card 01–071–4655). No signals corresponding to the presence of some remaining NiO crystalline phase were observed for this sample after reduction. This result points out to the complete transformation of nickel oxide species to the reduced metallic Ni, in line with previous report [23]. According to the H2-TPR observations (Fig. 6) the maximum of the reduction temperature of NiO species in the NiMCM catalyst was found at 394 oC, a temperature slightly lower than that used in the present work for the reduction of the calcined catalysts (400 oC, 4 h). The crystal size of the metallic Ni nanoparticles in the reduced NiMCM catalyst was estimated with the Scherrer equation using the (1 1 1) reflection of Ni0 giving a value around 14 nm. On the other hand, XRD diffraction patterns of the reduced NAM90 and NAM30 catalysts showed the presence of both NiO and Ni crystalline phases. In addition to the most intense (1 1 1) reflection of metallic Ni at 44.7o (2θ), three other detected signals at 37.2°, 43.3° and 62.8° (2θ) are due to the presence of the NiO crystalline phase (JCPDS-ICDD card 01–071–1179). The relative proportions of the Ni and NiO phases in the reduced NAM90 and NAM30 samples seem to be different. Such an incomplete reduction of NiO species deposited on Al-containing MCM-41 materials could be attributed to a stronger metal-support interaction as shown by H2-TPR results. For the reduced NAM90 and NAM30 catalysts, the most intense reflections of Ni and NiO phases were overlapped. Because of this, the crystal size of Ni and NiO nanoparticles was estimated after deconvolution of (2 0 0) reflection of NiO phase located at 43.3o (2θ) and (1 1 1) reflection of metallic Ni at 44.7o (2θ) (Fig. S2, Supporting information). The size of Ni0 nanoparticles was 10.1 nm for the NAM90 and 10.5 nm for the NAM30, respectively. Therefore, the obtained results indicate an increase in the dispersion of metallic Ni on Al-containing supports in comparison with the NiMCM sample. Regarding the NiO crystal size, it was 7.5 nm and 7.6 nm for NAM90 and NAM30, respectively. 3.2.2 HRTEM characterization The HRTEM micrographs of the reduced catalysts are shown in Fig. 9. All materials exhibit the presence of nanoparticles as grey-black spots of different sizes. As shown by powder XRD of the reduced catalysts (Fig. 8), NiO species were completely reduced only in the NiMCM catalyst, while both Ni and NiO crystalline phases were coexisting in the NAM30 and NAM90 catalysts after reduction at 400 oC for 4 h. It is difficult to distinguish between Ni and NiO crystals in the HRTEM images shown in Fig. 9. The majority of the observed nanoparticles has the size larger than the pore channels of the (Al)-MCM-41 supports that points out to their location on the external surface of the mesoporous supports. Nevertheless, some very small Ni or NiO particles (ca. 2 nm) can also be observed inside the hexagonal mesopores (see white arrows indicating these particles). Therefore, the observations made by HRTEM confirm our previous conclusion based on the results from DRS and H2-TPR of calcined catalysts regarding coexistence of two types of nickel species in the catalysts: agglomerated species on the external surface and the dispersed ones inside the mesopores. Size distributions of reduced Ni or oxidized NiO nanoparticles are also shown in Fig. 9. The NiMCM catalyst has the widest particle size distribution with Ni particles between 2 and 34 nm size. The average value of Ni0 particle size in this catalyst is near 16 nm, which is the highest average size among all the studied catalysts. Catalysts supported on Al-containing MCM-41 materials, in general, show narrower size distributions (2–24 nm) with smaller average size of Ni0/NiO particles (between 10 and 12 nm). This result is in line with an increase in the dispersion of the NiO precursor in the calcined Ni/Al-MCM-41 catalysts compared to the NiMCM reference as it was detected by wide-angle XRD. Better dispersed NiO particles give rise to a smaller-size Ni particles in reduced catalysts. It should be mentioned that the size of the reduced Ni particles estimated by HRTEM is of the same order of magnitude as the size of NiO crystallites determined in the calcined catalysts by XRD using the Scherrer equation. Similar trends in the dispersion of NiO and Ni0 species were observed as a result of the addition of Al to the MCM-41 supports, namely, a better dispersion of both on Al-containing supports. It should be also mentioned that the ordered hexagonal mesopore structure of the (Al)-MCM-41 supports was maintained in all the catalysts after reduction treatment (see Fig. S3, supporting information). 3.3 Catalytic evaluation in HDO of anisole The catalytic activity of the reduced Ni/(Al)-MCM-41 catalysts was tested in the HDO of anisole upon the following reaction conditions: batch reactor, 280 °C, 4.8 MPa of H2 total pressure. A Ni/Al2O3 catalyst (5 wt% of Ni) was used as a reference for comparison purposes. Activities of the catalysts were compared based on the initial reaction rates of anisole consumption and pseudo-first order rate constants shown in Table 4. According to the initial reaction rates (r 0 ), the most active catalyst was NAM90, followed by NAM60, NAM30, NAM120, Ni/Al2O3 and, finally, the NiMCM without Al. Catalytic activity of the NAM90 catalyst in HDO was twice higher than that of the reference Ni/Al2O3 catalyst. The reaction rate constants (k) were calculated using the pseudo-first order kinetic model and anisole conversions obtained with different catalysts at the first hour reaction time (Fig. S4 and Table S1, Supporting information). The values of the constants k and k’ (Table 4) confirmed the same order of activity of the catalysts: NAM90 > NAM60 > NAM30 > NAM120 ≫ Ni/Al2O3 > NiMCM, demonstrating that there is a significant enhancement in the catalytic activity when the support is modified with aluminum. Thus, anisole conversions obtained at 6 h reaction time with all Ni/Al-MCM-41 catalysts (NAMx) were of about 96–97% (Table 4), while the less active NiMCM and Ni/Al2O3 catalysts resulted only in 38.6% and 63.4% of conversion, respectively. For comparison purposes, the obtained catalytic activity results were compared with those previously published in the literature. Thus, in work [17], Ni catalysts (10 wt% Ni) supported on SBA-15 silica and protonated titanate nanotubes were tested in anisole HDO upon the same reaction conditions as in the present study. Obtained reaction rate constants were between 0.56 and 1.49 h-1, which is smaller than the activity (k, Table 4) shown by the NAM90 and NAM60 catalysts with only 5 wt% of Ni. On the other hand, Ni catalyst supported on USY zeolite showed a first-order rate constant equal to 1.86 × 10-4 s-1 (0.67 h-1) in liquid phase HDO of anisole at a reaction temperature of 200 oC and 750 psi (5.2 MPa) pressure [41]. NiCu-SiO2 catalysts with a metal content of 90% and different Ni/Cu ratios were investigated in HDO of anisole at 280 oC and 6 MPa pressure [42]. The monometallic Ni-SiO2 catalyst showed k = 0.224 min-1 gcat -1 (3.73 ×10-3 s-1 ×gcat -1), which is smaller than the corresponding value of 5.00 × 10-3 s-1×gcat -1 found in the present work for the most active NAM90 catalyst. From the above information, it can be concluded that the Ni catalysts developed in the present work show similar o slightly better activities in HDO of anisole than the above samples. A mass balance approximation for the reactants and products present in the liquid phase was made by the Gas Chromatography Liquid Phase Analysis (GCLPA, Table 4). Gaseous and heavy products (oligomerization products and carbonaceous solids precursors of coke deposits on the surface and in the mesopores of the prepared NAMx catalysts) have not been quantified. As shown in Table 4, GCLPA values varied between 58.3% and 67.3% without a clear trend related to the amount of Al incorporated in the AMx support. According to the obtained GCLPA results, the formation of some coke (ca. 10–20 wt%) can be expected in all the catalysts tested in the present work. This is in line with the recent publications [25,43], where the formation of 12.8–21.7 wt% of coke was observed in the HDO of guaiacol over Pd-Co and Pd-Fe catalysts supported on Al-MCM-41 (flow reactor, 400 oC, ambient pressure). Coke formation was also observed during the methanol dehydration reaction over Al-MCM-41 nanospheres at 300 oC [22]. In addition to the above-mentioned effect of Al incorporation on the catalytic activity of Ni catalysts in HDO, notorious differences were observed in the reaction products obtained over the Al-containing NAMx catalysts and the NiMCM one. The product distributions obtained with different catalysts were compared at two levels of anisole conversion: at medium anisole conversion (40%; since maximum anisole conversion reached with the NiMCM catalyst at 6 h time was 38.6%) and at high anisole conversion (96–97%, final conversions obtained with the NAMx catalysts), Table 5. For the reference NiMCM catalyst without aluminum, the main reaction product was cyclohexyl methyl ether (CME) obtained by the hydrogenation of aromatic ring of anisole. The expected deoxygenated cyclohexane (CHA) product was formed only in a small amount (Table 5), being the CME/CHA ratio = 7.39. Modification of the MCM-41 support by the incorporation of aluminum resulted in a radical change in the reaction product composition. For all NAMx catalysts, cyclohexane became the main reaction product at both anisole conversions (Table 5). Other reaction intermediates (CME, cyclohexyl methyl ether; CHL, cyclohexanol; CHE, cyclohexene and BEN, benzene) were formed only in small amounts, being their content slightly higher for the NAM30 catalyst (Table 5). The CME/CHA ratios determined for the NAMx catalysts at 40% of anisole conversion were between 0.05 and 0.46. These results clearly illustrate the effect that Al loading to the MCM-41supports has on the selectivity of the Ni catalysts in HDO of anisole. The NAMx catalysts (x = 120, 90 and 60) demonstrated very high selectivity to CHA (96.3–97.6%) with 100% of selectivity to hydrodeoxygenated products (Table 4), which should be related to the presence of Al atoms in the MCM-41 supports providing acid sites in addition to the metallic Ni nanoparticles. It is well-known that the HDO process of oxygen-containing aromatic molecules has a complex mechanism with several reaction routes including direct deoxygenation, dehydration, hydrogenation, demethylation, and other reactions [44]. Some of these routes can be more or less important depending on the characteristics of the catalyst used. To inquire into the reaction mechanism of anisole HDO over the Ni/Al-MCM-41 catalysts used in the present work, composition of the reaction mixture was determined at different anisole conversions (Table 5). Cyclohexane is the final fully hydrogenated and deoxygenated product, which can be formed through a series of parallel and consecutive steps including the formation and consumption of different intermediate reaction products. Therefore, to assess the possible reaction mechanism, special attention was placed on the intermediate reaction products. The concentration profiles of these products pass through the maxima, while the concentrations of the final products increase with the reaction time. According to Table 5, at 40% of anisole conversion, in addition to cyclohexane (the main final product), the following products were identified: cyclohexyl methyl ether (CME), cyclohexanol (CHL), benzene (BEN), cyclohexene (CHE), methylcyclopentane (MCP) and dicyclohexyl (DCH). The concentrations of the last three products (CHE, MCP and DCH) were smaller than those of CME, CHL and BEN. The amounts of different detected products slightly changed depending on the catalyst used and the Si/Al ratio in the support. Thus, the NAM90 catalyst is the most selective towards cyclohexane production, while the NAM30 is the least selective. With increasing anisole conversion from 40 to 96–97%, concentrations of CME, CHL and BEN decrease, and at 6 h reaction time CME and CHL are not detected, while BEN can still be detected in a very small concentration. This allows us to consider these three products as intermediates, which are formed from anisole at the beginning of the reaction and then disappear giving rise to cyclohexane. CHE concentration shows similar behavior, but it was discarded as another intermediate product due to a very small concentration. On the contrary, concentration of MCP increases with the reaction time, as well as of other deoxygenated products (M-CHA, methylcyclohexane; and DCH, dicyclohexyl). Therefore, MCP, M-CHA and DCH can be considered as secondary products formed in small amounts (below 2%). Fig. 10 shows how the concentrations of the three intermediate compounds (CME, CHL and BEN) change in the reaction mixture with the reaction time in the HDO of anisole performed with the NAM30 catalyst. It can be noted that all three intermediates appear at the beginning of the reaction and their concentrations decrease similarly. All three intermediates show their maximum concentrations at the same reaction time (0.25 h), which clearly points out to their formation through three parallel reactions. This observation was taken into account to propose the plausible reaction mechanism of anisole hydrodeoxygenation in the presence of Ni/Al-MCM-41 catalysts ( Scheme 1). This mechanism consists of three parallel reaction routes. In the first one, anisole is converted to phenol through demethylation, and then phenol is hydrogenated to cyclohexanol, which finally suffers dehydration producing cyclohexane. Since phenol (PHE) was not detected in the reaction products, we consider that its transformation to cyclohexanol is very quick. In the second reaction route (Scheme 1), anisole is transformed to cyclohexyl methyl ether, which gives rise to cyclohexane. This reaction route is composed by consecutive reactions of hydrogenation of the aromatic ring in anisole and demethoxylation of cyclohexyl methyl ether. The third reaction route consists of the direct demethoxylation of anisole to benzene via the hydrogenolysis of Caromatic-O bond followed by hydrogenation of benzene to cyclohexane. The possibility of the direct transformation of anisole to benzene was reported previously in the literature [45–47], although the rupture of the Caliphatic-O bond is easier than that of the Caromatic-O bond according to the bond dissociation energies, which are around 80–100 kJ mol−1 higher for Caromatic-O bonds than those for Caliphatic-O bonds [48,49]. On the other hand, the steric constraints of cleaving Caliphatic-O bonds are much higher than for Caromatic-O bonds. The cyclohexene product (CHE) detected in small amounts (< 1%) could be formed according to this mechanism either through dehydration of cyclohexanol (CHL) or through demetoxylation of cyclohexyl methyl ether (CME). Some other secondary reaction products: methylcyclohexane (M-CHA), methylcyclopentane (MCP) and dicyclohexyl (DCH) also detected in small amounts at the end of the reaction (Table 5) could be formed on the acid sites of the Al-MCM-41 supports. 3.4 Effect of Al incorporation on the activity and selectivity of Ni catalysts in HDO of anisole In the present work, anisole hydrodeoxygenation was studied in the presence of bifunctional Ni/Al-MCM-41 catalysts (NAMx) with different Si/Al ratios (x = 30, 60, 90 and 120). Activity and selectivity results of these catalysts were compared with those obtained with a NiMCM reference without Al. The latter sample represents a monofunctional catalyst with only metallic function and a negligible amount of acid sites (Table 3). Anisole conversions obtained with all NAMx catalysts at 6 h reaction time were of about 96–97%, while the NiMCM catalyst resulted in only 38.6% conversion. Characterization results showed that the presence of Al in the AMx supports and its amount affect characteristics and dispersion of NiO in calcined catalysts and metallic Ni (NiO) nanoparticles in reduced catalysts. Thus, UV–vis DRS and TPR characterization of calcined Ni/Al-MCM-41 catalysts (Figs. 5 and 6) showed the presence of two types of NiO species: agglomerated ones located on the external surface of the support’s particles and small ones located inside the mesopores of the Al-MCM-41 materials. According to the TPR results, proportion of dispersed NiO species is larger in the catalysts supported on AM120, AM90 and AM60 materials. In line with this, HRTEM characterization of reduced catalysts also showed an increase in the proportion of small metallic Ni nanoparticles (ca. 2 nm) in the above catalysts, especially in the NAM90 (Fig. 7c) with the best catalytic activity (initial reaction rates and rate constants, Table 4). Therefore, the support’s Si/Al molar ratio also affects the dispersion and location of the catalytically active metallic Ni phase. An additional and more notorious effect of Al incorporation in the catalytic supports was detected in the reaction product selectivity. This effect consists in a strong acceleration of the reaction mechanism steps related to C-O bond hydrogenolysis (demethylation, dehydration and demethoxylation) leading to the formation of the final cyclohexane product. These reactions require activation of oxygen atom of the molecule (starting anisole or O-containing intermediate products), which results in a weakening of C-O bonds and their easier hydrogenolysis. According to Hsu et al. [50], this oxygen activation can be reached on an oxophilic promoter (i.e., FeO x , MoO x , and WO x ) added to the metallic Ni catalyst. Such bifunctional catalysts resulted to be effective in the deoxygenation of lignine derivatives (i.e., p-cresol) through direct deoxygenation due to a contact synergy. Alternatively, acid sites can also catalyze the cleavage of C-O bonds [51,52]. Since oxygen atoms have two free electron pairs, they can interact with Lewis or Brønsted acid sites. In the present work, the monofunctional NiMCM catalyst showed a very low selectivity to cyclohexane (CHA) being cyclohexyl methyl ether (CME) the main reaction product (Table 5). This catalyst possesses only reduced Ni nanoparticles as an active phase (Fig. 8), resulting in a good hydrogenation activity. However, the lack of acid sites does not promote the C–O cleavage, preventing the formation of the desired CHA product. On the contrary, NAMx catalysts were highly selective towards formation of fully hydrogenated and deoxygenated product, cyclohexane. This can be attributed to a bifunctional character of these catalysts and to the participation of both types of active sites at different steps of the reaction mechanism (Scheme 1). A similar increase in the selectivity to cyclohexane has been reported recently in hydrodeoxygenation of anisole over Pt/Al-SBA-15, a bifunctional metal-acid catalyst [51]. The introduction of acidity to the SBA-15 support promoted the demethoxylation of the methoxycyclohexane intermediate (called CME in the present work) with an increase in the selectivity to cyclohexane from 15% to 92%. The NAMx catalysts (x = 120, 90 and 60) prepared in the present work showed ever higher selectivity to cyclohexane (96.3–97.6%) along with 100% selectivity to deoxygenated products (Table 4). The best activity and selectivity results were obtained with the NAM90 catalyst with a rate constant k of 1.80 h-1, followed by NAM60, NAM30, and NAM120, and SCHA = 97.6% (Table 4). The NAM90 catalyst had the highest proportion of well-dispersed Ni nanoparticles inside the support’s mesopore channels (Fig. 8c), in addition to the relatively high amount of strong acid sites compared to NAM120 and NAM60 catalysts (Table 3). The presence of two types of reduced Ni nanoparticles in the NAMx catalysts, large particles (10–12 nm) on the external surface of MCM-41 supports and small ones (ca. 2 nm) located inside the mesopores, seems to be important for the catalytic activity and selectivity in HDO of anisole. In our previous work [17], it was observed for the Ni/SBA-15 catalysts prepared by different methods that the catalysts with the larger average Ni particle size (16.2 nm) showed higher activity in hydrogenation of anisole than those with small Ni particles (3.2 nm). Therefore, Ni nanoparticles of different sizes catalyze the hydrogenation of aromatic ring of anisole, but the large metallic Ni particles observed in the catalysts prepared in the present work should be more active. This is the first step of anisole HDO leading to the formation of cyclohexyl methyl ether ( Scheme 2 d). Other hydrogenation steps of the proposed reaction mechanism (Scheme 2 b, g) also take place on the reduced metal nanoparticles. On the other side, demethylation, dehydration and demethoxylation steps of the proposed reaction mechanism require participation of both metallic and acid active sites (Scheme 2 a, c, e, f). For the efficient performance, the Ni species and the acid sites should be proximal one to another, as reported by Song et al. [52]. This can be reached inside the catalyst’s mesopores, where well-dispersed Ni nanoparticles are located near the acid sites provided by the Al-containing MCM-41 support or non-reduced NiO species. Strong acid sites promote C-O bonds activation making easier the cleavage of C-O bonds, while metallic Ni nanoparticles provide dissociated hydrogen for the saturation of the ruptured bonds. Finally, it can be concluded that the excellent catalytic performance of the NAMx catalysts in HDO of anisole is due to a synergistic effect between the metallic Ni active phase and the acid sites of the AMx supports, which enhances the hydrogenation activity and the selectivity of the bifunctional NAMx catalysts to deoxygenated products. Thus, both activity and selectivity of the Ni/(Al)-MCM-41 catalysts passes through the maximum with an increase in the total amount of acid sites ( Fig. 11). It seems that the most active and selective NAM90 catalyst has the optimized metal-acid synergy and an appropriate proportion of large and small Ni nanoparticles. 3.5 Catalyst recycling The most active catalyst (NAM90) was tested in several catalytic cycles of anisole hydrodeoxygenation. After each reaction, the catalyst was separated by centrifugation and used again without any additional regeneration treatment. Obtained anisole conversions are shown in Fig. 12. It can be observed that anisole conversions decreased from 96.5% to 90.4% and 80.8% in the second and third catalytic cycles. The above decrease in the catalytic activity of the used NAM90 catalyst could be ascribed to some mass loss of the catalyst upon separation after each reaction cycle, and to deactivation due to coke formation. According to the obtained GCLPA results (Table 4), the formation of 10–20 wt% of coke could be expected in all the catalysts tested in the present work. Therefore, the recycling of the catalysts such as those used in the present study (NAMx) would require some additional regeneration treatment for coke removing [43]. On the other side, no leaching of the active Ni phase into the reaction mixture was detected. 4 Conclusions Al-modified mesoporous MCM-41 materials with different Si/Al ratios (120, 90, 60, and 30) were synthesized and used as supports of Ni catalysts tested in the HDO of anisole at 280 °C and 4.8 MPa of H2 pressure. The supports exhibited the typical pore structure of MCM-41 with a hexagonal array of mesopores. This pore arrangement was maintained in calcined and reduced Ni catalysts. The addition of Al to the MCM-41 support, in general, increases metal-support interaction (MSI) and improves dispersion of NiO and metallic Ni species in comparison with the all-silica MCM-41-supported samples. However, this strong MSI impedes the complete reduction of NiO species upon the used activation conditions (400 oC, 4 h). In addition, too high Al loading in the AMx support (Si/Al molar ratio of 30) produced a decrease of the specific textural characteristics of the AM30 support and an increment in the agglomeration of the deposited Ni species, as corroborated by XRD, TPR, and HRTEM. On the other side, the incorporation of Al in the silica MCM-41 supports generated acid sites of different strengths, leading to the bifunctional metal-acid catalysts. The total amount of acid sites in the NAMx catalysts increases with increasing Al loading in the AMx supports, while the amount of strong acid sites does not follow this tendency. The NAM90 and NAM30 catalysts exhibited larger amounts of strong acid sites than other catalysts. All synthesized NAMx catalysts showed a significantly improved performance in HDO of anisole compared to the Al-free NiMCM analog and the Ni/Al2O3 reference. The presence of acid sites had a beneficial effect on both activity and selectivity of the Ni catalysts. This can be attributed to a bifunctional character of these catalysts combining metal and acid active sites and to a synergistic effect among them. The NAM90 catalyst presented the best activity and selectivity to cyclohexane, fully hydrogenated and deoxygenated product. It seems that this catalyst has the optimized metal-acid synergy. However, when the NAM90 catalyst was tested in three subsequent catalytic cycles, a decrease in the catalytic activity was observed. This deactivation could be ascribed to coke formation, and therefore, coke elimination is needed for repeated catalyst use. Also, a further search for Al-MCM-41-supported catalysts with improved resistance to coke formation is desirable. CRediT authorship contribution statement Luis H. Molina-Conde: Methodology, Investigation, Writing – review & editing. Alejandro Suárez-Méndez: Conceptualization, Validation, Writing – original draft, Investigation, Visualization. Daniel E. Pérez-Estrada: Investigation, Writing - review & editing. Tatiana E. Klimova: Conceptualization, Formal analysis, Resources, Writing – review & editing, Supervision, Project administration, Funding acquisition. Declaration of Competing Interest The authors declare that they have no known competing financial interests or personal relationships that could have appeared to influence the work reported in this paper. Acknowledgments This work was supported by Dirección General de Asuntos de Personal Académico – Universidad Nacional Autónoma de México, DGAPA-UNAM, México [grant IN-114121]. LHMC acknowledges CONACYT-México for scholarship No. 798446 through CVU 995029. The authors thank I. Puente Lee, C. Salcedo Luna and A. Morales Espino for performing characterization of supports and catalysts by electron microscopy, powder XRD and small-angle XRD, respectively. Appendix A Supporting information Supplementary data associated with this article can be found in the online version at doi:10.1016/j.apcata.2023.119313. Appendix A Supplementary material Supplementary material . References [1] A. Demırbas Energy Sources Part B: Econ. Plan. Policy 12 2017 47 55 10.1080/15567249.2014.966926 A. Demırbas, Energy Sources, Part B: Economics, Planning, and Policy 12 (2017) 47–55. https://doi.org/10.1080/15567249.2014.966926 [2] I.L. García Handbook of biofuels production Handbook of Biofuels Production 2016 Elsevier 85 118 10.1016/B978-0-08-100455-5.00005-9 I.L. García, in: Handbook of Biofuels Production, Elsevier, 2016: pp. 85–118. https://doi.org/10.1016/B978–0-08–100455-5.00005–9 [3] X. Chen Q. Che S. Li Z. Liu H. Yang Y. Chen X. Wang J. Shao H. Chen Fuel Process. Technol. 196 2019 106180 10.1016/j.fuproc.2019.106180 X. Chen, Q. Che, S. Li, Z. Liu, H. Yang, Y. Chen, X. Wang, J. Shao, H. Chen, Fuel Process. Tech. 196 (2019) 106180. https://doi.org/10.1016/j.fuproc.2019.106180 [4] M.M. Ambursa J.C. Juan Y. Yahaya Y.H. Taufiq-Yap Y.C. Lin H.V. Lee Renew. Sustain Energy Rev. 138 2021 110667 10.1016/j.rser.2020.110667 M.M. Ambursa, J.C. Juan, Y. Yahaya, Y.H. Taufiq-Yap, Y.C. Lin, H.V. Lee, Renew. Sust. Ener. Rev. 138 (2021) 110667. https://doi.org/10.1016/j.rser.2020.110667 [5] M.E. Martínez-Klimov P. Mӓki-Arvela D.Y. Murzin Catalysis 33 2021 181 213 10.1039/9781839163128-00181 M.E. Martínez-Klimov, P. Mӓki-Arvela, D.Y. Murzin, Catalysis, 33 (2021) 181–213. DOI: 10.1039/9781839163128–00181. [6] B. Valle A. Remiro N. García-Gómez A.G. Gayubo J. Bilbao J. Chem. Tech. Biotechnol. 94 2019 670 689 10.1002/jctb.5758 B. Valle, A. Remiro, N. García-Gómez, A.G. Gayubo, J. Bilbao, J. Chem. Tech. Biotech. 94 (2019) 670–689. https://doi.org/10.1002/jctb.5758 [7] P.M. Mortensen J.-D. Grunwaldt P.A. Jensen K.G. Knudsen A.D. Jensen Appl. Catal. A: Gen. 407 2011 1 19 10.1016/j.apcata.2011.08.046 P.M. Mortensen, J.-D. Grunwaldt, P.A. Jensen, K.G. Knudsen, A.D. Jensen, Appl. Catal. A: Gen. 407 (2011) 1–19. https://doi.org/10.1016/j.apcata.2011.08.046 [8] C. Ochoa-Hernández Y. Yang P. Pizarro V.A. de la Peña O’Shea J.M. Coronado D.P. Serrano Catal. Today 210 2013 81 88 10.1016/j.cattod.2012.12.002 C. Ochoa-Hernández, Y. Yang, P. Pizarro, V.A. de la Peña O’Shea, J.M. Coronado, D.P. Serrano, Catal. Today 210 (2013) 81–88. https://doi.org/10.1016/j.cattod.2012.12.002 [9] L. Qu X. Jiang Z. Zhang X. Zhang G. Song H. Wang Y. Yuan Y. Chang Green. Chem. 23 2021 9348 9376 10.1039/D1GC03183J L. Qu, X. Jiang, Z. Zhang, X. Zhang, G. Song, H. Wang, Y. Yuan, Y. Chang, Green Chem. 23 (2021) 9348–9376. https://doi.org/10.1039/D1GC03183J [10] M. Toba Y. Abe H. Kuramochi M. Osako T. Mochizuki Y. Yoshimura Catal. Today 164 2011 533 537 10.1016/j.cattod.2010.11.049 M. Toba, Y. Abe, H. Kuramochi, M. Osako, T. Mochizuki, Y. Yoshimura, Catal. Today. 164 (2011) 533–537. https://doi.org/10.1016/j.cattod.2010.11.049 [11] V.N. Bui D. Laurenti P. Afanasiev C. Geantet Appl. Catal. B: Environ. 101 2011 239 245 10.1016/j.apcatb.2010.10.025 V.N. Bui, D. Laurenti, P. Afanasiev, C. Geantet, Appl. Catal. B: Env. 101 (2011) 239–245. https://doi.org/10.1016/j.apcatb.2010.10.025. [12] L. Kaluža J. Karban D. Gulková React. Kinet. Mech. Catal. 127 2019 887 902 10.1007/s11144-019-01620-x L. Kaluža, J. Karban, D. Gulková, Reac. Kinet. Mech. Catal. 127 (2019) 887–902. https://doi.org/10.1007/s11144–019-01620-x. [13] A. Gutierrez R.K. Kaila M.L. Honkela R. Slioor A.O.I. Krause Catal. Today 147 2009 239 246 10.1016/j.cattod.2008.10.037 A. Gutierrez, R.K. Kaila, M.L. Honkela, R. Slioor, A.O.I. Krause, Catal. Today 147 (2009) 239–246. https://doi.org/10.1016/j.cattod.2008.10.037 [14] F. Broglia L. Rimoldi D. Meroni S. de Vecchi M. Morbidelli S. Ardizzone Fuel 243 2019 501 508 10.1016/j.fuel.2019.01.157 F. Broglia, L. Rimoldi, D. Meroni, S. de Vecchi, M. Morbidelli, S. Ardizzone, Fuel 243 (2019) 501–508. https://doi.org/10.1016/j.fuel.2019.01.157 [15] H. Lee E.-B. Cho S.-C. Jung S.C. Kim Y.-K. Park J. Nanosci. Nanotechnol. 20 2020 5738 5741 10.1166/jnn.2020.17640 H. Lee, E.-B. Cho, S.-C. Jung, S.C. Kim, Y.-K. Park, J. Nanosci. Nanotech. 20 (2020) 5738–5741. https://doi.org/10.1166/jnn.2020.17640 [16] Y. Shi C. Liu J. Zhuo Q. Yao ACS Omega 5 2020 20299 20310 10.1021/acsomega.0c02205 Y. Shi, C. Liu, J. Zhuo, Q. Yao, ACS Omega 5 (2020) 20299–20310. https://doi.org/10.1021/acsomega.0c02205 [17] H. Vargas-Villagrán M.A. Flores-Villeda I. Puente-Lee D.A. Solís-Casados A. Gómez-Cortés G. Díaz-Guerrero T.E. Klimova Catal. Today 349 2020 26 41 10.1016/j.cattod.2018.07.057 H. Vargas-Villagrán, M.A. Flores-Villeda, I. Puente-Lee, D.A. Solís-Casados, A. Gómez-Cortés, G. Díaz-Guerrero, T.E. Klimova, Catal. Today 349 (2020) 26–41. https://doi.org/10.1016/j.cattod.2018.07.057 [18] L. Feng X. Li Z. Wang B. Liu Bioresour. Technol. 323 2021 124569 10.1016/j.biortech.2020.124569 Feng, L., Li, X., Wang, Z., Liu, B. Bioresource Tech. 323 (2021) 124569. https://doi.org/10.1016/j.biortech.2020.124569 [19] M.M. Ambursa L.H. Voon J.J. Ching Y. Yahaya J.N. Appaturi Fuel 236 2019 236 243 10.1016/j.fuel.2018.08.162 M.M. Ambursa, L.H. Voon, J.J. Ching, Y. Yahaya, J.N. Appaturi, Fuel 236 (2019) 236–243. https://doi.org/10.1016/j.fuel.2018.08.162 [20] H. Kosslick G. Lischke B. Parlitz W. Storek R. Fricke Appl. Catal. A: Gen. 184 1999 49 60 10.1016/S0926-860X(99)00078-2 H. Kosslick, G. Lischke, B. Parlitz, W. Storek, R. Fricke, Appl. Catal. A: Gen. 184 (1999) 49–60. https://doi.org/10.1016/S0926–860X(99)00078–2 [21] A.G. Gebretatios A.R.K.K. Pillantakath T. Witoon J.-W. Lim F. Banat C.K. Cheng Chemosphere 310 2023 136843 10.1016/j.chemosphere.2022.136843 A.G. Gebretatios, A.R.K.K. Pillantakath, T. Witoon, J.-W. Lim, F. Banat, C.K. Cheng, Chemosphere 310 (2023) 136843. https://doi.org/10.1016/j.chemosphere.2022.136843 [22] J.C. Bedoya R. Valdez L. Cota M.A. Alvarez-Amparán A. Olivas Catal. Today 388–389 2022 55 62 10.1016/j.cattod.2021.01.010 J.C. Bedoya, R. Valdez, L. Cota, M.A. Alvarez-Amparán, A. Olivas, Catal. Today 388–389 (2022) 55–62. https://doi.org/10.1016/j.cattod.2021.01.010 [23] C. Ding J. Wang Y. Li Q. Ma L. Ma J. Guo Z. Ma P. Liu K. Zhang Catalysts 9 2019 606 10.3390/catal9070606 C. Ding, J. Wang, Y. Li, Q. Ma, L. Ma, J. Guo, Z. Ma, P. Liu, K. Zhang, Catalysts 9 (2019) 606. doi:10.3390/catal9070606 [24] M. Hachemaoui C.B. Molina C. Belver J. Bedia A. Mokhtar R. Hamacha B. Boukoussa Catalysts 11 2021 219 10.3390/catal11020219 M. Hachemaoui, C.B. Molina, C. Belver, J. Bedia, A. Mokhtar, R. Hamacha, B. Boukoussa, Catalysts 2021, 11, 219. https://doi.org/10.3390/catal11020219 [25] N.T.T. Tran Y. Uemura A. Ramli T.H. Trinh Mol. Catal. 523 2022 111435 10.1016/j.mcat.2021.111435 N.T.T. Tran, Y. Uemura, A. Ramli, T.H. Trinh, Molec. Catal. 523 (2022) 111435. https://doi.org/10.1016/j.mcat.2021.111435 [26] L. Brahmia T. Ali-Dahmane R. Hamacha S. Hacini J. Mol. Catal. A: Chem. 423 2016 31 40 10.1016/j.molcata.2016.06.004 L. Brahmia, T. Ali-Dahmane, R. Hamacha, S. Hacini, J. Molec. Catal. A: Chem. 423 (2016) 31–40. http://dx.doi.org/10.1016/j.molcata.2016.06.004 [27] S. Chen Z. Xu D. Tan D. Pan X. Cui Y. Qiao R. Li Appl. Organo Chem. 34 2020 e5396 10.1002/aoc.5396 S. Chen, Z. Xu, D. Tan, D. Pan., X. Cui, Y. Qiao, R. Li, Appl. Organometal. Chem. 34 (2020) e5396. https://doi.org/10.1002/aoc.5396 [28] R. Viscardi V. Barbarossa R. Maggi F. Pancrazzi Key Eng. Mater. 894 2021 45 49 10.4028/www.scientific.net/KEM.894.45 R. Viscardi, V. Barbarossa, R. Maggi, F. Pancrazzi, Key Eng. Mater. 894 (2021) 45–49. doi:10.4028/www.scientific.net/KEM.894.45 [29] S. Dehghani M. Haghighi Ultrason. – Sonochem. 54 2019 142 152 10.1016/j.ultsonch.2019.02.005 S. Dehghani, M. Haghighi, Ultrason. – Sonochem. 54 (2019) 142–152. https://doi.org/10.1016/j.ultsonch.2019.02.005 [30] R.E. Nugraha D. Prasetyoko H. Bahruji S. Suprapto N. Asikin-Mijan T.P. Oetami A.A. Jalil D.-V.N. Vo Y.H. Taufiq-Yap RSC Adv. 11 2021 21885 21896 10.1039/D1RA03145G R.E. Nugraha, D. Prasetyoko, H. Bahruji, S. Suprapto, N. Asikin-Mijan, T.P. Oetami, A.A. Jalil, D.-V.N. Vo, Y.H. Taufiq-Yap, R.S.C. Adv. 11 (2021) 21885–21896. https://doi.org/10.1039/D1RA03145G [31] N.T.T. Tran Y. Uemura A. Ramli Procedia Eng. 148 2016 1252 1258 10.1016/j.proeng.2016.06.488 N.T.T. Tran, Y. Uemura, A. Ramli, Procedia Eng. 148 (2016) 1252–1258. https://doi.org/10.1016/j.proeng.2016.06.488 [32] N.T.T. Tran Y. Uemura S. Chowdhury A. Ramli Appl. Catal. A: Gen. 512 2016 93 100 10.1016/j.apcata.2015.12.021 N.T.T. Tran, Y. Uemura, S. Chowdhury, A. Ramli, Appl. Catal. A: Gen. 512 (2016) 93–100. http://dx.doi.org/10.1016/j.apcata.2015.12.021 [33] H. Taghvaei A. Moaddeli A. Khalafi-Nezhad A. Iulianelli Fuel 293 2021 120493 10.1016/j.fuel.2021.120493 H. Taghvaei, A. Moaddeli, A. Khalafi-Nezhad, A. Iulianelli, Fuel. 293 (2021) 120493. https://doi.org/10.1016/j.fuel.2021.120493 [34] F.J. Méndez E. Bastardo-González P. Betancourt L. Paiva J.L. Brito Catal. Lett. 143 2013 93 100 10.1007/s10562-012-0933-y F.J. Méndez, E. Bastardo-González, P. Betancourt, L. Paiva, J.L. Brito, Catal. Lett. 143 (2013) 93–100. https://doi.org/10.1007/s10562–012-0933-y [35] D.J. Lensveld J. Gerbrand Mesu A. Jos van Dillen K.P. de Jong Microporous Mesoporous Mater. 44–45 2001 401 407 10.1016/S1387-1811(01)00214-1 D.J. Lensveld, J. Gerbrand Mesu, A. Jos van Dillen, K.P. de Jong, Micropor. Mesopor. Mater. 44–45 (2001) 401–407. https://doi.org/10.1016/S1387–1811(01)00214–1 [36] V.B. Fenelonov V.N. Romannikov A.Yu Derevyankin Microporous Mesoporous Mater. 28 1999 57 72 10.1016/S1387-1811(98)00280-7 V.B. Fenelonov, V.N. Romannikov, A.Yu Derevyankin, Micropor. Mesopor. Mater. 28 (1999) 57–72. https://doi.org/10.1016/S1387–1811(98)00280–7 [37] T. Klimova M. Calderón J. Ramírez Appl. Catal. A: Gen. 240 2003 29 40 10.1016/S0926-860X(02)00417-9 T. Klimova, M. Calderón, J. Ramírez, Appl. Catal A: Gen. 240 (2003) 29–40. https://doi.org/10.1016/S0926–860X(02)00417–9 [38] S. Thota J.H. Shim M.S. Seehra J. Appl. Phys. 114 2013 214307 10.1063/1.4838915 S. Thota, J.H. Shim, M.S. Seehra, J. Appl. Phys. 114 (2013) 214307. https://doi.org/10.1063/1.4838915 [39] H. Kosslick G. Lischke B. Parlitz W. Storek R. Fricke Appl. Catal. A: Gen. 184 1999 49 60 10.1016/S0926-860X(99)00078-2 H. Kosslick, G. Lischke, B. Parlitz, W. Storek, R. Fricke, Appl. Catal A: Gen. 184 (1999) 49–60. https://doi.org/10.1016/S0926–860X(99)00078–2 [40] R. Locus D. Verboekend R. Zhong K. Houthoofd T. Jaumann S. Oswald L. Giebeler G. Baron B.F. Sels Chem. Mater. 28 2016 7731 7743 10.1021/acs.chemmater.6b02874 R. Locus, D. Verboekend, R. Zhong, K. Houthoofd, T. Jaumann, S. Oswald, L. Giebeler, G. Baron, B.F. Sels, Chem. Mater. 28 (2016) 7731–7743. https://doi.org/10.1021/acs.chemmater.6b02874 [41] D.P. Gamliel S. Karakalos J.A. Valla Appl. Catal. A: Gen. 559 2018 20 29 10.1016/j.apcata.2018.04.004 D.P. Gamliel, S. Karakalos, J.A. Valla, Appl. Catal. A: Gen. 559 (2018) 20–29. https://doi.org/10.1016/j.apcata.2018.04.004 [42] A.A. Smirnov S.A. Khromova O.A. Bulavchenko V.V. Kaichev A.A. Saraev S.I. Reshetnikov M.V. Bykova L.I. Trusov V.A. Yakovlev Kinet. Catal. 55 2014 69 78 10.1134/S0023158414010145 A.A. Smirnov, S.A. Khromova, O.A. Bulavchenko, V.V. Kaichev, A.A. Saraev, S.I. Reshetnikov, M.V. Bykova, L.I. Trusov, V.A. Yakovlev, Kinetics Catal. 55 (2014) 69–78. DOI:10.1134/S0023158414010145 [43] N. Tran Y. Uemura T. Trinh A. Ramli Processes 9 2021 430 10.3390/pr9030430 N. Tran, Y. Uemura, T. Trinh, A. Ramli, Processes 9 (2021) 430. https://doi.org/10.3390/pr9030430 [44] M. Saidi F. Samimi D. Karimipourfard T. Nimmanwudipong B.C. Gates M.R. Rahimpour Energy Environ. Sci. 7 2014 103 129 10.1039/c3ee43081b M. Saidi, F. Samimi, D. Karimipourfard, T. Nimmanwudipong, B.C. Gates, M.R. Rahimpour, Ener. Env. Sci. 7 (2014) 103–129. DOI: 10.1039/c3ee43081b [45] W. Li F. Li H. Wang M. Liao P. Li J. Zheng C. Tu R. Li Mol. Catal. 480 2020 110642 10.1016/j.mcat.2019.110642 W. Li, F. Li, H. Wang, M. Liao, P. Li, J. Zheng, C. Tu, R. Li, Molec. Catal. 480 (2020) 110642. https://doi.org/10.1016/j.mcat.2019.110642 [46] F. Li X. Wang Y. Zheng J. Chen J. Fuel Chem. Technol. 46 2018 75 83 10.1016/S1872-5813(18)30005-7 F. Li, X. Wang, Y. Zheng, J. Chen, J. Fuel Chem. Technol. 46 (2018) 75–83. https://doi.org/10.1016/S1872–5813(18)30005–7 [47] M. Yusuf G. Leeke J. Wood Energy Fuels 37 2023 1225 1237 10.1021/acs.energyfuels.2c03734 M. Yusuf, G. Leeke, J. Wood, Energy Fuels 37 (2023) 1225−1237. https://doi.org/10.1021/acs.energyfuels.2c03734 [48] K. Li R. Wang J. Chen (dx.doi.org/) Energy Fuels 25 2011 854 863 10.1021/ef101258j K. Li, R. Wang, J. Chen, Energ. Fuel 25 (2011) 854–863. dx.doi.org/10.1021/ef101258j [49] E. Furimsky Appl. Catal. A 199 2000 147 190 10.1016/S0926-860X(99)00555-4 E. Furimsky, Appl. Catal. A 199 (2000) 147–190. https://doi.org/10.1016/S0926–860X(99)00555–4 [50] P.-J. Hsu J.-W. Jiang Y.-C. Lin ACS Sustain. Chem. Eng. 6 2018 660 667 10.1021/acssuschemeng.7b03010 P.-J. Hsu, J.-W. Jiang, Y.-C. Lin, ACS Sust. Chem. Eng. 6 (2018) 660–667. https://doi.org/10.1021/acssuschemeng.7b03010 [51] A. Shivhare J.A. Hunns L.J. Durndell C.M.A. Parlett M.A. Isaacs A.F. Lee K. Wilson ChemSusChem 13 2020 4945 4953 10.1002/cssc.202000764 A. Shivhare, J.A. Hunns, L.J. Durndell, C.M.A. Parlett, M.A. Isaacs, A.F. Lee, K. Wilson, ChemSusChem. 13 (2020) 4945–4953. https://doi.org/10.1002/cssc.202000764 [52] W. Song Y. Liu E. Baráth C. Zhao J.A. Lercher Green Chem. 17 2015 1204 1218 10.1039/C4GC01798F W. Song, Y. Liu, E. Baráth, C. Zhao, J.A. Lercher, Green Chem. 17 (2015) 1204–1218. https://doi.org/10.1039/C4GC01798F",
      "scopus-id": "85164298624",
      "coredata": {
        "eid": "1-s2.0-S0926860X23002934",
        "dc:description": "Ni/Al-MCM-41(x) catalysts were synthesized and tested in the hydrodeoxygenation of anisole as a model compound of bio-oil. Prepared catalysts behave as bifunctional metal-acid catalysts combining the metal function of the reduced Ni nanoparticles with the acid function of the Al-MCM-41 supports. Nickel loading in the catalysts was maintained constant (5 wt%), while Al content in the supports was varied (Si/Al molar ratios x = 120, 90, 60 and 30). The Ni/Al-MCM-41(x) catalysts showed significantly higher hydrodeoxygenation activities than the reference Ni/Al2O3 and the Ni/MCM-41 catalyst without Al. In addition, they showed high selectivity towards the formation of the deoxygenated products, with more than 96% selectivity to cyclohexane. The best activity and selectivity results were obtained with the Ni/Al-MCM-41(90) catalyst. This result was attributed to an optimum balance of metal and acid sites, both of which participate in different steps of anisole hydrodeoxygenation and generate a synergistic effect.",
        "openArchiveArticle": "false",
        "prism:coverDate": "2023-08-05",
        "openaccessUserLicense": null,
        "prism:aggregationType": "Journal",
        "prism:url": "https://api.elsevier.com/content/article/pii/S0926860X23002934",
        "dc:creator": [
          {
            "@_fa": "true",
            "$": "Molina-Conde, Luis H."
          },
          {
            "@_fa": "true",
            "$": "Suárez-Méndez, Alejandro"
          },
          {
            "@_fa": "true",
            "$": "Pérez-Estrada, Daniel E."
          },
          {
            "@_fa": "true",
            "$": "Klimova, Tatiana E."
          }
        ],
        "link": [
          {
            "@_fa": "true",
            "@rel": "self",
            "@href": "https://api.elsevier.com/content/article/pii/S0926860X23002934"
          },
          {
            "@_fa": "true",
            "@rel": "scidir",
            "@href": "https://www.sciencedirect.com/science/article/pii/S0926860X23002934"
          }
        ],
        "dc:format": "application/json",
        "openaccessType": null,
        "pii": "S0926-860X(23)00293-4",
        "prism:volume": "663",
        "articleNumber": "119313",
        "prism:publisher": "Elsevier B.V.",
        "dc:title": "Mesoporous Ni/Al-MCM-41 catalysts for highly active and selective hydrodeoxygenation of anisole to cyclohexane",
        "prism:copyright": "© 2023 Elsevier B.V. All rights reserved.",
        "openaccess": "0",
        "prism:issn": "0926860X",
        "dcterms:subject": [
          {
            "@_fa": "true",
            "$": "Hydrodeoxygenation"
          },
          {
            "@_fa": "true",
            "$": "Bifunctional catalysts"
          },
          {
            "@_fa": "true",
            "$": "Nickel"
          },
          {
            "@_fa": "true",
            "$": "Al-MCM-41"
          },
          {
            "@_fa": "true",
            "$": "Anisole"
          }
        ],
        "openaccessArticle": "false",
        "prism:publicationName": "Applied Catalysis A: General",
        "openaccessSponsorType": null,
        "prism:pageRange": "119313",
        "pubType": "fla",
        "prism:coverDisplayDate": "5 August 2023",
        "prism:doi": "10.1016/j.apcata.2023.119313",
        "prism:startingPage": "119313",
        "dc:identifier": "doi:10.1016/j.apcata.2023.119313",
        "openaccessSponsorName": null
      },
      "objects": {
        "object": [
          {
            "@category": "standard",
            "@height": "998",
            "@width": "708",
            "@_fa": "true",
            "$": "https://api.elsevier.com/content/object/eid/1-s2.0-S0926860X23002934-gr1.jpg?httpAccept=%2A%2F%2A",
            "@multimediatype": "JPEG image file",
            "@type": "IMAGE-DOWNSAMPLED",
            "@size": "153990",
            "@ref": "gr1",
            "@mimetype": "image/jpeg"
          },
          {
            "@category": "standard",
            "@height": "268",
            "@width": "678",
            "@_fa": "true",
            "$": "https://api.elsevier.com/content/object/eid/1-s2.0-S0926860X23002934-gr4.jpg?httpAccept=%2A%2F%2A",
            "@multimediatype": "JPEG image file",
            "@type": "IMAGE-DOWNSAMPLED",
            "@size": "53436",
            "@ref": "gr4",
            "@mimetype": "image/jpeg"
          },
          {
            "@category": "standard",
            "@height": "315",
            "@width": "376",
            "@_fa": "true",
            "$": "https://api.elsevier.com/content/object/eid/1-s2.0-S0926860X23002934-gr5.jpg?httpAccept=%2A%2F%2A",
            "@multimediatype": "JPEG image file",
            "@type": "IMAGE-DOWNSAMPLED",
            "@size": "29880",
            "@ref": "gr5",
            "@mimetype": "image/jpeg"
          },
          {
            "@category": "standard",
            "@height": "515",
            "@width": "678",
            "@_fa": "true",
            "$": "https://api.elsevier.com/content/object/eid/1-s2.0-S0926860X23002934-gr2.jpg?httpAccept=%2A%2F%2A",
            "@multimediatype": "JPEG image file",
            "@type": "IMAGE-DOWNSAMPLED",
            "@size": "79020",
            "@ref": "gr2",
            "@mimetype": "image/jpeg"
          },
          {
            "@category": "standard",
            "@height": "567",
            "@width": "376",
            "@_fa": "true",
            "$": "https://api.elsevier.com/content/object/eid/1-s2.0-S0926860X23002934-gr3.jpg?httpAccept=%2A%2F%2A",
            "@multimediatype": "JPEG image file",
            "@type": "IMAGE-DOWNSAMPLED",
            "@size": "39156",
            "@ref": "gr3",
            "@mimetype": "image/jpeg"
          },
          {
            "@category": "standard",
            "@height": "201",
            "@width": "565",
            "@_fa": "true",
            "$": "https://api.elsevier.com/content/object/eid/1-s2.0-S0926860X23002934-gr11.jpg?httpAccept=%2A%2F%2A",
            "@multimediatype": "JPEG image file",
            "@type": "IMAGE-DOWNSAMPLED",
            "@size": "14691",
            "@ref": "gr11",
            "@mimetype": "image/jpeg"
          },
          {
            "@category": "standard",
            "@height": "304",
            "@width": "565",
            "@_fa": "true",
            "$": "https://api.elsevier.com/content/object/eid/1-s2.0-S0926860X23002934-sc1.jpg?httpAccept=%2A%2F%2A",
            "@multimediatype": "JPEG image file",
            "@type": "IMAGE-DOWNSAMPLED",
            "@size": "30415",
            "@ref": "sc1",
            "@mimetype": "image/jpeg"
          },
          {
            "@category": "standard",
            "@height": "300",
            "@width": "376",
            "@_fa": "true",
            "$": "https://api.elsevier.com/content/object/eid/1-s2.0-S0926860X23002934-gr12.jpg?httpAccept=%2A%2F%2A",
            "@multimediatype": "JPEG image file",
            "@type": "IMAGE-DOWNSAMPLED",
            "@size": "16831",
            "@ref": "gr12",
            "@mimetype": "image/jpeg"
          },
          {
            "@category": "standard",
            "@height": "755",
            "@width": "678",
            "@_fa": "true",
            "$": "https://api.elsevier.com/content/object/eid/1-s2.0-S0926860X23002934-sc2.jpg?httpAccept=%2A%2F%2A",
            "@multimediatype": "JPEG image file",
            "@type": "IMAGE-DOWNSAMPLED",
            "@size": "53231",
            "@ref": "sc2",
            "@mimetype": "image/jpeg"
          },
          {
            "@category": "standard",
            "@height": "313",
            "@width": "376",
            "@_fa": "true",
            "$": "https://api.elsevier.com/content/object/eid/1-s2.0-S0926860X23002934-gr10.jpg?httpAccept=%2A%2F%2A",
            "@multimediatype": "JPEG image file",
            "@type": "IMAGE-DOWNSAMPLED",
            "@size": "24212",
            "@ref": "gr10",
            "@mimetype": "image/jpeg"
          },
          {
            "@category": "standard",
            "@height": "200",
            "@width": "500",
            "@_fa": "true",
            "$": "https://api.elsevier.com/content/object/eid/1-s2.0-S0926860X23002934-ga1.jpg?httpAccept=%2A%2F%2A",
            "@multimediatype": "JPEG image file",
            "@type": "IMAGE-DOWNSAMPLED",
            "@size": "24579",
            "@ref": "ga1",
            "@mimetype": "image/jpeg"
          },
          {
            "@category": "standard",
            "@height": "290",
            "@width": "376",
            "@_fa": "true",
            "$": "https://api.elsevier.com/content/object/eid/1-s2.0-S0926860X23002934-gr8.jpg?httpAccept=%2A%2F%2A",
            "@multimediatype": "JPEG image file",
            "@type": "IMAGE-DOWNSAMPLED",
            "@size": "28797",
            "@ref": "gr8",
            "@mimetype": "image/jpeg"
          },
          {
            "@category": "standard",
            "@height": "997",
            "@width": "667",
            "@_fa": "true",
            "$": "https://api.elsevier.com/content/object/eid/1-s2.0-S0926860X23002934-gr9.jpg?httpAccept=%2A%2F%2A",
            "@multimediatype": "JPEG image file",
            "@type": "IMAGE-DOWNSAMPLED",
            "@size": "224934",
            "@ref": "gr9",
            "@mimetype": "image/jpeg"
          },
          {
            "@category": "standard",
            "@height": "314",
            "@width": "376",
            "@_fa": "true",
            "$": "https://api.elsevier.com/content/object/eid/1-s2.0-S0926860X23002934-gr6.jpg?httpAccept=%2A%2F%2A",
            "@multimediatype": "JPEG image file",
            "@type": "IMAGE-DOWNSAMPLED",
            "@size": "27208",
            "@ref": "gr6",
            "@mimetype": "image/jpeg"
          },
          {
            "@category": "standard",
            "@height": "311",
            "@width": "376",
            "@_fa": "true",
            "$": "https://api.elsevier.com/content/object/eid/1-s2.0-S0926860X23002934-gr7.jpg?httpAccept=%2A%2F%2A",
            "@multimediatype": "JPEG image file",
            "@type": "IMAGE-DOWNSAMPLED",
            "@size": "23744",
            "@ref": "gr7",
            "@mimetype": "image/jpeg"
          },
          {
            "@category": "thumbnail",
            "@height": "163",
            "@width": "116",
            "@_fa": "true",
            "$": "https://api.elsevier.com/content/object/eid/1-s2.0-S0926860X23002934-gr1.sml?httpAccept=%2A%2F%2A",
            "@multimediatype": "GIF image file",
            "@type": "IMAGE-THUMBNAIL",
            "@size": "10880",
            "@ref": "gr1",
            "@mimetype": "image/gif"
          },
          {
            "@category": "thumbnail",
            "@height": "86",
            "@width": "219",
            "@_fa": "true",
            "$": "https://api.elsevier.com/content/object/eid/1-s2.0-S0926860X23002934-gr4.sml?httpAccept=%2A%2F%2A",
            "@multimediatype": "GIF image file",
            "@type": "IMAGE-THUMBNAIL",
            "@size": "7087",
            "@ref": "gr4",
            "@mimetype": "image/gif"
          },
          {
            "@category": "thumbnail",
            "@height": "163",
            "@width": "195",
            "@_fa": "true",
            "$": "https://api.elsevier.com/content/object/eid/1-s2.0-S0926860X23002934-gr5.sml?httpAccept=%2A%2F%2A",
            "@multimediatype": "GIF image file",
            "@type": "IMAGE-THUMBNAIL",
            "@size": "8731",
            "@ref": "gr5",
            "@mimetype": "image/gif"
          },
          {
            "@category": "thumbnail",
            "@height": "164",
            "@width": "216",
            "@_fa": "true",
            "$": "https://api.elsevier.com/content/object/eid/1-s2.0-S0926860X23002934-gr2.sml?httpAccept=%2A%2F%2A",
            "@multimediatype": "GIF image file",
            "@type": "IMAGE-THUMBNAIL",
            "@size": "10655",
            "@ref": "gr2",
            "@mimetype": "image/gif"
          },
          {
            "@category": "thumbnail",
            "@height": "163",
            "@width": "108",
            "@_fa": "true",
            "$": "https://api.elsevier.com/content/object/eid/1-s2.0-S0926860X23002934-gr3.sml?httpAccept=%2A%2F%2A",
            "@multimediatype": "GIF image file",
            "@type": "IMAGE-THUMBNAIL",
            "@size": "6419",
            "@ref": "gr3",
            "@mimetype": "image/gif"
          },
          {
            "@category": "thumbnail",
            "@height": "78",
            "@width": "219",
            "@_fa": "true",
            "$": "https://api.elsevier.com/content/object/eid/1-s2.0-S0926860X23002934-gr11.sml?httpAccept=%2A%2F%2A",
            "@multimediatype": "GIF image file",
            "@type": "IMAGE-THUMBNAIL",
            "@size": "2171",
            "@ref": "gr11",
            "@mimetype": "image/gif"
          },
          {
            "@category": "thumbnail",
            "@height": "118",
            "@width": "219",
            "@_fa": "true",
            "$": "https://api.elsevier.com/content/object/eid/1-s2.0-S0926860X23002934-sc1.sml?httpAccept=%2A%2F%2A",
            "@multimediatype": "GIF image file",
            "@type": "IMAGE-THUMBNAIL",
            "@size": "4697",
            "@ref": "sc1",
            "@mimetype": "image/gif"
          },
          {
            "@category": "thumbnail",
            "@height": "164",
            "@width": "205",
            "@_fa": "true",
            "$": "https://api.elsevier.com/content/object/eid/1-s2.0-S0926860X23002934-gr12.sml?httpAccept=%2A%2F%2A",
            "@multimediatype": "GIF image file",
            "@type": "IMAGE-THUMBNAIL",
            "@size": "8340",
            "@ref": "gr12",
            "@mimetype": "image/gif"
          },
          {
            "@category": "thumbnail",
            "@height": "164",
            "@width": "147",
            "@_fa": "true",
            "$": "https://api.elsevier.com/content/object/eid/1-s2.0-S0926860X23002934-sc2.sml?httpAccept=%2A%2F%2A",
            "@multimediatype": "GIF image file",
            "@type": "IMAGE-THUMBNAIL",
            "@size": "3893",
            "@ref": "sc2",
            "@mimetype": "image/gif"
          },
          {
            "@category": "thumbnail",
            "@height": "164",
            "@width": "197",
            "@_fa": "true",
            "$": "https://api.elsevier.com/content/object/eid/1-s2.0-S0926860X23002934-gr10.sml?httpAccept=%2A%2F%2A",
            "@multimediatype": "GIF image file",
            "@type": "IMAGE-THUMBNAIL",
            "@size": "7889",
            "@ref": "gr10",
            "@mimetype": "image/gif"
          },
          {
            "@category": "thumbnail",
            "@height": "88",
            "@width": "219",
            "@_fa": "true",
            "$": "https://api.elsevier.com/content/object/eid/1-s2.0-S0926860X23002934-ga1.sml?httpAccept=%2A%2F%2A",
            "@multimediatype": "GIF image file",
            "@type": "IMAGE-THUMBNAIL",
            "@size": "7144",
            "@ref": "ga1",
            "@mimetype": "image/gif"
          },
          {
            "@category": "thumbnail",
            "@height": "164",
            "@width": "212",
            "@_fa": "true",
            "$": "https://api.elsevier.com/content/object/eid/1-s2.0-S0926860X23002934-gr8.sml?httpAccept=%2A%2F%2A",
            "@multimediatype": "GIF image file",
            "@type": "IMAGE-THUMBNAIL",
            "@size": "9101",
            "@ref": "gr8",
            "@mimetype": "image/gif"
          },
          {
            "@category": "thumbnail",
            "@height": "163",
            "@width": "109",
            "@_fa": "true",
            "$": "https://api.elsevier.com/content/object/eid/1-s2.0-S0926860X23002934-gr9.sml?httpAccept=%2A%2F%2A",
            "@multimediatype": "GIF image file",
            "@type": "IMAGE-THUMBNAIL",
            "@size": "10691",
            "@ref": "gr9",
            "@mimetype": "image/gif"
          },
          {
            "@category": "thumbnail",
            "@height": "163",
            "@width": "196",
            "@_fa": "true",
            "$": "https://api.elsevier.com/content/object/eid/1-s2.0-S0926860X23002934-gr6.sml?httpAccept=%2A%2F%2A",
            "@multimediatype": "GIF image file",
            "@type": "IMAGE-THUMBNAIL",
            "@size": "7483",
            "@ref": "gr6",
            "@mimetype": "image/gif"
          },
          {
            "@category": "thumbnail",
            "@height": "164",
            "@width": "198",
            "@_fa": "true",
            "$": "https://api.elsevier.com/content/object/eid/1-s2.0-S0926860X23002934-gr7.sml?httpAccept=%2A%2F%2A",
            "@multimediatype": "GIF image file",
            "@type": "IMAGE-THUMBNAIL",
            "@size": "7545",
            "@ref": "gr7",
            "@mimetype": "image/gif"
          },
          {
            "@category": "high",
            "@height": "4408",
            "@width": "3128",
            "@_fa": "true",
            "$": "https://api.elsevier.com/content/object/eid/1-s2.0-S0926860X23002934-gr1_lrg.jpg?httpAccept=%2A%2F%2A",
            "@multimediatype": "JPEG image file",
            "@type": "IMAGE-HIGH-RES",
            "@size": "928523",
            "@ref": "gr1",
            "@mimetype": "image/jpeg"
          },
          {
            "@category": "high",
            "@height": "1182",
            "@width": "2994",
            "@_fa": "true",
            "$": "https://api.elsevier.com/content/object/eid/1-s2.0-S0926860X23002934-gr4_lrg.jpg?httpAccept=%2A%2F%2A",
            "@multimediatype": "JPEG image file",
            "@type": "IMAGE-HIGH-RES",
            "@size": "224026",
            "@ref": "gr4",
            "@mimetype": "image/jpeg"
          },
          {
            "@category": "high",
            "@height": "1394",
            "@width": "1663",
            "@_fa": "true",
            "$": "https://api.elsevier.com/content/object/eid/1-s2.0-S0926860X23002934-gr5_lrg.jpg?httpAccept=%2A%2F%2A",
            "@multimediatype": "JPEG image file",
            "@type": "IMAGE-HIGH-RES",
            "@size": "281117",
            "@ref": "gr5",
            "@mimetype": "image/jpeg"
          },
          {
            "@category": "high",
            "@height": "2273",
            "@width": "2994",
            "@_fa": "true",
            "$": "https://api.elsevier.com/content/object/eid/1-s2.0-S0926860X23002934-gr2_lrg.jpg?httpAccept=%2A%2F%2A",
            "@multimediatype": "JPEG image file",
            "@type": "IMAGE-HIGH-RES",
            "@size": "372603",
            "@ref": "gr2",
            "@mimetype": "image/jpeg"
          },
          {
            "@category": "high",
            "@height": "2506",
            "@width": "1663",
            "@_fa": "true",
            "$": "https://api.elsevier.com/content/object/eid/1-s2.0-S0926860X23002934-gr3_lrg.jpg?httpAccept=%2A%2F%2A",
            "@multimediatype": "JPEG image file",
            "@type": "IMAGE-HIGH-RES",
            "@size": "203431",
            "@ref": "gr3",
            "@mimetype": "image/jpeg"
          },
          {
            "@category": "high",
            "@height": "887",
            "@width": "2495",
            "@_fa": "true",
            "$": "https://api.elsevier.com/content/object/eid/1-s2.0-S0926860X23002934-gr11_lrg.jpg?httpAccept=%2A%2F%2A",
            "@multimediatype": "JPEG image file",
            "@type": "IMAGE-HIGH-RES",
            "@size": "76082",
            "@ref": "gr11",
            "@mimetype": "image/jpeg"
          },
          {
            "@category": "high",
            "@height": "1342",
            "@width": "2495",
            "@_fa": "true",
            "$": "https://api.elsevier.com/content/object/eid/1-s2.0-S0926860X23002934-sc1_lrg.jpg?httpAccept=%2A%2F%2A",
            "@multimediatype": "JPEG image file",
            "@type": "IMAGE-HIGH-RES",
            "@size": "129111",
            "@ref": "sc1",
            "@mimetype": "image/jpeg"
          },
          {
            "@category": "high",
            "@height": "1329",
            "@width": "1663",
            "@_fa": "true",
            "$": "https://api.elsevier.com/content/object/eid/1-s2.0-S0926860X23002934-gr12_lrg.jpg?httpAccept=%2A%2F%2A",
            "@multimediatype": "JPEG image file",
            "@type": "IMAGE-HIGH-RES",
            "@size": "72831",
            "@ref": "gr12",
            "@mimetype": "image/jpeg"
          },
          {
            "@category": "high",
            "@height": "3335",
            "@width": "2994",
            "@_fa": "true",
            "$": "https://api.elsevier.com/content/object/eid/1-s2.0-S0926860X23002934-sc2_lrg.jpg?httpAccept=%2A%2F%2A",
            "@multimediatype": "JPEG image file",
            "@type": "IMAGE-HIGH-RES",
            "@size": "248127",
            "@ref": "sc2",
            "@mimetype": "image/jpeg"
          },
          {
            "@category": "high",
            "@height": "1386",
            "@width": "1663",
            "@_fa": "true",
            "$": "https://api.elsevier.com/content/object/eid/1-s2.0-S0926860X23002934-gr10_lrg.jpg?httpAccept=%2A%2F%2A",
            "@multimediatype": "JPEG image file",
            "@type": "IMAGE-HIGH-RES",
            "@size": "106896",
            "@ref": "gr10",
            "@mimetype": "image/jpeg"
          },
          {
            "@category": "high",
            "@height": "885",
            "@width": "2213",
            "@_fa": "true",
            "$": "https://api.elsevier.com/content/object/eid/1-s2.0-S0926860X23002934-ga1_lrg.jpg?httpAccept=%2A%2F%2A",
            "@multimediatype": "JPEG image file",
            "@type": "IMAGE-HIGH-RES",
            "@size": "177165",
            "@ref": "ga1",
            "@mimetype": "image/jpeg"
          },
          {
            "@category": "high",
            "@height": "1283",
            "@width": "1663",
            "@_fa": "true",
            "$": "https://api.elsevier.com/content/object/eid/1-s2.0-S0926860X23002934-gr8_lrg.jpg?httpAccept=%2A%2F%2A",
            "@multimediatype": "JPEG image file",
            "@type": "IMAGE-HIGH-RES",
            "@size": "119749",
            "@ref": "gr8",
            "@mimetype": "image/jpeg"
          },
          {
            "@category": "high",
            "@height": "4408",
            "@width": "2948",
            "@_fa": "true",
            "$": "https://api.elsevier.com/content/object/eid/1-s2.0-S0926860X23002934-gr9_lrg.jpg?httpAccept=%2A%2F%2A",
            "@multimediatype": "JPEG image file",
            "@type": "IMAGE-HIGH-RES",
            "@size": "1149263",
            "@ref": "gr9",
            "@mimetype": "image/jpeg"
          },
          {
            "@category": "high",
            "@height": "1387",
            "@width": "1663",
            "@_fa": "true",
            "$": "https://api.elsevier.com/content/object/eid/1-s2.0-S0926860X23002934-gr6_lrg.jpg?httpAccept=%2A%2F%2A",
            "@multimediatype": "JPEG image file",
            "@type": "IMAGE-HIGH-RES",
            "@size": "152875",
            "@ref": "gr6",
            "@mimetype": "image/jpeg"
          },
          {
            "@category": "high",
            "@height": "1377",
            "@width": "1663",
            "@_fa": "true",
            "$": "https://api.elsevier.com/content/object/eid/1-s2.0-S0926860X23002934-gr7_lrg.jpg?httpAccept=%2A%2F%2A",
            "@multimediatype": "JPEG image file",
            "@type": "IMAGE-HIGH-RES",
            "@size": "113805",
            "@ref": "gr7",
            "@mimetype": "image/jpeg"
          },
          {
            "@category": "standard",
            "@_fa": "true",
            "$": "https://api.elsevier.com/content/object/eid/1-s2.0-S0926860X23002934-mmc1.docx?httpAccept=%2A%2F%2A",
            "@multimediatype": "Microsoft Word file",
            "@type": "APPLICATION",
            "@size": "2268279",
            "@ref": "mmc1",
            "@mimetype": "application/word"
          },
          {
            "@category": "thumbnail",
            "@_fa": "true",
            "$": "https://api.elsevier.com/content/object/eid/1-s2.0-S0926860X23002934-si0001.svg?httpAccept=%2A%2F%2A",
            "@multimediatype": "Scalable Vector Graphics file",
            "@type": "ALTIMG",
            "@size": "1790",
            "@ref": "si0001",
            "@mimetype": "image/svg+xml"
          },
          {
            "@category": "thumbnail",
            "@_fa": "true",
            "$": "https://api.elsevier.com/content/object/eid/1-s2.0-S0926860X23002934-si0002.svg?httpAccept=%2A%2F%2A",
            "@multimediatype": "Scalable Vector Graphics file",
            "@type": "ALTIMG",
            "@size": "1790",
            "@ref": "si0002",
            "@mimetype": "image/svg+xml"
          },
          {
            "@category": "thumbnail",
            "@_fa": "true",
            "$": "https://api.elsevier.com/content/object/eid/1-s2.0-S0926860X23002934-si0003.svg?httpAccept=%2A%2F%2A",
            "@multimediatype": "Scalable Vector Graphics file",
            "@type": "ALTIMG",
            "@size": "3282",
            "@ref": "si0003",
            "@mimetype": "image/svg+xml"
          },
          {
            "@category": "thumbnail",
            "@_fa": "true",
            "$": "https://api.elsevier.com/content/object/eid/1-s2.0-S0926860X23002934-si0004.svg?httpAccept=%2A%2F%2A",
            "@multimediatype": "Scalable Vector Graphics file",
            "@type": "ALTIMG",
            "@size": "1839",
            "@ref": "si0004",
            "@mimetype": "image/svg+xml"
          },
          {
            "@category": "thumbnail",
            "@_fa": "true",
            "$": "https://api.elsevier.com/content/object/eid/1-s2.0-S0926860X23002934-si0005.svg?httpAccept=%2A%2F%2A",
            "@multimediatype": "Scalable Vector Graphics file",
            "@type": "ALTIMG",
            "@size": "3108",
            "@ref": "si0005",
            "@mimetype": "image/svg+xml"
          },
          {
            "@category": "standard",
            "@_fa": "true",
            "$": "https://api.elsevier.com/content/object/eid/1-s2.0-S0926860X23002934-am.pdf?httpAccept=%2A%2F%2A",
            "@multimediatype": "Acrobat PDF file",
            "@type": "AAM-PDF",
            "@size": "2791923",
            "@ref": "am",
            "@mimetype": "application/pdf"
          }
        ]
      },
      "link": {
        "@rel": "abstract",
        "@href": "https://api.elsevier.com/content/abstract/scopus_id/85164298624"
      }
    }
  }
}