{
  "metadata": {
    "title": "Fe doping promotes water splitting activity of nickel-based catalysts in steam reforming of tar model compound",
    "authors": "; ; ",
    "journal": "Applied Catalysis A: General",
    "date": "2025-09-25",
    "doi": "10.1016/j.apcata.2025.120424",
    "abstract": "",
    "uri": "https://api.elsevier.com/content/article/pii/S0926860X25003254",
    "pii": "S0926860X25003254"
  },
  "fulltext": {
    "full-text-retrieval-response": {
      "scopus-eid": "2-s2.0-105009688198",
      "originalText": "serial JL 271346 291210 291744 291809 31 Applied Catalysis A: General APPLIEDCATALYSISAGENERAL 2025-07-03 2025-07-03 2025-07-07 2025-07-07 2025-08-02T16:52:27 1-s2.0-S0926860X25003254 S0926-860X(25)00325-4 S0926860X25003254 10.1016/j.apcata.2025.120424 S300 S300.1 FULL-TEXT 1-s2.0-S0926860X25X00132 2025-08-02T15:56:28.145171Z 0 0 20250925 2025 2025-07-03T18:40:15.666088Z absattachment articleinfo articlenumber articletitlenorm authfirstinitialnorm authfirstsurnamenorm cid cids contenttype copyright crossmark dateloaded dateloadedtxt datesearch datesort dateupdated dco docsubtype doctype doi eid ewtransactionid hubeid indexeddate issn issnnorm itemstage itemtransactionid itemweight openaccess openarchive pg pgfirst pii piinorm pubdatestart pubdatetxt pubyr sortorder srctitle srctitlenorm srctype ssids alllist content subj subheadings suppl tomb volfirst volissue volumelist webpdf webpdfpagecount yearnav figure table e-component body mmlmath acknowledge affil appendices articletitle auth authfirstini authfull authkeywords authlast footnotes grantnumber grantsponsor grantsponsorid highlightsabst primabst ref specialabst 0926-860X 0926860X true 705 705 C Volume 705 5 120424 120424 120424 20250925 25 September 2025 2025-09-25 2025 article fla © 2025 Elsevier B.V. All rights are reserved, including those for text and data mining, AI training, and similar technologies. FEDOPINGPROMOTESWATERSPLITTINGACTIVITYNICKELBASEDCATALYSTSINSTEAMREFORMINGTARMODELCOMPOUND AN T 1 Introduction 2 The experimental part 2.1 Material preparation 2.1.1 Purification and functionalization of CNTs 2.1.2 Preparation of catalyst 2.2 Characterization of catalysts 2.3 Reforming experiment 2.4 Theoretical calculation 3 Results and discussion 3.1 Material characterization 3.2 SRT catalytic performance of M/CeO2/CNT 3.2.1 Effect of reaction temperature 3.2.2 Effect of the molar ratio of steam to carbon in feedstock 3.2.3 Structure and SRT performance relationship 3.2.4 Characterization of M/CeO2/CNT after reaction 3.3 The mechanism of Ni-Fe/CeO2/CNT catalyst in SRT 3.3.1 In-situ DRIFTS experiments 3.3.2 DFT calculations 3.3.3 The SRT mechanism over Ni-Fe/CeO2/CNT 4 Conclusions CRediT authorship contribution statement Acknowledgments Appendix A Supplementary material References SUN 2024 123729 H AMMENDOLA 2010 123 129 P CHEN 2018 153 158 X SHAYAN 2018 30 41 E HERVY 2019 97 106 M ZHAO 2015 42 50 Z REN 2022 120743 J MEI 2013 1133 1143 D LI 2019 822 830 Z GUO 2024 148237 S ZHOU 2020 117859 S ORDONEZ 2025 120266 C YU 2024 238 249 Z HAI 2024 194 202 G SHI 2024 4209 4220 T WANG 2011 248 255 L KOIKE 2015 151 162 M KIM 2017 1937 1949 S YAO 2023 122479 X ASHOK 2020 106252 J VASILIADES 2024 123906 M SOSA 2025 124940 L PENG 2022 33 46 R XIA 2025 418 426 Y MIERCZYNSKI 2016 281 294 P ZHOU 2020 17259 17268 H LIU 2018 14403 14413 S YADAV 2019 30014 30023 A LIU 2016 560 567 Y YANG 2011 197 205 Y OEMAR 2014 4190 4198 U HAN 2021 695 705 D ZHAO 2016 236 248 S YAN 2021 D ZHANG 2021 120393 X CHEN 2018 469 479 X YANG 2019 730 739 X KRESSE 1996 11169 11186 G GRIMME 2010 S WANG 2021 108033 V TAGHVAEI 2021 119698 H LI 2018 10447 10455 Z HUA 2017 96 111 X HUANG 2025 130804 J ZHANG 2025 1598 1607 N BI 2025 363 380 F ABBASLOU 2009 47 52 R SIMONETTI 2010 6459 6465 S ZOU 2018 827 837 X SHAN 2003 1 9 W ZHANG 2017 35897 35907 X ASHOK 2014 289 301 J PENG 2021 118909 R WANG 2013 1506 1515 Y MA 2019 76 85 C LIU 2025 111063 N HAN 2025 161609 X SWIERCZYNSKI 2007 211 222 D ZHANG 2024 153323 Y REN 2025 124555 J LIU 2020 408 418 C LIU 2013 14070 14074 S KARATZA 2021 106606 D LUO 2022 130299 C SUN 2015 58 65 H JIA 2017 1600114 Z ANX2025X120424 ANX2025X120424XT 2027-07-07T00:00:00.000Z 2027-07-07T00:00:00.000Z http://creativecommons.org/licenses/by-nc-nd/4.0/ © 2025 Elsevier B.V. All rights are reserved, including those for text and data mining, AI training, and similar technologies. 2025-07-09T00:24:23.699Z http://vtw.elsevier.com/data/voc/AddOnTypes/50.7/aggregated-refined Young Top Talents Program of Science and Technology of Guizhou Province Qianjiaoji[2024]315 Science and Technology Program of Guizhou Province http://data.elsevier.com/vocabulary/SciValFunders/501100018555 http://sws.geonames.org/1814991/ Natural Science Foundation of Guizhou QiankehejichuMS[2025]185 Natural Science Foundation of Guizhou Province http://data.elsevier.com/vocabulary/SciValFunders/501100005329 http://sws.geonames.org/1814991/ National Natural Science Foundation of China 22168013 22279024 National Natural Science Foundation of China http://data.elsevier.com/vocabulary/SciValFunders/501100001809 http://sws.geonames.org/1814991 Guizhou University 2024SRT010 2023SRT197 GZU Guizhou University http://data.elsevier.com/vocabulary/SciValFunders/501100003459 http://sws.geonames.org/1814991/ This work was supported by National Natural Science Foundation of China ( 22168013 , 22279024 ), Natural Science Foundation of Guizhou ( QiankehejichuMS[2025]185 ), Young Top Talents Program of Science and Technology of Guizhou Province ( Qianjiaoji[2024]315 ), SRT project of Guizhou University ( 2024SRT010 , 2023SRT197 ). https://doi.org/10.15223/policy-017 https://doi.org/10.15223/policy-037 https://doi.org/10.15223/policy-012 https://doi.org/10.15223/policy-029 https://doi.org/10.15223/policy-004 item S0926-860X(25)00325-4 S0926860X25003254 1-s2.0-S0926860X25003254 10.1016/j.apcata.2025.120424 271346 2025-08-02T15:56:28.145171Z 2025-09-25 1-s2.0-S0926860X25003254-main.pdf https://s3-eu-west-1.amazonaws.com/prod-ucs-content-store-eu-west/content/pii:S0926860X25003254/MAIN/application/pdf/48cf23574a87f80cda65b19fff36321b/main.pdf main.pdf pdf true 9895592 MAIN 13 1-s2.0-S0926860X25003254-main_1.png https://s3-eu-west-1.amazonaws.com/prod-ucs-content-store-eu-west/content/pii:S0926860X25003254/PREVIEW/image/png/d0ffbac5cf0e3ef0c83ebdd3b5294962/main_1.png main_1.png png 56716 928 656 IMAGE-WEB-PDF 1 1-s2.0-S0926860X25003254-gr7.jpg https://s3-eu-west-1.amazonaws.com/prod-ucs-content-store-eu-west/content/pii:S0926860X25003254/gr7/DOWNSAMPLED/image/jpeg/97960c0b1b178edbf80ce7a8d61128ee/gr7.jpg gr7 gr7.jpg jpg 85993 477 807 IMAGE-DOWNSAMPLED 1-s2.0-S0926860X25003254-gr6.jpg https://s3-eu-west-1.amazonaws.com/prod-ucs-content-store-eu-west/content/pii:S0926860X25003254/gr6/DOWNSAMPLED/image/jpeg/fbb936c67cab32710c8837b8a6458db8/gr6.jpg gr6 gr6.jpg jpg 50787 238 678 IMAGE-DOWNSAMPLED 1-s2.0-S0926860X25003254-gr8.jpg https://s3-eu-west-1.amazonaws.com/prod-ucs-content-store-eu-west/content/pii:S0926860X25003254/gr8/DOWNSAMPLED/image/jpeg/88c9becdb2cf9129bc935857be0d2378/gr8.jpg gr8 gr8.jpg jpg 55970 622 678 IMAGE-DOWNSAMPLED 1-s2.0-S0926860X25003254-gr3.jpg https://s3-eu-west-1.amazonaws.com/prod-ucs-content-store-eu-west/content/pii:S0926860X25003254/gr3/DOWNSAMPLED/image/jpeg/01786f46193f969ac83f52c0af2e63be/gr3.jpg gr3 gr3.jpg jpg 83382 410 807 IMAGE-DOWNSAMPLED 1-s2.0-S0926860X25003254-gr2.jpg https://s3-eu-west-1.amazonaws.com/prod-ucs-content-store-eu-west/content/pii:S0926860X25003254/gr2/DOWNSAMPLED/image/jpeg/dc03f6c11281171b4e3ddf534a659c31/gr2.jpg gr2 gr2.jpg jpg 94486 315 807 IMAGE-DOWNSAMPLED 1-s2.0-S0926860X25003254-ga1.jpg https://s3-eu-west-1.amazonaws.com/prod-ucs-content-store-eu-west/content/pii:S0926860X25003254/ga1/DOWNSAMPLED/image/jpeg/e49b4e4934cf66d49db511a8cc69deae/ga1.jpg ga1 true ga1.jpg jpg 28107 245 282 IMAGE-DOWNSAMPLED 1-s2.0-S0926860X25003254-gr5.jpg https://s3-eu-west-1.amazonaws.com/prod-ucs-content-store-eu-west/content/pii:S0926860X25003254/gr5/DOWNSAMPLED/image/jpeg/f2d07286c250bd3c9b1934525edad9b0/gr5.jpg gr5 gr5.jpg jpg 93648 397 807 IMAGE-DOWNSAMPLED 1-s2.0-S0926860X25003254-gr4.jpg https://s3-eu-west-1.amazonaws.com/prod-ucs-content-store-eu-west/content/pii:S0926860X25003254/gr4/DOWNSAMPLED/image/jpeg/bb519ffd5d161bdf437ccc82895aed79/gr4.jpg gr4 gr4.jpg jpg 78111 401 807 IMAGE-DOWNSAMPLED 1-s2.0-S0926860X25003254-gr1.jpg https://s3-eu-west-1.amazonaws.com/prod-ucs-content-store-eu-west/content/pii:S0926860X25003254/gr1/DOWNSAMPLED/image/jpeg/16d90a7438bdc548ff356189e72937e8/gr1.jpg gr1 gr1.jpg jpg 74454 517 678 IMAGE-DOWNSAMPLED 1-s2.0-S0926860X25003254-gr7.sml https://s3-eu-west-1.amazonaws.com/prod-ucs-content-store-eu-west/content/pii:S0926860X25003254/gr7/THUMBNAIL/image/gif/de8929018e34d41a6a1ba52d72155964/gr7.sml gr7 gr7.sml sml 10248 130 219 IMAGE-THUMBNAIL 1-s2.0-S0926860X25003254-gr6.sml https://s3-eu-west-1.amazonaws.com/prod-ucs-content-store-eu-west/content/pii:S0926860X25003254/gr6/THUMBNAIL/image/gif/ac0470e46567fd48a0ecb8e4299f13a6/gr6.sml gr6 gr6.sml sml 9634 77 219 IMAGE-THUMBNAIL 1-s2.0-S0926860X25003254-gr8.sml https://s3-eu-west-1.amazonaws.com/prod-ucs-content-store-eu-west/content/pii:S0926860X25003254/gr8/THUMBNAIL/image/gif/34dddbfed2cb479c3c87f1898ebf408a/gr8.sml gr8 gr8.sml sml 6750 164 179 IMAGE-THUMBNAIL 1-s2.0-S0926860X25003254-gr3.sml https://s3-eu-west-1.amazonaws.com/prod-ucs-content-store-eu-west/content/pii:S0926860X25003254/gr3/THUMBNAIL/image/gif/d8ce9452a4cc75a6f7a21cff396d0c51/gr3.sml gr3 gr3.sml sml 10468 111 219 IMAGE-THUMBNAIL 1-s2.0-S0926860X25003254-gr2.sml https://s3-eu-west-1.amazonaws.com/prod-ucs-content-store-eu-west/content/pii:S0926860X25003254/gr2/THUMBNAIL/image/gif/62bb1b86324f5ccf9e518707f5a77211/gr2.sml gr2 gr2.sml sml 12666 85 219 IMAGE-THUMBNAIL 1-s2.0-S0926860X25003254-ga1.sml https://s3-eu-west-1.amazonaws.com/prod-ucs-content-store-eu-west/content/pii:S0926860X25003254/ga1/THUMBNAIL/image/gif/f66078eed72d1803265ad842740bc07b/ga1.sml ga1 true ga1.sml sml 15049 164 189 IMAGE-THUMBNAIL 1-s2.0-S0926860X25003254-gr5.sml https://s3-eu-west-1.amazonaws.com/prod-ucs-content-store-eu-west/content/pii:S0926860X25003254/gr5/THUMBNAIL/image/gif/371a3f822b437eae9db1f90de86e7406/gr5.sml gr5 gr5.sml sml 14668 108 219 IMAGE-THUMBNAIL 1-s2.0-S0926860X25003254-gr4.sml https://s3-eu-west-1.amazonaws.com/prod-ucs-content-store-eu-west/content/pii:S0926860X25003618/gr4/THUMBNAIL/image/gif/d8f0a3f7711b468f56cb62e28fcb7ea1/gr4.sml gr4 gr4.sml sml 11012 109 219 IMAGE-THUMBNAIL 1-s2.0-S0926860X25003254-gr1.sml https://s3-eu-west-1.amazonaws.com/prod-ucs-content-store-eu-west/content/pii:S0926860X25003618/gr1/THUMBNAIL/image/gif/f44741d9eaaf4f15ae8779f00b56d769/gr1.sml gr1 gr1.sml sml 10721 164 215 IMAGE-THUMBNAIL 1-s2.0-S0926860X25003254-gr7_lrg.jpg https://s3-eu-west-1.amazonaws.com/prod-ucs-content-store-eu-west/content/pii:S0926860X25003254/HIGHRES/image/jpeg/1d972da94f632349ec8fc3b916dc9347/gr7_lrg.jpg gr7 gr7_lrg.jpg jpg 432195 2114 3575 IMAGE-HIGH-RES 1-s2.0-S0926860X25003254-gr6_lrg.jpg https://s3-eu-west-1.amazonaws.com/prod-ucs-content-store-eu-west/content/pii:S0926860X25003254/HIGHRES/image/jpeg/b0737a801f2f2dfe4a92f30b83221fe8/gr6_lrg.jpg gr6 gr6_lrg.jpg jpg 284591 1049 2994 IMAGE-HIGH-RES 1-s2.0-S0926860X25003254-gr8_lrg.jpg https://s3-eu-west-1.amazonaws.com/prod-ucs-content-store-eu-west/content/pii:S0926860X25003254/HIGHRES/image/jpeg/aa9e38390b7db61651e73d9d87aa786e/gr8_lrg.jpg gr8 gr8_lrg.jpg jpg 273678 2747 2994 IMAGE-HIGH-RES 1-s2.0-S0926860X25003254-gr3_lrg.jpg https://s3-eu-west-1.amazonaws.com/prod-ucs-content-store-eu-west/content/pii:S0926860X25003254/HIGHRES/image/jpeg/d59022d675aa817dbb38eaa2afe47570/gr3_lrg.jpg gr3 gr3_lrg.jpg jpg 451850 1816 3575 IMAGE-HIGH-RES 1-s2.0-S0926860X25003254-gr2_lrg.jpg https://s3-eu-west-1.amazonaws.com/prod-ucs-content-store-eu-west/content/pii:S0926860X25003254/HIGHRES/image/jpeg/00a7b04f8694b9b4f930547e6aa9d92c/gr2_lrg.jpg gr2 gr2_lrg.jpg jpg 732885 1395 3575 IMAGE-HIGH-RES 1-s2.0-S0926860X25003254-ga1_lrg.jpg https://s3-eu-west-1.amazonaws.com/prod-ucs-content-store-eu-west/content/pii:S0926860X25003254/HIGHRES/image/jpeg/5badd5188005d14bf72e8189c21d5f91/ga1_lrg.jpg ga1 true ga1_lrg.jpg jpg 229583 1085 1250 IMAGE-HIGH-RES 1-s2.0-S0926860X25003254-gr5_lrg.jpg https://s3-eu-west-1.amazonaws.com/prod-ucs-content-store-eu-west/content/pii:S0926860X25003618/HIGHRES/image/jpeg/dae4f4ae735ba7fa94bf2df61c7202d4/gr5_lrg.jpg gr5 gr5_lrg.jpg jpg 497744 1757 3575 IMAGE-HIGH-RES 1-s2.0-S0926860X25003254-gr4_lrg.jpg https://s3-eu-west-1.amazonaws.com/prod-ucs-content-store-eu-west/content/pii:S0926860X25003618/HIGHRES/image/jpeg/1a083bc41bd771d9e6dde44f188d01c2/gr4_lrg.jpg gr4 gr4_lrg.jpg jpg 394863 1775 3575 IMAGE-HIGH-RES 1-s2.0-S0926860X25003254-gr1_lrg.jpg https://s3-eu-west-1.amazonaws.com/prod-ucs-content-store-eu-west/content/pii:S0926860X25003618/HIGHRES/image/jpeg/161100da3ac76f3311aa7391f7509bb0/gr1_lrg.jpg gr1 gr1_lrg.jpg jpg 399493 2281 2994 IMAGE-HIGH-RES 1-s2.0-S0926860X25003254-mmc1.docx https://s3-eu-west-1.amazonaws.com/prod-ucs-content-store-eu-west/content/pii:S0926860X25003254/mmc1/MAIN/application/vnd.openxmlformats-officedocument.wordprocessingml.document/ec49e8ad4ba335270150d870edcf3400/mmc1.docx mmc1 mmc1.docx docx 5412196 APPLICATION 1-s2.0-S0926860X25003254-si0001.svg https://s3-eu-west-1.amazonaws.com/prod-ucs-content-store-eu-west/content/pii:S0926860X25003254/image/svg+xml/488d8d58cb4a70de8b1795a375a282d9/si0001.svg si0001 si0001.svg svg 3853 ALTIMG 1-s2.0-S0926860X25003254-si0002.svg https://s3-eu-west-1.amazonaws.com/prod-ucs-content-store-eu-west/content/pii:S0926860X25003254/image/svg+xml/15dd9b81f59b433f9d2f0664ceec6fda/si0002.svg si0002 si0002.svg svg 1454 ALTIMG 1-s2.0-S0926860X25003254-si0003.svg https://s3-eu-west-1.amazonaws.com/prod-ucs-content-store-eu-west/content/pii:S0926860X25003254/image/svg+xml/6cc089e40bee7f614770db9fcea29d14/si0003.svg si0003 si0003.svg svg 1535 ALTIMG 1-s2.0-S0926860X25003254-si0004.svg https://s3-eu-west-1.amazonaws.com/prod-ucs-content-store-eu-west/content/pii:S0926860X25003254/image/svg+xml/fe01788f001e29242f0872aad575d72c/si0004.svg si0004 si0004.svg svg 1482 ALTIMG 1-s2.0-S0926860X25003254-si0005.svg https://s3-eu-west-1.amazonaws.com/prod-ucs-content-store-eu-west/content/pii:S0926860X25003254/image/svg+xml/f6f548cdfe6c3376efef25d5f6c5781c/si0005.svg si0005 si0005.svg svg 1499 ALTIMG 1-s2.0-S0926860X25003254-si0006.svg https://s3-eu-west-1.amazonaws.com/prod-ucs-content-store-eu-west/content/pii:S0926860X25003254/image/svg+xml/543dc0faa4f5c124ff4301607684dbc5/si0006.svg si0006 si0006.svg svg 3578 ALTIMG APCATA 120424 120424 S0926-860X(25)00325-4 10.1016/j.apcata.2025.120424 Elsevier B.V. Fig. 1 XRD patterns after calcination (A) and reduction (B); Nitrogen physical adsorption isotherm (C) and pore size distribution (D) of M/CeO2/CNT (M=Ni, Fe or Ni-Fe). Fig. 1 Fig. 2 TEM images of Ni/CeO2/CNT (A), Fe/CeO2/CNT (B), and Ni-Fe/CeO2/CNT (C) after reduction; HR-TEM image (D) of Ni-Fe/CeO2/CNT and HAADF-STEM (EDX mapping of Fe, Ce, Ni, C, O) images (E). Fig. 2 Fig. 3 H2-TPR (A), H2O-TPD (B), H2O-TPSR (C) profiles, and XPS spectra of Ni 2p3/2 (D), Fe 2p3/2 (E), and Ce 3d (F) for M/CeO2/CNT. Fig. 3 Fig. 4 Toluene conversion on M/CeO2/CNT (A) and product distribution of SRT using Ni-Fe/CeO2/CNT (B) between 600 and 750 °C (S/C=2); Effects of different S/C ratios on toluene conversion on M/CeO2/CNT (C) and product distribution on Ni-Fe/CeO2/CNT (D) at 700 °C; Arrhenius plots of Ni/CeO2/CNT and Ni-Fe/CeO2/CNT (E); Long time SRT stability test on Ni-Fe/CeO2/CNT (F). Reaction conditions: 50 mg catalyst, GHSV= 6000 h−1, reforming temperature= 700 °C, S/C= 2. Fig. 4 Fig. 5 TGA curves (A) and (B), Raman spectra (C), XRD patterns (D), and TEM images of Ni/CeO2/CNT (E), Fe/CeO2/CNT (F), and Ni-Fe/CeO2/CNT (G) of spent catalysts after reaction. Reaction conditions: reforming temperature= 700 °C, S/C= 2, 50 mg catalyst, GHSV= 6000 h−1, Ni/CeO2/CNT and Fe/CeO2/CNT reacted for 10 h, respectively, and Ni-Fe/CeO2/CNT reacted for 50 h. Fig. 5 Fig. 6 In-situ DRIFTS spectra of SRT over Ni-Fe/CeO2/CNT (A) and representative intermediates during SRT (B). Fig. 6 Fig. 7 (A) Potential energy diagram of water splitting; (B) Potential energy diagram of SRT; (C-D) Differential charge densities of toluene adsorption over the two models; (E-F) Differential charge densities of water adsorption over the two models (the blue areas represent the electrons lost, the yellow areas represent the electrons gained); (G) The projected density of states (PDOS) for the two models with and without Fe doping. Fig. 7 Fig. 8 Proposed mechanism for SRT over Ni-Fe/CeO2/CNT. Fig. 8 Table 1 Structural properties of M/CeO2/CNT. Table 1 Catalyst Metal crystallite size a N2 physisorption H2 chemisorption Dispersion ICP-OES TOF SBET Vpore Dpore Ni Fe [nm] [m2/g] [cm3/g] [nm] [µmol/gcat] % [wt%] [wt%] [h−1] Ni/CeO2/CNT 18.2 242.6 1.36 22.2 80 9.4 9.5 0.0 165.7 Fe/CeO2/CNT 12.8 171.1 0.99 23.5 2 0.2 0.0 8.9 - Ni-Fe/CeO2/CNT 12.0 215.3 1.01 19.1 45 10.6 4.4 5.0 186.8 a Monometallic or bimetallic crystallite size (catalysts reduced at 750 °C for 1 h) as determined by XRD. Table 2 The H2 consumption percentage of different peaks deconvoluted from the H2-TPR profiles for M/CeO2/CNT. Table 2 Catalyst peak I, % peak II, % peak III, % peak IV, % Ni/CeO2/CNT 27.3 24.3 25.5 22.9 Fe/CeO2/CNT 17.1 22.0 36.4 24.5 Ni-Fe/CeO2/CNT 10.1 32.0 42.7 15.2 Table 3 Percentage of different types of water adsorbed on M/CeO2/CNT calculated from the fitted peaks in the H2O-TPD profiles. Table 3 Catalyst type Ⅰ, % type Ⅱ, % type Ⅲ, % type Ⅳ, % Ni/CeO2/CNT 19.1 24.5 39.0 17.4 Fe/CeO2/CNT 14.8 22.6 40.7 21.8 Ni-Fe/CeO2/CNT 6.4 11.5 61.4 20.7 Table 4 Surface concentrations of elements in different chemical states in the reduced M/CeO2/CNT. Table 4 Catalyst Ni0/(Ni0+Ni2+) Fe0/(Fe0+Fe2++Fe3+) Ce3+/(Ce3++Ce4+) Ni/CeO2/CNT 0.73 - 0.22 Fe/CeO2/CNT - 0.04 0.24 Ni-Fe/CeO2/CNT 0.77 0.12 0.22 Fe doping promotes water splitting activity of nickel-based catalysts in steam reforming of tar model compound Tingwei An Data curation Writing – original draft Methodology a 1 Zixuan Zhang Investigation Formal analysis a 1 Xu Ren Resources b Keliang Wang Software c Ziwei Li Funding acquisition Supervision Writing – review & editing a ⁎ Min Li Funding acquisition Writing – review & editing b ⁎ a School of Chemistry and Chemical Engineering, North Alabama International College of Engineering and Technology, Guizhou University, Guiyang 550025, China School of Chemistry and Chemical Engineering, North Alabama International College of Engineering and Technology, Guizhou University Guiyang 550025 China School of Chemistry and Chemical Engineering, North Alabama International College of Engineering and Technology, Guizhou University, Guiyang 550025, China b School of Civil Engineering, Guizhou Institute of Technology, Guiyang 550003, China School of Civil Engineering, Guizhou Institute of Technology Guiyang 550003 China School of Civil Engineering, Guizhou Institute of Technology, Guiyang 550003, China c School of Chemical and Materials Engineering, Liupanshui Normal University, Liupanshui 553004, China School of Chemical and Materials Engineering, Liupanshui Normal University Liupanshui 553004 China School of Chemical and Materials Engineering, Liupanshui Normal University, Liupanshui 553004, China ⁎ Corresponding authors. 1 These authors have contributed equally to this work and share the first authorship. Steam reforming of tar represents a cost-effective approach for tar removal in biomass gasification. Here, we developed a Ni-Fe/CeO2/CNT catalyst and unveil the effect of Fe for steam reforming of toluene (SRT) which is a representative tar model compound. The catalyst demonstrated exceptional stability (above 80 % toluene conversion, 3000 mmol/gcat/h H2 yield) over 50 h. The outstanding performance is attributed to the effect of Fe in forming Ni-Fe alloy with the highest reducibility, dispersion, Ni0 ratio, and increased sintering resistance, alongside enhanced electron transfer between Ni and Fe. Fe also promotes H2O adsorption, providing active oxygen for toluene conversion and carbon elimination. Finally, reaction mechanism was explored based on the in-situ DRIFTS and DFT calculations. DFT calculations revealed that Fe sites exhibit higher density of states, electrostatic potential, and d-band center than Ni sites, facilitating H2O coordination. Fe doping reduces energy barriers for H2O splitting and methyl dehydrogenation, while Ni promotes H2 desorption. The synergistic Ni-Fe interaction enables distinct activation of toluene and H2O, respectively. Comparative studies showed Ni/CeO2/CNT suffers from carbon deposition, while Fe/CeO2/CNT exhibits limited activity due to poor reducibility and low Fe0 content. These findings provide critical insights for designing stable Fe-based catalysts for efficient tar removal. Graphical Abstract Keywords Fe doping Water splitting Steam reforming of toluene Ni-Fe/CeO2/CNT Data availability Data will be made available on request. 1 Introduction The overexploitation of traditional energy sources has led to severe energy, climate, and environmental crises, driving researchers to actively explore alternative renewable energy solutions [1]. Biomass, characterized by its widespread availability, recyclability, and “zero carbon emission” properties, has emerged as an ideal candidate for sustainable energy production [2]. Among the various technologies employed for biomass conversion—thermochemical, biochemical, and physical methods, the thermochemical processes are particularly notable for their high conversion efficiency and broad applicability [3]. Biomass gasification, a prominent thermochemical technology, is widely regarded as one of the most promising approaches, as it directly converts biomass into syngas, which can be utilized for combustion or as a feedstock for chemical synthesis [4,5]. However, a significant challenge in gasification is the production of tar as a byproduct. This tar tends to condense and accumulate within the gasification system, leading to pipeline blockages, equipment corrosion, and reduced gasification efficiency, thereby hindering the advancement of biomass gasification technology [6]. Catalytic steam reforming has gained considerable attention as an effective method for tar removal, as it converts tar into H2-rich syngas at relatively low reaction temperatures [7]. Given the complex composition of tar, benzene and toluene are frequently employed as model compounds in studies investigating reaction mechanisms and catalyst design [8,9]. While noble metal catalysts exhibit exceptional performance in steam reforming of tar, their high cost limits their widespread application [10,11]. In contrast, transition-metal catalysts such as Ni and Fe offer a cost-effective alternative with performance comparable to noble metals, making them the most widely used catalytic materials in steam reforming of tar [12,13]. For instance, Fe-based catalysts have demonstrated remarkable capabilities in electrochemical water splitting, showing promising applicability in steam reforming reactions [14,15]. Additionally, incorporating Fe into Ni-based catalysts has been shown to enhance the catalytic performance during steam reforming of tar [16,17]. Further, the excellent redox properties of Fe contribute to the reduction of coke formation and prevent the oxidation of Ni in Ni-Fe bimetallic catalysts [18]. The choice of support material is a critical factor influencing the stability of Ni-based catalysts [19]. For instance, Ni/Al2O3 often experience rapid deactivation during tar reforming due to excessive coke formation on the γ-Al2O3 support [20]. CeO2, another commonly used support, has been shown to enhance catalytic activity and anti-coking properties through the formation of Ni-CeO2 nanocomposites, which arise from the strong interaction between Ni and CeO2 [21,22]. Additionally, the abundant oxygen vacancies on the CeO2 surface facilitate oxygen activation and migration during redox reactions [23,24]. Carbon nanotubes (CNTs), one-dimensional tubular structures composed of rolled graphene layers, are frequently employed as catalyst support for steam reforming reactions [25–28]. Because of the high specific surface area, loading active metals onto the inner and outer surfaces of CNTs can significantly increase the number of active sites on the catalyst [25]. The curved structure of CNTs disrupts the electronic balance on their surface, while their excellent electrical conductivity promotes efficient electron transfer during reactions [29]. Moreover, CNTs exhibit exceptional thermal conductivity, enabling uniform and rapid heat distribution during high-temperature reactions, which mitigates localized overheating and inhibits the sintering of active metals [30]. Investigating the reaction mechanism of SRT is of paramount importance for catalyst design and optimization of reaction conditions. In mechanistic studies of SRT, the reaction pathway can be systematically categorized into two fundamental processes: (1) the decomposition of toluene and (2) the dissociation of water [31]. Regarding toluene decomposition, two predominant reaction pathways have been proposed. The first pathway suggests that toluene adsorbed on active sites initially dissociates into adsorbed benzene and methyl species. The adsorbed benzene subsequently undergoes further cleavage into C2 species, which, along with methyl groups, are oxidized by active oxygen species to form aldehyde intermediates. These intermediates then decompose into CO and H*, or undergo complete oxidation to yield CO2 [7,31]. Additionally, a minor fraction of methyl groups may directly react with H* to form CH4 [10]. The alternative pathway involves the initial dehydrogenation of the methyl group in toluene to form C6H5CH2*, which is then progressively oxidized by active oxygen species, generating intermediates such as benzyl alcohol, benzaldehyde, and benzoate species. The benzoate ultimately undergoes ring-opening and further oxidation to form various gaseous products [32–37]. Concerning water dissociation, the widely accepted mechanism involves the cleavage of water molecules into H* and OH* species [7,10,31]. The H* species combine to form H2, while OH* species, or O* species derived from further dissociation, replenish the consumed active oxygen species [10]. It is noteworthy that although Ni-Fe bimetallic catalysts have been explored for steam reforming of toluene (SRT), the promotional effects of Fe such as enhancing reducibility, boosting water adsorption and splitting, as well as altering electronic structure demand in-depth investigation. Therefore, in this study, by comparative investigation the property and catalytic SRT performance of monometallic Ni/CeO2/CNT and Fe/CeO2/CNT catalyst as well as the bimetallic Ni-Fe/CeO2/CNT catalyst, the role of Fe and the SRT reaction mechanism were unveiled. Ni-Fe/CeO2/CNT achieves a stable toluene conversion above 80 % with a high H2 yield of 3000 mmol/gcat/h within 50 h. Its good performance is ascribed to the effect of Fe which formed Ni-Fe alloy with Ni, obtaining the highest Ni0 ratio, metal dispersion, and sintering resistance. Additionally, the electron transfer between Ni and Fe was also enhanced, improving the H2O adsorption capacity, thereby high toluene conversion and low carbon deposition. The reaction mechanism was explored based on the in-situ diffuse reflectance infrared Fourier transform spectroscopy (DRIFTS) experiments and DFT calculations. It was found that Fe sites decrease the energy barrier for H2O splitting and lowers down the heat absorption for the rate determining step of the methyl dehydrogenation. The synergistic effect between Ni and Fe sites in toluene cracking and H2O splitting, respectively, contributes to the good SRT performance of Ni-Fe/CeO2/CNT catalyst. By contrast, Ni/CeO2/CNT shows a continuous degradation of toluene conversion as the result of its severe carbon deposition resulted from its largest Ni size. As for Fe/CeO2/CNT catalyst, it exhibits the lowest reducibility and least ratio of Fe0, leading to its lowest toluene conversion. The findings from this study offer valuable insights in the development of efficient catalysts for steam reforming of tar. 2 The experimental part 2.1 Material preparation 2.1.1 Purification and functionalization of CNTs The raw CNTs (Suzhou Sinero Technology Co., LTD., diameter: 5–100 nm) and concentrated nitric acid (65 %-68 %) were mixed evenly in proportion (1 g:50 mL) and refluxed at 393 K for 3 h. After the solution was cooled to ambient temperature, CNTs were separated from the mixed solution by high-speed centrifugation and dried at 100 °C overnight to complete the purification. Purified CNTs were added into the mixed solution of hydrogen peroxide (GR, 30 %) and concentrated sulfuric acid (95 %-98 %) by ultrasonic stirring for 3 h, and then filtered, separated and washed with deionized water several times. Finally, the functionalized CNTs were obtained by drying and grinding. 2.1.2 Preparation of catalyst Ni-Fe/CNT was prepared by the wet impregnation method (theoretical loading of both Ni and Fe was 5 wt%). Specifically, a certain amount of CNTs, Ni(NO3)2·6 H2O (98 %, Aladdin) and Fe(NO3)3·9 H2O (98.5 %, Macklin) were added to a small amount of deionized water, which underwent continuously stirring at room temperature for 4 h. After drying at 110 °C, the solid product was crushed to obtain fresh catalyst. The CeO2 was loaded on the surface of CNTs by the chemical deposition method (theoretical loading of CeO2 was 15 wt%). Ni-Fe/CNT was mixed with a certain amount of ethanol, where Ce(NO3)3·6 H2O (99.95 %, Macklin) and C6H12N4 (99.0 %, Aladdin) were added and stirred continuously at 70 °C for 4 h. The separated solids were alternately washed with deionized water and ethanol several times, and then dried overnight at 100 °C. The ground samples were loaded into a tube furnace and calcined in argon atmosphere at 700 °C for 4 h. The calcined catalyst was named Ni-Fe/CeO2/CNT. In addition, for comparison, Ni/CeO2/CNT and Fe/CeO2/CNT (both with 10 wt% active metal loading) were prepared by the same method. 2.2 Characterization of catalysts N2 physisorption was performed on samples using Micromeritics ASAP 2460 equipment at 77 K. Prior to analysis, samples underwent degassing at 573 K under vacuum for 4 h to remove physisorbed species. Brunauer-Emmett-Teller (BET) theory was applied to determine specific surface areas; the pore size distribution was calculated from the desorption branch data employing the Barrett–Joyner–Halenda (BJH) method. The TG curve was obtained by the NETZSCH STA449 device with a heating rate of 10 K/min from 373 to 1173 K under air flow. The Raman spectra of the samples were recorded using a LabRAM HR Evolution with a 532 nm laser excitation source. Crystalline structures were examined by X-ray diffraction (XRD, Bruker D8 Advance, 40 kV and 40 mA) using Cu Kα radiation (λ=1.5418 Å) with 2θ ranging from 10° to 80° at a scanning rate of 5°/min. The actual content of Ni and Fe were determined by inductively coupled plasma optical emission spectrometry (ICP-OES, Agilent 5110). Before the test, samples were pretreated by heating at 600 °C for 4 h to burn out the carbon nanotubes, and then dissolved using aqua regia. Morphological features and elemental distribution were investigated using a field-emission transmission electron microscopy (TEM, TECNAI F20) equipped with energy-dispersive X-ray spectroscopy (EDX) and high-angle annular dark-field (HAADF) detectors. Surface chemical environment analysis was conducted using X-ray photoelectron spectroscopy (XPS, Thermo Scientific K-Alpha) with monochromatic Al Kα radiation (1486.7 eV), and the spectral calibration references the binding energy of adventitious carbon at 284.8 eV. Temperature-programmed H2 reduction (H2-TPR), temperature-programmed water desorption (H2O-TPD), and H2 pulse chemisorption were all tested by Micromeritics AutoChem 2950HP coupled with quadrupole mass spectrometry (MKS Cirrus2). For reduction profile analysis, approximately 50 mg samples were initially dehydrated at 573 K, followed by temperature-programmed reduction in 10 % H2/Ar mixture with a heating rate of 10 K/min up to 1123 K, monitoring hydrogen consumption via thermal conductivity detection. In the H2O-TPD, approximately 50 mg of catalyst was initially subjected to in situ reduction under flowing hydrogen (50 mL/min) at 750 °C for 1 h. Following reduction, the system was cooled to 50 °C under inert atmosphere. Water vapor was introduced into the reactor through nitrogen bubbling (50 mL/min) for 1 h to establish adsorption equilibrium. Subsequently, the system was purged with nitrogen at identical flow rate to eliminate physisorbed water species. The temperature was then ramped from 50 to 700 °C at a constant heating rate of 10 °C/min, while monitoring the mass spectrometer signal corresponding to water (m/z = 18) to quantify desorbed species. The H2O-temperature-programmed surface reaction (H2O-TPSR) test was conducted in a Microtrac BelCat II equipped with a mass spectrometer (BelMass). Approximately 50 mg of the catalyst was loaded into a quartz tube. Prior to the test, the catalyst was reduced in situ under a H2 atmosphere at 750 °C for 1 h. After reduction, the catalyst surface was purged with N2 for 0.5 h before cooling commenced. Upon reaching 50 °C, saturated water vapor, generated by bubbling N2 (50 mL/min), was continuously introduced into the quartz tube to initiate the experiment. During the test, the temperature was raised from 50 °C to 700 °C at a ramp rate of 10 °C/min, while H2 evolution (m/z = 2) was monitored by the mass spectrometer. In-situ DRIFTS spectroscopy was carried out on a BRUKER INVENIO-S equipped with an MCT detector and the test samples were mounted in a high-temperature in-situ cell (Harrick). The temperature of the cell was raised to 650 °C before starting the test, then the samples were reduced by H2 for 1 h. N2 was introduced at the end of the reduction, and the background was recorded separately when it was lowered to the test temperature. Then water and toluene were brought into the in-situ cell by bubbling with N2, and after saturation adsorption of the samples, the profiles at different reaction temperatures were recorded. Each profile was scanned 64 times with a resolution of 4 cm−1 and all profiles were subtracted from the background. 2.3 Reforming experiment The SRT was performed in a fixed-bed reactor equipped with a titanium tube (inner diameter 8.0 mm), three mass flow controllers (MFC), a two-channel injection pump and an online gas chromatograph. First, 50 mg of catalyst was loaded into the tube. Then 20 mL/min of N2 was injected after the reactor temperature was raised from room temperature to 750 °C at the rate of 10 °C/min. Subsequently, 20 mL/min of H2 was injected for in-situ reduction for 1 h. After the reduction, the temperature of the reactor was reduced to 700 °C, toluene (0.025 mL/min) and water (S/C=1–3) were vaporized into gas by a high temperature preheater at 300 °C, and then were introduced into the tube together with N2. The total gas hourly space velocity (GHSV) was 6000 h−1. A cold trap was set up at the outlet to separate the liquid mixture that was not completely converted from the gas products. The Shimadzu GC-2014 gas chromatograph equipped with TCD and FID detectors was used for analysis of the gas products. The toluene conversion was calculated as follows: (1) X = n CO , out + n CO 2 , out + n CH 4 , out 7 n C 7 H 8 , in × 100 % where, n CO , out , n CO 2 , out , n CH 4 , out , and n C 7 H 8 , in represent the molar flow rates of CO, CO2, and CH4, and the molar flow rates of toluene passing into the reactor, respectively. To ensure data reliability, carbon balance was carefully monitored during toluene conversion analysis, and only results with a carbon balance > 90 % were deemed acceptable. To assess the catalytic performance, the reaction rate was expressed in terms of turnover frequency (TOF), which was derived from the toluene conversion according to the Eq. (2): (2) TOF ( h − 1 ) = n C 7 H 8 , in × X × M m catalyst × D × L L, D, and M are the loading, dispersion, and molar mass of Ni in the catalyst, respectively, m catalyst is the catalyst mass (g). 2.4 Theoretical calculation The structural configurations and electronic characteristics were comprehensively examined through first-principles calculations based on Density Functional Theory (DFT), as implemented in the Vienna Ab initio Simulation Package (VASP). Exchange-correlation effects were treated using the Perdew-Burke-Ernzerhof (PBE) functional, with the inclusion of the DFT-D3-BJ empirical correction to properly account for dispersion interactions [38,39]. In our slab model calculations, structural relaxations were performed by allowing two outermost atomic layers to fully optimize their positions. The electronic wavefunctions were expanded in a plane-wave basis set with an energy cutoff of 400 eV to ensure convergence of the calculated properties. For Brillouin zone sampling, we employed a Monkhorst-Pack grid with dimensions of 3 × 2 × 1 in reciprocal space. The self-consistent field calculations were considered converged when the total energy difference between successive iterations fell below 1 × 10−5 eV, and the maximum residual force on any atom was less than 0.02 eV Å−1. To identify transition states along reaction pathways, we utilized both the climbing image nudged elastic band (CI-NEB) approach and the DIMER algorithm. All post-processing analyses and data extraction were performed using the VASPKIT toolkit, which enabled efficient handling of the computational outputs [40]. 3 Results and discussion 3.1 Material characterization Fig. 1A and B show the XRD patterns of the three catalysts after calcination and reduction. The diffraction peaks of CNTs and CeO2 (JCPDS No.75–0390) can be seen in Fig. 1A, indicating that CeO2 was successfully deposited on CNTs. In addition, the characteristic diffraction peaks of Ni0 were observed for Ni/CeO2/CNT even without reduction treatment, which was consistent with the observation reported in other articles [28,41,42]. This can be attributed to the fact that some of the CNTs pyrolyzed to reduce the NiO loaded on their surfaces during the high temperature calcination process. Similarly, only the characteristic diffraction peaks of Fe3O4 were observed for Fe/CeO2/CNT, which suggests that Fe oxides are more difficult to be reduced to Fe0 by CNTs compared with NiO during heat treatment. For Ni-Fe/CeO2/CNT, both Ni0 and Fe3O4 present, which is in line with the patterns observed from the other two monometallic catalysts. After reduction treatment by H2 (Fig. 1B), part of Fe3O4 in Fe/CeO2/CNT was reduced to metal Fe0, which further suggests that Fe3O4 is difficult to be completely reduced [43]. In addition, the diffraction peaks of Ni-Fe alloy (JCPDS No. 88–2324) were observed for Ni-Fe/CeO2/CNT, indicating that the reduction with H2 is a necessary pretreatment for the formation of Ni-Fe alloy. The crystallite size of Ni-Fe alloy (12.0 nm, Table 1) calculated via Scherrer's formula is the smallest, indicating that Ni-Fe/CeO2/CNT may have the highest catalytic activity. By comparison, although the crystallite size of Fe (12.8 nm) is smaller than that of Ni (18.2 nm), the content of metal species in Fe/CeO2/CNT was much smaller than that in Ni/CeO2/CNT as shall be discussed later, which may lead to the worse catalytic performance of the former catalyst. Fig. 1C depicts the adsorption and desorption curves of all catalysts, which belong to Type IV isotherms with H1 hysteresis loops according to the classification rules of IUPAC [44–46]. Fig. 1D shows that the diameters of the pores on the surface of the three catalysts are mainly distributed in the range of 2–4 nm. These results suggest that the catalysts are all mesoporous materials and coincide with the structural features of CNTs [27]. It is also worth noting that a certain number of pores are also distributed in the range of 5–70 nm, which may be due to the uneven distribution of the inner diameters of CNTs. Fe/CeO2/CNT displayed the smallest specific surface area (171.1 m2/g, Table 1). This can be ascribed to the blockage of some small pores on the surface of CNTs by Fe3O4 species [47], which also can be verified from its smallest pore volume and largest average pore size. As for Ni-Fe/CeO2/CNT, it has the smallest average pore size. This can be due to the even distribution of Ni and Fe ( Fig. 2E) as well as their partial occupation of the CNTs channels. The morphologies of the three catalysts were characterized by TEM as shown in Fig. 2. Because of the excellent thermal stability, most of the CNTs can still maintain a clear and intact tubular structure after the catalyst has been reduced at a high temperature (Fig. 2A-C). Additionally, it can be seen that a large number of metal or Fe3O4 particles are loaded on the surface of the CNTs. Some large Fe3O4 particles on Fe/CeO2/CNT are more likely to block the pores on the surface of CNTs (Fig. 2B), resulting in its smallest specific surface. This is also consistent with its results of N2 physisorption analysis (Fig. 1C and Table 1). The Ni (111), Fe (110), and (Fe, Ni) alloy crystal planes with the crystal plane spacing of 0.203 nm, 0.202 nm, and 0.208 nm, respectively were also observed for Ni-Fe/CeO2/CNT (Fig. 2D) [7,48,49]. It can be found that the aggregation of metal particles is mitigated with a more uniform distribution on CNTs due to the addition of a second metal (Fig. 2E). In order to investigate the reducibility of the three catalysts, H2-TPR profiles were recorded from 50 °C to 700 °C. As shown in Fig. 3A, by fitting the H2-TPR profiles, the reduction profiles of each sample could be fitted to four reduction peaks, and then the areas of the reduction peaks were integrated to compare the reduction properties of different compositions, as shown in Table 2. Peak I and peak II can be due to the reduction of lattice oxygen of CeO2 on its surface [50,51]. Peak III and peak IV mainly represent the reduction of Ni or Fe species with weak and strong interaction with support, respectively [52]. It can be observed that Fe/CeO2/CNT has the lowest reducibility with most of its reduction peaks (over 60 % for peak III and peak IV) located above 485 °C, indicating that Fe species in Fe/CeO2/CNT is the most difficult to be reduced, which is in accordance with the XRD results and which may result in its low SRT activity as shall be discussed later. By comparison, Ni-Fe/CeO2/CNT has the highest reducibility with more than 84 % of its reduction peaks (peak I, II, and III) presented below 403 °C. This can be attributed to the weakening of the interactions between Fe and the support due to the synergistic effect produced by the formation of Ni-Fe alloy [53]. This may contribute to the highest amount of Ni0 and Fe0 on the surface of Ni-Fe/CeO2/CNT as confirmed from the XPS results later. Additionally, the formation of Ni-Fe alloy also enhanced the sintering resistance of Ni metal, boosting its SRT catalytic performance. In addition, the reduction temperatures of CeO2 in Ni-Fe/CeO2/CNT and Ni/CeO2/CNT are also lower compared with those in Fe/CeO2/CNT. This can be due to the formation of Ni-O-Ce between Ni and CeO2, promoting the reduction of CeO2 [51]. It is interesting that the reducibility of Ni/CeO2/CNT (48.4 % for peak III and peak IV) was higher than that of Fe/CeO2/CNT, producing more Ni0 species as confirmed from XRD in Fig. 1B and the XPS results later thereby leading to its better SRT activity than that of Fe/CeO2/CNT. However, compared with Ni-Fe/CeO2/CNT, Ni/CeO2/CNT exhibited a worse stability probably because of its worse carbon deposition resistance of Ni compared with the Ni-Fe alloy. The water adsorption capacity of the three catalysts was determined by H2O-TPD as shown in Fig. 3B. In order to make a more intuitive comparison, the Gaussian function was used to fit the profiles. The H2O-TPD profiles of all catalysts could be fitted into four peaks: below 130 °C (physically adsorbed type I water), 130–200 °C (type II water interacting with species such as hydroxide via hydrogen bonding), 200–350 °C (type III water combing with the catalyst to form H-OH active sites), and above 350 °C (type IV water due to the desorption of hydroxides) [35,54]. Among these four types of water, type III water can further split to provide active protons, promoting the oxidation of toluene and inhibiting the formation of carbon during SRT [54,55]. Further analysis reveals that the proportion of type III water exhibits no significant difference between the monometallic catalysts of Ni/CeO2/CNT and Fe/CeO2/CNT. However, upon the incorporation of Fe to form Ni-Fe alloy, a remarkable enhancement in the proportion of type III water is observed ( Table 3). This phenomenon suggests that the synergistic interaction between Ni and Fe facilitates the adsorption of water, particularly the type III water, on the catalyst surface. These adsorbed water molecules may subsequently undergo dissociation during the SRT reaction, thereby providing additional active oxygen species and good SRT performance. The water dissociation capabilities of the three catalysts were compared via H2O-TPSR, with the results presented in Fig. 3C. Fitting the H₂ mass spectrometry profiles using Gaussian functions enabled determination of the water dissociation temperature on each catalyst surface. As shown in Fig. 3C, only a small quantity of water dissociated at elevated temperatures (524 °C) over Ni/CeO2/CNT, indicating weak water dissociation activity at the Ni sites. This may subsequently hinder the generation of sufficient active oxygen species during the reaction to eliminate carbon deposits from the catalyst surface, leading to rapid catalyst deactivation. In contrast, the Fe/CeO2/CNT facilitated water dissociation at significantly lower temperatures (374 °C), demonstrating superior catalytic activity for water dissociation at Fe sites compared to Ni sites. Furthermore, upon formation of the Ni-Fe alloy (Ni-Fe/CeO2/CNT), the onset temperature for water dissociation decreased further to 311 °C. Concurrently, the peak centered at 583 °C indicates that Ni-Fe/CeO2/CNT generates substantially more H2 within a temperature range closer to actual reaction conditions. These findings collectively demonstrate that Ni-Fe/CeO2/CNT exhibits the strongest water dissociation capability among the three catalysts. They also confirm that Fe effectively enhances the catalyst efficiency for water dissociation, enabling it to function as a dual active site alongside Ni in SRT. Notably, although Fe/CeO2/CNT facilitates considerable water dissociation at relatively low temperatures, its weaker adsorption capacity for type III water resulted in inferior catalytic performance compared to Ni-Fe/CeO2/CNT. In order to characterize the chemical states of different elements on the catalyst surfaces after reduction, XPS was performed as depicted in Fig. 3D-F. The XPS spectra of Ni 2p3/2 are shown in Fig. 3D, where the binding energies of 853.0 eV, 854.2 eV, and 855.0–859.0 eV are assigned to Ni0, Ni2+, and satellite peaks, respectively [26]. The binding energies of Fe0, Fe2+, and Fe3O4 in the Fe 2p3/2 XPS spectra (Fig. 3E) are located at 707.0 eV, 710.2 eV, and 711.5 eV, respectively [56]. It was observable that after doping Fe, the binding energies of Ni0 in Ni-Fe/CeO2/CNT moved to lower values compared with that in Ni/CeO2/CNT (Fig. 3D). Whereas, the binding energies of Fe species in Ni-Fe/CeO2/CNT moved to higher values compared with those in Fe/CeO2/CNT (Fig. 3E). These results indicated that the formation of Ni-Fe alloy promotes the migration of electrons from Fe to Ni. This also resulted in the slightly higher Ni0/Ni2+ ratio in Ni-Fe/CeO2/CNT compared with that in Ni/CeO2/CNT ( Table 4). In addition, it was noted that the Fe0 content in the two Fe containing catalysts is very low, which confirms that Fe in these catalysts mainly exists in the form of oxidation state. This is consistent with the XRD (Fig. 1B) and H2-TPR results (Fig. 3A). The Ce 3d spectra (Fig. 3F) were deconvoluted into eight peaks v, v’, v’’, v’’’, u, u’, u’’, and u’’’, where v’ and u’ stand for Ce3+ and v, v’’, v’’’, u, u’’, as well as u’’’ represent Ce4+, respectively [57]. It was found that the concentration of oxygen vacancy (Ce3+/(Ce3++Ce4+)) in different catalysts (Table 4) was approximately equal, making equal contributions to their catalytic performance. 3.2 SRT catalytic performance of M/CeO2/CNT 3.2.1 Effect of reaction temperature The influence of reaction temperature on catalytic performance in SRT, maintaining constant operational parameters with a S/C molar ratio of 2 and a gas hourly space velocity (GHSV) of 6000 h−1 as demonstrated in Fig. 4. As can be seen from Fig. 4A, the toluene conversion of the three catalysts increased with the increase of the reaction temperature from 600 °C to 700 °C due to the endothermic nature of SRT reaction [49]. However, when the reaction temperature is further increased to 750 °C, the catalytic activity of Ni/CeO2/CNT and Ni-Fe/CeO2/CNT begin to decline, indicating that high temperature may also lead to sintering of the active components on these two catalysts to reduce their catalytic activities, which can be verified from the increased crystalline size from the XRD characterizations after reaction as shall be discussed later. Among the three catalysts, Ni-Fe/CeO2/CNT showed a comparable toluene conversion of 88.0 % at 700 °C with that of Ni/CeO2/CNT (90.8 %, Fig. 4A). By contrast, Fe/CeO2/CNT showed little catalytic activity for SRT. The composition of products was also analyzed as shown in Fig. 4B and Fig. S1 in Supplementary material. As can be found from Fig. 4B, the H2 yield on Ni-Fe/CeO2/CNT peaked at 700 °C (3350 mmol/gcat/h). Whereas, when the temperature continued to rise to 750 °C, the H2 yield began to decline, mainly because the reverse water-gas shift (RWGS) reaction occurred to consume H2 and CO2 to produce CO. Interestingly, although Ni/CeO2/CNT has the best catalytic activity over the entire temperature range (Fig. 4A), its H2 yield is significantly lower than that of Ni-Fe/CeO2/CNT at 700 °C (Fig. S1). This suggests that although the incorporation of Fe slightly reduced the catalyst activity of Ni-Fe/CeO2/CNT, the H2 yield was greatly improved due to the enhanced water adsorption and dissociation as discussed from the H2O-TPD and H2O-TPSR data (Fig. 3B and C) and thereby the efficiency of water splitting to produce H2. However, it is worth noting that the H2 yield on Fe/CeO2/CNT is still very low, indicating that the efficiency for water splitting is dependent on the conversion of toluene. 3.2.2 Effect of the molar ratio of steam to carbon in feedstock The effect of the molar ratio of steam to carbon (S/C) on toluene conversion and product composition was also examined at 700 °C as shown in Fig. 4C and D. When the S/C ratio equals to 1, the toluene conversion gradually decreased for Ni/CeO2/CNT (from 90.7 % to 30.7 %) and Ni-Fe/CeO2/CNT (from 63.3 % to 19.1 %) during the 10 h time of stream (TOS). The main reason lead to their decrease can be attributed to that little H2O could not provide enough active oxygen for the SRT reaction [7]. With the proceed of SRT reaction, the carbon deposition gradually increased to cover the active sites on the catalyst. When the S/C ratio increased to 2, the toluene conversion on Ni-Fe/CeO2/CNT increased significantly and showed excellent catalytic stability. This is because Ni-Fe/CeO2/CNT has the highest water adsorption (Fig. 3B) and splitting ability to provide active oxygen to promote the SRT and carbon elimination. Due to the increase of toluene conversion and the decrease of carbon deposition, the yield of syngas is also significantly improved (Fig. 4D). By contrast, for Ni/CeO2/CNT, the increase of S/C ratio did not obviously increase its initial toluene conversion compared with that of Ni-Fe/CeO2/CNT. This can be ascribed to the smaller adsorption capacity for water of Ni/CeO2/CNT. Whereas, more water provides more amount of active oxygen to accelerate the elimination of carbon, slowing down the decline of its activity. Further increase the S/C ratio to 3 resulted in the decrease in toluene conversion (from 88.6 % to 81.8 %), the H2 yield, as well as the stability for Ni-Fe/CeO2/CNT. This suggests that the catalyst has been saturated with excess H2O, reducing the adsorption sites of toluene therefore decreasing the toluene conversion [58]. Notably, the Fe/CeO2/CNT catalyst showed the lowest toluene conversions under the tested three S/C ratios, further suggesting that it is hardly active for SRT probably due to its low reducibility to Fe0 species as confirmed from XRD (Fig. 1B), H2-TPR (Fig. 3A), and XPS results (Fig. 3E). To further confirm the promoting effect of Fe content, we verified the Ni/Fe ratio while maintained the total active metal loading of 10 wt% and prepared the 3Ni-7Fe/CeO2/CNT and 7Ni-3Fe/CeO2/CNT catalysts for SRT. As can be seen from Fig. S5, under the optimal reaction conditions (T = 700 °C, S/C=2), the toluene conversion during SRT over the 7Ni-3Fe/CeO2/CNT declined from 89.9 % to 70.2 % within 10 h. This indicates that while this catalyst exhibits superior initial catalytic activity towards toluene, its stability is significantly inferior to that of the Ni-Fe/CeO2/CNT. Conversely, the 3Ni-7Fe/CeO2/CNT catalyst demonstrated reasonable stability but achieved a maximum toluene conversion of only 78.5 %, substantially lower than Ni-Fe/CeO2/CNT. This suggests that the catalytic activity for toluene is predominantly governed by the Ni content. Further analysis of the gas composition revealed that the H2 yield for both 3Ni-7Fe/CeO2/CNT and 7Ni-3Fe/CeO2/CNT remained below 3000 mmol/gcat/h. This demonstrates that the Ni-Fe/CeO2/CNT also possesses the highest water dissociation activity among the three catalysts tested. Collectively, these results confirm the superior overall catalytic performance of Ni-Fe/CeO2/CNT for SRT. 3.2.3 Structure and SRT performance relationship The TOF and apparent activation energy (Ea) values of Ni/CeO2/CNT and Ni-Fe/CeO2/CNT (Fig. 4E) were also calculated based on the metal dispersion data (Table 1) and intrinsic toluene conversion data which were controlled below 20 % after exclusion of mass transfer limitations [31,49]. From the dispersion data (Table 1), it was found that Fe/CeO2/CNT had an extremely low dispersion of 0.2 %, which may be attributed to its low reducibility and poor H2 adsorption [16,18]. By comparison, the metal dispersions for Ni/CeO2/CNT and Ni-Fe/CeO2/CNT were 9.4 % and 10.6 %, respectively, indicating that Fe promotes the uniform dispersion of Ni and enhances the reducibility of Ni/CeO2/CNT as discussed in the H2-TPR result (Fig. 3A). Additionally, Ni-Fe/CeO2/CNT exhibited a lower Ea of 75.6 kJ/mol (Fig. 4E) and higher TOF value of 186.8 h−1 (Table 1), respectively, indicating its highest SRT activity among the three catalysts under investigation. In order to further explore the stability of Ni-Fe/CeO2/CNT in SRT, the catalyst was continuously reacted for 50 h TOS as shown in Fig. 4F and Fig. S2. To eliminate potential interference from the support material, a blank control experiment was performed using CeO2/CNT under identical reaction conditions (Fig. S6). The results demonstrate that CeO2/CNT exhibits negligible catalytic activity for SRT. Only trace amounts of toluene underwent thermal cracking at elevated temperatures. Having excluded any significant contribution from the CeO2/CNT support, it can be seen that the toluene conversion was maintained above 80 % with a stable H2 yield of 3000 mmol/gcat/h. Its performance was comparable with other catalysts with similar composition as shown in Table S1. The outstanding SRT performance of Ni-Fe/CeO2/CNT can be attributed to the fact that Fe doping formed Ni-Fe alloy (XRD in Fig. 1B) which enhances the reducibility (H2-TPR in Fig. 3A) and sintering resistance of both Ni and Fe ( Fig. 5), increases their dispersion (Table 1), as well as facilitates the transfer of electrons from Fe to Ni (XPS in Fig. 3D and E). This leads to the generation of more Ni0 species (Table 4) and promotes the adsorption of type III water (Table 3) due to the more positive charge of the Fe surface, thereby promoting the cleavage of H-OH bonds in water and generating a significant amount of active oxygen species. DFT calculations (Fig. 7) further proved that, Fe doping promoted water adsorption, boosted the activation of both toluene and water, decreased the energy barrier for water splitting, and lowered down the heat absorption of the key methyl dehydrogenation step during toluene cracking, which shall be discussed in detail later. These factors not only facilitate the cracking of toluene but also inhibits carbon deposition, resulting in its highest activity and stability for SRT. By comparison, for Ni/CeO2/CNT, although high Ni0 ratio (XPS in Fig. 3D and Table 4) brought about high SRT activity, the largest crystalline size of Ni0 (Table 1) lead to the deposition of the greatest amount of carbon (Fig. 5A), resulting in its low stability. As for Fe/CeO2/CNT, its lowest SRT activity can be ascribed to its low Fe0 ratio and lowest dispersion as the result of its low reducibility as confirmed from the XRD, H2-TPR, XPS, and H2 chemisorption results. It lowest SRT activity i.e. toluene conversion contributed to its least carbon deposition. 3.2.4 Characterization of M/CeO2/CNT after reaction In order to confirm the relationship between the structure and SRT performance discussed above, spent catalysts after the reaction were characterized by TG-DTG, XRD, and TEM as illustrated in Fig. 5. As shown in Fig. 5A, with the increase of temperature, the mass of the three catalysts continued to decrease, which was mainly due to the combustion of CNTs and carbon deposits in the catalysts. Therefore, the influence of CNTs should be deducted when calculating the content of carbon deposits in the spent catalysts, so the content of carbon deposition was determined by Eq. S1. In summary, the carbon deposits in the three spent catalysts Ni/CeO2/CNT, Fe/CeO2/CNT, and Ni-Fe/CeO2/CNT accounted for 85.8 %, 2.4 % and 3.13 % respectively. It can be seen that the carbon deposition for Ni-Fe/CeO2/CNT was much less than that for Ni/CeO2/CNT. These results indicate that the doping of Fe improved the carbon resistance of Ni/CeO2/CNT probably because Fe enhanced the water adsorption (Fig. 3B) and its subsequent splitting to introduce more oxygen species to eliminate the deposited carbon species. The amount of deposited carbon on Fe/CeO2/CNT, on the other hand, was comparable to that on Ni-Fe/CeO2/CNT because of its low SRT activity. The Raman spectra of the spent catalysts are shown in Fig. 5C. In accordance with literature reports, the Raman spectra were deconvoluted into four bands [59]. The D band at approximately 1340 cm−1 and the G band at approximately 1580 cm−1 correspond to amorphous carbon and graphitic carbon on the catalyst surfaces, respectively [60]. The intensity ratio of IG/ID reflects the degree of graphitization of the deposited carbon [61]. Calculations revealed that Ni-Fe/CeO2/CNT exhibited a markedly lower IG/ID ratio (0.73) than the other two catalysts, indicating its lowest degree of carbon graphitization. This characteristic enhances its reactivity with active oxygen species generated from water splitting, thus explaining its lower coke accumulation after prolonged reaction. In contrast, Ni/CeO2/CNT showed a higher IG/ID ratio, signifying its inferior coke resistance. This observation is consistent with the TG analysis results. The highest XRD peak intensity of CNTs for Ni/CeO2/CNT (Fig. 5D), indicating its largest amount of carbon deposition which is consistent with the TG results (Fig. 5A). The crystalline size of Ni increased by 13.2 % compared with the fresh catalyst (Fig. 1B), accounting for its highest carbon deposition. By comparison, for Ni-Fe/CeO2/CNT, although Ni-Fe alloy transformed into Ni0 and Fe3O4 (JCPDS No.19–0629) after reaction, the crystalline size of Ni0 was 14.7 nm which was much smaller than that in Ni/CeO2/CNT, demonstrating the high Ni0 sintering resistance by forming Ni-Fe alloy thereby maintaining its SRT activity. Compared with the morphology of the spent Ni/CeO2/CNT in Fig. 5E, Ni-Fe/CeO2/CNT showed less sintering after reaction (Fig. 5G). Additionally, the formed Fe3O4 species can provide lattice oxygen to consume the deposited carbon species therefore improving the SRT stability of Ni-Fe/CeO2/CNT [18]. Further, it was noted that Fe3O4 also has a high water adsorption ability confirmed from the H2O-TPD data of Fe/CeO2/CNT (Fig. 3B) which contains mostly Fe3O4 as discussed in the XRD results in Fig. 1B, promoting the water splitting [62,63] and maintaining the carbon resistance of Ni-Fe/CeO2/CNT. However, for Fe/CeO2/CNT, the only active Fe0 species for toluene cracking were oxidized to Fe3O4 during SRT reaction [64], leading to its low SRT activity. 3.3 The mechanism of Ni-Fe/CeO2/CNT catalyst in SRT 3.3.1 In-situ DRIFTS experiments In order to figure out the reaction mechanism of SRT over Ni-Fe/CeO2/CNT, in-situ DRIFTS experiments were conducted to observe the intermediates generated at different reaction temperatures as shown in Fig. 6. The peaks at 3072 and 3041 cm−1 are the stretching vibrations of C-H bond on the benzene ring. The vibrational bands at 2933 and 2881 cm−1 correspond to the C-H stretching modes of methylene groups in benzyl intermediates, demonstrating the occurrence of the dehydrogenation of methyl group in toluene molecules. The stretching vibration peaks belonging to CC on the benzene ring are located at 1610 and 1498 cm−1 [33]. It can be found that with the increase of reaction temperature, the intensity of these characteristic absorption peaks related to toluene decreases, indicating that high temperature promotes the toluene conversion, which is consistent with the results in Fig. 4A. Furthermore, the attenuation of the characteristic peak at 3041 cm−1 indicates the structural alteration of the methyl group in toluene, providing additional evidence that the activation of toluene molecules initiates primarily at the methyl group [33]. In addition, the characteristic peaks of benzyl alcohol (1031 cm−1), benzaldehyde (2846 and 2737 cm−1), and benzoate (1558, 1537 and 1385 cm−1) were observed, which are considered to be the key intermediates in SRT [36,65,66]. Characteristic peaks observed at 1948, 1807, 1306 cm−1 indicate that maleic anhydride was formed in the reaction [37]. Finally, the characteristic absorption peaks of CO2 and CO are located at 2360 cm−1 and 2142 cm−1, respectively [7,10]. When the reaction temperature was higher than 600 °C, the peak intensity of CO2 was weakened due to the occurrence of RWGS reaction, which was in accordance with the previous discussion in the catalytic performance section. 3.3.2 DFT calculations In order to further confirm the effect of Fe doping on the structure and SRT performance of the Ni-Fe/CeO2/CNT catalyst, Ni-Fe slab and Ni slab models were constructed for DFT calculations (Fig. S3). Firstly, the energy barriers for water splitting over different catalysts were calculated as shown in Fig. 7 A. It is clear that after the addition of Fe for Ni-Fe catalyst, the energy barrier significantly decreases, which confirms that Fe can act as a facilitator for the water splitting reaction. Since benzoate is a key intermediate as discussed in the in-situ DRIFTS experiments (Fig. 6), the potential energy diagram from toluene to benzoate was also calculated and depicted in Fig. 7B. It can be found that methyl dehydrogenation is the step that absorbs the most heat in the whole process, which can be deemed as the rate-determining step (RDS) of SRT. Additionally, Ni-Fe has less heat absorption in this step, indicating that toluene is more easily to be activated on its surface. To unveil the effect of electron transfer on the activation of toluene and H2O molecules, difference of charge density was calculated as shown in Fig. 7 C to F. From Fig. 7 C and D, it was found that more electrons were transferred from Ni-Fe surface to the benzene ring compared with that from Ni surface, resulting in the more obvious deformation of the benzene ring and thus easier toluene activation. A similar phenomenon was also observed from Fig. 7E and F. When Fe was added to the catalyst, more electrons were transferred to water molecules, which was also the fundamental reason for the improved water splitting ability of the Ni-Fe catalyst (Fig. 7 A). Further analysis of the electrostatic surface potential of Ni-Fe shows that the Fe sites have higher electrostatic potential than that of the Ni sites (Fig. S4), leading to the better interaction with the O in water molecules. Projected density of states (PDOS) of Ni and Fe elements in the two models were also calculated to compare the differences in their electronic structures as illustrated in Fig. 7 G. It can be found that the d orbital of Fe in Ni-Fe obviously has higher density of states above the Fermi level due to the existence of more empty orbitals, making it easier for Fe to coordinate with the lone-pair electrons of O in water molecules and thus promoting the splitting of water as discussed in Fig. 7 A. Further, it can also be seen that the d-band center of Fe is significantly higher than that of Ni, resulting in the stronger adsorption between Fe and reactants or reaction intermediates. Furthermore, after the formation of Ni-Fe alloy, the electrons on Fe shift to one side of Ni, filling the empty orbital on Ni, increasing the Fermi level of Ni and relatively moving down the d band center. This decreased the adsorption strength of the reaction intermediates and promoted the hydrogen evolution reaction at the Ni sites. Therefore, water will be adsorbed at the Fe sites and split into H* and OH* which will spill over to the Ni sites to generate H2 and other intermediates. Therefore, Fe and Ni in Ni-Fe/CeO2/CNT form double active sites, synergistically promoting the splitting of H2O and the cracking of toluene, respectively in SRT. 3.3.3 The SRT mechanism over Ni-Fe/CeO2/CNT Based on the reaction intermediates observed in the in-situ DRIFTS experiments (Fig. 6) and the DFT calculation results (Fig. 7), the reaction mechanism was proposed as shown in Fig. 8. Initially, H2O and toluene are adsorbed onto the Fe and Ni active sites, respectively due to the higher density states of d orbital, electrostatic potential, as well as the d-band center of the former (Fig. 7 G). The adsorbed H2O on the Fe site undergoes dissociation to form OH* and H* because of the lower energy barrier for water splitting (Fig. 7 A). The adsorbed toluene on the Ni site decomposes into H* and C6H5CH2* intermediates evidenced from the peaks at 2933 and 2881 cm−1 and the decrease in the peak intensity at 3041 cm−1 from the in-situ DRIFTS experiments (Fig. 6) [33]. Additionally, DFT calculation also proved this step as the RDS during toluene cracking (Fig. 7B). Subsequently, the OH* on the Fe site spillovers to react with C6H5CH2* on the Ni surface to produce benzyl alcohol (C6H5CH2OH*) confirmed from the 1031 cm−1 bands in the in-situ DRIFTS experiments (Fig. 6). Meanwhile, the H* spills over to the Ni site to combine with other H* on the Ni surface to form H2* and desorb to form H2 ascribed to the lower d-band center of Ni site (Fig. 7 G). As the reaction progresses, additional H2O adsorbs on the Fe site and continues to dissociate, replenishing the OH* and H*. Simultaneously, C6H5CH2OH* on the Ni surface undergoes dehydrogenation to form H2 and benzaldehyde (C6H5CHO*) (2846 and 2737 cm−1 bands in Fig. 6). C6H5CHO* continues to dehydrogenate to form H* and C6H5CO*(1558, 1537 and 1385 cm−1 bands in Fig. 6), which is then oxidized by OH* from the Fe site to yield benzoic acid (C6H5COOH*) (1558, 1537 and 1385 cm−1 bands in Fig. 6). Finally, C6H5COOH* undergoes deep oxidation, leading to ring-opening and conversion into maleic anhydride, which is further decomposed into CO, CO2, and CH4 through subsequent reactions. 4 Conclusions To elucidate the promoting effect of Fe on nickel-based catalysts in SRT, Ni-Fe/CeO2/CNT was prepared via the impregnation and precipitation method. Under the reaction conditions of S/C= 2 and 700 °C, the Ni-Fe/CeO2/CNT catalyst exhibited the highest TOF, lowest Ea, and maintained a toluene conversion above 80 % over a TOS of 50 h with the highest H2 yield. The outstanding SRT performance can be attributed to the formation of Ni-Fe alloy which promoted the reducibility of Fe species, reduced the active Ni size and increased the Ni0 ratio, improved metal dispersion, increased the sintering resistance of metal, boosted the electron transfer between Ni and Fe confirmed from the XRD, H2-TPR, H2 chemisorption, and XPS analysis. Additionally, the addition of Fe significantly improved the water adsorption capacity, particularly for type III water, and the water dissociation capabilities demonstrated from the H2O-TPD and H2O-TPSR tests (Fig. 3B-C and Table 3), providing more active oxygen for toluene conversion and carbon elimination during SRT. Finally, reaction mechanism was investigated based on the in-situ DRIFTS experiments and DFT calculations. DFT calculations revealed that the d orbital of Fe in Ni-Fe has higher density of states above the Fermi level due to the existence of more empty orbitals (Fig. 7 G), making it easier for Fe to coordinate with the lone-pair electrons of O in water molecules. Additionally, Fe sites have higher electrostatic potential and d-band center than that of the Ni sites (Fig. 7 G), leading to the stronger interaction with the O in water molecules. By contrast, Ni sites have lower d-band center thereby boosting the desorption of H2 and other intermediates during toluene dehydrogenation. Further, from the difference of charge density (Fig. 7C-F), it was found that more electrons were transferred to water and toluene molecules, making Ni-Fe catalyst easier for both water and toluene activation. Fe doping decreases the energy barrier for water splitting (Fig. 7 A) and lowers down the heat absorption for the RDS of methyl dehydrogenation (Fig. 7B). It was found that Ni and Fe in the Ni-Fe/CeO2/CNT served as active sites for toluene and water, respectively. The formation of the Ni-Fe alloy altered the electronic structure of Fe, making it more favorable for water adsorption and activation. In contrast, the Ni/CeO2/CNT catalyst suffered from rapid deactivation caused by excessive carbon deposition due to its largest Ni size. The Fe/CeO2/CNT catalyst exhibited the lowest activity in SRT due to its lowest reducibility and least ratio of Fe0 species for toluene cracking. Our findings on the promotional effect of Fe are valuable to develop other stable Fe based catalysts for steam reforming of tar. CRediT authorship contribution statement Tingwei An: Data curation, Writing – original draft, Methodology. Keliang Wang: Software. Ziwei Li: Funding acquisition, Supervision, Writing – review & editing. Zixuan Zhang: Investigation, Formal analysis. Xu Ren: Resources. Min Li: Funding acquisition, Writing – review & editing. Declaration of Competing Interest The authors declare that they have no known competing financial interests or personal relationships that could have appeared to influence the work reported in this paper. Acknowledgments This work was supported by National Natural Science Foundation of China (22168013, 22279024), Natural Science Foundation of Guizhou (QiankehejichuMS[2025]185), Young Top Talents Program of Science and Technology of Guizhou Province (Qianjiaoji[2024]315), SRT project of Guizhou University (2024SRT010, 2023SRT197). Appendix A Supporting information Supplementary data associated with this article can be found in the online version at doi:10.1016/j.apcata.2025.120424. Appendix A Supplementary material Supplementary material References [1] H. Sun Z. Wang H. Miao Z. Liu J. Huang J. Bai C. Chen Y. Fang A novel biomass gasification process for the generation of inherently separated syngas using the concept of chemical looping technology Appl. Catal. B Environ. Energy 346 2024 123729 10.1016/j.apcatb.2024.123729 H. Sun, Z. Wang, H. Miao, Z. Liu, J. Huang, J. Bai, C. Chen, Y. Fang, A novel biomass gasification process for the generation of inherently separated syngas using the concept of chemical looping technology, Appl. Catal. B-Environ. Energy 346 (2024) 123729. https://doi.org/https://doi.org/10.1016/j.apcatb.2024.123729. [2] P. Ammendola R. Chirone L. Lisi B. Piriou G. Russo Investigation of the catalytic activity of Rh–LaCoO3 catalyst in the conversion of tar from biomass devolatilization products Appl. Catal. A Gen. 385 2010 123 129 10.1016/j.apcata.2010.07.003 P. Ammendola, R. Chirone, L. Lisi, B. Piriou, G. Russo, Investigation of the catalytic activity of Rh–LaCoO3 catalyst in the conversion of tar from biomass devolatilization products, Appl. Catal. A-Gen 385 (2010) 123-129. https://doi.org/https://doi.org/10.1016/j.apcata.2010.07.003. [3] X. Chen Y. Chen H. Yang X. Wang Q. Che W. Chen H. Chen Catalytic fast pyrolysis of biomass: selective deoxygenation to balance the quality and yield of bio-oil Bioresour. Technol. 273 2018 153 158 10.1016/j.biortech.2018.11.008 X. Chen, Y. Chen, H. Yang, X. Wang, Q. Che, W. Chen, H. Chen, Catalytic fast pyrolysis of biomass: Selective deoxygenation to balance the quality and yield of bio-oil, Bioresour. Technol. 273 (2018) 153-158. https://doi.org/10.1016/j.biortech.2018.11.008. [4] E. Shayan V. Zare I. Mirzaee Hydrogen production from biomass gasification; a theoretical comparison of using different gasification agents Energy Convers. Manag. 159 2018 30 41 10.1016/j.enconman.2017.12.096 E. Shayan, V. Zare, I. Mirzaee, Hydrogen production from biomass gasification; a theoretical comparison of using different gasification agents, Energy Convers. Manage. 159 (2018) 30-41. https://doi.org/https://doi.org/10.1016/j.enconman.2017.12.096. [5] M. Hervy R. Olcese M.M. Bettahar M. Mallet A. Renard L. Maldonado D. Remy G. Mauviel A. Dufour Evolution of dolomite composition and reactivity during biomass gasification Appl. Catal. A Gen. 572 2019 97 106 10.1016/j.apcata.2018.12.014 M. Hervy, R. Olcese, M.M. Bettahar, M. Mallet, A. Renard, L. Maldonado, D. Remy, G. Mauviel, A. Dufour, Evolution of dolomite composition and reactivity during biomass gasification, Appl. Catal. A-Gen 572 (2019) 97-106. https://doi.org/https://doi.org/10.1016/j.apcata.2018.12.014. [6] Z. Zhao N. Lakshminarayanan S.L. Swartz G.B. Arkenberg L.G. Felix R.B. Slimane C.C. Choi U.S. Ozkan Characterization of olivine-supported nickel silicate as potential catalysts for tar removal from biomass gasification Appl. Catal. A Gen. 489 2015 42 50 10.1016/j.apcata.2014.10.011 Z. Zhao, N. Lakshminarayanan, S.L. Swartz, G.B. Arkenberg, L.G. Felix, R.B. Slimane, C.C. Choi, U.S. Ozkan, Characterization of olivine-supported nickel silicate as potential catalysts for tar removal from biomass gasification, Appl. Catal. A-Gen 489 (2015) 42-50. https://doi.org/https://doi.org/10.1016/j.apcata.2014.10.011. [7] J. Ren Y.-L. Liu Promoting syngas production from steam reforming of toluene using a highly stable Ni/(Mg, Al)Ox catalyst Appl. Catal. B Environ. 300 2022 120743 10.1016/j.apcatb.2021.120743 J. Ren, Y.-L. Liu, Promoting syngas production from steam reforming of toluene using a highly stable Ni/(Mg, Al)Ox catalyst, Appl. Catal. B-Environ. 300 (2022) 120743. https://doi.org/https://doi.org/10.1016/j.apcatb.2021.120743. [8] D. Mei V.M. Lebarbier R. Rousseau V.-A. Glezakou K.O. Albrecht L. Kovarik M. Flake R.A. Dagle Comparative investigation of benzene steam reforming over spinel supported Rh and Ir catalysts ACS Catal. 3 2013 1133 1143 10.1021/cs4000427 D. Mei, V.M. Lebarbier, R. Rousseau, V.-A. Glezakou, K.O. Albrecht, L. Kovarik, M. Flake, R.A. Dagle, Comparative investigation of benzene steam reforming over spinel supported Rh and Ir catalysts, ACS Catal. 3 (2013) 1133-1143. https://doi.org/10.1021/cs4000427. [9] Z. Li M. Li J. Ashok S. Kawi NiCo@NiCo phyllosilicate@CeO2 hollow core shell catalysts for steam reforming of toluene as biomass tar model compound Energy Convers. Manag. 180 2019 822 830 10.1016/j.enconman.2018.11.034 Z. Li, M. Li, J. Ashok, S. Kawi, NiCo@NiCo phyllosilicate@CeO2 hollow core shell catalysts for steam reforming of toluene as biomass tar model compound, Energy Convers. Manage. 180 (2019) 822-830. https://doi.org/https://doi.org/10.1016/j.enconman.2018.11.034. [10] S. Guo S. Liu G. Liu Modulation of Rh species in Rh/Al2O3/FeCrAl-foam structured catalysts for steam reforming of toluene Chem. Eng. J. 480 2024 148237 10.1016/j.cej.2023.148237 S. Guo, S. Liu, G. Liu, Modulation of Rh species in Rh/Al2O3/FeCrAl-foam structured catalysts for steam reforming of toluene, Chem. Eng. J. 480 (2024) 148237. https://doi.org/https://doi.org/10.1016/j.cej.2023.148237. [11] S. Zhou Z. Chen H. Gong X. Wang T. Zhu Y. Zhou Low-temperature catalytic steam reforming of toluene as a biomass tar model compound over three-dimensional ordered macroporous Ni-Pt/Ce1−xZrxO2 catalysts Appl. Catal. A Gen. 607 2020 117859 10.1016/j.apcata.2020.117859 S. Zhou, Z. Chen, H. Gong, X. Wang, T. Zhu, Y. Zhou, Low-temperature catalytic steam reforming of toluene as a biomass tar model compound over three-dimensional ordered macroporous Ni-Pt/Ce1−xZrxO2 catalysts, Appl. Catal. A-Gen 607 (2020) 117859. https://doi.org/https://doi.org/10.1016/j.apcata.2020.117859. [12] C. Ordóñez I. Martínez R. Murillo Nickel catalyst supported on mayenite/CaO for the catalytic steam reforming of a tar model compound Appl. Catal. A Gen. 700 2025 120266 10.1016/j.apcata.2025.120266 C. Ordóñez, I. Martínez, R. Murillo, Nickel catalyst supported on mayenite/CaO for the catalytic steam reforming of a tar model compound, Appl. Catal. A-Gen 700 (2025) 120266. https://doi.org/https://doi.org/10.1016/j.apcata.2025.120266. [13] Z. Yu Z. Guo L. Lang Y. Yu J. Wei X. Yin C. Wu Steam reforming of toluene as model compounds of biomass tar by Fe–K-based biochar nano-catalysts at mild temperatures Int. J. Hydrog. Energy 93 2024 238 249 10.1016/j.ijhydene.2024.10.365 Z. Yu, Z. Guo, L. Lang, Y. Yu, J. Wei, X. Yin, C. Wu, Steam reforming of toluene as model compounds of biomass tar by Fe–K-based biochar nano-catalysts at mild temperatures, Int. J. Hydrogen Energy 93 (2024) 238-249. https://doi.org/https://doi.org/10.1016/j.ijhydene.2024.10.365. [14] G. Hai X. Xue Z. Wu C. Zhang X. Liu X. Huang High-throughput calculation-based rational design of Fe-doped MoS2 nanosheets for electrocatalytic pH-universal overall water splitting J. Energy Chem. 91 2024 194 202 10.1016/j.jechem.2023.12.014 G. Hai, X. Xue, Z. Wu, C. Zhang, X. Liu, X. Huang, High-throughput calculation-based rational design of Fe-doped MoS2 nanosheets for electrocatalytic pH-universal overall water splitting, J. Energy Chem. 91 (2024) 194-202. https://doi.org/https://doi.org/10.1016/j.jechem.2023.12.014. [15] T. Shi B. Gao H. Meng Y. Fu D. Kong P. Ren H. Fu Z. Feng In situ electronic redistribution of NiCoZnP/NF heterostructure via Fe-doping for boosting hydrazine oxidation and hydrogen evolution Green Chem. 26 2024 4209 4220 10.1039/D4GC00309H T. Shi, B. Gao, H. Meng, Y. Fu, D. Kong, P. Ren, H. Fu, Z. Feng, In situ electronic redistribution of NiCoZnP/NF heterostructure via Fe-doping for boosting hydrazine oxidation and hydrogen evolution, Green Chem. 26 (2024) 4209-4220. https://doi.org/10.1039/D4GC00309H. [16] L. Wang D. Li M. Koike S. Koso Y. Nakagawa Y. Xu K. Tomishige Catalytic performance and characterization of Ni-Fe catalysts for the steam reforming of tar from biomass pyrolysis to synthesis gas Appl. Catal. A Gen. 392 2011 248 255 10.1016/j.apcata.2010.11.013 L. Wang, D. Li, M. Koike, S. Koso, Y. Nakagawa, Y. Xu, K. Tomishige, Catalytic performance and characterization of Ni-Fe catalysts for the steam reforming of tar from biomass pyrolysis to synthesis gas, Appl. Catal. A-Gen 392 (2011) 248-255. https://doi.org/https://doi.org/10.1016/j.apcata.2010.11.013. [17] M. Koike D. Li H. Watanabe Y. Nakagawa K. Tomishige Comparative study on steam reforming of model aromatic compounds of biomass tar over Ni and Ni–Fe alloy nanoparticles Appl. Catal. A Gen. 506 2015 151 162 10.1016/j.apcata.2015.09.007 M. Koike, D. Li, H. Watanabe, Y. Nakagawa, K. Tomishige, Comparative study on steam reforming of model aromatic compounds of biomass tar over Ni and Ni–Fe alloy nanoparticles, Appl. Catal. A-Gen 506 (2015) 151-162. https://doi.org/https://doi.org/10.1016/j.apcata.2015.09.007. [18] S.M. Kim P.M. Abdala T. Margossian D. Hosseini L. Foppa A. Armutlulu W. van Beek A. Comas-Vives C. Copéret C. Müller Cooperativity and dynamics increase the performance of NiFe dry reforming catalysts J. Am. Chem. Soc. 139 2017 1937 1949 10.1021/jacs.6b11487 S.M. Kim, P.M. Abdala, T. Margossian, D. Hosseini, L. Foppa, A. Armutlulu, W. van Beek, A. Comas-Vives, C. Copéret, C. Müller, Cooperativity and dynamics increase the performance of NiFe dry reforming catalysts, J. Am. Chem. Soc. 139 (2017) 1937-1949. https://doi.org/10.1021/jacs.6b11487. [19] X. Yao Q. Cheng Y. Attada S. Ould-Chikh A. Ramírez X. Bai H.O. Mohamed G. Li G. Shterk L. Zheng J. Gascon Y. Han O.M. Bakr P. Castaño Atypical stability of exsolved Ni-Fe alloy nanoparticles on double layered perovskite for CO2 dry reforming of methane Appl. Catal. B Environ. 328 2023 122479 10.1016/j.apcatb.2023.122479 X. Yao, Q. Cheng, Y. Attada, S. Ould-Chikh, A. Ramírez, X. Bai, H.O. Mohamed, G. Li, G. Shterk, L. Zheng, J. Gascon, Y. Han, O.M. Bakr, P. Castaño, Atypical stability of exsolved Ni-Fe alloy nanoparticles on double layered perovskite for CO2 dry reforming of methane, Appl. Catal. B-Environ. 328 (2023) 122479. https://doi.org/https://doi.org/10.1016/j.apcatb.2023.122479. [20] J. Ashok N. Dewangan S. Das P. Hongmanorom M.H. Wai K. Tomishige S. Kawi Recent progress in the development of catalysts for steam reforming of biomass tar model reaction Fuel Process. Technol. 199 2020 106252 10.1016/j.fuproc.2019.106252 J. Ashok, N. Dewangan, S. Das, P. Hongmanorom, M.H. Wai, K. Tomishige, S. Kawi, Recent progress in the development of catalysts for steam reforming of biomass tar model reaction, Fuel Process. Technol. 199 (2020) 106252. https://doi.org/https://doi.org/10.1016/j.fuproc.2019.106252. [21] M.A. Vasiliades C.M. Damaskinos M. Lykaki S. Stefa V.D. Binas T. Kentri S. Boghosian M. Konsolakis A.M. Efstathiou Deciphering the role of nano-CeO2 morphology on the dry reforming of methane over Ni/CeO2 using transient and isotopic techniques Appl. Catal. B Environ. Energy 350 2024 123906 10.1016/j.apcatb.2024.123906 M.A. Vasiliades, C.M. Damaskinos, M. Lykaki, S. Stefa, V.D. Binas, T. Kentri, S. Boghosian, M. Konsolakis, A.M. Efstathiou, Deciphering the role of nano-CeO2 morphology on the dry reforming of methane over Ni/CeO2 using transient and isotopic techniques, Appl. Catal. B-Environ. Energy 350 (2024) 123906. https://doi.org/https://doi.org/10.1016/j.apcatb.2024.123906. [22] L.F. Sosa M.A.S. Garcia A.C.A. Silva B.S. Archanjo A.F. Feil D. Eberhardt S.J.A. Figueroa J.M.A.Rd Almeida P.N. Romano Highly efficient low metal content Ni/CeO2 catalysts prepared by magnetron sputtering deposition for ethanol steam reforming reaction Appl. Catal. B Environ. Energy 365 2025 124940 10.1016/j.apcatb.2024.124940 L.F. Sosa, M.A.S. Garcia, A.C.A. Silva, B.S. Archanjo, A.F. Feil, D. Eberhardt, S.J.A. Figueroa, J.M.A.Rd Almeida, P.N. Romano, Highly efficient low metal content Ni/CeO2 catalysts prepared by magnetron sputtering deposition for ethanol steam reforming reaction, Appl. Catal. B-Environ. Energy 365 (2025) 124940. https://doi.org/https://doi.org/10.1016/j.apcatb.2024.124940. [23] R. Peng H. Zhang Y. Guo W. Huang Y. Zhang J. Wu M. Fu C. Yu D. Ye The lanthanide doping effect on toluene catalytic oxidation over Pt/CeO2 catalyst J. Colloid Interface Sci. 614 2022 33 46 10.1016/j.jcis.2022.01.071 R. Peng, H. Zhang, Y. Guo, W. Huang, Y. Zhang, J. Wu, M. Fu, C. Yu, D. Ye, The lanthanide doping effect on toluene catalytic oxidation over Pt/CeO2 catalyst, J. Colloid Interface Sci. 614 (2022) 33-46. https://doi.org/https://doi.org/10.1016/j.jcis.2022.01.071. [24] Y. Xia T. Mao X. Jin L. Wang J. Yan S. Lin D.-L. Peng Z. Yu G. Yue Constructed the microflower-like NiFe2O4/CeO2 composites with high concentration of oxygen vacancies to accelerate the three-phase reaction in lithium-oxygen batteries J. Colloid Interface Sci. 680 2025 418 426 10.1016/j.jcis.2024.11.128 Y. Xia, T. Mao, X. Jin, L. Wang, J. Yan, S. Lin, D.-L. Peng, Z. Yu, G. Yue, Constructed the microflower-like NiFe2O4/CeO2 composites with high concentration of oxygen vacancies to accelerate the three-phase reaction in lithium-oxygen batteries, J. Colloid Interface Sci. 680 (2025) 418-426. https://doi.org/https://doi.org/10.1016/j.jcis.2024.11.128. [25] P. Mierczynski K. Vasilev A. Mierczynska W. Maniukiewicz M.I. Szynkowska T.P. Maniecki Bimetallic Au–Cu, Au–Ni catalysts supported on MWCNTs for oxy-steam reforming of methanol Appl. Catal. B Environ. 185 2016 281 294 10.1016/j.apcatb.2015.11.047 P. Mierczynski, K. Vasilev, A. Mierczynska, W. Maniukiewicz, M.I. Szynkowska, T.P. Maniecki, Bimetallic Au–Cu, Au–Ni catalysts supported on MWCNTs for oxy-steam reforming of methanol, Appl. Catal. B-Environ. 185 (2016) 281-294. https://doi.org/https://doi.org/10.1016/j.apcatb.2015.11.047. [26] H. Zhou S. Liu F. Jing S.-Z. Luo J. Shen Y. Pang W. Chu Synergetic bimetallic NiCo/CNT catalyst for hydrogen production by glycerol steam reforming: effects of metal species distribution Ind. Eng. Chem. Res. 59 2020 17259 17268 10.1021/acs.iecr.0c01258 H. Zhou, S. Liu, F. Jing, S.-Z. Luo, J. Shen, Y. Pang, W. Chu, Synergetic Bimetallic NiCo/CNT Catalyst for Hydrogen Production by Glycerol Steam Reforming: Effects of Metal Species Distribution, Ind. Eng. Chem. Res. 59 (2020) 17259-17268. https://doi.org/10.1021/acs.iecr.0c01258. [27] S. Liu Z. Yan Y. Zhang R. Wang S.-Z. Luo F. Jing W. Chu Carbon nanotubes supported nickel as the highly efficient catalyst for hydrogen production through glycerol steam reforming ACS Sustain. Chem. Eng. 6 2018 14403 14413 10.1021/acssuschemeng.8b03095 S. Liu, Z. Yan, Y. Zhang, R. Wang, S.-Z. Luo, F. Jing, W. Chu, Carbon Nanotubes Supported Nickel as the Highly Efficient Catalyst for Hydrogen Production through Glycerol Steam Reforming, ACS Sustainable Chem. Eng. 6 (2018) 14403-14413. https://doi.org/10.1021/acssuschemeng.8b03095. [28] A.K. Yadav P.D. Vaidya Renewable hydrogen production by steam reforming of butanol over multiwalled carbon nanotube-supported catalysts Int. J. Hydrog. Energy 44 2019 30014 30023 10.1016/j.ijhydene.2019.09.054 A.K. Yadav, P.D. Vaidya, Renewable hydrogen production by steam reforming of butanol over multiwalled carbon nanotube-supported catalysts, Int. J. Hydrogen Energy 44 (2019) 30014-30023. https://doi.org/https://doi.org/10.1016/j.ijhydene.2019.09.054. [29] Y. Liu Y. Liu S.H.-S. Cheng S. Yu B. Nan H. Bian K. Md M. Wang C.Y. Chung Z.-G. Lu Conformal coating of heterogeneous CoO/Co nanocomposites on carbon nanotubes as efficient bifunctional electrocatalyst for Li-air batteries Electrochim. Acta 219 2016 560 567 10.1016/j.electacta.2016.10.064 Y. Liu, Y. Liu, S.H.-S. Cheng, S. Yu, B. Nan, H. Bian, K. Md, M. Wang, C.Y. Chung, Z.-G. Lu, Conformal Coating of Heterogeneous CoO/Co Nanocomposites on Carbon Nanotubes as Efficient Bifunctional Electrocatalyst for Li-Air Batteries, Electrochim. Acta 219 (2016) 560-567. https://doi.org/https://doi.org/10.1016/j.electacta.2016.10.064. [30] Y. Yang K. Chiang N. Burke Porous carbon-supported catalysts for energy and environmental applications: a short review Catal. Today 178 2011 197 205 10.1016/j.cattod.2011.08.028 Y. Yang, K. Chiang, N. Burke, Porous carbon-supported catalysts for energy and environmental applications: A short review, Catal. Today 178 (2011) 197-205. https://doi.org/https://doi.org/10.1016/j.cattod.2011.08.028. [31] U. Oemar A. Ming Li K. Hidajat S. Kawi Mechanism and kinetic modeling for steam reforming of toluene on La0.8Sr0.2Ni0.8Fe0.2O3 catalyst AIChE J. 60 2014 4190 4198 10.1002/aic.14573 U. Oemar, A. Ming Li, K. Hidajat, S. Kawi, Mechanism and kinetic modeling for steam reforming of toluene on La0.8Sr0.2Ni0.8Fe0.2O3 catalyst, AIChE J. 60 (2014) 4190-4198. https://doi.org/https://doi.org/10.1002/aic.14573. [32] D. Han X. Ma X. Yang M. Xiao H. Sun L. Ma X. Yu M. Ge Metal organic framework-templated fabrication of exposed surface defect-enriched Co3O4 catalysts for efficient toluene oxidation J. Colloid Interface Sci. 603 2021 695 705 10.1016/j.jcis.2021.06.139 D. Han, X. Ma, X. Yang, M. Xiao, H. Sun, L. Ma, X. Yu, M. Ge, Metal organic framework-templated fabrication of exposed surface defect-enriched Co3O4 catalysts for efficient toluene oxidation, J. Colloid Interface Sci. 603 (2021) 695-705. https://doi.org/10.1016/j.jcis.2021.06.139. [33] S. Zhao K. Li S. Jiang J. Li Pd–Co based spinel oxides derived from pd nanoparticles immobilized on layered double hydroxides for toluene combustion Appl. Catal. B Environ. 181 2016 236 248 10.1016/j.apcatb.2015.08.001 S. Zhao, K. Li, S. Jiang, J. Li, Pd–Co based spinel oxides derived from pd nanoparticles immobilized on layered double hydroxides for toluene combustion, Appl. Catal. B-Environ. 181 (2016) 236-248. https://doi.org/https://doi.org/10.1016/j.apcatb.2015.08.001. [34] D. Yan T. Li P. Liu S. Mo J. Zhong Q. Ren Y. Sun H. Cheng M. Fu J. Wu P. Chen H. Huang D. Ye In-situ atmosphere thermal pyrolysis of spindle-like Ce(OH)CO3 to fabricate Pt/CeO2 catalysts: enhancing Pt–O–Ce bond intensity and boosting toluene degradation Chemosphere 279 2021 10.1016/j.chemosphere.2021.130658 D. Yan, T. Li, P. Liu, S. Mo, J. Zhong, Q. Ren, Y. Sun, H. Cheng, M. Fu, J. Wu, P. Chen, H. Huang, D. Ye, In-situ atmosphere thermal pyrolysis of spindle-like Ce(OH)CO3 to fabricate Pt/CeO2 catalysts: Enhancing Pt–O–Ce bond intensity and boosting toluene degradation, Chemosphere 279 (2021). https://doi.org/10.1016/j.chemosphere.2021.130658. [35] X. Zhang F. Bi Z. Zhu Y. Yang S. Zhao J. Chen X. Lv Y. Wang J. Xu N. Liu The promoting effect of H2O on rod-like MnCeOx derived from MOFs for toluene oxidation: a combined experimental and theoretical investigation Appl. Catal. BEnviron. 297 2021 120393 10.1016/j.apcatb.2021.120393 X. Zhang, F. Bi, Z. Zhu, Y. Yang, S. Zhao, J. Chen, X. Lv, Y. Wang, J. Xu, N. Liu, The promoting effect of H2O on rod-like MnCeOx derived from MOFs for toluene oxidation: a combined experimental and theoretical investigation, Appl. Catal. B-Environ. 297 (2021) 120393. https://doi.org/https://doi.org/10.1016/j.apcatb.2021.120393. [36] X. Chen X. Chen E. Yu S. Cai H. Jia J. Chen P. Liang In situ pyrolysis of Ce-MOF to prepare CeO2 catalyst with obviously improved catalytic performance for toluene combustion Chem. Eng. J. 344 2018 469 479 10.1016/j.cej.2018.03.091 X. Chen, X. Chen, E. Yu, S. Cai, H. Jia, J. Chen, P. Liang, In situ pyrolysis of Ce-MOF to prepare CeO2 catalyst with obviously improved catalytic performance for toluene combustion, Chem. Eng. J. 344 (2018) 469-479. https://doi.org/https://doi.org/10.1016/j.cej.2018.03.091. [37] X. Yang X. Yu M. Jing W. Song J. Liu M. Ge Defective MnxZr1–xO2 solid solution for the catalytic oxidation of toluene: insights into the oxygen vacancy contribution ACS Appl. Mater. Interfaces 11 2019 730 739 10.1021/acsami.8b17062 X. Yang, X. Yu, M. Jing, W. Song, J. Liu, M. Ge, Defective MnxZr1–xO2 Solid Solution for the Catalytic Oxidation of Toluene: Insights into the Oxygen Vacancy Contribution, ACS Appl. Mater. Interfaces 11 (2019) 730-739. https://doi.org/10.1021/acsami.8b17062. [38] G. Kresse J. Furthmüller Efficient iterative schemes for ab initio total-energy calculations using a plane-wave basis set Phys. Rev. B 54 1996 11169 11186 10.1103/PhysRevB.54.11169 G. Kresse, J. Furthmüller, Efficient iterative schemes for ab initio total-energy calculations using a plane-wave basis set, Phys. Rev. B 54 (1996) 11169-11186. https://doi.org/10.1103/PhysRevB.54.11169. [39] S. Grimme J. Antony S. Ehrlich H. Krieg A consistent and accurate ab initio parametrization of density functional dispersion correction (DFT-D) for the 94 elements H-Pu J. Chem. Phys. 132 2010 10.1063/1.3382344 S. Grimme, J. Antony, S. Ehrlich, H. Krieg, A consistent and accurate ab initio parametrization of density functional dispersion correction (DFT-D) for the 94 elements H-Pu, J. Chem. Phys. 132 (2010). https://doi.org/10.1063/1.3382344. [40] V. Wang N. Xu J.-C. Liu G. Tang W.-T. Geng VASPKIT: a user-friendly interface facilitating high-throughput computing and analysis using VASP code Comput. Phys. Commun. 267 2021 108033 10.1016/j.cpc.2021.108033 V. Wang, N. Xu, J.-C. Liu, G. Tang, W.-T. Geng, VASPKIT: A user-friendly interface facilitating high-throughput computing and analysis using VASP code, Comput. Phys. Commun. 267 (2021) 108033. https://doi.org/https://doi.org/10.1016/j.cpc.2021.108033. [41] H. Taghvaei A. Bakhtyari M. Reza Rahimpour Carbon nanotube supported nickel catalysts for anisole and cyclohexanone conversion in the presence of hydrogen and synthesis gas: effect of plasma, acid, and thermal functionalization Fuel 288 2021 119698 10.1016/j.fuel.2020.119698 H. Taghvaei, A. Bakhtyari, M. Reza Rahimpour, Carbon nanotube supported nickel catalysts for anisole and cyclohexanone conversion in the presence of hydrogen and synthesis gas: Effect of plasma, acid, and thermal functionalization, Fuel 288 (2021) 119698. https://doi.org/https://doi.org/10.1016/j.fuel.2020.119698. [42] Z. Li J. Yang D.A. Agyeman M. Park W. Tamakloe Y. Yamauchi Y.-M. Kang CNT@Ni@Ni–Co silicate core–shell nanocomposite: a synergistic triple-coaxial catalyst for enhancing catalytic activity and controlling side products for Li–O2 batteries J. Mater. Chem. A 6 2018 10447 10455 10.1039/C8TA03099E Z. Li, J. Yang, D.A. Agyeman, M. Park, W. Tamakloe, Y. Yamauchi, Y.-M. Kang, CNT@Ni@Ni–Co silicate core–shell nanocomposite: a synergistic triple-coaxial catalyst for enhancing catalytic activity and controlling side products for Li–O2 batteries, J. Mater. Chem. A 6 (2018) 10447-10455. https://doi.org/10.1039/C8TA03099E. [43] X. Hua Y. Fan Y. Wang T. Fu G.D. Fowler D. Zhao W. Wang The behaviour of multiple reaction fronts during iron (III) oxide reduction in a non-steady state packed bed for chemical looping water splitting Appl. Energy 193 2017 96 111 10.1016/j.apenergy.2017.01.036 X. Hua, Y. Fan, Y. Wang, T. Fu, G.D. Fowler, D. Zhao, W. Wang, The behaviour of multiple reaction fronts during iron (III) oxide reduction in a non-steady state packed bed for chemical looping water splitting, Appl. Energy 193 (2017) 96-111. https://doi.org/https://doi.org/10.1016/j.apenergy.2017.01.036. [44] J. Huang X. Feng F. Bi G. Huang R. Rao R. Qiao X. Zhang Strategic defect engineering in TiO2 catalysts through electron beam irradiation: unraveling enhanced photocatalytic pathways for multicomponent VOCs degradation Sep. Purif. Technol. 359 2025 130804 10.1016/j.seppur.2024.130804 J. Huang, X. Feng, F. Bi, G. Huang, R. Rao, R. Qiao, X. Zhang, Strategic defect engineering in TiO2 catalysts through electron beam irradiation: Unraveling enhanced photocatalytic pathways for multicomponent VOCs degradation, Sep. Purif. Technol. 359 (2025) 130804. https://doi.org/https://doi.org/10.1016/j.seppur.2024.130804. [45] N. Zhang C. He Y. Jing Y. Qian M. Obuchi R. Toyoshima H. Kondoh K. Oka B. Wu L. Li A. Anzai T. Toyao K.-i Shimizu Enhanced nitrous oxide decomposition on zirconium-supported rhodium catalysts by iridium augmentation Environ. Sci. Technol. 59 2025 1598 1607 10.1021/acs.est.4c08083 N. Zhang, C. He, Y. Jing, Y. Qian, M. Obuchi, R. Toyoshima, H. Kondoh, K. Oka, B. Wu, L. Li, A. Anzai, T. Toyao, K.-i Shimizu, Enhanced Nitrous Oxide Decomposition on Zirconium-Supported Rhodium Catalysts by Iridium Augmentation, Environ. Sci. Technol. 59 (2025) 1598-1607. https://doi.org/10.1021/acs.est.4c08083. [46] F. Bi J. Wei Z. Zhou Y. Zhang B. Gao N. Liu J. Xu B. Liu Y. Huang X. Zhang Insight into the synergistic effect of binary nonmetallic codoped Co3O4 catalysts for efficient ethyl acetate degradation under humid conditions JACS Au 5 2025 363 380 10.1021/jacsau.4c01146 F. Bi, J. Wei, Z. Zhou, Y. Zhang, B. Gao, N. Liu, J. Xu, B. Liu, Y. Huang, X. Zhang, Insight into the Synergistic Effect of Binary Nonmetallic Codoped Co3O4 Catalysts for Efficient Ethyl Acetate Degradation under Humid Conditions, JACS Au 5 (2025) 363-380. https://doi.org/10.1021/jacsau.4c01146. [47] R.M.M. Abbaslou A. Tavassoli J. Soltan A.K. Dalai Iron catalysts supported on carbon nanotubes for Fischer–Tropsch synthesis: effect of catalytic site position Appl. Catal. A Gen. 367 2009 47 52 10.1016/j.apcata.2009.07.025 R.M.M. Abbaslou, A. Tavassoli, J. Soltan, A.K. Dalai, Iron catalysts supported on carbon nanotubes for Fischer–Tropsch synthesis: Effect of catalytic site position, Appl. Catal. A-Gen 367 (2009) 47-52. https://doi.org/https://doi.org/10.1016/j.apcata.2009.07.025. [48] S. Simonetti G. Brizuela A. Juan Study of the adsorption, electronic structure and bonding of C2H4 on the FeNi(111) surface Appl. Surf. Sci. 256 2010 6459 6465 10.1016/j.apsusc.2010.04.035 S. Simonetti, G. Brizuela, A. Juan, Study of the adsorption, electronic structure and bonding of C2H4 on the FeNi(111) surface, Appl. Surf. Sci. 256 (2010) 6459-6465. https://doi.org/https://doi.org/10.1016/j.apsusc.2010.04.035. [49] X. Zou T. Chen P. Zhang D. Chen J. He Y. Dang Z. Ma Y. Chen P. Toloueinia C. Zhu J. Xie H. Liu S.L. Suib High catalytic performance of Fe-Ni/Palygorskite in the steam reforming of toluene for hydrogen production Appl. Energy 226 2018 827 837 10.1016/j.apenergy.2018.06.005 X. Zou, T. Chen, P. Zhang, D. Chen, J. He, Y. Dang, Z. Ma, Y. Chen, P. Toloueinia, C. Zhu, J. Xie, H. Liu, S.L. Suib, High catalytic performance of Fe-Ni/Palygorskite in the steam reforming of toluene for hydrogen production, Appl. Energy 226 (2018) 827-837. https://doi.org/https://doi.org/10.1016/j.apenergy.2018.06.005. [50] W. Shan M. Luo P. Ying W. Shen C. Li, Reduction property and catalytic activity of Ce1−XNiXO2 mixed oxide catalysts for CH4 oxidation Appl. Catal. A Gen. 246 2003 1 9 10.1016/S0926-860X(02)00659-2 W. Shan, M. Luo, P. Ying, W. Shen, C. Li, Reduction property and catalytic activity of Ce1−XNiXO2 mixed oxide catalysts for CH4 oxidation, Appl. Catal. A-Gen 246 (2003) 1-9. https://doi.org/https://doi.org/10.1016/S0926-860X(02)00659-2. [51] X. Zhang R. You D. Li T. Cao W. Huang Reaction sensitivity of ceria morphology effect on Ni/CeO2 catalysis in propane oxidation reactions ACS Appl. Mater. Interfaces 9 2017 35897 35907 10.1021/acsami.7b11536 X. Zhang, R. You, D. Li, T. Cao, W. Huang, Reaction sensitivity of ceria morphology effect on Ni/CeO2 catalysis in propane oxidation reactions, ACS Appl. Mater. Interfaces 9 (2017) 35897-35907. https://doi.org/10.1021/acsami.7b11536. [52] J. Ashok S. Kawi Nickel–iron alloy supported over iron–alumina catalysts for steam reforming of biomass tar model compound ACS Catal. 4 2014 289 301 10.1021/cs400621p J. Ashok, S. Kawi, Nickel–iron alloy supported over iron–alumina catalysts for steam reforming of biomass tar model compound, ACS Catal. 4 (2014) 289-301. https://doi.org/10.1021/cs400621p. [53] R. Peng Y. Chen B. Zhang Z. Li X. Cui C. Guo Y. Zhao J. Zhang Tailoring the stability of Ni-Fe/mayenite in methane – carbon dioxide reforming Fuel 284 2021 118909 10.1016/j.fuel.2020.118909 R. Peng, Y. Chen, B. Zhang, Z. Li, X. Cui, C. Guo, Y. Zhao, J. Zhang, Tailoring the stability of Ni-Fe/mayenite in methane – Carbon dioxide reforming, Fuel 284 (2021) 118909. https://doi.org/https://doi.org/10.1016/j.fuel.2020.118909. [54] Y. Wang F. Wang Q. Song Q. Xin S. Xu J. Xu Heterogeneous ceria catalyst with water-tolerant lewis acidic sites for one-pot synthesis of 1,3-diols via prins condensation and hydrolysis reactions J. Am. Chem. Soc. 135 2013 1506 1515 10.1021/ja310498c Y. Wang, F. Wang, Q. Song, Q. Xin, S. Xu, J. Xu, Heterogeneous Ceria Catalyst with Water-Tolerant Lewis Acidic Sites for One-Pot Synthesis of 1,3-Diols via Prins Condensation and Hydrolysis Reactions, J. Am. Chem. Soc. 135 (2013) 1506-1515. https://doi.org/10.1021/ja310498c. [55] C. Ma C. Yang B. Wang C. Chen F. Wang X. Yao M. Song Effects of H2O on HCHO and CO oxidation at room-temperature catalyzed by MCo2O4 (M=Mn, Ce and Cu) materials Appl. Catal. B Environ. 254 2019 76 85 10.1016/j.apcatb.2019.04.085 C. Ma, C. Yang, B. Wang, C. Chen, F. Wang, X. Yao, M. Song, Effects of H2O on HCHO and CO oxidation at room-temperature catalyzed by MCo2O4 (M=Mn, Ce and Cu) materials, Appl. Catal. B-Environ. 254 (2019) 76-85. https://doi.org/https://doi.org/10.1016/j.apcatb.2019.04.085. [56] N. Liu M. Tian Y. Zhang J. Yang Z. Wang W. Dai G. Quan J. Lei X. Zhang L. Tang Three-dimensional MIL-88A(Fe)-derived α-Fe2O3 and graphene composite for efficient photo-Fenton-like degradation of ciprofloxacin Chin. Chem. Lett. 2025 111063 10.1016/j.cclet.2025.111063 N. Liu, M. Tian, Y. Zhang, J. Yang, Z. Wang, W. Dai, G. Quan, J. Lei, X. Zhang, L. Tang, Three-dimensional MIL-88A(Fe)-derived α-Fe2O3 and graphene composite for efficient photo-Fenton-like degradation of ciprofloxacin, Chin. Chem. Lett. (2025) 111063. https://doi.org/https://doi.org/10.1016/j.cclet.2025.111063. [57] X. Han Z. Zhang Y. Dong J. Zhao G. Sun J. Hu Q. Xu X. Zhang L. Li T. Toyao K.-i Shimizu N. Zhang Photothermal CO2 hydrogenation to CO on CeO2 catalyst via redox mechanism Chem. Eng. J. 510 2025 161609 10.1016/j.cej.2025.161609 X. Han, Z. Zhang, Y. Dong, J. Zhao, G. Sun, J. Hu, Q. Xu, X. Zhang, L. Li, T. Toyao, K.-i Shimizu, N. Zhang, Photothermal CO2 hydrogenation to CO on CeO2 catalyst via redox mechanism, Chem. Eng. J. 510 (2025) 161609. https://doi.org/https://doi.org/10.1016/j.cej.2025.161609. [58] D. Świerczyński S. Libs C. Courson A. Kiennemann Steam reforming of tar from a biomass gasification process over Ni/olivine catalyst using toluene as a model compound Appl. Catal. B Environ. 74 2007 211 222 10.1016/j.apcatb.2007.01.017 D. Świerczyński, S. Libs, C. Courson, A. Kiennemann, Steam reforming of tar from a biomass gasification process over Ni/olivine catalyst using toluene as a model compound, Appl. Catal. B-Environ. 74 (2007) 211-222. https://doi.org/https://doi.org/10.1016/j.apcatb.2007.01.017. [59] Y. Zhang M. Liu C. Huang H. Zhang J. Zheng Y. Qin Y. Yang Y. Mei Y. Zu Origin of extra-stable multinuclear zinc species riveted into siliceous zeolite for efficient propane dehydrogenation Chem. Eng. J. 495 2024 153323 10.1016/j.cej.2024.153323 Y. Zhang, M. Liu, C. Huang, H. Zhang, J. Zheng, Y. Qin, Y. Yang, Y. Mei, Y. Zu, Origin of extra-stable multinuclear zinc species riveted into siliceous zeolite for efficient propane dehydrogenation, Chem. Eng. J. 495 (2024) 153323. https://doi.org/https://doi.org/10.1016/j.cej.2024.153323. [60] J. Ren Z. Abbasi I. Ullah F. Zeng Dry reforming of toluene for syngas production over Ni-based perovskite-type oxides Appl. Catal. B Environ. Energy 361 2025 124555 10.1016/j.apcatb.2024.124555 J. Ren, Z. Abbasi, I. Ullah, F. Zeng, Dry reforming of toluene for syngas production over Ni-based perovskite-type oxides, Appl. Catal. B-Environ. Energy 361 (2025) 124555. https://doi.org/https://doi.org/10.1016/j.apcatb.2024.124555. [61] C. Liu D. Chen Y. Cao T. zhang Y. Mao W. Wang Z. Wang S. Kawi Catalytic steam reforming of in-situ tar from rice husk over MCM-41 supported LaNiO3 to produce hydrogen rich syngas Renew. Energy 161 2020 408 418 10.1016/j.renene.2020.07.089 C. Liu, D. Chen, Y. Cao, T. zhang, Y. Mao, W. Wang, Z. Wang, S. Kawi, Catalytic steam reforming of in-situ tar from rice husk over MCM-41 supported LaNiO3 to produce hydrogen rich syngas, Renewable Energy 161 (2020) 408-418. https://doi.org/https://doi.org/10.1016/j.renene.2020.07.089. [62] S. Liu S. Wang W. Li J. Guo Q. Guo Water dissociation on magnetite (001) films J. Phys. Chem. C. 117 2013 14070 14074 10.1021/jp403799n S. Liu, S. Wang, W. Li, J. Guo, Q. Guo, Water Dissociation on Magnetite (001) Films, J. Phys. Chem. C 117 (2013) 14070-14074. https://doi.org/10.1021/jp403799n. [63] D. Karatza C. Konstantopoulos S. Chianese S. Diplas P. Svec E. Hristoforou D. Musmarra Hydrogen production through water splitting at low temperature over Fe3O4 pellet: effects of electric power, magnetic field, and temperature Fuel Process. Technol. 211 2021 106606 10.1016/j.fuproc.2020.106606 D. Karatza, C. Konstantopoulos, S. Chianese, S. Diplas, P. Svec, E. Hristoforou, D. Musmarra, Hydrogen production through water splitting at low temperature over Fe3O4 pellet: Effects of electric power, magnetic field, and temperature, Fuel Process. Technol. 211 (2021) 106606. https://doi.org/https://doi.org/10.1016/j.fuproc.2020.106606. [64] C. Luo B. Dou H. Zhang L. Zhao P. Zeng D. Gao Y. Wang H. Chen Y. Xu Hydrogen and syngas co-production by coupling of chemical looping water splitting and glycerol oxidation reforming using Ce–Ni modified Fe-based oxygen carriers J. Clean. Prod. 335 2022 130299 10.1016/j.jclepro.2021.130299 C. Luo, B. Dou, H. Zhang, L. Zhao, P. Zeng, D. Gao, Y. Wang, H. Chen, Y. Xu, Hydrogen and syngas co-production by coupling of chemical looping water splitting and glycerol oxidation reforming using Ce–Ni modified Fe-based oxygen carriers, J. Clean. Prod. 335 (2022) 130299. https://doi.org/https://doi.org/10.1016/j.jclepro.2021.130299. [65] H. Sun Z.G. Liu S. Chen X. Quan The role of lattice oxygen on the activity and selectivity of the OMS-2 catalyst for the total oxidation of toluene Chem. Eng. J. 270 2015 58 65 10.1016/j.cej.2015.02.017 H. Sun, Z.G. Liu, S. Chen, X. Quan, The role of lattice oxygen on the activity and selectivity of the OMS-2 catalyst for the total oxidation of toluene, Chem. Eng. J. 270 (2015) 58-65. https://doi.org/10.1016/j.cej.2015.02.017. [66] Z. Jia X. Wang F. Thevenet A. Rousseau Dynamic probing of plasma-catalytic surface processes: oxidation of toluene on CeO2 Plasma Process. Polym. 14 2017 1600114 10.1002/ppap.201600114 Z. Jia, X. Wang, F. Thevenet, A. Rousseau, Dynamic probing of plasma-catalytic surface processes: oxidation of toluene on CeO2, Plasma Processes Polym. 14 (2017) 1600114. https://doi.org/https://doi.org/10.1002/ppap.201600114.",
      "scopus-id": "105009688198",
      "coredata": {
        "eid": "1-s2.0-S0926860X25003254",
        "dc:description": "Steam reforming of tar represents a cost-effective approach for tar removal in biomass gasification. Here, we developed a Ni-Fe/CeO2/CNT catalyst and unveil the effect of Fe for steam reforming of toluene (SRT) which is a representative tar model compound. The catalyst demonstrated exceptional stability (above 80 % toluene conversion, 3000 mmol/gcat/h H2 yield) over 50 h. The outstanding performance is attributed to the effect of Fe in forming Ni-Fe alloy with the highest reducibility, dispersion, Ni0 ratio, and increased sintering resistance, alongside enhanced electron transfer between Ni and Fe. Fe also promotes H2O adsorption, providing active oxygen for toluene conversion and carbon elimination. Finally, reaction mechanism was explored based on the in-situ DRIFTS and DFT calculations. DFT calculations revealed that Fe sites exhibit higher density of states, electrostatic potential, and d-band center than Ni sites, facilitating H2O coordination. Fe doping reduces energy barriers for H2O splitting and methyl dehydrogenation, while Ni promotes H2 desorption. The synergistic Ni-Fe interaction enables distinct activation of toluene and H2O, respectively. Comparative studies showed Ni/CeO2/CNT suffers from carbon deposition, while Fe/CeO2/CNT exhibits limited activity due to poor reducibility and low Fe0 content. These findings provide critical insights for designing stable Fe-based catalysts for efficient tar removal.",
        "openArchiveArticle": "false",
        "prism:coverDate": "2025-09-25",
        "openaccessUserLicense": null,
        "prism:aggregationType": "Journal",
        "prism:url": "https://api.elsevier.com/content/article/pii/S0926860X25003254",
        "dc:creator": [
          {
            "@_fa": "true",
            "$": "An, Tingwei"
          },
          {
            "@_fa": "true",
            "$": "Zhang, Zixuan"
          },
          {
            "@_fa": "true",
            "$": "Ren, Xu"
          },
          {
            "@_fa": "true",
            "$": "Wang, Keliang"
          },
          {
            "@_fa": "true",
            "$": "Li, Ziwei"
          },
          {
            "@_fa": "true",
            "$": "Li, Min"
          }
        ],
        "link": [
          {
            "@_fa": "true",
            "@rel": "self",
            "@href": "https://api.elsevier.com/content/article/pii/S0926860X25003254"
          },
          {
            "@_fa": "true",
            "@rel": "scidir",
            "@href": "https://www.sciencedirect.com/science/article/pii/S0926860X25003254"
          }
        ],
        "dc:format": "application/json",
        "openaccessType": null,
        "pii": "S0926-860X(25)00325-4",
        "prism:volume": "705",
        "articleNumber": "120424",
        "prism:publisher": "Elsevier B.V. All rights are reserved, including those for text and data mining, AI training, and similar technologies.",
        "dc:title": "Fe doping promotes water splitting activity of nickel-based catalysts in steam reforming of tar model compound",
        "prism:copyright": "© 2025 Elsevier B.V. All rights are reserved, including those for text and data mining, AI training, and similar technologies.",
        "openaccess": "0",
        "prism:issn": "0926860X",
        "dcterms:subject": [
          {
            "@_fa": "true",
            "$": "Fe doping"
          },
          {
            "@_fa": "true",
            "$": "Water splitting"
          },
          {
            "@_fa": "true",
            "$": "Steam reforming of toluene"
          },
          {
            "@_fa": "true",
            "$": "Ni-Fe/CeO2/CNT"
          }
        ],
        "openaccessArticle": "false",
        "prism:publicationName": "Applied Catalysis A: General",
        "openaccessSponsorType": null,
        "prism:pageRange": "120424",
        "pubType": "fla",
        "prism:coverDisplayDate": "25 September 2025",
        "prism:doi": "10.1016/j.apcata.2025.120424",
        "prism:startingPage": "120424",
        "dc:identifier": "doi:10.1016/j.apcata.2025.120424",
        "openaccessSponsorName": null
      },
      "objects": {
        "object": [
          {
            "@category": "standard",
            "@height": "477",
            "@width": "807",
            "@_fa": "true",
            "$": "https://api.elsevier.com/content/object/eid/1-s2.0-S0926860X25003254-gr7.jpg?httpAccept=%2A%2F%2A",
            "@multimediatype": "JPEG image file",
            "@type": "IMAGE-DOWNSAMPLED",
            "@size": "85993",
            "@ref": "gr7",
            "@mimetype": "image/jpeg"
          },
          {
            "@category": "standard",
            "@height": "238",
            "@width": "678",
            "@_fa": "true",
            "$": "https://api.elsevier.com/content/object/eid/1-s2.0-S0926860X25003254-gr6.jpg?httpAccept=%2A%2F%2A",
            "@multimediatype": "JPEG image file",
            "@type": "IMAGE-DOWNSAMPLED",
            "@size": "50787",
            "@ref": "gr6",
            "@mimetype": "image/jpeg"
          },
          {
            "@category": "standard",
            "@height": "622",
            "@width": "678",
            "@_fa": "true",
            "$": "https://api.elsevier.com/content/object/eid/1-s2.0-S0926860X25003254-gr8.jpg?httpAccept=%2A%2F%2A",
            "@multimediatype": "JPEG image file",
            "@type": "IMAGE-DOWNSAMPLED",
            "@size": "55970",
            "@ref": "gr8",
            "@mimetype": "image/jpeg"
          },
          {
            "@category": "standard",
            "@height": "410",
            "@width": "807",
            "@_fa": "true",
            "$": "https://api.elsevier.com/content/object/eid/1-s2.0-S0926860X25003254-gr3.jpg?httpAccept=%2A%2F%2A",
            "@multimediatype": "JPEG image file",
            "@type": "IMAGE-DOWNSAMPLED",
            "@size": "83382",
            "@ref": "gr3",
            "@mimetype": "image/jpeg"
          },
          {
            "@category": "standard",
            "@height": "315",
            "@width": "807",
            "@_fa": "true",
            "$": "https://api.elsevier.com/content/object/eid/1-s2.0-S0926860X25003254-gr2.jpg?httpAccept=%2A%2F%2A",
            "@multimediatype": "JPEG image file",
            "@type": "IMAGE-DOWNSAMPLED",
            "@size": "94486",
            "@ref": "gr2",
            "@mimetype": "image/jpeg"
          },
          {
            "@category": "standard",
            "@height": "245",
            "@width": "282",
            "@_fa": "true",
            "$": "https://api.elsevier.com/content/object/eid/1-s2.0-S0926860X25003254-ga1.jpg?httpAccept=%2A%2F%2A",
            "@multimediatype": "JPEG image file",
            "@type": "IMAGE-DOWNSAMPLED",
            "@size": "28107",
            "@ref": "ga1",
            "@mimetype": "image/jpeg"
          },
          {
            "@category": "standard",
            "@height": "397",
            "@width": "807",
            "@_fa": "true",
            "$": "https://api.elsevier.com/content/object/eid/1-s2.0-S0926860X25003254-gr5.jpg?httpAccept=%2A%2F%2A",
            "@multimediatype": "JPEG image file",
            "@type": "IMAGE-DOWNSAMPLED",
            "@size": "93648",
            "@ref": "gr5",
            "@mimetype": "image/jpeg"
          },
          {
            "@category": "standard",
            "@height": "401",
            "@width": "807",
            "@_fa": "true",
            "$": "https://api.elsevier.com/content/object/eid/1-s2.0-S0926860X25003254-gr4.jpg?httpAccept=%2A%2F%2A",
            "@multimediatype": "JPEG image file",
            "@type": "IMAGE-DOWNSAMPLED",
            "@size": "78111",
            "@ref": "gr4",
            "@mimetype": "image/jpeg"
          },
          {
            "@category": "standard",
            "@height": "517",
            "@width": "678",
            "@_fa": "true",
            "$": "https://api.elsevier.com/content/object/eid/1-s2.0-S0926860X25003254-gr1.jpg?httpAccept=%2A%2F%2A",
            "@multimediatype": "JPEG image file",
            "@type": "IMAGE-DOWNSAMPLED",
            "@size": "74454",
            "@ref": "gr1",
            "@mimetype": "image/jpeg"
          },
          {
            "@category": "thumbnail",
            "@height": "130",
            "@width": "219",
            "@_fa": "true",
            "$": "https://api.elsevier.com/content/object/eid/1-s2.0-S0926860X25003254-gr7.sml?httpAccept=%2A%2F%2A",
            "@multimediatype": "GIF image file",
            "@type": "IMAGE-THUMBNAIL",
            "@size": "10248",
            "@ref": "gr7",
            "@mimetype": "image/gif"
          },
          {
            "@category": "thumbnail",
            "@height": "77",
            "@width": "219",
            "@_fa": "true",
            "$": "https://api.elsevier.com/content/object/eid/1-s2.0-S0926860X25003254-gr6.sml?httpAccept=%2A%2F%2A",
            "@multimediatype": "GIF image file",
            "@type": "IMAGE-THUMBNAIL",
            "@size": "9634",
            "@ref": "gr6",
            "@mimetype": "image/gif"
          },
          {
            "@category": "thumbnail",
            "@height": "164",
            "@width": "179",
            "@_fa": "true",
            "$": "https://api.elsevier.com/content/object/eid/1-s2.0-S0926860X25003254-gr8.sml?httpAccept=%2A%2F%2A",
            "@multimediatype": "GIF image file",
            "@type": "IMAGE-THUMBNAIL",
            "@size": "6750",
            "@ref": "gr8",
            "@mimetype": "image/gif"
          },
          {
            "@category": "thumbnail",
            "@height": "111",
            "@width": "219",
            "@_fa": "true",
            "$": "https://api.elsevier.com/content/object/eid/1-s2.0-S0926860X25003254-gr3.sml?httpAccept=%2A%2F%2A",
            "@multimediatype": "GIF image file",
            "@type": "IMAGE-THUMBNAIL",
            "@size": "10468",
            "@ref": "gr3",
            "@mimetype": "image/gif"
          },
          {
            "@category": "thumbnail",
            "@height": "85",
            "@width": "219",
            "@_fa": "true",
            "$": "https://api.elsevier.com/content/object/eid/1-s2.0-S0926860X25003254-gr2.sml?httpAccept=%2A%2F%2A",
            "@multimediatype": "GIF image file",
            "@type": "IMAGE-THUMBNAIL",
            "@size": "12666",
            "@ref": "gr2",
            "@mimetype": "image/gif"
          },
          {
            "@category": "thumbnail",
            "@height": "164",
            "@width": "189",
            "@_fa": "true",
            "$": "https://api.elsevier.com/content/object/eid/1-s2.0-S0926860X25003254-ga1.sml?httpAccept=%2A%2F%2A",
            "@multimediatype": "GIF image file",
            "@type": "IMAGE-THUMBNAIL",
            "@size": "15049",
            "@ref": "ga1",
            "@mimetype": "image/gif"
          },
          {
            "@category": "thumbnail",
            "@height": "108",
            "@width": "219",
            "@_fa": "true",
            "$": "https://api.elsevier.com/content/object/eid/1-s2.0-S0926860X25003254-gr5.sml?httpAccept=%2A%2F%2A",
            "@multimediatype": "GIF image file",
            "@type": "IMAGE-THUMBNAIL",
            "@size": "14668",
            "@ref": "gr5",
            "@mimetype": "image/gif"
          },
          {
            "@category": "thumbnail",
            "@height": "109",
            "@width": "219",
            "@_fa": "true",
            "$": "https://api.elsevier.com/content/object/eid/1-s2.0-S0926860X25003254-gr4.sml?httpAccept=%2A%2F%2A",
            "@multimediatype": "GIF image file",
            "@type": "IMAGE-THUMBNAIL",
            "@size": "11012",
            "@ref": "gr4",
            "@mimetype": "image/gif"
          },
          {
            "@category": "thumbnail",
            "@height": "164",
            "@width": "215",
            "@_fa": "true",
            "$": "https://api.elsevier.com/content/object/eid/1-s2.0-S0926860X25003254-gr1.sml?httpAccept=%2A%2F%2A",
            "@multimediatype": "GIF image file",
            "@type": "IMAGE-THUMBNAIL",
            "@size": "10721",
            "@ref": "gr1",
            "@mimetype": "image/gif"
          },
          {
            "@category": "high",
            "@height": "2114",
            "@width": "3575",
            "@_fa": "true",
            "$": "https://api.elsevier.com/content/object/eid/1-s2.0-S0926860X25003254-gr7_lrg.jpg?httpAccept=%2A%2F%2A",
            "@multimediatype": "JPEG image file",
            "@type": "IMAGE-HIGH-RES",
            "@size": "432195",
            "@ref": "gr7",
            "@mimetype": "image/jpeg"
          },
          {
            "@category": "high",
            "@height": "1049",
            "@width": "2994",
            "@_fa": "true",
            "$": "https://api.elsevier.com/content/object/eid/1-s2.0-S0926860X25003254-gr6_lrg.jpg?httpAccept=%2A%2F%2A",
            "@multimediatype": "JPEG image file",
            "@type": "IMAGE-HIGH-RES",
            "@size": "284591",
            "@ref": "gr6",
            "@mimetype": "image/jpeg"
          },
          {
            "@category": "high",
            "@height": "2747",
            "@width": "2994",
            "@_fa": "true",
            "$": "https://api.elsevier.com/content/object/eid/1-s2.0-S0926860X25003254-gr8_lrg.jpg?httpAccept=%2A%2F%2A",
            "@multimediatype": "JPEG image file",
            "@type": "IMAGE-HIGH-RES",
            "@size": "273678",
            "@ref": "gr8",
            "@mimetype": "image/jpeg"
          },
          {
            "@category": "high",
            "@height": "1816",
            "@width": "3575",
            "@_fa": "true",
            "$": "https://api.elsevier.com/content/object/eid/1-s2.0-S0926860X25003254-gr3_lrg.jpg?httpAccept=%2A%2F%2A",
            "@multimediatype": "JPEG image file",
            "@type": "IMAGE-HIGH-RES",
            "@size": "451850",
            "@ref": "gr3",
            "@mimetype": "image/jpeg"
          },
          {
            "@category": "high",
            "@height": "1395",
            "@width": "3575",
            "@_fa": "true",
            "$": "https://api.elsevier.com/content/object/eid/1-s2.0-S0926860X25003254-gr2_lrg.jpg?httpAccept=%2A%2F%2A",
            "@multimediatype": "JPEG image file",
            "@type": "IMAGE-HIGH-RES",
            "@size": "732885",
            "@ref": "gr2",
            "@mimetype": "image/jpeg"
          },
          {
            "@category": "high",
            "@height": "1085",
            "@width": "1250",
            "@_fa": "true",
            "$": "https://api.elsevier.com/content/object/eid/1-s2.0-S0926860X25003254-ga1_lrg.jpg?httpAccept=%2A%2F%2A",
            "@multimediatype": "JPEG image file",
            "@type": "IMAGE-HIGH-RES",
            "@size": "229583",
            "@ref": "ga1",
            "@mimetype": "image/jpeg"
          },
          {
            "@category": "high",
            "@height": "1757",
            "@width": "3575",
            "@_fa": "true",
            "$": "https://api.elsevier.com/content/object/eid/1-s2.0-S0926860X25003254-gr5_lrg.jpg?httpAccept=%2A%2F%2A",
            "@multimediatype": "JPEG image file",
            "@type": "IMAGE-HIGH-RES",
            "@size": "497744",
            "@ref": "gr5",
            "@mimetype": "image/jpeg"
          },
          {
            "@category": "high",
            "@height": "1775",
            "@width": "3575",
            "@_fa": "true",
            "$": "https://api.elsevier.com/content/object/eid/1-s2.0-S0926860X25003254-gr4_lrg.jpg?httpAccept=%2A%2F%2A",
            "@multimediatype": "JPEG image file",
            "@type": "IMAGE-HIGH-RES",
            "@size": "394863",
            "@ref": "gr4",
            "@mimetype": "image/jpeg"
          },
          {
            "@category": "high",
            "@height": "2281",
            "@width": "2994",
            "@_fa": "true",
            "$": "https://api.elsevier.com/content/object/eid/1-s2.0-S0926860X25003254-gr1_lrg.jpg?httpAccept=%2A%2F%2A",
            "@multimediatype": "JPEG image file",
            "@type": "IMAGE-HIGH-RES",
            "@size": "399493",
            "@ref": "gr1",
            "@mimetype": "image/jpeg"
          },
          {
            "@category": "standard",
            "@_fa": "true",
            "$": "https://api.elsevier.com/content/object/eid/1-s2.0-S0926860X25003254-mmc1.docx?httpAccept=%2A%2F%2A",
            "@multimediatype": "Microsoft Word file",
            "@type": "APPLICATION",
            "@size": "5412196",
            "@ref": "mmc1",
            "@mimetype": "application/word"
          },
          {
            "@category": "thumbnail",
            "@_fa": "true",
            "$": "https://api.elsevier.com/content/object/eid/1-s2.0-S0926860X25003254-si0001.svg?httpAccept=%2A%2F%2A",
            "@multimediatype": "Scalable Vector Graphics file",
            "@type": "ALTIMG",
            "@size": "3853",
            "@ref": "si0001",
            "@mimetype": "image/svg+xml"
          },
          {
            "@category": "thumbnail",
            "@_fa": "true",
            "$": "https://api.elsevier.com/content/object/eid/1-s2.0-S0926860X25003254-si0002.svg?httpAccept=%2A%2F%2A",
            "@multimediatype": "Scalable Vector Graphics file",
            "@type": "ALTIMG",
            "@size": "1454",
            "@ref": "si0002",
            "@mimetype": "image/svg+xml"
          },
          {
            "@category": "thumbnail",
            "@_fa": "true",
            "$": "https://api.elsevier.com/content/object/eid/1-s2.0-S0926860X25003254-si0003.svg?httpAccept=%2A%2F%2A",
            "@multimediatype": "Scalable Vector Graphics file",
            "@type": "ALTIMG",
            "@size": "1535",
            "@ref": "si0003",
            "@mimetype": "image/svg+xml"
          },
          {
            "@category": "thumbnail",
            "@_fa": "true",
            "$": "https://api.elsevier.com/content/object/eid/1-s2.0-S0926860X25003254-si0004.svg?httpAccept=%2A%2F%2A",
            "@multimediatype": "Scalable Vector Graphics file",
            "@type": "ALTIMG",
            "@size": "1482",
            "@ref": "si0004",
            "@mimetype": "image/svg+xml"
          },
          {
            "@category": "thumbnail",
            "@_fa": "true",
            "$": "https://api.elsevier.com/content/object/eid/1-s2.0-S0926860X25003254-si0005.svg?httpAccept=%2A%2F%2A",
            "@multimediatype": "Scalable Vector Graphics file",
            "@type": "ALTIMG",
            "@size": "1499",
            "@ref": "si0005",
            "@mimetype": "image/svg+xml"
          },
          {
            "@category": "thumbnail",
            "@_fa": "true",
            "$": "https://api.elsevier.com/content/object/eid/1-s2.0-S0926860X25003254-si0006.svg?httpAccept=%2A%2F%2A",
            "@multimediatype": "Scalable Vector Graphics file",
            "@type": "ALTIMG",
            "@size": "3578",
            "@ref": "si0006",
            "@mimetype": "image/svg+xml"
          }
        ]
      },
      "link": {
        "@rel": "abstract",
        "@href": "https://api.elsevier.com/content/abstract/scopus_id/105009688198"
      }
    }
  }
}