{
  "metadata": {
    "title": "Room-temperature synthesis of primary amines by selective hydrogenation of nitriles over ZnAlO<ce:inf loc=post>x</ce:inf> supported Ni catalysts",
    "authors": "; ; ",
    "journal": "Applied Catalysis A: General",
    "date": "2023-04-05",
    "doi": "10.1016/j.apcata.2023.119115",
    "abstract": "",
    "uri": "https://api.elsevier.com/content/article/pii/S0926860X23000959",
    "pii": "S0926860X23000959"
  },
  "fulltext": {
    "full-text-retrieval-response": {
      "scopus-eid": "2-s2.0-85149208513",
      "originalText": "serial JL 271346 291210 291744 291809 31 Applied Catalysis A: General APPLIEDCATALYSISAGENERAL 2023-02-24 2023-02-24 2023-03-02 2023-03-02 2023-09-18T12:55:13 1-s2.0-S0926860X23000959 S0926-860X(23)00095-9 S0926860X23000959 10.1016/j.apcata.2023.119115 S300 S300.1 FULL-TEXT 1-s2.0-S0926860X23X00064 2024-01-01T12:35:59.692098Z 0 0 20230405 2023 2023-02-24T16:41:50.447429Z absattachment articleinfo articlenumber articletitlenorm authfirstinitialnorm authfirstsurnamenorm cid cids contenttype copyright crossmark dateloaded dateloadedtxt datesearch datesort dateupdated dco docsubtype doctype doi eid ewtransactionid hubeid indexeddate issn issnnorm itemstage itemtransactionid itemweight openaccess openarchive pg pgfirst pii piinorm pubdatestart pubdatetxt pubyr sortorder srctitle srctitlenorm srctype ssids alllist content subj subheadings suppl tomb volfirst volissue volumelist webpdf webpdfpagecount yearnav figure table e-component body acknowledge affil appendices articletitle auth authfirstini authfull authkeywords authlast grantnumber grantsponsor grantsponsorid highlightsabst orcid primabst ref specialabst 0926-860X 0926860X true 655 655 C Volume 655 11 119115 119115 119115 20230405 5 April 2023 2023-04-05 2023 article fla © 2023 Elsevier B.V. All rights reserved. ROOMTEMPERATURESYNTHESISPRIMARYAMINESBYSELECTIVEHYDROGENATIONNITRILESOVERZNALOXSUPPORTEDNICATALYSTS ZHAO H 1 Introduction 2 Materials and methods 2.1 Materials 2.2 Preparation of NiZnAl-LDH 2.3 Preparation of Ni/ZnAlOx catalysts 2.4 Characterization of catalysts 2.5 Catalyst activity test 2.6 Methods for product analysis 3 Result and discussion 4 Conclusions CRediT authorship contribution statement Acknowledgment Appendix A Supplementary material References LU 2021 475 492 Q VANPRAET 2022 6503 6508 S AFANASYEV 2019 11857 11911 O LIU 2019 830 838 Y FFERRETTI 2019 2611 2680 F YOSHIMURA 2018 1726 1732 M ADAM 2017 842 846 R ZHANG 2019 1246 1255 Y YUAN 2019 347 356 Z ZHENG 2022 9047 9055 B CHANDRASHEKHAR 2022 1433 1441 V JAGADEESH 2017 326 332 R QI 2021 3295 H CHIN 1992 135 140 C TAKEMOTO 2002 3897 3904 S YOSHIDA 1979 870 871 T MUKHERJEE 2015 8888 8891 A ELANGOVAN 2016 8809 8814 S SARKAR 2021 2786 2794 K BORNSCHEIN 2014 4111 C LIU 2018 61 73 L LI 2019 7346 7350 J GOKSU 2014 1777 1782 H LIU 2019 1390 1395 L CHANDRASHEKHAR 2022 20 29 V CHEN 2016 8781 8788 F LONG 2017 275 284 J MITSUDOME 2020 6682 6689 T SHENG 2021 11238 11246 M MURUGESAN 2018 8553 8560 K SEGOBIA 2015 41 47 D GUO 2022 104561 R GUO 2023 109143 R CAO 2016 9 13 Y LV 2018 203 216 Y SEGOBIA 2021 2181 2190 D ANTIL 2021 3943 3957 N RYABCHUK 2018 eaat0761 P KANG 2020 1906707 Y MA 2022 10914 10922 Z ZHANG 2019 258 265 H KONG 2017 11280 11289 X SEGOBIA 2019 1693 1703 D ANJANEYULU 2016 85 98 C PAN 2018 88 100 Z RODRIGUEZ 1996 223 287 J SPANJERS 2015 3304 3315 C YUE 2021 120243 X TOKMIC 2017 13554 13561 K YANG 2014 1123 1131 L WANG 2023 253 263 H ZHAOX2023X119115 ZHAOX2023X119115XH 2025-03-02T00:00:00.000Z 2025-03-02T00:00:00.000Z http://creativecommons.org/licenses/by-nc-nd/4.0/ © 2023 Elsevier B.V. All rights reserved. 2023-03-08T07:29:02.237Z http://vtw.elsevier.com/data/voc/AddOnTypes/50.7/aggregated-refined https://doi.org/10.15223/policy-017 https://doi.org/10.15223/policy-037 https://doi.org/10.15223/policy-012 https://doi.org/10.15223/policy-029 https://doi.org/10.15223/policy-004 item S0926-860X(23)00095-9 S0926860X23000959 1-s2.0-S0926860X23000959 10.1016/j.apcata.2023.119115 271346 2024-01-01T12:35:59.692098Z 2023-04-05 1-s2.0-S0926860X23000959-main.pdf https://s3-eu-west-1.amazonaws.com/prod-ucs-content-store-eu-west/content/pii:S0926860X23000959/MAIN/application/pdf/f5269bfdcc24e40bf177dddf8b71099e/main.pdf main.pdf pdf true 5394195 MAIN 10 1-s2.0-S0926860X23000959-main_1.png https://s3-eu-west-1.amazonaws.com/prod-ucs-content-store-eu-west/content/pii:S0926860X23000959/PREVIEW/image/png/ddbd649e628adf39b92e6d43d70e7c7b/main_1.png main_1.png png 55010 849 656 IMAGE-WEB-PDF 1 1-s2.0-S0926860X23000959-gr9.jpg https://s3-eu-west-1.amazonaws.com/prod-ucs-content-store-eu-west/content/pii:S0926860X23000959/gr9/DOWNSAMPLED/image/jpeg/0fb552d94e67e5598b23b6007ab69f37/gr9.jpg gr9 gr9.jpg jpg 62966 422 565 IMAGE-DOWNSAMPLED 1-s2.0-S0926860X23000959-gr2.jpg https://s3-eu-west-1.amazonaws.com/prod-ucs-content-store-eu-west/content/pii:S0926860X23000959/gr2/DOWNSAMPLED/image/jpeg/a2d70e5f457b40f45733d60debe68270/gr2.jpg gr2 gr2.jpg jpg 26492 226 282 IMAGE-DOWNSAMPLED 1-s2.0-S0926860X23000959-gr1.jpg https://s3-eu-west-1.amazonaws.com/prod-ucs-content-store-eu-west/content/pii:S0926860X23000959/gr1/DOWNSAMPLED/image/jpeg/b47fa77326f2e566c6cf5252a3baf44a/gr1.jpg gr1 gr1.jpg jpg 22798 167 565 IMAGE-DOWNSAMPLED 1-s2.0-S0926860X23000959-gr4.jpg https://s3-eu-west-1.amazonaws.com/prod-ucs-content-store-eu-west/content/pii:S0926860X23000959/gr4/DOWNSAMPLED/image/jpeg/3b64392efd924a9015777063c608a877/gr4.jpg gr4 gr4.jpg jpg 68089 458 565 IMAGE-DOWNSAMPLED 1-s2.0-S0926860X23000959-gr3.jpg https://s3-eu-west-1.amazonaws.com/prod-ucs-content-store-eu-west/content/pii:S0926860X23000959/gr3/DOWNSAMPLED/image/jpeg/08c8293fc8bede00af8de5e72b0c72de/gr3.jpg gr3 gr3.jpg jpg 132515 562 565 IMAGE-DOWNSAMPLED 1-s2.0-S0926860X23000959-gr6.jpg https://s3-eu-west-1.amazonaws.com/prod-ucs-content-store-eu-west/content/pii:S0926860X23000959/gr6/DOWNSAMPLED/image/jpeg/8eddcb8348a74dd3beaccc90df3b32bc/gr6.jpg gr6 gr6.jpg jpg 49864 205 791 IMAGE-DOWNSAMPLED 1-s2.0-S0926860X23000959-gr5.jpg https://s3-eu-west-1.amazonaws.com/prod-ucs-content-store-eu-west/content/pii:S0926860X23000959/gr5/DOWNSAMPLED/image/jpeg/a435ff68f9046e7ffb7dcb7a463d88f7/gr5.jpg gr5 gr5.jpg jpg 35232 218 565 IMAGE-DOWNSAMPLED 1-s2.0-S0926860X23000959-gr8.jpg https://s3-eu-west-1.amazonaws.com/prod-ucs-content-store-eu-west/content/pii:S0926860X23000959/gr8/DOWNSAMPLED/image/jpeg/a1fa856bab67b5ca17b456ff705f3ea3/gr8.jpg gr8 gr8.jpg jpg 17833 224 282 IMAGE-DOWNSAMPLED 1-s2.0-S0926860X23000959-gr7.jpg https://s3-eu-west-1.amazonaws.com/prod-ucs-content-store-eu-west/content/pii:S0926860X23000959/gr7/DOWNSAMPLED/image/jpeg/d98fa9cb0514bb98f2eeda828636b91e/gr7.jpg gr7 gr7.jpg jpg 38778 277 565 IMAGE-DOWNSAMPLED 1-s2.0-S0926860X23000959-fx1.jpg https://s3-eu-west-1.amazonaws.com/prod-ucs-content-store-eu-west/content/pii:S0926860X23000959/fx1/DOWNSAMPLED/image/jpeg/bcc9314b26d4e055bc993520c35dc8b9/fx1.jpg fx1 fx1.jpg jpg 5745 57 376 IMAGE-DOWNSAMPLED 1-s2.0-S0926860X23000959-fx3.jpg https://s3-eu-west-1.amazonaws.com/prod-ucs-content-store-eu-west/content/pii:S0926860X23000959/fx3/DOWNSAMPLED/image/jpeg/8d90da625175e950f4a443d8d9bb1e76/fx3.jpg fx3 fx3.jpg jpg 124106 696 602 IMAGE-DOWNSAMPLED 1-s2.0-S0926860X23000959-sc1.jpg https://s3-eu-west-1.amazonaws.com/prod-ucs-content-store-eu-west/content/pii:S0926860X23000959/sc1/DOWNSAMPLED/image/jpeg/f99f03334bc1eb1968a461aae5f2c921/sc1.jpg sc1 sc1.jpg jpg 42971 301 527 IMAGE-DOWNSAMPLED 1-s2.0-S0926860X23000959-fx2.jpg https://s3-eu-west-1.amazonaws.com/prod-ucs-content-store-eu-west/content/pii:S0926860X23000959/fx2/DOWNSAMPLED/image/jpeg/22aadc5433ca304177686426728d02b4/fx2.jpg fx2 fx2.jpg jpg 5739 57 376 IMAGE-DOWNSAMPLED 1-s2.0-S0926860X23000959-sc3.jpg https://s3-eu-west-1.amazonaws.com/prod-ucs-content-store-eu-west/content/pii:S0926860X23000959/sc3/DOWNSAMPLED/image/jpeg/9e6cd0a6cfab3d6634a6db0814262d0a/sc3.jpg sc3 sc3.jpg jpg 29218 223 678 IMAGE-DOWNSAMPLED 1-s2.0-S0926860X23000959-sc2.jpg https://s3-eu-west-1.amazonaws.com/prod-ucs-content-store-eu-west/content/pii:S0926860X23000959/sc2/DOWNSAMPLED/image/jpeg/c8fd8d9a05ceb2accecad47d6bb534b0/sc2.jpg sc2 sc2.jpg jpg 26082 154 602 IMAGE-DOWNSAMPLED 1-s2.0-S0926860X23000959-ga1.jpg https://s3-eu-west-1.amazonaws.com/prod-ucs-content-store-eu-west/content/pii:S0926860X23000959/ga1/DOWNSAMPLED/image/jpeg/c4704d118b1f8aafa839027c09955fc6/ga1.jpg ga1 true ga1.jpg jpg 22067 200 373 IMAGE-DOWNSAMPLED 1-s2.0-S0926860X23000959-gr9.sml https://s3-eu-west-1.amazonaws.com/prod-ucs-content-store-eu-west/content/pii:S0926860X23000959/gr9/THUMBNAIL/image/gif/d50988833008d6f95bbfc473962ce202/gr9.sml gr9 gr9.sml sml 13410 164 219 IMAGE-THUMBNAIL 1-s2.0-S0926860X23000959-gr2.sml https://s3-eu-west-1.amazonaws.com/prod-ucs-content-store-eu-west/content/pii:S0926860X23000959/gr2/THUMBNAIL/image/gif/fad63deb919f5765358e2c215f9c508d/gr2.sml gr2 gr2.sml sml 12359 164 204 IMAGE-THUMBNAIL 1-s2.0-S0926860X23000959-gr1.sml https://s3-eu-west-1.amazonaws.com/prod-ucs-content-store-eu-west/content/pii:S0926860X23000959/gr1/THUMBNAIL/image/gif/cb543ed29ac13b7859fad726fe499074/gr1.sml gr1 gr1.sml sml 6367 65 219 IMAGE-THUMBNAIL 1-s2.0-S0926860X23000959-gr4.sml https://s3-eu-west-1.amazonaws.com/prod-ucs-content-store-eu-west/content/pii:S0926860X23000959/gr4/THUMBNAIL/image/gif/11b7fafdc880036a04daa973bf77fefc/gr4.sml gr4 gr4.sml sml 11731 164 202 IMAGE-THUMBNAIL 1-s2.0-S0926860X23000959-gr3.sml https://s3-eu-west-1.amazonaws.com/prod-ucs-content-store-eu-west/content/pii:S0926860X23000959/gr3/THUMBNAIL/image/gif/e5e87c4b16a63aacb317b72423e7b750/gr3.sml gr3 gr3.sml sml 22018 164 165 IMAGE-THUMBNAIL 1-s2.0-S0926860X23000959-gr6.sml https://s3-eu-west-1.amazonaws.com/prod-ucs-content-store-eu-west/content/pii:S0926860X23000959/gr6/THUMBNAIL/image/gif/5c3374256cc4b1d841f98d3e8a0ab96a/gr6.sml gr6 gr6.sml sml 5426 57 219 IMAGE-THUMBNAIL 1-s2.0-S0926860X23000959-gr5.sml https://s3-eu-west-1.amazonaws.com/prod-ucs-content-store-eu-west/content/pii:S0926860X23000959/gr5/THUMBNAIL/image/gif/52bd3ac47a6c68850ccb50a6429ed0bb/gr5.sml gr5 gr5.sml sml 6510 84 219 IMAGE-THUMBNAIL 1-s2.0-S0926860X23000959-gr8.sml https://s3-eu-west-1.amazonaws.com/prod-ucs-content-store-eu-west/content/pii:S0926860X23000959/gr8/THUMBNAIL/image/gif/42e56ffba582f8392ba2927898e8f1e6/gr8.sml gr8 gr8.sml sml 7920 164 207 IMAGE-THUMBNAIL 1-s2.0-S0926860X23000959-gr7.sml https://s3-eu-west-1.amazonaws.com/prod-ucs-content-store-eu-west/content/pii:S0926860X23000959/gr7/THUMBNAIL/image/gif/b703d09838abe33972092fff2018e078/gr7.sml gr7 gr7.sml sml 8081 107 219 IMAGE-THUMBNAIL 1-s2.0-S0926860X23000959-fx1.sml https://s3-eu-west-1.amazonaws.com/prod-ucs-content-store-eu-west/content/pii:S0926860X23000959/fx1/THUMBNAIL/image/gif/0429c6beee02a0400cc7d04fe82d34e2/fx1.sml fx1 fx1.sml sml 2412 33 219 IMAGE-THUMBNAIL 1-s2.0-S0926860X23000959-fx3.sml https://s3-eu-west-1.amazonaws.com/prod-ucs-content-store-eu-west/content/pii:S0926860X23000959/fx3/THUMBNAIL/image/gif/e799de07bbb2b761c539e3cc604e6700/fx3.sml fx3 fx3.sml sml 6560 164 142 IMAGE-THUMBNAIL 1-s2.0-S0926860X23000959-sc1.sml https://s3-eu-west-1.amazonaws.com/prod-ucs-content-store-eu-west/content/pii:S0926860X23000959/sc1/THUMBNAIL/image/gif/deac2c6e012d091d4c7080346ac0f6ff/sc1.sml sc1 sc1.sml sml 9723 125 219 IMAGE-THUMBNAIL 1-s2.0-S0926860X23000959-fx2.sml https://s3-eu-west-1.amazonaws.com/prod-ucs-content-store-eu-west/content/pii:S0926860X23000959/fx2/THUMBNAIL/image/gif/060b51e9a21971a9722503dd88ab7e8e/fx2.sml fx2 fx2.sml sml 2427 33 219 IMAGE-THUMBNAIL 1-s2.0-S0926860X23000959-sc3.sml https://s3-eu-west-1.amazonaws.com/prod-ucs-content-store-eu-west/content/pii:S0926860X23000959/sc3/THUMBNAIL/image/gif/4fe46795f54a81a244f37fa7c94c5012/sc3.sml sc3 sc3.sml sml 4408 72 219 IMAGE-THUMBNAIL 1-s2.0-S0926860X23000959-sc2.sml https://s3-eu-west-1.amazonaws.com/prod-ucs-content-store-eu-west/content/pii:S0926860X23000959/sc2/THUMBNAIL/image/gif/7435a0e7786fe3dd4d6d9f11133878af/sc2.sml sc2 sc2.sml sml 3898 56 219 IMAGE-THUMBNAIL 1-s2.0-S0926860X23000959-ga1.sml https://s3-eu-west-1.amazonaws.com/prod-ucs-content-store-eu-west/content/pii:S0926860X23000959/ga1/THUMBNAIL/image/gif/54b05b4f74bc06783c4e1d7c82314d53/ga1.sml ga1 true ga1.sml sml 15492 117 219 IMAGE-THUMBNAIL 1-s2.0-S0926860X23000959-gr9_lrg.jpg https://s3-eu-west-1.amazonaws.com/prod-ucs-content-store-eu-west/content/pii:S0926860X23000959/HIGHRES/image/jpeg/52cd7636ac5334cd75c308776c164f74/gr9_lrg.jpg gr9 gr9_lrg.jpg jpg 406126 1864 2495 IMAGE-HIGH-RES 1-s2.0-S0926860X23000959-gr2_lrg.jpg https://s3-eu-west-1.amazonaws.com/prod-ucs-content-store-eu-west/content/pii:S0926860X23000959/HIGHRES/image/jpeg/68d765f975716c789503b17dfbc10ae2/gr2_lrg.jpg gr2 gr2_lrg.jpg jpg 178654 1001 1247 IMAGE-HIGH-RES 1-s2.0-S0926860X23000959-gr1_lrg.jpg https://s3-eu-west-1.amazonaws.com/prod-ucs-content-store-eu-west/content/pii:S0926860X23000959/HIGHRES/image/jpeg/e5b3a33ca1b7a28d8b6c49407cdf17dd/gr1_lrg.jpg gr1 gr1_lrg.jpg jpg 99866 736 2495 IMAGE-HIGH-RES 1-s2.0-S0926860X23000959-gr4_lrg.jpg https://s3-eu-west-1.amazonaws.com/prod-ucs-content-store-eu-west/content/pii:S0926860X23000959/HIGHRES/image/jpeg/e27e59a68f9e1f1d958e1b62fdde9881/gr4_lrg.jpg gr4 gr4_lrg.jpg jpg 459066 2023 2495 IMAGE-HIGH-RES 1-s2.0-S0926860X23000959-gr3_lrg.jpg https://s3-eu-west-1.amazonaws.com/prod-ucs-content-store-eu-west/content/pii:S0926860X23000959/HIGHRES/image/jpeg/f01a9985546f2338589840fc4b5245da/gr3_lrg.jpg gr3 gr3_lrg.jpg jpg 684861 2480 2495 IMAGE-HIGH-RES 1-s2.0-S0926860X23000959-gr6_lrg.jpg https://s3-eu-west-1.amazonaws.com/prod-ucs-content-store-eu-west/content/pii:S0926860X23000959/HIGHRES/image/jpeg/e0bbab6a1aea2c634aaf5091d511b5b0/gr6_lrg.jpg gr6 gr6_lrg.jpg jpg 315472 907 3493 IMAGE-HIGH-RES 1-s2.0-S0926860X23000959-gr5_lrg.jpg https://s3-eu-west-1.amazonaws.com/prod-ucs-content-store-eu-west/content/pii:S0926860X23000959/HIGHRES/image/jpeg/df8989d347a578b06f2e579611adf9cc/gr5_lrg.jpg gr5 gr5_lrg.jpg jpg 191012 962 2495 IMAGE-HIGH-RES 1-s2.0-S0926860X23000959-gr8_lrg.jpg https://s3-eu-west-1.amazonaws.com/prod-ucs-content-store-eu-west/content/pii:S0926860X23000959/HIGHRES/image/jpeg/d79f344017b5e8b5e42dbefb0e344ecd/gr8_lrg.jpg gr8 gr8_lrg.jpg jpg 110100 989 1247 IMAGE-HIGH-RES 1-s2.0-S0926860X23000959-gr7_lrg.jpg https://s3-eu-west-1.amazonaws.com/prod-ucs-content-store-eu-west/content/pii:S0926860X23000959/HIGHRES/image/jpeg/99b0a60f85ee88fc7ec39efa87932337/gr7_lrg.jpg gr7 gr7_lrg.jpg jpg 231934 1224 2495 IMAGE-HIGH-RES 1-s2.0-S0926860X23000959-fx1_lrg.jpg https://s3-eu-west-1.amazonaws.com/prod-ucs-content-store-eu-west/content/pii:S0926860X23000959/HIGHRES/image/jpeg/84fc2ab034f7687fa96eb1fd60baa1e9/fx1_lrg.jpg fx1 fx1_lrg.jpg jpg 34025 254 1663 IMAGE-HIGH-RES 1-s2.0-S0926860X23000959-fx3_lrg.jpg https://s3-eu-west-1.amazonaws.com/prod-ucs-content-store-eu-west/content/pii:S0926860X23000959/HIGHRES/image/jpeg/db1a0ad484ec09bc44db8c6cfb0fbb84/fx3_lrg.jpg fx3 fx3_lrg.jpg jpg 808546 3082 2665 IMAGE-HIGH-RES 1-s2.0-S0926860X23000959-sc1_lrg.jpg https://s3-eu-west-1.amazonaws.com/prod-ucs-content-store-eu-west/content/pii:S0926860X23000959/HIGHRES/image/jpeg/a5e6eec503fd19aa0d60fafb0858cac1/sc1_lrg.jpg sc1 sc1_lrg.jpg jpg 259900 1331 2328 IMAGE-HIGH-RES 1-s2.0-S0926860X23000959-fx2_lrg.jpg https://s3-eu-west-1.amazonaws.com/prod-ucs-content-store-eu-west/content/pii:S0926860X23000959/HIGHRES/image/jpeg/f056196ff24f7edc076f1ef0eb5b51eb/fx2_lrg.jpg fx2 fx2_lrg.jpg jpg 34018 254 1663 IMAGE-HIGH-RES 1-s2.0-S0926860X23000959-sc3_lrg.jpg https://s3-eu-west-1.amazonaws.com/prod-ucs-content-store-eu-west/content/pii:S0926860X23000959/HIGHRES/image/jpeg/314d2f21259faaa9ef89742c64d5ebb6/sc3_lrg.jpg sc3 sc3_lrg.jpg jpg 187059 984 2994 IMAGE-HIGH-RES 1-s2.0-S0926860X23000959-sc2_lrg.jpg https://s3-eu-west-1.amazonaws.com/prod-ucs-content-store-eu-west/content/pii:S0926860X23000959/HIGHRES/image/jpeg/7b160945ce66e89ee7832a5f3f662709/sc2_lrg.jpg sc2 sc2_lrg.jpg jpg 160622 679 2661 IMAGE-HIGH-RES 1-s2.0-S0926860X23000959-ga1_lrg.jpg https://s3-eu-west-1.amazonaws.com/prod-ucs-content-store-eu-west/content/pii:S0926860X23000959/HIGHRES/image/jpeg/23d1ba39ccb3b12fed35b0d16f5b756a/ga1_lrg.jpg ga1 true ga1_lrg.jpg jpg 164255 886 1653 IMAGE-HIGH-RES 1-s2.0-S0926860X23000959-mmc1.docx https://s3-eu-west-1.amazonaws.com/prod-ucs-content-store-eu-west/content/pii:S0926860X23000959/mmc1/MAIN/application/vnd.openxmlformats-officedocument.wordprocessingml.document/8560aa136a4a5b7056a5ed48d81a0a7e/mmc1.docx mmc1 mmc1.docx docx 6262117 APPLICATION 1-s2.0-S0926860X23000959-am.pdf https://s3-eu-west-1.amazonaws.com/prod-ucs-content-store-eu-west/content/egi:10B5W8DGH2X/MAIN/application/pdf/4a2dbb1b031596f5827161a8531c40e8/am.pdf am am.pdf pdf false 995643 AAM-PDF APCATA 119115 119115 S0926-860X(23)00095-9 10.1016/j.apcata.2023.119115 Elsevier B.V. Fig. 1 Schematic diagram of the preparation of Ni/ZnAlOx-T catalysts. Fig. 1 Fig. 2 The XRD patterns of the as-prepared Ni/ZnAlOx-T and Ni/ZnAlOx-air catalysts. Fig. 2 Fig. 3 TEM images and particle size distributions (a & b), HR-TEM images of Ni/ZnAlOx-600 catalyst (c & d). Fig. 3 Fig. 4 The XPS spectra of Ni 2p of Ni/Al2O3-600 and Ni/ZnAlOx-T catalysts. (a) Ni/Al2O3-600, (b) Ni/ZnAlOx-500, (c) Ni/ZnAlOx-600, and (d) Ni/ZnAlOx-650. Fig. 4 Fig. 5 Texture properties of the as-prepared Ni/ZnAlOx-T catalysts. (a) The adsorption-desorption isotherm and (b) pore size distribution. Fig. 5 Fig. 6 (a) H2-TPR patterns of LDH precursors calcined with Ni/ZnAlOx-T (T = 500, 600, and 650), (b) NH3-TPD results of different catalysts, and (c) FT-IR spectra of the surface species after pyridine adsorption and desorption at RT over reduced Ni/ZnAlOx-600 catalyst. Fig. 6 Fig. 7 Optimization of selective hydrogenation reaction parameters. Reaction conditions: (a) 0.5 mmol of benzonitrile, 10 mL of hexane, 20 mg of the Ni/ZnAlOx-600 catalyst, 1–20 bar H2, 200 μL of NH3·H2O, 25 °C and 4 h; (b) 0.5 mmol of benzonitrile, 10 mL of hexane, 20 mg of Ni/ZnAlOx-600 catalyst, 10 bar H2, 0–200 μL of NH3·H2O, 25 °C and 4 h. Fig. 7 Fig. 8 Time course of product distribution. Reaction conditions: 20 mg of the Ni/ZnAlOx-600 catalyst, 0.5 mmol of benzonitrile, 200 μL of NH3·H2O, 10 mL of hexane, 10 bar H2, and 25 °C. Fig. 8 Fig. 9 Recovery experiments of the Ni/ZnAlOx-600 catalyst. (a) The recycling experiments of the Ni/ZnAlOx-600 catalyst towards the hydrogenation of benzonitrile. Reaction conditions: 0.5 mmol of benzonitrile, 10 mL of hexane, 20 mg of the Ni/ZnAlOx-600 catalyst, 10 bar of H2, 200 μL of NH3·H2O, 25 °C and 4 h. (b) XRD patterns of the fresh and used Ni/ZnAlOx-600 catalyst, (c) TEM image of the used catalyst and the particle size distribution diagram of the catalyst was obtained, (d) The XPS spectra of Ni 2p of the fresh and used Ni/ZnAlOx-600 catalyst. Fig. 9 Scheme 1 The development of catalysts for the hydrogenation of nitriles to primary amines. Scheme 1 Scheme 2 Control Experiments. Scheme 2 Scheme 3 Proposed reaction mechanism for the synthesis of primary amines from nitriles over Ni/ZnAlOx-600 catalyst. Scheme 3 Table 1 The results of benzonitrile hydrogenation by H2 over different catalysts.a Table 1 Image 1 Entry Catalyst Conversion (%) Selectivity.1 (%) Selectivity.2 (%) 1 Ni/ZnAlOx-air 0 - - 2 Ni/ZnAlOx-500 3.0 100 0 3 Ni/ZnAlOx-600 57.1 91.1 8.9 4 Ni/ZnAlOx-650 47.1 92.7 7.3 5 Ni/Al2O3-600 43.3 40.0 60.0 6 Ni/ZnO-600 2.1 100 0 7 ZnAlOx-600 0 0 0 [a]Reaction conditions: 20 mg of catalyst, 0.5 mmol of benzonitrile, 200 μL of NH3·H2O, 10 mL of hexane, 10 bar of H2, 25 °C, and 4 h. Table 2 The results of benzonitrile hydrogenation with H2 under different conditions.a Table 2 Image 2 Entry Solvent Con (%) Selectivity.1 (%) Selectivity.2 (%) 1 THF 0 - - 2 1.4-Dioxane 0 - - 3 Methanol 0 - - 4 Isopropanol 0 - - 5 toluene 33.8 91.1 8.9 6 hexane 57.1 91.1 8.9 7 cyclohexane 19.8 73.2 26.8 8 CH2Cl2 4.8 64.6 35.4 9 Petroleum ether 43.3 76.9 23.1 10b hexane 32.5 92.0 8.0 11c hexane 20.6 93.5 6.5 [a]Reaction conditions: 20 mg of the Ni/ZnAlOx-600 catalyst, 0.5 mmol of benzonitrile, 200 μL of NH3·H2O, 10 mL of solvent, 10 bar H2, 25 °C and 4 h. [b] 200 μL of methanol was added. [c] 400 μL of methanol was added. Table 3 Hydrogenation of various nitriles to corresponding amines over Ni/ZnAlOx-600 catalyst. Table 3 Image 3 Reaction conditions: 20 mg of catalyst, 0.5 mmol of substrate, 10 mL of hexane, 10 bar of H2. a: 200 μL of NH3·H2O; b: 500 μL of NH3·H2O. Room-temperature synthesis of primary amines by selective hydrogenation of nitriles over ZnAlOx supported Ni catalysts Huanyu Zhao a Yurong He a Xiaochen Wang b Jie He a ⁎ Anqiu Liu b ⁎ Zehui Zhang a a Key Laboratory of Catalysis and Energy Materials Chemistry of Ministry of Education & Hubei Key Laboratory of Catalysis and Materials Science, South-Central Minzu University, Wuhan 430074, China Key Laboratory of Catalysis and Energy Materials Chemistry of Ministry of Education & Hubei Key Laboratory of Catalysis and Materials Science, South-Central Minzu University Wuhan 430074 China Key Laboratory of Catalysis and Energy Materials Chemistry of Ministry of Education & Hubei Key Laboratory of Catalysis and Materials Science, South-Central Minzu University, Wuhan 430074, China. b School of Energy Materials & Chemical Engineering, Hefei University, Hefei 230601, Anhui, China School of Energy Materials & Chemical Engineering, Hefei University Hefei Anhui 230601 China School of Energy Materials & Chemical Engineering, Hefei University, Hefei 230601, Anhui Province, China. ⁎ Corresponding authors. Selective hydrogenation of nitriles is a feasible route to synthesize primary amines. While highly desirable, conducting the synthesis under mild conditions is challenging. We report non-precious zinc and aluminum oxides supported Ni catalysts (Ni/ZnAlOx) facilely prepared by calcination and reduction of NiZnAl layered double hydroxide (LDH) precursors. The optimized Ni/ZnAlOx-600 catalyst demonstrates great activity towards the selective hydrogenation of nitriles to primary amines. Proper-size metallic nickel provides the hydrogenation centers, and the presence of Ni-Zn alloys indicates strong metal-support interactions, which can produce electron-deficient nickel species and enhances the chemisorption of the CN bonds on the catalyst surface. The introduction of Zinc provides strong Lewis acid sites which also contribute to the catalytic activity. Based on the catalyst characterizations and control experiments, a plausible mechanism is proposed. This catalyst shows good stability and is conducive to the transformation of a variety of aromatic and aliphatic substrates, demonstrating potential application prospects. Graphical Abstract A nickel-based catalyst supported on composite metal oxides was prepared and applied to the selective reduction of nitriles to primary amines at room temperature. ga1 Keywords Primary amines Hydrogenation Non-precious catalysts Room temperature NiZnAl layered double hydroxide Data availability Data will be made available on request. 1 Introduction Primary amines are essential raw materials for the industrial synthesis of polymers, dyes, agrochemicals, pharmaceuticals, and aqua-chemicals [1–3]. Currently, there are many synthetic methods for primary amines, such as the hydrogenation of nitro compounds, the hydrogenation of nitriles, and the reductive amination of aldehydes [4–13]. Among them, catalytic hydrogenation of nitriles with H2 is one of the generally implemented, environmental-friendly, and atom-economic routes. Homogeneous catalysts such as Ir, Ru, Rh, Co, Mn, and Fe can catalyze the hydrogenation of nitriles [14–20]. They generally show good catalytic activity but pose challenges for catalyst re-usability and product purification, as the leaking of metal species is hardly avoided. Heterogeneous catalytic systems are generally preferred to conduct the synthesis in industry. Some precious metal catalysts such as Pd-CuFe [21], PdCu [22], and NiPd [23] were developed for the hydrogenation of nitriles to primary amines, but the high cost, as well as the low abundance of precious metal catalysts, limits their industrialization. Although there have been many reported catalytic systems for the hydrogenation of nitriles ( Scheme 1), high reaction temperature and high H2 pressure are usually needed [24–33]. Based on the above discussion, while widely applied, the selective hydrogenation of nitriles to primary amines under mild conditions even room temperature, remains a challenge, due to the hydrogenation occurring too slowly at room temperature and the selectivity of primary is not satisfactory. Therefore, it is necessary to develop non-precious catalysts with high activity and selectivity that work feasibly under mild conditions. Given the excellent hydrogenation performance of nickel [8,34–40], we believe that developing effective and selective nickel-based catalysts is of great practical and scientific significance. Herein, ZnAlOx supported Ni catalysts are reported to achieve highly selective hydrogenation of nitriles to primary amines at room temperature. The excellent performance of the optimized Ni/ZnAlOx-600 catalyst is comparable to most reported heterogeneous systems. In addition, the relationship between the performance and catalyst structure as well as the catalytic mechanism is also investigated. 2 Materials and methods 2.1 Materials Benzonitrile was purchased from TCI Co., Ltd. (Shanghai, China). Solvents were purchased from Sinopharm Chemical Reagent Co., Ltd. (Shanghai, China). Urea, Ni(NO3)2·6 H2O, and all other chemicals were purchased from Aladdin Chemicals Co., Ltd (Beijing, China). All the reagents were used directly without further purification. 2.2 Preparation of NiZnAl-LDH 1.4 g of Ni(NO3)2·6 H2O, 4.0 g of Al(NO3)3·9 H2O, 4.5 g of Zn(NO3)2·6 H2O, and 4.5 g of urea were dissolved in 100 mL of distilled water. After vigorously stirring at 30 °C for 4 h, the clear green solution was poured into a 150 mL hydrothermal kettle, and then sealed and kept at 100 °C for 24 h. After cooling to room temperature, the solid was obtained by suction filtration under reduced pressure, rinsed with distilled water, and dried under vacuum at 70 °C. The product was labeled as NiZnAl-LDH. 2.3 Preparation of Ni/ZnAlOx catalysts First, the NiZnAl-LDH was calcinated at 600 °C in the air for 2 h to generate metal oxide (NiZnAlOx), which was then treated at 500–650 °C in a reduction atmosphere flow (Ar: H2 = 9:1, v/v) for 2 h with a ramp rate of 5 °C/min and a gas velocity of 40 mL/min. After cooling to 25 °C in the reductive atmosphere, black powder was obtained and recorded as Ni/ZnAlOx-T (T represents the reduction temperature). For comparison, the catalyst that was not reduced under a reduction atmosphere was named Ni/ZnAlOx-air. Ni/Al2O3-600: The Ni/Al2O3-600 catalyst was prepared following a similar preparation procedure of Ni/ZnAlOx-600 catalyst except without the addition of Zn(NO3)2·6 H2O. Ni/ZnO-600: The Ni/ZnO-600 catalyst was prepared following a similar preparation procedure of Ni/ZnAlOx-600 catalyst except without the addition of Al(NO3)3·9 H2O. ZnAlOx-600: The ZnAlOx-600 catalyst was prepared following a similar preparation procedure of Ni/ZnAlOx-600 catalyst except without the addition of Ni(NO3)2·6 H2O. 2.4 Characterization of catalysts The content of Ni in the Ni/ZnAlOx-T catalysts was analyzed using an inductively coupled atomic emission spectrometer (ICP-OES) on the IRIS Intrepid II XSP instrument (Thermo Electron Corporation). The morphologies of the catalysts were characterized by transmission electron microscopy (TEM, FEI TECNAI G2–20). X-ray powder diffraction (XRD) experiments were conducted on a Bruker D8 Advance powder diffractometer (Cu Kα) with a rate of 0.016°/s scanning in the 2θ scope of 10–80°. Nitrogen adsorption and desorption were performed to measure the physical properties of the Ni/ZnAlOx-T catalysts on a V-Sorb 2800 P instrument at 77 K. X-ray photoelectron spectroscopy (XPS) measurements were carried out on a Thermo Scientific ESCALAB Xi+ spectrometer with a monochromatized Al Kα source (1486.6 eV) at constant analyzer pass energy of 25 eV. Temperature-programmed reduction of H2 (H2-TPR) test and temperature-programmed desorption of NH3 (NH3-TPD) were conducted on the Micromeritics Autochem II 2920 instrument. The nature and strength of surface acid sites were determined by BRUKER VERTEX 70 FT-IR spectrometer using pyridine as a probe molecule (Py-IR). 2.5 Catalyst activity test The hydrogenation reaction was carried out in a 40 mL stainless steel lined high-pressure reactor. In a representative operation, 0.5 mmol of benzonitrile, 20 mg of catalyst, and 10 mL of solvent were placed in the autoclave. After scavenging the impurity gas in the reactor through multiple exchanges with H2, 10 bar H2 was finally charged into the autoclave. And then the reaction was performed for 4 h at room temperature with magnetic stirring of 1000 rpm. After the reaction, the reaction mixture was quantitatively analyzed with Agilent 7820 A gas chromatography (GC). 2.6 Methods for product analysis Agilent 7820 A GC equipped with a flame ionization detector and a cross-linked capillary HP-5 column (30 m × 0.32 mm × 0.4 mm) was used to analyze the products. N2 was used as the carrier gas with a flow rate of 40 mL/min. The injection port temperature was 300 °C. The initial temperature of the column oven is 50 °C, the heating rate is 10 °C/min, and the detector temperature is set to 300 °C. Ethylbenzene was used as an internal standard. 3 Result and discussion The schematic diagram of the preparation of Ni/ZnAlOx-T catalysts is shown in Fig. 1. The preparation includes two steps, (i) the co-precipitation of the Ni2+, Zn2+, and Al3+ precursors and (ii) the calcination and reduction process. The samples prepared under different reduction temperatures were donated as Ni/ZnAlOx-500, Ni/ZnAlOx-600, and Ni/ZnAlOx-650, respectively. The X-ray powder diffraction (XRD) patterns of the NiZnAl-LDH, Ni/Al2O3-600, and Ni/ZnAlOx-T catalysts are shown in Fig. S1 and Fig. 2. The NiZnAl-LDH sample shows the characteristic diffraction peaks at 11.8°, 23.7°, 34.7°, 39.5°, 47.2°, 53.4°, 57.0°, 60.5°, and 61.8°, which are indexed to LDH phase (PDF#52–1082) [41]. The characteristic diffraction peaks at 44.3°, 51.7°, and 76.2° are indexed to the metallic Ni phase (PDF#89–7128), as shown in the XRD pattern of the Ni/Al2O3-600 sample (Fig. S1). As shown in Fig. 2, diffraction peaks at 31.7°, 34.3°, 36.2°, 47.5°, 56.5°, 62.9°, 67.8° and 69.2° are attributed to the ZnO phase (PDF#36–1451), and the peaks at 36.8°, 55.6°, and 59.4° are ascribed to ZnAl2O4 (PDF#05–0669). Both ZnO and ZnAl2O4 phases exist in all of the as-prepared catalysts, indicating that the reduction treatment does not change the basic structure of the supports. The peaks of NiO (PDF#89–7390) at 37.2° and 62.9° are covered by ZnO (PDF#36–1451), and the characteristic peak at 43.3° can be ascribed to NiO. Through hydrogen reduction treatment, nickel species changed from oxidized nickel into metallic nickel, and the peak intensity of Ni became stronger with the rise of the reduction temperature. It is worth noting that the metallic Ni peaks at 43.2°, 51.7°, and 76.1° slightly shift to the small angle, revealing possible lattice expansions of Ni0. As the atomic radius of Zn is larger than Ni, the slight shift may be explained by the possible alloying between Ni and Zn during the calcination and reduction process. In general, it is difficult to reduce Zn2+ species to metallic Zn with H2, and this reduction occurs in Ni/ZnAlOx-600 and Ni/ZnAlOx-650 catalysts may be due to close contact between the metallic Ni and the zinc-containing support [42]. Hydrogen is adsorbed on the metallic Ni by dissociation to form hydrogen atoms, which overflow to reduce the adjacent Zn species [42]. The ICP results reveal that the Ni content in the Ni/ZnAlOx-500, Ni/ZnAlOx-600, and Ni/ZnAlOx-650 catalysts is 5.4 wt%, 7.4 wt%, and 7.5 wt%, respectively (Table S1). The difference in Ni content is also attributed to a higher reduction degree of nickel oxides at higher reduction temperatures. As shown in Fig. S2, the NiZnAl-LDH precursor exhibits a hierarchical petal-like morphology before and after the calcination and reduction process. As shown in Fig. 3, the metallic Ni nano-particles can be distinctly found in the TEM image of the Ni/ZnAlOx-600 catalyst. They are homogeneously distributed without serious aggregation, and the average grain diameter of Ni nano-particles is 8.5 nm, which is larger than some of the previously reported ones [34,35,40,43], because of the possible formation of Ni-Zn alloy during the catalyst preparation [42,44]. The fringe spacing distance of 0.206 nm, 0.243 nm, 0.283 nm, 0.209 nm, and 0.241 nm measured in the high-resolution TEM (HR-TEM) image of Ni/ZnAlOx-600, correspond to the (111) plane of metallic Ni, (311) plane of ZnAl2O4, (100) plane of ZnO, (101) plane of metallic Ni-Zn and (101) plane of metallic NiO, respectively. As shown in Fig. S2, higher reduction temperature results in the growth of the nano-particles, and the average size of the nano-particles in the Ni/ZnAlOx-650 sample is around 17.3 nm. X-ray photoelectron spectroscopy (XPS) was used to probe the different chemical valence states of the elements on the catalyst surface. As shown in Fig. 4, two peaks were fitted for the Ni species. The binding energy values at 852.2–852.4 eV and 869.3–869.7 eV may be assigned to 2p3/2 and 2p1/2 of metallic Ni0, respectively, while the binding energy values at 855.5–855.7 eV (Ni2+ 2p3/2) and 873.2–873.5 eV (Ni2+ 2p1/2) indicate the presence of nickel oxide. The peaks located between 861.5 and 861.6 eV and 879.5–880.0 eV can be attributed to the satellite peak of Ni2+ (Table S2). The presence of Ni oxide in the catalyst might be partially caused by the slight oxidation during placement in the air. Compared with the Ni/Al2O3-600 catalyst, Ni/ZnAlOx-600 catalyst shows slightly higher Ni 2p3/2 and 2p1/2 binding energy (Ni/ZnAlOx-600 vs Ni/Al2O3-600, 852.3 and 869.4 eV vs 852.2 and 869.3 eV, respectively), revealing a possible charge transfer from the Ni atoms to the Zn atoms, which further confirms the formation of Ni-Zn alloy on the catalyst. The Ni/ZnAlOx-650 catalyst also shows this property (Ni/ZnAlOx-650 vs Ni/Al2O3-600, 852.4 and 869.7 eV vs 852.2 and 869.3 eV, respectively). This phenomenon has been verified by similar observations in literature [45–47]. This strong charge transfer between nickel and ZnAl support may produce electron-deficient Ni species, thus enhancing the chemisorption for CN bonds in nitrile molecules. The increase in the proportion of Ni0 and Ni2+ species also enhanced the reduction degree of Ni with the increase in calcination temperature. The Ni/ZnAlOx-500 sample shows no metallic Ni because only a small amount or almost no NiO in the precursor was reduced to Ni0 at 500 °C, which is consistent with the XRD result. N2 adsorption-desorption isotherms of the NiZnAl-LDH and the Ni/ZnAlOx-T catalysts exhibit typical IV-type isotherm curves in the P/P0 scope of 0.4–0.9, which is the characteristic of mesoporous structure (Fig. S3 and Fig. 5). As shown in Table S3, the prepared NiZnAl-LDH and Ni/ZnAlOx-500 catalysts show BET surface area of 115.2 m2/g and 95.0 m2/g, and pore size of 16.1 nm and 18.6 nm, respectively. With the increasing reduction temperature, the BET surface area decreased to 63.5 m2/g for the Ni/ZnAlOx-600 and 39.4 m2/g for Ni/ZnAlOx-650 respectively, which may be due to the collapse of hierarchical structure, as compared to Ni/ZnAlOx-500 catalyst. Moreover, the reduction behaviors of catalysts were tested through H2 temperature-programmed reduction (H2-TPR). As illustrated in Fig. 6a, Ni/ZnAlOx-500 shows a wide and strong peak with the center around 650 °C, due to the reduction of bulk NiO in the NiZnAl mixed oxides, which further confirms the above statements that NiO in the Ni/ZnAlOx-500 is hardly reduced to metallic Ni nano-particles. The intensity of the reduction peak decreases sharply or even almost disappears at around 650 °C, suggesting that the NiO phase in the mixed metal oxide precursor is nearly completely reduced to metallic Ni nano-particles by H2 with a reduction temperature beyond 600 °C. However, a weak reduction peak between 100 and 200 °C is intuitively noticed in the H2-TPR profiles of the Ni/ZnAlOx-600 and Ni/ZnAlOx-650 catalysts, which is due to the reduction of oxides formed by slight oxidation of nickel nano-particles during placement in the air. The acidic properties of the catalysts were studied by NH3-TPD (Fig. 6b). All catalysts show a weak peak around 200 °C, corresponding to a weak acidic site, which may be related to the Al3+ species. The catalysts (Ni/Al2O3-600) without Zn species show an NH3 desorption peak around 400 °C, corresponding to the medium-strength acidic sites. For the Ni/ZnAlOx-600 catalyst, the NH3 desorption peak at around 650 °C corresponds to the strong acidic sites. These results indicated that the addition of Zn species increased the acidic site of the catalyst [48]. The surface structure and acid-base association of the Ni/ZnAlOx-600 catalyst were investigated by the analysis of pyridine adsorption by RT and desorption at 25, 150, and 300 °C by FT-IR spectra (Fig. 6c). The pyridine ligated on Lewis acid site (L) shows characteristic absorption bands at 1455 and 1616 cm−1, the pyridine adsorbed on Brønsted acid site (B) observes characteristic absorption bands at 1540 and 1652 cm−1, 1490 cm−1 ascribes to pyridine adsorbed onto both Lewis and Brønsted acid site (B+L). More importantly, the results of Table S4 showed that the L/B ratio increased with the increase in desorption temperature, indicating that the Ni/ZnAlOx-600 catalyst possesses a strong Lewis acidity [43]. XPS revealed that the existence of strong electron interactions between metallic nickel and ZnAl support can produce electron-deficient Ni species. Therefore, although the Ni/Al2O3-600 catalyst (without Zn) can promote the conversion of benzonitrile, the selectivity for benzylamine was not high. In contrast, the introduction of zinc species enabled Lewis acid produced by zinc species on the surface of nickel nano-particles to act as an electron acceptor by adsorbing benzonitrile to fix selectively the N atoms of the CN bonds, which facilitated the functionalization of CN bonds [49,50]. The catalytic performance of the mesoporous Ni/ZnAlOx-T catalysts was judged by the reduction of benzonitrile to benzylamine as a model reaction. As shown in Table 1, no conversion and the negligible conversion of benzonitrile (Table 1, Entries 1 & 2) were observed for Ni/ZnAlOx-air and Ni/ZnAlOx-500 catalysts, respectively, which suggested that NiO could not activate the H2 molecules to promote the hydrogenation of nitriles. As expected, the Ni/ZnAlOx-600 and Ni/ZnAlOx-650 catalysts with metallic Ni and Ni-Zn alloy as the active species showed high activity for the hydrogenation of benzonitrile, which gave conversions of 57.1% and 47.1% after 4 h at room temperature (Table 1, Entries 3 & 4), respectively. The slightly higher reactivity of Ni/ZnAlOx-600 to Ni/ZnAlOx-650 was due to its smaller size of metallic Ni nano-particles, which provided more contact sites to the substrates. In addition, the main product of the selective hydrogenation reaction was benzylamine, and the selectivity of benzylamine was as high as 91.1% and 92.7% over the Ni/ZnAlOx-600 and Ni/ZnAlOx-650 catalyst, respectively. Therefore, Ni/ZnAlOx-600 showed the highest activity and selectivity in the experiments, as Ni/ZnAlOx-600 occupied higher content of metallic Ni than Ni/ZnAlOx-500 and smaller Ni particle size than Ni/ZnAlOx-650, according to the XPS and TEM characterizations. Moreover, compared with Ni/ZnAlOx-600, the conversion of benzonitrile over Ni/Al2O3-600 (without Zn) was only 43.3%, and the selectivity of benzylamine was 40.0%, indicating that the existence of Zn species greatly promoted the catalytic efficiency (Table 1, Entry 5). The catalytic activity of the Ni/ZnO catalyst was only 2.1% (Table 1, Entry 6), indicating the essential role of Al2O3 as the main support. ZnAlOx catalyst without Ni in the catalytic reaction did not show any activity (Table 1, Entry 7). Particularly, we attribute the room temperature reaction property of the Ni/ZnAlOx-600 catalyst to the introduction of zinc, which has two effects: the formation of Ni-Zn alloy and the introduction of Lewis acid. The formation of Ni-Zn alloys initiates the charge transfer from Ni to Zn, revealing strong electron interaction between Ni and Zn [45–47]. This electron interaction can produce electron-deficient nickel species, which is more favorable for the adsorption of benzonitrile as well as the dissociated adsorption of H2 by decreasing the activation energy [45,50]. This is the major reason that the reaction can be activated at room temperature. (ii) Lewis acid brought by Zn also contributes to the selective hydrogenation of benzonitrile. The Lewis acid acts as an electron acceptor and interacts with the N atom on the CN bonds in the benzonitrile adsorbed on the catalyst, making the CN bonds functionalized [49]. Therefore, the reaction could be performed at a much lower temperature. The excellent catalytic effect of the Ni/ZnAlOx-600 was also compared with representative systems [8,21–40]. The results show that the Ni/ZnAlOx-600 catalyst is comparable to most of the reported catalysts (Table S5). Having clarified the role of the catalyst components, the reaction conditions were optimized for the reduction of benzonitrile. Firstly, we investigated the influence of different solvents on catalytic hydrogenation activity ( Table 2). In contrast to previous reports on the hydrogenation of nitriles [25–27], Ni/ZnAlOx-600 had been investigated to be completely inactive in the oxygen-containing solvents with strong polarity (Table 2, entries 1–4), and the possible reason might be due to the affinity of these solvents to the catalytic sites for the presence of oxygen atoms in these solvents. Moderate to high yields were produced in hydrocarbon solvent regardless of the polarity (Table 2, entries 5–9). The best result was obtained in the hexane solvent. When 200 μL of methanol was added to hexane solvent, the conversion of benzonitrile was significantly decreased (Table 2, Entry 6 vs 10, 57.1% vs 32.5%). When the content of methanol was increased to 400 μL, the conversion of benzonitrile continued to decrease to 20.6% (Table 2, Entry 11). These results indicated that there was competitive adsorption between oxygen-containing molecules (such as methanol) and benzonitrile. Subsequently, the influence of the pressure of hydrogen and the amount of NH3·H2O was also examined for the hydrogenation of benzonitrile ( Fig. 7). With the increase of H2 pressure from 1 bar to 20 bar, the conversion of benzonitrile gradually increased from 25.0% to 63.0%, which may be attributed to the increase of the hydrogen content in the reaction system as well as the surface layer of the catalyst, promoting the hydrogenation of benzonitrile (Fig. 7a). However, the selectivity of benzylamine was not significantly affected by the hydrogen pressure, which remained around 90.0%. Besides, the loading of NH3·H2O on the hydrogenation of benzonitrile was also investigated (Fig. 7b). Without the addition of NH3·H2O, the conversion of benzonitrile was 50.5% and the selectivity of benzylamine was only 16.0%. It was obvious that the presence of NH3·H2O could not significantly promote the hydrogenation of benzonitrile. However, the selectivity of primary amine increased with the gradual rise of NH3·H2O content. When 200 μL NH3·H2O was added into the catalytic system, the selectivity of benzylamine reached more than 90.0%. To our pleasure, the formation of dibenzylamine was not observed in our catalytic system. The time curve of the yield of the hydrogenation of benzonitrile was recorded in Fig. 8. In the process of reaction, the conversion of benzonitrile was gradually increased, and the yield of benzylamine also increased gradually under normal circumstances. The content of N-benzylidene benzylamine first increased and then decreased, indicating that it can be further converted to the target product (benzylamine) as an intermediate. It gave the 99.8% conversion of benzonitrile and 99.0% yield of benzylamine after 14 h at room temperature under the 10 bar H2 pressure. Further, we applied this catalytic system to different kinds of nitriles to investigate the universality of the Ni/ZnAlOx-600 catalyst. As observed in Table 3, all reactions were performed in 10 bar H2 and within 25–80 °C to afford the moderate to excellent yields of primary amines. 4-methylbenzonitrile, 4-methoxybenzonitrile, and 2-naphthonitrile can be reduced under room temperature (25 °C) with almost quantitative yield (Table 3, substrates 1, 4, and 8), which is superior to most heterogeneous catalyst. Higher temperatures and more NH3·H2O were needed when reacting with a large steric hindrance 2-methylbenzonitrile and 3-methylbenzonitrile. (Table 3, substrates 2 and 3) which indicated that the steric hindrance of substituents showed a significant effect on the substrate activity due to the inaccessibility of the nitrile-based group with the Ni sites on the surface of the catalyst. Besides, the electronic properties of the substituent groups were also found to be influential on the hydrogenation of nitriles. Substrates with electron-giving groups (Table 3, substrates 1–4 and 13–14) showed significantly higher activity than aromatic nitriles with electron-drawing groups (Table 3, substrates 5–7 and 12), and the latter required a higher temperature, more NH3·H2O amount, and longer time to achieve the best conversion over the Ni/ZnAlOx-600 catalyst. It was worth noting that no dehalogenation reaction was found in this investigation, which may be related to the mild conditions of nonprecious-based metals catalytic systems (Table 3, substrates 5–7). It was glad that nitriles bearing N-heterocycle also represented high activity, realizing complete conversion. However, the selectivity of the corresponding primary amine was lower than benzylamine (Table 3, substrates 9–11). It might be caused by the alkaline pyridine ring in nitriles containing N-heterocycles, which promoted the hydrolysis of the cyano group to obtain amide by-products. Interestingly, when 1, 3-benzenedicarbonitrile was applied to this reaction, only 3-cyanobenzylamine was generated, the reason might be that the steric hindrance induced by meta-methylamine prevented the continued reaction (Table 3, substrate 12). In addition, aldehyde, acetyl, valeronitrile, and cyclohexyl benzonitrile (Table 3, substrates 15–18) all showed excellent activity and selectivity. The potential of the catalyst was further probed by employing the more challenging benzylic nitriles. The obtained results showed that all benzylic nitriles reacted smoothly with high to excellent yield; however, higher temperature and longer time were needed due to the lower activity of these substrates (Table 3, 19–24). Subsequently, we explored the reaction route of hydrogenation of benzonitrile to benzylamine through a series of control experiments ( Scheme 2). In the absence of NH3·H2O, the conversion of benzonitrile hardly decreased, but the selectivity of benzylamine decreased significantly. The main product was N-benzylidene benzylamine, indicating that the role of NH3·H2O was to control the selectivity of the product. However, N-benzylidene benzylamine had almost no conversion under the H2 atmosphere without NH3·H2O, which explains why there was no dibenzylamine in the catalytic system. With benzonitrile and N-benzylidene benzylamine as substrate, the conversion of benzonitrile was significantly lower than the latter (57.1% vs 88.7%) under the conditions of 200 μL NH3·H2O and 10 bar H2. Therefore, it can be concluded that the main reaction route was coupling to obtain intermediate N-benzylidene benzylamine and then further ammonolysis and hydrogenation. In other words, Path A was dominant in this reaction ( Scheme 3). Benzylamine was produced by direct hydrogenation of benzonitrile in the absence of ammonia. Benzonitrile (Compound A) was reduced by hydrogenation of one hydrogen molecule to phenylmethanimine (Compound B) and then reacted with one hydrogen molecule to form benzylamine (Compound E). The by-product N-benzylidene benzylamine (Compound C) was formed by condensation of phenylmethanimine (Compound B) and benzylamine (Compound E) to remove one molecule of ammonia. After adding ammonia, hydrogenation coupling is the main way of benzonitrile hydrogenation (Path A). Benzonitrile (Compound A) was first hydrogenated to form phenylmethanimine (Compound B). The phenylmethanimine (Compound B) and benzylamine (Compound E) condensed and released one molecule of ammonia to form N-benzylidene benzylamine (Compound C). However, the reaction of phenylmethylimide (Compound B) was a too weak response to be detected. Proper-size metallic nickel nano-particles in the Ni/ZnAlOx-600 catalyst were recognized as the hydrogenation sites, which were easy to dissociation of hydrogen. The presence of Ni-Zn alloys indicated that strong metal-support interactions can produce electron-deficient nickel species, which led to the enhancement of directional chemisorption of CN bonds in the nitrile on the nickel surface. At the same time, NiOx in Ni/ZnAlOx-600 catalyst enhanced the adsorption of phenylmethanimine (Compound B) and benzylamine (Compound E), and the promoter condensed the two molecules into N-benzylidene benzylamine (Compound C) [51]. In addition, the introduction of zinc species enabled Lewis acid produced by zinc species on the surface of nickel nano-particles to act as an electron acceptor by adsorbing benzonitrile to fix selectively the N atoms of the CN bonds, which facilitated the functionalization of CN bonds [49,50]. In the reaction, although N-benzylidene benzylamine (Compound C) was very sensitive to hydrogenation, no dibenzylamine was formed, probably because the hydrogenation of benzonitrile to a higher reaction temperature was required. The stability of the Ni/ZnAlOx-600 catalyst was finally judged by the reduction of benzonitrile as the model reaction at 25 °C and 10 bar H2 ( Fig. 9a). At the end of each reaction, the solid matter was parted via centrifugation and the used catalyst was rinsed with deionized water, dried in vacuum and reused in the next run. In the whole process of recycling, the benzonitrile conversion and benzylamine yield showed no significant decrease, which suggested that the Ni/ZnAlOx-600 catalyst was highly stable. The XRD pattern of the catalyst showed no significant change, indicating that the structure of the catalyst was stable before and after use (Fig. 9b). The TEM of the used catalyst and the particle size distribution of Ni nano-particles in TEM of the used catalyst did not change significantly, indicating that the catalyst had excellent stability (Fig. 9c), and the XPS spectra of Ni 2p of fresh and used Ni/ZnAlOx-600 showed little difference (Fig. 9d). The excellent stability of the catalyst may be attributed to the violent interaction between Ni metallic nano-particles and ZnAl support as well as the mild reaction conditions. 4 Conclusions In summary, we have developed an efficient method for the preparation of structure-diverse primary amines from the reduction of nitriles over the inexpensive and stable Ni/ZnAlOx-600 under mild conditions. The Ni/ZnAlOx-600 catalyst demonstrated comparable or even higher activity than noble and most non-precious metal catalysts. Proper-size metallic nickel provides the hydrogenation centers, NiOx enhanced the adsorption of phenylmethanimine and benzylamine, the formation of Ni-Zn alloys facilitated the enhancement of directional chemisorption of CN bonds in the benzonitrile, and the introduction of Zinc into the catalyst provides strong Lewis acid sites which also contribute greatly to the room-temperature catalytic activity. Our developed methods demonstrate some obvious advantages including the facile catalyst preparation, the low catalyst cost, the mild reaction condition, the wide substrate scope, and the excellent catalyst stability. CRediT authorship contribution statement Jie He and An-Qiu Liu supervised the project. Huan-Yu Zhao and Ze-Hui Zhang planned and developed the project and designed the experiments. Huan-Yu Zhao prepared and developed catalysts and performed all catalytic experiments. Yu-Rong He and Xiao-Chen Wang performed catalyst characterization. Jie He and An-Qiu Liu co-wrote the paper. Declaration of Competing Interest The authors declare that they have no known competing financial interests or personal relationships that could have appeared to influence the work reported in this paper. Acknowledgment This work was supported by the National Natural Science Foundation of China (NO. 22209210), the Natural Science Foundation of Hubei Province (2022CFB912), the Knowledge Innovation Program of Wuhan-Shuguang Project (2022010801020411), the Fundamental Research Funds for Central Universities (CSZY22011 and CZQ21008), Scientific Research Fund of South-Central Minzu University (YZZ21005), and University Natural Science Research Project of Anhui Province (No. KJ2019A0829 and KJ2019A0832). Appendix A Supporting information Supplementary data associated with this article can be found in the online version at doi:10.1016/j.apcata.2023.119115. Appendix A Supplementary material Table S1 Supplementary material . References [1] Q.Q. Lu J.G. Liu L.L. Ma J. Catal. 404 2021 475 492 Q.Q. Lu, J.G. Liu, L.L. Ma, J. Catal. 404 (2021) 475–492. [2] S. Van Praet G. Preegel F. Rammal B.F. Sels ACS Sustain. Chem. Eng. 10 20 2022 6503 6508 S. Van Praet, G. Preegel, F. Rammal, B.F. Sels, ACS Sustainable Chem. Eng. 10 (20) (2022) 6503–6508. [3] O.I. Afanasyev E. Kuchuk D.L. Usanov D. Chusov Chem. Rev. 119 23 2019 11857 11911 O.I. Afanasyev, E. Kuchuk, D.L. Usanov, D. Chusov, Chem. Rev. 119 (23) (2019) 11857–11911. [4] Y.X. Liu S.P. He Z.Y. Quan H.Z. Cai Y. Zhao B. Wang Green Chem. 21 4 2019 830 838 Y.X. Liu, S.P. He, Z.Y. Quan, H.Z. Cai, Y. Zhao, B. Wang, Green Chem. 21 (4) (2019) 830–838. [5] Formenti F. Ferretti F.K. Scharnagl M. Beller Chem. Rev. 119 4 2019 2611 2680 Formenti, F. Ferretti, F.K. Scharnagl, M. Beller, Chem. Rev. 119 (4) (2019) 2611–2680. [6] M. Yoshimura A. Komatsu M. Niimura Y. Takagi T. Takahashi S. Ueda T. Ichikawa Y. Kobayashi H. Okami T. Hattori Y. Sawama Y. Monguchi H. Sajiki Adv. Synth. Catal. 360 8 2018 1726 1732 M. Yoshimura, A. Komatsu, M. Niimura, Y. Takagi, T. Takahashi, S. Ueda, T. Ichikawa, Y. Kobayashi, H. Okami, T. Hattori, Y. Sawama, Y. Monguchi, H. Sajiki, Adv. Synth. Catal. 360 (8) (2018) 1726–1732. [7] R. Adam C.B. Bheeter J.R. Cabrero-Antonino K. Junge R. Jackstell M. Beller ChemSusChem 10 5 2017 842 846 R. Adam, C.B. Bheeter, J.R. Cabrero-Antonino, K. Junge, R. Jackstell, M. Beller, ChemSusChem 10 (5) (2017) 842–846. [8] Y.M. Zhang H.M. Yang Q. Chi Z.H. Zhang ChemSusChem 12 6 2019 1246 1255 Y.M. Zhang, H.M. Yang, Q. Chi, Z.H. Zhang, ChemSusChem 12 (6) (2019) 1246–1255. [9] Z.L. Yuan B. Liu P. Zhou Z.H. Zhang Q. Chi J. Catal. 370 2019 347 356 Z.L. Yuan, B. Liu, P. Zhou, Z.H. Zhang, Q. Chi, J. Catal. 370 (2019) 347–356. [10] B.X. Zheng J. Xu J.L. Song H.H. Wu X.L. Mei K.L. Zhang W.Y. Han W. Wu M.Y. He B.X. Han Chem. Sci. 13 31 2022 9047 9055 B.X. Zheng, J. Xu, J.L. Song, H.H. Wu, X.L. Mei, K.L. Zhang, W.Y. Han, W. Wu, M.Y. He, B.X. Han, Chem. Sci. 13 (31) (2022) 9047–9055. [11] V.G. Chandrashekhar W. Baumann M. Beller R.V. Jagadeesh Science 376 6600 2022 1433 1441 V.G. Chandrashekhar, W. Baumann, M. Beller, R.V. Jagadeesh, Science 376 (6600) (2022) 1433–1441. [12] R.V. Jagadeesh K. Murugesan A.S. Alshammari H. Neumann M.M. Pohl J. Radnik M. Beller Science 358 6361 2017 326 332 R.V. Jagadeesh, K. Murugesan, A.S. Alshammari, H. Neumann, M.M. Pohl, J. Radnik, M. Beller, Science 358 (6361) (2017) 326–332. [13] H.F. Qi J. Yang F. Liu L.L. Zhang J.Y. Yang X.Y. Liu L. Li Y. Su Y.F. Liu R. Hao A.Q. Wang T. Zhang Nat. Commun. 12 1 2021 3295 H.F. Qi, J. Yang, F. Liu, L.L. Zhang, J.Y. Yang, X.Y. Liu, L. Li, Y. Su, Y.F. Liu, R. Hao, A.Q. Wang, T. Zhang, Nat. Commun. 12 (1) (2021) 3295. [14] C.S. Chin B. Lee Catal. Lett. 14 1992 135 140 C.S. Chin, B. Lee, Catal. Lett. 14 (1992) 135–140. [15] S. Takemoto H. Kawamura Y. Yamada T. Okada A. Ono E. Yoshikawa Y. A Mizobe M. Hidai Organometallics 21 19 2002 3897 3904 S. Takemoto, H. Kawamura, Y. Yamada, T. Okada, A. Ono, E. Yoshikawa, Y. A Mizobe, M. Hidai, Organometallics 21 (19) (2002) 3897–3904. [16] T. Yoshida T. Okano S. Otsuka J. Chem. Soc. Chem. Commun. 1979 870 871 T. Yoshida, T. Okano, S. Otsuka, J. Chem. Soc., Chem. Commun. (1979) 870–871. [17] A. Mukherjee D. Srimani S. Chakraborty Y. Ben-David D. Milstein J. Am. Chem. Soc. 137 28 2015 8888 8891 A. Mukherjee, D. Srimani, S. Chakraborty, Y. Ben-David, D. Milstein, J. Am. Chem. Soc. 137 (28) (2015) 8888–8891. [18] S. Elangovan C. Topf S. Fischer H.J. Jiao A. Spannenberg W. Baumann R. Ludwig K. Junge M. Beller J. Am. Chem. Soc. 138 2016 8809 8814 S. Elangovan, C. Topf, S. Fischer, H.J. Jiao, A. Spannenberg, W. Baumann, R. Ludwig, K. Junge, M. Beller, J. Am. Chem. Soc. 138 (2016) 8809–8814. [19] K. Sarkar K. Das A. Kundu D. Adhikari B. Maji ACS Catal. 11 5 2021 2786 2794 K. Sarkar, K. Das, A. Kundu, D. Adhikari, B. Maji, A.C.S. Catal. 11 (5) (2021) 2786–2794. [20] C. Bornschein S. Werkmeister B. Wendt H.J. Jiao E. Alberico W. Baumann H. Junge K. Junge M. Beller Nat. Commun. 5 2014 4111 C. Bornschein, S. Werkmeister, B. Wendt, H.J. Jiao, E. Alberico, W. Baumann, H. Junge, K. Junge, M. Beller, Nat. Commun. 5 (2014) 4111. [21] L. Liu Y.H. Liu Y.J. Ai J.F. Li J.J. Zhou Z.B. Fan H.J. Bao R.H. Jiang Z.N. Hu J.T. Wang K. Jing Y. Wang Q.L. Liang H.B. Sun Iscience 8 2018 61 73 L. Liu, Y.H. Liu, Y.J. Ai, J.F. Li, J.J. Zhou, Z.B. Fan, H.J. Bao, R.H. Jiang, Z.N. Hu, J.T. Wang, K. Jing, Y. Wang, Q.L. Liang, H.B. Sun, Iscience. 8 (2018) 61–73. [22] J.F. Li L. Liu Y.J. Ai Z.N. Hu Z.B. Liu R.X. Guo C. Zhang H.M. Tian J.J. Wu M. Ruan H.B. Sun ChemistrySelect 4 2019 7346 7350 J.F. Li, L. Liu, Y.J. Ai, Z.N. Hu, Z.B. Liu, R.X. Guo, C. Zhang, H.M. Tian, J.J. Wu, M. Ruan, H.B. Sun, ChemistrySelect. 4 (2019) 7346–7350. [23] H. Goksu S.F. Ho O. Metin K. Korkmaz A.M. Garcia M.S. Gultekin S.H. Sun ACS Catal. 4 6 2014 1777 1782 H. Goksu, S.F. Ho, O. Metin, K. Korkmaz, A.M. Garcia, M.S. Gultekin, S.H. Sun, ACS Catal. 4 (6) (2014) 1777–1782. [24] L. Liu J.F. Li Y.J. Ai Y.H. Liu J.L. Xiong H.D. Wang Y.J. Qiao W.R. Liu S.C. Tan S.F. Feng K.P. Wang H.B. Sun Q.L. Liang Green Chem. 21 2019 1390 1395 L. Liu, J.F. Li, Y.J. Ai, Y.H. Liu, J.L. Xiong, H.D. Wang, Y.J. Qiao, W.R. Liu, S.C. Tan, S.F. Feng, K.P. Wang, H.B. Sun, Q.L. Liang, Green Chem. 21 (2019) 1390–1395. [25] V.G. Chandrashekhar T. Senthamarai R.G. Kadam O. Malina J. Kašlík R. Zbořil M.B. Gawande R.V. Jagadeesh M. Beller Nat. Catal. 5 2022 20 29 V.G. Chandrashekhar, T. Senthamarai, R.G. Kadam, O. Malina, J. Kašlík, R. Zbořil, M.B. Gawande, R.V. Jagadeesh, M. Beller, Nat. Catal. 5 (2022) 20–29. [26] F. Chen C. Topf J. Radnik C. Kreyenschulte H. Lund M. Schneider A.E. Surkus L. He K. Junge M. Beller J. Am. Chem. Soc. 138 2016 8781 8788 F. Chen, C. Topf, J. Radnik, C. Kreyenschulte, H. Lund, M. Schneider, A.E. Surkus, L. He, K. Junge, M. Beller, J. Am. Chem. Soc. 138 (2016) 8781–8788. [27] J.L. Long K. Shen Y.W. Li ACS Catal. 7 2017 275 284 J.L. Long, K. Shen, Y.W. Li. ACS Catal. 7 (2017) 275–284. [28] T. Mitsudome M. Sheng A. Nakata J. Yamasaki T. Mizugaki K. Jitsukawa Chem. Sci. 11 2020 6682 6689 T. Mitsudome, M. Sheng, A. Nakata, J. Yamasaki, T. Mizugaki, K. Jitsukawa, Chem. Sci. 11 (2020) 6682–6689. [29] M. Sheng S. Yamaguchi A. Nakata S. Yamazoe K. Nakajima J. Yamasaki T. Mizugaki T. Mitsudome A.C.S. Sustainable Chem. Eng. 9 2021 11238 11246 M. Sheng, S. Yamaguchi, A. Nakata, S. Yamazoe, K. Nakajima, J. Yamasaki, T. Mizugaki, T. Mitsudome, A.C.S. Sustainable Chem. Eng. 9 (2021) 11238–11246. [30] K. Murugesan T. Senthamarai M. Sohail A.S. Alshammari M.M. Pohl M. Beller R.V. Jagadeesh Chem. Sci. 9 45 2018 8553 8560 K. Murugesan, T. Senthamarai, M. Sohail, A.S. Alshammari, M.M. Pohl, M. Beller, R.V. Jagadeesh, Chem. Sci. 9 (45) (2018) 8553–8560. [31] D.J. Segobia A.F. Trasarti C.R. Apesteguia Appl. Catal. A 494 2015 41 47 D.J. Segobia, A.F. Trasarti, C.R. Apesteguia, Appl. Catal., A 494 (2015) 41–47. [32] R.X. Guo X.Y. Zhang X.D. Li D. Niu H.B. Sun J. Taiwan Inst. Chem. Eng. 140 2022 104561 R.X. Guo, X.Y. Zhang, X.D. Li, D. Niu, H.B. Sun, J. Taiwan Inst. Chem. Eng. 140 (2022) 104561. [33] R.X. Guo X.Y. Zhang Z.N. Hu D. Niu X.D. Li H.B. Sun Q.L. Liang J. Environ. Chem. Eng. 11 2023 109143 R.X. Guo, X.Y. Zhang, Z.N. Hu, D. Niu, X.D. Li, H.B. Sun, Q.L. Liang, J. Environ. Chem. Eng. 11 (2023) 109143. [34] Y.Y. Cao L.B. Niu X. Wen W.H. Feng L. Huo G.Y. Bai J. Catal. 339 2016 9 13 Y.Y. Cao, L.B. Niu, X. Wen, W.H. Feng, L. Huo, G.Y. Bai, J. Catal. 339 (2016) 9–13. [35] Y. Lv J. Li S. Feng P.L. Liu F. Hao W. Xiong H.A. Luo Chem. Eng. J. 346 2018 203 216 Y. Lv, J. Li, S. Feng, P.L. Liu, F. Hao, W. Xiong, H.A. Luo, Chem. Eng. J. 346 (2018) 203–216. [36] D.J. Segobia A.F. Trasarti C.R. Apesteguia React. Chem. Eng. 6 2021 2181 2190 D.J. Segobia, A.F. Trasarti, C.R. Apesteguia, React. Chem. Eng. 6 (2021) 2181–2190. [37] N. Antil A. Kumar N. Akhtar R. Newar W. Begum A. Dwivedi K. Manna ACS Catal. 11 7 2021 3943 3957 N. Antil, A. Kumar, N. Akhtar, R. Newar, W. Begum, A. Dwivedi, K. Manna, ACS Catal. 11 (7) (2021) 3943–3957. [38] P. Ryabchuk G. Agostini M.M. Pohl H. Lund A. Agapova H. Junge K. Junge M. Beller Sci. Adv. 4 6 2018 eaat0761 P. Ryabchuk, G. Agostini, M.M. Pohl, H. Lund, A. Agapova, H. Junge, K. Junge, M. Beller, Sci. Adv. 4 (6) (2018) eaat0761. [39] Y.Q. Kang J. Henzie H.J. Gu J. Na A. Fatehmulla B.S.A. Shamsan A.M. Aldhafiri W.A. Farooq Y. Bando T. Asahi B. Jiang H.X. Li Y. Yamauchi Small 16 10 2020 1906707 Y.Q. Kang, J. Henzie, H.J. Gu, J. Na, A. Fatehmulla, B.S. A. Shamsan, A.M. Aldhafiri, W.A. Farooq, Y. Bando, T. Asahi, B. Jiang, H.X. Li, Y. Yamauchi, Small 16 (10) (2020) 1906707. [40] Z. Ma V.G. Chandrashekhar B. Zhou A.M. Alenad N. Rockstroh S. Bartling M. Beller R.V. Jagadeesh Chem. Sci. 13 36 2022 10914 10922 Z. Ma, V.G. Chandrashekhar, B. Zhou, A.M. Alenad, N. Rockstroh, S. Bartling, M. Beller, R.V. Jagadeesh, Chem. Sci. 13 (36) (2022) 10914–10922. [41] H.L. Zhang J. Dong X.L. Qiao J.R. Qin H.F. Sun A.Q. Wang L.B. Niu G.Y. Bai J. Catal. 372 2019 258 265 H.L. Zhang, J. Dong, X.L. Qiao, J.R. Qin, H.F. Sun, A.Q. Wang, L.B. Niu, G.Y. Bai, J. Catal. 372 (2019) 258–265. [42] X. Kong Y.F. Zhu H.Y. Zheng Y.L. Zhu Z. Fang ACS Sustain. Chem. Eng. 5 12 2017 11280 11289 X. Kong, Y.F. Zhu, H.Y. Zheng, Y.L. Zhu, Z. Fang, ACS Sustainable Chem. Eng. 5 (12) (2017) 11280–11289. [43] D.J. Segobia A.F. Trasarti C.R. Apesteguía Chin. J. Catal. 40 2019 1693 1703 D.J. Segobia, A.F. Trasarti, C.R. Apesteguía, Chin. J. Catal. 40 (2019) 1693–1703. [44] C. Anjaneyulu L.O.O. da Costa M.C. Ribeiro R.C. Rabelo-Neto L.V. Mattos A. Venugopal F.B. Noronha Appl. Catal. A 519 2016 85 98 C. Anjaneyulu, L.O. O. da Costa, M.C. Ribeiro, R.C. Rabelo-Neto, L.V. Mattos, A. Venugopal, F.B. Noronha, Appl. Catal., A 519 (2016) 85–98. [45] Z.Y. Pan R.J. Wang J.X. Chen Appl. Catal. B 224 2018 88 100 Z.Y. Pan, R.J. Wang, J.X. Chen, Appl. Catal., B 224 (2018) 88–100. [46] J. Rodriguez Surf. Sci. Rep. 24 1996 223 287 J. Rodriguez, Surf. Sci. Rep. 24 (1996) 223–287. [47] C.S. Spanjers R.S. Sim N.P. Sturgis B. Kabius R.M. Rioux ACS Catal. 5 6 2015 3304 3315 C.S. Spanjers, R.S. Sim, N.P. Sturgis, B. Kabius, R.M. Rioux, ACS Catal. 5 (6) (2015) 3304–3315. [48] X.K. Yue L.H. Zhang L.X. Sun S.T. Gao W. Gao X. Cheng N.Z. Shang Y.J. Gao C. Wang Appl. Catal. B 293 2021 120243 X.K. Yue, L.H. Zhang, L.X. Sun, S.T. Gao, W. Gao, X. Cheng, N.Z. Shang, Y.J. Gao, C. Wang, Appl. Catal., B 293 (2021) 120243. [49] K. Tokmic B.J. Jackson A. Salazar T.J. Woods A.R. Fout J. Am. Chem. Soc. 139 38 2017 13554 13561 K. Tokmic, B.J. Jackson, A. Salazar, T.J. Woods, A.R. Fout, J. Am. Chem. Soc. 139 (38) (2017) 13554–13561. [50] L. Yang Z.S. Jiang G.L. Fan F. Li Catal. Sci. Technol. 4 4 2014 1123 1131 L. Yang, Z.S. Jiang, G.L. Fan, F. Li, Catal. Sci. Technol. 4 (4) (2014) 1123–1131. [51] H.W. Wang Y. Lin J.L. Lu Catal. Today 410 2023 253 263 H.W. Wang, Y. Lin, J.L. Lu, Catal. Today 410 (2023) 253–263.",
      "scopus-id": "85149208513",
      "coredata": {
        "eid": "1-s2.0-S0926860X23000959",
        "dc:description": "Selective hydrogenation of nitriles is a feasible route to synthesize primary amines. While highly desirable, conducting the synthesis under mild conditions is challenging. We report non-precious zinc and aluminum oxides supported Ni catalysts (Ni/ZnAlOx) facilely prepared by calcination and reduction of NiZnAl layered double hydroxide (LDH) precursors. The optimized Ni/ZnAlOx-600 catalyst demonstrates great activity towards the selective hydrogenation of nitriles to primary amines. Proper-size metallic nickel provides the hydrogenation centers, and the presence of Ni-Zn alloys indicates strong metal-support interactions, which can produce electron-deficient nickel species and enhances the chemisorption of the CN bonds on the catalyst surface. The introduction of Zinc provides strong Lewis acid sites which also contribute to the catalytic activity. Based on the catalyst characterizations and control experiments, a plausible mechanism is proposed. This catalyst shows good stability and is conducive to the transformation of a variety of aromatic and aliphatic substrates, demonstrating potential application prospects.",
        "openArchiveArticle": "false",
        "prism:coverDate": "2023-04-05",
        "openaccessUserLicense": null,
        "prism:aggregationType": "Journal",
        "prism:url": "https://api.elsevier.com/content/article/pii/S0926860X23000959",
        "dc:creator": [
          {
            "@_fa": "true",
            "$": "Zhao, Huanyu"
          },
          {
            "@_fa": "true",
            "$": "He, Yurong"
          },
          {
            "@_fa": "true",
            "$": "Wang, Xiaochen"
          },
          {
            "@_fa": "true",
            "$": "He, Jie"
          },
          {
            "@_fa": "true",
            "$": "Liu, Anqiu"
          },
          {
            "@_fa": "true",
            "$": "Zhang, Zehui"
          }
        ],
        "link": [
          {
            "@_fa": "true",
            "@rel": "self",
            "@href": "https://api.elsevier.com/content/article/pii/S0926860X23000959"
          },
          {
            "@_fa": "true",
            "@rel": "scidir",
            "@href": "https://www.sciencedirect.com/science/article/pii/S0926860X23000959"
          }
        ],
        "dc:format": "application/json",
        "openaccessType": null,
        "pii": "S0926-860X(23)00095-9",
        "prism:volume": "655",
        "articleNumber": "119115",
        "prism:publisher": "Elsevier B.V.",
        "dc:title": "Room-temperature synthesis of primary amines by selective hydrogenation of nitriles over ZnAlOx supported Ni catalysts",
        "prism:copyright": "© 2023 Elsevier B.V. All rights reserved.",
        "openaccess": "0",
        "prism:issn": "0926860X",
        "dcterms:subject": [
          {
            "@_fa": "true",
            "$": "Primary amines"
          },
          {
            "@_fa": "true",
            "$": "Hydrogenation"
          },
          {
            "@_fa": "true",
            "$": "Non-precious catalysts"
          },
          {
            "@_fa": "true",
            "$": "Room temperature"
          },
          {
            "@_fa": "true",
            "$": "NiZnAl layered double hydroxide"
          }
        ],
        "openaccessArticle": "false",
        "prism:publicationName": "Applied Catalysis A: General",
        "openaccessSponsorType": null,
        "prism:pageRange": "119115",
        "pubType": "fla",
        "prism:coverDisplayDate": "5 April 2023",
        "prism:doi": "10.1016/j.apcata.2023.119115",
        "prism:startingPage": "119115",
        "dc:identifier": "doi:10.1016/j.apcata.2023.119115",
        "openaccessSponsorName": null
      },
      "objects": {
        "object": [
          {
            "@category": "standard",
            "@height": "422",
            "@width": "565",
            "@_fa": "true",
            "$": "https://api.elsevier.com/content/object/eid/1-s2.0-S0926860X23000959-gr9.jpg?httpAccept=%2A%2F%2A",
            "@multimediatype": "JPEG image file",
            "@type": "IMAGE-DOWNSAMPLED",
            "@size": "62966",
            "@ref": "gr9",
            "@mimetype": "image/jpeg"
          },
          {
            "@category": "standard",
            "@height": "226",
            "@width": "282",
            "@_fa": "true",
            "$": "https://api.elsevier.com/content/object/eid/1-s2.0-S0926860X23000959-gr2.jpg?httpAccept=%2A%2F%2A",
            "@multimediatype": "JPEG image file",
            "@type": "IMAGE-DOWNSAMPLED",
            "@size": "26492",
            "@ref": "gr2",
            "@mimetype": "image/jpeg"
          },
          {
            "@category": "standard",
            "@height": "167",
            "@width": "565",
            "@_fa": "true",
            "$": "https://api.elsevier.com/content/object/eid/1-s2.0-S0926860X23000959-gr1.jpg?httpAccept=%2A%2F%2A",
            "@multimediatype": "JPEG image file",
            "@type": "IMAGE-DOWNSAMPLED",
            "@size": "22798",
            "@ref": "gr1",
            "@mimetype": "image/jpeg"
          },
          {
            "@category": "standard",
            "@height": "458",
            "@width": "565",
            "@_fa": "true",
            "$": "https://api.elsevier.com/content/object/eid/1-s2.0-S0926860X23000959-gr4.jpg?httpAccept=%2A%2F%2A",
            "@multimediatype": "JPEG image file",
            "@type": "IMAGE-DOWNSAMPLED",
            "@size": "68089",
            "@ref": "gr4",
            "@mimetype": "image/jpeg"
          },
          {
            "@category": "standard",
            "@height": "562",
            "@width": "565",
            "@_fa": "true",
            "$": "https://api.elsevier.com/content/object/eid/1-s2.0-S0926860X23000959-gr3.jpg?httpAccept=%2A%2F%2A",
            "@multimediatype": "JPEG image file",
            "@type": "IMAGE-DOWNSAMPLED",
            "@size": "132515",
            "@ref": "gr3",
            "@mimetype": "image/jpeg"
          },
          {
            "@category": "standard",
            "@height": "205",
            "@width": "791",
            "@_fa": "true",
            "$": "https://api.elsevier.com/content/object/eid/1-s2.0-S0926860X23000959-gr6.jpg?httpAccept=%2A%2F%2A",
            "@multimediatype": "JPEG image file",
            "@type": "IMAGE-DOWNSAMPLED",
            "@size": "49864",
            "@ref": "gr6",
            "@mimetype": "image/jpeg"
          },
          {
            "@category": "standard",
            "@height": "218",
            "@width": "565",
            "@_fa": "true",
            "$": "https://api.elsevier.com/content/object/eid/1-s2.0-S0926860X23000959-gr5.jpg?httpAccept=%2A%2F%2A",
            "@multimediatype": "JPEG image file",
            "@type": "IMAGE-DOWNSAMPLED",
            "@size": "35232",
            "@ref": "gr5",
            "@mimetype": "image/jpeg"
          },
          {
            "@category": "standard",
            "@height": "224",
            "@width": "282",
            "@_fa": "true",
            "$": "https://api.elsevier.com/content/object/eid/1-s2.0-S0926860X23000959-gr8.jpg?httpAccept=%2A%2F%2A",
            "@multimediatype": "JPEG image file",
            "@type": "IMAGE-DOWNSAMPLED",
            "@size": "17833",
            "@ref": "gr8",
            "@mimetype": "image/jpeg"
          },
          {
            "@category": "standard",
            "@height": "277",
            "@width": "565",
            "@_fa": "true",
            "$": "https://api.elsevier.com/content/object/eid/1-s2.0-S0926860X23000959-gr7.jpg?httpAccept=%2A%2F%2A",
            "@multimediatype": "JPEG image file",
            "@type": "IMAGE-DOWNSAMPLED",
            "@size": "38778",
            "@ref": "gr7",
            "@mimetype": "image/jpeg"
          },
          {
            "@category": "standard",
            "@height": "57",
            "@width": "376",
            "@_fa": "true",
            "$": "https://api.elsevier.com/content/object/eid/1-s2.0-S0926860X23000959-fx1.jpg?httpAccept=%2A%2F%2A",
            "@multimediatype": "JPEG image file",
            "@type": "IMAGE-DOWNSAMPLED",
            "@size": "5745",
            "@ref": "fx1",
            "@mimetype": "image/jpeg"
          },
          {
            "@category": "standard",
            "@height": "696",
            "@width": "602",
            "@_fa": "true",
            "$": "https://api.elsevier.com/content/object/eid/1-s2.0-S0926860X23000959-fx3.jpg?httpAccept=%2A%2F%2A",
            "@multimediatype": "JPEG image file",
            "@type": "IMAGE-DOWNSAMPLED",
            "@size": "124106",
            "@ref": "fx3",
            "@mimetype": "image/jpeg"
          },
          {
            "@category": "standard",
            "@height": "301",
            "@width": "527",
            "@_fa": "true",
            "$": "https://api.elsevier.com/content/object/eid/1-s2.0-S0926860X23000959-sc1.jpg?httpAccept=%2A%2F%2A",
            "@multimediatype": "JPEG image file",
            "@type": "IMAGE-DOWNSAMPLED",
            "@size": "42971",
            "@ref": "sc1",
            "@mimetype": "image/jpeg"
          },
          {
            "@category": "standard",
            "@height": "57",
            "@width": "376",
            "@_fa": "true",
            "$": "https://api.elsevier.com/content/object/eid/1-s2.0-S0926860X23000959-fx2.jpg?httpAccept=%2A%2F%2A",
            "@multimediatype": "JPEG image file",
            "@type": "IMAGE-DOWNSAMPLED",
            "@size": "5739",
            "@ref": "fx2",
            "@mimetype": "image/jpeg"
          },
          {
            "@category": "standard",
            "@height": "223",
            "@width": "678",
            "@_fa": "true",
            "$": "https://api.elsevier.com/content/object/eid/1-s2.0-S0926860X23000959-sc3.jpg?httpAccept=%2A%2F%2A",
            "@multimediatype": "JPEG image file",
            "@type": "IMAGE-DOWNSAMPLED",
            "@size": "29218",
            "@ref": "sc3",
            "@mimetype": "image/jpeg"
          },
          {
            "@category": "standard",
            "@height": "154",
            "@width": "602",
            "@_fa": "true",
            "$": "https://api.elsevier.com/content/object/eid/1-s2.0-S0926860X23000959-sc2.jpg?httpAccept=%2A%2F%2A",
            "@multimediatype": "JPEG image file",
            "@type": "IMAGE-DOWNSAMPLED",
            "@size": "26082",
            "@ref": "sc2",
            "@mimetype": "image/jpeg"
          },
          {
            "@category": "standard",
            "@height": "200",
            "@width": "373",
            "@_fa": "true",
            "$": "https://api.elsevier.com/content/object/eid/1-s2.0-S0926860X23000959-ga1.jpg?httpAccept=%2A%2F%2A",
            "@multimediatype": "JPEG image file",
            "@type": "IMAGE-DOWNSAMPLED",
            "@size": "22067",
            "@ref": "ga1",
            "@mimetype": "image/jpeg"
          },
          {
            "@category": "thumbnail",
            "@height": "164",
            "@width": "219",
            "@_fa": "true",
            "$": "https://api.elsevier.com/content/object/eid/1-s2.0-S0926860X23000959-gr9.sml?httpAccept=%2A%2F%2A",
            "@multimediatype": "GIF image file",
            "@type": "IMAGE-THUMBNAIL",
            "@size": "13410",
            "@ref": "gr9",
            "@mimetype": "image/gif"
          },
          {
            "@category": "thumbnail",
            "@height": "164",
            "@width": "204",
            "@_fa": "true",
            "$": "https://api.elsevier.com/content/object/eid/1-s2.0-S0926860X23000959-gr2.sml?httpAccept=%2A%2F%2A",
            "@multimediatype": "GIF image file",
            "@type": "IMAGE-THUMBNAIL",
            "@size": "12359",
            "@ref": "gr2",
            "@mimetype": "image/gif"
          },
          {
            "@category": "thumbnail",
            "@height": "65",
            "@width": "219",
            "@_fa": "true",
            "$": "https://api.elsevier.com/content/object/eid/1-s2.0-S0926860X23000959-gr1.sml?httpAccept=%2A%2F%2A",
            "@multimediatype": "GIF image file",
            "@type": "IMAGE-THUMBNAIL",
            "@size": "6367",
            "@ref": "gr1",
            "@mimetype": "image/gif"
          },
          {
            "@category": "thumbnail",
            "@height": "164",
            "@width": "202",
            "@_fa": "true",
            "$": "https://api.elsevier.com/content/object/eid/1-s2.0-S0926860X23000959-gr4.sml?httpAccept=%2A%2F%2A",
            "@multimediatype": "GIF image file",
            "@type": "IMAGE-THUMBNAIL",
            "@size": "11731",
            "@ref": "gr4",
            "@mimetype": "image/gif"
          },
          {
            "@category": "thumbnail",
            "@height": "164",
            "@width": "165",
            "@_fa": "true",
            "$": "https://api.elsevier.com/content/object/eid/1-s2.0-S0926860X23000959-gr3.sml?httpAccept=%2A%2F%2A",
            "@multimediatype": "GIF image file",
            "@type": "IMAGE-THUMBNAIL",
            "@size": "22018",
            "@ref": "gr3",
            "@mimetype": "image/gif"
          },
          {
            "@category": "thumbnail",
            "@height": "57",
            "@width": "219",
            "@_fa": "true",
            "$": "https://api.elsevier.com/content/object/eid/1-s2.0-S0926860X23000959-gr6.sml?httpAccept=%2A%2F%2A",
            "@multimediatype": "GIF image file",
            "@type": "IMAGE-THUMBNAIL",
            "@size": "5426",
            "@ref": "gr6",
            "@mimetype": "image/gif"
          },
          {
            "@category": "thumbnail",
            "@height": "84",
            "@width": "219",
            "@_fa": "true",
            "$": "https://api.elsevier.com/content/object/eid/1-s2.0-S0926860X23000959-gr5.sml?httpAccept=%2A%2F%2A",
            "@multimediatype": "GIF image file",
            "@type": "IMAGE-THUMBNAIL",
            "@size": "6510",
            "@ref": "gr5",
            "@mimetype": "image/gif"
          },
          {
            "@category": "thumbnail",
            "@height": "164",
            "@width": "207",
            "@_fa": "true",
            "$": "https://api.elsevier.com/content/object/eid/1-s2.0-S0926860X23000959-gr8.sml?httpAccept=%2A%2F%2A",
            "@multimediatype": "GIF image file",
            "@type": "IMAGE-THUMBNAIL",
            "@size": "7920",
            "@ref": "gr8",
            "@mimetype": "image/gif"
          },
          {
            "@category": "thumbnail",
            "@height": "107",
            "@width": "219",
            "@_fa": "true",
            "$": "https://api.elsevier.com/content/object/eid/1-s2.0-S0926860X23000959-gr7.sml?httpAccept=%2A%2F%2A",
            "@multimediatype": "GIF image file",
            "@type": "IMAGE-THUMBNAIL",
            "@size": "8081",
            "@ref": "gr7",
            "@mimetype": "image/gif"
          },
          {
            "@category": "thumbnail",
            "@height": "33",
            "@width": "219",
            "@_fa": "true",
            "$": "https://api.elsevier.com/content/object/eid/1-s2.0-S0926860X23000959-fx1.sml?httpAccept=%2A%2F%2A",
            "@multimediatype": "GIF image file",
            "@type": "IMAGE-THUMBNAIL",
            "@size": "2412",
            "@ref": "fx1",
            "@mimetype": "image/gif"
          },
          {
            "@category": "thumbnail",
            "@height": "164",
            "@width": "142",
            "@_fa": "true",
            "$": "https://api.elsevier.com/content/object/eid/1-s2.0-S0926860X23000959-fx3.sml?httpAccept=%2A%2F%2A",
            "@multimediatype": "GIF image file",
            "@type": "IMAGE-THUMBNAIL",
            "@size": "6560",
            "@ref": "fx3",
            "@mimetype": "image/gif"
          },
          {
            "@category": "thumbnail",
            "@height": "125",
            "@width": "219",
            "@_fa": "true",
            "$": "https://api.elsevier.com/content/object/eid/1-s2.0-S0926860X23000959-sc1.sml?httpAccept=%2A%2F%2A",
            "@multimediatype": "GIF image file",
            "@type": "IMAGE-THUMBNAIL",
            "@size": "9723",
            "@ref": "sc1",
            "@mimetype": "image/gif"
          },
          {
            "@category": "thumbnail",
            "@height": "33",
            "@width": "219",
            "@_fa": "true",
            "$": "https://api.elsevier.com/content/object/eid/1-s2.0-S0926860X23000959-fx2.sml?httpAccept=%2A%2F%2A",
            "@multimediatype": "GIF image file",
            "@type": "IMAGE-THUMBNAIL",
            "@size": "2427",
            "@ref": "fx2",
            "@mimetype": "image/gif"
          },
          {
            "@category": "thumbnail",
            "@height": "72",
            "@width": "219",
            "@_fa": "true",
            "$": "https://api.elsevier.com/content/object/eid/1-s2.0-S0926860X23000959-sc3.sml?httpAccept=%2A%2F%2A",
            "@multimediatype": "GIF image file",
            "@type": "IMAGE-THUMBNAIL",
            "@size": "4408",
            "@ref": "sc3",
            "@mimetype": "image/gif"
          },
          {
            "@category": "thumbnail",
            "@height": "56",
            "@width": "219",
            "@_fa": "true",
            "$": "https://api.elsevier.com/content/object/eid/1-s2.0-S0926860X23000959-sc2.sml?httpAccept=%2A%2F%2A",
            "@multimediatype": "GIF image file",
            "@type": "IMAGE-THUMBNAIL",
            "@size": "3898",
            "@ref": "sc2",
            "@mimetype": "image/gif"
          },
          {
            "@category": "thumbnail",
            "@height": "117",
            "@width": "219",
            "@_fa": "true",
            "$": "https://api.elsevier.com/content/object/eid/1-s2.0-S0926860X23000959-ga1.sml?httpAccept=%2A%2F%2A",
            "@multimediatype": "GIF image file",
            "@type": "IMAGE-THUMBNAIL",
            "@size": "15492",
            "@ref": "ga1",
            "@mimetype": "image/gif"
          },
          {
            "@category": "high",
            "@height": "1864",
            "@width": "2495",
            "@_fa": "true",
            "$": "https://api.elsevier.com/content/object/eid/1-s2.0-S0926860X23000959-gr9_lrg.jpg?httpAccept=%2A%2F%2A",
            "@multimediatype": "JPEG image file",
            "@type": "IMAGE-HIGH-RES",
            "@size": "406126",
            "@ref": "gr9",
            "@mimetype": "image/jpeg"
          },
          {
            "@category": "high",
            "@height": "1001",
            "@width": "1247",
            "@_fa": "true",
            "$": "https://api.elsevier.com/content/object/eid/1-s2.0-S0926860X23000959-gr2_lrg.jpg?httpAccept=%2A%2F%2A",
            "@multimediatype": "JPEG image file",
            "@type": "IMAGE-HIGH-RES",
            "@size": "178654",
            "@ref": "gr2",
            "@mimetype": "image/jpeg"
          },
          {
            "@category": "high",
            "@height": "736",
            "@width": "2495",
            "@_fa": "true",
            "$": "https://api.elsevier.com/content/object/eid/1-s2.0-S0926860X23000959-gr1_lrg.jpg?httpAccept=%2A%2F%2A",
            "@multimediatype": "JPEG image file",
            "@type": "IMAGE-HIGH-RES",
            "@size": "99866",
            "@ref": "gr1",
            "@mimetype": "image/jpeg"
          },
          {
            "@category": "high",
            "@height": "2023",
            "@width": "2495",
            "@_fa": "true",
            "$": "https://api.elsevier.com/content/object/eid/1-s2.0-S0926860X23000959-gr4_lrg.jpg?httpAccept=%2A%2F%2A",
            "@multimediatype": "JPEG image file",
            "@type": "IMAGE-HIGH-RES",
            "@size": "459066",
            "@ref": "gr4",
            "@mimetype": "image/jpeg"
          },
          {
            "@category": "high",
            "@height": "2480",
            "@width": "2495",
            "@_fa": "true",
            "$": "https://api.elsevier.com/content/object/eid/1-s2.0-S0926860X23000959-gr3_lrg.jpg?httpAccept=%2A%2F%2A",
            "@multimediatype": "JPEG image file",
            "@type": "IMAGE-HIGH-RES",
            "@size": "684861",
            "@ref": "gr3",
            "@mimetype": "image/jpeg"
          },
          {
            "@category": "high",
            "@height": "907",
            "@width": "3493",
            "@_fa": "true",
            "$": "https://api.elsevier.com/content/object/eid/1-s2.0-S0926860X23000959-gr6_lrg.jpg?httpAccept=%2A%2F%2A",
            "@multimediatype": "JPEG image file",
            "@type": "IMAGE-HIGH-RES",
            "@size": "315472",
            "@ref": "gr6",
            "@mimetype": "image/jpeg"
          },
          {
            "@category": "high",
            "@height": "962",
            "@width": "2495",
            "@_fa": "true",
            "$": "https://api.elsevier.com/content/object/eid/1-s2.0-S0926860X23000959-gr5_lrg.jpg?httpAccept=%2A%2F%2A",
            "@multimediatype": "JPEG image file",
            "@type": "IMAGE-HIGH-RES",
            "@size": "191012",
            "@ref": "gr5",
            "@mimetype": "image/jpeg"
          },
          {
            "@category": "high",
            "@height": "989",
            "@width": "1247",
            "@_fa": "true",
            "$": "https://api.elsevier.com/content/object/eid/1-s2.0-S0926860X23000959-gr8_lrg.jpg?httpAccept=%2A%2F%2A",
            "@multimediatype": "JPEG image file",
            "@type": "IMAGE-HIGH-RES",
            "@size": "110100",
            "@ref": "gr8",
            "@mimetype": "image/jpeg"
          },
          {
            "@category": "high",
            "@height": "1224",
            "@width": "2495",
            "@_fa": "true",
            "$": "https://api.elsevier.com/content/object/eid/1-s2.0-S0926860X23000959-gr7_lrg.jpg?httpAccept=%2A%2F%2A",
            "@multimediatype": "JPEG image file",
            "@type": "IMAGE-HIGH-RES",
            "@size": "231934",
            "@ref": "gr7",
            "@mimetype": "image/jpeg"
          },
          {
            "@category": "high",
            "@height": "254",
            "@width": "1663",
            "@_fa": "true",
            "$": "https://api.elsevier.com/content/object/eid/1-s2.0-S0926860X23000959-fx1_lrg.jpg?httpAccept=%2A%2F%2A",
            "@multimediatype": "JPEG image file",
            "@type": "IMAGE-HIGH-RES",
            "@size": "34025",
            "@ref": "fx1",
            "@mimetype": "image/jpeg"
          },
          {
            "@category": "high",
            "@height": "3082",
            "@width": "2665",
            "@_fa": "true",
            "$": "https://api.elsevier.com/content/object/eid/1-s2.0-S0926860X23000959-fx3_lrg.jpg?httpAccept=%2A%2F%2A",
            "@multimediatype": "JPEG image file",
            "@type": "IMAGE-HIGH-RES",
            "@size": "808546",
            "@ref": "fx3",
            "@mimetype": "image/jpeg"
          },
          {
            "@category": "high",
            "@height": "1331",
            "@width": "2328",
            "@_fa": "true",
            "$": "https://api.elsevier.com/content/object/eid/1-s2.0-S0926860X23000959-sc1_lrg.jpg?httpAccept=%2A%2F%2A",
            "@multimediatype": "JPEG image file",
            "@type": "IMAGE-HIGH-RES",
            "@size": "259900",
            "@ref": "sc1",
            "@mimetype": "image/jpeg"
          },
          {
            "@category": "high",
            "@height": "254",
            "@width": "1663",
            "@_fa": "true",
            "$": "https://api.elsevier.com/content/object/eid/1-s2.0-S0926860X23000959-fx2_lrg.jpg?httpAccept=%2A%2F%2A",
            "@multimediatype": "JPEG image file",
            "@type": "IMAGE-HIGH-RES",
            "@size": "34018",
            "@ref": "fx2",
            "@mimetype": "image/jpeg"
          },
          {
            "@category": "high",
            "@height": "984",
            "@width": "2994",
            "@_fa": "true",
            "$": "https://api.elsevier.com/content/object/eid/1-s2.0-S0926860X23000959-sc3_lrg.jpg?httpAccept=%2A%2F%2A",
            "@multimediatype": "JPEG image file",
            "@type": "IMAGE-HIGH-RES",
            "@size": "187059",
            "@ref": "sc3",
            "@mimetype": "image/jpeg"
          },
          {
            "@category": "high",
            "@height": "679",
            "@width": "2661",
            "@_fa": "true",
            "$": "https://api.elsevier.com/content/object/eid/1-s2.0-S0926860X23000959-sc2_lrg.jpg?httpAccept=%2A%2F%2A",
            "@multimediatype": "JPEG image file",
            "@type": "IMAGE-HIGH-RES",
            "@size": "160622",
            "@ref": "sc2",
            "@mimetype": "image/jpeg"
          },
          {
            "@category": "high",
            "@height": "886",
            "@width": "1653",
            "@_fa": "true",
            "$": "https://api.elsevier.com/content/object/eid/1-s2.0-S0926860X23000959-ga1_lrg.jpg?httpAccept=%2A%2F%2A",
            "@multimediatype": "JPEG image file",
            "@type": "IMAGE-HIGH-RES",
            "@size": "164255",
            "@ref": "ga1",
            "@mimetype": "image/jpeg"
          },
          {
            "@category": "standard",
            "@_fa": "true",
            "$": "https://api.elsevier.com/content/object/eid/1-s2.0-S0926860X23000959-mmc1.docx?httpAccept=%2A%2F%2A",
            "@multimediatype": "Microsoft Word file",
            "@type": "APPLICATION",
            "@size": "6262117",
            "@ref": "mmc1",
            "@mimetype": "application/word"
          },
          {
            "@category": "standard",
            "@_fa": "true",
            "$": "https://api.elsevier.com/content/object/eid/1-s2.0-S0926860X23000959-am.pdf?httpAccept=%2A%2F%2A",
            "@multimediatype": "Acrobat PDF file",
            "@type": "AAM-PDF",
            "@size": "995643",
            "@ref": "am",
            "@mimetype": "application/pdf"
          }
        ]
      },
      "link": {
        "@rel": "abstract",
        "@href": "https://api.elsevier.com/content/abstract/scopus_id/85149208513"
      }
    }
  }
}