{
  "metadata": {
    "title": "Isomerization/hydroformylation tandem reaction of a decene isomeric mixture with subsequent catalyst recycling in thermomorphic solvent systems",
    "authors": "; ; ",
    "journal": "Applied Catalysis A: General",
    "date": "2017-02-25",
    "doi": "10.1016/j.apcata.2016.12.011",
    "abstract": "",
    "uri": "https://api.elsevier.com/content/article/pii/S0926860X16306056",
    "pii": "S0926860X16306056"
  },
  "fulltext": {
    "full-text-retrieval-response": {
      "scopus-eid": "2-s2.0-85006927604",
      "originalText": "serial JL 271346 291210 291744 291809 31 Applied Catalysis A: General APPLIEDCATALYSISAGENERAL 2016-12-14 2016-12-14 2016-12-25 2016-12-25 2017-12-05T21:02:29 1-s2.0-S0926860X16306056 S0926-860X(16)30605-6 S0926860X16306056 10.1016/j.apcata.2016.12.011 S300 S300.2 FULL-TEXT 1-s2.0-S0926860X16X00208 2024-01-01T12:31:47.592716Z 0 0 20170225 2017 2016-12-14T16:37:25.199427Z absattachment articleinfo articletitlenorm authfirstinitialnorm authfirstsurnamenorm cid cids contenttype copyright crossmark dateloaded dateloadedtxt datesearch datesort dateupdated dco docsubtype doctype doi eid ewtransactionid hubeid indexeddate issn issnnorm itemstage itemtransactionid itemweight openaccess openarchive pg pgfirst pglast pii piinorm pubdatestart pubdatetxt pubyr sortorder srctitle srctitlenorm srctype ssids alllist content subj subheadings suppl tomb volfirst volissue volumelist webpdf webpdfpagecount yearnav figure table body acknowledge affil articletitle auth authfirstini authfull authkeywords authlast grantsponsor highlightsabst otherkwds primabst pubtype ref specialabst 0926-860X 0926860X true 532 532 C Volume 532 9 50 56 50 56 20170225 25 February 2017 2017-02-25 2017 article fla © 2016 Elsevier B.V. All rights reserved. ISOMERIZATIONHYDROFORMYLATIONTANDEMREACTIONADECENEISOMERICMIXTURESUBSEQUENTCATALYSTRECYCLINGINTHERMOMORPHICSOLVENTSYSTEMS GAIDE T 1 Introduction 2 Materials and methods 2.1 Chemicals 2.2 Reaction in a 20mL autoclave 2.3 Reaction in a 300mL autoclave 2.4 Recycling experiments 2.5 Gas chromatography – flame ionization detector (GC–FID) measurements 2.6 Inductive coupled plasma optical emission spectrometry (ICP–OES) measurements 3 Results and discussion 3.1 Reaction optimization 3.2 Design of the TMS system 3.3 Catalyst recycling 4 Conclusion Acknowledgments References VILCHESHERRERA 2014 1706 1724 M KLEIN 2001 3408 3411 H VANDERVEENLARS 1999 336 338 A ZUIDEMA 2010 1210 1221 E BILLIG 1987 E VOGL 2005 41 44 C BEHR 2005 215 219 A BEHR 2004 904 910 A BEHR 2005 645 A PIRAS 2010 479 486 I SELENT 2001 1696 1698 D SELENT 2000 1639 1641 D CHRISTIANSEN 2016 A KLEIN 2005 2283 H BELLER 1999 31 39 M KANT 2006 913 921 M KOKKINOS 2013 275 283 N BRONGER 2004 1590 R BEHR 2008 20 28 A BEHR 2006 1485 1495 A GAIDE 2016 197 204 T HUBNER 2016 3 25 S YANG 2007 288 292 Y SCHAFER 2012 10296 10306 E BRUNSCH 2013 1586 1589 Y BEHR 2014 1535 1536 A JORKE 2015 513 523 A JORKE 2016 A MCBRIDE 2016 97 106 K GAIDEX2017X50 GAIDEX2017X50X56 GAIDEX2017X50XT GAIDEX2017X50X56XT 2018-12-25T00:00:00.000Z UnderEmbargo http://creativecommons.org/licenses/by-nc-nd/4.0/ © 2016 Elsevier B.V. All rights reserved. item S0926-860X(16)30605-6 S0926860X16306056 1-s2.0-S0926860X16306056 10.1016/j.apcata.2016.12.011 271346 2024-01-01T12:31:47.592716Z 2017-02-25 1-s2.0-S0926860X16306056-main.pdf https://s3-eu-west-1.amazonaws.com/prod-ucs-content-store-eu-west/content/pii:S0926860X16306056/MAIN/application/pdf/98ef36e686b1a295de82e75a6f126ef6/main.pdf https://s3.amazonaws.com/prod-ucs-content-store-us-east/content/pii:S0926860X16306056/MAIN/application/pdf/98ef36e686b1a295de82e75a6f126ef6/main.pdf main.pdf pdf true 1025826 MAIN 7 1-s2.0-S0926860X16306056-main_1.png https://s3-eu-west-1.amazonaws.com/prod-ucs-content-store-eu-west/content/pii:S0926860X16306056/PREVIEW/image/png/e11a4284fb7a702a671b116d9a038cbb/main_1.png https://s3.amazonaws.com/prod-ucs-content-store-us-east/content/pii:S0926860X16306056/PREVIEW/image/png/e11a4284fb7a702a671b116d9a038cbb/main_1.png main_1.png png 55428 849 656 IMAGE-WEB-PDF 1 1-s2.0-S0926860X16306056-fx1.sml https://s3-eu-west-1.amazonaws.com/prod-ucs-content-store-eu-west/content/pii:S0926860X16306056/fx1/THUMBNAIL/image/gif/48bc21d3a6d5eb65f19fe78c238b6fe7/fx1.sml https://s3.amazonaws.com/prod-ucs-content-store-us-east/content/pii:S0926860X16306056/fx1/THUMBNAIL/image/gif/48bc21d3a6d5eb65f19fe78c238b6fe7/fx1.sml fx1 true fx1.sml sml 6107 88 219 IMAGE-THUMBNAIL 1-s2.0-S0926860X16306056-gr1.sml https://s3-eu-west-1.amazonaws.com/prod-ucs-content-store-eu-west/content/pii:S0926860X16306056/gr1/THUMBNAIL/image/gif/80488fb777ac79f4763b74354cc3e414/gr1.sml https://s3.amazonaws.com/prod-ucs-content-store-us-east/content/pii:S0926860X16306056/gr1/THUMBNAIL/image/gif/80488fb777ac79f4763b74354cc3e414/gr1.sml gr1 gr1.sml sml 2951 75 219 IMAGE-THUMBNAIL 1-s2.0-S0926860X16306056-gr2.sml https://s3-eu-west-1.amazonaws.com/prod-ucs-content-store-eu-west/content/pii:S0926860X16306056/gr2/THUMBNAIL/image/gif/5a97045fc9b22aa9ddcdf5f0b5f9ab26/gr2.sml https://s3.amazonaws.com/prod-ucs-content-store-us-east/content/pii:S0926860X16306056/gr2/THUMBNAIL/image/gif/5a97045fc9b22aa9ddcdf5f0b5f9ab26/gr2.sml gr2 gr2.sml sml 3781 72 219 IMAGE-THUMBNAIL 1-s2.0-S0926860X16306056-gr3.sml https://s3-eu-west-1.amazonaws.com/prod-ucs-content-store-eu-west/content/pii:S0926860X16306056/gr3/THUMBNAIL/image/gif/afbdf700f0c9bb134fb8e5d6562dd03a/gr3.sml https://s3.amazonaws.com/prod-ucs-content-store-us-east/content/pii:S0926860X16306056/gr3/THUMBNAIL/image/gif/afbdf700f0c9bb134fb8e5d6562dd03a/gr3.sml gr3 gr3.sml sml 5725 161 219 IMAGE-THUMBNAIL 1-s2.0-S0926860X16306056-gr4.sml https://s3-eu-west-1.amazonaws.com/prod-ucs-content-store-eu-west/content/pii:S0926860X16306056/gr4/THUMBNAIL/image/gif/70c9bceac8ec6df09fa48aaa75884fbb/gr4.sml https://s3.amazonaws.com/prod-ucs-content-store-us-east/content/pii:S0926860X16306056/gr4/THUMBNAIL/image/gif/70c9bceac8ec6df09fa48aaa75884fbb/gr4.sml gr4 gr4.sml sml 4400 164 173 IMAGE-THUMBNAIL 1-s2.0-S0926860X16306056-gr5.sml https://s3-eu-west-1.amazonaws.com/prod-ucs-content-store-eu-west/content/pii:S0926860X16306056/gr5/THUMBNAIL/image/gif/052ae6cf4605278292a850797c8a16c4/gr5.sml https://s3.amazonaws.com/prod-ucs-content-store-us-east/content/pii:S0926860X16306056/gr5/THUMBNAIL/image/gif/052ae6cf4605278292a850797c8a16c4/gr5.sml gr5 gr5.sml sml 3368 105 219 IMAGE-THUMBNAIL 1-s2.0-S0926860X16306056-gr6.sml https://s3-eu-west-1.amazonaws.com/prod-ucs-content-store-eu-west/content/pii:S0926860X16306056/gr6/THUMBNAIL/image/gif/447df06e94f4730b3d2f6cdec5f0e525/gr6.sml https://s3.amazonaws.com/prod-ucs-content-store-us-east/content/pii:S0926860X16306056/gr6/THUMBNAIL/image/gif/447df06e94f4730b3d2f6cdec5f0e525/gr6.sml gr6 gr6.sml sml 4252 115 219 IMAGE-THUMBNAIL 1-s2.0-S0926860X16306056-gr7.sml https://s3-eu-west-1.amazonaws.com/prod-ucs-content-store-eu-west/content/pii:S0926860X16306056/gr7/THUMBNAIL/image/gif/a961fde3dd27ac8a16f251e7275cdf2b/gr7.sml https://s3.amazonaws.com/prod-ucs-content-store-us-east/content/pii:S0926860X16306056/gr7/THUMBNAIL/image/gif/a961fde3dd27ac8a16f251e7275cdf2b/gr7.sml gr7 gr7.sml sml 4433 104 219 IMAGE-THUMBNAIL 1-s2.0-S0926860X16306056-gr8.sml https://s3-eu-west-1.amazonaws.com/prod-ucs-content-store-eu-west/content/pii:S0926860X16306056/gr8/THUMBNAIL/image/gif/aac2d7e31de78cb8db3ef9441258e3af/gr8.sml https://s3.amazonaws.com/prod-ucs-content-store-us-east/content/pii:S0926860X16306056/gr8/THUMBNAIL/image/gif/aac2d7e31de78cb8db3ef9441258e3af/gr8.sml gr8 gr8.sml sml 3810 105 219 IMAGE-THUMBNAIL 1-s2.0-S0926860X16306056-gr9.sml https://s3-eu-west-1.amazonaws.com/prod-ucs-content-store-eu-west/content/pii:S0926860X16306056/gr9/THUMBNAIL/image/gif/f4380209497aff2f6afd85f4069ea3ce/gr9.sml https://s3.amazonaws.com/prod-ucs-content-store-us-east/content/pii:S0926860X16306056/gr9/THUMBNAIL/image/gif/f4380209497aff2f6afd85f4069ea3ce/gr9.sml gr9 gr9.sml sml 4142 83 219 IMAGE-THUMBNAIL 1-s2.0-S0926860X16306056-fx1.jpg https://s3-eu-west-1.amazonaws.com/prod-ucs-content-store-eu-west/content/pii:S0926860X16306056/fx1/DOWNSAMPLED/image/jpeg/b8ee2d39af55a711937b53e730d9c83d/fx1.jpg https://s3.amazonaws.com/prod-ucs-content-store-us-east/content/pii:S0926860X16306056/fx1/DOWNSAMPLED/image/jpeg/b8ee2d39af55a711937b53e730d9c83d/fx1.jpg fx1 true fx1.jpg jpg 11506 200 500 IMAGE-DOWNSAMPLED 1-s2.0-S0926860X16306056-gr1.jpg https://s3-eu-west-1.amazonaws.com/prod-ucs-content-store-eu-west/content/pii:S0926860X16306056/gr1/DOWNSAMPLED/image/jpeg/1f24c4f284aab94db36ec8db86133aee/gr1.jpg https://s3.amazonaws.com/prod-ucs-content-store-us-east/content/pii:S0926860X16306056/gr1/DOWNSAMPLED/image/jpeg/1f24c4f284aab94db36ec8db86133aee/gr1.jpg gr1 gr1.jpg jpg 13751 168 489 IMAGE-DOWNSAMPLED 1-s2.0-S0926860X16306056-gr2.jpg https://s3-eu-west-1.amazonaws.com/prod-ucs-content-store-eu-west/content/pii:S0926860X16306056/gr2/DOWNSAMPLED/image/jpeg/431e12a18dd557f5408ad45d1538f0c2/gr2.jpg https://s3.amazonaws.com/prod-ucs-content-store-us-east/content/pii:S0926860X16306056/gr2/DOWNSAMPLED/image/jpeg/431e12a18dd557f5408ad45d1538f0c2/gr2.jpg gr2 gr2.jpg jpg 27454 224 678 IMAGE-DOWNSAMPLED 1-s2.0-S0926860X16306056-gr3.jpg https://s3-eu-west-1.amazonaws.com/prod-ucs-content-store-eu-west/content/pii:S0926860X16306056/gr3/DOWNSAMPLED/image/jpeg/157ee86b0a2ee4f656cbc7f5a44c2b28/gr3.jpg https://s3.amazonaws.com/prod-ucs-content-store-us-east/content/pii:S0926860X16306056/gr3/DOWNSAMPLED/image/jpeg/157ee86b0a2ee4f656cbc7f5a44c2b28/gr3.jpg gr3 gr3.jpg jpg 33070 416 565 IMAGE-DOWNSAMPLED 1-s2.0-S0926860X16306056-gr4.jpg https://s3-eu-west-1.amazonaws.com/prod-ucs-content-store-eu-west/content/pii:S0926860X16306056/gr4/DOWNSAMPLED/image/jpeg/54f0626743a9feb00b221830b7454098/gr4.jpg https://s3.amazonaws.com/prod-ucs-content-store-us-east/content/pii:S0926860X16306056/gr4/DOWNSAMPLED/image/jpeg/54f0626743a9feb00b221830b7454098/gr4.jpg gr4 gr4.jpg jpg 41128 535 565 IMAGE-DOWNSAMPLED 1-s2.0-S0926860X16306056-gr5.jpg https://s3-eu-west-1.amazonaws.com/prod-ucs-content-store-eu-west/content/pii:S0926860X16306056/gr5/DOWNSAMPLED/image/jpeg/63941c9a0730e1ee167405b108080437/gr5.jpg https://s3.amazonaws.com/prod-ucs-content-store-us-east/content/pii:S0926860X16306056/gr5/DOWNSAMPLED/image/jpeg/63941c9a0730e1ee167405b108080437/gr5.jpg gr5 gr5.jpg jpg 9783 181 376 IMAGE-DOWNSAMPLED 1-s2.0-S0926860X16306056-gr6.jpg https://s3-eu-west-1.amazonaws.com/prod-ucs-content-store-eu-west/content/pii:S0926860X16306056/gr6/DOWNSAMPLED/image/jpeg/3e7c1715f3d64dc7a753325f769f758e/gr6.jpg https://s3.amazonaws.com/prod-ucs-content-store-us-east/content/pii:S0926860X16306056/gr6/DOWNSAMPLED/image/jpeg/3e7c1715f3d64dc7a753325f769f758e/gr6.jpg gr6 gr6.jpg jpg 12793 197 376 IMAGE-DOWNSAMPLED 1-s2.0-S0926860X16306056-gr7.jpg https://s3-eu-west-1.amazonaws.com/prod-ucs-content-store-eu-west/content/pii:S0926860X16306056/gr7/DOWNSAMPLED/image/jpeg/92fd83111dcb7ac01387196ea9351c74/gr7.jpg https://s3.amazonaws.com/prod-ucs-content-store-us-east/content/pii:S0926860X16306056/gr7/DOWNSAMPLED/image/jpeg/92fd83111dcb7ac01387196ea9351c74/gr7.jpg gr7 gr7.jpg jpg 12515 179 376 IMAGE-DOWNSAMPLED 1-s2.0-S0926860X16306056-gr8.jpg https://s3-eu-west-1.amazonaws.com/prod-ucs-content-store-eu-west/content/pii:S0926860X16306056/gr8/DOWNSAMPLED/image/jpeg/786c668ddaaaddd03e3bfdc4f5d1307a/gr8.jpg https://s3.amazonaws.com/prod-ucs-content-store-us-east/content/pii:S0926860X16306056/gr8/DOWNSAMPLED/image/jpeg/786c668ddaaaddd03e3bfdc4f5d1307a/gr8.jpg gr8 gr8.jpg jpg 20551 272 565 IMAGE-DOWNSAMPLED 1-s2.0-S0926860X16306056-gr9.jpg https://s3-eu-west-1.amazonaws.com/prod-ucs-content-store-eu-west/content/pii:S0926860X16306056/gr9/DOWNSAMPLED/image/jpeg/8e9b87683e6e07f653c0e72df56a8de4/gr9.jpg https://s3.amazonaws.com/prod-ucs-content-store-us-east/content/pii:S0926860X16306056/gr9/DOWNSAMPLED/image/jpeg/8e9b87683e6e07f653c0e72df56a8de4/gr9.jpg gr9 gr9.jpg jpg 22820 275 728 IMAGE-DOWNSAMPLED 1-s2.0-S0926860X16306056-fx1_lrg.jpg https://s3-eu-west-1.amazonaws.com/prod-ucs-content-store-eu-west/content/pii:S0926860X16306056/fx1/HIGHRES/image/jpeg/54e7da878570fcf05bfc5eb741c81225/fx1_lrg.jpg https://s3.amazonaws.com/prod-ucs-content-store-us-east/content/pii:S0926860X16306056/fx1/HIGHRES/image/jpeg/54e7da878570fcf05bfc5eb741c81225/fx1_lrg.jpg fx1 true fx1_lrg.jpg jpg 102792 886 2213 IMAGE-HIGH-RES 1-s2.0-S0926860X16306056-gr1_lrg.jpg https://s3-eu-west-1.amazonaws.com/prod-ucs-content-store-eu-west/content/pii:S0926860X16306056/gr1/HIGHRES/image/jpeg/351ff4a5ecad0a4e9cd7bdc789296ae4/gr1_lrg.jpg https://s3.amazonaws.com/prod-ucs-content-store-us-east/content/pii:S0926860X16306056/gr1/HIGHRES/image/jpeg/351ff4a5ecad0a4e9cd7bdc789296ae4/gr1_lrg.jpg gr1 gr1_lrg.jpg jpg 95791 743 2167 IMAGE-HIGH-RES 1-s2.0-S0926860X16306056-gr2_lrg.jpg https://s3-eu-west-1.amazonaws.com/prod-ucs-content-store-eu-west/content/pii:S0926860X16306056/gr2/HIGHRES/image/jpeg/ea56e1b511241aec9b4ffebaea1beaee/gr2_lrg.jpg https://s3.amazonaws.com/prod-ucs-content-store-us-east/content/pii:S0926860X16306056/gr2/HIGHRES/image/jpeg/ea56e1b511241aec9b4ffebaea1beaee/gr2_lrg.jpg gr2 gr2_lrg.jpg jpg 193871 993 3000 IMAGE-HIGH-RES 1-s2.0-S0926860X16306056-gr3_lrg.jpg https://s3-eu-west-1.amazonaws.com/prod-ucs-content-store-eu-west/content/pii:S0926860X16306056/gr3/HIGHRES/image/jpeg/a67a3bc2ab9b8e8d5bd128b2453e26fc/gr3_lrg.jpg https://s3.amazonaws.com/prod-ucs-content-store-us-east/content/pii:S0926860X16306056/gr3/HIGHRES/image/jpeg/a67a3bc2ab9b8e8d5bd128b2453e26fc/gr3_lrg.jpg gr3 gr3_lrg.jpg jpg 258547 1840 2500 IMAGE-HIGH-RES 1-s2.0-S0926860X16306056-gr4_lrg.jpg https://s3-eu-west-1.amazonaws.com/prod-ucs-content-store-eu-west/content/pii:S0926860X16306056/gr4/HIGHRES/image/jpeg/562797f7726e0bcc8a60ea99a326f201/gr4_lrg.jpg https://s3.amazonaws.com/prod-ucs-content-store-us-east/content/pii:S0926860X16306056/gr4/HIGHRES/image/jpeg/562797f7726e0bcc8a60ea99a326f201/gr4_lrg.jpg gr4 gr4_lrg.jpg jpg 311509 2368 2500 IMAGE-HIGH-RES 1-s2.0-S0926860X16306056-gr5_lrg.jpg https://s3-eu-west-1.amazonaws.com/prod-ucs-content-store-eu-west/content/pii:S0926860X16306056/gr5/HIGHRES/image/jpeg/5d34e4dce41d44549850e6a550610ea4/gr5_lrg.jpg https://s3.amazonaws.com/prod-ucs-content-store-us-east/content/pii:S0926860X16306056/gr5/HIGHRES/image/jpeg/5d34e4dce41d44549850e6a550610ea4/gr5_lrg.jpg gr5 gr5_lrg.jpg jpg 67107 803 1667 IMAGE-HIGH-RES 1-s2.0-S0926860X16306056-gr6_lrg.jpg https://s3-eu-west-1.amazonaws.com/prod-ucs-content-store-eu-west/content/pii:S0926860X16306056/gr6/HIGHRES/image/jpeg/4972ca757ddc9a73d1dad86dfecad170/gr6_lrg.jpg https://s3.amazonaws.com/prod-ucs-content-store-us-east/content/pii:S0926860X16306056/gr6/HIGHRES/image/jpeg/4972ca757ddc9a73d1dad86dfecad170/gr6_lrg.jpg gr6 gr6_lrg.jpg jpg 105558 875 1667 IMAGE-HIGH-RES 1-s2.0-S0926860X16306056-gr7_lrg.jpg https://s3-eu-west-1.amazonaws.com/prod-ucs-content-store-eu-west/content/pii:S0926860X16306056/gr7/HIGHRES/image/jpeg/d023e3ef148da908e1ad092a4722a079/gr7_lrg.jpg https://s3.amazonaws.com/prod-ucs-content-store-us-east/content/pii:S0926860X16306056/gr7/HIGHRES/image/jpeg/d023e3ef148da908e1ad092a4722a079/gr7_lrg.jpg gr7 gr7_lrg.jpg jpg 89886 792 1667 IMAGE-HIGH-RES 1-s2.0-S0926860X16306056-gr8_lrg.jpg https://s3-eu-west-1.amazonaws.com/prod-ucs-content-store-eu-west/content/pii:S0926860X16306056/gr8/HIGHRES/image/jpeg/3b03bd3c374f4e9b3791a088507ffdbd/gr8_lrg.jpg https://s3.amazonaws.com/prod-ucs-content-store-us-east/content/pii:S0926860X16306056/gr8/HIGHRES/image/jpeg/3b03bd3c374f4e9b3791a088507ffdbd/gr8_lrg.jpg gr8 gr8_lrg.jpg jpg 159168 1204 2500 IMAGE-HIGH-RES 1-s2.0-S0926860X16306056-gr9_lrg.jpg https://s3-eu-west-1.amazonaws.com/prod-ucs-content-store-eu-west/content/pii:S0926860X16306056/gr9/HIGHRES/image/jpeg/b52a3118b2ab2f84053aede65cc5d7dd/gr9_lrg.jpg https://s3.amazonaws.com/prod-ucs-content-store-us-east/content/pii:S0926860X16306056/gr9/HIGHRES/image/jpeg/b52a3118b2ab2f84053aede65cc5d7dd/gr9_lrg.jpg gr9 gr9_lrg.jpg jpg 139660 1215 3222 IMAGE-HIGH-RES APCATA 16096 S0926-860X(16)30605-6 10.1016/j.apcata.2016.12.011 Elsevier B.V. Fig. 1 Hydroformylation and isomerization – hydroformylation tandem reaction. Fig. 1 Fig. 2 Principle of a TMS system [21]. Fig. 2 Fig. 3 Highly selective tandem isomerisation – hydroformylation reactions of internal olefins with subsequent catalyst recycling. white: catalyst recycling realized; grey: catalyst was not recycled, but separated from the product. Fig. 3 Fig. 4 Product spectrum/BIPHEPHOS ligand. Fig. 4 Fig. 5 Influence of the reaction temperature on the product distribution. Conditions: 0.5mol% Rh(CO)2acac (with regard to 1), 2mol% BIPHEPHOS (with regard to 1), 5mL DMF, 2.6mmol 1, 15bar syngas (CO/H2 =1/1), reaction time=3h, batch reaction in a 20mL autoclave, yields were determined by GC-FID. Fig. 5 Fig. 6 Reaction Network of the isomerization [27] – hydroformylation tandem reaction. t=trans-isomers, c=cis-isomers, number=double bond position. Fig. 6 Fig. 7 Influence of TMS system composition on the reaction behavior. Conditions: 0.2mol% Rh(CO)2acac (with regard to 1), 0.8mol% BIPHEPHOS (with regard to 1), 2.5mL DMF, 2.5mL nonpolar solvent, 7.5mmol 1, 15bar syngas (CO/H2 =1/1), reaction temperature=135°C, reaction time=1 h, batch reaction in a 20mL autoclave, yields were determined by GC-FID, leaching values were determined by ICP-OES. Fig. 7 Fig. 8 Conversion/yield vs. time plot of the isomerization – hydroformylation tandem reaction in a TMS system. Conditions: 0.2mol% Rh(CO)2acac (with regard to 1), 0.8mol% BIPHEPHOS (with regard to 1), 50mL DMF, 50mL dodecane, 150mmol 1, 15bar syngas (CO/H2=1/1; reactor was repressurized after taking 4 samples), reaction in a 300mL autoclave, conversion of 1 and yields of 4, 2 and 3 were determined by GC-FID. Fig. 8 Fig. 9 a: Product yields after the initial run (run 0) of the recycling experiments. Conditions: 0.2mol% Rh(CO)2acac (with regard to 1), 0.8mol% BIPHEPHOS (with regard to 1), 50mL DMF, 50mL dodecane, 150mmol 1, 15bar syngas (CO/H2=1/1; reactor was repressurized after 1,5h), reaction temperature=135°C, reaction time=3h, semi-batch reaction in a 300mL autoclave, yields were determined by GC-FID. b: Yield of the different products in the dodecane phase (product phase) after reaction and phase separation. Conditions: run 0: 0.2mol% Rh(CO)2acac (with regard to 1), 0.8mol% BIPHEPHOS (with regard to 1), 50mL DMF, 50mL dodecane, 150mmol 1, 15bar syngas (CO/H2=1/1; reactor was repressurized after 1.5h), reaction temperature=135°C, reaction time=3h, semi-batch reaction in a 300mL autoclave, separation temperature=0°C, separation time=0.5h yields were determined by GC-FID; run 1–5: catalyst phase was recycled into the reactor, addition of: 3mL DMF, 47mL dodecane, 94mmol 1. Fig. 9 Table 1 Optimized reaction conditions for the isomerization – hydroformylation tandem reaction in batch reaction mode. Table 1 Parameter Optimized Value Temperature 135°C Pressure 15bar (for batch operation mode); 5bar (for semi-batch operation mode) CO/H2-ratio 1:1 1 concentration 1.5mmol/mL Rh concentration 0.2 mol% (with regard to 1) BIPHEPHOS concentration 0.8 mol% (with regard to 1) DMF volume 5mL Reactor volume 20mL Table 2 Component distribution after phase separation. Table 2 Compound Percentage in DMF phase [%] Percentage in dodecane phase [%] 1 15 85 4 10 90 2 45 55 3 48 52 rhodium 99.4 0.6 phosphorus (ligand) 98.8 1.2 DMF 94 6 dodecane 6 94 Conditions: 0.2mol% Rh(CO)2acac (with respect to 1), 0.8mol% BIPHEPHOS (with regard to 1), 25mL DMF, 25mL dodecane, 75mmol 1, 15bar syngas (CO/H2=1/1), reaction temperature=135°C, reaction time=3h, batch reaction in a 300mL autoclave, separation temperature=−9°C, separation time=0.5h, distributions of 1, 4, 2, 3, DMF and dodecane were determined by GC-FID, distributions of rhodium and phosphorus were determined by ICP-OES. Feature Article Isomerization/hydroformylation tandem reaction of a decene isomeric mixture with subsequent catalyst recycling in thermomorphic solvent systems T. Gaide a A. Jörke b K.E. Schlipköter a C. Hamel b A. Seidel-Morgenstern c A. Behr a A.J. Vorholt a ⁎ a Technische Univeristät Dortmund, Emil-Figge-Straße 66, 44227 Dortmund, Germany Technische Univeristät Dortmund Emil-Figge-Straße 66 Dortmund 44227 Germany b Otto von Guericke Universität, Universitätsplatz 2, 39106 Magdeburg, Germany Otto von Guericke Universität Universitätsplatz 2 Magdeburg 39106 Germany c Max Planck Institut für Dynamik Komplexer Systeme, Sandtorstraße 1, 39106 Magdeburg, Germany Max Planck Institut für Dynamik Komplexer Systeme Sandtorstraße 1 Magdeburg 39106 Germany ⁎ Corresponding author. Graphical abstract Herein we report about an efficient isomerization/hydroformylation tandem reaction to convert a technical mixture of decene isomers selectively into the linear undecanal in a thermomorphic solvent system. By applying a rhodium/BIPHEPHOS catalyst a high turnover frequency of 375h−1 and high regioselectivity of 92% for the linear product are achieved. Yields up to 70% of the linear aldehyde are obtained. The catalyst can be successfully separated from the product using a thermomorphic solvent system consisting of dimethyl formamide (catalyst phase) and dodecane (product phase). The leaching of the rhodium (0.6% of the initial amount) and phosphorus (1.2% of the initial amount) is very low. The catalyst was successfully recycled five times. Abbreviations TMS thermomorphic solvent systems TOF turnover frequency DMF N,N-dimethylformamide 1 isomeric decene mixture 3 branched C11 aldehydes 2 undecanal 4 decane BP highboiling byproducts v% volume percentage Keywords Homogeneous catalysis Hydroformylation Catalyst recycling Thermomorphic solvent systems Tandem reactions Isomerization 1 Introduction The hydroformylation is the most important reaction for the homogeneously catalyzed synthesis of linear aldehydes, which are intermediates of high interest in the chemical industry (e.g. in the synthesis of surfactants, plasticizers or perfumes) (Fig. 1 a). Essentially, linear as well as branched aldehydes can be synthesized from a terminal double bond. The hydroformylation of internal double bonds leads to the formation of branched aldehydes. Often the linear aldehydes are of particular interest in technical chemistry. Unfortunately, technical grade olefin feedstocks are often complex mixtures of different olefin isomers, predominately internal olefins. In order to convert these mixtures into linear aldehydes a tandem reaction sequence of double bond isomerization and highly n-selective hydroformylation is necessary (Fig. 1b). For the realization of this reaction sequence the catalyst plays a crucial role. In consequence, much effort was taken into catalyst development. Several metals like Co, Rh, Ru, Pd, Pt, Ir and iron were tested in combination with different ligands [1]. However, the best results are obtained using rhodium as metal in combination with chelating phosphorous ligands like BISBI and IPHOS [2], XANTPHOS-type ligands [3,4], BIPHEPHOS-type ligands (also in solvent mixtures) [5–9], H8-BINOL-derived diphosphite ligands [10], or electronical nonsymmetric acylphosphite ligands [11]. Very good results are also obtained by application of hemilabile ligands [12], anthracenetriol-based triphosphite ligands [13] or tetraphosphorus ligands (for details see [1]). However, all of the above mentioned catalysts have in common, that they use expensive noble metals and tailored ligands, which makes them very expensive. For that reason, catalyst recycling is an essential step in the development of economical processes from an industrial point of view. Compared to the development of suitable catalysts for the isomerization – hydroformylation tandem reaction, their separation and reuse has attracted less attention in academic research. To the best of our knowledge there is only one example for an isomerizing hydroformylation of higher olefins with a high regioselectivity and a successful catalyst recycling [14]. While techniques like product distillation are well suited for separating homogeneous catalysts from low boiling products, the distillation of higher aldehydes requires high temperatures, which often shortens the lifetime of the temperature sensitive catalysts. One other approach for catalyst recycling is the immobilization of the catalyst on a solid carrier or in liquid phase. There are examples for the cobalt/TPPTS catalyzed isomerization – hydroformylation of 2-pentene [15] and technical decene mixtures [16] in aqueous biphasic solvent systems, where the catalyst is immobilized in the aqueous phase. Also a rhodium/TPPTS catalyzed conversion of olefins present in the light-light cracked naphtha in water [17] and a rhodium/XANTphos-type ligand catalyzed hydroformylation of 2-octene in ionic liquids [18] are described. Unfortunately, these catalysts show relatively low n-selectivity (between 50% and 75%) in the hydroformylation step. In order to achieve a highly n-selective hydroformylation, Beller et al. used a rhodium/BINAS catalyst for the hydroformylation of isomeric octene mixtures in an aqueous solvent system, which shows a very high regioselectivity (n/iso 98:2). The catalyst is immobilized in water [14]. The turnover frequency (TOF) decreases with increasing chain length of the substrate (TOF 113h−1 for 2-butene, TOF 29h−1 for octene mixtures). Despite the use of water as solvent in industrial plants is very attractive from an economic and ecologic point of view, the conversion of higher olefins in water usually suffers from mass transfer- and solubility limitations, which is displayed by the relatively low TOF values of 29h−1 for higher olefins reported in literature. One approach to overcome these limitations is the use of thermomorphic solvent systems (TMS systems). The idea of these systems is to take advantage of the temperature dependent miscibility gap of a mixture of a polar and a non-polar solvent. While the substrate and the product are better soluble in the non-polar solvent, the catalyst has a high solubility in the polar solvent. Heating the solvent system to reaction temperature leads to the formation of one single homogeneous reaction mixture overcoming mass transfer and solubility limitations during the reaction. Cooling after reaction initiates phase separation and the polar, catalyst containing phase can be separated from the non-polar product phase via simple decantation (Fig. 2 ) [19,20]. The TMS system offers several advantages compared to other catalyst immobilization strategies like a homogeneous reaction mixture (no mass transport and solubility limitations during the reaction), straightforward catalyst separation via decantation after reaction and the use of cheap commercially available solvents. Usually, there is no need to modify the catalyst, which is of great advantage since catalyst modification means higher prices and, not unusual, lower activities [22]. The concept of TMS systems was already successfully applied in the hydroformylation of long chained olefins [23–25]. The hydroformylation of 1-dodecene in a thermomorphic solvent system consisting of N,N-dimethylformamide (DMF) and decane using a rhodium/BIPHEPHOS catalyst was already successfully transferred into a continuously operated miniplant [26]. Fig. 3 shows the examples from literature for the isomerization – hydroformylation tandem reaction achieving high selectivity towards the linear aldehydes with subsequent catalyst separation, which are already realized. To the best of our knowledge, there is only one example for the isomerization – hydroformylation tandem reaction (synthesis of n-hexanal from 2-pentene) demonstrating a recyclability of the catalyst. This work describes the highly selective tandem isomerization – hydroformylation to convert a mixture of decene isomers into undecanal with relatively high turnover frequencies in a TMS system with subsequent catalyst recycling. 2 Materials and methods 2.1 Chemicals DMF (>99%), octane (99%), heptane (>99%) and cyclohexane (>99%) were purchased from Acros Organics. Cyclooctane (98%) was purchased from Sigma Aldrich. Dodecane (>99%) and undecanal (97%) were purchased from TCI Chemicals. Nonane (99%) was purchased from Alfa Aesar. BIPHEPHOS (>95%) was purchased from Molisa GmbH. Rh(CO)2acac was donated by Umicore. The technical decene mixture was donated by Sasol. All chemicals were degassed before use and stored under argon. CO (2.0) and H2 (5.0) were purchased from Messer Industriegase GmbH. 2.2 Reaction in a 20mL autoclave The precursor Rh(CO)2acac and BIPHEPHOS were weighted and added in a homemade 20mL autoclave. The autoclave was closed, evacuated and flushed with Argon three times. Afterwards degassed DMF, non-polar solvent and decene mixture were transferred into the reactor via cannula using standard Schlenk technique. The reactor was pressurized with synthesis gas and heated under stirring to reaction temperature. After reaction time the reactor was cooled in an ice bath and the pressure was released carefully. The reaction mixture was analyzed via GC-FID. 2.3 Reaction in a 300mL autoclave The precursor Rh(CO)2acac and BIPHEPHOS were weighted and added into a 300mL autoclave (Parr Instruments). The autoclave was closed, evacuated and flushed with Argon three times. Afterwards the reactor was evacuated again and degassed DMF, non-polar solvent and decene mixture were transferred into the autoclave via vacuum using standard Schlenk technique. The reactor was pressurized with synthesis gas and heated to reaction temperature under stirring. For time-resolved experiments samples of the reaction solution were taken via a capillary from inside the reactor and analyzed via GC-FID. After reaction time the reactor was cooled in an ice bath and the pressure was released carefully. For the determination of the phase behavior the reaction solution was transferred into a temperature controlled separating funnel. After separation, both phases were analyzed via GC-FID. The product phase was analyzed via ICP-OES. 2.4 Recycling experiments The initial run was set up as described in 2.3. Before cooling the reactor to end the reaction, a sample was taken from the hot reaction mixture and analyzed via GC-FID in order to determine conversion and yield. Afterwards, the reactor was cooled via an ice bath. The syngas pressure was then reduced to 10bar. The autoclave was connected to an inert glass pressure reactor (Büchi AG) via flexible tube. The reaction solution was then transferred into the glass pressure autoclave via CO/H2-pressure. The phases were separated in the glass autoclave under syngas atmosphere and 0°C. Meanwhile the steel autoclave was inerted again via the procedure described in 2.3. and refilled with DMF (small amounts), dodecane and decene mixture. The two reactors were connected again and the catalyst phase was transferred from the glass autoclave into the steel autoclave via syngas pressure. Finally, the reaction was started again and the product phase was analyzed via GC-FID. In the following reaction runs no samples from the hot reaction mixtures or the catalyst phase were taken. 2.5 Gas chromatography – flame ionization detector (GC–FID) measurements GC-FID measurements were conducted by HP 6890 Series gas chromatograph (Hewlett Packard). The gas chromatograph was equipped with a capillary column (Agilent J&W GC Columns-INNOWAX 30m×0.25mm×0.25μm) and a flame ionization detector. Helium was used as carrier gas. The method of external standard was used for quantitative analysis of the reaction mixture. 2.6 Inductive coupled plasma optical emission spectrometry (ICP–OES) measurements For sample preparation for ICP-OES measurement 0.230g of the non-polar phase was weighted into a Teflon cup. Then 2.5mL nitric acid (65%) and 4mL sulfuric acid (96%) were added and a digestion was conducted in a Micro mPrep A microwave apparatus (MWS GmbH). Subsequently 2mL of distilled water and 1mL hydrogen peroxide solution (30–32%, optima grade, Fisher Chemical) were added. Finally, ICP-OES measurements were conducted with an IRIS Intrepid optical emission spectrometer (Thermo Elemental). 3 Results and discussion We started our studies on the isomerization – hydroformylation tandem reaction of decene isomeric mixtures by investigating the reaction parameters temperature, synthesis gas pressure, CO/H2-ratio and decene concentration in pure DMF as solvent. The aim was to determine important influence factors for the tandem reaction and to optimize the yield of the desired linear aldehyde (2, Fig. 4 ) at low catalyst loadings. Afterwards, suitable TMS systems were developed to realize the catalyst recycling. We decided to use a Rh(CO)2acac/BIPHEPHOS catalyst (Fig. 4) which was reported to be active in double bond isomerization as well as very n-selective in the hydroformylation of olefins [7]. The substrate mixture (1), the desired linear aldehyde (2), the branched hydroformylation products (3) and the hydrogenated substrates (4) are shown in Fig. 4. Besides these products, small amounts of high boiling byproducts (BP) were detected in some cases. 3.1 Reaction optimization The first paremeter we investigated in order to optimize the yield of 2 was the reaction temperature. The reaction temperature has influence on both the isomerization and the hydroformylation reaction rates. Also the equilibrium concentration of the different decene isomers depends on temperature [27]. Results of the temperature screening are given in Fig. 5 . The yield of the desired linear hydroformylation product 2 increases from 26% at 95°C to 75% at 135°C. Also the overall selectivity towards 2 increases with higher temperatures from 72% (95°C) to 78% (135°C). This behavior can be explained with the reaction network of this tandem reaction (Fig. 6 ). All the isomers of the decene mixture are in equilibrium. While the branched aldehydes and hydrogenated decane can be formed by all isomers, the desired linear product can only be obtained from the terminal 1-decene, which is the thermodynamically less favored alkene. The concentration of 1-decene in the reaction solution increases with higher temperatures [27] and, in consequence, also the reaction rate for the n-selective hydroformylation. Also the isomerization rate increases with temperature [27]. This is beneficial since the converted 1-decene can be reproduced faster from the internal decene isomers. Notably, the regioselectivity in the hydroformylation towards the linear product is between 91% and 92% and not influenced by the temperature in the investigated range. If temperature is raised to 145°C the yield of all products decreases drastically which can be ascribed to catalyst decomposition at this temperature. However, the best results in terms of reaction rates and selectivity are obtained at 135°C and further investigations were conducted at this temperature. After the investigation of the reaction temperature the parameters syngas pressure, CO/H2-ratio, concentration of 1, Rh-concentration and rhodium/ligand ratio were optimized for batch operation mode. Table 1 shows the optimized conditions for the isomerization – hydroformylation tandem reaction of a decene isomeric mixture in batch reaction mode. At a relative high temperature of 135°C a Rh/ligand ratio of 1/4 is required for a stable and selective catalyst complex. A pressure of 15bar is required for the reaction in batch operation mode. If the synthesis gas pressure is constant (semi-batch), very good results are obtained at lower pressures of 5bar. A CO/H2-ratio of 1:1 turned out to be the best under given conditions. While higher amounts of hydrogen lead to an increasing yield of the hydrogenated substrate 4, higher amounts of CO lower the reactivity of the catalyst. Kinetic studies for this reaction in semi-batch mode can be found in [28]. Under these conditions, a yield of the desired 2 of 34% with a regioselectivity of 92% after one hour can be achieved. With these intermediate results we started to develop a suitable TMS-System for the reaction. 3.2 Design of the TMS system After optimizing the reaction conditions the next step was to develop a suitable TMS system to be able to separate the catalyst from the products. The TMS system should meet the following criteria: • Two solvent components (one polar for the catalyst, one non-polar for the product). • Biphasic at room temperature. • Homogeneous at reaction temperature. • Good reaction performance. • Low catalyst leaching into the nonpolar phase. • Fast an accurate phase separation. Recently we reported about a concept of a COSMO-RS based approach for the solvent selection in TMS systems using Rh/BIPHEPHOS catalyst as model compound. It turned out that DMF is one of the most suitable polar solvents in a TMS system for this catalyst, especially in terms of catalyst leaching [29]. Consequently, we decided to use it as the polar solvent component for the TMS system. Alkanes and cycloalkanes are suitable non-polar components in a TMS system for this type of reaction, since the resulting C11-aldehydes have a higher solubility in them compared to DMF. So we tested the phase behavior of heptane, octane, nonane, dodecane, cyclohexane and cyclooctane (each in 50v%) in combination with DMF (50v%). All these mixtures were biphasic at room temperature and homogeneous at reaction temperature, so they meet the first three criteria. Fig. 7 shows the product distribution in different TMS compositions. All TMS systems show comparable results in the isomerization – hydroformylation tandem reaction. Also there are no significant differences between the use of a TMS system and a reaction in pure DMF. The yield of 2 is at about 40% after one hour. The regioselectivity in the hydroformylation is 92%. As a consequence, all TMS systems are in line for a possible application in view of their reaction performance. Another important decision criterion is the leaching of the catalyst into the nonpolar product phase. Brunsch et al. already showed that the Rh/BIPHEPHOS-catalyst leaching into the nonpolar phase decreases with increasing chain length of the nonpolar solvent [25]. ICP-OES analytic of the DMF/dodecane TMS system showed that the concentrations of rhodium and phosphorus in the dodecane phase after reaction and subsequent phase separation at −9°C were only 5ppm for rhodium respectively 25ppm for phosphorus. If cyclic alkanes like cyclohexane are used as non-polar solvents the concentrations of rhodium (66ppm) and phosphorus (71ppm) are much higher compared to simple linear alkanes. While the DMF/cycloalkane TMS-systems were homogeneous at room temperature, the phase separation was accurate for all TMS systems at −9°C. Taking into account all the criteria made above the DMF/dodecane TMS system seems to be the most promising for further investigations. Table 2 shows the distribution of the different components in the two phases after reaction and phase separation. The desired 2 as well as the byproducts 4 and 3 have a (slightly) higher solubility in the nonpolar dodecane phase; rhodium and the ligand are nearly completely dissolved in the DMF phase. Therefore the phase behavior of the reaction system is very promising for a catalyst recycling in the ongoing. Fig. 8 shows a yield/conversion vs. time plot of the reaction in the TMS system under optimized conditions. After 3h a yield of the desired 2 of 64% is obtained. The regioselectivity in the hydroformylation is 92%. The TOF after 50% conversion (after 40min) is 375h−1 which is very fast for this tandem reaction in a biphasic solvent system (see Fig. 3). For example, TOFs obtained in the aqueous reaction system for the conversion of internal octene isomers developed by Beller et al. [15] is only 29h−1 at 36% conversion. With this knowledge we started our investigations on the catalyst recycling in the DMF/dodecane TMS system. 3.3 Catalyst recycling In order to prove the applicability of our TMS system as a recycling concept we conducted a set of recycling experiments (Fig. 9 ): • After the initial run (run 0) the phases were separated. • Also a sample was taken from the catalyst phase of run 0 to determine the yields of the reaction in the initial run (Fig. 9a). • After sampling the catalyst phase was recycled back into the reactor, new dodecane, substrate and synthesis gas were added and the reaction was started again. The results match the expectations from the results shown in Fig. 8. The yield of the desired product 2 (95 mmol) is 65% and the regioselectivity in hydroformylation is 91%. From resulting 2 58% (55mmol) were extracted into the product phase which is also in good accordance to the results shown in Table 2. In the following recycling runs (run 1–5, Fig. 9b) no samples of the catalyst phase were taken from the reaction mixture to avoid loss of the catalyst. The yield of the desired 2 is more or less constant over all recycling runs (between 50 and 62mmol). The same observation was made for the yield of the hydrogenated substrates 4 (6–10mmol). The regioselectivity in the hydroformylation decreases after run 3 from 90% (run 3) to 64% (run 5). The loss of regioselectivity can be traced back to ligand decomposition, since the ligand is responsible for the high n-selectivity in the hydroformylation reaction. It should be noted that a regioselectivity of 64% is still quite high taking into account that less than 1% of all decene isomers is 1-decene in the equilibrium at this temperature [27]. With decreasing regioselectivity in the hydroformylation also the amount of 1 in the product phase decreases from 28mmol (run 3) to 12mmol (run 5) since also internal olefins are converted into branched aldehydes. However, with this set of recycling experiments we were able to show that our developed tunable multiphasic catalyst recycling strategy gives stable yields of 2 over five recycling runs and enhances the reaction kinetic in comparison to the biphasic systems described in literature. Future investigations will be done in a continuously operated miniplant in order to get information about the long time stability and a possible refreshment of the BIPHEPHOS ligand. 4 Conclusion In this paper we described the first development of an isomerization-hydroformylation tandem reaction of a technical decene isomeric mixture with subsequent recycling of the rhodium/BIPHEPHOS catalyst in a thermomorphic solvent system consisting of DMF/dodecane. With this reaction system highest turnover frequency in a multiphase reaction for this tandem reaction (375h−1 at 50% conversion) in combination with a high regioselectivity of 92% towards the desired linear aldehyde were achieved. The losses of rhodium (5ppm, <1% of initial amount) and phosphorus (25ppm, 2% of initial amount) into the product phase are very low. A catalyst recycling was successfully realized. The activity of the catalyst was maintained over 6 runs without any refreshment of a catalyst component. This reaction system represents a promising approach for the conversion of internal long chained olefin mixtures into linear aldehydes with an integrated catalyst separation via thermomorphic solvent systems. Further investigations should regard the implementation of this reaction in a continuously operated miniplant to get information about the long-term behavior of the TMS system and to get a better understanding of the BIPHEPHOS decomposition. Also different ligands can be applied to evaluate their reaction performance and the stability in a continuously operated process. Acknowledgments The financial support of the German Science Foundation (Project SFB/TRR 63: ”InPROMPT – Integrated Chemical Processes in Multi-Phase Fluid Systems”) for this joint collaboration (Subprojects A1/A3) is gratefully acknowledged. We are also very grateful to Umicore AG and Co. KG for the supply of the catalyst precursor Rh(CO)2acac. References [1] M. Vilches-Herrera L. Domke A. Börner ACS Catal. 4 2014 1706 1724 [2] H. Klein R. Jackstell K.-D. Wiese C. Borgmann M. Beller Angew. Chem. Int. Ed. 40 2001 3408 3411 [3] A. van der Veen Lars P.C.J. Kamer W.N.M. van Leeuwen Piet Angew. Chem. Int. Ed. 38 1999 336 338 [4] E. Zuidema P.E. Goudriaan B.H.G. Swennenhuis P.C.J. Kamer P.W.N.M. van Leeuwen M. Lutz A.L. Spek Organometallics 29 2010 1210 1221 [5] E. Billig A.G. Abatjoglou D.R. Bryant Union Carbide Corporation Evol. Psychol. EP213639 1987 [6] C. Vogl E. Paetzold C. Fischer U. Kragl J. Mol. Catal. A: Chem. 232 2005 41 44 [7] A. Behr D. Obst B. Turkowski J. Mol. Catal. A: Chem. 226 2005 215 219 [8] A. Behr D. Obst C. Schulte Chem. Ing. Tech. 76 2004 904 910 [9] A. Behr G. Henze D. Obst B. Turkowski Green Chem. 7 2005 645 [10] I. Piras R. Jennerjahn R. Jackstell W. Baumann A. Spannenberg R. Franke K.-D. Wiese M. Beller J. Organomet. Chem. 695 2010 479 486 [11] D. Selent D. Hess K.-D. Wiese D. Röttger C. Kunze A. Börner Angew. Chem. Int. Ed. 40 2001 1696 1698 [12] D. Selent K.-D. Wiese D. Röttger A. Börner Angew. Chem. Int. Ed. 39 2000 1639 1641 [13] A. Christiansen R. Franke D. Fridag D. Hess B. Kreidler D. Selent A. Börner Evonik Oxeno GmbH 2016 (WO2013068232) [14] H. Klein R. Jackstell M. Beller Chem. Commun. 2005 2283 [15] M. Beller J.G. Krauter J. Mol. Catal. A: Chem. 143 1999 31 39 [16] M. Kant A. Martin G. Giuffrida S. Rosano Chem. Ing. Tech. 78 2006 913 921 [17] N.C. Kokkinos E. Kazou A. Lazaridou C.E. Papadopoulos N. Psaroudakis K. Mertis N. Nikolaou Fuel 104 2013 275 283 [18] R.P.J. Bronger S.M. Silva P.C.J. Kamer P.W.N.M. van Leeuwen Dalton Trans. 2004 1590 [19] A. Behr G. Henze L. Johnen C. Awungacha J. Mol. Catal. A: Chem. 285 2008 20 28 [20] A. Behr G. Henze R. Schomäcker Adv. Synth. Catal. 348 2006 1485 1495 [21] T. Gaide A. Behr A. Arns F. Benski A.J. Vorholt Chem. Eng. Process. 99 2016 197 204 [22] S. Hübner J.G. de Vries V. Farina Adv. Synth. Catal. 358 2016 3 25 [23] Y. Yang J. Jiang Y. Wang C. Liu Z. Jin J. Mol. Catal. A: Chem. 261 2007 288 292 [24] E. Schäfer Y. Brunsch G. Sadowski A. Behr Ind. Eng. Chem. Res. 51 2012 10296 10306 [25] Y. Brunsch A. Behr Angew Chem. Int. Ed. 52 2013 1586 1589 [26] A. Behr J. Dreimann M. Zagajewski A.J. Vorholt Chem. Ing. Tech. 86 2014 1535 1536 [27] A. Jörke A. Seidel-Morgenstern C. Hamel Chem. Eng. J. 260 2015 513 523 [28] A. Jörke T. Gaide A. Behr A. Vorholt A. Seidel-Morgenstern C. Hamel Chem. Eng. J. 2016 10.1016/j.cej.2016.12.070 submitted (added as supplementary information for review process) [29] K. McBride T. Gaide A. Vorholt A. Behr K. Sundmacher Chem. Eng. Process. 99 2016 97 106",
      "scopus-id": "85006927604",
      "coredata": {
        "eid": "1-s2.0-S0926860X16306056",
        "dc:description": "Herein we report about an efficient isomerization/hydroformylation tandem reaction to convert a technical mixture of decene isomers selectively into the linear undecanal in a thermomorphic solvent system. By applying a rhodium/BIPHEPHOS catalyst a high turnover frequency of 375h−1 and high regioselectivity of 92% for the linear product are achieved. Yields up to 70% of the linear aldehyde are obtained. The catalyst can be successfully separated from the product using a thermomorphic solvent system consisting of dimethyl formamide (catalyst phase) and dodecane (product phase). The leaching of the rhodium (0.6% of the initial amount) and phosphorus (1.2% of the initial amount) is very low. The catalyst was successfully recycled five times.",
        "openArchiveArticle": "false",
        "prism:coverDate": "2017-02-25",
        "openaccessUserLicense": null,
        "prism:aggregationType": "Journal",
        "prism:url": "https://api.elsevier.com/content/article/pii/S0926860X16306056",
        "dc:creator": [
          {
            "@_fa": "true",
            "$": "Gaide, T."
          },
          {
            "@_fa": "true",
            "$": "Jörke, A."
          },
          {
            "@_fa": "true",
            "$": "Schlipköter, K.E."
          },
          {
            "@_fa": "true",
            "$": "Hamel, C."
          },
          {
            "@_fa": "true",
            "$": "Seidel-Morgenstern, A."
          },
          {
            "@_fa": "true",
            "$": "Behr, A."
          },
          {
            "@_fa": "true",
            "$": "Vorholt, A.J."
          }
        ],
        "link": [
          {
            "@_fa": "true",
            "@rel": "self",
            "@href": "https://api.elsevier.com/content/article/pii/S0926860X16306056"
          },
          {
            "@_fa": "true",
            "@rel": "scidir",
            "@href": "https://www.sciencedirect.com/science/article/pii/S0926860X16306056"
          }
        ],
        "dc:format": "application/json",
        "openaccessType": null,
        "pii": "S0926-860X(16)30605-6",
        "prism:volume": "532",
        "prism:publisher": "Elsevier B.V.",
        "dc:title": "Isomerization/hydroformylation tandem reaction of a decene isomeric mixture with subsequent catalyst recycling in thermomorphic solvent systems",
        "prism:copyright": "© 2016 Elsevier B.V. All rights reserved.",
        "openaccess": "0",
        "prism:issn": "0926860X",
        "dcterms:subject": [
          {
            "@_fa": "true",
            "$": "Homogeneous catalysis"
          },
          {
            "@_fa": "true",
            "$": "Hydroformylation"
          },
          {
            "@_fa": "true",
            "$": "Catalyst recycling"
          },
          {
            "@_fa": "true",
            "$": "Thermomorphic solvent systems"
          },
          {
            "@_fa": "true",
            "$": "Tandem reactions"
          },
          {
            "@_fa": "true",
            "$": "Isomerization"
          }
        ],
        "openaccessArticle": "false",
        "prism:publicationName": "Applied Catalysis A: General",
        "openaccessSponsorType": null,
        "prism:pageRange": "50-56",
        "prism:endingPage": "56",
        "pubType": "fla",
        "prism:coverDisplayDate": "25 February 2017",
        "prism:doi": "10.1016/j.apcata.2016.12.011",
        "prism:startingPage": "50",
        "dc:identifier": "doi:10.1016/j.apcata.2016.12.011",
        "openaccessSponsorName": null
      },
      "objects": {
        "object": [
          {
            "@category": "thumbnail",
            "@height": "88",
            "@width": "219",
            "@_fa": "true",
            "$": "https://api.elsevier.com/content/object/eid/1-s2.0-S0926860X16306056-fx1.sml?httpAccept=%2A%2F%2A",
            "@multimediatype": "GIF image file",
            "@type": "IMAGE-THUMBNAIL",
            "@size": "6107",
            "@ref": "fx1",
            "@mimetype": "image/gif"
          },
          {
            "@category": "thumbnail",
            "@height": "75",
            "@width": "219",
            "@_fa": "true",
            "$": "https://api.elsevier.com/content/object/eid/1-s2.0-S0926860X16306056-gr1.sml?httpAccept=%2A%2F%2A",
            "@multimediatype": "GIF image file",
            "@type": "IMAGE-THUMBNAIL",
            "@size": "2951",
            "@ref": "gr1",
            "@mimetype": "image/gif"
          },
          {
            "@category": "thumbnail",
            "@height": "72",
            "@width": "219",
            "@_fa": "true",
            "$": "https://api.elsevier.com/content/object/eid/1-s2.0-S0926860X16306056-gr2.sml?httpAccept=%2A%2F%2A",
            "@multimediatype": "GIF image file",
            "@type": "IMAGE-THUMBNAIL",
            "@size": "3781",
            "@ref": "gr2",
            "@mimetype": "image/gif"
          },
          {
            "@category": "thumbnail",
            "@height": "161",
            "@width": "219",
            "@_fa": "true",
            "$": "https://api.elsevier.com/content/object/eid/1-s2.0-S0926860X16306056-gr3.sml?httpAccept=%2A%2F%2A",
            "@multimediatype": "GIF image file",
            "@type": "IMAGE-THUMBNAIL",
            "@size": "5725",
            "@ref": "gr3",
            "@mimetype": "image/gif"
          },
          {
            "@category": "thumbnail",
            "@height": "164",
            "@width": "173",
            "@_fa": "true",
            "$": "https://api.elsevier.com/content/object/eid/1-s2.0-S0926860X16306056-gr4.sml?httpAccept=%2A%2F%2A",
            "@multimediatype": "GIF image file",
            "@type": "IMAGE-THUMBNAIL",
            "@size": "4400",
            "@ref": "gr4",
            "@mimetype": "image/gif"
          },
          {
            "@category": "thumbnail",
            "@height": "105",
            "@width": "219",
            "@_fa": "true",
            "$": "https://api.elsevier.com/content/object/eid/1-s2.0-S0926860X16306056-gr5.sml?httpAccept=%2A%2F%2A",
            "@multimediatype": "GIF image file",
            "@type": "IMAGE-THUMBNAIL",
            "@size": "3368",
            "@ref": "gr5",
            "@mimetype": "image/gif"
          },
          {
            "@category": "thumbnail",
            "@height": "115",
            "@width": "219",
            "@_fa": "true",
            "$": "https://api.elsevier.com/content/object/eid/1-s2.0-S0926860X16306056-gr6.sml?httpAccept=%2A%2F%2A",
            "@multimediatype": "GIF image file",
            "@type": "IMAGE-THUMBNAIL",
            "@size": "4252",
            "@ref": "gr6",
            "@mimetype": "image/gif"
          },
          {
            "@category": "thumbnail",
            "@height": "104",
            "@width": "219",
            "@_fa": "true",
            "$": "https://api.elsevier.com/content/object/eid/1-s2.0-S0926860X16306056-gr7.sml?httpAccept=%2A%2F%2A",
            "@multimediatype": "GIF image file",
            "@type": "IMAGE-THUMBNAIL",
            "@size": "4433",
            "@ref": "gr7",
            "@mimetype": "image/gif"
          },
          {
            "@category": "thumbnail",
            "@height": "105",
            "@width": "219",
            "@_fa": "true",
            "$": "https://api.elsevier.com/content/object/eid/1-s2.0-S0926860X16306056-gr8.sml?httpAccept=%2A%2F%2A",
            "@multimediatype": "GIF image file",
            "@type": "IMAGE-THUMBNAIL",
            "@size": "3810",
            "@ref": "gr8",
            "@mimetype": "image/gif"
          },
          {
            "@category": "thumbnail",
            "@height": "83",
            "@width": "219",
            "@_fa": "true",
            "$": "https://api.elsevier.com/content/object/eid/1-s2.0-S0926860X16306056-gr9.sml?httpAccept=%2A%2F%2A",
            "@multimediatype": "GIF image file",
            "@type": "IMAGE-THUMBNAIL",
            "@size": "4142",
            "@ref": "gr9",
            "@mimetype": "image/gif"
          },
          {
            "@category": "standard",
            "@height": "200",
            "@width": "500",
            "@_fa": "true",
            "$": "https://api.elsevier.com/content/object/eid/1-s2.0-S0926860X16306056-fx1.jpg?httpAccept=%2A%2F%2A",
            "@multimediatype": "JPEG image file",
            "@type": "IMAGE-DOWNSAMPLED",
            "@size": "11506",
            "@ref": "fx1",
            "@mimetype": "image/jpeg"
          },
          {
            "@category": "standard",
            "@height": "168",
            "@width": "489",
            "@_fa": "true",
            "$": "https://api.elsevier.com/content/object/eid/1-s2.0-S0926860X16306056-gr1.jpg?httpAccept=%2A%2F%2A",
            "@multimediatype": "JPEG image file",
            "@type": "IMAGE-DOWNSAMPLED",
            "@size": "13751",
            "@ref": "gr1",
            "@mimetype": "image/jpeg"
          },
          {
            "@category": "standard",
            "@height": "224",
            "@width": "678",
            "@_fa": "true",
            "$": "https://api.elsevier.com/content/object/eid/1-s2.0-S0926860X16306056-gr2.jpg?httpAccept=%2A%2F%2A",
            "@multimediatype": "JPEG image file",
            "@type": "IMAGE-DOWNSAMPLED",
            "@size": "27454",
            "@ref": "gr2",
            "@mimetype": "image/jpeg"
          },
          {
            "@category": "standard",
            "@height": "416",
            "@width": "565",
            "@_fa": "true",
            "$": "https://api.elsevier.com/content/object/eid/1-s2.0-S0926860X16306056-gr3.jpg?httpAccept=%2A%2F%2A",
            "@multimediatype": "JPEG image file",
            "@type": "IMAGE-DOWNSAMPLED",
            "@size": "33070",
            "@ref": "gr3",
            "@mimetype": "image/jpeg"
          },
          {
            "@category": "standard",
            "@height": "535",
            "@width": "565",
            "@_fa": "true",
            "$": "https://api.elsevier.com/content/object/eid/1-s2.0-S0926860X16306056-gr4.jpg?httpAccept=%2A%2F%2A",
            "@multimediatype": "JPEG image file",
            "@type": "IMAGE-DOWNSAMPLED",
            "@size": "41128",
            "@ref": "gr4",
            "@mimetype": "image/jpeg"
          },
          {
            "@category": "standard",
            "@height": "181",
            "@width": "376",
            "@_fa": "true",
            "$": "https://api.elsevier.com/content/object/eid/1-s2.0-S0926860X16306056-gr5.jpg?httpAccept=%2A%2F%2A",
            "@multimediatype": "JPEG image file",
            "@type": "IMAGE-DOWNSAMPLED",
            "@size": "9783",
            "@ref": "gr5",
            "@mimetype": "image/jpeg"
          },
          {
            "@category": "standard",
            "@height": "197",
            "@width": "376",
            "@_fa": "true",
            "$": "https://api.elsevier.com/content/object/eid/1-s2.0-S0926860X16306056-gr6.jpg?httpAccept=%2A%2F%2A",
            "@multimediatype": "JPEG image file",
            "@type": "IMAGE-DOWNSAMPLED",
            "@size": "12793",
            "@ref": "gr6",
            "@mimetype": "image/jpeg"
          },
          {
            "@category": "standard",
            "@height": "179",
            "@width": "376",
            "@_fa": "true",
            "$": "https://api.elsevier.com/content/object/eid/1-s2.0-S0926860X16306056-gr7.jpg?httpAccept=%2A%2F%2A",
            "@multimediatype": "JPEG image file",
            "@type": "IMAGE-DOWNSAMPLED",
            "@size": "12515",
            "@ref": "gr7",
            "@mimetype": "image/jpeg"
          },
          {
            "@category": "standard",
            "@height": "272",
            "@width": "565",
            "@_fa": "true",
            "$": "https://api.elsevier.com/content/object/eid/1-s2.0-S0926860X16306056-gr8.jpg?httpAccept=%2A%2F%2A",
            "@multimediatype": "JPEG image file",
            "@type": "IMAGE-DOWNSAMPLED",
            "@size": "20551",
            "@ref": "gr8",
            "@mimetype": "image/jpeg"
          },
          {
            "@category": "standard",
            "@height": "275",
            "@width": "728",
            "@_fa": "true",
            "$": "https://api.elsevier.com/content/object/eid/1-s2.0-S0926860X16306056-gr9.jpg?httpAccept=%2A%2F%2A",
            "@multimediatype": "JPEG image file",
            "@type": "IMAGE-DOWNSAMPLED",
            "@size": "22820",
            "@ref": "gr9",
            "@mimetype": "image/jpeg"
          },
          {
            "@category": "high",
            "@height": "886",
            "@width": "2213",
            "@_fa": "true",
            "$": "https://api.elsevier.com/content/object/eid/1-s2.0-S0926860X16306056-fx1_lrg.jpg?httpAccept=%2A%2F%2A",
            "@multimediatype": "JPEG image file",
            "@type": "IMAGE-HIGH-RES",
            "@size": "102792",
            "@ref": "fx1",
            "@mimetype": "image/jpeg"
          },
          {
            "@category": "high",
            "@height": "743",
            "@width": "2167",
            "@_fa": "true",
            "$": "https://api.elsevier.com/content/object/eid/1-s2.0-S0926860X16306056-gr1_lrg.jpg?httpAccept=%2A%2F%2A",
            "@multimediatype": "JPEG image file",
            "@type": "IMAGE-HIGH-RES",
            "@size": "95791",
            "@ref": "gr1",
            "@mimetype": "image/jpeg"
          },
          {
            "@category": "high",
            "@height": "993",
            "@width": "3000",
            "@_fa": "true",
            "$": "https://api.elsevier.com/content/object/eid/1-s2.0-S0926860X16306056-gr2_lrg.jpg?httpAccept=%2A%2F%2A",
            "@multimediatype": "JPEG image file",
            "@type": "IMAGE-HIGH-RES",
            "@size": "193871",
            "@ref": "gr2",
            "@mimetype": "image/jpeg"
          },
          {
            "@category": "high",
            "@height": "1840",
            "@width": "2500",
            "@_fa": "true",
            "$": "https://api.elsevier.com/content/object/eid/1-s2.0-S0926860X16306056-gr3_lrg.jpg?httpAccept=%2A%2F%2A",
            "@multimediatype": "JPEG image file",
            "@type": "IMAGE-HIGH-RES",
            "@size": "258547",
            "@ref": "gr3",
            "@mimetype": "image/jpeg"
          },
          {
            "@category": "high",
            "@height": "2368",
            "@width": "2500",
            "@_fa": "true",
            "$": "https://api.elsevier.com/content/object/eid/1-s2.0-S0926860X16306056-gr4_lrg.jpg?httpAccept=%2A%2F%2A",
            "@multimediatype": "JPEG image file",
            "@type": "IMAGE-HIGH-RES",
            "@size": "311509",
            "@ref": "gr4",
            "@mimetype": "image/jpeg"
          },
          {
            "@category": "high",
            "@height": "803",
            "@width": "1667",
            "@_fa": "true",
            "$": "https://api.elsevier.com/content/object/eid/1-s2.0-S0926860X16306056-gr5_lrg.jpg?httpAccept=%2A%2F%2A",
            "@multimediatype": "JPEG image file",
            "@type": "IMAGE-HIGH-RES",
            "@size": "67107",
            "@ref": "gr5",
            "@mimetype": "image/jpeg"
          },
          {
            "@category": "high",
            "@height": "875",
            "@width": "1667",
            "@_fa": "true",
            "$": "https://api.elsevier.com/content/object/eid/1-s2.0-S0926860X16306056-gr6_lrg.jpg?httpAccept=%2A%2F%2A",
            "@multimediatype": "JPEG image file",
            "@type": "IMAGE-HIGH-RES",
            "@size": "105558",
            "@ref": "gr6",
            "@mimetype": "image/jpeg"
          },
          {
            "@category": "high",
            "@height": "792",
            "@width": "1667",
            "@_fa": "true",
            "$": "https://api.elsevier.com/content/object/eid/1-s2.0-S0926860X16306056-gr7_lrg.jpg?httpAccept=%2A%2F%2A",
            "@multimediatype": "JPEG image file",
            "@type": "IMAGE-HIGH-RES",
            "@size": "89886",
            "@ref": "gr7",
            "@mimetype": "image/jpeg"
          },
          {
            "@category": "high",
            "@height": "1204",
            "@width": "2500",
            "@_fa": "true",
            "$": "https://api.elsevier.com/content/object/eid/1-s2.0-S0926860X16306056-gr8_lrg.jpg?httpAccept=%2A%2F%2A",
            "@multimediatype": "JPEG image file",
            "@type": "IMAGE-HIGH-RES",
            "@size": "159168",
            "@ref": "gr8",
            "@mimetype": "image/jpeg"
          },
          {
            "@category": "high",
            "@height": "1215",
            "@width": "3222",
            "@_fa": "true",
            "$": "https://api.elsevier.com/content/object/eid/1-s2.0-S0926860X16306056-gr9_lrg.jpg?httpAccept=%2A%2F%2A",
            "@multimediatype": "JPEG image file",
            "@type": "IMAGE-HIGH-RES",
            "@size": "139660",
            "@ref": "gr9",
            "@mimetype": "image/jpeg"
          }
        ]
      },
      "link": {
        "@rel": "abstract",
        "@href": "https://api.elsevier.com/content/abstract/scopus_id/85006927604"
      }
    }
  }
}