{
  "metadata": {
    "title": "Catalytic performances of Ag/SiC catalysts for styrene epoxidation in O<ce:inf loc=post>2</ce:inf> atmosphere",
    "authors": "; ; ",
    "journal": "Applied Catalysis A: General",
    "date": "2024-12-25",
    "doi": "10.1016/j.apcata.2024.120004",
    "abstract": "",
    "uri": "https://api.elsevier.com/content/article/pii/S0926860X24004496",
    "pii": "S0926860X24004496"
  },
  "fulltext": {
    "full-text-retrieval-response": {
      "scopus-eid": "2-s2.0-85207696648",
      "originalText": "serial JL 271346 291210 291744 291809 31 Applied Catalysis A: General APPLIEDCATALYSISAGENERAL 2024-10-30 2024-10-30 2024-11-02 2024-11-02 2024-11-13T00:52:53 1-s2.0-S0926860X24004496 S0926-860X(24)00449-6 S0926860X24004496 10.1016/j.apcata.2024.120004 S300 S300.1 FULL-TEXT 1-s2.0-S0926860X24X00162 2024-11-13T00:57:40.159605Z 0 0 20241225 2024 2024-10-30T16:58:27.071316Z absattachment articleinfo articlenumber articletitlenorm authfirstinitialnorm authfirstsurnamenorm cid cids contenttype copyright crossmark dateloaded dateloadedtxt datesearch datesort dateupdated dco docsubtype doctype doi eid ewtransactionid hubeid indexeddate issn issnnorm itemstage itemtransactionid itemweight openaccess openarchive pg pgfirst pii piinorm pubdatestart pubdatetxt pubyr sortorder srctitle srctitlenorm srctype ssids alllist content subj subheadings suppl tomb volfirst volissue volumelist webpdf webpdfpagecount yearnav figure table e-component body mmlmath acknowledge affil appendices articletitle auth authfirstini authfull authkeywords authlast grantnumber grantsponsor highlightsabst orcid primabst ref specialabst 0926-860X 0926860X true 688 688 C Volume 688 13 120004 120004 120004 20241225 25 December 2024 2024-12-25 2024 article fla © 2024 Elsevier B.V. All rights are reserved, including those for text and data mining, AI training, and similar technologies. CATALYTICPERFORMANCESAGSICCATALYSTSFORSTYRENEEPOXIDATIONINO2ATMOSPHERE LI X 1 Introduction 2 Experimental sections 2.1 Catalyst preparation 2.2 Catalyst test 2.3 Catalyst characterization 2.4 Styrene adsorption determination 2.5 In-situ Raman test 2.6 The control experiment of styrene adsorption 2.7 O2 adsorption capacity and O/Ag ratio calculations 2.8 DFT calculations 3 Results and discussion 4 Conclusion CRediT authorship contribution statement Acknowledgements Appendix A Supplementary material References AYED 2023 e202216159 C SEBASTIAN 2006 208 218 J KALILURRAHIMAN 2006 216 225 A ZHANG 2021 21293 21298 H DEFAVERI 2011 1722 1760 G TYAGI 2011 171 177 B RAHMAN 2014 61 68 S AMOLI 2015 67089 67092 V JAIN 2019 4574 4581 R WEINSTOCK 2018 2680 2717 I RAHMAN 2015 46850 46860 S BROWN 2015 50 54 J JIANG 2008 221 228 J TIAN 2021 4946 4954 S WU 2022 117045 Y ZHANG 2016 57174 57182 H TUCI 2021 10559 10665 G HAO 2018 23029 23036 C JIAO 2019 2266 Z LI 2023 314 321 L JIN 2003 207 212 G YANG 2019 9751 9763 J VANDEVONDELE 2005 103 128 J PERDEW 1996 3865 3868 J GRIMME 2010 154104 S GRIMME 2011 1456 1465 S VANDEVONDELE 2007 114105 J GOEDECKER 1996 1703 1710 S HARTWIGSEN 1998 3641 3662 C LI 2021 11855 11866 F KLUST 2006 5025 5040 A LIU 2023 157935 J XIONG 2020 4773 M OZBEK 2011 230 235 M DUTOV 2016 150 156 V HU 2015 3758 3763 X ZHANG 2020 38 47 X GANNORUWA 2016 479 487 A LI 2021 1406 R KIM 2016 33074 S WANG 2017 658 664 Y PU 2019 10727 10750 T VANHOOF 2019 9829 9839 A DISSANAYAKE 2021 119573 S CAO 2018 388 395 L HERMAN 2015 51371 51381 V VARDHAN 2018 301 310 P ZHAO 2019 2006 2017 Y YABAGI 2018 012004 J KUHNE 2020 194103 T LACKNER 2019 17613 17620 P JIA 2012 158 165 L LIX2024X120004 LIX2024X120004XX 2026-11-02T00:00:00.000Z 2026-11-02T00:00:00.000Z http://creativecommons.org/licenses/by-nc-nd/4.0/ © 2024 Elsevier B.V. All rights are reserved, including those for text and data mining, AI training, and similar technologies. 2024-11-05T12:56:28.444Z http://vtw.elsevier.com/data/voc/AddOnTypes/50.7/aggregated-refined 2021DQ06 KYCX23_3024 http://sws.geonames.org/1814991 This work was supported by a project from CNPC-CZU Innovation Alliance (2021DQ06) and Postgraduate Research & Practice Innovation Program of Jiangsu Province (KYCX23_3024). https://doi.org/10.15223/policy-017 https://doi.org/10.15223/policy-037 https://doi.org/10.15223/policy-012 https://doi.org/10.15223/policy-029 https://doi.org/10.15223/policy-004 item S0926-860X(24)00449-6 S0926860X24004496 1-s2.0-S0926860X24004496 10.1016/j.apcata.2024.120004 271346 2024-11-13T00:57:40.159605Z 2024-12-25 1-s2.0-S0926860X24004496-main.pdf https://s3-eu-west-1.amazonaws.com/prod-ucs-content-store-eu-west/content/pii:S0926860X24004496/MAIN/application/pdf/43f9b2fa6891002261b83981faa95492/main.pdf main.pdf pdf true 3618527 MAIN 8 1-s2.0-S0926860X24004496-main_1.png https://s3-eu-west-1.amazonaws.com/prod-ucs-content-store-eu-west/content/pii:S0926860X24004496/PREVIEW/image/png/3f4917667c40479b72e35a66f871cd37/main_1.png main_1.png png 58858 849 656 IMAGE-WEB-PDF 1 1-s2.0-S0926860X24004496-gr9.jpg https://s3-eu-west-1.amazonaws.com/prod-ucs-content-store-eu-west/content/pii:S0926860X24004496/gr9/DOWNSAMPLED/image/jpeg/d02f00be7e912d49381bb5178d931a47/gr9.jpg gr9 gr9.jpg jpg 16542 228 282 IMAGE-DOWNSAMPLED 1-s2.0-S0926860X24004496-gr8.jpg https://s3-eu-west-1.amazonaws.com/prod-ucs-content-store-eu-west/content/pii:S0926860X24004496/gr8/DOWNSAMPLED/image/jpeg/a81783d92f64b1bc05f8f93fd68e6f29/gr8.jpg gr8 gr8.jpg jpg 35079 290 508 IMAGE-DOWNSAMPLED 1-s2.0-S0926860X24004496-gr5.jpg https://s3-eu-west-1.amazonaws.com/prod-ucs-content-store-eu-west/content/pii:S0926860X24004496/gr5/DOWNSAMPLED/image/jpeg/5a64f5c214d7c5b902678ecd9fa3bac4/gr5.jpg gr5 gr5.jpg jpg 17299 240 282 IMAGE-DOWNSAMPLED 1-s2.0-S0926860X24004496-gr4.jpg https://s3-eu-west-1.amazonaws.com/prod-ucs-content-store-eu-west/content/pii:S0926860X24004496/gr4/DOWNSAMPLED/image/jpeg/e0d1e54d97f8a81c7be6432b4e8a165f/gr4.jpg gr4 gr4.jpg jpg 29913 238 565 IMAGE-DOWNSAMPLED 1-s2.0-S0926860X24004496-gr7.jpg https://s3-eu-west-1.amazonaws.com/prod-ucs-content-store-eu-west/content/pii:S0926860X24004496/gr7/DOWNSAMPLED/image/jpeg/8ff3b062885fecceb88b2becb6e0aec0/gr7.jpg gr7 gr7.jpg jpg 29135 145 508 IMAGE-DOWNSAMPLED 1-s2.0-S0926860X24004496-gr6.jpg https://s3-eu-west-1.amazonaws.com/prod-ucs-content-store-eu-west/content/pii:S0926860X24004496/gr6/DOWNSAMPLED/image/jpeg/fc0d8d24aa85991b66eb6d24eeaedc60/gr6.jpg gr6 gr6.jpg jpg 33304 257 339 IMAGE-DOWNSAMPLED 1-s2.0-S0926860X24004496-gr1.jpg https://s3-eu-west-1.amazonaws.com/prod-ucs-content-store-eu-west/content/pii:S0926860X24004496/gr1/DOWNSAMPLED/image/jpeg/3fabf34ea4a9da9a43ec441e12308be6/gr1.jpg gr1 gr1.jpg jpg 61195 465 565 IMAGE-DOWNSAMPLED 1-s2.0-S0926860X24004496-gr3.jpg https://s3-eu-west-1.amazonaws.com/prod-ucs-content-store-eu-west/content/pii:S0926860X24004496/gr3/DOWNSAMPLED/image/jpeg/0bbfcd134e6320186d9d6c609e28d878/gr3.jpg gr3 gr3.jpg jpg 29034 245 565 IMAGE-DOWNSAMPLED 1-s2.0-S0926860X24004496-gr2.jpg https://s3-eu-west-1.amazonaws.com/prod-ucs-content-store-eu-west/content/pii:S0926860X24004496/gr2/DOWNSAMPLED/image/jpeg/08db3a82856c3e8b25931f81be39a0b2/gr2.jpg gr2 gr2.jpg jpg 50803 250 508 IMAGE-DOWNSAMPLED 1-s2.0-S0926860X24004496-ga1.jpg https://s3-eu-west-1.amazonaws.com/prod-ucs-content-store-eu-west/content/pii:S0926860X24004496/ga1/DOWNSAMPLED/image/jpeg/83e3807377db54453e5989b022ebbb3e/ga1.jpg ga1 true ga1.jpg jpg 21337 200 350 IMAGE-DOWNSAMPLED 1-s2.0-S0926860X24004496-gr9.sml https://s3-eu-west-1.amazonaws.com/prod-ucs-content-store-eu-west/content/pii:S0926860X24004496/gr9/THUMBNAIL/image/gif/2a642d75731cf8fdca16c128b2bf1d86/gr9.sml gr9 gr9.sml sml 12066 164 203 IMAGE-THUMBNAIL 1-s2.0-S0926860X24004496-gr8.sml https://s3-eu-west-1.amazonaws.com/prod-ucs-content-store-eu-west/content/pii:S0926860X24004496/gr8/THUMBNAIL/image/gif/d2c9c32c0f5dea862a075325366224f3/gr8.sml gr8 gr8.sml sml 10875 125 219 IMAGE-THUMBNAIL 1-s2.0-S0926860X24004496-gr5.sml https://s3-eu-west-1.amazonaws.com/prod-ucs-content-store-eu-west/content/pii:S0926860X24004496/gr5/THUMBNAIL/image/gif/1bab590ee0226c61d0aa333c74372d3e/gr5.sml gr5 gr5.sml sml 7385 164 193 IMAGE-THUMBNAIL 1-s2.0-S0926860X24004496-gr4.sml https://s3-eu-west-1.amazonaws.com/prod-ucs-content-store-eu-west/content/pii:S0926860X24004496/gr4/THUMBNAIL/image/gif/31f1d6d3a9b8f8ecb606510e1317e458/gr4.sml gr4 gr4.sml sml 6148 92 219 IMAGE-THUMBNAIL 1-s2.0-S0926860X24004496-gr7.sml https://s3-eu-west-1.amazonaws.com/prod-ucs-content-store-eu-west/content/pii:S0926860X24004496/gr7/THUMBNAIL/image/gif/e046ed502dfdddb04d824b331f1f3395/gr7.sml gr7 gr7.sml sml 8202 62 219 IMAGE-THUMBNAIL 1-s2.0-S0926860X24004496-gr6.sml https://s3-eu-west-1.amazonaws.com/prod-ucs-content-store-eu-west/content/pii:S0926860X24004496/gr6/THUMBNAIL/image/gif/224322f2ab2dd3716d2e1bc34b5ed493/gr6.sml gr6 gr6.sml sml 13564 164 216 IMAGE-THUMBNAIL 1-s2.0-S0926860X24004496-gr1.sml https://s3-eu-west-1.amazonaws.com/prod-ucs-content-store-eu-west/content/pii:S0926860X24004496/gr1/THUMBNAIL/image/gif/692742af75481cbf6f811913584cddff/gr1.sml gr1 gr1.sml sml 15137 164 199 IMAGE-THUMBNAIL 1-s2.0-S0926860X24004496-gr3.sml https://s3-eu-west-1.amazonaws.com/prod-ucs-content-store-eu-west/content/pii:S0926860X24004496/gr3/THUMBNAIL/image/gif/3c4a720584103a7a7e658023c7cc9987/gr3.sml gr3 gr3.sml sml 6488 95 219 IMAGE-THUMBNAIL 1-s2.0-S0926860X24004496-gr2.sml https://s3-eu-west-1.amazonaws.com/prod-ucs-content-store-eu-west/content/pii:S0926860X24004496/gr2/THUMBNAIL/image/gif/00b255125b8e8d3c52db42a2e8dc5963/gr2.sml gr2 gr2.sml sml 14986 108 219 IMAGE-THUMBNAIL 1-s2.0-S0926860X24004496-ga1.sml https://s3-eu-west-1.amazonaws.com/prod-ucs-content-store-eu-west/content/pii:S0926860X24004496/ga1/THUMBNAIL/image/gif/fbd13a58378fa8dccc75b5c89031eee0/ga1.sml ga1 true ga1.sml sml 11070 125 219 IMAGE-THUMBNAIL 1-s2.0-S0926860X24004496-gr9_lrg.jpg https://s3-eu-west-1.amazonaws.com/prod-ucs-content-store-eu-west/content/pii:S0926860X24004496/HIGHRES/image/jpeg/5559b8bc75a1be9bfd1e5ee96fd2ce4a/gr9_lrg.jpg gr9 gr9_lrg.jpg jpg 82068 1008 1247 IMAGE-HIGH-RES 1-s2.0-S0926860X24004496-gr8_lrg.jpg https://s3-eu-west-1.amazonaws.com/prod-ucs-content-store-eu-west/content/pii:S0926860X24004496/HIGHRES/image/jpeg/93bf1fd7e61f1478b055b3eba55494c9/gr8_lrg.jpg gr8 gr8_lrg.jpg jpg 153563 1282 2245 IMAGE-HIGH-RES 1-s2.0-S0926860X24004496-gr5_lrg.jpg https://s3-eu-west-1.amazonaws.com/prod-ucs-content-store-eu-west/content/pii:S0926860X24004496/HIGHRES/image/jpeg/14dc758adec52e7625d2538110659b1f/gr5_lrg.jpg gr5 gr5_lrg.jpg jpg 89186 1060 1247 IMAGE-HIGH-RES 1-s2.0-S0926860X24004496-gr4_lrg.jpg https://s3-eu-west-1.amazonaws.com/prod-ucs-content-store-eu-west/content/pii:S0926860X24004496/HIGHRES/image/jpeg/1492c42fef44c0aeb37de226c22ffa59/gr4_lrg.jpg gr4 gr4_lrg.jpg jpg 181854 1051 2495 IMAGE-HIGH-RES 1-s2.0-S0926860X24004496-gr7_lrg.jpg https://s3-eu-west-1.amazonaws.com/prod-ucs-content-store-eu-west/content/pii:S0926860X24004496/HIGHRES/image/jpeg/d4609ee639888e643c8c7bf2e306ed2f/gr7_lrg.jpg gr7 gr7_lrg.jpg jpg 134306 639 2245 IMAGE-HIGH-RES 1-s2.0-S0926860X24004496-gr6_lrg.jpg https://s3-eu-west-1.amazonaws.com/prod-ucs-content-store-eu-west/content/pii:S0926860X24004496/HIGHRES/image/jpeg/73339fbebac674ecfe1e9c40d9fdf1f2/gr6_lrg.jpg gr6 gr6_lrg.jpg jpg 195466 1137 1497 IMAGE-HIGH-RES 1-s2.0-S0926860X24004496-gr1_lrg.jpg https://s3-eu-west-1.amazonaws.com/prod-ucs-content-store-eu-west/content/pii:S0926860X24004496/HIGHRES/image/jpeg/9a4188772fe73a47cd70072a60ad3750/gr1_lrg.jpg gr1 gr1_lrg.jpg jpg 281405 2052 2495 IMAGE-HIGH-RES 1-s2.0-S0926860X24004496-gr3_lrg.jpg https://s3-eu-west-1.amazonaws.com/prod-ucs-content-store-eu-west/content/pii:S0926860X24004496/HIGHRES/image/jpeg/e4e0067d20c83ef4f5ab1fdb7f2c5662/gr3_lrg.jpg gr3 gr3_lrg.jpg jpg 158635 1080 2495 IMAGE-HIGH-RES 1-s2.0-S0926860X24004496-gr2_lrg.jpg https://s3-eu-west-1.amazonaws.com/prod-ucs-content-store-eu-west/content/pii:S0926860X24004496/HIGHRES/image/jpeg/aab12e5023806e6acbb236b98f7c975f/gr2_lrg.jpg gr2 gr2_lrg.jpg jpg 268946 1105 2245 IMAGE-HIGH-RES 1-s2.0-S0926860X24004496-ga1_lrg.jpg https://s3-eu-west-1.amazonaws.com/prod-ucs-content-store-eu-west/content/pii:S0926860X24004496/HIGHRES/image/jpeg/905c7776508ba7bac823479904eae0a8/ga1_lrg.jpg ga1 true ga1_lrg.jpg jpg 160186 886 1550 IMAGE-HIGH-RES 1-s2.0-S0926860X24004496-mmc1.docx https://s3-eu-west-1.amazonaws.com/prod-ucs-content-store-eu-west/content/pii:S0926860X24004496/mmc1/MAIN/application/vnd.openxmlformats-officedocument.wordprocessingml.document/ed5509da034485eb4b0e130460ed5fdd/mmc1.docx mmc1 mmc1.docx docx 3231068 APPLICATION 1-s2.0-S0926860X24004496-si0001.svg https://s3-eu-west-1.amazonaws.com/prod-ucs-content-store-eu-west/content/pii:S0926860X24004496/image/svg+xml/f7ab061a0be18067352100220e2d59f4/si0001.svg si0001 si0001.svg svg 4757 ALTIMG 1-s2.0-S0926860X24004496-si0002.svg https://s3-eu-west-1.amazonaws.com/prod-ucs-content-store-eu-west/content/pii:S0926860X24004496/image/svg+xml/e782f29db150a8993a5474cd6561989f/si0002.svg si0002 si0002.svg svg 4883 ALTIMG 1-s2.0-S0926860X24004496-si0003.svg https://s3-eu-west-1.amazonaws.com/prod-ucs-content-store-eu-west/content/pii:S0926860X24004496/image/svg+xml/3534729cc4feb7aabac594e1f6bd6132/si0003.svg si0003 si0003.svg svg 2718 ALTIMG 1-s2.0-S0926860X24004496-si0004.svg https://s3-eu-west-1.amazonaws.com/prod-ucs-content-store-eu-west/content/pii:S0926860X24004496/image/svg+xml/3854bd1380f365ec5f9d8b981d65a077/si0004.svg si0004 si0004.svg svg 5255 ALTIMG 1-s2.0-S0926860X24004496-si0005.svg https://s3-eu-west-1.amazonaws.com/prod-ucs-content-store-eu-west/content/pii:S0926860X24004496/image/svg+xml/6f64eb8e9154450b2fe3831cb775033e/si0005.svg si0005 si0005.svg svg 1243 ALTIMG 1-s2.0-S0926860X24004496-si0006.svg https://s3-eu-west-1.amazonaws.com/prod-ucs-content-store-eu-west/content/pii:S0926860X24004496/image/svg+xml/940df53b6d2b4e350c17113a5f6f97f1/si0006.svg si0006 si0006.svg svg 1284 ALTIMG 1-s2.0-S0926860X24004496-si0007.svg https://s3-eu-west-1.amazonaws.com/prod-ucs-content-store-eu-west/content/pii:S0926860X24004496/image/svg+xml/483356fb981a7a34aceca6a277c4d2c7/si0007.svg si0007 si0007.svg svg 5490 ALTIMG 1-s2.0-S0926860X24004496-si0008.svg https://s3-eu-west-1.amazonaws.com/prod-ucs-content-store-eu-west/content/pii:S0926860X24004496/image/svg+xml/820686dff787f75a7a5080ea2b367d4a/si0008.svg si0008 si0008.svg svg 1130 ALTIMG 1-s2.0-S0926860X24004496-si0009.svg https://s3-eu-west-1.amazonaws.com/prod-ucs-content-store-eu-west/content/pii:S0926860X24004496/image/svg+xml/c8f6428d133f73fa8a7ddf9f0a07d3f8/si0009.svg si0009 si0009.svg svg 1227 ALTIMG 1-s2.0-S0926860X24004496-si0010.svg https://s3-eu-west-1.amazonaws.com/prod-ucs-content-store-eu-west/content/pii:S0926860X24004496/image/svg+xml/3130d2e0c843cef44f4c9ee4307596ee/si0010.svg si0010 si0010.svg svg 1227 ALTIMG 1-s2.0-S0926860X24004496-si0011.svg https://s3-eu-west-1.amazonaws.com/prod-ucs-content-store-eu-west/content/pii:S0926860X24004496/image/svg+xml/43a22a05fb72868d1d5bac306e1ef90b/si0011.svg si0011 si0011.svg svg 1243 ALTIMG 1-s2.0-S0926860X24004496-si0012.svg https://s3-eu-west-1.amazonaws.com/prod-ucs-content-store-eu-west/content/pii:S0926860X24004496/image/svg+xml/940df53b6d2b4e350c17113a5f6f97f1/si0012.svg si0012 si0012.svg svg 1284 ALTIMG 1-s2.0-S0926860X24004496-si0013.svg https://s3-eu-west-1.amazonaws.com/prod-ucs-content-store-eu-west/content/pii:S0926860X24004496/image/svg+xml/3c8945b2ebc4030318088ac562a04f79/si0013.svg si0013 si0013.svg svg 3059 ALTIMG 1-s2.0-S0926860X24004496-si0014.svg https://s3-eu-west-1.amazonaws.com/prod-ucs-content-store-eu-west/content/pii:S0926860X24004496/image/svg+xml/47f9a8f139da0dc9be6dc1179720f5a4/si0014.svg si0014 si0014.svg svg 1953 ALTIMG 1-s2.0-S0926860X24004496-si0015.svg https://s3-eu-west-1.amazonaws.com/prod-ucs-content-store-eu-west/content/pii:S0926860X24004496/image/svg+xml/8ae5a80ababd1daa84dc055d917ad489/si0015.svg si0015 si0015.svg svg 1337 ALTIMG 1-s2.0-S0926860X24004496-si0016.svg https://s3-eu-west-1.amazonaws.com/prod-ucs-content-store-eu-west/content/pii:S0926860X24004496/image/svg+xml/865c7ecd019d88628a39d56f34433932/si0016.svg si0016 si0016.svg svg 1632 ALTIMG APCATA 120004 120004 S0926-860X(24)00449-6 10.1016/j.apcata.2024.120004 Elsevier B.V. Fig. 1 Dependences of catalytic performances of Ag(5 %)/SiC on reaction time (a), temperature (b) and O2 pressure (c), and the comparison of different Ag-loaded catalysts under optimal reaction condition (d). Fig. 1 Fig. 2 TEM image (a) and high-resolution TEM image (b) of Ag(5 %)/SiC catalyst. Fig. 2 Fig. 3 XPS spectra (a) and XPS Auger spectra (b) of Ag(5 %)/SiC catalyst. Fig. 3 Fig. 4 EPR spectra of Ag(5 %)/SiC catalyst. Fig. 4 Fig. 5 Desorption curves of styrene adsorbed on SiC and Ag(5 %)/SiC. Fig. 5 Fig. 6 In-situ FTIR spectra of styrene adsorbed on SiC and Ag(5 %)/SiC. Fig. 6 Fig. 7 The adsorption configurations (side view) of styrene on Si-terminated SiC (a), C-terminated SiC (b) and Ag surface (c). Fig. 7 Fig. 8 Proposed reaction mechanism of styrene epoxidation on Ag/SiC. Fig. 8 Fig. 9 Recycle stability of Ag(5 %)/SiC catalyst in the styrene epoxidation. Fig. 9 Table 1 The amount of active oxygen on different catalysts. Table 1 Catalysts Amount of reactive oxygen species (spins/mm3) 1O2 •O2 - Ag(1 %)/SiC 8.280×1010 8.371×1011 Ag(3 %)/SiC 8.626×1010 1.226×1012 Ag(5 %)/SiC 8.891×1010 2.384×1012 Ag(7 %)/SiC 8.909×1010 3.349×1012 Catalytic performances of Ag/SiC catalysts for styrene epoxidation in O2 atmosphere Xiang Li Writing – original draft Investigation Funding acquisition Formal analysis Data curation Conceptualization a b Zhi-Feng Jiao Writing – review & editing Validation Methodology Formal analysis Conceptualization b ⁎ Ji-Xiao Zhao Supervision Project administration Methodology Conceptualization b Tian-Yu Xu Methodology Data curation b Xiang-Yun Guo Writing – review & editing Supervision Resources Methodology Funding acquisition Conceptualization b ⁎ a School of Materials Science and Engineering, Changzhou University, Changzhou 213164, China School of Materials Science and Engineering, Changzhou University Changzhou 213164 China School of Materials Science and Engineering, Changzhou University, Changzhou 213164, China b Jiangsu Key Laboratory of Green Catalytic Materials and Technology, School of Petrochemical Engineering, Changzhou University, Changzhou 213164, China Jiangsu Key Laboratory of Green Catalytic Materials and Technology, School of Petrochemical Engineering, Changzhou University Changzhou 213164 China Jiangsu Key Laboratory of Green Catalytic Materials and Technology, School of Petrochemical Engineering, Changzhou University, Changzhou 213164, China ⁎ Corresponding authors. SiC supported Ag catalysts were prepared by an impregnation-reduction method for styrene epoxidation in O2 atmosphere. Under the condition of 100 °C, 0.5 MPa O2 and 4 h, 5 wt% Ag/SiC catalyst achieved styrene conversion of 98.5 % and styrene oxide selectivity of 69.7 %. Further studies show that O2 was activated on the Ag surface and then formed reactive oxygen species, 1O2 and •O2 -. Based on the O2 adsorption results, the atomic ratio of O/Ag larger than 0.5 indicated that more oxygen species had spilled over to the SiC surface. In-situ diffuse reflectance Fourier transform infrared spectroscopy and Density Functional Theory calculation results showed that styrene was adsorbed on the SiC surface. The active oxygen species generated on the Ag surface could spill over to the SiC surface, reacting with the adsorbed styrene to produce styrene oxide or benzaldehyde. In addition, the catalyst exhibits good stability. Graphical Abstract Keywords Ag/SiC catalyst Styrene epoxidation Active oxygen species Oxygen spillover Data Availability Data will be made available on request. 1 Introduction Styrene oxide (SO) is an important chemical intermediate for producing perfumes, epoxy resins, drugs, sweeteners and others [1]. Traditionally, SO was mainly produced through the dehydrochlorination of styrene chlorohydrin with a base or by oxidizing styrene with organic peracids [2,3]. However, these methods suffer from issues such as environmental pollution, equipment corrosion and poor selectivity. Recently, the catalytic epoxidation of styrene has gained increasing attention as it is a green and energy-efficient route to prepare SO. H2O2, tert-butyl hydroperoxide (TBHP), and O2 have been used as oxidants in the catalytic epoxidation of styrene [4,5]. Among them, O2 is regarded as the most ideal oxidant for the reaction because it is non-toxic, non-corrosive, low-cost and pollution-free. Therefore, it is of great significance to develop highly efficient heterogeneous catalysts for styrene epoxidation in O2 atmosphere. In recent years, researchers have developed various catalysts aimed at achieving the catalytic epoxidation of styrene under O2 atmosphere [6–10]. Rahman et al. reported that indium oxide nanoparticles dispersed on mesoporous silica could activate molecular O₂ and produce SO with a selectivity of 60 % and a conversion of approximately 25 % [11]. Brown et al. prepared a MOF-525-Mn catalyst, which converted styrene to styrene oxide with a yield of 82.8 % [12]. Jiang et al. developed a Co/TS-1 catalyst for the epoxidation reaction in O2 atmosphere and achieved a styrene conversion of 94.5 % and a SO selectivity of 74.3 % at 100 °C [13]. Tian et al. reported a single-atomic-site Ag catalyst supported by mesoporous graphitic carbon nitride, which exhibited a styrene conversion of 96 % and a SO selectivity of 81 % at 100 °C under O2 atmosphere [14]. The epoxidation reaction of alkenes is strongly exothermic, and the heat released in the reaction easily accumulates on the catalytically active sites, leading to a rapid temperature rise of the active sites [15]. Hence, the supported metal particles, especially silver particles, are prone to sintering or aggregation during the process. Therefore, the carriers with good chemical stability and thermal conductivity are desired. Silicon carbide (SiC) is a non-oxide semiconductor with excellent electrical and thermal conductivity, making it a suitable carrier for epoxidation reactions [16,17]. Additionally, some reactants such as nitrobenzene, nitriles, and cinnamic aldehyde are easily adsorbed and activated by the surface of SiC, making it a promising support material in catalysis [18–20]. In this work, we employed a high specific surface area SiC as the carrier and successfully prepared highly dispersed Ag/SiC catalysts. A 5 wt% catalyst can efficiently catalyze the epoxidation of styrene to SO in O2, and achieve a styrene conversion of 98.5 % and a SO selectivity of 69.7 % at 100 °C. Further studies suggest that styrene is adsorbed on the SiC surface and then it reacts with the active oxygen species spilling over from Ag particles. Additionally, the catalyst also shows good stability. 2 Experimental sections 2.1 Catalyst preparation Powder-like SiC carrier with a specific surface area of 68 m2/g was purchased from ReginTech, which was prepared by the carbothermal reduction of a carbonaceous silica xerogel [21]. The SiC carrier was treated with a mixture of HCl and HF to remove possible metals, oxides and other impurities before use. The preparation of 5 wt% Ag/SiC catalyst was described as follows. Firstly, 0.85 g of SiC was dispersed in 30 mL of anhydrous ethanol, and the suspension was magnetically stirred for 10 min. Then, 5 mL of AgNO3 solution (0.046 M) was added dropwise into the suspension under stirring. After 2 h stirring, the mixture was transferred to a rotary evaporator to get a solid AgNO3 and SiC mixture. Next, the solid mixture was transferred to a porcelain boat and calcined at 400 °C for 4 h in air atmosphere. After cooling to room temperature, the catalyst of 5 wt% Ag/SiC was obtained, which was marked as Ag(5 %)/SiC. Similarly, Ag(1 %)/SiC, Ag(3 %)/SiC and Ag(7 %)/SiC catalysts can be prepared by the similar process. 2.2 Catalyst test The epoxidation reaction of styrene was carried out in a 50 mL stirred-tank reactor equipped with heating and magnetic stirring functions. In a typical reaction, 4 mmol of styrene, 150 mg of Ag(5 %)/SiC catalyst, 15 mL of 1,4-dioxane, and 0.5 MPa of oxygen were sealed in the reactor. The reaction liquid was stirred by magnetic agitation (rotation speed at 500 r/min) during the reaction. The mixture was heated (at a rate of 5 °C /min) to 100 °C. After 4 hours of reaction, the filtrate was obtained through the Millipore filter (pore size 0.22 μm). The filtrate and methanol were diluted in a ratio of 1:100. Finally, gas chromatography-mass spectrometry (GC-MS, Shimadzu GCMS-QP2010 SE) was used for analysis. Detailed chromatographic methods of analysis are given in the Supporting Information. The styrene conversion rate, SO selectivity, SO yield, and turnover frequency (TOF) were calculated using formulas (1)-(4): (1) Conversion = Initial mole number − Final mole number Initial mole number × 100 % # (2) Selectivity = mole number of product mole number of all products × 100 % # (3) Yield = Conversion × Selectivity# (4) TOF = Moles of styrene oxide formed m × w Ag × D Ag × reaction time / M Ag # where m is the mass of the Ag/SiC catalyst, w Ag is the mass fraction of Ag in the catalyst, D Ag is the dispersion degree of Ag on the catalyst surface, and M[Ag] is the relative atomic mass of Ag. 2.3 Catalyst characterization The structure and morphology of the Ag/SiC catalysts were characterized by powder X-ray diffractometer (XRD, D/MAX 2500PC) and transmission electron microscope (TEM, FEI Talos F200x G2, 200 kV). The valence state of Ag was determined by X-ray photoelectron spectroscopy (XPS, Thermo Fischer ESCALAB Xi +) and XPS Auger spectroscopy, and the values of binding energy were corrected by the C1s peak (284.8 eV) [22]. The ultraviolet-visible spectroscopy was measured using a spectrophotometer (UV–vis, UV-2600i). The reactive oxygen species (ROS) in the reaction system were determined using electron paramagnetic resonance spectroscopy (EPR, Bruker EMX PLUS). The oxygen adsorption capacity and Ag dispersion were tested by a multifunctional atomic adsorption instrument (Xianquan, TP-5080D). The adsorption of styrene was studied by using the Xianquan adsorption instrument and in-situ diffuse reflectance Fourier transform infrared spectroscopy (In-situ FTIR, Nicolet IS 50). The activation of O₂ on the catalyst surface was studied by in-situ Raman spectroscopy (In-situ Raman, Alpha300R, WITec GmbH). The In-situ Raman analysis was performed using a confocal Raman microscope. The microscope was equipped with a TEM single-frequency laser (λ = 532 nm, laser power = 40 mW). The adsorption energies of styrene on SiC and Ag surfaces were calculated by density functional theory (DFT). 2.4 Styrene adsorption determination Firstly, 0.3 g of powder sample were loaded into the adsorption instrument, and then the sample was pretreated at 650 °C under a N2 flow (30 mL/min) for 1 hour to remove possible impurities. Subsequently, 1 mL of styrene was added to the pretreated sample. After the styrene was fully adsorbed on the sample surface (about 30 minutes), it was purged by N2 (30 mL/min) to get a stable baseline. Then the temperature-programmed desorption (TPD) began at 40 °C with a heating rate of 10 °C/min. The In-situ FTIR was employed to determine the adsorption of styrene on the catalyst surface. The sample was firstly pretreated at 200 °C in Ar for 30 minutes, and then three drops (approximately 0.3 mL) of styrene were added. After the sample was purged in Ar (50 mL/min) for 30 minutes, the vacuum system was turned on and the vacuum degree was remained about 10 Pa until the measurement was completed. 2.5 In-situ Raman test The In-situ Raman test was carried out as follows: the sample was pretreated for 30 min at 120 °C under an Ar gas flow (30 mL/min). After cooling to room temperature, the gas flow was switched from Ar to O2 (30 mL/min), and the sample was heated at a rate of 5 °C/min to 100 °C for 1 h. Then, Raman tests were conducted at 25, 50, 75, and 100 °C, and the tests were also conducted at 100 °C for 0.5 and 1 h. 2.6 The control experiment of styrene adsorption The control experiments were carried out as follows: (1) 500 mg of the SiC carrier was soaked in a mixed solution containing 0.5 mL of styrene and 10 mL of ethanol for 1 hour. Then, the SiC solid was filtered out and dried at 40 °C for 5 hours. After this treatment, only adsorbed styrene remained on the SiC surface, and the sample was named as styrene/SiC. (2) 5 mg of the catalyst was thoroughly mixed with 10, 30, 50, 70, and 100 mg of styrene/SiC, respectively, and placed in a steel reactor. Subsequently, 0.5 MPa of H2 or O2 was pressured into the reactor, and the temperature was maintained at 100 °C for 4 h to ensure the adsorbed styrene was completely converted. Lastly, 2 mL of ethanol was added to the reactor and ultrasonicated for 10 minutes to extract any possible reaction products. The product was analyzed using GC-MS. 2.7 O2 adsorption capacity and O/Ag ratio calculations The O2 adsorption capacity was measured as follows: 0.1 g of Ag/SiC catalyst was placed in the adsorption instrument and treated in a N2 flow of 30 mL/min at 400 °C for 1 hour to remove possible adsorbed impurities, and then naturally cooled to 40 °C. Next, the O2 adsorption capacity was measured by using the pulse adsorption method. The dispersion of Ag was determined using a similar method: 0.1 g of catalyst was pretreated and then cooled to 40 °C for H2 pulse adsorption. The H2 adsorption capacity was measured, and the dispersion of Ag was calculated. The O/Ag atomic ratio was calculated using the following formula (5): (5) O / Ag = n O n Ag = q O 2 × m × 2 m × w Ag × D Ag / 107.9 = 215.8 × q O 2 w Ag × D Ag # where n O and n Ag represent the moles of O and Ag atoms, respectively. q O 2 is the O2 adsorption capacity, m is the mass of the Ag/SiC catalyst, w Ag is the mass fraction of Ag in the catalyst, and D Ag is the dispersion degree of Ag on the catalyst surface. 2.8 DFT calculations DFT calculations in this work were carried out using the CP2K package version-2022.1 with Gaussian Plane Wave (GPW) method implemented in the QUICKSTEP module [23]. Perdew-Burke-Ernzerhof (PBE) [24] exchange-correlation (XC) functional with Grimme-D3 [25,26] dispersion correction method was employed. Both the double-zeta valence polarized (DZVP) sets and Goedecker-Teter-Hutter (GTH) pseudopotentials were adopted [27–29]. Plane wave and relative cut-offs were set to 400 and 55 Ry, respectively. The inner and outer SCF convergence criteria were set to 1.0 × 10−6 Ha. The SiC (1 1 1) and Ag (1 1 1) surfaces were simulated using slab models with 3 × 3 (18.47 Å × 18.47 Å) and 5 × 5 (14.45 Å × 14.45 Å) surface unit cell periodicity, respectively. In order to avoid interactions between periodic images, a vacuum distance of 20 Å was imposed between different layers. The geometrical optimizations were implemented at the Γ point for all surface structures, with all the atoms being relaxed. Root mean square and maximum force convergence were set to 3.0 × 10−4 and 4.5 × 10−4 Ha·Å−1, respectively. The adsorption energies were calculated according to the following equation: (6) E ads = E slab + adsorbate − E slab − E adsorbate # where E slab + adsorbate , E slab , and E adsorbate are the calculated electronic energy of species adsorbed on the surface, the bare surface, and the gas-phase molecule, respectively. 3 Results and discussion The influences of reaction conditions on the catalytic performances of the Ag(5 %)/SiC catalyst for styrene epoxidation were investigated. Fig. 1(a) shows the performances of the catalyst at 0.5 MPa and 100 °C for different reaction times. From the figure, the styrene conversion gradually increased with the reaction time and reached 98.5 % at 4 hours. However, when the reaction time exceeded 4 h, the selectivity of SO decreased slightly, and the proportion of benzaldehyde (BAL) as a by-product increased. When the reaction time was 0.5 h, the product was mainly BAL. This may be due to O₂ being first transformed into superoxide anion radical (•O2 -) on Ag surface, which then further react with styrene to produce BAL [30]. Therefore, the best performance was achieved at a reaction time of 4 hours. To study the effects of reaction temperature and O2 pressure on the styrene conversion and SO selectivity, the reaction time was selected as 1 h to ensure a middle level of styrene conversion. The effect of reaction temperature is shown in Fig. 1(b). No product was observed at 70 °C, this is because the oxygen needs to be activated at ∼75 °C (Fig.S1). The styrene conversion and the SO selectivity were very low when the temperature increased to 80 °C and 90 °C. Both the conversion and selectivity increased rapidly at 100 °C, indicating that styrene could be effectively converted to SO at 100 °C. This is consistent with the reported work [14]. Fig. 1(c) shows the effect of O2 pressure on the styrene conversion and SO selectivity at 100 °C. As the O2 pressure increased from 0.1 MPa to 1 MPa, the conversion gradually increased to ∼ 55 % and then slightly decreased, while the SO selectivity consistently showed a downward trend. When the O2 pressure was 0.3 MPa and 0.5 MPa, the yields of SO were 24.6 % and 33.5 %, respectively (corresponding TOF were 30 h−1 and 40.8 h−1, respectively). Therefore, the O2 pressure of 0.5 MPa is suitable for the reaction. In addition, some other by-products (benzoic acid, 1-Phenyl-1,2-ethanediol and acetophenone) are present in the reaction, and their overall selectivity is less than ∼5 %. These by-products are common in styrene epoxidation reactions [31,32]. Under the optimal conditions, 0.5 MPa of O2 pressure, 100 °C and 4 h, the catalytic performances of Ag/SiC with different Ag loadings were further investigated, as shown in Fig. 1(d). Without any catalyst, the styrene conversion was approximately 7.8 % and the SO selectivity was 58.6 %, which are similar to the reported in literature [13,33]. In the presence of Ag/SiC catalyst, the styrene conversion increased rapidly. As the Ag loading increased from 1 wt% to 7 wt%, the styrene conversions increased from 18.5 % to 98.5 %, indicating that the Ag/SiC catalysts could effectively catalyze the epoxidation reaction. In the epoxidation reaction, the metallic Ag functions as the active sites to activate oxygen [34]. Obviously, more Ag particles will produce more active Ag surfaces. The number of Ag particles on SiC increases with the Ag loading when the Ag loading is less than 5 wt% (Fig.S2). When the Ag loading exceeds 5 wt%, further continuing increase in Ag loading will lead to an increase in the size of Ag particles, but not an increase in the active Ag surface. So, in this work, the optimal Ag loading was 5 wt%. The turnover frequency (TOF) values for the four catalysts were calculated to be 42.2, 76.4, 83.7, and 73.0 h−1, respectively, and the TOF value of Ag(5 %)/SiC catalyst was the highest. As compared with reported results (Table S1), Ag(5 %)/SiC is a promising catalyst for styrene epoxidation. The morphology and size distribution of Ag particles in Ag(5 %)/SiC catalyst were characterized using TEM, as shown in Fig. 2. From Fig. 2(a), the Ag particles on the SiC surface are uniformly dispersed and have a quasi-spherical morphology. The average size of Ag particles was statistically calculated to be 3.2 nm. Fig. 2(b) presents a high-resolution TEM image of a particle, in which the lattice fringes of the particle can be clearly observed and the lattice spacing is 0.238 nm, corresponding to the (111) crystal plane spacing of Ag [35]. In addition, XRD patterns (Fig.S3) of Ag/SiC catalysts also showed apparent diffraction peaks of β-SiC and Ag. The relatively weak Ag diffraction peaks indicate that the Ag particles are highly dispersed on the support surface [36]. This is also consistent with the TEM results shown in Fig. 2(a). XPS was used to determine the chemical state of Ag in Ag(5 %)/SiC catalyst. Typically, the binding energy (BE) of metallic Ag 3d5/2 is in the range of 367.9–368.5 eV, and the BE of Ag 3d3/2 is in the range of 373.9–375.0 eV [36–38]. Unlike common metals, the BE value of oxidized Ag is usually lower than that of metallic Ag [39]. Fig. 3(a) shows the XPS spectra of Ag 3d region, from which the BEs of Ag 3d5/2 and Ag 3d3/2 are 368.5 eV and 374.5 eV, respectively, indicating that the Ag on the catalyst surface is in a metallic state (Ag0). Since the BEs of metallic and oxidized Ag are similar, XPS Auger spectroscopy was used to further distinguish them. Fig. 3(b) shows the Ag MNN XPS Auger peak of Ag(5 %)/SiC catalyst, in which a significant peak appears at 351.8 eV, indicating that the Ag in Ag(5 %)/SiC is metallic [40]. Similarly, the Ag in Ag(1 %)/SiC, Ag(3 %)/SiC and Ag(7 %)/SiC is also metallic (Fig.S4). The UV–vis spectra of Ag/SiC catalysts were further measured. In the spectra (Fig.S5), obvious protrusions present at around 410 nm, which are caused by the localized surface plasmon resonance of Ag nanoparticles [38], further confirming the existence of metallic Ag nanoparticles. In addition, the SiC carrier is a n-type semiconductor with a bandgap of 2.36 eV [41]. Since the work function of Ag (4.26 eV) is higher than that of SiC (4 eV), the electron transfer can occur from SiC to Ag due to the Mott-Schottky effect, resulting in electron-rich metallic Ag. This is consistent with the XPS results. The adsorption capacity of Ag/SiC catalysts was determined by O2 pulse adsorption. For the Ag(5 %)/SiC catalyst, the measured O2 adsorption capacity was 33.2 μmol/g. Moreover, the O2 adsorption capacity of catalysts gradually increased with the increase of Ag loading (Table S2). This indicates that supported Ag particles can activate O2 [42,43]. The dispersion of Ag in Ag(5 %)/SiC estimated by the H2 pulse adsorption was 0.118, and the further calculated O/Ag atomic ratio was 1.2. The lower the Ag loading, the higher the O/Ag ratio (Table S2). The O/Ag ratios in Ag/SiC catalysts are all larger than 0.5, indicating that most of oxygen species have spilled over to the surface of SiC carrier. The reactive oxygen species on Ag/SiC catalysts in the styrene epoxidation were determined by EPR at 30 min. 2,2,6,6-tetramethylpiperidine (TEMP) and 5,5-dimethyl-1-pyrroline-N-oxide (DMPO) were used as capture agents for singlet oxygen(1O2) and •O2 -, respectively. Fig. 4(a) shows the results of TEMP-1O2 test, with a characteristic of 1:1:1 triplet line, confirming the formation of 1O2 in the system [44]. Fig. 4(b) shows the results of DMPO-•O2 - test, with six distinct peaks, four strong and two weak peaks. The four strong peaks exhibit a 1:1:1:1 intensity ratio, confirming the presence of •O2 - radicals [45]. It is established that 1O2 is crucial for the formation of SO while •O2 - primarily lead to the byproduct BAL [30]. Further, the amount of reactive oxygen species was tested on different catalysts, as shown in Table 1. The amounts of both 1O2 and •O2 - increased with the increase of Ag loading. Among them, the content of •O2 - is significantly higher than that of 1O2. This may be related to the activation process of O2. In this work, O2 was first converted to •O2 - and then further transformed to 1O2. After O2 was introduced for 30 min, much of O2 had already been converted to •O2 -, and the transformation of •O2 - to 1O2 was low. Hence, most of the products are BAL when the reaction time is 30 min (Fig. 1(a)). Besides, when the Ag loading increased from 5 wt% to 7 wt%, •O2 - increased rapidly while the 1O2 increased slightly. This is consistent with the performance results in Fig. 1(d). The above results further demonstrate that 1O2 is essential for the formation of SO, while •O2 - primarily leads to the production of BAL. The adsorption of styrene on SiC and Ag(5 %)/SiC were measured by TPD, and the results were shown in Fig. 5. It can be clearly seen that there are two desorption peaks on the two samples. The first desorption peak on SiC appears at about 190 °C, which is slightly higher than the boiling point of styrene (145.2 °C), indicating that the desorption is caused by physically adsorbed styrene. For Ag(5 %)/SiC, the peak shifted to ∼210 °C and its area increased evidently, which may be attributed to the adsorption of styrene on the surface of Ag particles. The second desorption peak appears at about 450 °C, indicating that these styrene molecules are chemisorbed. It is worth noting that the second peak is very similar on both curves, suggesting that the chemical adsorption of styrene may occur mainly on the surface of SiC carrier. In-situ FTIR was used to further verify the adsorption of styrene, and SiC and Ag(5 %)/SiC samples were diluted with KBr (the mass ratio is 1:150) in the measurement. From Fig. 6, the IR spectra of styrene on KBr present a series of adsorption bands. Specifically, the bands at 1681 and 1629 cm−1 can be attributed to the CC stretching vibration of the vinyl group in styrene [31,46], the bands between 1600 and 1500 cm−1 to the stretching vibration of the aromatic CC bond [47], the bands at 1494 and 1449 cm−1 to the phenyl C-C ring extensions [31], and the peak of 1412 cm−1 to the vinyl =CH2 deformation of the styrene molecule [31]. Compared with the spectra of styrene on KBr, the spectra of styrene on SiC and Ag(5 %)/SiC exhibit significant differences. All the absorption bands relative to the vinyl group, 1681, 1629 and 1412 cm−1, show obvious blue shifts to 1685, 1636 and 1420 cm−1, respectively. Other absorption bands at 1540, 1521, 1516, 1488 and 1472 cm−1 are assigned to the skeletal vibrations of aromatic ring [47–49]. In addition, the IR spectra of styrene on SiC and Ag(5 %)/SiC also exhibit visible changes, especially in the range of 1450–1550 cm−1, which may be caused by the presence of Ag particles. From these IR results, it is evident that the chemisorption of styrene on Ag5/SiC occurs mainly on the surface of SiC. In addition, a control experiment was conducted to demonstrate the adsorption of styrene on the SiC surface. 30 mg of the composite of styrene/SiC was mixed with 5 mg Ag(5 %)/SiC as the catalyst for the epoxidation reaction. However, no product was detected under the given conditions. When Ag(5 %)/SiC was replaced by Pt(5 %)/SiC, the hydrogenated product (ethylbenzene) could be found under H2 reaction conditions (Fig.S6). This is because the active hydrogen dissociated from Pt/SiC spills over to styrene/SiC and reacts with adsorbed styrene. In contrast, under O2 reaction conditions, the spillover distance of oxygen species is too short to reach the surface of the styrene/SiC composite. Furthermore, the adsorption energies of styrene on SiC and Ag surfaces were calculated by DFT. DFT calculations in this work were carried out using the CP2K package version-2022.1 [50], and more details can be found elsewhere. Fig. 7 shows the adsorption configurations (side view) of styrene on SiC (111) and Ag (111) surfaces. The calculated adsorption energies were −6.028 eV for Si-terminated SiC, −5.583 eV for C-terminated SiC and −1.906 eV for Ag, respectively. These results indicate that styrene molecules will be preferentially adsorbed on the SiC surface. Generally, the length of the CC bond in styrene is 1.344 Å. After adsorption, the calculated CC bond lengths are 1.486 Å (Si-terminated), 1.507 Å (C-terminated) and 1.373 Å (Ag) respectively, indicating that the CC bond was activated on the SiC surface and participated in the epoxidation reaction. According to the above experimental and calculation results, it is suggested that styrene is adsorbed on SiC surface while O2 is activated on the Ag surface in the epoxidation. Referring to relevant studies on spillover [51,52], a plausible reaction mechanism is proposed for understanding the epoxidation of styrene on Ag/SiC, as shown in Fig. 8. During the reaction, O2 is firstly adsorbed on the Ag surface. These adsorbed O2 molecules can form •O2 - radicals or singlet 1O2, and then spillover to SiC surface. The styrene adsorbed on SiC surface reacts with the spilled •O2 - to produce BAL (route I), or reacts with 1O2 to produce SO (route II). This mechanism differs from common viewpoints, where both O2 and styrene are activated on the Ag surface. Finally, the stability of Ag(5 %)/SiC catalyst was evaluated through recycling experiments, and the results were shown in Fig. 9. After five cycles, the conversion of styrene remained almost unchanged, while the selectivity of SO showed a slightly decrease. TEM characterizations indicate that Ag nanoparticles still remain good dispersion on SiC surface (Fig.S7). However, the mean size of Ag particles has a slight increase from initial 3.2 nm to 3.8 nm. The XPS analysis of the used catalyst shows that Ag⁰ and a small amount of Ag⁺ coexist in the catalyst (Fig.S8). The slight increase in Ag particle size and the minor change of Ag state may lead to the decreasing of SO selectivity. The stability of other carriers supported Ag catalysts were also tested (Fig.S9). Compare with Ag(5 %)/SiC, the epoxidation performance of Ag(5 %)/Al2O3 and Ag(5 %)/SiO2 showed a significant decrease after 3 cycles, and the color of Ag(5 %)/Al2O3 changed significantly (Fig.S10). The above results show that Ag(5 %)/SiC is a promising catalyst for the epoxidation of styrene. 4 Conclusion In summary, we successfully prepared a 5 wt% Ag/SiC catalyst, in which Ag particles were uniformly distributed on SiC surface and had an average size of 3.2 nm. When O2 was used as the oxidant, the styrene conversion and SO selectivity were 98.5 % and 69.7 %, respectively. The catsalyst exhibited good recycle stability due to the excellent thermal conductivity of SiC carrier, which efficiently dispersed the reaction heat. The experimental and computational results showed that in the epoxidation process, O2 was activated on the Ag surface to form 1O2 and •O2 -, which then spilled over to the SiC surface and reacted with the styrene adsorbed on the SiC surface. The present work provides new insight for understanding the epoxidation reaction and helps to the development of epoxidation catalysts. CRediT authorship contribution statement Xiang-Yun Guo: Writing – review & editing, Supervision, Resources, Methodology, Funding acquisition, Conceptualization. Tian-Yu Xu: Methodology, Data curation. Xiang Li: Writing – original draft, Investigation, Funding acquisition, Formal analysis, Data curation, Conceptualization. Ji-Xiao Zhao: Supervision, Project administration, Methodology, Conceptualization. Zhi-Feng Jiao: Writing – review & editing, Validation, Methodology, Formal analysis, Conceptualization. Declaration of Competing Interest The authors declare that they have no known competing financial interests or personal relationships that could have appeared to influence the work reported in this paper. Acknowledgements This work was supported by a project from CNPC-CZU Innovation Alliance (2021DQ06) and Postgraduate Research & Practice Innovation Program of Jiangsu Province (KYCX23_3024). Appendix A Supporting information Supplementary data associated with this article can be found in the online version at doi:10.1016/j.apcata.2024.120004. Appendix A Supplementary material Supplementary material References [1] C. Ayed J. Yin K. Landfester KaiA.I. Zhang Angew. Chem. Int. Ed. 135 2023 e202216159 C. Ayed, J. Yin, K. Landfester, KaiA.I. Zhang, Angew. Chem. Int. Ed. 135 (2023) e202216159. [2] J. Sebastian K. Jinka R. Jasra J. Catal. 244 2006 208 218 J. Sebastian, K. Jinka, R. Jasra, J. Catal. 244 (2006) 208–218. [3] A. Kalilur Rahiman K. Rajesh K. Shanmuga Bharathi S. Sreedaran V. Narayanan Appl. Catal., A 314 2006 216 225 A. Kalilur Rahiman, K. Rajesh, K. Shanmuga Bharathi, S. Sreedaran, V. Narayanan, Appl. Catal., A 314 (2006) 216–225. [4] H. Zhang Z. Wang W. Wang C. Wu T. Lu Y. Zhang P. Cheng Z. Zhao N. J. Chem. 45 2021 21293 21298 H. Zhang, Z. Wang, W. Wang, C. Wu, T. Lu, Y. Zhang, P. Cheng, Z. Zhao, New J. Chem. 45 (2021) 21293–21298. [5] G. De Faveri G. Ilyashenko M. Watkinson Chem. Soc. Rev. 40 2011 1722 1760 G. De Faveri, G. Ilyashenko, M. Watkinson, Chem. Soc. Rev. 40 (2011) 1722–1760. [6] B. Tyagi U. Sharma R.V. Jasra Appl. Catal., A 408 2011 171 177 B. Tyagi, U. Sharma, R.V. Jasra, Appl. Catal., A 408 (2011) 171–177. [7] S. Rahman C. Santra R. Kumar J. Bahadur A. Sultana R. Schweins D. Sen S. Maity S. Mazumdar B. Chowdhury Appl. Catal., A 482 2014 61 68 S. Rahman, C. Santra, R. Kumar, J. Bahadur, A. Sultana, R. Schweins, D. Sen, S. Maity, S. Mazumdar, B. Chowdhury, Appl. Catal., A 482 (2014) 61–68. [8] V. Amoli S. Farooqui A. Rai C. Santra S. Rahman A.K. Sinha B. Chowdhury RSC Adv. 5 2015 67089 67092 V. Amoli, S. Farooqui, A. Rai, C. Santra, S. Rahman, A.K. Sinha, B. Chowdhury, RSC Adv. 5 (2015) 67089–67092. [9] R. Jain C.S. Gopinath Dalton Trans. 48 2019 4574 4581 R. Jain, C.S. Gopinath, Dalton Trans. 48 (2019) 4574–4581. [10] I.A. Weinstock R.E. Schreiber R. Neumann Chem. Rev. 118 2018 2680 2717 I.A. Weinstock, R.E. Schreiber, R. Neumann, Chem. Rev. 118 (2018) 2680–2717. [11] S. Rahman S.A. Farooqui A. Rai R. Kumar C. Santra V.C. Prabhakaran G.R. Bhadu D. Sen S. Mazumder S. Maity A.K. Sinha B. Chowdhury RSC Adv. 5 2015 46850 46860 S. Rahman, S.A. Farooqui, A. Rai, R. Kumar, C. Santra, V.C. Prabhakaran, G.R. Bhadu, D. Sen, S. Mazumder, S. Maity, A.K. Sinha, B. Chowdhury, RSC Adv. 5 (2015) 46850–46860. [12] J.W. Brown Q.T. Nguyen T. Otto N.N. Jarenwattananon S. Glöggler L.-S. Bouchard Catal. Commun. 59 2015 50 54 J.W. Brown, Q.T. Nguyen, T. Otto, N.N. Jarenwattananon, S. Glöggler, L.-S. Bouchard, Catal. Commun. 59 (2015) 50–54. [13] J. Jiang R. Li H. Wang Y. Zheng H. Chen J. Ma Catal. Lett. 120 2008 221 228 J. Jiang, R. Li, H. Wang, Y. Zheng, H. Chen, J. Ma, Catal. Lett. 120 (2008) 221–228. [14] S. Tian C. Peng J. Dong Q. Xu Z. Chen D. Zhai Y. Wang L. Gu P. Hu H. Duan D. Wang Y. Li ACS Catal. 11 2021 4946 4954 S. Tian, C. Peng, J. Dong, Q. Xu, Z. Chen, D. Zhai, Y. Wang, L. Gu, P. Hu, H. Duan, D. Wang, Y. Li, ACS Catal. 11 (2021) 4946–4954. [15] Y. Wu Z. Chen F. Wang J. Xu Y. Wang Chem. Eng. Sci. 247 2022 117045 Y. Wu, Z. Chen, F. Wang, J. Xu, Y. Wang, Chem. Eng. Sci. 247 (2022) 117045. [16] H. Zhang J. Cao B. Wu W. Dai Z. Chen M. Ma RSC Adv. 6 2016 57174 57182 H. Zhang, J. Cao, B. Wu, W. Dai, Z. Chen, M. Ma, RSC Adv. 6 (2016) 57174–57182. [17] G. Tuci Y. Liu A. Rossin X. Guo C. Pham G. Giambastiani C. Pham-Huu Chem. Rev. 121 2021 10559 10665 G. Tuci, Y. Liu, A. Rossin, X. Guo, C. Pham, G. Giambastiani, C. Pham-Huu, Chem. Rev. 121 (2021) 10559–10665. [18] C.-H. Hao X.-N. Guo M. Sankar H. Yang B. Ma Y.-F. Zhang X.-L. Tong G.-Q. Jin X.-Y. Guo ACS Appl. Mater. Interfaces 10 2018 23029 23036 C.-H. Hao, X.-N. Guo, M. Sankar, H. Yang, B. Ma, Y.-F. Zhang, X.-L. Tong, G.-Q. Jin, X.-Y. Guo, ACS Appl. Mater. Interfaces 10 (2018) 23029–23036. [19] Z.-F. Jiao J.-X. Zhao X.-N. Guo X.-L. Tong B. Zhang G.-Q. Jin Y. Qin X.-Y. Guo Catal. Sci. Technol. 9 2019 2266 Z.-F. Jiao, J.-X. Zhao, X.-N. Guo, X.-L. Tong, B. Zhang, G.-Q. Jin, Y. Qin, X.-Y. Guo, Catal. Sci. Technol. 9 (2019) 2266. [20] L. Li Z.-F. Jiao J.-X. Zhao D. Yao X. Li X.-Y. Guo J. Catal. 425 2023 314 321 L. Li, Z.-F. Jiao, J.-X. Zhao, D. Yao, X. Li, X.-Y. Guo, J. Catal. 425 (2023) 314–321. [21] G.-Q. Jin X.-Y. Guo Microporous Mesoporous Mater. 60 2003 207 212 G.-Q. Jin, X.-Y. Guo, Microporous Mesoporous Mater. 60 (2003) 207–212. [22] J. Yang S. Hu Y. Fang S. Hoang L. Li W. Yang Z. Liang J. Wu J. Hu W. Xiao C. Pan Z. Luo J. Ding L. Zhang Y. Guo ACS Catal. 9 2019 9751 9763 J. Yang, S. Hu, Y. Fang, S. Hoang, L. Li, W. Yang, Z. Liang, J. Wu, J. Hu, W. Xiao, C. Pan, Z. Luo, J. Ding, L. Zhang, Y. Guo, ACS Catal. 9 (2019) 9751–9763. [23] J. VandeVondele M. Krack F. Mohamed M. Parrinello T. Chassaing J. Hutter Comput. Phys. Commun. 167 2005 103 128 J. VandeVondele, M. Krack, F. Mohamed, M. Parrinello, T. Chassaing, J. Hutter, Comput. Phys. Commun. 167 (2005) 103–128. [24] J.P. Perdew K. Burke M. Ernzerhof Phys. Rev. Lett. 77 1996 3865 3868 J.P. Perdew, K. Burke, M. Ernzerhof, Phys. Rev. Lett. 77 (1996) 3865–3868. [25] S. Grimme J. Antony S. Ehrlich H. Krieg J. Chem. Phys. 132 2010 154104 S. Grimme, J. Antony, S. Ehrlich, H. Krieg, J. Chem. Phys. 132 (2010) 154104. [26] S. Grimme S. Ehrlich L. Goerigk J. Comput. Chem. 32 2011 1456 1465 S. Grimme, S. Ehrlich, L. Goerigk, J. Comput. Chem. 32 (2011) 1456–1465. [27] J. VandeVondele J. Hutter J. Chem. Phys. 127 2007 114105 J. VandeVondele, J. Hutter, J. Chem. Phys. 127 (2007) 114105. [28] S. Goedecker M. Teter J. Hutter Phys. Rev. B 54 1996 1703 1710 S. Goedecker, M. Teter, J. Hutter, Phys. Rev. B 54 (1996) 1703–1710. [29] C. Hartwigsen S. Goedecker J. Hutter Phys. Rev. B 58 1998 3641 3662 C. Hartwigsen, S. Goedecker, J. Hutter, Phys. Rev. B 58 (1998) 3641–3662. [30] F. Li J. Tang Q. Ke Y. Guo M.N. Ha C. Wan Z. Lei J. Gu Q. Ling V.N. Nguyen W. Zhan ACS Catal. 11 2021 11855 11866 F. Li, J. Tang, Q. Ke, Y. Guo, M.N. Ha, C. Wan, Z. Lei, J. Gu, Q. Ling, V.N. Nguyen, W. Zhan, ACS Catal. 11 (2021) 11855–11866. [31] A. Klust R.J. Madix Surf. Sci. 600 2006 5025 5040 A. Klust, R.J. Madix, Surf. Sci. 600 (2006) 5025–5040. [32] J. Liu X. Ji L. Wang P. Jian B. Liu Appl. Surf. Sci. 637 2023 157935 J. Liu, X. Ji, L. Wang, P. Jian, B. Liu, Appl. Surf. Sci. 637 (2023) 157935. [33] M. Xiong Z. Gao P. Zhao G. Wang W. Yan S. Xing P. Wang J. Ma Z. Jiang X. Liu J. Ma J. Xu Y. Qin Nat. Commun. 11 2020 4773 M. Xiong, Z. Gao, P. Zhao, G. Wang, W. Yan, S. Xing, P. Wang, J. Ma, Z. Jiang, X. Liu, J. Ma, J. Xu, Y. Qin, Nat. Commun. 11 (2020) 4773. [34] M.O. Ozbek I. Onal R.A. Van Santen J. Catal. 284 2011 230 235 M.O. Ozbek, I. Onal, R.A. Van Santen, J. Catal. 284 (2011) 230–235. [35] V.V. Dutov G.V. Mamontov V.I. Zaikovskii O.V. Vodyankina Catal. Today 278 2016 150 156 V.V. Dutov, G.V. Mamontov, V.I. Zaikovskii, O.V. Vodyankina, Catal. Today. 278 (2016) 150–156. [36] X. Hu J. Bai C. Li H. Liang W. Sun Eur. J. Inorg. Chem. 2015 2015 3758 3763 X. Hu, J. Bai, C. Li, H. Liang, W. Sun, Eur. J. Inorg. Chem. 2015 (2015) 3758–3763. [37] X. Zhang L. Song F. Bi D. Zhang Y. Wang L. Cui J. Colloid Interface Sci. 571 2020 38 47 X. Zhang, L. Song, F. Bi, D. Zhang, Y. Wang, L. Cui, J. Colloid Interface Sci. 571 (2020) 38–47. [38] A. Gannoruwa B. Ariyasinghe J. Bandara Catal. Sci. Technol. 6 2016 479 487 A. Gannoruwa, B. Ariyasinghe, J. Bandara, Catal. Sci. Technol. 6 (2016) 479–487. [39] R. Li X. Xu B. Zhu X.-Y. Li Y. Ning R. Mu P. Du M. Li H. Wang J. Liang Y. Chen Y. Gao B. Yang Q. Fu X. Bao Nat. Commun. 12 2021 1406 R. Li, X. Xu, B. Zhu, X.-Y. Li, Y. Ning, R. Mu, P. Du, M. Li, H. Wang, J. Liang, Y. Chen, Y. Gao, B. Yang, Q. Fu, X. Bao, Nat. Commun. 12 (2021) 1406. [40] S.H. Kim W.I. Choi K.H. Kim D.J. Yang S. Heo D.-J. Yun Sci. Rep. 6 2016 33074 S.H. Kim, W.I. Choi, K.H. Kim, D.J. Yang, S. Heo, D.-J. Yun, Sci. Rep. 6 (2016) 33074. [41] Y. Wang X. Guo M. Lü Z. Zhai Y. Wang X. Guo Chin. J. Catal. 38 2017 658 664 Y. Wang, X. Guo, M. Lü, Z. Zhai, Y. Wang, X. Guo, Chin. J. Catal. 38 (2017) 658–664. [42] T. Pu H. Tian M.E. Ford S. Rangarajan I.E. Wachs ACS Catal. 9 2019 10727 10750 T. Pu, H. Tian, M.E. Ford, S. Rangarajan, I.E. Wachs, ACS Catal. 9 (2019) 10727–10750. [43] A.J.F. Van Hoof E.A.R. Hermans A.P. Van Bavel H. Friedrich E.J.M. Hensen ACS Catal. 9 2019 9829 9839 A.J.F. Van Hoof, E.A.R. Hermans, A.P. Van Bavel, H. Friedrich, E.J.M. Hensen, ACS Catal. 9 (2019) 9829–9839. [44] S. Dissanayake N. Vora L. Achola Y. Dang J. He Z. Tobin X. Lu A. Mirich P.-X. Gao S.L. Suib Appl. Catal., B 282 2021 119573 S. Dissanayake, N. Vora, L. Achola, Y. Dang, J. He, Z. Tobin, X. Lu, A. Mirich, P.-X. Gao, S.L. Suib, Appl. Catal., B 282 (2021) 119573. [45] L. Cao C. Yang B. Zhang K. Lv M. Li K. Deng J. Hazard. Mater. 359 2018 388 395 L. Cao, C. Yang, B. Zhang, K. Lv, M. Li, K. Deng, J. Hazard. Mater. 359 (2018) 388–395. [46] V. Hermán H. Takacs F. Duclairoir O. Renault J.H. Tortai B. Viala RSC Adv. 5 2015 51371 51381 V. Hermán, H. Takacs, F. Duclairoir, O. Renault, J.H. Tortai, B. Viala, RSC Adv. 5 (2015) 51371–51381. [47] P.V. Vardhan L.I. Shukla Radiat. Environ. Biophys. 57 2018 301 310 P.V. Vardhan, L.I. Shukla, Radiat. Environ. Biophys. 57 (2018) 301–310. [48] Y. Zhao Y. Guo X. Wang X. Zhang J. Mater. Sci. 55 2019 2006 2017 Y. Zhao, Y. Guo, X. Wang, X. Zhang, J. Mater. Sci. 55 (2019) 2006–2017. [49] J.A. Yabagi M.I. Kimpa M.N. Muhammad S.B. Rashid E. Zaidi M.A. Agam IOP Conf. Ser.: Mater. Sci. Eng. 298 2018 012004 J.A. Yabagi, M.I. Kimpa, M.N. Muhammad, S.B. Rashid, E. Zaidi, M.A. Agam, IOP Conf. Ser.: Mater. Sci. Eng. 298 (2018) 012004. [50] T.D. Kühne M. Iannuzzi M. Del Ben V.V. Rybkin P. Seewald F. Stein T. Laino R.Z. Khaliullin O. Schütt F. Schiffmann D. Golze J. Wilhelm S. Chulkov M.H. Bani-Hashemian V. Weber U. Borštnik M. Taillefumier A.S. Jakobovits A. Lazzaro H. Pabst T. Müller R. Schade M. Guidon S. Andermatt N. Holmberg G.K. Schenter A. Hehn A. Bussy F. Belleflamme G. Tabacchi A. Glöß M. Lass I. Bethune C.J. Mundy C. Plessl M. Watkins J. VandeVondele M. Krack J. Hutter J. Chem. Phys. 152 2020 194103 T.D. Kühne, M. Iannuzzi, M. Del Ben, V.V. Rybkin, P. Seewald, F. Stein, T. Laino, R.Z. Khaliullin, O. Schütt, F. Schiffmann, D. Golze, J. Wilhelm, S. Chulkov, M.H. Bani-Hashemian, V. Weber, U. Borštnik, M. Taillefumier, A.S. Jakobovits, A. Lazzaro, H. Pabst, T. Müller, R. Schade, M. Guidon, S. Andermatt, N. Holmberg, G.K. Schenter, A. Hehn, A. Bussy, F. Belleflamme, G. Tabacchi, A. Glöß, M. Lass, I. Bethune, C.J. Mundy, C. Plessl, M. Watkins, J. VandeVondele, M. Krack, J. Hutter, J. Chem. Phys. 152 (2020) 194103. [51] P. Lackner Z. Zou S. Mayr U. Diebold M. Schmid Phys. Chem. Chem. Phys. 21 2019 17613 17620 P. Lackner, Z. Zou, S. Mayr, U. Diebold, M. Schmid, Phys. Chem. Chem. Phys. 21 (2019) 17613–17620. [52] L. Jia S. Zhang F. Gu Y. Ping X. Guo Z. Zhong F. Su Microporous Mesoporous Mater. 149 2012 158 165 L. Jia, S. Zhang, F. Gu, Y. Ping, X. Guo, Z. Zhong, F. Su, Microporous Mesoporous Mater. 149 (2012) 158–165.",
      "scopus-id": "85207696648",
      "coredata": {
        "eid": "1-s2.0-S0926860X24004496",
        "dc:description": "SiC supported Ag catalysts were prepared by an impregnation-reduction method for styrene epoxidation in O2 atmosphere. Under the condition of 100 °C, 0.5 MPa O2 and 4 h, 5 wt% Ag/SiC catalyst achieved styrene conversion of 98.5 % and styrene oxide selectivity of 69.7 %. Further studies show that O2 was activated on the Ag surface and then formed reactive oxygen species, 1O2 and •O2 -. Based on the O2 adsorption results, the atomic ratio of O/Ag larger than 0.5 indicated that more oxygen species had spilled over to the SiC surface. In-situ diffuse reflectance Fourier transform infrared spectroscopy and Density Functional Theory calculation results showed that styrene was adsorbed on the SiC surface. The active oxygen species generated on the Ag surface could spill over to the SiC surface, reacting with the adsorbed styrene to produce styrene oxide or benzaldehyde. In addition, the catalyst exhibits good stability.",
        "openArchiveArticle": "false",
        "prism:coverDate": "2024-12-25",
        "openaccessUserLicense": null,
        "prism:aggregationType": "Journal",
        "prism:url": "https://api.elsevier.com/content/article/pii/S0926860X24004496",
        "dc:creator": [
          {
            "@_fa": "true",
            "$": "Li, Xiang"
          },
          {
            "@_fa": "true",
            "$": "Jiao, Zhi-Feng"
          },
          {
            "@_fa": "true",
            "$": "Zhao, Ji-Xiao"
          },
          {
            "@_fa": "true",
            "$": "Xu, Tian-Yu"
          },
          {
            "@_fa": "true",
            "$": "Guo, Xiang-Yun"
          }
        ],
        "link": [
          {
            "@_fa": "true",
            "@rel": "self",
            "@href": "https://api.elsevier.com/content/article/pii/S0926860X24004496"
          },
          {
            "@_fa": "true",
            "@rel": "scidir",
            "@href": "https://www.sciencedirect.com/science/article/pii/S0926860X24004496"
          }
        ],
        "dc:format": "application/json",
        "openaccessType": null,
        "pii": "S0926-860X(24)00449-6",
        "prism:volume": "688",
        "articleNumber": "120004",
        "prism:publisher": "Elsevier B.V. All rights are reserved, including those for text and data mining, AI training, and similar technologies.",
        "dc:title": "Catalytic performances of Ag/SiC catalysts for styrene epoxidation in O2 atmosphere",
        "prism:copyright": "© 2024 Elsevier B.V. All rights are reserved, including those for text and data mining, AI training, and similar technologies.",
        "openaccess": "0",
        "prism:issn": "0926860X",
        "dcterms:subject": [
          {
            "@_fa": "true",
            "$": "Ag/SiC catalyst"
          },
          {
            "@_fa": "true",
            "$": "Styrene epoxidation"
          },
          {
            "@_fa": "true",
            "$": "Active oxygen species"
          },
          {
            "@_fa": "true",
            "$": "Oxygen spillover"
          }
        ],
        "openaccessArticle": "false",
        "prism:publicationName": "Applied Catalysis A: General",
        "openaccessSponsorType": null,
        "prism:pageRange": "120004",
        "pubType": "fla",
        "prism:coverDisplayDate": "25 December 2024",
        "prism:doi": "10.1016/j.apcata.2024.120004",
        "prism:startingPage": "120004",
        "dc:identifier": "doi:10.1016/j.apcata.2024.120004",
        "openaccessSponsorName": null
      },
      "objects": {
        "object": [
          {
            "@category": "standard",
            "@height": "228",
            "@width": "282",
            "@_fa": "true",
            "$": "https://api.elsevier.com/content/object/eid/1-s2.0-S0926860X24004496-gr9.jpg?httpAccept=%2A%2F%2A",
            "@multimediatype": "JPEG image file",
            "@type": "IMAGE-DOWNSAMPLED",
            "@size": "16542",
            "@ref": "gr9",
            "@mimetype": "image/jpeg"
          },
          {
            "@category": "standard",
            "@height": "290",
            "@width": "508",
            "@_fa": "true",
            "$": "https://api.elsevier.com/content/object/eid/1-s2.0-S0926860X24004496-gr8.jpg?httpAccept=%2A%2F%2A",
            "@multimediatype": "JPEG image file",
            "@type": "IMAGE-DOWNSAMPLED",
            "@size": "35079",
            "@ref": "gr8",
            "@mimetype": "image/jpeg"
          },
          {
            "@category": "standard",
            "@height": "240",
            "@width": "282",
            "@_fa": "true",
            "$": "https://api.elsevier.com/content/object/eid/1-s2.0-S0926860X24004496-gr5.jpg?httpAccept=%2A%2F%2A",
            "@multimediatype": "JPEG image file",
            "@type": "IMAGE-DOWNSAMPLED",
            "@size": "17299",
            "@ref": "gr5",
            "@mimetype": "image/jpeg"
          },
          {
            "@category": "standard",
            "@height": "238",
            "@width": "565",
            "@_fa": "true",
            "$": "https://api.elsevier.com/content/object/eid/1-s2.0-S0926860X24004496-gr4.jpg?httpAccept=%2A%2F%2A",
            "@multimediatype": "JPEG image file",
            "@type": "IMAGE-DOWNSAMPLED",
            "@size": "29913",
            "@ref": "gr4",
            "@mimetype": "image/jpeg"
          },
          {
            "@category": "standard",
            "@height": "145",
            "@width": "508",
            "@_fa": "true",
            "$": "https://api.elsevier.com/content/object/eid/1-s2.0-S0926860X24004496-gr7.jpg?httpAccept=%2A%2F%2A",
            "@multimediatype": "JPEG image file",
            "@type": "IMAGE-DOWNSAMPLED",
            "@size": "29135",
            "@ref": "gr7",
            "@mimetype": "image/jpeg"
          },
          {
            "@category": "standard",
            "@height": "257",
            "@width": "339",
            "@_fa": "true",
            "$": "https://api.elsevier.com/content/object/eid/1-s2.0-S0926860X24004496-gr6.jpg?httpAccept=%2A%2F%2A",
            "@multimediatype": "JPEG image file",
            "@type": "IMAGE-DOWNSAMPLED",
            "@size": "33304",
            "@ref": "gr6",
            "@mimetype": "image/jpeg"
          },
          {
            "@category": "standard",
            "@height": "465",
            "@width": "565",
            "@_fa": "true",
            "$": "https://api.elsevier.com/content/object/eid/1-s2.0-S0926860X24004496-gr1.jpg?httpAccept=%2A%2F%2A",
            "@multimediatype": "JPEG image file",
            "@type": "IMAGE-DOWNSAMPLED",
            "@size": "61195",
            "@ref": "gr1",
            "@mimetype": "image/jpeg"
          },
          {
            "@category": "standard",
            "@height": "245",
            "@width": "565",
            "@_fa": "true",
            "$": "https://api.elsevier.com/content/object/eid/1-s2.0-S0926860X24004496-gr3.jpg?httpAccept=%2A%2F%2A",
            "@multimediatype": "JPEG image file",
            "@type": "IMAGE-DOWNSAMPLED",
            "@size": "29034",
            "@ref": "gr3",
            "@mimetype": "image/jpeg"
          },
          {
            "@category": "standard",
            "@height": "250",
            "@width": "508",
            "@_fa": "true",
            "$": "https://api.elsevier.com/content/object/eid/1-s2.0-S0926860X24004496-gr2.jpg?httpAccept=%2A%2F%2A",
            "@multimediatype": "JPEG image file",
            "@type": "IMAGE-DOWNSAMPLED",
            "@size": "50803",
            "@ref": "gr2",
            "@mimetype": "image/jpeg"
          },
          {
            "@category": "standard",
            "@height": "200",
            "@width": "350",
            "@_fa": "true",
            "$": "https://api.elsevier.com/content/object/eid/1-s2.0-S0926860X24004496-ga1.jpg?httpAccept=%2A%2F%2A",
            "@multimediatype": "JPEG image file",
            "@type": "IMAGE-DOWNSAMPLED",
            "@size": "21337",
            "@ref": "ga1",
            "@mimetype": "image/jpeg"
          },
          {
            "@category": "thumbnail",
            "@height": "164",
            "@width": "203",
            "@_fa": "true",
            "$": "https://api.elsevier.com/content/object/eid/1-s2.0-S0926860X24004496-gr9.sml?httpAccept=%2A%2F%2A",
            "@multimediatype": "GIF image file",
            "@type": "IMAGE-THUMBNAIL",
            "@size": "12066",
            "@ref": "gr9",
            "@mimetype": "image/gif"
          },
          {
            "@category": "thumbnail",
            "@height": "125",
            "@width": "219",
            "@_fa": "true",
            "$": "https://api.elsevier.com/content/object/eid/1-s2.0-S0926860X24004496-gr8.sml?httpAccept=%2A%2F%2A",
            "@multimediatype": "GIF image file",
            "@type": "IMAGE-THUMBNAIL",
            "@size": "10875",
            "@ref": "gr8",
            "@mimetype": "image/gif"
          },
          {
            "@category": "thumbnail",
            "@height": "164",
            "@width": "193",
            "@_fa": "true",
            "$": "https://api.elsevier.com/content/object/eid/1-s2.0-S0926860X24004496-gr5.sml?httpAccept=%2A%2F%2A",
            "@multimediatype": "GIF image file",
            "@type": "IMAGE-THUMBNAIL",
            "@size": "7385",
            "@ref": "gr5",
            "@mimetype": "image/gif"
          },
          {
            "@category": "thumbnail",
            "@height": "92",
            "@width": "219",
            "@_fa": "true",
            "$": "https://api.elsevier.com/content/object/eid/1-s2.0-S0926860X24004496-gr4.sml?httpAccept=%2A%2F%2A",
            "@multimediatype": "GIF image file",
            "@type": "IMAGE-THUMBNAIL",
            "@size": "6148",
            "@ref": "gr4",
            "@mimetype": "image/gif"
          },
          {
            "@category": "thumbnail",
            "@height": "62",
            "@width": "219",
            "@_fa": "true",
            "$": "https://api.elsevier.com/content/object/eid/1-s2.0-S0926860X24004496-gr7.sml?httpAccept=%2A%2F%2A",
            "@multimediatype": "GIF image file",
            "@type": "IMAGE-THUMBNAIL",
            "@size": "8202",
            "@ref": "gr7",
            "@mimetype": "image/gif"
          },
          {
            "@category": "thumbnail",
            "@height": "164",
            "@width": "216",
            "@_fa": "true",
            "$": "https://api.elsevier.com/content/object/eid/1-s2.0-S0926860X24004496-gr6.sml?httpAccept=%2A%2F%2A",
            "@multimediatype": "GIF image file",
            "@type": "IMAGE-THUMBNAIL",
            "@size": "13564",
            "@ref": "gr6",
            "@mimetype": "image/gif"
          },
          {
            "@category": "thumbnail",
            "@height": "164",
            "@width": "199",
            "@_fa": "true",
            "$": "https://api.elsevier.com/content/object/eid/1-s2.0-S0926860X24004496-gr1.sml?httpAccept=%2A%2F%2A",
            "@multimediatype": "GIF image file",
            "@type": "IMAGE-THUMBNAIL",
            "@size": "15137",
            "@ref": "gr1",
            "@mimetype": "image/gif"
          },
          {
            "@category": "thumbnail",
            "@height": "95",
            "@width": "219",
            "@_fa": "true",
            "$": "https://api.elsevier.com/content/object/eid/1-s2.0-S0926860X24004496-gr3.sml?httpAccept=%2A%2F%2A",
            "@multimediatype": "GIF image file",
            "@type": "IMAGE-THUMBNAIL",
            "@size": "6488",
            "@ref": "gr3",
            "@mimetype": "image/gif"
          },
          {
            "@category": "thumbnail",
            "@height": "108",
            "@width": "219",
            "@_fa": "true",
            "$": "https://api.elsevier.com/content/object/eid/1-s2.0-S0926860X24004496-gr2.sml?httpAccept=%2A%2F%2A",
            "@multimediatype": "GIF image file",
            "@type": "IMAGE-THUMBNAIL",
            "@size": "14986",
            "@ref": "gr2",
            "@mimetype": "image/gif"
          },
          {
            "@category": "thumbnail",
            "@height": "125",
            "@width": "219",
            "@_fa": "true",
            "$": "https://api.elsevier.com/content/object/eid/1-s2.0-S0926860X24004496-ga1.sml?httpAccept=%2A%2F%2A",
            "@multimediatype": "GIF image file",
            "@type": "IMAGE-THUMBNAIL",
            "@size": "11070",
            "@ref": "ga1",
            "@mimetype": "image/gif"
          },
          {
            "@category": "high",
            "@height": "1008",
            "@width": "1247",
            "@_fa": "true",
            "$": "https://api.elsevier.com/content/object/eid/1-s2.0-S0926860X24004496-gr9_lrg.jpg?httpAccept=%2A%2F%2A",
            "@multimediatype": "JPEG image file",
            "@type": "IMAGE-HIGH-RES",
            "@size": "82068",
            "@ref": "gr9",
            "@mimetype": "image/jpeg"
          },
          {
            "@category": "high",
            "@height": "1282",
            "@width": "2245",
            "@_fa": "true",
            "$": "https://api.elsevier.com/content/object/eid/1-s2.0-S0926860X24004496-gr8_lrg.jpg?httpAccept=%2A%2F%2A",
            "@multimediatype": "JPEG image file",
            "@type": "IMAGE-HIGH-RES",
            "@size": "153563",
            "@ref": "gr8",
            "@mimetype": "image/jpeg"
          },
          {
            "@category": "high",
            "@height": "1060",
            "@width": "1247",
            "@_fa": "true",
            "$": "https://api.elsevier.com/content/object/eid/1-s2.0-S0926860X24004496-gr5_lrg.jpg?httpAccept=%2A%2F%2A",
            "@multimediatype": "JPEG image file",
            "@type": "IMAGE-HIGH-RES",
            "@size": "89186",
            "@ref": "gr5",
            "@mimetype": "image/jpeg"
          },
          {
            "@category": "high",
            "@height": "1051",
            "@width": "2495",
            "@_fa": "true",
            "$": "https://api.elsevier.com/content/object/eid/1-s2.0-S0926860X24004496-gr4_lrg.jpg?httpAccept=%2A%2F%2A",
            "@multimediatype": "JPEG image file",
            "@type": "IMAGE-HIGH-RES",
            "@size": "181854",
            "@ref": "gr4",
            "@mimetype": "image/jpeg"
          },
          {
            "@category": "high",
            "@height": "639",
            "@width": "2245",
            "@_fa": "true",
            "$": "https://api.elsevier.com/content/object/eid/1-s2.0-S0926860X24004496-gr7_lrg.jpg?httpAccept=%2A%2F%2A",
            "@multimediatype": "JPEG image file",
            "@type": "IMAGE-HIGH-RES",
            "@size": "134306",
            "@ref": "gr7",
            "@mimetype": "image/jpeg"
          },
          {
            "@category": "high",
            "@height": "1137",
            "@width": "1497",
            "@_fa": "true",
            "$": "https://api.elsevier.com/content/object/eid/1-s2.0-S0926860X24004496-gr6_lrg.jpg?httpAccept=%2A%2F%2A",
            "@multimediatype": "JPEG image file",
            "@type": "IMAGE-HIGH-RES",
            "@size": "195466",
            "@ref": "gr6",
            "@mimetype": "image/jpeg"
          },
          {
            "@category": "high",
            "@height": "2052",
            "@width": "2495",
            "@_fa": "true",
            "$": "https://api.elsevier.com/content/object/eid/1-s2.0-S0926860X24004496-gr1_lrg.jpg?httpAccept=%2A%2F%2A",
            "@multimediatype": "JPEG image file",
            "@type": "IMAGE-HIGH-RES",
            "@size": "281405",
            "@ref": "gr1",
            "@mimetype": "image/jpeg"
          },
          {
            "@category": "high",
            "@height": "1080",
            "@width": "2495",
            "@_fa": "true",
            "$": "https://api.elsevier.com/content/object/eid/1-s2.0-S0926860X24004496-gr3_lrg.jpg?httpAccept=%2A%2F%2A",
            "@multimediatype": "JPEG image file",
            "@type": "IMAGE-HIGH-RES",
            "@size": "158635",
            "@ref": "gr3",
            "@mimetype": "image/jpeg"
          },
          {
            "@category": "high",
            "@height": "1105",
            "@width": "2245",
            "@_fa": "true",
            "$": "https://api.elsevier.com/content/object/eid/1-s2.0-S0926860X24004496-gr2_lrg.jpg?httpAccept=%2A%2F%2A",
            "@multimediatype": "JPEG image file",
            "@type": "IMAGE-HIGH-RES",
            "@size": "268946",
            "@ref": "gr2",
            "@mimetype": "image/jpeg"
          },
          {
            "@category": "high",
            "@height": "886",
            "@width": "1550",
            "@_fa": "true",
            "$": "https://api.elsevier.com/content/object/eid/1-s2.0-S0926860X24004496-ga1_lrg.jpg?httpAccept=%2A%2F%2A",
            "@multimediatype": "JPEG image file",
            "@type": "IMAGE-HIGH-RES",
            "@size": "160186",
            "@ref": "ga1",
            "@mimetype": "image/jpeg"
          },
          {
            "@category": "standard",
            "@_fa": "true",
            "$": "https://api.elsevier.com/content/object/eid/1-s2.0-S0926860X24004496-mmc1.docx?httpAccept=%2A%2F%2A",
            "@multimediatype": "Microsoft Word file",
            "@type": "APPLICATION",
            "@size": "3231068",
            "@ref": "mmc1",
            "@mimetype": "application/word"
          },
          {
            "@category": "thumbnail",
            "@_fa": "true",
            "$": "https://api.elsevier.com/content/object/eid/1-s2.0-S0926860X24004496-si0001.svg?httpAccept=%2A%2F%2A",
            "@multimediatype": "Scalable Vector Graphics file",
            "@type": "ALTIMG",
            "@size": "4757",
            "@ref": "si0001",
            "@mimetype": "image/svg+xml"
          },
          {
            "@category": "thumbnail",
            "@_fa": "true",
            "$": "https://api.elsevier.com/content/object/eid/1-s2.0-S0926860X24004496-si0002.svg?httpAccept=%2A%2F%2A",
            "@multimediatype": "Scalable Vector Graphics file",
            "@type": "ALTIMG",
            "@size": "4883",
            "@ref": "si0002",
            "@mimetype": "image/svg+xml"
          },
          {
            "@category": "thumbnail",
            "@_fa": "true",
            "$": "https://api.elsevier.com/content/object/eid/1-s2.0-S0926860X24004496-si0003.svg?httpAccept=%2A%2F%2A",
            "@multimediatype": "Scalable Vector Graphics file",
            "@type": "ALTIMG",
            "@size": "2718",
            "@ref": "si0003",
            "@mimetype": "image/svg+xml"
          },
          {
            "@category": "thumbnail",
            "@_fa": "true",
            "$": "https://api.elsevier.com/content/object/eid/1-s2.0-S0926860X24004496-si0004.svg?httpAccept=%2A%2F%2A",
            "@multimediatype": "Scalable Vector Graphics file",
            "@type": "ALTIMG",
            "@size": "5255",
            "@ref": "si0004",
            "@mimetype": "image/svg+xml"
          },
          {
            "@category": "thumbnail",
            "@_fa": "true",
            "$": "https://api.elsevier.com/content/object/eid/1-s2.0-S0926860X24004496-si0005.svg?httpAccept=%2A%2F%2A",
            "@multimediatype": "Scalable Vector Graphics file",
            "@type": "ALTIMG",
            "@size": "1243",
            "@ref": "si0005",
            "@mimetype": "image/svg+xml"
          },
          {
            "@category": "thumbnail",
            "@_fa": "true",
            "$": "https://api.elsevier.com/content/object/eid/1-s2.0-S0926860X24004496-si0006.svg?httpAccept=%2A%2F%2A",
            "@multimediatype": "Scalable Vector Graphics file",
            "@type": "ALTIMG",
            "@size": "1284",
            "@ref": "si0006",
            "@mimetype": "image/svg+xml"
          },
          {
            "@category": "thumbnail",
            "@_fa": "true",
            "$": "https://api.elsevier.com/content/object/eid/1-s2.0-S0926860X24004496-si0007.svg?httpAccept=%2A%2F%2A",
            "@multimediatype": "Scalable Vector Graphics file",
            "@type": "ALTIMG",
            "@size": "5490",
            "@ref": "si0007",
            "@mimetype": "image/svg+xml"
          },
          {
            "@category": "thumbnail",
            "@_fa": "true",
            "$": "https://api.elsevier.com/content/object/eid/1-s2.0-S0926860X24004496-si0008.svg?httpAccept=%2A%2F%2A",
            "@multimediatype": "Scalable Vector Graphics file",
            "@type": "ALTIMG",
            "@size": "1130",
            "@ref": "si0008",
            "@mimetype": "image/svg+xml"
          },
          {
            "@category": "thumbnail",
            "@_fa": "true",
            "$": "https://api.elsevier.com/content/object/eid/1-s2.0-S0926860X24004496-si0009.svg?httpAccept=%2A%2F%2A",
            "@multimediatype": "Scalable Vector Graphics file",
            "@type": "ALTIMG",
            "@size": "1227",
            "@ref": "si0009",
            "@mimetype": "image/svg+xml"
          },
          {
            "@category": "thumbnail",
            "@_fa": "true",
            "$": "https://api.elsevier.com/content/object/eid/1-s2.0-S0926860X24004496-si0010.svg?httpAccept=%2A%2F%2A",
            "@multimediatype": "Scalable Vector Graphics file",
            "@type": "ALTIMG",
            "@size": "1227",
            "@ref": "si0010",
            "@mimetype": "image/svg+xml"
          },
          {
            "@category": "thumbnail",
            "@_fa": "true",
            "$": "https://api.elsevier.com/content/object/eid/1-s2.0-S0926860X24004496-si0011.svg?httpAccept=%2A%2F%2A",
            "@multimediatype": "Scalable Vector Graphics file",
            "@type": "ALTIMG",
            "@size": "1243",
            "@ref": "si0011",
            "@mimetype": "image/svg+xml"
          },
          {
            "@category": "thumbnail",
            "@_fa": "true",
            "$": "https://api.elsevier.com/content/object/eid/1-s2.0-S0926860X24004496-si0012.svg?httpAccept=%2A%2F%2A",
            "@multimediatype": "Scalable Vector Graphics file",
            "@type": "ALTIMG",
            "@size": "1284",
            "@ref": "si0012",
            "@mimetype": "image/svg+xml"
          },
          {
            "@category": "thumbnail",
            "@_fa": "true",
            "$": "https://api.elsevier.com/content/object/eid/1-s2.0-S0926860X24004496-si0013.svg?httpAccept=%2A%2F%2A",
            "@multimediatype": "Scalable Vector Graphics file",
            "@type": "ALTIMG",
            "@size": "3059",
            "@ref": "si0013",
            "@mimetype": "image/svg+xml"
          },
          {
            "@category": "thumbnail",
            "@_fa": "true",
            "$": "https://api.elsevier.com/content/object/eid/1-s2.0-S0926860X24004496-si0014.svg?httpAccept=%2A%2F%2A",
            "@multimediatype": "Scalable Vector Graphics file",
            "@type": "ALTIMG",
            "@size": "1953",
            "@ref": "si0014",
            "@mimetype": "image/svg+xml"
          },
          {
            "@category": "thumbnail",
            "@_fa": "true",
            "$": "https://api.elsevier.com/content/object/eid/1-s2.0-S0926860X24004496-si0015.svg?httpAccept=%2A%2F%2A",
            "@multimediatype": "Scalable Vector Graphics file",
            "@type": "ALTIMG",
            "@size": "1337",
            "@ref": "si0015",
            "@mimetype": "image/svg+xml"
          },
          {
            "@category": "thumbnail",
            "@_fa": "true",
            "$": "https://api.elsevier.com/content/object/eid/1-s2.0-S0926860X24004496-si0016.svg?httpAccept=%2A%2F%2A",
            "@multimediatype": "Scalable Vector Graphics file",
            "@type": "ALTIMG",
            "@size": "1632",
            "@ref": "si0016",
            "@mimetype": "image/svg+xml"
          }
        ]
      },
      "link": {
        "@rel": "abstract",
        "@href": "https://api.elsevier.com/content/abstract/scopus_id/85207696648"
      }
    }
  }
}