{
  "metadata": {
    "title": "Particle size effect in glucose oxidation with Pd/CB catalysts",
    "authors": "; ; ",
    "journal": "Applied Catalysis A: General",
    "date": "2017-07-25",
    "doi": "10.1016/j.apcata.2017.05.008",
    "abstract": "",
    "uri": "https://api.elsevier.com/content/article/pii/S0926860X17301989",
    "pii": "S0926860X17301989"
  },
  "fulltext": {
    "full-text-retrieval-response": {
      "scopus-eid": "2-s2.0-85019561118",
      "originalText": "serial JL 271346 291210 291744 291809 31 Applied Catalysis A: General APPLIEDCATALYSISAGENERAL 2017-05-18 2017-05-18 2017-05-26 2017-05-26 2017-06-29T21:06:47 1-s2.0-S0926860X17301989 S0926-860X(17)30198-9 S0926860X17301989 10.1016/j.apcata.2017.05.008 S300 S300.1 FULL-TEXT 1-s2.0-S0926860X17X00112 2025-07-16T14:34:32.714048Z 0 0 20170725 2017 2017-05-18T01:08:00.853912Z absattachment articleinfo articletitlenorm authfirstinitialnorm authfirstsurnamenorm cid cids contenttype copyright crossmark dateloaded dateloadedtxt datesearch datesort dateupdated dco docsubtype doctype doi eid ewtransactionid hubeid indexeddate issn issnnorm itemstage itemtransactionid itemweight openaccess openarchive pg pgfirst pglast pii piinorm pubdatestart pubdatetxt pubyr sortorder srctitle srctitlenorm srctype ssids alllist content subj subheadings suppl tomb volfirst volissue volumelist webpdf webpdfpagecount yearnav figure table e-component body acknowledge affil appendices articletitle auth authfirstini authfull authkeywords authlast highlightsabst primabst ref specialabst 0926-860X 0926860X true 542 542 C Volume 542 8 47 54 47 54 20170725 25 July 2017 2017-07-25 2017 article fla © 2017 Elsevier B.V. All rights reserved. PARTICLESIZEEFFECTINGLUCOSEOXIDATIONPDCBCATALYSTS HAYNES T 1 Introduction 2 Experimental section 2.1 Synthesis of Pd/CB catalysts 2.2 Characterization methods 2.3 Thermal treatment 2.4 Oxidative dehydrogenation of glucose: catalytic experiments 3 Results and discussion 3.1 XPS 3.2 TGA 3.3 TEM and dispersion 3.4 Catalytic tests 4 Conclusion Acknowledgments Appendix A Supplementary data References MURZIN 2011 218 249 D JIPING 2013 492 507 M LICHTENTHALER 2004 65 90 F CHHEDA 2007 7164 7183 J RAMESH 2003 149 173 H BUCHHOLZ 2008 1966 1979 K TATHOD 2014 90 99 A BESSON 2014 1827 1870 M ANASTASSIADIS 2007 167 180 S DELIDOVICH 2010 14 21 I CHENG 2010 1598 1602 C VANDAM 1987 361 372 H BESSON 1995 T M WITONSKA 2011 73 82 I DEFFERNEZ 2005 303 313 A KARSKI 2003 618 622 S KARSKI 2003 87 92 S BIAN 2007 2252 2254 R WENKIN 2002 141 159 M BIELLA 2002 242 247 S HERMANS 2011 19 27 S OKATSU 2009 8 14 H ONAL 2004 122 133 Y MIRESCU 2007 204 209 A ISHIDA 2008 9265 9268 T MEYER 2013 463 473 N GEUS 1983 1 J KIM 2009 15330 15338 J WENKIN 1996 181 199 M WOJCIESZAK 2010 16677 16684 R CHEN 2015 408 416 C HAGLUND 1993 11685 11691 J WASER 1953 661 663 J ZHANG 2002 246 248 H GALLEZOT 1997 405 418 P HAYNESX2017X47 HAYNESX2017X47X54 HAYNESX2017X47XT HAYNESX2017X47X54XT 2019-05-26T00:00:00.000Z http://creativecommons.org/licenses/by-nc-nd/4.0/ © 2017 Elsevier B.V. All rights reserved. item S0926-860X(17)30198-9 S0926860X17301989 1-s2.0-S0926860X17301989 10.1016/j.apcata.2017.05.008 271346 2024-01-01T12:31:47.592716Z 2017-07-25 1-s2.0-S0926860X17301989-main.pdf https://s3-eu-west-1.amazonaws.com/prod-ucs-content-store-eu-west/content/pii:S0926860X17301989/MAIN/application/pdf/bb9a8562b4f5f3a53f7896d7c4539a32/main.pdf https://s3.amazonaws.com/prod-ucs-content-store-us-east/content/pii:S0926860X17301989/MAIN/application/pdf/bb9a8562b4f5f3a53f7896d7c4539a32/main.pdf main.pdf pdf true 1368567 MAIN 8 1-s2.0-S0926860X17301989-main_1.png https://s3-eu-west-1.amazonaws.com/prod-ucs-content-store-eu-west/content/pii:S0926860X17301989/PREVIEW/image/png/357596c84c80596ca63c57a220fe1b26/main_1.png https://s3.amazonaws.com/prod-ucs-content-store-us-east/content/pii:S0926860X17301989/PREVIEW/image/png/357596c84c80596ca63c57a220fe1b26/main_1.png main_1.png png 56350 849 656 IMAGE-WEB-PDF 1 1-s2.0-S0926860X17301989-fx1.sml https://s3-eu-west-1.amazonaws.com/prod-ucs-content-store-eu-west/content/pii:S0926860X17301989/fx1/THUMBNAIL/image/gif/d5b77a1d626f0445b7b33680eab65148/fx1.sml https://s3.amazonaws.com/prod-ucs-content-store-us-east/content/pii:S0926860X17301989/fx1/THUMBNAIL/image/gif/d5b77a1d626f0445b7b33680eab65148/fx1.sml fx1 true fx1.sml sml 8816 163 174 IMAGE-THUMBNAIL 1-s2.0-S0926860X17301989-gr1.sml https://s3-eu-west-1.amazonaws.com/prod-ucs-content-store-eu-west/content/pii:S0926860X17301989/gr1/THUMBNAIL/image/gif/c3fe376d3d69f4ac55eee2ab53d23cb6/gr1.sml https://s3.amazonaws.com/prod-ucs-content-store-us-east/content/pii:S0926860X17301989/gr1/THUMBNAIL/image/gif/c3fe376d3d69f4ac55eee2ab53d23cb6/gr1.sml gr1 gr1.sml sml 10104 90 219 IMAGE-THUMBNAIL 1-s2.0-S0926860X17301989-gr2.sml https://s3-eu-west-1.amazonaws.com/prod-ucs-content-store-eu-west/content/pii:S0926860X17301989/gr2/THUMBNAIL/image/gif/4453cb844cf790f39e419e8641d38bc9/gr2.sml https://s3.amazonaws.com/prod-ucs-content-store-us-east/content/pii:S0926860X17301989/gr2/THUMBNAIL/image/gif/4453cb844cf790f39e419e8641d38bc9/gr2.sml gr2 gr2.sml sml 10068 101 219 IMAGE-THUMBNAIL 1-s2.0-S0926860X17301989-gr3.sml https://s3-eu-west-1.amazonaws.com/prod-ucs-content-store-eu-west/content/pii:S0926860X17301989/gr3/THUMBNAIL/image/gif/c01cce974b8377a384d61c3bbe9db172/gr3.sml https://s3.amazonaws.com/prod-ucs-content-store-us-east/content/pii:S0926860X17301989/gr3/THUMBNAIL/image/gif/c01cce974b8377a384d61c3bbe9db172/gr3.sml gr3 gr3.sml sml 9436 164 109 IMAGE-THUMBNAIL 1-s2.0-S0926860X17301989-gr4.sml https://s3-eu-west-1.amazonaws.com/prod-ucs-content-store-eu-west/content/pii:S0926860X17301989/gr4/THUMBNAIL/image/gif/d819256c22874c02872e05ba34613416/gr4.sml https://s3.amazonaws.com/prod-ucs-content-store-us-east/content/pii:S0926860X17301989/gr4/THUMBNAIL/image/gif/d819256c22874c02872e05ba34613416/gr4.sml gr4 gr4.sml sml 10136 116 219 IMAGE-THUMBNAIL 1-s2.0-S0926860X17301989-gr5.sml https://s3-eu-west-1.amazonaws.com/prod-ucs-content-store-eu-west/content/pii:S0926860X17301989/gr5/THUMBNAIL/image/gif/7a78392387be8d49496f17aa4dd73503/gr5.sml https://s3.amazonaws.com/prod-ucs-content-store-us-east/content/pii:S0926860X17301989/gr5/THUMBNAIL/image/gif/7a78392387be8d49496f17aa4dd73503/gr5.sml gr5 gr5.sml sml 24338 163 156 IMAGE-THUMBNAIL 1-s2.0-S0926860X17301989-gr6.sml https://s3-eu-west-1.amazonaws.com/prod-ucs-content-store-eu-west/content/pii:S0926860X17301989/gr6/THUMBNAIL/image/gif/a2062d360a6041911cf3cad95b337c37/gr6.sml https://s3.amazonaws.com/prod-ucs-content-store-us-east/content/pii:S0926860X17301989/gr6/THUMBNAIL/image/gif/a2062d360a6041911cf3cad95b337c37/gr6.sml gr6 gr6.sml sml 10230 71 219 IMAGE-THUMBNAIL 1-s2.0-S0926860X17301989-gr7.sml https://s3-eu-west-1.amazonaws.com/prod-ucs-content-store-eu-west/content/pii:S0926860X17301989/gr7/THUMBNAIL/image/gif/05644ea06781137d604a24631217f359/gr7.sml https://s3.amazonaws.com/prod-ucs-content-store-us-east/content/pii:S0926860X17301989/gr7/THUMBNAIL/image/gif/05644ea06781137d604a24631217f359/gr7.sml gr7 gr7.sml sml 11927 131 219 IMAGE-THUMBNAIL 1-s2.0-S0926860X17301989-gr8.sml https://s3-eu-west-1.amazonaws.com/prod-ucs-content-store-eu-west/content/pii:S0926860X17301989/gr8/THUMBNAIL/image/gif/61b8888097abd580816248f34dd5ae9c/gr8.sml https://s3.amazonaws.com/prod-ucs-content-store-us-east/content/pii:S0926860X17301989/gr8/THUMBNAIL/image/gif/61b8888097abd580816248f34dd5ae9c/gr8.sml gr8 gr8.sml sml 8399 50 219 IMAGE-THUMBNAIL 1-s2.0-S0926860X17301989-fx1.jpg https://s3-eu-west-1.amazonaws.com/prod-ucs-content-store-eu-west/content/pii:S0926860X17301989/fx1/DOWNSAMPLED/image/jpeg/9161c33b5816843a2325812af788fcdb/fx1.jpg https://s3.amazonaws.com/prod-ucs-content-store-us-east/content/pii:S0926860X17301989/fx1/DOWNSAMPLED/image/jpeg/9161c33b5816843a2325812af788fcdb/fx1.jpg fx1 true fx1.jpg jpg 11587 200 213 IMAGE-DOWNSAMPLED 1-s2.0-S0926860X17301989-gr1.jpg https://s3-eu-west-1.amazonaws.com/prod-ucs-content-store-eu-west/content/pii:S0926860X17301989/gr1/DOWNSAMPLED/image/jpeg/f61cac08981f5a9b8b3d71ec67db2b26/gr1.jpg https://s3.amazonaws.com/prod-ucs-content-store-us-east/content/pii:S0926860X17301989/gr1/DOWNSAMPLED/image/jpeg/f61cac08981f5a9b8b3d71ec67db2b26/gr1.jpg gr1 gr1.jpg jpg 37155 216 527 IMAGE-DOWNSAMPLED 1-s2.0-S0926860X17301989-gr2.jpg https://s3-eu-west-1.amazonaws.com/prod-ucs-content-store-eu-west/content/pii:S0926860X17301989/gr2/DOWNSAMPLED/image/jpeg/58b993a6f64d0d9b59656b2e9ee0a69f/gr2.jpg https://s3.amazonaws.com/prod-ucs-content-store-us-east/content/pii:S0926860X17301989/gr2/DOWNSAMPLED/image/jpeg/58b993a6f64d0d9b59656b2e9ee0a69f/gr2.jpg gr2 gr2.jpg jpg 25765 157 339 IMAGE-DOWNSAMPLED 1-s2.0-S0926860X17301989-gr3.jpg https://s3-eu-west-1.amazonaws.com/prod-ucs-content-store-eu-west/content/pii:S0926860X17301989/gr3/DOWNSAMPLED/image/jpeg/16576c0f0f5403c1c5c3c19629bc9d77/gr3.jpg https://s3.amazonaws.com/prod-ucs-content-store-us-east/content/pii:S0926860X17301989/gr3/DOWNSAMPLED/image/jpeg/16576c0f0f5403c1c5c3c19629bc9d77/gr3.jpg gr3 gr3.jpg jpg 31806 438 291 IMAGE-DOWNSAMPLED 1-s2.0-S0926860X17301989-gr4.jpg https://s3-eu-west-1.amazonaws.com/prod-ucs-content-store-eu-west/content/pii:S0926860X17301989/gr4/DOWNSAMPLED/image/jpeg/9a51678ff8565ea0b384f7c096b865a3/gr4.jpg https://s3.amazonaws.com/prod-ucs-content-store-us-east/content/pii:S0926860X17301989/gr4/DOWNSAMPLED/image/jpeg/9a51678ff8565ea0b384f7c096b865a3/gr4.jpg gr4 gr4.jpg jpg 41921 298 565 IMAGE-DOWNSAMPLED 1-s2.0-S0926860X17301989-gr5.jpg https://s3-eu-west-1.amazonaws.com/prod-ucs-content-store-eu-west/content/pii:S0926860X17301989/gr5/DOWNSAMPLED/image/jpeg/19122fdca2f0b1e56a740de0b95936b9/gr5.jpg https://s3.amazonaws.com/prod-ucs-content-store-us-east/content/pii:S0926860X17301989/gr5/DOWNSAMPLED/image/jpeg/19122fdca2f0b1e56a740de0b95936b9/gr5.jpg gr5 gr5.jpg jpg 181579 829 791 IMAGE-DOWNSAMPLED 1-s2.0-S0926860X17301989-gr6.jpg https://s3-eu-west-1.amazonaws.com/prod-ucs-content-store-eu-west/content/pii:S0926860X17301989/gr6/DOWNSAMPLED/image/jpeg/5d26fba95b2c4e0a13386d56230723b9/gr6.jpg https://s3.amazonaws.com/prod-ucs-content-store-us-east/content/pii:S0926860X17301989/gr6/DOWNSAMPLED/image/jpeg/5d26fba95b2c4e0a13386d56230723b9/gr6.jpg gr6 gr6.jpg jpg 24560 110 339 IMAGE-DOWNSAMPLED 1-s2.0-S0926860X17301989-gr7.jpg https://s3-eu-west-1.amazonaws.com/prod-ucs-content-store-eu-west/content/pii:S0926860X17301989/gr7/DOWNSAMPLED/image/jpeg/7371d42dbdab2b4bd12818e7cd744203/gr7.jpg https://s3.amazonaws.com/prod-ucs-content-store-us-east/content/pii:S0926860X17301989/gr7/DOWNSAMPLED/image/jpeg/7371d42dbdab2b4bd12818e7cd744203/gr7.jpg gr7 gr7.jpg jpg 28911 202 339 IMAGE-DOWNSAMPLED 1-s2.0-S0926860X17301989-gr8.jpg https://s3-eu-west-1.amazonaws.com/prod-ucs-content-store-eu-west/content/pii:S0926860X17301989/gr8/DOWNSAMPLED/image/jpeg/c04cff2d731858b653814404bc73c314/gr8.jpg https://s3.amazonaws.com/prod-ucs-content-store-us-east/content/pii:S0926860X17301989/gr8/DOWNSAMPLED/image/jpeg/c04cff2d731858b653814404bc73c314/gr8.jpg gr8 gr8.jpg jpg 32775 156 678 IMAGE-DOWNSAMPLED 1-s2.0-S0926860X17301989-fx1_lrg.jpg https://s3-eu-west-1.amazonaws.com/prod-ucs-content-store-eu-west/content/pii:S0926860X17301989/fx1/HIGHRES/image/jpeg/72bbe662c942e8abf2b1788d65f8e6ef/fx1_lrg.jpg https://s3.amazonaws.com/prod-ucs-content-store-us-east/content/pii:S0926860X17301989/fx1/HIGHRES/image/jpeg/72bbe662c942e8abf2b1788d65f8e6ef/fx1_lrg.jpg fx1 true fx1_lrg.jpg jpg 84895 886 943 IMAGE-HIGH-RES 1-s2.0-S0926860X17301989-gr1_lrg.jpg https://s3-eu-west-1.amazonaws.com/prod-ucs-content-store-eu-west/content/pii:S0926860X17301989/gr1/HIGHRES/image/jpeg/63d55e83ea6f0122c51dcf40974dda0c/gr1_lrg.jpg https://s3.amazonaws.com/prod-ucs-content-store-us-east/content/pii:S0926860X17301989/gr1/HIGHRES/image/jpeg/63d55e83ea6f0122c51dcf40974dda0c/gr1_lrg.jpg gr1 gr1_lrg.jpg jpg 188014 958 2333 IMAGE-HIGH-RES 1-s2.0-S0926860X17301989-gr2_lrg.jpg https://s3-eu-west-1.amazonaws.com/prod-ucs-content-store-eu-west/content/pii:S0926860X17301989/gr2/HIGHRES/image/jpeg/cc7f112ebbda628c330c54ada4ee4c67/gr2_lrg.jpg https://s3.amazonaws.com/prod-ucs-content-store-us-east/content/pii:S0926860X17301989/gr2/HIGHRES/image/jpeg/cc7f112ebbda628c330c54ada4ee4c67/gr2_lrg.jpg gr2 gr2_lrg.jpg jpg 102191 694 1500 IMAGE-HIGH-RES 1-s2.0-S0926860X17301989-gr3_lrg.jpg https://s3-eu-west-1.amazonaws.com/prod-ucs-content-store-eu-west/content/pii:S0926860X17301989/gr3/HIGHRES/image/jpeg/e66f211ae1b3e1f2714f18f3c3a81f89/gr3_lrg.jpg https://s3.amazonaws.com/prod-ucs-content-store-us-east/content/pii:S0926860X17301989/gr3/HIGHRES/image/jpeg/e66f211ae1b3e1f2714f18f3c3a81f89/gr3_lrg.jpg gr3 gr3_lrg.jpg jpg 152534 1940 1289 IMAGE-HIGH-RES 1-s2.0-S0926860X17301989-gr4_lrg.jpg https://s3-eu-west-1.amazonaws.com/prod-ucs-content-store-eu-west/content/pii:S0926860X17301989/gr4/HIGHRES/image/jpeg/8918d495b5e923a115b62b064371c213/gr4_lrg.jpg https://s3.amazonaws.com/prod-ucs-content-store-us-east/content/pii:S0926860X17301989/gr4/HIGHRES/image/jpeg/8918d495b5e923a115b62b064371c213/gr4_lrg.jpg gr4 gr4_lrg.jpg jpg 234539 1319 2500 IMAGE-HIGH-RES 1-s2.0-S0926860X17301989-gr5_lrg.jpg https://s3-eu-west-1.amazonaws.com/prod-ucs-content-store-eu-west/content/pii:S0926860X17301989/gr5/HIGHRES/image/jpeg/5fbbf35d0cded4026c40551c6f878e0e/gr5_lrg.jpg https://s3.amazonaws.com/prod-ucs-content-store-us-east/content/pii:S0926860X17301989/gr5/HIGHRES/image/jpeg/5fbbf35d0cded4026c40551c6f878e0e/gr5_lrg.jpg gr5 gr5_lrg.jpg jpg 1557377 3666 3500 IMAGE-HIGH-RES 1-s2.0-S0926860X17301989-gr6_lrg.jpg https://s3-eu-west-1.amazonaws.com/prod-ucs-content-store-eu-west/content/pii:S0926860X17301989/gr6/HIGHRES/image/jpeg/e779bd44f235d9f2cf8a8684eb37512b/gr6_lrg.jpg https://s3.amazonaws.com/prod-ucs-content-store-us-east/content/pii:S0926860X17301989/gr6/HIGHRES/image/jpeg/e779bd44f235d9f2cf8a8684eb37512b/gr6_lrg.jpg gr6 gr6_lrg.jpg jpg 79660 485 1500 IMAGE-HIGH-RES 1-s2.0-S0926860X17301989-gr7_lrg.jpg https://s3-eu-west-1.amazonaws.com/prod-ucs-content-store-eu-west/content/pii:S0926860X17301989/gr7/HIGHRES/image/jpeg/d6285e38d68225c2b42d8f7f1ee8104f/gr7_lrg.jpg https://s3.amazonaws.com/prod-ucs-content-store-us-east/content/pii:S0926860X17301989/gr7/HIGHRES/image/jpeg/d6285e38d68225c2b42d8f7f1ee8104f/gr7_lrg.jpg gr7 gr7_lrg.jpg jpg 111805 894 1500 IMAGE-HIGH-RES 1-s2.0-S0926860X17301989-gr8_lrg.jpg https://s3-eu-west-1.amazonaws.com/prod-ucs-content-store-eu-west/content/pii:S0926860X17301989/gr8/HIGHRES/image/jpeg/94e1301f4eccb7680696a307235bd7f5/gr8_lrg.jpg https://s3.amazonaws.com/prod-ucs-content-store-us-east/content/pii:S0926860X17301989/gr8/HIGHRES/image/jpeg/94e1301f4eccb7680696a307235bd7f5/gr8_lrg.jpg gr8 gr8_lrg.jpg jpg 169731 691 3000 IMAGE-HIGH-RES 1-s2.0-S0926860X17301989-mmc1.pdf https://s3-eu-west-1.amazonaws.com/prod-ucs-content-store-eu-west/content/pii:S0926860X17301989/mmc1/MAIN/application/pdf/3e389f6462ba0f702c5930fc4df87426/mmc1.pdf https://s3.amazonaws.com/prod-ucs-content-store-us-east/content/pii:S0926860X17301989/mmc1/MAIN/application/pdf/3e389f6462ba0f702c5930fc4df87426/mmc1.pdf mmc1 mmc1.pdf pdf false 595911 APPLICATION APCATA 16230 S0926-860X(17)30198-9 10.1016/j.apcata.2017.05.008 Elsevier B.V. Fig. 1 Main reactions implied in glucose valorization (inspired from [1]). Fig. 1 Fig. 2 TGA curves of a) CB support b) 12.05 Pd wt.% c) 6.41 Pd wt.% and d) 2.50 Pd wt.% loaded Pd/CB catalysts prepared by urea-assisted deposition process. Fig. 2 Fig. 3 XRD phase analysis of (a) TGA residues and (b) metallic Pd and Pd oxide references [30,31]. Fig. 3 Fig. 4 TGA curves of (a) PR and (b) HD catalysts. Fig. 4 Fig. 5 TEM micrographs and particles size distribution of PR catalyst treated at a) RT, b) 573K, c) 873K, d) 1173K and HD catalyst treated at e) RT, f) 573K,g) 873K and h) 1173K. Fig. 5 Fig. 6 Oxidative dehydrogenation of glucose. Fig. 6 Fig. 7 Normalized activity dependence on Pd particle size. Fig. 7 Fig. 8 Schematics of particle size effects observed in this work. Fig. 8 Table 1 Palladium composition of the catalysts determined by XPS. Table 1 PR HD RT 573K 873K 1173K RT 573K 873K 1173K Pd (at.%) 0.38 0.21 0.17 0.12 0.47 0.39 0.13 0.15 Pd3d5/2 (eV) 335.9 335.5 335.4 335.9 335.5 335.7 335.7 335.8 Table 2 Palladium mass percentage either calculated or obtained by TGA and ICP measurements for three different Pd/CB catalysts prepared by urea-assisted deposition process. Table 2 Entry theoretical (wt.%) a TGA (wt.%) ICP (wt.%) 1 12.05 12.17 10.80 2 6.41 6.43 5.62 3 2.50 2.50 2.29 a Calculated on the basis of the amount of metallic precursor and carbon black engaged in the synthesis. Table 3 Palladium mass percentage for the eight Pd/CB catalysts determined by TGA (expected value: 2.50wt.% in all cases). Table 3 Pd wt.% PR HD RT 2.6±0.4 2.6±0.4 573K 2.1±0.4 2.2±0.4 873K 2.2±0.4 2.2±0.4 1173K 2.5±0.4 2.4±0.4 Table 4 Catalytic performance of Pd/CB catalysts for oxidative dehydrogenation of glucose. Table 4 PR HD Yield Normalized activity a k0cat. b Yield Normalized activity a k0cat. b RT 30 21 0.31 14 6 0.17 573K 50 32 1.01 27 10 0.44 873K 8 5 0.12 22 11 0.30 1173K 0 0 0.00 0 0 0.00 a Normalized activity = (mmol gluconic acid produced)/(mmol Pd *time), (time = 4 h). b k0cat. = initial activity (mmol/L acid gluconic produced *s−1*1000) determined graphically in the linear part of the curve at low reaction time (time = 600 s). Table 5 Palladium composition of the catalysts determined by XPS before and after catalytic test. Table 5 Pd/CB catalyst (PR) at RT As synthesized (at.%) After 4h of catalytic test (at.%) After 24h of catalytic test (at.%) C1s 97.35 88.28 85.08 O1s 2.21 10.24 13.07 Pd3d5/2 0.38 0.15 0.03 Particle size effect in glucose oxidation with Pd/CB catalysts Tommy Haynes a Vincent Dubois b Sophie Hermans a ⁎ a IMCN Institute, Université catholique de Louvain, Place L. Pasteur 1, 1348 Louvain-la-Neuve, Belgium IMCN Institute Université catholique de Louvain Place L. Pasteur 1 Louvain-la-Neuve 1348 Belgium b Department of Physical Chemistry and Catalysis, Meurice Institute, rue E. Gryzon, 1, 1070 Brussels, Belgium Department of Physical Chemistry and Catalysis Meurice Institute rue E. Gryzon, 1 Brussels 1070 Belgium ⁎ Corresponding author. Graphical abstract Palladium nanoparticles supported on carbon black were synthesized by two different methods precipitation- reduction (PR) and urea-assisted sodium formate homogeneous deposition (HD). The catalysts were then submitted to thermal treatments at 573K, 873K and 1173K to produce catalysts with a wide range of particle sizes. The obtained catalysts were characterized by XPS, TEM CO chemisorption and TGA measurements and tested in the oxidative dehydrogenation of glucose to gluconic acid. It was found that catalysts with a palladium particles size of 7nm exhibit the highest activity. Above or below this particular value the oxidative dehydrogenation of glucose appeared less efficient. Keywords Glucose Dehydrogenation Oxidation Palladium Catalyst Nanoparticles Carbon black 1 Introduction Since many years the development of sustainable alternatives to non-renewable fossil feedstock has attracted researchers across the world [1]. In this context, carbohydrates, derived from lignocellulosic biomass represent an attractive option for the production of high added-value compounds with pharmaceutical and fine chemistry applications [2–4]. Due to the difficulty in controlling selectivity of carbohydrate transformations, most industrial processes are based on chemo-catalytic methodologies that involve enzyme and microbial biocatalysts [5,6]. However, the use of biocatalysts has limitations such as stability, high cost and difficulty in recovery after catalytic reaction. The replacement of enzymatic process by supported catalysts is an interesting alternative to overcome these drawbacks [7]. Sugar conversion using heterogeneous catalysts has been the subject of many investigations, such as those mentioned in a recent review [8]. In general, carbohydrate transformation is carried out in aqueous liquid phase and produces various chemical intermediates by numerous biomass-based reactions such as hydrolysis, hydrogenation, oxidation, dehydration, isomerization, aldol condensation and reforming [1]. Glucose, a saccharide derived from cellulose hydrolysis, is a platform chemical to synthesize valuable products. It can be converted into ethanol (fermentation), sorbitol (hydrogenation), 5-hydroxymethyl furfural (dehydration), hydrogen (reforming), gluconic acid (oxidation) and by combining several types of reactions it is possible to produce a wide range of products [8] (Fig. 1 ). Among all products derived from glucose, gluconic acid and its salts are important industrial chemicals [9]. In 2007, its global annual production amounted to 100,000 tons per year. It is widely used in pharmaceutical, food and textiles industries. Gluconic acid displays also an important application in dairy and metallurgic industries based on its chelating properties with calcium, iron, copper, aluminum and other heavy metals. Currently, gluconic acid is manufactured by glucose microbial fermentation processes [7,8]. Gluconic acid and its derivatives can also be obtained by oxidation of aqueous glucose solutions in the presence of supported metal catalysts. Pd and Pt are the most common metals used for glucose oxidation [9–13]. These are often combined with promoters such as Bi, Sn and Te [14–19] which act as co-catalysts to improve the selectivity, activity and durability of Pd and Pt catalysts. Promoters are known to prevent overoxidation of the noble metal, arising from strong adsorption of oxygen on the metal surface. Recently a special interest has been focused on gold due to its high selectivity and high activity in carbohydrates oxidation [20–22]. However, usual deactivation phenomena, such as sintering and leaching, have restricted its industrial use [8]. Though it is known that biomass conversions are structure-sensitive reactions [23–26], the number of studies dealing with this subject for glucose oxidation over Pd supported catalysts is very poor [11]. The present study is focused on the preparation of Pd nanoparticles supported on carbon black catalysts by two different reduction methods, namely precipitation- reduction (PR) and urea-assisted sodium formate homogeneous deposition (HD) [27,28], in order to induce different particle sizes. The influence of catalyst synthetic methods and indirectly of Pd particle sizes on catalytic performance in the glucose oxidation reaction will be investigated. Moreover, to perform a significant particles size comparative study, the catalysts will be submitted to thermal treatment at 3 temperatures: 573K, 873K and 1173K to induce sintering and produce samples with gradually increased particle sizes. The carbonaceous material support has been selected for its non-porous structure which should help to avoid internal diffusional limitations implied in liquid phase reactions. The goal of this work is thus to determine the optimal Pd particles size in Pd/CB catalysts for the selective oxidation of glucose into gluconic acid. 2 Experimental section The carbon black support was received as 250G type from IMERYS GRAPHITE & CARBON (Fig. S1 in Supplementary data for textural characterization). It will be noted CB. It has been analyzed by ICP after acid digestion under microwave irradiation with a multi-element (10ppm) solution as reference. No trace of metallic element was found above 10ppm. Sodium borohydride (NaBH4, >98%), sodium tetrachloropalladate (II) (Na2PdCl4, 98%), sodium carbonate (Na2CO3), ethylene glycol (EG, >99.5%), urea (99–100%) and sodium formate (FAM, 97%) were purchased from Sigma Aldrich and used as received. 2.1 Synthesis of Pd/CB catalysts Several Pd/CB catalysts were prepared by two synthetic strategies, namely precipitation-NaBH4 reduction (PR) and urea-assisted sodium formate homogeneous deposition (HD) process. In PR synthesis, a conventional precipitation-reduction method was used with NaBH4 as reducing agent: 4g of CB dispersed in 400mL of a Na2CO3 2.5wt.% aqueous solution were stirred 15min at room temperature. 285mg of Na2PdCl4 (corresponding to 2.5wt.% Pd in final activated catalyst) dissolved in 20mL of distilled water were added dropwise to the suspension within 1h. 5g of NaBH4 in 20mL of distilled water were then added. The suspension was stirred magnetically for 2h. Finally the catalyst was filtered out, washed with distilled water (1L) and dried overnight at 383K. For HD synthesis, 1.2g of urea were first dissolved in 300mL distilled water. 4g of CB were added and the mixture was stirred for 15min. To this solution, 285mg of Na2PdCl4 (2.5wt.% Pd) were added. After stirring for 1h, the mixture was heated to 393K for 1h and was then cooled down to room temperature. Next, 14g of sodium formate were added and the solution was stirred for 1h. Finally, the mixture was heated to 403K, kept for 1h at that temperature, cooled down, and stirred overnight at RT. The solid was filtered out, washed with distilled water (1L) and dried overnight at 383K 2.2 Characterization methods The solid catalysts were characterized by X-ray photoelectron spectroscopy (XPS), transmission electron microscopy (TEM), thermogravimetric analysis (TGA), powder X-ray diffraction (XRD), Elemental analyses (ICP) and CO chemisorption. XPS analyses were carried out at room temperature with a SSI-X-probe (SSX 100/206) photoelectron spectrometer from Surface Science Instruments equipped with a monochromatized microfocus Al X-ray source. Samples were stuck onto small sample holders with double-face adhesive tape and then placed on an insulating ceramic carousel (Macor®, Switzerland). Charge effects were avoided by placing a nickel grid above the samples and using a flood gun set at 8eV. The binding energies were calculated with respect to the CC component of the C1s peak fixed at 284.8eV. Data treatment was performed using the CasaXPS program (Casa Software Ltd., UK). The peaks were decomposed into a sum of Gaussian/Lorentzian (85/15) after subtraction of a Shirley-type baseline. To evaluate the morphology of the samples, TEM images were obtained on a LEO 922 Omega Energy Filter Transmission Electron Microscope operating at 120kV. The samples were suspended in hexane under ultrasonic treatment. A drop of the supernatant was deposited on a holey carbon film supported on a copper grid (Holey Carbon Film 300 Mesh Cu), which was dried overnight under vacuum at room temperature, before introduction in the microscope. Thermograms were recorded on a TGA/SDTA 851e from Mettler Toledo. Samples (5–10mg) in alumina containers were heated at 10K/min under air flux. CO chemisorption measurements were carried out on an ASAP 2020 apparatus from Micromeritics. The samples (about 100mg) were degassed at 383K for 2h under dynamic vacuum. They were then submitted to a pretreatment under He at 373K for 30min. The catalysts were then reduced under hydrogen during 2h at 373K. The hydrogen was evacuated during 2h and once at room temperature again, CO was swept onto the samples. The Pd dispersion was calculated by considering a surface Pd:CO stoichiometry equal to 1. For XRD measurements, samples were introduced into 0.5mm thin-walled glass capillaries (Hilgenberg GmbH), mounted on a goniometer head and kept at 200mm from the detector. Diffractograms were then collected at room temperature using a MAR345 diffractometer (MarResearch GmbH), a Mo-Kα (0.71073Å) anode and a XENOCS focusing mirror. The obtained 2D diffractograms were azimuthally integrated using the Fit2D software and calibrated with a LaB6 standard (NIST 660b Standard). The elemental analyses (C, H, N, O, Pd) have been realized by MEDAC Ltd., UK by microgravimetry for C, H, N, O (direct measure) and by ICP after acid digestion for Pd. 2.3 Thermal treatment All the supported catalysts were submitted to a thermal treatment in a tubular oven STF 16/450 from CARBOLITE. The samples were placed into porcelain combustion boats and heated during 1h at the selected temperature (573K, 873K and 1173K, heating ramp and cooling ramp: 100K/h) under a N2 stream. Under these inert conditions, the carbon black support is not consumed. 2.4 Oxidative dehydrogenation of glucose: catalytic experiments The oxidation of glucose into gluconic acid was carried out in a 600mL thermostatized double-walled glass reactor. The pH of the glucose solution was measured continuously by a combined AgCl/Ag Beckman electrode. An automatic titration device Metrohm 842 Titrando was used to neutralize the acids formed over time with a 0.1M KOH solution to keep the pH at a constant value. Constant stirring was ensured by a mechanical stirrer (Heidolph RZR 2051 electronic). Oxygen was introduced in the solution under constant flow controlled by a flowmeter, using a bent glass tube. Experimentally, 500mL of milliQ water were added to the reactor containing 0.9g of glucose in order to obtain a concentration of 10mmol/L. When the temperature was set to 323K, the stirring rate was fixed at 1000rpm, the oxygen flow at 0.5mL/min and the pH was brought to 9 with the KOH solution. The test started when 0.100g of Pd/C catalyst- was added. After 4h of reaction with continuous pH control to keep it constant at pH=9, the catalyst was recovered by filtration and the filtrate, brought to 1L, was analyzed by HPLC. HPLC analysis was performed on a Waters system equipped with a refractive index 2414 detector and a UV 2998 Photodiode Array detector. To quantify gluconic acid, an Aminex BioRad HPX-87C column was used, with CaSO4 1.2mmol/L solution as eluent, a flow rate of 0.8cm3/min, a column temperature of 353K. Injected sample volume is 10μL. The gluconic acid yield was calculated using the equation: gluconicacidyield(%)=(mmolgluconicacid)/(mmolglucoseengaged)×100(%) Apart from gluconic acid obtained with >90% selectivity, the only by-product is fructose, produced by non-catalytic isomerization of glucose in very low amounts (<10%). No other carboxylic acid was detected, as in previous studies where a HPLC column specific for carboxylic acids and 13C NMR were used to confirm it [21,29]. 3 Results and discussion Several 2.5wt.% Pd/CB catalysts were synthesized by a precipitation-reduction method (PR) and a urea-assisted sodium formate (HD) homogeneous deposition process. We expect the HD method to give the smallest particle sizes because of slow pH rise promoted by urea, while the PR method uses faster reduction by NaBH4. The catalysts were heated at 573K, 873K and 1173K in order to produce catalysts with different particle sizes after a potential sintering process. The catalysts (heated or untreated) were characterized by XPS, TGA, ICP, CO chemisorption and TEM. The catalytic properties of all samples were evaluated in glucose oxidation. 3.1 XPS XPS characterization of all catalysts revealed that the palladium on the surface of the carbon black support was in metallic form for each synthesis method with binding energies between 335.4 and 335.9eV for Pd3d5/2 confirming the efficiency of the reduction processes (see Table 1 and Fig. S3 in Supplementary data for an illustrative example of spectra). The acquired XPS data also showed a decrease in Pd surface atomic% with increased temperature of the thermal treatment, due to thermally induced sintering leading to larger size Pd particles. As illustrated in Fig. S2 in Supplementary data, the XPS depth information being constant from one sample to another, it is logical that the detected Pd surface concentration gradually reduces with temperature for the same bulk content in Pd [30]. The XPS spectra disclose the presence of palladium, nitrogen and oxygen indicating that catalysts were not contaminated by chlorine from palladium precursor (Fig. S3 in Supplementary data). From XPS characterization, it was concluded that all catalysts could be used for catalytic glucose oxidation and that the thermal treatments appears to have modified the catalysts surface structure. The catalysts particle size distribution has also been studied in more details by TEM, as described below. 3.2 TGA TGA measurements were performed on the eight catalysts to determine the Pd mass percentage loaded on the support by the two synthetic methods. These TGA analyses were carried out under air to consume the CB support: hence the residue at high temperature is connected to the metal content. In order to achieve this, three catalysts with respectively 12wt.%, 6.5wt.% and 2.5wt.% of palladium were first prepared by HD process and analyzed by TGA in air. The TGA results were compared with ICP and calculated values of Pd loading. As shown in Fig. 2 , pure carbon black is completely consumed at 923K under air. On the contrary, when Pd is deposited on the CB support (b, c and d TGA curves) the catalysts give a high temperature residue. By comparing the results obtained by TGA (mass% corresponding to non-consumed residue) with theoretical (from engaged amounts of reactants) and ICP palladium mass% (Table 2 ), we see that the remaining mass in TGA curves can be attributed in each case to the palladium mass percentage loaded on the support. Thus, TGA measurements in air can be used to provide with speed and accuracy the mass percentage loading of noble metal in carbon-supported catalysts [31]. It was also noted that the ICP results (Table 2) are systematically lower than the values either calculated or extracted from TGA analysis. Moreover, the ICP undervaluation remains at a constant value of ∼10%, pointing towards a systematic error. This underestimation could be assigned to a difficulty of dissolving all the palladium present on carbon black in acidic solution, but not to metal impurities in the starting carbon. On the other hand, it is conceivable that under high temperature an oxide layer has been formed on palladium residues during TGA measurement. This layer could give an incorrect estimation of the palladium mass percentage loading. Nevertheless, the XRD phase analysis of the Pd residues obtained after TGA measurement (Fig. 3 a) shows clearly that these residues consist mainly of metallic palladium in comparison with references (Fig. 3b) [32,33]. In addition, the thermal behavior of Pd/PdO upon heating has been studied and it was shown that Pd metal is obtained at such high temperatures [34].We also observed on TGA curves a shift to lower decomposition temperatures for higher Pd mass percentage. This result implies that the deposited palladium nanoparticles accelerate the thermal decomposition of carbon black support in air. Moreover, in order to determine the precision of the Pd mass percentage determination obtained by TGA measurements (Table 3 ), one Pd/CB catalyst prepared by the PR method has been analyzed seven times. The mean palladium mass percentage obtained is 2.63 with a standard deviation of 0.39 (Table S1 in Supplementary data). This value is close to the theoretical value of 2.50wt.% and confirms the reliability of TGA measurements. Finally, the eight catalysts have then been analyzed by TGA in air in a similar manner. The palladium mass percentages obtained are reported in Table 3. All catalysts are close to the expected loading (2.5wt.%). The slight variations observed could be attributed to the preparation conditions. These catalysts were prepared on a larger scale (4g of carbon black) than the samples presented in Table 2. TGA curves of each Pd/CB catalyst, grouped by synthesis method, are also reported in Fig. 4 . For each given synthetic method, TGA curves are shifted to higher decomposition temperature with increasing thermal treatment temperature. The structure of Pd nanoparticles influences the temperature of carbon black support decomposition. As shown by XPS analyses, when the temperature of thermal treatment increases, the Pd nanoparticles size goes up. Therefore, it seems that the smaller is the Pd particle size, the lower is the CB decomposition temperature. This effect is ascribed to a catalytic role of Pd nanoparticles (increasing with diminishing Pd particle sizes) in CB decomposition. These results will be complemented by a particles size distribution study by TEM. 3.3 TEM and dispersion TEM images of Pd/CB catalysts prepared by the PR and HD methods and treated at 573K, 873K and 1173K are shown in Fig. 5 . Pd particles size distributions were built on no less than one hundred particles. As expected, TEM images clearly show the formation of larger Pd nanoparticles with higher temperature post-treatment with an average size of 4.0nm, 7.0nm, 12.3nm, 14.6nm (PR method) and 2.3nm, 3.4nm, 19.2nm and 30.4nm (HD method) for, respectively, untreated catalysts and samples thermally treated at 573K, 873K and 1173K (Fig. 5). In addition, the distribution range of RT catalysts is much narrower than when treated at 573K, which is also narrower than at 873K and 1173K. Those results corroborate the results previously obtained by XPS and TGA measurements. Pd dispersion values of each catalyst were measured by CO chemisorption (Table S2 in Supplementary data). Obviously the dispersion decreases with increasing heat treatment. The catalysts prepared by the HD method are initially better dispersed than by using the PR method, as expected. Here, particle size calculated from CO chemisorption values gives an average value which is meaningless, given the non-Gaussian particle sizes distributions and the presence of some much larger particles (see TEM images). 3.4 Catalytic tests The catalytic performance of synthesized catalysts was evaluated in model biomass reaction: the oxidative dehydrogenation of glucose into gluconic acid (Fig. 6 ). The yield in gluconic acid (%) was determined over time (see Fig. S4 in Supplementary data). As the different curves present similar trends and do not cross each other, we compare the different catalysts after a given reaction time, here 4h of reaction. The comparison between Pd/CB catalysts was made on the basis of yield (%), normalized activity (mmol gluconic acid produced per mmol Pd *time, in h−1 units) and initial activity values (k0cat., mmols−1) (Table 4 ). TOF values were also calculated taking into account metallic dispersion values (Tables S2 and S3 in Supplementary data). The gluconic acid yield ranges between 0% and 50%, which reflects the strong influence of Pd particles size on catalytic activity [11]. The preparation method and support are the same in all cases and, with the support being non porous, internal accessibility issues can be discarded (Fig. S1 in Supplementary data). We have performed standard tests for external mass transfer limitations (Fig. S5 in Supplementary data), by changing stirring rates and amounts of catalysts. To be on the safe side, we have selected the data obtained with 100mg of catalyst, where increasing the stirring rate has no influence on catalytic activity, and dividing the mass of catalyst gives a half yield. For discarding internal mass transfer limitations, we have grinded a catalyst and tested it in the same conditions, which also gave same performance. To compare the influence of Pd particles size on catalytic activity, we refer to the TEM images in Fig. 5. It should be noted that particle sizes are not affected by the catalytic test conditions (50°C in water), as demonstrated by TEM imaging after testing (see Fig. S6 in Supplementary data). The best yield (50%) was obtained with the catalyst prepared by PR method at 573K. As it can be observed in Fig. 5, the Pd nanoparticles produced by this method have an average size of 7nm. Moreover, with this method, the Pd nanoparticles were homogeneously deposited on the carbon black support. It was expected that urea-assisted method would produce catalysts with smaller Pd particle sizes than the PR preparation method [27,28]. It has been demonstrated that the in situ hydrolysis of urea enables a homogeneous gradual deposition of very small metal nanoparticles on a given support. Indeed, the HD samples at RT have an average particles size of 2.3nm±0.6nm (Fig. 5e). However, after thermal treatment at 573K, we have noted the formation of isolated large Pd particles (>10nm) aggregates in HD catalysts (Fig. 5f) which results in a broadening size distribution and rise in average size to 3.4±4.7nm. Nevertheless, we notice from particle sizes distributions that more than 60% of Pd nanoparticles have a size smaller than 4nm, even after the thermal treatment. Moreover, the Pd metallic dispersion does not change drastically when comparing the two HD samples at RT and 573K (Table S2 in Supplementary data). This shows the weak influence of the large Pd particles on dispersion and therefore on the catalyst activity. The behavior is dominated by the smallest ones. The lowest yields are observed with catalysts treated at the highest temperature (1173K). This is also not surprising. As previously shown in Fig. 5d–h, most Pd particles have a size larger than 12nm when catalysts were treated at this high temperature. This strong loss of activity is explained by a very low catalytically-active metal surface. This is shown in Table S2 in Supplementary data (giving values of metallic surface (m2/g sample)), where these samples appear with metallic dispersion values below 1%. The normalized activity values calculated by using the total amount of Pd in the catalysts follow the same trends as the yields. By contrast, the TOF values calculated using Pd dispersion measured by CO chemisorption (Table S3 in Supplementary data) do not respect the same tendency. This is due to the fact that particle size increases dramatically and the metal dispersion reaches very small value at high temperature (when treated at 1173K). Hence, when dividing quite similar activities by these very small numbers, very high TOF values are obtained artificially. We do not believe that these badly dispersed catalysts are the most performant. When looking at the activity versus time (Fig. S4 in Supplementary data), all catalysts behave similarly over time (parallel curves), indicating that there are not drastically different mechanisms occurring on our different particle sized catalysts. Parallel curves for catalysts with different particle sizes have been also shown before by other authors for this reaction [10]. We also calculated an initial activity (k0cat. in Table 4) based on the slope of the conversion versus time curves. The trends are the same as observations based on normalized activity values, which is logical because all the curves are parallel (within a series of heat-treated samples prepared by the same method). All these comments indicate clearly that the optimal Pd particle size for glucose oxidation is around 7nm (Fig. 7 ) which is in good agreement with the results reported by Parmon et al. [10]. They claimed that Pd/C catalysts with the smallest noble metal particle sizes (3nm) deactivate more rapidly hence are less performant. This particle size effect was also observed with gold catalysts [25] which corroborates the structure sensitivity of sugars oxidation. Based on the work of Besson et al., it was also proven that small Pd nanoparticles were less resistant to strong Pd-O bond formation which deactivates the catalyst [8]. This phenomenon could explain the difference in normalized activity values observed between a urea-assisted process and a PR conventional synthetic method. It is generally admitted that glucose oxidation proceeds according to an oxidative dehydrogenation mechanism [35], where the first step is abstraction of H atoms by the metal surface. Hence it requires available surface sites for sugar adsorption, and overwhelming oxygen coverage is deleterious. It is known that the presence of electronegative atoms such as O decrease the strength of H-atoms adsorption. The effect of surface site blocking for hydrogen is attributed to both steric and long-range electronic effects. In consequence, the smallest particles, highly covered in O atoms, are less active. Conversely, the largest particles are not able to either bind strongly the sugar molecules, or more importantly to carry out the dehydrogenation H cleavage, which is believed to be the rate-determining step. A direct comparison of activity values with catalysts from the literature cannot be made easily since the reaction parameters vary from a study to another. However, the values obtained in this work falls within the range of activity values reported in the literature [10,11,13] (Table S4 in Supplementary data): when comparing the normalized activity (in h−1), we obtained 32, while other authors report 21 or ∼50 with Pd catalysts supported on active charcoal (using respectively 5 and 3.5wt.% Pd loading). Using Bi promotors, the performance is greatly enhanced [13,19]. Nevertheless, these undergo substantial leaching which is a considerable drawback for industrial use. It has also to be noted that a loss of activity over time was always observed for each catalyst (Fig. S4 in Supplementary data), which is very common for non-promoted catalysts in this reaction. The oxidation of palladium catalysts is usually recognized as a deactivation phenomenon in glucose oxidation [10]. Here, Pd(0) was still the main component of Pd3d XPS photopeaks after 24h of reaction. Nevertheless Table 5 clearly shows a progressive increase in O1s atomic percentage and, a contrario, a decrease in surface Pd3d and C1s atomic percentage after four hours and twenty-four hours of catalytic test, respectively. The O/Pd surface ratio is above a stoichiometric Pd1:O1 ratio expected for the PdO oxide, therefore the surface oxygen content might be attributed to: (i) Pd coverage by O adatoms, (ii) carbon support oxygen coverage or (iii) adsorbed sugars which are oxygen-rich molecules. The last hypothesis can be discarded because TGA analysis of a spent catalyst showed no mass loss corresponding to carbohydrates (Fig. S7 in Supplementary data). Furthermore, the reaction mixture was analyzed by Pd atomic absorption after catalytic test. No Pd in solution was observed after the catalytic reaction. It should also be noted that no variation of Pd mass percentage was observed by TGA. This clearly shows that the decrease in Pd3d surface atomic percentage observed by XPS (Table 5) has not been caused by palladium leaching. These observations suggest that the catalysts were deactivated by a gradual formation of oxygen layers on the Pd particles. In summary, we found that Pd/CB catalysts present an optimal activity when particle sizes distribution is centered at a value of 7nm. This is probably a compromise between accessibility for sugar and oxygen coverage. On the smallest particles, oxygen coverage increases drastically, because of the presence of more edges and corners. On the largest particles, active metal surface is greatly reduced, hence the number of adsorption sites for sugar molecules, where it could be transformed, is diminished. This has been schematically sketched in Fig. 8 . One could also argue that a minimal step size is necessary for sugar adsorption. These steps or flat Pd surfaces do not exist anymore in the smallest particles, due to their high degree of curvature. 4 Conclusion In this work, the influence of particle sizes on catalytic performance in the oxidative dehydrogenation of glucose has been clearly evidenced for carbon black supported Pd nanoparticle catalysts. The supported catalysts were prepared by different reduction methods and were submitted to thermal treatment at 573K, 873K and 1173K to cover a broad range of palladium particle sizes (from 1 to 50nm). All the catalysts were characterized by XPS, TEM, CO chemisorption and TGA measurements. According to XPS and TEM, each catalyst discloses the presence of metallic palladium with a proportional increase in particles size with thermal treatment. We have also validated an unusual methodology to quickly determine the palladium mass percentage in each catalyst using TGA. The Pd/CB catalysts exhibiting the best catalytic activity present a metal particles size of 7nm. Below this size, the TOF values decrease due to rapid deactivation by oxygen deposition on palladium particles. Above this size, the active metal surface is greatly reduced. Nevertheless, oxygen coverage occurs after a while for each catalyst regardless of the catalyst preparation method. We have demonstrated that the catalytic activity is extremely sensitive to particle sizes. As it is quite tricky to control supported particle sizes within 1nm values, this shows how many reactions involving similar substrates could still be improved by using tailored catalysts. Acknowledgments We acknowledge the FRS-FNRS, Fédération Wallonie-Bruxelles, Loterie Nationale, and Université catholique de Louvain for funding. We are also grateful to Jean-François Statsijns for technical assistance, Francisco Mederos-Henry for XRD characterizations and Michael L. Singleton for proof-reading the manuscript. We also thank the IMERYS GRAPHITE & CARBON firm for generous donation of carbon black. Appendix A Supplementary data Supplementary data associated with this article can be found, in the online version, at http://dx.doi.org/10.1016/j.apcata.2017.05.008. Appendix A Supplementary data The following is Supplementary data to this article: References [1] D.Y. Murzin I.L. Simakova Catal. Ind. 3 2011 218 249 [2] M. Jiping Y. Weiqiang W. Min J. Xiuquan L. Fang X. Jie Chin. J. Catal. 34 2013 492 507 [3] F.W. Lichtenthaler S. Peters C. R. Chim. 7 2004 65 90 [4] J.N. Chheda G.W. Huber J.A. Dumesic Angew. Chem. Int. Ed. 46 2007 7164 7183 [5] H.P. Ramesh R.N. Tharanathan Crit. Rev. Biotechnol. 23 2003 149 173 [6] K. Buchholz J. Seibel Carbohydr. Res. 343 2008 1966 1979 [7] A. Tathod T. Kane E.S. Sanil P.L. Dhepe J. Mol. Catal. A: Chem. 388–389 2014 90 99 [8] M. Besson P. Gallezot C. Pinel Chem. Rev. 114 2014 1827 1870 [9] S. Anastassiadis I.G. Morgunov Recent Pat. Biotechnol. 1 2007 167 180 [10] I.V. Delidovich O.P. Taran L.G. Matvienko A.N. Simonov I.L. Simakova A.N. Bobrovskaya V.N. Parmon Catal. Lett. 140 2010 14 21 [11] C.K. Cheng P.Y. Xiang L.C. Jun Sci. China Chem. 53 2010 1598 1602 [12] H.E. Vandam A.P.G. Kieboom H. Van Bekkum Appl. Catal. 33 1987 361 372 [13] M. Besson F. Lahmer P. Gallezot P. Fuertes G. Flèche J. Catal. 152 1995 T [14] I. Witonska M. Frajtak S. Karski Appl. Catal. A: Gen. 401 2011 73 82 [15] A. Deffernez S. Hermans M. Devillers Appl. Catal. A: Gen. 282 2005 303 313 [16] S. Karski T. Paryjczak I. Witonska Kinet. Catal. 44 2003 618 622 [17] S. Karski I. Witonska J. Mol. Catal. A: Chem. 191 2003 87 92 [18] R.B. Bian J. Shen Mater. Trans. 48 2007 2252 2254 [19] M. Wenkin P. Ruiz B. Delmon M. Devillers J. Mol. Catal. A: Chem. 180 2002 141 159 [20] S. Biella L. Prati M. Rossi J. Catal. 206 2002 242 247 [21] S. Hermans A. Deffernez M. Devillers Appl. Catal. A: Gen. 395 2011 19 27 [22] H. Okatsu N. Kinoshita T. Akita T. Ishida M. Haruta Appl. Catal. A: Gen. 369 2009 8 14 [23] Y. Önal S. Schimpf P. Claus J. Catal. 223 2004 122 133 [24] A. Mirescu H. Berndt A. Martin U. Prüße Appl. Catal. A: Gen. 317 2007 204 209 [25] T. Ishida N. Kinoshita H. Okatsu T. Akita T. Takei M. Haruta Angew. Chem. Int. Ed. 47 2008 9265 9268 [26] N. Meyer D. Pirson M. Devillers S. Hermans Appl. Catal. A: Gen. 467 2013 463 473 [27] J.W. Geus Stud. Surf. Sci. Catal. 16 1983 1 [28] J.H. Kim J.-S. Yu J. Am. Chem. Soc. 131 2009 15330 15338 [29] M. Wenkin R. Touillaux P. Ruiz B. Delmon M. Devillers Appl. Catal. A: Gen. 148 1996 181 199 [30] R. Wojcieszak M.J. Genet P. Eloy P. Ruiz E.M. Gaigneaux J. Phys. Chem. C 114 2010 16677 16684 [31] C.-C. Chen C.-L. Lin L.-C. Chen Electrochim. Acta 152 2015 408 416 [32] J. Haglund F. Fernandez Guillermet G. Grimvall M. Korling Phys. Rev. 48 1993 11685 11691 [33] J. Waser H.A. Levy S.W. Peterson Acta Crystallogr. 6 1953 661 663 [34] H. Zhang J. Gromek G.W. Fernando S. Boorse H.L. Marcus J. Phase Equilib. 23 2002 246 248 [35] P. Gallezot Catal. Today 37 1997 405 418",
      "scopus-id": "85019561118",
      "coredata": {
        "eid": "1-s2.0-S0926860X17301989",
        "dc:description": "Palladium nanoparticles supported on carbon black were synthesized by two different methods precipitation- reduction (PR) and urea-assisted sodium formate homogeneous deposition (HD). The catalysts were then submitted to thermal treatments at 573K, 873K and 1173K to produce catalysts with a wide range of particle sizes. The obtained catalysts were characterized by XPS, TEM CO chemisorption and TGA measurements and tested in the oxidative dehydrogenation of glucose to gluconic acid. It was found that catalysts with a palladium particles size of 7nm exhibit the highest activity. Above or below this particular value the oxidative dehydrogenation of glucose appeared less efficient.",
        "openArchiveArticle": "false",
        "prism:coverDate": "2017-07-25",
        "openaccessUserLicense": null,
        "prism:aggregationType": "Journal",
        "prism:url": "https://api.elsevier.com/content/article/pii/S0926860X17301989",
        "dc:creator": [
          {
            "@_fa": "true",
            "$": "Haynes, Tommy"
          },
          {
            "@_fa": "true",
            "$": "Dubois, Vincent"
          },
          {
            "@_fa": "true",
            "$": "Hermans, Sophie"
          }
        ],
        "link": [
          {
            "@_fa": "true",
            "@rel": "self",
            "@href": "https://api.elsevier.com/content/article/pii/S0926860X17301989"
          },
          {
            "@_fa": "true",
            "@rel": "scidir",
            "@href": "https://www.sciencedirect.com/science/article/pii/S0926860X17301989"
          }
        ],
        "dc:format": "application/json",
        "openaccessType": null,
        "pii": "S0926-860X(17)30198-9",
        "prism:volume": "542",
        "prism:publisher": "Elsevier B.V.",
        "dc:title": "Particle size effect in glucose oxidation with Pd/CB catalysts",
        "prism:copyright": "© 2017 Elsevier B.V. All rights reserved.",
        "openaccess": "0",
        "prism:issn": "0926860X",
        "dcterms:subject": [
          {
            "@_fa": "true",
            "$": "Glucose"
          },
          {
            "@_fa": "true",
            "$": "Dehydrogenation"
          },
          {
            "@_fa": "true",
            "$": "Oxidation"
          },
          {
            "@_fa": "true",
            "$": "Palladium"
          },
          {
            "@_fa": "true",
            "$": "Catalyst"
          },
          {
            "@_fa": "true",
            "$": "Nanoparticles"
          },
          {
            "@_fa": "true",
            "$": "Carbon black"
          }
        ],
        "openaccessArticle": "false",
        "prism:publicationName": "Applied Catalysis A: General",
        "openaccessSponsorType": null,
        "prism:pageRange": "47-54",
        "prism:endingPage": "54",
        "pubType": "fla",
        "prism:coverDisplayDate": "25 July 2017",
        "prism:doi": "10.1016/j.apcata.2017.05.008",
        "prism:startingPage": "47",
        "dc:identifier": "doi:10.1016/j.apcata.2017.05.008",
        "openaccessSponsorName": null
      },
      "objects": {
        "object": [
          {
            "@category": "thumbnail",
            "@height": "163",
            "@width": "174",
            "@_fa": "true",
            "$": "https://api.elsevier.com/content/object/eid/1-s2.0-S0926860X17301989-fx1.sml?httpAccept=%2A%2F%2A",
            "@multimediatype": "GIF image file",
            "@type": "IMAGE-THUMBNAIL",
            "@size": "8816",
            "@ref": "fx1",
            "@mimetype": "image/gif"
          },
          {
            "@category": "thumbnail",
            "@height": "90",
            "@width": "219",
            "@_fa": "true",
            "$": "https://api.elsevier.com/content/object/eid/1-s2.0-S0926860X17301989-gr1.sml?httpAccept=%2A%2F%2A",
            "@multimediatype": "GIF image file",
            "@type": "IMAGE-THUMBNAIL",
            "@size": "10104",
            "@ref": "gr1",
            "@mimetype": "image/gif"
          },
          {
            "@category": "thumbnail",
            "@height": "101",
            "@width": "219",
            "@_fa": "true",
            "$": "https://api.elsevier.com/content/object/eid/1-s2.0-S0926860X17301989-gr2.sml?httpAccept=%2A%2F%2A",
            "@multimediatype": "GIF image file",
            "@type": "IMAGE-THUMBNAIL",
            "@size": "10068",
            "@ref": "gr2",
            "@mimetype": "image/gif"
          },
          {
            "@category": "thumbnail",
            "@height": "164",
            "@width": "109",
            "@_fa": "true",
            "$": "https://api.elsevier.com/content/object/eid/1-s2.0-S0926860X17301989-gr3.sml?httpAccept=%2A%2F%2A",
            "@multimediatype": "GIF image file",
            "@type": "IMAGE-THUMBNAIL",
            "@size": "9436",
            "@ref": "gr3",
            "@mimetype": "image/gif"
          },
          {
            "@category": "thumbnail",
            "@height": "116",
            "@width": "219",
            "@_fa": "true",
            "$": "https://api.elsevier.com/content/object/eid/1-s2.0-S0926860X17301989-gr4.sml?httpAccept=%2A%2F%2A",
            "@multimediatype": "GIF image file",
            "@type": "IMAGE-THUMBNAIL",
            "@size": "10136",
            "@ref": "gr4",
            "@mimetype": "image/gif"
          },
          {
            "@category": "thumbnail",
            "@height": "163",
            "@width": "156",
            "@_fa": "true",
            "$": "https://api.elsevier.com/content/object/eid/1-s2.0-S0926860X17301989-gr5.sml?httpAccept=%2A%2F%2A",
            "@multimediatype": "GIF image file",
            "@type": "IMAGE-THUMBNAIL",
            "@size": "24338",
            "@ref": "gr5",
            "@mimetype": "image/gif"
          },
          {
            "@category": "thumbnail",
            "@height": "71",
            "@width": "219",
            "@_fa": "true",
            "$": "https://api.elsevier.com/content/object/eid/1-s2.0-S0926860X17301989-gr6.sml?httpAccept=%2A%2F%2A",
            "@multimediatype": "GIF image file",
            "@type": "IMAGE-THUMBNAIL",
            "@size": "10230",
            "@ref": "gr6",
            "@mimetype": "image/gif"
          },
          {
            "@category": "thumbnail",
            "@height": "131",
            "@width": "219",
            "@_fa": "true",
            "$": "https://api.elsevier.com/content/object/eid/1-s2.0-S0926860X17301989-gr7.sml?httpAccept=%2A%2F%2A",
            "@multimediatype": "GIF image file",
            "@type": "IMAGE-THUMBNAIL",
            "@size": "11927",
            "@ref": "gr7",
            "@mimetype": "image/gif"
          },
          {
            "@category": "thumbnail",
            "@height": "50",
            "@width": "219",
            "@_fa": "true",
            "$": "https://api.elsevier.com/content/object/eid/1-s2.0-S0926860X17301989-gr8.sml?httpAccept=%2A%2F%2A",
            "@multimediatype": "GIF image file",
            "@type": "IMAGE-THUMBNAIL",
            "@size": "8399",
            "@ref": "gr8",
            "@mimetype": "image/gif"
          },
          {
            "@category": "standard",
            "@height": "200",
            "@width": "213",
            "@_fa": "true",
            "$": "https://api.elsevier.com/content/object/eid/1-s2.0-S0926860X17301989-fx1.jpg?httpAccept=%2A%2F%2A",
            "@multimediatype": "JPEG image file",
            "@type": "IMAGE-DOWNSAMPLED",
            "@size": "11587",
            "@ref": "fx1",
            "@mimetype": "image/jpeg"
          },
          {
            "@category": "standard",
            "@height": "216",
            "@width": "527",
            "@_fa": "true",
            "$": "https://api.elsevier.com/content/object/eid/1-s2.0-S0926860X17301989-gr1.jpg?httpAccept=%2A%2F%2A",
            "@multimediatype": "JPEG image file",
            "@type": "IMAGE-DOWNSAMPLED",
            "@size": "37155",
            "@ref": "gr1",
            "@mimetype": "image/jpeg"
          },
          {
            "@category": "standard",
            "@height": "157",
            "@width": "339",
            "@_fa": "true",
            "$": "https://api.elsevier.com/content/object/eid/1-s2.0-S0926860X17301989-gr2.jpg?httpAccept=%2A%2F%2A",
            "@multimediatype": "JPEG image file",
            "@type": "IMAGE-DOWNSAMPLED",
            "@size": "25765",
            "@ref": "gr2",
            "@mimetype": "image/jpeg"
          },
          {
            "@category": "standard",
            "@height": "438",
            "@width": "291",
            "@_fa": "true",
            "$": "https://api.elsevier.com/content/object/eid/1-s2.0-S0926860X17301989-gr3.jpg?httpAccept=%2A%2F%2A",
            "@multimediatype": "JPEG image file",
            "@type": "IMAGE-DOWNSAMPLED",
            "@size": "31806",
            "@ref": "gr3",
            "@mimetype": "image/jpeg"
          },
          {
            "@category": "standard",
            "@height": "298",
            "@width": "565",
            "@_fa": "true",
            "$": "https://api.elsevier.com/content/object/eid/1-s2.0-S0926860X17301989-gr4.jpg?httpAccept=%2A%2F%2A",
            "@multimediatype": "JPEG image file",
            "@type": "IMAGE-DOWNSAMPLED",
            "@size": "41921",
            "@ref": "gr4",
            "@mimetype": "image/jpeg"
          },
          {
            "@category": "standard",
            "@height": "829",
            "@width": "791",
            "@_fa": "true",
            "$": "https://api.elsevier.com/content/object/eid/1-s2.0-S0926860X17301989-gr5.jpg?httpAccept=%2A%2F%2A",
            "@multimediatype": "JPEG image file",
            "@type": "IMAGE-DOWNSAMPLED",
            "@size": "181579",
            "@ref": "gr5",
            "@mimetype": "image/jpeg"
          },
          {
            "@category": "standard",
            "@height": "110",
            "@width": "339",
            "@_fa": "true",
            "$": "https://api.elsevier.com/content/object/eid/1-s2.0-S0926860X17301989-gr6.jpg?httpAccept=%2A%2F%2A",
            "@multimediatype": "JPEG image file",
            "@type": "IMAGE-DOWNSAMPLED",
            "@size": "24560",
            "@ref": "gr6",
            "@mimetype": "image/jpeg"
          },
          {
            "@category": "standard",
            "@height": "202",
            "@width": "339",
            "@_fa": "true",
            "$": "https://api.elsevier.com/content/object/eid/1-s2.0-S0926860X17301989-gr7.jpg?httpAccept=%2A%2F%2A",
            "@multimediatype": "JPEG image file",
            "@type": "IMAGE-DOWNSAMPLED",
            "@size": "28911",
            "@ref": "gr7",
            "@mimetype": "image/jpeg"
          },
          {
            "@category": "standard",
            "@height": "156",
            "@width": "678",
            "@_fa": "true",
            "$": "https://api.elsevier.com/content/object/eid/1-s2.0-S0926860X17301989-gr8.jpg?httpAccept=%2A%2F%2A",
            "@multimediatype": "JPEG image file",
            "@type": "IMAGE-DOWNSAMPLED",
            "@size": "32775",
            "@ref": "gr8",
            "@mimetype": "image/jpeg"
          },
          {
            "@category": "high",
            "@height": "886",
            "@width": "943",
            "@_fa": "true",
            "$": "https://api.elsevier.com/content/object/eid/1-s2.0-S0926860X17301989-fx1_lrg.jpg?httpAccept=%2A%2F%2A",
            "@multimediatype": "JPEG image file",
            "@type": "IMAGE-HIGH-RES",
            "@size": "84895",
            "@ref": "fx1",
            "@mimetype": "image/jpeg"
          },
          {
            "@category": "high",
            "@height": "958",
            "@width": "2333",
            "@_fa": "true",
            "$": "https://api.elsevier.com/content/object/eid/1-s2.0-S0926860X17301989-gr1_lrg.jpg?httpAccept=%2A%2F%2A",
            "@multimediatype": "JPEG image file",
            "@type": "IMAGE-HIGH-RES",
            "@size": "188014",
            "@ref": "gr1",
            "@mimetype": "image/jpeg"
          },
          {
            "@category": "high",
            "@height": "694",
            "@width": "1500",
            "@_fa": "true",
            "$": "https://api.elsevier.com/content/object/eid/1-s2.0-S0926860X17301989-gr2_lrg.jpg?httpAccept=%2A%2F%2A",
            "@multimediatype": "JPEG image file",
            "@type": "IMAGE-HIGH-RES",
            "@size": "102191",
            "@ref": "gr2",
            "@mimetype": "image/jpeg"
          },
          {
            "@category": "high",
            "@height": "1940",
            "@width": "1289",
            "@_fa": "true",
            "$": "https://api.elsevier.com/content/object/eid/1-s2.0-S0926860X17301989-gr3_lrg.jpg?httpAccept=%2A%2F%2A",
            "@multimediatype": "JPEG image file",
            "@type": "IMAGE-HIGH-RES",
            "@size": "152534",
            "@ref": "gr3",
            "@mimetype": "image/jpeg"
          },
          {
            "@category": "high",
            "@height": "1319",
            "@width": "2500",
            "@_fa": "true",
            "$": "https://api.elsevier.com/content/object/eid/1-s2.0-S0926860X17301989-gr4_lrg.jpg?httpAccept=%2A%2F%2A",
            "@multimediatype": "JPEG image file",
            "@type": "IMAGE-HIGH-RES",
            "@size": "234539",
            "@ref": "gr4",
            "@mimetype": "image/jpeg"
          },
          {
            "@category": "high",
            "@height": "3666",
            "@width": "3500",
            "@_fa": "true",
            "$": "https://api.elsevier.com/content/object/eid/1-s2.0-S0926860X17301989-gr5_lrg.jpg?httpAccept=%2A%2F%2A",
            "@multimediatype": "JPEG image file",
            "@type": "IMAGE-HIGH-RES",
            "@size": "1557377",
            "@ref": "gr5",
            "@mimetype": "image/jpeg"
          },
          {
            "@category": "high",
            "@height": "485",
            "@width": "1500",
            "@_fa": "true",
            "$": "https://api.elsevier.com/content/object/eid/1-s2.0-S0926860X17301989-gr6_lrg.jpg?httpAccept=%2A%2F%2A",
            "@multimediatype": "JPEG image file",
            "@type": "IMAGE-HIGH-RES",
            "@size": "79660",
            "@ref": "gr6",
            "@mimetype": "image/jpeg"
          },
          {
            "@category": "high",
            "@height": "894",
            "@width": "1500",
            "@_fa": "true",
            "$": "https://api.elsevier.com/content/object/eid/1-s2.0-S0926860X17301989-gr7_lrg.jpg?httpAccept=%2A%2F%2A",
            "@multimediatype": "JPEG image file",
            "@type": "IMAGE-HIGH-RES",
            "@size": "111805",
            "@ref": "gr7",
            "@mimetype": "image/jpeg"
          },
          {
            "@category": "high",
            "@height": "691",
            "@width": "3000",
            "@_fa": "true",
            "$": "https://api.elsevier.com/content/object/eid/1-s2.0-S0926860X17301989-gr8_lrg.jpg?httpAccept=%2A%2F%2A",
            "@multimediatype": "JPEG image file",
            "@type": "IMAGE-HIGH-RES",
            "@size": "169731",
            "@ref": "gr8",
            "@mimetype": "image/jpeg"
          },
          {
            "@category": "standard",
            "@_fa": "true",
            "$": "https://api.elsevier.com/content/object/eid/1-s2.0-S0926860X17301989-mmc1.pdf?httpAccept=%2A%2F%2A",
            "@multimediatype": "Acrobat PDF file",
            "@type": "APPLICATION",
            "@size": "595911",
            "@ref": "mmc1",
            "@mimetype": "application/pdf"
          }
        ]
      },
      "link": {
        "@rel": "abstract",
        "@href": "https://api.elsevier.com/content/abstract/scopus_id/85019561118"
      }
    }
  }
}