{
  "metadata": {
    "title": "Hydrogenation of succinic acid to 1,4-butanediol over Re–Ru bimetallic catalysts supported on mesoporous carbon",
    "authors": "; ; ",
    "journal": "Applied Catalysis A: General",
    "date": "2015-01-25",
    "doi": "10.1016/j.apcata.2014.11.029",
    "abstract": "",
    "uri": "https://api.elsevier.com/content/article/pii/S0926860X14007352",
    "pii": "S0926860X14007352"
  },
  "fulltext": {
    "full-text-retrieval-response": {
      "scopus-eid": "2-s2.0-84919392947",
      "originalText": "serial JL 271346 291210 291744 291809 31 Applied Catalysis A: General APPLIEDCATALYSISAGENERAL 2014-11-26 2014-11-26 2018-04-14T00:57:11 1-s2.0-S0926860X14007352 S0926-860X(14)00735-2 S0926860X14007352 10.1016/j.apcata.2014.11.029 S300 S300.2 FULL-TEXT 1-s2.0-S0926860X14X00219 2024-01-01T12:30:29.635264Z 0 0 20150125 2015 2014-11-26T16:37:37.176459Z absattachment articleinfo articletitlenorm authfirstinitialnorm authfirstsurnamenorm cid cids contenttype copyright crossmark dateloaded dateloadedtxt datesearch datesort dateupdated dco docsubtype doctype doi eid ewtransactionid hubeid indexeddate issn issnnorm itemstage itemtransactionid itemweight openaccess openarchive pg pgfirst pglast pii piinorm pubdatestart pubdatetxt pubyr sectiontitle sortorder srctitle srctitlenorm srctype ssids alllist content subj subheadings suppl tomb volfirst volissue volumelist webpdf webpdfpagecount yearnav figure table body mmlmath acknowledge affil articletitle auth authfirstini authfull authkeywords authlast grantnumber grantsponsor grantsponsorid highlightsabst primabst ref specialabst 0926-860X 0926860X true 490 490 C Volume 490 22 153 162 153 162 20150125 25 January 2015 2015-01-25 2015 Articles article fla Copyright © 2014 Elsevier B.V. All rights reserved. HYDROGENATIONSUCCINICACID14BUTANEDIOLOVERRERUBIMETALLICCATALYSTSSUPPORTEDMESOPOROUSCARBON KANG K 1 Introduction 2 Experimental 2.1 Preparation of (0.6− x)Re–xRu/MC catalysts 2.2 Characterization 2.3 Hydrogenation of succinic acid to BDO 3 Results and discussion 3.1 Textural properties of (0.6− x)Re–xRu/MC catalysts 3.2 Reduction behaviors of (0.6− x)Re–xRu/MC catalysts 3.3 Crystalline structures of reduced (0.6− x)Re–xRu/MC catalysts 3.4 Metal dispersion of reduced (0.6− x)Re–xRu/MC catalysts 3.5 XPS study of reduced (0.6− x)Re–xRu/MC catalysts 3.6 Hydrogen adsorption study on reduced (0.6− x)Re–xRu/MC catalysts 3.7 Hydrogenation of succinic acid to BDO over (0.6− x)Re–xRu/MC catalysts 3.8 Stability and reusability of 0.3Re–0.3Ru/MC catalysts 4 Conclusion Acknowledgement References MORGAN 1997 166 168 M BECHTHOLD 2008 647 654 I DELHOMME 2009 13 26 C CUKALOVIC 2008 505 529 A GALLEZOT 2012 1538 1558 P HAAS 2005 83 88 T CHUNG 2012 205 210 S TAPIN 2013 2327 2335 B HONG 2011 332 338 U LUQUE 2009 5305 5307 R ROSI 2010 1314 1322 L HONG 2014 466 471 U HONG 2012 141 148 U CORBELDIMAILLY 2013 2388 2395 L MINH 2010 1270 1273 D LY 2012 466 473 B CHAUDHARI 2003 627 632 R BEAMSON 2011 228 238 G PONEC 1993 393 453 V MASSALSKI 1990 T BINARYALLOYPHASEDIAGRAMS YAO 1976 392 403 H OKAL 1999 140 153 J MATOS 2006 38 46 I ARNOLDY 1985 231 245 P BETANCOURT 1998 307 314 P BONAROWSKA 1999 145 154 M ISAACS 1982 43 52 B MA 2009 834 844 L AMADA 2011 117 127 Y HOMEYER 1989 226 274 S AIKA 1985 296 304 K BADENES 1997 241 250 P LI 2007 1686 1695 Z ZHU 2007 382 389 Y YAZAWA 1999 15 23 Y YUAN 2000 1421 1422 Y TYSOE 1988 1 14 W MITCHELL 1987 482 489 P YAGI 1961 372 379 S PARK 1975 1207 1214 J SU 1998 125 135 S CLAUS 2005 222 229 P TESSONNIER 2005 203 210 J BARANOWSKA 2014 447 459 K DONG 2003 237 246 X ZUPANC 2002 501 514 C VANDERWIEL 1999 186 202 D KANGX2015X153 KANGX2015X153X162 KANGX2015X153XK KANGX2015X153X162XK 2022-06-09T10:01:26.154Z http://vtw.elsevier.com/data/voc/AddOnTypes/50.7/aggregated-refined Ministry of Education, Science and Technology, Korea 20110031575 MEST Ministry of Education, Science and Technology http://data.elsevier.com/vocabulary/SciValFunders/501100004085 http://sws.geonames.org/1835841/ National Research Foundation NRF National Research Foundation of Korea http://data.elsevier.com/vocabulary/SciValFunders/501100003725 http://sws.geonames.org/1835841/ This work was supported by the Global Frontier R&amp;D Program on Center for Multiscale Energy System funded by the National Research Foundation under the Ministry of Education, Science and Technology, Korea ( 20110031575 ). item S0926-860X(14)00735-2 S0926860X14007352 1-s2.0-S0926860X14007352 10.1016/j.apcata.2014.11.029 271346 2024-01-01T12:30:29.635264Z 2015-01-25 1-s2.0-S0926860X14007352-main.pdf https://s3-eu-west-1.amazonaws.com/prod-ucs-content-store-eu-west/content/pii:S0926860X14007352/MAIN/application/pdf/92853ee5b4bf6761db30b0dc91c8444b/main.pdf https://s3.amazonaws.com/prod-ucs-content-store-us-east/content/pii:S0926860X14007352/MAIN/application/pdf/92853ee5b4bf6761db30b0dc91c8444b/main.pdf main.pdf pdf true 2621198 MAIN 10 1-s2.0-S0926860X14007352-main_1.png https://s3-eu-west-1.amazonaws.com/prod-ucs-content-store-eu-west/content/pii:S0926860X14007352/PREVIEW/image/png/92621b579987d2f0827d261fb6e76b55/main_1.png https://s3.amazonaws.com/prod-ucs-content-store-us-east/content/pii:S0926860X14007352/PREVIEW/image/png/92621b579987d2f0827d261fb6e76b55/main_1.png main_1.png png 56199 849 656 IMAGE-WEB-PDF 1 1-s2.0-S0926860X14007352-fx1.sml https://s3-eu-west-1.amazonaws.com/prod-ucs-content-store-eu-west/content/pii:S0926860X14007352/fx1/THUMBNAIL/image/gif/e68e7bd6ca449aae14871ab48433164d/fx1.sml https://s3.amazonaws.com/prod-ucs-content-store-us-east/content/pii:S0926860X14007352/fx1/THUMBNAIL/image/gif/e68e7bd6ca449aae14871ab48433164d/fx1.sml fx1 true fx1.sml sml 4108 164 164 IMAGE-THUMBNAIL 1-s2.0-S0926860X14007352-gr1.sml https://s3-eu-west-1.amazonaws.com/prod-ucs-content-store-eu-west/content/pii:S0926860X14007352/gr1/THUMBNAIL/image/gif/61f4841b9221fee85e732e1bdbbab9f1/gr1.sml https://s3.amazonaws.com/prod-ucs-content-store-us-east/content/pii:S0926860X14007352/gr1/THUMBNAIL/image/gif/61f4841b9221fee85e732e1bdbbab9f1/gr1.sml gr1 gr1.sml sml 2590 70 219 IMAGE-THUMBNAIL 1-s2.0-S0926860X14007352-gr10.sml https://s3-eu-west-1.amazonaws.com/prod-ucs-content-store-eu-west/content/pii:S0926860X14007352/gr10/THUMBNAIL/image/gif/93d600c0d6a5cb6fe33c9c2894c9b798/gr10.sml https://s3.amazonaws.com/prod-ucs-content-store-us-east/content/pii:S0926860X14007352/gr10/THUMBNAIL/image/gif/93d600c0d6a5cb6fe33c9c2894c9b798/gr10.sml gr10 gr10.sml sml 4490 163 165 IMAGE-THUMBNAIL 1-s2.0-S0926860X14007352-gr11.sml https://s3-eu-west-1.amazonaws.com/prod-ucs-content-store-eu-west/content/pii:S0926860X14007352/gr11/THUMBNAIL/image/gif/87130b3795704c9d283344b75d854b05/gr11.sml https://s3.amazonaws.com/prod-ucs-content-store-us-east/content/pii:S0926860X14007352/gr11/THUMBNAIL/image/gif/87130b3795704c9d283344b75d854b05/gr11.sml gr11 gr11.sml sml 3552 164 164 IMAGE-THUMBNAIL 1-s2.0-S0926860X14007352-gr12.sml https://s3-eu-west-1.amazonaws.com/prod-ucs-content-store-eu-west/content/pii:S0926860X14007352/gr12/THUMBNAIL/image/gif/0eee22927dd427f986ca4bfbd2d869b1/gr12.sml https://s3.amazonaws.com/prod-ucs-content-store-us-east/content/pii:S0926860X14007352/gr12/THUMBNAIL/image/gif/0eee22927dd427f986ca4bfbd2d869b1/gr12.sml gr12 gr12.sml sml 7939 164 167 IMAGE-THUMBNAIL 1-s2.0-S0926860X14007352-gr2.sml https://s3-eu-west-1.amazonaws.com/prod-ucs-content-store-eu-west/content/pii:S0926860X14007352/gr2/THUMBNAIL/image/gif/029c79ded1087a806bd24286b07e2c64/gr2.sml https://s3.amazonaws.com/prod-ucs-content-store-us-east/content/pii:S0926860X14007352/gr2/THUMBNAIL/image/gif/029c79ded1087a806bd24286b07e2c64/gr2.sml gr2 gr2.sml sml 6124 164 154 IMAGE-THUMBNAIL 1-s2.0-S0926860X14007352-gr3.sml https://s3-eu-west-1.amazonaws.com/prod-ucs-content-store-eu-west/content/pii:S0926860X14007352/gr3/THUMBNAIL/image/gif/fca852f3a82d416347cbe431879901d6/gr3.sml https://s3.amazonaws.com/prod-ucs-content-store-us-east/content/pii:S0926860X14007352/gr3/THUMBNAIL/image/gif/fca852f3a82d416347cbe431879901d6/gr3.sml gr3 gr3.sml sml 4087 164 161 IMAGE-THUMBNAIL 1-s2.0-S0926860X14007352-gr4.sml https://s3-eu-west-1.amazonaws.com/prod-ucs-content-store-eu-west/content/pii:S0926860X14007352/gr4/THUMBNAIL/image/gif/534a555d0dcb9bd4211e953b5e17d0f0/gr4.sml https://s3.amazonaws.com/prod-ucs-content-store-us-east/content/pii:S0926860X14007352/gr4/THUMBNAIL/image/gif/534a555d0dcb9bd4211e953b5e17d0f0/gr4.sml gr4 gr4.sml sml 7192 164 150 IMAGE-THUMBNAIL 1-s2.0-S0926860X14007352-gr5.sml https://s3-eu-west-1.amazonaws.com/prod-ucs-content-store-eu-west/content/pii:S0926860X14007352/gr5/THUMBNAIL/image/gif/7dd3542442532cac14e635d90440a8a6/gr5.sml https://s3.amazonaws.com/prod-ucs-content-store-us-east/content/pii:S0926860X14007352/gr5/THUMBNAIL/image/gif/7dd3542442532cac14e635d90440a8a6/gr5.sml gr5 gr5.sml sml 25686 164 216 IMAGE-THUMBNAIL 1-s2.0-S0926860X14007352-gr6.sml https://s3-eu-west-1.amazonaws.com/prod-ucs-content-store-eu-west/content/pii:S0926860X14007352/gr6/THUMBNAIL/image/gif/1d861d568f5a0f0970297f233833b397/gr6.sml https://s3.amazonaws.com/prod-ucs-content-store-us-east/content/pii:S0926860X14007352/gr6/THUMBNAIL/image/gif/1d861d568f5a0f0970297f233833b397/gr6.sml gr6 gr6.sml sml 22614 164 164 IMAGE-THUMBNAIL 1-s2.0-S0926860X14007352-gr7.sml https://s3-eu-west-1.amazonaws.com/prod-ucs-content-store-eu-west/content/pii:S0926860X14007352/gr7/THUMBNAIL/image/gif/459c14b3766ff2a0d01fba6a3d781723/gr7.sml https://s3.amazonaws.com/prod-ucs-content-store-us-east/content/pii:S0926860X14007352/gr7/THUMBNAIL/image/gif/459c14b3766ff2a0d01fba6a3d781723/gr7.sml gr7 gr7.sml sml 6979 132 219 IMAGE-THUMBNAIL 1-s2.0-S0926860X14007352-gr8.sml https://s3-eu-west-1.amazonaws.com/prod-ucs-content-store-eu-west/content/pii:S0926860X14007352/gr8/THUMBNAIL/image/gif/358a6383b0d38de9c0edc527ad38d950/gr8.sml https://s3.amazonaws.com/prod-ucs-content-store-us-east/content/pii:S0926860X14007352/gr8/THUMBNAIL/image/gif/358a6383b0d38de9c0edc527ad38d950/gr8.sml gr8 gr8.sml sml 5671 164 162 IMAGE-THUMBNAIL 1-s2.0-S0926860X14007352-gr9.sml https://s3-eu-west-1.amazonaws.com/prod-ucs-content-store-eu-west/content/pii:S0926860X14007352/gr9/THUMBNAIL/image/gif/5ba97d872123e193bb9ddabcd896327d/gr9.sml https://s3.amazonaws.com/prod-ucs-content-store-us-east/content/pii:S0926860X14007352/gr9/THUMBNAIL/image/gif/5ba97d872123e193bb9ddabcd896327d/gr9.sml gr9 gr9.sml sml 4723 164 186 IMAGE-THUMBNAIL 1-s2.0-S0926860X14007352-fx1.jpg https://s3-eu-west-1.amazonaws.com/prod-ucs-content-store-eu-west/content/pii:S0926860X14007352/fx1/DOWNSAMPLED/image/jpeg/4dc2ac4461937cd44917d92dd326daab/fx1.jpg https://s3.amazonaws.com/prod-ucs-content-store-us-east/content/pii:S0926860X14007352/fx1/DOWNSAMPLED/image/jpeg/4dc2ac4461937cd44917d92dd326daab/fx1.jpg fx1 true fx1.jpg jpg 7759 200 200 IMAGE-DOWNSAMPLED 1-s2.0-S0926860X14007352-gr1.jpg https://s3-eu-west-1.amazonaws.com/prod-ucs-content-store-eu-west/content/pii:S0926860X14007352/gr1/DOWNSAMPLED/image/jpeg/e48c9e9811838659edb5899838748127/gr1.jpg https://s3.amazonaws.com/prod-ucs-content-store-us-east/content/pii:S0926860X14007352/gr1/DOWNSAMPLED/image/jpeg/e48c9e9811838659edb5899838748127/gr1.jpg gr1 gr1.jpg jpg 12819 160 498 IMAGE-DOWNSAMPLED 1-s2.0-S0926860X14007352-gr10.jpg https://s3-eu-west-1.amazonaws.com/prod-ucs-content-store-eu-west/content/pii:S0926860X14007352/gr10/DOWNSAMPLED/image/jpeg/17196a42a7acdfc6e987a63a1ea98c55/gr10.jpg https://s3.amazonaws.com/prod-ucs-content-store-us-east/content/pii:S0926860X14007352/gr10/DOWNSAMPLED/image/jpeg/17196a42a7acdfc6e987a63a1ea98c55/gr10.jpg gr10 gr10.jpg jpg 20061 331 334 IMAGE-DOWNSAMPLED 1-s2.0-S0926860X14007352-gr11.jpg https://s3-eu-west-1.amazonaws.com/prod-ucs-content-store-eu-west/content/pii:S0926860X14007352/gr11/DOWNSAMPLED/image/jpeg/ef6378071a211ba6e41781e1a5f88f17/gr11.jpg https://s3.amazonaws.com/prod-ucs-content-store-us-east/content/pii:S0926860X14007352/gr11/DOWNSAMPLED/image/jpeg/ef6378071a211ba6e41781e1a5f88f17/gr11.jpg gr11 gr11.jpg jpg 15751 353 353 IMAGE-DOWNSAMPLED 1-s2.0-S0926860X14007352-gr12.jpg https://s3-eu-west-1.amazonaws.com/prod-ucs-content-store-eu-west/content/pii:S0926860X14007352/gr12/DOWNSAMPLED/image/jpeg/2f3d07eb50cc47a1e1852cb89e32c4b9/gr12.jpg https://s3.amazonaws.com/prod-ucs-content-store-us-east/content/pii:S0926860X14007352/gr12/DOWNSAMPLED/image/jpeg/2f3d07eb50cc47a1e1852cb89e32c4b9/gr12.jpg gr12 gr12.jpg jpg 24735 330 336 IMAGE-DOWNSAMPLED 1-s2.0-S0926860X14007352-gr2.jpg https://s3-eu-west-1.amazonaws.com/prod-ucs-content-store-eu-west/content/pii:S0926860X14007352/gr2/DOWNSAMPLED/image/jpeg/1d0ddb05eb4d2d6f1a581eba18cb975a/gr2.jpg https://s3.amazonaws.com/prod-ucs-content-store-us-east/content/pii:S0926860X14007352/gr2/DOWNSAMPLED/image/jpeg/1d0ddb05eb4d2d6f1a581eba18cb975a/gr2.jpg gr2 gr2.jpg jpg 31820 368 346 IMAGE-DOWNSAMPLED 1-s2.0-S0926860X14007352-gr3.jpg https://s3-eu-west-1.amazonaws.com/prod-ucs-content-store-eu-west/content/pii:S0926860X14007352/gr3/DOWNSAMPLED/image/jpeg/3d9756d953aea8be118f4e359d914bed/gr3.jpg https://s3.amazonaws.com/prod-ucs-content-store-us-east/content/pii:S0926860X14007352/gr3/DOWNSAMPLED/image/jpeg/3d9756d953aea8be118f4e359d914bed/gr3.jpg gr3 gr3.jpg jpg 22214 371 365 IMAGE-DOWNSAMPLED 1-s2.0-S0926860X14007352-gr4.jpg https://s3-eu-west-1.amazonaws.com/prod-ucs-content-store-eu-west/content/pii:S0926860X14007352/gr4/DOWNSAMPLED/image/jpeg/0b588568a7b555bca14539112866337b/gr4.jpg https://s3.amazonaws.com/prod-ucs-content-store-us-east/content/pii:S0926860X14007352/gr4/DOWNSAMPLED/image/jpeg/0b588568a7b555bca14539112866337b/gr4.jpg gr4 gr4.jpg jpg 36507 393 360 IMAGE-DOWNSAMPLED 1-s2.0-S0926860X14007352-gr5.jpg https://s3-eu-west-1.amazonaws.com/prod-ucs-content-store-eu-west/content/pii:S0926860X14007352/gr5/DOWNSAMPLED/image/jpeg/0099ca1b2bc34859ff1a1bb588699b53/gr5.jpg https://s3.amazonaws.com/prod-ucs-content-store-us-east/content/pii:S0926860X14007352/gr5/DOWNSAMPLED/image/jpeg/0099ca1b2bc34859ff1a1bb588699b53/gr5.jpg gr5 gr5.jpg jpg 167373 570 753 IMAGE-DOWNSAMPLED 1-s2.0-S0926860X14007352-gr6.jpg https://s3-eu-west-1.amazonaws.com/prod-ucs-content-store-eu-west/content/pii:S0926860X14007352/gr6/DOWNSAMPLED/image/jpeg/76373c8d2161ed6d5401873f16bbb330/gr6.jpg https://s3.amazonaws.com/prod-ucs-content-store-us-east/content/pii:S0926860X14007352/gr6/DOWNSAMPLED/image/jpeg/76373c8d2161ed6d5401873f16bbb330/gr6.jpg gr6 gr6.jpg jpg 147225 565 565 IMAGE-DOWNSAMPLED 1-s2.0-S0926860X14007352-gr7.jpg https://s3-eu-west-1.amazonaws.com/prod-ucs-content-store-eu-west/content/pii:S0926860X14007352/gr7/DOWNSAMPLED/image/jpeg/43c1cac1a15f80013e835788cca4a77b/gr7.jpg https://s3.amazonaws.com/prod-ucs-content-store-us-east/content/pii:S0926860X14007352/gr7/DOWNSAMPLED/image/jpeg/43c1cac1a15f80013e835788cca4a77b/gr7.jpg gr7 gr7.jpg jpg 65687 410 682 IMAGE-DOWNSAMPLED 1-s2.0-S0926860X14007352-gr8.jpg https://s3-eu-west-1.amazonaws.com/prod-ucs-content-store-eu-west/content/pii:S0926860X14007352/gr8/DOWNSAMPLED/image/jpeg/2c4476c3ffa6316eff8eabd2d57df44d/gr8.jpg https://s3.amazonaws.com/prod-ucs-content-store-us-east/content/pii:S0926860X14007352/gr8/DOWNSAMPLED/image/jpeg/2c4476c3ffa6316eff8eabd2d57df44d/gr8.jpg gr8 gr8.jpg jpg 32267 369 365 IMAGE-DOWNSAMPLED 1-s2.0-S0926860X14007352-gr9.jpg https://s3-eu-west-1.amazonaws.com/prod-ucs-content-store-eu-west/content/pii:S0926860X14007352/gr9/DOWNSAMPLED/image/jpeg/97f5f7c4dd735f457c66692ec1ec5873/gr9.jpg https://s3.amazonaws.com/prod-ucs-content-store-us-east/content/pii:S0926860X14007352/gr9/DOWNSAMPLED/image/jpeg/97f5f7c4dd735f457c66692ec1ec5873/gr9.jpg gr9 gr9.jpg jpg 22699 346 393 IMAGE-DOWNSAMPLED 1-s2.0-S0926860X14007352-fx1_lrg.jpg https://s3-eu-west-1.amazonaws.com/prod-ucs-content-store-eu-west/content/pii:S0926860X14007352/fx1/HIGHRES/image/jpeg/3a6d466ac7b492b74b8b61b943d202bf/fx1_lrg.jpg https://s3.amazonaws.com/prod-ucs-content-store-us-east/content/pii:S0926860X14007352/fx1/HIGHRES/image/jpeg/3a6d466ac7b492b74b8b61b943d202bf/fx1_lrg.jpg fx1 true fx1_lrg.jpg jpg 54778 886 886 IMAGE-HIGH-RES 1-s2.0-S0926860X14007352-gr1_lrg.jpg https://s3-eu-west-1.amazonaws.com/prod-ucs-content-store-eu-west/content/pii:S0926860X14007352/gr1/HIGHRES/image/jpeg/2eafdcf9243fb3b55f1b9b3bfa4bc033/gr1_lrg.jpg https://s3.amazonaws.com/prod-ucs-content-store-us-east/content/pii:S0926860X14007352/gr1/HIGHRES/image/jpeg/2eafdcf9243fb3b55f1b9b3bfa4bc033/gr1_lrg.jpg gr1 gr1_lrg.jpg jpg 101702 708 2206 IMAGE-HIGH-RES 1-s2.0-S0926860X14007352-gr10_lrg.jpg https://s3-eu-west-1.amazonaws.com/prod-ucs-content-store-eu-west/content/pii:S0926860X14007352/gr10/HIGHRES/image/jpeg/68492e5bcb79047976f660f68c45cca5/gr10_lrg.jpg https://s3.amazonaws.com/prod-ucs-content-store-us-east/content/pii:S0926860X14007352/gr10/HIGHRES/image/jpeg/68492e5bcb79047976f660f68c45cca5/gr10_lrg.jpg gr10 gr10_lrg.jpg jpg 145707 1464 1478 IMAGE-HIGH-RES 1-s2.0-S0926860X14007352-gr11_lrg.jpg https://s3-eu-west-1.amazonaws.com/prod-ucs-content-store-eu-west/content/pii:S0926860X14007352/gr11/HIGHRES/image/jpeg/3b4ca87ab6228a78e2dc4e3840d867ed/gr11_lrg.jpg https://s3.amazonaws.com/prod-ucs-content-store-us-east/content/pii:S0926860X14007352/gr11/HIGHRES/image/jpeg/3b4ca87ab6228a78e2dc4e3840d867ed/gr11_lrg.jpg gr11 gr11_lrg.jpg jpg 124255 1568 1566 IMAGE-HIGH-RES 1-s2.0-S0926860X14007352-gr12_lrg.jpg https://s3-eu-west-1.amazonaws.com/prod-ucs-content-store-eu-west/content/pii:S0926860X14007352/gr12/HIGHRES/image/jpeg/17a903323432b942fb19e6f89a7fb324/gr12_lrg.jpg https://s3.amazonaws.com/prod-ucs-content-store-us-east/content/pii:S0926860X14007352/gr12/HIGHRES/image/jpeg/17a903323432b942fb19e6f89a7fb324/gr12_lrg.jpg gr12 gr12_lrg.jpg jpg 301934 1462 1489 IMAGE-HIGH-RES 1-s2.0-S0926860X14007352-gr2_lrg.jpg https://s3-eu-west-1.amazonaws.com/prod-ucs-content-store-eu-west/content/pii:S0926860X14007352/gr2/HIGHRES/image/jpeg/1443ebc73c010df9bca6f27083570994/gr2_lrg.jpg https://s3.amazonaws.com/prod-ucs-content-store-us-east/content/pii:S0926860X14007352/gr2/HIGHRES/image/jpeg/1443ebc73c010df9bca6f27083570994/gr2_lrg.jpg gr2 gr2_lrg.jpg jpg 253958 1634 1535 IMAGE-HIGH-RES 1-s2.0-S0926860X14007352-gr3_lrg.jpg https://s3-eu-west-1.amazonaws.com/prod-ucs-content-store-eu-west/content/pii:S0926860X14007352/gr3/HIGHRES/image/jpeg/73aa74147331e0af6795036053d81f97/gr3_lrg.jpg https://s3.amazonaws.com/prod-ucs-content-store-us-east/content/pii:S0926860X14007352/gr3/HIGHRES/image/jpeg/73aa74147331e0af6795036053d81f97/gr3_lrg.jpg gr3 gr3_lrg.jpg jpg 172588 1642 1616 IMAGE-HIGH-RES 1-s2.0-S0926860X14007352-gr4_lrg.jpg https://s3-eu-west-1.amazonaws.com/prod-ucs-content-store-eu-west/content/pii:S0926860X14007352/gr4/HIGHRES/image/jpeg/65f9b025736d2eae27de4c94c99b3f13/gr4_lrg.jpg https://s3.amazonaws.com/prod-ucs-content-store-us-east/content/pii:S0926860X14007352/gr4/HIGHRES/image/jpeg/65f9b025736d2eae27de4c94c99b3f13/gr4_lrg.jpg gr4 gr4_lrg.jpg jpg 346728 1744 1596 IMAGE-HIGH-RES 1-s2.0-S0926860X14007352-gr5_lrg.jpg https://s3-eu-west-1.amazonaws.com/prod-ucs-content-store-eu-west/content/pii:S0926860X14007352/gr5/HIGHRES/image/jpeg/2728d626978e66089535c7e861e82021/gr5_lrg.jpg https://s3.amazonaws.com/prod-ucs-content-store-us-east/content/pii:S0926860X14007352/gr5/HIGHRES/image/jpeg/2728d626978e66089535c7e861e82021/gr5_lrg.jpg gr5 gr5_lrg.jpg jpg 1805552 2523 3333 IMAGE-HIGH-RES 1-s2.0-S0926860X14007352-gr6_lrg.jpg https://s3-eu-west-1.amazonaws.com/prod-ucs-content-store-eu-west/content/pii:S0926860X14007352/gr6/HIGHRES/image/jpeg/cb647a80ade5ddda9d829f69550d5693/gr6_lrg.jpg https://s3.amazonaws.com/prod-ucs-content-store-us-east/content/pii:S0926860X14007352/gr6/HIGHRES/image/jpeg/cb647a80ade5ddda9d829f69550d5693/gr6_lrg.jpg gr6 gr6_lrg.jpg jpg 738827 1499 1500 IMAGE-HIGH-RES 1-s2.0-S0926860X14007352-gr7_lrg.jpg https://s3-eu-west-1.amazonaws.com/prod-ucs-content-store-eu-west/content/pii:S0926860X14007352/gr7/HIGHRES/image/jpeg/f5b651d5c01f26226a4d8bf49ced762d/gr7_lrg.jpg https://s3.amazonaws.com/prod-ucs-content-store-us-east/content/pii:S0926860X14007352/gr7/HIGHRES/image/jpeg/f5b651d5c01f26226a4d8bf49ced762d/gr7_lrg.jpg gr7 gr7_lrg.jpg jpg 547483 1816 3020 IMAGE-HIGH-RES 1-s2.0-S0926860X14007352-gr8_lrg.jpg https://s3-eu-west-1.amazonaws.com/prod-ucs-content-store-eu-west/content/pii:S0926860X14007352/gr8/HIGHRES/image/jpeg/ef99d1f7eb340dd1fc757aa20d23674f/gr8_lrg.jpg https://s3.amazonaws.com/prod-ucs-content-store-us-east/content/pii:S0926860X14007352/gr8/HIGHRES/image/jpeg/ef99d1f7eb340dd1fc757aa20d23674f/gr8_lrg.jpg gr8 gr8_lrg.jpg jpg 246151 1638 1619 IMAGE-HIGH-RES 1-s2.0-S0926860X14007352-gr9_lrg.jpg https://s3-eu-west-1.amazonaws.com/prod-ucs-content-store-eu-west/content/pii:S0926860X14007352/gr9/HIGHRES/image/jpeg/d11c633c89639982d2bd5e1de91eb56a/gr9_lrg.jpg https://s3.amazonaws.com/prod-ucs-content-store-us-east/content/pii:S0926860X14007352/gr9/HIGHRES/image/jpeg/d11c633c89639982d2bd5e1de91eb56a/gr9_lrg.jpg gr9 gr9_lrg.jpg jpg 168849 1534 1742 IMAGE-HIGH-RES 1-s2.0-S0926860X14007352-si1.gif https://s3-eu-west-1.amazonaws.com/prod-ucs-content-store-eu-west/content/pii:S0926860X14007352/STRIPIN/image/gif/dc9a924c4bef9528ff218bb891966059/si1.gif https://s3.amazonaws.com/prod-ucs-content-store-us-east/content/pii:S0926860X14007352/STRIPIN/image/gif/dc9a924c4bef9528ff218bb891966059/si1.gif si1 si1.gif gif 1454 26 349 ALTIMG 1-s2.0-S0926860X14007352-si2.gif https://s3-eu-west-1.amazonaws.com/prod-ucs-content-store-eu-west/content/pii:S0926860X14007352/STRIPIN/image/gif/f9cd7441281df43fcf7e0c88bca43f20/si2.gif https://s3.amazonaws.com/prod-ucs-content-store-us-east/content/pii:S0926860X14007352/STRIPIN/image/gif/f9cd7441281df43fcf7e0c88bca43f20/si2.gif si2 si2.gif gif 1376 24 319 ALTIMG 1-s2.0-S0926860X14007352-si3.gif https://s3-eu-west-1.amazonaws.com/prod-ucs-content-store-eu-west/content/pii:S0926860X14007352/STRIPIN/image/gif/bd69741275df250b38666def943248b7/si3.gif https://s3.amazonaws.com/prod-ucs-content-store-us-east/content/pii:S0926860X14007352/STRIPIN/image/gif/bd69741275df250b38666def943248b7/si3.gif si3 si3.gif gif 1240 23 373 ALTIMG APCATA 15122 S0926-860X(14)00735-2 10.1016/j.apcata.2014.11.029 Elsevier B.V. Fig. 1 Reaction pathways for hydrogenation of succinic acid. Fig. 2 Nitrogen adsorption–desorption isotherms of (0.6− x)Re–xRu/MC (x =0, 0.15, 0.3, 0.45, and 0.6) catalysts. Fig. 3 TPR profiles of (0.6− x)Re–xRu/MC (x =0, 0.15, 0.3, 0.45, and 0.6) catalysts. Fig. 4 XRD patterns of reduced (0.6− x)Re–xRu/MC (x =0, 0.15, 0.3, 0.45, and 0.6) catalysts. Fig. 5 TEM images and particle size distributions of reduced (0.6− x)Re–xRu/MC (x =0, 0.15, 0.3, 0.45, and 0.6) catalysts. Fig. 6 STEM-EDX images of reduced 0.3Re–0.3Ru/MC catalyst obtained by mapping on rhenium and ruthenium. (For interpretation of the references to color in text near the figure citation, the reader is referred to the web version of this article.) Fig. 7 XPS spectra of (a) Re 4f and (b) Ru 3p3/2 levels in the reduced (0.6− x)Re–xRu/MC (x =0, 0.15, 0.3, 0.45, and 0.6) catalysts. Fig. 8 H2-TPD profiles of reduced (0.6− x)Re–xRu/MC (x =0, 0.15, 0.3, 0.45, and 0.6) catalysts and mesoporous carbon (MC) support. Fig. 9 Correlations between the amount of weak hydrogen-binding sites and Re0/Retotal ratio and between the amount of weak hydrogen-binding sites and Ru0/Rutotal ratio of reduced (0.6− x)Re–xRu/MC (x =0, 0.15, 0.3, 0.45, and 0.6) catalysts. Fig. 10 Conversion of succinic acid and yields for GBL, BDO, and THF with time on stream in liquid-phase hydrogenation of succinic acid over 0.3Re–0.3Ru/MC catalyst at 200°C and 80bar. Fig. 11 A correlation between TOFBDO and the amount of weak hydrogen-binding sites in the reduced (0.6− x)Re–xRu/MC (x =0, 0.15, 0.3, 0.45, and 0.6) catalysts. Fig. 12 Results for liquid-phase hydrogenation of succinic acid to BDO over 0.3Re–0.3Ru/MC catalyst with respect to recycle run at 200°C and 80bar for 7h. Table 1 Textural properties of (0.6− x)Re–xRu/MC (x =0, 0.15, 0.3, 0.45, and 0.6) catalysts. Sample Re:Ru loading (mol%) a Re:Ru molar ratio Surface area (m2/g) b Pore volume (cm3/g) c Pore diameter (nm) d 0.6Re/MC 0.59:0 1:0 812 1.06 5.2 0.45Re–0.15Ru/MC 0.44:0.15 0.74:0.26 838 1.07 5.1 0.3Re–0.3Ru/MC 0.29:0.31 0.49:0.51 861 1.14 5.3 0.15Re–0.45Ru/MC 0.15:0.45 0.25:0.75 899 1.18 5.3 0.6Ru/MC 0:0.6 0:1 923 1.19 5.0 a Determined by ICP-MS measurement. b Calculated by the BET equation. c Total pore volume at P/P 0 =0.99. d Average pore diameter. Table 2 TPR and CO chemisorption results of (0.6− x)Re–xRu/MC (x =0, 0.15, 0.3, 0.45, and 0.6) catalysts. Catalyst Amount of hydrogen uptake (mol-H2/mol-metal) a Metal surface area (m2/g-catalyst) b Metal dispersion (%) b Average metal particle size (nm) b 0.6Re/MC 2.73 3.15 17.6 7.9 0.45Re–0.15Ru/MC 3.29 3.62 20.3 6.8 0.3Re–0.3Ru/MC 4.10 4.74 26.9 5.1 0.15Re–0.45Ru/MC 3.50 4.09 23.2 5.9 0.6Ru/MC 3.03 3.36 19.2 6.9 a Calculated from peak area of TPR profiles in Fig. 3. b Calculated from CO chemisorption measurement by assuming a stoichiometry factor of CO/metalatom =1. Table 3 XPS analyses results of reduced (0.6− x)Re–xRu/MC (x =0, 0.15, 0.3, 0.45, and 0.6) catalysts. Catalyst Ratio of rhenium species a Ratio of ruthenium species a Surface atomic ratio (×103) Re0/Retotal Reα+/Retotal b Re6+/Retotal Ru0/Rutotal Ru4+/Rutotal Retotal/C Rutotal/C (Re0 +Ru0)/C 0.6Re/MC 0.46 0.26 0.28 – – 4.12 – 1.90 0.45Re–0.15Ru/MC 0.61 0.24 0.15 0.88 0.12 5.03 1.81 4.66 0.3Re–0.3Ru/MC 0.67 0.25 0.08 0.92 0.08 4.75 5.46 8.21 0.15Re–0.45Ru/MC 0.53 0.16 0.31 0.81 0.19 1.51 6.65 6.19 0.6Ru/MC – – – 0.65 0.35 – 5.73 3.72 a Calculated from deconvoluted peak area of XPS spectra in Fig. 7. b 3≤ α ≤4. Table 4 H2-TPD results of reduced (0.6− x)Re–xRu/MC (x =0, 0.15, 0.3, 0.45, and 0.6) catalysts. Catalyst Amount of desorbed hydrogen (μmol-H2/g-catalyst) a Total Weak site (400–500°C) Strong site (500–600°C) 0.6Re/MC 7.3 15.5 22.8 0.45Re–0.15Ru/MC 28.4 18.9 47.3 0.3Re–0.3Ru/MC 56.9 23.2 80.1 0.15Re–0.45Ru/MC 26.7 28.4 52.1 0.6Ru/MC 5.4 35.6 41.0 a Calculated from deconvoluted peak area of H2-TPD profiles in Fig. 8. Table 5 Performance of (0.6− x)Re–xRu/MC (x =0, 0.15, 0.3, 0.45, and 0.6) catalysts in liquid-phase hydrogenation of succinic acid at 200°C and 80bar for 7h. Catalyst Conversion of succinic acid (%) Selectivity (%) Yield for BDO (%) TOF (h−1) a TOFBDO (h−1) b GBL BDO THF 0.6Re/MC 73.1 88.7 7.7 3.6 5.6 25.4 2.05 0.45Re–0.15Ru/MC 100 39.8 52.2 7.9 52.2 46.1 6.04 0.3Re–0.3Ru/MC 100 18.1 71.2 10.7 71.2 61.2 8.51 0.15Re–0.45Ru/MC 100 44.3 48.9 6.8 48.9 38.6 5.23 0.6Ru/MC 45.2 97.5 1.8 0.7 0.8 13.4 0.29 a Calculated as moles of succinic acid converted per moles of surface metal atom per hour (at ca. 10% conversion of succinic acid). b Calculated as moles of BDO produced per moles of surface metal atom per hour (at ca. 70% yield for GBL). Table 6 Metal leaching in the liquid-phase hydrogenation of succinic acid over 0.3Re–0.3Ru/MC catalyst with respect to recycle run at 200°C and 80bar for 7h. Recycle run Rhenium leaching (%) a Ruthenium leaching (%) a Fresh 1.01 0.28 1 0.96 0.40 2 1.47 0.74 a Determined by ICP-MS measurement. Hydrogenation of succinic acid to 1,4-butanediol over Re–Ru bimetallic catalysts supported on mesoporous carbon Ki Hyuk Kang Ung Gi Hong Yongju Bang Jung Ho Choi Jeong Kwon Kim Jong Kwon Lee Seung Ju Han In Kyu Song ⁎ School of Chemical and Biological Engineering, Institute of Chemical Processes, Seoul National University, Shinlim-dong, Kwanak-ku, Seoul 151-744, South Korea School of Chemical and Biological Engineering, Institute of Chemical Processes, Seoul National University Shinlim-dong, Kwanak-ku Seoul 151-744 South Korea ⁎ Corresponding author. Tel.: +82 2 880 9227; fax: +82 2 889 7415. Graphical abstract A series of Re–Ru bimetallic catalysts supported on mesoporous carbon (denoted as (0.6− x)Re–xRu/MC) were prepared by a single-step surfactant-templating method and a subsequent incipient wetness impregnation method with a variation of ruthenium loading (x, mol%), and they were applied to the liquid-phase hydrogenation of succinic acid to 1,4-butanediol (BDO). The effect of metal content on the catalytic activities and physicochemical properties of (0.6− x)Re–xRu/MC catalysts was investigated. It was found that a Re–Ru miscible phase was formed in the catalysts during the reduction process, and it was responsible for strong interaction between rhenium and ruthenium. It was also revealed that reducibility, metal dispersion, and oxidation state of (0.6− x)Re–xRu/MC catalysts were affected by Re:Ru molar ratio. In particular, the oxidation state was closely related to the hydrogen adsorption behavior of the catalysts. The amount of weak hydrogen-binding sites increased with increasing the ratios of metallic rhenium (Re0) and ruthenium (Ru0) with respect to total metallic species in the reduced (0.6− x)Re–xRu/MC catalysts. Catalytic performance in the hydrogenation of succinic acid to BDO over (0.6− x)Re–xRu/MC showed a volcano-shaped trend with respect to Re:Ru molar ratio. This result was well correlated with the amount of weak hydrogen-binding sites of the catalysts. Among the catalysts tested, 0.3Re–0.3Ru/MC with the largest amount of weak hydrogen-binding sites showed the best catalytic performance in the BDO production by hydrogenation of succinic acid. Keywords Hydrogenation Succinic acid 1,4-Butanediol Bimetallic catalyst Re–Ru catalyst 1 Introduction 1,4-Butanediol (BDO) is a versatile chemical that can be used in a wide range of industrial applications. BDO has been used as an organic solvent and a fine chemical for production of adhesives, fibers, and polyurethanes [1–4]. Recently, BDO has received much attention as an important raw material for thermoplastic polymers such as polybutylene succinate (PBS) and polybutylene terephthalate (PBT) [5]. As the consumption of these polymers is growing faster in electronics and automobile industries, in particular, the global demand for BDO is expected to increase rapidly. BDO has been produced through several conventional routes: hydrogenation of maleic anhydride [6], isomerization of propylene oxide [6], and acetoxylation of butadiene [4]. These processes rely on petrochemical feedstocks derived from fossil fuel. Due to the limited amount of fossil fuel, however, current research trend for BDO production moves toward the utilization of renewable energy sources such as biomass. In this respect, conversion of succinic acid to BDO by catalytic hydrogenation has attracted recent attraction as a promising process, because succinic acid can be obtained from bio-refinery process [5]. Hydrogenation of succinic acid to BDO occurs via two-step hydrogenation reactions as shown in Fig. 1 . Succinic acid is first transformed into γ-butyrolactone (GBL) by hydrogenation, and then BDO or tetrahydrofuran (THF) is formed through consecutive hydrogenation of GBL [4]. For the catalytic conversion of succinic acid, various noble metal catalysts such as Pd [7–9], Pt [10], Rh [10], Ru [11,12], and Re [13] have been investigated. Among these catalysts, rhenium has been considered as the most efficient monometallic catalyst for the selective formation of BDO. However, several studies have shown that rhenium alone was not sufficient to obtain high yield for BDO [5,14–17]. In an attempt to improve BDO production by hydrogenation of succinic acid, Re-based bimetallic catalysts, including Re–Pt/C [14], Re–Pd/C [14,15], Re–Pd/TiO2 [16], and Re–Ru/C [15,17], have been investigated. Nonetheless, the researches have rarely elucidated the effect of interaction between rhenium and other metal on the selective formation of BDO from succinic acid. This is because combination of rhenium and noble metal causes difficulty in structural and chemical analyses. For example, rhenium can be miscible with noble metals such as Pt, Pd, and Ru to form a solid-solution due to their similar atomic sizes and surface energies [18–20], which complicates characterization. Moreover, since rhenium does not cause dissociative hydrogen chemisorption at low temperature [21,22], either modified hydrogen chemisorption or CO chemisorption method is essential for determining metal dispersion of Re-based catalyst. In this respect, a systematic investigation on the effect of interaction between rhenium and other metal on the catalytic activities and physicochemical properties of Re-based bimetallic catalyst would be worthwhile. In this work, a series of Re–Ru bimetallic catalysts with different metal content were supported on mesoporous carbon, and they were applied to the liquid-phase hydrogenation of succinic acid to BDO. The effect of metal content on the catalytic activities and physicochemical properties of the catalysts was investigated. The catalysts were characterized by nitrogen adsorption–desorption, TPR, XRD, CO chemisorption, TEM, STEM-EDX mapping, XPS, and H2-TPD analyses. 2 Experimental 2.1 Preparation of (0.6− x)Re–xRu/MC catalysts A series of Re–Ru bimetallic catalysts supported on mesoporous carbon were prepared by a single-step surfactant-templating method and a subsequent incipient wetness impregnation method. For the preparation of mesoporous carbon (MC), 5g of P123 copolymer (Sigma–Aldrich) was dissolved in deionized water (130ml) at room temperature under vigorous stirring. 2.1g of sucrose (Sigma–Aldrich) as a carbon precursor and 20ml of HCl solution (35%) were then added into the solution. Subsequently, 1.9ml of H2SO4 solution (95%) was added into the solution to promote later cross-linkage of P123 with tetraethoxysilane (TEOS). After maintaining the solution with stirring for 1h, 9.3ml of TEOS (Sigma–Aldrich) as a structure-directing agent was slowly added into the mixed solution. The resulting solution was stirred at 37°C for 24h, and it was then kept at 100°C for 24h without stirring for self-assembly of micelle structure. The resultant was dried at 100°C for 48h, and then carbonized at 800°C for 4h at a heating rate of 5°C/min in a nitrogen stream (50ml/min). The obtained carbon–silica composite was then treated with 300ml of HF solution (5%) for 24h to remove silica template, and it was finally filtered and dried. The resulting mesoporous carbon was denoted as MC. For co-impregnation of rhenium and ruthenium onto MC support, known amounts of ReCl5 (Sigma–Aldrich) and RuCl3·xH2O (Sigma–Aldrich) as metal precursors were dissolved in 5ml of acetone. During this process, Re:Ru molar ratio was adjusted to be 1:0, 0.75:0.25, 0.50:0.50, 0.25:0.75, and 0:1, while the total loading of two metals was fixed at 0.6mol% in all the samples to maintain the same number of active sites. The acetone solution containing metal precursors was then introduced to MC by an incipient wetness impregnation method. After drying the impregnated sample at 60°C, it was calcined at 500°C for 4h with a heating rate of 5°C/min under N2 flow (50ml/min) to remove chlorine and organic impurities. The prepared Re–Ru bimetallic catalysts were denoted as (0.6− x)Re–xRu/MC (x =0, 0.15, 0.3, 0.45, and 0.6), where x represented the ruthenium content (mol%). 2.2 Characterization Textural properties of calcined (0.6− x)Re–xRu/MC (x =0, 0.15, 0.3, 0.45, and 0.6) catalysts were investigated by nitrogen adsorption–desorption measurements using a BELSORP-mini II instrument (BEL Japan). Surface areas of the catalysts were calculated by the Brunauer–Emmett–Teller (BET) method. The Re:Ru molar ratios of the catalysts were determined by ICP-MS analyses (ELAN 6100, Perkin-Elmer SCIEX). Temperature-programmed reduction (TPR) analyses of the calcined catalysts were conducted in a flow reactor system equipped with a quartz reactor. 10mg of the catalysts was pretreated with N2 flow (50ml/min) at 200°C for 1h, and subsequently, TPR profiles were obtained using a thermal conductivity detector (TCD) at temperatures ranging from room temperature to 600°C with a heating rate of 5°C/min under 5% H2/N2 flow (50ml/min). X-ray diffraction (XRD) patterns of the reduced catalysts were collected by a D-Max2500-PC diffractometer (Rigaku) using Cu-Kα radiation (λ =1.541Å) operated at 50kV and 100mA. In order to investigate the metal surface area, metal dispersion, and average metal particle size of the reduced catalysts, CO chemisorption experiments were performed using a BELCAT-B instrument (BEL Japan). 10mg of calcined catalyst was reduced at 500°C for 4h with a heating rate of 5°C/min, and then 5% CO/He mixed gas was periodically injected at 100°C. Metal surface area, metal dispersion, and average metal particle size were calculated from the amount of carbon monoxide adsorbed on the reduced catalyst by assuming that one carbon monoxide molecule occupies one surface metal atom. Morphology and particle size distribution of the reduced catalysts were examined by transmission electron microscopy (TEM) analyses (JEM-3010, JEOL). The particle size was calculated on the basis of projected area of particle in the TEM image by assuming that the shape of metal particle is sphere. The projected area, A, was converted to particle diameter, D, using D =2(A/π)1/2. To confirm the detailed distribution of rhenium and ruthenium of the reduced catalysts, energy dispersive X-ray spectroscopy (EDX) mapping analyses were conducted using a scanning transmission electron microscopy (STEM) apparatus (JEM-2100F, JEOL). Binding energies and surface atomic compositions of rhenium and ruthenium in the reduced catalysts were examined by X-ray photoelectron spectroscopy (XPS) analyses using a AXIS-HSI instrument (KRATOS) equipped with a Mg/Al anode source. For XPS analyses, the calcined catalysts were reduced using an ex situ reduction system at 500°C for 4h under 5% H2/N2 flow (50ml/min), and the catalysts were then transported to glass jar with sample holder in argon atmosphere glove box to minimize air exposure. After outgassing the glass jar in a vacuum oven, the sample holder was transferred to the XPS chamber as quickly as possible. All the XPS spectra were calibrated using C 1s peak (284.5eV) as a reference. H2 temperature-programmed desorption (H2-TPD) analyses of the reduced catalysts were conducted using a BELCAT-B instrument (BEL Japan). 10mg of calcined catalyst was reduced at 500°C for 4h with a heating rate of 5°C/min under 5% H2/Ar flow (50ml/min), and then purged with Ar flow (50ml/min) for 10min at 500°C. After cooling the reduced catalyst to 200°C under Ar flow (50ml/min), 5% H2/Ar mixed gas (50ml/min) was injected for 30min at 200°C. To remove physisorbed hydrogen, the sample was purged at 200°C with Ar flow (50ml/min), and subsequently, H2-TPD measurements were conducted within temperature range of 200–700°C at a heating rate of 5°C/min under Ar flow (50ml/min). 2.3 Hydrogenation of succinic acid to BDO Liquid-phase hydrogenation of succinic acid to BDO was conducted in a stainless steel autoclave reactor with a volume of 200ml. Prior to the reaction, the catalysts were reduced using an ex situ reduction system at 500°C for 4h with a heating rate of 5°C/min under 5% H2/N2 flow (50ml/min). In order to avoid air exposure, reduced catalyst (0.1g), succinic acid (0.25g), and 1,4-dioxane (50ml, an inert aprotic solvent) were charged into the reactor in an argon atmosphere glove box. The closed reactor filled with argon was then mounted to the autoclave chamber as quickly as possible. After purging the reactor with nitrogen, it was pressurized up to 50bar using hydrogen. The sealed autoclave was heated to the reaction temperature (200°C), and then pressurized up to 80bar using hydrogen. Catalytic reaction was conducted with constant stirring (700rpm) for 7h. After the reaction, the reactor was cooled to room temperature and depressurized. Reaction products were analyzed with a gas chromatograph (Younglin, ACME-6100) equipped with a flame ionization detector (FID). Conversion of succinic acid, selectivity for product, and yield for product were calculated according to the following equations. (1) Conversion of succinic acid ( % ) = mole of succinic acid reacted mole of succinic acid supplied × 100 (2) Selectivity for product ( % ) = mole of product formed mole of succinic acid reacted × 100 (3) Yield for product ( % ) = conversion of succinic acid × selectivity for product 100 Turnover frequency (TOF) and TOF for BDO (TOFBDO) were calculated on the basis of moles of succinic acid converted at ca. 10% conversion and moles of BDO formed at ca. 70% yield for GBL, respectively. The moles of surface metal atoms used for TOF and TOFBDO calculation were obtained by CO chemisorption experiments. 3 Results and discussion 3.1 Textural properties of (0.6− x)Re–xRu/MC catalysts Textural properties of (0.6− x)Re–xRu/MC (x =0, 0.15, 0.3, 0.45, and 0.6) catalysts were examined by nitrogen adsorption–desorption measurements as shown in Fig. 2 . All the catalysts exhibited IV-type isotherms indicative of mesoporous structure. H3-type hysteresis loops were also observed in the isotherms, which were attributed to the capillary condensation of nitrogen molecules in the well-developed mesopores of carbon support [23]. Detailed textural properties of (0.6− x)Re–xRu/MC (x =0, 0.15, 0.3, 0.45, and 0.6) catalysts are listed in Table 1 . It was found that the actual Re:Ru loadings and molar ratios of the prepared catalysts were in good agreement with the designed values. Total metal loadings were also well fixed at 0.6mol%. All the catalysts retained high surface area (>812m2/g), large pore volume (>1.06cm3/g), and large average pore diameter (>5.0nm), which means that mesoporous carbon structure were successfully formed by a single-step surfactant-templating method. Interestingly, surface area and pore volume of the catalysts decreased with increasing rhenium loading. This might be because pore blockage by rhenium was more severe than that by ruthenium due to the difference in atomic radius of rhenium (137pm) and ruthenium (134pm). 3.2 Reduction behaviors of (0.6− x)Re–xRu/MC catalysts In order to investigate the reduction behaviors of (0.6− x)Re–xRu/MC (x =0, 0.15, 0.3, 0.45, and 0.6) catalysts, TPR measurements were conducted as shown in Fig. 3 . It was found that 0.6Re/MC and 0.6Ru/MC catalysts exhibited asymmetrical reduction peaks at 340°C and 264°C, respectively; the former was attributed to the reduction of rhenium species [24], while the latter was attributed to the reduction of ruthenium species [25]. The reduction peak of 0.45Re–0.15Ru/MC catalyst moved toward lower temperature and showed more narrow shape than that of 0.6Re/MC. In case of bimetallic catalysts containing noble metals such as Pd, Pt, and Ru, the noble metals can affect the reduction of the other metal due to hydrogen transfer from their reduced species [26–29]. Therefore, it can be inferred that hydrogen adsorbed on reduced ruthenium species was transferred to unreduced neighboring rhenium species during the reduction process, which promoted the reduction of rhenium species. It is interesting to note that (0.6− x)Re–xRu/MC (x =0.15, 0.3, and 0.45) catalysts retained only one reduction peak corresponding to co-reduction of rhenium and ruthenium without any reduction peaks for bulk rhenium and ruthenium species, indicating that most of ruthenium atoms were distributed in the periphery of unreduced rhenium atoms throughout the catalyst. Furthermore, the reduction bands of (0.6− x)Re–xRu/MC (x =0.15, 0.3, and 0.45) catalysts were changed to the symmetrical shape compared to those of 0.6Re/MC and 0.6Ru/MC. It is known that the symmetrical peak shape can be induced from uniform reduction process caused by homogeneity of metal particle size [30]. Thus, it is inferred that the particles of both rhenium and ruthenium species were homogeneously formed in the Re–Ru bimetallic catalysts. The amounts of hydrogen uptake calculated from the TPR profiles of (0.6− x)Re–xRu/MC (x =0, 0.15, 0.3, 0.45, and 0.6) catalysts are summarized in Table 2 . It was found that (0.6− x)Re–xRu/MC (x =0.15, 0.3, and 0.45) catalysts showed the larger amount of hydrogen uptake than 0.6Re/MC and 0.6Ru/MC, indicating that the interaction between rhenium and ruthenium species might modify the reducibility of both metal species. However, the amount of hydrogen uptake of (0.6− x)Re–xRu/MC (x =0.15, 0.3, 0.45, and 0.6) catalysts determined by TPR measurements exceeded the theoretical ratio of hydrogen with respect to rhenium (3.5) and ruthenium (2) for complete reduction [31]. This was due to hydrogen spillover induced by metal surface on carbon material [32]. Therefore, it is difficult to determine the reduction degree of (0.6− x)Re–xRu/MC (x =0.15, 0.3, 0.45, and 0.6) catalysts by only TPR results, and this issue will be further discussed in Section 3.5. 3.3 Crystalline structures of reduced (0.6− x)Re–xRu/MC catalysts Crystalline phases of the reduced (0.6− x)Re–xRu/MC (x =0, 0.15, 0.3, 0.45, and 0.6) catalysts were examined by XRD measurements as presented in Fig. 4 . All the catalysts showed diffraction peaks for graphitic carbon structure at 2θ =23.5° and 43.8° [33]. The diffraction peaks corresponding to (101) planes of metallic rhenium (dashed line in Fig. 4) and ruthenium (solid line in Fig. 4) were clearly observed in the XRD patterns of 0.6Re/MC and 0.6Ru/MC catalysts, respectively, although the diffraction peak of 0.6Ru/MC was overlapped with that (43.8°) of the carbon support. On the other hand, any diffraction peaks for rhenium and ruthenium species were not detected in the (0.6− x)Re–xRu/MC (x =0.15, 0.3, and 0.45) catalysts. This result might be because particle sizes of metallic rhenium and ruthenium in the catalysts were too small to be detected by XRD. According to the literatures [18–20], rhenium and ruthenium species can interact in all range of chemical composition due to their similar crystal structure, atomic radius, and electronegativity. Thus, it is inferred that the interaction between rhenium and ruthenium species affected the development of particles during the reduction process, which might induce the decrement of metal particle size of Re–Ru bimetallic catalysts compared to rhenium or ruthenium monometallic catalyst. 3.4 Metal dispersion of reduced (0.6− x)Re–xRu/MC catalysts To investigate the effect of Re–Ru interaction on the metal dispersion, CO chemisorption measurements for the reduced (0.6− x)Re–xRu/MC (x =0, 0.15, 0.3, 0.45, and 0.6) catalysts were conducted. As listed in Table 2, metal surface area and metal dispersion increased in the order of 0.6Re/MC<0.6Ru/MC<0.45Re–0.15Ru/MC<0.15Re–0.45Ru/MC<0.3Re–0.3Ru/MC, while average metal particle size decreased in the order of 0.6Re/MC>0.6Ru/MC>0.45Re–0.15Ru/MC>0.15Re–0.45Ru/MC>0.3Re–0.3Ru/MC. It was found that all the catalysts retained small metal particle size in the range of 5.1–7.9nm, indicating that metallic rhenium and ruthenium particles were finely dispersed in the mesoporous carbon framework. It is noteworthy that average metal particle sizes of (0.6− x)Re–xRu/MC (x =0.15, 0.3, and 0.45) catalysts were smaller than those of 0.6Re/MC and 0.6Ru/MC. This might be because aggregation of each rhenium and ruthenium particle was effectively suppressed by forming a Re–Ru metallic bond during the reduction process, as discussed in the XRD results. The above result was further confirmed by TEM analyses. Fig. 5 shows the TEM images and particle size distributions of reduced (0.6− x)Re–xRu/MC (x =0, 0.15, 0.3, 0.45, and 0.6) catalysts. All the catalysts retained an ordered mesoporous carbon structure and well-dispersed metal particles as presented in the TEM images. However, (0.6− x)Re–xRu/MC (x =0.15, 0.3, and 0.45) catalysts showed more narrow particle size distributions than 0.6Re/MC and 0.6Ru/MC, indicating that metal particles of Re–Ru bimetallic catalysts were uniformly distributed, as discussed in the TPR results. It is noteworthy that all the reduced catalysts retained a few metal particles which were larger than pore sizes of the calcined catalysts (Table 1). This means that some metal particles grown during the reduction process caused the partial pore blockage of carbon supports. It was revealed that average metal particle size measured by TEM decreased in the order of 0.6Re/MC>0.6Ru/MC>0.45Re–0.15Ru/MC>0.15Re–0.45Ru/MC>0.3Re–0.3Ru/MC, which was well consistent with the trend of average metal particle size determined by CO chemisorption. However, average metal particle sizes of all catalysts determined by CO chemisorption were larger than those measured by TEM. This overestimation might be because the catalysts were partially reduced under the reduction condition at 500°C for 4h. Among the catalysts, 0.3Re–0.3Ru/MC showed the largest metal dispersion and smallest average metal particle size. In order to confirm the distribution of rhenium and ruthenium species, STEM-EDX analyses were carried out. Fig. 6 showed the STEM and EDX mapping images for one metal particle (white arrow in Fig. 6) of reduced 0.3Re–0.3Ru/MC catalyst. Rhenium and ruthenium species were distinguishable in the EDX mapping images. It is noticeable that rhenium atom (blue dot in Fig. 6) and ruthenium atom (red dot in Fig. 6) were co-presented in the metal particle domain of 0.3Re–0.3Ru/MC catalyst. On the basis of TPR, XRD, and EDX mapping results, it is believed that a Re–Ru miscible phase was formed in the reduced 0.3Re–0.3Ru/MC catalyst and this was responsible for strong interaction between metallic rhenium and ruthenium species. 3.5 XPS study of reduced (0.6− x)Re–xRu/MC catalysts It is known that the oxidation state of metal species in the catalyst served as an important factor determining the catalytic activity [34,35]. Accordingly, the oxidation states of reduced (0.6− x)Re–xRu/MC (x =0, 0.15, 0.3, 0.45, and 0.6) catalysts were examined by XPS analyses. Fig. 7 shows the XPS spectra for Re 4f (Fig. 7(a)) and Ru 3p3/2 (Fig. 7(b)) levels of the catalysts. The Re 4f spectra were deconvoluted into Re 4f7/2 (solid line in Fig. 7(a)) and Re 4f5/2 (dashed line in Fig. 7(a)) peaks, and then Re 4f7/2 spectra were divided into Re0 (40.6eV), Re3+ (41.4eV), Re4+ (42.3eV), and Re6+ (45.3eV) species [36,37]. On the other hand, the Ru 3p3/2 spectra were assigned to metallic Ru0 (462.1eV) and Ru4+ (464.3eV) species [38]. It was found that the areas of Re 4f and Ru 3p3/2 spectra decreased with decreasing the rhenium and ruthenium loading, respectively. On the basis of deconvoluted peak areas of Re 3f7/2 and Ru 3p3/2 spectra, the oxidation state ratios and surface atomic ratios of rhenium and ruthenium were quantified as summarized in Table 3 . It was found that Re0/Retotal increased in the order of 0.6Re/MC<0.15Re–0.45Ru/MC<0.45Re–0.15Ru/MC<0.3Re–0.3Ru/MC, while Ru0/Rutotal increased in the order of 0.6Ru/MC<0.15Re–0.45Ru/MC<0.45Re–0.15Ru/MC<0.3Re–0.3Ru/MC. It was also found that (Re0 +Ru0)/C increased in the order of 0.6Re/MC<0.6Ru/MC<0.45Re–0.15Ru/MC<0.15Re–0.45Ru/MC<0.3Re–0.3Ru/MC, which was in good agreement with the trend of metal surface area determined by CO chemisorption (Table 2). This demonstrates that all the catalysts retained different total reduction degree of rhenium and ruthenium species. In addition, (Re0 +Ru0)/C increased with decreasing average metal particle size determined by TEM (Fig. 5), indicating that total reduction degree of both two metals was closely related to the average particle size of the catalysts. It is important to note that (Re0 +Ru0)/C ratios of (0.6− x)Re–xRu/MC (x =0.15, 0.3, and 0.45) catalysts were higher than those of 0.6Re/MC and 0.6Ru/MC. According to the shrinking core model [39–41], the reduction of a metal particle is limited by the intraparticle hydrogen diffusivity, which means that the reduction degree of metal species can be enhanced by decreasing the particle size. Therefore, it is believed that the Re–Ru bimetallic catalysts with smaller particle size were more effectively reduced than rhenium or ruthenium monometallic catalyst. 3.6 Hydrogen adsorption study on reduced (0.6− x)Re–xRu/MC catalysts It has been reported that the ability of hydrogen adsorption on the active sites plays a crucial role in the catalytic hydrogenation reaction [42,43]. Thus, H2-TPD measurements were carried out to explain the affinity of metal species toward hydrogen in the reduced (0.6− x)Re–xRu/MC (x =0, 0.15, 0.3, 0.45, and 0.6) catalysts. In this study, hydrogen was injected to the reduced catalysts at 200°C, which was identical to the reaction temperature, to thermally activate the dissociative adsorption of hydrogen molecules on metallic rhenium and ruthenium [21,22,44]. Fig. 8 shows the H2-TPD profiles of reduced (0.6− x)Re–xRu/MC (x =0, 0.15, 0.3, 0.45, and 0.6) catalysts. For comparison, H2-TPD profile of MC support was also presented. The H2-TPD profile of MC support exhibited a broad miner peak at 283°C and a main peak at 607°C; the former corresponded to the adsorption of hydrogen molecules, while the latter was caused by gaseous products such as H2, CH4, C2H2, and C2H4 formed by reaction of carbon with spillover hydrogen on carbon surface, as evidenced by the TPR results [32,33,45]. Interestingly, when rhenium or ruthenium was added into the MC support, new peaks corresponding to the dissociatively adsorbed hydrogen (400–600°C) appeared instead of the peak for molecularly adsorbed hydrogen (<300°C). In order to distinguish dissociatively adsorbed hydrogen in the H2-TPD profiles of the reduced (0.6− x)Re–xRu/MC catalysts, therefore, H2-TPD profiles were deconvoluted into three peaks in terms of desorption temperature; weak hydrogen-binding site (400–500°C), strong hydrogen-binding site (500–600°C), and the others (>600°C). The other peaks appearing above 600°C might be due to mesoporous carbon. Thus, weak hydrogen-binding sites and strong hydrogen-binding sites were only considered for quantification. The amounts of these two hydrogen-binding sites calculated from the deconvoluted results of H2-TPD profiles of the catalysts are summarized in Table 4 . Total amount of hydrogen desorbed from the reduced (0.6− x)Re–xRu/MC catalysts increased in the order of 0.6Re/MC<0.6Ru/MC<0.45Re–0.15Ru/MC<0.15Re–0.45Ru/MC<0.3Re–0.3Ru/MC. This trend was well consistent with the trend of (Re0 +Ru0)/C determined by XPS analyses (Table 3), indicating that larger total amount of desorbed hydrogen resulted from more reduced state of the catalysts. On the other hand, the amount of weak hydrogen-binding sites increased in the order of 0.6Ru/MC<0.6Re/MC<0.15Re–0.45Ru/MC<0.45Re–0.15Ru/MC<0.3Re–0.3Ru/MC, which was different from the trend of the total amount of hydrogen-binding sites. From XPS and H2-TPD results of the reduced (0.6− x)Re–xRu/MC catalysts, it was found that the trend of weak hydrogen-binding sites was well matched with the trend of Re0/Retotal and Ru0/Rutotal ratios (Table 3). Fig. 9 shows the relationships between the amount of weak hydrogen-binding sites and Re0/Retotal ratio and between the amount of weak hydrogen-binding sites and Ru0/Rutotal ratio of reduced (0.6− x)Re–xRu/MC (x =0, 0.15, 0.3, 0.45, and 0.6) catalysts. It was revealed that the amount of weak hydrogen-binding sites increased with increasing Re0/Retotal and Ru0/Rutotal ratios, suggesting that the metallic ratio was a crucial factor determining the hydrogen adsorption behavior of (0.6− x)Re–xRu/MC catalysts. In other words, the synergistic interaction formed by Re–Ru metallic bond increased the amount of weak hydrogen-binding sites with respect to total active sites in the (0.6− x)Re–xRu/MC catalysts. It is well known that the weakly bound hydrogen atoms on the metallic surface are highly mobile due to their low stability, and therefore, they can be easily and continuatively delivered to the adsorbed reactant molecules [46,47]. Thus, it is expected that a catalyst retaining larger amount of weak hydrogen-binding sites would be more favorable for continuous supply of hydrogen to adsorbed succinic acid. 3.7 Hydrogenation of succinic acid to BDO over (0.6− x)Re–xRu/MC catalysts In order to ensure the reaction pathways presented in Fig. 1, catalytic hydrogenation of succinic acid to BDO was carried out at 200°C and 80bar with time on stream. 0.3Re–0.3Ru/MC catalyst with the largest amount of weak hydrogen-binding sites was used as a model catalyst for the reaction. Fig. 10 shows the conversion of succinic acid and yields for GBL, BDO, and THF as a function of time. It was found that succinic acid was completely converted after 5h, and yield for GBL exhibited a volcano-shaped curve with respect to the reaction time because GBL was transformed to BDO or THF by consecutive hydrogenation. It is noteworthy that BDO was dominantly produced from GBL, indicating that BDO can be selectively formed from succinic acid over 0.3Re–0.3Ru/MC catalyst. The yield for BDO showed the maximum value (71.2%) after 7h-reaction. The catalytic performance of (0.6− x)Re–xRu/MC (x =0, 0.15, 0.3, 0.45, and 0.6) in the liquid-phase hydrogenation of succinic acid to BDO at 200°C and 80bar for 7h is summarized in Table 5 . It was found that 0.6Re/MC and 0.6Ru/MC catalysts produced GBL as a major product, while (0.6− x)Re–xRu/MC (x =0.15, 0.3, and 0.45) catalysts produced BDO as a major product in the reaction. This result indicates that Re–Ru bimetallic catalysts were more effective for consecutive hydrogenation of succinic acid to BDO via GBL than rhenium or ruthenium monometallic catalyst. It should be noted that TOF and TOFBDO of (0.6− x)Re–xRu/MC (x =0.15, 0.3, and 0.45) catalysts were also higher than those of 0.6Re/MC and 0.6Ru/MC, which means that the Re–Ru bimetallic catalysts were structure sensitive in the hydrogenation of succinic acid to BDO. In other words, the catalytic activity of (0.6− x)Re–xRu/MC was significantly affected by the ability of active sites rather than by the amount of total active sites. TOF and TOFBDO increased in the order of 0.6Ru/MC<0.6Re/MC<0.15Re–0.45Ru/MC<0.45Re–0.15Ru/MC<0.3Re–0.3Ru/MC. Among the catalysts tested, 0.3Re–0.3Ru/MC showed the highest TOF (61.2h−1) and TOFBDO (8.51h−1). In particular, the catalytic performance of 0.3Re–0.3Ru/MC was comparable to that of reported Re-based bimetallic catalysts [14–17]. This implies that 0.3Re–0.3Ru/MC served as a promising catalyst for the selective formation of BDO from succinic acid. From the trend of TOFBDO (Table 5), it was revealed that an optimal Re:Ru molar ratio was required for the maximum BDO production by hydrogenation of succinic acid over (0.6− x)Re–xRu/MC (x =0, 0.15, 0.3, 0.45, and 0.6) catalysts. It was also found that the trend of TOFBDO was closely related to the hydrogen adsorption behavior of the catalysts. Accordingly, TOFBDO of (0.6− x)Re–xRu/MC catalysts was correlated with the amount of weak hydrogen-binding sites as shown in Fig. 11 . It was revealed that TOFBDO increased with increasing the amount of weak hydrogen-binding sites. This indicates that weak hydrogen-binding sites of the catalysts served as the crucial active sites for the selective formation of BDO from hydrogenation of succinic acid. This is because weak hydrogen-binding site can provide excellent hydrogen supply to the reactants adsorbed on the catalysts, as discussed in the H2-TPD results. Among the catalysts, 0.3Re–0.3Ru/MC catalyst with the largest amount of weak hydrogen-binding sites showed the highest TOFBDO in the hydrogenation of succinic acid to BDO. 3.8 Stability and reusability of 0.3Re–0.3Ru/MC catalysts To investigate the stability of 0.3Re–0.3Ru/MC catalyst, reusability of the catalyst was tested. According to the previous works [12,13], it was revealed that the decrement of catalytic activity in the hydrogenation of succinic acid was mainly attributed to the leaching of active metal species under the harsh reaction conditions. For the recycle test, the spent catalyst was separated from liquid product by filtration, washed with deionized water, and dried in a vacuum oven at 60°C after each reaction test. The remaining liquid containing leached metal species was collected for ICP-MS analysis. Fig. 12 shows the recycle results of 0.3Re–0.3Ru/MC catalyst in the liquid-phase hydrogenation of succinic acid to BDO at 200°C and 80bar for 7h. Fresh and spent 0.3Re–0.3Re/MC catalyst showed complete conversion of succinic acid, and selectivity and yield for BDO over the catalyst remained almost constant. Moreover, no significant metal leaching was observed (less than 2%) after each recycle test, as listed in Table 6 . This implies that the strong interaction of Re–Ru metallic bond effectively suppressed leaching of metal species. Thus, 0.3Re–0.3Ru/MC catalyst served as a stable and reusable catalyst in the hydrogenation of succinic acid to BDO. 4 Conclusion A series of Re–Ru bimetallic catalysts supported on mesoporous carbon ((0.6− x)Re–xRu/MC, x =0, 0.15, 0.3, 0.45, and 0.6mol%) were prepared by a single-step surfactant-templating method and a subsequent incipient wetness impregnation method, and they were used for liquid-phase hydrogenation of succinic acid to BDO. The effect of metal content on the catalytic activities and physicochemical properties of (0.6− x)Re–xRu/MC was investigated. All the catalysts showed a well-developed mesoporous structure. It was found that a Re–Ru solid-solution phase was formed in the catalysts during the reduction process, facilitating the synergistic interaction between rhenium and ruthenium. It was also revealed that reducibility, metal dispersion, and oxidation state of (0.6− x)Re–xRu/MC catalysts were strongly influenced by Re:Ru molar ratio. In particular, the ratios of Re0/Retotal and Ru0/Rutotal were closely related to the hydrogen adsorption behavior of the reduced (0.6− x)Re–xRu/MC catalysts. The amount of weak hydrogen-binding sites of the catalysts increased with increasing Re0/Retotal and Ru0/Rutotal ratios. Catalytic performance in the hydrogenation of succinic acid to BDO over (0.6− x)Re–xRu/MC showed a volcano-shaped trend with respect to Re:Ru molar ratio. TOFBDO increased with increasing the amount of weak hydrogen-binding sites of the reduced (0.6− x)Re–xRu/MC catalysts. Among the catalysts tested, 0.3Re–0.3Ru/MC with the largest amount of weak hydrogen-binding sites showed the highest TOFBDO. Furthermore, 0.3Re–0.3Ru/MC served as a stable and reusable catalyst in the selective formation of BDO by hydrogenation of succinic acid. Acknowledgement This work was supported by the Global Frontier R&D Program on Center for Multiscale Energy System funded by the National Research Foundation under the Ministry of Education, Science and Technology, Korea (20110031575). References [1] M.L. Morgan Chem. Ind. 3 1997 166 168 [2] I. Bechthold K. Bretz S. Kabasci R. Kopitzky A. Springer Chem. Eng. Technol. 31 2008 647 654 [3] C. Delhomme D. Weuster-Botz F.E. Kuhn Green Chem. 11 2009 13 26 [4] A. Cukalovic C.V. Stevens Biofuels Bioprod. Bioref. 2 2008 505 529 [5] P. Gallezot Chem. Soc. Rev. 41 2012 1538 1558 [6] T. Haas B. Jaeger R. Weber S.F. Mitchell C.F. King Appl. Catal. A 280 2005 83 88 [7] S.-H. Chung Y.-M. Park M.-S. Kim K.-Y. Lee Catal. Today 185 2012 205 210 [8] B. Tapin F. Epron C. Especel B.K. Ly C. Pinel M. Besson ACS Catal. 3 2013 2327 2335 [9] U.G. Hong J. Lee S. Hwang I.K. Song Catal. Lett. 141 2011 332 338 [10] R. Luque J.H. Clark K. Yoshida P.L. Gai Chem. Commun. 35 2009 5305 5307 [11] L. Rosi M. Frediani P. Frediani J. Organomet. Chem. 695 2010 1314 1322 [12] U.G. Hong J.K. Kim J. Lee J.K. Lee J.H. Song J. Yi I.K. Song Appl. Catal. A 469 2014 466 471 [13] U.G. Hong H.W. Park J. Lee S. Hwang J. Yi I.K. Song Appl. Catal. A 415 2012 141 148 [14] L. Corbel-Dimailly B.-K. Ly D.-P. Minh B. Tapin C. Especel F. Epron A. Cabiac E. Guillon M. Besson C. Pinel ChemSusChem 6 2013 2388 2395 [15] D.P. Minh M. Besson C. Pinel P. Fuertes C. Petitjean Top. Catal. 53 2010 1270 1273 [16] B.K. Ly D.P. Minh C. Pinel M. Besson B. Tapin F. Epron C. Especel Top. Catal. 55 2012 466 473 [17] R.V. Chaudhari C.V. Rode R.M. Deshpande R. Jaganathan T.M. Leib P.L. Mills Chem. Eng. Sci. 58 2003 627 632 [18] G. Beamson A.J. Papworth C. Phillipps A.M. Smith R. Whyman J. Catal. 278 2011 228 238 [19] V. Ponec G.C. Bond Stud. Surf. Sci. Catal. 95 1993 393 453 [20] T.B. Massalski Binary Alloy Phase Diagrams 1990 ASM International Materials Park [21] H.C. Yao M. Shelef J. Catal. 44 1976 392 403 [22] J. Okal L. Kepinski L. Krajczyk M. Drozd J. Catal. 188 1999 140 153 [23] I. Matos S. Fernandes L. Guerreiro S. Barata A.M. Ramos J. Vital I.M. Fonseca Microporous Mesoporous Mater. 92 2006 38 46 [24] P. Arnoldy E.M. Van-Oersa O.S.L. Bruinsma V.H.J. De-Beer J.A. Moulijn J. Catal. 93 1985 231 245 [25] P. Betancourt A. Rives R. Hubaut C.E. Scott J. Goldwaser Appl. Catal. A 170 1998 307 314 [26] M. Bonarowska A. Malinowski Z. Karpinski Appl. Catal. A 188 1999 145 154 [27] B.H. Isaacs E.E. Petersen J. Catal. 77 1982 43 52 [28] L. Ma D. He Top. Catal. 52 2009 834 844 [29] Y. Amada Y. Shimi S. Koso T. Kubota Y. Nakagawa K. Tomishige Appl. Catal. B 105 2011 117 127 [30] S.T. Homeyer W.M.H. Sachtler J. Catal. 118 1989 226 274 [31] K. Aika K. Shimazaki Y. Hattori A. Ohya S. Ohshima K. Shirota A. Ozaki J. Catal. 92 1985 296 304 [32] P. Badenes L. Daza I. Rodriguez-Ramos A. Guerrero-Ruiz Stud. Surf. Sci. Catal. 112 1997 241 250 [33] Z.Q. Li C.J. Lu Z.P. Xia Y. Zhou Z. Luo Carbon 45 2007 1686 1695 [34] Y. Zhu W. Lu H. Li H. Wan J. Catal. 246 2007 382 389 [35] Y. Yazawa H. Yoshida N. Takagi S. Komai A. Satsuma T. Hattori J. Catal. 187 1999 15 23 [36] Y. Yuan T. Shido Y. Iwasawa Chem. Commun. 15 2000 1421 1422 [37] W.T. Tysoe F. Zaera G.A. Somorjai Surf. Sci. 200 1988 1 14 [38] P.C.H. Mitchell C.E. Scott J.-P. Bonnelle J.G. Grimblot J. Catal. 107 1987 482 489 [39] S. Yagi D. Kuni Chem. Eng. Sci. 16 1961 372 379 [40] J.Y. Park O. Levenspiel Chem. Eng. Sci. 30 1975 1207 1214 [41] S.C. Su J.N. Carstens A.T. Bell J. Catal. 176 1998 125 135 [42] P. Claus Appl. Catal. A 291 2005 222 229 [43] J.-P. Tessonnier L. Pesant G. Ehret M.J. Ledoux C. Pham-Huu Appl. Catal. A 288 2005 203 210 [44] K. Baranowska J. Okal N. Miniajluk Catal. Lett. 144 2014 447 459 [45] X. Dong H.-B. Zhang G.-D. Lin Y.-Z. Yuan K.R. Ysai Catal. Lett. 85 2003 237 246 [46] C. Zupanc A. Hornung O. Hinrichsen M. Muhler J. Catal. 209 2002 501 514 [47] D.P. Vanderwiel M. Pruski T.S. King J. Catal. 188 1999 186 202",
      "scopus-id": "84919392947",
      "coredata": {
        "eid": "1-s2.0-S0926860X14007352",
        "dc:description": "A series of Re–Ru bimetallic catalysts supported on mesoporous carbon (denoted as (0.6− x)Re–xRu/MC) were prepared by a single-step surfactant-templating method and a subsequent incipient wetness impregnation method with a variation of ruthenium loading (x, mol%), and they were applied to the liquid-phase hydrogenation of succinic acid to 1,4-butanediol (BDO). The effect of metal content on the catalytic activities and physicochemical properties of (0.6− x)Re–xRu/MC catalysts was investigated. It was found that a Re–Ru miscible phase was formed in the catalysts during the reduction process, and it was responsible for strong interaction between rhenium and ruthenium. It was also revealed that reducibility, metal dispersion, and oxidation state of (0.6− x)Re–xRu/MC catalysts were affected by Re:Ru molar ratio. In particular, the oxidation state was closely related to the hydrogen adsorption behavior of the catalysts. The amount of weak hydrogen-binding sites increased with increasing the ratios of metallic rhenium (Re0) and ruthenium (Ru0) with respect to total metallic species in the reduced (0.6− x)Re–xRu/MC catalysts. Catalytic performance in the hydrogenation of succinic acid to BDO over (0.6− x)Re–xRu/MC showed a volcano-shaped trend with respect to Re:Ru molar ratio. This result was well correlated with the amount of weak hydrogen-binding sites of the catalysts. Among the catalysts tested, 0.3Re–0.3Ru/MC with the largest amount of weak hydrogen-binding sites showed the best catalytic performance in the BDO production by hydrogenation of succinic acid.",
        "openArchiveArticle": "false",
        "prism:coverDate": "2015-01-25",
        "openaccessUserLicense": null,
        "prism:aggregationType": "Journal",
        "prism:url": "https://api.elsevier.com/content/article/pii/S0926860X14007352",
        "dc:creator": [
          {
            "@_fa": "true",
            "$": "Kang, Ki Hyuk"
          },
          {
            "@_fa": "true",
            "$": "Hong, Ung Gi"
          },
          {
            "@_fa": "true",
            "$": "Bang, Yongju"
          },
          {
            "@_fa": "true",
            "$": "Choi, Jung Ho"
          },
          {
            "@_fa": "true",
            "$": "Kim, Jeong Kwon"
          },
          {
            "@_fa": "true",
            "$": "Lee, Jong Kwon"
          },
          {
            "@_fa": "true",
            "$": "Han, Seung Ju"
          },
          {
            "@_fa": "true",
            "$": "Song, In Kyu"
          }
        ],
        "link": [
          {
            "@_fa": "true",
            "@rel": "self",
            "@href": "https://api.elsevier.com/content/article/pii/S0926860X14007352"
          },
          {
            "@_fa": "true",
            "@rel": "scidir",
            "@href": "https://www.sciencedirect.com/science/article/pii/S0926860X14007352"
          }
        ],
        "dc:format": "application/json",
        "openaccessType": null,
        "pii": "S0926-860X(14)00735-2",
        "prism:volume": "490",
        "prism:publisher": "Elsevier B.V.",
        "dc:title": "Hydrogenation of succinic acid to 1,4-butanediol over Re–Ru bimetallic catalysts supported on mesoporous carbon",
        "prism:copyright": "Copyright © 2014 Elsevier B.V. All rights reserved.",
        "openaccess": "0",
        "prism:issn": "0926860X",
        "dcterms:subject": [
          {
            "@_fa": "true",
            "$": "Hydrogenation"
          },
          {
            "@_fa": "true",
            "$": "Succinic acid"
          },
          {
            "@_fa": "true",
            "$": "1,4-Butanediol"
          },
          {
            "@_fa": "true",
            "$": "Bimetallic catalyst"
          },
          {
            "@_fa": "true",
            "$": "Re–Ru catalyst"
          }
        ],
        "openaccessArticle": "false",
        "prism:publicationName": "Applied Catalysis A: General",
        "openaccessSponsorType": null,
        "prism:pageRange": "153-162",
        "prism:endingPage": "162",
        "pubType": "fla",
        "prism:coverDisplayDate": "25 January 2015",
        "prism:doi": "10.1016/j.apcata.2014.11.029",
        "prism:startingPage": "153",
        "dc:identifier": "doi:10.1016/j.apcata.2014.11.029",
        "openaccessSponsorName": null
      },
      "objects": {
        "object": [
          {
            "@category": "thumbnail",
            "@height": "164",
            "@width": "164",
            "@_fa": "true",
            "$": "https://api.elsevier.com/content/object/eid/1-s2.0-S0926860X14007352-fx1.sml?httpAccept=%2A%2F%2A",
            "@multimediatype": "GIF image file",
            "@type": "IMAGE-THUMBNAIL",
            "@size": "4108",
            "@ref": "fx1",
            "@mimetype": "image/gif"
          },
          {
            "@category": "thumbnail",
            "@height": "70",
            "@width": "219",
            "@_fa": "true",
            "$": "https://api.elsevier.com/content/object/eid/1-s2.0-S0926860X14007352-gr1.sml?httpAccept=%2A%2F%2A",
            "@multimediatype": "GIF image file",
            "@type": "IMAGE-THUMBNAIL",
            "@size": "2590",
            "@ref": "gr1",
            "@mimetype": "image/gif"
          },
          {
            "@category": "thumbnail",
            "@height": "163",
            "@width": "165",
            "@_fa": "true",
            "$": "https://api.elsevier.com/content/object/eid/1-s2.0-S0926860X14007352-gr10.sml?httpAccept=%2A%2F%2A",
            "@multimediatype": "GIF image file",
            "@type": "IMAGE-THUMBNAIL",
            "@size": "4490",
            "@ref": "gr10",
            "@mimetype": "image/gif"
          },
          {
            "@category": "thumbnail",
            "@height": "164",
            "@width": "164",
            "@_fa": "true",
            "$": "https://api.elsevier.com/content/object/eid/1-s2.0-S0926860X14007352-gr11.sml?httpAccept=%2A%2F%2A",
            "@multimediatype": "GIF image file",
            "@type": "IMAGE-THUMBNAIL",
            "@size": "3552",
            "@ref": "gr11",
            "@mimetype": "image/gif"
          },
          {
            "@category": "thumbnail",
            "@height": "164",
            "@width": "167",
            "@_fa": "true",
            "$": "https://api.elsevier.com/content/object/eid/1-s2.0-S0926860X14007352-gr12.sml?httpAccept=%2A%2F%2A",
            "@multimediatype": "GIF image file",
            "@type": "IMAGE-THUMBNAIL",
            "@size": "7939",
            "@ref": "gr12",
            "@mimetype": "image/gif"
          },
          {
            "@category": "thumbnail",
            "@height": "164",
            "@width": "154",
            "@_fa": "true",
            "$": "https://api.elsevier.com/content/object/eid/1-s2.0-S0926860X14007352-gr2.sml?httpAccept=%2A%2F%2A",
            "@multimediatype": "GIF image file",
            "@type": "IMAGE-THUMBNAIL",
            "@size": "6124",
            "@ref": "gr2",
            "@mimetype": "image/gif"
          },
          {
            "@category": "thumbnail",
            "@height": "164",
            "@width": "161",
            "@_fa": "true",
            "$": "https://api.elsevier.com/content/object/eid/1-s2.0-S0926860X14007352-gr3.sml?httpAccept=%2A%2F%2A",
            "@multimediatype": "GIF image file",
            "@type": "IMAGE-THUMBNAIL",
            "@size": "4087",
            "@ref": "gr3",
            "@mimetype": "image/gif"
          },
          {
            "@category": "thumbnail",
            "@height": "164",
            "@width": "150",
            "@_fa": "true",
            "$": "https://api.elsevier.com/content/object/eid/1-s2.0-S0926860X14007352-gr4.sml?httpAccept=%2A%2F%2A",
            "@multimediatype": "GIF image file",
            "@type": "IMAGE-THUMBNAIL",
            "@size": "7192",
            "@ref": "gr4",
            "@mimetype": "image/gif"
          },
          {
            "@category": "thumbnail",
            "@height": "164",
            "@width": "216",
            "@_fa": "true",
            "$": "https://api.elsevier.com/content/object/eid/1-s2.0-S0926860X14007352-gr5.sml?httpAccept=%2A%2F%2A",
            "@multimediatype": "GIF image file",
            "@type": "IMAGE-THUMBNAIL",
            "@size": "25686",
            "@ref": "gr5",
            "@mimetype": "image/gif"
          },
          {
            "@category": "thumbnail",
            "@height": "164",
            "@width": "164",
            "@_fa": "true",
            "$": "https://api.elsevier.com/content/object/eid/1-s2.0-S0926860X14007352-gr6.sml?httpAccept=%2A%2F%2A",
            "@multimediatype": "GIF image file",
            "@type": "IMAGE-THUMBNAIL",
            "@size": "22614",
            "@ref": "gr6",
            "@mimetype": "image/gif"
          },
          {
            "@category": "thumbnail",
            "@height": "132",
            "@width": "219",
            "@_fa": "true",
            "$": "https://api.elsevier.com/content/object/eid/1-s2.0-S0926860X14007352-gr7.sml?httpAccept=%2A%2F%2A",
            "@multimediatype": "GIF image file",
            "@type": "IMAGE-THUMBNAIL",
            "@size": "6979",
            "@ref": "gr7",
            "@mimetype": "image/gif"
          },
          {
            "@category": "thumbnail",
            "@height": "164",
            "@width": "162",
            "@_fa": "true",
            "$": "https://api.elsevier.com/content/object/eid/1-s2.0-S0926860X14007352-gr8.sml?httpAccept=%2A%2F%2A",
            "@multimediatype": "GIF image file",
            "@type": "IMAGE-THUMBNAIL",
            "@size": "5671",
            "@ref": "gr8",
            "@mimetype": "image/gif"
          },
          {
            "@category": "thumbnail",
            "@height": "164",
            "@width": "186",
            "@_fa": "true",
            "$": "https://api.elsevier.com/content/object/eid/1-s2.0-S0926860X14007352-gr9.sml?httpAccept=%2A%2F%2A",
            "@multimediatype": "GIF image file",
            "@type": "IMAGE-THUMBNAIL",
            "@size": "4723",
            "@ref": "gr9",
            "@mimetype": "image/gif"
          },
          {
            "@category": "standard",
            "@height": "200",
            "@width": "200",
            "@_fa": "true",
            "$": "https://api.elsevier.com/content/object/eid/1-s2.0-S0926860X14007352-fx1.jpg?httpAccept=%2A%2F%2A",
            "@multimediatype": "JPEG image file",
            "@type": "IMAGE-DOWNSAMPLED",
            "@size": "7759",
            "@ref": "fx1",
            "@mimetype": "image/jpeg"
          },
          {
            "@category": "standard",
            "@height": "160",
            "@width": "498",
            "@_fa": "true",
            "$": "https://api.elsevier.com/content/object/eid/1-s2.0-S0926860X14007352-gr1.jpg?httpAccept=%2A%2F%2A",
            "@multimediatype": "JPEG image file",
            "@type": "IMAGE-DOWNSAMPLED",
            "@size": "12819",
            "@ref": "gr1",
            "@mimetype": "image/jpeg"
          },
          {
            "@category": "standard",
            "@height": "331",
            "@width": "334",
            "@_fa": "true",
            "$": "https://api.elsevier.com/content/object/eid/1-s2.0-S0926860X14007352-gr10.jpg?httpAccept=%2A%2F%2A",
            "@multimediatype": "JPEG image file",
            "@type": "IMAGE-DOWNSAMPLED",
            "@size": "20061",
            "@ref": "gr10",
            "@mimetype": "image/jpeg"
          },
          {
            "@category": "standard",
            "@height": "353",
            "@width": "353",
            "@_fa": "true",
            "$": "https://api.elsevier.com/content/object/eid/1-s2.0-S0926860X14007352-gr11.jpg?httpAccept=%2A%2F%2A",
            "@multimediatype": "JPEG image file",
            "@type": "IMAGE-DOWNSAMPLED",
            "@size": "15751",
            "@ref": "gr11",
            "@mimetype": "image/jpeg"
          },
          {
            "@category": "standard",
            "@height": "330",
            "@width": "336",
            "@_fa": "true",
            "$": "https://api.elsevier.com/content/object/eid/1-s2.0-S0926860X14007352-gr12.jpg?httpAccept=%2A%2F%2A",
            "@multimediatype": "JPEG image file",
            "@type": "IMAGE-DOWNSAMPLED",
            "@size": "24735",
            "@ref": "gr12",
            "@mimetype": "image/jpeg"
          },
          {
            "@category": "standard",
            "@height": "368",
            "@width": "346",
            "@_fa": "true",
            "$": "https://api.elsevier.com/content/object/eid/1-s2.0-S0926860X14007352-gr2.jpg?httpAccept=%2A%2F%2A",
            "@multimediatype": "JPEG image file",
            "@type": "IMAGE-DOWNSAMPLED",
            "@size": "31820",
            "@ref": "gr2",
            "@mimetype": "image/jpeg"
          },
          {
            "@category": "standard",
            "@height": "371",
            "@width": "365",
            "@_fa": "true",
            "$": "https://api.elsevier.com/content/object/eid/1-s2.0-S0926860X14007352-gr3.jpg?httpAccept=%2A%2F%2A",
            "@multimediatype": "JPEG image file",
            "@type": "IMAGE-DOWNSAMPLED",
            "@size": "22214",
            "@ref": "gr3",
            "@mimetype": "image/jpeg"
          },
          {
            "@category": "standard",
            "@height": "393",
            "@width": "360",
            "@_fa": "true",
            "$": "https://api.elsevier.com/content/object/eid/1-s2.0-S0926860X14007352-gr4.jpg?httpAccept=%2A%2F%2A",
            "@multimediatype": "JPEG image file",
            "@type": "IMAGE-DOWNSAMPLED",
            "@size": "36507",
            "@ref": "gr4",
            "@mimetype": "image/jpeg"
          },
          {
            "@category": "standard",
            "@height": "570",
            "@width": "753",
            "@_fa": "true",
            "$": "https://api.elsevier.com/content/object/eid/1-s2.0-S0926860X14007352-gr5.jpg?httpAccept=%2A%2F%2A",
            "@multimediatype": "JPEG image file",
            "@type": "IMAGE-DOWNSAMPLED",
            "@size": "167373",
            "@ref": "gr5",
            "@mimetype": "image/jpeg"
          },
          {
            "@category": "standard",
            "@height": "565",
            "@width": "565",
            "@_fa": "true",
            "$": "https://api.elsevier.com/content/object/eid/1-s2.0-S0926860X14007352-gr6.jpg?httpAccept=%2A%2F%2A",
            "@multimediatype": "JPEG image file",
            "@type": "IMAGE-DOWNSAMPLED",
            "@size": "147225",
            "@ref": "gr6",
            "@mimetype": "image/jpeg"
          },
          {
            "@category": "standard",
            "@height": "410",
            "@width": "682",
            "@_fa": "true",
            "$": "https://api.elsevier.com/content/object/eid/1-s2.0-S0926860X14007352-gr7.jpg?httpAccept=%2A%2F%2A",
            "@multimediatype": "JPEG image file",
            "@type": "IMAGE-DOWNSAMPLED",
            "@size": "65687",
            "@ref": "gr7",
            "@mimetype": "image/jpeg"
          },
          {
            "@category": "standard",
            "@height": "369",
            "@width": "365",
            "@_fa": "true",
            "$": "https://api.elsevier.com/content/object/eid/1-s2.0-S0926860X14007352-gr8.jpg?httpAccept=%2A%2F%2A",
            "@multimediatype": "JPEG image file",
            "@type": "IMAGE-DOWNSAMPLED",
            "@size": "32267",
            "@ref": "gr8",
            "@mimetype": "image/jpeg"
          },
          {
            "@category": "standard",
            "@height": "346",
            "@width": "393",
            "@_fa": "true",
            "$": "https://api.elsevier.com/content/object/eid/1-s2.0-S0926860X14007352-gr9.jpg?httpAccept=%2A%2F%2A",
            "@multimediatype": "JPEG image file",
            "@type": "IMAGE-DOWNSAMPLED",
            "@size": "22699",
            "@ref": "gr9",
            "@mimetype": "image/jpeg"
          },
          {
            "@category": "high",
            "@height": "886",
            "@width": "886",
            "@_fa": "true",
            "$": "https://api.elsevier.com/content/object/eid/1-s2.0-S0926860X14007352-fx1_lrg.jpg?httpAccept=%2A%2F%2A",
            "@multimediatype": "JPEG image file",
            "@type": "IMAGE-HIGH-RES",
            "@size": "54778",
            "@ref": "fx1",
            "@mimetype": "image/jpeg"
          },
          {
            "@category": "high",
            "@height": "708",
            "@width": "2206",
            "@_fa": "true",
            "$": "https://api.elsevier.com/content/object/eid/1-s2.0-S0926860X14007352-gr1_lrg.jpg?httpAccept=%2A%2F%2A",
            "@multimediatype": "JPEG image file",
            "@type": "IMAGE-HIGH-RES",
            "@size": "101702",
            "@ref": "gr1",
            "@mimetype": "image/jpeg"
          },
          {
            "@category": "high",
            "@height": "1464",
            "@width": "1478",
            "@_fa": "true",
            "$": "https://api.elsevier.com/content/object/eid/1-s2.0-S0926860X14007352-gr10_lrg.jpg?httpAccept=%2A%2F%2A",
            "@multimediatype": "JPEG image file",
            "@type": "IMAGE-HIGH-RES",
            "@size": "145707",
            "@ref": "gr10",
            "@mimetype": "image/jpeg"
          },
          {
            "@category": "high",
            "@height": "1568",
            "@width": "1566",
            "@_fa": "true",
            "$": "https://api.elsevier.com/content/object/eid/1-s2.0-S0926860X14007352-gr11_lrg.jpg?httpAccept=%2A%2F%2A",
            "@multimediatype": "JPEG image file",
            "@type": "IMAGE-HIGH-RES",
            "@size": "124255",
            "@ref": "gr11",
            "@mimetype": "image/jpeg"
          },
          {
            "@category": "high",
            "@height": "1462",
            "@width": "1489",
            "@_fa": "true",
            "$": "https://api.elsevier.com/content/object/eid/1-s2.0-S0926860X14007352-gr12_lrg.jpg?httpAccept=%2A%2F%2A",
            "@multimediatype": "JPEG image file",
            "@type": "IMAGE-HIGH-RES",
            "@size": "301934",
            "@ref": "gr12",
            "@mimetype": "image/jpeg"
          },
          {
            "@category": "high",
            "@height": "1634",
            "@width": "1535",
            "@_fa": "true",
            "$": "https://api.elsevier.com/content/object/eid/1-s2.0-S0926860X14007352-gr2_lrg.jpg?httpAccept=%2A%2F%2A",
            "@multimediatype": "JPEG image file",
            "@type": "IMAGE-HIGH-RES",
            "@size": "253958",
            "@ref": "gr2",
            "@mimetype": "image/jpeg"
          },
          {
            "@category": "high",
            "@height": "1642",
            "@width": "1616",
            "@_fa": "true",
            "$": "https://api.elsevier.com/content/object/eid/1-s2.0-S0926860X14007352-gr3_lrg.jpg?httpAccept=%2A%2F%2A",
            "@multimediatype": "JPEG image file",
            "@type": "IMAGE-HIGH-RES",
            "@size": "172588",
            "@ref": "gr3",
            "@mimetype": "image/jpeg"
          },
          {
            "@category": "high",
            "@height": "1744",
            "@width": "1596",
            "@_fa": "true",
            "$": "https://api.elsevier.com/content/object/eid/1-s2.0-S0926860X14007352-gr4_lrg.jpg?httpAccept=%2A%2F%2A",
            "@multimediatype": "JPEG image file",
            "@type": "IMAGE-HIGH-RES",
            "@size": "346728",
            "@ref": "gr4",
            "@mimetype": "image/jpeg"
          },
          {
            "@category": "high",
            "@height": "2523",
            "@width": "3333",
            "@_fa": "true",
            "$": "https://api.elsevier.com/content/object/eid/1-s2.0-S0926860X14007352-gr5_lrg.jpg?httpAccept=%2A%2F%2A",
            "@multimediatype": "JPEG image file",
            "@type": "IMAGE-HIGH-RES",
            "@size": "1805552",
            "@ref": "gr5",
            "@mimetype": "image/jpeg"
          },
          {
            "@category": "high",
            "@height": "1499",
            "@width": "1500",
            "@_fa": "true",
            "$": "https://api.elsevier.com/content/object/eid/1-s2.0-S0926860X14007352-gr6_lrg.jpg?httpAccept=%2A%2F%2A",
            "@multimediatype": "JPEG image file",
            "@type": "IMAGE-HIGH-RES",
            "@size": "738827",
            "@ref": "gr6",
            "@mimetype": "image/jpeg"
          },
          {
            "@category": "high",
            "@height": "1816",
            "@width": "3020",
            "@_fa": "true",
            "$": "https://api.elsevier.com/content/object/eid/1-s2.0-S0926860X14007352-gr7_lrg.jpg?httpAccept=%2A%2F%2A",
            "@multimediatype": "JPEG image file",
            "@type": "IMAGE-HIGH-RES",
            "@size": "547483",
            "@ref": "gr7",
            "@mimetype": "image/jpeg"
          },
          {
            "@category": "high",
            "@height": "1638",
            "@width": "1619",
            "@_fa": "true",
            "$": "https://api.elsevier.com/content/object/eid/1-s2.0-S0926860X14007352-gr8_lrg.jpg?httpAccept=%2A%2F%2A",
            "@multimediatype": "JPEG image file",
            "@type": "IMAGE-HIGH-RES",
            "@size": "246151",
            "@ref": "gr8",
            "@mimetype": "image/jpeg"
          },
          {
            "@category": "high",
            "@height": "1534",
            "@width": "1742",
            "@_fa": "true",
            "$": "https://api.elsevier.com/content/object/eid/1-s2.0-S0926860X14007352-gr9_lrg.jpg?httpAccept=%2A%2F%2A",
            "@multimediatype": "JPEG image file",
            "@type": "IMAGE-HIGH-RES",
            "@size": "168849",
            "@ref": "gr9",
            "@mimetype": "image/jpeg"
          },
          {
            "@category": "thumbnail",
            "@height": "26",
            "@width": "349",
            "@_fa": "true",
            "$": "https://api.elsevier.com/content/object/eid/1-s2.0-S0926860X14007352-si1.gif?httpAccept=%2A%2F%2A",
            "@multimediatype": "GIF image file",
            "@type": "ALTIMG",
            "@size": "1454",
            "@ref": "si1",
            "@mimetype": "image/gif"
          },
          {
            "@category": "thumbnail",
            "@height": "24",
            "@width": "319",
            "@_fa": "true",
            "$": "https://api.elsevier.com/content/object/eid/1-s2.0-S0926860X14007352-si2.gif?httpAccept=%2A%2F%2A",
            "@multimediatype": "GIF image file",
            "@type": "ALTIMG",
            "@size": "1376",
            "@ref": "si2",
            "@mimetype": "image/gif"
          },
          {
            "@category": "thumbnail",
            "@height": "23",
            "@width": "373",
            "@_fa": "true",
            "$": "https://api.elsevier.com/content/object/eid/1-s2.0-S0926860X14007352-si3.gif?httpAccept=%2A%2F%2A",
            "@multimediatype": "GIF image file",
            "@type": "ALTIMG",
            "@size": "1240",
            "@ref": "si3",
            "@mimetype": "image/gif"
          }
        ]
      },
      "link": {
        "@rel": "abstract",
        "@href": "https://api.elsevier.com/content/abstract/scopus_id/84919392947"
      }
    }
  }
}