{
  "metadata": {
    "title": "Kaolin supported heteropoly acid catalysts for methacrolein oxidation: Insights into the carrier acidity effect on active components",
    "authors": "; ; ",
    "journal": "Applied Catalysis A: General",
    "date": "2023-01-05",
    "doi": "10.1016/j.apcata.2022.118942",
    "abstract": "",
    "uri": "https://api.elsevier.com/content/article/pii/S0926860X22004653",
    "pii": "S0926860X22004653"
  },
  "fulltext": {
    "full-text-retrieval-response": {
      "scopus-eid": "2-s2.0-85141326578",
      "originalText": "serial JL 271346 291210 291744 291809 31 Applied Catalysis A: General APPLIEDCATALYSISAGENERAL 2022-11-03 2022-11-03 2022-11-07 2022-11-07 2022-12-14T20:52:52 1-s2.0-S0926860X22004653 S0926-860X(22)00465-3 S0926860X22004653 10.1016/j.apcata.2022.118942 S300 S300.1 FULL-TEXT 1-s2.0-S0926860X22X00203 2024-01-01T12:34:28.416125Z 0 0 20230105 2023 2022-11-03T16:34:39.816995Z absattachment articleinfo articlenumber articletitlenorm authfirstinitialnorm authfirstsurnamenorm cid cids contenttype copyright crossmark dateloaded dateloadedtxt datesearch datesort dateupdated dco docsubtype doctype doi eid ewtransactionid hubeid indexeddate issn issnnorm itemstage itemtransactionid itemweight openaccess openarchive pg pgfirst pii piinorm pubdatestart pubdatetxt pubyr sortorder srctitle srctitlenorm srctype ssids alllist content subj subheadings suppl tomb volfirst volissue volumelist webpdf webpdfpagecount yearnav figure table body mmlmath acknowledge affil articletitle auth authfirstini authfull authkeywords authlast grantnumber grantsponsor grantsponsorid highlightsabst primabst ref specialabst 0926-860X 0926860X true 649 649 C Volume 649 2 118942 118942 118942 20230105 5 January 2023 2023-01-05 2023 article fla © 2022 Elsevier B.V. All rights reserved. KAOLINSUPPORTEDHETEROPOLYACIDCATALYSTSFORMETHACROLEINOXIDATIONINSIGHTSCARRIERACIDITYEFFECTACTIVECOMPONENTS ZHU Q 1 Introduction 2 Experimemtal section 2.1 Materials 2.2 Catalysts preparation 2.2.1 Synthesis of CsNH4KPMoV 2.2.2 Synthesis of CsNH4KPMoV/kaolin 2.3 Characterization of catalysts 2.3.1 Experimental analysis of structure 2.3.2 Molecular simulation 2.3.3 Catalytic reaction experiment 3 Results and discussion 3.1 Characterization of catalysts 3.2 DFT simulation and the interfacial interactions 3.3 Catalytic performance of the catalysts 3.3.1 Influence of the amount of CsNH4KPMoV active components 3.3.2 Influence of the temperature 3.3.3 Performance comparison of 50 wt% supported catalyst and physical mixture 3.3.4 The catalytic stability of 50CsNH 4 KPMoV/kaolin 3.4 General discussion 4 Conclusion CRediT authorship contribution statement Acknowledgments References ILLIES 2016 8509 8518 S FILIMONOV 2009 70 75 I WANG 2021 394 B CAO 2018 254 263 Y KANNO 2011 59 62 M DARABIMAHBOUB 2018 7703 7738 M SENNERICH 2020 106016 M ZHOU 2019 44 49 L CHUB 2022 O JING 2014 121 135 F LIU 2016 85 92 S ZHANG 2020 60 67 H YASUDA 2019 43 47 S HU 2020 1759832 S KIM 2006 21 25 H MICEKILNICKA 2009 1 14 A LI 2006 58 66 X MOLINARI 2011 1536 1548 J DESAI 2022 D KIM 2007 159 165 H MAROSI 2003 235 240 L CAO 2018 1657 1667 Y CAO 2017 653 664 Y ZHENG 2015 139 146 Y SANTOS 2011 138 148 J M 1996 981 990 D ZHOU 2017 47 54 L KANNO 2010 1 8 M LEGAGNEUX 2009 2235 2240 N GUO 2008 675 680 X GUO 2022 L BOAHENE 2022 P ZHOU 2017 153 161 L MAROSI 2000 140 145 L MA 2018 660 670 X SCHNEE 2019 116 121 J ZHOU 2019 34065 34075 L BENADJI 2010 103 114 S MICEKILNICKA 2012 91 98 A ALFAZE 2020 117549 R YUAN 2020 1 8 D MAGAR 2020 1157 1165 S BALLARINI 2007 263 269 N TESSONNIER 2013 393 402 J NEWMAN 2006 2893 2902 A DEUSSER 1998 3230 3236 L LIU 2018 239 245 W QIU 2014 5397 5405 X PLATOVA 2013 R LI 2018 76 87 C HASAN 2018 72 82 A HU 2003 1279 1284 Y LI 2018 126 138 C WANG 2017 378 385 Z ZHANG 2007 159 166 F CHEN 2020 J WANG 2016 333 339 X PERDEW 1996 3865 3868 J YASUJIINADA 2008 225 232 H HOHENBERG 1964 864 871 P TANDEKAR 2022 5521 5531 K LI 2014 72 79 X SHU 2014 33 40 Z ZHOU 2015 431 440 L LARONZE 2003 172 181 N LIU 2021 C ZHANG 2013 4484 4490 H LEE 2000 2977 2983 J GAO 2004 27 35 X SERRANOLOTINA 2012 12342 12350 A ISHIKAWA 2022 7693 7708 S HE 2007 284 292 H ZHUX2023X118942 ZHUX2023X118942XQ 2024-11-07T00:00:00.000Z 2024-11-07T00:00:00.000Z http://creativecommons.org/licenses/by-nc-nd/4.0/ © 2022 Elsevier B.V. All rights reserved. 2022-11-11T00:03:34.602Z http://vtw.elsevier.com/data/voc/AddOnTypes/50.7/aggregated-refined 0 https://doi.org/10.15223/policy-017 https://doi.org/10.15223/policy-037 https://doi.org/10.15223/policy-012 https://doi.org/10.15223/policy-029 https://doi.org/10.15223/policy-004 item S0926-860X(22)00465-3 S0926860X22004653 1-s2.0-S0926860X22004653 10.1016/j.apcata.2022.118942 271346 2024-01-01T12:34:28.416125Z 2023-01-05 1-s2.0-S0926860X22004653-main.pdf https://s3-eu-west-1.amazonaws.com/prod-ucs-content-store-eu-west/content/pii:S0926860X22004653/MAIN/application/pdf/efb519e5d8b00ef140958a44e411501c/main.pdf main.pdf pdf true 5581210 MAIN 11 1-s2.0-S0926860X22004653-main_1.png https://s3-eu-west-1.amazonaws.com/prod-ucs-content-store-eu-west/content/pii:S0926860X22004653/PREVIEW/image/png/4c35bf251a85df1d32718fdff7057482/main_1.png main_1.png png 59416 849 656 IMAGE-WEB-PDF 1 1-s2.0-S0926860X22004653-gr8.jpg https://s3-eu-west-1.amazonaws.com/prod-ucs-content-store-eu-west/content/pii:S0926860X22004653/gr8/DOWNSAMPLED/image/jpeg/6b09cf7b22203d020d101c964e2c4eca/gr8.jpg gr8 gr8.jpg jpg 17924 258 339 IMAGE-DOWNSAMPLED 1-s2.0-S0926860X22004653-gr7.jpg https://s3-eu-west-1.amazonaws.com/prod-ucs-content-store-eu-west/content/pii:S0926860X22004653/gr7/DOWNSAMPLED/image/jpeg/f781af3a0290f565f6dbe67306f8b477/gr7.jpg gr7 gr7.jpg jpg 44668 232 565 IMAGE-DOWNSAMPLED 1-s2.0-S0926860X22004653-gr9.jpg https://s3-eu-west-1.amazonaws.com/prod-ucs-content-store-eu-west/content/pii:S0926860X22004653/gr9/DOWNSAMPLED/image/jpeg/98d416f89df13ff9f8d6d585f4a4947b/gr9.jpg gr9 gr9.jpg jpg 63246 506 658 IMAGE-DOWNSAMPLED 1-s2.0-S0926860X22004653-gr2.jpg https://s3-eu-west-1.amazonaws.com/prod-ucs-content-store-eu-west/content/pii:S0926860X22004653/gr2/DOWNSAMPLED/image/jpeg/d7ffec53dc1b8a2a70dc5c6edcab8184/gr2.jpg gr2 gr2.jpg jpg 28142 258 339 IMAGE-DOWNSAMPLED 1-s2.0-S0926860X22004653-gr1.jpg https://s3-eu-west-1.amazonaws.com/prod-ucs-content-store-eu-west/content/pii:S0926860X22004653/gr1/DOWNSAMPLED/image/jpeg/9aeae2a1e916ffbd61e12216c677f052/gr1.jpg gr1 gr1.jpg jpg 17523 265 376 IMAGE-DOWNSAMPLED 1-s2.0-S0926860X22004653-gr4.jpg https://s3-eu-west-1.amazonaws.com/prod-ucs-content-store-eu-west/content/pii:S0926860X22004653/gr4/DOWNSAMPLED/image/jpeg/4fff951923df0a2fc5477e497edc93e4/gr4.jpg gr4 gr4.jpg jpg 30504 219 678 IMAGE-DOWNSAMPLED 1-s2.0-S0926860X22004653-gr3.jpg https://s3-eu-west-1.amazonaws.com/prod-ucs-content-store-eu-west/content/pii:S0926860X22004653/gr3/DOWNSAMPLED/image/jpeg/81aa8ca966329c7121ed2170bba0eae2/gr3.jpg gr3 gr3.jpg jpg 35210 254 527 IMAGE-DOWNSAMPLED 1-s2.0-S0926860X22004653-gr6.jpg https://s3-eu-west-1.amazonaws.com/prod-ucs-content-store-eu-west/content/pii:S0926860X22004653/gr6/DOWNSAMPLED/image/jpeg/94af267e6325cbb00a6ec32f83e5c844/gr6.jpg gr6 gr6.jpg jpg 19800 260 339 IMAGE-DOWNSAMPLED 1-s2.0-S0926860X22004653-gr11.jpg https://s3-eu-west-1.amazonaws.com/prod-ucs-content-store-eu-west/content/pii:S0926860X22004653/gr11/DOWNSAMPLED/image/jpeg/b003d2dc552988a18d5389fd899f582f/gr11.jpg gr11 gr11.jpg jpg 14358 260 339 IMAGE-DOWNSAMPLED 1-s2.0-S0926860X22004653-gr5.jpg https://s3-eu-west-1.amazonaws.com/prod-ucs-content-store-eu-west/content/pii:S0926860X22004653/gr5/DOWNSAMPLED/image/jpeg/319625bc5a2dff56a34b0d1ded4c360d/gr5.jpg gr5 gr5.jpg jpg 27407 257 339 IMAGE-DOWNSAMPLED 1-s2.0-S0926860X22004653-gr10.jpg https://s3-eu-west-1.amazonaws.com/prod-ucs-content-store-eu-west/content/pii:S0926860X22004653/gr10/DOWNSAMPLED/image/jpeg/a9f1356a481da9d7900015e0ac8e66b9/gr10.jpg gr10 gr10.jpg jpg 28558 244 658 IMAGE-DOWNSAMPLED 1-s2.0-S0926860X22004653-gr13.jpg https://s3-eu-west-1.amazonaws.com/prod-ucs-content-store-eu-west/content/pii:S0926860X22004653/gr13/DOWNSAMPLED/image/jpeg/f5818f2a5dd849aff49f8d624d150d5c/gr13.jpg gr13 gr13.jpg jpg 14471 260 339 IMAGE-DOWNSAMPLED 1-s2.0-S0926860X22004653-gr12.jpg https://s3-eu-west-1.amazonaws.com/prod-ucs-content-store-eu-west/content/pii:S0926860X22004653/gr12/DOWNSAMPLED/image/jpeg/4d1e23d506e1f6cec0a1ad89de69f8eb/gr12.jpg gr12 gr12.jpg jpg 14306 259 339 IMAGE-DOWNSAMPLED 1-s2.0-S0926860X22004653-gr15.jpg https://s3-eu-west-1.amazonaws.com/prod-ucs-content-store-eu-west/content/pii:S0926860X22004653/gr15/DOWNSAMPLED/image/jpeg/98c826dd1ff365023090702bb2972f65/gr15.jpg gr15 gr15.jpg jpg 12269 260 339 IMAGE-DOWNSAMPLED 1-s2.0-S0926860X22004653-gr14.jpg https://s3-eu-west-1.amazonaws.com/prod-ucs-content-store-eu-west/content/pii:S0926860X22004653/gr14/DOWNSAMPLED/image/jpeg/0da7f7eb286012b1545b3104121022fa/gr14.jpg gr14 gr14.jpg jpg 20714 257 339 IMAGE-DOWNSAMPLED 1-s2.0-S0926860X22004653-gr17.jpg https://s3-eu-west-1.amazonaws.com/prod-ucs-content-store-eu-west/content/pii:S0926860X22004653/gr17/DOWNSAMPLED/image/jpeg/aeb2a127b002d2b34953536c7c3ea0e5/gr17.jpg gr17 gr17.jpg jpg 15762 255 339 IMAGE-DOWNSAMPLED 1-s2.0-S0926860X22004653-sc1.jpg https://s3-eu-west-1.amazonaws.com/prod-ucs-content-store-eu-west/content/pii:S0926860X22004653/sc1/DOWNSAMPLED/image/jpeg/f37756180626e9954425ee2d40c2228f/sc1.jpg sc1 sc1.jpg jpg 3372 70 226 IMAGE-DOWNSAMPLED 1-s2.0-S0926860X22004653-gr16.jpg https://s3-eu-west-1.amazonaws.com/prod-ucs-content-store-eu-west/content/pii:S0926860X22004653/gr16/DOWNSAMPLED/image/jpeg/f8ebb433a8ac103692fe956823686949/gr16.jpg gr16 gr16.jpg jpg 31507 249 658 IMAGE-DOWNSAMPLED 1-s2.0-S0926860X22004653-sc2.jpg https://s3-eu-west-1.amazonaws.com/prod-ucs-content-store-eu-west/content/pii:S0926860X22004653/sc2/DOWNSAMPLED/image/jpeg/f40992c25871827bcfc825059f39f7bb/sc2.jpg sc2 sc2.jpg jpg 51354 260 678 IMAGE-DOWNSAMPLED 1-s2.0-S0926860X22004653-ga1.jpg https://s3-eu-west-1.amazonaws.com/prod-ucs-content-store-eu-west/content/pii:S0926860X22004653/ga1/DOWNSAMPLED/image/jpeg/074fdfeee5964bdecd7cab45e107473a/ga1.jpg ga1 true ga1.jpg jpg 33145 200 435 IMAGE-DOWNSAMPLED 1-s2.0-S0926860X22004653-gr8.sml https://s3-eu-west-1.amazonaws.com/prod-ucs-content-store-eu-west/content/pii:S0926860X22004653/gr8/THUMBNAIL/image/gif/fcab1fae76a722eba9368364f69218da/gr8.sml gr8 gr8.sml sml 7546 164 215 IMAGE-THUMBNAIL 1-s2.0-S0926860X22004653-gr7.sml https://s3-eu-west-1.amazonaws.com/prod-ucs-content-store-eu-west/content/pii:S0926860X22004653/gr7/THUMBNAIL/image/gif/5b75a13c22f17df37bdde35e9771e24d/gr7.sml gr7 gr7.sml sml 8655 90 219 IMAGE-THUMBNAIL 1-s2.0-S0926860X22004653-gr9.sml https://s3-eu-west-1.amazonaws.com/prod-ucs-content-store-eu-west/content/pii:S0926860X22004653/gr9/THUMBNAIL/image/gif/127cfb00524ba34bd055158a734bd4d9/gr9.sml gr9 gr9.sml sml 8475 164 213 IMAGE-THUMBNAIL 1-s2.0-S0926860X22004653-gr2.sml https://s3-eu-west-1.amazonaws.com/prod-ucs-content-store-eu-west/content/pii:S0926860X22004653/gr2/THUMBNAIL/image/gif/706d6e083ccf46df390fb7fa87eccf67/gr2.sml gr2 gr2.sml sml 12979 164 216 IMAGE-THUMBNAIL 1-s2.0-S0926860X22004653-gr1.sml https://s3-eu-west-1.amazonaws.com/prod-ucs-content-store-eu-west/content/pii:S0926860X22004653/gr1/THUMBNAIL/image/gif/1a82e1cbcfa7f79c0f491c00860f671e/gr1.sml gr1 gr1.sml sml 5712 154 219 IMAGE-THUMBNAIL 1-s2.0-S0926860X22004653-gr4.sml https://s3-eu-west-1.amazonaws.com/prod-ucs-content-store-eu-west/content/pii:S0926860X22004653/gr4/THUMBNAIL/image/gif/d55c219fd1bd74a05e817ac5957f34e2/gr4.sml gr4 gr4.sml sml 3160 71 219 IMAGE-THUMBNAIL 1-s2.0-S0926860X22004653-gr3.sml https://s3-eu-west-1.amazonaws.com/prod-ucs-content-store-eu-west/content/pii:S0926860X22004653/gr3/THUMBNAIL/image/gif/2d51ed5e5ddf4aef590efc4fb475838b/gr3.sml gr3 gr3.sml sml 6765 106 219 IMAGE-THUMBNAIL 1-s2.0-S0926860X22004653-gr6.sml https://s3-eu-west-1.amazonaws.com/prod-ucs-content-store-eu-west/content/pii:S0926860X22004653/gr6/THUMBNAIL/image/gif/ba327c2ca9b607fc60d66d5d5a56e88a/gr6.sml gr6 gr6.sml sml 7432 164 213 IMAGE-THUMBNAIL 1-s2.0-S0926860X22004653-gr11.sml https://s3-eu-west-1.amazonaws.com/prod-ucs-content-store-eu-west/content/pii:S0926860X22004653/gr11/THUMBNAIL/image/gif/cd941a39ea8af0004fd32aa82374709a/gr11.sml gr11 gr11.sml sml 5199 163 213 IMAGE-THUMBNAIL 1-s2.0-S0926860X22004653-gr5.sml https://s3-eu-west-1.amazonaws.com/prod-ucs-content-store-eu-west/content/pii:S0926860X22004653/gr5/THUMBNAIL/image/gif/8e000ca1d56ebc17da1c9f8e2de93af6/gr5.sml gr5 gr5.sml sml 10338 164 216 IMAGE-THUMBNAIL 1-s2.0-S0926860X22004653-gr10.sml https://s3-eu-west-1.amazonaws.com/prod-ucs-content-store-eu-west/content/pii:S0926860X22004653/gr10/THUMBNAIL/image/gif/1f2a3bdb824fb3f78307f9438d3c1bb3/gr10.sml gr10 gr10.sml sml 4383 81 219 IMAGE-THUMBNAIL 1-s2.0-S0926860X22004653-gr13.sml https://s3-eu-west-1.amazonaws.com/prod-ucs-content-store-eu-west/content/pii:S0926860X22004653/gr13/THUMBNAIL/image/gif/5ead9f429510bb16a2b52fcc7bb8c07d/gr13.sml gr13 gr13.sml sml 5269 164 214 IMAGE-THUMBNAIL 1-s2.0-S0926860X22004653-gr12.sml https://s3-eu-west-1.amazonaws.com/prod-ucs-content-store-eu-west/content/pii:S0926860X22004653/gr12/THUMBNAIL/image/gif/54b6dcd0f2de20e9cb5eab63276cf013/gr12.sml gr12 gr12.sml sml 5211 164 215 IMAGE-THUMBNAIL 1-s2.0-S0926860X22004653-gr15.sml https://s3-eu-west-1.amazonaws.com/prod-ucs-content-store-eu-west/content/pii:S0926860X22004653/gr15/THUMBNAIL/image/gif/8d564b450482b5c38d97cc642dafb0c4/gr15.sml gr15 gr15.sml sml 4742 164 214 IMAGE-THUMBNAIL 1-s2.0-S0926860X22004653-gr14.sml https://s3-eu-west-1.amazonaws.com/prod-ucs-content-store-eu-west/content/pii:S0926860X22004653/gr14/THUMBNAIL/image/gif/340e14a215c988f89d5241bdc0cda1d6/gr14.sml gr14 gr14.sml sml 7539 164 217 IMAGE-THUMBNAIL 1-s2.0-S0926860X22004653-gr17.sml https://s3-eu-west-1.amazonaws.com/prod-ucs-content-store-eu-west/content/pii:S0926860X22004653/gr17/THUMBNAIL/image/gif/a7c7f73cfb911446b99323847cd9947f/gr17.sml gr17 gr17.sml sml 6409 164 218 IMAGE-THUMBNAIL 1-s2.0-S0926860X22004653-sc1.sml https://s3-eu-west-1.amazonaws.com/prod-ucs-content-store-eu-west/content/pii:S0926860X22004653/sc1/THUMBNAIL/image/gif/051a14e0bcb59c7fd0477f44033a7ed6/sc1.sml sc1 sc1.sml sml 2757 68 219 IMAGE-THUMBNAIL 1-s2.0-S0926860X22004653-gr16.sml https://s3-eu-west-1.amazonaws.com/prod-ucs-content-store-eu-west/content/pii:S0926860X22004653/gr16/THUMBNAIL/image/gif/533ef0db8456e0c34cdaaf305e6527c8/gr16.sml gr16 gr16.sml sml 4645 83 219 IMAGE-THUMBNAIL 1-s2.0-S0926860X22004653-sc2.sml https://s3-eu-west-1.amazonaws.com/prod-ucs-content-store-eu-west/content/pii:S0926860X22004653/sc2/THUMBNAIL/image/gif/e5dd577b0662701c14398feb474effda/sc2.sml sc2 sc2.sml sml 8125 84 219 IMAGE-THUMBNAIL 1-s2.0-S0926860X22004653-ga1.sml https://s3-eu-west-1.amazonaws.com/prod-ucs-content-store-eu-west/content/pii:S0926860X22004653/ga1/THUMBNAIL/image/gif/ec147201de6c1864a76ce6c441bf9a8d/ga1.sml ga1 true ga1.sml sml 11023 101 219 IMAGE-THUMBNAIL 1-s2.0-S0926860X22004653-gr8_lrg.jpg https://s3-eu-west-1.amazonaws.com/prod-ucs-content-store-eu-west/content/pii:S0926860X22004653/HIGHRES/image/jpeg/14d5acbcfafd9b32bb3f34efb7f1ff48/gr8_lrg.jpg gr8 gr8_lrg.jpg jpg 118244 1139 1497 IMAGE-HIGH-RES 1-s2.0-S0926860X22004653-gr7_lrg.jpg https://s3-eu-west-1.amazonaws.com/prod-ucs-content-store-eu-west/content/pii:S0926860X22004653/HIGHRES/image/jpeg/497dc3bd5db0e008fcac7bbbae950250/gr7_lrg.jpg gr7 gr7_lrg.jpg jpg 231018 1023 2495 IMAGE-HIGH-RES 1-s2.0-S0926860X22004653-gr9_lrg.jpg https://s3-eu-west-1.amazonaws.com/prod-ucs-content-store-eu-west/content/pii:S0926860X22004653/HIGHRES/image/jpeg/481b7591742ad58dbc09953aad6eefb0/gr9_lrg.jpg gr9 gr9_lrg.jpg jpg 428665 2238 2910 IMAGE-HIGH-RES 1-s2.0-S0926860X22004653-gr2_lrg.jpg https://s3-eu-west-1.amazonaws.com/prod-ucs-content-store-eu-west/content/pii:S0926860X22004653/HIGHRES/image/jpeg/a8d581bdb54435ddfe6f0ad4e8cc9915/gr2_lrg.jpg gr2 gr2_lrg.jpg jpg 149956 1138 1497 IMAGE-HIGH-RES 1-s2.0-S0926860X22004653-gr1_lrg.jpg https://s3-eu-west-1.amazonaws.com/prod-ucs-content-store-eu-west/content/pii:S0926860X22004653/HIGHRES/image/jpeg/d60b1310a3fd23b74828c6df10a2b552/gr1_lrg.jpg gr1 gr1_lrg.jpg jpg 86739 1171 1663 IMAGE-HIGH-RES 1-s2.0-S0926860X22004653-gr4_lrg.jpg https://s3-eu-west-1.amazonaws.com/prod-ucs-content-store-eu-west/content/pii:S0926860X22004653/HIGHRES/image/jpeg/5b50b636ec0f8ea1234bb6efcebcb06f/gr4_lrg.jpg gr4 gr4_lrg.jpg jpg 187709 969 2994 IMAGE-HIGH-RES 1-s2.0-S0926860X22004653-gr3_lrg.jpg https://s3-eu-west-1.amazonaws.com/prod-ucs-content-store-eu-west/content/pii:S0926860X22004653/HIGHRES/image/jpeg/4ef646aa18c410e33744756d214801f8/gr3_lrg.jpg gr3 gr3_lrg.jpg jpg 247948 1123 2328 IMAGE-HIGH-RES 1-s2.0-S0926860X22004653-gr6_lrg.jpg https://s3-eu-west-1.amazonaws.com/prod-ucs-content-store-eu-west/content/pii:S0926860X22004653/HIGHRES/image/jpeg/bb958444a3ba12da3b443a092ad92022/gr6_lrg.jpg gr6 gr6_lrg.jpg jpg 127150 1150 1497 IMAGE-HIGH-RES 1-s2.0-S0926860X22004653-gr11_lrg.jpg https://s3-eu-west-1.amazonaws.com/prod-ucs-content-store-eu-west/content/pii:S0926860X22004653/HIGHRES/image/jpeg/6c7715a0ccaeaa9e9c667f990976aa51/gr11_lrg.jpg gr11 gr11_lrg.jpg jpg 92597 1149 1497 IMAGE-HIGH-RES 1-s2.0-S0926860X22004653-gr5_lrg.jpg https://s3-eu-west-1.amazonaws.com/prod-ucs-content-store-eu-west/content/pii:S0926860X22004653/HIGHRES/image/jpeg/53463bc4aae20307fd41bd090c4a7ffc/gr5_lrg.jpg gr5 gr5_lrg.jpg jpg 193197 1135 1497 IMAGE-HIGH-RES 1-s2.0-S0926860X22004653-gr10_lrg.jpg https://s3-eu-west-1.amazonaws.com/prod-ucs-content-store-eu-west/content/pii:S0926860X22004653/HIGHRES/image/jpeg/aeeaae87e078c148c2d7ad205eb256bb/gr10_lrg.jpg gr10 gr10_lrg.jpg jpg 198037 1078 2910 IMAGE-HIGH-RES 1-s2.0-S0926860X22004653-gr13_lrg.jpg https://s3-eu-west-1.amazonaws.com/prod-ucs-content-store-eu-west/content/pii:S0926860X22004653/HIGHRES/image/jpeg/50cde054a26cd6dceee0367875af0a33/gr13_lrg.jpg gr13 gr13_lrg.jpg jpg 90234 1146 1497 IMAGE-HIGH-RES 1-s2.0-S0926860X22004653-gr12_lrg.jpg https://s3-eu-west-1.amazonaws.com/prod-ucs-content-store-eu-west/content/pii:S0926860X22004653/HIGHRES/image/jpeg/410a1a88b5c0e132f5abbad6d56f60ba/gr12_lrg.jpg gr12 gr12_lrg.jpg jpg 90874 1142 1497 IMAGE-HIGH-RES 1-s2.0-S0926860X22004653-gr15_lrg.jpg https://s3-eu-west-1.amazonaws.com/prod-ucs-content-store-eu-west/content/pii:S0926860X22004653/HIGHRES/image/jpeg/463eb09686f3d74dcbbb9255cb13f51b/gr15_lrg.jpg gr15 gr15_lrg.jpg jpg 73386 1147 1497 IMAGE-HIGH-RES 1-s2.0-S0926860X22004653-gr14_lrg.jpg https://s3-eu-west-1.amazonaws.com/prod-ucs-content-store-eu-west/content/pii:S0926860X22004653/HIGHRES/image/jpeg/cc75edcf32273a13f7ca41b126147e9e/gr14_lrg.jpg gr14 gr14_lrg.jpg jpg 137811 1133 1497 IMAGE-HIGH-RES 1-s2.0-S0926860X22004653-gr17_lrg.jpg https://s3-eu-west-1.amazonaws.com/prod-ucs-content-store-eu-west/content/pii:S0926860X22004653/HIGHRES/image/jpeg/fd0340f1d52721a33de7b063228f6168/gr17_lrg.jpg gr17 gr17_lrg.jpg jpg 102203 1128 1498 IMAGE-HIGH-RES 1-s2.0-S0926860X22004653-sc1_lrg.jpg https://s3-eu-west-1.amazonaws.com/prod-ucs-content-store-eu-west/content/pii:S0926860X22004653/HIGHRES/image/jpeg/f2931f68b8059f572ed7c114c2d2bc72/sc1_lrg.jpg sc1 sc1_lrg.jpg jpg 15034 308 998 IMAGE-HIGH-RES 1-s2.0-S0926860X22004653-gr16_lrg.jpg https://s3-eu-west-1.amazonaws.com/prod-ucs-content-store-eu-west/content/pii:S0926860X22004653/HIGHRES/image/jpeg/cdae74e2aea8e368e811257f8fe81023/gr16_lrg.jpg gr16 gr16_lrg.jpg jpg 211898 1099 2910 IMAGE-HIGH-RES 1-s2.0-S0926860X22004653-sc2_lrg.jpg https://s3-eu-west-1.amazonaws.com/prod-ucs-content-store-eu-west/content/pii:S0926860X22004653/HIGHRES/image/jpeg/630c755ebc2b967327161f5d1329f8bd/sc2_lrg.jpg sc2 sc2_lrg.jpg jpg 281158 1147 2994 IMAGE-HIGH-RES 1-s2.0-S0926860X22004653-ga1_lrg.jpg https://s3-eu-west-1.amazonaws.com/prod-ucs-content-store-eu-west/content/pii:S0926860X22004653/HIGHRES/image/jpeg/4b2940c3a2ff30a1951d0d43d2b54d29/ga1_lrg.jpg ga1 true ga1_lrg.jpg jpg 249150 886 1928 IMAGE-HIGH-RES 1-s2.0-S0926860X22004653-am.pdf https://s3-eu-west-1.amazonaws.com/prod-ucs-content-store-eu-west/content/egi:102G3HH5SBR/MAIN/application/pdf/211cdd9b0e40d7f0b02c6f26186680ef/am.pdf am am.pdf pdf false 1045911 AAM-PDF APCATA 118942 118942 S0926-860X(22)00465-3 10.1016/j.apcata.2022.118942 Elsevier B.V. Fig. 1 Catalyst performance evaluation device. Fig. 1 Fig. 2 FT-IR spectra of kaolin, CsNH4KPMoV, and xCsNH4KPMoV/kaolin. Fig. 2 Fig. 3 (A) XRD patterns of the kaolin, CsNH4KPMoV and xCsNH4KPMoV/kaolin before the reaction. (B) The signal amplification of the samples in Fig. 3(A). Fig. 3 Fig. 4 TG/DTA curves of kaolin, CsNH4KPMoV and 50CsNH4KPMoV/kaolin. Fig. 4 Fig. 5 N2 adsorption-desorption isotherms of kaolin, CsNH4KPMoV and xCsNH4KPMoV/kaolin. The data in parentheses refer to the origin coordinates of the isotherm. Fig. 5 Fig. 6 NH3-TPD profiles for kaolin, CsNH4KPMoV and xCsNH4KPMoV/kaolin. (a): CsNH4KPMoV, (b): 50CsNH4KPMoV/kaolin, (c): 33CsNH4KPMoV/kaolin, (d): kaolin. Fig. 6 Fig. 7 The adsorption configuration of HPVA/kaolin. Fig. 7 Fig. 8 PDOS analysis of O atom connected to Mo in HPVA and H atom in kaolin for the HPVA/kaolin configuration. The vertical dashed line in black denotes the Fermi level. Fig. 8 Fig. 9 XPS spectra of V 2p3/2 and Mo 3d of CsNH4KPMoV and 50CsNH4KPMoV/kaolin. Fig. 9 Fig. 10 N 1 s spectra of CsNH4KPMoV and 50CsNH4KPMoV/kaolin. Fig. 10 Fig. 11 MAL conversion and selectivity to MAA of 20CsNH4KPMoV/kaolin, 33CsNH4KPMoV/kaolin, 50CsNH4KPMoV/kaolin, 67CsNH4KPMoV/kaolin, and CsNH4KPMoV at 315 °C. Fig. 11 Fig. 12 MAL conversion and selectivity to MAA of 50CsNH4KPMoV/kaolin at different reaction temperature. Fig. 12 Fig. 13 The stability test of 50CsNH4KPMoV/kaolin. Fig. 13 Fig. 14 XRD patterns of xCsNH4KPMoV/kaolin catalysts used at 315 °C. Fig. 14 Fig. 15 NH3-TPD profiles for used 50CsNH4KPMoV/kaolin. Fig. 15 Fig. 16 V 2p and N 1 s spectra of 50CsNH4KPMoV/kaolin after reaction at 315 °C. Fig. 16 Fig. 17 TPO-MS spectrum for used 50CsNH4KPMoV/kaolin catalyst. Fig. 17 Scheme 1 Gas-phase catalytic oxidation of methacrolein [5]. Scheme 1 Scheme 2 Illustration of the synthetic scheme of CsNH4KPMoV/kaolin. Scheme 2 Table 1 The compositions of the kaolin. Table 1 Chemical composition SiO2 Al2O3 TiO2 Fe2O3 H2O Weight percentages (wt%) 52.5 45.0 1.5 0.5 0.5 Table 2 Textural properties of the kaolin, CsNH4KPMoV, and xCsNH4KPMoV/kaolin catalysts. Table 2 Supports and catalysts BET surfacearea/m2 g−1 Porevolume/cm3 g−1 Average porediameter/nm kaolin 15.3 0.024 18.1 CsNH4KPMoV 4.6 0.019 26.8 33CsNH4KPMoV/kaolin 11.7 0.023 19.5 50CsNH4KPMoV/kaolin 9.9 0.021 23.4 67CsNH4KPMoV/kaolin 7.3 0.020 24.3 Table 3 Different adsorption configurations of HPVA on kaolin. Table 3 Configuration Adsorptionsites D ads,min (Å) E ads (eV) A O(Mo) 1.01 -6.15 B O(Mo/V)&H(O) 1.00 -5.13 C O(Mo/V) 1.01 -5.17 Note: D ads,min represents the minimum adsorption distance (O and H atoms), E ads represents the adsorption energies of HPVA on kaolin. Table 4 Surface analysis of the catalysts before and after supported. Table 4 Catalyst Binding energy (eV) Molar ratio(V5+/V4+) Mo 3d5/2 V 2p3/2 (V5+/V4+) CsNH4KPMoV 333.2 517.9/517 66/34 50CsNH4KPMoV/kaolin 233.3 517.9/517 55/45 Table 5 Catalytic performance of 50CsNH4KPMoV/kaolin and 50 wt%kaolin+ 50 wt%CsNH4KPMoV at 315 °C. Table 5 Catalyst MAL Conversion (%) Selectivity to MAA (%) 50CsNH4KPMoV/kaolin 81.8 88.2 50 wt%kaolin+ 50 wt%CsNH4KPMoV 48.2 56.3 Table 6 Catalytic performance comparison for different catalysts. Table 6 Catalyst Temperature(°C) MAL Conversion (%) Selectivity to MAA (%) Reference PMo10V2/N-MC 350 81 79 [20] PMo10V2/SBA-15 350 74 40 [20] HPMV/C3N4-SBA-15 290 20 98.9 [37] HPA/SiO2 300 14 72 [5] HPA[acetone]/NH3-SiO2 300 9 89 [5] HPA/3DOM(5%Cu)-SiO2 315 63 82 [35] 50CsNH4KPMoV/kaolin 315 81.8 88.2 This work Kaolin supported heteropoly acid catalysts for methacrolein oxidation: Insights into the carrier acidity effect on active components Qianwen Zhu Writing – review & editing Writing – review & editing, Investigation, Data processing, Writing – review & editing Jing Zhu Investigation, Data curation Yang Li Investigation, Writing – review & editing Zhaobang Zhang Data processing, Validation Baohe Wang Validation, Writing – review & editing, Funding acquisition ⁎ Jing Ma Validation, Writing – review & editing ⁎ Key Laboratory for Green Chemical Technology of Ministry of Education, R&D Center for Petrochemical Technology, Tianjin University, Tianjin 300072, China Key Laboratory for Green Chemical Technology of Ministry of Education, R&D Center for Petrochemical Technology, Tianjin University Tianjin 300072 China Key Laboratory for Green Chemical Technology of Ministry of Education, R&D Center for Petrochemical Technology, Tianjin University, Tianjin 300072, China ⁎ Corresponding authors. The application of heteropoly acid catalyst in methacrolein (MAL) oxidation reaction is limited for its poor thermal stability and few active centers. Here, the supported catalyst of P-Mo-V heteropoly acid (CsNH4KPMoV) active components supported on kaolin were prepared, and were characterized by FT-IR, TG/DTA, XRD, N2-adsorption and desorption, NH3-TPD, TPO-MS and XPS. The results show that kaolin was weak acidity and the negative charge on the surface of kaolin promoted the reduction of V5+ species to V4+(VO2+) active species. There was a strong electron interaction between kaolin and HPVA, and chemical adsorption occurred by DFT calculations. Under optimal conditions, higher MAL conversion (81.8%) and Methacrylic acid (MAA) selectivity (88.2%) were obtained by 50CsNH4KPMoV/kaolin catalyst. The Keggin structure was maintained and the acid strength and acidity did not decrease after the catalyst was used continuously for 100 h. There was no carbon deposition in the reaction process. Graphical Abstract ga1 Keywords Keggin heteropoly acid Kaolin Supported catalyst Methacrolein Methacrylic acid Data Availability Data will be made available on request. 1 Introduction Methacrylic acid (MAA) is an important chemical intermediate, which can be used to synthesize methyl methacrylate (MMA) [1–4] and further synthesize poly-methyl-methacrylate (PMMA), synthetic rubber, functional plastics [5–9], etc. The traditional synthesis method of synthesizing MAA is acetone-cyanohydrin (ACH) method. However, the process uses toxic hydrocyanic acid and corrosive H2SO4, which does not meet the requirements of green chemistry [10,11]. The oxidation of methacrolein (MAL) to MAA by Keggin-type heteropoly acid (HPAs) catalysts has the advantages of high atomic utilization and low pollution [7,12,13], and the gas-phase oxidation reaction equation is shown in Scheme 1 [5]. HPAs, as a kind of important acidic and redox catalysts especially those with Keggin structure, have attracted more and more research interest in recent years [10,14–19]. HPAs have been widely used as oxidation catalysts in various homogeneous and heterogeneous reactions, in which Keggin-type HPAs catalysts containing P, Mo and V are often used for the oxidation of MAL [10,20,21]. At present, many methods have been taken to improve the catalytic performance of Keggin-type HPAs. The main methods include replacing some Mo atoms with V atoms, or replacing some protons with alkali metal ions and transition metal ions [11,20,22–27], etc. In our previous work, the effect of K+ counterions on the catalytic performance of P-Mo-V HPAs was studied [3]. However, it is well known that the specific surface area of HPAs is low, generally 3–5 m2·g−1, and the thermal stability of HPAs is poor [28–32]. In addition, HPAs also has the problems of few active centers and easy decomposition of active components [33,34]. In recent years, researchers usually dispersed HPAs on SiO2, Al2O3, SBA-15, TiO2, MCM-41, HMS and other supports with high surface areas to prepare highly active catalysts and solve these problems [35–39]. These supported HPAs catalysts have been widely used in dehydration reaction of ethanol and methanol to ether [40], oxidation of glycerol to formic acid [41], esterification of glycerol with acetic acid [42], Baeyer-Villiger oxidation of cyclic ketones [14], and the results indicate that the performance are related to the type of carriers. It is reported that the supported catalyst has been used in the oxidative synthesis of MAA. Mitsuru Kanno et al. supported H4PMo11VO40 (HPVA) on SiO2 for MAL oxidation to MAA, the activity of catalysts was improved [28]. N. Ballarini et al. [43] supported Keggin-type P/Mo polyoxometalates (POMs) on silica gel and the specific surface area of the catalyst increased. HPAs have high dispersibility when supported on 1D mesoporous channels of SBA-15 and MCM-41 [12]. However, the supported catalyst generally exhibits poor thermal stability and low conversion in the reaction process. The main reason is that the reaction between the carrier and HPAs leads to the decomposition of Keggin unit or neutralizing the partial acidity of HPAs [28,29]. Moreover, amphoteric and basic carriers like Al2O3 and MgO will reduce the acidity of HPAs and decompose the structure of HPAs [40,44]. In view of the above problems, the researchers adopt the method of modification to adjust the acidity and basicity of the carrier. For example, SiO2 was modified with ammonia and SBA-15 was modified with melamine [5,37]. The acidity and alkalinity of the support has a great influence on the performance of the catalyst. When the carrier exhibits obvious alkalinity, the HPAs will interact with the carrier, resulting in the decomposition of the active components and reducing the catalytic activity [38,45]. A certain acidity is necessary to activate MAL for the nucleophilic attack oxygen atom, however, too strong acidity enhance the adsorption of MAL and affect the reoxidation rate [46] and decrease MAA selectivity [37]. Therefore, the selection of weakly acidic or neutral carriers with high temperature resistance is of great significance for the preparation of supported HPAs catalysts. As a kind of aluminum-rich silicate, kaolin is natural mineral with 2D layered morphology of mild acidic minerals [47–50] and a heterogeneous surface charge [51,52]. The high specific surface area, good adsorption performance and a large number of hydroxyl groups on the surface make kaolin widely used in many fields, such as cosmetics, ceramics, paints, etc [51,53,54]. Based on the above advantages of kaolin, if kaolin is used as a carrier to load HPAs, the decomposition of active components (HPAs) can be avoided and the efficiency of oxidation synthesis of MAA by MAL can be improved. In this work, the kaolin-supported Cs+-NH4 +-K+ doping P-Mo-V Keggin-type HPAs catalysts (CsNH4KPMoV/kaolin) were prepared. The morphology and property of catalysts before and after loading were characterized by FT-IR, XRD, TG/DTA, XPS, NH3-TPD and N2 adsorption-desorption. The structural stability of CsNH4KPMoV/kaolin and the electronic interaction between kaolin support and CsNH4KPMoV active components were revealed by density functional theory (DFT) calculation. The catalytic oxidation of MAL to MAA was carried out in a fixed-bed reactor. The effects of CsNH4KPMoV loading and reaction temperature on the performance of the catalyst were investigated. In addition, the long-term stability test of the catalyst was performed by continuous reaction for 100 h. And the crystal phase, acidity and carbon deposition of the used catalysts were analyzed by XRD, NH3-TPD, TPO-MS. It is hoped that this work could provide a catalyst with high stability and high catalytic performance for the synthesis of MAA. 2 Experimemtal section 2.1 Materials Molybdenum trioxide (≥99.9%), vanadium oxide (≥98%), phosphoric acid (≥85%) and cesium hydroxide (≥99%) were purchased from Aladdin Chemistry Co., Ltd. (Shanghai, China). Potassium hydroxide (AR) was purchased from Tianjin Kemiou Chemical Reagent Co., Ltd. Ammonium hydrogen carbonate (AR) and kaolin (superfine) were purchased from Shanghai Myrell Chemical Reagent Co., Ltd. The main components of kaolin are SiO2 (52.5%) and Al2O3 (45.0%). All materials were used directly without other treatment ( Table 1). 2.2 Catalysts preparation 2.2.1 Synthesis of CsNH4KPMoV CsNH4KPMoV catalysts was prepared on the basis of laboratory [3]. 28.8 g MoO3, 1.65 g V2O5 and 500 mL deionized water were added to a round bottom flask and stirred vigorously at 80 °C for 20 min. Then 85% H3PO4 (2.096 g) was added into the resulting suspension, stirred at 90 °C for 5 h and dried overnight at 80 °C to obtain solid powder. 15 g solid powder was dissolved in 300 mL deionized water and stirred 20 min at 80 °C. Then 0.99 g NH4HCO3 was dissolved in 50 mL of water, slowly added to the suspension and stirred for 10 min. Next, 1.41 g CsOH·H2O and 0.28 g KOH were added to the above suspension by the same way as NH4HCO3. After that, the suspension was stirred vigorously at 80 °C for 3 h and obtained yellow suspension. Then the insoluble matter in the suspension was filtered off and dried overnight at 80 °C. A yellow solid was obtained, which was composed of Cs(NH4)1.5K0.6H0.9PMo11VO40 and abbreviated as CsNH4KPMoV. 2.2.2 Synthesis of CsNH4KPMoV/kaolin CsNH4KPMoV supported on kaolin was prepared by impregnation method with water as the impregnation solvent. The specific operation was as follows: A certain amount of CsNH4KPMoV was dissolved in deionized water and dropped into a flask containing kaolin and stirred vigorously at 80 °C. The wet solid after impregnation was dried overnight at 80 °C, and then calcined in air at 350 °C for 12 h. The loading of the supported catalyst was adjusted by the amount of CsNH4KPMoV added. The obtained sample was recorded as xCsNH4KPMoV/kaolin, where x represents the load of CsNH4KPMoV. Basing on the above process, the synthesis mechanism of the catalyst is shown in Scheme 2. Firstly, Keggin-type heteropoly anion [PMo11VO40]4- was modified by Cs+-NH4 +-K+ to form CsNH4KPMoV. Then the supported catalyst CsNH4KPMoV/kaolin was prepared by impregnation, drying and calcination of CsNH4KPMoV and kaolin. There are negative charge and weak acid sites on the surface of kaolin, which was beneficial to the system. In order to make it easy to understand, the local area of the supported catalyst was also magnified. 2.3 Characterization of catalysts 2.3.1 Experimental analysis of structure Surface group analysis of the catalysts was carried out by Fourier transform infrared (FT-IR) spectroscopy on a Thermo-Nicolet 6700 FT-IR spectrometer by using KBr pellets. Powder X-ray diffraction (XRD) data were obtained with a Cu Kα radiation source (λ = 1.5418 Å) at 40 kV and 200 mA, from 5° to 70° with a scan rate of 8°/min. Brunauer-Emmett-Teller (BET) surface area and pore volumes analysis was performed from the nitrogen adsorption isotherms at − 196 °C with a Micromeritics Model ASAP 2020 instrument. Thermogravimetry analysis (TGA) of the samples was obtained on a Shimadzu DTG-60AH thermal analyzer. About 10 mg samples were heated to 600 °C under air flow at a constant heating rate of 10 °C·min−1. X-ray photoelectron spectroscopy (XPS) analysis was performed on a Thermo Scientific ESCALAB250Xi. Catalyst acidity was determined using ammonia temperature-programed desorption (NH3-TPD) on a Micromeritics AutoChem II 2920 Chemisorption Analyzer. About 50 mg samples were placed in a quartz tube and first treated at 120 °C for 60 min at 50 mL·min−1 of He flow, then cooled to 50 °C. After that, the mixture gas of NH3 and He (5% NH3, 15 mL·min−1) was adsorbed at 100 °C for 60 min. At last, desorption profiles were recorded by the thermal conductivity detector (TCD) signal in a He flow (25 mL·min−1) by raising the temperature to 600 °C with a heating rate of 10 °C·min−1. Temperature-programmed oxidation-mass spectrometry (TPO-MS) measurements were performed in an AutoChem II 2920 Chemisorption Analyzer. About 150 mg of the sample was heated from 25 °C to 750 °C at a rate of 10 °C·min−1, using a mixture of O2 and He (2% O2). 2.3.2 Molecular simulation All calculations were performed at the DFT level with DMol3 program [55–57] in the Materials Studio of Accelrys Inc. The periodic supercells 2 × 1 × 1 of kaolinite (0 0 1) surface with a vacuum thickness of 20 Å were generated for HPVA adsorption [56]. In order to accurately calculate the interaction between HPVA and kaolin, all atoms were in a relaxed state during the geometry optimization process. The exchange-correlation energy was calculated by the generalized gradient approximation (GGA) with Perdew-Burke-Ernzerhof (PBE) [58] functional. The DFT-Semi-core pseudopts (DSPP) method was used to describe the interaction between the atomic cores and electrons for metal atoms, and other atoms were treated with an all electron [59]. Meanwhile, the valence electron function was expanded into a set of numerical atomic orbitals through a double-numerical basis with polarization functions (DNP) [60], and partial occupancies was obtained by a smearing value of 0.005 hartree. A 2 × 1 × 1 Monkhorst-Pack grid was used for the adsorption configuration. The convergence criteria for structure optimization with tolerance energy of 2 × 10−5 eV/atom, maximum force of 0.05 eV/Å and maximum displacement of 2 × 10−3 Å, respectively. 2.3.3 Catalytic reaction experiment As shown in Fig. 1, selective oxidation of MAL to MAA was evaluated in a fixed-bed reactor at atmospheric pressure. Before evaluation, 4 g catalysts were tableted and sieved to obtain a particle size of 20–40 mesh. The catalysts were placed in the middle of the fixed bed reactor. The upper and lower ends of the catalyst were filled with appropriate amount of quartz wool, and then supported by wire mesh. O2 and N2 (carrier gas) with a volume ratio of 1/7.5 were injected into the reactor with the rate of 10 mL·min−1 and 75 mL·min−1, respectively. After temperature was increased to appropriate reaction temperature, the reactants (MAL/O2/N2/H2O) with the volume ratio of 1/2.6/19.5/5.3 were mixed firstly in a pre-mixer and then injected into the reactor. After the reaction was steady, the products were analyzed by Agilent-6820 GC equipped with a thermal conductivity cell detector (TCD) and a HP-INNOWAX capillary column. The highly volatile byproducts such as CO and CO2 were analyzed using an online GC with an HP-PLOT capillary column. The MAL conversion was calculated by Eq. (1) and the selectivity to MAA was calculated by Eq. (2). (1) C ( % ) = n MAL , F − n MAL , P n MAL , F × 100 % (2) S ( % ) = n MAA , P n MAL , F − n MAL , P × 100 % Where C (%) is the MAL conversion, S (%) is the selectivity to MAA. nMAL,F is the moles of MAL fed into the reactor, nMAL,P is the moles of MAL detected in the liquid phase product, nMAA,P is the moles of MAA detected in the liquid phase product. 3 Results and discussion 3.1 Characterization of catalysts The FT-IR spectra of kaolin, CsNH4KPMoV and xCsNH4KPMoV/kaolin were analyzed, and the structure of the catalysts was investigated. The results are presented in Fig. 2. CsNH4KPMoV and xCsNH4KPMoV/kaolin catalysts exhibit the typical band of Keggin unit at about 1062, 965, 870, and 785 cm−1, which were attributed to P-O of PO4 tetrahedron, MoOd, Mo-Ob-Mo, and Mo-Oc-Mo asymmetric stretching vibrations, respectively [23,43,61]. The small band at about 1413 cm−1 of CsNH4KPMoV and supported xCsNH4KPMoV/kaolin catalysts can be assigned to the N-H deformation vibration of the NH4 + cations [23]. The peak at 1093 cm−1 was attributed to the dissymmetry stretching and Si-O-Si for kaolin [12]. In addition, the band at 469 cm−1 was attributed to the vibration of Si-O-Al [62]. The peaks of kaolin at 1093 and 469 cm−1 were also observed in all supported catalysts, indicating that the CsNH4KPMoV was successfully loaded on the kaolin carrier. And as the load of CsNH4KPMoV increased, the intensity of these two peaks became weaker and weaker. For supported catalyst xCsNH4KPMoV/kaolin, there were both characteristic peaks of CsNH4KPMoV and kaolin. These results further prove that CsNH4KPMoV was successfully loaded on kaolin. Fig. 3 shows the XRD patterns of the catalysts before reaction. The diffraction peaks of CsNH4KPMoV matched well with that of the CsPAV cubic phase (PDF 46–0481) [22] from Fig. 3(A), revealing the phase purity of the compound after calcination was high. The crystalline of kaolin was close to amorphous [63]. For the supported catalysts xCsNH4KPMoV/kaolin, all samples had diffraction patterns corresponding to pure CsNH4KPMoV. Even if the CsNH4KPMoV loading was only 33 wt%, the diffraction peak was almost the same as that of CsNH4KPMoV. In addition, no new peaks appeared and no peaks disappeared for all supported catalysts compared with pure CsNH4KPMoV, which indicates that the active component (CsNH4KPMoV) was successfully supported on kaolin and combined well with the carriers. At the same time, there was no decomposition of active components when CsNH4KPMoV was loaded on kaolin, which was consistent with the results of FT-IR in Fig. 2. In order to observe the shift of the diffraction peaks, the region from 25° to 27° was magnified. The diffraction peaks of CsNH4KPMoV/kaolin catalysts shifted slightly to lower angle sides after CsNH4KPMoV was loaded on kaolin from Fig. 3(B). For all samples, the strongest characteristic diffraction peak was about 26.2°, corresponding to the (222) plane of Keggin-type heteropoly acid. For CsNH4KPMoV, the crystal plane assigned to (222) at 26.32°, while the peak position shifted to 26.23°, 26.23°, 26.16° for 33CsNH4KPMoV/kaolin, 50CsNH4KPMoV/kaolin, and 67CsNH4KPMoV/kaolin, respectively. The phenomenon that the diffraction peak shifted to lower angles indicates that the d-spacing of the lattice increases [10]. Thermal stability of unsupported CsNH4KPMoV and support 50CsNH4KPMoV/kaolin catalysts in air at 50–600 °C were characterized by TG/DTA. Fig. 4 depicts the TG/DTA curves of kaolin, CsNH4KPMoV and supported catalysts 50CsNH4KPMoV/kaolin. There were two stages of weight loss in CsNH4KPMoV and 50CsNH4KPMoV/kaolin. The weight loss before 250 °C was crystalline water for both CsNH4KPMoV and 50CsNH4KPMoV/kaolin [64]. The weight loss of 250–450 °C was the decomposition of the active phase [10] and leading to form lacunary Keggin-type HPAs [65]. The decomposition of active phase refers to the decomposition of ammonium ion with release of ammonia and the elimination of acidic protons under the form of constitutional water [10,23]. Moreover, when the temperature reached about 450 °C, V4+ species were easily oxidized to V5+ species by air [23]. Thus, the increase in weight at about 450 °C of CsNH4KPMoV and 50CsNH4KPMoV/kaolin can be attributed to the reoxidation of V4+ to more stable V5+ under air [10]. The decrease in the weight of kaolin was mainly due to the water evaporation and dehydroxylation in the process of heating [63,66]. For catalyst CsNH4KPMoV, the decomposed of active phase began at 404 °C, while for 50CsNH4KPMoV/kaolin, the decomposition temperature of active phase increased to 420 °C. The active phase decomposition shifted to higher temperature for 50CsNH4KPMoV/kaolin catalysts, which was related to the improvement of thermal stability of the catalysts[64]. Good thermal stability is beneficial to the improvement of its catalytic performance. The nitrogen adsorption-desorption isotherms of kaolin, CsNH4KPMoV and xCsNH4KPMoV/kaolin catalysts were analyzed, and the results are shown in Fig. 5. The results reveal that the specific surface area of supported catalyst was higher than that of CsNH4KPMoV. All the curves exhibited type IV adsorption isotherms and had the H3 or H4 hysteresis loop. Although there was little difference in the isotherms of several samples, the hysteresis loop of kaolin was clearer than that of CsNH4KPMoV and kaolin has more obvious pore structure. Therefore, the average pore size of kaolin was smaller than that of CsNH4KPMoV ( Table 2). As shown in Table 2, the specific surface area, pore volume, and average pore size of the all samples are summarized. The specific surface area of kaolin was 15.3 m2·g−1, while that of pure CsNH4KPMoV was only 4.6 m2·g−1. The specific surface area of kaolin was 3.3 times of that of CsNH4KPMoV, thus kaolin can be used as a good carrier to support CsNH4KPMoV. When the CsNH4KPMoV loading was 67 wt%, 50 wt%, and 33 wt%, the specific surface area was 7.3 m2·g−1, 9.9 m2·g−1, 11.7 m2·g−1, respectively. With the increase of CsNH4KPMoV load, the specific surface area decreased. The increase of specific surface area promoted the exposure of acid sites and redox sites, which should be one of the reasons for the improvement of catalyst performance. Compared with kaolin, the pore volume of CsNH4KPMoV/kaolin decreased slightly, which was due to the fact that some CsNH4KPMoV were filled into the pores of kaolin. The NH3-TPD profiles of kaolin, CsNH4KPMoV, 50CsNH4KPMoV/kaolin and 33CsNH4KPMoV/kaolin are shown in Fig. 6. There was a broad desorption peak in the temperature range of 100–300 °C with the Tmax value being 197 °C for kaolin, corresponding to the weak acid sites [33]. NH3-TPD data indicate that the kaolin support was weakly acidic and can be used as an effective carrier to support HPAs. There were mainly two broad desorption peaks at 100–300 °C and 320–530 °C of CsNH4KPMoV. The Tmax value at 205 °C corresponded to weak acid sites and the Tmax value at 452 °C was strong acid sites. Weak acid sites appeared at 194 °C and strong acid sites appeared at 454 °C for 50CsNH4KPMoV/kaolin catalysts [10]. For catalysts 33CsNH4KPMoV/kaolin, three desorption peaks appeared at Tmax value 155 °C, 318 °C and 419 °C, corresponding to weak acid sites, mediate strong acid sites and strong acid sites, respectively [10,33,67]. The desorption peaks of 33CsNH4KPMoV/kaolin were very similar to that of CsNH4KPMoV, except that desorption peak temperature and strength was slightly lower. Because the xCsNH4KPMoV/kaolin catalyst will decompose and release NH3 when heating up, blank experiments without NH3 adsorption was carried out and the amount of ammonium ion was subtracted from that of desorbed ammonia on NH3-TPD profile. The acidity of 33CsNH4KPMoV/kaolin was 0.039 mmol·g−1, and the acidity was 0.11 mmol·g−1 for CsNH4KPMoV. The low acidity of 33CsNH4KPMoV/kaolin was related to the low content of the active ingredients (CsNH4KPMoV) and the lack of acidic sites. The desorption peaks of 50CsNH4KPMoV/kaolin supported catalysts and CsNH4KPMoV catalysts were almost the same. For 50CsNH4KPMoV/kaolin, the load of CsNH4KPMoV was 50 wt%, but acidity was 0.077 mmol·g−1, which was more than half of the acidity of CsNH4KPMoV, indicating that CsNH4KPMoV was well dispersed on the kaolin support and exposed most of the acidic sites. These results further suggests that the supported catalysts basically maintained the Keggin structure without decomposition of CsNH4KPMoV, and there were strong interaction between CsNH4KPMoV and kaolin [12]. The XRD results of Fig. 3 also reveal that the crystal phase of the supported catalyst was almost unchanged compared with that of CsNH4KPMoV. The retention of Keggin structure prove that the active component (CsNH4KPMoV) of the supported catalyst did not decompose, which was one of the reasons for the improvement of stability. 3.2 DFT simulation and the interfacial interactions In order to investigate the interfacial interaction between HPVA and kaolin, the structural stability of HPVA/kaolin catalyst was investigated by DFT simulation and the stable adsorption configuration obtained is shown in Fig. 7. According to the different adsorption sites of HPVA on kaolin, the adsorption configuration can be divided into the following three types. For adsorption configuration Fig. 7(A), the adsorption of O atom connected to Mo (O(Mo)). The adsorption of O atom connected to Mo and V in HPVA, and the adsorption of H atom connected to O atom (O(Mo/V)&H(O)) for Fig. 7(B). And for adsorption configuration Fig. 7(C), an O atom connected to Mo and an O atom connected to V in HPVA were adsorbed on kaolin (O(Mo/V)). In addition, the adsorption energies of the three adsorptions configuration were also calculated according to the Equ.3, and the results are listed in Table 3. (3) E ads= E HPVA/kaolin – E HPVA – E kaolin Among them, EHPVA/kaolin is the total energy of HPVA adsorbed on kaolin, and EHPVA and E kaolin are the energy of HPVA and kaolin, respectively. It can be concluded from Table 3 that the adsorption energies of the three adsorption configurations were all negative. The minimum adsorption distances (O and H atoms) were all around 1.0 Å, indicating that there was a strong attraction between HPVA and kaolin. For the adsorption configuration Fig. 7(A), Fig. 7(B) and Fig. 7(C), the adsorption energies were − 6.15 eV, − 5.13 eV, and − 5.17 eV, respectively. The absolute value of adsorption energy of Fig. 7(A) adsorption configuration was the largest, indicating that Fig. 7(A) configuration was the most stable. All the adsorption configuration of HPVA and kaolin (HPVA/kaolin) was multi-site adsorption from Fig. 7, and the large adsorption energy indicates that chemical adsorption has occurred between HPVA and kaolin. The partial density of states (PDOS) of kaolin adsorbed HPVA configuration (HPVA/kaolin) was calculated and the electronic interaction between HPVA and kaolin was further verified. As shown in Fig. 8, the s and p orbitals of the O atom in HPVA and the s orbital of the H atom in kaolin overlapped to a large extent in the range of − 18.6∼− 17.2 eV and − 7∼− 4.8 eV, revealing that there was a strong electronic interaction between HPVA and kaolin. The composition and the valence states of the elements in the near surface of CsNH4KPMoV and 50CsNH4KPMoV/kaolin were analyzed by XPS technique, and the results are shown in Fig. 9. The V 2p3/2 spectral zones are shown in Fig. 9(A) and Fig. 9(B). The binding energy of 518 eV and 517 eV belongs to V5+ and V4+ [10]. Vanadium species in the Keggin anion play an important role in the oxidation reaction of MAL through the transition of V4+ and V5+. The peaks of Mo 3d for catalysts CsNH4KPMoV and 50CsNH4KPMoV/kaolin are shown in Fig. 9(C) and Fig. 9(D). The binding energy of around 233.2 eV was assigned to Mo 3d5/2. Only Mo6+ peaks were presented because both CsNH4KPMoV and 50CsNH4KPMoV/kaolin were calcined in air. The change of Mo 3d5/2 spectra before and after loading was little, indicating that the presence of kaolin did not greatly affect the chemical state of Mo. The binding energy values and quantification results of Mo and V elements are obtained in Table 4. The ratio of V4+ for 50CsNH4KPMoV/kaolin (45%) was higher than CsNH4KPMoV (34%), indicating that more V5+ species was reduced to V4+ after CsNH4KPMoV loading on kaolin. This reduction occurred automatically and was related to the O2- ligands (lattice oxygen) in the Keggin structure [64,68]. When CsNH4KPMoV was loaded on kaolin, the lattice oxygen in heteropoly acid interacted strongly with kaolin from Fig. 7 (B) and Fig. 7 (C). The negative charge on the surface of kaolin [50] was transferred to the lattice oxygen in heteropoly acid and form electron-rich lattice oxygen, which was beneficial to the reduction of V5+ species. This was the reason for the increase of V4+ species after loading. V4+(VO2+) species are active species for the oxidation of MAL to MAA [22]. Kaolin support promoted the formation of V4+ species and the low chemical states of the V species were beneficial for improving the catalytic performance. Therefore, the incorporation of V in HPAs catalysts was very important for the oxidation of MAL. Changes in vanadium species indicate electronic interactions between the kaolin support and the active components (CsNH4KPMoV). The results of the partial density of states in Fig. 8 also proved that there was a strong electronic interaction between CsNH4KPMoVand kaolin. The N 1 s spectra of the CsNH4KPMoV and 50CsNH4KPMoV/kaolin are shown in Fig. 10. The peaks of the two samples were basically similar, and the loading process had no obvious effect on NH4 + in the active components. For the CsNH4KPMoV, the deconvoluted spectra for N 1 s exhibited two main peaks at 398.6 eV and 401.6 eV, corresponding to Mo6+ and NH4 +, respectively [23]. This conclusion also applied to 50CsNH4KPMoV/kaolin. By quantitative calculation, the ratio of Mo6+/NH4 + was 91.2/8.8 for sample CsNH4KPMoV and 90.9/9.1 for 50CsNH4KPMoV/kaolin. The nature of N in the catalyst has hardly changed before and after supporting. Therefore, the NH4 + cation in the active component played a role in regulating the acidity and alkalinity, but did not interact with the support. 3.3 Catalytic performance of the catalysts In order to study the catalytic performance of supported catalyst CsNH4KPMoV/kaolin for the oxidation of MAL to MAA, this work was based on the previous studies on the catalytic oxidation of MAL by unsupported heteropoly acid [3], and further discussion was carried out. The effects of loading and temperature on the reaction were mainly discussed, and the long-term performance of the catalyst was evaluated. At the same time, the catalytic performance was compared with that of unsupported pure CsNH4KPMoV. 3.3.1 Influence of the amount of CsNH4KPMoV active components The catalytic performance of a series of supported catalysts xCsNH4KPMoVkaolin is shown in Fig. 11. The performance of the supported catalyst was related to the CsNH4KPMoV loading. For pure CsNH4KPMoV, MAL conversion was 71.1% and selectivity to MAA was 88.9%. When the load of CsNH4KPMoV increased from 20 wt% to 50 wt%, MAL conversion increased from 52.8% to 81.8%. When the load continued to increase to 67 wt%, MAL conversion decreased. When the CsNH4KPMoV loading was 20 wt%, there were few active components and acid sites in the composite catalyst, so the catalytic performance was poor. However, when the CsNH4KPMoV loading was more than 67 wt%, the specific surface area of the catalyst decreased (Table 2), and the dispersion of the catalyst plays a leading role, resulting in the decrease of catalyst activity and the decrease of MAL conversion. The results are consistent with Jing’s study on the oxidation of isobutane to MAA [10]. When the CsNH4KPMoV loading was 50 wt%, the highest conversion was 81.8%, which was 10.7% higher than pure CsNH4KPMoV. 50CsNH4KPMoV/kaolin exposed more active sites and improved the oxidation performance of the catalyst. Besides, V4+ species was the active phase of MAL selective oxidation [23]. XPS results show that there were more V4+ species in 50CsNH4KPMoV/kaolin than in CsNH4KPMoV. Therefore, the activity of the supported catalyst increased. With the increase of CsNH4KPMoV load, the selectivity to MAA increased continuously. When the load of CsNH4KPMoV was 20 wt% and 33 wt%, the selectivity to MAA was 68.9% and 80.4%, respectively. For 50CsNH4KPMoV/kaolin and 67CsNH4KPMoV/kaolin, the selectivity to MAA was about 88% and changed little compared with CsNH4KPMoV. NH3-TPD results show that desorption peak temperature and intensity of 50CsNH4KPMoV/kaolin and CsNH4KPMoV were almost the same, so they had similar acidic sites and similar MAA selective. The catalytic performance was related to the loading amount of CsNH4KPMoV. This is mainly because the load affects the specific surface area and the exposure of active sites. The 50CsNH4KPMoV/kaolin catalyst was further discussed. 3.3.2 Influence of the temperature Fig. 12 shows the effect of temperature on catalytic performance of 50CsNH4KPMoV/kaolin. The conversion of MAL increased with the increase of temperature. MAL conversion was only 41.4% at 290 °C and reached to 84.5% at 345 °C, which was related to the activation of more MAL molecules in the reaction at high temperature. With the increase of temperature, the selectivity to MAA first increased from 65.1% to 88.2%, and then decreased to 73.4%. Proper increase of temperature can improve the catalytic performance (MAL conversion and selectivity to MAA) of the catalyst, but when the temperature exceeded a certain value, the by-product increased and the MAA selectivity decreased. The by-products were mainly acetic acid, CO and CO2. When the reaction temperature was 290–345 °C, the selectivity to acetic acid was in the range of 6.1–20.3%, the selectivity to COx was in the range of 5.7–14.6%. It is worth noting that 50CsNH4KPMoV/kaolin had the best catalytic performance. The MAL conversion was 81.8% and the selectivity to MAA was 88.2% when the temperature was 315 °C. 3.3.3 Performance comparison of 50 wt% supported catalyst and physical mixture The catalytic performance of 50 wt% supported catalyst and physical mixture was compared. From Table 5, for 50CsNH4KPMoV/kaolin supported catalysts, the MAL conversion and selectivity to MAA were 81.8% and 88.2% respectively at 315 °C. For the sample of physical mixture of kaolin and CsNH4KPMoV, under the same reaction conditions, the MAL conversion and selectivity to MAA were only 48.2% and 56.3%, less than 50CsNH4KPMoV/kaolin supported catalysts. Therefore, the performance of the physical mixture of kaolin and CsNH4KPMoV was much lower than that of the supported catalyst. 3.3.4 The catalytic stability of 50CsNH 4 KPMoV/kaolin In order to investigate the stability of the supported catalyst 50CsNH4KPMoV/kaolin, long-term life evaluation experiment was carried out at 315 °C for 100 h. During the reaction, the catalyst was not replaced. The catalytic performance of the catalyst is shown in Fig. 13. The MAL conversion and selectivity to MAA changed little with the increase of reaction time, and maintained at about 81% and 88%, respectively. In addition, the structure and performance of the catalyst did not change significantly after evaluation. These results confirm that the 50CsNH4KPMoV/kaolin supported catalyst had good stability and maintained high reaction efficiency for a long time. 3.4 General discussion In addition, the catalytic performance comparison of 50CsNH4KPMoV/kaolin and other supported catalysts in references for MAL oxidation is shown in Table 6. When SiO2 was used as carrier in MAL oxidation reaction, the catalytic performance was not good and generally needs to be further modified with ammonia, melamine, Cu, etc. Previous reports indicate that SiO2 carrier could react with heteropoly acid and lead to the decomposition of the active components to form MoO3. However, MoO3 was not conducive to the selective oxidation of MAL, so the catalytic performance decreased [28]. For 50CsNH4KPMoV/kaolin, the MAL conversion and selectivity to MAA were about 81% and 88% with the prolongation of reaction time. This is mainly attributed to the suitable acidity of kaolin, thus avoided the decomposition of active components and kept stable. The XRD characterization of the used supported catalyst (xCsNH4KPMoV/kaolin) was carried out to analyze the crystal phase change of the catalyst. Compared with the fresh xCsNH4KPMoV/kaolin catalysts (Fig. 3), the XRD crystallite of the used supported catalysts has almost no change, as shown in Fig. 14. This reveals that the supported catalyst was stable in the reaction process. The Keggin structure was maintained without decomposition and loss of active components. The catalyst life evaluation experiment in Fig. 13 also proved these results. From the NH3-TPD profile of Fig. 15, for the used catalyst 50CsNH4KPMoV/kaolin, there was a broad peak with the Tmax of 201 °C in the range of 150–300 °C, corresponding to weak acid sites. There was a broad peak between 320 °C and 530 °C with the Tmax value being 453 °C. Compared with the fresh 50CsNH4KPMoV/kaolin catalyst (Fig. 6), the NH3-TPD peak position and intensity of the used catalyst 50CsNH4KPMoV/kaolin almost did not change. This shows that the acid property of the used catalyst was basically the same as that of the fresh catalyst. The acidity of the used catalyst (50CsNH4KPMoV/kaolin) was also analyzed, and the total acidity was 0.078 mmol·g−1, which was nearly the same as that of the fresh catalyst of 0.077 mmol·g−1. The acid strength and acidity of the catalyst did not decrease after use, indicating that the stability of the support catalyst was good. Fig. 16 is the XPS spectra of V 2p and N 1 s of the used 50CsNH4KPMoV/kaolin catalyst. The molar ratio of V5+/V4+ was 46/54, which was significantly lower than that of fresh catalyst (55/45). This was due to the partial reduction of V5+ to V4+ in the reaction process and shows that the vanadium species were reactive active species and participated in the reaction [37,64]. The deconvoluted spectra for N 1 s exhibited two main peaks at 398.6 eV and 401.6 eV, corresponding to Mo6+ and NH4 + [23], which was consistent with the fresh 50CsNH4KPMoV/kaolin catalyst. By quantitative calculation, the ratio of Mo6+/NH4 + was 92.6/8.4 for the used 50CsNH4KPMoV/kaolin. Compared with the fresh catalyst in Fig. 10, the proportion of NH4 + decreased slightly after 100 h reaction. There was a small amount of NH4 + decomposition during the reaction. The carbon deposition of the used 50CsNH4KPMoV/kaolin catalyst was studied by temperature-programmed oxidation (TPO) and monitored by online mass spectrometry (MS). The results are shown in Fig. 17. The TPO-MS pattern for m/e= 17 had a broad peak between 310 °C and 530 °C, which corresponds to the decomposition of ammonium in the catalyst to form NH3. For m/e= 18 from 310 °C to 530 °C can be associated with H2O [69–71]. The TPO-MS signals for m/e= 28 (CO2 and/or CO) and 44 (CO2) [72] can hardly be observed. The results show that there was almost no carbon deposition in the used 50CsNH4KPMoV/kaolin catalyst. Therefore, after 100 h of reaction, the catalyst still maintained good performance. 4 Conclusion A series of xCsNH4KPMoV/kaolin catalysts with different CsNH4KPMoV content were prepared for the oxidation of MAL. CsNH4KPMoV was successfully supported on kaolin, and the specific surface area of supported catalyst 50CsNH4KPMoV/kaolin was 2.1 times of that of CsNH4KPMoV. Kaolin carrier was weakly acidic and all the supported catalysts have strong acidic sites. CsNH4KPMoV was well dispersed on the kaolin support and maintained Keggin structure without decomposition of active components. Furthermore, the negative surface charge on the kaolin support promoted the reduction V5+ species in the CsNH4KPMoV to V4+ (VO2+) active species, which was beneficial to the improvement of their catalytic performance. In addition, the DFT calculation results suggest that there was a strong interaction between CsNH4KPMoV and kaolin, and chemical adsorption occurred. The loading of CsNH4KPMoV had an important effect on the catalytic performance of CsNH4KPMoV/kaolin catalysts. When the CsNH4KPMoV load was lower than 33 wt%, the strong acidic sites were less and the activity was poor. When the loading of CsNH4KPMoV exceeded 67 wt%, MAL conversion decreased due to the poor dispersion of catalyst. 50CsNH4KPMoV/kaolin had the best catalytic performance, and the MAL conversion and the selectivity to MAA were 81.8% and 88.2%, respectively. More importantly, the 50CsNH4KPMoV/kaolin catalyst exhibited good catalytic stability. There was no carbon deposition in the reaction process. The XRD patterns of the used catalyst were basically the same as that of the fresh catalyst, the acid strength and acidity of the used catalyst did not decrease, indicating that the catalyst had high stability. CRediT authorship contribution statement Qianwen Zhu: Research plan, Investigation, Data processing, Writing – review & editing. Jing Zhu: Investigation, Data curation, Yang Li: Investigation, Writing – review & editing. Zhaobang Zhang: Data processing, Validation. Baohe Wang: Validation, Writing – review & editing, Funding acquisition. Jing Ma: Validation, Research plan, Writing – review & editing. Declaration of Competing Interest The authors declare that they have no known competing financial interests or personal relationships that could have appeared to influence the work reported in this paper. Acknowledgments This work was financially supported by the National Natural Science Foundation of China (21606168 and 22178246). References [1] S. Illies B. Kraushaar-Czarnetzki Ind. Eng. Chem. Res. 55 2016 8509 8518 S. Illies, B. Kraushaar-Czarnetzki, Processing study on the stability of heteropoly acid catalyst in the oxidation of methacrolein to methacrylic acid, Ind. Eng. Chem. Res., Research, 55 (2016) 8509–8518. [2] I.N. Filimonov W.-H. Lee Catal. Lett. 131 2009 70 75 I.N. Filimonov, W.-H. Lee, Methacrylic acid: Not a mere product but activator in the catalytic oxidation of methacrolein?, Catal. Lett., 131 (2009) 70–75. [3] B.H. Wang H.G. Dong L. Lu H.X. Liu Z.B. Zhang J. Zhu Catalysts 11 2021 394 B.H. Wang, H.G. Dong, L. Lu, H.X. Liu, Z.B. Zhang, J. Zhu, Study on the development of high-performance P-Mo-V catalyst and the influence of aldehyde impurities on catalytic performance in selective oxidation of methacrolein to methacrylic acid, Catalysts, 11 (2021) 394. [4] Y.L. Cao L. Wang L.L. Zhou B.H. Xu Y.Y. Diao S.J. Zhang J. Ind. Eng. Chem. 65 2018 254 263 Y.L. Cao, L. Wang, L.L. Zhou, B.H. Xu, Y.Y. Diao, S.J. Zhang, A modified heteropoly acid catalyst with cetyltrimethylammonium bromide for methacrolein to methacrylic acid, J. Ind. Eng. Chem., 65 (2018) 254–263. [5] M. Kanno Y.-k Miura T. Yasukawa T. Hasegawa W. Ninomiya K. Ooyachi H. Imai T. Tatsumi Y. Kamiya Catal. Commun. 13 2011 59 62 M. Kanno, Y.-k Miura, T. Yasukawa, T. Hasegawa, W. Ninomiya, K. Ooyachi, H. Imai, T. Tatsumi, Y. Kamiya, 11-Molybdo-1-vanadophosphoricacid H4PMo11VO40 supported on ammonia-modified silica as highly active and selective catalyst for oxidation of methacrolein, Catal. Commun., 13 (2011) 59–62. [6] M.J. Darabi Mahboub J.L. Dubois F. Cavani M. Rostamizadeh G.S. Patience Chem. Soc. Rev. 47 2018 7703 7738 M.J. Darabi Mahboub, J.L. Dubois, F. Cavani, M. Rostamizadeh, G.S. Patience, Catalysis for the synthesis of methacrylic acid and methyl methacrylate, Chem Soc Rev, 47 (2018) 7703–7738. [7] M. Sennerich P. Weidler B. Kraushaar-Czarnetzki Catal. Commun. 141 2020 106016 M. Sennerich, P. Weidler, B. Kraushaar-Czarnetzki, Hexagonal Mo/V/W mixed oxide as a catalyst for the partial oxidation of methacrolein to methacrylic acid, Catal. Commun., 141 (2020) 106016. [8] L.L. Zhou Y. Sun B. Li Z.J. Li Z.K. Zhang J. Yun R.J. Liu Catal. Commun. 126 2019 44 49 L.L. Zhou, Y. Sun, B. Li, Z.J. Li, Z.K. Zhang, J. Yun, R.J. Liu, Selective oxidation of methacrolein to methacrylic acid on carbon catalysts, Catal. Commun., 126 (2019) 44–49. [9] O.V. Chub N. Saadatkhah J.-L. Dubois G.S. Patience Appl. Catal. A 638 2022 O.V. Chub, N. Saadatkhah, J.-L. Dubois, G.S. Patience, Fluidized bed poly(methyl methacrylate) thermolysis to methyl methacrylate followed by catalytic hydrolysis to methacrylic acid, Appl. Catal., A, 638 (2022). [10] F.L. Jing B. Katryniok F. Dumeignil E. Bordes-Richard S. Paul J. Catal. 309 2014 121 135 F.L. Jing, B. Katryniok, F. Dumeignil, E. Bordes-Richard, S. Paul, Catalytic selective oxidation of isobutane to methacrylic acid on supported (NH4)3HPMo11VO40 catalysts, J. Catal., 309 (2014) 121–135. [11] S.Z. Liu L. Chen G.W. Wang J.W. Liu Y.A. Gao C.Y. Li H.H. Shan J. Energy Chem. 25 2016 85 92 S.Z. Liu, L. Chen, G.W. Wang, J.W. Liu, Y.A. Gao, C.Y. Li, H.H. Shan, Effects of Cs-substitution and partial reduction on catalytic performance of Keggin-type phosphomolybdic polyoxometalates for selective oxidation of isobutane, J. Energy Chem., 25 (2016) 85–92. [12] H. Zhang C.H. Yang S.Y. Zhao T.T. Wang W.C. Zhu J. Chem. Res. 45 2020 60 67 H. Zhang, C.H. Yang, S.Y. Zhao, T.T. Wang, W.C. Zhu, Comparison in thermal stability and catalytic performance of H4PMo11VO40 heteropolyacid supported on mesoporous and macroporous silica materials, J.Chem.Res., 45 (2020) 60–67. [13] S. Yasuda A. Iwakura J. Hirata M. Kanno W. Ninomiya R. Otomo Y. Kamiya Catal. Commun. 125 2019 43 47 S. Yasuda, A. Iwakura, J. Hirata, M. Kanno, W. Ninomiya, R. Otomo, Y. Kamiya, Strong Brønsted acid-modified chromium oxide as an efficient catalyst for the selective oxidation of methacrolein to methacrylic acid, Catal. Commun., 125 (2019) 43–47. [14] S.P. Hu L.T. Niu Y.L. Wei L.N. Chen Z.W. Yang Mol. Phys. 118 2020 1759832 S.P. Hu, L.T. Niu, Y.L. Wei, L.N. Chen, Z.W. Yang, Catalytic properties of mesoporous materials supported heteropoly acids for Baeyer-Villiger oxidation of cyclic ketones, Mol. Phys., 118 (2020) 1759832. [15] H. Kim J.C. Jung S.H. Yeom K.-Y. Lee I.K. Song J. Mol. Catal. A Chem. 248 2006 21 25 H. Kim, J.C. Jung, S.H. Yeom, K.-Y. Lee, I.K. Song, Preparation of H3PMo12O40 catalyst immobilized on polystyrene support and its application to the methacrolein oxidation, J. Mol. Catal. A: Chem., 248 (2006) 21–25. [16] A. Micek-Ilnicka J. Mol. Catal. A Chem. 308 2009 1 14 A. Micek-Ilnicka, The role of water in the catalysis on solid heteropolyacids, J. Mol. Catal. A: Chem., 308 (2009) 1–14. [17] X.K. Li J. Zhao W.J. Ji Z.B. Zhang Y. Chen C.-T. Au S. Han H. Hibst J. Catal. 237 2006 58 66 X.K. Li, J. Zhao, W.J. Ji, Z.B. Zhang, Y. Chen, C.-T. Au, S. Han, H. Hibst, Effect of vanadium substitution in the cesium salts of Keggin-type heteropolyacids on propane partial oxidation, J. Catal., 237 (2006) 58–66. [18] J.E. Molinari L. Nakka T. Kim I.E. Wachs ACS Catal. 1 2011 1536 1548 J.E. Molinari, L. Nakka, T. Kim, I.E. Wachs, Dynamic surface structures and reactivity of vanadium-containing molybdophosphoric acid (H3+xPMo12–xVxO40) Keggin catalysts during methanol oxidation and dehydration, ACS Catal., 1 (2011) 1536–1548. [19] D.S. Desai G.D. Yadav Mol. Catal. 524 2022 D.S. Desai, G.D. Yadav, Solvent-free oxidative esterification of furfural to 2-methyl furoate using novel copper-exchanged tungstophosphoric acid supported on montmorillonite K-10 catalyst, Mol. Catal., 524 (2022). [20] H. Kim J.C. Jung D.R. Park S.-H. Baeck I.K. Song Appl. Catal., A 320 2007 159 165 H. Kim, J.C. Jung, D.R. Park, S.-H. Baeck, I.K. Song, Preparation of H5PMo10V2O40 (PMo10V2) catalyst immobilized on nitrogen-containing mesoporous carbon (N-MC) and its application to the methacrolein oxidation, Appl. Catal., A, 320 (2007) 159–165. [21] L. Marosi A.C. Otero J. Catal. 213 2003 235 240 L. Marosi, A.C. Otero, Catalytic performance of Csx(NH4)yHzPMo12O40 and related heteropolyacids in the methacrolein to methacrylic acid conversion: in situ structural study of the formation and stability of the catalytically active species, J. Catal., 213 (2003) 235–240. [22] Y.L. Cao L. Wang B.H. Xu S.J. Zhang Chem. Eng. J. 334 2018 1657 1667 Y.L. Cao, L. Wang, B.H. Xu, S.J. Zhang, The Chitin/Keggin-type heteropolyacid hybrid microspheres as catalyst for oxidation of methacrolein to methacrylic acid, Chem. Eng. J., 334 (2018) 1657–1667. [23] Y.L. Cao L. Wang L.L. Zhou G.J. Zhang B.H. Xu S.J. Zhang Ind. Eng. Chem. Res. 56 2017 653 664 Y.L. Cao, L. Wang, L.L. Zhou, G.J. Zhang, B.H. Xu, S.J. Zhang, Cs(NH4)xH3–xPMo11VO40 catalyzed selective oxidation of methacrolein to methacrylic acid: Effects of NH4+ on the structure and catalytic activity, Ind. Eng. Chem. Res., 56 (2017) 653–664. [24] Y.X. Zheng H. Zhang L. Wang S.J. Zhang S.J. Wang Front. Chem. Sci. Eng. 10 2015 139 146 Y.X. Zheng, H. Zhang, L. Wang, S.J. Zhang, S.J. Wang, Transition metal-doped heteropoly catalysts for the selective oxidation of methacrolein to methacrylic acid, Front. Chem. Sci. Eng., 10 (2015) 139–146. [25] J.S. Santos J.A. Dias S.C.L. Dias F.A.C. Garcia J.L. Macedo F.S.G. Sousa L.S. Almeida Appl. Catal. A 394 2011 138 148 J.S. Santos, J.A. Dias, S.C.L. Dias, F.A.C. Garcia, J.L. Macedo, F.S.G. Sousa, L.S. Almeida, Mixed salts of cesium and ammonium derivatives of 12-tungstophosphoric acid: Synthesis and structural characterization, Appl. Catal., A, 394 (2011) 138–148. [26] D.L. M G.J. W H.Hibst Martin，F.-G Stud. Surf. Sci. Catal. 101 1996 981 990 D.L. M., G.J. W., Martin，F.-G., H.Hibst, Effects of Cs and V on heteropolyacid catalysts in methacrolein oxidation, Stud. Surf. Sci. Catal., 101 (1996) 981–990. [27] L.L. Zhou L. Wang Y.L. Cao Y.Y. Diao R.Y. Yan S.J. Zhang Mol. Catal. 438 2017 47 54 L.L. Zhou, L. Wang, Y.L. Cao, Y.Y. Diao, R.Y. Yan, S.J. Zhang, The states and effects of copper in Keggin-type heteropolyoxometalate catalysts on oxidation of methacrolein to methacrylic acid, Mol. Catal., 438 (2017) 47–54. [28] M. Kanno T. Yasukawa W. Ninomiya K. Ooyachi Y. Kamiya J. Catal. 273 2010 1 8 M. Kanno, T. Yasukawa, W. Ninomiya, K. Ooyachi, Y. Kamiya, Catalytic oxidation of methacrolein to methacrylic acid over silica-supported 11-molybdo-1-vanadophosphoric acid with different heteropolyacid loadings, J. Catal., 273 (2010) 1–8. [29] N. Legagneux J.M. Basset A. Thomas F. Lefebvre A. Goguet J. Sa C. Hardacre Dalton Trans. 2009 2235 2240 N. Legagneux, J.M. Basset, A. Thomas, F. Lefebvre, A. Goguet, J. Sa, C. Hardacre, Characterization of silica-supported dodecatungstic heteropolyacids as a function of their dehydroxylation temperature, Dalton Trans, (2009) 2235–2240. [30] X.J. Guo C.P. Huang B.H. Chen Korean J. Chem. Eng. 25 2008 675 680 X.J. Guo, C.P. Huang, B.H. Chen, One-step synthesis of methylmethacrylate from methacrolein over Keggin-type heteropoly compounds, Korean J. Chem. Eng., 25 (2008) 675–680. [31] L.H. Guo W.L. Xie C.L. Gao Fuel 316 2022 L.H. Guo, W.L. Xie, C.L. Gao, Heterogeneous H6PV3MoW8O40/AC-Ag catalyst for biodiesel production: Preparation, characterization and catalytic performance, Fuel, 316 (2022). [32] P.E. Boahene S. Vedachalam A.K. Dalai Fuel 317 2022 P.E. Boahene, S. Vedachalam, A.K. Dalai, Catalytic oxidative desulfurization of light gas oil over Keggin-type phosphomolybdic acid supported on TUD-1 metallosilicates, Fuel, 317 (2022). [33] L.L. Zhou L. Wang Y.Y. Diao R.Y. Yan S.J. Zhang Mol. Catal. 433 2017 153 161 L.L. Zhou, L. Wang, Y.Y. Diao, R.Y. Yan, S.J. Zhang, Cesium salts supported heteropoly acid for oxidation of methacrolein to methacrylic acid, Mol. Catal., 433 (2017) 153–161. [34] L. Marosi G. Cox A. Tenten H. Hibst J. Catal. 194 2000 140 145 L. Marosi, G. Cox, A. Tenten, H. Hibst, In situ XRD investigations of heteropolyacid catalysts in the methacrolein to methacrylic acid oxidation reaction: Structural changes during the activation/deactivation process, J. Catal., 194 (2000) 140–145. [35] X.X. Ma T.T. Wang M.N. Zhang W.C. Zhu Z.S. Zhang H. Zhang Catal. Lett. 148 2018 660 670 X.X. Ma, T.T. Wang, M.N. Zhang, W.C. Zhu, Z.S. Zhang, H. Zhang, Heteropoly acid supported on Cu-doped three-dimensionally ordered macroporous SiO2 as efficient catalyst for the selective oxidation of methacrolein, Catal. Lett., 148 (2018) 660–670. [36] J. Schnee F. Devred E.M. Gaigneaux A. Vimont Appl. Catal. A 578 2019 116 121 J. Schnee, F. Devred, E.M. Gaigneaux, A. Vimont, Assessing the dispersion of supported H3PW12O40 catalysts: No longer a hurdle thanks to in situ IR upon pyridine adsorption, Appl. Catal., A, 578 (2019) 116–121. [37] L.L. Zhou S.S. Zhang Z.J. Li J. Scott Z.K. Zhang R.J. Liu J. Yun RSC Adv. 9 2019 34065 34075 L.L. Zhou, S.S. Zhang, Z.J. Li, J. Scott, Z.K. Zhang, R.J. Liu, J. Yun, Selective oxidation of methacrolein to methacrylic acid over H4PMo11VO40/C3N4-SBA-15, RSC Adv., 9 (2019) 34065–34075. [38] S. Benadji P. Eloy A. Léonard B.L. Su K. Bachari C. Rabia E.M. Gaigneaux Microporous Mesoporous Mater. 130 2010 103 114 S. Benadji, P. Eloy, A. Léonard, B.L. Su, K. Bachari, C. Rabia, E.M. Gaigneaux, Preparation and characterization of HMS supported 11-molybdo-vanado-phosphoric acid for selective oxidation of propylene, Microporous Mesoporous Mater., 130 (2010) 103–114. [39] A. Micek-Ilnicka E. Bielańska L. Lityńska-Dobrzyńska A. Bielański Appl. Catal., A 421–422 2012 91 98 A. Micek-Ilnicka, E. Bielańska, L. Lityńska-Dobrzyńska, A. Bielański, Carbon nanotubes, silica and titania supported heteropolyacid H3PW12O40 as the catalyst for ethanol conversion, Appl. Catal., A, 421–422 (2012) 91–98. [40] R. Al-Faze A. Finch E.F. Kozhevnikova I.V. Kozhevnikov Appl. Catal. A 597 2020 117549 R. Al-Faze, A. Finch, E.F. Kozhevnikova, I.V. Kozhevnikov, Dehydration of methanol and ethanol over silica-supported heteropoly acids in the gas phase: Surface-type versus bulk-type catalysis mechanism, Appl. Catal., A, 597 (2020) 117549. [41] D.J. Yuan J.L. Yang A.M. Hengne Y.T. Lin C.Y. Mou K.W. Huang J. Saudi Chem. Soc. 24 2020 1 8 D.J. Yuan, J.L. Yang, A.M. Hengne, Y.T. Lin, C.Y. Mou, K.W. Huang, Mesoporous silica-supported V-substituted heteropoly acid for efficient selective conversion of glycerol to formic acid, J. Saudi Chem. Soc., 24 (2020) 1–8. [42] S. Magar G.T. Mohanraj S.K. Jana C.V. Rode Inorg. Nano Met. Chem. 50 2020 1157 1165 S. Magar, G.T. Mohanraj, S.K. Jana, C.V. Rode, Synthesis and characterization of supported heteropoly acid: Efficient solid acid catalyst for glycerol esterification to produce biofuel additives, Inorg. Nano Met. Chem., 50 (2020) 1157–1165. [43] N. Ballarini F. Candiracci F. Cavani H. Degrand J.L. Dubois G. Lucarelli M. Margotti A. Patinet A. Pigamo F. Trifirò Appl. Catal, A 325 2007 263 269 N. Ballarini, F. Candiracci, F. Cavani, H. Degrand, J.L. Dubois, G. Lucarelli, M. Margotti, A. Patinet, A. Pigamo, F. Trifirò, The dispersion of Keggin-type P/Mo polyoxometalates inside silica gel, and the preparation of catalysts for the oxidation of isobutane to methacrolein and methacrylic acid, Appl. Catal., A, 325 (2007) 263–269. [44] J.P. Tessonnier S. Goubert-Renaudin S. Alia Y. Yan M.A. Barteau Langmuir 29 2013 393 402 J.P. Tessonnier, S. Goubert-Renaudin, S. Alia, Y. Yan, M.A. Barteau, Structure, stability, and electronic interactions of polyoxometalates on functionalized graphene sheets, Langmuir, 29 (2013) 393–402. [45] A.D. Newman D.R. Brown P. Siril A.F. Lee K. Wilson Phys. Chem. Chem. Phys. 8 2006 2893 2902 A.D. Newman, D.R. Brown, P. Siril, A.F. Lee, K. Wilson, Structural studies of high dispersion H3PW12O40/SiO2 solid acid catalysts, Phys. Chem. Chem. Phys., 8 (2006) 2893–2902. [46] L.M. Deusser J.C. Petzoldt J.W. Gaube Ind. Eng. Chem. Res. 37 1998 3230 3236 L.M. Deusser, J.C. Petzoldt, J.W. Gaube, Kinetic model for methacrolein oxidations-influence of cesium and vanadium on heteropolyacid catalysts CsxH3-x+y[PMo12-yVyO40], Ind. Eng. Chem. Res., 37 (1998) 3230–3236. [47] W.J. Liu T. Du Q.X. Ru S.X. Zuo X.Y. Yang C. Yao Y. Kong Appl. Clay Sci. 153 2018 239 245 W.J. Liu, T. Du, Q.X. Ru, S.X. Zuo, X.Y. Yang, C. Yao, Y. Kong, Facile synthesis and characterization of 2D kaolin/CoAl2O4: A novel inorganic pigment with high near-infrared reflectance for thermal insulation, Appl. Clay Sci., 153 (2018) 239–245. [48] X.M. Qiu X.R. Lei A. Alshameri H.Q. Wang C.J. Yan Ceram. Int. 40 2014 5397 5405 X.M. Qiu, X.R. Lei, A. Alshameri, H.Q. Wang, C.J. Yan, Comparison of the physicochemical properties and mineralogy of Chinese (Beihai) and Brazilian kaolin, Ceram. Int., 40 (2014) 5397–5405. [49] R.A. Platova G.N. Maslennikova Y.T. Platov Glass Ceram. 2013 R.A. Platova, G.N. Maslennikova, Y.T. Platov, Biochemical method of removing iron from zhuravlinyi log kaolin, Glass Ceram., (2013). [50] C.Q. Li Z.M. Sun A.K. Song X.B. Dong S.L. Zheng D.D. Dionysiou Appl. Catal., B 236 2018 76 87 C.Q. Li, Z.M. Sun, A.K. Song, X.B. Dong, S.L. Zheng, D.D. Dionysiou, Flowing nitrogen atmosphere induced rich oxygen vacancies overspread the surface of TiO2/kaolinite composite for enhanced photocatalytic activity within broad radiation spectrum, Appl. Catal., B, 236 (2018) 76–87. [51] A. Hasan P. Fatehi Appl. Clay Sci. 158 2018 72 82 A. Hasan, P. Fatehi, Stability of kaolin dispersion in the presence of lignin-acrylamide polymer, Appl. Clay Sci., 158 (2018) 72–82. [52] Y. Hu X. Liu Miner. Eng. 16 2003 1279 1284 Y. Hu, X. Liu, Chemical composition and surface property of kaolins, Miner. Eng., 16 (2003) 1279–1284. [53] C.Q. Li Z.M. Sun X.B. Dong S.L. Zheng D.D. Dionysiou J. Catal. 367 2018 126 138 C.Q. Li, Z.M. Sun, X.B. Dong, S.L. Zheng, D.D. Dionysiou, Acetic acid functionalized TiO2/kaolinite composite photocatalysts with enhanced photocatalytic performance through regulating interfacial charge transfer, J. Catal., 367 (2018) 126–138. [54] Z.R. Wang W. Zheng Z.Q. Zhang L.K. Chen Z.F. Zhang Y. Li N. Ma P.Y. Du Appl. Clay Sci. 135 2017 378 385 Z.R. Wang, W. Zheng, Z.Q. Zhang, L.K. Chen, Z.F. Zhang, Y. Li, N. Ma, P.Y. Du, Formation of a kaolinite-serine intercalation compound via exchange of the pre-intercalated transition molecules in kaolinite with serine, Appl. Clay Sci., 135 (2017) 378–385. [55] F.Q. Zhang X.M. Zhang H.S. Wu H.J. Jiao J. Phys. Chem. A 111 2007 159 166 F.Q. Zhang, X.M. Zhang, H.S. Wu, H.J. Jiao, Structural and electronic properties of hetero-transition-metal Keggin anions: A DFT study of α/β-[XW12O40]n- (X =CrVI, VV, TiIV, FeIII, CoIII, NiIII, CoII, and ZnII) relative stability, J. Phys. Chem. A, 111 (2007) 159–166. [56] J. Chen F.F. Min L.Y. Liu C.C. Cai Fuel 266 2020 J. Chen, F.F. Min, L.Y. Liu, C.C. Cai, Systematic exploration of the interactions between Fe-doped kaolinite and coal based on DFT calculations, Fuel, 266 (2020). [57] X.Y. Wang Y.J. Huang Z.P. Zhong Z.G. Pan C.Q. Liu Fuel 166 2016 333 339 X.Y. Wang, Y.J. Huang, Z.P. Zhong, Z.G. Pan, C.Q. Liu, Theoretical investigation of cadmium vapor adsorption on kaolinite surfaces with DFT calculations, Fuel, 166 (2016) 333–339. [58] J.P. Perdew K. Burke M. Ernzerhof Phys. Rev. Lett. 77 1996 3865 3868 J.P. Perdew, K. Burke, M. Ernzerhof, Generalized gradient approximation made simple, Phys. Rev. Lett., 77 (1996) 3865–3868. [59] H. YASUJI INADA J. Comput. Chem. 29 2008 225 232 YASUJI INADA, H. ORITA, Efficiency of numerical basis sets for predicting the binding energies of hydrogen bonded complexes: evidence of small basis set superposition error compared to Gaussian Basis Sets, J. Comput. Chem., 29 (2008) 225–232. [60] P. Hohenberg W. Kohn Phys. Rev. 136 1964 864 871 P. Hohenberg, W. Kohn, Inhomogeneous electron gas, Phys. Rev., 136 (1964) 864–871. [61] K. Tandekar A. Tripathi M.D. Prasad S. Supriya Mater. Adv. 3 2022 5521 5531 K. Tandekar, A. Tripathi, M.D. Prasad, S. Supriya, Keggin based self-assembled mesoporous materials for the capture of selective guest molecules, Mater. Adv., 3 (2022) 5521–5531. [62] X.Y. Li L.J. Fu J. Ouyang H.M. Yang Colloids Surf., A 443 2014 72 79 X.Y. Li, L.J. Fu, J. Ouyang, H.M. Yang, Microwave-assisted synthesis and interfacial features of CdS/kaolinite nanocomposite, Colloids Surf., A, 443 (2014) 72–79. [63] Z. Shu T.T. Li J. Zhou Y. Chen D.X. Yu Y.X. Wang Appl. Clay Sci. 102 2014 33 40 Z. Shu, T.T. Li, J. Zhou, Y. Chen, D.X. Yu, Y.X. Wang, Template-free preparation of mesoporous silica and alumina from natural kaolinite and their application in methylene blue adsorption, Appl. Clay Sci., 102 (2014) 33–40. [64] L.L. Zhou L. Wang S.J. Zhang R.Y. Yan Y.Y. Diao J. Catal. 329 2015 431 440 L.L. Zhou, L. Wang, S.J. Zhang, R.Y. Yan, Y.Y. Diao, Effect of vanadyl species in Keggin-type heteropoly catalysts in selective oxidation of methacrolein to methacrylic acid, J. Catal., 329 (2015) 431–440. [65] N. Laronze C. Marchal-Roch N. Guillou F.X. Liu G. Hervé J. Catal. 220 2003 172 181 N. Laronze, C. Marchal-Roch, N. Guillou, F.X. Liu, G. Hervé, Solid-state chemistry of ammonium and cesium 1-vanado-11-molybdophosphate and ammonium 12-molybdosilicate: application to oxidation catalysis, J. Catal., 220 (2003) 172–181. [66] C.Q. Liu Y.J. Huang X.Y. Wang Z.C. Zhu M.Z. Yu C.S. Bu J.B. Zhang Fuel 286 2021 C.Q. Liu, Y.J. Huang, X.Y. Wang, Z.C. Zhu, M.Z. Yu, C.S. Bu, J.B. Zhang, Interactions of PbCl2 capture and CdCl2 capture by kaolin in the high-temperature PbCl2-CdCl2-Kaolin reaction system, Fuel, 286 (2021). [67] H. Zhang R.Y. Yan L. Yang Y.Y. Diao L. Wang S.J. Zhang Ind. Eng. Chem. Res. 52 2013 4484 4490 H. Zhang, R.Y. Yan, L. Yang, Y.Y. Diao, L. Wang, S.J. Zhang, Investigation of Cu- and Fe-doped CsH3PMo11VO40 heteropoly compounds for the selective oxidation of methacrolein to methacrylic Acid, Ind. Eng. Chem. Res., 52 (2013) 4484–4490. [68] J.K. Lee V. Russo J. Melsheimer K. Köhler R. Schlögl Phys. Chem. Chem. Phys. 2 2000 2977 2983 J.K. Lee, V. Russo, J. Melsheimer, K. Köhler, R. Schlögl, Genesis of V4+ in heteropoly compounds CsxH4-xPVMo11O40 during thermal treatment, rehydration and oxidation of methanol studied by EPR spectroscopy, Phys. Chem. Chem. Phys., 2 (2000) 2977–2983. [69] X.T. Gao C.Y. Yeh P. Angevine Microporous Mesoporous Mater. 70 2004 27 35 X.T. Gao, C.Y. Yeh, P. Angevine, Mechanistic study of organic template removal from ZSM-5 precursors, Microporous Mesoporous Mater., 70 (2004) 27–35. [70] A. Serrano-Lotina A.J. Martin M.A. Folgado L. Daza Int. J. Hydrog. Energy 37 2012 12342 12350 A. Serrano-Lotina, A.J. Martin, M.A. Folgado, L. Daza, Dry reforming of methane to syngas over La-promoted hydrotalcite clay-derived catalysts, Int. J. Hydrogen Energy, 37 (2012) 12342–12350. [71] S. Ishikawa T. Ikeda M. Koutani S. Yasumura K. Amakawa K. Shimoda Y. Jing T. Toyao M. Sadakane K.I. Shimizu W. Ueda J. Am. Chem. Soc. 144 2022 7693 7708 S. Ishikawa, T. Ikeda, M. Koutani, S. Yasumura, K. Amakawa, K. Shimoda, Y. Jing, T. Toyao, M. Sadakane, K.I. Shimizu, W. Ueda, Oxidation catalysis over solid-state Keggin-type phosphomolybdic acid with oxygen defects, J. Am. Chem. Soc., 144 (2022) 7693–7708. [72] H. He J.M. Hill Appl. Catal., A 317 2007 284 292 H. He, J.M. Hill, Carbon deposition on Ni/YSZ composites exposed to humidified methane, Appl. Catal., A, 317 (2007) 284–292.",
      "scopus-id": "85141326578",
      "coredata": {
        "eid": "1-s2.0-S0926860X22004653",
        "dc:description": "The application of heteropoly acid catalyst in methacrolein (MAL) oxidation reaction is limited for its poor thermal stability and few active centers. Here, the supported catalyst of P-Mo-V heteropoly acid (CsNH4KPMoV) active components supported on kaolin were prepared, and were characterized by FT-IR, TG/DTA, XRD, N2-adsorption and desorption, NH3-TPD, TPO-MS and XPS. The results show that kaolin was weak acidity and the negative charge on the surface of kaolin promoted the reduction of V5+ species to V4+(VO2+) active species. There was a strong electron interaction between kaolin and HPVA, and chemical adsorption occurred by DFT calculations. Under optimal conditions, higher MAL conversion (81.8%) and Methacrylic acid (MAA) selectivity (88.2%) were obtained by 50CsNH4KPMoV/kaolin catalyst. The Keggin structure was maintained and the acid strength and acidity did not decrease after the catalyst was used continuously for 100 h. There was no carbon deposition in the reaction process.",
        "openArchiveArticle": "false",
        "prism:coverDate": "2023-01-05",
        "openaccessUserLicense": null,
        "prism:aggregationType": "Journal",
        "prism:url": "https://api.elsevier.com/content/article/pii/S0926860X22004653",
        "dc:creator": [
          {
            "@_fa": "true",
            "$": "Zhu, Qianwen"
          },
          {
            "@_fa": "true",
            "$": "Zhu, Jing"
          },
          {
            "@_fa": "true",
            "$": "Li, Yang"
          },
          {
            "@_fa": "true",
            "$": "Zhang, Zhaobang"
          },
          {
            "@_fa": "true",
            "$": "Wang, Baohe"
          },
          {
            "@_fa": "true",
            "$": "Ma, Jing"
          }
        ],
        "link": [
          {
            "@_fa": "true",
            "@rel": "self",
            "@href": "https://api.elsevier.com/content/article/pii/S0926860X22004653"
          },
          {
            "@_fa": "true",
            "@rel": "scidir",
            "@href": "https://www.sciencedirect.com/science/article/pii/S0926860X22004653"
          }
        ],
        "dc:format": "application/json",
        "openaccessType": null,
        "pii": "S0926-860X(22)00465-3",
        "prism:volume": "649",
        "articleNumber": "118942",
        "prism:publisher": "Elsevier B.V.",
        "dc:title": "Kaolin supported heteropoly acid catalysts for methacrolein oxidation: Insights into the carrier acidity effect on active components",
        "prism:copyright": "© 2022 Elsevier B.V. All rights reserved.",
        "openaccess": "0",
        "prism:issn": "0926860X",
        "dcterms:subject": [
          {
            "@_fa": "true",
            "$": "Keggin heteropoly acid"
          },
          {
            "@_fa": "true",
            "$": "Kaolin"
          },
          {
            "@_fa": "true",
            "$": "Supported catalyst"
          },
          {
            "@_fa": "true",
            "$": "Methacrolein"
          },
          {
            "@_fa": "true",
            "$": "Methacrylic acid"
          }
        ],
        "openaccessArticle": "false",
        "prism:publicationName": "Applied Catalysis A: General",
        "openaccessSponsorType": null,
        "prism:pageRange": "118942",
        "pubType": "fla",
        "prism:coverDisplayDate": "5 January 2023",
        "prism:doi": "10.1016/j.apcata.2022.118942",
        "prism:startingPage": "118942",
        "dc:identifier": "doi:10.1016/j.apcata.2022.118942",
        "openaccessSponsorName": null
      },
      "objects": {
        "object": [
          {
            "@category": "standard",
            "@height": "258",
            "@width": "339",
            "@_fa": "true",
            "$": "https://api.elsevier.com/content/object/eid/1-s2.0-S0926860X22004653-gr8.jpg?httpAccept=%2A%2F%2A",
            "@multimediatype": "JPEG image file",
            "@type": "IMAGE-DOWNSAMPLED",
            "@size": "17924",
            "@ref": "gr8",
            "@mimetype": "image/jpeg"
          },
          {
            "@category": "standard",
            "@height": "232",
            "@width": "565",
            "@_fa": "true",
            "$": "https://api.elsevier.com/content/object/eid/1-s2.0-S0926860X22004653-gr7.jpg?httpAccept=%2A%2F%2A",
            "@multimediatype": "JPEG image file",
            "@type": "IMAGE-DOWNSAMPLED",
            "@size": "44668",
            "@ref": "gr7",
            "@mimetype": "image/jpeg"
          },
          {
            "@category": "standard",
            "@height": "506",
            "@width": "658",
            "@_fa": "true",
            "$": "https://api.elsevier.com/content/object/eid/1-s2.0-S0926860X22004653-gr9.jpg?httpAccept=%2A%2F%2A",
            "@multimediatype": "JPEG image file",
            "@type": "IMAGE-DOWNSAMPLED",
            "@size": "63246",
            "@ref": "gr9",
            "@mimetype": "image/jpeg"
          },
          {
            "@category": "standard",
            "@height": "258",
            "@width": "339",
            "@_fa": "true",
            "$": "https://api.elsevier.com/content/object/eid/1-s2.0-S0926860X22004653-gr2.jpg?httpAccept=%2A%2F%2A",
            "@multimediatype": "JPEG image file",
            "@type": "IMAGE-DOWNSAMPLED",
            "@size": "28142",
            "@ref": "gr2",
            "@mimetype": "image/jpeg"
          },
          {
            "@category": "standard",
            "@height": "265",
            "@width": "376",
            "@_fa": "true",
            "$": "https://api.elsevier.com/content/object/eid/1-s2.0-S0926860X22004653-gr1.jpg?httpAccept=%2A%2F%2A",
            "@multimediatype": "JPEG image file",
            "@type": "IMAGE-DOWNSAMPLED",
            "@size": "17523",
            "@ref": "gr1",
            "@mimetype": "image/jpeg"
          },
          {
            "@category": "standard",
            "@height": "219",
            "@width": "678",
            "@_fa": "true",
            "$": "https://api.elsevier.com/content/object/eid/1-s2.0-S0926860X22004653-gr4.jpg?httpAccept=%2A%2F%2A",
            "@multimediatype": "JPEG image file",
            "@type": "IMAGE-DOWNSAMPLED",
            "@size": "30504",
            "@ref": "gr4",
            "@mimetype": "image/jpeg"
          },
          {
            "@category": "standard",
            "@height": "254",
            "@width": "527",
            "@_fa": "true",
            "$": "https://api.elsevier.com/content/object/eid/1-s2.0-S0926860X22004653-gr3.jpg?httpAccept=%2A%2F%2A",
            "@multimediatype": "JPEG image file",
            "@type": "IMAGE-DOWNSAMPLED",
            "@size": "35210",
            "@ref": "gr3",
            "@mimetype": "image/jpeg"
          },
          {
            "@category": "standard",
            "@height": "260",
            "@width": "339",
            "@_fa": "true",
            "$": "https://api.elsevier.com/content/object/eid/1-s2.0-S0926860X22004653-gr6.jpg?httpAccept=%2A%2F%2A",
            "@multimediatype": "JPEG image file",
            "@type": "IMAGE-DOWNSAMPLED",
            "@size": "19800",
            "@ref": "gr6",
            "@mimetype": "image/jpeg"
          },
          {
            "@category": "standard",
            "@height": "260",
            "@width": "339",
            "@_fa": "true",
            "$": "https://api.elsevier.com/content/object/eid/1-s2.0-S0926860X22004653-gr11.jpg?httpAccept=%2A%2F%2A",
            "@multimediatype": "JPEG image file",
            "@type": "IMAGE-DOWNSAMPLED",
            "@size": "14358",
            "@ref": "gr11",
            "@mimetype": "image/jpeg"
          },
          {
            "@category": "standard",
            "@height": "257",
            "@width": "339",
            "@_fa": "true",
            "$": "https://api.elsevier.com/content/object/eid/1-s2.0-S0926860X22004653-gr5.jpg?httpAccept=%2A%2F%2A",
            "@multimediatype": "JPEG image file",
            "@type": "IMAGE-DOWNSAMPLED",
            "@size": "27407",
            "@ref": "gr5",
            "@mimetype": "image/jpeg"
          },
          {
            "@category": "standard",
            "@height": "244",
            "@width": "658",
            "@_fa": "true",
            "$": "https://api.elsevier.com/content/object/eid/1-s2.0-S0926860X22004653-gr10.jpg?httpAccept=%2A%2F%2A",
            "@multimediatype": "JPEG image file",
            "@type": "IMAGE-DOWNSAMPLED",
            "@size": "28558",
            "@ref": "gr10",
            "@mimetype": "image/jpeg"
          },
          {
            "@category": "standard",
            "@height": "260",
            "@width": "339",
            "@_fa": "true",
            "$": "https://api.elsevier.com/content/object/eid/1-s2.0-S0926860X22004653-gr13.jpg?httpAccept=%2A%2F%2A",
            "@multimediatype": "JPEG image file",
            "@type": "IMAGE-DOWNSAMPLED",
            "@size": "14471",
            "@ref": "gr13",
            "@mimetype": "image/jpeg"
          },
          {
            "@category": "standard",
            "@height": "259",
            "@width": "339",
            "@_fa": "true",
            "$": "https://api.elsevier.com/content/object/eid/1-s2.0-S0926860X22004653-gr12.jpg?httpAccept=%2A%2F%2A",
            "@multimediatype": "JPEG image file",
            "@type": "IMAGE-DOWNSAMPLED",
            "@size": "14306",
            "@ref": "gr12",
            "@mimetype": "image/jpeg"
          },
          {
            "@category": "standard",
            "@height": "260",
            "@width": "339",
            "@_fa": "true",
            "$": "https://api.elsevier.com/content/object/eid/1-s2.0-S0926860X22004653-gr15.jpg?httpAccept=%2A%2F%2A",
            "@multimediatype": "JPEG image file",
            "@type": "IMAGE-DOWNSAMPLED",
            "@size": "12269",
            "@ref": "gr15",
            "@mimetype": "image/jpeg"
          },
          {
            "@category": "standard",
            "@height": "257",
            "@width": "339",
            "@_fa": "true",
            "$": "https://api.elsevier.com/content/object/eid/1-s2.0-S0926860X22004653-gr14.jpg?httpAccept=%2A%2F%2A",
            "@multimediatype": "JPEG image file",
            "@type": "IMAGE-DOWNSAMPLED",
            "@size": "20714",
            "@ref": "gr14",
            "@mimetype": "image/jpeg"
          },
          {
            "@category": "standard",
            "@height": "255",
            "@width": "339",
            "@_fa": "true",
            "$": "https://api.elsevier.com/content/object/eid/1-s2.0-S0926860X22004653-gr17.jpg?httpAccept=%2A%2F%2A",
            "@multimediatype": "JPEG image file",
            "@type": "IMAGE-DOWNSAMPLED",
            "@size": "15762",
            "@ref": "gr17",
            "@mimetype": "image/jpeg"
          },
          {
            "@category": "standard",
            "@height": "70",
            "@width": "226",
            "@_fa": "true",
            "$": "https://api.elsevier.com/content/object/eid/1-s2.0-S0926860X22004653-sc1.jpg?httpAccept=%2A%2F%2A",
            "@multimediatype": "JPEG image file",
            "@type": "IMAGE-DOWNSAMPLED",
            "@size": "3372",
            "@ref": "sc1",
            "@mimetype": "image/jpeg"
          },
          {
            "@category": "standard",
            "@height": "249",
            "@width": "658",
            "@_fa": "true",
            "$": "https://api.elsevier.com/content/object/eid/1-s2.0-S0926860X22004653-gr16.jpg?httpAccept=%2A%2F%2A",
            "@multimediatype": "JPEG image file",
            "@type": "IMAGE-DOWNSAMPLED",
            "@size": "31507",
            "@ref": "gr16",
            "@mimetype": "image/jpeg"
          },
          {
            "@category": "standard",
            "@height": "260",
            "@width": "678",
            "@_fa": "true",
            "$": "https://api.elsevier.com/content/object/eid/1-s2.0-S0926860X22004653-sc2.jpg?httpAccept=%2A%2F%2A",
            "@multimediatype": "JPEG image file",
            "@type": "IMAGE-DOWNSAMPLED",
            "@size": "51354",
            "@ref": "sc2",
            "@mimetype": "image/jpeg"
          },
          {
            "@category": "standard",
            "@height": "200",
            "@width": "435",
            "@_fa": "true",
            "$": "https://api.elsevier.com/content/object/eid/1-s2.0-S0926860X22004653-ga1.jpg?httpAccept=%2A%2F%2A",
            "@multimediatype": "JPEG image file",
            "@type": "IMAGE-DOWNSAMPLED",
            "@size": "33145",
            "@ref": "ga1",
            "@mimetype": "image/jpeg"
          },
          {
            "@category": "thumbnail",
            "@height": "164",
            "@width": "215",
            "@_fa": "true",
            "$": "https://api.elsevier.com/content/object/eid/1-s2.0-S0926860X22004653-gr8.sml?httpAccept=%2A%2F%2A",
            "@multimediatype": "GIF image file",
            "@type": "IMAGE-THUMBNAIL",
            "@size": "7546",
            "@ref": "gr8",
            "@mimetype": "image/gif"
          },
          {
            "@category": "thumbnail",
            "@height": "90",
            "@width": "219",
            "@_fa": "true",
            "$": "https://api.elsevier.com/content/object/eid/1-s2.0-S0926860X22004653-gr7.sml?httpAccept=%2A%2F%2A",
            "@multimediatype": "GIF image file",
            "@type": "IMAGE-THUMBNAIL",
            "@size": "8655",
            "@ref": "gr7",
            "@mimetype": "image/gif"
          },
          {
            "@category": "thumbnail",
            "@height": "164",
            "@width": "213",
            "@_fa": "true",
            "$": "https://api.elsevier.com/content/object/eid/1-s2.0-S0926860X22004653-gr9.sml?httpAccept=%2A%2F%2A",
            "@multimediatype": "GIF image file",
            "@type": "IMAGE-THUMBNAIL",
            "@size": "8475",
            "@ref": "gr9",
            "@mimetype": "image/gif"
          },
          {
            "@category": "thumbnail",
            "@height": "164",
            "@width": "216",
            "@_fa": "true",
            "$": "https://api.elsevier.com/content/object/eid/1-s2.0-S0926860X22004653-gr2.sml?httpAccept=%2A%2F%2A",
            "@multimediatype": "GIF image file",
            "@type": "IMAGE-THUMBNAIL",
            "@size": "12979",
            "@ref": "gr2",
            "@mimetype": "image/gif"
          },
          {
            "@category": "thumbnail",
            "@height": "154",
            "@width": "219",
            "@_fa": "true",
            "$": "https://api.elsevier.com/content/object/eid/1-s2.0-S0926860X22004653-gr1.sml?httpAccept=%2A%2F%2A",
            "@multimediatype": "GIF image file",
            "@type": "IMAGE-THUMBNAIL",
            "@size": "5712",
            "@ref": "gr1",
            "@mimetype": "image/gif"
          },
          {
            "@category": "thumbnail",
            "@height": "71",
            "@width": "219",
            "@_fa": "true",
            "$": "https://api.elsevier.com/content/object/eid/1-s2.0-S0926860X22004653-gr4.sml?httpAccept=%2A%2F%2A",
            "@multimediatype": "GIF image file",
            "@type": "IMAGE-THUMBNAIL",
            "@size": "3160",
            "@ref": "gr4",
            "@mimetype": "image/gif"
          },
          {
            "@category": "thumbnail",
            "@height": "106",
            "@width": "219",
            "@_fa": "true",
            "$": "https://api.elsevier.com/content/object/eid/1-s2.0-S0926860X22004653-gr3.sml?httpAccept=%2A%2F%2A",
            "@multimediatype": "GIF image file",
            "@type": "IMAGE-THUMBNAIL",
            "@size": "6765",
            "@ref": "gr3",
            "@mimetype": "image/gif"
          },
          {
            "@category": "thumbnail",
            "@height": "164",
            "@width": "213",
            "@_fa": "true",
            "$": "https://api.elsevier.com/content/object/eid/1-s2.0-S0926860X22004653-gr6.sml?httpAccept=%2A%2F%2A",
            "@multimediatype": "GIF image file",
            "@type": "IMAGE-THUMBNAIL",
            "@size": "7432",
            "@ref": "gr6",
            "@mimetype": "image/gif"
          },
          {
            "@category": "thumbnail",
            "@height": "163",
            "@width": "213",
            "@_fa": "true",
            "$": "https://api.elsevier.com/content/object/eid/1-s2.0-S0926860X22004653-gr11.sml?httpAccept=%2A%2F%2A",
            "@multimediatype": "GIF image file",
            "@type": "IMAGE-THUMBNAIL",
            "@size": "5199",
            "@ref": "gr11",
            "@mimetype": "image/gif"
          },
          {
            "@category": "thumbnail",
            "@height": "164",
            "@width": "216",
            "@_fa": "true",
            "$": "https://api.elsevier.com/content/object/eid/1-s2.0-S0926860X22004653-gr5.sml?httpAccept=%2A%2F%2A",
            "@multimediatype": "GIF image file",
            "@type": "IMAGE-THUMBNAIL",
            "@size": "10338",
            "@ref": "gr5",
            "@mimetype": "image/gif"
          },
          {
            "@category": "thumbnail",
            "@height": "81",
            "@width": "219",
            "@_fa": "true",
            "$": "https://api.elsevier.com/content/object/eid/1-s2.0-S0926860X22004653-gr10.sml?httpAccept=%2A%2F%2A",
            "@multimediatype": "GIF image file",
            "@type": "IMAGE-THUMBNAIL",
            "@size": "4383",
            "@ref": "gr10",
            "@mimetype": "image/gif"
          },
          {
            "@category": "thumbnail",
            "@height": "164",
            "@width": "214",
            "@_fa": "true",
            "$": "https://api.elsevier.com/content/object/eid/1-s2.0-S0926860X22004653-gr13.sml?httpAccept=%2A%2F%2A",
            "@multimediatype": "GIF image file",
            "@type": "IMAGE-THUMBNAIL",
            "@size": "5269",
            "@ref": "gr13",
            "@mimetype": "image/gif"
          },
          {
            "@category": "thumbnail",
            "@height": "164",
            "@width": "215",
            "@_fa": "true",
            "$": "https://api.elsevier.com/content/object/eid/1-s2.0-S0926860X22004653-gr12.sml?httpAccept=%2A%2F%2A",
            "@multimediatype": "GIF image file",
            "@type": "IMAGE-THUMBNAIL",
            "@size": "5211",
            "@ref": "gr12",
            "@mimetype": "image/gif"
          },
          {
            "@category": "thumbnail",
            "@height": "164",
            "@width": "214",
            "@_fa": "true",
            "$": "https://api.elsevier.com/content/object/eid/1-s2.0-S0926860X22004653-gr15.sml?httpAccept=%2A%2F%2A",
            "@multimediatype": "GIF image file",
            "@type": "IMAGE-THUMBNAIL",
            "@size": "4742",
            "@ref": "gr15",
            "@mimetype": "image/gif"
          },
          {
            "@category": "thumbnail",
            "@height": "164",
            "@width": "217",
            "@_fa": "true",
            "$": "https://api.elsevier.com/content/object/eid/1-s2.0-S0926860X22004653-gr14.sml?httpAccept=%2A%2F%2A",
            "@multimediatype": "GIF image file",
            "@type": "IMAGE-THUMBNAIL",
            "@size": "7539",
            "@ref": "gr14",
            "@mimetype": "image/gif"
          },
          {
            "@category": "thumbnail",
            "@height": "164",
            "@width": "218",
            "@_fa": "true",
            "$": "https://api.elsevier.com/content/object/eid/1-s2.0-S0926860X22004653-gr17.sml?httpAccept=%2A%2F%2A",
            "@multimediatype": "GIF image file",
            "@type": "IMAGE-THUMBNAIL",
            "@size": "6409",
            "@ref": "gr17",
            "@mimetype": "image/gif"
          },
          {
            "@category": "thumbnail",
            "@height": "68",
            "@width": "219",
            "@_fa": "true",
            "$": "https://api.elsevier.com/content/object/eid/1-s2.0-S0926860X22004653-sc1.sml?httpAccept=%2A%2F%2A",
            "@multimediatype": "GIF image file",
            "@type": "IMAGE-THUMBNAIL",
            "@size": "2757",
            "@ref": "sc1",
            "@mimetype": "image/gif"
          },
          {
            "@category": "thumbnail",
            "@height": "83",
            "@width": "219",
            "@_fa": "true",
            "$": "https://api.elsevier.com/content/object/eid/1-s2.0-S0926860X22004653-gr16.sml?httpAccept=%2A%2F%2A",
            "@multimediatype": "GIF image file",
            "@type": "IMAGE-THUMBNAIL",
            "@size": "4645",
            "@ref": "gr16",
            "@mimetype": "image/gif"
          },
          {
            "@category": "thumbnail",
            "@height": "84",
            "@width": "219",
            "@_fa": "true",
            "$": "https://api.elsevier.com/content/object/eid/1-s2.0-S0926860X22004653-sc2.sml?httpAccept=%2A%2F%2A",
            "@multimediatype": "GIF image file",
            "@type": "IMAGE-THUMBNAIL",
            "@size": "8125",
            "@ref": "sc2",
            "@mimetype": "image/gif"
          },
          {
            "@category": "thumbnail",
            "@height": "101",
            "@width": "219",
            "@_fa": "true",
            "$": "https://api.elsevier.com/content/object/eid/1-s2.0-S0926860X22004653-ga1.sml?httpAccept=%2A%2F%2A",
            "@multimediatype": "GIF image file",
            "@type": "IMAGE-THUMBNAIL",
            "@size": "11023",
            "@ref": "ga1",
            "@mimetype": "image/gif"
          },
          {
            "@category": "high",
            "@height": "1139",
            "@width": "1497",
            "@_fa": "true",
            "$": "https://api.elsevier.com/content/object/eid/1-s2.0-S0926860X22004653-gr8_lrg.jpg?httpAccept=%2A%2F%2A",
            "@multimediatype": "JPEG image file",
            "@type": "IMAGE-HIGH-RES",
            "@size": "118244",
            "@ref": "gr8",
            "@mimetype": "image/jpeg"
          },
          {
            "@category": "high",
            "@height": "1023",
            "@width": "2495",
            "@_fa": "true",
            "$": "https://api.elsevier.com/content/object/eid/1-s2.0-S0926860X22004653-gr7_lrg.jpg?httpAccept=%2A%2F%2A",
            "@multimediatype": "JPEG image file",
            "@type": "IMAGE-HIGH-RES",
            "@size": "231018",
            "@ref": "gr7",
            "@mimetype": "image/jpeg"
          },
          {
            "@category": "high",
            "@height": "2238",
            "@width": "2910",
            "@_fa": "true",
            "$": "https://api.elsevier.com/content/object/eid/1-s2.0-S0926860X22004653-gr9_lrg.jpg?httpAccept=%2A%2F%2A",
            "@multimediatype": "JPEG image file",
            "@type": "IMAGE-HIGH-RES",
            "@size": "428665",
            "@ref": "gr9",
            "@mimetype": "image/jpeg"
          },
          {
            "@category": "high",
            "@height": "1138",
            "@width": "1497",
            "@_fa": "true",
            "$": "https://api.elsevier.com/content/object/eid/1-s2.0-S0926860X22004653-gr2_lrg.jpg?httpAccept=%2A%2F%2A",
            "@multimediatype": "JPEG image file",
            "@type": "IMAGE-HIGH-RES",
            "@size": "149956",
            "@ref": "gr2",
            "@mimetype": "image/jpeg"
          },
          {
            "@category": "high",
            "@height": "1171",
            "@width": "1663",
            "@_fa": "true",
            "$": "https://api.elsevier.com/content/object/eid/1-s2.0-S0926860X22004653-gr1_lrg.jpg?httpAccept=%2A%2F%2A",
            "@multimediatype": "JPEG image file",
            "@type": "IMAGE-HIGH-RES",
            "@size": "86739",
            "@ref": "gr1",
            "@mimetype": "image/jpeg"
          },
          {
            "@category": "high",
            "@height": "969",
            "@width": "2994",
            "@_fa": "true",
            "$": "https://api.elsevier.com/content/object/eid/1-s2.0-S0926860X22004653-gr4_lrg.jpg?httpAccept=%2A%2F%2A",
            "@multimediatype": "JPEG image file",
            "@type": "IMAGE-HIGH-RES",
            "@size": "187709",
            "@ref": "gr4",
            "@mimetype": "image/jpeg"
          },
          {
            "@category": "high",
            "@height": "1123",
            "@width": "2328",
            "@_fa": "true",
            "$": "https://api.elsevier.com/content/object/eid/1-s2.0-S0926860X22004653-gr3_lrg.jpg?httpAccept=%2A%2F%2A",
            "@multimediatype": "JPEG image file",
            "@type": "IMAGE-HIGH-RES",
            "@size": "247948",
            "@ref": "gr3",
            "@mimetype": "image/jpeg"
          },
          {
            "@category": "high",
            "@height": "1150",
            "@width": "1497",
            "@_fa": "true",
            "$": "https://api.elsevier.com/content/object/eid/1-s2.0-S0926860X22004653-gr6_lrg.jpg?httpAccept=%2A%2F%2A",
            "@multimediatype": "JPEG image file",
            "@type": "IMAGE-HIGH-RES",
            "@size": "127150",
            "@ref": "gr6",
            "@mimetype": "image/jpeg"
          },
          {
            "@category": "high",
            "@height": "1149",
            "@width": "1497",
            "@_fa": "true",
            "$": "https://api.elsevier.com/content/object/eid/1-s2.0-S0926860X22004653-gr11_lrg.jpg?httpAccept=%2A%2F%2A",
            "@multimediatype": "JPEG image file",
            "@type": "IMAGE-HIGH-RES",
            "@size": "92597",
            "@ref": "gr11",
            "@mimetype": "image/jpeg"
          },
          {
            "@category": "high",
            "@height": "1135",
            "@width": "1497",
            "@_fa": "true",
            "$": "https://api.elsevier.com/content/object/eid/1-s2.0-S0926860X22004653-gr5_lrg.jpg?httpAccept=%2A%2F%2A",
            "@multimediatype": "JPEG image file",
            "@type": "IMAGE-HIGH-RES",
            "@size": "193197",
            "@ref": "gr5",
            "@mimetype": "image/jpeg"
          },
          {
            "@category": "high",
            "@height": "1078",
            "@width": "2910",
            "@_fa": "true",
            "$": "https://api.elsevier.com/content/object/eid/1-s2.0-S0926860X22004653-gr10_lrg.jpg?httpAccept=%2A%2F%2A",
            "@multimediatype": "JPEG image file",
            "@type": "IMAGE-HIGH-RES",
            "@size": "198037",
            "@ref": "gr10",
            "@mimetype": "image/jpeg"
          },
          {
            "@category": "high",
            "@height": "1146",
            "@width": "1497",
            "@_fa": "true",
            "$": "https://api.elsevier.com/content/object/eid/1-s2.0-S0926860X22004653-gr13_lrg.jpg?httpAccept=%2A%2F%2A",
            "@multimediatype": "JPEG image file",
            "@type": "IMAGE-HIGH-RES",
            "@size": "90234",
            "@ref": "gr13",
            "@mimetype": "image/jpeg"
          },
          {
            "@category": "high",
            "@height": "1142",
            "@width": "1497",
            "@_fa": "true",
            "$": "https://api.elsevier.com/content/object/eid/1-s2.0-S0926860X22004653-gr12_lrg.jpg?httpAccept=%2A%2F%2A",
            "@multimediatype": "JPEG image file",
            "@type": "IMAGE-HIGH-RES",
            "@size": "90874",
            "@ref": "gr12",
            "@mimetype": "image/jpeg"
          },
          {
            "@category": "high",
            "@height": "1147",
            "@width": "1497",
            "@_fa": "true",
            "$": "https://api.elsevier.com/content/object/eid/1-s2.0-S0926860X22004653-gr15_lrg.jpg?httpAccept=%2A%2F%2A",
            "@multimediatype": "JPEG image file",
            "@type": "IMAGE-HIGH-RES",
            "@size": "73386",
            "@ref": "gr15",
            "@mimetype": "image/jpeg"
          },
          {
            "@category": "high",
            "@height": "1133",
            "@width": "1497",
            "@_fa": "true",
            "$": "https://api.elsevier.com/content/object/eid/1-s2.0-S0926860X22004653-gr14_lrg.jpg?httpAccept=%2A%2F%2A",
            "@multimediatype": "JPEG image file",
            "@type": "IMAGE-HIGH-RES",
            "@size": "137811",
            "@ref": "gr14",
            "@mimetype": "image/jpeg"
          },
          {
            "@category": "high",
            "@height": "1128",
            "@width": "1498",
            "@_fa": "true",
            "$": "https://api.elsevier.com/content/object/eid/1-s2.0-S0926860X22004653-gr17_lrg.jpg?httpAccept=%2A%2F%2A",
            "@multimediatype": "JPEG image file",
            "@type": "IMAGE-HIGH-RES",
            "@size": "102203",
            "@ref": "gr17",
            "@mimetype": "image/jpeg"
          },
          {
            "@category": "high",
            "@height": "308",
            "@width": "998",
            "@_fa": "true",
            "$": "https://api.elsevier.com/content/object/eid/1-s2.0-S0926860X22004653-sc1_lrg.jpg?httpAccept=%2A%2F%2A",
            "@multimediatype": "JPEG image file",
            "@type": "IMAGE-HIGH-RES",
            "@size": "15034",
            "@ref": "sc1",
            "@mimetype": "image/jpeg"
          },
          {
            "@category": "high",
            "@height": "1099",
            "@width": "2910",
            "@_fa": "true",
            "$": "https://api.elsevier.com/content/object/eid/1-s2.0-S0926860X22004653-gr16_lrg.jpg?httpAccept=%2A%2F%2A",
            "@multimediatype": "JPEG image file",
            "@type": "IMAGE-HIGH-RES",
            "@size": "211898",
            "@ref": "gr16",
            "@mimetype": "image/jpeg"
          },
          {
            "@category": "high",
            "@height": "1147",
            "@width": "2994",
            "@_fa": "true",
            "$": "https://api.elsevier.com/content/object/eid/1-s2.0-S0926860X22004653-sc2_lrg.jpg?httpAccept=%2A%2F%2A",
            "@multimediatype": "JPEG image file",
            "@type": "IMAGE-HIGH-RES",
            "@size": "281158",
            "@ref": "sc2",
            "@mimetype": "image/jpeg"
          },
          {
            "@category": "high",
            "@height": "886",
            "@width": "1928",
            "@_fa": "true",
            "$": "https://api.elsevier.com/content/object/eid/1-s2.0-S0926860X22004653-ga1_lrg.jpg?httpAccept=%2A%2F%2A",
            "@multimediatype": "JPEG image file",
            "@type": "IMAGE-HIGH-RES",
            "@size": "249150",
            "@ref": "ga1",
            "@mimetype": "image/jpeg"
          },
          {
            "@category": "standard",
            "@_fa": "true",
            "$": "https://api.elsevier.com/content/object/eid/1-s2.0-S0926860X22004653-am.pdf?httpAccept=%2A%2F%2A",
            "@multimediatype": "Acrobat PDF file",
            "@type": "AAM-PDF",
            "@size": "1045911",
            "@ref": "am",
            "@mimetype": "application/pdf"
          }
        ]
      },
      "link": {
        "@rel": "abstract",
        "@href": "https://api.elsevier.com/content/abstract/scopus_id/85141326578"
      }
    }
  }
}