{
  "metadata": {
    "title": "Contribution of Ca and V to enhancing coking-resistance and stability of MoV/CaO-intercalated montmorillonite catalyst in deoxydehydration of glycerol",
    "authors": "; ; ",
    "journal": "Applied Catalysis A: General",
    "date": "2023-09-05",
    "doi": "10.1016/j.apcata.2023.119355",
    "abstract": "",
    "uri": "https://api.elsevier.com/content/article/pii/S0926860X23003356",
    "pii": "S0926860X23003356"
  },
  "fulltext": {
    "full-text-retrieval-response": {
      "scopus-eid": "2-s2.0-85167450043",
      "originalText": "serial JL 271346 291210 291744 291809 31 Applied Catalysis A: General APPLIEDCATALYSISAGENERAL 2023-07-27 2023-07-27 2023-08-09 2023-08-09 2023-09-04T08:54:40 1-s2.0-S0926860X23003356 S0926-860X(23)00335-6 S0926860X23003356 10.1016/j.apcata.2023.119355 S300 S300.1 FULL-TEXT 1-s2.0-S0926860X23X00167 2024-01-01T12:35:59.692098Z 0 0 20230905 2023 2023-07-27T15:00:47.02917Z absattachment articleinfo articlenumber articletitlenorm authfirstinitialnorm authfirstsurnamenorm cid cids contenttype copyright crossmark dateloaded dateloadedtxt datesearch datesort dateupdated dco docsubtype doctype doi eid ewtransactionid hubeid indexeddate issn issnnorm itemstage itemtransactionid itemweight openaccess openarchive pg pgfirst pii piinorm pubdatestart pubdatetxt pubyr sortorder srctitle srctitlenorm srctype ssids alllist content subj subheadings suppl tomb volfirst volissue volumelist webpdf webpdfpagecount yearnav figure table body mmlmath acknowledge affil articletitle auth authfirstini authfull authkeywords authlast grantnumber grantsponsor grantsponsorid highlightsabst primabst ref specialabst 0926-860X 0926860X true 665 665 C Volume 665 12 119355 119355 119355 20230905 5 September 2023 2023-09-05 2023 article fla © 2023 Elsevier B.V. All rights reserved. CONTRIBUTIONCAVENHANCINGCOKINGRESISTANCESTABILITYMOVCAOINTERCALATEDMONTMORILLONITECATALYSTINDEOXYDEHYDRATIONGLYCEROL LI C 1 Introduction 2 Materials and methods 2.1 Materials 2.2 Catalyst preparation 2.2.1 Acidified Na-MMT 2.2.2 CaO-intercalated montmorillonite (CaxMMT, x is the loading amount of CaO) 2.2.3 Preparation of MoV/CaO intercalated MMT (MoxVy-CazMMT, x and y are the ratio of vanadium/molybdenum, while z is the additive amount of CaO) 2.3 Catalytic conversion of glycerol 2.4 Characterizations 3 Results and discussion 3.1 Structure and morphology of MoV-CaMMTcatalysts 3.2 Activity and coking studies over the MoV-CaMMT catalyst 3.2.1 Effects of different molar ratios and loading amounts of Mo/V 3.2.2 Effects of calcium content 3.3 Mechanism of resistance to carbon deposition 3.3.1 Stability evaluation of MoV-CaMMT catalyst 3.3.2 Study on synergistic of calcium and vanadium 4 Conclusion CRediT authorship contribution statement Acknowledgements References LIU 2022 27997 28008 Y KHAZAYIALIABAD 2021 5049 5063 A KORANIAN 2022 897 P VAZQUEZ 2020 349 358 E MULLER 2019 3 18 L LI 2016 143 150 X TSHIBALONZA 2017 3006 3013 N NAKAGAWA 2018 3879 3903 Y KON 2017 9864 9868 Y YI 2012 1401 1404 J CANALE 2014 3697 3704 V PETERSEN 2018 769 778 A DETHLEFSEN 2014 425 428 J DETHLEFSEN 2015 3638 3647 J FERNANDESBARBOSA 2023 F LIU 2019 108 L GUISNET 2009 69 83 M GUISNET 2001 83 96 M WU 2020 481 523 S SUN 2023 1657 1677 Y BAO 2022 T SUN 2017 3186 3213 D YANG 2016 353 361 X LI 2023 918 926 G OU 2023 126994 Z PIZZOLATO 2023 114041 M ZHAO 2013 154 162 H PHUAKPUNK 2020 156 172 K ISLAM 2020 117095 M HAFRIZ 2021 128 143 R ZATTA 2013 236 244 L HU 2012 103 112 T MA 2021 7180 Y NI 2008 1356 1361 M NAZDRACHEVA 2022 131871 T SARIER 2010 40 49 N YU 2017 1087 1100 W LI 2021 2568 M BENADJI 2010 103 114 S WANG 2018 14 24 J ETIM 2018 108 117 U JIANG 2016 99 108 B FJERMESTAD 2018 68 75 T SUPPIAH 2017 1367 1376 D SUPRUN 2009 71 78 W MAHDAVI 2016 114244 114255 V SUN 2020 16421 16431 D HAIDER 2015 1028 1032 M KABWE 2021 111969 F LI 2017 4439 4444 B YUN 2015 82 94 Y MA 2000 155 160 D VARZANEH 2018 13 21 A LIX2023X119355 LIX2023X119355XC 2025-08-09T00:00:00.000Z 2025-08-09T00:00:00.000Z http://creativecommons.org/licenses/by-nc-nd/4.0/ © 2023 Elsevier B.V. All rights reserved. 2023-08-15T03:29:30.606Z http://vtw.elsevier.com/data/voc/AddOnTypes/50.7/aggregated-refined https://doi.org/10.15223/policy-017 https://doi.org/10.15223/policy-037 https://doi.org/10.15223/policy-012 https://doi.org/10.15223/policy-029 https://doi.org/10.15223/policy-004 item S0926-860X(23)00335-6 S0926860X23003356 1-s2.0-S0926860X23003356 10.1016/j.apcata.2023.119355 271346 2024-01-01T12:35:59.692098Z 2023-09-05 1-s2.0-S0926860X23003356-main.pdf https://s3-eu-west-1.amazonaws.com/prod-ucs-content-store-eu-west/content/pii:S0926860X23003356/MAIN/application/pdf/cb43557ab29e6cb1845928ff6aa8903b/main.pdf main.pdf pdf true 4293932 MAIN 8 1-s2.0-S0926860X23003356-main_1.png https://s3-eu-west-1.amazonaws.com/prod-ucs-content-store-eu-west/content/pii:S0926860X23003356/PREVIEW/image/png/03174e7e7d92dc737531a51d1bcb7e1f/main_1.png main_1.png png 56715 849 656 IMAGE-WEB-PDF 1 1-s2.0-S0926860X23003356-gr5.jpg https://s3-eu-west-1.amazonaws.com/prod-ucs-content-store-eu-west/content/pii:S0926860X23003356/gr5/DOWNSAMPLED/image/jpeg/45dd9da5e16bcedb5b4b223e52df8032/gr5.jpg gr5 gr5.jpg jpg 32287 316 376 IMAGE-DOWNSAMPLED 1-s2.0-S0926860X23003356-gr6.jpg https://s3-eu-west-1.amazonaws.com/prod-ucs-content-store-eu-west/content/pii:S0926860X23003356/gr6/DOWNSAMPLED/image/jpeg/b6333d640ab50c4c2cefbd84e193a360/gr6.jpg gr6 gr6.jpg jpg 28337 300 376 IMAGE-DOWNSAMPLED 1-s2.0-S0926860X23003356-gr7.jpg https://s3-eu-west-1.amazonaws.com/prod-ucs-content-store-eu-west/content/pii:S0926860X23003356/gr7/DOWNSAMPLED/image/jpeg/07d41b89f59b3e55933e989f730db1dc/gr7.jpg gr7 gr7.jpg jpg 62296 338 791 IMAGE-DOWNSAMPLED 1-s2.0-S0926860X23003356-gr1.jpg https://s3-eu-west-1.amazonaws.com/prod-ucs-content-store-eu-west/content/pii:S0926860X23003356/gr1/DOWNSAMPLED/image/jpeg/c6adabb46b7804f66b8919456f0c44e2/gr1.jpg gr1 gr1.jpg jpg 62651 274 751 IMAGE-DOWNSAMPLED 1-s2.0-S0926860X23003356-gr2.jpg https://s3-eu-west-1.amazonaws.com/prod-ucs-content-store-eu-west/content/pii:S0926860X23003356/gr2/DOWNSAMPLED/image/jpeg/93484bf5e8735a3b0d30b64ddef35fef/gr2.jpg gr2 gr2.jpg jpg 38215 373 376 IMAGE-DOWNSAMPLED 1-s2.0-S0926860X23003356-ga1.jpg https://s3-eu-west-1.amazonaws.com/prod-ucs-content-store-eu-west/content/pii:S0926860X23003356/ga1/DOWNSAMPLED/image/jpeg/a27419297249db2bc3fe1784263b64ad/ga1.jpg ga1 true ga1.jpg jpg 21476 113 500 IMAGE-DOWNSAMPLED 1-s2.0-S0926860X23003356-gr3.jpg https://s3-eu-west-1.amazonaws.com/prod-ucs-content-store-eu-west/content/pii:S0926860X23003356/gr3/DOWNSAMPLED/image/jpeg/ac63e452dcee16726e3d06403797e45d/gr3.jpg gr3 gr3.jpg jpg 68790 299 791 IMAGE-DOWNSAMPLED 1-s2.0-S0926860X23003356-gr4.jpg https://s3-eu-west-1.amazonaws.com/prod-ucs-content-store-eu-west/content/pii:S0926860X23003356/gr4/DOWNSAMPLED/image/jpeg/afb9c41a9106e1535c10f5085fa742cb/gr4.jpg gr4 gr4.jpg jpg 48695 283 678 IMAGE-DOWNSAMPLED 1-s2.0-S0926860X23003356-gr5.sml https://s3-eu-west-1.amazonaws.com/prod-ucs-content-store-eu-west/content/pii:S0926860X23003356/gr5/THUMBNAIL/image/gif/4c905906cfcdab503fe7e247a6d85507/gr5.sml gr5 gr5.sml sml 9989 164 195 IMAGE-THUMBNAIL 1-s2.0-S0926860X23003356-gr6.sml https://s3-eu-west-1.amazonaws.com/prod-ucs-content-store-eu-west/content/pii:S0926860X23003356/gr6/THUMBNAIL/image/gif/93095b530a7b6df8296ceb721e236a35/gr6.sml gr6 gr6.sml sml 8467 164 205 IMAGE-THUMBNAIL 1-s2.0-S0926860X23003356-gr7.sml https://s3-eu-west-1.amazonaws.com/prod-ucs-content-store-eu-west/content/pii:S0926860X23003356/gr7/THUMBNAIL/image/gif/fb1e2649dd63432f6815b45605f0f7d8/gr7.sml gr7 gr7.sml sml 9124 94 219 IMAGE-THUMBNAIL 1-s2.0-S0926860X23003356-gr1.sml https://s3-eu-west-1.amazonaws.com/prod-ucs-content-store-eu-west/content/pii:S0926860X23003356/gr1/THUMBNAIL/image/gif/4eb558f05319dd2da8dc4ff002d3a805/gr1.sml gr1 gr1.sml sml 7414 80 219 IMAGE-THUMBNAIL 1-s2.0-S0926860X23003356-gr2.sml https://s3-eu-west-1.amazonaws.com/prod-ucs-content-store-eu-west/content/pii:S0926860X23003356/gr2/THUMBNAIL/image/gif/9c622a88e1928af8f4e8a2a89e7a1c24/gr2.sml gr2 gr2.sml sml 8258 164 165 IMAGE-THUMBNAIL 1-s2.0-S0926860X23003356-ga1.sml https://s3-eu-west-1.amazonaws.com/prod-ucs-content-store-eu-west/content/pii:S0926860X23003356/ga1/THUMBNAIL/image/gif/ed6ab67e5626f2863f4fea8dfc261b26/ga1.sml ga1 true ga1.sml sml 6185 50 219 IMAGE-THUMBNAIL 1-s2.0-S0926860X23003356-gr3.sml https://s3-eu-west-1.amazonaws.com/prod-ucs-content-store-eu-west/content/pii:S0926860X23003356/gr3/THUMBNAIL/image/gif/e428b5071dd3d209e45e9ce4a22f05bf/gr3.sml gr3 gr3.sml sml 11891 83 219 IMAGE-THUMBNAIL 1-s2.0-S0926860X23003356-gr4.sml https://s3-eu-west-1.amazonaws.com/prod-ucs-content-store-eu-west/content/pii:S0926860X23003356/gr4/THUMBNAIL/image/gif/94ed80e235243910811ac5b89b8505ff/gr4.sml gr4 gr4.sml sml 7800 91 219 IMAGE-THUMBNAIL 1-s2.0-S0926860X23003356-gr5_lrg.jpg https://s3-eu-west-1.amazonaws.com/prod-ucs-content-store-eu-west/content/pii:S0926860X23003356/HIGHRES/image/jpeg/1d591cfc3fec47d4ae95b59fbd543494/gr5_lrg.jpg gr5 gr5_lrg.jpg jpg 204243 1401 1665 IMAGE-HIGH-RES 1-s2.0-S0926860X23003356-gr6_lrg.jpg https://s3-eu-west-1.amazonaws.com/prod-ucs-content-store-eu-west/content/pii:S0926860X23003356/HIGHRES/image/jpeg/e62dd41fbae0ed3c7489f7742cdab811/gr6_lrg.jpg gr6 gr6_lrg.jpg jpg 155055 1329 1663 IMAGE-HIGH-RES 1-s2.0-S0926860X23003356-gr7_lrg.jpg https://s3-eu-west-1.amazonaws.com/prod-ucs-content-store-eu-west/content/pii:S0926860X23003356/HIGHRES/image/jpeg/d11c9e1a90d9f8586f4454b57b946d9f/gr7_lrg.jpg gr7 gr7_lrg.jpg jpg 307649 1493 3493 IMAGE-HIGH-RES 1-s2.0-S0926860X23003356-gr1_lrg.jpg https://s3-eu-west-1.amazonaws.com/prod-ucs-content-store-eu-west/content/pii:S0926860X23003356/HIGHRES/image/jpeg/afedb98d575fddce4ab65f4d8fdec674/gr1_lrg.jpg gr1 gr1_lrg.jpg jpg 318543 1214 3326 IMAGE-HIGH-RES 1-s2.0-S0926860X23003356-gr2_lrg.jpg https://s3-eu-west-1.amazonaws.com/prod-ucs-content-store-eu-west/content/pii:S0926860X23003356/HIGHRES/image/jpeg/f3a48e097a3001d89129c71af8ad95b6/gr2_lrg.jpg gr2 gr2_lrg.jpg jpg 206153 1648 1663 IMAGE-HIGH-RES 1-s2.0-S0926860X23003356-ga1_lrg.jpg https://s3-eu-west-1.amazonaws.com/prod-ucs-content-store-eu-west/content/pii:S0926860X23003356/HIGHRES/image/jpeg/b6845c15599937dda0ebcbaf0877c84a/ga1_lrg.jpg ga1 true ga1_lrg.jpg jpg 172520 502 2213 IMAGE-HIGH-RES 1-s2.0-S0926860X23003356-gr3_lrg.jpg https://s3-eu-west-1.amazonaws.com/prod-ucs-content-store-eu-west/content/pii:S0926860X23003356/HIGHRES/image/jpeg/6870f8bd244db42fa1be58602959aff1/gr3_lrg.jpg gr3 gr3_lrg.jpg jpg 317265 1319 3493 IMAGE-HIGH-RES 1-s2.0-S0926860X23003356-gr4_lrg.jpg https://s3-eu-west-1.amazonaws.com/prod-ucs-content-store-eu-west/content/pii:S0926860X23003356/HIGHRES/image/jpeg/0f069baa8fad6ba7b1073842a97d3da1/gr4_lrg.jpg gr4 gr4_lrg.jpg jpg 267788 1248 2994 IMAGE-HIGH-RES 1-s2.0-S0926860X23003356-si0001.svg https://s3-eu-west-1.amazonaws.com/prod-ucs-content-store-eu-west/content/pii:S0926860X23003356/image/svg+xml/d48eb6127d50e934aacf846201b2ebc4/si0001.svg si0001 si0001.svg svg 5458 ALTIMG 1-s2.0-S0926860X23003356-si0002.svg https://s3-eu-west-1.amazonaws.com/prod-ucs-content-store-eu-west/content/pii:S0926860X23003356/image/svg+xml/1d5a8984be7d43220eb6ebdb9371dcfd/si0002.svg si0002 si0002.svg svg 5191 ALTIMG 1-s2.0-S0926860X23003356-am.pdf https://s3-eu-west-1.amazonaws.com/prod-ucs-content-store-eu-west/content/egi:102XQGNJSVW/MAIN/application/pdf/ca8cedf42804004fab67d83e18d32aaa/am.pdf am am.pdf pdf false 2323457 AAM-PDF APCATA 119355 119355 S0926-860X(23)00335-6 10.1016/j.apcata.2023.119355 Elsevier B.V. Fig. 1 XRD patterns of the prepared catalyst: (a) CaxMMT (b) 5 wt% V-CaxMMT (c) 5 wt% MoxVy-CazMMT (CaxMMT, x wt% CaO; MoxVy-CazMMT, x, y is Mo/V ratio, z wt% CaO). Fig. 1 Fig. 2 FT-IR spectra of the prepared catalyst:(a) Na-MMT; (b) Ca3MMT; (c) UC-MoV-Ca1MMT; (d) Mo8V2-Ca1MMT; (e) Mo8V2-Ca2MMT; (f) Mo8V2-Ca5MMT ( CazMMT, MoxVy-CazMMT, x, y is Mo/V ratio, z wt.% CaO, uncalcined (UC)) Fig. 2 Fig. 3 SEM images of 5 wt % Mo8V2-CaMMT catalyst: (a-b)MoV-MMT; (c-d)Mo8V2-Ca1MMT; (e-f)Mo8V2-Ca2MMT; (g-h)Mo8V2-Ca5MMT (MoxVy-CazMMT, x, y is Mo/V ratio, z wt% CaO). Fig. 3 Fig. 4 Catalytic activity of Mo8V2-MMT catalyst: (a) different Mo/(Mo+V) molar ratios loading; (b)different Mo/V oxides loading(0.5 g MoxVy-MMT, x, y is Mo/V ratio, 60–80 mesh; 20 mL/min air flow rate, 20 wt % glycerol feed at 0.1 mL/min, 320 ℃). Fig. 4 Fig. 5 Catalytic activity of 5 wt % Mo8V2-MMT, Mo8V2-Ca2MMT and Mo8V2-Ca5MMT catalyst within 5 h (0.5 g MoxVy-CaxMMT, x, y is Mo/V ratio, z wt% CaO, 60–80 mesh; 20 mL/min air flow rate, 20 wt % glycerol feed at 0.1 mL/min, 320 ℃). Fig. 5 Fig. 6 TG profiles of spent-V-Ca2MMT and spent-Mo8V2-Ca2MMT catalysts (Samples stay at 100 ℃ for 30 min; MoxVy-CazMMT, x, y is Mo/V ratio, z wt% CaO). Fig. 6 Fig. 7 Study on the synergistic of VOx and CaO and the change of active site by MoOx: (a, b, c) XPS spectra of V-Ca2MMT; (e, f, g) XPS spectra of spent-V-Ca2MMT (V-CaxMMT, x wt% CaO); (d, h) TPD of V-Ca2MMT and Mo8V2-Ca2MMT. Fig. 7 Table 1 Glycerol conversion and product selectivity of 5 wt% Mo8V2-CaMMT catalyst with different CaO content. Table 1 Catalyst Conversion X (%) Selectivity Si (%) acrolein allyl alcohol acetol ethylal ethanol acrylicacid Mo8V2-Ca1MMT 59.9 17.6 27.2 26.1 4.5 8.6 3.6 Mo8V2-Ca2MMT 86.5 21.0 31.6 19.6 5.2 10.7 2.6 Mo8V2-Ca3MMT 57.6 15.6 36.3 23.9 6.0 10.8 4.2 Mo8V2-Ca4MMT 40.9 30.1 28.0 27.8 6.7 13.3 2.1 Mo8V2-Ca5MMT 33.7 33.7 23.6 24.7 7.1 9.2 3.1 (MoxVy-CazMMT, x and y are Mo/V ratio, z wt% CaO. Reaction conditions: 320 ℃, air atmosphere, carrier gas flow rate of 20 mL/min, raw material of 20 wt % glycerol aqueous solution, through the injection pump at 0.1 mL/min into the fixed bed reactor. Other products are: acetic acid, acetone, propionic acid, 1, 2-propylene glycol not listed.) Contribution of Ca and V to enhancing coking-resistance and stability of MoV/CaO-intercalated montmorillonite catalyst in deoxydehydration of glycerol Cheng Cang Li Data curation Conceptualization Investigation a b c Da Jian Li Writing – review & editing a b c Shu Tian Yin Investigation a b c Ze Zhen Wang a b c Chen Lan Liu a b c Chun Hui Zhou Conceptualization Methodology Supervision Funding acquisition Investigation a b c ⁎ a Research Group for Advanced Materials & Sustainable Catalysis (AMSC), State Key Laboratory Breeding Base of Green Chemistry-Synthesis Technology, College of Chemical Engineering, Zhejiang University of Technology, Hangzhou 310032, China Research Group for Advanced Materials & Sustainable Catalysis (AMSC), State Key Laboratory Breeding Base of Green Chemistry-Synthesis Technology, College of Chemical Engineering, Zhejiang University of Technology Hangzhou 310032 China Research Group for Advanced Materials & Sustainable Catalysis (AMSC), State Key Laboratory Breeding Base of Green Chemistry-Synthesis Technology, College of Chemical Engineering, Zhejiang University of Technology, Hangzhou 310032, China. b Qing Yang Institute for Industrial Minerals, You Hua, Qing Yang, Chi Zhou 242804, China Qing Yang Institute for Industrial Minerals You Hua Qing Yang Chi Zhou 242804 China Qing Yang Institute for Industrial Minerals, You Hua, Qing Yang, Chi Zhou 242804, China c Engineering Research Center of Non-metallic Minerals of Zhejiang Province, Zhejiang Institute of Geology and Mineral Resources, Hangzhou 310007, China Engineering Research Center of Non-metallic Minerals of Zhejiang Province, Zhejiang Institute of Geology and Mineral Resources Hangzhou 310007 China Engineering Research Center of Non-metallic Minerals of Zhejiang Province, Zhejiang Institute of Geology and Mineral Resources, Hangzhou 310007, China ⁎ Corresponding author at: Research Group for Advanced Materials & Sustainable Catalysis (AMSC), State Key Laboratory Breeding Base of Green Chemistry-Synthesis Technology, College of Chemical Engineering, Zhejiang University of Technology, Hangzhou 310032, China. Research Group for Advanced Materials & Sustainable Catalysis (AMSC), State Key Laboratory Breeding Base of Green Chemistry-Synthesis Technology, College of Chemical Engineering, Zhejiang University of Technology Hangzhou 310032 China Glycerol can be converted to allyl alcohol via deoxydehydration using molybdenum-vanadium, rhenium and iron based catalysts. However, the dehydration causes severe coking at strong acid sites on the surface of catalyst. Molybdenum-vanadium oxide supported on calcium oxide-intercalated montmorillonite (MoV-CaMMT) was prepared by oxalate anion intercalation followed by impregnation. MoV-CaMMT displayed the best catalytic performance of 86.5% glycerol conversion and good stability in 5 h. Correlating the results of XRD, XPS and TG analysis, it can be demonstrated that the addition of CaO in the catalyst preparation is conducive to the crystallization and dispersion of vanadium oxides, and reduces the acid strength, while the presence of a few vanadium dioxide and the stable conversion of V4+ and V5+ are the reasons for enhancing coking-resistance of MoV-CaMMT. Additionally, NH3-TPD analysis proved the coexistence of weak and strong acid sites in MoVOx, which are conducive to the formation of acetol. Graphical Abstract ga1 Keywords Glycerol Allyl alcohol Deoxydehydration Coking-resistance Montmorillonite Molybdenum-vanadium Data Availability No data was used for the research described in the article. 1 Introduction Crude glycerol is the main by-product (about 10% of biodiesel) in biodiesel production by transesterification [1]. With the rapid increase of biodiesel production, crude glycerol production has been simultaneously increased approximately to 50 billion liters in year 2021 [2]. However, the traditional glycerol industry cannot consume the increasing production of crude glycerol and this obviously causes lower the price of crude glycerol [3]. Finding an innovative approach to convert crude glycerol into other high value-added chemicals through chemical reaction can not only broaden the way of glycerol consumption but also improve the comprehensive income of biodiesel [3–5]. Allyl alcohol is an intermediate product obtained by deoxydehydration (DODH) or dehydration and hydrogen transfer of glycerol. The DODH process of glycerol induced by formic acid enables glycerol to continuously produce allyl alcohol in the liquid phase, and then convert to acrylic acid through the subsequent oxidation reaction [6]. Tshibalonza et al. [7] designed a microfluidic reaction device for continuous-flow glycerol deoxidation and dehydration at high temperature (300 ℃). Although the glycerol conversion and allyl alcohol selectivity obtained by liquid phase reaction of the microfluidic device were not as high as those obtained by formic acid induced glycerol deoxidation and dehydration process operated by distillation, this method has the characteristics of short reaction time (1–6 min) and easy operation. Deoxydehydration with formic acid is difficult to use in the industry due to its poor atomic economy, which requires complex distillation and purification of allyl alcohol. Also, formic acid is converted into water and carbon dioxide during repeated heating, cooling, and replenishing of the solution [8,9]. Glycerol can be converted to acrolein, propanal and allyl alcohol at 165 ℃ under the catalysis of rhenium methyl trioxide (CH3ReO3, MTO) [9]. The selectivity of allyl alcohol can be enhanced from 72% to either 75% or 97% with the addition of a small quantity of potassium chloride or octanol respectively [10]. MTO showed excellent catalytic performance in the catalytic deoxidation and dehydration of glycerol in organic and aqueous solvents. Due to the high price of MTO, Canale et al. [11] evaluated the catalytic activity of relatively inexpensive rhenium derivatives (ReO3, NH4ReO4, Re2(CO)10, Cp*ReO3) in glycerol dehydrating oxidation reactions. It is found that MTO and ReO3 can catalyze glycerol deoxidation and dehydration at comparatively low temperature (140 ℃), while other rhenium catalysts are active at higher temperatures (170 ℃). Although rhenium catalysts are effective for the DODH reaction of glycerol, their high cost and instability make it difficult to commercialize. In addition to rhenium catalysts that exhibit unique activity in DODH, vanadium and molybdenum catalysts have been reported for the catalysis of glycerol DODH to produce allyl alcohol without additional hydrogen sources. Allan et al. [12] found that NH4VO3 was an effective catalyst for glycerol deoxidation and dehydration, and the yield of allyl alcohol produced by the reaction was higher than that of MTO. In the experiment of deuterated glycerol as reactant, it was confirmed that glycerol was converted to allyl alcohol by NH4VO3. Besides, (NH4)6Mo7O24 and other molybdenum compounds can be potentially fungible for the rhenium in the catalytic DODH of aliphatic diols into the corresponding alkenes [13]. The DODH of glycerol yields allyl alcohol, which undergoes subsequent molybdenum catalyzed deoxygenation to propylene driven by oxidation of isopropanol [14]. Both solid acid and metal oxide catalysts have demonstrated excellent catalytic activity in glycerol dehydration, oxidation, deoxydehydration and other reactions, but many catalysts fail to counter the problem of loss of activity after carbon deposition [15]. In the process of catalytic glycerol oxidation and dehydration, the catalyst will be deactivated due to changes in physical structure, active site poisoning, carbon accumulation, thermal decomposition of active substances and other reasons; the main reason is that in the reaction between glycerol, acrolein and acetol molecules, there is a high chance of polymerization which may form a large number of carbon deposits an coke [16–18]. Thus, it has of great importance to prepare coking-resistance catalysts by controlling the acid strength and acidity types of catalysts (Brønsted and Lewis acid sites) to avoid the precursor polycondensation and other secondary reactions involved in the formation of coke [15,19]. The coke-deposition behavior of catalysts can also be affected by improving the dispersion of the supported metal oxides or adding additional active components [20,21]. And the addition of precious metals (Ru, Pd, Pt) to solid acid catalysts is conducive to inhibiting catalyst deactivation, because the carbon substrate is introduced into the lattice of precious metals and effectively reduces deposition on the catalyst [22]. The addition of CeO2 increased the dispersion of nickel, and Mg, Ba, and Ca promoters increased the basicity of the nickel-based catalyst. these are useful for coking-resistance in dry reforming of methane [23,24]. Ou et al. found the addition of alkaline oxides (CaO, MgO, ZnO and La2O3) facilitate the adsorption and activation of CO2 and accelerate the elimination of carbon deposition by providing more oxygen species [25]. In addition, the catalyst doped with vanadium species showed better catalytic activity in the dry reforming process of methane, and the hydrogen yield was increased under dilution conditions, and the coking-resistance of the catalyst was enhanced after combining with calcium carbonate[26]. Therefore, there may be synergistic effects of vanadium and calcium in acid catalysts, precious metal catalysts or metal oxide catalysts to enhance their coking-resistance. Additionally, the impact of free H+ for the acid-activated montmorillonite (MMT) on glycerol dehydration was insignificant, whereas appropriate medium-strong acidic sites exhibited remarkable catalytic activity towards glycerol conversion [27]. Dolomite or calcium oxide (CaO) catalysts can be used as basic catalysts for steam reforming [28], catalytic cracking [29], deoxidation and dehydration[30]. Therefore, it remains to be studied how to add basic sites to acid catalysts with strong acid sites to prepare the catalyst with appropriate acidity and basic sites to catalyze the products of glycerol dehydration or dehydration oxidation reaction and the catalytic mechanism. And whether basic species can be added, which usually cannot coexist with basic species to tune enhancing coking-resistance and stability of catalyst remain elusive. Molybdenum-vanadium (Mo/V) compounds have been shown to catalyze the deoxidation and dehydration of glycerol to produce allyl alcohol directly, but the coking of the catalysts is not considered in these experiments. In this work, we identified catalyst materials with optimal Mo/V ratios for glycerol deoxidation and dehydration, and assessed the activity and coking-resistance of these catalysts impregnated with Mo/V (at optimal ratios) supported by varying amounts of CaO-intercalated MMT. Additionally, we investigated the mechanism behind their coking-resistance. 2 Materials and methods 2.1 Materials Glycerol (AR, 99 %), ((NH4)6Mo7O24·4H2O) and NH4VO3 were purchased from Aladdin. H3PO4 (85 wt % in H2O) was purchased from Sinopharm Chemical Reagent Co., Ltd. Na-MMT (Na-MMT) was purchased from Qingyang, Anhui, China. CaO (AR, 98 %) and oxalic acid (AR, 99 %) was purchased from Shanghai Lingfeng. 2.2 Catalyst preparation 2.2.1 Acidified Na-MMT Na-MMT was acidified by 1 mol/L H3PO4 aqueous solution. Specifically, a mixture of Na-MMT and 1 mol/L H3PO4 aqueous solution (mass ratio of 1: 19) was placed in a round-bottomed flask and the mixture was stirred at 80 ℃ for 4 h. After the mixture cooling down to room temperature, the mixture was separated by centrifugation at 4000 rpm for 5 min. The obtained solid product was washed with deionized water to neutrality and then dried at 80 ℃ for 24 h to obtain acid-activated MMT. Ammonium metavanadate was dissolved in oxalic acid solution to obtain a vanadium oxalate complex solution, which was then mixed with calcium-containing compounds and acidified MMT for 6 h. After standing, ammonium molybdate tetrahydrate was added and impregnated for 24 h before being heated in an oven and muffle furnace at temperatures ranging from 500 ℃ to 800 ℃ to burn off calcium oxalate. 2.2.2 CaO-intercalated montmorillonite (CaxMMT, x is the loading amount of CaO) CaxMMT: a stipulated amount of oxalic acid (0.225 g) with an equal molar ratio of CaO (0.25 g) was placed in 50 mL beaker, then 15 mL deionized water was poured into the beaker to dissolve oxalic acid solution. Then, 5 g of acidified MMT was added into oxalic acid solution and stirred for 2 h at room temperature. Subsequently, 0.25 g of CaO was added and stir for another 2 h. The mixed solution was then poured into the evaporating dish and dried in the oven at 80 ℃ for 24 h, followed by calcination at 500 ℃ at 5 ℃/min in a muffle furnace for 4 h and then at 800 ℃ for 1 h to obtain Ca5MMT. Ca1MMT, Ca2MMT, Ca3MMT and Ca4MMT catalysts were also prepared by changing the molar ratios of CaO and oxalic acid. 2.2.3 Preparation of MoV/CaO intercalated MMT (MoxVy-CazMMT, x and y are the ratio of vanadium/molybdenum, while z is the additive amount of CaO) On the basis of CaxMMT, MoxVy-CazMMT was prepared by an impregnation method. In this procedure, the total impregnated vanadium molybdenum of 5 wt % and the molar ratio of vanadium molybdenum of 8: 2, 1 wt % of CaO were taken as examples: a weighed amount (0.12 g) of oxalic acid was placed into a 50 mL beaker and then dissolved by adding 15 mL of deionized water and stirred. Then, 0.043 g of ammonium metadadate was added into the prepared oxalic acid solution, stir until completely dissolved to obtain the oxalate complex solution. Subsequently, a 3 g of acidified MMT and 0.03 g of CaO were added into the vanadium oxalate complex solution, stirred for 4 h, then allowed to stand for 12 h at room temperature. Then adding 0.29 g ammonium molybdate tetrahydrate, the mixture was agitated for 6 h, impregnating for 24 h, and put them in oven at 80 ℃ for drying. After being completely dried, the product was placed into a Muffle furnace and calcined at 500 ℃ with the heating rate of 5 ℃/min for 4 h and then at 800 ℃ for 1 h. After grinding and sifting to 60–80 mesh, Mo8V2-Ca1MMT catalysts were obtained and stored for further use. Mo8V2-Ca2MMT, Mo8V2-Ca3MMT and Mo8V2-Ca4MMT catalysts were also prepared using the same procedure by changing the amount of CaO to 0.06, 0.09, 0.12 and 0.15 g, respectively. 2.3 Catalytic conversion of glycerol The conversion of glycerol using these catalysts was carried out in a fixed-bed flow reactor for 5 h at the reaction temperature of 320 ℃ under atmospheric pressure. The 20 wt% glycerol aqueous solution was used as a feedstock and fed to the reactor with a syringe pump at a rate of 0.1 mL/min. The products were collected for every 1 h after condensation and analyzed by a gas chromatograph equipped with a flame ionization detector (FID) (GC-2014; Shimadzu Co. Ltd.). 2.4 Characterizations X-ray diffraction (XRD) patterns were recorded with a PANalytical X’Pert PRO powder diffractometer using Cu Kα radiation (λ = 0.1541 nm). The working voltage was 40 kV and the working current was 40 mA. The patterns were collected with a 2θ range from 2° to 80° at a step of 0.0167°. The FT-IR spectra of catalyst were recorded on a Nicolet 6700 FT-IR spectrophotometer in the range of 400–4000 cm-1. Gaschromatography (GC): The liquid products after catalytic reaction were analyzed with gaschromatography (Shimadzu GC-2014) equipped with a flame ionization detector (FID) and capillary column. Thermogravimetric Analysis (TGA) was carried out at a heating rate of 10 ℃/min from 25 ℃ up to 100 ℃, equilibration at 100 ℃ for 30 min, and 10 ℃/min from 100 ℃ up to 800 ℃ under an air flow of 50 mL/min. Glycerol conversion and product selectivity were then calculated using Eqs. (1)–(2). (1) Glycerolconversion ( % ) = Molesofglycerolreacted Molesofglycerolfed × 100 (2) Productselectivity ( % ) = Molesofglycerolreacted Glycerolconversion × 100 NH3-TPD profile was measured on a MicroActive for AutoChem II 2920 Version 6.01. A sample of 80 mg was pretreated in He (30 mL/min) at 300 ℃ for 1 h, and the sample was treated with 10% NH3/He gas mixture (30 mL/min) for 1 h after cooling to 50 ℃. Subsequently, the sample was purged in He (30 mL/min) for 1 h to remove weakly physically adsorbed NH3. Finally, the temperature was programmed at a heating rate of 10 ℃/min to 700 ℃ to desorb the chemically absorbed NH3. X-ray photoelectron spectroscopy (XPS) measurements were performed on a SPECS Spectrometer equipped with a Phoibos 150 MCD-9 detector using a monochromatic Al Kα (1486.6 eV) X-ray source. Spectra were recorded using analyzer pass energy of 50 V, an X-ray power of 200 W, and operating pressure of 10-9 mbar. The morphology of the prepared catalysts was observed through a field emission scanning electron microscope (FE-SEM, HITACHI Regulus 8100) at an acceleration voltage of 15 kV. The related elemental distribution was analyzed with energy-dispersive X-ray spectroscopy (EDS, Oxford Ultim Max 65). 3 Results and discussion 3.1 Structure and morphology of MoV-CaMMTcatalysts The XRD patterns of the CaO-intercalated MMT samples (CaxMMT) shows an intense peak of MMT ( Fig. 1 (a)). The peaks at 2θ = 6.9°, 19.7°, 63°were due to the (001), (020), (060) planes of MMT [31,32]. Moreover, the presence of purity in MMT leads to the peak of quartz (2θ = 21.8°, 2θ = 28°, and 2θ = 36°) [32]. The peaks of (001) crystal surface of CaxMMT at 1, 3 and 5 wt% are located at 2θ = 9.1°, 2θ = 8.8° and 2θ = 8.5°, respectively. The corresponding lamellar spacing of MMT is d001 = 0.97 nm, d001 = 1.00 nm and d001 = 1.03 nm, respectively. Meanwhile, the peaks of CaO (2θ = 28°, 2θ = 35.7° and 2θ = 56.7°) and calcium carbonate (2θ = 31°) appear in the XRD patterns of CaxMMT [33]. It shows that calcium oxalate is not completely decomposed into CaO in the process of calcination of calcium oxalate at high temperature, and partial calcium carbonate is produced. The spacing of CaMMT layers was found to be directly affected by the content of CaO. V-MMT and V-Ca2MMT, V-Ca4MMT and V-Ca6MMT samples all exhibited peaks at 2θ = 16.4° on the (003) crystal surface of MMT and the peak 2θ = 20.5° on the (100) crystal surface. In addition, there are also V2O5 peaks at 2θ = 26.4° and 2θ = 31.2° (Fig. 1 (b)). The diffraction peak at 2θ = 26.4°, corresponding to the (301) crystal surface of V2O5 in V-MMT, becomes sharper in V-CaMMT, which indicates that the presence of CaO is conducive to the perfection of V2O5 crystallization and the enlargement of grain size to some extent [34]. The intensity of peak 2θ = 26.4° of V2O5 decreases with the increase of CaO content, which is caused by the over population of V2O5, CaO and CaCO3 species on the surface of MMT. Fig. 1 (c) displayed all the characteristic diffraction peaks of V2O5 and MO3 in the diffractogram of the catalyst samples. The characteristic diffraction peaks of V2O5 are found at 2θ = 25.3° and 2θ = 31.2°, and the characteristic diffraction peaks for (040) and (140) plane of MO3 are obtained at 2θ = 23.1° and 2θ = 26.3°, respectively (Fig. 1 (c)). FT-IR spectra of 5 wt% MoV-CaMMT catalyst prepared by the intercalation method ( Fig. 2), and the infrared absorption bands corresponding to different functional groups. According to the infrared absorption spectra of Na-MMT (Fig. 2 (a)), the 462 cm-1 and 523 cm-1 bands correspond to the Si–O–Si bend vibration and Al–O–Si bend vibration of MMT structure, respectively [35]. And 788 cm-1 and 1041 cm-1 correspond to Si–O–Si stretches in silico-oxygen tetrahedron structure [36]. Meanwhile, the 916 cm-1 peak corresponds to Al–O–(OH)–Al stretching vibration in MMT structure [37]; 3417 cm-1 corresponds to Si–OH stretches vibration [37]. In addition, 1632 cm-1 and 3612 cm-1 correspond to the bending and stretching vibrations of –OH of adsorbed water molecules of MMT respectively. Among them, 1637 cm-1, 1650 cm-1 and 3626 cm-1 are the infrared absorption bands of carbonate and calcium oxide, respectively [38]. SEM analysis showed that the MoV-MMT catalyst ( Fig. 3 (a, b)) has a smooth surface, and particles of carbonate and Mo/V oxides can also be seen [39–41]. From Fig. 3 (b), the stacking structure of MMT layers can be observed [42]. With the increase of CaO content, the surface of the catalyst became rougher due to the increase of oxide particles. The surface of the V-CazMMT containing 5 wt % CaO was covered by oxide, and the agglomeration of CaO and Mo/V oxide particles was obvious, which was consistent with the XRD analysis. 3.2 Activity and coking studies over the MoV-CaMMT catalyst 3.2.1 Effects of different molar ratios and loading amounts of Mo/V From the characterization results and discussion above, the optimum molybdenum-vanadium molar ratio was Mo/(Mo+V)= 8, that is, Mo8V2-MMT catalyst, which reached the highest catalytic glycerol conversion within 3 h, and the corresponding selectivities of allyl alcohol and acrolein were 37.9 % and 30.6 % ( Fig. 4 (a)). The highest glycerol conversion and allyl alcohol selectivity of 5 wt% Mo8V2-MMT might be ascribed to the appropriate MoVOx phase formed by the appropriate Mo/V ratio [43]. In this regard, the existence of MoVOx phase is beneficial to activate the C–H bond of light olefin and thus enhance the selective oxidation ability of catalyst [44]. The catalytic glycerol conversion rate of Mo8V2-MMT catalyst firstly increased and then decreased with the total impregnation amount of Mo/V oxides in the range of 2.5–10 wt% (Fig. 4 (b)). Glycerol conversion was increased with increasing Mo/V loading from 2.5 wt% to 7.5 wt%, but when the impregnation amount of catalyst was increased to 10 wt%, the maximum glycerol conversion was found to be 64.7%. This might be happened due to covering of the Brønsted acid sites by the excessive Mo/V oxides, thus consequently declined acrolein selectivity with decreasing glycerol conversion [14]. The catalyst activity reached the highest when the total amount of Mo/V oxide impregnation was 7.5 wt %, affording glycerol conversion of 85.7% and the selectivity of allyl alcohol and acrolein was 34.5% and 32.9%, respectively. The maximum glycerol conversion of 5 wt% Mo8V2-MMT catalyst is 81.6% and the selectivity of allyl alcohol and acrolein is 30.6% and 37.9%, respectively. The catalytic performance of 5 wt% Mo8V2-MMT catalyst is slightly lower than that of 7.5 wt %. Although 7.5 wt % Mo8V2-MMT has the best glycerol conversion and allyl alcohol selectivity compared with 5 wt % Mo8V2-MMT, 7.5 wt % Mo8V2-MMT has more active sites and more easily to undergo inactivation. 3.2.2 Effects of calcium content The glycerol reaction catalyzed by Mo2V8-CaMMT catalyst involves a variety of reactions, including dehydration of glycerol at the Brønsted acid site to acrolein, dehydration of glycerol at the Lewis acid site to acetol, or the deoxidation dehydration of MoVOx oxide at the REDOX site to allyl alcohol ( Table 1) [45,46]. In addition, the selective oxidation of allyl alcohol and acrolein under the catalysis of MoO3 may be followed to form acrylic acid [12]. The content of 1–3 wt % of CaO was found to be not conducive to the formation of acrolein and acetol, but is conducive to the formation of allyl alcohol, and the selectivity of allyl alcohol is 27.2 %, 31.6%, 36.3%, respectively. On the one hand, the existence of basic sites may be conducive to the C–C bond and C–O bond of the long chain compounds produced in the fracture reaction, which is conducive to the dehydrating reaction of glycerol to produce alcohol [47]. In terms of catalysis, it is possible that the low content of CaO is conducive to the DODH reaction of glycerol. When the content of CaO was greater than 3 wt %, the selectivity of allyl alcohol decreased significantly while the selectivity of allyl aldehyde and acetol increased. High content of calcium oxide may cover the acid sites and leads to the reduction of acid sites strength and number, resulting in the reduction of glycerol conversion. Similarly, when the CaO content in Mo8V2-Ca2MMT, glycerol conversion decreases significantly, but the selectivity of acrolein and acetol will improve, which may also be related to the addition of a large number of alkaline sites [48]. When the CaO content of Mo8V2-CaMMT catalyst exceeds 3 wt %, the main catalyst may change from MO3 or MoVOx to CaO as the main active site, resulting in the dehydration reaction of glycerol at the acid base site to produce acrolein and acetol. Low selectivity of acrylic acid and 1, 2-propylene glycol were also found in the products. 3.3 Mechanism of resistance to carbon deposition 3.3.1 Stability evaluation of MoV-CaMMT catalyst The catalytic performance of Mo8V2-MMT, Mo8V2-Ca2MMT and Mo8V2-Ca5MMT within 5 h, and the glycerol conversion per hour and the stability of allyl alcohol demonstrates the stability and coking-resistance of the catalyst to a certain extent ( Fig. 5). In this regard, Mo8V2-MMT catalyst achieved the maximum glycerol conversion of 81.6% within 3 h, but the catalytic activity decreased to 24.3 % within a few hours due to the rapid deactivation due to coking. The intercalation of CaO and the presence of calcium species are the reasons for the improved stability of Mo8V2-Ca2MMT and Mo8V2-Ca5MMT catalysts than Mo8V2-MMT catalyst. In addition, the allyl alcohol selectivity of Mo8V2-Ca5MMT catalyst with high CaO content reached a maximum of 39.2 % at 5 h. In the Mo/V catalysts, vanadium and CaO can be used as co-catalyst components to significantly improve the coking-resistance of the catalyst and the stability of the catalyst [49], which may be related to the fact that the doping of CaO species is conducive to the crystallization and dispersion of MO3 or MoVOx particles. However, the existence of basic sites makes glycerol molecules tend to undergo dehydration reaction to produce acrolein and acetol in the catalytic reaction, which also leads to low glycerol conversion and low selectivity of allyl alcohol over MoV-CaMMT catalyst. High content of CaO will cover most of the acidic sites and become the main catalytic active sites, which leads to the deterioration of the catalytic capacity of Mo8V2-Ca5MMT catalyst for the dehydration and oxidation of glycerol. The thermogravimetric analysis of the used catalysts showed that the addition of molybdenum oxide was related to the increase of carbon deposition ( Fig. 6). Among them, the weight loss rate of spent-Mo8V2-MMT was 15.9% during the heating process of 100–800 ℃. Since the temperature heating program was set to stay at 100 ℃ for 30 min to remove most of the water content, the weight loss rate could be regarded as the coking rate of spent-Mo8V2-MMT [50]. The addition of CaO and column support significantly reduced coking rate of the Mo/V catalyst, and the coking rate of Mo8V2-Ca2MMT catalyst was 6.9 %. Similarly, the coking rate of V-Ca2MMT catalyst is 5.3 %, compared with 11.1 % for V-MMT catalyst without CaO. Hence, the addition of vanadium and CaO improves the coking-resistance of molybdenum oxide-based catalyst. 3.3.2 Study on synergistic of calcium and vanadium In order to further explore the coking-resistance of vanadium oxides and CaO, the fresh and used V-Ca2MMT catalyst were characterized by XPS, and the correction was carried out on the basis of C 1s, and the XPS results of C, Ca and V were peak-fitting, respectively ( Fig. 7). Although no significant CO3 2- diffraction peak was found in XRD analysis, the C 1s spectra in XPS confirmed the presence of calcium carbonate in the catalyst. This data also satisfied the FTIR findings. The C–C bond represented by 284.8 eV is an additional carbon source added for correction and the bind energy 287.3 eV regarding CO3 2- is found on its surface, indicating the presence of calcium carbonate on the surface or between layers of the V-CaMMT catalyst [33,38]. The vanadium in the catalyst mainly exists as oxides of V4+ and V5+, which also verifies that the existence of the by-product acrylic acid is the result of the charge transfer between V4+ conversion V5+ and acrolein is adsorbed on the vanadium oxide and oxidized [51]. In addition, the presence of V4+ oxide (VO2) may be the reason that catalysts have good carbon accumulation resistance, so that its REDOX properties can promote the oxidation of carbon deposits into gaseous products easy to leave the surface of the catalyst, and vanadium dioxide itself is not easy to carbon accumulation, so the presence of V4+ is conducive to prevent the accumulation of carbon deposits on the surface of the catalyst [49]. Fig. 7 (c, g) is Ca 2p spectrum [34], Since calcium species in CaO, CaCO3 and Ca(OH)2 are calcium ions, it is difficult to distinguish the binding energy of these three calcium species [38]. However, after the catalytic reaction, it is obvious that the binding energy of 2p1/2 is shifted from 347.0 eV to 346.0 eV, and the binding energy of 2p2/3 is shifted from 351.2 eV to 350.2 eV. This is probably the reaction of CaO with water molecules in glycerol solution or dehydration reaction to form Ca(OH)2. The active sites of V-Ca2MMT catalysts are located at 86.4 ℃, 509.2 ℃ and 598 ℃, which are respectively weak acid sites provided by MMT, strong acid sites provided by acid-activated MMT and vanadium oxides and Mo8V2-Ca2MMT catalyst has two strengths of acid sites (96.2–141.5 ℃, 502.1–670.4 ℃) (Fig. 7 (d, h)) [52,53]. Compared with V-Ca2MMT catalyst, the addition of molybdenum oxide in Mo8V2-Ca2MMT catalyst brought about multiple active sites (141.5 ℃, 670.4 ℃), which may include MoO3, MoVOx and mixed sites of CaO and vanadium oxide. The low impregnation amount of vanadium oxide and the addition of calcium oxide resulted in the weakening of the weak acid and strong acid sites provided by acidified montmorillonite, resulting in the low activity of the catalyst. 4 Conclusion In this study, calcium oxide was added as a cocatalyst not only to prevent the collapse of MMT-lamella under high temperature calcination but also promote the catalytic reaction through improving crystallization of V2O5 and VO2. In addition, the calcium species on the catalyst surface mainly exist in the form of CaO (containing a few CaCO3), and the addition of its basic site will affect the activity and coking-resistance of the catalyst. Low content of CaO was found to be conducive to DODH reaction to produce allyl alcohol but the effect is attenuated by catalysts containing more than 2 wt % CaO, and the dehydration of glycerol at the MoVOx site mainly produces acrolein and acetol. Mo8V2-Ca2MMT had the best catalyst performance with glycerol conversion of 86.5% and allyl alcohol selectivity of 31.6%, compared with undoped CaO catalysts, Mo8V2-Ca2MMT maintains a high conversion rate and stable selectivity within 5 h. Vanadium has been shown to be resistant to coke formation. The synergism of vanadium and CaO improves the coking-resistance of molybdenum oxide-based catalyst. The decrease of catalyst acidity, the presence of VO2 and the stable conversion of V4+ and V5+, and the new weak and strong acid sites formed by MoVOx and CaO play the main role of coking-resistance. But the existence of MoOx created new active sites (MoVOx) in the weak and strong acid sites of the catalyst, which led to the production of another dehydration product (acetol) parallel to allyl alcohol and acrolein. The study of this synergistic effect on solid acid or mixed metal oxide catalysts and its influence can adjust the dispersion and microenvironment of the active site and provide a theoretical basis for the subsequent development of various reaction types of V/Ca based catalysts. CRediT authorship contribution statement Cheng Cang Li: Data curation, Conceptualization, Investigation, Writing – review & editing. Da Jian Li: Writing – review & editing. Shu Tian Yin: Investigation. Chun Hui Zhou: Conceptualization, Methodology, Supervision, Funding acquisition, Investigation. Declaration of Competing Interest The authors declare that they have no known competing financial interests or personal relationships that could have appeared to influence the work reported in this paper. Acknowledgements The authors wish to acknowledge the financial support from the National Natural Science Foundation of China (22072136; 41672033), the research grants from Engineering Research Center of Non-metallic Minerals of Zhejiang Province (ZD2023K01), and the projects from Qing Yang Institute for Industrial Minerals (KYY-HX-20220336; KYY-HX-20170557). Thanks goes to Dr. A. Kurniawan and Dr. T. Roy for helping check the revised version and giving useful comments to improve it. References [1] Y.J. Liu B.Q. Zhong A. Lawal RSC Adv. 12 2022 27997 28008 10.1039/D2RA05090K Y.J. Liu, B.Q. Zhong, A. Lawal, R.S.C. Adv. 12 (2022) 27997–28008. https://doi.org/10.1039/D2RA05090K [2] A. Khazayialiabad D. Iranshahi Energy Fuel 35 2021 5049 5063 10.1021/acs.energyfuels.0c02664 A. Khazayialiabad, D. Iranshahi, Energy Fuel 35 (2021) 5049–5063. https://doi.org/10.1021/acs.energyfuels.0c02664 [3] P. Koranian Q. Huang A.K. Dalai R. Sammynaiken Catalysts 12 2022 897 10.3390/catal12080897 P. Koranian, Q. Huang, A.K. Dalai, R. Sammynaiken, Catalysts 12 (2022) 897. https://doi.org/10.3390/catal12080897 [4] E.S. Vázquez J.A. Pliego J.P. Pariente M.S. Sánchez Á.R. Arteaga Licona M.G. Ruiz D. Solis-Casados Catal. Today 356 2020 349 358 10.1016/j.cattod.2020.06.056 E.S. Vázquez, J.A. Pliego, J.P. Pariente, M.S. Sánchez, Á.R. Arteaga Licona, M.G. Ruiz, D. Solis-Casados, Catalysis Today 356 (2020) 349–358. https://doi.org/10.1016/j.cattod.2020.06.056 [5] L.C. Muller S. Marx H.C. Vosloo I. Chiyanzu Polym. Renew. Resour. 10 2019 3 18 10.1177/2041247919830833 L.C. Muller, S. Marx, H.C. Vosloo, I. Chiyanzu, Polymers from Renewable Resources 10 (2019) 3–18. https://doi.org/10.1177/2041247919830833 [6] X.K. Li Y.G. Zhang ACS Catal. 6 2016 143 150 10.1021/acscatal.5b01843 X.K. Li, Y.G. Zhang, ACS Catal. 6 (2016) 143–150. https://doi.org/10.1021/acscatal.5b01843 [7] N.N. Tshibalonza J.-C.M. Monbaliu Green. Chem. 19 2017 3006 3013 10.1039/C7GC00657H N.N. Tshibalonza, J.-C.M. Monbaliu, Green Chem. 19 (2017) 3006–3013. https://doi.org/10.1039/C7GC00657H [8] Y. Nakagawa M. Tamura K. Tomishige Res Chem. Inter. 44 2018 3879 3903 10.1007/s11164-018-3481-2 Y. Nakagawa, M. Tamura, K. Tomishige, Res Chem Intermed 44 (2018) 3879–3903. https://doi.org/10.1007/s11164–018-3481–2 [9] Y. Kon M. Araque T. Nakashima S. Paul F. Dumeignil B. Katryniok ChemistrySelect 2 2017 9864 9868 10.1002/slct.201702070 Y. Kon, M. Araque, T. Nakashima, S. Paul, F. Dumeignil, B. Katryniok, ChemistrySelect 2 (2017) 9864–9868. https://doi.org/10.1002/slct.201702070 [10] J. Yi S. Liu M.M. Abu-Omar ChemSusChem 5 2012 1401 1404 10.1002/cssc.201200138 J. Yi, S. Liu, M.M. Abu-Omar, ChemSusChem 5 (2012) 1401–1404. https://doi.org/10.1002/cssc.201200138 [11] V. Canale L. Tonucci M. Bressan N. d’Alessandro Catal. Sci. Technol. 4 2014 3697 3704 10.1039/C4CY00631C V. Canale, L. Tonucci, M. Bressan, N. d’Alessandro, Catal. Sci. Technol. 4 (2014) 3697–3704. https://doi.org/10.1039/C4CY00631C [12] A.R. Petersen L.B. Nielsen J.R. Dethlefsen P. Fristrup ChemCatChem 10 2018 769 778 10.1002/cctc.201701049 A.R. Petersen, L.B. Nielsen, J.R. Dethlefsen, P. Fristrup, ChemCatChem 10 (2018) 769–778. https://doi.org/10.1002/cctc.201701049 [13] J.R. Dethlefsen D. Lupp B.-C. Oh P. Fristrup ChemSusChem 7 2014 425 428 10.1002/cssc.201300945 J.R. Dethlefsen, D. Lupp, B.-C. Oh, P. Fristrup, ChemSusChem 7 (2014) 425–428. https://doi.org/10.1002/cssc.201300945 [14] J.R. Dethlefsen D. Lupp A. Teshome L.B. Nielsen P. Fristrup ACS Catal. 5 2015 3638 3647 10.1021/acscatal.5b00427 J.R. Dethlefsen, D. Lupp, A. Teshome, L.B. Nielsen, P. Fristrup, ACS Catal. 5 (2015) 3638–3647. https://doi.org/10.1021/acscatal.5b00427 [15] F. Fernandes Barbosa T. Pinheiro Braga ChemCatChem 15 2023 10.1002/cctc.202200950 F. Fernandes Barbosa, T. Pinheiro Braga, ChemCatChem 15 (2023). https://doi.org/10.1002/cctc.202200950 [16] L. Liu X.P. Ye B. Katryniok M. Capron S. Paul F. Dumeignil Front. Chem. 7 2019 108 10.3389/fchem.2019.00108 L. Liu, X.P. Ye, B. Katryniok, M. Capron, S. Paul, F. Dumeignil, Front. Chem. 7 (2019) 108. https://doi.org/10.3389/fchem.2019.00108 [17] M. Guisnet L. Costa F.R. Ribeiro J. Mol. Catal. A: Chem. 305 2009 69 83 10.1016/j.molcata.2008.11.012 M. Guisnet, L. Costa, F.R. Ribeiro, Journal of Molecular Catalysis A: Chemical 305 (2009) 69–83. https://doi.org/10.1016/j.molcata.2008.11.012 [18] M. Guisnet P. Magnoux Appl. Catal. A: Gen. 212 2001 83 96 10.1016/S0926-860X(00)00845-0 M. Guisnet, P. Magnoux, Applied Catalysis A: General 212 (2001) 83–96. https://doi.org/10.1016/S0926–860X(00)00845–0 19] S.T. Wu Q.M. She R. Tesser M.D. Serio C.H. Zhou Catal. Rev. 62 2020 481 523 10.1080/01614940.2020.1719611 S.T. Wu, Q.M. She, R. Tesser, M.D. Serio, C.H. Zhou, Catalysis Reviews 62 (2020) 481–523. https://doi.org/10.1080/01614940.2020.1719611 [20] Y.W. Sun L.H. Wei Z. Zhang H.X. Zhang Y.L. Li Energy Fuels 37 2023 1657 1677 10.1021/acs.energyfuels.2c03479 Y.W. Sun, L.H. Wei, Z. Zhang, H.X. Zhang, Y.L. Li, Energy Fuels 37 (2023) 1657–1677. https://doi.org/10.1021/acs.energyfuels.2c03479 [21] T.T. Bao H. Zhou Y. Zhang C.X. Guo W.M. Guo H. Qin P.Z. Gao H.N. Xiao W.X. Liu S1002072122002551 J. Rare Earths 2022 10.1016/j.jre.2022.09.006 T.T. Bao, H. Zhou, Y. Zhang, C.X. Guo, W.M. Guo, H. Qin, P.Z. Gao, H.N. Xiao, W.X. Liu, Journal of Rare Earths (2022) S1002072122002551. https://doi.org/10.1016/j.jre.2022.09.006 [22] D.L. Sun Y. Yamada S. Sato W. Ueda Green. Chem. 19 2017 3186 3213 10.1039/C7GC00358G D.L. Sun, Y. Yamada, S. Sato, W. Ueda, Green Chem. 19 (2017) 3186–3213. https://doi.org/10.1039/C7GC00358G [23] X. Yang J.W. Da H.T. Yu H. Wang Fuel 179 2016 353 361 10.1016/j.fuel.2016.03.104 X. Yang, J.W. Da, H.T. Yu, H. Wang, Fuel 179 (2016) 353–361. https://doi.org/10.1016/j.fuel.2016.03.104 [24] G.Q. Li Y.F. Zhang G.J. Zhang Y.H. Sun J.W. Liu Chem. Eng. Technol. 46 2023 918 926 10.1002/ceat.202200536 G.Q. Li, Y.F. Zhang, G.J. Zhang, Y.H. Sun, J.W. Liu, Chemical Engineering & Technology 46 (2023) 918–926. https://doi.org/10.1002/ceat.202200536 [25] Z.L. Ou J.Y. Ran H.Y. Qiu X. Huang C.L. Qin Fuel 335 2023 126994 10.1016/j.fuel.2022.126994 Z.L. Ou, J.Y. Ran, H.Y. Qiu, X. Huang, C.L. Qin, Fuel 335 (2023) 126994. https://doi.org/10.1016/j.fuel.2022.126994 [26] M. Pizzolato G.D. Pian E. Ghedini A.D. Michele F. Menegazzo G. Cruciani M. Signoretto Catal. Today 418 2023 114041 10.1016/j.cattod.2023.114041 M. Pizzolato, G.D. Pian, E. Ghedini, A.D. Michele, F. Menegazzo, G. Cruciani, M. Signoretto, Catalysis Today 418 (2023) 114041. https://doi.org/10.1016/j.cattod.2023.114041 [27] H. Zhao C.H. Zhou L.M. Wu J.Y. Lou N. Li H.M. Yang D.S. Tong W.H. Yu Appl. Clay Sci. 74 2013 154 162 10.1016/j.clay.2011.04.016 H. Zhao, C.H. Zhou, L.M. Wu, J.Y. Lou, N. Li, H.M. Yang, D.S. Tong, W.H. Yu, Applied Clay Science 74 (2013) 154–162. https://doi.org/10.1016/j.clay.2011.04.016 [28] K. Phuakpunk B. Chalermsinsuwan S. Putivisutisak S. Assabumrungrat Particuology 50 2020 156 172 10.1016/j.partic.2019.08.005 K. Phuakpunk, B. Chalermsinsuwan, S. Putivisutisak, S. Assabumrungrat, Particuology 50 (2020) 156–172. https://doi.org/10.1016/j.partic.2019.08.005 [29] M.W. Islam Fuel 267 2020 117095 10.1016/j.fuel.2020.117095 M.W. Islam, Fuel 267 (2020) 117095. https://doi.org/10.1016/j.fuel.2020.117095 [30] R.S.R.M. Hafriz I.N. Shafizah N.A. Arifin A. Salmiaton R. Yunus Y.H.T. Yap A.H. Shamsuddin Renew. Energy 178 2021 128 143 10.1016/j.renene.2021.06.074 R.S.R.M. Hafriz, I.N. Shafizah, N.A. Arifin, A. Salmiaton, R. Yunus, Y.H.T. Yap, A.H. Shamsuddin, Renewable Energy 178 (2021) 128–143. https://doi.org/10.1016/j.renene.2021.06.074 [31] L. Zatta L.P. Ramos F. Wypych Appl. Clay Sci. 80–81 2013 236 244 10.1016/j.clay.2013.04.009 L. Zatta, L.P. Ramos, F. Wypych, Applied Clay Science 80–81 (2013) 236–244. https://doi.org/10.1016/j.clay.2013.04.009 [32] T. Hu L.Q. Tan J. Radio. Nucl. Chem. 292 2012 103 112 10.1007/s10967-011-1377-3 T. Hu, L.Q. Tan, J Radioanal Nucl Chem 292 (2012) 103–112. https://doi.org/10.1007/s10967–011-1377–3 [33] Y.T. Ma P. Tian M. Bounmyxay Y.W. Zeng N. Wang Molecules 26 2021 7180 10.3390/molecules26237180 Y.T. Ma, P. Tian, M. Bounmyxay, Y.W. Zeng, N. Wang, Molecules 26 (2021) 7180. https://doi.org/10.3390/molecules26237180 [34] M. Ni B.D. Ratner Surf. Interface Anal. 40 2008 1356 1361 10.1002/sia.2904 M. Ni, B.D. Ratner, Surf. Interface Anal. 40 (2008) 1356–1361. https://doi.org/10.1002/sia.2904 [35] T. Nazdracheva A. Morozov V. Yavna A. Kochur J. Mol. Struct. 1250 2022 131871 10.1016/j.molstruc.2021.131871 T. Nazdracheva A. Morozov V. Yavna A. Kochur J. Mol. Struct. 1250 2022 131871 doi: 10.1016/j.molstruc.2021.131871. [36] N. Sarier E. Onder S. Ersoy Colloids Surf. A: Physicochem. Eng. Asp. 371 2010 40 49 10.1016/j.colsurfa.2010.08.061 N. Sarier, E. Onder, S. Ersoy, Colloids and Surfaces A: Physicochemical and Engineering Aspects 371 (2010) 40–49. https://doi.org/10.1016/j.colsurfa.2010.08.061 [37] W.H. Yu P.P. Wang C.H. Zhou H. Zhao D.S. Tong H. Zhang H.M. Yang S.F. Ji H. Wang Chin. J. Catal. 38 2017 1087 1100 10.1016/S1872-2067(17)62813-4 W.H. Yu, P.P. Wang, C.H. Zhou, H. Zhao, D.S. Tong, H. Zhang, H.M. Yang, S.F. Ji, H. Wang, Chinese Journal of Catalysis 38 (2017) 1087–1100. https://doi.org/10.1016/S1872–2067(17)62813–4 [38] M. Li S. Chen H. Dai H. Zhao B. Jiang Molecules 26 2021 2568 10.3390/molecules26092568 M. Li, S. Chen, H. Dai, H. Zhao, B. Jiang, Molecules 26 (2021) 2568. https://doi.org/10.3390/molecules26092568 [39] S. Benadji P. Eloy A. Léonard B.L. Su K. Bachari C. Rabia E.M. Gaigneaux Microporous Mesoporous Mater. 130 2010 103 114 10.1016/j.micromeso.2009.10.019 S. Benadji, P. Eloy, A. Léonard, B.L. Su, K. Bachari, C. Rabia, E.M. Gaigneaux, Microporous and Mesoporous Materials 130 (2010) 103–114. https://doi.org/10.1016/j.micromeso.2009.10.019 [40] J. Wang C.J. Li J. Therm. Spray. Tech. 27 2018 14 24 10.1007/s11666-017-0664-0 J. Wang, C.J. Li, J Therm Spray Tech 27 (2018) 14–24. https://doi.org/10.1007/s11666–017-0664–0 [41] U.J. Etim P. Bai R. Ullah F. Subhan Z. Yan Appl. Catal. A: Gen. 555 2018 108 117 10.1016/j.apcata.2018.02.011 U.J. Etim, P. Bai, R. Ullah, F. Subhan, Z. Yan, Applied Catalysis A: General 555 (2018) 108–117. https://doi.org/10.1016/j.apcata.2018.02.011 [42] B. Jiang C. Zhang K.Q. Wang B.L. Dou Y.C. Song H.S. Chen Y.J. Xu Appl. Therm. Eng. 109 2016 99 108 10.1016/j.applthermaleng.2016.08.041 B. Jiang, C. Zhang, K.Q. Wang, B.L. Dou, Y.C. Song, H.S. Chen, Y.J. Xu, Applied Thermal Engineering 109 (2016) 99–108. https://doi.org/10.1016/j.applthermaleng.2016.08.041 [43] T. Fjermestad W. Li G. Rugg S. Ishida M. Okuno K. Sagi A. Genest N. Rösch Appl. Catal. A: Gen. 565 2018 68 75 10.1016/j.apcata.2018.07.044 T. Fjermestad, W. Li, G. Rugg, S. Ishida, M. Okuno, K. Sagi, A. Genest, N. Rösch, Applied Catalysis A: General 565 (2018) 68–75. https://doi.org/10.1016/j.apcata.2018.07.044 [44] D.D. Suppiah A. Komar S.B.A. Hamid J. Therm. Anal. Calor. 129 2017 1367 1376 10.1007/s10973-017-6333-1 D.D. Suppiah, A. Komar, S.B.A. Hamid, J Therm Anal Calorim 129 (2017) 1367–1376. https://doi.org/10.1007/s10973–017-6333–1 [45] W. Suprun M. Lutecki T. Haber H. Papp J. Mol. Catal. A: Chem. 309 2009 71 78 10.1016/j.molcata.2011.04.020 W. Suprun, M. Lutecki, T. Haber, H. Papp, Journal of Molecular Catalysis A: Chemical 309 (2009) 71–78. https://doi.org/10.1016/j.molcata.2011.04.020 [46] V. Mahdavi A. Monajemi RSC Adv. 6 2016 114244 114255 10.1039/C6RA24614A V. Mahdavi, A. Monajemi, RSC Adv. 6 (2016) 114244–114255. https://doi.org/10.1039/C6RA24614A [47] D.A. Sun Y.M. Du Z.X. Wang J.W. Zhang Y. Li J.Y. Li L.G. Kou C.Y. Li J.W. Li H. Feng J. Lu Int. J. Hydrog. Energy 45 2020 16421 16431 10.1016/j.ijhydene.2020.04.126 D.A. Sun, Y.M. Du, Z.X. Wang, J.W. Zhang, Y. Li, J.Y. Li, L.G. Kou, C.Y. Li, J.W. Li, H. Feng, J. Lu, International Journal of Hydrogen Energy 45 (2020) 16421–16431. https://doi.org/10.1016/j.ijhydene.2020.04.126 [48] M.H. Haider N.F. Dummer D.W. Knight R.L. Jenkins M. Howard J. Moulijn S.H. Taylor G.J. Hutchings Nat. Chem. 7 2015 1028 1032 10.1038/nchem.2345 M.H. Haider, N.F. Dummer, D.W. Knight, R.L. Jenkins, M. Howard, J. Moulijn, S.H. Taylor, G.J. Hutchings, Nature Chem 7 (2015) 1028–1032.https://doi.org/10.1038/nchem.2345 [49] F.B. Kabwe J.Q. Zhong W.J. Huang C.J. Li C.H. Zhou Mol. Catal. 516 2021 111969 10.1016/j.mcat.2021.111969 F.B. Kabwe, J.Q. Zhong, W.J. Huang, C.J. Li, C.H. Zhou, Molecular Catalysis 516 (2021) 111969. https://doi.org/10.1016/j.mcat.2021.111969 [50] B.R. Li X. Wu Z. Li X. An X.M. Xie Arab J. Sci. Eng. 42 2017 4439 4444 10.1007/s13369-017-2558-3 B.R. Li, X. Wu, Z. Li, X. An, X.M. Xie, Arab J Sci Eng 42 (2017) 4439–4444. https://doi.org/10.1007/s13369–017-2558–3 [51] Y.S. Yun K.R. Lee H. Park T.Y. Kim D. Yun J.W. Han J. Yi ACS Catal. 5 2015 82 94 10.1021/cs501307v Y.S. Yun, K.R. Lee, H. Park, T.Y. Kim, D. Yun, J.W. Han, J. Yi, ACS Catal. 5 (2015) 82–94. https://doi.org/10.1021/cs501307v [52] D. Ma W.P. Zhang Y.Y. Shu X.M. Liu Y.D. Xu X.H. Bao Catal. Lett. 66 2000 155 160 10.1023/A:1019099607029 D. Ma, W.P. Zhang, Y.Y. Shu, X.M. Liu, Y.D. Xu, X.H. Bao, Catalysis Letters 66 (2000) 155–160. https://doi.org/10.1023/A:1019099607029 [53] A.Z. Varzaneh M.S. Moghaddam J.T. Darian Pet. Chem. 58 2018 13 21 10.1134/S0965544118010036 A.Z. Varzaneh, M.S. Moghaddam, J.T. Darian, Pet. Chem. 58 (2018) 13–21. https://doi.org/10.1134/S0965544118010036",
      "scopus-id": "85167450043",
      "coredata": {
        "eid": "1-s2.0-S0926860X23003356",
        "dc:description": "Glycerol can be converted to allyl alcohol via deoxydehydration using molybdenum-vanadium, rhenium and iron based catalysts. However, the dehydration causes severe coking at strong acid sites on the surface of catalyst. Molybdenum-vanadium oxide supported on calcium oxide-intercalated montmorillonite (MoV-CaMMT) was prepared by oxalate anion intercalation followed by impregnation. MoV-CaMMT displayed the best catalytic performance of 86.5% glycerol conversion and good stability in 5 h. Correlating the results of XRD, XPS and TG analysis, it can be demonstrated that the addition of CaO in the catalyst preparation is conducive to the crystallization and dispersion of vanadium oxides, and reduces the acid strength, while the presence of a few vanadium dioxide and the stable conversion of V4+ and V5+ are the reasons for enhancing coking-resistance of MoV-CaMMT. Additionally, NH3-TPD analysis proved the coexistence of weak and strong acid sites in MoVOx, which are conducive to the formation of acetol.",
        "openArchiveArticle": "false",
        "prism:coverDate": "2023-09-05",
        "openaccessUserLicense": null,
        "prism:aggregationType": "Journal",
        "prism:url": "https://api.elsevier.com/content/article/pii/S0926860X23003356",
        "dc:creator": [
          {
            "@_fa": "true",
            "$": "Li, Cheng Cang"
          },
          {
            "@_fa": "true",
            "$": "Li, Da Jian"
          },
          {
            "@_fa": "true",
            "$": "Yin, Shu Tian"
          },
          {
            "@_fa": "true",
            "$": "Wang, Ze Zhen"
          },
          {
            "@_fa": "true",
            "$": "Liu, Chen Lan"
          },
          {
            "@_fa": "true",
            "$": "Zhou, Chun Hui"
          }
        ],
        "link": [
          {
            "@_fa": "true",
            "@rel": "self",
            "@href": "https://api.elsevier.com/content/article/pii/S0926860X23003356"
          },
          {
            "@_fa": "true",
            "@rel": "scidir",
            "@href": "https://www.sciencedirect.com/science/article/pii/S0926860X23003356"
          }
        ],
        "dc:format": "application/json",
        "openaccessType": null,
        "pii": "S0926-860X(23)00335-6",
        "prism:volume": "665",
        "articleNumber": "119355",
        "prism:publisher": "Elsevier B.V.",
        "dc:title": "Contribution of Ca and V to enhancing coking-resistance and stability of MoV/CaO-intercalated montmorillonite catalyst in deoxydehydration of glycerol",
        "prism:copyright": "© 2023 Elsevier B.V. All rights reserved.",
        "openaccess": "0",
        "prism:issn": "0926860X",
        "dcterms:subject": [
          {
            "@_fa": "true",
            "$": "Glycerol"
          },
          {
            "@_fa": "true",
            "$": "Allyl alcohol"
          },
          {
            "@_fa": "true",
            "$": "Deoxydehydration"
          },
          {
            "@_fa": "true",
            "$": "Coking-resistance"
          },
          {
            "@_fa": "true",
            "$": "Montmorillonite"
          },
          {
            "@_fa": "true",
            "$": "Molybdenum-vanadium"
          }
        ],
        "openaccessArticle": "false",
        "prism:publicationName": "Applied Catalysis A: General",
        "openaccessSponsorType": null,
        "prism:pageRange": "119355",
        "pubType": "fla",
        "prism:coverDisplayDate": "5 September 2023",
        "prism:doi": "10.1016/j.apcata.2023.119355",
        "prism:startingPage": "119355",
        "dc:identifier": "doi:10.1016/j.apcata.2023.119355",
        "openaccessSponsorName": null
      },
      "objects": {
        "object": [
          {
            "@category": "standard",
            "@height": "316",
            "@width": "376",
            "@_fa": "true",
            "$": "https://api.elsevier.com/content/object/eid/1-s2.0-S0926860X23003356-gr5.jpg?httpAccept=%2A%2F%2A",
            "@multimediatype": "JPEG image file",
            "@type": "IMAGE-DOWNSAMPLED",
            "@size": "32287",
            "@ref": "gr5",
            "@mimetype": "image/jpeg"
          },
          {
            "@category": "standard",
            "@height": "300",
            "@width": "376",
            "@_fa": "true",
            "$": "https://api.elsevier.com/content/object/eid/1-s2.0-S0926860X23003356-gr6.jpg?httpAccept=%2A%2F%2A",
            "@multimediatype": "JPEG image file",
            "@type": "IMAGE-DOWNSAMPLED",
            "@size": "28337",
            "@ref": "gr6",
            "@mimetype": "image/jpeg"
          },
          {
            "@category": "standard",
            "@height": "338",
            "@width": "791",
            "@_fa": "true",
            "$": "https://api.elsevier.com/content/object/eid/1-s2.0-S0926860X23003356-gr7.jpg?httpAccept=%2A%2F%2A",
            "@multimediatype": "JPEG image file",
            "@type": "IMAGE-DOWNSAMPLED",
            "@size": "62296",
            "@ref": "gr7",
            "@mimetype": "image/jpeg"
          },
          {
            "@category": "standard",
            "@height": "274",
            "@width": "751",
            "@_fa": "true",
            "$": "https://api.elsevier.com/content/object/eid/1-s2.0-S0926860X23003356-gr1.jpg?httpAccept=%2A%2F%2A",
            "@multimediatype": "JPEG image file",
            "@type": "IMAGE-DOWNSAMPLED",
            "@size": "62651",
            "@ref": "gr1",
            "@mimetype": "image/jpeg"
          },
          {
            "@category": "standard",
            "@height": "373",
            "@width": "376",
            "@_fa": "true",
            "$": "https://api.elsevier.com/content/object/eid/1-s2.0-S0926860X23003356-gr2.jpg?httpAccept=%2A%2F%2A",
            "@multimediatype": "JPEG image file",
            "@type": "IMAGE-DOWNSAMPLED",
            "@size": "38215",
            "@ref": "gr2",
            "@mimetype": "image/jpeg"
          },
          {
            "@category": "standard",
            "@height": "113",
            "@width": "500",
            "@_fa": "true",
            "$": "https://api.elsevier.com/content/object/eid/1-s2.0-S0926860X23003356-ga1.jpg?httpAccept=%2A%2F%2A",
            "@multimediatype": "JPEG image file",
            "@type": "IMAGE-DOWNSAMPLED",
            "@size": "21476",
            "@ref": "ga1",
            "@mimetype": "image/jpeg"
          },
          {
            "@category": "standard",
            "@height": "299",
            "@width": "791",
            "@_fa": "true",
            "$": "https://api.elsevier.com/content/object/eid/1-s2.0-S0926860X23003356-gr3.jpg?httpAccept=%2A%2F%2A",
            "@multimediatype": "JPEG image file",
            "@type": "IMAGE-DOWNSAMPLED",
            "@size": "68790",
            "@ref": "gr3",
            "@mimetype": "image/jpeg"
          },
          {
            "@category": "standard",
            "@height": "283",
            "@width": "678",
            "@_fa": "true",
            "$": "https://api.elsevier.com/content/object/eid/1-s2.0-S0926860X23003356-gr4.jpg?httpAccept=%2A%2F%2A",
            "@multimediatype": "JPEG image file",
            "@type": "IMAGE-DOWNSAMPLED",
            "@size": "48695",
            "@ref": "gr4",
            "@mimetype": "image/jpeg"
          },
          {
            "@category": "thumbnail",
            "@height": "164",
            "@width": "195",
            "@_fa": "true",
            "$": "https://api.elsevier.com/content/object/eid/1-s2.0-S0926860X23003356-gr5.sml?httpAccept=%2A%2F%2A",
            "@multimediatype": "GIF image file",
            "@type": "IMAGE-THUMBNAIL",
            "@size": "9989",
            "@ref": "gr5",
            "@mimetype": "image/gif"
          },
          {
            "@category": "thumbnail",
            "@height": "164",
            "@width": "205",
            "@_fa": "true",
            "$": "https://api.elsevier.com/content/object/eid/1-s2.0-S0926860X23003356-gr6.sml?httpAccept=%2A%2F%2A",
            "@multimediatype": "GIF image file",
            "@type": "IMAGE-THUMBNAIL",
            "@size": "8467",
            "@ref": "gr6",
            "@mimetype": "image/gif"
          },
          {
            "@category": "thumbnail",
            "@height": "94",
            "@width": "219",
            "@_fa": "true",
            "$": "https://api.elsevier.com/content/object/eid/1-s2.0-S0926860X23003356-gr7.sml?httpAccept=%2A%2F%2A",
            "@multimediatype": "GIF image file",
            "@type": "IMAGE-THUMBNAIL",
            "@size": "9124",
            "@ref": "gr7",
            "@mimetype": "image/gif"
          },
          {
            "@category": "thumbnail",
            "@height": "80",
            "@width": "219",
            "@_fa": "true",
            "$": "https://api.elsevier.com/content/object/eid/1-s2.0-S0926860X23003356-gr1.sml?httpAccept=%2A%2F%2A",
            "@multimediatype": "GIF image file",
            "@type": "IMAGE-THUMBNAIL",
            "@size": "7414",
            "@ref": "gr1",
            "@mimetype": "image/gif"
          },
          {
            "@category": "thumbnail",
            "@height": "164",
            "@width": "165",
            "@_fa": "true",
            "$": "https://api.elsevier.com/content/object/eid/1-s2.0-S0926860X23003356-gr2.sml?httpAccept=%2A%2F%2A",
            "@multimediatype": "GIF image file",
            "@type": "IMAGE-THUMBNAIL",
            "@size": "8258",
            "@ref": "gr2",
            "@mimetype": "image/gif"
          },
          {
            "@category": "thumbnail",
            "@height": "50",
            "@width": "219",
            "@_fa": "true",
            "$": "https://api.elsevier.com/content/object/eid/1-s2.0-S0926860X23003356-ga1.sml?httpAccept=%2A%2F%2A",
            "@multimediatype": "GIF image file",
            "@type": "IMAGE-THUMBNAIL",
            "@size": "6185",
            "@ref": "ga1",
            "@mimetype": "image/gif"
          },
          {
            "@category": "thumbnail",
            "@height": "83",
            "@width": "219",
            "@_fa": "true",
            "$": "https://api.elsevier.com/content/object/eid/1-s2.0-S0926860X23003356-gr3.sml?httpAccept=%2A%2F%2A",
            "@multimediatype": "GIF image file",
            "@type": "IMAGE-THUMBNAIL",
            "@size": "11891",
            "@ref": "gr3",
            "@mimetype": "image/gif"
          },
          {
            "@category": "thumbnail",
            "@height": "91",
            "@width": "219",
            "@_fa": "true",
            "$": "https://api.elsevier.com/content/object/eid/1-s2.0-S0926860X23003356-gr4.sml?httpAccept=%2A%2F%2A",
            "@multimediatype": "GIF image file",
            "@type": "IMAGE-THUMBNAIL",
            "@size": "7800",
            "@ref": "gr4",
            "@mimetype": "image/gif"
          },
          {
            "@category": "high",
            "@height": "1401",
            "@width": "1665",
            "@_fa": "true",
            "$": "https://api.elsevier.com/content/object/eid/1-s2.0-S0926860X23003356-gr5_lrg.jpg?httpAccept=%2A%2F%2A",
            "@multimediatype": "JPEG image file",
            "@type": "IMAGE-HIGH-RES",
            "@size": "204243",
            "@ref": "gr5",
            "@mimetype": "image/jpeg"
          },
          {
            "@category": "high",
            "@height": "1329",
            "@width": "1663",
            "@_fa": "true",
            "$": "https://api.elsevier.com/content/object/eid/1-s2.0-S0926860X23003356-gr6_lrg.jpg?httpAccept=%2A%2F%2A",
            "@multimediatype": "JPEG image file",
            "@type": "IMAGE-HIGH-RES",
            "@size": "155055",
            "@ref": "gr6",
            "@mimetype": "image/jpeg"
          },
          {
            "@category": "high",
            "@height": "1493",
            "@width": "3493",
            "@_fa": "true",
            "$": "https://api.elsevier.com/content/object/eid/1-s2.0-S0926860X23003356-gr7_lrg.jpg?httpAccept=%2A%2F%2A",
            "@multimediatype": "JPEG image file",
            "@type": "IMAGE-HIGH-RES",
            "@size": "307649",
            "@ref": "gr7",
            "@mimetype": "image/jpeg"
          },
          {
            "@category": "high",
            "@height": "1214",
            "@width": "3326",
            "@_fa": "true",
            "$": "https://api.elsevier.com/content/object/eid/1-s2.0-S0926860X23003356-gr1_lrg.jpg?httpAccept=%2A%2F%2A",
            "@multimediatype": "JPEG image file",
            "@type": "IMAGE-HIGH-RES",
            "@size": "318543",
            "@ref": "gr1",
            "@mimetype": "image/jpeg"
          },
          {
            "@category": "high",
            "@height": "1648",
            "@width": "1663",
            "@_fa": "true",
            "$": "https://api.elsevier.com/content/object/eid/1-s2.0-S0926860X23003356-gr2_lrg.jpg?httpAccept=%2A%2F%2A",
            "@multimediatype": "JPEG image file",
            "@type": "IMAGE-HIGH-RES",
            "@size": "206153",
            "@ref": "gr2",
            "@mimetype": "image/jpeg"
          },
          {
            "@category": "high",
            "@height": "502",
            "@width": "2213",
            "@_fa": "true",
            "$": "https://api.elsevier.com/content/object/eid/1-s2.0-S0926860X23003356-ga1_lrg.jpg?httpAccept=%2A%2F%2A",
            "@multimediatype": "JPEG image file",
            "@type": "IMAGE-HIGH-RES",
            "@size": "172520",
            "@ref": "ga1",
            "@mimetype": "image/jpeg"
          },
          {
            "@category": "high",
            "@height": "1319",
            "@width": "3493",
            "@_fa": "true",
            "$": "https://api.elsevier.com/content/object/eid/1-s2.0-S0926860X23003356-gr3_lrg.jpg?httpAccept=%2A%2F%2A",
            "@multimediatype": "JPEG image file",
            "@type": "IMAGE-HIGH-RES",
            "@size": "317265",
            "@ref": "gr3",
            "@mimetype": "image/jpeg"
          },
          {
            "@category": "high",
            "@height": "1248",
            "@width": "2994",
            "@_fa": "true",
            "$": "https://api.elsevier.com/content/object/eid/1-s2.0-S0926860X23003356-gr4_lrg.jpg?httpAccept=%2A%2F%2A",
            "@multimediatype": "JPEG image file",
            "@type": "IMAGE-HIGH-RES",
            "@size": "267788",
            "@ref": "gr4",
            "@mimetype": "image/jpeg"
          },
          {
            "@category": "thumbnail",
            "@_fa": "true",
            "$": "https://api.elsevier.com/content/object/eid/1-s2.0-S0926860X23003356-si0001.svg?httpAccept=%2A%2F%2A",
            "@multimediatype": "Scalable Vector Graphics file",
            "@type": "ALTIMG",
            "@size": "5458",
            "@ref": "si0001",
            "@mimetype": "image/svg+xml"
          },
          {
            "@category": "thumbnail",
            "@_fa": "true",
            "$": "https://api.elsevier.com/content/object/eid/1-s2.0-S0926860X23003356-si0002.svg?httpAccept=%2A%2F%2A",
            "@multimediatype": "Scalable Vector Graphics file",
            "@type": "ALTIMG",
            "@size": "5191",
            "@ref": "si0002",
            "@mimetype": "image/svg+xml"
          },
          {
            "@category": "standard",
            "@_fa": "true",
            "$": "https://api.elsevier.com/content/object/eid/1-s2.0-S0926860X23003356-am.pdf?httpAccept=%2A%2F%2A",
            "@multimediatype": "Acrobat PDF file",
            "@type": "AAM-PDF",
            "@size": "2323457",
            "@ref": "am",
            "@mimetype": "application/pdf"
          }
        ]
      },
      "link": {
        "@rel": "abstract",
        "@href": "https://api.elsevier.com/content/abstract/scopus_id/85167450043"
      }
    }
  }
}