{
  "metadata": {
    "title": "Synergistic N-P coordination enables low-melting, high-crystallinity syndiotactic 1,2-polybutadiene via iron-based catalyst",
    "authors": "; ; ",
    "journal": "Applied Catalysis A: General",
    "date": "2025-12-25",
    "doi": "10.1016/j.apcata.2025.120594",
    "abstract": "",
    "uri": "https://api.elsevier.com/content/article/pii/S0926860X2500496X",
    "pii": "S0926860X2500496X"
  },
  "fulltext": {
    "full-text-retrieval-response": {
      "originalText": "serial JL 271346 291210 291744 291809 31 Applied Catalysis A: General APPLIEDCATALYSISAGENERAL 2025-09-21 2025-09-21 2025-09-26 2025-09-26 2025-10-11T16:52:42 1-s2.0-S0926860X2500496X S0926-860X(25)00496-X S0926860X2500496X 10.1016/j.apcata.2025.120594 S300 S300.1 FULL-TEXT 1-s2.0-S0926860X25X00168 2025-10-11T16:06:29.029052Z 0 0 20251225 2025 2025-09-21T22:31:14.522355Z absattachment articleinfo articlenumber articletitlenorm authfirstinitialnorm authfirstsurnamenorm cid cids contenttype copyright crossmark dateloaded dateloadedtxt datesearch datesort dateupdated dco docsubtype doctype doi eid ewtransactionid hubeid indexeddate issn issnnorm itemstage itemtransactionid itemweight openaccess openarchive pg pgfirst pii piinorm pubdatestart pubdatetxt pubyr sortorder srctitle srctitlenorm srctype ssids alllist content subj subheadings suppl tomb volfirst volissue volumelist webpdf webpdfpagecount yearnav figure table e-component body acknowledge affil appendices articletitle auth authfirstini authfull authkeywords authlast footnotes grantnumber grantsponsor grantsponsorid highlightsabst orcid primabst ref specialabst 0926-860X 0926860X true 708 708 C Volume 708 52 120594 120594 120594 20251225 25 December 2025 2025-12-25 2025 article fla © 2025 Elsevier B.V. All rights are reserved, including those for text and data mining, AI training, and similar technologies. SYNERGISTICNPCOORDINATIONENABLESLOWMELTINGHIGHCRYSTALLINITYSYNDIOTACTIC12POLYBUTADIENEVIAIRONBASEDCATALYST NA L 1 Introduction 2 Experimental 2.1 Materials and methods 2.2 Polymerization of BD 3 Results and discussion 3.1 Synthesis and characterization of 1,2-PB with Fe(acac)3/AIBN/TIBA system 3.2 Synthesis and characterization of 1,2-PB with Fe(acac)3/AIBN /PPh3/TIBA system 3.3 Proposed mechanism 4 Conclusions CRediT authorship contribution statement Acknowledgements Appendix A Supplementary material References RICCI 2010 661 G RICCI 2023 374 G RICCI 2024 501 G RICCI 2021 4067 G KUMAR 2021 393 A ZHANG 2021 108601 X RAYNAUD 2012 11805 J RICCI 2021 5879 G PORRI 1989 53 L COMPREHENSIVEPOLYMERSCIENCESUPPLEMENTS 5CONJUGATEDDIENEPOLYMERIZATION RICCI 2007 102 G NATTA 1959 526 G GIOVANNIRICCI 2005 1064 A RICCI 2005 1845 G RICCI 2001 5766 G NEWCHROMIUMII 2004 3727 LU 2006 4265 J RAYNAUD 2012 11805 J HU 2021 49686 Z RICCI 2003 287 G GONG 2009 5980 D HU 2020 111219 W CHEN 2022 e53127 Z PAN 2016 7580 W YU 2025 108723 Y SUN 1988 145 Q RICCI 2021 9947 G BAZZINI 2002 922 C GIBSON 2007 1745 V CHEN 2018 6 C CHAINOK 2010 10900 K BRESCIANI 2021 7088 G KUMAR 1983 365 D RICCI 2003 287 G ZHENG 2015 1182 W SEEWALD 2005 1829 O NAX2025X120594 NAX2025X120594XL 2027-09-26T00:00:00.000Z 2027-09-26T00:00:00.000Z http://creativecommons.org/licenses/by-nc-nd/4.0/ © 2025 Elsevier B.V. All rights are reserved, including those for text and data mining, AI training, and similar technologies. 2025-09-22T15:04:15.032Z http://vtw.elsevier.com/data/voc/AddOnTypes/50.7/aggregated-refined National Key R&D Program of China 2022YFB3704701 NKRDPC National Key Research and Development Program of China http://data.elsevier.com/vocabulary/SciValFunders/501100012166 http://sws.geonames.org/1814991/ Key Laboratory of Advanced Rubber Material ZR2022QE271 ZR2022ME154 XJCL2025003 Shandong Province Natural Science Foundation http://data.elsevier.com/vocabulary/SciValFunders/501100007129 http://sws.geonames.org/1814991 This work is supported by National Key R&D Program of China (2022YFB3704701), Natural Science Foundation of Shandong Province (ZR2022QE271, ZR2022ME154). Thanks for the project supported by the Foundation (No. XJCL2025003) of Key Laboratory of Advanced Rubber Material, Ministry of Education. https://doi.org/10.15223/policy-017 https://doi.org/10.15223/policy-037 https://doi.org/10.15223/policy-012 https://doi.org/10.15223/policy-029 https://doi.org/10.15223/policy-004 item S0926-860X(25)00496-X S0926860X2500496X 1-s2.0-S0926860X2500496X 10.1016/j.apcata.2025.120594 271346 2025-10-11T16:06:29.029052Z 2025-12-25 1-s2.0-S0926860X2500496X-main.pdf https://s3-eu-west-1.amazonaws.com/prod-ucs-content-store-eu-west/content/pii:S0926860X2500496X/MAIN/application/pdf/ead839ebc97e8c0cd157947e5257927a/main.pdf main.pdf pdf true 4582883 MAIN 7 1-s2.0-S0926860X2500496X-main_1.png https://s3-eu-west-1.amazonaws.com/prod-ucs-content-store-eu-west/content/pii:S0926860X2500496X/PREVIEW/image/png/94fbafcb5d281c935f0cc73aab7f46be/main_1.png main_1.png png 57998 928 656 IMAGE-WEB-PDF 1 1-s2.0-S0926860X2500496X-sc1.jpg https://s3-eu-west-1.amazonaws.com/prod-ucs-content-store-eu-west/content/pii:S0926860X2500496X/sc1/DOWNSAMPLED/image/jpeg/5d3c2f9d85954dfa1ef5f40461a9c59a/sc1.jpg sc1 sc1.jpg jpg 89174 562 678 IMAGE-DOWNSAMPLED 1-s2.0-S0926860X2500496X-sc1.sml https://s3-eu-west-1.amazonaws.com/prod-ucs-content-store-eu-west/content/pii:S0926860X2500496X/sc1/THUMBNAIL/image/gif/40491ea6d9e2bfa2fd5b1ff4089b099e/sc1.sml sc1 sc1.sml sml 9046 164 198 IMAGE-THUMBNAIL 1-s2.0-S0926860X2500496X-gr3.jpg https://s3-eu-west-1.amazonaws.com/prod-ucs-content-store-eu-west/content/pii:S0926860X2500496X/gr3/DOWNSAMPLED/image/jpeg/1029978eb3c4f7a43e8c5982a9a8e1e5/gr3.jpg gr3 gr3.jpg jpg 50827 275 789 IMAGE-DOWNSAMPLED 1-s2.0-S0926860X2500496X-gr3.sml https://s3-eu-west-1.amazonaws.com/prod-ucs-content-store-eu-west/content/pii:S0926860X2500496X/gr3/THUMBNAIL/image/gif/8b53f39682d0cc4de68525ff16c39388/gr3.sml gr3 gr3.sml sml 6120 76 219 IMAGE-THUMBNAIL 1-s2.0-S0926860X2500496X-gr2.jpg https://s3-eu-west-1.amazonaws.com/prod-ucs-content-store-eu-west/content/pii:S0926860X2500496X/gr2/DOWNSAMPLED/image/jpeg/d6b53734edcb5fc583545d406aa397e8/gr2.jpg gr2 gr2.jpg jpg 47485 273 788 IMAGE-DOWNSAMPLED 1-s2.0-S0926860X2500496X-gr2.sml https://s3-eu-west-1.amazonaws.com/prod-ucs-content-store-eu-west/content/pii:S0926860X2500496X/gr2/THUMBNAIL/image/gif/884442f52842f24caebffb09d81b7352/gr2.sml gr2 gr2.sml sml 5599 76 219 IMAGE-THUMBNAIL 1-s2.0-S0926860X2500496X-ga1.jpg https://s3-eu-west-1.amazonaws.com/prod-ucs-content-store-eu-west/content/pii:S0926860X2500496X/ga1/DOWNSAMPLED/image/jpeg/c98868c8da40b5bfd53cc4656219d7a0/ga1.jpg ga1 true ga1.jpg jpg 21757 200 401 IMAGE-DOWNSAMPLED 1-s2.0-S0926860X2500496X-ga1.sml https://s3-eu-west-1.amazonaws.com/prod-ucs-content-store-eu-west/content/pii:S0926860X2500496X/ga1/THUMBNAIL/image/gif/4c9540d4dc7c113088e116bf025eb1db/ga1.sml ga1 true ga1.sml sml 7317 109 219 IMAGE-THUMBNAIL 1-s2.0-S0926860X2500496X-gr1.jpg https://s3-eu-west-1.amazonaws.com/prod-ucs-content-store-eu-west/content/pii:S0926860X2500496X/gr1/DOWNSAMPLED/image/jpeg/3a0c176392652692a6ecc01137ff8f04/gr1.jpg gr1 gr1.jpg jpg 71902 559 791 IMAGE-DOWNSAMPLED 1-s2.0-S0926860X2500496X-gr1.sml https://s3-eu-west-1.amazonaws.com/prod-ucs-content-store-eu-west/content/pii:S0926860X25004818/gr1/THUMBNAIL/image/gif/b55c8d0af4771dd9a8f030312cbb7186/gr1.sml gr1 gr1.sml sml 8241 155 219 IMAGE-THUMBNAIL 1-s2.0-S0926860X2500496X-sc2.jpg https://s3-eu-west-1.amazonaws.com/prod-ucs-content-store-eu-west/content/pii:S0926860X2500496X/sc2/DOWNSAMPLED/image/jpeg/8302879fe540cfc552a179382f5e7e66/sc2.jpg sc2 sc2.jpg jpg 50938 343 678 IMAGE-DOWNSAMPLED 1-s2.0-S0926860X2500496X-sc2.sml https://s3-eu-west-1.amazonaws.com/prod-ucs-content-store-eu-west/content/pii:S0926860X2500496X/sc2/THUMBNAIL/image/gif/bb97688ee3608b03701200c61e9d4073/sc2.sml sc2 sc2.sml sml 4862 111 219 IMAGE-THUMBNAIL 1-s2.0-S0926860X2500496X-sc1_lrg.jpg https://s3-eu-west-1.amazonaws.com/prod-ucs-content-store-eu-west/content/pii:S0926860X2500496X/HIGHRES/image/jpeg/ecc7ffa525e675430edca5d5721ea18f/sc1_lrg.jpg sc1 sc1_lrg.jpg jpg 402150 2483 2994 IMAGE-HIGH-RES 1-s2.0-S0926860X2500496X-gr3_lrg.jpg https://s3-eu-west-1.amazonaws.com/prod-ucs-content-store-eu-west/content/pii:S0926860X2500496X/HIGHRES/image/jpeg/92ce697321adb82d5b759a5ffe5a79a4/gr3_lrg.jpg gr3 gr3_lrg.jpg jpg 251021 1219 3492 IMAGE-HIGH-RES 1-s2.0-S0926860X2500496X-gr2_lrg.jpg https://s3-eu-west-1.amazonaws.com/prod-ucs-content-store-eu-west/content/pii:S0926860X2500496X/HIGHRES/image/jpeg/5721fe3c4b3a20a0e0d2fcc75a15f6c3/gr2_lrg.jpg gr2 gr2_lrg.jpg jpg 233819 1208 3491 IMAGE-HIGH-RES 1-s2.0-S0926860X2500496X-ga1_lrg.jpg https://s3-eu-west-1.amazonaws.com/prod-ucs-content-store-eu-west/content/pii:S0926860X2500496X/HIGHRES/image/jpeg/3e3af371cba6cf7bfc482026b2570936/ga1_lrg.jpg ga1 true ga1_lrg.jpg jpg 145249 886 1778 IMAGE-HIGH-RES 1-s2.0-S0926860X2500496X-gr1_lrg.jpg https://s3-eu-west-1.amazonaws.com/prod-ucs-content-store-eu-west/content/pii:S0926860X25004818/HIGHRES/image/jpeg/85a97f67821c5ed7579361371565875b/gr1_lrg.jpg gr1 gr1_lrg.jpg jpg 365403 2468 3493 IMAGE-HIGH-RES 1-s2.0-S0926860X2500496X-sc2_lrg.jpg https://s3-eu-west-1.amazonaws.com/prod-ucs-content-store-eu-west/content/pii:S0926860X25004818/HIGHRES/image/jpeg/623c89213a0561056d97151ec6e1f2d2/sc2_lrg.jpg sc2 sc2_lrg.jpg jpg 233270 1517 2995 IMAGE-HIGH-RES 1-s2.0-S0926860X2500496X-mmc1.docx https://s3-eu-west-1.amazonaws.com/prod-ucs-content-store-eu-west/content/pii:S0926860X2500496X/mmc1/MAIN/application/vnd.openxmlformats-officedocument.wordprocessingml.document/7c4c553333ebae31283bf0d3ba1ae432/mmc1.docx mmc1 mmc1.docx docx 425332 APPLICATION APCATA 120594 120594 S0926-860X(25)00496-X 10.1016/j.apcata.2025.120594 Elsevier B.V. Fig. 1 (a) GPC traces of the PB obtained at different [Al]/[Fe] ratios (Table 1, Entry 10, 6, 11, 12); (b) 1H NMR of the representative PB (Table 1, Entry 6); (c) 13C NMR of the representative PB (Table 1, Entry 6) *denotes toluene; (d) The first cooling and (e) the second heating thermograms of DSC for PB obtained at different [Al]/[Fe] ratios (Table 1, Entry 10, 6, 11, 12). Fig. 1 Fig. 2 (a) XRD patterns of 1,2-PB (Entry 10) and 1,2-PB (Entry 14); (b) 13C NMR spectra of 1,2-PB (Entry 10) and 1,2-PB (Entry 14); (c) FTIR spectra of 1,2-PB (Entry 10) and 1,2-PB (Entry 14). Fig. 2 Fig. 3 (a) Effect of [BD]/[Fe] ratio on polymerization behaviors with Fe(acac)3/AIBN/PPh3/TIBA catalytic system; Polymerization conditions: in hexane at 50 °C for 2 h, [BD] = 1.85 mol L−1, P/Fe = 2, Al/Fe = 20, AIBN/Fe = 2; (b) The first cooling and (c) the second heating thermograms of DSC for 1,2-PB obtained at different [BD]/[Fe] ratios. Fig. 3 Scheme 1 (a) Some previous Fe-based catalytic systems for synthesizing syn-1,2-PB; (b) Fe(acac)3/AIBN/PPh3/AlR3 catalytic system used in this work. Scheme 1 Scheme 2 (a) Scheme for formation of 1,4 units vs 1,2 units; (b) Scheme for formation of syndiotactic and isotactic diads through (1) exo-exo and (2) exo-endo orientations, respectively, under the anti form (L denotes the ligand); (3) Proposed mechanism for formation of SPB using (1) Fe(acac)3/AIBN/TIBA and (2) Fe(acac)3/AIBN/PPh3/TIBA catalytic system. Scheme 2 Table 1 Effect of [Al]/[Fe] molar ratio on the polymerization of butadienea. Table 1 Entry [Al]/ [Fe] [AIBN]/[Fe] Yield (wt%) 1,2b (mol%) 1,4b (mol%) M n c× 10−4 M w/M n c T m d (℃) ΔH c d(J g−1) X c e (%) 1 f 0 2 0.0 -- -- -- -- -- -- -- 2 g 0 2 0.0 -- -- -- -- -- -- -- 3 h 20 0 0.0 -- -- -- -- -- -- -- 4 20 0.5 55.2 72.5 27.5 19.3 2.04 113.4 2.5 4.2 5 20 1 90.2 74.9 25.1 17.9 2.82 115.1 3.6 5.9 6 20 2 95.0 76.3 23.7 13.1 2.97 111.6 3.2 5.3 7 20 3 91.2 75.2 24.8 13.4 2.29 114.4 3.5 5.8 8 5 2 0.0 -- -- -- -- -- -- -- 9 10 2 25.2 73.5 26.5 n.d. n.d. -- -- -- 10 15 2 92.8 72.0 28.0 19.6 2.35 -- 0.5 0.8 11 25 2 96.5 76.9 23.1 14.0 2.67 106.7 3.1 5.1 12 30 2 95.5 75.5 24.5 17.9 2.82 114.4 3.5 5.7 aPolymerization conditions: in hexane at 50 °C for 2 h, [BD] = 1.85 mol L−1, [BD]/[Fe] = 10000; b Determined by 1H NMR; c M n and M w/M n determined by GPC (trichlorobenzene, PS calibration); d T m and crystallization enthalpy (ΔH c) Determined by DSC; e Crystallinity (X c) determined by the formula of ΔH/ΔH 0, where ΔH 0 refers to the standard enthalpy of 1,2-PB with 100 % crystallinity, equal to 60.7 J g−1; f Catalyst component: AIBN; g Catalyst component: Fe(acac)3/AIBN; h Catalyst component: Fe(acac)3/TIBA. Table 2 Effect of PPh3 on the polymerization of BDa. Table 2 Entry [Al]/[Fe] [P]/ [Fe] Yield (%) 1,2b (mol%) 1,4b (mol%) rrrr c (%) T g d (℃) T m d (℃) ΔH c d (J g−1) Xc e (%) 13 f 0 2 0.0 -- -- -- -- -- -- -- 14 15 2 87.0 73.0 27.0 22.7 −8.3 115.5 6.3 10.3 15 20 0.5 98.2 76.3 23.7 19.3 −7.0 106.7 3.0 5.0 16 20 1 91.8 78.7 21.3 24.6 −6.3 120.9 9.1 15.0 17 20 2 97.8 78.7 21.3 26.0 −6.4 119.8 11.0 18.126.0 18 20 3 98.4 75.2 24.8 26.0 −7.8 116.3 9.1 15.0 19 20 4 97.8 76.3 23.7 26.0 −9.2 113.4 8.0 13.2 a Polymerization conditions: in hexane at 50 °C for 2 h, [BD] = 1.85 mol L−1, [BD]/[Fe] = 10000, [AIBN]/[Fe] = 2; Catalyst component: Fe(acac)3/AIBN/PPh3/TIBA. b Determined by 1H NMR; c Determined by 13C NMR; d Determined by DSC; e Determined by the formula of ΔH/ΔH 0, where ΔH 0 refers to the standard enthalpy of 1,2-PB with 100 % crystallinity, equal to 60.7 J g−1; f Catalyst component: Fe(acac)3/PPh3/TIBA. Synergistic N-P coordination enables low-melting, high-crystallinity syndiotactic 1,2-polybutadiene via iron-based catalyst Lihua Na Investigation Data curation 1 Yunqing Fan Validation Data curation 1 Liang Fang Investigation Data curation ⁎ Xiaohua Wang Methodology Investigation Formal analysis Heng Liu Project administration Formal analysis Chunyu Zhang Writing – review & editing Funding acquisition ⁎ Xuequan Zhang Validation Project administration Qi Yang Writing – review & editing Project administration Funding acquisition Conceptualization ⁎ Key laboratory of Advanced Rubber Material, Ministry of Education, Key Lab of Rubber-Plastics, Ministry of Education/Shandong Provincial Key Lab of Rubber-Plastics, School of Polymer Science and Engineering, Qingdao University of Science & Technology, Qingdao 266042, China Key laboratory of Advanced Rubber Material, Ministry of Education, Key Lab of Rubber-Plastics, Ministry of Education/Shandong Provincial Key Lab of Rubber-Plastics, School of Polymer Science and Engineering, Qingdao University of Science & Technology Qingdao 266042 China Key laboratory of Advanced Rubber Material, Ministry of Education, Key Lab of Rubber-Plastics, Ministry of Education/Shandong Provincial Key Lab of Rubber-plastics, School of Polymer Science and Engineering, Qingdao University of Science & Technology, Qingdao, 266042, China ⁎ Corresponding authors. 1 Lihua Na and Yunqing Fan contribute equally to this work. Syndiotactic 1,2-polybutadiene (SPB) is promising crystalline material with high wear resistance, yet its practical applications remain limited due to excessively high melting temperature (Tₘ), which hinder melt processing. In this study, we report a novel iron-based catalyst system, Fe(acac)3/AIBN/PPh3/AlR3, that enables the synthesis of SPB with low melting temperature (T m) (< 120 °C) and relatively high crystallinity (up to 18 %), thereby addressing a long-standing challenge. The catalyst design features a synergistic N-P coordination strategy: AIBN serves as the primary ligand, coordinating to the Fe center via cyano groups to modulate its electronic and steric environment, effectively lowering Tₘ while promoting syndiotactic monomer insertion. Meanwhile, PPh3 functions as an auxiliary ligand, enhancing stereoselectivity by fine-tuning the coordination geometry through its strong σ-donating character. Comparative studies reveal that the presence of PPh3 significantly improves the syndiotacticity and crystallinity of the resulting polymers without compromising catalytic activity. This work not only provides a simple and scalable catalyst platform for producing processable crystalline polybutadiene, but also offers new mechanistic insights into ligand field modulation for stereocontrol in Fe-catalyzed diene polymerizations, paving the way for future advances in tunable diene synthesis. Graphical Abstract Keywords Syndiotactic-1,2-polybutadiene Iron-based catalyst N-P coordination Stereocontrol Data availability Data will be made available on request. 1 Introduction Depending on its regio- and/or stereo- microstructure, polybutadiene (PB) is capable of demonstrating distinctly different mechanical properties, that play a pivotal role in governing its application fields [1–5]. Cis-1,4-PB performs excellent elasticity, and serves as the primary elastomer for the current tire industry; trans-1,4-PB, known for its rigidity, is used in applications requiring high mechanical strength [6,7]; syn-/iso-1,2-PB are crystalline polymers valued for their wear-resistance, and serve the shoe sole market [8,9]. In contrast to the wide applications of cis-/trans-1,4-PB, syn-/iso-1,2-PB are comparatively underutilized. One of the possible reasons lies in that these two polymers feature high crystallinity and hence are accompanied with very high melting temperature (T m typically > 150 °C), which brings in a severe processability problem because the pendent CC double bond may undergo crosslinking upon melting. Typically, highly crystalline syndiotactic 1,2-PB exhibits Tₘ values in the range of ∼120–190 °C (sometimes up to 200 °C), far above the processing window where undesired crosslinking may occur. Based on this consideration, preparing syn-/iso-1,2-PB that maintain high crystallinity but possess a lower T m (preferably below 120 °C) could fully resolve the above processing issue and greatly expand their potential applications. Among the two stereoregular forms of 1,2-PB, iso-1,2-PB is more synthetically challenging because it requires consecutive same-side insertions in a 1,2-fashion, a pathway that is sterically demanding and thermodynamically disfavored for most coordination catalysts [8]; thus, it has so far been accessible only via a few specially designed chromium-based systems [10]. Consequently, most academic research and industrial interest have been largely concentrated on the syn form [8,10]. Over the past decades, a variety of catalytic systems-based on vanadium (V) [11], cobalt (Co) [12,13], chromium (Cr) [14,15], and iron (Fe) [16] have been developed to promote the stereospecific polymerization of 1,3-butadiene (BD) to syndiotactic 1,2-polybutadiene (SPB). Compared with representative Co- and Cr-based catalysts that usually rely on CS2 or toxic halogenated/aromatic solvents (Table S1), and are also inherently toxic to humans, Fe-based catalysts stand out due to their low toxicity, earth abundance, and environmental sustainability [17–19]. Our previous work focused on Fe catalysts bearing phosphorus ligands, such as phosphite or phosphate derivatives, which yielded SPB with high crystallinity and T m exceeding 150 °C, suitable for reinforcing rubber composites [20–23]. However, efforts to lower T m by either decreasing aluminum alkyl loading or increasing phosphorus ligand content resulted in excessively reduced crystallinity or even loss of stereoregularity, leading to atactic 1,2-PB [24]. To overcome these challenges, several Fe-based systems incorporating nitrogen ligands have been explored. For instance, Ricci et al. demonstrated that FeCl₂(bipyridine)₂/MAO and FeCl₂(phenanthroline)/MAO catalysts could produce SPB with T m below 140 °C [19,25], while FeCl₂(iminopyridine)/MAO complexes further lowered T m to the range of 68 °C to 106 °C [26,27]. Nevertheless, existing systems still face intrinsic limitations: (1) Phosphorus-based ligands, despite their strong σ-donor ability to enhance syndiotacticity (pentad rrrr: 65–95 %), overly increase the electron density of the Fe center, thereby limiting the tunability of T m; (2) Nitrogen-based ligands, while being weaker σ-donors that facilitate modulation of the metal center’s electronic environment, typically suffer from low coordination strength and thermal stability, resulting in ligand dissociation and catalyst deactivation at elevated temperature. These limitations underscore the need for alternative ligand frameworks that balance electronic modulation with robust coordination stability to achieve both stereocontrol and desirable crystallization behavior in SPB. To this end, we report a novel Fe-based catalytic system, Fe(acac)3/AIBN/PPh3/AlR3, that leverages a synergistic nitrogen-phosphorus coordination strategy to achieve stereospecific 1,2-polymerization of BD. In this design, AIBN functions as the primary ligand, coordinating to the Fe(III) center via its cyano groups. As a weak-field nitrogen donor, AIBN effectively tunes the electron density of the metal center, enabling control over the T m of the resulting polymer. Meanwhile, its steric profile favors syndiotactic monomer insertion and contributes to the stability of the active species under reaction conditions. PPh3 acts as an auxiliary ligand, providing complementary electronic effects. Although not required for catalyst activation, its strong σ-donor ability subtly modulates the coordination environment around Fe, further promoting syndiotacticity through enhanced control over monomer insertion geometry. This synergistic ligand design offers several key advances: (i) it provides a minimalistic and low-cost platform using readily available ligands (AIBN and PPh3), facilitating scalability and industrial adoption; (ii) it achieves SPB with high crystallinity (up to 18 %) and T m below 120 °C, effectively addressing the long-standing processing bottleneck; and (iii) it offers new mechanistic insights into stereocontrol via ligand field modulation in Fe-catalyzed diene polymerizations, and is readily generalizable to other metal-catalyst systems for the precision synthesis of stereoregular polymers. Scheme 1 2 Experimental 2.1 Materials and methods Ferric acetylacetonate (Fe(acac)3), 2,2′-Azobis(2-methylpropionitrile) (AIBN) and triphenylphosphine (PPh3) were supplied by Macklin. BD was purchased from Qingdao Ludong Gas Co. LTD and purified by passing through two columns filled with 4 Å molecular sieve and KOH before use. Tri-isobutyl aluminium (TIBA) was a commercial product of Aldrich and used as the hexane solutions (0.02 mol L−1). Hexane was refluxed over CaH2 for one day and then distilled prior to use. All other reagents were utilized as received. 1H NMR and 13C NMR spectra were recorded on a Varian Unity spectrometer (400 MHz) at 120 °C in 1,1,2,2-tetrachloroethane-d2 with tetramethylsilane (TMS) as internal reference. The microstructures and stereoregularity of polymers were determined by 1H NMR and 13C NMR, respectively. The pentad (rrrr) denotes the syndiotacticity which can be determined by the Equation: rrrr (%) = rrrr/(mrrm + mrrr + rrrr + mmrm + mmrr + rmrr + rmrm). The infrared spectra were collected on a Bruker Vertex 70 spectrometer. The number-average molecular weight (M n), weight-average molecular weight (M w) and molecular weight distribution (PDI) of the resultant polymers were measured by gel permeation chromatography (GPC) on a PL-GPC 220 high-temperature chromatograph at 120 °C. 1,2,4-Trichlorobenzene was employed as eluent at a flow rate of 1.0 ml min−1 and polystyrene as calibration. Wide angle X-ray scattering experiments were carried out by using the XRD-6100 instrument equipped with curved graphite crystal-filtered CuKa1 radiation (λ = 0.15406 nm) (Shimadzu Japan). The melting-crystallization behaviors were estimated on a Q20 DSC (TA Company) under a nitrogen atmosphere with a heating and cooling rate of 10 °C min−1. X-ray photoelectron spectroscopy (XPS) measurements were carried out using a Thermo Fisher Scientific K-Alpha spectrometer with X-ray source (1486.8 eV). The spot size was from 50 to 400 μm, the binding energy range was −5–1350 eV, and the dwell time was set to 100 ms. 2.2 Polymerization of BD All polymerization reactions were performed in a flame-dried Schlenk-type glassware under an argon atmosphere. In a general procedure, BD in hexane (1.85 mol L−1) was firstly charged into a glassware, then a predetermined amount of Fe(acac)3, AIBN, PPh3 and TIBA were injected into the glassware in order. After the polymerization was kept at 50 °C for 2 h, the reaction was immediately terminated by adding of acidified ethanol containing 1.0 wt% 2,6-di-tert-butyl-4-methylphenol (BHT) as antioxidant reagent. This quench step also converts remaining alkylaluminum species into ethanol-soluble aluminum salts, which were removed by washing. The polymer was isolated by filtration and dried in a vacuum oven at 45 °C overnight to constant weight. 3 Results and discussion 3.1 Synthesis and characterization of 1,2-PB with Fe(acac)3/AIBN/TIBA system In the past decades, transition metal complexes with imine derivative ligands have represented a class of powerful catalysts to polymerize conjugated dienes. The pivotal structure of such catalysts is the coordination of an imine group(CN) as the donor to the metal cationic active species [28,29]. AIBN, a common free radical initiator that contains an azo group cleavable into two free radicals at high temperature, has two cyano groups that can also coordinate with the metal center like imine groups. To elucidate the role of AIBN in this study, a series of contrast experiments were conducted under otherwise identical polymerization conditions. First, BD polymerization with AIBN as the sole additive afforded no polymer after 2 h at 50 °C ( Table 1, Entry 1). Even when the polymerization was performed at 80 °C where AIBN readily decomposes to free radicals, no polymer formation was detected (Table S2, Entry 1), indicating that AIBN also can not initiate BD polymerization under our conditions. Second, comparative experiments (Entry 2–3) confirmed that systems containing Fe(acac)3/AIBN or Fe(acac)3/TIBA exhibited no activity, whereas the ternary Fe(acac)3/AIBN/TIBA displayed significant activity, as shown in Entry 4–7. Finally, a radical-scavenger experiment was carried out by adding BHT, a well-known radical trap, to the Fe(acac)3/AIBN/TIBA system. Polymerization still proceeded in comparable yield (Table S2, Entry 2), suggesting that free radical pathways are not dominant. These results, combined with literature precedents for Fe-nitrile coordination [30,31], support our conclusion that in this catalytic system AIBN functions as a ligand coordinating to the Fe center rather than as a radical initiator. A systematic investigation of the [AIBN]/[Fe] and [Al]/[Fe] ratios (Entry 4–12) revealed that polymer yield increased with higher [AIBN]/[Fe] and [Al]/[Fe] ratios, plateauing at [AIBN]/[Fe] = 2 and [Al]/[Fe] = 20. This behavior can be attributed to the gradual formation and subsequent saturation of the active species. Notably, the M n of the resulting PB were consistently lower than theoretical values, indicating the occurrence of chain transfer reactions during polymerization. GPC traces ( Fig. 1a) revealed unimodal and relatively narrow molecular weight distributions, confirming the single-site nature of the Fe(acac)3/AIBN/TIBA system. The microstructure of the resulting PB was analyzed by 1H and 13C NMR spectroscopy (Fig. 1b-c). Resonances in the 1H NMR spectrum at 4.7–5.0 ppm correspond to terminal protons of 1,2-units, while signals at 5.1–5.5 ppm are attributed to internal protons from both 1,2- and 1,4-units. In the 13C NMR spectrum, peaks at 116.2 and 114.3 ppm correspond to vinyl carbons of 1,2-units, and those at 129.0 and 132.0 ppm confirm the presence of cis- and trans-1,4-units [32]. Quantitative analysis indicated that all samples possessed high 1,2-vinyl content (above 72 mol%). Interestingly, the 1,2-selectivity showed limited dependence on [Al]/[Fe] or [AIBN]/[Fe] ratios, with only a slight increase from 72 % to 77 % as [Al]/[Fe] increased. This stability is distinct from Fe catalysts bearing dialkylphosphite or triphenyl phosphate ligands. Such stability ensures that variations in catalyst component ratios have minimal influence on the polymer microstructure, which is beneficial for maintaining consistent product quality in industrial-scale synthesis. DSC measurements (Table 1 and Fig. 1d-e) were employed to evaluate the crystallization behavior of the produced 1,2-PB. For samples prepared at [Al]/[Fe] ratios below 15, no discernible melting transition was observed, indicating a largely amorphous structure. At [Al]/[Fe] = 20 (Entry 6), weak crystallization and T m at 111.6 °C were observed, with ΔH c of 3.2 J g⁻¹ , corresponding to a crystallinity of 5.3 %. Further increase in [Al]/[Fe] to 25 or 30 did not significantly influence thermal properties, suggesting a plateau in crystallinity enhancement. This behavior can be ascribed to incomplete alkylation of Fe centers at low [Al]/[Fe], which favors more atactic insertion, while higher [Al]/[Fe] yields fully alkylated sites that promote syndiotactic insertion and higher crystallinity; beyond ∼20, extra Al only stabilizes the sites without further enhancing stereoregularity. These results indicate that altering polymerization parameters within this system only moderately affects crystallinity, limiting its use for fine-tuning thermal properties. 3.2 Synthesis and characterization of 1,2-PB with Fe(acac)3/AIBN /PPh3/TIBA system The steric and electronic effects of ligands are critical in dictating the insertion mode of monomers with respect to the allylic-type growing species, thus influencing the microstructure and stereoselectivity of the resulting polymers. In particular, Lewis base ligands such as phosphines or CS2 have been reported to significantly enhance the 1,2-vinyl content in PB during cobalt-mediated BD polymerization. In this study, PPh3 as employed as an ancillary ligand in the Fe(acac)3/AIBN/TIBA catalytic system for the polymerization of BD. To elucidate the role of PPh3, a control experiment was conducted using a catalytic system comprising Fe(acac)3, PPh3, and TIBA but omitting AIBN. As shown in Table 2, Entry 13, this system exhibited no activity, indicating that the Fe-PPh3 species alone does not form active sites in the absence of AIBN. In contrast, the complete system with Fe(acac)3/AIBN/PPh3/TIBA demonstrated high catalytic activity. Under hexane at 50 °C for 2 h (Table 2), our catalyst remains stable and active, demonstrating markedly improved thermal robustness compared to previously reported FeCl2(bipy)/MAO systems, which typically require low polymerization temperature [33]. To further evaluate the influence of PPh3, a comparative study was conducted under identical conditions, except for the absence or presence of PPh3 (Table 1, Entry 10 and Table 2, Entry 14, respectively). Notably, the polymer obtained from Entry 10 displayed no discernible melting transition, while the sample from Entry 14 exhibited T m at 115.5 °C and ΔH c of 6.3 J g⁻¹ , corresponding to a calculated crystallinity (X c) of 10.5 %. These findings confirm that the presence of PPh3 significantly enhances the crystallization behavior of 1,2-PB. In addition to T m, glass transition temperature (T g) for the samples in Table 2 were observed in the range of −6.3 to −9.2 °C (Fig. S1), noticeably higher than the ca. −38 °C commonly observed for random 1,2-PB [34], likely reflecting restriction of chain mobility by crystalline domains. This improved crystallinity is further substantiated by wide-angle X-ray diffraction (XRD) analysis ( Fig. 2a). The polymer from Entry 10 exhibited a broad amorphous halo with weak intensity, while the product from Entry 14 displayed five distinct diffraction peaks indexed to crystalline planes (010), (200)/(110), (210), (111)/(201), and (120). Our prior studies have shown that the crystallinity of SPB is closely related to the stereoregularity of the 1,2-units, particularly the syndiotactic pentad (rrrr) content. Accordingly, the comparison of 13C NMR spectra (Fig. 2b) revealed a prominent increase in the rrrr pentad signal at 116.1 ppm in the polymer from Entry 14, which rose from 17.0 % (Entry 10) to 22.7 % (Entry 14). Complementary FTIR analysis (Fig. 2c) showed that the characteristic absorption at 667 cm−1 which is attributed to the out-of-plane deformation of pendant vinyl groups in a syndiotactic arrangement was also significantly enhanced in Entry 14 [21], further supporting the conclusion that PPh3 enhances the stereoregularity and crystallinity of the polymer. To further investigate the influence of PPh3, a series of experiments varying the [P]/[Fe] ratio were conducted (Table 2, Entry 15–19). In all cases, monomer conversions exceeded 95 %, indicating that the catalytic activity remained unaffected. While the 1,2-regioselectivity (74.6–78.7 %) showed little change, the syndiotacticity index increased with higher [P]/[Fe] ratios and reached a maximum of 26.0 % at ratio of 2. This value corresponds to a crystallinity of 18.1 %, which is comparable to that of previously reported Co-based SPB, as summarized in Table S1 [35]. Further increases in PPh3 content (Entry 18–19) did not lead to additional improvements in stereoregularity or crystallinity, likely due to over-saturation of the coordination sphere caused by the steric bulk of excess PPh3. These results suggest that a [P]/[Fe] ratio of 2 provides an optimal balance between coordination and steric effects, maximizing structural control without compromising catalytic efficiency. To evaluate the scalability and robustness of the catalytic system, polymerizations were carried out at various monomer-to-catalyst ratios ([BD]/[Fe]), ranging from 5000 to 40,000 ( Fig. 3a). The results showed that increasing the [BD]/[Fe] ratio had minimal impact on monomer conversion (all >90 %), crystallinity, and 1,2-content. This suggests that the Fe(acac)3/AIBN/PPh3/TIBA system retains high catalytic efficiency and product consistency over a wide range of conditions, owing to the strong coordination of the synergistic ligands that prevent catalyst deactivation and side reactions even under diluted conditions. In addition, GPC analysis (Table S3) revealed that the M n increased with higher [BD]/[Fe] ratios, while the M w/M n showed only a slight broadening but still remained in a reasonable range of 2.24–3.12, confirming stable control over chain growth. DSC thermograms of the resultant polymers (Fig. 3b-c) confirmed consistent thermal properties across different [BD]/[Fe] ratios, with negligible shifts in crystallization or melting behavior. These findings demonstrate that the catalytic system maintains high performance even under dilute catalyst conditions, enhancing its applicability in large-scale production. Scheme 2. 3.3 Proposed mechanism Based on the polymerization results and structural analyses, a plausible polymerization mechanism is proposed (Scheme 2). Initially, BD inserts into the Fe-C bond to form an allylic propagating species, which can adopt either an anti or syn configuration. Each configuration presents two reactive sites (C1 and C3), leading to the formation of 1,4- or 1,2-units. The cis-1,4 structure typically arises from the anti-configuration, while the trans-1,4 structure originates from the syn form (Scheme 2a). The stereochemistry of the 1,2-units depends on the orientation of monomer insertion; exo-exo and exo-endo orientations result in different stereoisomers, including syndiotactic (rrrr) and isotactic diads (Scheme 2b). The coordination environment around the metal center plays a key role in determining this selectivity. In the Fe(acac)3/AIBN/TIBA system, the cyano group of AIBN acts as a weak Lewis base and stabilizes the Fe center through coordination, most plausibly in a monodentate end-on fashion as commonly observed for Fe-nitrile complexes [30,31]. However, its limited steric and electronic influence results in low stereoregularity and poor crystallinity in the produced 1,2-PB. In contrast, introducing PPh3 into the Fe(acac)3/AIBN/PPh3/TIBA system creates a stronger ligand field and greater steric hindrance. XPS analysis (Fig. S2) provided direct evidence for Fe-P coordination: the P2p peak of the Fe(acac)3/PPh3 mixture showed a binding energy shift of ca. + 2.4 eV relative to free PPh3, confirming coordination between phosphorus and Fe. Previous studies on Fe-phosphine complexes have shown that PPh3 ligation strengthens Fe-P bonds and increases electron density at the metal center, which not only stabilizes the active species but also alters the steric environment [36]. These effects favor exo-exo insertion (Scheme 2c), promoting the formation of syndiotactic 1,2-units and leading to a more ordered polymer structure. Consequently, PPh3 not only slightly improves 1,2-regioselectivity but also significantly enhances stereoregularity and crystallinity. This interpretation is supported by NMR, XRD, and DSC analyses. 4 Conclusions In summary, a series of SPB with T m in the range of 106–120 °C and tunable crystallinity were successfully synthesized using a Fe(acac)3-based catalytic system. Compared with the Fe(acac)3/AIBN/TIBA system, the introduction of PPh3 significantly enhanced the crystallinity of the resulting 1,2-PB, without compromising catalytic efficiency or 1,2-regioselectivity. Detailed structural analyses revealed that this improvement stems from an increased syndiotacticity of the polymer backbone. A plausible mechanism was proposed, wherein PPh3 modifies the coordination environment and steric profile of the Fe center, promoting exo-exo insertion and favoring syndiotactic growth. This work highlights the synergistic role of AIBN and PPh3 as co-ligands in tuning both regio- and stereoselectivity, offering a practical and efficient strategy for producing highly crystalline SPB. Moreover, achieving T m values below 120 °C, even with modest crystallinity of 5–18 %, represents a practical breakthrough, as it expands the feasible melt-processing window to ∼100–120 °C while still ensuring minimal crystalline domains for dimensional stability and initial wear resistance. The simplicity, scalability, and robustness of the catalytic system underscore its strong potential for industrial application. CRediT authorship contribution statement Liang Fang: Investigation, Data curation. Xiaohua Wang: Methodology, Investigation, Formal analysis. Yunqing Fan: Validation, Data curation. Qi Yang: Writing – review & editing, Project administration, Funding acquisition, Conceptualization. Lihua Na: Investigation, Data curation. Xuequan Zhang: Validation, Project administration. Heng Liu: Project administration, Formal analysis. Chunyu Zhang: Writing – review & editing, Funding acquisition. Declaration of Competing interest The authors declare that they have no known competing financial interests or personal relationships that could have appeared to influence the work reported in this paper. Acknowledgements This work is supported by National Key R&D Program of China (2022YFB3704701), Natural Science Foundation of Shandong Province (ZR2022QE271, ZR2022ME154). Thanks for the project supported by the Foundation (No. XJCL2025003) of Key Laboratory of Advanced Rubber Material, Ministry of Education. Appendix A Supporting information Supplementary data associated with this article can be found in the online version at doi:10.1016/j.apcata.2025.120594. Appendix A Supplementary material Supplementary material References [1] G. Ricci A. Sommazzi F. Masi M. Ricci A. Boglia G. Leone Well-defined transition metal complexes with phosphorus and nitrogen ligands for 1,3-dienes polymerization Coord. Chem. Rev. 254 2010 661 G. Ricci, A. Sommazzi, F. Masi, M. Ricci, A. Boglia, G. Leone, Well-defined transition metal complexes with phosphorus and nitrogen ligands for 1,3-dienes polymerization, Coord. Chem. Rev. 254 (2010) 661. [2] G. Ricci G. Leone G. Zanchin F. Masi M. Guelfi G. Pampaloni Dichloro (2, 2′-bipyridine) copper/MAO: an active and stereospecific catalyst for 1, 3-diene polymerization Molecules 28 2023 374 G. Ricci, G. Leone, G. Zanchin, F. Masi, M. Guelfi, G. Pampaloni, Dichloro (2, 2′-bipyridine) copper/MAO: an active and stereospecific catalyst for 1, 3-diene polymerization, Molecules 28 (2023) 374. [3] G. Ricci A. Sommazzi F. Masi A. Forni Polymerization of 1, 3-butadiene with catalysts based on cobalt dichloride complexes with aminophosphines: switching the regioselectivity by varying the MAO/Co molar ratio Chin. J. Polym. Sci. 42 2024 501 G. Ricci, A. Sommazzi, F. Masi, A. Forni, Polymerization of 1, 3-butadiene with catalysts based on cobalt dichloride complexes with aminophosphines: switching the regioselectivity by varying the MAO/Co molar ratio, Chin. J. Polym. Sci. 42 (2024) 501. [4] G. Ricci G. Leone G. Zanchin B. Palucci A. Forni A. Sommazzi F. Masi S. Zacchini M. Guelfi G. Pampaloni Some novel cobalt diphenylphosphine complexes: synthesis, characterization, and behavior in the polymerization of 1, 3-butadiene Molecules 26 2021 4067 G. Ricci, G. Leone, G. Zanchin, B. Palucci, A. Forni, A. Sommazzi, F. Masi, S. Zacchini, M. Guelfi, G. Pampaloni, Some novel cobalt diphenylphosphine complexes: synthesis, characterization, and behavior in the polymerization of 1, 3-butadiene, Molecules 26 (2021) 4067. [5] A. Kumar S. Mohanty V.K. Gupta Butadiene rubber: synthesis, microstructure, and role of catalysts Rubber Chem. Technol. 94 2021 393 A. Kumar, S. Mohanty, V.K. Gupta, Butadiene rubber: Synthesis, microstructure, and role of catalysts, Rubber Chem. Technol. 94 (2021) 393. [6] X. Zhang L. Cai A. He H. Ma Y. Li Y. Hu X. Zhang L. Liu Facile strategies for Green tire tread with enhanced filler-matrix interfacial interactions and dynamic mechanical properties Compos. Sci. Technol. 203 2021 108601 X. Zhang, L. Cai, A. He, H. Ma, Y. Li, Y. Hu, X. Zhang, L. Liu, Facile strategies for green tire tread with enhanced filler-matrix interfacial interactions and dynamic mechanical properties, Compos. Sci. Technol. 203 (2021) 108601. [7] J. Raynaud J.Y. Wu T. Ritter Iron-catalyzed polymerization of isoprene and other 1, 3-dienes Angew. Chem. Int. Ed. 51 2012 11805 J. Raynaud, J.Y. Wu, T. Ritter, Iron-catalyzed polymerization of isoprene and other 1, 3-dienes, Angew. Chem. Int. Ed. 51 (2012) 11805. [8] G. Ricci G. Pampaloni A. Sommazzi F. Masi Dienes polymerization: where we are and what lies ahead Macromolecules 54 2021 5879 G. Ricci, G. Pampaloni, A. Sommazzi, F. Masi, Dienes Polymerization: Where We Are and What Lies Ahead, Macromolecules 54 (2021) 5879. [9] L. Porri A. Giarrusso 5-Conjugated diene polymerization G. Allen J.C. Bevington Comprehensive Polymer Science and Supplements 1989 Pergamon, Amsterdam 53 L. Porri, A. Giarrusso, 5-Conjugated Diene Polymerization, in: G. Allen, J.C. Bevington (Eds.), Comprehensive Polymer Science and Supplements, Pergamon, Amsterdam, 1989, pp. 53. [10] G. Ricci A. Boglia T. Motta Synthesis of new Cr(II) complexes with bidentate phosphine ligands and their behavior in the polymerization of butadiene J. Mol. Catal. A Chem. 267 2007 102 G. Ricci, A. Boglia, T. Motta, Synthesis of new Cr(II) complexes with bidentate phosphine ligands and their behavior in the polymerization of butadiene, J. Mol. Catal. A: Chem. 267 (2007) 102. [11] G. Natta L. Porri G. Zanini L. Fiore Polimerizzazioni stereospecifiche di diolefine coniugate−nota IV. Preparazione del polibutadiene 1,2 sindiotattico Chim. Ind. (Milano) 41 1959 526 G. Natta, L. Porri, G. Zanini, L. Fiore, Polimerizzazioni stereospecifiche di diolefine coniugate−Nota IV. Preparazione del polibutadiene 1,2 sindiotattico Chim. Ind. (Milano) 41 (1959) 526. [12] A.F. Giovanni Ricci Aldo Boglia Tiziano Motta Giulio Zannoni Maurizio Canetti Fabio Bertini Synthesis and X-ray structure of CoCl2(PiPrPh2)2. a new highly active and stereospecific catalyst for 1,2 polymerization of conjugated dienes when used in association with MAO Macromolecules 38 2005 1064 A.F. Giovanni Ricci, Aldo Boglia, Tiziano Motta, Giulio Zannoni, Maurizio Canetti, and Fabio Bertini, Synthesis and X-ray Structure of CoCl2(PiPrPh2)2. A New Highly Active and Stereospecific Catalyst for 1,2 Polymerization of Conjugated Dienes When Used in Association with MAO, Macromolecules 38 (2005) 1064. [13] G. Ricci A. Forni A. Boglia A. Sommazzi F. Masi Synthesis, structure and butadiene polymerization behavior of CoCl2(PRxPh3−x)2 (R = methyl, ethyl, propyl, allyl, isopropyl, cyclohexyl; x=1, 2). influence of the phosphorous ligand on polymerization stereoselectivity J. Organomet. Chem. 690 2005 1845 G. Ricci, A. Forni, A. Boglia, A. Sommazzi, F. Masi, Synthesis, structure and butadiene polymerization behavior of CoCl2(PRxPh3−x)2 (R = methyl, ethyl, propyl, allyl, isopropyl, cyclohexyl; x=1, 2). Influence of the phosphorous ligand on polymerization stereoselectivity, J. Organomet. Chem. 690 (2005) 1845. [14] Giovanni Ricci M. Battistella Chemoselectivity and stereospecificity of Chromium(II) catalysts for 1,3-Diene polymerization Macromolecules 34 2001 5766 Giovanni Ricci, M. Battistella, Chemoselectivity and Stereospecificity of Chromium(II) Catalysts for 1,3-Diene Polymerization, Macromolecules 34 (2001) 5766. [15] New Chromium(II) Bidentate phosphine complexes: synthesis, characterization, and behavior in the polymerization of 1,3-Butadiene Organometallics 23 2004 3727 New Chromium(II) Bidentate Phosphine Complexes: Synthesis, Characterization, and Behavior in the Polymerization of 1,3-Butadiene, Organometallics 23 (2004) 3727. [16] J. Lu Y. Hu X. Zhang J. Bi W. Dong L. Jiang B. Huang Fe(2-EHA)3/Al(I-Bu)3/hydrogen phosphite catalyst for preparing syndiotactic 1,2-polybutadiene J. Appl. Polym. Sci. 100 2006 4265 J. Lu, Y. Hu, X. Zhang, J. Bi, W. Dong, L. Jiang, B. Huang, Fe(2-EHA)3/Al(i-Bu)3/hydrogen phosphite catalyst for preparing syndiotactic 1,2-polybutadiene, J. Appl. Polym. Sci. 100 (2006) 4265. [17] J. Raynaud J.Y. Wu T. Ritter Iron-Catalyzed polymerization of isoprene and other 1,3-Dienes Angew. Chem. Int. Ed. 51 2012 11805 J. Raynaud, J.Y. Wu, T. Ritter, Iron-Catalyzed Polymerization of Isoprene and Other 1,3-Dienes, Angew. Chem. Int. Ed. 51 (2012) 11805. [18] Z. Hu Y. Xu W. Hu W. Luo Y. Zhao W. Huang D. Gong Synthesis and properties of syndiotactic 1,2-polybutadiene catalyzed by iron catalyst with phosphate as additive J. Appl. Polym. Sci. 138 2021 49686 Z. Hu, Y. Xu, W. Hu, W. Luo, Y. Zhao, W. Huang, D. Gong, Synthesis and properties of syndiotactic 1,2-polybutadiene catalyzed by iron catalyst with phosphate as additive, J. Appl. Polym. Sci. 138 (2021) 49686. [19] G. Ricci D. Morganti A. Sommazzi R. Santi F. Masi Polymerization of 1,3-dienes with iron complexes based catalysts: influence of the ligand on catalyst activity and stereospecificity J. Mol. Catal. AChem. 204 2003 287 G. Ricci, D. Morganti, A. Sommazzi, R. Santi, F. Masi, Polymerization of 1,3-dienes with iron complexes based catalysts: Influence of the ligand on catalyst activity and stereospecificity, J. Mol. Catal. A-Chem. 204 (2003) 287. [20] D.R. Gong W.M. Dong Y.M. Hu J.F. Bi X.Q. Zhang L.S. Jiang Syndiotactically enriched 1,2-selective polymerization of 1,3-butadiene initiated by iron catalysts based on a new class of donors Polymer 50 2009 5980 D.R. Gong, W.M. Dong, Y.M. Hu, J.F. Bi, X.Q. Zhang, L.S. Jiang, Syndiotactically enriched 1,2-selective polymerization of 1,3-butadiene initiated by iron catalysts based on a new class of donors, Polymer 50 (2009) 5980. [21] W.H. Hu Y.C. Xu W.L. Ying Z.H. Hu W.W. Luo F.M. Tang W.Z. Huang X.Y. Jia D.R. Gong 1,2-Syndiotactic polymerization of butadiene catalyzed by iron (III) acetylacetonate in combination with exogenous phosphate Mol. Catal. 497 2020 111219 W.H. Hu, Y.C. Xu, W.L. Ying, Z.H. Hu, W.W. Luo, F.M. Tang, W.Z. Huang, X.Y. Jia, D.R. Gong, 1,2-Syndiotactic polymerization of butadiene catalyzed by iron (III) acetylacetonate in combination with exogenous phosphate, Mol. Catal. 497 (2020) 111219. [22] Z. Chen X. Xu Y. Zhou H. Liu S. Cui D. Gong Fe-based catalyst with diphenylphosphite as donor for stereopolymerization of butadiene, isoprene, and myrcene J. Appl. Polym. Sci. 139 2022 e53127 Z. Chen, X. Xu, Y. Zhou, H. Liu, S. Cui, D. Gong, Fe-based catalyst with diphenylphosphite as donor for stereopolymerization of butadiene, isoprene, and myrcene, J. Appl. Polym. Sci. 139 (2022) e53127. [23] W.J. Pan H.F. Chen R. Sun D.R. Gong X.Y. Jia Y.M. Hu X.Q. Zhang Highly 1,2 Regio- and stereoselective polymerization of 1,3-Butadiene initiated by iron catalysts with pyridinyl phosphate Ind. Eng. Chem. Res. 55 2016 7580 W.J. Pan, H.F. Chen, R. Sun, D.R. Gong, X.Y. Jia, Y.M. Hu, X.Q. Zhang, Highly 1,2 Regio- and Stereoselective Polymerization of 1,3-Butadiene Initiated by Iron Catalysts with Pyridinyl Phosphate, Ind. Eng. Chem. Res. 55 (2016) 7580. [24] Y. Yu S.L. Xu Y.N. Zhao Y.F. Sun H. Liu C.Y. Zhang X.Q. Zhang Syndiotactic 1,2-polybutadiene with regulable viscoelasticity and crystallinity via a steric hindrance strategy for promoting the dynamic mechanical properties of nanocomposites Compos. Part AAppl. S. 191 2025 108723 Y. Yu, S.L. Xu, Y.N. Zhao, Y.F. Sun, H. Liu, C.Y. Zhang, X.Q. Zhang, Syndiotactic 1,2-polybutadiene with regulable viscoelasticity and crystallinity via a steric hindrance strategy for promoting the dynamic mechanical properties of nanocomposites, Compos. Part A-Appl. S. 191 (2025) 108723. [25] Q. Sun F. Wang Synthesis of crystalline 3, 4-polyisoprene with Fe-based catalyst system Acta Polym. Sin. ( Chin. ) 1988 145 Q. Sun, F. Wang, Synthesis of crystalline 3, 4-polyisoprene with Fe-based catalyst system, Acta Polymerica Sinica (in Chinese) (1988) 145. [26] G. Ricci G. Leone G. Zanchin B. Palucci A.C. Boccia A. Sommazzi F. Masi S. Zacchini M. Guelfi G. Pampaloni Highly stereoregular 1,3-Butadiene and isoprene polymers through Monoalkyl-N-Aryl-Substituted iminopyridine iron Complex-Based catalysts: synthesis and characterization Macromolecules 54 2021 9947 G. Ricci, G. Leone, G. Zanchin, B. Palucci, A.C. Boccia, A. Sommazzi, F. Masi, S. Zacchini, M. Guelfi, G. Pampaloni, Highly Stereoregular 1,3-Butadiene and Isoprene Polymers through Monoalkyl-N-Aryl-Substituted Iminopyridine Iron Complex-Based Catalysts: Synthesis and Characterization, Macromolecules 54 (2021) 9947. [27] C. Bazzini A. Giarrusso L. Porri Diethylbis(2,2′-bipyridine)iron/MAO. a very active and stereospecific catalyst for 1,3-Diene polymerization Macromol. Rapid Commun. 23 2002 922 C. Bazzini, A. Giarrusso, L. Porri, Diethylbis(2,2′-bipyridine)iron/MAO. A Very Active and Stereospecific Catalyst for 1,3-Diene Polymerization, Macromol. Rapid Commun. 23 (2002) 922. [28] V.C. Gibson C. Redshaw G.A. Solan Bis(imino)pyridines: surprisingly reactive ligands and a gateway to new families of catalysts Chem. Rev. 107 2007 1745 V.C. Gibson, C. Redshaw, G.A. Solan, Bis(imino)pyridines: Surprisingly Reactive Ligands and a Gateway to New Families of Catalysts, Chem. Rev. 107 (2007) 1745. [29] C. Chen Designing catalysts for olefin polymerization and copolymerization: beyond electronic and steric tuning Nat. Rev. Chem. 2 2018 6 C. Chen, Designing catalysts for olefin polymerization and copolymerization: beyond electronic and steric tuning, Nat. Rev. Chem. 2 (2018) 6. [30] K. Chainok S.M. Neville B. Moubaraki S.R. Batten K.S. Murray C.M. Forsyth J.D. Cashion Synthesis, structures and spin crossover properties of infinite 3D frameworks of iron(ii) containing organodinitrile bridging ligands Dalton Trans. 39 2010 10900 K. Chainok, S.M. Neville, B. Moubaraki, S.R. Batten, K.S. Murray, C.M. Forsyth, J.D. Cashion, Synthesis, structures and spin crossover properties of infinite 3D frameworks of iron(ii) containing organodinitrile bridging ligands, Dalton Transactions 39 (2010) 10900. [31] G. Bresciani L. Biancalana G. Pampaloni S. Zacchini G. Ciancaleoni F. Marchetti A comprehensive analysis of the Metal–Nitrile bonding in an Organo-Diiron system Molecules 26 2021 7088 G. Bresciani, L. Biancalana, G. Pampaloni, S. Zacchini, G. Ciancaleoni, F. Marchetti, A Comprehensive Analysis of the Metal–Nitrile Bonding in an Organo-Diiron System, Molecules 26 (2021) 7088. [32] D. Kumar M.R. Rao K.V.C. Rao Carbon-13 NMR of 1,2-Polybutadienes: configurational sequencing J. Polym. Sci. 21 1983 365 D. Kumar, M.R. Rao, K.V.C. Rao, Carbon-13 NMR of 1,2-Polybutadienes: Configurational Sequencing, J. Polym. Sci. 21 (1983) 365. [33] G. Ricci D. Morganti A. Sommazzi R. Santi F. Masi Polymerization of 1,3-dienes with iron complexes based catalysts: influence of the ligand on catalyst activity and stereospecificity J. Mol. Catal. A Chem. 204 205 2003 287 G. Ricci, D. Morganti, A. Sommazzi, R. Santi, F. Masi, Polymerization of 1,3-dienes with iron complexes based catalysts: Influence of the ligand on catalyst activity and stereospecificity, J. Mol. Catal. A: Chem. 204-205 (2003) 287. [34] W. Zheng F. Wang J. Bi H. Zhang C. Zhang Y. Hu C. Bai X. Zhang Synthesis and characterization of soft–hard stereoblock polybutadiene with Fe(2-EHA)3/Al(I-Bu)3/DEP catalyst system J. Polym. Sci. Part A Polym. Chem. 53 2015 1182 W. Zheng, F. Wang, J. Bi, H. Zhang, C. Zhang, Y. Hu, C. Bai, X. Zhang, Synthesis and characterization of soft–hard stereoblock polybutadiene with Fe(2-EHA)3/Al(i-Bu)3/DEP catalyst system, J. Polym. Sci., Part A: Polym. Chem. 53 (2015) 1182. [35] Y. Takeuchi, A. Sekimoto, M. Abe, A New Thermoplastic Syndiotactic 1,2-Poylbutadiene. II. Applications, New Industrial Polymers, AMERICAN CHEMICAL SOCIETY1974, pp. 26. [36] O. Seewald U. Flörke G. Henkel Dichlorobis(triphenylphosphine)iron(II) Acta Cryst. 61 2005 1829 O. Seewald, U. Flörke, G. Henkel, Dichlorobis(triphenylphosphine)iron(II), Acta Cryst. 61 (2005) 1829.",
      "coredata": {
        "eid": "1-s2.0-S0926860X2500496X",
        "dc:description": "Syndiotactic 1,2-polybutadiene (SPB) is promising crystalline material with high wear resistance, yet its practical applications remain limited due to excessively high melting temperature (Tₘ), which hinder melt processing. In this study, we report a novel iron-based catalyst system, Fe(acac)3/AIBN/PPh3/AlR3, that enables the synthesis of SPB with low melting temperature (T m) (< 120 °C) and relatively high crystallinity (up to 18 %), thereby addressing a long-standing challenge. The catalyst design features a synergistic N-P coordination strategy: AIBN serves as the primary ligand, coordinating to the Fe center via cyano groups to modulate its electronic and steric environment, effectively lowering Tₘ while promoting syndiotactic monomer insertion. Meanwhile, PPh3 functions as an auxiliary ligand, enhancing stereoselectivity by fine-tuning the coordination geometry through its strong σ-donating character. Comparative studies reveal that the presence of PPh3 significantly improves the syndiotacticity and crystallinity of the resulting polymers without compromising catalytic activity. This work not only provides a simple and scalable catalyst platform for producing processable crystalline polybutadiene, but also offers new mechanistic insights into ligand field modulation for stereocontrol in Fe-catalyzed diene polymerizations, paving the way for future advances in tunable diene synthesis.",
        "openArchiveArticle": "false",
        "prism:coverDate": "2025-12-25",
        "openaccessUserLicense": null,
        "prism:aggregationType": "Journal",
        "prism:url": "https://api.elsevier.com/content/article/pii/S0926860X2500496X",
        "dc:creator": [
          {
            "@_fa": "true",
            "$": "Na, Lihua"
          },
          {
            "@_fa": "true",
            "$": "Fan, Yunqing"
          },
          {
            "@_fa": "true",
            "$": "Fang, Liang"
          },
          {
            "@_fa": "true",
            "$": "Wang, Xiaohua"
          },
          {
            "@_fa": "true",
            "$": "Liu, Heng"
          },
          {
            "@_fa": "true",
            "$": "Zhang, Chunyu"
          },
          {
            "@_fa": "true",
            "$": "Zhang, Xuequan"
          },
          {
            "@_fa": "true",
            "$": "Yang, Qi"
          }
        ],
        "link": [
          {
            "@_fa": "true",
            "@rel": "self",
            "@href": "https://api.elsevier.com/content/article/pii/S0926860X2500496X"
          },
          {
            "@_fa": "true",
            "@rel": "scidir",
            "@href": "https://www.sciencedirect.com/science/article/pii/S0926860X2500496X"
          }
        ],
        "dc:format": "application/json",
        "openaccessType": null,
        "pii": "S0926-860X(25)00496-X",
        "prism:volume": "708",
        "articleNumber": "120594",
        "prism:publisher": "Elsevier B.V. All rights are reserved, including those for text and data mining, AI training, and similar technologies.",
        "dc:title": "Synergistic N-P coordination enables low-melting, high-crystallinity syndiotactic 1,2-polybutadiene via iron-based catalyst",
        "prism:copyright": "© 2025 Elsevier B.V. All rights are reserved, including those for text and data mining, AI training, and similar technologies.",
        "openaccess": "0",
        "prism:issn": "0926860X",
        "dcterms:subject": [
          {
            "@_fa": "true",
            "$": "Syndiotactic-1,2-polybutadiene"
          },
          {
            "@_fa": "true",
            "$": "Iron-based catalyst"
          },
          {
            "@_fa": "true",
            "$": "N-P coordination"
          },
          {
            "@_fa": "true",
            "$": "Stereocontrol"
          }
        ],
        "openaccessArticle": "false",
        "prism:publicationName": "Applied Catalysis A: General",
        "openaccessSponsorType": null,
        "prism:pageRange": "120594",
        "pubType": "fla",
        "prism:coverDisplayDate": "25 December 2025",
        "prism:doi": "10.1016/j.apcata.2025.120594",
        "prism:startingPage": "120594",
        "dc:identifier": "doi:10.1016/j.apcata.2025.120594",
        "openaccessSponsorName": null
      },
      "objects": {
        "object": [
          {
            "@category": "standard",
            "@height": "562",
            "@width": "678",
            "@_fa": "true",
            "$": "https://api.elsevier.com/content/object/eid/1-s2.0-S0926860X2500496X-sc1.jpg?httpAccept=%2A%2F%2A",
            "@multimediatype": "JPEG image file",
            "@type": "IMAGE-DOWNSAMPLED",
            "@size": "89174",
            "@ref": "sc1",
            "@mimetype": "image/jpeg"
          },
          {
            "@category": "thumbnail",
            "@height": "164",
            "@width": "198",
            "@_fa": "true",
            "$": "https://api.elsevier.com/content/object/eid/1-s2.0-S0926860X2500496X-sc1.sml?httpAccept=%2A%2F%2A",
            "@multimediatype": "GIF image file",
            "@type": "IMAGE-THUMBNAIL",
            "@size": "9046",
            "@ref": "sc1",
            "@mimetype": "image/gif"
          },
          {
            "@category": "standard",
            "@height": "275",
            "@width": "789",
            "@_fa": "true",
            "$": "https://api.elsevier.com/content/object/eid/1-s2.0-S0926860X2500496X-gr3.jpg?httpAccept=%2A%2F%2A",
            "@multimediatype": "JPEG image file",
            "@type": "IMAGE-DOWNSAMPLED",
            "@size": "50827",
            "@ref": "gr3",
            "@mimetype": "image/jpeg"
          },
          {
            "@category": "thumbnail",
            "@height": "76",
            "@width": "219",
            "@_fa": "true",
            "$": "https://api.elsevier.com/content/object/eid/1-s2.0-S0926860X2500496X-gr3.sml?httpAccept=%2A%2F%2A",
            "@multimediatype": "GIF image file",
            "@type": "IMAGE-THUMBNAIL",
            "@size": "6120",
            "@ref": "gr3",
            "@mimetype": "image/gif"
          },
          {
            "@category": "standard",
            "@height": "273",
            "@width": "788",
            "@_fa": "true",
            "$": "https://api.elsevier.com/content/object/eid/1-s2.0-S0926860X2500496X-gr2.jpg?httpAccept=%2A%2F%2A",
            "@multimediatype": "JPEG image file",
            "@type": "IMAGE-DOWNSAMPLED",
            "@size": "47485",
            "@ref": "gr2",
            "@mimetype": "image/jpeg"
          },
          {
            "@category": "thumbnail",
            "@height": "76",
            "@width": "219",
            "@_fa": "true",
            "$": "https://api.elsevier.com/content/object/eid/1-s2.0-S0926860X2500496X-gr2.sml?httpAccept=%2A%2F%2A",
            "@multimediatype": "GIF image file",
            "@type": "IMAGE-THUMBNAIL",
            "@size": "5599",
            "@ref": "gr2",
            "@mimetype": "image/gif"
          },
          {
            "@category": "standard",
            "@height": "200",
            "@width": "401",
            "@_fa": "true",
            "$": "https://api.elsevier.com/content/object/eid/1-s2.0-S0926860X2500496X-ga1.jpg?httpAccept=%2A%2F%2A",
            "@multimediatype": "JPEG image file",
            "@type": "IMAGE-DOWNSAMPLED",
            "@size": "21757",
            "@ref": "ga1",
            "@mimetype": "image/jpeg"
          },
          {
            "@category": "thumbnail",
            "@height": "109",
            "@width": "219",
            "@_fa": "true",
            "$": "https://api.elsevier.com/content/object/eid/1-s2.0-S0926860X2500496X-ga1.sml?httpAccept=%2A%2F%2A",
            "@multimediatype": "GIF image file",
            "@type": "IMAGE-THUMBNAIL",
            "@size": "7317",
            "@ref": "ga1",
            "@mimetype": "image/gif"
          },
          {
            "@category": "standard",
            "@height": "559",
            "@width": "791",
            "@_fa": "true",
            "$": "https://api.elsevier.com/content/object/eid/1-s2.0-S0926860X2500496X-gr1.jpg?httpAccept=%2A%2F%2A",
            "@multimediatype": "JPEG image file",
            "@type": "IMAGE-DOWNSAMPLED",
            "@size": "71902",
            "@ref": "gr1",
            "@mimetype": "image/jpeg"
          },
          {
            "@category": "thumbnail",
            "@height": "155",
            "@width": "219",
            "@_fa": "true",
            "$": "https://api.elsevier.com/content/object/eid/1-s2.0-S0926860X2500496X-gr1.sml?httpAccept=%2A%2F%2A",
            "@multimediatype": "GIF image file",
            "@type": "IMAGE-THUMBNAIL",
            "@size": "8241",
            "@ref": "gr1",
            "@mimetype": "image/gif"
          },
          {
            "@category": "standard",
            "@height": "343",
            "@width": "678",
            "@_fa": "true",
            "$": "https://api.elsevier.com/content/object/eid/1-s2.0-S0926860X2500496X-sc2.jpg?httpAccept=%2A%2F%2A",
            "@multimediatype": "JPEG image file",
            "@type": "IMAGE-DOWNSAMPLED",
            "@size": "50938",
            "@ref": "sc2",
            "@mimetype": "image/jpeg"
          },
          {
            "@category": "thumbnail",
            "@height": "111",
            "@width": "219",
            "@_fa": "true",
            "$": "https://api.elsevier.com/content/object/eid/1-s2.0-S0926860X2500496X-sc2.sml?httpAccept=%2A%2F%2A",
            "@multimediatype": "GIF image file",
            "@type": "IMAGE-THUMBNAIL",
            "@size": "4862",
            "@ref": "sc2",
            "@mimetype": "image/gif"
          },
          {
            "@category": "high",
            "@height": "2483",
            "@width": "2994",
            "@_fa": "true",
            "$": "https://api.elsevier.com/content/object/eid/1-s2.0-S0926860X2500496X-sc1_lrg.jpg?httpAccept=%2A%2F%2A",
            "@multimediatype": "JPEG image file",
            "@type": "IMAGE-HIGH-RES",
            "@size": "402150",
            "@ref": "sc1",
            "@mimetype": "image/jpeg"
          },
          {
            "@category": "high",
            "@height": "1219",
            "@width": "3492",
            "@_fa": "true",
            "$": "https://api.elsevier.com/content/object/eid/1-s2.0-S0926860X2500496X-gr3_lrg.jpg?httpAccept=%2A%2F%2A",
            "@multimediatype": "JPEG image file",
            "@type": "IMAGE-HIGH-RES",
            "@size": "251021",
            "@ref": "gr3",
            "@mimetype": "image/jpeg"
          },
          {
            "@category": "high",
            "@height": "1208",
            "@width": "3491",
            "@_fa": "true",
            "$": "https://api.elsevier.com/content/object/eid/1-s2.0-S0926860X2500496X-gr2_lrg.jpg?httpAccept=%2A%2F%2A",
            "@multimediatype": "JPEG image file",
            "@type": "IMAGE-HIGH-RES",
            "@size": "233819",
            "@ref": "gr2",
            "@mimetype": "image/jpeg"
          },
          {
            "@category": "high",
            "@height": "886",
            "@width": "1778",
            "@_fa": "true",
            "$": "https://api.elsevier.com/content/object/eid/1-s2.0-S0926860X2500496X-ga1_lrg.jpg?httpAccept=%2A%2F%2A",
            "@multimediatype": "JPEG image file",
            "@type": "IMAGE-HIGH-RES",
            "@size": "145249",
            "@ref": "ga1",
            "@mimetype": "image/jpeg"
          },
          {
            "@category": "high",
            "@height": "2468",
            "@width": "3493",
            "@_fa": "true",
            "$": "https://api.elsevier.com/content/object/eid/1-s2.0-S0926860X2500496X-gr1_lrg.jpg?httpAccept=%2A%2F%2A",
            "@multimediatype": "JPEG image file",
            "@type": "IMAGE-HIGH-RES",
            "@size": "365403",
            "@ref": "gr1",
            "@mimetype": "image/jpeg"
          },
          {
            "@category": "high",
            "@height": "1517",
            "@width": "2995",
            "@_fa": "true",
            "$": "https://api.elsevier.com/content/object/eid/1-s2.0-S0926860X2500496X-sc2_lrg.jpg?httpAccept=%2A%2F%2A",
            "@multimediatype": "JPEG image file",
            "@type": "IMAGE-HIGH-RES",
            "@size": "233270",
            "@ref": "sc2",
            "@mimetype": "image/jpeg"
          },
          {
            "@category": "standard",
            "@_fa": "true",
            "$": "https://api.elsevier.com/content/object/eid/1-s2.0-S0926860X2500496X-mmc1.docx?httpAccept=%2A%2F%2A",
            "@multimediatype": "Microsoft Word file",
            "@type": "APPLICATION",
            "@size": "425332",
            "@ref": "mmc1",
            "@mimetype": "application/word"
          }
        ]
      }
    }
  }
}