{
  "metadata": {
    "title": "Sodium laurate-assisted CeO<ce:inf loc=post>2</ce:inf> nanoparticles as highly efficient and recyclable catalysts for cyanosilylation reaction",
    "authors": "; ; ",
    "journal": "Applied Catalysis A: General",
    "date": "2021-11-25",
    "doi": "10.1016/j.apcata.2021.118404",
    "abstract": "",
    "uri": "https://api.elsevier.com/content/article/pii/S0926860X2100418X",
    "pii": "S0926860X2100418X"
  },
  "fulltext": {
    "full-text-retrieval-response": {
      "scopus-eid": "2-s2.0-85119998366",
      "originalText": "serial JL 271346 291210 291744 291809 31 Applied Catalysis A: General APPLIEDCATALYSISAGENERAL 2021-10-24 2021-10-24 2021-11-08 2021-11-08 2022-03-30T00:52:26 1-s2.0-S0926860X2100418X S0926-860X(21)00418-X S0926860X2100418X 10.1016/j.apcata.2021.118404 S300 S300.1 FULL-TEXT 1-s2.0-S0926860X21X0018X 2024-01-01T12:34:28.416125Z 0 0 20211125 2021 2021-10-24T02:14:43.127624Z absattachment articleinfo articlenumber articletitlenorm authfirstinitialnorm authfirstsurnamenorm cid cids contenttype copyright crossmark dateloaded dateloadedtxt datesearch datesort dateupdated dco docsubtype doctype doi eid ewtransactionid hubeid indexeddate issn issnnorm itemstage itemtransactionid itemweight openaccess openarchive pg pgfirst pii piinorm pubdatestart pubdatetxt pubyr sortorder srctitle srctitlenorm srctype ssids alllist content subj subheadings suppl tomb volfirst volissue volumelist webpdf webpdfpagecount yearnav figure table e-component body mmlmath acknowledge affil appendices articletitle auth authfirstini authfull authkeywords authlast grantnumber grantsponsor highlightsabst orcid primabst ref specialabst 0926-860X 0926860X true 628 628 C Volume 628 10 118404 118404 118404 20211125 25 November 2021 2021-11-25 2021 article fla © 2021 Elsevier B.V. All rights reserved. SODIUMLAURATEASSISTEDCEO2NANOPARTICLESHIGHLYEFFICIENTRECYCLABLECATALYSTSFORCYANOSILYLATIONREACTION WU H 1 Introduction 2 Experimental section 2.1 Chemicals 2.2 Synthesis of CeO2 NPs with different morphologies and sizes 2.2.1 Polyhedron-shaped CeO2 NPs-10 nm 2.2.2 Polyhedron-shaped CeO2 NPs-4 nm 2.2.3 Rod-shaped CeO2 NPs 2.2.4 Spindle-shaped CeO2 NPs 2.3 Cyanosilylation reaction 2.4 Computational models and methods 2.5 Characterization 3 Results and discussion 4 Conclusions CRediT authorship contribution statement Acknowledgements Appendix A Supplementary material References CHAN 2020 213213 A HU 2015 7415 7423 T MURAKAMI 2016 13759 13769 M SHENG 2019 182 186 K KIKUKAWA 2012 3686 3690 Y ZENG 2016 416 425 X AN 2018 9079 9089 H WANG 2015 11013 11020 X DU 2018 2772 2776 J KURONO 2016 989 1023 N MOTOKURA 2012 565 579 K HOU 2017 8439 8450 Y KARMAKAR 2017 8649 8657 A MA 2017 17 23 Z NOURIAN 2018 e3957 M KAMATA 2017 345 K FEI 2015 18796 18805 F ROSTAMI 2015 80 84 A GARNESPORTOLES 2020 21 28 F YAMAGUCHI 2016 851 853 S DU 2020 122883 J FU 2021 117907 W JIAN 2020 115891 S WU 2021 130640 H WANG 2021 116814 B FORNERO 2021 118282 E WU 2019 203 213 M LI 2020 57569 57577 Z WANG 2013 1506 1515 Y TROVARELLI 2017 4716 4735 A XIA 2020 124843 Y HONG 2019 P430 P436 S MINAMIDATE 2010 516 520 Y WANG 2013 2602 2609 G ZHANG 2015 79355 79360 Z XI 2015 79216 79223 F TIAN 2021 4660 4667 H HU 2018 2883 2889 L AN 2020 10578 10590 H JIANG 2017 3036 3043 W GU 2020 7197 7209 J AN 2018 4172 4181 J REVOY 2013 10095 10105 M LYKAKI 2018 18 28 M YUAN 2021 105639 L WUX2021X118404 WUX2021X118404XH 2023-11-08T00:00:00.000Z 2023-11-08T00:00:00.000Z http://creativecommons.org/licenses/by-nc-nd/4.0/ © 2021 Elsevier B.V. All rights reserved. 0 https://doi.org/10.15223/policy-017 https://doi.org/10.15223/policy-037 https://doi.org/10.15223/policy-012 https://doi.org/10.15223/policy-029 https://doi.org/10.15223/policy-004 item S0926-860X(21)00418-X S0926860X2100418X 1-s2.0-S0926860X2100418X 10.1016/j.apcata.2021.118404 271346 2024-01-01T12:34:28.416125Z 2021-11-25 1-s2.0-S0926860X2100418X-main.pdf https://s3-eu-west-1.amazonaws.com/prod-ucs-content-store-eu-west/content/pii:S0926860X2100418X/MAIN/application/pdf/6822663b86a2f6caac25f2ca71214021/main.pdf main.pdf pdf true 7820465 MAIN 9 1-s2.0-S0926860X2100418X-main_1.png https://s3-eu-west-1.amazonaws.com/prod-ucs-content-store-eu-west/content/pii:S0926860X2100418X/PREVIEW/image/png/187639b24b4cb3f15e6812962063f63d/main_1.png main_1.png png 60457 849 656 IMAGE-WEB-PDF 1 1-s2.0-S0926860X2100418X-gr1.jpg https://s3-eu-west-1.amazonaws.com/prod-ucs-content-store-eu-west/content/pii:S0926860X2100418X/gr1/DOWNSAMPLED/image/jpeg/d6c94a05ee0d0be662ecbdd6746c5604/gr1.jpg gr1 gr1.jpg jpg 216203 558 659 IMAGE-DOWNSAMPLED 1-s2.0-S0926860X2100418X-gr2.jpg https://s3-eu-west-1.amazonaws.com/prod-ucs-content-store-eu-west/content/pii:S0926860X2100418X/gr2/DOWNSAMPLED/image/jpeg/64ed3d3537fafbbe7566771bfa24e65d/gr2.jpg gr2 gr2.jpg jpg 131668 275 659 IMAGE-DOWNSAMPLED 1-s2.0-S0926860X2100418X-ga1.jpg https://s3-eu-west-1.amazonaws.com/prod-ucs-content-store-eu-west/content/pii:S0926860X2100418X/ga1/DOWNSAMPLED/image/jpeg/ca2d1e77d7ef2bab6d26137405f4e1c3/ga1.jpg ga1 true ga1.jpg jpg 114889 200 345 IMAGE-DOWNSAMPLED 1-s2.0-S0926860X2100418X-gr5.jpg https://s3-eu-west-1.amazonaws.com/prod-ucs-content-store-eu-west/content/pii:S0926860X2100418X/gr5/DOWNSAMPLED/image/jpeg/b59d8841a816595aa52c5e4dce115088/gr5.jpg gr5 gr5.jpg jpg 182645 536 659 IMAGE-DOWNSAMPLED 1-s2.0-S0926860X2100418X-gr6.jpg https://s3-eu-west-1.amazonaws.com/prod-ucs-content-store-eu-west/content/pii:S0926860X2100418X/gr6/DOWNSAMPLED/image/jpeg/c9eae3f10ef05b610b469a8e0c889832/gr6.jpg gr6 gr6.jpg jpg 131774 283 659 IMAGE-DOWNSAMPLED 1-s2.0-S0926860X2100418X-gr3.jpg https://s3-eu-west-1.amazonaws.com/prod-ucs-content-store-eu-west/content/pii:S0926860X2100418X/gr3/DOWNSAMPLED/image/jpeg/9bd054c72f344a9e4e6211005134cb86/gr3.jpg gr3 gr3.jpg jpg 168879 572 659 IMAGE-DOWNSAMPLED 1-s2.0-S0926860X2100418X-gr4.jpg https://s3-eu-west-1.amazonaws.com/prod-ucs-content-store-eu-west/content/pii:S0926860X2100418X/gr4/DOWNSAMPLED/image/jpeg/6b7405699ae9b6442cd6a383e1d31703/gr4.jpg gr4 gr4.jpg jpg 74842 260 659 IMAGE-DOWNSAMPLED 1-s2.0-S0926860X2100418X-fx1.jpg https://s3-eu-west-1.amazonaws.com/prod-ucs-content-store-eu-west/content/pii:S0926860X2100418X/fx1/DOWNSAMPLED/image/jpeg/b7a74efe1627cd94f9a72f3f555b9d98/fx1.jpg fx1 fx1.jpg jpg 11110 63 376 IMAGE-DOWNSAMPLED 1-s2.0-S0926860X2100418X-gr7.jpg https://s3-eu-west-1.amazonaws.com/prod-ucs-content-store-eu-west/content/pii:S0926860X2100418X/gr7/DOWNSAMPLED/image/jpeg/610c5075257d1d32dd3d8d6e4298e93b/gr7.jpg gr7 gr7.jpg jpg 125138 322 339 IMAGE-DOWNSAMPLED 1-s2.0-S0926860X2100418X-gr8.jpg https://s3-eu-west-1.amazonaws.com/prod-ucs-content-store-eu-west/content/pii:S0926860X2100418X/gr8/DOWNSAMPLED/image/jpeg/df2f02603641fe399f95c8d7dcb3586c/gr8.jpg gr8 gr8.jpg jpg 167941 403 565 IMAGE-DOWNSAMPLED 1-s2.0-S0926860X2100418X-gr1.sml https://s3-eu-west-1.amazonaws.com/prod-ucs-content-store-eu-west/content/pii:S0926860X2100418X/gr1/THUMBNAIL/image/gif/fd407df7485478dce6430180d8a6b934/gr1.sml gr1 gr1.sml sml 85790 164 194 IMAGE-THUMBNAIL 1-s2.0-S0926860X2100418X-gr2.sml https://s3-eu-west-1.amazonaws.com/prod-ucs-content-store-eu-west/content/pii:S0926860X2100418X/gr2/THUMBNAIL/image/gif/428c5f68c1dab3b1441ae366098cdd83/gr2.sml gr2 gr2.sml sml 74436 91 219 IMAGE-THUMBNAIL 1-s2.0-S0926860X2100418X-ga1.sml https://s3-eu-west-1.amazonaws.com/prod-ucs-content-store-eu-west/content/pii:S0926860X2100418X/ga1/THUMBNAIL/image/gif/4c772db00a61e0a53d1dc58aac1ad220/ga1.sml ga1 true ga1.sml sml 81772 127 219 IMAGE-THUMBNAIL 1-s2.0-S0926860X2100418X-gr5.sml https://s3-eu-west-1.amazonaws.com/prod-ucs-content-store-eu-west/content/pii:S0926860X2100418X/gr5/THUMBNAIL/image/gif/586717a6123fb770ec5c3dee56b47307/gr5.sml gr5 gr5.sml sml 79760 163 201 IMAGE-THUMBNAIL 1-s2.0-S0926860X2100418X-gr6.sml https://s3-eu-west-1.amazonaws.com/prod-ucs-content-store-eu-west/content/pii:S0926860X2100418X/gr6/THUMBNAIL/image/gif/c856fcfc4ad06d8218ac27a6b242f5f3/gr6.sml gr6 gr6.sml sml 74985 94 219 IMAGE-THUMBNAIL 1-s2.0-S0926860X2100418X-gr3.sml https://s3-eu-west-1.amazonaws.com/prod-ucs-content-store-eu-west/content/pii:S0926860X2100418X/gr3/THUMBNAIL/image/gif/fbf3be5729e9d173748426d6ba7d1528/gr3.sml gr3 gr3.sml sml 77811 164 189 IMAGE-THUMBNAIL 1-s2.0-S0926860X2100418X-gr4.sml https://s3-eu-west-1.amazonaws.com/prod-ucs-content-store-eu-west/content/pii:S0926860X2100418X/gr4/THUMBNAIL/image/gif/da8e98529368f72dbd73637dcb1afb72/gr4.sml gr4 gr4.sml sml 14003 86 219 IMAGE-THUMBNAIL 1-s2.0-S0926860X2100418X-fx1.sml https://s3-eu-west-1.amazonaws.com/prod-ucs-content-store-eu-west/content/pii:S0926860X2100418X/fx1/THUMBNAIL/image/gif/b7ec574f1981a3d6222b33c34b4b5d63/fx1.sml fx1 fx1.sml sml 5683 37 219 IMAGE-THUMBNAIL 1-s2.0-S0926860X2100418X-gr7.sml https://s3-eu-west-1.amazonaws.com/prod-ucs-content-store-eu-west/content/pii:S0926860X2100418X/gr7/THUMBNAIL/image/gif/d15a0e4380f1836ad7df7a2678f1329a/gr7.sml gr7 gr7.sml sml 83139 164 173 IMAGE-THUMBNAIL 1-s2.0-S0926860X2100418X-gr8.sml https://s3-eu-west-1.amazonaws.com/prod-ucs-content-store-eu-west/content/pii:S0926860X2100418X/gr8/THUMBNAIL/image/gif/96756e79e733534439b1da095c6ceb2c/gr8.sml gr8 gr8.sml sml 89564 156 219 IMAGE-THUMBNAIL 1-s2.0-S0926860X2100418X-gr1_lrg.jpg https://s3-eu-west-1.amazonaws.com/prod-ucs-content-store-eu-west/content/pii:S0926860X2100418X/gr1/HIGHRES/image/jpeg/e81c49555b84c2a2df284f12355b7112/gr1_lrg.jpg gr1 gr1_lrg.jpg jpg 1168486 2469 2917 IMAGE-HIGH-RES 1-s2.0-S0926860X2100418X-gr2_lrg.jpg https://s3-eu-west-1.amazonaws.com/prod-ucs-content-store-eu-west/content/pii:S0926860X2100418X/gr2/HIGHRES/image/jpeg/83a4287df979d6173d50e1be28921c0f/gr2_lrg.jpg gr2 gr2_lrg.jpg jpg 426039 1218 2917 IMAGE-HIGH-RES 1-s2.0-S0926860X2100418X-ga1_lrg.jpg https://s3-eu-west-1.amazonaws.com/prod-ucs-content-store-eu-west/content/pii:S0926860X2100418X/ga1/HIGHRES/image/jpeg/2b51fe8b6766a541ea64599fe9dad95c/ga1_lrg.jpg ga1 true ga1_lrg.jpg jpg 383580 886 1527 IMAGE-HIGH-RES 1-s2.0-S0926860X2100418X-gr5_lrg.jpg https://s3-eu-west-1.amazonaws.com/prod-ucs-content-store-eu-west/content/pii:S0926860X2100418X/gr5/HIGHRES/image/jpeg/b4dc6c623fc777d59a5a065cf2b5aaa0/gr5_lrg.jpg gr5 gr5_lrg.jpg jpg 871833 2372 2917 IMAGE-HIGH-RES 1-s2.0-S0926860X2100418X-gr6_lrg.jpg https://s3-eu-west-1.amazonaws.com/prod-ucs-content-store-eu-west/content/pii:S0926860X2100418X/gr6/HIGHRES/image/jpeg/f76d71a0ac4006a3214260d3aa105b84/gr6_lrg.jpg gr6 gr6_lrg.jpg jpg 492149 1252 2917 IMAGE-HIGH-RES 1-s2.0-S0926860X2100418X-gr3_lrg.jpg https://s3-eu-west-1.amazonaws.com/prod-ucs-content-store-eu-west/content/pii:S0926860X2100418X/gr3/HIGHRES/image/jpeg/8e9f7d5dbfa7983eaed73fd812f0ed58/gr3_lrg.jpg gr3 gr3_lrg.jpg jpg 649695 2532 2917 IMAGE-HIGH-RES 1-s2.0-S0926860X2100418X-gr4_lrg.jpg https://s3-eu-west-1.amazonaws.com/prod-ucs-content-store-eu-west/content/pii:S0926860X2100418X/gr4/HIGHRES/image/jpeg/5a926634c18fab633977fbe115f144be/gr4_lrg.jpg gr4 gr4_lrg.jpg jpg 623818 1150 2917 IMAGE-HIGH-RES 1-s2.0-S0926860X2100418X-fx1_lrg.jpg https://s3-eu-west-1.amazonaws.com/prod-ucs-content-store-eu-west/content/pii:S0926860X2100418X/fx1/HIGHRES/image/jpeg/1c547eb5b27e8161f345e00d58e80360/fx1_lrg.jpg fx1 fx1_lrg.jpg jpg 40207 278 1667 IMAGE-HIGH-RES 1-s2.0-S0926860X2100418X-gr7_lrg.jpg https://s3-eu-west-1.amazonaws.com/prod-ucs-content-store-eu-west/content/pii:S0926860X2100418X/gr7/HIGHRES/image/jpeg/00873bef3200dd5d71cb1a2787467588/gr7_lrg.jpg gr7 gr7_lrg.jpg jpg 338182 1423 1500 IMAGE-HIGH-RES 1-s2.0-S0926860X2100418X-gr8_lrg.jpg https://s3-eu-west-1.amazonaws.com/prod-ucs-content-store-eu-west/content/pii:S0926860X2100418X/gr8/HIGHRES/image/jpeg/a9fddd663d84c7d7d5a3ef88ec11016f/gr8_lrg.jpg gr8 gr8_lrg.jpg jpg 680649 1785 2500 IMAGE-HIGH-RES 1-s2.0-S0926860X2100418X-mmc1.docx https://s3-eu-west-1.amazonaws.com/prod-ucs-content-store-eu-west/content/pii:S0926860X2100418X/mmc1/MAIN/application/vnd.openxmlformats-officedocument.wordprocessingml.document/b781a868c49b08ad31df99fc4d528955/mmc1.docx mmc1 mmc1.docx docx 4137593 APPLICATION 1-s2.0-S0926860X2100418X-si0001.svg https://s3-eu-west-1.amazonaws.com/prod-ucs-content-store-eu-west/content/pii:S0926860X2100418X/STRIPIN/image/svg+xml/148d7658550b7ab3554ad755e836154d/si0001.svg si0001 si0001.svg svg 2390 ALTIMG 1-s2.0-S0926860X2100418X-si0002.svg https://s3-eu-west-1.amazonaws.com/prod-ucs-content-store-eu-west/content/pii:S0926860X2100418X/STRIPIN/image/svg+xml/4058a5febb23dd3622f9f65c3c7a9c42/si0002.svg si0002 si0002.svg svg 1426 ALTIMG 1-s2.0-S0926860X2100418X-si0003.svg https://s3-eu-west-1.amazonaws.com/prod-ucs-content-store-eu-west/content/pii:S0926860X2100418X/STRIPIN/image/svg+xml/02ea9ad59983c97f97be2574fc5801a4/si0003.svg si0003 si0003.svg svg 1491 ALTIMG 1-s2.0-S0926860X2100418X-am.pdf am am.pdf pdf 2520226 AAM-PDF https://s3-eu-west-1.amazonaws.com/prod-ucs-content-store-eu-west/content/egi:100ZP3RV8T4/MAIN/application/pdf/de45f9aef8335515f8caf24b36954086/am.pdf APCATA 118404 118404 S0926-860X(21)00418-X 10.1016/j.apcata.2021.118404 Elsevier B.V. Fig. 1 TEM and HRTEM images of the obtained (a) P-CeO2 NPs-4 nm, (b) P-CeO2 NPs-10 nm, (c) R-CeO2 NPs and (d) S-CeO2 NPs. (e) XRD patterns of the as-prepared CeO2 NPs with different morphologies. Fig. 1 Fig. 2 (a) FTIR spectra and (b) TG curves of the obtained CeO2 NPs with different morphologies. Fig. 2 Fig. 3 Effects of (a) CeO2 NPs morphologies, (b) the addition amount of P-CeO2 NPs-10 nm and (c) reaction temperatures on the cyanosilylation reaction. Reaction conditions: (a) Benzaldehyde (1.0 mmol) reacted with trimethylsilyl cyanide (TMSCN, 2.0 mmol) on CeO2 NPs with different morphologies (0.02 mmol, 2 mol%) in heptane at room temperature. (b) Benzaldehyde (1.0 mmol) reacted with trimethylsilyl cyanide (TMSCN, 2.0 mmol) on P-CeO2 NPs-10 nm in heptane at room temperature. (c) Benzaldehyde (1.0 mmol) reacted with trimethylsilyl cyanide (TMSCN, 2.0 mmol) on P-CeO2 NPs-10 nm (0.02 mmol, 2 mol%) in heptane at different temperatures. Fig. 3 Fig. 4 (a) The cyanosilylation reaction of benzaldehyde with TMSCN in heptane and under solvent-free conditions (1) without catalyst and on (2) P-CeO2 NPs-4 nm, (3) P-CeO2 NPs-10 nm (4) R-CeO2 NPs (5) S-CeO2 NPs (6) UM-P-CeO2 NPs-4 nm and (7) UM-P-CeO2 NPs-10 nm. (b) Effect of solvent on the cyanosilylation reaction catalyzed by P-CeO2 NPs-10 nm. Reaction conditions: Benzaldehyde (1.0 mmol) reacted with trimethylsilyl cyanide (TMSCN, 2.0 mmol) on CeO2 NPs (0.02 mmol, 2 mol%) in 1 h at room temperature in each experiment. Fig. 4 Fig. 5 (a) Recycling experiments of P-CeO2 NPs-10 nm in the cyanosilylation reaction. (b) FTIR spectra, (c) XRD patterns and (d) XPS spectra of P-CeO2 NPs-10 nm before and after the cyanosilylation reaction. Fig. 5 Fig. 6 (a) Pyridine-adsorption IR spectra of CeO2 NPs with different morphologies, (b) the calculated surface density of Lewis and Brönsted acidic sites of (1) P-CeO2 NPs-4 nm, (2) P-CeO2 NPs-10 nm, (3) R-CeO2 NPs, (4) S-CeO2 NPs, (5) UM-P-CeO2 NPs-4 nm and (6) UM-P-CeO2 NPs-10 nm. Fig. 6 Fig. 7 Ce 3d XPS spectra of the as-prepared CeO2 NPs with different morphologies and sizes. Fig. 7 Fig. 8 Space-filling models of (a) CeO2−x slab, (b) a TMSCN molecule adsorbed on the CeO2−x slab, (c) SL-CeO2−x slab and (d) a TMSCN molecule adsorbed on the SL-CeO2−x slab. Fig. 8 Table 1 The comparison of the cyanosilylation reaction among reported heterogeneous catalysts. Table 1 Catalyst Solvent Temperature (℃) Time (h) Yield (%) TOF (h−1) Ref. P-CeO 2 NPs-10 nm (2 mol%) Heptane 25 1 > 99 50 This study P-CeO 2 NPs-10 nm (2 mol%) Solvent free 25 0.75 > 99 66.7 This study Activated CeO2 Nanorod (10 mol%) Deuterated chloroform 22 1.5 92 6.1 [34] MIL-101 (Cr) (0.3 mol%) Solvent free 25 4 96 80 [35] UIO-66-A (2 mol%) Dichloromethane 40 48 70 0.73 [36] V-Zn-MOF (2 mol%) Solvent free 60 3 > 99 16.7 [37] Cd-PBA (2 mol%) Benzene 25 2 92 23 [38] Pr-POVs (1 mol%) Solvent free 25 3 > 99 33.3 [39] Cd-MOF (0.6 mol%) Solvent free 25 18 94 8.7 [40] Co-MOF-74 (1.6 mol%) Solvent free 60 1.5 97 40 [41] Table 2 BET surface areas, surface Ce3+ content and surface oxygen vacancies content of the obtained CeO2 NPs with different morphologies. Table 2 Samples BET surface areas (m2/g) The content of surface Ce3+ (%) The content of surface oxygen vacancy (%) P-CeO2 NPs-4 nm 124.6 24.4 6.1 P-CeO2 NPs-10 nm 98.3 37.8 9.5 R-CeO2 NPs 87.1 31.1 7.8 S-CeO2 NPs 107.1 32.4 8.1 Sodium laurate-assisted CeO2 nanoparticles as highly efficient and recyclable catalysts for cyanosilylation reaction Hao Wu Investigation Data curation Writing – original draft a b Linkai Han a Ni Wang Validation Formal analysis a Ling-Xia Yun Validation Formal analysis a Zhonghua Xiang Writing – review & editing a Jie-Xin Wang Supervision Writing – review & editing Funding acquisition a b ⁎ a State Key Laboratory of Organic-Inorganic Composites, Beijing University of Chemical Technology, Beijing 100029, PR China State Key Laboratory of Organic-Inorganic Composites, Beijing University of Chemical Technology Beijing 100029 PR China State Key Laboratory of Organic-Inorganic Composites, Beijing University of Chemical Technology, Beijing 100029, PR China b Research Center of the Ministry of Education for High Gravity Engineering and Technology, Beijing University of Chemical Technology, Beijing, 100029, PR China Research Center of the Ministry of Education for High Gravity Engineering and Technology, Beijing University of Chemical Technology Beijing 100029 PR China Research Center of the Ministry of Education for High Gravity Engineering and Technology, Beijing University of Chemical Technology, Beijing, 100029, PR China ⁎ Corresponding author at: State Key Laboratory of Organic-Inorganic Composites, Beijing University of Chemical Technology, Beijing 100029, PR China. State Key Laboratory of Organic-Inorganic Composites, Beijing University of Chemical Technology Beijing 100029 PR China Cyanosilylation of aromatic aldehydes has always been a promising reaction in the organic synthesis. Herein, we use sodium laurate (SL) as capping agent to synthesize CeO2 nanoparticles (NPs) with different morphologies and sizes, which are adopted as catalysts for the cyanosilylation reaction at room temperature. The obtained polyhedron-shaped CeO2 NPs with an average size of 10 nm are proved to have rich oxygen defects and abundant Lewis/Brönsted acidic sites, exhibiting excellent catalytic properties. The reaction can be rapidly completed in 1 h in heptane and 0.75 h under solvent-free conditions, achieving a high yield of over 99%. More importantly, the as-prepared catalysts possess outstanding recyclability that the reaction still keeps a high yield of over 98% in the 5th cycle. Density functional theory calculation is further employed to demonstrate SL grafted on CeO2 can greatly suppress the adsorption of hydrogen cyanide on the catalyst, thereby accelerating the reaction process. Graphical Abstract ga1 Keywords CeO2 nanoparticles Sodium laurate Cyanosilylation reaction Efficient catalysts Recyclability DFT calculation 1 Introduction The formation of C-C bond is a vital reaction in the organic synthesis [1,2], which employs structurally simple and readily available reagents to produce value-added chemicals [3,4]. Among the various C-C bond formation reactions, cyanosilylation of carbonyl compounds as a common and significant reaction has been extensively used in the agricultural and pharmaceutical industry to synthesize α-hydroxycarbonyl compounds, non-steroid anti-inflammatory drugs and β-amino alcohols [5–8]. Especially in recent years, with the development of green chemistry and the shortage of medical resources, cyanosilylation reaction has attracted growing attentions due to its mild reaction conditions, fine target product selectivity as well as a broad scope of applications [9,10]. However, the rate of cyanosilylation reaction is quite slow at room temperature, which limits the practical applications of such kind of reaction [11–13]. A numerous of homogeneous and heterogeneous catalysts have been reported for the cyanosilylation reaction such as alkaloid, small organic molecules, metal-organic frameworks and metal oxides [3,14–17]. Among them, metal oxides such as Fe3O4, ZnO and CeO2 are regarded as potential catalysts in the cyanosilylation reaction because of their easy availability, low cost and unique performance [18–20]. Especially, when the size of metal oxides is reduced to the nanoscale, the catalysts exhibit the advantages of exposing more accessible active sites to reactant molecules, larger surface area as well as richer oxygen vacancies in the solid structure [21]. The Lewis and Brönsted acidity of metal oxide nanoparticles usually dominates the efficiency of the cyanosilylation reaction process [22]. But the release of hydrogen cyanide (HCN) during the reaction can inactivate the Brönsted/Lewis acidic sites and cause the decrease of reaction rate and the difficulty of catalyst recycling [19]. Therefore, it is very important to design and develop highly efficient and recyclable metal oxide nanoparticles for promoting the cyanosilylation reaction. CeO2 has been widely employed as a bifunctional acid-base catalyst because of its outstanding oxygen storage capacity, unique Ce4+/Ce3+ redox cycle, and high catalytic activity, which has a great potential in the organic synthesis [23–25]. CeO2 surface with exposed active sites and rich defects plays an important role in the adsorption of specific reactants, charge transfer as well as the process of chemical reactions [26]. Thus, there are numerous reports focused on improving the surface properties of CeO2 by metal deposition, surfactant modification as well as heterojunctions fabrication [27,28]. Among them, the surfactant modification is a cheap and effective approach to orient the growth of nanocrystals for different morphologies with specific facets, and prevent particles agglomeration to expose more active sites on catalysts. Herein, CeO2 nanoparticles (NPs) with different morphologies and sizes were successfully synthesized with sodium laurate (SL) as surfactant by adjusting pH value, temperature and the type of solvent during the preparation process. After that, the obtained CeO2 NPs were applied in the cyanosilylation reaction, exhibiting high catalytic activities. The effects of CeO2 morphology and size, catalysts amount, solvents, as well as reaction temperature on the yield were explored. The recyclability of the catalysts was also tested. Furthermore, the mechanism of the cyanosilylation reaction catalyzed by SL modified CeO2 NPs was investigated by combining experiments and density functional theory (DFT) calculations. 2 Experimental section 2.1 Chemicals Cerium nitrate hexahydrate (Ce(NO3)3⋅6H2O), cerium chloride heptahydrate (CeCl3⋅7H2O), sodium laurate (SL), N,N-Dimethylformamide (DMF) and dichloromethane (DCM) were got from Shanghai Macklin Biochemical Co. Other reagents were purchased from Shanghai Aladdin Biochemical Technology Co. All the chemicals were used without further purification. Deionized water was produced by a water purification system (RO-DI plus, Hitech, PRC). 2.2 Synthesis of CeO2 NPs with different morphologies and sizes 2.2.1 Polyhedron-shaped CeO2 NPs-10 nm Initially, 5.4 g Ce(NO3)3.6H2O was dissolved in 45 mL deionized water as cerium precursor, and 0.6 g SL was dissolved in 5 mL deionized water at 40 °C under vigorous stirring. Afterwards, the cerium precursor solution was added into a flask containing 15 mL NH3·H2O aqueous solution (3.12 M) at 70 °C under stirring. After that, H2O2 (0.3 wt%) was added drop by drop in the flask to oxidize the products. In this process, the purple precipitate (Ce (III)) gradually turned yellow (Ce (IV)). Subsequently, the SL solution was poured into the flask, and the reaction lasted for 1 h at 70 °C under stirring. Finally, the obtained polyhedron-shaped CeO2 NPs-10 nm (P-CeO2 NPs-10 nm) were washed with ethanol for two times and further centrifuged at 6000 rpm. The as-prepared CeO2 NPs can be dispersed in nonpolar solvents such as heptane, benzene and dichloromethane to form nanodispersions. 2.2.2 Polyhedron-shaped CeO2 NPs-4 nm According to the above experimental conditions, polyhedron-shaped CeO2 NPs-4 nm (P-CeO2 NPs-4 nm) could be prepared by replacing deionized water with methanol, and decreasing the reaction temperature to 65 °C. 2.2.3 Rod-shaped CeO2 NPs According to the above experimental conditions, rod-shaped CeO2 NPs (R-CeO2 NPs) could be synthesized by increasing the reaction temperature to 85 °C and adjusting the pH value of solvent to 9 by NH3·H2O. 2.2.4 Spindle-shaped CeO2 NPs According to the above experimental conditions, spindle-shaped CeO2 NPs (S-CeO2 NPs) could be synthesized by using methanol as solvent and replacing Ce(NO3)3·6H2O with CeCl3·7H2O at 65 °C. 2.3 Cyanosilylation reaction A typical cyanosilylation reaction process was carried out as below: benzaldehyde (1.0 mmol), trimethylsilyl cyanide (TMSCN, 2.0 mmol), and CeO2 NPs (0.02 mmol, 2 mol%) were placed in a capped glass vial and stirred at room temperature for 1 h under solvent or solvent-free conditions. Afterwards, the catalysts were washed with ethanal once and separated by centrifugation at 8000 rpm. And then the catalysts were dried in the oven at 60 °C for 30 min to regenerate the activity for the following recycling experiments. The equation of cyanosilylation reaction is as follows: Image 1 . 2.4 Computational models and methods All the DFT calculations in this work were done by the Vienna Ab-initio Simulation Package (VASP). The projector augmented wave (PAW) potentials and Perdew-Burke-Ernzerhof (PBE) exchange-correlation functional were adopted. All calculations were conducted using a plane-wave kinetic energy cutoff of 400 eV. The energy convergence cri-terion was set to be 10−4 eV, and the force on each ion was converged to less than 0.03 eV/Å. The Brillouin zone of bulk CeO2 was sampled with (6 ×6 ×6) Monkhorst-Pack k-point mesh. A two-layer structure was constructed, and the bottom layer was fixed. (111) surface was selected as the reaction crystal plane and a vacuum layer of 25 Å along the z-direction was used to avoid interaction of neighbouring images. A (4 × 4 × 1) supercell was constructed and (2 ×2 ×1) Monkhorst-Pack k-point mesh was used for Brillouin zone sampling. 10% of the oxygen atoms on the surface of CeO2 were removed to simulate the oxygen vacancies on the surface. Adsorption energy ΔE of A group adsorbed on the surface was defined as: ΔE = E*A – (E* + EA) where *A and * denote the adsorption of A group on substrates and the bare substrates, EA denotes the energy of A group. Here, A group includes reactants and modifier. 2.5 Characterization The size, lattice structure and morphology of CeO2 catalysts were examined with a high-resolution transmission electron microscopy (HRTEM, JEOL-950, Japan). Nano Measurer software was employed to calculate the average particle size of CeO2 NPs by measuring over 50 particles in the TEM images. X-ray diffraction (XRD) patterns were tested by a Bruker equipment. Fourier transformed infrared spectroscopy (FTIR) was tested by a Perkin Elmer Frontier. Thermogravimetric analysis (TG) was characterized on a Netzsch TG209F3. The Brunauer-Emmett-Teller (BET) was tested via a BSDPS(M). X-ray photoelectron spectroscopy (XPS) was performed with a Thermo ESCALAB 250Xi. The reactants and products in the cyanosilylation reaction process were detected by Gas Chromatography-Mass Spectrometry (GCMS, Thermo Fisher ISQ Trace1300). Pyridine-adsorption IR analysis was performed on a Tensor 27 and the detailed experimental conditions were carried out according to the literature [29]. The number of Lewis (L) and Brönsted (B) acidic sites was calculated by the following formula: C (pyridine on Lewis sites) = 1.42 × IA (L) × R2/W C (pyridine on Brönsted sites) = 1.88 × IA (B) × R2/W where C is the concentration [mmol/g catalyst], IA is the integrated absorbance of the L or B band (cm−1), R is the radius of the catalyst disk (cm), and W is the mass of the disk (mg). 3 Results and discussion Fig. 1 shows the representative HRTEM images and XRD patterns of the obtained CeO2 with different morphologies and sizes. P-CeO2 NPs-4 nm mainly expose the most stable (111) planes as well as a small proportion of (200) planes, and can be seen as polyhedron-shape nanoparticles dominated by truncated octahedron (Fig. 1a). Correspondingly, P-CeO2 NPs-10 nm expose diverse planes such as (111), (220) and (200) (Fig. 1b), demonstrating that the as-prepared CeO2 NPs-10 nm have polyhedral structures defined by enclosed octahedral (Fig. S1). Furthermore, R-CeO2 NPs with length (100–150 nm) and diameter (5–10 nm) expose (220) and (200) faces were formed under the strong alkaline condition (pH=9) and high temperature (85 °C) (Fig. 1c), while the release of Cl- from CeCl3⋅7H2O precursor tended to orient the growth of CeO2 nanocrystals into secondary structures, thereby forming S-CeO2 NPs with length (50–100 nm) and diameter (20–40 nm) (Fig. 1d). The long hydrocarbon chain of SL endows the modified CeO2 NPs the ability to disperse into nonpolar solvents such as heptane, benzene and dichloromethane (Fig. S2). Meanwhile, SL can prevent the nanoparticles from agglomeration to achieve more active sites on the surface of CeO2 (Fig. S3a and Fig. S3b). It is worth noting that R-CeO2 NPs and S-CeO2 NPs can not be formed well without the addition of SL, indicating SL as capping agent plays an important role in the oriented growth of CeO2 nanoparticles (Fig. S3c and Fig. S3d). Fig. 1e further demonstrates that the main diffractions peaks of the obtained products are in accordance with planes of cubic fluorite structure [30]. P-CeO2 NPs-10 nm and R-CeO2 NPs have stronger and narrower diffraction peaks than other CeO2 NPs, which may be due to their relatively larger particle sizes and better crystallization from the synthesis at a relatively higher temperature. Fig. 2 shows the FTIR spectra and TG curves of the obtained CeO2 NPs. The stretching frequency peaks of carboxylate group (-COO-) at 1434 and 1535 cm−1 confirm that the carboxy group (-COOH) of SL dehydrates with the hydrogenated O atom on the surface of CeO2 to form a stable modified structure [31] (Fig. 2a). As shown in Fig. 2b, the modified CeO2 samples have two stages of weight loss. The weight loss before 200 °C is mainly attributed to adsorbed water, and the grafted SL does not start decomposing until the temperature exceeds 300 °C. The SL grafting ratio of P-CeO2 NPs-10 nm is slightly lower (~15%) compared with that of P-CeO2 NPs-4 nm (~22%), demonstrating that the smaller nanoparticles can graft more SL. Meanwhile, the obtained CeO2 NPs with different morphologies have the outstanding thermal stability and dispersibility, which has a great potential in many fields, such as organic synthesis, lubricating oil and oil-soluble UV cosmetics [32,33]. Fig. 3 illustrates the effects of CeO2 shape, SL modification of catalysts, the addition amount of catalysts, and reaction temperature on the cyanosilylation reaction. As shown in Fig. 3a, P-CeO2 NPs-10 nm exhibit the highest catalytic efficiency in converting benzaldehyde to α-[(trimethylsilyl)oxy]benzeneacetonitrile among the six samples, which can achieve a high yield of over 99% in 1 h (Fig. S4). In comparison, P-CeO2 NPs-4 nm, R-CeO2 NPs and S-CeO2 NPs can complete the reaction in 3 h, 3 h and 4 h, respectively, while the cyanosilylation reaction without catalysts can only achieve a yield of 33.1% in 4 h. Furthermore, unmodified polyhedron-shaped CeO2 NPs-4 nm (UM-P-CeO2 NPs-4 nm) and unmodified polyhedron-shaped CeO2 NPs-10 nm (UM-P-CeO2 NPs-10 nm) can only achieve a yield of around 75% in 4 h due to their serious agglomeration. It is worth noting that UM-P-CeO2 NPs-4 nm and UM-P-CeO2 NPs-10 nm exhibit satisfying performances in the first 15 min, however, their catalytic activities decline significantly in the following reaction period. Such results indicate that the active sites of CeO2 NPs without SL modification can not keep efficient and sustainable during the whole reaction process. This completely proves the important role of SL in the cyanosilylation reaction. As shown in Fig. 3b, the reaction rate of P-CeO2 NPs-10 nm has an obvious increase with the addition amount of catalysts. The reaction was completed in 40 min for 5 mol% compared with 1.5 h for 1 mol%. Furthermore, the reaction rate was obviously enhanced with increasing reaction temperature from 25 to 60 °C, achieving a high yield of over 99% in a short time of 15 min (Fig. 3c). Fig. 4 compares the catalytic properties of the obtained P-CeO2 NPs-10 nm in the cyanosilylation reaction in different solvents and under solvent-free conditions. As shown in Fig. 4a, P-CeO2 NPs-10 nm can still keep high catalytic activity without solvents. The reaction is completed in 45 min. The avoidance of organic solvents meets the requirements of sustainable development. It can be seen that the reaction catalyzed by P-CeO2 NPs-10 nm can achieve a high yield of over 99% in 1 h in heptane, DMF, or acetonitrile as solvent, and over 80% in toluene and DCM (Fig. 4a and Fig. S5). This indicated that the obtained catalysts can adapt various solvents. Heptane is thus selected as reaction solvent due to its lower toxicity than DMF and acetonitrile. Moreover, the benzaldehyde with electron withdrawing (-Br, -NO2 and -CN) and donating (-Me and -OMe) functional groups can be converted into the corresponding products in a relative high yield, indicating the applicability of the obtained CeO2 for more aldehydes with different structures and even ketone (Table S1). Fig. 5 presents the catalysts recyclability, as well as FTIR spectra, XRD patterns and Ce 3d XPS spectra of the P-CeO2 NPs-10 nm before and after the reaction. As shown in Fig. 5a, the catalytic performance of the as-prepared P-CeO2 NPs-10 nm does not have an obvious decrease after 5 cycles. The reaction still keeps a high yield of over 98% in 1 h. As shown in Fig. 5b, the new peaks at 850, 1574 and 1670 cm−1 appear after the reaction, corresponding to the Si-CH3 rock of TMSCN or products, C-C and CO stretch peaks of benzaldehyde. The peaks at 1022 and 1070 cm−1 can be ascribed to silanol Si-O stretch, proving that the hydroxyl group or oxygen atom on CeO2 surface interacts with the silicon atom of TMSCN to form the Si-O bond [34]. Furthermore, the shape and particle size of CeO2 NPs do not have a change after the reaction (Fig. S6). As shown in Fig. 5c and d, P-CeO2 NPs-10 nm have the same XRD diffraction peaks and XPS spectra before and after reactions. This indicated that the crystalline structure and elemental composition of the catalysts are not affected during the reaction. It is worth noting that a complex process is usually needed for the regeneration of CeO2 catalysts for the following recycling experiments. Wang et al. employed aqueous H2O2 to treat the used CeO2, and then the catalysts experienced the process of being washed and filtered by deionized water, as well as activated at 400 °C for 30 min [34]. Garnes-Portolés et al. separated the catalysts by centrifugation and calcinated the used CeO2 at 400 °C for 4 h for the catalyst regeneration [19]. In this work, the used P-CeO2 NPs were only washed by ethanol once, and then dried in the oven at 60 °C for 30 min for the subsequent recycling experiments. Such a simple regeneration process will make the as-prepared CeO2 NPs have a great potential in the practical application. Table 1 compares the performances of our P-CeO2 NPs-10 nm with some reported catalysts and calculates the related turnover frequency (TOF) for the cyanosilylation reaction using the following equation: TOF = n product n catalyst × t where n product and n catalyst present the number of product and catalyst molecules, respectively, and t is the reaction time. It can be obviously found that the as-prepared P-CeO2 NPs-10 nm exhibit the leading position in the cyanosilylation reaction among the heterogeneous catalysts. Its TOF value is almost 8 times higher than that of other reported CeO2 nanoparticles, and even exceeds those of most metal-organic frameworks and coordination polymers. Only MIL-101 (Cr) with the usage of 0.3 mol% in the cyanosilylation reaction has a slightly higher TOF (80 h−1) than that of P-CeO2 NPs-10 nm (66.7 h−1). However, the reaction is completed in over 4 h and the 4th cycle reaction only achieves a yield of 85%. There are many factors affecting the catalytic activity of CeO2 NPs in the cyanosilylation reaction, such as Lewis and Brönsted acidic sites, oxygen defects and SL modification. Among them, Lewis and Brönsted acidic sites are usually seen to play the dominant role. Herein, pyridine-adsorption IR analysis was performed to test the quantification Lewis and Brönsted acidity of the obtained CeO2 NPs with different morphologies. As shown in Fig. 6a, the peaks at 1440 and 1597 cm−1 are attributed to the Lewis acidic sites, and the peak at 1540 cm−1 is assigned to the Brönsted acidic sites [42]. Furthermore, the peak at 1470 cm−1 is ascribed to coordinatively bonded pyridine or hydrogen-bonded pyridine. It is clear that P-CeO2 NPs-10 nm have the strongest acidity (88.3 μmol/g) (Fig. 6b). Moreover, P-CeO2 NPs-10 nm have the highest Brönsted/Lewis ratio, while P-CeO2 NPs-4 nm have the largest proportion of Lewis acidic sites. The overall acidity of CeO2 NPs is positively correlated with the performance of the catalyst in the reaction, demonstrating the dominant role of Lewis-Brönsted acidic sites on catalysts for promoting the cyanosilylation reaction. Fig. 7 presents the Ce 3d XPS spectra of the as-prepared CeO2 NPs with different morphologies, and the Ce3+ and Ce4+ components are labeled as u and v, respectively. Here, the peaks assigned v0, v1, v2, v0′, v1′ and v2′ are ascribed to Ce4+ oxidation, and u1, u0, u1′ as well as u0′ are signals of Ce3+ [43]. The overall areas of various Ce3+ and Ce4+ peaks are fitted and the content of surface oxygen vacancy is calculated by Ce3+ content, and the results are listed in Table 2. Clearly, P-CeO2 NPs-10 nm have more Ce3+ sites and richer oxygen defects, and such XPS results are consistent with TEM analysis. The formation of oxygen vacancies on (111) surface needs more energy compared with those on (200) and (220) surfaces [44]. Thus, P-CeO2 NPs-10 nm with (200) and (220) planes usually have a high content of oxygen defects. Furthermore, 3, 3 ´ , 5, 5 ´ -tetramethylbenzidine (TMB) was employed as an indicator to confirm the generation of radical oxygen species (ROS) during the reaction [45]. The solution color turned blue when the benzaldehyde was added. This indicated that oxygen vacancies on CeO2 surface also play an important role in the cyanosilylation reaction (Fig. S7). P-CeO2 NPs-4 nm have higher surface areas (124.6 m2/g) than P-CeO2 NPs-10 nm (98.3 m2/g), while the P-CeO2 NPs-4 nm do not exhibit the same excellent performance with P-CeO2 NPs-10 nm, demonstrating that the surface area does not mainly contribute to high catalytic activity in this system (Table 2). In addition, DFT calculations were also employed to determine the influence of SL on the reaction process and the chemisorption of TMSCN on the surface of CeO2. Based on the XPS analysis, we established the CeO2−x model with 10% oxygen vacancy on the surface layer, and added SL in this model to simulate the modified CeO2−x catalyst (SL-CeO2−x) ( Fig. 8 and Table S2). The carboxy group of SL dehydrates with the hydrogenated O atom on the surface of CeO2−x to form a stable modified structure. During the reaction, TMS and CN molecules are broken from TMSCN which are bonded to O and Ce atoms on CeO2−x surface, respectively. After that, TMS and CN attack the O and carbon atoms of carbonyl in benzaldehyde to achieve the product. Ce site acts as a bridge for CN transfer, while CN may continuously occupy the Ce site due to their strong adsorption and cause the deactivation of catalysts. The adsorption energy of CN on the SL modified CeO2−x is −4.49 eV, which is lower than that on unmodified CeO2−x (−4.84 eV). This demonstrates SL grafted on CeO2−x surface can not only suppress the adsorption of CN on the catalyst, but also reduce the CN transfer energy barrier, thereby accelerating the reaction process. Furthermore, SL does not affect the adsorption of TMSCN on the catalysts. The adsorption energy of TMSCN on SL-CeO2−x (−2.13 eV) is even higher than that (−1.98 eV) on unmodified CeO2−x. The adsorption energies of SL molecules and reactant molecules are negative, further confirming that SL has a strong chemisorption on the catalyst surface and the cyanosilylation reaction can smoothly proceed (Table S3). On the SL-CeO2−x model, the charge number of O1 increases from −1.22e to −1.27e due to the charge transfer from the C atom of SL (Table S3). Such charge transfer leads to the decline of Ce4 charge from +2.30e to +2.26e. This will affect the adsorption equilibrium of CN on Ce2, Ce4 and Ce5, and speed up the reaction kinetics. Furthermore, the position of CN has an obvious change that the C of CN tends to bond with Ce5 on unmodified CeO2−x but bond with Ce2 on SL-CeO2−x due to the charge transfer of Ce4 (Fig. 8 and Fig. S8). The improvement of adsorption energy and charge transfer are responsible for higher catalytic activity of the SL modified CeO2−x than unmodified CeO2 in the cyanosilylation reaction. Based on the above investigations, we propose a possible catalytic mechanism of the cyanosilylation reaction on the surface of the obtained SL-assisted CeO2 NPs. Lewis and Brönsted acidic sites of CeO2 show a dominant role in promoting the cyanosilylation reaction, and can electrophilically activate the carbonyl group of aldehydes. O atom on CeO2 surface as Lewis base sites interacts with the Si of TMSCN. Subsequently, TMS and CN molecules which are broken from TMSCN attack the O and carbon atom of carbonyl in benzaldehyde to achieve the α-[(trimethylsilyl)oxy]benzeneacetonitrile. P-CeO2 NPs-10 nm with diverse crystal planes are more likely to form highly active adsorption sites such as corners, edges and steps, which is helpful to speeding up the adsorption of reactant molecules. Furthermore, SL grafted on the CeO2 surface can inhibit HCN from deactivating the active sites on the catalysts, and CN has a lower transfer energy barrier on SL-CeO2−x model compared with that on UM-CeO2−x model, which is beneficial to more efficient reaction. 4 Conclusions In summary, CeO2 nanocrystals with tunable sizes and morphologies were successfully prepared by using SL as modifier, which were used as catalysts for the cyanosilylation reaction. The obtained P-CeO2 NPs-10 nm have strong Lewis and Brönsted acidic sites, exhibiting the high catalytic activity. The reaction can achieve an excellent yield of over 99% in 1 h in heptane, and 0.75 h under solvent-free conditions. The cyanosilylation reaction catalyzed by P-CeO2 NPs-10 nm still keeps a high yield of over 98% in 1 h in the 5th cycle, demonstrating an excellent recyclability. Furthermore, Brönsted-Lewis acidic synergy on catalysts is proved to play the dominant role in promoting the cyanosilylation reaction. DFT calculations reveal that the SL grafted on CeO2 NPs can suppress the adsorption of HCN and accelerate the cyanosilylation reaction. This work provides a new idea to synthesize efficient and recyclable catalysts employed in the practical applications. CRediT authorship contribution statement Hao Wu: Investigation, Data curation, Writing – original draft, Linkai Han: Density functional theory calculation, Ni Wang: Validation, Formal analysis, Ling-Xia Yun: Validation, Formal analysis, Zhonghua Xiong：Writing – review & editing, Jie-Xin Wang: Supervision, Writing – review & editing, Funding acquisition. Declaration of Competing Interest The authors declare that they have no known competing financial interests or personal relationships that could have appeared to influence the work reported in this paper. Acknowledgements This work was financially supported by National Key R & D Program of China (2017YFA0206801). Appendix A Supporting information Supplementary data associated with this article can be found in the online version at doi:10.1016/j.apcata.2021.118404. Appendix A Supplementary material Supplementary material . References [1] A.P.Y. Chan A.G. Sergeev Coord. Chem. Rev. 413 2020 213213 A.P.Y. Chan, A.G. Sergeev, Metal-mediated cleavage of unsaturated C-C bonds, Coord. Chem. Rev. 413 (2020) 213213. [2] T.P. Hu Y.Q. Zhao Z. Jaglicic K. Yu X.P. Wang D. Sun Inorg. Chem. 54 2015 7415 7423 T.P. Hu, Y.Q. Zhao, Z. Jaglicic, K. Yu, X.P. Wang, D. Sun, Four hybrid materials based on preyssler P5W30 polyoxometalate and first-row transition-metal complex, Inorg. Chem. 54 (2015) 7415–7423. [3] M. Murakami N. Ishida J. Am. Chem. Soc. 138 2016 13759 13769 M. Murakami, N. Ishida, Potential of metal-catalyzed C-C single bond cleavage for organic synthesis, J. Am. Chem. Soc. 138 (2016) 13759–13769. [4] K. Sheng L.M. Fan X.F. Tian R.K. Gupta L. Gao C.H. Tung D. Sun Sci. China Chem. 63 2019 182 186 K. Sheng, L.M. Fan, X.F. Tian, R.K. Gupta, L. Gao, C.H. Tung, D. Sun, Temperature-induced Sn(II) supramolecular isomeric frameworks as promising heterogeneous catalysts for cyanosilylation of aldehydes, Sci. China Chem. 63 (2019) 182–186. [5] Y. Kikukawa K. Suzuki M. Sugawa T. Hirano K. Kamata K. Yamaguchi N. Mizuno Angew. Chem. Int. Ed. 51 2012 3686 3690 Y. Kikukawa, K. Suzuki, M. Sugawa, T. Hirano, K. Kamata, K. Yamaguchi, N. Mizuno, Cyanosilylation of carbonyl compounds with trimethylsilyl cyanide catalyzed by an yttrium-pillared silicotungstate dimer, Angew. Chem. Int. Edit. 51 (2012) 3686–3690. [6] X.P. Zeng Z.Y. Cao X. Wang L. Chen F. Zhou F. Zhu C.H. Wang J. Zhou J. Am. Chem. Soc. 138 2016 416 425 X.P. Zeng, Z.Y. Cao, X. Wang, L. Chen, F. Zhou, F. Zhu, C.H. Wang, J. Zhou, Activation of chiral (salen)AlCl complex by phosphorane for highly enantioselective cyanosilylation of ketones and enones, J. Am. Chem. Soc. 138 (2016) 416–425. [7] H. An Y. Zhang Y. Hou T. Hu W. Yang S. Chang J. Zhang Dalton Trans. 47 2018 9079 9089 H. An, Y. Zhang, Y. Hou, T. Hu, W. Yang, S. Chang, J. Zhang, Hybrid dimers based on metal-substituted Keggin polyoxometalates (metal = Ti, Ln) for cyanosilylation catalysis, Dalton T. 47 (2018) 9079–9089. [8] X.P. Wang Y.Q. Zhao Z. Jaglicic S.N. Wang S.J. Lin X.Y. Li D. Sun Dalton Trans. 44 2015 11013 11020 X.P. Wang, Y.Q. Zhao, Z. Jaglicic, S.N. Wang, S.J. Lin, X.Y. Li, D. Sun, Controlled in situ reaction for the assembly of Cu(II) mixed-ligand coordination polymers: synthesis, structure, mechanistic insights, magnetism and catalysis, Dalton T. 44 (2015) 11013–11020. [9] J.J. Du X. Zhang X.P. Zhou D. Li Inorg. Chem. Front. 5 2018 2772 2776 J.J. Du, X. Zhang, X.P. Zhou, D. Li, Robust heterometallic MOF catalysts for the cyanosilylation of aldehydes, Inorg. Chem. Front. 5 (2018) 2772–2776. [10] N. Kurono T. Ohkuma ACS Catal. 6 2016 989 1023 N. Kurono, T. Ohkuma, Catalytic asymmetric cyanation reactions, ACS Catal. 6 (2016) 989–1023. [11] K. Motokura T. Baba Green Chem. 14 2012 565 579 K. Motokura, T. Baba, An atom-efficient synthetic method: carbosilylations of alkenes, alkynes, and cyclic acetals using Lewis and Brønsted acid catalysts, Green Chem. 14 (2012) 565–579. [12] Y. Hou H. An B. Ding Y. Li Dalton Trans. 46 2017 8439 8450 Y. Hou, H. An, B. Ding, Y. Li, Evans-showell-type polyoxometalate constructing novel 3D inorganic architectures with alkaline earth metal linkers: Syntheses, structures and catalytic properties, Dalton T. 46 (2017) 8439–8450. [13] A. Karmakar G. Rubio A. Paul M.F.C. Guedes da Silva K.T. Mahmudov F.I. Guseinov S.A.C. Carabineiro A.J.L. Pombeiro Dalton Trans. 46 2017 8649 8657 A. Karmakar, G. Rubio, A. Paul, M.F.C. Guedes da Silva, K.T. Mahmudov, F.I. Guseinov, S.A.C. Carabineiro, A.J.L. Pombeiro, Lanthanide metal organic frameworks based on dicarboxyl-functionalized arylhydrazone of barbituric acid: syntheses, structures, luminescence and catalytic cyanosilylation of aldehydes, Dalton T. 46 (2017) 8649–8657. [14] Z. Ma A.V. Gurbanov M. Sutradhar M.N. Kopylovich K.T. Mahmudov A.M. Maharramov F.I. Guseinov F.I. Zubkov A.J.L. Pombeiro Mol. Catal. 428 2017 17 23 Z. Ma, A.V. Gurbanov, M. Sutradhar, M.N. Kopylovich, K.T. Mahmudov, A.M. Maharramov, F.I. Guseinov, F.I. Zubkov, A.J.L. Pombeiro, Effective cyanosilylation of aldehydes with copper(II)-based polymeric catalysts, Mol. Catal. 428 (2017) 17–23. [15] M. Nourian F. Zadehahmadi R. Kardanpour S. Tangestaninejad M. Moghadam V. Mirkhani I. Mohammadpoor-Baltork Appl. Organomet. Chem. 32 2018 e3957 M. Nourian, F. Zadehahmadi, R. Kardanpour, S. Tangestaninejad, M. Moghadam, V. Mirkhani, I. Mohammadpoor-Baltork, Highly efficient oxidative cleavage of alkenes and cyanosilylation of aldehydes catalysed by magnetically recoverable MIL-101, Appl. Organomet. Chem. 32 (2018) e3957. [16] K. Kamata K. Sugahara Catalysts 7 2017 345 K. Kamata, K. Sugahara, Base catalysis by mono- and polyoxometalates, Catalysts 7 (2017) 345. [17] F. Fei H. An C. Meng L. Wang H. Wang RSC Adv. 5 2015 18796 18805 F. Fei, H. An, C. Meng, L. Wang, H. Wang, Lanthanide-supported molybdenum-vanadium oxide clusters: syntheses, structures and catalytic properties, RSC Adv. 5 (2015) 18796–18805. [18] A. Rostami B. Atashkar Catal. Commun. 58 2015 80 84 A. Rostami, B. Atashkar, Synthesis, characterization and catalytic property of chiral oxo-vanadium (+)-pseudoephedrine complex supported on magnetic nanoparticles Fe3O4 in the cyanosilylation of carbonyl compounds, Catal. Commun. 58 (2015) 80–84. [19] F. Garnes-Portolés M.Á. Rivero-Crespo A. Leyva-Pérez J. Catal. 392 2020 21 28 F. Garnes-Portolés, M.Á. Rivero-Crespo, A. Leyva-Pérez, Nanoceria as a recyclable catalyst/support for the cyanosilylation of ketones and alcohol oxidation in cascade, J. Catal. 392 (2020) 21–28. [20] S. Yamaguchi H. Yamaura K. Morihara M. Iwasaki H. Yahiro Chem. Lett. 45 2016 851 853 S. Yamaguchi, H. Yamaura, K. Morihara, M. Iwasaki, H. Yahiro, Cyanosilylation of benzaldehyde with trimethylsilyl cyanide over Zn-Sn mixed oxide catalysts with cubic-shaped particles, Chem. Lett. 45 (2016) 851–853. [21] J.T. Du J. Shi Q. Sun D. Wang H. Wu J.X. Wang J.F. Chen Chem. Eng. J. 382 2020 122883 J.T. Du, J. Shi, Q. Sun, D. Wang, H. Wu, J.X. Wang, J.F. Chen, High-gravity-assisted preparation of aqueous dispersions of monodisperse palladium nanocrystals as pseudohomogeneous catalyst for highly efficient nitrobenzene reduction, Chem. Eng. J. 382 (2020) 122883. [22] W. Fu C. Yin Y. Feng L. Zhang F. Cheng Z. Fang C. Zhu T. Tang Appl. Catal. A-Gen. 609 2021 117907 W. Fu, C. Yin, Y. Feng, L. Zhang, F. Cheng, Z. Fang, C. Zhu, T. Tang, Synergistic catalysis of the Brönsted acid and highly dispersed Cu on the mesoporous Beta zeolite in the intermolecular aminoazidation of styrene, Appl. Catal. A-Gen. 609 (2021) 117907. [23] S. Jian Y. Yang W. Ren L. Xing D. Zhao Y. Tian T. Ding X. Li Chem. Eng. Sci. 226 2020 115891 S. Jian, Y. Yang, W. Ren, L. Xing, D. Zhao, Y. Tian, T. Ding, X. Li, Kinetic analysis of morphologies and crystal planes of nanostructured CeO2 catalysts on soot oxidation, Chem. Eng. Sci. 226 (2020) 115891. [24] H. Wu Q. Sun J. Chen G.Y. Wang D. Wang X.F. Zeng J.X. Wang Chem. Eng. J. 425 2021 130640 H. Wu, Q. Sun, J. Chen, G.Y. Wang, D. Wang, X.F. Zeng, J.X. Wang, Citric acid-assisted ultrasmall CeO2 nanoparticles for efficient photocatalytic degradation of glyphosate, Chem. Eng. J. 425 (2021) 130640. [25] B.J. Wang G.W. Chu Y.B. Li X.Z. Duan J.X. Wang Y. Luo Chem. Eng. Sci. 244 2021 116814 B.J. Wang, G.W. Chu, Y.B. Li, X.Z. Duan, J.X. Wang, Y. Luo, Intensified micro-mixing effects on evolution of oxygen vacancies of CeO2-based catalysts for improved CO oxidation, Chem. Eng. Sci. 244 (2021) 116814. [26] E.L. Fornero M. Bosco A. Aguirre A. Bonivardi S.E. Collins Appl. Catal. A-Gen. 623 2021 118282 E.L. Fornero, M. Bosco, A. Aguirre, A. Bonivardi, S.E. Collins, Highly disperse CeO2 nanoparticles on MgO hexagonal plates as oxidation catalyst, Appl. Catal. A-Gen. 623 (2021) 118282. [27] M. Wu Y. Zhang W. Szeto W. Pan H. Huang D.Y.C. Leung Chem. Eng. Sci. 200 2019 203 213 M. Wu, Y. Zhang, W. Szeto, W. Pan, H. Huang, D.Y.C. Leung, Vacuum ultraviolet (VUV)-based photocatalytic oxidation for toluene degradation over pure CeO2, Chem. Eng. Sci. 200 (2019) 203–213. [28] Z. Li X. Dong M. Zhang L. Leng W. Chen J.H. Horton J. Wang Z. Li W. Wu ACS Appl. Mater. Inter. 12 2020 57569 57577 Z. Li, X. Dong, M. Zhang, L. Leng, W. Chen, J.H. Horton, J. Wang, Z. Li, W. Wu, Selective hydrogenation on a highly active single-atom catalyst of palladium dispersed on ceria nanorods by defect engineering, ACS Appl. Mater. Inter. 12 (2020) 57569–57577. [29] Y. Wang F. Wang Q. Song Q. Xin S. Xu J. Xu J. Am. Chem. Soc. 135 2013 1506 1515 Y. Wang, F. Wang, Q. Song, Q. Xin, S. Xu, J. Xu, Heterogeneous ceria catalyst with water-tolerant Lewis acidic sites for one-pot synthesis of 1,3-diols via Prins condensation and hydrolysis reactions, J. Am. Chem. Soc. 135 (2013) 1506–1515. [30] A. Trovarelli J. Llorca ACS Catal. 7 2017 4716 4735 A. Trovarelli, J. Llorca, Ceria catalysts at nanoscale: How do crystal shapes shape catalysis? ACS Catal. 7 (2017) 4716–4735. [31] Y. Xia J. Shi Q. Sun D. Wang X.F. Zeng J.X. Wang J.F. Chen Chem. Eng. J. 394 2020 124843 Y. Xia, J. Shi, Q. Sun, D. Wang, X.F. Zeng, J.X. Wang, J.F. Chen, Controllable synthesis and evolution mechanism of monodispersed Sub-10 nm ZrO2 nanocrystals, Chem. Eng. J. 394 (2020) 124843. [32] S. Hong J. Kim J. Won N. Qureshi S. Chae Y. Wada H. Hiyama S. Hamada T. Kim ECS J. Solid. State Sc. 8 2019 P430 P436 S. Hong, J. Kim, J. Won, N. Qureshi, S. Chae, Y. Wada, H. Hiyama, S. Hamada, T. Kim, A water polishing process to improve ceria abrasive removal, ECS J. Solid. State. Sc. 8 (2019) P430-P436. [33] Y. Minamidate S. Yin T. Sato Mater. Chem. Phys. 123 2010 516 520 Y. Minamidate, S. Yin, T. Sato, Synthesis and characterization of plate-like ceria particles for cosmetic application, Mater. Chem. Phys. 123 (2010) 516–520. [34] G. Wang L. Wang X. Fei Y. Zhou R.F. Sabirianov W.N. Mei C.L. Cheung Catal. Sci. Technol. 3 2013 2602 2609 G. Wang, L. Wang, X. Fei, Y. Zhou, R.F. Sabirianov, W.N. Mei, C.L. Cheung, Probing the bifunctional catalytic activity of ceria nanorods towards the cyanosilylation reaction, Catal. Sci. Technol. 3 (2013) 2602–2609. [35] Z. Zhang J. Chen Z. Bao G. Chang H. Xing Q. Ren RSC Adv. 5 2015 79355 79360 Z. Zhang, J. Chen, Z. Bao, G. Chang, H. Xing, Q. Ren, Insight into the catalytic properties and applications of metal–organic frameworks in the cyanosilylation of aldehydes, RSC Adv. 5 (2015) 79355–79360. [36] F.G. Xi Y. Yang H. Liu H.F. Yao E.Q. Gao RSC Adv. 5 2015 79216 79223 F.G. Xi, Y. Yang, H. Liu, H.F. Yao, E.Q. Gao, Different acidity and additive effects of zirconium metal-organic frameworks as catalysts for cyanosilylation, RSC Adv. 5 (2015) 79216–79223. [37] H. Tian S. Liu Z. Zhang T. Dang Y. Lu S. Liu ACS Sustain. Chem. Eng. 9 2021 4660 4667 H. Tian, S. Liu, Z. Zhang, T. Dang, Y. Lu, S. Liu, Highly stable polyoxovanadate-based Zn-MOF with dual active sites as a solvent-free catalyst for C-C bond formation, ACS Sustain. Chem. Eng. 9 (2021) 4660–4667. [38] L. Hu G.X. Hao H.D. Luo C.X. Ke G. Shi J. Lin X.M. Lin U.Y. Qazi Y.P. Cai Cryst. Growth Des. 18 2018 2883 2889 L. Hu, G.X. Hao, H.D. Luo, C.X. Ke, G. Shi, J. Lin, X.M. Lin, U.Y. Qazi, Y.P. Cai, Bifunctional 2D Cd(II)-based metal-organic framework as efficient heterogeneous catalyst for the formation of C-C bond, Cryst. Growth Des. 18 (2018) 2883–2889. [39] H. An J. Zhang S. Chang Y. Hou Q. Zhu Inorg. Chem. 59 2020 10578 10590 H. An, J. Zhang, S. Chang, Y. Hou, Q. Zhu, 2D hybrid architectures constructed from two kinds of polyoxovanadates as efficient heterogeneous catalysts for cyanosilylation and knoevenagel condensation, Inorg. Chem. 59 (2020) 10578–10590. [40] W. Jiang J. Yang Y.Y. Liu S.Y. Song J.F. Ma Inorg. Chem. 56 2017 3036 3043 W. Jiang, J. Yang, Y.Y. Liu, S.Y. Song, J.F. Ma, A stable porphyrin-based porous mog metal-organic framework as an efficient solvent-free catalyst for C-C bond formation, Inorg. Chem. 56 (2017) 3036–3043. [41] J.Z. Gu S.M. Wan M.V. Kirillova A.M. Kirillov Dalton Trans. 49 2020 7197 7209 J.Z. Gu, S.M. Wan, M.V. Kirillova, A.M. Kirillov, H-Bonded and metal(ii)-organic architectures assembled from an unexplored aromatic tricarboxylic acid: structural variety and functional properties, Dalton T. 49 (2020) 7197–7209. [42] J. An Y. Wang J. Lu J. Zhang Z. Zhang S. Xu X. Liu T. Zhang M. Gocyla M. Heggen R.E. Dunin-Borkowski P. Fornasiero F. Wang J. Am. Chem. Soc. 140 2018 4172 4181 J. An, Y. Wang, J. Lu, J. Zhang, Z. Zhang, S. Xu, X. Liu, T. Zhang, M. Gocyla, M. Heggen, R.E. Dunin-Borkowski, P. Fornasiero, F. Wang, Acid-promoter-free ethylene methoxycarbonylation over Ru-clusters/ceria: The catalysis of interfacial Lewis acid-base pair, J. Am. Chem. Soc. 140 (2018) 4172–4181. [43] M.N. Revoy R.W.J. Scott A.P. Grosvenor J. Phys. Chem. C 117 2013 10095 10105 M.N. Revoy, R.W.J. Scott, A.P. Grosvenor, Ceria nanocubes: Dependence of the electronic structure on synthetic and experimental conditions, J. Phys. Chem. C 117 (2013) 10095–10105. [44] M. Lykaki E. Pachatouridou S.A.C. Carabineiro E. Iliopoulou C. Andriopoulou N. Kallithrakas-Kontos S. Boghosian M. Konsolakis Appl. Catal. B: Environ. 230 2018 18 28 M. Lykaki, E. Pachatouridou, S.A.C. Carabineiro, E. Iliopoulou, C. Andriopoulou, N. Kallithrakas-Kontos, S. Boghosian, M. Konsolakis, Ceria nanoparticles shape effects on the structural defects and surface chemistry: Implications in CO oxidation by Cu/CeO2 catalysts, Appl. Catal. B: Environ. 230 (2018) 18–28. [45] L. Yuan W. Guo Y. Fu Z. Zhang P. Wang J. Wang Microchem. J. 160 2021 105639 L. Yuan, W. Guo, Y. Fu, Z. Zhang, P. Wang, J. Wang, A rapid colorimetric method for determining glutathione based on the reaction between cobalt oxyhydroxide nanosheets and 3,3′,5,5′-Tetramethylbenzidine, Microchem. J. 160 (2021) 105639.",
      "scopus-id": "85119998366",
      "coredata": {
        "eid": "1-s2.0-S0926860X2100418X",
        "dc:description": "Cyanosilylation of aromatic aldehydes has always been a promising reaction in the organic synthesis. Herein, we use sodium laurate (SL) as capping agent to synthesize CeO2 nanoparticles (NPs) with different morphologies and sizes, which are adopted as catalysts for the cyanosilylation reaction at room temperature. The obtained polyhedron-shaped CeO2 NPs with an average size of 10 nm are proved to have rich oxygen defects and abundant Lewis/Brönsted acidic sites, exhibiting excellent catalytic properties. The reaction can be rapidly completed in 1 h in heptane and 0.75 h under solvent-free conditions, achieving a high yield of over 99%. More importantly, the as-prepared catalysts possess outstanding recyclability that the reaction still keeps a high yield of over 98% in the 5th cycle. Density functional theory calculation is further employed to demonstrate SL grafted on CeO2 can greatly suppress the adsorption of hydrogen cyanide on the catalyst, thereby accelerating the reaction process.",
        "openArchiveArticle": "false",
        "prism:coverDate": "2021-11-25",
        "openaccessUserLicense": null,
        "prism:aggregationType": "Journal",
        "prism:url": "https://api.elsevier.com/content/article/pii/S0926860X2100418X",
        "dc:creator": [
          {
            "@_fa": "true",
            "$": "Wu, Hao"
          },
          {
            "@_fa": "true",
            "$": "Han, Linkai"
          },
          {
            "@_fa": "true",
            "$": "Wang, Ni"
          },
          {
            "@_fa": "true",
            "$": "Yun, Ling-Xia"
          },
          {
            "@_fa": "true",
            "$": "Xiang, Zhonghua"
          },
          {
            "@_fa": "true",
            "$": "Wang, Jie-Xin"
          }
        ],
        "link": [
          {
            "@_fa": "true",
            "@rel": "self",
            "@href": "https://api.elsevier.com/content/article/pii/S0926860X2100418X"
          },
          {
            "@_fa": "true",
            "@rel": "scidir",
            "@href": "https://www.sciencedirect.com/science/article/pii/S0926860X2100418X"
          }
        ],
        "dc:format": "application/json",
        "openaccessType": null,
        "pii": "S0926-860X(21)00418-X",
        "prism:volume": "628",
        "articleNumber": "118404",
        "prism:publisher": "Elsevier B.V.",
        "dc:title": "Sodium laurate-assisted CeO2 nanoparticles as highly efficient and recyclable catalysts for cyanosilylation reaction",
        "prism:copyright": "© 2021 Elsevier B.V. All rights reserved.",
        "openaccess": "0",
        "prism:issn": "0926860X",
        "dcterms:subject": [
          {
            "@_fa": "true",
            "$": "CeO2 nanoparticles"
          },
          {
            "@_fa": "true",
            "$": "Sodium laurate"
          },
          {
            "@_fa": "true",
            "$": "Cyanosilylation reaction"
          },
          {
            "@_fa": "true",
            "$": "Efficient catalysts"
          },
          {
            "@_fa": "true",
            "$": "Recyclability"
          },
          {
            "@_fa": "true",
            "$": "DFT calculation"
          }
        ],
        "openaccessArticle": "false",
        "prism:publicationName": "Applied Catalysis A: General",
        "openaccessSponsorType": null,
        "prism:pageRange": "118404",
        "pubType": "fla",
        "prism:coverDisplayDate": "25 November 2021",
        "prism:doi": "10.1016/j.apcata.2021.118404",
        "prism:startingPage": "118404",
        "dc:identifier": "doi:10.1016/j.apcata.2021.118404",
        "openaccessSponsorName": null
      },
      "objects": {
        "object": [
          {
            "@category": "standard",
            "@height": "558",
            "@width": "659",
            "@_fa": "true",
            "$": "https://api.elsevier.com/content/object/eid/1-s2.0-S0926860X2100418X-gr1.jpg?httpAccept=%2A%2F%2A",
            "@multimediatype": "JPEG image file",
            "@type": "IMAGE-DOWNSAMPLED",
            "@size": "216203",
            "@ref": "gr1",
            "@mimetype": "image/jpeg"
          },
          {
            "@category": "standard",
            "@height": "275",
            "@width": "659",
            "@_fa": "true",
            "$": "https://api.elsevier.com/content/object/eid/1-s2.0-S0926860X2100418X-gr2.jpg?httpAccept=%2A%2F%2A",
            "@multimediatype": "JPEG image file",
            "@type": "IMAGE-DOWNSAMPLED",
            "@size": "131668",
            "@ref": "gr2",
            "@mimetype": "image/jpeg"
          },
          {
            "@category": "standard",
            "@height": "200",
            "@width": "345",
            "@_fa": "true",
            "$": "https://api.elsevier.com/content/object/eid/1-s2.0-S0926860X2100418X-ga1.jpg?httpAccept=%2A%2F%2A",
            "@multimediatype": "JPEG image file",
            "@type": "IMAGE-DOWNSAMPLED",
            "@size": "114889",
            "@ref": "ga1",
            "@mimetype": "image/jpeg"
          },
          {
            "@category": "standard",
            "@height": "536",
            "@width": "659",
            "@_fa": "true",
            "$": "https://api.elsevier.com/content/object/eid/1-s2.0-S0926860X2100418X-gr5.jpg?httpAccept=%2A%2F%2A",
            "@multimediatype": "JPEG image file",
            "@type": "IMAGE-DOWNSAMPLED",
            "@size": "182645",
            "@ref": "gr5",
            "@mimetype": "image/jpeg"
          },
          {
            "@category": "standard",
            "@height": "283",
            "@width": "659",
            "@_fa": "true",
            "$": "https://api.elsevier.com/content/object/eid/1-s2.0-S0926860X2100418X-gr6.jpg?httpAccept=%2A%2F%2A",
            "@multimediatype": "JPEG image file",
            "@type": "IMAGE-DOWNSAMPLED",
            "@size": "131774",
            "@ref": "gr6",
            "@mimetype": "image/jpeg"
          },
          {
            "@category": "standard",
            "@height": "572",
            "@width": "659",
            "@_fa": "true",
            "$": "https://api.elsevier.com/content/object/eid/1-s2.0-S0926860X2100418X-gr3.jpg?httpAccept=%2A%2F%2A",
            "@multimediatype": "JPEG image file",
            "@type": "IMAGE-DOWNSAMPLED",
            "@size": "168879",
            "@ref": "gr3",
            "@mimetype": "image/jpeg"
          },
          {
            "@category": "standard",
            "@height": "260",
            "@width": "659",
            "@_fa": "true",
            "$": "https://api.elsevier.com/content/object/eid/1-s2.0-S0926860X2100418X-gr4.jpg?httpAccept=%2A%2F%2A",
            "@multimediatype": "JPEG image file",
            "@type": "IMAGE-DOWNSAMPLED",
            "@size": "74842",
            "@ref": "gr4",
            "@mimetype": "image/jpeg"
          },
          {
            "@category": "standard",
            "@height": "63",
            "@width": "376",
            "@_fa": "true",
            "$": "https://api.elsevier.com/content/object/eid/1-s2.0-S0926860X2100418X-fx1.jpg?httpAccept=%2A%2F%2A",
            "@multimediatype": "JPEG image file",
            "@type": "IMAGE-DOWNSAMPLED",
            "@size": "11110",
            "@ref": "fx1",
            "@mimetype": "image/jpeg"
          },
          {
            "@category": "standard",
            "@height": "322",
            "@width": "339",
            "@_fa": "true",
            "$": "https://api.elsevier.com/content/object/eid/1-s2.0-S0926860X2100418X-gr7.jpg?httpAccept=%2A%2F%2A",
            "@multimediatype": "JPEG image file",
            "@type": "IMAGE-DOWNSAMPLED",
            "@size": "125138",
            "@ref": "gr7",
            "@mimetype": "image/jpeg"
          },
          {
            "@category": "standard",
            "@height": "403",
            "@width": "565",
            "@_fa": "true",
            "$": "https://api.elsevier.com/content/object/eid/1-s2.0-S0926860X2100418X-gr8.jpg?httpAccept=%2A%2F%2A",
            "@multimediatype": "JPEG image file",
            "@type": "IMAGE-DOWNSAMPLED",
            "@size": "167941",
            "@ref": "gr8",
            "@mimetype": "image/jpeg"
          },
          {
            "@category": "thumbnail",
            "@height": "164",
            "@width": "194",
            "@_fa": "true",
            "$": "https://api.elsevier.com/content/object/eid/1-s2.0-S0926860X2100418X-gr1.sml?httpAccept=%2A%2F%2A",
            "@multimediatype": "GIF image file",
            "@type": "IMAGE-THUMBNAIL",
            "@size": "85790",
            "@ref": "gr1",
            "@mimetype": "image/gif"
          },
          {
            "@category": "thumbnail",
            "@height": "91",
            "@width": "219",
            "@_fa": "true",
            "$": "https://api.elsevier.com/content/object/eid/1-s2.0-S0926860X2100418X-gr2.sml?httpAccept=%2A%2F%2A",
            "@multimediatype": "GIF image file",
            "@type": "IMAGE-THUMBNAIL",
            "@size": "74436",
            "@ref": "gr2",
            "@mimetype": "image/gif"
          },
          {
            "@category": "thumbnail",
            "@height": "127",
            "@width": "219",
            "@_fa": "true",
            "$": "https://api.elsevier.com/content/object/eid/1-s2.0-S0926860X2100418X-ga1.sml?httpAccept=%2A%2F%2A",
            "@multimediatype": "GIF image file",
            "@type": "IMAGE-THUMBNAIL",
            "@size": "81772",
            "@ref": "ga1",
            "@mimetype": "image/gif"
          },
          {
            "@category": "thumbnail",
            "@height": "163",
            "@width": "201",
            "@_fa": "true",
            "$": "https://api.elsevier.com/content/object/eid/1-s2.0-S0926860X2100418X-gr5.sml?httpAccept=%2A%2F%2A",
            "@multimediatype": "GIF image file",
            "@type": "IMAGE-THUMBNAIL",
            "@size": "79760",
            "@ref": "gr5",
            "@mimetype": "image/gif"
          },
          {
            "@category": "thumbnail",
            "@height": "94",
            "@width": "219",
            "@_fa": "true",
            "$": "https://api.elsevier.com/content/object/eid/1-s2.0-S0926860X2100418X-gr6.sml?httpAccept=%2A%2F%2A",
            "@multimediatype": "GIF image file",
            "@type": "IMAGE-THUMBNAIL",
            "@size": "74985",
            "@ref": "gr6",
            "@mimetype": "image/gif"
          },
          {
            "@category": "thumbnail",
            "@height": "164",
            "@width": "189",
            "@_fa": "true",
            "$": "https://api.elsevier.com/content/object/eid/1-s2.0-S0926860X2100418X-gr3.sml?httpAccept=%2A%2F%2A",
            "@multimediatype": "GIF image file",
            "@type": "IMAGE-THUMBNAIL",
            "@size": "77811",
            "@ref": "gr3",
            "@mimetype": "image/gif"
          },
          {
            "@category": "thumbnail",
            "@height": "86",
            "@width": "219",
            "@_fa": "true",
            "$": "https://api.elsevier.com/content/object/eid/1-s2.0-S0926860X2100418X-gr4.sml?httpAccept=%2A%2F%2A",
            "@multimediatype": "GIF image file",
            "@type": "IMAGE-THUMBNAIL",
            "@size": "14003",
            "@ref": "gr4",
            "@mimetype": "image/gif"
          },
          {
            "@category": "thumbnail",
            "@height": "37",
            "@width": "219",
            "@_fa": "true",
            "$": "https://api.elsevier.com/content/object/eid/1-s2.0-S0926860X2100418X-fx1.sml?httpAccept=%2A%2F%2A",
            "@multimediatype": "GIF image file",
            "@type": "IMAGE-THUMBNAIL",
            "@size": "5683",
            "@ref": "fx1",
            "@mimetype": "image/gif"
          },
          {
            "@category": "thumbnail",
            "@height": "164",
            "@width": "173",
            "@_fa": "true",
            "$": "https://api.elsevier.com/content/object/eid/1-s2.0-S0926860X2100418X-gr7.sml?httpAccept=%2A%2F%2A",
            "@multimediatype": "GIF image file",
            "@type": "IMAGE-THUMBNAIL",
            "@size": "83139",
            "@ref": "gr7",
            "@mimetype": "image/gif"
          },
          {
            "@category": "thumbnail",
            "@height": "156",
            "@width": "219",
            "@_fa": "true",
            "$": "https://api.elsevier.com/content/object/eid/1-s2.0-S0926860X2100418X-gr8.sml?httpAccept=%2A%2F%2A",
            "@multimediatype": "GIF image file",
            "@type": "IMAGE-THUMBNAIL",
            "@size": "89564",
            "@ref": "gr8",
            "@mimetype": "image/gif"
          },
          {
            "@category": "high",
            "@height": "2469",
            "@width": "2917",
            "@_fa": "true",
            "$": "https://api.elsevier.com/content/object/eid/1-s2.0-S0926860X2100418X-gr1_lrg.jpg?httpAccept=%2A%2F%2A",
            "@multimediatype": "JPEG image file",
            "@type": "IMAGE-HIGH-RES",
            "@size": "1168486",
            "@ref": "gr1",
            "@mimetype": "image/jpeg"
          },
          {
            "@category": "high",
            "@height": "1218",
            "@width": "2917",
            "@_fa": "true",
            "$": "https://api.elsevier.com/content/object/eid/1-s2.0-S0926860X2100418X-gr2_lrg.jpg?httpAccept=%2A%2F%2A",
            "@multimediatype": "JPEG image file",
            "@type": "IMAGE-HIGH-RES",
            "@size": "426039",
            "@ref": "gr2",
            "@mimetype": "image/jpeg"
          },
          {
            "@category": "high",
            "@height": "886",
            "@width": "1527",
            "@_fa": "true",
            "$": "https://api.elsevier.com/content/object/eid/1-s2.0-S0926860X2100418X-ga1_lrg.jpg?httpAccept=%2A%2F%2A",
            "@multimediatype": "JPEG image file",
            "@type": "IMAGE-HIGH-RES",
            "@size": "383580",
            "@ref": "ga1",
            "@mimetype": "image/jpeg"
          },
          {
            "@category": "high",
            "@height": "2372",
            "@width": "2917",
            "@_fa": "true",
            "$": "https://api.elsevier.com/content/object/eid/1-s2.0-S0926860X2100418X-gr5_lrg.jpg?httpAccept=%2A%2F%2A",
            "@multimediatype": "JPEG image file",
            "@type": "IMAGE-HIGH-RES",
            "@size": "871833",
            "@ref": "gr5",
            "@mimetype": "image/jpeg"
          },
          {
            "@category": "high",
            "@height": "1252",
            "@width": "2917",
            "@_fa": "true",
            "$": "https://api.elsevier.com/content/object/eid/1-s2.0-S0926860X2100418X-gr6_lrg.jpg?httpAccept=%2A%2F%2A",
            "@multimediatype": "JPEG image file",
            "@type": "IMAGE-HIGH-RES",
            "@size": "492149",
            "@ref": "gr6",
            "@mimetype": "image/jpeg"
          },
          {
            "@category": "high",
            "@height": "2532",
            "@width": "2917",
            "@_fa": "true",
            "$": "https://api.elsevier.com/content/object/eid/1-s2.0-S0926860X2100418X-gr3_lrg.jpg?httpAccept=%2A%2F%2A",
            "@multimediatype": "JPEG image file",
            "@type": "IMAGE-HIGH-RES",
            "@size": "649695",
            "@ref": "gr3",
            "@mimetype": "image/jpeg"
          },
          {
            "@category": "high",
            "@height": "1150",
            "@width": "2917",
            "@_fa": "true",
            "$": "https://api.elsevier.com/content/object/eid/1-s2.0-S0926860X2100418X-gr4_lrg.jpg?httpAccept=%2A%2F%2A",
            "@multimediatype": "JPEG image file",
            "@type": "IMAGE-HIGH-RES",
            "@size": "623818",
            "@ref": "gr4",
            "@mimetype": "image/jpeg"
          },
          {
            "@category": "high",
            "@height": "278",
            "@width": "1667",
            "@_fa": "true",
            "$": "https://api.elsevier.com/content/object/eid/1-s2.0-S0926860X2100418X-fx1_lrg.jpg?httpAccept=%2A%2F%2A",
            "@multimediatype": "JPEG image file",
            "@type": "IMAGE-HIGH-RES",
            "@size": "40207",
            "@ref": "fx1",
            "@mimetype": "image/jpeg"
          },
          {
            "@category": "high",
            "@height": "1423",
            "@width": "1500",
            "@_fa": "true",
            "$": "https://api.elsevier.com/content/object/eid/1-s2.0-S0926860X2100418X-gr7_lrg.jpg?httpAccept=%2A%2F%2A",
            "@multimediatype": "JPEG image file",
            "@type": "IMAGE-HIGH-RES",
            "@size": "338182",
            "@ref": "gr7",
            "@mimetype": "image/jpeg"
          },
          {
            "@category": "high",
            "@height": "1785",
            "@width": "2500",
            "@_fa": "true",
            "$": "https://api.elsevier.com/content/object/eid/1-s2.0-S0926860X2100418X-gr8_lrg.jpg?httpAccept=%2A%2F%2A",
            "@multimediatype": "JPEG image file",
            "@type": "IMAGE-HIGH-RES",
            "@size": "680649",
            "@ref": "gr8",
            "@mimetype": "image/jpeg"
          },
          {
            "@category": "standard",
            "@_fa": "true",
            "$": "https://api.elsevier.com/content/object/eid/1-s2.0-S0926860X2100418X-mmc1.docx?httpAccept=%2A%2F%2A",
            "@multimediatype": "Microsoft Word file",
            "@type": "APPLICATION",
            "@size": "4137593",
            "@ref": "mmc1",
            "@mimetype": "application/word"
          },
          {
            "@category": "thumbnail",
            "@_fa": "true",
            "$": "https://api.elsevier.com/content/object/eid/1-s2.0-S0926860X2100418X-si0001.svg?httpAccept=%2A%2F%2A",
            "@multimediatype": "Scalable Vector Graphics file",
            "@type": "ALTIMG",
            "@size": "2390",
            "@ref": "si0001",
            "@mimetype": "image/svg+xml"
          },
          {
            "@category": "thumbnail",
            "@_fa": "true",
            "$": "https://api.elsevier.com/content/object/eid/1-s2.0-S0926860X2100418X-si0002.svg?httpAccept=%2A%2F%2A",
            "@multimediatype": "Scalable Vector Graphics file",
            "@type": "ALTIMG",
            "@size": "1426",
            "@ref": "si0002",
            "@mimetype": "image/svg+xml"
          },
          {
            "@category": "thumbnail",
            "@_fa": "true",
            "$": "https://api.elsevier.com/content/object/eid/1-s2.0-S0926860X2100418X-si0003.svg?httpAccept=%2A%2F%2A",
            "@multimediatype": "Scalable Vector Graphics file",
            "@type": "ALTIMG",
            "@size": "1491",
            "@ref": "si0003",
            "@mimetype": "image/svg+xml"
          },
          {
            "@category": "standard",
            "@_fa": "true",
            "$": "https://api.elsevier.com/content/object/eid/1-s2.0-S0926860X2100418X-am.pdf?httpAccept=%2A%2F%2A",
            "@multimediatype": "Acrobat PDF file",
            "@type": "AAM-PDF",
            "@size": "2520226",
            "@ref": "am",
            "@mimetype": "application/pdf"
          }
        ]
      },
      "link": {
        "@rel": "abstract",
        "@href": "https://api.elsevier.com/content/abstract/scopus_id/85119998366"
      }
    }
  }
}