{
  "metadata": {
    "title": "Effects of rare-earth (Nd, Er and Y) doping on catalytic performance of HZSM-5 zeolite catalysts for methyl mercaptan (CH<ce:inf loc=post>3</ce:inf>SH) decomposition",
    "authors": "; ; ",
    "journal": "Applied Catalysis A: General",
    "date": "2017-03-05",
    "doi": "10.1016/j.apcata.2017.01.011",
    "abstract": "",
    "uri": "https://api.elsevier.com/content/article/pii/S0926860X17300194",
    "pii": "S0926860X17300194"
  },
  "fulltext": {
    "full-text-retrieval-response": {
      "scopus-eid": "2-s2.0-85010190553",
      "originalText": "serial JL 271346 291210 291744 291809 31 Applied Catalysis A: General APPLIEDCATALYSISAGENERAL 2017-01-15 2017-01-15 2017-01-18 2017-01-18 2017-01-31T17:14:48 1-s2.0-S0926860X17300194 S0926-860X(17)30019-4 S0926860X17300194 10.1016/j.apcata.2017.01.011 S300 S300.1 FULL-TEXT 1-s2.0-S0926860X17X00021 2025-07-16T14:33:53.326206Z 0 0 20170305 2017 2017-01-15T15:29:14.874319Z absattachment articleinfo articletitlenorm authfirstinitialnorm authfirstsurnamenorm cid cids contenttype copyright crossmark dateloaded dateloadedtxt datesearch datesort dateupdated dco docsubtype doctype doi eid ewtransactionid hubeid indexeddate issn issnnorm itemstage itemtransactionid itemweight openaccess openarchive pg pgfirst pglast pii piinorm pubdatestart pubdatetxt pubyr sortorder srctitle srctitlenorm srctype ssids alllist content subj subheadings suppl tomb volfirst volissue volumelist webpdf webpdfpagecount yearnav figure table e-component body mmlmath acknowledge affil appendices articletitle auth authfirstini authfull authkeywords authlast grantnumber grantsponsor grantsponsorid highlightsabst primabst pubtype ref specialabst 0926-860X 0926860X true 533 533 C Volume 533 10 66 74 66 74 20170305 5 March 2017 2017-03-05 2017 article fla © 2017 Elsevier B.V. All rights reserved. EFFECTSRAREEARTHNDERYDOPINGCATALYTICPERFORMANCEHZSM5ZEOLITECATALYSTSFORMETHYLMERCAPTANCH3SHDECOMPOSITION HE D 1 Introduction 2 Experimental 2.1 Catalysts synthesis 2.2 Catalysts characterization 2.3 Catalytic tests 3 Results and discussion 3.1 Effect of rare-earth (Nd, Er and Y) modification 3.1.1 Characterization results of the synthesized catalysts 3.1.2 Catalytic activity of the catalysts 3.2 Effect of neodymium (Nd) content 3.2.1 Characterization results of the catalysts 3.2.2 Catalytic activity and stability of the catalysts 3.3 Possible reaction mechanism for the conversion of CH3SH over HZSM-5 based catalysts 3.4 Regeneration of spent catalysts 3.5 Catalytic performance comparison of Nd/HZSM-5 with other reported catalysts 4 Conclusion Acknowledgement Appendix A Supplementary data References ABDELOUAHABREDDAM 2015 87 94 Z KIM 2005 311 315 D SON 2015 217 223 Y ZHAO 2015 856 861 S BROWN 1959 73 78 M SUN 2015 80 89 J RYZHIKOV 2011 218 224 A KOIVIKKO 2011 72 78 N LAOSIRIPOJANA 2011 267 275 N HE 2016 311 318 D HE 2016 161 169 D HE 2017 559 565 D HUGUET 2013 344 348 E HULEA 2014 547 553 V CAMMARANO 2014 128 133 C CAMPBELL 1996 338 349 S YANG 2013 203 210 P ZHANG 2009 355 361 L BI 2011 68 76 J ANGELESCU 2004 647 651 E THE 2015 196 204 L WANG 2015 34 37 Y SUN 2012 18 21 L LEE 2013 189 195 J ZHAO 2007 29 37 G LI 2015 32 38 J YARIPOUR 2015 41 53 F OUYANG 2009 64 74 J JIANG 2008 176 182 G KIMPTON 2002 89 98 J GENG 2008 16344 16350 F JIANG 2007 300 303 Q BOTAS 2012 59 70 J LANG 2015 9924 9934 L GUISNET 2009 69 83 M HE 2016 959 967 D HEX2017X66 HEX2017X66X74 HEX2017X66XD HEX2017X66X74XD 2019-01-18T00:00:00.000Z http://creativecommons.org/licenses/by-nc-nd/4.0/ © 2017 Elsevier B.V. All rights reserved. item S0926-860X(17)30019-4 S0926860X17300194 1-s2.0-S0926860X17300194 10.1016/j.apcata.2017.01.011 271346 2024-01-01T12:31:47.592716Z 2017-03-05 1-s2.0-S0926860X17300194-main.pdf https://s3-eu-west-1.amazonaws.com/prod-ucs-content-store-eu-west/content/pii:S0926860X17300194/MAIN/application/pdf/fe47e1cc09d62a4df995a587fd656a11/main.pdf https://s3.amazonaws.com/prod-ucs-content-store-us-east/content/pii:S0926860X17300194/MAIN/application/pdf/fe47e1cc09d62a4df995a587fd656a11/main.pdf main.pdf pdf true 2219266 MAIN 9 1-s2.0-S0926860X17300194-main_1.png https://s3-eu-west-1.amazonaws.com/prod-ucs-content-store-eu-west/content/pii:S0926860X17300194/PREVIEW/image/png/00a9399493a00258b0b07fb95bcb4030/main_1.png https://s3.amazonaws.com/prod-ucs-content-store-us-east/content/pii:S0926860X17300194/PREVIEW/image/png/00a9399493a00258b0b07fb95bcb4030/main_1.png main_1.png png 54995 849 656 IMAGE-WEB-PDF 1 1-s2.0-S0926860X17300194-fx1.sml https://s3-eu-west-1.amazonaws.com/prod-ucs-content-store-eu-west/content/pii:S0926860X17300194/fx1/THUMBNAIL/image/gif/33bdc4c0a43dd4d00655b967afb66c9f/fx1.sml https://s3.amazonaws.com/prod-ucs-content-store-us-east/content/pii:S0926860X17300194/fx1/THUMBNAIL/image/gif/33bdc4c0a43dd4d00655b967afb66c9f/fx1.sml fx1 true fx1.sml sml 5858 88 219 IMAGE-THUMBNAIL 1-s2.0-S0926860X17300194-gr1.sml https://s3-eu-west-1.amazonaws.com/prod-ucs-content-store-eu-west/content/pii:S0926860X17300194/gr1/THUMBNAIL/image/gif/4a3be2f7ae3224e35b5f1d3a73241cbe/gr1.sml https://s3.amazonaws.com/prod-ucs-content-store-us-east/content/pii:S0926860X17300194/gr1/THUMBNAIL/image/gif/4a3be2f7ae3224e35b5f1d3a73241cbe/gr1.sml gr1 gr1.sml sml 6014 164 151 IMAGE-THUMBNAIL 1-s2.0-S0926860X17300194-gr10.sml https://s3-eu-west-1.amazonaws.com/prod-ucs-content-store-eu-west/content/pii:S0926860X17300194/gr10/THUMBNAIL/image/gif/a5254646912a7938a88677243362f61a/gr10.sml https://s3.amazonaws.com/prod-ucs-content-store-us-east/content/pii:S0926860X17300194/gr10/THUMBNAIL/image/gif/a5254646912a7938a88677243362f61a/gr10.sml gr10 gr10.sml sml 7074 164 155 IMAGE-THUMBNAIL 1-s2.0-S0926860X17300194-gr11.sml https://s3-eu-west-1.amazonaws.com/prod-ucs-content-store-eu-west/content/pii:S0926860X17300194/gr11/THUMBNAIL/image/gif/298a0ef309ca2a6eacb023e28fe277e5/gr11.sml https://s3.amazonaws.com/prod-ucs-content-store-us-east/content/pii:S0926860X17300194/gr11/THUMBNAIL/image/gif/298a0ef309ca2a6eacb023e28fe277e5/gr11.sml gr11 gr11.sml sml 6149 164 154 IMAGE-THUMBNAIL 1-s2.0-S0926860X17300194-gr12.sml https://s3-eu-west-1.amazonaws.com/prod-ucs-content-store-eu-west/content/pii:S0926860X17300194/gr12/THUMBNAIL/image/gif/78516e6b389e2741efecc5a3729d0230/gr12.sml https://s3.amazonaws.com/prod-ucs-content-store-us-east/content/pii:S0926860X17300194/gr12/THUMBNAIL/image/gif/78516e6b389e2741efecc5a3729d0230/gr12.sml gr12 gr12.sml sml 4907 164 163 IMAGE-THUMBNAIL 1-s2.0-S0926860X17300194-gr2.sml https://s3-eu-west-1.amazonaws.com/prod-ucs-content-store-eu-west/content/pii:S0926860X17300194/gr2/THUMBNAIL/image/gif/68b908ec548d0bd7949ffdbee497399f/gr2.sml https://s3.amazonaws.com/prod-ucs-content-store-us-east/content/pii:S0926860X17300194/gr2/THUMBNAIL/image/gif/68b908ec548d0bd7949ffdbee497399f/gr2.sml gr2 gr2.sml sml 5963 163 154 IMAGE-THUMBNAIL 1-s2.0-S0926860X17300194-gr3.sml https://s3-eu-west-1.amazonaws.com/prod-ucs-content-store-eu-west/content/pii:S0926860X17300194/gr3/THUMBNAIL/image/gif/b40c3961eb4f759eb01091f474488684/gr3.sml https://s3.amazonaws.com/prod-ucs-content-store-us-east/content/pii:S0926860X17300194/gr3/THUMBNAIL/image/gif/b40c3961eb4f759eb01091f474488684/gr3.sml gr3 gr3.sml sml 5234 164 151 IMAGE-THUMBNAIL 1-s2.0-S0926860X17300194-gr4.sml https://s3-eu-west-1.amazonaws.com/prod-ucs-content-store-eu-west/content/pii:S0926860X17300194/gr4/THUMBNAIL/image/gif/8628a211e0ac55b89c3aaac4b72918b4/gr4.sml https://s3.amazonaws.com/prod-ucs-content-store-us-east/content/pii:S0926860X17300194/gr4/THUMBNAIL/image/gif/8628a211e0ac55b89c3aaac4b72918b4/gr4.sml gr4 gr4.sml sml 7055 164 162 IMAGE-THUMBNAIL 1-s2.0-S0926860X17300194-gr5.sml https://s3-eu-west-1.amazonaws.com/prod-ucs-content-store-eu-west/content/pii:S0926860X17300194/gr5/THUMBNAIL/image/gif/5ce4a0ed811f724808422675a5a61367/gr5.sml https://s3.amazonaws.com/prod-ucs-content-store-us-east/content/pii:S0926860X17300194/gr5/THUMBNAIL/image/gif/5ce4a0ed811f724808422675a5a61367/gr5.sml gr5 gr5.sml sml 6728 164 152 IMAGE-THUMBNAIL 1-s2.0-S0926860X17300194-gr6.sml https://s3-eu-west-1.amazonaws.com/prod-ucs-content-store-eu-west/content/pii:S0926860X17300194/gr6/THUMBNAIL/image/gif/323ad106cdec5f0462a0e977fe3d7352/gr6.sml https://s3.amazonaws.com/prod-ucs-content-store-us-east/content/pii:S0926860X17300194/gr6/THUMBNAIL/image/gif/323ad106cdec5f0462a0e977fe3d7352/gr6.sml gr6 gr6.sml sml 6463 164 155 IMAGE-THUMBNAIL 1-s2.0-S0926860X17300194-gr7.sml https://s3-eu-west-1.amazonaws.com/prod-ucs-content-store-eu-west/content/pii:S0926860X17300194/gr7/THUMBNAIL/image/gif/4fc3720ca8799e8a8cb8674380a47598/gr7.sml https://s3.amazonaws.com/prod-ucs-content-store-us-east/content/pii:S0926860X17300194/gr7/THUMBNAIL/image/gif/4fc3720ca8799e8a8cb8674380a47598/gr7.sml gr7 gr7.sml sml 6024 164 150 IMAGE-THUMBNAIL 1-s2.0-S0926860X17300194-gr8.sml https://s3-eu-west-1.amazonaws.com/prod-ucs-content-store-eu-west/content/pii:S0926860X17300194/gr8/THUMBNAIL/image/gif/8d784a28f5cf3f3e3899cfbfcbea59cc/gr8.sml https://s3.amazonaws.com/prod-ucs-content-store-us-east/content/pii:S0926860X17300194/gr8/THUMBNAIL/image/gif/8d784a28f5cf3f3e3899cfbfcbea59cc/gr8.sml gr8 gr8.sml sml 8029 164 164 IMAGE-THUMBNAIL 1-s2.0-S0926860X17300194-gr9.sml https://s3-eu-west-1.amazonaws.com/prod-ucs-content-store-eu-west/content/pii:S0926860X17300194/gr9/THUMBNAIL/image/gif/6491e9219dbe943742f8f0b7d6b3fb3a/gr9.sml https://s3.amazonaws.com/prod-ucs-content-store-us-east/content/pii:S0926860X17300194/gr9/THUMBNAIL/image/gif/6491e9219dbe943742f8f0b7d6b3fb3a/gr9.sml gr9 gr9.sml sml 5861 164 161 IMAGE-THUMBNAIL 1-s2.0-S0926860X17300194-sc1.sml https://s3-eu-west-1.amazonaws.com/prod-ucs-content-store-eu-west/content/pii:S0926860X17300194/sc1/THUMBNAIL/image/gif/8996b60fd2c8e6b6b9c77befeae46a03/sc1.sml https://s3.amazonaws.com/prod-ucs-content-store-us-east/content/pii:S0926860X17300194/sc1/THUMBNAIL/image/gif/8996b60fd2c8e6b6b9c77befeae46a03/sc1.sml sc1 sc1.sml sml 5705 163 130 IMAGE-THUMBNAIL 1-s2.0-S0926860X17300194-fx1.jpg https://s3-eu-west-1.amazonaws.com/prod-ucs-content-store-eu-west/content/pii:S0926860X17300194/fx1/DOWNSAMPLED/image/jpeg/97530fe41c7dbbd9dedc07f39f482d99/fx1.jpg https://s3.amazonaws.com/prod-ucs-content-store-us-east/content/pii:S0926860X17300194/fx1/DOWNSAMPLED/image/jpeg/97530fe41c7dbbd9dedc07f39f482d99/fx1.jpg fx1 true fx1.jpg jpg 23221 200 500 IMAGE-DOWNSAMPLED 1-s2.0-S0926860X17300194-gr1.jpg https://s3-eu-west-1.amazonaws.com/prod-ucs-content-store-eu-west/content/pii:S0926860X17300194/gr1/DOWNSAMPLED/image/jpeg/6c9640a9e9298318f9817c8ff41f6f8f/gr1.jpg https://s3.amazonaws.com/prod-ucs-content-store-us-east/content/pii:S0926860X17300194/gr1/DOWNSAMPLED/image/jpeg/6c9640a9e9298318f9817c8ff41f6f8f/gr1.jpg gr1 gr1.jpg jpg 19782 305 282 IMAGE-DOWNSAMPLED 1-s2.0-S0926860X17300194-gr10.jpg https://s3-eu-west-1.amazonaws.com/prod-ucs-content-store-eu-west/content/pii:S0926860X17300194/gr10/DOWNSAMPLED/image/jpeg/a5042ae42c2a38f73acfce2a2a5d4368/gr10.jpg https://s3.amazonaws.com/prod-ucs-content-store-us-east/content/pii:S0926860X17300194/gr10/DOWNSAMPLED/image/jpeg/a5042ae42c2a38f73acfce2a2a5d4368/gr10.jpg gr10 gr10.jpg jpg 25551 298 282 IMAGE-DOWNSAMPLED 1-s2.0-S0926860X17300194-gr11.jpg https://s3-eu-west-1.amazonaws.com/prod-ucs-content-store-eu-west/content/pii:S0926860X17300194/gr11/DOWNSAMPLED/image/jpeg/c1a6e2f48beb8b1b3f8a73538051e8a7/gr11.jpg https://s3.amazonaws.com/prod-ucs-content-store-us-east/content/pii:S0926860X17300194/gr11/DOWNSAMPLED/image/jpeg/c1a6e2f48beb8b1b3f8a73538051e8a7/gr11.jpg gr11 gr11.jpg jpg 21413 301 282 IMAGE-DOWNSAMPLED 1-s2.0-S0926860X17300194-gr12.jpg https://s3-eu-west-1.amazonaws.com/prod-ucs-content-store-eu-west/content/pii:S0926860X17300194/gr12/DOWNSAMPLED/image/jpeg/11e0c0fda39b99c47b579f2585278a8d/gr12.jpg https://s3.amazonaws.com/prod-ucs-content-store-us-east/content/pii:S0926860X17300194/gr12/DOWNSAMPLED/image/jpeg/11e0c0fda39b99c47b579f2585278a8d/gr12.jpg gr12 gr12.jpg jpg 13618 284 282 IMAGE-DOWNSAMPLED 1-s2.0-S0926860X17300194-gr2.jpg https://s3-eu-west-1.amazonaws.com/prod-ucs-content-store-eu-west/content/pii:S0926860X17300194/gr2/DOWNSAMPLED/image/jpeg/7deee865edd406f52e85aaec9773e946/gr2.jpg https://s3.amazonaws.com/prod-ucs-content-store-us-east/content/pii:S0926860X17300194/gr2/DOWNSAMPLED/image/jpeg/7deee865edd406f52e85aaec9773e946/gr2.jpg gr2 gr2.jpg jpg 21606 299 282 IMAGE-DOWNSAMPLED 1-s2.0-S0926860X17300194-gr3.jpg https://s3-eu-west-1.amazonaws.com/prod-ucs-content-store-eu-west/content/pii:S0926860X17300194/gr3/DOWNSAMPLED/image/jpeg/004445a4fcb9f40fa6900789ab41c3d1/gr3.jpg https://s3.amazonaws.com/prod-ucs-content-store-us-east/content/pii:S0926860X17300194/gr3/DOWNSAMPLED/image/jpeg/004445a4fcb9f40fa6900789ab41c3d1/gr3.jpg gr3 gr3.jpg jpg 17537 305 282 IMAGE-DOWNSAMPLED 1-s2.0-S0926860X17300194-gr4.jpg https://s3-eu-west-1.amazonaws.com/prod-ucs-content-store-eu-west/content/pii:S0926860X17300194/gr4/DOWNSAMPLED/image/jpeg/6478acd5db59922ee0c0ce1420412fc6/gr4.jpg https://s3.amazonaws.com/prod-ucs-content-store-us-east/content/pii:S0926860X17300194/gr4/DOWNSAMPLED/image/jpeg/6478acd5db59922ee0c0ce1420412fc6/gr4.jpg gr4 gr4.jpg jpg 23083 285 282 IMAGE-DOWNSAMPLED 1-s2.0-S0926860X17300194-gr5.jpg https://s3-eu-west-1.amazonaws.com/prod-ucs-content-store-eu-west/content/pii:S0926860X17300194/gr5/DOWNSAMPLED/image/jpeg/ecdd23a01d6f512c6307da53a6f72432/gr5.jpg https://s3.amazonaws.com/prod-ucs-content-store-us-east/content/pii:S0926860X17300194/gr5/DOWNSAMPLED/image/jpeg/ecdd23a01d6f512c6307da53a6f72432/gr5.jpg gr5 gr5.jpg jpg 24846 304 282 IMAGE-DOWNSAMPLED 1-s2.0-S0926860X17300194-gr6.jpg https://s3-eu-west-1.amazonaws.com/prod-ucs-content-store-eu-west/content/pii:S0926860X17300194/gr6/DOWNSAMPLED/image/jpeg/27bcfa4e0ff574c5bb2001758957a44f/gr6.jpg https://s3.amazonaws.com/prod-ucs-content-store-us-east/content/pii:S0926860X17300194/gr6/DOWNSAMPLED/image/jpeg/27bcfa4e0ff574c5bb2001758957a44f/gr6.jpg gr6 gr6.jpg jpg 22941 298 282 IMAGE-DOWNSAMPLED 1-s2.0-S0926860X17300194-gr7.jpg https://s3-eu-west-1.amazonaws.com/prod-ucs-content-store-eu-west/content/pii:S0926860X17300194/gr7/DOWNSAMPLED/image/jpeg/fc0a70ba1faa3bc405085b19f3b8917f/gr7.jpg https://s3.amazonaws.com/prod-ucs-content-store-us-east/content/pii:S0926860X17300194/gr7/DOWNSAMPLED/image/jpeg/fc0a70ba1faa3bc405085b19f3b8917f/gr7.jpg gr7 gr7.jpg jpg 22455 309 282 IMAGE-DOWNSAMPLED 1-s2.0-S0926860X17300194-gr8.jpg https://s3-eu-west-1.amazonaws.com/prod-ucs-content-store-eu-west/content/pii:S0926860X17300194/gr8/DOWNSAMPLED/image/jpeg/4eff9d5fb960e9273d83862f9eebe488/gr8.jpg https://s3.amazonaws.com/prod-ucs-content-store-us-east/content/pii:S0926860X17300194/gr8/DOWNSAMPLED/image/jpeg/4eff9d5fb960e9273d83862f9eebe488/gr8.jpg gr8 gr8.jpg jpg 25078 282 282 IMAGE-DOWNSAMPLED 1-s2.0-S0926860X17300194-gr9.jpg https://s3-eu-west-1.amazonaws.com/prod-ucs-content-store-eu-west/content/pii:S0926860X17300194/gr9/DOWNSAMPLED/image/jpeg/add072895a4089a44867001c8c3708e1/gr9.jpg https://s3.amazonaws.com/prod-ucs-content-store-us-east/content/pii:S0926860X17300194/gr9/DOWNSAMPLED/image/jpeg/add072895a4089a44867001c8c3708e1/gr9.jpg gr9 gr9.jpg jpg 17288 287 282 IMAGE-DOWNSAMPLED 1-s2.0-S0926860X17300194-sc1.jpg https://s3-eu-west-1.amazonaws.com/prod-ucs-content-store-eu-west/content/pii:S0926860X17300194/sc1/DOWNSAMPLED/image/jpeg/1b678d3cfc030f972c06145f8a83f6df/sc1.jpg https://s3.amazonaws.com/prod-ucs-content-store-us-east/content/pii:S0926860X17300194/sc1/DOWNSAMPLED/image/jpeg/1b678d3cfc030f972c06145f8a83f6df/sc1.jpg sc1 sc1.jpg jpg 63607 709 565 IMAGE-DOWNSAMPLED 1-s2.0-S0926860X17300194-fx1_lrg.jpg https://s3-eu-west-1.amazonaws.com/prod-ucs-content-store-eu-west/content/pii:S0926860X17300194/fx1/HIGHRES/image/jpeg/79f0fdfcf7f668c500a494c6919a88e7/fx1_lrg.jpg https://s3.amazonaws.com/prod-ucs-content-store-us-east/content/pii:S0926860X17300194/fx1/HIGHRES/image/jpeg/79f0fdfcf7f668c500a494c6919a88e7/fx1_lrg.jpg fx1 true fx1_lrg.jpg jpg 165761 886 2213 IMAGE-HIGH-RES 1-s2.0-S0926860X17300194-gr1_lrg.jpg https://s3-eu-west-1.amazonaws.com/prod-ucs-content-store-eu-west/content/pii:S0926860X17300194/gr1/HIGHRES/image/jpeg/9aef384765ad7388abd81e0ded302113/gr1_lrg.jpg https://s3.amazonaws.com/prod-ucs-content-store-us-east/content/pii:S0926860X17300194/gr1/HIGHRES/image/jpeg/9aef384765ad7388abd81e0ded302113/gr1_lrg.jpg gr1 gr1_lrg.jpg jpg 160181 1354 1250 IMAGE-HIGH-RES 1-s2.0-S0926860X17300194-gr10_lrg.jpg https://s3-eu-west-1.amazonaws.com/prod-ucs-content-store-eu-west/content/pii:S0926860X17300194/gr10/HIGHRES/image/jpeg/28129532c48e8f3b1e306a6ba60029f3/gr10_lrg.jpg https://s3.amazonaws.com/prod-ucs-content-store-us-east/content/pii:S0926860X17300194/gr10/HIGHRES/image/jpeg/28129532c48e8f3b1e306a6ba60029f3/gr10_lrg.jpg gr10 gr10_lrg.jpg jpg 209542 1319 1250 IMAGE-HIGH-RES 1-s2.0-S0926860X17300194-gr11_lrg.jpg https://s3-eu-west-1.amazonaws.com/prod-ucs-content-store-eu-west/content/pii:S0926860X17300194/gr11/HIGHRES/image/jpeg/10d23c4b0d5ac02391175d4a2f8bc36c/gr11_lrg.jpg https://s3.amazonaws.com/prod-ucs-content-store-us-east/content/pii:S0926860X17300194/gr11/HIGHRES/image/jpeg/10d23c4b0d5ac02391175d4a2f8bc36c/gr11_lrg.jpg gr11 gr11_lrg.jpg jpg 172348 1333 1250 IMAGE-HIGH-RES 1-s2.0-S0926860X17300194-gr12_lrg.jpg https://s3-eu-west-1.amazonaws.com/prod-ucs-content-store-eu-west/content/pii:S0926860X17300194/gr12/HIGHRES/image/jpeg/f489c14dfa86560a8c166fe063cd90a4/gr12_lrg.jpg https://s3.amazonaws.com/prod-ucs-content-store-us-east/content/pii:S0926860X17300194/gr12/HIGHRES/image/jpeg/f489c14dfa86560a8c166fe063cd90a4/gr12_lrg.jpg gr12 gr12_lrg.jpg jpg 107096 1257 1250 IMAGE-HIGH-RES 1-s2.0-S0926860X17300194-gr2_lrg.jpg https://s3-eu-west-1.amazonaws.com/prod-ucs-content-store-eu-west/content/pii:S0926860X17300194/gr2/HIGHRES/image/jpeg/14151f43d5d8cfdda51e04adabbf073f/gr2_lrg.jpg https://s3.amazonaws.com/prod-ucs-content-store-us-east/content/pii:S0926860X17300194/gr2/HIGHRES/image/jpeg/14151f43d5d8cfdda51e04adabbf073f/gr2_lrg.jpg gr2 gr2_lrg.jpg jpg 162857 1326 1250 IMAGE-HIGH-RES 1-s2.0-S0926860X17300194-gr3_lrg.jpg https://s3-eu-west-1.amazonaws.com/prod-ucs-content-store-eu-west/content/pii:S0926860X17300194/gr3/HIGHRES/image/jpeg/831e44690896f7f7944954be08c6012d/gr3_lrg.jpg https://s3.amazonaws.com/prod-ucs-content-store-us-east/content/pii:S0926860X17300194/gr3/HIGHRES/image/jpeg/831e44690896f7f7944954be08c6012d/gr3_lrg.jpg gr3 gr3_lrg.jpg jpg 133137 1354 1250 IMAGE-HIGH-RES 1-s2.0-S0926860X17300194-gr4_lrg.jpg https://s3-eu-west-1.amazonaws.com/prod-ucs-content-store-eu-west/content/pii:S0926860X17300194/gr4/HIGHRES/image/jpeg/cb5729cf384156ada91a3b4d70542e61/gr4_lrg.jpg https://s3.amazonaws.com/prod-ucs-content-store-us-east/content/pii:S0926860X17300194/gr4/HIGHRES/image/jpeg/cb5729cf384156ada91a3b4d70542e61/gr4_lrg.jpg gr4 gr4_lrg.jpg jpg 172143 1264 1250 IMAGE-HIGH-RES 1-s2.0-S0926860X17300194-gr5_lrg.jpg https://s3-eu-west-1.amazonaws.com/prod-ucs-content-store-eu-west/content/pii:S0926860X17300194/gr5/HIGHRES/image/jpeg/30b8e1dfea19abc98bd21a0a682069a7/gr5_lrg.jpg https://s3.amazonaws.com/prod-ucs-content-store-us-east/content/pii:S0926860X17300194/gr5/HIGHRES/image/jpeg/30b8e1dfea19abc98bd21a0a682069a7/gr5_lrg.jpg gr5 gr5_lrg.jpg jpg 189294 1347 1250 IMAGE-HIGH-RES 1-s2.0-S0926860X17300194-gr6_lrg.jpg https://s3-eu-west-1.amazonaws.com/prod-ucs-content-store-eu-west/content/pii:S0926860X17300194/gr6/HIGHRES/image/jpeg/021bbd82b688054b5b6e5294da452f7a/gr6_lrg.jpg https://s3.amazonaws.com/prod-ucs-content-store-us-east/content/pii:S0926860X17300194/gr6/HIGHRES/image/jpeg/021bbd82b688054b5b6e5294da452f7a/gr6_lrg.jpg gr6 gr6_lrg.jpg jpg 172092 1319 1250 IMAGE-HIGH-RES 1-s2.0-S0926860X17300194-gr7_lrg.jpg https://s3-eu-west-1.amazonaws.com/prod-ucs-content-store-eu-west/content/pii:S0926860X17300194/gr7/HIGHRES/image/jpeg/eeac6a27cdff3f7e8c23e8c36a19100c/gr7_lrg.jpg https://s3.amazonaws.com/prod-ucs-content-store-us-east/content/pii:S0926860X17300194/gr7/HIGHRES/image/jpeg/eeac6a27cdff3f7e8c23e8c36a19100c/gr7_lrg.jpg gr7 gr7_lrg.jpg jpg 167115 1368 1250 IMAGE-HIGH-RES 1-s2.0-S0926860X17300194-gr8_lrg.jpg https://s3-eu-west-1.amazonaws.com/prod-ucs-content-store-eu-west/content/pii:S0926860X17300194/gr8/HIGHRES/image/jpeg/b8ce4c2cdef8eff62712b07d04b1ef40/gr8_lrg.jpg https://s3.amazonaws.com/prod-ucs-content-store-us-east/content/pii:S0926860X17300194/gr8/HIGHRES/image/jpeg/b8ce4c2cdef8eff62712b07d04b1ef40/gr8_lrg.jpg gr8 gr8_lrg.jpg jpg 196786 1250 1250 IMAGE-HIGH-RES 1-s2.0-S0926860X17300194-gr9_lrg.jpg https://s3-eu-west-1.amazonaws.com/prod-ucs-content-store-eu-west/content/pii:S0926860X17300194/gr9/HIGHRES/image/jpeg/4edd9119c3016a0a875038d5f068e337/gr9_lrg.jpg https://s3.amazonaws.com/prod-ucs-content-store-us-east/content/pii:S0926860X17300194/gr9/HIGHRES/image/jpeg/4edd9119c3016a0a875038d5f068e337/gr9_lrg.jpg gr9 gr9_lrg.jpg jpg 122934 1271 1250 IMAGE-HIGH-RES 1-s2.0-S0926860X17300194-sc1_lrg.jpg https://s3-eu-west-1.amazonaws.com/prod-ucs-content-store-eu-west/content/pii:S0926860X17300194/sc1/HIGHRES/image/jpeg/8598f39087ed713f5382030d4fb83af0/sc1_lrg.jpg https://s3.amazonaws.com/prod-ucs-content-store-us-east/content/pii:S0926860X17300194/sc1/HIGHRES/image/jpeg/8598f39087ed713f5382030d4fb83af0/sc1_lrg.jpg sc1 sc1_lrg.jpg jpg 489596 3139 2500 IMAGE-HIGH-RES 1-s2.0-S0926860X17300194-mmc1.doc https://s3-eu-west-1.amazonaws.com/prod-ucs-content-store-eu-west/content/pii:S0926860X17300194/mmc1/MAIN/application/msword/718f59ceea78f29c8fd5198b69e462e3/mmc1.doc https://s3.amazonaws.com/prod-ucs-content-store-us-east/content/pii:S0926860X17300194/mmc1/MAIN/application/msword/718f59ceea78f29c8fd5198b69e462e3/mmc1.doc mmc1 mmc1.doc doc 3299840 APPLICATION 1-s2.0-S0926860X17300194-si1.gif https://s3-eu-west-1.amazonaws.com/prod-ucs-content-store-eu-west/content/pii:S0926860X17300194/STRIPIN/image/gif/d2d791807a20712565908c65887d97a5/si1.gif https://s3.amazonaws.com/prod-ucs-content-store-us-east/content/pii:S0926860X17300194/STRIPIN/image/gif/d2d791807a20712565908c65887d97a5/si1.gif si1 si1.gif gif 1770 35 435 ALTIMG APCATA 16122 S0926-860X(17)30019-4 10.1016/j.apcata.2017.01.011 Elsevier B.V. Scheme 1 Possible reaction mechanism for the conversion of CH3SH over the pure and modified HZSM-5 catalysts. Scheme 1 Fig. 1 XRD patterns of HZSM-5 and RE modified HZSM-5 catalysts: (a) parent HZSM-5, (b) 5wt%Nd/HZSM-5, (c) 5wt%Er/HZSM-5, (d) 5wt%Y/HZSM-5. Fig. 1 Fig. 2 NH3-TPD profiles of HZSM-5 and RE modified HZSM-5 catalysts: (a) parent HZSM-5, (b) 5wt%Nd/HZSM-5, (c) 5wt%Er/HZSM-5, (d) 5wt%Y/HZSM-5. Fig. 2 Fig. 3 CO2-TPD profiles of HZSM-5 and RE modified HZSM-5 catalysts: (a) parent HZSM-5, (b) 5wt%Nd/HZSM-5, (c) 5wt%Er/HZSM-5, (d) 5wt% Y/HZSM-5. Fig. 3 Fig. 4 Conversion of methyl mercaptan as a function of temperature over parent HZSM-5 and RE modified HZSM-5 catalysts. Fig. 4 Fig. 5 XRD patterns of the catalysts: (a) parent HZSM-5, (b) 1wt%Nd/HZSM-5, (c) 5wt%Nd/HZSM-5, (d) 9wt%Nd/HZSM-5, (e) 13wt%Nd/HZSM-5, (f) 17wt%Nd/HZSM-5. Fig. 5 Fig. 6 NH3-TPD profiles of the catalysts: (a) parent HZSM-5, (b) 1wt%Nd/HZSM-5, (c) 5wt%Nd/HZSM-5, (d) 9wt%Nd/HZSM-5, (e) 13wt%Nd/HZSM-5, (f) 17wt%Nd/HZSM-5. Fig. 6 Fig. 7 CO2-TPD profiles of the catalysts: (a) parent HZSM-5, (b) 1wt%Nd/HZSM-5, (c) 5wt%Nd/HZSM-5, (d) 9wt%Nd/HZSM-5, (e) 13wt%Nd/HZSM-5, (f) 17wt%Nd/HZSM-5. Fig. 7 Fig. 8 Conversion of methyl mercaptan as a function of temperature over parent HZSM-5 and Nd modified HZSM-5 catalysts. Fig. 8 Fig. 9 Conversion of methyl mercaptan as a function of time at 550°C over parent HZSM-5 and 13wt%Nd/HZSM-5 catalysts. Fig. 9 Fig. 10 Raman spectra of the fresh and spent (after reaction) catalysts: (a) fresh parent HZSM-5, (b) spent parent HZSM-5 (40h), (c) fresh 13wt%Nd/HZSM-5, (d) spent 13wt%Nd/HZSM-5 (40h), (e) spent 13wt%Nd/HZSM-5 (60h), (f) spent 13wt%Nd/HZSM-5 (80h). Fig. 10 Fig. 11 NH3-TPD profiles of the fresh and spent (after reaction) catalysts: (a) fresh parent HZSM-5, (b) spent parent HZSM-5 (40h), (c) fresh 13wt%Nd/HZSM-5, (d) spent 13wt%Nd/HZSM-5 (40h), (e) spent 13wt%Nd/HZSM-5 (60h), (f) spent 13wt%Nd/HZSM-5 (80h). Fig. 11 Fig. 12 Conversion of methyl mercaptan as a function of time at 550°C over fresh and regenerated 13wt%Nd/HZSM-5 catalysts. Fig. 12 Table 1 Textural properties of parent and rare earth modified HZSM-5 catalysts. Table 1 Catalyst S BET (m2/g) S micro (m2/g) V micro (cm3/g) RE content (wt%) Si/Al Pure HZSM-5 402.6 379.4 0.160 – 17.78 5wt%Nd/HZSM-5 368.2 334.3 0.141 6.45 15.60 5wt%Er/HZSM-5 297.8 276.7 0.115 7.19 15.15 5wt%Y/HZSM-5 339.8 314.5 0.134 8.16 15.27 1wt%Nd/HZSM-5 381.2 349.9 0.148 1.83 17.58 9wt%Nd/HZSM-5 335.7 300.7 0.127 11.01 15.16 13wt%Nd/HZSM-5 324.7 292.9 0.123 15.10 14.75 17wt%Nd/HZSM-5 291.4 268.5 0.112 17.06 14.43 S BET: BET surface area was calculated by using Brumauer-Emmett-Teller (BET) mode. S micro: micropore area was determined from t-Plot micropore area. V micro: micropore volume was calculated from t-Plot micropore volume. RE, Si and Al mass% were determined from XRF. Table 2 Catalytic performance comparison of Nd/HZSM-5 with other reported catalysts. Table 2 Catalyst Temperature (°C) a Time (h) b Refs. Pure HZSM-5 550 12–14 [13,14] H-Y – 4–6 [13,14] H-ferrierite – 4–6 [13,14] CeO2 450–500 10–12 [11] Ce0.75Gd0.25O2-δ 450–500 10–12 [12], [36] Pure HZSM-5 550 15 Present work 13wt%Nd/HZSM-5 500 60 Present work a The reaction temperature for CH3SH completely decompose. b The time for the catalyst begin to deactivate. Research paper Effects of rare-earth (Nd, Er and Y) doping on catalytic performance of HZSM-5 zeolite catalysts for methyl mercaptan (CH3SH) decomposition Dedong He a Husheng Hao a Dingkai Chen a Jiangping Liu a Jie Yu a Jichang Lu a Feng Liu a Sufang He b Kongzhai Li c Yongming Luo a ⁎ a Faculty of Environmental Science and Engineering, Kunming University of Science and Technology, Kunming 650500, PR China Faculty of Environmental Science and Engineering, Kunming University of Science and Technology Kunming 650500 PR China b Research Center for Analysis and Measurement, Kunming University of Science and Technology, Kunming 650093, PR China Research Center for Analysis and Measurement Kunming University of Science and Technology Kunming 650093 PR China c State Key Laboratory of Complex Nonferrous Metal Resources Clean Utilization, Kunming University of Science and Technology, Kunming 650093, PR China State Key Laboratory of Complex Nonferrous Metal Resources Clean Utilization Kunming University of Science and Technology Kunming 650093 PR China ⁎ Corresponding author. Graphical abstract A series of HZSM-5 zeolite catalysts modified with various rare earth metals (Nd, Er and Y) was prepared and used for CH3SH catalytic decomposition test. The results revealed that addition of rare earth metals significantly improved activity and stability of the HZSM-5 zeolite catalysts, and Nd-modified catalyst exhibited the best performance. Several characterization studies were undertaken to correlate structural and surface properties of the obtained catalysts with their catalytic performance. It was found that acid-base properties of the catalysts were closely related to the catalytic performance. The NH3-TPD and CO2-TPD analysis showed that the concentration of strong acid sites of the HZSM-5 catalysts decreased after rare earth metals addition, while the concentration of basic sites of the catalysts increased. The decrease in the amount of strong acid sites suppressed the formation of coke on the catalysts. The catalysts with increased amount of basic sites displayed better adsorption ability to CH3SH. The UV–vis, 27Al NMR and XRD analysis indicated that the existence of an empty f orbit Nd3+ caused the increase of non-framework aluminium species amount, which leaded to the decrease of the strong acid sites amount. In addition, the optimal loading amount of Nd was investigated and 13wt%Nd/HZSM-5 catalyst showed no obvious deactivation during 60h test. The spent Nd/HZSM-5 catalyst can be successfully regenerated, showing that Nd/HZSM-5 was an efficient catalyst for CH3SH elimination. Keywords CH3SH decomposition Rare earth Activity and stability Acid-base properties Nd content 1 Introduction Nowadays, volatile organic compounds (VOCs), which are causing serious health and environmental problems, have been required to be strictly controlled all around the world [1]. Methyl mercaptan (CH3SH) is a model sulfur-containing volatile organic pollutant that is generated from various industrial sources (e.g. petroleum refining processes, wood-pulping industries, DL-methionine manufacturing processes and some environmental pollution-control activities) and easily detected in ambient air (the olfactory threshold of CH3SH is as low as 0.002ppm) [2,3]. Moreover, CH3SH is also regarded as a source that will cause catalysts to be deactivated and poisoned during many catalytic reactions (such as the reactions in synthesis of methanol and ammonia) [4]. Therefore, the raised environmental awareness and the increased catalytic technical standards have urgently stimulated the importance to find a suitable method to control the emission of CH3SH. Diverse technologies have been developed to removal this odorous gas (CH3SH), including alkaline treatment [5], biological degradation [6], absorption [7] and catalytic oxidation [8]. But catalytic decomposition method may provide an alternative to other methods, since it requires no additional reagents and produces very small amount of waste during the degradation process, which has been predominantly performed recently [9–15]. Among all the catalysts studied, much more attention has been paid to HZSM-5 zeolite catalyst, which is considered as a good candidate for CH3SH catalytic decomposition [13–15]. These studies have shown that CH3SH can be completely decomposed into hydrogen sulfide (H2S) and some inorganic hydrocarbons (e.g. CH4, C2H6, C2H4, etc.) above 550°C [13–15]. Since the produced H2S can be easily captured by amine extraction process or commercially converted to elemental sulfur from Claus technique. Therefore, this chemical transformation may be regarded as a tempting process for achieving the completely removal of CH3SH in further researches. However, the stability of the pure HZSM-5 zeolite catalyst in some reaction processes is not satisfactory, and seriously deactivation of the catalyst is observed because of its strong acidity, as the presence of strong acid sites usually promote the formation of coke deposit [16,17]. During CH3SH catalytic decomposition test, pure HZSM-5 catalyst with high CH3SH conversion rapidly deactivate after about 15h time on stream [13,14]. In fact, ceria based catalysts investigated in our previous researches also face with the problem that catalysts will deactivate after about 10h test [10–12]. Therefore, it is essential to make efforts to increase the stability of the pure HZSM-5 catalyst. It has been reported that the formation of coke deposit can be reduced and the stability of zeolite catalysts can be enhanced by means of adding some rare earth metals (e.g. La, Ce) [18,19]. Broadly speaking, acid-base properties of the zeolite catalysts could be effectively tuned by modifying these catalysts with small amounts of rare earth oxides which have strong basic character [20]. However, to our best knowledge, there has been no report on rare earth metals (e.g. Nd, Er and Y. Nd are considered as the light rare earth element, and Er and Y are classified as the heavy rare earth elements) modified HZSM-5 for CH3SH catalytic decomposition so far, which initiates us to study this catalytic reaction system. Additionally, it has been well known that the dual properties of both acidity and alkalinity of zeolite catalysts can play a vital role in many catalytic processes [21]. The acidic properties of the zeolite catalysts have been investigated, while their basic properties have rarely been focused on. It is believed that the presence of increased concentration of basic sites on the catalysts will has a positive effect on their catalytic performance, since CH3SH is generally regarded as an acid gas [9]. Based on the aforementioned background, a series of rare-earth metals (Nd, Er and Y) with different ionic radii modified HZSM-5 zeolite catalysts were prepared and used for CH3SH decomposition test in the present study. The effects of modification of rare earth metals on the physicochemical properties of the synthesized catalysts were investigated. In addition, several characterization studies, including XRD, XRF, FT-IR, 27Al-NMR, UV–vis, BET, NH3-TPD, CO2-TPD and Raman, were carried out to provide valuable information to understand the reason for the improved catalytic activity and stability of the modified HZSM-5 zeolite. Furthermore, deactivation and regeneration of the spent catalysts were also investigated. 2 Experimental 2.1 Catalysts synthesis The commercial HZSM-5 catalyst (Si/Al ratio was 20) was obtained from Fuxu zeolite company, China. Pure catalyst was calcined at 550°C for 5h to remove impurities. The modification of rare earth metals (Nd, Er and Y) was accomplished by conventional incipient wetness impregnation method, and detail impregnation process is recorded as follows: 5g of pure HZSM-5 zeolite catalyst was modified with a certain amount of RE(NO3)3·6H2O (RE=Nd, Er and Y) in aqueous solution at room temperature for 12h, to obtain RE/HZSM-5 catalysts with 5wt% l loading of RE. Meanwhile, the neodymium (Nd) nitrate aqueous solutions with certain concentrations were used to prepare Nd/HZSM-5 catalyst with 1, 5, 9, 13 and 17wt% loading of Nd. The impregnated powder was dried at 80°C for 6h and then calcined in air at 550°C for 5h. Preparation details are recorded in Electronic Supplementary Material and the content of rare earth metal in the modified zeolite catalyst was calculated by the formula described in previous research [22]. 2.2 Catalysts characterization N2 adsorption/desorption isotherms were carried out on a Micrometrics ASAP 2020 instrument. Before the measurement, all the samples were degassed under vacuum at 250°C for 4h. Specific total surface area and microporous volume of the synthesized samples were calculated from BET method and t-plot method, respectively. XRD patterns were recorded by a Rigaku D/max-1200 diffractometer, using Cu-Kα radiation (λ=1.5406Å) as an X-ray source and operating at 40kV and 30mA. FT-IR experiments were performed on a Nicolet 560 IR spectrometer with standard KBr pellet method. XRF were used to analyze the chemical composition of the synthesized catalysts. The 27Al NMR experiments were conducted on a Bruker Avance III 600 spectrometer at a resonance frequency of 156.4MHz and the spectra were collected at a spinning rate of 12KHz. UV–vis spectra were recorded on a Cary 500 spectrometer with an integration sphere diffuse reflectance attachment. Raman tests were operated at room temperature to analyze the nature of coke deposited on the catalyst after reaction, using a Via Reflex Raman spectrometer with 514nm emission lines from Ar+ laser. NH3-TPD experiments were performed on an instrument equipped with a TCD detector. About 0.2g of the catalyst was dried at 500°C for 2h in He flow and then cooled down to 100°C. NH3 adsorption was conducted at 100°C for 2h by flowing 10% NH3/He under a flow rate of 30ml/min to saturate the acid sites of the catalyst. Then the sample was purged with He flow at 100°C for 1h to desorb the weakly or physically adsorbed NH3 from the catalyst surface. Finally, TPD was carried out in 30ml/min He flow, ramping the temperature from 100°C to 700°C at a ramp rate of 10°C/min. The desorbed NH3 was detected by the TCD detector. CO2-TPD tests were measured at the same apparatus for NH3-TPD. About 0.2g of the sample was pretreated in He flow at 600°C for 2h, then cooled to 30°C and adsorbed by CO2 (10% CO2/He) at 30°C for 2h. The catalyst was flushed with He flow for 1h, and CO2 desorption was recorded from 30°C to 600°C with a temperature ramp of 10°C/min. 2.3 Catalytic tests A fixed-bed micro-reactor was used for catalytic decomposition of CH3SH at atmospheric pressure from 350°C to 600°C. An amount of 0.2g of catalyst with particle size of 0.25–0.42mm (60–40mesh) diluted with 0.2g of quartz sand was loaded into the reactor. Then, a gas mixture of 1vol% CH3SH in N2 was supplied as feed gas, and the flow rate of the feed gas was 30ml/min. The stability tests of pure HZSM-5 sample and 13% Nd/HZSM-5 catalyst were performed at 500°C. The gaseous products were analyzed by two online gas chromatograph (GC), equipped with two TCD detectors, one FPD detector and one FID detector. The concentration of CH3SH was detected by the FID and FPD detectors, and the concentrations of CH4, C2H4, C2H6 and other hydrocarbons were analyzed by the FID detector. Meanwhile, two TCD detectors were used to quantitate the concentrations of produced H2, CO and CO2. The conversion of CH3SH (%) was defined by the under-mentioned equation: C o n v e r s i o n o f C H 3 S H ( % ) = C [ C H 3 S H ] i n − C [ C H 3 S H ] o u t C [ C H 3 S H ] i n × 100 where C[CH3SH]in is the content of CH3SH in the feedstock, and C[CH3SH]out is the content of CH3SH in the product. 3 Results and discussion 3.1 Effect of rare-earth (Nd, Er and Y) modification 3.1.1 Characterization results of the synthesized catalysts Fig. 1 exhibits the XRD patterns of pure HZSM-5 and RE metals (Nd, Er and Y) modified HZSM-5 catalysts. It is clear the XRD patterns of all these samples are similar, and no peaks associated with the doped RE oxides are observed in the patterns of Nd, Er and Y doped HZSM-5 catalysts. This suggests that modification of RE metals does not destroy the lattice structure of the HZSM-5 zeolite, and the formed RE oxides are well dispersed on the synthesized samples [17,23]. Moreover, SEM and element mapping characterization of the 17wt%Nd-ZSM-5 is given in Electronic Supplementary Material (as shown in Fig. S1) to further prove the dispersing of Nd metals. When compared with the pure HZSM-5 sample, however, RE metals modified HZSM-5 catalysts present lower peak intensity. One possibility for the lower intensity of the XRD patterns from the RE impregnated HZSM-5 is that the high atomic weight rare earths absorb X-rays. Meanwhile, one other possibility for the decrease of peak intensity could either be originated from the existence of RE species that are incorporated into the channels of the prepared catalysts [24]. or resulted from the framework defects caused by partial dealumination of HZSM-5 [25,26]. The textural properties and FT-IR characterization of the HZSM-5 and RE-doped HZEM-5 catalysts are recorded in Table 1 , Figs. S2 and Fig. S3, respectively (as shown in the Electronic Supplementary Material). Fig. 2 illustrates the NH3-TPD profiles of the pure HZSM-5 and RE (Nd, Er and Y) doped HZSM-5 samples. The TPD profile of the pure HZSM-5 consists of two major desorption peaks at about 250°C and 500°C, representing for weak acid sites and strong acid sites, respectively [13,26]. As demonstrated in Fig. 2, after modification of rare earth metals, the low-temperature desorption peaks exhibit small changes in intensity, suggesting that the strength of weak acidity is not evidently affected. However, the amount of the strong acid sites is significantly eliminated by RE species addition according to the markedly decrease of the intensity of the high-temperature desorption peaks. It was reported that the Al in zeolitic framework was generally contributed to the strong acid sites [27]. Hence, the loss of the strong acid sites could be ascribed to the dealumination in the framework of HZSM-5, which was suggested in the literature reported previously [19] and also revealed by the characterization results of the XRD, 27Al NMR and UV–vis (as shown in Figs. S4 and S5 in Electronic Supplementary Material). More importantly, the decrease in the concentration of strong acidity may result in more stable of the active sites of the catalyst and a better anti-coking capability during the reaction [28], which should be responsible for the increased catalytic activity and stability. Fig. 3 presents the CO2-TPD analysis of the pure and rare earth metals modified HZSM-5 catalysts. From Fig. 3, a desorption peak at the temperature of 120°C is seen for the unmodified sample, and this peak was reported to indicate the presence of surface basic sites that was due to the interaction between the framework of HZSM-5 and CO2 [29]. It is apparent that the intensity of CO2 desorption peaks increase after impregnation of rare earth elements, implying the formation of increased amount of surface basic sites. Moreover, modification of Nd causes a larger increase in peak intensity, meaning that Nd introduction demonstrates a remarkable effect on the enhanced basicity of the catalyst. It is generally accepted that modification of rare earth metals could effectively tune the acid-base property of the HZSM-5 catalyst, since rare earth oxides usually present some basic characters. Moreover, Nd with larger cation radius (Er3+ =1.00Å, Y=1.015Å and Nd=1.12Å [30,31]) could associate more ligand number of oxygen, thus contributing to increased amount of basic sites [32]. Due to high acidity of CH3SH [9], it could be easily adsorbed by the basic sites on the catalyst. Therefore, RE modified HZSM-5 catalysts with increased alkalinity would display better adsorption ability to CH3SH, which should contribute to the enhanced catalytic activity. 3.1.2 Catalytic activity of the catalysts The evaluation results of catalytic activity tests for decomposition of CH3SH over pure HZSM-5 and RE modified HZSM-5 catalysts are shown in Fig. 4 . As the reaction temperature rose up, the CH3SH conversion over all the catalysts increase. It should be noted that from 400 to 450°C, the CH3SH conversion displays a slight decrease over the pure HZSM-5 catalyst, which merely attributes to the equilibrium conversion as explained in the previous study [13]. From Fig. 4, catalytic activity for CH3SH decomposition (in terms of CH3SH conversion) over rare earth elements modified HZSM-5 catalysts is much higher than that over pure HZSM-5 zeolite sample. The conversion of CH3SH is completed over the modified HZSM-5 catalysts at 500°C, the CH3SH conversion over the pure HZSM-5 catalyst, by contrast, is about 80% at this time. When the reaction temperature increases to 550°C, the CH3SH conversion of the RE modified HZSM-5 catalyst samples reaches up to 100%, but slightly amount of CH3SH in the outlet gas still can be detected from the pure HZSM-5 catalyst sample. Therefore, it is obvious that the addition of rare earth metals significantly enhances the activity of the catalyst. Furthermore, it is found that the activity of Nd/HZSM-5 is higher than that of Er and Y doped HZSM-5 catalysts when the reaction temperature is 450°C. According to the characterization results, after impregnation of rare earth metals, on the one hand, increased amount of basic sites are presented on the doped-HZSM-5 samples. Furthermore, the introduction of Nd causes a remarkable effect on the enhanced basicity of the catalyst. On the other hand, the decrease in the concentration of strong acidity may result in more stable of the active sites of the modified HZSM-5 catalysts. All these should be responsible for the increased catalytic activity of the RE modified catalysts, especially for Nd/HZSM-5 sample. 3.2 Effect of neodymium (Nd) content 3.2.1 Characterization results of the catalysts Since Nd/HZSM-5 catalyst has been proven to be very efficient among all the RE (Nd, Er and Y) modified HZSM-5 catalysts. Hence, the effect of Nd content (with 1, 5, 9, 13 and 17wt% loading amount of Nd) on the physicochemical properties of the catalysts and their catalytic performance for CH3SH decomposition are detailed investigated. Fig. 5 illustrates the XRD patterns of the pure HZSM-5 and Nd/HZSM-5 catalysts with different Nd contents. All catalysts exhibit the similarity of the XRD patterns, indicating that the original structure of HZSM-5 is well retained after Nd modification. Nevertheless, the XRD intensities of the Nd modified HZSM-5 catalysts are relatively lower than that of the unmodified one and the peak intensity gradually decreases with increasing Nd content. As explained before, the decrease of the peak intensity in the modified catalysts was either resulted from the existence of RE species inside the channel of HZSM-5 or attributed to the framework defects caused by dealumination [25,26]. Therefore, the XRD results displayed here also indicate the entrance of Nd species into the channels or partial dealumination of the HZSM-5 during the process of impregnation of Nd. NH3-TPD and CO2-TPD profiles of the pure HZSM-5 and Nd/HZSM5 with different Nd contents are displayed in Figs. 6 and 7 , respectively. It is clear that the acidic-basic properties of the catalysts are strongly influenced by the Nd content. On the one hand, as the content of Nd increase, the amount of the strong acid sites (high-temperature desorption peak) decrease sharply. When the content of Nd reaches to 13% or even higher, the peak ascribed to the strong acid sites can hardly be observed. In particular, quantitative results of NH3-TPD and CO2-TPD are listed in Table S1 (as shown in Electronic Supplementary Material). Considering the results of the XRD, 27Al NMR and UV–vis, and also combining the results discussed previously, the loss of the strong acid sites could be corresponded to the partial dealumination in the framework of HZSM-5. The reduced amounts of strong acid sites may be favorable for the better catalytic performance in decomposition of CH3SH. On the other hand, with increasing Nd loading from 1% to 13%, the intensity of the CO2 desorption peak increase. When Nd loading increases to 17%, the intensity of the CO2 desorption peak remains unchanged. Therefore, the appropriate amount of Nd in the Nd/HZSM5 catalysts would lead to the formation of increased amount of surface basic sites, which is responsible for the enhanced catalytic activity. 3.2.2 Catalytic activity and stability of the catalysts Fig. 8 compares the activity for CH3SH catalytic decomposition over the pure HZSM-5 and Nd/HZSM-5 catalysts as a function of temperature. It is seen from Fig. 8 that the activities of these samples differ sharply. The addition of Nd to HZSM-5 catalysts displays a considerable improvement in terms of CH3SH conversion. Moreover, an increasing Nd content is found to positively affect the catalytic activity as suggested by higher CH3SH conversion. The highest conversion of CH3SH is obtained over the 13wt%Nd/HZSM-5 catalyst. But further Nd addition (with Nd loading increases to 17%) leads to a slightly decrease of CH3SH conversion. As mentioned, introduction of Nd into HZSM-5 catalysts was believed not only to adjust the formation of increased amount of surface basic sites in its favor, but also to decrease the amount of the strong acid sites. CH3SH could be easily adsorbed by the basic sites because of its high acidity and this would contribute to the increased catalytic activity. Furthermore, the decrease in the concentration of the strong acidity may result in more stable of the active sites of the catalyst, which could be responsible for the enhanced catalytic activity as well. Therefore, rare earth Nd has a rather important role in tuning the acid-base properties of the HZSM-5 zeolite catalyst, which results in an increased catalytic activity in CH3SH decomposition. But too much addition of Nd (more than 17% Nd loading) does not further increase the reactivity, since too many Nd species that are entered into the channels of HZSM-5 zeolite catalyst, to some extent, may slightly affect the structural and surface properties of the catalyst. These results demonstrate that it is necessary to have a suitable amount of Nd (with l3wt% load of Nd) in the process of catalyst synthesis. The primary tests have indicated that 13wt%Nd-modified HZSM-5 catalyst exhibited high catalytic activity. Hence, the stability tests of the pure HZSM-5 and 13wt%Nd/HZSM-5 catalysts are evaluated at 500°C, and the test results are shown in Fig. 9 . The parent HZSM-5 catalyst exhibits a poor stability in catalytic decomposition of CH3SH. It is faced with deactivation after a relatively short time on-stream reaction (about 15h), and the conversion of CH3SH decreases from 98% to 50% after 30h of exposure. In contrast, 13wt%Nd/HZSM-5 shows high stability with no obvious deactivation during the 60h test, indicating that the addition of Nd markedly improve the stability of the HZSM-5 catalyst. The improved stability of the 13wt%Nd-modified HZSM-5 catalyst could be interpreted by the fact that modification of Nd into HZSM-5 catalyst could restrict the accumulation of coke deposit, since the amount of the strong acid sites which is closely related to the formation of coke deposit is significantly eliminated on this catalyst. 3.3 Possible reaction mechanism for the conversion of CH3SH over HZSM-5 based catalysts It is well known that the accumulation of coke deposit on zeolite catalyst was considered as the main reason for the deactivation of the catalyst in CH3SH decomposition process [13] and Raman spectroscopy was generally used to evaluate the nature of coke deposit over the spent catalyst [33,34]. Therefore, characterization of the coke deposit on the fresh and spent samples is conducted by Raman technique in the present study, and the corresponding result is depicted in Fig. 10 . It can be observed that several Raman bands at about 1180, 1380–1500, and 1610cm−1 are presented in the spectra of the spent catalysts, which are absent in that of the fresh HZSM-5 and Nd/HZSM-5 catalysts. These signals obviously indicate that coke is deposited over the spent catalysts, and this coke deposit is possibly originated from the deep dehydrogenation of hydrocarbons during the reaction [33], since hydrocarbons (such as CH4, C2H4, C2H6, etc.) are indicated as the main products during the process of CH3SH decomposition [13]. As shown in Fig. 9, after 40h on stream, the CH3SH conversion over the pure HZSM-5 catalyst reduces to 0% approximately. Fig. 10 exhibits that a large amount of coke is deposited at this time. Hence, the accumulated coke deposit could finally lead to a decrease in CH3SH conversion, because it could either poison the active sites or block the access to them by the reactant molecules [35]. In contrast, the CH3SH conversion over the 13wt%Nd/HZSM-5 catalyst does not decrease after 40h of exposure though coke is already formed at this time. This is because that the amount of the coke deposit over the 13wt%Nd/HZSM-5 catalyst is much lower than that over the pure HZSM-5 catalyst after the same exposure time (40h) of the reaction. Therefore, it is accepted that a large number of active sites are still possessed at this moment, which will be further proved by the result in Fig. 11 . Moreover, from Fig. 10, the amount of the coke over the 13wt%Nd/HZSM-5 catalyst increases with increasing the exposure time from 0 to 80h. But to our surprise, the intensity represented for the coke deposit of 13wt%Nd/HZSM-5 catalyst with 80h of exposure is still lower than that of pure HZSM-5 catalyst with 40h of exposure. This suggests that the 13wt%Nd-modified HZSM-5 catalyst possesses stronger resistance to the formation of coke deposit during the reaction. As mentioned before, the decrease in the concentration of the strong acid sites over the RE modified HZSM-5 catalyst could effectively suppress the formation of coke on the zeolite catalyst surface. Although the strong acid sites can promote the formation of coke deposit, it has been reported that the acid sites on HZSM-5 catalyst could generally be regarded as the active sites/active centres in CH3SH catalytic decomposition [13,14]. Hence, a comparison of the NH3-TPD data of the fresh and spent samples is investigated and the results are depicted in Fig. 11. Apparently, the pure HZSM-5 catalyst lose most of its acid sites after 40h of exposure, and its CH3SH conversion almost decreases to 0% as obtained from Fig. 9. Whereas in 13wt%Nd-modified HZSM-5 catalyst, a certain amount of weak acid sites can be found, even after 80h on stream. As expected, nearly 60% of CH3SH conversion is displayed at this time (Fig. 9). For the pure HZSM-5 catalyst, the acid sites may be completely covered due to the serious accumulation of coke deposit after 40h of exposure. But for the 13wt%Nd/HZSM-5 catalyst, the decrease in the amount of strong acid sites that could effectively result in the decrease of coke amount may give rise to less coverage of the weak acid sites during the reaction. The existence of the weak acid sites could provide enough active centres for CH3SH decomposition. On the basis of the above results, a possible reaction mechanism for the conversion of CH3SH over the pure and modified HZSM-5 catalysts is proposed, and the results are illustrated in Scheme 1 . CH3SH, due to its strong acidity, could be firstly absorbed by the basic sites on the HZSM-5 catalyst. Then, the absorbed CH3SH molecules would be migrated to the active centres. Finally, CH3SH would be ultimately converted into the corresponding products (such as CH4 and other hydrocarbons) that have been reported in previous researches [13–15] (CH4 production as a function of time in the present study is also shown in Fig. S6 in Electronic Supplementary Material). However, the produced hydrocarbons would be dehydrogenated deeply on the strong acid sites over the HZSM-5 catalyst, and this would lead to form a lot of coke deposit during the reaction. The accumulated coke deposit could either poison the active centres or block the access to them by the CH3SH molecules, and finally causes the decrease of catalytic activity. For RE doped HZSM-5 catalyst (13wt%Nd/HZSM-5), after modification of Nd, increased amount of surface basic sites are formed. Moreover, the amount of the strong acid sites is obviously decreased. The increased amount of surface basic sites could lead to more CH3SH molecules are adsorbed, and the decrease of the strong acidity may result in more stable of the active sites of the catalyst. All these should be responsible for the enhanced catalytic activity. More importantly, the decrease in the amount of the strong acid sites could suppress the formation of coke deposit, which may cause less coverage of the weak acid sites during the reaction, and the existence of the weak acid sites could provide enough active centres for CH3SH decomposition. Therefore, the catalytic stability of the 13wt%Nd-modified HZSM-5 catalyst has significantly been improved. 3.4 Regeneration of spent catalysts Regeneration of the used 13wt%Nd-modified HZSM-5 catalyst is carried out by switching 30ml/min air flow at 500°C (the temperature is the same as the reaction temperature) for 30min, and the results are shown in Fig. 12 . Surprisingly, it is found that the used catalyst can be well recovered to its original performance after regeneration. Furthermore, multi-cycle regeneration performance (4 regeneration cycles) has also been conducted (results are not shown), and the results illustrate that the used catalyst can be well regenerated for many times, which highlights its industrial application. The acidity and alkalinity properties of the regenerated catalysts are also well recovered after the regeneration process (as presented in Fig. S8A and 8B in Electronic Supplementary Material). 3.5 Catalytic performance comparison of Nd/HZSM-5 with other reported catalysts The catalytic activity and stability obtained by using Nd/HZSM-5 as catalysts is compared with that of other reported catalysts. Detail results are collected and presented in Table 2 . It is found that catalytic performance of pure HZSM-5 in the present work is comparable to that of HZSM-5 catalyst reported previously [13,14]. CH3SH can be completely decomposed over pure HZSM-5 zeolite above 550°C, and this pure zeolite catalyst faces with deactivation after a relatively short time on-stream reaction (about 12–15h). Furthermore, it is noted that other popular catalysts (ceria based catalysts) also confront with low catalytic stability during CH3SH decomposition processes [10–12,36], and these catalysts will deactivate after about 10h test. Nd modified HZSM-5 catalysts, by contrast, can obtain 100% CH3SH conversion at 500°C. Moreover, the modified HZSM-5 catalyst shows high stability with no obvious deactivation during the 60h test. Therefore, the improvements for the modified HZM-5 catalysts investigated in the present study can be observed obviously. 4 Conclusion In this study, a series of rare earth metals (Nd, Er and Y) modified HZSM-5 catalysts and pure HZSM-5 catalyst was prepared and tested for catalytic decomposition of CH3SH. The catalysis tests showed that rare earth metals (especially for Nd) modification increased both catalytic activity and catalytic stability. Based on the characterization results, increased amount of basic sites were presented on the modified HZSM-5 catalysts. Moreover, the decrease of the strong acid sites amount over the RE modified HZSM-5 catalysts resulted in more stable of the active sites of the catalysts and also suppressed the formation of coke on the catalysts surface. All these features gave rise to the increased catalytic activity and catalytic stability. The optimal Nd content was detailed investigated and 13wt%Nd/HZSM-5 catalyst showed high stability with no obvious deactivation during the 60h test. In addition, the spent catalysts can be successfully regenerated with air for many times. Acknowledgement Authors gratefully acknowledge the financial supports of this research work from NSFC (National Natural Science Foundation of China, Grant Nos. 21667016, U1402233, and 21267011). Appendix A Supplementary data Supplementary data associated with this article can be found, in the online version, at http://dx.doi.org/10.1016/j.apcata.2017.01.011. Appendix A Supplementary data The following are Supplementary data to this article: References [1] Z. Abdelouahab-Reddam R.E. Mail F. Coloma A. Sepúlveda-Escribano Appl. Catal. A: Gen. 494 2015 87 94 [2] D.J. Kim J.E. Yie J. Colloid Interface Sci. 283 2005 311 315 [3] Y.K. Son J.C. Kim Chem. Eng. J. 262 2015 217 223 [4] S. Zhao H. Yi X. Tang F. Gao B. Zhang Z. Wang Y. Zuo J. Clean. Prod. 87 2015 856 861 [5] M. Brown W.K.T. Gleim P. Urban Oil Gas J. 57 1959 73 78 [6] J. Sun S. Hu K.R. Sharma B.J. Ni Z. Yuan Water Res. 69 2015 80 89 [7] A. Ryzhikov V. Hulea D. Tichit C. Leroi D. Anglerot B. Coq P. Trens Appl. Catal. A: Gen. 397 2011 218 224 [8] N. Koivikko T. Laitinen S. Ojala S. Pitkäaho K. Kucherov R.L. Keiski Appl. Catal. B: Environ. 103 2011 72 78 [9] N. Laosiripojana S. Assabumrungrat Appl. Catal. B: Environ. 102 2011 267 275 [10] D. He H. Hao D. Chen J. Lu L. Zhong R. Chen F. Liu G. Wan S. He Y. Luo J. Environ. Chem. Eng. 4 2016 311 318 [11] D. He G. Wan H. Hao D. Chen J. Lu L. Zhang F. Liu L. Zhong S. He Y. Luo Chem. Eng. J. 289 2016 161 169 [12] D. He H. Hao D. Chen J. Liu J. Yu J. Lu F. Liu G. Wan S. He Y. Luo Catal. Today 281 2017 559 565 [13] E. Huguet B. Coq R. Durand C. Leroi R. Cadours V. Hulea Appl. Catal. B: Environ. 134–135 2013 344 348 [14] V. Hulea E. Huguet C. Cammarano A. Lacarriere R. Durand C. Leroi R. Cadours B. Coq Appl. Catal. B: Environ. 144 2014 547 553 [15] C. Cammarano E. Huguet R. Cadours C. Leroi B. Coq V. Hulea Appl. Catal. B: Environ. 156–157 2014 128 133 [16] S.M. Campbell D.M. Bibby J.M. Coddington R.F. Howe R.H. Meinhold J. Catal. 161 1996 338 349 [17] P. Yang X. Xue Z. Meng R. Zhou Chem. Eng. J. 234 2013 203 210 [18] L. Zhang J. Gao J. Hu W. Li J. Wang Catal. Lett. 130 2009 355 361 [19] J. Bi M. Liu C. Song X. Wang X. Guo Appl. Catal. B: Environ. 107 2011 68 76 [20] E. Angelescu O.D. Pavel M. Che R. Bı̂rjega G. Constentin Catal. Commun. 5 2004 647 651 [21] L.P. The S. Triwahyono A.A. Jalil R.R. Mukti M.A.A. Aziz T. Shishido Chem. Eng. J. 270 2015 196 204 [22] Y. Wang G. Jian Z. Peng J. Hu X. Wang W. Duan B. Liu Catal. Commun. 66 2015 34 37 [23] L. Sun X. Guo G. Xiong X. Wang Catal. Commun. 25 2012 18 21 [24] J. Lee U.G. Hong S. Hwang M.H. Youn I.K. Song Fuel Process. Technol. 109 2013 189 195 [25] G. Zhao J. Teng Z. Xie W. Jin W. Yang Q. Chen Y. Tang J. Catal. 248 2007 29 37 [26] J. Li H. Ma Q. Sun W. Ying D. Fang Fuel Process. Technol. 134 2015 32 38 [27] F. Yaripour Z. Shariatinia S. Sahebdelfar A. Irandoukht Microporous Mesoporous Mat. 203 2015 41 53 [28] J. Ouyang F. Kong G. Su Y. Hu Q. Song Catal. Lett. 132 2009 64 74 [29] G. Jiang L. Zhang Z. Zhao X. Zhou A. Duan C. Xu J. Gao Appl. Catal. A: Gen. 340 2008 176 182 [30] J. Kimpton T.H. Randle J. Drennan Solid State Ion. 149 2002 89 98 [31] F. Geng Y. Matsushita R. Ma H. Xin M. Tanaka F. Izumi N. Iyi T. Sasaki J. Am. Chem. Soc. 130 2008 16344 16350 [32] Q. Jiang J. Cheng Z. Gao Front. Chem. Eng. China 1 2007 300 303 [33] J.A. Botas D.P. Serrano A. García J. Vicente R. Ramos Catal. Today 195 2012 59 70 [34] L. Lang S. Zhao X. Yin W. Yang C. Wu Int. J. Hydrog. Energy 40 2015 9924 9934 [35] M. Guisnet L. Costa F.R. Ribeiro J. Mol. Catal. A: Chem. 305 2009 69 83 [36] D. He D. Chen H. Hao J. Yu J. Liu J. Lu F. Liu G. Wan S. He Y. Luo Appl. Surf. Sci. 390 2016 959 967",
      "scopus-id": "85010190553",
      "coredata": {
        "eid": "1-s2.0-S0926860X17300194",
        "dc:description": "A series of HZSM-5 zeolite catalysts modified with various rare earth metals (Nd, Er and Y) was prepared and used for CH3SH catalytic decomposition test. The results revealed that addition of rare earth metals significantly improved activity and stability of the HZSM-5 zeolite catalysts, and Nd-modified catalyst exhibited the best performance. Several characterization studies were undertaken to correlate structural and surface properties of the obtained catalysts with their catalytic performance. It was found that acid-base properties of the catalysts were closely related to the catalytic performance. The NH3-TPD and CO2-TPD analysis showed that the concentration of strong acid sites of the HZSM-5 catalysts decreased after rare earth metals addition, while the concentration of basic sites of the catalysts increased. The decrease in the amount of strong acid sites suppressed the formation of coke on the catalysts. The catalysts with increased amount of basic sites displayed better adsorption ability to CH3SH. The UV–vis, 27Al NMR and XRD analysis indicated that the existence of an empty f orbit Nd3+ caused the increase of non-framework aluminium species amount, which leaded to the decrease of the strong acid sites amount. In addition, the optimal loading amount of Nd was investigated and 13wt%Nd/HZSM-5 catalyst showed no obvious deactivation during 60h test. The spent Nd/HZSM-5 catalyst can be successfully regenerated, showing that Nd/HZSM-5 was an efficient catalyst for CH3SH elimination.",
        "openArchiveArticle": "false",
        "prism:coverDate": "2017-03-05",
        "openaccessUserLicense": null,
        "prism:aggregationType": "Journal",
        "prism:url": "https://api.elsevier.com/content/article/pii/S0926860X17300194",
        "dc:creator": [
          {
            "@_fa": "true",
            "$": "He, Dedong"
          },
          {
            "@_fa": "true",
            "$": "Hao, Husheng"
          },
          {
            "@_fa": "true",
            "$": "Chen, Dingkai"
          },
          {
            "@_fa": "true",
            "$": "Liu, Jiangping"
          },
          {
            "@_fa": "true",
            "$": "Yu, Jie"
          },
          {
            "@_fa": "true",
            "$": "Lu, Jichang"
          },
          {
            "@_fa": "true",
            "$": "Liu, Feng"
          },
          {
            "@_fa": "true",
            "$": "He, Sufang"
          },
          {
            "@_fa": "true",
            "$": "Li, Kongzhai"
          },
          {
            "@_fa": "true",
            "$": "Luo, Yongming"
          }
        ],
        "link": [
          {
            "@_fa": "true",
            "@rel": "self",
            "@href": "https://api.elsevier.com/content/article/pii/S0926860X17300194"
          },
          {
            "@_fa": "true",
            "@rel": "scidir",
            "@href": "https://www.sciencedirect.com/science/article/pii/S0926860X17300194"
          }
        ],
        "dc:format": "application/json",
        "openaccessType": null,
        "pii": "S0926-860X(17)30019-4",
        "prism:volume": "533",
        "prism:publisher": "Elsevier B.V.",
        "dc:title": "Effects of rare-earth (Nd, Er and Y) doping on catalytic performance of HZSM-5 zeolite catalysts for methyl mercaptan (CH3SH) decomposition",
        "prism:copyright": "© 2017 Elsevier B.V. All rights reserved.",
        "openaccess": "0",
        "prism:issn": "0926860X",
        "dcterms:subject": [
          {
            "@_fa": "true",
            "$": "CH3SH decomposition"
          },
          {
            "@_fa": "true",
            "$": "Rare earth"
          },
          {
            "@_fa": "true",
            "$": "Activity and stability"
          },
          {
            "@_fa": "true",
            "$": "Acid-base properties"
          },
          {
            "@_fa": "true",
            "$": "Nd content"
          }
        ],
        "openaccessArticle": "false",
        "prism:publicationName": "Applied Catalysis A: General",
        "openaccessSponsorType": null,
        "prism:pageRange": "66-74",
        "prism:endingPage": "74",
        "pubType": "fla",
        "prism:coverDisplayDate": "5 March 2017",
        "prism:doi": "10.1016/j.apcata.2017.01.011",
        "prism:startingPage": "66",
        "dc:identifier": "doi:10.1016/j.apcata.2017.01.011",
        "openaccessSponsorName": null
      },
      "objects": {
        "object": [
          {
            "@category": "thumbnail",
            "@height": "88",
            "@width": "219",
            "@_fa": "true",
            "$": "https://api.elsevier.com/content/object/eid/1-s2.0-S0926860X17300194-fx1.sml?httpAccept=%2A%2F%2A",
            "@multimediatype": "GIF image file",
            "@type": "IMAGE-THUMBNAIL",
            "@size": "5858",
            "@ref": "fx1",
            "@mimetype": "image/gif"
          },
          {
            "@category": "thumbnail",
            "@height": "164",
            "@width": "151",
            "@_fa": "true",
            "$": "https://api.elsevier.com/content/object/eid/1-s2.0-S0926860X17300194-gr1.sml?httpAccept=%2A%2F%2A",
            "@multimediatype": "GIF image file",
            "@type": "IMAGE-THUMBNAIL",
            "@size": "6014",
            "@ref": "gr1",
            "@mimetype": "image/gif"
          },
          {
            "@category": "thumbnail",
            "@height": "164",
            "@width": "155",
            "@_fa": "true",
            "$": "https://api.elsevier.com/content/object/eid/1-s2.0-S0926860X17300194-gr10.sml?httpAccept=%2A%2F%2A",
            "@multimediatype": "GIF image file",
            "@type": "IMAGE-THUMBNAIL",
            "@size": "7074",
            "@ref": "gr10",
            "@mimetype": "image/gif"
          },
          {
            "@category": "thumbnail",
            "@height": "164",
            "@width": "154",
            "@_fa": "true",
            "$": "https://api.elsevier.com/content/object/eid/1-s2.0-S0926860X17300194-gr11.sml?httpAccept=%2A%2F%2A",
            "@multimediatype": "GIF image file",
            "@type": "IMAGE-THUMBNAIL",
            "@size": "6149",
            "@ref": "gr11",
            "@mimetype": "image/gif"
          },
          {
            "@category": "thumbnail",
            "@height": "164",
            "@width": "163",
            "@_fa": "true",
            "$": "https://api.elsevier.com/content/object/eid/1-s2.0-S0926860X17300194-gr12.sml?httpAccept=%2A%2F%2A",
            "@multimediatype": "GIF image file",
            "@type": "IMAGE-THUMBNAIL",
            "@size": "4907",
            "@ref": "gr12",
            "@mimetype": "image/gif"
          },
          {
            "@category": "thumbnail",
            "@height": "163",
            "@width": "154",
            "@_fa": "true",
            "$": "https://api.elsevier.com/content/object/eid/1-s2.0-S0926860X17300194-gr2.sml?httpAccept=%2A%2F%2A",
            "@multimediatype": "GIF image file",
            "@type": "IMAGE-THUMBNAIL",
            "@size": "5963",
            "@ref": "gr2",
            "@mimetype": "image/gif"
          },
          {
            "@category": "thumbnail",
            "@height": "164",
            "@width": "151",
            "@_fa": "true",
            "$": "https://api.elsevier.com/content/object/eid/1-s2.0-S0926860X17300194-gr3.sml?httpAccept=%2A%2F%2A",
            "@multimediatype": "GIF image file",
            "@type": "IMAGE-THUMBNAIL",
            "@size": "5234",
            "@ref": "gr3",
            "@mimetype": "image/gif"
          },
          {
            "@category": "thumbnail",
            "@height": "164",
            "@width": "162",
            "@_fa": "true",
            "$": "https://api.elsevier.com/content/object/eid/1-s2.0-S0926860X17300194-gr4.sml?httpAccept=%2A%2F%2A",
            "@multimediatype": "GIF image file",
            "@type": "IMAGE-THUMBNAIL",
            "@size": "7055",
            "@ref": "gr4",
            "@mimetype": "image/gif"
          },
          {
            "@category": "thumbnail",
            "@height": "164",
            "@width": "152",
            "@_fa": "true",
            "$": "https://api.elsevier.com/content/object/eid/1-s2.0-S0926860X17300194-gr5.sml?httpAccept=%2A%2F%2A",
            "@multimediatype": "GIF image file",
            "@type": "IMAGE-THUMBNAIL",
            "@size": "6728",
            "@ref": "gr5",
            "@mimetype": "image/gif"
          },
          {
            "@category": "thumbnail",
            "@height": "164",
            "@width": "155",
            "@_fa": "true",
            "$": "https://api.elsevier.com/content/object/eid/1-s2.0-S0926860X17300194-gr6.sml?httpAccept=%2A%2F%2A",
            "@multimediatype": "GIF image file",
            "@type": "IMAGE-THUMBNAIL",
            "@size": "6463",
            "@ref": "gr6",
            "@mimetype": "image/gif"
          },
          {
            "@category": "thumbnail",
            "@height": "164",
            "@width": "150",
            "@_fa": "true",
            "$": "https://api.elsevier.com/content/object/eid/1-s2.0-S0926860X17300194-gr7.sml?httpAccept=%2A%2F%2A",
            "@multimediatype": "GIF image file",
            "@type": "IMAGE-THUMBNAIL",
            "@size": "6024",
            "@ref": "gr7",
            "@mimetype": "image/gif"
          },
          {
            "@category": "thumbnail",
            "@height": "164",
            "@width": "164",
            "@_fa": "true",
            "$": "https://api.elsevier.com/content/object/eid/1-s2.0-S0926860X17300194-gr8.sml?httpAccept=%2A%2F%2A",
            "@multimediatype": "GIF image file",
            "@type": "IMAGE-THUMBNAIL",
            "@size": "8029",
            "@ref": "gr8",
            "@mimetype": "image/gif"
          },
          {
            "@category": "thumbnail",
            "@height": "164",
            "@width": "161",
            "@_fa": "true",
            "$": "https://api.elsevier.com/content/object/eid/1-s2.0-S0926860X17300194-gr9.sml?httpAccept=%2A%2F%2A",
            "@multimediatype": "GIF image file",
            "@type": "IMAGE-THUMBNAIL",
            "@size": "5861",
            "@ref": "gr9",
            "@mimetype": "image/gif"
          },
          {
            "@category": "thumbnail",
            "@height": "163",
            "@width": "130",
            "@_fa": "true",
            "$": "https://api.elsevier.com/content/object/eid/1-s2.0-S0926860X17300194-sc1.sml?httpAccept=%2A%2F%2A",
            "@multimediatype": "GIF image file",
            "@type": "IMAGE-THUMBNAIL",
            "@size": "5705",
            "@ref": "sc1",
            "@mimetype": "image/gif"
          },
          {
            "@category": "standard",
            "@height": "200",
            "@width": "500",
            "@_fa": "true",
            "$": "https://api.elsevier.com/content/object/eid/1-s2.0-S0926860X17300194-fx1.jpg?httpAccept=%2A%2F%2A",
            "@multimediatype": "JPEG image file",
            "@type": "IMAGE-DOWNSAMPLED",
            "@size": "23221",
            "@ref": "fx1",
            "@mimetype": "image/jpeg"
          },
          {
            "@category": "standard",
            "@height": "305",
            "@width": "282",
            "@_fa": "true",
            "$": "https://api.elsevier.com/content/object/eid/1-s2.0-S0926860X17300194-gr1.jpg?httpAccept=%2A%2F%2A",
            "@multimediatype": "JPEG image file",
            "@type": "IMAGE-DOWNSAMPLED",
            "@size": "19782",
            "@ref": "gr1",
            "@mimetype": "image/jpeg"
          },
          {
            "@category": "standard",
            "@height": "298",
            "@width": "282",
            "@_fa": "true",
            "$": "https://api.elsevier.com/content/object/eid/1-s2.0-S0926860X17300194-gr10.jpg?httpAccept=%2A%2F%2A",
            "@multimediatype": "JPEG image file",
            "@type": "IMAGE-DOWNSAMPLED",
            "@size": "25551",
            "@ref": "gr10",
            "@mimetype": "image/jpeg"
          },
          {
            "@category": "standard",
            "@height": "301",
            "@width": "282",
            "@_fa": "true",
            "$": "https://api.elsevier.com/content/object/eid/1-s2.0-S0926860X17300194-gr11.jpg?httpAccept=%2A%2F%2A",
            "@multimediatype": "JPEG image file",
            "@type": "IMAGE-DOWNSAMPLED",
            "@size": "21413",
            "@ref": "gr11",
            "@mimetype": "image/jpeg"
          },
          {
            "@category": "standard",
            "@height": "284",
            "@width": "282",
            "@_fa": "true",
            "$": "https://api.elsevier.com/content/object/eid/1-s2.0-S0926860X17300194-gr12.jpg?httpAccept=%2A%2F%2A",
            "@multimediatype": "JPEG image file",
            "@type": "IMAGE-DOWNSAMPLED",
            "@size": "13618",
            "@ref": "gr12",
            "@mimetype": "image/jpeg"
          },
          {
            "@category": "standard",
            "@height": "299",
            "@width": "282",
            "@_fa": "true",
            "$": "https://api.elsevier.com/content/object/eid/1-s2.0-S0926860X17300194-gr2.jpg?httpAccept=%2A%2F%2A",
            "@multimediatype": "JPEG image file",
            "@type": "IMAGE-DOWNSAMPLED",
            "@size": "21606",
            "@ref": "gr2",
            "@mimetype": "image/jpeg"
          },
          {
            "@category": "standard",
            "@height": "305",
            "@width": "282",
            "@_fa": "true",
            "$": "https://api.elsevier.com/content/object/eid/1-s2.0-S0926860X17300194-gr3.jpg?httpAccept=%2A%2F%2A",
            "@multimediatype": "JPEG image file",
            "@type": "IMAGE-DOWNSAMPLED",
            "@size": "17537",
            "@ref": "gr3",
            "@mimetype": "image/jpeg"
          },
          {
            "@category": "standard",
            "@height": "285",
            "@width": "282",
            "@_fa": "true",
            "$": "https://api.elsevier.com/content/object/eid/1-s2.0-S0926860X17300194-gr4.jpg?httpAccept=%2A%2F%2A",
            "@multimediatype": "JPEG image file",
            "@type": "IMAGE-DOWNSAMPLED",
            "@size": "23083",
            "@ref": "gr4",
            "@mimetype": "image/jpeg"
          },
          {
            "@category": "standard",
            "@height": "304",
            "@width": "282",
            "@_fa": "true",
            "$": "https://api.elsevier.com/content/object/eid/1-s2.0-S0926860X17300194-gr5.jpg?httpAccept=%2A%2F%2A",
            "@multimediatype": "JPEG image file",
            "@type": "IMAGE-DOWNSAMPLED",
            "@size": "24846",
            "@ref": "gr5",
            "@mimetype": "image/jpeg"
          },
          {
            "@category": "standard",
            "@height": "298",
            "@width": "282",
            "@_fa": "true",
            "$": "https://api.elsevier.com/content/object/eid/1-s2.0-S0926860X17300194-gr6.jpg?httpAccept=%2A%2F%2A",
            "@multimediatype": "JPEG image file",
            "@type": "IMAGE-DOWNSAMPLED",
            "@size": "22941",
            "@ref": "gr6",
            "@mimetype": "image/jpeg"
          },
          {
            "@category": "standard",
            "@height": "309",
            "@width": "282",
            "@_fa": "true",
            "$": "https://api.elsevier.com/content/object/eid/1-s2.0-S0926860X17300194-gr7.jpg?httpAccept=%2A%2F%2A",
            "@multimediatype": "JPEG image file",
            "@type": "IMAGE-DOWNSAMPLED",
            "@size": "22455",
            "@ref": "gr7",
            "@mimetype": "image/jpeg"
          },
          {
            "@category": "standard",
            "@height": "282",
            "@width": "282",
            "@_fa": "true",
            "$": "https://api.elsevier.com/content/object/eid/1-s2.0-S0926860X17300194-gr8.jpg?httpAccept=%2A%2F%2A",
            "@multimediatype": "JPEG image file",
            "@type": "IMAGE-DOWNSAMPLED",
            "@size": "25078",
            "@ref": "gr8",
            "@mimetype": "image/jpeg"
          },
          {
            "@category": "standard",
            "@height": "287",
            "@width": "282",
            "@_fa": "true",
            "$": "https://api.elsevier.com/content/object/eid/1-s2.0-S0926860X17300194-gr9.jpg?httpAccept=%2A%2F%2A",
            "@multimediatype": "JPEG image file",
            "@type": "IMAGE-DOWNSAMPLED",
            "@size": "17288",
            "@ref": "gr9",
            "@mimetype": "image/jpeg"
          },
          {
            "@category": "standard",
            "@height": "709",
            "@width": "565",
            "@_fa": "true",
            "$": "https://api.elsevier.com/content/object/eid/1-s2.0-S0926860X17300194-sc1.jpg?httpAccept=%2A%2F%2A",
            "@multimediatype": "JPEG image file",
            "@type": "IMAGE-DOWNSAMPLED",
            "@size": "63607",
            "@ref": "sc1",
            "@mimetype": "image/jpeg"
          },
          {
            "@category": "high",
            "@height": "886",
            "@width": "2213",
            "@_fa": "true",
            "$": "https://api.elsevier.com/content/object/eid/1-s2.0-S0926860X17300194-fx1_lrg.jpg?httpAccept=%2A%2F%2A",
            "@multimediatype": "JPEG image file",
            "@type": "IMAGE-HIGH-RES",
            "@size": "165761",
            "@ref": "fx1",
            "@mimetype": "image/jpeg"
          },
          {
            "@category": "high",
            "@height": "1354",
            "@width": "1250",
            "@_fa": "true",
            "$": "https://api.elsevier.com/content/object/eid/1-s2.0-S0926860X17300194-gr1_lrg.jpg?httpAccept=%2A%2F%2A",
            "@multimediatype": "JPEG image file",
            "@type": "IMAGE-HIGH-RES",
            "@size": "160181",
            "@ref": "gr1",
            "@mimetype": "image/jpeg"
          },
          {
            "@category": "high",
            "@height": "1319",
            "@width": "1250",
            "@_fa": "true",
            "$": "https://api.elsevier.com/content/object/eid/1-s2.0-S0926860X17300194-gr10_lrg.jpg?httpAccept=%2A%2F%2A",
            "@multimediatype": "JPEG image file",
            "@type": "IMAGE-HIGH-RES",
            "@size": "209542",
            "@ref": "gr10",
            "@mimetype": "image/jpeg"
          },
          {
            "@category": "high",
            "@height": "1333",
            "@width": "1250",
            "@_fa": "true",
            "$": "https://api.elsevier.com/content/object/eid/1-s2.0-S0926860X17300194-gr11_lrg.jpg?httpAccept=%2A%2F%2A",
            "@multimediatype": "JPEG image file",
            "@type": "IMAGE-HIGH-RES",
            "@size": "172348",
            "@ref": "gr11",
            "@mimetype": "image/jpeg"
          },
          {
            "@category": "high",
            "@height": "1257",
            "@width": "1250",
            "@_fa": "true",
            "$": "https://api.elsevier.com/content/object/eid/1-s2.0-S0926860X17300194-gr12_lrg.jpg?httpAccept=%2A%2F%2A",
            "@multimediatype": "JPEG image file",
            "@type": "IMAGE-HIGH-RES",
            "@size": "107096",
            "@ref": "gr12",
            "@mimetype": "image/jpeg"
          },
          {
            "@category": "high",
            "@height": "1326",
            "@width": "1250",
            "@_fa": "true",
            "$": "https://api.elsevier.com/content/object/eid/1-s2.0-S0926860X17300194-gr2_lrg.jpg?httpAccept=%2A%2F%2A",
            "@multimediatype": "JPEG image file",
            "@type": "IMAGE-HIGH-RES",
            "@size": "162857",
            "@ref": "gr2",
            "@mimetype": "image/jpeg"
          },
          {
            "@category": "high",
            "@height": "1354",
            "@width": "1250",
            "@_fa": "true",
            "$": "https://api.elsevier.com/content/object/eid/1-s2.0-S0926860X17300194-gr3_lrg.jpg?httpAccept=%2A%2F%2A",
            "@multimediatype": "JPEG image file",
            "@type": "IMAGE-HIGH-RES",
            "@size": "133137",
            "@ref": "gr3",
            "@mimetype": "image/jpeg"
          },
          {
            "@category": "high",
            "@height": "1264",
            "@width": "1250",
            "@_fa": "true",
            "$": "https://api.elsevier.com/content/object/eid/1-s2.0-S0926860X17300194-gr4_lrg.jpg?httpAccept=%2A%2F%2A",
            "@multimediatype": "JPEG image file",
            "@type": "IMAGE-HIGH-RES",
            "@size": "172143",
            "@ref": "gr4",
            "@mimetype": "image/jpeg"
          },
          {
            "@category": "high",
            "@height": "1347",
            "@width": "1250",
            "@_fa": "true",
            "$": "https://api.elsevier.com/content/object/eid/1-s2.0-S0926860X17300194-gr5_lrg.jpg?httpAccept=%2A%2F%2A",
            "@multimediatype": "JPEG image file",
            "@type": "IMAGE-HIGH-RES",
            "@size": "189294",
            "@ref": "gr5",
            "@mimetype": "image/jpeg"
          },
          {
            "@category": "high",
            "@height": "1319",
            "@width": "1250",
            "@_fa": "true",
            "$": "https://api.elsevier.com/content/object/eid/1-s2.0-S0926860X17300194-gr6_lrg.jpg?httpAccept=%2A%2F%2A",
            "@multimediatype": "JPEG image file",
            "@type": "IMAGE-HIGH-RES",
            "@size": "172092",
            "@ref": "gr6",
            "@mimetype": "image/jpeg"
          },
          {
            "@category": "high",
            "@height": "1368",
            "@width": "1250",
            "@_fa": "true",
            "$": "https://api.elsevier.com/content/object/eid/1-s2.0-S0926860X17300194-gr7_lrg.jpg?httpAccept=%2A%2F%2A",
            "@multimediatype": "JPEG image file",
            "@type": "IMAGE-HIGH-RES",
            "@size": "167115",
            "@ref": "gr7",
            "@mimetype": "image/jpeg"
          },
          {
            "@category": "high",
            "@height": "1250",
            "@width": "1250",
            "@_fa": "true",
            "$": "https://api.elsevier.com/content/object/eid/1-s2.0-S0926860X17300194-gr8_lrg.jpg?httpAccept=%2A%2F%2A",
            "@multimediatype": "JPEG image file",
            "@type": "IMAGE-HIGH-RES",
            "@size": "196786",
            "@ref": "gr8",
            "@mimetype": "image/jpeg"
          },
          {
            "@category": "high",
            "@height": "1271",
            "@width": "1250",
            "@_fa": "true",
            "$": "https://api.elsevier.com/content/object/eid/1-s2.0-S0926860X17300194-gr9_lrg.jpg?httpAccept=%2A%2F%2A",
            "@multimediatype": "JPEG image file",
            "@type": "IMAGE-HIGH-RES",
            "@size": "122934",
            "@ref": "gr9",
            "@mimetype": "image/jpeg"
          },
          {
            "@category": "high",
            "@height": "3139",
            "@width": "2500",
            "@_fa": "true",
            "$": "https://api.elsevier.com/content/object/eid/1-s2.0-S0926860X17300194-sc1_lrg.jpg?httpAccept=%2A%2F%2A",
            "@multimediatype": "JPEG image file",
            "@type": "IMAGE-HIGH-RES",
            "@size": "489596",
            "@ref": "sc1",
            "@mimetype": "image/jpeg"
          },
          {
            "@category": "standard",
            "@_fa": "true",
            "$": "https://api.elsevier.com/content/object/eid/1-s2.0-S0926860X17300194-mmc1.doc?httpAccept=%2A%2F%2A",
            "@multimediatype": "Microsoft Word file",
            "@type": "APPLICATION",
            "@size": "3299840",
            "@ref": "mmc1",
            "@mimetype": "application/word"
          },
          {
            "@category": "thumbnail",
            "@height": "35",
            "@width": "435",
            "@_fa": "true",
            "$": "https://api.elsevier.com/content/object/eid/1-s2.0-S0926860X17300194-si1.gif?httpAccept=%2A%2F%2A",
            "@multimediatype": "GIF image file",
            "@type": "ALTIMG",
            "@size": "1770",
            "@ref": "si1",
            "@mimetype": "image/gif"
          }
        ]
      },
      "link": {
        "@rel": "abstract",
        "@href": "https://api.elsevier.com/content/abstract/scopus_id/85010190553"
      }
    }
  }
}