{
  "metadata": {
    "title": "Effect of leaching temperature on structure and performance of Raney Cu catalysts for hydrogenation of dimethyl oxalate",
    "authors": "; ; ",
    "journal": "Applied Catalysis A: General",
    "date": "2016-01-05",
    "doi": "10.1016/j.apcata.2015.10.029",
    "abstract": "",
    "uri": "https://api.elsevier.com/content/article/pii/S0926860X15302064",
    "pii": "S0926860X15302064"
  },
  "fulltext": {
    "full-text-retrieval-response": {
      "scopus-eid": "2-s2.0-84947260353",
      "originalText": "serial JL 271346 291210 291744 291809 31 Applied Catalysis A: General APPLIEDCATALYSISAGENERAL 2015-10-26 2015-10-26 2015-11-19 2015-11-19 2015-12-17T16:54:56 1-s2.0-S0926860X15302064 S0926-860X(15)30206-4 S0926860X15302064 10.1016/j.apcata.2015.10.029 S300 S300.1 FULL-TEXT 1-s2.0-S0926860X15X00184 2025-07-16T14:33:53.326206Z 0 0 20160105 2016 2015-10-26T15:56:30.269945Z absattachment articleinfo articletitlenorm authfirstinitialnorm authfirstsurnamenorm cid cids contenttype copyright crossmark dateloaded dateloadedtxt datesearch datesort dateupdated dco docsubtype doctype doi eid ewtransactionid hubeid indexeddate issn issnnorm itemstage itemtransactionid itemweight openaccess openarchive pg pgfirst pglast pii piinorm pubdatestart pubdatetxt pubyr sectiontitle sortorder srctitle srctitlenorm srctype ssids alllist content subj subheadings suppl tomb volfirst volissue volumelist webpdf webpdfpagecount yearnav figure table body acknowledge affil articletitle auth authfirstini authfull authkeywords authlast grantnumber grantsponsor highlightsabst primabst ref specialabst 0926-860X 0926860X true 509 509 C Volume 509 19 153 160 153 160 20160105 5 January 2016 2016-01-05 2016 Articles article fla Copyright © 2015 Elsevier B.V. All rights reserved. EFFECTLEACHINGTEMPERATURESTRUCTUREPERFORMANCERANEYCUCATALYSTSFORHYDROGENATIONDIMETHYLOXALATE KONG X 1 Introduction 2 Experimental 2.1 Preparation of catalysts 2.2 Catalyst characterizations 2.3 Evaluations of catalytic performance 3 Results 3.1 Textural properties of catalysts 3.2 Crystallite structure of catalysts 3.3 SEM and TEM results 3.4 Reduction behavior of catalysts 3.5 Hydrogen adsorption properties 3.6 Catalytic performance of Raney Cu catalysts 4 Discussions 4.1 The evolution of structural and surface properties 4.2 The structure–performance relationships 5 Conclusions Acknowledgment References YIN 2011 90 99 A YUE 2012 4218 4244 H HAYASHI 2006 210 213 T YIN 2011 77 88 A HE 1999 127 134 D SUN 2009 678 681 Y JIN 2014 158 174 E PRUETT 1981 11 16 R ZHAO 2013 142 150 S ZHENG 2013 2738 2749 X YAMAMOTO 2010 103 110 Y XU 1996 2371 2378 G GONG 2012 13922 13925 J HE 2011 54 63 Z YIN 2011 77 88 A ZHENG 2013 110 118 J CHEN 2008 172 180 L YIN 2008 91 99 A ZHENG 2013 129 133 J WEN 2015 483 493 C YIN 2011 90 99 A YIN 2010 4348 4350 A YIN 2010 4348 4350 A WEN 2013 82 89 C ZHU 2014 3675 3681 Y MA 2000 499 505 L HUANG 2004 235 243 X TOYIR 1998 267 272 J TOMSETT 1984 43 48 A EVANS 1983 355 362 J THOMAS 1992 101 114 D FAN 1989 53 58 C TOMSETT 1984 43 48 A YUAN 2011 431 440 Z CURRYHYDE 1991 89 94 H MELLOR 1997 171 183 J BIRKENSTOCK 1985 55 67 U TANABE 2006 153 157 T MUHLER 1992 241 249 M GENGER 1999 137 141 T FRIEDRICH 1984 63 171 B TOMSETT 1987 321 328 A VOORHEES 2015 1081 1088 P SMITH 2005 127 142 A LIN 2012 1177 1179 J TONNER 1984 384 388 S BARBIER 1985 323 330 J ONUOHA 1984 1 12 N KONGX2016X153 KONGX2016X153X160 KONGX2016X153XX KONGX2016X153X160XX 2017-11-19T00:00:00Z http://creativecommons.org/licenses/by-nc-nd/4.0/ 2021-03-14T23:15:34.835Z http://vtw.elsevier.com/data/voc/AddOnTypes/50.7/nlp S0926860X15302064 Natural Science Foundation of China 21373254 NSFC National Natural Science Foundation of China http://data.elsevier.com/vocabulary/SciValFunders/501100001809 http://sws.geonames.org/1814991/ Financial support from Natural Science Foundation of China (Grant No. 21373254 ) are gratefully acknowledged. item S0926-860X(15)30206-4 S0926860X15302064 1-s2.0-S0926860X15302064 10.1016/j.apcata.2015.10.029 271346 2024-01-01T12:30:29.635264Z 2016-01-05 1-s2.0-S0926860X15302064-main.pdf https://s3-eu-west-1.amazonaws.com/prod-ucs-content-store-eu-west/content/pii:S0926860X15302064/MAIN/application/pdf/a1d0872cdefe7bb08bacbbe9a0e2f534/main.pdf https://s3.amazonaws.com/prod-ucs-content-store-us-east/content/pii:S0926860X15302064/MAIN/application/pdf/a1d0872cdefe7bb08bacbbe9a0e2f534/main.pdf main.pdf pdf true 1904166 MAIN 8 1-s2.0-S0926860X15302064-main_1.png https://s3-eu-west-1.amazonaws.com/prod-ucs-content-store-eu-west/content/pii:S0926860X15302064/PREVIEW/image/png/c8349fa95330c8d4411e76994e1dce50/main_1.png https://s3.amazonaws.com/prod-ucs-content-store-us-east/content/pii:S0926860X15302064/PREVIEW/image/png/c8349fa95330c8d4411e76994e1dce50/main_1.png main_1.png png 57443 849 656 IMAGE-WEB-PDF 1 1-s2.0-S0926860X15302064-fx1.sml https://s3-eu-west-1.amazonaws.com/prod-ucs-content-store-eu-west/content/pii:S0926860X15302064/fx1/THUMBNAIL/image/gif/33f6610fda77b3273f46e2504fd8c6cb/fx1.sml https://s3.amazonaws.com/prod-ucs-content-store-us-east/content/pii:S0926860X15302064/fx1/THUMBNAIL/image/gif/33f6610fda77b3273f46e2504fd8c6cb/fx1.sml fx1 true fx1.sml sml 4698 88 219 IMAGE-THUMBNAIL 1-s2.0-S0926860X15302064-gr1.sml https://s3-eu-west-1.amazonaws.com/prod-ucs-content-store-eu-west/content/pii:S0926860X15302064/gr1/THUMBNAIL/image/gif/472929955dcf9cfe921a3901ac7479f3/gr1.sml https://s3.amazonaws.com/prod-ucs-content-store-us-east/content/pii:S0926860X15302064/gr1/THUMBNAIL/image/gif/472929955dcf9cfe921a3901ac7479f3/gr1.sml gr1 gr1.sml sml 14762 164 204 IMAGE-THUMBNAIL 1-s2.0-S0926860X15302064-gr10.sml https://s3-eu-west-1.amazonaws.com/prod-ucs-content-store-eu-west/content/pii:S0926860X15302064/gr10/THUMBNAIL/image/gif/853d1ccd126713664d9e5240aecd7403/gr10.sml https://s3.amazonaws.com/prod-ucs-content-store-us-east/content/pii:S0926860X15302064/gr10/THUMBNAIL/image/gif/853d1ccd126713664d9e5240aecd7403/gr10.sml gr10 gr10.sml sml 12433 160 219 IMAGE-THUMBNAIL 1-s2.0-S0926860X15302064-gr11.sml https://s3-eu-west-1.amazonaws.com/prod-ucs-content-store-eu-west/content/pii:S0926860X15302064/gr11/THUMBNAIL/image/gif/848aba543694fd8aac08f77a0cb4de8e/gr11.sml https://s3.amazonaws.com/prod-ucs-content-store-us-east/content/pii:S0926860X15302064/gr11/THUMBNAIL/image/gif/848aba543694fd8aac08f77a0cb4de8e/gr11.sml gr11 gr11.sml sml 10185 164 211 IMAGE-THUMBNAIL 1-s2.0-S0926860X15302064-gr2.sml https://s3-eu-west-1.amazonaws.com/prod-ucs-content-store-eu-west/content/pii:S0926860X15302064/gr2/THUMBNAIL/image/gif/1e6d73981b384e1a115b6a3198429e7b/gr2.sml https://s3.amazonaws.com/prod-ucs-content-store-us-east/content/pii:S0926860X15302064/gr2/THUMBNAIL/image/gif/1e6d73981b384e1a115b6a3198429e7b/gr2.sml gr2 gr2.sml sml 13651 163 104 IMAGE-THUMBNAIL 1-s2.0-S0926860X15302064-gr3.sml https://s3-eu-west-1.amazonaws.com/prod-ucs-content-store-eu-west/content/pii:S0926860X15302064/gr3/THUMBNAIL/image/gif/749c11be1d7351b597a23417406d0986/gr3.sml https://s3.amazonaws.com/prod-ucs-content-store-us-east/content/pii:S0926860X15302064/gr3/THUMBNAIL/image/gif/749c11be1d7351b597a23417406d0986/gr3.sml gr3 gr3.sml sml 27676 107 219 IMAGE-THUMBNAIL 1-s2.0-S0926860X15302064-gr4.sml https://s3-eu-west-1.amazonaws.com/prod-ucs-content-store-eu-west/content/pii:S0926860X15302064/gr4/THUMBNAIL/image/gif/c78565cbd26af365a659b879239ff763/gr4.sml https://s3.amazonaws.com/prod-ucs-content-store-us-east/content/pii:S0926860X15302064/gr4/THUMBNAIL/image/gif/c78565cbd26af365a659b879239ff763/gr4.sml gr4 gr4.sml sml 29917 159 219 IMAGE-THUMBNAIL 1-s2.0-S0926860X15302064-gr5.sml https://s3-eu-west-1.amazonaws.com/prod-ucs-content-store-eu-west/content/pii:S0926860X15302064/gr5/THUMBNAIL/image/gif/afe5bacce442573ad997c4c1148f6cd9/gr5.sml https://s3.amazonaws.com/prod-ucs-content-store-us-east/content/pii:S0926860X15302064/gr5/THUMBNAIL/image/gif/afe5bacce442573ad997c4c1148f6cd9/gr5.sml gr5 gr5.sml sml 15569 164 210 IMAGE-THUMBNAIL 1-s2.0-S0926860X15302064-gr6.sml https://s3-eu-west-1.amazonaws.com/prod-ucs-content-store-eu-west/content/pii:S0926860X15302064/gr6/THUMBNAIL/image/gif/3c0784171a2e13d1ff3d237d4f9c2fb7/gr6.sml https://s3.amazonaws.com/prod-ucs-content-store-us-east/content/pii:S0926860X15302064/gr6/THUMBNAIL/image/gif/3c0784171a2e13d1ff3d237d4f9c2fb7/gr6.sml gr6 gr6.sml sml 16110 164 204 IMAGE-THUMBNAIL 1-s2.0-S0926860X15302064-gr7.sml https://s3-eu-west-1.amazonaws.com/prod-ucs-content-store-eu-west/content/pii:S0926860X15302064/gr7/THUMBNAIL/image/gif/e836ba848e7b8501cfcd2fd597e40ad1/gr7.sml https://s3.amazonaws.com/prod-ucs-content-store-us-east/content/pii:S0926860X15302064/gr7/THUMBNAIL/image/gif/e836ba848e7b8501cfcd2fd597e40ad1/gr7.sml gr7 gr7.sml sml 13369 164 109 IMAGE-THUMBNAIL 1-s2.0-S0926860X15302064-gr8.sml https://s3-eu-west-1.amazonaws.com/prod-ucs-content-store-eu-west/content/pii:S0926860X15302064/gr8/THUMBNAIL/image/gif/507bbc50844224ecc2aea376f64c6385/gr8.sml https://s3.amazonaws.com/prod-ucs-content-store-us-east/content/pii:S0926860X15302064/gr8/THUMBNAIL/image/gif/507bbc50844224ecc2aea376f64c6385/gr8.sml gr8 gr8.sml sml 9606 164 209 IMAGE-THUMBNAIL 1-s2.0-S0926860X15302064-gr9.sml https://s3-eu-west-1.amazonaws.com/prod-ucs-content-store-eu-west/content/pii:S0926860X15302064/gr9/THUMBNAIL/image/gif/969c5440a4d8dbde4465794178ec2f4a/gr9.sml https://s3.amazonaws.com/prod-ucs-content-store-us-east/content/pii:S0926860X15302064/gr9/THUMBNAIL/image/gif/969c5440a4d8dbde4465794178ec2f4a/gr9.sml gr9 gr9.sml sml 16370 164 211 IMAGE-THUMBNAIL 1-s2.0-S0926860X15302064-sc1.sml https://s3-eu-west-1.amazonaws.com/prod-ucs-content-store-eu-west/content/pii:S0926860X15302064/sc1/THUMBNAIL/image/gif/140ff6d5d88e9b7ffe63c8042c5dae05/sc1.sml https://s3.amazonaws.com/prod-ucs-content-store-us-east/content/pii:S0926860X15302064/sc1/THUMBNAIL/image/gif/140ff6d5d88e9b7ffe63c8042c5dae05/sc1.sml sc1 sc1.sml sml 10943 72 219 IMAGE-THUMBNAIL 1-s2.0-S0926860X15302064-fx1.jpg https://s3-eu-west-1.amazonaws.com/prod-ucs-content-store-eu-west/content/pii:S0926860X15302064/fx1/DOWNSAMPLED/image/jpeg/fca313362839f4aceeff136222196257/fx1.jpg https://s3.amazonaws.com/prod-ucs-content-store-us-east/content/pii:S0926860X15302064/fx1/DOWNSAMPLED/image/jpeg/fca313362839f4aceeff136222196257/fx1.jpg fx1 true fx1.jpg jpg 19106 200 500 IMAGE-DOWNSAMPLED 1-s2.0-S0926860X15302064-gr1.jpg https://s3-eu-west-1.amazonaws.com/prod-ucs-content-store-eu-west/content/pii:S0926860X15302064/gr1/DOWNSAMPLED/image/jpeg/f3df72e30e6ec850af6a5cee9134f436/gr1.jpg https://s3.amazonaws.com/prod-ucs-content-store-us-east/content/pii:S0926860X15302064/gr1/DOWNSAMPLED/image/jpeg/f3df72e30e6ec850af6a5cee9134f436/gr1.jpg gr1 gr1.jpg jpg 46765 314 391 IMAGE-DOWNSAMPLED 1-s2.0-S0926860X15302064-gr10.jpg https://s3-eu-west-1.amazonaws.com/prod-ucs-content-store-eu-west/content/pii:S0926860X15302064/gr10/DOWNSAMPLED/image/jpeg/a8b06f4ddbc38cee06f4e9120f706f4c/gr10.jpg https://s3.amazonaws.com/prod-ucs-content-store-us-east/content/pii:S0926860X15302064/gr10/DOWNSAMPLED/image/jpeg/a8b06f4ddbc38cee06f4e9120f706f4c/gr10.jpg gr10 gr10.jpg jpg 37205 286 391 IMAGE-DOWNSAMPLED 1-s2.0-S0926860X15302064-gr11.jpg https://s3-eu-west-1.amazonaws.com/prod-ucs-content-store-eu-west/content/pii:S0926860X15302064/gr11/DOWNSAMPLED/image/jpeg/d3b8288ca6233bc9ed1ed6601525e0ef/gr11.jpg https://s3.amazonaws.com/prod-ucs-content-store-us-east/content/pii:S0926860X15302064/gr11/DOWNSAMPLED/image/jpeg/d3b8288ca6233bc9ed1ed6601525e0ef/gr11.jpg gr11 gr11.jpg jpg 32104 303 391 IMAGE-DOWNSAMPLED 1-s2.0-S0926860X15302064-gr2.jpg https://s3-eu-west-1.amazonaws.com/prod-ucs-content-store-eu-west/content/pii:S0926860X15302064/gr2/DOWNSAMPLED/image/jpeg/03efe61c87754035af1cc6ed6f7c5f15/gr2.jpg https://s3.amazonaws.com/prod-ucs-content-store-us-east/content/pii:S0926860X15302064/gr2/DOWNSAMPLED/image/jpeg/03efe61c87754035af1cc6ed6f7c5f15/gr2.jpg gr2 gr2.jpg jpg 86480 615 393 IMAGE-DOWNSAMPLED 1-s2.0-S0926860X15302064-gr3.jpg https://s3-eu-west-1.amazonaws.com/prod-ucs-content-store-eu-west/content/pii:S0926860X15302064/gr3/DOWNSAMPLED/image/jpeg/4649d2bd8e2c90c4a3b864d268b0c203/gr3.jpg https://s3.amazonaws.com/prod-ucs-content-store-us-east/content/pii:S0926860X15302064/gr3/DOWNSAMPLED/image/jpeg/4649d2bd8e2c90c4a3b864d268b0c203/gr3.jpg gr3 gr3.jpg jpg 94997 313 640 IMAGE-DOWNSAMPLED 1-s2.0-S0926860X15302064-gr4.jpg https://s3-eu-west-1.amazonaws.com/prod-ucs-content-store-eu-west/content/pii:S0926860X15302064/gr4/DOWNSAMPLED/image/jpeg/d6309ac5810eaac7d0a3037383eee192/gr4.jpg https://s3.amazonaws.com/prod-ucs-content-store-us-east/content/pii:S0926860X15302064/gr4/DOWNSAMPLED/image/jpeg/d6309ac5810eaac7d0a3037383eee192/gr4.jpg gr4 gr4.jpg jpg 97929 463 640 IMAGE-DOWNSAMPLED 1-s2.0-S0926860X15302064-gr5.jpg https://s3-eu-west-1.amazonaws.com/prod-ucs-content-store-eu-west/content/pii:S0926860X15302064/gr5/DOWNSAMPLED/image/jpeg/5ec94fdeeae27553e7e611435d438ff4/gr5.jpg https://s3.amazonaws.com/prod-ucs-content-store-us-east/content/pii:S0926860X15302064/gr5/DOWNSAMPLED/image/jpeg/5ec94fdeeae27553e7e611435d438ff4/gr5.jpg gr5 gr5.jpg jpg 46889 306 391 IMAGE-DOWNSAMPLED 1-s2.0-S0926860X15302064-gr6.jpg https://s3-eu-west-1.amazonaws.com/prod-ucs-content-store-eu-west/content/pii:S0926860X15302064/gr6/DOWNSAMPLED/image/jpeg/00484c9c1a9ac51adf3f48bedeba2bc6/gr6.jpg https://s3.amazonaws.com/prod-ucs-content-store-us-east/content/pii:S0926860X15302064/gr6/DOWNSAMPLED/image/jpeg/00484c9c1a9ac51adf3f48bedeba2bc6/gr6.jpg gr6 gr6.jpg jpg 51732 313 390 IMAGE-DOWNSAMPLED 1-s2.0-S0926860X15302064-gr7.jpg https://s3-eu-west-1.amazonaws.com/prod-ucs-content-store-eu-west/content/pii:S0926860X15302064/gr7/DOWNSAMPLED/image/jpeg/e663fe6bdb47c374ebd6f8b7c975e978/gr7.jpg https://s3.amazonaws.com/prod-ucs-content-store-us-east/content/pii:S0926860X15302064/gr7/DOWNSAMPLED/image/jpeg/e663fe6bdb47c374ebd6f8b7c975e978/gr7.jpg gr7 gr7.jpg jpg 73071 586 390 IMAGE-DOWNSAMPLED 1-s2.0-S0926860X15302064-gr8.jpg https://s3-eu-west-1.amazonaws.com/prod-ucs-content-store-eu-west/content/pii:S0926860X15302064/gr8/DOWNSAMPLED/image/jpeg/3c0c9ca2ade5409ae30cb04df9b6e2c7/gr8.jpg https://s3.amazonaws.com/prod-ucs-content-store-us-east/content/pii:S0926860X15302064/gr8/DOWNSAMPLED/image/jpeg/3c0c9ca2ade5409ae30cb04df9b6e2c7/gr8.jpg gr8 gr8.jpg jpg 32134 307 391 IMAGE-DOWNSAMPLED 1-s2.0-S0926860X15302064-gr9.jpg https://s3-eu-west-1.amazonaws.com/prod-ucs-content-store-eu-west/content/pii:S0926860X15302064/gr9/DOWNSAMPLED/image/jpeg/7ae906646ad5d14fb1bbd4fb92e86b96/gr9.jpg https://s3.amazonaws.com/prod-ucs-content-store-us-east/content/pii:S0926860X15302064/gr9/DOWNSAMPLED/image/jpeg/7ae906646ad5d14fb1bbd4fb92e86b96/gr9.jpg gr9 gr9.jpg jpg 59759 305 393 IMAGE-DOWNSAMPLED 1-s2.0-S0926860X15302064-sc1.jpg https://s3-eu-west-1.amazonaws.com/prod-ucs-content-store-eu-west/content/pii:S0926860X15302064/sc1/DOWNSAMPLED/image/jpeg/14d4e0bdd12126fcf355dbb180b32ff0/sc1.jpg https://s3.amazonaws.com/prod-ucs-content-store-us-east/content/pii:S0926860X15302064/sc1/DOWNSAMPLED/image/jpeg/14d4e0bdd12126fcf355dbb180b32ff0/sc1.jpg sc1 sc1.jpg jpg 40925 186 565 IMAGE-DOWNSAMPLED 1-s2.0-S0926860X15302064-fx1_lrg.jpg https://s3-eu-west-1.amazonaws.com/prod-ucs-content-store-eu-west/content/pii:S0926860X15302064/fx1/HIGHRES/image/jpeg/eaa10896489d0c910feff7fdf7b08b26/fx1_lrg.jpg https://s3.amazonaws.com/prod-ucs-content-store-us-east/content/pii:S0926860X15302064/fx1/HIGHRES/image/jpeg/eaa10896489d0c910feff7fdf7b08b26/fx1_lrg.jpg fx1 true fx1_lrg.jpg jpg 130889 886 2213 IMAGE-HIGH-RES 1-s2.0-S0926860X15302064-gr1_lrg.jpg https://s3-eu-west-1.amazonaws.com/prod-ucs-content-store-eu-west/content/pii:S0926860X15302064/gr1/HIGHRES/image/jpeg/cc483e379918a8fc2f085cd7d9929c38/gr1_lrg.jpg https://s3.amazonaws.com/prod-ucs-content-store-us-east/content/pii:S0926860X15302064/gr1/HIGHRES/image/jpeg/cc483e379918a8fc2f085cd7d9929c38/gr1_lrg.jpg gr1 gr1_lrg.jpg jpg 221273 1391 1731 IMAGE-HIGH-RES 1-s2.0-S0926860X15302064-gr10_lrg.jpg https://s3-eu-west-1.amazonaws.com/prod-ucs-content-store-eu-west/content/pii:S0926860X15302064/gr10/HIGHRES/image/jpeg/fcead6132eb855fa5d74ce0d4611237d/gr10_lrg.jpg https://s3.amazonaws.com/prod-ucs-content-store-us-east/content/pii:S0926860X15302064/gr10/HIGHRES/image/jpeg/fcead6132eb855fa5d74ce0d4611237d/gr10_lrg.jpg gr10 gr10_lrg.jpg jpg 183244 1267 1732 IMAGE-HIGH-RES 1-s2.0-S0926860X15302064-gr11_lrg.jpg https://s3-eu-west-1.amazonaws.com/prod-ucs-content-store-eu-west/content/pii:S0926860X15302064/gr11/HIGHRES/image/jpeg/f5738b4e6042d3f340856e881e051b6a/gr11_lrg.jpg https://s3.amazonaws.com/prod-ucs-content-store-us-east/content/pii:S0926860X15302064/gr11/HIGHRES/image/jpeg/f5738b4e6042d3f340856e881e051b6a/gr11_lrg.jpg gr11 gr11_lrg.jpg jpg 141386 1343 1733 IMAGE-HIGH-RES 1-s2.0-S0926860X15302064-gr2_lrg.jpg https://s3-eu-west-1.amazonaws.com/prod-ucs-content-store-eu-west/content/pii:S0926860X15302064/gr2/HIGHRES/image/jpeg/aed72ccc5d88a2945333c8aa65f8e43a/gr2_lrg.jpg https://s3.amazonaws.com/prod-ucs-content-store-us-east/content/pii:S0926860X15302064/gr2/HIGHRES/image/jpeg/aed72ccc5d88a2945333c8aa65f8e43a/gr2_lrg.jpg gr2 gr2_lrg.jpg jpg 524850 2727 1742 IMAGE-HIGH-RES 1-s2.0-S0926860X15302064-gr3_lrg.jpg https://s3-eu-west-1.amazonaws.com/prod-ucs-content-store-eu-west/content/pii:S0926860X15302064/gr3/HIGHRES/image/jpeg/39a8affb089ec857efab19c51a021bea/gr3_lrg.jpg https://s3.amazonaws.com/prod-ucs-content-store-us-east/content/pii:S0926860X15302064/gr3/HIGHRES/image/jpeg/39a8affb089ec857efab19c51a021bea/gr3_lrg.jpg gr3 gr3_lrg.jpg jpg 334222 832 1700 IMAGE-HIGH-RES 1-s2.0-S0926860X15302064-gr4_lrg.jpg https://s3-eu-west-1.amazonaws.com/prod-ucs-content-store-eu-west/content/pii:S0926860X15302064/gr4/HIGHRES/image/jpeg/644256c544d86427156dfd4a4ad17334/gr4_lrg.jpg https://s3.amazonaws.com/prod-ucs-content-store-us-east/content/pii:S0926860X15302064/gr4/HIGHRES/image/jpeg/644256c544d86427156dfd4a4ad17334/gr4_lrg.jpg gr4 gr4_lrg.jpg jpg 358757 1231 1700 IMAGE-HIGH-RES 1-s2.0-S0926860X15302064-gr5_lrg.jpg https://s3-eu-west-1.amazonaws.com/prod-ucs-content-store-eu-west/content/pii:S0926860X15302064/gr5/HIGHRES/image/jpeg/57a12946884343b1995496d3b7ede62a/gr5_lrg.jpg https://s3.amazonaws.com/prod-ucs-content-store-us-east/content/pii:S0926860X15302064/gr5/HIGHRES/image/jpeg/57a12946884343b1995496d3b7ede62a/gr5_lrg.jpg gr5 gr5_lrg.jpg jpg 248668 1356 1734 IMAGE-HIGH-RES 1-s2.0-S0926860X15302064-gr6_lrg.jpg https://s3-eu-west-1.amazonaws.com/prod-ucs-content-store-eu-west/content/pii:S0926860X15302064/gr6/HIGHRES/image/jpeg/8b54a5dee0fc16d2786804489ed5839d/gr6_lrg.jpg https://s3.amazonaws.com/prod-ucs-content-store-us-east/content/pii:S0926860X15302064/gr6/HIGHRES/image/jpeg/8b54a5dee0fc16d2786804489ed5839d/gr6_lrg.jpg gr6 gr6_lrg.jpg jpg 255284 1387 1730 IMAGE-HIGH-RES 1-s2.0-S0926860X15302064-gr7_lrg.jpg https://s3-eu-west-1.amazonaws.com/prod-ucs-content-store-eu-west/content/pii:S0926860X15302064/gr7/HIGHRES/image/jpeg/b5871ef577253ef05e33326022c5f6d9/gr7_lrg.jpg https://s3.amazonaws.com/prod-ucs-content-store-us-east/content/pii:S0926860X15302064/gr7/HIGHRES/image/jpeg/b5871ef577253ef05e33326022c5f6d9/gr7_lrg.jpg gr7 gr7_lrg.jpg jpg 423952 2598 1729 IMAGE-HIGH-RES 1-s2.0-S0926860X15302064-gr8_lrg.jpg https://s3-eu-west-1.amazonaws.com/prod-ucs-content-store-eu-west/content/pii:S0926860X15302064/gr8/HIGHRES/image/jpeg/2f95bf5c9551d1dfcd4ce0fc149dac21/gr8_lrg.jpg https://s3.amazonaws.com/prod-ucs-content-store-us-east/content/pii:S0926860X15302064/gr8/HIGHRES/image/jpeg/2f95bf5c9551d1dfcd4ce0fc149dac21/gr8_lrg.jpg gr8 gr8_lrg.jpg jpg 140549 1360 1731 IMAGE-HIGH-RES 1-s2.0-S0926860X15302064-gr9_lrg.jpg https://s3-eu-west-1.amazonaws.com/prod-ucs-content-store-eu-west/content/pii:S0926860X15302064/gr9/HIGHRES/image/jpeg/9e816ccfce353d4e75a72911b56f8f38/gr9_lrg.jpg https://s3.amazonaws.com/prod-ucs-content-store-us-east/content/pii:S0926860X15302064/gr9/HIGHRES/image/jpeg/9e816ccfce353d4e75a72911b56f8f38/gr9_lrg.jpg gr9 gr9_lrg.jpg jpg 283170 1354 1742 IMAGE-HIGH-RES 1-s2.0-S0926860X15302064-sc1_lrg.jpg https://s3-eu-west-1.amazonaws.com/prod-ucs-content-store-eu-west/content/pii:S0926860X15302064/sc1/HIGHRES/image/jpeg/ebd68a55ccb10c7d20cbf0961eea9f86/sc1_lrg.jpg https://s3.amazonaws.com/prod-ucs-content-store-us-east/content/pii:S0926860X15302064/sc1/HIGHRES/image/jpeg/ebd68a55ccb10c7d20cbf0961eea9f86/sc1_lrg.jpg sc1 sc1_lrg.jpg jpg 218215 824 2500 IMAGE-HIGH-RES APCATA 15605 S0926-860X(15)30206-4 10.1016/j.apcata.2015.10.029 Elsevier B.V. Scheme 1 Structural evolution over the Raney Cu catalyst upon increasing leaching temperatures. Fig. 1 Profiles of pore size distribution of the passivated Raney Cu catalysts. Fig. 2 XRD patterns of the Cu–Al alloy precursor and passivated Raney Cu samples (A), and the activated (B). Fig. 3 SEM images of the passivated Raney Cu samples: (a) Ro-20, (b) Ro-30, (c) Ro-40, (d and e) Ro-50, and (f) Ro-60. Fig. 4 TEM images of the Cu–Al alloy and reduced R-T samples: (a) alloy, (b) R-20, (c) R-30, (d) R-40, (e) R-50, and (f) R-60. Fig. 5 H2-TPR profiles of the alloy and Ro-T samples. Fig. 6 H2-TPD profiles of the Cu–Al alloy and activated R-T samples. Fig. 7 DMO Conversion, EG Selectivity and MG Selectivity of the Raney Cu catalysts with the stream time (A). Long time catalytic test over the R-40 catalyst (B). Fig. 8 Cu particle sizes as a function of the leaching temperature. Fig. 9 XRD patterns of the spent Raney Cu samples. Fig. 10 Thermogravimetric analysis of the spent R-50 catalyst. Fig. 11 TPO profiles of the spent R-50 catalyst. Table 1 Physicochemical property of catalysts. Catalyst Al (wt%) a S BET (m2/g) V p (cm3/g) D A p (nm)d D c Cu (nm) S Cu (m2/g) b Cu dispersion (%) b Ro-20 21.4 45.7 0.051 4.7 8.6 2.4 32.7(±0.3%) Ro-30 20.9 49.0 0.071 5.2 12.4 2.5 23.3(±0.3%) Ro-40 12.2 29.9 0.136 19.9 14.5 2.4 17.8(±0.3%) Ro-50 5.5 20.8 0.121 19.8 17.6 2.3 11.6(±0.3%) Ro-60 6.4 33.6 0.102 1.8 15.6 4.0 23.8(±0.3%) a Al element contents were determined by ICP-OES analysis. b S Cu and copper dispersion (D Cu) were measured by N2O adsorption. c D Cu were calculated from the reflections of Cu (111) and CuO (111) planes in the XRD using the Scherrer equation. Table 2 Cu2O, CuO particle percent calculated from disintegration of H2-TPR peaks. R-20 R-30 R-40 R-50 R-60 LT peak area 205.9 331.0 342.8 552.4 607.1 HT peak area 61.5 28.4 23.9 627.3 563.5 LT peak percent (%) 77.0 92.1 93.5 46.8 51.9 Effect of leaching temperature on structure and performance of Raney Cu catalysts for hydrogenation of dimethyl oxalate Xiangpeng Kong a b Cailian Ma a b Juan Zhang a Jiaqiang Sun a Jiangang Chen a ⁎ Kefeng Liu c a State Key Laboratory of Coal Conversion, Institute of Coal Chemistry, Chinese Academy of Sciences, Taiyuan, 030001 Shanxi, PR China State Key Laboratory of Coal Conversion Institute of Coal Chemistry Chinese Academy of Sciences Taiyuan Shanxi 030001 PR China b University of Chinese Academy of Sciences, Beijing 100049, PR China University of Chinese Academy of Sciences Beijing 100049 PR China c Petro China Petrochemical Research Institute, Beijing 100195, PR China Petro China Petrochemical Research Institute Beijing 100195 PR China ⁎ Corresponding author. Graphical abstract As-synthesized Raney Cu catalysts through selective leaching of Cu–Al (50wt%Cu–50wt%Al) alloy pellets in sodium hydroxide solution have been systematically investigated during the catalyst preparation process. Results reveal that the microstructures, physicochemical and surface properties of the Raney Cu catalysts depend profoundly on the leaching temperature. In gas-phase hydrogenation of dimethyl oxalate (DMO), the Raney Cu catalysts prepared at the mild leaching conditions tend to deactivate rapidly, the formation of methyl glycolate (MG). As-prepared catalysts at higher leaching temperature exhibit excellent stability, favoring the synthesis of ethylene glycol (EG). Especially, Raney Cu catalyst obtained at 40°C shows the superior stability and MG selectivity of 95.0% in DMO hydrogenation. Furthermore, the reasons for deactivation of Raney Cu catalyst in DMO hydrogenation have been discussed in detail. Keywords Raney Cu Hydrogenation Dimethyl oxalate Ethylene glycol Methyl glycolate 1 Introduction Methyl glycolate (MG) and Ethylene glycol (EG), as essential organic compounds and intermediates, are widely applied in various chemical fields [1,2]. To date, varieties of synthesis approaches of MG and EG have been researched and developed, such as, selective oxidation of primary alcohol [3], hydrolysis of ethylene oxide [4], condensation of formaldehyde and methyl formate [5], and carbonylation of HCHO [6]. Nevertheless, there are several disadvantages (e.g., harsh reaction conditions, low target product yield, shrinking of the crude oil resource, high cost and excessive energy consumption) of these routes. Therefore, it is essential to research and develop a novel and practical route. Recently, the synthesis of EG or MG from syngas rather than crude oil resource, has attracted considerable interests in the both academic and business circles owing to abundance and low-price of syngas [7,8]. Remarkably, an indirect technology from syngas to EG and MG, including the coupling of CO with nitrite esters to dimethyl oxalate (DMO) and subsequently selective hydrogenation to MG or EG, was successfully demonstrated by a pilot plant, accelerating greatly the commercialization process [9–11]. However, there are still plenty of unsolved technical problems. Wherein, one of the most vital problems is the poor performance of the DMO selective hydrogenation catalyst in the terms of selectivity, activity and stability [12]. Being aware of the difficulties in the catalyst-product separation for homogeneous catalysts, Cu and Ag based catalysts have been considered as the potential candidate for commercial production of MG or EG by selective hydrogenation of DMO [13–23]. Nevertheless, the selective hydrogenation of DMO to MG over the Cu based catalysts is facing with the great challenge of the overabundant hydrogenation ability of Cu species, which results in the behavior of MG excessive hydrogenation to EG [24]. In addition, the local overheating from exothermic DMO hydrogenation and poor thermal conductance of the metallic oxide support results in serious sintering of Cu nanoparticle [25]. For the Ag based catalysts, the high price and low efficiency limit their further applications in the industrial field. As a result, it is urgent to develop an economic and efficient non-noble metal based catalyst. Raney Cu catalysts have been widely used in several hydrogenation and dehydrogenation processes [26–28]. It is well known that the mesoporous structure, high Cu0 surface area and thermal conductivity features of Raney Cu catalyst endow it with excellent hydrogenation performance [29,30]. Previous studies proposed that the performance of Raney Cu catalysts in ester hydrogenation was comparable to that of the commercial Cu–Cr and co-precipitated Cu–Zn–Al catalysts [31]. Thomas et al. [32] reported the Raney Cu catalyst showed excellent performance in oxalate ester hydrogenation, but suffered from severe deactivation. However, the close relationship between the essential structure features and stability of Raney Cu catalysts in the hydrogenation reaction has not been systematically investigated up to now, which is of great importance for designing the Raney Cu catalyst. In this work, Raney Cu catalysts with different structure features were prepared by controlling the leaching temperature in the preparation process. Moreover, an intrinsic relationship between microcosmic structures and macroscopical performance in DMO hydrogenation for Raney Cu catalysts was investigated. Our results provided the essential information for the research and development of Raney Cu catalysts with excellent performance in DMO hydrogenation process. 2 Experimental 2.1 Preparation of catalysts Raney Cu catalysts were prepared from crushed and screened Cu–Al alloy (50wt% Cu, 50wt% Al) by selective leaching of aluminum in aqueous sodium hydroxide. In order to control the rate of highly exothermic leaching reaction, the alloy (40.0g) was firstly placed in a beaker containing 100mL of distilled water inside a thermostated water bath at different temperatures (20, 30, 40, 50, and 60°C). Then 80mL of NaOH solution (40wt%) was added dropwise into the solution during 90min period, and the alloy was allowed to digest for further 90min. After that, the catalyst was washed several times with deionized water to remove any residual Al compound until the pH value of washed water is 7.0. Finally, the fresh Raney Cu catalysts were passivated in a continuous-flow fixed-bed microreactor using nitrous oxide at 200°C for 1h, which has been described in detail elsewhere [33,34]. The Raney Cu catalysts after passivation were denoted as Ro-T (T is the leaching temperature), and corresponding activated Raney Cu catalysts were denoted as R-T. 2.2 Catalyst characterizations The Brunauer–Emmett–Teller (BET) surface area (S BET), pore volume (V p) and average pore size (D p) were tested via N2 physical adsorption at −196°C using a Micromeritics ASAP 2420 instrument. All the samples were degassed under vacuum at 90°C for 1h and then 350°C for 8h before measurement. The number of surface metallic copper sites exposed was determined by N2O oxidation and followed H2 titration using the procedure described by the previous report [35]. X-ray powder diffraction (XRD) patterns of as-prepared catalysts were collected on an advanced X-ray diffractometer (Bruker AXS D8, Germany) with monochromated Cu Kα radiation, and the crystal Cu2O size was calculated using the Scherrer equation. The morphology of catalysts was investigated by scanning electron microscopy (SEM) (JSM-6701F, Japan). Transmission electron microscopy (TEM) images of the catalysts were obtained by using a JEM 2010 microscope operated at 200kV. The catalysts were dispersed in ethanol and mounted on a carbon foil supported on a copper grid. H2 temperature programmed reduction (H2-TPR) was carried out in a conventional atmospheric quartz reactor (5mm i.d.). 30mg of the calcined sample was outgassed at 100°C under Ar for 1h. After cooling to room temperature under Ar, the gas was switched to 5% H2/Ar (volume ratio), and the sample was heated to 600°C at a ramping rate of 10°C/min. The amount of H2 consumed was monitored by a thermal conductivity detector (TCD). The hydrogen adsorption properties of catalyst were measured by H2 temperature-programmed desorption (H2-TPD). In each H2 temperature programmed desorption (H2-TPD), 0.3g of as-prepared calcined sample was loaded into the quartz tube flow reactor and reduced with 5% H2/Ar (50mL/min, volume ratio) at 300°C for 4h. Then the reduced 10 sample was cooled to 80°C and switched to Ar until the baseline of H2 signal leveled off. Afterward, the TPD experiment was started with a heating rate of 15°C/min under Ar flow (40mL/min), and the desorbed H2 was monitored by a TCD of effluent gas. Thermal decomposition of the catalyst precursors was studied by the thermogravimetric (TG) method using a NETZSCH TG209F1 thermal analyzer. Measurements were performed in the temperature range 50–750°C with a linear temperature program b =10°C/min in a continuous flow of Ar atmosphere (30mL/min). Temperature Programmed Oxidation (TPO) was carried out in a conventional atmospheric quartz reactor (5mm i.d.). 300mg of the spent sample was outgassed at 100°C under Ar for 1h. After cooling to room temperature under He, the gas was switched to 5% O2/He (volume ratio), and the sample was heated to 700°C at a ramping rate of 15°C/min. The amount of O2 consumed was monitored by mass spectra. 2.3 Evaluations of catalytic performance The DMO hydrogenation reaction was conducted in continuous flow mode in a stainless steel tubular reactor. Typically, 3.0g of passivated Raney copper catalyst (40–60 meshes) was loaded into the center of the reactor, and both sides of the catalyst bed were packed with quartz powders (40–60 meshes). Before the test, the inert samples were firstly activated in 5% H2/95% N2 (volume ratio) atmosphere at 200°C for 4h with a ramping rate of 2°C /min. After that, 12.5wt% DMO (purity 99.9%) in methanol and H2 were fed into the reactor at a H2/DMO molar ratio of 100. The products were analyzed with a GC-920 gas chromatograph fitted with a DB-FFAP capillary column (30.00m×0.45mm×0.85μm) and a flame ionization detector with relative standard deviation less than 2%. Reaction conditions: T =210°C, P =2.5MPa, and Liquid Hourly Space Velocity (LHSV)=2.0h−1. 3 Results 3.1 Textural properties of catalysts The physicochemical property of the as-prepared Raney Cu samples are summarized in Table 1 . The analysis results of chemical compositions reveals that the Al contents are 21.4wt% and 20.9wt% at the leaching temperatures of 20°C and 30°C, respectively. With the leaching temperature increasing, the residual Al compounds decreased gradually, and the least Al compositions remained in the Ro-50 and Ro-60. Besides, the data of BET surface area, pore volume, and metallic Cu specific area (S Cu) indicate that the S BET of the Ro-T decreases from 49m2/g to 21m2/g when the leaching temperature increasing from 30°C to 50°C, while the V p raises from 0.051cm3/g to 0.136cm3/g. Further elevating the leaching temperature to 60°C causes the increase of S BET adversely to 33m2/g and decline of V p to 0.102cm3/g. Additionally, there is the same change trend for the metallic Cu specific area (S Cu) and S BET of R-T with the varying leaching temperature. The pore size distribution curves derived from the desorption branch using the BJH algorithm (Fig. 1 ) show that the Ro-20 and Ro-30 samples have intense peak at about 4.0nm and 4.5nm, respectively. While the Ro-40 and Ro-50 were mainly composed of well-developed macroporous structure (20–40nm). Nevertheless, increasing the leaching temperature to 60°C results in the decreasing pore size of Ro-60 sample. The rearrangement of the resultant skeletal Cu structure, due to over loss of Al remained in the core in the Raney Cu pellets at the excessively high temperature, was reported to be responsible for the adverse structure change of Ro-60 sample [36]. Therefore, it is inferred that the leaching temperature has remarkable effects on the textural properties and the chemical compositions of the Raney Cu catalysts. 3.2 Crystallite structure of catalysts Fig. 2 A gives the XRD patterns of the Cu–Al alloy precursor and passivated Raney Cu samples. In the aspect of the Cu–Al alloy, there are a series of diffraction peaks assigned to crystalline CuAl2 (JCPDS 65-2695). Besides, three weakened diffraction peaks from Al (JCPDS 04-0787) and Cu9Al4 (JCPDS 24-0003) can be observed, confirming that CuAl2 phase is the main chemical constituent in the precursor [37]. As for the as-prepared Raney Cu catalysts, it is found the passivated Raney Cu catalysts exhibits main diffractions peaks characteristic of Cu2O (JCPDS 05-0677), suggesting the resultant samples should be mainly composed of Cu2O phase. Moreover, the intensity of the diffraction peaks strengthened gradually with the leaching temperature increasing from 20°C to 50°C, implying that Cu crystals in Raney Cu catalysts grow larger gradually. Nevertheless, the higher leaching temperature (60°C) will lead to the intensity of the Cu2O diffractions peaks weakens, indicating the smaller Cu crystals in the R-60. In additional, CuO phase (JCPDS 48-1548) could be found in both the Ro-50 and Ro-60 catalysts, which should be related to the severe preparation conditions. Furthermore, with the leaching temperature increasing, the intensity of the diffraction peaks assigned to CuAl2 weakened gradually and vanished at the leaching temperature higher than 50°C, indicating that crystalline alloy precursor was leached completely. It is from the XRD patterns (Fig. 2B) of the activated Raney Cu samples found that there are only three diffractions peaks positing at the 2θ of 43.2°, 51.5° and 75.8° ascribed to Cu (JCPDS 04-0836) and one weakened characteristic diffractions peak ascribed to Cu9Al4 (JCPDS 24-0003), indicating that Cu x O (x =1 or 2) species could be completely restored at the present conditions. Moreover, the characteristic diffractions peaks of Cu at the 2θ of 43.2° exhibited the similar trend with the Cu2O phase in the Ro-T samples with the increasing leaching temperature, demonstrating that this passivation and reactivating method is an effective route for the storage of the Raney Cu catalysts. Additionally, the diffraction peaks characteristic of Cu9Al4 could still be detected for all the Ro-T and R-T samples, confirming that Cu9Al4 phase was immune to alkali liquor [38]. 3.3 SEM and TEM results The surface morphology of the Ro-T catalysts via the leaching temperature can be directly observed in Fig. 3 . It is obvious that all the Ro-T samples are consisted of large plates, and there exists no obvious cracks on the surface of the Ro-20 and Ro-30 catalysts. Nevertheless, the higher leaching temperature caused the surface of catalysts much more coarse, and the more obvious parallel cracks. Especially, the Ro-60 became more fragile. Additionally, there exist uniform network of short interconnected copper rods in the cracks of the Ro-50 and Ro-60 catalysts, and the intervals reach up to 20–50nm, which is well accordant with the size distribution of the larger mesoporous. The cracks and network formation could be explained in terms of faster dissolution of the elemental Al from the alloy precursor, which contributed to the mesoporous structure and the large S BET [38]. In the leaching process, excessive loss of Al could aggravate structure rearrangement of the samples, resulting in the collapse of their network structures at the severe leaching conditions (Fig. 3e) [39]. Thus, the obtained results are in good agreement with the degeneration of the mesoporous structure (Fig. 1). Fig. 4 displays the TEM images of the Cu–Al alloy precursor and R-T samples. Form the TEM image of Cu–Al alloy (Fig. 4a), it is noted that crystalline metallic Cu particles are highly dispersed by interacting with the disordered crystalline Al phase. For the Raney Cu samples, the crystalline metallic Cu phase with platelet-like particles becomes the primary phase, confirming the occurring of coarsening of the metallic Cu rims in the leaching process (Fig. 4b–f). Whereas, the platelet-like Cu particles in the Raney Cu samples prepared at 50°C and 60°C became accumulational and disordered, indicting the existent of over-arrangement at the severe leaching conditions. Additionally, the Cu aggregates were surrounded by continuous pore space in the range from 5nm to 10nm, corresponding to the small mesoporous structure in Raney Cu samples. 3.4 Reduction behavior of catalysts The H2-TPR technique has been adopted to determine the reducibility of the Cu–Al alloy and passivated samples, as shown in Fig. 5 . Notably, there exists no chemical hydrogen consumption signal in the Cu–Al alloy sample, illustrating the high stability of Cu compounds in Cu–Al alloy. For the Ro-20 sample, there are the main broad reduction peak at 216°C and another weak shoulder peak locating at the higher reduction temperature, suggesting the appearance of two different Cu species. When the leaching temperature increased to 40°C, the main reduction peaks shift to 265°C and the width become narrower, suggesting that the Cu particle size distribution becomes more symmetrical. Whereas, the shoulder peaks locating at lower reduction temperature reemerge again and the peak intensity continue to increase over 50°C, implying the much more isolated Cu species released from alloy. Combined with the results of XRD (Fig. 2) and TEM (Fig. 4), the hydrogen consumption peaks should be associated with the reduction of highly dispersed Cu x O with different particle sizes. Furthermore, the areas of the reduction peaks at different temperatures from TPR results can indirectly reflect the distribution of the Cu species in the resultant Raney Cu catalysts (Table 2 ). Thus the leaching temperatures can determine the size distribution of the Cu species in the Raney Cu catalysts. 3.5 Hydrogen adsorption properties Temperature-programmed desorption of H2 (H2-TPD) has been considered as a useful tool for ensuring the hydrogen desorption features of the surface of the catalysts [40]. The H2-TPD profiles of the Cu–Al precursor and R-T samples have been plotted in Fig. 6 . No hydrogen desorption signal could be detected below the desorption temperature of 450°C for Cu–Al alloy, implying that Cu species in the form of CuAl2 phase are inactive in hydrogen molecules. However, the weak desorption peak appears over 450°C, which mainly origins from the surface hydroxy existing on the interface of the Cu–Al alloy. As for the Raney Cu samples, there are three distinct hydrogen desorption peaks locating at different temperature regions: low temperature peak (LT: 80–200°C), medium temperature peak (MT: 250–575°C), and high temperature peak (HT: >575°C). The LT desorption peaks corresponded to the H*desorption on the Cu0 sites, and the intensity is closely related to the quantity of exposed active Cu0 sites [41]. Particularly, the R-50 sample exhibits the weakest H* desorption intensity, indicating the least exposed active Cu0 sites, which is in good accordance with the Cu0 dispersion data on the basis of N2O titration. Both the MT and HT peaks originate from H* adsorbed from the hydroxy on the interface between Cu and Cu–Al alloy phase. The intensity of the desorption peaks at various temperature range can directly reflect the surface composition of the as-prepared samples. 3.6 Catalytic performance of Raney Cu catalysts The catalytic behavior of Raney Cu catalysts prepared at different leaching temperatures in gas-phase hydrogenation of DMO was investigated, as shown in Fig. 7 A. All the catalysts exhibit 100% DMO conversion in the initial period. After the reaction time of 8h, DMO conversion of the R-20 and R-30 drops rapidly to less than 50%. In contrast, there is no loss of DMO conversion efficiency for R-40, R-50 and R-60 catalysts after 14h. Therefore, as-prepared R-40, R-50 and R-60 samples have the superior stability. It is from Fig. 7A found that there is no loss of EG selectivity over the R-50 during 20h, and the EG selectivity of other catalysts decreases sharply with the increasing MG selectivity during 4h, indicating that R-50 Raney Cu catalysts exhibit the best stability. Moreover, Fig. 7B gives the catalytic performance of the R-40 catalyst. The DMO conversion drops gradually to 80% after 20h reaction time, and the MG selectivity increases sharply to 80% at the expense of the conversion of DMO. Interestingly, the selectivity of MG can actually reach up to 95.0% after 100h reaction time, which is the highest value on the copper based catalysts until now [20]. 4 Discussions 4.1 The evolution of structural and surface properties Our results can directly reflect the evolutions of microstructures, physicochemical and surface properties of Raney Cu catalysts correlative to the leaching temperature. In the alloy leaching process, the phase constitution of the precursor alloy and kinetics of the leaching reaction should be responsible for the resultant morphology of the Raney Cu catalyst [42]. Meanwhile, coarsening of the Cu rims occurred in the dissolution and re-precipitation process of the Cu–Al alloy by the Oswald ripening mechanism, leading to the crystalline Cu formation [43,44]. Based on the H2-TPR profiles (Fig. 5) and crystalline Cu size versus the leaching temperatures (Fig. 8 ), it is obvious that the particle size of the crystalline Cu in the Raney Cu catalysts grows with the increasing leaching temperatures, indicating that the Cu particle size is closely related to the leaching rate determined by the leaching temperatures. While the adverse decreasing of the crystalline Cu size at 60°C suggests that the leaching process should be mainly controlled by the liquid phase diffusion, where the leaching depth approaches the core in the Cu–Al alloy pellets. Thus, it is confirmed that, the diffusing effect should be another important factor determining the resultant Raney Cu structure in the leaching process, except for the leaching temperature. What is more, the leaching conditions could modify the chemical state of the Cu elements and surface properties. The residual Al (Table 1) in the Raney Cu catalysts and H2-TPD profiles (Fig. 6) confirms that elevating leaching temperature induces surface enrichment of metallic Cu and decreases the rest of CuAl2 content phase. While the Cu9Al4 phase is independent of the leaching temperature, and still remains in the Raney Cu catalysts. Nevertheless, over-rearrangement of the Raney Cu catalysts at the excessive leaching conditions will cause noticeable change of the structural feature [37,38], due to the excessive loss of the remained Al component, as shown in the Figs. 1, 3 and 4. Scheme 1 gives the main structural evolution diagram of the Raney Cu catalyst upon the leaching temperature. In the initial leaching depth, the crystalline Cu size increases with the leaching temperatures increasing, indicating that the leaching rate should be responsible for the leaching process. After that, at the relative leaching depth before forming the core in the pellets (60°C), the S BET of the resultant Raney Cu pellet reaches the minimum, where the leaching process is mainly controlled by the liquid phase diffusion in the product layer until the alloy was leached completely [45]. 4.2 The structure–performance relationships The evolutions of structural and surface properties of the resultant Raney Cu catalysts depend on the leaching temperature, and consequently, determine the catalytic hydrogenation performance. The Raney Cu catalyst prepared at the mild leaching conditions with smaller pore structure has the highest metallic Cu dispersion that decreases with the increasing leaching temperature. The R-50 and R-60 catalysts, obtained from the harsh leaching conditions, exhibit the less metallic Cu dispersion and larger pore structure, and possess excellent performance and stability, which well determines the resultant main product (Fig. 7(A)). However, the R-20, R-30 and R-40 suffer rapid deactivation in the DMO hydrogenation process. In order to further explore the relation between the structure and catalytic performance of the Raney Cu catalysts in the DMO hydrogenation process, the spent Raney Cu catalysts are investigated and illustrated in Fig. 9 . It is found that there are three diffraction peaks at 2θ of 43.3°, 50.5° and 74.0° assigned to Cu° (JCPDS 04-0836) in the spent Raney Cu catalysts. Remarkably, there is no obvious change of the Cu° particle size in the spent sample compared to the catalyst without reaction based on the Scherrer equation, suggesting that no change of the Cu nanopatciles occurred in the DMO hydrogenation process. Additionally, the diffraction peaks at 2θ around 22° and 44.1° assigned to quartz and Cu9Al4 (JCPDS 24-0003), respectively, could still be detected for all the spent catalysts. Moreover, there is a diffraction peak with strong intensity characteristic of carbonaceous (JCPDS 26-1076) for the spent R-50, R-60 and R-70, indicating the crystalline carbonaceous deposited in the reaction. Previous studies proposed that sintering of Cu nanoparticles is the mainly reason for the deactivation of the Cu based catalysts [46]. Weight loss of ca. 7% in the thermogravimetric analysis (Fig. 10 ) of the spent catalyst argue against strong chemiorption of a poison. Besides, XRD patterns reveal that Cu sintering is not the reason for the spent Raney Cu catalyst in the DMO hydrogenation reaction. It is well known that the Raney Cu catalysts, is not only highly active in hydrogenation reaction, but an excellent candidate for the methanol dehydrogenation reaction. Notably, a trace of formaldehyde detected in the product can afford evidence that dehydrogenation of feedstock solvent occurred, which can cause the polymer deposition over the Raney Cu catalyst in the present reaction conditions. Moreover, the intermediate MG used to be an easy polymerization unit, which can polymerize on the active Cu0 sites, accelerating the deactivation [32]. Thus, it induced that the polymer formation on the active sites and pore structure, resulting in the active sites being covered and pore structure being blocked, should be another reason for the deactivation of the Raney Cu catalysts [47]. What is more, TPO was also conducted to further investigate polymer deposited in the spent Raney Cu catalyst. As shown in Fig. 11 , the spent R-50 catalyst displayed a broad oxygen consumption in the range from 275°C to 700°C, corresponding to combustion of amorphous carbonaceous adsorbed on the metal Cu0 sites and crystalline coke deposited on the surface of the catalysts [48]. These results demonstrate that carbonaceous residues deposit on the surface of the Raney Cu catalyst in the DMO hydrogenation process. In the preparation process, coarsening of rim Cu resulted in large pore size and low Cu0 dispersion that will exhibit an advantage of reducing the activity extent of fouling by polymer by-products in the DMO hydrogenation process, which will be beneficial to excellent stability on the expense of the partial activity [48]. Excessive exposed active Cu density over the surface of the Raney Cu catalyst facilitates the dehydrogenation reaction, but it will has passive influence on the lifetime of the Raney Cu catalysts. Deposition of fouling with polymer in the Raney Cu catalysts can block the pore structure and cover the active sites exposed, reducing the catalytic hydrogenation activity [49]. As a result, the intermediate product of MG from DMO partially hydrogenation becomes the main product. Moreover, long-term catalytic stability is a necessary feature for industrial catalysts of DMO hydrogenation to EG, and synthesis of highly stable copper catalysts remains a significant challenge. 5 Conclusions In summary, the leaching temperature has the significant effect on the microstructures, physicochemical and surface properties of the resultant Raney Cu catalysts, and the catalytic performance in the gas-phase hydrogenation of DMO. Raney Cu catalyst with lower Cu0 dispersion and larger macroporous structure exhibits better stability. The high EG yield of 98.0% was obtained over R-50 catalyst, and the selectivity of MG could reach up to 95.0% over R-40 Cu catalyst. Our analysis results confirm that the main reason for the deactivation of the Raney Cu catalyst is the carbonaceous deposition rather than the sintering of the Cu nanoparticles in the DMO hydrogenation process. These studies should provide fundamental knowledge for the development of DMO hydrogenation technology. Acknowledgment Financial support from Natural Science Foundation of China (Grant No. 21373254) are gratefully acknowledged. References [1] A.Y. Yin C. Wen W.L. Dai K.N. Fan Appl. Catal. B 108–109 2011 90 99 [2] H.R. Yue Y.J. Zhao X.B. Ma J.L. Gong Chem. Soc. Rev. 41 2012 4218 4244 [3] T. Hayashi T. Inagaki N. Itayama H. Baba Catal. Today 117 2006 210 213 [4] A.Y. Yin C. Wen X.Y. Guo W.L. Dai K.N. Fan J. Catal. 280 2011 77 88 [5] D. He W. Huang J. Liu Q. Zhu Catal. Today 51 1999 127 134 [6] Y. Sun H. Wang J. Shen H. Liu Z. Liu Catal. Commun. 10 2009 678 681 [7] E. Jin Y.Y. Zhang L.L. He H.G. Harris B.T. Teng M.H. Fan Appl. Catal. A 476 2014 158 174 [8] R.L. Pruett Science 211 1981 11 16 [9] S. Zhao H. Yue Y. Zhao B. Wang Y. Geng J. Lv S. Wang J. Gong X. Ma J. Catal. 297 2013 142 150 [10] X. Zheng H. Lin J. Zheng X. Duan Y. Yuan ACS Catal. 3 2013 2738 2749 [11] Y. Yamamoto Catal. Surv. Asia 14 2010 103 110 [12] G.H. Xu Y.C. Li Z.H. Li H.J. Wang Ind. Eng. Chem. Res. 24 1996 2371 2378 [13] J.L. Gong H.R. Yue Y.J. Zhao S. Zhao L. Zhao J. Lv S.P. Wang X.B. Ma J. Am. Chem. Soc. 134 2012 13922 13925 [14] Z. He H.Q. Lin P. He Y.Z. Yuan J. Catal. 277 2011 54 63 [15] A. Yin C. Wen X. Guo W.L. Dai K. Fan J. Catal. 280 2011 77 88 [16] J. Zheng H. Lin Y. Wang X. Zheng X. Duan Y. Yuan J. Catal. 297 2013 110 118 [17] L.F. Chen P.J. Guo M.H. Qiao S.R. Yan H.X. Li W. Shen H.L. Xu K.N. Fan J. Catal. 257 2008 172 180 [18] A. Yin X. Guo W.L. Dai H. Li K. Fan Appl. Catal. A 349 2008 91 99 [19] J. Zheng H. Lin X. Zheng X. Duan Y. Yuan Catal. Commun. 40 2013 129 133 [20] C. Wen Y. Cui X. Chen B. Zong W.L. Dai Appl. Catal. B 162 2015 483 493 [21] A. Yin C. Wen W.L. Dai K. Fan Appl. Catal. B 108–109 2011 90 99 [22] A. Yin X. Guo W. Dai K. Fan Chem. Commun. 46 2010 4348 4350 [23] A.Y. Yin X.Y. Guo W.L. Dai K.N. Fan Chem. Commun. 46 2010 4348 4350 [24] C. Wen A.Y. Yin Y.Y. Cui X.L. Yang W.L. Dai Appl. Catal. A 458 2013 82 89 [25] Y. Zhu X. Kong D.B. Cao J. Cui Y. Zhu Y.W. Li ACS Catal. 4 2014 3675 3681 [26] L. Ma B. Gong T. Tran M.S. Wainwright Catal. Today 63 2000 499 505 [27] X. Huang L. Ma M.S. Wainwright Appl. Catal. A 257 2004 235 243 [28] J. Toyir M. Saito I. Yamauchi S. Luo J. Wu I. Takahara M. Takeuchi Stud. Surf. Sci. Catal. 114 1998 267 272 [29] A.D. Tomsett M.S. Wainwright D.J. Young Appl. Catal. 12 1984 43 48 [30] A.J. Smith, M.S. Wainwright, Handbook of Heterogeneous Catalysis, (2008) 92–99. [31] J.W. Evans N.W. Cant D.L. Trimm M.S. Wainwright Appl. Catal. 6 1983 355 362 [32] D.J. Thomas J.Y. Wehrli S. Wainwright D.L. Trimm Appl. Catal. A 86 1992 101 114 [33] C.Z. Fan M.S. Wainwright D.L. Trimm Appl. Catal. 54 1989 53 58 [34] A.D. Tomsett M.S. Wainwright D.J. Young Appl. Catal. 12 1984 43 48 [35] Z. Yuan L. Wang J. Wang S. Xia P. Chen Z. Hou X. Zheng Appl. Catal. B 101 2011 431 440 [36] H.E. Curry-Hyde M.S. Wainwright D.J. Young Appl. Catal. 77 1991 89 94 [37] J.R. Mellor N.J. Covflle A.C. Sofianos R.G. Copperthwaite Appl. Catal. A 164 1997 171 183 [38] U. Birkenstock R. Holm B. Reinfandt S. Storp J. Catal. 93 1985 55 67 [39] T. Tanabe S. Kameoka A.P. Tsai Catal. Today 111 2006 153 157 [40] M. Muhler L.P. Nielsen E. Törnqvist B.S. Clausen H. Topsøe Catal. Lett. 14 1992 241 249 [41] T. Genger O. Hinrichsen M. Muhler Catal. Lett. 59 1999 137 141 [42] B.J. Friedrich M.S. Wainwright D.J. Young I.F. Boag Chem. Eng. Commun. 26 1984 63 171 [43] A.D. Tomsett D.J. Young M.S. Wainwright Appl. Catal. 35 1987 321 328 [44] P.W. Voorhees M.E. Glicksman Metall. Trans. A 15A 2015 1081 1088 [45] A.J. Smith D.L. Trimm Annu. Rev. Mater. Res. 35 2005 127 142 [46] J. Lin X. Zhao Y. Cui H. Zhang D. Liao Chem. Commun. 48 2012 1177 1179 [47] S.P. Tonner D.L. Trlmm M.S. Walnwrlgh Ind. Eng. Chem. Prod. Res. Dev. 23 1984 384 388 [48] J. Barbier E. Churin J.M. Parera J. Riviere React. Kinet. Catal. Lett. 29 1985 323 330 [49] N.I. Onuoha M.S. Wainwright Chem. Eng. Commun. 29 1984 1 12",
      "scopus-id": "84947260353",
      "coredata": {
        "eid": "1-s2.0-S0926860X15302064",
        "dc:description": "As-synthesized Raney Cu catalysts through selective leaching of Cu–Al (50wt%Cu–50wt%Al) alloy pellets in sodium hydroxide solution have been systematically investigated during the catalyst preparation process. Results reveal that the microstructures, physicochemical and surface properties of the Raney Cu catalysts depend profoundly on the leaching temperature. In gas-phase hydrogenation of dimethyl oxalate (DMO), the Raney Cu catalysts prepared at the mild leaching conditions tend to deactivate rapidly, the formation of methyl glycolate (MG). As-prepared catalysts at higher leaching temperature exhibit excellent stability, favoring the synthesis of ethylene glycol (EG). Especially, Raney Cu catalyst obtained at 40°C shows the superior stability and MG selectivity of 95.0% in DMO hydrogenation. Furthermore, the reasons for deactivation of Raney Cu catalyst in DMO hydrogenation have been discussed in detail.",
        "openArchiveArticle": "false",
        "prism:coverDate": "2016-01-05",
        "openaccessUserLicense": null,
        "prism:aggregationType": "Journal",
        "prism:url": "https://api.elsevier.com/content/article/pii/S0926860X15302064",
        "dc:creator": [
          {
            "@_fa": "true",
            "$": "Kong, Xiangpeng"
          },
          {
            "@_fa": "true",
            "$": "Ma, Cailian"
          },
          {
            "@_fa": "true",
            "$": "Zhang, Juan"
          },
          {
            "@_fa": "true",
            "$": "Sun, Jiaqiang"
          },
          {
            "@_fa": "true",
            "$": "Chen, Jiangang"
          },
          {
            "@_fa": "true",
            "$": "Liu, Kefeng"
          }
        ],
        "link": [
          {
            "@_fa": "true",
            "@rel": "self",
            "@href": "https://api.elsevier.com/content/article/pii/S0926860X15302064"
          },
          {
            "@_fa": "true",
            "@rel": "scidir",
            "@href": "https://www.sciencedirect.com/science/article/pii/S0926860X15302064"
          }
        ],
        "dc:format": "application/json",
        "openaccessType": null,
        "pii": "S0926-860X(15)30206-4",
        "prism:volume": "509",
        "prism:publisher": "Elsevier B.V.",
        "dc:title": "Effect of leaching temperature on structure and performance of Raney Cu catalysts for hydrogenation of dimethyl oxalate",
        "prism:copyright": "Copyright © 2015 Elsevier B.V. All rights reserved.",
        "openaccess": "0",
        "prism:issn": "0926860X",
        "dcterms:subject": [
          {
            "@_fa": "true",
            "$": "Raney Cu"
          },
          {
            "@_fa": "true",
            "$": "Hydrogenation"
          },
          {
            "@_fa": "true",
            "$": "Dimethyl oxalate"
          },
          {
            "@_fa": "true",
            "$": "Ethylene glycol"
          },
          {
            "@_fa": "true",
            "$": "Methyl glycolate"
          }
        ],
        "openaccessArticle": "false",
        "prism:publicationName": "Applied Catalysis A: General",
        "openaccessSponsorType": null,
        "prism:pageRange": "153-160",
        "prism:endingPage": "160",
        "pubType": "fla",
        "prism:coverDisplayDate": "5 January 2016",
        "prism:doi": "10.1016/j.apcata.2015.10.029",
        "prism:startingPage": "153",
        "dc:identifier": "doi:10.1016/j.apcata.2015.10.029",
        "openaccessSponsorName": null
      },
      "objects": {
        "object": [
          {
            "@category": "thumbnail",
            "@height": "88",
            "@width": "219",
            "@_fa": "true",
            "$": "https://api.elsevier.com/content/object/eid/1-s2.0-S0926860X15302064-fx1.sml?httpAccept=%2A%2F%2A",
            "@multimediatype": "GIF image file",
            "@type": "IMAGE-THUMBNAIL",
            "@size": "4698",
            "@ref": "fx1",
            "@mimetype": "image/gif"
          },
          {
            "@category": "thumbnail",
            "@height": "164",
            "@width": "204",
            "@_fa": "true",
            "$": "https://api.elsevier.com/content/object/eid/1-s2.0-S0926860X15302064-gr1.sml?httpAccept=%2A%2F%2A",
            "@multimediatype": "GIF image file",
            "@type": "IMAGE-THUMBNAIL",
            "@size": "14762",
            "@ref": "gr1",
            "@mimetype": "image/gif"
          },
          {
            "@category": "thumbnail",
            "@height": "160",
            "@width": "219",
            "@_fa": "true",
            "$": "https://api.elsevier.com/content/object/eid/1-s2.0-S0926860X15302064-gr10.sml?httpAccept=%2A%2F%2A",
            "@multimediatype": "GIF image file",
            "@type": "IMAGE-THUMBNAIL",
            "@size": "12433",
            "@ref": "gr10",
            "@mimetype": "image/gif"
          },
          {
            "@category": "thumbnail",
            "@height": "164",
            "@width": "211",
            "@_fa": "true",
            "$": "https://api.elsevier.com/content/object/eid/1-s2.0-S0926860X15302064-gr11.sml?httpAccept=%2A%2F%2A",
            "@multimediatype": "GIF image file",
            "@type": "IMAGE-THUMBNAIL",
            "@size": "10185",
            "@ref": "gr11",
            "@mimetype": "image/gif"
          },
          {
            "@category": "thumbnail",
            "@height": "163",
            "@width": "104",
            "@_fa": "true",
            "$": "https://api.elsevier.com/content/object/eid/1-s2.0-S0926860X15302064-gr2.sml?httpAccept=%2A%2F%2A",
            "@multimediatype": "GIF image file",
            "@type": "IMAGE-THUMBNAIL",
            "@size": "13651",
            "@ref": "gr2",
            "@mimetype": "image/gif"
          },
          {
            "@category": "thumbnail",
            "@height": "107",
            "@width": "219",
            "@_fa": "true",
            "$": "https://api.elsevier.com/content/object/eid/1-s2.0-S0926860X15302064-gr3.sml?httpAccept=%2A%2F%2A",
            "@multimediatype": "GIF image file",
            "@type": "IMAGE-THUMBNAIL",
            "@size": "27676",
            "@ref": "gr3",
            "@mimetype": "image/gif"
          },
          {
            "@category": "thumbnail",
            "@height": "159",
            "@width": "219",
            "@_fa": "true",
            "$": "https://api.elsevier.com/content/object/eid/1-s2.0-S0926860X15302064-gr4.sml?httpAccept=%2A%2F%2A",
            "@multimediatype": "GIF image file",
            "@type": "IMAGE-THUMBNAIL",
            "@size": "29917",
            "@ref": "gr4",
            "@mimetype": "image/gif"
          },
          {
            "@category": "thumbnail",
            "@height": "164",
            "@width": "210",
            "@_fa": "true",
            "$": "https://api.elsevier.com/content/object/eid/1-s2.0-S0926860X15302064-gr5.sml?httpAccept=%2A%2F%2A",
            "@multimediatype": "GIF image file",
            "@type": "IMAGE-THUMBNAIL",
            "@size": "15569",
            "@ref": "gr5",
            "@mimetype": "image/gif"
          },
          {
            "@category": "thumbnail",
            "@height": "164",
            "@width": "204",
            "@_fa": "true",
            "$": "https://api.elsevier.com/content/object/eid/1-s2.0-S0926860X15302064-gr6.sml?httpAccept=%2A%2F%2A",
            "@multimediatype": "GIF image file",
            "@type": "IMAGE-THUMBNAIL",
            "@size": "16110",
            "@ref": "gr6",
            "@mimetype": "image/gif"
          },
          {
            "@category": "thumbnail",
            "@height": "164",
            "@width": "109",
            "@_fa": "true",
            "$": "https://api.elsevier.com/content/object/eid/1-s2.0-S0926860X15302064-gr7.sml?httpAccept=%2A%2F%2A",
            "@multimediatype": "GIF image file",
            "@type": "IMAGE-THUMBNAIL",
            "@size": "13369",
            "@ref": "gr7",
            "@mimetype": "image/gif"
          },
          {
            "@category": "thumbnail",
            "@height": "164",
            "@width": "209",
            "@_fa": "true",
            "$": "https://api.elsevier.com/content/object/eid/1-s2.0-S0926860X15302064-gr8.sml?httpAccept=%2A%2F%2A",
            "@multimediatype": "GIF image file",
            "@type": "IMAGE-THUMBNAIL",
            "@size": "9606",
            "@ref": "gr8",
            "@mimetype": "image/gif"
          },
          {
            "@category": "thumbnail",
            "@height": "164",
            "@width": "211",
            "@_fa": "true",
            "$": "https://api.elsevier.com/content/object/eid/1-s2.0-S0926860X15302064-gr9.sml?httpAccept=%2A%2F%2A",
            "@multimediatype": "GIF image file",
            "@type": "IMAGE-THUMBNAIL",
            "@size": "16370",
            "@ref": "gr9",
            "@mimetype": "image/gif"
          },
          {
            "@category": "thumbnail",
            "@height": "72",
            "@width": "219",
            "@_fa": "true",
            "$": "https://api.elsevier.com/content/object/eid/1-s2.0-S0926860X15302064-sc1.sml?httpAccept=%2A%2F%2A",
            "@multimediatype": "GIF image file",
            "@type": "IMAGE-THUMBNAIL",
            "@size": "10943",
            "@ref": "sc1",
            "@mimetype": "image/gif"
          },
          {
            "@category": "standard",
            "@height": "200",
            "@width": "500",
            "@_fa": "true",
            "$": "https://api.elsevier.com/content/object/eid/1-s2.0-S0926860X15302064-fx1.jpg?httpAccept=%2A%2F%2A",
            "@multimediatype": "JPEG image file",
            "@type": "IMAGE-DOWNSAMPLED",
            "@size": "19106",
            "@ref": "fx1",
            "@mimetype": "image/jpeg"
          },
          {
            "@category": "standard",
            "@height": "314",
            "@width": "391",
            "@_fa": "true",
            "$": "https://api.elsevier.com/content/object/eid/1-s2.0-S0926860X15302064-gr1.jpg?httpAccept=%2A%2F%2A",
            "@multimediatype": "JPEG image file",
            "@type": "IMAGE-DOWNSAMPLED",
            "@size": "46765",
            "@ref": "gr1",
            "@mimetype": "image/jpeg"
          },
          {
            "@category": "standard",
            "@height": "286",
            "@width": "391",
            "@_fa": "true",
            "$": "https://api.elsevier.com/content/object/eid/1-s2.0-S0926860X15302064-gr10.jpg?httpAccept=%2A%2F%2A",
            "@multimediatype": "JPEG image file",
            "@type": "IMAGE-DOWNSAMPLED",
            "@size": "37205",
            "@ref": "gr10",
            "@mimetype": "image/jpeg"
          },
          {
            "@category": "standard",
            "@height": "303",
            "@width": "391",
            "@_fa": "true",
            "$": "https://api.elsevier.com/content/object/eid/1-s2.0-S0926860X15302064-gr11.jpg?httpAccept=%2A%2F%2A",
            "@multimediatype": "JPEG image file",
            "@type": "IMAGE-DOWNSAMPLED",
            "@size": "32104",
            "@ref": "gr11",
            "@mimetype": "image/jpeg"
          },
          {
            "@category": "standard",
            "@height": "615",
            "@width": "393",
            "@_fa": "true",
            "$": "https://api.elsevier.com/content/object/eid/1-s2.0-S0926860X15302064-gr2.jpg?httpAccept=%2A%2F%2A",
            "@multimediatype": "JPEG image file",
            "@type": "IMAGE-DOWNSAMPLED",
            "@size": "86480",
            "@ref": "gr2",
            "@mimetype": "image/jpeg"
          },
          {
            "@category": "standard",
            "@height": "313",
            "@width": "640",
            "@_fa": "true",
            "$": "https://api.elsevier.com/content/object/eid/1-s2.0-S0926860X15302064-gr3.jpg?httpAccept=%2A%2F%2A",
            "@multimediatype": "JPEG image file",
            "@type": "IMAGE-DOWNSAMPLED",
            "@size": "94997",
            "@ref": "gr3",
            "@mimetype": "image/jpeg"
          },
          {
            "@category": "standard",
            "@height": "463",
            "@width": "640",
            "@_fa": "true",
            "$": "https://api.elsevier.com/content/object/eid/1-s2.0-S0926860X15302064-gr4.jpg?httpAccept=%2A%2F%2A",
            "@multimediatype": "JPEG image file",
            "@type": "IMAGE-DOWNSAMPLED",
            "@size": "97929",
            "@ref": "gr4",
            "@mimetype": "image/jpeg"
          },
          {
            "@category": "standard",
            "@height": "306",
            "@width": "391",
            "@_fa": "true",
            "$": "https://api.elsevier.com/content/object/eid/1-s2.0-S0926860X15302064-gr5.jpg?httpAccept=%2A%2F%2A",
            "@multimediatype": "JPEG image file",
            "@type": "IMAGE-DOWNSAMPLED",
            "@size": "46889",
            "@ref": "gr5",
            "@mimetype": "image/jpeg"
          },
          {
            "@category": "standard",
            "@height": "313",
            "@width": "390",
            "@_fa": "true",
            "$": "https://api.elsevier.com/content/object/eid/1-s2.0-S0926860X15302064-gr6.jpg?httpAccept=%2A%2F%2A",
            "@multimediatype": "JPEG image file",
            "@type": "IMAGE-DOWNSAMPLED",
            "@size": "51732",
            "@ref": "gr6",
            "@mimetype": "image/jpeg"
          },
          {
            "@category": "standard",
            "@height": "586",
            "@width": "390",
            "@_fa": "true",
            "$": "https://api.elsevier.com/content/object/eid/1-s2.0-S0926860X15302064-gr7.jpg?httpAccept=%2A%2F%2A",
            "@multimediatype": "JPEG image file",
            "@type": "IMAGE-DOWNSAMPLED",
            "@size": "73071",
            "@ref": "gr7",
            "@mimetype": "image/jpeg"
          },
          {
            "@category": "standard",
            "@height": "307",
            "@width": "391",
            "@_fa": "true",
            "$": "https://api.elsevier.com/content/object/eid/1-s2.0-S0926860X15302064-gr8.jpg?httpAccept=%2A%2F%2A",
            "@multimediatype": "JPEG image file",
            "@type": "IMAGE-DOWNSAMPLED",
            "@size": "32134",
            "@ref": "gr8",
            "@mimetype": "image/jpeg"
          },
          {
            "@category": "standard",
            "@height": "305",
            "@width": "393",
            "@_fa": "true",
            "$": "https://api.elsevier.com/content/object/eid/1-s2.0-S0926860X15302064-gr9.jpg?httpAccept=%2A%2F%2A",
            "@multimediatype": "JPEG image file",
            "@type": "IMAGE-DOWNSAMPLED",
            "@size": "59759",
            "@ref": "gr9",
            "@mimetype": "image/jpeg"
          },
          {
            "@category": "standard",
            "@height": "186",
            "@width": "565",
            "@_fa": "true",
            "$": "https://api.elsevier.com/content/object/eid/1-s2.0-S0926860X15302064-sc1.jpg?httpAccept=%2A%2F%2A",
            "@multimediatype": "JPEG image file",
            "@type": "IMAGE-DOWNSAMPLED",
            "@size": "40925",
            "@ref": "sc1",
            "@mimetype": "image/jpeg"
          },
          {
            "@category": "high",
            "@height": "886",
            "@width": "2213",
            "@_fa": "true",
            "$": "https://api.elsevier.com/content/object/eid/1-s2.0-S0926860X15302064-fx1_lrg.jpg?httpAccept=%2A%2F%2A",
            "@multimediatype": "JPEG image file",
            "@type": "IMAGE-HIGH-RES",
            "@size": "130889",
            "@ref": "fx1",
            "@mimetype": "image/jpeg"
          },
          {
            "@category": "high",
            "@height": "1391",
            "@width": "1731",
            "@_fa": "true",
            "$": "https://api.elsevier.com/content/object/eid/1-s2.0-S0926860X15302064-gr1_lrg.jpg?httpAccept=%2A%2F%2A",
            "@multimediatype": "JPEG image file",
            "@type": "IMAGE-HIGH-RES",
            "@size": "221273",
            "@ref": "gr1",
            "@mimetype": "image/jpeg"
          },
          {
            "@category": "high",
            "@height": "1267",
            "@width": "1732",
            "@_fa": "true",
            "$": "https://api.elsevier.com/content/object/eid/1-s2.0-S0926860X15302064-gr10_lrg.jpg?httpAccept=%2A%2F%2A",
            "@multimediatype": "JPEG image file",
            "@type": "IMAGE-HIGH-RES",
            "@size": "183244",
            "@ref": "gr10",
            "@mimetype": "image/jpeg"
          },
          {
            "@category": "high",
            "@height": "1343",
            "@width": "1733",
            "@_fa": "true",
            "$": "https://api.elsevier.com/content/object/eid/1-s2.0-S0926860X15302064-gr11_lrg.jpg?httpAccept=%2A%2F%2A",
            "@multimediatype": "JPEG image file",
            "@type": "IMAGE-HIGH-RES",
            "@size": "141386",
            "@ref": "gr11",
            "@mimetype": "image/jpeg"
          },
          {
            "@category": "high",
            "@height": "2727",
            "@width": "1742",
            "@_fa": "true",
            "$": "https://api.elsevier.com/content/object/eid/1-s2.0-S0926860X15302064-gr2_lrg.jpg?httpAccept=%2A%2F%2A",
            "@multimediatype": "JPEG image file",
            "@type": "IMAGE-HIGH-RES",
            "@size": "524850",
            "@ref": "gr2",
            "@mimetype": "image/jpeg"
          },
          {
            "@category": "high",
            "@height": "832",
            "@width": "1700",
            "@_fa": "true",
            "$": "https://api.elsevier.com/content/object/eid/1-s2.0-S0926860X15302064-gr3_lrg.jpg?httpAccept=%2A%2F%2A",
            "@multimediatype": "JPEG image file",
            "@type": "IMAGE-HIGH-RES",
            "@size": "334222",
            "@ref": "gr3",
            "@mimetype": "image/jpeg"
          },
          {
            "@category": "high",
            "@height": "1231",
            "@width": "1700",
            "@_fa": "true",
            "$": "https://api.elsevier.com/content/object/eid/1-s2.0-S0926860X15302064-gr4_lrg.jpg?httpAccept=%2A%2F%2A",
            "@multimediatype": "JPEG image file",
            "@type": "IMAGE-HIGH-RES",
            "@size": "358757",
            "@ref": "gr4",
            "@mimetype": "image/jpeg"
          },
          {
            "@category": "high",
            "@height": "1356",
            "@width": "1734",
            "@_fa": "true",
            "$": "https://api.elsevier.com/content/object/eid/1-s2.0-S0926860X15302064-gr5_lrg.jpg?httpAccept=%2A%2F%2A",
            "@multimediatype": "JPEG image file",
            "@type": "IMAGE-HIGH-RES",
            "@size": "248668",
            "@ref": "gr5",
            "@mimetype": "image/jpeg"
          },
          {
            "@category": "high",
            "@height": "1387",
            "@width": "1730",
            "@_fa": "true",
            "$": "https://api.elsevier.com/content/object/eid/1-s2.0-S0926860X15302064-gr6_lrg.jpg?httpAccept=%2A%2F%2A",
            "@multimediatype": "JPEG image file",
            "@type": "IMAGE-HIGH-RES",
            "@size": "255284",
            "@ref": "gr6",
            "@mimetype": "image/jpeg"
          },
          {
            "@category": "high",
            "@height": "2598",
            "@width": "1729",
            "@_fa": "true",
            "$": "https://api.elsevier.com/content/object/eid/1-s2.0-S0926860X15302064-gr7_lrg.jpg?httpAccept=%2A%2F%2A",
            "@multimediatype": "JPEG image file",
            "@type": "IMAGE-HIGH-RES",
            "@size": "423952",
            "@ref": "gr7",
            "@mimetype": "image/jpeg"
          },
          {
            "@category": "high",
            "@height": "1360",
            "@width": "1731",
            "@_fa": "true",
            "$": "https://api.elsevier.com/content/object/eid/1-s2.0-S0926860X15302064-gr8_lrg.jpg?httpAccept=%2A%2F%2A",
            "@multimediatype": "JPEG image file",
            "@type": "IMAGE-HIGH-RES",
            "@size": "140549",
            "@ref": "gr8",
            "@mimetype": "image/jpeg"
          },
          {
            "@category": "high",
            "@height": "1354",
            "@width": "1742",
            "@_fa": "true",
            "$": "https://api.elsevier.com/content/object/eid/1-s2.0-S0926860X15302064-gr9_lrg.jpg?httpAccept=%2A%2F%2A",
            "@multimediatype": "JPEG image file",
            "@type": "IMAGE-HIGH-RES",
            "@size": "283170",
            "@ref": "gr9",
            "@mimetype": "image/jpeg"
          },
          {
            "@category": "high",
            "@height": "824",
            "@width": "2500",
            "@_fa": "true",
            "$": "https://api.elsevier.com/content/object/eid/1-s2.0-S0926860X15302064-sc1_lrg.jpg?httpAccept=%2A%2F%2A",
            "@multimediatype": "JPEG image file",
            "@type": "IMAGE-HIGH-RES",
            "@size": "218215",
            "@ref": "sc1",
            "@mimetype": "image/jpeg"
          }
        ]
      },
      "link": {
        "@rel": "abstract",
        "@href": "https://api.elsevier.com/content/abstract/scopus_id/84947260353"
      }
    }
  }
}