{
  "metadata": {
    "title": "Osmium impregnated on magnetite as a heterogeneous catalyst for the <ce:italic>syn</ce:italic>-dihydroxylation of alkenes",
    "authors": "; ; ",
    "journal": "Applied Catalysis A: General",
    "date": "2014-01-30",
    "doi": "10.1016/j.apcata.2013.10.050",
    "abstract": "",
    "uri": "https://api.elsevier.com/content/article/pii/S0926860X13006698",
    "pii": "S0926860X13006698"
  },
  "fulltext": {
    "full-text-retrieval-response": {
      "scopus-eid": "2-s2.0-84888102763",
      "originalText": "serial JL 271346 291210 291744 291809 31 Applied Catalysis A: General APPLIEDCATALYSISAGENERAL 2013-11-05 2013-11-05 2014-01-10T08:54:41 1-s2.0-S0926860X13006698 S0926-860X(13)00669-8 S0926860X13006698 10.1016/j.apcata.2013.10.050 S300 S300.1 FULL-TEXT 1-s2.0-S0926860X13X0016X 2024-01-01T12:29:14.622205Z 0 0 20140130 2014 2013-11-05T00:00:00Z articleinfo crossmark dco dateupdated tomb dateloaded datesearch indexeddate volumelist yearnav absattachment articletitlenorm authfirstinitialnorm authfirstsurnamenorm cid cids contenttype copyright dateloadedtxt docsubtype doctype doi eid ewtransactionid hubeid issn issnnorm itemstage itemtransactionid itemweight openaccess openarchive pg pgfirst pglast pii piinorm pubdatestart pubdatetxt pubyr sectiontitle sortorder srctitle srctitlenorm srctype subheadings suppl volfirst volissue webpdf webpdfpagecount figure table e-component body acknowledge affil appendices articletitle auth authfirstini authfull authkeywords authlast highlightsabst primabst ref specialabst alllist content subj ssids 0926-860X 0926860X true 470 470 C Volume 470 21 177 182 177 182 20140130 30 January 2014 2014-01-30 2014 Articles article fla Copyright © 2013 Elsevier B.V. All rights reserved. OSMIUMIMPREGNATEDMAGNETITEAHETEROGENEOUSCATALYSTFORSYNDIHYDROXYLATIONALKENES CANO R 1 Introduction 2 Experimental 2.1 General procedure for the preparation of catalyst 2.2 Characterization of catalyst 2.3 General procedure for the dihydroxylation of alkenes 3 Results and discussion 3.1 Synthesis of catalyst 3.2 Dihydroxylation reactions 4 Conclusion Acknowledgements Appendix A Supplementary data References NATIVI 2008 757 762 C SCIENCESYNTHESIS SUNDERMEIER 2004 1 20 U MODERNOXIDATIONMETHODS WANG 1994 8302 8303 Z SONG 1996 645 648 C HAN 1997 1731 1733 H BOLM 1997 2353 2354 C BOLM 1998 21 27 C SEVEREYNS 2002 125 131 A KOBAYASHI 2003 449 460 S KOBAYASHI 2006 1496 1504 S AKIYAMA 2009 594 642 R HERRMANN 1997 197 205 W NANDANAN 1997 2577 2580 E LEE 2005 4491 4493 B AKIYAMA 2012 7456 7461 R SEVEREYNS 2001 586 589 A MOTORINA 2001 2325 2328 I CHOUDARY 2002 586 587 B QIU 2011 1197 1201 S FRIEDRICH 2003 2922 2923 H NAICKER 2008 96 102 T TANG 2004 1378 1379 W FUJITA 2010 8536 8543 K DECLUE 2004 2287 2298 M QI 2008 136 141 X LAZARUS 2010 7888 7890 L FUJITA 2011 3137 3140 K METIN 2012 1488 1492 O NAGAYAMA 1998 6094 6095 S KOBAYASHI 1999 11229 11230 S ISHIDA 2003 576 579 T CHOUDARY 2001 9220 9221 B SEVEREYNS 2002 380 384 A CHOUDARY 2004 45 48 B DEHURY 2007 2493 2496 S CHANDRASEKHAR 2003 1716 1717 S YAO 2002 2197 2199 Q BRANCO 2011 1408 1413 L ALIAGA 2010 43 46 M CANO 2010 3458 3460 R CANO 2011 5432 5436 R CANO 2011 5547 5557 R CANO 2011 8079 8085 R CANO 2012 1393 1400 R CANO 2012 1070 1078 R CANO 2012 7628 7630 R PEREZ 2012 4548 4554 J PEREZ 2013 1373 1379 J MARTINEZ 2008 1235 1240 R MARTINEZ 2009 2176 2181 R CANO 2011 2017 2020 R CANOX2014X177 CANOX2014X177X182 CANOX2014X177XR CANOX2014X177X182XR item S0926-860X(13)00669-8 S0926860X13006698 1-s2.0-S0926860X13006698 10.1016/j.apcata.2013.10.050 271346 2024-01-01T12:29:14.622205Z 2014-01-30 1-s2.0-S0926860X13006698-main.pdf https://s3.amazonaws.com/prod-ucs-content-store-us-east/content/pii:S0926860X13006698/MAIN/application/pdf/9cb1a7c4c39bba08945354a15296098a/main.pdf https://s3-eu-west-1.amazonaws.com/prod-ucs-content-store-eu-west/content/pii:S0926860X13006698/MAIN/application/pdf/9cb1a7c4c39bba08945354a15296098a/main.pdf main.pdf pdf true 1408952 MAIN 6 1-s2.0-S0926860X13006698-main_1.png https://s3-eu-west-1.amazonaws.com/prod-ucs-content-store-eu-west/content/pii:S0926860X13006698/PREVIEW/image/png/3028b67a7510de6cbf7e20daf7d88d16/main_1.png https://s3.amazonaws.com/prod-ucs-content-store-us-east/content/pii:S0926860X13006698/PREVIEW/image/png/3028b67a7510de6cbf7e20daf7d88d16/main_1.png main_1.png png 55950 849 656 IMAGE-WEB-PDF 1 1-s2.0-S0926860X13006698-sc1_lrg.jpg https://s3.amazonaws.com/prod-ucs-content-store-us-east/content/pii:S0926860X13006698/sc1/HIGHRES/image/jpeg/0cc0ad6cea63d7b060455ccbe393fa18/sc1_lrg.jpg https://s3-eu-west-1.amazonaws.com/prod-ucs-content-store-eu-west/content/pii:S0926860X13006698/sc1/HIGHRES/image/jpeg/0cc0ad6cea63d7b060455ccbe393fa18/sc1_lrg.jpg sc1 sc1_lrg.jpg jpg 126544 593 1810 IMAGE-HIGH-RES 1-s2.0-S0926860X13006698-gr5_lrg.jpg https://s3.amazonaws.com/prod-ucs-content-store-us-east/content/pii:S0926860X13006698/gr5/HIGHRES/image/jpeg/433b63d180a5d22d8add3922429035e5/gr5_lrg.jpg https://s3-eu-west-1.amazonaws.com/prod-ucs-content-store-eu-west/content/pii:S0926860X13006698/gr5/HIGHRES/image/jpeg/433b63d180a5d22d8add3922429035e5/gr5_lrg.jpg gr5 gr5_lrg.jpg jpg 446535 1566 2410 IMAGE-HIGH-RES 1-s2.0-S0926860X13006698-gr4_lrg.jpg https://s3.amazonaws.com/prod-ucs-content-store-us-east/content/pii:S0926860X13006698/gr4/HIGHRES/image/jpeg/ae0aafc95fe0ce397bbea5308e1c9392/gr4_lrg.jpg https://s3-eu-west-1.amazonaws.com/prod-ucs-content-store-eu-west/content/pii:S0926860X13006698/gr4/HIGHRES/image/jpeg/ae0aafc95fe0ce397bbea5308e1c9392/gr4_lrg.jpg gr4 gr4_lrg.jpg jpg 800326 1511 3518 IMAGE-HIGH-RES 1-s2.0-S0926860X13006698-gr3_lrg.jpg https://s3.amazonaws.com/prod-ucs-content-store-us-east/content/pii:S0926860X13006698/gr3/HIGHRES/image/jpeg/9e7e493078328de4681a9255242b61be/gr3_lrg.jpg https://s3-eu-west-1.amazonaws.com/prod-ucs-content-store-eu-west/content/pii:S0926860X13006698/gr3/HIGHRES/image/jpeg/9e7e493078328de4681a9255242b61be/gr3_lrg.jpg gr3 gr3_lrg.jpg jpg 142401 1199 2010 IMAGE-HIGH-RES 1-s2.0-S0926860X13006698-gr2_lrg.jpg https://s3.amazonaws.com/prod-ucs-content-store-us-east/content/pii:S0926860X13006698/gr2/HIGHRES/image/jpeg/e7514c0db945b6cb2c9ddfad8282afda/gr2_lrg.jpg https://s3-eu-west-1.amazonaws.com/prod-ucs-content-store-eu-west/content/pii:S0926860X13006698/gr2/HIGHRES/image/jpeg/e7514c0db945b6cb2c9ddfad8282afda/gr2_lrg.jpg gr2 gr2_lrg.jpg jpg 116069 1187 2010 IMAGE-HIGH-RES 1-s2.0-S0926860X13006698-gr1_lrg.jpg https://s3.amazonaws.com/prod-ucs-content-store-us-east/content/pii:S0926860X13006698/gr1/HIGHRES/image/jpeg/a3dcec00fb29f419fd875f570ae5fe20/gr1_lrg.jpg https://s3-eu-west-1.amazonaws.com/prod-ucs-content-store-eu-west/content/pii:S0926860X13006698/gr1/HIGHRES/image/jpeg/a3dcec00fb29f419fd875f570ae5fe20/gr1_lrg.jpg gr1 gr1_lrg.jpg jpg 1180402 1759 4010 IMAGE-HIGH-RES 1-s2.0-S0926860X13006698-fx3_lrg.jpg https://s3.amazonaws.com/prod-ucs-content-store-us-east/content/pii:S0926860X13006698/fx3/HIGHRES/image/jpeg/666fb9e2feceb2540884491431d39579/fx3_lrg.jpg https://s3-eu-west-1.amazonaws.com/prod-ucs-content-store-eu-west/content/pii:S0926860X13006698/fx3/HIGHRES/image/jpeg/666fb9e2feceb2540884491431d39579/fx3_lrg.jpg fx3 fx3_lrg.jpg jpg 134359 886 2213 IMAGE-HIGH-RES 1-s2.0-S0926860X13006698-fx2_lrg.jpg https://s3.amazonaws.com/prod-ucs-content-store-us-east/content/pii:S0926860X13006698/fx2/HIGHRES/image/jpeg/1e6d0ef7d745bee6a88791bf8cc0d1e1/fx2_lrg.jpg https://s3-eu-west-1.amazonaws.com/prod-ucs-content-store-eu-west/content/pii:S0926860X13006698/fx2/HIGHRES/image/jpeg/1e6d0ef7d745bee6a88791bf8cc0d1e1/fx2_lrg.jpg fx2 fx2_lrg.jpg jpg 82566 886 2213 IMAGE-HIGH-RES 1-s2.0-S0926860X13006698-fx1_lrg.jpg https://s3.amazonaws.com/prod-ucs-content-store-us-east/content/pii:S0926860X13006698/fx1/HIGHRES/image/jpeg/13aaa9eb3cd9c0eb168be5c574a5a913/fx1_lrg.jpg https://s3-eu-west-1.amazonaws.com/prod-ucs-content-store-eu-west/content/pii:S0926860X13006698/fx1/HIGHRES/image/jpeg/13aaa9eb3cd9c0eb168be5c574a5a913/fx1_lrg.jpg fx1 true fx1_lrg.jpg jpg 103815 886 2213 IMAGE-HIGH-RES 1-s2.0-S0926860X13006698-sc1.jpg https://s3.amazonaws.com/prod-ucs-content-store-us-east/content/pii:S0926860X13006698/sc1/DOWNSAMPLED/image/jpeg/3abfab2dd6e464b8a200429e3b18693e/sc1.jpg https://s3-eu-west-1.amazonaws.com/prod-ucs-content-store-eu-west/content/pii:S0926860X13006698/sc1/DOWNSAMPLED/image/jpeg/3abfab2dd6e464b8a200429e3b18693e/sc1.jpg sc1 sc1.jpg jpg 17914 111 340 IMAGE-DOWNSAMPLED 1-s2.0-S0926860X13006698-gr5.jpg https://s3.amazonaws.com/prod-ucs-content-store-us-east/content/pii:S0926860X13006698/gr5/DOWNSAMPLED/image/jpeg/e34bc52492a18380bb53d9527be76a6b/gr5.jpg https://s3-eu-west-1.amazonaws.com/prod-ucs-content-store-eu-west/content/pii:S0926860X13006698/gr5/DOWNSAMPLED/image/jpeg/e34bc52492a18380bb53d9527be76a6b/gr5.jpg gr5 gr5.jpg jpg 43860 294 453 IMAGE-DOWNSAMPLED 1-s2.0-S0926860X13006698-gr4.jpg https://s3.amazonaws.com/prod-ucs-content-store-us-east/content/pii:S0926860X13006698/gr4/DOWNSAMPLED/image/jpeg/722ee08cfd655ef1af548f190a0b36e6/gr4.jpg https://s3-eu-west-1.amazonaws.com/prod-ucs-content-store-eu-west/content/pii:S0926860X13006698/gr4/DOWNSAMPLED/image/jpeg/722ee08cfd655ef1af548f190a0b36e6/gr4.jpg gr4 gr4.jpg jpg 41559 284 662 IMAGE-DOWNSAMPLED 1-s2.0-S0926860X13006698-gr3.jpg https://s3.amazonaws.com/prod-ucs-content-store-us-east/content/pii:S0926860X13006698/gr3/DOWNSAMPLED/image/jpeg/bfe78246c49a32047f6ab51a738befcc/gr3.jpg https://s3-eu-west-1.amazonaws.com/prod-ucs-content-store-eu-west/content/pii:S0926860X13006698/gr3/DOWNSAMPLED/image/jpeg/bfe78246c49a32047f6ab51a738befcc/gr3.jpg gr3 gr3.jpg jpg 20549 225 378 IMAGE-DOWNSAMPLED 1-s2.0-S0926860X13006698-gr2.jpg https://s3.amazonaws.com/prod-ucs-content-store-us-east/content/pii:S0926860X13006698/gr2/DOWNSAMPLED/image/jpeg/658ef0f7c3d1af4ad9002322868abb37/gr2.jpg https://s3-eu-west-1.amazonaws.com/prod-ucs-content-store-eu-west/content/pii:S0926860X13006698/gr2/DOWNSAMPLED/image/jpeg/658ef0f7c3d1af4ad9002322868abb37/gr2.jpg gr2 gr2.jpg jpg 17260 223 378 IMAGE-DOWNSAMPLED 1-s2.0-S0926860X13006698-gr1.jpg https://s3.amazonaws.com/prod-ucs-content-store-us-east/content/pii:S0926860X13006698/gr1/DOWNSAMPLED/image/jpeg/95c862afdda57e37ffbe1fcc0abb0392/gr1.jpg https://s3-eu-west-1.amazonaws.com/prod-ucs-content-store-eu-west/content/pii:S0926860X13006698/gr1/DOWNSAMPLED/image/jpeg/95c862afdda57e37ffbe1fcc0abb0392/gr1.jpg gr1 gr1.jpg jpg 54798 331 755 IMAGE-DOWNSAMPLED 1-s2.0-S0926860X13006698-fx3.jpg https://s3.amazonaws.com/prod-ucs-content-store-us-east/content/pii:S0926860X13006698/fx3/DOWNSAMPLED/image/jpeg/e434d1d50786163fe5874f2525afe42c/fx3.jpg https://s3-eu-west-1.amazonaws.com/prod-ucs-content-store-eu-west/content/pii:S0926860X13006698/fx3/DOWNSAMPLED/image/jpeg/e434d1d50786163fe5874f2525afe42c/fx3.jpg fx3 fx3.jpg jpg 18154 200 500 IMAGE-DOWNSAMPLED 1-s2.0-S0926860X13006698-fx2.jpg https://s3.amazonaws.com/prod-ucs-content-store-us-east/content/pii:S0926860X13006698/fx2/DOWNSAMPLED/image/jpeg/4f1f7b0d467371d254dde684aa68ce99/fx2.jpg https://s3-eu-west-1.amazonaws.com/prod-ucs-content-store-eu-west/content/pii:S0926860X13006698/fx2/DOWNSAMPLED/image/jpeg/4f1f7b0d467371d254dde684aa68ce99/fx2.jpg fx2 fx2.jpg jpg 10427 200 500 IMAGE-DOWNSAMPLED 1-s2.0-S0926860X13006698-fx1.jpg https://s3.amazonaws.com/prod-ucs-content-store-us-east/content/pii:S0926860X13006698/fx1/DOWNSAMPLED/image/jpeg/eeac22f5fab182a28ab9628731afe2a5/fx1.jpg https://s3-eu-west-1.amazonaws.com/prod-ucs-content-store-eu-west/content/pii:S0926860X13006698/fx1/DOWNSAMPLED/image/jpeg/eeac22f5fab182a28ab9628731afe2a5/fx1.jpg fx1 true fx1.jpg jpg 13776 200 500 IMAGE-DOWNSAMPLED 1-s2.0-S0926860X13006698-sc1.sml https://s3.amazonaws.com/prod-ucs-content-store-us-east/content/pii:S0926860X13006698/sc1/THUMBNAIL/image/gif/16d6c988a20228846c414a621e2e1efc/sc1.sml https://s3-eu-west-1.amazonaws.com/prod-ucs-content-store-eu-west/content/pii:S0926860X13006698/sc1/THUMBNAIL/image/gif/16d6c988a20228846c414a621e2e1efc/sc1.sml sc1 sc1.sml sml 2619 72 219 IMAGE-THUMBNAIL 1-s2.0-S0926860X13006698-gr5.sml https://s3.amazonaws.com/prod-ucs-content-store-us-east/content/pii:S0926860X13006698/gr5/THUMBNAIL/image/gif/e941271c36c1869ed14872f54b037a40/gr5.sml https://s3-eu-west-1.amazonaws.com/prod-ucs-content-store-eu-west/content/pii:S0926860X13006698/gr5/THUMBNAIL/image/gif/e941271c36c1869ed14872f54b037a40/gr5.sml gr5 gr5.sml sml 5144 142 219 IMAGE-THUMBNAIL 1-s2.0-S0926860X13006698-gr4.sml https://s3.amazonaws.com/prod-ucs-content-store-us-east/content/pii:S0926860X13006698/gr4/THUMBNAIL/image/gif/7293f62bb5875fe0630ca305143537fb/gr4.sml https://s3-eu-west-1.amazonaws.com/prod-ucs-content-store-eu-west/content/pii:S0926860X13006698/gr4/THUMBNAIL/image/gif/7293f62bb5875fe0630ca305143537fb/gr4.sml gr4 gr4.sml sml 4126 94 219 IMAGE-THUMBNAIL 1-s2.0-S0926860X13006698-gr3.sml https://s3.amazonaws.com/prod-ucs-content-store-us-east/content/pii:S0926860X13006698/gr3/THUMBNAIL/image/gif/7c182f09124a4badc081933d180a6233/gr3.sml https://s3-eu-west-1.amazonaws.com/prod-ucs-content-store-eu-west/content/pii:S0926860X13006698/gr3/THUMBNAIL/image/gif/7c182f09124a4badc081933d180a6233/gr3.sml gr3 gr3.sml sml 3140 131 219 IMAGE-THUMBNAIL 1-s2.0-S0926860X13006698-gr2.sml https://s3.amazonaws.com/prod-ucs-content-store-us-east/content/pii:S0926860X13006698/gr2/THUMBNAIL/image/gif/c24d86530da759e297248098f8620aaa/gr2.sml https://s3-eu-west-1.amazonaws.com/prod-ucs-content-store-eu-west/content/pii:S0926860X13006698/gr2/THUMBNAIL/image/gif/c24d86530da759e297248098f8620aaa/gr2.sml gr2 gr2.sml sml 2175 129 219 IMAGE-THUMBNAIL 1-s2.0-S0926860X13006698-gr1.sml https://s3.amazonaws.com/prod-ucs-content-store-us-east/content/pii:S0926860X13006698/gr1/THUMBNAIL/image/gif/2b30810657cf42bc5ce539d2414d7910/gr1.sml https://s3-eu-west-1.amazonaws.com/prod-ucs-content-store-eu-west/content/pii:S0926860X13006698/gr1/THUMBNAIL/image/gif/2b30810657cf42bc5ce539d2414d7910/gr1.sml gr1 gr1.sml sml 4354 96 219 IMAGE-THUMBNAIL 1-s2.0-S0926860X13006698-fx3.sml https://s3.amazonaws.com/prod-ucs-content-store-us-east/content/pii:S0926860X13006698/fx3/THUMBNAIL/image/gif/979843356697c7cbd92f6942a8dbf286/fx3.sml https://s3-eu-west-1.amazonaws.com/prod-ucs-content-store-eu-west/content/pii:S0926860X13006698/fx3/THUMBNAIL/image/gif/979843356697c7cbd92f6942a8dbf286/fx3.sml fx3 fx3.sml sml 3446 88 219 IMAGE-THUMBNAIL 1-s2.0-S0926860X13006698-fx2.sml https://s3.amazonaws.com/prod-ucs-content-store-us-east/content/pii:S0926860X13006698/fx2/THUMBNAIL/image/gif/101211bf707ff761b332a5e60035c2f7/fx2.sml https://s3-eu-west-1.amazonaws.com/prod-ucs-content-store-eu-west/content/pii:S0926860X13006698/fx2/THUMBNAIL/image/gif/101211bf707ff761b332a5e60035c2f7/fx2.sml fx2 fx2.sml sml 2256 88 219 IMAGE-THUMBNAIL 1-s2.0-S0926860X13006698-fx1.sml https://s3.amazonaws.com/prod-ucs-content-store-us-east/content/pii:S0926860X13006698/fx1/THUMBNAIL/image/gif/cb6c0fb49157e8210d530c4a535caa34/fx1.sml https://s3-eu-west-1.amazonaws.com/prod-ucs-content-store-eu-west/content/pii:S0926860X13006698/fx1/THUMBNAIL/image/gif/cb6c0fb49157e8210d530c4a535caa34/fx1.sml fx1 true fx1.sml sml 2825 88 219 IMAGE-THUMBNAIL 1-s2.0-S0926860X13006698-mmc1.pdf https://s3.amazonaws.com/prod-ucs-content-store-us-east/content/pii:S0926860X13006698/mmc1/MAIN/application/pdf/45d6e4126627c3f7f02eee933eead6b5/mmc1.pdf https://s3-eu-west-1.amazonaws.com/prod-ucs-content-store-eu-west/content/pii:S0926860X13006698/mmc1/MAIN/application/pdf/45d6e4126627c3f7f02eee933eead6b5/mmc1.pdf mmc1 mmc1.pdf pdf 27213106 APPLICATION APCATA 14544 S0926-860X(13)00669-8 10.1016/j.apcata.2013.10.050 Elsevier B.V. Fig. 1 X-Ray photoelectron spectroscopy and TEM image of the fresh osmium impregnated magnetite catalyst. Fig. 2 Plot-time yield for the standard preparation of compound 2a using different amounts of catalyst [NMO (200mol%), Me2CO:H2O (2:1), 100°C, 3h]. Fig. 3 Correlation between initial rates and catalyst amount for the standard preparation of compound 2a [NMO (200mol%), Me2CO:H2O (2:1), 100°C, 3h]. Fig. 4 X-Ray photoelectron spectroscopy and TEM image of the recycled osmium impregnated magnetite catalyst [NMO (200mol%), Me2CO:H2O (2:1), 100°C, 3h]. Fig. 5 Particle size of fresh and recycled [NMO (200mol%), Me2CO:H2O (2:1), 100°C, 3h] osmium oxide derivatives on the surface of magnetite. Scheme 1 Selective dihydroxylation of 1,5-dienes. Table 1 Optimization of reaction conditions a . Entry T (°C) Solvent Oxidant (mol%) Conversion (%) b t (h) Yield (%) c 1 70 Acetone:H2O (2:1) NMO (130) 65 24 63 2 50 Acetone:H2O (2:1) NMO (130) 43 48 43 3 100 Acetone:H2O (2:1) NMO (130) 72 3 72 4 130 Acetone:H2O (2:1) NMO (130) 71 3 71 5 100 H2O NMO (130) 10 24 0 6 100 PhMe:H2O (2:1) NMO (130) 10 24 0 7 100 PhMe NMO (130) 45 24 40 8 100 Acetone:H2O (2:1) t-BuOOH (130) 15 24 0 9 100 Acetone:H2O (2:1) H2O2 (130) 5 24 0 10 100 Acetone:H2O (2:1) (CH3)3N–O (130) 55 3 52 11 100 Acetone:H2O (2:1) Isoquinoline N-oxide (130) 2 24 0 12 100 Acetone:H2O (2:1) NMO (200) 99 1 97 13 100 Acetone:H2O (2:1) NMO (300) 90 1 89 14 d 100 Acetone:H2O (2:1) NMO (200) 90 1 87 5 e 100 Acetone:H2O (2:1) NMO (200) 84 1 77 16 f 100 Acetone:H2O (2:1) NMO (200) 55 (99) g 1 55 (96) g 17 h 100 Acetone:H2O (2:1) NMO (200) 20 (33) i 1 12 (27) i a Reactions performed using 1a (1mmol) in 3mL of solvent. b Calculated from GC analysis of crude mixture. c Isolated yield. d Reaction performed with 0.8mol% of catalyst. e Reaction performed with 0.2mol% of catalyst. f Reaction performed with 0.08mol% of catalyst. g The result after 3h of reaction appear in parenthesis. h Reaction performed with 0.04mol% of catalyst. i The result after 48h of reaction appear in parenthesis. Table 2 Dihydroxylation of alkenes a . Entry Alkene Compound Conversion (%) b Yield (%) c 1 (E)-1-phenylprop-1-ene 2a 99 96 2 Styrene 2b 90 87 3 1-Phenylprop-1-ene 2c 99 98 4 Methylenecyclopentane 2d 72 71 5 1,1-Diphenylethene 2e 75 73 6 (E)-stilbene 2f 90 87 7 (Z)-stilbene 2g 75 54 d 8 (E)-hex-3-ene 2h 83 81 9 (Z)-hex-3-ene 2i 80 77 10 Dodec-1-ene 2j 99 99 11 4-Phenylbut-1-ene 2k 95 93 12 Cyclohexene 2l 80 79 13 Cyclooctene 2m 95 92 14 1-Methylcyclohex-1-ene 2n 85 84 15 1H-indene 2o 70 66 16 Allyloxybenzene 2p 85 80 17 Allyl benzoate 2q 90 75 18 Methyl cinnamate 2r 65 49 19 (Z/E)-β-bromostyrene 2s 0 0 e a Reactions performed using 1 (1mmol), NMO (2mmol) in acetone (2mL) and water (1mL) at 100°C during 3h. b Calculated from GC analysis of crude mixture. c Isolated yield. d Compound 2f was isolated in 16% yield. e Starting material recovered unchanged. Osmium impregnated on magnetite as a heterogeneous catalyst for the syn-dihydroxylation of alkenes Rafael Cano Juana M. Pérez Diego J. Ramón ⁎ Instituto de Síntesis Orgánica (ISO), and Departamento de Química Orgánica, Facultad de Ciencias, Universidad de Alicante, Apdo. 99, E-03080 Alicante, Spain Instituto de Síntesis Orgánica (ISO), and Departamento de Química Orgánica, Facultad de Ciencias, Universidad de Alicante Apdo. 99 Alicante E-03080 Spain ⁎ Corresponding author. Tel.: +34 965903986; fax: +34 965903549. Graphical abstract A new catalyst derived from osmium has been prepared, fully characterized and tested in the dihydroxylation of alkenes. The catalyst was prepared by wet impregnation methodology of OsCl3·3H2O on a commercial micro-magnetite surface. The catalyst allowed the reaction with one of the lowest osmium loadings for a heterogeneous catalyst and was selective for the monodihydroxylation of 1,5-dienes. Moreover, the catalyst was easily removed from the reaction medium by the simple use of a magnet. The selectivity of catalyst is very high with conversions up to 99%. Preliminary kinetics studies showed a first-order reaction rate with respect to the catalyst. Keywords Heterogeneous catalyst Dihydroxylation process Magnetite Osmium oxide 1 Introduction The syn-dihydroxylation of alkenes for the preparation of diols [1,2] is one of the most explored reactions in organic chemistry due to the importance of these compounds for the fine chemical industry and their use as intermediates for pharmaceuticals and agrochemicals. The most employed catalyst for this transformation is OsO4, with the asymmetric version of this reaction being performed using the appropriated chiral ligands [3–6]. The use of the aforementioned oxide has important drawbacks such as the high cost, its high volatility and its toxicity, which limits or makes very difficult its application in industry, and in the laboratory. In the last years a great effort has been made to prepare heterogeneous catalysts [7–11] which overcome these problems. Different supports having osmium salts in different loadings (osmium/support ratio), such as polymers (0.25–5mol%) [12–15], silica (0.25mol%) [16], cinchona modified silica gel (1mol%) [17–19], hydrotalcites (8.5mol%) [20,21], dendrimers (0.25–1mol%) [22,23], polysiloxane (1mol%) [24], imigolite (0.25mol%) [25] fullerenes (3.8mol%) [26], magnetically recoverable quaternary ammonium salts (2mol%) [27], or zeolites (0.6mol%) [28] have been reported for this purpose, as well as other strategies including microencapsulation (5mol%) [29–31], ion-exchange technique (0.5–2.5mol%) [32–35], and the use of poly(ethylene glycol) (0.5mol%) [36] or ionic liquids (0.5–2mol%) [37,38]. The majority of these catalyst preparation strategies suffer the need of a large and complicated work in the corresponding catalyst elaboration, so the initial interest has not been transformed into general industrial applications. We have recently developed a new, simple and robust method to immobilize different metal oxides [39–48] on the surface of the magnetite [49–51]. Here, we show the effective application of this new osmium impregnated on magnetite catalyst in organic synthesis for the syn-dihydroxylation of alkenes. 2 Experimental 2.1 General procedure for the preparation of catalyst To a stirred solution of OsCl3·3H2O (349mg, 1mmol) in deionized water (120mL) was added Fe3O4 (4g, 17mmol, powder <5μm, BET area: 9.86m2/g). After 10min at room temperature, the mixture was slowly basified with NaOH (1M) until pH around 13. The mixture was stirred during one day at room temperature. After that, the catalyst was filtered under vacuum and washed several times with deionized water (3×10mL). The solid was dried at 100°C during 24h in a standard glassware oven, obtaining the expected catalyst. 2.2 Characterization of catalyst XRD patterns were recorded on a Brucker D8 advance diffractometer with monochromatized Cu Kα radiation (λ =0.15406nm) at a setting of 40kV and 40mA. TEM images were obtained on a JEOL JEM-2010 electron microscope equipped with an X-ray detector for microanalysis (EDS). XRF analyses were obtained on a X-ray spectrometer PHILIPS MAGIX PRO equipped with a rhodium X-ray tube and a beryllium window. Surfaces areas were determined by the application of the BET equation to N2 adsorption isotherm at 77K. Adsorption data were obtained from a QUANTACROME AUTOSORB-6 equipment. 2.3 General procedure for the dihydroxylation of alkenes To a stirred solution of alkene (1, 1mmol) in a mixture of acetone:H2O 2:1 (3mL) in a pressure tube, OsO2–Fe3O4 (10mg, 0.08% of osmium) and NMO (234mg, 2mmol) were added. The resulting mixture was stirred at 100°C during 3h. The catalyst was removed by a magnet and the resulting solution was extracted with ether. The organic phases were dried over MgSO4, and the solvents were removed under reduced pressure. The product was usually purified by chromatography on silica gel (hexane/ethyl acetate) to give the corresponding products 2 or 4. Physical and spectroscopic data as well as literature for all compounds are included as Appendices A and B. FT-IR spectra were obtained on a Nicolet impact 400D spectrophotometer. NMR spectra were recorded on a Bruker AC-300 apparatus (300MHz for 1H and 75MHz for 13C) using CDCl3 as a solvent and TMS as internal standard for 1H and 13C; chemical shifts are given in δ (parts per million) and coupling constants (J) in Hertz. Mass spectra (EI) were obtained at 70eV on a spectrometer Agilent GC/MS-5973N, giving fragment ions in m/z with relative intensities (%) in parentheses. Thin layer chromatography (TLC) was carried out on DC-Fertigfolien ALUGRAM plates coated with a 0.2mm layer of silica gel; detection by UV254 light, staining with phosphomolybdic acid [25g phosphomolybdic acid, 10g Ce(SO4)2·4H2O, 60mL of concentrated H2SO4 and 940mL H2O]. Column chromatography was performed using silica gel 60 of 35–70mesh. 3 Results and discussion 3.1 Synthesis of catalyst The catalyst was easily prepared by the typical wet impregnation methodology. The addition of commercial micro-particles of magnetite to an aqueous solution of OsCl3, followed by the increasing of the pH of the solution up to nearly 13 by addition of 2M aqueous solution of NaOH, filtering, washing with water and evaporation of water at 100°C during 24h rendered the catalyst (non osmium species were detected in the aqueous mixture, coming from the evaporated phase, which was collected in a liquid nitrogen trap). The XRD analysis of freshly prepared catalyst did not provide any concluding information due to the low metal osmiun loading and its high dispersion, with exception of the support diffraction peaks (Fe3O4, see Appendices A and B). The total incorporation of osmium was around 1.6%, according to the XRF and the BET area surface was 8.6m2/g, almost the same as in the starting magnetite (9.8m2/g). The distribution of osmium particles seems to be homogenous on the surface of magnetite, according to the TEM images (Fig. 1 ), and the size distribution was 1.7±0.6nm. The XPS spectra showed the presence of two osmium species in a nearly 1:1 mixture, and these species seemed to be OsO2 and OsO2(OH)2 according to the binding energies (Fig. 1)[52]. 3.2 Dihydroxylation reactions Once the catalyst was prepared and fully characterized, we faced the problem of their activity in dihydroxylation processes. Initial studies were performed upon the reaction of (E)-1-phenylprop-1-ene (1a) with 4-methylmorpholine N-oxide (NMO), as the oxidant, in a mixture of solvents (acetone/H2O: 2/1) at 70°C and the effects of different parameters were evaluated (Table 1 ). First, the effect of the temperature of the reaction was studied (entries 1–4). When the temperature was reduced to 50°C the reaction took place, although it needed a longer reaction time to achieve similar yield. The increase of the temperature to 100°C allowed to obtain the corresponding diol 2a in 72% yield in only 3h (entry 3). However, a further increase on the temperature gave similar results (entry 4). Then, other solvents were tested in the reaction (entries 5–7), but the initial mixture of acetone:H2O gave the best results. Only in the case of using toluene, it was possible to obtain the diol 2a in modest yield (entry 7). The reaction failed when other oxidants, such as t-BuOOH, H2O2, or isoquinoline N-oxide, were used. Only using trimethylamine N-oxide similar result was obtained (entry 10). The importance of the amount of oxidant was also evaluated (entries 12 and 13). When the amount of the oxidant was increased to 200mol% the corresponding diol was obtained in 97% yield in only 1h. However, increasing the amount of the oxidant to 300mol% did not improve the previous result. Finally, the amount of catalyst was optimized (entries 14–16), finding that a good result was obtained when 0.4mol% of osmium was added (entry 12). However, similar yield was obtained when a lower amount of osmium (0.08mol%) was added (entry 16), but the reaction time had to be increased up to 3h in order to achieve the same yield (96%). In order to test the formation of toxic volatile osmium species, after performing the reaction at 100°C and removing carefully the catalyst and the solution, the walls and the cap of pressure tube were washed with methanol and water. This washing solution was analyzed by ICP–MS, with the amount of osmium in this washing solution being lower than 0.01% of the initial charged osmium. When the reaction was repeated with only 0.04mol% of catalyst, the yield decreased drastically (entry 17), and in this case, when the reaction was repeated increasing the reaction time to 3h the yield kept modest (27%). In almost all cases, the only compound detected by GC–MS analysis of the crude mixture was the product 2a, and variable amounts of starting alkene 1a. To the best of our knowledge, the optimal conditions found for this reaction involved the use of the lowest catalyst loading ever reported, without taking in account the possible recyclability.The evolution of yield of compound 2a with the time at different catalyst loadings is depicted in Fig. 2 . Assuming that the equation rate is simple and that the reaction conditions permit a pseudo-first order approximation for all reagents, the equation rate could be expressed as Ln r 0i = α Ln [catalyst] i +constant. The estimation of the initial reaction rate for each trial and their representation permitted us to calculate the value of the reaction order for the catalyst (Fig. 3 ), with the obtained value (1.1) being very close to a first order. The magnetite support was tested in order to confirm that it was inert, and after 24h the starting alkene was recovered unmodified. Other transition metal oxides impregnated on magnetite such as cobalt, nickel, copper, ruthenium, palladium, iridium, or platinum were also tested in the reaction, but none of them showed activity. Finally, the reaction was performed in absence of catalyst, and the starting material was recovered after 24h. Once the activity of the catalyst was demonstrated, the problem of the recyclability was faced. After the reaction, the catalyst was kept inside the vessel using a magnet, decanting the liquid reaction media. Then, the catalyst was washed with diethyl ether, and re-used under the same reaction conditions described in the entry 16 of Table 1. Unfortunately, the yield obtained in the second cycle was only 40% after 24h of reaction. The ICP–MS analysis of the reaction solution, after the first trial, showed the presence of osmium (5.1% of the initial amount) and iron (0.01% of the initial amount). Meanwhile, the XRF data of used catalyst showed 1.4% of osmium amount, in good agreement with the ICP–MS analysis of reaction solution. The XPS studies showed that the iron species in the initial and in the recovered catalyst were the same. In the case of oxygen, the expected decrease of the relative intensity between oxygen bonded to osmium and to iron was also detected, being in both cases the same species (see Appendices A and B). However, just one species of osmium (OsO2) on the surface of catalyst was detected (Fig. 4 ). However, it should be pointed out that the initial catalyst data had showed the presence of OsO2 and OsO2(OH)2 in a 1:1 ratio. So, the decrease on the catalyst activity would be due to the partial leaching of the OsO2(OH)2 species as well as its transformation to OsO2 in the reaction media. Finally, it should notice that the simple removal of catalyst by a magnet is quite efficient since more than 97% of initial mass was recovered according to its weight. The analysis of the TEM images of the used catalyst showed a slight process of sinterization of the particles. Initially the particles of osmium had a distribution of size of 1.7±0.6nm, and after the reaction the distribution was 2.2±0.7nm, but this change is not sufficient to explain the lost of its activity (Fig. 5 ). The BET area of the recycled catalyst was 11.9m2/g, which is in the range of starting values. To know if the reaction took place by the leached osmium to the organic medium, we performed the standard dihydroxylation of alkene 1a (Table 1, entry 16). After that, the catalyst was removed carefully by a magnet at high temperature. The solvents of the above solution, without catalyst, were removed under low pressure and dodec-1-ene, NMO, acetone and water were added to the above residue. The resulting mixture was heated again at 100°C for 3h. The analysis of crude mixture, after hydrolysis, revealed the formation of compound 2a in 93% (catalyzed process) and product (2j) with only 21% yield (compare with entry 10 in Table 2 ). Therefore, we could not exclude that the final leached osmium was partially responsible for the reaction results. With the best conditions in hand, the scope of the reaction was evaluated (Table 2). The reaction gave excellent yields independently of the substitution of the alkene (entries 1–5). A slight decrease in the yields was observed when 1,1-disubstituted alkenes were used (entries 4 and 5). Then, the influence of the configuration of the alkene was evaluated performing the reaction with (Z)- and (E)-stilbene (entries 6 and 7), and better result was obtained in the case of the E-isomer. The reaction with the Z-isomer rendered the expected diol in lower yield (compare entries 6 and 7), and 16% of the diol arising from the isomerization of the starting Z-alkene to the E-isomer, followed by a dihydroxylation process. However, the related aliphatic alkenes did not show this isomerization process (entries 8 and 9), and only the syn-dihydroxylation products were detected for the reaction of (Z)- and (E)-hex-3-ene. Excellent results were achieved when aliphatic alkenes were tested, with independence of the nature of the alkene, such as terminal or internal (entries 8–15). The tolerance of other functional groups was also tested using allylic ether or ester moieties, obtaining the corresponding diol with similar results (entries 16 and 17). Unfortunately, when the reaction was performed with a conjugated alkene, the yield decreased somewhat (entry 18), and the reaction failed when a (Z/E)-mixture of β-bromostyrene was used, recovering unchanged the starting material (entry 19). Finally, it should be pointed out that the selectivity of the reaction was nearly 100% since the only product detected by GC–MS from the crude mixture was the expected diol 2 and the corresponding unchanged alkene 1, with the exception of the (Z)-stilbene case (entry 7).The same reaction conditions were applied to afford the hydroxylation of dienes (Scheme 1 ). However, the only isolated product from the reaction media was the diol arising from a monodihydroxylation process in low yields using 400mol% of oxidant, with the starting reagent being the other product detected by CG–MS from the crude reaction media. The catalyst was selective for this process, because the double dihydroxylation product was not detected even when a large excess of oxidant was added (800mol%). It should be pointed that the reaction gave the monohydroxylation products in similar yields (4a: 49%, 4b: 42%), with only 200mol% of oxidant. 4 Conclusion In conclusion, we have demonstrated that the impregnated osmium on magnetite system is a good catalyst for the dihydroxylation of alkenes, with one of the lowest osmium loadings described for heterogeneous catalyst so far. An interesting selectivity was achieved in the case of 1,5-diines, with only the monodihydroxylation process being performed. Moreover, the catalyst is easily removed from the reaction medium just by the use of a simple magnet. Acknowledgements This work was supported by the Spanish Ministerio de Economía y Competitividad (CTQ2011-24151). J. M. P. thanks the M.E.C. for a fellowship through the FPI program. We gratefully acknowledge the polishing of our English by Mrs. Oriana C. Townley. Appendix A Supplementary data Supplementary data associated with this article can be found, in the online version, at http://dx.doi.org/10.1016/j.apcata.2013.10.050. Appendix A Supplementary data The following are the supplementary data to this article: References [1] C. Nativi S. Roelens J. Clayden Science of Synthesis l36 2008 Thieme Stuttgart 757 762 [2] U. Sundermeier C. Döbler M. Beller J.-E. Bäckvall Modern Oxidation Methods 2004 Wiley-VCH Weinheim 1 20 [3] Z.-M. Wang K.B. Sharpless J. Org. Chem. 59 1994 8302 8303 [4] C.E. Song J.W. Yang H.J. Ha S.-g. Lee Tetrahedron: Asymmetry 7 1996 645 648 [5] H. Han K.D. Janda Angew. Chem. Int. Ed. 36 1997 1731 1733 [6] C. Bolm A. Maischak A. Gerlach Chem. Commun. 1997 2353 2354 [7] C. Bolm A. Gerlach Eur. J. Org. Chem. 1998 21 27 [8] A. Severeyns D.E. De Vos P.A. Jacobs Top. Catal. 19 2002 125 131 [9] S. Kobayashi R. Akiyama Chem. Commun. 2003 449 460 [10] S. Kobayashi M. Sugiura Adv. Synth. Catal. 348 2006 1496 1504 [11] R. Akiyama S. Kobayashi Chem. Rev. 109 2009 594 642 [12] W.A. Herrmann R.M. Kratzer J. Blümel H.B. Friedrich R.W. Fischer D.C. Apperley J. Mink O. Berkesi J. Mol. Catal. A: Chem. 120 1997 197 205 [13] E. Nandanan A. Sudalai T. Ravindranathan Tetrahedron Lett. 38 1997 2577 2580 [14] B.S. Lee S. Mahajan K.D. Janda Tetrahedron Lett. 46 2005 4491 4493 [15] R. Akiyama N. Matsuki H. Nomura H. Yoshida T. Yoshida S. Kobayashi RSC Adv. 2 2012 7456 7461 [16] A. Severeyns D.E. De Vos L. Fiermans F. Verpoort P.J. Grobet P.A. Jacobs Angew. Chem. Int. Ed. 40 2001 586 589 [17] I. Motorina C.M. Crudden Org. Lett. 3 2001 2325 2328 [18] B.M. Choudary N.S. Chowdari K. Jyothi N.S. Kumar M.L. Kantam Chem. Commun. 2002 586 587 [19] S. Qiu J. Sun Y. Li L. Gao Mater. Res. Bull. 46 2011 1197 1201 [20] H.B. Friedrich M. Govender X. Makhoba T.D. Ngcobo M.O. Onami Chem. Commun. 2003 2922 2923 [21] T. Naicker A.K. Datye H.F. Friedrich Appl. Catal., A 350 2008 96 102 [22] W.-J. Tang N.-F. Yang B. Yi G.-J. Deng Y.-Y. Huang Q.-H. Fan Chem. Commun. 2004 1378 1379 [23] K.-i. Fujita M. Yamazaki T. Ainoya T. Tsuchimoto H. Yasuda Tetrahedron 66 2010 8536 8543 [24] M.S. DeClue J.S. Siegel Org. Biomol. Chem. 2 2004 2287 2298 [25] X. Qi H. Yoon S.-H. Lee J. Yoon S.-J. Kim J. Ind. Eng. Chem. 14 2008 136 141 [26] L.L. Lazarus R.L. Brutchey Dalton Trans. 39 2010 7888 7890 [27] K.-i. Fujita S. Umeki M. Yamazaki T. Ainoya T. Tsuchimoto H. Yasuda Tetrahedron Lett. 52 2011 3137 3140 [28] Ö. Metin N.A. Alp S. Akbayrak A. Biçer M.S. Gültekin S. Özkar U. Bozkaya Green Chem. 14 2012 1488 1492 [29] S. Nagayama M. Endo S. Kobayashi J. Org. Chem. 63 1998 6094 6095 [30] S. Kobayashi M. Endo S. Nagayama J. Am. Chem. Soc. 121 1999 11229 11230 [31] T. Ishida R. Akiyama S. Kobayashi Adv. Synth. Catal. 345 2003 576 579 [32] B.M. Choudary N.S. Chowdari M.L. Kantam K.V. Raghavan J. Am. Chem. Soc. 123 2001 9220 9221 [33] A. Severeyns D.E. De Vos P.A. Jacobs Green Chem. 4 2002 380 384 [34] B.M. Choudary K. Jyothi S. Madhi M.L. Kantam B. Sreedhar Adv. Synth. Catal. 346 2004 45 48 [35] S.K. Dehury V.S. Hariharakrishnan Tetrahedron Lett. 48 2007 2493 2496 [36] S. Chandrasekhar C. Narsihmulu S.S. Sultana N.R. Reddy Chem. Commun. 2003 1716 1717 [37] Q. Yao Org. Lett. 4 2002 2197 2199 [38] L.C. Branco A. Serbanovic M.N. da Ponte C.A.M. Afonso ACS Catal. 1 2011 1408 1413 [39] M.J. Aliaga D.J. Ramón M. Yus Org. Biomol. Chem. 8 2010 43 46 [40] R. Cano D.J. Ramón M. Yus J. Org. Chem. 75 2010 3458 3460 [41] R. Cano D.J. Ramón M. Yus Tetrahedron 67 2011 5432 5436 [42] R. Cano D.J. Ramón M. Yus J. Org. Chem. 76 2011 5547 5557 [43] R. Cano M. Yus D.J. Ramón Tetrahedron 67 2011 8079 8085 [44] R. Cano D.J. Ramón M. Yus Tetrahedron 68 2012 1393 1400 [45] R. Cano M. Yus D.J. Ramón ACS Catal. 2 2012 1070 1078 [46] R. Cano M. Yus D.J. Ramón Chem. Commun. 48 2012 7628 7630 [47] J.M. Pérez R. Cano M. Yus D.J. Ramón Eur. J. Org. Chem. 2012 4548 4554 [48] J.M. Pérez R. Cano M. Yus D.J. Ramón Synthesis 2013 1373 1379 [49] R. Martínez D.J. Ramón M. Yus Adv. Synth. Catal. 350 2008 1235 1240 [50] R. Martínez D.J. Ramón M. Yus Org. Biomol. Chem. 7 2009 2176 2181 [51] R. Cano M. Yus D.J. Ramón Synlett 2011 2017 2020 [52] http://srdata.nist.gov/xps and literature quoted therein",
      "scopus-id": "84888102763",
      "coredata": {
        "eid": "1-s2.0-S0926860X13006698",
        "dc:description": "A new catalyst derived from osmium has been prepared, fully characterized and tested in the dihydroxylation of alkenes. The catalyst was prepared by wet impregnation methodology of OsCl3·3H2O on a commercial micro-magnetite surface. The catalyst allowed the reaction with one of the lowest osmium loadings for a heterogeneous catalyst and was selective for the monodihydroxylation of 1,5-dienes. Moreover, the catalyst was easily removed from the reaction medium by the simple use of a magnet. The selectivity of catalyst is very high with conversions up to 99%. Preliminary kinetics studies showed a first-order reaction rate with respect to the catalyst.",
        "openArchiveArticle": "false",
        "prism:coverDate": "2014-01-30",
        "openaccessUserLicense": null,
        "prism:aggregationType": "Journal",
        "prism:url": "https://api.elsevier.com/content/article/pii/S0926860X13006698",
        "dc:creator": [
          {
            "@_fa": "true",
            "$": "Cano, Rafael"
          },
          {
            "@_fa": "true",
            "$": "Pérez, Juana M."
          },
          {
            "@_fa": "true",
            "$": "Ramón, Diego J."
          }
        ],
        "link": [
          {
            "@_fa": "true",
            "@rel": "self",
            "@href": "https://api.elsevier.com/content/article/pii/S0926860X13006698"
          },
          {
            "@_fa": "true",
            "@rel": "scidir",
            "@href": "https://www.sciencedirect.com/science/article/pii/S0926860X13006698"
          }
        ],
        "dc:format": "application/json",
        "openaccessType": null,
        "pii": "S0926-860X(13)00669-8",
        "prism:volume": "470",
        "prism:publisher": "Elsevier B.V.",
        "dc:title": "Osmium impregnated on magnetite as a heterogeneous catalyst for the syn-dihydroxylation of alkenes",
        "prism:copyright": "Copyright © 2013 Elsevier B.V. All rights reserved.",
        "openaccess": "0",
        "prism:issn": "0926860X",
        "dcterms:subject": [
          {
            "@_fa": "true",
            "$": "Heterogeneous catalyst"
          },
          {
            "@_fa": "true",
            "$": "Dihydroxylation process"
          },
          {
            "@_fa": "true",
            "$": "Magnetite"
          },
          {
            "@_fa": "true",
            "$": "Osmium oxide"
          }
        ],
        "openaccessArticle": "false",
        "prism:publicationName": "Applied Catalysis A: General",
        "openaccessSponsorType": null,
        "prism:pageRange": "177-182",
        "prism:endingPage": "182",
        "pubType": "fla",
        "prism:coverDisplayDate": "30 January 2014",
        "prism:doi": "10.1016/j.apcata.2013.10.050",
        "prism:startingPage": "177",
        "dc:identifier": "doi:10.1016/j.apcata.2013.10.050",
        "openaccessSponsorName": null
      },
      "objects": {
        "object": [
          {
            "@category": "high",
            "@height": "593",
            "@width": "1810",
            "@_fa": "true",
            "$": "https://api.elsevier.com/content/object/eid/1-s2.0-S0926860X13006698-sc1_lrg.jpg?httpAccept=%2A%2F%2A",
            "@multimediatype": "JPEG image file",
            "@type": "IMAGE-HIGH-RES",
            "@size": "126544",
            "@ref": "sc1",
            "@mimetype": "image/jpeg"
          },
          {
            "@category": "high",
            "@height": "1566",
            "@width": "2410",
            "@_fa": "true",
            "$": "https://api.elsevier.com/content/object/eid/1-s2.0-S0926860X13006698-gr5_lrg.jpg?httpAccept=%2A%2F%2A",
            "@multimediatype": "JPEG image file",
            "@type": "IMAGE-HIGH-RES",
            "@size": "446535",
            "@ref": "gr5",
            "@mimetype": "image/jpeg"
          },
          {
            "@category": "high",
            "@height": "1511",
            "@width": "3518",
            "@_fa": "true",
            "$": "https://api.elsevier.com/content/object/eid/1-s2.0-S0926860X13006698-gr4_lrg.jpg?httpAccept=%2A%2F%2A",
            "@multimediatype": "JPEG image file",
            "@type": "IMAGE-HIGH-RES",
            "@size": "800326",
            "@ref": "gr4",
            "@mimetype": "image/jpeg"
          },
          {
            "@category": "high",
            "@height": "1199",
            "@width": "2010",
            "@_fa": "true",
            "$": "https://api.elsevier.com/content/object/eid/1-s2.0-S0926860X13006698-gr3_lrg.jpg?httpAccept=%2A%2F%2A",
            "@multimediatype": "JPEG image file",
            "@type": "IMAGE-HIGH-RES",
            "@size": "142401",
            "@ref": "gr3",
            "@mimetype": "image/jpeg"
          },
          {
            "@category": "high",
            "@height": "1187",
            "@width": "2010",
            "@_fa": "true",
            "$": "https://api.elsevier.com/content/object/eid/1-s2.0-S0926860X13006698-gr2_lrg.jpg?httpAccept=%2A%2F%2A",
            "@multimediatype": "JPEG image file",
            "@type": "IMAGE-HIGH-RES",
            "@size": "116069",
            "@ref": "gr2",
            "@mimetype": "image/jpeg"
          },
          {
            "@category": "high",
            "@height": "1759",
            "@width": "4010",
            "@_fa": "true",
            "$": "https://api.elsevier.com/content/object/eid/1-s2.0-S0926860X13006698-gr1_lrg.jpg?httpAccept=%2A%2F%2A",
            "@multimediatype": "JPEG image file",
            "@type": "IMAGE-HIGH-RES",
            "@size": "1180402",
            "@ref": "gr1",
            "@mimetype": "image/jpeg"
          },
          {
            "@category": "high",
            "@height": "886",
            "@width": "2213",
            "@_fa": "true",
            "$": "https://api.elsevier.com/content/object/eid/1-s2.0-S0926860X13006698-fx3_lrg.jpg?httpAccept=%2A%2F%2A",
            "@multimediatype": "JPEG image file",
            "@type": "IMAGE-HIGH-RES",
            "@size": "134359",
            "@ref": "fx3",
            "@mimetype": "image/jpeg"
          },
          {
            "@category": "high",
            "@height": "886",
            "@width": "2213",
            "@_fa": "true",
            "$": "https://api.elsevier.com/content/object/eid/1-s2.0-S0926860X13006698-fx2_lrg.jpg?httpAccept=%2A%2F%2A",
            "@multimediatype": "JPEG image file",
            "@type": "IMAGE-HIGH-RES",
            "@size": "82566",
            "@ref": "fx2",
            "@mimetype": "image/jpeg"
          },
          {
            "@category": "high",
            "@height": "886",
            "@width": "2213",
            "@_fa": "true",
            "$": "https://api.elsevier.com/content/object/eid/1-s2.0-S0926860X13006698-fx1_lrg.jpg?httpAccept=%2A%2F%2A",
            "@multimediatype": "JPEG image file",
            "@type": "IMAGE-HIGH-RES",
            "@size": "103815",
            "@ref": "fx1",
            "@mimetype": "image/jpeg"
          },
          {
            "@category": "standard",
            "@height": "111",
            "@width": "340",
            "@_fa": "true",
            "$": "https://api.elsevier.com/content/object/eid/1-s2.0-S0926860X13006698-sc1.jpg?httpAccept=%2A%2F%2A",
            "@multimediatype": "JPEG image file",
            "@type": "IMAGE-DOWNSAMPLED",
            "@size": "17914",
            "@ref": "sc1",
            "@mimetype": "image/jpeg"
          },
          {
            "@category": "standard",
            "@height": "294",
            "@width": "453",
            "@_fa": "true",
            "$": "https://api.elsevier.com/content/object/eid/1-s2.0-S0926860X13006698-gr5.jpg?httpAccept=%2A%2F%2A",
            "@multimediatype": "JPEG image file",
            "@type": "IMAGE-DOWNSAMPLED",
            "@size": "43860",
            "@ref": "gr5",
            "@mimetype": "image/jpeg"
          },
          {
            "@category": "standard",
            "@height": "284",
            "@width": "662",
            "@_fa": "true",
            "$": "https://api.elsevier.com/content/object/eid/1-s2.0-S0926860X13006698-gr4.jpg?httpAccept=%2A%2F%2A",
            "@multimediatype": "JPEG image file",
            "@type": "IMAGE-DOWNSAMPLED",
            "@size": "41559",
            "@ref": "gr4",
            "@mimetype": "image/jpeg"
          },
          {
            "@category": "standard",
            "@height": "225",
            "@width": "378",
            "@_fa": "true",
            "$": "https://api.elsevier.com/content/object/eid/1-s2.0-S0926860X13006698-gr3.jpg?httpAccept=%2A%2F%2A",
            "@multimediatype": "JPEG image file",
            "@type": "IMAGE-DOWNSAMPLED",
            "@size": "20549",
            "@ref": "gr3",
            "@mimetype": "image/jpeg"
          },
          {
            "@category": "standard",
            "@height": "223",
            "@width": "378",
            "@_fa": "true",
            "$": "https://api.elsevier.com/content/object/eid/1-s2.0-S0926860X13006698-gr2.jpg?httpAccept=%2A%2F%2A",
            "@multimediatype": "JPEG image file",
            "@type": "IMAGE-DOWNSAMPLED",
            "@size": "17260",
            "@ref": "gr2",
            "@mimetype": "image/jpeg"
          },
          {
            "@category": "standard",
            "@height": "331",
            "@width": "755",
            "@_fa": "true",
            "$": "https://api.elsevier.com/content/object/eid/1-s2.0-S0926860X13006698-gr1.jpg?httpAccept=%2A%2F%2A",
            "@multimediatype": "JPEG image file",
            "@type": "IMAGE-DOWNSAMPLED",
            "@size": "54798",
            "@ref": "gr1",
            "@mimetype": "image/jpeg"
          },
          {
            "@category": "standard",
            "@height": "200",
            "@width": "500",
            "@_fa": "true",
            "$": "https://api.elsevier.com/content/object/eid/1-s2.0-S0926860X13006698-fx3.jpg?httpAccept=%2A%2F%2A",
            "@multimediatype": "JPEG image file",
            "@type": "IMAGE-DOWNSAMPLED",
            "@size": "18154",
            "@ref": "fx3",
            "@mimetype": "image/jpeg"
          },
          {
            "@category": "standard",
            "@height": "200",
            "@width": "500",
            "@_fa": "true",
            "$": "https://api.elsevier.com/content/object/eid/1-s2.0-S0926860X13006698-fx2.jpg?httpAccept=%2A%2F%2A",
            "@multimediatype": "JPEG image file",
            "@type": "IMAGE-DOWNSAMPLED",
            "@size": "10427",
            "@ref": "fx2",
            "@mimetype": "image/jpeg"
          },
          {
            "@category": "standard",
            "@height": "200",
            "@width": "500",
            "@_fa": "true",
            "$": "https://api.elsevier.com/content/object/eid/1-s2.0-S0926860X13006698-fx1.jpg?httpAccept=%2A%2F%2A",
            "@multimediatype": "JPEG image file",
            "@type": "IMAGE-DOWNSAMPLED",
            "@size": "13776",
            "@ref": "fx1",
            "@mimetype": "image/jpeg"
          },
          {
            "@category": "thumbnail",
            "@height": "72",
            "@width": "219",
            "@_fa": "true",
            "$": "https://api.elsevier.com/content/object/eid/1-s2.0-S0926860X13006698-sc1.sml?httpAccept=%2A%2F%2A",
            "@multimediatype": "GIF image file",
            "@type": "IMAGE-THUMBNAIL",
            "@size": "2619",
            "@ref": "sc1",
            "@mimetype": "image/gif"
          },
          {
            "@category": "thumbnail",
            "@height": "142",
            "@width": "219",
            "@_fa": "true",
            "$": "https://api.elsevier.com/content/object/eid/1-s2.0-S0926860X13006698-gr5.sml?httpAccept=%2A%2F%2A",
            "@multimediatype": "GIF image file",
            "@type": "IMAGE-THUMBNAIL",
            "@size": "5144",
            "@ref": "gr5",
            "@mimetype": "image/gif"
          },
          {
            "@category": "thumbnail",
            "@height": "94",
            "@width": "219",
            "@_fa": "true",
            "$": "https://api.elsevier.com/content/object/eid/1-s2.0-S0926860X13006698-gr4.sml?httpAccept=%2A%2F%2A",
            "@multimediatype": "GIF image file",
            "@type": "IMAGE-THUMBNAIL",
            "@size": "4126",
            "@ref": "gr4",
            "@mimetype": "image/gif"
          },
          {
            "@category": "thumbnail",
            "@height": "131",
            "@width": "219",
            "@_fa": "true",
            "$": "https://api.elsevier.com/content/object/eid/1-s2.0-S0926860X13006698-gr3.sml?httpAccept=%2A%2F%2A",
            "@multimediatype": "GIF image file",
            "@type": "IMAGE-THUMBNAIL",
            "@size": "3140",
            "@ref": "gr3",
            "@mimetype": "image/gif"
          },
          {
            "@category": "thumbnail",
            "@height": "129",
            "@width": "219",
            "@_fa": "true",
            "$": "https://api.elsevier.com/content/object/eid/1-s2.0-S0926860X13006698-gr2.sml?httpAccept=%2A%2F%2A",
            "@multimediatype": "GIF image file",
            "@type": "IMAGE-THUMBNAIL",
            "@size": "2175",
            "@ref": "gr2",
            "@mimetype": "image/gif"
          },
          {
            "@category": "thumbnail",
            "@height": "96",
            "@width": "219",
            "@_fa": "true",
            "$": "https://api.elsevier.com/content/object/eid/1-s2.0-S0926860X13006698-gr1.sml?httpAccept=%2A%2F%2A",
            "@multimediatype": "GIF image file",
            "@type": "IMAGE-THUMBNAIL",
            "@size": "4354",
            "@ref": "gr1",
            "@mimetype": "image/gif"
          },
          {
            "@category": "thumbnail",
            "@height": "88",
            "@width": "219",
            "@_fa": "true",
            "$": "https://api.elsevier.com/content/object/eid/1-s2.0-S0926860X13006698-fx3.sml?httpAccept=%2A%2F%2A",
            "@multimediatype": "GIF image file",
            "@type": "IMAGE-THUMBNAIL",
            "@size": "3446",
            "@ref": "fx3",
            "@mimetype": "image/gif"
          },
          {
            "@category": "thumbnail",
            "@height": "88",
            "@width": "219",
            "@_fa": "true",
            "$": "https://api.elsevier.com/content/object/eid/1-s2.0-S0926860X13006698-fx2.sml?httpAccept=%2A%2F%2A",
            "@multimediatype": "GIF image file",
            "@type": "IMAGE-THUMBNAIL",
            "@size": "2256",
            "@ref": "fx2",
            "@mimetype": "image/gif"
          },
          {
            "@category": "thumbnail",
            "@height": "88",
            "@width": "219",
            "@_fa": "true",
            "$": "https://api.elsevier.com/content/object/eid/1-s2.0-S0926860X13006698-fx1.sml?httpAccept=%2A%2F%2A",
            "@multimediatype": "GIF image file",
            "@type": "IMAGE-THUMBNAIL",
            "@size": "2825",
            "@ref": "fx1",
            "@mimetype": "image/gif"
          },
          {
            "@category": "standard",
            "@_fa": "true",
            "$": "https://api.elsevier.com/content/object/eid/1-s2.0-S0926860X13006698-mmc1.pdf?httpAccept=%2A%2F%2A",
            "@multimediatype": "Acrobat PDF file",
            "@type": "APPLICATION",
            "@size": "27213106",
            "@ref": "mmc1",
            "@mimetype": "application/pdf"
          }
        ]
      },
      "link": {
        "@rel": "abstract",
        "@href": "https://api.elsevier.com/content/abstract/scopus_id/84888102763"
      }
    }
  }
}