{
  "metadata": {
    "title": "Efficient Cu-based catalysts for the selective demethoxylation of guaiacols",
    "authors": "; ; ",
    "journal": "Applied Catalysis A: General",
    "date": "2023-03-25",
    "doi": "10.1016/j.apcata.2023.119062",
    "abstract": "",
    "uri": "https://api.elsevier.com/content/article/pii/S0926860X2300042X",
    "pii": "S0926860X2300042X"
  },
  "fulltext": {
    "full-text-retrieval-response": {
      "scopus-eid": "2-s2.0-85148082122",
      "originalText": "serial JL 271346 291210 291744 291809 31 90 Applied Catalysis A: General APPLIEDCATALYSISAGENERAL 2023-01-26 2023-01-26 2023-02-16 2023-02-16 2023-09-04T16:53:03 1-s2.0-S0926860X2300042X S0926-860X(23)00042-X S0926860X2300042X 10.1016/j.apcata.2023.119062 S300 S300.1 FULL-TEXT 1-s2.0-S0926860X23X00052 2024-01-01T12:35:59.692098Z 0 0 20230325 2023 2023-01-26T08:44:02.316055Z absattachment articleinfo articlenumber articletitlenorm authfirstinitialnorm authfirstsurnamenorm cid cids contenttype copyright crossmark dateloaded dateloadedtxt datesearch datesort dateupdated dco docsubtype doctype doi eid ewtransactionid fundingbodyid hubeid indexeddate issn issnnorm itemstage itemtransactionid itemweight oauserlicense openaccess openarchive pg pgfirst pii piinorm pubdatestart pubdatetxt pubyr sortorder sponsoredaccesstype srctitle srctitlenorm srctype ssids alllist content oa subj subheadings suppl tomb volfirst volissue volumelist webpdf webpdfpagecount yearnav figure table e-component body mmlmath acknowledge affil appendices articletitle auth authfirstini authfull authkeywords authlast grantnumber grantsponsor grantsponsorid highlightsabst primabst ref specialabst 0926-860X 0926860X UNLIMITED VSNU2020 true 654 654 C Volume 654 11 119062 119062 119062 20230325 25 March 2023 2023-03-25 2023 article fla © 2023 The Author(s). Published by Elsevier B.V. EFFICIENTCUBASEDCATALYSTSFORSELECTIVEDEMETHOXYLATIONGUAIACOLS YANG H 1 Introduction 2 Experimental section 2.1 Materials 2.2 Catalyst preparation 2.3 Catalyst activity measurement 2.4 Catalyst characterization 3 Results and discussion 3.1 Catalyst characterization 3.2 Demethoxylation of guaiacol by supported Cu catalysts 3.3 Discussion 3.4 Stability of the Cu/TiO2-P25 catalyst 3.5 Effect of solvent and process conditions on catalyst performance 3.5.1 Solvent effects 3.5.2 Temperature effects 3.6 Exploratory experiments using alternative feeds (4-n-propylguaiacol and an guaiacol enriched feed) 4 Conclusions CRediT authorship contribution statement Acknowledgments Appendix A Supplementary material References RAGAUSKAS 2014 1246843 A DEUSS 2015 7456 7467 P LI 2010 3126 3136 B WONGSIRIWAN 2010 3232 3238 U RODRIGUEZ 2017 8171 8180 A KIM 2015 90 98 J RENDERS 2019 193 201 T ANDERSON 2017 613 622 E JING 2020 1 7 Y WONG 2020 S SUN 2020 5199 5212 Z HUANG 2018 11184 11190 X GONZALEZBORJA 2011 4155 4162 M SUN 2013 47 57 J GARCIASERNA 2022 237 243 J ZHANG 2021 297 311 X LIAO 2020 1385 1390 Y PRASOMSRI 2014 2660 2669 T ZHANG 2019 41 47 X OUYANG 2020 1705 1709 X GHAMPSON 2012 78 84 I LIU 2017 6378 6388 S LI 2020 14624 14639 C GRIFFIN 2017 2954 2966 M SCHIMMING 2015 2073 2083 S DIAO 2021 234 251 X CAI 2017 28 34 Z CHANG 2013 3041 3049 J SONG 2020 106224 S RUIZ 2012 44 48 P ZHAO 2011 305 310 H TYRONEGHAMPSON 2012 51 60 I BLANCO 2020 376 383 E KONG 2021 1511 1522 X DEUTSCH 2012 144 150 K SHETTY 2015 86 97 M SHETTY 2017 5293 5301 M YANG 2022 e202200297 H HEERES 2019 1894 1898 H EURBIOMASSCONFEXHIBPROC GROEN 2003 1 17 J HORACEK 2013 38 45 J LARSSON 1998 72 89 P SEEMALA 2017 4070 4082 B LARSSON 1996 279 293 P LIU 2019 396 404 K LIU 2017 3014 3022 K DING 1996 1789 1791 X PORTER 1999 1523 1531 J JIANG 2018 12 17 X XI 2020 118950 X MAO 2017 695 705 J YOHE 2016 535 552 S LI 2021 12794 12814 C GHAMPSON 2018 225 236 I PADAYACHEE 2020 2211 2220 D OHNO 2001 2417 2420 T XU 2011 329 335 Q ZHANG 2011 71 75 X WANG 2021 3083 3094 X PHAN 2017 84 93 T BESSEKHOUAD 2004 49 57 Y OLCESE 2012 63 73 R OLCESE 2013 528 538 R YE 2018 3428 3449 R YANGX2023X119062 YANGX2023X119062XH Full 2023-01-25T14:29:44Z FundingBody Dutch University VSNU 2020 http://creativecommons.org/licenses/by/4.0/ 2025-02-16T00:00:00.000Z 2025-02-16T00:00:00.000Z http://creativecommons.org/licenses/by-nc-nd/4.0/ This is an open access article under the CC BY license. © 2023 The Author(s). Published by Elsevier B.V. 2023-02-21T01:46:29.286Z http://vtw.elsevier.com/data/voc/AddOnTypes/50.7/aggregated-refined item S0926-860X(23)00042-X S0926860X2300042X 1-s2.0-S0926860X2300042X 10.1016/j.apcata.2023.119062 271346 2024-01-01T12:35:59.692098Z 2023-03-25 UNLIMITED VSNU2020 1-s2.0-S0926860X2300042X-main.pdf https://s3-eu-west-1.amazonaws.com/prod-ucs-content-store-eu-west/content/pii:S0926860X2300042X/MAIN/application/pdf/308bc07b21c8679e0e3e76fbd8561b18/main.pdf main.pdf pdf true 4706364 MAIN 10 1-s2.0-S0926860X2300042X-main_1.png https://s3-eu-west-1.amazonaws.com/prod-ucs-content-store-eu-west/content/pii:S0926860X2300042X/PREVIEW/image/png/a4870e8929b4f840de7c3ff7454e77d9/main_1.png main_1.png png 59147 849 656 IMAGE-WEB-PDF 1 1-s2.0-S0926860X2300042X-sc1.jpg https://s3-eu-west-1.amazonaws.com/prod-ucs-content-store-eu-west/content/pii:S0926860X2300042X/sc1/DOWNSAMPLED/image/jpeg/7e97ba1527b12538446d74ab8d2f44da/sc1.jpg sc1 sc1.jpg jpg 19611 299 376 IMAGE-DOWNSAMPLED 1-s2.0-S0926860X2300042X-gr1.jpg https://s3-eu-west-1.amazonaws.com/prod-ucs-content-store-eu-west/content/pii:S0926860X2300042X/gr1/DOWNSAMPLED/image/jpeg/deb37a4bbadf7582d7e550b2d040dd28/gr1.jpg gr1 gr1.jpg jpg 27322 340 376 IMAGE-DOWNSAMPLED 1-s2.0-S0926860X2300042X-gr2.jpg https://s3-eu-west-1.amazonaws.com/prod-ucs-content-store-eu-west/content/pii:S0926860X2300042X/gr2/DOWNSAMPLED/image/jpeg/531ba5ba5f4e918cabdba3faac7e8198/gr2.jpg gr2 gr2.jpg jpg 27312 345 376 IMAGE-DOWNSAMPLED 1-s2.0-S0926860X2300042X-gr3.jpg https://s3-eu-west-1.amazonaws.com/prod-ucs-content-store-eu-west/content/pii:S0926860X2300042X/gr3/DOWNSAMPLED/image/jpeg/03775ea833a132d75c7ba63fd0c20f43/gr3.jpg gr3 gr3.jpg jpg 29218 337 376 IMAGE-DOWNSAMPLED 1-s2.0-S0926860X2300042X-gr4.jpg https://s3-eu-west-1.amazonaws.com/prod-ucs-content-store-eu-west/content/pii:S0926860X2300042X/gr4/DOWNSAMPLED/image/jpeg/12d7d2c0d3f2233bb7df867428c4ed0a/gr4.jpg gr4 gr4.jpg jpg 80310 844 565 IMAGE-DOWNSAMPLED 1-s2.0-S0926860X2300042X-gr5.jpg https://s3-eu-west-1.amazonaws.com/prod-ucs-content-store-eu-west/content/pii:S0926860X2300042X/gr5/DOWNSAMPLED/image/jpeg/4ef2f9ee6c0fb49c65af16ab9c30ae43/gr5.jpg gr5 gr5.jpg jpg 33676 277 376 IMAGE-DOWNSAMPLED 1-s2.0-S0926860X2300042X-gr6.jpg https://s3-eu-west-1.amazonaws.com/prod-ucs-content-store-eu-west/content/pii:S0926860X2300042X/gr6/DOWNSAMPLED/image/jpeg/fa6adbdd745dea09fa19def1f85f3fe5/gr6.jpg gr6 gr6.jpg jpg 25224 345 376 IMAGE-DOWNSAMPLED 1-s2.0-S0926860X2300042X-gr7.jpg https://s3-eu-west-1.amazonaws.com/prod-ucs-content-store-eu-west/content/pii:S0926860X2300042X/gr7/DOWNSAMPLED/image/jpeg/2f820d4b0ea0e0d28e1625bcb4183ebc/gr7.jpg gr7 gr7.jpg jpg 9677 101 376 IMAGE-DOWNSAMPLED 1-s2.0-S0926860X2300042X-gr8.jpg https://s3-eu-west-1.amazonaws.com/prod-ucs-content-store-eu-west/content/pii:S0926860X2300042X/gr8/DOWNSAMPLED/image/jpeg/eb79c899ade06d3a1c5d38611fee508e/gr8.jpg gr8 gr8.jpg jpg 28585 331 376 IMAGE-DOWNSAMPLED 1-s2.0-S0926860X2300042X-gr10.jpg https://s3-eu-west-1.amazonaws.com/prod-ucs-content-store-eu-west/content/pii:S0926860X2300042X/gr10/DOWNSAMPLED/image/jpeg/b24d015b0792f8747dcbbad2ad27038e/gr10.jpg gr10 gr10.jpg jpg 27477 338 376 IMAGE-DOWNSAMPLED 1-s2.0-S0926860X2300042X-gr9.jpg https://s3-eu-west-1.amazonaws.com/prod-ucs-content-store-eu-west/content/pii:S0926860X2300042X/gr9/DOWNSAMPLED/image/jpeg/c022c70e4a04eda5a5016d16af29d12e/gr9.jpg gr9 gr9.jpg jpg 38321 273 678 IMAGE-DOWNSAMPLED 1-s2.0-S0926860X2300042X-ga1.jpg https://s3-eu-west-1.amazonaws.com/prod-ucs-content-store-eu-west/content/pii:S0926860X2300042X/ga1/DOWNSAMPLED/image/jpeg/68d30bca0ac5ae4ace60a658a94c3cd8/ga1.jpg ga1 true ga1.jpg jpg 23198 190 500 IMAGE-DOWNSAMPLED 1-s2.0-S0926860X2300042X-sc1.sml https://s3-eu-west-1.amazonaws.com/prod-ucs-content-store-eu-west/content/pii:S0926860X2300042X/sc1/THUMBNAIL/image/gif/97353112a5c7e1f2be850884879d4675/sc1.sml sc1 sc1.sml sml 6120 164 206 IMAGE-THUMBNAIL 1-s2.0-S0926860X2300042X-gr1.sml https://s3-eu-west-1.amazonaws.com/prod-ucs-content-store-eu-west/content/pii:S0926860X2300042X/gr1/THUMBNAIL/image/gif/73bc41d5428cdb338132b416eedd45c1/gr1.sml gr1 gr1.sml sml 7730 164 181 IMAGE-THUMBNAIL 1-s2.0-S0926860X2300042X-gr2.sml https://s3-eu-west-1.amazonaws.com/prod-ucs-content-store-eu-west/content/pii:S0926860X2300042X/gr2/THUMBNAIL/image/gif/fd870a3d980c5c4c3dbdb206c02d4a4f/gr2.sml gr2 gr2.sml sml 7427 164 179 IMAGE-THUMBNAIL 1-s2.0-S0926860X2300042X-gr3.sml https://s3-eu-west-1.amazonaws.com/prod-ucs-content-store-eu-west/content/pii:S0926860X2300042X/gr3/THUMBNAIL/image/gif/82459db1d5c45f0693f333a2649a21b3/gr3.sml gr3 gr3.sml sml 8230 164 183 IMAGE-THUMBNAIL 1-s2.0-S0926860X2300042X-gr4.sml https://s3-eu-west-1.amazonaws.com/prod-ucs-content-store-eu-west/content/pii:S0926860X2300042X/gr4/THUMBNAIL/image/gif/c879d754618f53bcc19577f6edb9158e/gr4.sml gr4 gr4.sml sml 10814 163 109 IMAGE-THUMBNAIL 1-s2.0-S0926860X2300042X-gr5.sml https://s3-eu-west-1.amazonaws.com/prod-ucs-content-store-eu-west/content/pii:S0926860X2300042X/gr5/THUMBNAIL/image/gif/8b106ab3a0faae3a34a8c2700a0080ba/gr5.sml gr5 gr5.sml sml 15535 161 219 IMAGE-THUMBNAIL 1-s2.0-S0926860X2300042X-gr6.sml https://s3-eu-west-1.amazonaws.com/prod-ucs-content-store-eu-west/content/pii:S0926860X2300042X/gr6/THUMBNAIL/image/gif/c37c784e9ad5475c8f5cf00ca5072d94/gr6.sml gr6 gr6.sml sml 6379 164 179 IMAGE-THUMBNAIL 1-s2.0-S0926860X2300042X-gr7.sml https://s3-eu-west-1.amazonaws.com/prod-ucs-content-store-eu-west/content/pii:S0926860X2300042X/gr7/THUMBNAIL/image/gif/5af69575fe6dc65946c09d3c0f260601/gr7.sml gr7 gr7.sml sml 4317 59 219 IMAGE-THUMBNAIL 1-s2.0-S0926860X2300042X-gr8.sml https://s3-eu-west-1.amazonaws.com/prod-ucs-content-store-eu-west/content/pii:S0926860X2300042X/gr8/THUMBNAIL/image/gif/ea145f7c5b65b9770126ca06bdea5341/gr8.sml gr8 gr8.sml sml 8198 164 186 IMAGE-THUMBNAIL 1-s2.0-S0926860X2300042X-gr10.sml https://s3-eu-west-1.amazonaws.com/prod-ucs-content-store-eu-west/content/pii:S0926860X2300042X/gr10/THUMBNAIL/image/gif/5aff30097636220ea2896625724cd358/gr10.sml gr10 gr10.sml sml 7995 164 182 IMAGE-THUMBNAIL 1-s2.0-S0926860X2300042X-gr9.sml https://s3-eu-west-1.amazonaws.com/prod-ucs-content-store-eu-west/content/pii:S0926860X2300042X/gr9/THUMBNAIL/image/gif/3c3355f14cd818db14b5256069ed95c8/gr9.sml gr9 gr9.sml sml 5888 88 219 IMAGE-THUMBNAIL 1-s2.0-S0926860X2300042X-ga1.sml https://s3-eu-west-1.amazonaws.com/prod-ucs-content-store-eu-west/content/pii:S0926860X2300042X/ga1/THUMBNAIL/image/gif/a11b2133344455cd1fec2dd175850204/ga1.sml ga1 true ga1.sml sml 5712 83 219 IMAGE-THUMBNAIL 1-s2.0-S0926860X2300042X-sc1_lrg.jpg https://s3-eu-west-1.amazonaws.com/prod-ucs-content-store-eu-west/content/pii:S0926860X2300042X/HIGHRES/image/jpeg/9d473bec2e0652445122506a15197664/sc1_lrg.jpg sc1 sc1_lrg.jpg jpg 106418 1321 1663 IMAGE-HIGH-RES 1-s2.0-S0926860X2300042X-gr1_lrg.jpg https://s3-eu-west-1.amazonaws.com/prod-ucs-content-store-eu-west/content/pii:S0926860X2300042X/HIGHRES/image/jpeg/27f3d1c83eca9cc9b26341fcaadbe236/gr1_lrg.jpg gr1 gr1_lrg.jpg jpg 143790 1504 1663 IMAGE-HIGH-RES 1-s2.0-S0926860X2300042X-gr2_lrg.jpg https://s3-eu-west-1.amazonaws.com/prod-ucs-content-store-eu-west/content/pii:S0926860X2300042X/HIGHRES/image/jpeg/bf78ec2eede06d3724271afd933dd116/gr2_lrg.jpg gr2 gr2_lrg.jpg jpg 135959 1524 1663 IMAGE-HIGH-RES 1-s2.0-S0926860X2300042X-gr3_lrg.jpg https://s3-eu-west-1.amazonaws.com/prod-ucs-content-store-eu-west/content/pii:S0926860X2300042X/HIGHRES/image/jpeg/4ac4b8489088b4b5215a1b84965629b5/gr3_lrg.jpg gr3 gr3_lrg.jpg jpg 149450 1489 1663 IMAGE-HIGH-RES 1-s2.0-S0926860X2300042X-gr4_lrg.jpg https://s3-eu-west-1.amazonaws.com/prod-ucs-content-store-eu-west/content/pii:S0926860X2300042X/HIGHRES/image/jpeg/b6370bf280f890e10048414f6d099b48/gr4_lrg.jpg gr4 gr4_lrg.jpg jpg 396189 3729 2495 IMAGE-HIGH-RES 1-s2.0-S0926860X2300042X-gr5_lrg.jpg https://s3-eu-west-1.amazonaws.com/prod-ucs-content-store-eu-west/content/pii:S0926860X2300042X/HIGHRES/image/jpeg/df022263d8c38b22f403d900cab27b0b/gr5_lrg.jpg gr5 gr5_lrg.jpg jpg 181768 1223 1663 IMAGE-HIGH-RES 1-s2.0-S0926860X2300042X-gr6_lrg.jpg https://s3-eu-west-1.amazonaws.com/prod-ucs-content-store-eu-west/content/pii:S0926860X2300042X/HIGHRES/image/jpeg/8b6902c47f2f0d97ca004595b23e60d5/gr6_lrg.jpg gr6 gr6_lrg.jpg jpg 132055 1525 1663 IMAGE-HIGH-RES 1-s2.0-S0926860X2300042X-gr7_lrg.jpg https://s3-eu-west-1.amazonaws.com/prod-ucs-content-store-eu-west/content/pii:S0926860X2300042X/HIGHRES/image/jpeg/66a1aba1c8dd837c47b23abc6ee1f389/gr7_lrg.jpg gr7 gr7_lrg.jpg jpg 41766 448 1663 IMAGE-HIGH-RES 1-s2.0-S0926860X2300042X-gr8_lrg.jpg https://s3-eu-west-1.amazonaws.com/prod-ucs-content-store-eu-west/content/pii:S0926860X2300042X/HIGHRES/image/jpeg/3e1886c552ab801abd3d3e1ba2df71e8/gr8_lrg.jpg gr8 gr8_lrg.jpg jpg 133081 1464 1663 IMAGE-HIGH-RES 1-s2.0-S0926860X2300042X-gr10_lrg.jpg https://s3-eu-west-1.amazonaws.com/prod-ucs-content-store-eu-west/content/pii:S0926860X2300042X/HIGHRES/image/jpeg/450f727d1b813da4be9698836db64bb8/gr10_lrg.jpg gr10 gr10_lrg.jpg jpg 138212 1495 1663 IMAGE-HIGH-RES 1-s2.0-S0926860X2300042X-gr9_lrg.jpg https://s3-eu-west-1.amazonaws.com/prod-ucs-content-store-eu-west/content/pii:S0926860X2300042X/HIGHRES/image/jpeg/62e5b6202bfc620d22c7e17b323fd445/gr9_lrg.jpg gr9 gr9_lrg.jpg jpg 191177 1205 2994 IMAGE-HIGH-RES 1-s2.0-S0926860X2300042X-ga1_lrg.jpg https://s3-eu-west-1.amazonaws.com/prod-ucs-content-store-eu-west/content/pii:S0926860X2300042X/HIGHRES/image/jpeg/0822906d214e7f5906e2d04c28ac0e2f/ga1_lrg.jpg ga1 true ga1_lrg.jpg jpg 143798 843 2213 IMAGE-HIGH-RES 1-s2.0-S0926860X2300042X-mmc1.docx https://s3-eu-west-1.amazonaws.com/prod-ucs-content-store-eu-west/content/pii:S0926860X2300042X/mmc1/MAIN/application/vnd.openxmlformats-officedocument.wordprocessingml.document/138bd8e93965f899d55d470aa6c53597/mmc1.docx mmc1 mmc1.docx docx 2773663 APPLICATION 1-s2.0-S0926860X2300042X-si0001.svg https://s3-eu-west-1.amazonaws.com/prod-ucs-content-store-eu-west/content/pii:S0926860X2300042X/image/svg+xml/6ebede6f1359f1416ef8116fda7ca159/si0001.svg si0001 si0001.svg svg 1896 ALTIMG 1-s2.0-S0926860X2300042X-si0002.svg https://s3-eu-west-1.amazonaws.com/prod-ucs-content-store-eu-west/content/pii:S0926860X2300042X/image/svg+xml/6e6977b1d43b6c5d7e74173d6e021f73/si0002.svg si0002 si0002.svg svg 2868 ALTIMG 1-s2.0-S0926860X2300042X-si0003.svg https://s3-eu-west-1.amazonaws.com/prod-ucs-content-store-eu-west/content/pii:S0926860X2300042X/image/svg+xml/18051b4f086b3b978d40f45d69edfbc0/si0003.svg si0003 si0003.svg svg 2658 ALTIMG 1-s2.0-S0926860X2300042X-am.pdf https://s3-eu-west-1.amazonaws.com/prod-ucs-content-store-eu-west/content/egi:10VFVG07STB/MAIN/application/pdf/b9d43a64f695f52ff15b56dfcd7f2651/am.pdf am am.pdf pdf false 3394868 AAM-PDF APCATA 119062 119062 S0926-860X(23)00042-X 10.1016/j.apcata.2023.119062 The Authors Fig. 1 H2-TPR profiles of Cu/TiO2-P25, Cu/TiO2-A HSA, Cu/TiO2-R, and Cu/MoO3-TiO2 catalysts. Fig. 1 Fig. 2 XRD patterns of Cu/TiO2-P25, Cu/TiO2-A HSA, Cu/TiO2-R, and Cu/MoO3-TiO2. Fig. 2 Fig. 3 NH3-TPD profiles of Cu/TiO2-P25, Cu/TiO2-A HSA, Cu/TiO2-R, and Cu/MoO3-TiO2. Fig. 3 Fig. 4 HAADF-STEM images of fresh Cu/TiO2-P25 (a, b) and the spent Cu/TiO2-P25 after a TOS of 100 h (c-f). Fig. 4 Fig. 5 Conversion and selectivity for the catalytic demethoxylation of guaiacol (5 wt% in octane) using a series of supported Cu catalysts in a fixed-bed reactor. Reaction conditions: 300 °C, 10 bar, data taken at a TOS of 3 h. WHSV left part of Figure: 16 h−1; right part: 32 h−1 for Cu/MoO3-TiO2, 5 h−1 for Cu/ZrO2, and 9 h−1 for Cu/TiO2-P25. Fig. 5 Fig. 6 Conversion of guaiacol versus oxygen vacancies on the support. Fig. 6 Fig. 7 Proposed mechanism of guaiacol hydrodeoxygenation over Cu/TiO2 catalysts. Fig. 7 Fig. 8 Stability test for HDO of guaiacol (5 wt% in octane) using the Cu/TiO2-P25. Reaction conditions: T = 300 °C, P = 10 bar, WHSV = 16 h−1. Fig. 8 Fig. 9 Product selectivity for guaiacol demethoxylation as a function of conversion using Cu/TiO2-P25 (300 °C, 10 bar, and WHSV is variable) for octane and toluene; (b) Conversion and selectivity for guaiacol demethoxylation (5 wt% in toluene) as a function of temperature for Cu/TiO2-P25 (10 bar, WHSV = 21 h−1). Fig. 9 Fig. 10 Conversion and selectivity values for the catalytic demethoxylation of a bioliquid enriched in guaiacols (5 wt% in toluene) using the Cu/TiO2-P25 catalyst. Reaction conditions: T = 360 °C, P = 10 bar, WHSV = 23 h−1. Fig. 10 Scheme 1 Simplified reaction network for the catalytic hydrotreatment of guaiacol. Scheme 1 Table 1 Overview of non-precious metal catalysts for the conversion of guaiacols to demethoxylated phenolics. Table 1 Feed Reaction conditions Catalyst Xa (%) S to DeMeOb (%) Ref. Guaiacol Batch, 300 °C, 40 bar H2, 500 rpm, 2 h Ni/TiO2 48 94 [16] Guaiacol Fixed-bed, 350 °C, 5 bar, WHSVc = 10 h-1 Ni/TiO2 50 76 [24] 4-n-propylguaiacol Fixed-bed, 285 °C, 1 bar, WHSVc = 6 h-1 Ni/SiO2 94 89 [17] Pine wood derived lignin monomers Fixed-bed, 285 °C, 1 bar, WHSVc = 6 h-1 Ni/SiO2 92 88 [17] Guaiacol Fixed-bed, 400 °C, 1 bar, W/Fd = 1.21 g∙h∙moltotal -1 FeOx/CeO2 100 87 [23] Guaiacol Fixed-bed, 375 °C, 1 bar, WHSVc = 0.71 h-1 CeO2-ZrO2 59 92 [25] Guaiacol Fixed-bed, 350 °C, 15 mbar partial pressure of guaiacol, 998 mbar H2, WHSVc = 3.55 h-1 MoO3 98 30 [18] Guaiacol Batch, 340 °C, 5 bar H2 + 30 bar N2, 800 rpm, 6 h MoO3 98 13 [19] Guaiacol Batch, 300 °C, 40 bar H2, 1000 rpm, 4 h MoO3 96 97 [26] Guaiacol Batch, 300 °C, 30 bar H2, 600 rpm, 3 h MoO2/AC 98 91 [27] Guaiacol Fixed-bed, 400 °C, 40 bar, WHSVc = 14.9 h-1 MoO3/AC 99 71 [28] 4-n-propylguaiacol Fixed-bed, 350 °C, 1000 mbar H2, WHSVc = 2 h-1 MoO3/SiO2 82 76 [29] Guaiacol Batch, 300 °C, 50 bar H2, 300 rpm, 4 h MoS2/AC 30 55 [30] Guaiacol Fixed-bed, 300 °C, 1 bar, WHSVc = 1.4 h-1 MoP/SiO2 54 28 [31] 4-n-propylguaiacol Fixed-bed, 350 °C, 90 bar, WHSVc = 80 h-1 MoP/SiO2 96 99 [20] Guaiacol Batch, 300 °C, 50 bar H2, 4 h MoN 92 92 [21] Guaiacol Batch, 300 °C, 50 bar H2, 4 h MoN/SBA-15 44 55 [32] Guaiacol Batch, 320 °C, 34 bar H2, 1000 rpm, 4 h Mo2C/AC 100 88 [22] Guaiacol Batch, 350 °C, 50 bar H2, 645 rpm, 4 h Mo2C/AC 24 72 [33] Guaiacol Batch, 350 °C, 50 bar H2, 645 rpm, 4 h Cu/AC 24 79 [33] Guaiacol Fixed-bed, 350 °C, 40 bar, W/Fd = 0.067 h-1 Cu/C 3.6 33 [28] Guaiacol Batch, 275 °C, 1 bar Ar, 2 h Cu/CuMgAlOx 75 15 [34] Guaiacol Batch, 275 °C, 50 bar H2, 500 rpm, 20 h CuCr2O4·CuO 100 -e [35] a Conversion; b Selectivity to demethoxylated phenols; c weight hourly space velocity; d mass of catalysts divided by mass flow rate; e phenol is a minor product, selectivity is not mentioned. Table 2 Relevant properties and catalytic performance data for the TiO2 supported Cu catalysts. Table 2 Cu catalyst Cu contentsa Physisorption datab Chemisorption datac Cu particle sizeg Catalytic performanceh SBET Pore volume dpores Total Weakd Mediume Strongf Conversion Selectivityi (wt%) (m2/g) (cm3/g) (nm) (µmol NH3/g) (nm) (mol%) Cu/TiO2-P25 5.0 61 0.37 21 301 70 122 109 27 (2.6) 29.5 74.6 Cu/TiO2-A HSA 4.7 83 0.25 10 393 71 185 137 n.d. (1.6) 21.4 73.9 Cu/TiO2-R 4.8 27 0.27 33 136 44 58 34 29 10.2 69.0 Cu/MoO3-TiO2 (P25) 4.9 44 0.28 19 264 25 114 125 81 70.3 66.3 a Determined by ICP-OES; b Determined by N2 physisorption; c Determined by NH3-TPD; d weak acidic sites (temperature range 100–200 °C); e medium acidic sites (temperature range 200–350 °C); f strong acidic sites (temperature range 350–600 °C); g Estimated by the Scherrer equation, number in parentheses is the Cu particle size determined by HAADF-STEM; h Reaction conditions: 300 °C, 10 bar, WHSV of 16 h−1; i Selectivity to demethoxylated phenols. Table 3 Conversion and yield/selectivity for the catalytic demethoxylation of 4-n-propylguaiacol (5 wt% in toluene) using the Cu/TiO2-P25 catalyst. Table 3 Selectivity (mol%)a Phenol 4.3 Methylphenols 2.2 Dimethylphenols 1.3 Propylphenols 36.8 Methylated propylphenols 24.3 Total demethoxylated phenols 68.9 a at a conversion level of 94%, Reaction conditions: 360 °C, 10 bar, WHSV = 21 h−1. Efficient Cu-based catalysts for the selective demethoxylation of guaiacols Huaizhou Yang Investigation Writing – original draft a Xiaotian Zhu Investigation Writing – original draft b Helda Wika Amini Investigation Writing – original draft a c Boy Fachri Supervision Writing – review & editing c Majid Ahmadi Investigation Writing – original draft b Gert H. ten Brink Investigation Writing – original draft b Peter J. Deuss Supervision Validation Writing – review & editing a Hero J. Heeres Conceptualization Funding acquisition Supervision Validation Writing – review & editing a ⁎ a Department of Chemical Engineering, ENTEG, University of Groningen, Nijenborgh 4, Groningen 9747AG, the Netherlands Department of Chemical Engineering, ENTEG, University of Groningen Nijenborgh 4 Groningen 9747AG the Netherlands Department of Chemical Engineering, ENTEG, University of Groningen, Nijenborgh 4, 9747AG, Groningen, The Netherlands b Zernike Institute for Advanced Materials, University of Groningen, Nijenborgh 4, Groningen 9747AG, the Netherlands Zernike Institute for Advanced Materials, University of Groningen Nijenborgh 4 Groningen 9747AG the Netherlands Zernike Institute for Advanced Materials, University of Groningen, Nijenborgh 4, 9747 AG Groningen, The Netherlands c Department of Chemical Engineering, Faculty of Engineering, University of Jember, Kalimantan 37, Jember 68121, Indonesia Department of Chemical Engineering, Faculty of Engineering, University of Jember Kalimantan 37 Jember 68121 Indonesia Department of Chemical Engineering, Faculty of Engineering, University of Jember, Kalimantan 37, Jember 68121, Indonesia ⁎ Corresponding author. Lignin is an attractive feedstock for low molecular weight biobased phenols using depolymerization strategies such as reductive catalytic fractionation or fast pyrolysis. Such strategies often yield a product mixture enriched in lignin-derived monomers with methoxy substituents. Selective catalytic hydrodeoxygenation (HDO) is an effective methodology to demethoxylate these monomers into valuable alkylated phenols. Here, we report the use of non-precious Cu based catalysts supported on SiO2, ZrO2, TiO2 (various forms), MoO3-ZrO2, and MoO3-TiO2 in a continuous fixed-bed reactor at elevated temperature and pressure (300–360 °C, 10 bar) for the selective demethoxylation of guaiacol. Among the various catalysts, Cu/TiO2-P25 was found to be an effective and highly stable catalyst (100 h on stream) with a selectivity of 87% to demethoxylated compounds like phenol and cresols at a guaiacol conversion of 98%. A correlation was found between the oxygen storage capacity of the support (TiO2-P25, TiO2-A HSA, TiO2-R, and MoO3-TiO2) and guaiacol conversion, indicating that this property plays a role in the catalytic cycle. Besides, the demethoxylation of 4-n-propylguaiacol and a realistic guaiacol-rich feed isolated from a representative pyrolysis oil was successfully demonstrated. 87% of the guaiacols present in the feed were converted to demethoxylated phenols with a selectivity of 81%. Graphical Abstract ga1 Keywords Guaiacol Pyrolysis oil Demethoxylation Cu catalyst Titania Data Availability Data will be made available on request. 1 Introduction Nowadays, chemical production is heavily dependent on fossil resources. Alternatives are required for sustainable development and the use of renewable carbon sources such as biomass is an attractive option. In particular, lignin is interesting for this purpose, as nowadays it is mainly used for energy generation and thus highly underutilized. Due to its oxygenated propylphenolic backbone structure, it could serve as an attractive source for phenol and alkylphenols, which are currently produced from fossil resources on a large scale [1]. Examples of strategies that have been proposed and explored to obtain low molecular weight phenols from lignin are acid/base catalyzed depolymerizations [2–5], fast pyrolysis [6], and reductive catalytic fractionation [7,8]. However, the obtained monomeric products are usually highly functionalized, for example by methoxy groups, hindering their direct utilization [9]. As a result, demethoxylation is needed to funnel the product mixtures into products with reduced complexity and increased value [10,11]. A well-known demethoxylation strategy involves catalytic hydrotreatment with metal-based catalysts in combination with hydrogen. Exploratory catalyst studies for demethoxylation have been reported using heterogeneous catalysts in metallic, oxide, sulfide, phosphide, nitride or carbide form. Precious metal catalysts, such as Au/TiO2 and carbon-supported Pt and Pd catalysts, show excellent performance for the conversion of (propyl)guaiacol to demethoxylated phenols and 80 + % selectivities have been reported at conversions > 97% [12–14]. However, based on green chemistry and engineering principles, there is a need for the use of cheaper and more abundantly available metal catalysts [15]. A number of studies have been reported for the demethoxylation of guaiacols using Ni, Fe and Mo bases catalysts and an overview is given in Table 1. Both batch and continuous set-ups have been used and typical temperatures are between 285 and 400 °C, with hydrogen pressures between 1 and 90 bar. Ni catalysts, either supported on TiO2 or SiO2, particularly gave good results for the demethoxylation of 4-n-propylguaiacol (89% selectivity at 95% conversion, 285 °C, 1 bar) whereas worse results were obtained using guaiacol [16,17]. Various types of Mo based catalysts have also been used for catalytic demethoxylation, ranging from bulk MoO3 to Mo-oxides, sulphides, nitrides and phosphides on various supports (AC, SiO2, and SBA-15). When considering bulk MoO3, good performance was obtained when using guaiacol in batch set-ups though performance dropped considerably in continuous fixed-bed reactors. In addition, selectivity to phenols was limited and large amounts of fully deoxygenated products (e.g., benzene and toluene) were obtained [18,19]. When considering supported Mo- catalysts, excellent performance was found for MoP/SiO2 when using 4-n-propylguaiacol as the feed (350 °C, 90 bar) [20–22]. Good results were also achieved with the Fe based catalysts such as FeOx/CeO2 with conversion and selectivity levels similar to those for Ni catalysts, though catalyst stability was fair with up to 41% reduction in activity over a time on stream (TOS) of 10 h (400 °C, 1 bar) [23]. The use of supported Cu catalysts for the guaiacol demethoxylation with high selectivity is limited (Table 1). The best results were reported in batch using Cu/AC as the catalyst [33]. Performance was reasonable, with 79% selectivity to demethoxylated products though at a low conversion of 24% (350 °C, 50 bar). Only one study reports the use of a continuous reactor set-up in combination with Cu/C, though only 3.6% guaiacol conversion was reported (350 °C, 40 bar, Table 1). Furthermore, support studies, stability testing, and demethoxylation of crude bioliquids (enriched in guaiacols) in continuous set-ups has not been explored systematically for supported Cu catalysts. To overcome this knowledge gap, a series of supported Cu catalysts were investigated for the demethoxylation of guaiacol. The effect of inorganic supports (SiO2, ZrO2, TiO2 (various forms), MoO3-ZrO2, and MoO3-TiO2), solvent (toluene, n-octane), WHSV, and temperature on catalyst performance (activity, selectivity, and stability) was studied. In addition to common inorganic supports (viz. SiO2, ZrO2, and TiO2), MoO3-ZrO2 and MoO3-TiO2 were also investigated because the introduction of MoO3 on ZrO2 or TiO2 is known to have a positive effect on catalyst performance for the hydrodeoxygenation of lignin-derived monomers (e.g., m-cresol, anisole, and guaiacol) [36–38]. The Mo species are supposed to form coordinatively unsaturated sites during reactions, which promote the HDO pathway, possibly via an oxygen vacancy-driven mechanism [36]. Besides guaiacol, also other relevant feeds such as 4-n-propylguaiacol, and a guaiacol mixture isolated from pyrolysis oil were tested using the best Cu catalyst in the series. 2 Experimental section 2.1 Materials SiO2 (99.5% trace metals basis, 10–20 nm particle size), ZrO2 (< 100 nm particle size), TiO2 (P25, ≥ 99.5% trace metals basis, 21 nm primary particle size), anatase TiO2 with a low surface area (denoted as LSA, ≥ 99%, average diameter of 156 nm), anatase TiO2 with a high surface area (denoted as HSA, 99.7% trace metals basis, < 25 nm particle size), rutile TiO2 (99.5% trace metals basis, < 100 nm particle size), silicon carbide (about 200 mesh particle size), copper nitrate trihydrate (99–104%), ammonium molybdate tetrahydrate (99.98% trace metals basis), guaiacol (≥ 99%), 4-n-propylguaiacol (≥ 99%), 4-n-propylphenol (99%), 2-sec-butylphenol (98%), p-propyl anisole (≥ 99%), benzene (≥ 99.7%), and cyclohexene (99%) were supplied by Sigma-Aldrich. n-Octane (≥ 98%) was obtained from Alfa Aesar. Toluene (≥ 99%) and tetrahydrofuran (THF) stabilized with BHT (for analysis) were obtained from Avantor and Boom B.V., respectively. Phenol (> 99.5%), 4-methylphenol (> 99.0%), 2,3-dimethylphenol (> 98.0%), 2,3,6-trimethylphenol (> 98.0%), 1,2-dimethoxybenzene (> 99.0%), 4-methylguaiacol (> 98.0%), catechol (> 99.0%), n-propylbenzene (> 99.0%), n-decane (> 99.0%), and n-dodecane (> 99.0%) were purchased from TCI. p-Xylene (99%), m-xylene (99%), and o-xylene (99%) were obtained from abcr GmbH. High purity (> 99.99 mol%) N2, He, and H2 were purchased from Linde. Certified gas mixtures used in this study, including 1 vol% O2/N2 5 vol% H2 in Ar, and 10 vol% NH3 in He were also supplied by Linde. A guaiacols enriched feed from pyrolysis oil fractionation was provided by the Biomass Technology Group B.V. [39]. 2.2 Catalyst preparation Supported Cu catalysts (5 wt%) were prepared using an incipient wetness impregnation method by the following procedure. Copper nitrate trihydrate (0.1053 g) was dissolved in an amount of Milli-Q water equal to the measured pore volume for water of the support. Then, the solution was added dropwise to the support (2.000 g) with mixing at room temperature. After 6 h, the mixture was dried at 100 °C for 12 h, followed by calcination at 400 °C (2 °C min−1) for 2 h in static air. The catalysts were pelletized, crushed, sieved, and the 100–200 µm fraction was used in the experiments. For catalyst characterization purposes, the Cu catalysts were reduced ex situ under a H2 flow (200 mL/g Cat, 350 °C, 2 h) and then passivated under 1% O2/N2 (room temperature, 2 h). The MoO3-ZrO2 and MoO3-TiO2 (P25) mixed oxides supports with ‘sub-monolayer’ coverage of MoO3 (about 4 Mo/nm2) were also synthesized by an incipient wetness impregnation method [38]. This involved dissolving the appropriate amount of ammonium molybdate tetrahydrate in Milli-Q water, support impregnation, drying, and calcination at 550 °C (2 °C min−1) for 4 h in static air. The nominal MoO3 content in the MoO3-ZrO2 and MoO3-TiO2 (P25) are 3 and 5 wt%, respectively. 2.3 Catalyst activity measurement The catalytic hydrotreatment experiments with lignin-derived model compounds and a guaiacols enriched feed were carried out in a continuous down-flow fixed-bed reactor (stainless steel) with an outer diameter of 6.35 mm and an inner diameter of 4.55 mm. Typically, the supported Cu catalyst (100 mg) was mixed with SiC (200 mg). The mixture was loaded into the reactor and reduced in situ at 350 °C for 2 h under a H2 flow (20 mL min−1). An experiment was started by heating the reactor to the desired temperature, followed by increasing the pressure to 10 bar using a back pressure valve using a H2 flow (20 mL min−1). Subsequently, the H2 flow rate was set to the desired value (typically 10 mL min−1) and feeding of the reactant (5 wt% guaiacol in n-octane or toluene, 5 wt% 4-n-propylguaiacol in toluene, or 5 wt% crude feed in toluene) at the desired Weighted Hourly Space Velocity (WHSV, h-1) was started using an HPLC pump. The WHSV was calculated based on the feed flow rate (reactant and solvent) and the catalyst intake as shown in Eq. (1). (1) WHSV = F g / w Where Fg is the flow rate of the feed (g/h) and w is the weight of catalyst (set at 0.100 g). Aspen plus simulations indicate that all reactions were carried out in the vapor phase, see supporting information for details. The reaction products were separated in a gas-liquid separator at room temperature, and condensable products were collected at 1 h intervals. The feed and liquid product composition were analyzed offline using GC-MS (Agilent 6890 series GC system equipped with an HP973 mass detector) and GC-FID [Agilent 8860 gas chromatograph equipped with a flame ionization detector and an HP-5 capillary column (30 m x 320 µm x 0.25 µm)]. n-Dodecane was added to the feed and used as an internal standard (IS). The liquid products were diluted about 20 times using THF containing 500 ppm n-decane as an IS before analyses. Conversion of feed component g and selectivity for a product i were calculated on a molar basis using Eqs. (2) and (3). (2) X g % = ( C g , 0 − C g ) / C g , 0 × 100 (3) S i % = C i / ( C g , 0 − C g ) × 100 Here Cg,0, is the molar fractions of guaiacol or 4-n-propylguaiacol in the feed, Cg is those molar fractions in the product mixture, and Ci is the molar fraction of a product i. The molecular weight distributions of the feed and liquid product after hydrotreatment were determined by gel permeation chromatography (GPC) analyses using an Agilent HPLC 1100 system equipped with three MIXED-E columns (length 300 mm, i.d. 7.5 mm) in series and a GBC LC 1240 refractive index detector (RID). All samples were diluted by THF to a concentration of about 10 mg mL-1, and toluene was used as internal reference. The reproducibility of a selected set of experimental conditions was determined and shown to be good (Fig. 5). 2.4 Catalyst characterization Inductively coupled plasma-optical emission spectrometry (ICP-OES) was used to quantify the Cu content in the supported Cu catalysts. Before analyses, the samples were dissolved in aqua regia (HF was used for Cu/SiO2), and then the Cu content was determined using an PerkinElmer Optima 7000 DV equipped with a solid-state CCD array detector. H2-TPR measurements were conducted using a Micromeritics AutoChem 2920 system, equipped with a thermal conductivity detector (TCD). Samples (about 100 mg) were pretreated under Ar at 400 °C for 1 h and then cooled to 50 °C. After that, the H2-TPR profiles were collected under 5 vol% H2 in Ar (30 mL min-1) from 50 °C to 800 °C using a temperature ramp of 10 °C min-1. Surface acidity was quantified by NH3-TPD measurements, which were carried out on a Micromeritics AutoChem 2920 system. The passivated Cu catalysts (about 100 mg) were reduced under 5 vol% H2 in Ar at 350 °C for 1 h. Then a gas mixture containing 10 vol% NH3 in He (50 mL min-1) was used to saturate the acid sites at 100 °C for 1 h. After that, the samples were purged under a He flow until the baseline was stable. TPD measurements were carried out from 100° to 600°C at a rate of 10 °C min−1 under a He flow (50 mL min-1). X-ray diffraction (XRD) patterns were collected using a Bruker D8 Advance diffractometer, operating at 40 kV and 40 mA using Cu-Kα radiation (λ = 1.5544 Å). Data were collected using a coupled 2θ / θ configuration, between 2θ values of 5–80° with a step size of 0.02 and a scan time of 1.000 s. The specific surface area and pore properties of the supported Cu catalysts were determined by N2 physisorption, conducted at 77 K using a Micromeritics ASAP 2420 system. Before analysis, the samples were degassed at 250 °C under vacuum for 6 h. The specific surface area was determined using the Brunauer-Emmett-Teller (BET) method at relative pressures (P/P0) ranging from 0.05 to 0.25. The total pore volume was obtained from the single-point desorption point at a relative pressure of 0.98. The pore diameter was calculated using the adsorption branch from the N2 isotherm according to the Barrett-Joyner-Halenda (BJH) method. This approach eliminates tensile strength effects, which lead to an artificial peak at 4 nm in the pore size distribution [40]. The microstructure of the Cu/TiO2 catalysts was examined with a probe and image aberration corrected Themis Z microscope (Thermo Fisher Scientific) operating at 300 kV equipped with a Ceta camera. The samples were first ultrasonically dispersed in ethanol and then deposited on a carbon-coated gold grid. High-angle annular dark-field scanning transmission electron microscopy (HAADF-STEM) images of the Cu/TiO2 catalysts were obtained using the same microscope in STEM mode with a convergence semi-angle of 26 mrad and a probe current of 100 pA. Energy dispersive X-ray spectroscopy (EDS mapping) results were achieved with a Dual X EDS system (Bruker) with a probe current of 250 pA. Data acquisition and analysis were done using Velox software (version 2.8.0). The coke amount on the spent catalyst were determined using thermogravimetric analysis (TGA) by a TGA 4000 from PerkinElmer. The samples were heated in an air flow (30.0 mL min-1) from 50° to 900°C with a heating rate of 10 °C min-1, and the coke amount was obtained from the TG curves. The oxygen vacancy concentration of the support was quantified by oxygen storage capacity measurements on a Micromeritics AutoChem 2920 system. Firstly, the sample (0.06–0.34 g) was pretreated in a 5 vol% H2 in Ar stream (25 mL min-1) at 550 °C for 2 h. Afterward, the sample was purged with He until a constant baseline was obtained. Then, successive pulses of 10 vol% O2 in He were injected into the sample at 550 °C until O2 consumption ceased. The O2 uptake was used to calculate the concentration of oxygen vacancies on the sample by assuming that one O2 molecule saturates two oxygen vacancies [25,36]. 3 Results and discussion 3.1 Catalyst characterization A series of supported Cu catalysts on non-reducible (SiO2 and ZrO2) and reducible supports (TiO2, MoO3-ZrO2, and MoO3-TiO2) was prepared using an incipient wetness impregnation method, all with about 5 wt% Cu (determined by ICP-OES, see Table S1). The focus of this study is the use of TiO2 supported Cu catalysts (Cu/TiO2-P25, Cu/TiO2-A HSA, Cu/TiO2-R, and Cu/MoO3-TiO2), which were characterized in detail using H2-TPR, NH3-TPD, XRD, N2 physisorption, HAADF-STEM, and TGA (for spent catalyst) to rationalize catalyst performance ( Table 2). The N2 physisorption data reveals that the TiO2 supported Cu catalysts have a specific surface area of 27–61 m2/g, pore volume of 0.25–0.37 cm3/g, and pore diameter 19–21 nm. The Cu/TiO2-A HSA shows the highest specific surface area as well as lowest pore volume and pore diameter among these four catalysts [41]. H2-TPR was used to determine the reducibility of catalysts and the results are given in Fig. 1. Two or three peaks are present in all samples in the 100–300 °C region, which are associated with the reduction of Cu-oxides. The lower temperature peak between 136 and 198 °C is assigned to the reduction of monomeric Cu species directly interacting with the support, whereas the second peak at higher temperatures (195–296 °C) is believed to be due to the reduction of bulk CuO on the support [42,43]. For Cu/TiO2 on P25, two peaks are observed in this region due to reduction of bulk CuO with different particle sizes [42,44]. For Cu/TiO2-A HSA, the reduction peak for bulk CuO shifted to lower temperature and merged with that of monomeric Cu species, indicating the presence of low amounts of bulk CuO and a high dispersion of Cu species. Based on these data, it was deemed sufficient to reduce the catalysts before reaction at 350 °C for 2 h (pure H2) to ensure quantitative reduction of Cu species to metallic Cu. A distinct reduction peak centered at 383 °C is observed for Cu/TiO2-A HSA, which is associated to reduction of support (TiO2-A HSA) [45]. This reduction step is promoted by the presence of Cu, as the support alone shows only a high temperature reduction peak at about 674 °C (Fig. S1). The Cu/MoO3-TiO2 also showed a clear peak at 737 °C, which is due to the reduction of Mo species [46]. XRD was used to examine the various phases and crystallinity of the Cu catalysts (reduced at 350 °C for 2 h under pure H2), and the XRD patterns are shown in Fig. 2. Clear peaks of the various TiO2 crystal phases are present at 2θ = 25.3° (anatase (101)) and 2θ = 27.4° (rutile (110)). Integration shows that the TiO2-P25 contains about 16 wt% of the rutile phase, in line with literature data [47–49]. In three of the samples (Cu/TiO2-P25, Cu/TiO2-R and Cu/MoO3-TiO2-P25), clear peaks from Cu species were present at 43.3° and 50.4°, corresponding to the (111) and (200) planes of Cu, respectively (JCPDS PDF No. 04–0836). For Cu/TiO2-A HSA Cu peaks are absent, indicating that the Cu species are highly dispersed, which is in line with the TPR results. The average crystallite size of the Cu species in the samples showing clearly visible Cu peaks were determined using the Scherrer equation and the results are given in Table 2 [50]. The average Cu size varies between 27 and 81 nm, the smallest for Cu/TiO2-P25, and the largest for Cu/MoO3-TiO2. The differences in Cu crystal sizes may be due differences in the metal-support interactions as well as the specific surface area of the materials (Table 2). Surface acidity was quantified by NH3-TPD, and the profiles are shown in Fig. 3. The surface acidity decreases in the order: Cu/TiO2-A HSA > Cu/TiO2-P25 > Cu/MoO3-TiO2 > Cu/TiO2-R. The Cu/TiO2-P25, Cu/TiO2-A HSA, and Cu/TiO2-R mainly show weak acidic sites, while the Cu/MoO3-TiO2 mainly contains strong acidic sites. High-angle annular dark-field STEM (HAADF-STEM) was conducted to investigate the morphologies and particle size of Cu species for the fresh Cu/TiO2-P25 and Cu/TiO2-A HSA, and distinct differences were found between these two samples. The Cu nanoparticles (small bright ones) are highly dispersed on the TiO2-P25 ( Figs. 4a and 4b), with an average diameter of 2.6 nm. Beside these small Cu particles, larger ones (> 10 nm) are also present (confirmed by the EDS mapping) on the fresh Cu/TiO2-P25 (Fig. S2). The presence of these larger Cu particles is consistent with the XRD results, which showed an average particle size of 26 nm. Based on these measurements we conclude that the Cu species on the support have a bimodal distribution. In contrast to Cu/TiO2-P25, the HAADF-STEM images of Cu/TiO2-A HSA reveal the presence of hollow TiO2 spheres and small Cu nanoparticles (Fig. S3). The average diameter of the Cu nanoparticles is about 1.6 nm, which is somewhat smaller than that in Cu/TiO2-P25. In addition, the XRD data for Cu/TiO2-A HSA show that larger Cu particles are absent, and imply that the Cu size distribution is not bimodal and that only smaller Cu particles are present. 3.2 Demethoxylation of guaiacol by supported Cu catalysts A series of supported Cu catalysts on non-reducible (SiO2 and ZrO2) and reducible supports (TiO2, MoO3-ZrO2, and MoO3-TiO2) was prepared. Four different types of TiO2 were investigated: anatase (both high and low surface area, denoted as TiO2-HSA and TiO2-LSA, respectively), rutile (TiO2-R) and P25. Initial catalytic screening experiments to assess support effects were performed using guaiacol in octane (5 wt%) as the feed in a continuous fixed bed reactor at 300 °C, a WHSV of 16 h-1 and 10 bar pressure. Experiments were run for a TOS of at least 3 h to ensure steady state operation and the conversions at 3 h were used for evaluation. The conversion of guaiacol and the selectivity to individual products are shown in Fig. 5 (see also Fig. S4). The main products are the desired (alkylated)phenols such as the parent phenol, methyl- and dimethylphenols formed by demethoxylation and methyl transfer, with minor amounts of methoxybenzene and dimethoxybenzene ( Scheme 1). The balance closure on molar basis is not quantitative, and this is likely due to the formation of some gas-phase components, and GC-undetectable oligomers. The presence of the latter was confirmed by GPC measurements showing a small peak at higher molecular weight values (Fig. S5). Strong support effects were observed on catalyst performance (300 °C, 10 bar, and WHSV of 16 h-1). The conversion for Cu/SiO2, Cu/TiO2-A LSA (low surface area anatase TiO2), Cu/TiO2-R (rutile), and Cu/MoO3-ZrO2 are all below 15%. Better results were obtained using Cu/ZrO2, Cu/TiO2-P25, and Cu/TiO2-A HSA (high surface area anatase TiO2) with conversion levels between 20% and 30%. The by far most active catalyst is Cu/MoO3-TiO2 with a guaiacol conversion of 70%. Blank experiments with support only (TiO2-P25 or MoO3-TiO2) were performed and the results are shown in Fig. S6. It was found the TiO2-P25 has limited activity (conversion of 8%), while the MoO3-TiO2 (P25) is much more active (conversion of 31%). However, performance of the bare supports is considerably less than for the supported Cu catalysts, indicating that Cu plays a major role in the catalytic cycle (vide infra). It is of interest to compare the activity data for the TiO2 supported catalysts in the series. Among them, guaiacol conversion increases in the order anatase (LSA) < rutile < anatase (HSA) < P25. The latter consists of a mixture of anatase and rutile phases and this appears to be favored when considering activity. Mo doping has a very positive effect on conversion, which is particularly evident when comparing Cu/TiO2-P25 (conversion of 29%) and Cu/MoO3-TiO2 (conversion of 70%). The promoting effect of Mo doping on titania supports is in line with recent results from our group [38] and was speculated to be due to i) the formation of additional oxygen vacancies which promote the deoxygenation reaction and/or ii) the formation of active Mo oxycarbide or Mo oxycarbohydride phase. However, activity is not the only catalyst performance criterium and selectivity should be considered as well. Regarding product distribution, demethoxylated phenols like phenol, methylphenols and dimethylphenols are the major products. In addition, small amounts of methoxybenzene and dimethoxybenzene were detected. This product distribution indicates that demethoxylation in combination with methyl transfer are the dominant reactions (Scheme 1). Selectivity to non-aromatics is low, indicating limited overhydrogenation of the aromatic rings [51,52]. Methyl transfer to form methylated phenols is assumed to be catalyzed by acid sites on the catalyst via Friedel−Crafts-type reactions with a carbonium ion (CH3 +) as an intermediate [23,53,54]. For a proper comparison of the best catalysts in the series in terms of selectivity at equal conversion, the WHSV was tuned to obtain a conversion of about 40% for three of the most active catalysts (300 °C, 10 bar). The results are given in Fig. 5 (right). The highest selectivity to alkylated phenols (76%) was obtained using Cu/TiO2-P25, and only minor amounts of dimethoxybenzene was formed. The parent phenol selectivity in this case is up to 55%. The amounts of dimethoxybenzene are considerably higher for the Cu/MoO3-TiO2 catalyst. As such, we can conclude that i) the TiO2 based catalysts (e.g., TiO2-P25, TiO2-LSA, and MoO3-TiO2 supported Cu catalysts) perform best and ii) the best catalyst in terms of selectivity towards alkylated phenols is Cu/TiO2-P25. 3.3 Discussion When considering the catalytic performance data for the TiO2 supported catalysts, guaiacol conversion increases in the order anatase (LSA) < rutile < anatase (HSA) < P25. Thus, a mixture of anatase and rutile phases as in P25 TiO2 appears to be favored when considering catalyst activity. Friedrich et al. have proposed that the interface and particularly the disorder of the TiO2 lattice between the anatase and rutile phase has a positive effect on catalyst performance and plays a major role [55]. In addition, mixed-phase TiO2 was shown to have superior photocatalytic activity [56,57], which was ascribed a larger charge separation of the anatase-rutile phase junction [57,58]. It could be one of the possible explanation for the good performance of the P25 based catalyst, as there is close contact between the anatase and rutile phases in P25 TiO2 [49]. However, catalyst characterization studies showed that other properties like surface area, Cu particle size, and acidity are also different for the set of catalysts and may affect performance. Attempts have been undertaken to find correlations between these catalyst features and performance like conversion and selectivity. Unfortunately, no clear relations between these relevant properties and performance was obtained. This implies that other factors play a role as well and may interfere. Oxygen vacancies (Ov) have been proposed to play a role in the molecular mechanism for the demethoxylation of guaiacol (or anisole) when using supported catalysts with reducible supports like MoO3 and TiO2 [18,45,59,60]. For instance, Liu et al. performed studies on Ag/TiO2 as a demethoxylation catalyst and proposed that Ov are formed by the reduction of the TiO2 surface by spillover hydrogen [45]. Unfortunately, the amounts of oxygen vacancies on the supports of the Cu based catalysts could not be quantified by oxygen storage capacity measurement due to the presence of Cu. To get some information on the possible involvement of oxygen vacancies, the oxygen storage capacity of the support (TiO2-P25, TiO2-A HSA, TiO2-R, and MoO3-TiO2) without Cu was quantified. A clear trend was found between the oxygen vacancies of the support and the conversion of guaiacol at a WHSV of 16 h-1 ( Fig. 6), indicating these oxygen vacancies may play an important role in the catalytic cycle. In addition, the presence and levels of impurities in the different types of titania supports may also affect performance. P25 TiO2 shows the presence of about 180 ppm of trace metals, among others K, Ag, Pd, Pt and Sb (Table S2). The total amount of trace elements in TiO2-A HSA is much higher (1018 ppm), the majority being Na. The presence of Na in anatase TiO2 was shown to be detrimental for the photocatalytic degradation of certain substrtaes (malachite green oxalate and 4-hydroxy benzoic acid) [61]. A such, differences in type and levels of impurities in the titania supports may also affect catalyst performance for the demethoxylation reactions reported in this study. Based on literature precedents and the experimental correlation between oxygen vacancies and conversion [45], a mechanism is proposed for the guaiacol demethoxylation on Cu based catalysts ( Fig. 7). It involves two active sites, viz., Cu and oxygen vacancies close to the Cu sites. It assumes that hydrogen is activated and chemosorbed on reduced Cu sites, and after spill over create oxygen vacancies on the TiO2 surface. Interaction of the substrate with these oxygen vacancies leads to demethoxylation [23,45]. The mechanism for the formation of alkylated phenols is still under debate. Either the initially formed phenol reacts with guaiacol to form methylated phenols and catechol [45,51] or Friedel-Crafts-type reactions occur with the involvement of CH3 + species that are known to be active in intra- or inter-molecular methylation reactions [23,53]. The formation of oligomers, minor byproducts, may be related to the presence of acidic sites on the surface. 3.4 Stability of the Cu/TiO2-P25 catalyst The stability of the Cu/TiO2-P25 catalyst was determined in the continuous set-up for an experiment at a TOS of 100 h (300 °C, 10 bar, and WHSV of 16 h-1). Excellent stability was demonstrated with a near constant conversion level of about 27% ( Fig. 8, detailed selectivity data are given in Fig. S7). The high stability of the Cu catalyst is remarkable as catalyst deactivation is significant for the catalytic hydrodeoxygenation of lignin-derived guaiacols to phenols or BTX [14,23,29,53,62,63]. As such, these Cu-based catalysts combine good activity and selectivity with stability which is highly beneficial when considering potential industrial application. The desired demethoxylated phenols like phenol and methylated phenols are the major products with a selectivity of about 79% throughout the run. The only major side product was dimethoxybenzene, in line with the exploratory runs at much shorter TOS’s (vide supra). The selectivity towards the latter increases slightly over time, indicating some changes in the catalyst structure. As such, the spent Cu/TiO2-P25 after 100 h-on-stream was characterized by several techniques (HADDF-STEM, ICP-OES, and TGA) to identify changes in composition and texture. HADDF-STEM (Fig. 4) reveal that the original small Cu nanoparticles (< 3 nm) are still present, though qualitatively the amount is lower than in the original samples. The latter is indicative for some aggregation to larger particles (Fig. 4f). Aggregation is typical for Cu based catalysts due to the high mobility of Cu species at elevated temperatures [64]. Besides aggregation, also some leaching of Cu also occurred as revealed by ICP-OES, showing that the Cu contents decreased from 5.0 wt% for the fresh to 3.7 wt% for the spent catalyst. Carbon deposition on the catalyst was quantified by TGA (Fig. S8). Based on these data, it can be concluded that carbon deposition on the catalyst is minimal. 3.5 Effect of solvent and process conditions on catalyst performance 3.5.1 Solvent effects The effect of the solvent on catalyst performance and particularly product selectivity was determined for the Cu/TiO2-P25 catalyst in the continuous set-up (300 °C, 10 bar) using toluene and n-octane at different conversion levels (18–40%). The latter was varied by operating the continuous set-up at different WHSV values. The selectivity versus the conversion in both solvents is given in Fig. 9a. Distinct differences in selectivity trends are observed for both solvents. n-Octane gives the highest selectivity to phenol and demethoxylated phenols at low conversion, whereas the trend is opposite at higher conversions. Thus, toluene is favored for the reaction and best results were a 58% selectivity of phenol, and 81% of demethoxylated phenols at a conversion level of 35%. Possible reactivity of toluene was checked by performing a blank experiment with toluene alone and the catalyst at 300 °C. Clear peaks from toluene derived products were not detected in the product mixtures, indicating that toluene is inert at the prevailing reaction conditions. 3.5.2 Temperature effects The effect of reaction temperature was studied in the continuous set-up for Cu/TiO2-P25 with toluene as the solvent at a fixed WHSV of 21 h−1 and a pressure of 10 bar. The results are shown in Fig. 9b. The guaiacol conversion increases with temperature and values up to 98% were obtained at 360 °C. The selectivity of demethoxylated phenols also increased to 87%, though the selectivity to the parent phenol dropped from 54% to 48%. These values correspond to a yield of demethoxylated products of about 85%, which is by far better than reported for Cu/AC in batch (79% selectivity at 24% conversion giving a yield of 19%, Table 1) and other Cu based catalysts (yields between 1.2% and 11%). The gas-phase product was collected for the experiment at 360 °C (10 bar, WHSV = 21 h−1), with 5 wt% guaiacol in toluene as reactant. CH4 was the only product identified, though present in only very minor amounts (0.28%). In addition, the carbon balance closure considering gas and liquid phase products, as identified and quantified with GC, was calculated for this experiment and was found to be reasonably good (86.6%). 3.6 Exploratory experiments using alternative feeds (4-n-propylguaiacol and an guaiacol enriched feed) Catalytic demethoxylation using the Cu bases catalysts was extended to another model compound (4-n-propylguaiacol) and a crude bioliquid (a pyrolysis oil fraction enriched in guaiacols). The former was selected as it is a major component of lignin oils obtained by the reductive catalytic fractionation (RCF) of lignocellulosic biomass [20]. The demethoxylation of 4-n-propylguaiacol using Cu/TiO2-P25 was carried out in the continuous set-up at 360 °C, 10 bar, with 5 wt% 4-n-propylguaiacol dissolved in toluene as a reactant and a WHSV of 21 h−1. The results are given in Table 3. The conversion level of 4-n-propylguaiacol was 94%, which is slightly lower when compared to guaiacol (98%) at similar conditions. The main products were higher alkylated phenols (i.e., propylphenols and methylated propylphenols) with a total selectivity to demethoxylated phenols of 69%. The latter is somewhat lower than found for guaiacol (87%), though comparison is cumbersome as the substrate conversion is different for both experiments. A bioliquid enriched in guaiacols, obtained by pyrolysis oil fractionation was used as the feed to extent the synthetic strategy to more complex feeds. The feed is enriched in guaiacols, and like guaiacol (16 wt%), methylguaiacols (35 wt%), 4-ethylguaiacol (9 wt%), eugenol (9 wt%), and 4-n-propylguaiacol (1 wt%), as shown in Table S3. The reaction was carried out in the continuous set-up at 360 °C, 10 bar, with 5 wt% crude feed dissolved in toluene as a reactant and a WHSV of 23 h−1. The catalytic reaction was conducted without major operational issues for a TOS of 6 h and a total of 14.1 g of the product was obtained. The product was analyzed in detail using GC-FID and was shown to contain mainly (methylated)-phenols like 2-methylphenol, 4-methylphenol, and 2,4-dimethylphenol ( Fig. 10). The presence of mainly methylated phenols is not surprising as the feed contains high amounts of methyl substituted guaiacols. Based on the analyses data, the total guaiacol conversion was estimated at 87% and the selectivity to demethoxylated phenols was about 81%. Overall, it can be concluded that demethoxylation of a complex bioliquid is well possible using the Cu/TiO2-P25 catalyst. 4 Conclusions A series of novel non-precious metal catalysts based on Cu and supported on inorganic supports (TiO2, SiO2 and ZrO2) was tested for the demethoxylaton of guaiacols. Cu/TiO2-P25, was shown to be the best catalyst in the series when considering selectivity at equal conversion levels. A clear correlation was found between the oxygen storage capacity of the support (TiO2-P25, TiO2-A HSA, TiO2-R, and MoO3-TiO2) and guaiacol conversion, indicating that this property plays an important role in the catalytic cycle. Further optimization studies showed that the selectivity to demethoxylated phenols can be up to 87% at 98% conversion. In addition, the catalyst shows excellent stability for a 100 h TOS experiment. The synthetic methodology was successfully extended for the demethoxylation of 4-n-propylguaiacol and a guaiacols enriched pyrolysis oil fraction, showing high substrate flexibility. Further studies are in progress to obtain biobased phenol, a valuable bulk chemical, now primarily obtained from fossil resources, by selective dealkylation of the alkylated phenols formed in this study. These studies will be reported in due course. CRediT authorship contribution statement Huiazhou Yang: Investigation, Writing – original draft. Xiatian Zhu: Investigation, Writing – original draft. Helda Wika Amini: Investigation, Writing – original draft. Majid Ahmad: Investigation, Writing – original draft. Gert H. ten Brink: Investigation, Writing – original draft. Boy Fachri: Supervision, Writing – review & editing. P. Deuss: Supervision, Validation, Writing – review & editing. H.J. Heeres: Conceptualization, Funding acquisition, Supervision, Validation, Writing – review & editing. Declaration of Competing Interest The authors declare the following financial interests/personal relationships which may be considered as potential competing interests: Huaizhou Yang and Xiaotian Zhu reports financial support was provided by China Scholarship Council. Acknowledgments H.Y. and X.Z. acknowledge the China Scholarship Council for funding their PhD studies (grant number 201706160156 and 201707040079, respectively). The authors thank Hans Heeres (Biomass Technology Group, BTG) for providing the crude feed isolated from pyrolysis oil. Leon Rohrbach, Erwin Wilbers, Marcel de Vries, and Hans van der Velde are acknowledged for technical and analytical support. We also thank Jos Winkelman for performing the Aspen plus simulations. Appendix A Supporting information Supplementary data associated with this article can be found in the online version at doi:10.1016/j.apcata.2023.119062. Appendix A Supplementary material Supplementary material. . References [1] A.J. Ragauskas G.T. Beckham M.J. Biddy R. Chandra F. Chen M.F. Davis B.H. Davison R.A. Dixon P. Gilna M. Keller P. Langan A.K. Naskar J.N. Saddler T.J. Tschaplinski G.A. Tuskan C.E. Wyman Science 80 344 2014 1246843 A.J. Ragauskas, G.T. Beckham, M.J. Biddy, R. Chandra, F. Chen, M.F. Davis, B.H. Davison, R.A. Dixon, P. Gilna, M. Keller, P. Langan, A.K. Naskar, J.N. Saddler, T.J. Tschaplinski, G.A. Tuskan, C.E. Wyman, Science (80–.). 344 (2014) 1246843. [2] P.J. Deuss M. Scott F. Tran N.J. Westwood J.G. de Vries K. Barta J. Am. Chem. Soc. 137 2015 7456 7467 P.J. Deuss, M. Scott, F. Tran, N.J. Westwood, J.G. de Vries, K. Barta, J. Am. Chem. Soc. 137 (2015) 7456–7467. [3] B. Li I. Filpponen D.S. Argyropoulos Ind. Eng. Chem. Res. 49 2010 3126 3136 B. Li, I. Filpponen, D.S. Argyropoulos, Ind. Eng. Chem. Res. 49 (2010) 3126–3136. [4] U. Wongsiriwan Y. Noda C. Song P. Prasassarakich Y. Yeboah Energy Fuels 24 2010 3232 3238 U. Wongsiriwan, Y. Noda, C. Song, P. Prasassarakich, Y. Yeboah, Energy & Fuels 24 (2010) 3232–3238. [5] A. Rodriguez D. Salvachúa R. Katahira B.A. Black N.S. Cleveland M. Reed H. Smith E.E.K. Baidoo J.D. Keasling B.A. Simmons G.T. Beckham J.M. Gladden ACS Sustain. Chem. Eng. 5 2017 8171 8180 A. Rodriguez, D. Salvachúa, R. Katahira, B.A. Black, N.S. Cleveland, M. Reed, H. Smith, E.E.K. Baidoo, J.D. Keasling, B.A. Simmons, G.T. Beckham, J.M. Gladden, ACS Sustain. Chem. Eng. 5 (2017) 8171–8180. [6] J.-S. Kim Bioresour. Technol. 178 2015 90 98 J.-S. Kim, Bioresour. Technol. 178 (2015) 90–98. [7] T. Renders G. Van den Bossche T. Vangeel K. Van Aelst B. Sels Curr. Opin. Biotechnol 56 2019 193 201 T. Renders, G. Van den Bossche, T. Vangeel, K. Van Aelst, B. Sels, Curr. Opin. Biotechnol. 56 (2019) 193–201. [8] E.M. Anderson M.L. Stone R. Katahira M. Reed G.T. Beckham Y. Román-Leshkov Joule 1 2017 613 622 E.M. Anderson, M.L. Stone, R. Katahira, M. Reed, G.T. Beckham, Y. Román-Leshkov, Joule 1 (2017) 613–622. [9] Y. Jing Y. Wang Front. Chem. Eng. 2 2020 1 7 Y. Jing, Y. Wang, Front. Chem. Eng. 2 (2020) 1–7. [10] S.S. Wong R. Shu J. Zhang H. Liu N. Yan Chem. Soc. Rev. 2020 S.S. Wong, R. Shu, J. Zhang, H. Liu, N. Yan, Chem. Soc. Rev. (2020). [11] Z. Sun J. Cheng D. Wang T.-Q. Yuan G. Song K. Barta ChemSusChem 13 2020 5199 5212 Z. Sun, J. Cheng, D. Wang, T.-Q. Yuan, G. Song, K. Barta, ChemSusChem 13 (2020) 5199–5212. [12] X. Huang J.M. Ludenhoff M. Dirks X. Ouyang M.D. Boot E.J.M. Hensen ACS Catal. 8 2018 11184 11190 X. Huang, J.M. Ludenhoff, M. Dirks, X. Ouyang, M.D. Boot, E.J.M. Hensen, ACS Catal. 8 (2018) 11184–11190. [13] M.Á. González-Borja D.E. Resasco Energy Fuels 25 2011 4155 4162 M.Á. González-Borja, D.E. Resasco, Energy & Fuels 25 (2011) 4155–4162. [14] J. Sun A.M. Karim H. Zhang L. Kovarik X.S. Li A.J. Hensley J.-S. McEwen Y. Wang J. Catal. 306 2013 47 57 J. Sun, A.M. Karim, H. Zhang, L. Kovarik, X.S. Li, A.J. Hensley, J.-S. McEwen, Y. Wang, J. Catal. 306 (2013) 47–57. [15] J. García-Serna R. Piñero-Hernanz D. Durán-Martín Catal. Today 387 2022 237 243 J. García-Serna, R. Piñero-Hernanz, D. Durán-Martín, Catal. Today 387 (2022) 237–243. [16] X. Zhang P. Yan B. Zhao Z.C. Zhang Catal. Sci. Technol. 11 2021 297 311 X. Zhang, P. Yan, B. Zhao, Z.C. Zhang, Catal. Sci. Technol. 11 (2021) 297–311. [17] Y. Liao S. Koelewijn G. Van den Bossche J. Van Aelst S. Van den Bosch T. Renders K. Navare T. Nicolaï K. Van Aelst M. Maesen H. Matsushima J.M. Thevelein K. Van Acker B. Lagrain D. Verboekend B.F. Sels Science 80 367 2020 1385 1390 Y. Liao, S. Koelewijn, G. Van den Bossche, J. Van Aelst, S. Van den Bosch, T. Renders, K. Navare, T. Nicolaï, K. Van Aelst, M. Maesen, H. Matsushima, J.M. Thevelein, K. Van Acker, B. Lagrain, D. Verboekend, B.F. Sels, Science (80–.). 367 (2020) 1385–1390. [18] T. Prasomsri M. Shetty K. Murugappan Y. Román-Leshkov Energy Environ. Sci. 7 2014 2660 2669 T. Prasomsri, M. Shetty, K. Murugappan, Y. Román-Leshkov, Energy Environ. Sci. 7 (2014) 2660–2669. [19] X. Zhang J. Tang Q. Zhang Q. Liu Y. Li L. Chen C. Wang L. Ma Catal. Today 319 2019 41 47 X. Zhang, J. Tang, Q. Zhang, Q. Liu, Y. Li, L. Chen, C. Wang, L. Ma, Catal. Today 319 (2019) 41–47. [20] X. Ouyang X. Huang M.D. Boot E.J.M. Hensen ChemSusChem 13 2020 1705 1709 X. Ouyang, X. Huang, M.D. Boot, E.J.M. Hensen, ChemSusChem 13 (2020) 1705–1709. [21] I.T. Ghampson C. Sepúlveda R. Garcia B.G. Frederick M.C. Wheeler N. Escalona W.J. DeSisto Appl. Catal. A Gen. 413–414 2012 78 84 I.T. Ghampson, C. Sepúlveda, R. Garcia, B.G. Frederick, M.C. Wheeler, N. Escalona, W.J. DeSisto, Appl. Catal. A Gen. 413–414 (2012) 78–84. [22] S. Liu H. Wang K.J. Smith C.S. Kim Energy Fuels 31 2017 6378 6388 S. Liu, H. Wang, K.J. Smith, C.S. Kim, Energy & Fuels 31 (2017) 6378–6388. [23] C. Li Y. Nakagawa M. Tamura A. Nakayama K. Tomishige ACS Catal. 2020 14624 14639 C. Li, Y. Nakagawa, M. Tamura, A. Nakayama, K. Tomishige, ACS Catal. (2020) 14624–14639. [24] M.B. Griffin F.G. Baddour S.E. Habas C.P. Nash D.A. Ruddy J.A. Schaidle Catal. Sci. Technol. 7 2017 2954 2966 M.B. Griffin, F.G. Baddour, S.E. Habas, C.P. Nash, D.A. Ruddy, J.A. Schaidle, Catal. Sci. Technol. 7 (2017) 2954–2966. [25] S.M. Schimming O.D. LaMont M. König A.K. Rogers A.D. D’Amico M.M. Yung C. Sievers ChemSusChem 8 2015 2073 2083 S.M. Schimming, O.D. LaMont, M. König, A.K. Rogers, A.D. D’Amico, M.M. Yung, C. Sievers, ChemSusChem 8 (2015) 2073–2083. [26] X. Diao N. Ji T. Li Z. Jia S. Jiang Z. Wang C. Song C. Liu X. Lu Q. Liu J. Catal. 401 2021 234 251 X. Diao, N. Ji, T. Li, Z. Jia, S. Jiang, Z. Wang, C. Song, C. Liu, X. Lu, Q. Liu, J. Catal. 401 (2021) 234–251. [27] Z. Cai F. Wang X. Zhang R. Ahishakiye Y. Xie Y. Shen Mol. Catal. 441 2017 28 34 Z. Cai, F. Wang, X. Zhang, R. Ahishakiye, Y. Xie, Y. Shen, Mol. Catal. 441 (2017) 28–34. [28] J. Chang T. Danuthai S. Dewiyanti C. Wang A. Borgna ChemCatChem 5 2013 3041 3049 J. Chang, T. Danuthai, S. Dewiyanti, C. Wang, A. Borgna, ChemCatChem 5 (2013) 3041–3049. [29] S. Song J. Zhang N. Yan Fuel Process. Technol. 199 2020 106224 S. Song, J. Zhang, N. Yan, Fuel Process. Technol. 199 (2020) 106224. [30] P.E. Ruiz B.G. Frederick W.J. De Sisto R.N. Austin L.R. Radovic K. Leiva R. García N. Escalona M.C. Wheeler Catal. Commun. 27 2012 44 48 P.E. Ruiz, B.G. Frederick, W.J. De Sisto, R.N. Austin, L.R. Radovic, K. Leiva, R. García, N. Escalona, M.C. Wheeler, Catal. Commun. 27 (2012) 44–48. [31] H.Y. Zhao D. Li P. Bui S.T. Oyama Appl. Catal. A Gen. 391 2011 305 310 H.Y. Zhao, D. Li, P. Bui, S.T. Oyama, Appl. Catal. A Gen. 391 (2011) 305–310. [32] I. Tyrone Ghampson C. Sepúlveda R. Garcia J.L. García Fierro N. Escalona W.J. DeSisto Appl. Catal. A Gen. 435–436 2012 51 60 I. Tyrone Ghampson, C. Sepúlveda, R. Garcia, J.L. García Fierro, N. Escalona, W.J. DeSisto, Appl. Catal. A Gen. 435–436 (2012) 51–60. [33] E. Blanco C. Sepulveda K. Cruces J.L. García-Fierro I.T. Ghampson N. Escalona Catal. Today 356 2020 376 383 E. Blanco, C. Sepulveda, K. Cruces, J.L. García-Fierro, I.T. Ghampson, N. Escalona, Catal. Today 356 (2020) 376–383. [34] X. Kong C. Liu Y. Han M. Lei Y. Fan M. Li R. Xiao Energy Fuels 35 2021 1511 1522 X. Kong, C. Liu, Y. Han, M. Lei, Y. Fan, M. Li, R. Xiao, Energy & Fuels 35 (2021) 1511–1522. [35] K.L. Deutsch B.H. Shanks Appl. Catal. A Gen. 447–448 2012 144 150 K.L. Deutsch, B.H. Shanks, Appl. Catal. A Gen. 447–448 (2012) 144–150. [36] M. Shetty K. Murugappan T. Prasomsri W.H. Green Y. Román-Leshkov J. Catal. 331 2015 86 97 M. Shetty, K. Murugappan, T. Prasomsri, W.H. Green, Y. Román-Leshkov, J. Catal. 331 (2015) 86–97. [37] M. Shetty K. Murugappan W.H. Green Y. Román-Leshkov ACS Sustain. Chem. Eng. 5 2017 5293 5301 M. Shetty, K. Murugappan, W.H. Green, Y. Román-Leshkov, ACS Sustain. Chem. Eng. 5 (2017) 5293–5301. [38] H. Yang W. Yin X. Zhu P.J. Deuss H.J. Heeres ChemCatChem 14 2022 e202200297 H. Yang, W. Yin, X. Zhu, P.J. Deuss, H.J. Heeres, ChemCatChem 14 (2022) e202200297. [39] H. Heeres E.J. Leijenhorst R. Ongena L. Van de Beld Eur. Biomass Conf. Exhib. Proc. 2019 ETA-Florence Renewable Energies 1894 1898 H. Heeres, E.J. Leijenhorst, R. Ongena, L. Van de Beld, in: Eur. Biomass Conf. Exhib. Proc., ETA-Florence Renewable Energies, 2019, pp. 1894–1898. [40] J.C. Groen L.A.A. Peffer J. Pérez-Ramírez Microporous Mesoporous Mater. 60 2003 1 17 J.C. Groen, L.A.A. Peffer, J. Pérez-Ramírez, Microporous Mesoporous Mater. 60 (2003) 1–17. [41] J. Horáček G. Šťávová V. Kelbichová D. Kubička Catal. Today 204 2013 38 45 J. Horáček, G. Šťávová, V. Kelbichová, D. Kubička, Catal. Today 204 (2013) 38–45. [42] P.-O. Larsson A. Andersson J. Catal. 179 1998 72 89 P.-O. Larsson, A. Andersson, J. Catal. 179 (1998) 72–89. [43] B. Seemala C.M. Cai C.E. Wyman P. Christopher ACS Catal. 7 2017 4070 4082 B. Seemala, C.M. Cai, C.E. Wyman, P. Christopher, ACS Catal. 7 (2017) 4070–4082. [44] P.-O. Larsson A. Andersson L.R. Wallenberg B. Svensson J. Catal. 163 1996 279 293 P.-O. Larsson, A. Andersson, L.R. Wallenberg, B. Svensson, J. Catal. 163 (1996) 279–293. [45] K. Liu P. Yan H. Jiang Z. Xia Z. Xu S. Bai Z.C. Zhang J. Catal. 369 2019 396 404 K. Liu, P. Yan, H. Jiang, Z. Xia, Z. Xu, S. Bai, Z.C. Zhang, J. Catal. 369 (2019) 396–404. [46] K. Liu X. Huang E.A. Pidko E.J.M. Hensen Green. Chem. 19 2017 3014 3022 K. Liu, X. Huang, E.A. Pidko, E.J.M. Hensen, Green Chem. 19 (2017) 3014–3022. [47] X.-Z. Ding X.-H. Liu Y.-Z. He J. Mater. Sci. Lett. 15 1996 1789 1791 X.-Z. Ding, X.-H. Liu, Y.-Z. He, J. Mater. Sci. Lett. 15 (1996) 1789–1791. [48] J.F. Porter Y.-G. Li C.K. Chan J. Mater. Sci. 34 1999 1523 1531 J.F. Porter, Y.-G. Li, C.K. Chan, J. Mater. Sci. 34 (1999) 1523–1531. [49] X. Jiang M. Manawan T. Feng R. Qian T. Zhao G. Zhou F. Kong Q. Wang S. Dai J.H. Pan Catal. Today 300 2018 12 17 X. Jiang, M. Manawan, T. Feng, R. Qian, T. Zhao, G. Zhou, F. Kong, Q. Wang, S. Dai, J.H. Pan, Catal. Today 300 (2018) 12–17. [50] X. Xi F. Zeng H. Cao C. Cannilla T. Bisswanger S. de Graaf Y. Pei F. Frusteri C. Stampfer R. Palkovits H.J. Heeres Appl. Catal. B Environ. 272 2020 118950 X. Xi, F. Zeng, H. Cao, C. Cannilla, T. Bisswanger, S. de Graaf, Y. Pei, F. Frusteri, C. Stampfer, R. Palkovits, H.J. Heeres, Appl. Catal. B Environ. 272 (2020) 118950. [51] J. Mao J. Zhou Z. Xia Z. Wang Z. Xu W. Xu P. Yan K. Liu X. Guo Z.C. Zhang ACS Catal. 7 2017 695 705 J. Mao, J. Zhou, Z. Xia, Z. Wang, Z. Xu, W. Xu, P. Yan, K. Liu, X. Guo, Z.C. Zhang, ACS Catal. 7 (2017) 695–705. [52] S.L. Yohe H.J. Choudhari D.D. Mehta P.J. Dietrich M.D. Detwiler C.M. Akatay E.A. Stach J.T. Miller W.N. Delgass R. Agrawal F.H. Ribeiro J. Catal. 344 2016 535 552 S.L. Yohe, H.J. Choudhari, D.D. Mehta, P.J. Dietrich, M.D. Detwiler, C.M. Akatay, E.A. Stach, J.T. Miller, W.N. Delgass, R. Agrawal, F.H. Ribeiro, J. Catal. 344 (2016) 535–552. [53] C. Li Y. Nakagawa M. Yabushita A. Nakayama K. Tomishige ACS Catal. 2021 12794 12814 C. Li, Y. Nakagawa, M. Yabushita, A. Nakayama, K. Tomishige, ACS Catal. (2021) 12794–12814. [54] I.T. Ghampson R. Canales N. Escalona Appl. Catal. A Gen. 549 2018 225 236 I.T. Ghampson, R. Canales, N. Escalona, Appl. Catal. A Gen. 549 (2018) 225–236. [55] D. Padayachee A.S. Mahomed S. Singh H.B. Friedrich ACS Catal. 2020 2211 2220 D. Padayachee, A.S. Mahomed, S. Singh, H.B. Friedrich, ACS Catal. (2020) 2211–2220. [56] T. Ohno K. Sarukawa M. Matsumura J. Phys. Chem. B 105 2001 2417 2420 T. Ohno, K. Sarukawa, M. Matsumura, J. Phys. Chem. B 105 (2001) 2417–2420. [57] Q. Xu Y. Ma J. Zhang X. Wang Z. Feng C. Li J. Catal J. Catal. 278 2011 329 335 Q. Xu, Y. Ma, J. Zhang, X. Wang, Z. Feng, C. Li, J. Catal. 278 (2011) 329–335. [58] X. Zhang Y. Lin D. He J. Zhang Z. Fan T. Xie Chem. Phys. Lett. 504 2011 71 75 X. Zhang, Y. Lin, D. He, J. Zhang, Z. Fan, T. Xie, Chem. Phys. Lett. 504 (2011) 71–75. [59] X. Wang P. Wu Z. Wang L. Zhou Y. Liu H. Cheng M. Arai C. Zhang F. Zhao ACS Sustain. Chem. Eng. 9 2021 3083 3094 X. Wang, P. Wu, Z. Wang, L. Zhou, Y. Liu, H. Cheng, M. Arai, C. Zhang, F. Zhao, ACS Sustain. Chem. Eng. 9 (2021) 3083–3094. [60] T.N. Phan Y.-K. Park I.-G. Lee C.H. Ko Appl. Catal. A Gen. 544 2017 84 93 T.N. Phan, Y.-K. Park, I.-G. Lee, C.H. Ko, Appl. Catal. A Gen. 544 (2017) 84–93. [61] Y. Bessekhouad D. Robert J.-V. Weber N. Chaoui J. Photochem. Photobiol. A Chem. 167 2004 49 57 Y. Bessekhouad, D. Robert, J.-V. Weber, N. Chaoui, J. Photochem. Photobiol. A Chem. 167 (2004) 49–57. [62] R.N. Olcese M. Bettahar D. Petitjean B. Malaman F. Giovanella A. Dufour Appl. Catal. B Environ. 115–116 2012 63 73 R.N. Olcese, M. Bettahar, D. Petitjean, B. Malaman, F. Giovanella, A. Dufour, Appl. Catal. B Environ. 115–116 (2012) 63–73. [63] R. Olcese M.M. Bettahar B. Malaman J. Ghanbaja L. Tibavizco D. Petitjean A. Dufour Appl. Catal. B Environ. 129 2013 528 538 R. Olcese, M.M. Bettahar, B. Malaman, J. Ghanbaja, L. Tibavizco, D. Petitjean, A. Dufour, Appl. Catal. B Environ. 129 (2013) 528–538. [64] R.-P. Ye L. Lin Q. Li Z. Zhou T. Wang C.K. Russell H. Adidharma Z. Xu Y.-G. Yao M. Fan Catal. Sci. Technol. 8 2018 3428 3449 R.-P. Ye, L. Lin, Q. Li, Z. Zhou, T. Wang, C.K. Russell, H. Adidharma, Z. Xu, Y.-G. Yao, M. Fan, Catal. Sci. Technol. 8 (2018) 3428–3449.",
      "scopus-id": "85148082122",
      "coredata": {
        "eid": "1-s2.0-S0926860X2300042X",
        "dc:description": "Lignin is an attractive feedstock for low molecular weight biobased phenols using depolymerization strategies such as reductive catalytic fractionation or fast pyrolysis. Such strategies often yield a product mixture enriched in lignin-derived monomers with methoxy substituents. Selective catalytic hydrodeoxygenation (HDO) is an effective methodology to demethoxylate these monomers into valuable alkylated phenols. Here, we report the use of non-precious Cu based catalysts supported on SiO2, ZrO2, TiO2 (various forms), MoO3-ZrO2, and MoO3-TiO2 in a continuous fixed-bed reactor at elevated temperature and pressure (300–360 °C, 10 bar) for the selective demethoxylation of guaiacol. Among the various catalysts, Cu/TiO2-P25 was found to be an effective and highly stable catalyst (100 h on stream) with a selectivity of 87% to demethoxylated compounds like phenol and cresols at a guaiacol conversion of 98%. A correlation was found between the oxygen storage capacity of the support (TiO2-P25, TiO2-A HSA, TiO2-R, and MoO3-TiO2) and guaiacol conversion, indicating that this property plays a role in the catalytic cycle. Besides, the demethoxylation of 4-n-propylguaiacol and a realistic guaiacol-rich feed isolated from a representative pyrolysis oil was successfully demonstrated. 87% of the guaiacols present in the feed were converted to demethoxylated phenols with a selectivity of 81%.",
        "openArchiveArticle": "false",
        "prism:coverDate": "2023-03-25",
        "openaccessUserLicense": "http://creativecommons.org/licenses/by/4.0/",
        "prism:aggregationType": "Journal",
        "prism:url": "https://api.elsevier.com/content/article/pii/S0926860X2300042X",
        "dc:creator": [
          {
            "@_fa": "true",
            "$": "Yang, Huaizhou"
          },
          {
            "@_fa": "true",
            "$": "Zhu, Xiaotian"
          },
          {
            "@_fa": "true",
            "$": "Amini, Helda Wika"
          },
          {
            "@_fa": "true",
            "$": "Fachri, Boy"
          },
          {
            "@_fa": "true",
            "$": "Ahmadi, Majid"
          },
          {
            "@_fa": "true",
            "$": "ten Brink, Gert H."
          },
          {
            "@_fa": "true",
            "$": "Deuss, Peter J."
          },
          {
            "@_fa": "true",
            "$": "Heeres, Hero J."
          }
        ],
        "link": [
          {
            "@_fa": "true",
            "@rel": "self",
            "@href": "https://api.elsevier.com/content/article/pii/S0926860X2300042X"
          },
          {
            "@_fa": "true",
            "@rel": "scidir",
            "@href": "https://www.sciencedirect.com/science/article/pii/S0926860X2300042X"
          }
        ],
        "dc:format": "application/json",
        "openaccessType": "Full",
        "pii": "S0926-860X(23)00042-X",
        "prism:volume": "654",
        "articleNumber": "119062",
        "prism:publisher": "The Author(s). Published by Elsevier B.V.",
        "dc:title": "Efficient Cu-based catalysts for the selective demethoxylation of guaiacols",
        "prism:copyright": "© 2023 The Author(s). Published by Elsevier B.V.",
        "openaccess": "1",
        "prism:issn": "0926860X",
        "dcterms:subject": [
          {
            "@_fa": "true",
            "$": "Guaiacol"
          },
          {
            "@_fa": "true",
            "$": "Pyrolysis oil"
          },
          {
            "@_fa": "true",
            "$": "Demethoxylation"
          },
          {
            "@_fa": "true",
            "$": "Cu catalyst"
          },
          {
            "@_fa": "true",
            "$": "Titania"
          }
        ],
        "openaccessArticle": "true",
        "prism:publicationName": "Applied Catalysis A: General",
        "openaccessSponsorType": "FundingBody",
        "prism:pageRange": "119062",
        "pubType": "fla",
        "prism:coverDisplayDate": "25 March 2023",
        "prism:doi": "10.1016/j.apcata.2023.119062",
        "prism:startingPage": "119062",
        "dc:identifier": "doi:10.1016/j.apcata.2023.119062",
        "openaccessSponsorName": "Dutch University VSNU 2020"
      },
      "objects": {
        "object": [
          {
            "@category": "standard",
            "@height": "299",
            "@width": "376",
            "@_fa": "true",
            "$": "https://api.elsevier.com/content/object/eid/1-s2.0-S0926860X2300042X-sc1.jpg?httpAccept=%2A%2F%2A",
            "@multimediatype": "JPEG image file",
            "@type": "IMAGE-DOWNSAMPLED",
            "@size": "19611",
            "@ref": "sc1",
            "@mimetype": "image/jpeg"
          },
          {
            "@category": "standard",
            "@height": "340",
            "@width": "376",
            "@_fa": "true",
            "$": "https://api.elsevier.com/content/object/eid/1-s2.0-S0926860X2300042X-gr1.jpg?httpAccept=%2A%2F%2A",
            "@multimediatype": "JPEG image file",
            "@type": "IMAGE-DOWNSAMPLED",
            "@size": "27322",
            "@ref": "gr1",
            "@mimetype": "image/jpeg"
          },
          {
            "@category": "standard",
            "@height": "345",
            "@width": "376",
            "@_fa": "true",
            "$": "https://api.elsevier.com/content/object/eid/1-s2.0-S0926860X2300042X-gr2.jpg?httpAccept=%2A%2F%2A",
            "@multimediatype": "JPEG image file",
            "@type": "IMAGE-DOWNSAMPLED",
            "@size": "27312",
            "@ref": "gr2",
            "@mimetype": "image/jpeg"
          },
          {
            "@category": "standard",
            "@height": "337",
            "@width": "376",
            "@_fa": "true",
            "$": "https://api.elsevier.com/content/object/eid/1-s2.0-S0926860X2300042X-gr3.jpg?httpAccept=%2A%2F%2A",
            "@multimediatype": "JPEG image file",
            "@type": "IMAGE-DOWNSAMPLED",
            "@size": "29218",
            "@ref": "gr3",
            "@mimetype": "image/jpeg"
          },
          {
            "@category": "standard",
            "@height": "844",
            "@width": "565",
            "@_fa": "true",
            "$": "https://api.elsevier.com/content/object/eid/1-s2.0-S0926860X2300042X-gr4.jpg?httpAccept=%2A%2F%2A",
            "@multimediatype": "JPEG image file",
            "@type": "IMAGE-DOWNSAMPLED",
            "@size": "80310",
            "@ref": "gr4",
            "@mimetype": "image/jpeg"
          },
          {
            "@category": "standard",
            "@height": "277",
            "@width": "376",
            "@_fa": "true",
            "$": "https://api.elsevier.com/content/object/eid/1-s2.0-S0926860X2300042X-gr5.jpg?httpAccept=%2A%2F%2A",
            "@multimediatype": "JPEG image file",
            "@type": "IMAGE-DOWNSAMPLED",
            "@size": "33676",
            "@ref": "gr5",
            "@mimetype": "image/jpeg"
          },
          {
            "@category": "standard",
            "@height": "345",
            "@width": "376",
            "@_fa": "true",
            "$": "https://api.elsevier.com/content/object/eid/1-s2.0-S0926860X2300042X-gr6.jpg?httpAccept=%2A%2F%2A",
            "@multimediatype": "JPEG image file",
            "@type": "IMAGE-DOWNSAMPLED",
            "@size": "25224",
            "@ref": "gr6",
            "@mimetype": "image/jpeg"
          },
          {
            "@category": "standard",
            "@height": "101",
            "@width": "376",
            "@_fa": "true",
            "$": "https://api.elsevier.com/content/object/eid/1-s2.0-S0926860X2300042X-gr7.jpg?httpAccept=%2A%2F%2A",
            "@multimediatype": "JPEG image file",
            "@type": "IMAGE-DOWNSAMPLED",
            "@size": "9677",
            "@ref": "gr7",
            "@mimetype": "image/jpeg"
          },
          {
            "@category": "standard",
            "@height": "331",
            "@width": "376",
            "@_fa": "true",
            "$": "https://api.elsevier.com/content/object/eid/1-s2.0-S0926860X2300042X-gr8.jpg?httpAccept=%2A%2F%2A",
            "@multimediatype": "JPEG image file",
            "@type": "IMAGE-DOWNSAMPLED",
            "@size": "28585",
            "@ref": "gr8",
            "@mimetype": "image/jpeg"
          },
          {
            "@category": "standard",
            "@height": "338",
            "@width": "376",
            "@_fa": "true",
            "$": "https://api.elsevier.com/content/object/eid/1-s2.0-S0926860X2300042X-gr10.jpg?httpAccept=%2A%2F%2A",
            "@multimediatype": "JPEG image file",
            "@type": "IMAGE-DOWNSAMPLED",
            "@size": "27477",
            "@ref": "gr10",
            "@mimetype": "image/jpeg"
          },
          {
            "@category": "standard",
            "@height": "273",
            "@width": "678",
            "@_fa": "true",
            "$": "https://api.elsevier.com/content/object/eid/1-s2.0-S0926860X2300042X-gr9.jpg?httpAccept=%2A%2F%2A",
            "@multimediatype": "JPEG image file",
            "@type": "IMAGE-DOWNSAMPLED",
            "@size": "38321",
            "@ref": "gr9",
            "@mimetype": "image/jpeg"
          },
          {
            "@category": "standard",
            "@height": "190",
            "@width": "500",
            "@_fa": "true",
            "$": "https://api.elsevier.com/content/object/eid/1-s2.0-S0926860X2300042X-ga1.jpg?httpAccept=%2A%2F%2A",
            "@multimediatype": "JPEG image file",
            "@type": "IMAGE-DOWNSAMPLED",
            "@size": "23198",
            "@ref": "ga1",
            "@mimetype": "image/jpeg"
          },
          {
            "@category": "thumbnail",
            "@height": "164",
            "@width": "206",
            "@_fa": "true",
            "$": "https://api.elsevier.com/content/object/eid/1-s2.0-S0926860X2300042X-sc1.sml?httpAccept=%2A%2F%2A",
            "@multimediatype": "GIF image file",
            "@type": "IMAGE-THUMBNAIL",
            "@size": "6120",
            "@ref": "sc1",
            "@mimetype": "image/gif"
          },
          {
            "@category": "thumbnail",
            "@height": "164",
            "@width": "181",
            "@_fa": "true",
            "$": "https://api.elsevier.com/content/object/eid/1-s2.0-S0926860X2300042X-gr1.sml?httpAccept=%2A%2F%2A",
            "@multimediatype": "GIF image file",
            "@type": "IMAGE-THUMBNAIL",
            "@size": "7730",
            "@ref": "gr1",
            "@mimetype": "image/gif"
          },
          {
            "@category": "thumbnail",
            "@height": "164",
            "@width": "179",
            "@_fa": "true",
            "$": "https://api.elsevier.com/content/object/eid/1-s2.0-S0926860X2300042X-gr2.sml?httpAccept=%2A%2F%2A",
            "@multimediatype": "GIF image file",
            "@type": "IMAGE-THUMBNAIL",
            "@size": "7427",
            "@ref": "gr2",
            "@mimetype": "image/gif"
          },
          {
            "@category": "thumbnail",
            "@height": "164",
            "@width": "183",
            "@_fa": "true",
            "$": "https://api.elsevier.com/content/object/eid/1-s2.0-S0926860X2300042X-gr3.sml?httpAccept=%2A%2F%2A",
            "@multimediatype": "GIF image file",
            "@type": "IMAGE-THUMBNAIL",
            "@size": "8230",
            "@ref": "gr3",
            "@mimetype": "image/gif"
          },
          {
            "@category": "thumbnail",
            "@height": "163",
            "@width": "109",
            "@_fa": "true",
            "$": "https://api.elsevier.com/content/object/eid/1-s2.0-S0926860X2300042X-gr4.sml?httpAccept=%2A%2F%2A",
            "@multimediatype": "GIF image file",
            "@type": "IMAGE-THUMBNAIL",
            "@size": "10814",
            "@ref": "gr4",
            "@mimetype": "image/gif"
          },
          {
            "@category": "thumbnail",
            "@height": "161",
            "@width": "219",
            "@_fa": "true",
            "$": "https://api.elsevier.com/content/object/eid/1-s2.0-S0926860X2300042X-gr5.sml?httpAccept=%2A%2F%2A",
            "@multimediatype": "GIF image file",
            "@type": "IMAGE-THUMBNAIL",
            "@size": "15535",
            "@ref": "gr5",
            "@mimetype": "image/gif"
          },
          {
            "@category": "thumbnail",
            "@height": "164",
            "@width": "179",
            "@_fa": "true",
            "$": "https://api.elsevier.com/content/object/eid/1-s2.0-S0926860X2300042X-gr6.sml?httpAccept=%2A%2F%2A",
            "@multimediatype": "GIF image file",
            "@type": "IMAGE-THUMBNAIL",
            "@size": "6379",
            "@ref": "gr6",
            "@mimetype": "image/gif"
          },
          {
            "@category": "thumbnail",
            "@height": "59",
            "@width": "219",
            "@_fa": "true",
            "$": "https://api.elsevier.com/content/object/eid/1-s2.0-S0926860X2300042X-gr7.sml?httpAccept=%2A%2F%2A",
            "@multimediatype": "GIF image file",
            "@type": "IMAGE-THUMBNAIL",
            "@size": "4317",
            "@ref": "gr7",
            "@mimetype": "image/gif"
          },
          {
            "@category": "thumbnail",
            "@height": "164",
            "@width": "186",
            "@_fa": "true",
            "$": "https://api.elsevier.com/content/object/eid/1-s2.0-S0926860X2300042X-gr8.sml?httpAccept=%2A%2F%2A",
            "@multimediatype": "GIF image file",
            "@type": "IMAGE-THUMBNAIL",
            "@size": "8198",
            "@ref": "gr8",
            "@mimetype": "image/gif"
          },
          {
            "@category": "thumbnail",
            "@height": "164",
            "@width": "182",
            "@_fa": "true",
            "$": "https://api.elsevier.com/content/object/eid/1-s2.0-S0926860X2300042X-gr10.sml?httpAccept=%2A%2F%2A",
            "@multimediatype": "GIF image file",
            "@type": "IMAGE-THUMBNAIL",
            "@size": "7995",
            "@ref": "gr10",
            "@mimetype": "image/gif"
          },
          {
            "@category": "thumbnail",
            "@height": "88",
            "@width": "219",
            "@_fa": "true",
            "$": "https://api.elsevier.com/content/object/eid/1-s2.0-S0926860X2300042X-gr9.sml?httpAccept=%2A%2F%2A",
            "@multimediatype": "GIF image file",
            "@type": "IMAGE-THUMBNAIL",
            "@size": "5888",
            "@ref": "gr9",
            "@mimetype": "image/gif"
          },
          {
            "@category": "thumbnail",
            "@height": "83",
            "@width": "219",
            "@_fa": "true",
            "$": "https://api.elsevier.com/content/object/eid/1-s2.0-S0926860X2300042X-ga1.sml?httpAccept=%2A%2F%2A",
            "@multimediatype": "GIF image file",
            "@type": "IMAGE-THUMBNAIL",
            "@size": "5712",
            "@ref": "ga1",
            "@mimetype": "image/gif"
          },
          {
            "@category": "high",
            "@height": "1321",
            "@width": "1663",
            "@_fa": "true",
            "$": "https://api.elsevier.com/content/object/eid/1-s2.0-S0926860X2300042X-sc1_lrg.jpg?httpAccept=%2A%2F%2A",
            "@multimediatype": "JPEG image file",
            "@type": "IMAGE-HIGH-RES",
            "@size": "106418",
            "@ref": "sc1",
            "@mimetype": "image/jpeg"
          },
          {
            "@category": "high",
            "@height": "1504",
            "@width": "1663",
            "@_fa": "true",
            "$": "https://api.elsevier.com/content/object/eid/1-s2.0-S0926860X2300042X-gr1_lrg.jpg?httpAccept=%2A%2F%2A",
            "@multimediatype": "JPEG image file",
            "@type": "IMAGE-HIGH-RES",
            "@size": "143790",
            "@ref": "gr1",
            "@mimetype": "image/jpeg"
          },
          {
            "@category": "high",
            "@height": "1524",
            "@width": "1663",
            "@_fa": "true",
            "$": "https://api.elsevier.com/content/object/eid/1-s2.0-S0926860X2300042X-gr2_lrg.jpg?httpAccept=%2A%2F%2A",
            "@multimediatype": "JPEG image file",
            "@type": "IMAGE-HIGH-RES",
            "@size": "135959",
            "@ref": "gr2",
            "@mimetype": "image/jpeg"
          },
          {
            "@category": "high",
            "@height": "1489",
            "@width": "1663",
            "@_fa": "true",
            "$": "https://api.elsevier.com/content/object/eid/1-s2.0-S0926860X2300042X-gr3_lrg.jpg?httpAccept=%2A%2F%2A",
            "@multimediatype": "JPEG image file",
            "@type": "IMAGE-HIGH-RES",
            "@size": "149450",
            "@ref": "gr3",
            "@mimetype": "image/jpeg"
          },
          {
            "@category": "high",
            "@height": "3729",
            "@width": "2495",
            "@_fa": "true",
            "$": "https://api.elsevier.com/content/object/eid/1-s2.0-S0926860X2300042X-gr4_lrg.jpg?httpAccept=%2A%2F%2A",
            "@multimediatype": "JPEG image file",
            "@type": "IMAGE-HIGH-RES",
            "@size": "396189",
            "@ref": "gr4",
            "@mimetype": "image/jpeg"
          },
          {
            "@category": "high",
            "@height": "1223",
            "@width": "1663",
            "@_fa": "true",
            "$": "https://api.elsevier.com/content/object/eid/1-s2.0-S0926860X2300042X-gr5_lrg.jpg?httpAccept=%2A%2F%2A",
            "@multimediatype": "JPEG image file",
            "@type": "IMAGE-HIGH-RES",
            "@size": "181768",
            "@ref": "gr5",
            "@mimetype": "image/jpeg"
          },
          {
            "@category": "high",
            "@height": "1525",
            "@width": "1663",
            "@_fa": "true",
            "$": "https://api.elsevier.com/content/object/eid/1-s2.0-S0926860X2300042X-gr6_lrg.jpg?httpAccept=%2A%2F%2A",
            "@multimediatype": "JPEG image file",
            "@type": "IMAGE-HIGH-RES",
            "@size": "132055",
            "@ref": "gr6",
            "@mimetype": "image/jpeg"
          },
          {
            "@category": "high",
            "@height": "448",
            "@width": "1663",
            "@_fa": "true",
            "$": "https://api.elsevier.com/content/object/eid/1-s2.0-S0926860X2300042X-gr7_lrg.jpg?httpAccept=%2A%2F%2A",
            "@multimediatype": "JPEG image file",
            "@type": "IMAGE-HIGH-RES",
            "@size": "41766",
            "@ref": "gr7",
            "@mimetype": "image/jpeg"
          },
          {
            "@category": "high",
            "@height": "1464",
            "@width": "1663",
            "@_fa": "true",
            "$": "https://api.elsevier.com/content/object/eid/1-s2.0-S0926860X2300042X-gr8_lrg.jpg?httpAccept=%2A%2F%2A",
            "@multimediatype": "JPEG image file",
            "@type": "IMAGE-HIGH-RES",
            "@size": "133081",
            "@ref": "gr8",
            "@mimetype": "image/jpeg"
          },
          {
            "@category": "high",
            "@height": "1495",
            "@width": "1663",
            "@_fa": "true",
            "$": "https://api.elsevier.com/content/object/eid/1-s2.0-S0926860X2300042X-gr10_lrg.jpg?httpAccept=%2A%2F%2A",
            "@multimediatype": "JPEG image file",
            "@type": "IMAGE-HIGH-RES",
            "@size": "138212",
            "@ref": "gr10",
            "@mimetype": "image/jpeg"
          },
          {
            "@category": "high",
            "@height": "1205",
            "@width": "2994",
            "@_fa": "true",
            "$": "https://api.elsevier.com/content/object/eid/1-s2.0-S0926860X2300042X-gr9_lrg.jpg?httpAccept=%2A%2F%2A",
            "@multimediatype": "JPEG image file",
            "@type": "IMAGE-HIGH-RES",
            "@size": "191177",
            "@ref": "gr9",
            "@mimetype": "image/jpeg"
          },
          {
            "@category": "high",
            "@height": "843",
            "@width": "2213",
            "@_fa": "true",
            "$": "https://api.elsevier.com/content/object/eid/1-s2.0-S0926860X2300042X-ga1_lrg.jpg?httpAccept=%2A%2F%2A",
            "@multimediatype": "JPEG image file",
            "@type": "IMAGE-HIGH-RES",
            "@size": "143798",
            "@ref": "ga1",
            "@mimetype": "image/jpeg"
          },
          {
            "@category": "standard",
            "@_fa": "true",
            "$": "https://api.elsevier.com/content/object/eid/1-s2.0-S0926860X2300042X-mmc1.docx?httpAccept=%2A%2F%2A",
            "@multimediatype": "Microsoft Word file",
            "@type": "APPLICATION",
            "@size": "2773663",
            "@ref": "mmc1",
            "@mimetype": "application/word"
          },
          {
            "@category": "thumbnail",
            "@_fa": "true",
            "$": "https://api.elsevier.com/content/object/eid/1-s2.0-S0926860X2300042X-si0001.svg?httpAccept=%2A%2F%2A",
            "@multimediatype": "Scalable Vector Graphics file",
            "@type": "ALTIMG",
            "@size": "1896",
            "@ref": "si0001",
            "@mimetype": "image/svg+xml"
          },
          {
            "@category": "thumbnail",
            "@_fa": "true",
            "$": "https://api.elsevier.com/content/object/eid/1-s2.0-S0926860X2300042X-si0002.svg?httpAccept=%2A%2F%2A",
            "@multimediatype": "Scalable Vector Graphics file",
            "@type": "ALTIMG",
            "@size": "2868",
            "@ref": "si0002",
            "@mimetype": "image/svg+xml"
          },
          {
            "@category": "thumbnail",
            "@_fa": "true",
            "$": "https://api.elsevier.com/content/object/eid/1-s2.0-S0926860X2300042X-si0003.svg?httpAccept=%2A%2F%2A",
            "@multimediatype": "Scalable Vector Graphics file",
            "@type": "ALTIMG",
            "@size": "2658",
            "@ref": "si0003",
            "@mimetype": "image/svg+xml"
          },
          {
            "@category": "standard",
            "@_fa": "true",
            "$": "https://api.elsevier.com/content/object/eid/1-s2.0-S0926860X2300042X-am.pdf?httpAccept=%2A%2F%2A",
            "@multimediatype": "Acrobat PDF file",
            "@type": "AAM-PDF",
            "@size": "3394868",
            "@ref": "am",
            "@mimetype": "application/pdf"
          }
        ]
      },
      "link": {
        "@rel": "abstract",
        "@href": "https://api.elsevier.com/content/abstract/scopus_id/85148082122"
      }
    }
  }
}