{
  "metadata": {
    "title": "Progress of advanced electrocatalysts towards electrochemical selectivity reduction CO<ce:inf loc=post>2</ce:inf> to formic acid",
    "authors": "; ; ",
    "journal": "Applied Catalysis A: General",
    "date": "2025-07-05",
    "doi": "10.1016/j.apcata.2025.120330",
    "abstract": "",
    "uri": "https://api.elsevier.com/content/article/pii/S0926860X25002315",
    "pii": "S0926860X25002315"
  },
  "fulltext": {
    "full-text-retrieval-response": {
      "scopus-eid": "2-s2.0-105004265009",
      "originalText": "serial JL 271346 291210 291744 291809 31 Applied Catalysis A: General APPLIEDCATALYSISAGENERAL 2025-05-04 2025-05-04 2025-05-08 2025-05-08 2025-05-15T16:52:39 1-s2.0-S0926860X25002315 S0926-860X(25)00231-5 S0926860X25002315 10.1016/j.apcata.2025.120330 S300 S300.1 FULL-TEXT 1-s2.0-S0926860X25X00090 2025-05-15T15:57:20.157843Z 0 0 20250705 2025 2025-05-04T15:18:58.570271Z absattachment articleinfo articlenumber articletitlenorm authfirstinitialnorm authfirstsurnamenorm cid cids contenttype copyright crossmark dateloaded dateloadedtxt datesearch datesort dateupdated dco docsubtype doctype doi eid ewtransactionid hubeid indexeddate issn issnnorm itemstage itemtransactionid itemweight openaccess openarchive pg pgfirst pii piinorm pubdatestart pubdatetxt pubyr sortorder srctitle srctitlenorm srctype ssids alllist content subj subheadings suppl tomb volfirst volissue volumelist webpdf webpdfpagecount yearnav figure body acknowledge affil articletitle auth authfirstini authfull authkeywords authlast grantnumber grantsponsor grantsponsorid highlightsabst orcid primabst ref specialabst 0926-860X 0926860X true 701 701 C Volume 701 15 120330 120330 120330 20250705 5 July 2025 2025-07-05 2025 article rev © 2025 Elsevier B.V. All rights are reserved, including those for text and data mining, AI training, and similar technologies. PROGRESSADVANCEDELECTROCATALYSTSTOWARDSELECTROCHEMICALSELECTIVITYREDUCTIONCO2FORMICACID LONG X 1 Introduction 2 Reaction mechanism 3 CO2RR electrocatalysts 3.1 Metals and metal oxides 3.2 Metal-organic frameworks 3.3 Covalent organic frameworks 3.4 Carbon-based materials 4 Electrochemical energy technologies 4.1 Formic acid fuel cells 4.2 Water splitting 5 Perspectives and outlook CRediT authorship contribution statement Acknowledgments References CHU 2012 294 303 S ZHANG 2020 115627 Z LIU 2024 104454 M LIU 2024 134933 M WEI 2025 240022 X JIN 2021 20627 20648 S ZHANG 2017 11326 11353 L XIA 2024 20530 20538 C CUI 2024 11857 11864 X MARGARIT 2019 72 78 C WANG 2020 2531 Y GONGLACH 2019 3864 S GUAN 2020 1044 1053 A DINH 2018 2835 2840 C ZHENG 2022 1148 1159 R DENG 2022 803 W LIU 2024 2403547 Y KIM 2020 114711 D YANG 2020 060901 Z DENG 2023 7242 7251 Y YOO 2015 358 363 J SHEN 2023 123140 H FEASTER 2017 4822 4827 J JALID 2021 117284 F WU 2024 110151 X WIJAYA 2022 137311 D XIAO 2023 2310195 L GONG 2024 e202318735 Y CHEN 2012 19969 19972 Y WANG 2024 6295 6321 Z LI 2024 5031 5039 W KOH 2017 5071 5077 J CHEN 2022 2201633 J AN 2019 42114 42122 X JIANG 2023 T ZHENG 2023 6591 6602 M YANG 2023 796 806 S ZHAO 2024 150280 R CHEN 2023 2512 Z NANKYA 2024 94 109 R SUN 2017 560 587 Z LI 2022 262 291 X LI 2023 e202313522 Y DENG 2019 743 750 P HAN 2019 1902338 N YANG 2023 4343 4380 P DELCASTILLO 2014 3557 3564 A WEEKES 2018 910 918 D GLOCKLER 1958 1049 1054 G QIAN 2021 156 W XIAO 2024 109155 L FENG 2024 e19 Y FU 2024 10726 10736 Q FU 2024 119045 Q BUI 2023 2205814 T LI 2023 2301597 P WEN 2018 1802427 G ZHU 2020 3361 3392 Y ZHENG 2019 7646 7659 Y LUC 2017 1885 1893 W REN 2022 2486 B WANG 2023 e202211174 T ZHENG 2017 794 805 X ZU 2019 1808135 X SHEN 2023 2843 H FENG 2022 2146 X MA 2024 e202412785 F XIANG 2020 115560 W LU 2024 2403767 Y HUANG 2020 6579 6586 H LIANG 2018 9604 9633 Z YANG 2013 1740 1748 X YUAN 2021 21685 21690 S YING 2021 3402 3412 Y GOMEZOLIVEIRA 2022 e202209335 E CHEN 2025 1927 X WANG 2022 2201642 L LU 2020 1906548 C ZHANG 2022 134503 H PRG 1963 3533 3539 JIANG 2023 e202311223 Z MUKHOPADHYAY 2024 3397 S GAO 2023 6860 6866 Z RUBIOGIMENEZ 2018 1704291 V WANG 2021 12 16 N GUAN 2020 1357 1384 X ZHAO 2019 6623 6630 X TU 2018 1707582 W CUI 2020 104525 X WANG 2020 115029 F NIU 2023 45 82 Q CHEN 2024 7880 7899 L WANG 2024 7013 7019 H CHEN 2024 e202411591 S PAKHIRA 2019 8785 8796 S SINHA 2021 720 732 N HAYAT 2024 100771 A GAO 2013 1882 F JIA 2016 9532 9538 Y ALI 2022 107451 S MIAO 2022 138427 Q LIU 2023 3800 M NANKYA 2024 e202403671 R CHEN 2021 2101128 X WANG 2011 42 55 Q HAO 2011 11378 11388 G SEVILLA 2011 2781 2787 M SCHNEIDER 2012 2036 2051 J WANG 2022 e202200552 Z PAN 2020 104384 F ZHANG 2018 3521 3529 H BI 2023 e202307612 J LI 2022 277 287 W LV 2023 e202303117 L LU 2021 5671 5678 P WANG 2020 12217 12314 Y AN 2016 127 139 L EPPINGER 2016 188 195 J MA 2020 803 815 Z JIA 2023 14101 14111 B YANG 2020 1088 F XU 2023 2300926 C XUE 2024 5998 J WANG 2024 2403664 T HU 2023 15109 15117 X WANG 2021 794 X YU 2024 1711 X REJAL 2014 10267 10274 S TUFA 2020 115557 R WASZCZUK 2002 599 603 P SUO 2009 210 217 Y ZHOU 2008 3789 3793 W ABRAHAM 2016 656 661 B ZHANG 2020 2003933 L FERNANDEZCASO 2023 1992 2024 K LU 2014 38 47 Q GANJI 2020 2000096 P FAN 2020 3633 L QIAO 2014 631 675 J SHEN 2023 121305 Y WEI 2024 e202402070 Z MONTEIRO 2021 1589 1602 M YE 2023 2040 F XI 2024 123291 W LIU 2023 5305 5314 S LONGX2025X120330 LONGX2025X120330XX 2027-05-08T00:00:00.000Z 2027-05-08T00:00:00.000Z http://creativecommons.org/licenses/by-nc-nd/4.0/ © 2025 Elsevier B.V. All rights are reserved, including those for text and data mining, AI training, and similar technologies. 2025-05-09T02:28:22.550Z http://vtw.elsevier.com/data/voc/AddOnTypes/50.7/aggregated-refined Ministry of Education 2024JYBKF06 MOE Ministry of Education of the People's Republic of China http://data.elsevier.com/vocabulary/SciValFunders/501100002338 http://sws.geonames.org/1814991/ Hubei Key Laboratory for Processing and Application of Catalytic Materials 202440704 http://sws.geonames.org/1814991 Hubei University HUBU Hubei University http://data.elsevier.com/vocabulary/SciValFunders/501100017589 http://sws.geonames.org/1814991/ http://sws.geonames.org/1814991 Graduate Education Innovation Fund of Wuhan Institute of Technology KLSAOFM2306 http://sws.geonames.org/1814991 CX2024335 http://sws.geonames.org/1814991 We acknowledge the financial support of the Key Laboratory of Material Chemistry for Energy Conversion and Storage (HUST), Ministry of Education (2024JYBKF06) and Hubei Key Laboratory for Processing and Application of Catalytic Materials (202440704). The work was also supported by open project funding of the Ministry of Education Key Laboratory for the Synthesis and Application of Organic Functional Molecules (KLSAOFM2306), Hubei University, Wuhan, P.R. China. We also acknowledge the financial support of the Graduate Education Innovation Fund of Wuhan Institute of Technology (CX2024335). https://doi.org/10.15223/policy-017 https://doi.org/10.15223/policy-037 https://doi.org/10.15223/policy-012 https://doi.org/10.15223/policy-029 https://doi.org/10.15223/policy-004 item S0926-860X(25)00231-5 S0926860X25002315 1-s2.0-S0926860X25002315 10.1016/j.apcata.2025.120330 271346 2025-05-15T15:57:20.157843Z 2025-07-05 1-s2.0-S0926860X25002315-main.pdf https://s3-eu-west-1.amazonaws.com/prod-ucs-content-store-eu-west/content/pii:S0926860X25002315/MAIN/application/pdf/86ef406487dcd88fd7574cde7f1c30f7/main.pdf main.pdf pdf true 12920852 MAIN 15 1-s2.0-S0926860X25002315-main_1.png https://s3-eu-west-1.amazonaws.com/prod-ucs-content-store-eu-west/content/pii:S0926860X25002315/PREVIEW/image/png/595ec911cf25880b73b49605ff48686b/main_1.png main_1.png png 59404 928 656 IMAGE-WEB-PDF 1 1-s2.0-S0926860X25002315-gr2.jpg https://s3-eu-west-1.amazonaws.com/prod-ucs-content-store-eu-west/content/pii:S0926860X25002315/gr2/DOWNSAMPLED/image/jpeg/79b64aac5e5866229610caca22fc8f60/gr2.jpg gr2 gr2.jpg jpg 119321 751 565 IMAGE-DOWNSAMPLED 1-s2.0-S0926860X25002315-gr7.jpg https://s3-eu-west-1.amazonaws.com/prod-ucs-content-store-eu-west/content/pii:S0926860X25002315/gr7/DOWNSAMPLED/image/jpeg/c26ab5e42d6e3e1545ab3cf96f603d06/gr7.jpg gr7 gr7.jpg jpg 119510 779 565 IMAGE-DOWNSAMPLED 1-s2.0-S0926860X25002315-ga1.jpg https://s3-eu-west-1.amazonaws.com/prod-ucs-content-store-eu-west/content/pii:S0926860X25002315/ga1/DOWNSAMPLED/image/jpeg/421ed2a6bacd25daf973ec93a0d9b934/ga1.jpg ga1 true ga1.jpg jpg 21967 245 245 IMAGE-DOWNSAMPLED 1-s2.0-S0926860X25002315-gr1.jpg https://s3-eu-west-1.amazonaws.com/prod-ucs-content-store-eu-west/content/pii:S0926860X25002315/gr1/DOWNSAMPLED/image/jpeg/38ddcd179ce0b2de1f3224e4fa0fc25c/gr1.jpg gr1 gr1.jpg jpg 83048 529 565 IMAGE-DOWNSAMPLED 1-s2.0-S0926860X25002315-gr4.jpg https://s3-eu-west-1.amazonaws.com/prod-ucs-content-store-eu-west/content/pii:S0926860X25002315/gr4/DOWNSAMPLED/image/jpeg/bf34bf10919d31c7693eab553a084367/gr4.jpg gr4 gr4.jpg jpg 146310 718 678 IMAGE-DOWNSAMPLED 1-s2.0-S0926860X25002315-gr3.jpg https://s3-eu-west-1.amazonaws.com/prod-ucs-content-store-eu-west/content/pii:S0926860X25002315/gr3/DOWNSAMPLED/image/jpeg/d6c62a863b749c8ebf7d168bdaf4e073/gr3.jpg gr3 gr3.jpg jpg 98068 568 565 IMAGE-DOWNSAMPLED 1-s2.0-S0926860X25002315-gr6.jpg https://s3-eu-west-1.amazonaws.com/prod-ucs-content-store-eu-west/content/pii:S0926860X25002315/gr6/DOWNSAMPLED/image/jpeg/b8b1f4ab68c46f5552dc478535a77f55/gr6.jpg gr6 gr6.jpg jpg 129168 693 678 IMAGE-DOWNSAMPLED 1-s2.0-S0926860X25002315-gr5.jpg https://s3-eu-west-1.amazonaws.com/prod-ucs-content-store-eu-west/content/pii:S0926860X25002315/gr5/DOWNSAMPLED/image/jpeg/bdb1511a73e16b9c83e480cbb45175e1/gr5.jpg gr5 gr5.jpg jpg 162125 696 678 IMAGE-DOWNSAMPLED 1-s2.0-S0926860X25002315-gr8.jpg https://s3-eu-west-1.amazonaws.com/prod-ucs-content-store-eu-west/content/pii:S0926860X25002315/gr8/DOWNSAMPLED/image/jpeg/a34b05bd35057b1664e1b64962533db2/gr8.jpg gr8 gr8.jpg jpg 84982 644 565 IMAGE-DOWNSAMPLED 1-s2.0-S0926860X25002315-gr2.sml https://s3-eu-west-1.amazonaws.com/prod-ucs-content-store-eu-west/content/pii:S0926860X25002315/gr2/THUMBNAIL/image/gif/6861cf8226749805cf9acd64de453478/gr2.sml gr2 gr2.sml sml 10887 163 123 IMAGE-THUMBNAIL 1-s2.0-S0926860X25002315-gr7.sml https://s3-eu-west-1.amazonaws.com/prod-ucs-content-store-eu-west/content/pii:S0926860X25002315/gr7/THUMBNAIL/image/gif/0bdb73a07acecd9cb7eb9052fc9d5d36/gr7.sml gr7 gr7.sml sml 10534 164 119 IMAGE-THUMBNAIL 1-s2.0-S0926860X25002315-ga1.sml https://s3-eu-west-1.amazonaws.com/prod-ucs-content-store-eu-west/content/pii:S0926860X25002315/ga1/THUMBNAIL/image/gif/562edfed0e1a225e5b3830ed1da7d8c7/ga1.sml ga1 true ga1.sml sml 13666 164 164 IMAGE-THUMBNAIL 1-s2.0-S0926860X25002315-gr1.sml https://s3-eu-west-1.amazonaws.com/prod-ucs-content-store-eu-west/content/pii:S0926860X25002315/gr1/THUMBNAIL/image/gif/6898465d7d60c4a5c950e48c5f67d3bc/gr1.sml gr1 gr1.sml sml 13673 164 175 IMAGE-THUMBNAIL 1-s2.0-S0926860X25002315-gr4.sml https://s3-eu-west-1.amazonaws.com/prod-ucs-content-store-eu-west/content/pii:S0926860X25002315/gr4/THUMBNAIL/image/gif/f39c300d4076dbe6e5e4acd936084144/gr4.sml gr4 gr4.sml sml 13888 164 155 IMAGE-THUMBNAIL 1-s2.0-S0926860X25002315-gr3.sml https://s3-eu-west-1.amazonaws.com/prod-ucs-content-store-eu-west/content/pii:S0926860X25002315/gr3/THUMBNAIL/image/gif/ce1de54d474cbc7ab8f1c630d92620ca/gr3.sml gr3 gr3.sml sml 14200 164 163 IMAGE-THUMBNAIL 1-s2.0-S0926860X25002315-gr6.sml https://s3-eu-west-1.amazonaws.com/prod-ucs-content-store-eu-west/content/pii:S0926860X25002315/gr6/THUMBNAIL/image/gif/3b40caca7d2d66057e0d3aa78680c29b/gr6.sml gr6 gr6.sml sml 13379 164 160 IMAGE-THUMBNAIL 1-s2.0-S0926860X25002315-gr5.sml https://s3-eu-west-1.amazonaws.com/prod-ucs-content-store-eu-west/content/pii:S0926860X2500225X/gr5/THUMBNAIL/image/gif/82cb260251c9ab0cd047ba23c3355601/gr5.sml gr5 gr5.sml sml 15701 163 159 IMAGE-THUMBNAIL 1-s2.0-S0926860X25002315-gr8.sml https://s3-eu-west-1.amazonaws.com/prod-ucs-content-store-eu-west/content/pii:S0926860X2500225X/gr8/THUMBNAIL/image/gif/39b2505cc558f45228422eb6504e6f6e/gr8.sml gr8 gr8.sml sml 10248 164 144 IMAGE-THUMBNAIL 1-s2.0-S0926860X25002315-gr2_lrg.jpg https://s3-eu-west-1.amazonaws.com/prod-ucs-content-store-eu-west/content/pii:S0926860X25002315/HIGHRES/image/jpeg/67dbd55687a1ca3c61ace137e37dff05/gr2_lrg.jpg gr2 gr2_lrg.jpg jpg 537785 3316 2495 IMAGE-HIGH-RES 1-s2.0-S0926860X25002315-gr7_lrg.jpg https://s3-eu-west-1.amazonaws.com/prod-ucs-content-store-eu-west/content/pii:S0926860X25002315/HIGHRES/image/jpeg/b42a334491f28b8cb41d77a4530cd4ef/gr7_lrg.jpg gr7 gr7_lrg.jpg jpg 567375 3443 2496 IMAGE-HIGH-RES 1-s2.0-S0926860X25002315-ga1_lrg.jpg https://s3-eu-west-1.amazonaws.com/prod-ucs-content-store-eu-west/content/pii:S0926860X25002315/HIGHRES/image/jpeg/b146e98cc3299ab3f3d480a4b85aac05/ga1_lrg.jpg ga1 true ga1_lrg.jpg jpg 172478 1085 1085 IMAGE-HIGH-RES 1-s2.0-S0926860X25002315-gr1_lrg.jpg https://s3-eu-west-1.amazonaws.com/prod-ucs-content-store-eu-west/content/pii:S0926860X25002315/HIGHRES/image/jpeg/9d137dd4ef47518c5dbdff93f04248e9/gr1_lrg.jpg gr1 gr1_lrg.jpg jpg 377062 2339 2497 IMAGE-HIGH-RES 1-s2.0-S0926860X25002315-gr4_lrg.jpg https://s3-eu-west-1.amazonaws.com/prod-ucs-content-store-eu-west/content/pii:S0926860X25002315/HIGHRES/image/jpeg/a39ef30a7e775a05be1d7b0cf8971015/gr4_lrg.jpg gr4 gr4_lrg.jpg jpg 697937 3170 2994 IMAGE-HIGH-RES 1-s2.0-S0926860X25002315-gr3_lrg.jpg https://s3-eu-west-1.amazonaws.com/prod-ucs-content-store-eu-west/content/pii:S0926860X25002315/HIGHRES/image/jpeg/8f58253741e877019bbfc3e729896834/gr3_lrg.jpg gr3 gr3_lrg.jpg jpg 487865 2510 2497 IMAGE-HIGH-RES 1-s2.0-S0926860X25002315-gr6_lrg.jpg https://s3-eu-west-1.amazonaws.com/prod-ucs-content-store-eu-west/content/pii:S0926860X2500225X/HIGHRES/image/jpeg/6ab12f694ddfdcb2b8a3e6a34c422436/gr6_lrg.jpg gr6 gr6_lrg.jpg jpg 593772 3060 2994 IMAGE-HIGH-RES 1-s2.0-S0926860X25002315-gr5_lrg.jpg https://s3-eu-west-1.amazonaws.com/prod-ucs-content-store-eu-west/content/pii:S0926860X2500225X/HIGHRES/image/jpeg/d9bd2694ef29e6af3e7b81cd1573efd2/gr5_lrg.jpg gr5 gr5_lrg.jpg jpg 802317 3075 2994 IMAGE-HIGH-RES 1-s2.0-S0926860X25002315-gr8_lrg.jpg https://s3-eu-west-1.amazonaws.com/prod-ucs-content-store-eu-west/content/pii:S0926860X2500225X/HIGHRES/image/jpeg/bb28abf5a80aa7dcd6e149613648d909/gr8_lrg.jpg gr8 gr8_lrg.jpg jpg 369971 2845 2496 IMAGE-HIGH-RES APCATA 120330 120330 S0926-860X(25)00231-5 10.1016/j.apcata.2025.120330 Elsevier B.V. Fig. 1 (a) Mechanism of CO2RR to HCOOH; (b) In-situ Raman spectra for CO2RR intermediate monitoring[43]; (c) Standard redox potentials of electrochemical CO2RR to different products as well as HER and OER as a function of the solution pH[45]; (d) Calculated Gibbs free energy diagrams for CO2RR to HCOOH[20]; (e) Volcano plot using *OCHO binding energy as a descriptor for HCOOH partial current density[23]. Fig. 1 Fig. 2 (a) Characteristics of P-block metals for CO2RR to HCOOH[56] and (b) ionization energy of P-block metals; (c) Projected density of states of O, Sn, and Bi atoms on Bi-SnO(001) surfaces with the adsorbed *OOCH[34]; (d) Projected density of states of different samples, (e) volume slices of calculated charge densities and corresponding optimized configurations for the three models with HCOO adsorbate[61]. Fig. 2 Fig. 3 (a) Crystal structure schematic of different samples during CO2RR, (b) FE value of CO2RR products for higher content of S-doping in Sn[65]; (c) FE of CO2RR, (d) scanning electron microscope (SEM) images and the corresponding mappings of Sn3O(OH)2Cl2, (e) in-situ attenuated total reflectance surface-enhanced infrared absorption spectroscopy spectra of Sn3O(OH)2Cl2 [62]. Fig. 3 Fig. 4 (a) Three-dimensional PZH-1 and coordination environment of Bi centers in PZH-1, (b) free energy diagrams for HCOOH formation on the different system, (c) isosurfaces of charge transfer of different centers[81]; (d) Illustration of increased local CO2 concentration at the vicinity of the Bi electrocatalyst surface, (e) nitrile modified Zr6-oxo node[82]; (f) The general process for the synthesis of Bi-HHTP, (g) electron paramagnetic resonance spectroscopy spectrum, (h) ultraviolet-visible spectroscopy spectra, (i) the FEs and current density of formate[83]. Fig. 4 Fig. 5 (a) Topologies in three dimensions COFs[86]; (b) The CO2-temperature programmed desorption curves of different catalysts, (c) the energy gap the different samples[102]; (d) The schematic diagram of the synthesis process of different samples, (e) calculated band structure of N-COF and Co-N-COF respectively[100]. Fig. 5 Fig. 6 (a) Schematic preparation of In2O3 and In2O3@C, (b) O 1 s XPS spectra, (c) In 3d XPS spectra, SEM images of In2O3@C (d) before and (e) after CO2RR test[109]; (f) Projected density of states of In 4d orbits, (g) the Gibbs free energy diagrams for CO2 to HCOOH on In-based catalysts, (h) product distributions of the CO2RR[112]; (i) Schematic illustration for the synthesis of In-N-C[115]. Fig. 6 Fig. 7 (a) Configuration of direct formate fuel cells (left) and performance curves of single cell with different anode electrocatalysts (right)[124]; (b) FE for HCOO− or HCOOH versus current density[135]; (c) Schematic illustration of the CO2RR to produce HCOOH in MEA, (d) FE at different current densities and the corresponding partial current densities of HCOOH, (e) power density plot and discharge curve at a current density of 50 mA cm−2, (f) long-term stability test and the corresponding FEs of HCOOH[123]. Fig. 7 Fig. 8 (a) Formation rate of HCOO− and kinetic isotope effect in CO2RR[141]; (b) CO2RR coupling system, (c) linear sweep voltammetry curves of InOOH-OV in the electrolyte with and without HMF[143]; (d) Linear sweep voltammetry curves for CO2RR-HMFOR and CO2RR-OER systems, (e) current density and FEformate as a function of cell voltage for the different system[145]. Fig. 8 Progress of advanced electrocatalysts towards electrochemical selectivity reduction CO2 to formic acid Xiaofeng Long Writing – review & editing Writing – original draft Formal analysis Conceptualization a Yujie Peng Visualization a Ze Yu Visualization a Yuhong Zhang Supervision Project administration b Xueliang Jiang Supervision Project administration a b ⁎ Huan Yang Writing – review & editing Supervision Resources Project administration a c ⁎ a Hubei Key Laboratory of Plasma Chemistry and Advanced Materials, School of Materials Science and Engineering, Key Laboratory of Green Chemical Engineering Process of Ministry of Education, Wuhan Institute of Technology, No. 206 Guanggu 1st Road, Wuhan 430205, China Hubei Key Laboratory of Plasma Chemistry and Advanced Materials, School of Materials Science and Engineering, Key Laboratory of Green Chemical Engineering Process of Ministry of Education, Wuhan Institute of Technology No. 206 Guanggu 1st Road Wuhan 430205 China Hubei Key Laboratory of Plasma Chemistry and Advanced Materials, School of Materials Science and Engineering, Key Laboratory of Green Chemical Engineering Process of Ministry of Education, Wuhan Institute of Technology, No. 206 Guanggu 1st Road, Wuhan 430205, China b Ministry of Education Key Laboratory for the Synthesis and Application of Organic Functional Molecules, College of Chemistry and Chemical Engineering, Hubei University, Wuhan 430062, China Ministry of Education Key Laboratory for the Synthesis and Application of Organic Functional Molecules, College of Chemistry and Chemical Engineering, Hubei University Wuhan 430062 China Ministry of Education Key Laboratory for the Synthesis and Application of Organic Functional Molecules, College of Chemistry and Chemical Engineering, Hubei University, Wuhan 430062, China c Hubei Key Laboratory of Processing and Application of Catalytic Materials, Huanggang Normal University, China Hubei Key Laboratory of Processing and Application of Catalytic Materials, Huanggang Normal University China Hubei Key Laboratory of Processing and Application of Catalytic Materials, Huanggang Normal University ⁎ Corresponding authors at: Hubei Key Laboratory of Plasma Chemistry and Advanced Materials, School of Materials Science and Engineering, Key Laboratory of Green Chemical Engineering Process of Ministry of Education, Wuhan Institute of Technology, No. 206 Guanggu 1st Road, Wuhan 430205, China. Hubei Key Laboratory of Plasma Chemistry and Advanced Materials, School of Materials Science and Engineering, Key Laboratory of Green Chemical Engineering Process of Ministry of Education, Wuhan Institute of Technology No. 206 Guanggu 1st Road Wuhan 430205 China Electrocatalytic reaction can convert carbon dioxide (CO2) into formic acid (HCOOH), which is considered as a promising pathway for sustainable energy conversion and valuable chemicals production. Nevertheless, CO2 reduction reaction (CO2RR) to HCOOH exists high reaction potential, insufficient active site and low product selectivity. In this review, various catalysts, including metal and metal oxides, metal-organic frameworks, covalent organic frameworks and carbon-based materials, are summarized from the structure-activity relationship between electrocatalysts and CO2RR performance. Then, the regulation strategies of morphology control, defect engineering, and interface engineering, to improve the selectivity and stability of CO2RR have been successively analyzed. In addition, the practical application of CO2RR to HCOOH in electrochemical energy technologies (formic acid fuel cells and water splitting) are comprehensively discussed. Finally, the perspectives and outlook of advanced catalysts for electrochemical selectivity reduction CO2 to HCOOH are thoroughly addressed. This review will be helpful to provide new insights for designing high selective and stable CO2RR to HCOOH electrocatalysts. Graphical Abstract Keywords Carbon dioxide reduction reaction Formic acid Electrocatalyst Selectivity and stability Energy technologies Data availability Data will be made available on request. 1 Introduction Recently, excessive consumption of fossil fuels has led to excessive emissions of CO2, causing serious environmental problems[1,2]. For example, global warming and greenhouse effect can induce ocean acidification, leading to an increase in extreme weather events[3–5]. These have adverse effects on human health and ecosystems. Electrocatalytic CO2 reduction can convert CO2 into useful chemicals and fuels. This reduces greenhouse gas emissions and recycles carbon resources. Therefore, there is an urgent need to explore various methods to convert CO2 into high-value fuels and chemicals[6]. Electrocatalytic reaction can convert CO2 into carbon monoxide (CO), formic acid (HCOOH), methanol (CH3OH), ethanol (C2H5OH), ethylene(C2H4), and methane(CH4), which is considered as a promising pathway for sustainable energy conversion and chemical products production[7–15]. Particularly, HCOOH as double-electron transfer product of carbon dioxide reduction reaction (CO2RR) is an ideal hydrogen carrier, more importantly, HCOOH can be used as raw materials for direct formic acid fuel cells and other chemical products[16–18]. Nevertheless, CO2RR to HCOOH exists high reaction potential, insufficient active site and low product selectivity, which needs advanced electrocatalyst to pave the slow kinetics process[19]. In general, an oxygen-bound intermediate of *OCHO to *HCOOH is the rate-determining step to produce formic acid, therefore, a much higher energy barrier for the formation of *OCHO intermediates can inhibit the HCOOH production[20]. In this regard, the selectivity and activity of HCOOH essentially depend on the relative bonding strength of the reaction intermediate on the catalyst active site[21]. In addition, catalyst with appropriate d-band centers and Fermi levels present moderate binds to the intermediates of *OCHO, which can effectively promote proto-electron transfer[22,23]. For instance, P-block metals (Such as Sn, In, Bi, Pb) have a unique electronic structure from ns2np1 to ns2np6, which possess variable valence states and high oxygen affinity, tending to activate CO2 by η(O) adsorption[19,24,25]. Thus, P-block metals and metal oxides has a higher adsorption capacity of OCHO* on the catalyst active site, which can stabilize the intermediate and selectively generate HCOOH. Typically, the organic ligand of metal-organic frameworks (MOFs) is connected to P-block metals, thus, MOFs has the merits of high porosity and large specific surface area, which is conducive to adsorption and mass transfer during the process of CO2RR to HCOOH[26]. Covalent organic frameworks (COFs) as another superior CO2RR electrocatalyst, present stable π-π conjugated structures, which can form many kinds of topological network structure, promoting charge transfer and improving the CO2RR performance[27,28]. Significantly, carbon can act as protection layer to prevent mental oxide from being reduced to a metallic state during the CO2RR process[29–31]. Thus, carbon-based materials with high stability can improve the CO2 adsorption and diffusion kinetics. Recently, several strategies, such as crystal phase regulation[32,33], component modulation[34,35], defects regulation[36,37], and interface engineering[38–40], are widely applied to redistribute the electron structure, which have significant effect on the adsorption strength of the key intermediates, improving the activity and stability of CO2RR to HCOOH. In this review, the recent progress of electrochemical CO2RR to HCOOH are comprehensively summarized. The mechanism of CO2RR to HCOOH, including the energy barrier of intermediate formation, the adsorption of intermediate, and d-band centers, is thoroughly analyzed to illustrate the structure–activity–performance of CO2RR to HCOOH. Successively, the strategies of morphology control, defect engineering, and interface engineering are discussed to optimize the metal and metal oxides, MOFs, COFs and carbon-based catalysts. Then, the application of CO2RR technology as a semi-reaction for formic acid fuel cells and water splitting are discussed. Finally, the perspectives and outlook of advanced catalysts for electrochemical selectivity reduction CO2 to HCOOH in energy technologies are addressed. We hope this review will provide value insights for designing high selective and stable CO2RR to HCOOH electrocatalysts, which is helpful to convert waste carbon dioxide into valuable chemicals and fuels. 2 Reaction mechanism CO2RR as a complicated process involves the transfer of multiple electrons. This results in the formation of different products. These competitive reaction pathways lead to different product distributions[41,42]. Under certain conditions, hydrogen evolution reactions (HER) competes with each proto-coupled electron transfer step of CO2RR. This has a negative effect on the selectivity of CO2RR[36]. The most important step in CO2RR is the first electron transfer to surface-adsorbed *CO2, forming *CO2 · −. The next protonation step depends on the binding of *CO2 · − to the electrode surface[20]. The selectivity and activity of CO2RR are largely dependent on the relative binding strengths of the reactive intermediates (e.g., *OCHO, *COOH, *CO, and *H), the relative binding strength on the catalyst surface. A strong binding to ∗CO prevents ∗CO from being released or reduced, which makes H2 as the main product. On the other hand, a weaker bond with ∗CO allows for the release of ∗CO and the formation of CO. A moderately strong bond with ∗CO allows for reduction and reaction of ∗CO, which results in the formation of C2+ reduction products[21,22,43,44]. However, CO2RR to HCOOH is a double-proton and double-electron transfer progress, which can be represented by the following Eqs. (1–3). When CO2 molecules enter the electrolyte, it can form *CO2 on the catalyst surface, and activate to form CO2 · − radical anion. *CO2 undergoes a series of proton-electron transfer to form *CO2 −, and then oxygen atoms adsorb on the catalyst active site to produce *OCHO or HCOO* ( Fig. 1a-b)[43,44]. In general, the product of CO2RR to formic acid is pH-dependent: at pH < 3.7, the product exists as HCOOH, while at pH > 3.7, it exists as HCOO⁻ (Fig. 1c)[45]. Therefore, increasing the solution pH promotes the deprotonation of the product, reducing the thermodynamic standard equilibrium potential for formate formation[45]. It can also reduce the HER competition. Consequently, CO2RR to formate is more favorable in alkaline solutions. In addition, the adsorption configuration of CO2 has important effect on the formation energy barrier and the selection of intermediate. Generally, an oxygen-bound intermediate of *OCHO to *HCOOH is the rate-determining step to produce HCOOH (Fig. 1d)[20]. Therefore, a much higher energy barrier for the formed *OCHO intermediate can inhibit the HCOOH production. (1) CO2 + e− → *CO2 · − (2-1) *CO2 · − + H+ → *OCHO or (2-2) *CO2 · − + H+ → HCOO* (3) *OCHO + H+ +e−→ HCOOH According to the Sabatier principle, the selectivity and activity of formic acid essentially depend on the relative bonding strength of the reaction intermediate on the catalyst active site[21]. There is a clear volcanic trend between the *OCHO adsorption energy and current densities of CO2RR to HCOOH on different metals (Fig. 1e)[23]. Thus, changing the valence state can redistribute the electron structure, which have significant effect on the adsorption strength of the key intermediates[30]. For instance, metals with weak *OCHO binding energy (e.g., Au, Ag, Pt, Cu) have a weak affinity for oxygen and hydrogen atoms, in addition, these metals present high d-band centers, which can induce unstable adsorption of *OCHO and other side reactions, resulting in low HCOOH selectivity. On the contrary, catalysts with lower d-band centers (such as Zn and Ni) usually have strong adsorption energy with *OCHO intermediates, however, strong adsorption energy will inhibit the desorption of *OCHO on the catalyst. Thus, catalyst with appropriate d-band centers and Fermi levels present moderate binds to the intermediate of *OCHO, which can effectively promote proton-electron transfer[22,23]. When the d-band center of a metal atom moves away from the Fermi level, the average valence state of the metal increases. Moreover, the lower atomic coordination number on the catalyst surface, the higher overlap between the d-band center of the catalyst and the molecular orbital (e.g., 2π*) of the intermediate, will induce stronger intermediate adsorption on the catalyst[46]. For example, the lower atomic coordination number and stronger interaction with *OCHO can increase the adsorption strength of *OCHO on the catalyst surface. This strong adsorption can inhibit the *OCHO form HCOOH, thus affecting the activity and selectivity of the catalyst. 3 CO2RR electrocatalysts Generally, the low CO2 solubility limits the kinetics of CO2RR in the electrolyte[47,48]. In addition, the activation of stable CO2 molecule requires high overpotential[49]. Electrocatalytic CO2RR can drive this process by charge transfer between the electrode and the electrolyte[50]. Electrocatalyst as a key factor can affect the local migration, adsorption, activation, hydrogenation and product desorption, which is beneficial for improving the CO2RR performance[51]. Typically, metals and metal oxides, MOFs, COFs and carbon-based materials are widely developed to improve the performance of CO2RR to HCOOH. However, the process of identifying high-performance catalysts should attempt numerous metal elements, doping concentrations, and positions, which are costly and time-consuming. In recent years, the utilization of artificial intelligence methodologies, such as density flood theory and machine learning, have emerged as promising approaches to address this challenge. These methods facilitate the analysis of voluminous data sets, expediting the catalyst screening and design process[52–54]. Various strategies, including morphology control, defect engineering, and interface engineering, have been introduced to modulate the electronic structures of catalyst, improving the selectivity and stability of CO2RR[55]. 3.1 Metals and metal oxides P-block metals (e.g., Sn, In, Bi, Pb) are a class of post-transition metals (ns2np1 to ns2np6) in which the outermost p-subshell is occupied by the final valence electron, resulting in unique properties such as high electronegativity and low ionization energy. Consequently, P-block metals exhibit a broad spectrum of variable oxidation states, the induced high degree of versatility is beneficial for the formation of P-block compounds with diverse valences ( Fig. 2a). These metals exhibit superior performance to high selectively produce HCOOH by CO2RR (Fig. 2b)[56,57]. More importantly, P-block metals possess variable valence states and high oxygen affinity, tending to activate CO2 by η(O) adsorption[19,25]. Therefore, it has a higher adsorption capacity of OCHO* than COOH* on the catalyst active site, which can stabilize the intermediate and selectively generate HCOOH. Thus, *OCHO plays a pivotal role as an intermediate in the reduction of CO2RR to HCOOH. In general, pure metal exposed to air is easily oxidized to metal oxide, the oxide layer on the metal surface can form a chemical bond with the CO2 molecule, which present more favorable catalytic activity and selectivity compared with the corresponded metal catalysts[19]. Nevertheless, metal oxides have the low electrical conductivity and limited surface catalytic active sites[58]. Sn has a high electronegativity and low ionization energy, which is beneficial for forming strong chemical bonds with oxygen atoms. As articulated by Sabatier's principle, the adsorption energy of the catalyst on the intermediate must be moderate to ensure successful desorption and generation of the desired product. Insufficient or excessive adsorption capacity has negative impact on the selectivity of the reaction[23,59]. Therefore, Sn located near the top of the volcano map has a near-optimal *OCHO adsorption energy[23]. Thus, the introduced metal heteroatoms (such as Cu, Bi, Ag or Pd) into Sn can induce electron transfer and form high-valence Sn (p- and d-band shift up of Sn), which is conducive to the adsorption and stability of *OCHO or HCOO* intermediates in CO2RR. For instance, a bimetallic Ag-SnOx core-shell catalyst was construct by seed growth and galvanic displacement method[60]. The formed SnOx core-shell makes the surface difference between Sn and Ag, resulting in the spontaneous accumulation of Sn on the surface. Therefore, the surface energy of the nanoparticles is minimized. Doping Ag optimizes the conductivity of the catalyst and improves the Faraday efficiency (FE) of formic acid to 80 %[60]. Different from Ag, Bi atom can stabilize the oxidation state of Sn and prevent the reduction of SnO to Sn0 in the CO2RR process. Bi doped SnO can make Bi 6 s form a hybrid region with O 2 s and 2p orbitals, resulting in the increased valence state of Sn (Fig. 2c)[34]. Additionally, doping Bi into Sn-based catalysts can cause the outermost valence p and d orbital of Sn move away from the Fermi level, which is beneficial for the electron transform from the O to the p and d orbitals of the Sn (Fig. 2d)[57,61]. For instance, the prepared Sn-Bi bimetallic nanofolds remain above 90 % FE and the local current density is up to 140 mA cm−2 for 160 h [61]. A machine learning-assisted density functional theory approach was employed to calculate the volume slices of the charge density and the corresponding optimized configurations of the HCOO adsorbate model. At the interface of Sn-Bi, the adsorption of Sn-O is stronger than that of Sn-C, thus producing HCOOH with high selectivity (Fig. 2e)[55,61]. Compared with metal heteroatoms, non-metallic heteroatoms (such as H, S, N and halogens) are much more electronegative, which can be adopted to regulate the electronic structure of metal catalysts[62–64]. Doping S can make Sn charge shift positively, which can induce the active site incline to bind with electron-rich oxygen-containing groups. For example, tin sulfide (π-SnS) nanocrystals were synthesized by a hydrothermal method, a strong bonding strength existed between Sn-S can make S stable in Sn ( Fig. 3a)[65]. Under acidic conditions, the increased peak area of higher content of S-doping in Sn can improve the *OCHO coverage, which enhances the FE of HCOOH to 92.15 % at the industrial current density of −1 A cm−2 (Fig. 3b). Compared with N and S, halogens have higher electronegativity. Doping halogens can cause the d-band center of Sn shift upward, which can induce the accumulation of electrons near halogens and the more positive valence state of Sn, thus promoting the selectivity of CO2RR to HCOOH[62,66,67]. For example, the synthesized Sn3O(OH)2Cl2 catalyst possesses high concentration of Cl located at the stacked nanoplates, and the FE of HCOOH can reach 96.1 % at −0.9 V vs RHE (Fig. 3c-d)[62]. The Sn3O(OH)2Cl2 catalyst contains Sn-Cl and Sn-O bonds. Sn-O moves toward lower energy and Sn is in a lower valence state, this obvious electron transfer from Sn to Cl reduces the binding energy of *OCHO, improving the selectivity of CO2RR to HCOOH (Fig. 3e). 3.2 Metal-organic frameworks MOFs has the merits of high porosity and large specific surface area, which is conducive to adsorption and mass transfer[26,68]. A new approach uses a combination of MOFs and single-atom catalysts (SACs)[69]. More importantly, the porous structure of MOFs exposes more active sites and enriches reaction intermediates[25]. In general, the active site of CO2RR to HCOOH is located at the center of MOFs, and the organic ligand is connected to P-block metals. However, its high surface energy is easy to aggregate during the synthesis and CO2RR process, which reduces the CO2RR performance[25,70–72]. Low-Dimensional MOFs (LD MOFs) have more functionalized open sites, ultrathin structures, and tunable compositions. They are considered as the ideal precursors for the preparation of SACs. LD MOFs include one-dimensional (1D) structures, such as nanorods, nanotubes, and nanowires, and two-dimensional (2D) structures, such as nanosheets, nanoplates, and nanosheets[69,73]. Bi-MOFs have clear coordination environment, exposed active sites and controllable structure, it is beneficial for increasing the contact area between the reactant molecules and catalyst, reducing the aggregation or deactivation of the active site[25]. For example, Bi nanoparticles with different particle sizes (400 ℃, Bi particle size < 10 nm) were obtained by ultrasonic assisted calcination method[74]. Bi-MOFs are easy to be functionalized and to introduce structural defects in the synthesis process, which can increase the exposure of active sites [75]. MOFs combined with the single atomic electrocatalyst is another effective strategy to optimize the CO2RR performance. Through rapid thermal shock treatment, the structure of Bi-MOF can be significantly altered to form a 2D nanosheet structure (Bi-MOF-TS). These nanosheet structures resemble the morphology of two-dimensional materials, with a larger specific surface area and more exposure to active sites[76]. However, 2D MOFs are relatively unstable, especially in electrochemical reactions, where the reactivity of the ligand may lead to structural instability[77–79]. Three-dimensional (3D) MOFs usually have higher structural stability and can maintain their structural integrity under a wider range of conditions. Bi(III) ions tend to form stable complexes with ligands by multiple O and N coordination sites, which is beneficial for Bi(III) building metal-organic frame structures with these ligands[75,80]. For example, bismuth-based Zeolitic metal–organic framework (Bi-ZMOF, denote PZH-1) with topological crystal structure was prepared by ligand-oriented strategy. A strong coordination bond formed between Bi with pyrazole-N atom can facilitate the charge transfer from N atoms to Bi atoms ( Fig. 4a)[81]. The lone pair electrons of the ligand will be transferred to the metal center, which can reduce the overpotential of the formed intermediate and stabilize the intermediate, obtaining 91 % FE of the produced formic acid (Fig. 4b-c). In addition, a metal node can be connected to an organic ligand by metal coordination bond, forming a 3D porous MOFs structure. For instance, a nitrile-modified UiO-66 MOF film (UiO-66-CN) was prepared on bismuth foil (Fig. 4d-e), and the FE of HCOOH can up to 93 % (at −0.75 V vs RHE)[82]. Nitrile, located at the missing connection point of UiO-66, can form a stable interaction with CO2 molecules at the Bi and UiO-66-CN interfaces, which is helpful to capture and activate CO2 molecules in the pores, stabilizing *OCHO intermediates through secondary spheroidal interactions. A conductive-based framework with Bi-enriched sites can solve the disadvantages of low conductivity and saturated coordination of Bi-MOFs. In this regard, a conductive catecholate-based framework (2,3,6,7,10,11-hexahydroxytriphenylene, HHTP) with Bi-enriched sites (noted Bi-HHTP) was constructed by solvothermal method (Fig. 4f)[83]. The FE of HCOOH exceeds 95 % (−0.7 V vs. RHE), and its catalytic energy efficiency is 68.8 % (Fig. 4i). This can be ascribed to the coordination of Bi3+ with catechol groups formed an unsaturated coordination environment. The ligand-to-metal charge transfer between π-π* and Bi3+ ions and HHTP indicates that Bi-HHTP has strong selectivity for HCOOH formation (Fig. 4g-h)[84,85]. Therefore, the rich unsaturated coordination and high porosity of organometallic framework can be contributed to high FE of CO2RR. 3.3 Covalent organic frameworks COFs with stable π-π conjugated structures can form many kinds topological network structure ( Fig. 5a)[86], which can promote charge transfer and greatly improve the CO2RR performance[27,28] Nevertheless, compared with conventional metal-based electrocatalysts, the primitive COFs present limited exposed active site and low conductivity. In this regard, a template (such as polystyrene spheres) assisted strategy was used to introduce macropores and the inherent microporosity of COFs[87]. In addition, ions (e.g., Cu2+, Zn2+, Fe atom) have been utilized to adjust the electronic properties of COFs and regulate the Fermi level[88–91]. The presence of dopant ions (e.g., Cu2+, Zn2+, Fe3+) within the conjugated system of COFs can result in a charge transfer phenomenon[92]. The doping of ions, such as Cu2+ or Zn2+, has been observed to cause an upward shift in the Fermi level of COFs. This shift is attributed to the increased electron density within the COFs, leading to a higher energy position of the Fermi levels. This upshifted Fermi level has been shown to enhance the adsorption of CO₂ by the COFs, thereby boosting their catalytic activity. For instance, the introduction of typical ions (e.g., Fe3+) can result in a downward shift of the Fermi level of COFs. This downshifted Fermi level can be contributed to the stabilization of intermediates in the CO2 reduction process, leading to an improvement in catalytic selectivity[93,94]. In general, the synergistic effect of structural characteristics and synergistic coordination will reduce the band gap, which is conducive to the absorption and activation of CO2, improving the catalytic activity and selectivity of CO2RR[95]. For example, Fe atom were introduced into the COFs space group symmetry, which can maintain the basic structure of COFs. Fe contributes significantly to the larger d-subshell electron density and total density around Fermi level, increasing the conductivity of COFs and improving the tunability of electronic properties[96]. Nevertheless, COFs in water can degrade to change its crystallinity and permeability, the resulted frame decomposition will affect the stability and durability of the catalyst[97]. Several elements, such as O, N, H, C, B, are connected by strong covalent bonds to form a porous structure[98]. By introducing N atoms into COFs, a perfectly covalently bonded carbon framework can be formed[99]. For instance, nitrogenated COFs (N-COFs) has a high specific surface area of more than 2700 m2 g−1, layered crystal structure with high crystallinity present excellent stability at high temperature (800 ℃)[100]. The lone pair electrons on the N atoms can form hydrogen bonds with the carbonyl O atoms in the CO2 molecule, which increases the electron density on N atoms, promoting the electrons transfer from N atoms to the π* orbitals of CO2 molecules [101]. The superior C-N bond and the high conductivity of the ionized skeleton can induce a higher CO2 desorption signal, enhancing the adsorption capacity of CO2 on the C-N bond (Fig. 5b)[102]. The incorporation of electron-rich atoms can effectively increase the delocalization degree and electron density of the p orbitals of metals, leading to the transfer of pores to Fermi level and promoting the CO2 activation step[103,104]. Co as a typical electron rich atom can change the electronic structure of different electrocatalysts. In this regard, doping Co and the introduction of N ions through post-synthetic modifications can significantly alter the electronic structure of COFs (Fig. 5c)[102]. For instance, Co-N-COF anchored Co atoms was constructed by using N-COF as a carrier (Fig. 5d)[100]. The concentration of Co2 + in Co-N-COF significantly reduces the electron band gap of Co-N-COF, thereby transferring electrons from the top of the valence band to the bottom of the conduction band (Fig. 5e). The maximum FE of HCOOH can achieve 97.4 % over a wide voltage range (at −0.75 V ∼ −1.05 V vs RHE), HCOOH partial current densities can achieve 446 mA cm−2 and stabile for 100 h. Thus, COF material is regarded as a promising catalyst for CO2RR to HCOOH. 3.4 Carbon-based materials Carbon-based catalysts, such as graphene, carbon nanotubes, carbon nanofibers, mesoporous carbon, present large pore structure and well-dispersed surface functional groups, which can improve the CO2 adsorption and diffusion kinetics[105–108]. More importantly, carbon with high stability can act as protection layer to prevent mental oxide from being reduced to a metallic state during the electrolysis process[29–31]. Generally, the greater negative shift of adsorption potential in the alkaline electrolyte will induce the stronger affinity for OH−, which can stabilize the *CO2·− intermediate. In this regard, a carbon-coated indium oxide catalyst (In2O3@C) was constructed by hydrothermal method and high temperature calcination ( Fig. 6a)[109]. There exist the negative shift of lattice oxygen peak in In2O3@C and positive shift in In 3d5/2. The results indicate that electrons may be transferred from In2O3 to the carbon layer, thus dispersing the electron density of In2O3 (Fig. 6b-c). In addition, the presence of oxygen vacancies can help to stabilize the oxidation state of metal sites, preventing excessive reduction or corrosion of metal sites during the CO2RR process[30]. The designed In2O3@C with rich oxygen vacancies presents high specific surface area and preserves 90 % selectivity of HCOO− at a wide voltage range (at −0.8 V ∼ −1.3 V vs RHE) (Fig. 6d-e)[109]. The introduced oxygen vacancies can enhance the adsorption of carbon dioxide, change the d-band center and electronic structure of In2O3, improving its binding ability with *CO2 · −. However, the resulted HCOO− needs to be further separated and purified into HCOOH. Doping N atoms can increase the micropores and surface area of carbon materials, which can increase the active sites and improve the utilization rate[110,111]. In this regard, an electron-rich catalytic environment around the site can be adopted to reduce the reaction energy barrier and promote the formation of HCOOH. For example, a In NPs/chitosan derived N-doped defective graphene (In/N-dG) catalyst was prepared from chitosan[112]. The decreased d-band center of the In/N-dG increases the electron density on the N-dG substrate (Fig. 6f-g). The FE of HCOOH maintains at 96.0 % over a wide potential window across −0.74 V to −1.17 V vs RHE (Fig. 6h). In addition, heteroatom-doped carbon-supported metal catalysts can regulate the inherent electronic structure of carbon substrate, adjust the Fermi level of electrocatalyst as well as change Lewis acidity and alkalinity[113,114]. Individual metal atoms are fixed to carbon-based carriers by forming coordination bonds with N atoms, such as mental-Nx. This coordination environment is conducive to regulating the electronic structure of metal atoms and ensuring adequate exposure of the active site. For instance, an atomically dispersed In-N-C catalyst was synthesized (Fig. 6i)[115]. Its atomically dispersed In site and strong electron interaction with the surrounding N atom can induce the d-band center shift upward relative to the In. The formed In-N coordination enhances the adsorption of intermediate *OCHO and achieves efficient conversion of CO2 to HCOOH. However, the unsaturated coordination and high surface energy of metal atoms are easy to migrate and aggregate, which can lead to the formation of metal clusters or nanoparticles, reducing the activity and selectivity of the catalyst[111,116]. The high specific surface area and abundant defect sites on the carrier are conducive to increasing the load of metal atoms and preventing their aggregation, thereby improving the activity and durability of the catalyst. 4 Electrochemical energy technologies 4.1 Formic acid fuel cells HCOOH as a high energy density hydrogen storage product can be continuously produced by electrochemical CO2RR under P-block metal catalysts. More importantly, HCOOH can be directly fed into the fuel cell to form a direct formic acid fuel cells. In general, a direct formic acid fuel cells uses HCOOH as aqueous solution and O2 in the air instead of a fuel to generate electricity[117–119]. Nevertheless, the difficult activation/cleavage of C═O bonds limits CO2RR kinetics. In addition, the HCOOH product needs to be further separated and purified accompanied with concentrated from electrolyte solution for subsequent application or storage[120,121]. In general, several factors, such as electrolyte, membrane electrode assembly and HCOOH concentration, can affect the performance of formic acid fuel cells[122–127]. The concentration of HCOOH can directly affect the current density and the transmembrane flux of HCOOH. Increasing the HCOOH concentration will spread from the high concentration area to the low concentration area, nevertheless, high HCOOH concentration will damage membrane electrode assembly (MEA), degrading the performance of formic acid fuel cells[128,129]. In addition, catalyst as the key factors can affect the performance of formic acid fuel cells. Precious metal catalysts (such as Pd and Pt) with superior activity have been widely applied in the formic acid fuel cells. For instance, the activity of Pt/Pd mixed metal nanoparticles prepared by spontaneous deposition present 1 mA cm−2 current density of HCOOH oxidation at 0.27 V, which is twice higher than that of pure Pt with HCOOH[130]. Due to the dependence between the size effect of nanoparticles and catalytic activity, larger nanoparticles are easy to cause agglomeration, and 5–7 nm Pd nanoparticles are most conducive to the electrooxidation of HCOOH[131,132]. Hetero-structured platinum-palladium alloy and oxides nanowires (PtPd-ox NWs) were synthesized by a self-sacrificing template method, a polymer fiber membrane was used to separate the cathode and anode in a single cell, and a commercially available Pt/C electrocatalyst was adopted as the cathode electrocatalyst ( Fig. 7a). A single cell with a PtPd-ox NWs anode has an open circuit voltage of 0.92 V and a peak power density of 43.3 mW cm−2, which are higher than that of the Pt/C electrocatalyst[124]. Electrocatalysts with different morphologies, such as dendritic[133] and nano-flower[134], can be used to improve the porosity and surface area. For instance, the catalyst with core-shell structure can improve the porosity and surface area. The PtPbBi/PtBi core-shell nanoparticles have an uneven surface and jagged edges, and the PtPbBi/PtBi nanoparticles can achieve a power density of 161.5 mW cm−2 in the MEA test[125]. Nevertheless, the high cost, poor selectivity and stability of precious metal catalysts for HCOOH have been the main obstacles to their large-scale application. P-block metals have been shown to be the promising catalysts for CO2RR to HCOOH. Recently, various strategies, such as metal alloying, nanostructure, heteroatom doping and regulation in electronic structure and morphology, can be used to optimize the CO2RR activity and stability of P-block metal catalysts (Fig. 7b)[120,124,135]. Particularly, impurities or defects in nanostructured electrocatalysts with large surface area can improve catalytic stability[136,137]. Bi2O3 treated with n-butyllithium with rich grain boundaries can facilitate the contact between catalyst and membrane in the MEA. In an all-solid-state electrochemical CO2RR system, a porous solid electrolyte layer was adopted for rapid ion transport for the continuous production of high-purity and high-concentration HCOOH (Fig. 7c-d)[123]. At neutral pH conditions, the partial current density of HCOOH can up to 450 mA cm⁻², and maintain high activity and selectivity for 100 h[138]. Bi-based catalysts with abundant lattice distortion defects can produce high concentrations of HCOOH in a solid electrolyte reactor, which can be directly used to drive direct formic acid fuel cells with a power density of 55 mW cm⁻2 for 300 h (Fig. 7e-f)[123]. 4.2 Water splitting CO2RR as a semi-reaction of water splitting can convert waste CO2 into useful chemicals and clean energy, realizing the resource reuse[139,140]. Electrolyte plays a key role in carbon dioxide reduction, both as a medium for electron transport and as a participant in the formation of intermediates. In general, the electrolyte in CO2RR can balance protons through anode reaction. The performance of the electrocatalyst can be regulated by controlling the concentration, cation and anion ratio, and pH of electrolyte[46,137]. However, CO2 reduction and hydrogen evolution reaction (HER) occur simultaneously during the water splitting process. In general, catalysts can significantly affect the selectivity of HCOOH and the overall efficiency of water splitting[141,142]. For instance, heteroatom-doped P-block metals as an effective strategy can be used to regulate the electronic structure, providing active sites with strong CO2 adsorption and inhibiting the HER. For example, P doped In2O3 catalyst with nanosheet structure presents high valence state[141]. Oxide-derived In and phosphorus-modified oxide-derived In were formed during in-situ reduction, which greatly improved the performance of CO2RR to formate ( Fig. 8a)[141]. Under alkaline conditions, water molecules exist in the form of hydrated base cation clusters, thus exhibiting excellent CO2 reduction properties to HCOOH. In addition, CO2RR is usually coupled with oxygen evolution reaction (OER). However, slow OER kinetics results in high overpotential and energy consumption. Based on thermodynamics, several powerful anodic substitution reactions, including oxidation of alcohols, biomass, chlorine and water contaminants, are proposed to improve the efficiency of water splitting and produce more value-added chemicals (Fig. 8b)[143,144]. Typically, anodic 5-hydroxymethylfurfural electrochemical oxidation (HMFOR) can be introduced to replace the slow OER. For example, indium oxyhydroxide with rich oxygen-vacancy (InOOH-OV) can act as a bifunctional catalyst, this constructed InOOH-OV catalyst presents superior catalytic performance for CO2RR to HCOOH and the HMFOR to 2, 5-furan dicarboxylic acid (Fig. 8c)[143]. In addition, bismuth doped single copper atom (Cu1Bi) was used as the cathode for CO2RR, and NiCo layered double hydroxide (NiCo LDHs) was adopted as the anode for OER. Cu1Bi can promote the dissociation of water and enhances the proton supply capacity. The presence of NiCo LDHs catalyst can reduce the activation energy of HMFOR reaction and accelerate the charge transfer at the electrode-electrolyte interface[145]. As a result, the CO2RR-HMFOR system presents a battery voltage of 2.7 V at the current density of 237 mA cm⁻², which is 0.8 V lower than the conventional CO2RR-OER system (Fig. 8d-e). 5 Perspectives and outlook In this review, recent achievements of advanced electrocatalysts for electrochemical selectivity reduction CO2 to HCOOH are summarized. Originating from the structure-activity relationship between electrocatalysts and CO2RR performance, various strategies, including morphology, alloying, doping and defect engineering, can be effectively applied to construct superior electrocatalysts. In addition, the effects of catalytic environment (such as pH and microenvironment) on catalyst surface should be considered on the practical application of CO2RR to HCOOH in electrochemical energy technologies (formic acid fuel cells and water splitting). Despite the obtained achievements of CO2RR in electrocatalysis, some problems still exist in the construction of high selective and stable CO2RR to HCOOH electrocatalysts. Firstly, the large-scale application of CO2RR technology in industrial production faces various challenges, such as cost-effectiveness, system stability and feasibility of long-term operation. Developing high-activity, high-selectivity and high-stability electrocatalysts is important for improving the performance of CO2RR. In general, balancing the relationship between activity, selectivity and stability should be considered. For instance, nanostructure and defect engineering is an effectivity strategy for constructing stable and highly effective catalysts. In addition, it is vital to design synthesis or modification methods with high efficiency, low cost, and easy extension. For example, constructing hetero-interfaces is an effective and easy strategy to improve the CO2RR performance. Moreover, electrocatalysts with the complex structure is difficult to determine the real active site. In order to reveal the behavior of carbon dioxide molecules, reaction intermediates and catalysts during electrocatalysis, the relationship between CO2RR and electrocatalyst performance can be effectively analyzed by theoretical calculation combined with in-situ characterization techniques. For instance, in-situ raman, in-situ attenuated total reflectance infrared spectroscopy, X-ray absorption spectroscopy and X-ray photoelectron spectroscopy can be adopted to capture the precise transformation of catalyst composition, structure, and adsorption intermediates, illustrating the real active sites of CO2RR. In addition, artificial intelligence methods, such as density functional theory and machine learning, which is the general trend to assisted design catalyst. Secondly, developing highly effective carbon dioxide electrolyzer system is vital in the practical applications. CO2RR electrolyzers include H-cells, microfluidicflow electrolyzers, MEA electrolyzer, and solid oxide electrolyzers. For instance, H-cells and microfluidicflow electrolyzers can separate cathode and anode products, nevertheless, the anode and anode are far apart, and the existence of ion exchange membrane may cause high ohmic resistance, resulting in high battery voltage and low energy efficiency of H-cells. MEA with polymer electrolyte membrane presents high ionic conductivity. However, the internal environment of the MEA electrolyzer is difficult to adjust, and some liquid products (such as formic acid, ethanol) are difficult to carry out through the gas flow. Solid oxide electrolyzer has an ion-conductive solid oxide, which can act as electrolyte to separate the anode and cathode. More importantly, solid oxide electrolyzer has higher electrolytic current density, energy efficiency and stability, which presents promising practical application towards CO2RR to HCOOH. Finally, the electrolyte for CO2RR to HCOOH is usually KHCO3 or KOH, the separation and purification of HCOOH is difficult, thus, its effective recovery rate and new separation processes need to be developed. Currently, the separation and purification methods for HCOOH include reduced pressure distillation, extraction, recrystallization, and distillation methods. However, the initial concentration of HCOOH affects the choice of separation and purification methods. In general, the concentration of HCOOH is in the range of tens of millimolar. For instance, at low concentrations, the selective permeability of semipermeable membranes can be used to separate formic acid from other components, such as using reverse osmosis or nanofiltration membranes. The high concentration of HCOOH vapor can be selectively produced in an all-solid electrolytic cell by using solid electrolyte. The resulting HCOOH vapor can be used directly to form direct formic acid fuel cells. Moreover, adopting solid-state electrolyte and MEA can avoid the separation and purification costs. At the same time, the concentration of CO2RR to HCOOH can be effectively increased, and the produced HCOOH can be directly used as fuel. Thus, constructing the entire electrolytic cell is extremely important for the application of industrial development. CRediT authorship contribution statement Long Xiaofeng: Writing – review & editing, Writing – original draft, Formal analysis, Conceptualization. Peng Yujie: Visualization. Yu Ze: Visualization. Zhang Yuhong: Supervision, Project administration. Jiang Xueliang: Supervision, Project administration. Yang Huan: Writing – review & editing, Supervision, Resources, Project administration. Declaration of Competing Interest The authors declare that they have no known competing financial interests or personal relationships that could have appeared to influence the work reported in this paper. Acknowledgments We acknowledge the financial support of the Key Laboratory of Material Chemistry for Energy Conversion and Storage (HUST), Ministry of Education (2024JYBKF06) and Hubei Key Laboratory for Processing and Application of Catalytic Materials (202440704). The work was also supported by open project funding of the Ministry of Education Key Laboratory for the Synthesis and Application of Organic Functional Molecules (KLSAOFM2306), Hubei University, Wuhan, P.R. China. We also acknowledge the financial support of the Graduate Education Innovation Fund of Wuhan Institute of Technology (CX2024335). References [1] S. Chu A. Majumdar Opportunities and challenges for a sustainable energy future Nat 488 7411 2012 294 303 10.1038/nature11475 S. Chu, A. Majumdar, Opportunities and challenges for a sustainable energy future, Nat. 488 (7411) (2012) 294-303. http://doi.org/10.1038/nature11475. [2] Z. Zhang T. Wang M.J. Blunt E.J. Anthony A.A. Park R.W. Hughes P.A. Webley J. Yan Advances in carbon capture, utilization and storage Appl. Energy 278 2020 115627 10.1016/j.apenergy.2020.115627 Z. Zhang, T. Wang, M.J. Blunt, E.J. Anthony, A.A. Park, R.W. Hughes, P.A. Webley, J. Yan, Advances in carbon capture, utilization and storage, Appl. Energy 278 (2020) 115627. http://doi.org/10.1016/j.apenergy.2020.115627. [3] M. Liu F. Rao J. Balamurugan T. Liang C. Liu Theoretical research on efficient electrocatalysis of CO2 reduction reaction by borophene loaded transition metals Surf. Inter. 49 2024 104454 10.1016/j.surfin.2024.104454 M. Liu, F. Rao, J. Balamurugan, T. Liang, C. Liu, Theoretical research on efficient electrocatalysis of CO2 reduction reaction by borophene loaded transition metals, Surf. Interf. 49 (2024) 104454. http://doi.org/10.1016/j.surfin.2024.104454. [4] M. Liu F. Rao T. Xu Q. Fu C. Liu Reaction mechanism of metal-free borophene catalyst electrochemical reduction of CO2 Colloids Surf. A 701 2024 134933 10.1016/j.colsurfa.2024.134933 M. Liu, F. Rao, T. Xu, Q. Fu, C. Liu, Reaction mechanism of metal-free borophene catalyst electrochemical reduction of CO2, Colloids Surf. A 701 (2024) 134933. http://doi.org/10.1016/j.colsurfa.2024.134933. [5] X. Wei D. Musikanth S. Zhang Metal-organic framework for high-temperature CO2 capture Energy Lab 3 1 2025 240022 10.54227/elab.20240022 X. Wei, D. Musikanth, S. Zhang, Metal-organic framework for high-temperature CO2 capture, Energy Lab 3 (1) (2025) 240022. http://doi.org/10.54227/elab.20240022. [6] S. Jin Z. Hao K. Zhang Z. Yan J. Chen Advances and challenges for the electrochemical reduction of CO2 to CO: From fundamentals to industrialization Angew. Chem. Int. Ed. 60 38 2021 20627 20648 10.1002/anie.202101818 S. Jin, Z. Hao, K. Zhang, Z. Yan, J. Chen, Advances and challenges for the electrochemical reduction of CO2 to CO: From fundamentals to industrialization, Angew. Chem. Int. Ed. 60 (38) (2021) 20627-20648. http://doi.org/10.1002/anie.202101818. [7] L. Zhang Z. Zhao J. Gong Nanostructured materials for heterogeneous electrocatalytic CO2 reduction and their related reaction mechanisms Angew. Chem. Int. Ed. 56 38 2017 11326 11353 10.1002/anie.201612214 L. Zhang, Z. Zhao, J. Gong, Nanostructured materials for heterogeneous electrocatalytic CO2 reduction and their related reaction mechanisms, Angew. Chem. Int. Ed. 56 (38) (2017) 11326-11353. http://doi.org/10.1002/anie.201612214. [8] C. Xia X. Wang C. He R. Qi D. Zhu R. Lu F. Li Y. Chen S. Chen B. You T. Yao W. Guo F. Song Z. Wang B.Y. Xia Highly selective electrocatalytic CO2 conversion to tailored products through precise regulation of hydrogenation and C-C coupling J. Am. Chem. Soc. 146 29 2024 20530 20538 10.1021/jacs.4c07502 C. Xia, X. Wang, C. He, R. Qi, D. Zhu, R. Lu, F. Li, Y. Chen, S. Chen, B. You, T. Yao, W. Guo, F. Song, Z. Wang, B.Y. Xia, Highly selective electrocatalytic CO2 conversion to tailored products through precise regulation of hydrogenation and C-C coupling, J. Am. Chem. Soc. 146 (29) (2024) 20530-20538. http://doi.org/10.1021/jacs.4c07502. [9] X. Cui M. Wu G. Hou Y. Li Y. Wang Y. Wang J. Huang M. Zhao Z.-Z. Luo Z. Zou Y. Zhang M. Shao Alkali metal ions stabilizing copper(I)-sulfur bonds for efficient formate production from electrochemical CO2 reduction ACS Catal. 14 15 2024 11857 11864 10.1021/acscatal.4c02022 X. Cui, M. Wu, G. Hou, Y. Li, Y. Wang, Y. Wang, J. Huang, M. Zhao, Z.-Z. Luo, Z. Zou, Y. Zhang, M. Shao, Alkali metal ions stabilizing copper(I)-sulfur bonds for efficient formate production from electrochemical CO2 reduction, ACS Catal. 14 (15) (2024) 11857-11864. http://doi.org/10.1021/acscatal.4c02022. [10] C.G. Margarit N.G. Asimow C. Costentin D.G. Nocera Tertiary amine-assisted electroreduction of carbon dioxide to formate catalyzed by iron tetraphenylporphyrin ACS Energy Lett. 5 1 2019 72 78 10.1021/acsenergylett.9b02093 C.G. Margarit, N.G. Asimow, C. Costentin, D.G. Nocera, Tertiary amine-assisted electroreduction of carbon dioxide to formate catalyzed by iron tetraphenylporphyrin, ACS Energy Lett. 5 (1) (2019) 72-78. http://doi.org/10.1021/acsenergylett.9b02093. [11] Y. Wang X. Liu X. Han R. Godin J. Chen W. Zhou C. Jiang J.F. Thompson K.B. Mustafa S.A. Shevlin J.R. Durrant Z. Guo J. Tang Unique hole-accepting carbon-dots promoting selective carbon dioxide reduction nearly 100% to methanol by pure water Nat. Commun. 11 1 2020 2531 10.1038/s41467-020-16227-3 Y. Wang, X. Liu, X. Han, R. Godin, J. Chen, W. Zhou, C. Jiang, J.F. Thompson, K.B. Mustafa, S.A. Shevlin, J.R. Durrant, Z. Guo, J. Tang, Unique hole-accepting carbon-dots promoting selective carbon dioxide reduction nearly 100% to methanol by pure water, Nat. Commun. 11 (1) (2020) 2531. http://doi.org/10.1038/s41467-020-16227-3. [12] S. Gonglach S. Paul M. Haas F. Pillwein S.S. Sreejith S. Barman R. De S. Müllegger P. Gerschel U.-P. Apfel H. Coskun A. Aljabour P. Stadler W. Schöfberger S. Roy Molecular cobalt corrole complex for the heterogeneous electrocatalytic reduction of carbon dioxide Nat. Commun. 10 1 2019 3864 10.1038/s41467-019-11868-5 S. Gonglach, S. Paul, M. Haas, F. Pillwein, S.S. Sreejith, S. Barman, R. De, S. Müllegger, P. Gerschel, U.-P. Apfel, H. Coskun, A. Aljabour, P. Stadler, W. Schöfberger, S. Roy, Molecular cobalt corrole complex for the heterogeneous electrocatalytic reduction of carbon dioxide, Nat. Commun. 10 (1) (2019) 3864. http://doi.org/10.1038/s41467-019-11868-5. [13] A. Guan Z. Chen Y. Quan C. Peng Z. Wang T.-K. Sham C. Yang Y. Ji L. Qian X. Xu G. Zheng Boosting CO2 electroreduction to CH4 via tuning neighboring single-copper sites ACS Energy Lett. 5 4 2020 1044 1053 10.1021/acsenergylett.0c00018 A. Guan, Z. Chen, Y. Quan, C. Peng, Z. Wang, T.-K. Sham, C. Yang, Y. Ji, L. Qian, X. Xu, G. Zheng, Boosting CO2 electroreduction to CH4 via tuning neighboring single-copper sites, ACS Energy Lett. 5 (4) (2020) 1044-1053. http://doi.org/10.1021/acsenergylett.0c00018. [14] C.-T. Dinh F.P. García de Arquer D. Sinton E.H. Sargent High rate, selective, and stable electroreduction of CO2 to CO in basic and neutral media ACS Energy Lett. 3 11 2018 2835 2840 10.1021/acsenergylett.8b01734 C.-T. Dinh, F.P. García de Arquer, D. Sinton, E.H. Sargent, High rate, selective, and stable electroreduction of CO2 to CO in basic and neutral media, ACS Energy Lett. 3 (11) (2018) 2835-2840. http://doi.org/10.1021/acsenergylett.8b01734. [15] R. Zheng Z. Liu Y. Wang Z. Xie M. He The future of green energy and chemicals: Rational design of catalysis routes Joule 6 6 2022 1148 1159 10.1016/j.joule.2022.04.014 R. Zheng, Z. Liu, Y. Wang, Z. Xie, M. He, The future of green energy and chemicals: Rational design of catalysis routes, Joule 6 (6) (2022) 1148-1159. http://doi.org/10.1016/j.joule.2022.04.014. [16] W. Deng P. Zhang B. Seger J. Gong Unraveling the rate-limiting step of two-electron transfer electrochemical reduction of carbon dioxide Nat. Commun. 13 1 2022 803 10.1038/s41467-022-28436-z W. Deng, P. Zhang, B. Seger, J. Gong, Unraveling the rate-limiting step of two-electron transfer electrochemical reduction of carbon dioxide, Nat. Commun. 13 (1) (2022) 803. http://doi.org/10.1038/s41467-022-28436-z. [17] Y. Liu Z. Wei X. Su X. Shi L. Liu T. Wang X. Xu M. Zhao Y. Zhai H.B. Yang B. Liu Promoting electrochemical CO2 reduction to formate via sulfur-assisted electrolysis Adv. Funct. Mater. 2024 2403547 10.1002/adfm.202403547 Y. Liu, Z. Wei, X. Su, X. Shi, L. Liu, T. Wang, X. Xu, M. Zhao, Y. Zhai, H.B. Yang, B. Liu, Promoting electrochemical CO2 reduction to formate via sulfur-assisted electrolysis, Adv. Funct. Mater. (2024) 2403547. http://doi.org/10.1002/adfm.202403547. [18] D. Kim J. Han Comprehensive analysis of two catalytic processes to produce formic acid from carbon dioxide Appl. Energy 264 2020 114711 10.1016/j.apenergy.2020.114711 D. Kim, J. Han, Comprehensive analysis of two catalytic processes to produce formic acid from carbon dioxide, Appl. Energy 264 (2020) 114711. http://doi.org/10.1016/j.apenergy.2020.114711. [19] Z. Yang F.E. Oropeza K.H.L. Zhang P-block metal-based (Sn, In, Bi, Pb) electrocatalysts for selective reduction of CO2 to formate APL Mater. 8 2020 060901 10.1063/5.0004194 Z. Yang, F.E. Oropeza, K.H. L. Zhang, P-block metal-based (Sn, In, Bi, Pb) electrocatalysts for selective reduction of CO2 to formate, APL Mater. 8 (2020) 060901. http://doi.org/10.1063/5.0004194. [20] Y. Deng J. Zhao S. Wang R. Chen J. Ding H. Tsai W. Zeng S. Hung W. Xu J. Wang F. Jaouen X. Li Y. Huang B. Liu Operando spectroscopic analysis of axial oxygen-coordinated single-Sn-atom sites for electrochemical CO2 reduction J. Am. Chem. Soc. 145 13 2023 7242 7251 10.1021/jacs.2c12952 Y. Deng, J. Zhao, S. Wang, R. Chen, J. Ding, H. Tsai, W. Zeng, S. Hung, W. Xu, J. Wang, F. Jaouen, X. Li, Y. Huang, B. Liu, Operando spectroscopic analysis of axial oxygen-coordinated single-Sn-atom sites for electrochemical CO2 reduction, J. Am. Chem. Soc. 145 (13) (2023) 7242-7251. http://doi.org/10.1021/jacs.2c12952. [21] J.S. Yoo R. Christensen T. Vegge J.K. Nørskov F. Studt Theoretical insight into the trends that guide the electrochemical reduction of carbon dioxide to formic acid ChemSusChem 9 4 2015 358 363 10.1002/cssc.201501197 J.S. Yoo, R. Christensen, T. Vegge, J.K. Nørskov, F. Studt, Theoretical insight into the trends that guide the electrochemical reduction of carbon dioxide to formic acid, ChemSusChem 9 (4) (2015) 358-363. http://doi.org/10.1002/cssc.201501197. [22] H. Shen T. Wang H. Jiang P. Zhao Z. Chen Y. Feng Y. Cao Y. Guo Q. Zhang H. Zhang Theoretical calculation guided design of single atom-alloyed bismuth catalysts for ampere-level CO2 electrolysis to formate Appl. Catal. B Environ. 339 2023 123140 10.1016/j.apcatb.2023.123140 H. Shen, T. Wang, H. Jiang, P. Zhao, Z. Chen, Y. Feng, Y. Cao, Y. Guo, Q. Zhang, H. Zhang, Theoretical calculation guided design of single atom-alloyed bismuth catalysts for ampere-level CO2 electrolysis to formate, Appl. Catal. B Environ. 339 (2023) 123140. http://doi.org/10.1016/j.apcatb.2023.123140. [23] J.T. Feaster C. Shi E.R. Cave T. Hatsukade D.N. Abram K.P. Kuhl C. Hahn J.K. Nørskov T.F. Jaramillo Understanding selectivity for the electrochemical reduction of carbon dioxide to formic acid and carbon monoxide on metal electrodes ACS Catal. 7 7 2017 4822 4827 10.1021/acscatal.7b00687 J.T. Feaster, C. Shi, E.R. Cave, T. Hatsukade, D.N. Abram, K.P. Kuhl, C. Hahn, J.K. Nørskov, T.F. Jaramillo, Understanding selectivity for the electrochemical reduction of carbon dioxide to formic acid and carbon monoxide on metal electrodes, ACS Catal. 7 (7) (2017) 4822-4827. http://doi.org/10.1021/acscatal.7b00687. [24] F. Jalid T.S. Khan M.A. Haider Exploring bimetallic alloy catalysts of Co, Pd and Cu for CO2 reduction combined with ethane dehydrogenation Appl. Energy 299 2021 117284 10.1016/j.apenergy.2021.117284 F. Jalid, T.S. Khan, M.A. Haider, Exploring bimetallic alloy catalysts of Co, Pd and Cu for CO2 reduction combined with ethane dehydrogenation, Appl. Energy 299 (2021) 117284. http://doi.org/10.1016/j.apenergy.2021.117284. [25] X. Wu J. Lu Z. Zhu S. Liu H. Wen Recent advances of metal-organic frameworks and MOF-derived materials based on p-block metal for the electrochemical reduction of carbon dioxide Chin. Chem. Lett. 2024 110151 10.1016/j.cclet.2024.110151 X. Wu, J. Lu, Z. Zhu, S. Liu, H. Wen, Recent advances of metal-organic frameworks and MOF-derived materials based on p-block metal for the electrochemical reduction of carbon dioxide, Chin. Chem. Lett. (2024) 110151. http://doi.org/10.1016/j.cclet.2024.110151. [26] D.T. Wijaya C.W. Lee Metal-organic framework catalysts: a versatile platform for bioinspired electrochemical conversion of carbon dioxide Chem. Eng. J. 446 2022 137311 10.1016/j.cej.2022.137311 D.T. Wijaya, C.W. Lee, Metal-organic framework catalysts: A versatile platform for bioinspired electrochemical conversion of carbon dioxide, Chem. Eng. J. 446 (2022) 137311. http://doi.org/10.1016/j.cej.2022.137311. [27] L. Xiao Z. Wang J. Guan Optimization strategies of covalent organic frameworks and their derivatives for electrocatalytic applications Adv. Funct. Mater. 34 11 2023 2310195 10.1002/adfm.202310195 L. Xiao, Z. Wang, J. Guan, Optimization strategies of covalent organic frameworks and their derivatives for electrocatalytic applications, Adv. Funct. Mater. 34 (11) (2023) 2310195. http://doi.org/10.1002/adfm.202310195. [28] Y.N. Gong J.H. Mei W.J. Shi J.W. Liu D.C. Zhong T.B. Lu Boosting CO2 photoreduction to formate or CO with high selectivity over a covalent organic framework covalently anchored on graphene oxide Angew. Chem. Int. Ed. 63 10 2024 e202318735 10.1002/anie.202318735 Y.N. Gong, J.H. Mei, W.J. Shi, J.W. Liu, D.C. Zhong, T.B. Lu, Boosting CO2 photoreduction to formate or CO with high selectivity over a covalent organic framework covalently anchored on graphene oxide, Angew. Chem. Int. Ed. 63 (10) (2024) e202318735. http://doi.org/10.1002/anie.202318735. [29] Y. Chen C.W. Li M.W. Kanan Aqueous CO2 reduction at very low overpotential on oxide-derived Au nanoparticles J. Am. Chem. Soc. 134 49 2012 19969 19972 10.1021/ja309317u Y. Chen, C.W. Li, M.W. Kanan, Aqueous CO2 reduction at very low overpotential on oxide-derived Au nanoparticles, J. Am. Chem. Soc. 134 (49) (2012) 19969-19972. http://doi.org/10.1021/ja309317u. [30] Z. Wang L. Xu Y. Zhou Y. Liang J. Yang D. Wu S. Zhang X. Han X. Shi J. Li Y. Yuan P. Deng X. Tian Stabilizing the oxidation state of catalysts for effective electrochemical carbon dioxide conversion Chem. Soc. Rev. 53 12 2024 6295 6321 10.1039/d3cs00887h Z. Wang, L. Xu, Y. Zhou, Y. Liang, J. Yang, D. Wu, S. Zhang, X. Han, X. Shi, J. Li, Y. Yuan, P. Deng, X. Tian, Stabilizing the oxidation state of catalysts for effective electrochemical carbon dioxide conversion, Chem. Soc. Rev. 53 (12) (2024) 6295-6321. http://doi.org/10.1039/d3cs00887h. [31] W. Li S. Gao C. Yang J. Yang A. Nisar G. Xiang J. Jin Enhanced electrocatalytic CO2 reduction to formic acid using nanocomposites of In2O3@C with graphene Nano Res 17 6 2024 5031 5039 10.1007/s12274-024-6517-5 W. Li, S. Gao, C. Yang, J. Yang, A. Nisar, G. Xiang, J. Jin, Enhanced electrocatalytic CO2 reduction to formic acid using nanocomposites of In2O3@C with graphene, Nano Res. 17 (6) (2024) 5031-5039. http://doi.org/10.1007/s12274-024-6517-5. [32] J.H. Koh D.H. Won T. Eom N.-K. Kim K.D. Jung H. Kim Y.J. Hwang B.K. Min Facile CO2 electro-reduction to formate via oxygen bidentate intermediate stabilized by high-index planes of Bi dendrite catalyst ACS Catal. 7 8 2017 5071 5077 10.1021/acscatal.7b00707 J.H. Koh, D.H. Won, T. Eom, N.-K. Kim, K.D. Jung, H. Kim, Y.J. Hwang, B.K. Min, Facile CO2 electro-reduction to formate via oxygen bidentate intermediate stabilized by high-index planes of Bi dendrite catalyst, ACS Catal. 7 (8) (2017) 5071-5077. http://doi.org/10.1021/acscatal.7b00707. [33] J. Chen S. Chen Y. Li X. Liao T. Zhao F. Cheng H. Wang Galvanic-cell deposition enables the exposure of bismuth grain boundary for efficient electroreduction of carbon dioxide Small 18 22 2022 2201633 10.1002/smll.202201633 J. Chen, S. Chen, Y. Li, X. Liao, T. Zhao, F. Cheng, H. Wang, Galvanic-cell deposition enables the exposure of bismuth grain boundary for efficient electroreduction of carbon dioxide, Small 18 (22) (2022) 2201633. http://doi.org/10.1002/smll.202201633. [34] X. An S. Li A. Yoshida T. Yu Z. Wang X. Hao A. Abudula G. Guan Bi-doped SnO nanosheets supported on Cu foam for electrochemical reduction of CO2 to HCOOH ACS Appl. Mater. Interfaces 11 45 2019 42114 42122 10.1021/acsami.9b13270 X. An, S. Li, A. Yoshida, T. Yu, Z. Wang, X. Hao, A. Abudula, G. Guan, Bi-doped SnO nanosheets supported on Cu foam for electrochemical reduction of CO2 to HCOOH, ACS Appl. Mater. Interfaces 11 (45) (2019) 42114-42122. http://doi.org/10.1021/acsami.9b13270. [35] T. Jiang X. Qin K. Ye W. Zhang H. Li W. Liu S. Huo X. Zhang K. Jiang W. Cai An interactive study of catalyst and mechanism for electrochemical CO2 reduction to formate on Pd surfaces Appl. Catal. B Environ. 334 2023 10.1016/j.apcatb.2023.122815 T. Jiang, X. Qin, K. Ye, W. Zhang, H. Li, W. Liu, S. Huo, X. Zhang, K. Jiang, W. Cai, An interactive study of catalyst and mechanism for electrochemical CO2 reduction to formate on Pd surfaces, Appl. Catal. B Environ. 334 (2023) http://doi.org/10.1016/j.apcatb.2023.122815. [36] M. Zheng X. Zhou Y. Wang G. Chen M. Li Theoretical study on the reduction mechanism of CO2 to HCOOH on Pd3Au: an explicit solvent model is essential J. Mater. Chem. A 11 12 2023 6591 6602 10.1039/d2ta08552f M. Zheng, X. Zhou, Y. Wang, G. Chen, M. Li, Theoretical study on the reduction mechanism of CO2 to HCOOH on Pd3Au: an explicit solvent model is essential, J. Mater. Chem. A 11 (12) (2023) 6591-6602. http://doi.org/10.1039/d2ta08552f. [37] S. Yang H. An S. Arnouts H. Wang X. Yu J. de Ruiter S. Bals T. Altantzis B.M. Weckhuysen W. van der Stam Halide-guided active site exposure in bismuth electrocatalysts for selective CO2 conversion into formic acid Nat. Catal. 6 9 2023 796 806 10.1038/s41929-023-01008-0 S. Yang, H. An, S. Arnouts, H. Wang, X. Yu, J. de Ruiter, S. Bals, T. Altantzis, B.M. Weckhuysen, W. van der Stam, Halide-guided active site exposure in bismuth electrocatalysts for selective CO2 conversion into formic acid, Nat. Catal. 6 (9) (2023) 796-806. http://doi.org/10.1038/s41929-023-01008-0. [38] R. Zhao Y. Wang G. Ji F. Zhang Y. Wang Y. Zhao B. Han Z. Liu Coupling electrocatalytic CO2 reduction with glucose oxidation for concurrent production of formate with high efficiency Chem. Eng. J. 486 2024 150280 10.1016/j.cej.2024.150280 R. Zhao, Y. Wang, G. Ji, F. Zhang, Y. Wang, Y. Zhao, B. Han, Z. Liu, Coupling electrocatalytic CO2 reduction with glucose oxidation for concurrent production of formate with high efficiency, Chem. Eng. J. 486 (2024) 150280. http://doi.org/10.1016/j.cej.2024.150280. [39] Z. Chen Z. Liu X. Xu Dynamic evolution of the active center driven by hemilabile coordination in Cu/CeO2 single-atom catalyst Nat. Commun. 14 1 2023 2512 10.1038/s41467-023-38307-w Z. Chen, Z. Liu, X. Xu, Dynamic evolution of the active center driven by hemilabile coordination in Cu/CeO2 single-atom catalyst, Nat. Commun. 14 (1) (2023) 2512. http://doi.org/10.1038/s41467-023-38307-w. [40] R. Nankya A. Elgazzar P. Zhu F.-Y. Chen H. Wang Catalyst design and reactor engineering for electrochemical CO2 reduction to formate and formic acid Mater. Today 76 2024 94 109 10.1016/j.mattod.2024.05.002 R. Nankya, A. Elgazzar, P. Zhu, F.-Y. Chen, H. Wang, Catalyst design and reactor engineering for electrochemical CO2 reduction to formate and formic acid, Mater. Today 76 (2024) 94-109. http://doi.org/10.1016/j.mattod.2024.05.002. [41] Z. Sun T. Ma H. Tao Q. Fan B. Han Fundamentals and challenges of electrochemical CO2 reduction using two-dimensional materials Chem 3 4 2017 560 587 10.1016/j.chempr.2017.09.009 Z. Sun, T. Ma, H. Tao, Q. Fan, B. Han, Fundamentals and challenges of electrochemical CO2 reduction using two-dimensional materials, Chem 3 (4) (2017) 560-587. http://doi.org/10.1016/j.chempr.2017.09.009. [42] X. Li X. Wu X. Lv J. Wang H.B. Wu Recent advances in metal-based electrocatalysts with hetero-interfaces for CO2 reduction reaction Chem. Catal. 2 2 2022 262 291 10.1016/j.checat.2021.10.015 X. Li, X. Wu, X. Lv, J. Wang, H.B. Wu, Recent advances in metal-based electrocatalysts with hetero-interfaces for CO2 reduction reaction, Chem. Catal. 2 (2) (2022) 262-291. http://doi.org/10.1016/j.checat.2021.10.015. [43] Y. Li E.P. Delmo G. Hou X. Cui M. Zhao Z. Tian Y. Zhang M. Shao Enhancing local CO2 adsorption by L-histidine incorporation for selective formate production over the wide potential window Angew. Chem. Int. Ed. 62 49 2023 e202313522 10.1002/anie.202313522 Y. Li, E.P. Delmo, G. Hou, X. Cui, M. Zhao, Z. Tian, Y. Zhang, M. Shao, Enhancing local CO2 adsorption by L-histidine incorporation for selective formate production over the wide potential window, Angew. Chem. Int. Ed. 62 (49) (2023) e202313522. http://doi.org/10.1002/anie.202313522. [44] P. Deng H. Wang R. Qi J. Zhu S. Chen F. Yang L. Zhou K. Qi H. Liu B.Y. Xia Bismuth oxides with enhanced bismuth-oxygen structure for efficient electrochemical reduction of carbon dioxide to formate ACS Catal. 10 1 2019 743 750 10.1021/acscatal.9b04043 P. Deng, H. Wang, R. Qi, J. Zhu, S. Chen, F. Yang, L. Zhou, K. Qi, H. Liu, B.Y. Xia, Bismuth oxides with enhanced bismuth-oxygen structure for efficient electrochemical reduction of carbon dioxide to formate, ACS Catal. 10 (1) (2019) 743-750. http://doi.org/10.1021/acscatal.9b04043. [45] N. Han P. Ding L. He Y. Li Y. Li Promises of main group metal-based nanostructured materials for electrochemical CO2 reduction to formate Adv. Energy Mater. 10 11 2019 1902338 10.1002/aenm.201902338 N. Han, P. Ding, L. He, Y. Li, Y. Li, Promises of main group metal-based nanostructured materials for electrochemical CO2 reduction to formate, Adv. Energy Mater. 10 (11) (2019) 1902338. http://doi.org/10.1002/aenm.201902338. [46] P.-P. Yang M.-R. Gao Enrichment of reactants and intermediates for electrocatalytic CO2 reduction Chem. Soc. Rev. 52 13 2023 4343 4380 10.1039/d2cs00849a P.-P. Yang, M.-R. Gao, Enrichment of reactants and intermediates for electrocatalytic CO2 reduction, Chem. Soc. Rev. 52 (13) (2023) 4343-4380. http://doi.org/10.1039/d2cs00849a. [47] A. Del Castillo M. Alvarez-Guerra A. Irabien Continuous electroreduction of CO2 to formate using Sn gas diffusion electrodes AIChE J. 60 10 2014 3557 3564 10.1002/aic.14544 A. Del Castillo, M. Alvarez-Guerra, A. Irabien, Continuous electroreduction of CO2 to formate using Sn gas diffusion electrodes, AIChE J. 60 (10) (2014) 3557-3564. http://doi.org/10.1002/aic.14544. [48] D.M. Weekes D.A. Salvatore A. Reyes A. Huang C.P. Berlinguette Electrolytic CO2 reduction in a flow cell Acc. Chem. Res. 51 4 2018 910 918 10.1021/acs.accounts.8b00010 D.M. Weekes, D.A. Salvatore, A. Reyes, A. Huang, C.P. Berlinguette, Electrolytic CO2 reduction in a flow cell, Acc. Chem. Res. 51 (4) (2018) 910-918. http://doi.org/10.1021/acs.accounts.8b00010. [49] G. Glockler Carbon-oxygen bond energies and bond distances J. Phys. Chem. 62 9 1958 1049 1054 G. Glockler, Carbon-oxygen bond energies and bond distances, J. Phys. Chem. 62 (9) (1958) 1049-1054. [50] W. Qian S. Xu X. Zhang C. Li W. Yang C.R. Bowen Y. Yang Differences and similarities of photocatalysis and electrocatalysis in two-dimensional nanomaterials: Strategies, traps, applications and challenges Nano-Micro Lett. 13 1 2021 156 10.1007/s40820-021-00681-9 W. Qian, S. Xu, X. Zhang, C. Li, W. Yang, C.R. Bowen, Y. Yang, Differences and similarities of photocatalysis and electrocatalysis in two-dimensional nanomaterials: Strategies, traps, applications and challenges, Nano-Micro Lett. 13 (1) (2021) 156. http://doi.org/10.1007/s40820-021-00681-9. [51] L. Xiao L. Qi J. Sun A. Husile S. Zhang Z. Wang J. Guan Structural regulation of covalent organic frameworks for advanced electrocatalysis Nano Energy 120 2024 109155 10.1016/j.nanoen.2023.109155 L. Xiao, L. Qi, J. Sun, A. Husile, S. Zhang, Z. Wang, J. Guan, Structural regulation of covalent organic frameworks for advanced electrocatalysis, Nano Energy 120 (2024) 109155. http://doi.org/10.1016/j.nanoen.2023.109155. [52] Y.X. Feng J. Hao S. Zhu B.W. Zhang Y. Chen Copper oxide foam with high specific surface area for electrocatalytic reduction of CO2 to C2+ products cMat 1 1 2024 e19 10.1002/cmt2.19 Y.X. Feng, J. Hao, S. Zhu, B.W. Zhang, Y. Chen, Copper oxide foam with high specific surface area for electrocatalytic reduction of CO2 to C2+ products, cMat 1 (1) (2024) e19. http://doi.org/10.1002/cmt2.19. [53] Q. Fu T. Xu C. He D. Wang M. Liu C. Liu Machine learning-assisted study of RENxC6-x-doped graphene as potential electrocatalysts for oxygen electrode reactions Langmuir 40 20 2024 10726 10736 10.1021/acs.langmuir.4c00803 Q. Fu, T. Xu, C. He, D. Wang, M. Liu, C. Liu, Machine learning-assisted study of RENxC6-x-doped graphene as potential electrocatalysts for oxygen electrode reactions, Langmuir 40 (20) (2024) 10726-10736. http://doi.org/10.1021/acs.langmuir.4c00803. [54] Q. Fu T. Xu D. Wang C. Liu Rare earth modified carbon-based catalysts for oxygen electrode reactions: a machine learning assisted density functional theory investigation Carbon 223 2024 119045 10.1016/j.carbon.2024.119045 Q. Fu, T. Xu, D. Wang, C. Liu, Rare earth modified carbon-based catalysts for oxygen electrode reactions: A machine learning assisted density functional theory investigation, Carbon 223 (2024) 119045. http://doi.org/10.1016/j.carbon.2024.119045. [55] T.S. Bui E.C. Lovell R. Daiyan R. Amal Defective metal oxides: lessons from CO2RR and applications in NOxRR Adv. Mater. 35 28 2023 2205814 10.1002/adma.202205814 T.S. Bui, E.C. Lovell, R. Daiyan, R. Amal, Defective metal oxides: Lessons from CO2RR and applications in NOxRR, Adv. Mater. 35 (28) (2023) 2205814. http://doi.org/10.1002/adma.202205814. [56] P. Li F. Yang J. Li Q. Zhu J.W. Xu X.J. Loh K.W. Huang W. Hu J. Lu Nanoscale engineering of P-block metal-based catalysts toward industrial-scale electrochemical reduction of CO2 Adv. Energy Mater. 13 34 2023 2301597 10.1002/aenm.202301597 P. Li, F. Yang, J. Li, Q. Zhu, J.W. Xu, X.J. Loh, K.W. Huang, W. Hu, J. Lu, Nanoscale engineering of P-block metal-based catalysts toward industrial-scale electrochemical reduction of CO2, Adv. Energy Mater. 13 (34) (2023) 2301597. http://doi.org/10.1002/aenm.202301597. [57] G. Wen D.U. Lee B. Ren F.M. Hassan G. Jiang Z.P. Cano J. Gostick E. Croiset Z. Bai L. Yang Z. Chen Orbital interactions in Bi-Sn bimetallic electrocatalysts for highly selective electrochemical CO2 reduction toward formate production Adv. Energy Mater. 8 31 2018 1802427 10.1002/aenm.201802427 G. Wen, D.U. Lee, B. Ren, F.M. Hassan, G. Jiang, Z.P. Cano, J. Gostick, E. Croiset, Z. Bai, L. Yang, Z. Chen, Orbital interactions in Bi-Sn bimetallic electrocatalysts for highly selective electrochemical CO2 reduction toward formate production, Adv. Energy Mater. 8 (31) (2018) 1802427. http://doi.org/10.1002/aenm.201802427. [58] Y. Zhu Q. Lin Y. Zhong H.A. Tahini Z. Shao H. Wang Metal oxide-based materials as an emerging family of hydrogen evolution electrocatalysts Energy Environ. Sci. 13 10 2020 3361 3392 10.1039/d0ee02485f Y. Zhu, Q. Lin, Y. Zhong, H.A. Tahini, Z. Shao, H. Wang, Metal oxide-based materials as an emerging family of hydrogen evolution electrocatalysts, Energy Environ. Sci. 13 (10) (2020) 3361-3392. http://doi.org/10.1039/d0ee02485f. [59] Y. Zheng A. Vasileff X. Zhou Y. Jiao M. Jaroniec S.-Z. Qiao Understanding the roadmap for electrochemical reduction of CO2 to multi-carbon oxygenates and hydrocarbons on copper-based catalysts J. Am. Chem. Soc. 141 19 2019 7646 7659 10.1021/jacs.9b02124 Y. Zheng, A. Vasileff, X. Zhou, Y. Jiao, M. Jaroniec, S.-Z. Qiao, Understanding the roadmap for electrochemical reduction of CO2 to multi-carbon oxygenates and hydrocarbons on copper-based catalysts, J. Am. Chem. Soc. 141 (19) (2019) 7646-7659. http://doi.org/10.1021/jacs.9b02124. [60] W. Luc C. Collins S. Wang H. Xin K. He Y. Kang F. Jiao Ag-Sn bimetallic catalyst with a core-shell structure for CO2 reduction J. Am. Chem. Soc. 139 5 2017 1885 1893 10.1021/jacs.6b10435 W. Luc, C. Collins, S. Wang, H. Xin, K. He, Y. Kang, F. Jiao, Ag-Sn bimetallic catalyst with a core-shell structure for CO2 reduction, J. Am. Chem. Soc. 139 (5) (2017) 1885-1893. http://doi.org/10.1021/jacs.6b10435. [61] B. Ren G. Wen R. Gao D. Luo Z. Zhang W. Qiu Q. Ma X. Wang Y. Cui L. Ricardez–Sandoval A. Yu Z. Chen Nano-crumples induced Sn-Bi bimetallic interface pattern with moderate electron bank for highly efficient CO2 electroreduction Nat. Commun. 13 1 2022 2486 10.1038/s41467-022-29861-w B. Ren, G. Wen, R. Gao, D. Luo, Z. Zhang, W. Qiu, Q. Ma, X. Wang, Y. Cui, L. Ricardez–Sandoval, A. Yu, Z. Chen, Nano-crumples induced Sn-Bi bimetallic interface pattern with moderate electron bank for highly efficient CO2 electroreduction, Nat. Commun. 13 (1) (2022) 2486. http://doi.org/10.1038/s41467-022-29861-w. [62] T. Wang J. Chen X. Ren J. Zhang J. Ding Y. Liu K.H. Lim J. Wang X. Li H. Yang Y. Huang S. Kawi B. Liu Halogen-incorporated Sn catalysts for selective electrochemical CO2 reduction to formate Angew. Chem. Int. Ed. 62 10 2023 e202211174 10.1002/anie.202211174 T. Wang, J. Chen, X. Ren, J. Zhang, J. Ding, Y. Liu, K.H. Lim, J. Wang, X. Li, H. Yang, Y. Huang, S. Kawi, B. Liu, Halogen-incorporated Sn catalysts for selective electrochemical CO2 reduction to formate, Angew. Chem. Int. Ed. 62 (10) (2023) e202211174. http://doi.org/10.1002/anie.202211174. [63] X. Zheng P. De Luna F.P. García de Arquer B. Zhang N. Becknell M.B. Ross Y. Li M.N. Banis Y. Li M. Liu O. Voznyy C.T. Dinh T. Zhuang P. Stadler Y. Cui X. Du P. Yang E.H. Sargent Sulfur-modulated tin sites enable highly selective electrochemical reduction of CO2 to formate Joule 1 4 2017 794 805 10.1016/j.joule.2017.09.014 X. Zheng, P. De Luna, F.P. García de Arquer, B. Zhang, N. Becknell, M.B. Ross, Y. Li, M.N. Banis, Y. Li, M. Liu, O. Voznyy, C.T. Dinh, T. Zhuang, P. Stadler, Y. Cui, X. Du, P. Yang, E.H. Sargent, Sulfur-modulated tin sites enable highly selective electrochemical reduction of CO2 to formate, Joule 1 (4) (2017) 794-805. http://doi.org/10.1016/j.joule.2017.09.014. [64] X. Zu X. Li W. Liu Y. Sun J. Xu T. Yao W. Yan S. Gao C. Wang S. Wei Y. Xie Efficient and robust carbon dioxide electroreduction enabled by atomically dispersed Snδ+ sites Adv. Mater. 31 15 2019 1808135 10.1002/adma.201808135 X. Zu, X. Li, W. Liu, Y. Sun, J. Xu, T. Yao, W. Yan, S. Gao, C. Wang, S. Wei, Y. Xie, Efficient and robust carbon dioxide electroreduction enabled by atomically dispersed Snδ+ sites, Adv. Mater. 31 (15) (2019) 1808135. http://doi.org/10.1002/adma.201808135. [65] H. Shen H. Jin H. Li H. Wang J. Duan Y. Jiao S. Qiao Acidic CO2-to-HCOOH electrolysis with industrial-level current on phase engineered tin sulfide Nat. Commun. 14 1 2023 2843 10.1038/s41467-023-38497-3 H. Shen, H. Jin, H. Li, H. Wang, J. Duan, Y. Jiao, S. Qiao, Acidic CO2-to-HCOOH electrolysis with industrial-level current on phase engineered tin sulfide, Nat. Commun. 14 (1) (2023) 2843. http://doi.org/10.1038/s41467-023-38497-3. [66] X. Feng R. Zheng C. Gao W. Wei J. Peng R. Wang S. Yang W. Zou X. Wu Y. Ji H. Chen Unlocking bimetallic active sites via a desalination strategy for photocatalytic reduction of atmospheric carbon dioxide Nat. Commun. 13 1 2022 2146 10.1038/s41467-022-29671-0 X. Feng, R. Zheng, C. Gao, W. Wei, J. Peng, R. Wang, S. Yang, W. Zou, X. Wu, Y. Ji, H. Chen, Unlocking bimetallic active sites via a desalination strategy for photocatalytic reduction of atmospheric carbon dioxide, Nat. Commun. 13 (1) (2022) 2146. http://doi.org/10.1038/s41467-022-29671-0. [67] F. Ma P. Zhang X. Zheng L. Chen Y. Li Z. Zhuang Y. Fan P. Jiang H. Zhao J. Zhang Y. Dong Y. Zhu D. Wang Y. Wang Steering the site distance of atomic Cu-Cu pairs by first-shell halogen coordination boosts CO2-to-C2 selectivity Angew. Chem. Int. Ed. 63 46 2024 e202412785 10.1002/anie.202412785 F. Ma, P. Zhang, X. Zheng, L. Chen, Y. Li, Z. Zhuang, Y. Fan, P. Jiang, H. Zhao, J. Zhang, Y. Dong, Y. Zhu, D. Wang, Y. Wang, Steering the site distance of atomic Cu-Cu pairs by first-shell halogen coordination boosts CO2-to-C2 selectivity, Angew. Chem. Int. Ed. 63 (46) (2024) e202412785. http://doi.org/https://doi.org/10.1002/anie.202412785. [68] W. Xiang J. Ren S. Chen C. Shen Y. Chen M. Zhang C.-j Liu The metal-organic framework UiO-66 with missing-linker defects: a highly active catalyst for carbon dioxide cycloaddition Appl. Energy 277 2020 115560 10.1016/j.apenergy.2020.115560 W. Xiang, J. Ren, S. Chen, C. Shen, Y. Chen, M. Zhang, C.-j Liu, The metal-organic framework UiO-66 with missing-linker defects: A highly active catalyst for carbon dioxide cycloaddition, Appl. Energy 277 (2020) 115560. http://doi.org/10.1016/j.apenergy.2020.115560. [69] Y. Lu Z. Ke Strategies for the preparation of single-atom catalysts using low-dimensional metal-organic frameworks Small 20 42 2024 2403767 10.1002/smll.202403767 Y. Lu, Z. Ke, Strategies for the preparation of single-atom catalysts using low-dimensional metal-organic frameworks, Small 20 (42) (2024) 2403767. http://doi.org/10.1002/smll.202403767. [70] H. Huang K. Shen F. Chen Y. Li Metal-organic frameworks as a good platform for the fabrication of single-atom catalysts ACS Catal. 10 12 2020 6579 6586 10.1021/acscatal.0c01459 H. Huang, K. Shen, F. Chen, Y. Li, Metal-organic frameworks as a good platform for the fabrication of single-atom catalysts, ACS Catal. 10 (12) (2020) 6579-6586. http://doi.org/10.1021/acscatal.0c01459. [71] Z. Liang C. Qu D. Xia R. Zou Q. Xu Atomically dispersed metal sites in MOF-based materials for electrocatalytic and photocatalytic energy conversion Angew. Chem. Int. Ed. 57 31 2018 9604 9633 10.1002/anie.201800269 Z. Liang, C. Qu, D. Xia, R. Zou, Q. Xu, Atomically dispersed metal sites in MOF-based materials for electrocatalytic and photocatalytic energy conversion, Angew. Chem. Int. Ed. 57 (31) (2018) 9604-9633. http://doi.org/10.1002/anie.201800269. [72] X. Yang A. Wang B. Qiao J. Li J. Liu T. Zhang Single atom catalysts: a new frontier in heterogeneous catalysis Acc. Chem. Res. 46 8 2013 1740 1748 10.1021/ar300361m X. Yang, A. Wang, B. Qiao, J. Li, J. Liu, T. Zhang, Single atom catalysts: A new frontier in heterogeneous catalysis, Acc. Chem. Res. 46 (8) (2013) 1740-1748. [73] S. Yuan J. Zhang L. Hu J. Li S. Li Y. Gao Q. Zhang L. Gu W. Yang X. Feng B. Wang Decarboxylation-induced defects in MOF-derived single cobalt atom@carbon electrocatalysts for efficient oxygen reduction Angew. Chem. Int. Ed. 60 40 2021 21685 21690 10.1002/anie.202107053 S. Yuan, J. Zhang, L. Hu, J. Li, S. Li, Y. Gao, Q. Zhang, L. Gu, W. Yang, X. Feng, B. Wang, Decarboxylation-induced defects in MOF-derived single cobalt atom@carbon electrocatalysts for efficient oxygen reduction, Angew. Chem. Int. Ed. 60 (40) (2021) 21685-21690. http://doi.org/10.1002/anie.202107053. [74] Y. Ying B. Khezri J. Kosina M. Pumera Reconstructed bismuth-based metal-organic framework nanofibers for selective CO2-to-formate conversion: morphology engineering ChemSusChem 14 16 2021 3402 3412 10.1002/cssc.202101122 Y. Ying, B. Khezri, J. Kosina, M. Pumera, Reconstructed bismuth-based metal-organic framework nanofibers for selective CO2-to-formate conversion: Morphology engineering, ChemSusChem 14 (16) (2021) 3402-3412. http://doi.org/10.1002/cssc.202101122. [75] E.P. GómezOliveira D. ReinaresFisac L.M. AguirreDíaz F. EstebanBetegón M. PintadoSierra E. GutiérrezPuebla M. Iglesias M. Ángeles Monge F. Gándara Framework adaptability and concerted structural response in a bismuth metal-organic framework catalyst Angew. Chem. Int. Ed. 61 37 2022 e202209335 10.1002/anie.202209335 E.P. GómezOliveira, D. ReinaresFisac, L.M. AguirreDíaz, F. EstebanBetegón, M. PintadoSierra, E. GutiérrezPuebla, M. Iglesias, M. Ángeles Monge, F. Gándara, Framework adaptability and concerted structural response in a bismuth metal-organic framework catalyst, Angew. Chem. Int. Ed. 61 (37) (2022) e202209335. http://doi.org/10.1002/anie.202209335. [76] X. Chen R. Lu C. Li W. Luo R. Yu J. Zhu L. Lv Y. Dai S. Gong Y. Zhou W. Xiong J. Wu H. Cai X. Wu Z. Deng B. Xing L. Su F. Wang F. Chao W. Chen C. Xia Z. Wang L. Mai Activating inert non-defect sites in Bi catalysts using tensile strain engineering for highly active CO2 electroreduction Nat. Commun. 16 1 2025 1927 10.1038/s41467-025-56975-8 X. Chen, R. Lu, C. Li, W. Luo, R. Yu, J. Zhu, L. Lv, Y. Dai, S. Gong, Y. Zhou, W. Xiong, J. Wu, H. Cai, X. Wu, Z. Deng, B. Xing, L. Su, F. Wang, F. Chao, W. Chen, C. Xia, Z. Wang, L. Mai, Activating inert non-defect sites in Bi catalysts using tensile strain engineering for highly active CO2 electroreduction, Nat. Commun. 16 (1) (2025) 1927. http://doi.org/10.1038/s41467-025-56975-8. [77] L. Wang S.E. Saji L. Wu Z. Wang Z. Chen Y. Du X. Yu H. Zhao Z. Yin Emerging synthesis strategies of 2D MOFs for electrical devices and integrated circuits Small 18 33 2022 2201642 10.1002/smll.202201642 L. Wang, S.E. Saji, L. Wu, Z. Wang, Z. Chen, Y. Du, X. Yu, H. Zhao, Z. Yin, Emerging synthesis strategies of 2D MOFs for electrical devices and integrated circuits, Small 18 (33) (2022) 2201642. http://doi.org/10.1002/smll.202201642. [78] C. Lu R. Fang X. Chen Single-atom catalytic materials for advanced battery systems Adv. Mater. 32 16 2020 1906548 10.1002/adma.201906548 C. Lu, R. Fang, X. Chen, Single-atom catalytic materials for advanced battery systems, Adv. Mater. 32 (16) (2020) 1906548. http://doi.org/10.1002/adma.201906548. [79] H. Zhang W. Zhang F. Huang Graphene inducing graphitization: towards a hard carbon anode with ultrahigh initial coulombic efficiency for sodium storage Chem. Eng. J. 434 2022 134503 10.1016/j.cej.2022.134503 H. Zhang, W. Zhang, F. Huang, Graphene inducing graphitization: Towards a hard carbon anode with ultrahigh initial coulombic efficiency for sodium storage, Chem. Eng. J. 434 (2022) 134503. http://doi.org/10.1016/j.cej.2022.134503. [80] P. R. G Hard and soft acids and base J. Am. Chem. Soc. 85 22 1963 3533 3539 10.1021/ja00905a001 P. R. G., Hard and soft acids and base, J. Am. Chem. Soc. 85 (22) (1963) 3533-3539. http://doi.org/10.1021/ja00905a001. [81] Z. Jiang M. Zhang X. Chen B. Wang W. Fan C. Yang X. Yang Z. Zhang X. Yang C. Li T. Zhou A bismuth-based zeolitic organic framework with coordination-linked metal cages for efficient electrocatalytic CO2 reduction to HCOOH Angew. Chem. Int. Ed. 62 45 2023 e202311223 10.1002/anie.202311223 Z. Jiang, M. Zhang, X. Chen, B. Wang, W. Fan, C. Yang, X. Yang, Z. Zhang, X. Yang, C. Li, T. Zhou, A bismuth-based zeolitic organic framework with coordination-linked metal cages for efficient electrocatalytic CO2 reduction to HCOOH, Angew. Chem. Int. Ed. 62 (45) (2023) e202311223. http://doi.org/10.1002/anie.202311223. [82] S. Mukhopadhyay M.S. Naeem G. Shiva Shanker A. Ghatak A.R. Kottaichamy R. Shimoni L. Avram I. Liberman R. Balilty R. Ifraemov I. Rozenberg M. Shalom N. López I. Hod Local CO2 reservoir layer promotes rapid and selective electrochemical CO2 reduction Nat. Commun. 15 1 2024 3397 10.1038/s41467-024-47498-9 S. Mukhopadhyay, M.S. Naeem, G. Shiva Shanker, A. Ghatak, A.R. Kottaichamy, R. Shimoni, L. Avram, I. Liberman, R. Balilty, R. Ifraemov, I. Rozenberg, M. Shalom, N. López, I. Hod, Local CO2 reservoir layer promotes rapid and selective electrochemical CO2 reduction, Nat. Commun. 15 (1) (2024) 3397. http://doi.org/10.1038/s41467-024-47498-9. [83] Z. Gao M. Hou Y. Shi L. Li Q. Sun S. Yang Z. Jiang W. Yang Z. Zhang W. Hu A conductive catecholate-based framework coordinated with unsaturated bismuth boosts CO2 electroreduction to formate Chem. Sci. 14 25 2023 6860 6866 10.1039/d3sc01876h Z. Gao, M. Hou, Y. Shi, L. Li, Q. Sun, S. Yang, Z. Jiang, W. Yang, Z. Zhang, W. Hu, A conductive catecholate-based framework coordinated with unsaturated bismuth boosts CO2 electroreduction to formate, Chem. Sci. 14 (25) (2023) 6860-6866. http://doi.org/10.1039/d3sc01876h. [84] V. RubioGiménez M. Galbiati J. CastellsGil N. AlmoraBarrios J. NavarroSánchez G. EscorciaAriza M. Mattera T. Arnold J. Rawle S. Tatay E. Coronado C. Martí-Gastaldo Bottom-up fabrication of semiconductive metal-organic framework ultrathin films Adv. Mater. 30 10 2018 1704291 10.1002/adma.201704291 V. RubioGiménez, M. Galbiati, J. CastellsGil, N. AlmoraBarrios, J. NavarroSánchez, G. EscorciaAriza, M. Mattera, T. Arnold, J. Rawle, S. Tatay, E. Coronado, C. Martí-Gastaldo, Bottom-up fabrication of semiconductive metal-organic framework ultrathin films, Adv. Mater. 30 (10) (2018) 1704291. http://doi.org/10.1002/adma.201704291. [85] N. Wang R.K. Miao G. Lee A. Vomiero D. Sinton A.H. Ip H. Liang E.H. Sargent Suppressing the liquid product crossover in electrochemical CO2 reduction SmartMat 2 1 2021 12 16 10.1002/smm2.1018 N. Wang, R.K. Miao, G. Lee, A. Vomiero, D. Sinton, A.H. Ip, H. Liang, E.H. Sargent, Suppressing the liquid product crossover in electrochemical CO2 reduction, SmartMat 2 (1) (2021) 12-16. http://doi.org/10.1002/smm2.1018. [86] X. Guan F. Chen Q. Fang S. Qiu Design and applications of three dimensional covalent organic frameworks Chem. Soc. Rev. 49 5 2020 1357 1384 10.1039/c9cs00911f X. Guan, F. Chen, Q. Fang, S. Qiu, Design and applications of three dimensional covalent organic frameworks, Chem. Soc. Rev. 49 (5) (2020) 1357-1384. http://doi.org/10.1039/c9cs00911f. [87] X. Zhao P. Pachfule S. Li T. Langenhahn M. Ye C. Schlesiger S. Praetz J. Schmidt A. Thomas Macro/microporous covalent organic frameworks for efficient electrocatalysis J. Am. Chem. Soc. 141 16 2019 6623 6630 10.1021/jacs.9b01226 X. Zhao, P. Pachfule, S. Li, T. Langenhahn, M. Ye, C. Schlesiger, S. Praetz, J. Schmidt, A. Thomas, Macro/microporous covalent organic frameworks for efficient electrocatalysis, J. Am. Chem. Soc. 141 (16) (2019) 6623-6630. http://doi.org/10.1021/jacs.9b01226. [88] W. Tu Y. Xu S. Yin R. Xu Rational design of catalytic centers in crystalline frameworks Adv. Mater. 30 33 2018 1707582 10.1002/adma.201707582 W. Tu, Y. Xu, S. Yin, R. Xu, Rational design of catalytic centers in crystalline frameworks, Adv. Mater. 30 (33) (2018) 1707582. http://doi.org/10.1002/adma.201707582. [89] X. Cui S. Lei A.C. Wang L. Gao Q. Zhang Y. Yang Z. Lin Emerging covalent organic frameworks tailored materials for electrocatalysis Nano Energy 70 2020 104525 10.1016/j.nanoen.2020.104525 X. Cui, S. Lei, A.C. Wang, L. Gao, Q. Zhang, Y. Yang, Z. Lin, Emerging covalent organic frameworks tailored materials for electrocatalysis, Nano Energy 70 (2020) 104525. http://doi.org/10.1016/j.nanoen.2020.104525. [90] F. Wang H. Xie T. Liu Y. Wu B. Chen Highly dispersed CuFe-nitrogen active sites electrode for synergistic electrochemical CO2 reduction at low overpotential Appl. Energy 269 2020 115029 10.1016/j.apenergy.2020.115029 F. Wang, H. Xie, T. Liu, Y. Wu, B. Chen, Highly dispersed CuFe-nitrogen active sites electrode for synergistic electrochemical CO2 reduction at low overpotential, Appl. Energy 269 (2020) 115029. http://doi.org/10.1016/j.apenergy.2020.115029. [91] Q. Niu L. Mi W. Chen Q. Li S. Zhong Y. Yu L. Li Review of covalent organic frameworks for single-site photocatalysis and electrocatalysis Chin. J. Catal. 50 2023 45 82 10.1016/S1872-2067(23)64457-2 Q. Niu, L. Mi, W. Chen, Q. Li, S. Zhong, Y. Yu, L. Li, Review of covalent organic frameworks for single-site photocatalysis and electrocatalysis, Chinese Journal of Catalysis 50 (2023) 45-82. http://doi.org/10.1016/S1872-2067(23)64457-2. [92] L. Chen M. Li J.-N. Zhang Tailoring microenvironment for efficient CO2 electroreduction through nanoconfinement strategy Nano Res 17 9 2024 7880 7899 10.1007/s12274-024-6870-4 L. Chen, M. Li, J.-N. Zhang, Tailoring microenvironment for efficient CO2 electroreduction through nanoconfinement strategy, Nano Res. 17 (9) (2024) 7880-7899. http://doi.org/10.1007/s12274-024-6870-4. [93] H. Wang R. Sun P. Liu H. Hu C. Ling X. Han Y. Shi X. Zheng G. Wu X. Hong Interstitial carbon induces enriched Cuδ+ sites in Cu2O nanoparticles to facilitate CO2 electroreduction to C2+ products Nano Res 17 8 2024 7013 7019 10.1007/s12274-024-6731-1 H. Wang, R. Sun, P. Liu, H. Hu, C. Ling, X. Han, Y. Shi, X. Zheng, G. Wu, X. Hong, Interstitial carbon induces enriched Cuδ+ sites in Cu2O nanoparticles to facilitate CO2 electroreduction to C2+ products, Nano Res. 17 (8) (2024) 7013-7019. http://doi.org/10.1007/s12274-024-6731-1. [94] S. Chen X. Zheng P. Zhu Y. Li Z. Zhuang H. Wu J. Zhu C. Xiao M. Chen P. Wang D. Wang Y. He Copper atom pairs stabilize *OCCO dipole toward highly selective CO2 electroreduction to C2H4 Angew. Chem. Int. Ed. 63 50 2024 e202411591 10.1002/anie.202411591 S. Chen, X. Zheng, P. Zhu, Y. Li, Z. Zhuang, H. Wu, J. Zhu, C. Xiao, M. Chen, P. Wang, D. Wang, Y. He, Copper atom pairs stabilize *OCCO dipole toward highly selective CO2 electroreduction to C2H4, Angew. Chem. Int. Ed. 63 (50) (2024) e202411591. http://doi.org/10.1002/anie.202411591. [95] S. Pakhira J.L. Mendoza-Cortes Intercalation of first row transition metals inside covalent-organic frameworks (COFs): a strategy to fine tune the electronic properties of porous crystalline materials Phys. Chem. Chem. Phys. 21 17 2019 8785 8796 10.1039/c8cp07396a S. Pakhira, J.L. Mendoza-Cortes, Intercalation of first row transition metals inside covalent-organic frameworks (COFs): A strategy to fine tune the electronic properties of porous crystalline materials, Physical Chemistry Chemical Physics 21 (17) (2019) 8785-8796. http://doi.org/10.1039/c8cp07396a. [96] N. Sinha S. Pakhira Tunability of the electronic properties of covalent organic frameworks ACS Appl. Electron. Mater. 3 2 2021 720 732 10.1021/acsaelm.0c00867 N. Sinha, S. Pakhira, Tunability of the electronic properties of covalent organic frameworks, ACS Appl. Electron. Mater. 3 (2) (2021) 720-732. http://doi.org/10.1021/acsaelm.0c00867. [97] A. Hayat S. Raza M.A. Amin Z. Ajmal M.M. Alghamdi A.A. El-Zahhar H. Ali D. Ghernaout Y. Al-Hadeethi M. Sohail Y. Orooji Developing new-generation covalent organic frameworks as sustainable catalysts: synthesis, properties, types and solar energy production Mat. Sci. Eng. R. 157 2024 100771 10.1016/j.mser.2024.100771 A. Hayat, S. Raza, M.A. Amin, Z. Ajmal, M.M. Alghamdi, A.A. El-Zahhar, H. Ali, D. Ghernaout, Y. Al-Hadeethi, M. Sohail, Y. Orooji, Developing new-generation covalent organic frameworks as sustainable catalysts: Synthesis, properties, types and solar energy production, Mat Sci. Eng. R. 157 (2024) 100771. http://doi.org/10.1016/j.mser.2024.100771. [98] F. Gao Z. Ding S. Meng Three-dimensional metal-intercalated covalent organic frameworks for near-ambient energy storage Sci. Rep. 3 1 2013 1882 10.1038/srep01882 F. Gao, Z. Ding, S. Meng, Three-dimensional metal-intercalated covalent organic frameworks for near-ambient energy storage, Sci. Rep. 3 (1) (2013) 1882 http://doi.org/10.1038/srep01882. [99] Y. Jia L. Zhang A. Du G. Gao J. Chen X. Yan C.L. Brown X. Yao Defect graphene as a trifunctional catalyst for electrochemical reactions Adv. Mater. 28 43 2016 9532 9538 10.1002/adma.201602912 Y. Jia, L. Zhang, A. Du, G. Gao, J. Chen, X. Yan, C.L. Brown, X. Yao, Defect graphene as a trifunctional catalyst for electrochemical reactions, Adv. Mater. 28 (43) (2016) 9532-9538. http://doi.org/10.1002/adma.201602912. [100] S. Ali R. Iqbal F. Wahid P.M. Ismail A. Saleem S. Ali F. Raziq S. Ullah I. Ullah Tahir M. Zahoor X. Wu H. Xiao X. Zu L. Qiao Cobalt coordinated two-dimensional covalent organic framework a sustainable and robust electrocatalyst for selective CO2 electrochemical conversion to formic acid Fuel Process. Technol. 237 2022 107451 10.1016/j.fuproc.2022.107451 S. Ali, R. Iqbal, F. Wahid, P.M. Ismail, A. Saleem, S. Ali, F. Raziq, S. Ullah, I. Ullah, Tahir, M. Zahoor, X. Wu, H. Xiao, X. Zu, L. Qiao, Cobalt coordinated two-dimensional covalent organic framework a sustainable and robust electrocatalyst for selective CO2 electrochemical conversion to formic acid, Fuel Process. Technol. 237 (2022) 107451. http://doi.org/10.1016/j.fuproc.2022.107451. [101] Q. Miao C. Lu Q. Xu S. Yang M. Liu S. Liu C. Yu X. Zhuang Z. Jiang G. Zeng CoN2O2 sites in carbon nanosheets by template-pyrolysis of COFs for CO2RR Chem. Eng. J. 450 2022 138427 10.1016/j.cej.2022.138427 Q. Miao, C. Lu, Q. Xu, S. Yang, M. Liu, S. Liu, C. Yu, X. Zhuang, Z. Jiang, G. Zeng, CoN2O2 sites in carbon nanosheets by template-pyrolysis of COFs for CO2RR, Chem. Eng. J. 450 (2022) 138427. http://doi.org/10.1016/j.cej.2022.138427. [102] M. Liu S. Yang X. Yang C.-X. Cui G. Liu X. Li J. He G.Z. Chen Q. Xu G. Zeng Post-synthetic modification of covalent organic frameworks for CO2 electroreduction Nat. Commun. 14 1 2023 3800 10.1038/s41467-023-39544-9 M. Liu, S. Yang, X. Yang, C.-X. Cui, G. Liu, X. Li, J. He, G.Z. Chen, Q. Xu, G. Zeng, Post-synthetic modification of covalent organic frameworks for CO2 electroreduction, Nat. Commun. 14 (1) (2023) 3800. http://doi.org/10.1038/s41467-023-39544-9. [103] R. Nankya Y. Xu A. Elgazzar P. Zhu T. Wi C. Qiu Y. Feng F. Che H. Wang Cobalt-doped bismuth nanosheet catalyst for enhanced electrochemical CO2 reduction to electrolyte-free formic acid Angew. Chem. Int. Ed. 63 36 2024 e202403671 10.1002/anie.202403671 R. Nankya, Y. Xu, A. Elgazzar, P. Zhu, T. Wi, C. Qiu, Y. Feng, F. Che, H. Wang, Cobalt-doped bismuth nanosheet catalyst for enhanced electrochemical CO2 reduction to electrolyte-free formic acid, Angew. Chem. Int. Ed. 63 (36) (2024) e202403671. http://doi.org/10.1002/anie.202403671. [104] X. Chen H. Chen W. Zhou Q. Zhang Z. Yang Z. Li F. Yang D. Wang J. Ye L. Liu Boron dopant induced electron-rich bismuth for electrochemical CO2 reduction with high solar energy conversion efficiency Small 17 29 2021 2101128 10.1002/smll.202101128 X. Chen, H. Chen, W. Zhou, Q. Zhang, Z. Yang, Z. Li, F. Yang, D. Wang, J. Ye, L. Liu, Boron dopant induced electron-rich bismuth for electrochemical CO2 reduction with high solar energy conversion efficiency, Small 17 (29) (2021) 2101128. http://doi.org/10.1002/smll.202101128. [105] Q. Wang J. Luo Z. Zhong A. Borgna CO2 capture by solid adsorbents and their applications: current status and new trends Energy Environ. Sci. 4 1 2011 42 55 10.1039/c0ee00064g Q. Wang, J. Luo, Z. Zhong, A. Borgna, CO2 capture by solid adsorbents and their applications: Current status and new trends, Energy Environ. Sci. 4 (1) (2011) 42-55. http://doi.org/10.1039/c0ee00064g. [106] G. Hao W. Li D. Qian G. Wang W. Zhang T. Zhang A. Wang F. Schüth H. Bongard A. Lu Structurally designed synthesis of mechanically stable poly(benzoxazine-co-resol)-based porous carbon monoliths and their application as high-performance CO2 capture sorbents J. Am. Chem. Soc. 133 29 2011 11378 11388 10.1021/ja203857g G. Hao, W. Li, D. Qian, G. Wang, W. Zhang, T. Zhang, A. Wang, F. Schüth, H. Bongard, A. Lu, Structurally designed synthesis of mechanically stable poly(benzoxazine-co-resol)-based porous carbon monoliths and their application as high-performance CO2 capture sorbents, J. Am. Chem. Soc. 133 (29) (2011) 11378-11388. http://doi.org/10.1021/ja203857g. [107] M. Sevilla P. ValleVigón A.B. Fuertes N-doped polypyrrole-based porous carbons for CO2 capture Adv. Funct. Mater. 21 14 2011 2781 2787 10.1002/adfm.201100291 M. Sevilla, P. ValleVigón, A.B. Fuertes, N-doped polypyrrole-based porous carbons for CO2 capture, Adv. Funct. Mater. 21 (14) (2011) 2781-2787. http://doi.org/10.1002/adfm.201100291. [108] J. Schneider H. Jia J.T. Muckerman E. Fujita Thermodynamics and kinetics of CO2, CO, and H+ binding to the metal centre of CO2 reductioncatalysts Chem. Soc. Rev. 41 6 2012 2036 2051 10.1039/c1cs15278e J. Schneider, H. Jia, J.T. Muckerman, E. Fujita, Thermodynamics and kinetics of CO2, CO, and H+ binding to the metal centre of CO2 reductioncatalysts, Chem. Soc. Rev. 41 (6) (2012) 2036-2051. http://doi.org/10.1039/c1cs15278e. [109] Z. Wang Y. Zhou D. Liu R. Qi C. Xia M. Li B. You B.Y. Xia Carbon-confined indium oxides for efficient carbon dioxide reduction in a solid-state electrolyte flow cell Angew. Chem. Int. Ed. 61 21 2022 e202200552 10.1002/anie.202200552 Z. Wang, Y. Zhou, D. Liu, R. Qi, C. Xia, M. Li, B. You, B.Y. Xia, Carbon-confined indium oxides for efficient carbon dioxide reduction in a solid-state electrolyte flow cell, Angew. Chem. Int. Ed. 61 (21) (2022) e202200552. http://doi.org/10.1002/anie.202200552. [110] F. Pan B. Li E. Sarnello S. Hwang Y. Gang X. Feng X. Xiang N.M. Adli T. Li D. Su G. Wu G. Wang Y. Li Boosting CO2 reduction on Fe-N-C with sulfur incorporation: Synergistic electronic and structural engineering Nano Energy 68 2020 104384 10.1016/j.nanoen.2019.104384 F. Pan, B. Li, E. Sarnello, S. Hwang, Y. Gang, X. Feng, X. Xiang, N.M. Adli, T. Li, D. Su, G. Wu, G. Wang, Y. Li, Boosting CO2 reduction on Fe-N-C with sulfur incorporation: Synergistic electronic and structural engineering, Nano Energy 68 (2020) 104384. http://doi.org/10.1016/j.nanoen.2019.104384. [111] H. Zhang J. Wang Z. Zhao H. Zhao M. Cheng A. Li C. Wang J. Wang J. Wang The synthesis of atomic Fe embedded in bamboo-CNTs grown on graphene as a superior CO2 electrocatalyst Green. Chem. 20 15 2018 3521 3529 10.1039/c8gc01466c H. Zhang, J. Wang, Z. Zhao, H. Zhao, M. Cheng, A. Li, C. Wang, J. Wang, J. Wang, The synthesis of atomic Fe embedded in bamboo-CNTs grown on graphene as a superior CO2 electrocatalyst, Green Chem. 20 (15) (2018) 3521-3529. http://doi.org/10.1039/c8gc01466c. [112] J. Bi P. Li J. Liu Y. Wang X. Song X. Kang X. Sun Q. Zhu B. Han High-rate CO2 electrolysis to formic acid over a wide potential window: an electrocatalyst comprised of indium nanoparticles on chitosan-derived graphene Angew. Chem. Int. Ed. 62 36 2023 e202307612 10.1002/anie.202307612 J. Bi, P. Li, J. Liu, Y. Wang, X. Song, X. Kang, X. Sun, Q. Zhu, B. Han, High-rate CO2 electrolysis to formic acid over a wide potential window: An electrocatalyst comprised of indium nanoparticles on chitosan-derived graphene, Angew. Chem. Int. Ed. 62 (36) (2023) e202307612. http://doi.org/10.1002/anie.202307612. [113] W. Li C. Yu X. Tan S. Cui Y. Zhang J. Qiu Recent advances in the electroreduction of carbon dioxide to formic acid over carbon-based materials New Carbon Mater. 37 2 2022 277 287 10.1016/s1872-5805(22)60592-4 W. Li, C. Yu, X. Tan, S. Cui, Y. Zhang, J. Qiu, Recent advances in the electroreduction of carbon dioxide to formic acid over carbon-based materials, New Carbon Mater. 37 (2) (2022) 277-287. http://doi.org/10.1016/s1872-5805(22)60592-4. [114] L. Lv R. Lu J. Zhu R. Yu W. Zhang E. Cui X. Chen Y. Dai L. Cui J. Li L. Zhou W. Chen Z. Wang L. Mai Coordinating the edge defects of bismuth with sulfur for enhanced CO2 electroreduction to formate Angew. Chem. Int. Ed. 62 25 2023 e202303117 10.1002/anie.202303117 L. Lv, R. Lu, J. Zhu, R. Yu, W. Zhang, E. Cui, X. Chen, Y. Dai, L. Cui, J. Li, L. Zhou, W. Chen, Z. Wang, L. Mai, Coordinating the edge defects of bismuth with sulfur for enhanced CO2 electroreduction to formate, Angew. Chem. Int. Ed. 62 (25) (2023) e202303117. http://doi.org/10.1002/anie.202303117. [115] P. Lu X. Tan H. Zhao Q. Xiang K. Liu X. Zhao X. Yin X. Li X. Hai S. Xi A.T.S. Wee S.J. Pennycook X. Yu M. Yuan J. Wu G. Zhang S.C. Smith Z. Yin Atomically dispersed indium sites for selective CO2 electroreduction to formic acid ACS Nano 15 3 2021 5671 5678 10.1021/acsnano.1c00858 P. Lu, X. Tan, H. Zhao, Q. Xiang, K. Liu, X. Zhao, X. Yin, X. Li, X. Hai, S. Xi, A.T. S. Wee, S.J. Pennycook, X. Yu, M. Yuan, J. Wu, G. Zhang, S.C. Smith, Z. Yin, Atomically dispersed indium sites for selective CO2 electroreduction to formic acid, ACS Nano 15 (3) (2021) 5671-5678. http://doi.org/10.1021/acsnano.1c00858. [116] Y. Wang H. Su Y. He L. Li S. Zhu H. Shen P. Xie X. Fu G. Zhou C. Feng D. Zhao F. Xiao X. Zhu Y. Zeng M. Shao S. Chen G. Wu J. Zeng C. Wang Advanced electrocatalysts with single-metal-atom active sites Chem. Rev. 120 21 2020 12217 12314 10.1021/acs.chemrev.0c00594 Y. Wang, H. Su, Y. He, L. Li, S. Zhu, H. Shen, P. Xie, X. Fu, G. Zhou, C. Feng, D. Zhao, F. Xiao, X. Zhu, Y. Zeng, M. Shao, S. Chen, G. Wu, J. Zeng, C. Wang, Advanced electrocatalysts with single-metal-atom active sites, Chem. Rev. 120 (21) (2020) 12217-12314. http://doi.org/10.1021/acs.chemrev.0c00594. [117] L. An R. Chen Direct formate fuel cells: a review J. Power Sources 320 2016 127 139 10.1016/j.jpowsour.2016.04.082 L. An, R. Chen, Direct formate fuel cells: A review, J. Power Sources 320 (2016) 127-139. http://doi.org/10.1016/j.jpowsour.2016.04.082. [118] J. Eppinger K. Huang Formic acid as a hydrogen energy carrier ACS Energy Lett. 2 1 2016 188 195 10.1021/acsenergylett.6b00574 J. Eppinger, K. Huang, Formic acid as a hydrogen energy carrier, ACS Energy Lett. 2 (1) (2016) 188-195. http://doi.org/10.1021/acsenergylett.6b00574. [119] Z. Ma U. Legrand E. Pahija J.R. Tavares D.C. Boffito From CO2 to formic acid fuel cells Ind. Eng. Chem. Res. 60 2 2020 803 815 10.1021/acs.iecr.0c04711 Z. Ma, U. Legrand, E. Pahija, J.R. Tavares, D.C. Boffito, From CO2 to formic acid fuel cells, Ind. Eng. Chem. Res. 60 (2) (2020) 803-815. http://doi.org/10.1021/acs.iecr.0c04711. [120] B. Jia Z. Chen C. Li Z. Li X. Zhou T. Wang W. Yang L. Sun B. Zhang Indium cyanamide for industrial-grade CO2 electroreduction to formic acid J. Am. Chem. Soc. 145 25 2023 14101 14111 10.1021/jacs.3c04288 B. Jia, Z. Chen, C. Li, Z. Li, X. Zhou, T. Wang, W. Yang, L. Sun, B. Zhang, Indium cyanamide for industrial-grade CO2 electroreduction to formic acid, J. Am. Chem. Soc. 145 (25) (2023) 14101-14111. http://doi.org/10.1021/jacs.3c04288. [121] F. Yang A.O. Elnabawy R. Schimmenti P. Song J. Wang Z. Peng S. Yao R. Deng S. Song Y. Lin M. Mavrikakis W. Xu Bismuthene for highly efficient carbon dioxide electroreduction reaction Nat. Commun. 11 1 2020 1088 10.1038/s41467-020-14914-9 F. Yang, A.O. Elnabawy, R. Schimmenti, P. Song, J. Wang, Z. Peng, S. Yao, R. Deng, S. Song, Y. Lin, M. Mavrikakis, W. Xu, Bismuthene for highly efficient carbon dioxide electroreduction reaction, Nat. Commun. 11 (1) (2020) 1088. http://doi.org/10.1038/s41467-020-14914-9. [122] C. Xu Y. Dong H. Zhao Y. Lei CO2 conversion toward real-world applications: electrocatalysis versus CO2 batteries Adv. Funct. Mater. 33 32 2023 2300926 10.1002/adfm.202300926 C. Xu, Y. Dong, H. Zhao, Y. Lei, CO2 conversion toward real-world applications: Electrocatalysis versus CO2 batteries, Adv. Funct. Mater. 33 (32) (2023) 2300926. http://doi.org/10.1002/adfm.202300926. [123] J. Xue X. Dong C. Liu J. Li Y. Dai W. Xue L. Luo Y. Ji X. Zhang X. Li Q. Jiang T. Zheng J. Xiao C. Xia Turning copper into an efficient and stable CO evolution catalyst beyond noble metals Nat. Commun. 15 1 2024 5998 10.1038/s41467-024-50436-4 J. Xue, X. Dong, C. Liu, J. Li, Y. Dai, W. Xue, L. Luo, Y. Ji, X. Zhang, X. Li, Q. Jiang, T. Zheng, J. Xiao, C. Xia, Turning copper into an efficient and stable CO evolution catalyst beyond noble metals, Nat. Commun. 15 (1) (2024) 5998. http://doi.org/10.1038/s41467-024-50436-4. [124] T.J. Wang L.B. Sun X. Ai P. Chen Y. Chen X. Wang Boosting formate electrooxidation by heterostructured PtPd alloy and oxides nanowires Adv. Mater. 36 27 2024 2403664 10.1002/adma.202403664 T.J. Wang, L.B. Sun, X. Ai, P. Chen, Y. Chen, X. Wang, Boosting formate electrooxidation by heterostructured PtPd alloy and oxides nanowires, Adv. Mater. 36 (27) (2024) 2403664. http://doi.org/10.1002/adma.202403664. [125] X. Hu Z. Xiao W. Wang L. Bu Z. An S. Liu C. Pao C. Zhan Z. Hu Z. Yang Y. Wang X. Huang Platinum-lead-bismuth/platinum-bismuth core/shell nanoplate achieves complete dehydrogenation pathway for direct formic acid oxidation catalysis J. Am. Chem. Soc. 145 28 2023 15109 15117 10.1021/jacs.3c00262 X. Hu, Z. Xiao, W. Wang, L. Bu, Z. An, S. Liu, C. Pao, C. Zhan, Z. Hu, Z. Yang, Y. Wang, X. Huang, Platinum-lead-bismuth/platinum-bismuth core/shell nanoplate achieves complete dehydrogenation pathway for direct formic acid oxidation catalysis, J. Am. Chem. Soc. 145 (28) (2023) 15109-15117. http://doi.org/10.1021/jacs.3c00262. [126] X. Wang K. Klingan M. Klingenhof T. Möller J. Ferreira de Araújo I. Martens A. Bagger S. Jiang J. Rossmeisl H. Dau P. Strasser Morphology and mechanism of highly selective Cu(II) oxide nanosheet catalysts for carbon dioxide electroreduction Nat. Commun. 12 1 2021 794 10.1038/s41467-021-20961-7 X. Wang, K. Klingan, M. Klingenhof, T. Möller, J. Ferreira de Araújo, I. Martens, A. Bagger, S. Jiang, J. Rossmeisl, H. Dau, P. Strasser, Morphology and mechanism of highly selective Cu(II) oxide nanosheet catalysts for carbon dioxide electroreduction, Nat. Commun. 12 (1) (2021) 794. http://doi.org/10.1038/s41467-021-20961-7. [127] X. Yu Y. Xu L. Li M. Zhang W. Qin F. Che M. Zhong Coverage enhancement accelerates acidic CO2 electrolysis at ampere-level current with high energy and carbon efficiencies Nat. Commun. 15 1 2024 1711 10.1038/s41467-024-45988-4 X. Yu, Y. Xu, L. Li, M. Zhang, W. Qin, F. Che, M. Zhong, Coverage enhancement accelerates acidic CO2 electrolysis at ampere-level current with high energy and carbon efficiencies, Nat. Commun. 15 (1) (2024) 1711. http://doi.org/10.1038/s41467-024-45988-4. [128] S.Z. Rejal M.S. Masdar S.K. Kamarudin A parametric study of the direct formic acid fuel cell (DFAFC) performance and fuel crossover Int. J. Hydrog. Energy 39 19 2014 10267 10274 10.1016/j.ijhydene.2014.04.149 S.Z. Rejal, M.S. Masdar, S.K. Kamarudin, A parametric study of the direct formic acid fuel cell (DFAFC) performance and fuel crossover, Int. J. Hydrogen Energy 39 (19) (2014) 10267-10274. http://doi.org/10.1016/j.ijhydene.2014.04.149. [129] R.A. Tufa D. Chanda M. Ma D. Aili T.B. Demissie J. Vaes Q. Li S. Liu D. Pant Towards highly efficient electrochemical CO2 reduction: cell designs, membranes and electrocatalysts Appl. Energy 277 2020 115557 10.1016/j.apenergy.2020.115557 R.A. Tufa, D. Chanda, M. Ma, D. Aili, T.B. Demissie, J. Vaes, Q. Li, S. Liu, D. Pant, Towards highly efficient electrochemical CO2 reduction: Cell designs, membranes and electrocatalysts, Appl. Energy 277 (2020) 115557. http://doi.org/10.1016/j.apenergy.2020.115557. [130] P. Waszczuk T.M. Barnard C. Rice R.I. Masel A. Wieckowski A nanoparticle catalyst with superior activity for electrooxidation of formic acid Electrochem. Commun. 4 2002 599 603 P. Waszczuk, T.M. Barnard, C. Rice, R.I. Masel, A. Wieckowski, A nanoparticle catalyst with superior activity for electrooxidation of formic acid, Electrochem. Commun. 4 (2002) 599-603. [131] Y. Suo I.M. Hsing Size-controlled synthesis and impedance-based mechanistic understanding of Pd/C nanoparticles for formic acid oxidation Electrochim. Acta 55 1 2009 210 217 10.1016/j.electacta.2009.08.039 Y. Suo, I.M. Hsing, Size-controlled synthesis and impedance-based mechanistic understanding of Pd/C nanoparticles for formic acid oxidation, Electrochim. Acta 55 (1) (2009) 210-217. http://doi.org/10.1016/j.electacta.2009.08.039. [132] W.J. Zhou J.Y. Lee Particle size effects in Pd-catalyzed electrooxidation of formic acid J. Phys. Chem. C 112 10 2008 3789 3793 Particle size effects in Pd-catalyzed electrooxidation of formic acid, J. Phys. Chem. C 112 (10) (2008) 3789-3793. [133] B.G. Abraham K.K. Maniam A. Kuniyil R. Chetty Electrocatalytic performance of palladium dendrites deposited on titania nanotubes for formic acid oxidation Fuel Cells 16 5 2016 656 661 10.1002/fuce.201600023 B.G. Abraham, K.K. Maniam, A. Kuniyil, R. Chetty, Electrocatalytic performance of palladium dendrites deposited on titania nanotubes for formic acid oxidation, Fuel Cells 16 (5) (2016) 656-661. http://doi.org/10.1002/fuce.201600023. [134] L.Y. Zhang F. Wang S. Wang H. Huang X. Meng Y. Ouyang W. Yuan C.X. Guo C.M. Li Layered and heterostructured Pd/PdWCr sheet-assembled nanoflowers as highly active and stable electrocatalysts for formic acid oxidation Adv. Funct. Mater. 30 43 2020 2003933 10.1002/adfm.202003933 L.Y. Zhang, F. Wang, S. Wang, H. Huang, X. Meng, Y. Ouyang, W. Yuan, C.X. Guo, C.M. Li, Layered and heterostructured Pd/PdWCr sheet-assembled nanoflowers as highly active and stable electrocatalysts for formic acid oxidation, Adv. Funct. Mater. 30 (43) (2020) 2003933. http://doi.org/10.1002/adfm.202003933. [135] K. Fernández-Caso G. Díaz-Sainz M. Alvarez-Guerra A. Irabien Electroreduction of CO2: Advances in the continuous production of formic acid and formate ACS Energy Lett. 8 4 2023 1992 2024 10.1021/acsenergylett.3c00489 K. Fernández-Caso, G. Díaz-Sainz, M. Alvarez-Guerra, A. Irabien, Electroreduction of CO2: Advances in the continuous production of formic acid and formate, ACS Energy Lett. 8 (4) (2023) 1992-2024. http://doi.org/10.1021/acsenergylett.3c00489. [136] Q. Lu J. Rosen F. Jiao Nanostructured metallic electrocatalysts for carbon dioxide reduction ChemCatChem 7 1 2014 38 47 10.1002/cctc.201402669 Q. Lu, J. Rosen, F. Jiao, Nanostructured metallic electrocatalysts for carbon dioxide reduction, ChemCatChem 7 (1) (2014) 38-47. http://doi.org/10.1002/cctc.201402669. [137] P. Ganji R.A. Borse J. Xie A.G.A. Mohamed Y. Wang Toward commercial carbon dioxide electrolysis Adv. Sustain. Syst. 4 8 2020 2000096 10.1002/adsu.202000096 P. Ganji, R.A. Borse, J. Xie, A.G. A. Mohamed, Y. Wang, Toward commercial carbon dioxide electrolysis, Adv. Sustainable Syst. 4 (8) (2020) 2000096. http://doi.org/10.1002/adsu.202000096. [138] L. Fan C. Xia P. Zhu Y. Lu H. Wang Electrochemical CO2 reduction to high-concentration pure formic acid solutions in an all-solid-state reactor Nat. Commun. 11 1 2020 3633 10.1038/s41467-020-17403-1 L. Fan, C. Xia, P. Zhu, Y. Lu, H. Wang, Electrochemical CO2 reduction to high-concentration pure formic acid solutions in an all-solid-state reactor, Nat. Commun. 11 (1) (2020) 3633. http://doi.org/10.1038/s41467-020-17403-1. [139] J. Qiao Y. Liu F. Hong J. Zhang A review of catalysts for the electroreduction of carbon dioxide to produce low-carbon fuels Chem. Soc. Rev. 43 2 2014 631 675 10.1039/c3cs60323g J. Qiao, Y. Liu, F. Hong, J. Zhang, A review of catalysts for the electroreduction of carbon dioxide to produce low-carbon fuels, Chem. Soc. Rev. 43 (2) (2014) 631-675. http://doi.org/10.1039/c3cs60323g. [140] Y. Shen H. Yang Multi-objective optimization of a CO2/H2O capture-based ventilation and air conditioning system Appl. Energy 344 2023 121305 10.1016/j.apenergy.2023.121305 Y. Shen, H. Yang, Multi-objective optimization of a CO2/H2O capture-based ventilation and air conditioning system, Appl. Energy 344 (2023) 121305. http://doi.org/10.1016/j.apenergy.2023.121305. [141] Z. Wei J. Ding Z. Wang A. Wang L. Zhang Y. Liu Y. Guo X. Yang Y. Zhai B. Liu Enhanced electrochemical CO2 reduction to formate over phosphate-modified in: Water activation and active site tuning Angew. Chem. Int. Ed. 63 27 2024 e202402070 10.1002/anie.202402070 Z. Wei, J. Ding, Z. Wang, A. Wang, L. Zhang, Y. Liu, Y. Guo, X. Yang, Y. Zhai, B. Liu, Enhanced electrochemical CO2 reduction to formate over phosphate-modified in: Water activation and active site tuning, Angew. Chem. Int. Ed. 63 (27) (2024) e202402070. http://doi.org/10.1002/anie.202402070. [142] M.C.O. Monteiro F. Dattila N. López M.T.M. Koper The role of cation acidity on the competition between hydrogen evolution and CO2 reduction on gold electrodes J. Am. Chem. Soc. 144 4 2021 1589 1602 10.1021/jacs.1c10171 M.C. O. Monteiro, F. Dattila, N. López, M.T. M. Koper, The role of cation acidity on the competition between hydrogen evolution and CO2 reduction on gold electrodes, J. Am. Chem. Soc. 144 (4) (2021) 1589-1602. http://doi.org/10.1021/jacs.1c10171. [143] F. Ye S. Zhang Q. Cheng Y. Long D. Liu R. Paul Y. Fang Y. Su L. Qu L. Dai C. Hu The role of oxygen-vacancy in bifunctional indium oxyhydroxide catalysts for electrochemical coupling of biomass valorization with CO2 conversion Nat. Commun. 14 1 2023 2040 10.1038/s41467-023-37679-3 F. Ye, S. Zhang, Q. Cheng, Y. Long, D. Liu, R. Paul, Y. Fang, Y. Su, L. Qu, L. Dai, C. Hu, The role of oxygen-vacancy in bifunctional indium oxyhydroxide catalysts for electrochemical coupling of biomass valorization with CO2 conversion, Nat. Commun. 14 (1) (2023) 2040. http://doi.org/10.1038/s41467-023-37679-3. [144] W. Xi P. Yang M. Jiang X. Wang H. Zhou J. Duan M. Ratova D. Wu Electrochemical CO2 reduction coupled with alternative oxidation reactions: electrocatalysts, electrolytes, and electrolyzers Appl. Catal. B Environ. 341 2024 123291 10.1016/j.apcatb.2023.123291 W. Xi, P. Yang, M. Jiang, X. Wang, H. Zhou, J. Duan, M. Ratova, D. Wu, Electrochemical CO2 reduction coupled with alternative oxidation reactions: Electrocatalysts, electrolytes, and electrolyzers, Appl. Catal. B Environ. 341 (2024) 123291. http://doi.org/10.1016/j.apcatb.2023.123291. [145] S. Liu M. Gao S. Wu R. Feng Y. Wang L. Cui Y. Guo X. Fu J. Luo A coupled electrocatalytic system with reduced energy input for CO2 reduction and biomass valorization Energy Environ. Sci. 16 11 2023 5305 5314 10.1039/d3ee01999c S. Liu, M. Gao, S. Wu, R. Feng, Y. Wang, L. Cui, Y. Guo, X. Fu, J. Luo, A coupled electrocatalytic system with reduced energy input for CO2 reduction and biomass valorization, Energy Environ. Sci. 16 (11) (2023) 5305-5314. http://doi.org/10.1039/d3ee01999c.",
      "scopus-id": "105004265009",
      "coredata": {
        "eid": "1-s2.0-S0926860X25002315",
        "dc:description": "Electrocatalytic reaction can convert carbon dioxide (CO2) into formic acid (HCOOH), which is considered as a promising pathway for sustainable energy conversion and valuable chemicals production. Nevertheless, CO2 reduction reaction (CO2RR) to HCOOH exists high reaction potential, insufficient active site and low product selectivity. In this review, various catalysts, including metal and metal oxides, metal-organic frameworks, covalent organic frameworks and carbon-based materials, are summarized from the structure-activity relationship between electrocatalysts and CO2RR performance. Then, the regulation strategies of morphology control, defect engineering, and interface engineering, to improve the selectivity and stability of CO2RR have been successively analyzed. In addition, the practical application of CO2RR to HCOOH in electrochemical energy technologies (formic acid fuel cells and water splitting) are comprehensively discussed. Finally, the perspectives and outlook of advanced catalysts for electrochemical selectivity reduction CO2 to HCOOH are thoroughly addressed. This review will be helpful to provide new insights for designing high selective and stable CO2RR to HCOOH electrocatalysts.",
        "openArchiveArticle": "false",
        "prism:coverDate": "2025-07-05",
        "openaccessUserLicense": null,
        "prism:aggregationType": "Journal",
        "prism:url": "https://api.elsevier.com/content/article/pii/S0926860X25002315",
        "dc:creator": [
          {
            "@_fa": "true",
            "$": "Long, Xiaofeng"
          },
          {
            "@_fa": "true",
            "$": "Peng, Yujie"
          },
          {
            "@_fa": "true",
            "$": "Yu, Ze"
          },
          {
            "@_fa": "true",
            "$": "Zhang, Yuhong"
          },
          {
            "@_fa": "true",
            "$": "Jiang, Xueliang"
          },
          {
            "@_fa": "true",
            "$": "Yang, Huan"
          }
        ],
        "link": [
          {
            "@_fa": "true",
            "@rel": "self",
            "@href": "https://api.elsevier.com/content/article/pii/S0926860X25002315"
          },
          {
            "@_fa": "true",
            "@rel": "scidir",
            "@href": "https://www.sciencedirect.com/science/article/pii/S0926860X25002315"
          }
        ],
        "dc:format": "application/json",
        "openaccessType": null,
        "pii": "S0926-860X(25)00231-5",
        "prism:volume": "701",
        "articleNumber": "120330",
        "prism:publisher": "Elsevier B.V. All rights are reserved, including those for text and data mining, AI training, and similar technologies.",
        "dc:title": "Progress of advanced electrocatalysts towards electrochemical selectivity reduction CO2 to formic acid",
        "prism:copyright": "© 2025 Elsevier B.V. All rights are reserved, including those for text and data mining, AI training, and similar technologies.",
        "openaccess": "0",
        "prism:issn": "0926860X",
        "dcterms:subject": [
          {
            "@_fa": "true",
            "$": "Carbon dioxide reduction reaction"
          },
          {
            "@_fa": "true",
            "$": "Formic acid"
          },
          {
            "@_fa": "true",
            "$": "Electrocatalyst"
          },
          {
            "@_fa": "true",
            "$": "Selectivity and stability"
          },
          {
            "@_fa": "true",
            "$": "Energy technologies"
          }
        ],
        "openaccessArticle": "false",
        "prism:publicationName": "Applied Catalysis A: General",
        "openaccessSponsorType": null,
        "prism:pageRange": "120330",
        "pubType": "rev",
        "prism:coverDisplayDate": "5 July 2025",
        "prism:doi": "10.1016/j.apcata.2025.120330",
        "prism:startingPage": "120330",
        "dc:identifier": "doi:10.1016/j.apcata.2025.120330",
        "openaccessSponsorName": null
      },
      "objects": {
        "object": [
          {
            "@category": "standard",
            "@height": "751",
            "@width": "565",
            "@_fa": "true",
            "$": "https://api.elsevier.com/content/object/eid/1-s2.0-S0926860X25002315-gr2.jpg?httpAccept=%2A%2F%2A",
            "@multimediatype": "JPEG image file",
            "@type": "IMAGE-DOWNSAMPLED",
            "@size": "119321",
            "@ref": "gr2",
            "@mimetype": "image/jpeg"
          },
          {
            "@category": "standard",
            "@height": "779",
            "@width": "565",
            "@_fa": "true",
            "$": "https://api.elsevier.com/content/object/eid/1-s2.0-S0926860X25002315-gr7.jpg?httpAccept=%2A%2F%2A",
            "@multimediatype": "JPEG image file",
            "@type": "IMAGE-DOWNSAMPLED",
            "@size": "119510",
            "@ref": "gr7",
            "@mimetype": "image/jpeg"
          },
          {
            "@category": "standard",
            "@height": "245",
            "@width": "245",
            "@_fa": "true",
            "$": "https://api.elsevier.com/content/object/eid/1-s2.0-S0926860X25002315-ga1.jpg?httpAccept=%2A%2F%2A",
            "@multimediatype": "JPEG image file",
            "@type": "IMAGE-DOWNSAMPLED",
            "@size": "21967",
            "@ref": "ga1",
            "@mimetype": "image/jpeg"
          },
          {
            "@category": "standard",
            "@height": "529",
            "@width": "565",
            "@_fa": "true",
            "$": "https://api.elsevier.com/content/object/eid/1-s2.0-S0926860X25002315-gr1.jpg?httpAccept=%2A%2F%2A",
            "@multimediatype": "JPEG image file",
            "@type": "IMAGE-DOWNSAMPLED",
            "@size": "83048",
            "@ref": "gr1",
            "@mimetype": "image/jpeg"
          },
          {
            "@category": "standard",
            "@height": "718",
            "@width": "678",
            "@_fa": "true",
            "$": "https://api.elsevier.com/content/object/eid/1-s2.0-S0926860X25002315-gr4.jpg?httpAccept=%2A%2F%2A",
            "@multimediatype": "JPEG image file",
            "@type": "IMAGE-DOWNSAMPLED",
            "@size": "146310",
            "@ref": "gr4",
            "@mimetype": "image/jpeg"
          },
          {
            "@category": "standard",
            "@height": "568",
            "@width": "565",
            "@_fa": "true",
            "$": "https://api.elsevier.com/content/object/eid/1-s2.0-S0926860X25002315-gr3.jpg?httpAccept=%2A%2F%2A",
            "@multimediatype": "JPEG image file",
            "@type": "IMAGE-DOWNSAMPLED",
            "@size": "98068",
            "@ref": "gr3",
            "@mimetype": "image/jpeg"
          },
          {
            "@category": "standard",
            "@height": "693",
            "@width": "678",
            "@_fa": "true",
            "$": "https://api.elsevier.com/content/object/eid/1-s2.0-S0926860X25002315-gr6.jpg?httpAccept=%2A%2F%2A",
            "@multimediatype": "JPEG image file",
            "@type": "IMAGE-DOWNSAMPLED",
            "@size": "129168",
            "@ref": "gr6",
            "@mimetype": "image/jpeg"
          },
          {
            "@category": "standard",
            "@height": "696",
            "@width": "678",
            "@_fa": "true",
            "$": "https://api.elsevier.com/content/object/eid/1-s2.0-S0926860X25002315-gr5.jpg?httpAccept=%2A%2F%2A",
            "@multimediatype": "JPEG image file",
            "@type": "IMAGE-DOWNSAMPLED",
            "@size": "162125",
            "@ref": "gr5",
            "@mimetype": "image/jpeg"
          },
          {
            "@category": "standard",
            "@height": "644",
            "@width": "565",
            "@_fa": "true",
            "$": "https://api.elsevier.com/content/object/eid/1-s2.0-S0926860X25002315-gr8.jpg?httpAccept=%2A%2F%2A",
            "@multimediatype": "JPEG image file",
            "@type": "IMAGE-DOWNSAMPLED",
            "@size": "84982",
            "@ref": "gr8",
            "@mimetype": "image/jpeg"
          },
          {
            "@category": "thumbnail",
            "@height": "163",
            "@width": "123",
            "@_fa": "true",
            "$": "https://api.elsevier.com/content/object/eid/1-s2.0-S0926860X25002315-gr2.sml?httpAccept=%2A%2F%2A",
            "@multimediatype": "GIF image file",
            "@type": "IMAGE-THUMBNAIL",
            "@size": "10887",
            "@ref": "gr2",
            "@mimetype": "image/gif"
          },
          {
            "@category": "thumbnail",
            "@height": "164",
            "@width": "119",
            "@_fa": "true",
            "$": "https://api.elsevier.com/content/object/eid/1-s2.0-S0926860X25002315-gr7.sml?httpAccept=%2A%2F%2A",
            "@multimediatype": "GIF image file",
            "@type": "IMAGE-THUMBNAIL",
            "@size": "10534",
            "@ref": "gr7",
            "@mimetype": "image/gif"
          },
          {
            "@category": "thumbnail",
            "@height": "164",
            "@width": "164",
            "@_fa": "true",
            "$": "https://api.elsevier.com/content/object/eid/1-s2.0-S0926860X25002315-ga1.sml?httpAccept=%2A%2F%2A",
            "@multimediatype": "GIF image file",
            "@type": "IMAGE-THUMBNAIL",
            "@size": "13666",
            "@ref": "ga1",
            "@mimetype": "image/gif"
          },
          {
            "@category": "thumbnail",
            "@height": "164",
            "@width": "175",
            "@_fa": "true",
            "$": "https://api.elsevier.com/content/object/eid/1-s2.0-S0926860X25002315-gr1.sml?httpAccept=%2A%2F%2A",
            "@multimediatype": "GIF image file",
            "@type": "IMAGE-THUMBNAIL",
            "@size": "13673",
            "@ref": "gr1",
            "@mimetype": "image/gif"
          },
          {
            "@category": "thumbnail",
            "@height": "164",
            "@width": "155",
            "@_fa": "true",
            "$": "https://api.elsevier.com/content/object/eid/1-s2.0-S0926860X25002315-gr4.sml?httpAccept=%2A%2F%2A",
            "@multimediatype": "GIF image file",
            "@type": "IMAGE-THUMBNAIL",
            "@size": "13888",
            "@ref": "gr4",
            "@mimetype": "image/gif"
          },
          {
            "@category": "thumbnail",
            "@height": "164",
            "@width": "163",
            "@_fa": "true",
            "$": "https://api.elsevier.com/content/object/eid/1-s2.0-S0926860X25002315-gr3.sml?httpAccept=%2A%2F%2A",
            "@multimediatype": "GIF image file",
            "@type": "IMAGE-THUMBNAIL",
            "@size": "14200",
            "@ref": "gr3",
            "@mimetype": "image/gif"
          },
          {
            "@category": "thumbnail",
            "@height": "164",
            "@width": "160",
            "@_fa": "true",
            "$": "https://api.elsevier.com/content/object/eid/1-s2.0-S0926860X25002315-gr6.sml?httpAccept=%2A%2F%2A",
            "@multimediatype": "GIF image file",
            "@type": "IMAGE-THUMBNAIL",
            "@size": "13379",
            "@ref": "gr6",
            "@mimetype": "image/gif"
          },
          {
            "@category": "thumbnail",
            "@height": "163",
            "@width": "159",
            "@_fa": "true",
            "$": "https://api.elsevier.com/content/object/eid/1-s2.0-S0926860X25002315-gr5.sml?httpAccept=%2A%2F%2A",
            "@multimediatype": "GIF image file",
            "@type": "IMAGE-THUMBNAIL",
            "@size": "15701",
            "@ref": "gr5",
            "@mimetype": "image/gif"
          },
          {
            "@category": "thumbnail",
            "@height": "164",
            "@width": "144",
            "@_fa": "true",
            "$": "https://api.elsevier.com/content/object/eid/1-s2.0-S0926860X25002315-gr8.sml?httpAccept=%2A%2F%2A",
            "@multimediatype": "GIF image file",
            "@type": "IMAGE-THUMBNAIL",
            "@size": "10248",
            "@ref": "gr8",
            "@mimetype": "image/gif"
          },
          {
            "@category": "high",
            "@height": "3316",
            "@width": "2495",
            "@_fa": "true",
            "$": "https://api.elsevier.com/content/object/eid/1-s2.0-S0926860X25002315-gr2_lrg.jpg?httpAccept=%2A%2F%2A",
            "@multimediatype": "JPEG image file",
            "@type": "IMAGE-HIGH-RES",
            "@size": "537785",
            "@ref": "gr2",
            "@mimetype": "image/jpeg"
          },
          {
            "@category": "high",
            "@height": "3443",
            "@width": "2496",
            "@_fa": "true",
            "$": "https://api.elsevier.com/content/object/eid/1-s2.0-S0926860X25002315-gr7_lrg.jpg?httpAccept=%2A%2F%2A",
            "@multimediatype": "JPEG image file",
            "@type": "IMAGE-HIGH-RES",
            "@size": "567375",
            "@ref": "gr7",
            "@mimetype": "image/jpeg"
          },
          {
            "@category": "high",
            "@height": "1085",
            "@width": "1085",
            "@_fa": "true",
            "$": "https://api.elsevier.com/content/object/eid/1-s2.0-S0926860X25002315-ga1_lrg.jpg?httpAccept=%2A%2F%2A",
            "@multimediatype": "JPEG image file",
            "@type": "IMAGE-HIGH-RES",
            "@size": "172478",
            "@ref": "ga1",
            "@mimetype": "image/jpeg"
          },
          {
            "@category": "high",
            "@height": "2339",
            "@width": "2497",
            "@_fa": "true",
            "$": "https://api.elsevier.com/content/object/eid/1-s2.0-S0926860X25002315-gr1_lrg.jpg?httpAccept=%2A%2F%2A",
            "@multimediatype": "JPEG image file",
            "@type": "IMAGE-HIGH-RES",
            "@size": "377062",
            "@ref": "gr1",
            "@mimetype": "image/jpeg"
          },
          {
            "@category": "high",
            "@height": "3170",
            "@width": "2994",
            "@_fa": "true",
            "$": "https://api.elsevier.com/content/object/eid/1-s2.0-S0926860X25002315-gr4_lrg.jpg?httpAccept=%2A%2F%2A",
            "@multimediatype": "JPEG image file",
            "@type": "IMAGE-HIGH-RES",
            "@size": "697937",
            "@ref": "gr4",
            "@mimetype": "image/jpeg"
          },
          {
            "@category": "high",
            "@height": "2510",
            "@width": "2497",
            "@_fa": "true",
            "$": "https://api.elsevier.com/content/object/eid/1-s2.0-S0926860X25002315-gr3_lrg.jpg?httpAccept=%2A%2F%2A",
            "@multimediatype": "JPEG image file",
            "@type": "IMAGE-HIGH-RES",
            "@size": "487865",
            "@ref": "gr3",
            "@mimetype": "image/jpeg"
          },
          {
            "@category": "high",
            "@height": "3060",
            "@width": "2994",
            "@_fa": "true",
            "$": "https://api.elsevier.com/content/object/eid/1-s2.0-S0926860X25002315-gr6_lrg.jpg?httpAccept=%2A%2F%2A",
            "@multimediatype": "JPEG image file",
            "@type": "IMAGE-HIGH-RES",
            "@size": "593772",
            "@ref": "gr6",
            "@mimetype": "image/jpeg"
          },
          {
            "@category": "high",
            "@height": "3075",
            "@width": "2994",
            "@_fa": "true",
            "$": "https://api.elsevier.com/content/object/eid/1-s2.0-S0926860X25002315-gr5_lrg.jpg?httpAccept=%2A%2F%2A",
            "@multimediatype": "JPEG image file",
            "@type": "IMAGE-HIGH-RES",
            "@size": "802317",
            "@ref": "gr5",
            "@mimetype": "image/jpeg"
          },
          {
            "@category": "high",
            "@height": "2845",
            "@width": "2496",
            "@_fa": "true",
            "$": "https://api.elsevier.com/content/object/eid/1-s2.0-S0926860X25002315-gr8_lrg.jpg?httpAccept=%2A%2F%2A",
            "@multimediatype": "JPEG image file",
            "@type": "IMAGE-HIGH-RES",
            "@size": "369971",
            "@ref": "gr8",
            "@mimetype": "image/jpeg"
          }
        ]
      },
      "link": {
        "@rel": "abstract",
        "@href": "https://api.elsevier.com/content/abstract/scopus_id/105004265009"
      }
    }
  }
}