{
  "metadata": {
    "title": "Catalytic activities and resistance to HCl poisoning of Ni-based catalysts during steam reforming of naphthalene",
    "authors": "; ; ",
    "journal": "Applied Catalysis A: General",
    "date": "2018-05-05",
    "doi": "10.1016/j.apcata.2018.03.005",
    "abstract": "",
    "uri": "https://api.elsevier.com/content/article/pii/S0926860X18301157",
    "pii": "S0926860X18301157"
  },
  "fulltext": {
    "full-text-retrieval-response": {
      "scopus-eid": "2-s2.0-85044003503",
      "originalText": "serial JL 271346 291210 291744 291809 31 90 Applied Catalysis A: General APPLIEDCATALYSISAGENERAL 2018-03-12 2018-03-12 2018-03-16 2018-03-16 2019-02-08T16:52:30 1-s2.0-S0926860X18301157 S0926-860X(18)30115-7 S0926860X18301157 10.1016/j.apcata.2018.03.005 S300 S300.2 FULL-TEXT 1-s2.0-S0926860X18X00064 2024-01-01T12:31:47.592716Z 0 0 20180505 2018 2018-03-12T16:43:28.361746Z absattachment articleinfo articletitlenorm authfirstinitialnorm authfirstsurnamenorm cid cids contenttype copyright crossmark dateloaded dateloadedtxt datesearch datesort dateupdated dco docsubtype doctype doi eid ewtransactionid fundingbodyid hubeid indexeddate issn issnnorm itemstage itemtransactionid itemweight oauserlicense openaccess openarchive pg pgfirst pglast pii piinorm pubdatestart pubdatetxt pubyr sortorder sponsoredaccesstype srctitle srctitlenorm srctype ssids alllist content oa subj subheadings suppl tomb volfirst volissue volumelist webpdf webpdfpagecount yearnav figure table e-component body acknowledge affil appendices articletitle auth authfirstini authfull authkeywords authlast grantsponsor highlightsabst primabst ref specialabst 0926-860X 0926860X UNLIMITED NONE true 557 557 C Volume 557 5 25 38 25 38 20180505 5 May 2018 2018-05-05 2018 article fla © 2018 The Authors. Published by Elsevier B.V. CATALYTICACTIVITIESRESISTANCEHCLPOISONINGNIBASEDCATALYSTSDURINGSTEAMREFORMINGNAPHTHALENE VEKSHA A 1 Introduction 2 Materials and methods 2.1 Materials 2.2 Naphthalene reforming 2.3 Characterization of catalysts 3 Results and discussion 3.1 Catalysts 3.2 Naphthalene reforming 3.3 Water-gas shift activity 3.4 Deactivation mechanism and resistance to HCl poisoning 4 Conclusions Acknowledgements Appendix A Supplementary data References MOERSCH 2000 79 86 O ARENA 2012 625 639 U VEHLOW 2015 58 74 J SHEN 2013 371 392 Y ZWART 2009 R GASCLEANINGDOWNSTREAMBIOMASSGASIFICATIONSTATUSREPORT SIMELL 1997 1117 1127 P CORELLA 1998 4617 4624 J TRIMM 1997 233 238 D YUNG 2010 16589 16594 M WU 2013 19239 19242 C ELBABA 2014 2104 2113 I ALBERTAZZI 2011 746 754 S RICHARDSON 1996 17 20 J ORTEGO 1997 339 355 J COUTE 1998 175 187 N COUTE 2000 217 226 N SPIES 2017 2448 2456 K ZWART 2010 R STATUSREPORT TARREMOVALLOWTEMPERATUREGASIFIERS JESS 1996 487 494 A COLL 2001 19 31 R DEVI 2005 565 587 L UDOMSIRICHAKORN 2013 14495 14504 J KIM 1974 625 643 K ESPINOS 1992 508 512 J HERACLEOUS 2005 159 171 E VEDRINE 1978 1515 1520 J MOULDER 1992 J HANDBOOKXRAYPHOTOELECTRONSPECTROSCOPYAREFERENCEBOOKSTANDARDSPECTRAFORIDENTIFICATIONINTERPRETATIONXPSDATA BRITO 1986 179 182 J GARBARINO 2014 37 41 G SEPEHRI 2016 3456 3464 S GARCIA 2000 225 239 L MATASGUELL 2011 280 286 B ERLEY 1977 371 375 W KISKINOVA 1981 64 76 M MCKINLEY 1964 120 125 J MARINA 2010 7033 7037 O XU 2010 2149 2158 C MADI 2016 349 356 H VICENTE 2014 12586 12596 J SON 2014 194 200 I BAKTASH 2015 122 127 E HANSEN 2013 1720 1730 T DELARIVA 2013 291 305 A VANHAASTERECHT 2016 289 296 T TEIXEIRA 1999 3609 3618 A MORALESCANO 2015 117 125 F LAO 2016 78 92 L RICCA 2017 175 182 A VEKSHAX2018X25 VEKSHAX2018X25X38 VEKSHAX2018X25XA VEKSHAX2018X25X38XA Full 2018-03-13T04:25:12Z Author http://creativecommons.org/licenses/by-nc-nd/4.0/ 2020-03-16T00:00:00.000Z UnderEmbargo http://creativecommons.org/licenses/by-nc-nd/4.0/ This is an open access article under the CC BY-NC-ND license. © 2018 The Authors. Published by Elsevier B.V. item S0926-860X(18)30115-7 S0926860X18301157 1-s2.0-S0926860X18301157 10.1016/j.apcata.2018.03.005 271346 2024-01-01T12:31:47.592716Z 2018-05-05 UNLIMITED NONE 1-s2.0-S0926860X18301157-main.pdf https://s3.amazonaws.com/prod-ucs-content-store-us-east/content/pii:S0926860X18301157/MAIN/application/pdf/87ef8f4cf2eb84d51c450799d83f981b/main.pdf main.pdf pdf true 6943907 MAIN 14 1-s2.0-S0926860X18301157-main_1.png https://s3.amazonaws.com/prod-ucs-content-store-us-east/content/pii:S0926860X18301157/PREVIEW/image/png/d2bc79a4ceac49fd7e8459a894bbe94f/main_1.png main_1.png png 51591 849 656 IMAGE-WEB-PDF 1 1-s2.0-S0926860X18301157-fx1.sml https://s3.amazonaws.com/prod-ucs-content-store-us-east/content/pii:S0926860X18301157/fx1/THUMBNAIL/image/gif/87fff068c7f9740cbbd23c56e90a7c5b/fx1.sml fx1 true fx1.sml sml 6139 89 219 IMAGE-THUMBNAIL 1-s2.0-S0926860X18301157-gr1.sml https://s3.amazonaws.com/prod-ucs-content-store-us-east/content/pii:S0926860X18301157/gr1/THUMBNAIL/image/gif/f63627b0caccfaf90afbd4e48965f11e/gr1.sml gr1 gr1.sml sml 3555 164 177 IMAGE-THUMBNAIL 1-s2.0-S0926860X18301157-gr10.sml https://s3.amazonaws.com/prod-ucs-content-store-us-east/content/pii:S0926860X18301157/gr10/THUMBNAIL/image/gif/c3220de96027329559e41873e5002dc3/gr10.sml gr10 gr10.sml sml 16484 106 219 IMAGE-THUMBNAIL 1-s2.0-S0926860X18301157-gr11.sml https://s3.amazonaws.com/prod-ucs-content-store-us-east/content/pii:S0926860X18301157/gr11/THUMBNAIL/image/gif/870423766eb3914146a018a64c4ef918/gr11.sml gr11 gr11.sml sml 5747 164 211 IMAGE-THUMBNAIL 1-s2.0-S0926860X18301157-gr12.sml https://s3.amazonaws.com/prod-ucs-content-store-us-east/content/pii:S0926860X18301157/gr12/THUMBNAIL/image/gif/c686dd620eed3b802e5cae018d991d78/gr12.sml gr12 gr12.sml sml 4100 164 106 IMAGE-THUMBNAIL 1-s2.0-S0926860X18301157-gr13.sml https://s3.amazonaws.com/prod-ucs-content-store-us-east/content/pii:S0926860X18301157/gr13/THUMBNAIL/image/gif/8d12f5080cc461c7cbca5ad120b0a1a4/gr13.sml gr13 gr13.sml sml 3458 163 92 IMAGE-THUMBNAIL 1-s2.0-S0926860X18301157-gr14.sml https://s3.amazonaws.com/prod-ucs-content-store-us-east/content/pii:S0926860X18301157/gr14/THUMBNAIL/image/gif/51ef3cbea5b84f4b01f4055f39722ce9/gr14.sml gr14 gr14.sml sml 3799 163 111 IMAGE-THUMBNAIL 1-s2.0-S0926860X18301157-gr15.sml https://s3.amazonaws.com/prod-ucs-content-store-us-east/content/pii:S0926860X18301157/gr15/THUMBNAIL/image/gif/fc9394c54657ef6e2ab021c76636e608/gr15.sml gr15 gr15.sml sml 7296 158 219 IMAGE-THUMBNAIL 1-s2.0-S0926860X18301157-gr16.sml https://s3.amazonaws.com/prod-ucs-content-store-us-east/content/pii:S0926860X18301157/gr16/THUMBNAIL/image/gif/4d975c00358a8c2897c9af6c7b16229c/gr16.sml gr16 gr16.sml sml 7034 149 219 IMAGE-THUMBNAIL 1-s2.0-S0926860X18301157-gr17.sml https://s3.amazonaws.com/prod-ucs-content-store-us-east/content/pii:S0926860X18301157/gr17/THUMBNAIL/image/gif/2a5f803b0fd9ea231a3b6c70c2beaa82/gr17.sml gr17 gr17.sml sml 13504 163 110 IMAGE-THUMBNAIL 1-s2.0-S0926860X18301157-gr18.sml https://s3.amazonaws.com/prod-ucs-content-store-us-east/content/pii:S0926860X18301157/gr18/THUMBNAIL/image/gif/f66fd1a4f226cb8ec21020f9ed14eba1/gr18.sml gr18 gr18.sml sml 4769 164 116 IMAGE-THUMBNAIL 1-s2.0-S0926860X18301157-gr2.sml https://s3.amazonaws.com/prod-ucs-content-store-us-east/content/pii:S0926860X18301157/gr2/THUMBNAIL/image/gif/a3b79c68fc81bfa63cf14479399dbb58/gr2.sml gr2 gr2.sml sml 12079 164 126 IMAGE-THUMBNAIL 1-s2.0-S0926860X18301157-gr3.sml https://s3.amazonaws.com/prod-ucs-content-store-us-east/content/pii:S0926860X18301157/gr3/THUMBNAIL/image/gif/10602b696c157bf41268d18a3cdd8e93/gr3.sml gr3 gr3.sml sml 14450 108 219 IMAGE-THUMBNAIL 1-s2.0-S0926860X18301157-gr4.sml https://s3.amazonaws.com/prod-ucs-content-store-us-east/content/pii:S0926860X18301157/gr4/THUMBNAIL/image/gif/b7815266bd29f90baa6112d48e89544e/gr4.sml gr4 gr4.sml sml 10203 116 219 IMAGE-THUMBNAIL 1-s2.0-S0926860X18301157-gr5.sml https://s3.amazonaws.com/prod-ucs-content-store-us-east/content/pii:S0926860X18301157/gr5/THUMBNAIL/image/gif/19e48aa867ff26d5933ed0f2f16bb761/gr5.sml gr5 gr5.sml sml 3658 162 61 IMAGE-THUMBNAIL 1-s2.0-S0926860X18301157-gr6.sml https://s3.amazonaws.com/prod-ucs-content-store-us-east/content/pii:S0926860X18301157/gr6/THUMBNAIL/image/gif/c3131fb26897600c7a67494f29cc3eb5/gr6.sml gr6 gr6.sml sml 5274 164 123 IMAGE-THUMBNAIL 1-s2.0-S0926860X18301157-gr7.sml https://s3.amazonaws.com/prod-ucs-content-store-us-east/content/pii:S0926860X18301157/gr7/THUMBNAIL/image/gif/dd6c967700d460d92f494b7ff93edcd9/gr7.sml gr7 gr7.sml sml 3034 163 162 IMAGE-THUMBNAIL 1-s2.0-S0926860X18301157-gr8.sml https://s3.amazonaws.com/prod-ucs-content-store-us-east/content/pii:S0926860X18301157/gr8/THUMBNAIL/image/gif/b0ce18eafb45188c7d1933a53e15409f/gr8.sml gr8 gr8.sml sml 5208 164 205 IMAGE-THUMBNAIL 1-s2.0-S0926860X18301157-gr9.sml https://s3.amazonaws.com/prod-ucs-content-store-us-east/content/pii:S0926860X18301157/gr9/THUMBNAIL/image/gif/1ef14b24e06d7e133688f0e129798e93/gr9.sml gr9 gr9.sml sml 3895 164 103 IMAGE-THUMBNAIL 1-s2.0-S0926860X18301157-fx1.jpg https://s3.amazonaws.com/prod-ucs-content-store-us-east/content/pii:S0926860X18301157/fx1/DOWNSAMPLED/image/jpeg/10a37af35eee997bdc50b05c388ffddf/fx1.jpg fx1 true fx1.jpg jpg 32868 200 495 IMAGE-DOWNSAMPLED 1-s2.0-S0926860X18301157-gr1.jpg https://s3.amazonaws.com/prod-ucs-content-store-us-east/content/pii:S0926860X18301157/gr1/DOWNSAMPLED/image/jpeg/d321d11a8d6c30cabde98e08685f04cf/gr1.jpg gr1 gr1.jpg jpg 16173 347 376 IMAGE-DOWNSAMPLED 1-s2.0-S0926860X18301157-gr10.jpg https://s3.amazonaws.com/prod-ucs-content-store-us-east/content/pii:S0926860X18301157/gr10/DOWNSAMPLED/image/jpeg/e2cf0f11aa136b802b058d17870e716e/gr10.jpg gr10 gr10.jpg jpg 103560 345 715 IMAGE-DOWNSAMPLED 1-s2.0-S0926860X18301157-gr11.jpg https://s3.amazonaws.com/prod-ucs-content-store-us-east/content/pii:S0926860X18301157/gr11/DOWNSAMPLED/image/jpeg/7746d0f56f613e470f7f237ecb6b0156/gr11.jpg gr11 gr11.jpg jpg 20667 292 376 IMAGE-DOWNSAMPLED 1-s2.0-S0926860X18301157-gr12.jpg https://s3.amazonaws.com/prod-ucs-content-store-us-east/content/pii:S0926860X18301157/gr12/DOWNSAMPLED/image/jpeg/7565cfa31a8a0f0ca77fb9eba18b4be8/gr12.jpg gr12 gr12.jpg jpg 39471 581 376 IMAGE-DOWNSAMPLED 1-s2.0-S0926860X18301157-gr13.jpg https://s3.amazonaws.com/prod-ucs-content-store-us-east/content/pii:S0926860X18301157/gr13/DOWNSAMPLED/image/jpeg/cd420314c0fab9a528b84884ac27e0fe/gr13.jpg gr13 gr13.jpg jpg 36206 667 376 IMAGE-DOWNSAMPLED 1-s2.0-S0926860X18301157-gr14.jpg https://s3.amazonaws.com/prod-ucs-content-store-us-east/content/pii:S0926860X18301157/gr14/DOWNSAMPLED/image/jpeg/5ef34c324408833a61e5ee22e9c24647/gr14.jpg gr14 gr14.jpg jpg 35141 554 376 IMAGE-DOWNSAMPLED 1-s2.0-S0926860X18301157-gr15.jpg https://s3.amazonaws.com/prod-ucs-content-store-us-east/content/pii:S0926860X18301157/gr15/DOWNSAMPLED/image/jpeg/0268531716535c440efd66e9108f0fbd/gr15.jpg gr15 gr15.jpg jpg 76741 543 753 IMAGE-DOWNSAMPLED 1-s2.0-S0926860X18301157-gr16.jpg https://s3.amazonaws.com/prod-ucs-content-store-us-east/content/pii:S0926860X18301157/gr16/DOWNSAMPLED/image/jpeg/92271e8d8b5d8ec069401b38907ebfa1/gr16.jpg gr16 gr16.jpg jpg 16081 192 282 IMAGE-DOWNSAMPLED 1-s2.0-S0926860X18301157-gr17.jpg https://s3.amazonaws.com/prod-ucs-content-store-us-east/content/pii:S0926860X18301157/gr17/DOWNSAMPLED/image/jpeg/9442802bcce6ec738e7cac29bb740b7e/gr17.jpg gr17 gr17.jpg jpg 135517 837 565 IMAGE-DOWNSAMPLED 1-s2.0-S0926860X18301157-gr18.jpg https://s3.amazonaws.com/prod-ucs-content-store-us-east/content/pii:S0926860X18301157/gr18/DOWNSAMPLED/image/jpeg/8bb067a047214ea2305bc4d3936f1b86/gr18.jpg gr18 gr18.jpg jpg 37970 532 376 IMAGE-DOWNSAMPLED 1-s2.0-S0926860X18301157-gr2.jpg https://s3.amazonaws.com/prod-ucs-content-store-us-east/content/pii:S0926860X18301157/gr2/DOWNSAMPLED/image/jpeg/d8142fb58b69668b17a10e35de7b8400/gr2.jpg gr2 gr2.jpg jpg 237529 932 715 IMAGE-DOWNSAMPLED 1-s2.0-S0926860X18301157-gr3.jpg https://s3.amazonaws.com/prod-ucs-content-store-us-east/content/pii:S0926860X18301157/gr3/DOWNSAMPLED/image/jpeg/50d21254fc7570e03d551f8f8090e030/gr3.jpg gr3 gr3.jpg jpg 62694 352 715 IMAGE-DOWNSAMPLED 1-s2.0-S0926860X18301157-gr4.jpg https://s3.amazonaws.com/prod-ucs-content-store-us-east/content/pii:S0926860X18301157/gr4/DOWNSAMPLED/image/jpeg/f3b88b6cc042a1e999ee4a41ec348917/gr4.jpg gr4 gr4.jpg jpg 71966 380 715 IMAGE-DOWNSAMPLED 1-s2.0-S0926860X18301157-gr5.jpg https://s3.amazonaws.com/prod-ucs-content-store-us-east/content/pii:S0926860X18301157/gr5/DOWNSAMPLED/image/jpeg/3ede43f6245d209ecfc4c8eead8e6e54/gr5.jpg gr5 gr5.jpg jpg 58615 899 339 IMAGE-DOWNSAMPLED 1-s2.0-S0926860X18301157-gr6.jpg https://s3.amazonaws.com/prod-ucs-content-store-us-east/content/pii:S0926860X18301157/gr6/DOWNSAMPLED/image/jpeg/19c8e3e23c0101f3ea0c6b2aa75806fb/gr6.jpg gr6 gr6.jpg jpg 103522 950 715 IMAGE-DOWNSAMPLED 1-s2.0-S0926860X18301157-gr7.jpg https://s3.amazonaws.com/prod-ucs-content-store-us-east/content/pii:S0926860X18301157/gr7/DOWNSAMPLED/image/jpeg/bd91febaa7fdbfb9387fe8e45d4e3a40/gr7.jpg gr7 gr7.jpg jpg 17452 379 376 IMAGE-DOWNSAMPLED 1-s2.0-S0926860X18301157-gr8.jpg https://s3.amazonaws.com/prod-ucs-content-store-us-east/content/pii:S0926860X18301157/gr8/DOWNSAMPLED/image/jpeg/2e5b236c21d7efa584f603b539cc3856/gr8.jpg gr8 gr8.jpg jpg 18821 301 376 IMAGE-DOWNSAMPLED 1-s2.0-S0926860X18301157-gr9.jpg https://s3.amazonaws.com/prod-ucs-content-store-us-east/content/pii:S0926860X18301157/gr9/DOWNSAMPLED/image/jpeg/508053b4f766ae8ab03e84cdd6ff63be/gr9.jpg gr9 gr9.jpg jpg 34700 597 376 IMAGE-DOWNSAMPLED 1-s2.0-S0926860X18301157-fx1_lrg.jpg https://s3.amazonaws.com/prod-ucs-content-store-us-east/content/pii:S0926860X18301157/fx1/HIGHRES/image/jpeg/54aacccae0ab8af0d8d916c6f982c709/fx1_lrg.jpg fx1 true fx1_lrg.jpg jpg 221623 886 2191 IMAGE-HIGH-RES 1-s2.0-S0926860X18301157-gr1_lrg.jpg https://s3.amazonaws.com/prod-ucs-content-store-us-east/content/pii:S0926860X18301157/gr1/HIGHRES/image/jpeg/e5575c69c63ba7ab72e98ad68d9e16f0/gr1_lrg.jpg gr1 gr1_lrg.jpg jpg 111852 1540 1667 IMAGE-HIGH-RES 1-s2.0-S0926860X18301157-gr10_lrg.jpg https://s3.amazonaws.com/prod-ucs-content-store-us-east/content/pii:S0926860X18301157/gr10/HIGHRES/image/jpeg/003df4635626475a8017d26dfb7b9a59/gr10_lrg.jpg gr10 gr10_lrg.jpg jpg 1521027 1529 3167 IMAGE-HIGH-RES 1-s2.0-S0926860X18301157-gr11_lrg.jpg https://s3.amazonaws.com/prod-ucs-content-store-us-east/content/pii:S0926860X18301157/gr11/HIGHRES/image/jpeg/f6a0aabdf45ea7bee21ab6f4559c0dd9/gr11_lrg.jpg gr11 gr11_lrg.jpg jpg 163229 1293 1667 IMAGE-HIGH-RES 1-s2.0-S0926860X18301157-gr12_lrg.jpg https://s3.amazonaws.com/prod-ucs-content-store-us-east/content/pii:S0926860X18301157/gr12/HIGHRES/image/jpeg/23a8c874b9043f1635a9158f9c5c81da/gr12_lrg.jpg gr12 gr12_lrg.jpg jpg 302843 2578 1667 IMAGE-HIGH-RES 1-s2.0-S0926860X18301157-gr13_lrg.jpg https://s3.amazonaws.com/prod-ucs-content-store-us-east/content/pii:S0926860X18301157/gr13/HIGHRES/image/jpeg/21cd4def1ff6eea3cf087366bccba614/gr13_lrg.jpg gr13 gr13_lrg.jpg jpg 275336 2957 1667 IMAGE-HIGH-RES 1-s2.0-S0926860X18301157-gr14_lrg.jpg https://s3.amazonaws.com/prod-ucs-content-store-us-east/content/pii:S0926860X18301157/gr14/HIGHRES/image/jpeg/3045fd12ddd6f403a6e86fab8ff2a4ed/gr14_lrg.jpg gr14 gr14_lrg.jpg jpg 259041 2454 1667 IMAGE-HIGH-RES 1-s2.0-S0926860X18301157-gr15_lrg.jpg https://s3.amazonaws.com/prod-ucs-content-store-us-east/content/pii:S0926860X18301157/gr15/HIGHRES/image/jpeg/502679c48e33f29df11c0ef75906ed88/gr15_lrg.jpg gr15 gr15_lrg.jpg jpg 595162 2404 3333 IMAGE-HIGH-RES 1-s2.0-S0926860X18301157-gr16_lrg.jpg https://s3.amazonaws.com/prod-ucs-content-store-us-east/content/pii:S0926860X18301157/gr16/HIGHRES/image/jpeg/831e5bb602f514f6482f1231123a0d2b/gr16_lrg.jpg gr16 gr16_lrg.jpg jpg 117027 849 1250 IMAGE-HIGH-RES 1-s2.0-S0926860X18301157-gr17_lrg.jpg https://s3.amazonaws.com/prod-ucs-content-store-us-east/content/pii:S0926860X18301157/gr17/HIGHRES/image/jpeg/e995d3d9c89948340c346319f2f663fe/gr17_lrg.jpg gr17 gr17_lrg.jpg jpg 2223479 3703 2500 IMAGE-HIGH-RES 1-s2.0-S0926860X18301157-gr18_lrg.jpg https://s3.amazonaws.com/prod-ucs-content-store-us-east/content/pii:S0926860X18301157/gr18/HIGHRES/image/jpeg/2570e1f92136912b1cff01bf89ec1e70/gr18_lrg.jpg gr18 gr18_lrg.jpg jpg 258396 2360 1667 IMAGE-HIGH-RES 1-s2.0-S0926860X18301157-gr2_lrg.jpg https://s3.amazonaws.com/prod-ucs-content-store-us-east/content/pii:S0926860X18301157/gr2/HIGHRES/image/jpeg/0b634cce8d7f7cfd2a7cc3b0243a3ce7/gr2_lrg.jpg gr2 gr2_lrg.jpg jpg 2400619 4126 3167 IMAGE-HIGH-RES 1-s2.0-S0926860X18301157-gr3_lrg.jpg https://s3.amazonaws.com/prod-ucs-content-store-us-east/content/pii:S0926860X18301157/gr3/HIGHRES/image/jpeg/798068ff4549992dd3cae67f7d1aada4/gr3_lrg.jpg gr3 gr3_lrg.jpg jpg 1167317 1560 3167 IMAGE-HIGH-RES 1-s2.0-S0926860X18301157-gr4_lrg.jpg https://s3.amazonaws.com/prod-ucs-content-store-us-east/content/pii:S0926860X18301157/gr4/HIGHRES/image/jpeg/f06dff9aecea08e17907bd38798dfea9/gr4_lrg.jpg gr4 gr4_lrg.jpg jpg 1090152 1682 3167 IMAGE-HIGH-RES 1-s2.0-S0926860X18301157-gr5_lrg.jpg https://s3.amazonaws.com/prod-ucs-content-store-us-east/content/pii:S0926860X18301157/gr5/HIGHRES/image/jpeg/3f8b5565103f9eb034edc3f9fc01a122/gr5_lrg.jpg gr5 gr5_lrg.jpg jpg 466845 3980 1500 IMAGE-HIGH-RES 1-s2.0-S0926860X18301157-gr6_lrg.jpg https://s3.amazonaws.com/prod-ucs-content-store-us-east/content/pii:S0926860X18301157/gr6/HIGHRES/image/jpeg/0e75c237bf42fd02f24a7b2781efc220/gr6_lrg.jpg gr6 gr6_lrg.jpg jpg 768610 4210 3167 IMAGE-HIGH-RES 1-s2.0-S0926860X18301157-gr7_lrg.jpg https://s3.amazonaws.com/prod-ucs-content-store-us-east/content/pii:S0926860X18301157/gr7/HIGHRES/image/jpeg/9cc3500821e556bb0d2b9de464baa653/gr7_lrg.jpg gr7 gr7_lrg.jpg jpg 144007 1680 1667 IMAGE-HIGH-RES 1-s2.0-S0926860X18301157-gr8_lrg.jpg https://s3.amazonaws.com/prod-ucs-content-store-us-east/content/pii:S0926860X18301157/gr8/HIGHRES/image/jpeg/21ac20adf4f46e3a9aa4d05464a4e914/gr8_lrg.jpg gr8 gr8_lrg.jpg jpg 141175 1334 1667 IMAGE-HIGH-RES 1-s2.0-S0926860X18301157-gr9_lrg.jpg https://s3.amazonaws.com/prod-ucs-content-store-us-east/content/pii:S0926860X18301157/gr9/HIGHRES/image/jpeg/b789397e646d9f8770e3103018e60e10/gr9_lrg.jpg gr9 gr9_lrg.jpg jpg 282794 2648 1667 IMAGE-HIGH-RES 1-s2.0-S0926860X18301157-mmc1.docx https://s3.amazonaws.com/prod-ucs-content-store-us-east/content/pii:S0926860X18301157/mmc1/MAIN/application/vnd.openxmlformats-officedocument.wordprocessingml.document/0bc7b8778cbad4f9552b2979415a8a23/mmc1.docx mmc1 mmc1.docx docx 1378938 APPLICATION APCATA 16579 S0926-860X(18)30115-7 10.1016/j.apcata.2018.03.005 The Authors Fig. 1 Catalytic steam reforming setup. Fig. 1 Fig. 2 FESEM/EDS images of the pristine catalysts. Fig. 2 Fig. 3 Secondary electron (top) and back-scattered electron (bottom) images of the pristine alumina supported catalysts. Fig. 3 Fig. 4 (a) XRD patterns of the pristine catalysts and (b) high resolution TEM of the pristine Ni/Alumina. Fig. 4 Fig. 5 Ni 2p3/2 core level XPS spectra of the pristine catalysts. Fig. 5 Fig. 6 Ca 2p (Ni/Limestone), Al 2p and Ni 3p (alumina-supported catalysts) and O 1s core level XPS spectra of the pristine catalysts. Fig. 6 Fig. 7 TPR profiles of the pristine catalysts. Fig. 7 Fig. 8 Naphthalene conversion in the absence of HCl. Fig. 8 Fig. 9 Naphthalene conversion (a) over Ni/Alumina catalyst in the presence of 0, 500, 1000 and 2000 ppmv HCl and (b) over prepared and commercial catalysts in the presence of 2000 ppmv HCl. Fig. 9 Fig. 10 FESEM/EDS images of the spent Ni/Limestone after naphthalene reforming in the presence of 2000 ppmv HCl (top) and in the absence of HCl (bottom). Fig. 10 Fig. 11 Naphthalene conversion (space velocity 34,286 h−1). Exp. 1 and Exp. 2: poisoning of the catalysts with 2000 ppmv HCl for 5 h followed by naphthalene reforming in the presence and absence of HCl. Exp. 3: without HCl poisoning, naphthalene reforming in the absence of HCl. Fig. 11 Fig. 12 Influence of HCl concentration on the evolution of CO (a) and CO2 (b) during naphthalene reforming over Ni/Alumina. Dotted lines correspond to CO and CO2 concentrations at thermodynamic equilibrium. Fig. 12 Fig. 13 Influence of catalysts on CO/CO2 selectivity during naphthalene reforming (a) in the absence of HCl and (b) at 2000 ppmv HCl. Fig. 13 Fig. 14 CO/CO2 ratios (a) during naphthalene reforming and (b) subsequent water-gas shift reaction in the absence of naphthalene (space velocity 34,286 h−1). Exp. 1 and Exp. 2: poisoning of the catalysts with 2000 ppmv HCl followed by naphthalene reforming in the presence and absence of HCl. Exp. 3: without HCl poisoning, naphthalene reforming in the absence of HCl. Exp. 4 and Exp. 5: catalysts after Exp. 1 and Exp. 3, respectively, water-gas shift reaction in the absence of HCl. Fig. 14 Fig. 15 XRD patterns of the spent catalysts after the naphthalene reforming in the absence (no HCl) and 2000 ppmv HCl (with HCl). Fig. 15 Fig. 16 Cl 2p core level XPS spectra of the spent Ni/Alumina after naphthalene reforming. Fig. 16 Fig. 17 TEM images at different magnifications of the spent catalysts after reforming in the presence of 2000 ppmv HCl: Ni/Alumina (a, b), Commercial 1 (c, d) and Commercial 2 (e, f). Fig. 17 Fig. 18 Size distribution of nickel nanoparticles in the spent Ni/Alumina (a), Commercial 1 (b) and Commercial 2 (c) catalysts after reforming in the absence of HCl (black bars) and in the presence of 2000 ppmv HCl (white bars). Fig. 18 Table 1 Properties of pristine catalysts. Table 1 Catalyst BET surface area (m2 g−1) Total pore volume (mL g−1) Bulk density (g mL−1) Ni/Alumina 213 0.31 0.99 Ni/Limestone <1 <0.01 1.43 Commercial 1 24 0.02 1.44 Commercial 2 90 0.10 1.27 Table 2 Composition of pristine catalysts (wt. %). Table 2 Ni/Alumina Ni/Limestone Commercial 1 Commercial 2 Al2O3 67.2 0.1 74.3 41.9 NiO 28.7 37.9 19.9 21.9 Na2O 2.3 -- a 0.1 0.3 K2O -- -- -- 0.1 MgO 0.6 0.3 0.08 0.5 CaO 0.4 61.4 3.8 22.0 SiO2 0.5 0.1 0.3 4.8 Fe2O3 -- -- 0.1 1.5 TiO2 -- -- -- 1.6 MoO3 -- -- 1.4 3.7 Other 0.3 0.2 <0.1 1.7 a Not detected. Table 3 Porous properties of spent alumina supported catalysts after naphthalene reforming in the absence and presence of HCl. Table 3 Catalyst No HCl 2000 ppmv HCl BET surface area (m2 g−1) Total pore volume (mL g−1) BET surface area (m2 g−1) Total pore volume (mL g−1) Ni/Alumina 123 0.29 135 0.29 Commercial 1 3 <0.01 3 <0.01 Commercial 2 37 0.12 23 0.08 Catalytic activities and resistance to HCl poisoning of Ni-based catalysts during steam reforming of naphthalene Andrei Veksha a ⁎ Apostolos Giannis a Wen-Da Oh a Victor W.-C. Chang b Grzegorz Lisak a c Teik-Thye Lim a c ⁎⁎ a Residues and Resource Reclamation Centre, Nanyang Environment and Water Research Institute, Nanyang Technological University, 1 Cleantech Loop, Clean Tech One, 637141, Singapore Residues and Resource ReclamationCentre Nanyang Environment and Water Research Institute Nanyang Technological University 1 Cleantech Loop Clean Tech One 637141 Singapore b Department of Civil Engineering, Monash University, VIC, 3800, Australia Department of Civil Engineering Monash University VIC 3800 Australia c School of Civil and Environmental Engineering, Nanyang Technological University, 50 Nanyang Avenue, 639798, Singapore School of Civil and Environmental Engineering Nanyang Technological University 50 Nanyang Avenue 639798 Singapore ⁎ Corresponding author. ⁎⁎ Corresponding author at: Residues and Resource Reclamation Centre, Nanyang Environment and Water Research Institute, Nanyang Technological University, 1 Cleantech Loop, Clean Tech One, 637141, Singapore. Graphical abstract Hydrogen chloride is commonly present in syngas produced from municipal solid waste and biomass gasification. The influence of HCl on the activity of nickel-based catalysts during catalytic naphthalene reforming was investigated. Two synthesized and two commercial catalysts were tested for steam reforming at 790 °C and SV 24,000 h−1. In the absence of HCl, nickel supported on limestone (Ni/Limestone) demonstrated lower naphthalene conversion (∼80%) compared to nickel supported on alumina (Ni/Alumina) and two commercial alumina supported catalysts (∼100%). In the presence of 2000 ppmv HCl, the naphthalene conversion of Ni/Limestone rapidly decreased due to the reaction with HCl and, probably, formation of molten CaCl2 deactivating the supported Ni nanoparticles. These data demonstrate limited applicability of calcium-based nickel catalysts for naphthalene reforming at the studied temperature. The efficiencies of Ni/Alumina and two commercial catalysts were maintained at ∼100% naphthalene conversion. However, HCl concentrations of 500–2000 ppmv had detrimental effect on water-gas shift activity of alumina supported catalysts during naphthalene reforming. The spent alumina supported catalysts were characterized by N2 adsorption, FESEM/EDS, XRD, XPS, TPR and TEM after the reforming in the absence and presence of HCl, and the results suggested that HCl increased nickel sintering in the catalysts causing the loss of water-gas shift activity. The losses of catalytic activity varied among the catalysts and were the lowest for Ni/Alumina, which contained nanosized porous alumina support and had the strongest Ni nanoparticle-support interactions. Keywords Hydrogen chloride Naphthalene Nickel catalyst Steam reforming Water-gas shift activity 1 Introduction Tar is a complex mixture of mostly aromatic hydrocarbons, which is formed during thermal decomposition of organic compounds and secondary reactions of the intermediate organic species. Tar is typically defined as a mixture of organic molecules with molecular weight greater than benzene [1] and is one of the major hindrances in the application of syngas for power generation and chemical synthesis. At gasification temperatures, tar compounds are present in the vapor phase. However, upon cooling of syngas below approximately 350–400 °C, tar condenses in the downstream piping and cleaning equipment causing clogging and corrosion issues. When syngas is reheated above 400 °C, the tar compounds undergo subsequent decomposition forming solid coke particles that can also cause fouling and plugging of the equipment. The acceptable levels of tar in syngas for the operation of gas engines and gas turbines are low, i.e. 50–100 and 1–10 mg/Nm3, respectively [2,3]. Among available technologies for the decomposition of tar containing in syngas, tar reforming is considered the most promising as the process (1) does not require cooling of the syngas (i.e. heat and efficiency losses are minimized) and (2) does not produce waste water/solvent stream. As tar reforming reactions are kinetically limited, the rates can be increased by increasing the temperature and/or using a catalyst [4]. Application of various catalysts for tar reforming suggests that nickel-based catalysts are the most active [5]. In addition to the advantages mentioned earlier, during tar reforming with nickel catalysts, NH3 containing in syngas is converted into N2 [6]. Furthermore, overall gas composition and calorific value of syngas changes due to reforming and equilibrium reactions [5]. Corella et al. [7] reported the increases in H2 and CO contents by 6-7 vol. % (wet basis) and 4–5 vol. % (wet basis), respectively, after the catalytic reforming of syngas from biomass. Simultaneously, the contents of CO2, steam and methane decreased by 1–2 vol. % (wet basis), 5 vol. % (wet basis) and 1 vol. % (wet basis), respectively. As a result, lower heating value of the syngas and gas yield increased by 0.3 MJ Nm−3 and 0.2 Nm3 kg−1 biomass, respectively. During tar reforming, catalysts lose their activity due to carbon deposition and poisoning by sulfur species resulting in gradual reduction of the conversion efficiency [8–11]. Particulate matter containing in syngas was also reported to deposit on catalysts decreasing the reforming activity [12]. Depending on feedstock, the content of HCl in syngas varies from several tens (e.g., for biomass) to several hundreds ppmv (e.g., for municipal solid waste, MSW). Albertazzi et al. [12] observed a decrease in steam reforming of pure methane over a commercial nickel catalyst in the presence of above ca. 500 ppmv HCl. Other studies reported that HCl released from chlorinated hydrocarbons during reforming poisons methane reforming and water-gas shift activity of nickel catalysts [13–16]. High water-gas shift activity of reforming catalysts is beneficial as steam (which is typically present in syngas) can be converted into a valuable hydrogen: (1) CO + H2O ↔ H2 + CO2 Furthermore, lower steam concentration in syngas is advantageous if desulfurization with metal oxides (for instance, ZnO) is carried out downstream of the reformer as water can influence the thermodynamics of H2S sorption [17]. In the previous studies [12–16], the mechanisms for the loss of activity of nickel-based catalysts in the presence of HCl were not clarified. Furthermore, the studies were conducted using only a single catalyst. It is unclear how the losses of activity vary among different nickel-based catalysts and how to tailor the properties of catalysts in order to overcome the detrimental effect of HCl. To address these issues, this study investigated the influence of HCl on the activity of four nickel-based catalysts during steam reforming of naphthalene. Naphthalene is one of the major [18] and the most stable tar compounds in the syngas produced from gasification of biomass and MSW [19–21]. Two commercial reforming catalysts and two synthesized catalysts with different chemical and textural properties were compared. One of the synthesized catalysts was prepared using limestone (a cheap natural material with tar reforming activity [22]) as a support, while another catalyst was synthesized using a nanosized alumina precursor. Based on the performances of the four catalysts, the deactivation mechanisms of the catalysts by HCl and the catalyst properties related to the high resistance to HCl poisoning were established. 2 Materials and methods 2.1 Materials Two nickel catalysts were synthesized using a nanosized alumina precursor and limestone as supports. For the preparation of alumina-based catalyst, aluminum hydroxide H3AlO3·xH2O (Sigma-Aldrich) was pelletized and the prepared pellets were crushed to obtain particles with sizes 0.56–1.18 mm. Approximately 17.2 g of particles were added to the solution containing 10.9 g Ni(NO3)2∙6H2O (Sigma-Aldrich) in 10 mL deionized water and mixed. The solvent was evaporated using a rotary evaporator Hei-Vap Precision (Heidolph Instruments, Germany). The material was dried overnight in an oven at 105 °C and then calcined in air at 500 °C for 2 h (heating rate 2 °C min−1). Limestone supported catalyst was prepared similarly from 17.2 g of limestone with particle size 0.56–1.18 mm (China), 10.9 g Ni(NO3)2∙6H2O and 10 mL deionized water. After calcination, the samples were sieved again to remove fines and collected particles with 0.56–1.18 mm size were stored in sealed containers. The lab-made nickel catalysts prepared using alumina and limestone are denoted as “Ni/Alumina” and “Ni/Limestone”, respectively. Two commercial Ni catalysts supported on alumina from different manufacturers (6-holes monoliths from Xian Sunward Aeromat Co., China and 19 × 19 × 10 mm rings from Pingxiang Hualian Chemical Ceramic Co., China) were crushed and sieved to obtain 0.56-1.18 mm particles, and used as the reference materials. The catalysts are denoted as “Commercial 1″ and “Commercial 2″, respectively. 2.2 Naphthalene reforming The experimental setup for catalytic tar reforming is shown in Fig. 1 . In this setup, naphthalene was used as the model tar compound. The concentration of naphthalene during the experiments was fixed at 4.2 ± 0.4 g Nm−3 (average ± standard deviation based on 5 measurements). The naphthalene vapors were generated by flowing N2 gas through the evaporator. The actual concentration of naphthalene was measured in blank runs by capturing naphthalene vapors with an isopropanol (200 mL) trap and analyzing the solution with calibrated GC–MS. Steam and hydrogen chloride were produced by feeding deionized water containing HCl with a syringe pump using a separate evaporator. Hydrogen was supplied during the experiments to reduce catalysts (typically, nickel in fresh commercial and as-synthesized reforming catalysts is in the oxidized form) and maintain the reducing environment during the reforming process. The concentrations of steam and hydrogen were 26 vol. % and 10 vol. %, which are typical for syngas from wet biomass and MSW. In a typical run, a catalyst (0.5 mL) was loaded inside a quartz reactor on a quartz mesh with 50–90 μm openings, and then the temperature of the reactor increased to 790 °C by an electric heater at 15 °C min−1 in 20 vol. % H2 −80 vol. % N2 (total gas flow 50 mL-STP min−1). Afterwards, the catalyst was reduced at that temperature for 30 min. The reforming of naphthalene was performed by flowing the gas mixture containing 0.14 vol. % naphthalene – 26 vol. % H2O – 0, 500, 1000 or 2000 ppmv HCl – 10 vol. % H2 – N2 (balance) over the reduced catalyst at 790 °C. The total gas flow rate was 200 mL-STP min−1 (space velocity 24,000 h−1). After the reforming, gases passed through traps with deionized water to capture HCl and silica gel to remove moisture. Gas sample (N2, H2, CO and CO2) was collected every 30 min of reaction and analyzed by a calibrated gas chromatograph (Agilent 7890B, USA) equipped with one FID and two TCD detectors. During the reforming, naphthalene was converted to CO and CO2 measured by the gas chromatograph. From the volumes of these gases, the amount of converted naphthalene was calculated. The conversion efficiency was determined as a ratio between the naphthalene converted to CO and CO2 and initial naphthalene concentration determined by GC–MS. According to gas chromatography, the concentrations of C1–C5 hydrocarbons in product gas were below detection limits. In separate runs, it was confirmed that the water trap did not influence the concentrations of CO and CO2 gases. The trap with silica gel slightly decreased the concentration of CO2 during the measurement of first data point but did not influence the CO2 content thereafter. All experiments unless otherwise stated were triplicated and the results are presented as averages of three experimental runs. 2.3 Characterization of catalysts The surface morphology and elemental distribution of the catalysts were investigated using a field emission scanning electron microscopy (FESEM, JEOL JSM-7600F) equipped with the energy dispersive X-ray spectroscope (EDS, Oxford Xmax80 LN2 Free). The transmission electron micrographs were obtained using a transmission electron microscopes (TEM, JEOL JEM-1400 and JEM-2010). Chemical composition was characterized using X-ray fluorescence analysis (XRF, PANalytical Axios mAx). N2 adsorption isotherms were obtained using Quantachrome Autosorb-1 Analyzer at −196 °C and surface areas were calculated applying a BET model. The crystalline structure was studied using an X-ray diffractometer (Bruker AXS D8 Advance) at the scan rate of 0.02 s−1. The X-ray diffractometer was operated under 40 kV and 40 mA with high-intensity monochromatic Cu-Kα (λ = 1.5418 Å) as the X-ray source. X-ray photoelectron spectroscopy (XPS) was conducted using a Kratos Axis Supra spectrophotometer with a dual anode monochromatic Kα excitation source. All binding energies for elements of interest were corrected against an adventitious carbon C 1s core level at 284.8 eV. XPS peaks were fitted using Shirley background together with Gaussian-Lorentzian function using CASA XPS software. Temperature programmed reduction (TPR) was performed by flowing a 5% H2/N2 gas mixture (30 mL min−1), with a temperature ramp of 10 °C min−1 up to 900 °C. 3 Results and discussion 3.1 Catalysts Table 1 summarizes the porous characteristics of pristine Ni-based catalysts. The Ni/Alumina has the highest specific surface area (213 m2 g−1) and total pore volume (0.31 mL g−1) while Ni/Limestone is a non-porous material with the lowest specific surface area (<1 m2 g−1) and total pore volume (<0.01 mL g−1). According to pore size distributions in Fig. S1, Ni/Alumina contained pores with sizes between 4 and 20 nm. The differences in porous properties of the synthesized catalysts could be attributed to the different porosities of supports, which also influenced the distribution of nickel in the prepared supported catalysts. Fig. 2 shows the cross-sectional EDS elemental mappings of the catalysts. In Ni/Alumina, nickel was homogeneously integrated into the alumina support, while in Ni/Limestone, nickel was mainly accumulated on the outer surface of the support, forming a core-shell microstructure. As the EDS mapping did not detect any differences in the nickel distribution of the three alumina catalysts (i.e. Ni/Alumina, Commercial 1 and Commercial 2), the samples were characterized by FESEM in a back-scattered electron (BSE) mode (Fig. 3 ). According to Fig. 3, the morphology of Ni/Alumina was different from that of the commercial samples. In the BSE imaging, electron scattering of heavier elements such as Ni is stronger than that of lighter elements (such as Al) leading to brighter regions due to stronger signal intensity. It can be seen from the images that in Ni/Alumina, Ni is more uniformly distributed on the support compared to Commercial 1 and Commercial 2 catalysts. To confirm that nickel was the heaviest element, the catalysts were characterized by XRF analysis (Table 2 ). Ni/Alumina and Commercial 1 catalysts mainly contained Ni and Al, while Commercial 2 catalyst contained Ni, Al and Ca, among which Ni is the heaviest element. Thus, the strongest signal intensity in the back-scattered electron mode (i.e. brighter spots in the images) can be ascribed to Ni. According to chemical composition (Table 2), NiO contents in Commercial 1 and Commercial 2 catalysts were ∼20% and ∼22%, respectively. Commercial 2 catalyst also contained considerable amount of CaO. Although Ni/Alumina and Ni/Limestone were prepared using similar nickel to support mass ratios, concentrations of NiO in the pristine catalysts were different, probably due to different mass losses of supports during calcination. Fig. 4 a illustrates X-ray diffraction (XRD) patterns of the catalysts. NiO diffraction peaks can be clearly identified in Commercial 1, Commercial 2 and Ni/Limestone catalysts. However, in Ni/Alumina, no NiO diffraction peaks were detected by XRD analysis. Additionally, α-Al2O3 and calcite (CaCO3) phases were present in Commercial 1 and Ni/Limestone, respectively. The allotropic phase of alumina in Commercial 2 catalyst could not be determined from the XRD pattern. The XRD pattern of Ni/Alumina consists of broad alumina peaks at ca. 38°, 46° and 67°, which together with the absence of NiO peaks, suggest non-crystalline and/or nanosized structure of the catalyst. High resolution TEM image in Fig. 4b confirms the nanosized structure of Ni/Alumina. Darker spots in the image appear to be NiO particles with sizes smaller than 5 nm. The support consisted of hollow spherical and ellipsoidal particles with diameters smaller than 50 nm and wall thicknesses smaller than 10 nm. X-ray photoelectron spectroscopy (XPS) was used to characterize the chemical states and interactions between elements on the surface of the catalysts. Fig. 5 depicts the high-resolution Ni 2p3/2 core level spectra of pristine catalysts. The Ni 2p3/2 spectra of Ni/Limestone and Commercial 1 catalysts can be deconvoluted to peaks with binding energies at ∼854 and ∼856 eV, and a shake-up satellite peak at ∼861 eV (Table S1). These peaks are characteristics of Ni (II) in unsupported NiO and NiO that is weakly bound to the support [23–26]. On the other hand, the Ni 2p3/2 spectra of Ni/Alumina and Commercial 2 catalysts can be deconvoluted to peaks with binding energies at ∼856 eV only and a shake-up satellite peak at ∼861 eV. The disappearance of the peak with lower binding energies (∼854 eV) suggests the increased interactions between the Ni (II) in oxidized nickel and the support in these catalysts [24–26]. According to [25], the observed characteristics of XPS spectra may also suggest the transformation of NiO into NiAl2O4-like species. However, the formation of NiAl2O4 spinel in the catalysts was not confirmed by XRD data. Fig. 6 illustrates Ca 2p (Ni/Limestone), Al 2p and Ni 3p (alumina-supported catalysts) and O 1s XPS spectra of the pristine catalysts. The Ca 2p spectra of Ni/Limestone with binding energies of 346.8 and 350.4 eV correspond to Ca (II) in CaCO3 [27], which was detected by XRD analysis (Fig. 4a). The O 1s spectra contains the XPS peak with binding energy ∼531 eV for oxygen in CaCO3 and NiO [27]. Alumina-supported catalysts show the XPS peaks with binding energies at ∼68 eV attributed to the Ni 3p core level of Ni (II), ∼74 eV attributed to the Al 2p core level of Al (III) of the supports and ∼531 eV attributed to the O 1s core level of oxygen in aluminum and nickel oxides [27]. TPR profiles confirm the different state of nickel in the catalysts supported on alumina (Fig. 7 ). Typically, the reduction of unsupported NiO occurs at 300–400 °C, while the reduction of NiO, which is strongly attached to the support requires higher temperatures [28–30]. The reduction temperatures of NiO in the three catalysts increased in order of Commercial 1 < Commercial 2 <  Ni/Alumina. Commercial 1 had one main peak at 400 °C and one small peak at 550 °C, indicating the presence of unsupported NiO particles and/or NiO that is weakly bound to the support. NiO in Commercial 2 and Ni/Alumina required higher temperatures for reduction. Commercial 2 had a single broad peak at 600 °C, while Ni/Alumina contained two peaks at 590 and 780 °C. The highest reduction temperature of Ni/Alumina could be attributed to the strongest bonding of Ni (II) to the support in the catalyst. The XPS and TPR data suggest that the state of Ni (II) and the extent of interactions between the support and Ni (II) species varied among the catalysts. The catalysts were used for steam reforming of naphthalene in the presence of HCl in order to investigate the influence of structural differences on catalytic activity. 3.2 Naphthalene reforming Fig. 8 depicts the naphthalene conversion using the Ni-based catalysts in the absence of HCl. The three alumina supported catalysts had conversion efficiencies above 90% for at least 5 h. Despite the highest nickel content, Ni/Limestone converted only ∼80% of naphthalene. The lower catalytic activity of Ni/Limestone was likely caused by poor distribution of nickel (Fig. 2) and its lower porosity and specific surface area compared to pristine alumina supported catalysts (Table 1). Fig. 9 a demonstrates the conversion of naphthalene over Ni/Alumina in the presence of HCl. Regardless of the HCl concentration (0–2000 ppmv), the conversion of naphthalene was stable (∼100%) for at least 5 h. The highest HCl concentration (2000 ppmv) was further selected to investigate the effect of HCl on reforming activity of all catalysts (Fig. 9b). The three alumina supported catalysts maintained naphthalene conversion above 90% for 5 h, suggesting no significant influence of HCl on the reforming reactions. Previously, Albertazzi et al. [12] observed a decrease in pure methane reforming by a commercial catalyst at HCl concentrations above 500 ppmv. Other studies using methane and chlorinated hydrocarbons have shown that when conversion efficiencies are close to unity, the released HCl mainly decreases water gas shift activity and CH4 reforming of Ni catalysts [13–16]. In the previous studies, reforming of hydrocarbons was carried out using one nickel-based catalyst only and thus, the influence of properties of catalysts on the catalytic activity in the presence of HCl was not investigated. Unlike the alumina supported catalysts, Ni/Limestone was rapidly deactivated in the presence of HCl, demonstrating naphthalene conversion as low as 15% after 2.5 h (Fig. 9b). The deactivation was accompanied by morphological changes as shown in Fig. 10 . After reforming in the presence of HCl, the spent catalyst had rough surface with disordered nickel coverage compared to the spent catalyst after reforming in the absence of HCl. Furthermore, elemental mapping showed that chlorine was chemisorbed on the support in the presence of HCl. According to these data, the deactivation of Ni/Limestone was likely attributed to the reaction of support (i.e. calcium species) with HCl during the reforming [7]. This could be explained by the formation of CaCl2, which is present in a molten state at the reforming conditions (melting point 772 °C) and could encapsulate nickel nanoparticles, resulting in the decreasing catalytic activity. The obtained results suggest that nickel catalysts supported on limestone and other calcium-based supports, in general, are not suitable for the application with HCl containing gases. Two catalysts, namely Ni/Alumina and Commercial 1 were selected to investigate the effect of poisoning on the subsequent naphthalene reforming. For these tests, the catalyst loading was decreased to 0.35 mL to obtain lower naphthalene conversion (space velocity 34,286 h−1). The reduced catalysts were treated at 790 °C for 5 h with the gas stream containing 26 vol. % H2O – 2000 ppmv HCl – 10 vol. % H2 – N2 (balance) followed by 5 h naphthalene reforming in the presence of 2000 ppmv of HCl and 5 h naphthalene reforming in the absence of HCl, and are denoted as Ni/Alumina (Exp. 1) and Commercial 1 (Exp. 2). The experiments were duplicated. The conversion efficiency of naphthalene decreased for both catalysts due to the shorter residence time but remained stable during reforming in the presence and absence of HCl (Fig. 11 ). The activity of Commercial 1 (Exp. 2) was higher compared to Ni/Alumina (Exp. 1) (89% vs 72%, respectively). For comparison, the conversion of naphthalene over fresh Ni/Alumina catalyst without HCl poisoning denoted as Ni/Alumina (Exp. 3) is included into the figure demonstrating the similar activity with Ni/Alumina (Exp. 1). According to these data, neither HCl poisoning nor removal of HCl from the gas stream had significant influence on the reforming of naphthalene during the 5 h tests. 3.3 Water-gas shift activity Although the conversion of naphthalene by alumina supported catalysts was not significantly influenced by HCl up to 2000 ppmv, the composition of product gases changed during the 5 h tests. Fig. 12 demonstrates the evolution of CO and CO2, which were the main reaction products along with H2, during catalytic reforming in the absence and presence of HCl. According to the results obtained from gas chromatography, the concentrations of C1–C5 hydrocarbons were below detection limits in the product gas. Dotted lines correspond to the contents of CO and CO2 in gas at thermodynamic equilibrium calculated based on the gas composition of the feed using HSC Chemistry 9 software. According to the calculations, the equilibrium can be achieved through the reforming of naphthalene by steam into CO and H2 followed by CO conversion by steam into CO2 and H2 via water-gas shift reaction [13]. Gibbs free energies of the reactions at 790 °C are −603.4 and −0.8 kJ mol−1, respectively. The negative value of Gibbs free energy for the reforming of naphthalene suggests that the reaction is thermodynamically feasible at this temperature. Water gas shift reaction is at equilibrium. The composition of product gas at thermodynamic equilibrium is shown in Table S2. The actual contents of CO and CO2, especially in the absence of HCl, were close to equilibrium concentrations in the beginning of reaction (i.e. 5–30 min) and changed thereafter (Fig. 12). Specifically, the CO production increased while CO2 production decreased during the 5 h tests. Previously, similar changes in gas composition were demonstrated during reforming of phenol and bio-oil compounds in the absence of HCl [31,32] and reforming of chlorinated hydrocarbons [13–16] and were attributed to the poisoning of water-gas shift activity. In the presence of 2000 ppmv of HCl, the contents of CO and CO2 in gas reached plateau after 2.5 h of reaction, while at lower HCl concentrations (500 and 1000 ppmv), the stabilization of CO and CO2 contents required longer time. In the absence of HCl, there was a continuous drift of CO and CO2 contents during the 5 h test. These results suggest that deactivation of catalyst occurred both in the absence and presence of HCl. The presence of HCl in the gas stream accelerated the process. Furthermore, with increasing HCl concentration from 0 to 2000 ppmv, the final content of CO increased from 0.7 to 1.0 mL-STP while the final content of CO2 decreased from 0.8 to 0.5 mL-STP, indicating more severe deactivation of the catalyst. According to Fig. S2, decreasing the space velocity from 24,000 to 6000 h−1 offsets the deactivation of catalysts and the concentrations of CO and CO2 are close to equilibrium during the 5 h tests. This could be due to the presence of sufficient amount of catalyst for the equilibration of water-gas shift reaction even though catalyst was partially deactivated during reforming. Fig. 13 shows the CO/CO2 ratios in the gas during naphthalene reforming over the catalysts in the absence and presence of HCl. In the absence of HCl, the CO/CO2 ratios were similar for all catalysts and relatively low (CO/CO2 < 2), which could be due to higher water-gas shift activity (Fig. 13a). Nevertheless, these ratios were higher than the ratio corresponding to thermodynamic equilibrium (CO/CO2 = 0.41), indicating that equilibrium was not attained at this space velocity. Compared to the reforming in the absence of HCl, the CO/CO2 ratios after 5 h tests increased in the presence of 2000 ppmv HCl to 1.8, 6.5 and 2.4 for the Ni/Alumina, Commercial 1 and Commercial 2 catalysts, respectively (Fig. 13b). The increase in CO/CO2 ratio of Ni/Alumina, Ni/Limestone and Commercial 2 was more pronounced within the first 30–150 min of reaction depending on the catalyst. However, the CO/CO2 ratio of Commercial 1 continued to increase during the 5 h test indicating that longer time was required for stabilization of catalytic activity compared to the other catalysts. The smaller difference between the two ratios in the absence and presence of HCl for Ni/Alumina (i.e. CO/CO2 ratios 0.9 and 1.8, respectively) indicates higher resistance to HCl poisoning compared to the commercial catalysts. Unlike the alumina supported catalysts, the CO/CO2 ratio of Ni/Limestone barely changed in the presence of HCl and was close to the thermodynamic equilibrium (CO/CO2 = 0.45) (Fig. 13b). Probably, the catalyst maintained high conversion of CO to CO2 due to the low CO production from naphthalene and, consequently, lower amount of catalyst was required for the equilibration of water-gas shift reaction compared to the other catalysts (Fig. 9b). Fig. 14 a shows the CO/CO2 ratios obtained during naphthalene reforming after HCl poisoning over Ni/Alumina (Exp. 1) and Commercial 1 (Exp. 2), and without HCl poisoning over Ni/Alumina (Exp. 3). During reforming both in the presence and absence of HCl, the CO/CO2 ratios of Ni/Alumina (Exp. 1) were maintained at ∼4. The CO/CO2 ratio of Ni/Alumina (Exp. 3) that was not exposed to HCl was lower compared to CO/CO2 ratios of the catalysts utilized after HCl poisoning. Similar to the data in Fig. 12, there was a drift in CO/CO2 ratio of Ni/Alumina (Exp. 3) during the 5 h test, indicating continuous deactivation in the absence of HCl. The CO/CO2 ratio of Commercial 1 (Exp. 2) increased in the presence of HCl within 100 min from 0.9 to 8 and then fluctuated between 8 and 11.4 both in the presence and absence of HCl. The scattered data for Commercial 1 could be attributed to the lower accuracy of analysis due to the relatively low concentrations of CO2 in the gas stream. Nevertheless, the data show that the CO/CO2 ratios of the catalysts decreased with the increase in the space velocity, which is consistent with the data in Figs. S2 and 13. Furthermore, when HCl was removed from the feed, water-gas shift activity was not restored, indicating that the poisoning was irreversible. To confirm that the increase in CO/CO2 ratios in presence of HCl was caused by the poisoning of water-gas shift activity, the spent Ni/Alumina (Exp. 1) and Ni/Alumina (Exp. 3) catalysts were used to catalyze water-gas shift reaction at 790 °C. The catalysts were subjected to 200 mL-STP min−1 of gas mixture containing 2.3 vol. % CO – 26 vol. % H2O – 10.2 vol. % H2 – N2 (balance), and are denoted as Ni/Alumina (Exp. 4) and Ni/Alumina (Exp. 5), respectively. The concentrations of steam and H2 were similar to those utilized during naphthalene reforming, while the concentration of CO was ∼3 times higher than that produced from naphthalene assuming 100% conversion. Fig. 14b shows the CO/CO2 ratios obtained during water-gas shift conversion over the catalysts. During blank experiments without the catalyst, there was no production of CO2 from CO indicating that at the reforming conditions, the presence of catalyst is required for the water-gas shift reaction. After 30 min of reaction, which was probably required to stabilize the gas flow, the CO/CO2 ratio of Ni/Alumina (Exp. 4) was 3.3 and it further decreased to 2.8 after 150 min of water-gas shift reaction. The CO/CO2 ratio of Ni/Alumina (Exp. 5) decreased from 2.5 after 30 min to 2.1 by the end of experiment. The higher CO/CO2 ratios of Ni/Alumina (Exp. 4) that was exposed to HCl indicate that water-gas shift activity was poisoned by HCl. Water-gas shift activity of the catalyst was not restored during this experiment, indicating that the poisoning was irreversible. These results are different from the data reported for reforming of chlorinated hydrocarbons, which showed that the water-gas shift activity can be restored after chlorinated hydrocarbons are removed from the gas stream [13]. The differences could be attributed to either shorter water-gas shift reaction time or the use of HCl in this study. To clarify the reasons for different water-gas shift activities of the nickel based catalysts supported on alumina (i.e. Ni/Alumina, Commercial 1 and Commercial 2), characterization of the spent catalysts was carried out after the reforming of naphthalene in the absence and presence of HCl. 3.4 Deactivation mechanism and resistance to HCl poisoning Table 3 summarizes surface areas and total pore volumes of the spent alumina supported catalysts calculated from N2 adsorption isotherms. According to Table 3, after the reforming in the absence and presence of HCl, the total pore volumes were similar to the pristine samples while BET surface areas decreased. The observed decrease in surface area was likely due to structural changes in catalysts during heating, reduction of nickel and reforming process. Among the catalysts, the spent Ni/Alumina had the largest surface areas and total pore volumes, which are typically associated with higher catalytic activity. However, there were minor differences (if any) in the porous properties of each catalyst after the reforming in the absence and presence of HCl. Furthermore, according to Fig. S3, there were either minor (Commercial 2) or no changes (Ni/Alumina and Commercial 1) in pore size distributions of the spent catalysts after reforming in the absence and presence of HCl, suggesting that the observed changes in water-gas shift activities could not be solely attributed to the porous properties of catalysts. It has been reported that NiCl2 evaporates from nickel surfaces exposed to Cl2 [33–35], which could lead to the loss of nickel from catalysts and decrease the catalytic activity. However, the formation of bulk NiCl2 from Ni and HCl at the reaction conditions used in this study is not thermodynamically favorable [36]. The absence of bulk NiCl2 was confirmed by XRD analysis as shown in Fig. 15 . In the spent samples, metallic nickel formed via reduction of NiO by H2 was only present both in the presence and absence of HCl. The appearance of Ni peaks in the XRD pattern of Ni/Alumina indicated the enlargement of Ni particles compared to the pristine catalyst. These data were confirmed by BSE imaging (Fig. S4). In the spent catalyst, discreet Ni particles can be observed as opposed to uniform surface coverage by Ni in the pristine catalyst (Fig. 3). According to XRD analysis (Fig. 15), there was no formation of other compounds in the presence of HCl (e.g., metal chlorides), as suggested by similar XRD patterns of the same catalyst after reforming (“no HCl” and “with HCl” cases). Previous studies reported that although at the reforming conditions no formation of bulk NiCl2 occurs, the spent nickel-based catalysts still contain chloride on nickel nanoparticles [37,38]. These chloride species can decrease the number of active sites and influence the water-gas shift activity of the catalysts. The presence of chloride in the spent Ni/Alumina was investigated using XPS (Fig. 16 ). After the reforming of naphthalene in the presence of HCl (“with HCl” case), a Cl 2p peak with binding energy 198.6 eV was observed, which can be attributed to the formation of NiCl2 on the catalyst surface [27,37]. After naphthalene reforming in the absence of HCl, no chloride peak was observed (‘no HCl’ case). There was also no chloride peak in the sample that was treated with HCl for 5 h followed by naphthalene reforming in the presence of HCl for 5 h and in the absence of HCl for 5 h (‘with HCl, no HCl’ case). These data suggest that when HCl is removed from the gas stream desorption of chloride species occurs. However, according to the data in Fig. 14a, CO/CO2 ratio remained similar after the removal of HCl from the gas stream, indicating that chemisorption of chloride species cannot explain the observed changes in water-gas shift activity. The differences in the extent of deactivation among the catalysts could be explained by the differences in structure and morphology as shown below. Fig. 17 shows the TEM images of spent catalysts after the reforming in the presence of HCl. In all samples, well-defined discrete round spots were observed representing Ni nanoparticles, which were surrounded by Al support material. There was no observable formation of filamentous or encapsulating carbon on the spent catalysts (Fig. 17), which could decrease the catalytic activity [11,39]. The TEM data were consistent with Raman spectra of the catalysts (Fig. S5), which demonstrated no Raman peaks at wavelengths approximately 1350 cm−1 (D-band) and 1580 cm−1 (G-band) corresponding to amorphous and graphitic carbon, which are present once coking of catalysts takes place [40]. This is likely due to the high steam content (26 vol. %) and high temperature used in this study, which eliminated catalyst coking [8]. The elemental analysis of spent catalysts after reforming in the absence and presence of HCl confirmed that there was no significant change in carbon content compared to pristine catalysts (Table S3). In Ni/Alumina, the nickel nanoparticles were surrounded by thick layers of alumina support (Fig. 17a and b) indicating strong nickel nanoparticle – support interaction. On the contrary, in the commercial catalysts, some of the surfaces of nickel nanoparticles were either lacking of contact with the support (specifically, in Commercial 1, Fig. 17c and d) or covered with thin layers of the support (specifically, in Commercial 2, Fig. 17e and f). The strong interactions between Ni nanoparticles and alumina in Ni/Alumina could be attributed to the nanosized morphology of the support, which can provide better contact between the materials, and could stabilize the performance of catalyst in the presence of HCl. Typically, strong interactions between metal nanoparticles and support prevent sintering [41]. Sintering of metallic particles is one of the common reasons for the loss of catalytic activity and is ascribed to two mechanisms: Ostwald ripening of particles, and particle migration and coalescence. Ripening involves emission of mobile species (i.e., atoms or vapors) from one particle and transport to another. Particle migration involves the Brownian motion of particles leading to coalescence when particles come in close proximity to each other [42,43]. Sintering typically increases with longer reaction time [43,44], higher temperature and steam content [45]. To investigate whether sintering increased during the naphthalene reforming in the presence of HCl, the size distributions of nickel nanoparticles in the spent catalysts were estimated from TEM images. In Fig. 18 , the size distributions are given for the samples after reforming in the absence and presence of HCl. In all catalysts, the sizes of nickel nanoparticles were larger after the exposure to HCl. After the reforming in the presence of HCl, Ni/Alumina contained 16.5% and 53.4% of nickel nanoparticles with sizes between 1–40 nm and 40–60 nm, respectively, compared to 0.9% and 27.5% in Commercial 1, respectively, and 7.0% and 39.1% in Commercial 2, respectively (Fig. 18). The observed disappearance of smaller nickel nanoparticles in order Ni/Alumina < Commercial 2 < Commercial 1 is consistent with the increase in CO/CO2 ratios of these catalysts in the same order (Fig. 13b), suggesting that nickel sintering caused by HCl was a likely reason for the loss of water-gas shift activity. The differences in particle size distributions in the absence and presence of HCl were less pronounced in Ni/Alumina (Fig. 18), indicating the higher structural stability and resistance to HCl poisoning of this catalyst. Based on the obtained data, the possible deactivation mechanism of catalysts by HCl could proceed via two subsequent stages. At the first stage, HCl reacted with nickel nanoparticles, which seems to increase mobility of nickel in catalysts [37,38]. At the second stage, sintering of the produced Ni-Cl species via Ostwald ripening and/or migration and coalescence of nanoparticles occurred resulting in the increased nanoparticle size and loss of water-gas shift activity. The extent of sintering varied among the catalysts and was less severe in the catalyst with the strong interactions between Ni nanoparticles and nanosized alumina support (i.e. Ni/Alumina). The conversion of naphthalene was not influenced by the presence of HCl implying that the deactivation mechanisms of water-gas shift and steam reforming reactions are different. Previously, various strategies increasing the stability towards sintering were proposed. Baktash et al. [41] employed atomic layer deposition of alumina on NiO nanoparticles prior to reduction into metallic Ni. Morales-Cano et al. [46] promoted a nickel catalyst with noble metals such as Rh, Ir and Ru. This study demonstrated an alternative approach for the fabrication of nickel catalyst with high sintering resistance and stability to HCl poisoning by utilizing a nanosized alumina support with high surface area. The disadvantage of such catalysts, however, is that the prepared tablets or particulates for commercial reactor may have insufficient mechanical strength unlike conventional catalysts prepared using dense low surface area supports, such as α-Al2O3. Furthermore, the porous alumina support may have lower thermal conductivity compared to dense non-porous material, which is disadvantageous for reforming reactions limited by heat transfer [47]. Nevertheless, these disadvantages can be overcome by, for instance, depositing the catalyst as a coating on the heat exchanger where the mechanical strength and thermal conductivity of catalyst would be not so important [48]. 4 Conclusions Nickel catalysts supported on alumina had higher and more stable naphthalene conversion both in the presence and absence of HCl compared to nickel on limestone. These results could be attributed to higher dispersion of nickel on the alumina supports due to larger porosities and surface areas as well inertness of alumina in HCl containing atmosphere. Although alumina supported catalysts had ∼100% naphthalene conversion at 500–2000 ppmv HCl and SV 24,000 h−1, CO/CO2 selectivity of catalysts changed in the presence of HCl, which could be attributed to the poisoning of water-gas shift activity. This phenomenon was related to the increased sintering of nickel nanoparticles caused by the exposure to HCl. The loss of water-gas shift activity could be minimized by developing a catalyst with strong interactions between nickel nanoparticles and support that increase resistance to sintering in the presence of HCl. Acknowledgements This research is supported by the National Research Foundation, Prime Minister’s Office, Singapore and the National Environment Agency, Ministry of the Environment and Water Resources, Singapore, under the Waste – to–Energy Competitive Research Programme (WTE CRP 1501 105). The authors also acknowledge the management of Nanyang Environment and Water Research Institute and Economic Development Board, Singapore for the support. Appendix A Supplementary data Supplementary material related to this article can be found, in the online version, at doi:https://doi.org/10.1016/j.apcata.2018.03.005. Appendix A Supplementary data The following is Supplementary data to this article: References [1] O. Moersch H. Spliethoff K.R.G. Hein Biomass Bioenergy 18 2000 79 86 [2] U. Arena Waste Manage. 32 2012 625 639 [3] J. Vehlow Waste Manage. 37 2015 58 74 [4] Y. Shen K. Yoshikawa Renew. Sustain. Energ. Rev. 21 2013 371 392 [5] R.W.R. Zwart Gas Cleaning Downstream Biomass Gasification. Status Report 2009 Energy research Centre of the Netherlands http://www.ecn.nl/docs/library/report/2008/e08078.pdf [6] P.A. Simell J.O. Hepola A.O.I. Krause Fuel 76 1997 1117 1127 [7] J. Corella A. Orio M.P. Aznar Ind. Eng. Chem. Res. 37 1998 4617 4624 [8] D.L. Trimm Catal. Today 37 1997 233 238 [9] M.M. Yung J.N. Kuhn Langmuir 26 2010 16589 16594 [10] C. Wu L. Dong J. Huang P.T. Williams RSC Adv. 3 2013 19239 19242 [11] I.F. Elbaba P.T. Williams Energy Fuels 28 2014 2104 2113 [12] S. Albertazzi F. Basile D. Barbera P. Benito J. Brandin J. Einvall G. Fornasari F. Trifiro A. Vaccari Top. Catal. 54 2011 746 754 [13] J.T. Richardson J.D. Ortego N. Coute M.V. Twigg Catal. Lett. 41 1996 17 20 [14] J.D. Ortego Jr J.T. Richardson M.V. Twigg Appl. Catal. B 12 1997 339 355 [15] N. Coute J.D. Ortego Jr J.T. Richardson M.V. Twigg Appl. Catal. B 19 1998 175 187 [16] N. Coute J.T. Richardson Appl. Catal. B 26 2000 217 226 [17] K.A. Spies J.E. Rainbolt X.S. Li B. Braunberger L. Li D.L. King R.A. Dagle Energy Fuels 31 2017 2448 2456 [18] R.W.R. Zwart Tar removal from low-temperature gasifiers Status Report 2010 Energy research Centre of the Netherlands https://www.ecn.nl/docs/library/report/2010/e10008.pdf [19] A. Jess Chem. Eng. Process. 35 1996 487 494 [20] R. Coll J. Salvado X. Farriol D. Montane Fuel Process. Technol. 74 2001 19 31 [21] L. Devi K.J. Ptasinski F.J.J.G. Janssen S.V.B. van Paasen P.C.A. Bergman J.H.A. Kiel Renew. Energy 30 2005 565 587 [22] J. Udomsirichakorn P. Basu P. Abdul Salam B. Acharya Int. J. Hydrogen Energy 38 2013 14495 14504 [23] K.S. Kim N. Winograd Surf. Sci. 43 1974 625 643 [24] J.P. Espinos A.R. Gonzalez-Elipe A. Fernandez G. Munuera Surf. Interface Anal. 19 1992 508 512 [25] E. Heracleous A.F. Lee K. Wilson A.A. Lemonidou J. Catal. 231 2005 159 171 [26] J.C. Vedrine G. Hollinger T.M. Duc J. Phys. Chem. 82 1978 1515 1520 [27] J.F. Moulder W.F. Stickle P.E. Sobol K.D. Bomben Handbook of X-ray Photoelectron Spectroscopy: A Reference Book of Standard Spectra for Identification and Interpretation of XPS Data 1992 Physical Electronics Division, Perkin-Elmer Corporation [28] J. Brito J. Laine Polyhedron 5 1986 179 182 [29] G. Garbarino I. Valsamakis P. Riani G. Busca Catal. Commun. 51 2014 37 41 [30] S. Sepehri M. Rezaei G. Garbarino G. Busca Int. J. Hydrogen Energy 41 2016 3456 3464 [31] L. Garcia R. French S. Czernik E. Chornet Appl. Catal. A 201 2000 225 239 [32] B. Matas Guell I.V. Babich L. Lefferts K. Seshan Appl. Catal. B 106 2011 280 286 [33] W. Erley H. Wagner Surf. Sci. 66 1977 371 375 [34] M. Kiskinova D.W. Goodman Surf. Sci. 108 1981 64 76 [35] J.D. McKinley Jr J. Phys. Chem. 40 1964 120 125 [36] O.A. Marina L.R. Pederson E.C. Thomsen C.A. Coyle K.J. Yoon J. Power Sources 195 2010 7033 7037 [37] C. Xu M. Gong J.W. Zondlo X. Liu H.O. Finklea J. Power Sources 195 2010 2149 2158 [38] H. Madi A. Lanzini D. Papurello S. Diethelm C. Ludwig M. Santarelli J. Van Herle J. Power Sources 326 2016 349 356 [39] J. Vicente C. Montero J. Erena M.J. Azkoiti J. Bilbao A.G. Gayubo Int. J. Hydrogen Energy 39 2014 12586 12596 [40] I.H. Son S.J. Lee I.Y. Song W.S. Jeon I. Jung D.J. Yun D.W. Jeong J.O. Shim W.J. Jang H.S. Roh Fuel 136 2014 194 200 [41] E. Baktash P. Littlewood R. Schomäcker A. Thomas P.C. Stair Appl. Catal. B 179 2015 122 127 [42] T.W. Hansen A.T. DeLaRiva S.R. Challa A.K. Datye Acc. Chem. Res. 46 2013 1720 1730 [43] A.T. DeLaRiva T.W. Hansen S.R. Challa A.K. Datye J. Catal. 308 2013 291 305 [44] T. van Haasterecht M. Swart K.P. de Jong J.H. Bitter J. Energy Chem. 25 2016 289 296 [45] A.C.S.C. Teixeira R. Giudici Chem. Eng. Sci. 54 1999 3609 3618 [46] F. Morales-Cano L.F. Lundegaard R.R. Tiruvalam H. Falsig M.S. Skjoth-Rasmussen Appl. Catal. A 498 2015 117 125 [47] L. Lao A. Aguirre A. Tran Z. Wu H. Durand P.D. Christofides Chem. Eng. Sci. 148 2016 78 92 [48] A. Ricca V. Palma M. Martino E. Meloni Fuel 198 2017 175 182",
      "scopus-id": "85044003503",
      "coredata": {
        "eid": "1-s2.0-S0926860X18301157",
        "dc:description": "Hydrogen chloride is commonly present in syngas produced from municipal solid waste and biomass gasification. The influence of HCl on the activity of nickel-based catalysts during catalytic naphthalene reforming was investigated. Two synthesized and two commercial catalysts were tested for steam reforming at 790 °C and SV 24,000 h−1. In the absence of HCl, nickel supported on limestone (Ni/Limestone) demonstrated lower naphthalene conversion (∼80%) compared to nickel supported on alumina (Ni/Alumina) and two commercial alumina supported catalysts (∼100%). In the presence of 2000 ppmv HCl, the naphthalene conversion of Ni/Limestone rapidly decreased due to the reaction with HCl and, probably, formation of molten CaCl2 deactivating the supported Ni nanoparticles. These data demonstrate limited applicability of calcium-based nickel catalysts for naphthalene reforming at the studied temperature. The efficiencies of Ni/Alumina and two commercial catalysts were maintained at ∼100% naphthalene conversion. However, HCl concentrations of 500–2000 ppmv had detrimental effect on water-gas shift activity of alumina supported catalysts during naphthalene reforming. The spent alumina supported catalysts were characterized by N2 adsorption, FESEM/EDS, XRD, XPS, TPR and TEM after the reforming in the absence and presence of HCl, and the results suggested that HCl increased nickel sintering in the catalysts causing the loss of water-gas shift activity. The losses of catalytic activity varied among the catalysts and were the lowest for Ni/Alumina, which contained nanosized porous alumina support and had the strongest Ni nanoparticle-support interactions.",
        "openArchiveArticle": "false",
        "prism:coverDate": "2018-05-05",
        "openaccessUserLicense": "http://creativecommons.org/licenses/by-nc-nd/4.0/",
        "prism:aggregationType": "Journal",
        "prism:url": "https://api.elsevier.com/content/article/pii/S0926860X18301157",
        "dc:creator": [
          {
            "@_fa": "true",
            "$": "Veksha, Andrei"
          },
          {
            "@_fa": "true",
            "$": "Giannis, Apostolos"
          },
          {
            "@_fa": "true",
            "$": "Oh, Wen-Da"
          },
          {
            "@_fa": "true",
            "$": "Chang, Victor W.-C."
          },
          {
            "@_fa": "true",
            "$": "Lisak, Grzegorz"
          },
          {
            "@_fa": "true",
            "$": "Lim, Teik-Thye"
          }
        ],
        "link": [
          {
            "@_fa": "true",
            "@rel": "self",
            "@href": "https://api.elsevier.com/content/article/pii/S0926860X18301157"
          },
          {
            "@_fa": "true",
            "@rel": "scidir",
            "@href": "https://www.sciencedirect.com/science/article/pii/S0926860X18301157"
          }
        ],
        "dc:format": "application/json",
        "openaccessType": "Full",
        "pii": "S0926-860X(18)30115-7",
        "prism:volume": "557",
        "prism:publisher": "The Authors. Published by Elsevier B.V.",
        "dc:title": "Catalytic activities and resistance to HCl poisoning of Ni-based catalysts during steam reforming of naphthalene",
        "prism:copyright": "© 2018 The Authors. Published by Elsevier B.V.",
        "openaccess": "1",
        "prism:issn": "0926860X",
        "dcterms:subject": [
          {
            "@_fa": "true",
            "$": "Hydrogen chloride"
          },
          {
            "@_fa": "true",
            "$": "Naphthalene"
          },
          {
            "@_fa": "true",
            "$": "Nickel catalyst"
          },
          {
            "@_fa": "true",
            "$": "Steam reforming"
          },
          {
            "@_fa": "true",
            "$": "Water-gas shift activity"
          }
        ],
        "openaccessArticle": "true",
        "prism:publicationName": "Applied Catalysis A: General",
        "openaccessSponsorType": "Author",
        "prism:pageRange": "25-38",
        "prism:endingPage": "38",
        "pubType": "fla",
        "prism:coverDisplayDate": "5 May 2018",
        "prism:doi": "10.1016/j.apcata.2018.03.005",
        "prism:startingPage": "25",
        "dc:identifier": "doi:10.1016/j.apcata.2018.03.005",
        "openaccessSponsorName": null
      },
      "objects": {
        "object": [
          {
            "@category": "thumbnail",
            "@height": "89",
            "@width": "219",
            "@_fa": "true",
            "$": "https://api.elsevier.com/content/object/eid/1-s2.0-S0926860X18301157-fx1.sml?httpAccept=%2A%2F%2A",
            "@multimediatype": "GIF image file",
            "@type": "IMAGE-THUMBNAIL",
            "@size": "6139",
            "@ref": "fx1",
            "@mimetype": "image/gif"
          },
          {
            "@category": "thumbnail",
            "@height": "164",
            "@width": "177",
            "@_fa": "true",
            "$": "https://api.elsevier.com/content/object/eid/1-s2.0-S0926860X18301157-gr1.sml?httpAccept=%2A%2F%2A",
            "@multimediatype": "GIF image file",
            "@type": "IMAGE-THUMBNAIL",
            "@size": "3555",
            "@ref": "gr1",
            "@mimetype": "image/gif"
          },
          {
            "@category": "thumbnail",
            "@height": "106",
            "@width": "219",
            "@_fa": "true",
            "$": "https://api.elsevier.com/content/object/eid/1-s2.0-S0926860X18301157-gr10.sml?httpAccept=%2A%2F%2A",
            "@multimediatype": "GIF image file",
            "@type": "IMAGE-THUMBNAIL",
            "@size": "16484",
            "@ref": "gr10",
            "@mimetype": "image/gif"
          },
          {
            "@category": "thumbnail",
            "@height": "164",
            "@width": "211",
            "@_fa": "true",
            "$": "https://api.elsevier.com/content/object/eid/1-s2.0-S0926860X18301157-gr11.sml?httpAccept=%2A%2F%2A",
            "@multimediatype": "GIF image file",
            "@type": "IMAGE-THUMBNAIL",
            "@size": "5747",
            "@ref": "gr11",
            "@mimetype": "image/gif"
          },
          {
            "@category": "thumbnail",
            "@height": "164",
            "@width": "106",
            "@_fa": "true",
            "$": "https://api.elsevier.com/content/object/eid/1-s2.0-S0926860X18301157-gr12.sml?httpAccept=%2A%2F%2A",
            "@multimediatype": "GIF image file",
            "@type": "IMAGE-THUMBNAIL",
            "@size": "4100",
            "@ref": "gr12",
            "@mimetype": "image/gif"
          },
          {
            "@category": "thumbnail",
            "@height": "163",
            "@width": "92",
            "@_fa": "true",
            "$": "https://api.elsevier.com/content/object/eid/1-s2.0-S0926860X18301157-gr13.sml?httpAccept=%2A%2F%2A",
            "@multimediatype": "GIF image file",
            "@type": "IMAGE-THUMBNAIL",
            "@size": "3458",
            "@ref": "gr13",
            "@mimetype": "image/gif"
          },
          {
            "@category": "thumbnail",
            "@height": "163",
            "@width": "111",
            "@_fa": "true",
            "$": "https://api.elsevier.com/content/object/eid/1-s2.0-S0926860X18301157-gr14.sml?httpAccept=%2A%2F%2A",
            "@multimediatype": "GIF image file",
            "@type": "IMAGE-THUMBNAIL",
            "@size": "3799",
            "@ref": "gr14",
            "@mimetype": "image/gif"
          },
          {
            "@category": "thumbnail",
            "@height": "158",
            "@width": "219",
            "@_fa": "true",
            "$": "https://api.elsevier.com/content/object/eid/1-s2.0-S0926860X18301157-gr15.sml?httpAccept=%2A%2F%2A",
            "@multimediatype": "GIF image file",
            "@type": "IMAGE-THUMBNAIL",
            "@size": "7296",
            "@ref": "gr15",
            "@mimetype": "image/gif"
          },
          {
            "@category": "thumbnail",
            "@height": "149",
            "@width": "219",
            "@_fa": "true",
            "$": "https://api.elsevier.com/content/object/eid/1-s2.0-S0926860X18301157-gr16.sml?httpAccept=%2A%2F%2A",
            "@multimediatype": "GIF image file",
            "@type": "IMAGE-THUMBNAIL",
            "@size": "7034",
            "@ref": "gr16",
            "@mimetype": "image/gif"
          },
          {
            "@category": "thumbnail",
            "@height": "163",
            "@width": "110",
            "@_fa": "true",
            "$": "https://api.elsevier.com/content/object/eid/1-s2.0-S0926860X18301157-gr17.sml?httpAccept=%2A%2F%2A",
            "@multimediatype": "GIF image file",
            "@type": "IMAGE-THUMBNAIL",
            "@size": "13504",
            "@ref": "gr17",
            "@mimetype": "image/gif"
          },
          {
            "@category": "thumbnail",
            "@height": "164",
            "@width": "116",
            "@_fa": "true",
            "$": "https://api.elsevier.com/content/object/eid/1-s2.0-S0926860X18301157-gr18.sml?httpAccept=%2A%2F%2A",
            "@multimediatype": "GIF image file",
            "@type": "IMAGE-THUMBNAIL",
            "@size": "4769",
            "@ref": "gr18",
            "@mimetype": "image/gif"
          },
          {
            "@category": "thumbnail",
            "@height": "164",
            "@width": "126",
            "@_fa": "true",
            "$": "https://api.elsevier.com/content/object/eid/1-s2.0-S0926860X18301157-gr2.sml?httpAccept=%2A%2F%2A",
            "@multimediatype": "GIF image file",
            "@type": "IMAGE-THUMBNAIL",
            "@size": "12079",
            "@ref": "gr2",
            "@mimetype": "image/gif"
          },
          {
            "@category": "thumbnail",
            "@height": "108",
            "@width": "219",
            "@_fa": "true",
            "$": "https://api.elsevier.com/content/object/eid/1-s2.0-S0926860X18301157-gr3.sml?httpAccept=%2A%2F%2A",
            "@multimediatype": "GIF image file",
            "@type": "IMAGE-THUMBNAIL",
            "@size": "14450",
            "@ref": "gr3",
            "@mimetype": "image/gif"
          },
          {
            "@category": "thumbnail",
            "@height": "116",
            "@width": "219",
            "@_fa": "true",
            "$": "https://api.elsevier.com/content/object/eid/1-s2.0-S0926860X18301157-gr4.sml?httpAccept=%2A%2F%2A",
            "@multimediatype": "GIF image file",
            "@type": "IMAGE-THUMBNAIL",
            "@size": "10203",
            "@ref": "gr4",
            "@mimetype": "image/gif"
          },
          {
            "@category": "thumbnail",
            "@height": "162",
            "@width": "61",
            "@_fa": "true",
            "$": "https://api.elsevier.com/content/object/eid/1-s2.0-S0926860X18301157-gr5.sml?httpAccept=%2A%2F%2A",
            "@multimediatype": "GIF image file",
            "@type": "IMAGE-THUMBNAIL",
            "@size": "3658",
            "@ref": "gr5",
            "@mimetype": "image/gif"
          },
          {
            "@category": "thumbnail",
            "@height": "164",
            "@width": "123",
            "@_fa": "true",
            "$": "https://api.elsevier.com/content/object/eid/1-s2.0-S0926860X18301157-gr6.sml?httpAccept=%2A%2F%2A",
            "@multimediatype": "GIF image file",
            "@type": "IMAGE-THUMBNAIL",
            "@size": "5274",
            "@ref": "gr6",
            "@mimetype": "image/gif"
          },
          {
            "@category": "thumbnail",
            "@height": "163",
            "@width": "162",
            "@_fa": "true",
            "$": "https://api.elsevier.com/content/object/eid/1-s2.0-S0926860X18301157-gr7.sml?httpAccept=%2A%2F%2A",
            "@multimediatype": "GIF image file",
            "@type": "IMAGE-THUMBNAIL",
            "@size": "3034",
            "@ref": "gr7",
            "@mimetype": "image/gif"
          },
          {
            "@category": "thumbnail",
            "@height": "164",
            "@width": "205",
            "@_fa": "true",
            "$": "https://api.elsevier.com/content/object/eid/1-s2.0-S0926860X18301157-gr8.sml?httpAccept=%2A%2F%2A",
            "@multimediatype": "GIF image file",
            "@type": "IMAGE-THUMBNAIL",
            "@size": "5208",
            "@ref": "gr8",
            "@mimetype": "image/gif"
          },
          {
            "@category": "thumbnail",
            "@height": "164",
            "@width": "103",
            "@_fa": "true",
            "$": "https://api.elsevier.com/content/object/eid/1-s2.0-S0926860X18301157-gr9.sml?httpAccept=%2A%2F%2A",
            "@multimediatype": "GIF image file",
            "@type": "IMAGE-THUMBNAIL",
            "@size": "3895",
            "@ref": "gr9",
            "@mimetype": "image/gif"
          },
          {
            "@category": "standard",
            "@height": "200",
            "@width": "495",
            "@_fa": "true",
            "$": "https://api.elsevier.com/content/object/eid/1-s2.0-S0926860X18301157-fx1.jpg?httpAccept=%2A%2F%2A",
            "@multimediatype": "JPEG image file",
            "@type": "IMAGE-DOWNSAMPLED",
            "@size": "32868",
            "@ref": "fx1",
            "@mimetype": "image/jpeg"
          },
          {
            "@category": "standard",
            "@height": "347",
            "@width": "376",
            "@_fa": "true",
            "$": "https://api.elsevier.com/content/object/eid/1-s2.0-S0926860X18301157-gr1.jpg?httpAccept=%2A%2F%2A",
            "@multimediatype": "JPEG image file",
            "@type": "IMAGE-DOWNSAMPLED",
            "@size": "16173",
            "@ref": "gr1",
            "@mimetype": "image/jpeg"
          },
          {
            "@category": "standard",
            "@height": "345",
            "@width": "715",
            "@_fa": "true",
            "$": "https://api.elsevier.com/content/object/eid/1-s2.0-S0926860X18301157-gr10.jpg?httpAccept=%2A%2F%2A",
            "@multimediatype": "JPEG image file",
            "@type": "IMAGE-DOWNSAMPLED",
            "@size": "103560",
            "@ref": "gr10",
            "@mimetype": "image/jpeg"
          },
          {
            "@category": "standard",
            "@height": "292",
            "@width": "376",
            "@_fa": "true",
            "$": "https://api.elsevier.com/content/object/eid/1-s2.0-S0926860X18301157-gr11.jpg?httpAccept=%2A%2F%2A",
            "@multimediatype": "JPEG image file",
            "@type": "IMAGE-DOWNSAMPLED",
            "@size": "20667",
            "@ref": "gr11",
            "@mimetype": "image/jpeg"
          },
          {
            "@category": "standard",
            "@height": "581",
            "@width": "376",
            "@_fa": "true",
            "$": "https://api.elsevier.com/content/object/eid/1-s2.0-S0926860X18301157-gr12.jpg?httpAccept=%2A%2F%2A",
            "@multimediatype": "JPEG image file",
            "@type": "IMAGE-DOWNSAMPLED",
            "@size": "39471",
            "@ref": "gr12",
            "@mimetype": "image/jpeg"
          },
          {
            "@category": "standard",
            "@height": "667",
            "@width": "376",
            "@_fa": "true",
            "$": "https://api.elsevier.com/content/object/eid/1-s2.0-S0926860X18301157-gr13.jpg?httpAccept=%2A%2F%2A",
            "@multimediatype": "JPEG image file",
            "@type": "IMAGE-DOWNSAMPLED",
            "@size": "36206",
            "@ref": "gr13",
            "@mimetype": "image/jpeg"
          },
          {
            "@category": "standard",
            "@height": "554",
            "@width": "376",
            "@_fa": "true",
            "$": "https://api.elsevier.com/content/object/eid/1-s2.0-S0926860X18301157-gr14.jpg?httpAccept=%2A%2F%2A",
            "@multimediatype": "JPEG image file",
            "@type": "IMAGE-DOWNSAMPLED",
            "@size": "35141",
            "@ref": "gr14",
            "@mimetype": "image/jpeg"
          },
          {
            "@category": "standard",
            "@height": "543",
            "@width": "753",
            "@_fa": "true",
            "$": "https://api.elsevier.com/content/object/eid/1-s2.0-S0926860X18301157-gr15.jpg?httpAccept=%2A%2F%2A",
            "@multimediatype": "JPEG image file",
            "@type": "IMAGE-DOWNSAMPLED",
            "@size": "76741",
            "@ref": "gr15",
            "@mimetype": "image/jpeg"
          },
          {
            "@category": "standard",
            "@height": "192",
            "@width": "282",
            "@_fa": "true",
            "$": "https://api.elsevier.com/content/object/eid/1-s2.0-S0926860X18301157-gr16.jpg?httpAccept=%2A%2F%2A",
            "@multimediatype": "JPEG image file",
            "@type": "IMAGE-DOWNSAMPLED",
            "@size": "16081",
            "@ref": "gr16",
            "@mimetype": "image/jpeg"
          },
          {
            "@category": "standard",
            "@height": "837",
            "@width": "565",
            "@_fa": "true",
            "$": "https://api.elsevier.com/content/object/eid/1-s2.0-S0926860X18301157-gr17.jpg?httpAccept=%2A%2F%2A",
            "@multimediatype": "JPEG image file",
            "@type": "IMAGE-DOWNSAMPLED",
            "@size": "135517",
            "@ref": "gr17",
            "@mimetype": "image/jpeg"
          },
          {
            "@category": "standard",
            "@height": "532",
            "@width": "376",
            "@_fa": "true",
            "$": "https://api.elsevier.com/content/object/eid/1-s2.0-S0926860X18301157-gr18.jpg?httpAccept=%2A%2F%2A",
            "@multimediatype": "JPEG image file",
            "@type": "IMAGE-DOWNSAMPLED",
            "@size": "37970",
            "@ref": "gr18",
            "@mimetype": "image/jpeg"
          },
          {
            "@category": "standard",
            "@height": "932",
            "@width": "715",
            "@_fa": "true",
            "$": "https://api.elsevier.com/content/object/eid/1-s2.0-S0926860X18301157-gr2.jpg?httpAccept=%2A%2F%2A",
            "@multimediatype": "JPEG image file",
            "@type": "IMAGE-DOWNSAMPLED",
            "@size": "237529",
            "@ref": "gr2",
            "@mimetype": "image/jpeg"
          },
          {
            "@category": "standard",
            "@height": "352",
            "@width": "715",
            "@_fa": "true",
            "$": "https://api.elsevier.com/content/object/eid/1-s2.0-S0926860X18301157-gr3.jpg?httpAccept=%2A%2F%2A",
            "@multimediatype": "JPEG image file",
            "@type": "IMAGE-DOWNSAMPLED",
            "@size": "62694",
            "@ref": "gr3",
            "@mimetype": "image/jpeg"
          },
          {
            "@category": "standard",
            "@height": "380",
            "@width": "715",
            "@_fa": "true",
            "$": "https://api.elsevier.com/content/object/eid/1-s2.0-S0926860X18301157-gr4.jpg?httpAccept=%2A%2F%2A",
            "@multimediatype": "JPEG image file",
            "@type": "IMAGE-DOWNSAMPLED",
            "@size": "71966",
            "@ref": "gr4",
            "@mimetype": "image/jpeg"
          },
          {
            "@category": "standard",
            "@height": "899",
            "@width": "339",
            "@_fa": "true",
            "$": "https://api.elsevier.com/content/object/eid/1-s2.0-S0926860X18301157-gr5.jpg?httpAccept=%2A%2F%2A",
            "@multimediatype": "JPEG image file",
            "@type": "IMAGE-DOWNSAMPLED",
            "@size": "58615",
            "@ref": "gr5",
            "@mimetype": "image/jpeg"
          },
          {
            "@category": "standard",
            "@height": "950",
            "@width": "715",
            "@_fa": "true",
            "$": "https://api.elsevier.com/content/object/eid/1-s2.0-S0926860X18301157-gr6.jpg?httpAccept=%2A%2F%2A",
            "@multimediatype": "JPEG image file",
            "@type": "IMAGE-DOWNSAMPLED",
            "@size": "103522",
            "@ref": "gr6",
            "@mimetype": "image/jpeg"
          },
          {
            "@category": "standard",
            "@height": "379",
            "@width": "376",
            "@_fa": "true",
            "$": "https://api.elsevier.com/content/object/eid/1-s2.0-S0926860X18301157-gr7.jpg?httpAccept=%2A%2F%2A",
            "@multimediatype": "JPEG image file",
            "@type": "IMAGE-DOWNSAMPLED",
            "@size": "17452",
            "@ref": "gr7",
            "@mimetype": "image/jpeg"
          },
          {
            "@category": "standard",
            "@height": "301",
            "@width": "376",
            "@_fa": "true",
            "$": "https://api.elsevier.com/content/object/eid/1-s2.0-S0926860X18301157-gr8.jpg?httpAccept=%2A%2F%2A",
            "@multimediatype": "JPEG image file",
            "@type": "IMAGE-DOWNSAMPLED",
            "@size": "18821",
            "@ref": "gr8",
            "@mimetype": "image/jpeg"
          },
          {
            "@category": "standard",
            "@height": "597",
            "@width": "376",
            "@_fa": "true",
            "$": "https://api.elsevier.com/content/object/eid/1-s2.0-S0926860X18301157-gr9.jpg?httpAccept=%2A%2F%2A",
            "@multimediatype": "JPEG image file",
            "@type": "IMAGE-DOWNSAMPLED",
            "@size": "34700",
            "@ref": "gr9",
            "@mimetype": "image/jpeg"
          },
          {
            "@category": "high",
            "@height": "886",
            "@width": "2191",
            "@_fa": "true",
            "$": "https://api.elsevier.com/content/object/eid/1-s2.0-S0926860X18301157-fx1_lrg.jpg?httpAccept=%2A%2F%2A",
            "@multimediatype": "JPEG image file",
            "@type": "IMAGE-HIGH-RES",
            "@size": "221623",
            "@ref": "fx1",
            "@mimetype": "image/jpeg"
          },
          {
            "@category": "high",
            "@height": "1540",
            "@width": "1667",
            "@_fa": "true",
            "$": "https://api.elsevier.com/content/object/eid/1-s2.0-S0926860X18301157-gr1_lrg.jpg?httpAccept=%2A%2F%2A",
            "@multimediatype": "JPEG image file",
            "@type": "IMAGE-HIGH-RES",
            "@size": "111852",
            "@ref": "gr1",
            "@mimetype": "image/jpeg"
          },
          {
            "@category": "high",
            "@height": "1529",
            "@width": "3167",
            "@_fa": "true",
            "$": "https://api.elsevier.com/content/object/eid/1-s2.0-S0926860X18301157-gr10_lrg.jpg?httpAccept=%2A%2F%2A",
            "@multimediatype": "JPEG image file",
            "@type": "IMAGE-HIGH-RES",
            "@size": "1521027",
            "@ref": "gr10",
            "@mimetype": "image/jpeg"
          },
          {
            "@category": "high",
            "@height": "1293",
            "@width": "1667",
            "@_fa": "true",
            "$": "https://api.elsevier.com/content/object/eid/1-s2.0-S0926860X18301157-gr11_lrg.jpg?httpAccept=%2A%2F%2A",
            "@multimediatype": "JPEG image file",
            "@type": "IMAGE-HIGH-RES",
            "@size": "163229",
            "@ref": "gr11",
            "@mimetype": "image/jpeg"
          },
          {
            "@category": "high",
            "@height": "2578",
            "@width": "1667",
            "@_fa": "true",
            "$": "https://api.elsevier.com/content/object/eid/1-s2.0-S0926860X18301157-gr12_lrg.jpg?httpAccept=%2A%2F%2A",
            "@multimediatype": "JPEG image file",
            "@type": "IMAGE-HIGH-RES",
            "@size": "302843",
            "@ref": "gr12",
            "@mimetype": "image/jpeg"
          },
          {
            "@category": "high",
            "@height": "2957",
            "@width": "1667",
            "@_fa": "true",
            "$": "https://api.elsevier.com/content/object/eid/1-s2.0-S0926860X18301157-gr13_lrg.jpg?httpAccept=%2A%2F%2A",
            "@multimediatype": "JPEG image file",
            "@type": "IMAGE-HIGH-RES",
            "@size": "275336",
            "@ref": "gr13",
            "@mimetype": "image/jpeg"
          },
          {
            "@category": "high",
            "@height": "2454",
            "@width": "1667",
            "@_fa": "true",
            "$": "https://api.elsevier.com/content/object/eid/1-s2.0-S0926860X18301157-gr14_lrg.jpg?httpAccept=%2A%2F%2A",
            "@multimediatype": "JPEG image file",
            "@type": "IMAGE-HIGH-RES",
            "@size": "259041",
            "@ref": "gr14",
            "@mimetype": "image/jpeg"
          },
          {
            "@category": "high",
            "@height": "2404",
            "@width": "3333",
            "@_fa": "true",
            "$": "https://api.elsevier.com/content/object/eid/1-s2.0-S0926860X18301157-gr15_lrg.jpg?httpAccept=%2A%2F%2A",
            "@multimediatype": "JPEG image file",
            "@type": "IMAGE-HIGH-RES",
            "@size": "595162",
            "@ref": "gr15",
            "@mimetype": "image/jpeg"
          },
          {
            "@category": "high",
            "@height": "849",
            "@width": "1250",
            "@_fa": "true",
            "$": "https://api.elsevier.com/content/object/eid/1-s2.0-S0926860X18301157-gr16_lrg.jpg?httpAccept=%2A%2F%2A",
            "@multimediatype": "JPEG image file",
            "@type": "IMAGE-HIGH-RES",
            "@size": "117027",
            "@ref": "gr16",
            "@mimetype": "image/jpeg"
          },
          {
            "@category": "high",
            "@height": "3703",
            "@width": "2500",
            "@_fa": "true",
            "$": "https://api.elsevier.com/content/object/eid/1-s2.0-S0926860X18301157-gr17_lrg.jpg?httpAccept=%2A%2F%2A",
            "@multimediatype": "JPEG image file",
            "@type": "IMAGE-HIGH-RES",
            "@size": "2223479",
            "@ref": "gr17",
            "@mimetype": "image/jpeg"
          },
          {
            "@category": "high",
            "@height": "2360",
            "@width": "1667",
            "@_fa": "true",
            "$": "https://api.elsevier.com/content/object/eid/1-s2.0-S0926860X18301157-gr18_lrg.jpg?httpAccept=%2A%2F%2A",
            "@multimediatype": "JPEG image file",
            "@type": "IMAGE-HIGH-RES",
            "@size": "258396",
            "@ref": "gr18",
            "@mimetype": "image/jpeg"
          },
          {
            "@category": "high",
            "@height": "4126",
            "@width": "3167",
            "@_fa": "true",
            "$": "https://api.elsevier.com/content/object/eid/1-s2.0-S0926860X18301157-gr2_lrg.jpg?httpAccept=%2A%2F%2A",
            "@multimediatype": "JPEG image file",
            "@type": "IMAGE-HIGH-RES",
            "@size": "2400619",
            "@ref": "gr2",
            "@mimetype": "image/jpeg"
          },
          {
            "@category": "high",
            "@height": "1560",
            "@width": "3167",
            "@_fa": "true",
            "$": "https://api.elsevier.com/content/object/eid/1-s2.0-S0926860X18301157-gr3_lrg.jpg?httpAccept=%2A%2F%2A",
            "@multimediatype": "JPEG image file",
            "@type": "IMAGE-HIGH-RES",
            "@size": "1167317",
            "@ref": "gr3",
            "@mimetype": "image/jpeg"
          },
          {
            "@category": "high",
            "@height": "1682",
            "@width": "3167",
            "@_fa": "true",
            "$": "https://api.elsevier.com/content/object/eid/1-s2.0-S0926860X18301157-gr4_lrg.jpg?httpAccept=%2A%2F%2A",
            "@multimediatype": "JPEG image file",
            "@type": "IMAGE-HIGH-RES",
            "@size": "1090152",
            "@ref": "gr4",
            "@mimetype": "image/jpeg"
          },
          {
            "@category": "high",
            "@height": "3980",
            "@width": "1500",
            "@_fa": "true",
            "$": "https://api.elsevier.com/content/object/eid/1-s2.0-S0926860X18301157-gr5_lrg.jpg?httpAccept=%2A%2F%2A",
            "@multimediatype": "JPEG image file",
            "@type": "IMAGE-HIGH-RES",
            "@size": "466845",
            "@ref": "gr5",
            "@mimetype": "image/jpeg"
          },
          {
            "@category": "high",
            "@height": "4210",
            "@width": "3167",
            "@_fa": "true",
            "$": "https://api.elsevier.com/content/object/eid/1-s2.0-S0926860X18301157-gr6_lrg.jpg?httpAccept=%2A%2F%2A",
            "@multimediatype": "JPEG image file",
            "@type": "IMAGE-HIGH-RES",
            "@size": "768610",
            "@ref": "gr6",
            "@mimetype": "image/jpeg"
          },
          {
            "@category": "high",
            "@height": "1680",
            "@width": "1667",
            "@_fa": "true",
            "$": "https://api.elsevier.com/content/object/eid/1-s2.0-S0926860X18301157-gr7_lrg.jpg?httpAccept=%2A%2F%2A",
            "@multimediatype": "JPEG image file",
            "@type": "IMAGE-HIGH-RES",
            "@size": "144007",
            "@ref": "gr7",
            "@mimetype": "image/jpeg"
          },
          {
            "@category": "high",
            "@height": "1334",
            "@width": "1667",
            "@_fa": "true",
            "$": "https://api.elsevier.com/content/object/eid/1-s2.0-S0926860X18301157-gr8_lrg.jpg?httpAccept=%2A%2F%2A",
            "@multimediatype": "JPEG image file",
            "@type": "IMAGE-HIGH-RES",
            "@size": "141175",
            "@ref": "gr8",
            "@mimetype": "image/jpeg"
          },
          {
            "@category": "high",
            "@height": "2648",
            "@width": "1667",
            "@_fa": "true",
            "$": "https://api.elsevier.com/content/object/eid/1-s2.0-S0926860X18301157-gr9_lrg.jpg?httpAccept=%2A%2F%2A",
            "@multimediatype": "JPEG image file",
            "@type": "IMAGE-HIGH-RES",
            "@size": "282794",
            "@ref": "gr9",
            "@mimetype": "image/jpeg"
          },
          {
            "@category": "standard",
            "@_fa": "true",
            "$": "https://api.elsevier.com/content/object/eid/1-s2.0-S0926860X18301157-mmc1.docx?httpAccept=%2A%2F%2A",
            "@multimediatype": "Microsoft Word file",
            "@type": "APPLICATION",
            "@size": "1378938",
            "@ref": "mmc1",
            "@mimetype": "application/word"
          }
        ]
      },
      "link": {
        "@rel": "abstract",
        "@href": "https://api.elsevier.com/content/abstract/scopus_id/85044003503"
      }
    }
  }
}