{
  "metadata": {
    "title": "Mn-promoted hydrogenation of microalgae (<ce:italic>Chlorococcum</ce:italic> sp.) to 1,2-propanediol and ethylene glycol over Ni-ZnO catalysts",
    "authors": "; ; ",
    "journal": "Applied Catalysis A: General",
    "date": "2018-09-05",
    "doi": "10.1016/j.apcata.2018.07.042",
    "abstract": "",
    "uri": "https://api.elsevier.com/content/article/pii/S0926860X18303818",
    "pii": "S0926860X18303818"
  },
  "fulltext": {
    "full-text-retrieval-response": {
      "scopus-eid": "2-s2.0-85051011483",
      "originalText": "serial JL 271346 291210 291744 291809 31 Applied Catalysis A: General APPLIEDCATALYSISAGENERAL 2018-08-02 2018-08-02 2018-08-07 2018-08-07 2018-08-29T04:52:50 1-s2.0-S0926860X18303818 S0926-860X(18)30381-8 S0926860X18303818 10.1016/j.apcata.2018.07.042 S300 S300.1 FULL-TEXT 1-s2.0-S0926860X18X00143 2024-01-01T12:33:10.553292Z 0 0 20180905 2018 2018-08-02T15:37:57.978139Z absattachment articleinfo articletitlenorm authfirstinitialnorm authfirstsurnamenorm cid cids contenttype copyright crossmark dateloaded dateloadedtxt datesearch datesort dateupdated dco docsubtype doctype doi eid ewtransactionid hubeid indexeddate issn issnnorm itemstage itemtransactionid itemweight openaccess openarchive pg pgfirst pglast pii piinorm pubdatestart pubdatetxt pubyr sectiontitle sortorder srctitle srctitlenorm srctype ssids alllist content subj subheadings suppl tomb volfirst volissue volumelist webpdf webpdfpagecount yearnav figure table e-component body acknowledge affil appendices articletitle auth authfirstini authfull authkeywords authlast highlightsabst orcid primabst ref specialabst 0926-860X 0926860X true 565 565 C Volume 565 6 34 45 34 45 20180905 5 September 2018 2018-09-05 2018 Regular papers article fla © 2018 Elsevier B.V. All rights reserved. MNPROMOTEDHYDROGENATIONMICROALGAECHLOROCOCCUMSP12PROPANEDIOLETHYLENEGLYCOLOVERNIZNOCATALYSTS MIAO G 1 Introduction 2 Experimental section 2.1 Materials 2.2 Catalyst preparation 2.3 Catalyst characterization 2.4 Catalytic experiments and product analysis 3 Results and discussion 3.1 Screening of promoters for Ni-based catalysts 3.2 Properties of Mn-promoted Ni-ZnO catalysts 3.3 Performance of Mn-promoted Ni-ZnO for microalgae conversion 3.4 Mn promotion effects on the conversion of microalgae 4 Conclusions Acknowledgments Appendix A Supplementary data References CORMA 2007 2411 A WANG 2013 1377 A FUKUOKA 2006 5161 A MAKIARVELA 2014 1909 P CHATTERJEE 2015 40 C LI 2014 393 J BEECK 2015 230 B WANG 2016 452 J SADABA 2015 4133 I YANG 2016 206 Y VYVER 2012 1549 S SONG 2017 115 S JI 2008 8510 N PANG 2011 6601 J JI 2012 939 N WANG 2012 758 X XU 2015 65 G ZHANG 2014 3804 J CHEN 2013 86 X SUN 2014 75 J TAI 2012 7052 Z PANG 2014 2254 J ZHOU 2012 932 L LI 2012 6383 M MIAO 2015 2538 G CHEN 2005 17 B TOMISHIGE 2017 2876 K LIU 2018 251 H KIM 2016 113 M YU 2010 73 W KHODAKOV 2007 1692 A MORALES 2005 301 F DENG 2013 116 T WANG 2012 476 X CHEN 2015 43 W HOLZWARTH 2011 534 U PERRET 2014 128 N ZHOU 2014 393 G EMEIS 1993 347 C ROMERO 2017 49 A CAI 2014 59 H ZHAO 2011 522 M DELANNOY 2006 22471 L WANG 2013 92 G MORALES 2004 16201 F MA 2011 3325 Q LUO 2011 7636 C SUN 2011 135 J LAZARIDIS 2017 1 P XIAO 2013 891 Z SCHOLZ 2014 268 D SAMANT 2012 8658 B MAKIARVELA 2005 41 P OBREGON 2017 328 I SUN 2015 874 R YANG 2014 91 Y GEBOERS 2010 3577 J WU 2017 227 J DAPSENS 2015 7025 P LIU 2015 4612 C TAKAGAKI 2014 43785 A VERMA 2017 1969 D YANG 2016 207 L DENG 2014 31 W MIAOX2018X34 MIAOX2018X34X45 MIAOX2018X34XG MIAOX2018X34X45XG 2020-08-07T00:00:00.000Z 2020-08-07T00:00:00.000Z http://creativecommons.org/licenses/by-nc-nd/4.0/ © 2018 Elsevier B.V. All rights reserved. item S0926-860X(18)30381-8 S0926860X18303818 1-s2.0-S0926860X18303818 10.1016/j.apcata.2018.07.042 271346 2024-01-01T12:33:10.553292Z 2018-09-05 1-s2.0-S0926860X18303818-main.pdf https://s3-eu-west-1.amazonaws.com/prod-ucs-content-store-eu-west/content/pii:S0926860X18303818/MAIN/application/pdf/3a02c4ce1e19a8e12760191a4d61292b/main.pdf https://s3.amazonaws.com/prod-ucs-content-store-us-east/content/pii:S0926860X18303818/MAIN/application/pdf/3a02c4ce1e19a8e12760191a4d61292b/main.pdf main.pdf pdf true 4191615 MAIN 12 1-s2.0-S0926860X18303818-main_1.png https://s3-eu-west-1.amazonaws.com/prod-ucs-content-store-eu-west/content/pii:S0926860X18303818/PREVIEW/image/png/6b2dda0c334fdafd67430889aed0d77b/main_1.png https://s3.amazonaws.com/prod-ucs-content-store-us-east/content/pii:S0926860X18303818/PREVIEW/image/png/6b2dda0c334fdafd67430889aed0d77b/main_1.png main_1.png png 55616 849 656 IMAGE-WEB-PDF 1 1-s2.0-S0926860X18303818-ga1.sml https://s3-eu-west-1.amazonaws.com/prod-ucs-content-store-eu-west/content/pii:S0926860X18303818/ga1/THUMBNAIL/image/gif/895f29105105ea67d078f9f0cc6f846b/ga1.sml https://s3.amazonaws.com/prod-ucs-content-store-us-east/content/pii:S0926860X18303818/ga1/THUMBNAIL/image/gif/895f29105105ea67d078f9f0cc6f846b/ga1.sml ga1 true ga1.sml sml 10814 87 219 IMAGE-THUMBNAIL 1-s2.0-S0926860X18303818-gr1.sml https://s3-eu-west-1.amazonaws.com/prod-ucs-content-store-eu-west/content/pii:S0926860X18303818/gr1/THUMBNAIL/image/gif/06365a414c813e1100959b3ab206e116/gr1.sml https://s3.amazonaws.com/prod-ucs-content-store-us-east/content/pii:S0926860X18303818/gr1/THUMBNAIL/image/gif/06365a414c813e1100959b3ab206e116/gr1.sml gr1 gr1.sml sml 8958 164 206 IMAGE-THUMBNAIL 1-s2.0-S0926860X18303818-gr2.sml https://s3-eu-west-1.amazonaws.com/prod-ucs-content-store-eu-west/content/pii:S0926860X18303818/gr2/THUMBNAIL/image/gif/2a20ff112b4d2d870557ed8bbf62888c/gr2.sml https://s3.amazonaws.com/prod-ucs-content-store-us-east/content/pii:S0926860X18303818/gr2/THUMBNAIL/image/gif/2a20ff112b4d2d870557ed8bbf62888c/gr2.sml gr2 gr2.sml sml 4539 164 191 IMAGE-THUMBNAIL 1-s2.0-S0926860X18303818-gr3.sml https://s3-eu-west-1.amazonaws.com/prod-ucs-content-store-eu-west/content/pii:S0926860X18303818/gr3/THUMBNAIL/image/gif/cdf84aed34faa1655ecc2d0c20554286/gr3.sml https://s3.amazonaws.com/prod-ucs-content-store-us-east/content/pii:S0926860X18303818/gr3/THUMBNAIL/image/gif/cdf84aed34faa1655ecc2d0c20554286/gr3.sml gr3 gr3.sml sml 4783 85 219 IMAGE-THUMBNAIL 1-s2.0-S0926860X18303818-gr4.sml https://s3-eu-west-1.amazonaws.com/prod-ucs-content-store-eu-west/content/pii:S0926860X18303818/gr4/THUMBNAIL/image/gif/9fcb70726edcc3c9b1dee6c4fbec3300/gr4.sml https://s3.amazonaws.com/prod-ucs-content-store-us-east/content/pii:S0926860X18303818/gr4/THUMBNAIL/image/gif/9fcb70726edcc3c9b1dee6c4fbec3300/gr4.sml gr4 gr4.sml sml 3472 164 200 IMAGE-THUMBNAIL 1-s2.0-S0926860X18303818-gr5.sml https://s3-eu-west-1.amazonaws.com/prod-ucs-content-store-eu-west/content/pii:S0926860X18303818/gr5/THUMBNAIL/image/gif/c2ca53de7e36c24d8e5bca7731bc602b/gr5.sml https://s3.amazonaws.com/prod-ucs-content-store-us-east/content/pii:S0926860X18303818/gr5/THUMBNAIL/image/gif/c2ca53de7e36c24d8e5bca7731bc602b/gr5.sml gr5 gr5.sml sml 17181 164 181 IMAGE-THUMBNAIL 1-s2.0-S0926860X18303818-gr6.sml https://s3-eu-west-1.amazonaws.com/prod-ucs-content-store-eu-west/content/pii:S0926860X18303818/gr6/THUMBNAIL/image/gif/4769e44e62ba45f18b0e29cdc97d70a0/gr6.sml https://s3.amazonaws.com/prod-ucs-content-store-us-east/content/pii:S0926860X18303818/gr6/THUMBNAIL/image/gif/4769e44e62ba45f18b0e29cdc97d70a0/gr6.sml gr6 gr6.sml sml 14594 164 183 IMAGE-THUMBNAIL 1-s2.0-S0926860X18303818-gr7.sml https://s3-eu-west-1.amazonaws.com/prod-ucs-content-store-eu-west/content/pii:S0926860X18303818/gr7/THUMBNAIL/image/gif/8b837c4bd2cf482b1785a9d7a747841c/gr7.sml https://s3.amazonaws.com/prod-ucs-content-store-us-east/content/pii:S0926860X18303818/gr7/THUMBNAIL/image/gif/8b837c4bd2cf482b1785a9d7a747841c/gr7.sml gr7 gr7.sml sml 10516 104 219 IMAGE-THUMBNAIL 1-s2.0-S0926860X18303818-gr8.sml https://s3-eu-west-1.amazonaws.com/prod-ucs-content-store-eu-west/content/pii:S0926860X18303818/gr8/THUMBNAIL/image/gif/8e1a5de34b971fc98212ff1d14bb6258/gr8.sml https://s3.amazonaws.com/prod-ucs-content-store-us-east/content/pii:S0926860X18303818/gr8/THUMBNAIL/image/gif/8e1a5de34b971fc98212ff1d14bb6258/gr8.sml gr8 gr8.sml sml 17502 144 219 IMAGE-THUMBNAIL 1-s2.0-S0926860X18303818-gr9.sml https://s3-eu-west-1.amazonaws.com/prod-ucs-content-store-eu-west/content/pii:S0926860X18303818/gr9/THUMBNAIL/image/gif/6ae0e9d64840b7ddc7878aa8d57e71b3/gr9.sml https://s3.amazonaws.com/prod-ucs-content-store-us-east/content/pii:S0926860X18303818/gr9/THUMBNAIL/image/gif/6ae0e9d64840b7ddc7878aa8d57e71b3/gr9.sml gr9 gr9.sml sml 5171 157 219 IMAGE-THUMBNAIL 1-s2.0-S0926860X18303818-sc1.sml https://s3-eu-west-1.amazonaws.com/prod-ucs-content-store-eu-west/content/pii:S0926860X18303818/sc1/THUMBNAIL/image/gif/f129b83985880a1ecb522edd9d54c20d/sc1.sml https://s3.amazonaws.com/prod-ucs-content-store-us-east/content/pii:S0926860X18303818/sc1/THUMBNAIL/image/gif/f129b83985880a1ecb522edd9d54c20d/sc1.sml sc1 sc1.sml sml 4169 88 219 IMAGE-THUMBNAIL 1-s2.0-S0926860X18303818-ga1.jpg https://s3-eu-west-1.amazonaws.com/prod-ucs-content-store-eu-west/content/pii:S0926860X18303818/ga1/DOWNSAMPLED/image/jpeg/517f098bf40c18b592a5c5f2e1130309/ga1.jpg https://s3.amazonaws.com/prod-ucs-content-store-us-east/content/pii:S0926860X18303818/ga1/DOWNSAMPLED/image/jpeg/517f098bf40c18b592a5c5f2e1130309/ga1.jpg ga1 true ga1.jpg jpg 31300 198 500 IMAGE-DOWNSAMPLED 1-s2.0-S0926860X18303818-gr1.jpg https://s3-eu-west-1.amazonaws.com/prod-ucs-content-store-eu-west/content/pii:S0926860X18303818/gr1/DOWNSAMPLED/image/jpeg/d35f6e4288202991d292da1f34f2ec42/gr1.jpg https://s3.amazonaws.com/prod-ucs-content-store-us-east/content/pii:S0926860X18303818/gr1/DOWNSAMPLED/image/jpeg/d35f6e4288202991d292da1f34f2ec42/gr1.jpg gr1 gr1.jpg jpg 105629 629 791 IMAGE-DOWNSAMPLED 1-s2.0-S0926860X18303818-gr2.jpg https://s3-eu-west-1.amazonaws.com/prod-ucs-content-store-eu-west/content/pii:S0926860X18303818/gr2/DOWNSAMPLED/image/jpeg/789446eda448f066e2886cdf1f5bba77/gr2.jpg https://s3.amazonaws.com/prod-ucs-content-store-us-east/content/pii:S0926860X18303818/gr2/DOWNSAMPLED/image/jpeg/789446eda448f066e2886cdf1f5bba77/gr2.jpg gr2 gr2.jpg jpg 22238 321 374 IMAGE-DOWNSAMPLED 1-s2.0-S0926860X18303818-gr3.jpg https://s3-eu-west-1.amazonaws.com/prod-ucs-content-store-eu-west/content/pii:S0926860X18303818/gr3/DOWNSAMPLED/image/jpeg/673d18bba5441588a8fe63d2ce909b9a/gr3.jpg https://s3.amazonaws.com/prod-ucs-content-store-us-east/content/pii:S0926860X18303818/gr3/DOWNSAMPLED/image/jpeg/673d18bba5441588a8fe63d2ce909b9a/gr3.jpg gr3 gr3.jpg jpg 53143 308 791 IMAGE-DOWNSAMPLED 1-s2.0-S0926860X18303818-gr4.jpg https://s3-eu-west-1.amazonaws.com/prod-ucs-content-store-eu-west/content/pii:S0926860X18303818/gr4/DOWNSAMPLED/image/jpeg/b33e83672a41974f9a3c156c078c44d7/gr4.jpg https://s3.amazonaws.com/prod-ucs-content-store-us-east/content/pii:S0926860X18303818/gr4/DOWNSAMPLED/image/jpeg/b33e83672a41974f9a3c156c078c44d7/gr4.jpg gr4 gr4.jpg jpg 15549 308 376 IMAGE-DOWNSAMPLED 1-s2.0-S0926860X18303818-gr5.jpg https://s3-eu-west-1.amazonaws.com/prod-ucs-content-store-eu-west/content/pii:S0926860X18303818/gr5/DOWNSAMPLED/image/jpeg/bbc2d24727a141900c6eddee33a081df/gr5.jpg https://s3.amazonaws.com/prod-ucs-content-store-us-east/content/pii:S0926860X18303818/gr5/DOWNSAMPLED/image/jpeg/bbc2d24727a141900c6eddee33a081df/gr5.jpg gr5 gr5.jpg jpg 165198 713 789 IMAGE-DOWNSAMPLED 1-s2.0-S0926860X18303818-gr6.jpg https://s3-eu-west-1.amazonaws.com/prod-ucs-content-store-eu-west/content/pii:S0926860X18303818/gr6/DOWNSAMPLED/image/jpeg/4f266ffb6cf81a79880e39129a1cd6a4/gr6.jpg https://s3.amazonaws.com/prod-ucs-content-store-us-east/content/pii:S0926860X18303818/gr6/DOWNSAMPLED/image/jpeg/4f266ffb6cf81a79880e39129a1cd6a4/gr6.jpg gr6 gr6.jpg jpg 71929 507 567 IMAGE-DOWNSAMPLED 1-s2.0-S0926860X18303818-gr7.jpg https://s3-eu-west-1.amazonaws.com/prod-ucs-content-store-eu-west/content/pii:S0926860X18303818/gr7/DOWNSAMPLED/image/jpeg/a5488a80b01625b3039b05d79952e4f6/gr7.jpg https://s3.amazonaws.com/prod-ucs-content-store-us-east/content/pii:S0926860X18303818/gr7/DOWNSAMPLED/image/jpeg/a5488a80b01625b3039b05d79952e4f6/gr7.jpg gr7 gr7.jpg jpg 53489 268 567 IMAGE-DOWNSAMPLED 1-s2.0-S0926860X18303818-gr8.jpg https://s3-eu-west-1.amazonaws.com/prod-ucs-content-store-eu-west/content/pii:S0926860X18303818/gr8/DOWNSAMPLED/image/jpeg/ca8cf9d45d7e1e1b894f7d4efef41b59/gr8.jpg https://s3.amazonaws.com/prod-ucs-content-store-us-east/content/pii:S0926860X18303818/gr8/DOWNSAMPLED/image/jpeg/ca8cf9d45d7e1e1b894f7d4efef41b59/gr8.jpg gr8 gr8.jpg jpg 65721 374 567 IMAGE-DOWNSAMPLED 1-s2.0-S0926860X18303818-gr9.jpg https://s3-eu-west-1.amazonaws.com/prod-ucs-content-store-eu-west/content/pii:S0926860X18303818/gr9/DOWNSAMPLED/image/jpeg/d12886b118d1bfae23a3526dffa5d012/gr9.jpg https://s3.amazonaws.com/prod-ucs-content-store-us-east/content/pii:S0926860X18303818/gr9/DOWNSAMPLED/image/jpeg/d12886b118d1bfae23a3526dffa5d012/gr9.jpg gr9 gr9.jpg jpg 17041 270 376 IMAGE-DOWNSAMPLED 1-s2.0-S0926860X18303818-sc1.jpg https://s3-eu-west-1.amazonaws.com/prod-ucs-content-store-eu-west/content/pii:S0926860X18303818/sc1/DOWNSAMPLED/image/jpeg/ad3feca1987eae61db8bf1d24165afcb/sc1.jpg https://s3.amazonaws.com/prod-ucs-content-store-us-east/content/pii:S0926860X18303818/sc1/DOWNSAMPLED/image/jpeg/ad3feca1987eae61db8bf1d24165afcb/sc1.jpg sc1 sc1.jpg jpg 37692 301 752 IMAGE-DOWNSAMPLED 1-s2.0-S0926860X18303818-ga1_lrg.jpg https://s3-eu-west-1.amazonaws.com/prod-ucs-content-store-eu-west/content/pii:S0926860X18303818/ga1/HIGHRES/image/jpeg/4ebb717916209aecec15fdf1b693d9e3/ga1_lrg.jpg https://s3.amazonaws.com/prod-ucs-content-store-us-east/content/pii:S0926860X18303818/ga1/HIGHRES/image/jpeg/4ebb717916209aecec15fdf1b693d9e3/ga1_lrg.jpg ga1 true ga1_lrg.jpg jpg 234458 876 2213 IMAGE-HIGH-RES 1-s2.0-S0926860X18303818-gr1_lrg.jpg https://s3-eu-west-1.amazonaws.com/prod-ucs-content-store-eu-west/content/pii:S0926860X18303818/gr1/HIGHRES/image/jpeg/30e6764c0ff0a4200cc0043cad1269d7/gr1_lrg.jpg https://s3.amazonaws.com/prod-ucs-content-store-us-east/content/pii:S0926860X18303818/gr1/HIGHRES/image/jpeg/30e6764c0ff0a4200cc0043cad1269d7/gr1_lrg.jpg gr1 gr1_lrg.jpg jpg 864531 2782 3500 IMAGE-HIGH-RES 1-s2.0-S0926860X18303818-gr2_lrg.jpg https://s3-eu-west-1.amazonaws.com/prod-ucs-content-store-eu-west/content/pii:S0926860X18303818/gr2/HIGHRES/image/jpeg/cc6148de2375cda48dedce42cdd5ef21/gr2_lrg.jpg https://s3.amazonaws.com/prod-ucs-content-store-us-east/content/pii:S0926860X18303818/gr2/HIGHRES/image/jpeg/cc6148de2375cda48dedce42cdd5ef21/gr2_lrg.jpg gr2 gr2_lrg.jpg jpg 168691 1420 1655 IMAGE-HIGH-RES 1-s2.0-S0926860X18303818-gr3_lrg.jpg https://s3-eu-west-1.amazonaws.com/prod-ucs-content-store-eu-west/content/pii:S0926860X18303818/gr3/HIGHRES/image/jpeg/9d93b66dd5306347d15260513fd246e3/gr3_lrg.jpg https://s3.amazonaws.com/prod-ucs-content-store-us-east/content/pii:S0926860X18303818/gr3/HIGHRES/image/jpeg/9d93b66dd5306347d15260513fd246e3/gr3_lrg.jpg gr3 gr3_lrg.jpg jpg 380953 1362 3500 IMAGE-HIGH-RES 1-s2.0-S0926860X18303818-gr4_lrg.jpg https://s3-eu-west-1.amazonaws.com/prod-ucs-content-store-eu-west/content/pii:S0926860X18303818/gr4/HIGHRES/image/jpeg/5492fd65fa408c72d8529093564ee3aa/gr4_lrg.jpg https://s3.amazonaws.com/prod-ucs-content-store-us-east/content/pii:S0926860X18303818/gr4/HIGHRES/image/jpeg/5492fd65fa408c72d8529093564ee3aa/gr4_lrg.jpg gr4 gr4_lrg.jpg jpg 118292 1366 1667 IMAGE-HIGH-RES 1-s2.0-S0926860X18303818-gr5_lrg.jpg https://s3-eu-west-1.amazonaws.com/prod-ucs-content-store-eu-west/content/pii:S0926860X18303818/gr5/HIGHRES/image/jpeg/872dec1a831c071eaef6039e46ef7663/gr5_lrg.jpg https://s3.amazonaws.com/prod-ucs-content-store-us-east/content/pii:S0926860X18303818/gr5/HIGHRES/image/jpeg/872dec1a831c071eaef6039e46ef7663/gr5_lrg.jpg gr5 gr5_lrg.jpg jpg 1657097 3155 3492 IMAGE-HIGH-RES 1-s2.0-S0926860X18303818-gr6_lrg.jpg https://s3-eu-west-1.amazonaws.com/prod-ucs-content-store-eu-west/content/pii:S0926860X18303818/gr6/HIGHRES/image/jpeg/8156f8767f528d940538e812719ae031/gr6_lrg.jpg https://s3.amazonaws.com/prod-ucs-content-store-us-east/content/pii:S0926860X18303818/gr6/HIGHRES/image/jpeg/8156f8767f528d940538e812719ae031/gr6_lrg.jpg gr6 gr6_lrg.jpg jpg 559669 2243 2509 IMAGE-HIGH-RES 1-s2.0-S0926860X18303818-gr7_lrg.jpg https://s3-eu-west-1.amazonaws.com/prod-ucs-content-store-eu-west/content/pii:S0926860X18303818/gr7/HIGHRES/image/jpeg/967cf513e14a4d7db229b60956480e52/gr7_lrg.jpg https://s3.amazonaws.com/prod-ucs-content-store-us-east/content/pii:S0926860X18303818/gr7/HIGHRES/image/jpeg/967cf513e14a4d7db229b60956480e52/gr7_lrg.jpg gr7 gr7_lrg.jpg jpg 366125 1188 2509 IMAGE-HIGH-RES 1-s2.0-S0926860X18303818-gr8_lrg.jpg https://s3-eu-west-1.amazonaws.com/prod-ucs-content-store-eu-west/content/pii:S0926860X18303818/gr8/HIGHRES/image/jpeg/cae41625fa450d599be6f45066fa1273/gr8_lrg.jpg https://s3.amazonaws.com/prod-ucs-content-store-us-east/content/pii:S0926860X18303818/gr8/HIGHRES/image/jpeg/cae41625fa450d599be6f45066fa1273/gr8_lrg.jpg gr8 gr8_lrg.jpg jpg 568320 1654 2509 IMAGE-HIGH-RES 1-s2.0-S0926860X18303818-gr9_lrg.jpg https://s3-eu-west-1.amazonaws.com/prod-ucs-content-store-eu-west/content/pii:S0926860X18303818/gr9/HIGHRES/image/jpeg/d69ed500f7ebb47ea449d16b68deaacb/gr9_lrg.jpg https://s3.amazonaws.com/prod-ucs-content-store-us-east/content/pii:S0926860X18303818/gr9/HIGHRES/image/jpeg/d69ed500f7ebb47ea449d16b68deaacb/gr9_lrg.jpg gr9 gr9_lrg.jpg jpg 110296 1197 1667 IMAGE-HIGH-RES 1-s2.0-S0926860X18303818-sc1_lrg.jpg https://s3-eu-west-1.amazonaws.com/prod-ucs-content-store-eu-west/content/pii:S0926860X18303818/sc1/HIGHRES/image/jpeg/a30a7e15e8e65bde19b5904a1f2ca4fa/sc1_lrg.jpg https://s3.amazonaws.com/prod-ucs-content-store-us-east/content/pii:S0926860X18303818/sc1/HIGHRES/image/jpeg/a30a7e15e8e65bde19b5904a1f2ca4fa/sc1_lrg.jpg sc1 sc1_lrg.jpg jpg 299201 1335 3330 IMAGE-HIGH-RES 1-s2.0-S0926860X18303818-mmc1.pdf https://s3-eu-west-1.amazonaws.com/prod-ucs-content-store-eu-west/content/pii:S0926860X18303818/mmc1/MAIN/application/pdf/5667319663d61ce907f780ebd6bd326b/mmc1.pdf https://s3.amazonaws.com/prod-ucs-content-store-us-east/content/pii:S0926860X18303818/mmc1/MAIN/application/pdf/5667319663d61ce907f780ebd6bd326b/mmc1.pdf mmc1 mmc1.pdf pdf false 761487 APPLICATION APCATA 16768 S0926-860X(18)30381-8 10.1016/j.apcata.2018.07.042 Elsevier B.V. Scheme 1 Proposed reaction pathway of glucose on Mn-promoted Ni-ZnO catalysts. Scheme 1 Fig. 1 XRD patterns of a) Mn-promoted Ni-ZnO catalyst with different amounts of Mn, where x%MNZ represents the percentage of Mn in the Mn-promoted Ni-ZnO catalysts; b)Ni-based catalysts on different supports; c) 5% Mn-promoted Ni-ZnO catalyst (MNZ) catalysts reduced at different temperature, where MNZ-400 represents the catalysts reduced at 400 °C, etc.; d) Mn-promoted Ni-ZnO catalysts synthesized with different methods, where MNZ was prepared by coprecipitation method, MNZ-1 was prepared by the impregnation method with Ni loaded on MnOx-ZnO, and MNZ-2 was prepared by loading Ni and Mn on ZnO by the impregnation method. Fig. 1 Fig. 2 Ni 2p XPS region of Ni/ZnO and 5%Mn/Ni/ZnO reduced at 350 °C. Fig. 2 Fig. 3 XPS spectra of (a) Ni species and (b) Mn species of 5%Mn/Ni/ZnO catalysts reduced at different temperatures. MNZ-00 represents 5%Mn/Ni/ZnO catalysts before reduction but after calcination, MNZ-240 represents MNZ-300 represents 5%Mn/Ni/ZnO catalysts reduced at 300 °C, 5%Mn/Ni/ZnO catalysts reduced at 240 °C, and MNZ-350 represents 5%Mn/Ni/ZnO catalysts reduced at 350 °C, MNZ-400 represents 5%Mn/Ni/ZnO catalysts reduced at 400 °C and MNZ-500 represents 5%Mn/Ni/ZnO catalysts reduced at 500 °C. Fig. 3 Fig. 4 H2-TPR patterns of the synthesized catalysts: Ni/ZnO and 5% Mn-promoted Ni-ZnO (5%Mn/Ni/ZnO). Fig. 4 Fig. 5 TEM images and particle size distribution of the synthesized catalysts: a d, g) 5%Mn/Ni/ZnO; b, e, h) Ni/ZnO; c, f, i) Ni/MnOx. Fig. 5 Fig. 6 EDX mapping images of (a) 5%Mn/Ni/ZnO after calcination and before reduction, (b) Ni, (c) Zn, (d) Mn in the catalysts. Fig. 6 Fig. 7 EDX mapping images of (a) 5%Mn/Ni/ZnO reduced at 350 °C, and (b) Ni, (c) Zn, (d) Mn in the catalysts. Fig. 7 Fig. 8 EDX mapping images of (a) 5%Mn/Ni/ZnO reduced at 500 °C, (b) Ni, (c) Zn, (d) Mn in the catalysts. Fig. 8 Fig. 9 Performance of microalgae conversion over 5%Mn/Ni/ZnO, Ni/MnOx and Ni/ZnO. Fig. 9 Table 1 Performance of the Ni-ZnO catalysts promoted with W, Zr, Ce, Mn, Mg a . Table 1 Entry Catalysts CTL, % Yield, % 1,2-PDO EG Glycerol 1,2-BDO 1 5%W/Ni/ ZnO 46.2 15.3 8.5 7.6 3.5 2 5%Zr/Ni/ ZnO 44.6 16.8 10.6 4.4 6.4 3 5%Ce/Ni/ ZnO 49.4 17.9 14.2 4.2 4.1 4 5%Mn/Ni/ ZnO 66.9 25.0 16.7 6.6 5.3 5 5%Mg/Ni/ ZnO 55.3 18.6 14.7 4.3 3.5 6 Ni/ZnO 59.3 16.8 10.1 4.5 4.3 a Reaction condition: microalgae 0.25 g, H2O 25 mL, catalyst 0.15 g, 250 °C, 3.0 h, H2 6 MPa. Table 2 Performance of the Mn/Ni/ZnO catalysts synthesized under different conditions a . Table 2 Entry Catalysts ReT c , °C CTL, % Yields, % 1,2-PDO EG Glycerol 1,2-BDO 1 1%Mn/Ni/ZnO b 350 65.3 23.1 15.3 6.6 5.0 2 5%Mn/Ni/ZnO b 350 66.9 25.0 16.7 6.6 5.3 3 10%Mn/Ni/ZnO b 350 65.7 19.4 17.9 6.1 3.1 4 15%Mn/Ni/ZnO b 350 64.3 17.6 16.9 5.7 3.4 5 5%Mn/Ni/ZnO b 240 65.2 22.3 17.6 7.4 2.8 6 5%Mn/Ni/ZnO b 300 65.5 23.5 16.8 5.7 3.9 7 5%Mn/Ni/ZnO b 400 64.1 16.7 13.4 7.2 3.5 8 5%Mn/Ni/ZnO b 500 60.9 8.5 – 7.1 0.0 9 5%Mn/Ni/ZnO d 350 52.1 2.4 5.6 7.1 – 10 5%Mn/Ni/ZnO e 350 50.3 0.9 0.8 7.0 – a Reaction condition: microalgae 0.25 g, H2O 25 mL, catalyst 0.15 g, 250 °C, 3.0 h, H2 6 MPa. b The catalysts was prepared by co-precipitation with the Ni/Zn ratio of 4/6. c ReT: reduction temperature. d Ni was loaded onto MnOx-ZnO by the impregnation method. e Ni and Mn were loaded onto ZnO by the impregnation method. Table 3 Conversion and product yields for the various intermediates during their hydrogenation over the Mn-Promoted Ni-ZnO catalyst a . Table 3 Entry Substrate Time, h Conversion,% Yields, % 1,2-PDO EG Glycerol 1,2-BDO 1 Glucose 1.0 99.9 30.8 14.4 18.7 2.7 2 Glucose 2.0 99.9 37.7 16.1 11.6 3.5 3 Glucose 3.0 99.9 39.8 15.1 8.3 2.8 4 Glycoaldehyde 1.0 96.5 10.3 52.5 3.4 4.8 5 Glycoaldehyde 2.0 99.9 11.0 57.6 4.0 6.1 6 Methyglyoxal 1.0 99.9 67.7 – – 1.6 7 Methyglyoxal 2.0 99.9 66.0 – – 1.3 8 Acetol 1.0 99.9 87.3 – – 2.4 9 Fructose 3.0 99.9 50.9 10.4 9.6 2.4 10 1,3-Dihydroxyacetone 2.0 89.5 45.0 3.4 27.6 – 11 1,3-Dihydroxyacetone 3.0 86.9 53.0 4.4 21.9 – 12 Glycerol 1.0 22.8 9.5 3.1 77.2 – 13 Glycerol 2.0 69.8 54.2 9.8 30.1 – 14 Glycerol 3.0 82.9 62.2 10.3 17.1 – a Reaction condition: substrate 0.25 g, H2O 25 mL, catalyst 0.15 g, 230 °C, H2 6 MPa. Table 4 Comparison of the performance for the hydrogenation of a) Glycoaldehyde; b) Methygloxal; c) Acetol; d) Fructose; e) 1,3-Dihydroxyacetone; f) Glycerol over the Mn-promoted Ni-ZnO (Mn/Ni/ZnO) and Ni/ZnO catalysts a . Table 4 Entry Substrates Catalysts Conversion,% Yields, % 1,2-PDO EG Glycerol 1,2-BDO 1 Glycoaldehyde Mn/Ni/ZnO 99.3 – 82.6 4.0 2.1 2 Glycoaldehyde Ni/ZnO 98.6 – 90.3 – – 3 Methyglyoxal Mn/Ni/ZnO 99.8 67.7 – – 1.6 4 Methyglyoxal Ni/ZnO 99.9 69.4 – 1.1 0.0 5 Acetol Mn/Ni/ZnO 99.9 87.3 – – 2.4 6 Acetol Ni/ZnO 99.9 91.5 – – 1.2 7 Fructose Mn/Ni/ZnO 99.9 50.9 10.4 9.6 2.4 8 Fructose Ni/ZnO 98.6 25.2 7.4 8.1 7.8 9 1,3-Dihydroxyacetone Mn/Ni/ZnO 99.9 53.0 4.4 21.9 – 10 1,3-Dihydroxyacetone Ni/ZnO 98.3 36.0 8.4 49.4 – 11 Glycerol Mn/Ni/ZnO 82.9 62.2 10.3 17.1 – 12 Glycerol Ni/ZnO 48.9 36.9 8.4 51.1 0.0 a Reaction condition: substrate 0.25 g, H2O 25 mL, catalyst 0.15 g, 230 °C, 3.0 h, H2 6 MPa. Mn-promoted hydrogenation of microalgae (Chlorococcum sp.) to 1,2-propanediol and ethylene glycol over Ni-ZnO catalysts Gai Miao a b Yifan Zan a c Yuanyuan Sun a b Hao Wang a b Shenglin Li a b Chang Liu a c Shenggang Li a ⁎ Lingzhao Kong a ⁎ Yuhan Sun a ⁎ a Laboratory of Low-Carbon Conversion Science and Engineering, Shanghai Advanced Research Institute, CAS. No. 100 Haike Road, Shanghai, China Laboratory of Low-Carbon Conversion Science and Engineering Shanghai Advanced Research Institute CAS. No. 100 Haike Road Shanghai China b University of Chinese Academy of Sciences, Beijing 100049, China University of Chinese Academy of Sciences Beijing 100049 China c College of Sciences, Shanghai University, Shanghai 200444, China College of Sciences Shanghai University Shanghai 200444 China ⁎ Corresponding authors. Graphical abstract Mn-promoted nickel-based catalysts were explored for the direct hydrogenation of microalgae (Chlorococcum sp.) containing 49.6% of carbohydrates in water. With this catalyst at 250 °C for 3.0 h, microalgae was completely decomposed, where the conversion of microalgae to liquid products (CTL) and the total yield of polyols reached 66.9%, and 53.6%, respectively. Among polyols, the total yield of 1,2-propanediol and ethylene glycol were 41.7%. XRD, XPS and TEM-EDX characterizations showed that 5% of Mn addition, 350 °C of reduction temperature and the co-precipitation synthesis ensured the excellent dispersion of the Ni catalyst with small particle sizes. The Mn promoter was found to stabilize the catalyst structure by preventing the Ni particles from aggregation and to effectively promote retro-aldol and dehydroxylation reaction due to the increasing number of Lewis acid sites. Meanwhile, the hydrogenation pathways over nickel-based catalysts were proposed. Keywords Microalgae Hydrogenation 1,2-Propanediol Ethylene glycol Mn-promoted Ni-ZnO catalyst 1 Introduction The manufacture of bulk chemicals, such as 1,2-propanediol (1,2-PDO) and ethylene glycol (EG), from biomass instead of from fossil resources can contribute significantly to a sustainable and environment-friendly chemical industry [1–5]. Due to the shift towards renewable feedstocks from fossil resources, new catalytic processes are being developed, where the utilization of heterogeneous catalysts is preferred [6–9]. Biomass hydrogenation is a promising route for chemical production from biomass due to its economic benefit and environmental sustainability. Nickel-based catalysts are preferred for biomass hydrogenation due to their much lower cost and better availability compared to noble metal-based catalysts. In addition, nickel-based catalysts also have the proper reduction capability for biomass hydrogenation, as catalysts with too strong reduction capability will transform biomass into gaseous products and catalysts with too weak reduction capability will yield mostly C6 alcohols [10–12]. Great efforts have been taken to develop selective catalysts for biomass hydrogenation, and representative catalysts are Ni-W2C/AC developed by Zhang’s group [13–15]. They developed an environment-friendly approach for the catalytic degradation of cellulose into glycols, and the yield of EG reached 61% attributed to the synergism between nickel and W2C. However, the total yield for the conversion of raw biomass feedstock, such as corn stalk, to EG and 1,2-PDO was limited to 48% in addition to the fact that the feedstock had to be pretreated with organic solvents and/or alkali solutions. Mu’s group further examined the performance of nickel-based catalysts supported by Al2O3, TiO2, SiO2, activated carbon, ZnO, ZrO2 and MgO, and the catalyst support was found to play an important role in the product distribution and the best performance was obtained using 20% Ni/ZnO as the catalyst with complete cellulose conversion and a total glycol yield of 70.4% [16]. In the above-mentioned reports, pure substrates, such as cellulose, glucose, sorbitols, xylitols, were usually chosen to investigate the catalytic performance and the reaction mechanism [17–21]. When using corn stalk, miscanthus and jerusalem artichole tubers as the reactants, pretreatment and purification were required to enhance the carbohydrate content and to improve the catalytic efficiency [22–24]. Miscanthus was used for producing EG with a yield of 35.5% over a binary catalyst consisting of commercial tungstic acid and Raney Ni. The formation of organic acids and unsaturated compounds was found to poison the Raney Ni catalyst leading to limited EG yield [22]. Ni-W2C/AC catalysts were found to convert corn stalk to EG and 1,2-PDO with an overall yield of 48.0% [24]. Thus, the catalyst must be sufficiently robust for efficient conversion of raw biomass feedstocks in aqueous medium. In our previous work, we developed a process for the direct hydrogenation of microalgae using the Ni-MgO-ZnO catalyst, and the total yield of the main products, including 1,2-PDO, EG and other alcohols, were 41.5%, among which the combined yield of 1,2-PDO and EG were 33.2% [25]. Thus, the yield remained limited partly due to the poisonous effect of the impurities in microalgae to the Ni-based catalysts, so catalysts with higher reactivity and tolerance to these impurities are to be developed. Promotion of metal catalysts with metal oxides is an effective method to improve the catalytic activity in hydrogenation reactions [26–34]. For the Fischer-Tropsch synthesis (FTS), metal oxide promoters were found to significantly affect the catalyst texture and porosity, leading to enhanced dispersion of the active metals as well as their reducibility [31]. Morales et al prepared Mn-promoted Co/TiO2 catalysts, and found that a small amount of Mn promoter could substantially improve the catalytic performance in the FTS reaction by enhancing the dispersion of the active metal [32]. With the Ni-CaO/C catalysts, the combined selectivity of xylitol and polyols reached 69.5% at 200 °C, 4.0 MPa H2. The presence of solid bases rendered the Ni catalysts noticeably more resistant to leaching and sintering, leading to much improved catalytic stability in xylitol hydrogenolysis [20]. Deng and Liu investigated cellulose hydrogenation into polyols over SnOx-modified Pt/Al2O3 catalysts and the selectivity of hexitols reached 82.7% with a Sn/Pt ratio of 0.5, although the conversion was only 17.1% [33]. Ni-Cu/ZnO catalysts were prepared for the hydrogenolysis of cellulose into 1,2-alkanediols with a selectivity of 72.5% under 245 °C, 4.0 MPa H2. Synergism between the Ni and Cu species led to the efficient formation of 1,2-alkanediols via dehydroxylation and CC bond breaking [34]. In this work, we used Mn as additive promoter to substantially improve the catalytic performance of Ni-ZnO catalysts for one-pot hydrogenation of microalgae in hot water. The catalysts were thoroughly characterized by X-ray diffraction (XRD), X-ray photoelectron spectroscopy (XPS) and temperature-programmed reduction of hydrogen (H2-TPR), transmission electron microscopy (TEM) and energy dispersive X-ray spectroscopy (EDX) to elucidate the role of the Mn promoter on the structure of the catalyst. Influence of various catalyst preparation parameters, such as the amount of Mn, the reduction temperature, and the metal loading method on the performance of the catalysts, was systematically investigated. In addition, the catalytic mechanism and the effect of the Mn promoter on the reaction pathway were further elucidated by using several reaction intermediates as model substrates in further hydrogenation experiments under the same reaction conditions. 2 Experimental section 2.1 Materials The microalgae (Chlorococcum sp.) were cultivated with the same method as reported in our previous work [25]. All the other regents and chemicals were purchased from Sinopharm Chemical Reagent Co., Ltd, and used without further purification. 2.2 Catalyst preparation Mn-promoted Ni-ZnO catalysts (MNZ) were prepared by co-precipitation. Briefly, the metal salts (nickel, zinc and manganese nitrates) were mixed in aqueous solution with a fixed molar ratio. The solution of Na2CO3 was then added dropwise into the above mixture under vigorous stirring at 70 °C at the pH value of 7.0. The resultant mixture was aged under continuous stirring at the same temperature for 3–4 h, followed by vacuum filtration. Olivine powder was collected after being dried at 80 °C overnight and ground by mortar. The collected powder was calcined in the air by increasing the temperature at the rate of 5 °C/min–400 °C and then kept at this temperature for 5 h. This was followed by reduction under H2 by further increasing the temperature at the rate of 5 °C/min to some temperature and kept at that temperature for 10 h. The catalysts were passivated in a flow of 0.5% O2/N2 for 3.0 h at room temperature before exposure to the air in case of being burned. Other metal-doped catalysts (such as W-promoted Ni-ZnO, Ce-promoted Ni-ZnO, and Zr-promoted Ni-ZnO) were prepared with the same method by changing the precursors and the molar ratios of metal nitrates. Catalysts prepared with the impregnation method were synthesized in the traditional approach [35]. For MNZ-1 catalysts, Ni was loaded onto the support Mn-doped ZnO by incipient wetness impregnation using as nickel nitrate as the precursor. The Mn-doped ZnO support was synthesized by the co-precipitation method the same as MNZ preparation without nickel nitrates addition. MNZ-2 was prepared by loading nickel onto the mixture of commercial ZnO and MnO by the impregnation method. The calcination and reduction procedure for MNZ-1 and MNZ-2 was identical to that of MNZ. 2.3 Catalyst characterization X-Ray powder diffraction (XRD) patterns of the catalysts were conducted on a Rigaku Ultima IVX-Ray diffractometer with CuK α radiation in the 2θ range from 20° to 80° at a scan rate of 5°/min. The crystallite sizes (D) of nickel species in the catalysts was evaluated by the Scherrer equation, assuming negligible contribution from strain and instrumental broadening to reflection widths, D = kλ/βLcosθ, where k is a dimensionless shape factor with a typical value of about 0.89, λ is the wavelength of the radiation (λCu = 1.54178 Å), βL is the full width at half-maximum, and θ is the diffraction angle for Ni (111), which is the main plain of nickel species [36,37]. X-ray photoelectron spectroscopy (XPS) was conducted on Thermo Scientific K-Alpha with AlKα radiation. The binding energy (BE) of C1s core level (284.8 eV) was used as the reference. Transmission electron microscopy (TEM) including high-resolution transmission electron microscopy (HRTEM) and energy dispersive X-ray spectrum (EDX) studies were conducted on a JEM-2100F field emission electron microscope at an operating voltage of 200 kV, equipped with a Gatan 832 CCD camera. Prior to the characterization, the samples were dispersed into ethanol solution with ultrasonic treatment for 30 min and then dropped onto a carbon film on copper grid. H2-TPR and NH3-TPD were both conducted on an Auto Chem. II2920 equipment (Mircromeritics, USA). For H2-TPR, 100 mg of sample was placed into a U-shaped quartz tube and pretreated in Ar at 350 °C for 30 min and then cooled to 5 °C. A 10 vol% H2-Ar gas mixture was then applied and the water vapor was condensed with isopropanol-liquid nitrogen slurry. The data were recorded from 50 °C to 850 °C with a ramping rate of 5 °C/min, and simultaneously monitored by a thermal conductivity detector (TCD). Pyridine-adsorption FTIR (Py-IR) spectra were recorded by a VERTEX70 (Bruker) FT-IR spectrophotometer, equipped with a deuterium triglycine sulphate (DTGS) detector. Typically, about 20 mg of sample was pressed into a self-supporting water of 2 cm in diameter and degassed at 300 °C in vacuum for 1.0 h before exposed to the pyridine vapor and cooled down to 30 °C. The Py-IR spectra were recorded at 200 °C and 350 °C after evacuating for 30 min to remove the physidorbed pyridine [38]. The amounts of Lewis-acid sites and Brønsted-acid sites were determined from the integrated area of the adsorption bands at ca. 1548 and 1442 cm−1, respectively. The extinction coefficients from Emeis’ work [39] were employed. Elemental analysis of the feedstock was performed on a Thermo Scientific Flash 2000 with a CHNS analyzer. The total organic carbon (TOC) and total nitrogen (TN) in the liquid products were obtained with a Shimadzu TOC-L. 2.4 Catalytic experiments and product analysis Direct conversion of microalgae was carried out in a stainless steel autoclave (Parr, 50 mL) with an initial H2 pressure of 6 MPa at 230–250 °C for 180 min. Briefly, 0.25 g of microalgae (1.0 wt.%) and 0.15 g of catalyst were added into 25 mL of deionized water. The mixture was then poured into the autoclave and stirred at a speed of 600 rpm. The reactor was heated to the target temperature and kept for 180 min. After the reaction, the autoclave was cooled naturally, and the liquid solution was separated by centrifuging the mixture from the reaction. The solid catalyst was collected and washed with deionized water for three times, followed by drying overnight at 80 °C. Prior to further analysis, the collected liquid solution was filtered through filters with pore size of 0.22 μm. Qualitative and quantitative analyses of the products in the resultant solution were conducted with gas chromatography-mass spectrometry (GC–MS, Agilent 5975/6890N, HP-INNOWax column: 30 m × 0.25 mm; film thickness, 0.25 μm) with a flame ionization detector (FID) and high performance liquid chromatography (HPLC, Shimadzu LC-20CE, Aminex HPX-87H ion exclusion column: 300 mm × 7.8 mm) with a differential refraction detector (RID-10 A). The conversion of microalgae to liquid products (CTL) was calculated from the TOC data by: CTL = (moles of carbon in the resultant liquid determined by TOC)/(moles of carbon in microalgae determined by the CHNS analyzer) × 100%. The yield of a specific polyol was determined from the carbon via the equations: Yield of the polyol = (moles of carbon in the polyol determined)/(mole of carbon in the carbohydrate components of microalgae) × 100%. Due to the excess hydrogen present in the tail gas, the amount of the gaseous products was very difficult to quantify, which was only qualitatively analyzed by GC. Nevertheless, the total amount of the gaseous products was estimated from the difference between the total amount of carbon in microalgae and that in the liquid and solid products. All the primary experimental data were repeated three times and the relative error bar was no more than 5%. 3 Results and discussion 3.1 Screening of promoters for Ni-based catalysts The microalgae (Chlorococcum sp.) used as the feedstock contains 49.6% of carbohydrates, 32.6% of lipids and 11.9% of proteins (Table S1). The complex composition of microalgae demands the catalysts to possess high tolerance to impurities, especially to lipids and proteins, which are usually detrimental to the catalysts. In the catalytic hydrogenation process, about 5–10% of the carbon in microalgae was estimated to be converted into gaseous products, such as CH4, CO2 and CO, via deep CC cracking of the carbon content in microalgae. The solid products with carbon and hydrogen contents of 74% and 12%, respectively, were mostly precipitated carbon from lipids released from the hydrothermal process. The solid products accounted for 25%–35% of all the products. TN analysis of the liquid products shows that the total nitrogen in the liquid products is almost identical to the total amount of nitrogen in microalgae, suggesting that proteins in the microalgae were hydrolyzed and released into the liquid products. Thus, more than half of the solid carbon in the raw materials was turned into liquid products, where alkanediols (including 1,2-PDO, EG) derived from carbohydrates in the microalgae are the main products (Fig. S1). The other liquid products include methanol, acetic acid, which are derived from the deep CC cleavage of carbohydrates and proteins in microalgae, and their amounts are too limited to be quantified. Nickel-based catalysts were reported to have good performance for biomass hydrogenation to sugar alcohols [40–42]. Some metal promoters could enhance the catalytic activity when introduced to the hydrogenation catalyst [27]. We previously showed that catalysts doped with Mg had favorable catalytic activity for microalgae hydrogenation, with the overall yield of 1,2-propanediol (1,2-PDO) and ethylene glycol (EG) reaching up to 33.3% [25]. Based on that work, catalysts with W, Zr, Ce, Mn, and Mg promoters were prepared and investigated in this work (Table 1 ). With these promoted catalysts, the microalgae was completely converted, and 1,2-PDO, EG, glycerol and 1,2-butanediol (1,2-BDO) were found to be the main liquid products. For W-promoted catalysts (W/Ni/ZnO), CTL reached 46.2% with the total yield of the polyols of 34.9% (15.3% of 1,2-PDO, 8.5% of EG, 7.6% of glycerol and 3.5% of 1,2-BDO). The total yields of the polyols were 38.2% and 41.1% for the Zr/Ni/ZnO and Mg/Ni/ZnO catalysts, respectively. Thus, the Mn-promoted Ni-ZnO (Mn/Ni/ZnO) catalyst exhibited the best performance with an overall yield of polyols of 53.6% and the CTL of 66.9%. In our previous study [25], the addition of Mg changed the texture of the catalyst and increased nickel dispersion on the support. Compared with the Mg/Ni/ZnO catalyst, the catalytic efficiency of the Mn-promoted Ni-ZnO catalyst is higher by 30.5%. Although Mn has been used as a promoter for cobalt-based catalysts in Fisher-Tropsch synthesis [34], promotion of Ni-based catalysts by Mn especially for biomass hydrogenation has not been reported to our knowledge. 3.2 Properties of Mn-promoted Ni-ZnO catalysts XRD patterns of our catalysts with different amounts of Mn, reduced at different temperatures and synthesized by different methods are shown in Fig. 1 . From Fig. 1a, as the amount of Mn increases, peaks at 2θ = 41.5–42.0°, which are assigned to MnO (JCPDS data No. 07-2030), become stronger and sharper, indicating the formation of crystalline manganic oxide. Notably, catalysts with the Mn promoter below 5% have no diffraction peaks from MnO, suggesting the high dispersion of MnO in these samples. Peak width of Ni varies the amount of Mn, which reflects the crystal size of Ni on the support. Through the Scherrer Equation, Ni crystal sizes were calculated as 9.1 nm for 1%Mn/Ni/ZnO, 8.5 nm for 5%Mn/Ni/ZnO, 10.2 nm for 10%Mn/Ni/ZnO, 10.8 nm for 15%Mn/Ni/ZnO and 13.1 nm for 20%Mn/Ni/ZnO. In addition, the peak for Ni in 20%Mn/Ni/ZnO at 2θ = 43.6° was shifted to the left, which resulted from the presence of Mn species in the crystal lattice of Ni leading to changes in the cell parameters [43]. Fig. 1b compares XRD profiles of 5%Mn/Ni/ZnO with those of Ni/ZnO and Ni/MnOx, where the amount of Ni was fixed and the amount of Mn was maximized and minimized, respectively. The broader diffraction peaks at 2θ = 44.3° for the 5%Mn/Ni/ZnO catalyst indicates the presence of smaller crystal sizes of Ni than those found for Ni/MnOx and Ni/ZnO. Meanwhile, the sharp diffraction peaks at 2θ = 35.0° and 40.6° suggested the presence of well-grown MnO crystals in Ni/MnOx, while they were not observed in the 5%Mn/Ni/ZnO sample. As shown in Fig. 1c, for 5%Mn-doped Ni-based catalysts, the reduction temperature can also affect the nickel crystal size. Ni crystal sizes were calculated from the Scherrer equation as 4.0 nm, 7.6 nm, 8.5 nm and 13.2 nm for 5%Mn/Ni/ZnO reduced at 260 °C, 300 °C, 350 °C and 400 °C, respectively. Thus, as the reduction temperature increases, the nickel crystal sizes get larger. For the catalysts with 5%Mn, no characteristic peaks of MnO were present in the XRD patterns when they were reduced below 350 °C. This shows that the manganese species are well dispersed in the catalysts and their crystallite sizes are below the detection limit of XRD [35]. When the reduction temperature is 400 °C or higher, the characteristic peaks of Mn start to appear, which are signed to MnO (JCPDS data No. 07-0230), even though the amount of Mn was the same. For Mn-promoted Ni-ZnO catalysts reduced at 500 °C (Fig. S1), MnO peaks were sharper and crystalline peaks of the sample matched well with the XRD card, indicating the growth of MnO crystallines at 500 °C. Meanwhile, for the XRD patterns of the catalyst reduced at 500 °C, peaks at 51.3° for metallic nickel disappeared, and the sharpest peaks at 43.4° were coincident to the JCPDS data No. 47-1019 for the Ni-Zn alloy. Thus, the Ni-Zn alloy was formed when the catalyst was reduced at higher temperature. The loading manner of Mn can also affect its phase in the catalyst, as well as the crystal size. Fig. 1d shows the XRD patterns of three types of Mn-doped catalysts under the same calcination and reduction conditions: MNZ prepared by co-precipitation; MNZ-1 prepared by Ni impregnation on the co-precipitated MnOx-ZnO; MNZ-2 prepared by Ni and Mn co-impregnation on the synthesized ZnO. The co-precipitated catalysts show no characteristic peaks of MnOx for MNZ and MNZ-1 reduced at 350 °C, due to the high dispersion of Mn in the catalysts. However, for the impregnated catalysts, Mn is exposed on the surface and the characteristic peaks of MnOx appeared for the MNZ-2 catalyst. Therefore, only when prepared by co-precipitation with other metals in the synthesis, Mn can disperse well in the catalyst, leading to very weak or disappearing diffraction peaks of MnOx. The broadening of the characteristic peaks at 2θ = 43–44° of nickel indicates smaller Ni crystal sizes in the MNZ and MNZ-1 catalysts [44]. For the MNZ-2 catalyst, the characteristic peaks of nickel species are sharper, indicating the larger crystal sizes. Fig. 2 shows Ni 2p XPS spectra for 5%Mn/Ni/ZnO and Ni/ZnO reduced at 350 °C. The binding energies of the main peaks are nearly identical to those of oxidized nickel (2p3/2 = 855.2 eV and 872.9 eV). However, the presence of a shoulder peak at lower energy at 852.5 eV in both spectra indicates the further existence of metallic nickel. The shoulder peak is more pronounced for the Ni/ZnO catalysts, demonstrating a higher reduction extent for Ni/ZnO than for 5%Mn/Ni/ZnO under the same condition [34,45]. For the 5%Mn/Ni/ZnO catalysts, the reduction temperature affects the amount of reduced Ni in the catalysts, as shown in Fig. 3 a. The catalyst reduced at a higher temperature exhibits a more pronounced shoulder peak, indicating a higher level of reduction to Ni° in the catalyst. When the reduction temperature exceeds 500 °C, metallic nickel dominates with the Ni 2p peak shifted from 852.5 eV to 851.7 eV, attributed to the interaction of Ni with Zn, consistent with the observation of Ni-Zn alloys from the XRD results for MNZ-500 in Fig. S2. Mn 2p spectra for the 5%Mn/Ni/ZnO catalysts obtained before and after the reduction are presented in Fig. 3b. As Mn has many possible oxidation states, such as Mn(VII), Mn(VI), Mn(IV), Mn(III), Mn(II), and Mn, although Mn(II) nitrates was employed in the catalyst preparation, the Mn species can be oxidized to higher oxidation states after deposition and calcination at high temperature in the air. This is reflected by the very broad Mn 2p peaks for the catalysts before the reduction (MNZ-00) [46]. After the reduction, especially upon reduction at the high temperature (500 °C), the Mn species with high oxidation state were reduced to Mn(II) by forming MnO on the surface of the catalyst (Fig. S2), resulting in narrower Mn peak for the catalyst after the reduction. Fig. 4 presents the TPR profiles for the Ni-ZnO and Mn-promoted Ni-ZnO catalysts. Both catalysts exhibit a main reduction peak at ∼370 °C, ascribed to the reduction of NiO to metallic Ni. For the 5%Mn/Ni/ZnO catalysts, there is also a weak feature at 150 °C, attributed to the reduction of surface Mn species in higher oxidation states (Mn(VII) or Mn(VI)). The initial temperature for the Ni feature is 230 °C for Ni/ZnO, 50 °C lower than that for 5%Mn/Ni/ZnO, although they end at the same temperature, indicating the higher interaction of nickel with the support in 5%Mn/Ni/ZnO catalysts. The narrower peak for Mn-promoted catalysts suggests the specific interaction between Ni and the promoter, as well as the better dispersion of nickel on 5%Mn/Ni/ZnO. These results are consistent with the XPS results shown in Fig. 2 in that nickel on Ni-ZnO is better reduced at 350 °C than that on 5%Mn/Ni/ZnO. Morphologies of the representative catalysts were illustrated in Fig. 5 . Fig. 5a–c shows the TEM patterns of the catalysts 5%Mn/Ni/ZnO, Ni/ZnO and Ni/MnOx. And Fig. 5d–f display the corresponding HRTEM images. The average particle size of 5%Mn/Ni/ZnO, Ni/ZnO and Ni/MnOx was 10.8, 17.8 and 38.8 nm, respectively (Fig. 5g–i). The 5%Mn/Ni/ZnO catalyst was found to have a more uniform dispersion of the metal with nanoparticles of about 10 nm in diameter, and as shown in Fig. 5d the crystalline was formed based on the clear lattice fringes. When the catalyst support is ZnO or MnOx, the particle size is larger than that of 5%Mn/Ni/ZnO. As shown in Fig. 5e, the nickel particles on the catalysts are visible from the passive film on the nickel surface based on two different directions of the lattice fringes in one particle. For Ni/MnOx (Fig. 5c and f), the support is 30–50 nm in size and nickel on the support is well dispersed and is 5 nm in diameter. The TEM results of these catalysts indicate that the addition of Mn results in enhanced dispersion of Ni on the catalyst, consistent with our XRD results. The evolution of the composites of the three metal oxides is illustrated in Figs. 6–8 by the EDX mapping of the metal elements for 5%Mn/Ni/ZnO before the reduction, reduced at 350 °C and 500 °C, respectively. Because the catalyst was prepared by co-precipitation, the EDX mappings of the three metals (Ni, Mn, Zn) show a homogeneous distribution before the reduction, and the weak signals of Mn in Fig. 6 is due to its small amount (5%) in the catalyst. When the catalysts were reduced at 350 °C, metallic Ni was formed and detected on the ZnO surface. Fig. 7 shows that these nickel nanoparticles have an average diameter of 10 nm. After the reduction, the Mn signal got stronger, although Mn remained well dispersed. Increasing the reduction temperature to 500 °C, the EDX mappings of Ni and Zn display the similar heterogeneous distribution, and larger particles in diameter of 100–200 nm are present in Fig. 8b and c, resulting from the Ni-Zn alloys due to the strong interaction between Ni and Zn, as also confirmed by the XRD patterns (Fig. S2). However, the EDX mapping of Mn in Fig. 8d shows pronounced signals at specific places, which are assigned to MnO aggregated on the catalyst surface. These specific spots on the catalysts have the similar elemental distribution found from the overall mapping images as shown in Figs. S3–S5 and Tables S2–S4. In particular, from Fig. S5 and Table S4, spot 2 and spot 4 have the comparable Ni to Zn atomic ratio, indicating that the two spots are in the Ni-Zn alloy region. Spot 3 is the aggregated MnO region on the catalyst surface, where more than 90% of the detected metal element is Mn. In Fig. 8d, the MnO region was also observed, where the Mn signal is the most pronounced, consistent with the XRD patterns in Fig. S2, suggesting that the high reduction temperature leads to the phase separation of manganese from the mixture. From the distribution of manganese in the three reduction stages, it was found that as the reduction temperature increases, more oxidized manganese in high oxidation states was reduced, separated from the mixture, and aggregated on the catalyst surface. From the characterizations it can be concluded that the high dispersion of Mn plays an important role on the promotion to the structure of the catalyst. The proper level of Mn loading prevents the growth of the nickel particles, resulting in smaller particle sizes than Ni/ZnO (Fig. 5). However, the amount of Mn must match that of Ni for optimal dispersion of the nickel on the support, whereas overloaded Mn tends to segregate and cover the active sites on the catalyst surface. Moreover, the way to introduce the Mn promoter into the catalyst also matters, and co-precipitation is preferable leading to homogenous distribution of Mn in the catalyst. When Mn is present in the catalyst, the reduction temperature of the catalyst also affects its structure. Higher reduction temperature leads to the separation of Mn from the catalyst, whereas the opposite reduces the extent in reducing nickel oxide into metallic nickel, and the latter is the active species for the hydrogenation. Thus, an optimal reduction temperature and the proper Mn loading, along with the coprecipitation method, result in high dispersion of Mn and uniform Ni nanoparticles on the support. Furthermore, the higher activation temperature for Ni reduction profile in H2-TPR (Fig.4) pattern indicates the higher interaction of Ni with the support. Meanwhile, the shoulder peak of Ni 2p XPS at the lower energy of 852 eV for 5%Mn/Ni/ZnO catalyst in Fig. 2 is weaker than that for Ni/ZnO catalyst after reduction under the same condition, suggesting the lower reduction extent of the Mn-doped catalyst. As such, nickel over 5%Mn/Ni/ZnO catalyst could be reduced in slower rate compared to that on Ni/ZnO, and it is natural that the more uniform nanoparticle can be observed on 5%Mn/Ni/ZnO catalyst in the TEM pattern (Fig. 5). Thus, it can be concluded that the Mn could not only favor the dispersion of nickel crystal but also the particle uniformity of the catalyst. 3.3 Performance of Mn-promoted Ni-ZnO for microalgae conversion The catalytic activities of our catalysts were tested for microalgae (Chlorococcum sp.) conversion under hydrothermal conditions in a hydrogen-rich atmosphere. Polyols, including 1,2-PDO, EG, glycerol and 1,2-BDO, are the main liquid products, accounting for 60–70%. The remained carbon in the raw materials was converted into gaseous products (yield of 5–10%, including CO2, CH4 and CO) and solid products (yield of 20–25%). Fig. 9 presents the distribution of the liquid products using the Mn-promoted Ni-ZnO, Ni-MnOx and Ni-ZnO catalysts. The highest yield of the main products (1,2-PDO, EG, glycerol and 1,2-BDO) reaches 53.6% over Mn-promoted Ni-ZnO catalysts, and the CTL is up to 66.9%. When the catalyst support is merely ZnO or MnOx, the yield of the main product dropped to 43.1% and 35.4%. The conversion of the solid carbon to liquid in the raw materials over Ni-ZnO and Ni-MnOx also decreases to 62.0% and 64.8%, respectively. Table 2 summarizes the performance of the catalysts with different Mn loadings, reduced at different temperatures, and prepared by different methods. 1,2-PDO, EG, glycerol and 1,2-BDO are the major liquid products. As listed in Table 2 entry 1–5, the catalyst promoted by 5% Mn has the highest catalytic performance with a yield of 53.6% for the main products and the CTL of 66.9%. For the catalyst with 1% Mn loading, the yield of the main products is 50.0% with the CTL of 65.3%. With the higher Mn loading of 10%, the CTL is 65.7% and the yield of the main products drops to 46.5%. From the XRD patterns of catalysts promoted with different Mn content (Fig. 1a), 5% of Mn is a critical point for the appearance of MnO when the catalysts were reduced at 350 °C. An excessive amount of Mn results in pure MnO crystalline covering on the catalyst surface and burying some of active sites, leading to reduced catalytic activity. When the amount of Mn is fixed, the variation of the reduction temperature can also affect the catalytic activity. From entry 5–6 of Table 2, the catalysts reduced at the lower temperatures of 240 °C and 300 °C have excellent catalytic activity and yields of the major products are both up to 50%. When the reduction temperature is raised to 400 °C, the resulting catalyst has lower catalytic activity than that reduced at 350 °C. Further increasing the reduction temperature to 500 °C, the catalytic activity dropped dramatically, and the yield of 1,2-PDO is only 8.5% with no EG detected. Thus, for catalysts reduced at different temperatures, the higher reduction temperature leads to much lower catalytic activity. In general, the active sites for the hydrogenation or hydrogenolysis are Ni° or Ni+ and the higher reduction temperature may generate more Ni°. However, in our work, when the catalysts were reduced at 500 °C, which is used in the literature [10,13,15], although more Ni° was generated, the catalytic activity was unsatisfying. From the EDS mapping and XRD patterns of the catalysts, we found that most of nickel in the catalysts reduced at 500 °C formed the Ni-Zn alloy as observed from the XRD patterns (Fig. S2). In contrast, catalysts reduced at 350 °C had more nickel nanoparticles, which were likely the catalytic active sites. From entry 9–10 of Table 2, the preparing method was also found to greatly affect the catalytic performance. Catalysts prepared by impreanation show poor catalytic activity; the yield of the major products is less than 15% and the conversion of the solid carbon to liquid products is only ∼50%.The decrease in the catalytic activity of MNZ-1 and MNZ-2 is due to the larger crystal size of nickel in these catalysts and the excess MnO on the catalyst surface. Therefore, for microalgae hydrolytic hydrogenation, the co-precipitated Mn/Ni/ZnO catalysts with 5% Mn addition reduced at 350 °C have the best catalytic performance. 3.4 Mn promotion effects on the conversion of microalgae In previous works, 1,2-PDO and EG were derived from carbohydrates in microalgae, which were hydrolyzed from microalgae by a dissociative proton from water at high temperature [25,47,48]. Thus, the reaction pathway for the conversion of microalgae to 1,2-PDO and EG was proposed with glucose as the substrate over the Mn-promoted Ni-ZnO catalyst. Based on the existing literature [14–16,49,50], we proposed the pathway as shown in Scheme 1 , which includes three processes: 1) retro-aldol + hydrogenation; 2) dehydration + hydrogenation; 3) isomerization + retro-aldol + hydrogenation. In the first process, glycoaldehyde is formed via CC bond cleavage in glucose, followed by hydrogenation to form EG. The second path involves dehydration of glucose to form methyglyoxal, and the subsequent hydrogenation of methyglyoxal to acetol and then to 1,2-PDO. In the third path, glycerol is first formed by isomerization of glucose to fructose, followed by the retro-aldol reaction to yield 1,3-dihydroxyacetone and the further hydrogenation, and the resulting glycerol is then converted into 1,2-PDO, EG, as well as other aliphatic alcohols such methanol through hydrogenolysis. Table 3 shows the catalytic performance of glucose and other possible intermediates in our microalgae hydrogenation. When the substrate is glucose, increasing the reaction time from 1.0 h to 3.0 h leads to the increase in the yield of 1,2-PDO from 30.8% to 39.8%, although the yield of glycerol drops from 18.7% to 8.3% with that of EG essentially unchanged (Table 3, entry 1–3). As the increase in the amount of 1,2-PDO is almost equal to the decrease in that of glycerol, some 1,2-PDO is likely to derive from glycerol. To validate our first pathway, glycoaldehyde was used as the substrate and the main product was found to be EG, accounting for more than 50% of the conversion (Table 3, entry 4–5). We proposed that 1,2-PDO was produced through the second and the third processes, where methylglyoxal and acetol are the intermediate products in the second pathway, and fructose, 1,3-dihydroxyacetone and glycerol are those in the third pathway. Treating these intermediate products in the hydrogen atmosphere over the Mn-promoted Ni-ZnO catalyst, the dominant products were found to be 1,2-PDO, especially for methyglyoxal and acetol. From entry 6 and 7 of Table 3, methyglyoxal can be converted into 1,2-PDO with yields of 67.7% and 66.0%, and the reaction is completed within 1.0 h. Acetol, the hydrogenation product of methylglyoxal, can be also converted into 1,2-PDO within 1.0 h (entry 8). From entry 9–15 of Table 3, the yields of 1,2-PDO from fructose, 1,3-dihydroxyacetone and glycerol are 50.9%, 53.0% and 62.2%, respectively, after of the reaction for 3.0 h. When the reaction time is reduced to 2.0 h, the yield of 1,2-PDO decreases by 8.0%, and the conversion of glycerol is also reduced. In 1.0 h, the conversion of glycerol dropped dramatically and was only 22.8%. This suggests that the hydroganolysis process is slower than the isomerization and hydrogenation reactions, so the former is likely the rate determining step. In the catalytic reaction system, microalgae were hydrolyzed and monose (glucose) was released first, which was then converted into C2 and C3 alcohols through hydrogenation and hydrogenolysis. Strictly speaking, hydrogenation in organic chemistry refers to the process of adding H atoms to unsaturated bonds, such as CC or other unsaturated groups, while hydrogenolysis is the process by replacing a group or atom, such as OH or CH3, with an H atom [51,52]. Thus CC bond cleavages of the retro-aldol reaction and dehydroxylation of glycerol belong to hydrogenolysis. In this work, the released glucose is subjected to the retro-aldol reaction, and is converted into the intermediate products and then alcohols through hydrogenation and hydrogenolysis. The equilibrium among the hydrolysis of microalgae, the hydrogenolysis of glucose and the hydrogenation of the intermediate products determines the product distribution, where the active sites on the catalyst play the essential role. Therefore, bifunctional catalysts are needed in this reaction. In this work, our Mn-promoted Ni-ZnO catalysts were found to have superior catalytic activity for the formation of glycols from the carbohydrates in microalgae compared with other nickel-based catalysts. Thus, addition of the Mn promoter significantly improved the performance of the Ni-ZnO catalysts. To further illustrate the promotional effects of Mn in our catalysts, comparison of Mn/Ni/ZnO with Ni/ZnO for catalyzing the hydrogenation of the intermediate products were made to determine the effect of the Mn promotion as shown in Table 4 . For entry 1 and 2, glycoaldehyde is subjected to the hydrogenation process and the yield of EG over Ni/ZnO is slightly higher than that over Mn/Ni/ZnO. Similarly, when the substrates are methyglyoxal and acetol, the yields of 1,2-PDO are comparable over Mn-promoted Ni-ZnO and Ni/ZnO catalysts (entry 3–6). As the above reactions are only hydrogenation, we conclude that the Mn promoter does not significantly affect the hydrogenation process. For glycerol conversion to 1,2-PDO, which is a typical hydrogenolysis process, higher yield of 1,2-PDO and higher conversion of glycerol were found over Mn-promoted Ni-ZnO catalysts (entry 11 and 12). In addition, the conversion of fructose and 1,3-dihydroxyacetone to 1,2-PDO also includes hydrogenolysis such as the retro-aldol reaction of fructose and glycerol dehydroxylation, and in entry 7–10, with fructose and 1,3-dihydroxyacetone as the substrates, the yield of 1,2-PDO is considerably higher over Mn-promoted Ni-ZnO catalysts than over Ni/ZnO. These results suggest that the Mn component in our catalysts mainly promote the hydrogenolysis process but not the hydrogenation step. In biomass conversion, Ni is one of the most frequently used metals for the hydrogenation of unsaturated aldehyde due to its activity for hydrogen adsorption [53–57]. Thus, there is no question that nickel plays the key role for hydrogenation/hydrogenolysis in our reaction. The ZnO support is not only used to disperse and stabilize the metal active sites, but also provides the acid-base sites to enhance the CC cleavage and the dehydroxylation processes [25]. By comparing the ZnO supported nickel catalyst with neutral Active Carbon (AC) supported nickel catalyst in Table S5, it can be seen that 20.0% sorbitol was obtained in glucose hydrogenation over catalyst with neutral support AC while no sorbitol was observed after 3.0 h hydrogenation of glucose over Ni/ZnO and 5%Mn/Ni/ZnO catalysts, demonstrating the good ability of the ZnO support to break CC bonds. In general, other transition metals were also introduced to adjust the properties of the support in order to further enhance the catalytic activity [26–30,58]. It has been reported that the addition of Fe and Re to the catalysts substantially boosts the deoxygenation and C–O hydrogenolysis activity, resulting in the complete deoxygenation of guaiacol to cyclohexane [29]. The basic nature of the support is known to be responsible for glucose isomerization to fructose followed by the retro-aldol reaction [16,59], and the support ZnO used in our study has both acidity and basicity. The addition of Mn also adjusts the acidity of the support. As shown in Fig. S6, the amount of Lewis acid and Brønsted acid sites are both enhanced in the Mn-promoted ZnO catalyst, which are also quantified in Table S6. According to the proposed reaction pathways in Scheme 1, glycerol is formed as an intermediate via isomerization of glucose to fructose followed by the retro-aldol reaction to dihydroxyacetone, which is then hydrogenated to glycerol to produce 1,2-PDO from C–O hydroangenolysis of glycerol. The yield of 1,2-PDO increases when fructose, dihydroxyacetone and glycerol are the substrates over Mn-promoted Ni-ZnO catalyst compared with Ni-ZnO catalyst. Lewis acid was reported to favor the isomerization of glucose and CC bond cleavage [60–64], as well as the yield of 1,2-PDO is twice over Mn-promoted Ni-ZnO than that over Ni-ZnO in this work. Thus, the CC and C–O bond breakages are also promoted by the Mn dopants in the synthesized catalysts. Thus, the addition of Mn not only promotes the dispersion of nickel on the catalyst but also enhances the hydrogenolysis reaction, including the CC bond cleavage in the retro-aldol reaction and glycerol dehydroxylation. However, as the Ni/ZnO and Mn/Ni/ZnO catalysts have comparable catalytic activity in the hydrogenation process, this process is not sensitive to the size of nickel particles or the acidity of the support. Thus, the promotion effect of Mn was mainly shown in the hydrogenolysis process, largely due to the improved dispersion and reduced particle size of Ni, as well as the increase in the Lewis acid sites of support. 4 Conclusions In summary, Mn-promoted Ni-based catalysts prepared at mild reduction temperature were shown to have high performance towards microalgae hydrolytic hydrogenation. The catalytic activity of our synthesized catalyst depended largely on the amount of the Mn added, the reduction temperature and the preparation method (impregnation or co-precipitation). The catalyst prepared by co-precipitation with 5% Mn and reduced at 350 °C exhibited the best performance, where the total yield of 1,2-PDO, EG, glycerol and 1,2-BDO reached 53.6% in the direct hydrogenation of microalgae. The addition of a proper amount of Mn into the Ni-ZnO catalyst was found to greatly enhance the dispersion of Ni and the formation of small Ni nanoparticles, which acted as the active sites in the hydrogenation reaction. The Mn-promoted Ni-ZnO catalyst was superior to the un-promoted catalyst for the dehydroxylation as well as the CC bond cleavage due to the increasing number of Lewis acid sites. Our findings not only provide a promising route for efficient biomass upgrading, but also shed light on the development of efficient and stable bimetallic nanocatalysts for hydrogenation. Acknowledgments Authors acknowledge financial supports provided by the Shanghai Science and Technology Committee, China (16dz1207200) and the Youth Innovation Promotion Association CAS, China (2015231). Appendix A Supplementary data Supplementary material related to this article can be found, in the online version, at doi:https://doi.org/10.1016/j.apcata.2018.07.042. Appendix A Supplementary data The following is Supplementary data to this article: References [1] A. Corma S. Iborra A. Velty Chem. Rev. 107 2007 2411 [2] A. Wang T. Zhang Acc. Chem. Res. 46 2013 1377 [3] A. Fukuoka P.L. Dhepe Angew. Chem. Int. Ed. 45 2006 5161 [4] P. Mäki-Arvela I. Simakova T. Salmi D.Yu. Murzin Chem. Res. 114 2014 1909 [5] C. Chatterjee F. Pong A. Sen Green Chem. 17 2015 40 [6] J. Li L. Liu Y. Liu M. Li Y. Zhu H. Liu Y. Kou J. Zhang Y. Han D. Ma Energy Environ. Sci. 7 2014 393 [7] B.O. Beeck M. Dusselier J. Geboers J. Holsbeek E. Morré S. Oswald L. Giebeler B.F. Sels Energy Environ. Sci. 8 2015 230 [8] J.J. Wang Z.C. Tan C.C. Zhu G. Miao L.Z. Kong Y.H. Sun Green Chem. 18 2016 452 [9] I. Sádaba M.L. Granados A. Riisager E. Taarning Green Chem. 17 2015 4133 [10] Y. Yang C. Ochoa-Hernández P. Pizarro V.A. de la Peña O’shea J.M. Coronado D.P. Serrano Appl. Catal. B: Environ. 197 2016 206 [11] S.V. Vyver J. Geboers W. Schutyser M. Dusselier P. Eloy E. Dornez J.W. Seo C.M. Courtin E.M. Gaigneaux P.A. Jacobs B.F. Sels ChemSusChem 5 2012 1549 [12] S. Song S. Yao J. Cao L. Di G. Wu N. Guan L. Li Appl. Catal. B: Environ. 217 2017 115 [13] N. Ji T. Zhang M. Zheng A. Wang H. Wang X. Wang J. Chen Angew. Chem. Int. Ed. 47 2008 8510 [14] J. Pang M. Zheng A. Wang T. Zhang Ind. Eng. Chem. Res. 50 2011 6601 [15] N. Ji M. Zheng A. Wang T. Zhang G. Chen ChemSusChem 5 2012 939 [16] X. Wang L. Meng F. Wu Y. Jiang L. Wang X. Mu Green Chem. 14 2012 758 [17] G. Xu A. Wang J. Pang M. Zheng J. Yin T. Zhang Appl. Catal. A: Gen. 502 2015 65 [18] J. Zhang B. Hou A. Wang Z. Li H. Wang T. Zhang AIChE J. 60 2014 3804 [19] X. Chen X. Wang S. Yao X. Mu Catal. Commun. 39 2013 86 [20] J. Sun H. Liu Catal. Today 234 2014 75 [21] Z. Tai J. Zhang A. Wang M. Zheng T. Zhang Chem. Commun. 48 2012 7052 [22] J. Pang M. Zheng A. Wang R. Sun H. Wang Y. Jiang T. Zhang AIChE J. 60 2014 2254 [23] L. Zhou A. Wang C. Li M. Zheng T. Zhang ChemSusChem 5 2012 932 [24] M. Li A.Q. Zheng T. Wang Zhang Energy Environ. Sci. 5 2012 6383 [25] G. Miao C.C. Zhu J.J. Wang Z.C. Tan L. Wang J.L. Liu L.Z. Kong Y.H. Sun Green Chem. 17 2015 2538 [26] B. Chen U. Dingerdissen J.G.E. Krauter H.G.J. Lansink Rotgerink K. Mobus D.J. Ostgard P. Panster T.H. Riermeier S. Seebald T. Tacke H. Trauthwein Appl. Catal. A: Gen. 280 2005 17 [27] K. Tomishige Y. Nakagawa M. Tamura Green Chem. 19 2017 2876 [28] H. Liu Z. Huang H. Kang X. Li C. Xia J. Chen Appl. Catal. B: Environ. 220 2018 251 [29] M. Kim J.M. Ha K.Y. Lee J. Jae Catal. Commun. 86 2016 113 [30] W. Yu J. Zhao H. Ma H. Miao Q. Song J. Xu Appl. Catal. A: Gen. 383 2010 73 [31] A.Y. Khodakov W. Chu P. Fongarland Chem. Rev. 107 2007 1692 [32] F. Morales F.M.F. Groot O.L.J. Gijzeman A. Mens O. Stephan B.M. Weckhuysen J. Catal. 230 2005 301 [33] T. Deng H. Liu Green Chem. 15 2013 116 [34] X.C. Wang F. Wu S.X. Yao Y.J. Jiang J. Guan X.D. Mu Chem. Lett. 41 2012 476 [35] W.T. Chen A. Chan D.S. Waterhouse T. Moriga H. Idriss G.I.N. Waterhouse J. Catal. 326 2015 43 [36] U. Holzwarth N. Gibson Nat. Nanotechnol. 6 2011 534 [37] N. Perret A.-M. Alexander S.M. Hunter P. Chung J.S.J. Hargreaves R.F. Howe M.A. Keane Appl. Catal. A: Gen. 488 2014 128 [38] G.B. Zhou Y. Pei Z. Jiang K.N. Fan M.H. Qiao B. Sun B.N. Zong J. Catal. 311 2014 393 [39] C.A. Emeis J. Catal. 141 1993 347 [40] A. Romero A. Nieto-Márquez E. Alonso Appl. Catal. A: Gen. 529 2017 49 [41] H. Cai C. Li A. Wang T. Zhang Catal. Today 234 2014 59 [42] M. Zhao T.L. Church A.T. Harris Appl. Catal. B: Environ. 101 2011 522 [43] L. Delannoy N.E. Hassan A. Musi N.N. Le To J. Krafft C. Louis J. Phys. Chem. B 110 2006 22471 [44] G. Wang J.A. Schaidle M.B. Katz Y. Li X. Pan L.T. Thompson J. Catal. 304 2013 92 [45] F. Morales F.M.F. de Groot P. Glatzel E. Kleimenov H. Bluhm M. Havecker A. Knop-Gericke B.M. Weckhuysen J. Phys. Chem. B 108 2004 16201 [46] Q. Ma H. Guo R.G. Gordon F. Zaera Chem. Mater. 23 2011 3325 [47] C. Luo S. Wang H. Liu Angew. Chem. Int. Ed. 46 2011 7636 [48] J. Sun H. Liu Green Chem. 13 2011 135 [49] P.A. Lazaridis S.A. Karakoulia C. Teodorescu N. Apostol D. Macovei A. Panteli A. Delimitis S.M. Coman V.I. Parvulescu K.S. Triantafylllidis Appl. Catal. B: Environ. 214 2017 1 [50] Z. Xiao S. Jin M. Pang C. Liang Green Chem. 15 2013 891 [51] D. Scholz C. Aellig L. Hermans ChemSusChem 7 2014 268 [52] B.S. Samant G.W. Kabalka Chem. Commun. 48 2012 8658 [53] P. Mäki-Arvela J. Hájek T. Salmi D.Y. Murzin Appl. Catal. A: Gen. 292 2005 41 [54] I. Obregón I. Gandarias A. Ocio I. García-García N. Alvarez de Eulate P.L. Arias Appl. Catal. B: Environ. 210 2017 328 [55] R. Sun T. Wang M. Zheng W. Deng J. Pang A. Wang X. Wang T. Zhang ACS Catal. 5 2015 874 [56] Y. Yang C. Ochoa-Hernández V.A. de la Peña O’Shea P. Pizarro J.M. Coronado D.P. Serrano Appl. Catal. B: Environ. 145 2014 91 [57] J. Geboers S.V. Vyver K. Carpentier K. Blochouse P. Jacobs B. Sels Chem. Commun. 46 2010 3577 [58] J. Wu G. Gao J. Li P. Sun X. Long F. Li Appl. Catal. B: Environ. 203 2017 227 [59] P.Y. Dapsens C. Mondelli J. Perez-Ramirez Chem. Soc. Res. 44 2015 7025 [60] C. Liu C. Zhang S. Sun K. Liu S. Hao J. Xu Y. Zhu Y. Li ACS Catal. 5 2015 4612 [61] A. Takagaki J.C. Jung S. Hayashi RSC Adv. 4 2014 43785 [62] D. Verma R. Insyani Y.-W. Suh S.M. Kim S.K. Kim J. Kim Green Chem. 19 2017 1969 [63] L. Yang X. Yang E. Tian V. Vattipalli W. Fan H. Lin J. Catal. 333 2016 207 [64] W. Deng Q. Zhang Y. Wang Catal. Today 234 2014 31",
      "scopus-id": "85051011483",
      "coredata": {
        "eid": "1-s2.0-S0926860X18303818",
        "dc:description": "Mn-promoted nickel-based catalysts were explored for the direct hydrogenation of microalgae (Chlorococcum sp.) containing 49.6% of carbohydrates in water. With this catalyst at 250 °C for 3.0 h, microalgae was completely decomposed, where the conversion of microalgae to liquid products (CTL) and the total yield of polyols reached 66.9%, and 53.6%, respectively. Among polyols, the total yield of 1,2-propanediol and ethylene glycol were 41.7%. XRD, XPS and TEM-EDX characterizations showed that 5% of Mn addition, 350 °C of reduction temperature and the co-precipitation synthesis ensured the excellent dispersion of the Ni catalyst with small particle sizes. The Mn promoter was found to stabilize the catalyst structure by preventing the Ni particles from aggregation and to effectively promote retro-aldol and dehydroxylation reaction due to the increasing number of Lewis acid sites. Meanwhile, the hydrogenation pathways over nickel-based catalysts were proposed.",
        "openArchiveArticle": "false",
        "prism:coverDate": "2018-09-05",
        "openaccessUserLicense": null,
        "prism:aggregationType": "Journal",
        "prism:url": "https://api.elsevier.com/content/article/pii/S0926860X18303818",
        "dc:creator": [
          {
            "@_fa": "true",
            "$": "Miao, Gai"
          },
          {
            "@_fa": "true",
            "$": "Zan, Yifan"
          },
          {
            "@_fa": "true",
            "$": "Sun, Yuanyuan"
          },
          {
            "@_fa": "true",
            "$": "Wang, Hao"
          },
          {
            "@_fa": "true",
            "$": "Li, Shenglin"
          },
          {
            "@_fa": "true",
            "$": "Liu, Chang"
          },
          {
            "@_fa": "true",
            "$": "Li, Shenggang"
          },
          {
            "@_fa": "true",
            "$": "Kong, Lingzhao"
          },
          {
            "@_fa": "true",
            "$": "Sun, Yuhan"
          }
        ],
        "link": [
          {
            "@_fa": "true",
            "@rel": "self",
            "@href": "https://api.elsevier.com/content/article/pii/S0926860X18303818"
          },
          {
            "@_fa": "true",
            "@rel": "scidir",
            "@href": "https://www.sciencedirect.com/science/article/pii/S0926860X18303818"
          }
        ],
        "dc:format": "application/json",
        "openaccessType": null,
        "pii": "S0926-860X(18)30381-8",
        "prism:volume": "565",
        "prism:publisher": "Elsevier B.V.",
        "dc:title": "Mn-promoted hydrogenation of microalgae (Chlorococcum sp.) to 1,2-propanediol and ethylene glycol over Ni-ZnO catalysts",
        "prism:copyright": "© 2018 Elsevier B.V. All rights reserved.",
        "openaccess": "0",
        "prism:issn": "0926860X",
        "dcterms:subject": [
          {
            "@_fa": "true",
            "$": "Microalgae"
          },
          {
            "@_fa": "true",
            "$": "Hydrogenation"
          },
          {
            "@_fa": "true",
            "$": "1,2-Propanediol"
          },
          {
            "@_fa": "true",
            "$": "Ethylene glycol"
          },
          {
            "@_fa": "true",
            "$": "Mn-promoted Ni-ZnO catalyst"
          }
        ],
        "openaccessArticle": "false",
        "prism:publicationName": "Applied Catalysis A: General",
        "openaccessSponsorType": null,
        "prism:pageRange": "34-45",
        "prism:endingPage": "45",
        "pubType": "fla",
        "prism:coverDisplayDate": "5 September 2018",
        "prism:doi": "10.1016/j.apcata.2018.07.042",
        "prism:startingPage": "34",
        "dc:identifier": "doi:10.1016/j.apcata.2018.07.042",
        "openaccessSponsorName": null
      },
      "objects": {
        "object": [
          {
            "@category": "thumbnail",
            "@height": "87",
            "@width": "219",
            "@_fa": "true",
            "$": "https://api.elsevier.com/content/object/eid/1-s2.0-S0926860X18303818-ga1.sml?httpAccept=%2A%2F%2A",
            "@multimediatype": "GIF image file",
            "@type": "IMAGE-THUMBNAIL",
            "@size": "10814",
            "@ref": "ga1",
            "@mimetype": "image/gif"
          },
          {
            "@category": "thumbnail",
            "@height": "164",
            "@width": "206",
            "@_fa": "true",
            "$": "https://api.elsevier.com/content/object/eid/1-s2.0-S0926860X18303818-gr1.sml?httpAccept=%2A%2F%2A",
            "@multimediatype": "GIF image file",
            "@type": "IMAGE-THUMBNAIL",
            "@size": "8958",
            "@ref": "gr1",
            "@mimetype": "image/gif"
          },
          {
            "@category": "thumbnail",
            "@height": "164",
            "@width": "191",
            "@_fa": "true",
            "$": "https://api.elsevier.com/content/object/eid/1-s2.0-S0926860X18303818-gr2.sml?httpAccept=%2A%2F%2A",
            "@multimediatype": "GIF image file",
            "@type": "IMAGE-THUMBNAIL",
            "@size": "4539",
            "@ref": "gr2",
            "@mimetype": "image/gif"
          },
          {
            "@category": "thumbnail",
            "@height": "85",
            "@width": "219",
            "@_fa": "true",
            "$": "https://api.elsevier.com/content/object/eid/1-s2.0-S0926860X18303818-gr3.sml?httpAccept=%2A%2F%2A",
            "@multimediatype": "GIF image file",
            "@type": "IMAGE-THUMBNAIL",
            "@size": "4783",
            "@ref": "gr3",
            "@mimetype": "image/gif"
          },
          {
            "@category": "thumbnail",
            "@height": "164",
            "@width": "200",
            "@_fa": "true",
            "$": "https://api.elsevier.com/content/object/eid/1-s2.0-S0926860X18303818-gr4.sml?httpAccept=%2A%2F%2A",
            "@multimediatype": "GIF image file",
            "@type": "IMAGE-THUMBNAIL",
            "@size": "3472",
            "@ref": "gr4",
            "@mimetype": "image/gif"
          },
          {
            "@category": "thumbnail",
            "@height": "164",
            "@width": "181",
            "@_fa": "true",
            "$": "https://api.elsevier.com/content/object/eid/1-s2.0-S0926860X18303818-gr5.sml?httpAccept=%2A%2F%2A",
            "@multimediatype": "GIF image file",
            "@type": "IMAGE-THUMBNAIL",
            "@size": "17181",
            "@ref": "gr5",
            "@mimetype": "image/gif"
          },
          {
            "@category": "thumbnail",
            "@height": "164",
            "@width": "183",
            "@_fa": "true",
            "$": "https://api.elsevier.com/content/object/eid/1-s2.0-S0926860X18303818-gr6.sml?httpAccept=%2A%2F%2A",
            "@multimediatype": "GIF image file",
            "@type": "IMAGE-THUMBNAIL",
            "@size": "14594",
            "@ref": "gr6",
            "@mimetype": "image/gif"
          },
          {
            "@category": "thumbnail",
            "@height": "104",
            "@width": "219",
            "@_fa": "true",
            "$": "https://api.elsevier.com/content/object/eid/1-s2.0-S0926860X18303818-gr7.sml?httpAccept=%2A%2F%2A",
            "@multimediatype": "GIF image file",
            "@type": "IMAGE-THUMBNAIL",
            "@size": "10516",
            "@ref": "gr7",
            "@mimetype": "image/gif"
          },
          {
            "@category": "thumbnail",
            "@height": "144",
            "@width": "219",
            "@_fa": "true",
            "$": "https://api.elsevier.com/content/object/eid/1-s2.0-S0926860X18303818-gr8.sml?httpAccept=%2A%2F%2A",
            "@multimediatype": "GIF image file",
            "@type": "IMAGE-THUMBNAIL",
            "@size": "17502",
            "@ref": "gr8",
            "@mimetype": "image/gif"
          },
          {
            "@category": "thumbnail",
            "@height": "157",
            "@width": "219",
            "@_fa": "true",
            "$": "https://api.elsevier.com/content/object/eid/1-s2.0-S0926860X18303818-gr9.sml?httpAccept=%2A%2F%2A",
            "@multimediatype": "GIF image file",
            "@type": "IMAGE-THUMBNAIL",
            "@size": "5171",
            "@ref": "gr9",
            "@mimetype": "image/gif"
          },
          {
            "@category": "thumbnail",
            "@height": "88",
            "@width": "219",
            "@_fa": "true",
            "$": "https://api.elsevier.com/content/object/eid/1-s2.0-S0926860X18303818-sc1.sml?httpAccept=%2A%2F%2A",
            "@multimediatype": "GIF image file",
            "@type": "IMAGE-THUMBNAIL",
            "@size": "4169",
            "@ref": "sc1",
            "@mimetype": "image/gif"
          },
          {
            "@category": "standard",
            "@height": "198",
            "@width": "500",
            "@_fa": "true",
            "$": "https://api.elsevier.com/content/object/eid/1-s2.0-S0926860X18303818-ga1.jpg?httpAccept=%2A%2F%2A",
            "@multimediatype": "JPEG image file",
            "@type": "IMAGE-DOWNSAMPLED",
            "@size": "31300",
            "@ref": "ga1",
            "@mimetype": "image/jpeg"
          },
          {
            "@category": "standard",
            "@height": "629",
            "@width": "791",
            "@_fa": "true",
            "$": "https://api.elsevier.com/content/object/eid/1-s2.0-S0926860X18303818-gr1.jpg?httpAccept=%2A%2F%2A",
            "@multimediatype": "JPEG image file",
            "@type": "IMAGE-DOWNSAMPLED",
            "@size": "105629",
            "@ref": "gr1",
            "@mimetype": "image/jpeg"
          },
          {
            "@category": "standard",
            "@height": "321",
            "@width": "374",
            "@_fa": "true",
            "$": "https://api.elsevier.com/content/object/eid/1-s2.0-S0926860X18303818-gr2.jpg?httpAccept=%2A%2F%2A",
            "@multimediatype": "JPEG image file",
            "@type": "IMAGE-DOWNSAMPLED",
            "@size": "22238",
            "@ref": "gr2",
            "@mimetype": "image/jpeg"
          },
          {
            "@category": "standard",
            "@height": "308",
            "@width": "791",
            "@_fa": "true",
            "$": "https://api.elsevier.com/content/object/eid/1-s2.0-S0926860X18303818-gr3.jpg?httpAccept=%2A%2F%2A",
            "@multimediatype": "JPEG image file",
            "@type": "IMAGE-DOWNSAMPLED",
            "@size": "53143",
            "@ref": "gr3",
            "@mimetype": "image/jpeg"
          },
          {
            "@category": "standard",
            "@height": "308",
            "@width": "376",
            "@_fa": "true",
            "$": "https://api.elsevier.com/content/object/eid/1-s2.0-S0926860X18303818-gr4.jpg?httpAccept=%2A%2F%2A",
            "@multimediatype": "JPEG image file",
            "@type": "IMAGE-DOWNSAMPLED",
            "@size": "15549",
            "@ref": "gr4",
            "@mimetype": "image/jpeg"
          },
          {
            "@category": "standard",
            "@height": "713",
            "@width": "789",
            "@_fa": "true",
            "$": "https://api.elsevier.com/content/object/eid/1-s2.0-S0926860X18303818-gr5.jpg?httpAccept=%2A%2F%2A",
            "@multimediatype": "JPEG image file",
            "@type": "IMAGE-DOWNSAMPLED",
            "@size": "165198",
            "@ref": "gr5",
            "@mimetype": "image/jpeg"
          },
          {
            "@category": "standard",
            "@height": "507",
            "@width": "567",
            "@_fa": "true",
            "$": "https://api.elsevier.com/content/object/eid/1-s2.0-S0926860X18303818-gr6.jpg?httpAccept=%2A%2F%2A",
            "@multimediatype": "JPEG image file",
            "@type": "IMAGE-DOWNSAMPLED",
            "@size": "71929",
            "@ref": "gr6",
            "@mimetype": "image/jpeg"
          },
          {
            "@category": "standard",
            "@height": "268",
            "@width": "567",
            "@_fa": "true",
            "$": "https://api.elsevier.com/content/object/eid/1-s2.0-S0926860X18303818-gr7.jpg?httpAccept=%2A%2F%2A",
            "@multimediatype": "JPEG image file",
            "@type": "IMAGE-DOWNSAMPLED",
            "@size": "53489",
            "@ref": "gr7",
            "@mimetype": "image/jpeg"
          },
          {
            "@category": "standard",
            "@height": "374",
            "@width": "567",
            "@_fa": "true",
            "$": "https://api.elsevier.com/content/object/eid/1-s2.0-S0926860X18303818-gr8.jpg?httpAccept=%2A%2F%2A",
            "@multimediatype": "JPEG image file",
            "@type": "IMAGE-DOWNSAMPLED",
            "@size": "65721",
            "@ref": "gr8",
            "@mimetype": "image/jpeg"
          },
          {
            "@category": "standard",
            "@height": "270",
            "@width": "376",
            "@_fa": "true",
            "$": "https://api.elsevier.com/content/object/eid/1-s2.0-S0926860X18303818-gr9.jpg?httpAccept=%2A%2F%2A",
            "@multimediatype": "JPEG image file",
            "@type": "IMAGE-DOWNSAMPLED",
            "@size": "17041",
            "@ref": "gr9",
            "@mimetype": "image/jpeg"
          },
          {
            "@category": "standard",
            "@height": "301",
            "@width": "752",
            "@_fa": "true",
            "$": "https://api.elsevier.com/content/object/eid/1-s2.0-S0926860X18303818-sc1.jpg?httpAccept=%2A%2F%2A",
            "@multimediatype": "JPEG image file",
            "@type": "IMAGE-DOWNSAMPLED",
            "@size": "37692",
            "@ref": "sc1",
            "@mimetype": "image/jpeg"
          },
          {
            "@category": "high",
            "@height": "876",
            "@width": "2213",
            "@_fa": "true",
            "$": "https://api.elsevier.com/content/object/eid/1-s2.0-S0926860X18303818-ga1_lrg.jpg?httpAccept=%2A%2F%2A",
            "@multimediatype": "JPEG image file",
            "@type": "IMAGE-HIGH-RES",
            "@size": "234458",
            "@ref": "ga1",
            "@mimetype": "image/jpeg"
          },
          {
            "@category": "high",
            "@height": "2782",
            "@width": "3500",
            "@_fa": "true",
            "$": "https://api.elsevier.com/content/object/eid/1-s2.0-S0926860X18303818-gr1_lrg.jpg?httpAccept=%2A%2F%2A",
            "@multimediatype": "JPEG image file",
            "@type": "IMAGE-HIGH-RES",
            "@size": "864531",
            "@ref": "gr1",
            "@mimetype": "image/jpeg"
          },
          {
            "@category": "high",
            "@height": "1420",
            "@width": "1655",
            "@_fa": "true",
            "$": "https://api.elsevier.com/content/object/eid/1-s2.0-S0926860X18303818-gr2_lrg.jpg?httpAccept=%2A%2F%2A",
            "@multimediatype": "JPEG image file",
            "@type": "IMAGE-HIGH-RES",
            "@size": "168691",
            "@ref": "gr2",
            "@mimetype": "image/jpeg"
          },
          {
            "@category": "high",
            "@height": "1362",
            "@width": "3500",
            "@_fa": "true",
            "$": "https://api.elsevier.com/content/object/eid/1-s2.0-S0926860X18303818-gr3_lrg.jpg?httpAccept=%2A%2F%2A",
            "@multimediatype": "JPEG image file",
            "@type": "IMAGE-HIGH-RES",
            "@size": "380953",
            "@ref": "gr3",
            "@mimetype": "image/jpeg"
          },
          {
            "@category": "high",
            "@height": "1366",
            "@width": "1667",
            "@_fa": "true",
            "$": "https://api.elsevier.com/content/object/eid/1-s2.0-S0926860X18303818-gr4_lrg.jpg?httpAccept=%2A%2F%2A",
            "@multimediatype": "JPEG image file",
            "@type": "IMAGE-HIGH-RES",
            "@size": "118292",
            "@ref": "gr4",
            "@mimetype": "image/jpeg"
          },
          {
            "@category": "high",
            "@height": "3155",
            "@width": "3492",
            "@_fa": "true",
            "$": "https://api.elsevier.com/content/object/eid/1-s2.0-S0926860X18303818-gr5_lrg.jpg?httpAccept=%2A%2F%2A",
            "@multimediatype": "JPEG image file",
            "@type": "IMAGE-HIGH-RES",
            "@size": "1657097",
            "@ref": "gr5",
            "@mimetype": "image/jpeg"
          },
          {
            "@category": "high",
            "@height": "2243",
            "@width": "2509",
            "@_fa": "true",
            "$": "https://api.elsevier.com/content/object/eid/1-s2.0-S0926860X18303818-gr6_lrg.jpg?httpAccept=%2A%2F%2A",
            "@multimediatype": "JPEG image file",
            "@type": "IMAGE-HIGH-RES",
            "@size": "559669",
            "@ref": "gr6",
            "@mimetype": "image/jpeg"
          },
          {
            "@category": "high",
            "@height": "1188",
            "@width": "2509",
            "@_fa": "true",
            "$": "https://api.elsevier.com/content/object/eid/1-s2.0-S0926860X18303818-gr7_lrg.jpg?httpAccept=%2A%2F%2A",
            "@multimediatype": "JPEG image file",
            "@type": "IMAGE-HIGH-RES",
            "@size": "366125",
            "@ref": "gr7",
            "@mimetype": "image/jpeg"
          },
          {
            "@category": "high",
            "@height": "1654",
            "@width": "2509",
            "@_fa": "true",
            "$": "https://api.elsevier.com/content/object/eid/1-s2.0-S0926860X18303818-gr8_lrg.jpg?httpAccept=%2A%2F%2A",
            "@multimediatype": "JPEG image file",
            "@type": "IMAGE-HIGH-RES",
            "@size": "568320",
            "@ref": "gr8",
            "@mimetype": "image/jpeg"
          },
          {
            "@category": "high",
            "@height": "1197",
            "@width": "1667",
            "@_fa": "true",
            "$": "https://api.elsevier.com/content/object/eid/1-s2.0-S0926860X18303818-gr9_lrg.jpg?httpAccept=%2A%2F%2A",
            "@multimediatype": "JPEG image file",
            "@type": "IMAGE-HIGH-RES",
            "@size": "110296",
            "@ref": "gr9",
            "@mimetype": "image/jpeg"
          },
          {
            "@category": "high",
            "@height": "1335",
            "@width": "3330",
            "@_fa": "true",
            "$": "https://api.elsevier.com/content/object/eid/1-s2.0-S0926860X18303818-sc1_lrg.jpg?httpAccept=%2A%2F%2A",
            "@multimediatype": "JPEG image file",
            "@type": "IMAGE-HIGH-RES",
            "@size": "299201",
            "@ref": "sc1",
            "@mimetype": "image/jpeg"
          },
          {
            "@category": "standard",
            "@_fa": "true",
            "$": "https://api.elsevier.com/content/object/eid/1-s2.0-S0926860X18303818-mmc1.pdf?httpAccept=%2A%2F%2A",
            "@multimediatype": "Acrobat PDF file",
            "@type": "APPLICATION",
            "@size": "761487",
            "@ref": "mmc1",
            "@mimetype": "application/pdf"
          }
        ]
      },
      "link": {
        "@rel": "abstract",
        "@href": "https://api.elsevier.com/content/abstract/scopus_id/85051011483"
      }
    }
  }
}