{
  "metadata": {
    "title": "Combined theoretical and experimental kinetic approach for methane conversion on model supported Pd/La<ce:inf loc=post>0.7</ce:inf>MnO<ce:inf loc=post>3</ce:inf> NGV catalyst: Sensitivity to inlet gas composition and consequence on the Pd-support interface",
    "authors": "; ; ",
    "journal": "Applied Catalysis A: General",
    "date": "2022-07-05",
    "doi": "10.1016/j.apcata.2022.118687",
    "abstract": "",
    "uri": "https://api.elsevier.com/content/article/pii/S0926860X22002101",
    "pii": "S0926860X22002101"
  },
  "fulltext": {
    "full-text-retrieval-response": {
      "scopus-eid": "2-s2.0-85131141933",
      "originalText": "serial JL 271346 291210 291744 291809 31 Applied Catalysis A: General APPLIEDCATALYSISAGENERAL 2022-05-26 2022-05-26 2022-05-30 2022-05-30 2022-06-09T08:53:05 1-s2.0-S0926860X22002101 S0926-860X(22)00210-1 S0926860X22002101 10.1016/j.apcata.2022.118687 S300 S300.1 FULL-TEXT 1-s2.0-S0926860X22X00124 2024-01-01T12:34:28.416125Z 0 0 20220705 2022 2022-05-26T15:26:45.633275Z absattachment articleinfo articlenumber articletitlenorm authfirstinitialnorm authfirstsurnamenorm cid cids contenttype copyright crossmark dateloaded dateloadedtxt datesearch datesort dateupdated dco docsubtype doctype doi eid ewtransactionid hubeid indexeddate issn issnnorm itemstage itemtransactionid itemweight openaccess openarchive pg pgfirst pii piinorm pubdatestart pubdatetxt pubyr sortorder srctitle srctitlenorm srctype ssids alllist content subj subheadings suppl tomb volfirst volissue volumelist webpdf webpdfpagecount yearnav figure table e-component body mmlmath acknowledge affil appendices articletitle auth authfirstini authfull authkeywords authlast grantnumber grantsponsor grantsponsorid highlightsabst primabst ref specialabst 0926-860X 0926860X true 641 641 C Volume 641 13 118687 118687 118687 20220705 5 July 2022 2022-07-05 2022 article fla © 2022 Elsevier B.V. All rights reserved. COMBINEDTHEORETICALEXPERIMENTALKINETICAPPROACHFORMETHANECONVERSIONMODELSUPPORTEDPDLA07MNO3NGVCATALYSTSENSITIVITYINLETGASCOMPOSITIONCONSEQUENCEPDSUPPORTINTERFACE ZHENG Y 1 Introduction 2 Materials and methods 3 Results and discussion 3.1 Theoretical approach on model Pd(111) surface 3.2 Kinetics and related reaction mechanism on Pd/La0.7MnO3 in lean conditions 3.3 Kinetics and related reaction mechanism on Pd/La0.7MnO3 near the stoichiometry in the presence of steam 4 Conclusion CRediT authorship contribution statement Acknowledgments Appendix A Supplementary material References AUYEUNG 1999 132 139 J STOTZ 2019 152 175 H ZHU 2005 2331 2337 G RIBEIRO 1994 537 544 F FUJIMOTO 1998 431 442 K ZANG 2016 570 579 F NILSSON 2017 237 345 J SANTOSHKUMAR 2010 77 84 M WINKLER 2008 162 169 A MILLER 2015 54 62 J GRANGER 2020 1474 1484 P NISHIHATA 2002 164 Y UENISHI 2005 267 273 M LU 2014 631 643 Y PILARGONZALESMARCOS 2021 88 95 P CHEN 2020 118475 J SHWARTZ 2012 8571 8578 W SCHWARTZ 2012 W SCHON 2018 167 176 A SHUSTOROVICH 1998 1 119 E SHUSTOROVICH 1993 127 138 E STOTZ 2019 152 175 H MONTEIRO 2001 291 301 R WU 2015 236 247 Y DACQUIN 2011 1911 1921 J VANDENBOSSCHE 2015 12035 12044 M ZHENGX2022X118687 ZHENGX2022X118687XY NR_HAL publishAcceptedManuscriptIndexable http://www.elsevier.com/open-access/userlicense/1.0/ 2023-05-30T00:00:00.000Z http://creativecommons.org/licenses/by-nc-nd/4.0/ © 2022 Elsevier B.V. All rights reserved. 0 https://doi.org/10.15223/policy-017 https://doi.org/10.15223/policy-037 https://doi.org/10.15223/policy-012 https://doi.org/10.15223/policy-029 https://doi.org/10.15223/policy-004 item S0926-860X(22)00210-1 S0926860X22002101 1-s2.0-S0926860X22002101 10.1016/j.apcata.2022.118687 271346 2024-01-01T12:34:28.416125Z 2022-07-05 1-s2.0-S0926860X22002101-main.pdf https://s3-eu-west-1.amazonaws.com/prod-ucs-content-store-eu-west/content/pii:S0926860X22002101/MAIN/application/pdf/a7352e8c1c8959d2612d3f88bb26c4ef/main.pdf main.pdf pdf true 530194 MAIN 6 1-s2.0-S0926860X22002101-main_1.png https://s3-eu-west-1.amazonaws.com/prod-ucs-content-store-eu-west/content/pii:S0926860X22002101/PREVIEW/image/png/95c82e7b4a9a71e18e5aa51b1b4e9133/main_1.png main_1.png png 58634 849 656 IMAGE-WEB-PDF 1 1-s2.0-S0926860X22002101-fx3.jpg https://s3-eu-west-1.amazonaws.com/prod-ucs-content-store-eu-west/content/pii:S0926860X22002101/fx3/DOWNSAMPLED/image/jpeg/51e864e7f2b51288f41664b3d47a00c2/fx3.jpg fx3 fx3.jpg jpg 531 12 12 IMAGE-DOWNSAMPLED 1-s2.0-S0926860X22002101-fx2.jpg https://s3-eu-west-1.amazonaws.com/prod-ucs-content-store-eu-west/content/pii:S0926860X22002101/fx2/DOWNSAMPLED/image/jpeg/38ae5dee60f7ac2561da31adbbeb6bee/fx2.jpg fx2 fx2.jpg jpg 480 12 12 IMAGE-DOWNSAMPLED 1-s2.0-S0926860X22002101-fx4.jpg https://s3-eu-west-1.amazonaws.com/prod-ucs-content-store-eu-west/content/pii:S0926860X22002101/fx4/DOWNSAMPLED/image/jpeg/659cac4462873a749587e9e9fd770f82/fx4.jpg fx4 fx4.jpg jpg 496 12 14 IMAGE-DOWNSAMPLED 1-s2.0-S0926860X22002101-fx1.jpg https://s3-eu-west-1.amazonaws.com/prod-ucs-content-store-eu-west/content/pii:S0926860X22002101/fx1/DOWNSAMPLED/image/jpeg/3228b98b129b3758c46ebd319cd9b559/fx1.jpg fx1 fx1.jpg jpg 287 10 10 IMAGE-DOWNSAMPLED 1-s2.0-S0926860X22002101-gr2.jpg https://s3-eu-west-1.amazonaws.com/prod-ucs-content-store-eu-west/content/pii:S0926860X22002101/gr2/DOWNSAMPLED/image/jpeg/28bec0ca49c3e669cb94129ff9ac63f1/gr2.jpg gr2 gr2.jpg jpg 14927 173 282 IMAGE-DOWNSAMPLED 1-s2.0-S0926860X22002101-ga1.jpg https://s3-eu-west-1.amazonaws.com/prod-ucs-content-store-eu-west/content/pii:S0926860X22002101/ga1/DOWNSAMPLED/image/jpeg/1e19cd131820ec3393af5f95a060acfd/ga1.jpg ga1 true ga1.jpg jpg 12396 245 251 IMAGE-DOWNSAMPLED 1-s2.0-S0926860X22002101-gr1.jpg https://s3-eu-west-1.amazonaws.com/prod-ucs-content-store-eu-west/content/pii:S0926860X22002101/gr1/DOWNSAMPLED/image/jpeg/117a0dbe16ee2b65ed63b9820e5cebe9/gr1.jpg gr1 gr1.jpg jpg 20486 180 565 IMAGE-DOWNSAMPLED 1-s2.0-S0926860X22002101-fx3.sml https://s3-eu-west-1.amazonaws.com/prod-ucs-content-store-eu-west/content/pii:S0926860X22002101/fx3/THUMBNAIL/image/gif/2222f017143c741d8e58204ceeeb0627/fx3.sml fx3 fx3.sml sml 3100 57 57 IMAGE-THUMBNAIL 1-s2.0-S0926860X22002101-fx2.sml https://s3-eu-west-1.amazonaws.com/prod-ucs-content-store-eu-west/content/pii:S0926860X22002101/fx2/THUMBNAIL/image/gif/9df483620d507647157ea173a8c2c853/fx2.sml fx2 fx2.sml sml 1703 57 57 IMAGE-THUMBNAIL 1-s2.0-S0926860X22002101-fx4.sml https://s3-eu-west-1.amazonaws.com/prod-ucs-content-store-eu-west/content/pii:S0926860X22002101/fx4/THUMBNAIL/image/gif/ba0675a9bcb1235def5835578875429a/fx4.sml fx4 fx4.sml sml 2652 55 63 IMAGE-THUMBNAIL 1-s2.0-S0926860X22002101-fx1.sml https://s3-eu-west-1.amazonaws.com/prod-ucs-content-store-eu-west/content/pii:S0926860X22002101/fx1/THUMBNAIL/image/gif/de8c3b98e40f45068782f7f143998424/fx1.sml fx1 fx1.sml sml 111 55 55 IMAGE-THUMBNAIL 1-s2.0-S0926860X22002101-gr2.sml https://s3-eu-west-1.amazonaws.com/prod-ucs-content-store-eu-west/content/pii:S0926860X22002101/gr2/THUMBNAIL/image/gif/1dbdc0c44d9cd5c09ff0dc8bfc1667f1/gr2.sml gr2 gr2.sml sml 6860 135 219 IMAGE-THUMBNAIL 1-s2.0-S0926860X22002101-ga1.sml https://s3-eu-west-1.amazonaws.com/prod-ucs-content-store-eu-west/content/pii:S0926860X22002101/ga1/THUMBNAIL/image/gif/8597d16c618ee044760e14abd12b900b/ga1.sml ga1 true ga1.sml sml 6728 164 168 IMAGE-THUMBNAIL 1-s2.0-S0926860X22002101-gr1.sml https://s3-eu-west-1.amazonaws.com/prod-ucs-content-store-eu-west/content/pii:S0926860X22002101/gr1/THUMBNAIL/image/gif/0cb12dfb06791cecf2d5a9f722d0695a/gr1.sml gr1 gr1.sml sml 3676 70 219 IMAGE-THUMBNAIL 1-s2.0-S0926860X22002101-fx3_lrg.jpg https://s3-eu-west-1.amazonaws.com/prod-ucs-content-store-eu-west/content/pii:S0926860X22002101/fx3/HIGHRES/image/jpeg/9b3cb0766f7f06a02dc7f72d4e435c7e/fx3_lrg.jpg fx3 fx3_lrg.jpg jpg 1745 57 57 IMAGE-HIGH-RES 1-s2.0-S0926860X22002101-fx2_lrg.jpg https://s3-eu-west-1.amazonaws.com/prod-ucs-content-store-eu-west/content/pii:S0926860X22002101/fx2/HIGHRES/image/jpeg/6d68e7fa26688623bffb444d0e9ce3a1/fx2_lrg.jpg fx2 fx2_lrg.jpg jpg 1040 57 57 IMAGE-HIGH-RES 1-s2.0-S0926860X22002101-fx4_lrg.jpg https://s3-eu-west-1.amazonaws.com/prod-ucs-content-store-eu-west/content/pii:S0926860X22002101/fx4/HIGHRES/image/jpeg/a079f7ccfad8e4936f18016e1f286946/fx4_lrg.jpg fx4 fx4_lrg.jpg jpg 1189 55 63 IMAGE-HIGH-RES 1-s2.0-S0926860X22002101-fx1_lrg.jpg https://s3-eu-west-1.amazonaws.com/prod-ucs-content-store-eu-west/content/pii:S0926860X22002101/fx1/HIGHRES/image/jpeg/f2f34119dadbfd4351b900a3395a8e31/fx1_lrg.jpg fx1 fx1_lrg.jpg jpg 320 55 55 IMAGE-HIGH-RES 1-s2.0-S0926860X22002101-gr2_lrg.jpg https://s3-eu-west-1.amazonaws.com/prod-ucs-content-store-eu-west/content/pii:S0926860X22002101/gr2/HIGHRES/image/jpeg/24da3a74267a9ec122d80bd0ad7a3c58/gr2_lrg.jpg gr2 gr2_lrg.jpg jpg 89235 767 1247 IMAGE-HIGH-RES 1-s2.0-S0926860X22002101-ga1_lrg.jpg https://s3-eu-west-1.amazonaws.com/prod-ucs-content-store-eu-west/content/pii:S0926860X22002101/ga1/HIGHRES/image/jpeg/fb0ce2794b7c80ae7f924872ea9250a0/ga1_lrg.jpg ga1 true ga1_lrg.jpg jpg 84145 1085 1111 IMAGE-HIGH-RES 1-s2.0-S0926860X22002101-gr1_lrg.jpg https://s3-eu-west-1.amazonaws.com/prod-ucs-content-store-eu-west/content/pii:S0926860X22002101/gr1/HIGHRES/image/jpeg/a3b709a06fcc597b05125f6cd15c4d60/gr1_lrg.jpg gr1 gr1_lrg.jpg jpg 117181 794 2495 IMAGE-HIGH-RES 1-s2.0-S0926860X22002101-mmc1.docx https://s3-eu-west-1.amazonaws.com/prod-ucs-content-store-eu-west/content/pii:S0926860X22002101/mmc1/MAIN/application/vnd.openxmlformats-officedocument.wordprocessingml.document/0b951969b892fc98cd9b20feb43364f0/mmc1.docx mmc1 mmc1.docx docx 857212 APPLICATION 1-s2.0-S0926860X22002101-si0001.svg https://s3-eu-west-1.amazonaws.com/prod-ucs-content-store-eu-west/content/pii:S0926860X22002101/STRIPIN/image/svg+xml/58b587a73709ec8b326f918f75d327f6/si0001.svg si0001 si0001.svg svg 1430 ALTIMG 1-s2.0-S0926860X22002101-si0002.svg https://s3-eu-west-1.amazonaws.com/prod-ucs-content-store-eu-west/content/pii:S0926860X22002101/STRIPIN/image/svg+xml/145a037b5540b5a3304e6a2b6412068f/si0002.svg si0002 si0002.svg svg 1223 ALTIMG 1-s2.0-S0926860X22002101-si0003.svg https://s3-eu-west-1.amazonaws.com/prod-ucs-content-store-eu-west/content/pii:S0926860X22002101/STRIPIN/image/svg+xml/f88eee3d3e7419067dca8e91cd356aad/si0003.svg si0003 si0003.svg svg 1235 ALTIMG 1-s2.0-S0926860X22002101-si0004.svg https://s3-eu-west-1.amazonaws.com/prod-ucs-content-store-eu-west/content/pii:S0926860X22002101/STRIPIN/image/svg+xml/b9b21b2ba9c729a555ccb8c8734e0319/si0004.svg si0004 si0004.svg svg 2228 ALTIMG 1-s2.0-S0926860X22002101-si0005.svg https://s3-eu-west-1.amazonaws.com/prod-ucs-content-store-eu-west/content/pii:S0926860X22002101/STRIPIN/image/svg+xml/ef341021fbdf030630b532968c77cdd4/si0005.svg si0005 si0005.svg svg 2419 ALTIMG 1-s2.0-S0926860X22002101-si0006.svg https://s3-eu-west-1.amazonaws.com/prod-ucs-content-store-eu-west/content/pii:S0926860X22002101/STRIPIN/image/svg+xml/6605821df23df4426f4e2567986eee4d/si0006.svg si0006 si0006.svg svg 3010 ALTIMG 1-s2.0-S0926860X22002101-si0007.svg https://s3-eu-west-1.amazonaws.com/prod-ucs-content-store-eu-west/content/pii:S0926860X22002101/STRIPIN/image/svg+xml/681b2bff6e6f929704278e57c68bee00/si0007.svg si0007 si0007.svg svg 4846 ALTIMG 1-s2.0-S0926860X22002101-si0008.svg https://s3-eu-west-1.amazonaws.com/prod-ucs-content-store-eu-west/content/pii:S0926860X22002101/STRIPIN/image/svg+xml/c74d0547da6b373a76276f5e44ff3767/si0008.svg si0008 si0008.svg svg 5381 ALTIMG 1-s2.0-S0926860X22002101-si0009.svg https://s3-eu-west-1.amazonaws.com/prod-ucs-content-store-eu-west/content/pii:S0926860X22002101/STRIPIN/image/svg+xml/024160b747c0e9a7d000a2762bf34539/si0009.svg si0009 si0009.svg svg 1661 ALTIMG 1-s2.0-S0926860X22002101-si0010.svg https://s3-eu-west-1.amazonaws.com/prod-ucs-content-store-eu-west/content/pii:S0926860X22002101/STRIPIN/image/svg+xml/163f842cd50b7183b086fa9daa279158/si0010.svg si0010 si0010.svg svg 2175 ALTIMG 1-s2.0-S0926860X22002101-si0011.svg https://s3-eu-west-1.amazonaws.com/prod-ucs-content-store-eu-west/content/pii:S0926860X22002101/STRIPIN/image/svg+xml/09c4039ae7a12e29c97fa96efe58a7fb/si0011.svg si0011 si0011.svg svg 1312 ALTIMG 1-s2.0-S0926860X22002101-si0012.svg https://s3-eu-west-1.amazonaws.com/prod-ucs-content-store-eu-west/content/pii:S0926860X22002101/STRIPIN/image/svg+xml/948c07b4581491441aa1753182800923/si0012.svg si0012 si0012.svg svg 7116 ALTIMG 1-s2.0-S0926860X22002101-si0013.svg https://s3-eu-west-1.amazonaws.com/prod-ucs-content-store-eu-west/content/pii:S0926860X22002101/STRIPIN/image/svg+xml/f72cac2a2ea18ad3b6e2bbde2b936973/si0013.svg si0013 si0013.svg svg 1158 ALTIMG 1-s2.0-S0926860X22002101-si0014.svg https://s3-eu-west-1.amazonaws.com/prod-ucs-content-store-eu-west/content/pii:S0926860X22002101/STRIPIN/image/svg+xml/981db4bf602c67cd79986b9d867cc167/si0014.svg si0014 si0014.svg svg 1215 ALTIMG 1-s2.0-S0926860X22002101-si0015.svg https://s3-eu-west-1.amazonaws.com/prod-ucs-content-store-eu-west/content/pii:S0926860X22002101/STRIPIN/image/svg+xml/4d14a88c6b810531b14518e11f3904ce/si0015.svg si0015 si0015.svg svg 1174 ALTIMG 1-s2.0-S0926860X22002101-si0016.svg https://s3-eu-west-1.amazonaws.com/prod-ucs-content-store-eu-west/content/pii:S0926860X22002101/STRIPIN/image/svg+xml/9aea8c79de81be4c46ab06728d465ecc/si0016.svg si0016 si0016.svg svg 1543 ALTIMG 1-s2.0-S0926860X22002101-si0017.svg https://s3-eu-west-1.amazonaws.com/prod-ucs-content-store-eu-west/content/pii:S0926860X22002101/STRIPIN/image/svg+xml/8e6b3e0224c767a41591a926fcef2b93/si0017.svg si0017 si0017.svg svg 2321 ALTIMG 1-s2.0-S0926860X22002101-si0018.svg https://s3-eu-west-1.amazonaws.com/prod-ucs-content-store-eu-west/content/pii:S0926860X22002101/STRIPIN/image/svg+xml/294aebb81e256d099dce264a9ac731cb/si0018.svg si0018 si0018.svg svg 6479 ALTIMG 1-s2.0-S0926860X22002101-si0019.svg https://s3-eu-west-1.amazonaws.com/prod-ucs-content-store-eu-west/content/pii:S0926860X22002101/STRIPIN/image/svg+xml/9204e35043fc644ec217c3387945ed12/si0019.svg si0019 si0019.svg svg 2252 ALTIMG 1-s2.0-S0926860X22002101-si0020.svg https://s3-eu-west-1.amazonaws.com/prod-ucs-content-store-eu-west/content/pii:S0926860X22002101/STRIPIN/image/svg+xml/a191b7d5696c27c7c05d5af2fd486a0f/si0020.svg si0020 si0020.svg svg 3622 ALTIMG 1-s2.0-S0926860X22002101-si0021.svg https://s3-eu-west-1.amazonaws.com/prod-ucs-content-store-eu-west/content/pii:S0926860X22002101/STRIPIN/image/svg+xml/ece02085bee97265d1bb2dac8d3dc64b/si0021.svg si0021 si0021.svg svg 4538 ALTIMG 1-s2.0-S0926860X22002101-si0022.svg https://s3-eu-west-1.amazonaws.com/prod-ucs-content-store-eu-west/content/pii:S0926860X22002101/STRIPIN/image/svg+xml/b0bf891e367560ac24bd364a1b41c4d9/si0022.svg si0022 si0022.svg svg 2848 ALTIMG 1-s2.0-S0926860X22002101-si0023.svg https://s3-eu-west-1.amazonaws.com/prod-ucs-content-store-eu-west/content/pii:S0926860X22002101/STRIPIN/image/svg+xml/6b154cd800315dd7e798ee6ce2ca058d/si0023.svg si0023 si0023.svg svg 7083 ALTIMG 1-s2.0-S0926860X22002101-si0024.svg https://s3-eu-west-1.amazonaws.com/prod-ucs-content-store-eu-west/content/pii:S0926860X22002101/STRIPIN/image/svg+xml/f0905f4860936c6f44e49e7ba41c7de7/si0024.svg si0024 si0024.svg svg 1365 ALTIMG 1-s2.0-S0926860X22002101-am.pdf am am.pdf pdf 455762 AAM-PDF https://s3-eu-west-1.amazonaws.com/prod-ucs-content-store-eu-west/content/egi:10QCSJC1073/MAIN/application/pdf/8386560866b29124dcc0cebf80eb5d94/am.pdf APCATA 118687 118687 S0926-860X(22)00210-1 10.1016/j.apcata.2022.118687 Elsevier B.V. Fig. 2 Evolution of surface coverages θ Ai for methane (red curve), oxygen (blue curve) and OH species (green) vs. methane partial pressure during the CH4/O2 reaction on pre-reduced Pd/La0.7MnO3 (bold line), on aged catalyst (- - - -) in the absence of steam and on pre-reduced catalyst in the presence of steam (….). Fig. 2 Fig. 1 Coverage dependency of enthalpy of adsorption for gaseous O2 ( Image 1 ) and methane ( Image 2 ) (b) surface oxygen and OH coverage dependency of activation barrier of step (3b) O coverage ( Image 3 ) and OH coverage ( Image 4 ). Fig. 1 Table 1 Heat of reaction and activation barrier calculated on Pd(111) at θ = 0 from the UBI-QEP method. Table 1 Reaction ΔH (kJ/mol) E f a (kJ/mol) O2 + 2* ⇆ 2O* -232 0 CH4 + * ⇆ CH4* -90 0 CH4* + * ⇆ CH3* + H* 88 97 CH3* + * ⇆ CH2* + H* 66 104 CH2* + * ⇆ CH* + H* 35 99 CH* + * ⇆ C* + H* -145 21 C* + O* ⇆ CO* + * -174 31 CO* ⇆ CO + * 134 -134 CO* + O* ⇆ CO2 + 2* -36 20 O* + H* ⇆ OH* + * 29 90 OH* + H* ⇆ H2O + 2* -114 0 2OH* ⇆ H2O + O* + * -144 144 CH4* + O* ⇆ CH3* + OH* 117 117 CH3* + O* ⇆ CH2* + OH* 95 102 CH2* + O* ⇆ CH* + OH* 64 93 CH* + O* ⇆ C* + OH* -116 42 a forward reaction. Table 2 Kinetic parameters for the CH4/O2 and CH4/O2/H2O reaction on Pd/La0.7MnO3 respectively in lean and near stoichiometric conditions. Table 2 Catalyst Thermal treatment p (CH4)/10−3 p (O2)/10−3 p (H2O)/10−3 T (°C) Preexponential Eapp Reaction order Specif. rate TOF Reference (atm) (atm) (atm) factor A (s−1) (kJ/mol) CH4 O2 H2O mol.s−1g−1 (s−1) 1 wt%Pd/La0.7MnO3 Pre-reduced/250 °C 0.75–3.0 50 – 400 6.2 × 1011 136.0 0.7 – – 4.5 × 10−8 0.015 This study 1 50 100 400 – – – – – 0.9 × 10−8 0.003 This study Aged a 0.75–3.0 50 – 400 6.4 × 108 97.9 0.8 – – 4.4 × 10−8 0.015 This study 1 50 100 400 – – – – – 2.1 × 10−8 0.007 This study Pre-reduced/250 °C 0.75–3.0 2.0–6.0 5.0–20.0 460 2.6 × 108 87.6 0.8 0.14 ∼ − 1.0 17.4 × 10−8 0.088 This study 0.86 wt% Pd/ZrO2 Calc./air, 500 °C 20 200 1–150 280 – – 1.1 0.1 -1.0 0.015 [5] 7.7 wt%Pd/Si-Al2O3 Calc./air, 500 °C 20 200 – 280 – 85 0.012 [4] Pd foil under reaction mixture/500 °C 0.2 200 0.0125 280 – 125 0.7 0.2 -0.9 0.59 [24] a in 10 vol% H2O with 5 vol% O2 at 750 °C. Table 3 Kinetic and thermodynamic constants optimized from a least square method at 400 °C on Pd/La0.7MnO3. Table 3 Operating conditions Thermal treatment T (reaction) (°C) k3c a k10 a k3b a KCH4 b KO b KH2O b 750–3000 ppm CH4, 5 vol% O2 Reduced c 400 (2.5 ± 0.3)× 10−6 (5.2 ± 0.6)× 10−2 17.2 ± 0.9 (5.0 ± 0.3)× 10−2 Aged d 400 (11.6 ± 0.2 ×10−6 (2.3 ± 0.6)× 10−2 5.7 ± 0.3 (8.0 ± 0.4)× 10−1 750–3000 ppm CH4, 2000–6000 ppm O2, 0.5–2.0 vol% H2O Reduced c 460 (1.0 ± 0.1)× 10−5 95 ± 5 132 ± 7 (5.0 ± 0.3)× 10−1 a mol.s−1.g−1 - b atm−1. c pre-reduction at 250 °C - d aging at 750 °C in 10 vol% H2O and 5 vol% O2. Combined theoretical and experimental kinetic approach for methane conversion on model supported Pd/La0.7MnO3 NGV catalyst: Sensitivity to inlet gas composition and consequence on the Pd-support interface Yuanshuang Zheng Investigation Validation a Amaury Decoster Formal analysis a Andrea Osti Investigation Validation a b Antonella Glisenti Supervision Conceptualization Methodology b c Jean-Philippe Dacquin Supervision Conceptualization Methodology a Fabien Dhainaut Formal analysis a Svetlana Heyte Methodology Resources a Pascal Granger Project administration Supervision Writing – original draft Writing – review & editing Visualization a ⁎ a Univ. Lille, CNRS, Centrale Lille, ENSCL, Univ. Artois, UMR 8181 - UCCS - Unité de Catalyse et Chimie du Solide, F-59000 Lille, France Univ. Lille, CNRS, Centrale Lille, ENSCL, Univ. Artois, UMR 8181 - UCCS - Unité de Catalyse et Chimie du Solide Lille F-59000 France Univ. Lille, CNRS, Centrale Lille, ENSCL, Univ. Artois, UMR 8181 - UCCS - Unité de Catalyse et Chimie du Solide, F-59000 Lille, France b Dept. of Chemical Sciences, University of Padova, Via F. Marzolo, 1, 35131 Padova, Italy Dept. of Chemical Sciences, University of Padova Via F. Marzolo, 1 Padova 35131 Italy Dept. of Chemical Sciences, University of Padova, Via F. Marzolo, 1, 35131, Padova, Italy c CNR-ICMATE, INSTM, Via F. Marzolo, 1, 35131 Padova, Italy CNR-ICMATE, INSTM Via F. Marzolo, 1 Padova 35131 Italy CNR-ICMATE, INSTM, Via F. Marzolo, 1, 35131, Padova, Italy ⁎ Corresponding author. New insights into reaction mechanism for catalytic methane combustion are provided in broad operating conditions on Pd/La0.7MnO3 as model natural gas vehicle catalyst. Under lean and dry conditions, a dual mechanism is suggested with active sites combining reactive oxygen species from La0.7MnO3 and palladium instead of single site reaction mechanism. Aging in wet atmosphere has no consequence on the kinetic behavior. On the other hand, in wet atmosphere near the stoichiometry, strong accumulation of hydroxyl groups on the support would suppress the metal-support interface. Accordingly, methane combustion would take place only on Pd particles. Graphical Abstract ga1 Keywords Methane combustion NGV three-way catalyst Palladium Perovskite Kinetics 1 Introduction At short term, the substitution of liquid fuels by natural gas powered engines is envisioned and complies with more stringent regulations on atmospheric pollutant emissions with lower NOx and nearly zero particulates emissions. However, more efficient three-way catalytic technologies are required to avoid unburnt methane emission recognized as potent greenhouse gas. One of the key issues lies in their weak efficacy near the stoichiometry or under slight rich exposure typically under three-way catalytic operating conditions. Up to now, the kinetics of catalytic methane combustion and the related models for predictions have been investigated essentially in lean conditions on benchmark supported palladium catalysts [1–5]. Numerical simulations near stoichiometric conditions from relevant microkinetic analysis are scarce [6,7]. A critical factor is the preservation of the dispersion of PdOx species recognized as the active sites [8,9]. At high temperature typically encountered in three-way operating conditions, the decomposition of PdOx into less active nanometric metallic Pd0 species cannot be strictly ruled out causing a loss of efficiency [8]. Presently, there is no clear consensus on the nature and architecture of active sites in typical three-way operating conditions. Miller and Malatpure [10] assumed a pair of sites composed of PdO and Pd0. New generations of three-way catalysts have arisen in the past two decades able for stabilizing the dispersion of precious metals in a broader temperature range under switching lean/rich exposure thanks to strong interactions with perovskite structures [11–13]. The development of such supported catalysts has also opened up debate over the consensus that PdOx is the active site of the reaction. For instance, Lu et al. [14] synthesized hexagonal Pd-YFeO3±δ structure by flame-spray-pyrolysis, with preferential formation of supported Pd0 and Pd2+ species instead of solid solution. They observed a strong rate enhancement in methane conversion after cycling up to 850 °C under reaction conditions assigned to the formation of metallic particles and the phase transition to orthorhombic YFeO3±δ . Besides, Gonzáles-Marcos et al. [15] also observed the coexistence of two kinetic regimes from light-off curves on Pd supported on Ce0.68Zr0.32O2 explained by the involvement of Pd(+I)-like species at low temperature while metallic Pd0 species would act as active sites at high temperature. Different kinetic regimes have been also identified on Pd/Al2O3-CeO2 assigned to the prevalence of the Pd-Ce or Pd-PdO interface accompanied with higher TOF values and lower activation barrier in the former case [16]. The nature of the active site-related reaction mechanisms is also disputed over the presence or the absence of water in the feed gas. Steam has currently a detrimental effect [17] by hindering oxygen mobility on the support and suppressing the oxygen exchange process at the metal-support interface [18]. In addition, water can originate deactivation because the large accumulation of water can weaken the strength of Pd nanoparticles on support material, and then become more sensitive to coalescence process, leading to changes in the particle size and morphology. This study reports a kinetic study of the catalytic CH4/O2 reaction in the presence and absence of steam on pre-reduced and aged Pd/La0.7MnO3 catalysts. Based on combined theoretical and experimental approaches, the different reaction mechanisms accounting for single and dual sites involving surface reactive oxygen species from the perovskite have been compared. It was found that the richness of the inlet gas composition in the presence and in the absence of steam has strong impact on the nature of active sites and related reaction mechanism. On the other hand, a good stability was found upon aging process. 2 Materials and methods Two reproducible batches have been prepared by using a classical citrate route for the preparation of La-deficient La0.7MnO3 perovskite support material. La-deficiency was found to improve oxygen storage properties [19,20]. Calcination in air led to the formation of the pure rhombohedral structure with no discernible bulk impurities due to single oxide segregation. 1 wt% palladium was incorporated through a classical wet impregnation by using palladium nitrate as precursor salt. The impregnated solid precursor was subsequently dried and calcined in air flow at 400 °C. Hydrogen titration was performed at 100 °C according to a pulse technique to measure the metal dispersion assuming H/Pd = 1. Prior chemisorption measurements, the samples were pre-reduced at 250 °C in hydrogen. For the two samples comparable Pd dispersions were obtained of 3.1% and 2.1%. Catalytic measurements were carried out on the REALCAT plaform in a Flowrence high-throughput unit supplied by Avantium. Flowrence unit is equipped with 16 parallel quartz fixed-bed microreactors (d=2 mm) and a sampling system composed of a 16-ports multi position valve that enables online gas phase analysis of the products of reaction of each reactor using an Agilent 7890 gas chromatograph. Each microreactor was filled with 30 mg catalyst with average grain size of 100 μm. Steady-state experiments were performed with inlet gas mixture composed of 750–3000 ppm CH4 with 5 vol% O2 in the presence or in the absence of 10 vol% H2O in the temperature range 350–600 °C. Two similar series were performed first on pre-reduced samples and on aged samples after exposure at 750 °C to a mixture composed of 5 vol% O2 and 10 vol% H2O. The second set of steady-state rate measurements were performed in the presence of steam with 750–3000 ppm CH4, 2000–6000 ppm O2 and 0.5–2 vol% H2O. Prior to catalytic measurements, the catalyst was pre-reduced in hydrogen at 250 °C to insure a quasi-complete reduction of PdO to metallic Pd species in agreement with H2-Temperature-programmed reduction experiments (not shown). We verified that this pre-reductive thermal treatment did not alter the structural features of the perovskite. As seen in Fig S1 in Supplementary Information (SI) the rhombohedral structure is conserved. Slight shift of reflections to lower 2θ values can be explained by the partial reduction of Mn4+ to Mn3+. For all experiments the space velocity was maintained constant at 60 L h−1 g−1. Calculation of the Weisz-Prater criterion, as detailed in SI, suggested that kinetic measurements were performed in chemical regime. 3 Results and discussion 3.1 Theoretical approach on model Pd(111) surface The unity bond index-quadratic exponential potential (UBI-QEP) is a theoretical method suited for straightforward calculations of heat and activation energies for elementary steps involved in a catalytic reaction according to a thermodynamic approach described in SI. This method can be considered as a generalization of the bond order conservation Morse potential method as described elsewhere [21]. Calculations of activation barrier E and enthalpy of reaction ΔH were performed on a closed-packed Pd(111) surface with preferred three-fold hollow sites. As explained in SI, only gas phase total bond energy D and atomic heat of chemisorption (Q) are needed [22]. Numerical values are listed in Table 1 and account for a typical accuracy of 5–15 kJ/mol. These values correspond to the zero-coverage limit when free sites are largely available, which is rarely the case when catalytic measurements are performed near atmospheric pressure. The heat of adsorptions for none activated adsorption processes, i.e. dissociative and molecular adsorption respectively for O2 and CH4, reveal a much higher exothermicity of oxygen adsorption reflecting a stronger adsorption. Subsequent surface reactions have been considered with two different scenarios for the dissociation of chemisorbed methane molecules involving a nearest-neighbor vacant Pd site or occupied by chemisorbed O atoms. Slightly lower activation barrier is obtained in the former case (97 kJ/mol vs. 117 kJ/mol) which emphasizes that chemisorbed O atom would not a priori favor the C-H bond breaking in CH4,ads molecules in these coverage conditions. Previous DFT calculations on PdO(101) surface [23] differ from these conclusions showing that hydrogen abstraction from methane would occur more readily over a Pdcus-Ocus site pair. As a matter of fact, such differences were expected as already pointed out by Zhu et al. [3] who found significant change of the activation energy on Pd metal and PdO for methane combustion suggesting different reaction mechanisms and we must also keep in mind the borderline case for θ = 0 which does not reflect the adsorbate composition in our operating conditions. The intermediate production of CO can be discussed near stoichiometric conditions when the surface is oxygen depleted because similarly to Oads and OHads, COads species could potentially act as inhibitor preventing methane dissociation. Let us note the low activation barrier for the following step: CO* + O* ⇆ CO2 + 2* which presumes a fast CO oxidation to CO2. Results near zero-coverage a priori suggest a detrimental effect of oxygen related to inhibiting effect. However, the adsorbate coverage dependency of the activation barrier assigned to the C-H bond breaking step must be envisioned. More representative energy data can be calculated using the UBI-QEP method upon addition of co-adsorbates resulting from the fact that the surface metal atoms interact with more than one adsorbate. The dependence of O- OH- and CH4-coverage on the adsorption enthalpy and activation barrier is illustrated in Fig. 1(a) and 1(b) respectively. The usual decrease in the heat of adsorption while increasing oxygen and methane coverage due to repulsive interactions is correctly predicted by the UBI-QEP method. This effect becomes significant when the adsorbed species occupied more than 40% adsorption sites with a sharp weakening effect of Pd-O adsorption bond. The effect of coverage adsorbate can be also quantified on the activation barrier. Particular attention has been paid to the following step CH4* + O* ⇆ CH3* + OH* (step 3b in mechanism I(b)) characterized by an activation barrier higher than step corresponding to C-H bond breaking on a nearest-neighbor vacant site at zero coverage. Chemisorbed O atom and OH groups appear as reactant and product respectively. Evolution of the activation with respect to θ O and θ OH is a key information. Some restrictions in the UBI-QEP method lie in the lack of possibility to consider the mutual interactions between adsorbed O and OH. Fig. 1(a) and (b) only take the repulsive interactions between the same adsorbate, i.e. Oads or OHads, into account. As seen, antagonistic evolutions appear as increasing O-coverage induces a lowering of the activation barrier for θ O above 0.4. This tendency emphasizes a clear assistance of oxygen in the C-H bond scission and seems to reconcile previous investigations which privileged a cooperative effect of Pd0 and PdO [10]. On the contrary, an increase of the activation barrier is observable with a rise of θ OH which clearly shows a detrimental effect. On the basis of these theoretical calculations the classical beneficial effect of nearest neighbor O atoms is restored at increasing coverage while he did not appear formally at nil coverage. 3.2 Kinetics and related reaction mechanism on Pd/La0.7MnO3 in lean conditions Kinetic parameters calculated on pre-reduced and aged catalysts in 750–3000 ppm CH4 and 5 vol% O2 at 400 °C are reported in Table 2. Their comparison with previous studies either on metallic or oxidic Pd surface did not reveal significant discrepancies [4,5,24]. Indeed, an increase of the activation energy on metallic surface is noticeable and the kinetics obeys to a positive reaction order with respect to methane. The lowering of TOF values in the presence of 10 vol% H2O is also consistent with a strong inhibiting effect of water on the reaction rate. Let us note that comparable specific rates and TOF values are measured on aged catalyst still in the absence of water. This observation does not show significant detrimental effect of the aging process in the presence of steam. As a matter of fact, previous investigations revealed that the alteration of the metal-support interaction may depend on the nature of the pretreatment and the richness of the reactant mixture with an alteration accentuated in reducing atmosphere by using perovskite as substrate [25,26]. In our case, XRD analysis (see Fig. S1 in SI) revealed that pre-reduction at moderate temperature, i.e. 250 °C, did not deteriorate the rhombohedral perovskite structure suggesting the preservation of the metal-support interface. In first approximation, two reaction mechanisms I(a) and I(b) have been examined based on the UBI-QEP method which account for metallic Pd sites stabilized on La0.7MnO3. Mechanism I(b) can be supported due to a combined effect related to a weaker oxygen inhibiting effect associated to a lowering of the heat of adsorption and a lowering of the activation energy of step (3b) at increasing O-coverage as expected in large excess of oxygen. Table Mechanism I(a) (1) O2(g) + 2✱ ⇆ 2O✱ (2) CH4(g) + ✱ ⇆ CH4✱ (3a) CH4✱ + ✱ → CH3✱ + H✱ (4a) CH3✱ + ✱ → CH2✱ + H✱(5a) CH2 ✱ + ✱ → CH✱ + H✱(6a) CH✱ + ✱ → C✱+ H✱(7) C✱ + O✱ → CO✱ + ✱(8) CO✱ + O✱ → CO2(g) + 2✱(9) 2OH✱ → H2O(g) + O✱ + 2✱ Mechanism II (1) O2(g) + 2✱ ⇆ 2 O✱ (2) CH4(g) + ✱ ⇆ CH4✱ (3c) CH4✱ + ‘O’ → CH3✱ + ‘OH’(4c) CH3✱ + ‘O’ → CH2✱ + ‘OH’(5c) CH2✱ + ‘O’ → CH✱ + ‘OH’(6c) CH✱ + ‘O’ → C✱+ ‘OH’(7) C✱ + O✱ → CO✱ + ✱(8) CO✱ + O✱ → CO2(g) + 2✱(10) 2 ‘OH’→ H2O(g) + ‘O’ Mechanism I(b) (1) O2(g) + 2✱ ⇆ 2 O✱ (2) CH4(g) + ✱ ⇆ CH4✱ (3b) CH4✱ + O✱ → CH3✱ + OH✱ (4b) CH3✱ + O✱ → CH2✱ + OH✱ (5b) CH2✱ + O✱ → CH✱ + OH✱ (6b) CH✱ + O✱ → C✱+ OH✱ (7) C✱ + O✱ → CO✱ + ✱(8) CO✱ + O✱ → CO2(g) + 2✱(9) 2OH✱ → H2O(g) + O✱ + 2✱ In fact, the aforementioned elementary steps closely mimic those already reported in the literature on PdO [13] even though the nature of oxygen can be questioned coming from dissociative adsorption into chemisorbed O species on PdO/Pd and/or surface oxygen lattice species. Mechanism I(a) and I(b) agree with a single site mechanism only composed of Pd atoms with competitive adsorptions of O2 and methane. The positive reaction order for CH4 concentration (see Table 2) accounts for the kinetic limiting effect of the first C-H bond dissociation [27]. Fujimoto et al. [5] also suggested that subsequent C-H bond breaking are kinetically insignificant. By assuming the first C-H bond breaking slow, then all the other steps would occur much faster and reversible adsorptions can be assumed quasi equilibrated leading to Eqs. (11) and (12) corresponding to surface coverages of adsorbed methane molecules and O atoms on Pd, i.e. θ CH 4 * and θ O * with θ v * corresponding to the fraction of vacant sites based on the hypothesis that Oads, and CH4,ads are the most abundant intermediates at the surface. (11) θ O * = K O P O 2 θ v * (12) θ CH 4 * = K CH 4 P CH 4 θ v * (13) with θ v * = 1 1 + K CH 4 P CH 4 + K O P O 2 The expression of the reaction rate in Eqs. (14) and (15) respectively for mechanism I(a) and I(b) can be easily derived in agreement with this set of assumptions. (14) r = k 3 a θ CH 4 * θ v * = k 3 a K CH 4 P CH 4 1 + K CH 4 P CH 4 + K O P O 2 2 (15) r = k 3 b θ CH 4 * θ O * = k 3 b K CH 4 P CH 4 K O P O 2 1 + K CH 4 P CH 4 + K O P O 2 2 The linear transformed of the reaction rate Eqs. (14) and (15) allow a graphical discrimination. In practice, the set of assumptions for their establishment is valid if the plots P CH 4 / r and P CH 4 P O 2 / r vs. P CH 4 is linear with a positive slope. As observed in Fig. S2 in SI, the plots reveal a poor agreement. On the basis of these observations, a dual site mechanism II has been examined as alternative which differs from Mechanisms I(a) and I(b) by the nature of reactive oxygen species. Indeed, they would no longer come from the direct gaseous O2 dissociative adsorption on metallic Pd sites but from surface lattice oxygen of the perovskite support at the Pd-La0.7MnO3 interface. Let us note that one cannot strictly rule out reactive oxygen species coming from PdO at the vicinity of Pd0 site even though it is accepted that oxidation of metallic Pd particle is a slow process [2]. The following Eq. (16) can be derived based on the mathematical development given in SI. (16) r = k 3 c θ CH 4 * θ O = k 3 c θ CH 4 * ( 2 k 10 + 4 k 3 c θ CH 4 * ) 2 k 10 1 ± 1 − 2 k 10 2 k 10 + 4 k 3 c θ CH 4 * 2 θ O stands for the fraction of surface lattice oxygen species coming from La0.7MnO3, kn stands for the rate constant for step (n), K A i and P A i are respectively the equilibrium constants and the partial pressures for the reactant A i . By assuming step (3c) as slow step, i.e. k 10 ≫ k 3 c , then 2 k 10 2 k 10 + 4 k 3 c θ CH 4 * ∼ 1 and the following simplified Eq. (17) can be obtained. (17) r = k 3 c K CH 4 P CH 4 ( 1 + K CH 4 P CH 4 + K o P O 2 ) 1 + 2 k 3 c K CH 4 P CH 4 k 10 ( 1 + K CH 4 P CH 4 + K o P O 2 ) Kinetic and thermodynamic constants have been estimated from a least square method through the minimization of the sum of the square differences between predicted and experimental reaction rates ∑ ( r exp . − r predic . ) 2 . Only Eq. (17) has been considered for the adjustment. The optimized values in Table 3 obtained on pre-reduced and aged catalyst in steam at 750 °C agree with mechanism II. They corroborate previous conclusions emphasizing the supply of reactive oxygen from the support [17,18]. The rate constant k3c for methane dissociation increases significantly on the aged catalyst which agrees with the decrease of the apparent activation energy from 136 kJ/mol to 97.9 kJ/mol on aged sample (Table 2). Such evolution could suggest a strengthening of the metal support interface after aging. This assumption is supported by comparable values for k10 which still indicate a fast restoration of ‘O’ reactive species. Such changes also coincide with an alteration of the adsorptive properties of palladium because adsorption competition on aged sample becomes more in favor of oxygen with sharp increase in O-coverage at the expense of methane coverage as illustrated in Fig. 2. Hence, statistically the probability to find adsorbed methane on Pd at the vicinity of reactive O species from perovskite would lessen. This inhibiting effect would exert a diluting effect and counterbalance the increase observed on the reaction rate constant k3c which could potentially explain unchanged specific reaction rate and TOF values on aged Pd/La0.7MnO3. Nevertheless, the most prominent information given by those data is related to the absence of significant deterioration of the Pd-support interface when the catalyst is exposed to 5 vol% O2 and 10 vol% H2O at 750 °C as mechanism II still prevails. 3.3 Kinetics and related reaction mechanism on Pd/La0.7MnO3 near the stoichiometry in the presence of steam The kinetics has been studied near stoichiometric conditions in the 0.5–2 vol% H2O with lower partial pressure of methane and O2 (see Table 2). Consequently, water adsorption must be considered according to the following step (18): (18) H2O + O✱ + ✱ ⇆ 2OH✱ By assuming this step quasi at equilibrium then the OH-coverage expression can be expressed according to Eq. (19): (19) θ OH * = K H 2 O P H 2 O K O P O 2 0.5 θ v * (20) with θ v * = 1 1 + K CH 4 P CH 4 + K O P O 2 + K H 2 O P H 2 O K O P O 2 0.5 Regarding the reaction rate Eqs. (14)–(16) their expressions only differ from the denominator which includes the following additional term K H 2 O P H 2 O K O P O 2 0.5 . By examining the reaction order, the positive value with respect to the partial pressure of oxygen seems to invalidate Eqs. (14) and (17) (see Fig. S3 in SI). As a matter of fact, the adjustment routine by using Eq. (17) converges to KO = 0 when the minimum is reached. The best fit is obtained with Eq. (21) with optimized values for the rate constant and equilibrium constant reported in Table 3. (21) r = k 3 b θ CH 4 * θ O * = k 3 b K CH 4 P CH 4 K O P O 2 1 + K CH 4 P CH 4 + K O P O 2 + K H 2 O P H 2 O K O P O 2 0.5 2 Hence, near the stoichiometry, in the presence of steam, mechanism I(b) would prevail at the expense of mechanism (II). This means that the Pd-La0.7MnO3 interface would be suppressed and only Pd active sites would run in these operating conditions. This could be explained by a strong OH group accumulation onto the support in the presence of steam in the inlet gas mixture blocking mobility and reactivity of surface oxygen lattice. Indeed, Shwartz et al. found on Pd-based catalyst that OH groups accumulation on the support hinders oxygen mobility and provokes deactivation [17,18]. Despite higher reaction temperature, the value for k3b seems to be abnormally low compared to that calculated in dry conditions at lower T. The opposite trend observed on the apparent activation energy would likely reflect change in the reaction mechanism. Based on the values of the equilibrium constants in Table 3, the calculation and comparison of adsorbate coverages in Fig. 2 reveal that θ OH * remains below the critical coverage value causing a decrease in the rate constant (Fig. 1(b)) and should not exert detrimental effect. The comparison of methane- and O- coverage seems consistent with the absence of oxygen inhibiting effect in agreement with the positive order with respect to oxygen and the prevalence of step (3b) for modeling the reaction rate. 4 Conclusion Steady-state reaction rate measurements for methane abatement were performed in lean and near stoichiometric conditions on Pd/La0.7MnO3 as model NGV catalyst. Two series were performed in the presence and in the absence of steam. Kinetic data were exploited taking into account reaction mechanisms suggested from a theoretical approach which accounts for the coverage dependency on reaction rate constants and heat of adsorptions more representative of catalyst surface composition in running conditions. In summary, the Pd-La0.7MnO3 interface would occur in the absence of steam and would be resistant in severe aging conditions, i.e. at 750 °C in 5 vol% O2 and 10 vol% H2O. However, in wet condition, the kinetics is strongly altered due to strong OH accumulation on the support. The deterioration of oxygen mobility and the suppression of Pd-support interface cause deactivation and restore a single site mechanism. These observations pause the question on the strategy to optimize the interface of nano-sized Pd particles with support materials exhibiting oxygen storage properties for methane conversion based on the detrimental effect of steam. In practice, the interferences with the other atmospheric pollutants must be also considered with potential detrimental effects on the reaction rate of methane conversion into CO2 due to their competitive adsorptions and induced inhibiting effects. The reliability of predictions of the overall efficiency of the NGV three-way catalysts also requires an overview taking into account the removal of NO and CO. The robustness of kinetic models is closely linked to their ability to correctly predict undesirable products when methane oxidation is incomplete. The combination of theoretical and experimental approaches, as illustrated in this paper, could be still powerful, especially to predict operating conditions and corresponding adsorbates coverages which would favor the formation of undesired products on the basis of reliable estimates of enthalpies and activation barriers. CRediT authorship contribution statement Yuanshang Zheng: Investigation, Validation; Amaury Decoster: Formal analysis; Andrea Osti: Investigation, Validation; Antonella Glisenti: Supervision, Conceptualization, Methodology,; Jean-Philippe Dacquin: Supervision, Conceptualization, Methodology,; Fabien Dhainaut: Conceptionalization, Formal analysis; Svtelana Heyte: Methodology, Resources; Pascal Granger: Project administration, Supervision, Writing original draft, Writing - Review & Editing Visualization. Declaration of Competing Interest The authors declare that they have no known competing financial interests or personal relationships that could have appeared to influence the work reported in this paper. Acknowledgments This work was financially supported by the French National Research Agency through the project ANR-18-CE07-0040. One of the co-authors (Y. Zheng) was able to benefit from a thesis grant within the framework of this program. The REALCAT platform was funded by the French National Research Agency (ANR-11-EQPX-0037) within the frame of the ‘Future Investments’ program (PIA). The Nord-Pas-de-Calais Region and the FEDER are acknowledged for their financial contribution to the equipment of the platform. Appendix A Supporting information Supplementary data associated with this article can be found in the online version at doi:10.1016/j.apcata.2022.118687. Appendix A Supplementary material Supplementary material . References [1] J. Au-Yeung K. Chen A.T. Bell E. Iglesia J. Catal. 188 1999 132 139 J. Au-Yeung, K. Chen, A.T. Bell, E. Iglesia, J. Catal. 188 (1999) 132–139. [2] H. Stotz L. Maier A. Boubnov A.T. Gremminger J.D. Grundwaldt O. Deutschmann J. Catal. 370 2019 152 175 H. Stotz, L. Maier, A. Boubnov, A.T. Gremminger, J.D. Grundwaldt, O. Deutschmann, J. Catal. 370 (2019) 152–175. [3] G. Zhu J. Han D.Y. Zemlyanov F.H. Ribeiro J. Phys. Chem. B 109 2005 2331 2337 G. Zhu, J. Han, D.Y. Zemlyanov, F.H. Ribeiro, J. Phys. Chem. B 109 (2005) 2331–2337. [4] F.H. Ribeiro M. Chow R.A. Dalla Betta J. Catal. 146 1994 537 544 F.H. Ribeiro, M. Chow, R.A. Dalla Betta, J. Catal. 146 (1994) 537–544. [5] K. Fujimoto F.H. Ribeiro M. Avalos-Borja E. Iglesis J. Catal. 179 1998 431 442 K. Fujimoto, F.H. Ribeiro, M. Avalos-Borja, E. Iglesis, J. Catal. 179 (1998) 431–442. [6] F. Zang K.L. Hohn Appl. Catal. B 182 2016 570 579 F. Zang, K.L. Hohn, Appl. Catal. B 182 (2016) 570–579. [7] J. Nilsson P.-A. Carlsson N.M. Martin E.C. Adams G. Agostini H. Grönbeck M. Skoglundh J. Catal. 356 2017 237 345 J. Nilsson, P.-A. Carlsson, N.M. Martin, E.C. Adams, G. Agostini, H. Grönbeck, M. Skoglundh, J. Catal. 356 (2017) 237–345. [8] M. Santosh Kumar A. Eyssler P. Hug N. van Vegten A. Baiker A. Weidenkaff D. Ferri Appl. Catal. B 94 2010 77 84 M. Santosh Kumar, A. Eyssler, P. Hug, N. van Vegten, A. Baiker, A. Weidenkaff, D. Ferri, Appl. Catal. B 94 (2010) 77–84. [9] A. Winkler P. Dimopoulos R. Hauert C. Bach M. Aguirre Appl. Catal. B 84 2008 162 169 A. Winkler, P. Dimopoulos, R. Hauert, C. Bach, M. Aguirre, Appl. Catal. B 84 (2008) 162–169. [10] J.B. Miller M. Malatpure Appl. Catal. A 495 2015 54 62 J.B. Miller, M. Malatpure, Appl. Catal. A 495 (2015) 54–62. [11] P. Granger Y. Renème A. Lahougue C. Hamon F. Dhainaut Top. Catal. 63 2020 1474 1484 P. Granger, Y. Renème, A. Lahougue, C. Hamon, F. Dhainaut, Top. Catal. 63 (2020) 1474–1484. [12] Y. Nishihata J. Mizuki T. Akao H. Tanaka M. Uenishi M. Kimura T. Okamoto N. Hamada Nature 418 2002 164 Y. Nishihata, J. Mizuki, T. Akao, H. Tanaka, M. Uenishi, M. Kimura, T. Okamoto, N. Hamada, Nature 418 (2002) 164. [13] M. Uenishi M. Tanigushi H. Tanaka M. Kimura Y. Nishihata J. Mizuki T. Kobayashi Appl. Catal. B 57 2005 267 273 M. Uenishi, M. Tanigushi, H. Tanaka, M. Kimura, Y. Nishihata, J. Mizuki, T.Kobayashi, Appl. Catal. B 57 (2005) 267–273. [14] Y. Lu K.A. Michalow M. Santosh Kumar A. Winkler A.E. Maegli S. Yoon A. Heel A. Weidenkaff D. Ferri Appl. Catal. B144 2014 631 643 Y. Lu, K.A. Michalow, M. Santosh Kumar, A. Winkler, A.E. Maegli, S. Yoon, A. Heel, A. Weidenkaff, D. Ferri, Appl. Catal. B144 (2014) 631–643. [15] P. Pilar Gonzáles-Marcos B. Pereda-Ayo A. Aranzabal J.A. González-Marcos Catal. Today 180 2021 88 95 P. Pilar Gonzáles-Marcos, B. Pereda-Ayo, A. Aranzabal, J.A. González-Marcos, Catal. Today 180 (2021) 88–95. [16] J. Chen Y. Wu W. Hu P. Qu G. Zhang P. Granger L. Zhong Y. Chen Appl. Catal. B 264 2020 118475 J. Chen, Y. Wu, W. Hu, P. Qu, G. Zhang, P. Granger, L. Zhong, Y. Chen, Appl. Catal. B 264 (2020) 118475. [17] W.R. Shwartz L.D. Pfefferle J. Phys. Chem. C 116 2012 8571 8578 W.R. Shwartz, L.D. Pfefferle, J. Phys. Chem C 116 (2012) 8571–8578. [18] W.R. Schwartz D. Ciuparu L.D. Pferfferle J. Phys. Chem. C 116 2012 W.R. Schwartz, D. Ciuparu, L.D. Pferfferle, J. Phys. Chem. C 116 (2012) 8597–8593. [19] J. Wu, J.-P. Dacquin, N. Djelal, C. Cordier, C. Dujardin, P. Granger, 282 (2021) 119621. [20] A. Schön J.-P. Dacquin P. Granger C. Dujardin Appl. Catal. B 223 2018 167 176 A. Schön, J.-P. Dacquin, P. Granger, C. Dujardin, Appl. Catal. B 223 (2018) 167–176 [21] E. Shustorovich H. Sellers Surf. Sci. Rep. 31 1998 1 119 E. Shustorovich, H. Sellers, Surf. Sci. Rep. 31 (1998) 1–119. [22] E. Shustorovich A.T. Bell Surf. Sci. 289 1993 127 138 E. Shustorovich, A.T. Bell, Surf. Sci. 289 (1993) 127–138. [23] H. Stotz L. Maier A. Boubnov A.T. Gremminger J.-D. Grundwald O. Deutschmann J. Catal. 370 2019 152 175 H. Stotz, L. Maier, A. Boubnov, A.T. Gremminger, J.-D. Grundwald, O. Deutschmann, J. Catal. 370 (2019) 152–175. [24] R.S. Monteiro D. Zemlyanov J.M. Storey F.H. Ribeiro J. Catal. 199 2001 291 301 R.S. Monteiro, D. Zemlyanov, J.M. Storey, F.H. Ribeiro, J. Catal. 199 (2001) 291–301. [25] Y. Wu C. Dujardin C. Lancelot J.P. Dacquin V. Parvulescu M. Cabié C.R. Henry T. Neisius P. Granger J. Catal. 328 2015 236 247 Y. Wu, C. Dujardin, C. Lancelot, J.P. Dacquin, V. Parvulescu, M. Cabié, C.R. Henry, T. Neisius, P. Granger, J. Catal. 328 (2015) 236–247. [26] J.P. Dacquin C. Lancelot C. Dujardin P. Granger J. Phys. Chem. C 115 2011 1911 1921 J.P. Dacquin, C. Lancelot, C. Dujardin, P. Granger, J. Phys. Chem. C 115 (2011) 1911–1921. [27] M. Van den Bossche H. Grönbeck J. Am. Chem. Soc. 137 2015 12035 12044 M. Van den Bossche, H. Grönbeck, J. Am. Chem. Soc. 2015, 137, 12035–12044.",
      "scopus-id": "85131141933",
      "coredata": {
        "eid": "1-s2.0-S0926860X22002101",
        "dc:description": "New insights into reaction mechanism for catalytic methane combustion are provided in broad operating conditions on Pd/La0.7MnO3 as model natural gas vehicle catalyst. Under lean and dry conditions, a dual mechanism is suggested with active sites combining reactive oxygen species from La0.7MnO3 and palladium instead of single site reaction mechanism. Aging in wet atmosphere has no consequence on the kinetic behavior. On the other hand, in wet atmosphere near the stoichiometry, strong accumulation of hydroxyl groups on the support would suppress the metal-support interface. Accordingly, methane combustion would take place only on Pd particles.",
        "openArchiveArticle": "false",
        "prism:coverDate": "2022-07-05",
        "openaccessUserLicense": null,
        "prism:aggregationType": "Journal",
        "prism:url": "https://api.elsevier.com/content/article/pii/S0926860X22002101",
        "dc:creator": [
          {
            "@_fa": "true",
            "$": "Zheng, Yuanshuang"
          },
          {
            "@_fa": "true",
            "$": "Decoster, Amaury"
          },
          {
            "@_fa": "true",
            "$": "Osti, Andrea"
          },
          {
            "@_fa": "true",
            "$": "Glisenti, Antonella"
          },
          {
            "@_fa": "true",
            "$": "Dacquin, Jean-Philippe"
          },
          {
            "@_fa": "true",
            "$": "Dhainaut, Fabien"
          },
          {
            "@_fa": "true",
            "$": "Heyte, Svetlana"
          },
          {
            "@_fa": "true",
            "$": "Granger, Pascal"
          }
        ],
        "link": [
          {
            "@_fa": "true",
            "@rel": "self",
            "@href": "https://api.elsevier.com/content/article/pii/S0926860X22002101"
          },
          {
            "@_fa": "true",
            "@rel": "scidir",
            "@href": "https://www.sciencedirect.com/science/article/pii/S0926860X22002101"
          }
        ],
        "dc:format": "application/json",
        "openaccessType": null,
        "pii": "S0926-860X(22)00210-1",
        "prism:volume": "641",
        "articleNumber": "118687",
        "prism:publisher": "Elsevier B.V.",
        "dc:title": "Combined theoretical and experimental kinetic approach for methane conversion on model supported Pd/La0.7MnO3 NGV catalyst: Sensitivity to inlet gas composition and consequence on the Pd-support interface",
        "prism:copyright": "© 2022 Elsevier B.V. All rights reserved.",
        "openaccess": "0",
        "prism:issn": "0926860X",
        "dcterms:subject": [
          {
            "@_fa": "true",
            "$": "Methane combustion"
          },
          {
            "@_fa": "true",
            "$": "NGV three-way catalyst"
          },
          {
            "@_fa": "true",
            "$": "Palladium"
          },
          {
            "@_fa": "true",
            "$": "Perovskite"
          },
          {
            "@_fa": "true",
            "$": "Kinetics"
          }
        ],
        "openaccessArticle": "false",
        "prism:publicationName": "Applied Catalysis A: General",
        "openaccessSponsorType": null,
        "prism:pageRange": "118687",
        "pubType": "fla",
        "prism:coverDisplayDate": "5 July 2022",
        "prism:doi": "10.1016/j.apcata.2022.118687",
        "prism:startingPage": "118687",
        "dc:identifier": "doi:10.1016/j.apcata.2022.118687",
        "openaccessSponsorName": null
      },
      "objects": {
        "object": [
          {
            "@category": "standard",
            "@height": "12",
            "@width": "12",
            "@_fa": "true",
            "$": "https://api.elsevier.com/content/object/eid/1-s2.0-S0926860X22002101-fx3.jpg?httpAccept=%2A%2F%2A",
            "@multimediatype": "JPEG image file",
            "@type": "IMAGE-DOWNSAMPLED",
            "@size": "531",
            "@ref": "fx3",
            "@mimetype": "image/jpeg"
          },
          {
            "@category": "standard",
            "@height": "12",
            "@width": "12",
            "@_fa": "true",
            "$": "https://api.elsevier.com/content/object/eid/1-s2.0-S0926860X22002101-fx2.jpg?httpAccept=%2A%2F%2A",
            "@multimediatype": "JPEG image file",
            "@type": "IMAGE-DOWNSAMPLED",
            "@size": "480",
            "@ref": "fx2",
            "@mimetype": "image/jpeg"
          },
          {
            "@category": "standard",
            "@height": "12",
            "@width": "14",
            "@_fa": "true",
            "$": "https://api.elsevier.com/content/object/eid/1-s2.0-S0926860X22002101-fx4.jpg?httpAccept=%2A%2F%2A",
            "@multimediatype": "JPEG image file",
            "@type": "IMAGE-DOWNSAMPLED",
            "@size": "496",
            "@ref": "fx4",
            "@mimetype": "image/jpeg"
          },
          {
            "@category": "standard",
            "@height": "10",
            "@width": "10",
            "@_fa": "true",
            "$": "https://api.elsevier.com/content/object/eid/1-s2.0-S0926860X22002101-fx1.jpg?httpAccept=%2A%2F%2A",
            "@multimediatype": "JPEG image file",
            "@type": "IMAGE-DOWNSAMPLED",
            "@size": "287",
            "@ref": "fx1",
            "@mimetype": "image/jpeg"
          },
          {
            "@category": "standard",
            "@height": "173",
            "@width": "282",
            "@_fa": "true",
            "$": "https://api.elsevier.com/content/object/eid/1-s2.0-S0926860X22002101-gr2.jpg?httpAccept=%2A%2F%2A",
            "@multimediatype": "JPEG image file",
            "@type": "IMAGE-DOWNSAMPLED",
            "@size": "14927",
            "@ref": "gr2",
            "@mimetype": "image/jpeg"
          },
          {
            "@category": "standard",
            "@height": "245",
            "@width": "251",
            "@_fa": "true",
            "$": "https://api.elsevier.com/content/object/eid/1-s2.0-S0926860X22002101-ga1.jpg?httpAccept=%2A%2F%2A",
            "@multimediatype": "JPEG image file",
            "@type": "IMAGE-DOWNSAMPLED",
            "@size": "12396",
            "@ref": "ga1",
            "@mimetype": "image/jpeg"
          },
          {
            "@category": "standard",
            "@height": "180",
            "@width": "565",
            "@_fa": "true",
            "$": "https://api.elsevier.com/content/object/eid/1-s2.0-S0926860X22002101-gr1.jpg?httpAccept=%2A%2F%2A",
            "@multimediatype": "JPEG image file",
            "@type": "IMAGE-DOWNSAMPLED",
            "@size": "20486",
            "@ref": "gr1",
            "@mimetype": "image/jpeg"
          },
          {
            "@category": "thumbnail",
            "@height": "57",
            "@width": "57",
            "@_fa": "true",
            "$": "https://api.elsevier.com/content/object/eid/1-s2.0-S0926860X22002101-fx3.sml?httpAccept=%2A%2F%2A",
            "@multimediatype": "GIF image file",
            "@type": "IMAGE-THUMBNAIL",
            "@size": "3100",
            "@ref": "fx3",
            "@mimetype": "image/gif"
          },
          {
            "@category": "thumbnail",
            "@height": "57",
            "@width": "57",
            "@_fa": "true",
            "$": "https://api.elsevier.com/content/object/eid/1-s2.0-S0926860X22002101-fx2.sml?httpAccept=%2A%2F%2A",
            "@multimediatype": "GIF image file",
            "@type": "IMAGE-THUMBNAIL",
            "@size": "1703",
            "@ref": "fx2",
            "@mimetype": "image/gif"
          },
          {
            "@category": "thumbnail",
            "@height": "55",
            "@width": "63",
            "@_fa": "true",
            "$": "https://api.elsevier.com/content/object/eid/1-s2.0-S0926860X22002101-fx4.sml?httpAccept=%2A%2F%2A",
            "@multimediatype": "GIF image file",
            "@type": "IMAGE-THUMBNAIL",
            "@size": "2652",
            "@ref": "fx4",
            "@mimetype": "image/gif"
          },
          {
            "@category": "thumbnail",
            "@height": "55",
            "@width": "55",
            "@_fa": "true",
            "$": "https://api.elsevier.com/content/object/eid/1-s2.0-S0926860X22002101-fx1.sml?httpAccept=%2A%2F%2A",
            "@multimediatype": "GIF image file",
            "@type": "IMAGE-THUMBNAIL",
            "@size": "111",
            "@ref": "fx1",
            "@mimetype": "image/gif"
          },
          {
            "@category": "thumbnail",
            "@height": "135",
            "@width": "219",
            "@_fa": "true",
            "$": "https://api.elsevier.com/content/object/eid/1-s2.0-S0926860X22002101-gr2.sml?httpAccept=%2A%2F%2A",
            "@multimediatype": "GIF image file",
            "@type": "IMAGE-THUMBNAIL",
            "@size": "6860",
            "@ref": "gr2",
            "@mimetype": "image/gif"
          },
          {
            "@category": "thumbnail",
            "@height": "164",
            "@width": "168",
            "@_fa": "true",
            "$": "https://api.elsevier.com/content/object/eid/1-s2.0-S0926860X22002101-ga1.sml?httpAccept=%2A%2F%2A",
            "@multimediatype": "GIF image file",
            "@type": "IMAGE-THUMBNAIL",
            "@size": "6728",
            "@ref": "ga1",
            "@mimetype": "image/gif"
          },
          {
            "@category": "thumbnail",
            "@height": "70",
            "@width": "219",
            "@_fa": "true",
            "$": "https://api.elsevier.com/content/object/eid/1-s2.0-S0926860X22002101-gr1.sml?httpAccept=%2A%2F%2A",
            "@multimediatype": "GIF image file",
            "@type": "IMAGE-THUMBNAIL",
            "@size": "3676",
            "@ref": "gr1",
            "@mimetype": "image/gif"
          },
          {
            "@category": "high",
            "@height": "57",
            "@width": "57",
            "@_fa": "true",
            "$": "https://api.elsevier.com/content/object/eid/1-s2.0-S0926860X22002101-fx3_lrg.jpg?httpAccept=%2A%2F%2A",
            "@multimediatype": "JPEG image file",
            "@type": "IMAGE-HIGH-RES",
            "@size": "1745",
            "@ref": "fx3",
            "@mimetype": "image/jpeg"
          },
          {
            "@category": "high",
            "@height": "57",
            "@width": "57",
            "@_fa": "true",
            "$": "https://api.elsevier.com/content/object/eid/1-s2.0-S0926860X22002101-fx2_lrg.jpg?httpAccept=%2A%2F%2A",
            "@multimediatype": "JPEG image file",
            "@type": "IMAGE-HIGH-RES",
            "@size": "1040",
            "@ref": "fx2",
            "@mimetype": "image/jpeg"
          },
          {
            "@category": "high",
            "@height": "55",
            "@width": "63",
            "@_fa": "true",
            "$": "https://api.elsevier.com/content/object/eid/1-s2.0-S0926860X22002101-fx4_lrg.jpg?httpAccept=%2A%2F%2A",
            "@multimediatype": "JPEG image file",
            "@type": "IMAGE-HIGH-RES",
            "@size": "1189",
            "@ref": "fx4",
            "@mimetype": "image/jpeg"
          },
          {
            "@category": "high",
            "@height": "55",
            "@width": "55",
            "@_fa": "true",
            "$": "https://api.elsevier.com/content/object/eid/1-s2.0-S0926860X22002101-fx1_lrg.jpg?httpAccept=%2A%2F%2A",
            "@multimediatype": "JPEG image file",
            "@type": "IMAGE-HIGH-RES",
            "@size": "320",
            "@ref": "fx1",
            "@mimetype": "image/jpeg"
          },
          {
            "@category": "high",
            "@height": "767",
            "@width": "1247",
            "@_fa": "true",
            "$": "https://api.elsevier.com/content/object/eid/1-s2.0-S0926860X22002101-gr2_lrg.jpg?httpAccept=%2A%2F%2A",
            "@multimediatype": "JPEG image file",
            "@type": "IMAGE-HIGH-RES",
            "@size": "89235",
            "@ref": "gr2",
            "@mimetype": "image/jpeg"
          },
          {
            "@category": "high",
            "@height": "1085",
            "@width": "1111",
            "@_fa": "true",
            "$": "https://api.elsevier.com/content/object/eid/1-s2.0-S0926860X22002101-ga1_lrg.jpg?httpAccept=%2A%2F%2A",
            "@multimediatype": "JPEG image file",
            "@type": "IMAGE-HIGH-RES",
            "@size": "84145",
            "@ref": "ga1",
            "@mimetype": "image/jpeg"
          },
          {
            "@category": "high",
            "@height": "794",
            "@width": "2495",
            "@_fa": "true",
            "$": "https://api.elsevier.com/content/object/eid/1-s2.0-S0926860X22002101-gr1_lrg.jpg?httpAccept=%2A%2F%2A",
            "@multimediatype": "JPEG image file",
            "@type": "IMAGE-HIGH-RES",
            "@size": "117181",
            "@ref": "gr1",
            "@mimetype": "image/jpeg"
          },
          {
            "@category": "standard",
            "@_fa": "true",
            "$": "https://api.elsevier.com/content/object/eid/1-s2.0-S0926860X22002101-mmc1.docx?httpAccept=%2A%2F%2A",
            "@multimediatype": "Microsoft Word file",
            "@type": "APPLICATION",
            "@size": "857212",
            "@ref": "mmc1",
            "@mimetype": "application/word"
          },
          {
            "@category": "thumbnail",
            "@_fa": "true",
            "$": "https://api.elsevier.com/content/object/eid/1-s2.0-S0926860X22002101-si0001.svg?httpAccept=%2A%2F%2A",
            "@multimediatype": "Scalable Vector Graphics file",
            "@type": "ALTIMG",
            "@size": "1430",
            "@ref": "si0001",
            "@mimetype": "image/svg+xml"
          },
          {
            "@category": "thumbnail",
            "@_fa": "true",
            "$": "https://api.elsevier.com/content/object/eid/1-s2.0-S0926860X22002101-si0002.svg?httpAccept=%2A%2F%2A",
            "@multimediatype": "Scalable Vector Graphics file",
            "@type": "ALTIMG",
            "@size": "1223",
            "@ref": "si0002",
            "@mimetype": "image/svg+xml"
          },
          {
            "@category": "thumbnail",
            "@_fa": "true",
            "$": "https://api.elsevier.com/content/object/eid/1-s2.0-S0926860X22002101-si0003.svg?httpAccept=%2A%2F%2A",
            "@multimediatype": "Scalable Vector Graphics file",
            "@type": "ALTIMG",
            "@size": "1235",
            "@ref": "si0003",
            "@mimetype": "image/svg+xml"
          },
          {
            "@category": "thumbnail",
            "@_fa": "true",
            "$": "https://api.elsevier.com/content/object/eid/1-s2.0-S0926860X22002101-si0004.svg?httpAccept=%2A%2F%2A",
            "@multimediatype": "Scalable Vector Graphics file",
            "@type": "ALTIMG",
            "@size": "2228",
            "@ref": "si0004",
            "@mimetype": "image/svg+xml"
          },
          {
            "@category": "thumbnail",
            "@_fa": "true",
            "$": "https://api.elsevier.com/content/object/eid/1-s2.0-S0926860X22002101-si0005.svg?httpAccept=%2A%2F%2A",
            "@multimediatype": "Scalable Vector Graphics file",
            "@type": "ALTIMG",
            "@size": "2419",
            "@ref": "si0005",
            "@mimetype": "image/svg+xml"
          },
          {
            "@category": "thumbnail",
            "@_fa": "true",
            "$": "https://api.elsevier.com/content/object/eid/1-s2.0-S0926860X22002101-si0006.svg?httpAccept=%2A%2F%2A",
            "@multimediatype": "Scalable Vector Graphics file",
            "@type": "ALTIMG",
            "@size": "3010",
            "@ref": "si0006",
            "@mimetype": "image/svg+xml"
          },
          {
            "@category": "thumbnail",
            "@_fa": "true",
            "$": "https://api.elsevier.com/content/object/eid/1-s2.0-S0926860X22002101-si0007.svg?httpAccept=%2A%2F%2A",
            "@multimediatype": "Scalable Vector Graphics file",
            "@type": "ALTIMG",
            "@size": "4846",
            "@ref": "si0007",
            "@mimetype": "image/svg+xml"
          },
          {
            "@category": "thumbnail",
            "@_fa": "true",
            "$": "https://api.elsevier.com/content/object/eid/1-s2.0-S0926860X22002101-si0008.svg?httpAccept=%2A%2F%2A",
            "@multimediatype": "Scalable Vector Graphics file",
            "@type": "ALTIMG",
            "@size": "5381",
            "@ref": "si0008",
            "@mimetype": "image/svg+xml"
          },
          {
            "@category": "thumbnail",
            "@_fa": "true",
            "$": "https://api.elsevier.com/content/object/eid/1-s2.0-S0926860X22002101-si0009.svg?httpAccept=%2A%2F%2A",
            "@multimediatype": "Scalable Vector Graphics file",
            "@type": "ALTIMG",
            "@size": "1661",
            "@ref": "si0009",
            "@mimetype": "image/svg+xml"
          },
          {
            "@category": "thumbnail",
            "@_fa": "true",
            "$": "https://api.elsevier.com/content/object/eid/1-s2.0-S0926860X22002101-si0010.svg?httpAccept=%2A%2F%2A",
            "@multimediatype": "Scalable Vector Graphics file",
            "@type": "ALTIMG",
            "@size": "2175",
            "@ref": "si0010",
            "@mimetype": "image/svg+xml"
          },
          {
            "@category": "thumbnail",
            "@_fa": "true",
            "$": "https://api.elsevier.com/content/object/eid/1-s2.0-S0926860X22002101-si0011.svg?httpAccept=%2A%2F%2A",
            "@multimediatype": "Scalable Vector Graphics file",
            "@type": "ALTIMG",
            "@size": "1312",
            "@ref": "si0011",
            "@mimetype": "image/svg+xml"
          },
          {
            "@category": "thumbnail",
            "@_fa": "true",
            "$": "https://api.elsevier.com/content/object/eid/1-s2.0-S0926860X22002101-si0012.svg?httpAccept=%2A%2F%2A",
            "@multimediatype": "Scalable Vector Graphics file",
            "@type": "ALTIMG",
            "@size": "7116",
            "@ref": "si0012",
            "@mimetype": "image/svg+xml"
          },
          {
            "@category": "thumbnail",
            "@_fa": "true",
            "$": "https://api.elsevier.com/content/object/eid/1-s2.0-S0926860X22002101-si0013.svg?httpAccept=%2A%2F%2A",
            "@multimediatype": "Scalable Vector Graphics file",
            "@type": "ALTIMG",
            "@size": "1158",
            "@ref": "si0013",
            "@mimetype": "image/svg+xml"
          },
          {
            "@category": "thumbnail",
            "@_fa": "true",
            "$": "https://api.elsevier.com/content/object/eid/1-s2.0-S0926860X22002101-si0014.svg?httpAccept=%2A%2F%2A",
            "@multimediatype": "Scalable Vector Graphics file",
            "@type": "ALTIMG",
            "@size": "1215",
            "@ref": "si0014",
            "@mimetype": "image/svg+xml"
          },
          {
            "@category": "thumbnail",
            "@_fa": "true",
            "$": "https://api.elsevier.com/content/object/eid/1-s2.0-S0926860X22002101-si0015.svg?httpAccept=%2A%2F%2A",
            "@multimediatype": "Scalable Vector Graphics file",
            "@type": "ALTIMG",
            "@size": "1174",
            "@ref": "si0015",
            "@mimetype": "image/svg+xml"
          },
          {
            "@category": "thumbnail",
            "@_fa": "true",
            "$": "https://api.elsevier.com/content/object/eid/1-s2.0-S0926860X22002101-si0016.svg?httpAccept=%2A%2F%2A",
            "@multimediatype": "Scalable Vector Graphics file",
            "@type": "ALTIMG",
            "@size": "1543",
            "@ref": "si0016",
            "@mimetype": "image/svg+xml"
          },
          {
            "@category": "thumbnail",
            "@_fa": "true",
            "$": "https://api.elsevier.com/content/object/eid/1-s2.0-S0926860X22002101-si0017.svg?httpAccept=%2A%2F%2A",
            "@multimediatype": "Scalable Vector Graphics file",
            "@type": "ALTIMG",
            "@size": "2321",
            "@ref": "si0017",
            "@mimetype": "image/svg+xml"
          },
          {
            "@category": "thumbnail",
            "@_fa": "true",
            "$": "https://api.elsevier.com/content/object/eid/1-s2.0-S0926860X22002101-si0018.svg?httpAccept=%2A%2F%2A",
            "@multimediatype": "Scalable Vector Graphics file",
            "@type": "ALTIMG",
            "@size": "6479",
            "@ref": "si0018",
            "@mimetype": "image/svg+xml"
          },
          {
            "@category": "thumbnail",
            "@_fa": "true",
            "$": "https://api.elsevier.com/content/object/eid/1-s2.0-S0926860X22002101-si0019.svg?httpAccept=%2A%2F%2A",
            "@multimediatype": "Scalable Vector Graphics file",
            "@type": "ALTIMG",
            "@size": "2252",
            "@ref": "si0019",
            "@mimetype": "image/svg+xml"
          },
          {
            "@category": "thumbnail",
            "@_fa": "true",
            "$": "https://api.elsevier.com/content/object/eid/1-s2.0-S0926860X22002101-si0020.svg?httpAccept=%2A%2F%2A",
            "@multimediatype": "Scalable Vector Graphics file",
            "@type": "ALTIMG",
            "@size": "3622",
            "@ref": "si0020",
            "@mimetype": "image/svg+xml"
          },
          {
            "@category": "thumbnail",
            "@_fa": "true",
            "$": "https://api.elsevier.com/content/object/eid/1-s2.0-S0926860X22002101-si0021.svg?httpAccept=%2A%2F%2A",
            "@multimediatype": "Scalable Vector Graphics file",
            "@type": "ALTIMG",
            "@size": "4538",
            "@ref": "si0021",
            "@mimetype": "image/svg+xml"
          },
          {
            "@category": "thumbnail",
            "@_fa": "true",
            "$": "https://api.elsevier.com/content/object/eid/1-s2.0-S0926860X22002101-si0022.svg?httpAccept=%2A%2F%2A",
            "@multimediatype": "Scalable Vector Graphics file",
            "@type": "ALTIMG",
            "@size": "2848",
            "@ref": "si0022",
            "@mimetype": "image/svg+xml"
          },
          {
            "@category": "thumbnail",
            "@_fa": "true",
            "$": "https://api.elsevier.com/content/object/eid/1-s2.0-S0926860X22002101-si0023.svg?httpAccept=%2A%2F%2A",
            "@multimediatype": "Scalable Vector Graphics file",
            "@type": "ALTIMG",
            "@size": "7083",
            "@ref": "si0023",
            "@mimetype": "image/svg+xml"
          },
          {
            "@category": "thumbnail",
            "@_fa": "true",
            "$": "https://api.elsevier.com/content/object/eid/1-s2.0-S0926860X22002101-si0024.svg?httpAccept=%2A%2F%2A",
            "@multimediatype": "Scalable Vector Graphics file",
            "@type": "ALTIMG",
            "@size": "1365",
            "@ref": "si0024",
            "@mimetype": "image/svg+xml"
          },
          {
            "@category": "standard",
            "@_fa": "true",
            "$": "https://api.elsevier.com/content/object/eid/1-s2.0-S0926860X22002101-am.pdf?httpAccept=%2A%2F%2A",
            "@multimediatype": "Acrobat PDF file",
            "@type": "AAM-PDF",
            "@size": "455762",
            "@ref": "am",
            "@mimetype": "application/pdf"
          }
        ]
      },
      "link": {
        "@rel": "abstract",
        "@href": "https://api.elsevier.com/content/abstract/scopus_id/85131141933"
      }
    }
  }
}