{
  "metadata": {
    "title": "Construction of hierarchical core-shell Pt/USY@MSA bifunctional catalysts for hydroisomerization of n-hexadecane",
    "authors": "; ; ",
    "journal": "Applied Catalysis A: General",
    "date": "2023-03-05",
    "doi": "10.1016/j.apcata.2022.119011",
    "abstract": "",
    "uri": "https://api.elsevier.com/content/article/pii/S0926860X22005348",
    "pii": "S0926860X22005348"
  },
  "fulltext": {
    "full-text-retrieval-response": {
      "scopus-eid": "2-s2.0-85147214137",
      "originalText": "serial JL 271346 291210 291744 291809 31 Applied Catalysis A: General APPLIEDCATALYSISAGENERAL 2022-12-22 2022-12-22 2023-01-27 2023-01-27 2023-02-13T08:53:12 1-s2.0-S0926860X22005348 S0926-860X(22)00534-8 S0926860X22005348 10.1016/j.apcata.2022.119011 S300 S300.1 FULL-TEXT 1-s2.0-S0926860X23X00040 2024-01-01T12:35:59.692098Z 0 0 20230305 2023 2022-12-22T16:17:03.320261Z absattachment articleinfo articlenumber articletitlenorm authfirstinitialnorm authfirstsurnamenorm cid cids contenttype copyright crossmark dateloaded dateloadedtxt datesearch datesort dateupdated dco docsubtype doctype doi eid ewtransactionid hubeid indexeddate issn issnnorm itemstage itemtransactionid itemweight openaccess openarchive pg pgfirst pii piinorm pubdatestart pubdatetxt pubyr sortorder srctitle srctitlenorm srctype ssids alllist content subj subheadings suppl tomb volfirst volissue volumelist webpdf webpdfpagecount yearnav figure table e-component body acknowledge affil appendices articletitle auth authfirstini authfull authkeywords authlast grantnumber grantsponsor grantsponsorid highlightsabst primabst ref specialabst 0926-860X 0926860X true 653 653 C Volume 653 3 119011 119011 119011 20230305 5 March 2023 2023-03-05 2023 article fla © 2023 Elsevier B.V. All rights reserved. CONSTRUCTIONHIERARCHICALCORESHELLPTUSYMSABIFUNCTIONALCATALYSTSFORHYDROISOMERIZATIONNHEXADECANE WANG B 1 Introduction 2 Experimental 2.1 Synthesis of USY@MSA composites 2.2 Preparation of catalysts 2.3 Characterization 2.4 Catalytic experiments 3 Results and discussion 3.1 Preparation and characterization of the USY@MSA composite 3.2 Hydroisomerization of n-hexadecane over different catalysts 4 Conclusions CRediT authorship contribution statement Acknowledgments Appendix A Supplementary material References VANDERWAL 2021 3842 3855 L VEDACHALAM 2021 121008 121019 S TAN 2021 117916 117935 Y YU 2020 622 630 G SREE 2021 1519 1525 S WANG 2020 117335 117345 X ZHAI 2022 135874 135892 M SUN 2021 2104442 21044479 Q POTTER 2020 9758 9789 M ZHANG 2022 10313 10325 M WEI 2022 122809 122825 C MAGHREBI 2021 111264 111283 R MARTENS 1991 95 116 J HARTMANN 2021 2001841 2001879 M TAO 2020 3455 3459 S MENG 2022 124589 124603 J WANG 2019 8495 9505 X WEI 2006 97 106 X CHEN 2020 11194 11294 L FERNANDEZ 2018 201 209 S WANG 2019 4162 4189 W MENDES 2020 260 270 P ZECEVIC 2015 245 248 J CHENG 2020 3592 3600 K MOUSSA 2018 6071 6078 O SAMAD 2016 203 212 J CHENG 2022 204 208 K WEISZ 1962 137 190 P BATALHA 2013 122 131 N WANG 2014 15535 15545 D ZHANG 2016 48 58 T GONG 2021 121131 121142 H MILINA 2014 3922 3932 M LIU 2022 118676 118683 X VU 2022 132763 132772 H PENG 2012 8 17 H NOZIK 2021 14489 14506 D FANG 2021 119942 119953 L LIU 2019 2812 2827 S VERBOEKEND 2013 1923 1934 D JI 2013 1892 1901 Y LI 1999 107 120 Y ZHENG 2022 138939 138947 D YANG 2021 727 736 Y CHEN 2022 279 286 Y WEI 2021 122809 122825 C WANGX2023X119011 WANGX2023X119011XB 2025-01-27T00:00:00.000Z 2025-01-27T00:00:00.000Z http://creativecommons.org/licenses/by-nc-nd/4.0/ © 2023 Elsevier B.V. All rights reserved. 2023-02-07T06:18:22.323Z http://vtw.elsevier.com/data/voc/AddOnTypes/50.7/aggregated-refined 0 https://doi.org/10.15223/policy-017 https://doi.org/10.15223/policy-037 https://doi.org/10.15223/policy-012 https://doi.org/10.15223/policy-029 https://doi.org/10.15223/policy-004 item S0926-860X(22)00534-8 S0926860X22005348 1-s2.0-S0926860X22005348 10.1016/j.apcata.2022.119011 271346 2024-01-01T12:35:59.692098Z 2023-03-05 1-s2.0-S0926860X22005348-main.pdf https://s3-eu-west-1.amazonaws.com/prod-ucs-content-store-eu-west/content/pii:S0926860X22005348/MAIN/application/pdf/a39c07826607beddd64c4510449efc95/main.pdf main.pdf pdf true 8716201 MAIN 10 1-s2.0-S0926860X22005348-main_1.png https://s3-eu-west-1.amazonaws.com/prod-ucs-content-store-eu-west/content/pii:S0926860X22005348/PREVIEW/image/png/3ca4e900410daad2510245d169d0a71b/main_1.png main_1.png png 58360 849 656 IMAGE-WEB-PDF 1 1-s2.0-S0926860X22005348-gr4.jpg https://s3-eu-west-1.amazonaws.com/prod-ucs-content-store-eu-west/content/pii:S0926860X22005348/gr4/DOWNSAMPLED/image/jpeg/da18a0e4b693d8b1b70034c195c8982d/gr4.jpg gr4 gr4.jpg jpg 193846 846 565 IMAGE-DOWNSAMPLED 1-s2.0-S0926860X22005348-gr3.jpg https://s3-eu-west-1.amazonaws.com/prod-ucs-content-store-eu-west/content/pii:S0926860X22005348/gr3/DOWNSAMPLED/image/jpeg/2a3c06f8619fa74f7a450e75d1314cd9/gr3.jpg gr3 gr3.jpg jpg 26983 141 555 IMAGE-DOWNSAMPLED 1-s2.0-S0926860X22005348-gr2.jpg https://s3-eu-west-1.amazonaws.com/prod-ucs-content-store-eu-west/content/pii:S0926860X22005348/gr2/DOWNSAMPLED/image/jpeg/827b200c6b14044ae3f4d0b3750d8127/gr2.jpg gr2 gr2.jpg jpg 124452 794 565 IMAGE-DOWNSAMPLED 1-s2.0-S0926860X22005348-gr11.jpg https://s3-eu-west-1.amazonaws.com/prod-ucs-content-store-eu-west/content/pii:S0926860X22005348/gr11/DOWNSAMPLED/image/jpeg/1d5fbda70dee4eaa9982d72af41cdf4e/gr11.jpg gr11 gr11.jpg jpg 29146 226 565 IMAGE-DOWNSAMPLED 1-s2.0-S0926860X22005348-gr1.jpg https://s3-eu-west-1.amazonaws.com/prod-ucs-content-store-eu-west/content/pii:S0926860X22005348/gr1/DOWNSAMPLED/image/jpeg/ea8265314ed8cf5c764b2dc91984ea56/gr1.jpg gr1 gr1.jpg jpg 23226 340 376 IMAGE-DOWNSAMPLED 1-s2.0-S0926860X22005348-gr10.jpg https://s3-eu-west-1.amazonaws.com/prod-ucs-content-store-eu-west/content/pii:S0926860X22005348/gr10/DOWNSAMPLED/image/jpeg/265ebd388e5557f9a0ccb567ccf4dbe2/gr10.jpg gr10 gr10.jpg jpg 53190 282 565 IMAGE-DOWNSAMPLED 1-s2.0-S0926860X22005348-gr8.jpg https://s3-eu-west-1.amazonaws.com/prod-ucs-content-store-eu-west/content/pii:S0926860X22005348/gr8/DOWNSAMPLED/image/jpeg/38a7f175e28d5238777653201d295056/gr8.jpg gr8 gr8.jpg jpg 20335 299 339 IMAGE-DOWNSAMPLED 1-s2.0-S0926860X22005348-gr7.jpg https://s3-eu-west-1.amazonaws.com/prod-ucs-content-store-eu-west/content/pii:S0926860X22005348/gr7/DOWNSAMPLED/image/jpeg/bf2717c934176888db9b54b5ba3819e8/gr7.jpg gr7 gr7.jpg jpg 39499 514 565 IMAGE-DOWNSAMPLED 1-s2.0-S0926860X22005348-gr6.jpg https://s3-eu-west-1.amazonaws.com/prod-ucs-content-store-eu-west/content/pii:S0926860X22005348/gr6/DOWNSAMPLED/image/jpeg/9c61a37670cf78e438960ba5053846e5/gr6.jpg gr6 gr6.jpg jpg 19000 306 339 IMAGE-DOWNSAMPLED 1-s2.0-S0926860X22005348-gr5.jpg https://s3-eu-west-1.amazonaws.com/prod-ucs-content-store-eu-west/content/pii:S0926860X22005348/gr5/DOWNSAMPLED/image/jpeg/3fa846591ea81cc2469efe5e68d2502f/gr5.jpg gr5 gr5.jpg jpg 42972 300 569 IMAGE-DOWNSAMPLED 1-s2.0-S0926860X22005348-gr9.jpg https://s3-eu-west-1.amazonaws.com/prod-ucs-content-store-eu-west/content/pii:S0926860X22005348/gr9/DOWNSAMPLED/image/jpeg/897240ad1593df57a21d38d4ad0d1fa5/gr9.jpg gr9 gr9.jpg jpg 36369 244 565 IMAGE-DOWNSAMPLED 1-s2.0-S0926860X22005348-ga1.jpg https://s3-eu-west-1.amazonaws.com/prod-ucs-content-store-eu-west/content/pii:S0926860X22005348/ga1/DOWNSAMPLED/image/jpeg/4e107cca195846b47d8a5f4403dbb207/ga1.jpg ga1 true ga1.jpg jpg 28255 200 485 IMAGE-DOWNSAMPLED 1-s2.0-S0926860X22005348-sc1.jpg https://s3-eu-west-1.amazonaws.com/prod-ucs-content-store-eu-west/content/pii:S0926860X22005348/sc1/DOWNSAMPLED/image/jpeg/47cf5e55f653d4c2a4595e8c13f5426e/sc1.jpg sc1 sc1.jpg jpg 34877 319 565 IMAGE-DOWNSAMPLED 1-s2.0-S0926860X22005348-gr4.sml https://s3-eu-west-1.amazonaws.com/prod-ucs-content-store-eu-west/content/pii:S0926860X22005348/gr4/THUMBNAIL/image/gif/7cb2d7ffcd4c58d4952925226e5e760d/gr4.sml gr4 gr4.sml sml 11459 163 109 IMAGE-THUMBNAIL 1-s2.0-S0926860X22005348-gr3.sml https://s3-eu-west-1.amazonaws.com/prod-ucs-content-store-eu-west/content/pii:S0926860X22005348/gr3/THUMBNAIL/image/gif/e0b527ca3c620959848907e427f760fe/gr3.sml gr3 gr3.sml sml 5856 56 219 IMAGE-THUMBNAIL 1-s2.0-S0926860X22005348-gr2.sml https://s3-eu-west-1.amazonaws.com/prod-ucs-content-store-eu-west/content/pii:S0926860X22005348/gr2/THUMBNAIL/image/gif/9addc79f66cc0ef9f74cb14d0d58c8be/gr2.sml gr2 gr2.sml sml 13879 163 116 IMAGE-THUMBNAIL 1-s2.0-S0926860X22005348-gr11.sml https://s3-eu-west-1.amazonaws.com/prod-ucs-content-store-eu-west/content/pii:S0926860X22005348/gr11/THUMBNAIL/image/gif/22c9c170b2b14af0c252da5879d431a8/gr11.sml gr11 gr11.sml sml 5069 87 219 IMAGE-THUMBNAIL 1-s2.0-S0926860X22005348-gr1.sml https://s3-eu-west-1.amazonaws.com/prod-ucs-content-store-eu-west/content/pii:S0926860X22005348/gr1/THUMBNAIL/image/gif/8d8db8da362bcd4ece3b08969370f369/gr1.sml gr1 gr1.sml sml 5998 164 181 IMAGE-THUMBNAIL 1-s2.0-S0926860X22005348-gr10.sml https://s3-eu-west-1.amazonaws.com/prod-ucs-content-store-eu-west/content/pii:S0926860X22005348/gr10/THUMBNAIL/image/gif/b709f75d9fc0207dda9fb2d2adf7490c/gr10.sml gr10 gr10.sml sml 14023 109 219 IMAGE-THUMBNAIL 1-s2.0-S0926860X22005348-gr8.sml https://s3-eu-west-1.amazonaws.com/prod-ucs-content-store-eu-west/content/pii:S0926860X22005348/gr8/THUMBNAIL/image/gif/c90b2da1881b11c756e8353f74977c2e/gr8.sml gr8 gr8.sml sml 6135 164 186 IMAGE-THUMBNAIL 1-s2.0-S0926860X22005348-gr7.sml https://s3-eu-west-1.amazonaws.com/prod-ucs-content-store-eu-west/content/pii:S0926860X22005348/gr7/THUMBNAIL/image/gif/6ff25a462d744ca861b3ac870d848149/gr7.sml gr7 gr7.sml sml 5067 164 180 IMAGE-THUMBNAIL 1-s2.0-S0926860X22005348-gr6.sml https://s3-eu-west-1.amazonaws.com/prod-ucs-content-store-eu-west/content/pii:S0926860X22005348/gr6/THUMBNAIL/image/gif/263c2d2659015c56b81489cec70afec6/gr6.sml gr6 gr6.sml sml 5139 164 181 IMAGE-THUMBNAIL 1-s2.0-S0926860X22005348-gr5.sml https://s3-eu-west-1.amazonaws.com/prod-ucs-content-store-eu-west/content/pii:S0926860X22005348/gr5/THUMBNAIL/image/gif/9e568974b3dee292354457603f5b5007/gr5.sml gr5 gr5.sml sml 7275 115 219 IMAGE-THUMBNAIL 1-s2.0-S0926860X22005348-gr9.sml https://s3-eu-west-1.amazonaws.com/prod-ucs-content-store-eu-west/content/pii:S0926860X22005348/gr9/THUMBNAIL/image/gif/fb7ce357b065ae7fb8edb5cf55e43dfc/gr9.sml gr9 gr9.sml sml 5789 95 219 IMAGE-THUMBNAIL 1-s2.0-S0926860X22005348-ga1.sml https://s3-eu-west-1.amazonaws.com/prod-ucs-content-store-eu-west/content/pii:S0926860X22005348/ga1/THUMBNAIL/image/gif/e18a216a8dc04034e41e38cee9ecd691/ga1.sml ga1 true ga1.sml sml 7583 90 219 IMAGE-THUMBNAIL 1-s2.0-S0926860X22005348-sc1.sml https://s3-eu-west-1.amazonaws.com/prod-ucs-content-store-eu-west/content/pii:S0926860X22005348/sc1/THUMBNAIL/image/gif/5d2c34e279dbf9989c515ba488482dd1/sc1.sml sc1 sc1.sml sml 5967 124 219 IMAGE-THUMBNAIL 1-s2.0-S0926860X22005348-gr4_lrg.jpg https://s3-eu-west-1.amazonaws.com/prod-ucs-content-store-eu-west/content/pii:S0926860X22005348/HIGHRES/image/jpeg/3a7ebbd9adab90884e85755886a62268/gr4_lrg.jpg gr4 gr4_lrg.jpg jpg 1437458 3735 2495 IMAGE-HIGH-RES 1-s2.0-S0926860X22005348-gr3_lrg.jpg https://s3-eu-west-1.amazonaws.com/prod-ucs-content-store-eu-west/content/pii:S0926860X22005348/HIGHRES/image/jpeg/049241a9ba536ba2842640549384a989/gr3_lrg.jpg gr3 gr3_lrg.jpg jpg 156424 626 2459 IMAGE-HIGH-RES 1-s2.0-S0926860X22005348-gr2_lrg.jpg https://s3-eu-west-1.amazonaws.com/prod-ucs-content-store-eu-west/content/pii:S0926860X22005348/HIGHRES/image/jpeg/f31fd7e63c11a1f3fc6468e951b5971d/gr2_lrg.jpg gr2 gr2_lrg.jpg jpg 832747 3506 2495 IMAGE-HIGH-RES 1-s2.0-S0926860X22005348-gr11_lrg.jpg https://s3-eu-west-1.amazonaws.com/prod-ucs-content-store-eu-west/content/pii:S0926860X22005348/HIGHRES/image/jpeg/bd7688016fdd2bb0651dc567473fc94f/gr11_lrg.jpg gr11 gr11_lrg.jpg jpg 177968 996 2495 IMAGE-HIGH-RES 1-s2.0-S0926860X22005348-gr1_lrg.jpg https://s3-eu-west-1.amazonaws.com/prod-ucs-content-store-eu-west/content/pii:S0926860X22005348/HIGHRES/image/jpeg/09f27b7b95df6760fc5c8e6c2d802787/gr1_lrg.jpg gr1 gr1_lrg.jpg jpg 149203 1505 1663 IMAGE-HIGH-RES 1-s2.0-S0926860X22005348-gr10_lrg.jpg https://s3-eu-west-1.amazonaws.com/prod-ucs-content-store-eu-west/content/pii:S0926860X22005348/HIGHRES/image/jpeg/89e98b46e8c148aac12a34c69ebcc484/gr10_lrg.jpg gr10 gr10_lrg.jpg jpg 372078 1246 2495 IMAGE-HIGH-RES 1-s2.0-S0926860X22005348-gr8_lrg.jpg https://s3-eu-west-1.amazonaws.com/prod-ucs-content-store-eu-west/content/pii:S0926860X22005348/HIGHRES/image/jpeg/fd038131f494c0586ec87c97c90b9233/gr8_lrg.jpg gr8 gr8_lrg.jpg jpg 128319 1320 1497 IMAGE-HIGH-RES 1-s2.0-S0926860X22005348-gr7_lrg.jpg https://s3-eu-west-1.amazonaws.com/prod-ucs-content-store-eu-west/content/pii:S0926860X22005348/HIGHRES/image/jpeg/5414a49945c5d93b6bd869206998164d/gr7_lrg.jpg gr7 gr7_lrg.jpg jpg 254176 2269 2495 IMAGE-HIGH-RES 1-s2.0-S0926860X22005348-gr6_lrg.jpg https://s3-eu-west-1.amazonaws.com/prod-ucs-content-store-eu-west/content/pii:S0926860X22005348/HIGHRES/image/jpeg/db6697fb61c815ab3f280df7b77768f9/gr6_lrg.jpg gr6 gr6_lrg.jpg jpg 110812 1353 1497 IMAGE-HIGH-RES 1-s2.0-S0926860X22005348-gr5_lrg.jpg https://s3-eu-west-1.amazonaws.com/prod-ucs-content-store-eu-west/content/pii:S0926860X22005348/HIGHRES/image/jpeg/b52b826f84307c815b8d991a59ab7eea/gr5_lrg.jpg gr5 gr5_lrg.jpg jpg 267024 1330 2522 IMAGE-HIGH-RES 1-s2.0-S0926860X22005348-gr9_lrg.jpg https://s3-eu-west-1.amazonaws.com/prod-ucs-content-store-eu-west/content/pii:S0926860X22005348/HIGHRES/image/jpeg/3e63a393a69dee7d66d0d135b973cfc0/gr9_lrg.jpg gr9 gr9_lrg.jpg jpg 219590 1077 2495 IMAGE-HIGH-RES 1-s2.0-S0926860X22005348-ga1_lrg.jpg https://s3-eu-west-1.amazonaws.com/prod-ucs-content-store-eu-west/content/pii:S0926860X22005348/HIGHRES/image/jpeg/e20ec5a7a27c705bc438654fbf692c3b/ga1_lrg.jpg ga1 true ga1_lrg.jpg jpg 194232 886 2150 IMAGE-HIGH-RES 1-s2.0-S0926860X22005348-sc1_lrg.jpg https://s3-eu-west-1.amazonaws.com/prod-ucs-content-store-eu-west/content/pii:S0926860X22005348/HIGHRES/image/jpeg/ac6e1f130dc61028fa242811f270a2cf/sc1_lrg.jpg sc1 sc1_lrg.jpg jpg 203530 1410 2495 IMAGE-HIGH-RES 1-s2.0-S0926860X22005348-mmc1.doc https://s3-eu-west-1.amazonaws.com/prod-ucs-content-store-eu-west/content/pii:S0926860X22005348/mmc1/MAIN/application/msword/42c2058f7d4d58c35915d256a74b303e/mmc1.doc mmc1 mmc1.doc doc 2892800 APPLICATION 1-s2.0-S0926860X22005348-am.pdf https://s3-eu-west-1.amazonaws.com/prod-ucs-content-store-eu-west/content/egi:104R85N3JG4/MAIN/application/pdf/34ff8e8911c5361908456e744cbd98cb/am.pdf am am.pdf pdf false 2533782 AAM-PDF APCATA 119011 119011 S0926-860X(22)00534-8 10.1016/j.apcata.2022.119011 Elsevier B.V. Fig. 1 (A) XRD patterns of pristine USY (a), USY-ds (b), and USY@MSA samples(c). Fig. 1 Fig. 2 SEM images of pristine USY (a)，USY-ds (b), and USY@MSA samples at pH value of 1.7 (c), 2.5 (d), 3.5 (e), 4.7 (f), 5.7 (g), 6.2 (h). Fig. 2 Fig. 3 The possible formation process of USY@MSA sample. Fig. 3 Fig. 4 TEM images of pristine USY (a, b), USY-ds (c, d), and USY@MSA samples (e, f). Fig. 4 Fig. 5 N2 adsorption isothermals (A) and BJH pore size distribution (B) of pristine USY (a), USY-ds (b) and USY@MSA sample (c). Fig. 5 Fig. 6 27Al MAS NMR spectra of pristine USY (a), USY-ds (b) and USY@MSA sample (c). Fig. 6 Fig. 7 29Si MAS NMR spectra of pristine USY (a), USY-ds (b) and USY@MSA sample (c). Fig. 7 Fig. 8 FT-IR spectra in hydroxyl stretching region of pristine USY (a), USY-ds (b) and USY@MSA sample (c). Fig. 8 Fig. 9 NH3-TPD profiles and pyridine-adsorbed FT-IR spectra of pristine USY (a), USY-ds (b) and USY@MSA sample (c). Fig. 9 Fig. 10 TEM images of Pt/USY@MSA sample. Fig. 10 Fig. 11 Curves of n-C16 conversion versus reaction temperature (A) and i-C16 yields versus n-C16 conversion (B) over Pt/USY (a), Pt/USY-ds (b) and Pt/USY@MSA samples (c). Fig. 11 Scheme 1 Possible reaction pathway of n-alkane hydroisomerization over bifunctional catalysts. Scheme 1 Table 1 Textural properties of pristine USY, alkaline-treated and self-assembled sample. Table 1 Samples SBET a (m2g−1) Sext b (m2g−1) Vtot c (cm3g−1) Vmicro b (cm3g−1) Vmeso d (cm3g−1) USY 752 139 0.54 0.24 0.30 USY-ds 803 396 0.79 0.21 0.58 USY@MSA 799 377 0.71 0.17 0.54 a Specific surface area (SSA) obtained from N2 adsorption isotherm at 77 K using BET method. b Obtained by t-plot method. c Given by the adsorption capacity at relative pressure P/P0 = 0.99. d Vmeso = Vtot - Vmicro. Construction of hierarchical core-shell Pt/USY@MSA bifunctional catalysts for hydroisomerization of n-hexadecane Bo Wang Methodology Investigation Project administration Writing – original draft Jinsheng Zhao Project administration Supervision ⁎ Hongxi Pan Formal analysis Yunyun Dong Investigation Xiaolei Li Investigation Shuo Tao Conceptualization Supervision Project administration Writing – review & editing Funding acquisition ⁎ School of Chemistry and Chemical Engineering, Shandong Provincial Key Laboratory of Chemical Energy Storage and Novel Cell Technology, Liaocheng University, Liaocheng, Shandong 252059, China School of Chemistry and Chemical Engineering, Shandong Provincial Key Laboratory of Chemical Energy Storage and Novel Cell Technology, Liaocheng University Liaocheng Shandong 252059 China School of Chemistry and Chemical Engineering, Shandong Provincial Key Laboratory of Chemical Energy Storage and Novel Cell Technology, Liaocheng University, Liaocheng, Shandong 252059, China ⁎ Corresponding authors. Hydroisomerization of long-chain n-alkanes is an indispensable process in the upgrading of fuel oil and lubricants to meet the state of art regulations. In this work, a novel core-shell structural material comprising USY zeolite core and mesoporous aluminosilicate (MSA) shell, denoted as USY@MSA, was fabricated by virtue of a desilication and recrystallization approach. Comprehensive characterizations demonstrate that the USY@MSA composite exhibits a hierarchical pore architecture and a gradient acidity. Due to the confinement effect of the mesoporous aluminosilicate shell, highly dispersed platinum particles were selectively deposited on the shell, generating a nanoscale distance with acidic sites of USY zeolite core. In the hydroisomerization of n-hexadecane, the Pt/USY@MSA composite catalyst outperforms the conventional Pt/USY and desilicated Pt/USY-ds catalysts, effectively suppressing the cracking side reactions and producing higher selectivity to branched isomers. Graphical Abstract ga1 Keywords Core-shell Hierarchical Nanoscale distance Hydroisomerization Data availability Data will be made available on request. 1 Introduction With the rising stringent environmental regulations, it is urgent to improve the quality of transportation oil to meet the environment and energy requirements. Typically, as an effective process for refining and upgrading of hydrocarbons, hydroisomerization of long-chain alkanes is widely employed in petroleum industry, Fischer-Tropsch reaction and vegetable oil transformation [1,2]. Compared to long-chain n-paraffins, the isomerized branched paraffins exhibits more favorable low-temperature properties, i.e. lower pour point and higher viscosity index [3,4]. However, owing to the similar activation energy, hydroisomerization of long-chain alkanes is always accompanied with cracking side reaction, and in consequence leads to poor isomer yields [5]. Accordingly, it is still facing a challenge to suppress cracking reactions and improve selectivity of branched molecules. Generally, the hydroisomerization of n-alkanes takes place over bifunctional catalyst containing both metal sites and acid sites. The formation of carbonium ions and skeletal rearrangement mainly occurs over acidic supports, such as amorphous oxide, zeolites and mesoporous materials [6,7]. As known to all, zeolites with unique shape-selectivity and adjustable acidity are the potential candidates as acidic supports for industrial application [8,9]. According to the well-acknowledged pore-mouth model and key-lock mechanism [10], one-dimensional 10-membered ring zeolites (i.e. ZSM-22, ZSM-48, ZSM-23, SAPO-11, SAPO-31) possess the similar pore size with the linear chain alkanes, and they are supposed to be the most promising acidic carriers in the hydroisomerization of alkanes [11]. By contrast, zeolites with larger pore size (such as Y and Beta) have shown inferior tendency towards branched molecules due to the cracking side reaction [12,13]. However, with respect to the long-chain alkanes, the confined spatial effect generated by the narrow one-dimensional 10-membered ring channel impose significant diffusion limitation and promote the cleavage of C-C bond. In this regard, multiple studies associated with the design of zeolites with hierarchical architecture were reported [14–18]. Particularly, alkaline-assisted post-treatment strategy was the most extensively studied to create mesopores into zeolites chanel [14]. Microporous and mesoporous structural SAPO-11 [15], ZSM-48 [16], ZSM-22 [17], and ZSM-12 [18] zeolites were constructed successively. It demonstrates that the hierarchical pore structure not only shortens diffusion path exhibiting excellent diffusivity, but also adjusts the accessibility of acidity. Hence the hierarchical architecture significantly enhances the branched isomer selectivity during long-chain alkane isomerization [19,20]. For the other hand, the metal components mainly catalyze the dehydrogenation of n-alkanes to the corresponding n-alkenes and the hydrogenation of i-alkenes to i-alkanes [21]. Platinum (Pt) specie has been the most widely used metal active site. Recent studies have found the mutual intimacy of Pt active site and acid sites is critical for gaining well balance between the two active sites and generating vital influence on isomerization performance [22]. Noteworthy is the results reported by de Jong’s group, which investigated the isomerization performance over the Pt-A/Y and Pt-Y/A bifunctional catalysts. The former is prepared by supporting Pt selectively on γ-alumina binder generating the nano-scaled intimacy, while the latter was prepared by supporting Pt selectively on Y zeolite forming the closet intimacy. Higher isomerization selectivity and lower cracking selectivity were obtained over Pt-A/Y catalyst [23,24]. In contrast, the alkene intermediates formed on metal sites have to diffuse across the Y zeolite channel over Pt-Y/A catalyst, which significantly increased the probability of cracking. Afterwards, Moussa and Samad et al. came to the similar conclusion that supporting Pt catalyst with nanometer scale intimacy contributes to the dominated branched isomers compared with the spatial arrangement of proximity or micrometric scale [25,26]. Most recently, K. Cheng et al. found the less platinum amount and higher isomer yield could be obtained when Pt particles selectively supported on the out surface of zeolite or alumina binder due to the well balance between two active sites [27]. These findings basically reveled that a nanoscale distance between the acid and metal sites was beneficial for isomerization reactions, which were in sharp contrast to the previous acknowledgment of “the close the better” principle proposed by Weisz and Batalha et al. [28,29]. Accordingly, in order to fabricate the outperformed bifunctional catalyst, the main challenge lies in how to organize the acidic carriers and metal components rationally to maximum the synergistic effect without disturbing the diffusion of reactant molecules. The construction of core-shell structural zeolites is an efficient route to control the location of supported metal particles. For example, hierarchical core-shell mesoporous aluminosilicate-coated zeolites (ZSM-5, SSZ-13, Beta) have been fabricated to selectively deposit metal on the mesoporous shell [30–32]. Herein, we fabricated a Pt-supported hierarchical core-shell catalyst via a controlled desilication and recrystallization route, through which the dissolved species were further utilized during the post-treatment process and formed the mesoporous shell coating on USY zeolites. For one hand, this material featured hierarchical pore structure and gradient acidity, facilitating the diffusion of reactants and products. For the other hand, the supported Pt particles were highly dispersed and selectively deposited on the mesoporous shell, keeping in nanoscale distance with acidic sites within USY zeolite. The combined effect may contribute to the superior branched isomers yield during the n-C16 hydroisomerization. 2 Experimental 2.1 Synthesis of USY@MSA composites Pristine USY zeolite was purchased from Wenzhou Huahua Co., Ltd. USY@MSA composites were prepared via the controlled desilication process and recrystallization with triblock copolymer P123 (polyethylene-polypropylene glycol) as template. In a typical synthesis, pristine USY zeolite powders (1 g) were dissolved in 0.1 M NaOH solution (50 ml) containing desirable amount of piperidine (PI, PI/SiO2 molar ratio was 0.1) as structural protective agent. The mixture was sealed and heated at 65 °C for 30 min. Afterwards, 130 g H2O, 76 g ethanol and 2 g P123 were added into above mixture under continuous stirring. Subsequently, certain amount of 0.5 M HCl solution was dropped into above solution until the pH value reached close to 5.7. The solution was ultrasonicated for 30 mins to form homogeneous suspension. The suspension was firstly placed in water bath at 30 °C for 48 h and then heated to 75 °C reacting for another 24 h. After reaction, the white precipitate was collected by filtration, washed with deionized water and ethanol successively, and dried at 100 °C overnight. Finally, the sample, denoted as USY@MSA, was obtained after calcination at 550 °C for 5 h to remove organic template. For the control experiment, USY-ds samples were prepared through the identical desilication procedure. While MSA sample was obtained by following the above recrystallization procedures after removing undissolved bulky USY crystals. 2.2 Preparation of catalysts The bifunctional catalysts of 0.50 wt% Pt-loaded zeolites were prepared by incipient wetness impregnation method with H2PtCl6 as precursor. The zeolites were firstly placed into aqueous H2PtCl6 solution at 25 °C for 12 h, and evaporated to remove moisture. After drying at 120 °C for 4 h, the mixture was pressed and crushed into particles with size between 20 and 40 mess. 2.3 Characterization Powder X-ray diffraction (XRD) was collected on a Rigaku Ultima IV diffractometer with Cu Kα radiation at 35 kV and 25 mA. The morphology of samples was determined by taking scanning electron microscopy (SEM) images with a Hitachi S-4800 microscopy. Transmission electron microscopy (TEM) images were obtained by using Tecnai G2 F30 microscope. N2 adsorption-desorption isothermal were performed on an BELSORP-MAX system by using Brunauer-Emmett-Teller (BET) method. Prior to the test, the sample was outgassed under vacuum at 300 °C for 5 h. Total pore volume was calculated by the adsorbed amount at relative pressure P/P0 of 0.99. The micropore volume and size distribution of mesopores were determined by t-plot method and Battet-Joyner-Halenda (BJH) method, respectively. The 29Si and 27Al MAS NMR spectra were measured on a VARIAN VNMRS 400WB NMR spectrometer. The former was conducted at a frequency of 79.3 MHz with the spinning rate of 3 kHz. And the latter was conducted at a frequency of 104.2 MHz with the spinning rate of 10 kHz. The bulk chemical composition was determined by inductively coupled plasma emission spectrometry (ICP) with a Thermo IRIS Intrepid II XSP atomic emission spectrometer. While the chemical composition on the surface were determined by X-ray photoelectron spectra (XPS) were collected with a ESCALAB 250Xi spectrometer. The temperature-programmed desorption of NH3 (NH3-TPD) was performed on Micromeritica Auto Chem 2920. The samples were firstly heated to 550 °C for 1 h in Ar flow. After cooling down to 100 °C, NH3 was introduced to the system for 20 min. Then the samples were heated to 550 °C and the TPD profiles were recorded correspondingly with a heating rate of 10 °C min−1 under Ar flow. CO pulse chemisorption was performed on the same apparatus. Prior to analysis, the samples were in-situ reduced in H2 flow (50 ml/min) at 400 °C for 2 h. Then, the system was flushed with a flowing He atmosphere (50 ml/min) at 450 °C for 1 h. After cooling down to 50 °C, the CO pulses was passed through the samples until the effluent areas of consecutives pulses were constant. The Pt dispersion was calculated with the stoichiometry of CO/Pt= 1. The FT-IR spectra in hydroxyl stretching region and pyridine-adsorption FT-IR spectra were both collected on a Nicolet Nexus 670 FT-IR spectrometer in absorbance mode at a resolution of 2 cm−1. The sample was firstly pressed into a self-supported wafer and evacuated at 450 °C for 2 h. The FT-IR spectra in hydroxyl stretching region were recorded at the same time. As for the pyridine-adsorped FT-IR spectra, the samples were then exposed to pyridine vapor for 20 min after cooling down to ambient temperature. Afterwards, the adsorbed pyridine was evacuated by elevating the temperature to 450 °C for 1 h. 2.4 Catalytic experiments The hydroisomerization of n-hexadecane (n-C16) was conducted in a fixed-bed micro-reactor loaded with 2.0 g of the catalysts. The reaction conditions were 2.0 h−1 WHSV, 1.0 MPa, H2/n-C16 = 15 (molar ratio). Prior to reaction, the catalysts were reduced in situ in H2 flow at 400 °C for 4 h. Then the system was cooled down to the reaction temperature and n-C16 was then pumped to the reactor. The products were analyzed online by an Agilent 7890 gas chromatograph. 3 Results and discussion 3.1 Preparation and characterization of the USY@MSA composite The preparation of USY@MSA composite included alkaline desilication and self-assembly processes. The pristine USY zeolite was firstly subjected to alkaline solution to remove framework Si atoms. The specific alkaline treatment conditions were firstly investigated comprehensively. Pristine USY shew typical and well-resolved Bragg diffractions attributed to the FAU topology ( Fig. 1a). The treatment in 0.1 M NaOH solution only led to complete collapse of zeolite framework, indicating USY zeolite couldn’t bear the harsh alkaline condition (Fig. S1A). Upon introduction of piperidine (PI), the peaks assigned to USY zeolite were well preserved, and the intensity basically increased as a function of piperidine amount added into the desilication system. The yields for different samples were calculated according to the grams of solids obtained after treatment compared with the pristine USY zeolite (Fig. S1B). As the ratio of PI/SiO2 increased from 0.02 to 0.6, the corresponding yield varied from 55% to 75%, implying the irreversible loss of framework elements upon desilication. Accordingly, piperidine molecule effectively protected the crystal structure against the attack of OH- and prevented the collapse of zeolite framework. To our best knowledge, TPA+ or TBA+ were frequently reported as protective agents in previous reports [33,34]. For example, Vu et al. constructed mesoporous Y zeolite by using octadecyltrimethylammonium hydroxide and bromide (C18TAOH/C18TABr) as surfactant recently [35]. Herein, the low cost and easily accessible piperidine acted as protecting agent substituted for the high priced tetraalkylammonium compounds. When the ratio of PI/SiO2 was 0.1, the corresponding yield was about 55%, where large proportion of Si species were dissolved and the framework structure of USY was preserved simultaneously (Fig. 1b). Hence, the mixture obtained at the above condition was then subjected to the subsequent self-assembly process. The peak intensity of USY@MSA sample further enhanced compared to the USY-ds sample, indicating the increased crystallinity upon self-assembly process (Fig. 1c). Then the pH value during self-assembly process was investigated in detail. As pH value increased from 1.7 to 7.1, the intensity of diffraction peaks gradually increased (Fig. S2A), while the corresponding yield firstly elevated to 91.2% and then decreased to 79.3% (Fig. S2B). The specific morphology of the samples treated at different pH values were investigated by SEM images. Pristine USY zeolite displays irregular bulk crystal with rough surface resulting from ultra-stable process ( Fig. 2a). Upon desilication treatment, numerous circular holes emerged on the surface due to the removal of Si species (Fig. 2b). When the pH value of self-assembly process kept at 1.7 and 2.5, the morphology of the samples was almost unchanged compared with USY-ds sample (Fig. 2c and d). With the pH value raised to 3.5, there were some tiny spheroidal particles dispersing around USY crystals (Fig. 2e). Until the pH value increased to 4.7, the angular USY zeolites were coated by a uniform shell with a spongy-like texture, presenting a smooth crystal edge (Fig. 2f). It presents the similar surface at the higher pH value of 5.7 and 6.2 (Fig. 2g and h). The above results indicate pH value plays an important role in the fabrication of core-shell material. Deep insight into the specific morphology of USY, USY-ds and USY@MSA samples were investigated by TEM technique. Pristine USY zeolite presents well-developed cross-shaped morphology and clearly lattice fringe ( Fig. 4a and b). Upon hydrothermal treatment, more mesopores were introduced into the USY-ds crystal (Fig. 4c and d). A typical core-shell structure consisting of alkaline-treated USY crystal and newly-formed shell was observed from TEM image of the USY@MSA sample. HRTEM image revealed a close connection between the shell and core, in which a disordered wormhole-like pore architecture grew connectedly on the surface of USY zeolite (Fig. 4e and f). To our best knowledge, SBA-15 mesoporous silica with highly ordered hexagonal channels could be fabricated by virtue of P123 template. It was inferred the dissolved species from the pristine USY zeolite assembled into the disordered lamellar mesoporous shell with the assistance of P123 template. Moreover, the shell thickness could be tuned from 20 nm to 60 nm by varying the alkaline treatment conditions (Fig. S3). And the corresponding yields calculated after self-assembly process reached up to 90%, indicating most of the dissolved silicon species were returned back to the composite (Fig. S4). Combined with the above characterizations, the core-shell structural USY@MSA sample can be fabricated through the desilication and self-assembly process. During alkaline desilication process, some Si atoms were removed from USY framework and dissolved in the system, acting as the nutrient of mesoporous silica shell. The oriental assembly of silicious species on the surface of USY core was critical during the self-assembly process, which was determined by the adsorption of the template micelle on the core surface. According to the previous reports, the isoelectric point (IEP) of siliceous oligomer was about 2, and the IEP of P123 micelles were about 6.2 [36]. The dissolution and polycondensation rates of silicon source were slow in strong acidic system, therefore it was difficult to form mesoporous silica phase, just as revealed in Fig. 2c. When pH value was between 2.5 and 3.5, the mesoporous silica sphere could be formed at this situation. But the interaction between P123 micelle and zeolite was weak leading to serious phase separation (Fig. 2d and e). The small silica grain was lapsed during centrifugation and washing processes, resulting to a low yield of 65% (Fig. S2B). When the pH value was controlled in the range of 4.7–6.2, P123 micelles were partially protonated and the zeolites were negatively charged, generating strong electrostatic attraction. The dissolved siliceous orientally assembled and formed mesoporous silica shell coating on the surface of zeolite crystal, resulting in a homogeneous core-shell structured USY@MSA material (Fig. 3). In this sense, the USY@MSA material described in the following experiments were all prepared at pH value of 5.7. The pore architecture of the samples was investigated by N2 adsorption-desorption measurements ( Fig. 5). USY and USY-ds samples exhibited the similar type I (P/P0 <0.05) and IV (0.5 <P/P0 <1) isothermals, indicating the presence of both micropores and mesopores. While the isothermal of the USY@MSA sample presented an uptake at the pressure P/P0 < 0.6 (type I), type IV curves with H2 hysteresis loop at P/P0 of 0.6–0.85, and a third step at high pressure region (P/P0 = 0.8–1). The specific surface area (S BET), total pore volume (V tot) and mesopore volume (V meso) of USY zeolite were 752 m2 g−1, 0.54 cm3 g−1, and 0.3 cm3 g−1, respectively ( Table 1). Upon the desilication process in solution containing NaOH and piperidine, the S BET, V tot and V meso abruptly increased to 803 m2 g−1, 0.79 cm3 g−1, and 0.58 cm3 g−1, respectively. After coating the mesopore shell, the S BET was almost keep unchanged (799 m2 g−1), and the V tot and V meso were 0.71 cm3 g−1 and 0.54 cm3 g−1, respectively. Actually, the proportion of mesopore was highest among the three samples due to the internal desilication and the formation of mesoporous shell. As to the pore size distribution (Fig. 5B), USY and USY-ds samples exhibited a shoulder peak ranging from 20 to 30 nm, which was probably attributed to intra-crystal mesopores. By contrast, USY@MSA material showed a bimodal mesopore size distribution, including the intra-crystal mesopores around 40 nm and the mesopores resulting from the wormhole-like shell around 9 nm. Thus the core-shell USY@MSA material demonstrates a hierarchical structure and wider intra-crystal mesopores. The interconnected porosities characteristic was expected to make acid sites more accessible to reactants and facilitate the diffusion during catalytic reaction. To determine the variation of framework elements during alkaline-desilication and self-assembly processes, the elementary composition as well as the coordination state were investigated by various techniques. The initial bulk Si/Al molar ratio of pristine USY zeolite was 19, which significantly reduced to 12.7 after desilication treatment, indicating the leaching out of Si species from the crystal. Upon self-assembly process, the Si/Al molar ratio (20.7) raised close to the initial value, implying the dissolved Si or Al species returned back to the crystal. 27Al MAS NMR spectra of pristine USY zeolite consisted of two resonance peaks at 60 ppm and 0 ppm ( Fig. 6). The former peak is attributed to tetrahedrally coordinated alumina (AlIV) in the framework [37]. The latter one is indicative of extra-framework octahedral aluminum (AlVI) generated from the ultra-stable process, which is assigned to the Al(OH)6 3+ specie in highly asymmetrical environment [38]. Upon desilication treatment, the peak intensity at 0 ppm significantly reduced, while the peak at 60 ppm slightly increased conversely. Meanwhile the Si/Al molar ratio of MSA collected from the desiliconized solution was up to 233.1 (Table S1), manifesting extremely low amount of Al species contained in the mesoporous sample. Therefore, the desilication treatment mainly resulted in the dissolution of silicon species and partial extra-framework Al species. Upon self-assembly process, the signal at 0 ppm decreased further and the signal at 60 ppm kept almost unchanged. As can be seen from aforementioned results, the bulk Si/Al molar ratio and yield upon self-assembly process returned back to the initial level of pristine USY zeolite. We assumed that the dissolved octahedral Al species could be reinserted into the zeolite framework or mesoporous SiO2 shell. The above hypothesis was further verified by 29Si MAS NMR spectroscopy ( Fig. 7). All the samples exhibited one broad resonance band centered at about − 102.5 ppm. After deconvolution, the specific resonances at − 107, − 102, − 99, − 95 ppm were reasonably derived from Si(0Al), Si(1Al), Si(2Al), Si(3Al) building units, and the resonance at − 111 pm was generally attributed to the quartz phase [39]. After alkaline treatment, the percentage of Si(0Al) units decreased from 71.3% to 63.9%, whereas the proportion of Si(1Al) and Si(2Al) increased from 11.3% and 7.6–13.1% and 10.3%. It suggested that part of Si species leached out from zeolite framework leading to the reduction of Si(0Al) units and slight increase of Si(2Al) and Si(3Al) units. Upon self-assembly process, the proportion of Si(0Al) unit further decreased to 41.4%, and the proportion of Si(1Al) raised to 18.4%. However, the proportion belonging to Si(1Al) slightly decreased to 9.6%, accompanying with the appearance of new band at − 115 ppm, which was probably due to the formation of mesoporous SiO2 shell. Therefore, the extra-framework Al species within the crystal incorporated into the framework of mesoporous SiO2 shell during the desilication or self-assembly process, which was in good agreement with 27Al MAS NMR spectra. IR spectra in the region of hydroxyl stretching vibration were collected under vacuum conditions ( Fig. 8). With respect to pristine USY zeolite, the strong band at 3740 cm−1 was assigned to stretching vibration of isolated silanols (Si-OH) on the external surface [40], and the accompanying shoulder band at 3725 cm−1 was presumably associated with the hydrogen-bonded internal silanols [41]. The bands at 3622 cm−1 and 3560 cm−1 corresponded to Si(OH)Al hydroxyls within α cage and β cage in FAU topology structure [42]. By contrast, USY-ds sample exhibited a more intense band at 3740 cm−1 as well as weaken bands at 3560 cm−1 and 3622 cm−1, manifesting the substantial reduction of Si(OH)Al hydroxyls upon desilication treatment. Upon self-assembly process, the band at 3622 cm−1 slightly strengthened and presented left-shifts relative to the other two samples. The newly emerged Si(OH)Al hydroxyls may be correlated to the reinsertion of dissolved Al species into USY framework. To gain more insight into the acidity of the samples, we measured NH3-TPD profiles and pyridine-adsorption FT-IR spectra systemically. As shown in Fig. 9, NH3-TPD profiles of the pristine USY sample exhibited two peaks at 150 °C and 320 °C, which were related to the desorption of ammonia adsorbed on weak and medium acid sites, respectively. Upon desilication process in alkaline solution, the high-temperature peak intensity became weaken, and the low-temperature peak intensity enhanced simultaneously. It indicated the removal of Si species from USY framework changed the distribution of acidic sites. As to the USY@MSA sample, the high-temperature peak slightly shifted to 304 °C, implying the reduction of medium-acidic sites. Pyridine adsorbed FT-IR spectra was generally employed to clarify the acidic properties. As shown in Fig. 9B, the stretching bands at 1545 cm−1 and 1454 cm−1 were assigned to the pyridine adsorbed on Brønsted and Lewis acid sites, respectively, and the band at 1490 cm−1 was attributed to both Brønsted and Lewis acid sites [43,44]. Pristine USY zeolite exhibited strong band at 1545 cm−1 and weak band at 1454 cm−1, indicating the Brønsted acid sites predominated the total acidity. Suffering from desilication treatment, the Brønsted acidity significantly decreased and the Lewis acidity slightly increased, due to the leaching out of Si specie from framework. In addition, a weak shoulder peak appeared at 1447 cm−1 corresponding to pyridine interacting with hydrogen band on the external surface. After self-assembly process, the band related to Brønsted acid sites kept almost intact and the band assigned to Lewis acid sites further enhanced, which was probably attributed to the insertion of extra-framework Al specie into USY framework. The increased intensity of the peak at 1447 cm−1 was correlated to the formation of abundant silicon hydroxyls within the mesoporous MSA shell. Accordingly, the USY@MSA sample demonstrated the increase acidity upon self-assembly process. 3.2 Hydroisomerization of n-hexadecane over different catalysts To construct the bifunctional catalyst for hydro-isomerization of n-hexadecane (n-C16), we then loaded 0.5 wt% Pt on different zeolites by the incipient wetness method. TEM image of Pt/USY@MSA revealed that the supported Pt nanoparticles mainly located on the mesoporous shell, which were highly dispersed with the average size of ca. 5 nm ( Fig. 10). In contrast, the supported Pt nanoparticles on the pristine USY zeolite and USY-dsAT0.1-PI0.1 mainly distributed on the surface of bulk crystal phase, giving an aggregated and heterogeneous distribution (Fig. S5). Moreover, the Pt dispersion of Pt/USY, Pt/USY-ds and Pt/USY@MSA samples were 30%, 31%, and 35%, respectively. It indicates the fabrication of mesoporous shell benefited to the confining effect and improvement of Pt dispersion. Firstly, the evolution of n-C16 conversion as a function of temperature for different catalysts were depicted ( Fig. 11A). With the increase in reaction temperature, the n-C16 conversion for all the catalysts increased apparently. Compared to Pt/USY catalyst, the Pt/USY-ds and the core-shell Pt/USY@MSA catalysts required a higher reaction temperature to reach equivalent conversion, indicating the relative low activity for the treated samples. According to previous reports, hydroconversion of alkane including hydroisomerization and cracking reaction proceeds mainly on Brønsted acid sites [45]. Accordingly, the considerable reduction of Brønsted acid sites upon desilication treatment led to the decline of hydromerization activity (Fig. 9). The Pt/USY-ds catalyst possessing the minimum amount of Brønsted acid sites exhibited the lowest activity for n-C16 hydroisomerization. While Pt/USY@MSA catalyst possessing more strong Brønsted acid sites was endowed with the boosted activity than the desilication catalyst. Fig. 11B depicts the curves of isomerized i-C16 yields versus conversion over different catalysts. All of the i-C16 yields showed a volcanic variation trend with the increase of n-C16 conversion. The maximum i-C16 yields for the Pt/USY and Pt/USY-ds catalysts were only 36.3% and 46.8%, respectively, which were obtained at the n-C16 conversion of 62.4% and 83.1%. It is noteworthy that Pt/USY@MSA catalyst exhibited the highest i-C16 yield of 61% at the conversion of 72.2%. Afterwards, all the branched isomer yields decreased sharply with the further increase of n-C16 conversion. High conversion was obtained at elevated temperatures, which led to serious cracking reaction especially for those with abundant Brønsted acid sites. Hence the branched isomers yield was extremely low at high conversion for Pt/USY and Pt/USY@MSA catalysts. The products distribution as a function of n-C16 conversion over Pt/USY, Pt/USY-ds and Pt/USY@MSA catalysts were depicted in Fig. S6. The Pt/USY catalyst achieved much higher selectivity of cracked products, compared to the Pt/USY-ds and Pt/USY@MSA catalysts. As for the Pt/USY@MSA catalyst, high selectivity to mono-branched was achieved at low n-C16 conversion (<40%) and high selectivity of multi-branched isomers was obtained at relatively high n-C16 conversion (40%∼85%). According to the classical metal-acid bifunctional mechanism, the hydroisomerization reactions of n-alkanes mainly comprises three processes: 1) the dehydrogenation of n-alkanes to n-alkene intermediates over metal sites, 2) isomerization of n-alkene intermediates to iso-alkenes over acid sites via carbenium ion mechanism, 3) hydrogenation of iso-alkenes over metal sites to form iso-alkanes ( Scheme 1). Amongst the isomerization of n-alkene is much slower than the dehydrogenation/hydrogenation steps, which is considered as the rate-determining step [46]. Meanwhile, the protonation alkene intermediates resting on acid sites may undergo C-C bond cracking side reaction and reduce the branched isomers yield. In this sense, the ideal hydroisomerization process requires fast diffusion of alkene intermediates within acidic zeolites, which could effectively inhibit the cracking reaction and promote isomerization reaction. Firstly, the USY@MSA sample exhibited the largest proportion of mesoporous volume than the desilicated Pt/USY-ds and conventional Pt/USY sample (76% vs 73% vs 56%). The interconnected porosities characteristic of Pt/USY@MSA catalysts significantly enhance the diffusion of alkene intermediates. Secondly, the distance between metal active sites and acid sites was found to play an essential role in the product distributions [1,26]. The nano-scale metal-acid distance is more beneficial for the formation of branched isomers, while the adjacent or millimetric scale metal-acid distance would cause serious cracking reaction or reduce the catalytic performance [26]. As to the Pt/USY-ds zeolite, although Pt particles mainly located on the outer surface, their location was still in close proximity to the acidic sites of USY of distance. The n-alkene intermediates were formed rapidly, while the isomerization of n-alkene intermediates was much slow. It is deduced that the newly formed n-alkene intermediates easily diffused to adjacent acidic sites and cracked into light hydrocarbons. With respect to Pt/USY@MSA catalyst, the mesoporous SiO2 acting as a wall to separate the acidic and metal sites. The confinement of the mesopores may lead to a longer residence of the n-alkene intermediates, but the mesoporous SiO2 has rare acidity and does not cause the cracking of n-alkene intermediates. Finally, the n-alkene intermediates diffused into the acidic sites of USY zeolites and isomerized to the i-alkene intermediates, resulting in the higher yield of branched isomers. According to characterizations, Pt particles within Pt/USY and Pt/USY-ds catalysts were trapped in the USY support, which may increase the residence time of the newly-formed alkene intermediates on acidic support and improve the probability of cracking side reactions. 4 Conclusions A Hierarchical core-shell USY@MSA material composing of desilicated USY core and Al-containing mesoporous silica shell was constructed via a self-assembly strategy without the addition of additional silicon source. The pristine USY zeolite couldn’t bear the harsh treatment with NaOH only, and piperidine acting as a structure-protecting agent effectively shielded the topology structure from collapse. The core-shell USY@MSA material was feathered with the interconnected channel structure and gradient acidity distribution. Due to the construction of hierarchical core-shell structure, highly dispersed Pt particles selectively deposited on mesoporous shell, generating nanoscale distance with the acid sites of USY support. The combination effect of hierarchical structure and favorable metal-acid balance effectively suppressed the cracking side reaction to a large extent and boosted the isomerization reaction. This result provides useful reference for the design of bifunctional catalysts for long-chain alkanes hydroisomerization process. CRediT authorship contribution statement Bo Wang: Methodology, Investigation, Project administration, Writing − original draft. Jinsheng Zhao: Project administration, Supervision. Hongxi Pan: Formal analysis. Yunyun Dong: Investigation. Xiaolei Li: Investigation. Shuo Tao: Conceptualization, Supervision, Project administration, Writing − review & editing, Funding acquisition. Declaration of Competing Interest The authors declare that they have no known competing financial interests or personal relationships that could have appeared to influence the work reported in this paper. Acknowledgments The authors gratefully acknowledge to the financial support from National Natural Science Foundation of China (Grant Nos. 22202096, 21706109, 21908089), National Science Foundation of Shandong Province (ZR2022QB101, ZR2022MB063), Development Plan of Youth Innovation Team in Colleges and Universities of Shandong Province (Grant No. 2022KJ109), Guangyue Young Scholar Innovation Team of Liaocheng University (Grant No. LCUGYTD2022–02), the Doctoral Scientific Research Foundation of Liaocheng University (Grant No. 318051806). Appendix A Supporting information Supplementary data associated with this article can be found in the online version at doi:10.1016/j.apcata.2022.119011. Appendix A Supplementary material Supplementary material . References [1] L.I. van der Wal J. Oenema L.C.J. Smulders N.J. Samplonius K.R. Nandpersad J. Zečević K.P. de Jong ACS Catal. 11 2021 3842 3855 L.I. van der Wal, J. Oenema, L.C.J. Smulders, N.J. Samplonius, K.R. Nandpersad, J. Zečević, K.P. de Jong, ACS Catal. 11 (2021) 3842–3855. [2] S. Vedachalam P. Boahene A.K. Dalai Fuel 300 2021 121008 121019 S. Vedachalam, P. Boahene, A.K. Dalai, Fuel 300 (2021) 121008–121019. [3] Y. Tan W. Hu Y. Du J. Li Appl. Catal. A: Gen. 611 2021 117916 117935 Y. Tan, W. Hu, Y. Du, J. Li, Appl. Catal. A: Gen. 611 (2021) 117916–117935. [4] G. Yu X. Chen W. Xue L. Ge T. Wang M. Qiu W. Wei P. Gao Y. Sun Chin J. Catal. 41 2020 622 630 G. Yu, X. Chen, W. Xue, L. Ge, T. Wang, M. Qiu, W. Wei, P. Gao, Y. Sun, Chin. J. Catal. 41 (2020) 622–630. [5] S.P. Sree S. Radhakrishnan L. Geerts T.V. Donck G. Vanbutsele E. Breynaert J.W. Seo J.A. Martens Catal. Sci. Technol. 11 2021 1519 1525 S.P. Sree, S. Radhakrishnan, L. Geerts, T.V. Donck, G. Vanbutsele, E. Breynaert, J.W. Seo, J.A. Martens, Catal. Sci. Technol. 11 (2021) 1519–1525. [6] X. Wang X. Zhang Q. Wang Appl. Catal. A: Gen. 590 2020 117335 117345 X. Wang, X. Zhang, Q. Wang, Appl. Catal. A: Gen. 590 (2020) 117335–117345. [7] M. Zhai W. Wu E. Xing Y. Zhang Chem. Eng. J. 440 2022 135874 135892 M. Zhai, W. Wu, E. Xing, Y. Zhang, et al. Chem. Engineer. J. 440 (2022) 135874–135892. [8] Q. Sun N. Wang J. Yu Advances in Catalytic Applications of Zeolite-Supported Metal Catalysts Adv. Mater. 33 2021 2104442 21044479 Q. Sun, N. Wang, J. Yu, Advances in Catalytic Applications of Zeolite-Supported Metal Catalysts, Adv. Mater., 33 (2021) 2104442–21044479. [9] M.E. Potter ACS Catal. 10 2020 9758 9789 M.E. Potter, A.C.S. Catal. 10 (2020) 9758–9789. [10] M. Zhang L. Liu L. Wang X. Zhang G. Li ACS Catal. 12 2022 10313 10325 M. Zhang, L. Liu, L. Wang, X. Zhang, G. Li, ACS Catal. 12 (2022) 10313–10325. [11] C. Wei G. Zhang L. Zhao J. Gao C. Xu Fuel 315 2022 122809 122825 C. Wei, G. Zhang, L. Zhao, J. Gao, C. Xu, Fuel 315 (2022) 122809–122825. [12] R. Maghrebi M. Buffi P. Bondioli D. Chiaramonti Renew. Sustain. Energy Rev. 149 2021 111264 111283 R. Maghrebi, M. Buffi, P. Bondioli, D. Chiaramonti, Renew. Sustain. Energy Rev. 149 (2021) 111264–111283. [13] J.A. Martens R. Parton L. Uytterhoeven P.A. Jacobs G.F. Froment Appl. Catal. 76 1991 95 116 J.A. Martens, R. Parton, L. Uytterhoeven, P.A. Jacobs, G.F. Froment, Appl. Catal. 76 (1991) 95–116. [14] M. Hartmann M. Thommes W. Schwieger Adv. Mater. Interfaces 8 2021 2001841 2001879 M. Hartmann, M. Thommes, W. Schwieger, Adv. Mater. Interfaces 8 (2021) 2001841–2001879. [15] S. Tao X. Li X. Wang Y. Wei Y. Jia J. Ju Angew. Chem. Int. Ed. 59 2020 3455 3459 S. Tao, X. Li, X. Wang, Y. Wei, Y. Jia, J. Ju, et al., Angew. Chem. Int. Ed. 59 (2020) 3455–3459. [16] J. Meng T. Cui D. Bai C. Li X. Chen C. Liang Fuel 324 2022 124589 124603 J. Meng, T. Cui, D. Bai, C. Li, X. Chen, C. Liang, Fuel 324 (2022) 124589–124603. [17] X. Wang X. Zhang Q. Wang Ind. Eng. Chem. Res 58 2019 8495 9505 X. Wang, X. Zhang, Q. Wang, Ind. Eng. Chem. Res. 58 (2019) 8495–9505. [18] X. Wei P.G. Smirniotis Microporous Mesoporous Mater. 97 2006 97 106 X. Wei, P.G. Smirniotis, Microporous Mesoporous Mater. 97 (2006) 97–106. [19] L. Chen M. Sun Z. Wang W. Yang Z. Xie B. Su Chem. Rev. 120 2020 11194 11294 L. Chen, M. Sun, Z. Wang, W. Yang, Z. Xie, B. Su, Chem. Rev. 120 (2020) 11194–11294. [20] S. Fernandez M.L. Ostraat J.A. Lawrence III K. Zhang Microporous Mesoporous Mater. 263 2018 201 209 S. Fernandez, M.L. Ostraat, J.A. Lawrence III, K. Zhang, Microporous Mesoporous Mater. 263 (2018) 201–209. [21] W. Wang C. Liu W. Wu Catal. Sci. Technol. 9 2019 4162 4189 W. Wang, C. Liu, W. Wu, Catal. Sci. Technol. 9 (2019) 4162–4189. [22] P.S.F. Mendes J.M. Silva M.F. Ribeiro A. Daudin C. Bouchy Catal. Today 356 2020 260 270 P.S.F. Mendes, J.M. Silva, M.F. Ribeiro, A. Daudin, C. Bouchy, Catal. Today 356 (2020) 260–270. [23] J. Zecevic G. Vanbutsele K.P. de Jong J.A. Martens Nature 528 2015 245 248 J. Zecevic, G. Vanbutsele, K.P. de Jong, J.A. Martens, Nature 528 (2015) 245–248. [24] K. Cheng L.I. van der Wal H. Yoshida J. Oenema J. Harmel Z. Zhang G. Sunley J. Zečević K.P. de Jong Angew. Chem. Int. Ed. 59 2020 3592 3600 K. Cheng, van der Wal L.I., H. Yoshida, J. Oenema, J. Harmel, Z. Zhang, G. Sunley, J. Zečević, K.P. de Jong, Angew. Chem. Int. Edit. 59 (2020) 3592–3600. [25] O.B. Moussa L. Tinat X. Jin W. Baaziz O. Durupthy C. Sayag J. Blanchard ACS Catal. 8 2018 6071 6078 O.B. Moussa, L. Tinat, X. Jin, W. Baaziz, O. Durupthy, C. Sayag, J. Blanchard, ACS Catal. 8 (2018) 6071–6078. [26] J.E. Samad J. Blanchard C. Sayag C. Louis J.R. Regalbuto J. Catal. 342 2016 203 212 J.E. Samad, J. Blanchard, C. Sayag, C. Louis, J.R. Regalbuto, J. Catal. 342 (2016) 203–212. [27] K. Cheng L.J. Smulders L.I. Van Der Wal J. Oenema J.D. Meeldijk N.L. Visser G. Sunley T. Roberts Z. Xu E. Doskocil H. Yoshida Y. Zheng J. Zečević P.E. de Jongh K.P. de Jong Science 377 2022 204 208 K. Cheng, L.J. Smulders, L.I. Van Der Wal, J. Oenema, J.D. Meeldijk, N.L. Visser, G. Sunley, T. Roberts, Z. Xu, E. Doskocil, H. Yoshida, Y. Zheng, J. Zečević, P.E. de Jongh, K.P. de Jong, Science 377 (2022) 204–208. [28] P.B. Weisz Adv. Catal. 13 1962 137 190 P.B. Weisz, Adv. Catal. 13 (1962) 137–190. [29] N. Batalha L. Pinard C. Bouchy E. Guillon M. Guisnet J. Catal. 307 2013 122 131 N. Batalha, L. Pinard, C. Bouchy, E. Guillon, M. Guisnet, J. Catal. 307 (2013) 122–131. [30] D. Wang L. Xu P. Wu J. Mater. Chem. A 2 2014 15535 15545 D. Wang, L. Xu, P. Wu, J. Mater. Chem. A 2(2014) 15535–15545. [31] T. Zhang F. Qiu J. Li Appl. Catal. B: Environ. 195 2016 48 58 T. Zhang, F. Qiu, J. Li, Appl. Catal. B: Environ. 195(2016) 48–58. [32] H. Gong Z. Xiao Y. Zhuang S. Liang X. Li W. Zheng A. Duan X. Zhang J. Liu Fuel 302 2021 121131 121142 H. Gong, Z. Xiao, Y. Zhuang, S. Liang, X. Li, W. Zheng, A. Duan, X. Zhang, J. Liu, Fuel 302(2021) 121131–121142. [33] M. Milina S. Mitchell P. Crivelli D. Cooke J. Pérez-Ramírez Nat. Commun. 5 2014 3922 3932 M. Milina, S. Mitchell, P. Crivelli, D. Cooke, J. Pérez-Ramírez, Nat. Commun. 5 (2014) 3922–3932. [34] X. Liu Z. Liao H. Wang J. Fu J. Zheng N. Zhang B. Chen Appl. Catal. A: Gen. 642 2022 118676 118683 X. Liu, Z. Liao, H. Wang, J. Fu, J. Zheng, N. Zhang, B. Chen, Appl. Catal. A: Gen. 642 (2022) 118676–118683. [35] H. Vu F.M. Harth M. Goepel N. Linares J. Garca-Martnez R. Glser Chem. Eng. J. 430 2022 132763 132772 H. Vu, F.M. Harth, M. Goepel, N. Linares, J. Garca-Martnez, R. Glser, Chem. Engineer. J. 430 (2022) 132763–132772. [36] H. Peng L. Xu H. Wu Z. Wang Y. Liu X. Li M. He P. Wu Microporous Mesoporous Mater. 153 2012 8 17 H. Peng, L. Xu, H. Wu, Z. Wang, Y. Liu, X. Li, M. He, P. Wu, Microporous Mesoporous Mater. 153 (2012) 8–17. [37] D. Nozik F.M.P. Tinga A.T. Bell ACS Catal. 11 2021 14489 14506 D. Nozik, F.M.P. Tinga, A.T. Bell, ACS Catal. 11 (2021) 14489–14506. [38] L. Fang Z. Yan J. Wu A. Bugaev C. Lamberti M. Pera-Titus Appl. Catal. B: Environ. 286 2021 119942 119953 L. Fang, Z. Yan, J. Wu, A. Bugaev, C. Lamberti, M. Pera-Titus, Appl. Catal. B: Environ. 286 (2021) 119942–119953. [39] S. Liu Y. He H. Zhang Z. Chen W. Lv J. Ren Y. Yun X. Wen Y. Li Catal. Sci. Technol. 9 2019 2812 2827 S. Liu, Y. He, H. Zhang, Z. Chen, W. Lv, J. Ren, Y. Yun, X. Wen, Y. Li, Catal. Sci. Technol. 9 (2019) 2812–2827. [40] D. Verboekend T.C. Keller S. Mitchell J. Pérez-Ramírez Adv. Funct. Mater. 23 2013 1923 1934 D. Verboekend, T.C. Keller, S. Mitchell, J. Pérez-Ramírez, Adv. Funct. Mater. 23 (2013) 1923–1934. [41] Y. Ji H. Xu D. Wang L. Xu P. Ji H. Wu P. Wu ACS Catal. 3 2013 1892 1901 Y. Ji, H. Xu, D. Wang, L. Xu, P. Ji, H. Wu, P. Wu, ACS Catal. 3 (2013) 1892–1901. [42] Y. Li J.N. Armor Appl. Catal. A: Gen. 183 1999 107 120 Y. Li, J.N. Armor, Appl. Catal. A: Gen. 183 (1999) 107–120. [43] D. Zheng D. Guo Z. Wang X. Wang Y. Shan X. Liu Z. Yan S. Yu Y. Liu Chem. Eng. J. 451 2022 138939 138947 D. Zheng, D. Guo, Z. Wang, X. Wang, Y. Shan, X. Liu, Z. Yan, S. Yu, Y. Liu, Chem. Engineer. J. 451 (2022) 138939–138947. [44] Y. Yang X. Liu Y. Lyu Y. Liu W. Zhan Z. Yu L. Fan Z. Yan J. Colloid Interf. Sci. 604 2021 727 736 Y. Yang, X. Liu, Y. Lyu, Y. Liu, W. Zhan, Z. Yu, L. Fan, Z. Yan, J. Colloid. Interf. Sci. 604 (2021) 727–736. [45] Y. Chen J. Meng C. Li X. Chen C. Liang Ind. Eng. Chem. Res. 61 2022 279 286 Chen Y., Meng J., Li C., Chen X., Liang C., Ind. Eng. Chem. Res. 61 (2022) 279–286. [46] C. Wei G. Zhang L. Zhao J. Gao C. Xu Fuel 315 2021 122809 122825 C. Wei, G. Zhang, L. Zhao, J. Gao, C. Xu, Fuel 315 (2021) 122809–122825.",
      "scopus-id": "85147214137",
      "coredata": {
        "eid": "1-s2.0-S0926860X22005348",
        "dc:description": "Hydroisomerization of long-chain n-alkanes is an indispensable process in the upgrading of fuel oil and lubricants to meet the state of art regulations. In this work, a novel core-shell structural material comprising USY zeolite core and mesoporous aluminosilicate (MSA) shell, denoted as USY@MSA, was fabricated by virtue of a desilication and recrystallization approach. Comprehensive characterizations demonstrate that the USY@MSA composite exhibits a hierarchical pore architecture and a gradient acidity. Due to the confinement effect of the mesoporous aluminosilicate shell, highly dispersed platinum particles were selectively deposited on the shell, generating a nanoscale distance with acidic sites of USY zeolite core. In the hydroisomerization of n-hexadecane, the Pt/USY@MSA composite catalyst outperforms the conventional Pt/USY and desilicated Pt/USY-ds catalysts, effectively suppressing the cracking side reactions and producing higher selectivity to branched isomers.",
        "openArchiveArticle": "false",
        "prism:coverDate": "2023-03-05",
        "openaccessUserLicense": null,
        "prism:aggregationType": "Journal",
        "prism:url": "https://api.elsevier.com/content/article/pii/S0926860X22005348",
        "dc:creator": [
          {
            "@_fa": "true",
            "$": "Wang, Bo"
          },
          {
            "@_fa": "true",
            "$": "Zhao, Jinsheng"
          },
          {
            "@_fa": "true",
            "$": "Pan, Hongxi"
          },
          {
            "@_fa": "true",
            "$": "Dong, Yunyun"
          },
          {
            "@_fa": "true",
            "$": "Li, Xiaolei"
          },
          {
            "@_fa": "true",
            "$": "Tao, Shuo"
          }
        ],
        "link": [
          {
            "@_fa": "true",
            "@rel": "self",
            "@href": "https://api.elsevier.com/content/article/pii/S0926860X22005348"
          },
          {
            "@_fa": "true",
            "@rel": "scidir",
            "@href": "https://www.sciencedirect.com/science/article/pii/S0926860X22005348"
          }
        ],
        "dc:format": "application/json",
        "openaccessType": null,
        "pii": "S0926-860X(22)00534-8",
        "prism:volume": "653",
        "articleNumber": "119011",
        "prism:publisher": "Elsevier B.V.",
        "dc:title": "Construction of hierarchical core-shell Pt/USY@MSA bifunctional catalysts for hydroisomerization of n-hexadecane",
        "prism:copyright": "© 2023 Elsevier B.V. All rights reserved.",
        "openaccess": "0",
        "prism:issn": "0926860X",
        "dcterms:subject": [
          {
            "@_fa": "true",
            "$": "Core-shell"
          },
          {
            "@_fa": "true",
            "$": "Hierarchical"
          },
          {
            "@_fa": "true",
            "$": "Nanoscale distance"
          },
          {
            "@_fa": "true",
            "$": "Hydroisomerization"
          }
        ],
        "openaccessArticle": "false",
        "prism:publicationName": "Applied Catalysis A: General",
        "openaccessSponsorType": null,
        "prism:pageRange": "119011",
        "pubType": "fla",
        "prism:coverDisplayDate": "5 March 2023",
        "prism:doi": "10.1016/j.apcata.2022.119011",
        "prism:startingPage": "119011",
        "dc:identifier": "doi:10.1016/j.apcata.2022.119011",
        "openaccessSponsorName": null
      },
      "objects": {
        "object": [
          {
            "@category": "standard",
            "@height": "846",
            "@width": "565",
            "@_fa": "true",
            "$": "https://api.elsevier.com/content/object/eid/1-s2.0-S0926860X22005348-gr4.jpg?httpAccept=%2A%2F%2A",
            "@multimediatype": "JPEG image file",
            "@type": "IMAGE-DOWNSAMPLED",
            "@size": "193846",
            "@ref": "gr4",
            "@mimetype": "image/jpeg"
          },
          {
            "@category": "standard",
            "@height": "141",
            "@width": "555",
            "@_fa": "true",
            "$": "https://api.elsevier.com/content/object/eid/1-s2.0-S0926860X22005348-gr3.jpg?httpAccept=%2A%2F%2A",
            "@multimediatype": "JPEG image file",
            "@type": "IMAGE-DOWNSAMPLED",
            "@size": "26983",
            "@ref": "gr3",
            "@mimetype": "image/jpeg"
          },
          {
            "@category": "standard",
            "@height": "794",
            "@width": "565",
            "@_fa": "true",
            "$": "https://api.elsevier.com/content/object/eid/1-s2.0-S0926860X22005348-gr2.jpg?httpAccept=%2A%2F%2A",
            "@multimediatype": "JPEG image file",
            "@type": "IMAGE-DOWNSAMPLED",
            "@size": "124452",
            "@ref": "gr2",
            "@mimetype": "image/jpeg"
          },
          {
            "@category": "standard",
            "@height": "226",
            "@width": "565",
            "@_fa": "true",
            "$": "https://api.elsevier.com/content/object/eid/1-s2.0-S0926860X22005348-gr11.jpg?httpAccept=%2A%2F%2A",
            "@multimediatype": "JPEG image file",
            "@type": "IMAGE-DOWNSAMPLED",
            "@size": "29146",
            "@ref": "gr11",
            "@mimetype": "image/jpeg"
          },
          {
            "@category": "standard",
            "@height": "340",
            "@width": "376",
            "@_fa": "true",
            "$": "https://api.elsevier.com/content/object/eid/1-s2.0-S0926860X22005348-gr1.jpg?httpAccept=%2A%2F%2A",
            "@multimediatype": "JPEG image file",
            "@type": "IMAGE-DOWNSAMPLED",
            "@size": "23226",
            "@ref": "gr1",
            "@mimetype": "image/jpeg"
          },
          {
            "@category": "standard",
            "@height": "282",
            "@width": "565",
            "@_fa": "true",
            "$": "https://api.elsevier.com/content/object/eid/1-s2.0-S0926860X22005348-gr10.jpg?httpAccept=%2A%2F%2A",
            "@multimediatype": "JPEG image file",
            "@type": "IMAGE-DOWNSAMPLED",
            "@size": "53190",
            "@ref": "gr10",
            "@mimetype": "image/jpeg"
          },
          {
            "@category": "standard",
            "@height": "299",
            "@width": "339",
            "@_fa": "true",
            "$": "https://api.elsevier.com/content/object/eid/1-s2.0-S0926860X22005348-gr8.jpg?httpAccept=%2A%2F%2A",
            "@multimediatype": "JPEG image file",
            "@type": "IMAGE-DOWNSAMPLED",
            "@size": "20335",
            "@ref": "gr8",
            "@mimetype": "image/jpeg"
          },
          {
            "@category": "standard",
            "@height": "514",
            "@width": "565",
            "@_fa": "true",
            "$": "https://api.elsevier.com/content/object/eid/1-s2.0-S0926860X22005348-gr7.jpg?httpAccept=%2A%2F%2A",
            "@multimediatype": "JPEG image file",
            "@type": "IMAGE-DOWNSAMPLED",
            "@size": "39499",
            "@ref": "gr7",
            "@mimetype": "image/jpeg"
          },
          {
            "@category": "standard",
            "@height": "306",
            "@width": "339",
            "@_fa": "true",
            "$": "https://api.elsevier.com/content/object/eid/1-s2.0-S0926860X22005348-gr6.jpg?httpAccept=%2A%2F%2A",
            "@multimediatype": "JPEG image file",
            "@type": "IMAGE-DOWNSAMPLED",
            "@size": "19000",
            "@ref": "gr6",
            "@mimetype": "image/jpeg"
          },
          {
            "@category": "standard",
            "@height": "300",
            "@width": "569",
            "@_fa": "true",
            "$": "https://api.elsevier.com/content/object/eid/1-s2.0-S0926860X22005348-gr5.jpg?httpAccept=%2A%2F%2A",
            "@multimediatype": "JPEG image file",
            "@type": "IMAGE-DOWNSAMPLED",
            "@size": "42972",
            "@ref": "gr5",
            "@mimetype": "image/jpeg"
          },
          {
            "@category": "standard",
            "@height": "244",
            "@width": "565",
            "@_fa": "true",
            "$": "https://api.elsevier.com/content/object/eid/1-s2.0-S0926860X22005348-gr9.jpg?httpAccept=%2A%2F%2A",
            "@multimediatype": "JPEG image file",
            "@type": "IMAGE-DOWNSAMPLED",
            "@size": "36369",
            "@ref": "gr9",
            "@mimetype": "image/jpeg"
          },
          {
            "@category": "standard",
            "@height": "200",
            "@width": "485",
            "@_fa": "true",
            "$": "https://api.elsevier.com/content/object/eid/1-s2.0-S0926860X22005348-ga1.jpg?httpAccept=%2A%2F%2A",
            "@multimediatype": "JPEG image file",
            "@type": "IMAGE-DOWNSAMPLED",
            "@size": "28255",
            "@ref": "ga1",
            "@mimetype": "image/jpeg"
          },
          {
            "@category": "standard",
            "@height": "319",
            "@width": "565",
            "@_fa": "true",
            "$": "https://api.elsevier.com/content/object/eid/1-s2.0-S0926860X22005348-sc1.jpg?httpAccept=%2A%2F%2A",
            "@multimediatype": "JPEG image file",
            "@type": "IMAGE-DOWNSAMPLED",
            "@size": "34877",
            "@ref": "sc1",
            "@mimetype": "image/jpeg"
          },
          {
            "@category": "thumbnail",
            "@height": "163",
            "@width": "109",
            "@_fa": "true",
            "$": "https://api.elsevier.com/content/object/eid/1-s2.0-S0926860X22005348-gr4.sml?httpAccept=%2A%2F%2A",
            "@multimediatype": "GIF image file",
            "@type": "IMAGE-THUMBNAIL",
            "@size": "11459",
            "@ref": "gr4",
            "@mimetype": "image/gif"
          },
          {
            "@category": "thumbnail",
            "@height": "56",
            "@width": "219",
            "@_fa": "true",
            "$": "https://api.elsevier.com/content/object/eid/1-s2.0-S0926860X22005348-gr3.sml?httpAccept=%2A%2F%2A",
            "@multimediatype": "GIF image file",
            "@type": "IMAGE-THUMBNAIL",
            "@size": "5856",
            "@ref": "gr3",
            "@mimetype": "image/gif"
          },
          {
            "@category": "thumbnail",
            "@height": "163",
            "@width": "116",
            "@_fa": "true",
            "$": "https://api.elsevier.com/content/object/eid/1-s2.0-S0926860X22005348-gr2.sml?httpAccept=%2A%2F%2A",
            "@multimediatype": "GIF image file",
            "@type": "IMAGE-THUMBNAIL",
            "@size": "13879",
            "@ref": "gr2",
            "@mimetype": "image/gif"
          },
          {
            "@category": "thumbnail",
            "@height": "87",
            "@width": "219",
            "@_fa": "true",
            "$": "https://api.elsevier.com/content/object/eid/1-s2.0-S0926860X22005348-gr11.sml?httpAccept=%2A%2F%2A",
            "@multimediatype": "GIF image file",
            "@type": "IMAGE-THUMBNAIL",
            "@size": "5069",
            "@ref": "gr11",
            "@mimetype": "image/gif"
          },
          {
            "@category": "thumbnail",
            "@height": "164",
            "@width": "181",
            "@_fa": "true",
            "$": "https://api.elsevier.com/content/object/eid/1-s2.0-S0926860X22005348-gr1.sml?httpAccept=%2A%2F%2A",
            "@multimediatype": "GIF image file",
            "@type": "IMAGE-THUMBNAIL",
            "@size": "5998",
            "@ref": "gr1",
            "@mimetype": "image/gif"
          },
          {
            "@category": "thumbnail",
            "@height": "109",
            "@width": "219",
            "@_fa": "true",
            "$": "https://api.elsevier.com/content/object/eid/1-s2.0-S0926860X22005348-gr10.sml?httpAccept=%2A%2F%2A",
            "@multimediatype": "GIF image file",
            "@type": "IMAGE-THUMBNAIL",
            "@size": "14023",
            "@ref": "gr10",
            "@mimetype": "image/gif"
          },
          {
            "@category": "thumbnail",
            "@height": "164",
            "@width": "186",
            "@_fa": "true",
            "$": "https://api.elsevier.com/content/object/eid/1-s2.0-S0926860X22005348-gr8.sml?httpAccept=%2A%2F%2A",
            "@multimediatype": "GIF image file",
            "@type": "IMAGE-THUMBNAIL",
            "@size": "6135",
            "@ref": "gr8",
            "@mimetype": "image/gif"
          },
          {
            "@category": "thumbnail",
            "@height": "164",
            "@width": "180",
            "@_fa": "true",
            "$": "https://api.elsevier.com/content/object/eid/1-s2.0-S0926860X22005348-gr7.sml?httpAccept=%2A%2F%2A",
            "@multimediatype": "GIF image file",
            "@type": "IMAGE-THUMBNAIL",
            "@size": "5067",
            "@ref": "gr7",
            "@mimetype": "image/gif"
          },
          {
            "@category": "thumbnail",
            "@height": "164",
            "@width": "181",
            "@_fa": "true",
            "$": "https://api.elsevier.com/content/object/eid/1-s2.0-S0926860X22005348-gr6.sml?httpAccept=%2A%2F%2A",
            "@multimediatype": "GIF image file",
            "@type": "IMAGE-THUMBNAIL",
            "@size": "5139",
            "@ref": "gr6",
            "@mimetype": "image/gif"
          },
          {
            "@category": "thumbnail",
            "@height": "115",
            "@width": "219",
            "@_fa": "true",
            "$": "https://api.elsevier.com/content/object/eid/1-s2.0-S0926860X22005348-gr5.sml?httpAccept=%2A%2F%2A",
            "@multimediatype": "GIF image file",
            "@type": "IMAGE-THUMBNAIL",
            "@size": "7275",
            "@ref": "gr5",
            "@mimetype": "image/gif"
          },
          {
            "@category": "thumbnail",
            "@height": "95",
            "@width": "219",
            "@_fa": "true",
            "$": "https://api.elsevier.com/content/object/eid/1-s2.0-S0926860X22005348-gr9.sml?httpAccept=%2A%2F%2A",
            "@multimediatype": "GIF image file",
            "@type": "IMAGE-THUMBNAIL",
            "@size": "5789",
            "@ref": "gr9",
            "@mimetype": "image/gif"
          },
          {
            "@category": "thumbnail",
            "@height": "90",
            "@width": "219",
            "@_fa": "true",
            "$": "https://api.elsevier.com/content/object/eid/1-s2.0-S0926860X22005348-ga1.sml?httpAccept=%2A%2F%2A",
            "@multimediatype": "GIF image file",
            "@type": "IMAGE-THUMBNAIL",
            "@size": "7583",
            "@ref": "ga1",
            "@mimetype": "image/gif"
          },
          {
            "@category": "thumbnail",
            "@height": "124",
            "@width": "219",
            "@_fa": "true",
            "$": "https://api.elsevier.com/content/object/eid/1-s2.0-S0926860X22005348-sc1.sml?httpAccept=%2A%2F%2A",
            "@multimediatype": "GIF image file",
            "@type": "IMAGE-THUMBNAIL",
            "@size": "5967",
            "@ref": "sc1",
            "@mimetype": "image/gif"
          },
          {
            "@category": "high",
            "@height": "3735",
            "@width": "2495",
            "@_fa": "true",
            "$": "https://api.elsevier.com/content/object/eid/1-s2.0-S0926860X22005348-gr4_lrg.jpg?httpAccept=%2A%2F%2A",
            "@multimediatype": "JPEG image file",
            "@type": "IMAGE-HIGH-RES",
            "@size": "1437458",
            "@ref": "gr4",
            "@mimetype": "image/jpeg"
          },
          {
            "@category": "high",
            "@height": "626",
            "@width": "2459",
            "@_fa": "true",
            "$": "https://api.elsevier.com/content/object/eid/1-s2.0-S0926860X22005348-gr3_lrg.jpg?httpAccept=%2A%2F%2A",
            "@multimediatype": "JPEG image file",
            "@type": "IMAGE-HIGH-RES",
            "@size": "156424",
            "@ref": "gr3",
            "@mimetype": "image/jpeg"
          },
          {
            "@category": "high",
            "@height": "3506",
            "@width": "2495",
            "@_fa": "true",
            "$": "https://api.elsevier.com/content/object/eid/1-s2.0-S0926860X22005348-gr2_lrg.jpg?httpAccept=%2A%2F%2A",
            "@multimediatype": "JPEG image file",
            "@type": "IMAGE-HIGH-RES",
            "@size": "832747",
            "@ref": "gr2",
            "@mimetype": "image/jpeg"
          },
          {
            "@category": "high",
            "@height": "996",
            "@width": "2495",
            "@_fa": "true",
            "$": "https://api.elsevier.com/content/object/eid/1-s2.0-S0926860X22005348-gr11_lrg.jpg?httpAccept=%2A%2F%2A",
            "@multimediatype": "JPEG image file",
            "@type": "IMAGE-HIGH-RES",
            "@size": "177968",
            "@ref": "gr11",
            "@mimetype": "image/jpeg"
          },
          {
            "@category": "high",
            "@height": "1505",
            "@width": "1663",
            "@_fa": "true",
            "$": "https://api.elsevier.com/content/object/eid/1-s2.0-S0926860X22005348-gr1_lrg.jpg?httpAccept=%2A%2F%2A",
            "@multimediatype": "JPEG image file",
            "@type": "IMAGE-HIGH-RES",
            "@size": "149203",
            "@ref": "gr1",
            "@mimetype": "image/jpeg"
          },
          {
            "@category": "high",
            "@height": "1246",
            "@width": "2495",
            "@_fa": "true",
            "$": "https://api.elsevier.com/content/object/eid/1-s2.0-S0926860X22005348-gr10_lrg.jpg?httpAccept=%2A%2F%2A",
            "@multimediatype": "JPEG image file",
            "@type": "IMAGE-HIGH-RES",
            "@size": "372078",
            "@ref": "gr10",
            "@mimetype": "image/jpeg"
          },
          {
            "@category": "high",
            "@height": "1320",
            "@width": "1497",
            "@_fa": "true",
            "$": "https://api.elsevier.com/content/object/eid/1-s2.0-S0926860X22005348-gr8_lrg.jpg?httpAccept=%2A%2F%2A",
            "@multimediatype": "JPEG image file",
            "@type": "IMAGE-HIGH-RES",
            "@size": "128319",
            "@ref": "gr8",
            "@mimetype": "image/jpeg"
          },
          {
            "@category": "high",
            "@height": "2269",
            "@width": "2495",
            "@_fa": "true",
            "$": "https://api.elsevier.com/content/object/eid/1-s2.0-S0926860X22005348-gr7_lrg.jpg?httpAccept=%2A%2F%2A",
            "@multimediatype": "JPEG image file",
            "@type": "IMAGE-HIGH-RES",
            "@size": "254176",
            "@ref": "gr7",
            "@mimetype": "image/jpeg"
          },
          {
            "@category": "high",
            "@height": "1353",
            "@width": "1497",
            "@_fa": "true",
            "$": "https://api.elsevier.com/content/object/eid/1-s2.0-S0926860X22005348-gr6_lrg.jpg?httpAccept=%2A%2F%2A",
            "@multimediatype": "JPEG image file",
            "@type": "IMAGE-HIGH-RES",
            "@size": "110812",
            "@ref": "gr6",
            "@mimetype": "image/jpeg"
          },
          {
            "@category": "high",
            "@height": "1330",
            "@width": "2522",
            "@_fa": "true",
            "$": "https://api.elsevier.com/content/object/eid/1-s2.0-S0926860X22005348-gr5_lrg.jpg?httpAccept=%2A%2F%2A",
            "@multimediatype": "JPEG image file",
            "@type": "IMAGE-HIGH-RES",
            "@size": "267024",
            "@ref": "gr5",
            "@mimetype": "image/jpeg"
          },
          {
            "@category": "high",
            "@height": "1077",
            "@width": "2495",
            "@_fa": "true",
            "$": "https://api.elsevier.com/content/object/eid/1-s2.0-S0926860X22005348-gr9_lrg.jpg?httpAccept=%2A%2F%2A",
            "@multimediatype": "JPEG image file",
            "@type": "IMAGE-HIGH-RES",
            "@size": "219590",
            "@ref": "gr9",
            "@mimetype": "image/jpeg"
          },
          {
            "@category": "high",
            "@height": "886",
            "@width": "2150",
            "@_fa": "true",
            "$": "https://api.elsevier.com/content/object/eid/1-s2.0-S0926860X22005348-ga1_lrg.jpg?httpAccept=%2A%2F%2A",
            "@multimediatype": "JPEG image file",
            "@type": "IMAGE-HIGH-RES",
            "@size": "194232",
            "@ref": "ga1",
            "@mimetype": "image/jpeg"
          },
          {
            "@category": "high",
            "@height": "1410",
            "@width": "2495",
            "@_fa": "true",
            "$": "https://api.elsevier.com/content/object/eid/1-s2.0-S0926860X22005348-sc1_lrg.jpg?httpAccept=%2A%2F%2A",
            "@multimediatype": "JPEG image file",
            "@type": "IMAGE-HIGH-RES",
            "@size": "203530",
            "@ref": "sc1",
            "@mimetype": "image/jpeg"
          },
          {
            "@category": "standard",
            "@_fa": "true",
            "$": "https://api.elsevier.com/content/object/eid/1-s2.0-S0926860X22005348-mmc1.doc?httpAccept=%2A%2F%2A",
            "@multimediatype": "Microsoft Word file",
            "@type": "APPLICATION",
            "@size": "2892800",
            "@ref": "mmc1",
            "@mimetype": "application/word"
          },
          {
            "@category": "standard",
            "@_fa": "true",
            "$": "https://api.elsevier.com/content/object/eid/1-s2.0-S0926860X22005348-am.pdf?httpAccept=%2A%2F%2A",
            "@multimediatype": "Acrobat PDF file",
            "@type": "AAM-PDF",
            "@size": "2533782",
            "@ref": "am",
            "@mimetype": "application/pdf"
          }
        ]
      },
      "link": {
        "@rel": "abstract",
        "@href": "https://api.elsevier.com/content/abstract/scopus_id/85147214137"
      }
    }
  }
}