{
  "metadata": {
    "title": "Thermo-responsive polymer grafted carbon nanotubes as the catalyst support for selective hydrogenation of cinnamaldehyde: Effects of surface chemistry on catalytic performance",
    "authors": "; ; ",
    "journal": "Applied Catalysis A: General",
    "date": "2019-04-05",
    "doi": "10.1016/j.apcata.2019.02.009",
    "abstract": "",
    "uri": "https://api.elsevier.com/content/article/pii/S0926860X1930064X",
    "pii": "S0926860X1930064X"
  },
  "fulltext": {
    "full-text-retrieval-response": {
      "scopus-eid": "2-s2.0-85061361857",
      "originalText": "serial JL 271346 291210 291744 291809 31 Applied Catalysis A: General APPLIEDCATALYSISAGENERAL 2019-02-07 2019-02-07 2019-02-13 2019-02-13 2019-03-13T08:52:49 1-s2.0-S0926860X1930064X S0926-860X(19)30064-X S0926860X1930064X 10.1016/j.apcata.2019.02.009 S300 S300.1 FULL-TEXT 1-s2.0-S0926860X19X00046 2024-01-01T12:33:10.553292Z 0 0 20190405 2019 2019-02-07T17:26:40.687151Z absattachment articleinfo articletitlenorm authfirstinitialnorm authfirstsurnamenorm cid cids contenttype copyright crossmark dateloaded dateloadedtxt datesearch datesort dateupdated dco docsubtype doctype doi eid ewtransactionid hubeid indexeddate issn issnnorm itemstage itemtransactionid itemweight openaccess openarchive pg pgfirst pglast pii piinorm pubdatestart pubdatetxt pubyr sectiontitle sortorder srctitle srctitlenorm srctype ssids alllist content subj subheadings suppl tomb volfirst volissue volumelist webpdf webpdfpagecount yearnav figure table e-component body mmlmath acknowledge affil appendices articletitle auth authfirstini authfull authkeywords authlast grantnumber grantsponsor grantsponsorid highlightsabst orcid primabst ref specialabst 0926-860X 0926860X true 575 575 C Volume 575 5 11 19 11 19 20190405 5 April 2019 2019-04-05 2019 Regular Papers article fla © 2019 Elsevier B.V. All rights reserved. THERMORESPONSIVEPOLYMERGRAFTEDCARBONNANOTUBESCATALYSTSUPPORTFORSELECTIVEHYDROGENATIONCINNAMALDEHYDEEFFECTSSURFACECHEMISTRYCATALYTICPERFORMANCE ZHU J 1 Introduction 2 Experimental 2.1 Synthesis of PNIPAM brushes on CNT surface (CNT-PNIPAM hybrid) 2.2 Preparation of CNT-PNIPAM supported palladium (Pd) catalysts (Pd/CNT-PNIPAM) 2.3 Characterization of catalysts and supports 2.4 Catalytic performance on selective hydrogenation of cinnamaldehyde 2.5 Calculation of initial reaction rate in turnover frequency (Initial TOF) 3 Results and discussion 3.1 Synthesis of PNIPAM brushes on CNTs 3.2 Thermoresponsive properties of CNT-PNIPAM 3.3 Catalytic performance of Pd/CNT-PNIPAM 3.3.1 Pd dispersion on CNT-PNIPAM 3.3.2 Catalytic activity of Pd/CNT-PNIPAM 3.3.3 Selectivity to COL over Pd/CNT-PNIPAM 3.3.4 Recycling of Pd/CNT-PNIPAM 4 Conclusions Acknowledgements Appendix A Supplementary data References KALYON 2017 436 441 N BAILONGARCIA 2016 701 711 E ZHU 2013 737 744 J BAILONGARCIA 2013 853 877 E LI 2018 3580 3589 Y WANG 2016 8 16 Y JIANG 2016 75541 75551 F SUN 2014 1874 1878 Z GALLEZOT 1998 81 126 P HAN 2016 98356 98364 Q JI 2014 3246 3253 X SALNIKOV 2014 2022 2028 O SINGH 2001 73 84 U JIANG 2016 75541 75551 F PLOMP 2008 9 15 A WEI 2013 18 26 H ZHANG 1998 264 272 L ZHANG 2012 213 226 X BHOGESWARARAO 2012 31 40 S MANYAR 2013 506 512 H ZAERA 2017 4947 4967 F XIONG 2016 126 134 W ZHU 2013 1224 1233 J GARCIABORDEJE 2017 22408 22441 E TOEBES 2005 5682 5695 M ROEMERSVANBEEK 2018 134 140 J CHINTHAGINJALA 2010 144 149 J JUNG 2009 95 105 A NIE 2016 607 613 R WANG 2014 4143 4148 Y CHEN 2013 8973 8977 A QI 2013 6275 6279 J WANG 2017 5088 5097 D SUI 2011 1440 1447 X SONG 2006 327 331 W DUTTA 2017 22095 22112 K HAPIOT 2013 1006 1010 F DONG 2017 60 67 Y ZHANG 2013 29 35 J WANG 2015 158 164 Q YU 2015 8508 8516 Y GONG 2016 459 468 Z BAK 2012 316 323 J FAN 2018 130 138 M ARRIGO 2015 2740 2753 R CUI 2018 1121 1130 X ZHUX2019X11 ZHUX2019X11X19 ZHUX2019X11XJ ZHUX2019X11X19XJ 2021-02-13T00:00:00.000Z 2021-02-13T00:00:00.000Z http://creativecommons.org/licenses/by-nc-nd/4.0/ © 2019 Elsevier B.V. All rights reserved. item S0926-860X(19)30064-X S0926860X1930064X 1-s2.0-S0926860X1930064X 10.1016/j.apcata.2019.02.009 271346 2024-01-01T12:33:10.553292Z 2019-04-05 1-s2.0-S0926860X1930064X-main.pdf https://s3.amazonaws.com/prod-ucs-content-store-us-east/content/pii:S0926860X1930064X/MAIN/application/pdf/cd42796d6ebe4eaf2ad5f50eaba2a3fd/main.pdf main.pdf pdf true 2321987 MAIN 9 1-s2.0-S0926860X1930064X-main_1.png https://s3.amazonaws.com/prod-ucs-content-store-us-east/content/pii:S0926860X1930064X/PREVIEW/image/png/987e8a359b083b4dab2f10d734469055/main_1.png main_1.png png 54914 849 656 IMAGE-WEB-PDF 1 1-s2.0-S0926860X1930064X-ga1.sml https://s3.amazonaws.com/prod-ucs-content-store-us-east/content/pii:S0926860X1930064X/ga1/THUMBNAIL/image/gif/6438e709e27c84a96f6291f5bef5fb8e/ga1.sml ga1 true ga1.sml sml 5753 60 219 IMAGE-THUMBNAIL 1-s2.0-S0926860X1930064X-gr1.sml https://s3.amazonaws.com/prod-ucs-content-store-us-east/content/pii:S0926860X1930064X/gr1/THUMBNAIL/image/gif/2f95aae4ba02e0e7af8660e47fb7bba8/gr1.sml gr1 gr1.sml sml 3682 96 219 IMAGE-THUMBNAIL 1-s2.0-S0926860X1930064X-gr10.sml https://s3.amazonaws.com/prod-ucs-content-store-us-east/content/pii:S0926860X1930064X/gr10/THUMBNAIL/image/gif/f7cb4203fb92dfb0f85b4ffdf71112c3/gr10.sml gr10 gr10.sml sml 5940 163 124 IMAGE-THUMBNAIL 1-s2.0-S0926860X1930064X-gr11.sml https://s3.amazonaws.com/prod-ucs-content-store-us-east/content/pii:S0926860X1930064X/gr11/THUMBNAIL/image/gif/f91b297da710fc86aceb651f6d20207c/gr11.sml gr11 gr11.sml sml 8523 164 202 IMAGE-THUMBNAIL 1-s2.0-S0926860X1930064X-gr2.sml https://s3.amazonaws.com/prod-ucs-content-store-us-east/content/pii:S0926860X1930064X/gr2/THUMBNAIL/image/gif/4a1605d190c51879ae50dcbeff5b051d/gr2.sml gr2 gr2.sml sml 9252 162 219 IMAGE-THUMBNAIL 1-s2.0-S0926860X1930064X-gr3.sml https://s3.amazonaws.com/prod-ucs-content-store-us-east/content/pii:S0926860X1930064X/gr3/THUMBNAIL/image/gif/c31356b1764a8e509f4f5054b57f8b6b/gr3.sml gr3 gr3.sml sml 9841 164 210 IMAGE-THUMBNAIL 1-s2.0-S0926860X1930064X-gr4.sml https://s3.amazonaws.com/prod-ucs-content-store-us-east/content/pii:S0926860X1930064X/gr4/THUMBNAIL/image/gif/7e8985e4a02c9b3cd67cc5efee959bf4/gr4.sml gr4 gr4.sml sml 7764 164 124 IMAGE-THUMBNAIL 1-s2.0-S0926860X1930064X-gr5.sml https://s3.amazonaws.com/prod-ucs-content-store-us-east/content/pii:S0926860X1930064X/gr5/THUMBNAIL/image/gif/99d96230a4a67b6d300a209644b91ef6/gr5.sml gr5 gr5.sml sml 10303 160 219 IMAGE-THUMBNAIL 1-s2.0-S0926860X1930064X-gr6.sml https://s3.amazonaws.com/prod-ucs-content-store-us-east/content/pii:S0926860X1930064X/gr6/THUMBNAIL/image/gif/97c77b2669b1556ff714df7c8ff1b8e0/gr6.sml gr6 gr6.sml sml 12331 101 219 IMAGE-THUMBNAIL 1-s2.0-S0926860X1930064X-gr7.sml https://s3.amazonaws.com/prod-ucs-content-store-us-east/content/pii:S0926860X1930064X/gr7/THUMBNAIL/image/gif/a0cc2cf0ea3b2e7a7339c402e9aa6a40/gr7.sml gr7 gr7.sml sml 14748 163 161 IMAGE-THUMBNAIL 1-s2.0-S0926860X1930064X-gr8.sml https://s3.amazonaws.com/prod-ucs-content-store-us-east/content/pii:S0926860X1930064X/gr8/THUMBNAIL/image/gif/09140905f936ed6f28134fb822d21e05/gr8.sml gr8 gr8.sml sml 7584 87 219 IMAGE-THUMBNAIL 1-s2.0-S0926860X1930064X-gr9.sml https://s3.amazonaws.com/prod-ucs-content-store-us-east/content/pii:S0926860X1930064X/gr9/THUMBNAIL/image/gif/80d886fd5021cd9864af718fdd63436b/gr9.sml gr9 gr9.sml sml 6745 85 219 IMAGE-THUMBNAIL 1-s2.0-S0926860X1930064X-ga1.jpg https://s3.amazonaws.com/prod-ucs-content-store-us-east/content/pii:S0926860X1930064X/ga1/DOWNSAMPLED/image/jpeg/760755184e6030ed9fa335e7118a1f34/ga1.jpg ga1 true ga1.jpg jpg 22665 137 500 IMAGE-DOWNSAMPLED 1-s2.0-S0926860X1930064X-gr1.jpg https://s3.amazonaws.com/prod-ucs-content-store-us-east/content/pii:S0926860X1930064X/gr1/DOWNSAMPLED/image/jpeg/4f2c34625006b58eb81416ac917671ad/gr1.jpg gr1 gr1.jpg jpg 14648 166 378 IMAGE-DOWNSAMPLED 1-s2.0-S0926860X1930064X-gr10.jpg https://s3.amazonaws.com/prod-ucs-content-store-us-east/content/pii:S0926860X1930064X/gr10/DOWNSAMPLED/image/jpeg/6e8348a7babacc48e0eb503c7106b9e3/gr10.jpg gr10 gr10.jpg jpg 74128 640 487 IMAGE-DOWNSAMPLED 1-s2.0-S0926860X1930064X-gr11.jpg https://s3.amazonaws.com/prod-ucs-content-store-us-east/content/pii:S0926860X1930064X/gr11/DOWNSAMPLED/image/jpeg/9ece6b296ed27a92b64d70a8cdab7b1f/gr11.jpg gr11 gr11.jpg jpg 17980 257 317 IMAGE-DOWNSAMPLED 1-s2.0-S0926860X1930064X-gr2.jpg https://s3.amazonaws.com/prod-ucs-content-store-us-east/content/pii:S0926860X1930064X/gr2/DOWNSAMPLED/image/jpeg/5b08339d1858654a5915c1dea03907d4/gr2.jpg gr2 gr2.jpg jpg 22661 220 298 IMAGE-DOWNSAMPLED 1-s2.0-S0926860X1930064X-gr3.jpg https://s3.amazonaws.com/prod-ucs-content-store-us-east/content/pii:S0926860X1930064X/gr3/DOWNSAMPLED/image/jpeg/879275263c7974d5c0fbdd0c649c94af/gr3.jpg gr3 gr3.jpg jpg 22641 217 279 IMAGE-DOWNSAMPLED 1-s2.0-S0926860X1930064X-gr4.jpg https://s3.amazonaws.com/prod-ucs-content-store-us-east/content/pii:S0926860X1930064X/gr4/DOWNSAMPLED/image/jpeg/3ce394d4320c29085e4d22aca955b456/gr4.jpg gr4 gr4.jpg jpg 81883 644 487 IMAGE-DOWNSAMPLED 1-s2.0-S0926860X1930064X-gr5.jpg https://s3.amazonaws.com/prod-ucs-content-store-us-east/content/pii:S0926860X1930064X/gr5/DOWNSAMPLED/image/jpeg/ec01a7788e80ee49e4652cecdf74175c/gr5.jpg gr5 gr5.jpg jpg 22244 205 280 IMAGE-DOWNSAMPLED 1-s2.0-S0926860X1930064X-gr6.jpg https://s3.amazonaws.com/prod-ucs-content-store-us-east/content/pii:S0926860X1930064X/gr6/DOWNSAMPLED/image/jpeg/f3f0cd03bded071bc14b17e0a56188fc/gr6.jpg gr6 gr6.jpg jpg 27723 227 491 IMAGE-DOWNSAMPLED 1-s2.0-S0926860X1930064X-gr7.jpg https://s3.amazonaws.com/prod-ucs-content-store-us-east/content/pii:S0926860X1930064X/gr7/DOWNSAMPLED/image/jpeg/91c82ad94e6e3043af8fff29c579af3e/gr7.jpg gr7 gr7.jpg jpg 100169 517 510 IMAGE-DOWNSAMPLED 1-s2.0-S0926860X1930064X-gr8.jpg https://s3.amazonaws.com/prod-ucs-content-store-us-east/content/pii:S0926860X1930064X/gr8/DOWNSAMPLED/image/jpeg/4baf9151cc3c1fb8ef16122610ab59c0/gr8.jpg gr8 gr8.jpg jpg 37398 194 487 IMAGE-DOWNSAMPLED 1-s2.0-S0926860X1930064X-gr9.jpg https://s3.amazonaws.com/prod-ucs-content-store-us-east/content/pii:S0926860X1930064X/gr9/DOWNSAMPLED/image/jpeg/e4dc3640055082c6b6b474dd6747a7be/gr9.jpg gr9 gr9.jpg jpg 32960 188 487 IMAGE-DOWNSAMPLED 1-s2.0-S0926860X1930064X-ga1_lrg.jpg https://s3.amazonaws.com/prod-ucs-content-store-us-east/content/pii:S0926860X1930064X/ga1/HIGHRES/image/jpeg/deb3856099b53ee7cc2dba0cccf4e5a0/ga1_lrg.jpg ga1 true ga1_lrg.jpg jpg 160001 605 2213 IMAGE-HIGH-RES 1-s2.0-S0926860X1930064X-gr1_lrg.jpg https://s3.amazonaws.com/prod-ucs-content-store-us-east/content/pii:S0926860X1930064X/gr1/HIGHRES/image/jpeg/02da5b0199157dfccea3d1422a79fbe2/gr1_lrg.jpg gr1 gr1_lrg.jpg jpg 124262 734 1675 IMAGE-HIGH-RES 1-s2.0-S0926860X1930064X-gr10_lrg.jpg https://s3.amazonaws.com/prod-ucs-content-store-us-east/content/pii:S0926860X1930064X/gr10/HIGHRES/image/jpeg/5358b52b219404edcd5d9df6e8935b0e/gr10_lrg.jpg gr10 gr10_lrg.jpg jpg 532131 2834 2156 IMAGE-HIGH-RES 1-s2.0-S0926860X1930064X-gr11_lrg.jpg https://s3.amazonaws.com/prod-ucs-content-store-us-east/content/pii:S0926860X1930064X/gr11/HIGHRES/image/jpeg/58e505577c6639c03864349ef7a6309b/gr11_lrg.jpg gr11 gr11_lrg.jpg jpg 131740 1140 1406 IMAGE-HIGH-RES 1-s2.0-S0926860X1930064X-gr2_lrg.jpg https://s3.amazonaws.com/prod-ucs-content-store-us-east/content/pii:S0926860X1930064X/gr2/HIGHRES/image/jpeg/ce47fbfa63b094f315ea267d0e448316/gr2_lrg.jpg gr2 gr2_lrg.jpg jpg 183410 977 1322 IMAGE-HIGH-RES 1-s2.0-S0926860X1930064X-gr3_lrg.jpg https://s3.amazonaws.com/prod-ucs-content-store-us-east/content/pii:S0926860X1930064X/gr3/HIGHRES/image/jpeg/deb55aedc02737459c552f432f0a8b80/gr3_lrg.jpg gr3 gr3_lrg.jpg jpg 188642 965 1238 IMAGE-HIGH-RES 1-s2.0-S0926860X1930064X-gr4_lrg.jpg https://s3.amazonaws.com/prod-ucs-content-store-us-east/content/pii:S0926860X1930064X/gr4/HIGHRES/image/jpeg/5176e343383185da6180ede732dfd96c/gr4_lrg.jpg gr4 gr4_lrg.jpg jpg 670695 2849 2156 IMAGE-HIGH-RES 1-s2.0-S0926860X1930064X-gr5_lrg.jpg https://s3.amazonaws.com/prod-ucs-content-store-us-east/content/pii:S0926860X1930064X/gr5/HIGHRES/image/jpeg/32f08cdf2d64507034f231027563a7b5/gr5_lrg.jpg gr5 gr5_lrg.jpg jpg 174607 905 1239 IMAGE-HIGH-RES 1-s2.0-S0926860X1930064X-gr6_lrg.jpg https://s3.amazonaws.com/prod-ucs-content-store-us-east/content/pii:S0926860X1930064X/gr6/HIGHRES/image/jpeg/b3e47f96bc1e57fa63a112807aae17e0/gr6_lrg.jpg gr6 gr6_lrg.jpg jpg 282983 1004 2175 IMAGE-HIGH-RES 1-s2.0-S0926860X1930064X-gr7_lrg.jpg https://s3.amazonaws.com/prod-ucs-content-store-us-east/content/pii:S0926860X1930064X/gr7/HIGHRES/image/jpeg/6b635c91d99cd707fce3c27b1099e34a/gr7_lrg.jpg gr7 gr7_lrg.jpg jpg 1475071 2291 2258 IMAGE-HIGH-RES 1-s2.0-S0926860X1930064X-gr8_lrg.jpg https://s3.amazonaws.com/prod-ucs-content-store-us-east/content/pii:S0926860X1930064X/gr8/HIGHRES/image/jpeg/2a03ee43d2a2aa2fae9dde7dd6e24f51/gr8_lrg.jpg gr8 gr8_lrg.jpg jpg 293316 861 2156 IMAGE-HIGH-RES 1-s2.0-S0926860X1930064X-gr9_lrg.jpg https://s3.amazonaws.com/prod-ucs-content-store-us-east/content/pii:S0926860X1930064X/gr9/HIGHRES/image/jpeg/a9f96a7708f01daf5fc91a2b71c367b1/gr9_lrg.jpg gr9 gr9_lrg.jpg jpg 260536 834 2158 IMAGE-HIGH-RES 1-s2.0-S0926860X1930064X-mmc1.doc https://s3.amazonaws.com/prod-ucs-content-store-us-east/content/pii:S0926860X1930064X/mmc1/MAIN/application/msword/7608431364a3caa8fb14e877b1933a35/mmc1.doc mmc1 mmc1.doc doc 2965504 APPLICATION 1-s2.0-S0926860X1930064X-si1.gif https://s3.amazonaws.com/prod-ucs-content-store-us-east/content/pii:S0926860X1930064X/STRIPIN/image/gif/3a2b8c702296d7a7a9fd2e51654fd210/si1.gif si1 si1.gif gif 1099 38 358 ALTIMG 1-s2.0-S0926860X1930064X-am.pdf https://s3-eu-west-1.amazonaws.com/prod-ucs-content-store-eu-west/content/egi:10S8101LX52/MAIN/application/pdf/76c255cc5556da6c20b21576a391743e/am.pdf https://s3.amazonaws.com/prod-ucs-content-store-us-east/content/egi:10S8101LX52/MAIN/application/pdf/76c255cc5556da6c20b21576a391743e/am.pdf am am.pdf pdf false 4431647 AAM-PDF APCATA 16979 S0926-860X(19)30064-X 10.1016/j.apcata.2019.02.009 Elsevier B.V. Fig. 1 Consecutive reaction pathway of cinnamaldehyde hydrogenation. Fig. 1 Fig. 2 FT-IR spectra of CNT (a) and CNT-PNIPAM (b). Fig. 2 Fig. 3 Raman spectra of CNT, CNT-A and CNT-PNIPAM. Fig. 3 Fig. 4 XPS spectrum of CNT materials and supported Pd catalysts: C1s spectra of CNT (a), CNT-A (b) and CNT-PNIPAM (C); Pd3d spectra of Pd/CNT (d) and Pd/CNT-PNIPAM (LH) (e). Fig. 4 Fig. 5 TG curves of CNT (a), CNT-A (b), CNT-PNIPAM (c) and Pd/CNT-PNIPM-R (d). Fig. 5 Fig. 6 Water contact angles of CNT and CNT-PNIPAM at different temperatures: (a) CNT at 25 °C; (b) CNT at 50 °C; (c) CNT-PNIPAM at 25 °C; (d) CNT-PNIPAM at 50 °C. Fig. 6 Fig. 7 TEM images of Pd/CNT (a), Pd/CNT (A) (b), Pd/CNT-PNIPAM (L) (c), Pd/CNT-PNIPAM (H) (d) and Pd/CNT-PNIPAM (LH) (e). Fig. 7 Fig. 8 CAL conversion versus reaction time over Pd/CNT and Pd/CNT-PNIPAM at different reaction temperatures in CAL hydrogenation: (a) 30 °C; (b) 80 °C. Fig. 8 Fig. 9 Reaction rate constants for CAL hydrogenation over Pd/CNT and Pd/CNT-PNIPAM at 30 °C (a) and 80 °C (b). Fig. 9 Fig. 10 Product distribution versus CAL conversion in selective hydrogenation of CAL 80 °C over Pd/CNT (a), Pd/CNT(A) (b), Pd/CNT-PNIPAM (L) (c), Pd/CNT-PNIPAM (LH) (d) and Pd/CNT-PNIPAM (H) (e). Fig. 10 Fig. 11 Recycling of Pd/CNT-PNIPAM (LH) across 5 runs at 80 °C and 3 MPa H2 pressure. Fig. 11 Table 1 Textural properties of CNT materials and supported Pd catalysts. Table 1 Sample BET Surface Area(m2/g) Micropore Area(m2/g) Average Pore diameter(nm) CNT 217 32 13.1 CNT-A 221 28 14.5 CNT-PNIPAM 192 21 17.4 Pd/CNT a 215 29 14.3 Pd/CNT (A) a 227 25 15.4 Pd/CNT-PNIPAM (L) a 187 17 18.1 Pd/CNT-PNIPAM (H) b 196 17 17.6 Pd/CNT-PNIPAM (LH) c 191 21 18.4 Note: (a) Prepared by impregnating and reducing Pd precursors at the room temperature (< LCST); (b) Prepared by impregnating and reducing Pd precursors at 50 °C; (C) Prepared by impregnating and reducing half of Pd precursors at the room temperature (< LCST) first and then the other half at 50 °C; Table 2 Pd properties over catalysts and initial TOFs in CAL hydrogenation at 80 °C. Table 2 Sample Actual Pd loading(wt. %) a Average Pd size (nm) b Pd dispersion(%) c Initial TOF(min−1) d Pd/CNT 1.02 10.7 ± 3.0 12.1 ± 3.5 26.3 ± 7.9 Pd/CNT (A) 0.96 4.6 ± 0.8 26.2 ± 3.6 35.4 ± 4.9 Pd/CNT-PNIPAM (L) 1.04 3.6 ± 0.8 34.9 ± 7.8 13.3 ± 3.0 Pd/CNT-PNIPAM (H) 0.98 4.5 ± 1.0 27.9 ± 6.4 29.3 ± 6.9 Pd/CNT-PNIPAM (LH) 0.98 4.0 ± 0.6 30.8 ± 4.7 33.6 ± 5.2 Note: (a) Determined with ICP-AES; (b) Randomly measured 50 Pd nanoparticles in TEM images (Fig. 7) and calculated their average sizes as well as standard deviations (Statistical charts shown in Figure S5 in ESI); (c) Based on the hemispherical model of metal particles on surface of the catalyst; (d) calculated using Eq. (3). Thermo-responsive polymer grafted carbon nanotubes as the catalyst support for selective hydrogenation of cinnamaldehyde: Effects of surface chemistry on catalytic performance Jie Zhu a Mengdi Dou a Mohong Lu a Xu Xiang b Xuejie Ding a Wenxin Liu a Mingshi Li a ⁎ a Jiangsu Key Laboratory of Advanced Catalytic Materials and Technology, Advanced Catalysis and Green Manufacturing Collaborative Innovation Center, and School of Petrochemical Engineering, Changzhou University, Changzhou, 213164, China Jiangsu Key Laboratory of Advanced Catalytic Materials and Technology Advanced Catalysis and Green Manufacturing Collaborative Innovation Center and School of Petrochemical Engineering Changzhou University Changzhou 213164 China b State Key Laboratory of Chemical Resource Engineering, Beijing University of Chemical Technology, Beijing, 100029, China State Key Laboratory of Chemical Resource Engineering Beijing University of Chemical Technology Beijing 100029 China ⁎ Corresponding author. Graphical abstract A wettability-controllable surface on carbon nanotubes (CNTs) was successfully constructed through directly grafting poly(N-isopropylacrylamide) (PNIPAM) from CNT surface (i.e. CNT-PNIPAM) via a facile method. The hybrid was employed as the support to prepare Pd catalyst (i.e. Pd/CNT-PNIPAM) for selective hydrogenation of cinnamaldehyde (CAL). The effects of thermoresponsive surface chemistry on catalytic performance were studied. Results showed that CNT-PNIPAM had the lower critical solution temperature (LCST) at about 37 °C. The hydrophilic surface of CNT-PNIPAM at 25 °C (< LCST) improved the dispersion of Pd nanoparticles on it in catalyst preparation. As-prepared Pd/CNT-PNIPAM then automatically switched its hydrophilic surface to the hydrophobic one at 80 °C (>LCST), which exhibited the good adsorption properties for reactants in the reaction. The high Pd dispersion on Pd/CNT-PNIPAM as well as its good adsorption properties for CAL jointly resulted in an enhanced catalytic activity, meanwhile maintaining the selectivity to cinnamyl alcohol (COL) unchanged in comparison to CNT supported Pd catalyst (Pd/CNT). Keywords Thermoresponsive smart surface PNIPAM Carbon nanotube Selective hydrogenation Cinnamaldehyde 1 Introduction Selective hydrogenation of α,β-unsaturated aldehydes (e.g. citral and cinnamaldehyde) is practically important and also challenging for both fundamental and practical points of view due to their complex reaction pathways and resulting various products [1–8]. Cinnamaldehyde (CAL) hydrogenation, for example, can produce useful unsaturated intermediates including CO hydrogenated cinnamyl alcohol (COL) and CC hydrogenated hydrocinnamic aldeyde (HCAL) for pharmaceutical and fragrance industries [9,10]. COL and HCAL may further be hydrogenated to hydrocinnamic alcohol (HCOL) as the final product (Fig. 1 ). Undoubtedly, fast reaction rate as well as high selectivity to desired product is always what we expect in selective hydrogenation. For this purpose, several important factors affecting the reaction rate and the product selectivity have been studied over the past decades, such as active metal [9,11–13], metal particle size [14–16], solvent effect [5,17] and particularly catalyst support and its surface chemistry [6,8,18–23]. Surface chemistry of a supported catalyst mainly influences the catalytic performance in selective hydrogenation via dispersion of active site, adsorption ability to reactants and their adsorption mode on catalyst [6,8]. Carbon nanomaterials (CNMs) such as carbon nanotubes (CNTs) and graphene are proved the promising supports for metal nanoparticles towards selective hydrogenation [24,25]. Besides some excellent characteristics including strong resistance to acids and bases, large surface area, high mechanical strength and minimal mass transfer limitations [10,11,25–28], CNMs possess exceptional surface chemical properties such as hydrophobic surface and good electronic transfer property, which favor the adsorption of organic compounds with weak polarity on its surface, enhancing the reaction rate. In addition, the different adsorption mode depending on CNM surface chemistry often leads to the different product selectivity as well. Jung et al. [28] and Ji et al. [11], for example, deposited Pt nanoparticles on the surface of CNTs and graphene, respectively. The resulting catalysts exhibited high catalytic activities, thanks to the strong π-π interactions between CAL and sp2-bonded surface of CNM supports. Furthermore, enhanced π−CO back bonding adsorption mode of CAL on metal nanoparticles increased the probability of the hydrogenation of CO bond, resulting in the high selectivity to COL. However, hydrophobic nature of CNM hampers high dispersion of metal nanoparticles on its surface, using conventional aqueous wetness impregnation technique in catalyst preparation. Therefore, CNM supported catalyst is typically prepared through a two-step process. It is firstly oxidized with concentrated sulfuric acid, nitrate acid and other strong oxidants to introduce some functional groups (e.g. carboxyl and hydroxyl groups) on its surface to increase anchoring sites for improving dispersion of metal nanoparticles on it. After impregnation of metal precursors and the following reduction, extra hydrophilic groups on the catalyst are further removed by chemical reduction or heat treatment with inert gases to recover its hydrophobic surface for the subsequent organic reactions [15,29]. Clearly, this treatment process brings about tedious operations. Hence, constructing a wettability-controllable surface (i.e. smart surface) on CNM is an efficient solution we are seeking for to achieve high catalytic performance in selective hydrogenation [30–33]. Poly(N-isopropylacrylamide) (PNIPAM), a well-known thermosensitive polymer, is a promising candidate to construct “smart surface” on catalyst. In this mechanism, CNM possessing thermosensitive smart surface exhibits an extended conformation in aqueous solution if ambient temperature is below its lower critical solution temperature (LCST) at about 32 °C, which gives a hydrophilic surface; while it curls to a compressed coil if ambient temperature ascends to above LCST, resulting in a hydrophobic one. At present, thermosensitive ploymer has achieved wide applications in many fields such as cell adhesives [34], controllable water permeation [35,36] and very recently catalysis [31,37–40]. Chen et al. [31], for example, prepared a graphene supported Au nanocatalyst with thermo-sensitive surface. It showed a thermo-controlled catalytic behavior with different catalytic activities in the reduction of 4-nitrophenol at different temperature windows (below or over 33–34 °C). Herein, we directly grafted PNIPAM brushes from CNT surface via a facile method, using persulfate as polymerization initiator. The resulting thermo-responsive CNT-PNIPAM hybrid was employed to prepare Pd catalyst (Pd/CNT-PNIPAM) for selective hydrogenation of CAL. Effects of catalyst surface chemistry on catalytic performance were discussed in this work. Compared to CNTs supported Pd catalyst (Pd/CNT), thermoresponsive Pd/CNT-PNIPAM exhibited an enhanced catalytic activity, meanwhile keeping the selectivity to COL unchanged. Obviously, the synthesized thermo-responsive CNT-PNIPAM is an efficient and competitive catalyst support for selective hydrogenation. 2 Experimental 2.1 Synthesis of PNIPAM brushes on CNT surface (CNT-PNIPAM hybrid) Before polymerization, the monomer N-isopropylacrylamide (NIPAM, Aladdin, 98%) was purified by recrystallization twice from hexane, and dried under vacuum for 48 h at room temperature. In addition, CNTs were purchased from Heng Qiu Technologies, Suzhou, China. (1) Acidification of CNT surface Piranha solution (H2SO4: H2O2 = 3 : 1, v/v) was employed to produce hydroxyl groups (−OH) on CNT surface for the further grafting of polymers on it. Specifically, 1.0 g of CNTs was dispersed in 60 ml of piranha solution and kept stirring at 80 °C for 2 h. After that, CNTs was rinsed extensively with water and dried overnight. The resultant CNTs was labelled as CNT-A. The amount of hydroxyl groups on CNT-A surface was measured by ion exchange capacity. (2) Grafting of PNIPAM on CNT-A NPIAM (0.80 g) was firstly dissolved in distilled water (40.0 ml), followed by CNT-A (0.50 g) dispersion in it. Then, 4 ml of aqueous solution of ammonium persulfate (APS, Aladdin, ≥ 98%) with the concentration at 1.4 wt. % was dropped in it and kept stirring at 80 °C for 8 h under argon protection. The obtained hybrid was named CNT-PNIPAM. 2.2 Preparation of CNT-PNIPAM supported palladium (Pd) catalysts (Pd/CNT-PNIPAM) A series of Pd catalysts supported on CNTs (Pd/CNT-PNIPAM) were prepared via impregnation-reduction method in aqueous medium using KBH4 as the reducing agent. Specifically, CNT-PNIPAM (1.0 g) was impregnated with 200 ml of aqueous solution of PdCl2 (0.016 g, Pd ≥ 59%, Sinopharm, China) and stirred continuously at 25 °C for 1 h. 20 ml of aqueous solution of KBH4 (0.005 g, Sinopharm, China) was then dropped into the solution for Pd reduction at the same temperature. The reaction proceeded for 2 h. After that, the resultant Pd catalyst was filtered and rinsed with deionized water for three times to remove unreacted impurities and free Pd nanoparticles. The catalyst was finally obtained after drying under vacuum at 60 °C overnight. It was labelled as Pd/CNT-PNIPAM (L). In comparison, another two catalysts were prepared at different temperatures from that of Pd/CNT-PNIPAM (L). The one that prepared via impregnation-reduction method at 50 °C was named Pd/CNT-PNIPAM (H), while the other one that prepared by impregnating and reducing half of Pd precursors at 25 °C and then the other half at 50 °C was called Pd/CNT-PNIPAM (LH). In addition, CNT and CNT-A supported Pd catalysts were prepared using the same method as Pd/CNT-PNIPAM (L) for comparison. They were labelled as Pd/CNT and Pd/CNT (A), respectively. 2.3 Characterization of catalysts and supports The morphology of CNT-PNIPAM was observed by transmission electron microscopy (TEM) (JEOL-2010) at 200 kV. Some characteristic functional groups on CNT and CNT-PNIPAM hybrid were obtained by Fourier transform infrared (FT-IR) spectra, collecting on a Bruker Tensor 27 spectrometer. Thermal stability was measured by thermogravimetric analysis (TGA) (STA449F3, NETZSCH) in the temperature range of 25–850 °C at a heating rate of 10 °C/min in oxygen. Raman spectra were recorded on a Raman spectrometer (Bruker, SENTERRA) using a 532 nm laser excitation. Water contact angles (WCAs) were measured using an optical contact angle measuring device (KRUSS, DSA100). Nitrogen adsorption-desorption isotherms were measured at 195 °C using an ASAP 2020 Micromeritics instrument. Phase-transition temperature of CNT-PNIPAM materials were tested on PerkinElmer DSC8000 Differential scanning calorimeter (DSC). The specific surface area of the catalyst was obtained using a Brunauer-Emmett-Teller (BET) model, and the branch average pore size was analyzed using the Barrett-Joyner-Halenda (BJH) formula. X-ray photoelectron spectroscopy (XPS) measurements were performed using an ESCALAB250 X-ray photoelectron spectrometer using Al Ka radiation as the excitation source. The contents of various elements in the catalyst were determined by inductively coupled plasma-emission spectroscopy (ICP-OES), which was carried out by a Perkin Elmer Optima 7000 DV analyzer. Organic elemental analysis (OEA) for CNT, CNT-A and CNT-PNIPAM composite were conducted on a Thermo Scientific™ FLASH 2000 CHNS/O Analyzer. 2.4 Catalytic performance on selective hydrogenation of cinnamaldehyde CAL hydrogenation was typically performed in an 80 ml pressurized autoclave at 80 °C and 3.0 MPa H2 pressure. The detailed reaction conditions was summarized in Table S1 in Electronic Supplementary Information (ESI). Specifically, approximately 0.2 g of a catalyst was dispersed in 40 g of isopropanol (IPA, A.R., Sinopharm, China) solution of CAL (A.R., Sinopharm, China) at a concentration of 5.0 wt. %. The reactor was then sufficiently flushed with nitrogen flow to remove dissolved oxygen. After the temperature ascended to the set value, nitrogen in autoclave was completely replaced with hydrogen. The reaction was carried out at 80 °C, maintaining the total pressure constant at 3.0 MPa by continuously injecting hydrogen into the autoclave. The stirring speed was controlled to approximately 800 rpm, guaranteeing the removal of external diffusion limitation. Small amount of samples were withdrawn from autoclave at different times in the reaction. They was analyzed by gas chromatograph (SP-7820) equipped with an FID detector and a CP7821 capillary column (30 m × 0.25 mm × 0.25 μm). In addition, the reaction was carried out at 30 °C for comparison. Also, Pd/CNT-PNIPAM (LH) was employed for recycling test through five consecutive reactions at 80 °C and 3.0 MPa H2 pressure. The recycled sample was labelled as Pd/CNT-PNIPAM (LH)-R. 2.5 Calculation of initial reaction rate in turnover frequency (Initial TOF) Due to the first order reaction of cinnamaldehyde hydrogenation, initial reaction rate in TOF over five catalysts including Pd/CNT, Pd/CNT(A), Pd/CNT-PNIPAM (L), Pd/CNT-PNIPAM (H) and Pd/CNT-PNIPAM (LH) could be calculated using Eq. (3). (3) I n i t i a l T O F = k 1 × n C A L 0 × N S u r f a c e P d − 1 where k1 is reaction rate constant over the catalyst, n° CAL is initial mole amount of CAL and NSurface Pd is the molar number of surface Pd in catalyst. 3 Results and discussion 3.1 Synthesis of PNIPAM brushes on CNTs PNIPAM brushes were grafted from CNT surface in this work by radical polymerization, using APS as the initiator. The structural properties of synthesized CNT-PNIPAM hybrid were characterized by some technologies including FT-IR, Raman, XPS, TGA, OEA and N2 adsorption. The results were compared to that of CNT. Initially, compared to FT-IR spectrum of CNT (Fig. 2 a), that of CNT-PNIPAM (Fig. 2b) showed three new characteristic peaks at 1665, 1545 and 1282 cm−1, representing band I, II and III of secondary amide group, respectively. It was reasonably originated from the side chain of PNIPAM, confirming the successful grafting of PNIPAM on CNT. In addition, appearance of ether group (C–O-C) with the characteristic peak at 1137 cm−1 on CNT-PNIPAM very possibly hinted the grafting of PNIPAM on CNT via covalent combination with ether linkage. Furthermore, Raman spectra of all CNT materials (Fig. 3 ) exhibited three characteristic peaks at 1347, 1575 and 2688 cm−1 on behalf of d-band, G-band and 2D-band, respectively. Compared to I D/I G for CNT (0.19, Table S2, ESI), the slight increase of that for CNT-A (0.21) hinted that partial oxidation to CNT with piranha solution in this work produced slight effects on the crystallinity and defect of CNT. However, after the further synthesis of PNIPAM on CNT, a great amount of disordered carbon (sp3) led to a significant increase of I D/I G for CNT-PNIPAM (0.39). After that, XPS spectra were analyzed to characterize the detailed surface chemical compositions of CNT materials. From Fig. 4 a, C1s spectrum of CNT showed only one peak with a binding energy of 284.6 eV, which represented graphitic carbon-carbon bond (CC, sp2). In comparison, a new independent peak (285.9 eV) representing C–O could be separated from that of CNT-A (Fig. 4b). Acidification with piranha solution resulted in the formation of hydroxyl groups on CNT-A surface [41]. The amount of hydroxyl groups on CNT-A was calculated to be approximately 5.2 mmol/g by ion exchange capacity. It would help the grafting of PNIPAM on it via covalent combination with ether linkages. After the synthesis of PNIPAM, according to the expected structure of CNT-PNIPAM composite, its C1s spectrum (Fig. 4c) was deconvoluted in five independent peaks at 284.6, 284.9, 285.7, 286.2 and 288.2 eV, corresponding to CC (sp2), CC (sp3), C–N, C–O and CO groups, respectively [32,33,42,43]. Obviously, CC (sp2, 284.6 eV) and C–O (286.2 eV) groups are originated from CNT surface, while CC (sp3, 284.9 eV), CO (288.2 eV) and C–N (285.7 eV) groups are typical in the structure of PNIPAM, hinting the synthesis of PNIPAM on CNT surface. The descending content of graphitic CC (sp2) in carbon composition (Table S3 in ESI) also supported it. In combination with O1s and N1s spectra of CNT-PNIPAM (Figure S1b and S1c in ESI), PNIPAM was successfully grafted from CNT, in accordance with FT-IR and Raman analysis. TGA and OEA were further conducted to determine the grafting amount of PNIPAM on CNT. As shown in Fig. 5 , both CNT and CNT-A showed only one significant mass loss between 600 and 850 °C with DTG peaks at 771 and 755 °C, respectively. It was related to the decomposition of carbon ring on CNT. The similar decomposition process over CNT and CNT-A indicated a slight impact of acidification on structural defect of CNT, in agreement with the result of Raman spectra. However, CNT-PNIPAM exhibited another significant mass loss in the range of 250–480 °C with DTG peaks at 332 °C, attributing to the decomposition of PNIPAM on CNT. The grafting amount of PNIPAM on CNT was calculated to be approximately 34.1 wt. % of the total. It complied with the calculation result based on OEA analysis (approximately 35.8 wt. %, Table S4 in ESI). Finally, the textural properties of CNT materials were analyzed by N2 adsorption-desorption measurement. Clearly, CNT-A exhibited the similar structural properties to that of pristine CNT (Table 1 ). It proved once again that although the process of acidification with piranha solution rendered a few OH groups on CNT surface, it had slight impacts on structural properties of CNT, in agreement with the results of Raman and TG. However, after the synthesis of PNIPAM on CNT, CNT-PNIPAM hybrid showed a decreased BET surface area (about 190 m2/g) in comparison to that of CNT and CNT-A (220 m2/g). We speculated that the grafted PNIPAM very possibly blocked some pores and tunnels inside CNTs, leading to the decrease of its surface area. In addition, the similar structural properties of CNT-PNIPAM to that of Pd/CNT-PNIPAM catalysts hinted the good stability of the hybrid. In conclusion from above characterizations, PNIPAM were successfully synthesized on CNT surface by the method of radical polymerization. The possible grafting mechanism was shown in Figure S2. Specifically, some hydroxyl groups were firstly created on CNT surface in process of acidification using piranha solution. Hydroxyl radicals (·OH), which were produced by thermal decomposition of APS in aqueous medium, further attack hydroxyl groups on CNT, leading to the formation of oxyradicals (C–O·) on its surface. Afterwards NIPAM monomers were continuously introduced to the sites of radicals that resulted in the growth of PNIPAM on CNT via covalent combination with ether linkages. 3.2 Thermoresponsive properties of CNT-PNIPAM Thermoresponsive properties of CNT-PNIPAM was determined through water contact angles (WCAs) and dispersion tests in different solvents at low and high temperatures. Apparently, CNT possessed a hydrophobic surface, keeping WCA unchanged at approximately 150° when ambient temperature ascended from 25 °C to 50 °C (Fig. 6 a-b). In comparison, CNT-PNIPAM exhibited the thermoresponsive surface. Specifically, the hybrid showed a hydrophilic surface (WCA less than 15°) at 25 °C (Fig. 6c) while automatically switched to a hydrophobic one (WCA approximately 150°) at 50 °C (Fig. 6d). The dispersion tests also confirmed this conclusion (Figure S3, ESI). Obviously, CNTs agglomerated in water at any temperature due to its hydrophobic surface (Figure S3a and S3g, ESI). In comparison, CNT-PNIPAM showed the thermoresponsive property. It could be well dispersed in water at low temperature while agglomerated at high one, thanks to the change of the surface wettability from hydrophilicity to hydrophobicity with the temperature increasing. In addition, CNT-PNIPAM dispersion in IPA was opposite to that in water. Although the nature of the protic solvent, IPA possessed the polarity of 4.3, between water (10.2) and toluene (2.4), which preferred the dispersion of nanoparticles with weak polar surface. CNT well dispersion in IPA at any temperature confirmed it (Figure S3d and S3j, ESI). The thermoresponsive surface of the hybrid gave the direct proof of the successful grafting of PNIPAM on CNTs. LCST of the hybrid was further estimated through phase-transition temperature using DSC, as shown in Figure S4 (ESI). In contrast to CNT, CNT-PNIPAM and Pd/CNT-PNIPAM (LH) exhibited clear endothermic peaks at about 37 °C thanks to the change of PNIPAM conformation at this temperature. Hence, LCST of the hybrid was confirmed at about 37 °C. The thermoresponsive property of CNT-PNIPAM would produce great impacts on Pd dispersion and the subsequent selective hydrogenation. 3.3 Catalytic performance of Pd/CNT-PNIPAM 3.3.1 Pd dispersion on CNT-PNIPAM A series of Pd/CNT-PNIPAM were prepared by depositing Pd nanoparticles on CNT-PNIPAM at different temperatures. Average sizes of Pd nanoparticles on catalysts were measured from TEM images (Fig. 7 ) and summarized in Table 2 . Apparently, the synthesis of PNIPAM helped the improvement of Pd dispersion on the support. Pd/CNT-PNIPAM (L), for example, had the highest Pd dispersion (34.9 ± 7.8%) among five catalysts in this work, much higher than Pd/CNT did (12.1 ± 3.5%). Considered the lower BET surface area of Pd/CNT-PNIPAM than that of Pd/CNT, the high Pd dispersion on Pd/CNT-PNIPAM reasonably derived from its hydrophilic surface that provided more anchoring sites for Pd deposition on it. Pd3d XPS spectra of Pd/CNT and Pd/CNT-PNIPAM (LH) (Fig. 4d–e) were further analyzed to investigate the effect of supports on active sites. Apparently, both Pd catalysts exhibited four peaks at 336.1, 338.5, 341.3 and 343.6 eV, corresponding to Pd°3d5/2, Pd2+3d5/2, Pd°3d3/2 and Pd2+3d3/2, respectively. Pd° species on Pd/CNT surface accounted for approximately 91.4% of the total. In comparison, that on Pd/CNT-PNIPAM (LH) surface decreased to 85.2%. More Pd2+ species on Pd/CNT-PNIPAM (LH) than that on Pd/CNT was very possibly attributed to the coordination effect of nitrogen (N) atoms in PNIPAM side chain with metallic Pd nanoparticles. Some reports [44–46] suggested that N sites on supports provide electrons for coordination and anchoring with metal ions. Also, the Lewis basic site from N atom makes Pd2+ species rich. Hence, results further proved that the grafting of PNIPAM on CNT favors the dispersion of Pd nanoparticles, preventing their aggregation. Moreover, among three Pd/CNT-PNIPAM samples, Pd/CNT-PNIPAM (H) possessed comparatively lower Pd dispersion (27.9 ± 6.4%) than the other two did because its hydrophobic surface at high temperature hampered Pd dispersion well on it. Specifically, as shown in Figure S6 (ESI), PNIPAM exhibited an extended chain conformation at room temperature, which allowed a great amount of Pd nanoparticles to deposit on its hydrophilic side chains, resulting in a high Pd dispersion on Pd/CNT-PNIPAM (L). However, with the temperature ascending to 50 °C (>LCST), the conformation of PNIPAM automatically switched to a compressed coil in which hydrophilic side chains were inside the coil while hydrophobic backbones outside. Thus, the declined amount of exposed hydrophilic anchoring sites was unfavorable to Pd deposition, leading to a comparatively low Pd dispersion on Pd/CNT-PNIPAM (H). In addition, in preparation of Pd/CNT-PNIPAM (LH), Pd nanoparticles could be deposited on PNIPAM including its hydrophilic side chains and hydrophobic backbone thanks to its consecutive preparation at room temperature (< LCST) and then a high one (> LCST). Therefore, Pd/CNT-PNIPAM (LH) had a relatively higher Pd dispersion (30.8 ± 4.7%) than Pd/CNT-PNIPAM (H) did. 3.3.2 Catalytic activity of Pd/CNT-PNIPAM Catalytic activity of Pd/CNT-PNIPAM was evaluated in CAL selective hydrogenation at different temperatures. Generally, the reaction rates over the catalysts in this work always increased with the temperature ascending. CAL conversion over Pd/CNT, for example, was approximately 61% after 8 h at 30 °C (Fig. 8 a). Due to the first order reaction of cinnamaldehyde hydrogenation, the reaction rate constant (k) at 30 °C was further calculated to be 0.12 h−1 in Fig. 9 a. However, k ascended to 0.23 h−1 at 80 °C (Fig. 9b), approximately twice as fast as that at 30 °C. Compared to Pd/CNT, Pd/CNT-PNIPAM showed a higher activity at a high temperature (> LCST). Reaction rate constant over Pd/CNT-PNIPAM (LH), for instance, reached 0.75 h−1 at 80 °C, much higher than that over Pd/CNT (0.23 h−1) at the same temperature (Fig. 9b). The initial TOFs over them at 80 °C were further calculated, using Eq. (3). Through t-test statistics (P < 0.05), results exhibited the similar initial TOFs over them (Table 2). It indicated that CAL hydrogenation is very possibly structure insensitive, and the high activity over Pd/CNT-PNIPAM at high reaction temperature was reasonably attributed to the high Pd dispersion on it. On the contrary, Pd/CNT exhibited the higher activity than Pd/CNT-PNIPAM did at a low temperature (< LCST). Pd/CNT-PNIPAM (LH), for example, had k value of 0.067 h−1 (Fig. 9a) at 30 °C, only half of Pd/CNT did (0.12 h−1) at the same reaction temperature. The lower activity over Pd/CNT-PNIPAM than that over Pd/CNT at 30 °C was mainly ascribed to its hydrophilic surface that decreased the adsorption ability for CAL on it. It was thus evident that surface wettability of a catalyst played a key role on the activity via affecting the adsorption ability for reactants on it. Furthermore, three Pd/CNT-PNIPAM catalysts that prepared at different temperatures exhibited different catalytic activities. Pd/CNT-PNIPAM (LH) and Pd/CNT-PNIPAM (H) generally possessed the higher activity than Pd/CNT-PNIPAM (L) did. Considering the similar surface wettability of three samples in the reaction, the comparatively lower activity over Pd/CNT-PNIPAM (L) was reasonably relied on the less active Pd sites on it than those of the other two samples. Although Pd/CNT-PNIPAM (L) possessed the highest Pd dispersion among the catalysts, most of Pd nanoparticles deposited on hydrophilic side chains of PNIPAM (Figure S6). At the reaction temperature of 30 °C, reactants with weak polarity preferred being adsorbed on hydrophobic part of the catalyst including CNT surface and backbones of PNIPAM, where less Pd nanoparticles deposited on Pd/CNT-PNIPAM (L) than those on the other two catalysts. Therefore, comparatively low contact frequency between CAL molecules and Pd nanoparticles on Pd/CNT-PNIPAM (L) led to the slow reaction rate over it. In contrast, Pd nanoparticles on Pd/CNT-PNIPAM (H) were mainly deposited on the hydrophobic backbones of PNIPAM as well as CNT surface. A great amount of CAL molecules was adsorbed on the hydrophobic surface neighboring to Pd nanoparticles, which enabled more active sites participate in the hydrogenation. It rendered comparatively fast reaction rate over Pd/CNT-PNIPAM (H). While as the temperature ascended to 80 °C, the conformation of PNIPAM switched from an extended one to a compressed coil. During this process, some Pd sites that deposited on side chains of PNIPAM were covered (Figure S6, ESI). Thus, the decreased amount of exposed Pd sites on Pd/CNT-PNIPAM (L) logically led to the decline of activity over it. In comparison, the change of PNIPAM conformation had little effects on Pd/CNT-PNIPAM (H) because most Pd nanoparticles maintained exposed outside during the reaction (Figure S6, ESI). The slight decrease of the amount of active sites on Pd/CNT-PNIPAM (H) resulted in the high activity over it. The calculated lower initial TOF at 80 °C over Pd/CNT-PNIPAM (L) (13.3 ± 3.0 min−1, Table 2) than those over Pd/CNT-PNIPAM (LH) (33.6 ± 5.2 min-1) and Pd/CNT-PNIPAM (H) (29.3 ± 6.9 min−1, Table 2) supported this conclusion. Above results demonstrated that thermoresponsive smart surface greatly affected catalytic activity through regulating both the amount of active sites and the adsorption ability for the reactants on catalyst surface. 3.3.3 Selectivity to COL over Pd/CNT-PNIPAM In general, all catalysts in this work exhibited the predominant selectivity to HCAL at the reaction temperature of 80 °C (Fig. 10 ) because hydrogenation of CC is thermodynamically favored over that of CO. However, there existed some difference in product distribution over Pd/CNT and Pd/CNT-PNIPAM catalysts. At first, the catalysts with hydrophobic surface including Pd/CNT and Pd/CNT-PNIPAM possessed the higher COL selectivity than Pd/CNT (A) did. Pd/CNT, for example, had COL selectivity as high as approximately 30% at CAL conversion of 80%, higher than Pd/CNT (A) did (approximately 20%) at the same conversion. It was attributed to a change in the adsorption mode of reactants as a function of the surface wettability of the catalyst. Hydrophobic surfaces of Pd/CNT and Pd/CNT-PNIPAM at high temperature helped the adsorption of phenyl ring on them. Thus, a great amount of CAL molecules leaned against the neighboring Pd nanoparticles on the surface, directing CO group towards the periphery of Pd nanoparticle (Figure S7, ESI). Therefore, this adsorption mode enables the periphery of Pd nanoparticle to participate in the hydrogenation, leading to the higher COL selectivity over Pd/CNT and Pd/CNT-PNIPAM than that over Pd/CNT (A). Furthermore, among three Pd/CNT-PNIPAM samples, Pd/CNT-PNIPAM (LH) and Pd/CNT-PNIPAM (H) possessed the higher COL selectivity (approximately 27% at CAL conversion at 80%) than Pd/CNT-PNIPAM (L) did (approximately 20% at the same CAL conversion) (Fig. 10). It could be explained that Pd/CNT-PNIPAM (LH) and Pd/CNT-PNIPAM (H) deposited more Pd nanoparticles on hydrophobic surface of CNT and PNIPAM backbones, which favored more CAL adsorption on the peripheries of Pd nanoparticles, rendering the comparatively high COL selectivity over them. In conclusion, Pd/CNT-PNIPAM (LH) exhibited enhanced catalytic activity in CAL hydrogenation, meanwhile maintaining the COL selectivity unchanged in comparison to Pd/CNT. 3.3.4 Recycling of Pd/CNT-PNIPAM The recyclability of Pd/CNT-PNIPAM (LH) was examined at 80 °C and its catalytic performance in five consecutive reactions were shown in Fig. 11 . The sample after recycling was labelled as Pd/CNT-PNIPAM (LH)-R. Actually, CAL conversion over it gradually decreased from approximately 95% to 84% in five runs, while remaining COL selectivity constant (approximately 30%) in each run. The decline of activity over Pd/CNT-PNIPAM (LH) was mainly attributed to the mass loss during the recycling. Moreover, the recycled catalyst was characterized using TG, DSC and WCA, for checking its stability. Results indicated that Pd/CNT-PNIPAM (LH)-R remained the obvious thermoresponsive properties. It showed a hydrophilic surface (WCA approximately 18°) at 25 °C (Figure S8a, ESI) while automatically switched to a hydrophobic one (WCA approximately 150°) at 50 °C (Figure S8b, ESI). Through DSC, its phase-transition temperature was measured to be approximately 37 °C, similar to that of Pd/CNT-PNIPAM (LH) (Figure S4, ESI). The grafting amount of PNIPAM on recycled catalyst was further calculated to be 31% of the total (Fig. 5). Hence, these characterizations hinted the good reusability and stability of Pd/CNT-PNIPAM (LH) for CAL hydrogenation. 4 Conclusions In summary, we constructed a wettability-controllable surface on CNT via a facile method and employed this hybrid as the catalyst support for selective hydrogenation of CAL. In comparison to Pd/CNT, as-prepared Pd/CNT-PNIPAM exhibited enhanced catalytic activity, meanwhile maintaining COL selectivity unchanged, thanks to the high Pd dispersion on Pd/CNT-PNIPAM as well as its good adsorption properties for the reactants in the reaction. This work potentially created a highly efficient catalytic system for selective hydrogenation in application of scientific research and industrial production. Acknowledgements This work was supported by the National Natural Science Foundation of China (No. 21676029 and No. 21761132006). The financial support from the Priority Academic Program Development of Jiangsu Higher Education Institutions (PAPD) is also acknowledged. Appendix A Supplementary data Supplementary material related to this article can be found, in the online version, at doi:https://doi.org/10.1016/j.apcata.2019.02.009. Appendix A Supplementary data The following is Supplementary data to this article: References [1] N. Kalyon K. Hofmann J. Malter M. Lucas P. Claus B. Albert J. Catal. 352 2017 436 441 [2] E. Bailón-García F. Carrasco-Marín A.F. Pérez-Cadenas F.J. Maldonado-Hódar J. Catal. 344 2016 701 711 [3] J. Zhu M. Li M. Lu J. Zhu Catal. Sci. Technol. 3 2013 737 744 [4] E. Bailón-García F.J. Maldonado-Hódar A.F. Pérez-Cadenas F. Carrasco-Marín Catalysts 3 2013 853 877 [5] Y. Li H. Cheng W. Lin C. Zhang Q. Wu F. Zhao M. Arai Catal. Sci. Technol. 8 2018 3580 3589 [6] Y. Wang Z. Rong Y. Wang J. Qu J. Catal. 333 2016 8 16 [7] F. Jiang J. Cai B. Liu Y. Xu X. Liu RSC Adv. 6 2016 75541 75551 [8] Z. Sun Z. Rong Y. Wang Y. Xia W. Du Y. Wang RSC Adv. 4 2014 1874 1878 [9] P. Gallezot D. Richard Catal. Rev. Sci. Eng. 40 1998 81 126 [10] Q. Han Y. Liu D. Wang F. Yuan X. Niu Y. Zhu RSC Adv. 6 2016 98356 98364 [11] X. Ji X. Niu B. Li Q. Han F. Yuan F. Zaera Y. Zhu H. Fu ChemCatChem 6 2014 3246 3253 [12] O.G. Salnikov K.V. Kovtunov D.A. Barskiy A.K. Khudorozhkov E.A. Inozemtseva I.P. Prosvirin V.I. Bukhtiyarov I.V. Koptyug ACS Catal. 4 2014 2022 2028 [13] U.K. Singh M.A. Vannice J. Catal. 199 2001 73 84 [14] F. Jiang J. Cai B. Liu Y. Xu X. Liu RSC Adv. 6 2016 75541 75551 [15] A.J. Plomp H. Vuori A.O.I. Krause K.P. de Jong J.H. Bitter Appl. Catal. A Gen. 351 2008 9 15 [16] H.J. Wei C. Gomez J.J. Liu N. Guo T.P. Wu R. Lobo-Lapidus C.L. Marshall J.T. Miller R.J. Meyer J. Catal. 298 2013 18 26 [17] L.Q. Zhang J.M. Winterbottom A.P. Boyes S. Raymahasay J. Chem. Technol. Biotechnol. 72 1998 264 272 [18] X. Zhang Y.C. Guo Z.C. Zhang J.S. Gao C.M. Xu J. Catal. 292 2012 213 226 [19] S. Bhogeswararao D. Srinivas J. Catal. 285 2012 31 40 [20] H.G. Manyar B. Yang H. Daly H. Moor S. McMonagle Y. Tao G.D. Yadav A. Goguet P. Hu C. Hardacre ChemCatChem 5 2013 506 512 [21] F. Zaera ACS Catal. 7 2017 4947 4967 [22] W. Xiong K. Wang X. Liu F. Hao H. Xiao P. Liu H. Luo Appl. Catal. A Gen. 514 2016 126 134 [23] J. Zhu Y. Jia M. Li M. Lu J. Zhu Ind. Eng. Chem. Res. 52 2013 1224 1233 [24] E. García-Bordejé Y. Liu D.S. Su C. Pham-Huu J. Mater. Chem. A Mater. Energy Sustain. 5 2017 22408 22441 [25] M.L. Toebes T.A. Nijhuis J. Hájek J.H. Bitter A.J. van Dillen D.Y. Murzin K.P. de Jong Chem. Eng. Sci. 60 2005 5682 5695 [26] J.M. Roemers-van Beek J.G. van Ommen L. Lefferts Catal. Today 301 2018 134 140 [27] J.K. Chinthaginjala L. Lefferts Appl. Catal. B: Environ. 101 2010 144 149 [28] A. Jung A. Jess T. Schubert W. Schütz Appl. Catal. A Gen. 362 2009 95 105 [29] R. Nie M. Miao W. Du J. Shi Y. Liu Z. Hou Appl. Catal. B: Environ. 180 2016 607 613 [30] Y. Wang W. Leng Y. Gao J. Guo ACS Appl. Mater. Interfaces 6 2014 4143 4148 [31] A. Chen J. Qi Q. Zhao Y. Li G. Zhang F. Zhang X. Fan RSC Adv. 3 2013 8973 8977 [32] J. Qi W. Lv G. Zhang Y. Li G. Zhang F. Zhang X. Fan Nanoscale 5 2013 6275 6279 [33] D. Wang H. Duan J. Lü C. Lü J. Mater. Chem. A Mater. Energy Sustain. 5 2017 5088 5097 [34] X.F. Sui Q. Chen M.A. Hempenius G.J. Vancso Small 7 2011 1440 1447 [35] W. Song F. Xia Y. Bai F. Liu T. Sun L. Jiang Langmuir 23 2006 327 331 [36] K. Dutta S. De J. Mater. Chem. A Mater. Energy Sustain. 5 2017 22095 22112 [37] F. Hapiot S. Menuel E. Monflier ACS Catal. 3 2013 1006 1010 [38] Y. Dong Q. Wang J. Wang Y. Ma D. Wang Z. Wu M. Abudkremb M. Zhang Reac. Funct. Polym. 112 2017 60 67 [39] J. Zhang Y. Yuan K.J. Kilpin Y. Kou P.J. Dyson N. Yan J. Mol. Catal. A Chem. 371 2013 29 35 [40] Q. Wang J. Wang D. Wang M. Turhong M. Zhang Chem. Eng. J. 280 2015 158 164 [41] Y. Yu B.D. Kieviet F. Liu I. Siretanu E. Kutnyánszky G.J. Vancso S. de Beer Soft Matter 11 2015 8508 8516 [42] Z. Gong S. Li W. Han J. Wang J. Ma X. Zhang Appl. Surf. Sci. 362 2016 459 468 [43] J.M. Bak T. Lee E. Seo Y. Lee H.M. Jeong B.-S. Kim H. Lee Polymer 53 2012 316 323 [44] M. Fan Y. Long Y. Zhu X. Hu Z. Dong Appl. Catal. A Gen. 568 2018 130 138 [45] R. Arrigo M.E. Schuster Z. Xie Y. Yi G. Wowsnick L.L. Sun K.E. Hermann M. Friedrich P. Kast M. Hävecker A. Knop-Gericke R. Schlögl ACS Catal. 5 2015 2740 2753 [46] X. Cui Y. Long X. Zhou G. Yu J. Yang M. Yuan J. Ma Z. Dong Green Chem. 20 2018 1121 1130",
      "scopus-id": "85061361857",
      "coredata": {
        "eid": "1-s2.0-S0926860X1930064X",
        "dc:description": "A wettability-controllable surface on carbon nanotubes (CNTs) was successfully constructed through directly grafting poly(N-isopropylacrylamide) (PNIPAM) from CNT surface (i.e. CNT-PNIPAM) via a facile method. The hybrid was employed as the support to prepare Pd catalyst (i.e. Pd/CNT-PNIPAM) for selective hydrogenation of cinnamaldehyde (CAL). The effects of thermoresponsive surface chemistry on catalytic performance were studied. Results showed that CNT-PNIPAM had the lower critical solution temperature (LCST) at about 37 °C. The hydrophilic surface of CNT-PNIPAM at 25 °C (< LCST) improved the dispersion of Pd nanoparticles on it in catalyst preparation. As-prepared Pd/CNT-PNIPAM then automatically switched its hydrophilic surface to the hydrophobic one at 80 °C (>LCST), which exhibited the good adsorption properties for reactants in the reaction. The high Pd dispersion on Pd/CNT-PNIPAM as well as its good adsorption properties for CAL jointly resulted in an enhanced catalytic activity, meanwhile maintaining the selectivity to cinnamyl alcohol (COL) unchanged in comparison to CNT supported Pd catalyst (Pd/CNT).",
        "openArchiveArticle": "false",
        "prism:coverDate": "2019-04-05",
        "openaccessUserLicense": null,
        "prism:aggregationType": "Journal",
        "prism:url": "https://api.elsevier.com/content/article/pii/S0926860X1930064X",
        "dc:creator": [
          {
            "@_fa": "true",
            "$": "Zhu, Jie"
          },
          {
            "@_fa": "true",
            "$": "Dou, Mengdi"
          },
          {
            "@_fa": "true",
            "$": "Lu, Mohong"
          },
          {
            "@_fa": "true",
            "$": "Xiang, Xu"
          },
          {
            "@_fa": "true",
            "$": "Ding, Xuejie"
          },
          {
            "@_fa": "true",
            "$": "Liu, Wenxin"
          },
          {
            "@_fa": "true",
            "$": "Li, Mingshi"
          }
        ],
        "link": [
          {
            "@_fa": "true",
            "@rel": "self",
            "@href": "https://api.elsevier.com/content/article/pii/S0926860X1930064X"
          },
          {
            "@_fa": "true",
            "@rel": "scidir",
            "@href": "https://www.sciencedirect.com/science/article/pii/S0926860X1930064X"
          }
        ],
        "dc:format": "application/json",
        "openaccessType": null,
        "pii": "S0926-860X(19)30064-X",
        "prism:volume": "575",
        "prism:publisher": "Elsevier B.V.",
        "dc:title": "Thermo-responsive polymer grafted carbon nanotubes as the catalyst support for selective hydrogenation of cinnamaldehyde: Effects of surface chemistry on catalytic performance",
        "prism:copyright": "© 2019 Elsevier B.V. All rights reserved.",
        "openaccess": "0",
        "prism:issn": "0926860X",
        "dcterms:subject": [
          {
            "@_fa": "true",
            "$": "Thermoresponsive smart surface"
          },
          {
            "@_fa": "true",
            "$": "PNIPAM"
          },
          {
            "@_fa": "true",
            "$": "Carbon nanotube"
          },
          {
            "@_fa": "true",
            "$": "Selective hydrogenation"
          },
          {
            "@_fa": "true",
            "$": "Cinnamaldehyde"
          }
        ],
        "openaccessArticle": "false",
        "prism:publicationName": "Applied Catalysis A: General",
        "openaccessSponsorType": null,
        "prism:pageRange": "11-19",
        "prism:endingPage": "19",
        "pubType": "fla",
        "prism:coverDisplayDate": "5 April 2019",
        "prism:doi": "10.1016/j.apcata.2019.02.009",
        "prism:startingPage": "11",
        "dc:identifier": "doi:10.1016/j.apcata.2019.02.009",
        "openaccessSponsorName": null
      },
      "objects": {
        "object": [
          {
            "@category": "thumbnail",
            "@height": "60",
            "@width": "219",
            "@_fa": "true",
            "$": "https://api.elsevier.com/content/object/eid/1-s2.0-S0926860X1930064X-ga1.sml?httpAccept=%2A%2F%2A",
            "@multimediatype": "GIF image file",
            "@type": "IMAGE-THUMBNAIL",
            "@size": "5753",
            "@ref": "ga1",
            "@mimetype": "image/gif"
          },
          {
            "@category": "thumbnail",
            "@height": "96",
            "@width": "219",
            "@_fa": "true",
            "$": "https://api.elsevier.com/content/object/eid/1-s2.0-S0926860X1930064X-gr1.sml?httpAccept=%2A%2F%2A",
            "@multimediatype": "GIF image file",
            "@type": "IMAGE-THUMBNAIL",
            "@size": "3682",
            "@ref": "gr1",
            "@mimetype": "image/gif"
          },
          {
            "@category": "thumbnail",
            "@height": "163",
            "@width": "124",
            "@_fa": "true",
            "$": "https://api.elsevier.com/content/object/eid/1-s2.0-S0926860X1930064X-gr10.sml?httpAccept=%2A%2F%2A",
            "@multimediatype": "GIF image file",
            "@type": "IMAGE-THUMBNAIL",
            "@size": "5940",
            "@ref": "gr10",
            "@mimetype": "image/gif"
          },
          {
            "@category": "thumbnail",
            "@height": "164",
            "@width": "202",
            "@_fa": "true",
            "$": "https://api.elsevier.com/content/object/eid/1-s2.0-S0926860X1930064X-gr11.sml?httpAccept=%2A%2F%2A",
            "@multimediatype": "GIF image file",
            "@type": "IMAGE-THUMBNAIL",
            "@size": "8523",
            "@ref": "gr11",
            "@mimetype": "image/gif"
          },
          {
            "@category": "thumbnail",
            "@height": "162",
            "@width": "219",
            "@_fa": "true",
            "$": "https://api.elsevier.com/content/object/eid/1-s2.0-S0926860X1930064X-gr2.sml?httpAccept=%2A%2F%2A",
            "@multimediatype": "GIF image file",
            "@type": "IMAGE-THUMBNAIL",
            "@size": "9252",
            "@ref": "gr2",
            "@mimetype": "image/gif"
          },
          {
            "@category": "thumbnail",
            "@height": "164",
            "@width": "210",
            "@_fa": "true",
            "$": "https://api.elsevier.com/content/object/eid/1-s2.0-S0926860X1930064X-gr3.sml?httpAccept=%2A%2F%2A",
            "@multimediatype": "GIF image file",
            "@type": "IMAGE-THUMBNAIL",
            "@size": "9841",
            "@ref": "gr3",
            "@mimetype": "image/gif"
          },
          {
            "@category": "thumbnail",
            "@height": "164",
            "@width": "124",
            "@_fa": "true",
            "$": "https://api.elsevier.com/content/object/eid/1-s2.0-S0926860X1930064X-gr4.sml?httpAccept=%2A%2F%2A",
            "@multimediatype": "GIF image file",
            "@type": "IMAGE-THUMBNAIL",
            "@size": "7764",
            "@ref": "gr4",
            "@mimetype": "image/gif"
          },
          {
            "@category": "thumbnail",
            "@height": "160",
            "@width": "219",
            "@_fa": "true",
            "$": "https://api.elsevier.com/content/object/eid/1-s2.0-S0926860X1930064X-gr5.sml?httpAccept=%2A%2F%2A",
            "@multimediatype": "GIF image file",
            "@type": "IMAGE-THUMBNAIL",
            "@size": "10303",
            "@ref": "gr5",
            "@mimetype": "image/gif"
          },
          {
            "@category": "thumbnail",
            "@height": "101",
            "@width": "219",
            "@_fa": "true",
            "$": "https://api.elsevier.com/content/object/eid/1-s2.0-S0926860X1930064X-gr6.sml?httpAccept=%2A%2F%2A",
            "@multimediatype": "GIF image file",
            "@type": "IMAGE-THUMBNAIL",
            "@size": "12331",
            "@ref": "gr6",
            "@mimetype": "image/gif"
          },
          {
            "@category": "thumbnail",
            "@height": "163",
            "@width": "161",
            "@_fa": "true",
            "$": "https://api.elsevier.com/content/object/eid/1-s2.0-S0926860X1930064X-gr7.sml?httpAccept=%2A%2F%2A",
            "@multimediatype": "GIF image file",
            "@type": "IMAGE-THUMBNAIL",
            "@size": "14748",
            "@ref": "gr7",
            "@mimetype": "image/gif"
          },
          {
            "@category": "thumbnail",
            "@height": "87",
            "@width": "219",
            "@_fa": "true",
            "$": "https://api.elsevier.com/content/object/eid/1-s2.0-S0926860X1930064X-gr8.sml?httpAccept=%2A%2F%2A",
            "@multimediatype": "GIF image file",
            "@type": "IMAGE-THUMBNAIL",
            "@size": "7584",
            "@ref": "gr8",
            "@mimetype": "image/gif"
          },
          {
            "@category": "thumbnail",
            "@height": "85",
            "@width": "219",
            "@_fa": "true",
            "$": "https://api.elsevier.com/content/object/eid/1-s2.0-S0926860X1930064X-gr9.sml?httpAccept=%2A%2F%2A",
            "@multimediatype": "GIF image file",
            "@type": "IMAGE-THUMBNAIL",
            "@size": "6745",
            "@ref": "gr9",
            "@mimetype": "image/gif"
          },
          {
            "@category": "standard",
            "@height": "137",
            "@width": "500",
            "@_fa": "true",
            "$": "https://api.elsevier.com/content/object/eid/1-s2.0-S0926860X1930064X-ga1.jpg?httpAccept=%2A%2F%2A",
            "@multimediatype": "JPEG image file",
            "@type": "IMAGE-DOWNSAMPLED",
            "@size": "22665",
            "@ref": "ga1",
            "@mimetype": "image/jpeg"
          },
          {
            "@category": "standard",
            "@height": "166",
            "@width": "378",
            "@_fa": "true",
            "$": "https://api.elsevier.com/content/object/eid/1-s2.0-S0926860X1930064X-gr1.jpg?httpAccept=%2A%2F%2A",
            "@multimediatype": "JPEG image file",
            "@type": "IMAGE-DOWNSAMPLED",
            "@size": "14648",
            "@ref": "gr1",
            "@mimetype": "image/jpeg"
          },
          {
            "@category": "standard",
            "@height": "640",
            "@width": "487",
            "@_fa": "true",
            "$": "https://api.elsevier.com/content/object/eid/1-s2.0-S0926860X1930064X-gr10.jpg?httpAccept=%2A%2F%2A",
            "@multimediatype": "JPEG image file",
            "@type": "IMAGE-DOWNSAMPLED",
            "@size": "74128",
            "@ref": "gr10",
            "@mimetype": "image/jpeg"
          },
          {
            "@category": "standard",
            "@height": "257",
            "@width": "317",
            "@_fa": "true",
            "$": "https://api.elsevier.com/content/object/eid/1-s2.0-S0926860X1930064X-gr11.jpg?httpAccept=%2A%2F%2A",
            "@multimediatype": "JPEG image file",
            "@type": "IMAGE-DOWNSAMPLED",
            "@size": "17980",
            "@ref": "gr11",
            "@mimetype": "image/jpeg"
          },
          {
            "@category": "standard",
            "@height": "220",
            "@width": "298",
            "@_fa": "true",
            "$": "https://api.elsevier.com/content/object/eid/1-s2.0-S0926860X1930064X-gr2.jpg?httpAccept=%2A%2F%2A",
            "@multimediatype": "JPEG image file",
            "@type": "IMAGE-DOWNSAMPLED",
            "@size": "22661",
            "@ref": "gr2",
            "@mimetype": "image/jpeg"
          },
          {
            "@category": "standard",
            "@height": "217",
            "@width": "279",
            "@_fa": "true",
            "$": "https://api.elsevier.com/content/object/eid/1-s2.0-S0926860X1930064X-gr3.jpg?httpAccept=%2A%2F%2A",
            "@multimediatype": "JPEG image file",
            "@type": "IMAGE-DOWNSAMPLED",
            "@size": "22641",
            "@ref": "gr3",
            "@mimetype": "image/jpeg"
          },
          {
            "@category": "standard",
            "@height": "644",
            "@width": "487",
            "@_fa": "true",
            "$": "https://api.elsevier.com/content/object/eid/1-s2.0-S0926860X1930064X-gr4.jpg?httpAccept=%2A%2F%2A",
            "@multimediatype": "JPEG image file",
            "@type": "IMAGE-DOWNSAMPLED",
            "@size": "81883",
            "@ref": "gr4",
            "@mimetype": "image/jpeg"
          },
          {
            "@category": "standard",
            "@height": "205",
            "@width": "280",
            "@_fa": "true",
            "$": "https://api.elsevier.com/content/object/eid/1-s2.0-S0926860X1930064X-gr5.jpg?httpAccept=%2A%2F%2A",
            "@multimediatype": "JPEG image file",
            "@type": "IMAGE-DOWNSAMPLED",
            "@size": "22244",
            "@ref": "gr5",
            "@mimetype": "image/jpeg"
          },
          {
            "@category": "standard",
            "@height": "227",
            "@width": "491",
            "@_fa": "true",
            "$": "https://api.elsevier.com/content/object/eid/1-s2.0-S0926860X1930064X-gr6.jpg?httpAccept=%2A%2F%2A",
            "@multimediatype": "JPEG image file",
            "@type": "IMAGE-DOWNSAMPLED",
            "@size": "27723",
            "@ref": "gr6",
            "@mimetype": "image/jpeg"
          },
          {
            "@category": "standard",
            "@height": "517",
            "@width": "510",
            "@_fa": "true",
            "$": "https://api.elsevier.com/content/object/eid/1-s2.0-S0926860X1930064X-gr7.jpg?httpAccept=%2A%2F%2A",
            "@multimediatype": "JPEG image file",
            "@type": "IMAGE-DOWNSAMPLED",
            "@size": "100169",
            "@ref": "gr7",
            "@mimetype": "image/jpeg"
          },
          {
            "@category": "standard",
            "@height": "194",
            "@width": "487",
            "@_fa": "true",
            "$": "https://api.elsevier.com/content/object/eid/1-s2.0-S0926860X1930064X-gr8.jpg?httpAccept=%2A%2F%2A",
            "@multimediatype": "JPEG image file",
            "@type": "IMAGE-DOWNSAMPLED",
            "@size": "37398",
            "@ref": "gr8",
            "@mimetype": "image/jpeg"
          },
          {
            "@category": "standard",
            "@height": "188",
            "@width": "487",
            "@_fa": "true",
            "$": "https://api.elsevier.com/content/object/eid/1-s2.0-S0926860X1930064X-gr9.jpg?httpAccept=%2A%2F%2A",
            "@multimediatype": "JPEG image file",
            "@type": "IMAGE-DOWNSAMPLED",
            "@size": "32960",
            "@ref": "gr9",
            "@mimetype": "image/jpeg"
          },
          {
            "@category": "high",
            "@height": "605",
            "@width": "2213",
            "@_fa": "true",
            "$": "https://api.elsevier.com/content/object/eid/1-s2.0-S0926860X1930064X-ga1_lrg.jpg?httpAccept=%2A%2F%2A",
            "@multimediatype": "JPEG image file",
            "@type": "IMAGE-HIGH-RES",
            "@size": "160001",
            "@ref": "ga1",
            "@mimetype": "image/jpeg"
          },
          {
            "@category": "high",
            "@height": "734",
            "@width": "1675",
            "@_fa": "true",
            "$": "https://api.elsevier.com/content/object/eid/1-s2.0-S0926860X1930064X-gr1_lrg.jpg?httpAccept=%2A%2F%2A",
            "@multimediatype": "JPEG image file",
            "@type": "IMAGE-HIGH-RES",
            "@size": "124262",
            "@ref": "gr1",
            "@mimetype": "image/jpeg"
          },
          {
            "@category": "high",
            "@height": "2834",
            "@width": "2156",
            "@_fa": "true",
            "$": "https://api.elsevier.com/content/object/eid/1-s2.0-S0926860X1930064X-gr10_lrg.jpg?httpAccept=%2A%2F%2A",
            "@multimediatype": "JPEG image file",
            "@type": "IMAGE-HIGH-RES",
            "@size": "532131",
            "@ref": "gr10",
            "@mimetype": "image/jpeg"
          },
          {
            "@category": "high",
            "@height": "1140",
            "@width": "1406",
            "@_fa": "true",
            "$": "https://api.elsevier.com/content/object/eid/1-s2.0-S0926860X1930064X-gr11_lrg.jpg?httpAccept=%2A%2F%2A",
            "@multimediatype": "JPEG image file",
            "@type": "IMAGE-HIGH-RES",
            "@size": "131740",
            "@ref": "gr11",
            "@mimetype": "image/jpeg"
          },
          {
            "@category": "high",
            "@height": "977",
            "@width": "1322",
            "@_fa": "true",
            "$": "https://api.elsevier.com/content/object/eid/1-s2.0-S0926860X1930064X-gr2_lrg.jpg?httpAccept=%2A%2F%2A",
            "@multimediatype": "JPEG image file",
            "@type": "IMAGE-HIGH-RES",
            "@size": "183410",
            "@ref": "gr2",
            "@mimetype": "image/jpeg"
          },
          {
            "@category": "high",
            "@height": "965",
            "@width": "1238",
            "@_fa": "true",
            "$": "https://api.elsevier.com/content/object/eid/1-s2.0-S0926860X1930064X-gr3_lrg.jpg?httpAccept=%2A%2F%2A",
            "@multimediatype": "JPEG image file",
            "@type": "IMAGE-HIGH-RES",
            "@size": "188642",
            "@ref": "gr3",
            "@mimetype": "image/jpeg"
          },
          {
            "@category": "high",
            "@height": "2849",
            "@width": "2156",
            "@_fa": "true",
            "$": "https://api.elsevier.com/content/object/eid/1-s2.0-S0926860X1930064X-gr4_lrg.jpg?httpAccept=%2A%2F%2A",
            "@multimediatype": "JPEG image file",
            "@type": "IMAGE-HIGH-RES",
            "@size": "670695",
            "@ref": "gr4",
            "@mimetype": "image/jpeg"
          },
          {
            "@category": "high",
            "@height": "905",
            "@width": "1239",
            "@_fa": "true",
            "$": "https://api.elsevier.com/content/object/eid/1-s2.0-S0926860X1930064X-gr5_lrg.jpg?httpAccept=%2A%2F%2A",
            "@multimediatype": "JPEG image file",
            "@type": "IMAGE-HIGH-RES",
            "@size": "174607",
            "@ref": "gr5",
            "@mimetype": "image/jpeg"
          },
          {
            "@category": "high",
            "@height": "1004",
            "@width": "2175",
            "@_fa": "true",
            "$": "https://api.elsevier.com/content/object/eid/1-s2.0-S0926860X1930064X-gr6_lrg.jpg?httpAccept=%2A%2F%2A",
            "@multimediatype": "JPEG image file",
            "@type": "IMAGE-HIGH-RES",
            "@size": "282983",
            "@ref": "gr6",
            "@mimetype": "image/jpeg"
          },
          {
            "@category": "high",
            "@height": "2291",
            "@width": "2258",
            "@_fa": "true",
            "$": "https://api.elsevier.com/content/object/eid/1-s2.0-S0926860X1930064X-gr7_lrg.jpg?httpAccept=%2A%2F%2A",
            "@multimediatype": "JPEG image file",
            "@type": "IMAGE-HIGH-RES",
            "@size": "1475071",
            "@ref": "gr7",
            "@mimetype": "image/jpeg"
          },
          {
            "@category": "high",
            "@height": "861",
            "@width": "2156",
            "@_fa": "true",
            "$": "https://api.elsevier.com/content/object/eid/1-s2.0-S0926860X1930064X-gr8_lrg.jpg?httpAccept=%2A%2F%2A",
            "@multimediatype": "JPEG image file",
            "@type": "IMAGE-HIGH-RES",
            "@size": "293316",
            "@ref": "gr8",
            "@mimetype": "image/jpeg"
          },
          {
            "@category": "high",
            "@height": "834",
            "@width": "2158",
            "@_fa": "true",
            "$": "https://api.elsevier.com/content/object/eid/1-s2.0-S0926860X1930064X-gr9_lrg.jpg?httpAccept=%2A%2F%2A",
            "@multimediatype": "JPEG image file",
            "@type": "IMAGE-HIGH-RES",
            "@size": "260536",
            "@ref": "gr9",
            "@mimetype": "image/jpeg"
          },
          {
            "@category": "standard",
            "@_fa": "true",
            "$": "https://api.elsevier.com/content/object/eid/1-s2.0-S0926860X1930064X-mmc1.doc?httpAccept=%2A%2F%2A",
            "@multimediatype": "Microsoft Word file",
            "@type": "APPLICATION",
            "@size": "2965504",
            "@ref": "mmc1",
            "@mimetype": "application/word"
          },
          {
            "@category": "thumbnail",
            "@height": "38",
            "@width": "358",
            "@_fa": "true",
            "$": "https://api.elsevier.com/content/object/eid/1-s2.0-S0926860X1930064X-si1.gif?httpAccept=%2A%2F%2A",
            "@multimediatype": "GIF image file",
            "@type": "ALTIMG",
            "@size": "1099",
            "@ref": "si1",
            "@mimetype": "image/gif"
          },
          {
            "@category": "standard",
            "@_fa": "true",
            "$": "https://api.elsevier.com/content/object/eid/1-s2.0-S0926860X1930064X-am.pdf?httpAccept=%2A%2F%2A",
            "@multimediatype": "Acrobat PDF file",
            "@type": "AAM-PDF",
            "@size": "4431647",
            "@ref": "am",
            "@mimetype": "application/pdf"
          }
        ]
      },
      "link": {
        "@rel": "abstract",
        "@href": "https://api.elsevier.com/content/abstract/scopus_id/85061361857"
      }
    }
  }
}