{
  "metadata": {
    "title": "Regulating Ni–O–V bond in nickel doped vanadium catalysts for propane dehydrogenation",
    "authors": "; ; ",
    "journal": "Applied Catalysis A: General",
    "date": "2022-08-25",
    "doi": "10.1016/j.apcata.2022.118819",
    "abstract": "",
    "uri": "https://api.elsevier.com/content/article/pii/S0926860X22003428",
    "pii": "S0926860X22003428"
  },
  "fulltext": {
    "full-text-retrieval-response": {
      "scopus-eid": "2-s2.0-85136089768",
      "originalText": "serial JL 271346 291210 291744 291809 31 Applied Catalysis A: General APPLIEDCATALYSISAGENERAL 2022-08-17 2022-08-17 2022-08-19 2022-08-19 2022-09-08T08:52:53 1-s2.0-S0926860X22003428 S0926-860X(22)00342-8 S0926860X22003428 10.1016/j.apcata.2022.118819 S300 S300.1 FULL-TEXT 1-s2.0-S0926860X22X0015X 2024-01-01T12:34:28.416125Z 0 0 20220825 2022 2022-08-17T09:09:02.155426Z absattachment articleinfo articlenumber articletitlenorm authfirstinitialnorm authfirstsurnamenorm cid cids contenttype copyright crossmark dateloaded dateloadedtxt datesearch datesort dateupdated dco docsubtype doctype doi eid ewtransactionid hubeid indexeddate issn issnnorm itemstage itemtransactionid itemweight openaccess openarchive pg pgfirst pii piinorm pubdatestart pubdatetxt pubyr sortorder srctitle srctitlenorm srctype ssids alllist content subj subheadings suppl tomb volfirst volissue volumelist webpdf webpdfpagecount yearnav figure e-component body mmlmath acknowledge affil appendices articletitle auth authfirstini authfull authkeywords authlast grantnumber grantsponsor grantsponsorid highlightsabst primabst ref specialabst 0926-860X 0926860X true 644 644 C Volume 644 14 118819 118819 118819 20220825 25 August 2022 2022-08-25 2022 article fla © 2022 Elsevier B.V. All rights reserved. REGULATINGNIOVBONDINNICKELDOPEDVANADIUMCATALYSTSFORPROPANEDEHYDROGENATION HUANG J 1 Introduction 2 Experiment 2.1 Catalyst preparation 2.2 Catalyst characterization 2.3 Catalytical test 2.4 Computational details 3 Results and discussion 3.1 Experimental validation 3.2 Catalytic performance 3.3 Structure-performance correlation 4 Conclusions CRediT authorship contribution statement Acknowledgments Appendix A Supplementary material References SATTLER 2014 10613 10653 J AKPORIAYE 2001 4741 4748 D SANTHOSHKUMAR 2008 747 750 M MONAI 2021 11503 11529 M SAELEE 2018 14678 14690 T BHASIN 2001 397 419 M HAN 2020 8933 8949 S SOKOLOV 2015 1691 1700 S LIU 2016 5207 5214 G CARRERO 2014 3357 3380 C ZHAO 2018 6791 6795 Z RODEMERCK 2016 174 183 U BARDIN 1999 283 292 B YU 2014 28 34 J JEON 2021 118036 N BLANCO 2008 93 98 S WANG 2014 71 80 G GU 2020 119089 Y CHEN 2019 18653 18657 S WANG 2022 120731 P KRESSE 1996 11169 11186 G PERDEW 1996 3865 3868 J BLOCHL 1994 17953 17979 P DEBOKX 1987 86 98 P LI 2016 172 179 P URENABEGARA 2017 717 727 F WU 2005 2793 2800 Z SHVETS 2019 1226 1244 P MIZUKOSHI 2015 180 186 Y KHAN 2021 105526 A KAICHEV 2019 19668 19680 V KANERVO 2003 171 180 J GAO 1999 325 331 X LU 2015 34 46 X TIAN 2020 1901270 Z VALENZUELA 1996 223 228 R LI 1995 457 465 C LIU 2016 1599 1605 Q BAKARE 2015 207 216 I IANNAZZO 2003 49 68 V XUE 2007 117 126 M BALOGUN 2021 82 97 M CONNELL 1987 285 298 G LIU 2014 183 192 X SILVERSMIT 2004 167 175 G ZHAO 2018 31081 31093 X LI 2020 2720 Y MCINTYRE 1975 2208 2213 N SUN 2018 1704137 Q FILATOVA 2016 8979 8985 E ZHANG 2022 122756 H MENDIALDUA 1995 249 261 J SHOAEIRAD 2011 1835 1838 V YANG 2020 593 H HUANGX2022X118819 HUANGX2022X118819XJ 2024-08-19T00:00:00.000Z 2024-08-19T00:00:00.000Z http://creativecommons.org/licenses/by-nc-nd/4.0/ © 2022 Elsevier B.V. All rights reserved. 2022-08-24T01:03:34.214Z http://vtw.elsevier.com/data/voc/AddOnTypes/50.7/aggregated-refined 0 https://doi.org/10.15223/policy-017 https://doi.org/10.15223/policy-037 https://doi.org/10.15223/policy-012 https://doi.org/10.15223/policy-029 https://doi.org/10.15223/policy-004 item S0926-860X(22)00342-8 S0926860X22003428 1-s2.0-S0926860X22003428 10.1016/j.apcata.2022.118819 271346 2024-01-01T12:34:28.416125Z 2022-08-25 1-s2.0-S0926860X22003428-main.pdf https://s3-eu-west-1.amazonaws.com/prod-ucs-content-store-eu-west/content/pii:S0926860X22003428/MAIN/application/pdf/600dabeb40600e73e041e737ca844541/main.pdf main.pdf pdf true 3151698 MAIN 8 1-s2.0-S0926860X22003428-main_1.png https://s3-eu-west-1.amazonaws.com/prod-ucs-content-store-eu-west/content/pii:S0926860X22003428/PREVIEW/image/png/038b56333de7c9b29e95a41d845ded70/main_1.png main_1.png png 57586 849 656 IMAGE-WEB-PDF 1 1-s2.0-S0926860X22003428-gr2.jpg https://s3-eu-west-1.amazonaws.com/prod-ucs-content-store-eu-west/content/pii:S0926860X22003428/gr2/DOWNSAMPLED/image/jpeg/8b3badbee7affb968bfa294414377788/gr2.jpg gr2 gr2.jpg jpg 88010 351 678 IMAGE-DOWNSAMPLED 1-s2.0-S0926860X22003428-ga1.jpg https://s3-eu-west-1.amazonaws.com/prod-ucs-content-store-eu-west/content/pii:S0926860X22003428/ga1/DOWNSAMPLED/image/jpeg/792a0fd465a0d6611ab4aa0f469edf75/ga1.jpg ga1 true ga1.jpg jpg 27481 184 500 IMAGE-DOWNSAMPLED 1-s2.0-S0926860X22003428-gr3.jpg https://s3-eu-west-1.amazonaws.com/prod-ucs-content-store-eu-west/content/pii:S0926860X22003428/gr3/DOWNSAMPLED/image/jpeg/b424f824fd71a28f54a7827c62ddb3ff/gr3.jpg gr3 gr3.jpg jpg 32037 294 565 IMAGE-DOWNSAMPLED 1-s2.0-S0926860X22003428-gr1.jpg https://s3-eu-west-1.amazonaws.com/prod-ucs-content-store-eu-west/content/pii:S0926860X22003428/gr1/DOWNSAMPLED/image/jpeg/3cd6b2858b71a81f07c1ee29efc12e72/gr1.jpg gr1 gr1.jpg jpg 35385 207 376 IMAGE-DOWNSAMPLED 1-s2.0-S0926860X22003428-gr6.jpg https://s3-eu-west-1.amazonaws.com/prod-ucs-content-store-eu-west/content/pii:S0926860X22003428/gr6/DOWNSAMPLED/image/jpeg/f8204d2df8527a30aeef3b1bc91bdcaa/gr6.jpg gr6 gr6.jpg jpg 43561 379 565 IMAGE-DOWNSAMPLED 1-s2.0-S0926860X22003428-gr7.jpg https://s3-eu-west-1.amazonaws.com/prod-ucs-content-store-eu-west/content/pii:S0926860X22003428/gr7/DOWNSAMPLED/image/jpeg/dd6718ed6d7fe372a7fc8a914aa80775/gr7.jpg gr7 gr7.jpg jpg 17097 187 376 IMAGE-DOWNSAMPLED 1-s2.0-S0926860X22003428-gr4.jpg https://s3-eu-west-1.amazonaws.com/prod-ucs-content-store-eu-west/content/pii:S0926860X22003428/gr4/DOWNSAMPLED/image/jpeg/34099bb70ee4b27db8dd81dc9c625874/gr4.jpg gr4 gr4.jpg jpg 72854 557 676 IMAGE-DOWNSAMPLED 1-s2.0-S0926860X22003428-gr5.jpg https://s3-eu-west-1.amazonaws.com/prod-ucs-content-store-eu-west/content/pii:S0926860X22003428/gr5/DOWNSAMPLED/image/jpeg/8ef5232d7fed9397f85519b95a443bef/gr5.jpg gr5 gr5.jpg jpg 19321 313 339 IMAGE-DOWNSAMPLED 1-s2.0-S0926860X22003428-gr2.sml https://s3-eu-west-1.amazonaws.com/prod-ucs-content-store-eu-west/content/pii:S0926860X22003428/gr2/THUMBNAIL/image/gif/8ed186e433a0d018ca1a49b92cb11f60/gr2.sml gr2 gr2.sml sml 13523 114 219 IMAGE-THUMBNAIL 1-s2.0-S0926860X22003428-ga1.sml https://s3-eu-west-1.amazonaws.com/prod-ucs-content-store-eu-west/content/pii:S0926860X22003428/ga1/THUMBNAIL/image/gif/3a534cf472620c94a31a7571f32c931e/ga1.sml ga1 true ga1.sml sml 6495 81 219 IMAGE-THUMBNAIL 1-s2.0-S0926860X22003428-gr3.sml https://s3-eu-west-1.amazonaws.com/prod-ucs-content-store-eu-west/content/pii:S0926860X22003428/gr3/THUMBNAIL/image/gif/6b733350ba8d13c1292108683a9c3970/gr3.sml gr3 gr3.sml sml 6565 114 219 IMAGE-THUMBNAIL 1-s2.0-S0926860X22003428-gr1.sml https://s3-eu-west-1.amazonaws.com/prod-ucs-content-store-eu-west/content/pii:S0926860X22003428/gr1/THUMBNAIL/image/gif/6d88107397886890c32278c15b905e24/gr1.sml gr1 gr1.sml sml 14162 121 219 IMAGE-THUMBNAIL 1-s2.0-S0926860X22003428-gr6.sml https://s3-eu-west-1.amazonaws.com/prod-ucs-content-store-eu-west/content/pii:S0926860X22003428/gr6/THUMBNAIL/image/gif/50ed16a72d27a83509031e91a7fcbcda/gr6.sml gr6 gr6.sml sml 10202 147 219 IMAGE-THUMBNAIL 1-s2.0-S0926860X22003428-gr7.sml https://s3-eu-west-1.amazonaws.com/prod-ucs-content-store-eu-west/content/pii:S0926860X22003428/gr7/THUMBNAIL/image/gif/55b3521b3e6df82eff9dae6de5f94e7c/gr7.sml gr7 gr7.sml sml 5995 109 219 IMAGE-THUMBNAIL 1-s2.0-S0926860X22003428-gr4.sml https://s3-eu-west-1.amazonaws.com/prod-ucs-content-store-eu-west/content/pii:S0926860X22003428/gr4/THUMBNAIL/image/gif/2cda67377b76d6779fa1b590695b41b3/gr4.sml gr4 gr4.sml sml 8363 164 199 IMAGE-THUMBNAIL 1-s2.0-S0926860X22003428-gr5.sml https://s3-eu-west-1.amazonaws.com/prod-ucs-content-store-eu-west/content/pii:S0926860X22003428/gr5/THUMBNAIL/image/gif/0b437c02d95bc4c591eb4aed29141413/gr5.sml gr5 gr5.sml sml 5627 164 178 IMAGE-THUMBNAIL 1-s2.0-S0926860X22003428-gr2_lrg.jpg https://s3-eu-west-1.amazonaws.com/prod-ucs-content-store-eu-west/content/pii:S0926860X22003428/gr2/HIGHRES/image/jpeg/cc55b2a537fd109983731d33baf89b98/gr2_lrg.jpg gr2 gr2_lrg.jpg jpg 592151 1552 2994 IMAGE-HIGH-RES 1-s2.0-S0926860X22003428-ga1_lrg.jpg https://s3-eu-west-1.amazonaws.com/prod-ucs-content-store-eu-west/content/pii:S0926860X22003428/ga1/HIGHRES/image/jpeg/94ec7e479163fcf3ce08621f4191155d/ga1_lrg.jpg ga1 true ga1_lrg.jpg jpg 202485 815 2213 IMAGE-HIGH-RES 1-s2.0-S0926860X22003428-gr3_lrg.jpg https://s3-eu-west-1.amazonaws.com/prod-ucs-content-store-eu-west/content/pii:S0926860X22003428/gr3/HIGHRES/image/jpeg/545b93f6cae3c0117516c8461b231188/gr3_lrg.jpg gr3 gr3_lrg.jpg jpg 163614 1300 2495 IMAGE-HIGH-RES 1-s2.0-S0926860X22003428-gr1_lrg.jpg https://s3-eu-west-1.amazonaws.com/prod-ucs-content-store-eu-west/content/pii:S0926860X22003428/gr1/HIGHRES/image/jpeg/d07100e9fc0cb2ba0b2fe6353112540a/gr1_lrg.jpg gr1 gr1_lrg.jpg jpg 195115 916 1663 IMAGE-HIGH-RES 1-s2.0-S0926860X22003428-gr6_lrg.jpg https://s3-eu-west-1.amazonaws.com/prod-ucs-content-store-eu-west/content/pii:S0926860X22003428/gr6/HIGHRES/image/jpeg/a0609be6a94aac265ee9a198a1df8bfe/gr6_lrg.jpg gr6 gr6_lrg.jpg jpg 230843 1674 2495 IMAGE-HIGH-RES 1-s2.0-S0926860X22003428-gr7_lrg.jpg https://s3-eu-west-1.amazonaws.com/prod-ucs-content-store-eu-west/content/pii:S0926860X22003428/gr7/HIGHRES/image/jpeg/00d08c2abf7deff2e6d1c81adb60df87/gr7_lrg.jpg gr7 gr7_lrg.jpg jpg 99132 825 1663 IMAGE-HIGH-RES 1-s2.0-S0926860X22003428-gr4_lrg.jpg https://s3-eu-west-1.amazonaws.com/prod-ucs-content-store-eu-west/content/pii:S0926860X22003428/gr4/HIGHRES/image/jpeg/33bc52918197af3b980b94804d2854ee/gr4_lrg.jpg gr4 gr4_lrg.jpg jpg 462839 2465 2993 IMAGE-HIGH-RES 1-s2.0-S0926860X22003428-gr5_lrg.jpg https://s3-eu-west-1.amazonaws.com/prod-ucs-content-store-eu-west/content/pii:S0926860X22003428/gr5/HIGHRES/image/jpeg/f4a544334226c9d58505b4f2195f9563/gr5_lrg.jpg gr5 gr5_lrg.jpg jpg 116212 1380 1497 IMAGE-HIGH-RES 1-s2.0-S0926860X22003428-mmc1.docx https://s3-eu-west-1.amazonaws.com/prod-ucs-content-store-eu-west/content/pii:S0926860X22003428/mmc1/MAIN/application/vnd.openxmlformats-officedocument.wordprocessingml.document/4417ac23c6ff96c6e350cf4117da72e3/mmc1.docx mmc1 mmc1.docx docx 12164958 APPLICATION 1-s2.0-S0926860X22003428-si0001.svg https://s3-eu-west-1.amazonaws.com/prod-ucs-content-store-eu-west/content/pii:S0926860X22003428/STRIPIN/image/svg+xml/0392e4908f6c74d5f719546a63b63605/si0001.svg si0001 si0001.svg svg 4485 ALTIMG 1-s2.0-S0926860X22003428-si0002.svg https://s3-eu-west-1.amazonaws.com/prod-ucs-content-store-eu-west/content/pii:S0926860X22003428/STRIPIN/image/svg+xml/dae414849ec3fa244432be8e331675eb/si0002.svg si0002 si0002.svg svg 4190 ALTIMG 1-s2.0-S0926860X22003428-si0003.svg https://s3-eu-west-1.amazonaws.com/prod-ucs-content-store-eu-west/content/pii:S0926860X22003428/STRIPIN/image/svg+xml/addbe89d56d4902df292c0c5ea059eee/si0003.svg si0003 si0003.svg svg 4076 ALTIMG 1-s2.0-S0926860X22003428-si0004.svg https://s3-eu-west-1.amazonaws.com/prod-ucs-content-store-eu-west/content/pii:S0926860X22003428/STRIPIN/image/svg+xml/1589c352b7d32cba2adae2078f5d7a6f/si0004.svg si0004 si0004.svg svg 6808 ALTIMG 1-s2.0-S0926860X22003428-si0005.svg https://s3-eu-west-1.amazonaws.com/prod-ucs-content-store-eu-west/content/pii:S0926860X22003428/STRIPIN/image/svg+xml/a4738dd5fb728b9ae91446a475587a79/si0005.svg si0005 si0005.svg svg 1689 ALTIMG 1-s2.0-S0926860X22003428-si0006.svg https://s3-eu-west-1.amazonaws.com/prod-ucs-content-store-eu-west/content/pii:S0926860X22003428/STRIPIN/image/svg+xml/f2440086257f61379620476fcf9da9c5/si0006.svg si0006 si0006.svg svg 1726 ALTIMG 1-s2.0-S0926860X22003428-si0007.svg https://s3-eu-west-1.amazonaws.com/prod-ucs-content-store-eu-west/content/pii:S0926860X22003428/STRIPIN/image/svg+xml/8b1b91f3c6e8a073962ac7e92619ec1d/si0007.svg si0007 si0007.svg svg 1418 ALTIMG 1-s2.0-S0926860X22003428-am.pdf https://s3-eu-west-1.amazonaws.com/prod-ucs-content-store-eu-west/content/egi:10HKJ6P0BGQ/MAIN/application/pdf/93291cdd24072b82e62db0409d3187f7/am.pdf am am.pdf pdf false 983960 AAM-PDF APCATA 118819 118819 S0926-860X(22)00342-8 10.1016/j.apcata.2022.118819 Elsevier B.V. Fig. 1 a) the model structure of V2O5 @Al2O3 and the adsorption of propane on V2O5 @Al2O3 catalyst; b) the model structure of Ni-doped V2O5 @Al2O3 and the adsorption of propane on Ni-doped V2O5 catalyst. Fig. 1 Fig. 2 a) XRD patterns of the as-prepared Ni-doped V2O5 catalysts; b) SEM image of Ni-doped V2O5 catalyst (N4V40Al); c) TEM image of Ni-doped V2O5 catalyst (N4V40Al); d) SAED pattern of Ni-doped V2O5 catalyst (N4V40Al); e) HRTEM image of Ni-doped V2O5 catalyst (N4V40Al). Fig. 2 Fig. 3 Raman spectra of the as-prepared Ni-doped V2O5 catalysts. Fig. 3 Fig. 4 PDH catalytic performance of the as-obtained catalysts. a) Conversions of C3H8 of as-obtained catalysts over 180 min, respectively; b) Selectivity to C3H6 of as-obtained catalysts over 180 min, respectively; c) C3H6 yields of as-obtained catalysts over 180 min, respectively d) Catalytic performance as a function of Ni/V molar ratio. Fig. 4 Fig. 5 H2-TPR profiles and of the as-prepared Ni-doped V2O5 catalysts. Fig. 5 Fig. 6 XPS spectra of a) V 2p and b) Ni 2p of the as-prepared Ni-doped V2O5 catalysts. Fig. 6 Fig. 7 Calculated energy profiles for key reaction intermediates for the conversion of C3H8 to C3H6 on the surface undoped (black line) and Ni-doped vanadium catalysts (red line). Fig. 7 Regulating Ni–O–V bond in nickel doped vanadium catalysts for propane dehydrogenation Junting Huang Conceptualization Methodology Validation Formal analysis Investigation Writing – original draft Qirui Liu Conceptualization Methodology Software Visualization Panpan Li Methodology Software Visualization Yuanrui Ying Methodology Software Visualization Shanshan Chai Methodology Software Visualization Qiuhong Cui Methodology Software Visualization Supervision ⁎ Yijun Yang Resources Funding acquisition Writing – review & editing Supervision ⁎ Xi Wang Resources Funding acquisition Supervision Key Laboratory of Luminescence and Optical Information, Ministry of Education, School of Physical Science and Engineering, Beijing Jiaotong University, Beijing 100044, PR China Key Laboratory of Luminescence and Optical Information, Ministry of Education, School of Physical Science and Engineering, Beijing Jiaotong University Beijing 100044 PR China Key Laboratory of Luminescence and Optical Information, Ministry of Education, School of Physical Science and Engineering, Beijing Jiaotong University, Beijing, 100044, P. R. China ⁎ Corresponding authors. Supported vanadium catalysts are commonly investigated in industrial propane dehydrogenation (PDH) but still remain a great challenge to achieve high propylene selectivity and productivity. Here, Ni species were adopted to regulate the micro-structure of V2O5 supported by γ-Al2O3 via incipient wetness impregnation method. The Ni-doped vanadium catalyst exhibits an optimal propylene yield of 31.88% with a superior propylene selectivity of 85.91% compared to undoped catalyst with a propylene yield of 20.49% (propylene selectivity of 80.77%). Experimental characterizations (such as XPS, XAFS and Raman studies) and DFT calculations were combined to support that the Ni–O–V bonds are active sites for PDH and could promote the charge redistribution from Ni to V based in the Ni–O–V bonds, which greatly strengthens the adsorption of C3H8 over V sites. This endows the Ni-doped vanadium catalyst high propane conversion and superior propylene selectivity. Graphical Abstract ga1 Keywords Dehydrogenation Propane Nickel Vanadium Metal oxide Data availability Data will be made available on request. 1 Introduction Propylene (C3H6), as a significant feedstock in petrochemical industry, is extensively employed in fabricating a series of value-added products, such as oxygenates, polymers as well as personal care products [1–3]. Currently, commercially vast manufacture of propylene is still predominantly achieved by the steam cracking and fluid catalytic cracking of naphtha, light diesel, and other oil byproducts. As the growing production of shale gas, the low price of propane makes the propane dehydrogenation (PDH) process more commercially attractive for the on-purpose propylene production [4]. Compared with other approaches of manufacturing propylene, direct propane dehydrogenation (PDH) to propylene is emphasized by its traits of relatively high propylene yield, high profitability as well as less by-products [5]. In industrial PDH production, Pt-based and CrO x -based catalysts involved correspondingly in the Oleflex and CATONFIN technologies are on behalf of the commercial and efficient strategies of propane dehydrogenation. However, problems of high price due to the scarcity of Pt resources and environmental toxicity of Cr element still remain intricate and unsolved for such traditional catalysts, thus restricting their practical application [6,7]. Therefore, developing non-precious and environmentally-friendly catalysts is of great urgency. The supported vanadium oxide catalysts display relatively superior activity in response to the C–H activation in converting light alkanes into olefins [8–10]. However, high deactivation rate of vanadium oxides catalysts was investigated by researchers due to both the enormous coke deposit and active lattice oxygen depletion, showing relatively low selectivity to propylene. Furthermore, on account of the variety of valence states and coexistence of complex structures, the intrinsic active site of supported vanadium oxides is still under debate. To give further insight into the nature of VO x -based catalysts, scientists made numerous endeavors to enhance the catalytic performance of the monotonous VO x with diverse modifications [11]. For example, U. Rodemerck and coworkers investigated that the extent of coke formation was directly related to the polymerization-degree of VO x species, where the highly polymerized three-dimensional V2O5 nanoparticles lead to more severe coke deposit than monomers and trimers of VO x species, suggesting that the well dispersion and suitable loading of VO x species on support can help sustain the catalytic performance and improve stability [12]. Another feasible strategy to facilitate the catalytic performance is by adding promoters to the metal oxide-based catalysts with metal elements such as Cu, Mo, Mg, Co and non-mental elements like S, P [13–18]. Implementing such elemental doping strategies to VO x -based catalysts can tremendously modulate the chemical environment of V atoms and thus give rise to the optimization of structure-performance relationship. Gong’s group reported a newly developed VO x /Al2O3 with Mo modification, and the Mo doping in the alumina-supported structure was found to greatly activate the lattice oxygen and strengthen the V–O bond, contributing to the enhanced selectivity and stability in more than 100 reaction loops [19]. Yun et al. reported the improved catalytic performance of xCo-yV catalysts catalyst in PDH. The improved performance was associated with the fact that the presence of the V component led to the modification of the interaction of Co species with Al2O3 support [15]. The correlations between bulk V2O5 and doping elements have not been revealed clearly and their refinery structure still remained elusive. Therefore, understanding how to precisely manipulate the electron structure of V atoms, as well as elaborate the hidden nature of inter-relationships, is critical to the further development of catalysts in propane dehydrogenation. Up to now, the vanadium oxide supported on γ-Al2O3 with doping nickel for the dehydrogenation of propane has been scarcely investigated. In order to properly design the nickel doped VO x catalyst, first-principles density functional theory (DFT) calculations were firstly conducted. Herein, nickel doped V2O5, one vanadium atom was replaced by one nickel atom, supported by γ-Al2O3 was chosen as the model catalysts, which pure V2O5, as the VO x spices, supported by γ-Al2O3 was taken as the counter catalyst. We systematically investigated their possible configurations, charge transfer, and the potential adsorption of propane on the catalysts. It can be obviously observed that pure V2O5 exhibits poorer interaction with γ-Al2O3 support, while Ni doped V2O5 crystal shows stronger interaction with γ-Al2O3 support. Furthermore, when propane was adsorbed on the catalysts, the charge density of V active site in Ni doped V2O5 surface became larger, which tends to adsorb the hydrogen atom in the terminal methyl group of C3H8, exhibiting more actively dehydrogenation of propane, compare to undoped V2O5. The experimental investigation confirms this calculation. A series of Ni-doped V2O5 catalysts were prepared by incipient wetness impregnation method. The Ni-doped vanadium catalyst with the Ni/V molar ratio of 1:10 achieves an optimal propylene yield of 31.88% with a superior propylene selectivity of 85.91%. Experimental characterizations, such as XRD, TEM, FITR, Raman, XPS, XAFS, H2-TPR, NH3-TPD, were applied to confirm the evolution of the micro-structure of V2O5 catalysts and the formation of Ni–O–V bonds in Ni-doped catalysts. DFT calculations furtherly support that the Ni–O–V bonds are active sites for PDH and could promote the charge redistribution from Ni to V based in the Ni–O–V bonds, which greatly strengthen the H-adsorption of C3H8 over V sites. 2 Experiment 2.1 Catalyst preparation Ni-VO x /Al2O3 samples were synthesized via an incipient wetness impregnation method. The synthesis of 40 wt% VO x /Al2O3 was accomplished by dissolving NH4VO3 (Aladdin, 99.5%) and oxalic acid dihydrate (Aladdin, 99.0%) in deionized water (3 mL/1 g Al2O3), in which the molar ratio of NH4VO3/H2C2O4∙2 H2O was 0.5. Then, the mixture was stirred by a magnetic rotor in 1000 rpm at room temperature for 4 h when γ-Al2O3 (Aladdin, 99.0%) support was immersed in the solution. After impregnation, the sample was dried at 90 °C for 12 h in vacuum drying oven and subsequently calcined at 500 °C in ambient atmosphere for 2 h with a heating rate of 10 °C per minute. Ultimately, the VO x /Al2O3 was collected and marked as precursor (denoted as N0V40Al) for further doping of Ni. As for the nickel modification of the precursor, a sequential incipient wetness impregnation experiment was conducted via using NiCl2∙6 H2O (Aladdin, 99.0%) to prepare the final Ni-doped catalysts. We labeled the Ni-doped catalysts as N4V40Al, N5V40Al, and N10V40Al, which represent the catalysts with the molar ratios of Ni/V of 1:10, 1:8, and 1:4, respectively. The synthetic condition of introducing Ni to VO x /Al2O3 was identical to the preparation procedure of precursor except that the stirring time was reduced to 30 min 2.2 Catalyst characterization X-ray diffraction (XRD) patterns were performed with 2θ values from 5° to 80° with a scanning speed of 5°/min via utilizing a D/max 2500 diffractometer in which was operated at 40 kV and 40 mA with the graphite-filtered Cu Kα radiation (λ = 1.5418 nm). Transmission electron microscopy (TEM) and High-resolution TEM (HETEM) were conducted to confirm the morphology of catalysts using a Tecnai G2 F20 microscopy operated at 200 kV. Energy dispersive spectroscopy (EDS) elemental mappings were adopted to identify the chemical component of the catalysts. Scanning electron microscopy (SEM) was carried out on a Hitachi S-4800 operated at 3 kV. Raman spectra of catalyst sample were obtained from the LabRAM HR Evolution HORIBA Laser Microscopic Confocal Raman Spectrometer from 50 to 1400 nm−1 with an excitation wavelength of 532 nm. Fourier transform transmission infrared (FTIR) spectra profile were acquired from a TENSOR-27 infrared spectrometer. KBr was used as self-supporting wafer for characterization. H2 temperature-programmed reduction (H2-TPR) measurements were conducted to detect the reducibility of samples on a chemisorption apparatus (Micromeritics AutoChem II 2920) equipped with thermal conduction detector (TCD). Prior to the experiments, 100 mg catalysts were pretreated at 400 °C in He atmosphere for 1 h and then spontaneously cooled down to 50 ℃. Subsequently, samples were placed in mixed gaseous flow of 10 vol% H2 and 90 vol% Ar (40 mL/min) in which temperature was ranging from 50 °C to 800 °C with a heating rate of 10 °C/min for further reduction. NH3 temperature-programmed desorption (NH3-TPD) measurements were carried out to observe the acidity of samples on a chemisorption apparatus (Micromeritics AutoChem II 2920) equipped with thermal conduction detector (TCD). Prior to the experiments, 100 mg catalysts were pretreated at 300 °C in He flow (30 mL/min) for 1 h and then naturally cooled down to 50 ℃. Subsequently, samples were placed in mixed gaseous flow of 10 vol% NH3 and 90 vol% He (40 mL/min), allowing the acid site to be saturated with ammonia. The temperature was ranging from 50 °C to 800 °C with a heating rate of 10 °C/min for ultimate desorption analysis. X-ray photoelectron Spectroscopy (XPS) measurements were carried out on an ESCALAB 250Xi instrument (Thermo Fisher Scientific, USA), incorporating an 18.2 W laser of monochromatic Al Kα radiation. Binding energy 284.8 eV of C1s was taken as reference for experimental calibration. The data of different valance binding energy and surface atomic proportion were analyzed by the software of XPSpeak41. X-ray absorption near-edge spectroscopy (XANES) and extended X-ray absorption fine structure (EXAFS) measurements at Ni K-edge and V K-edge were performed at beamline 1W1B at Beijing Synchrotron Radiation Facility (BSRF). Ni foil, Ni2O3, and NiO for Ni spectra and V foil, and V2O5 for V were employed as the reference samples. XAFS analyses on Ni K-edge and V K-edge spectra were carried out with Athena and Artemis in the Demeter software package. 2.3 Catalytical test A continuous-flow fixed-bed reactor was used to test the catalytic performance of our samples. Generally, 0.5 g of catalyst loaded on quartz wool was foisted into the middle of the quartz tube equipped with a thermoelectric couple inside to monitor the temperature in real- time. Prior to the test, the reactor was heated to 560 °C with a heating rate of 10 °C/min under ambient pressure, simultaneously pumping the pure gas N2 into the reactor with a flow rate of 9 mL/min. Then, the system was fed with a mixed gaseous flow containing a combination of N2 flow (9 mL/min) and C3H8 flow (1 mL/min) for further evaluation. In order to thoroughly reduce the propane, the whole reaction was conducted under relatively low weight hourly space velocity (WHSV=0.25 h−1). Converted product was analyzed by the online GC (Agilent 7890B) incorporated with a flame ionization detector (FID) and a mass selective detector (MSD). Catalytic stabilities of different doping ratio samples were measured via a 3-hour continuous test and integrated into the deactivation curve. The conversion and selectivity of propane were determined by the instantaneous peak area of various gas phase products detected on different time points on stream and subsequently revised by the correction factor. The results of propane conversion, propylene selectivity, propylene yield, and carbon balance were finally calculated by the following concrete equations [20]: C propane % = C 3 H 8 inlet − C 3 H 8 outlet C 3 H 8 inlet × 100 S propylene ( % ) = [ C 3 H 6 ] [ C 3 H 8 ] inlet − [ C 3 H 8 ] outlet × 100 Y propylene ( % ) = C propane ( % ) × S propylene ( % ) 100 Carbon Balance % = 1 / 3 × CH 4 out + 2 / 3 × C 2 H 6 out + 2 / 3 × C 2 H 4 out + C 3 H 8 out + C 3 H 6 out C 3 H 8 in × 100 % where [ C 3 H 8 ] inlet and [ C 3 H 8 ] outlet are the molar flow rates of propane enter in and exit out correspondingly, while C 3 H 6 represents the exit propylene molar flow rate detected by GC instantaneously. 2.4 Computational details First-principles calculations were carried out using density functional theory (DFT) with generalized gradient approximation (GGA) of Perdew-Burke-Ernzerhof (PBE) implemented in the Vienna Ab-Initio Simulation Package (VASP) [21,22]. The valence electronic states were expanded on the basis of plane waves with the core-valence interaction represented using the projector augmented plane wave (PAW) approach [23] and a cutoff of 520 eV. A Γ-centered k-mesh of 2 × 2 × 1 was used for the surface calculations. Convergence is achieved when the forces acting on ions become smaller than 0.02 eV/Å. 3 Results and discussion 3.1 Experimental validation A series of Ni-doped catalysts with various Ni/V molar ratios of Ni-doped catalysts, including N0V40Al (undoped), N4V40Al (1:10), N5V40Al (1:8), and N10V40Al (1:4), were prepared. The powder X-ray diffraction (XRD) patterns of the as-prepared catalysts were showed in Fig. 1a, which was utilized to identify the crystalline phases in the catalysts. As can be seen in the XRD patterns ( Fig. 2a), the prominent peaks at 15.4°, 20.3°, 21.7°, 26.1°, 31.0°, 32.4°, 34.3°correspond to the (200), (001), (101), (110), (301), (011), and (310) crystallographic plane reflections of crystalline V2O5 (JCPDS card No. 41–1426), respectively. Furthermore, crystalline phase of γ-Al2O3 (JCPDS card No. 46–1131) is also verified from XRD pattern. The (220), (040), (041), and (042) planes of γ-Al2O3 can be observed in all XRD patterns of the as-prepared catalysts. Neither NiOx species nor NiAl2O4 spinel structures can be monitored in the XRD pattern for catalysts with all Ni/V molar ratios, while three unnoticeable peaks at 27.8°, 28.9°, and 29.8°, assigned to the (200), (022), and (210) planes of Ni2V2O7 (JCPDS card No. 29–0945), become stronger with the ever-increasing Ni doping [24,25]. Scanning electron microscopy (SEM) images of the as-prepared catalysts were shown in Figs. S1–S4 and Fig. 2b. We can clearly discern that the size of nanoparticles grows with the ever-increasing Ni/V molar ratio. In addition, the morphology of catalyst is transformed from nanoparticle (N0V40Al, N4V40Al, and N5V40Al) to nano-prism (N10V40Al). Transmission electron microscope (TEM) technology was further utilized to confirm the crystalline structure of the as-prepared catalysts. As shown in Figs. S5-S8 and Fig. 2c, the morphologies of Ni-doped catalysts maintained during the doping process, and the size of nanoparticle increases with the ever-increasing content of Ni element. In Fig. 2c, the TEM images of N4V40Al show that the size of nanoparticle is around 40–80 nm. The selected area electron diffraction (SAED) image (Fig. 2d) of N4V40Al catalyst shows obvious diffraction rings, which could be assigned to (301) plane of V2O5 and (122), (200), and (041) planes of γ-Al2O3 support, respectively. The data is consistent with that obtained from XRD patterns. The high-resolution TEM (HRTEM) image of N4V40Al catalyst is shown in Fig. 2e. The lattice space of 0.198 nm is corresponded to the (220) plane of γ-Al2O3 support; while the lattice space of 0.288 nm of a small nanoparticle can be assigned to the (301) plane of V2O5. Energy-dispersive X-ray spectroscopy (EDS) elemental mapping results (in Fig. S5) indicate that Ni element has been successfully doped and uniformly distributed in N4V40Al catalyst. We assume that Ni atoms are uniformly distributed in the catalysts when the Ni doping is lower (for N4V40Al), while crystalline Ni2V2O7 species with abundant Ni–O–V bonds are formed with the increasing Ni doping (especially for N10V40Al). To verify the configuration of the catalyst, Raman spectroscopies using a spectrometer with a 532 nm laser beam were carried out. This technique has been widely utilized to distinguish the VO x species in supported vanadium-based catalysts [9]. As shown in Fig. 3, all samples exhibit a set of broad bands in the range of 100–600 cm−1, which could be ascribed to various vibrational modes of segregated amorphous VO x species [26–28]. Meanwhile, A band around 705 cm−1, which is attributed to the V−O−V stretching vibration shows a slightly blue shift compared with the undoped N0V40Al precursor (702 cm−1). In addition, the band around 994 cm−1 could be assigned to the crystalline V2O5. Furthermore, a blue shift of VO stretching (994 cm−1 to 997 cm−1) can be observed with increasing loading of Ni element, confirming the modification and distortion of V−O bonds generated by the anchored Ni species. Besides, though γ-Al2O3 phase can be barely detected by visible Raman spectroscopy, a relatively weak band near 929 cm−1 ascribed to V−O−Al antisymmetric stretching can be observed in Raman spectrum of the N10V40Al sample [9,29]. We assume that there is probably a reconstruction of surface nature, and the formation of Ni2V2O7 species at lower Ni doping could reinforce the interaction between the active sites of VO x and the support of γ-Al2O3. It is notable that the intensity of a novel set of bands at approximately 841 cm−1 and 861 cm−1 gradually magnifies as the Ni/V molar ratio increases. The emerging band at 841 cm−1 and 861 cm−1 indicates the presence of particular interaction among the Ni−O−V mixed oxide, which is ultimately validated to be the Ni−O−V stretching [30]. Generally, the consequence of Raman spectra can attest the effectiveness of our doping endeavor and modulation strategy to some extent. Together with XRD and TEM data, it can be concluded that the dominant VO x species in our catalysts is crystalline V2O5, and Ni2V2O7 species was formed during the doping procedure. When the Ni doping increases, V2O5 nanocrystal and crystalline Ni2V2O7 species coexists. 3.2 Catalytic performance The undoped and Ni-doped catalysts with different Ni/V molar ratios were tested for propane dehydrogenation (PDH). The PDH catalytic performances regarding conversion, selectivity and yield of all catalysts under specific experimental circumstance were exhibited in Fig. 4a. There was a semblable but brief induction period in the reaction initiation step, which was investigated in almost all catalyst samples. Thus, in order to conduct a more conspicuous comparison as well as analysis, only the consequences of the highest catalytic performance were recorded and calculated. As presented in the Fig. 4a, the undoped catalyst of N0V40Al exhibit a propane conversion of 28% at the initial catalytic stage but underwent remarkable decrease to approximately 14% after three-hour test. By contrast, after Ni modification, the conversion of propane over catalysts with different Ni/V molar ratios displays obvious promotions during the time on stream. All Ni-doped catalysts possessed propane conversions exceeding 30% at the preliminary point, in which the most eminent and outstanding conversion of 43% was particularly obtained by the N4V40Al catalyst. Despite undergoing time on stream of 3 h, all Ni-doped catalysts still sustain a relatively high propane conversion of over 20%. For catalytic stability, it is also notable that the most stable performance with 30% initial propane conversion and 21% at the end was observed over the N10V40Al catalyst during the test. However, remaining catalytic samples correspondingly showed unequal and relatively high deactivation rates. Such vulnerable response to continuous propane flow in elevated temperature was attributed to the severe coking which triggered the coverage and consumption of active sites [9,25]. The propane conversion of N0V40Al precursor was common and nearly identical to the previous work.[11] However, the Ni-doped catalysts introduced here were superior to the non-doped sample, illustrating that the Ni content anchored on precursor was crucial for activating the catalytic sites as well as regulating the electronic state of vanadium. Furthermore, selectivity to C3H6 was another pivotal parameter to identify the catalytic performance of propane dehydrogenation. As shown in the Fig. 4b, profiles of propylene selectivity exhibit a completely reversible trend compared with propane conversion. From the perspective of changing trends, the propylene selectivity of non-doped catalyst of N0V40Al initiates at approximately 80%, which is higher than all of the Ni-doped catalysts, then the propylene selectivity fluctuated and finally maintained at around 83% after three-hour test, indicating the limited selectivity over the dehydrogenation reaction. Though with a relatively low initial propylene selectivity of 72%, the catalysts of N5V40Al and N10V40Al exhibit steady increasing propylene selectivity to 84% after 100 min and sustained as time on stream lapsing. In addition, the propylene selectivity of N4V40Al is of a moderately higher initial data of 79%, and then increases to 89% after 60 min and maintains in the following procedure. The C3H6 yields of Ni-doped catalysts are higher than that of undoped vanadium catalyst, indicating that Ni doping effectively improve the propane dehydrogenation. However, all the Ni-doped catalysts exhibit obvious yield decay in the stream reaction, which is shown in Fig. 4c. 3.3 Structure-performance correlation It has been proved that the dehydrogenation reaction activity mainly depends on the oxidation state of vanadium species, in which V5+, V4+, and V3+ are crucial for the selective reaction [31]. In our vanadium system, the introduction of Ni species greatly improve the catalytic performance of propane dehydrogenation. As shown in Fig. 4d, Ni-doped catalyst with low Ni/V molar ratio (N4V40Al) achieves the optimal propane conversion and propylene selectivity. With ever-increasing Ni/V molar ratios, the propane conversion and propylene selectivity of N5V40Al and N10V40Al are relatively lower, which suggests that suitable Ni doping could regulate the oxidation state of vanadium species, which may effectively tune the catalytic performance. To further uncover the structure-performance correlation of supported vanadium catalysts, H2-TPR experiments were performed to confirm the reducibility. As presented in Fig. 5, for the undoped sample of N0V40Al, a low-temperature peak at around 494 °C corresponds to the formation of V4+ from V5+, while the high-temperature peak appeared at around 556 °C is attributed to the reduction of V valance state from V4+ to V3+ [27,32]. After embedding Ni, the predominant peaks of the catalyst undergo significant shifts to lower temperature, which are in the range of 300–400 °C and 400–500 °C respectively. With the increment of Ni doping, lower reduction temperatures are remarkably observed, indicating the enormously enhanced reactivity of lattice oxygen and reducibility of vanadium oxide on account of the Ni doping. Total reduction area and H2 consumption amount (given in Table S1) of Ni-doped catalysts are consistent with N0V40Al, establishing the carrying capacity of lattice activated oxygen is not implicated by the weakened V-O bond [12,33]. Furthermore, another minor reduction peak located between 500 and 550 °C gradually emerges as Ni/V molar ratio increases from N4V40Al to N10V40Al, in which the temperature interval is highly conformed with the reduction profile of Ni species coordinated vanadium content and alumina support [34–38]. However, compared with these previous works, the peaks of as-synthesized samples exhibit a trend towards low temperature, revealing the excellent dispersion of Ni content on support and the existence of Ni-triggered intensive interaction between the VO x species and the support. The FTIR spectroscopy (Fig. S9) was further conducted to give an insight into the structure of the catalysts. The dominant broad band at 570 cm−1 belongs to bare γ-Al2O3 [39]. The peaks located at 830 and 1020 cm−1 correspond to the asymmetrical stretching of V-O-V units and VO respectively, establishing the presence of crystalline V2O5 phase in the as-synthesized catalysts [40,41]. Meanwhile, all samples exhibit pronounced peaks at the wavenumber of approximately 3460 cm−1 and 1640 cm−1, which can be ascribed to the stretching of hydroxyl group from either the water adsorbed on the surface and the hydroxyl group bonded to the vanadium, respectively [42]. Notably, with the increasing concentration of Ni species, the gradually emerging band around 940 cm−1 related to asymmetrical VO4 unit stretching suggests the emergency of Ni-O-V bridging bonds [41], which is consistent with that obtained by XRD and Raman spectra. In order to evaluate the surface acidity of the as-prepared catalysts, NH3-TPD investigations were carried out. The surface acid properties would be changed when Ni is loaded onto support surfaces [43]. In this case, it is essential to research the acidity of Ni-doped catalysts. The semi-quantitative NH3-TPD data are shown in Table S1, which are collected by the deconvolution of peaks using the Gaussian deconvolution method. The profiles of NH3-TPD for all catalysts exhibit three desorption peaks (Fig. S10). The peak centered at 170–190 °C corresponds to weak acid sites. The peak centered at 230–250 °C is attributed to medium acid sites, and the high temperature desorption peak at 350–410 °C represents strong acid sites on catalyst surface [44]. The percentage of acid sites is calculated according to their corresponding peak area. It can be observed that the Ni-doped catalysts exhibit a larger total peak area compared to pure N0V40Al catalyst. This suggests that more acid sites are formed on the surfaces of Ni-doped samples with the introduction of Ni species. The content of weak acidity for Ni-doped catalysts increases with the increment of Ni content. X-ray photoelectron Spectroscopy (XPS) was further performed to explore the surface elemental nature of catalyst sample as well as verify the latent promotional effect of Ni on VO x . As displayed in Fig. 6a, according to the deconvolution results, the binding energies situated at 517.7, 517.1, 516.0 eV were ascribed to the V 2p3/2 of V5+, V4+, V3+ ions in XPS V 2p spectra, respectively [26,45]. Compared with previous work, a remarkable trend towards higher binding energy level was observed here, establishing the oligomerization of surface VOx species over alumina support [46]. With an incremental Ni loading, the binding energy of different valance states of V species exhibited to be barely discrepant (Table S2), which demonstrated the electron cloud density of V was faintly altered by Ni doping. Since V3+ and V4+ functioning increasingly active in catalytic performance, the proportion of different valance state vanadium species plays a vital role in selective dehydrogenation reaction [13,19], Combining with the peak resolving results, V 2p3/2 peak of N4V40Al was deconvoluted to increasing V4+ and V3+ ratios which accounted for 55% and 10% compared with other catalysts. This indicates the ability of suitable anchored Ni content in regulating the average oxidation state of vanadium species. The spectra of Ni 2p was also depicted in Fig. 6b. In the case of N4V40Al catalyst, two pronounced shake-up fitting peaks of binding energy located at 856.5 eV and 874.1 eV were assigned to the Ni2+ 2p3/2 and Ni2+ 2p1/2, respectively [34,47]. Simultaneously, two satellite peaks for Ni 2p were also appeared on account of spin-orbit coupling, in which one was deconvoluted at 862.4 eV and another at 880.5 eV [48]. The peak locations shown here were highly unmatched to the typical binding energy of NiO species (855 eV of Ni 2p3/2) with an intensive shift to higher level. Integrated with the fact that the vanadium content could increase the electron cloud density of Ni atoms, these results illustrated that a brand new chemical environment was adopted by Ni species due to the co-presence of Ni and V [49]. It can be concluded that Ni interacted with V species with bridging Ni-O-V bond, which modulates the charge density of V, which is consistent with that of XRD and Raman spectra. The band located around 74.5 eV on Al 2p XPS spectra (Fig. S11) is certified to be the γ-Al2O3 phase in our catalyst [50,51]. Based on the O 1 s XPS spectra (Fig. S12), the three predominant peaks approximately at 530.5 531.9, 533.4 eV can be correspondingly ascribed to the oxygen environment of VO x , γ-Al2O3 as well as the O2 loosely bounded on the catalysis surface [52,53]. The coordination environment of V and Ni species was intensively investigated via X-ray absorption fine spectroscopy (XAFS). Fig. S13 exhibits the X-ray absorption near-edge structure (XANES) spectra in the Ni K-edge of N4V40Al and N10V40Al, using Ni foil, Ni2O3 and NiO as the references. The near-edge spectra of N4V40Al and N10V40Al locate near that of NiO, implying that the valence states of those Ni species in N4V40Al and N10V40Al are of oxidized (Ni2+) status. The Fourier transform (FT) k2-weighted χ(k) function of the extended X-ray absorption fine structure (EXAFS) spectra (Fig. S14) of N4V40Al and N10V40Al exhibit dominant peaks at 1.62 Å for Ni–O coordination, consistent with that of NiO, which could be attributed to Ni2V2O7. By contrast, Ni foil shows a typical Ni-Ni pair at 2.20 Å. [54] The V K-edge XANES spectra of these catalysts were compared to V foil and V2O5 reference. As shown in Figs. S15, and S16, the intense pre-edge feature and edge position of both N4V40Al and N10V40Al suggest vanadium has an oxidation state between 0 and 5+, which is consistent with the XPS results [47]. DFT calculations were conducted to gain further insight into the structure of Ni-doped catalyst (N4V40Al) and its influence on catalytic performance. The propane dehydrogenation barriers over Ni-doped catalyst (N4V40Al) and non-doped N4V40Al were simulated and transition state (TS) geometries are shown in Fig. 7. The adsorption energy of propane on vanadium active in N4V40Al is − 0.37 eV, lower than that of N0V40Al (−0.12 eV), which is consistent with that of the DFT prediction and experimental data. In addition, the energy barriers of C3H8 * to TS1 (1.22 eV) and C3H6 * to TS3 (1.26 eV) for N4V40Al are lower than those of N0V40Al (1.49 eV and 1.60 eV, respectively), further implying that Ni doping facilitates propane dehydrogenation. 4 Conclusions In summary, Ni-doped vanadium catalyst was prepared via a facile incipient wetness impregnation method with the formation of active Ni–O–V bonds for enhanced propane dehydrogenation. Combining experimental analysis, such as Raman, XPS, and XAFS, and DFT calculations show that the formed Ni–O–V bond have a profound effect on both regulating the micro-structure and electronic structure of the composite and thus resulting in improved C3H8 adsorption and C3H6 desorption free energy over V sites to achieve enhanced propane conversion and propylene selectivity. It is anticipated that this doping insight can be easily adapted for large-scale catalyst production, and for the wide spread application toward alkane dehydrogenation. CRediT authorship contribution statement Junting Huang: Conceptualization, Methodology, Validation, Formal analysis, Investigation, Writing − original draft. Qirui Liu: Conceptualization, Methodology, Software, Visualization. Panpan Li: Methodology, Software, Visualization. Yuanrui Yin: Methodology, Software, Visualization. Shanshan Chai: Methodology, Software, Visualization. Qiuhong Cui: Methodology, Software, Visualization, Supervision. Yijun Yang: Resources, Funding acquisition, Writing − review & editing, Supervision. Xi Wang: Resources, Funding acquisition, Supervision. Declaration of Competing Interest The authors declare that they have no known competing financial interests or personal relationships that could have appeared to influence the work reported in this paper. Acknowledgments This work was supported by the Fundamental Research Funds for the Central Universities (No. 2019RC021). We thank the beamline 1W1B at Beijing Synchrotron Radiation Facility (BSRF). Appendix A Supporting information Supplementary data associated with this article can be found in the online version at doi:10.1016/j.apcata.2022.118819. Appendix A Supplementary material Supplementary material . References [1] J.J.H.B. Sattler J. Ruiz-Martinez E. Santillan-Jimenez B.M. Weckhuysen Catalytic dehydrogenation of light alkanes on metals and metal oxides Chem. Rev. 114 2014 10613 10653 J.J.H.B. Sattler, J. Ruiz-Martinez, E. Santillan-Jimenez, B.M. Weckhuysen, Catalytic Dehydrogenation of Light Alkanes on Metals and Metal Oxides, Chem. Rev., 114 (2014) 10613–10653. [2] D. Akporiaye S.F. Jensen U. Olsbye F. Rohr E. Rytter M. Rønnekleiv A.I. Spjelkavik A. Novel Highly efficient catalyst for propane dehydrogenation Ind. Eng. Chem. Res. 40 2001 4741 4748 D. Akporiaye, S.F. Jensen, U. Olsbye, F. Rohr, E. Rytter, M. Rønnekleiv, A.I. Spjelkavik, A. Novel, Highly Efficient Catalyst for Propane Dehydrogenation, Ind. Eng. Chem. Res., 40 (2001) 4741–4748. [3] M. Santhosh Kumar D. Chen J.C. Walmsley A. Holmen Dehydrogenation of propane over Pt-SBA-15: Effect of Pt particle size Catal. Commun. 9 2008 747 750 M. Santhosh Kumar, D. Chen, J.C. Walmsley, A. Holmen, Dehydrogenation of propane over Pt-SBA-15: Effect of Pt particle size, Catal. Commun., 9 (2008) 747–750. [4] M. Monai M. Gambino S. Wannakao B.M. Weckhuysen Propane to olefins tandem catalysis: a selective route towards light olefins production Chem. Soc. Rev. 50 2021 11503 11529 M. Monai, M. Gambino, S. Wannakao, B.M. Weckhuysen, Propane to olefins tandem catalysis: a selective route towards light olefins production, Chem. Soc. Rev., 50 (2021) 11503–11529. [5] T. Saelee S. Namuangruk N. Kungwan A. Junkaew Theoretical insight into catalytic propane dehydrogenation on Ni(111) J. Phys. Chem. C. 122 2018 14678 14690 T. Saelee, S. Namuangruk, N. Kungwan, A. Junkaew, Theoretical Insight into Catalytic Propane Dehydrogenation on Ni(111), J. Phys. Chem. C, 122 (2018) 14678–14690. [6] M.M. Bhasin J.H. McCain B.V. Vora T. Imai P.R. Pujadó Dehydrogenation and oxydehydrogenation of paraffins to olefins Appl. Catal. A Gen. 221 2001 397 419 M.M. Bhasin, J.H. McCain, B.V. Vora, T. Imai, P.R. Pujadó, Dehydrogenation and oxydehydrogenation of paraffins to olefins, Appl. Catal. A Gen., 221 (2001) 397–419. [7] S. Han D. Zhao T. Otroshchenko H. Lund U. Bentrup V.A. Kondratenko N. Rockstroh S. Bartling D.E. Doronkin J.-D. Grunwaldt U. Rodemerck D. Linke M. Gao G. Jiang E.V. Kondratenko Elucidating the Nature of Active Sites and Fundamentals for their Creation in Zn-Containing ZrO2–Based Catalysts for Nonoxidative Propane Dehydrogenation ACS Catal. 10 2020 8933 8949 S. Han, D. Zhao, T. Otroshchenko, H. Lund, U. Bentrup, V.A. Kondratenko, N. Rockstroh, S. Bartling, D.E. Doronkin, J.-D. Grunwaldt, U. Rodemerck, D. Linke, M. Gao, G. Jiang, E.V. Kondratenko, Elucidating the Nature of Active Sites and Fundamentals for their Creation in Zn-Containing ZrO2–Based Catalysts for Nonoxidative Propane Dehydrogenation, ACS Catal., 10 (2020) 8933–8949. [8] S. Sokolov V.Y. Bychkov M. Stoyanova U. Rodemerck U. Bentrup D. Linke Y.P. Tyulenin V.N. Korchak E.V. Kondratenko Effect of VO x species and support on coke formation and catalyst stability in nonoxidative propane dehydrogenation ChemCatChem 7 2015 1691 1700 S. Sokolov, V.Y. Bychkov, M. Stoyanova, U. Rodemerck, U. Bentrup, D. Linke, Y.P. Tyulenin, V.N. Korchak, E.V. Kondratenko, Effect of VOx Species and Support on Coke Formation and Catalyst Stability in Nonoxidative Propane Dehydrogenation, ChemCatChem, 7 (2015) 1691–1700. [9] G. Liu Z.-J. Zhao T. Wu L. Zeng J. Gong Nature of the active sites of VO x /Al2O3 catalysts for propane dehydrogenation ACS Catal. 6 2016 5207 5214 G. Liu, Z.-J. Zhao, T. Wu, L. Zeng, J. Gong, Nature of the Active Sites of VOx/Al2O3 Catalysts for Propane Dehydrogenation, ACS Catal., 6 (2016) 5207–5214. [10] C.A. Carrero R. Schloegl I.E. Wachs R. Schomaecker Critical literature review of the kinetics for the oxidative dehydrogenation of propane over well-defined supported vanadium oxide catalysts ACS Catal. 4 2014 3357 3380 C.A. Carrero, R. Schloegl, I.E. Wachs, R. Schomaecker, Critical Literature Review of the Kinetics for the Oxidative Dehydrogenation of Propane over Well-Defined Supported Vanadium Oxide Catalysts, ACS Catal., 4 (2014) 3357–3380. [11] Z.-J. Zhao T. Wu C. Xiong G. Sun R. Mu L. Zeng J. Gong Hydroxyl-mediated non-oxidative propane dehydrogenation over VOx/γ-Al2O3 catalysts with improved stability Angew. Chem. Int. Ed. 57 2018 6791 6795 Z.-J. Zhao, T. Wu, C. Xiong, G. Sun, R. Mu, L. Zeng, J. Gong, Hydroxyl-Mediated Non-oxidative Propane Dehydrogenation over VOx/γ-Al2O3 Catalysts with Improved Stability, Angew. Chem. Int. Ed., 57 (2018) 6791–6795. [12] U. Rodemerck S. Sokolov M. Stoyanova U. Bentrup D. Linke E.V. Kondratenko Influence of support and kind of VO x species on isobutene selectivity and coke deposition in non-oxidative dehydrogenation of isobutane J. Catal. 338 2016 174 183 U. Rodemerck, S. Sokolov, M. Stoyanova, U. Bentrup, D. Linke, E.V. Kondratenko, Influence of support and kind of VOx species on isobutene selectivity and coke deposition in non-oxidative dehydrogenation of isobutane, J. Catal., 338 (2016) 174–183. [13] B.B. Bardin R.J. Davis Characterization of copper and vanadium containing heteropolyacid catalysts for oxidative dehydrogenation of propane Appl. Catal. A Gen. 185 1999 283 292 B.B. Bardin, R.J. Davis, Characterization of copper and vanadium containing heteropolyacid catalysts for oxidative dehydrogenation of propane, Appl. Catal. A Gen., 185 (1999) 283–292. [14] J. Yu Y. Xu V.V. Guliants Propane ammoxidation over Mo–V–Te–Nb–O M1 phase: Density functional theory study of propane oxidative dehydrogenation steps Catal. Today 238 2014 28 34 J. Yu, Y. Xu, V.V. Guliants, Propane ammoxidation over Mo–V–Te–Nb–O M1 phase: Density functional theory study of propane oxidative dehydrogenation steps, Catal. Today, 238 (2014) 28–34. [15] N. Jeon O. Seo J. Oh J. Park I. Chung J. Kim O. Sakata A. Tayal Y. Yun Non-oxidative propane dehydrogenation over alumina-supported Co-V oxide catalysts Appl. Catal. A Gen. 614 2021 118036 N. Jeon, O. Seo, J. Oh, J. Park, I. Chung, J. Kim, O. Sakata, A. Tayal, Y. Yun, Non-oxidative propane dehydrogenation over alumina-supported Co-V oxide catalysts, Appl. Catal. A Gen., 614 (2021) 118036. [16] S. Blanco S.R.G. Carrazán V. Rives Oxidative dehydrogenation of propane on Mg-V-Al mixed oxides Appl. Catal. A Gen. 342 2008 93 98 S. Blanco, S.R.G. Carrazán, V. Rives, Oxidative dehydrogenation of propane on Mg-V-Al mixed oxides, Appl. Catal. A Gen., 342 (2008) 93–98. [17] G. Wang N. Sun C. Gao X. Zhu Y. Sun C. Li H. Shan Promoting mechanism of sulfur addition in catalytic dehydrogenation of isobutane over Mo/MgAl2O4 catalysts Appl. Catal. A Gen. 478 2014 71 80 G. Wang, N. Sun, C. Gao, X. Zhu, Y. Sun, C. Li, H. Shan, Promoting mechanism of sulfur addition in catalytic dehydrogenation of isobutane over Mo/MgAl2O4 catalysts, Appl. Catal. A Gen., 478 (2014) 71–80. [18] Y. Gu H. Liu M. Yang Z. Ma L. Zhao W. Xing P. Wu X. Liu S. Mintova P. Bai Z. Yan Highly stable phosphine modified VO x /Al2O3 catalyst in propane dehydrogenation Appl. Catal. B: Environ. 274 2020 119089 Y. Gu, H. Liu, M. Yang, Z. Ma, L. Zhao, W. Xing, P. Wu, X. Liu, S. Mintova, P. Bai, Z. Yan, Highly stable phosphine modified VOx/Al2O3 catalyst in propane dehydrogenation, Appl. Catal. B: Environ., 274 (2020) 119089. [19] S. Chen L. Zeng R. Mu C. Xiong Z.-J. Zhao C. Zhao C. Pei L. Peng J. Luo L.-S. Fan J. Gong Modulating lattice oxygen in dual-functional Mo–V–O mixed oxides for chemical looping oxidative dehydrogenation J. Am. Chem. Soc. 141 2019 18653 18657 S. Chen, L. Zeng, R. Mu, C. Xiong, Z.-J. Zhao, C. Zhao, C. Pei, L. Peng, J. Luo, L.-S. Fan, J. Gong, Modulating Lattice Oxygen in Dual-Functional Mo–V–O Mixed Oxides for Chemical Looping Oxidative Dehydrogenation, J. Am. Chem. Soc., 141 (2019) 18653–18657. [20] P. Wang J. Yao Q. Jiang X. Gao D. Lin H. Yang L. Wu Y. Tang L. Tan Stabilizing the isolated Pt sites on PtGa/Al2O3 catalyst via silica coating layers for propane dehydrogenation at low temperature Appl. Catal. B: Environ. 300 2022 120731 P. Wang, J. Yao, Q. Jiang, X. Gao, D. Lin, H. Yang, L. Wu, Y. Tang, L. Tan, Stabilizing the isolated Pt sites on PtGa/Al2O3 catalyst via silica coating layers for propane dehydrogenation at low temperature, Appl. Catal. B: Environ., 300 (2022) 120731. [21] G. Kresse J. Furthmüller Efficient iterative schemes for ab initio total-energy calculations using a plane-wave basis set Phys. Rev. B 54 1996 11169 11186 G. Kresse, J. Furthmüller, Efficient iterative schemes for ab initio total-energy calculations using a plane-wave basis set, Phys. Rev. B, 54 (1996) 11169–11186. [22] J.P. Perdew K. Burke M. Ernzerhof Generalized gradient approximation made simple Phys. Rev. Lett. 77 1996 3865 3868 J.P. Perdew, K. Burke, M. Ernzerhof, Generalized Gradient Approximation Made Simple, Phys. Rev. Lett., 77 (1996) 3865–3868. [23] P.E. Blöchl Projector augmented-wave method Phys. Rev. B 50 1994 17953 17979 P.E. Blöchl, Projector augmented-wave method, Phys. Rev. B, 50 (1994) 17953–17979. [24] P.K. de Bokx W.B.A. Wassenberg J.W. Geus Interaction of nickel ions with a γ-Al2O3 support during deposition from aqueous solution J. Catal. 104 1987 86 98 P.K. de Bokx, W.B.A. Wassenberg, J.W. Geus, Interaction of nickel ions with a γ-Al2O3 support during deposition from aqueous solution, J. Catal., 104 (1987) 86–98. [25] P.-P. Li W.-Z. Lang K. Xia L. Luan X. Yan Y.-J. Guo The promotion effects of Ni on the properties of Cr/Al catalysts for propane dehydrogenation reaction Appl. Catal. A Gen. 522 2016 172 179 P.-P. Li, W.-Z. Lang, K. Xia, L. Luan, X. Yan, Y.-J. Guo, The promotion effects of Ni on the properties of Cr/Al catalysts for propane dehydrogenation reaction, Appl. Catal. A Gen., 522 (2016) 172–179. [26] F. Ureña-Begara A. Crunteanu J.-P. Raskin Raman and XPS characterization of vanadium oxide thin films with temperature Appl. Surf. Sci. 403 2017 717 727 F. Ureña-Begara, A. Crunteanu, J.-P. Raskin, Raman and XPS characterization of vanadium oxide thin films with temperature, Appl. Surf. Sci., 403 (2017) 717–727. [27] Z. Wu H.-S. Kim P.C. Stair S. Rugmini S.D. Jackson On the Structure of Vanadium Oxide Supported on Aluminas: UV and Visible Raman Spectroscopy, UV−Visible Diffuse Reflectance Spectroscopy, and Temperature-Programmed Reduction Studies J. Phys. Chem. B 109 2005 2793 2800 Z. Wu, H.-S. Kim, P.C. Stair, S. Rugmini, S.D. Jackson, On the Structure of Vanadium Oxide Supported on Aluminas: UV and Visible Raman Spectroscopy, UV−Visible Diffuse Reflectance Spectroscopy, and Temperature-Programmed Reduction Studies, J. Phys. Chem. B, 109 (2005) 2793–2800. [28] P. Shvets O. Dikaya K. Maksimova A. Goikhman A review of Raman spectroscopy of vanadium oxides J. Raman Spectrosc. 50 2019 1226 1244 P. Shvets, O. Dikaya, K. Maksimova, A. Goikhman, A review of Raman spectroscopy of vanadium oxides, J. Raman Spectrosc., 50 (2019) 1226–1244. [29] Y. Mizukoshi T. Okajima N. Masahashi Local structure of vanadium in Ti-6Al-4V alloy anodized in acetic acid aqueous solution and its contribution to visible light response in photocatalysis Appl. Catal. B: Environ. 162 2015 180 186 Y. Mizukoshi, T. Okajima, N. Masahashi, Local structure of vanadium in Ti-6Al-4V alloy anodized in acetic acid aqueous solution and its contribution to visible light response in photocatalysis, Appl. Catal. B: Environ., 162 (2015) 180–186. [30] A.Z. Khan I. Khan A. Sufyan D. Anjum A. Qurashi Activation of Ni2V2O7 to nonstoichiometric NiV3O8 for solar-driven photoelectrochemical water oxidation, J. Environ Chem. Eng. 9 2021 105526 A.Z. Khan, I. Khan, A. Sufyan, D. Anjum, A. Qurashi, Activation of Ni2V2O7 to nonstoichiometric NiV3O8 for solar-driven photoelectrochemical water oxidation, J. Environ. Chem. Eng., 9 (2021) 105526. [31] V.V. Kaichev Y.A. Chesalov A.A. Saraev A.M. Tsapina A. Mechanistic Study of dehydrogenation of propane over vanadia–titania catalysts J. Phys. Chem. C. 123 2019 19668 19680 V.V. Kaichev, Y.A. Chesalov, A.A. Saraev, A.M. Tsapina, A. Mechanistic Study of Dehydrogenation of Propane over Vanadia–Titania Catalysts, J. Phys. Chem. C, 123 (2019) 19668–19680. [32] J.M. Kanervo M.E. Harlin A.O.I. Krause M.A. Bañares Characterisation of alumina-supported vanadium oxide catalysts by kinetic analysis of H2-TPR data Catal. Today 78 2003 171 180 J.M. Kanervo, M.E. Harlin, A.O.I. Krause, M.A. Bañares, Characterisation of alumina-supported vanadium oxide catalysts by kinetic analysis of H2-TPR data, Catal. Today, 78 (2003) 171–180. [33] X. Gao M.A. Bañares I.E. Wachs Ethane and n-Butane Oxidation over Supported Vanadium Oxide Catalysts: An in Situ UV–Visible Diffuse Reflectance Spectroscopic Investigation J. Catal. 188 1999 325 331 X. Gao, M.A. Bañares, I.E. Wachs, Ethane and n-Butane Oxidation over Supported Vanadium Oxide Catalysts: An in Situ UV–Visible Diffuse Reflectance Spectroscopic Investigation, J. Catal., 188 (1999) 325–331. [34] X. Lu F. Gu Q. Liu J. Gao Y. Liu H. Li L. Jia G. Xu Z. Zhong F. Su VOx promoted Ni catalysts supported on the modified bentonite for CO and CO2 methanation Fuel Process. Technol. 135 2015 34 46 X. Lu, F. Gu, Q. Liu, J. Gao, Y. Liu, H. Li, L. Jia, G. Xu, Z. Zhong, F. Su, VOx promoted Ni catalysts supported on the modified bentonite for CO and CO2 methanation, Fuel Process. Technol., 135 (2015) 34–46. [35] Z. Tian H. Yang Q. Liu C.O. Methanation on Mesoporous Ni–VOx/FDU-12 Catalyst: Effects of the VOx Promoter on Low-Temperature Activity Energy Technol. 8 2020 1901270 Z. Tian, H. Yang, Q. Liu, C.O. Methanation on Mesoporous Ni–VOx/FDU-12 Catalyst: Effects of the VOx Promoter on Low-Temperature Activity, Energy Technol., 8 (2020) 1901270. [36] R.X. Valenzuela J.L.G. Fierro V.C. Corberán E.A. Mamedov Ethane oxidehydrogenation selectivity and reductibility of mixed NiVSb oxides Catal. Lett. 40 1996 223 228 R.X. Valenzuela, J.L.G. Fierro, V.C. Corberán, E.A. Mamedov, Ethane oxidehydrogenation selectivity and reductibility of mixed NiVSb oxides, Catal. Lett., 40 (1996) 223–228. [37] C. Li Y.-W. Chen Temperature-programmed-reduction studies of nickel oxide/alumina catalysts: effects of the preparation method Thermochim. Acta 256 1995 457 465 C. Li, Y.-W. Chen, Temperature-programmed-reduction studies of nickel oxide/alumina catalysts: effects of the preparation method, Thermochim. Acta, 256 (1995) 457–465. [38] Q. Liu F. Gu Z. Zhong G. Xu F. Su V-promoted Ni/Al2O3 catalyst for synthetic natural gas (SNG) production: Catalyst preparation methodologies Korean J. Chem. Eng. 33 2016 1599 1605 Q. Liu, F. Gu, Z. Zhong, G. Xu, F. Su, V-promoted Ni/Al2O3 catalyst for synthetic natural gas (SNG) production: Catalyst preparation methodologies, Korean J. Chem. Eng., 33 (2016) 1599–1605. [39] I.A. Bakare S.A. Mohamed S. Al-Ghamdi S.A. Razzak M.M. Hossain H.I. de Lasa Fluidized bed ODH of ethane to ethylene over VOx–MoOx/γ-Al2O3 catalyst: Desorption kinetics and catalytic activity Chem. Eng. J. 278 2015 207 216 I.A. Bakare, S.A. Mohamed, S. Al-Ghamdi, S.A. Razzak, M.M. Hossain, H.I. de Lasa, Fluidized bed ODH of ethane to ethylene over VOx–MoOx/γ-Al2O3 catalyst: Desorption kinetics and catalytic activity, Chem. Eng. J., 278 (2015) 207–216. [40] V. Iannazzo G. Neri S. Galvagno M. Di Serio R. Tesser E. Santacesaria Oxidative dehydrogenation of isobutane over V2O5-based catalysts prepared by grafting vanadyl alkoxides on TiO2-SiO2 supports Appl. Catal. A Gen. 246 2003 49 68 V. Iannazzo, G. Neri, S. Galvagno, M. Di Serio, R. Tesser, E. Santacesaria, Oxidative dehydrogenation of isobutane over V2O5-based catalysts prepared by grafting vanadyl alkoxides on TiO2-SiO2 supports, Appl. Catal. A Gen., 246 (2003) 49–68. [41] M. Xue J. Ge H. Zhang J. Shen Surface acidic and redox properties of V-Ag-Ni-O catalysts for the selective oxidation of toluene to benzaldehyde Appl. Catal. A Gen. 330 2007 117 126 M. Xue, J. Ge, H. Zhang, J. Shen, Surface acidic and redox properties of V-Ag-Ni-O catalysts for the selective oxidation of toluene to benzaldehyde, Appl. Catal. A Gen., 330 (2007) 117–126. [42] M.L. Balogun S. Adamu M.S. Ba-Shammakh M.M. Hossain Promotional effects of CO2 on the oxidative dehydrogenation of propane over mesoporous VOX/γ-Al2O3 Catal., J. Ind. Eng. Chem. 96 2021 82 97 M.L. Balogun, S. Adamu, M.S. Ba-Shammakh, M.M. Hossain, Promotional effects of CO2 on the oxidative dehydrogenation of propane over mesoporous VOX/γ-Al2O3 catalysts, J. Ind. Eng. Chem., 96 (2021) 82–97. [43] G. Connell J.A. Dumesic The generation of Brønsted and Lewis acid sites on the surface of silica by addition of dopant cations J. Catal. 105 1987 285 298 G. Connell, J.A. Dumesic, The generation of Brønsted and Lewis acid sites on the surface of silica by addition of dopant cations, J. Catal., 105 (1987) 285–298. [44] X. Liu W.-Z. Lang L.-L. Long C.-L. Hu L.-F. Chu Y.-J. Guo Improved catalytic performance in propane dehydrogenation of PtSn/γ-Al2O3 catalysts by doping indium Chem. Eng. J. 247 2014 183 192 X. Liu, W.-Z. Lang, L.-L. Long, C.-L. Hu, L.-F. Chu, Y.-J. Guo, Improved catalytic performance in propane dehydrogenation of PtSn/γ-Al2O3 catalysts by doping indium, Chem. Eng. J., 247 (2014) 183–192. [45] G. Silversmit D. Depla H. Poelman G.B. Marin R. De Gryse Determination of the V2p XPS binding energies for different vanadium oxidation states (V5+ to V0+) J. Electron. Spectrosc. Relat. Phenom. 135 2004 167 175 G. Silversmit, D. Depla, H. Poelman, G.B. Marin, R. De Gryse, Determination of the V2p XPS binding energies for different vanadium oxidation states (V5+ to V0+), J. Electron. Spectrosc. Relat. Phenom, 135 (2004) 167–175. [46] X. Zhao Y. Yan L. Mao M. Fu H. Zhao L. Sun Y. Xiao G. Dong A relationship between the V4+/V5+ ratio and the surface dispersion, surface acidity, and redox performance of V2O5–WO3/TiO2 SCR catalysts RSC Adv. 8 2018 31081 31093 X. Zhao, Y. Yan, L. Mao, M. Fu, H. Zhao, L. Sun, Y. Xiao, G. Dong, A relationship between the V4+/V5+ ratio and the surface dispersion, surface acidity, and redox performance of V2O5–WO3/TiO2 SCR catalysts, RSC Adv., 8 (2018) 31081–31093. [47] Y. Li X. Tan R.K. Hocking X. Bo H. Ren B. Johannessen S.C. Smith C. Zhao Implanting Ni-O-VOx sites into Cu-doped Ni for low-overpotential alkaline hydrogen evolution Nat. Commun. 11 2020 2720 Y. Li, X. Tan, R.K. Hocking, X. Bo, H. Ren, B. Johannessen, S.C. Smith, C. Zhao, Implanting Ni-O-VOx sites into Cu-doped Ni for low-overpotential alkaline hydrogen evolution, Nat. Commun., 11 (2020) 2720. [48] N.S. McIntyre M.G. Cook X-ray photoelectron studies on some oxides and hydroxides of cobalt, nickel, and copper Anal. Chem. 47 1975 2208 2213 N.S. McIntyre, M.G. Cook, X-ray photoelectron studies on some oxides and hydroxides of cobalt, nickel, and copper, Anal. Chem., 47 (1975) 2208–2213. [49] Q. Sun Y. Dong Z. Wang S. Yin C. Zhao Synergistic nanotubular copper-doped nickel catalysts for hydrogen evolution reactions Small 14 2018 1704137 Q. Sun, Y. Dong, Z. Wang, S. Yin, C. Zhao, Synergistic Nanotubular Copper-Doped Nickel Catalysts for Hydrogen Evolution Reactions, Small, 14 (2018) 1704137. [50] E.O. Filatova A.S. Konashuk F. Schaefers V.V. Afanas’ev Metallization-induced oxygen deficiency of γ-Al2O3 layers J. Phys. Chem. C. 120 2016 8979 8985 E.O. Filatova, A.S. Konashuk, F. Schaefers, V.V. Afanas’ev, Metallization-Induced Oxygen Deficiency of γ-Al2O3 Layers, J. Phys. Chem. C, 120 (2016) 8979–8985. [51] H. Zhang K. Zhang G. Wang N. Tang X. Zhu C. Li H. Shan Propane dehydrogenation over core–shell structured Al2O3@Al via hydrothermal oxidation synthesis Fuel 312 2022 122756 H. Zhang, K. Zhang, G. Wang, N. Tang, X. Zhu, C. Li, H. Shan, Propane dehydrogenation over core–shell structured Al2O3@Al via hydrothermal oxidation synthesis, Fuel, 312 (2022) 122756. [52] J. Mendialdua R. Casanova Y. Barbaux XPS studies of V2O5, V6O13, VO2 and V2O3 J. Electron. Spectrosc. Relat. Phenom. 71 1995 249 261 J. Mendialdua, R. Casanova, Y. Barbaux, XPS studies of V2O5, V6O13, VO2 and V2O3, J. Electron. Spectrosc. Relat. Phenom, 71 (1995) 249–261. [53] V. Shoaei-Rad M.R. Bayati F. Golestani-Fard H.R. Zargar J. Javadpour Fabrication of ZrO2–Al2O3 hybrid nano-porous layers through micro arc oxidation process Mater. Lett. 65 2011 1835 1838 V. Shoaei-Rad, M.R. Bayati, F. Golestani-Fard, H.R. Zargar, J. Javadpour, Fabrication of ZrO2–Al2O3 hybrid nano-porous layers through micro arc oxidation process, Mater. Lett., 65 (2011) 1835–1838. [54] H. Yang Q. Lin C. Zhang X. Yu Z. Cheng G. Li Q. Hu X. Ren Q. Zhang J. Liu C. He Carbon dioxide electroreduction on single-atom nickel decorated carbon membranes with industry compatible current densities Nat. Commun. 11 2020 593 H. Yang, Q. Lin, C. Zhang, X. Yu, Z. Cheng, G. Li, Q. Hu, X. Ren, Q. Zhang, J. Liu, C. He, Carbon dioxide electroreduction on single-atom nickel decorated carbon membranes with industry compatible current densities, Nat. Commun., 11 (2020) 593.",
      "scopus-id": "85136089768",
      "coredata": {
        "eid": "1-s2.0-S0926860X22003428",
        "dc:description": "Supported vanadium catalysts are commonly investigated in industrial propane dehydrogenation (PDH) but still remain a great challenge to achieve high propylene selectivity and productivity. Here, Ni species were adopted to regulate the micro-structure of V2O5 supported by γ-Al2O3 via incipient wetness impregnation method. The Ni-doped vanadium catalyst exhibits an optimal propylene yield of 31.88% with a superior propylene selectivity of 85.91% compared to undoped catalyst with a propylene yield of 20.49% (propylene selectivity of 80.77%). Experimental characterizations (such as XPS, XAFS and Raman studies) and DFT calculations were combined to support that the Ni–O–V bonds are active sites for PDH and could promote the charge redistribution from Ni to V based in the Ni–O–V bonds, which greatly strengthens the adsorption of C3H8 over V sites. This endows the Ni-doped vanadium catalyst high propane conversion and superior propylene selectivity.",
        "openArchiveArticle": "false",
        "prism:coverDate": "2022-08-25",
        "openaccessUserLicense": null,
        "prism:aggregationType": "Journal",
        "prism:url": "https://api.elsevier.com/content/article/pii/S0926860X22003428",
        "dc:creator": [
          {
            "@_fa": "true",
            "$": "Huang, Junting"
          },
          {
            "@_fa": "true",
            "$": "Liu, Qirui"
          },
          {
            "@_fa": "true",
            "$": "Li, Panpan"
          },
          {
            "@_fa": "true",
            "$": "Ying, Yuanrui"
          },
          {
            "@_fa": "true",
            "$": "Chai, Shanshan"
          },
          {
            "@_fa": "true",
            "$": "Cui, Qiuhong"
          },
          {
            "@_fa": "true",
            "$": "Yang, Yijun"
          },
          {
            "@_fa": "true",
            "$": "Wang, Xi"
          }
        ],
        "link": [
          {
            "@_fa": "true",
            "@rel": "self",
            "@href": "https://api.elsevier.com/content/article/pii/S0926860X22003428"
          },
          {
            "@_fa": "true",
            "@rel": "scidir",
            "@href": "https://www.sciencedirect.com/science/article/pii/S0926860X22003428"
          }
        ],
        "dc:format": "application/json",
        "openaccessType": null,
        "pii": "S0926-860X(22)00342-8",
        "prism:volume": "644",
        "articleNumber": "118819",
        "prism:publisher": "Elsevier B.V.",
        "dc:title": "Regulating Ni–O–V bond in nickel doped vanadium catalysts for propane dehydrogenation",
        "prism:copyright": "© 2022 Elsevier B.V. All rights reserved.",
        "openaccess": "0",
        "prism:issn": "0926860X",
        "dcterms:subject": [
          {
            "@_fa": "true",
            "$": "Dehydrogenation"
          },
          {
            "@_fa": "true",
            "$": "Propane"
          },
          {
            "@_fa": "true",
            "$": "Nickel"
          },
          {
            "@_fa": "true",
            "$": "Vanadium"
          },
          {
            "@_fa": "true",
            "$": "Metal oxide"
          }
        ],
        "openaccessArticle": "false",
        "prism:publicationName": "Applied Catalysis A: General",
        "openaccessSponsorType": null,
        "prism:pageRange": "118819",
        "pubType": "fla",
        "prism:coverDisplayDate": "25 August 2022",
        "prism:doi": "10.1016/j.apcata.2022.118819",
        "prism:startingPage": "118819",
        "dc:identifier": "doi:10.1016/j.apcata.2022.118819",
        "openaccessSponsorName": null
      },
      "objects": {
        "object": [
          {
            "@category": "standard",
            "@height": "351",
            "@width": "678",
            "@_fa": "true",
            "$": "https://api.elsevier.com/content/object/eid/1-s2.0-S0926860X22003428-gr2.jpg?httpAccept=%2A%2F%2A",
            "@multimediatype": "JPEG image file",
            "@type": "IMAGE-DOWNSAMPLED",
            "@size": "88010",
            "@ref": "gr2",
            "@mimetype": "image/jpeg"
          },
          {
            "@category": "standard",
            "@height": "184",
            "@width": "500",
            "@_fa": "true",
            "$": "https://api.elsevier.com/content/object/eid/1-s2.0-S0926860X22003428-ga1.jpg?httpAccept=%2A%2F%2A",
            "@multimediatype": "JPEG image file",
            "@type": "IMAGE-DOWNSAMPLED",
            "@size": "27481",
            "@ref": "ga1",
            "@mimetype": "image/jpeg"
          },
          {
            "@category": "standard",
            "@height": "294",
            "@width": "565",
            "@_fa": "true",
            "$": "https://api.elsevier.com/content/object/eid/1-s2.0-S0926860X22003428-gr3.jpg?httpAccept=%2A%2F%2A",
            "@multimediatype": "JPEG image file",
            "@type": "IMAGE-DOWNSAMPLED",
            "@size": "32037",
            "@ref": "gr3",
            "@mimetype": "image/jpeg"
          },
          {
            "@category": "standard",
            "@height": "207",
            "@width": "376",
            "@_fa": "true",
            "$": "https://api.elsevier.com/content/object/eid/1-s2.0-S0926860X22003428-gr1.jpg?httpAccept=%2A%2F%2A",
            "@multimediatype": "JPEG image file",
            "@type": "IMAGE-DOWNSAMPLED",
            "@size": "35385",
            "@ref": "gr1",
            "@mimetype": "image/jpeg"
          },
          {
            "@category": "standard",
            "@height": "379",
            "@width": "565",
            "@_fa": "true",
            "$": "https://api.elsevier.com/content/object/eid/1-s2.0-S0926860X22003428-gr6.jpg?httpAccept=%2A%2F%2A",
            "@multimediatype": "JPEG image file",
            "@type": "IMAGE-DOWNSAMPLED",
            "@size": "43561",
            "@ref": "gr6",
            "@mimetype": "image/jpeg"
          },
          {
            "@category": "standard",
            "@height": "187",
            "@width": "376",
            "@_fa": "true",
            "$": "https://api.elsevier.com/content/object/eid/1-s2.0-S0926860X22003428-gr7.jpg?httpAccept=%2A%2F%2A",
            "@multimediatype": "JPEG image file",
            "@type": "IMAGE-DOWNSAMPLED",
            "@size": "17097",
            "@ref": "gr7",
            "@mimetype": "image/jpeg"
          },
          {
            "@category": "standard",
            "@height": "557",
            "@width": "676",
            "@_fa": "true",
            "$": "https://api.elsevier.com/content/object/eid/1-s2.0-S0926860X22003428-gr4.jpg?httpAccept=%2A%2F%2A",
            "@multimediatype": "JPEG image file",
            "@type": "IMAGE-DOWNSAMPLED",
            "@size": "72854",
            "@ref": "gr4",
            "@mimetype": "image/jpeg"
          },
          {
            "@category": "standard",
            "@height": "313",
            "@width": "339",
            "@_fa": "true",
            "$": "https://api.elsevier.com/content/object/eid/1-s2.0-S0926860X22003428-gr5.jpg?httpAccept=%2A%2F%2A",
            "@multimediatype": "JPEG image file",
            "@type": "IMAGE-DOWNSAMPLED",
            "@size": "19321",
            "@ref": "gr5",
            "@mimetype": "image/jpeg"
          },
          {
            "@category": "thumbnail",
            "@height": "114",
            "@width": "219",
            "@_fa": "true",
            "$": "https://api.elsevier.com/content/object/eid/1-s2.0-S0926860X22003428-gr2.sml?httpAccept=%2A%2F%2A",
            "@multimediatype": "GIF image file",
            "@type": "IMAGE-THUMBNAIL",
            "@size": "13523",
            "@ref": "gr2",
            "@mimetype": "image/gif"
          },
          {
            "@category": "thumbnail",
            "@height": "81",
            "@width": "219",
            "@_fa": "true",
            "$": "https://api.elsevier.com/content/object/eid/1-s2.0-S0926860X22003428-ga1.sml?httpAccept=%2A%2F%2A",
            "@multimediatype": "GIF image file",
            "@type": "IMAGE-THUMBNAIL",
            "@size": "6495",
            "@ref": "ga1",
            "@mimetype": "image/gif"
          },
          {
            "@category": "thumbnail",
            "@height": "114",
            "@width": "219",
            "@_fa": "true",
            "$": "https://api.elsevier.com/content/object/eid/1-s2.0-S0926860X22003428-gr3.sml?httpAccept=%2A%2F%2A",
            "@multimediatype": "GIF image file",
            "@type": "IMAGE-THUMBNAIL",
            "@size": "6565",
            "@ref": "gr3",
            "@mimetype": "image/gif"
          },
          {
            "@category": "thumbnail",
            "@height": "121",
            "@width": "219",
            "@_fa": "true",
            "$": "https://api.elsevier.com/content/object/eid/1-s2.0-S0926860X22003428-gr1.sml?httpAccept=%2A%2F%2A",
            "@multimediatype": "GIF image file",
            "@type": "IMAGE-THUMBNAIL",
            "@size": "14162",
            "@ref": "gr1",
            "@mimetype": "image/gif"
          },
          {
            "@category": "thumbnail",
            "@height": "147",
            "@width": "219",
            "@_fa": "true",
            "$": "https://api.elsevier.com/content/object/eid/1-s2.0-S0926860X22003428-gr6.sml?httpAccept=%2A%2F%2A",
            "@multimediatype": "GIF image file",
            "@type": "IMAGE-THUMBNAIL",
            "@size": "10202",
            "@ref": "gr6",
            "@mimetype": "image/gif"
          },
          {
            "@category": "thumbnail",
            "@height": "109",
            "@width": "219",
            "@_fa": "true",
            "$": "https://api.elsevier.com/content/object/eid/1-s2.0-S0926860X22003428-gr7.sml?httpAccept=%2A%2F%2A",
            "@multimediatype": "GIF image file",
            "@type": "IMAGE-THUMBNAIL",
            "@size": "5995",
            "@ref": "gr7",
            "@mimetype": "image/gif"
          },
          {
            "@category": "thumbnail",
            "@height": "164",
            "@width": "199",
            "@_fa": "true",
            "$": "https://api.elsevier.com/content/object/eid/1-s2.0-S0926860X22003428-gr4.sml?httpAccept=%2A%2F%2A",
            "@multimediatype": "GIF image file",
            "@type": "IMAGE-THUMBNAIL",
            "@size": "8363",
            "@ref": "gr4",
            "@mimetype": "image/gif"
          },
          {
            "@category": "thumbnail",
            "@height": "164",
            "@width": "178",
            "@_fa": "true",
            "$": "https://api.elsevier.com/content/object/eid/1-s2.0-S0926860X22003428-gr5.sml?httpAccept=%2A%2F%2A",
            "@multimediatype": "GIF image file",
            "@type": "IMAGE-THUMBNAIL",
            "@size": "5627",
            "@ref": "gr5",
            "@mimetype": "image/gif"
          },
          {
            "@category": "high",
            "@height": "1552",
            "@width": "2994",
            "@_fa": "true",
            "$": "https://api.elsevier.com/content/object/eid/1-s2.0-S0926860X22003428-gr2_lrg.jpg?httpAccept=%2A%2F%2A",
            "@multimediatype": "JPEG image file",
            "@type": "IMAGE-HIGH-RES",
            "@size": "592151",
            "@ref": "gr2",
            "@mimetype": "image/jpeg"
          },
          {
            "@category": "high",
            "@height": "815",
            "@width": "2213",
            "@_fa": "true",
            "$": "https://api.elsevier.com/content/object/eid/1-s2.0-S0926860X22003428-ga1_lrg.jpg?httpAccept=%2A%2F%2A",
            "@multimediatype": "JPEG image file",
            "@type": "IMAGE-HIGH-RES",
            "@size": "202485",
            "@ref": "ga1",
            "@mimetype": "image/jpeg"
          },
          {
            "@category": "high",
            "@height": "1300",
            "@width": "2495",
            "@_fa": "true",
            "$": "https://api.elsevier.com/content/object/eid/1-s2.0-S0926860X22003428-gr3_lrg.jpg?httpAccept=%2A%2F%2A",
            "@multimediatype": "JPEG image file",
            "@type": "IMAGE-HIGH-RES",
            "@size": "163614",
            "@ref": "gr3",
            "@mimetype": "image/jpeg"
          },
          {
            "@category": "high",
            "@height": "916",
            "@width": "1663",
            "@_fa": "true",
            "$": "https://api.elsevier.com/content/object/eid/1-s2.0-S0926860X22003428-gr1_lrg.jpg?httpAccept=%2A%2F%2A",
            "@multimediatype": "JPEG image file",
            "@type": "IMAGE-HIGH-RES",
            "@size": "195115",
            "@ref": "gr1",
            "@mimetype": "image/jpeg"
          },
          {
            "@category": "high",
            "@height": "1674",
            "@width": "2495",
            "@_fa": "true",
            "$": "https://api.elsevier.com/content/object/eid/1-s2.0-S0926860X22003428-gr6_lrg.jpg?httpAccept=%2A%2F%2A",
            "@multimediatype": "JPEG image file",
            "@type": "IMAGE-HIGH-RES",
            "@size": "230843",
            "@ref": "gr6",
            "@mimetype": "image/jpeg"
          },
          {
            "@category": "high",
            "@height": "825",
            "@width": "1663",
            "@_fa": "true",
            "$": "https://api.elsevier.com/content/object/eid/1-s2.0-S0926860X22003428-gr7_lrg.jpg?httpAccept=%2A%2F%2A",
            "@multimediatype": "JPEG image file",
            "@type": "IMAGE-HIGH-RES",
            "@size": "99132",
            "@ref": "gr7",
            "@mimetype": "image/jpeg"
          },
          {
            "@category": "high",
            "@height": "2465",
            "@width": "2993",
            "@_fa": "true",
            "$": "https://api.elsevier.com/content/object/eid/1-s2.0-S0926860X22003428-gr4_lrg.jpg?httpAccept=%2A%2F%2A",
            "@multimediatype": "JPEG image file",
            "@type": "IMAGE-HIGH-RES",
            "@size": "462839",
            "@ref": "gr4",
            "@mimetype": "image/jpeg"
          },
          {
            "@category": "high",
            "@height": "1380",
            "@width": "1497",
            "@_fa": "true",
            "$": "https://api.elsevier.com/content/object/eid/1-s2.0-S0926860X22003428-gr5_lrg.jpg?httpAccept=%2A%2F%2A",
            "@multimediatype": "JPEG image file",
            "@type": "IMAGE-HIGH-RES",
            "@size": "116212",
            "@ref": "gr5",
            "@mimetype": "image/jpeg"
          },
          {
            "@category": "standard",
            "@_fa": "true",
            "$": "https://api.elsevier.com/content/object/eid/1-s2.0-S0926860X22003428-mmc1.docx?httpAccept=%2A%2F%2A",
            "@multimediatype": "Microsoft Word file",
            "@type": "APPLICATION",
            "@size": "12164958",
            "@ref": "mmc1",
            "@mimetype": "application/word"
          },
          {
            "@category": "thumbnail",
            "@_fa": "true",
            "$": "https://api.elsevier.com/content/object/eid/1-s2.0-S0926860X22003428-si0001.svg?httpAccept=%2A%2F%2A",
            "@multimediatype": "Scalable Vector Graphics file",
            "@type": "ALTIMG",
            "@size": "4485",
            "@ref": "si0001",
            "@mimetype": "image/svg+xml"
          },
          {
            "@category": "thumbnail",
            "@_fa": "true",
            "$": "https://api.elsevier.com/content/object/eid/1-s2.0-S0926860X22003428-si0002.svg?httpAccept=%2A%2F%2A",
            "@multimediatype": "Scalable Vector Graphics file",
            "@type": "ALTIMG",
            "@size": "4190",
            "@ref": "si0002",
            "@mimetype": "image/svg+xml"
          },
          {
            "@category": "thumbnail",
            "@_fa": "true",
            "$": "https://api.elsevier.com/content/object/eid/1-s2.0-S0926860X22003428-si0003.svg?httpAccept=%2A%2F%2A",
            "@multimediatype": "Scalable Vector Graphics file",
            "@type": "ALTIMG",
            "@size": "4076",
            "@ref": "si0003",
            "@mimetype": "image/svg+xml"
          },
          {
            "@category": "thumbnail",
            "@_fa": "true",
            "$": "https://api.elsevier.com/content/object/eid/1-s2.0-S0926860X22003428-si0004.svg?httpAccept=%2A%2F%2A",
            "@multimediatype": "Scalable Vector Graphics file",
            "@type": "ALTIMG",
            "@size": "6808",
            "@ref": "si0004",
            "@mimetype": "image/svg+xml"
          },
          {
            "@category": "thumbnail",
            "@_fa": "true",
            "$": "https://api.elsevier.com/content/object/eid/1-s2.0-S0926860X22003428-si0005.svg?httpAccept=%2A%2F%2A",
            "@multimediatype": "Scalable Vector Graphics file",
            "@type": "ALTIMG",
            "@size": "1689",
            "@ref": "si0005",
            "@mimetype": "image/svg+xml"
          },
          {
            "@category": "thumbnail",
            "@_fa": "true",
            "$": "https://api.elsevier.com/content/object/eid/1-s2.0-S0926860X22003428-si0006.svg?httpAccept=%2A%2F%2A",
            "@multimediatype": "Scalable Vector Graphics file",
            "@type": "ALTIMG",
            "@size": "1726",
            "@ref": "si0006",
            "@mimetype": "image/svg+xml"
          },
          {
            "@category": "thumbnail",
            "@_fa": "true",
            "$": "https://api.elsevier.com/content/object/eid/1-s2.0-S0926860X22003428-si0007.svg?httpAccept=%2A%2F%2A",
            "@multimediatype": "Scalable Vector Graphics file",
            "@type": "ALTIMG",
            "@size": "1418",
            "@ref": "si0007",
            "@mimetype": "image/svg+xml"
          },
          {
            "@category": "standard",
            "@_fa": "true",
            "$": "https://api.elsevier.com/content/object/eid/1-s2.0-S0926860X22003428-am.pdf?httpAccept=%2A%2F%2A",
            "@multimediatype": "Acrobat PDF file",
            "@type": "AAM-PDF",
            "@size": "983960",
            "@ref": "am",
            "@mimetype": "application/pdf"
          }
        ]
      },
      "link": {
        "@rel": "abstract",
        "@href": "https://api.elsevier.com/content/abstract/scopus_id/85136089768"
      }
    }
  }
}