{
  "metadata": {
    "title": "Synergical effects of Nb and SiO<ce:inf loc=post>2</ce:inf> on enhanced NO elimination and sulfur resistance of Fe<ce:inf loc=post>2</ce:inf>O<ce:inf loc=post>3</ce:inf>-SCR catalyst",
    "authors": "; ; ",
    "journal": "Applied Catalysis A: General",
    "date": "2025-08-25",
    "doi": "10.1016/j.apcata.2025.120380",
    "abstract": "",
    "uri": "https://api.elsevier.com/content/article/pii/S0926860X25002819",
    "pii": "S0926860X25002819"
  },
  "fulltext": {
    "full-text-retrieval-response": {
      "scopus-eid": "2-s2.0-105006785024",
      "originalText": "serial JL 271346 291210 291744 291809 31 Applied Catalysis A: General APPLIEDCATALYSISAGENERAL 2025-05-28 2025-05-28 2025-05-31 2025-05-31 2025-07-07T20:52:29 1-s2.0-S0926860X25002819 S0926-860X(25)00281-9 S0926860X25002819 10.1016/j.apcata.2025.120380 S300 S300.1 FULL-TEXT 1-s2.0-S0926860X25X00120 2025-07-07T19:56:34.993414Z 0 0 20250825 2025 2025-05-28T06:53:29.443591Z absattachment articleinfo articlenumber articletitlenorm authfirstinitialnorm authfirstsurnamenorm cid cids contenttype copyright crossmark dateloaded dateloadedtxt datesearch datesort dateupdated dco docsubtype doctype doi eid ewtransactionid hubeid indexeddate issn issnnorm itemstage itemtransactionid itemweight openaccess openarchive pg pgfirst pii piinorm pubdatestart pubdatetxt pubyr sortorder srctitle srctitlenorm srctype ssids alllist content subj subheadings suppl tomb volfirst volissue volumelist webpdf webpdfpagecount yearnav figure table e-component body mmlmath acknowledge affil appendices articletitle auth authfirstini authfull authkeywords authlast grantnumber grantsponsor grantsponsorid highlightsabst primabst ref specialabst 0926-860X 0926860X true 704 704 C Volume 704 9 120380 120380 120380 20250825 25 August 2025 2025-08-25 2025 article fla © 2025 Elsevier B.V. All rights are reserved, including those for text and data mining, AI training, and similar technologies. SYNERGICALEFFECTSNBSIO2ENHANCEDNOELIMINATIONSULFURRESISTANCEFE2O3SCRCATALYST ZHAO W 1 Introduction 2 Experimental section 2.1 Catalyst preparation 2.2 Activity tests 2.3 Catalyst characterization 3 Results and discussion 3.1 NH3-SCR activity and sulfur resistance 3.2 Structural properties 3.3 Surface chemical state and redox properties 3.4 Surface acid-base properties 3.5 NO x adsorption properties 3.6 SO2 adsorption properties 3.7 Reaction mechanism 4 Conclusion CRediT authorship contribution statement Acknowledgements Appendix A Supplementary material References ZENG 2020 491 505 Y WANG 2021 462 469 L CHENG 2018 7802 7810 K SUN 2016 35 42 Y LIU 2016 54 69 C ZHAO 2023 5782 5791 W LI 2021 1488 1499 L LI 2022 1454 1461 L XIONG 2016 432 439 Z ZHOU 2021 97 104 Y MOU 2012 2989 2993 X CHEN 2018 Y SONG 2019 Z QU 2017 246 250 W SHI 2018 40509 40522 X XIONG 2016 459 466 Z LIU 2018 165 176 F LI 2021 W ZHAO 2019 H QU 2013 290 297 R ZHANG 2021 9825 9836 W MA 2015 380 394 Z LIU 2016 255 262 Z SHIN 2020 Y WANG 2019 54 60 F LIU 2012 6182 6189 C TAN 2021 4017 4026 W GUO 2021 K LIU 2023 418 428 Y JIA 2021 427 441 X HOU 2018 16675 16683 X JIANG 2015 220 226 S LIU 2016 6688 6696 Z YU 2021 614 622 Y ZHANG 2017 702 710 L STANCIULESCU 2014 201 207 M MA 2018 246 259 L HAO 2024 Y GUO 2022 M LIU 2023 H QIN 2022 B JIANG 2022 Y ZHOU 2017 2181 2198 W WANG 2020 12612 12620 Y PURBIA 2022 R SONG 2024 K SONG 2024 K WANG 2022 C SUN 2018 27 40 C ALI 2018 25 35 S WANG 2021 222 228 Z JI 2021 212 223 J WANG 2019 166 179 X ZHAOX2025X120380 ZHAOX2025X120380XW 2027-05-31T00:00:00.000Z 2027-05-31T00:00:00.000Z http://creativecommons.org/licenses/by-nc-nd/4.0/ © 2025 Elsevier B.V. All rights are reserved, including those for text and data mining, AI training, and similar technologies. 2025-06-03T03:08:00.373Z http://vtw.elsevier.com/data/voc/AddOnTypes/50.7/aggregated-refined 22402027 21806077 National Natural Science Foundation of China http://data.elsevier.com/vocabulary/SciValFunders/501100001809 http://sws.geonames.org/1814991 This work was supported by Financial support from the National Natural Science Foundation of China (22402027, 21806077) is greatly acknowledged. https://doi.org/10.15223/policy-017 https://doi.org/10.15223/policy-037 https://doi.org/10.15223/policy-012 https://doi.org/10.15223/policy-029 https://doi.org/10.15223/policy-004 item S0926-860X(25)00281-9 S0926860X25002819 1-s2.0-S0926860X25002819 10.1016/j.apcata.2025.120380 271346 2025-07-07T19:56:34.993414Z 2025-08-25 1-s2.0-S0926860X25002819-main.pdf https://s3-eu-west-1.amazonaws.com/prod-ucs-content-store-eu-west/content/pii:S0926860X25002819/MAIN/application/pdf/d41f6aaadbd7952fb3307a9e336a9018/main.pdf main.pdf pdf true 6739324 MAIN 11 1-s2.0-S0926860X25002819-main_1.png https://s3-eu-west-1.amazonaws.com/prod-ucs-content-store-eu-west/content/pii:S0926860X25002819/PREVIEW/image/png/41969fdf0e9511cc006c6020eeb74b95/main_1.png main_1.png png 58114 928 656 IMAGE-WEB-PDF 1 1-s2.0-S0926860X25002819-gr10.jpg https://s3-eu-west-1.amazonaws.com/prod-ucs-content-store-eu-west/content/pii:S0926860X25002819/gr10/DOWNSAMPLED/image/jpeg/bc5fc96b24491cf4dd6b992c346aeba0/gr10.jpg gr10 gr10.jpg jpg 92632 736 602 IMAGE-DOWNSAMPLED 1-s2.0-S0926860X25002819-gr11.jpg https://s3-eu-west-1.amazonaws.com/prod-ucs-content-store-eu-west/content/pii:S0926860X25002819/gr11/DOWNSAMPLED/image/jpeg/536a2684c3b8a2d1aad0c423be428808/gr11.jpg gr11 gr11.jpg jpg 57960 368 602 IMAGE-DOWNSAMPLED 1-s2.0-S0926860X25002819-ga1.jpg https://s3-eu-west-1.amazonaws.com/prod-ucs-content-store-eu-west/content/pii:S0926860X25002819/ga1/DOWNSAMPLED/image/jpeg/5ff378646977ae1592c051fc829a5113/ga1.jpg ga1 true ga1.jpg jpg 19183 200 280 IMAGE-DOWNSAMPLED 1-s2.0-S0926860X25002819-gr7.jpg https://s3-eu-west-1.amazonaws.com/prod-ucs-content-store-eu-west/content/pii:S0926860X25002819/gr7/DOWNSAMPLED/image/jpeg/5522df052b15fb7e4f61187704f985b8/gr7.jpg gr7 gr7.jpg jpg 99956 702 602 IMAGE-DOWNSAMPLED 1-s2.0-S0926860X25002819-gr6.jpg https://s3-eu-west-1.amazonaws.com/prod-ucs-content-store-eu-west/content/pii:S0926860X25002819/gr6/DOWNSAMPLED/image/jpeg/9ad939e5dee66d7fd690cfc0fc5b0e71/gr6.jpg gr6 gr6.jpg jpg 22103 286 299 IMAGE-DOWNSAMPLED 1-s2.0-S0926860X25002819-gr9.jpg https://s3-eu-west-1.amazonaws.com/prod-ucs-content-store-eu-west/content/pii:S0926860X25002819/gr9/DOWNSAMPLED/image/jpeg/d76c5ba4ae2c8fa24a6dde92e88559b8/gr9.jpg gr9 gr9.jpg jpg 15635 268 299 IMAGE-DOWNSAMPLED 1-s2.0-S0926860X25002819-gr8.jpg https://s3-eu-west-1.amazonaws.com/prod-ucs-content-store-eu-west/content/pii:S0926860X25002819/gr8/DOWNSAMPLED/image/jpeg/7dd0def2f8e5d9c121fc55187b81f705/gr8.jpg gr8 gr8.jpg jpg 97348 713 602 IMAGE-DOWNSAMPLED 1-s2.0-S0926860X25002819-gr1.jpg https://s3-eu-west-1.amazonaws.com/prod-ucs-content-store-eu-west/content/pii:S0926860X25002819/gr1/DOWNSAMPLED/image/jpeg/fd5907c303e087ce6a5408f1763942ed/gr1.jpg gr1 gr1.jpg jpg 39208 252 602 IMAGE-DOWNSAMPLED 1-s2.0-S0926860X25002819-gr3.jpg https://s3-eu-west-1.amazonaws.com/prod-ucs-content-store-eu-west/content/pii:S0926860X25002819/gr3/DOWNSAMPLED/image/jpeg/069149550e08e08abbeb776662692f84/gr3.jpg gr3 gr3.jpg jpg 34937 244 602 IMAGE-DOWNSAMPLED 1-s2.0-S0926860X25002819-gr2.jpg https://s3-eu-west-1.amazonaws.com/prod-ucs-content-store-eu-west/content/pii:S0926860X25002819/gr2/DOWNSAMPLED/image/jpeg/40483755c789ec5f2c278445655fafaf/gr2.jpg gr2 gr2.jpg jpg 18565 251 299 IMAGE-DOWNSAMPLED 1-s2.0-S0926860X25002819-gr5.jpg https://s3-eu-west-1.amazonaws.com/prod-ucs-content-store-eu-west/content/pii:S0926860X25002819/gr5/DOWNSAMPLED/image/jpeg/23bb718a5630ccc51188085f5ce6d4fb/gr5.jpg gr5 gr5.jpg jpg 35522 271 602 IMAGE-DOWNSAMPLED 1-s2.0-S0926860X25002819-gr4.jpg https://s3-eu-west-1.amazonaws.com/prod-ucs-content-store-eu-west/content/pii:S0926860X25002819/gr4/DOWNSAMPLED/image/jpeg/8ac5fdf8f8a9777524eb7a82cedcc41d/gr4.jpg gr4 gr4.jpg jpg 70976 524 602 IMAGE-DOWNSAMPLED 1-s2.0-S0926860X25002819-gr10.sml https://s3-eu-west-1.amazonaws.com/prod-ucs-content-store-eu-west/content/pii:S0926860X25002819/gr10/THUMBNAIL/image/gif/d05f995de34c4fd0dba752c36ed9ed88/gr10.sml gr10 gr10.sml sml 11333 164 134 IMAGE-THUMBNAIL 1-s2.0-S0926860X25002819-gr11.sml https://s3-eu-west-1.amazonaws.com/prod-ucs-content-store-eu-west/content/pii:S0926860X25002819/gr11/THUMBNAIL/image/gif/63674ab4f4bc2e964638c483a5147683/gr11.sml gr11 gr11.sml sml 15487 134 219 IMAGE-THUMBNAIL 1-s2.0-S0926860X25002819-ga1.sml https://s3-eu-west-1.amazonaws.com/prod-ucs-content-store-eu-west/content/pii:S0926860X25002819/ga1/THUMBNAIL/image/gif/e22617b39126466f442a84cb9e44d377/ga1.sml ga1 true ga1.sml sml 21659 156 219 IMAGE-THUMBNAIL 1-s2.0-S0926860X25002819-gr7.sml https://s3-eu-west-1.amazonaws.com/prod-ucs-content-store-eu-west/content/pii:S0926860X25002819/gr7/THUMBNAIL/image/gif/bbe2dda23f1fa0baab41e688aeaf19be/gr7.sml gr7 gr7.sml sml 12825 163 140 IMAGE-THUMBNAIL 1-s2.0-S0926860X25002819-gr6.sml https://s3-eu-west-1.amazonaws.com/prod-ucs-content-store-eu-west/content/pii:S0926860X25002819/gr6/THUMBNAIL/image/gif/fbf005809b5d6b8171e9f2293a1c8678/gr6.sml gr6 gr6.sml sml 10410 164 171 IMAGE-THUMBNAIL 1-s2.0-S0926860X25002819-gr9.sml https://s3-eu-west-1.amazonaws.com/prod-ucs-content-store-eu-west/content/pii:S0926860X25002819/gr9/THUMBNAIL/image/gif/acc273c093b9828374a87ca7c2fd0025/gr9.sml gr9 gr9.sml sml 5894 164 183 IMAGE-THUMBNAIL 1-s2.0-S0926860X25002819-gr8.sml https://s3-eu-west-1.amazonaws.com/prod-ucs-content-store-eu-west/content/pii:S0926860X25002819/gr8/THUMBNAIL/image/gif/755fa5796e7ce567e6b8b15ab5aaa4ae/gr8.sml gr8 gr8.sml sml 11537 163 138 IMAGE-THUMBNAIL 1-s2.0-S0926860X25002819-gr1.sml https://s3-eu-west-1.amazonaws.com/prod-ucs-content-store-eu-west/content/pii:S0926860X25002819/gr1/THUMBNAIL/image/gif/851b28e837139963d2c13c9b8726bbee/gr1.sml gr1 gr1.sml sml 7081 92 219 IMAGE-THUMBNAIL 1-s2.0-S0926860X25002819-gr3.sml https://s3-eu-west-1.amazonaws.com/prod-ucs-content-store-eu-west/content/pii:S0926860X25002819/gr3/THUMBNAIL/image/gif/a476c89955c116d36fc62bbe95a1a8b4/gr3.sml gr3 gr3.sml sml 6991 89 219 IMAGE-THUMBNAIL 1-s2.0-S0926860X25002819-gr2.sml https://s3-eu-west-1.amazonaws.com/prod-ucs-content-store-eu-west/content/pii:S0926860X25002819/gr2/THUMBNAIL/image/gif/a906d238e241002908815eb81f4e1619/gr2.sml gr2 gr2.sml sml 9302 164 195 IMAGE-THUMBNAIL 1-s2.0-S0926860X25002819-gr5.sml https://s3-eu-west-1.amazonaws.com/prod-ucs-content-store-eu-west/content/pii:S0926860X2500314X/gr5/THUMBNAIL/image/gif/c1b356f628b79b74e8812a92c3e68c19/gr5.sml gr5 gr5.sml sml 7304 99 219 IMAGE-THUMBNAIL 1-s2.0-S0926860X25002819-gr4.sml https://s3-eu-west-1.amazonaws.com/prod-ucs-content-store-eu-west/content/pii:S0926860X2500314X/gr4/THUMBNAIL/image/gif/182e9d9069fca77400353a25d6ad12ef/gr4.sml gr4 gr4.sml sml 10597 164 188 IMAGE-THUMBNAIL 1-s2.0-S0926860X25002819-gr10_lrg.jpg https://s3-eu-west-1.amazonaws.com/prod-ucs-content-store-eu-west/content/pii:S0926860X25002819/HIGHRES/image/jpeg/507b1ad1a4637d09ab3ac90ffba590c8/gr10_lrg.jpg gr10 gr10_lrg.jpg jpg 461204 3252 2661 IMAGE-HIGH-RES 1-s2.0-S0926860X25002819-gr11_lrg.jpg https://s3-eu-west-1.amazonaws.com/prod-ucs-content-store-eu-west/content/pii:S0926860X25002819/HIGHRES/image/jpeg/9e389675c1f8abb49ec32b089b38a6ed/gr11_lrg.jpg gr11 gr11_lrg.jpg jpg 309448 1627 2661 IMAGE-HIGH-RES 1-s2.0-S0926860X25002819-ga1_lrg.jpg https://s3-eu-west-1.amazonaws.com/prod-ucs-content-store-eu-west/content/pii:S0926860X25002819/HIGHRES/image/jpeg/a59f4dfbcc8236bd13023981c9b00f14/ga1_lrg.jpg ga1 true ga1_lrg.jpg jpg 167049 886 1242 IMAGE-HIGH-RES 1-s2.0-S0926860X25002819-gr7_lrg.jpg https://s3-eu-west-1.amazonaws.com/prod-ucs-content-store-eu-west/content/pii:S0926860X25002819/HIGHRES/image/jpeg/b242afcf4019af370ec111678a3d949c/gr7_lrg.jpg gr7 gr7_lrg.jpg jpg 501489 3101 2661 IMAGE-HIGH-RES 1-s2.0-S0926860X25002819-gr6_lrg.jpg https://s3-eu-west-1.amazonaws.com/prod-ucs-content-store-eu-west/content/pii:S0926860X25002819/HIGHRES/image/jpeg/7d4f472748ef3d3a8415945bb5673233/gr6_lrg.jpg gr6 gr6_lrg.jpg jpg 113991 1272 1330 IMAGE-HIGH-RES 1-s2.0-S0926860X25002819-gr9_lrg.jpg https://s3-eu-west-1.amazonaws.com/prod-ucs-content-store-eu-west/content/pii:S0926860X25002819/HIGHRES/image/jpeg/730e3e404dec1e06c348b336fc40fc69/gr9_lrg.jpg gr9 gr9_lrg.jpg jpg 83193 1191 1330 IMAGE-HIGH-RES 1-s2.0-S0926860X25002819-gr8_lrg.jpg https://s3-eu-west-1.amazonaws.com/prod-ucs-content-store-eu-west/content/pii:S0926860X2500314X/HIGHRES/image/jpeg/5aa240f55dee0cc72ce4f9b1506feef5/gr8_lrg.jpg gr8 gr8_lrg.jpg jpg 479880 3152 2661 IMAGE-HIGH-RES 1-s2.0-S0926860X25002819-gr1_lrg.jpg https://s3-eu-west-1.amazonaws.com/prod-ucs-content-store-eu-west/content/pii:S0926860X25002819/HIGHRES/image/jpeg/df8fc1bbbb7c5e8c61ba639b53fa321c/gr1_lrg.jpg gr1 gr1_lrg.jpg jpg 179931 1112 2661 IMAGE-HIGH-RES 1-s2.0-S0926860X25002819-gr3_lrg.jpg https://s3-eu-west-1.amazonaws.com/prod-ucs-content-store-eu-west/content/pii:S0926860X25002819/HIGHRES/image/jpeg/02caa464fc853dedbd1bc3c8fbb88d59/gr3_lrg.jpg gr3 gr3_lrg.jpg jpg 159239 1077 2661 IMAGE-HIGH-RES 1-s2.0-S0926860X25002819-gr2_lrg.jpg https://s3-eu-west-1.amazonaws.com/prod-ucs-content-store-eu-west/content/pii:S0926860X25002819/HIGHRES/image/jpeg/6af3191a2bdc6d170c494a1d36f5fc7c/gr2_lrg.jpg gr2 gr2_lrg.jpg jpg 91828 1118 1330 IMAGE-HIGH-RES 1-s2.0-S0926860X25002819-gr5_lrg.jpg https://s3-eu-west-1.amazonaws.com/prod-ucs-content-store-eu-west/content/pii:S0926860X2500314X/HIGHRES/image/jpeg/8f5ebc1c0cc490e54f261150358214f5/gr5_lrg.jpg gr5 gr5_lrg.jpg jpg 168059 1198 2661 IMAGE-HIGH-RES 1-s2.0-S0926860X25002819-gr4_lrg.jpg https://s3-eu-west-1.amazonaws.com/prod-ucs-content-store-eu-west/content/pii:S0926860X2500314X/HIGHRES/image/jpeg/f36090e9cdf84d678eec0ea56eb9f07e/gr4_lrg.jpg gr4 gr4_lrg.jpg jpg 339108 2316 2661 IMAGE-HIGH-RES 1-s2.0-S0926860X25002819-mmc1.docx https://s3-eu-west-1.amazonaws.com/prod-ucs-content-store-eu-west/content/pii:S0926860X25002819/mmc1/MAIN/application/vnd.openxmlformats-officedocument.wordprocessingml.document/7ddfe50170fe38b2a79845f0c30da57c/mmc1.docx mmc1 mmc1.docx docx 1558913 APPLICATION 1-s2.0-S0926860X25002819-si0001.svg https://s3-eu-west-1.amazonaws.com/prod-ucs-content-store-eu-west/content/pii:S0926860X25002819/image/svg+xml/7982388e35f0c6653aa2a4b7ebb4cf4f/si0001.svg si0001 si0001.svg svg 3967 ALTIMG 1-s2.0-S0926860X25002819-si0002.svg https://s3-eu-west-1.amazonaws.com/prod-ucs-content-store-eu-west/content/pii:S0926860X25002819/image/svg+xml/765d14991ec1af7de4c1b1d6942293b9/si0002.svg si0002 si0002.svg svg 6953 ALTIMG APCATA 120380 120380 S0926-860X(25)00281-9 10.1016/j.apcata.2025.120380 Elsevier B.V. Fig. 1 (a) NH3-SCR activities and (b) sulfur resistance test for catalysts. Test condition: 500 ppm NO, 500 ppm NH3, 5 % O2, 200 ppm SO2 (when used), and balanced with N2, WHSV = 40,000 ml·g−1·h−1. Fig. 1 Fig. 2 XRD patterns for catalysts. Fig. 2 Fig. 3 (a) N2 adsorption/desorption isotherms and (b) corresponding pore size distribution for catalysts. Fig. 3 Fig. 4 (a) XPS spectra of (a) Fe 2p, (b) Nb 3d, (c) Si 2p and (d) O 1s for catalysts. Fig. 4 Fig. 5 (a) H2-TPR profiles and (b) reduction peak area ratio of (I/I + II) over catalysts. Fig. 5 Fig. 6 The peak-differentiating of NH3-TPD profiles over these catalysts. Fig. 6 Fig. 7 In situ DRIFTS of NH3 adsorption as a function of temperature over (a) Fe, (b) FeSi, (c) Nb/Fe and (d) Nb/FeSi catalysts. Fig. 7 Fig. 8 In situ DRIFTS of NO adsorption as a function of temperature over (a) Fe, (b) FeSi (c) Nb/Fe and (d) Nb/FeSi catalysts. Fig. 8 Fig. 9 The NO-TPD profiles of Fe, FeSi, Nb/Fe and Nb/FeSi. Fig. 9 Fig. 10 SO2+O2 co-adsorption tests over (a) Fe, (b) FeSi, (c) Nb/Fe and (d)Nb/FeSi at 225 ℃. Fig. 10 Fig. 11 In situ DRIFTS of (a) NO + O2 adsorption after the pre-adsorption of NH3 and (b) NH3 adsorption after the pre-adsorption of NO + O2 over Nb/FeSi catalyst at 250 ℃. Fig. 11 Table 1 The structural parameters for catalyst. Table 1 Samples SBET (m2/g) Pore Volume (cm3/g) Pore Diameter (nm) Fe 30.4 0.21 27.5 Nb/Fe 26.4 0.14 20.2 FeSi 299.0 0.27 2.8 Nb/FeSi 228.0 0.13 3.3 Table 2 The quantitative analysis data of XPS and NH3-TPD for catalyst. Table 2 Samples Atomic concentration/mol% Atomic ratio/% NH3-TPD Fe O Nb Si Fe2+/Fe (%) Oα/O (%) Acid amount (a.u.) Fe 33.95 66.05 / / 55.1 20.6 7706 Nb/Fe 19.27 71.24 9.49 / 68.8 30.6 19,387 FeSi 13.24 62.84 / 23.92 65.5 68.5 54,918 Nb/FeSi 5.67 66.44 6.17 21.73 65.6 67.6 56,531 Synergical effects of Nb and SiO2 on enhanced NO elimination and sulfur resistance of Fe2O3-SCR catalyst Wenrui Zhao Writing – review & editing Supervision Project administration a Lulu Li Writing – review & editing Supervision Project administration Methodology a ⁎ Peiting Jiang Writing – review & editing Methodology Formal analysis a Kaili Ma Writing – review & editing Supervision Project administration c ⁎⁎ Weixin Zou Writing – review & editing Supervision Project administration b ⁎⁎ a College of Environmental and Chemical Engineering, Jiangsu University of Science and Technology, Zhenjiang 212000, PR China College of Environmental and Chemical Engineering, Jiangsu University of Science and Technology Zhenjiang 212000 PR China College of Environmental and Chemical Engineering, Jiangsu University of Science and Technology, Zhenjiang 212000, P R China b State Key Laboratory of Pollution Control and Resource Reuse, School of the Environment, Jiangsu Key Laboratory of Vehicle Emissions Control, Nanjing University, Nanjing 210023, PR China State Key Laboratory of Pollution Control and Resource Reuse, School of the Environment, Jiangsu Key Laboratory of Vehicle Emissions Control, Nanjing University Nanjing 210023 PR China State Key Laboratory of Pollution Control and Resource Reuse, School of the Environment, Jiangsu Key Laboratory of Vehicle Emissions Control, Nanjing University, Nanjing 210023, P R China c Analysis and Testing Center, Southeast University, Nanjing 211189, PR China Analysis and Testing Center, Southeast University Nanjing 211189 PR China Analysis and Testing Center, Southeast University, Nanjing 211189, P R China ⁎ Corresponding author. ⁎⁎ Correspondence to: College of Environmental and Chemical Engineering, Jiangsu University of Science and Technology, Zhenjiang 212000, PR China. College of Environmental and Chemical Engineering, Jiangsu University of Science and Technology Zhenjiang 212000 PR China The widespread application of Fe-based denitrification catalysts is limited by its unsatisfying low-temperature NO conversion and poor anti-SO2 ability. In this study, by virtue of FeSi composite oxide with large specific surface area as support and NbO x species was used for surface modification to further regulate their acidity and redox properties, significantly improving their NH3-SCR activity. The optimal Nb/FeSi catalyst exhibited over 90 % NO conversion at 250–400 °C and displayed excellent SO2 resistance at 225 °C. The characterization results revealed that Si doping induced an amorphous structure in the FeSi composite and facilitated the formation of distinctive Fe-O–Si bonding configurations. These structural features endowed the Nb/FeSi catalyst with both an enlarged specific surface area and increased Brønsted acid sites, facilitating the dispersion of active components and the activation of NH3 species. Nb could promote the generation of more oxygen vacancies and abundant Brønsted acid sites while inhibits the adsorption of NO x and SO2. Further mechanistic studies revealed that the enhanced Eley-Rideal (E-R) mechanism, where gaseous NO directly reacts with adsorbed NH₃, significantly promoted the NH₃-SCR efficiency of Nb/FeSi. This work provides experimental guidance to improve the activity and sulfur resistance of denitration catalyst by active component control. Graphical Abstract Keywords NO elimination Fe2O3 SiO2 NbO x Sulfur resistance Promoted mechanism Data availability No data was used for the research described in the article. 1 Introduction As a major atmospheric molecular pollutant, nitrogen oxides (NO x ) are mainly derived from the combustion of fossil fuels and high temperature processes involving air [1]. NO x is the main culprit of sour rain and photochemical smoke, and it is also an important cause of haze weather [2]. Ammonia selective catalytic reduction (NH3-SCR) technology is one of the most effective ways to eliminate NO at present [3]. Among them, the V2O5-WO3/TiO2 catalyst is a commercial catalyst that is mainly used for NO elimination of coal -fired power plants. However, the V2O5-WO3/TiO2 catalyst cannot be directly used as an efficient catalyst to eliminate NO directly from flue gases of other NO-emitting sources, such as iron and steel mills, glass mills, cement plants, and so on. This is because the emission temperature of these flue gas is low than 300 °C, which does not match the active temperature window of the V2O5-WO3/TiO2 catalyst (350–420 °C) [4,5], and the SO2 in the flue gas is also easy to cause catalyst poisoning [6,7]. Therefore, developing industrial applications with more extensive and efficient low-temperature tolerant denitration catalysts that are resistant to SO2 poisoning has become a significant challenge. In recent years, researchers have found that catalysts containing Mn, Fe, Cu, and Ce, among others [6,8–10], have shown good low-temperature activity or certain advantages in resisting SO2 poisoning in NO elimination, and are expected to become denitration catalysts for industrial applications [4]. Among them, Fe2O3 has been valued and extensively studied in the NH3-SCR process due to its excellent redox performance, good sulfur resistance, low cost, and environmental friendliness [11]. However, the SCR reaction performance of Fe2O3 alone often has certain limitations due to its small specific surface area and weak surface acidity [12]. Therefore, some researchers have shifted their focus to the modification of Fe-based catalysts to improve their SCR performance. Catalysts such as Fe-Ce [13], Fe-Ti [14] and Fe-Mn [15] were developed and all showed better SCR performance compared to pristine Fe2O3. For example, Xiong et al. [16] prepared FeTi composite oxide catalysts and found that the improved denitrification performance was due to the introduction of Ti which increased the specific surface area, surface acidity and generated more redox active sites. Most of the previous researches have primarily focused on dispersing iron as an active component onto a support or incorporating other active components to form a composite multimetallic catalyst. However, there have been relatively few studies that specifically concentrate on surface modification of Fe2O3 to enhance its selective catalytic reduction (SCR) performance. In 2018, Liu et al. [17] was the first to employ WO3 as an additive for surface modification of Fe2O3 and discovered that the WO3/Fe2O3 catalysts with modified WO3 exhibited excellent SCR activity and sulfur resistance. The characterization results show that this is because the surface modification of WO3 not only significantly increases the surface acid sites of Fe2O3, but also regulates the redox ability of Fe2O3 and inhibits the peroxidation of NH3. However, as a catalyst support, pristine Fe2O3 still has the disadvantages of small specific surface area and easy agglomeration at high temperature. SiO2 is usually used as an additive to improve the physicochemical properties of some supports, such as CeSi [18] and TiSi [19]. The addition of Si can make CeO2 and TiO2 form more lattice defects, which can not only significantly increase its specific surface area, but also produce more oxygen vacancies and acid sites, which will play a positive role in enhancing the SCR activity of the catalyst. In addition, compared with commercial V2O5-WO3/TiO2 catalysts, the active temperature window of Fe-based catalysts shifts towards lower temperatures and exhibits better resistance to SO2 poisoning at low temperatures. However, the small surface area and narrow temperature window of many Fe-based catalysts limit their further industrial applications. Niobium oxides (NbO x ) with high acid strength has recently been used as additives to improve SCR performance. For example, Qu et al. [20] prepared CeNb composite oxides and found that CeNb composite oxides exhibited better SCR performance than pure CeO2, which was mainly due to the high acidity caused by Nb addition and the enhanced redox performance caused by Ce-Nb interaction. Zhang et al. [21] prepared FeNb composite oxides with high specific surface area by CTAB, and found that the excellent SCR performance of FeNb was derived from the increase of specific surface area and the strong interaction between Fe and Nb, which induced more reduced Fe at low temperature. Ma et al. [22] loaded NbO x onto pure CeZr composite oxides and found that 15 wt% Nb addition could maximise the SCR catalytic activity of CeZr to achieve 90 % NO conversion at 200 °C. In summary, adding NbO x is a convenient and useful method to improve the surface acidity properties of catalysts. Therefore, in this work, we attempted to modify NbO x on the surface of Fe-based catalysts due to the weak surface acidity of Fe species. The Fe-based DeNO x catalyst with the best NH3-SCR catalytic performance is obtained by optimizing the added Nb content. In this work, we used Si as a modifier to prepare large specific area FeSiO x composite oxides as support, and NbO x as a surface modifier to modify the FeSiO x support to further boost its NH3-SCR activity and SO2 resistance. The obtained catalysts were investigated in detail using XRD, BET, XPS, H2-TPR, NH3-TPD, NO-TPD and in situ DRIFTs to reveal the key factors for the superior catalytic performance of Nb/FeSi catalysts. It helps to further understand the iron-based catalysts and broaden their industrial applications in the medium-temperature NH3-SCR system. 2 Experimental section 2.1 Catalyst preparation FeSiO x composite oxides were synthesized by a simple co-precipitation method using ferric nitrate hydrate and ethyl orthosilicate as the precursor salts and ammonia (25–28 %) as the precipitant. Ferric nitrate hydrate (Fe(NO3)3⋅9H2O)was dissolved in 50 ml of ethanol with full stirring, and tetraethyl orthosilicate (TEOS) (the molar ratio of Fe/Si = 1/1) was added dropwise, stirred for 30 min, and then aqueous ammonia was added drop by drop to pH ≈ 10, stirred for 2 h and then aged overnight, and the precipitates were washed by ethanol and water for several times, centrifuged, and dried at 80 ℃ overnight, and then baked at 450 ℃ for 4 h under air atmosphere to obtain the FeSiO x composite, abbreviated as FeSi. The same method was used to prepare iron oxide, abbreviated as Fe. The catalysts loaded with NbO x were prepared by a simple wet impregnation method using the obtained FeSi and Fe as supports and niobium acetate as a precursor salt. A certain amount of niobium acetate was accurately weighed and dissolved in 20 ml distilled water, then the prepared FeSi/Fe support was added, in which Nb accounted for 5–20 wt% of the mass of the support, stirred sufficiently, and the liquid was evaporated in an oil bath at 110 °C to a powder form, milled homogeneously, and then roasted at 450 °C for 4 h under an air atmosphere, which led to the preparation of Nb/Fe and Nb/FeSi catalysts. The catalysts with 5 wt% Nb, 10 wt% Nb, 15 wt% Nb, 20 wt% Nb were denoted as Nb/FeSi-5, Nb/FeSi-10, Nb/FeSi-15 and Nb/FeSi-20, respectively. The loading of Nb on pristine Fe was fixed at 10 wt%, abbreviated as Nb/Fe. 2.2 Activity tests 300 mg of catalyst pellets that had been pressed into 40–60 mesh was placed in fixed bed quartz tubes to test its NH3-SCR catalytic performance. The reaction conditions were 500 ppm NO, 500 ppm NH3, 200 ppm SO2 (when used), 5 vol% O2, 5 vol% H2O equilibrated with N2, and a total flow rate of 200 ml/min corresponding to a gas time-vacuum speed (GHSV) of 40,000 ml⋅g−1 h−1. The SCR reaction was carried out at 100–450 °C, and after equilibrium, the exhaust NO and the NO2, NH3, N2O concentration was determined by an online Thermofisher iS10 FTIR spectrometer equipped with a 2 m path-length gas cell (250 ml volume). The NO conversion rate and N2 selectivity were defined by the following equations: N O c onv ersion ( % ) = [ NO ] in − [ NO ] out [ NO ] in ✕ 100 % N 2 sel ectivity ( % ) = [ NO ] in + [ NH 3 ] in − [ NO ] out − [ NH 3 ] out − [ NO 2 ] out − 2 [ N 2 O ] out [ NO ] in + [ NH 3 ] in − [ NO ] out − [ NH 3 ] out ✕ 100 % 2.3 Catalyst characterization The crystal phases of the samples were identified by X-ray diffraction (XRD), Shimadzu XRD-6000 cu-k-α radiation source diffractometer. Signal strength data in the 2θ range of 5–8° were collected at a scanning speed of 5°/min and a step size of 0.02 °. BET specific surface area, total pore volume and average pore diameter were measured by nitrogen adsorption-desorption isotherm at − 196 ℃. X-ray electron spectroscopy (XPS) is performed on the PHI 5000 Versa Probe X-ray photoelectron spectrometer. Monochromatic Al Kα radiation (1486.6 eV, 15 kW). XPS data analysis was performed using Thermo Scientific Avantage software. H2 programmed temperature reduction test (H2-TPR) was carried out on PCA-1200 chemical adsorbent (China). 100 mg samples were placed in U-shaped quartz tube, pretreated for 30 mins at 200 °C with Ar at a flow rate of 30 ml/min, and heated to 800℃ at a rate of 10 ℃/min under flowing H2/Ar. NH3 temperature programmed desorption test (NH3-TPD). 100 mg samples were placed in U-shaped quartz tube, pretreated for 30 mins at 200 °C with Ar at a flow rate of 30 ml/min, then NH3 was adsorbed and saturated with a flow rate of 30 ml/min, Ar purged until the physical adsorbed ammonia disappeared, and heated to 800 ℃ at a speed of 10 ℃/min to collect TCD signals. NO temperature programed desorption (NO-TPD) was carried out in a fixed-bed quartz flow reactor connected with an online flue gas analyser. Approximately 100 mg of each sample were pretreated by highly purified Ar at 200 °C for 1 h and were then saturated with NO + O2 at room temperature. The Ar was introduced into the quartz tube reactor again to remove the weakly adsorbed NO x . After that, the samples were heated to 600 °C at a rate of 10 °C/min in the flowing high purity Ar (100 ml/min). The microscopic morphology of the catalysts was analyzed using a ZEISS Sigma 360 scanning electron microscope (SEM), a JEM-2100plus field-emission transmission electron microscope (TEM). In situ diffuse reflection Fourier Transform infrared (DRIFT) experiments were performed with an MCT detector on the Nicolet Nexus 5700 FT-IR spectrometer, with an average of 32 scans and a resolution of 4 cm−1. Before collecting the background spectra, the samples were pretreated with high-purity N2 at 400 °C for 1 h. Background spectra were then collected in a flowing high-purity N2 stream as the powder samples cooled to the target temperature. The sample spectra were then obtained after the subtraction of the background spectra. The samples were exposed to a controlled stream of specific gas mixture for a certain amount of time: 1000 ppm NH3; 1000 ppm SO2 + 5 % O2; 1000 ppm NO + 5 % O2. All of the reaction gasses were balanced with N2 at a flow rate of 50 ml·min−1. 3 Results and discussion 3.1 NH3-SCR activity and sulfur resistance The NH3-SCR activity result was presented in Fig. 1a, it can be seen that the pristine Fe displays poorly in the NH3-SCR activity test, achieving only about 33 % NO elimination efficiency at 250 °C. In addition, when the temperature rises above 350 °C, the NO conversion of Fe is negative, which may be due to the over-oxidation of NH3 [23]. With the addition of Si, the SCR activity of FeSi is improved in a certain extent, reaching 90 % NO conversion at 300 °C, but it is evident that the activity temperature window of FeSi catalyst is still very narrow. However, the Nb/Fe and Nb/FeSi samples exhibited significantly better SCR activity than the Fe and FeSi samples after modification of the Fe and FeSi surfaces with Nb. Comparing the Nb/FeSi catalysts with different Nb loadings, it can be found that the SCR performance of the Nb/FeSi catalysts shows an increasing and then decreasing trend with the increase of Nb loading amount. Among them, Nb/FeSi-10 showed the best catalytic activity, achieving 90 % NO conversion in the temperature interval of 250–400 ℃. In addition, the N2 selectivity of these prepared catalysts is also evaluated and the result is shown in Fig. S1. It is found that the N2 selectivity of these prepared catalysts is similar and decreases with increasing temperature. In addition, it was found that after adding Nb, the N2 selectivity of Nb/FeSi catalyst was better than that of Fe and FeSi, with over 90 % N2 selectivity in the temperature range of 150–400 °C. In order to be closer to the actual application conditions, SO2 resistance is also an important indicator of whether the denitration catalyst is excellent or not. Therefore, we investigated the stability of the catalyst against SO2 at 225 ℃, and the test results are depicted in Fig. 1b. It can be observed that the activity of the pristine Fe catalyst decreased significantly after the introduction of SO2 and almost no SCR activity after 12 h. For FeSi, Nb/Fe and Nb/FeSi-10 catalysts, the NO conversions decreased slowly after the introduction of SO2, which suggests that the introduction of Si and Nb can improve the anti-SO2 poisoning ability of Fe catalyst. Moreover, the activity of Nb/FeSi-10 catalyst remained the highest NO conversion of 96 % in 12 h after introducing SO2. The above results indicate that Fe species do have certain advantages in resistance to SO2 poisoning, which is keeping with the results reported in the previous studies [24,25]. At the same time, Nb/FeSi-10 showed higher NO conversion than Fe and Nb/Fe catalysts in 225 ℃ SO2 atmosphere, showing a certain industrial application potential. Moreover, we further investigated the influence of the coexistence of H2O and SO2 on the SCR activity of the synthesized catalysts and the result is presented in Fig. S2. After 200 ppm SO2 and 5 vol% H2O was added into reaction gas, the NO conversions of the prepared catalysts begin to slowly decrease, while the deactivation rate of the Nb/FeSi catalyst is the slowest. After 10 h of H2O + SO2 testing, the Nb/FeSi catalyst still remains a NO conversion of over 80 %. However, compared with the individual anti-SO2 test results of these catalysts, the co-introduction of H2O + SO2 has a stronger influence on the catalysts. In addition, the Nb/FeSi catalyst displayed excellent long-term stability, which remained about ∼ 98 % NO conversion within 72 h at 225 °C (Fig. S3). From the above NH3-SCR catalytic performance of these synthesized catalysts, it can be seen that the addition of Si and Nb has a significant impact on the NO conversion and SO2 poisoning resistance of Fe. Hence, the Fe, Nb/Fe, FeSi and Nb/FeSi-10 (denoted as Nb/FeSi in the following section) catalysts are characterized carefully to understand the main factors affecting the superior activity of Nb/FeSi catalyst. 3.2 Structural properties XRD was employed to analyze the crystalline structure of the obtained samples and the XRD profiles of Fe, Nb/Fe, FeSi and Nb/FeSi are shown in Fig. 2. Unlike the XRD pattern of pristine Fe, only a broad diffraction peak could be detected for FeSi, meaning the amorphous form of FeSi after the addition of Si. According to the literature [26], this is due to the fact that the doping of Si hinders the formation of the crystalline phase of FeO x , which is probably the main reason why we did not obtain the characteristic diffraction peaks of FeO x . This can be regarded as a strong evidence for the formation of strong Fe–O–Si bonds and short-range Si–O–Si bonds. After loading Nb, Nb/Fe and Nb/FeSi maintain their original crystal structure and no crystalline phase attributed to niobium oxide can be detected. This indicates that niobium oxide is dispersed on the corresponding support as a non-crystalline phase or the particle size is smaller than the XRD limitation. Moreover, the grain sizes of Fe and Nb/Fe were calculated using the Scherrer formula based XRD pattern. The results showed that the average particle sizes of Fe and Nb/Fe were 28.11 nm and 27.50 nm, respectively, which indicate that the introduction of Nb did not have an obvious impact on the particle size of Fe. Based on the N2 isothermal adsorption-desorption curve and the corresponding BJH pore size distribution curves of the prepared samples in Fig. 3, the textural data is summarized and presented in Table 1. As illustrated in Table 1, the specific surface area of pristine Fe catalyst is only 30.4 m2/g, and the specific surface area of FeSi greatly increase to 299.0 m2/g with the addition of Si into Fe, which is well-backed by previous report that silica is an efficient surface area stabilizer[27]. After the impregnation of Nb, the pore size of the Nb/Fe and Nb/FeSi was refined and the specific surface area reduced, which is mainly due to the blockage of surface pores by loading Nb species. The SEM and TEM images of Fe, Nb/Fe, FeSi, and Nb/FeSi need to be provided in Fig. S4 and Fig. S5. The results indicated that the pristine Fe2O3 was mainly present in irregular elliptical forms with particle sizes of approximately 30–50 nm. After doping Si, FeSi sample showed rough particle surfaces and presented amorphous phases, which was consistent with the XRD result. The SEM and TEM images of Nb/Fe and Nb/FeSi samples were similar with pristine Fe2O3 and FeSi, respectively, which suggested that the surface deposition of Nb species did not have a significant effect on the morphology of Fe and FeSi samples. Combined with the above results, an amorphous FeSi mixed oxide with high specific surface area was successfully synthesized and the texture property of pristine Fe and Nb/Fe catalysts is effectively improved by Si doping for the enlarged surface area and decreased grain size. This is beneficial for better dispersion and anchoring of active components, and can improve the durability of the catalyst. 3.3 Surface chemical state and redox properties To determine the valence state change and coordination environment of these catalyst, XPS characterization and corresponding analysis were conducted. The survey of XPS (Fig. S6 and Table 2) showed that all four catalyst samples contained O and Fe elements, in addition, FeSi contained Si element, Nb/Fe contained Fe element, and Nb/FeSi samples contained Nb and Si elements. The energy level spectra of O 1s, Fe 2p, Nb 3d and Si 2p of the catalyst were further analyzed in detail, as shown in Fig. 4. First, the spectra were charge-corrected by calibrating the adventitious carbon C 1s peak to a binding energy of 284.8 eV. Subsequently, the chemical species were identified and quantified through peak deconvolution using a mixed Gaussian-Lorentzian (Voigt) line shape. As shown in Fig. 4a, two main peaks are observed for O 1s spectra of the pristine Fe, which the peak located at low binding energy (∼ 529.5 eV) is assigned to lattice oxygen species and the peak at high binding energy (∼ 531.4 eV) is ascribed to surface chemical adsorption oxygen species including reactive oxygen species and hydroxyl like compounds [28]. According to the XPS result of SiO2, a highly symmetrical peak at about 532.7 eV was observed on SiO2 which is account for Si-O. Completely different from O 1s XPS for Fe2O3 or Nb/Fe, the O 1s XPS peak on FeSi and Nb/FeSi showed a broader peak shape and was located between the O 1s XPS peaks on Fe and SiO2. Based on this, it could be inferred that this unique O 1s XPS peak on FeSi and Nb/FeSi should be related to the oxygen atom in Fe-O-Si structure, confirming the strong interaction between Fe and Si. What’s more, after the introduction of Si, the surface oxygen content over FeSi and Nb/FeSi catalysts is markedly improved compared with Fe, Nb/Fe. Therefore, we can clearly infer that the increase in surface adsorbed oxygen content of FeSi and Nb/FeSi samples is due to the introduction of Si. In order to explore the interaction between Fe3+/Fe2+ species and Nb/ or Si in the catalysts, the Fe 2p XPS peaks of the catalysts are well analyzed. As shown in Fig. 4(b), the peak belonging to Fe 2p3/2 (∼ 710.4 eV) and the peak attributed to Fe 2p1/2 (∼ 724.6 eV) were observed for all samples, and the characteristic peak belonging to Fe3+ is also observed at ∼ 719.1 eV [29]. Compared to pristine Fe sample, it is worth noting that the peak positions of Nb/Fe, FeSi, and Nb/FeSi samples shift towards higher binding energies with the introduction of Si and Nb. We consider that this change is caused by the interaction between Fe and Si/or Nb, which can affect the electron cloud density of iron species [30]. Furthermore, the Fe 2p3/2 peaks of these catalysts are separated into two peaks, which are assigned to the Fe2+ and Fe3+ species. As the quantitative analysis results listed in Table 2, the relative concentration of Fe2+ in FeSi, Nb/Fe, and Nb/FeSi samples increased by comparison to pristine Fe. According to previous literature reported [31], the change of the content of intermediate valence states usually hints at an interaction between Fe species and Nb/ or Si species, which is contributed to improve the redox performance of these catalysts. Based on the XPS results of O 1s and Fe 2p, it can be inferred that the binding energy of Fe and Si in FeSi composite oxide is shifted compared to pristine Fe and SiO2, indicating the formation of Fe-O-Si structure. Previous literature [27] have indicated that the presence of M-O-Si structure can generate surface hydroxyl groups, which is beneficial for inhibiting the adsorption of SO2 on the catalyst surface. In addition, compared to SiO2, the Si 2p XPS peaks on FeSi and Nb/FeSi catalysts exhibited significant shifts simultaneously. At the same time, the introduction of Si also leads to a shift in the characteristic peak of Nb 3d towards higher binding energy, which well demonstrates the electron induction effect between Fe and Si and Nb. Based on the above XPS analysis results, we can find that the introduction of Nb and Si can affect the electron cloud density of around Fe species, while increase the amount of active species and surface hydroxyl groups on the catalyst, which is conducive to the redox process and the activation of NH3, and thus promote the process of NH3-SCR reaction. H2-temperature programmed reduction (H2-TPR) technology is employed to evaluated the redox ability of the prepared catalysts, the obtained H2-TPR curves are presented in Fig. 5a. As previous studies reported [32,33] the pristine Fe exhibits two reduction peaks located at about 380 and 620 ℃, which are ascribed to the stepwise reduction of the iron oxide species (i.e., Fe2O3→Fe3O4 and Fe3O4→FeO→Fe). Moreover, the onset reduction temperatures of these catalysts were summarized in Fig. 5b, it can be observed that FeSi displayed an initial reduction temperature at about 270 ℃, which is lower than that of pristine Fe, suggesting the Fe-O component in the FeSi sample be more easily reduced by Si doping. However, the reduction peak temperatures of Nb/Fe and Nb/FeSi catalysts are respectively higher than those of pristine Fe and FeSi samples, indicating that the deposition of Nb onto the Fe or FeSi surface could delay the reduction of iron oxide species towards high temperature. Furthermore, we can find that the low-temperature reduction peak area of Si containing samples (FeSi and Nb/FeSi) (I/I + II peak area ratio) are significantly higher than those of pristine Fe and Nb/Fe samples, indicating that the introduction of Si could make more iron oxide species be reduced at low temperatures. This enhancement is mainly owing to the reduction of grain sizes and the existence of Fe–O–M bonds [19,34]. To summarize, Si doping could improve the reducibility of pristine Fe, while the deposition of Nb onto pristine Fe and FeSi surface inhibits the oxidation ability of bulk iron oxide. It was reported that the existence of bulk iron oxide can cause non-selective oxidation of NH3 in the NH3-SCR reaction, leading to a decrease in denitrification efficiency. And the deposition of acidic oxide WO3 on the surface of pristine Fe can significantly weaken the NH3 over-oxidation activity of bulk iron oxide [34,35]. As the individual NH3 oxidation reaction results shown in Fig. S7, the NH3 oxidation activity of Nb/Fe and Nb/FeSi samples deposition with Nb is significantly inhibited. As discussed above the H2-TPR results, the introduction of Nb and Si can significantly tune the reduction behavior of these prepared catalyst, which is conducive to improve the low-temperature NH3-SCR activity and inhibit the over-oxidation of NH3 at high temperatures. 3.4 Surface acid-base properties It is well known that the adsorption and activation of NH3 molecules is a key factor affecting the NH3-SCR catalytic activity. Consequently, NH3-temperature programmed adsorption-desorption (NH3-TPD) experiment was conducted to evaluated the surface acidic properties of these synthesized catalysts. The obtained NH3-TPD profiles are shown in Fig. 6, all the samples displayed two broad peaks within the test temperature region belonging to the desorption of NH3 molecules adsorbed on the catalysts surface. According to literatures reported [26,36], the desorption peak at lower temperature belongs to the desorption of NH3 species adsorbed on weak acid sites, while the desorption peak at higher temperature of about 300 ℃ is related to the desorption of NH3 species adsorbed on medium strong acid sites. The desorption peak area is considered to be proportional to the amount of surface acid sites and the integrated area of these NH3 desorption peaks are displayed in Table 2. We can find that the desorption peak area could be ranked in the order Nb/FeSi > FeSi > Nb/Fe > Fe, which indicates that the introduce of Si or Nb can both increase the surface acid sites of the pristine Fe catalyst. The enhancement is related to the increase in the specific area of the catalysts and the existence of Si-OH or Nb-OH. It is interesting that although the specific surface area of FeSi is much larger than that of Nb/FeSi, the Nb/FeSi sample possess more surface acid sites. Therefore, the Nb/FeSi catalyst with the most surface acid sites exhibited the best NH3-SCR catalytic activity. The NH3 adsorption and activation behavior are further characterized by in situ DRIFTS of NH3 adsorption experiment. As a result, the in situ DRIFTS experiments of NH3 adsorption-desorption over pristine Fe, FeSi, Nb/Fe and Nb/FeSi catalysts are conducted and the obtained results are displayed in Fig. 7. As presented in Fig. 7a, after NH3 adsorption and N2 purge, some infrared bands assigned to NH3 adsorbed species on pristine Fe were detected. According to literatures, the bands round 1601、1182 and 1141 cm−1 could be attributed to the asymmetric and symmetric bending vibrations of coordinated NH3 species on Lewis acid sites, and the infrared vibration band at 1547 cm−1 is ascribed to the monodentate nitrate species produced by NH3 oxidation[37]. All of these vibration bands decrease with the elevation of temperature. For FeSi sample in Fig. 7b, the DRIFTS spectra of NH3 adsorption on FeSi surface showed obviously different features from pristine Fe. After NH3 adsorption, we can find that the surface acid sites of Nb/FeSi are mainly Brønsted acid sites (1689 cm−1 and 1439 cm−1 attributed to Brønsted acid sites, 1610 cm−1 assigned to Lewis acid site), while the pristine Fe are mainly Lewis acid sites[38]. For Nb/Fe sample in Fig. 7c and Nb/FeSi sample in Fig. 7d, the large amount of Brønsted acid sites were also observed (1436 and 1650 cm−1 for Nb/Fe, 1439 and 1689 cm−1 for Nb/FeSi). According to previous literature[21,39], the Brønsted acid sites on the FeSi, Nb/Fe and Nb/FeSi surface mainly comes from the exposed NbO, Nb-OH and Si-OH sites because of the introduction of Nb and Si. Combining the NH3-SCR activity and NH3 adsorption results, we can clearly find that these catalysts possess more Brønsted acid sites than pristine Fe and they exhibit better SCR catalytic activity, which suggests that the increase of Brønsted acid sites is beneficial for enhancing its NH3-SCR activity. 3.5 NO x adsorption properties Fig. 8 shows the influence of the introduction of Nb and Si on the NO x adsorption behavior of Nb/FeSi catalyst. For pristine Fe catalyst (Fig. 8a), after NO + O2 adsorption and N2 purge, the intense infrared bands assigned to bridge nitrates (1603 cm−1, 1226 cm−1) and monodentate nitrates (1253 cm−1) are clearly detected at 50 ℃. The bands attributed to bidentate nitrates at 1567 cm−1 and 1532 cm−1 are also observed [40,41]. With the increase of temperature, the adsorbed bridge nitrate remained stable at 400 ℃. However, the band intensity of bidentate nitrates increased visibly, while the intensity of monodentate nitrates decreased, possibly due to the conversion of monodentate nitrates to more heat-stable bidentate nitrates. For FeSi catalyst (Fig. 8b), the infrared bands assigned to bridge nitrate (1606 cm−1), bidentate nitrate (1579 cm−1), monodentate nitrate (1302 cm−1) and nitro species (1346 cm−1) were detected after NO + O2 adsorption [42]. Obviously, it can be found that when the temperature rises from 50 ℃ to 400 ℃, the infrared band intensity of all kinds of nitrates adsorbed on FeSi catalyst gradually decreases and disappear at 400 ℃. Comparing the NO + O2 adsorption-desorption behavior of Fe and FeSi, the difference is that the adsorption strength of nitrates on Nb/FeSi catalysts is weaker and easier to desorption at high temperature. With regard to Nb/Fe (Fig. 8c) and Nb/FeSi (Fig. 8d), similarly, all the infrared bands for bridging nitrates, bidentate nitrates, monodentate nitrates and gaseous NO molecules are also observed at the corresponding positions, and the variation trend of these bands is very similar with those of FeSi catalyst. However, what is worth our attention is the band intensities of these adsorbed NO x species on the surface of Nb/Fe and Nb/FeSi catalysts are also weaker than those on the surface of pristine Fe. This indicates that the adsorption of NO x species on FeSi, Nb/Fe and Nb/FeSi catalyst is inhibited with Nb and Si introduced. According to previous studies [43,44], competitive adsorption usually exists between thermally stable nitrate species and NH3, which may inhibit the adsorption and activation of NH3 species. In order to further compare the content of adsorbed NO x species on the synthesized catalysts, the NO-TPD experiments are conducted. The catalyst was first saturated with NO + O2 adsorption at 30 °C, then purged with Ar, and finally the NO desorption curve of the catalyst between 30 and 600 °C was collected. As shown in Fig. 9, two obvious NO desorption peaks are observed on the NO-TPD profile of pure Fe catalyst. According to previous studies [45,46], the area of the desorption peak is linearly correlated with the amount of adsorbed nitrate species on the catalyst surface, so we can determine the amount of adsorbed nitrate species of the synthesized catalysts by comparing their desorption peak areas of the NO-TPD profiles. It can be clearly observed that the desorption peak area is ranked in the order Fe > FeSi > Nb/FeSi Nb/Fe, which indicates that the introduce of Si or Nb can both inhibit the adsorption of nitrate species. Combing the results of in situ DRIFTs of NO+O2 co-adsorption and NO-TPD, the addition of Nb and Si can weaken the adsorption ability of NO x in the Nb/FeSi catalyst to a certain extent, weakens the thermal stability of nitrate, and releases more NH3 adsorption sites, which is beneficial to improve the NH3-SCR activity of Nb/FeSi catalyst. 3.6 SO2 adsorption properties The in situ DRIFTS characterization of SO2+O2 co-adsorption were conducted at 225 °C to further explore the difference of these prepared catalysts on the SO2 adsorption capacity and the types of the sulfates. As shown in Fig. 10 a, when 1000 ppm SO2 and 5 vol% O2 is introduced into the reaction cell, intense bands (900–1400 cm−1) assigned to the sulfate species could be detected. This indicates that SO2 will adsorb on the catalyst surface and cause sulfate deposition, which will interfere with the stable adsorption of NH3 and other active components on the catalyst and cut off the continuous reduction of NO [47]. Among them, the peak at 1080 cm−1 and 996 cm−1 is attributed to the symmetrical stretching frequency of O-S-O, and the peak at 1360 cm−1, 1152 cm−1 and 1298 cm−1 is attributed to the asymmetric stretching frequency of OS=O of metal oxide surface sulfate [48,49]. As for FeSi (Fig. 10b), most of the bands in the spectra of Fe2O3 were undetected, and only several weak bands around 1340 cm−1, assigned to a structure with OS=O. This is because that Fe ions in FeSi were bonded to Si-O and the existence of hydroxyl groups, and the deeper sulfation was suppressed. As for Nb/Fe catalyst (Fig. 10c), the detected types of sulfate were the same as Fe2O3, but the adsorption peak strength was significantly weakened, indicating that the surface acid site brought about by the introduction of Nb also inhibited the adsorption of SO2.With regard with Nb/FeSi catalyst (Fig. 10d), only very weak infrared peaks can be observed, which is mainly due to the presence of hydroxyl groups on the surface of Nb/FeSi catalyst and the combined effect of surface acid sites. Therefore, it can be inferred that the increase of surface acid sites and the presence of hydroxyl groups can help Nb/FeSi exhibit excellent sulfur resistance by inhibiting the adsorption of SO2. 3.7 Reaction mechanism The NH3-SCR reaction mechanism on the Nb/FeSi catalyst surface was explored by in situ DRIFTS experiment. As shown in Fig. 11, The reactions of NH3 between pre-adsorbed NO+O2 and NO + O2 between pre-adsorbed NH3 as a function of time were studied. After NH3 adsorption at 250 ℃, some infrared bands attributed to adsorbed NH3 species at Lewis acid sites (1609 cm−1) and Brønsted acid sites (1689 and 1434 cm−1) were observed on Nb/FeSi surface [50]. When the NO+O2 was introduced, both the ionic NH4 + species located at Brønsted acid sites (1689 and 1434 cm−1) and coordinated NH3 species adsorbed Lewis acid sites (1609 cm−1) disappeared due to the reaction with gas NO [51–53]. That is to say, the NH3-SCR reaction on Nb/FeSi could be efficiently carried out through the E-R mechanism reaction pathway during which the gaseous NO could directly react with adsorbed active NH3 species. More noteworthy is that the consumption rate of the ionic NH4 + species on Brønsted acid sites is faster, indicating that the ionic NH4 + species on the Nb/FeSi catalyst have higher reaction activity than the coordinated NH3 species on the Lewis acid sites. Therefore, it can be concluded that the more Brønsted acid sites and the weakened NO x adsorption capacity of Nb/FeSi catalyst are the main reason for its high its high NH3-SCR activity. To identify the reactivity of adsorbed nitrate species on the surface of Nb/FeSi catalyst, NH3 species were once again introduced into the gas cell, allowing the intensity of the peak at 1435 cm−1 to greatly increase, while the bands assigned to adsorbed nitrates showed no obvious change, indicating that adsorbed nitrate species were not the active species. This further indicates that the weakened nitrate adsorption capacity of Nb/FeSi catalyst is beneficial for the improvement of its NH3-SCR activity. The reactions of NH3 between pre-adsorbed NO+O2 and NO + O2 between pre-adsorbed NH3 as a function of time on Fe, Nb/Fe, and Nb/FeSi catalysts were studied and the results are shown in Fig. S8. Similar experimental conclusions are obtained, indicating that the NH3-SCR reaction proceeds following to the E-R mechanism. 4 Conclusion In summary, catalysts of NbO x supported on Si doped Fe2O3 composite oxide were synthesized and the effect of modification of Nb and Si on NH3-SCR performance of Nb/FeSi catalyst was studied. It is found that the doping of Si can inhibit the crystal phase formation of Fe2O3, greatly increase the specific surface area and at the same time bring a large number of hydroxyl groups, which makes Nb/FeSi catalyst has more Brønsted acid sites. The surface modification of Nb increases the amount of active oxygen species and acid sites, and significantly suppressed the peroxidation of NH3 and the adsorption of surface nitrate. Moreover, the increase of surface acid sites and the presence of hydroxyl groups help Nb/FeSi exhibit excellent sulfur resistance by inhibiting the adsorption of SO2. and helps to inhibit the adsorption of SO2. DRIFTS results show that NH3-SCR reaction of Nb/FeSi catalyst follows E-R mechanism, which is also an important reason why SO2 has little influence on its NH3-SCR activity. Our work provides reference for designing high-performance denitrification catalysts based on the role of different components in NH3-SCR catalytic performance. CRediT authorship contribution statement Wenrui Zhao: Writing – review & editing, Supervision, Project administration. Peiting Jiang: Writing – review & editing, Methodology, Formal analysis. Li Luli: Writing – review & editing, Supervision, Project administration, Methodology. Weixin Zou: Writing – review & editing, Supervision, Project administration. Kaili Ma: Writing – review & editing, Supervision, Project administration. Declaration of Competing Interest The authors declare that they have no known competing financial interests or personal relationships that could have appeared to influence the work reported in this paper. Acknowledgements This work was supported by Financial support from the National Natural Science Foundation of China (22402027, 21806077) is greatly acknowledged. Appendix A Supporting information Supplementary data associated with this article can be found in the online version at doi:10.1016/j.apcata.2025.120380. Appendix A Supplementary material Supplementary material References [1] Y. Zeng K.G. Haw Y. Wang S. Zhang Z. Wang Q. Zhong S. Kawi ChemCatChem 13 2020 491 505 Y. Zeng, K.G. Haw, Y. Wang, S. Zhang, Z. Wang, Q. Zhong, S. Kawi, ChemCatChem, 13 (2020) 491-505. [2] L. Wang Y. Li P. Han Y. Jiang RSC Adv. 11 2021 462 469 L. Wang, Y. Li, P. Han, Y. Jiang, RSC Advances, 11 (2021) 462-469. [3] K. Cheng B. Liu W. Song J. Liu Y. Chen Z. Zhao Y. Wei Ind. Eng. Chem. Res. 57 2018 7802 7810 K. Cheng, B. Liu, W. Song, J. Liu, Y. Chen, Z. Zhao, Y. Wei, Ind. Eng. Chem. Res., 57 (2018) 7802-7810. [4] Y. Sun Y. Guo W. Su Y. Wei Trans. Tianjin Univ. 23 2016 35 42 Y. Sun, Y. Guo, W. Su, Y. Wei, Trans. Tianjin Univ., 23 (2016) 35-42. [5] C. Liu J.-W. Shi C. Gao C. Niu Appl. Catal. A 522 2016 54 69 C. Liu, J.-W. Shi, C. Gao, C. Niu, Appl. Catal., A, 522 (2016) 54-69. [6] W. Zhao J. Ji K. Ma H. Yu C. Tang L. Dong L. Li J. Wang Ind. Eng. Chem. Res. 62 2023 5782 5791 W. Zhao, J. Ji, K. Ma, H. Yu, C. Tang, L. Dong, L. Li, J. Wang, Ind. Eng. Chem. Res., 62 (2023) 5782-5791. [7] L. Li C. Ge J. Ji W. Tan X. Wang X. Wei K. Guo C. Tang L. Dong Chin. J. Catal. 42 2021 1488 1499 L. Li, C. Ge, J. Ji, W. Tan, X. Wang, X. Wei, K. Guo, C. Tang, L. Dong, Chin. J. Catal., 42 (2021) 1488-1499. [8] L. Li J. Ji W. Tan W. Song X. Wang X. Wei K. Guo W. Zhang C. Tang L. Dong J. Rare Earths 40 2022 1454 1461 L. Li, J. Ji, W. Tan, W. Song, X. Wang, X. Wei, K. Guo, W. Zhang, C. Tang, L. Dong, J. of Rare Earths, 40 (2022) 1454-1461. [9] Z. Xiong Q. Hu D. Liu C. Wu F. Zhou Y. Wang J. Jin C. Lu Fuel 165 2016 432 439 Z. Xiong, Q. Hu, D. Liu, C. Wu, F. Zhou, Y. Wang, J. Jin, C. Lu, Fuel, 165 (2016) 432-439. [10] Y. Zhou S. Ren M. Wang J. Yang Z. Chen L. Chen J. Energy Inst. 99 2021 97 104 Y. Zhou, S. Ren, M. Wang, J. Yang, Z. Chen, L. Chen, J. Energy Inst., 99 (2021) 97-104. [11] X. Mou B. Zhang Y. Li L. Yao X. Wei D.S. Su W. Shen Angew. Chem. Int. Ed. 51 2012 2989 2993 X. Mou, B. Zhang, Y. Li, L. Yao, X. Wei, D.S. Su, W. Shen, Angew. Chem., Int. Ed., 51 (2012) 2989-2993. [12] Y. Chen C. Li J. Chen X. Tang Environ. Sci. Technol. 2018 Y. Chen, C. Li, J. Chen, X. Tang, Environ. Sci. Technol., (2018). [13] Z. Song Y. Xing T. Zhang J. Zhao J. Wang Y. Mao B. Zhao X. Zhang M. Zhao Z. Ma Appl. Organomet. Chem. 34 2019 Z. Song, Y. Xing, T. Zhang, J. Zhao, J. Wang, Y. Mao, B. Zhao, X. Zhang, M. Zhao, Z. Ma, Appl. Organomet. Chem., 34 (2019). [14] W. Qu Y. Chen Z. Huang J. Gao M. Zhou J. Chen C. Li Z. Ma J. Chen X. Tang Environ. Sci. Technol. Lett. 4 2017 246 250 W. Qu, Y. Chen, Z. Huang, J. Gao, M. Zhou, J. Chen, C. Li, Z. Ma, J. Chen, X. Tang, Environ. Sci. Technol. Lett., 4 (2017) 246-250. [15] X. Shi B. Chu F. Wang X. Wei L. Teng M. Fan B. Li L. Dong L. Dong ACS Appl. Mater. Interfaces 10 2018 40509 40522 X. Shi, B. Chu, F. Wang, X. Wei, L. Teng, M. Fan, B. Li, L. Dong, L. Dong, ACS Appl. Mater. Interfaces, 10 (2018) 40509-40522. [16] Z.-b Xiong C. Wu Q. Hu Y. Wang J. Jin C. Lu D. Guo Chem. Eng. J. 286 2016 459 466 Z.-b Xiong, C. Wu, Q. Hu, Y. Wang, J. Jin, C. Lu, D. Guo, Chem. Eng. J., 286 (2016) 459-466. [17] F. Liu W. Shan Z. Lian J. Liu H. He Appl. Catal. B 230 2018 165 176 F. Liu, W. Shan, Z. Lian, J. Liu, H. He, Appl. Catal., B, 230 (2018) 165-176. [18] W.-J. Li T.-Y. Li M.-Y. Wey Chem. Eng. J. 403 2021 W.-J. Li, T.-Y. Li, M.-Y. Wey, Chem. Eng. J., 403 (2021). [19] H. Zhao W. Han F. Dong Z. Tang Mol. Catal. 479 2019 H. Zhao, W. Han, F. Dong, Z. Tang, Mol. Catal., 479 (2019). [20] R. Qu X. Gao K. Cen J. Li Appl. Catal. B 142–143 2013 290 297 R. Qu, X. Gao, K. Cen, J. Li, Appl. Catal., B, 142-143 (2013) 290-297. [21] W. Zhang X. Shi Z. Yan Y. Shan Y. Zhu Y. Yu H. He ACS Catal. 11 2021 9825 9836 W. Zhang, X. Shi, Z. Yan, Y. Shan, Y. Zhu, Y. Yu, H. He, ACS Catalysis, 11 (2021) 9825-9836. [22] Z. Ma X. Wu Z. Si D. Weng J. Ma T. Xu Appl. Catal. B 179 2015 380 394 Z. Ma, X. Wu, Z. Si, D. Weng, J. Ma, T. Xu, Appl. Catal., B, 179 (2015) 380-394. [23] Z. Liu H. Su B. Chen J. Li S.I. Woo Chem. Eng. J. 299 2016 255 262 Z. Liu, H. Su, B. Chen, J. Li, S.I. Woo, Chem. Eng. J., 299 (2016) 255-262. [24] Y. Shin Y. Jung C.P. Cho Y.D. Pyo J. Jang G. Kim T.M. Kim Chem. Eng. J. 381 2020 Y. Shin, Y. Jung, C.P. Cho, Y.D. Pyo, J. Jang, G. Kim, T.M. Kim, Chem. Eng. J., 381 (2020). [25] F. Wang B. Shen S. Zhu Z. Wang Fuel 249 2019 54 60 F. Wang, B. Shen, S. Zhu, Z. Wang, Fuel, 249 (2019) 54-60. [26] C. Liu L. Chen J. Li L. Ma H. Arandiyan Y. Du J. Xu J. Hao Environ. Sci. Technol. 46 2012 6182 6189 C. Liu, L. Chen, J. Li, L. Ma, H. Arandiyan, Y. Du, J. Xu, J. Hao, Environ. Sci. Technol., 46 (2012) 6182-6189. [27] W. Tan A. Liu S. Xie Y. Yan T.E. Shaw Y. Pu K. Guo L. Li S. Yu F. Gao F. Liu L. Dong Environ. Sci. Technol. 55 2021 4017 4026 W. Tan, A. Liu, S. Xie, Y. Yan, T.E. Shaw, Y. Pu, K. Guo, L. Li, S. Yu, F. Gao, F. Liu, L. Dong, Environ. Sci. Technol., 55 (2021) 4017-4026. [28] K. Guo J. Ji R. Osuga Y. Zhu J. Sun C. Tang J.N. Kondo L. Dong Appl. Catal. B 287 2021 K. Guo, J. Ji, R. Osuga, Y. Zhu, J. Sun, C. Tang, J.N. Kondo, L. Dong, Appl. Catal., B, 287 (2021). [29] Y. Liu E. Huixiang Ang X. Zhong H. Lu J. Yang F. Gao C. Yu J. Zhu C. Zhu Y. Zhou F. Yang E. Yuan A. Yuan J. Colloid Interface Sci. 652 2023 418 428 Y. Liu, E. Huixiang Ang, X. Zhong, H. Lu, J. Yang, F. Gao, C. Yu, J. Zhu, C. Zhu, Y. Zhou, F. Yang, E. Yuan, A. Yuan, J. Colloid Interface Sci., 652 (2023) 418-428. [30] X. Jia H. Liu Y. Zhang W. Chen Q. Tong G. Piao C. Sun L. Dong J. Colloid Interface Sci. 581 2021 427 441 X. Jia, H. Liu, Y. Zhang, W. Chen, Q. Tong, G. Piao, C. Sun, L. Dong, J. Colloid Interface Sci., 581 (2021) 427-441. [31] X. Hou J. Qian L. Li F. Wang B. Li F. He M. Fan Z. Tong L. Dong L. Dong Ind. Eng. Chem. Res. 57 2018 16675 16683 X. Hou, J. Qian, L. Li, F. Wang, B. Li, F. He, M. Fan, Z. Tong, L. Dong, L. Dong, Ind. Eng. Chem. Res., 57 (2018) 16675-16683. [32] S.-Y. Jiang R.-X. Zhou Fuel Process. Technol. 133 2015 220 226 S.-Y. Jiang, R.-X. Zhou, Fuel Process. Technol., 133 (2015) 220-226. [33] Z. Liu Y. Liu B. Chen T. Zhu L. Ma Catal. Sci. Technol. 6 2016 6688 6696 Z. Liu, Y. Liu, B. Chen, T. Zhu, L. Ma, Catal. Sci. Technol., 6 (2016) 6688-6696. [34] Y. Yu W. Tan D. An C. Tang W. Zou C. Ge Q. Tong F. Gao J. Sun L. Dong Catal. Today 375 2021 614 622 Y. Yu, W. Tan, D. An, C. Tang, W. Zou, C. Ge, Q. Tong, F. Gao, J. Sun, L. Dong, Catal. Today, 375 (2021) 614-622. [35] L. Zhang T. Du H. Qu B. Chi Q. Zhong Chem. Eng. J. 313 2017 702 710 L. Zhang, T. Du, H. Qu, B. Chi, Q. Zhong, Chem. Eng. J., 313 (2017) 702-710. [36] M. Stanciulescu P. Bulsink G. Caravaggio L. Nossova R. Burich Appl. Surf. Sci. 300 2014 201 207 M. Stanciulescu, P. Bulsink, G. Caravaggio, L. Nossova, R. Burich, Appl. Surf. Sci., 300 (2014) 201-207. [37] L. Ma C.Y. Seo M. Nahata X. Chen J. Li J.W. Schwank Appl. Catal. B 232 2018 246 259 L. Ma, C.Y. Seo, M. Nahata, X. Chen, J. Li, J.W. Schwank, Appl. Catal., B, 232 (2018) 246-259. [38] Y. Hao Y. Wang T. Zhang Y. Liu Q.-Y. Fan Y. Jiang Y. Gao Z. Mao X. Gu S. Zeng Appl. Catal. B 340 2024 Y. Hao, Y. Wang, T. Zhang, Y. Liu, Q.-Y. Fan, Y. Jiang, Y. Gao, Z. Mao, X. Gu, S. Zeng, Appl. Catal., B, 340 (2024). [39] M. Guo B. Mosevitzky Lis M.E. Ford I.E. Wachs Appl. Catal. B 306 2022 M. Guo, B. Mosevitzky Lis, M.E. Ford, I.E. Wachs, Appl. Catal., B, 306 (2022). [40] H. Liu C. Gao J. Chen J. Mi S. Yang D. Chen W. Si Y. Peng C. Sun J. Li Appl. Catal. B 332 2023 H. Liu, C. Gao, J. Chen, J. Mi, S. Yang, D. Chen, W. Si, Y. Peng, C. Sun, J. Li, Appl. Catal., B, 332 (2023). [41] B. Qin R.-t Guo J. Zhou L.-g Wei T.-y Yin W.-g Pan Fuel 329 2022 B. Qin, R.-t Guo, J. Zhou, L.-g Wei, T.-y Yin, W.-g Pan, Fuel, 329 (2022). [42] Y. Jiang T. Liu W. Gao H. Ge Z. Yang R. Lin X. Wang Chem. Eng. J. 433 2022 Y. Jiang, T. Liu, W. Gao, H. Ge, Z. Yang, R. Lin, X. Wang, Chem. Eng. J., 433 (2022). [43] W. Zhou N. Soultanidis H. Xu M.S. Wong M. Neurock C.J. Kiely I.E. Wachs ACS Catal. 7 2017 2181 2198 W. Zhou, N. Soultanidis, H. Xu, M.S. Wong, M. Neurock, C.J. Kiely, I.E. Wachs, ACS Catalysis, 7 (2017) 2181-2198. [44] Y. Wang W. Yi J. Yu J. Zeng H. Chang Environ. Sci. Technol. 54 2020 12612 12620 Y. Wang, W. Yi, J. Yu, J. Zeng, H. Chang, Environ. Sci. Technol., 54 (2020) 12612-12620. [45] R. Purbia S.Y. Choi H.J. Kim B. Ye B. Jeong D.H. Lee H. Park H.-D. Kim J.M. Baik Chem. Eng. J. 437 2022 R. Purbia, S.Y. Choi, H.J. Kim, B. Ye, B. Jeong, D.H. Lee, H. Park, H.-D. Kim, J.M. Baik, Chem. Eng. J., 437 (2022). [46] K. Song J.-W. Shi X. Zhou Y. Gui J. Li D. Ma Y. Chen C. He Y. Jia B. Qin L. Liang Y. Zhang Y. Cheng S. Wang Appl. Catal. B 354 2024 K. Song, J.-W. Shi, X. Zhou, Y. Gui, J. Li, D. Ma, Y. Chen, C. He, Y. Jia, B. Qin, L. Liang, Y. Zhang, Y. Cheng, S. Wang, Appl. Catal., B, 354 (2024). [47] K. Song J. Hu P. Lu D. Ma X. Zhou J. Li T. Jiang L. Li S. Wu J.-W. Shi Appl. Catal. B 343 2024 K. Song, J. Hu, P. Lu, D. Ma, X. Zhou, J. Li, T. Jiang, L. Li, S. Wu, J.-W. Shi, Appl. Catal., B, 343 (2024). [48] C. Wang F. Gao S. Ko H. Liu H. Yi X. Tang Chem. Eng. J. 434 2022 C. Wang, F. Gao, S. Ko, H. Liu, H. Yi, X. Tang, Chem. Eng. J., 434 (2022). [49] C. Sun H. Liu W. Chen D. Chen S. Yu A. Liu L. Dong S. Feng Chem. Eng. J. 347 2018 27 40 C. Sun, H. Liu, W. Chen, D. Chen, S. Yu, A. Liu, L. Dong, S. Feng, Chem. Eng. J., 347 (2018) 27-40. [50] S. Ali L. Chen Z. Li T. Zhang R. Li S.U.H. Bakhtiar X. Leng F. Yuan X. Niu Y. Zhu Appl. Catal. B 236 2018 25 35 S. Ali, L. Chen, Z. Li, T. Zhang, R. Li, S.U.H. Bakhtiar, X. Leng, F. Yuan, X. Niu, Y. Zhu, Appl. Catal., B, 236 (2018) 25-35. [51] Z. Wang J. Lan M. Haneda Z. Liu Catal. Today 376 2021 222 228 Z. Wang, J. Lan, M. Haneda, Z. Liu, Catal. Today, 376 (2021) 222-228. [52] J. Ji M. Jing X. Wang W. Tan K. Guo L. Li X. Wang W. Song L. Cheng J. Sun W. Song C. Tang J. Liu L. Dong J. Catal. 399 2021 212 223 J. Ji, M. Jing, X. Wang, W. Tan, K. Guo, L. Li, X. Wang, W. Song, L. Cheng, J. Sun, W. Song, C. Tang, J. Liu, L. Dong, J. Catal., 399 (2021) 212-223. [53] X. Wang Q. Cong L. Chen Y. Shi Y. Shi S. Li W. Li Appl. Catal. B 246 2019 166 179 X. Wang, Q. Cong, L. Chen, Y. Shi, Y. Shi, S. Li, W. Li, Appl. Catal., B, 246 (2019) 166-179.",
      "scopus-id": "105006785024",
      "coredata": {
        "eid": "1-s2.0-S0926860X25002819",
        "dc:description": "The widespread application of Fe-based denitrification catalysts is limited by its unsatisfying low-temperature NO conversion and poor anti-SO2 ability. In this study, by virtue of FeSi composite oxide with large specific surface area as support and NbO x species was used for surface modification to further regulate their acidity and redox properties, significantly improving their NH3-SCR activity. The optimal Nb/FeSi catalyst exhibited over 90 % NO conversion at 250–400 °C and displayed excellent SO2 resistance at 225 °C. The characterization results revealed that Si doping induced an amorphous structure in the FeSi composite and facilitated the formation of distinctive Fe-O–Si bonding configurations. These structural features endowed the Nb/FeSi catalyst with both an enlarged specific surface area and increased Brønsted acid sites, facilitating the dispersion of active components and the activation of NH3 species. Nb could promote the generation of more oxygen vacancies and abundant Brønsted acid sites while inhibits the adsorption of NO x and SO2. Further mechanistic studies revealed that the enhanced Eley-Rideal (E-R) mechanism, where gaseous NO directly reacts with adsorbed NH₃, significantly promoted the NH₃-SCR efficiency of Nb/FeSi. This work provides experimental guidance to improve the activity and sulfur resistance of denitration catalyst by active component control.",
        "openArchiveArticle": "false",
        "prism:coverDate": "2025-08-25",
        "openaccessUserLicense": null,
        "prism:aggregationType": "Journal",
        "prism:url": "https://api.elsevier.com/content/article/pii/S0926860X25002819",
        "dc:creator": [
          {
            "@_fa": "true",
            "$": "Zhao, Wenrui"
          },
          {
            "@_fa": "true",
            "$": "Li, Lulu"
          },
          {
            "@_fa": "true",
            "$": "Jiang, Peiting"
          },
          {
            "@_fa": "true",
            "$": "Ma, Kaili"
          },
          {
            "@_fa": "true",
            "$": "Zou, Weixin"
          }
        ],
        "link": [
          {
            "@_fa": "true",
            "@rel": "self",
            "@href": "https://api.elsevier.com/content/article/pii/S0926860X25002819"
          },
          {
            "@_fa": "true",
            "@rel": "scidir",
            "@href": "https://www.sciencedirect.com/science/article/pii/S0926860X25002819"
          }
        ],
        "dc:format": "application/json",
        "openaccessType": null,
        "pii": "S0926-860X(25)00281-9",
        "prism:volume": "704",
        "articleNumber": "120380",
        "prism:publisher": "Elsevier B.V. All rights are reserved, including those for text and data mining, AI training, and similar technologies.",
        "dc:title": "Synergical effects of Nb and SiO2 on enhanced NO elimination and sulfur resistance of Fe2O3-SCR catalyst",
        "prism:copyright": "© 2025 Elsevier B.V. All rights are reserved, including those for text and data mining, AI training, and similar technologies.",
        "openaccess": "0",
        "prism:issn": "0926860X",
        "dcterms:subject": [
          {
            "@_fa": "true",
            "$": "NO elimination"
          },
          {
            "@_fa": "true",
            "$": "Fe2O3"
          },
          {
            "@_fa": "true",
            "$": "SiO2"
          },
          {
            "@_fa": "true",
            "$": "NbO x"
          },
          {
            "@_fa": "true",
            "$": "Sulfur resistance"
          },
          {
            "@_fa": "true",
            "$": "Promoted mechanism"
          }
        ],
        "openaccessArticle": "false",
        "prism:publicationName": "Applied Catalysis A: General",
        "openaccessSponsorType": null,
        "prism:pageRange": "120380",
        "pubType": "fla",
        "prism:coverDisplayDate": "25 August 2025",
        "prism:doi": "10.1016/j.apcata.2025.120380",
        "prism:startingPage": "120380",
        "dc:identifier": "doi:10.1016/j.apcata.2025.120380",
        "openaccessSponsorName": null
      },
      "objects": {
        "object": [
          {
            "@category": "standard",
            "@height": "736",
            "@width": "602",
            "@_fa": "true",
            "$": "https://api.elsevier.com/content/object/eid/1-s2.0-S0926860X25002819-gr10.jpg?httpAccept=%2A%2F%2A",
            "@multimediatype": "JPEG image file",
            "@type": "IMAGE-DOWNSAMPLED",
            "@size": "92632",
            "@ref": "gr10",
            "@mimetype": "image/jpeg"
          },
          {
            "@category": "standard",
            "@height": "368",
            "@width": "602",
            "@_fa": "true",
            "$": "https://api.elsevier.com/content/object/eid/1-s2.0-S0926860X25002819-gr11.jpg?httpAccept=%2A%2F%2A",
            "@multimediatype": "JPEG image file",
            "@type": "IMAGE-DOWNSAMPLED",
            "@size": "57960",
            "@ref": "gr11",
            "@mimetype": "image/jpeg"
          },
          {
            "@category": "standard",
            "@height": "200",
            "@width": "280",
            "@_fa": "true",
            "$": "https://api.elsevier.com/content/object/eid/1-s2.0-S0926860X25002819-ga1.jpg?httpAccept=%2A%2F%2A",
            "@multimediatype": "JPEG image file",
            "@type": "IMAGE-DOWNSAMPLED",
            "@size": "19183",
            "@ref": "ga1",
            "@mimetype": "image/jpeg"
          },
          {
            "@category": "standard",
            "@height": "702",
            "@width": "602",
            "@_fa": "true",
            "$": "https://api.elsevier.com/content/object/eid/1-s2.0-S0926860X25002819-gr7.jpg?httpAccept=%2A%2F%2A",
            "@multimediatype": "JPEG image file",
            "@type": "IMAGE-DOWNSAMPLED",
            "@size": "99956",
            "@ref": "gr7",
            "@mimetype": "image/jpeg"
          },
          {
            "@category": "standard",
            "@height": "286",
            "@width": "299",
            "@_fa": "true",
            "$": "https://api.elsevier.com/content/object/eid/1-s2.0-S0926860X25002819-gr6.jpg?httpAccept=%2A%2F%2A",
            "@multimediatype": "JPEG image file",
            "@type": "IMAGE-DOWNSAMPLED",
            "@size": "22103",
            "@ref": "gr6",
            "@mimetype": "image/jpeg"
          },
          {
            "@category": "standard",
            "@height": "268",
            "@width": "299",
            "@_fa": "true",
            "$": "https://api.elsevier.com/content/object/eid/1-s2.0-S0926860X25002819-gr9.jpg?httpAccept=%2A%2F%2A",
            "@multimediatype": "JPEG image file",
            "@type": "IMAGE-DOWNSAMPLED",
            "@size": "15635",
            "@ref": "gr9",
            "@mimetype": "image/jpeg"
          },
          {
            "@category": "standard",
            "@height": "713",
            "@width": "602",
            "@_fa": "true",
            "$": "https://api.elsevier.com/content/object/eid/1-s2.0-S0926860X25002819-gr8.jpg?httpAccept=%2A%2F%2A",
            "@multimediatype": "JPEG image file",
            "@type": "IMAGE-DOWNSAMPLED",
            "@size": "97348",
            "@ref": "gr8",
            "@mimetype": "image/jpeg"
          },
          {
            "@category": "standard",
            "@height": "252",
            "@width": "602",
            "@_fa": "true",
            "$": "https://api.elsevier.com/content/object/eid/1-s2.0-S0926860X25002819-gr1.jpg?httpAccept=%2A%2F%2A",
            "@multimediatype": "JPEG image file",
            "@type": "IMAGE-DOWNSAMPLED",
            "@size": "39208",
            "@ref": "gr1",
            "@mimetype": "image/jpeg"
          },
          {
            "@category": "standard",
            "@height": "244",
            "@width": "602",
            "@_fa": "true",
            "$": "https://api.elsevier.com/content/object/eid/1-s2.0-S0926860X25002819-gr3.jpg?httpAccept=%2A%2F%2A",
            "@multimediatype": "JPEG image file",
            "@type": "IMAGE-DOWNSAMPLED",
            "@size": "34937",
            "@ref": "gr3",
            "@mimetype": "image/jpeg"
          },
          {
            "@category": "standard",
            "@height": "251",
            "@width": "299",
            "@_fa": "true",
            "$": "https://api.elsevier.com/content/object/eid/1-s2.0-S0926860X25002819-gr2.jpg?httpAccept=%2A%2F%2A",
            "@multimediatype": "JPEG image file",
            "@type": "IMAGE-DOWNSAMPLED",
            "@size": "18565",
            "@ref": "gr2",
            "@mimetype": "image/jpeg"
          },
          {
            "@category": "standard",
            "@height": "271",
            "@width": "602",
            "@_fa": "true",
            "$": "https://api.elsevier.com/content/object/eid/1-s2.0-S0926860X25002819-gr5.jpg?httpAccept=%2A%2F%2A",
            "@multimediatype": "JPEG image file",
            "@type": "IMAGE-DOWNSAMPLED",
            "@size": "35522",
            "@ref": "gr5",
            "@mimetype": "image/jpeg"
          },
          {
            "@category": "standard",
            "@height": "524",
            "@width": "602",
            "@_fa": "true",
            "$": "https://api.elsevier.com/content/object/eid/1-s2.0-S0926860X25002819-gr4.jpg?httpAccept=%2A%2F%2A",
            "@multimediatype": "JPEG image file",
            "@type": "IMAGE-DOWNSAMPLED",
            "@size": "70976",
            "@ref": "gr4",
            "@mimetype": "image/jpeg"
          },
          {
            "@category": "thumbnail",
            "@height": "164",
            "@width": "134",
            "@_fa": "true",
            "$": "https://api.elsevier.com/content/object/eid/1-s2.0-S0926860X25002819-gr10.sml?httpAccept=%2A%2F%2A",
            "@multimediatype": "GIF image file",
            "@type": "IMAGE-THUMBNAIL",
            "@size": "11333",
            "@ref": "gr10",
            "@mimetype": "image/gif"
          },
          {
            "@category": "thumbnail",
            "@height": "134",
            "@width": "219",
            "@_fa": "true",
            "$": "https://api.elsevier.com/content/object/eid/1-s2.0-S0926860X25002819-gr11.sml?httpAccept=%2A%2F%2A",
            "@multimediatype": "GIF image file",
            "@type": "IMAGE-THUMBNAIL",
            "@size": "15487",
            "@ref": "gr11",
            "@mimetype": "image/gif"
          },
          {
            "@category": "thumbnail",
            "@height": "156",
            "@width": "219",
            "@_fa": "true",
            "$": "https://api.elsevier.com/content/object/eid/1-s2.0-S0926860X25002819-ga1.sml?httpAccept=%2A%2F%2A",
            "@multimediatype": "GIF image file",
            "@type": "IMAGE-THUMBNAIL",
            "@size": "21659",
            "@ref": "ga1",
            "@mimetype": "image/gif"
          },
          {
            "@category": "thumbnail",
            "@height": "163",
            "@width": "140",
            "@_fa": "true",
            "$": "https://api.elsevier.com/content/object/eid/1-s2.0-S0926860X25002819-gr7.sml?httpAccept=%2A%2F%2A",
            "@multimediatype": "GIF image file",
            "@type": "IMAGE-THUMBNAIL",
            "@size": "12825",
            "@ref": "gr7",
            "@mimetype": "image/gif"
          },
          {
            "@category": "thumbnail",
            "@height": "164",
            "@width": "171",
            "@_fa": "true",
            "$": "https://api.elsevier.com/content/object/eid/1-s2.0-S0926860X25002819-gr6.sml?httpAccept=%2A%2F%2A",
            "@multimediatype": "GIF image file",
            "@type": "IMAGE-THUMBNAIL",
            "@size": "10410",
            "@ref": "gr6",
            "@mimetype": "image/gif"
          },
          {
            "@category": "thumbnail",
            "@height": "164",
            "@width": "183",
            "@_fa": "true",
            "$": "https://api.elsevier.com/content/object/eid/1-s2.0-S0926860X25002819-gr9.sml?httpAccept=%2A%2F%2A",
            "@multimediatype": "GIF image file",
            "@type": "IMAGE-THUMBNAIL",
            "@size": "5894",
            "@ref": "gr9",
            "@mimetype": "image/gif"
          },
          {
            "@category": "thumbnail",
            "@height": "163",
            "@width": "138",
            "@_fa": "true",
            "$": "https://api.elsevier.com/content/object/eid/1-s2.0-S0926860X25002819-gr8.sml?httpAccept=%2A%2F%2A",
            "@multimediatype": "GIF image file",
            "@type": "IMAGE-THUMBNAIL",
            "@size": "11537",
            "@ref": "gr8",
            "@mimetype": "image/gif"
          },
          {
            "@category": "thumbnail",
            "@height": "92",
            "@width": "219",
            "@_fa": "true",
            "$": "https://api.elsevier.com/content/object/eid/1-s2.0-S0926860X25002819-gr1.sml?httpAccept=%2A%2F%2A",
            "@multimediatype": "GIF image file",
            "@type": "IMAGE-THUMBNAIL",
            "@size": "7081",
            "@ref": "gr1",
            "@mimetype": "image/gif"
          },
          {
            "@category": "thumbnail",
            "@height": "89",
            "@width": "219",
            "@_fa": "true",
            "$": "https://api.elsevier.com/content/object/eid/1-s2.0-S0926860X25002819-gr3.sml?httpAccept=%2A%2F%2A",
            "@multimediatype": "GIF image file",
            "@type": "IMAGE-THUMBNAIL",
            "@size": "6991",
            "@ref": "gr3",
            "@mimetype": "image/gif"
          },
          {
            "@category": "thumbnail",
            "@height": "164",
            "@width": "195",
            "@_fa": "true",
            "$": "https://api.elsevier.com/content/object/eid/1-s2.0-S0926860X25002819-gr2.sml?httpAccept=%2A%2F%2A",
            "@multimediatype": "GIF image file",
            "@type": "IMAGE-THUMBNAIL",
            "@size": "9302",
            "@ref": "gr2",
            "@mimetype": "image/gif"
          },
          {
            "@category": "thumbnail",
            "@height": "99",
            "@width": "219",
            "@_fa": "true",
            "$": "https://api.elsevier.com/content/object/eid/1-s2.0-S0926860X25002819-gr5.sml?httpAccept=%2A%2F%2A",
            "@multimediatype": "GIF image file",
            "@type": "IMAGE-THUMBNAIL",
            "@size": "7304",
            "@ref": "gr5",
            "@mimetype": "image/gif"
          },
          {
            "@category": "thumbnail",
            "@height": "164",
            "@width": "188",
            "@_fa": "true",
            "$": "https://api.elsevier.com/content/object/eid/1-s2.0-S0926860X25002819-gr4.sml?httpAccept=%2A%2F%2A",
            "@multimediatype": "GIF image file",
            "@type": "IMAGE-THUMBNAIL",
            "@size": "10597",
            "@ref": "gr4",
            "@mimetype": "image/gif"
          },
          {
            "@category": "high",
            "@height": "3252",
            "@width": "2661",
            "@_fa": "true",
            "$": "https://api.elsevier.com/content/object/eid/1-s2.0-S0926860X25002819-gr10_lrg.jpg?httpAccept=%2A%2F%2A",
            "@multimediatype": "JPEG image file",
            "@type": "IMAGE-HIGH-RES",
            "@size": "461204",
            "@ref": "gr10",
            "@mimetype": "image/jpeg"
          },
          {
            "@category": "high",
            "@height": "1627",
            "@width": "2661",
            "@_fa": "true",
            "$": "https://api.elsevier.com/content/object/eid/1-s2.0-S0926860X25002819-gr11_lrg.jpg?httpAccept=%2A%2F%2A",
            "@multimediatype": "JPEG image file",
            "@type": "IMAGE-HIGH-RES",
            "@size": "309448",
            "@ref": "gr11",
            "@mimetype": "image/jpeg"
          },
          {
            "@category": "high",
            "@height": "886",
            "@width": "1242",
            "@_fa": "true",
            "$": "https://api.elsevier.com/content/object/eid/1-s2.0-S0926860X25002819-ga1_lrg.jpg?httpAccept=%2A%2F%2A",
            "@multimediatype": "JPEG image file",
            "@type": "IMAGE-HIGH-RES",
            "@size": "167049",
            "@ref": "ga1",
            "@mimetype": "image/jpeg"
          },
          {
            "@category": "high",
            "@height": "3101",
            "@width": "2661",
            "@_fa": "true",
            "$": "https://api.elsevier.com/content/object/eid/1-s2.0-S0926860X25002819-gr7_lrg.jpg?httpAccept=%2A%2F%2A",
            "@multimediatype": "JPEG image file",
            "@type": "IMAGE-HIGH-RES",
            "@size": "501489",
            "@ref": "gr7",
            "@mimetype": "image/jpeg"
          },
          {
            "@category": "high",
            "@height": "1272",
            "@width": "1330",
            "@_fa": "true",
            "$": "https://api.elsevier.com/content/object/eid/1-s2.0-S0926860X25002819-gr6_lrg.jpg?httpAccept=%2A%2F%2A",
            "@multimediatype": "JPEG image file",
            "@type": "IMAGE-HIGH-RES",
            "@size": "113991",
            "@ref": "gr6",
            "@mimetype": "image/jpeg"
          },
          {
            "@category": "high",
            "@height": "1191",
            "@width": "1330",
            "@_fa": "true",
            "$": "https://api.elsevier.com/content/object/eid/1-s2.0-S0926860X25002819-gr9_lrg.jpg?httpAccept=%2A%2F%2A",
            "@multimediatype": "JPEG image file",
            "@type": "IMAGE-HIGH-RES",
            "@size": "83193",
            "@ref": "gr9",
            "@mimetype": "image/jpeg"
          },
          {
            "@category": "high",
            "@height": "3152",
            "@width": "2661",
            "@_fa": "true",
            "$": "https://api.elsevier.com/content/object/eid/1-s2.0-S0926860X25002819-gr8_lrg.jpg?httpAccept=%2A%2F%2A",
            "@multimediatype": "JPEG image file",
            "@type": "IMAGE-HIGH-RES",
            "@size": "479880",
            "@ref": "gr8",
            "@mimetype": "image/jpeg"
          },
          {
            "@category": "high",
            "@height": "1112",
            "@width": "2661",
            "@_fa": "true",
            "$": "https://api.elsevier.com/content/object/eid/1-s2.0-S0926860X25002819-gr1_lrg.jpg?httpAccept=%2A%2F%2A",
            "@multimediatype": "JPEG image file",
            "@type": "IMAGE-HIGH-RES",
            "@size": "179931",
            "@ref": "gr1",
            "@mimetype": "image/jpeg"
          },
          {
            "@category": "high",
            "@height": "1077",
            "@width": "2661",
            "@_fa": "true",
            "$": "https://api.elsevier.com/content/object/eid/1-s2.0-S0926860X25002819-gr3_lrg.jpg?httpAccept=%2A%2F%2A",
            "@multimediatype": "JPEG image file",
            "@type": "IMAGE-HIGH-RES",
            "@size": "159239",
            "@ref": "gr3",
            "@mimetype": "image/jpeg"
          },
          {
            "@category": "high",
            "@height": "1118",
            "@width": "1330",
            "@_fa": "true",
            "$": "https://api.elsevier.com/content/object/eid/1-s2.0-S0926860X25002819-gr2_lrg.jpg?httpAccept=%2A%2F%2A",
            "@multimediatype": "JPEG image file",
            "@type": "IMAGE-HIGH-RES",
            "@size": "91828",
            "@ref": "gr2",
            "@mimetype": "image/jpeg"
          },
          {
            "@category": "high",
            "@height": "1198",
            "@width": "2661",
            "@_fa": "true",
            "$": "https://api.elsevier.com/content/object/eid/1-s2.0-S0926860X25002819-gr5_lrg.jpg?httpAccept=%2A%2F%2A",
            "@multimediatype": "JPEG image file",
            "@type": "IMAGE-HIGH-RES",
            "@size": "168059",
            "@ref": "gr5",
            "@mimetype": "image/jpeg"
          },
          {
            "@category": "high",
            "@height": "2316",
            "@width": "2661",
            "@_fa": "true",
            "$": "https://api.elsevier.com/content/object/eid/1-s2.0-S0926860X25002819-gr4_lrg.jpg?httpAccept=%2A%2F%2A",
            "@multimediatype": "JPEG image file",
            "@type": "IMAGE-HIGH-RES",
            "@size": "339108",
            "@ref": "gr4",
            "@mimetype": "image/jpeg"
          },
          {
            "@category": "standard",
            "@_fa": "true",
            "$": "https://api.elsevier.com/content/object/eid/1-s2.0-S0926860X25002819-mmc1.docx?httpAccept=%2A%2F%2A",
            "@multimediatype": "Microsoft Word file",
            "@type": "APPLICATION",
            "@size": "1558913",
            "@ref": "mmc1",
            "@mimetype": "application/word"
          },
          {
            "@category": "thumbnail",
            "@_fa": "true",
            "$": "https://api.elsevier.com/content/object/eid/1-s2.0-S0926860X25002819-si0001.svg?httpAccept=%2A%2F%2A",
            "@multimediatype": "Scalable Vector Graphics file",
            "@type": "ALTIMG",
            "@size": "3967",
            "@ref": "si0001",
            "@mimetype": "image/svg+xml"
          },
          {
            "@category": "thumbnail",
            "@_fa": "true",
            "$": "https://api.elsevier.com/content/object/eid/1-s2.0-S0926860X25002819-si0002.svg?httpAccept=%2A%2F%2A",
            "@multimediatype": "Scalable Vector Graphics file",
            "@type": "ALTIMG",
            "@size": "6953",
            "@ref": "si0002",
            "@mimetype": "image/svg+xml"
          }
        ]
      },
      "link": {
        "@rel": "abstract",
        "@href": "https://api.elsevier.com/content/abstract/scopus_id/105006785024"
      }
    }
  }
}