{
  "metadata": {
    "title": "Potassium and cobalt double-doped ferrierites as a new class of soot oxidation catalysts",
    "authors": "; ; ",
    "journal": "Applied Catalysis A: General",
    "date": "2023-11-25",
    "doi": "10.1016/j.apcata.2023.119469",
    "abstract": "",
    "uri": "https://api.elsevier.com/content/article/pii/S0926860X23004490",
    "pii": "S0926860X23004490"
  },
  "fulltext": {
    "full-text-retrieval-response": {
      "scopus-eid": "2-s2.0-85174860515",
      "originalText": "serial JL 271346 291210 291744 291809 31 90 Applied Catalysis A: General APPLIEDCATALYSISAGENERAL 2023-10-24 2023-10-24 2023-10-28 2023-10-28 2023-11-15T12:57:37 1-s2.0-S0926860X23004490 S0926-860X(23)00449-0 S0926860X23004490 10.1016/j.apcata.2023.119469 S300 S300.1 FULL-TEXT 1-s2.0-S0926860X23X00192 2024-01-01T12:35:59.692098Z 0 0 20231125 2023 2023-10-24T14:55:01.53015Z absattachment articleinfo articlenumber articletitlenorm authfirstinitialnorm authfirstsurnamenorm cid cids contenttype copyright crossmark dateloaded dateloadedtxt datesearch datesort dateupdated dco docsubtype doctype doi eid ewtransactionid fundingbodyid hubeid indexeddate issn issnnorm itemstage itemtransactionid itemweight oauserlicense openaccess openarchive pg pgfirst pii piinorm pubdatestart pubdatetxt pubyr sortorder sponsoredaccesstype srctitle srctitlenorm srctype ssids alllist content oa subj subheadings suppl tomb volfirst volissue volumelist webpdf webpdfpagecount yearnav figure table e-component body mmlmath acknowledge affil appendices articletitle auth authfirstini authfull authkeywords authlast grantnumber grantsponsor grantsponsorid highlightsabst primabst ref specialabst 0926-860X 0926860X UNLIMITED NONE true 668 668 C Volume 668 6 119469 119469 119469 20231125 25 November 2023 2023-11-25 2023 article fla © 2023 The Author(s). Published by Elsevier B.V. POTASSIUMCOBALTDOUBLEDOPEDFERRIERITESANEWCLASSSOOTOXIDATIONCATALYSTS GRZYBEK G 1 Introduction 2 Experimental 2.1 Catalyst preparation 2.2 Materials characterization 2.3 Thermal alkali desorption studies 2.4 Catalytic tests 3 Results and discussion 3.1 Physicochemical characterization of the catalysts 3.2 The nature of potassium promotional effect 3.3 Analysis of the potassium promotion effect in terms of the catalyst work function changes 3.4 The surface state of potassium studied by the species-resolved thermal alkali desorption method 3.5 The effect of NO 4 Conclusions CRediT authorship contribution statement Acknowledgment Appendix A Supplementary material References 2020 AIRQUALITYINEUROPE2020REPORT ZHOU 2023 128805 X LIU 2015 17218 17227 S LIU 2015 909 919 S HERNANDEZGIMENEZ 2014 1154 1168 A LIU 2015 567 590 S LEGUTKO 2023 3395 3418 P CHEN 2021 21436 21449 L ZHANG 2023 122077 P LI 2023 351 364 Y ZHANG 2021 11245 11254 P LIANG 2014 685 690 H MATARRESE 2016 119 129 R LEGUTKO 2013 489 492 P LEGUTKO 2014 139 142 P LEGUTKO 2014 34 37 P BICKEL 2021 75 85 E BORTHAKUR 2022 214257 I LI 2017 928 949 Y MOSHOESHOE 2017 196 221 M ZHANG 2020 2002927 Q VANDERMYNSBRUGGE 2021 832 849 J LE 2020 56 68 T PEDEN 2019 384 389 C DEGNAN 2000 349 356 T XU 2018 7237 7243 J GRZYBEK 2023 143239 G CAO 2021 121446 C GRZYBEK 2021 118051 G GRZYBEK 2020 597528 G SLOWIK 2016 219 237 G FAIRLEY 2021 100112 N URA 2011 169 175 B GRZYBEK 2017 597 604 G GRZYBEK 2020 22658 22673 G GRZYBEK 2022 364 380 G GRZYBEK 2017 5723 5732 G GARCIA 2008 1099 1107 R KANNO 1994 625 628 N TEKETEL 2015 22 32 S JUNG 2021 14210 14223 H HADJIIVANOV 2000 71 144 K GRZYBEKX2023X119469 GRZYBEKX2023X119469XG Full 2023-10-24T07:09:43Z Author http://creativecommons.org/licenses/by/4.0/ 2025-10-28T00:00:00.000Z 2025-10-28T00:00:00.000Z http://creativecommons.org/licenses/by-nc-nd/4.0/ This is an open access article under the CC BY license. © 2023 The Author(s). Published by Elsevier B.V. 2023-11-02T03:07:26.216Z http://vtw.elsevier.com/data/voc/AddOnTypes/50.7/aggregated-refined 2021/43/D/ST4/03016 NCBR Narodowe Centrum Badan i Rozwoju http://data.elsevier.com/vocabulary/SciValFunders/501100005632 http://sws.geonames.org/798544 National Science Centre, Poland NCN Narodowym Centrum Nauki http://data.elsevier.com/vocabulary/SciValFunders/501100004442 http://sws.geonames.org/798544/ The work was financed by Grant No. 2021/43/D/ST4/03016 from the National Science Centre, Poland. item S0926-860X(23)00449-0 S0926860X23004490 1-s2.0-S0926860X23004490 10.1016/j.apcata.2023.119469 271346 2024-01-01T12:35:59.692098Z 2023-11-25 UNLIMITED NONE 1-s2.0-S0926860X23004490-main.pdf https://s3-eu-west-1.amazonaws.com/prod-ucs-content-store-eu-west/content/pii:S0926860X23004490/MAIN/application/pdf/40e16009f34cdb45638bde8d2c6bf90a/main.pdf main.pdf pdf true 9160560 MAIN 10 1-s2.0-S0926860X23004490-main_1.png https://s3-eu-west-1.amazonaws.com/prod-ucs-content-store-eu-west/content/pii:S0926860X23004490/PREVIEW/image/png/7b9c5fed0b451bb423048c8ac48f05b3/main_1.png main_1.png png 55020 849 656 IMAGE-WEB-PDF 1 1-s2.0-S0926860X23004490-gr4.jpg https://s3-eu-west-1.amazonaws.com/prod-ucs-content-store-eu-west/content/pii:S0926860X23004490/gr4/DOWNSAMPLED/image/jpeg/b513d7378852249272d807572ee8f2c0/gr4.jpg gr4 gr4.jpg jpg 134141 785 807 IMAGE-DOWNSAMPLED 1-s2.0-S0926860X23004490-gr3.jpg https://s3-eu-west-1.amazonaws.com/prod-ucs-content-store-eu-west/content/pii:S0926860X23004490/gr3/DOWNSAMPLED/image/jpeg/b4fdc86f449db00f817fa9d2633734ba/gr3.jpg gr3 gr3.jpg jpg 118279 477 715 IMAGE-DOWNSAMPLED 1-s2.0-S0926860X23004490-gr5.jpg https://s3-eu-west-1.amazonaws.com/prod-ucs-content-store-eu-west/content/pii:S0926860X23004490/gr5/DOWNSAMPLED/image/jpeg/c9efc293edcab97d4046439add6a3967/gr5.jpg gr5 gr5.jpg jpg 32064 272 602 IMAGE-DOWNSAMPLED 1-s2.0-S0926860X23004490-gr11.jpg https://s3-eu-west-1.amazonaws.com/prod-ucs-content-store-eu-west/content/pii:S0926860X23004490/gr11/DOWNSAMPLED/image/jpeg/fe3135bc275f37d8da40e2d23979c33f/gr11.jpg gr11 gr11.jpg jpg 53031 467 602 IMAGE-DOWNSAMPLED 1-s2.0-S0926860X23004490-gr8.jpg https://s3-eu-west-1.amazonaws.com/prod-ucs-content-store-eu-west/content/pii:S0926860X23004490/gr8/DOWNSAMPLED/image/jpeg/76b388097ca9e8d06e3535bfcb48c787/gr8.jpg gr8 gr8.jpg jpg 31974 236 678 IMAGE-DOWNSAMPLED 1-s2.0-S0926860X23004490-ga1.jpg https://s3-eu-west-1.amazonaws.com/prod-ucs-content-store-eu-west/content/pii:S0926860X23004490/ga1/DOWNSAMPLED/image/jpeg/69f047da785e0a5e8c5dbf3c7ded16da/ga1.jpg ga1 true ga1.jpg jpg 26074 200 487 IMAGE-DOWNSAMPLED 1-s2.0-S0926860X23004490-gr6.jpg https://s3-eu-west-1.amazonaws.com/prod-ucs-content-store-eu-west/content/pii:S0926860X23004490/gr6/DOWNSAMPLED/image/jpeg/0f0dd454ce839751bb04ed5dd25a6961/gr6.jpg gr6 gr6.jpg jpg 10700 182 263 IMAGE-DOWNSAMPLED 1-s2.0-S0926860X23004490-gr10.jpg https://s3-eu-west-1.amazonaws.com/prod-ucs-content-store-eu-west/content/pii:S0926860X23004490/gr10/DOWNSAMPLED/image/jpeg/c14664bbc41ca5f956dac0738c406898/gr10.jpg gr10 gr10.jpg jpg 22580 446 188 IMAGE-DOWNSAMPLED 1-s2.0-S0926860X23004490-gr2.jpg https://s3-eu-west-1.amazonaws.com/prod-ucs-content-store-eu-west/content/pii:S0926860X23004490/gr2/DOWNSAMPLED/image/jpeg/1b3c3d003a424df995fe5e91359ca1cb/gr2.jpg gr2 gr2.jpg jpg 88515 390 678 IMAGE-DOWNSAMPLED 1-s2.0-S0926860X23004490-gr1.jpg https://s3-eu-west-1.amazonaws.com/prod-ucs-content-store-eu-west/content/pii:S0926860X23004490/gr1/DOWNSAMPLED/image/jpeg/fbf2af819fc474a0241d0ea79f4f58bc/gr1.jpg gr1 gr1.jpg jpg 48655 391 602 IMAGE-DOWNSAMPLED 1-s2.0-S0926860X23004490-gr7.jpg https://s3-eu-west-1.amazonaws.com/prod-ucs-content-store-eu-west/content/pii:S0926860X23004490/gr7/DOWNSAMPLED/image/jpeg/f017b2f6c598da3dd269c0cbecb9fab9/gr7.jpg gr7 gr7.jpg jpg 12699 304 226 IMAGE-DOWNSAMPLED 1-s2.0-S0926860X23004490-gr9.jpg https://s3-eu-west-1.amazonaws.com/prod-ucs-content-store-eu-west/content/pii:S0926860X23004490/gr9/DOWNSAMPLED/image/jpeg/b7b32804b50a8ecf30733b69bd3efff4/gr9.jpg gr9 gr9.jpg jpg 16939 218 263 IMAGE-DOWNSAMPLED 1-s2.0-S0926860X23004490-gr4.sml https://s3-eu-west-1.amazonaws.com/prod-ucs-content-store-eu-west/content/pii:S0926860X23004490/gr4/THUMBNAIL/image/gif/c3b6251dc25ed756f0bcc0f684fe4425/gr4.sml gr4 gr4.sml sml 17688 163 168 IMAGE-THUMBNAIL 1-s2.0-S0926860X23004490-gr3.sml https://s3-eu-west-1.amazonaws.com/prod-ucs-content-store-eu-west/content/pii:S0926860X23004490/gr3/THUMBNAIL/image/gif/3d4ab3dff094a9aa98787a4c9eb88fdc/gr3.sml gr3 gr3.sml sml 20114 146 219 IMAGE-THUMBNAIL 1-s2.0-S0926860X23004490-gr5.sml https://s3-eu-west-1.amazonaws.com/prod-ucs-content-store-eu-west/content/pii:S0926860X23004490/gr5/THUMBNAIL/image/gif/362b09c07de12e2596ade77f64082cc6/gr5.sml gr5 gr5.sml sml 5635 99 219 IMAGE-THUMBNAIL 1-s2.0-S0926860X23004490-gr11.sml https://s3-eu-west-1.amazonaws.com/prod-ucs-content-store-eu-west/content/pii:S0926860X23004490/gr11/THUMBNAIL/image/gif/82527352d6b503d2c8c1687fedd81d69/gr11.sml gr11 gr11.sml sml 10312 164 211 IMAGE-THUMBNAIL 1-s2.0-S0926860X23004490-gr8.sml https://s3-eu-west-1.amazonaws.com/prod-ucs-content-store-eu-west/content/pii:S0926860X23004490/gr8/THUMBNAIL/image/gif/31f704047be1083033e019c48de03488/gr8.sml gr8 gr8.sml sml 4295 76 219 IMAGE-THUMBNAIL 1-s2.0-S0926860X23004490-ga1.sml https://s3-eu-west-1.amazonaws.com/prod-ucs-content-store-eu-west/content/pii:S0926860X23004490/ga1/THUMBNAIL/image/gif/fbe8ff7ea9e63b7621479ad442278223/ga1.sml ga1 true ga1.sml sml 6787 90 219 IMAGE-THUMBNAIL 1-s2.0-S0926860X23004490-gr6.sml https://s3-eu-west-1.amazonaws.com/prod-ucs-content-store-eu-west/content/pii:S0926860X23004490/gr6/THUMBNAIL/image/gif/d37dfcf08a32441634258d7633450e00/gr6.sml gr6 gr6.sml sml 7198 152 219 IMAGE-THUMBNAIL 1-s2.0-S0926860X23004490-gr10.sml https://s3-eu-west-1.amazonaws.com/prod-ucs-content-store-eu-west/content/pii:S0926860X23004490/gr10/THUMBNAIL/image/gif/4b809cffafe0a6e0b0697b9d7a1783de/gr10.sml gr10 gr10.sml sml 4242 164 69 IMAGE-THUMBNAIL 1-s2.0-S0926860X23004490-gr2.sml https://s3-eu-west-1.amazonaws.com/prod-ucs-content-store-eu-west/content/pii:S0926860X23004490/gr2/THUMBNAIL/image/gif/997ca9d6c83174d8c14c5cd7bbde17c8/gr2.sml gr2 gr2.sml sml 17627 126 219 IMAGE-THUMBNAIL 1-s2.0-S0926860X23004490-gr1.sml https://s3-eu-west-1.amazonaws.com/prod-ucs-content-store-eu-west/content/pii:S0926860X23004490/gr1/THUMBNAIL/image/gif/913503308d3888883739c61abd527466/gr1.sml gr1 gr1.sml sml 9142 142 219 IMAGE-THUMBNAIL 1-s2.0-S0926860X23004490-gr7.sml https://s3-eu-west-1.amazonaws.com/prod-ucs-content-store-eu-west/content/pii:S0926860X23004490/gr7/THUMBNAIL/image/gif/68990cec241df3df2a6b69b88b7ae8b7/gr7.sml gr7 gr7.sml sml 3914 164 122 IMAGE-THUMBNAIL 1-s2.0-S0926860X23004490-gr9.sml https://s3-eu-west-1.amazonaws.com/prod-ucs-content-store-eu-west/content/pii:S0926860X23004490/gr9/THUMBNAIL/image/gif/9d11d67d8b2be4775ad7c0825210d334/gr9.sml gr9 gr9.sml sml 8937 164 197 IMAGE-THUMBNAIL 1-s2.0-S0926860X23004490-gr4_lrg.jpg https://s3-eu-west-1.amazonaws.com/prod-ucs-content-store-eu-west/content/pii:S0926860X23004490/HIGHRES/image/jpeg/5279e80aed0cc95baa815b380ecb9c01/gr4_lrg.jpg gr4 gr4_lrg.jpg jpg 683043 3476 3575 IMAGE-HIGH-RES 1-s2.0-S0926860X23004490-gr3_lrg.jpg https://s3-eu-west-1.amazonaws.com/prod-ucs-content-store-eu-west/content/pii:S0926860X23004490/HIGHRES/image/jpeg/d0d0f46bd0b61a56a2849d0aab841906/gr3_lrg.jpg gr3 gr3_lrg.jpg jpg 911939 2110 3160 IMAGE-HIGH-RES 1-s2.0-S0926860X23004490-gr5_lrg.jpg https://s3-eu-west-1.amazonaws.com/prod-ucs-content-store-eu-west/content/pii:S0926860X23004490/HIGHRES/image/jpeg/2009798cffbca9fd9ae553b93d41ed63/gr5_lrg.jpg gr5 gr5_lrg.jpg jpg 149902 1201 2661 IMAGE-HIGH-RES 1-s2.0-S0926860X23004490-gr11_lrg.jpg https://s3-eu-west-1.amazonaws.com/prod-ucs-content-store-eu-west/content/pii:S0926860X23004490/HIGHRES/image/jpeg/d14703437d494763d8760112f3a19965/gr11_lrg.jpg gr11 gr11_lrg.jpg jpg 257746 2063 2661 IMAGE-HIGH-RES 1-s2.0-S0926860X23004490-gr8_lrg.jpg https://s3-eu-west-1.amazonaws.com/prod-ucs-content-store-eu-west/content/pii:S0926860X23004490/HIGHRES/image/jpeg/5b61001f3bb0cf73eb1e602d5dba984c/gr8_lrg.jpg gr8 gr8_lrg.jpg jpg 146385 1044 2994 IMAGE-HIGH-RES 1-s2.0-S0926860X23004490-ga1_lrg.jpg https://s3-eu-west-1.amazonaws.com/prod-ucs-content-store-eu-west/content/pii:S0926860X23004490/HIGHRES/image/jpeg/a037099b9433f0bc7f5c81d51b9e5589/ga1_lrg.jpg ga1 true ga1_lrg.jpg jpg 192877 886 2157 IMAGE-HIGH-RES 1-s2.0-S0926860X23004490-gr6_lrg.jpg https://s3-eu-west-1.amazonaws.com/prod-ucs-content-store-eu-west/content/pii:S0926860X23004490/HIGHRES/image/jpeg/ce4ca34305d2915af54b2520cd1971a5/gr6_lrg.jpg gr6 gr6_lrg.jpg jpg 54790 806 1164 IMAGE-HIGH-RES 1-s2.0-S0926860X23004490-gr10_lrg.jpg https://s3-eu-west-1.amazonaws.com/prod-ucs-content-store-eu-west/content/pii:S0926860X23004490/HIGHRES/image/jpeg/28c89480b5b13dd78a89cfc7d4bf5c5f/gr10_lrg.jpg gr10 gr10_lrg.jpg jpg 140263 1979 835 IMAGE-HIGH-RES 1-s2.0-S0926860X23004490-gr2_lrg.jpg https://s3-eu-west-1.amazonaws.com/prod-ucs-content-store-eu-west/content/pii:S0926860X23004490/HIGHRES/image/jpeg/b27da5c54556310a3dc38aafc31c5135/gr2_lrg.jpg gr2 gr2_lrg.jpg jpg 418957 1721 2994 IMAGE-HIGH-RES 1-s2.0-S0926860X23004490-gr1_lrg.jpg https://s3-eu-west-1.amazonaws.com/prod-ucs-content-store-eu-west/content/pii:S0926860X23004490/HIGHRES/image/jpeg/886451b769a71037fa572acd2341067f/gr1_lrg.jpg gr1 gr1_lrg.jpg jpg 232059 1730 2661 IMAGE-HIGH-RES 1-s2.0-S0926860X23004490-gr7_lrg.jpg https://s3-eu-west-1.amazonaws.com/prod-ucs-content-store-eu-west/content/pii:S0926860X23004490/HIGHRES/image/jpeg/3e07b8fe2d2b61742df96454b9fde60a/gr7_lrg.jpg gr7 gr7_lrg.jpg jpg 58358 1341 998 IMAGE-HIGH-RES 1-s2.0-S0926860X23004490-gr9_lrg.jpg https://s3-eu-west-1.amazonaws.com/prod-ucs-content-store-eu-west/content/pii:S0926860X23004490/HIGHRES/image/jpeg/aa63b6da3c34e6213cec805b36456de3/gr9_lrg.jpg gr9 gr9_lrg.jpg jpg 80998 967 1164 IMAGE-HIGH-RES 1-s2.0-S0926860X23004490-mmc1.docx https://s3-eu-west-1.amazonaws.com/prod-ucs-content-store-eu-west/content/pii:S0926860X23004490/mmc1/MAIN/application/vnd.openxmlformats-officedocument.wordprocessingml.document/463a5350f6d6d29a883a7245797f0658/mmc1.docx mmc1 mmc1.docx docx 1460224 APPLICATION 1-s2.0-S0926860X23004490-si0001.svg https://s3-eu-west-1.amazonaws.com/prod-ucs-content-store-eu-west/content/pii:S0926860X23004490/image/svg+xml/01ff130af2564d80a14dc3528352d948/si0001.svg si0001 si0001.svg svg 1008 ALTIMG 1-s2.0-S0926860X23004490-si0002.svg https://s3-eu-west-1.amazonaws.com/prod-ucs-content-store-eu-west/content/pii:S0926860X23004490/image/svg+xml/f2d94d315a040f3b8f24f5df2d06e73c/si0002.svg si0002 si0002.svg svg 2216 ALTIMG 1-s2.0-S0926860X23004490-am.pdf https://s3-eu-west-1.amazonaws.com/prod-ucs-content-store-eu-west/content/egi:10SDC12SQKL/MAIN/application/pdf/d67d7af72435348d19e782a3e63be363/am.pdf am am.pdf pdf false 1929665 AAM-PDF APCATA 119469 119469 S0926-860X(23)00449-0 10.1016/j.apcata.2023.119469 The Authors Fig. 1 A) XRD patterns of the NaKFER zeolite support and CoFER, Co/FER, 14 K Co/FER catalysts. B) Raman spectra of the Co/FER and 6 K Co/FER catalysts. C) H2-TPR profiles of the CoFER, Co/FER, 2 K Co/FER, and 6 K Co/FER catalysts. Fig. 1 Fig. 2 SEM images of the A – NaKFER, B – CoFER, C – Co/FER, D – 2 K Co/FER, E – 6 K Co/FER catalysts. Fig. 2 Fig. 3 TEM images with phase identification for the Co/FER (A1-A3) and 6 K Co/FER (B1-B3) catalysts. Fig. 3 Fig. 4 STEM images together with EDX maps of Si (blue), Al (green), Co (yellow), and K (dark blue) distributions in the NaKFER, CoFER, Co/FER, 2 K Co/FER, and 6 K Co/FER samples. Fig. 4 Fig. 5 Optimization of K-loading for the cobalt-based ferrierite-supported catalyst for the soot combustion reaction. A) T10%, T50%, and T90% and B) stability of catalytic activity of 6 K Co/FER catalyst over three subsequent tests. Tests were performed in the tight contact mode in 5% O2/He atmosphere with a TGA analysis. Fig. 5 Fig. 6 Comparison of the activity in soot combustion determined as the temperature of the 90% conversion (T90%) for the selected catalysts: CoFER, Co/FER, and 6 K Co/FER in tight and loose contact conditions in 5% O2/He atmosphere. Fig. 6 Fig. 7 Relationships between the changes of (A) the work function and (B) the catalyst activity in soot oxidation (tight contact, 5% O2/He) expressed as T90% with the potassium concentration determined from XRF studies. Fig. 7 Fig. 8 Potassium thermal desorption signals corresponding to heating (red points) and cooling (blue points) of the 2 K Co/FER, 6 K Co/FER, and 10 K Co/FER catalysts. Fig. 8 Fig. 9 The effect of NO presence in the feed on the Co/FER and 6 K Co/FER catalysts activity in the soot combustion reaction in loose contact mode. Fig. 9 Fig. 10 FT-IR spectra collected in KBr of Co/FER (A) and 6 K Co/FER (B) catalysts at different stages (0% conversion (A1, B1), 10% conversion (A2, B2), and 50% conversion (A3, B3) of soot combustion reaction in loose contact mode with NO in the gas flow. Fig. 10 Fig. 11 Quantification of the surface composition of the catalyst/soot mixture at 10% and 50% of the soot oxidation reaction stages for Co/FER A) Si, O, C; B) Co, N, K, Al, and 6 K Co/FER C) Si, O, C; D) Co, N, K, Al. Fig. 11 Table 1 Cobalt and potassium content in the studied catalysts from the XRF studies. Table 1 Catalyst Content by weight/% Co K CoFER 1.4 2.6 Co/FER 13.9 0* 2 K Co/FER 13.5 1.3* 6 K Co/FER 10.6 5.7* 10 K Co/FER 14.5 10.0* 14 K Co/FER 13.3 13.1* * The content of potassium was calculated as the difference between the total amount of K and the amount from the undoped Co/FER catalyst. Potassium and cobalt double-doped ferrierites as a new class of soot oxidation catalysts Gabriela Grzybek Conceptualization Methodology Investigation Writing – original draft Writing – review & editing Supervision Project administration Funding acquisition a ⁎ Rudzinska Magdalena Rudzińska Investigation Data curation a Gora-Marek Kinga Góra-Marek Investigation Resources Writing – review & editing a Paweł Stelmachowski Writing – review & editing a Grzegorz Słowik Investigation Data curation b Andrzej Kotarba Resources Writing – review & editing a a Faculty of Chemistry, Jagiellonian University in Kraków, Gronostajowa 2, 30–387 Krakow, Poland Faculty of Chemistry, Jagiellonian University in Kraków Gronostajowa 2 Krakow 30–387 Poland Faculty of Chemistry, Jagiellonian University in Kraków, Gronostajowa 2, 30–387 Krakow, Poland b Faculty of Chemistry, Maria Curie-Sklodowska University in Lublin, Maria Curie-Sklodowska Sq. 3, 20–031 Lublin, Poland Faculty of Chemistry, Maria Curie-Sklodowska University in Lublin Maria Curie-Sklodowska Sq. 3 Lublin 20–031 Poland Faculty of Chemistry, Maria Curie-Sklodowska University in Lublin, Maria Curie-Sklodowska Sq. 3, 20–031 Lublin, Poland ⁎ Corresponding author. Research efforts to develop an effective soot oxidation catalyst have intensified in recent years due to the increased awareness of the highly harmful effect of soot particles on the human health and the environment. Large-scale application of a developed catalyst calls for a cheap support material allowing for an effective dispersion and thus a decrease in the active phase loading. Zeolites, widely used in catalysis as active phase carriers, possess advantageous characteristics such as a uniform porous structure and large surface area. Furthermore, they are characterized by high availability, good price, and are environmentally friendly. Cobalt-based materials provide promising soot oxidation catalyst phases, and alkali doping can further enhance their activity. This study focuses on the optimization of the potassium loading in the potassium and cobalt double-doped ferrierites towards a new class of cheap and environmentally friendly soot combustion catalysts. The potassium doping of the ferrierite-supported cobalt spienel was optimized in the range of 0–14 wt%. The obtained materials were characterized in terms of their composition (XRF, XPS, XRD, Raman spectroscopy), morphology (SEM, TEM/EDX/FFT), and reducibility (H2-TPR), and tested in the process of soot oxidation in tight and loose contact modes. The strong promotional effect of potassium was discussed in terms of a significant modification of the catalyst electronic properties (work function studies) and supported by the potassium surface state studies by the alkali thermal desorption method (SR-TAD). It was found that the optimal potassium promoter dispersion leads to the lowest catalyst work function and its highest activity in soot combustion. The effect of nitric oxide was also investigated for selected catalysts. The opposite effect of NO on the activity of undoped and K-doped catalysts was discussed on the basis of in-depth spectroscopic studies. An enhanced formation of nitrate species was found on the surface of the K-containing catalyst which led to the stronger inhibiting effect of NO. Graphical Abstract ga1 Keywords Alkali promotion Cobalt catalyst Ferrierite Soot oxidation Electronic promotion Data availability Data will be made available on request. 1 Introduction Incomplete combustion of fossil and bio-derived fuels results in the emission of soot particles, which can enter into the human body, through the respiratory system, or even through the skin, causing many illnesses and cancerogenic changes [1]. Therefore, scientists are looking for solutions that can efficiently reduce soot release into the atmosphere. Effective removal of soot can be achieved by burning it with the use of a catalyst ensuring a satisfactory temperature window of the process. Soot oxidation catalysts can be grouped as noble metal-based catalysts, with emphasis on Pt-based catalysts [2–4], and transition metal oxide-based catalysts (e.g. perovskites, spinels, tunneled and/or layered structures) [5–11]. Among all the reported materials, platinum-based catalysts supported by ceria are the most active ones. However, following the current trend of targeting low-priced noble-metal-free catalysts, transition-metal oxides are gaining considerable attention as promising active phases, whose performance may be significantly improved by the optimized promotion with alkali [7,12,13]. Alkali addition affects the mechanism of soot combustion, strongly modifying the electronic properties of metal oxide catalysts [14,15]. Alkali adsorption on the surface of metal oxides results in a decrease in the work function (WF, φ ) of the materials according to the Topping equation (Eq. 1), with the local minimum corresponding to the optimum alkali loading [7]. This minimum correlates with the maximum activity in the soot combustion for many transition metal-based catalysts [7,14,16]. (1) ∆ φ = 4 π σ μ 1 + 9 α δ 3 / 2 where: μ - dipole moment of the individual adsorbate, σ - surface concentration of the dipoles, α - adsorbate polarizability. To increase the effectivity of the catalysts, the active phases are often dispersed on carriers characterized by a high specific surface area. In the case of soot combustion catalysts, mainly ceria, zirconia, alumina, and silica were used [5–7,10]. Surprisingly, mesoporous zeolitic materials, although popular in catalysis, were not widely explored as supports for the soot combustion catalysts. There are only a few papers addressing zeolite-based soot combustion catalysts. It was shown that a promising catalytic activity of Pt catalysts supported on zeolites such as TS-1, H-ZSM5, and USY can be achieved [2–4]. Notably, zeolites are widely used as molecular sieves, adsorbents, detergents, and catalyst supports, but also as catalysts themselves [17–21]. Zeolites-based catalysts are intensively studied for applications in petrochemistry, biomass conversion, environmental catalysis (i.e. NOx removal, CO2 capture, and conversion), or in lithium-ion batteries [17,22–26]. In our previous paper, we have shown that very active catalysts for steam reforming of ethanol (ESR) can be developed based on zeolites [27]. The cobalt catalyst based on high-silica and pure silica nanometric ZSM-5 zeolite supports indicated extraordinary performance (high selectivity and stability) in the ESR reaction, corresponding to a relatively low degree of carbon deposit formation over the catalysts. Furthermore, the carbon deposit formed during the ESR process was relatively easy to remove under oxidation conditions giving premises for the promising catalytic activity of catalysts in the combustion of carbonaceous materials such as soot particles. Thus, in this work, we aimed to investigate whether the ferrierite zeolite materials (FER) are suitable candidates as supports for soot combustion catalysts. We prepared a series of cobalt-containing zeolite materials doped with potassium in the range of 0 – 14 wt percent and characterized them with a wide range of complementary techniques. We tested their catalytic activity in tight and loose contact modes of the soot combustion reaction. Moreover, since NO is often present in the gas feed of exhaust engine gases, its effect on catalyst activity is of vital interest for the soot oxidation process [12,13,28], especially in the loose contact mode, where the contact between the soot and catalyst is limited. Therefore, we also tested the selected catalysts in loose contact mode with NO in the gas stream. The strong promotional effect of potassium on the activity of the ferrierite-supported cobalt catalyst (Co/FER) was discussed in terms of work function changes upon K-loading. We corroborated the relationship of observed activity-electronic properties by potassium surface state studies with the species-resolved thermal alkali desorption method (SR-TAD) [29]. We also compared the effect of NO on the undoped Co/FER and optimized potassium-doped Co/FER catalysts and evaluated the results based on the in-depth spectroscopic studies. 2 Experimental 2.1 Catalyst preparation A series of potassium-doped cobalt catalysts supported on ferrierite (K Co/FER) were synthesized using the commercial NaKFER zeolite (TOSOH 720KOA). The Co3O4 phase was deposited by the incipient wetness impregnation (IWI) method using a water solution of Co(NO3)2 with an appropriate concentration to obtain about 15 wt% loading of cobalt. The Co/FER sample was next dried in the air at 60 °C for 24 h and calcined in the air at 500 °C for 4 h. In the subsequent step, the potassium promoter in the amount of 0 – 14 wt% was added to Co/FER, also by the IWI method, using KNO3 aqueous solutions with appropriate concentrations, and dried and calcined again according to the procedure described above. A reference Co-exchanged catalyst, CoFER, was prepared by the ion-exchange of native NaKFER in a 1 M Co(NO3)2 solution at 80 °C, followed by drying in room temperature and calcination in air at 500 °C for 4 h. 2.2 Materials characterization The phase composition was examined with the X-ray diffraction method (XRD) using a Rigaku Multiflex X-ray diffractometer. The diffraction patterns were taken using the CuK α radiation of λ = 1.54 Å (2 theta between 5° and 90°, step of 0.02°, 2° per minute). Micro-Raman spectroscopy was applied to confirm the spinel structure of the cobalt phase present in the samples (fresh and used catalysts). The Raman spectra (in the range of 100–1000 cm−1, resolution of 1 cm–1) were recorded at room temperature using a Renishaw InVia spectrometer (laser 785 nm). The elemental composition of the obtained catalyst was checked using an X-ray Fluorescence Spectrometer (XRF, ARL QUANT’X). The Rh anode was applied to generate the X-rays of 4 – 50 kV (1 kV step). The texture of the catalysts was analyzed by N2-physisorption at − 196 °C with a Quantachrome Autosorb-1-MP gas sorption apparatus using the procedure described elsewhere [30]. The Quanta 3D FEG scanning electron microscope (SEM) of the FEI Company was used for sample imaging. The catalyst samples were applied to aluminum supports covered by carbon conductive tape and then transferred to the microscope. Microscopic characterization of the catalysts was carried out at an accelerating voltage of 30 kV. The detailed morphological characterization of the samples was carried out using the scanning transmission electron microscope (TEM, Titan G2 60–300 kV, FEI Company) with an acceleration voltage of the electron beam equal to 300 kV (the experimental details described elsewhere [31]). Information on the distribution of the elements was obtained by energy dispersion X-ray spectroscopy (EDX). The mapping was carried out in the scanning TEM mode (STEM). Phase separation in the cobalt-based catalysts was performed with the fast Fourier transform (FFT) by using masking available in the Gatan Digital Micrograph software package. Hydrogen temperature programmed reduction (H2-TPR) was carried out in a fixed-bed quartz flow microreactor system connected to a thermal conductivity detector, TCD (TCD3, Valco, Houston, TX, USA). 50 mg of the sample was placed in the reactor and degassed in a flow of high purity Ar (99.999%) at 550 °C for 30 min. Subsequently, the reactor was cooled to 80 °C and the sample was reduced in a gas mixture of 5 mol% H2 in Ar (both pure 99.999%) with a 10 ml·min−1 flow rate, controlled by the mass flow controller in the temperature range of 80–950 °C with a heating rate of 10 °·min−1. The water produced during the reduction was removed by a cold trap. Changes in the work function of catalysts due to potassium doping were examined by measuring contact potential difference (CPD) using the Kelvin probe method with a KP6500 device (McAllister Technical Services, Coeurd’Alene, ID, USA). The stainless steel plate (d = 3 mm) was used as a reference electrode (WFref = 4.3 eV). The studies were performed under ambient conditions, with vibration frequency at 114 Hz and amplitude at 40 arb. uni. The multi-chamber ultra-high vacuum system (PREVAC) was utilized to conduct X-ray photoelectron spectroscopy (XPS) studies, with a hemispherical Scienta R4000 electron analyzer for collecting spectra. Complementary equipment included a Scienta SAX-100 X-ray source (Al Kα, 1486.6 eV, 0.8 eV band) and the XM 650 X-Ray Monochromator (0.2 eV band). For survey spectra, the pass energy of the analyzer was set at 200 eV with a 500 meV step, and for high-resolution spectra (Si 2p, Al 2p, Co 2p, O 1 s, K 2p, N 1 s, and C 1 s), the pass energy was set at 50 eV with a 50–100 meV step. The analysis chamber had a base pressure of 5·10−9 mbar, which did not exceed 3·10−8 mbar during the spectra collection. Data processing was carried out using CasaXPS software (v 2.3.23 PR1.0) [32]. For the IR studies the pristine and reagent-contacted catalysts (5 mg) were mixed with potassium bromide (100 mg) and pressed in the form of thin pellets. IR spectra were acquired in transmission mode with a Bruker Vertex 70 spectrophotometer equipped with an MCT detector that collected 100 scans for each spectrum with 2 cm−1 resolution. 2.3 Thermal alkali desorption studies Alkali promoters are known to desorb from catalyst surfaces in high temperatures. If the loss of the alkali dopant is extensive, the properties of the catalyst will change and its activity usually deteriorates. Thus, detailed studies of the evolution of their surface state are of the greatest importance. As shown in our previous works [29,33,34], it is possible by monitoring the thermal desorption flux of alkali using the species-resolved thermal alkali desorption method (SR-TAD). Upon heating of an alkali-containing catalyst, the energy needed for the alkali desorption (atoms, cations, Rydberg atoms), the temperature range of desorption, and the amount of desorbing individuals can be determined. The analysis of the desorption parameters such as the onset and intensity of desorption flux as well as desorption energies gives information about the alkali chemical state (localization, identification of surface phases containing alkali admixtures), alkali surface dynamics (mobility of alkali), and stability of alkali on the catalyst surface (including mechanism and energy barriers of their escape). The desorption flux of potassium atoms during heating and subsequent cooling of the sample was measured with a surface ionization detector. The experiments were done in a vacuum apparatus (10−8 mbar). The pelletized samples (diameter of 13 mm) were heated to 600 °C and then cooled down (rate 10 °C/min) [34,35]. 2.4 Catalytic tests The soot oxidation tests were performed using thermogravimetric analysis using TGA/DSC 1 equipment (Mettler Toledo). The samples for catalytic tests were prepared by mixing (shaking in Eppendorf tube) 50 mg of catalyst and 5 mg of soot for 1 min (loose contact) and grounding the same amounts of sample and soot in an agate mortar for 10 min (tight contact). The prepared mixtures were then placed in an alumina crucible and heated in a flow of 5% O2/He 60 ml·min-1 (mixed with Ar 20 ml·min−1) in a temperature range of 30–900 °C at a heating rate of 10 °C/min. For the loose contact mode, the effect of NO in the gas stream was investigated by performing temperature-programmed soot oxidation tests in the temperature range of 30–800 °C. The samples were prepared in the same way as for the TGA experiments. Measurements were carried out in a U-shaped quartz reactor using 5% O2/He and 3.3% O2/0.33% NO/He gas mixtures with a total flow of 60 ml·min-1. The composition of the gas phase was monitored with a QMS detector (Hiden, lines for CO (m/z = 28), CO2 (m/z = 44), NO (m/z = 30), and O2 (m/z = 32)). 3 Results and discussion 3.1 Physicochemical characterization of the catalysts The series of K-doped Co/FER catalysts were characterized in terms of their chemical and phase composition, reducibility, and morphology (XRF XRD, Raman Spectroscopy, H2-TPR SEM, HR-TEM/EDX/FFT). XRF analysis revealed that the desired loading of the active cobalt phase was successfully achieved at the level of 13.2 ± 2.5 wt% ( Table 1). The results also confirmed that we obtained the series of potassium-doped samples with increasing K-loading, in the range of 0–14 wt%. Almost all studied samples contained native potassium located in ion-exchanged positions of the zeolite framework; the potassium content for pure NaKFER zeolitic support determined from XRF studies equaled 5.9 wt%. A lower potassium content in the case of the ion-exchanged CoFER sample can be explained by the potassium replacement with cobalt ions occupying ion-exchange positions [36]. From the X-ray diffractograms collected in Fig. 1A, it can be inferred that there was no change in the crystal structure of ferrierite support after the addition of cobalt. Both positions and intensities of the diffraction lines representative of the FER structure remained unaffected. The maxima marked by * at 2θ equal to 19.1, 31.3, 36.9, 44.9, 55.7, and 59.4 in the diffractograms of Co/FER and 14 K Co/FER catalysts were identified as corresponding to the (111), (220), (311), (400), (422), and (511) reflection planes of Co3O4 (ICSD 69378), respectively. Moreover, no additional reflexes indicating the formation of potassium-originated phases, such as KNO3, were detected in the XRD pattern of the 14 K Co/FER catalyst, which we selected for XRD studies as a representative K-containing sample, due to its highest content of potassium. Raman spectra of the selected, Co/FER and 6 K Co/FER, catalysts are shown in Fig. 1B. Five bands located at 187 (F2 g), 476 (Eg), 515 (F2 g), 613 (F2 g), and 684 (A1 g) cm−1 confirmed the presence of the spinel phase. In the TPR profiles of the catalysts (Fig. 1C), three main maxima at ca. 330, 360, and 410 °C are usually assigned to the Co3+→ Co2+ and Co2+→ Co0 reduction processes [37]. The presence of three maxima may be explained by two locations of cobalt, in the form of cobalt spinel on the external surface of ferrierite and in the form of Co2+ species in ion-exchanged positions. Although almost no change in the reducibility of the active cobalt phase is observed upon the introduction of potassium in the amount of 2 wt% (2 K Co/FER), a substantial change in the reduction profile is observed for the 6 K Co/FER sample. It is illustrated by the shift of the TPR profile by about 40 °C towards higher temperatures and the sharp, intense peak in the range of 400 − 600 °C for the 6 K Co/FER sample. The latter peak was attributed [29] to the nitrates on the surface of the catalyst that originate from the potassium source. In turn, the high-temperature peak (>800 °C) observed for CoFER is typical for reduction of cobalt in ion-exchange positions [30]. The representative SEM images of the zeolite support (NaKFER), Co-exchanged ferrierite (CoFER), and Co and K impregnated ferrierite (Co/FER, 2 K Co/FER, 6 K Co/FER) are shown in Fig. 2. The morphology of NaKFER (Fig. 2A) and Co-containing catalysts (CoFER, Co/FER, Fig. 2B,C) is characterized by aggregated lamellar and needle-shaped crystallites with irregular sizes and shapes typical of the FER morphology [38–41]. For bare zeolite, the grains are loosely arranged, whereas they are much more compact in the case of Co catalysts; there are no large spaces between the grains, and the grains are much more squeezed together. In the case of potassium-doped samples (Fig. 2D,E) the grains of the catalyst are additionally covered with a phase of an indefinite shape, which also fills the spaces between the grains. The grain boundaries are more difficult to define. These observations are consistent with the observed decrease in the specific surface area upon K-doping (Table S1). The TEM images together with the complementary phase identification of Co/FER and 6 K Co/FER are presented in Fig. 3. The cobalt spinel nanograins of the size in the range of 10–30 nm are dispersed on the grains of the ferrierite support. The STEM images together with the complementary EDX elemental maps for NaKFER, CoFER, Co/FER, 2 K Co/FER, and 6 K Co/FER catalysts are presented in Fig. 4. First, the STEM images revealed that the morphology of zeolite is preserved after the introduction of cobalt and potassium. Second, the collected elemental maps revealed the uniform distribution of cobalt on the zeolite support for Co/FER, 2 K Co/FER, and 6 K Co/FER catalysts. Additionally, the cobalt map collected for the CoFER cobalt-exchanged sample indicated a uniform cobalt distribution in the zeolite channels. The potassium maps indicated that it is well distributed on the surfaces of all catalysts. 3.2 The nature of potassium promotional effect In Fig. 5A we compared the activity in the soot combustion reaction, expressed as the temperature of 10%, 50%, and 90% conversion, carried out in tight contact mode for the series of NaKFER, CoFER, Co/FER, and K-doped Co/FER samples. The presented results revealed a negligible activity of bare ferrierite and cobalt-exchanged zeolite. For these samples, soot is oxidized in the same temperature window as for the non-catalytic process. The Co/FER catalyst containing the cobalt spinel phase segregated on the external surface of the support exhibited a significantly higher activity with respect to the non-catalytic process. The most significant activity enhancement was observed at the beginning of the process, where T10% was reduced by about 130 °C, whereas the temperatures of 50% and 90% of conversion were lowered by about 75–80 °C. Most importantly, the addition of potassium promoter significantly improves the activity of the Co/FER catalyst and strongly depends on the K loading. For the 2 K Co/FER sample we observed a T90% decrease of about 45 °C. The optimal potassium content was found for the 6 K Co/FER sample, for which T90% equals about 460 °C and corresponds to a 150 °C shift toward lower temperatures. Further increase of K content did not improve the activity of our catalysts, in fact we observed a slight increase in T90% for 10 K Co/FER and 14 K Co/FER. Moreover, the three subsequent catalytic tests for the most active sample, 6 K Co/FER, indicated its very high stability (Fig. 5B). The catalytic parameters such as T10%, T50%, and T90% are almost the same for three consecutive soot combustion cycles. The structural and morphological characterization of the used catalyst indicated no significant changes after the stability testing (Fig. S1). For the selected CoFER, Co/FER, and 6 K Co/FER catalysts, we performed thermogravimetric soot combustion studies in the loose contact mode. These conditions are closer to real-life scenarios, in which the soot is trapped on the catalyst external surface in the exhaust diesel particulate filter. As expected, the activity of all three catalysts, decreased significantly due to limited contact between the soot and catalyst ( Fig. 6, S2). However, the general trend in activity is preserved, the comparison of the temperature of 90% conversion indicates a positive effect of potassium in the loose contact mode as well (the full set of the activity parameters is presented in Fig. S2). For the performed catalytic tests, the mass spectrometry analysis of the outlet gas composition showed almost 100% selectivity to CO2 (Fig. S3). According to a recent review on soot combustion [7], the most active catalysts that meet the target conditions for catalytic soot removal are the ones containing noble metals, in particular platinum. However, a recent trend in soot oxidation aims at the development of noble-metal-free catalysts. The most active materials reported in the literature operate in the temperature range of 400–600 °C. Moreover, the tight contact mode performance of our best catalyst, 6 K Co/FER, is at the lower end of this range, approaching the highly active noble-metal catalysts. 3.3 Analysis of the potassium promotion effect in terms of the catalyst work function changes Electronic surface promotion plays a key role in the soot oxidation reaction [7], therefore, we investigated the influence of potassium on the electronic properties of the catalyst by measuring the changes in the work function upon K doping using the Kelvin method. Fig. 7 illustrates similar profiles of the changes in work function and catalytic activity measured in the tight contact mode with the potassium content determined from XRF studies. Both the WF and T 90% data sets show nonmonotonous behavior, with a minimum corresponding to the 6 K Co/FER sample. The initial linear decrease in the work function with increasing potassium loading results from surface dipole formation and the resultant increase of the surface electron density. Then, after passing the work function minimum, a further increase in potassium coverage leads to depolarisation and a consequent increase in the work function. The WF minimum, related to the optimal dispersion of the potassium species forming surface dipoles, corresponds with the best catalytic activity. This strong correlation results from the decrease of the energy barrier for the interfacial electron transfer and thus facilitation of the formation of reactive surface oxygen species such as O-, O2, O2 2- produced during the O2 activation step responsible for soot oxidation [7,8]. 3.4 The surface state of potassium studied by the species-resolved thermal alkali desorption method In Fig. 8 the profiles of the K-desorption fluxes registered for the 2 K Co/FER, 6 K Co/FER, and 10 K Co/FER catalysts are collected. We presented the heating (red) and cooling (blue) stages of the measurement. The onset of the potassium atoms desorption is observed at 450 °C for the all studied samples. However, the courses of desorption curves vary significantly, revealing differences in the potassium surface state for these three samples. For the 2 K Co/FER catalyst (Fig. 8A) we observed the exponential character of K atom desorption during both heating and cooling phases of the experiment; however, these two stages did not follow the same path. The desorption profile measured during the sample cooling step is shifted toward higher temperatures, which may be related to the low potassium content and desorption of the most loosely bonded fraction of the potassium species during the heating stage. For the 6 K Co/FER sample we observed the exponential character of the K desorption signal with increasing temperature and the same course for heating and cooling steps. It confirms that there is a large pool of well-dispersed potassium species without an apparent segregation (Fig. 8B). In turn, the segregation is evident for 10 K Co/FER, where a local maximum in the desorption signal is centered at approximately 500 °C, indicating the presence of a loosely bonded potassium species fraction (Fig. 8C). These results corroborate the WF changes studies indicating that the 6 K Co/FER catalyst is the optimal material in terms of the dispersion of K promoter, exhibiting a uniform surface coverage, without an appreciable segregation. 3.5 The effect of NO In Fig. 9 we presented the comparison of the results of the catalytic tests in loose contact mode with and without NO in the gas mixture for our best 6 K Co/FER catalyst and the undoped Co/FER catalyst. As expected, NO addition improved the activity of the Co/FER catalyst, shifting the soot oxidation curve towards a lower temperature (ΔT10% ≈ 75 °C, ΔT50% ≈ 70 °C, ΔT90% ≈ 40 °C). Surprisingly, the presence of NO deteriorates the reaction of soot oxidation over the potassium-doped sample, 6 K Co/FER, and the higher the reaction temperature, the more significant the conversion decrease is. To understand the observed effect we performed FT-IR and XPS spectroscopic studies for the fresh Co/FER and 6 K Co/FER catalysts and their mixtures with soot after stopping the soot combustion reaction (loose contact, 3.3% O2/0.33% NO/He, 60 ml·min-1 ) at the stage of 10% and 50% conversion. The temperatures, at which reactions were stopped, had been estimated based on full temperature range experiments performed previously (Fig. 9). The FT-IR spectra collected in Fig. 10 revealed that the presence of potassium influences the surface interaction with nitrate species. In the spectra of the potassium-free catalyst (Fig. 10A) we observed two bands centered at 1393 and 1375 cm−1 which are diagnostic for monodentate nitrates accommodated on the catalyst surface due to their incomplete decomposition during the calcination process. Indeed, the NOx - species are stable at higher temperatures and their thermal stability depends on the structure and the kind of cation to which they are bonded. Judging from the intensities of the nitrate bands, we concluded their marginal accommodation on K-free samples. However, the abundance of nitrates increased for K-doped catalysts, which was accompanied by a shift of their FT-IR bands toward higher frequencies. Such behavior suggests that NOx species are released less effectively from potassium than from cobalt sites during calcination treatment. The phenomenon of K-induced accommodation of nitrates on the catalyst surface is visible for the catalysts when NO is present in the gas stream. During the oxidation of soot by a mixture of O2 and NO stable nitrate species are formed. Furthermore, the upshift of the nitrate bands indicates a privileged location of NOx- formed at the K sites: for the 6 K Co/FER sample, the nitrate bands are located at higher frequencies (1412 and 1390 cm−1). Based on the literature these bands were attributed mainly to monodentate nitrates bonded to K+ cations [42]. The high thermal stability of nitrates formed on K-enriched surfaces results in a deterioration of catalytic activity, which is most likely related to blocking the active centers of the catalyst [28] and canceling the electronic promotion effect due to K doping. Similarly, an ex situ XPS analysis was performed to determine the surface composition of the catalyst/soot mixture at 10% and 50% of the soot oxidation reaction stages (see Figs. S4-S6). The same two catalysts were investigated; Co/FER and potassium-promoted 6 K Co/FER. Fresh samples, without soot, were used as references. Mixing with soot leads to covering of the whole Co/FER catalyst surface (decrease of surface concentration of all elements except carbon, Fig. 11 A and B). An increase in the oxidation of soot from 10% to 50% does not change appreciably the surface composition of the mixture. At the same time, the nitrogen atomic concentration remains at the background level for all three samples (Fig. 11 B). The constant composition of the catalyst/soot mixture may result from a uniform, non-preferential soot oxidation over the entire catalyst surface. Similarly to the non-K-promoted samples, mixing with soot leads to covering of the 6 K Co/FER catalyst surface (decrease of surface concentration of all elements but carbon, Fig. 11 C and D). However, in contrast, an increase in soot oxidation from 10% to 50% leads to an increase in the surface concentration of all catalyst components but K and a decrease in the surface concentration of carbon. Furthermore, the atomic nitrogen concentration increases in the samples after the partial oxidation of soot, indicating the formation of nitrates (Fig. 11 D). A decrease in carbon content in the catalyst/soot mixture results from preferential oxidation of the soot over the potassium-promoted active centers and uncovering the catalyst surface. We hypothesize that the decrease in the potassium content results from the diffusion of potassium on the surface and into the soot particles, enhancing their combustion. Although the thermal mobility of potassium, shown in Fig. 8, indicates that K desorption detected with the SR-TAD apparatus starts already at 450 °C, additional experimental studies to confirm this hypothesis should be performed. 4 Conclusions The results of this research revealed that careful adjustment of potassium promotion can lead to a promising cobalt catalyst for the soot oxidation reaction based on the economically and environmentally friendly ferrierite. Although our catalyst is not reaching the activity level of Pt-based materials, it provides a very good starting point to develop a new class of eco-catalysts based on zeolites. The catalytic activity of K-doped Co/FER catalyst strongly depends on potassium content. T90% decreases with K loading, reaches the minimum for 6 K Co/FER, and increases slightly again for 10 K Co/FER and 14 K Co/FER. The 90% conversion of soot for optimal 6 K Co/FER was achieved at a temperature below 450 °C. The strong correlation between the work function measured with the Kelvin method and the activity in soot oxidation revealed the electronic character of K doping. Furthermore, the studies of the surface state of potassium by SR-TAD method confirmed optimal potassium dispersion for optimized 6 K Co/FER catalyst and potassium overloading for 10 K Co/FER sample. These unique surface state studies allowed us to confirm that optimal potassium promoter dispersion correlates with the optimized electronic properties of the K-doped Co-FER catalyst and its catalytic activity. The presence of NO deteriorates the catalytic activity of the K-doped sample, in contrast to the frequently reported positive effect of NO addition. In-depth spectroscopic studies of the catalysts' surfaces at different stages of the soot oxidation reaction indicated that the opposite effect of NO for K-doped and undoped catalysts is caused by an enhanced formation of nitrate species on the surface of the K-containing catalyst. This research opens a new class of catalytic supports for soot oxidation catalysis. Although the applied zeolite support is completely catalytically inactive, the reactive zeolite-supported catalysts can be successfully developed. CRediT authorship contribution statement GG: Conceptualization, Methodology, Investigation, Writing – original draft, Writing – review & editing, Supervision, Project administration, Funding acquisition. MR: Investigation, Data curation. KGM: FT-IR investigation and data analysis, Resources, Writing – review & editing. PS: XPS data analysis, Writing – review & editing. GS: Investigation, Data curation. AK: Resources, Writing – review & editing. All authors have read and agreed to the published version of the manuscript. Declaration of Competing Interest The authors declare that they have no known competing financial interests or personal relationships that could have appeared to influence the work reported in this paper. Acknowledgment The work was financed by Grant No. 2021/43/D/ST4/03016 from the National Science Centre, Poland. Appendix A Supporting information Supplementary data associated with this article can be found in the online version at doi:10.1016/j.apcata.2023.119469. Appendix A Supplementary material Supplementary material . References [1] European Environmental Agency Air Quality in Europe−2020 Report 2020 Copenhagen Denmark European Environmental Agency, Air Quality in Europe−2020 Report, Copenhagen, Denmark, 2020. [2] X. Zhou H. Zhang Y. Sun Z. Gao H. Chen Fuel 351 2023 128805 X. Zhou, H. Zhang, Y. Sun, Z. Gao, H. Chen, Fuel 351 (2023) 128805. [3] S. Liu X. Wu H. Luo D. Weng R. Ran Pt/Zeolite catalysts for soot oxidation: influence of hydrothermal aging J. Phys. Chem. C. 119 2015 17218 17227 S. Liu, X. Wu, H. Luo, D. Weng, R. Ran, Pt/Zeolite Catalysts for Soot Oxidation: Influence of Hydrothermal Aging, J. Phys. Chem. C 119 (2015) 17218–17227. [4] S. Liu X. Wu D. Weng M. Li R. Ran Roles of acid sites on Pt/H-ZSM5 catalyst in catalytic oxidation of diesel soot ACS Catal. 5 2015 909 919 S. Liu, X. Wu, D. Weng, M. Li, R. Ran, Roles of Acid Sites on Pt/H-ZSM5 Catalyst in Catalytic Oxidation of Diesel soot, ACS Catal. 5 (2015) 909–919. [5] A.M. Hernández-Giménez D.L. Castelló A. Bueno-López Diesel soot combustion catalysts: review of active phases Chem. Pap. 68 2014 1154 1168 A.M. Hernández-Giménez, D.L. Castelló, A. Bueno-López, Diesel soot combustion catalysts: review of active phases, Chem. Pap. 68 (2014) 1154–1168. [6] S. Liu X. Wu D. Weng R. Ran Ceria-based catalysts for soot oxidation: a review J. Rare Earths 33 2015 567 590 S. Liu, X. Wu, D. Weng, R. Ran, Ceria-based catalysts for soot oxidation: a review, J. Rare Earths 33 (2015) 567–590. [7] P. Legutko P. Stelmachowski X. Yu Z. Zhao Z. Sojka A. Kotarba Catalytic Soot Combustion─General Concepts and Alkali Promotion ACS Catal. 13 2023 3395 3418 P. Legutko, P. Stelmachowski, X. Yu, Z. Zhao, Z. Sojka, A. Kotarba, Catalytic Soot Combustion─General Concepts and Alkali Promotion, ACS Catal. 13 (2023) 3395–3418. [8] L. Chen T. Li J. Zhang J. Wang P. Chen M. Fu J. Wu D. Ye Chemisorbed superoxide species enhanced the high catalytic performance of Ag/Co3O4 nanocubes for soot oxidation ACS Appl. Mater. Interfaces 13 2021 21436 21449 L. Chen, T. Li, J. Zhang, J. Wang, P. Chen, M. Fu, J. Wu, D. Ye, Chemisorbed Superoxide Species Enhanced the High Catalytic Performance of Ag/Co(3)O(4) Nanocubes for Soot Oxidation, ACS Appl. Mater. Interfaces 13 (2021) 21436–21449. [9] P. Zhang M. Yang D. Han X. Liu X. Yu J. Xiong Y. Li Z. Zhao J. Liu Y. Wei Synergistic integration of energy storage catalysis: a multifunctional catalytic material for round-the-clock environmental cleaning Appl. Catal. B Environ. 321 2023 122077 P. Zhang, M. Yang, D. Han, X. Liu, X. Yu, J. Xiong, Y. Li, Z. Zhao, J. Liu, Y. Wei, Synergistic integration of energy storage catalysis: A multifunctional catalytic material for round-the-clock environmental cleaning, Appl. Catal. B Environ. 321, 122052 (2023) 122077. [10] Y. Li T. Qin Y. Ma J. Xiong P. Zhang K. Lai X. Liu Z. Zhao J. Liu L. Chen Y. Wei Revealing active edge sites induced by oriented lattice bending of Co-CeO2 nanosheets for boosting auto-exhaust soot oxidation J. Catal. 421 2023 351 364 Y. Li, T. Qin, Y. Ma, J. Xiong, P. Zhang, K. Lai, X. Liu, Z. Zhao, J. Liu, L. Chen, Y. Wei, Revealing active edge sites induced by oriented lattice bending of Co-CeO2 nanosheets for boosting auto-exhaust soot oxidation, J. Catal. 421 (2023) 351–364. [11] P. Zhang X. Mei X. Zhao J. Xiong Y. Li Z. Zhao Y. Wei Boosting catalytic purification of soot particles over double perovskite-type La2–xKxNiCoO6 catalysts with an ordered macroporous structure Environ. Sci. Technol. 55 2021 11245 11254 P. Zhang, X. Mei, X. Zhao, J. Xiong, Y. Li, Z. Zhao, Y. Wei, Boosting Catalytic Purification of Soot Particles over Double Perovskite-Type La2–xKxNiCoO6Catalysts with an Ordered Macroporous Structure, Environ. Sci. Technol. 55 (2021) 11245–11254. [12] H. Liang S. Wu Y. Hong S. Li Y. Chen X. Yu D. Ye Influence of alkali metals with different ionic radius doping into Ce0.7Zr0.3O2 on the active oxygen Catal. Lett. 144 2014 685 690 H. Liang, S. Wu, Y. Hong, S. Li, Y. Chen, X. Yu, D. Ye, Influence of Alkali Metals with Different Ionic Radius Doping into Ce0.7Zr0.3O2 on the Active Oxygen, Catal. Letters 144 (2014) 685–690. [13] R. Matarrese E. Aneggi L. Castoldi J. Llorca A. Trovarelli L. Lietti Simultaneous removal of soot and NO over K- and Ba-doped ruthenium supported catalysts Catal. Today 267 2016 119 129 R. Matarrese, E. Aneggi, L. Castoldi, J. Llorca, A. Trovarelli, L. Lietti, Simultaneous removal of soot and NO over K- and Ba-doped ruthenium supported catalysts, Catal. Today 267 (2016) 119–129. [14] P. Legutko P. Stelmachowski M. Trȩbala Z. Sojka A. Kotarba Role of electronic factor in soot oxidation process over tunnelled and layered potassium iron oxide catalysts Top. Catal. 56 2013 489 492 P. Legutko, P. Stelmachowski, M. Trȩbala, Z. Sojka, A. Kotarba, Role of Electronic Factor in Soot Oxidation Process Over Tunnelled and Layered Potassium Iron Oxide Catalysts, Top. Catal. 56 (2013) 489–492. [15] P. Legutko W. Kaspera P. Stelmachowski Z. Sojka A. Kotarba Boosting the catalytic activity of magnetite in soot oxidation by surface alkali promotion Catal. Commun. 56 2014 139 142 P. Legutko, W. Kaspera, P. Stelmachowski, Z. Sojka, A. Kotarba, Boosting the catalytic activity of magnetite in soot oxidation by surface alkali promotion, Catal. Commun. 56 (2014) 139–142. [16] P. Legutko T. Jakubek W. Kaspera P. Stelmachowski Z. Sojka A. Kotarba Soot oxidation over K-doped manganese and iron spinels — How potassium precursor nature and doping level change the catalyst activity Catal. Commun. 43 2014 34 37 P. Legutko, T. Jakubek, W. Kaspera, P. Stelmachowski, Z. Sojka, A. Kotarba, Soot oxidation over K-doped manganese and iron spinels — How potassium precursor nature and doping level change the catalyst activity, Catal. Commun. 43 (2014) 34–37. [17] E.E. Bickel C.T. Nimlos R. Gounder Developing quantitative synthesis-structure-function relations for framework aluminum arrangement effects in zeolite acid catalysis J. Catal. 399 2021 75 85 E.E. Bickel, C.T. Nimlos, R. Gounder, Developing quantitative synthesis-structure-function relations for framework aluminum arrangement effects in zeolite acid catalysis, J. Catal. 399 (2021) 75–85. [18] I. Borthakur A. Sau S. Kundu Cobalt-catalyzed dehydrogenative functionalization of alcohols: progress and future prospect Coord. Chem. Rev. 451 2022 214257 I. Borthakur, A. Sau, S. Kundu, Cobalt-catalyzed dehydrogenative functionalization of alcohols: Progress and future prospect, Coord. Chem. Rev. 451, 214257 (2022) 214257. [19] Y. Li L. Li J. Yu Applications of zeolites in sustainable chemistry Chem 3 2017 928 949 Y. Li, L. Li, J. Yu, Applications of Zeolites in Sustainable Chemistry, Chem 3 (2017) 928–949. [20] M. Moshoeshoe M. Silas Nadiye-Tabbiruka V. Obuseng Am. J. Mater. Sci. 2017 2017 196 221 M. Moshoeshoe, M. Silas Nadiye-Tabbiruka, V. Obuseng, Am. J. Mater. Sci. 2017 (2017) 196–221. [21] Q. Zhang J. Yu A. Corma Applications of Zeolites to C1 Chemistry: Recent Advances, Challenges and Opportunities Adv. Mater. 32 2020 2002927 Q. Zhang, J. Yu, A. Corma, 2D Perovskites: Unraveling the Crystallization Kinetics of 2D Perovskites with Sandwich‐Type Structure for High‐Performance Photovoltaics (Adv. Mater. 36/2020, Adv. Mater. 32 (2020) 1–31. [22] J. Van der Mynsbrugge A.T. Bell Challenges for the theoretical description of the mechanism and kinetics of reactions catalyzed by zeolites J. Catal. 404 2021 832 849 J. Van der Mynsbrugge, A.T. Bell, Challenges for the theoretical description of the mechanism and kinetics of reactions catalyzed by zeolites, J. Catal. 404 (2021) 832–849. [23] T.T. Le A. Chawla J.D. Rimer Impact of acid site speciation and spatial gradients on zeolite catalysis J. Catal. 391 2020 56 68 T.T. Le, A. Chawla, J.D. Rimer, Impact of acid site speciation and spatial gradients on zeolite catalysis, J. Catal. 391 (2020) 56–68. [24] C.H.F. Peden Cu/Chabazite catalysts for ‘Lean-Burn’ vehicle emission control J. Catal. 373 2019 384 389 C.H.F. Peden, Cu/Chabazite catalysts for ‘Lean-Burn’ vehicle emission control, J. Catal. 373 (2019) 384–389. [25] T.F. Degnan Jr. Applications of zeolites in petroleum refining Top. Catal. 13 2000 349 356 T.D. Jr, Top. Catal. 13 (2000) 349–356. [26] J. Xu X. Xiao S. Zeng M. Cai M.W. Verbrugge Synergistic combination of two antimicrobial agents closing each other's mutant selection windows to prevent antimicrobial resistance ACS Appl. Energy Mater. 1 2018 7237 7243 J. Xu, X. Xiao, S. Zeng, M. Cai, M.W. Verbrugge, Synergistic combination of two antimicrobial agents closing each other's mutant selection windows to prevent antimicrobial resistance, ACS Appl. Energy Mater. 1 (2018) 7237–7243. [27] G. Grzybek M. Greluk P. Patulski P. Stelmachowski K. Tarach G. Słowik M. Rotko S. Valencia F. Rey K. Góra-Marek Adjustment of the ZSM-5 zeolite support towards the efficient hydrogen production by ethanol steam reforming on cobalt catalysts Chem. Eng. J. 467 2023 143239 G. Grzybek, M. Greluk, P. Patulski, P. Stelmachowski, K. Tarach, G. Słowik, M. Rotko, S. Valencia, F. Rey, K. Góra-Marek, Adjustment of the ZSM-5 zeolite support towards the efficient hydrogen production by ethanol steam reforming on cobalt catalysts, Chem. Eng. J. (2023), 467, 143239 143239. [28] C. Cao H. Yang J. Xiao X. Yang B. Ren L. Xu G. Liu X. Li Catalytic diesel soot elimination over potassium promoted transition metal oxide (Co/Mn/Fe) nanosheets monolithic catalysts Fuel 305 2021 121446 C. Cao, H. Yang, J. Xiao, X. Yang, B. Ren, L. Xu, G. Liu, X. Li, Catalytic diesel soot elimination over potassium promoted transition metal oxide (Co/Mn/Fe) nanosheets monolithic catalysts, Fuel 305, 121446 (2021). [29] G. Grzybek K. Góra-Marek P. Patulski M. Greluk M. Rotko G. Słowik A. Kotarba Optimization of the potassium promotion of the Co|α-Al2O3 catalyst for the effective hydrogen production via ethanol steam reforming Appl. Catal. A Gen. 614 2021 118051 G. Grzybek, K. Góra-Marek, P. Patulski, M. Greluk, M. Rotko, G. Słowik, A. Kotarba, Optimization of the potassium promotion of the Co|α-Al2O3 catalyst for the effective hydrogen production via ethanol steam reforming, Appl. Catal. A Gen. 614, 118051 (2021) 118051. [30] G. Grzybek M. Greluk K. Tarach K. Pyra G. Słowik M. Rotko K. Góra-Marek Bioethanol steam reforming over cobalt-containing USY and ZSM-5 commercial zeolite catalysts Front. Mater. 7 2020 597528 G. Grzybek, M. Greluk, K. Tarach, K. Pyra, G. Słowik, M. Rotko, K. Góra-Marek, Bioethanol Steam Reforming over Cobalt-Containing USY and ZSM-5 Commercial Zeolite Catalysts, Front. Mater. 7 (2020) 597528. [31] G. Słowik M. Greluk A. Machocki Microscopic characterization of changes in the structure of KCo/CeO2 catalyst used in the steam reforming of ethanol Mater. Chem. Phys. 173 2016 219 237 G. Słowik, M. Greluk, A. Machocki, Microscopic characterization of changes in the structure of KCo/CeO2 catalyst used in the steam reforming of ethanol, Mater. Chem. Phys. 173 (2016) 219–237. [32] N. Fairley V. Fernandez M. Richard‐Plouet C. Guillot-Deudon J. Walton E. Smith D. Flahaut M. Greiner M. Biesinger S. Tougaard D. Morgan J. Baltrusaitis Systematic and collaborative approach to problem solving using X-ray photoelectron spectroscopy Appl. Surf. Sci. Adv. 5 2021 100112 N. Fairley, V. Fernandez, M. Richard‐Plouet, C. Guillot-Deudon, J. Walton, E. Smith, D. Flahaut, M. Greiner, M. Biesinger, S. Tougaard, D. Morgan, J. Baltrusaitis, Systematic and collaborative approach to problem solving using X-ray photoelectron spectroscopy, Appl. Surf. Sci. Adv. 5 (2021) 100112. [33] B. Ura J. Trawczyński A. Kotarba W. Bieniasz M.J. Illán-Gómez A. Bueno-López F.E. López-Suárez Effect of potassium addition on catalytic activity of SrTiO3 catalyst for diesel soot combustion Appl. Catal. B Environ. 101 2011 169 175 B. Ura, J. Trawczyński, A. Kotarba, W. Bieniasz, M.J. Illán-Gómez, A. Bueno-López, F.E. López-Suárez, Effect of potassium addition on catalytic activity of SrTiO3 catalyst for diesel soot combustion, Appl. Catal. B Environ. 101 (2011) 169–175. [34] G. Grzybek S. Wójcik P. Legutko J. Gryboś P. Indyka B. Leszczyński A. Kotarba Z. Sojka Thermal stability and repartition of potassium promoter between the support and active phase in the K-Co2.6Zn0.4O4|α-Al2O3 catalyst for N2O decomposition: crucial role of activation temperature on catalytic performance Appl. Catal. B Environ. 205 2017 597 604 G. Grzybek, S. Wójcik, P. Legutko, J. Gryboś, P. Indyka, B. Leszczyński, A. Kotarba, Z. Sojka, Thermal stability and repartition of potassium promoter between the support and active phase in the K-Co2.6Zn0.4O4|α-Al2O3 catalyst for N2O decomposition: Crucial role of activation temperature on catalytic performance, Appl. Catal. B Environ. 205 (2017) 597–604. [35] G. Grzybek M. Greluk P. Indyka K. Góra-Marek P. Legutko G. Słowik S. Turczyniak-Surdacka M. Rotko Z. Sojka A. Kotarba Cobalt catalyst for steam reforming of ethanol–Insights into the promotional role of potassium Int. J. Hydrog. Energy 5 45 2020 22658 22673 G. Grzybek, M. Greluk, P. Indyka, K. Góra-Marek, P. Legutko, G. Słowik, S. Turczyniak-Surdacka, M. Rotko, Z. Sojka, A. Kotarba, Cobalt catalyst for steam reforming of ethanol–Insights into the promotional role of potassium, Int. J. Hydrogen Energy 5 (2020), 45 22658–22673. [36] G. Grzybek K. Góra-Marek K. Tarach K. Pyra P. Patulski M. Greluk G. Słowik M. Rotko A. Kotarba Tuning the properties of the cobalt-zeolite nanocomposite catalyst by potassium: Switching between dehydration and dehydrogenation of ethanol J. Catal. 407 2022 364 380 G. Grzybek, K. Góra-Marek, K. Tarach, K. Pyra, P. Patulski, M. Greluk, G. Słowik, M. Rotko, A. Kotarba, Tuning the properties of the cobalt-zeolite nanocomposite catalyst by potassium: Switching between dehydration and dehydrogenation of ethanol, J. Catal. 407 (2022) 364–380. [37] G. Grzybek K. Ciura S. Wójcik J. Gryboś P. Indyka M. Inger K. Antoniak-Jurak P. Kowalik A. Kotarba Z. Sojka On the selection of the best polymorph of Al2O3 carriers for supported cobalt nano-spinel catalysts for N2O abatement: an interplay between preferable surface spreading and damaging active phase–support interaction Catal. Sci. Technol. 7 2017 5723 5732 G. Grzybek, K. Ciura, S. Wójcik, J. Gryboś, P. Indyka, M. Inger, K. Antoniak-Jurak, P. Kowalik, A. Kotarba, Z. Sojka, On the selection of the best polymorph of Al2O3carriers for supported cobalt nano-spinel catalysts for N2O abatement: an interplay between preferable surface spreading and damaging active phase–support interaction, Catal. Sci. Technol. 7 (2017) 5723–5732. [38] R. García L. Gómez-Hortigüela I. Díaz E. Sastre J. Pérez-Pariente Synthesis of materials containing ferrierite layers using quinuclidine and 1-benzyl-1-methylpyrrolidine as structure-directing agents. An experimental and computational study Chem. Mater. 20 2008 1099 1107 R. García, L. Gómez-Hortigüela, I. Díaz, E. Sastre, J. Pérez-Pariente, Synthesis of Materials Containing Ferrierite Layers Using Quinuclidine and 1-Benzyl-1-methylpyrrolidine as Structure-Directing Agents. An Experimental and Computational Study, Chem. Mater. 20 (2008) 1099–1107. [39] N. Kanno M. Miyake M. Sato Syntheses of ferrierite, ZSM-48, and ZSM-5 in glycerol solvent Zeolites 14 1994 625 628 N. Kanno, M. Miyake, M. Sato, Syntheses of ferrierite, ZSM-48, and ZSM-5 in glycerol solvent, Zeolites 14 (1994) 625–628. [40] S. Teketel L.F. Lundegaard W. Skistad S.M. Chavan U. Olsbye K.P. Lillerud P. Beato S. Svelle Morphology-induced shape selectivity in zeolite catalysis J. Catal. 327 2015 22 32 S. Teketel, L.F. Lundegaard, W. Skistad, S.M. Chavan, U. Olsbye, K.P. Lillerud, P. Beato, S. Svelle, Morphology-induced shape selectivity in zeolite catalysis, J. Catal. 327 (2015) 22–32. [41] H.S. Jung F. Zafar X. Wang T.X. Nguyen C.H. Hong Y.G. Hur J.W. Choung M.J. Park J.W. Bae Morphology effects of ferrierite on bifunctional Cu–ZnO–Al2O3/ferrierite for direct syngas conversion to dimethyl ether ACS Catal. 11 2021 14210 14223 H.S. Jung, F. Zafar, X. Wang, T.X. Nguyen, C.H. Hong, Y.G. Hur, J.W. Choung, M.J. Park, J.W. Bae, Morphology Effects of Ferrierite on Bifunctional Cu–ZnO–Al2O3/Ferrierite for Direct Syngas Conversion to Dimethyl Ether, ACS Catal. 11 (2021) 14210–14223. [42] K.I. Hadjiivanov Identification of neutral and charged NxOy surface species by IR spectroscopy Catal. Rev. - Sci. Eng. 42 2000 71 144 K.I. Hadjiivanov, Identification of Neutral and Charged NxOySurface Species by IR Spectroscopy, Catal. Rev. - Sci. Eng. 42 (2000) 71–144.",
      "scopus-id": "85174860515",
      "coredata": {
        "eid": "1-s2.0-S0926860X23004490",
        "dc:description": "Research efforts to develop an effective soot oxidation catalyst have intensified in recent years due to the increased awareness of the highly harmful effect of soot particles on the human health and the environment. Large-scale application of a developed catalyst calls for a cheap support material allowing for an effective dispersion and thus a decrease in the active phase loading. Zeolites, widely used in catalysis as active phase carriers, possess advantageous characteristics such as a uniform porous structure and large surface area. Furthermore, they are characterized by high availability, good price, and are environmentally friendly. Cobalt-based materials provide promising soot oxidation catalyst phases, and alkali doping can further enhance their activity. This study focuses on the optimization of the potassium loading in the potassium and cobalt double-doped ferrierites towards a new class of cheap and environmentally friendly soot combustion catalysts. The potassium doping of the ferrierite-supported cobalt spienel was optimized in the range of 0–14 wt%. The obtained materials were characterized in terms of their composition (XRF, XPS, XRD, Raman spectroscopy), morphology (SEM, TEM/EDX/FFT), and reducibility (H2-TPR), and tested in the process of soot oxidation in tight and loose contact modes. The strong promotional effect of potassium was discussed in terms of a significant modification of the catalyst electronic properties (work function studies) and supported by the potassium surface state studies by the alkali thermal desorption method (SR-TAD). It was found that the optimal potassium promoter dispersion leads to the lowest catalyst work function and its highest activity in soot combustion. The effect of nitric oxide was also investigated for selected catalysts. The opposite effect of NO on the activity of undoped and K-doped catalysts was discussed on the basis of in-depth spectroscopic studies. An enhanced formation of nitrate species was found on the surface of the K-containing catalyst which led to the stronger inhibiting effect of NO.",
        "openArchiveArticle": "false",
        "prism:coverDate": "2023-11-25",
        "openaccessUserLicense": "http://creativecommons.org/licenses/by/4.0/",
        "prism:aggregationType": "Journal",
        "prism:url": "https://api.elsevier.com/content/article/pii/S0926860X23004490",
        "dc:creator": [
          {
            "@_fa": "true",
            "$": "Grzybek, Gabriela"
          },
          {
            "@_fa": "true",
            "$": "Rudzińska, Magdalena"
          },
          {
            "@_fa": "true",
            "$": "Góra-Marek, Kinga"
          },
          {
            "@_fa": "true",
            "$": "Stelmachowski, Paweł"
          },
          {
            "@_fa": "true",
            "$": "Słowik, Grzegorz"
          },
          {
            "@_fa": "true",
            "$": "Kotarba, Andrzej"
          }
        ],
        "link": [
          {
            "@_fa": "true",
            "@rel": "self",
            "@href": "https://api.elsevier.com/content/article/pii/S0926860X23004490"
          },
          {
            "@_fa": "true",
            "@rel": "scidir",
            "@href": "https://www.sciencedirect.com/science/article/pii/S0926860X23004490"
          }
        ],
        "dc:format": "application/json",
        "openaccessType": "Full",
        "pii": "S0926-860X(23)00449-0",
        "prism:volume": "668",
        "articleNumber": "119469",
        "prism:publisher": "The Author(s). Published by Elsevier B.V.",
        "dc:title": "Potassium and cobalt double-doped ferrierites as a new class of soot oxidation catalysts",
        "prism:copyright": "© 2023 The Author(s). Published by Elsevier B.V.",
        "openaccess": "1",
        "prism:issn": "0926860X",
        "dcterms:subject": [
          {
            "@_fa": "true",
            "$": "Alkali promotion"
          },
          {
            "@_fa": "true",
            "$": "Cobalt catalyst"
          },
          {
            "@_fa": "true",
            "$": "Ferrierite"
          },
          {
            "@_fa": "true",
            "$": "Soot oxidation"
          },
          {
            "@_fa": "true",
            "$": "Electronic promotion"
          }
        ],
        "openaccessArticle": "true",
        "prism:publicationName": "Applied Catalysis A: General",
        "openaccessSponsorType": "Author",
        "prism:pageRange": "119469",
        "pubType": "fla",
        "prism:coverDisplayDate": "25 November 2023",
        "prism:doi": "10.1016/j.apcata.2023.119469",
        "prism:startingPage": "119469",
        "dc:identifier": "doi:10.1016/j.apcata.2023.119469",
        "openaccessSponsorName": null
      },
      "objects": {
        "object": [
          {
            "@category": "standard",
            "@height": "785",
            "@width": "807",
            "@_fa": "true",
            "$": "https://api.elsevier.com/content/object/eid/1-s2.0-S0926860X23004490-gr4.jpg?httpAccept=%2A%2F%2A",
            "@multimediatype": "JPEG image file",
            "@type": "IMAGE-DOWNSAMPLED",
            "@size": "134141",
            "@ref": "gr4",
            "@mimetype": "image/jpeg"
          },
          {
            "@category": "standard",
            "@height": "477",
            "@width": "715",
            "@_fa": "true",
            "$": "https://api.elsevier.com/content/object/eid/1-s2.0-S0926860X23004490-gr3.jpg?httpAccept=%2A%2F%2A",
            "@multimediatype": "JPEG image file",
            "@type": "IMAGE-DOWNSAMPLED",
            "@size": "118279",
            "@ref": "gr3",
            "@mimetype": "image/jpeg"
          },
          {
            "@category": "standard",
            "@height": "272",
            "@width": "602",
            "@_fa": "true",
            "$": "https://api.elsevier.com/content/object/eid/1-s2.0-S0926860X23004490-gr5.jpg?httpAccept=%2A%2F%2A",
            "@multimediatype": "JPEG image file",
            "@type": "IMAGE-DOWNSAMPLED",
            "@size": "32064",
            "@ref": "gr5",
            "@mimetype": "image/jpeg"
          },
          {
            "@category": "standard",
            "@height": "467",
            "@width": "602",
            "@_fa": "true",
            "$": "https://api.elsevier.com/content/object/eid/1-s2.0-S0926860X23004490-gr11.jpg?httpAccept=%2A%2F%2A",
            "@multimediatype": "JPEG image file",
            "@type": "IMAGE-DOWNSAMPLED",
            "@size": "53031",
            "@ref": "gr11",
            "@mimetype": "image/jpeg"
          },
          {
            "@category": "standard",
            "@height": "236",
            "@width": "678",
            "@_fa": "true",
            "$": "https://api.elsevier.com/content/object/eid/1-s2.0-S0926860X23004490-gr8.jpg?httpAccept=%2A%2F%2A",
            "@multimediatype": "JPEG image file",
            "@type": "IMAGE-DOWNSAMPLED",
            "@size": "31974",
            "@ref": "gr8",
            "@mimetype": "image/jpeg"
          },
          {
            "@category": "standard",
            "@height": "200",
            "@width": "487",
            "@_fa": "true",
            "$": "https://api.elsevier.com/content/object/eid/1-s2.0-S0926860X23004490-ga1.jpg?httpAccept=%2A%2F%2A",
            "@multimediatype": "JPEG image file",
            "@type": "IMAGE-DOWNSAMPLED",
            "@size": "26074",
            "@ref": "ga1",
            "@mimetype": "image/jpeg"
          },
          {
            "@category": "standard",
            "@height": "182",
            "@width": "263",
            "@_fa": "true",
            "$": "https://api.elsevier.com/content/object/eid/1-s2.0-S0926860X23004490-gr6.jpg?httpAccept=%2A%2F%2A",
            "@multimediatype": "JPEG image file",
            "@type": "IMAGE-DOWNSAMPLED",
            "@size": "10700",
            "@ref": "gr6",
            "@mimetype": "image/jpeg"
          },
          {
            "@category": "standard",
            "@height": "446",
            "@width": "188",
            "@_fa": "true",
            "$": "https://api.elsevier.com/content/object/eid/1-s2.0-S0926860X23004490-gr10.jpg?httpAccept=%2A%2F%2A",
            "@multimediatype": "JPEG image file",
            "@type": "IMAGE-DOWNSAMPLED",
            "@size": "22580",
            "@ref": "gr10",
            "@mimetype": "image/jpeg"
          },
          {
            "@category": "standard",
            "@height": "390",
            "@width": "678",
            "@_fa": "true",
            "$": "https://api.elsevier.com/content/object/eid/1-s2.0-S0926860X23004490-gr2.jpg?httpAccept=%2A%2F%2A",
            "@multimediatype": "JPEG image file",
            "@type": "IMAGE-DOWNSAMPLED",
            "@size": "88515",
            "@ref": "gr2",
            "@mimetype": "image/jpeg"
          },
          {
            "@category": "standard",
            "@height": "391",
            "@width": "602",
            "@_fa": "true",
            "$": "https://api.elsevier.com/content/object/eid/1-s2.0-S0926860X23004490-gr1.jpg?httpAccept=%2A%2F%2A",
            "@multimediatype": "JPEG image file",
            "@type": "IMAGE-DOWNSAMPLED",
            "@size": "48655",
            "@ref": "gr1",
            "@mimetype": "image/jpeg"
          },
          {
            "@category": "standard",
            "@height": "304",
            "@width": "226",
            "@_fa": "true",
            "$": "https://api.elsevier.com/content/object/eid/1-s2.0-S0926860X23004490-gr7.jpg?httpAccept=%2A%2F%2A",
            "@multimediatype": "JPEG image file",
            "@type": "IMAGE-DOWNSAMPLED",
            "@size": "12699",
            "@ref": "gr7",
            "@mimetype": "image/jpeg"
          },
          {
            "@category": "standard",
            "@height": "218",
            "@width": "263",
            "@_fa": "true",
            "$": "https://api.elsevier.com/content/object/eid/1-s2.0-S0926860X23004490-gr9.jpg?httpAccept=%2A%2F%2A",
            "@multimediatype": "JPEG image file",
            "@type": "IMAGE-DOWNSAMPLED",
            "@size": "16939",
            "@ref": "gr9",
            "@mimetype": "image/jpeg"
          },
          {
            "@category": "thumbnail",
            "@height": "163",
            "@width": "168",
            "@_fa": "true",
            "$": "https://api.elsevier.com/content/object/eid/1-s2.0-S0926860X23004490-gr4.sml?httpAccept=%2A%2F%2A",
            "@multimediatype": "GIF image file",
            "@type": "IMAGE-THUMBNAIL",
            "@size": "17688",
            "@ref": "gr4",
            "@mimetype": "image/gif"
          },
          {
            "@category": "thumbnail",
            "@height": "146",
            "@width": "219",
            "@_fa": "true",
            "$": "https://api.elsevier.com/content/object/eid/1-s2.0-S0926860X23004490-gr3.sml?httpAccept=%2A%2F%2A",
            "@multimediatype": "GIF image file",
            "@type": "IMAGE-THUMBNAIL",
            "@size": "20114",
            "@ref": "gr3",
            "@mimetype": "image/gif"
          },
          {
            "@category": "thumbnail",
            "@height": "99",
            "@width": "219",
            "@_fa": "true",
            "$": "https://api.elsevier.com/content/object/eid/1-s2.0-S0926860X23004490-gr5.sml?httpAccept=%2A%2F%2A",
            "@multimediatype": "GIF image file",
            "@type": "IMAGE-THUMBNAIL",
            "@size": "5635",
            "@ref": "gr5",
            "@mimetype": "image/gif"
          },
          {
            "@category": "thumbnail",
            "@height": "164",
            "@width": "211",
            "@_fa": "true",
            "$": "https://api.elsevier.com/content/object/eid/1-s2.0-S0926860X23004490-gr11.sml?httpAccept=%2A%2F%2A",
            "@multimediatype": "GIF image file",
            "@type": "IMAGE-THUMBNAIL",
            "@size": "10312",
            "@ref": "gr11",
            "@mimetype": "image/gif"
          },
          {
            "@category": "thumbnail",
            "@height": "76",
            "@width": "219",
            "@_fa": "true",
            "$": "https://api.elsevier.com/content/object/eid/1-s2.0-S0926860X23004490-gr8.sml?httpAccept=%2A%2F%2A",
            "@multimediatype": "GIF image file",
            "@type": "IMAGE-THUMBNAIL",
            "@size": "4295",
            "@ref": "gr8",
            "@mimetype": "image/gif"
          },
          {
            "@category": "thumbnail",
            "@height": "90",
            "@width": "219",
            "@_fa": "true",
            "$": "https://api.elsevier.com/content/object/eid/1-s2.0-S0926860X23004490-ga1.sml?httpAccept=%2A%2F%2A",
            "@multimediatype": "GIF image file",
            "@type": "IMAGE-THUMBNAIL",
            "@size": "6787",
            "@ref": "ga1",
            "@mimetype": "image/gif"
          },
          {
            "@category": "thumbnail",
            "@height": "152",
            "@width": "219",
            "@_fa": "true",
            "$": "https://api.elsevier.com/content/object/eid/1-s2.0-S0926860X23004490-gr6.sml?httpAccept=%2A%2F%2A",
            "@multimediatype": "GIF image file",
            "@type": "IMAGE-THUMBNAIL",
            "@size": "7198",
            "@ref": "gr6",
            "@mimetype": "image/gif"
          },
          {
            "@category": "thumbnail",
            "@height": "164",
            "@width": "69",
            "@_fa": "true",
            "$": "https://api.elsevier.com/content/object/eid/1-s2.0-S0926860X23004490-gr10.sml?httpAccept=%2A%2F%2A",
            "@multimediatype": "GIF image file",
            "@type": "IMAGE-THUMBNAIL",
            "@size": "4242",
            "@ref": "gr10",
            "@mimetype": "image/gif"
          },
          {
            "@category": "thumbnail",
            "@height": "126",
            "@width": "219",
            "@_fa": "true",
            "$": "https://api.elsevier.com/content/object/eid/1-s2.0-S0926860X23004490-gr2.sml?httpAccept=%2A%2F%2A",
            "@multimediatype": "GIF image file",
            "@type": "IMAGE-THUMBNAIL",
            "@size": "17627",
            "@ref": "gr2",
            "@mimetype": "image/gif"
          },
          {
            "@category": "thumbnail",
            "@height": "142",
            "@width": "219",
            "@_fa": "true",
            "$": "https://api.elsevier.com/content/object/eid/1-s2.0-S0926860X23004490-gr1.sml?httpAccept=%2A%2F%2A",
            "@multimediatype": "GIF image file",
            "@type": "IMAGE-THUMBNAIL",
            "@size": "9142",
            "@ref": "gr1",
            "@mimetype": "image/gif"
          },
          {
            "@category": "thumbnail",
            "@height": "164",
            "@width": "122",
            "@_fa": "true",
            "$": "https://api.elsevier.com/content/object/eid/1-s2.0-S0926860X23004490-gr7.sml?httpAccept=%2A%2F%2A",
            "@multimediatype": "GIF image file",
            "@type": "IMAGE-THUMBNAIL",
            "@size": "3914",
            "@ref": "gr7",
            "@mimetype": "image/gif"
          },
          {
            "@category": "thumbnail",
            "@height": "164",
            "@width": "197",
            "@_fa": "true",
            "$": "https://api.elsevier.com/content/object/eid/1-s2.0-S0926860X23004490-gr9.sml?httpAccept=%2A%2F%2A",
            "@multimediatype": "GIF image file",
            "@type": "IMAGE-THUMBNAIL",
            "@size": "8937",
            "@ref": "gr9",
            "@mimetype": "image/gif"
          },
          {
            "@category": "high",
            "@height": "3476",
            "@width": "3575",
            "@_fa": "true",
            "$": "https://api.elsevier.com/content/object/eid/1-s2.0-S0926860X23004490-gr4_lrg.jpg?httpAccept=%2A%2F%2A",
            "@multimediatype": "JPEG image file",
            "@type": "IMAGE-HIGH-RES",
            "@size": "683043",
            "@ref": "gr4",
            "@mimetype": "image/jpeg"
          },
          {
            "@category": "high",
            "@height": "2110",
            "@width": "3160",
            "@_fa": "true",
            "$": "https://api.elsevier.com/content/object/eid/1-s2.0-S0926860X23004490-gr3_lrg.jpg?httpAccept=%2A%2F%2A",
            "@multimediatype": "JPEG image file",
            "@type": "IMAGE-HIGH-RES",
            "@size": "911939",
            "@ref": "gr3",
            "@mimetype": "image/jpeg"
          },
          {
            "@category": "high",
            "@height": "1201",
            "@width": "2661",
            "@_fa": "true",
            "$": "https://api.elsevier.com/content/object/eid/1-s2.0-S0926860X23004490-gr5_lrg.jpg?httpAccept=%2A%2F%2A",
            "@multimediatype": "JPEG image file",
            "@type": "IMAGE-HIGH-RES",
            "@size": "149902",
            "@ref": "gr5",
            "@mimetype": "image/jpeg"
          },
          {
            "@category": "high",
            "@height": "2063",
            "@width": "2661",
            "@_fa": "true",
            "$": "https://api.elsevier.com/content/object/eid/1-s2.0-S0926860X23004490-gr11_lrg.jpg?httpAccept=%2A%2F%2A",
            "@multimediatype": "JPEG image file",
            "@type": "IMAGE-HIGH-RES",
            "@size": "257746",
            "@ref": "gr11",
            "@mimetype": "image/jpeg"
          },
          {
            "@category": "high",
            "@height": "1044",
            "@width": "2994",
            "@_fa": "true",
            "$": "https://api.elsevier.com/content/object/eid/1-s2.0-S0926860X23004490-gr8_lrg.jpg?httpAccept=%2A%2F%2A",
            "@multimediatype": "JPEG image file",
            "@type": "IMAGE-HIGH-RES",
            "@size": "146385",
            "@ref": "gr8",
            "@mimetype": "image/jpeg"
          },
          {
            "@category": "high",
            "@height": "886",
            "@width": "2157",
            "@_fa": "true",
            "$": "https://api.elsevier.com/content/object/eid/1-s2.0-S0926860X23004490-ga1_lrg.jpg?httpAccept=%2A%2F%2A",
            "@multimediatype": "JPEG image file",
            "@type": "IMAGE-HIGH-RES",
            "@size": "192877",
            "@ref": "ga1",
            "@mimetype": "image/jpeg"
          },
          {
            "@category": "high",
            "@height": "806",
            "@width": "1164",
            "@_fa": "true",
            "$": "https://api.elsevier.com/content/object/eid/1-s2.0-S0926860X23004490-gr6_lrg.jpg?httpAccept=%2A%2F%2A",
            "@multimediatype": "JPEG image file",
            "@type": "IMAGE-HIGH-RES",
            "@size": "54790",
            "@ref": "gr6",
            "@mimetype": "image/jpeg"
          },
          {
            "@category": "high",
            "@height": "1979",
            "@width": "835",
            "@_fa": "true",
            "$": "https://api.elsevier.com/content/object/eid/1-s2.0-S0926860X23004490-gr10_lrg.jpg?httpAccept=%2A%2F%2A",
            "@multimediatype": "JPEG image file",
            "@type": "IMAGE-HIGH-RES",
            "@size": "140263",
            "@ref": "gr10",
            "@mimetype": "image/jpeg"
          },
          {
            "@category": "high",
            "@height": "1721",
            "@width": "2994",
            "@_fa": "true",
            "$": "https://api.elsevier.com/content/object/eid/1-s2.0-S0926860X23004490-gr2_lrg.jpg?httpAccept=%2A%2F%2A",
            "@multimediatype": "JPEG image file",
            "@type": "IMAGE-HIGH-RES",
            "@size": "418957",
            "@ref": "gr2",
            "@mimetype": "image/jpeg"
          },
          {
            "@category": "high",
            "@height": "1730",
            "@width": "2661",
            "@_fa": "true",
            "$": "https://api.elsevier.com/content/object/eid/1-s2.0-S0926860X23004490-gr1_lrg.jpg?httpAccept=%2A%2F%2A",
            "@multimediatype": "JPEG image file",
            "@type": "IMAGE-HIGH-RES",
            "@size": "232059",
            "@ref": "gr1",
            "@mimetype": "image/jpeg"
          },
          {
            "@category": "high",
            "@height": "1341",
            "@width": "998",
            "@_fa": "true",
            "$": "https://api.elsevier.com/content/object/eid/1-s2.0-S0926860X23004490-gr7_lrg.jpg?httpAccept=%2A%2F%2A",
            "@multimediatype": "JPEG image file",
            "@type": "IMAGE-HIGH-RES",
            "@size": "58358",
            "@ref": "gr7",
            "@mimetype": "image/jpeg"
          },
          {
            "@category": "high",
            "@height": "967",
            "@width": "1164",
            "@_fa": "true",
            "$": "https://api.elsevier.com/content/object/eid/1-s2.0-S0926860X23004490-gr9_lrg.jpg?httpAccept=%2A%2F%2A",
            "@multimediatype": "JPEG image file",
            "@type": "IMAGE-HIGH-RES",
            "@size": "80998",
            "@ref": "gr9",
            "@mimetype": "image/jpeg"
          },
          {
            "@category": "standard",
            "@_fa": "true",
            "$": "https://api.elsevier.com/content/object/eid/1-s2.0-S0926860X23004490-mmc1.docx?httpAccept=%2A%2F%2A",
            "@multimediatype": "Microsoft Word file",
            "@type": "APPLICATION",
            "@size": "1460224",
            "@ref": "mmc1",
            "@mimetype": "application/word"
          },
          {
            "@category": "thumbnail",
            "@_fa": "true",
            "$": "https://api.elsevier.com/content/object/eid/1-s2.0-S0926860X23004490-si0001.svg?httpAccept=%2A%2F%2A",
            "@multimediatype": "Scalable Vector Graphics file",
            "@type": "ALTIMG",
            "@size": "1008",
            "@ref": "si0001",
            "@mimetype": "image/svg+xml"
          },
          {
            "@category": "thumbnail",
            "@_fa": "true",
            "$": "https://api.elsevier.com/content/object/eid/1-s2.0-S0926860X23004490-si0002.svg?httpAccept=%2A%2F%2A",
            "@multimediatype": "Scalable Vector Graphics file",
            "@type": "ALTIMG",
            "@size": "2216",
            "@ref": "si0002",
            "@mimetype": "image/svg+xml"
          },
          {
            "@category": "standard",
            "@_fa": "true",
            "$": "https://api.elsevier.com/content/object/eid/1-s2.0-S0926860X23004490-am.pdf?httpAccept=%2A%2F%2A",
            "@multimediatype": "Acrobat PDF file",
            "@type": "AAM-PDF",
            "@size": "1929665",
            "@ref": "am",
            "@mimetype": "application/pdf"
          }
        ]
      },
      "link": {
        "@rel": "abstract",
        "@href": "https://api.elsevier.com/content/abstract/scopus_id/85174860515"
      }
    }
  }
}