{
  "metadata": {
    "title": "Sandwich-type Co core@shell nanocomposite (SiO<ce:inf loc=post>2</ce:inf> @Co@CeO<ce:inf loc=post>2</ce:inf>): Coke resistant catalyst toward CO<ce:inf loc=post>2</ce:inf> reforming with ethanol",
    "authors": "; ; ",
    "journal": "Applied Catalysis A: General",
    "date": "2022-05-25",
    "doi": "10.1016/j.apcata.2022.118605",
    "abstract": "",
    "uri": "https://api.elsevier.com/content/article/pii/S0926860X22001284",
    "pii": "S0926860X22001284"
  },
  "fulltext": {
    "full-text-retrieval-response": {
      "scopus-eid": "2-s2.0-85128511351",
      "originalText": "serial JL 271346 291210 291744 291809 31 Applied Catalysis A: General APPLIEDCATALYSISAGENERAL 2022-04-07 2022-04-07 2022-04-20 2022-04-20 2022-05-07T16:53:59 1-s2.0-S0926860X22001284 S0926-860X(22)00128-4 S0926860X22001284 10.1016/j.apcata.2022.118605 S300 S300.1 FULL-TEXT 1-s2.0-S0926860X22X00094 2024-01-01T12:34:28.416125Z 0 0 20220525 2022 2022-04-07T15:23:26.061154Z absattachment articleinfo articlenumber articletitlenorm authfirstinitialnorm authfirstsurnamenorm cid cids contenttype copyright crossmark dateloaded dateloadedtxt datesearch datesort dateupdated dco docsubtype doctype doi eid ewtransactionid hubeid indexeddate issn issnnorm itemstage itemtransactionid itemweight openaccess openarchive pg pgfirst pii piinorm pubdatestart pubdatetxt pubyr sortorder srctitle srctitlenorm srctype ssids alllist content subj subheadings suppl tomb volfirst volissue volumelist webpdf webpdfpagecount yearnav figure table e-component body mmlmath acknowledge affil appendices articletitle auth authfirstini authfull authkeywords authlast grantnumber grantsponsor highlightsabst primabst ref specialabst 0926-860X 0926860X true 638 638 C Volume 638 5 118605 118605 118605 20220525 25 May 2022 2022-05-25 2022 article fla © 2022 Elsevier B.V. All rights reserved. SANDWICHTYPECOCORESHELLNANOCOMPOSITESIO2COCEO2COKERESISTANTCATALYSTTOWARDCO2REFORMINGETHANOL LI F 1 Introduction 2 Experimental 2.1 Catalyst preparation 2.1.1 Materials 2.1.2 Preparation of SiO2 nanosphere 2.1.3 Preparation of SiO2 @Co catalyst 2.1.4 Preparation of SiO2 @Co@CeO2 catalyst 2.1.5 Preparation of Co-SiO2 catalyst 2.1.6 Preparation of Co/CeO2-SiO2 catalyst 2.2 Catalyst characterization 2.3 Catalytic tests 3 Experimental and discussion 3.1 Morphology and structure analysis 3.2 Catalytic activity and stability for ethanol dry reforming 3.2.1 Activity comparison 3.2.2 Stability tests 3.3 Characterization of spent catalysts 4 Conclusion CRediT authorship contribution statement Acknowledgements Appendix A Supplementary material References LIU 2021 118444 Y LEE 2019 22551 22560 J WANG 2021 118120 Y BAC 2020 1029 1047 S EWBANK 2015 57 67 J ITOA 2021 113 118 S HORLYCK 2018 572 580 J PARK 2018 465 475 J DRIF 2015 576 584 A WANG 2018 199 206 Y PALMA 2018 356 364 V PALMA 2020 665 734 V PALMA 2017 1598 1608 V RUOCCO 2022 913 922 C RUOCCO 2019 12661 12670 C GIEHR 2018 751 757 A PARK 2018 465 475 J HAN 2020 13370 13379 B IPEK 2015 164 174 P SHENG 2019 24078 24087 K EWBANK 2014 885 896 J DAS 2020 2937 3004 S WANG 2018 26 35 F AN 2014 4907 4912 K CHAI 2017 5500 5504 R KIM 2015 184 191 D LIM 2016 153 159 Z BAKTASH 2015 122 127 E ZHANG 2018 3550 3560 F IPEK 2015 164 174 P WANG 2021 3324 3333 F DING 2018 560 564 K STRANDWITE 2009 4577 4582 N SOYKAL 2012 2335 2348 I FANG 2020 10328 10337 W ZHANG 2011 8152 8158 N WANG 2014 22216 22223 F MIRZAEI 2005 662 667 F CHO 2012 313 319 J TUTI 2008 196 203 S WANG 2016 19761 19768 C LIM 2015 61925 61932 Z LI 2019 61 70 X ZHANG 2018 18 26 X HE 2017 559 565 D ZHANG 2017 13418 13424 L ZOU 2015 98335 98343 W PUTLA 2015 16525 16535 S BOARO 2004 225 237 M RANGASWAMY 2015 1162 1169 A DENG 2016 1033 1049 C KAMBOLIS 2010 16 26 A MONTOYA 2000 71 85 J KATHIRASE 2015 62 78 Y LYU 2020 11235 11252 Y LI 2003 6292 6299 W AYODELE 2016 198 207 B WANG 2020 35022 35034 F LIX2022X118605 LIX2022X118605XF 2024-04-20T00:00:00.000Z 2024-04-20T00:00:00.000Z http://creativecommons.org/licenses/by-nc-nd/4.0/ © 2022 Elsevier B.V. All rights reserved. 0 https://doi.org/10.15223/policy-017 https://doi.org/10.15223/policy-037 https://doi.org/10.15223/policy-012 https://doi.org/10.15223/policy-029 https://doi.org/10.15223/policy-004 item S0926-860X(22)00128-4 S0926860X22001284 1-s2.0-S0926860X22001284 10.1016/j.apcata.2022.118605 271346 2024-01-01T12:34:28.416125Z 2022-05-25 1-s2.0-S0926860X22001284-main.pdf https://s3-eu-west-1.amazonaws.com/prod-ucs-content-store-eu-west/content/pii:S0926860X22001284/MAIN/application/pdf/f1661e79e3a6d6e783d68026bc7dd225/main.pdf main.pdf pdf true 12589288 MAIN 11 1-s2.0-S0926860X22001284-main_1.png https://s3-eu-west-1.amazonaws.com/prod-ucs-content-store-eu-west/content/pii:S0926860X22001284/PREVIEW/image/png/eb8228f81f5cffa949f2b5a0d368140b/main_1.png main_1.png png 58453 849 656 IMAGE-WEB-PDF 1 1-s2.0-S0926860X22001284-gr7.jpg https://s3-eu-west-1.amazonaws.com/prod-ucs-content-store-eu-west/content/pii:S0926860X22001284/gr7/DOWNSAMPLED/image/jpeg/5b35722cf5857e5e5ba225de12745d10/gr7.jpg gr7 gr7.jpg jpg 44847 287 751 IMAGE-DOWNSAMPLED 1-s2.0-S0926860X22001284-gr6.jpg https://s3-eu-west-1.amazonaws.com/prod-ucs-content-store-eu-west/content/pii:S0926860X22001284/gr6/DOWNSAMPLED/image/jpeg/391549b0641e5cd066de0287ee6c863b/gr6.jpg gr6 gr6.jpg jpg 87769 541 751 IMAGE-DOWNSAMPLED 1-s2.0-S0926860X22001284-gr9.jpg https://s3-eu-west-1.amazonaws.com/prod-ucs-content-store-eu-west/content/pii:S0926860X22001284/gr9/DOWNSAMPLED/image/jpeg/915f4b670f12c62bec7086b17271daa2/gr9.jpg gr9 gr9.jpg jpg 117130 582 751 IMAGE-DOWNSAMPLED 1-s2.0-S0926860X22001284-gr8.jpg https://s3-eu-west-1.amazonaws.com/prod-ucs-content-store-eu-west/content/pii:S0926860X22001284/gr8/DOWNSAMPLED/image/jpeg/c20c2bea4df0ebe1bdedc6e0b217a270/gr8.jpg gr8 gr8.jpg jpg 69822 580 751 IMAGE-DOWNSAMPLED 1-s2.0-S0926860X22001284-gr3.jpg https://s3-eu-west-1.amazonaws.com/prod-ucs-content-store-eu-west/content/pii:S0926860X22001284/gr3/DOWNSAMPLED/image/jpeg/cc2ab007cb2644b0e7b764befee0ef21/gr3.jpg gr3 gr3.jpg jpg 21390 327 376 IMAGE-DOWNSAMPLED 1-s2.0-S0926860X22001284-gr2.jpg https://s3-eu-west-1.amazonaws.com/prod-ucs-content-store-eu-west/content/pii:S0926860X22001284/gr2/DOWNSAMPLED/image/jpeg/e167afc5984a42b4afe2ad21aa2cf802/gr2.jpg gr2 gr2.jpg jpg 155823 598 751 IMAGE-DOWNSAMPLED 1-s2.0-S0926860X22001284-gr5.jpg https://s3-eu-west-1.amazonaws.com/prod-ucs-content-store-eu-west/content/pii:S0926860X22001284/gr5/DOWNSAMPLED/image/jpeg/0b23a1c10101e5aa24e58a635de1c8d0/gr5.jpg gr5 gr5.jpg jpg 23643 279 376 IMAGE-DOWNSAMPLED 1-s2.0-S0926860X22001284-gr4.jpg https://s3-eu-west-1.amazonaws.com/prod-ucs-content-store-eu-west/content/pii:S0926860X22001284/gr4/DOWNSAMPLED/image/jpeg/944c173c4db2ddfe43070092e94ce86e/gr4.jpg gr4 gr4.jpg jpg 24452 282 376 IMAGE-DOWNSAMPLED 1-s2.0-S0926860X22001284-gr10.jpg https://s3-eu-west-1.amazonaws.com/prod-ucs-content-store-eu-west/content/pii:S0926860X22001284/gr10/DOWNSAMPLED/image/jpeg/25f809f46d10fe8ea61dde1e11a21905/gr10.jpg gr10 gr10.jpg jpg 29115 316 376 IMAGE-DOWNSAMPLED 1-s2.0-S0926860X22001284-gr11.jpg https://s3-eu-west-1.amazonaws.com/prod-ucs-content-store-eu-west/content/pii:S0926860X22001284/gr11/DOWNSAMPLED/image/jpeg/67e25ad3a0a34c78f5bff164aeeed45a/gr11.jpg gr11 gr11.jpg jpg 28165 253 376 IMAGE-DOWNSAMPLED 1-s2.0-S0926860X22001284-ga1.jpg https://s3-eu-west-1.amazonaws.com/prod-ucs-content-store-eu-west/content/pii:S0926860X22001284/ga1/DOWNSAMPLED/image/jpeg/5ceec684a41f51c0d1c454a252cc7d93/ga1.jpg ga1 true ga1.jpg jpg 19481 223 301 IMAGE-DOWNSAMPLED 1-s2.0-S0926860X22001284-gr1.jpg https://s3-eu-west-1.amazonaws.com/prod-ucs-content-store-eu-west/content/pii:S0926860X22001284/gr1/DOWNSAMPLED/image/jpeg/ba3f2e3586d9cad5e684079a7919f025/gr1.jpg gr1 gr1.jpg jpg 128458 577 754 IMAGE-DOWNSAMPLED 1-s2.0-S0926860X22001284-sc2.jpg https://s3-eu-west-1.amazonaws.com/prod-ucs-content-store-eu-west/content/pii:S0926860X22001284/sc2/DOWNSAMPLED/image/jpeg/6ee44359a6dd0784f883621bfe205e54/sc2.jpg sc2 sc2.jpg jpg 27921 279 376 IMAGE-DOWNSAMPLED 1-s2.0-S0926860X22001284-sc1.jpg https://s3-eu-west-1.amazonaws.com/prod-ucs-content-store-eu-west/content/pii:S0926860X22001284/sc1/DOWNSAMPLED/image/jpeg/02bedc06750cba680cec161e851bc3ba/sc1.jpg sc1 sc1.jpg jpg 57620 588 508 IMAGE-DOWNSAMPLED 1-s2.0-S0926860X22001284-gr7.sml https://s3-eu-west-1.amazonaws.com/prod-ucs-content-store-eu-west/content/pii:S0926860X22001284/gr7/THUMBNAIL/image/gif/18e55ff3c1553ebe217482ee3dea471c/gr7.sml gr7 gr7.sml sml 7259 84 219 IMAGE-THUMBNAIL 1-s2.0-S0926860X22001284-gr6.sml https://s3-eu-west-1.amazonaws.com/prod-ucs-content-store-eu-west/content/pii:S0926860X22001284/gr6/THUMBNAIL/image/gif/ffdf5ef6ea32d8ee533d84196334e08c/gr6.sml gr6 gr6.sml sml 12820 158 219 IMAGE-THUMBNAIL 1-s2.0-S0926860X22001284-gr9.sml https://s3-eu-west-1.amazonaws.com/prod-ucs-content-store-eu-west/content/pii:S0926860X22001284/gr9/THUMBNAIL/image/gif/2b45dea5dc7525b88593fa632109f7f1/gr9.sml gr9 gr9.sml sml 24490 164 211 IMAGE-THUMBNAIL 1-s2.0-S0926860X22001284-gr8.sml https://s3-eu-west-1.amazonaws.com/prod-ucs-content-store-eu-west/content/pii:S0926860X22001284/gr8/THUMBNAIL/image/gif/945498df17b7651c7d7921e50fca7b2d/gr8.sml gr8 gr8.sml sml 8348 164 212 IMAGE-THUMBNAIL 1-s2.0-S0926860X22001284-gr3.sml https://s3-eu-west-1.amazonaws.com/prod-ucs-content-store-eu-west/content/pii:S0926860X22001284/gr3/THUMBNAIL/image/gif/45230a7c6d84d375e3b4c29965064bc2/gr3.sml gr3 gr3.sml sml 7071 164 189 IMAGE-THUMBNAIL 1-s2.0-S0926860X22001284-gr2.sml https://s3-eu-west-1.amazonaws.com/prod-ucs-content-store-eu-west/content/pii:S0926860X22001284/gr2/THUMBNAIL/image/gif/dbf2f73aea548f9e7000a96930808b9b/gr2.sml gr2 gr2.sml sml 25929 164 206 IMAGE-THUMBNAIL 1-s2.0-S0926860X22001284-gr5.sml https://s3-eu-west-1.amazonaws.com/prod-ucs-content-store-eu-west/content/pii:S0926860X22001284/gr5/THUMBNAIL/image/gif/e94fba50932f9c02cf56d9ccd6179d72/gr5.sml gr5 gr5.sml sml 9543 163 219 IMAGE-THUMBNAIL 1-s2.0-S0926860X22001284-gr4.sml https://s3-eu-west-1.amazonaws.com/prod-ucs-content-store-eu-west/content/pii:S0926860X22001284/gr4/THUMBNAIL/image/gif/a0bcd326395bc2eeccdb3052bc2ad063/gr4.sml gr4 gr4.sml sml 8794 164 218 IMAGE-THUMBNAIL 1-s2.0-S0926860X22001284-gr10.sml https://s3-eu-west-1.amazonaws.com/prod-ucs-content-store-eu-west/content/pii:S0926860X22001284/gr10/THUMBNAIL/image/gif/0ec6af8ede41a85b3bd4029279d46395/gr10.sml gr10 gr10.sml sml 10465 164 195 IMAGE-THUMBNAIL 1-s2.0-S0926860X22001284-gr11.sml https://s3-eu-west-1.amazonaws.com/prod-ucs-content-store-eu-west/content/pii:S0926860X22001284/gr11/THUMBNAIL/image/gif/5eb516b185b8fc3b8f8376206e99a124/gr11.sml gr11 gr11.sml sml 20369 147 219 IMAGE-THUMBNAIL 1-s2.0-S0926860X22001284-ga1.sml https://s3-eu-west-1.amazonaws.com/prod-ucs-content-store-eu-west/content/pii:S0926860X22001284/ga1/THUMBNAIL/image/gif/4a0b7eb350cbbe0ba8e44b3f32f8c14a/ga1.sml ga1 true ga1.sml sml 26482 162 219 IMAGE-THUMBNAIL 1-s2.0-S0926860X22001284-gr1.sml https://s3-eu-west-1.amazonaws.com/prod-ucs-content-store-eu-west/content/pii:S0926860X22001284/gr1/THUMBNAIL/image/gif/df16014b105f22d6e9e035ba550c0865/gr1.sml gr1 gr1.sml sml 23720 164 214 IMAGE-THUMBNAIL 1-s2.0-S0926860X22001284-sc2.sml https://s3-eu-west-1.amazonaws.com/prod-ucs-content-store-eu-west/content/pii:S0926860X22001284/sc2/THUMBNAIL/image/gif/075cb38556713bb39a5c6c948313f4a0/sc2.sml sc2 sc2.sml sml 19806 163 219 IMAGE-THUMBNAIL 1-s2.0-S0926860X22001284-sc1.sml https://s3-eu-west-1.amazonaws.com/prod-ucs-content-store-eu-west/content/pii:S0926860X22001284/sc1/THUMBNAIL/image/gif/47c26ba98f78cd8185b2b863b06bff09/sc1.sml sc1 sc1.sml sml 13022 163 141 IMAGE-THUMBNAIL 1-s2.0-S0926860X22001284-gr7_lrg.jpg https://s3-eu-west-1.amazonaws.com/prod-ucs-content-store-eu-west/content/pii:S0926860X22001284/gr7/HIGHRES/image/jpeg/0915df8b3db7cb7e10541f3921054f0f/gr7_lrg.jpg gr7 gr7_lrg.jpg jpg 211384 1270 3326 IMAGE-HIGH-RES 1-s2.0-S0926860X22001284-gr6_lrg.jpg https://s3-eu-west-1.amazonaws.com/prod-ucs-content-store-eu-west/content/pii:S0926860X22001284/gr6/HIGHRES/image/jpeg/dec5bb8c8f4f782db38d26386738eef0/gr6_lrg.jpg gr6 gr6_lrg.jpg jpg 437397 2398 3326 IMAGE-HIGH-RES 1-s2.0-S0926860X22001284-gr9_lrg.jpg https://s3-eu-west-1.amazonaws.com/prod-ucs-content-store-eu-west/content/pii:S0926860X22001284/gr9/HIGHRES/image/jpeg/c72b5bab6fe792462ccb10bb67cb7d0d/gr9_lrg.jpg gr9 gr9_lrg.jpg jpg 570646 2579 3326 IMAGE-HIGH-RES 1-s2.0-S0926860X22001284-gr8_lrg.jpg https://s3-eu-west-1.amazonaws.com/prod-ucs-content-store-eu-west/content/pii:S0926860X22001284/gr8/HIGHRES/image/jpeg/9ee7439760f8a7040412651a0f61d2df/gr8_lrg.jpg gr8 gr8_lrg.jpg jpg 360531 2570 3326 IMAGE-HIGH-RES 1-s2.0-S0926860X22001284-gr3_lrg.jpg https://s3-eu-west-1.amazonaws.com/prod-ucs-content-store-eu-west/content/pii:S0926860X22001284/gr3/HIGHRES/image/jpeg/c771157e1c7e1ae2c1bfbf39f9a004d6/gr3_lrg.jpg gr3 gr3_lrg.jpg jpg 100072 1445 1663 IMAGE-HIGH-RES 1-s2.0-S0926860X22001284-gr2_lrg.jpg https://s3-eu-west-1.amazonaws.com/prod-ucs-content-store-eu-west/content/pii:S0926860X22001284/gr2/HIGHRES/image/jpeg/b2af3a93f457e25d30747af5bf6b407d/gr2_lrg.jpg gr2 gr2_lrg.jpg jpg 875111 2650 3326 IMAGE-HIGH-RES 1-s2.0-S0926860X22001284-gr5_lrg.jpg https://s3-eu-west-1.amazonaws.com/prod-ucs-content-store-eu-west/content/pii:S0926860X22001284/gr5/HIGHRES/image/jpeg/5701a472009a688be37a4d876826b369/gr5_lrg.jpg gr5 gr5_lrg.jpg jpg 114462 1235 1663 IMAGE-HIGH-RES 1-s2.0-S0926860X22001284-gr4_lrg.jpg https://s3-eu-west-1.amazonaws.com/prod-ucs-content-store-eu-west/content/pii:S0926860X22001284/gr4/HIGHRES/image/jpeg/02fbfee3d8d5a75423de2a41d0516501/gr4_lrg.jpg gr4 gr4_lrg.jpg jpg 125468 1249 1663 IMAGE-HIGH-RES 1-s2.0-S0926860X22001284-gr10_lrg.jpg https://s3-eu-west-1.amazonaws.com/prod-ucs-content-store-eu-west/content/pii:S0926860X22001284/gr10/HIGHRES/image/jpeg/9b9fa4c465d84827d9c088ae3e7a533c/gr10_lrg.jpg gr10 gr10_lrg.jpg jpg 144081 1399 1663 IMAGE-HIGH-RES 1-s2.0-S0926860X22001284-gr11_lrg.jpg https://s3-eu-west-1.amazonaws.com/prod-ucs-content-store-eu-west/content/pii:S0926860X22001284/gr11/HIGHRES/image/jpeg/1b09d1224055da631c63dd6cdd9d3d99/gr11_lrg.jpg gr11 gr11_lrg.jpg jpg 125124 1120 1663 IMAGE-HIGH-RES 1-s2.0-S0926860X22001284-ga1_lrg.jpg https://s3-eu-west-1.amazonaws.com/prod-ucs-content-store-eu-west/content/pii:S0926860X22001284/ga1/HIGHRES/image/jpeg/9a2600aeb0d45cb3d72565c028137cf3/ga1_lrg.jpg ga1 true ga1_lrg.jpg jpg 168168 988 1333 IMAGE-HIGH-RES 1-s2.0-S0926860X22001284-gr1_lrg.jpg https://s3-eu-west-1.amazonaws.com/prod-ucs-content-store-eu-west/content/pii:S0926860X22001284/gr1/HIGHRES/image/jpeg/6e2eb1f3e2fac749ebb0de316b2af1f5/gr1_lrg.jpg gr1 gr1_lrg.jpg jpg 662458 2550 3334 IMAGE-HIGH-RES 1-s2.0-S0926860X22001284-sc2_lrg.jpg https://s3-eu-west-1.amazonaws.com/prod-ucs-content-store-eu-west/content/pii:S0926860X22001284/sc2/HIGHRES/image/jpeg/8c6148e17e125b4b6eecb3f5a7ccf947/sc2_lrg.jpg sc2 sc2_lrg.jpg jpg 121613 1234 1663 IMAGE-HIGH-RES 1-s2.0-S0926860X22001284-sc1_lrg.jpg https://s3-eu-west-1.amazonaws.com/prod-ucs-content-store-eu-west/content/pii:S0926860X22001284/sc1/HIGHRES/image/jpeg/59710610eced28965e0d89864511c1d5/sc1_lrg.jpg sc1 sc1_lrg.jpg jpg 253844 2598 2245 IMAGE-HIGH-RES 1-s2.0-S0926860X22001284-mmc1.docx https://s3-eu-west-1.amazonaws.com/prod-ucs-content-store-eu-west/content/pii:S0926860X22001284/mmc1/MAIN/application/vnd.openxmlformats-officedocument.wordprocessingml.document/2c5e760a214521100119bcaf4e9596f4/mmc1.docx mmc1 mmc1.docx docx 5498851 APPLICATION 1-s2.0-S0926860X22001284-si0003.svg https://s3-eu-west-1.amazonaws.com/prod-ucs-content-store-eu-west/content/pii:S0926860X22001284/STRIPIN/image/svg+xml/96d3d274bad79e567b84514d7ab50491/si0003.svg si0003 si0003.svg svg 4275 ALTIMG 1-s2.0-S0926860X22001284-si0004.svg https://s3-eu-west-1.amazonaws.com/prod-ucs-content-store-eu-west/content/pii:S0926860X22001284/STRIPIN/image/svg+xml/97919198e15662cff1f4238dc29ad6df/si0004.svg si0004 si0004.svg svg 1681 ALTIMG 1-s2.0-S0926860X22001284-si0005.svg https://s3-eu-west-1.amazonaws.com/prod-ucs-content-store-eu-west/content/pii:S0926860X22001284/STRIPIN/image/svg+xml/13a11138487937fc82a72463a72d4d27/si0005.svg si0005 si0005.svg svg 1754 ALTIMG 1-s2.0-S0926860X22001284-si0006.svg https://s3-eu-west-1.amazonaws.com/prod-ucs-content-store-eu-west/content/pii:S0926860X22001284/STRIPIN/image/svg+xml/47236f7a5aea815fcfa0874e60bfccaf/si0006.svg si0006 si0006.svg svg 3197 ALTIMG 1-s2.0-S0926860X22001284-si0007.svg https://s3-eu-west-1.amazonaws.com/prod-ucs-content-store-eu-west/content/pii:S0926860X22001284/STRIPIN/image/svg+xml/9f67e33aebe86162b18b65012bc17d32/si0007.svg si0007 si0007.svg svg 1211 ALTIMG 1-s2.0-S0926860X22001284-si0008.svg https://s3-eu-west-1.amazonaws.com/prod-ucs-content-store-eu-west/content/pii:S0926860X22001284/STRIPIN/image/svg+xml/705e8eacf6c841d97050d7b3d9a486a8/si0008.svg si0008 si0008.svg svg 968 ALTIMG 1-s2.0-S0926860X22001284-si0009.svg https://s3-eu-west-1.amazonaws.com/prod-ucs-content-store-eu-west/content/pii:S0926860X22001284/STRIPIN/image/svg+xml/a491083500b57441422dd333d2641ffc/si0009.svg si0009 si0009.svg svg 1580 ALTIMG 1-s2.0-S0926860X22001284-si0010.svg https://s3-eu-west-1.amazonaws.com/prod-ucs-content-store-eu-west/content/pii:S0926860X22001284/STRIPIN/image/svg+xml/b448e190aed4664b1fe01937178f8b55/si0010.svg si0010 si0010.svg svg 931 ALTIMG 1-s2.0-S0926860X22001284-si0011.svg https://s3-eu-west-1.amazonaws.com/prod-ucs-content-store-eu-west/content/pii:S0926860X22001284/STRIPIN/image/svg+xml/eec4a2139bce7f9272813597241a6344/si0011.svg si0011 si0011.svg svg 1264 ALTIMG 1-s2.0-S0926860X22001284-si0001.svg https://s3-eu-west-1.amazonaws.com/prod-ucs-content-store-eu-west/content/pii:S0926860X22001284/STRIPIN/image/svg+xml/e6f565d4f21b597ff0d95c91082bbd8c/si0001.svg si0001 si0001.svg svg 976 ALTIMG 1-s2.0-S0926860X22001284-si0012.svg https://s3-eu-west-1.amazonaws.com/prod-ucs-content-store-eu-west/content/pii:S0926860X22001284/STRIPIN/image/svg+xml/b27843ca723bc309c119f7147bc6e765/si0012.svg si0012 si0012.svg svg 1333 ALTIMG 1-s2.0-S0926860X22001284-si0013.svg https://s3-eu-west-1.amazonaws.com/prod-ucs-content-store-eu-west/content/pii:S0926860X22001284/STRIPIN/image/svg+xml/66ffdbb990f5604de82a4c80e65e445c/si0013.svg si0013 si0013.svg svg 1600 ALTIMG 1-s2.0-S0926860X22001284-si0002.svg https://s3-eu-west-1.amazonaws.com/prod-ucs-content-store-eu-west/content/pii:S0926860X22001284/STRIPIN/image/svg+xml/8963fd98e66f5ff4c68a15a0833bf4d7/si0002.svg si0002 si0002.svg svg 1012 ALTIMG 1-s2.0-S0926860X22001284-am.pdf am am.pdf pdf 1114447 AAM-PDF https://s3-eu-west-1.amazonaws.com/prod-ucs-content-store-eu-west/content/egi:10BDZT4H0FM/MAIN/application/pdf/0067c50c8c2bd89a286545f11c9c91ac/am.pdf APCATA 118605 118605 S0926-860X(22)00128-4 10.1016/j.apcata.2022.118605 Elsevier B.V. Fig. 1 TEM images of (a) SiO2 nano-sphere; (b,c) SiO2 @Co; (d,e) SiO2 @Co@CeO2; (f,g) High resolution image of SiO2 @Co@CeO2; (h) Reduced SiO2 @Co@CeO2; (i) Co-SiO2. Fig. 1 Fig. 2 (a,b) SEM images of SiO2 @Co@CeO2 catalysts and (c-i) SEM-EDX of SiO2 @Co@CeO2. Fig. 2 Fig. 3 H2-TPR profiles of SiO2 @Co and SiO2 @Co@CeO2 catalysts. Fig. 3 Fig. 4 XRD patterns of the calcined Co-SiO2, SiO2 @Co and SiO2 @Co@CeO2 catalysts. Fig. 4 Fig. 5 N2 adsorption-desorption profiles and pore distribution plots of the SiO2 @Co and SiO2 @Co@CeO2 catalysts. Fig. 5 Fig. 6 XPS spectra of SiO2 @Co@CeO2 and SiO2 @Co catalysts: full survey spectrum (a); high resolution spectra of Ce 3d (b); Co 2p (c); O 1 s (d). Fig. 6 Fig. 7 (a) Comparison of the catalytic capability for the investigated catalysts (Reaction conditions: 550 °C, C2H6O/CO2/N2 =1/1/1.5 molar ratio, GHSV=27,700 mL gcat−1h−1); (b) Impact of reaction temperature on the product distributions over SiO2 @Co@CeO2 catalyst (Reaction conditions: C2H6O/CO2/ N2 =1/1/1.5 molar ratio, GHSV = 27,700 mL gcat−1h−1). Fig. 7 Fig. 8 Stability tests of the investigated catalysts in terms of (a) Ethanol and CO2 conversion and (b,c) product selectivity (Reaction conditions: 650 °C, C2H6O/CO2/N2 =1/1/1.5 molar ratio, GHSV = 27,700 mL gcat−1h−1). Fig. 8 Fig. 9 TEM images of the used catalysts. (a-c) SiO2 @Co after 50 h; (d-f) SiO2 @Co@CeO2 after 50 h reaction; (g-i) Co-SiO2 after 23 h. Fig. 9 Fig. 10 Raman spectra of the used catalysts. Fig. 10 Fig. 11 The proposed mechanism of coke formation. Fig. 11 Scheme 1 Scheme of the preparation for SiO2 @Co and SiO2 @Co@CeO2 catalysts. Scheme 1 Scheme 2 Reaction mechanism of ethanol dry reforming with CO2. Scheme 2 Table 1 Textural properties of catalysts. Table 1 Catalyst Surface area a (m2g−1) Pore Volume a (cm3g−1) Pore Size a (nm) Ce Loading b (wt%) Co Loading b (wt%) Co Crystal Size c (nm) Fresh dCo Reduce dCo Spent dCo SiO2 @Co 57.30 0.321 14.37 – 26.0 7.90 5.12 8.67 SiO2 @Co@CeO2 31.78 0.135 15.12 14.47 17.1 5.92 4.13 6.78 Co-SiO2 10.97 0.096 41.24 – 26.7 26.68 – 17.32 a BET surface measured by N2 adsorption-desorption. b Ce and Co content measured from ICP analysis. c Calculated from XRD patterns (Debye-Scherrer equation). Sandwich-type Co core@shell nanocomposite (SiO2 @Co@CeO2): Coke resistant catalyst toward CO2 reforming with ethanol Feifei Li a Mingyue Wang a Jinming Zhang a Xingtao Lin b ⁎ Dazhi Wang a ⁎ Weijie Cai Supervision a ⁎ a Faculty of Light Industry and Chemical Engineering, Dalian Polytechnic University, 116023 Dalian, China Faculty of Light Industry and Chemical Engineering, Dalian Polytechnic University Dalian 116023 China Faculty of Light Industry and Chemical Engineering, Dalian Polytechnic University, 116023 Dalian, China b Faculty of Environment and Life, Beijing University of Technology, 100124 Beijing, China Faculty of Environment and Life, Beijing University of Technology Beijing 100124 China Faculty of Environment and Life, Beijing University of Technology, 100124, Beijing, China ⁎ Corresponding authors. The design of highly efficient catalysts for CO2 reforming with ethanol is of great interest due to the serious coke deposition and the sintering of active metal. In this work, sandwich-type Co core@shell catalyst (SiO2 @Co@CeO2) with Co nanoparticles between SiO2 core and CeO2 shell was synthesized by strong electrostatic adsorption method. Interestingly, SiO2 @Co@CeO2 catalyst exhibited the outstanding activity/stability toward CO2 reforming of ethanol in comparison with Co-SiO2 catalyst. A bi-functional mechanism involving active sites on CeO2 shell was proposed. Indeed, cobalt nanoparticles between SiO2 core and CeO2 shell maintained the high dispersion because of the confinement effect, which supplied a stable Co-ceria interface area where the reaction occurred. In addition, CO2 could readily react with the O vacancies in CeO2 shell to form surface oxygen species and CO, which allowed a continuous cleaning of coke. These positive factors could make it as an attractive candidate for dry reforming process. Graphical Abstract ga1 Keywords SiO2 @Co@CeO2 Ethanol dry reforming Confinement effect Syngas Coke resistant 1 Introduction In the past decade, global warming mainly caused by the enormous discharge of the greenhouse gas CO2 has been one of the major concerns to maintain sustainable development [1]. To be addressed this issue, great efforts have focused on the physical capture and chemical utilization of CO2 to diminish its detrimental impact [2,3]. Among the developed techniques for CO2 value-added conversion, CO2 reforming with ethanol (EDR, C2H6O + CO2 →3CO + 3 H2) is regarded as an interesting process compared to methane dry reforming (CH4 + CO2 →2CO + 2 H2) [4]. One side, EDR approach could convert CO2 into high-valued syngas, a suitable feedstock for downstream Fischer-Tropsch process [5]. On the other hand, ethanol reactants derived from the renewable biomass such as corn or agriculture residues are more available and greener in comparison with fossil fuel methane, thereby meeting with the sustainable development [6]. However, the research about EDR process is still limited in spite of the above merits. Therefore, it is of great interest to investigate EDR reaction for CO2 depletion and syngas production. Up to date, enormous research has focused on the design of the active and low-cost transition metal-based catalysts with resistance to coking/sintering for dry reforming process, especially for Ni and Co [7–9]. Due to the high C-C bond rupture capacity, Ni-based catalysts have been widely studied [10,11]. However, the fast deactivation because of coke build-up might be a major hurdle for the industrial application of these systems. The encapsulated carbon on the catalyst surface could lead to the blocking of active metal or reactor blockage, thereby resulting in the decline of catalytic activity. Typically, Boudouard reaction, methane decomposition as well as polymerization of ethylene are regarded as the main routes of carbon formation, as depicted by Ruocco et al. [12,13]. To resolve this problem, they elucidated that 30 wt% of ceria loading in PtNi/SiO2-CeO2 catalyst could display the lowest coke formation rate. Meanwhile, other strategies have been developed to improve catalyst stability. Indeed, the addition of the appropriate noble metal could enhance the catalyst resistance towards deactivation [14]. On the other hand, it was reported that the selection of the suitable catalyst precursors might inhibit catalyst deactivation [15]. On the other hand, Co-based catalysts, another transition metal candidate, have been depicted with good coke resistance under dry reforming conditions [16]. Apart from the type of active metals and support, the performance of catalysts applied in dry reforming reaction also greatly relied on the preparation method [17]. The physicochemical properties such as particle size, morphology structure as well as metal-support interaction could be improved via the utilization of advanced preparation methods. It is generally accepted that catalysts with core@shell structure exhibit the better anti-sintering features to obtain the higher dispersion of active metal and the catalytic activity mainly depend on the synergistic interaction between core and shell [18–20]. In addition, it has been depicted that the particle size of active metal is of key importance in coke resistance [21]. Indeed, sintering of active metal to form larger particles in high temperature reforming reactions is regarded as one of the major reasons of carbon deposition. To be addressed this issue, catalysts with various core@shell structures such as yolk@shell, multicore@shell, sandwichtype core@shell etc. have been successfully fabricated for dry reforming process [22–24]. It was depicted that Ni@SiO2 catalysts in which Ni nanoparticles were embedded in SiO2 spheres presented better activity/stability than Ni/SiO2 samples [25]. The confinement effect of SiO2 might retard the aggregation of Ni nanoparticles as well as coke formation. Simultaneously, Ni@TiO2 [26], Ni@ZrO2 [27] and Ni@Al2O3 [28] have been designed and showed attractive stability. However, most of the above studies might focus on the Ni-based catalysts and the related research to confine the Co species is still in its infancy. So far, few reports on Co-based catalysts with core@shell structure are reported. Apart from this, CeO2 oxide with high redox capacity is regarded as an attractive dopant for catalyst modification in dry reforming reaction [29]. The adsorption/activation of reactant CO2 might occur in the oxygen defect sites of CeO2 to form the mobile O species which facilitate the dynamic coke elimination [30]. In this work, sandwich-type Co core@shell structure catalyst (SiO2 @Co@CeO2) was synthesized via a strong electrostatic adsorption method (SEA). Controlling the pH value of the impregnating solution above the point of zero charge of silica support might result in the deprotonation of the surface hydroxyl groups. Consequently, the silica surface was negatively charged, and cationic cobalt precursors could be strongly adsorbed, thereby enhancing the metal-support interaction and active metal dispersion [31,32]. Interestingly, the as-prepared SiO2 @Co@CeO2 catalyst exhibited higher activity/stability in EDR process compared to Co-SiO2 sample synthesized by impregnation method. Catalysts were characterized in detail by XRD, BET, SEM, TEM, H2-TPR, Raman and XPS technique to establish the relationship between the physicochemical properties and the catalytic performance. Both the importance of the sandwiched core@shell structure and CeO2 promoter in minimizing the sintering of Co nanoparticles and coke deposition were also elucidated in detail. 2 Experimental 2.1 Catalyst preparation 2.1.1 Materials Chemicals of C2H5OH, Co (NO3)3.6 H2O, CeCl3.7 H2O, NH3·H2O (aqueous, 25%−28%), hexamethylenetetramine (99%), tetraethylorthosilcate (TEOS) were purchased from Aladdin and Macklin Chemical Reagent. All chemicals were used without further pre-treatment. 2.1.2 Preparation of SiO2 nanosphere SiO2 nanospheres were prepared by Stöber method as reported in the previous literature [33]. 8 mL TEOS was firstly added into 280 mL ethanol. Subsequently, a mixture containing 8.4 mL ammonia water and 50 mL deionized water was added to the above solution and reacted for 24 h under constant stirring at room temperature. After that, the mixture was centrifuged, washed with deionized water and ethanol, and finally dried at 100 °C for 12 h. 2.1.3 Preparation of SiO2 @Co catalyst A strong electrostatic adsorption technique was used to synthesize SiO2 @Co catalyst. Indeed, 8 mL TEOS was added to 280 mL ethanol. A mixture containing 8.4 mL ammonia water and 50 mL deionized water was then added to the above solution. After reaction for 24 h under magnetic stirring, 4.1 g cobalt nitrate hexahydrate was added and the mixture was heated to 70 °C until the pH value was equal to 7. After that, the precipitation was thoroughly washed with the hot deionized water and calcined at 700 °C for 3.5 h. The catalyst was denoted as SiO2 @Co in the following discussion. 2.1.4 Preparation of SiO2 @Co@CeO2 catalyst A mixture containing 0.6 g SiO2 @Co and 0.57 g cerium trichloride heptahydrate were added to 100 mL ethanol. After the addition of 10 g hexamethylenetetramine which was dissolved in the deionized water, the solution was heated to 70 °C and kept for 7 h. The solid was centrifuged, washed and dried at 60 °C overnight. The catalyst was calcined at 700 °C for 3.5 h and labeled as SiO2 @Co@CeO2. 2.1.5 Preparation of Co-SiO2 catalyst Co-SiO2 was synthesized by conventional impregnation method for comparison. Typically, cobalt nitrate hexahydrate was dissolved in ethanol and the achieved solution was added to SiO2 nanosphere as prepared in the above discussion. After dried at 90 °C overnight, the solid sample was calcined in air at 700 °C for 3.5 h to obtain Co-SiO2 catalyst. 2.1.6 Preparation of Co/CeO2-SiO2 catalyst Co/CeO2-SiO2, another reference catalyst, was synthesized by the same impregnation method. Indeed, a precursor mixture containing cobalt nitrate hexahydrate and cerium trichloride heptahydrate were dissolved into ethanol and the solution was added to the as-prepared nanosphere SiO2. The mixture was dried at 90 ℃ overnight. Finally, the solid sample was calcined in air at 700 °C for 3.5 h to obtain Co/CeO2-SiO2 catalyst. 2.2 Catalyst characterization Morphology structures of the catalysts were probed using a JEM-2100 (UHR) transmission electron microscope (TEM). Scanning electron microscopy (SEM) images were collected on a JSM-7800 F Thermal field emission scanning electron microscope. Hydrogen temperature-programmed reduction (H2-TPR) of the calcined catalysts were carried out on a ZHD-TPX-6 apparatus. 100 mg sample was firstly degassed with a N2 flow at 200 °C for 20 min. After cooling down to room temperature, the tests were conducted from 25 °C to 750 °C with a heating rate of 5 °C /min under a flow of 5 vol% H2/N2. The metal composition was probed by an inductively coupled plasma-atomic emission spectrometry technique (ICP-AES) operated on an OPTIMA 8000 setup. X-ray diffraction (XRD) patterns were recorded by an X-ray diffractor (XRD-7000 s, Japan) using Cu-K α radiation (λ = 1.5406 Å). The operated voltage and current were 40 kV and 30 mA, respectively. The samples were scanned at 2 θ range between 10° and 70° and the scanning speed was 10°/min. N2 adsorption desorption isotherms were conducted on an ASAP 2460 setup to measure the specific surface area of catalysts. The pore size distribution was calculated according to the Barrett-Joyner-Halenda (BJH) method. Raman spectra were used to analyze the coke deposition of the spent catalysts. The measurements were conducted using a Renishaw inVia Raman microscope. The laser as the excitation source was 514 nm and laser intensity were 2 mW. X-ray photoelectron spectra (XPS) were performed to determine the valence states and surface features of the catalysts. The samples were tested using a Thermo VGscientific ESCA MultiLab-2000 equipment. 2.3 Catalytic tests Catalytic reforming of ethanol with CO2 was conducted in a fixed-bed reactor (8 mm of internal diameter) under atmospheric pressure. Prior to test, the samples (100 mg, 40–60 mesh) were insitu reduced at 500 °C for 1 h with a 5 vol% H2/N2 flow (40 mL/min). After purging with a N2 flow, ethanol dry reforming reactions were carried out from 500 °C to 750 °C with a stoichiometric feedstock (C2H6O/CO2/N2 =1/1/1.5, molar ratio; 33.3 wt% of CO2 in mass) to investigate the influence of reaction temperature on catalytic performance. The inert gas N2 was used as diluted gas and internal standard gas. The space velocity (GHSV) was set as 27,700 mL gcat−1h−1. The effluent gas after reaction was monitored online by gas chromatography (GC) with a thermal conductivity detector (TCD) and a flame ionization detector (FID). Ethanol conversion and product selectivity were calculated based on the following equation: (1) X EtOH = C EtOH ( in ) − C EtOH ( out ) C EtOH ( in ) × 100 % Where C EtOH ( in ) and C EtOH ( out ) corresponded to the molar flow of ethanol in inlet and outlet gas, respectively. (2) S x * = C x ( outlet ) ∑ C i ( outlet ) × 100 % Where S x * referred to the selectivity of the product x and C i ( outlet ) indicated the molar concentration of the product i in the outlet dry gas (except H2O and CO2). 3 Experimental and discussion 3.1 Morphology and structure analysis Scheme 1 demonstrated the stepwise preparation of the core@shell structure catalysts. Silica nanospheres were synthesized as core and then cobalt nanoparticles were deposited on the SiO2 surface (SiO2 @Co). When the outer shell was coated with ceria, sandwich-type catalyst (SiO2 @Co@CeO2) was generated. Morphology structure of the calcined catalysts was determined by TEM technique. As shown in Fig. 1a, the silica nano-spheres with the diameter size ranging from 160 to 180 nm were observed, which could act as an inert support for the deposition of Co and Ce to form hybrid core@shell structure catalyst. For SiO2 @Co core-shell sample, it was clear to see that Co nanoparticles with 7–12 nm sizes were decorated on the outside of the silica spheres (Fig. 1b,c). Moreover, silica sphere still maintained the original morphology, suggesting its structural stability. With respect to sandwich-type SiO2 @Co@CeO2 catalyst, SiO2 @Co was further coated with a CeO2 layer using precipitation method to investigate the dopant effect of ceria. As depicted in Fig. 1(d,e), small CeO2 nanocrystals were decorated on the catalyst surface. The thickness of sandwichtype structure catalyst was thicker than SiO2 @Co without CeO2 layer. In addition, the sizes of the nanoparticles around silica cores were obviously smaller than those in SiO2 @Co catalyst. This revealed that during the calcination process, Co species might interact with CeO2, thereby leading to its higher dispersion and smaller particles [34]. Herein, the aggregation of Co nanoparticles decorated on the SiO2 nanosphere surface (SiO2 @Co) occurred during the calcinations process. However, SiO2 @Co@CeO2 stabilized the cobalt particles via the encapsulation by CeO2 shell. Upon reduction, a clear layer of CeO2 was formed, covering the cobalt particles as marked in Fig. 1h. To further elucidate the detailed structure information, HRTEM images of SiO2 @Co@CeO2 are also depicted in Fig. 1g. Obviously, Co3O4 nanoparticles embedded by CeO2 particles were observed, thereby evidencing the successful synthesis of sandwich-type core@shell catalyst. Indeed, the lattice fringe depicted a spacing of 0.23 nm corresponded to the (222) plane of Co3O4 nanocrystals [35], whereas the lattice fringe of 0.27 nm was in indexed with the (200) plane of cubic CeO2 [36]. Besides, the interface between Co3O4 and CeO2 nanoparticles marked in Fig. 1g implied that the cobalt species were incorporated into CeO2 lattice and a synergy effect was generated in the sandwich-type Co core-shell catalyst. More importantly, for the supported catalysts, a metal oxide@metal core@shell nanoparticle was believed to improve the catalytic behavior in high-temperature reactions, considering the positive role at the oxide-metal interface and the anti-sintering features. Similarly, a sandwich-type SiO2 @Pt@SiO2 catalyst was prepared via the deposition of Pt nanoparticles on silica nanospheres, which were further encapsulated by SiO2 shell [24]. The designed catalyst exhibited the high thermal stability and excellent resistance to deactivation. TEM images of Co-SiO2 synthesized by conventional impregnation method (Fig. 1i) revealed the significant aggregation of Co species and no Co particles were observed around the silica nano-spheres, implying the unsatisfactory Co dispersion and weak metal-oxide interaction. FESEM images are further collected to determine the morphology and composition of the as-obtained catalysts. It was noted that the silica spheres were well-dispersed for the core@shell structure catalysts ( Fig. 2a,b). Typically, the rough surface implied the successful deposition of Co3O4 particles and ceria on the SiO2 surface in consistent with the previous report [37]. Moreover, the energy-dispersive X-ray spectrometry (EDS) results illuminated that SiO2 @Co@CeO2 catalyst mainly contained Co, Si, Ce and O elements and all elements were evenly scattered. The similar findings were obtained for SiO2 @Co sample as depicted in Fig S1. As measured by ICP-OES technique, the actual Co loading for the fresh SiO2 @Co catalyst was 26.0 wt%. The as-prepared SiO2 @Co was selected as core to prepare the sandwichtype SiO2 @Co@CeO2 catalyst. Therefore, the Co concentration for SiO2 @Co@CeO2 sample was less (17.1 wt%) because of the presence of Ce (14.5 wt%). On the other hand, the concentration of cobalt in Co-SiO2 sample was 25.1 wt%. In order to check the effect of CeO2 layer on the redox capacity, H2-TPR analysis were carried out for the SiO2 @Co and SiO2 @Co@CeO2 catalysts. The profiles are presented in Fig. 3. As for SiO2 @Co sample, two main reduction peaks centered at ca.340 °C and 542 °C, respectively. Considering that it was difficult for SiO2 to be reduced in the investigated temperature region, the observed reduction peaks were mainly attributed to the reduction of cobalt species. Hence, the first reduction peak was related to the continuous reduction of small, dispersed Co3O4 nanoparticles (Co3O4 →CoO→Co). It was reported that after reduction of Co3+ species to Co2+, immediately reduction of Co2+ species to metallic Co0 occurred [38,39]. Another broad peak at 542 °C might probably be assigned to the reduction of bulk Co3O4 nanoparticles with broad particle size distribution [40]. In particular, the obvious difference was noted in the TPR profile of SiO2 @Co@CeO2 catalyst. Indeed, the reduction peaks of sandwich-type SiO2 @Co@CeO2 shifted to lower temperatures compared to SiO2 @Co. Herein, the peak at 331 °C corresponded to the reduction of small cobalt particles, whereas the peak at 440 °C and 635 °C might represent the combined reduction of bulk Co3O4 species and CeO2 shell [41]. This finding confirmed that the presence of Co-Ce-O interface could facilitate the reduction of the Co3O4 nanoparticles. Moreover, the calculated hydrogen consumption of SiO2 @Co (5.56 mmol/gcat) was close to the theoretical value for the complete reduction of Co3O4 nanoparticles to metallic Co species (5.87 mmol/gcat). Actually, it was accepted that SiO2 core was difficult to be reduced in the region of the investigated temperatures. On the contrary, the experimental H2 consumption for SiO2 @Co@CeO2 catalyst (7.03 mmol/gcat) greatly surpassed the theoretical value. More hydrogen consumption probably corresponded to the reduction of the CeO2 species. The synergy effect between Co3O4 and CeO2 shell could improve the catalyst reducibility and oxygen mobility, thereby resulting in higher catalytic behavior. It was accepted that the incorporation of Co species into CeO2 crystal structure might lead to lattice deformation and the generation of O vacancies which facilitate the adsorption/activation of CO2 reactant as well as the coke cleaning in EDR reaction. XRD patterns of the calcined catalysts are shown in Fig. 4. The main diffraction peaks of the SiO2 @Co sample corresponded well to the Co3O4 phase (JCPDS#42–1467). More importantly, the band at 20–25 ° assigned to the amorphous silica phase was weak which might be caused by the cover of Co3O4 shell. This result indirectly evidenced the successful synthesis of core@shell catalyst. The similar finding was observed for the SiO2 @Co@CeO2 catalyst. Apart from this, the peaks at 2 θ = 28.8°, 33.2°, 47.7°, 56.5°, 59.6° and 65.3° were attributed to the characteristic (111), (200), (220), (311), (222) and (400) reflections of fluorite-phase CeO2, respectively (JCPDS#34–0394). It should be noted that SiO2 @Co@CeO2 exhibited the relatively broaden peaks of Co3O4 phase in comparison with SiO2 @Co. This implied the formation of smaller cobalt particles after the addition of CeO2 layer. The mean crystallite sizes of Co3O4 calculated by the Scherrer equation were 7.90 nm and 5.92 nm respectively for SiO2 @Co and SiO2 @Co@CeO2 catalysts ( Table 1), suggesting that the aggregation of Co3O4 was inhibited in the sandwich-type core @shell structure catalyst. Co3O4 nanoparticles were retarded to move outside the shell because of the presence of CeO2 shell and it was favorable to prevent the aggregation of the cobalt particles under calcination conditions [42]. Diffraction peaks for Co3O4 with more intensity were observed for the calcined Co-SiO2 catalyst and the calculated cobalt crystal size was 26.68 nm. Fig S2 shows XRD patterns of the ex-situ reduced catalysts. Obviously, the diffraction peaks became weaker in all cases. Characteristic peaks of Co3O4 were disappear while a tiny and broad peak attributed to CoO species were observed, indicating the partial re-oxidation of metallic Co0 sites due to the ex-situ reduction conditions. Moreover, SiO2 @Co@CeO2 catalyst presented the weaker and more broaden peak of CoO compared to SiO2 @Co and their average particles size were 4.13 nm and 5.12 nm, respectively. The result demonstrated that the strong interaction with CeO2 shell made the cobalt species to be more dispersed during the reduction process. Active cobalt particles were prevented to move outside the shell due to the presence of the slit-shaped framework of CeO2 shell. This positively reduced Co particles from aggregation with each other and inhibited their growth. Apart from this, the calculated lattice parameter of ceria in SiO2 @Co@CeO2 (5.39 Å) was slightly less than the value of pure CeO2 (5.41 Å), proving the incorporation of Co ions into CeO2 lattice structure considering that the ionic radius of Co3+ (0.65 Å) or Co2+ (0.74 Å) was smaller than that of Ce4+ ions (0.87 Å) [43]. Interestingly, partial cobalt ions diffused into ceria lattice structure and replaced Ce4+ ions via the interface diffusion during calcinations process because of the intimate contact between cobalt species and cerium species. Consequently, the diffraction peaks of cubic CeO2 moved to larger angle side. On the contrary, the position of diffraction peaks corresponding to Co3O4 phase was conversely shifted to lower region. Importantly, the smaller crystallite size that possessed more active sites was favorable to enhance the catalytic performance. On the other hand, the strong interaction between cobalt and ceria was beneficial for improving thermal stability and coke resistance in dry reforming. Nitrogen adsorption-desorption isotherm curves are presented in Fig. 5 to explore the textural features of the calcined catalysts. Both SiO2 @Co and SiO2 @Co@CeO2 showed type IV isotherms with a hysteresis loop, suggesting the presence of mesoporous structure. The distribution of pore size (inserted image) further confirmed this finding. As listed in Table 1, the calcined SiO2 @Co@CeO2 catalyst possessed the less specific surface area as well as pore volume compared with SiO2 @Co, which was probably due to the deposition of CeO2 on the porous structure, thereby blocking some pores [44]. Interestingly, the average pore size (Table 1) for the SiO2 @Co@CeO2 catalyst was still in the region of mesostructure, implying that the thin ceria shell might not cause massive diffusion resistance to the reactant and/or product molecules during dry reforming process. Indeed, SiO2 @Co@CeO2 sample with core-shell structure exhibited the less BET surface area while presented the better catalytic behavior. XPS spectra were collected to study the surface chemical states of the as-prepared catalysts. As shown in Fig. 6c, the less intensity of Co signal was observed for SiO2 @Co@CeO2 catalyst in comparison with SiO2 @Co. It was well-accepted that XPS technique could be only suitable to determine the surface information of catalysts. Hence, this finding might evidence the sandwich-type core@shell structure of the SiO2 @Co@CeO2 sample, where cobalt nanoparticles were covered by a CeO2 shell and could not be detected by XPS surface technique. This result was in good line with the above discussion of the TEM images. Moreover, Ce XPS spectra of SiO2 @Co@CeO2 sample (Fig. 6b) could be further deconvoluted into ten peaks due to the existence of Ce 3d5/2 (labeled as v) and Ce 3d3/2 (labeled as u). The peaks at v, v’’, v’’’, u, u’’ and u’’’ were ascribed to Ce4+ species while the bands at v0, v′, u0 and u′ corresponded to the Ce3+ states. The values of binding energy were listed in detail in Table S1. This indicated the co-existence of Ce3+ and Ce4+ species on the catalyst surface. It should be noted that the presence of Ce3+ ions was generally related with the generation of O vacancies. Interestingly, more Ce3+ species in CeO2-based catalysts corresponded to more oxygen vacancies [45]. The concentration of Ce3+ ions could be calculated according to the following formula: Con (Ce3+) = A(Ce3+)/ [A(Ce3+) + A(Ce4+)], where A(Ce3+) and A(Ce4+) referred to the sum of the peak areas indexed to the Ce3+ and Ce4+ species, respectively [46]. Herein, the calculated value was 34.5% as depicted in Table S1. In comparison with the Ce3+ concentration reported in the previous literature such as Ni/CeO2 (16%) [47], CeO2 @Co3O4 (27%) [46] and CeO2 nanocubes (12%) [48], it could be concluded that sandwich-type structure in SiO2 @Co@CeO2 sample greatly increased the formation of Ce3+ ions because of the strong interaction between Co cores and CeO2 shell as evidenced by XRD and XPS findings. It was believed that larger amount of Ce3+ species could facilitate the coke gasification during dry reforming process to avoid carbon deposition. Previous reports elucidated that CO2 preferred to adsorb onto the Ce3+ sites instead of the oxidized Ce4+ sites [49]. O 1 s spectra of the catalysts are also displayed in Fig. 6. After the deconvolution, two main peaks at ca. 530.9 eV and 533.4 eV were observed in all cases, which were assigned to the lattice oxygen bonding to the metal cations ( O latt ) and the chemisorbed oxygen ( O ads ), respectively. The relative ratio of two types of oxygen species was quantified according to the peak areas. Importantly, the O ads / O latt value was calculated to be 3.55 for SiO2 @Co@CeO2, which was much larger than that of SiO2 @Co (0.99). From this, Ce-O-Co bands might be formed in sandwich-type structure catalyst (SiO2 @Co@CeO2), which facilitated the migration of internal lattice oxygen to surface oxygen species [45,50]. This further convinced the interaction between cobalt and CeO2, in line with H2-TPR analysis. This might be also caused by the presence of Ce3+ species as depicted in XPS findings, which was favorable for the generation of oxygen defects on the oxide surface [51]. Moreover, the higher concentration of surface oxygen species could result in better catalytic behavior for EPR reaction. 3.2 Catalytic activity and stability for ethanol dry reforming 3.2.1 Activity comparison The catalytic behavior of the investigated was probed for ethanol dry reforming with a C2H6O/CO2/N2 molar ratio of 1/1/1.5. Fig. 7 shows the ethanol conversion and product concentration for SiO2 @Co, SiO2 @Co@CeO2 and the reference Co-SiO2, Co/CeO2-SiO2 catalysts, respectively. Indeed, Co-SiO2 catalyst exhibited the lowest activity. The unsatisfactory activity might be interpreted by the aggregation of Co particles as observed from TEM image (Fig. 1i). On the other hand, the addition of CeO2 (Co/CeO2-SiO2) might only enhance ethanol conversion to some extent. On the contrary, another two catalysts with core@shell structure depicted the better catalytic behavior. Actually, SiO2 @Co catalyst presented the higher ethanol conversion than that of the reference samples (Co-SiO2, Co/CeO2-SiO2). The strong metal oxide-metal interaction arising from the electrostatic adsorption method endowed the SiO2 @Co catalyst with better activity. More importantly, no byproduct acetone was detected for SiO2 @Co@CeO2 sample which also exhibited the highest ethanol conversion. This might be explained by its higher reducibility and the better dispersion of active Co species as supplied by H2-TPR, TEM and XRD results. It was accepted that cobalt metal possessed the higher capacity of C-C bond dissociation, which could make the fast decomposition of intermediates acetaldehyde instead of the formation of acetone via aldolization process. Moreover, a synergistic effect between Co3O4 and CeO2 shell in the unique sandwich-type core@shell structure might also contribute to the better performance. H2/CO ratio obtained over the SiO2 @Co@CeO2 was relatively less, which could be explained by the higher CO2 conversion on CeO2 shell to CO and active O species due to the existence of oxygen vacancies [52,53]. To optimize the operation temperature of ethanol dry reforming, the influence of reaction temperature was further studied for SiO2 @Co@CeO2 in the wide range of 500 °C to 750 °C. Complete ethanol conversion was achieved at 500 °C, implying its high low temperature activity. The molar concentration of H2 in the outlet dry gas gradually declined with increasing temperature, while another targeted product CO followed the reverse trend. This might be due to the occurrence of the RWGS reaction (CO2 + H2 →CO + H2O) that was thermodynamically favorable at the high temperature. Upon heating, the concentration of byproduct methane decreased, which indicated the occurrence of methane dry reforming (CH4 +CO2→2CO + 2 H2). 3.2.2 Stability tests Fig. 8 presents the stability tests of the as-prepared catalysts for EDR reaction at 650 °C. The reason to conduct the tests at the relatively high temperature was because coke deposition was enormous at low temperature for dry reforming process [54]. Typically, Co-SiO2 catalyst exhibited an initial decline of ethanol conversion as well as the increase of CH4 concentration, suggesting the occurrence of deactivation. Additionally, the carbon accumulation was severe which blocked the reaction tube within 23 h and increased the reaction pressure, thereby preventing the injection of the feedstocks. The reactor blocking problem also occurred for another reference catalyst Co/CeO2-SiO2 after 35 h time-on-stream tests. The results indicated that the existence of CeO2 doped by the impregnation technique only prolonged the catalyst stability to some extent. It was reported that coke formation was mainly due to Boudouard reaction (2CO →C + CO2) and methane decomposition (CH4 →C + H2) [55]. In contrast, SiO2 @Co@CeO2 catalyst maintained the stable activity with time on stream. Reactor pressure did not increase during stability tests, avoiding the absence of reactor blocking by carbon deposition. SiO2 @Co catalyst also exhibited the good stability during the whole time. 3.3 Characterization of spent catalysts XRD patterns of the spent catalysts are shown in Fig S3. A diffraction peak at 26.4° was detected, which was attributed to graphic coke [56]. More importantly, the intensity increased following the order: SiO2 @Co@CeO2 <SiO2 @Co< Co-SiO2. This result revealed that sandwich-type core@shell structure in SiO2 @Co@CeO2 catalyst greatly inhibited the carbon formation during the reaction. Besides, peaks for the face-centered cubic metallic Co0 species were also observed at 44.2° and 51.5° because of the reduced atmosphere. In addition, the diffraction peaks of SiO2 @Co@CeO2 sample were weaker and broader than the others, implying its smaller particle size. It demonstrated that the CeO2 shell could efficiently prevent the sintering of Co nanoparticles even after the long testing time. The calculated mean crystallite size of metallic cobalt was 6.78 nm (SiO2 @Co@CeO2), 8.67 nm (SiO2 @Co) and 17.32 nm (Co-SiO2). The decline of particle size for used Co-SiO2 catalyst compared to the fresh sample might be due to the cover of particle surface by the enormous coke. XRD findings depicted that sandwich-type Co core@shell catalyst exhibited the remarkable resistance to carbon deposition and metal sintering. TEM images of the used catalysts are displayed in Fig. 9. Whisker carbon were formed around the used SiO2 @Co (Fig. 9a,b) and the carbon nanotubes with cobalt particle at the tip were observed (Fig. 9c), suggesting that the filamentous coke detached Co particles from silica support and destroyed the catalyst structure. Moreover, Co nanoparticles were encapsulated by coke, thereby preventing the adsorption/activation of the reactants and leading to catalyst deactivation. In contrast, as shown in Fig. 9d, no extensive formation of whisker coke was found for the used SiO2 @Co@CeO2 catalyst and only slight sintering occurred compared to the fresh catalyst, reaffirming its structural stability. A clear CeO2 shell as marked in Fig. 9d further proved the successful synthesis of sandwich-type catalyst. Moreover, the formed carbon nanotubes were not intimate contact with Co nanoparticles (Fig. 9f). It was accepted that oxygen vacancies in CeO2 shell could facilitate the adsorption/activation of CO2 to form the mobile O species, thereby enhancing the insitu gasification of coke [57]. As to the used Co-SiO2 sample, the severe sintering of Co particles occurred (Fig. 9g) and the large amounts of coke covered the catalyst surface (Fig. 9h). This might be caused by the larger cobalt particle size and weaker metal-support interaction as elucidated in the above discussion. The massive growth of filamentous carbon could lead to the blocking of the reactor bed as observed in stability tests (Fig. 8). Fig. 10 shows the Raman spectra of the used catalysts to probe the type and graphitic degree of coke deposition. A band at1349cm−1 was attributed to the D band which was related to the disordered structural mode of the carbon species, while another band at 1581 cm−1 corresponded to the G band in association with the graphitic coke [58]. Indeed, the intensity of the spent Co-SiO2 catalyst was larger even after the shorter time test (23 h), thereby implying its faster rate of coke formation. Instead, the intensity of the used SiO2 @Co@CeO2 was less. Additionally, the intensity ratio of IG/ID, which was indexed with the graphitic degree of coke, increased in the following order: SiO2 @Co@CeO2 (0.97) < Co-SiO2 (1.2) <SiO2 @Co (1.51). Therefore, the less amount and lower graphitic degree of coke in SiO2 @Co@CeO2 catalyst might contribute to its stable performance. Based on the above results, the CeO2 shell also took part in ethanol dry reforming process to improve catalyst performance. Therefore, a bi-functional mechanism was proposed for SiO2 @Co@CeO2 ( Fig. 11) while a mono-functional pathway contributed to SiO2 @Co and Co-SiO2. Indeed, the cobalt nanoparticles encapsulated by SiO2 cores and CeO2 shell maintained the high dispersion, keeping a stable Co-ceria interface area where the reaction occurred. Meanwhile, the absence of acetone further confirmed the rapid decomposition of acetaldehyde at the Co-CeO2 interface. In addition, CO2 could readily react with the O vacancies in CeO2 shell to form surface oxygen species and CO, which allowed a continuous cleaning of coke. To be concluded, SiO2 @Co@CeO2 with sandwich-type core@shell structure showed the excellent coke-resistance and anti-sintering feature, which made it as a promising candidate for ethanol dry reforming. The confinement effect of the CeO2 shell prevented the movement of tiny Co nanoparticles to aggregation ( Scheme 2). On the other hand, the high oxygen storage capacity of CeO2 shell could enhance the dynamic oxidation of carbon formed during dry reforming reaction. 4 Conclusion In this work, a sandwich-type core@shell catalyst (SiO2 @Co@CeO2) with Co nanoparticles between SiO2 core and CeO2 layer was synthesized using the strong electrostatic method and applied for ethanol dry reforming. Indeed, full ethanol conversion was obtained at 500 °C with as high as 55.1 mol% H2 and 17.8 mol% CO in the outlet dry gas. More importantly, no byproduct acetone was formed. In addition, SiO2 @Co@CeO2 catalyst presented the less metal sintering and coke deposition after 50 h stability tests while still maintaining the high activity. In contrast, SiO2 @Co sample without the CeO2 shell exhibited the less activity and higher carbon formation compared to SiO2 @Co@CeO2. Moreover, Co-SiO2 prepared by impregnation method possessed the larger Co particle size and showed the unsatisfactory activity as well as the massive coke formation that blocked the reactor tube within 23 h. The better catalytic performance of SiO2 @Co@CeO2 catalyst might be attributed to the confinement effect provided by the core@shell structure and the high redox capacity of CeO2 shell. Typically, Co nanoparticles were encapsulated by silica and ceria and their mobility were prevented, thereby inhibiting their aggregation. Besides, the CeO2 shell could supply the mobile O species, thus facilitating the oxidation of coke formed during ethanol dry reforming. Hence, the finding might provide a simple strategy to develop the efficient catalysts for ethanol dry reforming and other high temperature reactions. CRediT authorship contribution statement Feifei Li: Catalyst preparation and catalytic tests. Mingyue Wang: Catalyst characterization and English writing. Jinming Zhang: English writing. Xingtao Lin: Design of catalyst and result analysis. Dazhi Wang: Financial supporting. Weijie Cai: Supervision and result analysis. Declaration of Competing Interest The authors declare that there are no conflict of interests. Acknowledgements The authors gratefully acknowledge the financial supports from Innovative Talents Program in Colleges and Universities of Liaoning Province (LR2019006), Scientific Research Funding of the Educational Department of Liaoning Province (J2020001). Appendix A Supporting information Supplementary data associated with this article can be found in the online version at doi:10.1016/j.apcata.2022.118605. Appendix A Supplementary material Supplementary material . References [1] Y.K. Liu R.N. Zhou J.Y. Qu F. Han S. Zhang X.L. Xu Appl. Catal. A 630 2021 118444 Y.K. Liu, R.N. Zhou, J.Y. Qu, F. Han, S. Zhang, X.L. Xu, Appl. Catal. A 630 (2021) 118444. [2] J.J. Lee C. Sievers C.W. Jones Ind. Eng. Chem. Res. 58 2019 22551 22560 J.J. Lee, C. Sievers, C.W. Jones, Ind. Eng. Chem. Res. 58 (2019) 22551–22560. [3] Y. Wang Q. Zhao L. Li C.W. Hu P. Costa Appl. Catal. A 617 2021 118120 Y. Wang, Q. Zhao, L. Li, C.W. Hu, P. Costa, Appl. Catal. A 617 (2021) 118120. [4] S. Bac S. Keskin A.K. Avci Sustain. Energy Fuels 4 2020 1029 1047 S. Bac, S. Keskin, A.K. Avci, Sustain. Energy. Fuels.4 (2020) 1029–1047. [5] J.L. Ewbank L. Kovarik F.Z. Diallo C. Sievers Appl. Catal. A 494 2015 57 67 J.L. Ewbank, L. Kovarik, F.Z. Diallo, C. Sievers, Appl. Catal. A 494 (2015) 57–67. [6] S.I. Itoa S. Kameoka Appl. Catal. A 617 2021 113 118 S.I. Itoa, S. Kameoka, Appl. Catal. A. 617 (2021) 113–118. [7] J. Horlyck C. Lawrey E.C. Lovell R. Amal J. Scott Chem. Eng. J. 352 2018 572 580 J. Horlyck, C. Lawrey, E.C. Lovell, R. Amal, J. Scott, Chem. Eng. J. 352 (2018) 572–580. [8] J.H. Park S.Y. Yeo T.S. Chang J. CO2 Util. 26 2018 465 475 J.H. Park, S.Y. Yeo, T.S. Chang, J. CO2. Util. 26 (2018) 465–475. [9] A. Drif N. Bion R. Brahmi S. Ojala L. Pirault-Roy E. Turpeinen P.K. Seelam R. Keiski F. Epron Appl. Catal. A 504 2015 576 584 A. Drif, N. Bion, R. Brahmi, S. Ojala, L. Pirault-Roy, E. Turpeinen, P.K. Seelam, R. Keiski, F. Epron, Appl. Catal. A.504 (2015) 576–584. [10] Y. Wang L. Yao S.H. Wang D.H. Mao C.W. Hu Fuel Process. Technol. 169 2018 199 206 Y. Wang, L. Yao, S.H. Wang, D.H. Mao, C.W. Hu, Fuel. Process. Technol. 169 (2018) 199–206. [11] V. Palma C. Ruocco A. Ricca Renew. Energy 125 2018 356 364 V. Palma, C. Ruocco, A. Ricca, Renew. Energ. 125 (2018) 356–364. [12] V. Palma C. Ruocco M. Cortese M. Martino Catalysts 10 2020 665 734 V. Palma, C. Ruocco, M. Cortese, M. Martino, Catalysts. 10 (2020) 665–734. [13] V. Palma C. Ruocco E. Meloni A. Ricca Int. J. Hydrog. Energy 42 2017 1598 1608 V. Palma, C. Ruocco, E. Meloni, A. Ricca, Int. J. Hydrogen Energy. 42 (2017) 1598–1608. [14] C. Ruocco V. Palma M. Cortese M. Martino Renew. Energy 182 2022 913 922 C. Ruocco, V. Palma, M. Cortese, M. Martino, Renew. Energ. 182 (2022) 913–922. [15] C. Ruocco V. Palma A. Ricca Int. J. Hydrog. Energy 44 2019 12661 12670 C. Ruocco, V. Palma, A. Ricca, Int. J. Hydrogen Energy. 44 (2019) 12661–12670. [16] A. Giehr L. Maier S.A. Schunk O. Deutschmann Chem. Cat. Chem. 10 2018 751 757 A. Giehr, L. Maier, S.A. Schunk, O. Deutschmann, Chem. Cat. Chem. 10 (2018) 751–757. [17] J.H. Park S. Yeo T.S. Chang J. CO2 Util. 26 2018 465 475 J.H. Park, S. Yeo, T.S. Chang, J. CO2. Util. 26 (2018) 465–475. [18] B.L. Han L. Zhao F.G. Wang L.L. Xu H. Yu Y. Cui J.M. Zhang W.D. Shi Ind. Eng. Chem. Res. 59 2020 13370 13379 B.L. Han, L. Zhao, F.G. Wang, L.L. Xu, H. Yu, Y. Cui, J.M. Zhang, W.D. Shi, Ind. Eng. Chem. Res.59 (2020) 13370–13379. [19] P. Ipek S.C. Burcu A. Erhan Appl. Catal. B 168 2015 164 174 P. Ipek, S.C. Burcu, A. Erhan, Appl. Catal. B. 168 (2015) 164–174. [20] K. Sheng D. Luan H. Jiang F. Zeng B. Wei F. Pang J. Ge ACS Appl. Mater. Interfaces 11 2019 24078 24087 K. Sheng, D. Luan, H. Jiang, F. Zeng, B. Wei, F. Pang, J. Ge, ACS. Appl. Mater. Interfaces. 11 (2019) 24078–24087. [21] J.L. Ewbank L. Kovarik C.C. Kenvin C. Sievers Green Chem. 16 2014 885 896 J.L. Ewbank, L. Kovarik, C.C. Kenvin, C. Sievers, Green. Chem. 16 (2014) 885–896. [22] S. Das J. Pérez-Ramírez J. Gong N. Dewangan K. Hidajat B.C. Gates S. Kawi Chem. Soc. Rev. 49 2020 2937 3004 S. Das, J. Pérez-Ramírez, J. Gong, N. Dewangan, K. Hidajat, B.C. Gates, S. Kawi, Chem. Soc. Rev. 49 (2020) 2937–3004. [23] F. Wang B. Han L. Zhang L. Xu H. Yu W. Shi Appl. Catal. B 235 2018 26 35 F. Wang, B. Han, L. Zhang, L. Xu, H. Yu, W. Shi, Appl. Catal. B. 235 (2018) 26–35. [24] K. An Q. Zhang S. Alayoglu N. Musselwhite J.Y. Shin Nano Lett. 14 2014 4907 4912 K. An, Q. Zhang, S. Alayoglu, N. Musselwhite, J.Y. Shin, Nano. Lett. 14 (2014) 4907–4912. [25] R. Chai G. Zhao Z. Zhang P. Chen Y. Liu Y. Lu Catal. Sci. Technol. 7 2017 5500 5504 R. Chai, G. Zhao, Z. Zhang, P. Chen, Y. Liu, Y. Lu, Catal. Sci. Technol. 7 (2017) 5500–5504. [26] D.H. Kim S.Y. Kim S.W. Han Y.K. Cho M.G. Jeong E.J. Park Y.D. Kim Appl. Catal. A 495 2015 184 191 D.H. Kim, S.Y. Kim, S.W. Han, Y.K. Cho, M.G. Jeong, E.J. Park, Y.D. Kim, Appl. Catal. A. 495 (2015) 184–191. [27] Z.Y. Lim C. Wu W.G. Wang K.L. Choy H. Yin J. Mater. Chem. A 4 2016 153 159 Z.Y. Lim, C. Wu, W.G. Wang, K.L. Choy, H. Yin, J. Mater. Chem. A. 4 (2016) 153–159. [28] E. Baktash P. Littlewood R.S. Schomäcker P.C. Thomas Appl. Catal. B 179 2015 122 127 E. Baktash, P. Littlewood, R.S. Schomäcker, P.C. Thomas, Appl. Catal. B. 179 (2015) 122–127. [29] F. Zhang Z.Y. Liu S.H. Zhang N. Akter R.M. Palomino D. Vovchok I. Orozco D. Salazar J. Rodriguez J. Llorca J. Lee D.H. Kim W.Q. Xu A.I. Frenkel Y.Y. Li T.J. Kim S.D. Senanayake ACS Catal. 8 2018 3550 3560 F. Zhang, Z.Y. Liu, S.H. Zhang, N. Akter, R.M. Palomino, D. Vovchok, I. Orozco, D. Salazar, J. Rodriguez, J. Llorca, J. Lee, D.H. Kim, W.Q. Xu, A.I. Frenkel, Y.Y. Li, T.J. Kim, S.D. Senanayake, ACS. Catal. 8 (2018) 3550–3560. [30] P. Ipek B.S. Caglayan A.E. Aksoylu Appl. Catal. B 168 2015 164 174 P. Ipek, B.S. Caglayan, A.E. Aksoylu, Appl. Catal. B. 168 (2015) 164–174. [31] F.G. Wang K.H. Han L.L. Xi H. Yu W.D. Shi Ind. Eng. Chem. Res. 60 2021 3324 3333 F.G. Wang, K.H. Han, L.L. Xi, H. Yu, W.D. Shi, Ind. Eng. Chem. Res. 60 (2021) 3324–3333. [32] K.L. Ding D.A. Cullen L.B. Zhang Z. Cao A.D. Roy I.N. Ivanov D.M. Cao Science 362 2018 560 564 K.L. Ding, D.A. Cullen, L.B. Zhang, Z. Cao, A.D. Roy, I.N. Ivanov, D.M. Cao, Science. 362 (2018) 560–564. [33] N.C. Strandwite G.D. Stucky Chem. Mater. 21 2009 4577 4582 N.C. Strandwite, G.D. Stucky, Chem. Mater. 21 (2009) 4577–4582. [34] I.I. Soykal H. Sohn U.S. Ozkan ACS Catal. 2 2012 2335 2348 I.I. Soykal, H. Sohn, U.S. Ozkan, ACS. Catal. 2 (2012) 2335–2348. [35] W. Fang J.H. Chen X.Y. Zhou J.J. Chen Z.P. Ye J.H. Li Ind. Eng. Chem. Res. 59 2020 10328 10337 W. Fang, J.H. Chen, X.Y. Zhou, J.J. Chen, Z.P. Ye, J.H. Li, Ind. Eng. Chem. Res. 59 (2020) 10328–10337. [36] N. Zhang X.Z. Fu Y.J. Xu J. Mater. Chem. 21 2011 8152 8158 N. Zhang, X.Z. Fu, Y.J. Xu, J. Mater. Chem. 21 (2011) 8152–8158. [37] F. Wang X. Wang D.P. Liu J.M. Zhen J.Q. Li Y.H. Wang H.J. Zhang ACS Appl. Mater. Interfaces 6 2014 22216 22223 F. Wang, X. Wang, D.P. Liu, J.M. Zhen, J.Q. Li, Y.H. Wang, H.J. Zhang, ACS. Appl. Mater. Interfaces. 6 (2014) 22216–22223. [38] F. Mirzaei M. Rezaei F. Meshkani Z. Fattah J. Ind. Eng. Chem. 21 2005 662 667 F. Mirzaei, M. Rezaei, F. Meshkani, Z. Fattah, J. Ind. Eng. Chem. 21 (2005) 662–667. [39] J.H. Cho J.H. Park T.S. Chang G. Seo C.H. Shin Appl. Catal. A 417–418 2012 313 319 J.H. Cho, J.H. Park, T.S. Chang, G. Seo, C.H. Shin, Appl. Catal. A. 417–418 (2012) 313–319. [40] S. Tuti F. Pepe Catal. Lett. 122 2008 196 203 S. Tuti, F. Pepe, Catal. Lett. 122 (2008) 196–203. [41] C.L. Wang D.D. Wang Y. Yang R. Li C.L. Chen Q.W. Chen Nanoscale 8 2016 19761 19768 C.L. Wang, D.D. Wang, Y. Yang, R. Li, C.L. Chen, Q.W. Chen, Nanoscale, 8 (2016) 19761–19768. [42] Z.Y. Lim C.Z. Wu W.G. Wang K.L. Choy H.F. Yin RSC Adv. 5 2015 61925 61932 Z.Y. Lim, C.Z. Wu, W.G. Wang, K.L. Choy, H.F. Yin, RSC. Adv. 5 (2015) 61925–61932. [43] X. Li X. Zeng T. Zhu Appl. Catal. A. 572 2019 61 70 X. Li, X. Zeng, T. Zhu, Appl. Catal. A. 572 (2019) 61–70. [44] X. Zhang J. Wang B. Tan N. Zhang J. Bao G. He Fuel 226 2018 18 26 X. Zhang, J. Wang, B. Tan, N. Zhang, J. Bao, G. He, Fuel. 226 (2018)18–26. [45] D. He H. Hao D. Chen J. Liu J. Yu F. Liu G. Wan S. He Y. Luo Catal. Today 281 2017 559 565 D. He, H. Hao, D. Chen, J. Liu, J. Yu, F. Liu, G. Wan, S. He, Y. Luo, Catal. Today. 281 (2017) 559–565. [46] L. Zhang L. Zhang G.C. Xu C. Zhang X. Li Z.P. Sun D.Z. Jia New. J. Chem. 41 2017 13418 13424 L. Zhang, L. Zhang, G.C. Xu, C. Zhang, X. Li, Z.P. Sun, D.Z. Jia, New. J. Chem. 41 (2017) 13418–13424. [47] W.X. Zou C.Y. Ge M.Y. Lu S.G. Wu Y.Z. Wang J.F. Sun Y. Pu C.J. Tang F. Gao L. Dong RSC Adv. 5 2015 98335 98343 W.X. Zou, C.Y. Ge, M.Y. Lu, S.G. Wu, Y.Z. Wang, J.F. Sun, Y. Pu, C.J. Tang, F. Gao, L. Dong, RSC. Adv. 5 (2015) 98335–98343. [48] S. Putla M.H. Amin B.M. Reddy A. Nafady K.A. Farhan S.K. Bhargava ACS Appl. Mater. Interfaces 7 2015 16525 16535 S. Putla, M.H. Amin, B.M. Reddy, A. Nafady, K.A. Farhan, S.K. Bhargava, ACS. Appl. Mater. Interfaces. 7 (2015) 16525–16535. [49] M. Boaro F. Giordano S. Recchia V. Dal Santo M. Giona A. Trovarelli Appl. Catal. B 52 2004 225 237 M. Boaro, F. Giordano, S. Recchia, V. Dal Santo, M. Giona, A. Trovarelli, Appl.Catal. B. 52 (2004) 225–237. [50] A. Rangaswamy P. Sudarsanam B.M. Reddy J. Rare Earths 33 2015 1162 1169 A. Rangaswamy, P. Sudarsanam, B.M. Reddy, J. Rare. Earths. 33 (2015) 1162–1169. [51] C.S. Deng Q.Q. Huang X.Y. Zhu Q. Hu W.L. Su J.N. Qian L.H. Dong B. Li M.G. Fan C.Y. Liang Appl. Surf. Sci. 389 2016 1033 1049 C.S. Deng, Q.Q. Huang, X.Y. Zhu, Q. Hu, W.L. Su, J.N. Qian, L.H. Dong, B. Li, M.G. Fan, C.Y. Liang, Appl. Surf. Sci. 389 (2016) 1033–1049. [52] A. Kambolis H. Matralis A. Trovarelli C. Paradopoulou Appl. Catal. A 377 2010 16 26 A. Kambolis, H. Matralis, A. Trovarelli, C. Paradopoulou, Appl.Catal. A. 377 (2010) 16–26. [53] J.A. Montoya E. Romero-Pascual C. Gimon P. Del Angel A. Monzón Catal. Today 63 2000 71 85 J.A. Montoya, E. Romero-Pascual, C. Gimon, P. Del Angel, A. Monzón, Catal. Today. 63 (2000) 71–85. [54] Y. Kathirase U. Oemar E.T. Saw Z. Li S. Kawi Chem. Eng. J. 278 2015 62 78 Y. Kathirase, U. Oemar, E.T. Saw, Z. Li, S. Kawi, Chem. Eng. J. 278 (2015) 62–78. [55] Y.M. Lyu J. Jocz R. Xu E. Stavitski C. Sievers ACS Catal. 10 2020 11235 11252 Y.M. Lyu, J. Jocz, R. Xu, E. Stavitski, C. Sievers, ACS. Catal. 10 (2020) 11235–11252. [56] W. Li C. Liang W. Zhou J. Qiu Z. Zhou G. Sun Q. Xin J. Phys. Chem. B 107 2003 6292 6299 W. Li, C. Liang, W. Zhou, J. Qiu, Z. Zhou, G. Sun, Q. Xin, J. Phys. Chem. B. 107 (2003) 6292–6299. [57] B.V. Ayodele M.R. Khan C.K. Cheng Int. J. Hydrog. Energy 41 2016 198 207 B.V. Ayodele, M.R. Khan, C.K. Cheng, Int. J. Hydrogen. Energy. 41 (2016) 198–207. [58] F.G. Wang K.H. Han W.S. Yu L. Zhao Y. Wang X.J. Wang H. Yu W.D. Shi ACS Appl. Mater. Interfaces 12 2020 35022 35034 F.G. Wang, K.H. Han, W.S. Yu, L. Zhao, Y. Wang, X.J. Wang, H. Yu, W.D. Shi, ACS. Appl. Mater. Interfaces.12 (2020) 35022–35034.",
      "scopus-id": "85128511351",
      "coredata": {
        "eid": "1-s2.0-S0926860X22001284",
        "dc:description": "The design of highly efficient catalysts for CO2 reforming with ethanol is of great interest due to the serious coke deposition and the sintering of active metal. In this work, sandwich-type Co core@shell catalyst (SiO2 @Co@CeO2) with Co nanoparticles between SiO2 core and CeO2 shell was synthesized by strong electrostatic adsorption method. Interestingly, SiO2 @Co@CeO2 catalyst exhibited the outstanding activity/stability toward CO2 reforming of ethanol in comparison with Co-SiO2 catalyst. A bi-functional mechanism involving active sites on CeO2 shell was proposed. Indeed, cobalt nanoparticles between SiO2 core and CeO2 shell maintained the high dispersion because of the confinement effect, which supplied a stable Co-ceria interface area where the reaction occurred. In addition, CO2 could readily react with the O vacancies in CeO2 shell to form surface oxygen species and CO, which allowed a continuous cleaning of coke. These positive factors could make it as an attractive candidate for dry reforming process.",
        "openArchiveArticle": "false",
        "prism:coverDate": "2022-05-25",
        "openaccessUserLicense": null,
        "prism:aggregationType": "Journal",
        "prism:url": "https://api.elsevier.com/content/article/pii/S0926860X22001284",
        "dc:creator": [
          {
            "@_fa": "true",
            "$": "Li, Feifei"
          },
          {
            "@_fa": "true",
            "$": "Wang, Mingyue"
          },
          {
            "@_fa": "true",
            "$": "Zhang, Jinming"
          },
          {
            "@_fa": "true",
            "$": "Lin, Xingtao"
          },
          {
            "@_fa": "true",
            "$": "Wang, Dazhi"
          },
          {
            "@_fa": "true",
            "$": "Cai, Weijie"
          }
        ],
        "link": [
          {
            "@_fa": "true",
            "@rel": "self",
            "@href": "https://api.elsevier.com/content/article/pii/S0926860X22001284"
          },
          {
            "@_fa": "true",
            "@rel": "scidir",
            "@href": "https://www.sciencedirect.com/science/article/pii/S0926860X22001284"
          }
        ],
        "dc:format": "application/json",
        "openaccessType": null,
        "pii": "S0926-860X(22)00128-4",
        "prism:volume": "638",
        "articleNumber": "118605",
        "prism:publisher": "Elsevier B.V.",
        "dc:title": "Sandwich-type Co core@shell nanocomposite (SiO2 @Co@CeO2): Coke resistant catalyst toward CO2 reforming with ethanol",
        "prism:copyright": "© 2022 Elsevier B.V. All rights reserved.",
        "openaccess": "0",
        "prism:issn": "0926860X",
        "dcterms:subject": [
          {
            "@_fa": "true",
            "$": "SiO2 @Co@CeO2"
          },
          {
            "@_fa": "true",
            "$": "Ethanol dry reforming"
          },
          {
            "@_fa": "true",
            "$": "Confinement effect"
          },
          {
            "@_fa": "true",
            "$": "Syngas"
          },
          {
            "@_fa": "true",
            "$": "Coke resistant"
          }
        ],
        "openaccessArticle": "false",
        "prism:publicationName": "Applied Catalysis A: General",
        "openaccessSponsorType": null,
        "prism:pageRange": "118605",
        "pubType": "fla",
        "prism:coverDisplayDate": "25 May 2022",
        "prism:doi": "10.1016/j.apcata.2022.118605",
        "prism:startingPage": "118605",
        "dc:identifier": "doi:10.1016/j.apcata.2022.118605",
        "openaccessSponsorName": null
      },
      "objects": {
        "object": [
          {
            "@category": "standard",
            "@height": "287",
            "@width": "751",
            "@_fa": "true",
            "$": "https://api.elsevier.com/content/object/eid/1-s2.0-S0926860X22001284-gr7.jpg?httpAccept=%2A%2F%2A",
            "@multimediatype": "JPEG image file",
            "@type": "IMAGE-DOWNSAMPLED",
            "@size": "44847",
            "@ref": "gr7",
            "@mimetype": "image/jpeg"
          },
          {
            "@category": "standard",
            "@height": "541",
            "@width": "751",
            "@_fa": "true",
            "$": "https://api.elsevier.com/content/object/eid/1-s2.0-S0926860X22001284-gr6.jpg?httpAccept=%2A%2F%2A",
            "@multimediatype": "JPEG image file",
            "@type": "IMAGE-DOWNSAMPLED",
            "@size": "87769",
            "@ref": "gr6",
            "@mimetype": "image/jpeg"
          },
          {
            "@category": "standard",
            "@height": "582",
            "@width": "751",
            "@_fa": "true",
            "$": "https://api.elsevier.com/content/object/eid/1-s2.0-S0926860X22001284-gr9.jpg?httpAccept=%2A%2F%2A",
            "@multimediatype": "JPEG image file",
            "@type": "IMAGE-DOWNSAMPLED",
            "@size": "117130",
            "@ref": "gr9",
            "@mimetype": "image/jpeg"
          },
          {
            "@category": "standard",
            "@height": "580",
            "@width": "751",
            "@_fa": "true",
            "$": "https://api.elsevier.com/content/object/eid/1-s2.0-S0926860X22001284-gr8.jpg?httpAccept=%2A%2F%2A",
            "@multimediatype": "JPEG image file",
            "@type": "IMAGE-DOWNSAMPLED",
            "@size": "69822",
            "@ref": "gr8",
            "@mimetype": "image/jpeg"
          },
          {
            "@category": "standard",
            "@height": "327",
            "@width": "376",
            "@_fa": "true",
            "$": "https://api.elsevier.com/content/object/eid/1-s2.0-S0926860X22001284-gr3.jpg?httpAccept=%2A%2F%2A",
            "@multimediatype": "JPEG image file",
            "@type": "IMAGE-DOWNSAMPLED",
            "@size": "21390",
            "@ref": "gr3",
            "@mimetype": "image/jpeg"
          },
          {
            "@category": "standard",
            "@height": "598",
            "@width": "751",
            "@_fa": "true",
            "$": "https://api.elsevier.com/content/object/eid/1-s2.0-S0926860X22001284-gr2.jpg?httpAccept=%2A%2F%2A",
            "@multimediatype": "JPEG image file",
            "@type": "IMAGE-DOWNSAMPLED",
            "@size": "155823",
            "@ref": "gr2",
            "@mimetype": "image/jpeg"
          },
          {
            "@category": "standard",
            "@height": "279",
            "@width": "376",
            "@_fa": "true",
            "$": "https://api.elsevier.com/content/object/eid/1-s2.0-S0926860X22001284-gr5.jpg?httpAccept=%2A%2F%2A",
            "@multimediatype": "JPEG image file",
            "@type": "IMAGE-DOWNSAMPLED",
            "@size": "23643",
            "@ref": "gr5",
            "@mimetype": "image/jpeg"
          },
          {
            "@category": "standard",
            "@height": "282",
            "@width": "376",
            "@_fa": "true",
            "$": "https://api.elsevier.com/content/object/eid/1-s2.0-S0926860X22001284-gr4.jpg?httpAccept=%2A%2F%2A",
            "@multimediatype": "JPEG image file",
            "@type": "IMAGE-DOWNSAMPLED",
            "@size": "24452",
            "@ref": "gr4",
            "@mimetype": "image/jpeg"
          },
          {
            "@category": "standard",
            "@height": "316",
            "@width": "376",
            "@_fa": "true",
            "$": "https://api.elsevier.com/content/object/eid/1-s2.0-S0926860X22001284-gr10.jpg?httpAccept=%2A%2F%2A",
            "@multimediatype": "JPEG image file",
            "@type": "IMAGE-DOWNSAMPLED",
            "@size": "29115",
            "@ref": "gr10",
            "@mimetype": "image/jpeg"
          },
          {
            "@category": "standard",
            "@height": "253",
            "@width": "376",
            "@_fa": "true",
            "$": "https://api.elsevier.com/content/object/eid/1-s2.0-S0926860X22001284-gr11.jpg?httpAccept=%2A%2F%2A",
            "@multimediatype": "JPEG image file",
            "@type": "IMAGE-DOWNSAMPLED",
            "@size": "28165",
            "@ref": "gr11",
            "@mimetype": "image/jpeg"
          },
          {
            "@category": "standard",
            "@height": "223",
            "@width": "301",
            "@_fa": "true",
            "$": "https://api.elsevier.com/content/object/eid/1-s2.0-S0926860X22001284-ga1.jpg?httpAccept=%2A%2F%2A",
            "@multimediatype": "JPEG image file",
            "@type": "IMAGE-DOWNSAMPLED",
            "@size": "19481",
            "@ref": "ga1",
            "@mimetype": "image/jpeg"
          },
          {
            "@category": "standard",
            "@height": "577",
            "@width": "754",
            "@_fa": "true",
            "$": "https://api.elsevier.com/content/object/eid/1-s2.0-S0926860X22001284-gr1.jpg?httpAccept=%2A%2F%2A",
            "@multimediatype": "JPEG image file",
            "@type": "IMAGE-DOWNSAMPLED",
            "@size": "128458",
            "@ref": "gr1",
            "@mimetype": "image/jpeg"
          },
          {
            "@category": "standard",
            "@height": "279",
            "@width": "376",
            "@_fa": "true",
            "$": "https://api.elsevier.com/content/object/eid/1-s2.0-S0926860X22001284-sc2.jpg?httpAccept=%2A%2F%2A",
            "@multimediatype": "JPEG image file",
            "@type": "IMAGE-DOWNSAMPLED",
            "@size": "27921",
            "@ref": "sc2",
            "@mimetype": "image/jpeg"
          },
          {
            "@category": "standard",
            "@height": "588",
            "@width": "508",
            "@_fa": "true",
            "$": "https://api.elsevier.com/content/object/eid/1-s2.0-S0926860X22001284-sc1.jpg?httpAccept=%2A%2F%2A",
            "@multimediatype": "JPEG image file",
            "@type": "IMAGE-DOWNSAMPLED",
            "@size": "57620",
            "@ref": "sc1",
            "@mimetype": "image/jpeg"
          },
          {
            "@category": "thumbnail",
            "@height": "84",
            "@width": "219",
            "@_fa": "true",
            "$": "https://api.elsevier.com/content/object/eid/1-s2.0-S0926860X22001284-gr7.sml?httpAccept=%2A%2F%2A",
            "@multimediatype": "GIF image file",
            "@type": "IMAGE-THUMBNAIL",
            "@size": "7259",
            "@ref": "gr7",
            "@mimetype": "image/gif"
          },
          {
            "@category": "thumbnail",
            "@height": "158",
            "@width": "219",
            "@_fa": "true",
            "$": "https://api.elsevier.com/content/object/eid/1-s2.0-S0926860X22001284-gr6.sml?httpAccept=%2A%2F%2A",
            "@multimediatype": "GIF image file",
            "@type": "IMAGE-THUMBNAIL",
            "@size": "12820",
            "@ref": "gr6",
            "@mimetype": "image/gif"
          },
          {
            "@category": "thumbnail",
            "@height": "164",
            "@width": "211",
            "@_fa": "true",
            "$": "https://api.elsevier.com/content/object/eid/1-s2.0-S0926860X22001284-gr9.sml?httpAccept=%2A%2F%2A",
            "@multimediatype": "GIF image file",
            "@type": "IMAGE-THUMBNAIL",
            "@size": "24490",
            "@ref": "gr9",
            "@mimetype": "image/gif"
          },
          {
            "@category": "thumbnail",
            "@height": "164",
            "@width": "212",
            "@_fa": "true",
            "$": "https://api.elsevier.com/content/object/eid/1-s2.0-S0926860X22001284-gr8.sml?httpAccept=%2A%2F%2A",
            "@multimediatype": "GIF image file",
            "@type": "IMAGE-THUMBNAIL",
            "@size": "8348",
            "@ref": "gr8",
            "@mimetype": "image/gif"
          },
          {
            "@category": "thumbnail",
            "@height": "164",
            "@width": "189",
            "@_fa": "true",
            "$": "https://api.elsevier.com/content/object/eid/1-s2.0-S0926860X22001284-gr3.sml?httpAccept=%2A%2F%2A",
            "@multimediatype": "GIF image file",
            "@type": "IMAGE-THUMBNAIL",
            "@size": "7071",
            "@ref": "gr3",
            "@mimetype": "image/gif"
          },
          {
            "@category": "thumbnail",
            "@height": "164",
            "@width": "206",
            "@_fa": "true",
            "$": "https://api.elsevier.com/content/object/eid/1-s2.0-S0926860X22001284-gr2.sml?httpAccept=%2A%2F%2A",
            "@multimediatype": "GIF image file",
            "@type": "IMAGE-THUMBNAIL",
            "@size": "25929",
            "@ref": "gr2",
            "@mimetype": "image/gif"
          },
          {
            "@category": "thumbnail",
            "@height": "163",
            "@width": "219",
            "@_fa": "true",
            "$": "https://api.elsevier.com/content/object/eid/1-s2.0-S0926860X22001284-gr5.sml?httpAccept=%2A%2F%2A",
            "@multimediatype": "GIF image file",
            "@type": "IMAGE-THUMBNAIL",
            "@size": "9543",
            "@ref": "gr5",
            "@mimetype": "image/gif"
          },
          {
            "@category": "thumbnail",
            "@height": "164",
            "@width": "218",
            "@_fa": "true",
            "$": "https://api.elsevier.com/content/object/eid/1-s2.0-S0926860X22001284-gr4.sml?httpAccept=%2A%2F%2A",
            "@multimediatype": "GIF image file",
            "@type": "IMAGE-THUMBNAIL",
            "@size": "8794",
            "@ref": "gr4",
            "@mimetype": "image/gif"
          },
          {
            "@category": "thumbnail",
            "@height": "164",
            "@width": "195",
            "@_fa": "true",
            "$": "https://api.elsevier.com/content/object/eid/1-s2.0-S0926860X22001284-gr10.sml?httpAccept=%2A%2F%2A",
            "@multimediatype": "GIF image file",
            "@type": "IMAGE-THUMBNAIL",
            "@size": "10465",
            "@ref": "gr10",
            "@mimetype": "image/gif"
          },
          {
            "@category": "thumbnail",
            "@height": "147",
            "@width": "219",
            "@_fa": "true",
            "$": "https://api.elsevier.com/content/object/eid/1-s2.0-S0926860X22001284-gr11.sml?httpAccept=%2A%2F%2A",
            "@multimediatype": "GIF image file",
            "@type": "IMAGE-THUMBNAIL",
            "@size": "20369",
            "@ref": "gr11",
            "@mimetype": "image/gif"
          },
          {
            "@category": "thumbnail",
            "@height": "162",
            "@width": "219",
            "@_fa": "true",
            "$": "https://api.elsevier.com/content/object/eid/1-s2.0-S0926860X22001284-ga1.sml?httpAccept=%2A%2F%2A",
            "@multimediatype": "GIF image file",
            "@type": "IMAGE-THUMBNAIL",
            "@size": "26482",
            "@ref": "ga1",
            "@mimetype": "image/gif"
          },
          {
            "@category": "thumbnail",
            "@height": "164",
            "@width": "214",
            "@_fa": "true",
            "$": "https://api.elsevier.com/content/object/eid/1-s2.0-S0926860X22001284-gr1.sml?httpAccept=%2A%2F%2A",
            "@multimediatype": "GIF image file",
            "@type": "IMAGE-THUMBNAIL",
            "@size": "23720",
            "@ref": "gr1",
            "@mimetype": "image/gif"
          },
          {
            "@category": "thumbnail",
            "@height": "163",
            "@width": "219",
            "@_fa": "true",
            "$": "https://api.elsevier.com/content/object/eid/1-s2.0-S0926860X22001284-sc2.sml?httpAccept=%2A%2F%2A",
            "@multimediatype": "GIF image file",
            "@type": "IMAGE-THUMBNAIL",
            "@size": "19806",
            "@ref": "sc2",
            "@mimetype": "image/gif"
          },
          {
            "@category": "thumbnail",
            "@height": "163",
            "@width": "141",
            "@_fa": "true",
            "$": "https://api.elsevier.com/content/object/eid/1-s2.0-S0926860X22001284-sc1.sml?httpAccept=%2A%2F%2A",
            "@multimediatype": "GIF image file",
            "@type": "IMAGE-THUMBNAIL",
            "@size": "13022",
            "@ref": "sc1",
            "@mimetype": "image/gif"
          },
          {
            "@category": "high",
            "@height": "1270",
            "@width": "3326",
            "@_fa": "true",
            "$": "https://api.elsevier.com/content/object/eid/1-s2.0-S0926860X22001284-gr7_lrg.jpg?httpAccept=%2A%2F%2A",
            "@multimediatype": "JPEG image file",
            "@type": "IMAGE-HIGH-RES",
            "@size": "211384",
            "@ref": "gr7",
            "@mimetype": "image/jpeg"
          },
          {
            "@category": "high",
            "@height": "2398",
            "@width": "3326",
            "@_fa": "true",
            "$": "https://api.elsevier.com/content/object/eid/1-s2.0-S0926860X22001284-gr6_lrg.jpg?httpAccept=%2A%2F%2A",
            "@multimediatype": "JPEG image file",
            "@type": "IMAGE-HIGH-RES",
            "@size": "437397",
            "@ref": "gr6",
            "@mimetype": "image/jpeg"
          },
          {
            "@category": "high",
            "@height": "2579",
            "@width": "3326",
            "@_fa": "true",
            "$": "https://api.elsevier.com/content/object/eid/1-s2.0-S0926860X22001284-gr9_lrg.jpg?httpAccept=%2A%2F%2A",
            "@multimediatype": "JPEG image file",
            "@type": "IMAGE-HIGH-RES",
            "@size": "570646",
            "@ref": "gr9",
            "@mimetype": "image/jpeg"
          },
          {
            "@category": "high",
            "@height": "2570",
            "@width": "3326",
            "@_fa": "true",
            "$": "https://api.elsevier.com/content/object/eid/1-s2.0-S0926860X22001284-gr8_lrg.jpg?httpAccept=%2A%2F%2A",
            "@multimediatype": "JPEG image file",
            "@type": "IMAGE-HIGH-RES",
            "@size": "360531",
            "@ref": "gr8",
            "@mimetype": "image/jpeg"
          },
          {
            "@category": "high",
            "@height": "1445",
            "@width": "1663",
            "@_fa": "true",
            "$": "https://api.elsevier.com/content/object/eid/1-s2.0-S0926860X22001284-gr3_lrg.jpg?httpAccept=%2A%2F%2A",
            "@multimediatype": "JPEG image file",
            "@type": "IMAGE-HIGH-RES",
            "@size": "100072",
            "@ref": "gr3",
            "@mimetype": "image/jpeg"
          },
          {
            "@category": "high",
            "@height": "2650",
            "@width": "3326",
            "@_fa": "true",
            "$": "https://api.elsevier.com/content/object/eid/1-s2.0-S0926860X22001284-gr2_lrg.jpg?httpAccept=%2A%2F%2A",
            "@multimediatype": "JPEG image file",
            "@type": "IMAGE-HIGH-RES",
            "@size": "875111",
            "@ref": "gr2",
            "@mimetype": "image/jpeg"
          },
          {
            "@category": "high",
            "@height": "1235",
            "@width": "1663",
            "@_fa": "true",
            "$": "https://api.elsevier.com/content/object/eid/1-s2.0-S0926860X22001284-gr5_lrg.jpg?httpAccept=%2A%2F%2A",
            "@multimediatype": "JPEG image file",
            "@type": "IMAGE-HIGH-RES",
            "@size": "114462",
            "@ref": "gr5",
            "@mimetype": "image/jpeg"
          },
          {
            "@category": "high",
            "@height": "1249",
            "@width": "1663",
            "@_fa": "true",
            "$": "https://api.elsevier.com/content/object/eid/1-s2.0-S0926860X22001284-gr4_lrg.jpg?httpAccept=%2A%2F%2A",
            "@multimediatype": "JPEG image file",
            "@type": "IMAGE-HIGH-RES",
            "@size": "125468",
            "@ref": "gr4",
            "@mimetype": "image/jpeg"
          },
          {
            "@category": "high",
            "@height": "1399",
            "@width": "1663",
            "@_fa": "true",
            "$": "https://api.elsevier.com/content/object/eid/1-s2.0-S0926860X22001284-gr10_lrg.jpg?httpAccept=%2A%2F%2A",
            "@multimediatype": "JPEG image file",
            "@type": "IMAGE-HIGH-RES",
            "@size": "144081",
            "@ref": "gr10",
            "@mimetype": "image/jpeg"
          },
          {
            "@category": "high",
            "@height": "1120",
            "@width": "1663",
            "@_fa": "true",
            "$": "https://api.elsevier.com/content/object/eid/1-s2.0-S0926860X22001284-gr11_lrg.jpg?httpAccept=%2A%2F%2A",
            "@multimediatype": "JPEG image file",
            "@type": "IMAGE-HIGH-RES",
            "@size": "125124",
            "@ref": "gr11",
            "@mimetype": "image/jpeg"
          },
          {
            "@category": "high",
            "@height": "988",
            "@width": "1333",
            "@_fa": "true",
            "$": "https://api.elsevier.com/content/object/eid/1-s2.0-S0926860X22001284-ga1_lrg.jpg?httpAccept=%2A%2F%2A",
            "@multimediatype": "JPEG image file",
            "@type": "IMAGE-HIGH-RES",
            "@size": "168168",
            "@ref": "ga1",
            "@mimetype": "image/jpeg"
          },
          {
            "@category": "high",
            "@height": "2550",
            "@width": "3334",
            "@_fa": "true",
            "$": "https://api.elsevier.com/content/object/eid/1-s2.0-S0926860X22001284-gr1_lrg.jpg?httpAccept=%2A%2F%2A",
            "@multimediatype": "JPEG image file",
            "@type": "IMAGE-HIGH-RES",
            "@size": "662458",
            "@ref": "gr1",
            "@mimetype": "image/jpeg"
          },
          {
            "@category": "high",
            "@height": "1234",
            "@width": "1663",
            "@_fa": "true",
            "$": "https://api.elsevier.com/content/object/eid/1-s2.0-S0926860X22001284-sc2_lrg.jpg?httpAccept=%2A%2F%2A",
            "@multimediatype": "JPEG image file",
            "@type": "IMAGE-HIGH-RES",
            "@size": "121613",
            "@ref": "sc2",
            "@mimetype": "image/jpeg"
          },
          {
            "@category": "high",
            "@height": "2598",
            "@width": "2245",
            "@_fa": "true",
            "$": "https://api.elsevier.com/content/object/eid/1-s2.0-S0926860X22001284-sc1_lrg.jpg?httpAccept=%2A%2F%2A",
            "@multimediatype": "JPEG image file",
            "@type": "IMAGE-HIGH-RES",
            "@size": "253844",
            "@ref": "sc1",
            "@mimetype": "image/jpeg"
          },
          {
            "@category": "standard",
            "@_fa": "true",
            "$": "https://api.elsevier.com/content/object/eid/1-s2.0-S0926860X22001284-mmc1.docx?httpAccept=%2A%2F%2A",
            "@multimediatype": "Microsoft Word file",
            "@type": "APPLICATION",
            "@size": "5498851",
            "@ref": "mmc1",
            "@mimetype": "application/word"
          },
          {
            "@category": "thumbnail",
            "@_fa": "true",
            "$": "https://api.elsevier.com/content/object/eid/1-s2.0-S0926860X22001284-si0003.svg?httpAccept=%2A%2F%2A",
            "@multimediatype": "Scalable Vector Graphics file",
            "@type": "ALTIMG",
            "@size": "4275",
            "@ref": "si0003",
            "@mimetype": "image/svg+xml"
          },
          {
            "@category": "thumbnail",
            "@_fa": "true",
            "$": "https://api.elsevier.com/content/object/eid/1-s2.0-S0926860X22001284-si0004.svg?httpAccept=%2A%2F%2A",
            "@multimediatype": "Scalable Vector Graphics file",
            "@type": "ALTIMG",
            "@size": "1681",
            "@ref": "si0004",
            "@mimetype": "image/svg+xml"
          },
          {
            "@category": "thumbnail",
            "@_fa": "true",
            "$": "https://api.elsevier.com/content/object/eid/1-s2.0-S0926860X22001284-si0005.svg?httpAccept=%2A%2F%2A",
            "@multimediatype": "Scalable Vector Graphics file",
            "@type": "ALTIMG",
            "@size": "1754",
            "@ref": "si0005",
            "@mimetype": "image/svg+xml"
          },
          {
            "@category": "thumbnail",
            "@_fa": "true",
            "$": "https://api.elsevier.com/content/object/eid/1-s2.0-S0926860X22001284-si0006.svg?httpAccept=%2A%2F%2A",
            "@multimediatype": "Scalable Vector Graphics file",
            "@type": "ALTIMG",
            "@size": "3197",
            "@ref": "si0006",
            "@mimetype": "image/svg+xml"
          },
          {
            "@category": "thumbnail",
            "@_fa": "true",
            "$": "https://api.elsevier.com/content/object/eid/1-s2.0-S0926860X22001284-si0007.svg?httpAccept=%2A%2F%2A",
            "@multimediatype": "Scalable Vector Graphics file",
            "@type": "ALTIMG",
            "@size": "1211",
            "@ref": "si0007",
            "@mimetype": "image/svg+xml"
          },
          {
            "@category": "thumbnail",
            "@_fa": "true",
            "$": "https://api.elsevier.com/content/object/eid/1-s2.0-S0926860X22001284-si0008.svg?httpAccept=%2A%2F%2A",
            "@multimediatype": "Scalable Vector Graphics file",
            "@type": "ALTIMG",
            "@size": "968",
            "@ref": "si0008",
            "@mimetype": "image/svg+xml"
          },
          {
            "@category": "thumbnail",
            "@_fa": "true",
            "$": "https://api.elsevier.com/content/object/eid/1-s2.0-S0926860X22001284-si0009.svg?httpAccept=%2A%2F%2A",
            "@multimediatype": "Scalable Vector Graphics file",
            "@type": "ALTIMG",
            "@size": "1580",
            "@ref": "si0009",
            "@mimetype": "image/svg+xml"
          },
          {
            "@category": "thumbnail",
            "@_fa": "true",
            "$": "https://api.elsevier.com/content/object/eid/1-s2.0-S0926860X22001284-si0010.svg?httpAccept=%2A%2F%2A",
            "@multimediatype": "Scalable Vector Graphics file",
            "@type": "ALTIMG",
            "@size": "931",
            "@ref": "si0010",
            "@mimetype": "image/svg+xml"
          },
          {
            "@category": "thumbnail",
            "@_fa": "true",
            "$": "https://api.elsevier.com/content/object/eid/1-s2.0-S0926860X22001284-si0011.svg?httpAccept=%2A%2F%2A",
            "@multimediatype": "Scalable Vector Graphics file",
            "@type": "ALTIMG",
            "@size": "1264",
            "@ref": "si0011",
            "@mimetype": "image/svg+xml"
          },
          {
            "@category": "thumbnail",
            "@_fa": "true",
            "$": "https://api.elsevier.com/content/object/eid/1-s2.0-S0926860X22001284-si0001.svg?httpAccept=%2A%2F%2A",
            "@multimediatype": "Scalable Vector Graphics file",
            "@type": "ALTIMG",
            "@size": "976",
            "@ref": "si0001",
            "@mimetype": "image/svg+xml"
          },
          {
            "@category": "thumbnail",
            "@_fa": "true",
            "$": "https://api.elsevier.com/content/object/eid/1-s2.0-S0926860X22001284-si0012.svg?httpAccept=%2A%2F%2A",
            "@multimediatype": "Scalable Vector Graphics file",
            "@type": "ALTIMG",
            "@size": "1333",
            "@ref": "si0012",
            "@mimetype": "image/svg+xml"
          },
          {
            "@category": "thumbnail",
            "@_fa": "true",
            "$": "https://api.elsevier.com/content/object/eid/1-s2.0-S0926860X22001284-si0013.svg?httpAccept=%2A%2F%2A",
            "@multimediatype": "Scalable Vector Graphics file",
            "@type": "ALTIMG",
            "@size": "1600",
            "@ref": "si0013",
            "@mimetype": "image/svg+xml"
          },
          {
            "@category": "thumbnail",
            "@_fa": "true",
            "$": "https://api.elsevier.com/content/object/eid/1-s2.0-S0926860X22001284-si0002.svg?httpAccept=%2A%2F%2A",
            "@multimediatype": "Scalable Vector Graphics file",
            "@type": "ALTIMG",
            "@size": "1012",
            "@ref": "si0002",
            "@mimetype": "image/svg+xml"
          },
          {
            "@category": "standard",
            "@_fa": "true",
            "$": "https://api.elsevier.com/content/object/eid/1-s2.0-S0926860X22001284-am.pdf?httpAccept=%2A%2F%2A",
            "@multimediatype": "Acrobat PDF file",
            "@type": "AAM-PDF",
            "@size": "1114447",
            "@ref": "am",
            "@mimetype": "application/pdf"
          }
        ]
      },
      "link": {
        "@rel": "abstract",
        "@href": "https://api.elsevier.com/content/abstract/scopus_id/85128511351"
      }
    }
  }
}