{
  "metadata": {
    "title": "Na-doped OMS-2-catalzyed highly selective aerobic oxidation of ethyl lactate to ethyl pyruvate under mild conditions",
    "authors": "; ; ",
    "journal": "Applied Catalysis A: General",
    "date": "2020-09-05",
    "doi": "10.1016/j.apcata.2020.117813",
    "abstract": "",
    "uri": "https://api.elsevier.com/content/article/pii/S0926860X20304063",
    "pii": "S0926860X20304063"
  },
  "fulltext": {
    "full-text-retrieval-response": {
      "scopus-eid": "2-s2.0-85090725730",
      "originalText": "serial JL 271346 291210 291744 291809 31 Applied Catalysis A: General APPLIEDCATALYSISAGENERAL 2020-09-01 2020-09-01 2020-09-12 2020-09-12 2020-10-08T16:52:38 1-s2.0-S0926860X20304063 S0926-860X(20)30406-3 S0926860X20304063 10.1016/j.apcata.2020.117813 S300 S300.1 FULL-TEXT 1-s2.0-S0926860X20X00159 2024-01-01T12:34:28.416125Z 0 0 20200905 2020 2020-09-01T16:55:55.047446Z absattachment articleinfo articlenumber articletitlenorm authfirstinitialnorm authfirstsurnamenorm cid cids contenttype copyright crossmark dateloaded dateloadedtxt datesearch datesort dateupdated dco docsubtype doctype doi eid ewtransactionid hubeid indexeddate issn issnnorm itemstage itemtransactionid itemweight openaccess openarchive pg pgfirst pii piinorm pubdatestart pubdatetxt pubyr sortorder srctitle srctitlenorm srctype ssids alllist content subj subheadings suppl tomb volfirst volissue volumelist webpdf webpdfpagecount yearnav figure table e-component body acknowledge affil appendices articletitle auth authfirstini authfull authkeywords authlast grantnumber grantsponsor grantsponsorid highlightsabst orcid primabst ref specialabst 0926-860X 0926860X true 605 605 C Volume 605 16 117813 117813 117813 20200905 5 September 2020 2020-09-05 2020 article fla © 2020 Elsevier B.V. All rights reserved. NADOPEDOMS2CATALZYEDHIGHLYSELECTIVEAEROBICOXIDATIONETHYLLACTATEETHYLPYRUVATEUNDERMILDCONDITIONS TAO L 1 Introduction 2 Experimental section 2.1 Materials 2.2 Catalyst preparation 2.3 Catalyst characterization 2.4 Typical reaction procedure 3 Results and discussion 3.1 Catalytic performance 3.2 Catalyst characterization 3.3 Catalyst recycling 3.4 Proposed mechanism 4 Conclusion CRediT authorship contribution statement Acknowledgements Appendix A Supplementary data References SHELDON 2014 950 963 R CORMA 2007 2411 2502 A TEONG 2019 5753 5780 S MA 2019 74 86 J MURLYKINA 2015 4481 4492 M XU 2008 169 175 P SUGIYAMA 2009 129 134 S MULLER 2010 1845 1853 A DENNIG 2015 7503 7506 A BOZKURT 2016 1044 1049 F SUGIYAMA 1991 12 18 S ZHANG 2017 553 562 B ZHANG 2018 840 850 L ZHAO 2016 217 224 X ZHANG 2018 3737 3747 W LIU 2017 3014 3022 K HAYASHI 1993 207 217 H ZHANG 2018 2365 2374 W ZHANG 2019 3381 3387 W ZHANG 2018 1866 1873 W LU 2018 1287 1296 T DOKE 2019 117246 D SUIB 2008 479 487 S LIU 2020 213109 X ELMACI 2016 8812 8821 G CYMES 2019 117310 B LIU 2019 1026 1036 X ELMACI 2019 17995 18006 G NAJAFPOUR 2016 16948 16954 M ELMACI 2017 56 59 G ELMACI 2019 632 640 G ELMACI 2015 117 121 G WANG 2016 1940 1945 M YAMAGUCHI 2012 544 547 K JIA 2016 974 978 X FERLIN 2020 397 403 F WANG 2020 S HUANG 2020 939 945 Y MENG 2016 890 896 X MENG 2015 372 379 X LI 2018 8048 8054 X GENUINO 2018 6493 6502 H SUBRAMANIAN 2014 33911 33922 N JAKUBEK 2019 105807 T BI 2020 360 371 X LIU 2020 175 180 X LI 2019 6074 6079 B SHEN 2019 58 63 J LIU 2018 4264 4273 S RONG 2018 1799 1812 S DAVIS 2013 17 45 S LIU 2018 115 125 P RAMOSFERNANDEZ 2014 3358 3363 E UEMATSU 2016 222 233 T JU 2019 1281 1292 Y TAOX2020X117813 TAOX2020X117813XL 2022-09-12T00:00:00.000Z 2022-09-12T00:00:00.000Z http://creativecommons.org/licenses/by-nc-nd/4.0/ © 2020 Elsevier B.V. All rights reserved. 2020-08-31T06:08:52.478Z http://vtw.elsevier.com/data/voc/AddOnTypes/50.7/eoas YIPA Youth Innovation Promotion Association http://data.elsevier.com/vocabulary/SciValFunders/501100012492 http://sws.geonames.org/1814991 National Natural Science Foundation of China http://data.elsevier.com/vocabulary/SciValFunders/501100001809 http://sws.geonames.org/1814991 item S0926-860X(20)30406-3 S0926860X20304063 1-s2.0-S0926860X20304063 10.1016/j.apcata.2020.117813 271346 2024-01-01T12:34:28.416125Z 2020-09-05 1-s2.0-S0926860X20304063-main.pdf https://s3-eu-west-1.amazonaws.com/prod-ucs-content-store-eu-west/content/pii:S0926860X20304063/MAIN/application/pdf/891de2aedf6d0acb8f3bb6578d69464a/main.pdf main.pdf pdf true 2615531 MAIN 7 1-s2.0-S0926860X20304063-main_1.png https://s3-eu-west-1.amazonaws.com/prod-ucs-content-store-eu-west/content/pii:S0926860X20304063/PREVIEW/image/png/d1749635412621c1f04e60cad0a58815/main_1.png main_1.png png 55901 849 656 IMAGE-WEB-PDF 1 1-s2.0-S0926860X20304063-gr9.jpg https://s3-eu-west-1.amazonaws.com/prod-ucs-content-store-eu-west/content/pii:S0926860X20304063/gr9/DOWNSAMPLED/image/jpeg/8f44b4051c8a33076e181b7fb54a192a/gr9.jpg gr9 gr9.jpg jpg 49952 180 717 IMAGE-DOWNSAMPLED 1-s2.0-S0926860X20304063-gr10.jpg https://s3-eu-west-1.amazonaws.com/prod-ucs-content-store-eu-west/content/pii:S0926860X20304063/gr10/DOWNSAMPLED/image/jpeg/a83191ce3e9d1ecbb00abfe2796b3de5/gr10.jpg gr10 gr10.jpg jpg 25032 188 717 IMAGE-DOWNSAMPLED 1-s2.0-S0926860X20304063-gr11.jpg https://s3-eu-west-1.amazonaws.com/prod-ucs-content-store-eu-west/content/pii:S0926860X20304063/gr11/DOWNSAMPLED/image/jpeg/d80d721c549934361e4861ec4ad05416/gr11.jpg gr11 gr11.jpg jpg 51697 379 661 IMAGE-DOWNSAMPLED 1-s2.0-S0926860X20304063-gr7.jpg https://s3-eu-west-1.amazonaws.com/prod-ucs-content-store-eu-west/content/pii:S0926860X20304063/gr7/DOWNSAMPLED/image/jpeg/2bf9ba417568fec55c9e9af4aa7c7ba4/gr7.jpg gr7 gr7.jpg jpg 18263 266 340 IMAGE-DOWNSAMPLED 1-s2.0-S0926860X20304063-gr8.jpg https://s3-eu-west-1.amazonaws.com/prod-ucs-content-store-eu-west/content/pii:S0926860X20304063/gr8/DOWNSAMPLED/image/jpeg/366602490ac7e12ee23f76bdfdd3fcd4/gr8.jpg gr8 gr8.jpg jpg 27017 271 340 IMAGE-DOWNSAMPLED 1-s2.0-S0926860X20304063-gr5.jpg https://s3-eu-west-1.amazonaws.com/prod-ucs-content-store-eu-west/content/pii:S0926860X20304063/gr5/DOWNSAMPLED/image/jpeg/8ff0411a8ce08ef3693576984a6ac466/gr5.jpg gr5 gr5.jpg jpg 16255 270 340 IMAGE-DOWNSAMPLED 1-s2.0-S0926860X20304063-gr6.jpg https://s3-eu-west-1.amazonaws.com/prod-ucs-content-store-eu-west/content/pii:S0926860X20304063/gr6/DOWNSAMPLED/image/jpeg/a290745055ceb78c4ff98212151db7b3/gr6.jpg gr6 gr6.jpg jpg 18915 293 340 IMAGE-DOWNSAMPLED 1-s2.0-S0926860X20304063-gr3.jpg https://s3-eu-west-1.amazonaws.com/prod-ucs-content-store-eu-west/content/pii:S0926860X20304063/gr3/DOWNSAMPLED/image/jpeg/42b12b66fef8ffebc0a14ff0bc4ce899/gr3.jpg gr3 gr3.jpg jpg 22737 283 340 IMAGE-DOWNSAMPLED 1-s2.0-S0926860X20304063-gr12.jpg https://s3-eu-west-1.amazonaws.com/prod-ucs-content-store-eu-west/content/pii:S0926860X20304063/gr12/DOWNSAMPLED/image/jpeg/70e26c6b39af1d0841a422f1a530dfcb/gr12.jpg gr12 gr12.jpg jpg 17769 257 340 IMAGE-DOWNSAMPLED 1-s2.0-S0926860X20304063-gr4.jpg https://s3-eu-west-1.amazonaws.com/prod-ucs-content-store-eu-west/content/pii:S0926860X20304063/gr4/DOWNSAMPLED/image/jpeg/5a99d59990632d3d3b619109476fd645/gr4.jpg gr4 gr4.jpg jpg 16361 258 340 IMAGE-DOWNSAMPLED 1-s2.0-S0926860X20304063-gr13.jpg https://s3-eu-west-1.amazonaws.com/prod-ucs-content-store-eu-west/content/pii:S0926860X20304063/gr13/DOWNSAMPLED/image/jpeg/ab056a68725a324329c37a62a3e49d4d/gr13.jpg gr13 gr13.jpg jpg 18069 273 340 IMAGE-DOWNSAMPLED 1-s2.0-S0926860X20304063-gr1.jpg https://s3-eu-west-1.amazonaws.com/prod-ucs-content-store-eu-west/content/pii:S0926860X20304063/gr1/DOWNSAMPLED/image/jpeg/f6a4a06baa04e94287038aaf74d31b65/gr1.jpg gr1 gr1.jpg jpg 19214 260 340 IMAGE-DOWNSAMPLED 1-s2.0-S0926860X20304063-gr2.jpg https://s3-eu-west-1.amazonaws.com/prod-ucs-content-store-eu-west/content/pii:S0926860X20304063/gr2/DOWNSAMPLED/image/jpeg/993c6b94cfd3d33f8e7760dc0b025941/gr2.jpg gr2 gr2.jpg jpg 17424 260 340 IMAGE-DOWNSAMPLED 1-s2.0-S0926860X20304063-ga1.jpg https://s3-eu-west-1.amazonaws.com/prod-ucs-content-store-eu-west/content/pii:S0926860X20304063/ga1/DOWNSAMPLED/image/jpeg/22cbd29636be7bd134eb2ee6cd99f077/ga1.jpg ga1 true ga1.jpg jpg 20666 200 325 IMAGE-DOWNSAMPLED 1-s2.0-S0926860X20304063-gr9.sml https://s3-eu-west-1.amazonaws.com/prod-ucs-content-store-eu-west/content/pii:S0926860X20304063/gr9/THUMBNAIL/image/gif/8ec410a5eb2a5cc669039bdd7b29382d/gr9.sml gr9 gr9.sml sml 8682 55 219 IMAGE-THUMBNAIL 1-s2.0-S0926860X20304063-gr10.sml https://s3-eu-west-1.amazonaws.com/prod-ucs-content-store-eu-west/content/pii:S0926860X20304063/gr10/THUMBNAIL/image/gif/fd496848d7dffd567f1e26ae42156081/gr10.sml gr10 gr10.sml sml 3500 57 219 IMAGE-THUMBNAIL 1-s2.0-S0926860X20304063-gr11.sml https://s3-eu-west-1.amazonaws.com/prod-ucs-content-store-eu-west/content/pii:S0926860X20304063/gr11/THUMBNAIL/image/gif/1ab06be9d562f12c9924b5a955c61e23/gr11.sml gr11 gr11.sml sml 8664 126 219 IMAGE-THUMBNAIL 1-s2.0-S0926860X20304063-gr7.sml https://s3-eu-west-1.amazonaws.com/prod-ucs-content-store-eu-west/content/pii:S0926860X20304063/gr7/THUMBNAIL/image/gif/fc5ed2a2744bda871a5af04893ebdb27/gr7.sml gr7 gr7.sml sml 9973 164 209 IMAGE-THUMBNAIL 1-s2.0-S0926860X20304063-gr8.sml https://s3-eu-west-1.amazonaws.com/prod-ucs-content-store-eu-west/content/pii:S0926860X20304063/gr8/THUMBNAIL/image/gif/653de67f56cabb7b83d6669c24e45976/gr8.sml gr8 gr8.sml sml 12960 164 206 IMAGE-THUMBNAIL 1-s2.0-S0926860X20304063-gr5.sml https://s3-eu-west-1.amazonaws.com/prod-ucs-content-store-eu-west/content/pii:S0926860X20304063/gr5/THUMBNAIL/image/gif/2198534d895e80c925a5d53753214584/gr5.sml gr5 gr5.sml sml 7931 164 206 IMAGE-THUMBNAIL 1-s2.0-S0926860X20304063-gr6.sml https://s3-eu-west-1.amazonaws.com/prod-ucs-content-store-eu-west/content/pii:S0926860X20304063/gr6/THUMBNAIL/image/gif/3d3ef364e908bde76ce93c923308244e/gr6.sml gr6 gr6.sml sml 9046 164 190 IMAGE-THUMBNAIL 1-s2.0-S0926860X20304063-gr3.sml https://s3-eu-west-1.amazonaws.com/prod-ucs-content-store-eu-west/content/pii:S0926860X20304063/gr3/THUMBNAIL/image/gif/04ff29c53c02bebbfbcaf27afe6b0db7/gr3.sml gr3 gr3.sml sml 10579 164 197 IMAGE-THUMBNAIL 1-s2.0-S0926860X20304063-gr12.sml https://s3-eu-west-1.amazonaws.com/prod-ucs-content-store-eu-west/content/pii:S0926860X20304063/gr12/THUMBNAIL/image/gif/6a4f99a9011af545b0d18f66c6f930db/gr12.sml gr12 gr12.sml sml 9988 164 217 IMAGE-THUMBNAIL 1-s2.0-S0926860X20304063-gr4.sml https://s3-eu-west-1.amazonaws.com/prod-ucs-content-store-eu-west/content/pii:S0926860X20304063/gr4/THUMBNAIL/image/gif/8532d7629e4626226f7e7f4059952db4/gr4.sml gr4 gr4.sml sml 9711 164 216 IMAGE-THUMBNAIL 1-s2.0-S0926860X20304063-gr13.sml https://s3-eu-west-1.amazonaws.com/prod-ucs-content-store-eu-west/content/pii:S0926860X20304063/gr13/THUMBNAIL/image/gif/a86b6b2f2f29a32c42efa565d2e9298b/gr13.sml gr13 gr13.sml sml 5923 164 204 IMAGE-THUMBNAIL 1-s2.0-S0926860X20304063-gr1.sml https://s3-eu-west-1.amazonaws.com/prod-ucs-content-store-eu-west/content/pii:S0926860X20304063/gr1/THUMBNAIL/image/gif/f9b384035dfe4baf3e6d721a29a53987/gr1.sml gr1 gr1.sml sml 12878 164 215 IMAGE-THUMBNAIL 1-s2.0-S0926860X20304063-gr2.sml https://s3-eu-west-1.amazonaws.com/prod-ucs-content-store-eu-west/content/pii:S0926860X20304063/gr2/THUMBNAIL/image/gif/d2d9ec7dff63e05456bf424a32299bb8/gr2.sml gr2 gr2.sml sml 10166 164 214 IMAGE-THUMBNAIL 1-s2.0-S0926860X20304063-ga1.sml https://s3-eu-west-1.amazonaws.com/prod-ucs-content-store-eu-west/content/pii:S0926860X20304063/ga1/THUMBNAIL/image/gif/40d8c5552206f00854ea0c2263dd2b86/ga1.sml ga1 true ga1.sml sml 10485 135 219 IMAGE-THUMBNAIL 1-s2.0-S0926860X20304063-gr9_lrg.jpg https://s3-eu-west-1.amazonaws.com/prod-ucs-content-store-eu-west/content/pii:S0926860X20304063/gr9/HIGHRES/image/jpeg/cef19fb4742f49274313851cf0f0c752/gr9_lrg.jpg gr9 gr9_lrg.jpg jpg 798786 799 3175 IMAGE-HIGH-RES 1-s2.0-S0926860X20304063-gr10_lrg.jpg https://s3-eu-west-1.amazonaws.com/prod-ucs-content-store-eu-west/content/pii:S0926860X20304063/gr10/HIGHRES/image/jpeg/e26cc444e8159875d06033ac8ca1b700/gr10_lrg.jpg gr10 gr10_lrg.jpg jpg 180836 832 3175 IMAGE-HIGH-RES 1-s2.0-S0926860X20304063-gr11_lrg.jpg https://s3-eu-west-1.amazonaws.com/prod-ucs-content-store-eu-west/content/pii:S0926860X20304063/gr11/HIGHRES/image/jpeg/22dc86758e185c48044eb2ebcf11b942/gr11_lrg.jpg gr11 gr11_lrg.jpg jpg 399056 1679 2925 IMAGE-HIGH-RES 1-s2.0-S0926860X20304063-gr7_lrg.jpg https://s3-eu-west-1.amazonaws.com/prod-ucs-content-store-eu-west/content/pii:S0926860X20304063/gr7/HIGHRES/image/jpeg/4e05d64dc9c1e837da4b8539be8ea611/gr7_lrg.jpg gr7 gr7_lrg.jpg jpg 225052 1180 1508 IMAGE-HIGH-RES 1-s2.0-S0926860X20304063-gr8_lrg.jpg https://s3-eu-west-1.amazonaws.com/prod-ucs-content-store-eu-west/content/pii:S0926860X20304063/gr8/HIGHRES/image/jpeg/b78ec752e4006bffa3ca008b0f6d6c55/gr8_lrg.jpg gr8 gr8_lrg.jpg jpg 407958 1201 1508 IMAGE-HIGH-RES 1-s2.0-S0926860X20304063-gr5_lrg.jpg https://s3-eu-west-1.amazonaws.com/prod-ucs-content-store-eu-west/content/pii:S0926860X20304063/gr5/HIGHRES/image/jpeg/2b91b7c0de628281039278ce86de043d/gr5_lrg.jpg gr5 gr5_lrg.jpg jpg 286823 1198 1508 IMAGE-HIGH-RES 1-s2.0-S0926860X20304063-gr6_lrg.jpg https://s3-eu-west-1.amazonaws.com/prod-ucs-content-store-eu-west/content/pii:S0926860X20304063/gr6/HIGHRES/image/jpeg/58199bead196e20852a02b4493c0415b/gr6_lrg.jpg gr6 gr6_lrg.jpg jpg 235091 1298 1508 IMAGE-HIGH-RES 1-s2.0-S0926860X20304063-gr3_lrg.jpg https://s3-eu-west-1.amazonaws.com/prod-ucs-content-store-eu-west/content/pii:S0926860X20304063/gr3/HIGHRES/image/jpeg/90e4ec68288798e339b3ec0afe4a9805/gr3_lrg.jpg gr3 gr3_lrg.jpg jpg 351751 1255 1508 IMAGE-HIGH-RES 1-s2.0-S0926860X20304063-gr12_lrg.jpg https://s3-eu-west-1.amazonaws.com/prod-ucs-content-store-eu-west/content/pii:S0926860X20304063/gr12/HIGHRES/image/jpeg/c609f37c5ada03aa5bba3d1aad37edf5/gr12_lrg.jpg gr12 gr12_lrg.jpg jpg 265417 1141 1508 IMAGE-HIGH-RES 1-s2.0-S0926860X20304063-gr4_lrg.jpg https://s3-eu-west-1.amazonaws.com/prod-ucs-content-store-eu-west/content/pii:S0926860X20304063/gr4/HIGHRES/image/jpeg/7c3adbb3fd3680b420aadf27f63c8c67/gr4_lrg.jpg gr4 gr4_lrg.jpg jpg 286211 1146 1508 IMAGE-HIGH-RES 1-s2.0-S0926860X20304063-gr13_lrg.jpg https://s3-eu-west-1.amazonaws.com/prod-ucs-content-store-eu-west/content/pii:S0926860X20304063/gr13/HIGHRES/image/jpeg/37e020c99cced99bacb651a57c5ee941/gr13_lrg.jpg gr13 gr13_lrg.jpg jpg 124303 1210 1508 IMAGE-HIGH-RES 1-s2.0-S0926860X20304063-gr1_lrg.jpg https://s3-eu-west-1.amazonaws.com/prod-ucs-content-store-eu-west/content/pii:S0926860X20304063/gr1/HIGHRES/image/jpeg/1aa03265a2097f4d352cd95bfe18a4f1/gr1_lrg.jpg gr1 gr1_lrg.jpg jpg 261287 1152 1508 IMAGE-HIGH-RES 1-s2.0-S0926860X20304063-gr2_lrg.jpg https://s3-eu-west-1.amazonaws.com/prod-ucs-content-store-eu-west/content/pii:S0926860X20304063/gr2/HIGHRES/image/jpeg/99722c7124ea9754ff1a46eb8b3f3080/gr2_lrg.jpg gr2 gr2_lrg.jpg jpg 285544 1154 1508 IMAGE-HIGH-RES 1-s2.0-S0926860X20304063-ga1_lrg.jpg https://s3-eu-west-1.amazonaws.com/prod-ucs-content-store-eu-west/content/pii:S0926860X20304063/ga1/HIGHRES/image/jpeg/b8c691758a77710d2a4332727716690f/ga1_lrg.jpg ga1 true ga1_lrg.jpg jpg 154533 886 1441 IMAGE-HIGH-RES 1-s2.0-S0926860X20304063-mmc1.docx https://s3-eu-west-1.amazonaws.com/prod-ucs-content-store-eu-west/content/pii:S0926860X20304063/mmc1/MAIN/application/vnd.openxmlformats-officedocument.wordprocessingml.document/82560f1909c4fdd0aa9aa4153be2e3e4/mmc1.docx mmc1 mmc1.docx docx 3337343 APPLICATION 1-s2.0-S0926860X20304063-am.pdf am am.pdf pdf 5302223 AAM-PDF https://s3-eu-west-1.amazonaws.com/prod-ucs-content-store-eu-west/content/egi:10VR9SQLJS7/MAIN/application/pdf/f596472e855b6fb7705c364ef39b297d/am.pdf APCATA 117813 117813 S0926-860X(20)30406-3 10.1016/j.apcata.2020.117813 Elsevier B.V. Fig. 1 Effect of reaction solvent on conversion of EL to EP. Reaction conditions: 2 mL of solvent, 0.5 mmol of EL, 40 mg (10 mol%) of OMS-2, 90 °C, 12 h, O2 balloon. Fig. 1 Fig. 2 Effect of green oxidants and anaerobic conditions on conversion of EL to EP catalyzed by OMS-2. Reaction conditions: 2 mL of MeNO2, 0.5 mmol of EL, 40 mg of OMS-2, 90 °C, 12 h (For interpretation of the references to colour in this figure legend, the reader is referred to the web version of this article). Fig. 2 Fig. 3 Catalytic performance of OMS-2-based catalysts on conversion of EL to EP. Reaction conditions: 2 mL of MeNO2, 0.5 mmol of EL, 40 mg of catalyst, 90 °C, 12 h, O2 balloon. Fig. 3 Fig. 4 Effect of reaction temperature on conversion of EL to EP catalyzed by Na-OMS-2-10 mol%. Reaction conditions: 2 mL of MeNO2, 0.5 mmol of EL, 80 mg (0.2 eq.) of Na-OMS-2-10 mol%, 12 h, O2 balloon. Fig. 4 Fig. 5 Effect of dopant loading of Na-OMS-2 on conversion of EL to EP. Reaction conditions: 2 mL of MeNO2, 0.5 mmol of EL, 80 mg (20 mol%) of Na-OMS-2-xmol%, 12 h, 50 °C, O2 balloon. Fig. 5 Fig. 6 Reaction profile of the aerobic oxidative conversion of EL to EP. Reaction conditions: 4 mL of MeNO2, 0.5 mmol of EL, 80 mg (20 mol%) of Na-OMS-2-2.5 mol%, 12 h, 50 °C, O2 balloon. Fig. 6 Fig. 7 Reaction profile and initial rate of the aerobic oxidative conversion of EL to EP over OMS-2 and Na-OMS-2-2.5 mol%. Reaction conditions: 4 mL of MeNO2, 0.5 mmol of EL, 80 mg (20 mol%) of OMS-2 or Na-OMS-2-2.5 mol%, 12 h, 50 °C, O2. Fig. 7 Fig. 8 XRD patterns of OMS-2 and Na-doped OMS-2 catalysts. Fig. 8 Fig. 9 SEM images of Na-OMS-2-2.5 mol%. Fig. 9 Fig. 10 H2-TPR, CO2-TPD and TGA profiles of OMS-2 and Na-OMS-2-2.5 mol%. Fig. 10 Fig. 11 The Mn2p XPS patterns of as-synthesized materials (left) and the O1 s XPS. patterns of as-synthesized materials (right). Fig. 11 Fig. 12 The recycling experiments over 5 runs. Reaction conditions: 10 mL of MeNO2, 2.5 mmol of EL, 0.4 g (20 mol%) of Na-OMS-2-2.5 mol%, 16 h, O2. Fig. 12 Fig. 13 The proposed mechanism. Fig. 13 Table 1 Catalytic performance comparison of oxidative EL conversion to EP over heterogeneous catalysts in liquid-phase with previous reports. Table 1 Catalyst Temp. (oC) Oxidant Con. (%) Sel. (%) Ref. Na-OMS-2 50 O2 78 95 This work ZrO2 130 O2 52 83 [17] SnO2-MoO3 130 O2 62 80 [17] V-TiO2 130 O2 60 85 [18] V-NCNs 130 O2 95 85 [19] VOx/C + pyridine 130 O2 80 90 [20] TS-1 50 H2O2 98 95 [21] V2O5 80 TBHP 98 100 [22] VO(acac)2 25 TBHP 99 100 [22] TiO2 130 O2 70 80 [53] Zn(NO3)2+VOC2O4 80 O2 98 98 [55] Table 2 The Mn2p XPS data of the as-synthesized materials. Table 2 Catalyst Binding energy of Mn 2p (eV) Manganese species (%) Mn4+ Mn3+ Mn2+ Mn4+ Mn3+ Mn2+ OMS-2 643.36 642.44 641.04 60.1 35.5 4.4 Na-OMS-2-1 mol% 643.77 642.33 641.08 39.4 44.5 16.1 Na-OMS-2-2.5 mol% 643.81 642.11 640.71 40.3 38.8 20.9 Na-OMS-2-5 mol% 643.95 642.18 640.86 42.3 40.4 17.3 Na-OMS-2-10 mol% 644.03 642.22 640.86 41.9 42.1 16.0 Table 3 The O 1s XPS data of the as-synthesized materials. Table 3 Catalyst Binding energy of Mn 2p (eV) Oxygen species (%) Lattice O Surface O Lattice O Surface O OMS-2 530.03 531.12 66.4 33.6 Na-OMS-2-1 mol% 529.67 531.37 78.0 22.0 Na-OMS-2-2.5 mol% 529.58 531.30 78.7 21.3 Na-OMS-2-5 mol% 529.55 531.29 77.3 22.7 Na-OMS-2-10 mol% 529.59 531.34 76.7 23.3 Na-doped OMS-2-catalzyed highly selective aerobic oxidation of ethyl lactate to ethyl pyruvate under mild conditions Luyao Tao Investigation Data curation Writing - original draft a b Xiuru Bi Investigation Formal analysis a b Liping Zhang Formal analysis a b Gexin Chen Data curation Formal analysis a Peiqing Zhao Funding acquisition a Jun-Li Yang Supervision Conceptualization Project administration c * Xu Meng Supervision Conceptualization Project administration Writing - original draft Writing - review & editing a * a State Key Laboratory for Oxo Synthesis and Selective Oxidation, Suzhou Research Institute of LICP, Lanzhou Institute of Chemical Physics (LICP), Chinese Academy of Sciences, Lanzhou 730000, China State Key Laboratory for Oxo Synthesis and Selective Oxidation Suzhou Research Institute of LICP Lanzhou Institute of Chemical Physics (LICP) Chinese Academy of Sciences Lanzhou 730000 China State Key Laboratory for Oxo Synthesis and Selective Oxidation, Suzhou Research Institute of LICP, Lanzhou Institute of Chemical Physics (LICP), Chinese Academy of Sciences, Lanzhou 730000, China b University of Chinese Academy of Sciences, Beijing 100049, China University of Chinese Academy of Sciences Beijing 100049 China University of Chinese Academy of Sciences, Beijing 100049, China c CAS Key Laboratory of Chemistry of Northwestern Plant Resources, Key Laboratory for Natural Medicine of Gansu Province, Lanzhou Institute of Chemical Physics, Chinese Academy of Sciences (CAS), Lanzhou 730000, China CAS Key Laboratory of Chemistry of Northwestern Plant Resources Key Laboratory for Natural Medicine of Gansu Province Lanzhou Institute of Chemical Physics Chinese Academy of Sciences (CAS) Lanzhou 730000 China CAS Key Laboratory of Chemistry of Northwestern Plant Resources, Key Laboratory for Natural Medicine of Gansu Province, Lanzhou Institute of Chemical Physics, Chinese Academy of Sciences (CAS), Lanzhou 730000, P. R. China ⁎ Corresponding author. Graphical abstract The direct oxidation of lactate to pyruvate is an important process for catalytic conversion of biomass, although low selectivity and harsh reaction conditions limit its potential for industrial application. In this study, catalytic oxidation of ethyl lactate (EL) to ethyl pyruvate (EP) over OMS-2-based materials was conducted using O2 as the green oxidant. A 78 % EL conversion and 95 % EP selectivity were obtained in CH3NO2 at 50 °C over a Na-doped OMS-2 catalyst. The conversion and selectivity of the reaction were affected by the dopant loading of catalyst and reaction temperature. Kinetic study found that original OMS-2 showed slightly higher initial reaction rate than modified OMS-2, and the latter gave higher EP yield due to its more labile lattice oxygen. Characterization of the catalyst indicates that the enhancement of surface oxygen vacancies and reducibility from the Na-doping might contribute to the superior catalytic activity. Keywords Biomass conversion Catalytic oxidation OMS-2 Ethyl lactate Ethyl pyruvate 1 Introduction As a sustainable carbon source, lignocellulosic biomass recently has attracted increasing attention due to the potential replacement of fossil raw [1,2]. Various platform molecules derived from biomass can be converted to valuable chemicals via catalytic transformation [3,4]. Among them, pyruvic acid and pyruvate can be converted to important chemicals and intermediates that are already used in pharmaceutical, food additives, perfume, plastic and electronic material industrials [5–7]. They are also employed as raw for the synthesis of bioactive compounds, like antivirus and anticancer drugs [8,9]. Moreover, pyruvates are used as a dietary supplement in food industry [10]. The traditional and commercial pathway for producing pyruvates employs tartaric acid as raw material via the dehydrative decarboxylation [11]. However, the use of excess dehydrating reagent KHSO4 results into serious environmental pollution and energy consumption, which is incompatible with green chemistry. Microbial fermentation using yeasts has been developed, although strict control of process parameters and difficulties of product isolation and purification decrease its practicality [12]. Thus, there is an incentive to explore catalytic and clean transformation to overcome the aforementioned drawbacks. Direct catalytic oxidation of lactates in gas- or liquid-phase is an atom-economic option for the production of pyruvates. Mo-based catalysts and V2O5/TiO2 were prepared and studied in oxidation of lactates in vapor-phase with O2 as the green oxidant [13–16]. Nevertheless, requirement of high reaction temperature (generally above 200 °C) not only decreased the selectivity of the reaction, but also increased the production cost of the process. Liquid-phase oxidation of lactates to pyruvates over catalysts with various oxidants has emerged. For example, Hayashi with co-workers studied catalytic performance of various transition metals on the oxidation of ethyl lactate (EL) to ethyl pyruvate (EP) at 130 °C, which shows high EP selectivity could only be obtained at low EL conversion and the yield of EP was no more than 50 % [17]. Later on, Shiju`s group prepared mesoporous vanadia-titania, V-N-doped carbon nanosheet and activated carbon-supported vanadia, and found that they could be used as efficient heterogeneous catalysts in the oxidation of EL with O2 as the green oxidant at 130 °C [18–20]. Zhou`s group reported a TS-1/H2O2 catalytic system for the oxidation of EL with high conversion and selectivity under very mild conditions [21]. Very recently, V2O5 and VO(acac)2 were successfully applied in EL oxidation at 80 °C or even room temperature when TBHP was employed as an efficient oxidant [22]. Although selective conversion of EL to EP by catalytic oxidative dehydrogenation has been realized, peroxides, additives and complex catalysts are still needed. O2 that is most abundant and cheapest oxidant has relatively high activation barrier, and is generally activated by noble metal, like Pd and Pt, under mild conditions. In this respect, the development of a highly selective process for oxidative conversion of EL to EP over a non-noble catalyst with molecular oxygen as efficient green oxidant under mild conditions (≤50 °C) is challenging and promising. Manganese oxide octahedral molecular sieve (OMS-2) is a microporous nanostructural material which is composed of edge- and corner-shared MnO6 octahedra [23]. It has unique mixed-valence of Mn (Mn4+, Mn3+ and Mn2+) and a 2 × 2 open tunnel structure with K+ inside that maintains the framework and balances the valence. Due to its structural properties, redox ability, adsorption and semiconductivity, OMS-2 has been applied as catalysts, ion-exchange agents, battery materials and adsorption materials [24–32]. In terms of clean synthesis and environmental catalysis, OMS-2-based materials have been widely used as heterogeneous oxidation catalysts because of readily activation of green oxidant (like O2) via electron transfer between mixed valent Mnn+ and O2 [33–40]. Rich amounts of surface oxygen vacancies, mobile lattice oxygen and superior redox ability are commonly believed to be beneficial for its catalytic activity in aerobic oxidative conversion. As a consequence, alternative preparation and modification methods of OMS-2 have been developed for enhancement of its catalytic activity [41–44]. In our previous research, the use of different oxidants during OMS-2 preparation and doping with transition metals both were able to better the catalytic performance of OMS-2 in clean synthesis of organic compounds [45–48]. Herein, we conducted oxidation of EL to EP using O2 as the terminal oxidant catalyzed by OMS-2 and a series of modified ones. It was found that the direct aerobic oxidation over Na-doped OMS-2 (Na-OMS-2) showed the highest conversion of EL and excellent selectivity of EP when the reaction was performed at 50 °C. Based on characterization of as-synthesized catalysts, the abundant surface oxygen vacancies, enhanced reducibility and labile lattice oxygen on Na-OMS-2 might be responsible for the good catalytic performance. 2 Experimental section 2.1 Materials KMnO4, MnSO4·H2O, NaNO3, ethyl lactate, ethyl pyruvate, CH3NO2, dimethyl carbonate (DMF), EtOH (anhydrous), N,N-dimethylformamide (DMF), PhCl, toluene and acetonitrile were purchased from China and used without further purification. OMS-2, δ-MnO2, AMO and CuOx/OMS-2 were all synthesized by literature methods [40,49,50]. V-OMS-2 and Mo-OMS-2 were synthesized by one-pot reflux method (For details, see SI). 2.2 Catalyst preparation In a round bottom flask, MnSO4·H2O (17.6 g, 0.104 mol) and NaNO3 (0.336 g, 0.004 mol) was dissolved in 60 mL of deionized water followed by addition of 6 mL of HNO3 at room temperature. Then, a 200 mL of KMnO4 (11.78 g, 0.074 mol) solution was added dropwise into the above solution with stirring at room temperature. The mixture was stirred at 100 °C for 24 h. After that, the brown solid was collected by filtration and washed by water. The solid material was dried in an oven under air at 120 °C for 8 h. Finally, the theoretical Na/Mn mole ratio was 2.5 % and the as-synthesized material was named as Na-OMS-2−2.5 mol%. For comparison, different amounts of NaNO3 (0.0016, 0.008 and 0.016 mol) were used following the same preparation method to produce Na-OMS-2−1 mol%, Na-OMS-2−5 mol% and Na-OMS-2−10 mol%, respectively. 2.3 Catalyst characterization The crystal phase of as-prepared catalysts was analyzed by power X-ray diffraction (XRD) employing a X-Pert PRO X-ray diffractometer with Cu Kα radiation in the 2θ range of 10−90°. The X-ray photoelectron spectroscopy (XPS) measurements were conducted on a Kratos AXIS Ultra DLD high performance electron spectrometer with nonmonochromatized Al Kα excitation source (hv =1486.6 eV). Binding energies were calibrated by using the contaminant carbon (C1 s = 284.8 eV). Nitrogen adsorption-desorption measurements were carried out at 76 K using an ASAP 2020 M analyzer utilizing the BET model for the calculation of specific surface areas. Tecnai G2 F20 S-Twin 200 KV high-resolution transmission electron microscopy and EVO 18 scanning electron microscope were used to characterize the morphology of catalysts. The elemental composition analysis towards the catalysts was examined by inductively coupled plasma emission spectroscopy (ICP-AES) on Varian Vista MPX. The reducibility of the catalysts was analyzed by H2-TPR. 50 mg of OMS-2 or Na-OMS-2-2.5 mol% was replaced in a quartz reactor which was connected to a TPR instrument and the reactor was heated to 550 °C with a heating rate of 10 °C/min. The reducing atmosphere was 5% H2/N2 with a flow rate of 30 mL/min. The outlet gas was analyzed by TCD. The basicity of the catalysts was analyzed by the use of CO2-TPD. 50 mg of OMS-2 or Na-OMS-2−2.5 mol% was replaced in a quartz reactor and heated in Ar at 400 °C for 2 h. Then, the sample was cooled down to 100 °C and saturated with CO2 gas in a flow rate of 30 mL/min of 10 % CO2/Ar for 1 h. After, the sample was flushed with Ar at 100 °C for 1 h and heated in Ar to 400 °C at ramp rate of 10 °C/min. The evolution of CO2 was analyzed by TCD. TGA was performed on a METTLER TGA/DSC 1. The sample was heated under N2 from R.T. to 1000 °C at a rate of 5 °C/min. The heat flow data were dynamically normalized using the instantaneous weight of the sample at the respective temperature. 2.4 Typical reaction procedure In a typical reaction, Na-OMS-2 (80 mg, 20 mol%) was added into a Schlenk tube with an O2 balloon. The air in the reaction tube was removed and replaced by O2. After that, ethyl lactate (0.5 mmol) and CH3NO2 (2 mL) were added into the tube by syringe. The reaction mixture was allowed to stir at 50 °C for 12 h under oxygen. The reaction was monitored and analyzed by gas chromatography (GC) and 1,4-dioxane was used as internal standard. 3 Results and discussion 3.1 Catalytic performance Initially, we used traditional reflux method to synthesize original OMS-2 catalyst and conducted the oxidation of EL over it under 1 atm of O2 for optimization of reaction solvent (Fig. 1 ). The reaction did not give any desired product EP in the absence of solvent, although OMS-2 showed catalytic activity. When green solvents, such as DMC and EtOH, were used, the low yields of EP were observed. Next, it was found that polar solvents, like DMF, PhCl, toluene and acetonitrile, did not better the reaction, though moderate conversion of EL was offered and the highest selectivity of EP (61 %) was obtained in MeCN. To our delight, the highest 80 % conversion of EL and a 58 % selectivity of EP were provided when MeNO2 was employed as the solvent. In order to better the reaction, other green oxidants, like air and hydrogen peroxide, were tested (Fig. 2 ). Air led to a slightly higher selectivity, but decreased the conversion of EL significantly. H2O2 was deleterious to the reaction showing a 56 % conversion. Finally, we ran the reaction under anaerobic conditions. The reaction under N2 gave low conversion and moderate selectivity, which indicates that the oxygen species of OMS-2 could give a 27 % conversion. The experimental results proved that the reaction under O2 was aerobic and probably followed the Mars-van Krevelen mechanism [35]. So, molecular oxygen was the best green oxidant. After the optimization of the reaction solvent and oxidant, a series of manganese oxides and modified OMS-2 materials were screened as the catalyst in the oxidation of EL to EP in MeNO2 at 90 °C under O2 (Fig. 3 ). Compared with OMS-2 having a-MnO2 phase, δ-MnO2 and amorphous MnOx (AMO) only resulted into moderate conversion and selectivity, although AMO gave a better selectivity (64 %) than OMS-2. Acid-modified one (H-OMS-2) only showed similar catalytic performance like AMO, which means acid sites are not beneficial for the conversion of EL to EP. Mo and V, that were generally used as catalyst species in previous reports [15,18], doped OMS-2 both did not further enhance the conversion and selectivity of the reaction. CuOx/OMS-2, that reportedly has enhanced redox ability due to the synergistic effect between Cu and Mn, just offered a 37 % conversion and 53 % selectivity. According the previous research towards selective oxidative dehydrogenation of alcohols, solid base catalysts were able to improve the transformation [51]. Based on the report from Liu`s group, Na ion could make OMS-2 possess basicity and higher redox ability, which enhanced the activity for gas-phase ethanol oxidation [52]. Thus, we tried to prepare Na-doped OMS-2 via ion-exchange in one-pot procedure and use it as the catalyst in aerobic oxidative dehydrogenation of EL. Interestingly, Na doping gave the highest 93 % conversion of EL and highest 73 % selectivity of EP. Furthermore, a better result on EL conversion (93 %) was given by doubling the amount of catalyst from 10 mol% to 20 mol%. These observations indicate that Na doping could enhance the catalytic activity and higher loading of catalyst (20 mol%) led to higher conversion of EL (93 %). However, higher catalyst loading resulted into the significant decrease of selectivity of EP (from 73 % to 53 %). According the previous research on optimization of EL aerobic oxidation, high reaction temperature usually led to high conversion of EL and low selectivity of EP [17–20]. In order to enhance the selectivity, efforts had been paid to proceed the reaction under mild conditions [21,22]. After we got the highest conversion of EL by the use of Na-OMS-2-10 mol% (0.2 eq. to substrate), lower temperatures were investigated (Fig.4 ). Na-OMS-2-10 mol% was very active, and a moderate conversion and a remarkable selectivity in 86 % were offered even at room temperature. As we expected, the conversion of EL gradually decreased with the decrease of reaction temperature and the selectivity of EP gradually increased. When the reaction was run at 50 °C in MnNO2 under O2, the good selectivity in 77 % and 84 % conversion were obtained (the yield of EP is 65 %). From the respect of EP yield, this catalytic result was same as the result from the use of 10 mol% of Na-OMS-2-10 mol% catalyst at 90 °C. Thus, the optimized reaction temperature was determined as 50 °C. Lastly, we investigated the effect of Na dopant loading on catalytic performance (Fig. 5 ). Through tuning the amount of NaNO3 used in the synthesis of Na-OMS-2, Na-OMS-2-1 mol%, Na-OMS-2-2.5 mol% and Na-OMS-2-5 mol% were also prepared. It was found that the catalytic performance of Na-OMS-2-xmol% was influenced by dopant loading severely (Fig. 5). The dopant loadings of 5 mol% and 10 mol% had very similar catalytic activity and selectivity. With dopant loading decreased from 10 mol% to 1 mol%, the conversion of EL under the optimized reaction conditions decreased from 84 % to 62 % and the selectivity of EP increased from 77 % to 98 %. For Na-OMS-2 catalysts doped by 1 mol% and 2.5 mol% of NaNO3, they both showed nearly 100 % selectivity, but Na-OMS-2−2.5 mol% gave the higher conversion than the former and afforded the highest 74 % yield of EP. Considering the yields around 60 % from other Na-doped catalysts, Na-OMS-2-2.5 mol% demonstrated the best catalytic performance. Under the optimized conditions, the reaction progress was monitored by the time-profile experiment at 50 °C (Fig. 6 ). Ethyl lactate converted very fast in initial period and reached the highest conversion after around 200 min. After that, the conversion of EL slowly increased to 78 %. The yield of EP smoothly raised with the increase of conversion of EL and the selectivity of EP nearly reached to 100 % after 500 min. From the analysis of GC, there was no by-products or over-oxidized products in the reaction. In order to further investigate the catalytic performance, we run the reaction over original OMS-2 at 50 °C and compared the initial reaction rate of it and Na-OMS-2-2.5 mol% under the optimized reaction conditions. As shown in Fig. 7 , original OMS-2 gave a higher initial reaction rate (0.065) than Na-OMS-2-2.5 mol% (0.035). However, the yield of EP over OMS-2 did not increase and stopped at about 50 %, although the reaction time was extended to 600 min. Na-OMS-2-2.5 mol% with lower initial reaction rate provided the higher yield of EP in 70 % during the same reaction period. Lastly, we compared our catalytic result with the previous reports that used heterogeneous catalysts in liquid-phase and the comparison was listed in Table 1 . The results from the present work feature the merits including green oxidant, mild conditions and high selectivity. 3.2 Catalyst characterization After finding out the best catalyst, we characterized the catalysts in order to understand the catalytic performance. Firstly, XRD was used to analyze the composition and crystal phase of Na-OMS-2-xmol% materials (Fig. 8 ). Na-OMS-2 with dopant loading ranging from 1 to 10 mol% all showed typical cryptomelane phase (JCPDS file #29-1020) and there were no other diffraction peaks and peak shift observed. With the increase of dopant loading, the diffraction peaks became increasingly sharp and narrow, which means that the crystal size and crystalline of Na-doped materials became larger and stronger than original OMS-2. These results indicate that Na ion possibly substituted partial K ion in tunnel of OMS-2 framework because eight-coordinated cations with large crystal radius size are easily introduced into the tunnel [54]. Compared with original OMS-2, Na-doping enhanced the surface area of the catalyst from 59 to 86 m2 g−1 (Table S1, in SI). Then, SEM and TEM images showed that the optimized catalyst Na-OMS-2-2.5 mol% had uniform nano-rod morphology which is same as original OMS-2 (Fig. 9 and Fig. S2 in SI). It is believed that the doping did not change the morphology of the catalyst. H2-TPR and CO2-TPD were used to examine the surface reducibility and basicity of optimal catalyst (Na-OMS-2-2.5 mol%). For comparison, original OMS-2 was also tested. As shown in Fig. 10 , Na-doped OMS-2 and original OMS-2 had very similar reduction patterns and they both showed a board peak range 200−450 °C which means the reduction of MnO2 to MnO occurred. Obviously, the reduction peak of Na-OMS-2-2.5 mol% shifted to lower temperatures (200 °C) compared with that of OMS-2 (250 °C). The results indicate that Na-doped OMS-2 was easier to reduce and had enhanced reducibility [52]. Next, CO2-TPR analysis proved that Na-doped OMS-2 had more basic sites and higher basicity than original OMS-2. It is believed that enhanced reducibility resulted in higher activity and higher conversion of EP in the oxidation of EL. And, basicity generated from Na-doping might help cleavage of hydroxyl OH bond of ethyl lactate when it was adsorbed on the catalyst surface [52]. The thermal stability was analyzed under N2 by TGA/DSC, which showed that OMS-2 and Na-doped OMS-2 had nearly same patterns of weight losses in the temperature of 25−780 °C. Specifically, physisorbed water was lost at 50−200 °C, chemisorbed O2 and H2O were lost at 380−550 °C and lattice oxygen species were released at 580−600 °C. When the temperature was above 620 °C, the framework of OMS-2 was collapsed and decomposed. The TGA analysis results was consistent with the previous report and Na-doping did not change the thermal stability of the material [23]. In heterogeneous catalytic oxidation, the oxygen and metal species on the catalysts surface are believed to be critical for the catalytic performance [41]. So, XPS was employed to analyze the oxygen and manganese species of original OMS-2 and Na-doped OMS-2 with different dopant loading (Fig. 11 and Fig. S3 in SI). From Mn2p XPS patterns of the catalyst, Na doping decreased the amounts of Mn4+ of Na-OMS-2-xmol% compared with original OMS-2, which means more oxygen vacancies were generated on Na-OMS-2-xmol%. Na doping also lowered the Mn valence from 3.83 to 3.40 (Table S2, in SI). Among them, Na-OMS-2-2.5 mol% had the most abundant of low valent manganese species. And, the dopant loading did not obviously affect the concentration of different valent Mn (Table 2 ). Surface oxygen vacancy is generally accepted to be critical for aerobic oxidation, because O2 is captured and activated by it to form active oxygen species to proceed the reaction. From O1 s XPS patterns of the catalyst, Na doping enhanced the amount of lattice oxygen (Table 3 ). It is believed that the lattice oxygen became much more labile by Na doping. These results of XPS were in accordance with the observation of H2-TPR. The enhanced redox ability is related to absorbed active oxygen species which is generated from oxygen absorbed on oxygen vacancies and activated by Mnn+/Mn(n−1)+ species. 3.3 Catalyst recycling To confirm whether the catalysis was derived from the solid material or leached metal species, we performed the hot-filtration experiment (Fig. S5, in SI). The catalyst was removed via filtration, when the reaction showed a conversion of EL in roughly 56 %. Then, the filtrate was kept stirring at 50 °C for another 7 h and no further conversion of EL detected, which proves that the observed catalysis was truly heterogeneous. Subsequently, the recycling experiment was carried out by the use of 2.5 mmol of EL and 400 mg of Na-OMS-2-2.5 mol% under the optimized conditions (Fig. 12 ). It was found that the selectivity of the reaction maintained very well (above 95 %), however, the conversion of EL decreased after the first run and was stable at around 50 % in the third and next runs. We analyzed the reaction solution by ICP-AES after removing the catalyst in the first run and no sodium or potassium species was detected (below 0.001 %) in the filtrate. However, 366 ppm of manganese was detected. The metal leaching might cause the deactivation of the catalyst. 3.4 Proposed mechanism On the basis of our experimental results (Fig. 2) and previous reports, we proposed a possible reaction mechanism which is consistent with Mars-van Krevelen mechanism (Fig. 13 ) [13,18,33,35]. Initially, ethyl lactate adsorbed on the catalyst surface via active site Mnn+, and oxygen species was adsorbed and activated by oxygen vacancies. The hydrogen atom of hydroxyl group was captured by surface activated oxygen species and the secondary H atom was caught by the lattice oxygen of Mn-O bond to generate the EL radical and reduced Mn(n−1)+. After dissociation, the desired product ethyl pyruvate and H2O were formed while the surface oxygen vacancies of the catalyst were generated. Finally, the reduced catalyst was reoxidized by O2 and adsorbed oxygen replenished the oxygen vacancies, regenerating the highly active oxygen to finish the catalytic cycle. 4 Conclusion It was found that OMS-2-based catalysts were highly active for the conversion of ethyl lactate to ethyl pyruvate in liquid-phase and Na-doped OMS-2 could further better the selectivity of the reaction to roughly 100 %. Moreover, O2 could be activated by the catalyst playing a role as the terminal oxidant instead of peroxide at very mild reaction temperature because Na-doping enhanced the amount of oxygen vacancies, reducibility and lattice oxygen lability. The catalytic system offers an atom-economic, environmental friendly and practical process for catalytic conversion of biomass platform molecules. Enhancement of catalytic ability of manganese oxide-based catalysts via unreducible metal-doping provides a new pathway for exploration of organic transformation and increasing the reaction selectivity. CRediT authorship contribution statement Luyao Tao: Investigation, Data curation, Writing - original draft. Xiuru Bi: Investigation, Formal analysis. Liping Zhang: Formal analysis. Gexin Chen: Data curation, Formal analysis. Peiqing Zhao: Funding acquisition. Jun-Li Yang: Supervision, Conceptualization, Project administration. Xu Meng: Supervision, Conceptualization, Project administration, Writing - original draft, Writing - review & editing. Declaration of Competing Interest The authors reported no declarations of interest. Acknowledgements This work was supported by the National Natural Science Foundation of China (21403256, 21573261); the Youth Innovation Promotion Association CAS (2018456); National Key Research and Development Project (2018YFE0182500); CAS “Light of West China” Program; CAS Pioneer Hundred Talents; and LICP Cooperation Foundation for Young Scholars (HZJJ20-10). Appendix A Supplementary data Supplementary material related to this article can be found, in the online version, at doi:https://doi.org/10.1016/j.apcata.2020.117813. Appendix A Supplementary data The following is Supplementary data to this article: References [1] R.A. Sheldon Green Chem. 16 2014 950 963 R.A. Sheldon, Green Chem. 16 (2014) 950-963. [2] A. Corma S. Iborra A. Velty Chem. Rev. 107 2007 2411 2502 A. Corma, S. Iborra, A. Velty, Chem. Rev. 107 (2007) 2411-2502. [3] S.P. Teong X. Li Y. Zhang Green Chem. 21 2019 5753 5780 S.P. Teong, X. Li, Y. Zhang, Green Chem. 21 (2019) 5753-5780. [4] J. Ma S. Shi X. Jia F. Xia H. Ma J. Gao J. Xu J. Energy Chem. 36 2019 74 86 J. Ma, S. Shi, X. Jia, F. Xia, H. Ma, J. Gao, J. Xu, J. Energy Chem. 36 (2019) 74-86. [5] M.V. Murlykina Y.I. Sakhno S.M. Desenko S.V. Shishkina O.V. Shishkin D.O. Sysoiev M.N. Kornet D. Schols J.L. Goeman J. Van der Eycken E.V. Van der Eycken V.A. Chebanov Eur. J. Org. Chem. 2015 4481 4492 M.V. Murlykina, Y.I. Sakhno, S.M. Desenko, S.V. Shishkina, O.V. Shishkin, D.O. Sysoiev, M.N. Kornet, D. Schols, J.L. Goeman, J. Van der Eycken, E.V. Van der Eycken, V.A. Chebanov, Eur. J. Org. Chem. (2015) 4481-4492. [6] P. Xu J. Qiu C. Gao C. Ma J. Biosci. Bioeng. 105 2008 169 175 P. Xu, J. Qiu, C. Gao, C. Ma, J. Biosci. Bioeng. 105 (2008) 169-175. [7] S. Sugiyama T. Kikumoto H. Tanaka K. Nakagawa K.-I. Sotowa K. Maehara Y. Himeno W. Ninomiya Catal. Lett. 131 2009 129 134 S. Sugiyama, T. Kikumoto, H. Tanaka, K. Nakagawa, K.-I. Sotowa, K. Maehara, Y. Himeno, W. Ninomiya, Catal. Lett. 131 (2009) 129-134. [8] A.J. Muller J.B. DuHadaway D. Jaller P. Curtis R. Metz G.C. Prendergast Cancer Res. 70 2010 1845 1853 A.J. Muller, J.B. DuHadaway, D. Jaller, P. Curtis, R. Metz, G.C. Prendergast, Cancer Res. 70 (2010) 1845-1853. [9] A. Dennig E. Busto W. Kroutil K. Faber ACS Catal. 5 2015 7503 7506 A. Dennig, E. Busto, W. Kroutil, K. Faber, ACS Catal. 5 (2015) 7503-7506. [10] F. Bozkurt F. Tornuk O.S. Toker S. Karasu M. Arici M.Z. Durak LWT-Food Sci. Technol. 65 2016 1044 1049 F. Bozkurt, F. Tornuk, O.S. Toker, S. Karasu, M. Arici, M.Z. Durak, LWT-Food Sci. Technol. 65 (2016) 1044-1049. [11] S. Sugiyama J. Catal. 129 1991 12 18 S. Sugiyama, J. Catal. 129 (1991) 12-18. [12] B. Zhang Y. Zhu J. Zhang D. Wang L. Sun J. Hong Bioresource Technol. 224 2017 553 562 B. Zhang, Y. Zhu, J. Zhang, D. Wang, L. Sun, J. Hong, Bioresource Technol. 224 (2017) 553-562. [13] L. Zhang R. Wang L. Song X. Zhao Q. Fan H. Li Q. Yu X. Li J. Zeng C. Zhang T. Liu Z. Wang Catal. Lett. 149 2018 840 850 L. Zhang, R. Wang, L. Song, X. Zhao, Q. Fan, H. Li, Q. Yu, X. Li, J. Zeng, C. Zhang, T. Liu, Z. Wang, Catal. Lett. 149 (2018) 840-850. [14] X. Zhao C. Zhang C. Xu H. Li H. Huang L. Song X. Li Chem. Eng. J. 296 2016 217 224 X. Zhao, C. Zhang, C. Xu, H. Li, H. Huang, L. Song, X. Li, Chem. Eng. J. 296 (2016) 217-224. [15] W. Zhang G. Innocenti M. Ferbinteanu E.V. Ramos-Fernandez A. Sepulveda-Escribano H. Wu F. Cavani G. Rothenberg N.R. Shiju Catal. Sci. Technol. 8 2018 3737 3747 W. Zhang, G. Innocenti, M. Ferbinteanu, E.V. Ramos-Fernandez, A. Sepulveda-Escribano, H. Wu, F. Cavani, G. Rothenberg, N.R. Shiju, Catal. Sci. Technol. 8 (2018) 3737-3747. [16] K. Liu X. Huang E.A. Pidko E.J.M. Hensen Green Chem. 19 2017 3014 3022 K. Liu, X. Huang, E.A. Pidko, E.J.M. Hensen, Green Chem. 19 (2017) 3014-3022. [17] H. Hayashi S. Sugiyama Y. Katayama K. Sakai M. Sugino N. Shigemoto J. Mol. Catal. 83 1993 207 217 H. Hayashi, S. Sugiyama, Y. Katayama, K. Sakai, M. Sugino, N. Shigemoto, J. Mol. Catal. 83 (1993) 207-217. [18] W. Zhang G. Innocenti P. Oulego V. Gitis H. Wu B. Ensing F. Cavani G. Rothenberg N.R. Shiju ACS Catal. 8 2018 2365 2374 W. Zhang, G. Innocenti, P. Oulego, V. Gitis, H. Wu, B. Ensing, F. Cavani, G. Rothenberg, N.R. Shiju, ACS Catal. 8 (2018) 2365-2374. [19] W. Zhang P. Oulego T.K. Slot G. Rothenberg N.R. Shiju ChemCatChem 11 2019 3381 3387 W. Zhang, P. Oulego, T.K. Slot, G. Rothenberg, N.R. Shiju, ChemCatChem 11 (2019) 3381-3387. [20] W. Zhang B. Ensing G. Rothenberg N.R. Shiju Green Chem. 20 2018 1866 1873 W. Zhang, B. Ensing, G. Rothenberg, N.R. Shiju, Green Chem. 20 (2018) 1866-1873. [21] T. Lu J. Zou Y. Zhan X. Yang Y. Wen X. Wang L. Zhou J. Xu ACS Catal. 8 2018 1287 1296 T. Lu, J. Zou, Y. Zhan, X. Yang, Y. Wen, X. Wang, L. Zhou, J. Xu, ACS Catal. 8 (2018) 1287-1296. [22] D.S. Doke S.B. Khomane S.L. Pandhare M.K. Dongare F. Dumeignil S.B. Umbarkar Appl. Catal. A: Gen. 587 2019 117246 D.S. Doke, S.B. Khomane, S.L. Pandhare, M.K. Dongare, F. Dumeignil, S.B. Umbarkar, Appl. Catal. A: Gen. 587 (2019) 117246. [23] S.L. Suib Acc. Chem. Res. 41 2008 479 487 S.L. Suib, Acc. Chem. Res. 41 (2008) 479-487. [24] X. Liu N. Li M. Li H. Chen N. Zhang Y. Wang K. Zheng Coord. Chem. Rev. 404 2020 213109 X. Liu, N. Li, M. Li, H. Chen, N. Zhang, Y. Wang, K. Zheng, Coord. Chem. Rev. 404 (2020) 213109. [25] G. Elmacı C.E. Frey P. Kurz B. Zümreoğlu-Karan J. Mater. Chem. A 4 2016 8812 8821 G. Elmacı, C.E. Frey, P. Kurz, B. Zümreoğlu-Karan, J. Mater. Chem. A, 4 (2016) 8812-8821. [26] B.A. Cymes C.B. Almquist M.P.S. Krekeler Appl. Catal. A: Gen. 598 2019 117310 B. A. Cymes, C. B. Almquist, M. P. S. Krekeler, Appl. Catal. A: Gen. 598 (2019) 117310. [27] X. Liu Y. Huang X. Meng J. Li D. Wang Y. Chen D. Tang B. Chen Synlett 30 2019 1026 1036 X. Liu, Y. Huang, X. Meng, J. Li, D. Wang, Y. Chen, D. Tang, B. Chen, Synlett 30 (2019) 1026-1036. [28] G. Elmacı A.S. Ertürk M. Sevim Ö. Metin Int. J. Hydro. Energy 44 2019 17995 18006 G. Elmacı, A.S. Ertürk, M. Sevim, Ö. Metin, Int. J. Hydro. Energy 44 (2019) 17995-18006. [29] M.M. Najafpour S.M. Hosseini Dalton Trans. 45 2016 16948 16954 M. M. Najafpour, S. M. Hosseini, Dalton Trans. 45 (2016) 16948-16954. [30] G. Elmaci D. Ozer B. Zümreoglu-Karan Catal. Comm. 89 2017 56 59 G. Elmaci, D. Ozer, B. Zümreoglu-Karan, Catal. Comm. 89 (2017) 56-59. [31] G. Elmaci S. Cerci D. Sunar-Cerci J. Mol. Structure 1195 2019 632 640 G. Elmaci, S. Cerci, D. Sunar-Cerci, J. Mol. Structure 1195 (2019) 632-640. [32] G. Elmaci O. Icten A.N. Ay B. Zümreoglu-Karan Appl. Clay Sci. 107 2015 117 121 G. Elmaci, O. Icten, A. N. Ay, B. Zümreoglu-Karan, Appl. Clay Sci. 107 (2015) 117-121. [33] M. Wang J. Ma M. Yu Z. Zhang F. Wang Catal. Sci. Technol. 6 2016 1940 1945 M. Wang, J. Ma, M. Yu, Z. Zhang, F. Wang, Catal. Sci. Technol. 6 (2016) 1940-1945. [34] K. Yamaguchi H. Kobayashi T. Oishi N. Mizuno Angew. Chem. Int. Ed. Engl. 51 2012 544 547 K. Yamaguchi, H. Kobayashi, T. Oishi, N. Mizuno, Angew. Chem. Int. Ed. Engl. 51 (2012) 544-547. [35] X. Jia J. Ma M. Wang H. Ma C. Chen J. Xu Green Chem. 18 2016 974 978 X. Jia, J. Ma, M. Wang, H. Ma, C. Chen, J. Xu, Green Chem. 18 (2016) 974-978. [36] F. Ferlin P.M. Luque Navarro Y. Gu D. Lanari L. Vaccaro Green Chem. 22 2020 397 403 F. Ferlin, P.M. Luque Navarro, Y. Gu, D. Lanari, L. Vaccaro, Green Chem. 22 (2020) 397-403. [37] S. Wang Y. Huang X. Meng X. Liu Inorg. Chem. Commun. 117 2020 S. Wang, Y. Huang, X. Meng, X. Liu, Inorg. Chem. Commun. 117 (2020). [38] Y. Huang K. Zheng X. Liu X. Meng D. Astruc Inorg. Chem. Front. 7 2020 939 945 Y. Huang, K. Zheng, X. Liu, X. Meng, D. Astruc, Inorg. Chem. Front. 7 (2020) 939-945. [39] X. Meng J. Zhang B. Chen Z. Jing P. Zhao Catal. Sci. Technol. 6 2016 890 896 X. Meng, J. Zhang, B. Chen, Z. Jing, P. Zhao, Catal. Sci. Technol. 6 (2016) 890-896. [40] X. Meng C. Yu G. Chen P. Zhao Catal. Sci. Technol. 5 2015 372 379 X. Meng, C. Yu, G. Chen, P. Zhao, Catal. Sci. Technol. 5 (2015) 372-379. [41] X. Li J. Ma X. Jia F. Xia Y. Huang Y. Xu J. Xu ACS Sus. Chem. Eng. 6 2018 8048 8054 X. Li, J. Ma, X. Jia, F. Xia, Y. Huang, Y. Xu, J. Xu, ACS Sus. Chem. Eng. 6 (2018) 8048-8054. [42] H.C. Genuino D. Valencia S.L. Suib Catal. Sci. Technol. 8 2018 6493 6502 H.C. Genuino, D. Valencia, S.L. Suib, Catal. Sci. Technol. 8 (2018) 6493-6502. [43] N. Subramanian B. Viswanathan T.K. Varadarajan RSC Adv. 4 2014 33911 33922 N. Subramanian, B. Viswanathan, T.K. Varadarajan, RSC Adv. 4 (2014) 33911-33922. [44] T. Jakubek C. Hudy P. Indyka E. Nowicka S. Golunski A. Kotarba Catal. Commun. 132 2019 105807 T. Jakubek, C. Hudy, P. Indyka, E. Nowicka, S. Golunski, A. Kotarba, Catal. Commun. 132 (2019) 105807. [45] X. Bi T. Tang X. Meng M. Gou X. Liu P. Zhao Catal. Sci. Technol. 10 2020 360 371 X. Bi, T. Tang, X. Meng, M. Gou, X. Liu, P. Zhao, Catal. Sci. Technol. 10 (2020) 360-371. [46] X. Liu Y. Huang P. Zhao X. Meng D. Astruc ChemCatChem 12 2020 175 180 X. Liu, Y. Huang, P. Zhao, X. Meng, D. Astruc, ChemCatChem 12 (2020) 175-180. [47] B. Li X. Bi J. Zhou C. Li P. Zhao X. Meng ChemistrySelect 4 2019 6074 6079 B. Li, X. Bi, J. Zhou, C. Li, P. Zhao, X. Meng, ChemistrySelect 4 (2019) 6074-6079. [48] J. Shen X. Meng Catal. Commun. 127 2019 58 63 J. Shen, X. Meng, Catal. Commun. 127 (2019) 58-63. [49] S. Liu J. Ji Y. Yu H. Huang Catal. Sci. Technol. 8 2018 4264 4273 S. Liu, J. Ji, Y. Yu, H. Huang, Catal. Sci. Technol. 8 (2018) 4264-4273. [50] S. Rong K. Li P. Zhang F. Liu J. Zhang Catal. Sci. Technol. 8 2018 1799 1812 S. Rong, K. Li, P. Zhang, F. Liu, J. Zhang, Catal. Sci. Technol. 8 (2018) 1799-1812. [51] S.E. Davis M.S. Ide R.J. Davis Green Chem. 15 2013 17 45 S.E. Davis, M.S. Ide, R.J. Davis, Green Chem. 15 (2013) 17-45. [52] P. Liu J. Duan Q. Ye F. Mei Z. Shu H. Chen J. Catal. 367 2018 115 125 P. Liu, J. Duan, Q. Ye, F. Mei, Z. Shu, H. Chen, J. Catal. 367 (2018) 115-125. [53] E.V. Ramos-Fernandez N.J. Geels N.R. Shiju G. Rothenberg Green Chem. 16 2014 3358 3363 E.V. Ramos-Fernandez, N.J. Geels, N.R. Shiju, G. Rothenberg, Green Chem. 16 (2014) 3358-3363. [54] T. Uematsu Y. Miyamoto Y. Ogasawara K. Suzuki K. Yamaguchi N. Mizuno Catal. Sci. Technol. 6 2016 222 233 T. Uematsu, Y. Miyamoto, Y. Ogasawara, K. Suzuki, K. Yamaguchi, N. Mizuno, Catal. Sci. Technol. 6 (2016) 222-233. [55] Y. Ju Z. Du C. Xiao X. Li S. Li Molecules 24 2019 1281 1292 Y. Ju, Z. Du, C. Xiao, X. Li, S. Li, Molecules 24 (2019) 1281-1292.",
      "scopus-id": "85090725730",
      "coredata": {
        "eid": "1-s2.0-S0926860X20304063",
        "dc:description": "The direct oxidation of lactate to pyruvate is an important process for catalytic conversion of biomass, although low selectivity and harsh reaction conditions limit its potential for industrial application. In this study, catalytic oxidation of ethyl lactate (EL) to ethyl pyruvate (EP) over OMS-2-based materials was conducted using O2 as the green oxidant. A 78 % EL conversion and 95 % EP selectivity were obtained in CH3NO2 at 50 °C over a Na-doped OMS-2 catalyst. The conversion and selectivity of the reaction were affected by the dopant loading of catalyst and reaction temperature. Kinetic study found that original OMS-2 showed slightly higher initial reaction rate than modified OMS-2, and the latter gave higher EP yield due to its more labile lattice oxygen. Characterization of the catalyst indicates that the enhancement of surface oxygen vacancies and reducibility from the Na-doping might contribute to the superior catalytic activity.",
        "openArchiveArticle": "false",
        "prism:coverDate": "2020-09-05",
        "openaccessUserLicense": null,
        "prism:aggregationType": "Journal",
        "prism:url": "https://api.elsevier.com/content/article/pii/S0926860X20304063",
        "dc:creator": [
          {
            "@_fa": "true",
            "$": "Tao, Luyao"
          },
          {
            "@_fa": "true",
            "$": "Bi, Xiuru"
          },
          {
            "@_fa": "true",
            "$": "Zhang, Liping"
          },
          {
            "@_fa": "true",
            "$": "Chen, Gexin"
          },
          {
            "@_fa": "true",
            "$": "Zhao, Peiqing"
          },
          {
            "@_fa": "true",
            "$": "Yang, Jun-Li"
          },
          {
            "@_fa": "true",
            "$": "Meng, Xu"
          }
        ],
        "link": [
          {
            "@_fa": "true",
            "@rel": "self",
            "@href": "https://api.elsevier.com/content/article/pii/S0926860X20304063"
          },
          {
            "@_fa": "true",
            "@rel": "scidir",
            "@href": "https://www.sciencedirect.com/science/article/pii/S0926860X20304063"
          }
        ],
        "dc:format": "application/json",
        "openaccessType": null,
        "pii": "S0926-860X(20)30406-3",
        "prism:volume": "605",
        "articleNumber": "117813",
        "prism:publisher": "Elsevier B.V.",
        "dc:title": "Na-doped OMS-2-catalzyed highly selective aerobic oxidation of ethyl lactate to ethyl pyruvate under mild conditions",
        "prism:copyright": "© 2020 Elsevier B.V. All rights reserved.",
        "openaccess": "0",
        "prism:issn": "0926860X",
        "dcterms:subject": [
          {
            "@_fa": "true",
            "$": "Biomass conversion"
          },
          {
            "@_fa": "true",
            "$": "Catalytic oxidation"
          },
          {
            "@_fa": "true",
            "$": "OMS-2"
          },
          {
            "@_fa": "true",
            "$": "Ethyl lactate"
          },
          {
            "@_fa": "true",
            "$": "Ethyl pyruvate"
          }
        ],
        "openaccessArticle": "false",
        "prism:publicationName": "Applied Catalysis A: General",
        "openaccessSponsorType": null,
        "prism:pageRange": "117813",
        "pubType": "fla",
        "prism:coverDisplayDate": "5 September 2020",
        "prism:doi": "10.1016/j.apcata.2020.117813",
        "prism:startingPage": "117813",
        "dc:identifier": "doi:10.1016/j.apcata.2020.117813",
        "openaccessSponsorName": null
      },
      "objects": {
        "object": [
          {
            "@category": "standard",
            "@height": "180",
            "@width": "717",
            "@_fa": "true",
            "$": "https://api.elsevier.com/content/object/eid/1-s2.0-S0926860X20304063-gr9.jpg?httpAccept=%2A%2F%2A",
            "@multimediatype": "JPEG image file",
            "@type": "IMAGE-DOWNSAMPLED",
            "@size": "49952",
            "@ref": "gr9",
            "@mimetype": "image/jpeg"
          },
          {
            "@category": "standard",
            "@height": "188",
            "@width": "717",
            "@_fa": "true",
            "$": "https://api.elsevier.com/content/object/eid/1-s2.0-S0926860X20304063-gr10.jpg?httpAccept=%2A%2F%2A",
            "@multimediatype": "JPEG image file",
            "@type": "IMAGE-DOWNSAMPLED",
            "@size": "25032",
            "@ref": "gr10",
            "@mimetype": "image/jpeg"
          },
          {
            "@category": "standard",
            "@height": "379",
            "@width": "661",
            "@_fa": "true",
            "$": "https://api.elsevier.com/content/object/eid/1-s2.0-S0926860X20304063-gr11.jpg?httpAccept=%2A%2F%2A",
            "@multimediatype": "JPEG image file",
            "@type": "IMAGE-DOWNSAMPLED",
            "@size": "51697",
            "@ref": "gr11",
            "@mimetype": "image/jpeg"
          },
          {
            "@category": "standard",
            "@height": "266",
            "@width": "340",
            "@_fa": "true",
            "$": "https://api.elsevier.com/content/object/eid/1-s2.0-S0926860X20304063-gr7.jpg?httpAccept=%2A%2F%2A",
            "@multimediatype": "JPEG image file",
            "@type": "IMAGE-DOWNSAMPLED",
            "@size": "18263",
            "@ref": "gr7",
            "@mimetype": "image/jpeg"
          },
          {
            "@category": "standard",
            "@height": "271",
            "@width": "340",
            "@_fa": "true",
            "$": "https://api.elsevier.com/content/object/eid/1-s2.0-S0926860X20304063-gr8.jpg?httpAccept=%2A%2F%2A",
            "@multimediatype": "JPEG image file",
            "@type": "IMAGE-DOWNSAMPLED",
            "@size": "27017",
            "@ref": "gr8",
            "@mimetype": "image/jpeg"
          },
          {
            "@category": "standard",
            "@height": "270",
            "@width": "340",
            "@_fa": "true",
            "$": "https://api.elsevier.com/content/object/eid/1-s2.0-S0926860X20304063-gr5.jpg?httpAccept=%2A%2F%2A",
            "@multimediatype": "JPEG image file",
            "@type": "IMAGE-DOWNSAMPLED",
            "@size": "16255",
            "@ref": "gr5",
            "@mimetype": "image/jpeg"
          },
          {
            "@category": "standard",
            "@height": "293",
            "@width": "340",
            "@_fa": "true",
            "$": "https://api.elsevier.com/content/object/eid/1-s2.0-S0926860X20304063-gr6.jpg?httpAccept=%2A%2F%2A",
            "@multimediatype": "JPEG image file",
            "@type": "IMAGE-DOWNSAMPLED",
            "@size": "18915",
            "@ref": "gr6",
            "@mimetype": "image/jpeg"
          },
          {
            "@category": "standard",
            "@height": "283",
            "@width": "340",
            "@_fa": "true",
            "$": "https://api.elsevier.com/content/object/eid/1-s2.0-S0926860X20304063-gr3.jpg?httpAccept=%2A%2F%2A",
            "@multimediatype": "JPEG image file",
            "@type": "IMAGE-DOWNSAMPLED",
            "@size": "22737",
            "@ref": "gr3",
            "@mimetype": "image/jpeg"
          },
          {
            "@category": "standard",
            "@height": "257",
            "@width": "340",
            "@_fa": "true",
            "$": "https://api.elsevier.com/content/object/eid/1-s2.0-S0926860X20304063-gr12.jpg?httpAccept=%2A%2F%2A",
            "@multimediatype": "JPEG image file",
            "@type": "IMAGE-DOWNSAMPLED",
            "@size": "17769",
            "@ref": "gr12",
            "@mimetype": "image/jpeg"
          },
          {
            "@category": "standard",
            "@height": "258",
            "@width": "340",
            "@_fa": "true",
            "$": "https://api.elsevier.com/content/object/eid/1-s2.0-S0926860X20304063-gr4.jpg?httpAccept=%2A%2F%2A",
            "@multimediatype": "JPEG image file",
            "@type": "IMAGE-DOWNSAMPLED",
            "@size": "16361",
            "@ref": "gr4",
            "@mimetype": "image/jpeg"
          },
          {
            "@category": "standard",
            "@height": "273",
            "@width": "340",
            "@_fa": "true",
            "$": "https://api.elsevier.com/content/object/eid/1-s2.0-S0926860X20304063-gr13.jpg?httpAccept=%2A%2F%2A",
            "@multimediatype": "JPEG image file",
            "@type": "IMAGE-DOWNSAMPLED",
            "@size": "18069",
            "@ref": "gr13",
            "@mimetype": "image/jpeg"
          },
          {
            "@category": "standard",
            "@height": "260",
            "@width": "340",
            "@_fa": "true",
            "$": "https://api.elsevier.com/content/object/eid/1-s2.0-S0926860X20304063-gr1.jpg?httpAccept=%2A%2F%2A",
            "@multimediatype": "JPEG image file",
            "@type": "IMAGE-DOWNSAMPLED",
            "@size": "19214",
            "@ref": "gr1",
            "@mimetype": "image/jpeg"
          },
          {
            "@category": "standard",
            "@height": "260",
            "@width": "340",
            "@_fa": "true",
            "$": "https://api.elsevier.com/content/object/eid/1-s2.0-S0926860X20304063-gr2.jpg?httpAccept=%2A%2F%2A",
            "@multimediatype": "JPEG image file",
            "@type": "IMAGE-DOWNSAMPLED",
            "@size": "17424",
            "@ref": "gr2",
            "@mimetype": "image/jpeg"
          },
          {
            "@category": "standard",
            "@height": "200",
            "@width": "325",
            "@_fa": "true",
            "$": "https://api.elsevier.com/content/object/eid/1-s2.0-S0926860X20304063-ga1.jpg?httpAccept=%2A%2F%2A",
            "@multimediatype": "JPEG image file",
            "@type": "IMAGE-DOWNSAMPLED",
            "@size": "20666",
            "@ref": "ga1",
            "@mimetype": "image/jpeg"
          },
          {
            "@category": "thumbnail",
            "@height": "55",
            "@width": "219",
            "@_fa": "true",
            "$": "https://api.elsevier.com/content/object/eid/1-s2.0-S0926860X20304063-gr9.sml?httpAccept=%2A%2F%2A",
            "@multimediatype": "GIF image file",
            "@type": "IMAGE-THUMBNAIL",
            "@size": "8682",
            "@ref": "gr9",
            "@mimetype": "image/gif"
          },
          {
            "@category": "thumbnail",
            "@height": "57",
            "@width": "219",
            "@_fa": "true",
            "$": "https://api.elsevier.com/content/object/eid/1-s2.0-S0926860X20304063-gr10.sml?httpAccept=%2A%2F%2A",
            "@multimediatype": "GIF image file",
            "@type": "IMAGE-THUMBNAIL",
            "@size": "3500",
            "@ref": "gr10",
            "@mimetype": "image/gif"
          },
          {
            "@category": "thumbnail",
            "@height": "126",
            "@width": "219",
            "@_fa": "true",
            "$": "https://api.elsevier.com/content/object/eid/1-s2.0-S0926860X20304063-gr11.sml?httpAccept=%2A%2F%2A",
            "@multimediatype": "GIF image file",
            "@type": "IMAGE-THUMBNAIL",
            "@size": "8664",
            "@ref": "gr11",
            "@mimetype": "image/gif"
          },
          {
            "@category": "thumbnail",
            "@height": "164",
            "@width": "209",
            "@_fa": "true",
            "$": "https://api.elsevier.com/content/object/eid/1-s2.0-S0926860X20304063-gr7.sml?httpAccept=%2A%2F%2A",
            "@multimediatype": "GIF image file",
            "@type": "IMAGE-THUMBNAIL",
            "@size": "9973",
            "@ref": "gr7",
            "@mimetype": "image/gif"
          },
          {
            "@category": "thumbnail",
            "@height": "164",
            "@width": "206",
            "@_fa": "true",
            "$": "https://api.elsevier.com/content/object/eid/1-s2.0-S0926860X20304063-gr8.sml?httpAccept=%2A%2F%2A",
            "@multimediatype": "GIF image file",
            "@type": "IMAGE-THUMBNAIL",
            "@size": "12960",
            "@ref": "gr8",
            "@mimetype": "image/gif"
          },
          {
            "@category": "thumbnail",
            "@height": "164",
            "@width": "206",
            "@_fa": "true",
            "$": "https://api.elsevier.com/content/object/eid/1-s2.0-S0926860X20304063-gr5.sml?httpAccept=%2A%2F%2A",
            "@multimediatype": "GIF image file",
            "@type": "IMAGE-THUMBNAIL",
            "@size": "7931",
            "@ref": "gr5",
            "@mimetype": "image/gif"
          },
          {
            "@category": "thumbnail",
            "@height": "164",
            "@width": "190",
            "@_fa": "true",
            "$": "https://api.elsevier.com/content/object/eid/1-s2.0-S0926860X20304063-gr6.sml?httpAccept=%2A%2F%2A",
            "@multimediatype": "GIF image file",
            "@type": "IMAGE-THUMBNAIL",
            "@size": "9046",
            "@ref": "gr6",
            "@mimetype": "image/gif"
          },
          {
            "@category": "thumbnail",
            "@height": "164",
            "@width": "197",
            "@_fa": "true",
            "$": "https://api.elsevier.com/content/object/eid/1-s2.0-S0926860X20304063-gr3.sml?httpAccept=%2A%2F%2A",
            "@multimediatype": "GIF image file",
            "@type": "IMAGE-THUMBNAIL",
            "@size": "10579",
            "@ref": "gr3",
            "@mimetype": "image/gif"
          },
          {
            "@category": "thumbnail",
            "@height": "164",
            "@width": "217",
            "@_fa": "true",
            "$": "https://api.elsevier.com/content/object/eid/1-s2.0-S0926860X20304063-gr12.sml?httpAccept=%2A%2F%2A",
            "@multimediatype": "GIF image file",
            "@type": "IMAGE-THUMBNAIL",
            "@size": "9988",
            "@ref": "gr12",
            "@mimetype": "image/gif"
          },
          {
            "@category": "thumbnail",
            "@height": "164",
            "@width": "216",
            "@_fa": "true",
            "$": "https://api.elsevier.com/content/object/eid/1-s2.0-S0926860X20304063-gr4.sml?httpAccept=%2A%2F%2A",
            "@multimediatype": "GIF image file",
            "@type": "IMAGE-THUMBNAIL",
            "@size": "9711",
            "@ref": "gr4",
            "@mimetype": "image/gif"
          },
          {
            "@category": "thumbnail",
            "@height": "164",
            "@width": "204",
            "@_fa": "true",
            "$": "https://api.elsevier.com/content/object/eid/1-s2.0-S0926860X20304063-gr13.sml?httpAccept=%2A%2F%2A",
            "@multimediatype": "GIF image file",
            "@type": "IMAGE-THUMBNAIL",
            "@size": "5923",
            "@ref": "gr13",
            "@mimetype": "image/gif"
          },
          {
            "@category": "thumbnail",
            "@height": "164",
            "@width": "215",
            "@_fa": "true",
            "$": "https://api.elsevier.com/content/object/eid/1-s2.0-S0926860X20304063-gr1.sml?httpAccept=%2A%2F%2A",
            "@multimediatype": "GIF image file",
            "@type": "IMAGE-THUMBNAIL",
            "@size": "12878",
            "@ref": "gr1",
            "@mimetype": "image/gif"
          },
          {
            "@category": "thumbnail",
            "@height": "164",
            "@width": "214",
            "@_fa": "true",
            "$": "https://api.elsevier.com/content/object/eid/1-s2.0-S0926860X20304063-gr2.sml?httpAccept=%2A%2F%2A",
            "@multimediatype": "GIF image file",
            "@type": "IMAGE-THUMBNAIL",
            "@size": "10166",
            "@ref": "gr2",
            "@mimetype": "image/gif"
          },
          {
            "@category": "thumbnail",
            "@height": "135",
            "@width": "219",
            "@_fa": "true",
            "$": "https://api.elsevier.com/content/object/eid/1-s2.0-S0926860X20304063-ga1.sml?httpAccept=%2A%2F%2A",
            "@multimediatype": "GIF image file",
            "@type": "IMAGE-THUMBNAIL",
            "@size": "10485",
            "@ref": "ga1",
            "@mimetype": "image/gif"
          },
          {
            "@category": "high",
            "@height": "799",
            "@width": "3175",
            "@_fa": "true",
            "$": "https://api.elsevier.com/content/object/eid/1-s2.0-S0926860X20304063-gr9_lrg.jpg?httpAccept=%2A%2F%2A",
            "@multimediatype": "JPEG image file",
            "@type": "IMAGE-HIGH-RES",
            "@size": "798786",
            "@ref": "gr9",
            "@mimetype": "image/jpeg"
          },
          {
            "@category": "high",
            "@height": "832",
            "@width": "3175",
            "@_fa": "true",
            "$": "https://api.elsevier.com/content/object/eid/1-s2.0-S0926860X20304063-gr10_lrg.jpg?httpAccept=%2A%2F%2A",
            "@multimediatype": "JPEG image file",
            "@type": "IMAGE-HIGH-RES",
            "@size": "180836",
            "@ref": "gr10",
            "@mimetype": "image/jpeg"
          },
          {
            "@category": "high",
            "@height": "1679",
            "@width": "2925",
            "@_fa": "true",
            "$": "https://api.elsevier.com/content/object/eid/1-s2.0-S0926860X20304063-gr11_lrg.jpg?httpAccept=%2A%2F%2A",
            "@multimediatype": "JPEG image file",
            "@type": "IMAGE-HIGH-RES",
            "@size": "399056",
            "@ref": "gr11",
            "@mimetype": "image/jpeg"
          },
          {
            "@category": "high",
            "@height": "1180",
            "@width": "1508",
            "@_fa": "true",
            "$": "https://api.elsevier.com/content/object/eid/1-s2.0-S0926860X20304063-gr7_lrg.jpg?httpAccept=%2A%2F%2A",
            "@multimediatype": "JPEG image file",
            "@type": "IMAGE-HIGH-RES",
            "@size": "225052",
            "@ref": "gr7",
            "@mimetype": "image/jpeg"
          },
          {
            "@category": "high",
            "@height": "1201",
            "@width": "1508",
            "@_fa": "true",
            "$": "https://api.elsevier.com/content/object/eid/1-s2.0-S0926860X20304063-gr8_lrg.jpg?httpAccept=%2A%2F%2A",
            "@multimediatype": "JPEG image file",
            "@type": "IMAGE-HIGH-RES",
            "@size": "407958",
            "@ref": "gr8",
            "@mimetype": "image/jpeg"
          },
          {
            "@category": "high",
            "@height": "1198",
            "@width": "1508",
            "@_fa": "true",
            "$": "https://api.elsevier.com/content/object/eid/1-s2.0-S0926860X20304063-gr5_lrg.jpg?httpAccept=%2A%2F%2A",
            "@multimediatype": "JPEG image file",
            "@type": "IMAGE-HIGH-RES",
            "@size": "286823",
            "@ref": "gr5",
            "@mimetype": "image/jpeg"
          },
          {
            "@category": "high",
            "@height": "1298",
            "@width": "1508",
            "@_fa": "true",
            "$": "https://api.elsevier.com/content/object/eid/1-s2.0-S0926860X20304063-gr6_lrg.jpg?httpAccept=%2A%2F%2A",
            "@multimediatype": "JPEG image file",
            "@type": "IMAGE-HIGH-RES",
            "@size": "235091",
            "@ref": "gr6",
            "@mimetype": "image/jpeg"
          },
          {
            "@category": "high",
            "@height": "1255",
            "@width": "1508",
            "@_fa": "true",
            "$": "https://api.elsevier.com/content/object/eid/1-s2.0-S0926860X20304063-gr3_lrg.jpg?httpAccept=%2A%2F%2A",
            "@multimediatype": "JPEG image file",
            "@type": "IMAGE-HIGH-RES",
            "@size": "351751",
            "@ref": "gr3",
            "@mimetype": "image/jpeg"
          },
          {
            "@category": "high",
            "@height": "1141",
            "@width": "1508",
            "@_fa": "true",
            "$": "https://api.elsevier.com/content/object/eid/1-s2.0-S0926860X20304063-gr12_lrg.jpg?httpAccept=%2A%2F%2A",
            "@multimediatype": "JPEG image file",
            "@type": "IMAGE-HIGH-RES",
            "@size": "265417",
            "@ref": "gr12",
            "@mimetype": "image/jpeg"
          },
          {
            "@category": "high",
            "@height": "1146",
            "@width": "1508",
            "@_fa": "true",
            "$": "https://api.elsevier.com/content/object/eid/1-s2.0-S0926860X20304063-gr4_lrg.jpg?httpAccept=%2A%2F%2A",
            "@multimediatype": "JPEG image file",
            "@type": "IMAGE-HIGH-RES",
            "@size": "286211",
            "@ref": "gr4",
            "@mimetype": "image/jpeg"
          },
          {
            "@category": "high",
            "@height": "1210",
            "@width": "1508",
            "@_fa": "true",
            "$": "https://api.elsevier.com/content/object/eid/1-s2.0-S0926860X20304063-gr13_lrg.jpg?httpAccept=%2A%2F%2A",
            "@multimediatype": "JPEG image file",
            "@type": "IMAGE-HIGH-RES",
            "@size": "124303",
            "@ref": "gr13",
            "@mimetype": "image/jpeg"
          },
          {
            "@category": "high",
            "@height": "1152",
            "@width": "1508",
            "@_fa": "true",
            "$": "https://api.elsevier.com/content/object/eid/1-s2.0-S0926860X20304063-gr1_lrg.jpg?httpAccept=%2A%2F%2A",
            "@multimediatype": "JPEG image file",
            "@type": "IMAGE-HIGH-RES",
            "@size": "261287",
            "@ref": "gr1",
            "@mimetype": "image/jpeg"
          },
          {
            "@category": "high",
            "@height": "1154",
            "@width": "1508",
            "@_fa": "true",
            "$": "https://api.elsevier.com/content/object/eid/1-s2.0-S0926860X20304063-gr2_lrg.jpg?httpAccept=%2A%2F%2A",
            "@multimediatype": "JPEG image file",
            "@type": "IMAGE-HIGH-RES",
            "@size": "285544",
            "@ref": "gr2",
            "@mimetype": "image/jpeg"
          },
          {
            "@category": "high",
            "@height": "886",
            "@width": "1441",
            "@_fa": "true",
            "$": "https://api.elsevier.com/content/object/eid/1-s2.0-S0926860X20304063-ga1_lrg.jpg?httpAccept=%2A%2F%2A",
            "@multimediatype": "JPEG image file",
            "@type": "IMAGE-HIGH-RES",
            "@size": "154533",
            "@ref": "ga1",
            "@mimetype": "image/jpeg"
          },
          {
            "@category": "standard",
            "@_fa": "true",
            "$": "https://api.elsevier.com/content/object/eid/1-s2.0-S0926860X20304063-mmc1.docx?httpAccept=%2A%2F%2A",
            "@multimediatype": "Microsoft Word file",
            "@type": "APPLICATION",
            "@size": "3337343",
            "@ref": "mmc1",
            "@mimetype": "application/word"
          },
          {
            "@category": "standard",
            "@_fa": "true",
            "$": "https://api.elsevier.com/content/object/eid/1-s2.0-S0926860X20304063-am.pdf?httpAccept=%2A%2F%2A",
            "@multimediatype": "Acrobat PDF file",
            "@type": "AAM-PDF",
            "@size": "5302223",
            "@ref": "am",
            "@mimetype": "application/pdf"
          }
        ]
      },
      "link": {
        "@rel": "abstract",
        "@href": "https://api.elsevier.com/content/abstract/scopus_id/85090725730"
      }
    }
  }
}