{
  "metadata": {
    "title": "Copper-supported hydroxyapatite catalysts for bio-isobutanol synthesis from sustainable short-chain alcohols",
    "authors": "; ; ",
    "journal": "Applied Catalysis A: General",
    "date": "2024-09-25",
    "doi": "10.1016/j.apcata.2024.119881",
    "abstract": "",
    "uri": "https://api.elsevier.com/content/article/pii/S0926860X24003260",
    "pii": "S0926860X24003260"
  },
  "fulltext": {
    "full-text-retrieval-response": {
      "scopus-eid": "2-s2.0-85199310301",
      "originalText": "serial JL 271346 291210 291744 291809 31 Applied Catalysis A: General APPLIEDCATALYSISAGENERAL 2024-07-08 2024-07-08 2024-07-23 2024-07-23 2025-01-28T12:54:02 1-s2.0-S0926860X24003260 S0926-860X(24)00326-0 S0926860X24003260 10.1016/j.apcata.2024.119881 S300 S300.1 FULL-TEXT 1-s2.0-S0926860X24X00137 2025-01-28T13:20:03.63595Z 0 0 20240925 2024 2024-07-09T00:32:26.478534Z absattachment articleinfo articlenumber articletitlenorm authfirstinitialnorm authfirstsurnamenorm cid cids contenttype copyright crossmark dateloaded dateloadedtxt datesearch datesort dateupdated dco docsubtype doctype doi eid ewtransactionid hubeid indexeddate issn issnnorm itemstage itemtransactionid itemweight openaccess openarchive pg pgfirst pii piinorm pubdatestart pubdatetxt pubyr sortorder srctitle srctitlenorm srctype ssids alllist content subj subheadings suppl tomb volfirst volissue volumelist webpdf webpdfpagecount yearnav figure table e-component body mmlmath acknowledge affil appendices articletitle auth authfirstini authfull authkeywords authlast grantnumber grantsponsor grantsponsorid highlightsabst orcid primabst ref specialabst 0926-860X 0926860X true 685 685 C Volume 685 17 119881 119881 119881 20240925 25 September 2024 2024-09-25 2024 article fla © 2024 Elsevier B.V. All rights are reserved, including those for text and data mining, AI training, and similar technologies. COPPERSUPPORTEDHYDROXYAPATITECATALYSTSFORBIOISOBUTANOLSYNTHESISSUSTAINABLESHORTCHAINALCOHOLS VALDIVIESOVERA D 1 Introduction 2 Materials and methods 2.1 Catalysts synthesis 2.2 Catalyst characterization 2.3 Catalytic activity for the Guerbet reaction 2.3.1 Catalytic activity for the Guerbet reaction in a batch reactor 2.3.2 Catalytic activity for the Guerbet reaction in a continuous flow reactor 3 Results and discussion 3.1 Characterization of Cux/HAP 1.65 catalysts 3.2 Catalytic Guerbet condensation of MeOH with EtOH to give isobutanol: batch and continuous flow reactor 3.2.1 Effect of reaction time in batch reactor 3.2.2 Effect of reaction temperature on isobutanol selectivity in a continuous flow reactor 3.2.3 Catalytic condensation of methanol and ethanol in a fixed bed reactor: time on stream study and recycling test 4 Conclusions CRediT authorship contribution statement Acknowledgements Appendix A Supplementary material References HAHNHAGERDAL 2006 549 556 B SAVAGE 2011 N HILL 2006 11206 11210 J IRIMESCU 2011 3030 3035 A GUPTA 2015 550 567 A SAVAGE 2011 N RAJESHKUMAR 2016 84 115 B ERDIWANSYAH 2019 467 479 RAMEY 2007 137 D FENKL 2016 1 5 M ANDERSEN 2010 3647 3654 V RODRIGUEZANTON 2016 73 78 L YUSOFF 2017 23 38 M WALLNER 2014 T LI 2015 908 914 Y KOLODZIEJ 2012 79 85 R LAN 2013 339 349 E WINGAD 2016 5202 5204 R SCALBERT 2014 28 32 J HANSPAL 2017 182 190 S VEIBEL 1967 1723 1733 S KOZLOWSKI 2013 1588 1600 J TSUCHIDA 2008 183 189 T RAMASAMY 2016 46 54 K FARIA 2008 168 173 R CIMINO 2017 58 63 S DICOSIMO 1998 499 510 J HO 2016 939 948 C OGO 2011 188 195 S OGO 2012 24 30 S VALDIVIESOVERA 2024 D ZHOU 2020 2341 2347 B CARLINI 2003 409 418 C CARLINI 2002 273 280 C CARLINI 2003 137 146 C CARLINI 2005 13 20 C CARLINI 2004 215 220 C CHENG 2019 119 136 F LIU 2016 2811 2818 Q BRAVOSUAREZ 2013 234 246 J TSUCHIDA 2009 51 59 T DIALLOGARCIA 2014 12744 12757 S POGOSOVA 2018 20140 20147 M GUO 2017 45420 45431 J IRIARTEVELASCO 2021 6745 6763 U GOMA 2019 D HILL 2015 9186 9197 I SHAO 2019 4499 4511 Y ZHOU 2020 W BIESINGER 2017 1325 1334 M SAITO 2023 K GOMES 2017 174 183 G REN 2022 121515 Y ZHANG 2023 143755 J SI 2020 C VALDIVIESOVERAX2024X119881 VALDIVIESOVERAX2024X119881XD 2026-07-23T00:00:00.000Z 2026-07-23T00:00:00.000Z http://creativecommons.org/licenses/by-nc-nd/4.0/ © 2024 Elsevier B.V. All rights are reserved, including those for text and data mining, AI training, and similar technologies. 2024-10-09T19:55:06.823Z http://vtw.elsevier.com/data/voc/AddOnTypes/50.7/aggregated-refined Asociación Universitaria Iberoamericana de Posgrado AUIP Asociación Universitaria Iberoamericana de Postgrado http://data.elsevier.com/vocabulary/SciValFunders/501100006371 http://sws.geonames.org/2510769/ TED2021-130756B PID2021-126235OB-C32 UMA Universidad de Malaga http://data.elsevier.com/vocabulary/SciValFunders/100009473 http://sws.geonames.org/2510769 FEDER MCIN/AEI/10.13039/501100011033 TED2021-130756B ERDF European Regional Development Fund http://data.elsevier.com/vocabulary/SciValFunders/501100008530 http://sws.geonames.org/6695072/ PRTR Consejo Nacional de Ciencia y Tecnología Conahcyt Consejo Nacional de Humanidades, Ciencias y Tecnologías http://data.elsevier.com/vocabulary/SciValFunders/501100003141 http://sws.geonames.org/3996063/ European Union NextGenerationEU 584-IT-2022 UANL Universidad Autónoma de Nuevo León http://data.elsevier.com/vocabulary/SciValFunders/501100004685 http://sws.geonames.org/3996063 Authors acknowledge the financial support of this work by PAICyT-UANL 2022 (584-IT-2022, PID2021-126235OB-C32 funded by MCIN/ AEI/10.13039/501100011033/ and FEDER funds, TED2021-130756B funded by MCIN/AEI/10.13039/501100011033 and by \\u201CERDF A way of making Europe\\u201D by the European Union NextGenerationEU/PRTR. Daniel Valdivieso acknowledges the Consejo Nacional de Ciencia y Tecnolog\\u00EDa (CONACyT) for PhD scholarship and the Asociaci\\u00F3n Universitaria Iberoamericana de Posgrado (AUIP) for the financial support granted. Authors acknowledge the financial support of this work by PAICyT-UANL 2022 (584-IT-2022, ProACTI-UANL 2023 128-IDT-2023 PID2021\\u2013126235OB-C32 funded by MCIN/ AEI/10.13039/501100011033/ and FEDER funds, TED2021\\u2013130756B funded by MCIN/AEI/10.13039/501100011033 and by \\u201CERDF A way of making Europe\\u201D by the European Union NextGenerationEU/PRTR. Daniel Valdivieso acknowledges the Consejo Nacional de Humanidades, Ciencias y Tecnolog\\u00EDas (CONAHCyT) for PhD scholarship and the Asociaci\\u00F3n Universitaria Iberoamericana de Posgrado (AUIP) for the financial support granted. https://doi.org/10.15223/policy-017 https://doi.org/10.15223/policy-037 https://doi.org/10.15223/policy-012 https://doi.org/10.15223/policy-029 https://doi.org/10.15223/policy-004 item S0926-860X(24)00326-0 S0926860X24003260 1-s2.0-S0926860X24003260 10.1016/j.apcata.2024.119881 271346 2025-01-28T13:20:03.63595Z 2024-09-25 1-s2.0-S0926860X24003260-main.pdf https://s3-eu-west-1.amazonaws.com/prod-ucs-content-store-eu-west/content/pii:S0926860X24003260/MAIN/application/pdf/89760dcaa95dd1bfab9618e2d24ba169/main.pdf main.pdf pdf true 5746135 MAIN 10 1-s2.0-S0926860X24003260-main_1.png https://s3-eu-west-1.amazonaws.com/prod-ucs-content-store-eu-west/content/pii:S0926860X24003260/PREVIEW/image/png/656fd5ada1b43bc80988a79cfe963973/main_1.png main_1.png png 58408 849 656 IMAGE-WEB-PDF 1 1-s2.0-S0926860X24003260-gr6.jpg https://s3-eu-west-1.amazonaws.com/prod-ucs-content-store-eu-west/content/pii:S0926860X24003260/gr6/DOWNSAMPLED/image/jpeg/958a0cd66a8910025a211c6c8d648b91/gr6.jpg gr6 gr6.jpg jpg 55643 339 565 IMAGE-DOWNSAMPLED 1-s2.0-S0926860X24003260-gr7.jpg https://s3-eu-west-1.amazonaws.com/prod-ucs-content-store-eu-west/content/pii:S0926860X24003260/gr7/DOWNSAMPLED/image/jpeg/db93950536ff12ad49975645ebd2b2db/gr7.jpg gr7 gr7.jpg jpg 28668 242 376 IMAGE-DOWNSAMPLED 1-s2.0-S0926860X24003260-gr4.jpg https://s3-eu-west-1.amazonaws.com/prod-ucs-content-store-eu-west/content/pii:S0926860X24003260/gr4/DOWNSAMPLED/image/jpeg/faf2b401d220bb3b3a2c0212eed3feb4/gr4.jpg gr4 gr4.jpg jpg 32798 397 282 IMAGE-DOWNSAMPLED 1-s2.0-S0926860X24003260-gr5.jpg https://s3-eu-west-1.amazonaws.com/prod-ucs-content-store-eu-west/content/pii:S0926860X24003260/gr5/DOWNSAMPLED/image/jpeg/f78d95ab1b2485d4d0f3215cd013e8e2/gr5.jpg gr5 gr5.jpg jpg 23878 277 339 IMAGE-DOWNSAMPLED 1-s2.0-S0926860X24003260-gr8.jpg https://s3-eu-west-1.amazonaws.com/prod-ucs-content-store-eu-west/content/pii:S0926860X24003260/gr8/DOWNSAMPLED/image/jpeg/4cd9775ecaf790611ad52c09bae82507/gr8.jpg gr8 gr8.jpg jpg 55572 383 565 IMAGE-DOWNSAMPLED 1-s2.0-S0926860X24003260-gr9.jpg https://s3-eu-west-1.amazonaws.com/prod-ucs-content-store-eu-west/content/pii:S0926860X24003260/gr9/DOWNSAMPLED/image/jpeg/7bbc6bdeabdf0af5ea3e84080a67121e/gr9.jpg gr9 gr9.jpg jpg 45996 361 565 IMAGE-DOWNSAMPLED 1-s2.0-S0926860X24003260-sc1.jpg https://s3-eu-west-1.amazonaws.com/prod-ucs-content-store-eu-west/content/pii:S0926860X24003260/sc1/DOWNSAMPLED/image/jpeg/98e6bec56b67e8175a7d68947b2f2035/sc1.jpg sc1 sc1.jpg jpg 57050 407 659 IMAGE-DOWNSAMPLED 1-s2.0-S0926860X24003260-gr2.jpg https://s3-eu-west-1.amazonaws.com/prod-ucs-content-store-eu-west/content/pii:S0926860X24003260/gr2/DOWNSAMPLED/image/jpeg/5ab93081b87349054d49ac0a9c64b46e/gr2.jpg gr2 gr2.jpg jpg 21784 265 339 IMAGE-DOWNSAMPLED 1-s2.0-S0926860X24003260-ga1.jpg https://s3-eu-west-1.amazonaws.com/prod-ucs-content-store-eu-west/content/pii:S0926860X24003260/ga1/DOWNSAMPLED/image/jpeg/e7a34eb3259ed8427c15ba6b9a065331/ga1.jpg ga1 true ga1.jpg jpg 38270 200 443 IMAGE-DOWNSAMPLED 1-s2.0-S0926860X24003260-gr3.jpg https://s3-eu-west-1.amazonaws.com/prod-ucs-content-store-eu-west/content/pii:S0926860X24003260/gr3/DOWNSAMPLED/image/jpeg/833fec12996a05a6a818850ff51a07c1/gr3.jpg gr3 gr3.jpg jpg 30951 396 282 IMAGE-DOWNSAMPLED 1-s2.0-S0926860X24003260-gr1.jpg https://s3-eu-west-1.amazonaws.com/prod-ucs-content-store-eu-west/content/pii:S0926860X24003260/gr1/DOWNSAMPLED/image/jpeg/f53cd5144e4389a8efd4f5d5bbf42548/gr1.jpg gr1 gr1.jpg jpg 25758 281 339 IMAGE-DOWNSAMPLED 1-s2.0-S0926860X24003260-gr6.sml https://s3-eu-west-1.amazonaws.com/prod-ucs-content-store-eu-west/content/pii:S0926860X24003260/gr6/THUMBNAIL/image/gif/fc3aa54e4545534297286f0f0f81116b/gr6.sml gr6 gr6.sml sml 10479 132 219 IMAGE-THUMBNAIL 1-s2.0-S0926860X24003260-gr7.sml https://s3-eu-west-1.amazonaws.com/prod-ucs-content-store-eu-west/content/pii:S0926860X24003260/gr7/THUMBNAIL/image/gif/19b0bef24b0df7a7cf142b445d1d06e1/gr7.sml gr7 gr7.sml sml 11248 141 219 IMAGE-THUMBNAIL 1-s2.0-S0926860X24003260-gr4.sml https://s3-eu-west-1.amazonaws.com/prod-ucs-content-store-eu-west/content/pii:S0926860X24003260/gr4/THUMBNAIL/image/gif/a7619c15c11e4dd533df154cedcd24f7/gr4.sml gr4 gr4.sml sml 6418 163 116 IMAGE-THUMBNAIL 1-s2.0-S0926860X24003260-gr5.sml https://s3-eu-west-1.amazonaws.com/prod-ucs-content-store-eu-west/content/pii:S0926860X24003260/gr5/THUMBNAIL/image/gif/b0d060d61799b5697ed249dd952bcc2d/gr5.sml gr5 gr5.sml sml 7399 164 200 IMAGE-THUMBNAIL 1-s2.0-S0926860X24003260-gr8.sml https://s3-eu-west-1.amazonaws.com/prod-ucs-content-store-eu-west/content/pii:S0926860X24003260/gr8/THUMBNAIL/image/gif/a54ebd22bafc0ee15c30a74c4a17f634/gr8.sml gr8 gr8.sml sml 10074 148 219 IMAGE-THUMBNAIL 1-s2.0-S0926860X24003260-gr9.sml https://s3-eu-west-1.amazonaws.com/prod-ucs-content-store-eu-west/content/pii:S0926860X24003260/gr9/THUMBNAIL/image/gif/39f8ac22160261ca2a9729f9f58144f6/gr9.sml gr9 gr9.sml sml 8492 140 219 IMAGE-THUMBNAIL 1-s2.0-S0926860X24003260-sc1.sml https://s3-eu-west-1.amazonaws.com/prod-ucs-content-store-eu-west/content/pii:S0926860X24003260/sc1/THUMBNAIL/image/gif/3d336fbfcd8614e76cdaa2f5b2a1be5a/sc1.sml sc1 sc1.sml sml 8717 135 219 IMAGE-THUMBNAIL 1-s2.0-S0926860X24003260-gr2.sml https://s3-eu-west-1.amazonaws.com/prod-ucs-content-store-eu-west/content/pii:S0926860X24003260/gr2/THUMBNAIL/image/gif/0b7456362760d8f8f66ed19abfe91371/gr2.sml gr2 gr2.sml sml 7582 164 210 IMAGE-THUMBNAIL 1-s2.0-S0926860X24003260-ga1.sml https://s3-eu-west-1.amazonaws.com/prod-ucs-content-store-eu-west/content/pii:S0926860X24003260/ga1/THUMBNAIL/image/gif/ef9a57944ad669c56a92cf5bb157c9a3/ga1.sml ga1 true ga1.sml sml 12181 99 219 IMAGE-THUMBNAIL 1-s2.0-S0926860X24003260-gr3.sml https://s3-eu-west-1.amazonaws.com/prod-ucs-content-store-eu-west/content/pii:S0926860X24003260/gr3/THUMBNAIL/image/gif/96bdb9eab1b5b2b68c730e0539a9f45d/gr3.sml gr3 gr3.sml sml 6268 163 116 IMAGE-THUMBNAIL 1-s2.0-S0926860X24003260-gr1.sml https://s3-eu-west-1.amazonaws.com/prod-ucs-content-store-eu-west/content/pii:S0926860X24003405/gr1/THUMBNAIL/image/gif/78412987a964a5244ceeeca6bb046a12/gr1.sml gr1 gr1.sml sml 8198 164 198 IMAGE-THUMBNAIL 1-s2.0-S0926860X24003260-gr6_lrg.jpg https://s3-eu-west-1.amazonaws.com/prod-ucs-content-store-eu-west/content/pii:S0926860X24003260/HIGHRES/image/jpeg/966189940c2cddba0640be1a382530d4/gr6_lrg.jpg gr6 gr6_lrg.jpg jpg 307860 1499 2495 IMAGE-HIGH-RES 1-s2.0-S0926860X24003260-gr7_lrg.jpg https://s3-eu-west-1.amazonaws.com/prod-ucs-content-store-eu-west/content/pii:S0926860X24003260/HIGHRES/image/jpeg/677d6a3fa3375c97b5cbcc21722c9cd2/gr7_lrg.jpg gr7 gr7_lrg.jpg jpg 145612 1071 1663 IMAGE-HIGH-RES 1-s2.0-S0926860X24003260-gr4_lrg.jpg https://s3-eu-west-1.amazonaws.com/prod-ucs-content-store-eu-west/content/pii:S0926860X24003260/HIGHRES/image/jpeg/1692e059eb6b54570e6beb997024f571/gr4_lrg.jpg gr4 gr4_lrg.jpg jpg 184152 1756 1247 IMAGE-HIGH-RES 1-s2.0-S0926860X24003260-gr5_lrg.jpg https://s3-eu-west-1.amazonaws.com/prod-ucs-content-store-eu-west/content/pii:S0926860X24003260/HIGHRES/image/jpeg/e4d6fa88dcab01ac6beb2cbe89a90e19/gr5_lrg.jpg gr5 gr5_lrg.jpg jpg 180183 1225 1497 IMAGE-HIGH-RES 1-s2.0-S0926860X24003260-gr8_lrg.jpg https://s3-eu-west-1.amazonaws.com/prod-ucs-content-store-eu-west/content/pii:S0926860X24003260/HIGHRES/image/jpeg/1ed09b815983f167a179068feb0034e6/gr8_lrg.jpg gr8 gr8_lrg.jpg jpg 292929 1691 2495 IMAGE-HIGH-RES 1-s2.0-S0926860X24003260-gr9_lrg.jpg https://s3-eu-west-1.amazonaws.com/prod-ucs-content-store-eu-west/content/pii:S0926860X24003260/HIGHRES/image/jpeg/3f276674d7cce1a6bae1407db85408f0/gr9_lrg.jpg gr9 gr9_lrg.jpg jpg 247834 1592 2495 IMAGE-HIGH-RES 1-s2.0-S0926860X24003260-sc1_lrg.jpg https://s3-eu-west-1.amazonaws.com/prod-ucs-content-store-eu-west/content/pii:S0926860X24003260/HIGHRES/image/jpeg/5f989e7786ed109df6a90c2f033b152f/sc1_lrg.jpg sc1 sc1_lrg.jpg jpg 294463 1798 2911 IMAGE-HIGH-RES 1-s2.0-S0926860X24003260-gr2_lrg.jpg https://s3-eu-west-1.amazonaws.com/prod-ucs-content-store-eu-west/content/pii:S0926860X24003260/HIGHRES/image/jpeg/b151f7c4db8e9f185762d5898d4bbc00/gr2_lrg.jpg gr2 gr2_lrg.jpg jpg 125564 1169 1497 IMAGE-HIGH-RES 1-s2.0-S0926860X24003260-ga1_lrg.jpg https://s3-eu-west-1.amazonaws.com/prod-ucs-content-store-eu-west/content/pii:S0926860X24003260/HIGHRES/image/jpeg/460412884f1e44c2deb9eb3384aa8432/ga1_lrg.jpg ga1 true ga1_lrg.jpg jpg 279910 886 1963 IMAGE-HIGH-RES 1-s2.0-S0926860X24003260-gr3_lrg.jpg https://s3-eu-west-1.amazonaws.com/prod-ucs-content-store-eu-west/content/pii:S0926860X24003405/HIGHRES/image/jpeg/26b902e89272c05be6025f83fdbe923f/gr3_lrg.jpg gr3 gr3_lrg.jpg jpg 169266 1751 1247 IMAGE-HIGH-RES 1-s2.0-S0926860X24003260-gr1_lrg.jpg https://s3-eu-west-1.amazonaws.com/prod-ucs-content-store-eu-west/content/pii:S0926860X24003405/HIGHRES/image/jpeg/70d2e984103ac111c49f1cf3669bc22a/gr1_lrg.jpg gr1 gr1_lrg.jpg jpg 146648 1240 1497 IMAGE-HIGH-RES 1-s2.0-S0926860X24003260-mmc1.docx https://s3-eu-west-1.amazonaws.com/prod-ucs-content-store-eu-west/content/pii:S0926860X24003260/mmc1/MAIN/application/vnd.openxmlformats-officedocument.wordprocessingml.document/47f4f3570f835264ccc7d0322c5c8c5a/mmc1.docx mmc1 mmc1.docx docx 2994452 APPLICATION 1-s2.0-S0926860X24003260-si0001.svg https://s3-eu-west-1.amazonaws.com/prod-ucs-content-store-eu-west/content/pii:S0926860X24003260/image/svg+xml/2ea2fceaba631b8de4be0f9e818bfc72/si0001.svg si0001 si0001.svg svg 1154 ALTIMG 1-s2.0-S0926860X24003260-si0002.svg https://s3-eu-west-1.amazonaws.com/prod-ucs-content-store-eu-west/content/pii:S0926860X24003260/image/svg+xml/b9b28f65e5432af52b59d899d57a1603/si0002.svg si0002 si0002.svg svg 1106 ALTIMG 1-s2.0-S0926860X24003260-si0003.svg https://s3-eu-west-1.amazonaws.com/prod-ucs-content-store-eu-west/content/pii:S0926860X24003260/image/svg+xml/b9b28f65e5432af52b59d899d57a1603/si0003.svg si0003 si0003.svg svg 1106 ALTIMG 1-s2.0-S0926860X24003260-si0004.svg https://s3-eu-west-1.amazonaws.com/prod-ucs-content-store-eu-west/content/pii:S0926860X24003260/image/svg+xml/3defc09ba32eb2159065270c03b1b3e5/si0004.svg si0004 si0004.svg svg 2216 ALTIMG 1-s2.0-S0926860X24003260-si0005.svg https://s3-eu-west-1.amazonaws.com/prod-ucs-content-store-eu-west/content/pii:S0926860X24003260/image/svg+xml/f051f175fe2cae4e3aea3f19c6933e32/si0005.svg si0005 si0005.svg svg 1369 ALTIMG 1-s2.0-S0926860X24003260-am.pdf https://s3-eu-west-1.amazonaws.com/prod-ucs-content-store-eu-west/content/egi:108T72DV3QJ/MAIN/application/pdf/8fbd94f44cbcc4c6eff07fa438ce482d/am.pdf am am.pdf pdf false 1146866 AAM-PDF APCATA 119881 119881 S0926-860X(24)00326-0 10.1016/j.apcata.2024.119881 Elsevier B.V. Fig. 1 Powder X-ray diffraction patterns of Cux/HAP 1.65 catalysts. Fig. 1 Fig. 2 H2-TPR profiles for the Cux/HAP 1.65 catalysts. Fig. 2 Fig. 3 NH3-TPD profiles and their deconvolution indicate the presence of weak (red) and moderate (blue) acid sites for the Cux/HAP 1.65 catalysts. Fig. 3 Fig. 4 CO2-TPD profiles and their deconvolution indicate the presence of weak (cyan), moderate (red) and strong (blue) basic sites for the Cux/HAP 1.65 catalysts. Fig. 4 Fig. 5 XPS spectra of Cu 2p 1/2 and Cu 2p 3/2 region of Cux/HAP 1.65 catalysts. Fig. 5 Fig. 6 Ethanol conversion and acetaldehyde, 1-propanol, propionaldehyde, isobutanol and n-butanol selectivities in the methanol and ethanol condensation over a) HAP 1.65, b) Cu10/HAP 1.65 and c) Cu15/HAP 1.65 in a batch reactor at 180 ºC, pressurized at 30 atm of N2 for 1–6 h. Fig. 6 Fig. 7 The reaction scheme proposed for two pathways: 1) methanol and ethanol condensation towards isobutanol; and 2) ethanol self-condensation or dimerization towards n-butanol. Gas chromatography was used to identify the intermediates and reaction products marked with *GC. Fig. 7 Fig. 8 Ethanol and methanol conversion and selectivity to Ace, 1-PrOH, PrCHO, iBuOH and n-BuOH for the EtOH and MeOH condensation over Cu10/HAP 1.65 and Cu15/HAP 1.65 catalysts in a fixed bed reactor. Fig. 8 Fig. 9 Ethanol conversion and selectivity to Ace, 1-PrOH, PrCHO, iBuOH and n-BuOH over (left) fresh and (right) spent Cu10/HAP 1.65 catalyst in a fixed bed reactor. Fig. 9 Scheme 1 Simplified Guerbet reaction network involving the dehydrogenation, aldol condensation and hydrogenation reactions for higher alcohol synthesis. Scheme 1 Table 1 Acidic-basic distribution of Cux/HAP 1.65 catalysts from NH3 and CO2 TPD measurements. Table 1 Catalyst μmol NH3/gcat W M μmol CO2/gcat W M S Base/Acid ratio* Cu10/HAP 1.65 135 62 % 38 % 151 35 % 65 % − 1.12 Cu15/HAP 1.65 149 69 % 31 % 157 13 % 62 % 25 % 1.05 HAP 1.65 139 59 % 41 % 11 100 % -- − 0.08 Note: W: weak, M: moderate and S: strong acid or basic sites * Base/Acid ratio was calculated by dividing the total basic sites by the total acidic sites. Table 2 Surface composition of HAP 1.65 and Cux/HAP 1.65 catalysts from XPS analysis. Table 2 Catalyst wt% and (at%) Surface Ca/P molar ratio Surface Cu+/Cu0 ratio Cu Ca P O Cu10/HAP 1.65 5.4(2) 31.8(17.3) 18.6(13.7) 36.6(51.9) 1.26 1.87 Cu15/HAP 1.65 7.7(2.8) 30.2(17.3) 18.0(13.6) 36.8(51.9) 1.28 1.55 HAP 1.65 − 38.3(19.1) 20.3(14.2) 36.1(51.3) 1.46 − Copper-supported hydroxyapatite catalysts for bio-isobutanol synthesis from sustainable short-chain alcohols Daniel Alejandro Valdivieso-Vera Writing – review & editing Writing – original draft Methodology Investigation Formal analysis Data curation Conceptualization a b Santos-Lopez Iván Alonso Santos-López Writing – review & editing Writing – original draft Supervision Resources Methodology Investigation Funding acquisition Formal analysis Conceptualization a ⁎ José Julián Cano-Gomez Resources Investigation Data curation a Gerardo Antonio Flores-Escamilla Resources Methodology Data curation a Javier Rivera de la Rosa Methodology Data curation a Rodriguez-Castellon Enrique Rodríguez-Castellón Writing – review & editing Methodology Investigation Funding acquisition Data curation c Barroso-Martin Isabel Barroso-Martín Methodology Investigation c Olga Guerrero-Perez M. Olga Guerrero-Pérez Writing – review & editing Writing – original draft Supervision Methodology Investigation Funding acquisition Data curation Conceptualization b ⁎ a Facultad de Ciencias Químicas, Universidad Autónoma de Nuevo León, San Nicolás de los Garza, Nuevo León 66455, Mexico Facultad de Ciencias Químicas, Universidad Autónoma de Nuevo León San Nicolás de los Garza Nuevo León 66455 Mexico Facultad de Ciencias Químicas, Universidad Autónoma de Nuevo León, 66455, San Nicolás de los Garza, Nuevo León, México b Departamento de Ingeniería Química, Universidad de Málaga, Campus Teatinos, Málaga 29071, Spain Departamento de Ingeniería Química, Universidad de Málaga, Campus Teatinos Málaga 29071 Spain Departamento de Ingeniería Química, Universidad de Málaga, Campus Teatinos, 29071, Málaga, España c Departamento de Química Inorgánica, Cristalografía y Mineralogía, Facultad de Ciencias, Universidad de Málaga, Campus Teatinos, Málaga 29071, Spain Departamento de Química Inorgánica, Cristalografía y Mineralogía, Facultad de Ciencias, Universidad de Málaga, Campus Teatinos Málaga 29071 Spain Departamento de Química Inorgánica, Cristalografía y Mineralogía, Facultad de Ciencias, Universidad de Málaga, Campus Teatinos, 29071, Málaga, España ⁎ Corresponding authors. Developing high-performance catalysts for the direct production of isobutanol through the Guerbet reaction is a challenge today, due to the potential of isobutanol as fuel. The present study describes the synthesis and characterization of Cu-supported hydroxyapatite catalysts. The synthesis of isobutanol has been investigated through batch experiments and in a continuous-flow reactor operating in a gas-solid phase. This study used ethanol and methanol as the primary feedstock for the synthesis process. It was found that Cu supported hydroxyapatite catalysts are capable of catalyzing the formation of isobutanol from CH3OH and C2H5OH at temperatures (300–500 ºC) and 1 atm in a continuous flow reactor. Notably, the highest selectivity to isobutanol was observed at 400 ºC. The use of Cu10/HAP 1.65 catalyst in a batch reactor greatly enhances the selectivity of iBuOH in the liquid phase, increasing it from 18 % (vapor-phase) to 65 %. The data showed that the reaction of ethanol/methanol was limited by the 1-propanol-to-isobutanol reaction, which is a secondary reaction of the key intermediate. A reaction scheme has been proposed. Graphical Abstract Keywords Isobutanol Bioethanol Copper-hydroxyapatite Guerbet reaction 1 Introduction Liquid biofuels derived from renewable resources, such as lignocellulosic materials, have been studied for several years. Ethanol (EtOH) is the most widely used liquid biofuel due to its production from renewable sources and its lower toxicity than other alcoholic fuels [1,2]. However, ethanol has drawbacks as a fuel due to its corrosive nature, low energy density, high vapor pressure, and higher water solubility than gasoline [1,3–5]. In internal combustion engines, including those used in oil and diesel engines, higher alcohols such as n-butanol (n-BuOH), isobutanol (iBuOH) and 1-propanol (1-PrOH) offer notable advantages over short-chain alcohols such as EtOH and methanol (MeOH) [6–8]. Isobutanol, in particular, emerges as the preferred biofuel due to its energy density [9], high octane number [10–12], and because it is formed as a kinetic end product through an aldol condensation chain growth process. In addition, n-butanol and isobutanol-gasoline blends have been reported to produce lower concentrations of carbon monoxide and hydrocarbons than pure gasoline, and a decrease in nitrogen oxide emissions is observed at high loads with the alcohol blends [13–15]. These higher alcohols can be synthesized by catalytic conversion using the Guerbet reaction, which consists of a general multi-step reaction sequence involving ( Scheme 1): (i) alcohol dehydrogenation, (ii) hydrogen transfer (or borrowed hydrogen chemistry), (iii) dehydration, and (iv) aldol condensation [16–22]. The use of hydroxyapatite (HAP) catalyst with a good balance of moderate strength acid and base sites fosters the upgrading of ethanol to n-butanol [19,23–31] with distinctive selectivity and enhanced catalytic activity. Specifically, the HAP catalyst with a Ca/P molar ratio of 1.67 demonstrated selectivity towards n-butanol production in a fixed bed reactor at 272 ºC, achieving a selectivity of approximately 71 % [23]. While considerable progress has been made in the upgrading of ethanol to n-butanol, as highlighted earlier, investigation of its branched isomer, isobutanol, has scarcely been explored, despite its potential as an advanced liquid biofuel with a higher octane number than n-butanol. Isobutanol can be produced by the Guerbet reaction through converting mixtures of methanol + ethanol or methanol + propanol. This is typically done in a batch reactor at low temperatures ranging from 150 to 200 ºC, under high pressures of 40–80 atm, and strong bases such sodium methoxide or sodium hydroxide are used as catalytic component. Additionally, the homogenous or heterogeneous catalyst are preactivated in situ under harsh conditions (high pressure and hydrogen). In spite of this, some homogeneous and heterogeneous catalysts have been reported for isobutanol production by Guerbet condensation, using different feedstock such as ethanol + methanol or methanol + propanol mixture [18,33–39]. The use of heterogeneous Cu-based catalysts (Cu-Raney and Cu 1955-P) for the condensation of MeOH and 1-PrOH in batch reactor has been reported, exhibiting nearly complete selectivity towards isobutanol [34], although sodium methoxide was used as a catalytic component and activation step for the catalysts with methanol/H2 at 80 atm and 180 ºC is required. However, there is limited information on the catalytic conversion of methanol and ethanol to isobutanol: e.g. through homogeneous catalysis in a batch reactor system using sodium methoxide (ruthenium diphosphine complexes, homogeneous catalysts) [18] or sodium hydroxide (Ir catalyst supported on N-Carbon support, but with high reaction time of 16 h) [40] as a basic agent and in liquid phase in a pressured system at 30 atm of N2 and 180 ºC with chromium and copper catalysts [35] and in a continuous system using oxide catalysts [41] and a mixture of Cu-Mg-Al oxides (propanol and butanol are the main products and the isobutanol production as traces) [38,42]. In particular, CuMgAl catalysts achieved an isobutanol selectivity of 80 % in a continuous flow reactor at 280 ºC and a contact time of 20 g h mol−1, from a starting mixture of methanol and 1-propanol [36]. Co-hydroxyapatite catalyst has been reported for the reaction of methanol + ethanol on continuous reactor at a reaction temperature of 300–375 ºC, where the distribution of aromatic alcohol products can be controlled by adjusting the methanol pressure, however, the isobutanol selectivity were between 5 % and 13 % [32]. Isobutanol synthesis, an important process in the production of biofuels and various chemicals, has primarily been explored using batch reactors with homogeneous and heterogeneous catalysts. However, studies on isobutanol synthesis in continuous reactors using methanol/propanol or methanol/ethanol feedstocks have been limited. This approach offers benefits as it eliminates the need for a base such as NaOH or sodium methoxide. Therefore, our study aims to investigate the impact of reaction temperature on isobutanol synthesis in a continuous reactor using a reactive mixture of methanol and ethanol, without the use of NaOH or sodium methoxide as a catalytic component. The objective of this contribution is to describe the use of a heterogeneous CuHAP catalyst with an initial ethanol/methanol mixture and using sodium hydroxide instead of sodium methoxide as a catalytic component in a batch reactor, since this has not been reported. 2 Materials and methods 2.1 Catalysts synthesis The hydroxyapatite support was prepared by a co-precipitation method [21,40]. A Ca/P molar ratio of 1.65 was used since in ongoing studies, our group found it to be the optimal molar ratio of Ca/P for converting methanol and ethanol. In a typical synthesis, aqueous solutions of 0.6 M calcium nitrate tetrahydrate (Ca(NO3)2･4 H2O, Sigma Aldrich) and 0.3636 M of dibasic ammonium phosphate ((NH4)2HPO4, Sigma Aldrich) were simultaneously added dropwise into a round-bottom glass flask. Then, the resulting suspension was stirred and adjusted with aqueous ammonia (, Sigma Aldrich) to pH of 10. The solution was kept under magnetic agitation at 80 ºC overnight. Subsequently, the precipitate was washed several times with deionized water, recovered by filtration and dried at 140 ºC overnight. Finally, the hydroxyapatite powder was calcined at 600 ºC for 2 h to obtain the HAP 1.65 support. Before being impregnated with copper nitrate trihydrate (Cu(NO3)2･3 H2O, Sigma Aldrich), the support was heated at 60 ºC to remove any impurities. Then, the required amount of an aqueous solution of (Cu(NO3)2･3 H2O) to obtain10 and 15 wt% Cu by incipient wetness impregnation in HAP 1.65. The copper salt solution was slowly added dropwise to the support. The catalyst was then dried at 140 ºC overnight, calcined in static air at 500 ºC for 2 h, and finally reduced at 400 ºC for 2 h in H2 flow. The catalysts were named Cu10/HAP 1.65 and Cu15/HAP 1.65, and generally Cux/HAP 1.65 (where “x” represents the Cu loading of 10 and 15 wt%). 2.2 Catalyst characterization The physicochemical properties of the catalysts were evaluated by different techniques. XRD analysis was performed on a Bruker D2 Phaser Cu-source powder diffractometer. Cu K α radiation (λ=1.5418 Å) was used with a power setting of 40 kV and 20 mA. Crystalline structures were obtained within Bragg 2θ angle from 5 to 90° a scan rate of 1º/min with a 0.05º 3/s step size was used. The specific surface area (m2/g) and pore size were determined by the Brunaeur-Emmet-Teller (BET) method and the Barrett-Joyner-Halenda (BJH) method using the nitrogen adsorption/desorption isotherms at −196 ºC on a Micromeritics TriStar II Plus. Temperature-programmed reduction by H2 was performed in an AutoChem III apparatus (Micromeritics). The catalyst was firstly cleaned at 150 ºC under 50 mL/min He flow for 30 min. After cooling to 50 ºC, the carrier gas was switched to 5 % H2/Ar (v/v) at 30 mL/min. When the baseline was stable, the temperature was increased up to 800 ºC with a heating rate of 10 ºC/min, while the amount of H2 consumed was measured with (GC-TCD). Temperature-programmed desorption of NH3 and CO2 experiments were performed in an Autochem III (Micromeritics) instrument with powdered catalysts. The sample was placed in a quartz tubular reactor and pretreated at 500 ºC under 30 mL/min He flow for 2 h, then cooled down to 40 ºC and exposed to 10 % NH3/He(v/v) or 10 % CO2/He(v/v) stream with a flow rate of 30 mL/min for 15 min. The physisorbed NH3 and CO2 were removed by He purging (30 mL/min) for 30 min. Subsequently, the sample was heated at a ramp rate of 10ºC/min up to 800 ºC and the desorbed NH3 or CO2 was monitored and recorded using a GC-TCD and GC-MS. X-ray photoelectron Spectroscopy (XPS) data were collected using a Physical Electronics PHI 5700 spectrometer with non-monochromatic Mg-Kα radiation (300 W, 15 kV, 1253.6 eV) for the analysis of the core level signals of the studied elements and with a multichannel detector. Spectra of powdered samples were recorded with a constant pass energy value of 29.35 eV, using a 720 mm diameter analysis area. All the Cux/HAP 1.65 catalysts were calcined and reduced ( Section 2.1 ) before the analysis (except for the H2−TPR analysis, which only was calcined). 2.3 Catalytic activity for the Guerbet reaction 2.3.1 Catalytic activity for the Guerbet reaction in a batch reactor The condensation of methanol and ethanol was carried out in a stainless-steel batch reactor. Typically, 200 mg (0.106−0.125 mm) of previously activated catalyst ( Section 2.1 ), 100 mL of MeOH, 10 mL of EtOH and 1.37 g of NaOH in a batch reactor system (Iberfluid). Prior to the reaction, the reactor was purged with nitrogen. The reaction was performed at 180 ºC under magnetic stirring (800 rpm) at autogenous pressure or pressurized with N2 (30 atm). The reaction profile was followed by collecting at different times through the sample valve and quickly cooling at 0 ºC. Priorly blank experiments were performed at 180 ºC. Reaction samples were collected every 1 h for 6 hours and were diluted with 1-pentanol and 1–3-dichlorobenzene as internal standard, and stored in sealed vials to be subsequently analyzed by gas chromatography, using a Shimazu GB-14A chromatograph equipped with a flame ionization detector and a CP-Wax 52 CB capillary column. 2.3.2 Catalytic activity for the Guerbet reaction in a continuous flow reactor The methanol and ethanol (10:1, V/V) condensation was carried out at atmospheric pressure in a tubular metallic flow reactor with an internal diameter of 9.1 mm. For these reaction experiments, 200 mg of pelletized catalyst (0.71−0.85 mm) was placed inside the reactor diluted with silicon carbide (SiC, VWR Chemicals) up to 3 mL. The catalysts were reduced in situ at 400 ºC for 2 h, using an H2 flow of 50 mL/min and a heating rate of 5 ºC/min. After cooling at 300 ºC, the reactions were performed at 300, 350, 400, 450 and 500 ºC, at atmospheric pressure with a liquid feed flow of 0.1 mL/min and a N2 flow of 30 mL/min. The liquid samples were collected every 1 h and analyzed by GC-FID Shimazu model GB-14A equipped with a CP-Wax 52 CB capillary column. 3 Results and discussion 3.1 Characterization of Cux/HAP 1.65 catalysts Cux/HAP 1.65 catalysts presented the typical diffraction pattern of hydroxyapatite ( Fig. 1) at 2θ= 31.6º (211), 32.2º (112), 32.9º (300) and 34.1º (202) according to the JCPDS 09–0432 [40–45]. Additionally, the Cu0 crystalline phase was detected at 2θ= 43.5º (111) and 50.9 º (200) [47]. When Cu loadings increased from 10 to 15 wt%, the Cu0 crystallite size increased from 35.2 nm to 53.7 nm. As demonstrated in Figure S1, no crystalline planes attributed to Cu oxides have been identified in CuxHAP1.65 catalysts. Although, it is known that the hydroxyapatite characteristics peaks could be overlaid with the crystal planes of CuO (Cu2+, 2 θ = 35.5º, 38º and 48º, JCPDS 45–0937) and Cu2O (Cu1+, 2 θ = 42.6º, 61º and 73º, JCPDS 05–0667); and XPS and TPR techniques were then utilized to investigate the oxidation states of copper species in the CuxHAP 1.65 catalysts. The TPR profiles ( Fig. 2) show a single peak that increases in intensity and temperature as the copper loading increases (235ºC for Cu15/HAP 1.65 and 228ºC for Cu10/HAP 1.65). This H2 consumption peak between 215 and 235 ºC is attributed to the reduction of highly dispersed Cu2+ species to Cu0 [47,48]. These results agree with the XRD patterns (Fig. 1), which showed the formation of Cu0 on the Cux/HAP 1.65 catalysts after reduction at 400 ºC for 2 h in an H2 atmosphere. In the H2-TPR analysis of CuxHAP 1.65 catalysts, a typical multistep CuO reduction process of occurs Cu 2 + → Cu 1 + → Cu 0 . A shoulder reduction peak can be attributed to the reduction of Cu2+ particles at 168 ºC, while the reduction peaks at 218 ºC - 235 ºC are ascribed to the reduction of Cu1+ particles into metallic copper species, Cu0. Increased copper loading at this range in hydroxyapatite support demonstrated negligible effects on the textural properties of the Cux/HAP 1.65 catalysts. Specifically, pore size distribution (25 nm, as shown in Table S1 and Figure S1) remained unchanged. However, the specific surface area increased slightly to 33 m2/g due to the formation of larger crystallite size with higher copper loading. The NH3-TPD desorption profiles ( Fig. 3) showed an asymmetric peak that can be deconvoluted into two peaks related to weak (≈150 ºC) and moderate (≈280 ºC) acid sites [49]. These acid sites can be attributed to the Lewis acid sites from the PO 4 3 − species [20,50]. In addition, the HAP 1.65 support showed a total amount of acid sites of 139 μmol NH3/gcat with a higher number of weak acid sites. The acidity increases with increasing copper loading, from 135 to 149 μmol NH3/gcat ( Table 1), while the number of moderate acid sites decreases with increasing copper weight loading. The addition of copper to the HAP 1.65 support slightly modifies the amount of acid sites, showing a balance between medium and weak acid sites. Other catalysts have been reported to exhibit similar behavior, with increasing acidity with Cu loading [51]. Generally speaking, Cu10HAP 1.65 catalyst showed a decrease and Cu15HAP 1.65 catalyst demonstrated an increase in acid site density with copper incorporation, from 139 to 135 μmol NH3/gcat and from 139 to 149 μmol NH3/gcat, respectively (see Table 1). Although, particularly the number of weak acid sites increased, while the number of medium acid sites decreases with increasing copper weight loading for Cu10HAP 1.65 and Cu15HAP 1.65 catalyst, respectively. The CO2−TPD profiles of Cux/HAP 1.65 ( Fig. 4) demonstrated the presence of around 150–157 μmol CO2/gcat as the basic site density. This suggests that the amount of basic sites increases with increasing copper loading, as shown in Table 1. The HAP 1.65 support indicated a total amount of basic sites of 11 μmol/gcat. The distribution of basic sites is enhanced by the incorporation of copper, with a higher copper loading (Cu15/HAP 1.65 catalyst) promoting the presence of stronger basic sites and favoring a decrease in weak sites. Meanwhile, for the lower copper loading (Cu10/HAP 1.65), the balance of sites is also modified, with a decrease in medium basic sites and increase in the number of weak sites. The high resolution Cu 2p core level spectra of Cu10/HAP 1.65 and Cu15/HAP 1.65 ( Fig. 5) showed two main peaks at around 952.6 eV and 932.6 eV, corresponding to the doublet Cu 2p 1/2 and Cu 2p 3/2, respectively. To our knowledge, the Cu 2 P3/2 binding energy can not distinguish between Cu1+ and Cu0, as they are nearly identical. Consequently, Auger CuLMM spectra of CuxHAP 1.65 catalysts (see Figure S3, supplementary information) were used to identify the chemical state of copper surface species, Cu0 917.4 or 917.7 eV, and Cu1+ 916.5 or 916.7 eV [47,52,53]. The Cu+/Cu0 ratio decreased from 1.87 to 1.55 with the Cu loading ( Table 2 and Figure S2), modifying the dehydrogenation/hydrogenation properties. Copper-based catalysts are known to promote the Guerbet reaction by assisting in the step of dehydrogenation reactions and the subsequent coupling reactions involving C-O and C-C bonds. Section 3.2 will discuss the effect of these properties on isobutanol production, with a focus on how changes in the Cu+/Cu0 species ratio on the surface improve product selectivity. Furthermore, the Ca/P molar ratio decreased from 1.46 (HAP 1.65 support) to 1.26 and 1.28 as a function of Cu wt% (Table 2). This could be attributed to a substitution of Ca ions for Cu species during the Cu incorporation since it has been reported the partial substitution of Ca ions by e.g. Cu, Co, Zn, etc. It has been established that the hexagonal apatite-type crystal structure of the hydroxyapatite materials remains stable during this chemical modification [46,54]. Figure S3 and Table S2 show the O 1 s, Ca 2p and P 2p of a) Cu10/HAP 1.65 and b) Cu15/HAP 1.65. The O 1 s peak was deconvoluted in three contributions at ≈533 eV attributed to oxygens of adsorbed H2O on the HAP surface, another peak at ≈531 eV assigned to the oxygen from the phosphate groups and OH− groups of hydroxyapatite structure and the carbonates adsorbed on HAP surface, finally, the peak at ≈529 eV was assigned to the oxygen bonds of CaO on the HAP 1.65 structure [55]. The Ca 2p core level spectrum showed the typical doublet Ca 2p 3/2-Ca 2p 1/2 with the maximum of the Ca 2p 3/2 signal at ≈347.3 eV assigned to the HAP's characteristic of Ca2+ species. The peak at ≈133 eV (P 2p 3/2) was attributed to the P−O bonds of the HAP [55]. As shown in this study, CuxHAP 1.65 catalysts were found to contains Cu1+ and Cu0 copper species based on the results of XRD and H2-TPR techniques. It is important to note that XRD and H2-TPR are bulk analyses, meaning they analize the entire composition rather than specifically the surface like the XPS technique does. As a result we identified metallic copper (Cu0) species on the catalyst surface using XRD and TPR analyses, along with the Cu1+ species identified by XPS analysis. It is reasonable to assume that the strong interaction between copper nanoparticles and the hydroxyapatite support induced the coexistence of copper species as Cu1+ and Cu0 on the catalyst surface of fresh catalysts. 3.2 Catalytic Guerbet condensation of MeOH with EtOH to give isobutanol: batch and continuous flow reactor 3.2.1 Effect of reaction time in batch reactor The methanol and ethanol coupling reaction was performed in liquid phase at 180 ºC and 30 atm of N2 atmosphere and the results are shown in Fig. 6. The conversion of EtOH increases in a steady state as the reaction time is increased for all catalysts. It is observed that the addition of Cu to the hydroxyapatite support enhances the catalytic activity. A significant improvement in ethanol conversion was observed, increasing from 44 % to 49 % with hydroxyapatite support. Despite an increased in copper loading from 10 wt% to 15 wt% in the CuxHAP 1.65 catalyst, the ethanol conversion remained nearly identical, ranging from 45 % to 58 %. It is noteworthy that the addition of Cu to the hydroxyapatite support enhances the catalytic activity. Furthermore, both reaction time and copper loading demonstrated a beneficial impact on ethanol conversion. The loading of copper evidently influences the distribution of the product to a greater extent. Specifically, the selectivity to iBuOH increases significantly with Cu loading and reaction time: HAP 1.65 (5–31 %), Cu15/HAP 1.65 (32–53 %), and Cu10/HAP 1.65 (27–64.8 %). The copper loading on the CuxHAP1.65 catalyst substantially affects its performance, as shown in previous studies on the methanol + 1-propanol reaction, which is the second step in producing isobutanol using the Guerbet reaction pathway. The Cu10HAP1.65 catalyst requires much less copper compared to Cu-based catalysts with 18 wt% copper loading [36]. Although, the copper reducibility is similar in the Cu10HAP1.65 (35.2 nm) and Cu15HAP1.65 (53.7 nm) catalysts, there are noticeable differences in the basicity and copper crystal size in the fresh catalyst. As a result of the copper loading, modifications in the Cu1+/Cu0 ratio (1.87 and 1.55, Cu10HAP1.65 and Cu15HAP1.65, respectively) impact the hydrogenation/dehydrogenation processes, influencing the acetaldehyde and propanal production and the subsequent conversion to isobutanol through the aldol condensation step. Interestingly, the incorporation of copper into the hydroxyapatite support (Figs. 6 b) and 6 c)) enhanced the selectivity for isobutanol to 65 % as a function of reaction time in compared to the unsupported counterparts ( Fig. 6 a). The results in Fig. 6 also indicate that the selectivity to n-butanol with reaction time increases for Cux/HAP 1.65, whereas it decreases for the HAP sample. Indeed, for HAP, an increase in reaction time unexpectedly raised isobutanol selectivity at the expense of n-butanol selectivity, suggesting that a shorter reaction time (2 h) favored the production of n-butanol, while a longer reaction time (>3 h) led to highly selective isobutanol production. During the reaction with Cux/HAP 1.65 catalysts, isobutanol shows a linear increase in selectivity for 5 h, followed by a decrease over the next hour of reaction time. The selectivity of propanaldehyde decreases during the first 5 h and then experiences an increase. Within the 6 h reaction time interval, the selectivity towards 1-propanol and acetaldehyde indicates a linear decrease. On the other hand, the selectivity toward n-butanol increases gradually, reaching a plateau between 3 and 6 h of reaction time. An interesting behavior is observed between the selectivities of propanaldehyde and isobutanol. The production of the latter is closely related to the formation and conversion of propanal, which is produced by the dehydrogenation of 1-propanol (step III to step IV, see reaction scheme Fig. 7). During the synthesis of isobutanol, the reaction time and the liquid reaction phase are crucial under our adopted reaction conditions. The results (Fig. 6) show that the iBuOH selectivity gradually increases with time from 27.4 (1 h) to 64.8 % (5 h), demonstrating that the reaction time is important to improve the isobutanol production. A correlation has been found between the relationship of basic and acidic properties and the number of surface Cu+/Cu0 species for the selectivity and conversion towards isobutanol using Cux/HAP1.65 catalysts. This has enhanced tailored control over-reactivity and selectivity in the Guerbet reaction. In particular, decreasing Cu loading increased the distribution of smaller Cu crystallites and elucidated the structure-activity relationship of Cux/HAP1.65 support interactions for isobutanol synthesis. Furthermore, the selectivity toward isobutanol is higher with the Cu10/HAP1.65 catalyst, which shows the highest basicity/acidity ratio (1.12) and the highest value of surface Cu+/Cu0 species of 1.87. On the contrary, when using the Cu15/HAP 1.65 catalyst, the isobutanol selectivity is lower which can be attributed to a lower basicity/acidity ratio (1.05) and Cu+/Cu0 ratio (1.55), which affected the product distribution. The reason for this is that increasing the amount of copper in the catalyst leads to the formation of larger crystals and strong basic sites, while reducing the amount of weak basic sites. As a result, it was observed that the ratio of basicity to acidity decreases to 1.05 and there are 1.55 Cu+/Cu0 surface copper species. Basic sites of medium and weak strength show a strong correlation with selectivity to isobutanol. However, Cu+/Cu0 species had a positive effect on catalyzing aldol reactions, dehydrogenation and hydrogenation, while Cu+ and Cu0 demonstrated a synergistic effect on isobutanol production. Studies have reported that the Cu+ species serves as both the active site for dehydrogenation and hydrogenation, while the Cu0 site enables the transfer of hydrogen atoms on the catalyst surface [56–58]. Furthermore, the yield towards isobutanol achieved in a gas-phase reaction was 4.8 % with Cu10/HAP 1.65 (SI, Table S3), which increased to a maximum value of 36.6 % in a liquid-phase reaction with the same catalyst. Moreover, during the pressurized reaction with N2, in liquid phase, additional reaction byproducts were recognized: acetaldehyde (Ace) resulting from the dehydrogenation of ethanol (Step I and II of Route 1 in Fig. 7), and propionaldehyde (PrCHO) formed through the dehydrogenation of 1-PrOH (Step III and IV of Route 1 in Fig. 7). The identification of these aldehydes as intermediate products aligns with literature findings [16,30], contributing to a better understanding of the condensation reaction mechanism involving ethanol and methanol (see Fig. 7, reaction scheme proposed). The catalytic activity was improved when it was carried out in the liquid phase by pressurizing the reactor with 3 MPa of N2, avoiding the vaporization of intermediates and reaction products and improving the interaction between methanol and ethanol or intermediate products and catalyst [18]. The Guerbet reaction, which produces isobutanol from mixtures of ethanol/methanol and propanol/methanol, with an organometallic catalyst and CuMgAl (18.5 wt% Cu) [34] has been described to be highly selective to isobutanol when sodium methoxide is used as a catalytic component. Notably, we replaced the sodium methoxide base with sodium hydroxide, a less corrosive base, and, in addition, we used an ethanol/methanol mixture, which is less reactive than the propanol/methanol mixture, achieving similar selectivities for isobutanol [18,33]. On the other hand, the addition of Cu to the catalyst seems to inhibit the parallel ethanol self-condensation to n-BuOH (Route 2 in Fig. 7), since the selectivity to this alcohol decreased from 47 % (HAP 1.65) to values below 10 % with Cu-supported catalysts [18,33]. 3.2.2 Effect of reaction temperature on isobutanol selectivity in a continuous flow reactor Fig. 8 shows the catalytic results during the condensation reaction of MeOH and EtOH in the fixed bed reactor. As expected, as the reaction temperature increases from 300 to 500 ºC, ethanol conversion increases for both catalysts whereas isobutanol selectivity (pink lines) reaches a maximum at 400ºC. A comparable gradual trend was observed in the ethanol conversion with varying copper loadings in the CuxHAP1.65 catalysts (Cu10HAP1.65 −35.2 nm crystal size- and Cu15HAP1.65 −53.7 nm crystal size), rising from 42 % to 60 % with changes in both copper loading and reaction temperature. Increasing the amount of copper in the catalyst can affect the strength of the basic sites and the ratio of Cu1+ to Cu0 surface species, which in turn changes the overall performance and selectivity of the catalyst in the reaction. The effect is particularly striking when examining the selectivity trends of CuxHAP1.65 catalysts, especially in the case of 1-propanol and isobutanol. At a lower reaction temperature of 300 ºC, increasing the copper loading from 10 wt% (Cu10HAP1.65) to 15 wt% (Cu15HAP1.65) resulted in a significant rise in the 1-propanol selectivity from 34 % to 51 %, while conversely, the isobutanol selectivity decreased from 34 % to 16 %. Meanwhile, the 1-propanol and PrCHO (propionaldehyde) selectivities decrease, suggesting that 1-PrOH and PrCHO are intermediate products involved in the isobutanol production (see step III to step IV of the reaction scheme, Fig. 7). This suggests that although the dehydrogenation reaction occurs, the aldol condensation of PrCHO with formaldehyde to produce iBuOH is limited (step IV to step V, scheme reaction), resulting in a decrease in the iBuOH selectivity. Conversely, when the Cu15/HAP 1.65 catalyst was utilized, the 1-PrOH selectivity decreased slightly from 32 % to 30 %, even though remaining higher than when the catalyst with a lower copper loading was used. Moreover, the conversion of 1-propanol-to-isobutanol (step III to step V, reaction scheme, Fig. 7) emerges as the rate-determining step in the overall reaction sequence for isobutanol synthesis. Interestingly, the reaction between ethanol and methanol yielded an n-butanol selectivity of around 18 % for the Cu15/HAP 1.65 catalyst in the vapor-phase of the batch reactor (table S3, SI), while in the liquid phase of the batch reactor, the selectivity of n-BuOH was around 10 %. However, for both catalysts, the selectivity of n-butanol decreased below 5 % in the continuous reactor. This demonstrates an advantage of carrying out the reaction of methanol with ethanol in a continuous flow reactor, allowing the selectivity of isobutanol to be increased while maintaining the selectivity of n-butanol at a minimum value. At 400 ºC, the Cu10/HAP 1.65 and Cu15/HAP 1.65 catalysts exhibited the highest selectivities toward isobutanol (62.2 and 46.1 %, respectively). W. Ueda et al. [41], reported that at 390 ºC, the selectivity for iBuOH over MgO catalysts was higher (46 %) than at lower temperatures. Furthermore, the 1-propanol and PrCHO selectivities decrease with temperature, suggesting that 1-PrOH and PrCHO are being converted into isobutanol, as expected. Nonetheless, as Fig. 8 shows, Cu15/HAP 1.65 displayed significantly higher selectivity to 1-PrOH than Cu10/HAP 1.65. This is attributed to the lower Cu+/Cu0 and base/acid ratio exhibited by the catalyst with 15 wt% of Cu. This suggests that the conversion of 1-PrOH to PrCHO and iBuOH is less efficient with this catalyst compared to Cu10/HAP 1.65. Interestingly, the selectivity towards n-BuOH decreased (below 5 %) in the continuous reactor, in comparison with the vapor-phase batch reactor (≈16 %, table S3, SI) and the liquid-phase batch reactor (≈10 %). Using a continuous flow reactor for methanol with ethanol reaction improves isobutanol selectivity and reduces n-butanol selectivity by suppressing ethanol self-condensation in Route 2 (Fig. 7 ). It is worth mentioning that high selectivity and yield (77.5 %) to isobutanol have been reported [34] but using a CH3OH/C3H7OH mixture as feedstock, which contributes to the rate-determining step with our catalysts, and a high contact time of 20 g h/mol, whereas we used 1.4 g h/mol. Although our highest isobutanol yield is 33.9 % (Figure S4), both our contact time and copper loading are lower compared to those reported. Particularly, our contact time is shorter and the copper loading used by us is less than 18.5 wt%. Currently, our research group is conducting further studies to investigate the effect of contact time on isobutanol yield. As previously indicated, the Guerbet reaction of MeOH and EtOH requires the presence of metal sites (Cu0) and basic/acidic sites to undergo dehydrogenation, aldol condensation, and hydrogenation reactions, which are necessary for the synthesis of Guerbet products (C3; 1-PrOH, PrCHO and C4; iBuOH and n-BuOH). The results show a close relationship between the Cu+/Cu0 ratio and the selectivity towards iBuOH. Similar to basic/acidic species; it decreased with increasing Cu loading in the HAP 1.65 support. On the other hand, in agreement with Cheng et al. [38], we found high selectivity for C3 and C4 products such as 1-PrOH, PrCHO, iBuOH and n-BuOH (Figure S5). Both catalysts showed higher production of C3 products (1-PrOH and PrCHO) at low reaction temperatures. This is attributed to the fact that 1-PrOH is formed at low temperatures by increasing the reaction temperature, this intermediate is more likely to be transformed to iBuOH. The formation of C4 products was higher at 400 ºC, due to a higher yield value of isobutanol at this reaction temperature. The Cu10/HAP1.65 catalyst demonstrates a gradual enhancement in isobutanol yield, reaching the best value of 33.9 % at the reaction temperature of 400 ºC. In contrast, Cu15/HAP1.65 shows an increase in the yield of isobutanol from 300 to 450 ºC, but decreases at 500 ºC. To elucidate the relationship between isobutanol selectivity (product distribution), basicity and Cu+/Cu0 species, we have plotted the changes in isobutanol selectivity against the ratio of weak/medium basic sites and Cu+/Cu0 ratio (see Figure S5). The selectivity for isobutanol demonstrates a positive correlation with the ratio of weak/medium basic sites and the Cu+/Cu0 ratio. This indicates the potential for a synergistic effect between Cu1+ and Cu0 species in influencing isobutanol selectivity. As mentioned previously, the incorporation of copper to the catalyst surface increases the Cu1+/Cu0 ratio and creates weak/medium basic sites when the catalyst has a lower copper loading (10 wt%), Cu1oHAP1.65. Furthermore, the Guerbet reaction of methanol + ethanol needs dehydrogenation, aldol condensation, and hydrogenation reactions (see Scheme 1 and Fig. 7), all of which require the participation of metal sites (in our case Cu1+/Cu0 species) and basic/acid sites. Specifically, it was observed that the production of isobutanol can be facilated by the Cu10HAP1.65 catalyst which showed the highest ratio for both Cu1+/Cu0 species and weak/medium basic sites. Based on the results (see Figure S5), it is noteworthy that the low copper loading optimizes the balance between weak/medium basic sites for aldol condensation reactions (propanal + formaldehyde to produce isobutanol) and Cu1+/Cu0 species for dehydrogenation and hydrogenation reactions. 3.2.3 Catalytic condensation of methanol and ethanol in a fixed bed reactor: time on stream study and recycling test Considering that the Cu10/HAP 1.65 catalyst showed higher selectivity and yield towards isobutanol at 400 ºC, its stability was studied at this temperature was studied for 6 h. Fig. 9 shows that the EtOH conversion decreased slightly over time, from 56.9 % to 52.7 %. The catalyst showed excellent stability to produce isobutanol since the selectivity towards this product only decreased from 62 % to 56 % in 6 h. On the other hand, the 1-PrOH selectivity decreased with time, while propionaldehyde increased. Furthermore, the recycling results showed good carbon balance values in the catalyst stability reaction 82.7−85.2 %. These results indicated that the Cu10/HAP 1.65 catalyst is stable for at least 6 h of reaction at 400 °C. Fig. 9 shows that the EtOH conversion decreased slightly over time, from 58 % to 51 % (fresh and spent catalyst). The deactivation of the Cu10HAP 1.65 catalyst is likely caused by the deposition of carbonaceous materials on the surface and through the agglomeration/growth of copper nanoparticles. The results showed a slight decrease in EtOH conversion and selectivity to iBuOH. We observed that both ethanol conversion and isobutanol selectivity slowly decline with time on stream, tending to a 55 % (fresh catalyst, and 50 % spent catalyst) and 58 % (fresh catalyst, and 50 % spent catalyst), while the propanal selectivity increases progressively from 15 % (fresh catalyst, and 17 % spent catalyst) to 27 % (fresh catalyst, and 28 % spent catalyst). The yields to iBuOH decreased from 34.9 % (the first hour of reaction of the fresh catalyst) to 24.1 % (the sixth hour of reaction of the spent catalyst). Indeed, the Cu+/Cu0 ratio for fresh and spent catalyst decreased from 1.87 to 1.66, respectively (Figures S6 and S7). Moreover, the surface carbon composition increased from 15.1 to 15.9 wt% which confirm that a possible deposition of organic material occurs on the catalyst surface. However, the surface amount of Cu increased from 5.4 to 8.7 wt%. This could be attributed to the increase of Cu particles after the reaction. This was confirmed by XRD analysis (Figure S8), where the size of the Cu0 crystallite was found to increase from 35.2 nm (fresh) to 38.8 nm (spent catalyst) which could be attributed to the growth or agglomeration of copper particles. This suggested that the Cu0 species were more prominently present on the surface of the spent catalyst. Consequently, the decrease in the Cu+/Cu0 ratio can be attributed to this exposure of Cu0 species on the surface. Regardless, the SSA remained at a value of 31 m2/g (fresh 28 m2/g), but the average pore size reduced from 25.5 to 13.4 nm in fresh and spent catalysts, respectively (Figure S9). This is attributed to mesopore obstruction resulting from increased Cu size and coke deposition. This experiment suggests that aldol condensation to produce isobutanol active sites is progressively deactivated (as Cu+1/Cu0 ratio decreases) by carbon deposition or by copper sintering (as crystallite size shown to increase), and this results in an increasing propanal selectivity. 4 Conclusions The results have shown that a significant improvements in catalytic performance are obtained when CuxHAP 165 catalysts are evaluated in a vapor-pase batch reactor, liquid-phase batch reactor and vapor phase in a fixed bed reactor (as a function of reaction temperature from 300 ºC to 500 ºC). Particularly when Cu10/HAP 1.65 catalyst was used in a batch reactor, the selectivity for iBuOH increased from 18 % in the vapor-phase to 65 % in the liquid phase. A positive effect is observed with the reaction time in the liquid-phase batch reactor, as it aids in identifying key intermediate products, such as ACe and PrCHO, while increasing the selectivity for isobutanol and decreasing the selectivity for n-butanol obtained with Cu15/HAP 1.65 catalyst. More importantly, upgrading from a batch reactor to a continuous flow reactor, the Cu10/HAP 1.65 catalyst demonstrated outstanding catalytic performance, 54.5 % ethanol conversion, 62.2 % isobutanol selectivity and 33.9 % isobutanol yield at 400 ºC. Consequently, the selectivity towards n-BuOH was almost inhibited and the use of NaOH base in the catalylitic system was avoided, promising features for industrial applications. Interestingly, Cu modifies the balance of base/acid sites, and greater dispersion is achieved on the Cu10/HAP 165 catalyst. This catalyst can promote a multi-step reaction smoothly, but depending on whether the MeOH with EtOH reaction is conducted in a batch reactor or a continuous flow reactor, the rate-determining step of 1-PrOH/PrCHO to isobutanol becomes more critical. Notably, at lower copper loadings, the basicity/acidity ratio (as determined by TPD) and the Cu+/Cu0 ratio (as determined by XPS) increased. This effect influenced the isobutanol selectivity, resulting in higher values of 64.8 % in a batch system at 30 atm pressure and 62.2 % in a continuous system at 400 ºC with Cu10/HAP 1.65. Cu10/HAP 1.65 catalyst is stable in a packed bed reactor but deactivates due to copper crystallites enlargement during the reaction, reducing surface copper species. CRediT authorship contribution statement Daniel Alejandro Valdivieso-Vera: Writing – review & editing, Writing – original draft, Methodology, Investigation, Formal analysis, Data curation, Conceptualization. Iván Alonso Santos-López: Writing – review & editing, Writing – original draft, Supervision, Resources, Methodology, Investigation, Funding acquisition, Formal analysis, Conceptualization. José Julián Cano-Gomez: Resources, Investigation, Data curation. Gerardo Antonio Flores-Escamilla: Resources, Methodology, Data curation. Javier Rivera de la Rosa: Methodology, Data curation. Enrique Rodríguez-Castellón: Writing – review & editing, Methodology, Investigation, Funding acquisition, Data curation. Isabel Barroso-Martín: Methodology, Investigation. M. Olga Guerrero-Pérez: Writing – review & editing, Writing – original draft, Supervision, Methodology, Investigation, Funding acquisition, Data curation, Conceptualization. Declaration of Competing Interest The authors declare the following financial interests/personal relationships which may be considered as potential competing interests: Daniel A. Valdivieso Vera reports financial support was provided by Consejo Nacional de Humanidades, Ciencias y Tecnologías (CONAHCyT). Daniel Valdivieso reports financial support was provided by Asociación Universitaria Iberoamericana de Posgrado (AUIP). M. Olga Guerrero-Peréz reports financial support was provided by Spain Ministry of Science and Innovation. Iván Alonso Santos López reports financial support was provided by Autonomous University of Nuevo Leon Faculty of Chemical Sciences. Ivan Alonso Santos Lopez reports financial support was provided by PAICyT-UANL and ProACti-UANL. If there are other authors, they declare that they have no known competing financial interests or personal relationships that could have appeared to influence the work reported in this paper. Acknowledgements Authors acknowledge the financial support of this work by PAICyT-UANL 2022 (584-IT-2022, ProACTI-UANL 2023 128-IDT-2023 PID2021–126235OB-C32 funded by MCIN/ AEI/10.13039/501100011033/ and FEDER funds, TED2021–130756B funded by MCIN/AEI/10.13039/501100011033 and by “ERDF A way of making Europe” by the European Union NextGenerationEU/PRTR. Daniel Valdivieso acknowledges the Consejo Nacional de Humanidades, Ciencias y Tecnologías (CONAHCyT) for PhD scholarship and the Asociación Universitaria Iberoamericana de Posgrado (AUIP) for the financial support granted. Appendix A Supporting information Supplementary data associated with this article can be found in the online version at doi:10.1016/j.apcata.2024.119881. Appendix A Supplementary material Supplementary material. References [1] B. Hahn-Hägerdal M. Galbe M.F. Gorwa-Grauslund G. Lidén G. Zacchi Bio-ethanol - the fuel of tomorrow from the residues of today Trends Biotechnol. 24 2006 549 556 10.1016/j.tibtech.2006.10.004 B. Hahn-Hägerdal, M. Galbe, M.F. Gorwa-Grauslund, G. Lidén, G. Zacchi, Bio-ethanol - the fuel of tomorrow from the residues of today, Trends Biotechnol 24 (2006) 549–556. https://doi.org/10.1016/j.tibtech.2006.10.004. [2] N. Savage Fuel options: the ideal biofuel Nature 474 2011 10.1038/474S09a N. Savage, Fuel options: The ideal biofuel, Nature 474 (2011). https://doi.org/10.1038/474S09a. [3] J. Hill E. Nelson D. Tilman S. Polasky D. Tiffany Environmental, economic, and energetic costs and benefits of biodiesel and ethanol biofuels Proc. Natl. Acad. Sci. 103 2006 11206 11210 10.1073/pnas.0604600103 J. Hill, E. Nelson, D. Tilman, S. Polasky, D. Tiffany, Environmental, economic, and energetic costs and benefits of biodiesel and ethanol biofuels, Proceedings of the National Academy of Sciences 103 (2006) 11206–11210. https://doi.org/10.1073/pnas.0604600103. [4] A. Irimescu Fuel conversion efficiency of a port injection engine fueled with gasoline-isobutanol blends Energy 36 2011 3030 3035 10.1016/j.energy.2011.02.047 A. Irimescu, Fuel conversion efficiency of a port injection engine fueled with gasoline-isobutanol blends, Energy 36 (2011) 3030–3035. https://doi.org/10.1016/j.energy.2011.02.047. [5] A. Gupta J.P. Verma Sustainable bio-ethanol production from agro-residues: a review Renew. Sustain. Energy Rev. 41 2015 550 567 10.1016/j.rser.2014.08.032 A. Gupta, J.P. Verma, Sustainable bio-ethanol production from agro-residues: A review, Renewable and Sustainable Energy Reviews 41 (2015) 550–567. https://doi.org/10.1016/j.rser.2014.08.032. [6] N. Savage Fuel options: the ideal biofuel Nature 474 2011 10.1038/474S09a N. Savage, Fuel options: The ideal biofuel, Nature 474 (2011). https://doi.org/10.1038/474S09a. [7] B. Rajesh Kumar S. Saravanan Use of higher alcohol biofuels in diesel engines: A review Renew. Sustain. Energy Rev. 60 2016 84 115 10.1016/j.rser.2016.01.085 B. Rajesh Kumar, S. Saravanan, Use of higher alcohol biofuels in diesel engines: A review, Renewable and Sustainable Energy Reviews 60 (2016) 84–115. https://doi.org/10.1016/j.rser.2016.01.085. [8] Erdiwansyah R. Mamat M.S.M. Sani K. Sudhakar A. Kadarohman R.E. Sardjono An overview of Higher alcohol and biodiesel as alternative fuels in engines Energy Rep. 5 2019 467 479 10.1016/j.egyr.2019.04.009 Erdiwansyah, R. Mamat, M.S.M. Sani, K. Sudhakar, A. Kadarohman, R.E. Sardjono, An overview of Higher alcohol and biodiesel as alternative fuels in engines, Energy Reports 5 (2019) 467–479. https://doi.org/10.1016/j.egyr.2019.04.009. [9] D.E. Ramey Butanol: the other alternative fuel, agricultural biofuels: technology Sustain. Profitab. 85 2007 137 〈https://www.researchgate.net/publication/284806414〉 D.E. Ramey, Butanol: The Other Alternative Fuel, Agricultural Biofuels: Technology, Sustainability and Profitability 85 (2007) 137. https://www.researchgate.net/publication/284806414. [10] M. Fenkl M. Pechout M. Vojtisek N-butanol and isobutanol as alternatives to gasoline: comparison of port fuel injector characteristics EPJ Web Conf. 114 2016 1 5 10.1051/epjconf/201611402021 M. Fenkl, M. Pechout, M. Vojtisek, N-butanol and isobutanol as alternatives to gasoline: Comparison of port fuel injector characteristics, EPJ Web Conf 114 (2016) 1–5. https://doi.org/10.1051/epjconf/201611402021. [11] V.F. Andersen J.E. Anderson T.J. Wallington S.A. Mueller O.J. Nielsen Vapor pressures of alcohol-gasoline blends Energy Fuels 24 2010 3647 3654 10.1021/ef100254w V.F. Andersen, J.E. Anderson, T.J. Wallington, S.A. Mueller, O.J. Nielsen, Vapor pressures of alcohol-gasoline blends, Energy and Fuels 24 (2010) 3647–3654. https://doi.org/10.1021/ef100254w. [12] L.M. Rodríguez-Antón F. Gutíerrez-Martín Y. Doce Physical properties of gasoline, isobutanol and ETBE binary blends in comparison with gasoline ethanol blends Fuel 166 2016 73 78 10.1016/j.fuel.2015.10.106 L.M. Rodríguez-Antón, F. Gutíerrez-Martín, Y. Doce, Physical properties of gasoline, isobutanol and ETBE binary blends in comparison with gasoline ethanol blends, Fuel 166 (2016) 73–78. https://doi.org/10.1016/j.fuel.2015.10.106. [13] M.N.A.M. Yusoff N.W.M. Zulkifli H.H. Masjuki M.H. Harith A.Z. Syahir M.A. Kalam M.F. Mansor A. Azham L.S. Khuong Performance and emission characteristics of a spark ignition engine fuelled with butanol isomer-gasoline blends Transp. Res. D. Transp. Environ. 57 2017 23 38 10.1016/j.trd.2017.09.004 M.N.A.M. Yusoff, N.W.M. Zulkifli, H.H. Masjuki, M.H. Harith, A.Z. Syahir, M.A. Kalam, M.F. Mansor, A. Azham, L.S. Khuong, Performance and emission characteristics of a spark ignition engine fuelled with butanol isomer-gasoline blends, Transp Res D Transp Environ 57 (2017) 23–38. https://doi.org/10.1016/j.trd.2017.09.004. [14] T. Wallner A. Ickes J. Wasil J. Sevik S. Miers Impact of blending gasoline with isobutanol compared to ethanol on efficiency, performance and emissions of a recreational marine 4-stroke engine SAE Tech. Pap., SAE Int. 2014 10.4271/2014-01-1230 T. Wallner, A. Ickes, J. Wasil, J. Sevik, S. Miers, Impact of blending gasoline with isobutanol compared to ethanol on efficiency, performance and emissions of a recreational marine 4-stroke engine, in: SAE Technical Papers, SAE International, 2014. https://doi.org/10.4271/2014-01-1230. [15] Y.L. Li Y.C. Yu Z.W. Wang J.F. Wang Physical and chemical properties of isobutanol-gasoline blends Environ. Prog. Sustain Energy 34 2015 908 914 10.1002/ep.12061 Y.L. Li, Y.C. Yu, Z.W. Wang, J.F. Wang, Physical and chemical properties of isobutanol-gasoline blends, Environ Prog Sustain Energy 34 (2015) 908–914. https://doi.org/10.1002/ep.12061. [16] R. Kolodziej J. Scheib Bio-isobutanol: the next-generation biofuel Hydrocarb. Process. 91 2012 79 85 R. Kolodziej, J. Scheib, Bio-isobutanol: The next-generation biofuel, Hydrocarbon Processing 91 (2012) 79–85. [17] E.I. Lan J.C. Liao Microbial synthesis of n-butanol, isobutanol, and other higher alcohols from diverse resources Bioresour. Technol. 135 2013 339 349 10.1016/j.biortech.2012.09.104 E.I. Lan, J.C. Liao, Microbial synthesis of n-butanol, isobutanol, and other higher alcohols from diverse resources, Bioresour Technol 135 (2013) 339–349. https://doi.org/10.1016/j.biortech.2012.09.104. [18] R.L. Wingad E.J.E. Bergström M. Everett K.J. Pellow D.F. Wass Catalytic conversion of methanol/ethanol to isobutanol - A highly selective route to an advanced biofuel Chem. Commun. 52 2016 5202 5204 10.1039/c6cc01599a R.L. Wingad, E.J.E. Bergström, M. Everett, K.J. Pellow, D.F. Wass, Catalytic conversion of methanol/ethanol to isobutanol - A highly selective route to an advanced biofuel, Chemical Communications 52 (2016) 5202–5204. https://doi.org/10.1039/c6cc01599a. [19] J. Scalbert F. Thibault-Starzyk R. Jacquot D. Morvan F. Meunier Ethanol condensation to butanol at high temperatures over a basic heterogeneous catalyst: how relevant is acetaldehyde self-aldolization? J. Catal. 311 2014 28 32 10.1016/j.jcat.2013.11.004 J. Scalbert, F. Thibault-Starzyk, R. Jacquot, D. Morvan, F. Meunier, Ethanol condensation to butanol at high temperatures over a basic heterogeneous catalyst: How relevant is acetaldehyde self-aldolization?, J Catal 311 (2014) 28–32. https://doi.org/10.1016/j.jcat.2013.11.004. [20] S. Hanspal Z.D. Young J.T. Prillaman R.J. Davis Influence of surface acid and base sites on the Guerbet coupling of ethanol to butanol over metal phosphate catalysts J. Catal. 352 2017 182 190 10.1016/j.jcat.2017.04.036 S. Hanspal, Z.D. Young, J.T. Prillaman, R.J. Davis, Influence of surface acid and base sites on the Guerbet coupling of ethanol to butanol over metal phosphate catalysts, J Catal 352 (2017) 182–190. https://doi.org/10.1016/j.jcat.2017.04.036. [21] S. Veibel J.I. Nielsen On the mechanism of the Guerbet reaction Tetrahedron 23 1967 1723 1733 10.1016/S0040-4020(01)82571-0 S. Veibel, J.I. Nielsen, On the mechanism of the Guerbet reaction, Tetrahedron 23 (1967) 1723–1733. https://doi.org/10.1016/S0040-4020(01)82571-0. [22] J.T. Kozlowski R.J. Davis Heterogeneous catalysts for the guerbet coupling of alcohols ACS Catal. 3 2013 1588 1600 10.1021/cs400292f J.T. Kozlowski, R.J. Davis, Heterogeneous catalysts for the guerbet coupling of alcohols, ACS Catal 3 (2013) 1588–1600. https://doi.org/10.1021/cs400292f. [23] T. Tsuchida J. Kubo T. Yoshioka S. Sakuma T. Takeguchi W. Ueda Reaction of ethanol over hydroxyapatite affected by Ca/P ratio of catalyst J. Catal. 259 2008 183 189 10.1016/j.jcat.2008.08.005 T. Tsuchida, J. Kubo, T. Yoshioka, S. Sakuma, T. Takeguchi, W. Ueda, Reaction of ethanol over hydroxyapatite affected by Ca/P ratio of catalyst, J Catal 259 (2008) 183–189. https://doi.org/10.1016/j.jcat.2008.08.005. [24] K.K. Ramasamy M. Gray H. Job D. Santosa X.S. Li A. Devaraj A. Karkamkar Y. Wang Role of calcination temperature on the hydrotalcite derived MgO-Al2O3 in converting ethanol to butanol Top. Catal. 59 2016 46 54 10.1007/s11244-015-0504-8 K.K. Ramasamy, M. Gray, H. Job, D. Santosa, X.S. Li, A. Devaraj, A. Karkamkar, Y. Wang, Role of Calcination Temperature on the Hydrotalcite Derived MgO-Al2O3 in Converting Ethanol to Butanol, Top Catal 59 (2016) 46–54. https://doi.org/10.1007/s11244-015-0504-8. [25] R.M.B. Faria D.V. César V.M.M. Salim Surface reactivity of zinc-modified hydroxyapatite Catal. Today 133–135 2008 168 173 10.1016/j.cattod.2007.12.114 R.M.B. Faria, D.V. César, V.M.M. Salim, Surface reactivity of zinc-modified hydroxyapatite, Catal Today 133–135 (2008) 168–173. https://doi.org/10.1016/j.cattod.2007.12.114. [26] S. Cimino L. Lisi S. Romanucci Catalysts for conversion of ethanol to butanol: Effect of acid-base and redox properties Catal. Today 304 2017 58 63 10.1016/j.cattod.2017.08.035 S. Cimino, L. Lisi, S. Romanucci, Catalysts for conversion of ethanol to butanol: Effect of acid-base and redox properties, Catal Today 304 (2017) 58–63. https://doi.org/10.1016/j.cattod.2017.08.035. [27] J.I. Di Cosimo V.K. Díez M. Xu E. Iglesia C.R. Apesteguía Structure and surface and catalytic properties of Mg-Al basic oxides J. Catal. 178 1998 499 510 10.1006/jcat.1998.2161 J.I. Di Cosimo, V.K. Díez, M. Xu, E. Iglesia, C.R. Apesteguía, Structure and surface and catalytic properties of Mg-Al basic oxides, J Catal 178 (1998) 499–510. https://doi.org/10.1006/jcat.1998.2161. [28] C.R. Ho S. Shylesh A.T. Bell Mechanism and kinetics of ethanol coupling to butanol over hydroxyapatite ACS Catal. 6 2016 939 948 10.1021/acscatal.5b02672 C.R. Ho, S. Shylesh, A.T. Bell, Mechanism and Kinetics of Ethanol Coupling to Butanol over Hydroxyapatite, ACS Catal 6 (2016) 939–948. https://doi.org/10.1021/acscatal.5b02672. [29] S. Ogo A. Onda K. Yanagisawa Selective synthesis of 1-butanol from ethanol over strontium phosphate hydroxyapatite catalysts Appl. Catal. A Gen. 402 2011 188 195 10.1016/j.apcata.2011.06.006 S. Ogo, A. Onda, K. Yanagisawa, Selective synthesis of 1-butanol from ethanol over strontium phosphate hydroxyapatite catalysts, Appl Catal A Gen 402 (2011) 188–195. https://doi.org/10.1016/j.apcata.2011.06.006. [30] S. Ogo A. Onda Y. Iwasa K. Hara A. Fukuoka K. Yanagisawa 1-Butanol synthesis from ethanol over strontium phosphate hydroxyapatite catalysts with various Sr/P ratios J. Catal. 296 2012 24 30 10.1016/j.jcat.2012.08.019 S. Ogo, A. Onda, Y. Iwasa, K. Hara, A. Fukuoka, K. Yanagisawa, 1-Butanol synthesis from ethanol over strontium phosphate hydroxyapatite catalysts with various Sr/P ratios, J Catal 296 (2012) 24–30. https://doi.org/10.1016/j.jcat.2012.08.019. [31] D.A. Valdivieso-Vera G.A. Flores-Escamilla J.J. Cano-Gómez I. Barroso-Martín E. Rodríguez-Castellón I.A. Santos-López M.O. Guerrero-Pérez Effect of Nb as dopant of hydrotalcite catalysts during the ethanol condensation to optimize n-Butanol production Catal. Today 433 2024 10.1016/j.cattod.2024.114658 D.A. Valdivieso-Vera, G.A. Flores-Escamilla, J.J. Cano-Gómez, I. Barroso-Martín, E. Rodríguez-Castellón, I.A. Santos-López, M.O. Guerrero-Pérez, Effect of Nb as dopant of hydrotalcite catalysts during the ethanol condensation to optimize n-Butanol production, Catal Today 433 (2024). https://doi.org/10.1016/j.cattod.2024.114658. [32] B.C. Zhou Q.N. Wang X.F. Weng L. He W.C. Li A.H. Lu Regulating aromatic alcohols distributions by cofeeding methanol with ethanol over cobalt-hydroxyapatite catalyst ChemCatChem 12 2020 2341 2347 10.1002/cctc.202000010 B.C. Zhou, Q.N. Wang, X.F. Weng, L. He, W.C. Li, A.H. Lu, Regulating Aromatic Alcohols Distributions by Cofeeding Methanol with Ethanol over Cobalt-Hydroxyapatite Catalyst, ChemCatChem 12 (2020) 2341–2347. https://doi.org/10.1002/cctc.202000010. [33] C. Carlini A. Macinai M. Marchionna M. Noviello A.M.Raspolli Galletti G. Sbrana Selective synthesis of isobutanol by means of the Guerbet reaction - Part 3: Methanol/n-propanol condensation by using bifunctional catalytic systems based on nickel, rhodium and ruthenium species with basic components J. Mol. Catal. A Chem. 206 2003 409 418 10.1016/S1381-1169(03)00453-9 C. Carlini, A. Macinai, M. Marchionna, M. Noviello, A.M.Raspolli Galletti, G. Sbrana, Selective synthesis of isobutanol by means of the Guerbet reaction - Part 3: Methanol/n-propanol condensation by using bifunctional catalytic systems based on nickel, rhodium and ruthenium species with basic components, J Mol Catal A Chem 206 (2003) 409–418. https://doi.org/10.1016/S1381-1169(03)00453-9. [34] C. Carlini M.Di Girolamo M. Marchionna M. Noviello A.M.R. Galletti G. Sbrana Selective synthesis of isobutanol by means of the Guerbet reaction part 1. Methanol/n-propanol condensation by using copper based catalytic systems J. Mol. Catal. A Chem. 184 2002 273 280 10.1016/S1381-1169(02)00007-9 C. Carlini, M.Di Girolamo, M. Marchionna, M. Noviello, A.M.R. Galletti, G. Sbrana, Selective synthesis of isobutanol by means of the Guerbet reaction part 1. Methanol/n-propanol condensation by using copper based catalytic systems, J Mol Catal A Chem 184 (2002) 273–280. https://doi.org/10.1016/S1381-1169(02)00007-9. [35] C. Carlini M. Di Girolamo A. Macinai M. Marchionna M. Noviello A.M. Raspolli Galletti G. Sbrana Selective synthesis of isobutanol by means of the Guerbet reaction part 2. Reaction of methanol/ethanol and methanol/ethanol/n-propanol mixtures over copper based/MeOna catalytic systems J. Mol. Catal. A Chem. 200 2003 137 146 10.1016/S1381-1169(03)00042-6 C. Carlini, M. Di Girolamo, A. Macinai, M. Marchionna, M. Noviello, A.M. Raspolli Galletti, G. Sbrana, Selective synthesis of isobutanol by means of the Guerbet reaction part 2. Reaction of methanol/ethanol and methanol/ethanol/n-propanol mixtures over copper based/MeOna catalytic systems, J Mol Catal A Chem 200 (2003) 137–146. https://doi.org/10.1016/S1381-1169(03)00042-6. [36] C. Carlini M. Marchionna M. Noviello A.M. Raspolli Galletti G. Sbrana F. Basile A. Vaccari Guerbet condensation of methanol with n-propanol to isobutyl alcohol over heterogeneous bifunctional catalysts based on Mg-Al mixed oxides partially substituted by different metal components J. Mol. Catal. A Chem. 232 2005 13 20 10.1016/j.molcata.2004.12.037 C. Carlini, M. Marchionna, M. Noviello, A.M. Raspolli Galletti, G. Sbrana, F. Basile, A. Vaccari, Guerbet condensation of methanol with n-propanol to isobutyl alcohol over heterogeneous bifunctional catalysts based on Mg-Al mixed oxides partially substituted by different metal components, J Mol Catal A Chem 232 (2005) 13–20. https://doi.org/10.1016/j.molcata.2004.12.037. [37] C. Carlini C. Flego M. Marchionna M. Noviello A.M. Raspolli Galletti G. Sbrana F. Basile A. Vaccari Guerbet condensation of methanol with n-propanol to isobutyl alcohol over heterogeneous copper chromite/Mg-Al mixed oxides catalysts J. Mol. Catal. A Chem. 220 2004 215 220 10.1016/j.molcata.2004.05.034 C. Carlini, C. Flego, M. Marchionna, M. Noviello, A.M. Raspolli Galletti, G. Sbrana, F. Basile, A. Vaccari, Guerbet condensation of methanol with n-propanol to isobutyl alcohol over heterogeneous copper chromite/Mg-Al mixed oxides catalysts, J Mol Catal A Chem 220 (2004) 215–220. https://doi.org/10.1016/j.molcata.2004.05.034. [38] F. Cheng H. Guo J. Cui B. Hou H. Xi L. Jia D. Li Coupling of methanol and ethanol over CuMgAlO x catalysts: the roles of copper species and alkalinity React. Kinet., Mech. Catal. 126 2019 119 136 10.1007/s11144-018-1476-z F. Cheng, H. Guo, J. Cui, B. Hou, H. Xi, L. Jia, D. Li, Coupling of methanol and ethanol over CuMgAlO x catalysts: the roles of copper species and alkalinity, Reaction Kinetics, Mechanisms and Catalysis 126 (2019) 119–136. https://doi.org/10.1007/s11144-018-1476-z. [39] F.-L. Cheng, G. He-Qin, J.-L. Cui, H. Bo, L.I. De-Bao, Guerbet reaction of methanol and ethanol catalyzed by CuMgAlO x mixed oxides: Effect of M 2+ /Al 3+ ratio, 2018. [40] Q. Liu G. Xu X. Wang X. Mu Selective upgrading of ethanol with methanol in water for the production of improved biofuel - Isobutanol Green. Chem. 18 2016 2811 2818 10.1039/c5gc02963e Q. Liu, G. Xu, X. Wang, X. Mu, Selective upgrading of ethanol with methanol in water for the production of improved biofuel - Isobutanol, Green Chemistry 18 (2016) 2811–2818. https://doi.org/10.1039/c5gc02963e. [41] W. Ueda, T. Kuwabara, T. Ohshida, Y. Morikawa, A Low-pressure Guerbet Reaction over Magnesium Oxide Catalyst, n.d. [42] J.J. Bravo-Suárez B. Subramaniam R.V. Chaudhari Vapor-phase methanol and ethanol coupling reactions on CuMgAl mixed metal oxides Appl. Catal. A Gen. 455 2013 234 246 10.1016/j.apcata.2013.01.025 J.J. Bravo-Suárez, B. Subramaniam, R.V. Chaudhari, Vapor-phase methanol and ethanol coupling reactions on CuMgAl mixed metal oxides, Appl Catal A Gen 455 (2013) 234–246. https://doi.org/10.1016/j.apcata.2013.01.025. [43] T. Tsuchida J. Kubo T. Yoshioka S. Sakuma T. Takeguchi W. Ueda Influence of preparation factors on Ca/P ratio and surface basicity of hydroxyapatite catalyst J. Jpn. Pet. Inst. 52 2009 51 59 T. Tsuchida, J. Kubo, T. Yoshioka, S. Sakuma, T. Takeguchi, W. Ueda, Influence of Preparation Factors on Ca/P Ratio and Surface Basicity of Hydroxyapatite Catalyst, Journal of the Japan Petroleum Institute 52 (2009) 51–59. [44] S. Diallo-Garcia M. Ben Osman S. Casale C. Thomas J. Kubo Identification of Surface Basic Sites and Acid − Base Pairs of Hydroxyapatite J. Phys. Chem. 118 2014 12744 12757 S. Diallo-Garcia, M. Ben Osman, S. Casale, C. Thomas, J. Kubo, Identification of Surface Basic Sites and Acid − Base Pairs of Hydroxyapatite, Journal of Physical Chemistry 118 (2014) 12744–12757. [45] T. Fujii, Y. Saito, Catalytic dehydrogenation of methanol with ruthenium complexes, 1991. [46] M.A. Pogosova L.V. González Influence of anion substitution on the crystal structure and color properties of copper-doped strontium hydroxyapatite Ceram. Int. 44 2018 20140 20147 10.1016/j.ceramint.2018.07.307 M.A. Pogosova, L.V. González, Influence of anion substitution on the crystal structure and color properties of copper-doped strontium hydroxyapatite, Ceram Int 44 (2018) 20140–20147. https://doi.org/10.1016/j.ceramint.2018.07.307. [47] J. Guo H. Yu F. Dong B. Zhu W. Huang S. Zhang High efficiency and stability of Au-Cu/hydroxyapatite catalyst for the oxidation of carbon monoxide RSC Adv. 7 2017 45420 45431 10.1039/c7ra08781k J. Guo, H. Yu, F. Dong, B. Zhu, W. Huang, S. Zhang, High efficiency and stability of Au-Cu/hydroxyapatite catalyst for the oxidation of carbon monoxide, RSC Adv 7 (2017) 45420–45431. https://doi.org/10.1039/c7ra08781k. [48] U. Iriarte-Velasco J.L. Ayastuy R. Bravo Z. Boukha M.A. Gutiérrez-Ortiz Biogenic hydroxyapatite as novel catalytic support for Ni and Cu for the water–gas shift reaction J. Mater. Sci. 56 2021 6745 6763 10.1007/s10853-020-05724-x U. Iriarte-Velasco, J.L. Ayastuy, R. Bravo, Z. Boukha, M.A. Gutiérrez-Ortiz, Biogenic hydroxyapatite as novel catalytic support for Ni and Cu for the water–gas shift reaction, J Mater Sci 56 (2021) 6745–6763. https://doi.org/10.1007/s10853-020-05724-x. [49] D. Goma J.J. Delgado L. Lefferts J. Faria J.J. Calvino M.Á. Cauqui Catalytic performance of Ni/CeO2/X-ZrO2 (X = ca, y) catalysts in the aqueous-phase reforming of methanol Nanomaterials 9 2019 10.3390/nano9111582 D. Goma, J.J. Delgado, L. Lefferts, J. Faria, J.J. Calvino, M.Á. Cauqui, Catalytic performance of Ni/CeO2/X-ZrO2 (X = ca, y) catalysts in the aqueous-phase reforming of methanol, Nanomaterials 9 (2019). https://doi.org/10.3390/nano9111582. [50] I.M. Hill S. Hanspal Z.D. Young R.J. Davis DRIFTS of probe molecules adsorbed on magnesia, zirconia, and hydroxyapatite catalysts J. Phys. Chem. C. 119 2015 9186 9197 10.1021/jp509889j I.M. Hill, S. Hanspal, Z.D. Young, R.J. Davis, DRIFTS of Probe Molecules Adsorbed on Magnesia, Zirconia, and Hydroxyapatite Catalysts, Journal of Physical Chemistry C 119 (2015) 9186–9197. https://doi.org/10.1021/jp509889j. [51] Y. Shao K. Sun Q. Li Q. Liu S. Zhang Q. Liu G. Hu X. Hu Copper-based catalysts with tunable acidic and basic sites for the selective conversion of levulinic acid/ester to γ-valerolactone or 1,4-pentanediol Green. Chem. 21 2019 4499 4511 10.1039/c9gc01706b Y. Shao, K. Sun, Q. Li, Q. Liu, S. Zhang, Q. Liu, G. Hu, X. Hu, Copper-based catalysts with tunable acidic and basic sites for the selective conversion of levulinic acid/ester to γ-valerolactone or 1,4-pentanediol, Green Chemistry 21 (2019) 4499–4511. https://doi.org/10.1039/c9gc01706b. [52] W. Zhou W. Lu H. Wang Z. Xia S. Zhai Z. Zhang Y. Ma M. He Q. Chen CuMgAl hydrotalcite as an efficient bifunctional catalyst for the cross-dehydrogenative C–C coupling reactions under mild conditions Appl. Catal. A Gen. 604 2020 10.1016/j.apcata.2020.117771 W. Zhou, W. Lu, H. Wang, Z. Xia, S. Zhai, Z. Zhang, Y. Ma, M. He, Q. Chen, CuMgAl hydrotalcite as an efficient bifunctional catalyst for the cross-dehydrogenative C–C coupling reactions under mild conditions, Appl Catal A Gen 604 (2020). https://doi.org/10.1016/j.apcata.2020.117771. [53] M.C. Biesinger Advanced analysis of copper X-ray photoelectron spectra Surf. Interface Anal. 49 2017 1325 1334 10.1002/sia.6239 M.C. Biesinger, Advanced analysis of copper X-ray photoelectron spectra, Surface and Interface Analysis 49 (2017) 1325–1334. https://doi.org/10.1002/sia.6239. [54] K. Saito S. Kagawa M. Ogasawara S. Kato Multiple incorporation of copper and iron ions into the channel of hydroxyapatite J. Solid State Chem. 317 2023 10.1016/j.jssc.2022.123673 K. Saito, S. Kagawa, M. Ogasawara, S. Kato, Multiple incorporation of copper and iron ions into the channel of hydroxyapatite, J Solid State Chem 317 (2023). https://doi.org/10.1016/j.jssc.2022.123673. [55] G.C. Gomes F.F. Borghi R.O. Ospina E.O. López F.O. Borges A. Mello Nd:YAG (532 nm) pulsed laser deposition produces crystalline hydroxyapatite thin coatings at room temperature Surf. Coat. Technol. 329 2017 174 183 10.1016/j.surfcoat.2017.09.008 G.C. Gomes, F.F. Borghi, R.O. Ospina, E.O. López, F.O. Borges, A. Mello, Nd:YAG (532 nm) pulsed laser deposition produces crystalline hydroxyapatite thin coatings at room temperature, Surf Coat Technol 329 (2017) 174–183. https://doi.org/10.1016/j.surfcoat.2017.09.008. [56] Y. Ren Y. Yang L. Chen L. Wang Y. Shi P. Yin W. Wang M. Shao X. Zhang M. Wei Synergetic effect of Cu0 −Cu+ derived from layered double hydroxides toward catalytic transfer hydrogenation reaction Appl. Catal. B 314 2022 121515 10.1016/j.apcatb.2022.121515 Y. Ren, Y. Yang, L. Chen, L. Wang, Y. Shi, P. Yin, W. Wang, M. Shao, X. Zhang, M. Wei, Synergetic effect of Cu0 −Cu+ derived from layered double hydroxides toward catalytic transfer hydrogenation reaction, Appl Catal B 314 (2022) 121515. https://doi.org/https://doi.org/10.1016/j.apcatb.2022.121515. [57] J. Zhang Z. Jia S. Yu S. Liu L. Li C. Xie Q. Wu Y. Zhang H. Yu Y. Liu J. Pang Y. Liu Regulating the Cu0-Cu+ ratio to enhance metal-support interaction for selective hydrogenation of furfural under mild conditions Chem. Eng. J. 468 2023 143755 10.1016/j.cej.2023.143755 J. Zhang, Z. Jia, S. Yu, S. Liu, L. Li, C. Xie, Q. Wu, Y. Zhang, H. Yu, Y. Liu, J. Pang, Y. Liu, Regulating the Cu0-Cu+ ratio to enhance metal-support interaction for selective hydrogenation of furfural under mild conditions, Chemical Engineering Journal 468 (2023) 143755. https://doi.org/https://doi.org/10.1016/j.cej.2023.143755. [58] C. Si H. Ban K. Chen X. Wang R. Cao Q. Yi Z. Qin L. Shi Z. Li W. Cai C. Li Insight into the positive effect of Cu0/Cu+ ratio on the stability of Cu-ZnO-CeO2 catalyst for syngas hydrogenation Appl. Catal. A Gen. 594 2020 10.1016/j.apcata.2020.117466 C. Si, H. Ban, K. Chen, X. Wang, R. Cao, Q. Yi, Z. Qin, L. Shi, Z. Li, W. Cai, C. Li, Insight into the positive effect of Cu0/Cu+ ratio on the stability of Cu-ZnO-CeO2 catalyst for syngas hydrogenation, Appl Catal A Gen 594 (2020). https://doi.org/10.1016/j.apcata.2020.117466.",
      "scopus-id": "85199310301",
      "coredata": {
        "eid": "1-s2.0-S0926860X24003260",
        "dc:description": "Developing high-performance catalysts for the direct production of isobutanol through the Guerbet reaction is a challenge today, due to the potential of isobutanol as fuel. The present study describes the synthesis and characterization of Cu-supported hydroxyapatite catalysts. The synthesis of isobutanol has been investigated through batch experiments and in a continuous-flow reactor operating in a gas-solid phase. This study used ethanol and methanol as the primary feedstock for the synthesis process. It was found that Cu supported hydroxyapatite catalysts are capable of catalyzing the formation of isobutanol from CH3OH and C2H5OH at temperatures (300–500 ºC) and 1 atm in a continuous flow reactor. Notably, the highest selectivity to isobutanol was observed at 400 ºC. The use of Cu10/HAP 1.65 catalyst in a batch reactor greatly enhances the selectivity of iBuOH in the liquid phase, increasing it from 18 % (vapor-phase) to 65 %. The data showed that the reaction of ethanol/methanol was limited by the 1-propanol-to-isobutanol reaction, which is a secondary reaction of the key intermediate. A reaction scheme has been proposed.",
        "openArchiveArticle": "false",
        "prism:coverDate": "2024-09-25",
        "openaccessUserLicense": null,
        "prism:aggregationType": "Journal",
        "prism:url": "https://api.elsevier.com/content/article/pii/S0926860X24003260",
        "dc:creator": [
          {
            "@_fa": "true",
            "$": "Valdivieso-Vera, Daniel Alejandro"
          },
          {
            "@_fa": "true",
            "$": "Santos-López, Iván Alonso"
          },
          {
            "@_fa": "true",
            "$": "Cano-Gomez, José Julián"
          },
          {
            "@_fa": "true",
            "$": "Flores-Escamilla, Gerardo Antonio"
          },
          {
            "@_fa": "true",
            "$": "de la Rosa, Javier Rivera"
          },
          {
            "@_fa": "true",
            "$": "Rodríguez-Castellón, Enrique"
          },
          {
            "@_fa": "true",
            "$": "Barroso-Martín, Isabel"
          },
          {
            "@_fa": "true",
            "$": "Olga Guerrero-Pérez, M."
          }
        ],
        "link": [
          {
            "@_fa": "true",
            "@rel": "self",
            "@href": "https://api.elsevier.com/content/article/pii/S0926860X24003260"
          },
          {
            "@_fa": "true",
            "@rel": "scidir",
            "@href": "https://www.sciencedirect.com/science/article/pii/S0926860X24003260"
          }
        ],
        "dc:format": "application/json",
        "openaccessType": null,
        "pii": "S0926-860X(24)00326-0",
        "prism:volume": "685",
        "articleNumber": "119881",
        "prism:publisher": "Elsevier B.V. All rights are reserved, including those for text and data mining, AI training, and similar technologies.",
        "dc:title": "Copper-supported hydroxyapatite catalysts for bio-isobutanol synthesis from sustainable short-chain alcohols",
        "prism:copyright": "© 2024 Elsevier B.V. All rights are reserved, including those for text and data mining, AI training, and similar technologies.",
        "openaccess": "0",
        "prism:issn": "0926860X",
        "dcterms:subject": [
          {
            "@_fa": "true",
            "$": "Isobutanol"
          },
          {
            "@_fa": "true",
            "$": "Bioethanol"
          },
          {
            "@_fa": "true",
            "$": "Copper-hydroxyapatite"
          },
          {
            "@_fa": "true",
            "$": "Guerbet reaction"
          }
        ],
        "openaccessArticle": "false",
        "prism:publicationName": "Applied Catalysis A: General",
        "openaccessSponsorType": null,
        "prism:pageRange": "119881",
        "pubType": "fla",
        "prism:coverDisplayDate": "25 September 2024",
        "prism:doi": "10.1016/j.apcata.2024.119881",
        "prism:startingPage": "119881",
        "dc:identifier": "doi:10.1016/j.apcata.2024.119881",
        "openaccessSponsorName": null
      },
      "objects": {
        "object": [
          {
            "@category": "standard",
            "@height": "339",
            "@width": "565",
            "@_fa": "true",
            "$": "https://api.elsevier.com/content/object/eid/1-s2.0-S0926860X24003260-gr6.jpg?httpAccept=%2A%2F%2A",
            "@multimediatype": "JPEG image file",
            "@type": "IMAGE-DOWNSAMPLED",
            "@size": "55643",
            "@ref": "gr6",
            "@mimetype": "image/jpeg"
          },
          {
            "@category": "standard",
            "@height": "242",
            "@width": "376",
            "@_fa": "true",
            "$": "https://api.elsevier.com/content/object/eid/1-s2.0-S0926860X24003260-gr7.jpg?httpAccept=%2A%2F%2A",
            "@multimediatype": "JPEG image file",
            "@type": "IMAGE-DOWNSAMPLED",
            "@size": "28668",
            "@ref": "gr7",
            "@mimetype": "image/jpeg"
          },
          {
            "@category": "standard",
            "@height": "397",
            "@width": "282",
            "@_fa": "true",
            "$": "https://api.elsevier.com/content/object/eid/1-s2.0-S0926860X24003260-gr4.jpg?httpAccept=%2A%2F%2A",
            "@multimediatype": "JPEG image file",
            "@type": "IMAGE-DOWNSAMPLED",
            "@size": "32798",
            "@ref": "gr4",
            "@mimetype": "image/jpeg"
          },
          {
            "@category": "standard",
            "@height": "277",
            "@width": "339",
            "@_fa": "true",
            "$": "https://api.elsevier.com/content/object/eid/1-s2.0-S0926860X24003260-gr5.jpg?httpAccept=%2A%2F%2A",
            "@multimediatype": "JPEG image file",
            "@type": "IMAGE-DOWNSAMPLED",
            "@size": "23878",
            "@ref": "gr5",
            "@mimetype": "image/jpeg"
          },
          {
            "@category": "standard",
            "@height": "383",
            "@width": "565",
            "@_fa": "true",
            "$": "https://api.elsevier.com/content/object/eid/1-s2.0-S0926860X24003260-gr8.jpg?httpAccept=%2A%2F%2A",
            "@multimediatype": "JPEG image file",
            "@type": "IMAGE-DOWNSAMPLED",
            "@size": "55572",
            "@ref": "gr8",
            "@mimetype": "image/jpeg"
          },
          {
            "@category": "standard",
            "@height": "361",
            "@width": "565",
            "@_fa": "true",
            "$": "https://api.elsevier.com/content/object/eid/1-s2.0-S0926860X24003260-gr9.jpg?httpAccept=%2A%2F%2A",
            "@multimediatype": "JPEG image file",
            "@type": "IMAGE-DOWNSAMPLED",
            "@size": "45996",
            "@ref": "gr9",
            "@mimetype": "image/jpeg"
          },
          {
            "@category": "standard",
            "@height": "407",
            "@width": "659",
            "@_fa": "true",
            "$": "https://api.elsevier.com/content/object/eid/1-s2.0-S0926860X24003260-sc1.jpg?httpAccept=%2A%2F%2A",
            "@multimediatype": "JPEG image file",
            "@type": "IMAGE-DOWNSAMPLED",
            "@size": "57050",
            "@ref": "sc1",
            "@mimetype": "image/jpeg"
          },
          {
            "@category": "standard",
            "@height": "265",
            "@width": "339",
            "@_fa": "true",
            "$": "https://api.elsevier.com/content/object/eid/1-s2.0-S0926860X24003260-gr2.jpg?httpAccept=%2A%2F%2A",
            "@multimediatype": "JPEG image file",
            "@type": "IMAGE-DOWNSAMPLED",
            "@size": "21784",
            "@ref": "gr2",
            "@mimetype": "image/jpeg"
          },
          {
            "@category": "standard",
            "@height": "200",
            "@width": "443",
            "@_fa": "true",
            "$": "https://api.elsevier.com/content/object/eid/1-s2.0-S0926860X24003260-ga1.jpg?httpAccept=%2A%2F%2A",
            "@multimediatype": "JPEG image file",
            "@type": "IMAGE-DOWNSAMPLED",
            "@size": "38270",
            "@ref": "ga1",
            "@mimetype": "image/jpeg"
          },
          {
            "@category": "standard",
            "@height": "396",
            "@width": "282",
            "@_fa": "true",
            "$": "https://api.elsevier.com/content/object/eid/1-s2.0-S0926860X24003260-gr3.jpg?httpAccept=%2A%2F%2A",
            "@multimediatype": "JPEG image file",
            "@type": "IMAGE-DOWNSAMPLED",
            "@size": "30951",
            "@ref": "gr3",
            "@mimetype": "image/jpeg"
          },
          {
            "@category": "standard",
            "@height": "281",
            "@width": "339",
            "@_fa": "true",
            "$": "https://api.elsevier.com/content/object/eid/1-s2.0-S0926860X24003260-gr1.jpg?httpAccept=%2A%2F%2A",
            "@multimediatype": "JPEG image file",
            "@type": "IMAGE-DOWNSAMPLED",
            "@size": "25758",
            "@ref": "gr1",
            "@mimetype": "image/jpeg"
          },
          {
            "@category": "thumbnail",
            "@height": "132",
            "@width": "219",
            "@_fa": "true",
            "$": "https://api.elsevier.com/content/object/eid/1-s2.0-S0926860X24003260-gr6.sml?httpAccept=%2A%2F%2A",
            "@multimediatype": "GIF image file",
            "@type": "IMAGE-THUMBNAIL",
            "@size": "10479",
            "@ref": "gr6",
            "@mimetype": "image/gif"
          },
          {
            "@category": "thumbnail",
            "@height": "141",
            "@width": "219",
            "@_fa": "true",
            "$": "https://api.elsevier.com/content/object/eid/1-s2.0-S0926860X24003260-gr7.sml?httpAccept=%2A%2F%2A",
            "@multimediatype": "GIF image file",
            "@type": "IMAGE-THUMBNAIL",
            "@size": "11248",
            "@ref": "gr7",
            "@mimetype": "image/gif"
          },
          {
            "@category": "thumbnail",
            "@height": "163",
            "@width": "116",
            "@_fa": "true",
            "$": "https://api.elsevier.com/content/object/eid/1-s2.0-S0926860X24003260-gr4.sml?httpAccept=%2A%2F%2A",
            "@multimediatype": "GIF image file",
            "@type": "IMAGE-THUMBNAIL",
            "@size": "6418",
            "@ref": "gr4",
            "@mimetype": "image/gif"
          },
          {
            "@category": "thumbnail",
            "@height": "164",
            "@width": "200",
            "@_fa": "true",
            "$": "https://api.elsevier.com/content/object/eid/1-s2.0-S0926860X24003260-gr5.sml?httpAccept=%2A%2F%2A",
            "@multimediatype": "GIF image file",
            "@type": "IMAGE-THUMBNAIL",
            "@size": "7399",
            "@ref": "gr5",
            "@mimetype": "image/gif"
          },
          {
            "@category": "thumbnail",
            "@height": "148",
            "@width": "219",
            "@_fa": "true",
            "$": "https://api.elsevier.com/content/object/eid/1-s2.0-S0926860X24003260-gr8.sml?httpAccept=%2A%2F%2A",
            "@multimediatype": "GIF image file",
            "@type": "IMAGE-THUMBNAIL",
            "@size": "10074",
            "@ref": "gr8",
            "@mimetype": "image/gif"
          },
          {
            "@category": "thumbnail",
            "@height": "140",
            "@width": "219",
            "@_fa": "true",
            "$": "https://api.elsevier.com/content/object/eid/1-s2.0-S0926860X24003260-gr9.sml?httpAccept=%2A%2F%2A",
            "@multimediatype": "GIF image file",
            "@type": "IMAGE-THUMBNAIL",
            "@size": "8492",
            "@ref": "gr9",
            "@mimetype": "image/gif"
          },
          {
            "@category": "thumbnail",
            "@height": "135",
            "@width": "219",
            "@_fa": "true",
            "$": "https://api.elsevier.com/content/object/eid/1-s2.0-S0926860X24003260-sc1.sml?httpAccept=%2A%2F%2A",
            "@multimediatype": "GIF image file",
            "@type": "IMAGE-THUMBNAIL",
            "@size": "8717",
            "@ref": "sc1",
            "@mimetype": "image/gif"
          },
          {
            "@category": "thumbnail",
            "@height": "164",
            "@width": "210",
            "@_fa": "true",
            "$": "https://api.elsevier.com/content/object/eid/1-s2.0-S0926860X24003260-gr2.sml?httpAccept=%2A%2F%2A",
            "@multimediatype": "GIF image file",
            "@type": "IMAGE-THUMBNAIL",
            "@size": "7582",
            "@ref": "gr2",
            "@mimetype": "image/gif"
          },
          {
            "@category": "thumbnail",
            "@height": "99",
            "@width": "219",
            "@_fa": "true",
            "$": "https://api.elsevier.com/content/object/eid/1-s2.0-S0926860X24003260-ga1.sml?httpAccept=%2A%2F%2A",
            "@multimediatype": "GIF image file",
            "@type": "IMAGE-THUMBNAIL",
            "@size": "12181",
            "@ref": "ga1",
            "@mimetype": "image/gif"
          },
          {
            "@category": "thumbnail",
            "@height": "163",
            "@width": "116",
            "@_fa": "true",
            "$": "https://api.elsevier.com/content/object/eid/1-s2.0-S0926860X24003260-gr3.sml?httpAccept=%2A%2F%2A",
            "@multimediatype": "GIF image file",
            "@type": "IMAGE-THUMBNAIL",
            "@size": "6268",
            "@ref": "gr3",
            "@mimetype": "image/gif"
          },
          {
            "@category": "thumbnail",
            "@height": "164",
            "@width": "198",
            "@_fa": "true",
            "$": "https://api.elsevier.com/content/object/eid/1-s2.0-S0926860X24003260-gr1.sml?httpAccept=%2A%2F%2A",
            "@multimediatype": "GIF image file",
            "@type": "IMAGE-THUMBNAIL",
            "@size": "8198",
            "@ref": "gr1",
            "@mimetype": "image/gif"
          },
          {
            "@category": "high",
            "@height": "1499",
            "@width": "2495",
            "@_fa": "true",
            "$": "https://api.elsevier.com/content/object/eid/1-s2.0-S0926860X24003260-gr6_lrg.jpg?httpAccept=%2A%2F%2A",
            "@multimediatype": "JPEG image file",
            "@type": "IMAGE-HIGH-RES",
            "@size": "307860",
            "@ref": "gr6",
            "@mimetype": "image/jpeg"
          },
          {
            "@category": "high",
            "@height": "1071",
            "@width": "1663",
            "@_fa": "true",
            "$": "https://api.elsevier.com/content/object/eid/1-s2.0-S0926860X24003260-gr7_lrg.jpg?httpAccept=%2A%2F%2A",
            "@multimediatype": "JPEG image file",
            "@type": "IMAGE-HIGH-RES",
            "@size": "145612",
            "@ref": "gr7",
            "@mimetype": "image/jpeg"
          },
          {
            "@category": "high",
            "@height": "1756",
            "@width": "1247",
            "@_fa": "true",
            "$": "https://api.elsevier.com/content/object/eid/1-s2.0-S0926860X24003260-gr4_lrg.jpg?httpAccept=%2A%2F%2A",
            "@multimediatype": "JPEG image file",
            "@type": "IMAGE-HIGH-RES",
            "@size": "184152",
            "@ref": "gr4",
            "@mimetype": "image/jpeg"
          },
          {
            "@category": "high",
            "@height": "1225",
            "@width": "1497",
            "@_fa": "true",
            "$": "https://api.elsevier.com/content/object/eid/1-s2.0-S0926860X24003260-gr5_lrg.jpg?httpAccept=%2A%2F%2A",
            "@multimediatype": "JPEG image file",
            "@type": "IMAGE-HIGH-RES",
            "@size": "180183",
            "@ref": "gr5",
            "@mimetype": "image/jpeg"
          },
          {
            "@category": "high",
            "@height": "1691",
            "@width": "2495",
            "@_fa": "true",
            "$": "https://api.elsevier.com/content/object/eid/1-s2.0-S0926860X24003260-gr8_lrg.jpg?httpAccept=%2A%2F%2A",
            "@multimediatype": "JPEG image file",
            "@type": "IMAGE-HIGH-RES",
            "@size": "292929",
            "@ref": "gr8",
            "@mimetype": "image/jpeg"
          },
          {
            "@category": "high",
            "@height": "1592",
            "@width": "2495",
            "@_fa": "true",
            "$": "https://api.elsevier.com/content/object/eid/1-s2.0-S0926860X24003260-gr9_lrg.jpg?httpAccept=%2A%2F%2A",
            "@multimediatype": "JPEG image file",
            "@type": "IMAGE-HIGH-RES",
            "@size": "247834",
            "@ref": "gr9",
            "@mimetype": "image/jpeg"
          },
          {
            "@category": "high",
            "@height": "1798",
            "@width": "2911",
            "@_fa": "true",
            "$": "https://api.elsevier.com/content/object/eid/1-s2.0-S0926860X24003260-sc1_lrg.jpg?httpAccept=%2A%2F%2A",
            "@multimediatype": "JPEG image file",
            "@type": "IMAGE-HIGH-RES",
            "@size": "294463",
            "@ref": "sc1",
            "@mimetype": "image/jpeg"
          },
          {
            "@category": "high",
            "@height": "1169",
            "@width": "1497",
            "@_fa": "true",
            "$": "https://api.elsevier.com/content/object/eid/1-s2.0-S0926860X24003260-gr2_lrg.jpg?httpAccept=%2A%2F%2A",
            "@multimediatype": "JPEG image file",
            "@type": "IMAGE-HIGH-RES",
            "@size": "125564",
            "@ref": "gr2",
            "@mimetype": "image/jpeg"
          },
          {
            "@category": "high",
            "@height": "886",
            "@width": "1963",
            "@_fa": "true",
            "$": "https://api.elsevier.com/content/object/eid/1-s2.0-S0926860X24003260-ga1_lrg.jpg?httpAccept=%2A%2F%2A",
            "@multimediatype": "JPEG image file",
            "@type": "IMAGE-HIGH-RES",
            "@size": "279910",
            "@ref": "ga1",
            "@mimetype": "image/jpeg"
          },
          {
            "@category": "high",
            "@height": "1751",
            "@width": "1247",
            "@_fa": "true",
            "$": "https://api.elsevier.com/content/object/eid/1-s2.0-S0926860X24003260-gr3_lrg.jpg?httpAccept=%2A%2F%2A",
            "@multimediatype": "JPEG image file",
            "@type": "IMAGE-HIGH-RES",
            "@size": "169266",
            "@ref": "gr3",
            "@mimetype": "image/jpeg"
          },
          {
            "@category": "high",
            "@height": "1240",
            "@width": "1497",
            "@_fa": "true",
            "$": "https://api.elsevier.com/content/object/eid/1-s2.0-S0926860X24003260-gr1_lrg.jpg?httpAccept=%2A%2F%2A",
            "@multimediatype": "JPEG image file",
            "@type": "IMAGE-HIGH-RES",
            "@size": "146648",
            "@ref": "gr1",
            "@mimetype": "image/jpeg"
          },
          {
            "@category": "standard",
            "@_fa": "true",
            "$": "https://api.elsevier.com/content/object/eid/1-s2.0-S0926860X24003260-mmc1.docx?httpAccept=%2A%2F%2A",
            "@multimediatype": "Microsoft Word file",
            "@type": "APPLICATION",
            "@size": "2994452",
            "@ref": "mmc1",
            "@mimetype": "application/word"
          },
          {
            "@category": "thumbnail",
            "@_fa": "true",
            "$": "https://api.elsevier.com/content/object/eid/1-s2.0-S0926860X24003260-si0001.svg?httpAccept=%2A%2F%2A",
            "@multimediatype": "Scalable Vector Graphics file",
            "@type": "ALTIMG",
            "@size": "1154",
            "@ref": "si0001",
            "@mimetype": "image/svg+xml"
          },
          {
            "@category": "thumbnail",
            "@_fa": "true",
            "$": "https://api.elsevier.com/content/object/eid/1-s2.0-S0926860X24003260-si0002.svg?httpAccept=%2A%2F%2A",
            "@multimediatype": "Scalable Vector Graphics file",
            "@type": "ALTIMG",
            "@size": "1106",
            "@ref": "si0002",
            "@mimetype": "image/svg+xml"
          },
          {
            "@category": "thumbnail",
            "@_fa": "true",
            "$": "https://api.elsevier.com/content/object/eid/1-s2.0-S0926860X24003260-si0003.svg?httpAccept=%2A%2F%2A",
            "@multimediatype": "Scalable Vector Graphics file",
            "@type": "ALTIMG",
            "@size": "1106",
            "@ref": "si0003",
            "@mimetype": "image/svg+xml"
          },
          {
            "@category": "thumbnail",
            "@_fa": "true",
            "$": "https://api.elsevier.com/content/object/eid/1-s2.0-S0926860X24003260-si0004.svg?httpAccept=%2A%2F%2A",
            "@multimediatype": "Scalable Vector Graphics file",
            "@type": "ALTIMG",
            "@size": "2216",
            "@ref": "si0004",
            "@mimetype": "image/svg+xml"
          },
          {
            "@category": "thumbnail",
            "@_fa": "true",
            "$": "https://api.elsevier.com/content/object/eid/1-s2.0-S0926860X24003260-si0005.svg?httpAccept=%2A%2F%2A",
            "@multimediatype": "Scalable Vector Graphics file",
            "@type": "ALTIMG",
            "@size": "1369",
            "@ref": "si0005",
            "@mimetype": "image/svg+xml"
          },
          {
            "@category": "standard",
            "@_fa": "true",
            "$": "https://api.elsevier.com/content/object/eid/1-s2.0-S0926860X24003260-am.pdf?httpAccept=%2A%2F%2A",
            "@multimediatype": "Acrobat PDF file",
            "@type": "AAM-PDF",
            "@size": "1146866",
            "@ref": "am",
            "@mimetype": "application/pdf"
          }
        ]
      },
      "link": {
        "@rel": "abstract",
        "@href": "https://api.elsevier.com/content/abstract/scopus_id/85199310301"
      }
    }
  }
}