{
  "metadata": {
    "title": "Nitrogen-doped carbon nanotubes decorated silicon carbide as a metal-free catalyst for partial oxidation of H<ce:inf loc=post>2</ce:inf>S",
    "authors": "; ; ",
    "journal": "Applied Catalysis A: General",
    "date": "2014-07-22",
    "doi": "10.1016/j.apcata.2014.06.010",
    "abstract": "",
    "uri": "https://api.elsevier.com/content/article/pii/S0926860X14003962",
    "pii": "S0926860X14003962"
  },
  "fulltext": {
    "full-text-retrieval-response": {
      "scopus-eid": "2-s2.0-84904292368",
      "originalText": "serial JL 271346 291210 291744 291809 31 Applied Catalysis A: General APPLIEDCATALYSISAGENERAL 2014-06-17 2014-06-17 2014-07-21T16:56:42 1-s2.0-S0926860X14003962 S0926-860X(14)00396-2 S0926860X14003962 10.1016/j.apcata.2014.06.010 S300 S300.1 FULL-TEXT 1-s2.0-S0926860X14X0013X 2024-01-01T12:30:29.635264Z 0 0 20140722 2014 2014-06-17T00:00:00Z absattachment articleinfo articletitlenorm authfirstinitialnorm authfirstsurnamenorm cid cids contenttype copyright crossmark dateloaded dateloadedtxt datesearch datesort dateupdated dco docsubtype doctype doi eid ewtransactionid hubeid indexeddate issn issnnorm itemstage itemtransactionid itemweight openaccess openarchive pg pgfirst pglast pii piinorm pubdatestart pubdatetxt pubyr sectiontitle sortorder srctitle srctitlenorm srctype subheadings suppl tomb volfirst volissue volumelist webpdf webpdfpagecount yearnav figure table body acknowledge affil articletitle auth authfirstini authfull authkeywords authlast highlightsabst primabst ref specialabst alllist content subj ssids 0926-860X 0926860X true 482 482 C Volume 482 50 397 406 397 406 20140722 22 July 2014 2014-07-22 2014 Articles article fla Copyright © 2014 Elsevier B.V. All rights reserved. NITROGENDOPEDCARBONNANOTUBESDECORATEDSILICONCARBIDEAMETALFREECATALYSTFORPARTIALOXIDATIONH2S CUONG D 1 Introduction 2 Experimental 2.1 Silicon carbide supports 2.2 Synthesis of the N-CNT/SiC composite 2.3 Characterization techniques 2.4 Selective oxidation of H2S 3 Results and discussion 3.1 N-CNT/SiC characteristics 3.2 Selective oxidation of H2S 3.2.1 Influence of the reaction temperature 3.2.2 Influence of the N-CNT loading 3.2.3 Influence of the O2-to-H2S molar ratio 3.2.4 Desulfurization performance between N-CNT/SiC and Fe2O3/SiC catalysts 3.3 Characteristics of the spent catalysts 4 Conclusion Acknowledgements References YASUDA 2013 9627 9629 S TUCI 2013 2108 2111 G QU 2010 1321 1326 L NEDERLOF 2012 163 173 C BEGIN 2009 119 123 D CHEN 2013 8151 8153 C AMADOU 2008 62 68 J VILLA 2009 4405 4407 A VILLA 2010 241 245 A CAO 2013 433 442 Y CHIZARI 2012 102 108 K LUO 2013 44 49 J SU 2013 5782 5816 D WANG 2012 781 794 H YU 2010 2165 2173 D PENG 2003 513 517 S SU 2010 169 180 D VANDOMMELE 2006 4859 4861 S FABA 2013 155 161 L GAO 2013 2109 2113 Y CONNOCK 1998 257 L CHUN 1998 235 S ESTEP 1962 315 J ADVANCESINPETROLEUMCHEMISTRYREFINING WIECKOWSKA 1995 405 J LEDOUX 2000 157 163 M KELLER 2001 205 217 N NGUYEN 2007 300 310 P NGUYEN 2011 443 454 P DENEUVE 2010 52 61 A FLOREA 2010 2668 2678 I CHIZARI 2010 72 80 K AMADOU 2008 62 68 J FLOREA 2012 9672 9680 I TESSONNIER 2011 824 847 J CHEN 2013 1964 1971 P JANOWSKA 2007 92 97 I ROLDAN 2012 3568 3575 L TERRONES 1996 576 582 M ZHONG 2001 5939 5943 D CHIZARI 2014 369 379 K TERRONES 2002 355 361 M EWELS 2005 1345 1363 C BINIAK 1997 1799 1810 S CHOI 2005 4333 4340 H CHOI 2004 5742 5744 H STRELKO 2004 281 290 V GONG 2009 760 764 K TUCI 2014 G LIU 2013 279 289 Y ZHAO 2013 5113 5120 Q CUONGX2014X397 CUONGX2014X397X406 CUONGX2014X397XD CUONGX2014X397X406XD item S0926-860X(14)00396-2 S0926860X14003962 1-s2.0-S0926860X14003962 10.1016/j.apcata.2014.06.010 271346 2024-01-01T12:30:29.635264Z 2014-07-22 1-s2.0-S0926860X14003962-main.pdf https://s3.amazonaws.com/prod-ucs-content-store-us-east/content/pii:S0926860X14003962/MAIN/application/pdf/744d4682433060938babb9357057dfca/main.pdf https://s3-eu-west-1.amazonaws.com/prod-ucs-content-store-eu-west/content/pii:S0926860X14003962/MAIN/application/pdf/744d4682433060938babb9357057dfca/main.pdf main.pdf pdf true 3777527 MAIN 10 1-s2.0-S0926860X14003962-main_1.png https://s3.amazonaws.com/prod-ucs-content-store-us-east/content/pii:S0926860X14003962/PREVIEW/image/png/4c592bdfd3a8e5fb34d2dc529697be5a/main_1.png https://s3-eu-west-1.amazonaws.com/prod-ucs-content-store-eu-west/content/pii:S0926860X14003962/PREVIEW/image/png/4c592bdfd3a8e5fb34d2dc529697be5a/main_1.png main_1.png png 58554 849 656 IMAGE-WEB-PDF 1 1-s2.0-S0926860X14003962-gr9_lrg.jpg https://s3.amazonaws.com/prod-ucs-content-store-us-east/content/pii:S0926860X14003962/gr9/HIGHRES/image/jpeg/f7d3b5d4ee3fa559c1bf08f2877a762e/gr9_lrg.jpg https://s3-eu-west-1.amazonaws.com/prod-ucs-content-store-eu-west/content/pii:S0926860X14003962/gr9/HIGHRES/image/jpeg/f7d3b5d4ee3fa559c1bf08f2877a762e/gr9_lrg.jpg gr9 gr9_lrg.jpg jpg 250487 1978 1333 IMAGE-HIGH-RES 1-s2.0-S0926860X14003962-gr8_lrg.jpg https://s3.amazonaws.com/prod-ucs-content-store-us-east/content/pii:S0926860X14003962/gr8/HIGHRES/image/jpeg/96f81ff0b60908d4ab6da4b5971e5b19/gr8_lrg.jpg https://s3-eu-west-1.amazonaws.com/prod-ucs-content-store-eu-west/content/pii:S0926860X14003962/gr8/HIGHRES/image/jpeg/96f81ff0b60908d4ab6da4b5971e5b19/gr8_lrg.jpg gr8 gr8_lrg.jpg jpg 137938 1094 1492 IMAGE-HIGH-RES 1-s2.0-S0926860X14003962-gr7_lrg.jpg https://s3.amazonaws.com/prod-ucs-content-store-us-east/content/pii:S0926860X14003962/gr7/HIGHRES/image/jpeg/07b66b66130fcf5690e3410726442858/gr7_lrg.jpg https://s3-eu-west-1.amazonaws.com/prod-ucs-content-store-eu-west/content/pii:S0926860X14003962/gr7/HIGHRES/image/jpeg/07b66b66130fcf5690e3410726442858/gr7_lrg.jpg gr7 gr7_lrg.jpg jpg 240828 1930 1240 IMAGE-HIGH-RES 1-s2.0-S0926860X14003962-gr6_lrg.jpg https://s3.amazonaws.com/prod-ucs-content-store-us-east/content/pii:S0926860X14003962/gr6/HIGHRES/image/jpeg/07a50f658bb7686937c3ce5bfa8a5d02/gr6_lrg.jpg https://s3-eu-west-1.amazonaws.com/prod-ucs-content-store-eu-west/content/pii:S0926860X14003962/gr6/HIGHRES/image/jpeg/07a50f658bb7686937c3ce5bfa8a5d02/gr6_lrg.jpg gr6 gr6_lrg.jpg jpg 412146 2107 1306 IMAGE-HIGH-RES 1-s2.0-S0926860X14003962-gr5_lrg.jpg https://s3.amazonaws.com/prod-ucs-content-store-us-east/content/pii:S0926860X14003962/gr5/HIGHRES/image/jpeg/520bac807c261bd84f1ff85f3a79cb62/gr5_lrg.jpg https://s3-eu-west-1.amazonaws.com/prod-ucs-content-store-eu-west/content/pii:S0926860X14003962/gr5/HIGHRES/image/jpeg/520bac807c261bd84f1ff85f3a79cb62/gr5_lrg.jpg gr5 gr5_lrg.jpg jpg 540321 601 1500 IMAGE-HIGH-RES 1-s2.0-S0926860X14003962-gr4_lrg.jpg https://s3.amazonaws.com/prod-ucs-content-store-us-east/content/pii:S0926860X14003962/gr4/HIGHRES/image/jpeg/1bfcf83d8b28253d42b9ef333c0d5dc5/gr4_lrg.jpg https://s3-eu-west-1.amazonaws.com/prod-ucs-content-store-eu-west/content/pii:S0926860X14003962/gr4/HIGHRES/image/jpeg/1bfcf83d8b28253d42b9ef333c0d5dc5/gr4_lrg.jpg gr4 gr4_lrg.jpg jpg 661387 1153 1500 IMAGE-HIGH-RES 1-s2.0-S0926860X14003962-gr3_lrg.jpg https://s3.amazonaws.com/prod-ucs-content-store-us-east/content/pii:S0926860X14003962/gr3/HIGHRES/image/jpeg/c61f9647d096a7bb3073f06c5280e90b/gr3_lrg.jpg https://s3-eu-west-1.amazonaws.com/prod-ucs-content-store-eu-west/content/pii:S0926860X14003962/gr3/HIGHRES/image/jpeg/c61f9647d096a7bb3073f06c5280e90b/gr3_lrg.jpg gr3 gr3_lrg.jpg jpg 197081 564 1500 IMAGE-HIGH-RES 1-s2.0-S0926860X14003962-gr2_lrg.jpg https://s3.amazonaws.com/prod-ucs-content-store-us-east/content/pii:S0926860X14003962/gr2/HIGHRES/image/jpeg/0a6a2840d21258f8b0518e8b7dbe6cc1/gr2_lrg.jpg https://s3-eu-west-1.amazonaws.com/prod-ucs-content-store-eu-west/content/pii:S0926860X14003962/gr2/HIGHRES/image/jpeg/0a6a2840d21258f8b0518e8b7dbe6cc1/gr2_lrg.jpg gr2 gr2_lrg.jpg jpg 262289 1036 2909 IMAGE-HIGH-RES 1-s2.0-S0926860X14003962-gr12_lrg.jpg https://s3.amazonaws.com/prod-ucs-content-store-us-east/content/pii:S0926860X14003962/gr12/HIGHRES/image/jpeg/6441137ea37771019cdcde3f782210a3/gr12_lrg.jpg https://s3-eu-west-1.amazonaws.com/prod-ucs-content-store-eu-west/content/pii:S0926860X14003962/gr12/HIGHRES/image/jpeg/6441137ea37771019cdcde3f782210a3/gr12_lrg.jpg gr12 gr12_lrg.jpg jpg 562466 1877 2493 IMAGE-HIGH-RES 1-s2.0-S0926860X14003962-gr11_lrg.jpg https://s3.amazonaws.com/prod-ucs-content-store-us-east/content/pii:S0926860X14003962/gr11/HIGHRES/image/jpeg/438f545d2bba25c772408964430cef97/gr11_lrg.jpg https://s3-eu-west-1.amazonaws.com/prod-ucs-content-store-eu-west/content/pii:S0926860X14003962/gr11/HIGHRES/image/jpeg/438f545d2bba25c772408964430cef97/gr11_lrg.jpg gr11 gr11_lrg.jpg jpg 422650 3186 1981 IMAGE-HIGH-RES 1-s2.0-S0926860X14003962-gr10_lrg.jpg https://s3.amazonaws.com/prod-ucs-content-store-us-east/content/pii:S0926860X14003962/gr10/HIGHRES/image/jpeg/282a9550e8168ab35ba023635fb8e72c/gr10_lrg.jpg https://s3-eu-west-1.amazonaws.com/prod-ucs-content-store-eu-west/content/pii:S0926860X14003962/gr10/HIGHRES/image/jpeg/282a9550e8168ab35ba023635fb8e72c/gr10_lrg.jpg gr10 gr10_lrg.jpg jpg 115299 965 1240 IMAGE-HIGH-RES 1-s2.0-S0926860X14003962-gr1_lrg.jpg https://s3.amazonaws.com/prod-ucs-content-store-us-east/content/pii:S0926860X14003962/gr1/HIGHRES/image/jpeg/8576821c2ec5865eb0bfc369f7727d89/gr1_lrg.jpg https://s3-eu-west-1.amazonaws.com/prod-ucs-content-store-eu-west/content/pii:S0926860X14003962/gr1/HIGHRES/image/jpeg/8576821c2ec5865eb0bfc369f7727d89/gr1_lrg.jpg gr1 gr1_lrg.jpg jpg 1042004 2980 2667 IMAGE-HIGH-RES 1-s2.0-S0926860X14003962-fx1_lrg.jpg https://s3.amazonaws.com/prod-ucs-content-store-us-east/content/pii:S0926860X14003962/fx1/HIGHRES/image/jpeg/2c850b0c589f206c182fd93a52de7d47/fx1_lrg.jpg https://s3-eu-west-1.amazonaws.com/prod-ucs-content-store-eu-west/content/pii:S0926860X14003962/fx1/HIGHRES/image/jpeg/2c850b0c589f206c182fd93a52de7d47/fx1_lrg.jpg fx1 true fx1_lrg.jpg jpg 263179 886 2179 IMAGE-HIGH-RES 1-s2.0-S0926860X14003962-gr9.jpg https://s3.amazonaws.com/prod-ucs-content-store-us-east/content/pii:S0926860X14003962/gr9/DOWNSAMPLED/image/jpeg/b5c7f8b89c592dac8748526712891b63/gr9.jpg https://s3-eu-west-1.amazonaws.com/prod-ucs-content-store-eu-west/content/pii:S0926860X14003962/gr9/DOWNSAMPLED/image/jpeg/b5c7f8b89c592dac8748526712891b63/gr9.jpg gr9 gr9.jpg jpg 28903 447 301 IMAGE-DOWNSAMPLED 1-s2.0-S0926860X14003962-gr8.jpg https://s3.amazonaws.com/prod-ucs-content-store-us-east/content/pii:S0926860X14003962/gr8/DOWNSAMPLED/image/jpeg/1e2ca09a3f900e6faaaa7a0945961e24/gr8.jpg https://s3-eu-west-1.amazonaws.com/prod-ucs-content-store-eu-west/content/pii:S0926860X14003962/gr8/DOWNSAMPLED/image/jpeg/1e2ca09a3f900e6faaaa7a0945961e24/gr8.jpg gr8 gr8.jpg jpg 17230 247 337 IMAGE-DOWNSAMPLED 1-s2.0-S0926860X14003962-gr7.jpg https://s3.amazonaws.com/prod-ucs-content-store-us-east/content/pii:S0926860X14003962/gr7/DOWNSAMPLED/image/jpeg/b0f61832ec04b22a36c840d3f76e61dc/gr7.jpg https://s3-eu-west-1.amazonaws.com/prod-ucs-content-store-eu-west/content/pii:S0926860X14003962/gr7/DOWNSAMPLED/image/jpeg/b0f61832ec04b22a36c840d3f76e61dc/gr7.jpg gr7 gr7.jpg jpg 29410 436 280 IMAGE-DOWNSAMPLED 1-s2.0-S0926860X14003962-gr6.jpg https://s3.amazonaws.com/prod-ucs-content-store-us-east/content/pii:S0926860X14003962/gr6/DOWNSAMPLED/image/jpeg/dfded662ed8b42f227837e2d0d986734/gr6.jpg https://s3-eu-west-1.amazonaws.com/prod-ucs-content-store-eu-west/content/pii:S0926860X14003962/gr6/DOWNSAMPLED/image/jpeg/dfded662ed8b42f227837e2d0d986734/gr6.jpg gr6 gr6.jpg jpg 48520 476 295 IMAGE-DOWNSAMPLED 1-s2.0-S0926860X14003962-gr5.jpg https://s3.amazonaws.com/prod-ucs-content-store-us-east/content/pii:S0926860X14003962/gr5/DOWNSAMPLED/image/jpeg/a743ff3a087859ef1d6d6210d3edac82/gr5.jpg https://s3-eu-west-1.amazonaws.com/prod-ucs-content-store-eu-west/content/pii:S0926860X14003962/gr5/DOWNSAMPLED/image/jpeg/a743ff3a087859ef1d6d6210d3edac82/gr5.jpg gr5 gr5.jpg jpg 75282 226 565 IMAGE-DOWNSAMPLED 1-s2.0-S0926860X14003962-gr4.jpg https://s3.amazonaws.com/prod-ucs-content-store-us-east/content/pii:S0926860X14003962/gr4/DOWNSAMPLED/image/jpeg/3c7d335fb5b5913fa5d9178c8c242ca0/gr4.jpg https://s3-eu-west-1.amazonaws.com/prod-ucs-content-store-eu-west/content/pii:S0926860X14003962/gr4/DOWNSAMPLED/image/jpeg/3c7d335fb5b5913fa5d9178c8c242ca0/gr4.jpg gr4 gr4.jpg jpg 122455 434 565 IMAGE-DOWNSAMPLED 1-s2.0-S0926860X14003962-gr3.jpg https://s3.amazonaws.com/prod-ucs-content-store-us-east/content/pii:S0926860X14003962/gr3/DOWNSAMPLED/image/jpeg/ab0b2d8608a90205164207ae0191cc9d/gr3.jpg https://s3-eu-west-1.amazonaws.com/prod-ucs-content-store-eu-west/content/pii:S0926860X14003962/gr3/DOWNSAMPLED/image/jpeg/ab0b2d8608a90205164207ae0191cc9d/gr3.jpg gr3 gr3.jpg jpg 41935 212 565 IMAGE-DOWNSAMPLED 1-s2.0-S0926860X14003962-gr2.jpg https://s3.amazonaws.com/prod-ucs-content-store-us-east/content/pii:S0926860X14003962/gr2/DOWNSAMPLED/image/jpeg/1670e6022cc07bf7bca91bdc215c4b2e/gr2.jpg https://s3-eu-west-1.amazonaws.com/prod-ucs-content-store-eu-west/content/pii:S0926860X14003962/gr2/DOWNSAMPLED/image/jpeg/1670e6022cc07bf7bca91bdc215c4b2e/gr2.jpg gr2 gr2.jpg jpg 33162 234 657 IMAGE-DOWNSAMPLED 1-s2.0-S0926860X14003962-gr12.jpg https://s3.amazonaws.com/prod-ucs-content-store-us-east/content/pii:S0926860X14003962/gr12/DOWNSAMPLED/image/jpeg/7e537752c5b096415094f262a0314441/gr12.jpg https://s3-eu-west-1.amazonaws.com/prod-ucs-content-store-eu-west/content/pii:S0926860X14003962/gr12/DOWNSAMPLED/image/jpeg/7e537752c5b096415094f262a0314441/gr12.jpg gr12 gr12.jpg jpg 63294 424 563 IMAGE-DOWNSAMPLED 1-s2.0-S0926860X14003962-gr11.jpg https://s3.amazonaws.com/prod-ucs-content-store-us-east/content/pii:S0926860X14003962/gr11/DOWNSAMPLED/image/jpeg/a1f4b591ae2caf3b7a394cf0b6d7c859/gr11.jpg https://s3-eu-west-1.amazonaws.com/prod-ucs-content-store-eu-west/content/pii:S0926860X14003962/gr11/DOWNSAMPLED/image/jpeg/a1f4b591ae2caf3b7a394cf0b6d7c859/gr11.jpg gr11 gr11.jpg jpg 48983 719 447 IMAGE-DOWNSAMPLED 1-s2.0-S0926860X14003962-gr10.jpg https://s3.amazonaws.com/prod-ucs-content-store-us-east/content/pii:S0926860X14003962/gr10/DOWNSAMPLED/image/jpeg/c32bf9bd12c91bee9d87bc791d28f88d/gr10.jpg https://s3-eu-west-1.amazonaws.com/prod-ucs-content-store-eu-west/content/pii:S0926860X14003962/gr10/DOWNSAMPLED/image/jpeg/c32bf9bd12c91bee9d87bc791d28f88d/gr10.jpg gr10 gr10.jpg jpg 13307 218 280 IMAGE-DOWNSAMPLED 1-s2.0-S0926860X14003962-gr1.jpg https://s3.amazonaws.com/prod-ucs-content-store-us-east/content/pii:S0926860X14003962/gr1/DOWNSAMPLED/image/jpeg/745b5861e9e8335442b14e1b08150365/gr1.jpg https://s3-eu-west-1.amazonaws.com/prod-ucs-content-store-eu-west/content/pii:S0926860X14003962/gr1/DOWNSAMPLED/image/jpeg/745b5861e9e8335442b14e1b08150365/gr1.jpg gr1 gr1.jpg jpg 90834 673 602 IMAGE-DOWNSAMPLED 1-s2.0-S0926860X14003962-fx1.jpg https://s3.amazonaws.com/prod-ucs-content-store-us-east/content/pii:S0926860X14003962/fx1/DOWNSAMPLED/image/jpeg/1e2173e2f845a84121b480fcd255a622/fx1.jpg https://s3-eu-west-1.amazonaws.com/prod-ucs-content-store-eu-west/content/pii:S0926860X14003962/fx1/DOWNSAMPLED/image/jpeg/1e2173e2f845a84121b480fcd255a622/fx1.jpg fx1 true fx1.jpg jpg 25479 200 492 IMAGE-DOWNSAMPLED 1-s2.0-S0926860X14003962-gr9.sml https://s3.amazonaws.com/prod-ucs-content-store-us-east/content/pii:S0926860X14003962/gr9/THUMBNAIL/image/gif/9e315a00bc757e9ac2df8e0ee7feb0fa/gr9.sml https://s3-eu-west-1.amazonaws.com/prod-ucs-content-store-eu-west/content/pii:S0926860X14003962/gr9/THUMBNAIL/image/gif/9e315a00bc757e9ac2df8e0ee7feb0fa/gr9.sml gr9 gr9.sml sml 3456 163 110 IMAGE-THUMBNAIL 1-s2.0-S0926860X14003962-gr8.sml https://s3.amazonaws.com/prod-ucs-content-store-us-east/content/pii:S0926860X14003962/gr8/THUMBNAIL/image/gif/2bba81bded03d17e7ba41ab95f7d9e92/gr8.sml https://s3-eu-west-1.amazonaws.com/prod-ucs-content-store-eu-west/content/pii:S0926860X14003962/gr8/THUMBNAIL/image/gif/2bba81bded03d17e7ba41ab95f7d9e92/gr8.sml gr8 gr8.sml sml 5004 161 219 IMAGE-THUMBNAIL 1-s2.0-S0926860X14003962-gr7.sml https://s3.amazonaws.com/prod-ucs-content-store-us-east/content/pii:S0926860X14003962/gr7/THUMBNAIL/image/gif/409cc662f6488b4a5b12563f78c2c63f/gr7.sml https://s3-eu-west-1.amazonaws.com/prod-ucs-content-store-eu-west/content/pii:S0926860X14003962/gr7/THUMBNAIL/image/gif/409cc662f6488b4a5b12563f78c2c63f/gr7.sml gr7 gr7.sml sml 3816 163 105 IMAGE-THUMBNAIL 1-s2.0-S0926860X14003962-gr6.sml https://s3.amazonaws.com/prod-ucs-content-store-us-east/content/pii:S0926860X14003962/gr6/THUMBNAIL/image/gif/a1815c471f4effe3dc211a8189bd2615/gr6.sml https://s3-eu-west-1.amazonaws.com/prod-ucs-content-store-eu-west/content/pii:S0926860X14003962/gr6/THUMBNAIL/image/gif/a1815c471f4effe3dc211a8189bd2615/gr6.sml gr6 gr6.sml sml 5200 163 101 IMAGE-THUMBNAIL 1-s2.0-S0926860X14003962-gr5.sml https://s3.amazonaws.com/prod-ucs-content-store-us-east/content/pii:S0926860X14003962/gr5/THUMBNAIL/image/gif/d639b5f24bc0a238f35a3d9a61ce2a8e/gr5.sml https://s3-eu-west-1.amazonaws.com/prod-ucs-content-store-eu-west/content/pii:S0926860X14003962/gr5/THUMBNAIL/image/gif/d639b5f24bc0a238f35a3d9a61ce2a8e/gr5.sml gr5 gr5.sml sml 7091 88 219 IMAGE-THUMBNAIL 1-s2.0-S0926860X14003962-gr4.sml https://s3.amazonaws.com/prod-ucs-content-store-us-east/content/pii:S0926860X14003962/gr4/THUMBNAIL/image/gif/55cddb5bc9c0d63346f10c699a8c8c5e/gr4.sml https://s3-eu-west-1.amazonaws.com/prod-ucs-content-store-eu-west/content/pii:S0926860X14003962/gr4/THUMBNAIL/image/gif/55cddb5bc9c0d63346f10c699a8c8c5e/gr4.sml gr4 gr4.sml sml 17977 164 213 IMAGE-THUMBNAIL 1-s2.0-S0926860X14003962-gr3.sml https://s3.amazonaws.com/prod-ucs-content-store-us-east/content/pii:S0926860X14003962/gr3/THUMBNAIL/image/gif/f24aa7adf57d52cea49c3bd42d530cf3/gr3.sml https://s3-eu-west-1.amazonaws.com/prod-ucs-content-store-eu-west/content/pii:S0926860X14003962/gr3/THUMBNAIL/image/gif/f24aa7adf57d52cea49c3bd42d530cf3/gr3.sml gr3 gr3.sml sml 9848 82 219 IMAGE-THUMBNAIL 1-s2.0-S0926860X14003962-gr2.sml https://s3.amazonaws.com/prod-ucs-content-store-us-east/content/pii:S0926860X14003962/gr2/THUMBNAIL/image/gif/fbb4e04fa7a9a0625fd466231fef9c67/gr2.sml https://s3-eu-west-1.amazonaws.com/prod-ucs-content-store-eu-west/content/pii:S0926860X14003962/gr2/THUMBNAIL/image/gif/fbb4e04fa7a9a0625fd466231fef9c67/gr2.sml gr2 gr2.sml sml 4193 78 219 IMAGE-THUMBNAIL 1-s2.0-S0926860X14003962-gr12.sml https://s3.amazonaws.com/prod-ucs-content-store-us-east/content/pii:S0926860X14003962/gr12/THUMBNAIL/image/gif/6953b4cf0c8fd62c23eda2763fe2e4ad/gr12.sml https://s3-eu-west-1.amazonaws.com/prod-ucs-content-store-eu-west/content/pii:S0926860X14003962/gr12/THUMBNAIL/image/gif/6953b4cf0c8fd62c23eda2763fe2e4ad/gr12.sml gr12 gr12.sml sml 8000 164 218 IMAGE-THUMBNAIL 1-s2.0-S0926860X14003962-gr11.sml https://s3.amazonaws.com/prod-ucs-content-store-us-east/content/pii:S0926860X14003962/gr11/THUMBNAIL/image/gif/5e6d388220ed985e170275d45da88fae/gr11.sml https://s3-eu-west-1.amazonaws.com/prod-ucs-content-store-eu-west/content/pii:S0926860X14003962/gr11/THUMBNAIL/image/gif/5e6d388220ed985e170275d45da88fae/gr11.sml gr11 gr11.sml sml 3280 164 102 IMAGE-THUMBNAIL 1-s2.0-S0926860X14003962-gr10.sml https://s3.amazonaws.com/prod-ucs-content-store-us-east/content/pii:S0926860X14003962/gr10/THUMBNAIL/image/gif/aa9da24a3c35dc4038fb157975af5d5e/gr10.sml https://s3-eu-west-1.amazonaws.com/prod-ucs-content-store-eu-west/content/pii:S0926860X14003962/gr10/THUMBNAIL/image/gif/aa9da24a3c35dc4038fb157975af5d5e/gr10.sml gr10 gr10.sml sml 5184 164 211 IMAGE-THUMBNAIL 1-s2.0-S0926860X14003962-gr1.sml https://s3.amazonaws.com/prod-ucs-content-store-us-east/content/pii:S0926860X14003962/gr1/THUMBNAIL/image/gif/6c10d463a04fd276776714c25bd32283/gr1.sml https://s3-eu-west-1.amazonaws.com/prod-ucs-content-store-eu-west/content/pii:S0926860X14003962/gr1/THUMBNAIL/image/gif/6c10d463a04fd276776714c25bd32283/gr1.sml gr1 gr1.sml sml 6854 163 146 IMAGE-THUMBNAIL 1-s2.0-S0926860X14003962-fx1.sml https://s3.amazonaws.com/prod-ucs-content-store-us-east/content/pii:S0926860X14003962/fx1/THUMBNAIL/image/gif/b21c83bb49893a78cd8104c0b44c70d1/fx1.sml https://s3-eu-west-1.amazonaws.com/prod-ucs-content-store-eu-west/content/pii:S0926860X14003962/fx1/THUMBNAIL/image/gif/b21c83bb49893a78cd8104c0b44c70d1/fx1.sml fx1 true fx1.sml sml 6051 89 219 IMAGE-THUMBNAIL APCATA 14870 S0926-860X(14)00396-2 10.1016/j.apcata.2014.06.010 Elsevier B.V. Fig. 1 (A) Macroscopic shapes, i.e. grains, extrudates, foams, rings, of silicon carbide synthesized by a gas–solid reaction (www.sicatcatalyst.com). (B) XPS Si2p of the SiC surface after calcinations at 700°C in air showing the presence of SiC (red – 1), SiO x C y (green – 2) and SiO2 (blue – 3). (C) High-resolution TEM micrograph showing the presence of a thin (2nm) amorphous layer of SiO2/SiO x C y which was formed during air exposure on the SiC surface. (For interpretation of the references to color in this figure legend, the reader is referred to the web version of the article.) Fig. 2 (A) Specific surface area of the pristine SiC and the same after decorating with different N-CNT as a function of the synthesis temperature. The N-CNT yield as a function of the synthesis temperature is also reported in the same figure. (B) Average tube diameter of the unsupported and SiC-supported N-CNT synthesized at 750°C. Fig. 3 Digital photos of the SiC before (A) and after (B) N-CNT loading carried out at 750°C showing the significant increase of the apparent volume of the catalyst due to the formation of a high surface-to-volume N-CNTs. Fig. 4 SEM micrographs of the N-CNT/Al2O3 synthesized at 750°C (A and B) and the N-CNT/SiC synthesized at 750°C (C and D) composites showing the high coverage of the SiC surface by the N-CNT network. Fig. 5 TEM micrographs of the N-CNT (A) and the N-CNT/SiC (B) synthesized at 750°C with similar closed periodical bamboo-like structure. Fig. 6 (A) N1s XPS spectra on the N-CNT/SiC-750 and N-CNT-750 catalysts after acid treatment in HNO3 (35vol.%) at 80°C for 6h. (B) Fe2p XPS spectra recorded on the N-CNT-750 sample after CVD synthesis and after acid treatment. Fig. 7 Desulfurization conversion (A) and sulfur selectivity (B) on the N-CNT/SiC-750 and N-CNT-750 catalysts as a function of the reaction temperature. Reaction conditions: catalyst weight=0.8g, O2-to-H2S molar ratio=2.5, reaction temperature=170–190°C, WHSV=0.6h−1. The same catalyst was used for both tests. Fig. 8 Desulfurization performance at high space velocity on the N-CNT/SiC-750 catalyst. Reaction conditions: catalyst weight=0.4g, O2-to-H2S molar ratio=2.5, reaction temperature=190°C, WHSV=1.2 and 1.8h−1. The same catalyst was used for both tests. Fig. 9 Desulfurization performance, H2S conversion (A) and sulfur selectivity (B), on the N-CNT/SiC with different N-CNT loading, i.e. 40 and 60wt.%, catalysts, synthesized at 750°C. Reaction conditions: O2-to-H2S molar ratio=2.5, reaction temperature=190°C, WHSV=0.6h−1. Fig. 10 Desulfurization performance, H2S conversion (black sphere) and sulfur selectivity (red open square), on the N-CNT/SiC catalyst at different O2-to-H2S molar ratio. Reaction conditions: catalyst weight=0.3g, temperature=190°C, WHSV=0.6h−1. The same catalyst was used for both tests. (For interpretation of the references to color in this figure legend, the reader is referred to the web version of the article.) Fig. 11 Desulfurization conversion (A) and sulfur selectivity (B) on the N-CNT/SiC-750 and Fe2O3-3%/SiC catalysts. Reaction conditions: O2-to-H2S molar ratio=2.5, reaction temperature=190°C, WHSV=0.6h−1. Fig. 12 XPS analysis of the N-CNT/SiC-750 catalyst after desulfurization reaction showing the formation of sulfur on the spent catalyst. Table 1 Total nitrogen content and nitrogen species composition determined by XPS in the N-CNTs and N-CNTs/SiC as a function of the synthesis temperature. Synthesis temperature (°C) Ntotal a (%) NPyridinic (%) NPyrrolic (%) NQuaternary (%) NIntercalated (%) N-CNTs catalysts 720 2.8 21 20 33 26 750 2.4 21 13 37 30 800 2.2 17 25 29 29 N-CNTs/SiC catalysts 720 3.1 26 30 28 15 750 4.1 30 20 32 18 800 3.2 21 35 33 11 a Ntotal =N/(N+C+O). Nitrogen-doped carbon nanotubes decorated silicon carbide as a metal-free catalyst for partial oxidation of H2S Cuong Duong-Viet a b Lai Truong-Phuoc a Tung Tran-Thanh a Jean-Mario Nhut a Lam Nguyen-Dinh c Izabela Janowska a Dominique Begin a Cuong Pham-Huu a ⁎ a Institut de Chimie et Procédés pour l’Energie, l’Environnement et la Santé (ICPEES), ECPM, UMR 7515 du CNRS-Université de Strasbourg, 25 rue Becquerel, 67087 Strasbourg Cedex 02, France Institut de Chimie et Procédés pour l’Energie, l’Environnement et la Santé (ICPEES), ECPM, UMR 7515 du CNRS-Université de Strasbourg 25 rue Becquerel Strasbourg Cedex 02 67087 France b Ha-Noi University of Mining and Geology, Dong Ngac, Tu Liem, Ha Noi, Viet Nam Ha-Noi University of Mining and Geology Dong Ngac, Tu Liem, Ha Noi Viet Nam c The University of Da-Nang, University of Science and Technology, 54 Nguyen Luong Bang, Da-Nang, Viet Nam The University of Da-Nang, University of Science and Technology 54 Nguyen Luong Bang Da-Nang Viet Nam ⁎ Corresponding author. Tel.: +33 3 68 85 26 67. Graphical abstract Hierarchical metal-free catalyst based on the CVD synthesis of nitrogen-doped carbon nanotubes decorated silicon carbide (N-CNTs/SiC) macroscopic host structure has been prepared. The catalyst was evaluated in the partial oxidation of H2S by oxygen into elemental sulfur in a fixed-bed reactor. The catalytic results indicate that the N-CNTs/SiC catalyst exhibits an extremely high desulfurization performance even under severe reaction conditions such as low temperature, high space velocity and at low O2-to-H2S molar ratio. The high desulfurization performance was attributed to the high effective surface area of the catalyst along with a short diffusion length associated with the nanoscopic dimension of the carbon nanotubes. The N-CNTs/SiC catalyst also displays a high stability as a function of time on stream which could be attributed to the strong anchoring of the nitrogen doping within the carbon matrix. The extrudates shape of the SiC support allows the direct macroscopic shaping of the catalyst for use in conventional fixed-bed reactor without facing problems linked with catalyst handling, transportation and pressure drop across the catalyst bed as encountered with nanoscopic carbon-based catalyst. Keywords Catalysis Nitrogen-doped carbon nanotubes Silicon carbide Extrudates Selective oxidation H2S 1 Introduction The last decade has faced an over increasing research on the development of metal-free catalysts for several catalytic applications such as oxygen reduction reaction (ORR) [1–3], selective steam-free dehydrogenation and oxidative dehydrogenation [4–7], transesterification [8,9], and selective oxidation [10–12]. Nitrogen-doped carbon nanotubes (N-CNTs) were the most studied metal-free catalysts [13–15] due to the very similar size between the nitrogen atom and carbon atom which allows an easy insertion of nitrogen atoms inside the carbon matrix [16]. It is also worthy to note that the metal-free catalysts display a higher activity and stability compared to their counterpart metal and/or metal oxide catalysts. In a recent review, Su et al. [17] have highlighted the advantages of using carbon-based metal-free catalysts for several catalytic reactions with an advantage on the active-site control. Dai et al. [3] have recently reviewed on the development and use of N-CNT and graphene metal-free catalysts, for the selective dehydrogenation and oxidative dehydrogenation of alkanes and the ORR, which display better activity and stability compared to the metal-based catalysts. Bitter et al. [18] have also reported the high activity of the N-CNT in the Knoevenagel reaction. Recently, Peng et al. [12] have reported that N-CNT can be efficiently employed as metal-free catalyst in the selective oxidation of benzyl alcohol to benzaldehyde with molecular oxygen. The N-CNT catalyst also exhibits an extremely high stability as a function of the cycling tests which could be attributed to the strong incorporation of nitrogen atoms in the carbon host matrix. Similar results have also been reported by Faba et al. [19] in the biomass upgrading processes: acetone aldol and acetic acid decarboxylative condensations. Recently, Su et al. [20] have also reported that sp2 N-doped graphitic catalysts generate reactive oxygen species which allow one to perform the hydrocarbon activation even at room temperature. The high advantage of using these N-CNT catalysts versus the traditional metal/metal oxide supported ones is belong to the fact that the nitrogen species are well anchored within the catalyst structure and thus, problems linked with the active phase sintering are unlikely to occur. The international restrictions concerning the release of sulfur compounds containing gas into the atmosphere are becoming more and more drastic during the last decades [21]. Nowadays, a large amount of hydrogen sulfide (H2S) is released from crude oil, natural gas refineries and metal smelting process in steel production. It is also worthy to note that the coal liquefaction process is also considered to be the major source of H2S emission in the near future [22]. A large part of the H2S was removed via the Claus process [23] while the residual un-reacted H2S will be converted into elemental sulfur at different reaction temperatures through the Super-Claus process [24,25]. In a recent study we have reported that N-CNT and N-CNTs/SiC foam are efficient metal-free catalysts for performing the high temperature selective oxidation of H2S into elemental sulfur at a relatively high space velocity [11]. In addition, owing to the well anchorage of the nitrogen species inside the carbon matrix no deactivation was observed for a long-term reaction which was not the case with traditional supported catalyst where deactivation by sintering could occur. The problem linked with the transport/handling and pressure drop across the catalyst bed, belonging to the nanoscopic structure of the N-CNT, can be avoided by supporting them on a macroscopic host structure of silicon carbide (SiC) [11]. However, the high porous volume of the SiC foam support (>90%) presents a drawback for industrial application due to its relatively low active phase loading per unit volume of the reactor. It is of interest to optimize the synthesis process of the hybrid composite and to develop new support with a higher density in order to fulfill the industrial requirements. The aim of the present study is to report on the high desulfurization performance of the metal-free nitrogen-doped carbon nanotubes (N-CNTs) immobilized on a silicon carbide (SiC) extrudates host structure with high density. It is expected that the macroscopic shaping of the catalyst allows the avoidance of problems linked with handling and pressure drop for applications in a fixed-bed reactor. This hybrid catalyst exhibits an extremely high desulfurization performance along with a low pressure drop even at high reactant weight hourly space velocity (WHSV). The results highlighted the strong influence of the N-CNTs loading on the desulfurization performance which has ever been reported before. The desulfurization performance was also bench-marked with those obtained on the Fe2O3/SiC which is one of the most active and selective catalyst for the selective oxidation of H2S into elemental sulfur [26,27]. 2 Experimental 2.1 Silicon carbide supports Silicon carbide (β-SiC) in an extrudates shape was synthesized via a gas–solid reaction between SiO vapor and dispersed solid carbon. The detailed synthesis of the SiC-based materials is summarized in a recent review [28]. The β-SiC was synthesized by mixing microsized silicon powder with a carbon-containing resin. The paste will be further shaped into desired shape, i.e. extrudates, grains, beads, etc. Examples of the medium to high surface area SiC with different size and shape synthesized by an industrial gas–solid process are presented in Fig. 1 . The carburization process was carried out under flowing argon at temperature around 1350°C during 1h. The as-synthesized SiC was further calcined in air at 700°C for 2h in order to remove the un-reacted carbon within its matrix. The resulted SiC material was thus partly covered with a thin layer of SiO2 and SiO x C y (Fig. 1B) which could play the role of anchorage site for dispersing metal nanoparticles on its surface [29,30]. 2.2 Synthesis of the N-CNT/SiC composite The N-CNT/SiC composite was synthesized according to the Chemical Vapor Deposition (CVD) method with iron as a growth catalyst [31,32]. The Fe/SiC (7wt.%) catalyst was synthesized by impregnating the SiC support with an aqueous solution containing Fe(NO3)3. The solid was dried at room temperature overnight and oven-dried at 110°C for 24h. It was then calcined in air at 350°C for 2h in order to transform the nitrate precursor into its corresponding oxide. The Fe2O3/SiC catalyst was housed in a quartz reactor localized inside an electric furnace. The catalyst was reduced under hydrogen flow (200mL/min) at 400°C for 2h and then, the reaction temperature was raised to the synthesis temperature (heating rate of 10°Cmin−1) and the H2 flow was replaced by a C2H6/NH3/H2 mixture. The XRD patterns of the iron-based growth catalyst after calcination and reduction (not shown) confirm the complete reduction of the Fe2O3 phase. The C2H6, NH3, and H2 flow rates, used in the synthesis of N-CNT/SiC, were fixed at 50:50:20sccmmin−1. The synthesis was lasted for 2h, and the reactor was cooled to room temperature under argon. For the unsupported N-CNTs the Fe/Al2O3 growth catalyst was used instead of Fe/SiC and the similar process was used. For the unsupported N-CNTs, growth from the Fe/Al2O3 catalyst, the as-synthesized product was treated by a NaOH (20wt.%) solution at 80°C for 24h followed by an acid treatment (HNO3, 32vol.% at 80°C) for 24h in order to remove both the support and the growth catalyst. The solid was washed thoroughly with distilled water between the treatment processes. Elemental analysis performed on the treated N-CNTs indicates that about 0.2wt.% of residual iron remains in the catalyst. Such residual iron could be attributed to the iron encapsulated within the carbon nanotubes which was not being accessible to the acid during the purification process. For the supported N-CNTs/SiC sample the solid was only treated with an acid solution under the same conditions. The washed catalyst contains a residual iron of about 0.4wt.% according to the elemental analysis. TEM-EELS analysis on both samples indicates that the nitrogen concentration was higher in the arches region while lower nitrogen concentration was observed on the tube wall [33] and confirms the similar growth mode on both unsupported and supported materials. 2.3 Characterization techniques The TEM analysis was carried out on a JEOL 2100F working at 200kV accelerated voltage, equipped with a probe corrector for spherical aberrations, and a point-to-point resolution of 0.2nm. The sample was grinded and then dispersed by ultrasounds in an ethanol solution for 5min and a drop of the solution was deposited on a copper grid covered with a holey carbon membrane for observation. The scanning electron microscopy (SEM) was carried out on a JEOL 2600F with a resolution of 5nm. The sample was deposited onto a double face graphite tape in order to avoid the problem of charging effect during the analysis. The thermal gravimetric analysis (TGA) was carried out on a TA Instruments Model Q-5000. The known amount of sample (10mg) was loaded into a platinum crucible and heated up in air from room temperature to 1000°C with a heating rate of 5°Cmin−1. The specific surface area of the support and the catalyst, after reduction, was determined in a Micromeritics sorptometer. The sample was outgassed at 250°C under vacuum for 14h in order to desorb moisture and adsorbed species on its surface. The measurements were carried out using N2 as adsorbent at liquid N2 temperature at relative pressures between 0.06 and 0.2. The X-ray photoelectron spectroscopy (XPS) measurements of the support and catalyst were performed by using a MULTILAB 2000 (THERMO) spectrometer equipped with an Al Kα anode (hν =1486.6eV) with 10min of acquisition to achieve a good signal to noise ratio. Peak deconvolution was performed with the “Avantage” program from the Thermoelectron Company. The C1s photoelectron-binding energy was set at 284.6±0.2eV relative to the Fermi level and used as reference to calibrate the other peak positions. 2.4 Selective oxidation of H2S The catalytic selective oxidation of H2S by oxygen (Eq. (1)) was carried out in an apparatus working isothermally at atmospheric pressure. The temperature was controlled by a K-type thermocouple and a Minicor regulator. The gas mixture was passed downward through the catalyst bed. Before the test, the reactor was flushed with helium at room temperature until no trace of oxygen was detected at the outlet. The helium flow was replaced by the one containing steam. The catalyst was slowly heated up to the reaction temperature, and then the wet helium flow was replaced by the reactant mixture. The gases (H2S, O2, and He) flow rate was monitored by Brooks 5850TR mass flow controllers linked to a control unit. The composition of the reactant feed was H2S (1vol.%), O2 (0.625%, 1.25% or 2.5vol.%), H2O (30vol.%) and He (balance). The use of a relatively high concentration of steam in the feed is motivated by the will to be as close as possible to the industrial working conditions as the steam formed during the former Claus units is not removed before the oxidation step and remains in the treated tail gas. Steam (30vol.%) was fed to the gas mixture by bubbling a helium flow through a liquid tank containing water maintained at 85°C. The O2-to-H2S molar ratio was varied from 0.62 to 2.5 with a WHSV fixed at 0.6h−1. It is worth to note that the WHSV used in the present work is extremely high regarding the usual WHSV used in the industrial process for this kind of reaction, i.e. 0.09h−1 (GHSV: 1500h−1). (1) H2S+½O2 →(1/n)S n +H2OΔH =−222kJmol−1 The reaction was conducted in a continuous mode and the sulfur formed during the reaction was vaporized, due to the relatively high partial pressure of sulfur at these reaction temperatures, and was further condensed at the exit of the reactor in a trap maintained at room temperature. The analysis of the inlet and outlet gases was performed on-line using a Varian CP-3800 gas chromatography (GC) equipped with a Chrompack CP-SilicaPLOT capillary column coupled with a thermal catharometer detector (TCD), allowing the detection of O2, H2S, H2O and SO2. 3 Results and discussion 3.1 N-CNT/SiC characteristics The N-CNT yield and the specific surface area of the composites synthesized on the Fe–7%/SiC extrudate catalysts as a function of the reaction temperature are presented in Fig. 2 . Introduction of the N-CNT on the SiC host surface leads to a significant increase of the composite specific surface area, from about 20m2/g to more than 100m2/g, as shown in Fig. 2 with the maximum value of 150m2/g at the synthesis temperature of 750°C. The specific surface area increase was directly attributed to the presence of the N-CNT with high intrinsic surface area [13,17,18,31,32]. At higher synthesis temperature the N-CNT yield and the specific surface area slightly decreased (Fig. 2). The decrease of the N-CNT yield as increasing the synthesis temperature could be attributed to the gasification of part of the formed N-CNT by the hydrogen presence in the reactor while the specific surface area lost was attributed to the generation of a more graphitic material with lower surface area. The N-CNTs yield obtained on the N-CNTs/SiC extrudates at 750°C was about 40wt.%. The results obtained have shown that at yield higher than 60wt.%, the macroscopic structure was partly destroyed due to the breakdown of the grain boundary by the formed nanotubes. The decoration of the SiC surface with a dense layer of N-CNT also significantly increases the macroscopic shape of the support as evidenced by the digital photos in Fig. 3 . Such phenomenon has already been reported previously by different groups working on the CVD synthesis of either CNT or N-CNT on macroscopic supports [34–37] on the alumina-based growth catalyst. SEM analysis was extensively employed to characterize the final composite morphology and the coverage of the SiC host structure by the N-CNT and the representative SEM micrographs are presented in Fig. 4 . The N-CNT/SiC sample was synthesized at 750°C. Low magnification SEM micrographs (not shown) indicates that the SiC surface was completely covered by a dense and homogeneous layer of entangled carbon nanotubes providing a high density of active sites and low diffusion catalytic network for performing the selective oxidation reaction. For comparison the SEM micrographs of the N-CNT synthesized from the Fe/Al2O3 catalyst at 750°C are also reported in Fig. 4A and B. The diameter distribution of the N-CNT synthesized on the SiC- and alumina-based catalysts is presented in Fig. 2B. The N-CNT synthesized from the alumina-based catalyst exhibit a narrower diameter distribution which is centered between 20 and 40nm, while those synthesized from the SiC-based catalyst show a much larger diameter distribution ranged from 20 to 80nm. Such result could be attributed to the specific surface area of SiC which is lower than that of alumina and to the low metal-support interaction between the deposited iron nanoparticles and the SiC surface which leads to the sintering of the growth catalyst, during the thermal treatment, and thus, to a larger diameter of the as-growth N-CNT compared to that observed on the alumina-based catalyst. SEM micrographs also evidence the absence of carbon nanoparticles in the samples which confirm the high selectivity of the synthesis process to generate nitrogen-doped carbon nanotubes. It is worthy to note that the composite integrity was strongly depended on the synthesis temperature: low synthesis temperature, i.e. <750°C, leads to the relatively high yield (>40wt.%) of the N-CNTs which partially break the macroscopic structure of the final composite, while high synthesis temperature leads to the significant reduction of the N-CNT yield. This low N-CNT yield could be attributed to the formation of amorphous carbon or to the excessive gasification of the formed carbon by the H2 generated within the synthesis medium. The high temperature synthesis also leads to a significant decrease of the nitrogen doping in the material (Table 1 ) which is attributed to the low stability of the nitrogen in the carbon matrix at high temperature. The most appropriate synthesis temperature is set at 750°C which allows the compromise between yield and morphological stability. For the catalytic process only the catalyst synthesized at 750°C with a N-CNT yield of about 40wt.% will be evaluated. The microstructure of the N-CNT/SiC catalyst is also investigated by TEM and the representative TEM micrographs are presented in Fig. 5 . High-resolution TEM micrographs of the N-CNT catalyst are presented in Fig. 5A and B and again confirm the lack of any residual iron nanoparticles on the outer surface of the catalyst in good agreement with the assumption that residual iron is mainly localized within the tube channel. The TEM analysis confirms the periodical bamboo-like structure of the nanotube which is typical for the CNT doped with nitrogen atoms [38–40]. It has been reported that nitrogen doping not only modify the physical properties of the nanotubes but also drastically modify the morphology and microstructure of the carbon nanotubes [41,42]. Low magnification TEM analysis indicates the complete absence of carbon nanoparticles which again confirm the high selectivity of the synthesis to the formation of N-CNT. The nitrogen species present in the catalyst are analyzed by XPS and the results are presented in Fig. 6 . The N1s recorded XPS shows that the N-CNT/SiC synthesized at 750°C (so far named N-CNT/SiC-750) contains 4.1at.% of nitrogen presented in Fig. 6A and shows the presence of several nitrogen nitrogen-bonded carbon species: pyridinic, pyrrolic, quaternary, and an oxidized type of pyridinic nitrogen [43–46]. On the N-CNT/Al2O3 synthesized at the same temperature (N-CNT-750) similar results are also observed. The percentages of the different nitrogen species present on the two catalysts are summarized in Table 1. The SiC-based catalyst seems to have a higher total N content and also N-pyridinic species compared to the unsupported ones. The absence of iron particles on the surface of the N-CNT is also investigated by using XPS. Fe2p XPS spectra of the N-CNT/SiC-750 and N-CNT-750 catalysts are shown in Fig. 6B. The atomic percentage of iron in N-CNT/SiC-750 and N-CNT-750, measured by using XPS, is very low, and confirms the almost complete removal of the iron growth catalyst after the acid treatment (Fig. 6B). However, one cannot exclude the presence of some residual iron growth catalyst inside the N-CNTs which was not accessible during the acid treatment. According to the previous results these iron NPs are not accessible to the reactant during the subsequence catalytic reaction as well. 3.2 Selective oxidation of H2S 3.2.1 Influence of the reaction temperature The desulfurization tests are carried out on the N-CNT-750 and N-CNT/SiC-750 catalysts at two reaction temperatures, 170°C and 190°C, and with the WHSV fixed at 0.6h−1. The catalysts were evaluated first at 190°C for about 50h of test and then, the reaction temperature was lowered from 190 to 170°C and the test was continued on the same catalyst. The results obtained as a function of time on stream are presented in Fig. 7 . According to the results the N-CNT/SiC catalyst exhibits a relatively high desulfurization activity compared to the unsupported N-CNT catalyst regardless of the reaction temperature. The high desulfurization activity could be attributed to the high open porous structure of the N-CNTs/SiC, due to the generation of N-CNTs from different SiC grains surface, which provides a high effective surface contact between the reactant and the active sites compared to the unsupported N-CNTs with a more entangled structure which could render difficult the diffusion of the gaseous reactant inside the structure. The high effective surface area of the N-CNTs/SiC induces, however, a lower sulfur selectivity compared to the unsupported ones which could be attributed to secondary reactions between the formed sulfur and the oxygen in excess under the reaction conditions applied. Similar results have already been reported in previous work [14]. The desulfurization test on the N-CNT/SiC catalyst was also carried out at higher space velocity in order to check out the influence of the H2S conversion on the sulfur selectivity (Fig. 8 ). The sulfur selectivity slightly increases from 75 to around 80% when the H2S conversion was decreased from 95 to 45% and remains stable for the whole test. The sulfur selectivity remains unchanged at 80% even after further decreasing the H2S conversion from 45 to 30% which indicates that the sulfur selectivity is directly linked with the catalyst morphology and not only to the H2S conversion level. It is expected that on the N-CNT/SiC catalyst a direct reaction between H2S and O2 could occur, probably through the layer of N-CNTs, which lead to a higher production of SO2 compared to the unsupported one. 3.2.2 Influence of the N-CNT loading The catalytic performance of the N-CNT/SiC-750 catalysts synthesized under the same reaction temperature but with different N-CNT loading, i.e. N-CNT density and thickness, is also evaluated and the results are presented in Fig. 9 . According to the results one can stated that high N-CNT loading, i.e. 60wt.%, leads to a significantly lower desulfurization performance compared to that obtained on the low N-CNT loading, i.e. 40wt.%. The low desulfurization activity obtained on the high N-CNT loading could be attributed to the presence of a much denser N-CNT network on the catalyst surface, and also to the partial breakdown of the catalyst integrity, which could hinder the accessibility of the reactants toward the inside active site. Similar results have also been observed in the present work on the unsupported N-CNTs with low accessibility. On the lower N-CNT loading catalyst it is expected that the N-CNT layer and entanglement degree are less pronounced and thus, leading to a more easy diffusion of the reactants toward the active site. Such explanation was also partly confirmed by the sulfur selectivity obtained, the sulfur selectivity is almost similar on both catalysts: on the low loading catalyst the sulfur selectivity is about 75% whereas it reached almost 78% on the high loading catalyst. Such results could be explained by a lower accessibility of the reactant to the active site in the case of the catalyst with high N-CNTs loading and not to a modification of the active site nature. 3.2.3 Influence of the O2-to-H2S molar ratio The influence of the O2-to-H2S molar ratio on the desulfurization performance was also studied in order to evaluate the ability of the N-CNT to generate active oxygen species for oxidizing H2S compound. The results obtained at different O2-to-H2S molar ratios, i.e. 2.5, 1.25 and 0.625, as a function of time on stream are presented in Fig. 10 . The decreasing of the O2-to-H2S molar ratio leads to a slight decrease of the desulfurization performance without any observable deactivation as a function of time on stream. On the other hand, the sulfur selectivity steadily increases as decreasing the O2-to-H2S molar ratio. The sulfur selectivity increases was attributed to the low oxygen partial pressure which prevent successive oxidation of the formed sulfur into SO2. The results indicate that the N-CNT/SiC-750 catalyst exhibits a high activity for oxygen dissociation which provides enough oxygen to perform the selective oxidation of H2S even at low oxygen concentration in the reactant mixture and under a relatively high space velocity. Such phenomenon is relatively similar to the oxygen dissociation mechanism reported on the N-CNTs for the ORR [47,48]. It is worthy to note that it is the first time that such high desulfurization performance has been reported at high space velocity and low O2-to-H2S molar ratio. Desulfurization reaction carried out on supported Fe-based catalysts at higher reaction temperature and lower WHSV has shown that at low O2-to-H2S molar ratio the H2S conversion was severely decreased due to the lack of active oxygen species available for the reaction [26]. 3.2.4 Desulfurization performance between N-CNT/SiC and Fe2O3/SiC catalysts For comparison the catalytic desulfurization performance of the Fe2O3-3%/SiC extrudate catalyst, which is among the most reactive catalyst for the selective oxidation of H2S [26,27], and that of the N-CNT/SiC-750 are also reported in Fig. 11 . The results show that all the tested catalysts exhibit a high stability as a function of time on stream. The results clearly indicate that the N-CNT/SiC-750 metal-free catalyst is the most active catalyst for performing the selective oxidation of H2S into elemental sulfur at low reaction temperature range and under high space velocity. Indeed, under the same reaction conditions, the N-CNT/SiC-750 exhibits a conversion of about 97% compared to <20% for the Fe2O3/SiC catalyst. The low desulfurization activity of the Fe2O3/SiC catalyst could be attributed to the high space velocity of the reaction which significantly affects the diffusion of the reactant inside the SiC pore where the active phase was localized. On the N-CNT/SiC catalyst the high effective surface area combined with the nanoscopic size of the carbon nanotubes significantly improve the contact surface between the active site and the reactant leading to such a high desulfurization activity. Similar results have also been obtained on the cobalt catalyst deposited on a low surface area alumina decorated with carbon nanotubes for the Fischer–Tropsch synthesis [49]. The Fischer–Tropsch activity was greatly improved compared to the alumina-based catalyst due to the high effective surface area of the carbon-based catalyst for the gas phase reactant. The difference in the specific surface area between the two catalysts, i.e. 40m2/g for the Fe2O3/SiC and 145m2/g for the N-CNT/SiC catalyst, also contributes to the enhancement of the desulfurization performance on the N-CNT/SiC catalyst. The sulfur selectivity on the N-CNT-based catalysts is slightly lower than the one obtained on the iron-based catalyst, i.e. 75% instead of ca. 88%. This low sulfur selectivity could be attributed to the high activity of the N-CNTs which further oxidize the formed sulfur or the H2S into SO2 in the presence of excess oxygen in the stream as observed above. The apparent longer sojourn time of the sulfur intermediate within the N-CNT layer could also favor the secondary oxidation reaction to yield SO2 and thus, leading to a lower selectivity. According to this result one should expected that the N-CNT density and thickness could play a significant role on the desulfurization performance. Work is ongoing to find new structured metal-free catalyst with better activity along with high selectivity by replacing N-CNTs by nitrogen-doped carbon composite with high effective surface area and low diffusion characteristic length, i.e. mesoporous-doped carbon generated from thermal decomposition of polymerized ionic liquids (PILs) [50]. 3.3 Characteristics of the spent catalysts The specific surface area of the spent N-CNT/SiC catalyst, measured after more than 200h of reaction under different reaction conditions, is about two times lower than that of the fresh catalyst, i.e. 80 instead of 145m2/g. Such result could be attributed to the deposition of some solid sulfur with low specific surface area within the catalysts porosity which contributes to the lowering of the overall specific surface area of the catalysts. The XPS analysis carried out on the spent catalyst, after more than 200h on stream, evidences the presence of some sulfur species on the catalyst surface (Fig. 12 ). Such sulfur deposition was attributed to the low reaction temperature in the present study, i.e. 190°C instead of 230°C, which is not able to vaporize the totality of the solid sulfur formed during the reaction. As no deactivation was observed as a function of time on stream on the catalysts one should expected that the solid sulfur was mostly deposited on the SiC surface and thus, had no direct effect on the desulfurization activity of the N-CNT. It is worthy to note that the desulfurization performance can be recovered after a thermal treatment of the spent catalyst under helium flow at 400°C for 1h in order to vaporize the residual solid sulfur. The XPS analysis also confirms the high stability of the catalyst as the nitrogen species distribution remains unchanged after the reaction as shown by the N1s spectrum in Fig. 12. 4 Conclusion In summary, nitrogen-doped carbon nanotubes supported on a macroscopic host structure of SiC have shown to be an active and selective metal-free catalyst for the low-temperature oxidation of H2S into elemental sulfur. The macroscopic shaping of the catalyst allows one to avoid the problems linked with the handling and transport of the nanoscopic un-supported N-CNT catalyst. In addition, this hybrid metal-free catalyst with controlled macroscopic shape can be efficiently employed in a fixed-bed configuration without facing the problem linked with the pressure drop across the catalytic bed. The N-CNT supported on SiC extrudate catalyst also displays higher desulfurization performance compared to the most active Fe2O3/SiC catalyst. The high activity of the N-CNT-based catalyst for oxygen dissociation also allows the catalyst to operate at low O2-to-H2S molar ratio without detrimental lost in catalytic performance. The N-CNT/SiC catalysts were also extremely stable under the employed desulfurization reaction which could be directly attributed to the chemical bonding between the nitrogen and the carbon matrix, which prevent active site lost by sintering. Some surface area lost was observed on the spent catalyst which could be attributed to the presence of some low surface area solid sulfur deposited on the SiC surface during the course of the reaction. However, as no deactivation occurred, even after more than 100h of test, one can speculate that such solid sulfur deposition has no effect on the overall density of the active site. The results obtained here have shown that hierarchical nitrogen-doped carbon materials with controlled macroscopic shaping can be efficiently employed as metal-free catalyst for several reaction of interest. Acknowledgements The present work is financially supported by a European project (FREECATS) under a contract number NMP-2011-2.2-4 “Novel materials for replacement of strategic or scarce raw materials”. LTP would like to thank the EU (Grant No. NMP3-SL-2012-280658) for the grant during his postdoctoral stay at the ICPEES. DVC would like to thank the Vietnamese Government for the grant during his stay at the ICPEES. The SiC samples were supplied by SICAT Co. (www.sicatcatalyst.com) within the framework of the FREECATS project. The XPS, SEM and TEM analysis were performed at the facilities of the IPCMS (UMR 7504 CNRS-University of Strasbourg) and P. Bernhardt, T. Romero, W. Baaziz (ICPEES) and O. Ersen (IPCMS) are gratefully acknowledged for performing XPS, SEM and TEM analysis. References [1] S. Yasuda L. Yu J. Kima K. Murakoshi Chem. Commun. 49 2013 9627 9629 [2] G. Tuci C. Zafferoni P. D’Ambrosio S. Caporali M. Ceppatelli A. Rossin T. Tsoufis M. Innocenti G. Giambastiani ACS Catal. 3 9 2013 2108 2111 [3] L. Qu Y. Liu J.-B. Baek L. Dai ACS Nano 4 2010 1321 1326 [4] C. Nederlof F. Kapteijn M. Makkee Appl. Catal. A: Gen. 417–418 2012 163 173 [5] D. Bégin G. Ulrich J. Amadou D.S. Su C. Pham-Huu R. Ziessel J. Mol. Catal. A: Chem. 302 2009 119 123 [6] C. Chen J. Zhang B. Zhang C. Yu F. Peng D.S. Su Chem. Commun. 49 2013 8151 8153 [7] J. Amadou K. Chizari M. Houllé I. Janowska O. Ersen D. Bégin C. Pham-Huu Catal. Today 138 2008 62 68 [8] A. Villa J.P. Tessonnier O. Majoulet D.S. Su R. Schlögl Chem. Commun. 29 2009 4405 4407 [9] A. Villa J.P. Tessonnier O. Majoulet D.S. Su R. Schlögl ChemSusChem 3 2010 241 245 [10] Y. Cao H. Yu J. Tan F. Peng H. Wang J. Li W. Zheng N.-B. Wong Carbon 57 2013 433 442 [11] K. Chizari A. Deneuve O. Ersen I. Florea Y. Liu D. Edouard I. Janowska D. Begin C. Pham-Huu ChemSusChem 5 2012 102 108 [12] J. Luo F. Peng H. Wang H. Yu Catal. Commun. 39 2013 44 49 [13] D.S. Su S. Perathoner G. Centi Chem. Rev. 113 2013 5782 5816 [14] H. Wang T. Maiyalagan X. Wang ACS Catal. 2 2012 781 794 [15] D. Yu E. Nagelli F. Du L. Dai J. Phys. Chem. Lett. 1 2010 2165 2173 [16] S. Peng K. Cho Nano Lett. 3 2003 513 517 [17] D.S. Su J. Zhang B. Frank A. Thomas X. Wang J. Paraknowitsch R. Schlögl ChemSusChem 3 2010 169 180 [18] S. van Dommele K.P. de Jong J.H. Bitter Chem. Commun. 46 2006 4859 4861 [19] L. Faba Y.A. Criado E. Gallegos-Suarez M. Perez-Cadenas E. Diaz I. Rodriguez-Ramos A. Guerrero-Ruiz S. Ordonez Appl. Catal. A: Gen. 458 2013 155 161 [20] Y. Gao G. Hu J. Zhong Z. Shi Y. Zhu D.S. Su J. Wang X. Bao D. Ma Angew. Chem. Int. Ed. 52 2013 2109 2113 [21] L. Connock Sulphur 34 1998 257 [22] S.W. Chun J.Y. Jang D.W. Park H.C. Woo J.S. Chung Appl. Catal. B: Environ. 16 1998 235 [23] J.W. Estep G.T. McBride Jr. J.R. West Advances in Petroleum Chemistry and Refining vol. 6 1962 Interscience New-York 315 (Chapter 7) [24] J. Wieckowska Catal. Today 24 1995 405 [25] M.J. Ledoux C. Pham-Huu N. Keller J.B. Nougayrède S. Savin-Poncet J. Bousquet Catal. Today 61 2000 157 163 [26] N. Keller C. Pham-Huu M.J. Ledoux Appl. Catal. A: Gen. 217 2001 205 217 [27] P. Nguyen D. Edouard J.M. Nhut M.J. Ledoux C. Pham-Huu Appl. Catal. B: Environ. 76 2007 300 310 [28] P. Nguyen Ch. Pham Appl. Catal. A 391 2011 443 454 [29] A. Deneuve O. Ersen P. Nguyen Ch. Pham D. Edouard D. Begin M.J. Ledoux C. Pham-Huu Appl. Catal. A: Gen. 385 2010 52 61 [30] I. Florea O. Ersen Ch. Hirlimann L. Roiban A. Deneuve M. Houllé I. Janowska P. Nguyen Ch. Pham C. Pham-Huu Nanoscale 2 2010 2668 2678 [31] K. Chizari I. Janowska M. Houllé I. Florea O. Ersen T. Romero P. Bernhardt M.J. Ledoux C. Pham-Huu Appl. Catal. A: Gen. 380 2010 72 80 [32] J. Amadou K. Chizari M. Houllé I. Janowska O. Ersen D. Begin C. Pham-Huu Catal. Today 138 2008 62 68 [33] I. Florea O. Ersen R. Arenal D. Ihiawakrim C. Messaoudi K. Chizari I. Janowska C. Pham-Huu J. Am. Chem. Soc. 134 2012 9672 9680 [34] J.P. Tessonnier D.S. Su ChemSusChem 4 2011 824 847 [35] P. Chen L.M. Chew A. Kostka M. Muhler W. Xia Catal. Sci. Technol. 3 2013 1964 1971 [36] I. Janowska G. Winé M.J. Ledoux C. Pham-Huu J. Mol. Catal. A: Chem. 267 2007 92 97 [37] L. Roldan S. Armenise Y. Marco E. Garcia-Bordejé Phys. Chem. Chem. Phys. 14 2012 3568 3575 [38] M. Terrones A.M. Benito C. Manteca-Diego W.K. Hsu O.I. Osman J.P. Hare D.G. Reid H. Terrones A.K. Cheetham K. Prassides H.W. Kroto D.R.M. Walton Chem. Phys. Lett. 257 1996 576 582 [39] D. Zhong S. Lin G. Zhang E.G. Wang J. Appl. Phys. 89 2001 5939 5943 [40] K. Chizari A. Vena L. Laurentius U. Sundararaj Carbon 68 2014 369 379 [41] M. Terrones P.M. Ajayan F. Banhart X. Blase D.L. Carroll J.C. Charlier Appl. Phys. A: Mater. Sci. Process. 74 2002 355 361 [42] C.P. Ewels M. Glerup J. Nanosci. Nanotechnol. 5 2005 1345 1363 [43] S. Biniak G. Szymanski J. Siedlewski A. Wiatkoski Carbon 35 1997 1799 1810 [44] H.C. Choi J. Park B. Kim J. Phys. Chem. B 109 2005 4333 4340 [45] H.C. Choi S.Y. Bae J. Park K. Seo C. Kim B. Kim H.J. Song H.J. Shin Appl. Phys. Lett. 85 2004 5742 5744 [46] V.V. Strelko N.T. Kartel I.N. Dukhno V.S. Kuts R.B. Clarkson B.M. Odintsov Surf. Sci. 548 2004 281 290 [47] K. Gong F. Du Z. Xia M. Durstock L. Dai Science 323 2009 760 764 [48] G. Tuci C. Zafferoni A. Rossin A. Milella L. Luconi M. Innocneti L. Truong-Phuoc C. Duong-Viet C. Pham-Huu G. Giambastiani Chem. Mater. 2014 10.1021/cm500805c [49] Y. Liu T. Dintzer O. Ersen C. Pham-Huu J. Energy Chem. 22 2013 279 289 [50] Q. Zhao T.P. Feillinger M. Antoneitti J. Yuan J. Mater. Chem. A 1 2013 5113 5120",
      "scopus-id": "84904292368",
      "coredata": {
        "eid": "1-s2.0-S0926860X14003962",
        "dc:description": "Hierarchical metal-free catalyst based on the CVD synthesis of nitrogen-doped carbon nanotubes decorated silicon carbide (N-CNTs/SiC) macroscopic host structure has been prepared. The catalyst was evaluated in the partial oxidation of H2S by oxygen into elemental sulfur in a fixed-bed reactor. The catalytic results indicate that the N-CNTs/SiC catalyst exhibits an extremely high desulfurization performance even under severe reaction conditions such as low temperature, high space velocity and at low O2-to-H2S molar ratio. The high desulfurization performance was attributed to the high effective surface area of the catalyst along with a short diffusion length associated with the nanoscopic dimension of the carbon nanotubes. The N-CNTs/SiC catalyst also displays a high stability as a function of time on stream which could be attributed to the strong anchoring of the nitrogen doping within the carbon matrix. The extrudates shape of the SiC support allows the direct macroscopic shaping of the catalyst for use in conventional fixed-bed reactor without facing problems linked with catalyst handling, transportation and pressure drop across the catalyst bed as encountered with nanoscopic carbon-based catalyst.",
        "openArchiveArticle": "false",
        "prism:coverDate": "2014-07-22",
        "openaccessUserLicense": null,
        "prism:aggregationType": "Journal",
        "prism:url": "https://api.elsevier.com/content/article/pii/S0926860X14003962",
        "dc:creator": [
          {
            "@_fa": "true",
            "$": "Cuong, Duong-Viet"
          },
          {
            "@_fa": "true",
            "$": "Truong-Phuoc, Lai"
          },
          {
            "@_fa": "true",
            "$": "Tran-Thanh, Tung"
          },
          {
            "@_fa": "true",
            "$": "Nhut, Jean-Mario"
          },
          {
            "@_fa": "true",
            "$": "Nguyen-Dinh, Lam"
          },
          {
            "@_fa": "true",
            "$": "Janowska, Izabela"
          },
          {
            "@_fa": "true",
            "$": "Begin, Dominique"
          },
          {
            "@_fa": "true",
            "$": "Pham-Huu, Cuong"
          }
        ],
        "link": [
          {
            "@_fa": "true",
            "@rel": "self",
            "@href": "https://api.elsevier.com/content/article/pii/S0926860X14003962"
          },
          {
            "@_fa": "true",
            "@rel": "scidir",
            "@href": "https://www.sciencedirect.com/science/article/pii/S0926860X14003962"
          }
        ],
        "dc:format": "application/json",
        "openaccessType": null,
        "pii": "S0926-860X(14)00396-2",
        "prism:volume": "482",
        "prism:publisher": "Elsevier B.V.",
        "dc:title": "Nitrogen-doped carbon nanotubes decorated silicon carbide as a metal-free catalyst for partial oxidation of H2S",
        "prism:copyright": "Copyright © 2014 Elsevier B.V. All rights reserved.",
        "openaccess": "0",
        "prism:issn": "0926860X",
        "dcterms:subject": [
          {
            "@_fa": "true",
            "$": "Catalysis"
          },
          {
            "@_fa": "true",
            "$": "Nitrogen-doped carbon nanotubes"
          },
          {
            "@_fa": "true",
            "$": "Silicon carbide"
          },
          {
            "@_fa": "true",
            "$": "Extrudates"
          },
          {
            "@_fa": "true",
            "$": "Selective oxidation"
          },
          {
            "@_fa": "true",
            "$": "H2S"
          }
        ],
        "openaccessArticle": "false",
        "prism:publicationName": "Applied Catalysis A: General",
        "openaccessSponsorType": null,
        "prism:pageRange": "397-406",
        "prism:endingPage": "406",
        "pubType": "fla",
        "prism:coverDisplayDate": "22 July 2014",
        "prism:doi": "10.1016/j.apcata.2014.06.010",
        "prism:startingPage": "397",
        "dc:identifier": "doi:10.1016/j.apcata.2014.06.010",
        "openaccessSponsorName": null
      },
      "objects": {
        "object": [
          {
            "@category": "high",
            "@height": "1978",
            "@width": "1333",
            "@_fa": "true",
            "$": "https://api.elsevier.com/content/object/eid/1-s2.0-S0926860X14003962-gr9_lrg.jpg?httpAccept=%2A%2F%2A",
            "@multimediatype": "JPEG image file",
            "@type": "IMAGE-HIGH-RES",
            "@size": "250487",
            "@ref": "gr9",
            "@mimetype": "image/jpeg"
          },
          {
            "@category": "high",
            "@height": "1094",
            "@width": "1492",
            "@_fa": "true",
            "$": "https://api.elsevier.com/content/object/eid/1-s2.0-S0926860X14003962-gr8_lrg.jpg?httpAccept=%2A%2F%2A",
            "@multimediatype": "JPEG image file",
            "@type": "IMAGE-HIGH-RES",
            "@size": "137938",
            "@ref": "gr8",
            "@mimetype": "image/jpeg"
          },
          {
            "@category": "high",
            "@height": "1930",
            "@width": "1240",
            "@_fa": "true",
            "$": "https://api.elsevier.com/content/object/eid/1-s2.0-S0926860X14003962-gr7_lrg.jpg?httpAccept=%2A%2F%2A",
            "@multimediatype": "JPEG image file",
            "@type": "IMAGE-HIGH-RES",
            "@size": "240828",
            "@ref": "gr7",
            "@mimetype": "image/jpeg"
          },
          {
            "@category": "high",
            "@height": "2107",
            "@width": "1306",
            "@_fa": "true",
            "$": "https://api.elsevier.com/content/object/eid/1-s2.0-S0926860X14003962-gr6_lrg.jpg?httpAccept=%2A%2F%2A",
            "@multimediatype": "JPEG image file",
            "@type": "IMAGE-HIGH-RES",
            "@size": "412146",
            "@ref": "gr6",
            "@mimetype": "image/jpeg"
          },
          {
            "@category": "high",
            "@height": "601",
            "@width": "1500",
            "@_fa": "true",
            "$": "https://api.elsevier.com/content/object/eid/1-s2.0-S0926860X14003962-gr5_lrg.jpg?httpAccept=%2A%2F%2A",
            "@multimediatype": "JPEG image file",
            "@type": "IMAGE-HIGH-RES",
            "@size": "540321",
            "@ref": "gr5",
            "@mimetype": "image/jpeg"
          },
          {
            "@category": "high",
            "@height": "1153",
            "@width": "1500",
            "@_fa": "true",
            "$": "https://api.elsevier.com/content/object/eid/1-s2.0-S0926860X14003962-gr4_lrg.jpg?httpAccept=%2A%2F%2A",
            "@multimediatype": "JPEG image file",
            "@type": "IMAGE-HIGH-RES",
            "@size": "661387",
            "@ref": "gr4",
            "@mimetype": "image/jpeg"
          },
          {
            "@category": "high",
            "@height": "564",
            "@width": "1500",
            "@_fa": "true",
            "$": "https://api.elsevier.com/content/object/eid/1-s2.0-S0926860X14003962-gr3_lrg.jpg?httpAccept=%2A%2F%2A",
            "@multimediatype": "JPEG image file",
            "@type": "IMAGE-HIGH-RES",
            "@size": "197081",
            "@ref": "gr3",
            "@mimetype": "image/jpeg"
          },
          {
            "@category": "high",
            "@height": "1036",
            "@width": "2909",
            "@_fa": "true",
            "$": "https://api.elsevier.com/content/object/eid/1-s2.0-S0926860X14003962-gr2_lrg.jpg?httpAccept=%2A%2F%2A",
            "@multimediatype": "JPEG image file",
            "@type": "IMAGE-HIGH-RES",
            "@size": "262289",
            "@ref": "gr2",
            "@mimetype": "image/jpeg"
          },
          {
            "@category": "high",
            "@height": "1877",
            "@width": "2493",
            "@_fa": "true",
            "$": "https://api.elsevier.com/content/object/eid/1-s2.0-S0926860X14003962-gr12_lrg.jpg?httpAccept=%2A%2F%2A",
            "@multimediatype": "JPEG image file",
            "@type": "IMAGE-HIGH-RES",
            "@size": "562466",
            "@ref": "gr12",
            "@mimetype": "image/jpeg"
          },
          {
            "@category": "high",
            "@height": "3186",
            "@width": "1981",
            "@_fa": "true",
            "$": "https://api.elsevier.com/content/object/eid/1-s2.0-S0926860X14003962-gr11_lrg.jpg?httpAccept=%2A%2F%2A",
            "@multimediatype": "JPEG image file",
            "@type": "IMAGE-HIGH-RES",
            "@size": "422650",
            "@ref": "gr11",
            "@mimetype": "image/jpeg"
          },
          {
            "@category": "high",
            "@height": "965",
            "@width": "1240",
            "@_fa": "true",
            "$": "https://api.elsevier.com/content/object/eid/1-s2.0-S0926860X14003962-gr10_lrg.jpg?httpAccept=%2A%2F%2A",
            "@multimediatype": "JPEG image file",
            "@type": "IMAGE-HIGH-RES",
            "@size": "115299",
            "@ref": "gr10",
            "@mimetype": "image/jpeg"
          },
          {
            "@category": "high",
            "@height": "2980",
            "@width": "2667",
            "@_fa": "true",
            "$": "https://api.elsevier.com/content/object/eid/1-s2.0-S0926860X14003962-gr1_lrg.jpg?httpAccept=%2A%2F%2A",
            "@multimediatype": "JPEG image file",
            "@type": "IMAGE-HIGH-RES",
            "@size": "1042004",
            "@ref": "gr1",
            "@mimetype": "image/jpeg"
          },
          {
            "@category": "high",
            "@height": "886",
            "@width": "2179",
            "@_fa": "true",
            "$": "https://api.elsevier.com/content/object/eid/1-s2.0-S0926860X14003962-fx1_lrg.jpg?httpAccept=%2A%2F%2A",
            "@multimediatype": "JPEG image file",
            "@type": "IMAGE-HIGH-RES",
            "@size": "263179",
            "@ref": "fx1",
            "@mimetype": "image/jpeg"
          },
          {
            "@category": "standard",
            "@height": "447",
            "@width": "301",
            "@_fa": "true",
            "$": "https://api.elsevier.com/content/object/eid/1-s2.0-S0926860X14003962-gr9.jpg?httpAccept=%2A%2F%2A",
            "@multimediatype": "JPEG image file",
            "@type": "IMAGE-DOWNSAMPLED",
            "@size": "28903",
            "@ref": "gr9",
            "@mimetype": "image/jpeg"
          },
          {
            "@category": "standard",
            "@height": "247",
            "@width": "337",
            "@_fa": "true",
            "$": "https://api.elsevier.com/content/object/eid/1-s2.0-S0926860X14003962-gr8.jpg?httpAccept=%2A%2F%2A",
            "@multimediatype": "JPEG image file",
            "@type": "IMAGE-DOWNSAMPLED",
            "@size": "17230",
            "@ref": "gr8",
            "@mimetype": "image/jpeg"
          },
          {
            "@category": "standard",
            "@height": "436",
            "@width": "280",
            "@_fa": "true",
            "$": "https://api.elsevier.com/content/object/eid/1-s2.0-S0926860X14003962-gr7.jpg?httpAccept=%2A%2F%2A",
            "@multimediatype": "JPEG image file",
            "@type": "IMAGE-DOWNSAMPLED",
            "@size": "29410",
            "@ref": "gr7",
            "@mimetype": "image/jpeg"
          },
          {
            "@category": "standard",
            "@height": "476",
            "@width": "295",
            "@_fa": "true",
            "$": "https://api.elsevier.com/content/object/eid/1-s2.0-S0926860X14003962-gr6.jpg?httpAccept=%2A%2F%2A",
            "@multimediatype": "JPEG image file",
            "@type": "IMAGE-DOWNSAMPLED",
            "@size": "48520",
            "@ref": "gr6",
            "@mimetype": "image/jpeg"
          },
          {
            "@category": "standard",
            "@height": "226",
            "@width": "565",
            "@_fa": "true",
            "$": "https://api.elsevier.com/content/object/eid/1-s2.0-S0926860X14003962-gr5.jpg?httpAccept=%2A%2F%2A",
            "@multimediatype": "JPEG image file",
            "@type": "IMAGE-DOWNSAMPLED",
            "@size": "75282",
            "@ref": "gr5",
            "@mimetype": "image/jpeg"
          },
          {
            "@category": "standard",
            "@height": "434",
            "@width": "565",
            "@_fa": "true",
            "$": "https://api.elsevier.com/content/object/eid/1-s2.0-S0926860X14003962-gr4.jpg?httpAccept=%2A%2F%2A",
            "@multimediatype": "JPEG image file",
            "@type": "IMAGE-DOWNSAMPLED",
            "@size": "122455",
            "@ref": "gr4",
            "@mimetype": "image/jpeg"
          },
          {
            "@category": "standard",
            "@height": "212",
            "@width": "565",
            "@_fa": "true",
            "$": "https://api.elsevier.com/content/object/eid/1-s2.0-S0926860X14003962-gr3.jpg?httpAccept=%2A%2F%2A",
            "@multimediatype": "JPEG image file",
            "@type": "IMAGE-DOWNSAMPLED",
            "@size": "41935",
            "@ref": "gr3",
            "@mimetype": "image/jpeg"
          },
          {
            "@category": "standard",
            "@height": "234",
            "@width": "657",
            "@_fa": "true",
            "$": "https://api.elsevier.com/content/object/eid/1-s2.0-S0926860X14003962-gr2.jpg?httpAccept=%2A%2F%2A",
            "@multimediatype": "JPEG image file",
            "@type": "IMAGE-DOWNSAMPLED",
            "@size": "33162",
            "@ref": "gr2",
            "@mimetype": "image/jpeg"
          },
          {
            "@category": "standard",
            "@height": "424",
            "@width": "563",
            "@_fa": "true",
            "$": "https://api.elsevier.com/content/object/eid/1-s2.0-S0926860X14003962-gr12.jpg?httpAccept=%2A%2F%2A",
            "@multimediatype": "JPEG image file",
            "@type": "IMAGE-DOWNSAMPLED",
            "@size": "63294",
            "@ref": "gr12",
            "@mimetype": "image/jpeg"
          },
          {
            "@category": "standard",
            "@height": "719",
            "@width": "447",
            "@_fa": "true",
            "$": "https://api.elsevier.com/content/object/eid/1-s2.0-S0926860X14003962-gr11.jpg?httpAccept=%2A%2F%2A",
            "@multimediatype": "JPEG image file",
            "@type": "IMAGE-DOWNSAMPLED",
            "@size": "48983",
            "@ref": "gr11",
            "@mimetype": "image/jpeg"
          },
          {
            "@category": "standard",
            "@height": "218",
            "@width": "280",
            "@_fa": "true",
            "$": "https://api.elsevier.com/content/object/eid/1-s2.0-S0926860X14003962-gr10.jpg?httpAccept=%2A%2F%2A",
            "@multimediatype": "JPEG image file",
            "@type": "IMAGE-DOWNSAMPLED",
            "@size": "13307",
            "@ref": "gr10",
            "@mimetype": "image/jpeg"
          },
          {
            "@category": "standard",
            "@height": "673",
            "@width": "602",
            "@_fa": "true",
            "$": "https://api.elsevier.com/content/object/eid/1-s2.0-S0926860X14003962-gr1.jpg?httpAccept=%2A%2F%2A",
            "@multimediatype": "JPEG image file",
            "@type": "IMAGE-DOWNSAMPLED",
            "@size": "90834",
            "@ref": "gr1",
            "@mimetype": "image/jpeg"
          },
          {
            "@category": "standard",
            "@height": "200",
            "@width": "492",
            "@_fa": "true",
            "$": "https://api.elsevier.com/content/object/eid/1-s2.0-S0926860X14003962-fx1.jpg?httpAccept=%2A%2F%2A",
            "@multimediatype": "JPEG image file",
            "@type": "IMAGE-DOWNSAMPLED",
            "@size": "25479",
            "@ref": "fx1",
            "@mimetype": "image/jpeg"
          },
          {
            "@category": "thumbnail",
            "@height": "163",
            "@width": "110",
            "@_fa": "true",
            "$": "https://api.elsevier.com/content/object/eid/1-s2.0-S0926860X14003962-gr9.sml?httpAccept=%2A%2F%2A",
            "@multimediatype": "GIF image file",
            "@type": "IMAGE-THUMBNAIL",
            "@size": "3456",
            "@ref": "gr9",
            "@mimetype": "image/gif"
          },
          {
            "@category": "thumbnail",
            "@height": "161",
            "@width": "219",
            "@_fa": "true",
            "$": "https://api.elsevier.com/content/object/eid/1-s2.0-S0926860X14003962-gr8.sml?httpAccept=%2A%2F%2A",
            "@multimediatype": "GIF image file",
            "@type": "IMAGE-THUMBNAIL",
            "@size": "5004",
            "@ref": "gr8",
            "@mimetype": "image/gif"
          },
          {
            "@category": "thumbnail",
            "@height": "163",
            "@width": "105",
            "@_fa": "true",
            "$": "https://api.elsevier.com/content/object/eid/1-s2.0-S0926860X14003962-gr7.sml?httpAccept=%2A%2F%2A",
            "@multimediatype": "GIF image file",
            "@type": "IMAGE-THUMBNAIL",
            "@size": "3816",
            "@ref": "gr7",
            "@mimetype": "image/gif"
          },
          {
            "@category": "thumbnail",
            "@height": "163",
            "@width": "101",
            "@_fa": "true",
            "$": "https://api.elsevier.com/content/object/eid/1-s2.0-S0926860X14003962-gr6.sml?httpAccept=%2A%2F%2A",
            "@multimediatype": "GIF image file",
            "@type": "IMAGE-THUMBNAIL",
            "@size": "5200",
            "@ref": "gr6",
            "@mimetype": "image/gif"
          },
          {
            "@category": "thumbnail",
            "@height": "88",
            "@width": "219",
            "@_fa": "true",
            "$": "https://api.elsevier.com/content/object/eid/1-s2.0-S0926860X14003962-gr5.sml?httpAccept=%2A%2F%2A",
            "@multimediatype": "GIF image file",
            "@type": "IMAGE-THUMBNAIL",
            "@size": "7091",
            "@ref": "gr5",
            "@mimetype": "image/gif"
          },
          {
            "@category": "thumbnail",
            "@height": "164",
            "@width": "213",
            "@_fa": "true",
            "$": "https://api.elsevier.com/content/object/eid/1-s2.0-S0926860X14003962-gr4.sml?httpAccept=%2A%2F%2A",
            "@multimediatype": "GIF image file",
            "@type": "IMAGE-THUMBNAIL",
            "@size": "17977",
            "@ref": "gr4",
            "@mimetype": "image/gif"
          },
          {
            "@category": "thumbnail",
            "@height": "82",
            "@width": "219",
            "@_fa": "true",
            "$": "https://api.elsevier.com/content/object/eid/1-s2.0-S0926860X14003962-gr3.sml?httpAccept=%2A%2F%2A",
            "@multimediatype": "GIF image file",
            "@type": "IMAGE-THUMBNAIL",
            "@size": "9848",
            "@ref": "gr3",
            "@mimetype": "image/gif"
          },
          {
            "@category": "thumbnail",
            "@height": "78",
            "@width": "219",
            "@_fa": "true",
            "$": "https://api.elsevier.com/content/object/eid/1-s2.0-S0926860X14003962-gr2.sml?httpAccept=%2A%2F%2A",
            "@multimediatype": "GIF image file",
            "@type": "IMAGE-THUMBNAIL",
            "@size": "4193",
            "@ref": "gr2",
            "@mimetype": "image/gif"
          },
          {
            "@category": "thumbnail",
            "@height": "164",
            "@width": "218",
            "@_fa": "true",
            "$": "https://api.elsevier.com/content/object/eid/1-s2.0-S0926860X14003962-gr12.sml?httpAccept=%2A%2F%2A",
            "@multimediatype": "GIF image file",
            "@type": "IMAGE-THUMBNAIL",
            "@size": "8000",
            "@ref": "gr12",
            "@mimetype": "image/gif"
          },
          {
            "@category": "thumbnail",
            "@height": "164",
            "@width": "102",
            "@_fa": "true",
            "$": "https://api.elsevier.com/content/object/eid/1-s2.0-S0926860X14003962-gr11.sml?httpAccept=%2A%2F%2A",
            "@multimediatype": "GIF image file",
            "@type": "IMAGE-THUMBNAIL",
            "@size": "3280",
            "@ref": "gr11",
            "@mimetype": "image/gif"
          },
          {
            "@category": "thumbnail",
            "@height": "164",
            "@width": "211",
            "@_fa": "true",
            "$": "https://api.elsevier.com/content/object/eid/1-s2.0-S0926860X14003962-gr10.sml?httpAccept=%2A%2F%2A",
            "@multimediatype": "GIF image file",
            "@type": "IMAGE-THUMBNAIL",
            "@size": "5184",
            "@ref": "gr10",
            "@mimetype": "image/gif"
          },
          {
            "@category": "thumbnail",
            "@height": "163",
            "@width": "146",
            "@_fa": "true",
            "$": "https://api.elsevier.com/content/object/eid/1-s2.0-S0926860X14003962-gr1.sml?httpAccept=%2A%2F%2A",
            "@multimediatype": "GIF image file",
            "@type": "IMAGE-THUMBNAIL",
            "@size": "6854",
            "@ref": "gr1",
            "@mimetype": "image/gif"
          },
          {
            "@category": "thumbnail",
            "@height": "89",
            "@width": "219",
            "@_fa": "true",
            "$": "https://api.elsevier.com/content/object/eid/1-s2.0-S0926860X14003962-fx1.sml?httpAccept=%2A%2F%2A",
            "@multimediatype": "GIF image file",
            "@type": "IMAGE-THUMBNAIL",
            "@size": "6051",
            "@ref": "fx1",
            "@mimetype": "image/gif"
          }
        ]
      },
      "link": {
        "@rel": "abstract",
        "@href": "https://api.elsevier.com/content/abstract/scopus_id/84904292368"
      }
    }
  }
}