{
  "metadata": {
    "title": "Designing an isoelectronic counterpart to group III-V semiconductors: A novel honeycomb BeCN<ce:inf loc=post>2</ce:inf> monolayer with ultra-high mobility toward solar driven overall water splitting and bifunctional oxygen evolution/reduction reaction",
    "authors": "; ; ",
    "journal": "Applied Catalysis A: General",
    "date": "2024-01-25",
    "doi": "10.1016/j.apcata.2023.119518",
    "abstract": "",
    "uri": "https://api.elsevier.com/content/article/pii/S0926860X23004982",
    "pii": "S0926860X23004982"
  },
  "fulltext": {
    "full-text-retrieval-response": {
      "scopus-eid": "2-s2.0-85178136284",
      "originalText": "serial JL 271346 291210 291744 291809 31 Applied Catalysis A: General APPLIEDCATALYSISAGENERAL 2023-11-24 2023-11-24 2023-12-03 2023-12-03 2024-01-19T20:53:16 1-s2.0-S0926860X23004982 S0926-860X(23)00498-2 S0926860X23004982 10.1016/j.apcata.2023.119518 S300 S300.1 FULL-TEXT 1-s2.0-S0926860X23X00210 2024-01-19T21:05:05.039111Z 0 0 20240125 2024 2023-11-24T09:42:24.400126Z absattachment articleinfo articlenumber articletitlenorm authfirstinitialnorm authfirstsurnamenorm cid cids contenttype copyright crossmark dateloaded dateloadedtxt datesearch datesort dateupdated dco docsubtype doctype doi eid ewtransactionid hubeid indexeddate issn issnnorm itemstage itemtransactionid itemweight openaccess openarchive pg pgfirst pii piinorm pubdatestart pubdatetxt pubyr sortorder srctitle srctitlenorm srctype ssids alllist content subj subheadings suppl tomb volfirst volissue volumelist webpdf webpdfpagecount yearnav figure table e-component body mmlmath acknowledge affil appendices articletitle auth authfirstini authfull authkeywords authlast grantnumber grantsponsor grantsponsorid highlightsabst orcid primabst ref specialabst 0926-860X 0926860X true 670 670 C Volume 670 8 119518 119518 119518 20240125 25 January 2024 2024-01-25 2024 article fla © 2023 Elsevier B.V. All rights reserved. DESIGNINGISOELECTRONICCOUNTERPARTGROUPIIIVSEMICONDUCTORSANOVELHONEYCOMBBECN2MONOLAYERULTRAHIGHMOBILITYTOWARDSOLARDRIVENOVERALLWATERSPLITTINGBIFUNCTIONALOXYGENEVOLUTIONREDUCTIONREACTION ZHANG X 1 Introduction 2 Computational method 3 Results and discussion 3.1 Structure and stability of BeCN2 3.2 Mechanical properties of BeCN2 3.3 Electronic properties of BeCN2 3.4 Small effective mass, ultrahigh carrier mobility, strong optical absorption 3.5 Strain modulated band edge position and HER/OER driving force of bare BeCN2 3.6 Structure and stability of TM@BeCN2 3.7 HER activity on TM@BeCN2 3.8 OER/ORR activity and activity trend of TM@BeCN2 3.9 Activity origin of TM@BeCN2 4 Conclusions CRediT authorship contribution statement Acknowledgements Appendix A Supplementary material References MUSHTAQ 2023 113197 M MUSHTAQ 2022 121711 M YE 2020 15946 15952 W SUN 2022 11981 11984 W DONG 2022 891 899 C GAO 2020 1900954 R FAN 2019 14836 14843 Y HAO 2023 41 52 M FAN 2022 9363 9371 Y YANG 2021 130139 X CHEN 2020 105270 Z GUO 2019 687 693 Z GUO 2023 5098 5101 M FUJISHIMA 1972 37 38 A SHI 2023 107027 C LIU 2023 12890 12909 D ZHANG 2021 31934 31946 Q GAO 2021 13593 13603 R KANG 2023 257 265 L XIE 2022 6360 6363 J HINNEMANN 2005 5308 5309 B GUAN 2014 046804 J WANG 2009 76 80 X NIU 2020 6555 6563 H DEAN 2010 722 726 C SOLOZHENKO 1999 2903 2905 V HAUBNER 2002 1 45 R HIGHPERFORMANCENONOXIDECERAMICSII BORONNITRIDESPROPERTIESSYNTHESISAPPLICATIONS WOODS 2021 347 C HE 2012 10967 10971 C LI 2013 1858 X SHARMA 2022 153239 S LUO 2022 5155 5162 D KRESSE 1996 11169 11186 G PERDEW 1996 3865 3868 J GRIMME 2006 1787 1799 S GIANNOZZI 1991 7231 7242 P BUSSI 2007 014101 G TANG 2009 084204 W SHOBEYRIAN 2023 157319 F ZHANG 2022 153191 Q LIN 2022 24761 24776 K SUN 2020 4795 4800 M ZHU 2019 11485 11496 Y MOUHAT 2014 224104 F ZHANG 2019 87 95 Q LEE 2008 385 388 C CASTELLANOSGOMEZ 2012 772 775 A MICHEL 2009 K QIAO 2014 4475 J SONG 2019 1131 1139 Y KILIC 2021 4971 4977 M BARDEEN 1950 72 80 J PONCE 2018 121201 S RADISAVLJEVIC 2011 147 150 B LUO 2021 4128 4134 Y YING 2023 1416 1423 Y FANG 2022 3900 3912 C NORSKOV 2004 17886 17892 J BHAGAT 2021 666 677 B ZHAO 2023 156475 X GREELEY 2006 909 913 J FAN 2023 13037 13047 Y LV 2020 118521 X GAO 2018 1883 1894 R GAO 2017 90 95 R LV 2017 275 284 X LI 2023 2186 2199 H GREELEY 2009 552 556 J ZHANGX2024X119518 ZHANGX2024X119518XX 2025-12-03T00:00:00.000Z 2025-12-03T00:00:00.000Z http://creativecommons.org/licenses/by-nc-nd/4.0/ © 2023 Elsevier B.V. All rights reserved. 2023-12-06T11:54:36.112Z http://vtw.elsevier.com/data/voc/AddOnTypes/50.7/aggregated-refined National Natural Science Foundation of China 21905175 NSFC National Natural Science Foundation of China http://data.elsevier.com/vocabulary/SciValFunders/501100001809 http://sws.geonames.org/1814991/ This research was supported by the National Natural Science Foundation of China ( 21905175 ). https://doi.org/10.15223/policy-017 https://doi.org/10.15223/policy-037 https://doi.org/10.15223/policy-012 https://doi.org/10.15223/policy-029 https://doi.org/10.15223/policy-004 item S0926-860X(23)00498-2 S0926860X23004982 1-s2.0-S0926860X23004982 10.1016/j.apcata.2023.119518 271346 2024-01-19T21:05:05.039111Z 2024-01-25 1-s2.0-S0926860X23004982-main.pdf https://s3-eu-west-1.amazonaws.com/prod-ucs-content-store-eu-west/content/pii:S0926860X23004982/MAIN/application/pdf/cebb315b27fa4a6c392741d5c152e35f/main.pdf main.pdf pdf true 18079297 MAIN 17 1-s2.0-S0926860X23004982-main_1.png https://s3-eu-west-1.amazonaws.com/prod-ucs-content-store-eu-west/content/pii:S0926860X23004982/PREVIEW/image/png/aabd370700b48be6897bab6b2cbac094/main_1.png main_1.png png 54655 849 656 IMAGE-WEB-PDF 1 1-s2.0-S0926860X23004982-ga1.jpg https://s3-eu-west-1.amazonaws.com/prod-ucs-content-store-eu-west/content/pii:S0926860X23004982/ga1/DOWNSAMPLED/image/jpeg/a3756bdadaea5de5454c641a773beb31/ga1.jpg ga1 true ga1.jpg jpg 32613 200 370 IMAGE-DOWNSAMPLED 1-s2.0-S0926860X23004982-gr11.jpg https://s3-eu-west-1.amazonaws.com/prod-ucs-content-store-eu-west/content/pii:S0926860X23004982/gr11/DOWNSAMPLED/image/jpeg/c22f24d502d97c19822adcee74523460/gr11.jpg gr11 gr11.jpg jpg 89326 510 602 IMAGE-DOWNSAMPLED 1-s2.0-S0926860X23004982-gr10.jpg https://s3-eu-west-1.amazonaws.com/prod-ucs-content-store-eu-west/content/pii:S0926860X23004982/gr10/DOWNSAMPLED/image/jpeg/7557c33ad66d70be27d2fb3fdb784dfe/gr10.jpg gr10 gr10.jpg jpg 82434 512 602 IMAGE-DOWNSAMPLED 1-s2.0-S0926860X23004982-gr5.jpg https://s3-eu-west-1.amazonaws.com/prod-ucs-content-store-eu-west/content/pii:S0926860X23004982/gr5/DOWNSAMPLED/image/jpeg/37a096b4b6422d44533135a6e7cce127/gr5.jpg gr5 gr5.jpg jpg 92330 446 678 IMAGE-DOWNSAMPLED 1-s2.0-S0926860X23004982-gr6.jpg https://s3-eu-west-1.amazonaws.com/prod-ucs-content-store-eu-west/content/pii:S0926860X23004982/gr6/DOWNSAMPLED/image/jpeg/beb1bcc1d0b3f612668b75b197c5f6d0/gr6.jpg gr6 gr6.jpg jpg 111339 553 602 IMAGE-DOWNSAMPLED 1-s2.0-S0926860X23004982-gr3.jpg https://s3-eu-west-1.amazonaws.com/prod-ucs-content-store-eu-west/content/pii:S0926860X23004982/gr3/DOWNSAMPLED/image/jpeg/2e2e04d5c896d0907feb21e8ac9f151a/gr3.jpg gr3 gr3.jpg jpg 131045 612 602 IMAGE-DOWNSAMPLED 1-s2.0-S0926860X23004982-gr4.jpg https://s3-eu-west-1.amazonaws.com/prod-ucs-content-store-eu-west/content/pii:S0926860X23004982/gr4/DOWNSAMPLED/image/jpeg/56079596a44ebe7e609f00aecd64727a/gr4.jpg gr4 gr4.jpg jpg 125327 774 602 IMAGE-DOWNSAMPLED 1-s2.0-S0926860X23004982-gr1.jpg https://s3-eu-west-1.amazonaws.com/prod-ucs-content-store-eu-west/content/pii:S0926860X23004982/gr1/DOWNSAMPLED/image/jpeg/8cedef3be2f4105cf98e02863a83dec5/gr1.jpg gr1 gr1.jpg jpg 156157 703 602 IMAGE-DOWNSAMPLED 1-s2.0-S0926860X23004982-gr2.jpg https://s3-eu-west-1.amazonaws.com/prod-ucs-content-store-eu-west/content/pii:S0926860X23004982/gr2/DOWNSAMPLED/image/jpeg/97335bbdbe6e99fe995a3f84f65bcf86/gr2.jpg gr2 gr2.jpg jpg 94471 503 602 IMAGE-DOWNSAMPLED 1-s2.0-S0926860X23004982-gr12.jpg https://s3-eu-west-1.amazonaws.com/prod-ucs-content-store-eu-west/content/pii:S0926860X23004982/gr12/DOWNSAMPLED/image/jpeg/b145e12fc79d886a81e5205c0cb37ce5/gr12.jpg gr12 gr12.jpg jpg 120988 804 602 IMAGE-DOWNSAMPLED 1-s2.0-S0926860X23004982-gr9.jpg https://s3-eu-west-1.amazonaws.com/prod-ucs-content-store-eu-west/content/pii:S0926860X23004982/gr9/DOWNSAMPLED/image/jpeg/b476bf88dd5cc2857a6c70ce283ff864/gr9.jpg gr9 gr9.jpg jpg 112215 704 602 IMAGE-DOWNSAMPLED 1-s2.0-S0926860X23004982-gr7.jpg https://s3-eu-west-1.amazonaws.com/prod-ucs-content-store-eu-west/content/pii:S0926860X23004982/gr7/DOWNSAMPLED/image/jpeg/4cf0213d4cf4ae1d6696272bda8992fc/gr7.jpg gr7 gr7.jpg jpg 75966 463 602 IMAGE-DOWNSAMPLED 1-s2.0-S0926860X23004982-gr8.jpg https://s3-eu-west-1.amazonaws.com/prod-ucs-content-store-eu-west/content/pii:S0926860X23004982/gr8/DOWNSAMPLED/image/jpeg/db2043ea2ed4243d2d6c1def91f1d140/gr8.jpg gr8 gr8.jpg jpg 76442 501 602 IMAGE-DOWNSAMPLED 1-s2.0-S0926860X23004982-ga1.sml https://s3-eu-west-1.amazonaws.com/prod-ucs-content-store-eu-west/content/pii:S0926860X23004982/ga1/THUMBNAIL/image/gif/20f8887107c08247aa59419103ce587d/ga1.sml ga1 true ga1.sml sml 21607 118 219 IMAGE-THUMBNAIL 1-s2.0-S0926860X23004982-gr11.sml https://s3-eu-west-1.amazonaws.com/prod-ucs-content-store-eu-west/content/pii:S0926860X23004982/gr11/THUMBNAIL/image/gif/968fa332b5d6614ca7e1ca47203f0a97/gr11.sml gr11 gr11.sml sml 17501 164 193 IMAGE-THUMBNAIL 1-s2.0-S0926860X23004982-gr10.sml https://s3-eu-west-1.amazonaws.com/prod-ucs-content-store-eu-west/content/pii:S0926860X23004982/gr10/THUMBNAIL/image/gif/7a78f5bcb72850478d7490782eadbf00/gr10.sml gr10 gr10.sml sml 15968 163 192 IMAGE-THUMBNAIL 1-s2.0-S0926860X23004982-gr5.sml https://s3-eu-west-1.amazonaws.com/prod-ucs-content-store-eu-west/content/pii:S0926860X23004982/gr5/THUMBNAIL/image/gif/fae658ad6929d80c429610ff6943dd0f/gr5.sml gr5 gr5.sml sml 18914 144 219 IMAGE-THUMBNAIL 1-s2.0-S0926860X23004982-gr6.sml https://s3-eu-west-1.amazonaws.com/prod-ucs-content-store-eu-west/content/pii:S0926860X23004982/gr6/THUMBNAIL/image/gif/612593be64d5a23b00dffbfcd62ad317/gr6.sml gr6 gr6.sml sml 19491 163 178 IMAGE-THUMBNAIL 1-s2.0-S0926860X23004982-gr3.sml https://s3-eu-west-1.amazonaws.com/prod-ucs-content-store-eu-west/content/pii:S0926860X23004982/gr3/THUMBNAIL/image/gif/d0235428a98744f42219ea1d79d78b94/gr3.sml gr3 gr3.sml sml 14897 164 161 IMAGE-THUMBNAIL 1-s2.0-S0926860X23004982-gr4.sml https://s3-eu-west-1.amazonaws.com/prod-ucs-content-store-eu-west/content/pii:S0926860X23004982/gr4/THUMBNAIL/image/gif/035902a07534367a2312701ab7b9443d/gr4.sml gr4 gr4.sml sml 12224 163 127 IMAGE-THUMBNAIL 1-s2.0-S0926860X23004982-gr1.sml https://s3-eu-west-1.amazonaws.com/prod-ucs-content-store-eu-west/content/pii:S0926860X23004982/gr1/THUMBNAIL/image/gif/5ec4939c888668d53ae44d4a6b4905e2/gr1.sml gr1 gr1.sml sml 14781 164 140 IMAGE-THUMBNAIL 1-s2.0-S0926860X23004982-gr2.sml https://s3-eu-west-1.amazonaws.com/prod-ucs-content-store-eu-west/content/pii:S0926860X23004982/gr2/THUMBNAIL/image/gif/774add7a93ed635233906f4672bf1b2f/gr2.sml gr2 gr2.sml sml 17583 164 196 IMAGE-THUMBNAIL 1-s2.0-S0926860X23004982-gr12.sml https://s3-eu-west-1.amazonaws.com/prod-ucs-content-store-eu-west/content/pii:S0926860X23004982/gr12/THUMBNAIL/image/gif/cdd9a0987e3d2fee59a6554953a949a8/gr12.sml gr12 gr12.sml sml 12668 163 122 IMAGE-THUMBNAIL 1-s2.0-S0926860X23004982-gr9.sml https://s3-eu-west-1.amazonaws.com/prod-ucs-content-store-eu-west/content/pii:S0926860X23004982/gr9/THUMBNAIL/image/gif/024daf4824fb8d1c854f4ad3cbcc5624/gr9.sml gr9 gr9.sml sml 13910 164 140 IMAGE-THUMBNAIL 1-s2.0-S0926860X23004982-gr7.sml https://s3-eu-west-1.amazonaws.com/prod-ucs-content-store-eu-west/content/pii:S0926860X23004982/gr7/THUMBNAIL/image/gif/72b493dedf5b59052058d0b13b492acb/gr7.sml gr7 gr7.sml sml 16402 164 213 IMAGE-THUMBNAIL 1-s2.0-S0926860X23004982-gr8.sml https://s3-eu-west-1.amazonaws.com/prod-ucs-content-store-eu-west/content/pii:S0926860X23004982/gr8/THUMBNAIL/image/gif/f3ed7409cfb67544d23e77e7a1a23e79/gr8.sml gr8 gr8.sml sml 15848 164 197 IMAGE-THUMBNAIL 1-s2.0-S0926860X23004982-ga1_lrg.jpg https://s3-eu-west-1.amazonaws.com/prod-ucs-content-store-eu-west/content/pii:S0926860X23004982/HIGHRES/image/jpeg/dd7f1c4a0c2427976ef22a5726005fde/ga1_lrg.jpg ga1 true ga1_lrg.jpg jpg 277095 886 1638 IMAGE-HIGH-RES 1-s2.0-S0926860X23004982-gr11_lrg.jpg https://s3-eu-west-1.amazonaws.com/prod-ucs-content-store-eu-west/content/pii:S0926860X23004982/HIGHRES/image/jpeg/972106e0aa5aa9580af650af323abd54/gr11_lrg.jpg gr11 gr11_lrg.jpg jpg 459154 2255 2661 IMAGE-HIGH-RES 1-s2.0-S0926860X23004982-gr10_lrg.jpg https://s3-eu-west-1.amazonaws.com/prod-ucs-content-store-eu-west/content/pii:S0926860X23004982/HIGHRES/image/jpeg/ede26f31d3a4aabb8855762ef6aab241/gr10_lrg.jpg gr10 gr10_lrg.jpg jpg 474202 2265 2661 IMAGE-HIGH-RES 1-s2.0-S0926860X23004982-gr5_lrg.jpg https://s3-eu-west-1.amazonaws.com/prod-ucs-content-store-eu-west/content/pii:S0926860X23004982/HIGHRES/image/jpeg/56281dc3dd12a3307508efb640fad049/gr5_lrg.jpg gr5 gr5_lrg.jpg jpg 474235 1970 2994 IMAGE-HIGH-RES 1-s2.0-S0926860X23004982-gr6_lrg.jpg https://s3-eu-west-1.amazonaws.com/prod-ucs-content-store-eu-west/content/pii:S0926860X23004982/HIGHRES/image/jpeg/ed29d5827bc002d52b0c30c464bdac2d/gr6_lrg.jpg gr6 gr6_lrg.jpg jpg 553653 2443 2661 IMAGE-HIGH-RES 1-s2.0-S0926860X23004982-gr3_lrg.jpg https://s3-eu-west-1.amazonaws.com/prod-ucs-content-store-eu-west/content/pii:S0926860X23004982/HIGHRES/image/jpeg/df32446aff227e4824d0bc2f7786c789/gr3_lrg.jpg gr3 gr3_lrg.jpg jpg 690854 2706 2661 IMAGE-HIGH-RES 1-s2.0-S0926860X23004982-gr4_lrg.jpg https://s3-eu-west-1.amazonaws.com/prod-ucs-content-store-eu-west/content/pii:S0926860X23004982/HIGHRES/image/jpeg/c9c8f82c6295da2fdd136a45b26cf8c0/gr4_lrg.jpg gr4 gr4_lrg.jpg jpg 636588 3420 2661 IMAGE-HIGH-RES 1-s2.0-S0926860X23004982-gr1_lrg.jpg https://s3-eu-west-1.amazonaws.com/prod-ucs-content-store-eu-west/content/pii:S0926860X23004982/HIGHRES/image/jpeg/640fb0d95d5f3ccfdff95caa237adeae/gr1_lrg.jpg gr1 gr1_lrg.jpg jpg 855677 3109 2661 IMAGE-HIGH-RES 1-s2.0-S0926860X23004982-gr2_lrg.jpg https://s3-eu-west-1.amazonaws.com/prod-ucs-content-store-eu-west/content/pii:S0926860X23004982/HIGHRES/image/jpeg/a7b8980eb46394a43ea82f75985f0e06/gr2_lrg.jpg gr2 gr2_lrg.jpg jpg 482265 2223 2661 IMAGE-HIGH-RES 1-s2.0-S0926860X23004982-gr12_lrg.jpg https://s3-eu-west-1.amazonaws.com/prod-ucs-content-store-eu-west/content/pii:S0926860X23004982/HIGHRES/image/jpeg/77eba6c86569a37dc6ecd45652807109/gr12_lrg.jpg gr12 gr12_lrg.jpg jpg 599559 3554 2661 IMAGE-HIGH-RES 1-s2.0-S0926860X23004982-gr9_lrg.jpg https://s3-eu-west-1.amazonaws.com/prod-ucs-content-store-eu-west/content/pii:S0926860X23004982/HIGHRES/image/jpeg/3f8fb99132a59c3f6b0fde8b8e39b3fb/gr9_lrg.jpg gr9 gr9_lrg.jpg jpg 603398 3110 2661 IMAGE-HIGH-RES 1-s2.0-S0926860X23004982-gr7_lrg.jpg https://s3-eu-west-1.amazonaws.com/prod-ucs-content-store-eu-west/content/pii:S0926860X23004982/HIGHRES/image/jpeg/5e7b6c9c122d7818b07882e8d63e5a36/gr7_lrg.jpg gr7 gr7_lrg.jpg jpg 411478 2047 2661 IMAGE-HIGH-RES 1-s2.0-S0926860X23004982-gr8_lrg.jpg https://s3-eu-west-1.amazonaws.com/prod-ucs-content-store-eu-west/content/pii:S0926860X23004982/HIGHRES/image/jpeg/7a229b71eed5c8075ca8c02a1654874e/gr8_lrg.jpg gr8 gr8_lrg.jpg jpg 446017 2216 2661 IMAGE-HIGH-RES 1-s2.0-S0926860X23004982-mmc1.pdf https://s3-eu-west-1.amazonaws.com/prod-ucs-content-store-eu-west/content/pii:S0926860X23004982/mmc1/MAIN/application/pdf/1f41b67f739ba693e9c1c048046caac7/mmc1.pdf mmc1 mmc1.pdf pdf false 6499126 APPLICATION 1-s2.0-S0926860X23004982-si0001.svg https://s3-eu-west-1.amazonaws.com/prod-ucs-content-store-eu-west/content/pii:S0926860X23004982/image/svg+xml/1d48a69d45848b8b3d3c57940dc484fa/si0001.svg si0001 si0001.svg svg 1053 ALTIMG 1-s2.0-S0926860X23004982-si0002.svg https://s3-eu-west-1.amazonaws.com/prod-ucs-content-store-eu-west/content/pii:S0926860X23004982/image/svg+xml/204da848e8f386f73e4b0f3be370ce34/si0002.svg si0002 si0002.svg svg 1361 ALTIMG 1-s2.0-S0926860X23004982-si0003.svg https://s3-eu-west-1.amazonaws.com/prod-ucs-content-store-eu-west/content/pii:S0926860X23004982/image/svg+xml/204da848e8f386f73e4b0f3be370ce34/si0003.svg si0003 si0003.svg svg 1361 ALTIMG 1-s2.0-S0926860X23004982-si0004.svg https://s3-eu-west-1.amazonaws.com/prod-ucs-content-store-eu-west/content/pii:S0926860X23004982/image/svg+xml/d4bc5485b0a40fdaf9d7610c950c8afc/si0004.svg si0004 si0004.svg svg 1337 ALTIMG 1-s2.0-S0926860X23004982-si0005.svg https://s3-eu-west-1.amazonaws.com/prod-ucs-content-store-eu-west/content/pii:S0926860X23004982/image/svg+xml/84bad3e40746c378c91cace54fd616e1/si0005.svg si0005 si0005.svg svg 1491 ALTIMG 1-s2.0-S0926860X23004982-si0006.svg https://s3-eu-west-1.amazonaws.com/prod-ucs-content-store-eu-west/content/pii:S0926860X23004982/image/svg+xml/dd58402bea968aed0af42590bd07067b/si0006.svg si0006 si0006.svg svg 1953 ALTIMG 1-s2.0-S0926860X23004982-si0007.svg https://s3-eu-west-1.amazonaws.com/prod-ucs-content-store-eu-west/content/pii:S0926860X23004982/image/svg+xml/bd840a0e50076aae3a59bfe781d60ded/si0007.svg si0007 si0007.svg svg 1300 ALTIMG 1-s2.0-S0926860X23004982-si0008.svg https://s3-eu-west-1.amazonaws.com/prod-ucs-content-store-eu-west/content/pii:S0926860X23004982/image/svg+xml/89fbcab197b7c512f366804cfd1120da/si0008.svg si0008 si0008.svg svg 1361 ALTIMG 1-s2.0-S0926860X23004982-si0009.svg https://s3-eu-west-1.amazonaws.com/prod-ucs-content-store-eu-west/content/pii:S0926860X23004982/image/svg+xml/5bb1295727f908f99d9294f047022100/si0009.svg si0009 si0009.svg svg 1397 ALTIMG 1-s2.0-S0926860X23004982-si0010.svg https://s3-eu-west-1.amazonaws.com/prod-ucs-content-store-eu-west/content/pii:S0926860X23004982/image/svg+xml/cd73bef5d01252ac00f098bd57eea57e/si0010.svg si0010 si0010.svg svg 1085 ALTIMG 1-s2.0-S0926860X23004982-si0011.svg https://s3-eu-west-1.amazonaws.com/prod-ucs-content-store-eu-west/content/pii:S0926860X23004982/image/svg+xml/b81af38cf76af120c9f5f83a5c07ade2/si0011.svg si0011 si0011.svg svg 1174 ALTIMG 1-s2.0-S0926860X23004982-si0012.svg https://s3-eu-west-1.amazonaws.com/prod-ucs-content-store-eu-west/content/pii:S0926860X23004982/image/svg+xml/5168b45f04efd3c89e4eceb46754aa26/si0012.svg si0012 si0012.svg svg 1126 ALTIMG 1-s2.0-S0926860X23004982-si0013.svg https://s3-eu-west-1.amazonaws.com/prod-ucs-content-store-eu-west/content/pii:S0926860X23004982/image/svg+xml/e77adbee8bd2bcfe4aaa2eccf59d3b85/si0013.svg si0013 si0013.svg svg 1316 ALTIMG 1-s2.0-S0926860X23004982-si0014.svg https://s3-eu-west-1.amazonaws.com/prod-ucs-content-store-eu-west/content/pii:S0926860X23004982/image/svg+xml/1780b3ac516df7434bd7accd31535e4b/si0014.svg si0014 si0014.svg svg 1077 ALTIMG 1-s2.0-S0926860X23004982-si0015.svg https://s3-eu-west-1.amazonaws.com/prod-ucs-content-store-eu-west/content/pii:S0926860X23004982/image/svg+xml/0c8a9376c209a7c062b1dce5ff4261e6/si0015.svg si0015 si0015.svg svg 1174 ALTIMG 1-s2.0-S0926860X23004982-si0016.svg https://s3-eu-west-1.amazonaws.com/prod-ucs-content-store-eu-west/content/pii:S0926860X23004982/image/svg+xml/705641acaae14223c778953d04ed0bc9/si0016.svg si0016 si0016.svg svg 1114 ALTIMG 1-s2.0-S0926860X23004982-si0017.svg https://s3-eu-west-1.amazonaws.com/prod-ucs-content-store-eu-west/content/pii:S0926860X23004982/image/svg+xml/f5eed20ca9ca6c6bb4f9047bcdabfa5c/si0017.svg si0017 si0017.svg svg 1316 ALTIMG 1-s2.0-S0926860X23004982-si0018.svg https://s3-eu-west-1.amazonaws.com/prod-ucs-content-store-eu-west/content/pii:S0926860X23004982/image/svg+xml/5d2e6d30041b5496e2489ae80795f77f/si0018.svg si0018 si0018.svg svg 1142 ALTIMG 1-s2.0-S0926860X23004982-si0019.svg https://s3-eu-west-1.amazonaws.com/prod-ucs-content-store-eu-west/content/pii:S0926860X23004982/image/svg+xml/7f0ccaa948b98fe18cb783400c0f3fce/si0019.svg si0019 si0019.svg svg 1174 ALTIMG 1-s2.0-S0926860X23004982-si0020.svg https://s3-eu-west-1.amazonaws.com/prod-ucs-content-store-eu-west/content/pii:S0926860X23004982/image/svg+xml/7ba840a7865b642c94fb55079347eca6/si0020.svg si0020 si0020.svg svg 1114 ALTIMG 1-s2.0-S0926860X23004982-si0021.svg https://s3-eu-west-1.amazonaws.com/prod-ucs-content-store-eu-west/content/pii:S0926860X23004982/image/svg+xml/2ca35f4e1bb3a442b203cf8011f0ee29/si0021.svg si0021 si0021.svg svg 1316 ALTIMG 1-s2.0-S0926860X23004982-si0022.svg https://s3-eu-west-1.amazonaws.com/prod-ucs-content-store-eu-west/content/pii:S0926860X23004982/image/svg+xml/6d68d95e8dffccc9f624fa34764b59e9/si0022.svg si0022 si0022.svg svg 1174 ALTIMG 1-s2.0-S0926860X23004982-si0023.svg https://s3-eu-west-1.amazonaws.com/prod-ucs-content-store-eu-west/content/pii:S0926860X23004982/image/svg+xml/71cd5bc937e5481eb6a4625d489c83f3/si0023.svg si0023 si0023.svg svg 1491 ALTIMG 1-s2.0-S0926860X23004982-si0024.svg https://s3-eu-west-1.amazonaws.com/prod-ucs-content-store-eu-west/content/pii:S0926860X23004982/image/svg+xml/7543fc554f420ab0f2e75a18c07320ae/si0024.svg si0024 si0024.svg svg 1077 ALTIMG 1-s2.0-S0926860X23004982-si0025.svg https://s3-eu-west-1.amazonaws.com/prod-ucs-content-store-eu-west/content/pii:S0926860X23004982/image/svg+xml/af69455a9994f681a62d2a787e225486/si0025.svg si0025 si0025.svg svg 1110 ALTIMG 1-s2.0-S0926860X23004982-si0026.svg https://s3-eu-west-1.amazonaws.com/prod-ucs-content-store-eu-west/content/pii:S0926860X23004982/image/svg+xml/892406ba0d384e18bed5cea71d58d673/si0026.svg si0026 si0026.svg svg 1511 ALTIMG 1-s2.0-S0926860X23004982-si0027.svg https://s3-eu-west-1.amazonaws.com/prod-ucs-content-store-eu-west/content/pii:S0926860X23004982/image/svg+xml/675837e20ace3684224e4bd33868d190/si0027.svg si0027 si0027.svg svg 1507 ALTIMG 1-s2.0-S0926860X23004982-si0028.svg https://s3-eu-west-1.amazonaws.com/prod-ucs-content-store-eu-west/content/pii:S0926860X23004982/image/svg+xml/49a95c82cdcc871cd52d6c9787146b6f/si0028.svg si0028 si0028.svg svg 1661 ALTIMG 1-s2.0-S0926860X23004982-si0029.svg https://s3-eu-west-1.amazonaws.com/prod-ucs-content-store-eu-west/content/pii:S0926860X23004982/image/svg+xml/caf5dbac629b4d173c57d5a80b5fe65c/si0029.svg si0029 si0029.svg svg 976 ALTIMG 1-s2.0-S0926860X23004982-si0030.svg https://s3-eu-west-1.amazonaws.com/prod-ucs-content-store-eu-west/content/pii:S0926860X23004982/image/svg+xml/436df840549d3ca9bf7ff1536721a1e6/si0030.svg si0030 si0030.svg svg 1118 ALTIMG 1-s2.0-S0926860X23004982-si0031.svg https://s3-eu-west-1.amazonaws.com/prod-ucs-content-store-eu-west/content/pii:S0926860X23004982/image/svg+xml/49c6ea6ffdab0ec6fafb8991b6728874/si0031.svg si0031 si0031.svg svg 1179 ALTIMG 1-s2.0-S0926860X23004982-si0032.svg https://s3-eu-west-1.amazonaws.com/prod-ucs-content-store-eu-west/content/pii:S0926860X23004982/image/svg+xml/336845b33773bdb7c8a730f22183f144/si0032.svg si0032 si0032.svg svg 1215 ALTIMG 1-s2.0-S0926860X23004982-si0033.svg https://s3-eu-west-1.amazonaws.com/prod-ucs-content-store-eu-west/content/pii:S0926860X23004982/image/svg+xml/9a361e3789a4d374a1e7cc4cecde470e/si0033.svg si0033 si0033.svg svg 1243 ALTIMG 1-s2.0-S0926860X23004982-si0034.svg https://s3-eu-west-1.amazonaws.com/prod-ucs-content-store-eu-west/content/pii:S0926860X23004982/image/svg+xml/aa2f3a1d3fee261f4dec2338f1749656/si0034.svg si0034 si0034.svg svg 1320 ALTIMG 1-s2.0-S0926860X23004982-si0035.svg https://s3-eu-west-1.amazonaws.com/prod-ucs-content-store-eu-west/content/pii:S0926860X23004982/image/svg+xml/59f0d46de7da427a94f9d78e66e56772/si0035.svg si0035 si0035.svg svg 1847 ALTIMG 1-s2.0-S0926860X23004982-si0036.svg https://s3-eu-west-1.amazonaws.com/prod-ucs-content-store-eu-west/content/pii:S0926860X23004982/image/svg+xml/99d4def1b17d574db33e86ced0c7f575/si0036.svg si0036 si0036.svg svg 1458 ALTIMG 1-s2.0-S0926860X23004982-si0037.svg https://s3-eu-west-1.amazonaws.com/prod-ucs-content-store-eu-west/content/pii:S0926860X23004982/image/svg+xml/6fee3d8f690c08077b9ae1ef1173ad1e/si0037.svg si0037 si0037.svg svg 2192 ALTIMG 1-s2.0-S0926860X23004982-si0038.svg https://s3-eu-west-1.amazonaws.com/prod-ucs-content-store-eu-west/content/pii:S0926860X23004982/image/svg+xml/4abdc8c1fba0ee19346fe7923bae140a/si0038.svg si0038 si0038.svg svg 1636 ALTIMG 1-s2.0-S0926860X23004982-si0039.svg https://s3-eu-west-1.amazonaws.com/prod-ucs-content-store-eu-west/content/pii:S0926860X23004982/image/svg+xml/62d15e2ea688f832ee5656620fc2b349/si0039.svg si0039 si0039.svg svg 1636 ALTIMG 1-s2.0-S0926860X23004982-si0040.svg https://s3-eu-west-1.amazonaws.com/prod-ucs-content-store-eu-west/content/pii:S0926860X23004982/image/svg+xml/b4607bde42f96f41d5c80cb7d417cd8e/si0040.svg si0040 si0040.svg svg 1324 ALTIMG 1-s2.0-S0926860X23004982-si0041.svg https://s3-eu-west-1.amazonaws.com/prod-ucs-content-store-eu-west/content/pii:S0926860X23004982/image/svg+xml/ca09f1f72a84bdf7e069eb6d877f2fbb/si0041.svg si0041 si0041.svg svg 1268 ALTIMG 1-s2.0-S0926860X23004982-si0042.svg https://s3-eu-west-1.amazonaws.com/prod-ucs-content-store-eu-west/content/pii:S0926860X23004982/image/svg+xml/be0b92f1066f6603fb242c42c7b0b342/si0042.svg si0042 si0042.svg svg 1324 ALTIMG 1-s2.0-S0926860X23004982-si0043.svg https://s3-eu-west-1.amazonaws.com/prod-ucs-content-store-eu-west/content/pii:S0926860X23004982/image/svg+xml/0b23dc154bcbfc86b02942b920732565/si0043.svg si0043 si0043.svg svg 1353 ALTIMG 1-s2.0-S0926860X23004982-si0044.svg https://s3-eu-west-1.amazonaws.com/prod-ucs-content-store-eu-west/content/pii:S0926860X23004982/image/svg+xml/c87bc2dfa3f3bacb89ba1ececd8a0dc6/si0044.svg si0044 si0044.svg svg 1268 ALTIMG 1-s2.0-S0926860X23004982-si0045.svg https://s3-eu-west-1.amazonaws.com/prod-ucs-content-store-eu-west/content/pii:S0926860X23004982/image/svg+xml/7e2e415ff8188860bb2cc6a22f6869a8/si0045.svg si0045 si0045.svg svg 1170 ALTIMG 1-s2.0-S0926860X23004982-si0046.svg https://s3-eu-west-1.amazonaws.com/prod-ucs-content-store-eu-west/content/pii:S0926860X23004982/image/svg+xml/7e2e415ff8188860bb2cc6a22f6869a8/si0046.svg si0046 si0046.svg svg 1170 ALTIMG 1-s2.0-S0926860X23004982-si0047.svg https://s3-eu-west-1.amazonaws.com/prod-ucs-content-store-eu-west/content/pii:S0926860X23004982/image/svg+xml/54457b179fa76cbbb7eb82f460dea27b/si0047.svg si0047 si0047.svg svg 1203 ALTIMG 1-s2.0-S0926860X23004982-si0048.svg https://s3-eu-west-1.amazonaws.com/prod-ucs-content-store-eu-west/content/pii:S0926860X23004982/image/svg+xml/1d56f0dd40f2e66ce601a249e18d1761/si0048.svg si0048 si0048.svg svg 1170 ALTIMG 1-s2.0-S0926860X23004982-si0049.svg https://s3-eu-west-1.amazonaws.com/prod-ucs-content-store-eu-west/content/pii:S0926860X23004982/image/svg+xml/af55bcfbedb7a30539891020a34b70eb/si0049.svg si0049 si0049.svg svg 1150 ALTIMG 1-s2.0-S0926860X23004982-si0050.svg https://s3-eu-west-1.amazonaws.com/prod-ucs-content-store-eu-west/content/pii:S0926860X23004982/image/svg+xml/af55bcfbedb7a30539891020a34b70eb/si0050.svg si0050 si0050.svg svg 1150 ALTIMG 1-s2.0-S0926860X23004982-si0051.svg https://s3-eu-west-1.amazonaws.com/prod-ucs-content-store-eu-west/content/pii:S0926860X23004982/image/svg+xml/af2b3f5c5f41a1f980f76e6437895c27/si0051.svg si0051 si0051.svg svg 1203 ALTIMG 1-s2.0-S0926860X23004982-si0052.svg https://s3-eu-west-1.amazonaws.com/prod-ucs-content-store-eu-west/content/pii:S0926860X23004982/image/svg+xml/545941de094b0c33ec9b668ba8245bac/si0052.svg si0052 si0052.svg svg 1170 ALTIMG 1-s2.0-S0926860X23004982-si0053.svg https://s3-eu-west-1.amazonaws.com/prod-ucs-content-store-eu-west/content/pii:S0926860X23004982/image/svg+xml/026aebe5abd277cddafd2a776bec28c8/si0053.svg si0053 si0053.svg svg 1150 ALTIMG 1-s2.0-S0926860X23004982-si0054.svg https://s3-eu-west-1.amazonaws.com/prod-ucs-content-store-eu-west/content/pii:S0926860X23004982/image/svg+xml/90511b98031a9ec405a05876953dd6fc/si0054.svg si0054 si0054.svg svg 1150 ALTIMG 1-s2.0-S0926860X23004982-si0055.svg https://s3-eu-west-1.amazonaws.com/prod-ucs-content-store-eu-west/content/pii:S0926860X23004982/image/svg+xml/b719fd0c0bf07f43251fa82af91cecc2/si0055.svg si0055 si0055.svg svg 1203 ALTIMG 1-s2.0-S0926860X23004982-si0056.svg https://s3-eu-west-1.amazonaws.com/prod-ucs-content-store-eu-west/content/pii:S0926860X23004982/image/svg+xml/608bf24357aa6b8a1f6b0888d9dd1c40/si0056.svg si0056 si0056.svg svg 1170 ALTIMG 1-s2.0-S0926860X23004982-si0057.svg https://s3-eu-west-1.amazonaws.com/prod-ucs-content-store-eu-west/content/pii:S0926860X23004982/image/svg+xml/610508b36b0b4a1e1599bd8287497ea0/si0057.svg si0057 si0057.svg svg 1203 ALTIMG 1-s2.0-S0926860X23004982-si0058.svg https://s3-eu-west-1.amazonaws.com/prod-ucs-content-store-eu-west/content/pii:S0926860X23004982/image/svg+xml/d2acd0f92831c507c444ca4970d68c15/si0058.svg si0058 si0058.svg svg 1170 ALTIMG 1-s2.0-S0926860X23004982-si0059.svg https://s3-eu-west-1.amazonaws.com/prod-ucs-content-store-eu-west/content/pii:S0926860X23004982/image/svg+xml/d2acd0f92831c507c444ca4970d68c15/si0059.svg si0059 si0059.svg svg 1170 ALTIMG 1-s2.0-S0926860X23004982-si0060.svg https://s3-eu-west-1.amazonaws.com/prod-ucs-content-store-eu-west/content/pii:S0926860X23004982/image/svg+xml/d486b0bab13eb49b69f15af56472f55b/si0060.svg si0060 si0060.svg svg 1203 ALTIMG 1-s2.0-S0926860X23004982-si0061.svg https://s3-eu-west-1.amazonaws.com/prod-ucs-content-store-eu-west/content/pii:S0926860X23004982/image/svg+xml/d486b0bab13eb49b69f15af56472f55b/si0061.svg si0061 si0061.svg svg 1203 ALTIMG 1-s2.0-S0926860X23004982-si0062.svg https://s3-eu-west-1.amazonaws.com/prod-ucs-content-store-eu-west/content/pii:S0926860X23004982/image/svg+xml/6ec635471ecf1c05b7f0af87e539d38e/si0062.svg si0062 si0062.svg svg 1170 ALTIMG 1-s2.0-S0926860X23004982-si0063.svg https://s3-eu-west-1.amazonaws.com/prod-ucs-content-store-eu-west/content/pii:S0926860X23004982/image/svg+xml/35a4a7212bebb7815d9225fd12df6e8c/si0063.svg si0063 si0063.svg svg 1203 ALTIMG 1-s2.0-S0926860X23004982-si0064.svg https://s3-eu-west-1.amazonaws.com/prod-ucs-content-store-eu-west/content/pii:S0926860X23004982/image/svg+xml/5165cfa686a3329b0c3c4c0fd790b750/si0064.svg si0064 si0064.svg svg 1170 ALTIMG 1-s2.0-S0926860X23004982-si0065.svg https://s3-eu-west-1.amazonaws.com/prod-ucs-content-store-eu-west/content/pii:S0926860X23004982/image/svg+xml/22b9eb17f4320f02629634aabe6dfc25/si0065.svg si0065 si0065.svg svg 1203 ALTIMG 1-s2.0-S0926860X23004982-si0066.svg https://s3-eu-west-1.amazonaws.com/prod-ucs-content-store-eu-west/content/pii:S0926860X23004982/image/svg+xml/8201384baf99e890e7a409e6be46ed0d/si0066.svg si0066 si0066.svg svg 1170 ALTIMG 1-s2.0-S0926860X23004982-si0067.svg https://s3-eu-west-1.amazonaws.com/prod-ucs-content-store-eu-west/content/pii:S0926860X23004982/image/svg+xml/dc1b06852f81d835f8d47310b6f87e9c/si0067.svg si0067 si0067.svg svg 2427 ALTIMG 1-s2.0-S0926860X23004982-si0068.svg https://s3-eu-west-1.amazonaws.com/prod-ucs-content-store-eu-west/content/pii:S0926860X23004982/image/svg+xml/f25e8a4af72662678720bbaf97f43a04/si0068.svg si0068 si0068.svg svg 2629 ALTIMG 1-s2.0-S0926860X23004982-si0069.svg https://s3-eu-west-1.amazonaws.com/prod-ucs-content-store-eu-west/content/pii:S0926860X23004982/image/svg+xml/0875fcf52cc0e936431cb09ae210b8eb/si0069.svg si0069 si0069.svg svg 2658 ALTIMG 1-s2.0-S0926860X23004982-si0070.svg https://s3-eu-west-1.amazonaws.com/prod-ucs-content-store-eu-west/content/pii:S0926860X23004982/image/svg+xml/df0816dbb2d00f5b28628e0db30163c0/si0070.svg si0070 si0070.svg svg 2613 ALTIMG 1-s2.0-S0926860X23004982-si0071.svg https://s3-eu-west-1.amazonaws.com/prod-ucs-content-store-eu-west/content/pii:S0926860X23004982/image/svg+xml/d0bb794447cf8f25eb4f400811d776cd/si0071.svg si0071 si0071.svg svg 2808 ALTIMG 1-s2.0-S0926860X23004982-si0072.svg https://s3-eu-west-1.amazonaws.com/prod-ucs-content-store-eu-west/content/pii:S0926860X23004982/image/svg+xml/23e971ed94a1fc8436bac3a72c358538/si0072.svg si0072 si0072.svg svg 1381 ALTIMG 1-s2.0-S0926860X23004982-si0073.svg https://s3-eu-west-1.amazonaws.com/prod-ucs-content-store-eu-west/content/pii:S0926860X23004982/image/svg+xml/e649621f6b88269a12337ff380d2d1d1/si0073.svg si0073 si0073.svg svg 2723 ALTIMG 1-s2.0-S0926860X23004982-si0074.svg https://s3-eu-west-1.amazonaws.com/prod-ucs-content-store-eu-west/content/pii:S0926860X23004982/image/svg+xml/2352eb2d60f0d541c7e8b99beda2fd4b/si0074.svg si0074 si0074.svg svg 2743 ALTIMG 1-s2.0-S0926860X23004982-si0075.svg https://s3-eu-west-1.amazonaws.com/prod-ucs-content-store-eu-west/content/pii:S0926860X23004982/image/svg+xml/2abbb76646fa460bbdb30b764f87204e/si0075.svg si0075 si0075.svg svg 1110 ALTIMG 1-s2.0-S0926860X23004982-si0076.svg https://s3-eu-west-1.amazonaws.com/prod-ucs-content-store-eu-west/content/pii:S0926860X23004982/image/svg+xml/5d3c785d5740e83875bcae6b77ea2cdb/si0076.svg si0076 si0076.svg svg 1134 ALTIMG 1-s2.0-S0926860X23004982-si0077.svg https://s3-eu-west-1.amazonaws.com/prod-ucs-content-store-eu-west/content/pii:S0926860X23004982/image/svg+xml/2a24247058cd83c90229f60a509bba04/si0077.svg si0077 si0077.svg svg 1361 ALTIMG 1-s2.0-S0926860X23004982-si0078.svg https://s3-eu-west-1.amazonaws.com/prod-ucs-content-store-eu-west/content/pii:S0926860X23004982/image/svg+xml/3ebd8346dbc0329d74f29df8e3395dfa/si0078.svg si0078 si0078.svg svg 1130 ALTIMG 1-s2.0-S0926860X23004982-si0079.svg https://s3-eu-west-1.amazonaws.com/prod-ucs-content-store-eu-west/content/pii:S0926860X23004982/image/svg+xml/076b15a13a263acbc96b4363d07ab353/si0079.svg si0079 si0079.svg svg 1361 ALTIMG 1-s2.0-S0926860X23004982-si0080.svg https://s3-eu-west-1.amazonaws.com/prod-ucs-content-store-eu-west/content/pii:S0926860X23004982/image/svg+xml/52783c870877e10a28f7b638c57392c8/si0080.svg si0080 si0080.svg svg 1624 ALTIMG 1-s2.0-S0926860X23004982-si0081.svg https://s3-eu-west-1.amazonaws.com/prod-ucs-content-store-eu-west/content/pii:S0926860X23004982/image/svg+xml/b9846545dd39115df9d213a1c1714c1c/si0081.svg si0081 si0081.svg svg 1401 ALTIMG 1-s2.0-S0926860X23004982-si0082.svg https://s3-eu-west-1.amazonaws.com/prod-ucs-content-store-eu-west/content/pii:S0926860X23004982/image/svg+xml/80595196db49618c2355d566256e174a/si0082.svg si0082 si0082.svg svg 1134 ALTIMG 1-s2.0-S0926860X23004982-si0083.svg https://s3-eu-west-1.amazonaws.com/prod-ucs-content-store-eu-west/content/pii:S0926860X23004982/image/svg+xml/8d3f40507c77825cef42f06edd1d98cd/si0083.svg si0083 si0083.svg svg 1146 ALTIMG 1-s2.0-S0926860X23004982-si0084.svg https://s3-eu-west-1.amazonaws.com/prod-ucs-content-store-eu-west/content/pii:S0926860X23004982/image/svg+xml/606b93afd26fdeda8f515082827e990d/si0084.svg si0084 si0084.svg svg 1636 ALTIMG 1-s2.0-S0926860X23004982-si0085.svg https://s3-eu-west-1.amazonaws.com/prod-ucs-content-store-eu-west/content/pii:S0926860X23004982/image/svg+xml/6509a1407b9a8ded222c6f439815fba3/si0085.svg si0085 si0085.svg svg 1519 ALTIMG 1-s2.0-S0926860X23004982-si0086.svg https://s3-eu-west-1.amazonaws.com/prod-ucs-content-store-eu-west/content/pii:S0926860X23004982/image/svg+xml/ca04c2b4f1e5e5a90aafc813f7996fc5/si0086.svg si0086 si0086.svg svg 1669 ALTIMG 1-s2.0-S0926860X23004982-si0087.svg https://s3-eu-west-1.amazonaws.com/prod-ucs-content-store-eu-west/content/pii:S0926860X23004982/image/svg+xml/902a02e97b27a889ef495d62b5083690/si0087.svg si0087 si0087.svg svg 2646 ALTIMG 1-s2.0-S0926860X23004982-si0088.svg https://s3-eu-west-1.amazonaws.com/prod-ucs-content-store-eu-west/content/pii:S0926860X23004982/image/svg+xml/641ecc847ab055489276739cd6c46351/si0088.svg si0088 si0088.svg svg 1961 ALTIMG 1-s2.0-S0926860X23004982-si0089.svg https://s3-eu-west-1.amazonaws.com/prod-ucs-content-store-eu-west/content/pii:S0926860X23004982/image/svg+xml/d132ba322ced2a2cbe6518805df24e38/si0089.svg si0089 si0089.svg svg 1288 ALTIMG 1-s2.0-S0926860X23004982-si0090.svg https://s3-eu-west-1.amazonaws.com/prod-ucs-content-store-eu-west/content/pii:S0926860X23004982/image/svg+xml/3bcbc94c9bf7c249a4424696aa60a7da/si0090.svg si0090 si0090.svg svg 1470 ALTIMG 1-s2.0-S0926860X23004982-si0091.svg https://s3-eu-west-1.amazonaws.com/prod-ucs-content-store-eu-west/content/pii:S0926860X23004982/image/svg+xml/349f1319063c23387d812a8127aeb27f/si0091.svg si0091 si0091.svg svg 1142 ALTIMG 1-s2.0-S0926860X23004982-si0092.svg https://s3-eu-west-1.amazonaws.com/prod-ucs-content-store-eu-west/content/pii:S0926860X23004982/image/svg+xml/d9df2f76f5bf607b7d34b793ea4322a1/si0092.svg si0092 si0092.svg svg 1361 ALTIMG 1-s2.0-S0926860X23004982-si0093.svg https://s3-eu-west-1.amazonaws.com/prod-ucs-content-store-eu-west/content/pii:S0926860X23004982/image/svg+xml/0b34ae284f0e90dadb5c2d6c7def45e6/si0093.svg si0093 si0093.svg svg 1312 ALTIMG 1-s2.0-S0926860X23004982-si0094.svg https://s3-eu-west-1.amazonaws.com/prod-ucs-content-store-eu-west/content/pii:S0926860X23004982/image/svg+xml/0b34ae284f0e90dadb5c2d6c7def45e6/si0094.svg si0094 si0094.svg svg 1312 ALTIMG 1-s2.0-S0926860X23004982-si0095.svg https://s3-eu-west-1.amazonaws.com/prod-ucs-content-store-eu-west/content/pii:S0926860X23004982/image/svg+xml/460b96cdd761aba63574eac87ee988b8/si0095.svg si0095 si0095.svg svg 1312 ALTIMG 1-s2.0-S0926860X23004982-si0096.svg https://s3-eu-west-1.amazonaws.com/prod-ucs-content-store-eu-west/content/pii:S0926860X23004982/image/svg+xml/93d422c5debf93307a9d00c257fb179d/si0096.svg si0096 si0096.svg svg 1965 ALTIMG 1-s2.0-S0926860X23004982-si0097.svg https://s3-eu-west-1.amazonaws.com/prod-ucs-content-store-eu-west/content/pii:S0926860X23004982/image/svg+xml/460b96cdd761aba63574eac87ee988b8/si0097.svg si0097 si0097.svg svg 1312 ALTIMG 1-s2.0-S0926860X23004982-si0098.svg https://s3-eu-west-1.amazonaws.com/prod-ucs-content-store-eu-west/content/pii:S0926860X23004982/image/svg+xml/d29fba3de4e6ad76c08e64e0751522b2/si0098.svg si0098 si0098.svg svg 1361 ALTIMG 1-s2.0-S0926860X23004982-si0099.svg https://s3-eu-west-1.amazonaws.com/prod-ucs-content-store-eu-west/content/pii:S0926860X23004982/image/svg+xml/4330cb932c893e0d0779b5bbf696cf10/si0099.svg si0099 si0099.svg svg 1053 ALTIMG 1-s2.0-S0926860X23004982-si0100.svg https://s3-eu-west-1.amazonaws.com/prod-ucs-content-store-eu-west/content/pii:S0926860X23004982/image/svg+xml/4330cb932c893e0d0779b5bbf696cf10/si0100.svg si0100 si0100.svg svg 1053 ALTIMG 1-s2.0-S0926860X23004982-si0101.svg https://s3-eu-west-1.amazonaws.com/prod-ucs-content-store-eu-west/content/pii:S0926860X23004982/image/svg+xml/350df26fe309078b303ec093b1840169/si0101.svg si0101 si0101.svg svg 1361 ALTIMG 1-s2.0-S0926860X23004982-si0102.svg https://s3-eu-west-1.amazonaws.com/prod-ucs-content-store-eu-west/content/pii:S0926860X23004982/image/svg+xml/a229768a2605d3ff3dd418a15f61f9a2/si0102.svg si0102 si0102.svg svg 1369 ALTIMG 1-s2.0-S0926860X23004982-si0103.svg https://s3-eu-west-1.amazonaws.com/prod-ucs-content-store-eu-west/content/pii:S0926860X23004982/image/svg+xml/4b688adcdfb63e067b6720ef59942632/si0103.svg si0103 si0103.svg svg 1369 ALTIMG 1-s2.0-S0926860X23004982-si0104.svg https://s3-eu-west-1.amazonaws.com/prod-ucs-content-store-eu-west/content/pii:S0926860X23004982/image/svg+xml/132c565d44ebe72b70a76ea260fc9d15/si0104.svg si0104 si0104.svg svg 1361 ALTIMG 1-s2.0-S0926860X23004982-si0105.svg https://s3-eu-west-1.amazonaws.com/prod-ucs-content-store-eu-west/content/pii:S0926860X23004982/image/svg+xml/db437d497f13652e3d1192499adc49a8/si0105.svg si0105 si0105.svg svg 1337 ALTIMG 1-s2.0-S0926860X23004982-si0106.svg https://s3-eu-west-1.amazonaws.com/prod-ucs-content-store-eu-west/content/pii:S0926860X23004982/image/svg+xml/baac8041f0edf12fb984eff78a44dbd6/si0106.svg si0106 si0106.svg svg 2285 ALTIMG 1-s2.0-S0926860X23004982-si0107.svg https://s3-eu-west-1.amazonaws.com/prod-ucs-content-store-eu-west/content/pii:S0926860X23004982/image/svg+xml/1ca34a1e542135068e7dfb10a1888b79/si0107.svg si0107 si0107.svg svg 1316 ALTIMG 1-s2.0-S0926860X23004982-si0108.svg https://s3-eu-west-1.amazonaws.com/prod-ucs-content-store-eu-west/content/pii:S0926860X23004982/image/svg+xml/72b0601d468854ac515f88f7c2173945/si0108.svg si0108 si0108.svg svg 2273 ALTIMG 1-s2.0-S0926860X23004982-si0109.svg https://s3-eu-west-1.amazonaws.com/prod-ucs-content-store-eu-west/content/pii:S0926860X23004982/image/svg+xml/c3d9dbd30a6566d7db723b74f7979faa/si0109.svg si0109 si0109.svg svg 1377 ALTIMG 1-s2.0-S0926860X23004982-si0110.svg https://s3-eu-west-1.amazonaws.com/prod-ucs-content-store-eu-west/content/pii:S0926860X23004982/image/svg+xml/a288bbfff3252f4c590f2be941f998e0/si0110.svg si0110 si0110.svg svg 1957 ALTIMG 1-s2.0-S0926860X23004982-si0111.svg https://s3-eu-west-1.amazonaws.com/prod-ucs-content-store-eu-west/content/pii:S0926860X23004982/image/svg+xml/d2a0a1e6dc4b93e6ffa2ed1d332148ae/si0111.svg si0111 si0111.svg svg 1174 ALTIMG 1-s2.0-S0926860X23004982-si0112.svg https://s3-eu-west-1.amazonaws.com/prod-ucs-content-store-eu-west/content/pii:S0926860X23004982/image/svg+xml/f70633a317133f91090b7db662e343af/si0112.svg si0112 si0112.svg svg 2058 ALTIMG 1-s2.0-S0926860X23004982-si0113.svg https://s3-eu-west-1.amazonaws.com/prod-ucs-content-store-eu-west/content/pii:S0926860X23004982/image/svg+xml/85c6d89476419a7825196f8ae4a9e7a7/si0113.svg si0113 si0113.svg svg 1661 ALTIMG 1-s2.0-S0926860X23004982-si0114.svg https://s3-eu-west-1.amazonaws.com/prod-ucs-content-store-eu-west/content/pii:S0926860X23004982/image/svg+xml/104b1444e33dd2172ef6de5be1ccd3c5/si0114.svg si0114 si0114.svg svg 2743 ALTIMG 1-s2.0-S0926860X23004982-si0115.svg https://s3-eu-west-1.amazonaws.com/prod-ucs-content-store-eu-west/content/pii:S0926860X23004982/image/svg+xml/d2c3951caa94924528ff352d2b5865cd/si0115.svg si0115 si0115.svg svg 1361 ALTIMG 1-s2.0-S0926860X23004982-si0116.svg https://s3-eu-west-1.amazonaws.com/prod-ucs-content-store-eu-west/content/pii:S0926860X23004982/image/svg+xml/7cae6dc2f4def3f43d09aa3b4d811f47/si0116.svg si0116 si0116.svg svg 1491 ALTIMG 1-s2.0-S0926860X23004982-si0117.svg https://s3-eu-west-1.amazonaws.com/prod-ucs-content-store-eu-west/content/pii:S0926860X23004982/image/svg+xml/9c690b3fe6c042203594abf8dd6fc5a0/si0117.svg si0117 si0117.svg svg 2540 ALTIMG 1-s2.0-S0926860X23004982-si0118.svg https://s3-eu-west-1.amazonaws.com/prod-ucs-content-store-eu-west/content/pii:S0926860X23004982/image/svg+xml/bf6d5abaa50bd746d3b2523a4a0b4fa3/si0118.svg si0118 si0118.svg svg 1523 ALTIMG 1-s2.0-S0926860X23004982-si0119.svg https://s3-eu-west-1.amazonaws.com/prod-ucs-content-store-eu-west/content/pii:S0926860X23004982/image/svg+xml/aa75d365240ff592c9fdf36866c34b58/si0119.svg si0119 si0119.svg svg 1588 ALTIMG 1-s2.0-S0926860X23004982-si0120.svg https://s3-eu-west-1.amazonaws.com/prod-ucs-content-store-eu-west/content/pii:S0926860X23004982/image/svg+xml/31102b3fac3a032ebc03176f452f2a65/si0120.svg si0120 si0120.svg svg 2747 ALTIMG 1-s2.0-S0926860X23004982-si0121.svg https://s3-eu-west-1.amazonaws.com/prod-ucs-content-store-eu-west/content/pii:S0926860X23004982/image/svg+xml/daf52dcab2d17986d49ac6fe3d703a4e/si0121.svg si0121 si0121.svg svg 1588 ALTIMG 1-s2.0-S0926860X23004982-si0122.svg https://s3-eu-west-1.amazonaws.com/prod-ucs-content-store-eu-west/content/pii:S0926860X23004982/image/svg+xml/42cca807f8c0dfa4864b9e28cd99968d/si0122.svg si0122 si0122.svg svg 1491 ALTIMG 1-s2.0-S0926860X23004982-si0123.svg https://s3-eu-west-1.amazonaws.com/prod-ucs-content-store-eu-west/content/pii:S0926860X23004982/image/svg+xml/828d3d277a1b1a960df798db4b66d9ec/si0123.svg si0123 si0123.svg svg 1361 ALTIMG 1-s2.0-S0926860X23004982-si0124.svg https://s3-eu-west-1.amazonaws.com/prod-ucs-content-store-eu-west/content/pii:S0926860X23004982/image/svg+xml/02f2d94ecce34e38a241e7817fa43bcd/si0124.svg si0124 si0124.svg svg 1491 ALTIMG 1-s2.0-S0926860X23004982-si0125.svg https://s3-eu-west-1.amazonaws.com/prod-ucs-content-store-eu-west/content/pii:S0926860X23004982/image/svg+xml/d7b2d75707967af036864859c3592773/si0125.svg si0125 si0125.svg svg 1312 ALTIMG 1-s2.0-S0926860X23004982-si0126.svg https://s3-eu-west-1.amazonaws.com/prod-ucs-content-store-eu-west/content/pii:S0926860X23004982/image/svg+xml/38a02da8b682bb0d2464f8a9eb9ed7d8/si0126.svg si0126 si0126.svg svg 1491 ALTIMG 1-s2.0-S0926860X23004982-si0127.svg https://s3-eu-west-1.amazonaws.com/prod-ucs-content-store-eu-west/content/pii:S0926860X23004982/image/svg+xml/0da3c25dbaf51caec5165c662025865a/si0127.svg si0127 si0127.svg svg 1953 ALTIMG 1-s2.0-S0926860X23004982-si0128.svg https://s3-eu-west-1.amazonaws.com/prod-ucs-content-store-eu-west/content/pii:S0926860X23004982/image/svg+xml/38a02da8b682bb0d2464f8a9eb9ed7d8/si0128.svg si0128 si0128.svg svg 1491 ALTIMG 1-s2.0-S0926860X23004982-si0129.svg https://s3-eu-west-1.amazonaws.com/prod-ucs-content-store-eu-west/content/pii:S0926860X23004982/image/svg+xml/713fb7759d5f3994fa99b63ed3d7a970/si0129.svg si0129 si0129.svg svg 1953 ALTIMG 1-s2.0-S0926860X23004982-si0130.svg https://s3-eu-west-1.amazonaws.com/prod-ucs-content-store-eu-west/content/pii:S0926860X23004982/image/svg+xml/5113ca70995bfbc74a61bc41fccdb1d5/si0130.svg si0130 si0130.svg svg 1446 ALTIMG 1-s2.0-S0926860X23004982-si0131.svg https://s3-eu-west-1.amazonaws.com/prod-ucs-content-store-eu-west/content/pii:S0926860X23004982/image/svg+xml/97dc65041d19195dfe75786cd637c488/si0131.svg si0131 si0131.svg svg 1385 ALTIMG 1-s2.0-S0926860X23004982-si0132.svg https://s3-eu-west-1.amazonaws.com/prod-ucs-content-store-eu-west/content/pii:S0926860X23004982/image/svg+xml/05d215e923ed0e587652b4007e820a7e/si0132.svg si0132 si0132.svg svg 1369 ALTIMG 1-s2.0-S0926860X23004982-si0133.svg https://s3-eu-west-1.amazonaws.com/prod-ucs-content-store-eu-west/content/pii:S0926860X23004982/image/svg+xml/16a99cceb5faaf3aba929680c4a6679f/si0133.svg si0133 si0133.svg svg 1369 ALTIMG 1-s2.0-S0926860X23004982-si0134.svg https://s3-eu-west-1.amazonaws.com/prod-ucs-content-store-eu-west/content/pii:S0926860X23004982/image/svg+xml/7d94d9bdca66eefb4f96646a9cf5d911/si0134.svg si0134 si0134.svg svg 1697 ALTIMG 1-s2.0-S0926860X23004982-si0135.svg https://s3-eu-west-1.amazonaws.com/prod-ucs-content-store-eu-west/content/pii:S0926860X23004982/image/svg+xml/bc175188d027838e63367ba0bb890ef2/si0135.svg si0135 si0135.svg svg 1405 ALTIMG 1-s2.0-S0926860X23004982-si0136.svg https://s3-eu-west-1.amazonaws.com/prod-ucs-content-store-eu-west/content/pii:S0926860X23004982/image/svg+xml/1bbf697d5c8e23f019885845e966e6a0/si0136.svg si0136 si0136.svg svg 1077 ALTIMG 1-s2.0-S0926860X23004982-si0137.svg https://s3-eu-west-1.amazonaws.com/prod-ucs-content-store-eu-west/content/pii:S0926860X23004982/image/svg+xml/1bbf697d5c8e23f019885845e966e6a0/si0137.svg si0137 si0137.svg svg 1077 ALTIMG 1-s2.0-S0926860X23004982-si0138.svg https://s3-eu-west-1.amazonaws.com/prod-ucs-content-store-eu-west/content/pii:S0926860X23004982/image/svg+xml/d5c8ce93a9adc37c3e063341f453ec3b/si0138.svg si0138 si0138.svg svg 1085 ALTIMG 1-s2.0-S0926860X23004982-si0139.svg https://s3-eu-west-1.amazonaws.com/prod-ucs-content-store-eu-west/content/pii:S0926860X23004982/image/svg+xml/81b1ada734ebd64b4928a1ec158dac01/si0139.svg si0139 si0139.svg svg 3343 ALTIMG 1-s2.0-S0926860X23004982-si0140.svg https://s3-eu-west-1.amazonaws.com/prod-ucs-content-store-eu-west/content/pii:S0926860X23004982/image/svg+xml/c0cca94ad96d2f5e4251819c49d6ed5c/si0140.svg si0140 si0140.svg svg 1033 ALTIMG 1-s2.0-S0926860X23004982-si0141.svg https://s3-eu-west-1.amazonaws.com/prod-ucs-content-store-eu-west/content/pii:S0926860X23004982/image/svg+xml/71824851b8b88f599cd0a4177b1dc9cb/si0141.svg si0141 si0141.svg svg 1130 ALTIMG 1-s2.0-S0926860X23004982-si0142.svg https://s3-eu-west-1.amazonaws.com/prod-ucs-content-store-eu-west/content/pii:S0926860X23004982/image/svg+xml/19c417f45791ba4f48fae54cac47992d/si0142.svg si0142 si0142.svg svg 1077 ALTIMG 1-s2.0-S0926860X23004982-si0143.svg https://s3-eu-west-1.amazonaws.com/prod-ucs-content-store-eu-west/content/pii:S0926860X23004982/image/svg+xml/533fbf23aa3cd18833278efa38b79704/si0143.svg si0143 si0143.svg svg 1085 ALTIMG 1-s2.0-S0926860X23004982-si0144.svg https://s3-eu-west-1.amazonaws.com/prod-ucs-content-store-eu-west/content/pii:S0926860X23004982/image/svg+xml/5dc9285c7ec19cb2dfb6aaf047f76e31/si0144.svg si0144 si0144.svg svg 1491 ALTIMG 1-s2.0-S0926860X23004982-si0145.svg https://s3-eu-west-1.amazonaws.com/prod-ucs-content-store-eu-west/content/pii:S0926860X23004982/image/svg+xml/ccaff6e1fd70b362bb6dd2c127c4e9c2/si0145.svg si0145 si0145.svg svg 1361 ALTIMG 1-s2.0-S0926860X23004982-si0146.svg https://s3-eu-west-1.amazonaws.com/prod-ucs-content-store-eu-west/content/pii:S0926860X23004982/image/svg+xml/87833cbcf0b06c4c978d67f45dbcf93d/si0146.svg si0146 si0146.svg svg 1588 ALTIMG 1-s2.0-S0926860X23004982-si0147.svg https://s3-eu-west-1.amazonaws.com/prod-ucs-content-store-eu-west/content/pii:S0926860X23004982/image/svg+xml/c5ce67b070fd8ae6e447bd2ff4e12ff7/si0147.svg si0147 si0147.svg svg 1361 ALTIMG 1-s2.0-S0926860X23004982-si0148.svg https://s3-eu-west-1.amazonaws.com/prod-ucs-content-store-eu-west/content/pii:S0926860X23004982/image/svg+xml/72ae9589877efa3aa1d1c4ac697bbbc7/si0148.svg si0148 si0148.svg svg 1085 ALTIMG 1-s2.0-S0926860X23004982-si0149.svg https://s3-eu-west-1.amazonaws.com/prod-ucs-content-store-eu-west/content/pii:S0926860X23004982/image/svg+xml/06a5782555bab2675a797f2976b9fedd/si0149.svg si0149 si0149.svg svg 1588 ALTIMG 1-s2.0-S0926860X23004982-si0150.svg https://s3-eu-west-1.amazonaws.com/prod-ucs-content-store-eu-west/content/pii:S0926860X23004982/image/svg+xml/023fecd8f89cd5999154e362489d2d8d/si0150.svg si0150 si0150.svg svg 1491 ALTIMG 1-s2.0-S0926860X23004982-si0151.svg https://s3-eu-west-1.amazonaws.com/prod-ucs-content-store-eu-west/content/pii:S0926860X23004982/image/svg+xml/a53cb000ea4ba5787fb388fb16e3c5e0/si0151.svg si0151 si0151.svg svg 1260 ALTIMG 1-s2.0-S0926860X23004982-si0152.svg https://s3-eu-west-1.amazonaws.com/prod-ucs-content-store-eu-west/content/pii:S0926860X23004982/image/svg+xml/0f452c37878d0841d2f041e3dc6c0aa1/si0152.svg si0152 si0152.svg svg 1272 ALTIMG 1-s2.0-S0926860X23004982-si0153.svg https://s3-eu-west-1.amazonaws.com/prod-ucs-content-store-eu-west/content/pii:S0926860X23004982/image/svg+xml/f657b841c328b97bd88be4bc6e64c967/si0153.svg si0153 si0153.svg svg 1251 ALTIMG 1-s2.0-S0926860X23004982-si0154.svg https://s3-eu-west-1.amazonaws.com/prod-ucs-content-store-eu-west/content/pii:S0926860X23004982/image/svg+xml/b15e5eaeaee76cc47bc70d94b455bdd3/si0154.svg si0154 si0154.svg svg 1243 ALTIMG 1-s2.0-S0926860X23004982-si0155.svg https://s3-eu-west-1.amazonaws.com/prod-ucs-content-store-eu-west/content/pii:S0926860X23004982/image/svg+xml/682e9c2866cb87360261330efb9261a1/si0155.svg si0155 si0155.svg svg 1361 ALTIMG 1-s2.0-S0926860X23004982-si0156.svg https://s3-eu-west-1.amazonaws.com/prod-ucs-content-store-eu-west/content/pii:S0926860X23004982/image/svg+xml/9ce6f30ccd6755bd56ad437cd2041b4c/si0156.svg si0156 si0156.svg svg 1085 ALTIMG 1-s2.0-S0926860X23004982-si0157.svg https://s3-eu-west-1.amazonaws.com/prod-ucs-content-store-eu-west/content/pii:S0926860X23004982/image/svg+xml/1e73dd223fccad5e20e791d145afd7b7/si0157.svg si0157 si0157.svg svg 1142 ALTIMG 1-s2.0-S0926860X23004982-si0158.svg https://s3-eu-west-1.amazonaws.com/prod-ucs-content-store-eu-west/content/pii:S0926860X23004982/image/svg+xml/ceb5ede44de1e1ee160a5888c5634f01/si0158.svg si0158 si0158.svg svg 1085 ALTIMG 1-s2.0-S0926860X23004982-si0159.svg https://s3-eu-west-1.amazonaws.com/prod-ucs-content-store-eu-west/content/pii:S0926860X23004982/image/svg+xml/861199a09c2a31dadbad2653bb81ca66/si0159.svg si0159 si0159.svg svg 1085 ALTIMG 1-s2.0-S0926860X23004982-si0160.svg https://s3-eu-west-1.amazonaws.com/prod-ucs-content-store-eu-west/content/pii:S0926860X23004982/image/svg+xml/424f2d96ccf20383f337def833136cc8/si0160.svg si0160 si0160.svg svg 1531 ALTIMG 1-s2.0-S0926860X23004982-si0161.svg https://s3-eu-west-1.amazonaws.com/prod-ucs-content-store-eu-west/content/pii:S0926860X23004982/image/svg+xml/c10b0924fe9a2c30bcf52cdb2b596c7d/si0161.svg si0161 si0161.svg svg 1085 ALTIMG 1-s2.0-S0926860X23004982-si0162.svg https://s3-eu-west-1.amazonaws.com/prod-ucs-content-store-eu-west/content/pii:S0926860X23004982/image/svg+xml/7d417b4c3bbada83ec06f58f3ff25f53/si0162.svg si0162 si0162.svg svg 1543 ALTIMG 1-s2.0-S0926860X23004982-si0163.svg https://s3-eu-west-1.amazonaws.com/prod-ucs-content-store-eu-west/content/pii:S0926860X23004982/image/svg+xml/c10b0924fe9a2c30bcf52cdb2b596c7d/si0163.svg si0163 si0163.svg svg 1085 ALTIMG 1-s2.0-S0926860X23004982-si0164.svg https://s3-eu-west-1.amazonaws.com/prod-ucs-content-store-eu-west/content/pii:S0926860X23004982/image/svg+xml/75e67a7124f8651ac24c9be5a5972bff/si0164.svg si0164 si0164.svg svg 1085 ALTIMG 1-s2.0-S0926860X23004982-si0165.svg https://s3-eu-west-1.amazonaws.com/prod-ucs-content-store-eu-west/content/pii:S0926860X23004982/image/svg+xml/521e09f132ac16471d8f88b7dd59ef68/si0165.svg si0165 si0165.svg svg 1405 ALTIMG 1-s2.0-S0926860X23004982-si0166.svg https://s3-eu-west-1.amazonaws.com/prod-ucs-content-store-eu-west/content/pii:S0926860X23004982/image/svg+xml/eacd4a79d4b3f3c059eff083d92afb58/si0166.svg si0166 si0166.svg svg 1085 ALTIMG 1-s2.0-S0926860X23004982-si0167.svg https://s3-eu-west-1.amazonaws.com/prod-ucs-content-store-eu-west/content/pii:S0926860X23004982/image/svg+xml/d31f83887e8ccc70d689e568f7406dc3/si0167.svg si0167 si0167.svg svg 1085 ALTIMG 1-s2.0-S0926860X23004982-si0168.svg https://s3-eu-west-1.amazonaws.com/prod-ucs-content-store-eu-west/content/pii:S0926860X23004982/image/svg+xml/af43af5ebc40291221fd4b1324770224/si0168.svg si0168 si0168.svg svg 1491 ALTIMG 1-s2.0-S0926860X23004982-si0169.svg https://s3-eu-west-1.amazonaws.com/prod-ucs-content-store-eu-west/content/pii:S0926860X23004982/image/svg+xml/7aaa9fdc60725e251527666b724aa7cb/si0169.svg si0169 si0169.svg svg 1588 ALTIMG 1-s2.0-S0926860X23004982-si0170.svg https://s3-eu-west-1.amazonaws.com/prod-ucs-content-store-eu-west/content/pii:S0926860X23004982/image/svg+xml/f69bcc2c60048d6b59673aad75605876/si0170.svg si0170 si0170.svg svg 1260 ALTIMG 1-s2.0-S0926860X23004982-si0171.svg https://s3-eu-west-1.amazonaws.com/prod-ucs-content-store-eu-west/content/pii:S0926860X23004982/image/svg+xml/b43056fe06f2620c860e6740550890f2/si0171.svg si0171 si0171.svg svg 1466 ALTIMG 1-s2.0-S0926860X23004982-si0172.svg https://s3-eu-west-1.amazonaws.com/prod-ucs-content-store-eu-west/content/pii:S0926860X23004982/image/svg+xml/ccefc8c4a099ae672f90850929047581/si0172.svg si0172 si0172.svg svg 1142 ALTIMG 1-s2.0-S0926860X23004982-si0173.svg https://s3-eu-west-1.amazonaws.com/prod-ucs-content-store-eu-west/content/pii:S0926860X23004982/image/svg+xml/efa3588b0f99cd9fb24ad5e40dc5e5ed/si0173.svg si0173 si0173.svg svg 1491 ALTIMG 1-s2.0-S0926860X23004982-si0174.svg https://s3-eu-west-1.amazonaws.com/prod-ucs-content-store-eu-west/content/pii:S0926860X23004982/image/svg+xml/d9daa0fd6d31981dd82c91d8e2fa76dd/si0174.svg si0174 si0174.svg svg 1491 ALTIMG 1-s2.0-S0926860X23004982-si0175.svg https://s3-eu-west-1.amazonaws.com/prod-ucs-content-store-eu-west/content/pii:S0926860X23004982/image/svg+xml/376fc4e53f81045fe65531fb6c10b3d9/si0175.svg si0175 si0175.svg svg 1085 ALTIMG 1-s2.0-S0926860X23004982-am.pdf https://s3-eu-west-1.amazonaws.com/prod-ucs-content-store-eu-west/content/egi:10F3CDKHWXT/MAIN/application/pdf/5b8cb4214a786343a076e4ba747e9a48/am.pdf am am.pdf pdf false 26473532 AAM-PDF APCATA 119518 119518 S0926-860X(23)00498-2 10.1016/j.apcata.2023.119518 Elsevier B.V. Fig. 1 (a) Top (left) and side (right) views of geometric configuration of the BeCN2 monolayer, where the shaded area of a rectangle represents the primitive cell and a and b refer to the lattice vectors. Herein, light yellow, blue, and cyan balls represent Be, C, and N atoms, respectively. (b) Electron localization functions and (c) differential charge density of the BeCN2 monolayer. For differential charge density, the yellow represents the accumulation of electrons, and the cyan denotes the depletion of electrons. (d) pCOHP of all C-N and Be-N bonds in BeCN2. (e) Fluctuations of total energy (blue) and temperature (red) within 6 ps AIMD simulation at 400 K, where the inset denotes the final structure after reaching 6 ps. (f) Phonon dispersion curves and (g) phonon densities of states of the BeCN2 monolayer. Fig. 1 Fig. 2 (a) Stress-strain relationship with strain applied in the x (orange)/y (purple) direction. (b) Strain-strain relationship for strain conditions in the x (orange)/y (green) direction. variation of Young's modulus (c) and Poisson's ratio (d) of BeCN2 with angle. Fig. 2 Fig. 3 (a) Electronic structure (left) and density f states (right) and (b) 3D band structure of BeCN2 monolayer calculated based on the HSE06 method. The partial charge densities of the conduction (c) and valence (d) bands of BeCN2 at the point located at Y under the criterion of an isosurface of 0.0082 e/Å3. Fig. 3 Fig. 4 Angle-dependent electron (a) and hole (b) effective masses of BeCN2 monolayers. (c) Schematic of strain with the x-direction and y-direction defined for BeCN2 monolayer. (d) Shift of the CBM and VBM energy positions for BeCN2 monolayer as a function of the uniaxial strain and the vacuum level is set to zero for reference. (e) Twice the total energy shift 2(E − E0) per unit area of BeCN2 monolayer versus the x-direction and y-direction uniaxial strains. (f) Band gaps versus in-plane uniaxial strains, computed at the HSE06 level. Fig. 4 Fig. 5 Optical absorption coefficients of BeCN2 monolayers along x (a/c) and y (b/d) directions with uniaxial strain applied in x/y direction. The yellow region represents the solar irradiance spectra. Fig. 5 Fig. 6 Strain along the x-direction (a) and y-direction (b) modulated locations of the CBM and VBM of BeCN2 with respect to the vacuum level, calculated at the HSE06 level. The redox potentials of water splitting at pH 0 (red dashed line) and pH 14 (blue dashed line) are guide to the eye. The HER (left) and OER (right) free-energy profiles of T1 (c), T2 (d), T3 (e), and B1 (f) sites at pH 0 are plotted in (c)-(f), where the conditions of illumination are also considered. Fig. 6 Fig. 7 (a) Geometric structures of pristine BeCN2, BeCN2 with Be-N vacancies, and TM-loading BeCN2, where all of the transition metals considered in this work are listed in the upper panel. (b) Calculated binding energies of different single-atom anchored on the vacancy of BeCN2 (TM@BeCN2). (c) Charge exchange and electronegativities of the TM atoms, where the negative values denote the charge transfer from the TM atom to the substrate. (d) The catalytic pathways of OER, ORR and HER. Fig. 7 Fig. 8 (a) Free energy diagram for HER of partial TM@BeCN2 candidates. (b) HER volcano curve of the exchange current ( i 0 ) versus Δ G H * for hydrogen adsorbed on TM@BeCN2. (e) Three-dimensional HER activity volcano plot and (f) corresponding top view, which reflect the relationship that the HER overpotential as a function of the Gibbs free energy ( Δ G H * ) and adsorption energy of hydrogen adsorption ( Δ E H * ). Fig. 8 Fig. 9 (a) Summarization about overpotentials of OER and ORR for all TM@BeCN2 candidates. The free energy profiles of OER and ORR on (b) Ni@BeCN2 and (c) Co@BeCN2 in a dark environment. The blue and cyan arrows represent the rate-determining step for OER and ORR, respectively. (d) HSE06-predicted band structure of Ni@BeCN2. (e) Free energy steps of OER at pH 0 on Ni@BeCN2 under different conditions of illumination. Fig. 9 Fig. 10 (a) Dual volcano curves of OER/ORR overpotentials against Δ G O H * and Δ G O * − Δ G O H * . Volcano contour plots of (b) OER and (c) ORR originate from the projection of corresponding 3D volcano curves on XY-plane. (d) Spatial distribution of overpotentials including η HER , η OER and η ORR , where each shaded area represents the optimal area for the corresponding HER/OER/ORR. Fig. 10 Fig. 11 (a) Projected density of states (PDOS) of the TM-d orbitals in 3d TM@BeCN2 systems, where the vertical dashed line denotes the position of ε d . (b) Scaling relationship between the free energies of each adsorbate ( OH * , O * and OOH * ) and the d-band center of TM@BeCN2. (c) Required potentials of each reaction step as a function of the ε d for OER (upper panel) and ORR (lower panel), where the shaded area refers to the theoretical overpotential. Fig. 11 Fig. 12 (a) The differential charge density of O2, OH * , O * and OOH * adsorbed on Ni@BeCN2. (b) The ICOHP of TM-O bond in TM@BeCN2. (c) The relationship between the ICOHP of TM-O bond and the Δ G for OH * , O * and OOH * . pCOHP between TM-O for OH * intermediate, and the PDOS of d-orbitals of TM and p-orbitals of OH* for (d) Ni@BeCN2 and (e) Co@BeCN2. (f) PDOS of Ni-d orbital of Ni@BeCN2, p-orbitals of isolated OH and their interaction within OH*Ni@BeCN2. (g) Main energy levels of Ni@BeCN2 interacting with OH. Fig. 12 Table 1 Parameters of BeCN2: Lattice constants, Bond lengths, Bond angles, Elastic Constants and Band gaps. Table 1 Lattice constants (Å) a b 4.34 5.25 Bond lengths (Å) d 1 d 2 d 3 d 4 d 5 1.571 1.638 1.598 1.312 1.416 Bond angles (deg) θ 1 θ 2 θ 3 θ 4 θ 5 θ 6 118.81 132.80 116.96 106.56 127.69 117.68 Elastic Constants (N/m) C11 C12 C22 C66 214.87 65.54 218.73 89.79 Band gaps (eV) HSE06 PBE 3.31 2.22 Table 2 2D elastic modulus (C2D), effective (m*), deformation potential constant (E1) and carrier mobility (μ) along x and y-direction. Table 2 Systems Direction Carrier type m*(m0) E1 (eV) C2D (N m−1) μ (cm2 V−1 s−1) BeCN2 x Electron 0.782 1.02 214.06 11,885.34 Hole 1.095 3.27 214.06 412.97 y Electron 0.285 2.14 214.37 7419.51 Hole 0.814 0.27 214.37 81,602.22 Table 3 Calculated static dielectric constant (ε), effective exciton mass (μ) and exciton binding energy (Eeb). Table 3 me* mh* ε11 ε22 ε33 ε μ E eb Ni@BeCN2 0.37 0.55 1.57 1.68 1.20 1.48 0.22 1.37 Designing an isoelectronic counterpart to group III-V semiconductors: A novel honeycomb BeCN2 monolayer with ultra-high mobility toward solar driven overall water splitting and bifunctional oxygen evolution/reduction reaction Xihang Zhang Writing – original draft Data curation Formal analysis Methodology Conceptualization a Chunyao Fang Formal analysis Methodology Supervision a Qiang Zhang Writing – review & editing Supervision Formal analysis Methodology Conceptualization a ⁎ Renxian Qin Data curation Visualization a Xiaomeng Cui Visualization a Yali Lu Visualization a Jingcheng Xu Visualization b Chenglong Shi Funding acquisition a a Department of Physics, University of Shanghai for Science and Technology, Shanghai 200093, People’s Republic of China Department of Physics, University of Shanghai for Science and Technology Shanghai 200093 People’s Republic of China Department of Physics, University of Shanghai for Science and Technology, Shanghai 200093, People’s Republic of China b School of Materials and Chemistry, University of Shanghai for Science and Technology, Shanghai 200093, People’s Republic of China School of Materials and Chemistry, University of Shanghai for Science and Technology Shanghai 200093 People’s Republic of China School of Materials and Chemistry, University of Shanghai for Science and Technology, Shanghai 200093, People’s Republic of China ⁎ Corresponding author. Like group III-V materials, which have obviously broadened the scope of group IV family and enriched the semiconducting members, a lightest representative of group II−IV−V2 family, BeCN2 monolayer, as an isoelectronic counterpart to group III-V semiconductor has for long remained unsolved for its applications in HER/OER/ORR, although previous first-principles investigations have touched the configuration and existence toward multiple crystalline forms of BeCN2. Using density functional theory calculations, the stable BeCN2 monolayer is predicted to be a direct bandgap semiconductor with high ultraviolet light absorption, achieving photocatalytic overall water-splitting within full pH, whose photogenerated electrons/holes will provide an external potential to obviously reduce the overpotential of HER and even make it achieve a spontaneous OER within pH 0–14. Meanwhile, it presents significantly anisotropic and high carrier mobilities (104 order) with preferred electron/hole transport along the x/y-direction, providing rich and required charge sources for HER/OER/ORR. After TM-decoration, the catalytic activities are greatly enhanced, achieved by the low HER and OER/ORR overpotentials of 0.05/0.07 V for V/Co@BeCN2 and 0.79/0.43 V for Ni@BeCN2, respectively. Plus, under pH 0–14, the OER overpotential of Ni@BeCN2 can be completely overcome by the external potential provided by photogenerated holes, achieving bifunctional catalysis for OER and ORR. Particularly, the Ni-d orbital is evidently hybridized with the O-p orbital for OH*Ni@BeCN2, so that the initial lone electrons located at the anti-bonding orbital pair up can populate the downward bonding orbital, allowing the species *OH to be moderately adsorbed on Ni@BeCN2, and thus redound the performance of OER/ORR. Graphical Abstract ga1 Keywords First-principles calculations Photocatalytic water splitting Hydrogen evolution reaction Oxygen evolution reaction Oxygen reduction reaction Data availability Data will be made available on request. 1 Introduction Nowadays, the ever-increasing energy crisis and global environmental challenges, the excessive consumption of non-renewable tradition energy to meet global energy requirements is giving rise to sacrifice of fossil fuels and CO2 emission at an alarming rate leads to worldwide greenhouse effect, are two severe issues we are facing, and the technologies that can manufacture green energy without environmentally harmful products at its combustion end are sought after [1–3]. Against this pressing background, high-performance and cost-effective photo-/electrocatalysts are imperative [4], which play critical roles in the storage and conversion of renewable energy, such as proton exchange membrane fuel cells, rechargeable metal-air batteries, and hydrogen production from water-splitting[5], including oxygen evolution/reduction reaction (OER/ORR) and hydrogen evolution reaction (HER) mechanisms [6–8]. However, since the multi-step proton-coupled-electron transfer is involved during oxygen electrode reactions, the OER and ORR with scale relationships usually suffer from a sluggish kinetic rate and high overpotentials, limiting the overall efficiency of energy conversion and storage [9,10]. Up to now, the highly sought-after catalysts are still dominated by noble-metal-based materials, such as Pt for HER and ORR, IrO2/RuO2 for OER [11,12]. However, the reserve scarcity and high cost of these noble-metal-based catalysts make widespread and industrial scale applications daunting. Such that, it is of great necessity and consequence to design low-cost and efficient catalysts that can alleviate current predicament and energy problems [9,13]. Honda-Fujishima's pioneering work about TiO2 for photocatalytic water splitting has opened the prospect of semiconductor photocatalytic technology for applications in energy conversion and storage [14]. Unfortunately, the high recombination rate of photogenerated electron-hole pairs and low utilization of solar energy result in an unsatisfying photocatalytic efficiency, limiting large-scale applications. As yet, two-dimensional (2D) semiconductors have been widely explored for the purpose of photocatalytic water splitting and bifunctional OER/ORR on account of low recombination of photoexcited carriers, large surface area, short carrier migration distance, massive active sites, tunable bandgap, and good optical adsorption, like AlAs [15], BiP3 [16], and ε-SnS [17]. Currently, enormous attention has been paid to transition metal nitrides, sulfides, and phosphides for their potential applications in photocatalysis, the vast majority of which present high catalytic activity and desirable carrier mobility, such as GeSe/GeS, MXenes, and group-IV monochalcogenides ultra-thin sheets have been deemed as promising catalysts [18–20]. Moreover, it has been widely accepted that MoS2, a species of transition metal sulfides, is an outstanding HER catalyst [21], whereas its weak dispersion for band edges due to relatively localized d-orbital leads to large effective carrier masses and hence poor electron transport, limiting its further catalytic applications. Subsequently, another direct band gap semiconductor, black phosphorene has high carrier mobility [22], but extremely easy degeneration in air makes it difficult to be used in catalysis. Interestingly, graphene-like carbon-based material and its derivatives have gained enormous attention benefiting from large carrier mobility and ultra-high stability. As a key member of graphene-like derivatives, graphitic carbon nitride (g-C3N4) is an easy-to-synthesize and low-cost 2D material, has been utilized for the photocatalytic hydrogen production [23]. Besides, naturally evenly distributed large pores on g-C3N4 can offer rich and uniform nitrogen coordination sites with electron-rich lone pairs for capturing transition metal (TM) atoms to form TM@g-C3N4 single-atom catalysts (SACs), such as Niu et al. [24] reported that Pd@g-C3N4 stands out with a low ORR overpotential of 0.46 V. Another star member of the graphene derivatives, the high stability and purity BN touches upon several lattice phases including the cubic (c-BN), wurtzite (w-BN), and graphitic (g-BN) phases [25–27], of which rich physical and chemical performances highlight outstanding multifunctional applications of BN for nonlinear optics, ferroelectricity, piezoelectricity, and even super-hard materials [28,29]. However, wide band gaps of BN limit their applications in catalysis. As such, Yang et al. [30] designed a semi-hydrogenated graphitic BN monolayer, a strip-like antiferromagnetic semiconductor, which can be served as a visible-light driven photocatalyst for water splitting. Going beyond the structure of BN, as intermediates of graphene and BN, a recently predicted BCN compound possesses distinctive chemical and physical properties and even is suitable for photocatalytic water splitting on account of the ternary ingredients allowing higher tunable degrees of freedom [31]. Followed immediately, Luo et al. [32] designed the lightest members in the II-IV-V2 family, isoelectronic counterparts of BN, one of which is the phase of Pmc21, a monolayer of such graphitic BeCN2 displays charming potential in water-splitting. However, to our knowledge, a comprehensive and systematic catalytic insight for BeCN2 is missing, and even for it as a substrate to form SACs is also virgin. In the present work, to examine its potential applications in catalysis, we have systematically explored its stability, mechanical properties, electronic structures, carrier mobility, photocatalytic/electrocatalytic HER/OER/ORR using first-principles calculations. Our results demonstrate that the stable BeCN2 monolayer is a direct semiconductor with high ultraviolet light absorption suitable for photocatalytic water-splitting, achieving overall water-splitting within full pH. Particularly, the overpotential of HER will be significantly reduced and even achieving a spontaneous OER within pH 0–14 when BeCN2 is in a light environment. Plus, monolayer BeCN2 also exhibits significantly high carrier mobilities of the order of 104 cm2 V−1 s−1 with preferred electron/hole transport in the x/y-direction, providing sufficient charge sources for HER/OER/ORR. After TM-decoration, the HER, OER and ORR activities are greatly enhanced, achieved by the low HER and OER/ORR overpotentials of 0.05/0.07 V for V/Co@BeCN2 and 0.79/0.43 V for Ni@BeCN2, respectively. Particularly, the OER overpotential of Ni@BeCN2 can be completely overcome by the external potential supplied by photogenerated holes, achieving bifunctional catalysis for OER and ORR under pH 0–14. Finally, the origin of OER/ORR activity on TM@BeCN2 was also investigated with different descriptors ( Δ G O H * , ε d and ICOHP). 2 Computational method All first-principles calculations were carried out by using the Vienna ab initio Simulation Package (VASP) based on spin-polarized density functional theory (DFT) [33]. The generalized gradient approximation formulated by Perdew-Burke-Ernzerhof (PBE) was applied to characterize the exchange-correlation functional within the framework of projector-augmented-wave (PAW) theory [34]. To consider van der Waals (vdW) interactions, semiempirical D3 correction method, as recommended by Grimme et al. [35], was utilized. The integration over the Brillouin zone (BZ) was executed using the Monkhorst-Pack scheme for k-point sampling, a grid of 2 × 2 × 1. The plane wave unfolds with a cutoff energy of 500 eV, and the convergence criteria for energy and force are set to 10−5 eV and 0.01 eV/Å, respectively. To avoid interactions between neighboring periodic images, a vacuum layer of ∼29 Å was applied along the direction perpendicular to the 2D plane. Partial Crystal Orbital Hamilton Population (pCOHP) and its integrals can be directly obtained from plane wave data using the LOBSTER software package [32]. The computations for phonon spectra were conducted employing the PHONOPY software, which operates on the principles of density functional perturbation theory [36]. To assess thermodynamic stability, ab initio molecular dynamics (AIMD) simulations spanning 6 ps were performed, utilizing a time step of 1 fs [37]. To mitigate the potential underestimation of the band gap caused by the PBE functional, the Heyd-Scuseria-Ernzerhof (HSE06) hybrid functional is employed to attain accurate band structures [17]. A quantitative assessment of charge transfer can be achieved through Bader charge analysis [38]. Supercells, composed of a 3 × 3 × 1 primitive cell, were employed to construct transition metal (TM)-anchored slabs, forming single-atom catalysts. More details on the calculations of HER, OER and ORR are provided in the Supporting Information. 3 Results and discussion 3.1 Structure and stability of BeCN2 Considering that all constituted atoms in sp2-monatomic-thick motifs of group III-V monolayers are 3-fold coordinated, several unknown allotropes could be topologically mapped onto the orthogonal lattice of group-IV monolayers (such as graphene) with eight atoms each primitive cell. A feasible and easy approach to create group II-IV-V2 monolayer that is isoelectronic to group III-V monolayers is to simultaneously occupy the four group III sites using two group II and two group IV elements. Following this strategy, we used the group III-V compound featured with a form of cubic B4N4 (cubic BN) monolayer to construct the group II-IV-V2 monolayer, Be2C2N4 (BeCN2), i.e., replacing the four group III B atoms with two group II Be atoms and two group IV C atoms. This isoelectronic counterpart of cubic BN monolayer is packed into a 2D space group of Pmc21 (No. 26) with orthogonal lattice, as shown in Fig. 1a, the π − π overlaps in which are well-preserved compared with graphene and cubic BN, resulting in forming a sp2-monatomic-thick planar configuration. The well-optimized lattice parameters of BeCN2 are a → = 4.34 Å and b → = 5.25 Å and α = β = γ = 90 ° , where the bond lengths between Be/C and N atoms are in the range of 1.57–1.64/1.31–1.42 Å, and the bond angles correspond to the range of 106.56°-132.80° (see Table 1). Each element is tri-atomically coordinated, herein, N for Be and C atoms is the sole coordination element, while the N atoms possess a locale coordination moiety of Be2C or C2Be. To understand the bonding features of Be-N and C-N, the electron localization function (ELF) analysis was carried out, which is a position-dependent function ranging from 0 (ideal ionic bonds or van der Waals interactions) to 1 (ideal covalent bond or lone pair electrons) [39]. We noticed that large ELF values in regions corresponding to interatomic spacing of Be-N and C-N are significant, exhibiting that covalent dominated interactions between atoms in BeCN2 are formed, as shown in Fig. 1b. Then, differential charge density of BeCN2 monolayer was adopted to further elucidate its bonding nature. As obviously seen in Fig. 1c, there is a charge depletion on Be/C site and their contiguous hollow of the lattice, while the charge is accumulated and well delocalized predominantly over the bonding region between every two atoms, indicating that all constituted atoms form multicenter covalent bonds with adjacent other atoms. About the aforementioned covalent contributions, based on the pCOHP, the chemical-bonding analysis is performed, herein, all bonding states are located below the Fermi level corresponding to populated orbitals by electrons, while antibonding states are located above the Fermi level corresponding to non-populated states by electrons. As seen in Fig. 1d, the pCOHP of the Be-N and C-N bonds validates that no antibonding levels occur in the valence bonding region compared with the unoccupied conduction orbitals, the covalency is thus considerably pure. Meanwhile, values of integrated pCOHP (ICOHP) for C-N are significantly negative than those of Be-N, suggesting that C-atoms with high electronegativity induced stronger bonding strength and shorter bond length. Although BeCN2 presents rather interesting structural and bonding characteristics, we are still unclear whether it is a stable atomic motif. To obtain an effective evaluation for the stability of the BeCN2 monolayer, the cohesive energy of BeCN2 was firstly calculated according to the Eq. S(1) in Supporting Information and the value is − 6.01 eV/atom, as a reference, which is dramatically lower than those of theoretically predicted monolayers including δ-AlP3 (−3.59 eV/atom) [40], ε-SnO (−4.55 eV/atom) [41], α -CSe (- 3.86 eV/atom) [17] and δ-SnS (−3.84 eV/atom) [17], and even lower than those of experimentally realized phosphorene (−3.30 eV/atom) [22] and germanene (−3.24 eV/atom) [42], ensuring that monolayer BeCN2 is a stably connected network. The stability of BeCN2 could be further demonstrated by its AIMD simulation, thus, a AIMD simulation of 6 ps using a 3 × 3 × 1 supercell from 400 K (Fig. 1e) to 1400 K was performed to investigate the thermodynamic stability of BeCN2, where the atomic motif remains stable without obvious lattice distortion until 1300 K (Fig. S1). At 1400 K, however, the monolayer has a pronounced structural undulation, that is, the maximum temperature that the BeCN2 monolayer can maintain its structural stability is ∼1300 K. Then, the dynamic stability of BeCN2 was also assessed in terms of the phonon dispersion curves and phonon density of states of BeCN2 (see Fig. 1f-g), where no imaginary frequency in the whole momentum range is present, proving the high dynamic stability of BeCN2. Moreover, the highest phonon frequency reaches up to 1634.31 cm−1 at the Y point, which is significantly higher compared with those of δ-SnS (300 cm−1) [17], δ-AlP3 (442 cm−1) [40] and Si3P (540 cm−1) [43], suggesting robust bonding for Be-N and C-N bonds. Finally, the mechanic stability of BeCN2 was also evaluated by calculating the independent elastic constants, which were 214.87 N/m, 65.54 N/m, 218.73 N/m, 89.79 N/m for the components C 11 , C 12 , C 22 and C 66 , respectively. An inevitable requirement for the mechanic stability [44] is C 11 > 0 , C 11 C 22 > C 12 2 and C 66 > 0 , herein, it can be seen that the elastic constants of BeCN2 satisfy these requirements, indicating that BeCN2 has good mechanical stability. 3.2 Mechanical properties of BeCN2 To obtain the ideal tensile strength of BeCN2, starting with the well-relaxed BeCN2 monolayer, consecutive tensions are applied along either uniaxial x-direction or y-direction. Herein, the so-called ideal tensile strength denotes the highest bearable stress, the strain at which the ideal tensile strength obtains corresponds to critical strain. When a series of in-plane uniaxial strains from 0 to 0.26 along the x-direction/y-direction are imposed, the y-direction/x-direction lattice constant was fully relaxed and the strained lattice was fixed, meanwhile all atomic positions were also well-relaxed regardless of x-direction or y-direction strain. As shown in Fig. 2a, the stress induced by x-direction strain increases monotonically in the range of applied tensile strains from 0 to 0.12, then the stress decreases monotonically ranging from 0.12 to 0.26, that is, reaching its maximum value of 16.1 N/m at a critical strain of 0.12. Similarly, the stress induced by y-direction strain firstly increases then decreases monotonically, where a tensile strain of 0.15 is the inflection point of stress-strain curve, i.e., a maximum stress of 16.8 N/m at 0.15 is obtained. Interestingly, according to previous reports, the maximum stresses that BeCN2 can withstand in the x/y direction are much larger than those of BiP3 (2.46/2.17 N/m) [16], δ-SnS (3.31/2.5 N/m) [17] and α-CSe (4.008/10.96 N/m) [45], implying a large resistance to tensile strain. In order to investigate the response of the material to strain, the transverse response of BeCN2 induced by uniaxial tensile strain is described in Fig. 2b. We noted that when a tensile (compressive) strain is applied in the x-direction, the induced strain is negative (positive) along the y-direction and vice versa, exhibiting a positive Poisson effect. In Fig. 2b, the data are fitted to the cubic polynomial y = A x + B x 2 + C x 3 + D ,where v x y = - A = 0.30 and v y x = - A = 0.30 are the linear Poisson’s ratio. Considering a fact that the anisotropic geometric configuration usually induces a highly orientation-dependent mechanical property for BeCN2. To obtain a full understanding for the mechanical behavior of BeCN2, orientation-dependent Young's modulus E ( θ ) and Poisson's ratio v ( θ ) based on the results of elastic constants thus are calculated according to Eqs. S(2) and S(3). It was found that the E ( θ ) of BeCN2 increases steadily from a minimum value of 195.23 N/m along the x-direction to a maximum value of 219.57 N/m at about θ = 45 o (see Fig. 2c), implying obvious mechanical anisotropy. Clearly, the smaller Young's modulus of BeCN2 compared to those of other materials were found, such as graphene (342 N/m) [46], MoS2 (330 N/m) [47], and BN (318 N/m) [48], suggesting that the BeCN2 monolayer is highly flexible. As shown in Fig. 2(d), one can see that the values of v ( θ ) for the BeCN2 monolayer are also spatially varying, i.e., an angle-dependent positive Poisson’s ratio. The minimum and maximal values about Poisson’s ratio are 0.22 and ∼0.31 along the diagonal direction and the x/y-direction, respectively, catering to the fitting results in Fig. 2b. 3.3 Electronic properties of BeCN2 Having demonstrated the stability and discussed the mechanical properties of the BeCN2 monolayer, we turn our focus to the band structure, since it is a decisive and key factor for effective mass, carrier mobility, optic absorption and even photocatalytic water splitting. The electronic band structure demonstrates a semiconducting characteristic for BeCN2 with a direct band gap of 3.31 eV (2.22 eV), both the conduct band minimum (CBM) and the valence band maximum (VBM) being at the Y point, at the HSE06 (PBE) level, as presented in the Fig. 3a and S2. In projected band structure, the CBM shows the C and N atoms are responsible for a dominant contribution, while the VBM is primarily contributed by N atoms. Further detailed observation from the partial density of states (PDOS) indicates that the CBM is mainly contributed by the p z orbitals of the C atoms, with slight weight of the p z orbitals of the Be and N atoms, meanwhile the VBM is mainly contributed by the p z orbitals of the N atoms, and the contribution from the p z orbitals of other two atoms is quite tiny. These features match well with the calculated partial charge density at the CBM and VBM (see Fig. 3c and d), and the charge cloud of CBM and VBM from different atoms favor the reduction of recombination of photogenerated electron and hole pairs, i.e., the extended charge separation time results in the lifetime of the photogenerated carriers being increased, and the carrier’s application efficiency is thus expected to be enhanced. In this situation, bare C atoms could provide electrons to electron drawing adsorption species, such as oxygen-containing intermediates and hydrogen, and the N atoms can contribute empty orbitals to electron-donor adsorbates, therefore, BeCN2 is expected to balance the adsorption strength and exhibit good HER/OER/ORR performance. As seen in the projected band structure plotted in Fig. 3a, an obvious anisotropy under investigation is found, i.e., different effective masses of the carriers along different lattice directions may be presented. Intuitively, the CBM has a strong (weak) dispersion in the Γ − Y ( Γ − Y ) direction, while the band dispersion of the VBM is relatively flat in the Γ − X ( Γ − Y ) direction. Using the Eq. S(5) of Supporting Information to fit the band dispersion, and the effective masses of electrons and holes thus can be obtained, as summarized in Table 2. For electrons, the effective masses are predicted to be 0.782 m 0 and 0.285 m 0 along the Γ − X and Γ − Y directions, respectively, and calculated effective hole masses are 1.095 m 0 (0.814 m 0 ) along the Γ − X ( Γ − Y ) direction. Herein, it was found that the effective electron/hole mass of Γ − X direction is 2.744/1.345 times higher than that of the Γ − Y direction, corresponding to a dispersive CBM/VBM along the Γ − Y direction and relatively flat CBM/VBM along the Γ − X direction. These features imply that BeCN2 may exhibit obvious anisotropy for carrier mobility along the Γ − X and Γ − Y directions, especially for hole. To obtain a more intuitively understanding for the band dispersion near the CBM and VBM, 3D band valleys are plotted in Fig. 3(b), whereas for the insets, the band dispersions in the vicinity of the Γ point along the Γ − X (ka) and Γ − Y (kb) directions are displayed. We noticed that the CBM valley is significantly sharper than the VBM valley along the Γ − X / Γ − Y direction, matching well with the analysis of effective mass. 3.4 Small effective mass, ultrahigh carrier mobility, strong optical absorption Effective mass and mobility of carriers are two key factors to quantitatively evaluate the transfer capability of electron-hole pairs in water splitting or ORR along a certain direction, therefore, the direction-dependent carrier effective mass benefiting from anisotropic lattice was firstly investigated. Fig. 4a-b describe the direction-dependent effective masses of electrons and holes, from which we found that the effective electron and hole masses of BeCN2 are highly anisotropic with a “peanut” and “chubby egg” shape, respectively, owing to the dispersive p-orbitals of C/N predominantly contributing to the CBM/VBM. According to the values of effective carrier masses, the electron (hole) effective mass of BeCN2 is relatively small in the y-direction compared to that of other 2D materials such as: α-P ( m e = 1.13 m 0 , m h = 1.81 m 0 ) [49], monolayer KTlO ( m e = 0.74 m 0 , m h = 2.40 m 0 ) [50] and th-AlN ( m e = 0.79 m 0 ; m h = 5.60 m 0 ) [51]. The smaller carrier effective mass facilitates the transfer of carriers to the active site during reaction and improves the reaction efficiency. Meanwhile, the significant difference between the effective masses of electrons and holes is conducive to the electron-hole separation and reduction of electron-hole pairs recombination. Also, according to the deformation potential (DP) theory [52], which can be adjusted by acoustic phonon scattering through inter-valley and intra coupling, the carrier mobility of 2D ultrathin nanosheet can thus be estimated using the Eq. S(4) of Supporting Information. Herein, we used a small strain ranging from − 0.02 to 0.02 (see the strain schematic of Fig. 4c) to fit the values for elastic modulus and deformation potential, band edge position using vacuum energy level as reference and total energy against the isotropic strain along the x-direction and y-direction are plotted in Fig. 4d-e. As we can see, the linear fittings of the band edge positions and the parabolic fittings of total energies are perfectly presented, ensuring the reliability of the calculation. The coupling strength between the electron/hole and the acoustic phonon can be quantitatively described by the values of DP constants, meanwhile, we noticed that the DP constants with different directions listed in Table 2 are significantly different, regardless of electrons and holes, that is, there is a significant difference in such coupling strength. In other words, the scattering of electrons in the x-direction derived from the acoustic phonon is weaker than that of electrons along the y-direction, whereas, for the holes scattering derived from the acoustic phonon, the x-direction is considerably stronger than the y-direction. Considering that the DP constant takes a negative quadratic term in the determine relationship of carrier mobility, therefore, compared to other terms, a more significant impact for the carrier mobility stemming from the DP constant is imposed. The electron mobility of BeCN2 along the x/y-direction is predicted to be 1.19 × 10 4 / 0.74 × 10 4 cm 2 V − 1 s − 1 , and the mobility of holes is predicted to be 0.0412 × 10 4 / 8.16 × 10 4 cm 2 V − 1 s − 1 . Interestingly, although BeCN2 has smaller effective electron mass and larger in-plane stiffness along the y-direction compared with that of x-direction, the electron mobility along the x-direction is larger than that of y-direction. This phenomenon can be attributed to electron-acoustic-phonon interaction, where, for electrons, the weaker electron-acoustic-phonon interaction of x-direction in the BeCN2 monolayer causes an obviously smaller DP constant. Particularly, values of carrier mobility are significantly higher than that of many other 2D materials including silicon (1343 cm2 V−1 s−1) [53], δ-InP3 (2684 cm2 V−1 s−1) [54] and Pd4S3Se3 (564 cm2 V−1 s−1) [55], and MoS2 (200 cm2 V−1 s−1). Accordingly, the ultrahigh carrier mobility together with obvious anisotropy can sensibly diminish the recombination of electron–hole pairs, furthermore, they can speedily arrive to the reaction sites on BeCN2 to pitch in reaction, guaranteeing long-term catalytic activity. As we all know, during preparation process, the combination of mechanical loading and epitaxy on a substrate will inevitably lead to strain, that is, the electronic structure of BeCN2 is highly likely to be modulated by strain. A high strain capacity for BeCN2 has been demonstrated in Fig. 2, herein, uniaxial in-plane strains from − 0.05 to + 0.05 along the x-direction and y-direction were employed to investigate the strained band structure (see Fig. S3). We noticed that the band gap can be modulated monotonically from 3.312 eV to 3.533 eV with increasing tensions from 0 to + 0.05, while it first increases and then decreases mildly with an increasing compressive loading from 0 to − 0.05 (see Fig. 4f). Things are different for y-direction tensile and compressive strains, i.e., by applying increasing tensile loading from 0 to + 0.05, the bandgap of BeCN2 first increases and then decreases, yet the bandgap increases monotonically from 3.312 eV to 3.477 eV with increasing compressive strains from 0 to − 0.05 (see Fig. 4f). Interestingly, as seen in Fig. S3, regardless of the directions and size of the applied strain, the characteristic of direct bandgap is well-preserved, allowing convenient electronic transitions. To become a good photocatalyst, one must first become an excellent light absorber. Herein, two electric field polarizations along the x-direction and y-direction were considered, according to the Eq. S(8), in-plane light absorption coefficients of BeCN2 obtained by HSE06 were evaluated. As displayed in Fig. 5, the BeCN2 monolayer exhibits expectantly weak optical absorption regardless of strain, for which it is not difficult to imagine that it is caused by a big bandgap. In the ultraviolet region, the light absorption coefficient can reach the magnitude of 104 cm−1, where the unique atomic configuration of BeCN2 causes almost identical amount of in-plane light absorption along two lattice directions regardless of strain, exhibiting stable and strong light harvesting ability. In other words, the light absorption coefficients of BeCN2 would not be affected by strains, providing stable energy guarantee for photocatalytic water splitting. 3.5 Strain modulated band edge position and HER/OER driving force of bare BeCN2 As a desirable catalyst for photocatalytic water-splitting, in addition to possessing an appropriate bandgap (>1.23 eV), the energy positions of band edge must straddle the redox potential of water [56]. For strain-free BeCN2, in the full pH range, the band edges of CBM (−3.521 eV) and VBM (−6.833 eV) are higher than the reduction potential of H+/H2 and lower than the oxidation potential of O2/H2O (see Fig. 6a-b), respectively, suggesting that the BeCN2 monolayer can be served as a photocatalyst for overall water-splitting. As is well known, strain not only affects the band gap, but also the position of the band edge. That is, the band edge position will inevitably be modulated by strain, which will further affect the performance of photocatalytic water-splitting. Overall, uniaxial tensile/compressive strain of x-direction slightly lows/raises the energy position of VBM, while the opposite is true for y-direction strain. However, in contrast, compressive strains of x-direction and y-direction are more beneficial for HER. It should be noted that, at pH = 14, the CBM is lower than the reduction potential of H+/H2 when a tensile strain of 0.05 is applied in the y-direction, implying that the photocatalytic HER cannot occur under the condition of a tensile strain of 0.05. In a word, overall water-splitting in a wide pH range (0−13) almost remains valid, exhibiting a high-performance and little influence by pH. According to previous reports [17,57], the external potential provided by photoexcited electrons/holes for HER/OER ( U e / U h ) could be prescribed as the difference between CBM/VBM and reduction potential of H+/H2 in energy: U e = E C B M − ( − 4.44 + 0.059 * p H ) and U h = ( − 4.44 + 0.059 * p H ) − E V B M . Therefore, values of U e and U h for strain-free BeCN2 are both positive in pH 0–14, exhibiting that the overall water splitting on BeCN2 will be achieved from acidic, neutral, and even to alkaline conditions. Beyond that, for some cases, a photocatalyst that meets the conditions for photocatalytic water splitting may still suffer from high overpotentials of HER and OER. So, it is of our prime interest to gain an insight into individual half-cell reactions including HER and OER on BeCN2. As shown in Fig. S4, a 3 × 3 × 1 supercell was considered, six potential adsorption sites including the top of three atoms (N site (T1), Be site (T2), and C site (T3)), two bridge adsorption sites (N-Be bond (B1) and N-C bond (B2)), and one hole-centered adsorption site (H1) in six-membered ring were used to adsorb intermediates involved in the HER and OER processes. Conforming to assertions of Norskov and coworkers [58], a two-step/four-step reaction mechanism for water reduction/oxidation half-reaction is described in detail in Note S5 and plotted Fig. S5 of Supporting Information. All optimized geometries of HER and OER intermediates adsorbed on the surface of BeCN2 are plotted in Fig. S6, and free-energy profiles of different sites for HER and OER at different pH values are separately presented in Figs. S7-S18. As summarized in Table S1, values of HER and OER overpotential are large and unsatisfactory, meaning that, when the surface of BeCN2 in a dark environment, both half-reactions cannot proceed spontaneously. For HER, the adsorption of H* adsorbate is difficult, the Δ G H * increases with increasing pH value, similar to the case of equilibrium potential of H+/H2, and thus become its reaction barrier. When BeCN2 is in a light environment, photoexcited electrons will provide an U e as additional energy, which decreases as pH increases, significantly different from the case of Δ G H * . Herein, for HER, we utilized the case adopted the external potential ( U e = 0.92 V , cyan lines) to simulate the one in the light environment, as the cyan free-energy lines of four optimal sites (T1, T2, T3, and B1) presented in Fig. 6c-f. The value of Δ G H * was reduced in the light-added condition compared to the no-light condition, but its photocatalytic HER performance was still limited by the high overpotential, which resulted in a difficult photocatalytic HER process. On the other hand, in the dark environment, the OER also cannot proceed spontaneously at pH 0–14. Fortunately, when the BeCN2 monolayer receives light irradiation, photoexcited holes can provide an external potential ( U h ), which increases with raising pH, totally different from the case of Δ G (free-energy change) of OER intermediates. Obviously, at pH 1–14, all the elementary steps of OER are downhill (Figs. S13-S18), i.e., once irradiation is received, H2O molecules can be oxidized into O2 on the surface of BeCN2 spontaneously in mediums of full pH. 3.6 Structure and stability of TM@BeCN2 In recent years, it has been found in many studies that the catalytic activity can be effectively improved by doping transition metal atoms to form SACs and using the metal atoms as active sites correspondingly. Bhagat et al. [59] constructed a series of TM@g-C3N4 candidates by doping TM atoms in g-C3N4 and found that the Co@g-C3N4 exhibits a lower overpotential than that of pristine g-C3N4 in HER and OER. Zhao et al. [60] found that TM-doped A2X3 systems showed better HER catalytic activity, especially for Cu@As2Te3. These studies have inspired us to construct single atom catalysts through TM doping to reduce the overpotential of the primitive BeCN2 monolayer. As shown in Fig. 7a, a series of TM@BeCN2 SACs were constructed by using 23 transition metals to anchor on the Be-N double vacancy of BeCN2. The well-optimized lattice parameters of TM@BeCN2 are a → = 13.02 Å and b → = 15.75 Å , and the corresponding bond angles are α = β = γ = 90 ° . All optimized structures about TM@BeCN2 are plotted in Fig. S19-S22. To maintain a long-term catalytic activity and efficiency, the robust stability is an essential prerequisite. Herein, the stability of single TM atoms on the substrate was evaluated by calculating the binding energies (Eb) according to E b = E T M @ B e C N 2 – E T M – E V B e - N , where the E T M @ B e C N 2 , E T M , and E V B e - N represent the total energy of TM@BeCN2, the energy of an isolated TM atom, and the energy of a substrate with a Be-N double vacancy, respectively. The more negative the E b value, the tighter the bonding between the metal atoms and the substrate, as summarized in Table S2 and plotted Fig. 7b, the binding energies of all TM@BeCN2 are well below zero, ranging from − 2.83 to − 6.91 eV, indicating strong stability for TM@BeCN2. Bader charge analysis was utilized to determine the valence state of the TM atoms. The charge transfer from the TM atoms to the substrate leads to the TM atoms becoming positively charged, indicating a robust interaction between TM and substrate. Particularly, the trend of electronegativity is consistent with the decreasing amount of charge transfer from left to right for each period: Hf exhibits the lowest electronegativity of 1.30 and has a charge transfer amount of 1.40 e; in contrast, Au has a relatively high electronegativity of 2.40 corresponding to a low charge transfer amount of 0.03 e. Furthermore, the positive charge existing on the TM atoms makes TM-atom an ideal site for the adsorption of intermediates that contain oxygen, creating active center. 3.7 HER activity on TM@BeCN2 To evaluate the catalytic HER activity of the TM@BeCN2 catalysts, we first calculated the Gibbs free energy of hydrogen adsorption ( Δ G H * ) on TM@BeCN2 since the Δ G H * is considered as an efficient descriptor for HER activity [61]. All Δ G H * are summarized in Table S3, some of which are plotted in Fig. 8a. As is known to all, however, Δ G H * of a perfect HER catalyst should be close to 0[62]. Actually, catalysts with | Δ G H * | ≤ 0.09 eV are also deemed to possess high HER performance. For V and Co, the near-zero values of Δ G H * indicate that they could act as highly active HER sites, exhibiting an astonishing proximity to the ideal Δ G H * of 0 eV and even overmatching that of benchmark Pt (−0.09 eV) [63]. This striking performance unequivocally underscores the exceptional HER activity attaching to Co@BeCN2 and V@BeCN2, predicting their remarkable catalytic potential in sustainable energy conversion. The theoretical exchange current ( i 0 ) plays a paramount role in unraveling the underlying intrinsic electron transfer rate that governs the HER activity. A distinct and intriguing volcano-shaped curve is plotted to obtain an intuitive comparison for the HER performance of these as-designed TM@BeCN2 catalysts, as shown in Fig. 8b, where the exchange current at the volcano top is the most advantageous and thus corresponds to the best HER activity. According to Sabatier's principle, both too strong and too weak adsorption frustrates the HER activity. As exemplified by our findings, Ti@BeCN2 and Mo@BeCN2 exhibit their placement within the left branch of the volcano curve, indicating a pronounced affinity for H atoms and consequentially a more robust binding, which in turn leads to a comparatively sluggish release of hydrogen gas (H2). Conversely, catalysts like Ni@BeCN2 and Cu@BeCN2 are positioned on the right branch of the volcano, presenting a great challenge in binding of TM-atoms and H atoms. In such both cases, the corresponding i 0 are notably low, that is, a compelling inference emerges that the proximity of a catalyst to the summit of the volcano graph means an outstanding level of HER activity. Evidently, this assertion can be supported by a robust proof that two optimize catalysts including V@BeCN2 and Co@BeCN2 are conspicuously positioned at the acme of the volcano curve and possess the most positive exchange current. To explore the relationship between HER activity and Δ G H * more intuitively, HER overpotential ( η H E R ) was used to quantitatively describe the HER catalytic activity, and the relationship of η H E R with Δ G H * and H-adsorption energy ( Δ E H * ) is presented in Fig. 8c and d. Clearly, V@BeCN2 and Co@BeCN2 are located at the top/central region, confirming their optimal HER catalytic performance. 3.8 OER/ORR activity and activity trend of TM@BeCN2 OER and ORR activities are highly correlated with the adsorption of oxygenated intermediates (detailed adsorption free energy data of oxygenated adsorbates are summarized in Table S3), and the fully optimized adsorption configurations of intermediates are provided in Figs. S19-S22. Calculated overpotentials for OER/ORR ( η O E R / η O R R ) according to Eqs. S(17) and S(18) are listed in Table S2 and plotted in Fig. 9a. Among all candidates, Ni@BeCN2 has the lowest OER/ORR overpotentials of 0.79/0.43 V, followed by Co@BeCN2 with 0.94/1.05 V, corresponding OER/ORR free energy diagrams without illumination are given in Fig. 9b-c (other free energy diagrams can be found in Figs. S23-S25). The potential determine step (PDS) for both catalysts with the best catalytic OER activity is the formation of OOH * ( O * + H 2 O → O O H * + H + ) . For the ORR, which is the reverse reaction of the OER, the PDS for Ni@BeCN2 is also the formation of O O H * ( O 2 + H + → O O H * ), whereas the PDS for Co@BeCN2 is the desorption of OH * ( O H * + H + → H 2 O + * ). Considering that the OER overpotential can be overcome by the extra voltage supplied by the photogenerated holes, and the reaction would become spontaneous if the extra voltage is large enough. Next, taking Ni@BeCN2 with the best OER activity as an example, the band structure of Ni@BeCN2 was calculated by using the HSE06 method (see Fig. 9d) to estimate the voltage generated by the photogenerated holes. Calculated results indicate that the photoexcited holes can provided an external potential of U h = 3.194 V , which is much larger than the overpotential required (0.79 V) for the OER. When Ni@BeCN2 is in the light environment, all reaction steps become downward at pH 0–14 (see Fig. 9e and Fig. S26), i.e., the H2O molecules could be oxidized into O2 spontaneously in acidic, neutral, and even alkaline conditions. The catalytic OER properties of Ni@BeCN2 that can react spontaneously under light conditions are comparable to those of synthesized CoFe-LDH (0.28 V at 10 mA/cm2) [64] and FeSe2 (0.33 V at 10 mA/cm2) [65] experimentally. On the other hand, the CBM of Ni@BeCN2 is below the reduction potential, that is, it is impossible to obtain a driving force for photocatalytic HER. Also, the exciton binding energy (E eb) is computed to investigate the efficacy of carrier separation. The static dielectric constant (ε) is acquired using density-functional perturbation theory (DFPT) through the linear response method. The exciton binding energy and the exciton Bohr radius (a*) can be determined using the following formula, employing the hydrogenic model [66]: E eb = μ m 0 ε 2 R H , a * = m 0 μ ε a H where R H , m 0 and μ are the Rydberg constant of the hydrogen atom (13.6 eV), the free electron mass and the effective reduced mass, respectively. a H is the Bohr radius of the hydrogen atom. For the Ni@BeCN2 monolayer, E eb and a H were calculated to be 1.37 eV and 3.54 Å (see Table 3), respectively. In addition, the exciton binding energy of WS2 is 3.38 eV [67], while that of Ni@BeCN2 is much lower than that of WS2. These findings suggest that the exciton can be easily dissociated into free carriers. Our results indicate that Ni@BeCN2 monolayer, due to their high static permittivity and low exciton binding energy, could be served as a promising photocatalytic material. AIMD simulations of Ni@BeCN2 were carried out at 400 K. According to the results shown in Fig. S27, the total energy and temperature oscillate around the equilibrium state after 6 ps and the structure appears to remain unchanged, which suggests that the catalyst has a good thermodynamic stability for long-term use. Based on the above discussions, it was found that the overpotentials of the OER/ORR are closely related to the adsorption strength of intermediates. An obvious linear relationship exists between Δ G O * and Δ G O H * , as in Fig. S28, which can be described as Δ G O * = 1.83 Δ G O H * + 0.75 with a coefficient of determination of R 2 = 0.94 . Similarly, Δ G O O H * can be expressed using an expression of Δ G O O H * = 0.91 Δ G O H * + 3.14 (R2 = 0.93). We noticed that the square of correlation coefficient is basically equal for two equations, yet the scaling slope is obviously different, indicating that a different adsorption strength between oxygenated intermediates and TM atoms was existed. Specifically, a slope between Δ G O O H * and Δ G O H * of 0.91 indicates that the same TM-O single bonding for OOH* and OH* adsorbed on TM, whereas the slope between Δ G O * and Δ G O H * was 1.83, which is close to 2, implying a possible existence of TM = O double bonds between O* intermediate and TM atom. On the other hand, through such robust linear relationships described in Fig. S28, one can directly infer the overall catalytic performance using two independent variables: Δ G O H * and Δ G O * − Δ G O H * , instead of using complex multi-dimensions to understand the OER/ORR activity trend. Therefore, taking the 3d TM atoms including optimal Co and Ni as the object of study, the OER/ORR double volcano diagram was constructed based on a relationship of overpotential against the Δ G O H * and Δ G O * − Δ G O H * , as displayed in Fig. 10a. Clearly, in the dual volcano diagram, each TM@BeCN2 is located exactly on the volcano surface, indicating a good correlation between the two independent descriptors and corresponding overpotential. The closer the catalyst is to the top of the volcano, the better the activity. Fig. 10b-c shows the contour plots of the projected volcano map on the X-Y plane, where catalysts closer to the peak of the volcano in the dual volcano plot are likewise closer to the center of the volcano contour plots, which consist of four regions corresponding to four electron steps of the OER/ORR. For OER, the optimal catalytic activity at Δ G 2 = Δ G 3 , Ni@BeCN2 and Co@BeCN2 are close to the volcanic peak with respect to other TM@BeCN2 candidates, indicating good catalytic activity. Similarly, in the ORR volcanic contour plot (Fig. 10c), the best ORR activity is achieved when Δ G 1 = Δ G 4 . Herein, Ni@BeCN2 possesses a low ORR overpotential of 0.43 eV, which is clearly closer to the volcano peak compared with other catalysts, and its catalytic activity surpasses that of commonly utilized IrO2 (0.45 V) [68]. When we are searching for OER and ORR catalysts with good catalytic activity, what is their HER activities? To obtain an intuitive comparison, all overpotentials for the HER, OER, and ORR are plotted in Fig. 10d, where the TM@BeCN2 catalyst located in the bottom/front/left shaded area has good HER/OER/ORR catalytic activity. Although none of all the TM@BeCN2 catalysts can be seen as eligible multifunctional catalysts, the V@BeCN2 ( η H E R = 0.05 V) and Co@BeCN2 ( η H E R = 0.07 V) are excellent single functional HER catalysts, meanwhile, the Ni@BeCN2 ( η O E R = 0 V and η O R R = 0.43 V) under illumination can be identified as efficient bifunctional OER/ORR catalysts. 3.9 Activity origin of TM@BeCN2 To shed more light on the origin of activity and on how to enhance the activity of TM@BeCN2, d band center ( ε d ) of TM atoms is explored. The ε d can be served as an effective descriptor for evaluating the binding strength between reactants and different catalysts. Herein, for specific analysis, we choose 3d TM atoms containing optimal Ni and Co as the object of study. The ε d of TM@BeCN2 can be calculated according to the following equation [24]: ε d = ∫ − ∞ E f E ρ d ( E ) d E ∫ − ∞ E f ρ d ( E ) d E where the E and ρ d represent the energy band width of the d-orbitals and the density of states projected onto TM-d orbitals, respectively. As shown in Fig. 11a, Ti, V, and Cr atoms with less d electrons have a relatively positive value for the ε d (0.03 eV, 0.32 eV, and 0.21 eV, respectively), whereas, with increased d-electron occupation, the d-band centers gradually become more negative, e.g., from − 1.22 eV of Mn to − 2.12 eV of Cu. Consequently, a lower ε d would cause weaker adsorption for adsorbates adsorbed onto TM atoms, matching well with the results that Δ G O H * , Δ G O * and Δ G O O H * show negative correlations against the d-band center (see Fig. 11b). Interestingly, Δ G O * is more sensitive to the ε d compared to Δ G O O H * and Δ G O H * , so that the PDSs are Δ G 2 / Δ G 6 or Δ G 3 / Δ G 7 associated with Δ G O * for OER/ORR. Meanwhile, the nice linear relationship also proves that the ε d can be used as a good descriptor to characterize the catalytic activity. The upper (lower) panel of Fig. 11c presents the relationship between the required potential of each step ( Δ G ) and ε d in OER (ORR), which can provide a direct guide about how to enhance the catalytic performance and design efficient catalysts. For metal atoms with higher ε d ( > - 0.83 e V ), such as Ti (0.03 eV) and V (0.32 eV), the PDS of the OER reaction is the fourth step (OOH* → O2) due to strong O2-adsorption, causing that the entire OER process will be limited by difficult O2-desorption. On the contrary, for Fe (−1.11 eV) and Cu (−2.12 eV) with lower ε d ( < - 0.83 e V ), the weak adsorption of intermediates on TM leads to the formation of the adsorption species O* being difficult, and the PDS is thus the second step (OH* → O*). There is no doubt that, for the two circumstances, a high overpotential is inevitable. That is, a moderate ε d (−0.83 eV), at which the adsorption strength between the intermediates and TM atoms is neither too strong nor too weak, will make the catalyst have good OER catalytic activity. For example, Ni ( ε d = −1.04 eV) is the closest to − 0.83 eV among TM@BeCN2 and possesses an optimal OER overpotential of 0.79 V. To its credit, the same is true for ORR, i.e., the Ni@BeCN2 obtains a lowest ORR overpotential ( η O R R = 0.43 V) since its ε d is closest to the − 0.83 eV, at which the binding strength is neither too weak nor too strong. Therefore, the scheme as-built above provide us an innovative approach, i.e., modulating the ε d to an optimal level, to enhance the OER/ORR activity and design SACs more efficient. All above analyses proved that the adsorption strength of oxygen-containing intermediates has a great influence on the catalytic activity. To further understand the adsorption strength of oxygen-containing intermediates during OER/ORR, the charge density difference distribution of oxygen-containing intermediates was analyzed using Ni@BeCN2 as an example ( Fig. 12a). It can be clearly seen that there is a conspicuous charge exchange between the oxygen-containing intermediates and the TM atoms, implying that a chemical adsorption can be achieved by the TM-O bond. When oxygenated adsorbates are adsorbed onto TM atoms, new bonding and antibonding states occur, and the bonding strength between TM-O can be quantified by the ICOHP, where the more negative ICOHP, the stronger the TM-O bonding. As shown in Fig. 12b, due to similar bonding strength, the results also provide a reasonable explanation for the high linear correlation between Δ G O H * and Δ G O O H * . Meanwhile, the O* is found to be relatively stronger, the OER (ORR) thus needs more energy to desorb O* (adsorb OH* and OOH*), the PDS is usually Δ G 2 ( Δ G 5 / Δ G 8 ) step. A good linear relationship between the ICOHP and Δ G of different oxygen-containing adsorbates was achieved, suggesting that the adsorption strength related to the catalytic activity can be characterized by ICOHP. As mentioned above, Δ G O H * can be used a descriptor that can reasonably predict the catalytic OER/ORR performance, the PDOS and the pCOHP of Ni@BeCN2 were calculated (see Fig. 12d) to further reveal the origin of adsorption strength, meanwhile, that of Co@BeCN2 was also provided for a comparison (see Fig. 12e). Clearly, the d orbitals of the TM atoms and the p orbitals of the O atom in OH* undergo an obvious hybridization, forming new bonding and antibonding states. For the OH* adsorbed on Co@BeCN2, the value of the ICOHP (−2.72) between Co-O is relatively more negative, which results in OH* poisoning, while the ICOHP (−2.00) for Ni-O presents a moderate adsorption strength for OH* adsorbed on Ni@BeCN2. In Ni@BeCN2, the d-orbitals of Ni atom and the p-orbitals of O atom in OH* hybridize each other in the energy range of − 4.5 to − 1.7 eV, forming bonding contributions, and the hybridization in the energy range of − 1.6–0.5 eV dominates anti-bonding contributions (see Fig. 12f). Such hybridization makes the Ni-d orbital move down and occupy the bonding state and reduce the original Ni-d orbital on the antibonding state, promoting a suitable adsorption of OH* onto Ni. Three lone electrons of Ni-d orbital and a lone electron of the O-p orbital in OH* are well matched into two pairs of electron pairs, as shown in Fig. 12g, causing that the π-orbitals in the vicinity of the Fermi level obtain electrons and move down, so that the OH* can be appropriately adsorbed on Ni, promoting the catalytic performance. 4 Conclusions To summarize, using atomic transmutation based on first-principles calculations, we have identified a novel group II-IV-V2 monolayer as an isoelectronic counterpart to cubic BN monolayer in analogy to 2D group III-V materials, realized by monolayer BeCN2, which has dramatically broadened the scope of group V monolayers. The BeCN2 achieves high cohesive energy of − 6.01 eV/atom, high melting points (∼1300 K), absent imaginary phonon frequencies, and elastic constants meeting the Born-Huang stability criteria. A low Young’s modulus of 195.23 N/m∼219.57 N/m and a small Poisson’s ratio of 0.22–0.31 were found, confirming relatively low stiffness and high flexibility. Monolayer BeCN2 exhibits significantly high carrier mobilities of the order of 104 cm2 V−1 s−1 with preferred electron/hole transport in the x/y-direction. It has a direct bandgap with high ultraviolet light absorption suitable for photocatalytic water-splitting, achieving overall water-splitting within full pH. Calculated overpotentials of HER/OER on six possible adsorption sites are large of bare BeCN2, however, when BeCN2 is located in a light environment, the photogenerated electrons/holes will provide an external potential to obviously reduce the overpotential of HER and even achieve spontaneous OER within full pH. After TM-decoration for BeCN2, the HER activity is greatly enhanced, achieved by the HER overpotentials of 0.05 V for V@BeCN2 and 0.07 V for Co@BeCN2. In addition, the Ni@BeCN2 SACs possesses the best catalytic OER/ORR performance with an overpotential of 0.79/0.43 V, whose OER overpotential can be completely overcome by the external potential supplied by photogenerated holes, achieving bifunctional catalysis for OER and ORR under pH 0–14. The origin of OER/ORR activity on TM@BeCN2 was investigated with different descriptors ( Δ G O H * , ε d , ICOHP). Particularly, the Ni-d orbital is evidently hybridized with the O-p orbital for OH*Ni@BeCN2, so that the initial lone electrons located at the anti-bonding orbital pair up can populate the downward bonding orbital, allowing the species *OH to be moderately adsorbed on Ni@BeCN2, and redound the performance of OER/ORR. CRediT authorship contribution statement Xihang Zhang: Writing – original draft, Data curation, Formal analysis, Methodology, Conceptualization. Chunyao Fang: Formal analysis, Methodology, Supervision. Qiang Zhang: Writing – review & editing, Supervision, Formal analysis, Methodology, Conceptualization. Renxian Qin: Data curation, Visualization. Xiaomeng Cui: Visualization. Yali Lu: Visualization. Jingcheng Xu: Visualization. Chenglong Shi: Funding acquisition. Declaration of Competing Interest All authors declare that we have no known competing financial interests or personal relationships that could have appeared to influence the work reported in this paper. Acknowledgements This research was supported by the National Natural Science Foundation of China (21905175). Appendix A Supporting information Supplementary data associated with this article can be found in the online version at doi:10.1016/j.apcata.2023.119518. Appendix A Supplementary material Supplementary material . References [1] M.A. Mushtaq M. Arif G. Yasin M. Tabish A. Kumar S. Ibraheem W. Ye S. Ajmal J. Zhao P. Li J. Liu A. Saad X. Fang X. Cai S. Ji D. Yan Recent developments in heterogeneous electrocatalysts for ambient nitrogen reduction to ammonia: activity, challenges, and future perspectives Renew. Sustain. Energy Rev. 176 2023 113197 M.A. Mushtaq, M. Arif, G. Yasin, M. Tabish, A. Kumar, S. Ibraheem, W. Ye, S. Ajmal, J. Zhao, P. Li, J. Liu, A. Saad, X. Fang, X. Cai, S. Ji, D. Yan, Recent developments in heterogeneous electrocatalysts for ambient nitrogen reduction to ammonia: Activity, challenges, and future perspectives, Renewable Sustainable Energy Rev. 176 (2023) 113197. [2] M.A. Mushtaq A. Kumar G. Yasin M. Arif M. Tabish S. Ibraheem X. Cai W. Ye X. Fang A. Saad J. Zhao S. Ji D. Yan 3D interconnected porous Mo-doped WO3@CdS hierarchical hollow heterostructures for efficient photoelectrochemical nitrogen reduction to ammonia Appl. Catal. B 317 2022 121711 M.A. Mushtaq, A. Kumar, G. Yasin, M. Arif, M. Tabish, S. Ibraheem, X. Cai, W. Ye, X. Fang, A. Saad, J. Zhao, S. Ji, D. Yan, 3D interconnected porous Mo-doped WO3@CdS hierarchical hollow heterostructures for efficient photoelectrochemical nitrogen reduction to ammonia, \"Appl. Catal., B\" 317 (2022) 121711. [3] W. Ye Y. Yang M. Arif S. Yang X. Fang M.A. Mushtaq X. Chen D. Yan Fe, Mo–N/C hollow porous nitrogen-doped carbon nanorods as an effective electrocatalyst for N2 reduction reaction ACS Sustain. Chem. Eng. 8 2020 15946 15952 W. Ye, Y. Yang, M. Arif, S. Yang, X. Fang, M.A. Mushtaq, X. Chen, D. Yan, Fe, Mo–N/C Hollow Porous Nitrogen-Doped Carbon Nanorods as an Effective Electrocatalyst for N2 Reduction Reaction, ACS Sustainable Chem. Eng. 8 (2020) 15946–15952. [4] W. Sun Y. Wang S. Liu F. Lei J. Xie B. Tang High-entropy amorphous oxycyanide as an efficient pre-catalyst for the oxygen evolution reaction Chem. Commun. 58 2022 11981 11984 W. Sun, Y. Wang, S. Liu, F. Lei, J. Xie, B. Tang, High-entropy amorphous oxycyanide as an efficient pre-catalyst for the oxygen evolution reaction, Chem. Commun. 58 (2022) 11981–11984. [5] C. Dong M. Guo W. Gao P. Hao F. Lei J. Xie B. Tang Oriented interlayered charge transfer in NiCoFe layered double hydroxide/MoO3 stacked heterostructure promoting the oxygen-evolving behavior J. Colloid Interface Sci. 627 2022 891 899 C. Dong, M. Guo, W. Gao, P. Hao, F. Lei, J. Xie, B. Tang, Oriented interlayered charge transfer in NiCoFe layered double hydroxide/MoO3 stacked heterostructure promoting the oxygen-evolving behavior, J. Colloid Interface Sci. 627 (2022) 891–899. [6] R. Gao D. Yan Recent development of Ni/Fe-based micro/nanostructures toward photo/electrochemical water oxidation Adv. Energy Mater. 10 2020 1900954 R. Gao, D. Yan, Recent Development of Ni/Fe-Based Micro/Nanostructures toward Photo/Electrochemical Water Oxidation, Adv. Energy Mater. 10 (2020) 1900954. [7] Y. Fan J. Wang M. Zhao Spontaneous full photocatalytic water splitting on 2D MoSe2/SnSe2 and WSe2/SnSe2 vdW heterostructures Nanoscale 11 2019 14836 14843 Y. Fan, J. Wang, M. Zhao, Spontaneous full photocatalytic water splitting on 2D MoSe2/SnSe2 and WSe2/SnSe2 vdW heterostructures, Nanoscale 11 (2019) 14836–14843. [8] M. Hao J. Chen J. Chen K. Wang J. Wang F. Lei P. Hao X. Sun J. Xie B. Tang Lattice-disordered high-entropy metal hydroxide nanosheets as efficient precatalysts for bifunctional electro-oxidation J. Colloid Interface Sci. 642 2023 41 52 M. Hao, J. Chen, J. Chen, K. Wang, J. Wang, F. Lei, P. Hao, X. Sun, J. Xie, B. Tang, Lattice-disordered high-entropy metal hydroxide nanosheets as efficient precatalysts for bifunctional electro-oxidation, J. Colloid Interface Sci. 642 (2023) 41–52. [9] Y. Fan X. Song X. Ma W. Li M. Zhao Rational design of black phosphorus-based direct Z-scheme photocatalysts for overall water splitting: the role of defects J. Phys. Chem. Lett. 13 2022 9363 9371 Y. Fan, X. Song, X. Ma, W. Li, M. Zhao, Rational Design of Black Phosphorus-Based Direct Z-Scheme Photocatalysts for Overall Water Splitting: The Role of Defects, J. Phys. Chem. Lett. 13 (2022) 9363–9371. [10] X. Yang L. Kang Z. Wei S. Lou F. Lei P. Hao J. Xie B. Tang A self-sacrificial templated route to fabricate CuFe Prussian blue analogue/Cu(OH)2 nanoarray as an efficient pre-catalyst for ultrastable bifunctional electro-oxidation Chem. Eng. J. 422 2021 130139 X. Yang, L. Kang, Z. Wei, S. Lou, F. Lei, P. Hao, J. Xie, B. Tang, A self-sacrificial templated route to fabricate CuFe Prussian blue analogue/Cu(OH)2 nanoarray as an efficient pre-catalyst for ultrastable bifunctional electro-oxidation, Chem. Eng. J. 422 (2021) 130139. [11] Z.J. Chen X.G. Duan W. Wei S.B. Wang B.J. Ni Iridium-based nanomaterials for electrochemical water splitting Nano Energy 78 2020 105270 Z.J. Chen, X.G. Duan, W. Wei, S.B. Wang, B.J. Ni, Iridium-based nanomaterials for electrochemical water splitting, Nano Energy 78 (2020) 105270. [12] Z. Guo W. Ye X. Fang J. Wan Y. Ye Y. Dong D. Cao D. Yan Amorphous cobalt–iron hydroxides as high-efficiency oxygen-evolution catalysts based on a facile electrospinning process Inorg. Chem. Front. 6 2019 687 693 Z. Guo, W. Ye, X. Fang, J. Wan, Y. Ye, Y. Dong, D. Cao, D. Yan, Amorphous cobalt–iron hydroxides as high-efficiency oxygen-evolution catalysts based on a facile electrospinning process, Inorg. Chem. Front. 6 (2019) 687–693. [13] M. Guo P. Li A. Wang J. Wang J. Chen F. Lei P. Hao X. Sun J. Xie B. Tang Topotactic synthesis of high-entropy sulfide nanosheets as efficient pre-catalysts for water oxidation Chem. Commun. 59 2023 5098 5101 M. Guo, P. Li, A. Wang, J. Wang, J. Chen, F. Lei, P. Hao, X. Sun, J. Xie, B. Tang, Topotactic synthesis of high-entropy sulfide nanosheets as efficient pre-catalysts for water oxidation, Chem. Commun. 59 (2023) 5098–5101. [14] A. Fujishima K. Honda Electrochemical photolysis of water at a semiconductor electrode Nature 238 1972 37 38 A. Fujishima, K. Honda, Electrochemical Photolysis of Water at a Semiconductor Electrode, Nature 238 (1972) 37–38. [15] C.L. Shi Y.L. Lu Y.R. Li X.H. Zhang C.Y. Fang X.M. Cui J.C. Xu Z.J. Hu Q. Zhang Novel two-dimensional square-AlAs: direct semiconductor coupled with high electron-hole mobility ratio toward sunlight-driven water-splitting Mater. Today Commun. 37 2023 107027 C.L. Shi, Y.L. Lu, Y.R. Li, X.H. Zhang, C.Y. Fang, X.M. Cui, J.C. Xu, Z.J. Hu, Q. Zhang, Novel two-dimensional square-AlAs: Direct semiconductor coupled with high electron-hole mobility ratio toward sunlight-driven water-splitting, Mater. Today Commun. 37 (2023) 107027. [16] D. Liu C.Y. Fang Q. Zhang X.H. Zhang X.M. Cui C.L. Shi J.C. Xu M.Y. Yang Kagome-like BiP3 monolayer: an emerging quasi-direct auxetic semiconductor coupled with high anisotropic mobility toward visible-light-driven photoelectrocatalytic pH-robust overall water-splitting Langmuir 39 2023 12890 12909 D. Liu, C.Y. Fang, Q. Zhang, X.H. Zhang, X.M. Cui, C.L. Shi, J.C. Xu, M.Y. Yang, Kagome-like BiP3 Monolayer: An Emerging Quasi-Direct Auxetic Semiconductor Coupled with High Anisotropic Mobility toward Visible-Light-Driven Photoelectrocatalytic pH-Robust Overall Water-Splitting, Langmuir 39 (2023) 12890–12909. [17] Q. Zhang X. Wang S.L. Yang δ-SnS: an emerging bidirectional auxetic direct semiconductor with desirable carrier mobility and high-performance catalytic behavior toward the water-splitting reaction ACS Appl. Mater. Interfaces 13 2021 31934 31946 Q. Zhang, X. Wang, S.L. Yang, δ-SnS: An Emerging Bidirectional Auxetic Direct Semiconductor with Desirable Carrier Mobility and High-Performance Catalytic Behavior toward the Water-Splitting Reaction, ACS Appl. Mater. Interfaces 13 (2021) 31934–31946. [18] R. Gao J. Zhu D. Yan Transition metal-based layered double hydroxides for photo(electro)chemical water splitting: a mini review Nanoscale 13 2021 13593 13603 R. Gao, J. Zhu, D. Yan, Transition metal-based layered double hydroxides for photo(electro)chemical water splitting: a mini review, Nanoscale 13 (2021) 13593–13603. [19] L. Kang J. Li Y. Wang W. Gao P. Hao F. Lei J. Xie B. Tang Dual-oxidation-induced lattice disordering in a Prussian blue analog for ultrastable oxygen evolution reaction performance J. Colloid Interface Sci. 630 2023 257 265 L. Kang, J. Li, Y. Wang, W. Gao, P. Hao, F. Lei, J. Xie, B. Tang, Dual-oxidation-induced lattice disordering in a Prussian blue analog for ultrastable oxygen evolution reaction performance, J. Colloid Interface Sci. 630 (2023) 257–265. [20] J. Xie C. Dong J. Li M. Guo Y. Zhao L. Kang W. Gao F. Lei B. Tang Acceleration of the pre-oxidation process by tuning the degree of sulfurization for promoted oxygen evolution reaction Chem. Commun. 58 2022 6360 6363 J. Xie, C. Dong, J. Li, M. Guo, Y. Zhao, L. Kang, W. Gao, F. Lei, B. Tang, Acceleration of the pre-oxidation process by tuning the degree of sulfurization for promoted oxygen evolution reaction, Chem. Commun. 58 (2022) 6360–6363. [21] B. Hinnemann P.G. Moses J. Bonde K.P. Jørgensen J.H. Nielsen S. Horch I. Chorkendorff J.K. Nørskov Biomimetic hydrogen evolution: MoS2 nanoparticles as catalyst for hydrogen evolution J. Am. Chem. Soc. 127 2005 5308 5309 B. Hinnemann, P.G. Moses, J. Bonde, K.P. Jørgensen, J.H. Nielsen, S. Horch, I. Chorkendorff, J.K. Nørskov, Biomimetic Hydrogen Evolution: MoS2 Nanoparticles as Catalyst for Hydrogen Evolution, J. Am. Chem. Soc. 127 (2005) 5308–5309. [22] J. Guan Z. Zhu D. Tománek Phase coexistence and metal-insulator transition in few-layer phosphorene: a computational study Phys. Rev. Lett. 113 2014 046804 J. Guan, Z. Zhu, D. Tománek, Phase Coexistence and Metal-Insulator Transition in Few-Layer Phosphorene: A Computational Study, Phys. Rev. Lett. 113 (2014) 046804. [23] X. Wang K. Maeda A. Thomas K. Takanabe G. Xin J.M. Carlsson K. Domen M. Antonietti A metal-free polymeric photocatalyst for hydrogen production from water under visible light Nat. Mater. 8 2009 76 80 X. Wang, K. Maeda, A. Thomas, K. Takanabe, G. Xin, J.M. Carlsson, K. Domen, M. Antonietti, A metal-free polymeric photocatalyst for hydrogen production from water under visible light, Nat. Mater. 8 (2009) 76–80. [24] H. Niu X.T. Wang C. Shao Y.S. Liu Z.F. Zhang Y.Z. Guo Revealing the oxygen reduction reaction activity origin of single atoms supported on g-C3N4 monolayers: a first-principles study J. Mater. Chem. A 8 2020 6555 6563 H. Niu, X.T. Wang, C. Shao, Y.S. Liu, Z.F. Zhang, Y.Z. Guo, Revealing the oxygen reduction reaction activity origin of single atoms supported on g-C3N4 monolayers: a first-principles study, J. Mater. Chem. A 8 (2020) 6555–6563. [25] C.R. Dean A.F. Young I. Meric C. Lee L. Wang S. Sorgenfrei K. Watanabe T. Taniguchi P. Kim K.L. Shepard J. Hone Boron nitride substrates for high-quality graphene electronics Nat. Nanotechnol. 5 2010 722 726 C.R. Dean, A.F. Young, I. Meric, C. Lee, L. Wang, S. Sorgenfrei, K. Watanabe, T. Taniguchi, P. Kim, K.L. Shepard, J. Hone, Boron nitride substrates for high-quality graphene electronics, Nat. Nanotechnol. 5 (2010) 722–726. [26] V.L. Solozhenko V.Z. Turkevich W.B. Holzapfel Refined phase diagram of boron nitride J. Phys. Chem. B 103 1999 2903 2905 V.L. Solozhenko, V.Z. Turkevich, W.B. Holzapfel, Refined Phase Diagram of Boron Nitride, J. Phys. Chem. B 103 (1999) 2903–2905. [27] R. Haubner M. Wilhelm R. Weissenbacher B. Lux Boron nitrides — properties, synthesis and applications M. Jansen High Performance Non-Oxide Ceramics II 2002 Springer Berlin, Heidelberg 1 45 R. Haubner, M. Wilhelm, R. Weissenbacher, B. Lux, Boron Nitrides — Properties, Synthesis and Applications, in: M. Jansen (Ed.), High Performance Non-Oxide Ceramics II, Springer Berlin Heidelberg, Berlin, Heidelberg, 2002, pp. 1–45. [28] C.R. Woods P. Ares H. Nevison-Andrews M.J. Holwill R. Fabregas F. Guinea A.K. Geim K.S. Novoselov N.R. Walet L. Fumagalli Charge-polarized interfacial superlattices in marginally twisted hexagonal boron nitride Nat. Commun. 12 2021 347 C.R. Woods, P. Ares, H. Nevison-Andrews, M.J. Holwill, R. Fabregas, F. Guinea, A.K. Geim, K.S. Novoselov, N.R. Walet, L. Fumagalli, Charge-polarized interfacial superlattices in marginally twisted hexagonal boron nitride, Nat. Commun. 12 (2021) 347. [29] C.Y. He L.Z. Sun C.X. Zhang X.Y. Peng K.W. Zhang J.X. Zhong Z-BN: a novel superhard boron nitride phase PCCP 14 2012 10967 10971 C.Y. He, L.Z. Sun, C.X. Zhang, X.Y. Peng, K.W. Zhang, J.X. Zhong, Z-BN: a novel superhard boron nitride phase, PCCP 14 (2012) 10967–10971. [30] X. Li J. Zhao J. Yang Semihydrogenated BN sheet: a promising visible-light driven photocatalyst for water splitting Sci. Rep. 3 2013 1858 X. Li, J. Zhao, J. Yang, Semihydrogenated BN Sheet: A Promising Visible-light Driven Photocatalyst for Water Splitting, Sci. Rep. 3 (2013) 1858. [31] S.B. Sharma S. K.C D. Paudyal Enhanced optoelectronic and elastic responses in fluorinated penta-BCN Appl. Surf. Sci. 593 2022 153239 S.B. Sharma, S. K.C, D. Paudyal, Enhanced optoelectronic and elastic responses in fluorinated penta-BCN, Applied Surface Science 593 (2022) 153239. [32] D. Luo K. Yin R. Dronskowski Existence of BeCN2 and its first-principles phase diagram: Be and C introducing structural diversity J. Am. Chem. Soc. 144 2022 5155 5162 D. Luo, K. Yin, R. Dronskowski, Existence of BeCN2 and Its First-Principles Phase Diagram: Be and C Introducing Structural Diversity, J. Am. Chem. Soc. 144 (2022) 5155–5162. [33] G. Kresse J. Furthmüller Efficient iterative schemes for ab initio total-energy calculations using a plane-wave basis set Phys. Rev. B 54 1996 11169 11186 G. Kresse, J. Furthmüller, Efficient iterative schemes for ab initio total-energy calculations using a plane-wave basis set, Phys. Rev. B 54 (1996) 11169–11186. [34] J.P. Perdew K. Burke M. Ernzerhof Generalized gradient approximation made simple Phys. Rev. Lett. 77 1996 3865 3868 J.P. Perdew, K. Burke, M. Ernzerhof, Generalized Gradient Approximation Made Simple, Phys. Rev. Lett. 77 (1996) 3865–3868. [35] S. Grimme Semiempirical GGA-type density functional constructed with a long-range dispersion correction J. Comput. Chem. 27 2006 1787 1799 S. Grimme, Semiempirical GGA-type density functional constructed with a long-range dispersion correction, J. Comput. Chem. 27 (2006) 1787–1799. [36] P. Giannozzi S. de Gironcoli P. Pavone S. Baroni Ab initio calculation of phonon dispersions in semiconductors Phys. Rev. B 43 1991 7231 7242 P. Giannozzi, S. de Gironcoli, P. Pavone, S. Baroni, Ab initio calculation of phonon dispersions in semiconductors, Phys. Rev. B 43 (1991) 7231–7242. [37] G. Bussi D. Donadio M. Parrinello Canonical sampling through velocity rescaling J. Chem. Phys. 126 2007 014101 G. Bussi, D. Donadio, M. Parrinello, Canonical sampling through velocity rescaling, J. Chem. Phys. 126 (2007) 014101. [38] W. Tang E. Sanville G. Henkelman A grid-based Bader analysis algorithm without lattice bias J. Phys. Condens. Matter 21 2009 084204 W. Tang, E. Sanville, G. Henkelman, A grid-based Bader analysis algorithm without lattice bias, J. Phys.: Condens. Matter 21 (2009) 084204. [39] F. Shobeyrian F. Shojaei M. Soleimani M. Pourfath Two-dimensional Cr2X2Y6 (X = Si, Ge; Y = S, Se, Te) family with potential application in photocatalysis Appl. Surf. Sci. 630 2023 157319 F. Shobeyrian, F. Shojaei, M. Soleimani, M. Pourfath, Two-dimensional Cr2×2Y6 (X = Si, Ge; Y = S, Se, Te) family with potential application in photocatalysis, Appl. Surf. Sci. 630 (2023) 157319. [40] Q. Zhang X. Wang F.C. Zhang J.Y. Zhou An emerging direct monolayer δ-AlP3: high stability, desirable carrier mobility, NO2-sensitive sensing performance, and superior catalytic properties toward the nitrogen reduction reaction Appl. Surf. Sci. 591 2022 153191 Q. Zhang, X. Wang, F.C. Zhang, J.Y. Zhou, An emerging direct monolayer δ-AlP3: High stability, desirable carrier mobility, NO2-sensitive sensing performance, and superior catalytic properties toward the nitrogen reduction reaction, Appl. Surf. Sci. 591 (2022) 153191. [41] K. Lin X. Wang Q. Zhang C.Y. Fang J.Y. Zhou An emerging bidirectional auxetic post-phosphorene ε-SnO monolayer: a promising Janus semiconductor with photocatalytic activity for solar-driven water splitting reaction Int. J. Hydrog. Energy 47 2022 24761 24776 K. Lin, X. Wang, Q. Zhang, C.Y. Fang, J.Y. Zhou, An emerging bidirectional auxetic post-phosphorene ε-SnO monolayer: A promising Janus semiconductor with photocatalytic activity for solar-driven water splitting reaction, Int. J. Hydrogen Energy 47 (2022) 24761–24776. [42] M. Sun U. Schwingenschlögl B2P6: a two-dimensional anisotropic janus material with potential in photocatalytic water splitting and metal-ion batteries Chem. Mater. 32 2020 4795 4800 M. Sun, U. Schwingenschlögl, B2P6: A Two-Dimensional Anisotropic Janus Material with Potential in Photocatalytic Water Splitting and Metal-Ion Batteries, Chem. Mater. 32 (2020) 4795–4800. [43] Y.L. Zhu J.H. Yuan Y.Q. Song S. Wang K.H. Xue M. Xu X.M. Cheng X.S. Miao Two-dimensional silicon chalcogenides with high carrier mobility for photocatalytic water splitting J. Mater. Sci. 54 2019 11485 11496 Y.L. Zhu, J.H. Yuan, Y.Q. Song, S. Wang, K.H. Xue, M. Xu, X.M. Cheng, X.S. Miao, Two-dimensional silicon chalcogenides with high carrier mobility for photocatalytic water splitting, J. Mater. Sci. 54 (2019) 11485–11496. [44] F. Mouhat F.-X. Coudert Necessary and sufficient elastic stability conditions in various crystal systems Phys. Rev. B 90 2014 224104 F. Mouhat, F.-X. Coudert, Necessary and sufficient elastic stability conditions in various crystal systems, Phys. Rev. B 90 (2014) 224104. [45] Q. Zhang Y.Y. Feng X.Y. Chen W.W. Zhang X.Y. Wu L. Wu Y.X. Wang Structural and electronic anisotropy, negative Poisson’s ratio, strain-sensitive Dirac-like cone in monolayer α-CSe: tailoring electronic properties Comput. Mater. Sci. 168 2019 87 95 Q. Zhang, Y.Y. Feng, X.Y. Chen, W.W. Zhang, X.Y. Wu, L. Wu, Y.X. Wang, Structural and electronic anisotropy, negative Poisson’s ratio, strain-sensitive Dirac-like cone in monolayer α-CSe: Tailoring electronic properties, Comput. Mater. Sci 168 (2019) 87–95. [46] C.G. Lee X.D. Wei J.W. Kysar J. Hone Measurement of the elastic properties and intrinsic strength of monolayer graphene Science 321 2008 385 388 C.G. Lee, X.D. Wei, J.W. Kysar, J. Hone, Measurement of the Elastic Properties and Intrinsic Strength of Monolayer Graphene, Science 321 (2008) 385–388. [47] A. Castellanos-Gomez M. Poot G.A. Steele H.S.J. van der Zant N. Agraït G. Rubio-Bollinger Elastic properties of freely suspended MoS2 Nanosheets 24 2012 772 775 A. Castellanos-Gomez, M. Poot, G.A. Steele, H.S.J. van der Zant, N. Agraït, G. Rubio-Bollinger, Elastic Properties of Freely Suspended MoS2 Nanosheets, 24 (2012) 772–775. [48] K.H. Michel B. Verberck Theory of elastic and piezoelectric effects in two-dimensional hexagonal boron nitride Phys. Rev. B 80 2009 K.H. Michel, B. Verberck, Theory of elastic and piezoelectric effects in two-dimensional hexagonal boron nitride, Phys. Rev. B 80 (2009). [49] J.S. Qiao X.H. Kong Z.X. Hu F. Yang W. Ji High-mobility transport anisotropy and linear dichroism in few-layer black phosphorus Nat. Commun. 5 2014 4475 J.S. Qiao, X.H. Kong, Z.X. Hu, F. Yang, W. Ji, High-mobility transport anisotropy and linear dichroism in few-layer black phosphorus, Nat. Commun. 5 (2014) 4475. [50] Y.Q. Song J.H. Yuan L.H. Li M. Xu J.F. Wang K.H. Xue X.S. Miao KTlO: a metal shrouded 2D semiconductor with high carrier mobility and tunable magnetism Nanoscale 11 2019 1131 1139 Y.Q. Song, J.H. Yuan, L.H. Li, M. Xu, J.F. Wang, K.H. Xue, X.S. Miao, KTlO: a metal shrouded 2D semiconductor with high carrier mobility and tunable magnetism, Nanoscale 11 (2019) 1131–1139. [51] M.E. Kilic K.-R. Lee Auxetic, flexible, and strain-tunable two-dimensional th-AlN for photocatalytic visible light water splitting with anisotropic high carrier mobility J. Mater. Chem. C 9 2021 4971 4977 M.E. Kilic, K.-R. Lee, Auxetic, flexible, and strain-tunable two-dimensional th-AlN for photocatalytic visible light water splitting with anisotropic high carrier mobility, J. Mater. Chem. C 9 (2021) 4971–4977. [52] J. Bardeen W. Shockley Deformation potentials and mobilities in non-polar crystals Phys. Rev. 80 1950 72 80 J. Bardeen, W. Shockley, Deformation Potentials and Mobilities in Non-Polar Crystals, Phys. Rev. 80 (1950) 72–80. [53] S. Poncé E.R. Margine F. Giustino Towards predictive many-body calculations of phonon-limited carrier mobilities in semiconductors Phys. Rev. B 97 2018 121201 S. Poncé, E.R. Margine, F. Giustino, Towards predictive many-body calculations of phonon-limited carrier mobilities in semiconductors, Phys. Rev. B 97 (2018) 121201. [54] B. Radisavljevic A. Radenovic J. Brivio V. Giacometti A. Kis Single-layer MoS2 transistors Nat. Nanotechnol. 6 2011 147 150 B. Radisavljevic, A. Radenovic, J. Brivio, V. Giacometti, A. Kis, Single-layer MoS2 transistors, Nat. Nanotechnol. 6 (2011) 147–150. [55] Y. Luo M.L. Sun J. Yu U. Schwingenschlögl Pd4S3Se3, Pd4S3Te3, and Pd4Se3Te3: candidate two-dimensional janus materials for photocatalytic water splitting Chem. Mater. 33 2021 4128 4134 Y. Luo, M.L. Sun, J. Yu, U. Schwingenschlögl, Pd4S3Se3, Pd4S3Te3, and Pd4Se3Te3: Candidate Two-Dimensional Janus Materials for Photocatalytic Water Splitting, Chem. Mater. 33 (2021) 4128–4134. [56] Y.R. Ying Z.Z. Lin H.T. Huang Edge/basal plane half-reaction separation” mechanism of two-dimensional materials for photocatalytic water splitting ACS Energy Lett. 8 2023 1416 1423 Y.R. Ying, Z.Z. Lin, H.T. Huang, “Edge/Basal Plane Half-Reaction Separation” Mechanism of Two-Dimensional Materials for Photocatalytic Water Splitting, ACS Energy Lett. 8 (2023) 1416–1423. [57] C.Y. Fang X. Wang Q. Zhang J.Y. Zhou First-principles calculations on semiconducting ε-GeS and ε-SnS monolayer nanosheets with photocatalytic activity for sunlight-driven water splitting ACS Appl. Nano Mater. 5 2022 3900 3912 C.Y. Fang, X. Wang, Q. Zhang, J.Y. Zhou, First-Principles Calculations on Semiconducting ε-GeS and ε-SnS Monolayer Nanosheets with Photocatalytic Activity for Sunlight-Driven Water Splitting, ACS Appl. Nano Mater. 5 (2022) 3900–3912. [58] J.K. Nørskov J. Rossmeisl A. Logadottir L. Lindqvist J.R. Kitchin T. Bligaard H. Jónsson Origin of the overpotential for oxygen reduction at a fuel-cell cathode J. Phys. Chem. B 108 2004 17886 17892 J.K. Nørskov, J. Rossmeisl, A. Logadottir, L. Lindqvist, J.R. Kitchin, T. Bligaard, H. Jónsson, Origin of the Overpotential for Oxygen Reduction at a Fuel-Cell Cathode, J. Phys. Chem. B 108 (2004) 17886–17892. [59] B.R. Bhagat A. Dashora Understanding the synergistic effect of Co-loading and B-doping in g-C3N4 for enhanced photocatalytic activity for overall solar water splitting Carbon 178 2021 666 677 B.R. Bhagat, A. Dashora, Understanding the synergistic effect of Co-loading and B-doping in g-C3N4 for enhanced photocatalytic activity for overall solar water splitting, Carbon 178 (2021) 666–677. [60] X. Zhao Y. Yang Y.J. Hu G. Wang D.G. Wang Y.F. Wei S.X. Zhou J.S. Bi W.J. Xiao X.F. Liu Theoretical calculation of hydrogen evolution reaction in two-dimensional As2X3(X=S, Se, Te) doped with transition metal atoms Appl. Surf. Sci. 616 2023 156475 X. Zhao, Y. Yang, Y.J. Hu, G. Wang, D.G. Wang, Y.F. Wei, S.X. Zhou, J.S. Bi, W.J. Xiao, X.F. Liu, Theoretical calculation of hydrogen evolution reaction in two-dimensional As2×3(X=S, Se, Te) doped with transition metal atoms, Appl. Surf. Sci. 616 (2023) 156475. [61] J. Greeley T.F. Jaramillo J. Bonde I. Chorkendorff J.K. Nørskov Computational high-throughput screening of electrocatalytic materials for hydrogen evolution Nat. Mater. 5 2006 909 913 J. Greeley, T.F. Jaramillo, J. Bonde, I. Chorkendorff, J.K. Nørskov, Computational high-throughput screening of electrocatalytic materials for hydrogen evolution, Nat. Mater. 5 (2006) 909–913. [62] Y. Fan J. Wang Z. Zhang X. Ma M. Zhao Nitrogen-doped triphenylene-graphdiyne as metal-free multifunctional (photo)electrocatalysts for overall water splitting ACS Appl. Nano Mater. 6 2023 13037 13047 Y. Fan, J. Wang, Z. Zhang, X. Ma, M. Zhao, Nitrogen-Doped Triphenylene-Graphdiyne as Metal-Free Multifunctional (Photo)Electrocatalysts for Overall Water Splitting, ACS Appl. Nano Mater. 6 (2023) 13037–13047. [63] X. Lv W. Wei H. Wang B. Huang Y. Dai Holey graphitic carbon nitride (g-CN) supported bifunctional single atom electrocatalysts for highly efficient overall water splitting Appl. Catal. B 264 2020 118521 X. Lv, W. Wei, H. Wang, B. Huang, Y. Dai, Holey graphitic carbon nitride (g-CN) supported bifunctional single atom electrocatalysts for highly efficient overall water splitting, \"Appl. Catal., B\" 264 (2020) 118521. [64] R. Gao D. Yan Fast formation of single-unit-cell-thick and defect-rich layered double hydroxide nanosheets with highly enhanced oxygen evolution reaction for water splitting Nano Res 11 2018 1883 1894 R. Gao, D. Yan, Fast formation of single-unit-cell-thick and defect-rich layered double hydroxide nanosheets with highly enhanced oxygen evolution reaction for water splitting, Nano Res. 11 (2018) 1883–1894. [65] R. Gao H. Zhang D. Yan Iron diselenide nanoplatelets: stable and efficient water-electrolysis catalysts Nano Energy 31 2017 90 95 R. Gao, H. Zhang, D. Yan, Iron diselenide nanoplatelets: Stable and efficient water-electrolysis catalysts, Nano Energy 31 (2017) 90–95. [66] X. Lv W. Wei Q. Sun F. Li B. Huang Y. Dai Two-dimensional germanium monochalcogenides for photocatalytic water splitting with high carrier mobility Appl. Catal. B 217 2017 275 284 X. Lv, W. Wei, Q. Sun, F. Li, B. Huang, Y. Dai, Two-dimensional germanium monochalcogenides for photocatalytic water splitting with high carrier mobility, \"Appl. Catal., B\" 217 (2017) 275–284. [67] H. Li L. Xu X. Huang J. Ou-Yang M. Chen Y. Zhang S. Tang K. Dong L.-L. Wang Two-dimensional C3N/WS2 vdW heterojunction for direct Z-scheme photocatalytic overall water splitting Int. J. Hydrog. Energy 48 2023 2186 2199 H. Li, L. Xu, X. Huang, J. Ou-Yang, M. Chen, Y. Zhang, S. Tang, K. Dong, L.-L. Wang, Two-dimensional C3N/WS2 vdW heterojunction for direct Z-scheme photocatalytic overall water splitting, Int. J. Hydrogen Energy 48 (2023) 2186–2199. [68] J. Greeley I.E.L. Stephens A.S. Bondarenko T.P. Johansson H.A. Hansen T.F. Jaramillo J. Rossmeisl I. Chorkendorff J.K. Nørskov Alloys of platinum and early transition metals as oxygen reduction electrocatalysts Nat. Chem. 1 2009 552 556 J. Greeley, I.E.L. Stephens, A.S. Bondarenko, T.P. Johansson, H.A. Hansen, T.F. Jaramillo, J. Rossmeisl, I. Chorkendorff, J.K. Nørskov, Alloys of platinum and early transition metals as oxygen reduction electrocatalysts, Nat. Chem. 1 (2009) 552–556.",
      "scopus-id": "85178136284",
      "coredata": {
        "eid": "1-s2.0-S0926860X23004982",
        "dc:description": "Like group III-V materials, which have obviously broadened the scope of group IV family and enriched the semiconducting members, a lightest representative of group II−IV−V2 family, BeCN2 monolayer, as an isoelectronic counterpart to group III-V semiconductor has for long remained unsolved for its applications in HER/OER/ORR, although previous first-principles investigations have touched the configuration and existence toward multiple crystalline forms of BeCN2. Using density functional theory calculations, the stable BeCN2 monolayer is predicted to be a direct bandgap semiconductor with high ultraviolet light absorption, achieving photocatalytic overall water-splitting within full pH, whose photogenerated electrons/holes will provide an external potential to obviously reduce the overpotential of HER and even make it achieve a spontaneous OER within pH 0–14. Meanwhile, it presents significantly anisotropic and high carrier mobilities (104 order) with preferred electron/hole transport along the x/y-direction, providing rich and required charge sources for HER/OER/ORR. After TM-decoration, the catalytic activities are greatly enhanced, achieved by the low HER and OER/ORR overpotentials of 0.05/0.07 V for V/Co@BeCN2 and 0.79/0.43 V for Ni@BeCN2, respectively. Plus, under pH 0–14, the OER overpotential of Ni@BeCN2 can be completely overcome by the external potential provided by photogenerated holes, achieving bifunctional catalysis for OER and ORR. Particularly, the Ni-d orbital is evidently hybridized with the O-p orbital for OH*Ni@BeCN2, so that the initial lone electrons located at the anti-bonding orbital pair up can populate the downward bonding orbital, allowing the species *OH to be moderately adsorbed on Ni@BeCN2, and thus redound the performance of OER/ORR.",
        "openArchiveArticle": "false",
        "prism:coverDate": "2024-01-25",
        "openaccessUserLicense": null,
        "prism:aggregationType": "Journal",
        "prism:url": "https://api.elsevier.com/content/article/pii/S0926860X23004982",
        "dc:creator": [
          {
            "@_fa": "true",
            "$": "Zhang, Xihang"
          },
          {
            "@_fa": "true",
            "$": "Fang, Chunyao"
          },
          {
            "@_fa": "true",
            "$": "Zhang, Qiang"
          },
          {
            "@_fa": "true",
            "$": "Qin, Renxian"
          },
          {
            "@_fa": "true",
            "$": "Cui, Xiaomeng"
          },
          {
            "@_fa": "true",
            "$": "Lu, Yali"
          },
          {
            "@_fa": "true",
            "$": "Xu, Jingcheng"
          },
          {
            "@_fa": "true",
            "$": "Shi, Chenglong"
          }
        ],
        "link": [
          {
            "@_fa": "true",
            "@rel": "self",
            "@href": "https://api.elsevier.com/content/article/pii/S0926860X23004982"
          },
          {
            "@_fa": "true",
            "@rel": "scidir",
            "@href": "https://www.sciencedirect.com/science/article/pii/S0926860X23004982"
          }
        ],
        "dc:format": "application/json",
        "openaccessType": null,
        "pii": "S0926-860X(23)00498-2",
        "prism:volume": "670",
        "articleNumber": "119518",
        "prism:publisher": "Elsevier B.V.",
        "dc:title": "Designing an isoelectronic counterpart to group III-V semiconductors: A novel honeycomb BeCN2 monolayer with ultra-high mobility toward solar driven overall water splitting and bifunctional oxygen evolution/reduction reaction",
        "prism:copyright": "© 2023 Elsevier B.V. All rights reserved.",
        "openaccess": "0",
        "prism:issn": "0926860X",
        "dcterms:subject": [
          {
            "@_fa": "true",
            "$": "First-principles calculations"
          },
          {
            "@_fa": "true",
            "$": "Photocatalytic water splitting"
          },
          {
            "@_fa": "true",
            "$": "Hydrogen evolution reaction"
          },
          {
            "@_fa": "true",
            "$": "Oxygen evolution reaction"
          },
          {
            "@_fa": "true",
            "$": "Oxygen reduction reaction"
          }
        ],
        "openaccessArticle": "false",
        "prism:publicationName": "Applied Catalysis A: General",
        "openaccessSponsorType": null,
        "prism:pageRange": "119518",
        "pubType": "fla",
        "prism:coverDisplayDate": "25 January 2024",
        "prism:doi": "10.1016/j.apcata.2023.119518",
        "prism:startingPage": "119518",
        "dc:identifier": "doi:10.1016/j.apcata.2023.119518",
        "openaccessSponsorName": null
      },
      "objects": {
        "object": [
          {
            "@category": "standard",
            "@height": "200",
            "@width": "370",
            "@_fa": "true",
            "$": "https://api.elsevier.com/content/object/eid/1-s2.0-S0926860X23004982-ga1.jpg?httpAccept=%2A%2F%2A",
            "@multimediatype": "JPEG image file",
            "@type": "IMAGE-DOWNSAMPLED",
            "@size": "32613",
            "@ref": "ga1",
            "@mimetype": "image/jpeg"
          },
          {
            "@category": "standard",
            "@height": "510",
            "@width": "602",
            "@_fa": "true",
            "$": "https://api.elsevier.com/content/object/eid/1-s2.0-S0926860X23004982-gr11.jpg?httpAccept=%2A%2F%2A",
            "@multimediatype": "JPEG image file",
            "@type": "IMAGE-DOWNSAMPLED",
            "@size": "89326",
            "@ref": "gr11",
            "@mimetype": "image/jpeg"
          },
          {
            "@category": "standard",
            "@height": "512",
            "@width": "602",
            "@_fa": "true",
            "$": "https://api.elsevier.com/content/object/eid/1-s2.0-S0926860X23004982-gr10.jpg?httpAccept=%2A%2F%2A",
            "@multimediatype": "JPEG image file",
            "@type": "IMAGE-DOWNSAMPLED",
            "@size": "82434",
            "@ref": "gr10",
            "@mimetype": "image/jpeg"
          },
          {
            "@category": "standard",
            "@height": "446",
            "@width": "678",
            "@_fa": "true",
            "$": "https://api.elsevier.com/content/object/eid/1-s2.0-S0926860X23004982-gr5.jpg?httpAccept=%2A%2F%2A",
            "@multimediatype": "JPEG image file",
            "@type": "IMAGE-DOWNSAMPLED",
            "@size": "92330",
            "@ref": "gr5",
            "@mimetype": "image/jpeg"
          },
          {
            "@category": "standard",
            "@height": "553",
            "@width": "602",
            "@_fa": "true",
            "$": "https://api.elsevier.com/content/object/eid/1-s2.0-S0926860X23004982-gr6.jpg?httpAccept=%2A%2F%2A",
            "@multimediatype": "JPEG image file",
            "@type": "IMAGE-DOWNSAMPLED",
            "@size": "111339",
            "@ref": "gr6",
            "@mimetype": "image/jpeg"
          },
          {
            "@category": "standard",
            "@height": "612",
            "@width": "602",
            "@_fa": "true",
            "$": "https://api.elsevier.com/content/object/eid/1-s2.0-S0926860X23004982-gr3.jpg?httpAccept=%2A%2F%2A",
            "@multimediatype": "JPEG image file",
            "@type": "IMAGE-DOWNSAMPLED",
            "@size": "131045",
            "@ref": "gr3",
            "@mimetype": "image/jpeg"
          },
          {
            "@category": "standard",
            "@height": "774",
            "@width": "602",
            "@_fa": "true",
            "$": "https://api.elsevier.com/content/object/eid/1-s2.0-S0926860X23004982-gr4.jpg?httpAccept=%2A%2F%2A",
            "@multimediatype": "JPEG image file",
            "@type": "IMAGE-DOWNSAMPLED",
            "@size": "125327",
            "@ref": "gr4",
            "@mimetype": "image/jpeg"
          },
          {
            "@category": "standard",
            "@height": "703",
            "@width": "602",
            "@_fa": "true",
            "$": "https://api.elsevier.com/content/object/eid/1-s2.0-S0926860X23004982-gr1.jpg?httpAccept=%2A%2F%2A",
            "@multimediatype": "JPEG image file",
            "@type": "IMAGE-DOWNSAMPLED",
            "@size": "156157",
            "@ref": "gr1",
            "@mimetype": "image/jpeg"
          },
          {
            "@category": "standard",
            "@height": "503",
            "@width": "602",
            "@_fa": "true",
            "$": "https://api.elsevier.com/content/object/eid/1-s2.0-S0926860X23004982-gr2.jpg?httpAccept=%2A%2F%2A",
            "@multimediatype": "JPEG image file",
            "@type": "IMAGE-DOWNSAMPLED",
            "@size": "94471",
            "@ref": "gr2",
            "@mimetype": "image/jpeg"
          },
          {
            "@category": "standard",
            "@height": "804",
            "@width": "602",
            "@_fa": "true",
            "$": "https://api.elsevier.com/content/object/eid/1-s2.0-S0926860X23004982-gr12.jpg?httpAccept=%2A%2F%2A",
            "@multimediatype": "JPEG image file",
            "@type": "IMAGE-DOWNSAMPLED",
            "@size": "120988",
            "@ref": "gr12",
            "@mimetype": "image/jpeg"
          },
          {
            "@category": "standard",
            "@height": "704",
            "@width": "602",
            "@_fa": "true",
            "$": "https://api.elsevier.com/content/object/eid/1-s2.0-S0926860X23004982-gr9.jpg?httpAccept=%2A%2F%2A",
            "@multimediatype": "JPEG image file",
            "@type": "IMAGE-DOWNSAMPLED",
            "@size": "112215",
            "@ref": "gr9",
            "@mimetype": "image/jpeg"
          },
          {
            "@category": "standard",
            "@height": "463",
            "@width": "602",
            "@_fa": "true",
            "$": "https://api.elsevier.com/content/object/eid/1-s2.0-S0926860X23004982-gr7.jpg?httpAccept=%2A%2F%2A",
            "@multimediatype": "JPEG image file",
            "@type": "IMAGE-DOWNSAMPLED",
            "@size": "75966",
            "@ref": "gr7",
            "@mimetype": "image/jpeg"
          },
          {
            "@category": "standard",
            "@height": "501",
            "@width": "602",
            "@_fa": "true",
            "$": "https://api.elsevier.com/content/object/eid/1-s2.0-S0926860X23004982-gr8.jpg?httpAccept=%2A%2F%2A",
            "@multimediatype": "JPEG image file",
            "@type": "IMAGE-DOWNSAMPLED",
            "@size": "76442",
            "@ref": "gr8",
            "@mimetype": "image/jpeg"
          },
          {
            "@category": "thumbnail",
            "@height": "118",
            "@width": "219",
            "@_fa": "true",
            "$": "https://api.elsevier.com/content/object/eid/1-s2.0-S0926860X23004982-ga1.sml?httpAccept=%2A%2F%2A",
            "@multimediatype": "GIF image file",
            "@type": "IMAGE-THUMBNAIL",
            "@size": "21607",
            "@ref": "ga1",
            "@mimetype": "image/gif"
          },
          {
            "@category": "thumbnail",
            "@height": "164",
            "@width": "193",
            "@_fa": "true",
            "$": "https://api.elsevier.com/content/object/eid/1-s2.0-S0926860X23004982-gr11.sml?httpAccept=%2A%2F%2A",
            "@multimediatype": "GIF image file",
            "@type": "IMAGE-THUMBNAIL",
            "@size": "17501",
            "@ref": "gr11",
            "@mimetype": "image/gif"
          },
          {
            "@category": "thumbnail",
            "@height": "163",
            "@width": "192",
            "@_fa": "true",
            "$": "https://api.elsevier.com/content/object/eid/1-s2.0-S0926860X23004982-gr10.sml?httpAccept=%2A%2F%2A",
            "@multimediatype": "GIF image file",
            "@type": "IMAGE-THUMBNAIL",
            "@size": "15968",
            "@ref": "gr10",
            "@mimetype": "image/gif"
          },
          {
            "@category": "thumbnail",
            "@height": "144",
            "@width": "219",
            "@_fa": "true",
            "$": "https://api.elsevier.com/content/object/eid/1-s2.0-S0926860X23004982-gr5.sml?httpAccept=%2A%2F%2A",
            "@multimediatype": "GIF image file",
            "@type": "IMAGE-THUMBNAIL",
            "@size": "18914",
            "@ref": "gr5",
            "@mimetype": "image/gif"
          },
          {
            "@category": "thumbnail",
            "@height": "163",
            "@width": "178",
            "@_fa": "true",
            "$": "https://api.elsevier.com/content/object/eid/1-s2.0-S0926860X23004982-gr6.sml?httpAccept=%2A%2F%2A",
            "@multimediatype": "GIF image file",
            "@type": "IMAGE-THUMBNAIL",
            "@size": "19491",
            "@ref": "gr6",
            "@mimetype": "image/gif"
          },
          {
            "@category": "thumbnail",
            "@height": "164",
            "@width": "161",
            "@_fa": "true",
            "$": "https://api.elsevier.com/content/object/eid/1-s2.0-S0926860X23004982-gr3.sml?httpAccept=%2A%2F%2A",
            "@multimediatype": "GIF image file",
            "@type": "IMAGE-THUMBNAIL",
            "@size": "14897",
            "@ref": "gr3",
            "@mimetype": "image/gif"
          },
          {
            "@category": "thumbnail",
            "@height": "163",
            "@width": "127",
            "@_fa": "true",
            "$": "https://api.elsevier.com/content/object/eid/1-s2.0-S0926860X23004982-gr4.sml?httpAccept=%2A%2F%2A",
            "@multimediatype": "GIF image file",
            "@type": "IMAGE-THUMBNAIL",
            "@size": "12224",
            "@ref": "gr4",
            "@mimetype": "image/gif"
          },
          {
            "@category": "thumbnail",
            "@height": "164",
            "@width": "140",
            "@_fa": "true",
            "$": "https://api.elsevier.com/content/object/eid/1-s2.0-S0926860X23004982-gr1.sml?httpAccept=%2A%2F%2A",
            "@multimediatype": "GIF image file",
            "@type": "IMAGE-THUMBNAIL",
            "@size": "14781",
            "@ref": "gr1",
            "@mimetype": "image/gif"
          },
          {
            "@category": "thumbnail",
            "@height": "164",
            "@width": "196",
            "@_fa": "true",
            "$": "https://api.elsevier.com/content/object/eid/1-s2.0-S0926860X23004982-gr2.sml?httpAccept=%2A%2F%2A",
            "@multimediatype": "GIF image file",
            "@type": "IMAGE-THUMBNAIL",
            "@size": "17583",
            "@ref": "gr2",
            "@mimetype": "image/gif"
          },
          {
            "@category": "thumbnail",
            "@height": "163",
            "@width": "122",
            "@_fa": "true",
            "$": "https://api.elsevier.com/content/object/eid/1-s2.0-S0926860X23004982-gr12.sml?httpAccept=%2A%2F%2A",
            "@multimediatype": "GIF image file",
            "@type": "IMAGE-THUMBNAIL",
            "@size": "12668",
            "@ref": "gr12",
            "@mimetype": "image/gif"
          },
          {
            "@category": "thumbnail",
            "@height": "164",
            "@width": "140",
            "@_fa": "true",
            "$": "https://api.elsevier.com/content/object/eid/1-s2.0-S0926860X23004982-gr9.sml?httpAccept=%2A%2F%2A",
            "@multimediatype": "GIF image file",
            "@type": "IMAGE-THUMBNAIL",
            "@size": "13910",
            "@ref": "gr9",
            "@mimetype": "image/gif"
          },
          {
            "@category": "thumbnail",
            "@height": "164",
            "@width": "213",
            "@_fa": "true",
            "$": "https://api.elsevier.com/content/object/eid/1-s2.0-S0926860X23004982-gr7.sml?httpAccept=%2A%2F%2A",
            "@multimediatype": "GIF image file",
            "@type": "IMAGE-THUMBNAIL",
            "@size": "16402",
            "@ref": "gr7",
            "@mimetype": "image/gif"
          },
          {
            "@category": "thumbnail",
            "@height": "164",
            "@width": "197",
            "@_fa": "true",
            "$": "https://api.elsevier.com/content/object/eid/1-s2.0-S0926860X23004982-gr8.sml?httpAccept=%2A%2F%2A",
            "@multimediatype": "GIF image file",
            "@type": "IMAGE-THUMBNAIL",
            "@size": "15848",
            "@ref": "gr8",
            "@mimetype": "image/gif"
          },
          {
            "@category": "high",
            "@height": "886",
            "@width": "1638",
            "@_fa": "true",
            "$": "https://api.elsevier.com/content/object/eid/1-s2.0-S0926860X23004982-ga1_lrg.jpg?httpAccept=%2A%2F%2A",
            "@multimediatype": "JPEG image file",
            "@type": "IMAGE-HIGH-RES",
            "@size": "277095",
            "@ref": "ga1",
            "@mimetype": "image/jpeg"
          },
          {
            "@category": "high",
            "@height": "2255",
            "@width": "2661",
            "@_fa": "true",
            "$": "https://api.elsevier.com/content/object/eid/1-s2.0-S0926860X23004982-gr11_lrg.jpg?httpAccept=%2A%2F%2A",
            "@multimediatype": "JPEG image file",
            "@type": "IMAGE-HIGH-RES",
            "@size": "459154",
            "@ref": "gr11",
            "@mimetype": "image/jpeg"
          },
          {
            "@category": "high",
            "@height": "2265",
            "@width": "2661",
            "@_fa": "true",
            "$": "https://api.elsevier.com/content/object/eid/1-s2.0-S0926860X23004982-gr10_lrg.jpg?httpAccept=%2A%2F%2A",
            "@multimediatype": "JPEG image file",
            "@type": "IMAGE-HIGH-RES",
            "@size": "474202",
            "@ref": "gr10",
            "@mimetype": "image/jpeg"
          },
          {
            "@category": "high",
            "@height": "1970",
            "@width": "2994",
            "@_fa": "true",
            "$": "https://api.elsevier.com/content/object/eid/1-s2.0-S0926860X23004982-gr5_lrg.jpg?httpAccept=%2A%2F%2A",
            "@multimediatype": "JPEG image file",
            "@type": "IMAGE-HIGH-RES",
            "@size": "474235",
            "@ref": "gr5",
            "@mimetype": "image/jpeg"
          },
          {
            "@category": "high",
            "@height": "2443",
            "@width": "2661",
            "@_fa": "true",
            "$": "https://api.elsevier.com/content/object/eid/1-s2.0-S0926860X23004982-gr6_lrg.jpg?httpAccept=%2A%2F%2A",
            "@multimediatype": "JPEG image file",
            "@type": "IMAGE-HIGH-RES",
            "@size": "553653",
            "@ref": "gr6",
            "@mimetype": "image/jpeg"
          },
          {
            "@category": "high",
            "@height": "2706",
            "@width": "2661",
            "@_fa": "true",
            "$": "https://api.elsevier.com/content/object/eid/1-s2.0-S0926860X23004982-gr3_lrg.jpg?httpAccept=%2A%2F%2A",
            "@multimediatype": "JPEG image file",
            "@type": "IMAGE-HIGH-RES",
            "@size": "690854",
            "@ref": "gr3",
            "@mimetype": "image/jpeg"
          },
          {
            "@category": "high",
            "@height": "3420",
            "@width": "2661",
            "@_fa": "true",
            "$": "https://api.elsevier.com/content/object/eid/1-s2.0-S0926860X23004982-gr4_lrg.jpg?httpAccept=%2A%2F%2A",
            "@multimediatype": "JPEG image file",
            "@type": "IMAGE-HIGH-RES",
            "@size": "636588",
            "@ref": "gr4",
            "@mimetype": "image/jpeg"
          },
          {
            "@category": "high",
            "@height": "3109",
            "@width": "2661",
            "@_fa": "true",
            "$": "https://api.elsevier.com/content/object/eid/1-s2.0-S0926860X23004982-gr1_lrg.jpg?httpAccept=%2A%2F%2A",
            "@multimediatype": "JPEG image file",
            "@type": "IMAGE-HIGH-RES",
            "@size": "855677",
            "@ref": "gr1",
            "@mimetype": "image/jpeg"
          },
          {
            "@category": "high",
            "@height": "2223",
            "@width": "2661",
            "@_fa": "true",
            "$": "https://api.elsevier.com/content/object/eid/1-s2.0-S0926860X23004982-gr2_lrg.jpg?httpAccept=%2A%2F%2A",
            "@multimediatype": "JPEG image file",
            "@type": "IMAGE-HIGH-RES",
            "@size": "482265",
            "@ref": "gr2",
            "@mimetype": "image/jpeg"
          },
          {
            "@category": "high",
            "@height": "3554",
            "@width": "2661",
            "@_fa": "true",
            "$": "https://api.elsevier.com/content/object/eid/1-s2.0-S0926860X23004982-gr12_lrg.jpg?httpAccept=%2A%2F%2A",
            "@multimediatype": "JPEG image file",
            "@type": "IMAGE-HIGH-RES",
            "@size": "599559",
            "@ref": "gr12",
            "@mimetype": "image/jpeg"
          },
          {
            "@category": "high",
            "@height": "3110",
            "@width": "2661",
            "@_fa": "true",
            "$": "https://api.elsevier.com/content/object/eid/1-s2.0-S0926860X23004982-gr9_lrg.jpg?httpAccept=%2A%2F%2A",
            "@multimediatype": "JPEG image file",
            "@type": "IMAGE-HIGH-RES",
            "@size": "603398",
            "@ref": "gr9",
            "@mimetype": "image/jpeg"
          },
          {
            "@category": "high",
            "@height": "2047",
            "@width": "2661",
            "@_fa": "true",
            "$": "https://api.elsevier.com/content/object/eid/1-s2.0-S0926860X23004982-gr7_lrg.jpg?httpAccept=%2A%2F%2A",
            "@multimediatype": "JPEG image file",
            "@type": "IMAGE-HIGH-RES",
            "@size": "411478",
            "@ref": "gr7",
            "@mimetype": "image/jpeg"
          },
          {
            "@category": "high",
            "@height": "2216",
            "@width": "2661",
            "@_fa": "true",
            "$": "https://api.elsevier.com/content/object/eid/1-s2.0-S0926860X23004982-gr8_lrg.jpg?httpAccept=%2A%2F%2A",
            "@multimediatype": "JPEG image file",
            "@type": "IMAGE-HIGH-RES",
            "@size": "446017",
            "@ref": "gr8",
            "@mimetype": "image/jpeg"
          },
          {
            "@category": "standard",
            "@_fa": "true",
            "$": "https://api.elsevier.com/content/object/eid/1-s2.0-S0926860X23004982-mmc1.pdf?httpAccept=%2A%2F%2A",
            "@multimediatype": "Acrobat PDF file",
            "@type": "APPLICATION",
            "@size": "6499126",
            "@ref": "mmc1",
            "@mimetype": "application/pdf"
          },
          {
            "@category": "thumbnail",
            "@_fa": "true",
            "$": "https://api.elsevier.com/content/object/eid/1-s2.0-S0926860X23004982-si0001.svg?httpAccept=%2A%2F%2A",
            "@multimediatype": "Scalable Vector Graphics file",
            "@type": "ALTIMG",
            "@size": "1053",
            "@ref": "si0001",
            "@mimetype": "image/svg+xml"
          },
          {
            "@category": "thumbnail",
            "@_fa": "true",
            "$": "https://api.elsevier.com/content/object/eid/1-s2.0-S0926860X23004982-si0002.svg?httpAccept=%2A%2F%2A",
            "@multimediatype": "Scalable Vector Graphics file",
            "@type": "ALTIMG",
            "@size": "1361",
            "@ref": "si0002",
            "@mimetype": "image/svg+xml"
          },
          {
            "@category": "thumbnail",
            "@_fa": "true",
            "$": "https://api.elsevier.com/content/object/eid/1-s2.0-S0926860X23004982-si0003.svg?httpAccept=%2A%2F%2A",
            "@multimediatype": "Scalable Vector Graphics file",
            "@type": "ALTIMG",
            "@size": "1361",
            "@ref": "si0003",
            "@mimetype": "image/svg+xml"
          },
          {
            "@category": "thumbnail",
            "@_fa": "true",
            "$": "https://api.elsevier.com/content/object/eid/1-s2.0-S0926860X23004982-si0004.svg?httpAccept=%2A%2F%2A",
            "@multimediatype": "Scalable Vector Graphics file",
            "@type": "ALTIMG",
            "@size": "1337",
            "@ref": "si0004",
            "@mimetype": "image/svg+xml"
          },
          {
            "@category": "thumbnail",
            "@_fa": "true",
            "$": "https://api.elsevier.com/content/object/eid/1-s2.0-S0926860X23004982-si0005.svg?httpAccept=%2A%2F%2A",
            "@multimediatype": "Scalable Vector Graphics file",
            "@type": "ALTIMG",
            "@size": "1491",
            "@ref": "si0005",
            "@mimetype": "image/svg+xml"
          },
          {
            "@category": "thumbnail",
            "@_fa": "true",
            "$": "https://api.elsevier.com/content/object/eid/1-s2.0-S0926860X23004982-si0006.svg?httpAccept=%2A%2F%2A",
            "@multimediatype": "Scalable Vector Graphics file",
            "@type": "ALTIMG",
            "@size": "1953",
            "@ref": "si0006",
            "@mimetype": "image/svg+xml"
          },
          {
            "@category": "thumbnail",
            "@_fa": "true",
            "$": "https://api.elsevier.com/content/object/eid/1-s2.0-S0926860X23004982-si0007.svg?httpAccept=%2A%2F%2A",
            "@multimediatype": "Scalable Vector Graphics file",
            "@type": "ALTIMG",
            "@size": "1300",
            "@ref": "si0007",
            "@mimetype": "image/svg+xml"
          },
          {
            "@category": "thumbnail",
            "@_fa": "true",
            "$": "https://api.elsevier.com/content/object/eid/1-s2.0-S0926860X23004982-si0008.svg?httpAccept=%2A%2F%2A",
            "@multimediatype": "Scalable Vector Graphics file",
            "@type": "ALTIMG",
            "@size": "1361",
            "@ref": "si0008",
            "@mimetype": "image/svg+xml"
          },
          {
            "@category": "thumbnail",
            "@_fa": "true",
            "$": "https://api.elsevier.com/content/object/eid/1-s2.0-S0926860X23004982-si0009.svg?httpAccept=%2A%2F%2A",
            "@multimediatype": "Scalable Vector Graphics file",
            "@type": "ALTIMG",
            "@size": "1397",
            "@ref": "si0009",
            "@mimetype": "image/svg+xml"
          },
          {
            "@category": "thumbnail",
            "@_fa": "true",
            "$": "https://api.elsevier.com/content/object/eid/1-s2.0-S0926860X23004982-si0010.svg?httpAccept=%2A%2F%2A",
            "@multimediatype": "Scalable Vector Graphics file",
            "@type": "ALTIMG",
            "@size": "1085",
            "@ref": "si0010",
            "@mimetype": "image/svg+xml"
          },
          {
            "@category": "thumbnail",
            "@_fa": "true",
            "$": "https://api.elsevier.com/content/object/eid/1-s2.0-S0926860X23004982-si0011.svg?httpAccept=%2A%2F%2A",
            "@multimediatype": "Scalable Vector Graphics file",
            "@type": "ALTIMG",
            "@size": "1174",
            "@ref": "si0011",
            "@mimetype": "image/svg+xml"
          },
          {
            "@category": "thumbnail",
            "@_fa": "true",
            "$": "https://api.elsevier.com/content/object/eid/1-s2.0-S0926860X23004982-si0012.svg?httpAccept=%2A%2F%2A",
            "@multimediatype": "Scalable Vector Graphics file",
            "@type": "ALTIMG",
            "@size": "1126",
            "@ref": "si0012",
            "@mimetype": "image/svg+xml"
          },
          {
            "@category": "thumbnail",
            "@_fa": "true",
            "$": "https://api.elsevier.com/content/object/eid/1-s2.0-S0926860X23004982-si0013.svg?httpAccept=%2A%2F%2A",
            "@multimediatype": "Scalable Vector Graphics file",
            "@type": "ALTIMG",
            "@size": "1316",
            "@ref": "si0013",
            "@mimetype": "image/svg+xml"
          },
          {
            "@category": "thumbnail",
            "@_fa": "true",
            "$": "https://api.elsevier.com/content/object/eid/1-s2.0-S0926860X23004982-si0014.svg?httpAccept=%2A%2F%2A",
            "@multimediatype": "Scalable Vector Graphics file",
            "@type": "ALTIMG",
            "@size": "1077",
            "@ref": "si0014",
            "@mimetype": "image/svg+xml"
          },
          {
            "@category": "thumbnail",
            "@_fa": "true",
            "$": "https://api.elsevier.com/content/object/eid/1-s2.0-S0926860X23004982-si0015.svg?httpAccept=%2A%2F%2A",
            "@multimediatype": "Scalable Vector Graphics file",
            "@type": "ALTIMG",
            "@size": "1174",
            "@ref": "si0015",
            "@mimetype": "image/svg+xml"
          },
          {
            "@category": "thumbnail",
            "@_fa": "true",
            "$": "https://api.elsevier.com/content/object/eid/1-s2.0-S0926860X23004982-si0016.svg?httpAccept=%2A%2F%2A",
            "@multimediatype": "Scalable Vector Graphics file",
            "@type": "ALTIMG",
            "@size": "1114",
            "@ref": "si0016",
            "@mimetype": "image/svg+xml"
          },
          {
            "@category": "thumbnail",
            "@_fa": "true",
            "$": "https://api.elsevier.com/content/object/eid/1-s2.0-S0926860X23004982-si0017.svg?httpAccept=%2A%2F%2A",
            "@multimediatype": "Scalable Vector Graphics file",
            "@type": "ALTIMG",
            "@size": "1316",
            "@ref": "si0017",
            "@mimetype": "image/svg+xml"
          },
          {
            "@category": "thumbnail",
            "@_fa": "true",
            "$": "https://api.elsevier.com/content/object/eid/1-s2.0-S0926860X23004982-si0018.svg?httpAccept=%2A%2F%2A",
            "@multimediatype": "Scalable Vector Graphics file",
            "@type": "ALTIMG",
            "@size": "1142",
            "@ref": "si0018",
            "@mimetype": "image/svg+xml"
          },
          {
            "@category": "thumbnail",
            "@_fa": "true",
            "$": "https://api.elsevier.com/content/object/eid/1-s2.0-S0926860X23004982-si0019.svg?httpAccept=%2A%2F%2A",
            "@multimediatype": "Scalable Vector Graphics file",
            "@type": "ALTIMG",
            "@size": "1174",
            "@ref": "si0019",
            "@mimetype": "image/svg+xml"
          },
          {
            "@category": "thumbnail",
            "@_fa": "true",
            "$": "https://api.elsevier.com/content/object/eid/1-s2.0-S0926860X23004982-si0020.svg?httpAccept=%2A%2F%2A",
            "@multimediatype": "Scalable Vector Graphics file",
            "@type": "ALTIMG",
            "@size": "1114",
            "@ref": "si0020",
            "@mimetype": "image/svg+xml"
          },
          {
            "@category": "thumbnail",
            "@_fa": "true",
            "$": "https://api.elsevier.com/content/object/eid/1-s2.0-S0926860X23004982-si0021.svg?httpAccept=%2A%2F%2A",
            "@multimediatype": "Scalable Vector Graphics file",
            "@type": "ALTIMG",
            "@size": "1316",
            "@ref": "si0021",
            "@mimetype": "image/svg+xml"
          },
          {
            "@category": "thumbnail",
            "@_fa": "true",
            "$": "https://api.elsevier.com/content/object/eid/1-s2.0-S0926860X23004982-si0022.svg?httpAccept=%2A%2F%2A",
            "@multimediatype": "Scalable Vector Graphics file",
            "@type": "ALTIMG",
            "@size": "1174",
            "@ref": "si0022",
            "@mimetype": "image/svg+xml"
          },
          {
            "@category": "thumbnail",
            "@_fa": "true",
            "$": "https://api.elsevier.com/content/object/eid/1-s2.0-S0926860X23004982-si0023.svg?httpAccept=%2A%2F%2A",
            "@multimediatype": "Scalable Vector Graphics file",
            "@type": "ALTIMG",
            "@size": "1491",
            "@ref": "si0023",
            "@mimetype": "image/svg+xml"
          },
          {
            "@category": "thumbnail",
            "@_fa": "true",
            "$": "https://api.elsevier.com/content/object/eid/1-s2.0-S0926860X23004982-si0024.svg?httpAccept=%2A%2F%2A",
            "@multimediatype": "Scalable Vector Graphics file",
            "@type": "ALTIMG",
            "@size": "1077",
            "@ref": "si0024",
            "@mimetype": "image/svg+xml"
          },
          {
            "@category": "thumbnail",
            "@_fa": "true",
            "$": "https://api.elsevier.com/content/object/eid/1-s2.0-S0926860X23004982-si0025.svg?httpAccept=%2A%2F%2A",
            "@multimediatype": "Scalable Vector Graphics file",
            "@type": "ALTIMG",
            "@size": "1110",
            "@ref": "si0025",
            "@mimetype": "image/svg+xml"
          },
          {
            "@category": "thumbnail",
            "@_fa": "true",
            "$": "https://api.elsevier.com/content/object/eid/1-s2.0-S0926860X23004982-si0026.svg?httpAccept=%2A%2F%2A",
            "@multimediatype": "Scalable Vector Graphics file",
            "@type": "ALTIMG",
            "@size": "1511",
            "@ref": "si0026",
            "@mimetype": "image/svg+xml"
          },
          {
            "@category": "thumbnail",
            "@_fa": "true",
            "$": "https://api.elsevier.com/content/object/eid/1-s2.0-S0926860X23004982-si0027.svg?httpAccept=%2A%2F%2A",
            "@multimediatype": "Scalable Vector Graphics file",
            "@type": "ALTIMG",
            "@size": "1507",
            "@ref": "si0027",
            "@mimetype": "image/svg+xml"
          },
          {
            "@category": "thumbnail",
            "@_fa": "true",
            "$": "https://api.elsevier.com/content/object/eid/1-s2.0-S0926860X23004982-si0028.svg?httpAccept=%2A%2F%2A",
            "@multimediatype": "Scalable Vector Graphics file",
            "@type": "ALTIMG",
            "@size": "1661",
            "@ref": "si0028",
            "@mimetype": "image/svg+xml"
          },
          {
            "@category": "thumbnail",
            "@_fa": "true",
            "$": "https://api.elsevier.com/content/object/eid/1-s2.0-S0926860X23004982-si0029.svg?httpAccept=%2A%2F%2A",
            "@multimediatype": "Scalable Vector Graphics file",
            "@type": "ALTIMG",
            "@size": "976",
            "@ref": "si0029",
            "@mimetype": "image/svg+xml"
          },
          {
            "@category": "thumbnail",
            "@_fa": "true",
            "$": "https://api.elsevier.com/content/object/eid/1-s2.0-S0926860X23004982-si0030.svg?httpAccept=%2A%2F%2A",
            "@multimediatype": "Scalable Vector Graphics file",
            "@type": "ALTIMG",
            "@size": "1118",
            "@ref": "si0030",
            "@mimetype": "image/svg+xml"
          },
          {
            "@category": "thumbnail",
            "@_fa": "true",
            "$": "https://api.elsevier.com/content/object/eid/1-s2.0-S0926860X23004982-si0031.svg?httpAccept=%2A%2F%2A",
            "@multimediatype": "Scalable Vector Graphics file",
            "@type": "ALTIMG",
            "@size": "1179",
            "@ref": "si0031",
            "@mimetype": "image/svg+xml"
          },
          {
            "@category": "thumbnail",
            "@_fa": "true",
            "$": "https://api.elsevier.com/content/object/eid/1-s2.0-S0926860X23004982-si0032.svg?httpAccept=%2A%2F%2A",
            "@multimediatype": "Scalable Vector Graphics file",
            "@type": "ALTIMG",
            "@size": "1215",
            "@ref": "si0032",
            "@mimetype": "image/svg+xml"
          },
          {
            "@category": "thumbnail",
            "@_fa": "true",
            "$": "https://api.elsevier.com/content/object/eid/1-s2.0-S0926860X23004982-si0033.svg?httpAccept=%2A%2F%2A",
            "@multimediatype": "Scalable Vector Graphics file",
            "@type": "ALTIMG",
            "@size": "1243",
            "@ref": "si0033",
            "@mimetype": "image/svg+xml"
          },
          {
            "@category": "thumbnail",
            "@_fa": "true",
            "$": "https://api.elsevier.com/content/object/eid/1-s2.0-S0926860X23004982-si0034.svg?httpAccept=%2A%2F%2A",
            "@multimediatype": "Scalable Vector Graphics file",
            "@type": "ALTIMG",
            "@size": "1320",
            "@ref": "si0034",
            "@mimetype": "image/svg+xml"
          },
          {
            "@category": "thumbnail",
            "@_fa": "true",
            "$": "https://api.elsevier.com/content/object/eid/1-s2.0-S0926860X23004982-si0035.svg?httpAccept=%2A%2F%2A",
            "@multimediatype": "Scalable Vector Graphics file",
            "@type": "ALTIMG",
            "@size": "1847",
            "@ref": "si0035",
            "@mimetype": "image/svg+xml"
          },
          {
            "@category": "thumbnail",
            "@_fa": "true",
            "$": "https://api.elsevier.com/content/object/eid/1-s2.0-S0926860X23004982-si0036.svg?httpAccept=%2A%2F%2A",
            "@multimediatype": "Scalable Vector Graphics file",
            "@type": "ALTIMG",
            "@size": "1458",
            "@ref": "si0036",
            "@mimetype": "image/svg+xml"
          },
          {
            "@category": "thumbnail",
            "@_fa": "true",
            "$": "https://api.elsevier.com/content/object/eid/1-s2.0-S0926860X23004982-si0037.svg?httpAccept=%2A%2F%2A",
            "@multimediatype": "Scalable Vector Graphics file",
            "@type": "ALTIMG",
            "@size": "2192",
            "@ref": "si0037",
            "@mimetype": "image/svg+xml"
          },
          {
            "@category": "thumbnail",
            "@_fa": "true",
            "$": "https://api.elsevier.com/content/object/eid/1-s2.0-S0926860X23004982-si0038.svg?httpAccept=%2A%2F%2A",
            "@multimediatype": "Scalable Vector Graphics file",
            "@type": "ALTIMG",
            "@size": "1636",
            "@ref": "si0038",
            "@mimetype": "image/svg+xml"
          },
          {
            "@category": "thumbnail",
            "@_fa": "true",
            "$": "https://api.elsevier.com/content/object/eid/1-s2.0-S0926860X23004982-si0039.svg?httpAccept=%2A%2F%2A",
            "@multimediatype": "Scalable Vector Graphics file",
            "@type": "ALTIMG",
            "@size": "1636",
            "@ref": "si0039",
            "@mimetype": "image/svg+xml"
          },
          {
            "@category": "thumbnail",
            "@_fa": "true",
            "$": "https://api.elsevier.com/content/object/eid/1-s2.0-S0926860X23004982-si0040.svg?httpAccept=%2A%2F%2A",
            "@multimediatype": "Scalable Vector Graphics file",
            "@type": "ALTIMG",
            "@size": "1324",
            "@ref": "si0040",
            "@mimetype": "image/svg+xml"
          },
          {
            "@category": "thumbnail",
            "@_fa": "true",
            "$": "https://api.elsevier.com/content/object/eid/1-s2.0-S0926860X23004982-si0041.svg?httpAccept=%2A%2F%2A",
            "@multimediatype": "Scalable Vector Graphics file",
            "@type": "ALTIMG",
            "@size": "1268",
            "@ref": "si0041",
            "@mimetype": "image/svg+xml"
          },
          {
            "@category": "thumbnail",
            "@_fa": "true",
            "$": "https://api.elsevier.com/content/object/eid/1-s2.0-S0926860X23004982-si0042.svg?httpAccept=%2A%2F%2A",
            "@multimediatype": "Scalable Vector Graphics file",
            "@type": "ALTIMG",
            "@size": "1324",
            "@ref": "si0042",
            "@mimetype": "image/svg+xml"
          },
          {
            "@category": "thumbnail",
            "@_fa": "true",
            "$": "https://api.elsevier.com/content/object/eid/1-s2.0-S0926860X23004982-si0043.svg?httpAccept=%2A%2F%2A",
            "@multimediatype": "Scalable Vector Graphics file",
            "@type": "ALTIMG",
            "@size": "1353",
            "@ref": "si0043",
            "@mimetype": "image/svg+xml"
          },
          {
            "@category": "thumbnail",
            "@_fa": "true",
            "$": "https://api.elsevier.com/content/object/eid/1-s2.0-S0926860X23004982-si0044.svg?httpAccept=%2A%2F%2A",
            "@multimediatype": "Scalable Vector Graphics file",
            "@type": "ALTIMG",
            "@size": "1268",
            "@ref": "si0044",
            "@mimetype": "image/svg+xml"
          },
          {
            "@category": "thumbnail",
            "@_fa": "true",
            "$": "https://api.elsevier.com/content/object/eid/1-s2.0-S0926860X23004982-si0045.svg?httpAccept=%2A%2F%2A",
            "@multimediatype": "Scalable Vector Graphics file",
            "@type": "ALTIMG",
            "@size": "1170",
            "@ref": "si0045",
            "@mimetype": "image/svg+xml"
          },
          {
            "@category": "thumbnail",
            "@_fa": "true",
            "$": "https://api.elsevier.com/content/object/eid/1-s2.0-S0926860X23004982-si0046.svg?httpAccept=%2A%2F%2A",
            "@multimediatype": "Scalable Vector Graphics file",
            "@type": "ALTIMG",
            "@size": "1170",
            "@ref": "si0046",
            "@mimetype": "image/svg+xml"
          },
          {
            "@category": "thumbnail",
            "@_fa": "true",
            "$": "https://api.elsevier.com/content/object/eid/1-s2.0-S0926860X23004982-si0047.svg?httpAccept=%2A%2F%2A",
            "@multimediatype": "Scalable Vector Graphics file",
            "@type": "ALTIMG",
            "@size": "1203",
            "@ref": "si0047",
            "@mimetype": "image/svg+xml"
          },
          {
            "@category": "thumbnail",
            "@_fa": "true",
            "$": "https://api.elsevier.com/content/object/eid/1-s2.0-S0926860X23004982-si0048.svg?httpAccept=%2A%2F%2A",
            "@multimediatype": "Scalable Vector Graphics file",
            "@type": "ALTIMG",
            "@size": "1170",
            "@ref": "si0048",
            "@mimetype": "image/svg+xml"
          },
          {
            "@category": "thumbnail",
            "@_fa": "true",
            "$": "https://api.elsevier.com/content/object/eid/1-s2.0-S0926860X23004982-si0049.svg?httpAccept=%2A%2F%2A",
            "@multimediatype": "Scalable Vector Graphics file",
            "@type": "ALTIMG",
            "@size": "1150",
            "@ref": "si0049",
            "@mimetype": "image/svg+xml"
          },
          {
            "@category": "thumbnail",
            "@_fa": "true",
            "$": "https://api.elsevier.com/content/object/eid/1-s2.0-S0926860X23004982-si0050.svg?httpAccept=%2A%2F%2A",
            "@multimediatype": "Scalable Vector Graphics file",
            "@type": "ALTIMG",
            "@size": "1150",
            "@ref": "si0050",
            "@mimetype": "image/svg+xml"
          },
          {
            "@category": "thumbnail",
            "@_fa": "true",
            "$": "https://api.elsevier.com/content/object/eid/1-s2.0-S0926860X23004982-si0051.svg?httpAccept=%2A%2F%2A",
            "@multimediatype": "Scalable Vector Graphics file",
            "@type": "ALTIMG",
            "@size": "1203",
            "@ref": "si0051",
            "@mimetype": "image/svg+xml"
          },
          {
            "@category": "thumbnail",
            "@_fa": "true",
            "$": "https://api.elsevier.com/content/object/eid/1-s2.0-S0926860X23004982-si0052.svg?httpAccept=%2A%2F%2A",
            "@multimediatype": "Scalable Vector Graphics file",
            "@type": "ALTIMG",
            "@size": "1170",
            "@ref": "si0052",
            "@mimetype": "image/svg+xml"
          },
          {
            "@category": "thumbnail",
            "@_fa": "true",
            "$": "https://api.elsevier.com/content/object/eid/1-s2.0-S0926860X23004982-si0053.svg?httpAccept=%2A%2F%2A",
            "@multimediatype": "Scalable Vector Graphics file",
            "@type": "ALTIMG",
            "@size": "1150",
            "@ref": "si0053",
            "@mimetype": "image/svg+xml"
          },
          {
            "@category": "thumbnail",
            "@_fa": "true",
            "$": "https://api.elsevier.com/content/object/eid/1-s2.0-S0926860X23004982-si0054.svg?httpAccept=%2A%2F%2A",
            "@multimediatype": "Scalable Vector Graphics file",
            "@type": "ALTIMG",
            "@size": "1150",
            "@ref": "si0054",
            "@mimetype": "image/svg+xml"
          },
          {
            "@category": "thumbnail",
            "@_fa": "true",
            "$": "https://api.elsevier.com/content/object/eid/1-s2.0-S0926860X23004982-si0055.svg?httpAccept=%2A%2F%2A",
            "@multimediatype": "Scalable Vector Graphics file",
            "@type": "ALTIMG",
            "@size": "1203",
            "@ref": "si0055",
            "@mimetype": "image/svg+xml"
          },
          {
            "@category": "thumbnail",
            "@_fa": "true",
            "$": "https://api.elsevier.com/content/object/eid/1-s2.0-S0926860X23004982-si0056.svg?httpAccept=%2A%2F%2A",
            "@multimediatype": "Scalable Vector Graphics file",
            "@type": "ALTIMG",
            "@size": "1170",
            "@ref": "si0056",
            "@mimetype": "image/svg+xml"
          },
          {
            "@category": "thumbnail",
            "@_fa": "true",
            "$": "https://api.elsevier.com/content/object/eid/1-s2.0-S0926860X23004982-si0057.svg?httpAccept=%2A%2F%2A",
            "@multimediatype": "Scalable Vector Graphics file",
            "@type": "ALTIMG",
            "@size": "1203",
            "@ref": "si0057",
            "@mimetype": "image/svg+xml"
          },
          {
            "@category": "thumbnail",
            "@_fa": "true",
            "$": "https://api.elsevier.com/content/object/eid/1-s2.0-S0926860X23004982-si0058.svg?httpAccept=%2A%2F%2A",
            "@multimediatype": "Scalable Vector Graphics file",
            "@type": "ALTIMG",
            "@size": "1170",
            "@ref": "si0058",
            "@mimetype": "image/svg+xml"
          },
          {
            "@category": "thumbnail",
            "@_fa": "true",
            "$": "https://api.elsevier.com/content/object/eid/1-s2.0-S0926860X23004982-si0059.svg?httpAccept=%2A%2F%2A",
            "@multimediatype": "Scalable Vector Graphics file",
            "@type": "ALTIMG",
            "@size": "1170",
            "@ref": "si0059",
            "@mimetype": "image/svg+xml"
          },
          {
            "@category": "thumbnail",
            "@_fa": "true",
            "$": "https://api.elsevier.com/content/object/eid/1-s2.0-S0926860X23004982-si0060.svg?httpAccept=%2A%2F%2A",
            "@multimediatype": "Scalable Vector Graphics file",
            "@type": "ALTIMG",
            "@size": "1203",
            "@ref": "si0060",
            "@mimetype": "image/svg+xml"
          },
          {
            "@category": "thumbnail",
            "@_fa": "true",
            "$": "https://api.elsevier.com/content/object/eid/1-s2.0-S0926860X23004982-si0061.svg?httpAccept=%2A%2F%2A",
            "@multimediatype": "Scalable Vector Graphics file",
            "@type": "ALTIMG",
            "@size": "1203",
            "@ref": "si0061",
            "@mimetype": "image/svg+xml"
          },
          {
            "@category": "thumbnail",
            "@_fa": "true",
            "$": "https://api.elsevier.com/content/object/eid/1-s2.0-S0926860X23004982-si0062.svg?httpAccept=%2A%2F%2A",
            "@multimediatype": "Scalable Vector Graphics file",
            "@type": "ALTIMG",
            "@size": "1170",
            "@ref": "si0062",
            "@mimetype": "image/svg+xml"
          },
          {
            "@category": "thumbnail",
            "@_fa": "true",
            "$": "https://api.elsevier.com/content/object/eid/1-s2.0-S0926860X23004982-si0063.svg?httpAccept=%2A%2F%2A",
            "@multimediatype": "Scalable Vector Graphics file",
            "@type": "ALTIMG",
            "@size": "1203",
            "@ref": "si0063",
            "@mimetype": "image/svg+xml"
          },
          {
            "@category": "thumbnail",
            "@_fa": "true",
            "$": "https://api.elsevier.com/content/object/eid/1-s2.0-S0926860X23004982-si0064.svg?httpAccept=%2A%2F%2A",
            "@multimediatype": "Scalable Vector Graphics file",
            "@type": "ALTIMG",
            "@size": "1170",
            "@ref": "si0064",
            "@mimetype": "image/svg+xml"
          },
          {
            "@category": "thumbnail",
            "@_fa": "true",
            "$": "https://api.elsevier.com/content/object/eid/1-s2.0-S0926860X23004982-si0065.svg?httpAccept=%2A%2F%2A",
            "@multimediatype": "Scalable Vector Graphics file",
            "@type": "ALTIMG",
            "@size": "1203",
            "@ref": "si0065",
            "@mimetype": "image/svg+xml"
          },
          {
            "@category": "thumbnail",
            "@_fa": "true",
            "$": "https://api.elsevier.com/content/object/eid/1-s2.0-S0926860X23004982-si0066.svg?httpAccept=%2A%2F%2A",
            "@multimediatype": "Scalable Vector Graphics file",
            "@type": "ALTIMG",
            "@size": "1170",
            "@ref": "si0066",
            "@mimetype": "image/svg+xml"
          },
          {
            "@category": "thumbnail",
            "@_fa": "true",
            "$": "https://api.elsevier.com/content/object/eid/1-s2.0-S0926860X23004982-si0067.svg?httpAccept=%2A%2F%2A",
            "@multimediatype": "Scalable Vector Graphics file",
            "@type": "ALTIMG",
            "@size": "2427",
            "@ref": "si0067",
            "@mimetype": "image/svg+xml"
          },
          {
            "@category": "thumbnail",
            "@_fa": "true",
            "$": "https://api.elsevier.com/content/object/eid/1-s2.0-S0926860X23004982-si0068.svg?httpAccept=%2A%2F%2A",
            "@multimediatype": "Scalable Vector Graphics file",
            "@type": "ALTIMG",
            "@size": "2629",
            "@ref": "si0068",
            "@mimetype": "image/svg+xml"
          },
          {
            "@category": "thumbnail",
            "@_fa": "true",
            "$": "https://api.elsevier.com/content/object/eid/1-s2.0-S0926860X23004982-si0069.svg?httpAccept=%2A%2F%2A",
            "@multimediatype": "Scalable Vector Graphics file",
            "@type": "ALTIMG",
            "@size": "2658",
            "@ref": "si0069",
            "@mimetype": "image/svg+xml"
          },
          {
            "@category": "thumbnail",
            "@_fa": "true",
            "$": "https://api.elsevier.com/content/object/eid/1-s2.0-S0926860X23004982-si0070.svg?httpAccept=%2A%2F%2A",
            "@multimediatype": "Scalable Vector Graphics file",
            "@type": "ALTIMG",
            "@size": "2613",
            "@ref": "si0070",
            "@mimetype": "image/svg+xml"
          },
          {
            "@category": "thumbnail",
            "@_fa": "true",
            "$": "https://api.elsevier.com/content/object/eid/1-s2.0-S0926860X23004982-si0071.svg?httpAccept=%2A%2F%2A",
            "@multimediatype": "Scalable Vector Graphics file",
            "@type": "ALTIMG",
            "@size": "2808",
            "@ref": "si0071",
            "@mimetype": "image/svg+xml"
          },
          {
            "@category": "thumbnail",
            "@_fa": "true",
            "$": "https://api.elsevier.com/content/object/eid/1-s2.0-S0926860X23004982-si0072.svg?httpAccept=%2A%2F%2A",
            "@multimediatype": "Scalable Vector Graphics file",
            "@type": "ALTIMG",
            "@size": "1381",
            "@ref": "si0072",
            "@mimetype": "image/svg+xml"
          },
          {
            "@category": "thumbnail",
            "@_fa": "true",
            "$": "https://api.elsevier.com/content/object/eid/1-s2.0-S0926860X23004982-si0073.svg?httpAccept=%2A%2F%2A",
            "@multimediatype": "Scalable Vector Graphics file",
            "@type": "ALTIMG",
            "@size": "2723",
            "@ref": "si0073",
            "@mimetype": "image/svg+xml"
          },
          {
            "@category": "thumbnail",
            "@_fa": "true",
            "$": "https://api.elsevier.com/content/object/eid/1-s2.0-S0926860X23004982-si0074.svg?httpAccept=%2A%2F%2A",
            "@multimediatype": "Scalable Vector Graphics file",
            "@type": "ALTIMG",
            "@size": "2743",
            "@ref": "si0074",
            "@mimetype": "image/svg+xml"
          },
          {
            "@category": "thumbnail",
            "@_fa": "true",
            "$": "https://api.elsevier.com/content/object/eid/1-s2.0-S0926860X23004982-si0075.svg?httpAccept=%2A%2F%2A",
            "@multimediatype": "Scalable Vector Graphics file",
            "@type": "ALTIMG",
            "@size": "1110",
            "@ref": "si0075",
            "@mimetype": "image/svg+xml"
          },
          {
            "@category": "thumbnail",
            "@_fa": "true",
            "$": "https://api.elsevier.com/content/object/eid/1-s2.0-S0926860X23004982-si0076.svg?httpAccept=%2A%2F%2A",
            "@multimediatype": "Scalable Vector Graphics file",
            "@type": "ALTIMG",
            "@size": "1134",
            "@ref": "si0076",
            "@mimetype": "image/svg+xml"
          },
          {
            "@category": "thumbnail",
            "@_fa": "true",
            "$": "https://api.elsevier.com/content/object/eid/1-s2.0-S0926860X23004982-si0077.svg?httpAccept=%2A%2F%2A",
            "@multimediatype": "Scalable Vector Graphics file",
            "@type": "ALTIMG",
            "@size": "1361",
            "@ref": "si0077",
            "@mimetype": "image/svg+xml"
          },
          {
            "@category": "thumbnail",
            "@_fa": "true",
            "$": "https://api.elsevier.com/content/object/eid/1-s2.0-S0926860X23004982-si0078.svg?httpAccept=%2A%2F%2A",
            "@multimediatype": "Scalable Vector Graphics file",
            "@type": "ALTIMG",
            "@size": "1130",
            "@ref": "si0078",
            "@mimetype": "image/svg+xml"
          },
          {
            "@category": "thumbnail",
            "@_fa": "true",
            "$": "https://api.elsevier.com/content/object/eid/1-s2.0-S0926860X23004982-si0079.svg?httpAccept=%2A%2F%2A",
            "@multimediatype": "Scalable Vector Graphics file",
            "@type": "ALTIMG",
            "@size": "1361",
            "@ref": "si0079",
            "@mimetype": "image/svg+xml"
          },
          {
            "@category": "thumbnail",
            "@_fa": "true",
            "$": "https://api.elsevier.com/content/object/eid/1-s2.0-S0926860X23004982-si0080.svg?httpAccept=%2A%2F%2A",
            "@multimediatype": "Scalable Vector Graphics file",
            "@type": "ALTIMG",
            "@size": "1624",
            "@ref": "si0080",
            "@mimetype": "image/svg+xml"
          },
          {
            "@category": "thumbnail",
            "@_fa": "true",
            "$": "https://api.elsevier.com/content/object/eid/1-s2.0-S0926860X23004982-si0081.svg?httpAccept=%2A%2F%2A",
            "@multimediatype": "Scalable Vector Graphics file",
            "@type": "ALTIMG",
            "@size": "1401",
            "@ref": "si0081",
            "@mimetype": "image/svg+xml"
          },
          {
            "@category": "thumbnail",
            "@_fa": "true",
            "$": "https://api.elsevier.com/content/object/eid/1-s2.0-S0926860X23004982-si0082.svg?httpAccept=%2A%2F%2A",
            "@multimediatype": "Scalable Vector Graphics file",
            "@type": "ALTIMG",
            "@size": "1134",
            "@ref": "si0082",
            "@mimetype": "image/svg+xml"
          },
          {
            "@category": "thumbnail",
            "@_fa": "true",
            "$": "https://api.elsevier.com/content/object/eid/1-s2.0-S0926860X23004982-si0083.svg?httpAccept=%2A%2F%2A",
            "@multimediatype": "Scalable Vector Graphics file",
            "@type": "ALTIMG",
            "@size": "1146",
            "@ref": "si0083",
            "@mimetype": "image/svg+xml"
          },
          {
            "@category": "thumbnail",
            "@_fa": "true",
            "$": "https://api.elsevier.com/content/object/eid/1-s2.0-S0926860X23004982-si0084.svg?httpAccept=%2A%2F%2A",
            "@multimediatype": "Scalable Vector Graphics file",
            "@type": "ALTIMG",
            "@size": "1636",
            "@ref": "si0084",
            "@mimetype": "image/svg+xml"
          },
          {
            "@category": "thumbnail",
            "@_fa": "true",
            "$": "https://api.elsevier.com/content/object/eid/1-s2.0-S0926860X23004982-si0085.svg?httpAccept=%2A%2F%2A",
            "@multimediatype": "Scalable Vector Graphics file",
            "@type": "ALTIMG",
            "@size": "1519",
            "@ref": "si0085",
            "@mimetype": "image/svg+xml"
          },
          {
            "@category": "thumbnail",
            "@_fa": "true",
            "$": "https://api.elsevier.com/content/object/eid/1-s2.0-S0926860X23004982-si0086.svg?httpAccept=%2A%2F%2A",
            "@multimediatype": "Scalable Vector Graphics file",
            "@type": "ALTIMG",
            "@size": "1669",
            "@ref": "si0086",
            "@mimetype": "image/svg+xml"
          },
          {
            "@category": "thumbnail",
            "@_fa": "true",
            "$": "https://api.elsevier.com/content/object/eid/1-s2.0-S0926860X23004982-si0087.svg?httpAccept=%2A%2F%2A",
            "@multimediatype": "Scalable Vector Graphics file",
            "@type": "ALTIMG",
            "@size": "2646",
            "@ref": "si0087",
            "@mimetype": "image/svg+xml"
          },
          {
            "@category": "thumbnail",
            "@_fa": "true",
            "$": "https://api.elsevier.com/content/object/eid/1-s2.0-S0926860X23004982-si0088.svg?httpAccept=%2A%2F%2A",
            "@multimediatype": "Scalable Vector Graphics file",
            "@type": "ALTIMG",
            "@size": "1961",
            "@ref": "si0088",
            "@mimetype": "image/svg+xml"
          },
          {
            "@category": "thumbnail",
            "@_fa": "true",
            "$": "https://api.elsevier.com/content/object/eid/1-s2.0-S0926860X23004982-si0089.svg?httpAccept=%2A%2F%2A",
            "@multimediatype": "Scalable Vector Graphics file",
            "@type": "ALTIMG",
            "@size": "1288",
            "@ref": "si0089",
            "@mimetype": "image/svg+xml"
          },
          {
            "@category": "thumbnail",
            "@_fa": "true",
            "$": "https://api.elsevier.com/content/object/eid/1-s2.0-S0926860X23004982-si0090.svg?httpAccept=%2A%2F%2A",
            "@multimediatype": "Scalable Vector Graphics file",
            "@type": "ALTIMG",
            "@size": "1470",
            "@ref": "si0090",
            "@mimetype": "image/svg+xml"
          },
          {
            "@category": "thumbnail",
            "@_fa": "true",
            "$": "https://api.elsevier.com/content/object/eid/1-s2.0-S0926860X23004982-si0091.svg?httpAccept=%2A%2F%2A",
            "@multimediatype": "Scalable Vector Graphics file",
            "@type": "ALTIMG",
            "@size": "1142",
            "@ref": "si0091",
            "@mimetype": "image/svg+xml"
          },
          {
            "@category": "thumbnail",
            "@_fa": "true",
            "$": "https://api.elsevier.com/content/object/eid/1-s2.0-S0926860X23004982-si0092.svg?httpAccept=%2A%2F%2A",
            "@multimediatype": "Scalable Vector Graphics file",
            "@type": "ALTIMG",
            "@size": "1361",
            "@ref": "si0092",
            "@mimetype": "image/svg+xml"
          },
          {
            "@category": "thumbnail",
            "@_fa": "true",
            "$": "https://api.elsevier.com/content/object/eid/1-s2.0-S0926860X23004982-si0093.svg?httpAccept=%2A%2F%2A",
            "@multimediatype": "Scalable Vector Graphics file",
            "@type": "ALTIMG",
            "@size": "1312",
            "@ref": "si0093",
            "@mimetype": "image/svg+xml"
          },
          {
            "@category": "thumbnail",
            "@_fa": "true",
            "$": "https://api.elsevier.com/content/object/eid/1-s2.0-S0926860X23004982-si0094.svg?httpAccept=%2A%2F%2A",
            "@multimediatype": "Scalable Vector Graphics file",
            "@type": "ALTIMG",
            "@size": "1312",
            "@ref": "si0094",
            "@mimetype": "image/svg+xml"
          },
          {
            "@category": "thumbnail",
            "@_fa": "true",
            "$": "https://api.elsevier.com/content/object/eid/1-s2.0-S0926860X23004982-si0095.svg?httpAccept=%2A%2F%2A",
            "@multimediatype": "Scalable Vector Graphics file",
            "@type": "ALTIMG",
            "@size": "1312",
            "@ref": "si0095",
            "@mimetype": "image/svg+xml"
          },
          {
            "@category": "thumbnail",
            "@_fa": "true",
            "$": "https://api.elsevier.com/content/object/eid/1-s2.0-S0926860X23004982-si0096.svg?httpAccept=%2A%2F%2A",
            "@multimediatype": "Scalable Vector Graphics file",
            "@type": "ALTIMG",
            "@size": "1965",
            "@ref": "si0096",
            "@mimetype": "image/svg+xml"
          },
          {
            "@category": "thumbnail",
            "@_fa": "true",
            "$": "https://api.elsevier.com/content/object/eid/1-s2.0-S0926860X23004982-si0097.svg?httpAccept=%2A%2F%2A",
            "@multimediatype": "Scalable Vector Graphics file",
            "@type": "ALTIMG",
            "@size": "1312",
            "@ref": "si0097",
            "@mimetype": "image/svg+xml"
          },
          {
            "@category": "thumbnail",
            "@_fa": "true",
            "$": "https://api.elsevier.com/content/object/eid/1-s2.0-S0926860X23004982-si0098.svg?httpAccept=%2A%2F%2A",
            "@multimediatype": "Scalable Vector Graphics file",
            "@type": "ALTIMG",
            "@size": "1361",
            "@ref": "si0098",
            "@mimetype": "image/svg+xml"
          },
          {
            "@category": "thumbnail",
            "@_fa": "true",
            "$": "https://api.elsevier.com/content/object/eid/1-s2.0-S0926860X23004982-si0099.svg?httpAccept=%2A%2F%2A",
            "@multimediatype": "Scalable Vector Graphics file",
            "@type": "ALTIMG",
            "@size": "1053",
            "@ref": "si0099",
            "@mimetype": "image/svg+xml"
          },
          {
            "@category": "thumbnail",
            "@_fa": "true",
            "$": "https://api.elsevier.com/content/object/eid/1-s2.0-S0926860X23004982-si0100.svg?httpAccept=%2A%2F%2A",
            "@multimediatype": "Scalable Vector Graphics file",
            "@type": "ALTIMG",
            "@size": "1053",
            "@ref": "si0100",
            "@mimetype": "image/svg+xml"
          },
          {
            "@category": "thumbnail",
            "@_fa": "true",
            "$": "https://api.elsevier.com/content/object/eid/1-s2.0-S0926860X23004982-si0101.svg?httpAccept=%2A%2F%2A",
            "@multimediatype": "Scalable Vector Graphics file",
            "@type": "ALTIMG",
            "@size": "1361",
            "@ref": "si0101",
            "@mimetype": "image/svg+xml"
          },
          {
            "@category": "thumbnail",
            "@_fa": "true",
            "$": "https://api.elsevier.com/content/object/eid/1-s2.0-S0926860X23004982-si0102.svg?httpAccept=%2A%2F%2A",
            "@multimediatype": "Scalable Vector Graphics file",
            "@type": "ALTIMG",
            "@size": "1369",
            "@ref": "si0102",
            "@mimetype": "image/svg+xml"
          },
          {
            "@category": "thumbnail",
            "@_fa": "true",
            "$": "https://api.elsevier.com/content/object/eid/1-s2.0-S0926860X23004982-si0103.svg?httpAccept=%2A%2F%2A",
            "@multimediatype": "Scalable Vector Graphics file",
            "@type": "ALTIMG",
            "@size": "1369",
            "@ref": "si0103",
            "@mimetype": "image/svg+xml"
          },
          {
            "@category": "thumbnail",
            "@_fa": "true",
            "$": "https://api.elsevier.com/content/object/eid/1-s2.0-S0926860X23004982-si0104.svg?httpAccept=%2A%2F%2A",
            "@multimediatype": "Scalable Vector Graphics file",
            "@type": "ALTIMG",
            "@size": "1361",
            "@ref": "si0104",
            "@mimetype": "image/svg+xml"
          },
          {
            "@category": "thumbnail",
            "@_fa": "true",
            "$": "https://api.elsevier.com/content/object/eid/1-s2.0-S0926860X23004982-si0105.svg?httpAccept=%2A%2F%2A",
            "@multimediatype": "Scalable Vector Graphics file",
            "@type": "ALTIMG",
            "@size": "1337",
            "@ref": "si0105",
            "@mimetype": "image/svg+xml"
          },
          {
            "@category": "thumbnail",
            "@_fa": "true",
            "$": "https://api.elsevier.com/content/object/eid/1-s2.0-S0926860X23004982-si0106.svg?httpAccept=%2A%2F%2A",
            "@multimediatype": "Scalable Vector Graphics file",
            "@type": "ALTIMG",
            "@size": "2285",
            "@ref": "si0106",
            "@mimetype": "image/svg+xml"
          },
          {
            "@category": "thumbnail",
            "@_fa": "true",
            "$": "https://api.elsevier.com/content/object/eid/1-s2.0-S0926860X23004982-si0107.svg?httpAccept=%2A%2F%2A",
            "@multimediatype": "Scalable Vector Graphics file",
            "@type": "ALTIMG",
            "@size": "1316",
            "@ref": "si0107",
            "@mimetype": "image/svg+xml"
          },
          {
            "@category": "thumbnail",
            "@_fa": "true",
            "$": "https://api.elsevier.com/content/object/eid/1-s2.0-S0926860X23004982-si0108.svg?httpAccept=%2A%2F%2A",
            "@multimediatype": "Scalable Vector Graphics file",
            "@type": "ALTIMG",
            "@size": "2273",
            "@ref": "si0108",
            "@mimetype": "image/svg+xml"
          },
          {
            "@category": "thumbnail",
            "@_fa": "true",
            "$": "https://api.elsevier.com/content/object/eid/1-s2.0-S0926860X23004982-si0109.svg?httpAccept=%2A%2F%2A",
            "@multimediatype": "Scalable Vector Graphics file",
            "@type": "ALTIMG",
            "@size": "1377",
            "@ref": "si0109",
            "@mimetype": "image/svg+xml"
          },
          {
            "@category": "thumbnail",
            "@_fa": "true",
            "$": "https://api.elsevier.com/content/object/eid/1-s2.0-S0926860X23004982-si0110.svg?httpAccept=%2A%2F%2A",
            "@multimediatype": "Scalable Vector Graphics file",
            "@type": "ALTIMG",
            "@size": "1957",
            "@ref": "si0110",
            "@mimetype": "image/svg+xml"
          },
          {
            "@category": "thumbnail",
            "@_fa": "true",
            "$": "https://api.elsevier.com/content/object/eid/1-s2.0-S0926860X23004982-si0111.svg?httpAccept=%2A%2F%2A",
            "@multimediatype": "Scalable Vector Graphics file",
            "@type": "ALTIMG",
            "@size": "1174",
            "@ref": "si0111",
            "@mimetype": "image/svg+xml"
          },
          {
            "@category": "thumbnail",
            "@_fa": "true",
            "$": "https://api.elsevier.com/content/object/eid/1-s2.0-S0926860X23004982-si0112.svg?httpAccept=%2A%2F%2A",
            "@multimediatype": "Scalable Vector Graphics file",
            "@type": "ALTIMG",
            "@size": "2058",
            "@ref": "si0112",
            "@mimetype": "image/svg+xml"
          },
          {
            "@category": "thumbnail",
            "@_fa": "true",
            "$": "https://api.elsevier.com/content/object/eid/1-s2.0-S0926860X23004982-si0113.svg?httpAccept=%2A%2F%2A",
            "@multimediatype": "Scalable Vector Graphics file",
            "@type": "ALTIMG",
            "@size": "1661",
            "@ref": "si0113",
            "@mimetype": "image/svg+xml"
          },
          {
            "@category": "thumbnail",
            "@_fa": "true",
            "$": "https://api.elsevier.com/content/object/eid/1-s2.0-S0926860X23004982-si0114.svg?httpAccept=%2A%2F%2A",
            "@multimediatype": "Scalable Vector Graphics file",
            "@type": "ALTIMG",
            "@size": "2743",
            "@ref": "si0114",
            "@mimetype": "image/svg+xml"
          },
          {
            "@category": "thumbnail",
            "@_fa": "true",
            "$": "https://api.elsevier.com/content/object/eid/1-s2.0-S0926860X23004982-si0115.svg?httpAccept=%2A%2F%2A",
            "@multimediatype": "Scalable Vector Graphics file",
            "@type": "ALTIMG",
            "@size": "1361",
            "@ref": "si0115",
            "@mimetype": "image/svg+xml"
          },
          {
            "@category": "thumbnail",
            "@_fa": "true",
            "$": "https://api.elsevier.com/content/object/eid/1-s2.0-S0926860X23004982-si0116.svg?httpAccept=%2A%2F%2A",
            "@multimediatype": "Scalable Vector Graphics file",
            "@type": "ALTIMG",
            "@size": "1491",
            "@ref": "si0116",
            "@mimetype": "image/svg+xml"
          },
          {
            "@category": "thumbnail",
            "@_fa": "true",
            "$": "https://api.elsevier.com/content/object/eid/1-s2.0-S0926860X23004982-si0117.svg?httpAccept=%2A%2F%2A",
            "@multimediatype": "Scalable Vector Graphics file",
            "@type": "ALTIMG",
            "@size": "2540",
            "@ref": "si0117",
            "@mimetype": "image/svg+xml"
          },
          {
            "@category": "thumbnail",
            "@_fa": "true",
            "$": "https://api.elsevier.com/content/object/eid/1-s2.0-S0926860X23004982-si0118.svg?httpAccept=%2A%2F%2A",
            "@multimediatype": "Scalable Vector Graphics file",
            "@type": "ALTIMG",
            "@size": "1523",
            "@ref": "si0118",
            "@mimetype": "image/svg+xml"
          },
          {
            "@category": "thumbnail",
            "@_fa": "true",
            "$": "https://api.elsevier.com/content/object/eid/1-s2.0-S0926860X23004982-si0119.svg?httpAccept=%2A%2F%2A",
            "@multimediatype": "Scalable Vector Graphics file",
            "@type": "ALTIMG",
            "@size": "1588",
            "@ref": "si0119",
            "@mimetype": "image/svg+xml"
          },
          {
            "@category": "thumbnail",
            "@_fa": "true",
            "$": "https://api.elsevier.com/content/object/eid/1-s2.0-S0926860X23004982-si0120.svg?httpAccept=%2A%2F%2A",
            "@multimediatype": "Scalable Vector Graphics file",
            "@type": "ALTIMG",
            "@size": "2747",
            "@ref": "si0120",
            "@mimetype": "image/svg+xml"
          },
          {
            "@category": "thumbnail",
            "@_fa": "true",
            "$": "https://api.elsevier.com/content/object/eid/1-s2.0-S0926860X23004982-si0121.svg?httpAccept=%2A%2F%2A",
            "@multimediatype": "Scalable Vector Graphics file",
            "@type": "ALTIMG",
            "@size": "1588",
            "@ref": "si0121",
            "@mimetype": "image/svg+xml"
          },
          {
            "@category": "thumbnail",
            "@_fa": "true",
            "$": "https://api.elsevier.com/content/object/eid/1-s2.0-S0926860X23004982-si0122.svg?httpAccept=%2A%2F%2A",
            "@multimediatype": "Scalable Vector Graphics file",
            "@type": "ALTIMG",
            "@size": "1491",
            "@ref": "si0122",
            "@mimetype": "image/svg+xml"
          },
          {
            "@category": "thumbnail",
            "@_fa": "true",
            "$": "https://api.elsevier.com/content/object/eid/1-s2.0-S0926860X23004982-si0123.svg?httpAccept=%2A%2F%2A",
            "@multimediatype": "Scalable Vector Graphics file",
            "@type": "ALTIMG",
            "@size": "1361",
            "@ref": "si0123",
            "@mimetype": "image/svg+xml"
          },
          {
            "@category": "thumbnail",
            "@_fa": "true",
            "$": "https://api.elsevier.com/content/object/eid/1-s2.0-S0926860X23004982-si0124.svg?httpAccept=%2A%2F%2A",
            "@multimediatype": "Scalable Vector Graphics file",
            "@type": "ALTIMG",
            "@size": "1491",
            "@ref": "si0124",
            "@mimetype": "image/svg+xml"
          },
          {
            "@category": "thumbnail",
            "@_fa": "true",
            "$": "https://api.elsevier.com/content/object/eid/1-s2.0-S0926860X23004982-si0125.svg?httpAccept=%2A%2F%2A",
            "@multimediatype": "Scalable Vector Graphics file",
            "@type": "ALTIMG",
            "@size": "1312",
            "@ref": "si0125",
            "@mimetype": "image/svg+xml"
          },
          {
            "@category": "thumbnail",
            "@_fa": "true",
            "$": "https://api.elsevier.com/content/object/eid/1-s2.0-S0926860X23004982-si0126.svg?httpAccept=%2A%2F%2A",
            "@multimediatype": "Scalable Vector Graphics file",
            "@type": "ALTIMG",
            "@size": "1491",
            "@ref": "si0126",
            "@mimetype": "image/svg+xml"
          },
          {
            "@category": "thumbnail",
            "@_fa": "true",
            "$": "https://api.elsevier.com/content/object/eid/1-s2.0-S0926860X23004982-si0127.svg?httpAccept=%2A%2F%2A",
            "@multimediatype": "Scalable Vector Graphics file",
            "@type": "ALTIMG",
            "@size": "1953",
            "@ref": "si0127",
            "@mimetype": "image/svg+xml"
          },
          {
            "@category": "thumbnail",
            "@_fa": "true",
            "$": "https://api.elsevier.com/content/object/eid/1-s2.0-S0926860X23004982-si0128.svg?httpAccept=%2A%2F%2A",
            "@multimediatype": "Scalable Vector Graphics file",
            "@type": "ALTIMG",
            "@size": "1491",
            "@ref": "si0128",
            "@mimetype": "image/svg+xml"
          },
          {
            "@category": "thumbnail",
            "@_fa": "true",
            "$": "https://api.elsevier.com/content/object/eid/1-s2.0-S0926860X23004982-si0129.svg?httpAccept=%2A%2F%2A",
            "@multimediatype": "Scalable Vector Graphics file",
            "@type": "ALTIMG",
            "@size": "1953",
            "@ref": "si0129",
            "@mimetype": "image/svg+xml"
          },
          {
            "@category": "thumbnail",
            "@_fa": "true",
            "$": "https://api.elsevier.com/content/object/eid/1-s2.0-S0926860X23004982-si0130.svg?httpAccept=%2A%2F%2A",
            "@multimediatype": "Scalable Vector Graphics file",
            "@type": "ALTIMG",
            "@size": "1446",
            "@ref": "si0130",
            "@mimetype": "image/svg+xml"
          },
          {
            "@category": "thumbnail",
            "@_fa": "true",
            "$": "https://api.elsevier.com/content/object/eid/1-s2.0-S0926860X23004982-si0131.svg?httpAccept=%2A%2F%2A",
            "@multimediatype": "Scalable Vector Graphics file",
            "@type": "ALTIMG",
            "@size": "1385",
            "@ref": "si0131",
            "@mimetype": "image/svg+xml"
          },
          {
            "@category": "thumbnail",
            "@_fa": "true",
            "$": "https://api.elsevier.com/content/object/eid/1-s2.0-S0926860X23004982-si0132.svg?httpAccept=%2A%2F%2A",
            "@multimediatype": "Scalable Vector Graphics file",
            "@type": "ALTIMG",
            "@size": "1369",
            "@ref": "si0132",
            "@mimetype": "image/svg+xml"
          },
          {
            "@category": "thumbnail",
            "@_fa": "true",
            "$": "https://api.elsevier.com/content/object/eid/1-s2.0-S0926860X23004982-si0133.svg?httpAccept=%2A%2F%2A",
            "@multimediatype": "Scalable Vector Graphics file",
            "@type": "ALTIMG",
            "@size": "1369",
            "@ref": "si0133",
            "@mimetype": "image/svg+xml"
          },
          {
            "@category": "thumbnail",
            "@_fa": "true",
            "$": "https://api.elsevier.com/content/object/eid/1-s2.0-S0926860X23004982-si0134.svg?httpAccept=%2A%2F%2A",
            "@multimediatype": "Scalable Vector Graphics file",
            "@type": "ALTIMG",
            "@size": "1697",
            "@ref": "si0134",
            "@mimetype": "image/svg+xml"
          },
          {
            "@category": "thumbnail",
            "@_fa": "true",
            "$": "https://api.elsevier.com/content/object/eid/1-s2.0-S0926860X23004982-si0135.svg?httpAccept=%2A%2F%2A",
            "@multimediatype": "Scalable Vector Graphics file",
            "@type": "ALTIMG",
            "@size": "1405",
            "@ref": "si0135",
            "@mimetype": "image/svg+xml"
          },
          {
            "@category": "thumbnail",
            "@_fa": "true",
            "$": "https://api.elsevier.com/content/object/eid/1-s2.0-S0926860X23004982-si0136.svg?httpAccept=%2A%2F%2A",
            "@multimediatype": "Scalable Vector Graphics file",
            "@type": "ALTIMG",
            "@size": "1077",
            "@ref": "si0136",
            "@mimetype": "image/svg+xml"
          },
          {
            "@category": "thumbnail",
            "@_fa": "true",
            "$": "https://api.elsevier.com/content/object/eid/1-s2.0-S0926860X23004982-si0137.svg?httpAccept=%2A%2F%2A",
            "@multimediatype": "Scalable Vector Graphics file",
            "@type": "ALTIMG",
            "@size": "1077",
            "@ref": "si0137",
            "@mimetype": "image/svg+xml"
          },
          {
            "@category": "thumbnail",
            "@_fa": "true",
            "$": "https://api.elsevier.com/content/object/eid/1-s2.0-S0926860X23004982-si0138.svg?httpAccept=%2A%2F%2A",
            "@multimediatype": "Scalable Vector Graphics file",
            "@type": "ALTIMG",
            "@size": "1085",
            "@ref": "si0138",
            "@mimetype": "image/svg+xml"
          },
          {
            "@category": "thumbnail",
            "@_fa": "true",
            "$": "https://api.elsevier.com/content/object/eid/1-s2.0-S0926860X23004982-si0139.svg?httpAccept=%2A%2F%2A",
            "@multimediatype": "Scalable Vector Graphics file",
            "@type": "ALTIMG",
            "@size": "3343",
            "@ref": "si0139",
            "@mimetype": "image/svg+xml"
          },
          {
            "@category": "thumbnail",
            "@_fa": "true",
            "$": "https://api.elsevier.com/content/object/eid/1-s2.0-S0926860X23004982-si0140.svg?httpAccept=%2A%2F%2A",
            "@multimediatype": "Scalable Vector Graphics file",
            "@type": "ALTIMG",
            "@size": "1033",
            "@ref": "si0140",
            "@mimetype": "image/svg+xml"
          },
          {
            "@category": "thumbnail",
            "@_fa": "true",
            "$": "https://api.elsevier.com/content/object/eid/1-s2.0-S0926860X23004982-si0141.svg?httpAccept=%2A%2F%2A",
            "@multimediatype": "Scalable Vector Graphics file",
            "@type": "ALTIMG",
            "@size": "1130",
            "@ref": "si0141",
            "@mimetype": "image/svg+xml"
          },
          {
            "@category": "thumbnail",
            "@_fa": "true",
            "$": "https://api.elsevier.com/content/object/eid/1-s2.0-S0926860X23004982-si0142.svg?httpAccept=%2A%2F%2A",
            "@multimediatype": "Scalable Vector Graphics file",
            "@type": "ALTIMG",
            "@size": "1077",
            "@ref": "si0142",
            "@mimetype": "image/svg+xml"
          },
          {
            "@category": "thumbnail",
            "@_fa": "true",
            "$": "https://api.elsevier.com/content/object/eid/1-s2.0-S0926860X23004982-si0143.svg?httpAccept=%2A%2F%2A",
            "@multimediatype": "Scalable Vector Graphics file",
            "@type": "ALTIMG",
            "@size": "1085",
            "@ref": "si0143",
            "@mimetype": "image/svg+xml"
          },
          {
            "@category": "thumbnail",
            "@_fa": "true",
            "$": "https://api.elsevier.com/content/object/eid/1-s2.0-S0926860X23004982-si0144.svg?httpAccept=%2A%2F%2A",
            "@multimediatype": "Scalable Vector Graphics file",
            "@type": "ALTIMG",
            "@size": "1491",
            "@ref": "si0144",
            "@mimetype": "image/svg+xml"
          },
          {
            "@category": "thumbnail",
            "@_fa": "true",
            "$": "https://api.elsevier.com/content/object/eid/1-s2.0-S0926860X23004982-si0145.svg?httpAccept=%2A%2F%2A",
            "@multimediatype": "Scalable Vector Graphics file",
            "@type": "ALTIMG",
            "@size": "1361",
            "@ref": "si0145",
            "@mimetype": "image/svg+xml"
          },
          {
            "@category": "thumbnail",
            "@_fa": "true",
            "$": "https://api.elsevier.com/content/object/eid/1-s2.0-S0926860X23004982-si0146.svg?httpAccept=%2A%2F%2A",
            "@multimediatype": "Scalable Vector Graphics file",
            "@type": "ALTIMG",
            "@size": "1588",
            "@ref": "si0146",
            "@mimetype": "image/svg+xml"
          },
          {
            "@category": "thumbnail",
            "@_fa": "true",
            "$": "https://api.elsevier.com/content/object/eid/1-s2.0-S0926860X23004982-si0147.svg?httpAccept=%2A%2F%2A",
            "@multimediatype": "Scalable Vector Graphics file",
            "@type": "ALTIMG",
            "@size": "1361",
            "@ref": "si0147",
            "@mimetype": "image/svg+xml"
          },
          {
            "@category": "thumbnail",
            "@_fa": "true",
            "$": "https://api.elsevier.com/content/object/eid/1-s2.0-S0926860X23004982-si0148.svg?httpAccept=%2A%2F%2A",
            "@multimediatype": "Scalable Vector Graphics file",
            "@type": "ALTIMG",
            "@size": "1085",
            "@ref": "si0148",
            "@mimetype": "image/svg+xml"
          },
          {
            "@category": "thumbnail",
            "@_fa": "true",
            "$": "https://api.elsevier.com/content/object/eid/1-s2.0-S0926860X23004982-si0149.svg?httpAccept=%2A%2F%2A",
            "@multimediatype": "Scalable Vector Graphics file",
            "@type": "ALTIMG",
            "@size": "1588",
            "@ref": "si0149",
            "@mimetype": "image/svg+xml"
          },
          {
            "@category": "thumbnail",
            "@_fa": "true",
            "$": "https://api.elsevier.com/content/object/eid/1-s2.0-S0926860X23004982-si0150.svg?httpAccept=%2A%2F%2A",
            "@multimediatype": "Scalable Vector Graphics file",
            "@type": "ALTIMG",
            "@size": "1491",
            "@ref": "si0150",
            "@mimetype": "image/svg+xml"
          },
          {
            "@category": "thumbnail",
            "@_fa": "true",
            "$": "https://api.elsevier.com/content/object/eid/1-s2.0-S0926860X23004982-si0151.svg?httpAccept=%2A%2F%2A",
            "@multimediatype": "Scalable Vector Graphics file",
            "@type": "ALTIMG",
            "@size": "1260",
            "@ref": "si0151",
            "@mimetype": "image/svg+xml"
          },
          {
            "@category": "thumbnail",
            "@_fa": "true",
            "$": "https://api.elsevier.com/content/object/eid/1-s2.0-S0926860X23004982-si0152.svg?httpAccept=%2A%2F%2A",
            "@multimediatype": "Scalable Vector Graphics file",
            "@type": "ALTIMG",
            "@size": "1272",
            "@ref": "si0152",
            "@mimetype": "image/svg+xml"
          },
          {
            "@category": "thumbnail",
            "@_fa": "true",
            "$": "https://api.elsevier.com/content/object/eid/1-s2.0-S0926860X23004982-si0153.svg?httpAccept=%2A%2F%2A",
            "@multimediatype": "Scalable Vector Graphics file",
            "@type": "ALTIMG",
            "@size": "1251",
            "@ref": "si0153",
            "@mimetype": "image/svg+xml"
          },
          {
            "@category": "thumbnail",
            "@_fa": "true",
            "$": "https://api.elsevier.com/content/object/eid/1-s2.0-S0926860X23004982-si0154.svg?httpAccept=%2A%2F%2A",
            "@multimediatype": "Scalable Vector Graphics file",
            "@type": "ALTIMG",
            "@size": "1243",
            "@ref": "si0154",
            "@mimetype": "image/svg+xml"
          },
          {
            "@category": "thumbnail",
            "@_fa": "true",
            "$": "https://api.elsevier.com/content/object/eid/1-s2.0-S0926860X23004982-si0155.svg?httpAccept=%2A%2F%2A",
            "@multimediatype": "Scalable Vector Graphics file",
            "@type": "ALTIMG",
            "@size": "1361",
            "@ref": "si0155",
            "@mimetype": "image/svg+xml"
          },
          {
            "@category": "thumbnail",
            "@_fa": "true",
            "$": "https://api.elsevier.com/content/object/eid/1-s2.0-S0926860X23004982-si0156.svg?httpAccept=%2A%2F%2A",
            "@multimediatype": "Scalable Vector Graphics file",
            "@type": "ALTIMG",
            "@size": "1085",
            "@ref": "si0156",
            "@mimetype": "image/svg+xml"
          },
          {
            "@category": "thumbnail",
            "@_fa": "true",
            "$": "https://api.elsevier.com/content/object/eid/1-s2.0-S0926860X23004982-si0157.svg?httpAccept=%2A%2F%2A",
            "@multimediatype": "Scalable Vector Graphics file",
            "@type": "ALTIMG",
            "@size": "1142",
            "@ref": "si0157",
            "@mimetype": "image/svg+xml"
          },
          {
            "@category": "thumbnail",
            "@_fa": "true",
            "$": "https://api.elsevier.com/content/object/eid/1-s2.0-S0926860X23004982-si0158.svg?httpAccept=%2A%2F%2A",
            "@multimediatype": "Scalable Vector Graphics file",
            "@type": "ALTIMG",
            "@size": "1085",
            "@ref": "si0158",
            "@mimetype": "image/svg+xml"
          },
          {
            "@category": "thumbnail",
            "@_fa": "true",
            "$": "https://api.elsevier.com/content/object/eid/1-s2.0-S0926860X23004982-si0159.svg?httpAccept=%2A%2F%2A",
            "@multimediatype": "Scalable Vector Graphics file",
            "@type": "ALTIMG",
            "@size": "1085",
            "@ref": "si0159",
            "@mimetype": "image/svg+xml"
          },
          {
            "@category": "thumbnail",
            "@_fa": "true",
            "$": "https://api.elsevier.com/content/object/eid/1-s2.0-S0926860X23004982-si0160.svg?httpAccept=%2A%2F%2A",
            "@multimediatype": "Scalable Vector Graphics file",
            "@type": "ALTIMG",
            "@size": "1531",
            "@ref": "si0160",
            "@mimetype": "image/svg+xml"
          },
          {
            "@category": "thumbnail",
            "@_fa": "true",
            "$": "https://api.elsevier.com/content/object/eid/1-s2.0-S0926860X23004982-si0161.svg?httpAccept=%2A%2F%2A",
            "@multimediatype": "Scalable Vector Graphics file",
            "@type": "ALTIMG",
            "@size": "1085",
            "@ref": "si0161",
            "@mimetype": "image/svg+xml"
          },
          {
            "@category": "thumbnail",
            "@_fa": "true",
            "$": "https://api.elsevier.com/content/object/eid/1-s2.0-S0926860X23004982-si0162.svg?httpAccept=%2A%2F%2A",
            "@multimediatype": "Scalable Vector Graphics file",
            "@type": "ALTIMG",
            "@size": "1543",
            "@ref": "si0162",
            "@mimetype": "image/svg+xml"
          },
          {
            "@category": "thumbnail",
            "@_fa": "true",
            "$": "https://api.elsevier.com/content/object/eid/1-s2.0-S0926860X23004982-si0163.svg?httpAccept=%2A%2F%2A",
            "@multimediatype": "Scalable Vector Graphics file",
            "@type": "ALTIMG",
            "@size": "1085",
            "@ref": "si0163",
            "@mimetype": "image/svg+xml"
          },
          {
            "@category": "thumbnail",
            "@_fa": "true",
            "$": "https://api.elsevier.com/content/object/eid/1-s2.0-S0926860X23004982-si0164.svg?httpAccept=%2A%2F%2A",
            "@multimediatype": "Scalable Vector Graphics file",
            "@type": "ALTIMG",
            "@size": "1085",
            "@ref": "si0164",
            "@mimetype": "image/svg+xml"
          },
          {
            "@category": "thumbnail",
            "@_fa": "true",
            "$": "https://api.elsevier.com/content/object/eid/1-s2.0-S0926860X23004982-si0165.svg?httpAccept=%2A%2F%2A",
            "@multimediatype": "Scalable Vector Graphics file",
            "@type": "ALTIMG",
            "@size": "1405",
            "@ref": "si0165",
            "@mimetype": "image/svg+xml"
          },
          {
            "@category": "thumbnail",
            "@_fa": "true",
            "$": "https://api.elsevier.com/content/object/eid/1-s2.0-S0926860X23004982-si0166.svg?httpAccept=%2A%2F%2A",
            "@multimediatype": "Scalable Vector Graphics file",
            "@type": "ALTIMG",
            "@size": "1085",
            "@ref": "si0166",
            "@mimetype": "image/svg+xml"
          },
          {
            "@category": "thumbnail",
            "@_fa": "true",
            "$": "https://api.elsevier.com/content/object/eid/1-s2.0-S0926860X23004982-si0167.svg?httpAccept=%2A%2F%2A",
            "@multimediatype": "Scalable Vector Graphics file",
            "@type": "ALTIMG",
            "@size": "1085",
            "@ref": "si0167",
            "@mimetype": "image/svg+xml"
          },
          {
            "@category": "thumbnail",
            "@_fa": "true",
            "$": "https://api.elsevier.com/content/object/eid/1-s2.0-S0926860X23004982-si0168.svg?httpAccept=%2A%2F%2A",
            "@multimediatype": "Scalable Vector Graphics file",
            "@type": "ALTIMG",
            "@size": "1491",
            "@ref": "si0168",
            "@mimetype": "image/svg+xml"
          },
          {
            "@category": "thumbnail",
            "@_fa": "true",
            "$": "https://api.elsevier.com/content/object/eid/1-s2.0-S0926860X23004982-si0169.svg?httpAccept=%2A%2F%2A",
            "@multimediatype": "Scalable Vector Graphics file",
            "@type": "ALTIMG",
            "@size": "1588",
            "@ref": "si0169",
            "@mimetype": "image/svg+xml"
          },
          {
            "@category": "thumbnail",
            "@_fa": "true",
            "$": "https://api.elsevier.com/content/object/eid/1-s2.0-S0926860X23004982-si0170.svg?httpAccept=%2A%2F%2A",
            "@multimediatype": "Scalable Vector Graphics file",
            "@type": "ALTIMG",
            "@size": "1260",
            "@ref": "si0170",
            "@mimetype": "image/svg+xml"
          },
          {
            "@category": "thumbnail",
            "@_fa": "true",
            "$": "https://api.elsevier.com/content/object/eid/1-s2.0-S0926860X23004982-si0171.svg?httpAccept=%2A%2F%2A",
            "@multimediatype": "Scalable Vector Graphics file",
            "@type": "ALTIMG",
            "@size": "1466",
            "@ref": "si0171",
            "@mimetype": "image/svg+xml"
          },
          {
            "@category": "thumbnail",
            "@_fa": "true",
            "$": "https://api.elsevier.com/content/object/eid/1-s2.0-S0926860X23004982-si0172.svg?httpAccept=%2A%2F%2A",
            "@multimediatype": "Scalable Vector Graphics file",
            "@type": "ALTIMG",
            "@size": "1142",
            "@ref": "si0172",
            "@mimetype": "image/svg+xml"
          },
          {
            "@category": "thumbnail",
            "@_fa": "true",
            "$": "https://api.elsevier.com/content/object/eid/1-s2.0-S0926860X23004982-si0173.svg?httpAccept=%2A%2F%2A",
            "@multimediatype": "Scalable Vector Graphics file",
            "@type": "ALTIMG",
            "@size": "1491",
            "@ref": "si0173",
            "@mimetype": "image/svg+xml"
          },
          {
            "@category": "thumbnail",
            "@_fa": "true",
            "$": "https://api.elsevier.com/content/object/eid/1-s2.0-S0926860X23004982-si0174.svg?httpAccept=%2A%2F%2A",
            "@multimediatype": "Scalable Vector Graphics file",
            "@type": "ALTIMG",
            "@size": "1491",
            "@ref": "si0174",
            "@mimetype": "image/svg+xml"
          },
          {
            "@category": "thumbnail",
            "@_fa": "true",
            "$": "https://api.elsevier.com/content/object/eid/1-s2.0-S0926860X23004982-si0175.svg?httpAccept=%2A%2F%2A",
            "@multimediatype": "Scalable Vector Graphics file",
            "@type": "ALTIMG",
            "@size": "1085",
            "@ref": "si0175",
            "@mimetype": "image/svg+xml"
          },
          {
            "@category": "standard",
            "@_fa": "true",
            "$": "https://api.elsevier.com/content/object/eid/1-s2.0-S0926860X23004982-am.pdf?httpAccept=%2A%2F%2A",
            "@multimediatype": "Acrobat PDF file",
            "@type": "AAM-PDF",
            "@size": "26473532",
            "@ref": "am",
            "@mimetype": "application/pdf"
          }
        ]
      },
      "link": {
        "@rel": "abstract",
        "@href": "https://api.elsevier.com/content/abstract/scopus_id/85178136284"
      }
    }
  }
}