{
  "metadata": {
    "title": "Theoretical investigation on the ruthenium catalyzed dehydrogenation of formic acid and ligand effect",
    "authors": "Jia Zhou",
    "journal": "Applied Catalysis A: General",
    "date": "2016-04-10",
    "doi": "10.1016/j.apcata.2016.01.043",
    "abstract": "",
    "uri": "https://api.elsevier.com/content/article/pii/S0926860X16300436",
    "pii": "S0926860X16300436"
  },
  "fulltext": {
    "full-text-retrieval-response": {
      "scopus-eid": "2-s2.0-84957921952",
      "originalText": "serial JL 271346 291210 291744 291809 31 Applied Catalysis A: General APPLIEDCATALYSISAGENERAL 2016-02-02 2016-02-02 2016-02-12 2016-02-12 2017-08-04T01:21:45 1-s2.0-S0926860X16300436 S0926-860X(16)30043-6 S0926860X16300436 10.1016/j.apcata.2016.01.043 S300 S300.4 FULL-TEXT 1-s2.0-S0926860X16X00038 2025-07-16T14:33:53.326206Z 0 0 20160410 2016 2016-02-02T16:32:24.478364Z absattachment articleinfo articletitlenorm authfirstinitialnorm authfirstsurnamenorm cid cids contenttype copyright crossmark dateloaded dateloadedtxt datesearch datesort dateupdated dco docsubtype doctype doi eid ewtransactionid hubeid indexeddate issn issnnorm itemstage itemtransactionid itemweight openaccess openarchive pg pgfirst pglast pii piinorm pubdatestart pubdatetxt pubyr sectiontitle sortorder srctitle srctitlenorm srctype ssids alllist content subj subheadings suppl tomb volfirst volissue volumelist webpdf webpdfpagecount yearnav figure e-component body acknowledge affil appendices articletitle auth authfirstini authfull authkeywords authlast grantnumber grantsponsor highlightsabst primabst ref specialabst 0926-860X 0926860X true 515 515 C Volume 515 14 101 107 101 107 20160410 10 April 2016 2016-04-10 2016 Articles article fla Copyright © 2016 Elsevier B.V. All rights reserved. THEORETICALINVESTIGATIONRUTHENIUMCATALYZEDDEHYDROGENATIONFORMICACIDLIGANDEFFECT ZHOU J 1 Introduction 2 Methods 3 Results and discussion 4 Conclusions Competing interest Acknowledgements Appendix A Supplementary data References SCHLAPBACH 2001 353 358 L TURNER 2004 972 974 J ARMAROLI 2007 52 66 N NAIK 2010 578 597 S POLLET 2012 235 249 B JOHNSON 2010 81 88 T YUN 2010 012126 J BODDIEN 2011 1733 1736 A ZELL 2013 8068 8072 T SANCHEZDEARMAS 2013 11869 11873 R YANG 2013 11987 11991 X MELLONE 2013 2495 2501 I GUERRIERO 2014 3002 3012 A THEVENON 2014 3146 3152 A MANCA 2013 7053 7064 G CHEN 2015 1314 1324 Z FEDERSEL 2012 72 75 C GAO 2015 1006 1013 H TANAKA 2011 6742 6750 R WANG 2014 1976 1983 W MAYER 1994 1239 1272 H FRISCH 2009 M REVISIOND01EDN ZHAO 2008 215 241 Y HAY 1985 270 283 P FUKUI 1981 363 368 K MARENICH 2009 6378 6396 A FELLER 1996 1571 1586 D SCHUCHARDT 2007 1045 1052 K BHADBHADE 2011 6220 6228 M RACHIDI 1990 671 677 I RIEHL 1992 729 737 J OLIVAN 1997 2227 2229 M LAM 2003 4557 4568 W HAYNES 1992 28 36 G ZHOUX2016X101 ZHOUX2016X101X107 ZHOUX2016X101XJ ZHOUX2016X101X107XJ 2018-02-12T00:00:00Z http://creativecommons.org/licenses/by-nc-nd/4.0/ item S0926-860X(16)30043-6 S0926860X16300436 1-s2.0-S0926860X16300436 10.1016/j.apcata.2016.01.043 271346 2024-01-01T12:30:29.635264Z 2016-04-10 1-s2.0-S0926860X16300436-main.pdf https://s3-eu-west-1.amazonaws.com/prod-ucs-content-store-eu-west/content/pii:S0926860X16300436/MAIN/application/pdf/7aa16896e89c756c61efdc456f360939/main.pdf https://s3.amazonaws.com/prod-ucs-content-store-us-east/content/pii:S0926860X16300436/MAIN/application/pdf/7aa16896e89c756c61efdc456f360939/main.pdf main.pdf pdf true 1628580 MAIN 7 1-s2.0-S0926860X16300436-main_1.png https://s3-eu-west-1.amazonaws.com/prod-ucs-content-store-eu-west/content/pii:S0926860X16300436/PREVIEW/image/png/eae86191494b5300ede2d21add9f0672/main_1.png https://s3.amazonaws.com/prod-ucs-content-store-us-east/content/pii:S0926860X16300436/PREVIEW/image/png/eae86191494b5300ede2d21add9f0672/main_1.png main_1.png png 58327 849 656 IMAGE-WEB-PDF 1 1-s2.0-S0926860X16300436-fx1.sml https://s3-eu-west-1.amazonaws.com/prod-ucs-content-store-eu-west/content/pii:S0926860X16300436/fx1/THUMBNAIL/image/gif/728da784e797a2a3b6e8a15df221e420/fx1.sml https://s3.amazonaws.com/prod-ucs-content-store-us-east/content/pii:S0926860X16300436/fx1/THUMBNAIL/image/gif/728da784e797a2a3b6e8a15df221e420/fx1.sml fx1 true fx1.sml sml 4551 88 219 IMAGE-THUMBNAIL 1-s2.0-S0926860X16300436-gr1.sml https://s3-eu-west-1.amazonaws.com/prod-ucs-content-store-eu-west/content/pii:S0926860X16300436/gr1/THUMBNAIL/image/gif/158df37d4b09469d58a7a1ab4be9daa9/gr1.sml https://s3.amazonaws.com/prod-ucs-content-store-us-east/content/pii:S0926860X16300436/gr1/THUMBNAIL/image/gif/158df37d4b09469d58a7a1ab4be9daa9/gr1.sml gr1 gr1.sml sml 22243 164 186 IMAGE-THUMBNAIL 1-s2.0-S0926860X16300436-gr2.sml https://s3-eu-west-1.amazonaws.com/prod-ucs-content-store-eu-west/content/pii:S0926860X16300436/gr2/THUMBNAIL/image/gif/b26d93b59dac46692fd2e0a6fb79486a/gr2.sml https://s3.amazonaws.com/prod-ucs-content-store-us-east/content/pii:S0926860X16300436/gr2/THUMBNAIL/image/gif/b26d93b59dac46692fd2e0a6fb79486a/gr2.sml gr2 gr2.sml sml 11794 65 219 IMAGE-THUMBNAIL 1-s2.0-S0926860X16300436-gr3.sml https://s3-eu-west-1.amazonaws.com/prod-ucs-content-store-eu-west/content/pii:S0926860X16300436/gr3/THUMBNAIL/image/gif/b3dc2e72f4753334c6c79cb5e7973b8b/gr3.sml https://s3.amazonaws.com/prod-ucs-content-store-us-east/content/pii:S0926860X16300436/gr3/THUMBNAIL/image/gif/b3dc2e72f4753334c6c79cb5e7973b8b/gr3.sml gr3 gr3.sml sml 16053 130 219 IMAGE-THUMBNAIL 1-s2.0-S0926860X16300436-gr4.sml https://s3-eu-west-1.amazonaws.com/prod-ucs-content-store-eu-west/content/pii:S0926860X16300436/gr4/THUMBNAIL/image/gif/22350b611ddeab1efca87294a8e6294d/gr4.sml https://s3.amazonaws.com/prod-ucs-content-store-us-east/content/pii:S0926860X16300436/gr4/THUMBNAIL/image/gif/22350b611ddeab1efca87294a8e6294d/gr4.sml gr4 gr4.sml sml 12465 164 130 IMAGE-THUMBNAIL 1-s2.0-S0926860X16300436-gr5.sml https://s3-eu-west-1.amazonaws.com/prod-ucs-content-store-eu-west/content/pii:S0926860X16300436/gr5/THUMBNAIL/image/gif/63f35b48923122fca1833b41db83fe5c/gr5.sml https://s3.amazonaws.com/prod-ucs-content-store-us-east/content/pii:S0926860X16300436/gr5/THUMBNAIL/image/gif/63f35b48923122fca1833b41db83fe5c/gr5.sml gr5 gr5.sml sml 17214 131 219 IMAGE-THUMBNAIL 1-s2.0-S0926860X16300436-gr6.sml https://s3-eu-west-1.amazonaws.com/prod-ucs-content-store-eu-west/content/pii:S0926860X16300436/gr6/THUMBNAIL/image/gif/00cf7380c8225ab2d2a21c04eb28e915/gr6.sml https://s3.amazonaws.com/prod-ucs-content-store-us-east/content/pii:S0926860X16300436/gr6/THUMBNAIL/image/gif/00cf7380c8225ab2d2a21c04eb28e915/gr6.sml gr6 gr6.sml sml 15292 164 129 IMAGE-THUMBNAIL 1-s2.0-S0926860X16300436-sc1.sml https://s3-eu-west-1.amazonaws.com/prod-ucs-content-store-eu-west/content/pii:S0926860X16300436/sc1/THUMBNAIL/image/gif/f718bc83ff15d39c4d1d5295236c859e/sc1.sml https://s3.amazonaws.com/prod-ucs-content-store-us-east/content/pii:S0926860X16300436/sc1/THUMBNAIL/image/gif/f718bc83ff15d39c4d1d5295236c859e/sc1.sml sc1 sc1.sml sml 12224 153 219 IMAGE-THUMBNAIL 1-s2.0-S0926860X16300436-fx1.jpg https://s3-eu-west-1.amazonaws.com/prod-ucs-content-store-eu-west/content/pii:S0926860X16300436/fx1/DOWNSAMPLED/image/jpeg/52b673b005c26a4d05031dd5635b7423/fx1.jpg https://s3.amazonaws.com/prod-ucs-content-store-us-east/content/pii:S0926860X16300436/fx1/DOWNSAMPLED/image/jpeg/52b673b005c26a4d05031dd5635b7423/fx1.jpg fx1 true fx1.jpg jpg 19162 200 500 IMAGE-DOWNSAMPLED 1-s2.0-S0926860X16300436-gr1.jpg https://s3-eu-west-1.amazonaws.com/prod-ucs-content-store-eu-west/content/pii:S0926860X16300436/gr1/DOWNSAMPLED/image/jpeg/5e6f5fe6370b4297d44656e9d873d7c9/gr1.jpg https://s3.amazonaws.com/prod-ucs-content-store-us-east/content/pii:S0926860X16300436/gr1/DOWNSAMPLED/image/jpeg/5e6f5fe6370b4297d44656e9d873d7c9/gr1.jpg gr1 gr1.jpg jpg 81555 497 565 IMAGE-DOWNSAMPLED 1-s2.0-S0926860X16300436-gr2.jpg https://s3-eu-west-1.amazonaws.com/prod-ucs-content-store-eu-west/content/pii:S0926860X16300436/gr2/DOWNSAMPLED/image/jpeg/53b16beac0c42eb2f2fc2fadd7d4fff2/gr2.jpg https://s3.amazonaws.com/prod-ucs-content-store-us-east/content/pii:S0926860X16300436/gr2/DOWNSAMPLED/image/jpeg/53b16beac0c42eb2f2fc2fadd7d4fff2/gr2.jpg gr2 gr2.jpg jpg 40458 200 678 IMAGE-DOWNSAMPLED 1-s2.0-S0926860X16300436-gr3.jpg https://s3-eu-west-1.amazonaws.com/prod-ucs-content-store-eu-west/content/pii:S0926860X16300436/gr3/DOWNSAMPLED/image/jpeg/5629b0a637806d74a380ff7884279b98/gr3.jpg https://s3.amazonaws.com/prod-ucs-content-store-us-east/content/pii:S0926860X16300436/gr3/DOWNSAMPLED/image/jpeg/5629b0a637806d74a380ff7884279b98/gr3.jpg gr3 gr3.jpg jpg 56841 335 565 IMAGE-DOWNSAMPLED 1-s2.0-S0926860X16300436-gr4.jpg https://s3-eu-west-1.amazonaws.com/prod-ucs-content-store-eu-west/content/pii:S0926860X16300436/gr4/DOWNSAMPLED/image/jpeg/1c8538f3ffeb577f011e3819efe4f975/gr4.jpg https://s3.amazonaws.com/prod-ucs-content-store-us-east/content/pii:S0926860X16300436/gr4/DOWNSAMPLED/image/jpeg/1c8538f3ffeb577f011e3819efe4f975/gr4.jpg gr4 gr4.jpg jpg 76786 712 565 IMAGE-DOWNSAMPLED 1-s2.0-S0926860X16300436-gr5.jpg https://s3-eu-west-1.amazonaws.com/prod-ucs-content-store-eu-west/content/pii:S0926860X16300436/gr5/DOWNSAMPLED/image/jpeg/aa3089cdb70f182c0600d61b82c22618/gr5.jpg https://s3.amazonaws.com/prod-ucs-content-store-us-east/content/pii:S0926860X16300436/gr5/DOWNSAMPLED/image/jpeg/aa3089cdb70f182c0600d61b82c22618/gr5.jpg gr5 gr5.jpg jpg 61881 337 565 IMAGE-DOWNSAMPLED 1-s2.0-S0926860X16300436-gr6.jpg https://s3-eu-west-1.amazonaws.com/prod-ucs-content-store-eu-west/content/pii:S0926860X16300436/gr6/DOWNSAMPLED/image/jpeg/f8794ff962d5f14a00ccf96c9668c7fa/gr6.jpg https://s3.amazonaws.com/prod-ucs-content-store-us-east/content/pii:S0926860X16300436/gr6/DOWNSAMPLED/image/jpeg/f8794ff962d5f14a00ccf96c9668c7fa/gr6.jpg gr6 gr6.jpg jpg 81128 718 565 IMAGE-DOWNSAMPLED 1-s2.0-S0926860X16300436-sc1.jpg https://s3-eu-west-1.amazonaws.com/prod-ucs-content-store-eu-west/content/pii:S0926860X16300436/sc1/DOWNSAMPLED/image/jpeg/bb9fb6627a282a64bdeb3d1bfd572d2b/sc1.jpg https://s3.amazonaws.com/prod-ucs-content-store-us-east/content/pii:S0926860X16300436/sc1/DOWNSAMPLED/image/jpeg/bb9fb6627a282a64bdeb3d1bfd572d2b/sc1.jpg sc1 sc1.jpg jpg 57549 474 677 IMAGE-DOWNSAMPLED 1-s2.0-S0926860X16300436-fx1_lrg.jpg https://s3-eu-west-1.amazonaws.com/prod-ucs-content-store-eu-west/content/pii:S0926860X16300436/fx1/HIGHRES/image/jpeg/81b9fcddf1ab56a4ee39360b5fcbabe7/fx1_lrg.jpg https://s3.amazonaws.com/prod-ucs-content-store-us-east/content/pii:S0926860X16300436/fx1/HIGHRES/image/jpeg/81b9fcddf1ab56a4ee39360b5fcbabe7/fx1_lrg.jpg fx1 true fx1_lrg.jpg jpg 131152 886 2213 IMAGE-HIGH-RES 1-s2.0-S0926860X16300436-gr1_lrg.jpg https://s3-eu-west-1.amazonaws.com/prod-ucs-content-store-eu-west/content/pii:S0926860X16300436/gr1/HIGHRES/image/jpeg/aa2bdf355593a4187090d67b20610012/gr1_lrg.jpg https://s3.amazonaws.com/prod-ucs-content-store-us-east/content/pii:S0926860X16300436/gr1/HIGHRES/image/jpeg/aa2bdf355593a4187090d67b20610012/gr1_lrg.jpg gr1 gr1_lrg.jpg jpg 417715 2198 2500 IMAGE-HIGH-RES 1-s2.0-S0926860X16300436-gr2_lrg.jpg https://s3-eu-west-1.amazonaws.com/prod-ucs-content-store-eu-west/content/pii:S0926860X16300436/gr2/HIGHRES/image/jpeg/b9b3f67bb38b1f6b06ccd5686b0cf02f/gr2_lrg.jpg https://s3.amazonaws.com/prod-ucs-content-store-us-east/content/pii:S0926860X16300436/gr2/HIGHRES/image/jpeg/b9b3f67bb38b1f6b06ccd5686b0cf02f/gr2_lrg.jpg gr2 gr2_lrg.jpg jpg 212111 884 3000 IMAGE-HIGH-RES 1-s2.0-S0926860X16300436-gr3_lrg.jpg https://s3-eu-west-1.amazonaws.com/prod-ucs-content-store-eu-west/content/pii:S0926860X16300436/gr3/HIGHRES/image/jpeg/2c505bf2e30ee6fd3fd8298871f4f3f0/gr3_lrg.jpg https://s3.amazonaws.com/prod-ucs-content-store-us-east/content/pii:S0926860X16300436/gr3/HIGHRES/image/jpeg/2c505bf2e30ee6fd3fd8298871f4f3f0/gr3_lrg.jpg gr3 gr3_lrg.jpg jpg 286235 1483 2500 IMAGE-HIGH-RES 1-s2.0-S0926860X16300436-gr4_lrg.jpg https://s3-eu-west-1.amazonaws.com/prod-ucs-content-store-eu-west/content/pii:S0926860X16300436/gr4/HIGHRES/image/jpeg/a46e82a0bd22ce19da743f7e2235753e/gr4_lrg.jpg https://s3.amazonaws.com/prod-ucs-content-store-us-east/content/pii:S0926860X16300436/gr4/HIGHRES/image/jpeg/a46e82a0bd22ce19da743f7e2235753e/gr4_lrg.jpg gr4 gr4_lrg.jpg jpg 465464 3150 2500 IMAGE-HIGH-RES 1-s2.0-S0926860X16300436-gr5_lrg.jpg https://s3-eu-west-1.amazonaws.com/prod-ucs-content-store-eu-west/content/pii:S0926860X16300436/gr5/HIGHRES/image/jpeg/c50dd8ded909083a8cd14a38dc1697d7/gr5_lrg.jpg https://s3.amazonaws.com/prod-ucs-content-store-us-east/content/pii:S0926860X16300436/gr5/HIGHRES/image/jpeg/c50dd8ded909083a8cd14a38dc1697d7/gr5_lrg.jpg gr5 gr5_lrg.jpg jpg 323538 1493 2500 IMAGE-HIGH-RES 1-s2.0-S0926860X16300436-gr6_lrg.jpg https://s3-eu-west-1.amazonaws.com/prod-ucs-content-store-eu-west/content/pii:S0926860X16300436/gr6/HIGHRES/image/jpeg/180ef67f4b418730e228d161aa837035/gr6_lrg.jpg https://s3.amazonaws.com/prod-ucs-content-store-us-east/content/pii:S0926860X16300436/gr6/HIGHRES/image/jpeg/180ef67f4b418730e228d161aa837035/gr6_lrg.jpg gr6 gr6_lrg.jpg jpg 463919 3178 2500 IMAGE-HIGH-RES 1-s2.0-S0926860X16300436-sc1_lrg.jpg https://s3-eu-west-1.amazonaws.com/prod-ucs-content-store-eu-west/content/pii:S0926860X16300436/sc1/HIGHRES/image/jpeg/439919659c8d670b919d94e52d73340a/sc1_lrg.jpg https://s3.amazonaws.com/prod-ucs-content-store-us-east/content/pii:S0926860X16300436/sc1/HIGHRES/image/jpeg/439919659c8d670b919d94e52d73340a/sc1_lrg.jpg sc1 sc1_lrg.jpg jpg 348781 2098 2999 IMAGE-HIGH-RES 1-s2.0-S0926860X16300436-mmc2.zip https://s3-eu-west-1.amazonaws.com/prod-ucs-content-store-eu-west/content/pii:S0926860X16300436/mmc2/MAIN/application/zip/7dfd4a34f6c0cec363f4e45b10962d90/mmc2.zip https://s3.amazonaws.com/prod-ucs-content-store-us-east/content/pii:S0926860X16300436/mmc2/MAIN/application/zip/7dfd4a34f6c0cec363f4e45b10962d90/mmc2.zip mmc2 mmc2.zip zip 102489 APPLICATION 1-s2.0-S0926860X16300436-mmc1.docx https://s3-eu-west-1.amazonaws.com/prod-ucs-content-store-eu-west/content/pii:S0926860X16300436/mmc1/MAIN/application/msword/4ea1a1c7571b04a8f75715e13f19853e/mmc1.docx https://s3.amazonaws.com/prod-ucs-content-store-us-east/content/pii:S0926860X16300436/mmc1/MAIN/application/msword/4ea1a1c7571b04a8f75715e13f19853e/mmc1.docx mmc1 mmc1.docx docx 48585 APPLICATION APCATA 15758 S0926-860X(16)30043-6 10.1016/j.apcata.2016.01.043 Elsevier B.V. Scheme 1 Proposed mechanism for the Ru-catalyzed dehydrogenation of formic acid, including two competing cycles I and II. Fig. 1 Optimized structures of 1_transPh (a), 1_cisPh (b), 1_transiPr (c), and 1_cisiPr (d). All hydrogen atoms, except for that bonds with Ru atom, are omitted for clarity. (Gray: carbon; orange: phosphorus; green: ruthenium; white: hydrogen). (For interpretation of the references to color in this figure legend, the reader is referred to the web version of this article.) Fig. 2 Gibbs energy profiles for trans and cis inter-conversion of two Ru catalysts: P(PPh2)3RuH+ (a) and P(P′ i Pr2)3RuH+ (b). Fig. 3 Gibbs energy profiles for cycle I of P(PPh2)3RuH+. Fig. 4 Gibbs energy profiles for cycle II of P(PPh2)3RuH+. Fig. 5 Gibbs energy profiles for cycle I of P(P′ i Pr2)3RuH+. Fig. 6 Gibbs energy profiles for cycle II of P(P′ i Pr2)3RuH+. Theoretical investigation on the ruthenium catalyzed dehydrogenation of formic acid and ligand effect Jia Zhou Department of Chemistry, Harbin Institute of Technology, Harbin 150001, China Department of Chemistry Harbin Institute of Technology Harbin 150001 China Graphical abstract Density functional theory (DFT) calculations were used to study the mechanisms of dehydrogenation of formic acid catalyzed by two Ru complexes, including P(CH2CH2PPh2)3RuH+ (P(CH2CH2PPh2)3 =tris[2-(diphenylphosphino)ethyl]phosphine) and P(CH2CH2CH2P i Pr2)3RuH+ (P(CH2CH2CH2P i Pr2)3 =tris[3-(diisopropylphosphino)propyl]phosphine). Two competing catalytic cycles (I and II) have been explored. In cycle I, the catalytic reaction starts with a direct hydride transfer from HCOO− to a Ru center, releasing CO2 in the first place, followed by H2 production, while in cycle II, neutral formic acid approaches Ru catalyst to produce H2 molecule prior to CO2 generation via β-hydride elimination. The computational results show that cycle I is more accessible than cycle II, regardless of the ligands surrounding Ru center. The calculated overall Gibbs free energy barriers for formic acid dehydrogenation catalyzed by P(CH2CH2PPh2)3RuH+ (14.3kcal/mol) is significantly lower than its iron analogue in the previous experimental and theoretical studies (18.9kcal/mol) at the same level of theory. More interestingly, isopropyl group, a more electron-donating group than phenyl group, leads to an even lower reaction barrier of P(CH2CH2CH2P i Pr2)3RuH+ (12.9kcal/mol) than P(CH2CH2PPh2)3RuH+, indicating a more positive role the ligand could potentially play in the performance of the catalysts. Our results pave a new way to design more efficient catalysts for formic acid dehydrogenation. Keywords Density functional theory (DFT) Ruthenium complexes Dehydrogenation Formic acid Ligand effect 1 Introduction Energy storage is a hot global issue, and molecular hydrogen is one of the ideal candidates for this purpose due to its high energy density [1–3]. Fossil fuels, on the other hand, are becoming more scarce, resulting in dramatic price rises. Renewable energy, which comes from natural resources such as sunlight, wind, and tides, are thus being pursued. Biomass (plant material) is a renewable energy source because the energy it contains comes from the sun [4]. It is one of the best ways to store solar energy as fuel [5], because of a much higher energy density compared to batteries or mechanical storage devices. Among currently available biomass materials, formic acid (HCOOH) is thought to be a good organic hydrogen storage molecule, due to its high hydrogen content (ca. 4.4wt%) [6], and could be produced by hydrothermal oxidation of model biomass materials (glucose, starch and cellulose) [7]. To this end, it has drawn great attention to study the dehydrogenation of formic acid, and many different heterogeneous and homogeneous catalyst systems have since been explored. In recent years, a variety of transition metals, such as Fe [8–11], Ru [12–16], Co [17,18], and Ir [19,20], accompanied with the stabilizing ligands have been utilized to catalyze the dehydrogenation of formic acid. The stabilizing ligands are usually polydentate phosphines, which are used for controlling the stereochemistry of coordination complexes and solubilizing metal catalysts [21]. Among those transition metal catalysts, Boddien et al. in particular developed a highly active iron based catalyst for hydrogen production from formic acid using P(CH2CH2PPh2)3FeH+ (P(CH2CH2PPh2)3 =tris[2-(diphenylphosphino)ethyl]phosphine) in 2011 [8]. This iron catalyst has an impressive turnover frequency of up to 9425h−1, and a turnover number of more than 93,000 at 80°C. Shortly after, a theoretical study was carried out to elucidate the mechanism of the iron catalyzed formic acid dehydrogenation, pointing out β-hydrides elimination pathway is the most possible pathway, with the reaction barrier only 20.5kcal/mol [11]. In parallel, ruthenium is also widely investigated for formic acid dehydrogenation from both the experimental perspective [12–14] and the theoretical perspective [15,16]. For instance, Gonsalvi and co-workers studied formic acid dehydrogenation catalyzed by Ru complexes bearing the polydentate tripodal ligands 1,1,1-tris-(diphenylphosphinomethyl)ethane(triphos) and tris-[2-(diphenylphosphino)ethyl]-amine (NP3). By combining the experimental studies and DFT calculations, they were able to clarify the mechanism of the catalytic reaction, which showed superior performances with a TON of 10,000 after 6h using 0.01mol% of the catalyst [12,15]. Given that several different stabilizing ligands have been used in the studies of formic acid dehydrogenation combining with iron and ruthenium [8,12], it would be worth figuring out the relationship between stabilizing ligands and the catalysis. Encouraged by previous theoretical study on the P(CH2CH2PPh2)3FeH+ system [10,11], we would like to explore how P(CH2CH2PPh2)3RuH+, analogous to P(CH2CH2PPh2)3FeH+, will perform for formic acid dehydrogenation, and in addition to the direct comparison of metal center, if the stabilizing ligands, coordinating to the transition metal center, could impact the catalytic efficiency and how much extent the impact could possibly be. In this paper, we report a thorough theoretical study of dehydrogenation of formic acid catalyzed by P(CH2CH2PPh2)3RuH+ and P(CH2CH2CH2P i Pr2)3RuH+. A detailed reaction mechanism with key transition states is explored based upon DFT calculations, as well as the influence of the different stabilizing ligands. We are aiming to develop new formic acid dehydrogenation catalysts with high efficiency with the aid of computational chemistry methods. 2 Methods All DFT calculations were carried out with the Gaussian09 suite of ab initio programs [22]. All structures were fully optimized by the M06 [23] functional in the gas phase. The Los Alamos basis set [24] and the associated effective core potential (ECP) was used for Ru atom, and an all-electron 6-31G(d) basis set was used for all the other atoms. This basis set combination is referred to as BS1. An “ultrafine” integration grid of 99 radial shells and 590 angular points per shell was used throughout. The harmonic vibrational frequency calculations were performed to ensure that either a minimum (no imaginary frequency) or first-order saddle point (only one imaginary frequency) was obtained. Intrinsic reaction coordinate (IRC) [25] calculations were used to confirm the connectivity between transition structures and minima. To further refine the energies obtained from the M06/BS1 calculations, we carried out single-point energy calculations for all of the structures (including HCOOH, CO2 and H2) with a larger basis set (BS2) in THF corresponding to the experimental reaction conditions [8], using the SMD [26] solvation model. BS2 utilizes the triple ζ valence LANL2TZ plus f function basis set [27,28] on Ru atom, and 6-311++G(d,p) basis set on the others. Unless otherwise stated, the energies reported in this paper are Gibbs free energies under 298.15K and 1atm with solvent effect corrections. Given the complexity of the systems in the current study, the above techniques are a reasonable compromise to make the computations more tractable. The Cartesian coordinates of the optimized structures along with energies are reported in the Supporting information. 3 Results and discussion Based on previous study on iron catalyzed dehydrogenation of formic acid [8,11], two competing catalytic cycles (I and II) of dehydrogenation of formic acid catalyzed by Ru complexes are proposed, as displayed in Scheme 1 . In cycle I, the catalytic reaction begins with the coordination of HCOO− to Ru catalyst, while in cycle II, neutral formic acid molecule directly coordinate with Ru catalyst. The Ru catalysts, including P(CH2CH2PPh2)3RuH+ (short as P(PPh2)3RuH+), and P(CH2CH2CH2P i Pr2)3RuH+ (short as P(P’ i Pr2)3RuH+), each have two isomers. Fig. 1 shows the optimized structures of P(PPh2)3RuH+ (1_transPh and 1_cisPh), and P(P’ i Pr2)3RuH+ (1_trans i Pr and 1_cis i Pr). The structure of P(PPh2)3RuH+ is analogous to the Fe catalyst in the previous literatures [8,11], while P(P’ i Pr2)3RuH+ could be produced from P(P’ i Pr2)3RuCl+ [29]. The molecular structure of 1_transPh and 1_trans i Pr is a distorted trigonal bipyramidal geometry [30–33] with three equatorial phosphorus ligands, and the remaining phosphorus (labeled as Pc in Fig. 1) and the hydride (labeled as H in Fig. 1) being in the axial coordination site (the H-Ru-Pc angle is 173.4° and 179.5° for 1_transPh and 1_transiPr, respectively). The Ru-H distance of 1_transiPr (1.67 Å) is a little shorter than that of 1_transPh (1.69Å). Different from 1_transPh and 1_transiPr with the hydride (H) trans to the Pc atom, the structure of 1_cisPh and 1_cisiPr contains a cis-hydride towards to the Pc atom. Both of them exhibit a distorted square-pyramidal geometry with three equatorial phosphorus ligands and the hydride making up the base and the Pc atom at the apex. In cis structures, the RuH bond distance is shorter (0.2–0.3Å) than its respective trans counterpart, indicating a stronger RuH bond. In fact, the trans structure is higher in energy than its cis counterpart (8.0/6.0kcal/mol for P(PPh2)3RuH+/P(P’iPr2)3RuH+), and the barrier for mutual exchange is 4.1/5.1kcal/mol (from trans to cis) for P(PPh2)3RuH+/P(P’iPr2)3RuH+, as shown in Fig. 2 . These energetics suggest that both trans and cis isomers could be involved in the catalytic reactions, and thus have to be considered. Next, we are going to investigate the two catalytic cycles (I and II) of P(PPh2)3RuH+ and P(P’ i Pr2)3RuH+, respectively. Fig. 3 shows the Gibbs energy profile for cycle I of P(PPh2)3RuH+ (see all the optimized structures in the Supporting information). There are two ways for HCOO− to react with P(PPh2)3RuH+, forming either RuO bond or RuH bond, and the according products are 6_cisPh and 2_cisPh, respectively. Both processes are exothermic and spontaneous, with 6_cisPh ca. 7.9kcal/mol lower in energy than 2_cisPh due to stronger RuO bond, but only 2_cisPh leads to more stable product afterwards. A similar phenomenon is also observed in the iron catalyzed dehydrogenation of formic acid [11]. In this cycle, only the pathway starting from 1_cisPh is shown, because for trans case, 2_transPh and TS2trans_3 Ph are not able to be located after numerous attempts. Moreover, 6_cisPh is lower in energy than 6_transPh (ca. 5.3kcal/mol). Although it fails to optimize 2_transPh and TS2trans_3 Ph structures, the hydrogen transfer from HCOO− to P(PPh2)3RuH+ for both trans and cis cases would result in the same products, neutral 3Ph +CO2. In neutral 3Ph, two hydrides occupy both the trans and cis position of Ru complex, and the HH distance is ca. 2.26Å, making it a clear dihydride structure. The mutual exchange between dihydride and dihydrogen ligands have been studied in the previous study [34], and we also investigate this possibility in our case. It turns out that only the cis hydride could move to the trans position, making the new HH distance ca. 0.85Å in 4_transPh, while the opposite could not (4_cisPh is not stable). The barrier for this process is ca. 11.7kcal/mol. The HH distance in 4_transPh (0.85Å) is just a little longer than that in free H2 molecule (0.74Å) at the same level, indicating 4_transPh a more dihydrogen structure. The empty cis position of 4_transPh provides a space for free proton (H+) attacking to become 5_transPh. However, there is another one-step route to arrive at 5_transPh for 3Ph via the protonation by a proton from a formic acid molecule (TS3_5trans Ph), and this route requires much less energy (8.5kcal/mol) than the route via TS3_4trans Ph (11.7kcal/mol). This route was also investigated for Fe-catalyzed formic acid dehydrogenation, and the corresponding barrier between 3Ph for 5_transPh is almost thermoneutral [10]. Compared with 4_transPh, the HH distance (0.83Å) in the trans position of 5_transPh becomes a little shorter. Dissociation of dihydrogen ligands from 5_transPh requires 12.3kcal/mol, regenerating 1_cisPh along with H2 molecule. 5_transPh is a distorted octahedral structure with the hydride and dihydrogen ligands in mutually cis coordination sites. A similar structure has been studied by others [29], and fast exchange between the hydrido and dihydrogen ligands has been found at room temperature. As shown in the inset of Fig. 3, 5_transPh and 5_cisPh are relatively close in energy (less than 10kcal/mol apart) and the barrier between them is fairly low. Dissociation of dihydrogen ligands from 5_cisPh reproduces 1_transPh along with H2 molecule. After comparing all the relative energies shown in Fig. 3, the total Gibbs energy barrier is 14.3kcal/mol (3Ph →TS5trans_1cis Ph), which is far less than Fe-catalyzed formic acid dehydrogenation (18.9kcal/mol) [10]. On the other hand, P(PPh2)3RuH+ can also react with neutral HCOOH to generate CO2 and H2 (cycle II), as shown in Fig. 4 for the corresponding Gibbs energy profiles. Both trans (Fig. 4a) and cis (Fig. 4b) P(PPh2)3RuH+ are found to be able to be react with neutral HCOOH, despite the mutual exchange between the two isomers. In both reactions, the first step is the coordination of a formic acid molecule to the vacant position of P(PPh2)3RuH+. In the intermediate 7_transPh/7_cisPh, there is a strong Ru-Hδ−⋯Hδ+-O interaction, with the Hδ−⋯Hδ+ distance 1.48/1.55Å, comparable to the previous study on iron [11]. The Hδ+ approaches to the Hδ− to generate 8_transPh/8_cisPh with dihydrogen ligand. In cis case, structure 8_cisPh is thermoneutral to TS7cis_8cis Ph, and the latter is thus not shown on the potential energy surface (PES). After the dihydrogen ligand’s dissociation, both 8_transPh and 8_cisPh arrive at the same structure, 9Ph, possessing two Ru-O bonds (2.30 and 2.24Å for trans and cis position). 9Ph is the most stable species on both trans and cis PESs. There are two pathways for CO2 generation from structure 9Ph: from trans or cis site of Ru center, as seen in 12_transPh or 12_cisPh. Generally, three steps are involved from 9Ph to 12_cisPh: Ru-O elongation (TS9_10cis Ph), OH flip-flopping (TS10cis_11cis Ph), and H transfer (TS11cis_12cis Ph). For trans case, however Ru-O elongation (TS9_10trans Ph) and the according intermediate 10_transPh are not stable, making 9Ph directly to connect 11_transPh via TS9_11trans Ph. From structure 9Ph, it would be much easier for it to release CO2 to get back to 1_cisPh, overcoming a 16.0kcal/mol barrier (TS10cis_11cis Ph) than to 1_transPh with 19.4kcal/mol barrier (TS11trans_12trans Ph). Both of them though are remarkably higher than the overall barrier (14.3kcal/mol) in cycle I. As discussed previously, a variety of transition metal complexes were explored to do formic acid dehydrogenation, such as Fe [8–11], Ru [12–16], Co [17,18], and Ir [19,20]. In addition to metal itself, we also wonder how the dentate ligands play a role to the catalytic reaction. Isopropyl group is a more electron-donating group than phenyl group. Take 1_cisPh and 1_cisiPr for example, and Ru Mulliken charge is −0.69|e| and −0.83|e|, respectively. P(CH2CH2CH2P i Pr2)3RuH+ (short as P(P’ i Pr2)3RuH+), derived from the previous experimental study [29], is thought to be a potential candidate for formic acid dehydrogenation. Fig. 5 shows the Gibbs energy profile for cycle I of P(P’ i Pr2)3RuH+. Despite a generally similar reaction route, there are a few differences between the PESs of P(PPh2)3RuH+ and that of P(P’ i Pr2)3RuH+. In the latter case, we were able to locate the 2_transiPr and TS2trans_3 iPr, but they both lie above their respective cis counterparts. Both trans and cis P(P’ i Pr2)3RuH+ end up with neutral 3iPr +CO2 after reacting with HCOO−. We were able to locate the TS3_4trans iPr, but it is lower in energy than 4_transiPr by 1.6kcal/mol. TS3_5trans iPr still lies lower in energy than 4_transiPr, as in P(PPh2)3RuH+, and becomes the rate-determining step of cycle I for P(P’ i Pr2)3RuH+ (12.9kcal/mol relative to 3iPr), surpassing TS5trans_1cis iPr. Fig. 6 shows the Gibbs energy profiles for cycle II of P(P’ i Pr2)3RuH+. Generally speaking, the PESs for cycle II of P(P’ i Pr2)3RuH+ are similar to those of P(PPh2)3RuH+. Major difference however exists for the PES prior to 9iPr. The barrier for the process from 1_transPh/1_cisPh to 9Ph, namely H2 production, is only 6.8kcal/mol (8_transPh →TS8trans_9 Ph; or 8.1kcal/mol if considering 1_cisPh) and 10.8kcal/mol (1_cisPh →TS8cis_9 Ph), significantly lower than the following CO2 generation, as discussed previously. By contrast, the H2 production in P(P’ i Pr2)3RuH+ case requires more energy, 23.7kcal/mol for 1_transiPr (1_cisiPr →TS8trans_9 iPr; keep in mind that 1_cisiPr is more stable than 1_transiPr by 6kcal/mol) and 26.4kcal/mol for 1_cisiPr (1_cisiPr →TS8cis_9 iPr). As for CO2 generation, the activation energy is 18.3kcal/mol (9iPr →TS11trans_12trans iPr) and 14.8kcal/mol (9iPr →TS11cis_12cis iPr) for returning to 1_transiPr and 1_cisiPr, respectively. When comparing all the relative energies, it should be pointed out that for H2 production, it is a little easier for 1_cisiPr to convert to 1_transiPr in the first place (small barrier 11.1kcal/mol as seen in Fig. 2b), followed by passing TS8trans_9 iPr than for 1_cisiPr to directly overcome TS8cis_9 iPr. When reaching H2 production intermediate 9iPr, it is much easier for it to convert back to 1_cisiPr than to 1_transiPr. Therefore, the total Gibbs energy barrier for cycle II of P(P’ i Pr2)3RuH+ is 23.7kcal/mol, with the key detailed pathway being 1_cisiPr to 1_transiPr to TS8trans_9 iPr to 9iPr to TS11cis_12cis iPr to 1_cisiPr. We might notice in the above discussions, the starting points for cycle I and cycle II are different: HCOO− (somewhat like catalyst) and HCOOH in cycle I, while HCOOH only in cycle II. Formic acid is a week acid and thus mostly in the neutral form in solvent. We are aware that formic acid to some extent tends to exist as hydrogen-bonded dimers rather than individual molecules and counter anion in the solution is omitted in our computation, but our sophisticate model would be adequate to make a direct comparison of different metal centers and dentate ligands. Now we can conclude that for P(PPh2)3RuH+ and P(P’ i Pr2)3RuH+, the most likely pathway is that the Ru catalyst reacts with formate anion (HCOO−) in the first place, followed by CO2 generation and H2 production, and either TS5trans_1cis Ph or TS3_5trans iPr is the rate-determining step. For both Ru catalysts, cycle I is more accessible than cycle II. However, the difference of the reaction barriers of the two cycles is quite different: 1.7kcal/mol for P(PPh2)3RuH+, and 10.8kcal/mol for P(P’ i Pr2)3RuH+, indicating cycle II plays an even less role in P(P’ i Pr2)3RuH+ catalyzed formic acid dehydrogenation than in P(PPh2)3RuH+. Nevertheless, both Ru complexes show a better performance on formic acid dehydrogenation than the iron complex ((PPh2)3FeH+,) used in the previous studies [8,10,11]. 4 Conclusions In summary, we have performed a detailed computational study on the dehydrogenation mechanisms of formic acid catalyzed by P(PPh2)3RuH+ and P(P’ i Pr2)3RuH+. Similar to the iron catalyzed formic acid dehydrogenation, two competing catalytic cycles (I and II) of Ru catalysts were investigated, and the results show the cycle I is more accessible no matter what the dentate ligand is. Both trans and cis isomer of P(PPh2)3RuH+ and P(P’ i Pr2)3RuH+ were investigated for catalyzing the formic acid dehydrogenation. Generally speaking, the cis isomer of Ru catalysts is more stable than its trans isomer, and is thus believed to dominate the whole catalytic reaction. P(PPh2)3RuH+ edges its iron analogue by 4.6kcal/mol on formic acid dehydrogenation, suggesting a better impact of Ru over Fe. Furthermore, the reaction barrier of P(P’ i Pr2)3RuH+ is lower by 1.4kcal/mol than that of P(PPh2)3RuH+, indicating isopropyl group is superior to phenyl group in this regard. These findings might be of great importance in the future choice of tailored ligands around metal centers (e.g. ruthenium) for efficient catalysts for formic acid dehydrogenation. Competing interest The authors declare no competing financial interest. Acknowledgements This research is supported by the Fundamental Research Funds for the Central Universities of China (Grant No. AUGA5710013115). Computer time made available by the National Supercomputing Center of China in Shenzhen (Shenzhen Cloud Computing Center) is gratefully acknowledged. The author also thanks Prof. Ozerov and Dr. Chun-I Lee at Texas A&M University for helpful comments. Appendix A Supplementary data Supplementary data associated with this article can be found, in the online version, at http://dx.doi.org/10.1016/j.apcata.2016.01.043. Appendix A Supplementary data The following are Supplementary data to this article: References [1] L. Schlapbach A. Zuttel Nature 414 2001 353 358 [2] J.A. Turner Science 305 2004 972 974 [3] N. Armaroli V. Balzani Angew. Chem. Int. Ed. 46 2007 52 66 [4] S.N. Naik V.V. Goud P.K. Rout A.K. Dalai Renew. Sustainable Energy Rev. 14 2010 578 597 [5] B.G. Pollet I. Staffell J.L. Shang Electrochim. Acta 84 2012 235 249 [6] T.C. Johnson D.J. Morris M. Wills Chem. Soc. Rev. 39 2010 81 88 [7] J. Yun F. Jin A. Kishita K. Tohji H. Enomoto J. Phys. Conf. Ser. 215 2010 012126 [8] A. Boddien D. Mellmann F. Gartner R. Jackstell H. Junge P.J. Dyson G. Laurenczy R. Ludwig M. Beller Science 333 2011 1733 1736 [9] T. Zell B. Butschke Y. Ben-David D. Milstein Chem. Eur. J. 19 2013 8068 8072 [10] R. Sánchez-de-Armas L. Xue M.S.G. Ahlquist Chem. Eur. J. 19 2013 11869 11873 [11] X. Yang Dalton Trans. 42 2013 11987 11991 [12] I. Mellone M. Peruzzini L. Rosi D. Mellmann H. Junge M. Beller L. Gonsalvi Dalton Trans. 42 2013 2495 2501 [13] A. Guerriero H. Bricout K. Sordakis M. Peruzzini E. Monflier F. Hapiot G. Laurenczy L. Gonsalvi ACS Catal. 4 2014 3002 3012 [14] A. Thevenon E. Frost-Pennington G. Weijia A.F. Dalebrook G. Laurenczy ChemCatChem 6 2014 3146 3152 [15] G. Manca I. Mellone F. Bertini M. Peruzzini L. Rosi D. Mellmann H. Junge M. Beller A. Ienco L. Gonsalvi Organometallics 32 2013 7053 7064 [16] Z.-N. Chen K.-Y. Chan J.K. Pulleri J. Kong H. Hu Inorg. Chem. 54 2015 1314 1324 [17] C. Federsel C. Ziebart R. Jackstell W. Baumann M. Beller Chem. Eur. J. 18 2012 72 75 [18] H. Gao L. Chen J. Chen Y. Guo D. Ye Catal. Sci. Technol. 5 2015 1006 1013 [19] R. Tanaka M. Yamashita L.W. Chung K. Morokuma K. Nozaki Organometallics 30 2011 6742 6750 [20] W.-H. Wang S. Xu Y. Manaka Y. Suna H. Kambayashi J.T. Muckerman E. Fujita Y. Himeda ChemSusChem 7 2014 1976 1983 [21] H.A. Mayer W.C. Kaska Chem. Rev. 94 1994 1239 1272 [22] M.J. Frisch G.W. Trucks H.B. Schlegel G.E. Scuseria M.A. Robb J.R. Cheeseman G. Scalmani V. Barone B. Mennucci G.A. Petersson H. Nakatsuji M. Caricato X. Li H.P. Hratchian A.F. Izmaylov J. Bloino G. Zheng J.L. Sonnenberg M. Hada M. Ehara K. Toyota R. Fukuda J. Hasegawa M. Ishida T. Nakajima Y. Honda O. Kitao H. Nakai T. Vreven J.A. Montgomery Jr. J.E. Peralta F. Ogliaro M. Bearpark J.J. Heyd E. Brothers K.N. Kudin V.N. Staroverov R. Kobayashi J. Normand K. Raghavachari A. Rendell J.C. Burant S.S. Iyengar J. Tomasi M. Cossi N. Rega N.J. Millam M. Klene J.E. Knox J.B. Cross V. Bakken C. Adamo J. Jaramillo R. Gomperts R.E. Stratmann O. Yazyev A.J. Austin R. Cammi C. Pomelli J.W. Ochterski R.L. Martin K. Morokuma V.G. Zakrzewski G.A. Voth P. Salvador J.J. Dannenberg S. Dapprich A.D. Daniels Ö. Farkas J.B. Foresman J.V. Ortiz J. Cioslowski D.J. Fox Revision D.01 Edn. 2009 Gaussian, Inc. Wallingford, CT [23] Y. Zhao D. Truhlar Theor. Chem. Acc. 120 2008 215 241 [24] P.J. Hay W.R. Wadt J. Chem. Phys. 82 1985 270 283 [25] K. Fukui Acc. Chem. Res. 14 1981 363 368 [26] A.V. Marenich C.J. Cramer D.G. Truhlar J. Phys. Chem. B 113 2009 6378 6396 [27] D. Feller J. Comput. Chem. 17 1996 1571 1586 [28] K.L. Schuchardt B.T. Didier T. Elsethagen L. Sun V. Gurumoorthi J. Chase J. Li T.L. Windus J. Chem. Inf. Model. 47 2007 1045 1052 [29] M.M. Bhadbhade L.D. Field R. Gilbert-Wilson R.W. Guest P. Jensen Inorg. Chem. 50 2011 6220 6228 [30] I.E. Rachidi O. Eisenstein Y. Jean New J. Chem. 14 1990 671 677 [31] J.F. Riehl Y. Jean O. Eisenstein M. Pelissier Organometallics 11 1992 729 737 [32] M. Oliván O. Eisenstein K.G. Caulton Organometallics 16 1997 2227 2229 [33] W.H. Lam S. Shimada A.S. Batsanov Z. Lin T.B. Marder J.A. Cowan J.A.K. Howard S.A. Mason G.J. McIntyre Organometallics 22 2003 4557 4568 [34] G.R. Haynes R.L. Martin P.J. Hay J. Am. Chem. Soc. 114 1992 28 36",
      "scopus-id": "84957921952",
      "coredata": {
        "eid": "1-s2.0-S0926860X16300436",
        "dc:description": "Density functional theory (DFT) calculations were used to study the mechanisms of dehydrogenation of formic acid catalyzed by two Ru complexes, including P(CH2CH2PPh2)3RuH+ (P(CH2CH2PPh2)3 =tris[2-(diphenylphosphino)ethyl]phosphine) and P(CH2CH2CH2P i Pr2)3RuH+ (P(CH2CH2CH2P i Pr2)3 =tris[3-(diisopropylphosphino)propyl]phosphine). Two competing catalytic cycles (I and II) have been explored. In cycle I, the catalytic reaction starts with a direct hydride transfer from HCOO− to a Ru center, releasing CO2 in the first place, followed by H2 production, while in cycle II, neutral formic acid approaches Ru catalyst to produce H2 molecule prior to CO2 generation via β-hydride elimination. The computational results show that cycle I is more accessible than cycle II, regardless of the ligands surrounding Ru center. The calculated overall Gibbs free energy barriers for formic acid dehydrogenation catalyzed by P(CH2CH2PPh2)3RuH+ (14.3kcal/mol) is significantly lower than its iron analogue in the previous experimental and theoretical studies (18.9kcal/mol) at the same level of theory. More interestingly, isopropyl group, a more electron-donating group than phenyl group, leads to an even lower reaction barrier of P(CH2CH2CH2P i Pr2)3RuH+ (12.9kcal/mol) than P(CH2CH2PPh2)3RuH+, indicating a more positive role the ligand could potentially play in the performance of the catalysts. Our results pave a new way to design more efficient catalysts for formic acid dehydrogenation.",
        "openArchiveArticle": "false",
        "prism:coverDate": "2016-04-10",
        "openaccessUserLicense": null,
        "prism:aggregationType": "Journal",
        "prism:url": "https://api.elsevier.com/content/article/pii/S0926860X16300436",
        "dc:creator": {
          "@_fa": "true",
          "$": "Zhou, Jia"
        },
        "link": [
          {
            "@_fa": "true",
            "@rel": "self",
            "@href": "https://api.elsevier.com/content/article/pii/S0926860X16300436"
          },
          {
            "@_fa": "true",
            "@rel": "scidir",
            "@href": "https://www.sciencedirect.com/science/article/pii/S0926860X16300436"
          }
        ],
        "dc:format": "application/json",
        "openaccessType": null,
        "pii": "S0926-860X(16)30043-6",
        "prism:volume": "515",
        "prism:publisher": "Elsevier B.V.",
        "dc:title": "Theoretical investigation on the ruthenium catalyzed dehydrogenation of formic acid and ligand effect",
        "prism:copyright": "Copyright © 2016 Elsevier B.V. All rights reserved.",
        "openaccess": "0",
        "prism:issn": "0926860X",
        "dcterms:subject": [
          {
            "@_fa": "true",
            "$": "Density functional theory (DFT)"
          },
          {
            "@_fa": "true",
            "$": "Ruthenium complexes"
          },
          {
            "@_fa": "true",
            "$": "Dehydrogenation"
          },
          {
            "@_fa": "true",
            "$": "Formic acid"
          },
          {
            "@_fa": "true",
            "$": "Ligand effect"
          }
        ],
        "openaccessArticle": "false",
        "prism:publicationName": "Applied Catalysis A: General",
        "openaccessSponsorType": null,
        "prism:pageRange": "101-107",
        "prism:endingPage": "107",
        "pubType": "fla",
        "prism:coverDisplayDate": "10 April 2016",
        "prism:doi": "10.1016/j.apcata.2016.01.043",
        "prism:startingPage": "101",
        "dc:identifier": "doi:10.1016/j.apcata.2016.01.043",
        "openaccessSponsorName": null
      },
      "objects": {
        "object": [
          {
            "@category": "thumbnail",
            "@height": "88",
            "@width": "219",
            "@_fa": "true",
            "$": "https://api.elsevier.com/content/object/eid/1-s2.0-S0926860X16300436-fx1.sml?httpAccept=%2A%2F%2A",
            "@multimediatype": "GIF image file",
            "@type": "IMAGE-THUMBNAIL",
            "@size": "4551",
            "@ref": "fx1",
            "@mimetype": "image/gif"
          },
          {
            "@category": "thumbnail",
            "@height": "164",
            "@width": "186",
            "@_fa": "true",
            "$": "https://api.elsevier.com/content/object/eid/1-s2.0-S0926860X16300436-gr1.sml?httpAccept=%2A%2F%2A",
            "@multimediatype": "GIF image file",
            "@type": "IMAGE-THUMBNAIL",
            "@size": "22243",
            "@ref": "gr1",
            "@mimetype": "image/gif"
          },
          {
            "@category": "thumbnail",
            "@height": "65",
            "@width": "219",
            "@_fa": "true",
            "$": "https://api.elsevier.com/content/object/eid/1-s2.0-S0926860X16300436-gr2.sml?httpAccept=%2A%2F%2A",
            "@multimediatype": "GIF image file",
            "@type": "IMAGE-THUMBNAIL",
            "@size": "11794",
            "@ref": "gr2",
            "@mimetype": "image/gif"
          },
          {
            "@category": "thumbnail",
            "@height": "130",
            "@width": "219",
            "@_fa": "true",
            "$": "https://api.elsevier.com/content/object/eid/1-s2.0-S0926860X16300436-gr3.sml?httpAccept=%2A%2F%2A",
            "@multimediatype": "GIF image file",
            "@type": "IMAGE-THUMBNAIL",
            "@size": "16053",
            "@ref": "gr3",
            "@mimetype": "image/gif"
          },
          {
            "@category": "thumbnail",
            "@height": "164",
            "@width": "130",
            "@_fa": "true",
            "$": "https://api.elsevier.com/content/object/eid/1-s2.0-S0926860X16300436-gr4.sml?httpAccept=%2A%2F%2A",
            "@multimediatype": "GIF image file",
            "@type": "IMAGE-THUMBNAIL",
            "@size": "12465",
            "@ref": "gr4",
            "@mimetype": "image/gif"
          },
          {
            "@category": "thumbnail",
            "@height": "131",
            "@width": "219",
            "@_fa": "true",
            "$": "https://api.elsevier.com/content/object/eid/1-s2.0-S0926860X16300436-gr5.sml?httpAccept=%2A%2F%2A",
            "@multimediatype": "GIF image file",
            "@type": "IMAGE-THUMBNAIL",
            "@size": "17214",
            "@ref": "gr5",
            "@mimetype": "image/gif"
          },
          {
            "@category": "thumbnail",
            "@height": "164",
            "@width": "129",
            "@_fa": "true",
            "$": "https://api.elsevier.com/content/object/eid/1-s2.0-S0926860X16300436-gr6.sml?httpAccept=%2A%2F%2A",
            "@multimediatype": "GIF image file",
            "@type": "IMAGE-THUMBNAIL",
            "@size": "15292",
            "@ref": "gr6",
            "@mimetype": "image/gif"
          },
          {
            "@category": "thumbnail",
            "@height": "153",
            "@width": "219",
            "@_fa": "true",
            "$": "https://api.elsevier.com/content/object/eid/1-s2.0-S0926860X16300436-sc1.sml?httpAccept=%2A%2F%2A",
            "@multimediatype": "GIF image file",
            "@type": "IMAGE-THUMBNAIL",
            "@size": "12224",
            "@ref": "sc1",
            "@mimetype": "image/gif"
          },
          {
            "@category": "standard",
            "@height": "200",
            "@width": "500",
            "@_fa": "true",
            "$": "https://api.elsevier.com/content/object/eid/1-s2.0-S0926860X16300436-fx1.jpg?httpAccept=%2A%2F%2A",
            "@multimediatype": "JPEG image file",
            "@type": "IMAGE-DOWNSAMPLED",
            "@size": "19162",
            "@ref": "fx1",
            "@mimetype": "image/jpeg"
          },
          {
            "@category": "standard",
            "@height": "497",
            "@width": "565",
            "@_fa": "true",
            "$": "https://api.elsevier.com/content/object/eid/1-s2.0-S0926860X16300436-gr1.jpg?httpAccept=%2A%2F%2A",
            "@multimediatype": "JPEG image file",
            "@type": "IMAGE-DOWNSAMPLED",
            "@size": "81555",
            "@ref": "gr1",
            "@mimetype": "image/jpeg"
          },
          {
            "@category": "standard",
            "@height": "200",
            "@width": "678",
            "@_fa": "true",
            "$": "https://api.elsevier.com/content/object/eid/1-s2.0-S0926860X16300436-gr2.jpg?httpAccept=%2A%2F%2A",
            "@multimediatype": "JPEG image file",
            "@type": "IMAGE-DOWNSAMPLED",
            "@size": "40458",
            "@ref": "gr2",
            "@mimetype": "image/jpeg"
          },
          {
            "@category": "standard",
            "@height": "335",
            "@width": "565",
            "@_fa": "true",
            "$": "https://api.elsevier.com/content/object/eid/1-s2.0-S0926860X16300436-gr3.jpg?httpAccept=%2A%2F%2A",
            "@multimediatype": "JPEG image file",
            "@type": "IMAGE-DOWNSAMPLED",
            "@size": "56841",
            "@ref": "gr3",
            "@mimetype": "image/jpeg"
          },
          {
            "@category": "standard",
            "@height": "712",
            "@width": "565",
            "@_fa": "true",
            "$": "https://api.elsevier.com/content/object/eid/1-s2.0-S0926860X16300436-gr4.jpg?httpAccept=%2A%2F%2A",
            "@multimediatype": "JPEG image file",
            "@type": "IMAGE-DOWNSAMPLED",
            "@size": "76786",
            "@ref": "gr4",
            "@mimetype": "image/jpeg"
          },
          {
            "@category": "standard",
            "@height": "337",
            "@width": "565",
            "@_fa": "true",
            "$": "https://api.elsevier.com/content/object/eid/1-s2.0-S0926860X16300436-gr5.jpg?httpAccept=%2A%2F%2A",
            "@multimediatype": "JPEG image file",
            "@type": "IMAGE-DOWNSAMPLED",
            "@size": "61881",
            "@ref": "gr5",
            "@mimetype": "image/jpeg"
          },
          {
            "@category": "standard",
            "@height": "718",
            "@width": "565",
            "@_fa": "true",
            "$": "https://api.elsevier.com/content/object/eid/1-s2.0-S0926860X16300436-gr6.jpg?httpAccept=%2A%2F%2A",
            "@multimediatype": "JPEG image file",
            "@type": "IMAGE-DOWNSAMPLED",
            "@size": "81128",
            "@ref": "gr6",
            "@mimetype": "image/jpeg"
          },
          {
            "@category": "standard",
            "@height": "474",
            "@width": "677",
            "@_fa": "true",
            "$": "https://api.elsevier.com/content/object/eid/1-s2.0-S0926860X16300436-sc1.jpg?httpAccept=%2A%2F%2A",
            "@multimediatype": "JPEG image file",
            "@type": "IMAGE-DOWNSAMPLED",
            "@size": "57549",
            "@ref": "sc1",
            "@mimetype": "image/jpeg"
          },
          {
            "@category": "high",
            "@height": "886",
            "@width": "2213",
            "@_fa": "true",
            "$": "https://api.elsevier.com/content/object/eid/1-s2.0-S0926860X16300436-fx1_lrg.jpg?httpAccept=%2A%2F%2A",
            "@multimediatype": "JPEG image file",
            "@type": "IMAGE-HIGH-RES",
            "@size": "131152",
            "@ref": "fx1",
            "@mimetype": "image/jpeg"
          },
          {
            "@category": "high",
            "@height": "2198",
            "@width": "2500",
            "@_fa": "true",
            "$": "https://api.elsevier.com/content/object/eid/1-s2.0-S0926860X16300436-gr1_lrg.jpg?httpAccept=%2A%2F%2A",
            "@multimediatype": "JPEG image file",
            "@type": "IMAGE-HIGH-RES",
            "@size": "417715",
            "@ref": "gr1",
            "@mimetype": "image/jpeg"
          },
          {
            "@category": "high",
            "@height": "884",
            "@width": "3000",
            "@_fa": "true",
            "$": "https://api.elsevier.com/content/object/eid/1-s2.0-S0926860X16300436-gr2_lrg.jpg?httpAccept=%2A%2F%2A",
            "@multimediatype": "JPEG image file",
            "@type": "IMAGE-HIGH-RES",
            "@size": "212111",
            "@ref": "gr2",
            "@mimetype": "image/jpeg"
          },
          {
            "@category": "high",
            "@height": "1483",
            "@width": "2500",
            "@_fa": "true",
            "$": "https://api.elsevier.com/content/object/eid/1-s2.0-S0926860X16300436-gr3_lrg.jpg?httpAccept=%2A%2F%2A",
            "@multimediatype": "JPEG image file",
            "@type": "IMAGE-HIGH-RES",
            "@size": "286235",
            "@ref": "gr3",
            "@mimetype": "image/jpeg"
          },
          {
            "@category": "high",
            "@height": "3150",
            "@width": "2500",
            "@_fa": "true",
            "$": "https://api.elsevier.com/content/object/eid/1-s2.0-S0926860X16300436-gr4_lrg.jpg?httpAccept=%2A%2F%2A",
            "@multimediatype": "JPEG image file",
            "@type": "IMAGE-HIGH-RES",
            "@size": "465464",
            "@ref": "gr4",
            "@mimetype": "image/jpeg"
          },
          {
            "@category": "high",
            "@height": "1493",
            "@width": "2500",
            "@_fa": "true",
            "$": "https://api.elsevier.com/content/object/eid/1-s2.0-S0926860X16300436-gr5_lrg.jpg?httpAccept=%2A%2F%2A",
            "@multimediatype": "JPEG image file",
            "@type": "IMAGE-HIGH-RES",
            "@size": "323538",
            "@ref": "gr5",
            "@mimetype": "image/jpeg"
          },
          {
            "@category": "high",
            "@height": "3178",
            "@width": "2500",
            "@_fa": "true",
            "$": "https://api.elsevier.com/content/object/eid/1-s2.0-S0926860X16300436-gr6_lrg.jpg?httpAccept=%2A%2F%2A",
            "@multimediatype": "JPEG image file",
            "@type": "IMAGE-HIGH-RES",
            "@size": "463919",
            "@ref": "gr6",
            "@mimetype": "image/jpeg"
          },
          {
            "@category": "high",
            "@height": "2098",
            "@width": "2999",
            "@_fa": "true",
            "$": "https://api.elsevier.com/content/object/eid/1-s2.0-S0926860X16300436-sc1_lrg.jpg?httpAccept=%2A%2F%2A",
            "@multimediatype": "JPEG image file",
            "@type": "IMAGE-HIGH-RES",
            "@size": "348781",
            "@ref": "sc1",
            "@mimetype": "image/jpeg"
          },
          {
            "@category": "standard",
            "@_fa": "true",
            "$": "https://api.elsevier.com/content/object/eid/1-s2.0-S0926860X16300436-mmc2.zip?httpAccept=%2A%2F%2A",
            "@multimediatype": "ZIP file",
            "@type": "APPLICATION",
            "@size": "102489",
            "@ref": "mmc2",
            "@mimetype": "application/zip"
          },
          {
            "@category": "standard",
            "@_fa": "true",
            "$": "https://api.elsevier.com/content/object/eid/1-s2.0-S0926860X16300436-mmc1.docx?httpAccept=%2A%2F%2A",
            "@multimediatype": "Microsoft Word file",
            "@type": "APPLICATION",
            "@size": "48585",
            "@ref": "mmc1",
            "@mimetype": "application/word"
          }
        ]
      },
      "link": {
        "@rel": "abstract",
        "@href": "https://api.elsevier.com/content/abstract/scopus_id/84957921952"
      }
    }
  }
}