{
  "metadata": {
    "title": "Progress and challenges for electrocatalytic production of hydrogen peroxide",
    "authors": "; ; ",
    "journal": "Applied Catalysis A: General",
    "date": "2024-07-05",
    "doi": "10.1016/j.apcata.2024.119803",
    "abstract": "",
    "uri": "https://api.elsevier.com/content/article/pii/S0926860X24002473",
    "pii": "S0926860X24002473"
  },
  "fulltext": {
    "full-text-retrieval-response": {
      "scopus-eid": "2-s2.0-85193450889",
      "originalText": "serial JL 271346 291210 291744 291809 31 Applied Catalysis A: General APPLIEDCATALYSISAGENERAL 2024-05-16 2024-05-16 2024-05-18 2024-05-18 2024-06-20T08:52:59 1-s2.0-S0926860X24002473 S0926-860X(24)00247-3 S0926860X24002473 10.1016/j.apcata.2024.119803 S300 S300.1 FULL-TEXT 1-s2.0-S0926860X24X00095 2024-07-16T18:45:50.950567Z 0 0 20240705 2024 2024-05-16T15:39:25.621517Z absattachment articleinfo articlenumber articletitlenorm authfirstinitialnorm authfirstsurnamenorm cid cids contenttype copyright crossmark dateloaded dateloadedtxt datesearch datesort dateupdated dco docsubtype doctype doi eid ewtransactionid hubeid indexeddate issn issnnorm itemstage itemtransactionid itemweight openaccess openarchive pg pgfirst pii piinorm pubdatestart pubdatetxt pubyr sortorder srctitle srctitlenorm srctype ssids alllist content subj subheadings suppl tomb volfirst volissue volumelist webpdf webpdfpagecount yearnav figure table body mmlmath acknowledge affil articletitle auth authfirstini authfull authkeywords authlast grantnumber grantsponsor grantsponsorid highlightsabst primabst ref specialabst 0926-860X 0926860X true 681 681 C Volume 681 20 119803 119803 119803 20240705 5 July 2024 2024-07-05 2024 article rev © 2024 Elsevier B.V. All rights are reserved, including those for text and data mining, AI training, and similar technologies. PROGRESSCHALLENGESFORELECTROCATALYTICPRODUCTIONHYDROGENPEROXIDE HE C 1 Introduction 2 Pathways and progress of the water oxidation reaction (WOR) in H2O2 production 2.1 Reaction mechanisms 2.2 Recent research of water oxidation reaction (WOR) 3 Pathways of the oxygen reduction reaction (ORR) 3.1 Reaction mechanisms 4 Electrochemical test and physiochemical characterization 5 Progress in H2O2 production by two-electron oxygen reduction 5.1 Precious metal catalysts 5.2 Non-metallic catalysts 5.3 Non-precious metal catalysts 5.4 Single-atom catalysts 5.5 Homogeneous catalysts 6 Conclusions and challenges CRediT authorship contribution statement Acknowledgements References FREAKLEY 2016 965 968 S AGARWAL 2017 223 227 N BRILLAS 2009 6570 6631 E HAGE 2006 206 222 R CAMPOSMARTIN 2006 6962 6984 J YANG 2022 2107954 X ANANTHARAJ 2021 102331 S SHI 2021 38 63 X LIN 2023 2305019 L ANDO 2004 1349 1354 Y SHI 2017 701 X KELLY 2019 4593 4599 S PARK 2019 352 357 S BAEK 2019 720 728 J VISWANATHAN 2015 4224 4228 V XIA 2020 125 134 C SHAO 2024 119558 H ZHANG 2020 1902845 J KIM 2020 109 116 J GAO 2020 1008 1024 J SONG 2023 2212087 M KULKARNI 2018 2302 2312 A PANG 2020 24996 25016 Y CHEN 2017 239 245 Z SUN 2019 12372 12381 Y YANG 2018 4064 4081 S JUNG 2020 1881 1892 E WANG 2018 31855 31859 W XIA 2019 226 231 C YU 2023 2208101 Z LU 2018 156 162 Z CHEN 2017 239 245 Z ZHANG 2022 2880 X XU 2007 755 762 X WATTS 2007 312 326 R ZIMMERMAN 2015 30 40 M ZHAO 2008 499 505 L SHEN 2010 380 386 Q FORTUNATO 2022 6777 6793 G JIRKOVSKY 2011 19432 19441 J ZHENG 2016 9949 9955 Z ZHANG 2021 19643 19647 Y CHOI 2014 30063 30070 C CHANG 2020 2178 Q JIANG 2020 2003321 K ASKINS 2021 3288 E JIANG 2019 3997 K TANG 2017 1604103 C ZHU 2017 915 923 Y TIAN 2023 122 Y SU 2020 122681 P ZHANG 2020 154 161 J YANG 2022 2201325 Z WANG 2023 106582 Y XIA 2021 4225 Y AN 2022 338 354 F GUO 2022 4167 4174 Y MORIMOTO 2016 21715 N XU 2011 7376 Y SEBASTIAN 2010 4421 4431 D DONG 2021 10583 10587 K XIA 2021 4225 Y BYEON 2023 122557 A WANG 2020 14373 14377 M CAO 2020 121102 P RAWAH 2021 2296 2305 B WANG 2020 13057 13062 Y WU 2022 5911 5920 Z LIU 2022 2202248 M WU 2022 2202995 J LI 2023 e202306491 Y YANG 2022 2106534 Y JIA 2022 e202110838 Y TANG 2022 3490 3496 J ZHANG 2020 1906477 N DONG 2022 6092 6099 K LI 2019 1808173 B YAN 2023 123078 L ZHANG 2022 304 309 L DU 2023 4766 J GAO 2020 658 674 J JUNG 2020 436 442 E HU 2023 e202304754 J YAO 2024 132739 Y JIANG 2023 119242 H JIANG 2023 139449 H ZHANG 2022 36831 36842 Y YAO 2023 22154 22160 Y TIAN 2020 45 68 X SIAHROSTAMI 2013 1137 1143 S YANG 2016 2058 2062 S JIANG 2019 3997 K SHEN 2019 2099 2110 R CHEN 2022 14505 14516 S PEGIS 2018 2340 2391 M FAN 2023 1426 W SMITH 2020 4902 4907 P LIU 2023 446 459 C YU 2022 1238 1246 Z DENG 2024 2816 2823 Z LI 2019 1808173 B SONG 2020 17519 17527 X ZHOU 2024 193 X DONG 2024 e202317660 L KIM 2023 5822 C XU 2023 e202314414 H WANG 2022 8914 8920 W YIN 2019 7272 7278 X CHEN 2021 16607 16614 S WU 2023 6275 Q TIAN 2024 983 Q LIN 2023 e202315182 L SONG 2023 e202317267 Z PENG 2023 4430 W QI 2023 6263 J LEE 2023 234 243 B SUN 2024 2306336 L ZHI 2024 678 Q SMITH 2020 4902 4907 P YIN 2016 10800 10805 P HEX2024X119803 HEX2024X119803XC 2026-05-18T00:00:00.000Z 2026-05-18T00:00:00.000Z http://creativecommons.org/licenses/by-nc-nd/4.0/ © 2024 Elsevier B.V. All rights are reserved, including those for text and data mining, AI training, and similar technologies. 2024-05-22T16:15:42.394Z http://vtw.elsevier.com/data/voc/AddOnTypes/50.7/aggregated-refined https://doi.org/10.15223/policy-017 https://doi.org/10.15223/policy-037 https://doi.org/10.15223/policy-012 https://doi.org/10.15223/policy-029 https://doi.org/10.15223/policy-004 item S0926-860X(24)00247-3 S0926860X24002473 1-s2.0-S0926860X24002473 10.1016/j.apcata.2024.119803 271346 2024-07-16T18:45:50.950567Z 2024-07-05 1-s2.0-S0926860X24002473-main.pdf https://s3-eu-west-1.amazonaws.com/prod-ucs-content-store-eu-west/content/pii:S0926860X24002473/MAIN/application/pdf/af118302431ef2c7f1eb0dcb187b0c5d/main.pdf main.pdf pdf true 12435844 MAIN 17 1-s2.0-S0926860X24002473-main_1.png https://s3-eu-west-1.amazonaws.com/prod-ucs-content-store-eu-west/content/pii:S0926860X24002473/PREVIEW/image/png/37810a65adca5aa5f1e03ab7a7ebe7e8/main_1.png main_1.png png 57530 849 656 IMAGE-WEB-PDF 1 1-s2.0-S0926860X24002473-gr4.jpg https://s3-eu-west-1.amazonaws.com/prod-ucs-content-store-eu-west/content/pii:S0926860X24002473/gr4/DOWNSAMPLED/image/jpeg/2f46da6db1a357f90f79c495a2768edd/gr4.jpg gr4 gr4.jpg jpg 68269 453 791 IMAGE-DOWNSAMPLED 1-s2.0-S0926860X24002473-gr3.jpg https://s3-eu-west-1.amazonaws.com/prod-ucs-content-store-eu-west/content/pii:S0926860X24002473/gr3/DOWNSAMPLED/image/jpeg/0988732e3caa269c0a5ae3d211503a1c/gr3.jpg gr3 gr3.jpg jpg 104996 770 791 IMAGE-DOWNSAMPLED 1-s2.0-S0926860X24002473-gr6.jpg https://s3-eu-west-1.amazonaws.com/prod-ucs-content-store-eu-west/content/pii:S0926860X24002473/gr6/DOWNSAMPLED/image/jpeg/1dddc5f08b49cfcdcf989305497bc4fd/gr6.jpg gr6 gr6.jpg jpg 149073 970 791 IMAGE-DOWNSAMPLED 1-s2.0-S0926860X24002473-gr5.jpg https://s3-eu-west-1.amazonaws.com/prod-ucs-content-store-eu-west/content/pii:S0926860X24002473/gr5/DOWNSAMPLED/image/jpeg/2e7cd1661dc58c4646ea53a3b18cc2e6/gr5.jpg gr5 gr5.jpg jpg 107545 769 791 IMAGE-DOWNSAMPLED 1-s2.0-S0926860X24002473-gr2.jpg https://s3-eu-west-1.amazonaws.com/prod-ucs-content-store-eu-west/content/pii:S0926860X24002473/gr2/DOWNSAMPLED/image/jpeg/b480a0ade582950df66a795d6de43b34/gr2.jpg gr2 gr2.jpg jpg 108440 692 791 IMAGE-DOWNSAMPLED 1-s2.0-S0926860X24002473-gr11.jpg https://s3-eu-west-1.amazonaws.com/prod-ucs-content-store-eu-west/content/pii:S0926860X24002473/gr11/DOWNSAMPLED/image/jpeg/e2606cd09bac08cd098a601d934f4237/gr11.jpg gr11 gr11.jpg jpg 50406 289 791 IMAGE-DOWNSAMPLED 1-s2.0-S0926860X24002473-ga1.jpg https://s3-eu-west-1.amazonaws.com/prod-ucs-content-store-eu-west/content/pii:S0926860X24002473/ga1/DOWNSAMPLED/image/jpeg/0a9061cc28fa75cd6cb931c8f720a0ee/ga1.jpg ga1 true ga1.jpg jpg 20884 245 223 IMAGE-DOWNSAMPLED 1-s2.0-S0926860X24002473-gr1.jpg https://s3-eu-west-1.amazonaws.com/prod-ucs-content-store-eu-west/content/pii:S0926860X24002473/gr1/DOWNSAMPLED/image/jpeg/64678c6f52b66eaafcad07bf1382ebcf/gr1.jpg gr1 gr1.jpg jpg 24373 249 384 IMAGE-DOWNSAMPLED 1-s2.0-S0926860X24002473-gr10.jpg https://s3-eu-west-1.amazonaws.com/prod-ucs-content-store-eu-west/content/pii:S0926860X24002473/gr10/DOWNSAMPLED/image/jpeg/176acb0aea595494b01913019e14eea7/gr10.jpg gr10 gr10.jpg jpg 124869 887 791 IMAGE-DOWNSAMPLED 1-s2.0-S0926860X24002473-gr8.jpg https://s3-eu-west-1.amazonaws.com/prod-ucs-content-store-eu-west/content/pii:S0926860X24002473/gr8/DOWNSAMPLED/image/jpeg/82d502667a2a2c56c58c5a0c926d5cf1/gr8.jpg gr8 gr8.jpg jpg 83066 331 791 IMAGE-DOWNSAMPLED 1-s2.0-S0926860X24002473-gr7.jpg https://s3-eu-west-1.amazonaws.com/prod-ucs-content-store-eu-west/content/pii:S0926860X24002473/gr7/DOWNSAMPLED/image/jpeg/ff493c95512dfaf31a2ac760f2018314/gr7.jpg gr7 gr7.jpg jpg 34003 384 384 IMAGE-DOWNSAMPLED 1-s2.0-S0926860X24002473-gr9.jpg https://s3-eu-west-1.amazonaws.com/prod-ucs-content-store-eu-west/content/pii:S0926860X24002473/gr9/DOWNSAMPLED/image/jpeg/9b8dc7884f355009ace6662191a0d85f/gr9.jpg gr9 gr9.jpg jpg 61501 273 791 IMAGE-DOWNSAMPLED 1-s2.0-S0926860X24002473-gr4.sml https://s3-eu-west-1.amazonaws.com/prod-ucs-content-store-eu-west/content/pii:S0926860X24002473/gr4/THUMBNAIL/image/gif/5b0f47e894d34e7920b95921912372ab/gr4.sml gr4 gr4.sml sml 11336 125 219 IMAGE-THUMBNAIL 1-s2.0-S0926860X24002473-gr3.sml https://s3-eu-west-1.amazonaws.com/prod-ucs-content-store-eu-west/content/pii:S0926860X24002473/gr3/THUMBNAIL/image/gif/b87fd6ad144aa60b671ee42cb719bf02/gr3.sml gr3 gr3.sml sml 10531 164 168 IMAGE-THUMBNAIL 1-s2.0-S0926860X24002473-gr6.sml https://s3-eu-west-1.amazonaws.com/prod-ucs-content-store-eu-west/content/pii:S0926860X24002473/gr6/THUMBNAIL/image/gif/f2954e78143d49c447c3dc3351f1d288/gr6.sml gr6 gr6.sml sml 12654 163 133 IMAGE-THUMBNAIL 1-s2.0-S0926860X24002473-gr5.sml https://s3-eu-west-1.amazonaws.com/prod-ucs-content-store-eu-west/content/pii:S0926860X24002473/gr5/THUMBNAIL/image/gif/a47f432f64b4048e553ea2bf0ad5cc4e/gr5.sml gr5 gr5.sml sml 11522 163 168 IMAGE-THUMBNAIL 1-s2.0-S0926860X24002473-gr2.sml https://s3-eu-west-1.amazonaws.com/prod-ucs-content-store-eu-west/content/pii:S0926860X24002473/gr2/THUMBNAIL/image/gif/6a9caec51162351fdf7000ff07e19a82/gr2.sml gr2 gr2.sml sml 12977 164 187 IMAGE-THUMBNAIL 1-s2.0-S0926860X24002473-gr11.sml https://s3-eu-west-1.amazonaws.com/prod-ucs-content-store-eu-west/content/pii:S0926860X24002473/gr11/THUMBNAIL/image/gif/03d9d711bb51e92a68fd47ddc58287f1/gr11.sml gr11 gr11.sml sml 5727 80 219 IMAGE-THUMBNAIL 1-s2.0-S0926860X24002473-ga1.sml https://s3-eu-west-1.amazonaws.com/prod-ucs-content-store-eu-west/content/pii:S0926860X24002473/ga1/THUMBNAIL/image/gif/b9ebdf162cf47da782d1c36316bebc37/ga1.sml ga1 true ga1.sml sml 14083 163 149 IMAGE-THUMBNAIL 1-s2.0-S0926860X24002473-gr1.sml https://s3-eu-west-1.amazonaws.com/prod-ucs-content-store-eu-west/content/pii:S0926860X24002473/gr1/THUMBNAIL/image/gif/1327f87da90bf471f70f932f88073022/gr1.sml gr1 gr1.sml sml 21926 142 219 IMAGE-THUMBNAIL 1-s2.0-S0926860X24002473-gr10.sml https://s3-eu-west-1.amazonaws.com/prod-ucs-content-store-eu-west/content/pii:S0926860X24002473/gr10/THUMBNAIL/image/gif/7a5c6bcbc4eea8a99e8f9e270851c79b/gr10.sml gr10 gr10.sml sml 10959 164 146 IMAGE-THUMBNAIL 1-s2.0-S0926860X24002473-gr8.sml https://s3-eu-west-1.amazonaws.com/prod-ucs-content-store-eu-west/content/pii:S0926860X24002473/gr8/THUMBNAIL/image/gif/361a471813587328a86d2eebcffeb092/gr8.sml gr8 gr8.sml sml 12779 92 219 IMAGE-THUMBNAIL 1-s2.0-S0926860X24002473-gr7.sml https://s3-eu-west-1.amazonaws.com/prod-ucs-content-store-eu-west/content/pii:S0926860X24002473/gr7/THUMBNAIL/image/gif/d1fe6fb9882900117e592dcad65c7a99/gr7.sml gr7 gr7.sml sml 15282 164 164 IMAGE-THUMBNAIL 1-s2.0-S0926860X24002473-gr9.sml https://s3-eu-west-1.amazonaws.com/prod-ucs-content-store-eu-west/content/pii:S0926860X24002473/gr9/THUMBNAIL/image/gif/5c39ee1b52dd641b5230a39e05c28482/gr9.sml gr9 gr9.sml sml 8073 75 219 IMAGE-THUMBNAIL 1-s2.0-S0926860X24002473-gr4_lrg.jpg https://s3-eu-west-1.amazonaws.com/prod-ucs-content-store-eu-west/content/pii:S0926860X24002473/HIGHRES/image/jpeg/5f6d6e81ce1f5327664859223112421a/gr4_lrg.jpg gr4 gr4_lrg.jpg jpg 309787 2000 3493 IMAGE-HIGH-RES 1-s2.0-S0926860X24002473-gr3_lrg.jpg https://s3-eu-west-1.amazonaws.com/prod-ucs-content-store-eu-west/content/pii:S0926860X24002473/HIGHRES/image/jpeg/17bff0ee03b49122a631a0c72d2846b9/gr3_lrg.jpg gr3 gr3_lrg.jpg jpg 450267 3400 3493 IMAGE-HIGH-RES 1-s2.0-S0926860X24002473-gr6_lrg.jpg https://s3-eu-west-1.amazonaws.com/prod-ucs-content-store-eu-west/content/pii:S0926860X24002473/HIGHRES/image/jpeg/31120167b149729ef5e39e3b8adf5efc/gr6_lrg.jpg gr6 gr6_lrg.jpg jpg 669304 4284 3493 IMAGE-HIGH-RES 1-s2.0-S0926860X24002473-gr5_lrg.jpg https://s3-eu-west-1.amazonaws.com/prod-ucs-content-store-eu-west/content/pii:S0926860X24002473/HIGHRES/image/jpeg/7f3a1ae9af504033c866cc2171c0b4af/gr5_lrg.jpg gr5 gr5_lrg.jpg jpg 449642 3398 3493 IMAGE-HIGH-RES 1-s2.0-S0926860X24002473-gr2_lrg.jpg https://s3-eu-west-1.amazonaws.com/prod-ucs-content-store-eu-west/content/pii:S0926860X24002473/HIGHRES/image/jpeg/5aba3d72136c38286e8f4d8872cbb74e/gr2_lrg.jpg gr2 gr2_lrg.jpg jpg 483412 3056 3493 IMAGE-HIGH-RES 1-s2.0-S0926860X24002473-gr11_lrg.jpg https://s3-eu-west-1.amazonaws.com/prod-ucs-content-store-eu-west/content/pii:S0926860X24002473/HIGHRES/image/jpeg/005ab9cf8cddec47b1d59e87dae68236/gr11_lrg.jpg gr11 gr11_lrg.jpg jpg 215431 1277 3493 IMAGE-HIGH-RES 1-s2.0-S0926860X24002473-ga1_lrg.jpg https://s3-eu-west-1.amazonaws.com/prod-ucs-content-store-eu-west/content/pii:S0926860X24002473/HIGHRES/image/jpeg/a390893ba0725aa05302e5b25dc78335/ga1_lrg.jpg ga1 true ga1_lrg.jpg jpg 160687 1085 989 IMAGE-HIGH-RES 1-s2.0-S0926860X24002473-gr1_lrg.jpg https://s3-eu-west-1.amazonaws.com/prod-ucs-content-store-eu-west/content/pii:S0926860X24002473/HIGHRES/image/jpeg/f7bb262d441f87a87dbbcc547c64dc50/gr1_lrg.jpg gr1 gr1_lrg.jpg jpg 98708 1103 1704 IMAGE-HIGH-RES 1-s2.0-S0926860X24002473-gr10_lrg.jpg https://s3-eu-west-1.amazonaws.com/prod-ucs-content-store-eu-west/content/pii:S0926860X24002473/HIGHRES/image/jpeg/52b9b899049830425676299d916417ce/gr10_lrg.jpg gr10 gr10_lrg.jpg jpg 552944 3917 3493 IMAGE-HIGH-RES 1-s2.0-S0926860X24002473-gr8_lrg.jpg https://s3-eu-west-1.amazonaws.com/prod-ucs-content-store-eu-west/content/pii:S0926860X24002473/HIGHRES/image/jpeg/a96a72dfcd633707e093ee600e5d964f/gr8_lrg.jpg gr8 gr8_lrg.jpg jpg 392088 1461 3493 IMAGE-HIGH-RES 1-s2.0-S0926860X24002473-gr7_lrg.jpg https://s3-eu-west-1.amazonaws.com/prod-ucs-content-store-eu-west/content/pii:S0926860X24002473/HIGHRES/image/jpeg/fa4abe400af5ed562ede390d8ee6541a/gr7_lrg.jpg gr7 gr7_lrg.jpg jpg 146805 1704 1704 IMAGE-HIGH-RES 1-s2.0-S0926860X24002473-gr9_lrg.jpg https://s3-eu-west-1.amazonaws.com/prod-ucs-content-store-eu-west/content/pii:S0926860X24002473/HIGHRES/image/jpeg/5793a39608a5ee470842e8f040b2120f/gr9_lrg.jpg gr9 gr9_lrg.jpg jpg 262171 1204 3493 IMAGE-HIGH-RES 1-s2.0-S0926860X24002473-si0001.svg https://s3-eu-west-1.amazonaws.com/prod-ucs-content-store-eu-west/content/pii:S0926860X24002473/image/svg+xml/a111201bdc0e3d529127cb98373cc0d7/si0001.svg si0001 si0001.svg svg 3371 ALTIMG 1-s2.0-S0926860X24002473-si0002.svg https://s3-eu-west-1.amazonaws.com/prod-ucs-content-store-eu-west/content/pii:S0926860X24002473/image/svg+xml/e323150b7738ae09bc380198358d0e8c/si0002.svg si0002 si0002.svg svg 3152 ALTIMG 1-s2.0-S0926860X24002473-si0003.svg https://s3-eu-west-1.amazonaws.com/prod-ucs-content-store-eu-west/content/pii:S0926860X24002473/image/svg+xml/6c3ceb8a0847f74f2b02eb68dfb7449e/si0003.svg si0003 si0003.svg svg 2066 ALTIMG 1-s2.0-S0926860X24002473-si0004.svg https://s3-eu-west-1.amazonaws.com/prod-ucs-content-store-eu-west/content/pii:S0926860X24002473/image/svg+xml/431cd064c4557db46dd053c776c2443f/si0004.svg si0004 si0004.svg svg 2167 ALTIMG 1-s2.0-S0926860X24002473-si0005.svg https://s3-eu-west-1.amazonaws.com/prod-ucs-content-store-eu-west/content/pii:S0926860X24002473/image/svg+xml/7e49fed21707b4e33afe031e152bc4e6/si0005.svg si0005 si0005.svg svg 2937 ALTIMG 1-s2.0-S0926860X24002473-si0006.svg https://s3-eu-west-1.amazonaws.com/prod-ucs-content-store-eu-west/content/pii:S0926860X24002473/image/svg+xml/6c3ceb8a0847f74f2b02eb68dfb7449e/si0006.svg si0006 si0006.svg svg 2066 ALTIMG 1-s2.0-S0926860X24002473-si0007.svg https://s3-eu-west-1.amazonaws.com/prod-ucs-content-store-eu-west/content/pii:S0926860X24002473/image/svg+xml/e9fec5fe58ff8665dfe89d418b5b7942/si0007.svg si0007 si0007.svg svg 1726 ALTIMG 1-s2.0-S0926860X24002473-si0008.svg https://s3-eu-west-1.amazonaws.com/prod-ucs-content-store-eu-west/content/pii:S0926860X24002473/image/svg+xml/072c2849261ac606b745a55d3ad5f625/si0008.svg si0008 si0008.svg svg 2171 ALTIMG 1-s2.0-S0926860X24002473-si0009.svg https://s3-eu-west-1.amazonaws.com/prod-ucs-content-store-eu-west/content/pii:S0926860X24002473/image/svg+xml/79c2f919a60a4aa7ead88c9b43edd1ad/si0009.svg si0009 si0009.svg svg 2058 ALTIMG 1-s2.0-S0926860X24002473-si0010.svg https://s3-eu-west-1.amazonaws.com/prod-ucs-content-store-eu-west/content/pii:S0926860X24002473/image/svg+xml/b630525201790d092d0e2f65dbb62767/si0010.svg si0010 si0010.svg svg 3160 ALTIMG 1-s2.0-S0926860X24002473-si0011.svg https://s3-eu-west-1.amazonaws.com/prod-ucs-content-store-eu-west/content/pii:S0926860X24002473/image/svg+xml/5c6d45248bad062884029adf65ef51c4/si0011.svg si0011 si0011.svg svg 1580 ALTIMG 1-s2.0-S0926860X24002473-si0012.svg https://s3-eu-west-1.amazonaws.com/prod-ucs-content-store-eu-west/content/pii:S0926860X24002473/image/svg+xml/e73114fbfb83de1c30f80caed06981aa/si0012.svg si0012 si0012.svg svg 2119 ALTIMG 1-s2.0-S0926860X24002473-si0013.svg https://s3-eu-west-1.amazonaws.com/prod-ucs-content-store-eu-west/content/pii:S0926860X24002473/image/svg+xml/524c2e12d7f59ae4c642323303774dde/si0013.svg si0013 si0013.svg svg 2151 ALTIMG 1-s2.0-S0926860X24002473-si0014.svg https://s3-eu-west-1.amazonaws.com/prod-ucs-content-store-eu-west/content/pii:S0926860X24002473/image/svg+xml/bad8112cdba12ba729eb8d3fff3bed5c/si0014.svg si0014 si0014.svg svg 2970 ALTIMG 1-s2.0-S0926860X24002473-si0015.svg https://s3-eu-west-1.amazonaws.com/prod-ucs-content-store-eu-west/content/pii:S0926860X24002473/image/svg+xml/17041bfd98a901e8a112989f2c3867b7/si0015.svg si0015 si0015.svg svg 1580 ALTIMG 1-s2.0-S0926860X24002473-si0016.svg https://s3-eu-west-1.amazonaws.com/prod-ucs-content-store-eu-west/content/pii:S0926860X24002473/image/svg+xml/e73114fbfb83de1c30f80caed06981aa/si0016.svg si0016 si0016.svg svg 2119 ALTIMG 1-s2.0-S0926860X24002473-si0017.svg https://s3-eu-west-1.amazonaws.com/prod-ucs-content-store-eu-west/content/pii:S0926860X24002473/image/svg+xml/547d5af58662f31c7f0fad1e589b36c7/si0017.svg si0017 si0017.svg svg 2200 ALTIMG 1-s2.0-S0926860X24002473-si0018.svg https://s3-eu-west-1.amazonaws.com/prod-ucs-content-store-eu-west/content/pii:S0926860X24002473/image/svg+xml/56cbade85878312afbeaa30e4afcfa64/si0018.svg si0018 si0018.svg svg 1766 ALTIMG 1-s2.0-S0926860X24002473-si0019.svg https://s3-eu-west-1.amazonaws.com/prod-ucs-content-store-eu-west/content/pii:S0926860X24002473/image/svg+xml/86c1d3d3ae6be5e0174a5d95cadbedfb/si0019.svg si0019 si0019.svg svg 1924 ALTIMG 1-s2.0-S0926860X24002473-si0020.svg https://s3-eu-west-1.amazonaws.com/prod-ucs-content-store-eu-west/content/pii:S0926860X24002473/image/svg+xml/1c74ef6b68731ade81c15e89dc7f73e2/si0020.svg si0020 si0020.svg svg 1584 ALTIMG 1-s2.0-S0926860X24002473-si0021.svg https://s3-eu-west-1.amazonaws.com/prod-ucs-content-store-eu-west/content/pii:S0926860X24002473/image/svg+xml/331dccc48e43fa9d22c3d0c9bb697b0e/si0021.svg si0021 si0021.svg svg 2050 ALTIMG 1-s2.0-S0926860X24002473-si0022.svg https://s3-eu-west-1.amazonaws.com/prod-ucs-content-store-eu-west/content/pii:S0926860X24002473/image/svg+xml/677729399a1e389fd22d09fc7493b89a/si0022.svg si0022 si0022.svg svg 2236 ALTIMG 1-s2.0-S0926860X24002473-si0023.svg https://s3-eu-west-1.amazonaws.com/prod-ucs-content-store-eu-west/content/pii:S0926860X24002473/image/svg+xml/28b113427559119ea8bf86d33c12f625/si0023.svg si0023 si0023.svg svg 2171 ALTIMG 1-s2.0-S0926860X24002473-si0024.svg https://s3-eu-west-1.amazonaws.com/prod-ucs-content-store-eu-west/content/pii:S0926860X24002473/image/svg+xml/2d480259757fc5481fde9e2a95ebea9f/si0024.svg si0024 si0024.svg svg 2098 ALTIMG 1-s2.0-S0926860X24002473-si0025.svg https://s3-eu-west-1.amazonaws.com/prod-ucs-content-store-eu-west/content/pii:S0926860X24002473/image/svg+xml/cf6744d8ed53ac175329ca8ead326bb4/si0025.svg si0025 si0025.svg svg 2102 ALTIMG 1-s2.0-S0926860X24002473-si0026.svg https://s3-eu-west-1.amazonaws.com/prod-ucs-content-store-eu-west/content/pii:S0926860X24002473/image/svg+xml/3f9968799d008a9234379f9c54824792/si0026.svg si0026 si0026.svg svg 2244 ALTIMG 1-s2.0-S0926860X24002473-si0027.svg https://s3-eu-west-1.amazonaws.com/prod-ucs-content-store-eu-west/content/pii:S0926860X24002473/image/svg+xml/be247c63be06d93edf3b37e6e9f1d64c/si0027.svg si0027 si0027.svg svg 2305 ALTIMG 1-s2.0-S0926860X24002473-si0028.svg https://s3-eu-west-1.amazonaws.com/prod-ucs-content-store-eu-west/content/pii:S0926860X24002473/image/svg+xml/ae4ca9eb1c847bdcaa82de7cfe542a58/si0028.svg si0028 si0028.svg svg 1965 ALTIMG 1-s2.0-S0926860X24002473-si0029.svg https://s3-eu-west-1.amazonaws.com/prod-ucs-content-store-eu-west/content/pii:S0926860X24002473/image/svg+xml/914b52952fab3d81c383c343e4b9d04d/si0029.svg si0029 si0029.svg svg 2030 ALTIMG 1-s2.0-S0926860X24002473-si0030.svg https://s3-eu-west-1.amazonaws.com/prod-ucs-content-store-eu-west/content/pii:S0926860X24002473/image/svg+xml/edbb1664fc836349ddb4ea55396e9835/si0030.svg si0030 si0030.svg svg 2443 ALTIMG 1-s2.0-S0926860X24002473-si0031.svg https://s3-eu-west-1.amazonaws.com/prod-ucs-content-store-eu-west/content/pii:S0926860X24002473/image/svg+xml/8470cb6be76122424e13994463d394bd/si0031.svg si0031 si0031.svg svg 3987 ALTIMG 1-s2.0-S0926860X24002473-si0032.svg https://s3-eu-west-1.amazonaws.com/prod-ucs-content-store-eu-west/content/pii:S0926860X24002473/image/svg+xml/d0f9364e3d02b5791caf380014c0d486/si0032.svg si0032 si0032.svg svg 2123 ALTIMG 1-s2.0-S0926860X24002473-am.pdf am am.pdf pdf 1477923 AAM-PDF https://s3-eu-west-1.amazonaws.com/prod-ucs-content-store-eu-west/content/egi:10W5JWW2NHG/MAIN/application/pdf/89e320050d30f452f8ed5c890beda3e2/am.pdf APCATA 119803 119803 S0926-860X(24)00247-3 10.1016/j.apcata.2024.119803 Elsevier B.V. Fig. 1 Synthesis method of H2O2 and schematic diagrams of various applications. Fig. 1 Copied with permission [6]. Copyright 2021, Elsevier. Fig. 2 WOR catalyst development timeline, reaction path diagram and two-electron WOR volcano diagram. (a) The timeline for the development of selective electrocatalysts for 2e− WOR. (b) Schematics of Different Reaction Pathways for the Water Oxidation on a Catalytic Surface. (c) Two-electron WOR volcano plot for reported H2O2 evolving catalysts. Fig. 2 (a) Copied with permission [9]. Copyright. 2024 Acta Phys. -Chim. Sin.(b) Reproduced with permission [8]. Copyright. 2020 Elsevier Inc; (c) Reproduced with permission [7]. Copyright 2020, Elsevier B.V. All rights reserved. Fig. 3 Schematic representation of two different ORR pathways and reaction energy barriers. (a) O2 adsorption mode; (b) ORR Associative and dissociative pathway diagrams. (c) Free energy diagram for four-electron ORR; (d) Free energy diagram for two-electron ORR. Fig. 3 (a-b) Reproduced with permission [21]. Copyright 2018, American Chemical Society; (c-d) Reproduced with permission [22]. Copyright 2023, Wiley-VCH GmbH. Fig. 4 Schematic diagram of electrochemical test and practical application device. (a) Schematic diagram of a three-electrode RRDE device; (b) Schematic diagram of H-type electrolytic cell and gas diffusion electrode; (c) Schematic diagram of a zinc-air battery device for cogeneration of electricity and H2O2; (d) Schematic diagram of a device for the preparation of H2O2 using a solid electrolyte. Fig. 4 (a) Reprinted with permission from [26].Copyright 2018 American Chemical Society; (b) Reproduced with permission[27]. Copyright 2020 American Chemical Society; (c) Reprinted with permission from [28]. Copyright 2018 American Chemical Societ; (d) Reprinted with permission from [29]. Copyright 2019 The Authors. Fig. 5 Schematic diagram of 2e- ORR form H2O2 in acid with/without Na+ ions and the effect of Na+ ions concentration on electrosynthesis of H2O2 through 2e- ORR. (a) Schematic diagram of 2e- ORR form H2O2 in acid with/without Na+ ions; (b-e) The effect of Na+ ions concentration on electrosynthesis of H2O2 through 2e- ORR. Fig. 5 Copied with permission [33]. Copyright 2022, The Author(s). Fig. 6 Schematic and structural characterization of some noble metal catalysts. (a) Schematic representation of molecular O2 absorption at the Pt surface as an end-on configuration on carbon-coated Pt. (b-d) Schematic representation and structural characterization of GNR/AuPdMoOX catalyst. (e-g) Structural characterization of Pdδ+-OCNT and H-Pd-OCNT catalyst. Fig. 6 (a) Reproduced with permission [43]. Copyright 2014 American Chemical Society; (b-d) Reproduced with permission [39]. Copyright. 2022, American Chemical Society; (e-g) Reproduced with permission [44]. Copyright 2020, The Author(s). Fig. 7 Schemes of Carbon-based metal-free catalysts. Fig. 7 Copied with permission [56]. Copyright 2022, Institute of Coal Chemistry, Chinese Academy of Sciences. Published by Elsevier B.V. All rights reserved. Fig. 8 Schematic and structural characterization of some non-precious metal catalysts. (a-g) Schematic diagram, XRD patterns and TEM image of Ni-N2O2/C. (h-o) Active volcano plots of ORR via 2e- or 4e- pathways, Gibbs free energy plots at different Co1 sites, and schematic diagrams of theoretically calculated data. Fig. 8 (a-g) Reproduced with permission [67]. Copyright 2022, The Royal Society of Chemistry; (h-o) Reproduced with permission [83]. Copyright 2023, Wiley-VCH GmbH. Fig. 9 (a-d) DFT calculations of M-N-C (M= Mn, Fe, Co, Ni, Cu). (e-g) Plot of electrochemical performance data for M-N-C (M= Mn, Fe, Co, Ni, Cu) catalysts. (a) Schematic of ORR along the 2e- or 4e- pathway on M-SACs anchored in N-doped graphene; (b) Binding energies of *OOH, *O, and *OH on M-SACs and d-band centers of M atoms; (c) Volcano plot curves for ORR of the 2e- or 4e- pathway; (d) Free energy diagram of 2e- ORR on SACs at 0.7 V vs. RHE; (e) Plot of LSV test data for M-N-C catalyst; (f) Plot of H2O2 selectivity and electron transfer number data for M-N-C catalysts. Fig. 9 (a-d) Copied with permission [81]. Copyright 2021, Wiley-VCH GmbH; (e-g) Reproduced with permission [83]. Copyright 2023, Wiley-VCH GmbH. Fig. 10 Schematic and characterization diagrams of some non-precious metal catalysts. (a-d) HAADF-STEM images, (e-f) ORR performance in 0.1 M KOH of M-CNT (M= Fe, Pd, Co, Mn) catalysts. and (g-h) The stability and cumulative H2O2 yield at −0.4 V vs. RHE in O2-saturated 0.1 M KOH solution. Fig. 10 (a-d) Reproduced with permission [92]. Copyright 2019, The Author(s); (g-h) Reproduced with permission [85]. Copyright 2023 Elsevier B.V. All rights reserved. Fig. 11 Schematic structures of Fe, Co phthalocyanines and porphyrins and catalytic activity volcano diagrams. (a) Schematic diagram of the molecular structure of iron porphyrin;(b) Schematic diagram of the molecular structure of iron phthalocyanine; (c) Schematic diagram of the molecular structure of cobalt porphyrin; (d) Schematic diagram of the molecular structure of cobalt phthalocyanine. (e) Catalytic activity volcano plot for the 2e- and 4e- reaction pathways of ORR over MPc. Fig. 11 (d) Reproduced with permission [95]. Copyright 2022, Dalian Institute of Chemical Physics, the Chinese Academy of Sciences. Published by Elsevier B.V. All rights reserved; (e) Reproduced with permission [96]. Copyright 2020, Wiley-VCH Verlag GmbH & Co. KGaA, Weinheim. Table 1 Part of the 2e- ORR electrocatalyst. Table 1 Categorization Catalysts Electrolytes H2O2 Selectivity Catalyst loading amount (mg cm−2) Onset Potential (V vs. RHE) Ref. Precious metal catalysts Au-Pd 0.1 M HClO4 ∼95% 0.048 0.54 [40] Au-Pt-Ni 0.1 M KOH ∼95% 0.06 0.73 [41] AuPdMoOX 0.1 M HClO4 ∼80% 0.1527 0.75 [39] Pd@Au0.95Pd0.05 0.1 M HClO4 ∼90% 0.0084 0.62 [42] Pt/C 0.1 M HClO4 ∼41% 0.08 0.7 [43] Pd-OCNT 0.1 M HClO4 ∼95% 0.051 0.7 [44] Pt-TiN 0.1 M HClO4 ∼90% 0.06 0.75 [91] a-PdSe2 NPs/C 0.1 M HClO4 0.1 M Na2SO4 0.1 M KOH ∼95.8%∼96.3%∼90% 0.1 0.60.50.8 [30] Pt-S 0.1 M HClO4 ∼90% 0.025 0.7 [93] Au@Pd(13:1)NWs 0.1 M HClO4 ∼95% 0.032 0.91 [100] Non-precious metal catalysts NiOX 0.1 M KOH ∼90% 0.062 0.76 [68] NiZn 0.1 M KOH >90% 0.2 0.7 [69] Ni-N2O2/C 0.1 M KOH ∼90% 0.19 0.75 [67] NiB2 0.1 M KOH >90% 0.197 0.7 [70] Fe-N3S-C 0.1 M KOH ∼90% 0.05 0.77 [71] Cu-Pb 0.1 M KOH ∼90% 0.05 0.73 [72] ZnO3C 0.1 M KOH ∼80% 0.255 0.9 [73] Zn-N-C 0.1 M KOH >80% 0.208 0.78 [74] Bi2Te3 0.1 M KOH >90% 0.4 0.78 [75] Co-POC-O 0.1 M KOH ∼80% 0.1 0.84 [77] Co-N5C 0.5 M H2SO4 ∼60% 0.05 0.7 [78] CoIn-N-C 0.1 M HClO4 ∼94% 0.1 0.8 [80] Co-N-C 0.1 M HClO4 ∼94% 0.08 0.78 [94] Co-N-C 0.1 M KOH ∼80% 0.1 0.84 [101] Ni-C 0.1 M KOH ∼94% 0.0508 0.74 [102] Pb SA/OSC 0.1 M KOH0.1 M PBS >90%>90% 0.121 0.8 [103] Mn-NO-CH 1 M KOH ∼98.5% 0.02 0.8 [104] D-PSFZ 0.1 M KHCO3 >95% 0.51 0.5 [105] FeSAs/ACs-BCC 0.1 M KOH ∼96.5% 0.1 0.78 [106] Non-metallic catalysts O-C 0.1 M KOH ∼90% 0.1 0.75 [31] O-C 1 M Na2SO4 >90% 0.46 0.438 [29] N-C 0.05 M Na2SO4 ∼85% 0.25 0.411 [51] N-C 0.1 M KOH ∼75% 0.076 0.75 [52] CQD 0.1 M KOH ∼97.7% 0.08 0.823 [57] B-C 0.1 M KOH ∼90% 0.1 0.8 [55] CF 0.1 M KOH ∼90% 0.122 0.8 [107] 2,2’-dipyridylamine 0.5 M H2SO4 ∼80% - 0.6 [108] OCNS900 0.1 M KOH ∼90% 0.1 0.825 [109] O-DG 0.1 M KOH ∼85% 0.285 0.8 [110] MHNS0.5 0.1 M KOH >95% 0.25 0.85 [111] M-CC 1 M KOH ∼98% - 0.8 [112] CBNO 0.1 M Na2SO4 >95% 0.2 0.67 [113] P-NMG-10 1 M KOH ∼91% 0.081 0.8 [114] B/N-onion carbon 1 M NaOH ∼97.5% - 0.8 [115] O-C 0.1 M KOH ∼90% 0.1 0.75 [31] Homogeneous catalysts CoPc-CNT(O) 0.5 M H2SO4 ∼90% 0.05 0.72 [116] CoPc 0.1 M KOH ∼95% 0.03 0.8 [96] CoPor 0.1 M HClO4 ∼90% 0.01 0.7 [98] IL-CoPc/CNT 0.5 M H2SO4 ∼92% 0.05 0.68 [99] NiPyCN/CN 0.1 M HClO4 0.1 M K2SO4 0.1 M KOH ∼95% 0.1 0.380.570.8 [117] CoPc-S-COF 0.1 M KOH >95% 0.16 0.81 [118] Co-Rpb-1(6) 0.1 M KH2PO4 >90% 0.1 0.6 [119] Progress and challenges for electrocatalytic production of hydrogen peroxide Changjie He Writing – review & editing Writing – original draft Conceptualization Zhaoyan Luo Writing – review & editing Writing – original draft Conceptualization ⁎ Lei Zhang Writing – review & editing Qianling Zhang Writing – review & editing Chuanxin He Writing – review & editing Xiangzhong Ren Writing – review & editing ⁎ College of Chemistry and Environmental Engineering, Shenzhen University, Shenzhen 518071, China College of Chemistry and Environmental Engineering, Shenzhen University Shenzhen 518071 China College of Chemistry and Environmental Engineering, Shenzhen University, Shenzhen 518071, China ⁎ Corresponding authors. The preparation of Hydrogen peroxide (H2O2) by electrochemical two-electron oxygen reduction reaction (2e- ORR) and water oxidation reaction (2e- WOR) is a highly desirable method that can be green, clean and safe. However, the sluggish reaction kinetics and poor 2e- ORR and WOR selectivity severely limits scale-up applications. To resolve these challenges, research on cost-effective catalysts have been intensively explored, which have made great progress. Herein, we first introduced the fundamental chemistry and catalytic mechanism of ORR and WOR, including the possible reaction pathways, the binding modes of oxygen and water on the catalytic sites, and the energy-barrier diagrams of each stage of the reaction obtained by theoretical calculations. Then, the current progress of catalyst research for electrocatalytic synthesis of H2O2 is discussed. Among them, single-atom catalysts as well as molecular catalysts are the hot spots of current research. Single-atom catalysts can reduce the amount of precious or non-precious metals used, and maintain catalytic activity while reducing costs; meanwhile, molecular catalysts have the advantages of single reaction performance, high selectivity, and clear mechanism, which are easy to design and grasp. Finally, on the basis of previous studies, the remaining challenges and development prospects of the current research on electrocatalytic production of H2O2 are discussed, and suggestions are provided for the development of this field in the future. Graphical Abstract In this review, we first introduced the fundamental mechanism and testing equipment of 2e- ORR and WOR. Then, the catalyst research progress in electrocatalytic synthesis of H2O2 is discussed in terms of heterogeneous catalysts (noble metal catalysts, non-metallic catalysts, non-precious metal catalysts, and single-atom catalysts) as well as homogeneous catalysts (e.g., molecular catalysts). The remaining challenges and development prospects of the current research are discussed. Keywords Two-electron oxygen reduction reaction Two-electron water oxidation reaction Hydrogen peroxide Electrocatalysis Current status of research Data Availability Data will be made available on request. 1 Introduction Hydrogen peroxide (H2O2) is a crucial industrial chemical and oxidizing agent with many uses, playing a vital role in chemical synthesis, disinfection and first aid, sewage treatment, bleaching and even aircraft propulsion [1–4]. At present, H2O2 is mainly prepared industrially using the anthraquinone method, as shown in the part on the upper left of Fig. 1, which consists of the hydrogenation and oxidation of an alkyl anthraquinone precursor dissolved in an organic solvent, and ultimately extracts the H2O2 from the solvent. The anthraquinone method involves several steps, requires a massive amount of energy inputs, and generates numerous wastes, suggesting that the anthraquinone method is not suitable for H2O2 production, both from the point of view of sustainability as well as production costs [5]. Moreover, due to the instability of H2O2, there are potential safety hazards in transportation and storage after high-volume preparation, meanwhile, on-site synthesis of H2O2 with H2 and O2 may also cause accidents as the concentration of H2 reaches the explosion limit. Hence, it is essential to find a green and safe method for the preparation of H2O2. With the research and development of fuel cell, there have been an increasing number of researchers investigating the oxygen reduction reaction (ORR). Researchers have discovered that the two-electron reaction of ORR, which is to be avoided as much as possible in the cathodic reaction of fuel cells, can be used to prepare H2O2, and meanwhile, because the reactants and by- products of this reaction only include O2 and H2O, the purity of H2O2 will not be affected, which is a good solution from the perspective of green and environmental sustainability. Meanwhile, in the field of electrocatalysis, the two-electron water oxidation reaction (WOR) can also be used to produce H2O2. WOR has several advantages, such as high productivity due to high current activity during the test, no need to gas the reaction system with O2 during the test, and the simultaneous precipitation of O2 during the reaction enhances the diffusion of H2O2 from the electrode surface, etc. [7]. Moreover, the electricity generated from green and clean energy sources such as wind power can be used to produce H2O2, which does not affect the environment from the energy source to the products, and also solves the problem that wind power is inconvenient to be integrated into the power grid due to its unsteadiness. In the following section, the reaction pathway of ORR, WOR and the current research progress will be elaborated, and the shortcomings will be discussed. Finally, the prospects and suggestions for further development of the two-electron ORR, WOR preparing H2O2 technology will be presented. 2 Pathways and progress of the water oxidation reaction (WOR) in H2O2 production 2.1 Reaction mechanisms Water oxidation is a complex reaction with three distinct pathways, and with different amounts of electron transfer, the reaction produces three products, as shown in Fig. 2 (b) and the equations below. The most widely studied WOR is the four-electron process (4e- WOR) used in electrolysis to produce O2, which is often referred to as the oxygen precipitation reaction (OER). During the 4e- WOR process, a water molecule binds to the catalytic site and loses two H+ and e- in two steps to produce OH* and O*; another water molecule then binds to O* and loses one H+ and e- to produce OOH*, and finally loses the last H+ and e- to produce oxygen and separate from the catalytic site. Water oxidation can also produce H2O2 via the 2e- pathway and OH radicals (OH*) via the 1e- pathway. During the 2e- WOR process, a water molecule binds to the catalytic site and loses two H+ and e- in a stepwise manner, producing OH* and O*. Eventually O* binds to a water molecule and loses one H+ and e-, generating H2O2 and separating from the catalytic site. During the 1e- WOR process, a water molecule binds to the catalytic site and loses an H+ and e-, generating OH* and separating from the catalytic site. It is noteworthy that all three WORs begin with the same initial step, the formation of adsorbed OH (OH*) [8]. The following are the specific reaction equations for the different paths of the 1, 2 and 4-electron WOR: 1e- WOR: * + H 2 O → O H aq · + H + + e − E ° = 2.38 V vs . RHE 2e- WOR: 2 H 2 O → H 2 O 2 + 2 H + + 2 e − E ° = 1.76 V vs . RHE * + H 2 O → O H * + H + + e − O H * + H 2 O → H 2 O 2 + H + + e − 4e- WOR: 2 H 2 O → O 2 + 4 H + + 4 e − E ° = 1.23 V vs . RHE * + H 2 O → O H * + H + + e − O H * → O * + H + + e − O * + H 2 O → OO H * + H + + e − OO H * → * + O 2 + H + + e − 2.2 Recent research of water oxidation reaction (WOR) In 2004, Ando and Tanaka [10] demonstrated for the first time that carbon materials can be used as electrocatalysts to produce H2O2 via 2e- WOR in NaOH solution. With the efforts of researchers in recent years, a series of catalysts (e.g., WO3, TiO2, BiVO4, F-SnO2 and Sb2O3, as shown in Fig. 2 (a)) have shown good 2e- WOR catalytic selectivity and activity [9]. Siahrostami et al. [11–15] have extensively studied 2e- WOR and plotted the volcano diagrams of two-electron WOR metal oxide catalysts (containing PtO2, RuO2, MnO2, ZnO, etc.) as shown in Fig. 2 (c). Among them, we can find ZnO (00−10) located at the top of the diagram with the most suitable binding energy for *OH adsorption while maintaining high selectivity for H2O2 precipitation. The ZnO (00−10) catalyst had an overpotential of 40 mV at 0.1 mA cm−2 and was able to achieve a peak H2O2 Faraday efficiency of 81%. In addition, the strongly oxygen-binding WOR catalysts and the weakly oxygen-binding WOR catalysts require huge overpotentials. However, they usually have relatively good selectivity. In order to have a wide potential window for H2O2 release via water oxidation, the ideal catalysts have suppressed selectivity for O2 and hydroxyl radical release (four-electron and one-electron oxidation, respectively). Wang et al. [16] achieved a significant increase in the selectivity and activity of H2O to H2O2 by coating a carbon catalyst with a hydrophobic polymer and limiting the in situ production of O2 gas. The maximum Faraday efficiency of H2O2 reached 66% at an overpotential of 640 mV and the rate of H2O2 production was 23.4 μmol min−1 cm−2 at a current density of 75.2 mA cm−2. In addition, the hydrophobic polymer-coated catalyst approach was extended to nickel metal, demonstrating that the method of in situ gas confinement can be effectively extended to other catalysts and has wide applicability. Hu et al. [17] successfully prepared highly efficient 2e- WOR electrocatalysts by carefully selecting the “B” site metals with the best O* and OH* adsorption properties. The researchers compared the catalysts prepared by combining three “B” site metals, Co, Ni, and Mn, with La, in which the LaCoO3 catalyst exhibited an excellent H2O2 yield of 2977.29 μmol min−1 g−1. In addition, the LaCoO3 catalyst also has good stability, and the catalysts still showed remarkable durability and stable electrochemical performance after 120 h of stability testing. 3 Pathways of the oxygen reduction reaction (ORR) 3.1 Reaction mechanisms ORR is a multi-step and multi-electron transfer reaction, which can be categorized into two-electron (2e-) and four-electron (4e-) reactions with different products of the reaction. Depending on the mode of O2 adsorption, ORR can also be categorized into associative and dissociative pathways. As shown in Fig. 3 (a-b), when O2 is adsorbed on the active site in Pauling mode, ORR proceeds in the associative pathway. In the active site, O2 combines with H+ as O2* and becomes OOH*, in 2e- reaction, OOH* combines with H+ to form H2O2; in 4e- reaction, OOH* combines with H+ to become O*, and O* continuously combines with H+ to form H2O [18–20]. As can be seen from the equation, the OOH* generated by the 2e- reaction can continue to combine with H+ under certain conditions to transform into a 4e- reaction, in which case the 4e- reaction is called the \"2+2\" e- reaction, and we should endeavor to avoid the occurrence of the \"2+2\" e- reaction in the 2e- ORR preparation of H2O2. Obviously, in order to obtain the H2O2 product, the O-O bond should be maintained during the ORR process. Therefore, both the adsorption/ desorption properties of the OOH* intermediate and the splitting of the O-O bond needs to be considered and controlled so that it cannot be further reduced to generate H2O (4e- ORR process). When oxygen is adsorbed on the active site as Yeager mode, ORR proceeds in a dissociation path. on the active site, O2 dissociates directly into two O* sites, and O* then combines with H+ to form H2O. Only the 4e- reaction undergoes the dissociation path. The following are the specific reaction equations for the different paths of the 2 and 4-electron ORR: 2e- ORR: O 2 + 2 H + + 2 e − → H 2 O 2 E ° = 0.67 V vs . RHE Associative pathway: O 2 → O 2 * O 2 * + H + + e − → OOH * OOH * + H + + e − → H 2 O 2 4e- ORR: O 2 + 4 H + + 4 e − → H 2 OE°= 1.23 V vs. RHE Associative pathway: O 2 → O 2 * O 2 * + H + + e − → OOH * OOH * + H + + e − → O * + H 2 O O * + H + + e − → OH * OH * + H + + e − → H 2 O Dissociating pathways: O 2 → 2 O * 2 O * + 2 H + + 2 e − → 2 OH * 2 OH * + 2 H + + 2 e − → 2 H 2 O In different electrolyte environments, the mechanism of 2e- ORR will be different. In acidic electrolytes, O2 reacts directly with H+ to form H2O2; whereas in alkaline electrolytes, because H+ cannot be stabilized in the electrolyte, O2 instead reacts with H2O to form HO2 - as well as OH-. The following are the mechanism of 2e- ORR in different electrolytes condition: In acid electrolytes: O 2 + 2 H + + 2 e − → H 2 O 2 Associative pathway： O 2 + * + H + + e − → * OOH * OOH + H + + e − → H 2 O 2 In alkaline electrolytes: O 2 + H 2 O + 2 e − → H O 2 − + O H − Associative pathway： O 2 + * + H 2 O + e − → * OOH + O H − * OOH + e − → * + H O 2 − The pH of the electrolyte significantly affected the performance and stability of the catalyst. It was found that for metal-based catalysts, the H2O2 selectivity of the catalysts was higher in acidic environments than in alkaline environments, and the glassy carbons showed higher 2e- ORR selectivity in alkaline environments than in acidic environments. In acidic media, the kinetic barrier for breaking O-O bonds on metal-based catalysts is higher, and O2 is more firmly bound to the active site on the catalyst, resulting in more selective production of H2O2.Therefore, the use of metal-based catalysts in acidic environments is a better strategy for the production of H2O2 [23]. However, in acidic environments, leaching of metal ions may occur, resulting in reduced catalyst stability. The 2e- ORR of carbon-based catalysts under different pH conditions has been extensively studied. There are many excellent carbon-based catalysts that exhibit high 2e- ORR selectivity and high onset potentials in alkaline electrolytes. For instance, highly defective carbon with ordered mesoporous structure exhibits excellent electrochemical performance with more than 90% H2O2 selectivity at 0.6 V in KOH solution [24]. Besides, oxidized carbon nanotubes, reduced graphene oxide and pyrolytic edge-rich nanostructures showed promising high performance as H2O2 electrocatalysts with high selectivity and onset potentials in alkaline electrolytes. Conclusively, the use of carbon-based catalysts for the preparation of H2O2 in an alkaline environment is a better strategy. For single-atom catalysts, there have been extensive studies in acidic as well as alkaline environments, but fewer studies in neutral solutions. In acidic environments, the overpotential is usually high, except for Co-N-C catalysts. As an example, the onset potential for oxygen reduction of Co-N-C varies in different pH environments, with the highest onset potential in alkaline environments, followed by acidic environments, and finally neutral environments. Between 0.8 and 0.4 V, the order of disc and ring currents was neutral < acidic < alkaline, while at < 0.4 V, the current densities in neutral and acidic environments were higher than those in acidic environments, but the ring currents showed an opposite trend [25]. As shown in Fig. 3 (c-d), the rate-determining step of the reaction is the step from *OOH to the next stage, both in the two and four-electron processes. The two-electron partial reduction pathway leads to hydrogen peroxide (H2O2) as a product and involves only OOH* as a reaction intermediate, whereas the four-electron reduction pathway reduces oxygen completely to water, involving four reduction steps. Typically, both the associative and dissociative pathways are considered, depending on whether or not the O2 molecule is dissociated prior to reduction. The associative pathway involves three different intermediates, OOH*, O*, and OH*, while the dissociative pathway involves only O* and OH*. The Gibbs free energy of each step of the reaction also changes when different voltages are applied. As shown in Fig. 3 (c), when the equilibrium potential of 1.23 V is applied, the Gibbs free energy of each reaction step changes, in which the hydrogenation of O2 to OOH* and the hydrogenation of OH* to H2O are in an upward slope, implying that these two steps determine the rate of the reaction, and it is obvious that the energy barrier difference of the last step of the hydrogenation of OH* to H2O is larger than the first step of the reaction, therefore, the last step is the 4e- rate determining step for ORR. As shown in Fig. 3 (d), when an equilibrium potential of 0.70 V is applied, the first step of O2 hydrogenation to OOH* tends to be uphill, implying that this step is the rate-determining step for 2e- ORR [22]. The smaller the energy barrier difference between the Gibbs free energy of the reaction and the Gibbs free energy at the equilibrium potential when the test voltage is applied to the catalyst, the more beneficial it is to promote the reaction. Since the efficiency of H2O2 preparation by 2e- ORR is mainly limited by the adsorption rate of OOH*, the catalytic performance of the catalysts for 2e- ORR and the efficiency of H2O2 preparation can be enhanced if the reaction energy barrier of binding OOH* to the catalysts' active sites can be reduced as much as possible by modulating the catalysts. 4 Electrochemical test and physiochemical characterization Rotating Ring-Disk Electrode (RRDE) is a widely used equipment for evaluating the electrochemical performance of 2e- ORR, which mainly consists of a disk electrode with a glassy carbon electrode and a ring electrode with a platinum ring electrode. In Linear Sweep Voltammetry (LSV) test, O2 will be converted to H2O and H2O2 by the reduction reaction on the disk electrode under the action of reduction potential, and the H2O2 generated on the disk electrode will be shifted to the ring electrode under the action of electrode rotation. The oxidation potential applied on the ring electrode will oxidize H2O2 to H2O. The monitoring of the electron transfer number and H2O2 yield is accomplished by observing the changes in the disk current and ring current. ( Fig. 4 (a)) Based on the data obtained from RRDE LSV testing, the following parameters are mainly used to evaluate the electrochemical performance of 2e- ORR: (1) The reaction potential is the most directly reflecting parameter of 2e- ORR activity, and it can be calculated from the Nernst equation to the thermodynamic equilibrium potential Eθ, which is0.70 V vs. RHE in the acidic environment and 0.86 V vs. RHE in the alkaline environment. The value of the difference between the starting potential and Eθ is the overpotential η, the smaller η is, the closer to the thermodynamic equilibrium potential Eθ is, which indicates that the higher the activity of the catalyst in 2e- ORR is. It is generally believed that the η of the catalyst with high activity should be less than 0.2 V vs. RHE. (2) The selectivity of H2O2 and the electron transfer number of the reaction are also important parameters to evaluate the catalytic performance of 2e- ORR. During the LSV test, a reductive disk current ID is generated at the disk electrode and an oxidizing ring current IR is generated at the ring electrode. Based on ID and IR, the number of electrons transferred, the Faraday Efficiency (FE), and the H2O2 selectivity of the catalyst for the ORR process at the RRDE can be calculated [30]: n = 4 × I D I R ÷ N + I D FE % = 100 × ( I R ÷ N ) I D H 2 O 2 ( % ) = 100 × 2 × ( I R ÷ N ) I R ÷ N + I D = 2 FE 1 + FE where N is the acquisition efficiency of the RRDE. (3) For practical applications, the stability of catalysts for H2O2 preparation is also an important evaluation parameter. Under the conditions of laboratory testing, a well-performing catalyst should be able to maintain stable for more than tens of hours. For long-term testing, the catalyst can be coated on carbon paper and mounted in an H-type electrolytic cell for testing to protect the RRDE device (Fig. 4 (b)). The concentration of H2O2 prepared by 2e- ORR can be determined by ceric sulfate titration coupled with UV–visible spectroscopy. As shown in the following equations, the concentration of H2O2 prepared by the reaction is twice the concentration of Ce4+ consumed [31]. 2Ce4++H2O2→2Ce3++2H++O2 M H 2 O 2 = 2 × M Ce 4 + In addition, we can also use the colorimetric strip method and the titration method to determine the yield of H2O2. Colorimetry strip method is a method of determining the content of a component to be measured by comparing or measuring the depth of color of a solution of a colored substance. This method is able to quickly determine the approximate content of a substance during an experiment. However, the exact content of the substance cannot be accurately obtained from comparing the depth of the colors alone. The titration method is based on a change in the color of the indicator to indicate the end point of the titration, followed by a visual measurement of the volume of standard solution consumed and calculation of the analytical result. Hence the titration method is capable of obtaining relatively accurate substance content, but it requires numerous procedures during the titration process, which is not conducive to obtaining results rapidly. UV–visible spectroscopy enables precise substance content to be obtained and requires fewer procedures. However, UV–visible spectroscopy requires relatively expensive equipment and is not as cost-effective as the other two methods. Combined with the time cost and the requirement for data accuracy, UV–visible spectroscopy is widely used in most studies. In practical applications, H-type electrolytic cells or gas diffusion electrodes are commonly used for the preparation of massive H2O2. However, as the H-type electrolytic cell does not facilitate removing the generated H2O2 timely, and will inhibit the 2e- ORR when the concentration of H2O2 increases, thus the H-type electrolytic cell is mainly used to test the performance of 2e- ORR catalysts under laboratory conditions. In practical industrial production situations, the gas diffusion electrode flow cell is the main device to be used. During the reaction process, O2 continuously diffuses to the surface of the catalyst through the gas diffusion layer, which maintains the O2 on the surface of the catalyst in a saturated state and provides excellent conditions for the preparation of H2O2. Meanwhile, the flow cell can keep flowing of the liquid in the system to avoid the accumulation of H2O2 near the electrodes and be further reduced to H2O, so the timely shifting of H2O2 on the electrode surface is extremely important to enhance the yield [32]. By controlling the flow rate of the liquid, the concentration of H2O2 produced by the reaction system can be modulated. In electrochemical testing, the electrolyte also has a crucial impact on the performance. Wang et al. [33] found that the addition of Na2SO4 to H2SO4 was effective in enhancing the performance of the catalyst and helped the catalyst to maintain a high FE plateau. As the concentration of added Na2SO4 increased, the current density as well as the FE of H2O2 gradually increased. They also found that the addition of other alkali metal ions could also increase the H2O2 yield. This may be due to the fact that the addition of alkali metal ions such as Na+ avoids the aggregation of H+ ions and reduces the occurrence of the reaction in which OOH* combines with H+ to form H2O, as shown in Fig. 5. During the reaction, the dissolution of metal ions may also initiate a Fenton or Fenton-like reaction leading to the decomposition of H2O2, thus affecting the stability of the catalyst production. The reactive oxygen species (e.g., ·OH and ·OOH) produced by the decomposition of H2O2 can, conversely, destroy the catalyst, leading to degradation of catalytic performance as well as a loss of stability. Therefore, another approach is to add H2O2 stabilizing additives such as anions of p-block elements such as Si, Al, Ge and Sn [34,35]. However, it is also important to ensure that the addition of such redox inert anions do not alter the pH of the solution through the use of buffered electrolytes. In addition, reactive oxygen species (ROS) produced with the reaction may lead to H2O2 decomposition. Therefore, the introduction of a radical scavenger that scavenges both oxidizing radicals (e.g., hydroxyl radicals) and reducing radicals (e.g., superoxide) could improve the total H2O2 yield. The current study considers S and Se as potential scavengers [36–38]. 5 Progress in H2O2 production by two-electron oxygen reduction Catalysts can be classified into many types in terms of state, phase of the reaction system, and type of reaction, etc. In this review, catalysts are mainly categorized in terms of the phase of the reaction system, which can be classified into heterogeneous catalysts and homogeneous catalysts. Heterogeneous catalysts can be subdivided into metallic, non-metallic catalysts, and single atom catalysts. Here, the metallic catalysts can further be subdivided into precious and non-precious metal catalysts. Homogeneous catalysts can be subdivided into acid, base, soluble transition metal compounds and peroxide catalysts. Homogeneous catalysts act independently with molecules or ions, with uniform active centers, high activity and high selectivity. 5.1 Precious metal catalysts Precious metal catalysts provide better catalytic performance and selectivity in 2e- ORR and they are the most widely used catalysts commercially. For example, Au nanoparticles bind relatively weakly to O2 and exhibit low reaction rates and high overpotentials during electrocatalytic H2O2 process, whereas some metal-based catalysts such as Pt and Pd bind strongly to O2 but are liable to undergo the 4e- pathway. According to Sabatier principle, the catalytic activity is highest when the interaction between the reactants and the catalyst surface is at an optimum, i.e., not too weak and not too strong. Current strategies to regulate the bonding strength of noble metals with O2 is mainly through the synthesis of alloy catalysts [39–42] and the introduction of carbon carriers [43-45]，as shown in Fig. 6. Although the noble metal catalysts exhibit excellent catalytic activity, but from the point of view of commercial cost, the high price of noble metal will undoubtedly be a burden to the commercial preparation of H2O2, so the mainstream research trend is in the preparation of non-metal or non-precious -metallic catalysts, or to reduce of the loading amount of noble metal in order to achieve the purpose of cost reduction. 5.2 Non-metallic catalysts As mentioned above, noble metals have good catalytic activity, but the lack of materials and high-cost limit large-scale applications. Carbon-based materials have received widespread attention because of their low price, easy availability, and controllable structure. However, pure carbon-based materials have low catalytic activity and selectivity when used directly as catalysts [46]. For this reason, some researchers have developed to optimize the electrocatalytic H2O2 performance of pure carbon- based materials via heteroatoms (N, B, S, P, O, etc.) doping [47], to construct some structural defects [48], or induce interface engineering [49], see Fig. 7. Additionally, the introduction of heteroatom may also change the electronic structure of carbon materials and further improve the catalytic activity of the materials. The enhancement of electrocatalytic activity is derived from electroneutrality disruption and electron transfer caused by differences in the size and electronegativity of the incorporated heteroatoms. Due to the incorporation of heteroatoms, the electronic configuration of the neighboring carbons can be changed and the charge/spin distribution on the original sp2 hybrid carbon structure can be effectively altered to optimize the chemisorption of the intermediates and thus enhance the intrinsic activity. [50] For example, Su et al. [51] found that N doping improves the catalytic activity of graphene; more interestingly, different types of N behave differently, with graphite N having the best 2e- ORR activity, followed by pyridine N, and finally by pyrrole N. N-doped carbon-based materials can achieve 75–85% selectivity under laboratory test conditions [51,52]. Meanwhile, Hu et al. [53] synthesized g-C3N4 catalysts with different N species by using different precursors, and the analysis showed that Urea-C3N4 has the best 2e- ORR activity and ∼90% H2O2 selectivity in alkaline environments. Based on the XPS results, they found that graphitic nitrogen had a significant effect on the 2e- ORR selectivity. On this basis, they prepared carbon quantum dots (CQDs)-modified graphitic carbon nitride (g-C3N4/CQDs-X) by controlled ultrasonic stripping, which exhibited 95% selectivity at 0.35 V vs. RHE, and obtained a H2O2 yield of 1466.6 mmol g−1 in 12 h. The addition of CQDs by sonication not only enhanced the high specific surface area and porous structure of the g-C3N4 catalyst, but also increased the conductivity and electron transfer ability, which led to the acceleration of the reaction rate [54]. In addition, Wang et al. [55] found in their study of carbon materials doped with different heteroatoms, that the most favorable adsorption sites for *OOH on B-C and P-C materials are B and P, respectively, rather than C, which is linked to the heteroatom. To dope the carbon-based material with O, the catalyst can be prepared by oxidizing the carbon-based material with concentrated HNO3 or by using graphene oxide as a feedstock. Lu et al. [31] prepared O-C catalysts with selectivity up to 90% by oxidizing carbon nanotubes through concentrated HNO3. Oxygen-doped carbon-based materials are also useful in the preparation of other of catalysts. For example, Guo et al. [57] successfully introduceda ultrahigh amount of oxygen (30.4 at%) into carbon quantum dots (CQD), and the obtained CQD catalyst had a high yield of 10.06 mg cm−2 h−1 with a Faraday efficiency of 97.7% and a good stability over 10 h. Wang et al. [29] achieved >90% H2O2 yield of 3.4 mmol cm−2 h−1 by nitric acid oxidation of functionalized carbon black catalysts for 2e- ORR. They found that the surface oxidation of the carbon material was closely related to the selectivity and activity of H2O2, which may be due to the fact that the surface oxidation increased the concentration of active sites on the material. Although these O-C catalysts have a small negligible starting overpotential for H2O2, they typically require an overpotential of several hundred milliamps per square centimeter to produce H2O2 currents comparable to those of industrial grade. The need for high overpotentials to obtain industrial grade currents may be due to the high charge transfer resistivity caused by oxidation of the catalyst surface [58–60]. Sun et al. [61] prepared honeycomb carbon nanofibers (HCNFs) catalysts by spinning PVA powder and PTFE aqueous emulsion, and the oxygen-functional group-rich hydrophilic porous carbon skeleton facilitated electron transfer and contact between electrolyte and catalyst, achieving high H2O2 selectivity of 97.3% and high quality activity of 220 A g−1. To address the problem of high charge transfer resistance for O-C surface oxidation, highly active and selective B-doped carbon was used for 2e- ORR. Furthermore, the B doping is also a good strategy to improve the intrinsic activity of pristine carbon materials. Wang et al. [62] reported the B doped carbon black showing high selectivity of about 90%. Moreover, this catalyst was able to maintain the catalytic performance at a current density of 200 mA cm−2 for at least 30 h. In this work, they also investigated the effect of B doping amount towards H2O2 activity and found that when increasing the doping amount of B, the overpotential could be enhanced by 20 mV at the same current density compared to the catalysts which did not increasing the doping amount of B. And the B-C catalyst was able to enhance the overpotential by 210 mV at a current density of 300 mA cm−2 compared to the O-doped C catalyst previously studied by Wang et al. [29] CO2-derived edge B-doped porous carbon materials were prepared for the efficient production of H2O2 by Lee et al. [63] In their study, it was found that the oxidized B-doped configurations (BCO2 and BC2O) at the edge positions were the main reason for the catalyst's ability to enhance the 2e- ORR activity and stability. 5.3 Non-precious metal catalysts As described above, heteroatom-doped carbon-based material can dramatically improve its catalytic activity and selectivity of H2O2, but it is found that theses non-metal catalysts are not enough to bring the catalysts to the level of commercialization in practical applications. Therefore, researcher have begun to consider loading transition metals (TMs) onto carbon-based materials to optimum catalysts' performance improved by constructing structural defects or surface modification. In the beginning, due to the simplicity and reproducibility of the experiments, researchers loaded metal particles or clusters onto carbon-based materials to prepare catalysts. Huang et al. [64] prepared catalysts by distributing NiO nanoparticles into NiFe-MOF nanosheets, and the H2O2 selectivity of the resulting catalysts could even reach 99%. Niu et al. [65] introduced FeOX nanoparticles into N-doped layered porous carbon materials, and the resulting catalysts also achieved 95% H2O2 selectivity. Rawah et al. [66] introduced cobalt nanoparticles into nitrogen-doped carbon materials, and the resulting catalyst continuously catalyzed the reaction for 2 h at 0.3 V vs. RHE, with a H2O2 production rate of 100 mmol gcat −1 h−1 and a high H2O2 Faraday efficiency of close to 85%. To find out the best non-precious metal, researchers studied a variety of metals, as shown in Fig. 8, such as Ni [67–70], Fe [71], Cu [72], Zn [73,74], Bi [75], Mg [76], Co [22,77–80], etc. Among these catalytic materials, the Co-based materials exhibited the optimal H2O2 catalytic activity. Despite the good catalytic activity of NiO catalysts, poor stability is still a major problem. In the study by Wu et al. [68], the NiO catalysts were tested for stability with a slight decrease in both disk and ring currents, and the tested samples were subjected to SEM analysis, which revealed that the microstructure was damaged to a certain extent, which was supposed to be the reason for the performance degradation. The isolated metal atoms in most cases interact directly with the oxygenated intermediates during the ORR process. Hence, the catalytic performance of M-N-C catalysts depends largely on the center metal M. Through theoretical calculations as well as experimental proofs, Gao et al. [81] systematically investigated the structures of Mn, Fe, Co, Ni, and Cu atoms anchoring N-doped graphene and their relationship with the 2e- ORR performance. As shown in Fig. 9, DFT calculations showed that the binding energies of OOH*, O*, and OH* are usually inversely proportional to the number of valence electrons in the M atoms. The lower energy barrier possessed by Co atoms results in the higher activity and catalytic performance of Co-N-C catalysts. Besides, Jung et al. [82] loaded Co onto nitrogen-doped graphene, and the resulting Co-N4 sites exhibited a kinetic current density of 2.8 mA cm−2 and a mass activity of 155 A g−1 at 0.65 V vs. RHE, and had good stability with negligible loss of activity over 110 h. From theoretical calculations, Co-based catalysts have a low energy barrier, and from practical tests, Co-based catalysts also have good performance and stability, so many researchers are currently investigating Co-based catalysts. In current research, many Co-containing catalysts are able to achieve greater than 90% H2O2 selectivity, so Co and its modified catalysts have aroused the wide interest of researchers. For example, Yao et al. [84] designed a series catalysts with three sizes of Co species (single atom, cluster and nanoparticle), the Co-N bonds in Co clusters accelerated the speed of electron transfer. Meanwhile, Co clusters promotes the shift of the O2 adsorption configuration to the Yeager mode, which enhances the adsorption and activation of O2 and consequently boosts the catalytic performance. In addition to binding to carbon materials, α-MoO3-x transition metal oxide catalysts with controllable oxygen vacancies were prepared by Hu et al. [85]. By modulating the reaction temperature and oxygen vacancies of the samples, the α-MoO3-x-400 catalyst was able to achieve more than 93% selectivity and 87% Faraday efficiency at 0.4 V vs. RHE. Moreover, the cubic tungsten trioxide (c-WO3) catalyst developed by Hu et al. [86] through a phase modulation strategy exhibited a high selectivity of ∼90% and an H2O2 yield of 179 mmol gcat−1 h−1 at 0.1 V vs. RHE, and the continuous reaction for 24 h did not decrease the H2O2 generation rate. Hu et al. [87] also prepared NiFe layered double hydroxide (NiFe-LDH) catalysts capable of achieving a Faraday efficiency of 88.75% for the preparation of H2O2 under alkaline conditions. In addition, the catalyst possessed OER catalytic properties with an overpotential of 210 mV at 10 mA cm−2 and high stability in 1 M KOH. On this basis, a new reactor was designed to electrolyze oxygen and generate hydrogen peroxide. The H2O2 yield reached 47.62 mmol gcat−1 h−1 at an ultra-low cell voltage of 1 V. Using a 1.5 V dry cell as a power source, the H2O2 yield reached 83.90 mmol gcat−1 h−1. Sun et al. [88] found that Ti2O3 catalysts will form oxygen-deficient TiO2 catalysts in situ during the ORR process, and the reaction pathway shifted from the 4e- ORR pathway to the 2e- ORR pathway, and more than 90% of the FE was obtained in the synthesis of H2O2. 5.4 Single-atom catalysts With the development of the research, researchers found that ordinary metal catalysts would have metal agglomeration during the catalytic process leading to the reduction of catalytic sites and weakening the catalytic performance, as well as for the purpose of reducing the amount of metal used, researchers investigated single-atom catalysts (SACs). With up to 100% atom utilization, SACs are considered to have great potential to reduce the use of precious metal catalysts. Rather than simply complementing the original ORR electrocatalysts (i.e., precious metal catalysts, non-precious metal catalysts, and carbon-based materials), SACs can be viewed as an important conceptual advancement that can radically improve the performance of all types of catalysts [89]. 2e- ORR selectivity is highly dependent on the nature of the catalyst surface. Changing the arrangement of surface atoms from contiguous to isolated sites is crucial for controlling the reaction selectivity. When the monatomic active sites are wrapped with inert elements, the selectivity of the catalyst can be substantially improved. For example, Rossmeisl et al. [90] utilized the concept of isolated active sites to regulate the activity and selectivity of oxygen reduction. Their theoretical modeling successfully predicted Pt-Hg as an active, selective, and stable catalyst for hydrogen peroxide synthesis. The Pt-Hg catalysts produced hydrogen peroxide with efficiencies as high as 96% in the region between 0.2 and 0.4 V. Within these potential limits, the hydrogen peroxide current density is 3 mA cm−2, which is the theoretical mass transfer limit for the two-electron reduction of oxygen. Only at potentials below 0.2 V do selectivity and hydrogen peroxide current begin to decrease, which means that water formation is favored. In the current study, SACs with inherently isolated active sites have shown great advantages in meeting electrochemical H2O2 production. As shown in Fig. 3 (a-b), atomically dispersed catalysts are more inclined to adsorb oxygen molecules via the Pauling mode (end-on adsorptions), giving them dominant 2e- ORR selectivity. The unsaturated coordination environments of SACs can efficiently modulate the electronic structure, thus improving the ORR performance. Maximum atomic utilization efficiency and homogeneous reaction sites have led to the widespread use of SACs. In order to immobilize the metal atom sites, carbon-based materials are seen as ideal substrates, which are usually bonded in the form of anchoring or coordinating. Since SACs have the characteristic of low metal loading but high catalytic activity, SACs with noble metals show comparable or superior catalytic performance to other catalysts (e.g., nanoparticle or metal cluster catalysts) even with much lower noble metal loading. The ability to approach the activity of PGM catalysts while reducing the precious metal loading can greatly reduce the cost when used commercially, thus making SACs one of the catalysts currently under mainstream research in any electrocatalytic research area. Yang et al. [91] prepared a TiN nanoparticle-loaded single-atom Pt catalyst with about 0.35 wt% of Pt. It was found that the single-atom Pt catalyst preferred 2e- ORR for the preparation of H2O2 as compared to commercial Pt/C. Jiang et al. [92] loaded Fe, Pd, Co, and Mn single atoms onto carbon nanotubes (CNTs) as shown in Fig. 10, and found that the Fe-CNT catalysts were highly selective for H2O2 over 95% at both alkaline and neutral pH. The aggregation of single atoms into clusters is also a major problem affecting the performance of single-atom catalysts. Shen et al. prepared single-atom catalysts capable of achieving 24.8 at% Pt atom content and H2O2 selectivity of about 90% by loading Pt on sulfide carriers and utilizing the strong interaction force between Pt-S to avoid the interconnection of clusters between Pt single atoms, and this work provides a great contribution in solving the problem of cluster formation by single atoms [93]. Although metal nanoparticles or clusters can provide better catalytic activity, the particles or clusters may agglomerate over a long period of time, leading to a decrease in active sites and affecting the catalytic activity. For this reason, researchers have developed single-atom catalysts. In single-atom catalysts, the main active sites are M-N-C or MNX (M is a metal such as Fe, Cu, Co, etc.). Take Co as an example, the Co-N-C structure can play a good 2e- ORR catalytic performance and selectivity in a large number of studies. The Co-N-C catalysts prepared by Chen et al. [94] were able to achieve 94% selectivity under acidic condition, and were also able to carry out the H2O2 preparation stably for 90 h in the flow cell. In addition to Co-N-C, other elements such as O replaced some or all of the N in M-N-C, and the electron arrangement on M was changed by the influence of O, resulting that some of the MN4 sites, which were originally 4e- ORR catalytic active converts into MOX or MOXNY sites with higher 2e- ORR catalytic activity and higher H2O2 selectivity. 5.5 Homogeneous catalysts Homogeneous catalysts are also key catalysts for electrocatalytic production of H2O2. Herein, homogeneous catalysts are also summarized in this review. Compared with heterogeneous catalysts, homogeneous catalysts have some advantages: single reaction performance with specific selectivity; mild reaction conditions, which is conductive to energy saving; and because of its clear mechanism, it is easy to carefully design and deploy research and grasp. The main disadvantages of homogeneous catalysts are poor stability and difficulty in separating from the product. One of the main focuses of the research is the solidification of homogeneous catalysts, which is the anchoring of active component metal atoms to ionomers, such as organic polymers like polyvinyl chloride (PVC) and ion-exchange resins, or inorganic polymers like carbon-based materials, SiO2, and molecular sieves. In the study of 2e- ORR, the researchers mainly used molecular catalysts such as metal phthalocyanines (Pc) and porphyrins (Por) to binding with the carriers to modulate the catalytic performance. Organic molecules such as Pc and Por have known structures, shown in Fig. 11 (a-d), in which the metal M atom of Pc has four N atoms stably attached around it, and the C atoms around the M atom are then attached to another four N atoms to form the structure of M-N4+4; while the metal M atom of Por has four N atoms attached around it to form the structure of M-N4. In a certain extent, the previously mentioned M-N-C structure is also inspired by the structure of molecular catalysts, because the catalytic site in many M-N-C structured catalysts is M-N4, which is similar to the form of M-N bonding in molecular catalysts. However, since the structure of organic molecules becomes less stable in practice due to the presence of acids and alkalis, as well as the effect of potentials, it is impractical to use only Pc or Por for a long time preparation, so Smith et al. [97] loaded Pc onto carbon nanotubes oxidized by concentrated HNO3, protected by the carbon-based material, the Pc was able to stably provide the active site for the preparation of H2O2, meanwhile, the oxidized O on the carbon nanotubes also participated in the reaction, resulting in 90% H2O2 selectivity of the CoPc-CNT(O) catalyst. At the same time, Fan et al. [96] also loaded CoPc onto CNTs, and the H2O2 selectivity could reach 95%. In addition, he made predictions on the activity and selectivity of different MPc (M=Ti, V, Cr, Mn, Fe, Co, Ni, Cu, Zn) on each reaction pathway of ORR by theoretical calculations as shown in Fig. 11 (e). Liu et al. [98] also loaded CoPor onto carbon nanotubes and obtained catalysts with H2O2 selectivity of 90%. Therefore, molecular catalysts have great potential for application, and the catalytic activity as well as stability can be further enhanced by doping of heteroatoms and modulation of surface defects. On the basis of loaded carbon nanotubes, Yu et al. [99] improved the performance of the catalysts by using hydrophobic ionic away from the surface of the catalysts, preventing them from decomposing rapidly into H2O, and thus improving the H2O2selectivity. Compared with the catalyst without IL coating, the catalyst with an optimal thickness of 8 nm IL coating can provide nearly four times the current density and 12.5% H2O2 selectivity, with FE up to 92%. In a two-electrode electrolyzer test, a production efficiency of 3.71 molH2O2 gcat −1 h−1 and good stability were demonstrated. 6 Conclusions and challenges So far, the electrocatalytic synthesis of hydrogen peroxide has focused on the partial reduction of oxygen molecules at the cathode using a series of catalysts such as noble metals and their alloys, heteroatom-doped nonmetallic catalysts, nonprecious transition metal M-N-C complexes, and homogeneous catalysts. In Table 1, we summarize the application environments and H2O2 selectivity of some noble, non-precious, non-metallic, and homogeneous catalysts. However, since ORR requires O2 to participate in the reaction, the amount of H2O2 produced will still be limited by the diffusion of O2 into the catalyst surface in the electrolyte, regardless of the difference between the applied potential and the reversible potential of 2e- ORR. Since RRDE can only be used as a test of catalyst performance in a laboratory environment and does not allow for large-scale preparation of H2O2, in practical large-scale operations, such as applying gas diffusion electrodes or PEMFC assemblies, the selectivity seems to be significantly lower than that measured with RRDE assemblies. 2e- WOR, although it is unaffected by the diffusion of O2 through the electrolyte, and is able to produce a relatively large amount of H2O2, it still needs further improvement in selectivity. Unfortunately, the number of reported catalysts for 2e- WOR is much lower than the total number of reported catalysts for two-electron ORR. This clearly implies that increased attention needs to be paid to the anodic 2e- WOR synthesis of H2O2. To enhance the selectivity and yield of H2O2 prepared by 2e- ORR and WOR, the following improvements can be considered: 1) Changing the arrangement of surface atoms from continuous sites to isolated sites is crucial for controlling the reaction selectivity. The isolated site property that SACs possess can effectively enhance the H2O2 selectivity, but there are fewer catalytic sites in the current SACs (generally less than 1 wt%), so boosting the number of catalytic sites in the SACs is an effective way to enhance the catalytic performance and selectivity. For example, Yin et al. [120] synthesized high metal loaded cobalt metal based SACs with more than 4 wt% by pyrolysis, Shen et al. [93] increased the Pt atomic content to 24.8 at% by constructing a Pt-S structure, all these works show us that there is still a development potential for the high loaded SACs. 2) Besides the catalyst itself, the electrolyte is also a point of interest. For example, Wang et al. added alkali metal ions such as Na+ into the H2SO4 electrolyte, and the presence of Na+ avoids the aggregation of H+ and promotes the generation of H2O2, which improves the catalytic activity and selectivity. Another scheme is to add H2O2 stabilizing additives such as Si, Al, Ge and other elements to the electrolyte to avoid the decrease of H2O2 yield caused by the rapid decomposition of H2O2 after its generation. All the above schemes can provide inspiration for us in applying electrolyte engineering to optimize the catalytic activity and yield. 3) After the catalyst is prepared, the performance of the catalyst can be tested by selecting different pH test environments according to the type of catalyst, for example, the noble metal catalyst should be tested in an acidic environment, the carbon-based catalyst in an alkaline environment, and the monoatomic catalyst in an acidic or alkaline environment. The use of suitable test environments can enable the catalyst to achieve better catalytic performance and thus better preparation of H2O2. In order to solve the problem of metal catalyst leaching in acidic environments, it can be tried to wrap a porous protective layer outside the metal to ensure that O2 is in contact with the active site to prepare H2O2 while minimizing the leaching of the metal and maintaining the stability of the catalyst. 4) Precious metal catalysts have high catalytic activity, but their high price hinders their large-scale application. Precious metal or non-precious metal monoatomic catalysts usually have good catalytic selectivity but poor stability. Carbon-based materials have the advantages of high electrical conductivity and high mass-transfer porosity, but poor catalytic performance. Consequently, catalysts with high catalytic activity and high stability can be prepared by loading noble and non-precious metals onto carbon-based materials, combining the high catalytic activity of metals and the stability of carbon-based materials. When we applied the catalyst to devices such as gas diffusion electrodes or PEMFCs, the selectivity obtained seems to be significantly lower than that measured by the RRDE component, most likely owing to the fact that the sufficiently homogeneous diffusion of O2 improves the selectivity in the RRDE test, whereas the diffusion of O2 in the device is limited. Therefore, one possible improvement is to use, for example, electrodes with special coatings added to improve the diffusion of O2 in the device, while allowing H2O2 to detach from the catalyst surface in time to release the active sites to continue binding with O2, with higher catalytic site utilization also leading to higher catalytic performance. Another option is to combine 2e- ORR and 2e- WOR to form a device, where 2e- ORR occurring at the cathode and 2e- WOR occurring at the anode are able to produce H2O2 simultaneously, but the different voltages and reaction conditions required for the two reactions may be challenging for the device, which still needs to be further explored. CRediT authorship contribution statement Ren Xiangzhong: Writing – review & editing. zhaoyan luo: Writing – review & editing. Changjie He: Writing – review & editing, Writing – original draft, Conceptualization. Chuanxin He: Writing – review & editing. Qianling Zhang: Writing – review & editing. Lei Zhang: Writing – review & editing. Declaration of Competing Interest The authors declare that they have no known competing financial interests or personal relationships that could have appeared to influence the work reported in this paper. Acknowledgements This work was financially supported by the National Natural Science Foundation of China (22109100), Guangdong Basic and Applied Basic Research Foundation (2024A1515010028, 2024A1515012075). References [1] S.J. Freakley Q. He J.H. Harrhy L. Lu D.A. Crole D.J. Morgan E.N. Ntainjua J.K. Edwards A.F. Carley A.Y. Borisevich C.J. Kiely G.J. Hutchings Palladium-tin catalysts for the direct synthesis of H2O2 with high selectivity Science 351 2016 965 968 10.1126/science.aad5705 S.J. Freakley, Q. He, J.H. Harrhy, L. Lu, D.A. Crole, D.J. Morgan, E.N. Ntainjua, J.K. Edwards, A.F. Carley, A.Y. Borisevich, C.J. Kiely, G.J. Hutchings, Palladium-tin catalysts for the direct synthesis of H2O2 with high selectivity, Science. 351 (2016) 965–968. https://doi.org/10.1126/science.aad5705. [2] N. Agarwal S.J. Freakley R.U. McVicker S.M. Althahban N. Dimitratos Q. He D.J. Morgan R.L. Jenkins D.J. Willock S.H. Taylor C.J. Kiely G.J. Hutchings Aqueous Au-Pd colloids catalyze selective CH4 oxidation to CH3OH with O2 under mild conditions Science 358 2017 223 227 10.1126/science.aan6515 N. Agarwal, S.J. Freakley, R.U. McVicker, S.M. Althahban, N. Dimitratos, Q. He, D.J. Morgan, R.L. Jenkins, D.J. Willock, S.H. Taylor, C.J. Kiely, G.J. Hutchings, Aqueous Au-Pd colloids catalyze selective CH4 oxidation to CH3OH with O2 under mild conditions, Science. 358 (2017) 223–227. https://doi.org/10.1126/science.aan6515. [3] E. Brillas I. Sirés M.A. Oturan Electro-Fenton Process and Related Electrochemical Technologies Based on Fenton’s Reaction Chemistry Chem. Rev. 109 2009 6570 6631 10.1021/cr900136g E. Brillas, I. Sirés, M.A. Oturan, Electro-Fenton Process and Related Electrochemical Technologies Based on Fenton’s Reaction Chemistry, Chem. Rev. 109 (2009) 6570–6631. https://doi.org/10.1021/cr900136g. [4] R. Hage A. Lienke Applications of Transition-Metal Catalysts to Textile and Wood-Pulp Bleaching Angew. Chem. Int. Ed. 45 2006 206 222 10.1002/anie.200500525 R. Hage, A. Lienke, Applications of Transition-Metal Catalysts to Textile and Wood-Pulp Bleaching, Angew. Chem. Int. Ed. 45 (2006) 206–222. https://doi.org/10.1002/anie.200500525. [5] J.M. Campos-Martin G. Blanco-Brieva J.L.G. Fierro Hydrogen peroxide synthesis: an outlook beyond the anthraquinone process Angew. Chem. Int. Ed. 45 2006 6962 6984 10.1002/anie.200503779 J.M. Campos-Martin, G. Blanco-Brieva, J.L.G. Fierro, Hydrogen Peroxide Synthesis: An Outlook beyond the Anthraquinone Process, Angew. Chem. Int. Ed. 45 (2006) 6962–6984. https://doi.org/10.1002/anie.200503779. [6] X. Yang Y. Zeng W. Alnoush Y. Hou D. Higgins G. Wu Tuning two-electron oxygen-reduction pathways for H2O2 electrosynthesis via engineering atomically dispersed single metal site catalysts Adv. Mater. 34 2022 2107954 10.1002/adma.202107954 X. Yang, Y. Zeng, W. Alnoush, Y. Hou, D. Higgins, G. Wu, Tuning Two-Electron Oxygen-Reduction Pathways for H2O2 Electrosynthesis via Engineering Atomically Dispersed Single Metal Site Catalysts, Adv. Mater. 34 (2022) 2107954. https://doi.org/10.1002/adma.202107954. [7] S. Anantharaj S. Pitchaimuthu S. Noda A review on recent developments in electrochemical hydrogen peroxide synthesis with a critical assessment of perspectives and strategies Adv. Colloid Interface Sci. 287 2021 102331 10.1016/j.cis.2020.102331 S. Anantharaj, S. Pitchaimuthu, S. Noda, A review on recent developments in electrochemical hydrogen peroxide synthesis with a critical assessment of perspectives and strategies, Adv. Colloid. Interface. Sci. 287 (2021) 102331. https://doi.org/10.1016/j.cis.2020.102331. [8] X. Shi S. Back T.M. Gill S. Siahrostami X. Zheng Electrochemical Synthesis of H2O2 by Two-Electron Water Oxidation Reaction Chem. -Us 7 2021 38 63 10.1016/j.chempr.2020.09.013 X. Shi, S. Back, T.M. Gill, S. Siahrostami, X. Zheng, Electrochemical Synthesis of H2O2 by Two-Electron Water Oxidation Reaction, Chem-Us. 7 (2021) 38–63. https://doi.org/10.1016/j.chempr.2020.09.013. [9] L. Lin Z. Sun H. Chen L. Zhao M. Sun Y. Yang Z. Liao X. Wu X. Li C. Tang Recent advances in electrocatalytic two-electron water oxidation for green H2O2 production Acta Phys. Chim. Sin. 0 2023 2305019 10.3866/PKU.WHXB202305019 L. Lin, Z. Sun, H. Chen, L. Zhao, M. Sun, Y. Yang, Z. Liao, X. Wu, X. Li, C. Tang, Recent Advances in Electrocatalytic Two-Electron Water Oxidation for Green H2O2 Production, Acta Phys. Chim. Sin. 0 (2023) 2305019. https://doi.org/10.3866/PKU.WHXB202305019. [10] Y. Ando Proposal for a new system for simultaneous production of hydrogen and hydrogen peroxide by water electrolysis Int. J. Hydrog. Energy 29 2004 1349 1354 10.1016/j.ijhydene.2004.02.001 Y. Ando, Proposal for a new system for simultaneous production of hydrogen and hydrogen peroxide by water electrolysis, Int. J. Hydrogen. Energy. 29 (2004) 1349–1354. https://doi.org/10.1016/j.ijhydene.2004.02.001. [11] X. Shi S. Siahrostami G.-L. Li Y. Zhang P. Chakthranont F. Studt T.F. Jaramillo X. Zheng J.K. Nørskov Understanding activity trends in electrochemical water oxidation to form hydrogen peroxide Nat. Commun. 8 2017 701 10.1038/s41467-017-00585-6 X. Shi, S. Siahrostami, G.-L. Li, Y. Zhang, P. Chakthranont, F. Studt, T.F. Jaramillo, X. Zheng, J.K. Nørskov, Understanding activity trends in electrochemical water oxidation to form hydrogen peroxide, Nat. Commun. 8 (2017) 701. https://doi.org/10.1038/s41467-017-00585-6. [12] S.R. Kelly X. Shi S. Back L. Vallez S.Y. Park S. Siahrostami X. Zheng J.K. Nørskov ZnO As an active and selective catalyst for electrochemical water oxidation to hydrogen peroxide Acs. Catal. 9 2019 4593 4599 10.1021/acscatal.8b04873 S.R. Kelly, X. Shi, S. Back, L. Vallez, S.Y. Park, S. Siahrostami, X. Zheng, J.K. Nørskov, ZnO As an Active and Selective Catalyst for Electrochemical Water Oxidation to Hydrogen Peroxide, ACS. Catal. 9 (2019) 4593–4599. https://doi.org/10.1021/acscatal.8b04873. [13] S.Y. Park H. Abroshan X. Shi H.S. Jung S. Siahrostami X. Zheng CaSnO3: An electrocatalyst for two-electron water oxidation reaction to form H2O2 ACS Energy Lett. 4 2019 352 357 10.1021/acsenergylett.8b02303 S.Y. Park, H. Abroshan, X. Shi, H.S. Jung, S. Siahrostami, X. Zheng, CaSnO3: An Electrocatalyst for Two-Electron Water Oxidation Reaction to Form H2O2, ACS. Energy. Lett. 4 (2019) 352–357. https://doi.org/10.1021/acsenergylett.8b02303. [14] J.H. Baek T.M. Gill H. Abroshan S. Park X. Shi J. Nørskov H.S. Jung S. Siahrostami X. Zheng Selective and Efficient Gd-Doped BiVO4 Photoanode for Two-Electron Water Oxidation to H2O2 ACS Energy Lett. 4 2019 720 728 10.1021/acsenergylett.9b00277 J.H. Baek, T.M. Gill, H. Abroshan, S. Park, X. Shi, J. Nørskov, H.S. Jung, S. Siahrostami, X. Zheng, Selective and Efficient Gd-Doped BiVO4 Photoanode for Two-Electron Water Oxidation to H2O2, ACS. Energy. Lett. 4 (2019) 720–728. https://doi.org/10.1021/acsenergylett.9b00277. [15] V. Viswanathan H.A. Hansen J.K. Nørskov Selective electrochemical generation of hydrogen peroxide from water oxidation J. Phys. Chem. Lett. 6 2015 4224 4228 10.1021/acs.jpclett.5b02178 V. Viswanathan, H.A. Hansen, J.K. Nørskov, Selective Electrochemical Generation of Hydrogen Peroxide from Water Oxidation, J. Phys. Chem. Lett. 6 (2015) 4224–4228. https://doi.org/10.1021/acs.jpclett.5b02178. [16] C. Xia S. Back S. Ringe K. Jiang F. Chen X. Sun S. Siahrostami K. Chan H. Wang Confined local oxygen gas promotes electrochemical water oxidation to hydrogen peroxide Nat. Catal. 3 2020 125 134 10.1038/s41929-019-0402-8 C. Xia, S. Back, S. Ringe, K. Jiang, F. Chen, X. Sun, S. Siahrostami, K. Chan, H. Wang, Confined local oxygen gas promotes electrochemical water oxidation to hydrogen peroxide, Nat. Catal. 3 (2020) 125–134. https://doi.org/10.1038/s41929-019-0402-8. [17] H. Shao C. Zhang H. Jiang J. Guan W. Guan Q. Shi J. Hu “B” site-modulated perovskite oxide materials for efficient electrochemical water oxidation to hydrogen peroxide Appl. Catal. A-Gen. 670 2024 119558 10.1016/j.apcata.2024.119558 H. Shao, C. Zhang, H. Jiang, J. Guan, W. Guan, Q. Shi, J. Hu, “B” site-modulated perovskite oxide materials for efficient electrochemical water oxidation to hydrogen peroxide, APPL. CATAL. A-GEN. 670 (2024) 119558. https://doi.org/10.1016/j.apcata.2024.119558. [18] J. Zhang H. Zhang M. Cheng Q. Lu Tailoring the Electrochemical Production of H2O2: Strategies for the Rational Design of High-Performance Electrocatalysts Small 16 2020 1902845 10.1002/smll.201902845 J. Zhang, H. Zhang, M. Cheng, Q. Lu, Tailoring the Electrochemical Production of H2O2: Strategies for the Rational Design of High-Performance Electrocatalysts, Small. 16 (2020) 1902845. https://doi.org/10.1002/smll.201902845. [19] J.H. Kim Y.-T. Kim S.H. Joo Electrocatalyst design for promoting two-electron oxygen reduction reaction: Isolation of active site atoms Curr. Opin. Electro 21 2020 109 116 10.1016/j.coelec.2020.01.007 J.H. Kim, Y.-T. Kim, S.H. Joo, Electrocatalyst design for promoting two-electron oxygen reduction reaction: Isolation of active site atoms, Curr. Opin. Electroche. 21 (2020) 109–116. https://doi.org/10.1016/j.coelec.2020.01.007. [20] J. Gao B. Liu Progress of electrochemical hydrogen peroxide synthesis over single atom catalysts ACS Mater. Lett. 2 2020 1008 1024 10.1021/acsmaterialslett.0c00189 J. Gao, B. Liu, Progress of Electrochemical Hydrogen Peroxide Synthesis over Single Atom Catalysts, Acs. Mater. Lett. 2 (2020) 1008–1024. https://doi.org/10.1021/acsmaterialslett.0c00189. [21] M. Song W. Liu J. Zhang C. Zhang X. Huang D. Wang Single-atom catalysts for H2O2 Electrosynthesis via Adv. Funct. Mater. 33 2023 2212087 10.1002/adfm.202212087 M. Song, W. Liu, J. Zhang, C. Zhang, X. Huang, D. Wang, Single-Atom Catalysts for H2O2 Electrosynthesis via, Adv. Funct. Mater. 33 (2023) 2212087. https://doi.org/10.1002/adfm.202212087. [22] A. Kulkarni S. Siahrostami A. Patel J.K. Nørskov Understanding catalytic activity trends in the oxygen reduction reaction Chem. Rev. 118 2018 2302 2312 10.1021/acs.chemrev.7b00488 A. Kulkarni, S. Siahrostami, A. Patel, J.K. Nørskov, Understanding Catalytic Activity Trends in the Oxygen Reduction Reaction, Chem. Rev. 118 (2018) 2302–2312. https://doi.org/10.1021/acs.chemrev.7b00488. [23] Y. Pang H. Xie Y. Sun M.-M. Titirici G.-L. Chai Electrochemical oxygen reduction for H2O2 production: catalysts, pH effects and mechanisms J. Mater. Chem. A. 8 2020 24996 25016 10.1039/D0TA09122G Y. Pang, H. Xie, Y. Sun, M.-M. Titirici, G.-L. Chai, Electrochemical oxygen reduction for H2O2 production: catalysts, pH effects and mechanisms, J. Mater. Chem. A. 8 (2020) 24996–25016. https://doi.org/10.1039/D0TA09122G. [24] Z. Chen S. Chen S. Siahrostami P. Chakthranont C. Hahn D. Nordlund S. Dimosthenis J.K. Nørskov Z. Bao T.F. Jaramillo Development of a reactor with carbon catalysts for modular-scale, low-cost electrochemical generation of H2O2 React. Chem. Eng. 2 2017 239 245 10.1039/C6RE00195E Z. Chen, S. Chen, S. Siahrostami, P. Chakthranont, C. Hahn, D. Nordlund, S. Dimosthenis, J.K. Nørskov, Z. Bao, T.F. Jaramillo, Development of a reactor with carbon catalysts for modular-scale, low-cost electrochemical generation of H2O2, React. Chem. Eng. 2 (2017) 239–245. https://doi.org/10.1039/C6RE00195E. [25] Y. Sun L. Silvioli N.R. Sahraie W. Ju J. Li A. Zitolo S. Li A. Bagger L. Arnarson X. Wang T. Moeller D. Bernsmeier J. Rossmeisl F. Jaouen P. Strasser Activity–Selectivity trends in the electrochemical production of hydrogen peroxide over single-site metal–nitrogen–carbon catalysts J. Am. Chem. Soc. 141 2019 12372 12381 10.1021/jacs.9b05576 Y. Sun, L. Silvioli, N.R. Sahraie, W. Ju, J. Li, A. Zitolo, S. Li, A. Bagger, L. Arnarson, X. Wang, T. Moeller, D. Bernsmeier, J. Rossmeisl, F. Jaouen, P. Strasser, Activity–Selectivity Trends in the Electrochemical Production of Hydrogen Peroxide over Single-Site Metal–Nitrogen–Carbon Catalysts, J. Am. Chem. Soc. 141 (2019) 12372–12381. https://doi.org/10.1021/jacs.9b05576. [26] S. Yang A. Verdaguer-Casadevall L. Arnarson L. Silvioli V. Čolić R. Frydendal J. Rossmeisl I. Chorkendorff I.E.L. Stephens Toward the decentralized electrochemical production of H2O2: a focus on the catalysis ACS Catal. 8 2018 4064 4081 10.1021/acscatal.8b00217 S. Yang, A. Verdaguer-Casadevall, L. Arnarson, L. Silvioli, V. Čolić, R. Frydendal, J. Rossmeisl, I. Chorkendorff, I.E.L. Stephens, Toward the Decentralized Electrochemical Production of H2O2: A Focus on the Catalysis, Acs. Catal. 8 (2018) 4064–4081. https://doi.org/10.1021/acscatal.8b00217. [27] E. Jung H. Shin W. Hooch Antink Y.-E. Sung T. Hyeon Recent Advances in Electrochemical Oxygen Reduction to H2 O2: catalyst and Cell Design ACS Energy Lett. 5 2020 1881 1892 10.1021/acsenergylett.0c00812 E. Jung, H. Shin, W. Hooch Antink, Y.-E. Sung, T. Hyeon, Recent Advances in Electrochemical Oxygen Reduction to H2 O2: Catalyst and Cell Design, Acs. Energy. Lett. 5 (2020) 1881–1892. https://doi.org/10.1021/acsenergylett.0c00812. [28] W. Wang Y. Hu Y. Liu Z. Zheng S. Chen Self-powered and highly efficient production of H2O2 through a Zn–air battery with oxygenated carbon electrocatalyst ACS Appl. Mater. Interfaces 10 2018 31855 31859 10.1021/acsami.8b11703 W. Wang, Y. Hu, Y. Liu, Z. Zheng, S. Chen, Self-Powered and Highly Efficient Production of H2O2 through a Zn–Air Battery with Oxygenated Carbon Electrocatalyst, ACS. Appl. Mater. Interfaces 10 (2018) 31855–31859. https://doi.org/10.1021/acsami.8b11703. [29] C. Xia Y. Xia P. Zhu L. Fan H. Wang Direct electrosynthesis of pure aqueous H2O2 solutions up to 20% by weight using a solid electrolyte Science 366 2019 226 231 10.1126/science.aay1844 C. Xia, Y. Xia, P. Zhu, L. Fan, H. Wang, Direct electrosynthesis of pure aqueous H2O2 solutions up to 20% by weight using a solid electrolyte, Science. 366 (2019) 226–231. https://doi.org/10.1126/science.aay1844. [30] Z. Yu S. Lv Q. Yao N. Fang Y. Xu Q. Shao C. Pao J. Lee G. Li L. Yang X. Huang Low-Coordinated Pd Site within amorphous palladium selenide for active, selective and stable H2O2 electrosynthesis Adv. Mater. 35 2023 2208101 10.1002/adma.202208101 Z. Yu, S. Lv, Q. Yao, N. Fang, Y. Xu, Q. Shao, C. Pao, J. Lee, G. Li, L. Yang, X. Huang, Low-Coordinated Pd Site within Amorphous Palladium Selenide for Active, Selective and Stable H2O2 Electrosynthesis, Adv. Mater. 35 (2023) 2208101. https://doi.org/10.1002/adma.202208101. [31] Z. Lu G. Chen S. Siahrostami Z. Chen K. Liu J. Xie L. Liao T. Wu D. Lin Y. Liu T.F. Jaramillo J.K. Nørskov Y. Cui High-efficiency oxygen reduction to hydrogen peroxide catalysed by oxidized carbon materials Nat. Catal. 1 2018 156 162 10.1038/s41929-017-0017-x Z. Lu, G. Chen, S. Siahrostami, Z. Chen, K. Liu, J. Xie, L. Liao, T. Wu, D. Lin, Y. Liu, T.F. Jaramillo, J.K. Nørskov, Y. Cui, High-efficiency oxygen reduction to hydrogen peroxide catalysed by oxidized carbon materials, Nat. Catal. 1 (2018) 156–162. https://doi.org/10.1038/s41929-017-0017-x. [32] Z. Chen S. Chen S. Siahrostami P. Chakthranont C. Hahn D. Nordlund S. Dimosthenis J.K. Nørskov Z. Bao T.F. Jaramillo Development of a reactor with carbon catalysts for modular-scale, low-cost electrochemical generation of H2O2 React. Chem. Eng. 2 2017 239 245 10.1039/C6RE00195E Z. Chen, S. Chen, S. Siahrostami, P. Chakthranont, C. Hahn, D. Nordlund, S. Dimosthenis, J.K. Nørskov, Z. Bao, T.F. Jaramillo, Development of a reactor with carbon catalysts for modular-scale, low-cost electrochemical generation of H2O2, React. Chem. Eng. 2 (2017) 239–245. https://doi.org/10.1039/C6RE00195E. [33] X. Zhang X. Zhao P. Zhu Z. Adler Z.-Y. Wu Y. Liu H. Wang Electrochemical oxygen reduction to hydrogen peroxide at practical rates in strong acidic media Nat. Commun. 13 2022 2880 10.1038/s41467-022-30337-0 X. Zhang, X. Zhao, P. Zhu, Z. Adler, Z.-Y. Wu, Y. Liu, H. Wang, Electrochemical oxygen reduction to hydrogen peroxide at practical rates in strong acidic media, Nat. Commun. 13 (2022) 2880. https://doi.org/10.1038/s41467-022-30337-0. [34] X. Xu N.R. Thomson An evaluation of the green chelant EDDS to enhance the stability of hydrogen peroxide in the presence of aquifer solids Chemosphere 69 2007 755 762 10.1016/j.chemosphere.2007.05.008 X. Xu, N.R. Thomson, An evaluation of the green chelant EDDS to enhance the stability of hydrogen peroxide in the presence of aquifer solids, Chemosphere. 69 (2007) 755–762. https://doi.org/10.1016/j.chemosphere.2007.05.008. [35] R.J. Watts D.D. Finn L.M. Cutler J.T. Schmidt A.L. Teel Enhanced stability of hydrogen peroxide in the presence of subsurface solids J. Contam. Hydrol. 91 2007 312 326 10.1016/j.jconhyd.2006.11.004 R.J. Watts, D.D. Finn, L.M. Cutler, J.T. Schmidt, A.L. Teel, Enhanced stability of hydrogen peroxide in the presence of subsurface solids, J. Contam. Hydrol. 91 (2007) 312–326. https://doi.org/10.1016/j.jconhyd.2006.11.004. [36] Matthew T. Zimmerman Craig A. Bayse Ria R. Ramoutar Julia L. Brumaghim Sulfur and selenium antioxidants: Challenging radical scavenging mechanisms and developing structure–activity relationships based on metal binding J. Inorg. Biochem. 145 2015 30 40 10.1016/j.jinorgbio.2014.12.020 Matthew T. Zimmerman, Craig A. Bayse, Ria R. Ramoutar, Julia L. Brumaghim, Sulfur and selenium antioxidants: Challenging radical scavenging mechanisms and developing structure–activity relationships based on metal binding, J. Inorg. Biochem. 145 (2015) 30-40. https://doi.org/doi.org/10.1016/j.jinorgbio.2014.12.020. [37] L. Zhao G. Zhao M. Du Z. Zhao L. Xiao X. Hu Effect of selenium on increasing free radical scavenging activities of polysaccharide extracts from a Se-enriched mushroom species of the genus Ganoderma Eur. Food Res. Technol. 226 2008 499 505 10.1007/s00217-007-0562-7 L. Zhao, G. Zhao, M. Du, Z. Zhao, L. Xiao, X. Hu, Effect of selenium on increasing free radical scavenging activities of polysaccharide extracts from a Se-enriched mushroom species of the genus Ganoderma, Eur. Food. Res. Technol. 226 (2008) 499–505. https://doi.org/10.1007/s00217-007-0562-7. [38] Q. Shen B. Zhang R. Xu Y. Wang X. Ding P. Li Antioxidant activity in vitro of the selenium-contained protein from the Se-enriched Bifidobacterium animalis 01 Anaerobe 16 2010 380 386 10.1016/j.anaerobe.2010.06.006 Q. Shen, B. Zhang, R. Xu, Y. Wang, X. Ding, P. Li, Antioxidant activity in vitro of the selenium-contained protein from the Se-enriched Bifidobacterium animalis 01, Anaerobe. 16 (2010) 380–386. https://doi.org/10.1016/j.anaerobe.2010.06.006. [39] G.V. Fortunato L.S. Bezerra E.S.F. Cardoso M.S. Kronka A.J. Santos A.S. Greco J.L.R. Júnior M.R.V. Lanza G. Maia Using palladium and gold palladium nanoparticles decorated with molybdenum oxide for versatile hydrogen peroxide electroproduction on graphene nanoribbons ACS Appl. Mater. Inter. 14 2022 6777 6793 10.1021/acsami.1c22362 G.V. Fortunato, L.S. Bezerra, E.S.F. Cardoso, M.S. Kronka, A.J. Santos, A.S. Greco, J.L.R. Júnior, M.R.V. Lanza, G. Maia, Using Palladium and Gold Palladium Nanoparticles Decorated with Molybdenum Oxide for Versatile Hydrogen Peroxide Electroproduction on Graphene Nanoribbons, Acs. Appl. Mater. Inter. 14 (2022) 6777–6793. https://doi.org/10.1021/acsami.1c22362. [40] J.S. Jirkovský I. Panas E. Ahlberg M. Halasa S. Romani D.J. Schiffrin Single Atom Hot-Spots at Au–Pd Nanoalloys for Electrocatalytic H2O2 Production J. Am. Chem. Soc. 133 2011 19432 19441 10.1021/ja206477z J.S. Jirkovský, I. Panas, E. Ahlberg, M. Halasa, S. Romani, D.J. Schiffrin, Single Atom Hot-Spots at Au–Pd Nanoalloys for Electrocatalytic H2O2 Production, J. Am. Chem. Soc. 133 (2011) 19432–19441. https://doi.org/10.1021/ja206477z. [41] Z. Zheng Y.H. Ng D.-W. Wang R. Amal Epitaxial Growth of Au-Pt-Ni Nanorods for Direct High Selectivity H2O2 Production Adv. Mater. 28 2016 9949 9955 10.1002/adma.201603662 Z. Zheng, Y.H. Ng, D.-W. Wang, R. Amal, Epitaxial Growth of Au-Pt-Ni Nanorods for Direct High Selectivity H2O2 Production, Adv. Mater. 28 (2016) 9949–9955. https://doi.org/10.1002/adma.201603662. [42] Y. Zhang Z. Lyu Z. Chen S. Zhu Y. Shi R. Chen M. Xie Y. Yao M. Chi M. Shao Y. Xia Maximizing the catalytic performance of Pd@Aux Pd1−x Nanocubes in H2O2 production by reducing shell thickness to increase compositional stability Angew. Chem. Int. Ed. 60 2021 19643 19647 10.1002/anie.202105137 Y. Zhang, Z. Lyu, Z. Chen, S. Zhu, Y. Shi, R. Chen, M. Xie, Y. Yao, M. Chi, M. Shao, Y. Xia, Maximizing the Catalytic Performance of Pd@Aux Pd1−x Nanocubes in H2O2 Production by Reducing Shell Thickness to Increase Compositional Stability, Angew. Chem. Int. Ed. 60 (2021) 19643–19647. https://doi.org/10.1002/anie.202105137. [43] C.H. Choi H.C. Kwon S. Yook H. Shin H. Kim M. Choi Hydrogen Peroxide Synthesis via Enhanced Two-Electron Oxygen Reduction Pathway on Carbon-Coated Pt Surface J. Phys. Chem. C. 118 2014 30063 30070 10.1021/jp5113894 C.H. Choi, H.C. Kwon, S. Yook, H. Shin, H. Kim, M. Choi, Hydrogen Peroxide Synthesis via Enhanced Two-Electron Oxygen Reduction Pathway on Carbon-Coated Pt Surface, J. Phys. Chem. C. 118 (2014) 30063–30070. https://doi.org/10.1021/jp5113894. [44] Q. Chang P. Zhang A.H.B. Mostaghimi X. Zhao S.R. Denny J.H. Lee H. Gao Y. Zhang H.L. Xin S. Siahrostami J.G. Chen Z. Chen Promoting H2O2 production via 2-electron oxygen reduction by coordinating partially oxidized Pd with defect carbon Nat. Commun. 11 2020 2178 10.1038/s41467-020-15843-3 Q. Chang, P. Zhang, A.H.B. Mostaghimi, X. Zhao, S.R. Denny, J.H. Lee, H. Gao, Y. Zhang, H.L. Xin, S. Siahrostami, J.G. Chen, Z. Chen, Promoting H2O2 production via 2-electron oxygen reduction by coordinating partially oxidized Pd with defect carbon, Nat. Commun. 11 (2020) 2178. https://doi.org/10.1038/s41467-020-15843-3. [45] K. Jiang J. Zhao H. Wang Catalyst design for electrochemical oxygen reduction toward hydrogen peroxide Adv. Funct. Mater. 30 2020 2003321 10.1002/adfm.202003321 K. Jiang, J. Zhao, H. Wang, Catalyst Design for Electrochemical Oxygen Reduction toward Hydrogen Peroxide, Adv. Funct. Mater. 30 (2020) 2003321. https://doi.org/10.1002/adfm.202003321. [46] E.J. Askins M.R. Zoric M. Li Z. Luo K. Amine K.D. Glusac Toward a mechanistic understanding of electrocatalytic nanocarbon Nat. Commun. 12 2021 3288 10.1038/s41467-021-23486-1 E.J. Askins, M.R. Zoric, M. Li, Z. Luo, K. Amine, K.D. Glusac, Toward a mechanistic understanding of electrocatalytic nanocarbon, Nat. Commun. 12 (2021) 3288. https://doi.org/10.1038/s41467-021-23486-1. [47] K. Jiang S. Back A.J. Akey C. Xia Y. Hu W. Liang D. Schaak E. Stavitski J.K. Nørskov S. Siahrostami H. Wang Highly selective oxygen reduction to hydrogen peroxide on transition metal single atom coordination Nat. Commun. 10 2019 3997 10.1038/s41467-019-11992-2 K. Jiang, S. Back, A.J. Akey, C. Xia, Y. Hu, W. Liang, D. Schaak, E. Stavitski, J.K. Nørskov, S. Siahrostami, H. Wang, Highly selective oxygen reduction to hydrogen peroxide on transition metal single atom coordination, Nat. Commun. 10 (2019) 3997. https://doi.org/10.1038/s41467-019-11992-2. [48] C. Tang Q. Zhang Nanocarbon for oxygen reduction electrocatalysis: dopants, edges, and defects Adv. Mater. 29 2017 1604103 10.1002/adma.201604103 C. Tang, Q. Zhang, Nanocarbon for Oxygen Reduction Electrocatalysis: Dopants, Edges, and Defects, Adv. Mater. 29 (2017) 1604103. https://doi.org/10.1002/adma.201604103. [49] Y.P. Zhu C. Guo Y. Zheng S.-Z. Qiao Surface and Interface Engineering of Noble-Metal-Free Electrocatalysts for Efficient Energy Conversion Processes Acc. Chem. Res. 50 2017 915 923 10.1021/acs.accounts.6b00635 Y.P. Zhu, C. Guo, Y. Zheng, S.-Z. Qiao, Surface and Interface Engineering of Noble-Metal-Free Electrocatalysts for Efficient Energy Conversion Processes, Accounts. Chem. Res. 50 (2017) 915–923. https://doi.org/10.1021/acs.accounts.6b00635. [50] Y. Tian D. Deng L. Xu M. Li H. Chen Z. Wu S. Zhang Strategies for Sustainable Production of Hydrogen Peroxide via Oxygen Reduction Reaction: From Catalyst Design to Device Setup Nano-Micro Lett. 15 2023 122 10.1007/s40820-023-01067-9 Y. Tian, D. Deng, L. Xu, M. Li, H. Chen, Z. Wu, S. Zhang, Strategies for Sustainable Production of Hydrogen Peroxide via Oxygen Reduction Reaction: From Catalyst Design to Device Setup, Nano-Micro. Lett. 15 (2023) 122. https://doi.org/10.1007/s40820-023-01067-9. [51] P. Su M. Zhou G. Song X. Du X. Lu Efficient H2O2 generation and spontaneous OH conversion for in-situ phenol degradation on nitrogen-doped graphene: Pyrolysis temperature regulation and catalyst regeneration mechanism J. Hazard. Mater. 397 2020 122681 10.1016/j.jhazmat.2020.122681 P. Su, M. Zhou, G. Song, X. Du, X. Lu, Efficient H2O2 generation and spontaneous OH conversion for in-situ phenol degradation on nitrogen-doped graphene: Pyrolysis temperature regulation and catalyst regeneration mechanism, J. Hazard. Mater. 397 (2020) 122681. https://doi.org/10.1016/j.jhazmat.2020.122681. [52] J. Zhang G. Zhang S. Jin Y. Zhou Q. Ji H. Lan H. Liu J. Qu Graphitic N in nitrogen-Doped carbon promotes hydrogen peroxide synthesis from electrocatalytic oxygen reduction Carbon 163 2020 154 161 10.1016/j.carbon.2020.02.084 J. Zhang, G. Zhang, S. Jin, Y. Zhou, Q. Ji, H. Lan, H. Liu, J. Qu, Graphitic N in nitrogen-Doped carbon promotes hydrogen peroxide synthesis from electrocatalytic oxygen reduction, Carbon. 163 (2020) 154–161. https://doi.org/10.1016/j.carbon.2020.02.084. [53] Z. Yang C. Zhang Y. Mei Y. Zhang Y. Feng M. Shao J. Hu Effect of Nitrogen Species in Graphite Carbon Nitride on Hydrogen Peroxide Production Adv. Mater. Inter. 9 2022 2201325 10.1002/admi.202201325 Z. Yang, C. Zhang, Y. Mei, Y. Zhang, Y. Feng, M. Shao, J. Hu, Effect of Nitrogen Species in Graphite Carbon Nitride on Hydrogen Peroxide Production, Adv. Materials. Inter. 9 (2022) 2201325. https://doi.org/10.1002/admi.202201325. [54] Y. Wang Z. Yang C. Zhang Y. Feng H. Shao J. Chen J. Hu L. Zhang Fabricating carbon quantum dots of graphitic carbon nitride vis ultrasonic exfoliation for highly efficient H2O2 production Ultrason. Sonochem. 99 2023 106582 10.1016/j.ultsonch.2023.106582 Y. Wang, Z. Yang, C. Zhang, Y. Feng, H. Shao, J. Chen, J. Hu, L. Zhang, Fabricating carbon quantum dots of graphitic carbon nitride vis ultrasonic exfoliation for highly efficient H2O2 production, Ultrason. Sonochem. 99 (2023) 106582. https://doi.org/10.1016/j.ultsonch.2023.106582. [55] Y. Xia X. Zhao C. Xia Z.-Y. Wu P. Zhu J.Y. Kim X. Bai G. Gao Y. Hu J. Zhong Y. Liu H. Wang Highly active and selective oxygen reduction to H2O2 on boron-doped carbon for high production rates Nat. Commun. 12 2021 4225 10.1038/s41467-021-24329-9 Y. Xia, X. Zhao, C. Xia, Z.-Y. Wu, P. Zhu, J.Y. Kim, X. Bai, G. Gao, Y. Hu, J. Zhong, Y. Liu, H. Wang, Highly active and selective oxygen reduction to H2O2 on boron-doped carbon for high production rates, Nat. Commun. 12 (2021) 4225. https://doi.org/10.1038/s41467-021-24329-9. [56] F. An X. Bao X. Deng Z. Ma X. Wang Carbon-based metal-free oxygen reduction reaction electrocatalysts: past, present and future New. Carbon Mater. 37 2022 338 354 10.1016/S1872-5805(22)60590-0 F. An, X. Bao, X. Deng, Z. Ma, X. Wang, Carbon-based metal-free oxygen reduction reaction electrocatalysts: past, present and future, New. Carbon. Mater. 37 (2022) 338–354. https://doi.org/10.1016/S1872-5805(22)60590-0. [57] Y. Guo R. Zhang S. Zhang H. Hong Y. Zhao Z. Huang C. Han H. Li C. Zhi Ultrahigh oxygen-doped carbon quantum dots for highly efficient H2O2 production via two-electron electrochemical oxygen reduction Energy Environ. Sci. 15 2022 4167 4174 10.1039/D2EE01797K Y. Guo, R. Zhang, S. Zhang, H. Hong, Y. Zhao, Z. Huang, C. Han, H. Li, C. Zhi, Ultrahigh oxygen-doped carbon quantum dots for highly efficient H2O2 production via two-electron electrochemical oxygen reduction, Energy. Environ. Sci. 15 (2022) 4167–4174. https://doi.org/10.1039/D2EE01797K. [58] N. Morimoto T. Kubo Y. Nishina Tailoring the Oxygen Content of Graphite and Reduced Graphene Oxide for Specific Applications Sci. Rep. 6 2016 21715 10.1038/srep21715 N. Morimoto, T. Kubo, Y. Nishina, Tailoring the Oxygen Content of Graphite and Reduced Graphene Oxide for Specific Applications, Sci. Rep. 6 (2016) 21715. https://doi.org/10.1038/srep21715. [59] Y. Xu K. Sheng C. Li G. Shi Highly conductive chemically converted graphene prepared from mildly oxidized graphene oxide J. Mater. Chem. 21 2011 7376 10.1039/c1jm10768b Y. Xu, K. Sheng, C. Li, G. Shi, Highly conductive chemically converted graphene prepared from mildly oxidized graphene oxide, J. Mater. Chem. 21 (2011) 7376. https://doi.org/10.1039/c1jm10768b. [60] D. Sebastián I. Suelves R. Moliner M.J. Lázaro The effect of the functionalization of carbon nanofibers on their electronic conductivity Carbon 48 2010 4421 4431 10.1016/j.carbon.2010.07.059 D. Sebastián, I. Suelves, R. Moliner, M.J. Lázaro, The effect of the functionalization of carbon nanofibers on their electronic conductivity, Carbon. 48 (2010) 4421–4431. https://doi.org/10.1016/j.carbon.2010.07.059. [61] K. Dong J. Liang Y. Wang Z. Xu Q. Liu Y. Luo T. Li L. Li X. Shi A.M. Asiri Q. Li D. Ma X. Sun Honeycomb carbon nanofibers: a superhydrophilic O2-ENtrapping Electrocatalyst Enables Ultrahigh Mass Activity for the Two-electron Oxygen Reduction Reaction Angew. Chem. Int. Ed. 60 2021 10583 10587 10.1002/anie.202101880 K. Dong, J. Liang, Y. Wang, Z. Xu, Q. Liu, Y. Luo, T. Li, L. Li, X. Shi, A.M. Asiri, Q. Li, D. Ma, X. Sun, Honeycomb Carbon Nanofibers: A Superhydrophilic O2-Entrapping Electrocatalyst Enables Ultrahigh Mass Activity for the Two-Electron Oxygen Reduction Reaction, Angew. Chem. Int. Ed. 60 (2021) 10583–10587. https://doi.org/10.1002/anie.202101880. [62] Y. Xia X. Zhao C. Xia Z.-Y. Wu P. Zhu J.Y. Kim X. Bai G. Gao Y. Hu J. Zhong Y. Liu H. Wang Highly active and selective oxygen reduction to H2O2 on boron-doped carbon for high production rates Nat. Commun. 12 2021 4225 10.1038/s41467-021-24329-9 Y. Xia, X. Zhao, C. Xia, Z.-Y. Wu, P. Zhu, J.Y. Kim, X. Bai, G. Gao, Y. Hu, J. Zhong, Y. Liu, H. Wang, Highly active and selective oxygen reduction to H2O2 on boron-doped carbon for high production rates, Nat. Commun. 12 (2021) 4225. https://doi.org/10.1038/s41467-021-24329-9. [63] A. Byeon J.W. Choi H.W. Lee W.C. Yun W. Zhang C.-K. Hwang S.Y. Lee S.S. Han J.M. Kim J.W. Lee CO2-derived edge-boron-doped hierarchical porous carbon catalysts for highly effective electrochemical H2O2 production Appl. Catal. B-Environ. 329 2023 122557 10.1016/j.apcatb.2023.122557 A. Byeon, J.W. Choi, H.W. Lee, W.C. Yun, W. Zhang, C.-K. Hwang, S.Y. Lee, S.S. Han, J.M. Kim, J.W. Lee, CO2-derived edge-boron-doped hierarchical porous carbon catalysts for highly effective electrochemical H2O2 production, Appl. Catal. B-Environ. 329 (2023) 122557. https://doi.org/10.1016/j.apcatb.2023.122557. [64] M. Wang N. Zhang Y. Feng Z. Hu Q. Shao X. Huang Partially Pyrolyzed Binary Metal–Organic Framework Nanosheets for Efficient Electrochemical Hydrogen Peroxide Synthesis Angew. Chem. Int. Ed. 59 2020 14373 14377 10.1002/anie.202006422 M. Wang, N. Zhang, Y. Feng, Z. Hu, Q. Shao, X. Huang, Partially Pyrolyzed Binary Metal–Organic Framework Nanosheets for Efficient Electrochemical Hydrogen Peroxide Synthesis, Angew. Chem. Int. Ed. 59 (2020) 14373–14377. https://doi.org/10.1002/anie.202006422. [65] P. Cao X. Quan K. Zhao S. Chen H. Yu J. Niu Selective electrochemical H2O2 generation and activation on a bifunctional catalyst for heterogeneous electro-Fenton catalysis J. Hazard. Mater. 382 2020 121102 10.1016/j.jhazmat.2019.121102 P. Cao, X. Quan, K. Zhao, S. Chen, H. Yu, J. Niu, Selective electrochemical H2O2 generation and activation on a bifunctional catalyst for heterogeneous electro-Fenton catalysis, J. Hazard. Mater. 382 (2020) 121102. https://doi.org/10.1016/j.jhazmat.2019.121102. [66] B.S. Rawah W. Li Electrocatalytic generation of hydrogen peroxide on cobalt nanoparticles embedded in nitrogen-doped carbon Chin. J. Catal. 42 2021 2296 2305 10.1016/S1872-2067(21)63804-4 B.S. Rawah, W. Li, Electrocatalytic generation of hydrogen peroxide on cobalt nanoparticles embedded in nitrogen-doped carbon, Chin. J. Catal. 42 (2021) 2296–2305. https://doi.org/10.1016/S1872-2067(21)63804-4. [67] Y. Wang R. Shi L. Shang G.I.N. Waterhouse J. Zhao Q. Zhang L. Gu T. Zhang High-Efficiency Oxygen Reduction to Hydrogen Peroxide Catalyzed by Nickel Single-Atom Catalysts with Tetradentate N2O2 Coordination in a Three-Phase Flow Cell Angew. Chem. Int. Ed. 59 2020 13057 13062 10.1002/anie.202004841 Y. Wang, R. Shi, L. Shang, G.I.N. Waterhouse, J. Zhao, Q. Zhang, L. Gu, T. Zhang, High-Efficiency Oxygen Reduction to Hydrogen Peroxide Catalyzed by Nickel Single-Atom Catalysts with Tetradentate N2O2 Coordination in a Three-Phase Flow Cell, Angew. Chem. Int. Ed. 59 (2020) 13057–13062. https://doi.org/10.1002/anie.202004841. [68] Z. Wu T. Wang J.-J. Zou Y. Li C. Zhang Amorphous Nickel Oxides Supported on Carbon Nanosheets as High-Performance Catalysts for Electrochemical Synthesis of Hydrogen Peroxide ACS Catal. 12 2022 5911 5920 10.1021/acscatal.2c01829 Z. Wu, T. Wang, J.-J. Zou, Y. Li, C. Zhang, Amorphous Nickel Oxides Supported on Carbon Nanosheets as High-Performance Catalysts for Electrochemical Synthesis of Hydrogen Peroxide, ACS. Catal. 12 (2022) 5911–5920. https://doi.org/10.1021/acscatal.2c01829. [69] M. Liu H. Su W. Cheng F. Yu Y. Li W. Zhou H. Zhang X. Sun X. Zhang S. Wei Q. Liu Synergetic Dual-Ion Centers Boosting Metal Organic Framework Alloy Catalysts toward Efficient Two Electron Oxygen Reduction Small 18 2022 2202248 10.1002/smll.202202248 M. Liu, H. Su, W. Cheng, F. Yu, Y. Li, W. Zhou, H. Zhang, X. Sun, X. Zhang, S. Wei, Q. Liu, Synergetic Dual-Ion Centers Boosting Metal Organic Framework Alloy Catalysts toward Efficient Two Electron Oxygen Reduction, Small. 18 (2022) 2202248. https://doi.org/10.1002/smll.202202248. [70] J. Wu M. Hou Z. Chen W. Hao X. Pan H. Yang W. Cen Y. Liu H. Huang P.W. Menezes Z. Kang Composition engineering of amorphous nickel boride nanoarchitectures enabling highly efficient electrosynthesis of hydrogen peroxide Adv. Mater. 34 2022 2202995 10.1002/adma.202202995 J. Wu, M. Hou, Z. Chen, W. Hao, X. Pan, H. Yang, W. Cen, Y. Liu, H. Huang, P.W. Menezes, Z. Kang, Composition Engineering of Amorphous Nickel Boride Nanoarchitectures Enabling Highly Efficient Electrosynthesis of Hydrogen Peroxide, Adv. Mater. 34 (2022) 2202995. https://doi.org/10.1002/adma.202202995. [71] Y. Li J. Chen Y. Ji Z. Zhao W. Cui X. Sang Y. Cheng B. Yang Z. Li Q. Zhang L. Lei Z. Wen L. Dai Y. Hou Single-atom iron catalyst with biomimetic active center to accelerate proton spillover for medical-level electrosynthesis of H2O2 disinfectant Angew. Chem. Int. Ed. 62 2023 e202306491 10.1002/anie.202306491 Y. Li, J. Chen, Y. Ji, Z. Zhao, W. Cui, X. Sang, Y. Cheng, B. Yang, Z. Li, Q. Zhang, L. Lei, Z. Wen, L. Dai, Y. Hou, Single-atom Iron Catalyst with Biomimetic Active Center to Accelerate Proton Spillover for Medical-level Electrosynthesis of H2O2 Disinfectant, Angew. Chem. Int. Ed. 62 (2023) e202306491. https://doi.org/10.1002/anie.202306491. [72] Y. Yang W. Wu Y. Wang J. Liu N. Li Y. Fan S. Zhang Q. Dong J. Zhao J. Niu Q. Liu Z. Hao Enhanced Electrochemical O2-to-H2O2 Synthesis Via Cu-Pb synergistic interplay Small 18 2022 2106534 10.1002/smll.202106534 Y. Yang, W. Wu, Y. Wang, J. Liu, N. Li, Y. Fan, S. Zhang, Q. Dong, J. Zhao, J. Niu, Q. Liu, Z. Hao, Enhanced Electrochemical O2-to-H2O2 Synthesis Via Cu-Pb Synergistic Interplay, Small. 18 (2022) 2106534. https://doi.org/10.1002/smll.202106534. [73] Y. Jia Z. Xue J. Yang Q. Liu J. Xian Y. Zhong Y. Sun X. Zhang Q. Liu D. Yao G. Li Tailoring the electronic structure of an atomically dispersed zinc electrocatalyst: coordination environment regulation for high selectivity oxygen reduction Angew. Chem. 134 2022 e202110838 10.1002/ange.202110838 Y. Jia, Z. Xue, J. Yang, Q. Liu, J. Xian, Y. Zhong, Y. Sun, X. Zhang, Q. Liu, D. Yao, G. Li, Tailoring the Electronic Structure of an Atomically Dispersed Zinc Electrocatalyst: Coordination Environment Regulation for High Selectivity Oxygen Reduction, Angew. Chem. 134 (2022) e202110838. https://doi.org/10.1002/ange.202110838. [74] J. Tang S. Xu K. Sun X. Gao A. Chen S. Tian D. Zhou X. Sun Recycling synthesis of single-atom Zn-nitrogen-carbon catalyst for electrocatalytic reduction of O2 to H2O2 Sci. China Mater. 65 2022 3490 3496 10.1007/s40843-022-2054-5 J. Tang, S. Xu, K. Sun, X. Gao, A. Chen, S. Tian, D. Zhou, X. Sun, Recycling synthesis of single-atom Zn-nitrogen-carbon catalyst for electrocatalytic reduction of O2 to H2O2, Sci. China. Mater. 65 (2022) 3490–3496. https://doi.org/10.1007/s40843-022-2054-5. [75] N. Zhang F. Zheng B. Huang Y. Ji Q. Shao Y. Li X. Xiao X. Huang Exploring Bi2Te3 nanoplates as versatile catalysts for electrochemical reduction of small molecules Adv. Mater. 32 2020 1906477 10.1002/adma.201906477 N. Zhang, F. Zheng, B. Huang, Y. Ji, Q. Shao, Y. Li, X. Xiao, X. Huang, Exploring Bi2Te3 Nanoplates as Versatile Catalysts for Electrochemical Reduction of Small Molecules, Adv. Mater. 32 (2020) 1906477. https://doi.org/10.1002/adma.201906477. [76] K. Dong J. Liang Y. Wang L. Zhang Z. Xu S. Sun Y. Luo T. Li Q. Liu N. Li B. Tang A.A. Alshehri Q. Li D. Ma X. Sun Conductive two-dimensional magnesium metal–organic frameworks for high-efficiency O2 electroreduction to H2O2 Acs. Catal. 12 2022 6092 6099 10.1021/acscatal.2c00819 K. Dong, J. Liang, Y. Wang, L. Zhang, Z. Xu, S. Sun, Y. Luo, T. Li, Q. Liu, N. Li, B. Tang, A.A. Alshehri, Q. Li, D. Ma, X. Sun, Conductive Two-Dimensional Magnesium Metal–Organic Frameworks for High-Efficiency O2 Electroreduction to H2O2, ACS. Catal. 12 (2022) 6092–6099. https://doi.org/10.1021/acscatal.2c00819. [77] B. Li C. Zhao J. Liu Q. Zhang Electrosynthesis of hydrogen peroxide synergistically catalyzed by atomic Co–Nx–C sites and oxygen functional groups in noble-metal-free electrocatalysts Adv. Mater. 31 2019 1808173 10.1002/adma.201808173 B. Li, C. Zhao, J. Liu, Q. Zhang, Electrosynthesis of Hydrogen Peroxide Synergistically Catalyzed by Atomic Co–Nx–C Sites and Oxygen Functional Groups in Noble-Metal-Free Electrocatalysts, Adv. Mater. 31 (2019) 1808173. https://doi.org/10.1002/adma.201808173. [78] L. Yan C. Wang Y. Wang Y. Wang Z. Wang L. Zheng Y. Lu R. Wang G. Chen Optimizing the binding of the *OOH intermediate via axially coordinated Co-N5 motif for efficient electrocatalytic H2O2 production Appl. Catal. B-Environ. 338 2023 123078 10.1016/j.apcatb.2023.123078 L. Yan, C. Wang, Y. Wang, Y. Wang, Z. Wang, L. Zheng, Y. Lu, R. Wang, G. Chen, Optimizing the binding of the *OOH intermediate via axially coordinated Co-N5 motif for efficient electrocatalytic H2O2 production, Appl. Catal. B-Environ. 338 (2023) 123078. https://doi.org/10.1016/j.apcatb.2023.123078. [79] L. Zhang J. Liang L. Yue Z. Xu K. Dong Q. Liu Y. Luo T. Li X. Cheng G. Cui B. Tang A.A. Alshehri K.A. Alzahrani X. Guo X. Sun N-doped carbon nanotubes supported CoSe2 nanoparticles: a highly efficient and stable catalyst for H2O2 electrosynthesis in acidic media Nano Res. 15 2022 304 309 10.1007/s12274-021-3474-0 L. Zhang, J. Liang, L. Yue, Z. Xu, K. Dong, Q. Liu, Y. Luo, T. Li, X. Cheng, G. Cui, B. Tang, A.A. Alshehri, K.A. Alzahrani, X. Guo, X. Sun, N-doped carbon nanotubes supported CoSe2 nanoparticles: A highly efficient and stable catalyst for H2O2 electrosynthesis in acidic media, Nano. Res. 15 (2022) 304–309. https://doi.org/10.1007/s12274-021-3474-0. [80] J. Du G. Han W. Zhang L. Li Y. Yan Y. Shi X. Zhang L. Geng Z. Wang Y. Xiong G. Yin C. Du CoIn dual-atom catalyst for hydrogen peroxide production via oxygen reduction reaction in acid Nat. Commun. 14 2023 4766 10.1038/s41467-023-40467-8 J. Du, G. Han, W. Zhang, L. Li, Y. Yan, Y. Shi, X. Zhang, L. Geng, Z. Wang, Y. Xiong, G. Yin, C. Du, CoIn dual-atom catalyst for hydrogen peroxide production via oxygen reduction reaction in acid, Nat. Commun. 14 (2023) 4766. https://doi.org/10.1038/s41467-023-40467-8. [81] J. Gao H.B. Yang X. Huang S.-F. Hung W. Cai C. Jia S. Miao H.M. Chen X. Yang Y. Huang T. Zhang B. Liu Enabling Direct H2O2 Production in Acidic Media through Rational Design of Transition Metal Single Atom Catalyst Chem. -Us 6 2020 658 674 10.1016/j.chempr.2019.12.008 J. Gao, H.B. Yang, X. Huang, S.-F. Hung, W. Cai, C. Jia, S. Miao, H.M. Chen, X. Yang, Y. Huang, T. Zhang, B. Liu, Enabling Direct H2O2 Production in Acidic Media through Rational Design of Transition Metal Single Atom Catalyst, Chem-Us. 6 (2020) 658–674. https://doi.org/10.1016/j.chempr.2019.12.008. [82] E. Jung H. Shin B.-H. Lee V. Efremov S. Lee H.S. Lee J. Kim W. Hooch Antink S. Park K.-S. Lee S.-P. Cho J.S. Yoo Y.-E. Sung T. Hyeon Atomic-level tuning of Co–N–C catalyst for high-performance electrochemical H2O2 production Nat. Mater. 19 2020 436 442 10.1038/s41563-019-0571-5 E. Jung, H. Shin, B.-H. Lee, V. Efremov, S. Lee, H.S. Lee, J. Kim, W. Hooch Antink, S. Park, K.-S. Lee, S.-P. Cho, J.S. Yoo, Y.-E. Sung, T. Hyeon, Atomic-level tuning of Co–N–C catalyst for high-performance electrochemical H2O2 production, Nat. Mater. 19 (2020) 436–442. https://doi.org/10.1038/s41563-019-0571-5. [83] J. Hu W. Shang C. Xin J. Guo X. Cheng S. Zhang S. Song W. Liu F. Ju J. Hou Y. Shi Uncovering Dynamic Edge-Sites in Atomic Co−N−C Electrocatalyst for Selective Hydrogen Peroxide Production Angew. Chem. Int. Ed. 62 2023 e202304754 10.1002/anie.202304754 J. Hu, W. Shang, C. Xin, J. Guo, X. Cheng, S. Zhang, S. Song, W. Liu, F. Ju, J. Hou, Y. Shi, Uncovering Dynamic Edge-Sites in Atomic Co−N−C Electrocatalyst for Selective Hydrogen Peroxide Production, Angew. Chem. Int. Ed. 62 (2023) e202304754. https://doi.org/10.1002/anie.202304754. [84] Y. Yao J. Yang C. Zhu L. Lu Q. Fang C. Xu Z. He S. Song Y. Shen Unveiling the metallic size effect on O2 adsorption and activation for enhanced electro-Fenton degradation of aromatic compounds J. Hazard. Mater. 462 2024 132739 10.1016/j.jhazmat.2023.132739 Y. Yao, J. Yang, C. Zhu, L. Lu, Q. Fang, C. Xu, Z. He, S. Song, Y. Shen, Unveiling the metallic size effect on O2 adsorption and activation for enhanced electro-Fenton degradation of aromatic compounds, J. Hazard. Mater. 462 (2024) 132739. https://doi.org/10.1016/j.jhazmat.2023.132739. [85] H. Jiang C. Zhang Z. Wang Y. Zhang T. Le Y. Mei Y. Feng J. Hu Enhanced two-electron oxygen reduction for hydrogen peroxide production via fine-tuning the concentration of oxygen vacancies in MoO Appl. Catal. A-Gen. 661 2023 119242 10.1016/j.apcata.2023.119242 H. Jiang, C. Zhang, Z. Wang, Y. Zhang, T. Le, Y. Mei, Y. Feng, J. Hu, Enhanced two-electron oxygen reduction for hydrogen peroxide production via fine-tuning the concentration of oxygen vacancies in MoO, Appl. Catal. A-Gen. 661 (2023) 119242. https://doi.org/10.1016/j.apcata.2023.119242. [86] H. Jiang Y. Wang J. Hu X. Shai C. Zhang T. Le L. Zhang M. Shao Phase regulation of WO3 for highly selective oxygen reduction to hydrogen peroxide Chem. Eng. J. 452 2023 139449 10.1016/j.cej.2022.139449 H. Jiang, Y. Wang, J. Hu, X. Shai, C. Zhang, T. Le, L. Zhang, M. Shao, Phase regulation of WO3 for highly selective oxygen reduction to hydrogen peroxide, Chem. Eng. J. 452 (2023) 139449. https://doi.org/10.1016/j.cej.2022.139449. [87] Y. Zhang C. Zhang Y. Mei T. Le H. Shao H. Jiang Y. Feng J. Hu NiFe layered double hydroxide as an efficient bifunctional catalyst for electrosynthesis of hydrogen peroxide and oxygen Int. J. Hydrog. Energy 47 2022 36831 36842 10.1016/j.ijhydene.2022.08.250 Y. Zhang, C. Zhang, Y. Mei, T. Le, H. Shao, H. Jiang, Y. Feng, J. Hu, NiFe layered double hydroxide as an efficient bifunctional catalyst for electrosynthesis of hydrogen peroxide and oxygen, Int. J. Hydrogen. Energy. 47 (2022) 36831–36842. https://doi.org/10.1016/j.ijhydene.2022.08.250. [88] Y. Yao H. Wang K. Dong H. Li J. Liang R. Li S. Sun Z. Cai X. He D. Zheng Y. Luo S. Alfaifi D. Ma W. (Walter) Hu X. Sun Shifting the O2 reduction pathway from H2O to H2 O2 via in situ reconstruction of Ti2O3 nanoparticles J. Mater. Chem. A 11 2023 22154 22160 10.1039/D3TA05092K Y. Yao, H. Wang, K. Dong, H. Li, J. Liang, R. Li, S. Sun, Z. Cai, X. He, D. Zheng, Y. Luo, S. Alfaifi, D. Ma, W. (Walter) Hu, X. Sun, Shifting the O2 reduction pathway from H2O to H2 O2 via in situ reconstruction of Ti2O3 nanoparticles, J. Mater. Chem. A 11 (2023) 22154–22160. https://doi.org/10.1039/D3TA05092K. [89] X. Tian X.F. Lu B.Y. Xia X.W. (David) Lou Advanced electrocatalysts for the oxygen reduction reaction in energy conversion technologies Joule 4 2020 45 68 10.1016/j.joule.2019.12.014 X. Tian, X.F. Lu, B.Y. Xia, X.W. (David) Lou, Advanced Electrocatalysts for the Oxygen Reduction Reaction in Energy Conversion Technologies, Joule. 4 (2020) 45–68. https://doi.org/10.1016/j.joule.2019.12.014. [90] S. Siahrostami A. Verdaguer-Casadevall M. Karamad D. Deiana P. Malacrida B. Wickman M. Escudero-Escribano E.A. Paoli R. Frydendal T.W. Hansen I. Chorkendorff I.E.L. Stephens J. Rossmeisl Enabling direct H2O2 production through rational electrocatalyst design Nat. Mater. 12 2013 1137 1143 10.1038/nmat3795 S. Siahrostami, A. Verdaguer-Casadevall, M. Karamad, D. Deiana, P. Malacrida, B. Wickman, M. Escudero-Escribano, E.A. Paoli, R. Frydendal, T.W. Hansen, I. Chorkendorff, I.E.L. Stephens, J. Rossmeisl, Enabling direct H2O2 production through rational electrocatalyst design, Nature. Mater. 12 (2013) 1137–1143. https://doi.org/10.1038/nmat3795. [91] S. Yang J. Kim Y.J. Tak A. Soon H. Lee Single-atom catalyst of platinum supported on titanium nitride for selective electrochemical reactions Angew. Chem. Int. Ed. 55 2016 2058 2062 10.1002/anie.201509241 S. Yang, J. Kim, Y.J. Tak, A. Soon, H. Lee, Single-Atom Catalyst of Platinum Supported on Titanium Nitride for Selective Electrochemical Reactions, Angew. Chem. Int. Ed. 55 (2016) 2058–2062. https://doi.org/10.1002/anie.201509241. [92] K. Jiang S. Back A.J. Akey C. Xia Y. Hu W. Liang D. Schaak E. Stavitski J.K. Nørskov S. Siahrostami H. Wang Highly selective oxygen reduction to hydrogen peroxide on transition metal single atom coordination Nat. Commun. 10 2019 3997 10.1038/s41467-019-11992-2 K. Jiang, S. Back, A.J. Akey, C. Xia, Y. Hu, W. Liang, D. Schaak, E. Stavitski, J.K. Nørskov, S. Siahrostami, H. Wang, Highly selective oxygen reduction to hydrogen peroxide on transition metal single atom coordination, Nat. Commun. 10 (2019) 3997. https://doi.org/10.1038/s41467-019-11992-2. [93] R. Shen W. Chen Q. Peng S. Lu L. Zheng X. Cao Y. Wang W. Zhu J. Zhang Z. Zhuang C. Chen D. Wang Y. Li High-Concentration Single Atomic Pt Sites on Hollow CuSx for Selective O2 Reduction to H2O2 in Acid Solution Chem. -Us 5 2019 2099 2110 10.1016/j.chempr.2019.04.024 R. Shen, W. Chen, Q. Peng, S. Lu, L. Zheng, X. Cao, Y. Wang, W. Zhu, J. Zhang, Z. Zhuang, C. Chen, D. Wang, Y. Li, High-Concentration Single Atomic Pt Sites on Hollow CuSx for Selective O2 Reduction to H2O2 in Acid Solution, Chem-Us. 5 (2019) 2099–2110. https://doi.org/10.1016/j.chempr.2019.04.024. [94] S. Chen T. Luo X. Li K. Chen J. Fu K. Liu C. Cai Q. Wang H. Li Y. Chen C. Ma L. Zhu Y.-R. Lu T.-S. Chan M. Zhu E. Cortés M. Liu Identification of the highly active Co–N4 coordination motif for selective oxygen reduction to hydrogen peroxide J. Am. Chem. Soc. 144 2022 14505 14516 10.1021/jacs.2c01194 S. Chen, T. Luo, X. Li, K. Chen, J. Fu, K. Liu, C. Cai, Q. Wang, H. Li, Y. Chen, C. Ma, L. Zhu, Y.-R. Lu, T.-S. Chan, M. Zhu, E. Cortés, M. Liu, Identification of the Highly Active Co–N4 Coordination Motif for Selective Oxygen Reduction to Hydrogen Peroxide, J. Am. Chem. Soc. 144 (2022) 14505–14516. https://doi.org/10.1021/jacs.2c01194. [95] M.L. Pegis C.F. Wise D.J. Martin J.M. Mayer Oxygen Reduction by Homogeneous Molecular Catalysts and Electrocatalysts Chem. Rev. 118 2018 2340 2391 10.1021/acs.chemrev.7b00542 M.L. Pegis, C.F. Wise, D.J. Martin, J.M. Mayer, Oxygen Reduction by Homogeneous Molecular Catalysts and Electrocatalysts, Chem. Rev. 118 (2018) 2340–2391. https://doi.org/10.1021/acs.chemrev.7b00542. [96] W. Fan Z. Duan W. Liu R. Mehmood J. Qu Y. Cao X. Guo J. Zhong F. Zhang Rational design of heterogenized molecular phthalocyanine hybrid single-atom electrocatalyst towards two-electron oxygen reduction Nat. Commun. 14 2023 1426 10.1038/s41467-023-37066-y W. Fan, Z. Duan, W. Liu, R. Mehmood, J. Qu, Y. Cao, X. Guo, J. Zhong, F. Zhang, Rational design of heterogenized molecular phthalocyanine hybrid single-atom electrocatalyst towards two-electron oxygen reduction, Nat. Commun. 14 (2023) 1426. https://doi.org/10.1038/s41467-023-37066-y. [97] P.T. Smith Y. Kim B.P. Benke K. Kim C.J. Chang Supramolecular tuning enables selective oxygen reduction catalyzed by cobalt porphyrins for direct electrosynthesis of hydrogen peroxide Angew. Chem. Int. Ed. 59 2020 4902 4907 10.1002/anie.201916131 P.T. Smith, Y. Kim, B.P. Benke, K. Kim, C.J. Chang, Supramolecular Tuning Enables Selective Oxygen Reduction Catalyzed by Cobalt Porphyrins for Direct Electrosynthesis of Hydrogen Peroxide, Angew. Chem. Int. Ed. 59 (2020) 4902–4907. https://doi.org/10.1002/anie.201916131. [98] C. Liu Z. Yu F. She J. Chen F. Liu J. Qu J.M. Cairney C. Wu K. Liu W. Yang H. Zheng Y. Chen H. Li L. Wei Heterogeneous molecular Co–N–C catalysts for efficient electrochemical H2O2 synthesis Energ. Environ. Sci. 16 2023 446 459 10.1039/D2EE02734H C. Liu, Z. Yu, F. She, J. Chen, F. Liu, J. Qu, J.M. Cairney, C. Wu, K. Liu, W. Yang, H. Zheng, Y. Chen, H. Li, L. Wei, Heterogeneous molecular Co–N–C catalysts for efficient electrochemical H2O2 synthesis, Energ. Environ. Sci. 16 (2023) 446–459. https://doi.org/10.1039/D2EE02734H. [99] Z. Yu C. Liu Y. Deng M. Li F. She L. Lai Y. Chen L. Wei Interfacial engineering of heterogeneous molecular electrocatalysts using ionic liquids towards efficient hydrogen peroxide production Chin. J. Catal. 43 2022 1238 1246 10.1016/S1872-2067(21)63946-3 Z. Yu, C. Liu, Y. Deng, M. Li, F. She, L. Lai, Y. Chen, L. Wei, Interfacial engineering of heterogeneous molecular electrocatalysts using ionic liquids towards efficient hydrogen peroxide production, Chin. J. Catal. 43 (2022) 1238–1246. https://doi.org/10.1016/S1872-2067(21)63946-3. [100] Z. Deng A.H.B. Mostaghimi M. Gong N. Chen S. Siahrostami X. Wang Pd 4d Orbital Overlapping Modulation on Au@Pd Nanowires for Efficient H2O2 Production J. Am. Chem. Soc. 146 2024 2816 2823 10.1021/jacs.3c13259 Z. Deng, A.H.B. Mostaghimi, M. Gong, N. Chen, S. Siahrostami, X. Wang, Pd 4d Orbital Overlapping Modulation on Au@Pd Nanowires for Efficient H2O2 Production, J. Am. Chem. Soc. 146 (2024) 2816–2823. https://doi.org/10.1021/jacs.3c13259. [101] B. Li C. Zhao J. Liu Q. Zhang Electrosynthesis of Hydrogen Peroxide Synergistically Catalyzed by Atomic Co–Nx–C Sites and Oxygen Functional Groups in Noble-Metal-Free Electrocatalysts Adv. Mater. 31 2019 1808173 10.1002/adma.201808173 B. Li, C. Zhao, J. Liu, Q. Zhang, Electrosynthesis of Hydrogen Peroxide Synergistically Catalyzed by Atomic Co–Nx–C Sites and Oxygen Functional Groups in Noble-Metal-Free Electrocatalysts, Adv. Mater. 31 (2019) 1808173. https://doi.org/10.1002/adma.201808173. [102] X. Song N. Li H. Zhang L. Wang Y. Yan H. Wang L. Wang Z. Bian Graphene-supported single nickel atom catalyst for highly selective and efficient hydrogen peroxide production ACS Appl. Mater. Inter. 12 2020 17519 17527 10.1021/acsami.0c01278 X. Song, N. Li, H. Zhang, L. Wang, Y. Yan, H. Wang, L. Wang, Z. Bian, Graphene-Supported Single Nickel Atom Catalyst for Highly Selective and Efficient Hydrogen Peroxide Production, Acs. Appl. Mater. Inter. 12 (2020) 17519–17527. https://doi.org/10.1021/acsami.0c01278. [103] X. Zhou Y. Min C. Zhao C. Chen M.-K. Ke S.-L. Xu J.-J. Chen Y. Wu H.-Q. Yu Constructing sulfur and oxygen super-coordinated main-group electrocatalysts for selective and cumulative H2O2 production Nat. Commun. 15 2024 193 10.1038/s41467-023-44585-1 X. Zhou, Y. Min, C. Zhao, C. Chen, M.-K. Ke, S.-L. Xu, J.-J. Chen, Y. Wu, H.-Q. Yu, Constructing sulfur and oxygen super-coordinated main-group electrocatalysts for selective and cumulative H2O2 production, Nat. Commun. 15 (2024) 193. https://doi.org/10.1038/s41467-023-44585-1. [104] L.-Y. Dong J.-S. Wang T.-Y. Li T. Wu X. Hu Y.-T. Wu M.-Y. Zhu G.-P. Hao A.-H. Lu Boundary-rich Carbon-based Electrocatalysts with Manganese(II)-coordinated Active Environment for Selective Synthesis of Hydrogen Peroxide Angew. Chem. Int. Ed. 63 2024 e202317660 10.1002/anie.202317660 L.-Y. Dong, J.-S. Wang, T.-Y. Li, T. Wu, X. Hu, Y.-T. Wu, M.-Y. Zhu, G.-P. Hao, A.-H. Lu, Boundary-rich Carbon-based Electrocatalysts with Manganese(II)-coordinated Active Environment for Selective Synthesis of Hydrogen Peroxide, Angew. Chem. Int. Ed. 63 (2024) e202317660. https://doi.org/10.1002/anie.202317660. [105] C. Kim S.O. Park S.K. Kwak Z. Xia G. Kim L. Dai Concurrent oxygen reduction and water oxidation at high ionic strength for scalable electrosynthesis of hydrogen peroxide Nat. Commun. 14 2023 5822 10.1038/s41467-023-41397-1 C. Kim, S.O. Park, S.K. Kwak, Z. Xia, G. Kim, L. Dai, Concurrent oxygen reduction and water oxidation at high ionic strength for scalable electrosynthesis of hydrogen peroxide, Nat. Commun. 14 (2023) 5822. https://doi.org/10.1038/s41467-023-41397-1. [106] H. Xu S. Zhang X. Zhang M. Xu M. Han L.R. Zheng Y. Zhang G. Wang H. Zhang H. Zhao Atomically dispersed iron regulating electronic structure of iron atom clusters for electrocatalytic H2O2 production and biomass upgrading Angew. Chem. Int. Ed. 62 2023 e202314414 10.1002/anie.202314414 H. Xu, S. Zhang, X. Zhang, M. Xu, M. Han, L.R. Zheng, Y. Zhang, G. Wang, H. Zhang, H. Zhao, Atomically Dispersed Iron Regulating Electronic Structure of Iron Atom Clusters for Electrocatalytic H2O2 Production and Biomass Upgrading, Angew. Chem. Int. Ed. 62 (2023) e202314414. https://doi.org/10.1002/anie.202314414. [107] W. Wang Y. Zheng Y. Hu Y. Liu S. Chen Intrinsic carbon defects for the electrosynthesis of H2O2 J. Phys. Chem. Lett. 13 2022 8914 8920 10.1021/acs.jpclett.2c02684 W. Wang, Y. Zheng, Y. Hu, Y. Liu, S. Chen, Intrinsic Carbon Defects for the Electrosynthesis of H2O2, J. Phys. Chem. Lett. 13 (2022) 8914–8920. https://doi.org/10.1021/acs.jpclett.2c02684. [108] X. Yin L. Lin U. Martinez P. Zelenay 2,2′-dipyridylamine as heterogeneous organic molecular electrocatalyst for two-electron oxygen reduction reaction in acid media ACS Appl. Energ. Mater. 2 2019 7272 7278 10.1021/acsaem.9b01227 X. Yin, L. Lin, U. Martinez, P. Zelenay, 2,2′-Dipyridylamine as Heterogeneous Organic Molecular Electrocatalyst for Two-Electron Oxygen Reduction Reaction in Acid Media, Acs. Appl. Energ. Mater. 2 (2019) 7272–7278. https://doi.org/10.1021/acsaem.9b01227. [109] S. Chen T. Luo K. Chen Y. Lin J. Fu K. Liu C. Cai Q. Wang H. Li X. Li J. Hu H. Li M. Zhu M. Liu Chemical identification of catalytically active sites on oxygen-doped carbon nanosheet to decipher the high activity for electro-synthesis hydrogen peroxide Angew. Chem. Int. Ed. 60 2021 16607 16614 10.1002/anie.202104480 S. Chen, T. Luo, K. Chen, Y. Lin, J. Fu, K. Liu, C. Cai, Q. Wang, H. Li, X. Li, J. Hu, H. Li, M. Zhu, M. Liu, Chemical Identification of Catalytically Active Sites on Oxygen-doped Carbon Nanosheet to Decipher the High Activity for Electro-synthesis Hydrogen Peroxide, Angew. Chem. Int. Ed. 60 (2021) 16607–16614. https://doi.org/10.1002/anie.202104480. [110] Q. Wu H. Zou X. Mao J. He Y. Shi S. Chen X. Yan L. Wu C. Lang B. Zhang L. Song X. Wang A. Du Q. Li Y. Jia J. Chen X. Yao Unveiling the dynamic active site of defective carbon-based electrocatalysts for hydrogen peroxide production Nat. Commun. 14 2023 6275 10.1038/s41467-023-41947-7 Q. Wu, H. Zou, X. Mao, J. He, Y. Shi, S. Chen, X. Yan, L. Wu, C. Lang, B. Zhang, L. Song, X. Wang, A. Du, Q. Li, Y. Jia, J. Chen, X. Yao, Unveiling the dynamic active site of defective carbon-based electrocatalysts for hydrogen peroxide production, Nat. Commun. 14 (2023) 6275. https://doi.org/10.1038/s41467-023-41947-7. [111] Q. Tian L. Jing H. Du Y. Yin X. Cheng J. Xu J. Chen Z. Liu J. Wan J. Liu J. Yang Mesoporous carbon spheres with programmable interiors as efficient nanoreactors for H2O2 electrosynthesis Nat. Commun. 15 2024 983 10.1038/s41467-024-45243-w Q. Tian, L. Jing, H. Du, Y. Yin, X. Cheng, J. Xu, J. Chen, Z. Liu, J. Wan, J. Liu, J. Yang, Mesoporous carbon spheres with programmable interiors as efficient nanoreactors for H2O2 electrosynthesis, Nat. Commun. 15 (2024) 983. https://doi.org/10.1038/s41467-024-45243-w. [112] L. Lin L. Huang C. Wu Y. Gao N. Miao C. Wu A.T. Marshall Y. Zhao J. Wang J. Chen S. Dou G.G. Wallace W. Huang Lattice Distortion and H-passivation in Pure carbon electrocatalysts for efficient and stable two-electron oxygen reduction to H2O2 Angew. Chem. Int. Ed. 62 2023 e202315182 10.1002/anie.202315182 L. Lin, L. Huang, C. Wu, Y. Gao, N. Miao, C. Wu, A.T. Marshall, Y. Zhao, J. Wang, J. Chen, S. Dou, G.G. Wallace, W. Huang, Lattice Distortion and H-passivation in Pure Carbon Electrocatalysts for Efficient and Stable Two-electron Oxygen Reduction to H2O2, Angew. Chem. Int. Ed. 62 (2023) e202315182. https://doi.org/10.1002/anie.202315182. [113] Z. Song X. Chi S. Dong B. Meng X. Yu X. Liu Y. Zhou J. Wang Carboxylated hexagonal boron nitride/graphene configuration for electrosynthesis of high-concentration neutral hydrogen peroxide Angew. Chem. Int. Ed. 63 2023 e202317267 10.1002/anie.202317267 Z. Song, X. Chi, S. Dong, B. Meng, X. Yu, X. Liu, Y. Zhou, J. Wang, Carboxylated Hexagonal Boron Nitride/Graphene Configuration for Electrosynthesis of High-Concentration Neutral Hydrogen Peroxide, Angew. Chem. Int. Ed. 63 (2023) e202317267. https://doi.org/10.1002/anie.202317267. [114] W. Peng J. Liu X. Liu L. Wang L. Yin H. Tan F. Hou J. Liang Facilitating two-electron oxygen reduction with pyrrolic nitrogen sites for electrochemical hydrogen peroxide production Nat. Commun. 14 2023 4430 10.1038/s41467-023-40118-y W. Peng, J. Liu, X. Liu, L. Wang, L. Yin, H. Tan, F. Hou, J. Liang, Facilitating two-electron oxygen reduction with pyrrolic nitrogen sites for electrochemical hydrogen peroxide production, Nat. Commun. 14 (2023) 4430. https://doi.org/10.1038/s41467-023-40118-y. [115] J. Qi Y. Du Q. Yang N. Jiang J. Li Y. Ma Y. Ma X. Zhao J. Qiu Energy-saving and product-oriented hydrogen peroxide electrosynthesis enabled by electrochemistry pairing and product engineering Nat. Commun. 14 2023 6263 10.1038/s41467-023-41997-x J. Qi, Y. Du, Q. Yang, N. Jiang, J. Li, Y. Ma, Y. Ma, X. Zhao, J. Qiu, Energy-saving and product-oriented hydrogen peroxide electrosynthesis enabled by electrochemistry pairing and product engineering, Nat. Commun. 14 (2023) 6263. https://doi.org/10.1038/s41467-023-41997-x. [116] B.-H. Lee H. Shin A.S. Rasouli H. Choubisa P. Ou R. Dorakhan I. Grigioni G. Lee E. Shirzadi R.K. Miao J. Wicks S. Park H.S. Lee J. Zhang Y. Chen Z. Chen D. Sinton T. Hyeon Y.-E. Sung E.H. Sargent Supramolecular tuning of supported metal phthalocyanine catalysts for hydrogen peroxide electrosynthesis Nat. Catal. 6 2023 234 243 10.1038/s41929-023-00924-5 B.-H. Lee, H. Shin, A.S. Rasouli, H. Choubisa, P. Ou, R. Dorakhan, I. Grigioni, G. Lee, E. Shirzadi, R.K. Miao, J. Wicks, S. Park, H.S. Lee, J. Zhang, Y. Chen, Z. Chen, D. Sinton, T. Hyeon, Y.-E. Sung, E.H. Sargent, Supramolecular tuning of supported metal phthalocyanine catalysts for hydrogen peroxide electrosynthesis, Nat. Catal. 6 (2023) 234-243. https://doi.org/10.1038/s41929-023-00924-5. [117] L. Sun X. Jin T. Su A.C. Fisher X. Wang Conjugated nickel phthalocyanine derivatives for heterogeneous electrocatalytic H2O2 synthesis Adv. Mater. 36 2024 2306336 10.1002/adma.202306336 L. Sun, X. Jin, T. Su, A.C. Fisher, X. Wang, Conjugated Nickel Phthalocyanine Derivatives for Heterogeneous Electrocatalytic H2O2 Synthesis, Adv. Mater. 36 (2024) 2306336. https://doi.org/10.1002/adma.202306336. [118] Q. Zhi R. Jiang X. Yang Y. Jin D. Qi K. Wang Y. Liu J. Jiang Dithiine-linked metalphthalocyanine framework with undulated layers for highly efficient and stable H2O2 electroproduction Nat. Commun. 15 2024 678 10.1038/s41467-024-44899-8 Q. Zhi, R. Jiang, X. Yang, Y. Jin, D. Qi, K. Wang, Y. Liu, J. Jiang, Dithiine-linked metalphthalocyanine framework with undulated layers for highly efficient and stable H2O2 electroproduction, Nat. Commun. 15 (2024) 678. https://doi.org/10.1038/s41467-024-44899-8. [119] P.T. Smith Y. Kim B.P. Benke K. Kim C.J. Chang Supramolecular tuning enables selective oxygen reduction catalyzed by cobalt porphyrins for direct electrosynthesis of hydrogen peroxide Angew. Chem. Int. Ed. 59 2020 4902 4907 10.1002/anie.201916131 P.T. Smith, Y. Kim, B.P. Benke, K. Kim, C.J. Chang, Supramolecular Tuning Enables Selective Oxygen Reduction Catalyzed by Cobalt Porphyrins for Direct Electrosynthesis of Hydrogen Peroxide, Angew. Chem. Int. Ed. 59 (2020) 4902–4907. https://doi.org/10.1002/anie.201916131. [120] P. Yin T. Yao Y. Wu L. Zheng Y. Lin W. Liu H. Ju J. Zhu X. Hong Z. Deng G. Zhou S. Wei Y. Li Single cobalt atoms with precise N-coordination as superior oxygen reduction reaction catalysts Angew. Chem. Int. Ed. 55 2016 10800 10805 10.1002/anie.201604802 P. Yin, T. Yao, Y. Wu, L. Zheng, Y. Lin, W. Liu, H. Ju, J. Zhu, X. Hong, Z. Deng, G. Zhou, S. Wei, Y. Li, Single Cobalt Atoms with Precise N-Coordination as Superior Oxygen Reduction Reaction Catalysts, Angew. Chem. Int. Ed. 55 (2016) 10800–10805. https://doi.org/10.1002/anie.201604802.",
      "scopus-id": "85193450889",
      "coredata": {
        "eid": "1-s2.0-S0926860X24002473",
        "dc:description": "The preparation of Hydrogen peroxide (H2O2) by electrochemical two-electron oxygen reduction reaction (2e- ORR) and water oxidation reaction (2e- WOR) is a highly desirable method that can be green, clean and safe. However, the sluggish reaction kinetics and poor 2e- ORR and WOR selectivity severely limits scale-up applications. To resolve these challenges, research on cost-effective catalysts have been intensively explored, which have made great progress. Herein, we first introduced the fundamental chemistry and catalytic mechanism of ORR and WOR, including the possible reaction pathways, the binding modes of oxygen and water on the catalytic sites, and the energy-barrier diagrams of each stage of the reaction obtained by theoretical calculations. Then, the current progress of catalyst research for electrocatalytic synthesis of H2O2 is discussed. Among them, single-atom catalysts as well as molecular catalysts are the hot spots of current research. Single-atom catalysts can reduce the amount of precious or non-precious metals used, and maintain catalytic activity while reducing costs; meanwhile, molecular catalysts have the advantages of single reaction performance, high selectivity, and clear mechanism, which are easy to design and grasp. Finally, on the basis of previous studies, the remaining challenges and development prospects of the current research on electrocatalytic production of H2O2 are discussed, and suggestions are provided for the development of this field in the future.",
        "openArchiveArticle": "false",
        "prism:coverDate": "2024-07-05",
        "openaccessUserLicense": null,
        "prism:aggregationType": "Journal",
        "prism:url": "https://api.elsevier.com/content/article/pii/S0926860X24002473",
        "dc:creator": [
          {
            "@_fa": "true",
            "$": "He, Changjie"
          },
          {
            "@_fa": "true",
            "$": "Luo, Zhaoyan"
          },
          {
            "@_fa": "true",
            "$": "Zhang, Lei"
          },
          {
            "@_fa": "true",
            "$": "Zhang, Qianling"
          },
          {
            "@_fa": "true",
            "$": "He, Chuanxin"
          },
          {
            "@_fa": "true",
            "$": "Ren, Xiangzhong"
          }
        ],
        "link": [
          {
            "@_fa": "true",
            "@rel": "self",
            "@href": "https://api.elsevier.com/content/article/pii/S0926860X24002473"
          },
          {
            "@_fa": "true",
            "@rel": "scidir",
            "@href": "https://www.sciencedirect.com/science/article/pii/S0926860X24002473"
          }
        ],
        "dc:format": "application/json",
        "openaccessType": null,
        "pii": "S0926-860X(24)00247-3",
        "prism:volume": "681",
        "articleNumber": "119803",
        "prism:publisher": "Elsevier B.V. All rights are reserved, including those for text and data mining, AI training, and similar technologies.",
        "dc:title": "Progress and challenges for electrocatalytic production of hydrogen peroxide",
        "prism:copyright": "© 2024 Elsevier B.V. All rights are reserved, including those for text and data mining, AI training, and similar technologies.",
        "openaccess": "0",
        "prism:issn": "0926860X",
        "dcterms:subject": [
          {
            "@_fa": "true",
            "$": "Two-electron oxygen reduction reaction"
          },
          {
            "@_fa": "true",
            "$": "Two-electron water oxidation reaction"
          },
          {
            "@_fa": "true",
            "$": "Hydrogen peroxide"
          },
          {
            "@_fa": "true",
            "$": "Electrocatalysis"
          },
          {
            "@_fa": "true",
            "$": "Current status of research"
          }
        ],
        "openaccessArticle": "false",
        "prism:publicationName": "Applied Catalysis A: General",
        "openaccessSponsorType": null,
        "prism:pageRange": "119803",
        "pubType": "rev",
        "prism:coverDisplayDate": "5 July 2024",
        "prism:doi": "10.1016/j.apcata.2024.119803",
        "prism:startingPage": "119803",
        "dc:identifier": "doi:10.1016/j.apcata.2024.119803",
        "openaccessSponsorName": null
      },
      "objects": {
        "object": [
          {
            "@category": "standard",
            "@height": "453",
            "@width": "791",
            "@_fa": "true",
            "$": "https://api.elsevier.com/content/object/eid/1-s2.0-S0926860X24002473-gr4.jpg?httpAccept=%2A%2F%2A",
            "@multimediatype": "JPEG image file",
            "@type": "IMAGE-DOWNSAMPLED",
            "@size": "68269",
            "@ref": "gr4",
            "@mimetype": "image/jpeg"
          },
          {
            "@category": "standard",
            "@height": "770",
            "@width": "791",
            "@_fa": "true",
            "$": "https://api.elsevier.com/content/object/eid/1-s2.0-S0926860X24002473-gr3.jpg?httpAccept=%2A%2F%2A",
            "@multimediatype": "JPEG image file",
            "@type": "IMAGE-DOWNSAMPLED",
            "@size": "104996",
            "@ref": "gr3",
            "@mimetype": "image/jpeg"
          },
          {
            "@category": "standard",
            "@height": "970",
            "@width": "791",
            "@_fa": "true",
            "$": "https://api.elsevier.com/content/object/eid/1-s2.0-S0926860X24002473-gr6.jpg?httpAccept=%2A%2F%2A",
            "@multimediatype": "JPEG image file",
            "@type": "IMAGE-DOWNSAMPLED",
            "@size": "149073",
            "@ref": "gr6",
            "@mimetype": "image/jpeg"
          },
          {
            "@category": "standard",
            "@height": "769",
            "@width": "791",
            "@_fa": "true",
            "$": "https://api.elsevier.com/content/object/eid/1-s2.0-S0926860X24002473-gr5.jpg?httpAccept=%2A%2F%2A",
            "@multimediatype": "JPEG image file",
            "@type": "IMAGE-DOWNSAMPLED",
            "@size": "107545",
            "@ref": "gr5",
            "@mimetype": "image/jpeg"
          },
          {
            "@category": "standard",
            "@height": "692",
            "@width": "791",
            "@_fa": "true",
            "$": "https://api.elsevier.com/content/object/eid/1-s2.0-S0926860X24002473-gr2.jpg?httpAccept=%2A%2F%2A",
            "@multimediatype": "JPEG image file",
            "@type": "IMAGE-DOWNSAMPLED",
            "@size": "108440",
            "@ref": "gr2",
            "@mimetype": "image/jpeg"
          },
          {
            "@category": "standard",
            "@height": "289",
            "@width": "791",
            "@_fa": "true",
            "$": "https://api.elsevier.com/content/object/eid/1-s2.0-S0926860X24002473-gr11.jpg?httpAccept=%2A%2F%2A",
            "@multimediatype": "JPEG image file",
            "@type": "IMAGE-DOWNSAMPLED",
            "@size": "50406",
            "@ref": "gr11",
            "@mimetype": "image/jpeg"
          },
          {
            "@category": "standard",
            "@height": "245",
            "@width": "223",
            "@_fa": "true",
            "$": "https://api.elsevier.com/content/object/eid/1-s2.0-S0926860X24002473-ga1.jpg?httpAccept=%2A%2F%2A",
            "@multimediatype": "JPEG image file",
            "@type": "IMAGE-DOWNSAMPLED",
            "@size": "20884",
            "@ref": "ga1",
            "@mimetype": "image/jpeg"
          },
          {
            "@category": "standard",
            "@height": "249",
            "@width": "384",
            "@_fa": "true",
            "$": "https://api.elsevier.com/content/object/eid/1-s2.0-S0926860X24002473-gr1.jpg?httpAccept=%2A%2F%2A",
            "@multimediatype": "JPEG image file",
            "@type": "IMAGE-DOWNSAMPLED",
            "@size": "24373",
            "@ref": "gr1",
            "@mimetype": "image/jpeg"
          },
          {
            "@category": "standard",
            "@height": "887",
            "@width": "791",
            "@_fa": "true",
            "$": "https://api.elsevier.com/content/object/eid/1-s2.0-S0926860X24002473-gr10.jpg?httpAccept=%2A%2F%2A",
            "@multimediatype": "JPEG image file",
            "@type": "IMAGE-DOWNSAMPLED",
            "@size": "124869",
            "@ref": "gr10",
            "@mimetype": "image/jpeg"
          },
          {
            "@category": "standard",
            "@height": "331",
            "@width": "791",
            "@_fa": "true",
            "$": "https://api.elsevier.com/content/object/eid/1-s2.0-S0926860X24002473-gr8.jpg?httpAccept=%2A%2F%2A",
            "@multimediatype": "JPEG image file",
            "@type": "IMAGE-DOWNSAMPLED",
            "@size": "83066",
            "@ref": "gr8",
            "@mimetype": "image/jpeg"
          },
          {
            "@category": "standard",
            "@height": "384",
            "@width": "384",
            "@_fa": "true",
            "$": "https://api.elsevier.com/content/object/eid/1-s2.0-S0926860X24002473-gr7.jpg?httpAccept=%2A%2F%2A",
            "@multimediatype": "JPEG image file",
            "@type": "IMAGE-DOWNSAMPLED",
            "@size": "34003",
            "@ref": "gr7",
            "@mimetype": "image/jpeg"
          },
          {
            "@category": "standard",
            "@height": "273",
            "@width": "791",
            "@_fa": "true",
            "$": "https://api.elsevier.com/content/object/eid/1-s2.0-S0926860X24002473-gr9.jpg?httpAccept=%2A%2F%2A",
            "@multimediatype": "JPEG image file",
            "@type": "IMAGE-DOWNSAMPLED",
            "@size": "61501",
            "@ref": "gr9",
            "@mimetype": "image/jpeg"
          },
          {
            "@category": "thumbnail",
            "@height": "125",
            "@width": "219",
            "@_fa": "true",
            "$": "https://api.elsevier.com/content/object/eid/1-s2.0-S0926860X24002473-gr4.sml?httpAccept=%2A%2F%2A",
            "@multimediatype": "GIF image file",
            "@type": "IMAGE-THUMBNAIL",
            "@size": "11336",
            "@ref": "gr4",
            "@mimetype": "image/gif"
          },
          {
            "@category": "thumbnail",
            "@height": "164",
            "@width": "168",
            "@_fa": "true",
            "$": "https://api.elsevier.com/content/object/eid/1-s2.0-S0926860X24002473-gr3.sml?httpAccept=%2A%2F%2A",
            "@multimediatype": "GIF image file",
            "@type": "IMAGE-THUMBNAIL",
            "@size": "10531",
            "@ref": "gr3",
            "@mimetype": "image/gif"
          },
          {
            "@category": "thumbnail",
            "@height": "163",
            "@width": "133",
            "@_fa": "true",
            "$": "https://api.elsevier.com/content/object/eid/1-s2.0-S0926860X24002473-gr6.sml?httpAccept=%2A%2F%2A",
            "@multimediatype": "GIF image file",
            "@type": "IMAGE-THUMBNAIL",
            "@size": "12654",
            "@ref": "gr6",
            "@mimetype": "image/gif"
          },
          {
            "@category": "thumbnail",
            "@height": "163",
            "@width": "168",
            "@_fa": "true",
            "$": "https://api.elsevier.com/content/object/eid/1-s2.0-S0926860X24002473-gr5.sml?httpAccept=%2A%2F%2A",
            "@multimediatype": "GIF image file",
            "@type": "IMAGE-THUMBNAIL",
            "@size": "11522",
            "@ref": "gr5",
            "@mimetype": "image/gif"
          },
          {
            "@category": "thumbnail",
            "@height": "164",
            "@width": "187",
            "@_fa": "true",
            "$": "https://api.elsevier.com/content/object/eid/1-s2.0-S0926860X24002473-gr2.sml?httpAccept=%2A%2F%2A",
            "@multimediatype": "GIF image file",
            "@type": "IMAGE-THUMBNAIL",
            "@size": "12977",
            "@ref": "gr2",
            "@mimetype": "image/gif"
          },
          {
            "@category": "thumbnail",
            "@height": "80",
            "@width": "219",
            "@_fa": "true",
            "$": "https://api.elsevier.com/content/object/eid/1-s2.0-S0926860X24002473-gr11.sml?httpAccept=%2A%2F%2A",
            "@multimediatype": "GIF image file",
            "@type": "IMAGE-THUMBNAIL",
            "@size": "5727",
            "@ref": "gr11",
            "@mimetype": "image/gif"
          },
          {
            "@category": "thumbnail",
            "@height": "163",
            "@width": "149",
            "@_fa": "true",
            "$": "https://api.elsevier.com/content/object/eid/1-s2.0-S0926860X24002473-ga1.sml?httpAccept=%2A%2F%2A",
            "@multimediatype": "GIF image file",
            "@type": "IMAGE-THUMBNAIL",
            "@size": "14083",
            "@ref": "ga1",
            "@mimetype": "image/gif"
          },
          {
            "@category": "thumbnail",
            "@height": "142",
            "@width": "219",
            "@_fa": "true",
            "$": "https://api.elsevier.com/content/object/eid/1-s2.0-S0926860X24002473-gr1.sml?httpAccept=%2A%2F%2A",
            "@multimediatype": "GIF image file",
            "@type": "IMAGE-THUMBNAIL",
            "@size": "21926",
            "@ref": "gr1",
            "@mimetype": "image/gif"
          },
          {
            "@category": "thumbnail",
            "@height": "164",
            "@width": "146",
            "@_fa": "true",
            "$": "https://api.elsevier.com/content/object/eid/1-s2.0-S0926860X24002473-gr10.sml?httpAccept=%2A%2F%2A",
            "@multimediatype": "GIF image file",
            "@type": "IMAGE-THUMBNAIL",
            "@size": "10959",
            "@ref": "gr10",
            "@mimetype": "image/gif"
          },
          {
            "@category": "thumbnail",
            "@height": "92",
            "@width": "219",
            "@_fa": "true",
            "$": "https://api.elsevier.com/content/object/eid/1-s2.0-S0926860X24002473-gr8.sml?httpAccept=%2A%2F%2A",
            "@multimediatype": "GIF image file",
            "@type": "IMAGE-THUMBNAIL",
            "@size": "12779",
            "@ref": "gr8",
            "@mimetype": "image/gif"
          },
          {
            "@category": "thumbnail",
            "@height": "164",
            "@width": "164",
            "@_fa": "true",
            "$": "https://api.elsevier.com/content/object/eid/1-s2.0-S0926860X24002473-gr7.sml?httpAccept=%2A%2F%2A",
            "@multimediatype": "GIF image file",
            "@type": "IMAGE-THUMBNAIL",
            "@size": "15282",
            "@ref": "gr7",
            "@mimetype": "image/gif"
          },
          {
            "@category": "thumbnail",
            "@height": "75",
            "@width": "219",
            "@_fa": "true",
            "$": "https://api.elsevier.com/content/object/eid/1-s2.0-S0926860X24002473-gr9.sml?httpAccept=%2A%2F%2A",
            "@multimediatype": "GIF image file",
            "@type": "IMAGE-THUMBNAIL",
            "@size": "8073",
            "@ref": "gr9",
            "@mimetype": "image/gif"
          },
          {
            "@category": "high",
            "@height": "2000",
            "@width": "3493",
            "@_fa": "true",
            "$": "https://api.elsevier.com/content/object/eid/1-s2.0-S0926860X24002473-gr4_lrg.jpg?httpAccept=%2A%2F%2A",
            "@multimediatype": "JPEG image file",
            "@type": "IMAGE-HIGH-RES",
            "@size": "309787",
            "@ref": "gr4",
            "@mimetype": "image/jpeg"
          },
          {
            "@category": "high",
            "@height": "3400",
            "@width": "3493",
            "@_fa": "true",
            "$": "https://api.elsevier.com/content/object/eid/1-s2.0-S0926860X24002473-gr3_lrg.jpg?httpAccept=%2A%2F%2A",
            "@multimediatype": "JPEG image file",
            "@type": "IMAGE-HIGH-RES",
            "@size": "450267",
            "@ref": "gr3",
            "@mimetype": "image/jpeg"
          },
          {
            "@category": "high",
            "@height": "4284",
            "@width": "3493",
            "@_fa": "true",
            "$": "https://api.elsevier.com/content/object/eid/1-s2.0-S0926860X24002473-gr6_lrg.jpg?httpAccept=%2A%2F%2A",
            "@multimediatype": "JPEG image file",
            "@type": "IMAGE-HIGH-RES",
            "@size": "669304",
            "@ref": "gr6",
            "@mimetype": "image/jpeg"
          },
          {
            "@category": "high",
            "@height": "3398",
            "@width": "3493",
            "@_fa": "true",
            "$": "https://api.elsevier.com/content/object/eid/1-s2.0-S0926860X24002473-gr5_lrg.jpg?httpAccept=%2A%2F%2A",
            "@multimediatype": "JPEG image file",
            "@type": "IMAGE-HIGH-RES",
            "@size": "449642",
            "@ref": "gr5",
            "@mimetype": "image/jpeg"
          },
          {
            "@category": "high",
            "@height": "3056",
            "@width": "3493",
            "@_fa": "true",
            "$": "https://api.elsevier.com/content/object/eid/1-s2.0-S0926860X24002473-gr2_lrg.jpg?httpAccept=%2A%2F%2A",
            "@multimediatype": "JPEG image file",
            "@type": "IMAGE-HIGH-RES",
            "@size": "483412",
            "@ref": "gr2",
            "@mimetype": "image/jpeg"
          },
          {
            "@category": "high",
            "@height": "1277",
            "@width": "3493",
            "@_fa": "true",
            "$": "https://api.elsevier.com/content/object/eid/1-s2.0-S0926860X24002473-gr11_lrg.jpg?httpAccept=%2A%2F%2A",
            "@multimediatype": "JPEG image file",
            "@type": "IMAGE-HIGH-RES",
            "@size": "215431",
            "@ref": "gr11",
            "@mimetype": "image/jpeg"
          },
          {
            "@category": "high",
            "@height": "1085",
            "@width": "989",
            "@_fa": "true",
            "$": "https://api.elsevier.com/content/object/eid/1-s2.0-S0926860X24002473-ga1_lrg.jpg?httpAccept=%2A%2F%2A",
            "@multimediatype": "JPEG image file",
            "@type": "IMAGE-HIGH-RES",
            "@size": "160687",
            "@ref": "ga1",
            "@mimetype": "image/jpeg"
          },
          {
            "@category": "high",
            "@height": "1103",
            "@width": "1704",
            "@_fa": "true",
            "$": "https://api.elsevier.com/content/object/eid/1-s2.0-S0926860X24002473-gr1_lrg.jpg?httpAccept=%2A%2F%2A",
            "@multimediatype": "JPEG image file",
            "@type": "IMAGE-HIGH-RES",
            "@size": "98708",
            "@ref": "gr1",
            "@mimetype": "image/jpeg"
          },
          {
            "@category": "high",
            "@height": "3917",
            "@width": "3493",
            "@_fa": "true",
            "$": "https://api.elsevier.com/content/object/eid/1-s2.0-S0926860X24002473-gr10_lrg.jpg?httpAccept=%2A%2F%2A",
            "@multimediatype": "JPEG image file",
            "@type": "IMAGE-HIGH-RES",
            "@size": "552944",
            "@ref": "gr10",
            "@mimetype": "image/jpeg"
          },
          {
            "@category": "high",
            "@height": "1461",
            "@width": "3493",
            "@_fa": "true",
            "$": "https://api.elsevier.com/content/object/eid/1-s2.0-S0926860X24002473-gr8_lrg.jpg?httpAccept=%2A%2F%2A",
            "@multimediatype": "JPEG image file",
            "@type": "IMAGE-HIGH-RES",
            "@size": "392088",
            "@ref": "gr8",
            "@mimetype": "image/jpeg"
          },
          {
            "@category": "high",
            "@height": "1704",
            "@width": "1704",
            "@_fa": "true",
            "$": "https://api.elsevier.com/content/object/eid/1-s2.0-S0926860X24002473-gr7_lrg.jpg?httpAccept=%2A%2F%2A",
            "@multimediatype": "JPEG image file",
            "@type": "IMAGE-HIGH-RES",
            "@size": "146805",
            "@ref": "gr7",
            "@mimetype": "image/jpeg"
          },
          {
            "@category": "high",
            "@height": "1204",
            "@width": "3493",
            "@_fa": "true",
            "$": "https://api.elsevier.com/content/object/eid/1-s2.0-S0926860X24002473-gr9_lrg.jpg?httpAccept=%2A%2F%2A",
            "@multimediatype": "JPEG image file",
            "@type": "IMAGE-HIGH-RES",
            "@size": "262171",
            "@ref": "gr9",
            "@mimetype": "image/jpeg"
          },
          {
            "@category": "thumbnail",
            "@_fa": "true",
            "$": "https://api.elsevier.com/content/object/eid/1-s2.0-S0926860X24002473-si0001.svg?httpAccept=%2A%2F%2A",
            "@multimediatype": "Scalable Vector Graphics file",
            "@type": "ALTIMG",
            "@size": "3371",
            "@ref": "si0001",
            "@mimetype": "image/svg+xml"
          },
          {
            "@category": "thumbnail",
            "@_fa": "true",
            "$": "https://api.elsevier.com/content/object/eid/1-s2.0-S0926860X24002473-si0002.svg?httpAccept=%2A%2F%2A",
            "@multimediatype": "Scalable Vector Graphics file",
            "@type": "ALTIMG",
            "@size": "3152",
            "@ref": "si0002",
            "@mimetype": "image/svg+xml"
          },
          {
            "@category": "thumbnail",
            "@_fa": "true",
            "$": "https://api.elsevier.com/content/object/eid/1-s2.0-S0926860X24002473-si0003.svg?httpAccept=%2A%2F%2A",
            "@multimediatype": "Scalable Vector Graphics file",
            "@type": "ALTIMG",
            "@size": "2066",
            "@ref": "si0003",
            "@mimetype": "image/svg+xml"
          },
          {
            "@category": "thumbnail",
            "@_fa": "true",
            "$": "https://api.elsevier.com/content/object/eid/1-s2.0-S0926860X24002473-si0004.svg?httpAccept=%2A%2F%2A",
            "@multimediatype": "Scalable Vector Graphics file",
            "@type": "ALTIMG",
            "@size": "2167",
            "@ref": "si0004",
            "@mimetype": "image/svg+xml"
          },
          {
            "@category": "thumbnail",
            "@_fa": "true",
            "$": "https://api.elsevier.com/content/object/eid/1-s2.0-S0926860X24002473-si0005.svg?httpAccept=%2A%2F%2A",
            "@multimediatype": "Scalable Vector Graphics file",
            "@type": "ALTIMG",
            "@size": "2937",
            "@ref": "si0005",
            "@mimetype": "image/svg+xml"
          },
          {
            "@category": "thumbnail",
            "@_fa": "true",
            "$": "https://api.elsevier.com/content/object/eid/1-s2.0-S0926860X24002473-si0006.svg?httpAccept=%2A%2F%2A",
            "@multimediatype": "Scalable Vector Graphics file",
            "@type": "ALTIMG",
            "@size": "2066",
            "@ref": "si0006",
            "@mimetype": "image/svg+xml"
          },
          {
            "@category": "thumbnail",
            "@_fa": "true",
            "$": "https://api.elsevier.com/content/object/eid/1-s2.0-S0926860X24002473-si0007.svg?httpAccept=%2A%2F%2A",
            "@multimediatype": "Scalable Vector Graphics file",
            "@type": "ALTIMG",
            "@size": "1726",
            "@ref": "si0007",
            "@mimetype": "image/svg+xml"
          },
          {
            "@category": "thumbnail",
            "@_fa": "true",
            "$": "https://api.elsevier.com/content/object/eid/1-s2.0-S0926860X24002473-si0008.svg?httpAccept=%2A%2F%2A",
            "@multimediatype": "Scalable Vector Graphics file",
            "@type": "ALTIMG",
            "@size": "2171",
            "@ref": "si0008",
            "@mimetype": "image/svg+xml"
          },
          {
            "@category": "thumbnail",
            "@_fa": "true",
            "$": "https://api.elsevier.com/content/object/eid/1-s2.0-S0926860X24002473-si0009.svg?httpAccept=%2A%2F%2A",
            "@multimediatype": "Scalable Vector Graphics file",
            "@type": "ALTIMG",
            "@size": "2058",
            "@ref": "si0009",
            "@mimetype": "image/svg+xml"
          },
          {
            "@category": "thumbnail",
            "@_fa": "true",
            "$": "https://api.elsevier.com/content/object/eid/1-s2.0-S0926860X24002473-si0010.svg?httpAccept=%2A%2F%2A",
            "@multimediatype": "Scalable Vector Graphics file",
            "@type": "ALTIMG",
            "@size": "3160",
            "@ref": "si0010",
            "@mimetype": "image/svg+xml"
          },
          {
            "@category": "thumbnail",
            "@_fa": "true",
            "$": "https://api.elsevier.com/content/object/eid/1-s2.0-S0926860X24002473-si0011.svg?httpAccept=%2A%2F%2A",
            "@multimediatype": "Scalable Vector Graphics file",
            "@type": "ALTIMG",
            "@size": "1580",
            "@ref": "si0011",
            "@mimetype": "image/svg+xml"
          },
          {
            "@category": "thumbnail",
            "@_fa": "true",
            "$": "https://api.elsevier.com/content/object/eid/1-s2.0-S0926860X24002473-si0012.svg?httpAccept=%2A%2F%2A",
            "@multimediatype": "Scalable Vector Graphics file",
            "@type": "ALTIMG",
            "@size": "2119",
            "@ref": "si0012",
            "@mimetype": "image/svg+xml"
          },
          {
            "@category": "thumbnail",
            "@_fa": "true",
            "$": "https://api.elsevier.com/content/object/eid/1-s2.0-S0926860X24002473-si0013.svg?httpAccept=%2A%2F%2A",
            "@multimediatype": "Scalable Vector Graphics file",
            "@type": "ALTIMG",
            "@size": "2151",
            "@ref": "si0013",
            "@mimetype": "image/svg+xml"
          },
          {
            "@category": "thumbnail",
            "@_fa": "true",
            "$": "https://api.elsevier.com/content/object/eid/1-s2.0-S0926860X24002473-si0014.svg?httpAccept=%2A%2F%2A",
            "@multimediatype": "Scalable Vector Graphics file",
            "@type": "ALTIMG",
            "@size": "2970",
            "@ref": "si0014",
            "@mimetype": "image/svg+xml"
          },
          {
            "@category": "thumbnail",
            "@_fa": "true",
            "$": "https://api.elsevier.com/content/object/eid/1-s2.0-S0926860X24002473-si0015.svg?httpAccept=%2A%2F%2A",
            "@multimediatype": "Scalable Vector Graphics file",
            "@type": "ALTIMG",
            "@size": "1580",
            "@ref": "si0015",
            "@mimetype": "image/svg+xml"
          },
          {
            "@category": "thumbnail",
            "@_fa": "true",
            "$": "https://api.elsevier.com/content/object/eid/1-s2.0-S0926860X24002473-si0016.svg?httpAccept=%2A%2F%2A",
            "@multimediatype": "Scalable Vector Graphics file",
            "@type": "ALTIMG",
            "@size": "2119",
            "@ref": "si0016",
            "@mimetype": "image/svg+xml"
          },
          {
            "@category": "thumbnail",
            "@_fa": "true",
            "$": "https://api.elsevier.com/content/object/eid/1-s2.0-S0926860X24002473-si0017.svg?httpAccept=%2A%2F%2A",
            "@multimediatype": "Scalable Vector Graphics file",
            "@type": "ALTIMG",
            "@size": "2200",
            "@ref": "si0017",
            "@mimetype": "image/svg+xml"
          },
          {
            "@category": "thumbnail",
            "@_fa": "true",
            "$": "https://api.elsevier.com/content/object/eid/1-s2.0-S0926860X24002473-si0018.svg?httpAccept=%2A%2F%2A",
            "@multimediatype": "Scalable Vector Graphics file",
            "@type": "ALTIMG",
            "@size": "1766",
            "@ref": "si0018",
            "@mimetype": "image/svg+xml"
          },
          {
            "@category": "thumbnail",
            "@_fa": "true",
            "$": "https://api.elsevier.com/content/object/eid/1-s2.0-S0926860X24002473-si0019.svg?httpAccept=%2A%2F%2A",
            "@multimediatype": "Scalable Vector Graphics file",
            "@type": "ALTIMG",
            "@size": "1924",
            "@ref": "si0019",
            "@mimetype": "image/svg+xml"
          },
          {
            "@category": "thumbnail",
            "@_fa": "true",
            "$": "https://api.elsevier.com/content/object/eid/1-s2.0-S0926860X24002473-si0020.svg?httpAccept=%2A%2F%2A",
            "@multimediatype": "Scalable Vector Graphics file",
            "@type": "ALTIMG",
            "@size": "1584",
            "@ref": "si0020",
            "@mimetype": "image/svg+xml"
          },
          {
            "@category": "thumbnail",
            "@_fa": "true",
            "$": "https://api.elsevier.com/content/object/eid/1-s2.0-S0926860X24002473-si0021.svg?httpAccept=%2A%2F%2A",
            "@multimediatype": "Scalable Vector Graphics file",
            "@type": "ALTIMG",
            "@size": "2050",
            "@ref": "si0021",
            "@mimetype": "image/svg+xml"
          },
          {
            "@category": "thumbnail",
            "@_fa": "true",
            "$": "https://api.elsevier.com/content/object/eid/1-s2.0-S0926860X24002473-si0022.svg?httpAccept=%2A%2F%2A",
            "@multimediatype": "Scalable Vector Graphics file",
            "@type": "ALTIMG",
            "@size": "2236",
            "@ref": "si0022",
            "@mimetype": "image/svg+xml"
          },
          {
            "@category": "thumbnail",
            "@_fa": "true",
            "$": "https://api.elsevier.com/content/object/eid/1-s2.0-S0926860X24002473-si0023.svg?httpAccept=%2A%2F%2A",
            "@multimediatype": "Scalable Vector Graphics file",
            "@type": "ALTIMG",
            "@size": "2171",
            "@ref": "si0023",
            "@mimetype": "image/svg+xml"
          },
          {
            "@category": "thumbnail",
            "@_fa": "true",
            "$": "https://api.elsevier.com/content/object/eid/1-s2.0-S0926860X24002473-si0024.svg?httpAccept=%2A%2F%2A",
            "@multimediatype": "Scalable Vector Graphics file",
            "@type": "ALTIMG",
            "@size": "2098",
            "@ref": "si0024",
            "@mimetype": "image/svg+xml"
          },
          {
            "@category": "thumbnail",
            "@_fa": "true",
            "$": "https://api.elsevier.com/content/object/eid/1-s2.0-S0926860X24002473-si0025.svg?httpAccept=%2A%2F%2A",
            "@multimediatype": "Scalable Vector Graphics file",
            "@type": "ALTIMG",
            "@size": "2102",
            "@ref": "si0025",
            "@mimetype": "image/svg+xml"
          },
          {
            "@category": "thumbnail",
            "@_fa": "true",
            "$": "https://api.elsevier.com/content/object/eid/1-s2.0-S0926860X24002473-si0026.svg?httpAccept=%2A%2F%2A",
            "@multimediatype": "Scalable Vector Graphics file",
            "@type": "ALTIMG",
            "@size": "2244",
            "@ref": "si0026",
            "@mimetype": "image/svg+xml"
          },
          {
            "@category": "thumbnail",
            "@_fa": "true",
            "$": "https://api.elsevier.com/content/object/eid/1-s2.0-S0926860X24002473-si0027.svg?httpAccept=%2A%2F%2A",
            "@multimediatype": "Scalable Vector Graphics file",
            "@type": "ALTIMG",
            "@size": "2305",
            "@ref": "si0027",
            "@mimetype": "image/svg+xml"
          },
          {
            "@category": "thumbnail",
            "@_fa": "true",
            "$": "https://api.elsevier.com/content/object/eid/1-s2.0-S0926860X24002473-si0028.svg?httpAccept=%2A%2F%2A",
            "@multimediatype": "Scalable Vector Graphics file",
            "@type": "ALTIMG",
            "@size": "1965",
            "@ref": "si0028",
            "@mimetype": "image/svg+xml"
          },
          {
            "@category": "thumbnail",
            "@_fa": "true",
            "$": "https://api.elsevier.com/content/object/eid/1-s2.0-S0926860X24002473-si0029.svg?httpAccept=%2A%2F%2A",
            "@multimediatype": "Scalable Vector Graphics file",
            "@type": "ALTIMG",
            "@size": "2030",
            "@ref": "si0029",
            "@mimetype": "image/svg+xml"
          },
          {
            "@category": "thumbnail",
            "@_fa": "true",
            "$": "https://api.elsevier.com/content/object/eid/1-s2.0-S0926860X24002473-si0030.svg?httpAccept=%2A%2F%2A",
            "@multimediatype": "Scalable Vector Graphics file",
            "@type": "ALTIMG",
            "@size": "2443",
            "@ref": "si0030",
            "@mimetype": "image/svg+xml"
          },
          {
            "@category": "thumbnail",
            "@_fa": "true",
            "$": "https://api.elsevier.com/content/object/eid/1-s2.0-S0926860X24002473-si0031.svg?httpAccept=%2A%2F%2A",
            "@multimediatype": "Scalable Vector Graphics file",
            "@type": "ALTIMG",
            "@size": "3987",
            "@ref": "si0031",
            "@mimetype": "image/svg+xml"
          },
          {
            "@category": "thumbnail",
            "@_fa": "true",
            "$": "https://api.elsevier.com/content/object/eid/1-s2.0-S0926860X24002473-si0032.svg?httpAccept=%2A%2F%2A",
            "@multimediatype": "Scalable Vector Graphics file",
            "@type": "ALTIMG",
            "@size": "2123",
            "@ref": "si0032",
            "@mimetype": "image/svg+xml"
          },
          {
            "@category": "standard",
            "@_fa": "true",
            "$": "https://api.elsevier.com/content/object/eid/1-s2.0-S0926860X24002473-am.pdf?httpAccept=%2A%2F%2A",
            "@multimediatype": "Acrobat PDF file",
            "@type": "AAM-PDF",
            "@size": "1477923",
            "@ref": "am",
            "@mimetype": "application/pdf"
          }
        ]
      },
      "link": {
        "@rel": "abstract",
        "@href": "https://api.elsevier.com/content/abstract/scopus_id/85193450889"
      }
    }
  }
}