{
  "metadata": {
    "title": "Efficient CuZn/SiO<ce:inf loc=post>2</ce:inf> lamellar catalysts for methanol dehydrogenation: New insights into the role of zinc",
    "authors": "; ; ",
    "journal": "Applied Catalysis A: General",
    "date": "2022-05-05",
    "doi": "10.1016/j.apcata.2022.118585",
    "abstract": "",
    "uri": "https://api.elsevier.com/content/article/pii/S0926860X22001089",
    "pii": "S0926860X22001089"
  },
  "fulltext": {
    "full-text-retrieval-response": {
      "scopus-eid": "2-s2.0-85128209404",
      "originalText": "serial JL 271346 291210 291744 291809 31 Applied Catalysis A: General APPLIEDCATALYSISAGENERAL 2022-03-21 2022-03-21 2022-04-12 2022-04-12 2022-04-14T20:52:20 1-s2.0-S0926860X22001089 S0926-860X(22)00108-9 S0926860X22001089 10.1016/j.apcata.2022.118585 S300 S300.1 FULL-TEXT 1-s2.0-S0926860X22X00082 2024-01-01T12:34:28.416125Z 0 0 20220505 2022 2022-03-21T16:19:18.87986Z absattachment articleinfo articlenumber articletitlenorm authfirstinitialnorm authfirstsurnamenorm cid cids contenttype copyright crossmark dateloaded dateloadedtxt datesearch datesort dateupdated dco docsubtype doctype doi eid ewtransactionid hubeid indexeddate issn issnnorm itemstage itemtransactionid itemweight openaccess openarchive pg pgfirst pii piinorm pubdatestart pubdatetxt pubyr sortorder srctitle srctitlenorm srctype ssids alllist content subj subheadings suppl tomb volfirst volissue volumelist webpdf webpdfpagecount yearnav figure table e-component body mmlmath acknowledge affil appendices articletitle auth authfirstini authfull authkeywords authlast grantnumber grantsponsor grantsponsorid highlightsabst primabst ref specialabst 0926-860X 0926860X true 637 637 C Volume 637 5 118585 118585 118585 20220505 5 May 2022 2022-05-05 2022 article fla © 2022 Elsevier B.V. All rights reserved. EFFICIENTCUZNSIO2LAMELLARCATALYSTSFORMETHANOLDEHYDROGENATIONNEWINSIGHTSROLEZINC QUAN Y 1 Introduction 2 Experimental 2.1 Materials 2.2 Preparation of catalysts 2.3 Characterization techniques 2.4 Catalytic tests 3 Results and discussion 3.1 Characterization of catalysts 3.1.1 Physicochemical properties 3.1.2 Crystalline phase and morphology 3.1.3 Interaction between Cu and ZnO species 3.1.4 Surface chemical states 3.1.5 CH3OH-TPD 3.2 Dehydrogenation of methanol to MF 3.2.1 Catalytic performance 3.2.2 Stability of catalysts 4 Conclusion CRediT authorship contribution statement Acknowledgments Appendix A Supplementary material References RONG 2018 238 242 L INDU 1993 981 985 B LIU 2021 2254 2264 J WANG 2008 4421 4431 X LIU 2005 2155 2163 H LI 2006 23337 23342 W ZHAO 2007 117 125 H WESTHUES 2019 5269 5274 N IKRAM 2021 129090 M LU 2015 301 308 Z IWASA 2003 215 224 N ZHAO 2018 4526 4534 Y ZHANG 2018 268 276 M WANG 2021 111514 N YUAN 2019 1854 1860 D JOHN 2020 145037 M WANG 2018 403 409 G SHAO 2021 557 566 Y SHREIBER 2002 119 129 E SHELEPOVA 2017 291 295 E GAO 2015 1107 1118 D KAISER 2021 869 D YANG 2018 1836 1840 H VEDYAGIN 2016 185 199 A DI 2016 244 259 W HU 2021 eabi9828 S YANG 2016 56 60 H YUE 2013 2339 H GONG 2017 6933 6936 X WAN 2021 H REN 2017 673 682 J LU 2021 110842 Y TRUJILLANO 2008 18551 18558 R LEE 2012 3721 3730 J BIAN 2020 3 23 Z WANG 2018 231 241 X ZHU 2015 1169 1180 S CHEN 2021 30373 30381 Y BIAN 2020 27078 27088 Z WANG 2003 151 158 Z JIN 2017 12992 13001 L HUANG 2021 E KOITAYA 2017 1 10 T DING 2017 530 542 J POPA 2015 52 61 T WU 2015 94 102 T TOUPANCE 2002 2277 2286 T LI 2020 29 37 H GONG 2012 13922 13925 J CHEN 2008 172 180 L WANG 2017 37 46 X NIU 2014 252 261 X WANG 2019 133 140 G ZHANG 2018 99 108 Y HUANG 2020 68 73 H ZHAO 2017 759 768 Y CHEN 2021 546 556 J ZHANG 2002 1619 1624 R ARAIZA 2017 185 194 D ZHANG 2014 331 340 L WU 2021 2224 2234 Z SHELEPOVA 2017 449 458 E LI 2011 284 293 C VANDENBERG 2016 3433 3442 R LAKSHMINARAYANAN 2011 318 325 N QUANX2022X118585 QUANX2022X118585XY 2024-04-12T00:00:00.000Z 2024-04-12T00:00:00.000Z http://creativecommons.org/licenses/by-nc-nd/4.0/ © 2022 Elsevier B.V. All rights reserved. 0 https://doi.org/10.15223/policy-017 https://doi.org/10.15223/policy-037 https://doi.org/10.15223/policy-012 https://doi.org/10.15223/policy-029 https://doi.org/10.15223/policy-004 item S0926-860X(22)00108-9 S0926860X22001089 1-s2.0-S0926860X22001089 10.1016/j.apcata.2022.118585 271346 2024-01-01T12:34:28.416125Z 2022-05-05 1-s2.0-S0926860X22001089-main.pdf https://s3-eu-west-1.amazonaws.com/prod-ucs-content-store-eu-west/content/pii:S0926860X22001089/MAIN/application/pdf/f9245fb62697e51884afd411b52c0ac2/main.pdf main.pdf pdf true 5750340 MAIN 10 1-s2.0-S0926860X22001089-main_1.png https://s3-eu-west-1.amazonaws.com/prod-ucs-content-store-eu-west/content/pii:S0926860X22001089/PREVIEW/image/png/689e8dfa6bee63ba728d9359e52290b5/main_1.png main_1.png png 57474 849 656 IMAGE-WEB-PDF 1 1-s2.0-S0926860X22001089-gr9.jpg https://s3-eu-west-1.amazonaws.com/prod-ucs-content-store-eu-west/content/pii:S0926860X22001089/gr9/DOWNSAMPLED/image/jpeg/7f8f9e4e4e5b70ac6e1ffd1eb4e4933d/gr9.jpg gr9 gr9.jpg jpg 58088 495 565 IMAGE-DOWNSAMPLED 1-s2.0-S0926860X22001089-gr10.jpg https://s3-eu-west-1.amazonaws.com/prod-ucs-content-store-eu-west/content/pii:S0926860X22001089/gr10/DOWNSAMPLED/image/jpeg/bc58e7990a9f3fdea9c3f3540cfaf8fa/gr10.jpg gr10 gr10.jpg jpg 29789 457 282 IMAGE-DOWNSAMPLED 1-s2.0-S0926860X22001089-gr8.jpg https://s3-eu-west-1.amazonaws.com/prod-ucs-content-store-eu-west/content/pii:S0926860X22001089/gr8/DOWNSAMPLED/image/jpeg/2bb0d5f2e495516d4adf51cc58374a32/gr8.jpg gr8 gr8.jpg jpg 20226 219 282 IMAGE-DOWNSAMPLED 1-s2.0-S0926860X22001089-gr7.jpg https://s3-eu-west-1.amazonaws.com/prod-ucs-content-store-eu-west/content/pii:S0926860X22001089/gr7/DOWNSAMPLED/image/jpeg/b8a73cc4da880d78c574ae64507775a6/gr7.jpg gr7 gr7.jpg jpg 42013 450 282 IMAGE-DOWNSAMPLED 1-s2.0-S0926860X22001089-gr2.jpg https://s3-eu-west-1.amazonaws.com/prod-ucs-content-store-eu-west/content/pii:S0926860X22001089/gr2/DOWNSAMPLED/image/jpeg/af81585c44f3513a2c85764851df1397/gr2.jpg gr2 gr2.jpg jpg 53669 699 282 IMAGE-DOWNSAMPLED 1-s2.0-S0926860X22001089-ga1.jpg https://s3-eu-west-1.amazonaws.com/prod-ucs-content-store-eu-west/content/pii:S0926860X22001089/ga1/DOWNSAMPLED/image/jpeg/7a7713fc6bdc96e1226b108c2e99a001/ga1.jpg ga1 true ga1.jpg jpg 23798 200 283 IMAGE-DOWNSAMPLED 1-s2.0-S0926860X22001089-gr1.jpg https://s3-eu-west-1.amazonaws.com/prod-ucs-content-store-eu-west/content/pii:S0926860X22001089/gr1/DOWNSAMPLED/image/jpeg/df1f78d84cd427069eba71c8cb042e98/gr1.jpg gr1 gr1.jpg jpg 33463 456 282 IMAGE-DOWNSAMPLED 1-s2.0-S0926860X22001089-gr6.jpg https://s3-eu-west-1.amazonaws.com/prod-ucs-content-store-eu-west/content/pii:S0926860X22001089/gr6/DOWNSAMPLED/image/jpeg/d06e96f2a35737c2e5d7509672fe9f49/gr6.jpg gr6 gr6.jpg jpg 26067 236 339 IMAGE-DOWNSAMPLED 1-s2.0-S0926860X22001089-gr5.jpg https://s3-eu-west-1.amazonaws.com/prod-ucs-content-store-eu-west/content/pii:S0926860X22001089/gr5/DOWNSAMPLED/image/jpeg/fb6c1b5289c47208dc7ec188b717014c/gr5.jpg gr5 gr5.jpg jpg 17761 230 282 IMAGE-DOWNSAMPLED 1-s2.0-S0926860X22001089-gr4.jpg https://s3-eu-west-1.amazonaws.com/prod-ucs-content-store-eu-west/content/pii:S0926860X22001089/gr4/DOWNSAMPLED/image/jpeg/986834343196377ce7e5680e46591081/gr4.jpg gr4 gr4.jpg jpg 29772 414 282 IMAGE-DOWNSAMPLED 1-s2.0-S0926860X22001089-gr3.jpg https://s3-eu-west-1.amazonaws.com/prod-ucs-content-store-eu-west/content/pii:S0926860X22001089/gr3/DOWNSAMPLED/image/jpeg/24a35ebf83043b3094bdc444ff0c6062/gr3.jpg gr3 gr3.jpg jpg 143536 569 565 IMAGE-DOWNSAMPLED 1-s2.0-S0926860X22001089-gr9.sml https://s3-eu-west-1.amazonaws.com/prod-ucs-content-store-eu-west/content/pii:S0926860X22001089/gr9/THUMBNAIL/image/gif/040f28b6297ea1c2db313fd4c3063cdf/gr9.sml gr9 gr9.sml sml 10110 164 187 IMAGE-THUMBNAIL 1-s2.0-S0926860X22001089-gr10.sml https://s3-eu-west-1.amazonaws.com/prod-ucs-content-store-eu-west/content/pii:S0926860X22001089/gr10/THUMBNAIL/image/gif/c3e4bb84c342bcd4d183597264176d4d/gr10.sml gr10 gr10.sml sml 4673 164 101 IMAGE-THUMBNAIL 1-s2.0-S0926860X22001089-gr8.sml https://s3-eu-west-1.amazonaws.com/prod-ucs-content-store-eu-west/content/pii:S0926860X22001089/gr8/THUMBNAIL/image/gif/61b2a3502075d826e63bfaad4fc4c2d1/gr8.sml gr8 gr8.sml sml 9444 164 211 IMAGE-THUMBNAIL 1-s2.0-S0926860X22001089-gr7.sml https://s3-eu-west-1.amazonaws.com/prod-ucs-content-store-eu-west/content/pii:S0926860X22001089/gr7/THUMBNAIL/image/gif/38cc22b3bc5ca6f61b0f48ef116d4b5e/gr7.sml gr7 gr7.sml sml 6858 164 103 IMAGE-THUMBNAIL 1-s2.0-S0926860X22001089-gr2.sml https://s3-eu-west-1.amazonaws.com/prod-ucs-content-store-eu-west/content/pii:S0926860X22001089/gr2/THUMBNAIL/image/gif/4001f698a151d1b42fff875d49eaa2fb/gr2.sml gr2 gr2.sml sml 5042 164 66 IMAGE-THUMBNAIL 1-s2.0-S0926860X22001089-ga1.sml https://s3-eu-west-1.amazonaws.com/prod-ucs-content-store-eu-west/content/pii:S0926860X22001089/ga1/THUMBNAIL/image/gif/734acc36a3b1a544f1d781aa3c0ee19d/ga1.sml ga1 true ga1.sml sml 16192 154 219 IMAGE-THUMBNAIL 1-s2.0-S0926860X22001089-gr1.sml https://s3-eu-west-1.amazonaws.com/prod-ucs-content-store-eu-west/content/pii:S0926860X22001089/gr1/THUMBNAIL/image/gif/197e9ef19cfe1324aab9b9cf56014af8/gr1.sml gr1 gr1.sml sml 5313 163 101 IMAGE-THUMBNAIL 1-s2.0-S0926860X22001089-gr6.sml https://s3-eu-west-1.amazonaws.com/prod-ucs-content-store-eu-west/content/pii:S0926860X22001089/gr6/THUMBNAIL/image/gif/8117870a3f7e27cb8d91ccbcbaffb8d4/gr6.sml gr6 gr6.sml sml 11193 152 219 IMAGE-THUMBNAIL 1-s2.0-S0926860X22001089-gr5.sml https://s3-eu-west-1.amazonaws.com/prod-ucs-content-store-eu-west/content/pii:S0926860X22001089/gr5/THUMBNAIL/image/gif/8aeccec467fbf482083b9210ae4fcd6b/gr5.sml gr5 gr5.sml sml 7709 164 201 IMAGE-THUMBNAIL 1-s2.0-S0926860X22001089-gr4.sml https://s3-eu-west-1.amazonaws.com/prod-ucs-content-store-eu-west/content/pii:S0926860X22001089/gr4/THUMBNAIL/image/gif/9b57daaa5da179fec4099f1a474f5ed2/gr4.sml gr4 gr4.sml sml 5419 163 111 IMAGE-THUMBNAIL 1-s2.0-S0926860X22001089-gr3.sml https://s3-eu-west-1.amazonaws.com/prod-ucs-content-store-eu-west/content/pii:S0926860X22001089/gr3/THUMBNAIL/image/gif/408ac364e1f2849b601931e6b8ad8300/gr3.sml gr3 gr3.sml sml 18242 164 163 IMAGE-THUMBNAIL 1-s2.0-S0926860X22001089-gr9_lrg.jpg https://s3-eu-west-1.amazonaws.com/prod-ucs-content-store-eu-west/content/pii:S0926860X22001089/gr9/HIGHRES/image/jpeg/b1e03b5a7832a3e893d5d1355c81ee4c/gr9_lrg.jpg gr9 gr9_lrg.jpg jpg 293837 2186 2495 IMAGE-HIGH-RES 1-s2.0-S0926860X22001089-gr10_lrg.jpg https://s3-eu-west-1.amazonaws.com/prod-ucs-content-store-eu-west/content/pii:S0926860X22001089/gr10/HIGHRES/image/jpeg/cdc615c1cf4c3dc3c83c2dc7b4e66ce0/gr10_lrg.jpg gr10 gr10_lrg.jpg jpg 193196 2023 1247 IMAGE-HIGH-RES 1-s2.0-S0926860X22001089-gr8_lrg.jpg https://s3-eu-west-1.amazonaws.com/prod-ucs-content-store-eu-west/content/pii:S0926860X22001089/gr8/HIGHRES/image/jpeg/3d564e6cc21915dba52e064485b7b48a/gr8_lrg.jpg gr8 gr8_lrg.jpg jpg 129192 968 1247 IMAGE-HIGH-RES 1-s2.0-S0926860X22001089-gr7_lrg.jpg https://s3-eu-west-1.amazonaws.com/prod-ucs-content-store-eu-west/content/pii:S0926860X22001089/gr7/HIGHRES/image/jpeg/35a506abb630bee8909cb8b7e5811974/gr7_lrg.jpg gr7 gr7_lrg.jpg jpg 302721 1988 1247 IMAGE-HIGH-RES 1-s2.0-S0926860X22001089-gr2_lrg.jpg https://s3-eu-west-1.amazonaws.com/prod-ucs-content-store-eu-west/content/pii:S0926860X22001089/gr2/HIGHRES/image/jpeg/8bcacb7c338bc4766162c06a512667c9/gr2_lrg.jpg gr2 gr2_lrg.jpg jpg 402073 3091 1247 IMAGE-HIGH-RES 1-s2.0-S0926860X22001089-ga1_lrg.jpg https://s3-eu-west-1.amazonaws.com/prod-ucs-content-store-eu-west/content/pii:S0926860X22001089/ga1/HIGHRES/image/jpeg/edd1a88c9c7683650cc1296968be8e52/ga1_lrg.jpg ga1 true ga1_lrg.jpg jpg 188667 886 1256 IMAGE-HIGH-RES 1-s2.0-S0926860X22001089-gr1_lrg.jpg https://s3-eu-west-1.amazonaws.com/prod-ucs-content-store-eu-west/content/pii:S0926860X22001089/gr1/HIGHRES/image/jpeg/d8428a4e78bca82d2640fcadbdad04dd/gr1_lrg.jpg gr1 gr1_lrg.jpg jpg 208038 2018 1247 IMAGE-HIGH-RES 1-s2.0-S0926860X22001089-gr6_lrg.jpg https://s3-eu-west-1.amazonaws.com/prod-ucs-content-store-eu-west/content/pii:S0926860X22001089/gr6/HIGHRES/image/jpeg/5e39a3f56e7737fcbb117101da0be4e9/gr6_lrg.jpg gr6 gr6_lrg.jpg jpg 162732 1040 1497 IMAGE-HIGH-RES 1-s2.0-S0926860X22001089-gr5_lrg.jpg https://s3-eu-west-1.amazonaws.com/prod-ucs-content-store-eu-west/content/pii:S0926860X22001089/gr5/HIGHRES/image/jpeg/ae6883ee2a36ee47aea361c34f3c8497/gr5_lrg.jpg gr5 gr5_lrg.jpg jpg 110416 1015 1247 IMAGE-HIGH-RES 1-s2.0-S0926860X22001089-gr4_lrg.jpg https://s3-eu-west-1.amazonaws.com/prod-ucs-content-store-eu-west/content/pii:S0926860X22001089/gr4/HIGHRES/image/jpeg/c3435597b2aa88bad9ecd3efb5dd1ee0/gr4_lrg.jpg gr4 gr4_lrg.jpg jpg 196502 1829 1247 IMAGE-HIGH-RES 1-s2.0-S0926860X22001089-gr3_lrg.jpg https://s3-eu-west-1.amazonaws.com/prod-ucs-content-store-eu-west/content/pii:S0926860X22001089/gr3/HIGHRES/image/jpeg/c9bd6f3f77f50f623f3d3aa65990ed8b/gr3_lrg.jpg gr3 gr3_lrg.jpg jpg 856427 2511 2495 IMAGE-HIGH-RES 1-s2.0-S0926860X22001089-mmc1.docx https://s3-eu-west-1.amazonaws.com/prod-ucs-content-store-eu-west/content/pii:S0926860X22001089/mmc1/MAIN/application/vnd.openxmlformats-officedocument.wordprocessingml.document/ec77caa3f006338737fccc099547d8ff/mmc1.docx mmc1 mmc1.docx docx 2887534 APPLICATION 1-s2.0-S0926860X22001089-si0001.svg https://s3-eu-west-1.amazonaws.com/prod-ucs-content-store-eu-west/content/pii:S0926860X22001089/STRIPIN/image/svg+xml/8a5fdde42e6456a672f5284845325a66/si0001.svg si0001 si0001.svg svg 1357 ALTIMG 1-s2.0-S0926860X22001089-si0002.svg https://s3-eu-west-1.amazonaws.com/prod-ucs-content-store-eu-west/content/pii:S0926860X22001089/STRIPIN/image/svg+xml/c66d85a39d3d546c1328a7803b9c0bc0/si0002.svg si0002 si0002.svg svg 4562 ALTIMG 1-s2.0-S0926860X22001089-si0003.svg https://s3-eu-west-1.amazonaws.com/prod-ucs-content-store-eu-west/content/pii:S0926860X22001089/STRIPIN/image/svg+xml/b25af19b298ec091bcc7d48e0b3452e8/si0003.svg si0003 si0003.svg svg 3318 ALTIMG 1-s2.0-S0926860X22001089-si0004.svg https://s3-eu-west-1.amazonaws.com/prod-ucs-content-store-eu-west/content/pii:S0926860X22001089/STRIPIN/image/svg+xml/d7d67cd764c735adab2e47192a8c3cbc/si0004.svg si0004 si0004.svg svg 3440 ALTIMG 1-s2.0-S0926860X22001089-si0005.svg https://s3-eu-west-1.amazonaws.com/prod-ucs-content-store-eu-west/content/pii:S0926860X22001089/STRIPIN/image/svg+xml/6fcbc7a892c24387632d3050f88560bf/si0005.svg si0005 si0005.svg svg 3286 ALTIMG 1-s2.0-S0926860X22001089-si0006.svg https://s3-eu-west-1.amazonaws.com/prod-ucs-content-store-eu-west/content/pii:S0926860X22001089/STRIPIN/image/svg+xml/9d0d05953e5f30f42bcefad792c62116/si0006.svg si0006 si0006.svg svg 2581 ALTIMG 1-s2.0-S0926860X22001089-am.pdf am am.pdf pdf 2626967 AAM-PDF https://s3-eu-west-1.amazonaws.com/prod-ucs-content-store-eu-west/content/egi:10SM6WFZD70/MAIN/application/pdf/e5e7b0c4c56d42fab713c31847415e34/am.pdf APCATA 118585 118585 S0926-860X(22)00108-9 10.1016/j.apcata.2022.118585 Elsevier B.V. Fig. 1 Pore size distribution curves of calcined (A) and (B) reduced (a) 10CuZn/SiO2, (b) 20CuZn/SiO2, (c) 30CuZn/SiO2 and (d) Cu/SiO2. Fig. 1 Fig. 2 XRD spectra of (A) calcined and (B) reduced catalysts: (a) 10CuZn/SiO2, (b) 20CuZn/SiO2, (c) 30CuZn/SiO2, (d) Cu/SiO2; (C) Details of inset square in (B). Fig. 2 Fig. 3 TEM patterns of reduced catalysts: (a) Cu/SiO2, (b) 30CuZn/SiO2, (c) 20CuZn/SiO2, (d) 10CuZn/SiO2, (e-1) (e-2) HRTEM images of (c), (f) HRTEM image of (d). Fig. 3 Fig. 4 (A) FTIR spectra of (a) calcined 10CuZn/SiO2, (b) calcined 20CuZn/SiO2, (c) calcined 30CuZn/SiO2, (d) calcined Cu/SiO2, (e) reduced 20CuZn/SiO2 and (f) SiO2; (B) I670/I800 curves with the mol ratio of Cu/Zn. Fig. 4 Fig. 5 H2-TPR patterns of calcined Cu/SiO2 and xCuZn/SiO2 catalysts. Fig. 5 Fig. 6 Zn 2p spectra of reduced xCuZn/SiO2 catalysts. Fig. 6 Fig. 7 Cu 2p spectra (A) and Cu LMM XAES spectra (B) of reduced (a) 10CuZn/SiO2, (b) 20CuZn/SiO2, (c) 30CuZn/SiO2 and (d) Cu/SiO2. Fig. 7 Fig. 8 CH3OH-TPD profiles of degassed catalysts. Fig. 8 Fig. 9 Schematic diagram of the influence of ZnO amount on the copper phyllosilicate catalysts. Fig. 9 Fig. 10 Evaluation results of reduced catalysts stability. Fig. 10 Table 1 Physical properties of the calcined and reduced Cu/SiO2 and xCuZn/SiO2 catalysts. Table 1 Catalysts SBET a (m2/g) Vp a (cm3/g) Dp a (nm) Cu loading b (wt%) Zn loading b (wt%) Cu/Zn mole ratio Cu/SiO2 432 0.74 6.4 – – – 30CuZn/SiO2 415 0.73 6.2 – – – 20CuZn/SiO2 389 0.70 6.4 – – – 10CuZn/SiO2 379 0.68 6.5 – – – Cu/SiO2-red 210 0.46 7.7 19.7 – – 30CuZn/SiO2-red 301 0.55 6.7 19.4 0.67 29.8 20CuZn/SiO2- red 305 0.57 6.8 18.7 1.01 19.2 10CuZn/SiO2- red 297 0.55 6.7 19.5 2.01 9.99 a Determined by nitrogen adsorption-desorption. b Determined by ICP-OES. Table 2 Surface Cu species analysis of reduced Cu/SiO2 and xCuZn/SiO2 catalysts. Table 2 Catalysts DCu a (%) Area of Cu 2p3/2 b (%) Area of Cu LMM b (%) XCutotal 0 b (%) Cu2+ Cu0 + Cu+ Cu+ Cu0 Cu/SiO2 24.0 33.5 66.5 46.5 53.5 35.6 30CuZn/SiO2 25.2 33.4 66.6 39.1 60.1 40.6 20CuZn/SiO2 17.0 16.7 83.3 29.3 70.7 58.9 10CuZn/SiO2 7.9 23.1 76.9 32.8 67.2 51.7 a Determined by H2-N2O titration. b Determined from XPS analysis. Table 3 Comparison of vapor-phase dehydrogenation of MeOH to MF over Cu/SiO2 and xCuZn/SiO2 catalysts. Table 3 Catalysts MeOH Conversion (%) Selectivity (%) MF Yield (%) MF CO CO2 Cu/SiO2 37.2 83.1 14.1 2.8 30.9 30CuZn/SiO2 40.1 85.5 11.9 2.6 34.3 20CuZn/SiO2 44.5 92.7 5.4 1.9 41.3 10CuZn/SiO2 42.3 87.6 10.2 2.2 37.1 10CuZn/SBA-15 [14] 31.1 88.1 10.5 1.4 27.4 Cu5MgO5 [15] 16.7 88.1 5.5 2.4 – Reaction conditions of this work and Ref. [14]: mcat = 0.3 g, T = 300 °C, PN2 = 0.2 MPa, LHSV = 7.9 h−1. Reaction conditions of Ref. [15]: mcat = 100 mg, T = 250 °C, VN2 = 30 mL/min, WHSV = 47.4 h−1. Efficient CuZn/SiO2 lamellar catalysts for methanol dehydrogenation: New insights into the role of zinc Yanhong Quan Conceptualization Formal analysis Investigation Writing – original draft a b Yuting Jin Data curation Methodology Writing – review & editing a b Na Wang Conceptualization Methodology a b Jinxian Zhao Writing – review & editing a b Jun Ren Supervision Project administration Writing – review & editing a b ⁎ a State Key Laboratory of Clean and Efficient Coal Utilization, Taiyuan University of Technology, Taiyuan 030024, China State Key Laboratory of Clean and Efficient Coal Utilization, Taiyuan University of Technology Taiyuan 030024 China State Key Laboratory of Clean and Efficient Coal Utilization, Taiyuan University of Technology, Taiyuan 030024, China b Key Laboratory of Coal Science and Technology (Taiyuan University of Technology), Ministry of Education, China Key Laboratory of Coal Science and Technology (Taiyuan University of Technology), Ministry of Education China Key Laboratory of Coal Science and Technology (Taiyuan University of Technology), Ministry of Education ⁎ Corresponding author at: State Key Laboratory of Clean and Efficient Coal Utilization, Taiyuan University of Technology, Taiyuan 030024, China. State Key Laboratory of Clean and Efficient Coal Utilization, Taiyuan University of Technology Taiyuan 030024 China CuZn/SiO2 lamellar catalysts are obtained through the introduction of zinc oxide with different amount to Cu/SiO2 prepared by the ammonia-evaporation method and investigated for the dehydrogenation of methanol to methyl formate. The 20CuZn/SiO2 catalyst showed the best catalytic activity with a methanol conversion of 44.5% and a selectivity to methyl formate of ~92.7% at 300 °C and 0.2 MPa. The reason for this excellent activity could be ascribed to the strong interaction between Cu and ZnO, which promoted the decomposition of the copper phyllosilicate precursor to release copper oxide and thereby achieved more active Cu0 species upon reduction on the catalyst surface. In addition, the agglomeration of Cu species was mainly responsible for the slight decline in the methanol conversion in ZnO modified Cu based catalysts for the methanol dehydrogenation reaction. Graphical Abstract ga1 Keywords Methanol Methyl formate (MF) Copper phyllosilicate xCuZn/SiO2 Zinc oxide 1 Introduction Methyl formate (MF) with aldehyde and ester groups can be widely used to synthesize numerous high value-added products, including more than 50 chemicals, such as formic acid, ethylene glycol and dimethyl carbonate [1]. In addition, MF is also used in the pharmaceutical, pesticide, leather, dye and rubber industries. The synthesis routes of MF mainly include the esterification of methanol and formic acid [2], liquid-phase methanol carbonylation [3], methanol dehydrogenation [4], oxidative dehydrogenation of methanol [5,6], the one-step syngas method [7] and carbon dioxide hydrogenation condensation with methanol [8]. From a global perspective, there is an urgent need for the cleaner production of chemical products because it is crucial for the implementation of sustainable development goals [9]. Therefore, the dehydrogenation of methanol to MF has attracted increasing attention as a result of its abundant raw materials and pollution-free products, which make this reaction a green conversion. As described in Eqs. (1) and (2), in the methanol dehydrogenation reaction, MF is produced as the main product, with the formation of carbon monoxide (CO) and H2 as the main by-products, as shown in Eq. (3) [10]: (1) CH3OH → CH2O + H2 (2) CH2O + CH3OH → HCOOCH3+ H2 (3) HCOOCH3→2CO+ H2 Noble metals (Ru, Rh, Pd and Pt) [11] and transition metals (Cu and Ni)[12] are active for the dehydrogenation of methanol. As shown in Eqs. (1)–(3), methanol dehydrogenation to MF involves in the cleavage of both OH and CH bonds, which is closely related to the adsorption configuration of the reaction intermediates of formaldehyde on the active sites [13]. Sun et al. [14] confirmed that formaldehyde is the primary product of methanol dehydrogenation by in situ Fourier transform infrared (FTIR) spectroscopy. Moreover, Iwasa [11] illustrated a distinction between Cu and other metals (Ru, Rh, Pd, Pt and Ni), where the adsorption configuration of Cu with only the O atom of formaldehyde bonded to the metal surface contributes to its desorption, whereas the configuration with the linkage of both C and O atoms on the surface of Pt or other metals favors its decomposition to CO and H2. In addition, compared with noble metals, Cu-based catalysts are widely used for the methanol dehydrogenation reaction in both industry and academia due to their low price and high methanol conversion [14,15]. It has been reported that the activity of Cu-based catalysts is greatly determined by the nature of the support. Cu catalysts supported on different carriers (e.g., SiO2 [16], ZnO [17], ZrO2 [18], Cr2O3 [19], MgO [10] and carbon [20]) have been extensively studied. Among these, Cu/SiO2 catalysts have shown the best catalytic performance in the dehydrogenation of methanol due to the weak alkaline properties of SiO2. Conversely, the supports with acid sites induce the dehydration of methanol to produce dimethyl ether, thereby deteriorating the MF selectivity [21]. For Cu/SiO2 catalysts, despite the question of the required Cu species remaining controversial, metallic Cu species are usually considered to be responsible for superior catalytic performance in MF formation [15,20,22]. Furthermore, it is conducive to the cleavage of the OH bond in methanol and the CH bond in the reaction intermediates of CH3O and H2COOCH3 formed from CH3O and HCHO [23]. Nevertheless, metallic copper nanoparticles are prone to aggregation and sintering due to their low Hütting temperature (~178 °C) and Tammann temperature (~405 °C), which consequently cause inactivation of the catalysts under operating temperatures higher than 300 °C, representing one of the major issues for Cu-based catalysts in thermodynamically unfavorable reactions [24,25]. The agglomeration of Cu/SiO2 catalysts is a prevalent and critical problem in various reactions, as recognized by many researchers [26]. To solve this problem, one of the most significant and effective approaches is to design several unique structures, including core-shell [27], core-sheath [28], nanotube [29], lamellar [30] and ordered mesoporous materials [31]. For instance, Yang et al. [27] prepared a core-shell structured Cu@SiO2 catalyst with excellent performance for CO2 hydrogenation to methanol, which was attributed to the confined effect of the silica shell. Furthermore, it is noteworthy that the lamellar structure was preferred due to the strong metal-oxide and metal-support interactions [28]. Recently, metal phyllosilicates, including those based on Ni [32], Co [33], Cu [29] and Fe [34], have received increasing attention for the dry reforming of methane, the selective hydrogenation of esters, the water-gas shift reaction and dimethyl ether steam or ethanol reforming. This is because they can be converted to silica supported metal (or metal oxide) catalysts with unique layered structure incorporated ions after reduction, composed of octahedral (metal coordinated to oxygen atoms or hydroxyl groups) and tetrahedral SiO4 sheets [35]. Fan et al. reported that nickel phyllosilicate with entrapped Ni nanoparticles showed excellent activity for the selective hydrogenation of guaiacol to 2-methoxycyclohexanol [36] and glycerol hydrogenolysis to 1,2-propanediol [37]. Liu [38] prepared a Ni phyllosilicate catalyst for CO2 methanation and achieved high anti-sintering properties and stability due to its strong metal-support interaction and good Ni dispersion. Similarly, Kawi et al. [39] used copper phyllosilicate as a water-gas shift catalyst and found that the phyllosilicate structure promoted the dispersion of small nanoparticles, which showed good activity and excellent resistance of coking. Significantly, it has been confirmed by numerous studies that metal phyllosilicate precursors provide the resulting catalysts with highly dispersed metallic nanoparticles with an outstanding confinement effect, thereby further promoting the performance. By contrast, ZnO is known to be a promising promoter for improving the activity of Cu catalysts in the dehydrogenation of methanol and is also deemed as an effective strategy for inhibiting Cu aggregation [12,40]. Zhao et al. [12] found that the activity of the hydrogenation of methyl acetate depended on the Cu/Zn ratio due to the interaction between the Cu and ZnO species, which inhibited the sintering of the Cu nanoparticles. ZnO additives can enhance the adsorption capacity [40] and provide more active sites [41,42] for the methanol decomposition reaction due to the presence of a high abundance of defect sites and lattice distortion on the Zn surface. Koitaya et al. [43] concluded that there exists a synergetic effect between the ZnO islands and the partially oxidized Cu substrate for the dehydrogenation of methanol. In our previous work, the promotion of ZnO for Cu/SBA-15 in the methanol dehydrogenation reaction was also confirmed [14]. Various methods, including deposition-precipitation (DP) [44,45], hydrothermal [46], selective adsorption of copper tetraammine [47] and ammonia evaporation hydrothermal (AEH) [37,48,49], have been developed for MF synthesis and have a significant effect on the structure and catalytic performance of Cu-based catalysts. For example, Cheng et al. [25] found that more 2:1 copper phyllosilicate formed when prepared from a simple co-precipitation method and more 1:1 copper phyllosilicate was detected in a Cu/SiO2 catalyst derived from urea hydrolysis DP. It was worth noting that 1:1 copper phyllosilicate with the Si/Cu ratio of about 1 was often known as chrysocolla [Cu2Si2O5(OH)2], while 2:1 copper phyllosilicate with the Si/Cu ratio of about 2 was also called Cu-talc. Nevertheless, copper phyllosilicates species existed in all catalysts, which further resulted in inferior catalytic performance in ester hydrogenation to ethanol over a Cu co-precipitation catalyst than a Cu-DP catalyst, mainly due to the small amount of active copper species on the surface after reduction. Recently, the AEH method has drawn more attention for the easy formation of copper phyllosilicate (Cu2SiO5(OH)2) with a lamellar structure and consequently resulted in excellent performance in many catalytic reactions. A Cu/SiO2 catalyst derived from a copper phyllosilicate precursor prepared with the AEH method exhibited superior catalytic performance compared with that from an impregnation method in the glycerol hydrogenolysis to 1,2-propanediol [37] and water-gas shift reactions [39]. Xu et al. [50] explored the influence of the temperature of the AEH method on the texture, composition and structure of Cu/SiO2 catalysts and catalytic performance in the hydrogenation of dimethyl oxalate to ethylene glycol. Louis [47] investigated the influence of several preparation parameters on the relative amount of the two supported CuII species, including grafted CuII ions and copper phyllosilicate, which revealed the formation mechanism of copper phyllosilicate. From the above studies, it can be inferred that the AEH method shows significant advantages in contributing to the formation of copper phyllosilicate with the lamellar structure, which promoted the exposure of more terminal –OH groups anchoring the active metal on the surface of silica, as well as possessing open two-dimensional channels that transfer heat and mass [11,15]. This provides a favorable strategy to improve the anti-agglomeration performance of silica-supported Cu catalysts. In this study, Cu/SiO2 and xCuZn/SiO2 lamellar catalysts are synthesized by the AEH method and their catalytic performance is examined by the gas-phase dehydrogenation of methanol to MF. The loading of ZnO is modulated and the influence of ZnO content on the support structure and Cu sites is investigated. Furthermore, special emphasis is given to the evolution of both copper phyllosilicate and copper active sites caused by the ZnO additives. The key factor in influencing the catalytic activity and stability is also revealed. 2 Experimental 2.1 Materials Zinc nitrate (Zn(NO3)2.6H2O), copper nitrate (Cu(NO3)2.3H2O) and ammonia aqueous solution (NH3·H2O) were purchased from Aladdin Chemistry Co., Ltd. (Shanghai, China). Silica sol was purchased from Qingdao Ocean Chemical Co., Ltd. (Qingdao, China) and used without further treatment. High-purity N2 (> 99.99%), Ar (> 99.99%) and H2 (> 99.99%) were provided by the Jining Xieli Special Gases Co., Ltd. (Shandong, China). 2.2 Preparation of catalysts The Cu/SiO2 catalysts with a Cu loading of 20 wt% were prepared by the AEH method as follows [47]. Cu(NO3)2.3 H2O (4.86 g) was dissolved in 30 mL of deionized water and 9.2 mL of the 28 wt% ammonia aqueous solution were slowly added until the copper ammonia complex was generated under vigorous stirring for 30 min. Then, 8 g of silica gel were added into the copper ammonia complex solution under stirring for an additional 4 h at room temperature. Consequently, the above solution was transferred to a water bath preheated at 80 °C to allow for the evaporation of ammonia and the decrease of pH from 11/12–6/7, followed by filtration and washing three to four times with deionized water. The resulting filter cake was dried for 12 h at 120 °C and then calcinated for 4 h at 450 °C in muffle oven, followed by reducing with a 30% H2/N2 flow for 4 h at 400 °C in a tube furnace. The ZnO-modified Cu/SiO2 catalysts were prepared by a wet impregnation approach. Specifically, the dry Cu/SiO2 precursors were immersed in a Zn(NO3)2 solution and then oscillated in an ultrasonic cleaner for 30 min. The obtained mixture was then transferred into a rotary evaporator and conducted at 80 °C to remove the water. The calcined catalyst was consequently achieved from drying for 12 h at 120 °C, followed by calcination for 4 h at 450 °C. The reduction method was then used and was the same as that for the Cu/SiO2 catalysts described above. The final sample was then denoted as xCuZn/SiO2 (x = 10, 20 or 30), in which x represented the mol ratio of Cu to Zn. 2.3 Characterization techniques The morphology of the samples was measured by transmission electron microscopy (TEM, JEOL, JEM-2100 F, Tokyo, Japan). Before the measurements, the samples were ultrasonically dispersed in ethanol and supported on a copper or molybdenum grid. The analysis of the crystal structure and phase composition of the catalysts was carried out by X-ray diffraction (XRD) on a Rigaku D/max 2500 diffraction with Cu-Kα radiation (λ = 1.54056 Å). The voltage and current of the measurements were operated at 40 kV and 100 mA, respectively, with a scanning rate of 8°/min in the 2θ range of 5–80°. The FTIR spectra of the samples were recorded on a Thermo fisher Nicolet iS5 spectrometer in the range of 400–4000 cm−1. 1 mg powder samples were finely dispersed in 100 mg KBr and then pressed into a thin wafer for tests. The N2 adsorption-desorption isotherms were determined at −196 °C on a micromeritics 3 H-2000PS2 instrument (BeiShiDe). Prior to the measurement, 120–150 mg samples were pretreated with He gas at for 3 h 200 °C. The Brunauer–Emmett–Teller surface areas were calculated from the adsorption branch at P/P0 = 0.04–0.32. The total pore volume was estimated from the amount of nitrogen adsorbed at P/P0 = 0.99. The surface Cu species of the reduced catalysts were detected by X-ray photoelectron spectroscopy (XPS) and Auger electron spectroscopy (XAES) using a Thermo ESCALAB 250 spectrometer with an Al-Kα X-ray source (hν = 1486.6 eV). The binding energies were calibrated by the binding energy of C 1 s at 284.5 eV. H2 temperature-programmed reduction (H2-TPR) was carried out on a Finsore-3010 apparatus (Zhejiang FINETEC). For H2-TPR, 50 mg of samples were pretreated in an Ar flow for 60 min at 200 °C before reduction in 5% H2/Ar (30 mL/min) from room temperature to 500 °C at a rate of 10 °C/min. A thermal conductivity detector was used to record the hydrogen consumption during the reduction. The copper dispersion and metallic copper surface area were measured by N2O titration on a XianQuan TP-5080 instrument. The sample was reduced at 400 °C in a 10 vol% H2/Ar gas mixture (30 mL/min) and cooled to 50 °C with Ar (30 mL/min). Subsequently, the reduced sample was exposed to 10 vol% N2O/Ar (30 mL/min) for 30 min, ensuring that all the surface Cu atoms were completely oxidized. The H2-TPR experiment was then carried out in a 10% H2/Ar (30 mL/min) gas mixture at a heating rate of 10 °C/min. The CH3OH temperature-programmed desorption (CH3OH-TPD) was carried out on a XianQuan TP-5080 instrument. The sample was first degassed at 200 °C under a helium flow (30 mL/min) for 1 h. After degassing, the temperature of the sample was maintained at 100 °C. CH3OH steam was then introduced to the sample cell (using He as a carrier gas) to allow the sample to adsorb CH3OH until saturation, followed by flushing with He to remove all physically adsorbed molecules. The temperature of the sample was raised until 900 °C at a rate of 10 °C/min. The methanol released from the sample was continuously monitored by with a thermal conductivity detector (TCD). The Cu and Zn contents in the catalysts were measured by inductively coupled plasma-optical omission spectroscopy (ICP-OES) on a Thermo iCAP6300 device. 2.4 Catalytic tests The catalytic properties of the Cu/SiO2 and xCuZn/SiO2 catalysts for the dehydrogenation of methanol were studied in a fixed-bed reactor under 0.2 MPa at 300 °C [14]. First, 0.3 g of catalyst were diluted with 3 g of quartz sand between plugs of quartz wool and preheated in a H2 flow at 400 °C for 4 h with N2 used as an equilibrium gas. Methanol was then injected at 3 mL h−1 through a Series Ⅲ pump, which was vaporized in the preheater and then fed into the reactor for catalytic dehydrogenation using N2 as a carrier gas (30 mL/min). After condensation in the condenser, the effluents (including methanol, MF, H2, CO2 and CO) were collected and then analyzed offline through a gas chromatograph (GC-920, Shanghai Haixin) with a TDX-01 column (500 mm × 8 mm) using thermal conductivity and with a PEG-20 M Polar capillary column using flame ionization detectors, respectively. The methanol conversion (CMeOH, %), MF selectivity (SMF, %), CO2 selectivity ( S CO 2 , %), CO selectivity (SCO, %) and MF yield (YMF, %) were calculated according to the following equations, respectively: (2) C MeOH = 2 ×n MF +n CO 2 +n CO n MeOH + 2 ×n MF +n CO 2 +n CO × 100 % (3) S MF = 2 ×n MF 2 ×n MF +n CO 2 + n CO × 100 % (4) S CO 2 = n CO 2 2 ×n MF +n CO 2 + n CO × 100 % (5) S CO = n CO 2 ×n MF +n CO 2 + n CO × 100 % (6) Y MF = C MeOH × S MF × 100 % In the above equations, nMeOH, nMF, nCO and nCO2 was the molar ratio of methanol, MF, CO and CO2 in exhaust gas, respectively. 3 Results and discussion 3.1 Characterization of catalysts 3.1.1 Physicochemical properties The physicochemical properties of the Cu/SiO2 and xCuZn/SiO2 catalysts are shown in Table 1. The Cu and Zn concentrations of the reduced catalysts were determined by ICP-OES. As shown in Table 1, the actual copper metal loadings are lower than the design value due to the loss of metallic ions in the washing process, whereas the values for ZnO are close to the theoretical values, which is consistent with the results in the literature [41]. The textural properties of the calcined and reduced Cu/SiO2 and xCuZn/SiO2 catalysts were investigated by nitrogen adsorption-desorption isothermal measurements and are displayed in Fig. S1. All the catalysts exhibit the same type-IV isotherm and an obvious H1 hysteresis loop in the P/P0 range of 0.4–1.0, indicating the existence of a mesoporous structure. This result suggests that the mesoporous structure is maintained in all samples, although the catalysts are modified by the addition of ZnO and even reduced by the hydrogen atmosphere. However, the distinction in the relative P/P0 rang of 0.4–0.6 of nitrogen adsorption isotherms between the reduced and the calcined catalysts were observed and the hysteresis loops of the reduced catalysts was smaller than the calcined ones, further confirming destroy of copper phyllosilicates structure upon reduction. Additionally, there were two peaks with pore size centered at 3.5 and 5.5 nm in the pore size distribution curves for both reduced and calcined catalysts, which were showed in Fig. 1. Nevertheless, the relative proportion of the first peak area to the second peak area in the reduced catalysts decreases obviously compared with the calcined catalyst accordingly. This result demonstrated that the pores with the size of pores of copper phyllosilicate, would be destroyed once the catalyst is reduced. Noticeably, numerous pores of ~3.5 nm still remain, suggesting the presence of a portion of copper phyllosilicate in the reduced catalysts [51]. The specific surface area and detailed pore parameters of the calcined catalysts are summarized in Table 1. Noticeably, the evident change is observed for the structure of catalysts with increasing ZnO loading and their surface areas decrease gradually as the molar ratio between Cu and Zn decreases from 30 to 10. The 10CuZn/SiO2 catalyst exhibits the smallest surface area of 379 m2/g, with a significant reduction compared with that of Cu/SiO2 (432 m2/g). The reason appears to be related to the collapse of porous copper phyllosilicate with the high specific surface area caused by the excessive amount of ZnO introduced [37]. 3.1.2 Crystalline phase and morphology The XRD patterns in Fig. 2 show the structures of the calcined and reduced Cu/SiO2 and xCuZn/SiO2 catalysts. Obviously, the weak and broad diffraction peak at 2θ of 22.5° could be assigned to the feature peak of amorphous SiO2 in all the calcined and reduced samples. Fig. 2(A) illustrated that the calcined samples displayed the weak peaks 2θ located at 30.8° and 35.0° except 10CuZn/SiO2, which were assigned to the copper phyllosilicate phase [Cu2SiO5(OH)2] (JCPDS card 27-0188) [47,51]. For all the calcined catalysts, the diffraction peaks centered at 2θ of 35.6°, 38.8°, 48.7°, 58.4°, 61.8° and 66.2° belonging to CuO phase were observed, which was consistent with the report that a part of copper phyllosilicate would start to decompose at 450 °C to form CuO [47]. The diffracting peaks for CuO increased with the addition of ZnO, indicating that ZnO promoted the decomposition of copper phyllosilicate and led to the formation of bulk CuO crystallites. Moreover, only the 10CuZn/SiO2 catalyst presents the very weak diffraction peaks at 2θ of 31.8°, 34.4°, 36.3°, 56.7°, 62.9° and 67.9° corresponding to ZnO phase (JCPDS card 75-1526), indicative of the formation of ZnO crystallites on the catalyst surface. In contrast, no diffraction peak belonging to ZnO is observed in the 20CuZn/SiO2 and 30CuZn/SiO2, revealing a high dispersion of ZnO on the catalyst surface. As shown in Fig. 2(B), all reduced catalysts show distinct diffraction peaks centered at 2θ of 43.3°, 50.4° and 74.2°, attributed to the (111), (200) and (220) planes of metallic Cu (JCPDS card 04–0836), respectively. The peak at 2θ of 36.4° corresponding to the Cu2O (111) plane (JCPDS card 05–0667) is observed in the four catalysts. Compared with XRD patterns of the calcined samples, the characteristic peaks assigning to the copper phyllosilicate phase and CuO species disappeared, while the characteristic peaks attributed to Cu2O and metallic Cu were observed clearly in the reduced samples, suggesting that CuO was reduced to metallic Cu species while copper phyllosilicate was reduced to Cu2O due to the presence of a strong interaction between the copper species and silica support. Similar behavior has been reported where only CuO was reduced to metallic Cu species and this was ascribed to the presence of copper phyllosilicate and the partial transformation of copper phyllosilicate to CuO in Cu/SiO2 catalysts after calcination [20,24]. In addition, significant difference exists in the intensity of the diffraction peaks of metallic Cu for the reduced Cu/SiO2 and xCuZn/SiO2 catalysts seen from Fig. 2(B). The diffraction peaks of metallic Cu first become weak and then strengthen along with ZnO additive loading. The 30CuZn/SiO2 catalyst possesses the weakest peak of metallic Cu, while 10CuZn/SiO2 shows the strongest one, indicating that the introduction of excessive ZnO is capable of leading to an increase in large copper particles, consistent with that of the copper dispersion obtained from the N2O titration tests [12]. The observation was probably attributed to that the presence of strong interaction between the ZnO and Cu in xCuZn/SiO2 catalysts with appropriate amount of ZnO, which promoted the decomposition of copper phyllosilicate to produce CuO in the calcination procedure and further caused the formation of metallic copper through reduction process [51]. For achieving detailed information of the reduced 10CuZn/SiO2, the XRD patterns of Fig. 2(B) in the range of 30–40° are amplified and shown in Fig. 2(C). It is notable that the peak at 36.4° is asymmetric in the 10CuZn/SiO2 catalyst and obviously different from the other three catalysts, which could be due to the overlaying of the two peaks assigned to Cu2O and ZnO (at ~36.1°) (JCPDS card 75–1526). Beyond this, the other two obvious peaks at 31.8° and 34.4° can be discriminated from the XRD patterns of the reduced 10CuZn/SiO2 catalyst, which further confirms the presence of ZnO species [51,52]. However, no diffraction peaks for ZnO are observed in the reduced 20CuZn/SiO2 and 30CuZn/SiO2 catalysts, which is likely due to the high dispersion and homogeneous distribution of the ZnO species generated at the relatively low loading. Fig. 3 shows the TEM images of the reduced Cu/SiO2 and xCuZn/SiO2 catalysts. Large amounts of thin nanotubes can be clearly observed from Fig. S2(a) and (b), suggesting the formation of copper phyllosilicates in calcined catalysts prepared by the AEH method [35,48]. As shown in Fig. 3, all the reduced catalysts clearly demonstrate that the typical filandrous morphology of copper phyllosilicate is destroyed to varying degrees upon reduction, whereas dark spherical particles attributable to Cu species emerged. It is noticeable that the particles become larger with the introduction of ZnO, indicating the important effect of ZnO additives on the size and dispersion of Cu particles on the surface of the reduced catalysts. More importantly, the reduced 20CuZn/SiO2 possesses less of a filandrous structure compared with the reduced Cu/SiO2. This phenomenon suggests that both the reduction of catalysts and the introduction of ZnO are responsible for the decomposition of copper phyllosilicates and thus the crystallinity of the lamella decreases [25]. Furthermore, only in the reduced 10CuZn/SiO2 catalyst does the 0.269 nm lattice fringe assigned to the ZnO (002) lattice plane emerge, in agreement with the XRD results [53,54]. It is deemed that an appropriate amount of ZnO can contribute to its high dispersion on the surface of xCuZn/SiO2 and further promote the dispersion of Cu species, while an excessive amount of ZnO covers the active Cu species, which was further confirmed by the elemental mappings of reduced 10CuZn/SiO2 in Fig. S3. Fig. 4 displays the FTIR spectra of the calcined catalysts with different ZnO amounts and reduced 20CuZn/SiO2. The adsorption band at 1630 cm−1 is assigned to the bending mode of the OH groups of the absorbed water. The adsorption band of the asymmetric stretching vibrations of the SiOSi bond in SiO2 is at 1100 cm−1, while the band for the symmetric stretching vibrations of Si-O-Si is at 800 cm−1 [29]. The formation of copper phyllosilicates is supported by the existence of the adsorption band at 670 cm−1, assigned to the δOH bands and the shoulder peak at frequency vibrational band of 1040 cm−1 [25,48]. Compared with pure SiO2 and reduced 20 CuZn/SiO2, all the calcined catalysts presented the characteristic peaks of copper phyllosilicates. Furthermore, the relative amount of copper phyllosilicates in the calcined catalysts can be estimated by considering the integrated intensity of the δOH bands at 670 cm−1 normalized to that at 800 cm−1, which is termed as I670/I800 [55,56]. It is noted that the I670/I800 ratio only gives a qualitative estimation of the amount of copper phyllosilicate in that the extinction coefficients of the corresponding FTIR bands are not known. Fig. 4(B) clearly illustrates that the relative amount of copper phyllosilicates presents a downward trend as the ZnO content increases, indicating that the addition of ZnO is able to cause damage to the structure of the copper phyllosilicates. Noticeably, the trend becomes more moderate as the ZnO amount continues to increase compared with the 20CuZn/SiO2 with 30CuZn/SiO2 catalysts, which can be explained by the presence of the stable T-O-T (2:1) copper phyllosilicates structure. As reported in the literature, two types of layered structure of both T-O (1:1) and T-O-T (2:1) copper phyllosilicates coexist in the as-prepared catalysts, of which 1:1 copper phyllosilicates are unstable and tend to decompose at high temperature [25,36]. However, the more reasonable explanation should be that the Cu species in T-O-T (2:1) copper phyllosilicates are too far apart to form a strong interaction between ZnO and Cu, thereby inhibiting the decomposition of the copper species. In addition, compared with the calcined 20CuZn/SiO2 catalysts, the disappearance of the δOH band at 670 cm−1 and the blue shift of νSiO shoulder peak from 1040 to 1049 cm−1 occurred in the FTIR spectra of reduced catalyst, indicating the destroy of the lamellar structure during the process of hydrogen reduction, which consistent with the results of previous studies. [25,51]. 3.1.3 Interaction between Cu and ZnO species Fig. 5 shows the H2-TPR profiles of the calcined xCuZn/SiO2 and Cu/SiO2 catalysts. The width of the reduction temperature peak of xCuZn/SiO2 gradually increases with increasing ZnO loading, with a nearly identical onset of 170 °C but varied terminating temperature shifts from 320° to 450°C, indicative of the variation in the amount of different copper species for the calcined samples. The Cu/SiO2 and 30CuZn/SiO2 catalysts display a reduction peak centered at around 170–340 °C, attributed to the collective contribution of the reduction of the well-dispersed CuO to Cu0 and the Cu-O-Si of the copper phyllosilicate to Cu+, since a further reduction of Cu+ to Cu0 requires a high temperature of > 600 °C [56]. Compared with Cu/SiO2, 30CuZn/SiO2 possessed less amount of copper phyllosilicate as verified by the FTIR results and more well-dispersed CuO, which should be responsible for the distinction in the shape and position of the H2-TPR profiles between them. For the 20CuZn/SiO2 and 10CuZn/SiO2 catalysts, the peak higher than 340 °C is assigned to the reduction of large CuO particles to metallic Cu, in which the amount of bulk CuO particles in the former is lower than that in the latter. It is noted that the variation of the copper dispersion deduced from the H2-TPR profiles is Cu/SiO2 ≈ 30CuZn/SiO2 > 20CuZn/SiO2 > 10CuZn/SiO2, which is highly consistent with that determined by N2O titration ( Table 2). Combined with the FTIR and TEM results, it is reasonable to conclude that the two copper species of well-dispersed CuO and copper phyllosilicate are present in the calcined Cu/SiO2 and 30CuZn/SiO2 catalysts, while bulk CuO as the third copper species is also in the 20CuZn/SiO2 and 10CuZn/SiO2 catalysts. In other words, the copper species in the calcined catalysts change greatly as a result of the different degrees of damage for the copper phyllosilicate structure with the formation of the interaction between Cu and ZnO with different ZnO loadings. Fig. 6 shows the XPS analysis for the Zn 2p region of the reduced xCuZn/SiO2 catalyst. The intensive photoelectron peaks observed can be deconvoluted into two peaks, with the lower binding energy at 1021.5–1021.7 eV assigned to ZnO species [52] and the higher binding energy at 1022.4–1022.6 eV attributed to the ZnO species strongly interacting with the Cu species [51]. The presence of the strong interaction between the ZnO and Cu species causes a weakening of the CuOSi bond in the copper phyllosilicates and further promotes its decomposition. It is noteworthy that the proportions of two types of ZnO species varied distinctly in all the xCuZn/SiO2 catalysts. With increasing Zn, the portion of Zn species at higher binding energies first increases and then decreases. It is reasonable to deduce that the introduction of ZnO at an appropriate amount can promote the strong interaction between ZnO and Cu species, while an excess amount of ZnO contributes to the appearance of larger particles due to the aggregation of more CuO nanoparticles generated from the decomposition of copper phyllosilicates[51]. These results are in accordance with the XRD and H2-TPR results. 3.1.4 Surface chemical states The Cu 2p XPS and XAES spectra of the reduced xCuZn/SiO2 catalysts are shown in Fig. 7(a) and 7(b), respectively. Typically, the peaks at 932.4 and 952.2 eV are assigned to the Cu 2p3/2 and Cu 2p1/2, respectively. According to previous reports, the Cu 2p3/2 binding energy of CuO is located at 933.5 eV, but the binding energy of highly dispersed Cu2+ interacting with silica is discovered at 934.9 eV [51,57]. Fig. 7(a) shows that in all reduced catalysts, copper existed in the oxidation state of Cu2+, as evidenced by the Cu 2p3/2 peak at 935.1 eV and the satellite peak at 943.7 eV. The occurrence of Cu2+ may be due to the inevitable partial oxidation of the sample during the test. In this work, the binding energy of Cu 2p1/2 located at 932.4 eV and Cu 2p3/2 located at 952.2 eV are assigned to Cu+ and/or Cu0. In the Cu LMM XAES spectra of the reduced catalysts (Fig. 7(b)), the asymmetry and broad peak is observed and deconvoluted into two symmetrical peaks centered at about 916.6 and 913.0 eV, corresponding to Cu0 and Cu+, respectively. [25] Compared with the Cu/SiO2 catalyst, the auger electron peak shifted to the lower kinetic energy of 916.3 and 911.5 eV, respectively, indicating that the formation of stronger interaction between copper and ZnO in xCuZn/SiO2 than that in Si-O-Cu with the introduction of zinc additives. [2] Moreover, the relative percentages of different copper species were calculated from the corresponding peak areas in the Cu 2p and Cu LMM spectra, with the results given in Table 2. Based on these deconvolution results, the concentration of Cu0 first increases with increasing Zn species and reaches a maximum of 58.9% when the molar ratio of Cu/Zn is 20 and then drops to 51.7% with a further increment in Zn loading. This result indicates that the Cu0 concentration on the surface is heavily dependent on the Zn content. As reported by Wang et al. [51], an appropriate amount of ZnO species can promote the concentration of Cu0 species on the catalyst surface due to the strong interaction between the Cu and ZnO species. As confirmed by the FTIR results, the additional Cu0 species generated in 20CuZn/SiO2 stem from the decomposition of the copper phyllosilicate induced by the stronger Cu-ZnO interaction with the increased ZnO loading. However, when the Cu/Zn mole ratio was 10 with Zn loading increasing, some copper phyllosilicate was sacrificed to produce more CuO during the calcination procedure and yet the surface specific area decreased, which probably caused the aggregation of these CuO particles to form in bulk on the catalyst surface, as confirmed by XRD results. The formed bulk CuO particles were more difficult to be reduced than well-dispersed CuO, which eventually resulted in decrease of catalytic activity. The result might be responsible for the poorer dispersion of copper species along with the lower concentration of metallic Cu in all Cu species in the 10CuZn/SiO2 catalyst than that in 20CuZn/SiO2. 3.1.5 CH3OH-TPD General agreement is achieved between the investigations concerning methanol adsorption via hydrogen bonding and decomposition on the well-defined metal surface, where a methoxy species, CH3O, is formed during dissociative adsorption and is decomposed near 100 °C to give formaldehyde and MF [58]. Moreover, Gabriela Díaz et al [59] verified that methanol desorption peaks are observed in all samples around 110 °C using on-line mass spectrometry. In addition, the H2 and CO originated at higher temperature about 200 °C respectively, from gradually dehydrogenation of methoxy and formate intermediate species [59,60]. Overbury et al. [61] reported methanol adsorption at room temperature led to different types of methoxy species, and some MF and possibly carbonate species are retained after high-temperature desorption by in situ FIIR and Raman spectroscopy as well as mass spectrometry. In our study, degassing and the subsequent adsorption of CH3OH steam in the CH3OH-TPD test for all the samples are carried out at 100 °C. The CH3OH-TPD profiles of the Cu/SiO2 and xCuZn/SiO2 catalysts are displayed in Fig. 8. Three desorption peaks are identified in all catalysts and the desorption temperatures are in the ranges of 45–170, 170–290 and 290–400 °C, corresponding to the physically-adsorbed methanol, the oxidative products (e.g. CO2 and H2O)[23,63]; as well as stronger chemisorbed species (formaldehyde and MF) [62,63] or decomposition product (H2 and CO) [59,60], respectively. It can be seen that the peak area and position of desorption varied greatly. The area and position of desorption peaks varied greatly, which was assumed to be seriously related to the active species on the catalyst surface [41], induced by the interaction between the ZnO and Cu species. For the first peak at ~100 °C, all the catalysts exhibit a similar shape and position. Nevertheless, the second peak (~210 °C) corresponding to oxides, CO2 and H2O, is clearly distinct when the ratio of Cu to Zn decreases from 30 to 10 and the area of that in the 20CuZn/SiO2 catalyst is the lowest, suggesting that the risk of further decomposition of MF is smaller than the others. 3.2 Dehydrogenation of methanol to MF 3.2.1 Catalytic performance The catalytic performance of the Cu/SiO2 and xCuZn/SiO2 catalysts for the dehydrogenation of methanol to MF is shown in Table 3. The Cu/SiO2 shows a relatively low CMeOH of 37.2%, an SMF of 83.1% and a YMF of 30.9%. With increasing ZnO loading, the catalytic activity of the catalyst showed a volcano-type catalytic behavior in terms of CMeOH, SMF and YMF. Among all the catalysts, 20CuZn/SiO2 exhibits the highest activity with an excellent CMeOH of 44.5%, an SMF of 92.7% and a YMF of 41.3%, which are significantly superior to those reported in the literature. Thus, this result indicates that moderately tuning the ZnO loading on the surface of Cu/SiO2 and the interaction between Cu and ZnO species could be of importance for optimizing the catalytic performance. It is well known that Cu0 plays a dominant role in the dehydrogenation of methanol to MF. Cu0 sites enable the cleavage of the OH bond in methanol to give CH3O, followed by HCHO by breaking a CH bond, whereas Cu+ sites cause the rapid decomposition of HCHO into CO and H2 [23]. In a previous study, we also investigated the effect of Cu0 contents on the catalytic activity of Cu-based catalysts and found that the concentration of Cu0 presents a volcanic curve with increasing ZnO loading. The CMeOH and SMF also present a similar trend. A schematic diagram showing the influence of the ZnO amount on the copper phyllosilicate catalysts is presented in Fig. 9. Specifically, the presence of the interaction between Cu and ZnO upon introducing the ZnO promoter into the Cu/SiO2 catalyst weakens the CuOSi bond of copper phyllosilicates and thus causes its decomposition, as confirmed by the H2-TPR and FTIR results. The copper phyllosilicates tend to generate well dispersed CuO on the catalyst surface in the calcination process and a higher ratio of Cu0 species in the reduced xCuZn/SiO2 was achieved and detected than that in Cu/SiO2 by the XPS results. As revealed by Helveg [64], copper nanoparticles on a silica support formed during the reduction of homogeneous copper phyllosilicate platelets by H2, mainly because the plate-like structure of the precursor restricted the diffusion of copper and the autocatalytic reduction limited the probability for secondary nucleation. Furthermore, the influence of the incorporated Zn amount on the catalyst structure should be sufficiently considered. An excessive amount of ZnO causes the collapse of most copper phyllosilicates and further induces a decrease in the specific surface area, which may be responsible for the formation of the large particles and the sharp decline in Cu dispersion from 17.0% to 7.9%, as identified by TEM and N2O titration. Considering the presence of ZnO was also verified by the XRD and TEM results of 10CuZn/SiO2, another plausible explanation was that the Cu species in the 2:1 copper phyllosilicates were too far apart to interact with the introduced ZnO and thus large ZnO particles formed, accompanied with a small amount of CuO released from the residual 1:1 copper phyllosilicates aggregated due to the decreasing specific surface area. which resulted in a decrease of Cu0 concentration from 58.9% in 20CuZn/SiO2 to 51.7% in 10CuZn/SiO2. Therefore, copper phyllosilicates were decomposed with the ZnO loading through the enhanced interaction between ZnO and Cu, which is ultimately conducive to tuning the concentration of Cu0 and the amount of the stable type of lamellar structure. In other words, more Cu0 species were formed at the expense of copper phyllosilicates. Moreover, the ZnO amount is important to the adsorption of CH3OH on active Cu species, as revealed by the CH3OH-TPD results, where the 20CuZn/SiO2 catalyst displays a larger area for the third peak compared to the other catalysts. This indicates that an appropriate amount of ZnO is beneficial to the formation of MF or other carbon oxides [65]. Notably, the highest Cu0 concentration is observed in the 20CuZn/SiO2 catalyst, which displays the best catalytic performance. 3.2.2 Stability of catalysts Fig. 10 shows the stability test at 300 °C used to estimate the stability of the Cu/SiO2 and 20CuZn/SiO2 catalysts. The 20CuZn/SiO2 catalyst shows satisfactory catalytic performance and is stable up to 60 h, especially for the selectivity to MF, maintaining 94% of initial performance over the course. Conversely, the activity of the Cu/SiO2 catalyst drops sharply within only 20 h and declined by ~26% under identical reaction conditions. Therefore, it may be inferred that the addition of ZnO can help to improve the performance and stability of the catalyst. The reason for the inactivation of the 20CuZn/SiO2 catalyst is discussed below. Firstly, no obvious variation in the content of Cu0 species is detected after the stability test (Table S1), as proved by the Cu 2p XPS and Cu LMM XAES spectra of the used catalysts (Fig. S4), indicating that Cu0 can be maintained after the dehydrogenation reaction and the catalysts are not oxidized during the catalyst test [46]. However, it was seen from the Fig. S5 that the spent 20CuZn/SiO2 catalyst presented the hysteresis loop of type H1 in the P/P0 range of 0.7–1.0, significantly smaller than the reduced one, implying that the most of mesoporous structure was reserved and yet the amount of mesoporous of catalyst showed an obvious decrease during the reaction process. This was consistent with pore size distribution curves. Moreover, the visible change of textural properties was observed in 20CuZn/SiO2 and Cu/SiO2 during reaction and particularly the surface areas decrease from the reduced catalyst of 305 and 210 m2/g to the spent one of 68 and 43 m2/g, respectively (Table S1). Furthermore, the pore distribution of 3 nm belonging to the interlayer pores of copper phyllosilicate entirely disappears in the spent catalyst, indicating that the lamellar structure collapses. Furthermore, TEM and XRD confirmed that the particle size on the catalyst surface obviously grows (Figs. S3 and S4), which means the occurrence of agglomeration for Cu species during the reaction. The main peaks at 20.7º and 26.4º belonging to SiO2 are observed due to the quartz wool plugging the catalyst. Notably, a greater increase for the average size of the particles is observed in Cu/SiO2 than that in the 20CuZn/SiO2 catalyst after long-term testing, indicating that 20CuZn/SiO2 is relatively resistant to agglomeration due to the introduction of ZnO species. According to the literature, the deactivation and low stability of Cu-based nanoparticles is predominantly ascribed to the loss of active species caused by sintering [26] and carbon deposition [51] and Combined with the above results, it is speculated that the decline in the catalytic performance of the 20CuZn/SiO2 and Cu/SiO2 catalysts results from the agglomeration of Cu species during the reaction, which is ascribed to the decreased specific area due to the collapse of the lamellar structure. More importantly, the appropriate addition of ZnO is favorable in suppressing the agglomeration of copper crystallites in Cu-based catalysts effectively, thereby consequently extending their lifetimes [25]. 4 Conclusion A series of Cu/SiO2 and xCuZn/SiO2 (x = 10, 20 or 30) catalysts were prepared by the AEH method for the dehydrogenation of methanol to MF. It was found that the xCuZn/SiO2 catalysts exhibited superior activity than Cu/SiO2 and the ZnO amount has a dramatic effect on the catalytic activity and stability in methanol dehydrogenation. The introduction of ZnO can promote the decomposition of copper phyllosilicates by enhancing the interaction between ZnO and Cu, which is ultimately conducive to adjusting the concentration of Cu0 and the amount of the stable type of copper phyllosilicate. In all cases, 20CuZn/SiO2 showed the best catalytic performance with an excellent CMeOH of 44.5%, SMF of 92.7% and YMF of 41.3% at 300 °C, which could be predominantly associated with the highest Cu0 concentration. In addition, the results demonstrated that a higher Cu0 ratio can be achieved by sacrificing copper phyllosilicate by adjusting the ZnO amount in the xCuZn/SiO2 catalysts. CRediT authorship contribution statement Yanhong Quan: Conceptualization, Formal analysis, Investigation, Writing – original draft. Yuting Jin: Data curation, Methodology, Writing – review & editing. Na Wang: Conceptualization, Methodology. Jinxian Zhao: Writing – review & editing. Jun Ren: Supervision, Project administration, Writing – review & editing. Declaration of Competing Interest The authors declare that they have no known competing financial interests or personal relationships that could have appeared to influence the work reported in this paper. Acknowledgments This work was supported by a grant from the National Science Foundation of China (22108191, 22179091) and the Natural Science Foundation of Shanxi Province of China (201901D211055). Appendix A Supplementary material Supplementary data associated with this article can be found in the online version at doi:10.1016/j.apcata.2022.118585. Appendix A Supplementary material Supplementary material . References [1] L. Rong Z. Xu J. Sun J. Energy Chem. 27 2018 238 242 Rong, L.; Xu, Z.; Sun, J., et al., New methyl formate synthesis method: coal to methyl formate. J. Energy. Chem. 27 (2018) 238–242. [2] B. Indu W.R. Ernst L.T. Gelbaum Ind. Eng. Chem. Res. 32 1993 981 985 Indu, B.; Ernst, W.R.; Gelbaum, L.T., Methanol-formic acid esterification equilibrium in sulfuric acid solutions: influence of sodium salts. Ind. Eng. Chem. Res. 32 (1993) 981–985. [3] J. Liu Z. Ran Q. Cao Chin. J. Catal. 42 2021 2254 2264 Liu, J.; Ran, Z.; Cao, Q., et al., Preparation of MIL-88B(Fex,Co1−x) catalysts and their application in one-step liquid-phase methanol oxidation to methyl formate using H2O2. Chinese. J. Catal. 42 (2021) 2254–2264. [4] X. Wang W.-K. Chen C.-H. Lu Appl. Surf. Sci. 254 2008 4421 4431 Wang, X.; Chen, W.-K.; Lu, C.-H., A periodic density functional theory study of the dehydrogenation of methanol over CuCl(111) surface. Appl. Surf. Sci. 254 (2008) 4421–4431. [5] H. Liu E. Iglesia J. Phys. Chem. B 109 2005 2155 2163 Liu, H.; Iglesia, E., Selective oxidation of methanol and ethanol on supported ruthenium oxide clusters at low temperatures. J. Phys. Chem. B 109 (2005) 2155–2163. [6] W. Li H. Liu E. Iglesia J. Phys. Chem. B 110 2006 23337 23342 Li, W.; Liu, H.; Iglesia, E., Structures and properties of zirconia-supported ruthenium oxide catalysts for the selective oxidation of methanol to methyl formate. J. Phys. Chem. B 110 (2006) 23337–23342. [7] H. Zhao K. Fang F. Dong J. Ind. Eng. Chem. 54 2007 117 125 10.1016/j.jiec.2017.05.024 Zhao, H.; Fang, K.; Dong, F., et al., Textual properties of Cu–Mn mixed oxides and application for methyl formate synthesis from syngas. J. Ind. Eng. Chem. 54 (2007) 117–125. (http://dx.doi.org/10.1016/j.jiec.2017.05.024) [8] N. Westhues M. Belleflamme J. Klankermayer ChemCatChem 11 2019 5269 5274 Westhues, N.; Belleflamme, M.; Klankermayer, J., Base-free hydrogenation of carbon dioxide to methyl formate with a molecular ruthenium-phosphine catalyst. ChemCatChem. 11 (2019) 5269–5274. [9] M. Ikram M. Ferasso R. Sroufe J. Clean. Prod. 322 2021 129090 Ikram, M.; Ferasso, M.; Sroufe, R., et al., Assessing green technology indicators for cleaner production and sustainable investments in a developing country context. J. Clean. Prod. 322 (2021) 129090. [10] Z. Lu D. Gao H. Yin J. Ind. Eng. Chem. 31 2015 301 308 Lu, Z.; Gao, D.; Yin, H., et al., Methanol dehydrogenation to methyl formate catalyzed by SiO2-, hydroxyapatite-, and MgO-supported copper catalysts and reaction kinetics. J. Ind. Eng. Chem. 31 (2015) 301–308. [11] N. Iwasa N. Takezawa Top. Catal. 22 2003 215 224 Iwasa, N.; Takezawa, N., New supported Pd and Pt alloy catalysts for steam reforming and dehydrogenation of methanol. Top. Catal. 22 (2003) 215–224. [12] Y. Zhao B. Shan Y. Wang Ind. Eng. Chem. Res. 57 2018 4526 4534 Zhao, Y.; Shan, B.; Wang, Y., et al., An effective CuZn–SiO2 bimetallic catalyst prepared by hydrolysis precipitation method for the hydrogenation of methyl acetate to ethanol. Ind. Eng. Chem. Res. 57 (2018) 4526–4534. [13] M. Zhang X. Wu Y. Yu Appl. Surf. Sci. 436 2018 268 276 Zhang, M.; Wu, X.; Yu, Y., A comparative DFT study on the dehydrogenation of methanol on Rh(100) and Rh(110). Appl. Surf. Sci. 436 (2018) 268–276. [14] N. Wang Y. Quan J. Zhao Mol. Catal. 505 2021 111514 Wang, N.; Quan, Y.; Zhao, J., et al., Highly active CuZn/SBA-15 catalyst for methanol dehydrogenation to methyl formate: Influence of ZnO promoter. Mol. Catal. 505 (2021) 111514. [15] D.-J. Yuan A.M. Hengne Y. Saih ACS Omega 4 2019 1854 1860 Yuan, D.-J.; Hengne, A.M.; Saih, Y., et al., Nonoxidative dehydrogenation of methanol to methyl formate through highly stable and reusable CuMgO-based catalysts. ACS. Omega. 4 (2019) 1854–1860. [16] M.G. John K.M. Tibbetts Appl. Surf. Sci. 510 2020 145037 John, M.G.; Tibbetts, K.M., Controlling the morphology of copper-silica nanocomposites from laser ablation in liquid. Appl. Surf. Sci. 510 (2020) 145037. [17] G. Wang D. Mao X. Guo Appl. Surf. Sci. 456 2018 403 409 Wang, G.; Mao, D.; Guo, X., et al., Enhanced performance of the CuO-ZnO-ZrO2 catalyst for CO2 hydrogenation to methanol by WO3 modification. Appl. Surf. Sci. 456 (2018) 403–409. [18] Y. Shao T. Wang K. Sun Green Energy Environ. 6 2021 557 566 Shao, Y.; Wang, T.; Sun, K., et al., Competition between acidic sites and hydrogenation sites in Cu/ZrO2 catalysts with different crystal phases for conversion of biomass-derived organics. Green. Energy. Environ. 6 (2021) 557–566. [19] E.H. Shreiber G.W. Roberts Appl. Catal. B Environ. 26 2002 119 129 Shreiber, E.H.; Roberts, G.W., Methanol dehydrogenation in a slurry reactor: evaluation of copper chromite and iron/titanium catalysts. Appl. Catal. B Environ. 26 (2002) 119–129. [20] E.V. Shelepova A.A. Vedyagin L.Y. Ilina Appl. Surf. Sci. 409 2017 291 295 Shelepova, E.V.; Vedyagin, A.A.; Ilina, L.Y., et al., Synthesis of carbon-supported copper catalyst and its catalytic performance in methanol dehydrogenation. Appl. Surf. Sci. 409 (2017) 291–295. [21] D. Gao H. Yin Y. Feng Can. J. Chem. Eng. 93 2015 1107 1118 Gao, D.; Yin, H.; Feng, Y., et al., Coupling reaction between methanol dehydrogenation and maleic anhydride hydrogenation over zeolite-supported copper catalysts. Can. J. Chem. Eng. 93 (2015) 1107–1118. [22] D. Kaiser L. Beckmann J. Walter Catalysts 11 2021 869 Kaiser, D.; Beckmann, L.; Walter, J., et al., Conversion of green methanol to methyl formate. Catalysts. 11 (2021) 869. [23] H. Yang Y. Chen X. Cui Angew. Chem. Int. Ed. 57 2018 1836 1840 Yang, H.; Chen, Y.; Cui, X., et al., A highly stable copper-based catalyst for clarifying the catalytic roles of Cu0 and Cu+ Species in methanol dehydrogenation. Angew. Chem. Int. Edit. 57 (2018) 1836–1840. [24] A. Vedyagin Y. Kotolevich P. Tsyrul’nikov Int. J. Nanotechnol. 13 2016 185 199 Vedyagin, A.; Kotolevich, Y.; Tsyrul'nikov, P., et al., Methanol dehydrogenation over Cu/SiO2 catalysts. Int. J. Nanotechnol. 13 (2016) 185–199. [25] W. Di J. Cheng S. Tian Appl. Catal. A Gen. 510 2016 244 259 Di, W.; Cheng, J.; Tian, S., et al., Synthesis and characterization of supported copper phyllosilicate catalysts for acetic ester hydrogenation to ethanol. Appl. Catal. A Gen. 510 (2016) 244–259. [26] S. Hu W.-X. Li Science 2021 eabi9828 10.1126/science.abi9828 Hu, S.; Li, W.-X., Sabatier principle of metal-support interaction for design of ultrastable metal nanocatalysts. Science. (2021), eabi9828. (doi: 10.1126/science.abi9828 (2021).) [27] H. Yang P. Gao C. Zhang Catal. Commun. 84 2016 56 60 Yang, H.; Gao, P.; Zhang, C., et al., Core–shell structured Cu@m-SiO2 and Cu/ZnO@m-SiO2 catalysts for methanol synthesis from CO2 hydrogenation. Catal. Commun. 84 (2016) 56–60. [28] H. Yue Y. Zhao S. Zhao Nat. Commun. 4 2013 2339 Yue, H.; Zhao, Y.; Zhao, S., et al., A copper-phyllosilicate core-sheath nanoreactor for carbon-oxygen hydrogenolysis reactions. Nat. Commun. 4 (2013) 2339. [29] X. Gong M. Wang H. Fang Chem. Commun. 53 2017 6933 6936 Gong, X.; Wang, M.; Fang, H., et al., Copper nanoparticles socketed in situ into copper phyllosilicate nanotubes with enhanced performance for chemoselective hydrogenation of esters. Chem. Commun. 53 (2017) 6933–6936. [30] H. Wan W. Ma K. Zhou Green Energy Environ. 2021 10.1016/j.gee.2021.04.001 Wan, H.; Ma, W.; Zhou, K., et al., Advanced silicon nanostructures derived from natural silicate minerals for energy storage and conversion. Green. Energy. Environ. (2021), doi.org/10.1016/j.gee.2021.04.001. [31] J. Ren P. Hao W. Sun Chem. Eng. J. 328 2017 673 682 Ren, J.; Hao, P.; Sun, W., et al., Ordered mesoporous silica-carbon-supported copper catalyst as an efficient and stable catalyst for catalytic oxidative carbonylation. Chem. Eng. J. 328 (2017) 673–682. [32] Y. Lu D. Guo Y. Zhao Microporous Mesoporous Mater. 313 2021 110842 Lu, Y.; Guo, D.; Zhao, Y., et al., Confined high dispersion of Ni nanoparticles derived from nickel phyllosilicate structure in silicalite-2 shell for dry reforming of methane with enhanced performance. Micropor. Mesopor. Mat. 313 (2021) 110842. [33] R. Trujillano J.-F. Lambert C. Louis J. Phys. Chem. C 112 2008 18551 18558 Trujillano, R.; Lambert, J.-F.; Louis, C., Chemistry of silica-supported cobalt catalysts prepared by cation adsorption. 2. neoformation of cobalt phyllosilicate. J. Phys. Chem. C 112 (2008) 18551–18558. [34] J.-H. Lee J.K. Fredrickson R.K. Kukkadapu Environ. Sci. Technol. 46 2012 3721 3730 Lee, J.-H.; Fredrickson, J.K.; Kukkadapu, R.K., et al., Microbial reductive transformation of phyllosilicate Fe(III) and U(VI) in fluvial subsurface sediments. Environ. Sci. Technol. 46 (2012) 3721–3730. [35] Z. Bian S. Kawi Catal. Today 339 2020 3 23 Bian, Z.; Kawi, S., Preparation, characterization and catalytic application of phyllosilicate: A review. Catal. Today. 339 (2020) 3–23. [36] X. Wang S. Zhu S. Wang Appl. Catal. A Gen. 568 2018 231 241 Wang, X.; Zhu, S.; Wang, S., et al., Ni nanoparticles entrapped in nickel phyllosilicate for selective hydrogenation of guaiacol to 2-methoxycyclohexanol. Appl. Catal. A Gen. 568 (2018) 231–241. [37] S. Zhu X. Gao Y. Zhu Catal. Sci. Technol. 5 2015 1169 1180 Zhu, S.; Gao, X.; Zhu, Y., et al., A highly efficient and robust Cu/SiO2 catalyst prepared by the ammonia evaporation hydrothermal method for glycerol hydrogenolysis to 1,2-propanediol. Catal. Sci. Technol. 5 (2015) 1169–1180. [38] Y. Chen T. Zhang Q. Liu Int. J. Hydrog. Energy 46 2021 30373 30381 Chen, Y.; Zhang, T.; Liu, Q., One-pot or two-pot synthesis? Using a more facile and efficient method to synthesize Ni-phyllosilicate catalyst derived from 3D-SBA-15. Int. J. Hydrogen. Energ. 46 (2021) 30373–30381. [39] Z. Bian W. Zhong Y. Yu Int. J. Hydrog. Energy 45 2020 27078 27088 Bian, Z.; Zhong, W.; Yu, Y., et al., Cu/SiO2 derived from copper phyllosilicate for low-temperature water-gas shift reaction: Role of Cu+ sites. Int. J. Hydrogen. Energ. 45 (2020) 27078–27088. [40] Z. Wang W. Wang G. Lu Int. J. Hydrog. Energy 28 2003 151 158 Wang, Z.; Wang, W.; Lu, G., Studies on the active species and on dispersion of Cu in Cu/SiO2 and Cu/Zn/SiO2 for hydrogen production via methanol partial oxidation. Int. J. Hydrogen. Energ. 28 (2003) 151–158. [41] L. Jin Y. Wang Phys. Chem. Chem. Phys. 19 2017 12992 13001 Jin, L.; Wang, Y., Surface chemistry of methanol on different ZnO surfaces studied by vibrational spectroscopy. Phys. Chem. Chem. Phys. 19 (2017) 12992–13001. [42] E. Huang I. Orozco P.J. Ramirez J. Am. Chem. Soc. 2021 10.1021/jacs.1c08063 Huang, E.; Orozco, I.; Ramirez, P.J., et al., Selective methane oxidation to methanol on ZnO/Cu2O/Cu(111) catalysts: Multiple site-dependent behaviors. J. Am. Chem. Soc. (2021) (doi.org/10.1021/jacs.1c08063). [43] T. Koitaya Y. Shiozawa Y. Yoshikura Surf. Sci. 663 2017 1 10 Koitaya, T.; Shiozawa, Y.; Yoshikura, Y., et al., Electronic states and growth modes of Zn atoms deposited on Cu(111) studied by XPS, UPS and DFT. Surf. Sci. 663 (2017) 1–10. [44] J. Ding T. Popa J. Tang Appl. Catal. B Environ. 209 2017 530 542 Ding, J.; Popa, T.; Tang, J., et al., Highly selective and stable Cu/SiO2 catalysts prepared with a green method for hydrogenation of diethyl oxalate into ethylene glycol. Appl. Catal. B Environ. 209 (2017) 530–542. [45] T. Popa Y. Zhang E. Jin Appl. Catal. A Gen. 505 2015 52 61 Popa, T.; Zhang, Y.; Jin, E., et al., An environmentally benign and low-cost approach to synthesis of thermally stable industrial catalyst Cu/SiO2 for the hydrogenation of dimethyl oxalate to ethylene glycol. Appl. Catal. A Gen. 505 (2015) 52–61. [46] T. Wu Q. Zhang W. Cai Appl. Catal. A Gen. 503 2015 94 102 Wu, T.; Zhang, Q.; Cai, W., et al., Phyllosilicate evolved hierarchical Ni- and Cu–Ni/SiO2 nanocomposites for methane dry reforming catalysis. Appl. Catal. A Gen. 503 (2015) 94–102. [47] T. Toupance M. Kermarec J.-F. Lambert J. Phys. Chem. B 106 2002 2277 2286 Toupance, T.; Kermarec, M.; Lambert, J.-F., et al., Conditions of formation of copper phyllosilicates in silica-supported copper catalysts prepared by selective adsorption. J. Phys. Chem. B 106 (2002) 2277–2286. [48] H. Li Y. Cui Y. Liu J. Mater. Sci. Technol. 47 2020 29 37 Li, H.; Cui, Y.; Liu, Y., et al., Highly efficient Ag-modified copper phyllosilicate nanotube: Preparation by co-ammonia evaporation hydrothermal method and application in the selective hydrogenation of carbonate. J. Mater. Sci. Technol. 47 (2020) 29–37. [49] J. Gong H. Yue Y. Zhao J. Am. Chem. Soc. 134 2012 13922 13925 Gong, J.; Yue, H.; Zhao, Y., et al., Synthesis of ethanol via syngas on Cu/SiO2 catalysts with balanced Cu0-Cu+ sites. J. Am. Chem. Soc. 134 (2012) 13922–13925. [50] L. Chen P. Guo M. Qiao J. Catal. 257 2008 172 180 Chen, L.; Guo, P.; Qiao, M., et al., Cu/SiO2 catalysts prepared by the ammonia-evaporation method: Texture, structure, and catalytic performance in hydrogenation of dimethyl oxalate to ethylene glycol. J. Catal. 257 (2008) 172–180. [51] X. Wang K. Ma L. Guo Appl. Catal. A Gen. 540 2017 37 46 Wang, X.; Ma, K.; Guo, L., et al., Cu/ZnO/SiO2 catalyst synthesized by reduction of ZnO-modified copper phyllosilicate for dimethyl ether steam reforming. Appl. Catal. A Gen. 540 (2017) 37–46. [52] X. Niu J. Gao Q. Miao Microporous Mesoporous Mater. 197 2014 252 261 Niu, X.; Gao, J.; Miao, Q., et al., Influence of preparation method on the performance of Zn-containing HZSM-5 catalysts in methanol-to-aromatics. Micropor. Mesopor. Mat. 197 (2014) 252–261. [53] G. Wang L. Zeng J. Cao Microporous Mesoporous Mater. 284 2019 133 140 Wang, G.; Zeng, L.; Cao, J., et al., Highly selective conversion of CO2 to hydrocarbons over composite catalysts of ZnO-ZrO2 and SAPO-34. Micropor. Mesopor. Mat. 284 (2019) 133–140. [54] Y. Zhang C. Ye C. Guo J. Catal. 39 2018 99 108 Zhang, Y.; Ye, C.; Guo, C., et al., In2O3-modified Cu/SiO2 as an active and stable catalyst for the hydrogenation of methyl acetate to ethanol. Chinese. J. Catal. 39 (2018) 99–108. [55] H. Huang B. Wang Y. Wang Catal. Today 358 2020 68 73 Huang, H.; Wang, B.; Wang, Y., et al., Partial hydrogenation of dimethyl oxalate on Cu/SiO2 catalyst modified by sodium silicate. Catal. Today. 358 (2020) 68–73. [56] Y. Zhao S. Li Y. Wang Chem. Eng. J. 313 2017 759 768 Zhao, Y.; Li, S.; Wang, Y., et al., Efficient tuning of surface copper species of Cu/SiO2 catalyst for hydrogenation of dimethyl oxalate to ethylene glycol. Chem. Eng. J. 313 (2017) 759–768. [57] J. Chen W. Sun Y. Wang Green Energy Environ. 6 2021 546 556 Chen, J.; Sun, W.; Wang, Y., et al., Performant Au hydrogenation catalyst cooperated with Cu-doped Al2O3 for selective conversion of furfural to furfuryl alcohol at ambient pressure. Green. Energy. Environ. 6 (2021) 546–556. [58] R. Zhang Y. Sun S. Peng Fuel 81 2002 1619 1624 Zhang, R.; Sun, Y.; Peng, S., In situ FTIR studies of methanol adsorption and dehydrogenation over Cu/SiO2 catalyst. Fuel. 81 (2002) 1619–1624. [59] D. Araiza G. A. Gómez-Cortés G. Díaz Catal. Today 282 2017 185 194 Araiza, D., G.; A., Gómez-Cortés.; G., Díaz., Partial oxidation of methanol over copper supported on nanoshaped ceria for hydrogen production. Catal. Today. 282 (2017) 185–194. [60] L. Zhang M. Meng X. Wang J. Power Sources 268 2014 331 340 Zhang, L.; Meng, M.; Wang, X., et al., A series of copper-free ternary oxide catalysts ZnAlCex used for hydrogen production via dimethyl ether steam reforming. J. Power. Sources. 268 (2014) 331–340. [61] Z. Wu M. Li D.R. Mullins ACS Catal. 2 2021 2224 2234 Wu, Z.; Li, M.; Mullins, D.R., et al., Probing the surface sites of CeO2 nanocrystals with well-definedsurface planes via methanol adsorption and desorption. ACS. Catal. 2 (2021) 2224–2234. [62] E.V. Shelepova L.Y. Ilina A.A. Vedyagin Mech. Cat. 120 2017 449 458 Shelepova, E.V.; Ilina, L.Y.; Vedyagin, A.A., Kinetic studies of methanol dehydrogenation. Part I: copper-silica catalysts. Reaction Kinetics, React. Kinet. Mech. Cat. 120 (2017) 449–458. [63] C.-L. Li Y.-C. Lin Appl. Catal. B Environ. 107 2011 284 293 Li, C.-L.; Lin, Y.-C., Methanol partial oxidation over palladium-, platinum-, and rhodium-integrated LaMnO3 perovskites. Appl. Catal. B Environ. 107 (2011) 284–293. [64] R. van den Berg C.F. Elkjaer C.J. Gommes J. Am. Chem. Soc. 138 2016 3433 3442 van den Berg, R.; Elkjaer, C.F.; Gommes, C.J., et al., Revealing the formation of copper nanoparticles from a homogeneous solid precursor by electron microscopy. J. Am. Chem. Soc. 138 (2016) 3433–3442. [65] N. Lakshminarayanan H. Choi J.N. Kuhn Appl. Catal. B Environ. 103 2011 318 325 Lakshminarayanan, N.; Choi, H.; Kuhn, J.N., et al., Effect of additional B-site transition metal doping on oxygen transport and activation characteristics in La0.6Sr0.4(Co0.18Fe0.72×0.1)O3−δ (where X=Zn, Ni or Cu) perovskite oxides. Appl. Catal. B Environ. 103 (2011) 318–325.",
      "scopus-id": "85128209404",
      "coredata": {
        "eid": "1-s2.0-S0926860X22001089",
        "dc:description": "CuZn/SiO2 lamellar catalysts are obtained through the introduction of zinc oxide with different amount to Cu/SiO2 prepared by the ammonia-evaporation method and investigated for the dehydrogenation of methanol to methyl formate. The 20CuZn/SiO2 catalyst showed the best catalytic activity with a methanol conversion of 44.5% and a selectivity to methyl formate of ~92.7% at 300 °C and 0.2 MPa. The reason for this excellent activity could be ascribed to the strong interaction between Cu and ZnO, which promoted the decomposition of the copper phyllosilicate precursor to release copper oxide and thereby achieved more active Cu0 species upon reduction on the catalyst surface. In addition, the agglomeration of Cu species was mainly responsible for the slight decline in the methanol conversion in ZnO modified Cu based catalysts for the methanol dehydrogenation reaction.",
        "openArchiveArticle": "false",
        "prism:coverDate": "2022-05-05",
        "openaccessUserLicense": null,
        "prism:aggregationType": "Journal",
        "prism:url": "https://api.elsevier.com/content/article/pii/S0926860X22001089",
        "dc:creator": [
          {
            "@_fa": "true",
            "$": "Quan, Yanhong"
          },
          {
            "@_fa": "true",
            "$": "Jin, Yuting"
          },
          {
            "@_fa": "true",
            "$": "Wang, Na"
          },
          {
            "@_fa": "true",
            "$": "Zhao, Jinxian"
          },
          {
            "@_fa": "true",
            "$": "Ren, Jun"
          }
        ],
        "link": [
          {
            "@_fa": "true",
            "@rel": "self",
            "@href": "https://api.elsevier.com/content/article/pii/S0926860X22001089"
          },
          {
            "@_fa": "true",
            "@rel": "scidir",
            "@href": "https://www.sciencedirect.com/science/article/pii/S0926860X22001089"
          }
        ],
        "dc:format": "application/json",
        "openaccessType": null,
        "pii": "S0926-860X(22)00108-9",
        "prism:volume": "637",
        "articleNumber": "118585",
        "prism:publisher": "Elsevier B.V.",
        "dc:title": "Efficient CuZn/SiO2 lamellar catalysts for methanol dehydrogenation: New insights into the role of zinc",
        "prism:copyright": "© 2022 Elsevier B.V. All rights reserved.",
        "openaccess": "0",
        "prism:issn": "0926860X",
        "dcterms:subject": [
          {
            "@_fa": "true",
            "$": "Methanol"
          },
          {
            "@_fa": "true",
            "$": "Methyl formate (MF)"
          },
          {
            "@_fa": "true",
            "$": "Copper phyllosilicate"
          },
          {
            "@_fa": "true",
            "$": "xCuZn/SiO2"
          },
          {
            "@_fa": "true",
            "$": "Zinc oxide"
          }
        ],
        "openaccessArticle": "false",
        "prism:publicationName": "Applied Catalysis A: General",
        "openaccessSponsorType": null,
        "prism:pageRange": "118585",
        "pubType": "fla",
        "prism:coverDisplayDate": "5 May 2022",
        "prism:doi": "10.1016/j.apcata.2022.118585",
        "prism:startingPage": "118585",
        "dc:identifier": "doi:10.1016/j.apcata.2022.118585",
        "openaccessSponsorName": null
      },
      "objects": {
        "object": [
          {
            "@category": "standard",
            "@height": "495",
            "@width": "565",
            "@_fa": "true",
            "$": "https://api.elsevier.com/content/object/eid/1-s2.0-S0926860X22001089-gr9.jpg?httpAccept=%2A%2F%2A",
            "@multimediatype": "JPEG image file",
            "@type": "IMAGE-DOWNSAMPLED",
            "@size": "58088",
            "@ref": "gr9",
            "@mimetype": "image/jpeg"
          },
          {
            "@category": "standard",
            "@height": "457",
            "@width": "282",
            "@_fa": "true",
            "$": "https://api.elsevier.com/content/object/eid/1-s2.0-S0926860X22001089-gr10.jpg?httpAccept=%2A%2F%2A",
            "@multimediatype": "JPEG image file",
            "@type": "IMAGE-DOWNSAMPLED",
            "@size": "29789",
            "@ref": "gr10",
            "@mimetype": "image/jpeg"
          },
          {
            "@category": "standard",
            "@height": "219",
            "@width": "282",
            "@_fa": "true",
            "$": "https://api.elsevier.com/content/object/eid/1-s2.0-S0926860X22001089-gr8.jpg?httpAccept=%2A%2F%2A",
            "@multimediatype": "JPEG image file",
            "@type": "IMAGE-DOWNSAMPLED",
            "@size": "20226",
            "@ref": "gr8",
            "@mimetype": "image/jpeg"
          },
          {
            "@category": "standard",
            "@height": "450",
            "@width": "282",
            "@_fa": "true",
            "$": "https://api.elsevier.com/content/object/eid/1-s2.0-S0926860X22001089-gr7.jpg?httpAccept=%2A%2F%2A",
            "@multimediatype": "JPEG image file",
            "@type": "IMAGE-DOWNSAMPLED",
            "@size": "42013",
            "@ref": "gr7",
            "@mimetype": "image/jpeg"
          },
          {
            "@category": "standard",
            "@height": "699",
            "@width": "282",
            "@_fa": "true",
            "$": "https://api.elsevier.com/content/object/eid/1-s2.0-S0926860X22001089-gr2.jpg?httpAccept=%2A%2F%2A",
            "@multimediatype": "JPEG image file",
            "@type": "IMAGE-DOWNSAMPLED",
            "@size": "53669",
            "@ref": "gr2",
            "@mimetype": "image/jpeg"
          },
          {
            "@category": "standard",
            "@height": "200",
            "@width": "283",
            "@_fa": "true",
            "$": "https://api.elsevier.com/content/object/eid/1-s2.0-S0926860X22001089-ga1.jpg?httpAccept=%2A%2F%2A",
            "@multimediatype": "JPEG image file",
            "@type": "IMAGE-DOWNSAMPLED",
            "@size": "23798",
            "@ref": "ga1",
            "@mimetype": "image/jpeg"
          },
          {
            "@category": "standard",
            "@height": "456",
            "@width": "282",
            "@_fa": "true",
            "$": "https://api.elsevier.com/content/object/eid/1-s2.0-S0926860X22001089-gr1.jpg?httpAccept=%2A%2F%2A",
            "@multimediatype": "JPEG image file",
            "@type": "IMAGE-DOWNSAMPLED",
            "@size": "33463",
            "@ref": "gr1",
            "@mimetype": "image/jpeg"
          },
          {
            "@category": "standard",
            "@height": "236",
            "@width": "339",
            "@_fa": "true",
            "$": "https://api.elsevier.com/content/object/eid/1-s2.0-S0926860X22001089-gr6.jpg?httpAccept=%2A%2F%2A",
            "@multimediatype": "JPEG image file",
            "@type": "IMAGE-DOWNSAMPLED",
            "@size": "26067",
            "@ref": "gr6",
            "@mimetype": "image/jpeg"
          },
          {
            "@category": "standard",
            "@height": "230",
            "@width": "282",
            "@_fa": "true",
            "$": "https://api.elsevier.com/content/object/eid/1-s2.0-S0926860X22001089-gr5.jpg?httpAccept=%2A%2F%2A",
            "@multimediatype": "JPEG image file",
            "@type": "IMAGE-DOWNSAMPLED",
            "@size": "17761",
            "@ref": "gr5",
            "@mimetype": "image/jpeg"
          },
          {
            "@category": "standard",
            "@height": "414",
            "@width": "282",
            "@_fa": "true",
            "$": "https://api.elsevier.com/content/object/eid/1-s2.0-S0926860X22001089-gr4.jpg?httpAccept=%2A%2F%2A",
            "@multimediatype": "JPEG image file",
            "@type": "IMAGE-DOWNSAMPLED",
            "@size": "29772",
            "@ref": "gr4",
            "@mimetype": "image/jpeg"
          },
          {
            "@category": "standard",
            "@height": "569",
            "@width": "565",
            "@_fa": "true",
            "$": "https://api.elsevier.com/content/object/eid/1-s2.0-S0926860X22001089-gr3.jpg?httpAccept=%2A%2F%2A",
            "@multimediatype": "JPEG image file",
            "@type": "IMAGE-DOWNSAMPLED",
            "@size": "143536",
            "@ref": "gr3",
            "@mimetype": "image/jpeg"
          },
          {
            "@category": "thumbnail",
            "@height": "164",
            "@width": "187",
            "@_fa": "true",
            "$": "https://api.elsevier.com/content/object/eid/1-s2.0-S0926860X22001089-gr9.sml?httpAccept=%2A%2F%2A",
            "@multimediatype": "GIF image file",
            "@type": "IMAGE-THUMBNAIL",
            "@size": "10110",
            "@ref": "gr9",
            "@mimetype": "image/gif"
          },
          {
            "@category": "thumbnail",
            "@height": "164",
            "@width": "101",
            "@_fa": "true",
            "$": "https://api.elsevier.com/content/object/eid/1-s2.0-S0926860X22001089-gr10.sml?httpAccept=%2A%2F%2A",
            "@multimediatype": "GIF image file",
            "@type": "IMAGE-THUMBNAIL",
            "@size": "4673",
            "@ref": "gr10",
            "@mimetype": "image/gif"
          },
          {
            "@category": "thumbnail",
            "@height": "164",
            "@width": "211",
            "@_fa": "true",
            "$": "https://api.elsevier.com/content/object/eid/1-s2.0-S0926860X22001089-gr8.sml?httpAccept=%2A%2F%2A",
            "@multimediatype": "GIF image file",
            "@type": "IMAGE-THUMBNAIL",
            "@size": "9444",
            "@ref": "gr8",
            "@mimetype": "image/gif"
          },
          {
            "@category": "thumbnail",
            "@height": "164",
            "@width": "103",
            "@_fa": "true",
            "$": "https://api.elsevier.com/content/object/eid/1-s2.0-S0926860X22001089-gr7.sml?httpAccept=%2A%2F%2A",
            "@multimediatype": "GIF image file",
            "@type": "IMAGE-THUMBNAIL",
            "@size": "6858",
            "@ref": "gr7",
            "@mimetype": "image/gif"
          },
          {
            "@category": "thumbnail",
            "@height": "164",
            "@width": "66",
            "@_fa": "true",
            "$": "https://api.elsevier.com/content/object/eid/1-s2.0-S0926860X22001089-gr2.sml?httpAccept=%2A%2F%2A",
            "@multimediatype": "GIF image file",
            "@type": "IMAGE-THUMBNAIL",
            "@size": "5042",
            "@ref": "gr2",
            "@mimetype": "image/gif"
          },
          {
            "@category": "thumbnail",
            "@height": "154",
            "@width": "219",
            "@_fa": "true",
            "$": "https://api.elsevier.com/content/object/eid/1-s2.0-S0926860X22001089-ga1.sml?httpAccept=%2A%2F%2A",
            "@multimediatype": "GIF image file",
            "@type": "IMAGE-THUMBNAIL",
            "@size": "16192",
            "@ref": "ga1",
            "@mimetype": "image/gif"
          },
          {
            "@category": "thumbnail",
            "@height": "163",
            "@width": "101",
            "@_fa": "true",
            "$": "https://api.elsevier.com/content/object/eid/1-s2.0-S0926860X22001089-gr1.sml?httpAccept=%2A%2F%2A",
            "@multimediatype": "GIF image file",
            "@type": "IMAGE-THUMBNAIL",
            "@size": "5313",
            "@ref": "gr1",
            "@mimetype": "image/gif"
          },
          {
            "@category": "thumbnail",
            "@height": "152",
            "@width": "219",
            "@_fa": "true",
            "$": "https://api.elsevier.com/content/object/eid/1-s2.0-S0926860X22001089-gr6.sml?httpAccept=%2A%2F%2A",
            "@multimediatype": "GIF image file",
            "@type": "IMAGE-THUMBNAIL",
            "@size": "11193",
            "@ref": "gr6",
            "@mimetype": "image/gif"
          },
          {
            "@category": "thumbnail",
            "@height": "164",
            "@width": "201",
            "@_fa": "true",
            "$": "https://api.elsevier.com/content/object/eid/1-s2.0-S0926860X22001089-gr5.sml?httpAccept=%2A%2F%2A",
            "@multimediatype": "GIF image file",
            "@type": "IMAGE-THUMBNAIL",
            "@size": "7709",
            "@ref": "gr5",
            "@mimetype": "image/gif"
          },
          {
            "@category": "thumbnail",
            "@height": "163",
            "@width": "111",
            "@_fa": "true",
            "$": "https://api.elsevier.com/content/object/eid/1-s2.0-S0926860X22001089-gr4.sml?httpAccept=%2A%2F%2A",
            "@multimediatype": "GIF image file",
            "@type": "IMAGE-THUMBNAIL",
            "@size": "5419",
            "@ref": "gr4",
            "@mimetype": "image/gif"
          },
          {
            "@category": "thumbnail",
            "@height": "164",
            "@width": "163",
            "@_fa": "true",
            "$": "https://api.elsevier.com/content/object/eid/1-s2.0-S0926860X22001089-gr3.sml?httpAccept=%2A%2F%2A",
            "@multimediatype": "GIF image file",
            "@type": "IMAGE-THUMBNAIL",
            "@size": "18242",
            "@ref": "gr3",
            "@mimetype": "image/gif"
          },
          {
            "@category": "high",
            "@height": "2186",
            "@width": "2495",
            "@_fa": "true",
            "$": "https://api.elsevier.com/content/object/eid/1-s2.0-S0926860X22001089-gr9_lrg.jpg?httpAccept=%2A%2F%2A",
            "@multimediatype": "JPEG image file",
            "@type": "IMAGE-HIGH-RES",
            "@size": "293837",
            "@ref": "gr9",
            "@mimetype": "image/jpeg"
          },
          {
            "@category": "high",
            "@height": "2023",
            "@width": "1247",
            "@_fa": "true",
            "$": "https://api.elsevier.com/content/object/eid/1-s2.0-S0926860X22001089-gr10_lrg.jpg?httpAccept=%2A%2F%2A",
            "@multimediatype": "JPEG image file",
            "@type": "IMAGE-HIGH-RES",
            "@size": "193196",
            "@ref": "gr10",
            "@mimetype": "image/jpeg"
          },
          {
            "@category": "high",
            "@height": "968",
            "@width": "1247",
            "@_fa": "true",
            "$": "https://api.elsevier.com/content/object/eid/1-s2.0-S0926860X22001089-gr8_lrg.jpg?httpAccept=%2A%2F%2A",
            "@multimediatype": "JPEG image file",
            "@type": "IMAGE-HIGH-RES",
            "@size": "129192",
            "@ref": "gr8",
            "@mimetype": "image/jpeg"
          },
          {
            "@category": "high",
            "@height": "1988",
            "@width": "1247",
            "@_fa": "true",
            "$": "https://api.elsevier.com/content/object/eid/1-s2.0-S0926860X22001089-gr7_lrg.jpg?httpAccept=%2A%2F%2A",
            "@multimediatype": "JPEG image file",
            "@type": "IMAGE-HIGH-RES",
            "@size": "302721",
            "@ref": "gr7",
            "@mimetype": "image/jpeg"
          },
          {
            "@category": "high",
            "@height": "3091",
            "@width": "1247",
            "@_fa": "true",
            "$": "https://api.elsevier.com/content/object/eid/1-s2.0-S0926860X22001089-gr2_lrg.jpg?httpAccept=%2A%2F%2A",
            "@multimediatype": "JPEG image file",
            "@type": "IMAGE-HIGH-RES",
            "@size": "402073",
            "@ref": "gr2",
            "@mimetype": "image/jpeg"
          },
          {
            "@category": "high",
            "@height": "886",
            "@width": "1256",
            "@_fa": "true",
            "$": "https://api.elsevier.com/content/object/eid/1-s2.0-S0926860X22001089-ga1_lrg.jpg?httpAccept=%2A%2F%2A",
            "@multimediatype": "JPEG image file",
            "@type": "IMAGE-HIGH-RES",
            "@size": "188667",
            "@ref": "ga1",
            "@mimetype": "image/jpeg"
          },
          {
            "@category": "high",
            "@height": "2018",
            "@width": "1247",
            "@_fa": "true",
            "$": "https://api.elsevier.com/content/object/eid/1-s2.0-S0926860X22001089-gr1_lrg.jpg?httpAccept=%2A%2F%2A",
            "@multimediatype": "JPEG image file",
            "@type": "IMAGE-HIGH-RES",
            "@size": "208038",
            "@ref": "gr1",
            "@mimetype": "image/jpeg"
          },
          {
            "@category": "high",
            "@height": "1040",
            "@width": "1497",
            "@_fa": "true",
            "$": "https://api.elsevier.com/content/object/eid/1-s2.0-S0926860X22001089-gr6_lrg.jpg?httpAccept=%2A%2F%2A",
            "@multimediatype": "JPEG image file",
            "@type": "IMAGE-HIGH-RES",
            "@size": "162732",
            "@ref": "gr6",
            "@mimetype": "image/jpeg"
          },
          {
            "@category": "high",
            "@height": "1015",
            "@width": "1247",
            "@_fa": "true",
            "$": "https://api.elsevier.com/content/object/eid/1-s2.0-S0926860X22001089-gr5_lrg.jpg?httpAccept=%2A%2F%2A",
            "@multimediatype": "JPEG image file",
            "@type": "IMAGE-HIGH-RES",
            "@size": "110416",
            "@ref": "gr5",
            "@mimetype": "image/jpeg"
          },
          {
            "@category": "high",
            "@height": "1829",
            "@width": "1247",
            "@_fa": "true",
            "$": "https://api.elsevier.com/content/object/eid/1-s2.0-S0926860X22001089-gr4_lrg.jpg?httpAccept=%2A%2F%2A",
            "@multimediatype": "JPEG image file",
            "@type": "IMAGE-HIGH-RES",
            "@size": "196502",
            "@ref": "gr4",
            "@mimetype": "image/jpeg"
          },
          {
            "@category": "high",
            "@height": "2511",
            "@width": "2495",
            "@_fa": "true",
            "$": "https://api.elsevier.com/content/object/eid/1-s2.0-S0926860X22001089-gr3_lrg.jpg?httpAccept=%2A%2F%2A",
            "@multimediatype": "JPEG image file",
            "@type": "IMAGE-HIGH-RES",
            "@size": "856427",
            "@ref": "gr3",
            "@mimetype": "image/jpeg"
          },
          {
            "@category": "standard",
            "@_fa": "true",
            "$": "https://api.elsevier.com/content/object/eid/1-s2.0-S0926860X22001089-mmc1.docx?httpAccept=%2A%2F%2A",
            "@multimediatype": "Microsoft Word file",
            "@type": "APPLICATION",
            "@size": "2887534",
            "@ref": "mmc1",
            "@mimetype": "application/word"
          },
          {
            "@category": "thumbnail",
            "@_fa": "true",
            "$": "https://api.elsevier.com/content/object/eid/1-s2.0-S0926860X22001089-si0001.svg?httpAccept=%2A%2F%2A",
            "@multimediatype": "Scalable Vector Graphics file",
            "@type": "ALTIMG",
            "@size": "1357",
            "@ref": "si0001",
            "@mimetype": "image/svg+xml"
          },
          {
            "@category": "thumbnail",
            "@_fa": "true",
            "$": "https://api.elsevier.com/content/object/eid/1-s2.0-S0926860X22001089-si0002.svg?httpAccept=%2A%2F%2A",
            "@multimediatype": "Scalable Vector Graphics file",
            "@type": "ALTIMG",
            "@size": "4562",
            "@ref": "si0002",
            "@mimetype": "image/svg+xml"
          },
          {
            "@category": "thumbnail",
            "@_fa": "true",
            "$": "https://api.elsevier.com/content/object/eid/1-s2.0-S0926860X22001089-si0003.svg?httpAccept=%2A%2F%2A",
            "@multimediatype": "Scalable Vector Graphics file",
            "@type": "ALTIMG",
            "@size": "3318",
            "@ref": "si0003",
            "@mimetype": "image/svg+xml"
          },
          {
            "@category": "thumbnail",
            "@_fa": "true",
            "$": "https://api.elsevier.com/content/object/eid/1-s2.0-S0926860X22001089-si0004.svg?httpAccept=%2A%2F%2A",
            "@multimediatype": "Scalable Vector Graphics file",
            "@type": "ALTIMG",
            "@size": "3440",
            "@ref": "si0004",
            "@mimetype": "image/svg+xml"
          },
          {
            "@category": "thumbnail",
            "@_fa": "true",
            "$": "https://api.elsevier.com/content/object/eid/1-s2.0-S0926860X22001089-si0005.svg?httpAccept=%2A%2F%2A",
            "@multimediatype": "Scalable Vector Graphics file",
            "@type": "ALTIMG",
            "@size": "3286",
            "@ref": "si0005",
            "@mimetype": "image/svg+xml"
          },
          {
            "@category": "thumbnail",
            "@_fa": "true",
            "$": "https://api.elsevier.com/content/object/eid/1-s2.0-S0926860X22001089-si0006.svg?httpAccept=%2A%2F%2A",
            "@multimediatype": "Scalable Vector Graphics file",
            "@type": "ALTIMG",
            "@size": "2581",
            "@ref": "si0006",
            "@mimetype": "image/svg+xml"
          },
          {
            "@category": "standard",
            "@_fa": "true",
            "$": "https://api.elsevier.com/content/object/eid/1-s2.0-S0926860X22001089-am.pdf?httpAccept=%2A%2F%2A",
            "@multimediatype": "Acrobat PDF file",
            "@type": "AAM-PDF",
            "@size": "2626967",
            "@ref": "am",
            "@mimetype": "application/pdf"
          }
        ]
      },
      "link": {
        "@rel": "abstract",
        "@href": "https://api.elsevier.com/content/abstract/scopus_id/85128209404"
      }
    }
  }
}