{
  "metadata": {
    "title": "Tuning the co-catalyst loading for the optimization of thermo-photocatalytic hydrogen production over Cu/TiO<ce:inf loc=post>2</ce:inf>",
    "authors": "; ; ",
    "journal": "Applied Catalysis A: General",
    "date": "2022-08-05",
    "doi": "10.1016/j.apcata.2022.118804",
    "abstract": "",
    "uri": "https://api.elsevier.com/content/article/pii/S0926860X22003271",
    "pii": "S0926860X22003271"
  },
  "fulltext": {
    "full-text-retrieval-response": {
      "scopus-eid": "2-s2.0-85135334483",
      "originalText": "serial JL 271346 291210 291744 291809 31 90 Applied Catalysis A: General APPLIEDCATALYSISAGENERAL 2022-07-30 2022-07-30 2022-08-03 2022-08-03 2022-10-16T00:55:09 1-s2.0-S0926860X22003271 S0926-860X(22)00327-1 S0926860X22003271 10.1016/j.apcata.2022.118804 S300 S300.1 FULL-TEXT 1-s2.0-S0926860X22X00148 2024-01-01T12:34:28.416125Z 0 0 20220805 2022 2022-07-30T07:30:53.803271Z absattachment articleinfo articlenumber articletitlenorm authfirstinitialnorm authfirstsurnamenorm cid cids contenttype copyright crossmark dateloaded dateloadedtxt datesearch datesort dateupdated dco docsubtype doctype doi eid ewtransactionid fundingbodyid hubeid indexeddate issn issnnorm itemstage itemtransactionid itemweight oauserlicense openaccess openarchive pg pgfirst pii piinorm pubdatestart pubdatetxt pubyr sortorder sponsoredaccesstype srctitle srctitlenorm srctype ssids alllist content oa subj subheadings suppl tomb volfirst volissue volumelist webpdf webpdfpagecount yearnav figure table e-component body mmlmath acknowledge affil appendices articletitle auth authfirstini authfull authkeywords authlast grantnumber grantsponsor grantsponsorid highlightsabst primabst ref specialabst 0926-860X 0926860X UNLIMITED SPAIN2022 true 643 643 C Volume 643 71 118804 118804 118804 20220805 5 August 2022 2022-08-05 2022 article fla © 2022 The Author(s). Published by Elsevier B.V. TUNINGCOCATALYSTLOADINGFOROPTIMIZATIONTHERMOPHOTOCATALYTICHYDROGENPRODUCTIONOVERCUTIO2 PLATERO F 1 Introduction 2 Experimental 2.1 Catalysts preparation and characterisation 2.2 Photocatalytic runs 3 Results and discussions 3.1 Copper features study with metal content 3.2 Thermo-photocatalytic performance of Cu/TiO2 system 3.3 In-situ FTIR analysis of thermo-photocatalytic reaction 4 Conclusions CRediT authorship contribution statement Acknowledgments Appendix A Supplementary material References WU 2022 1021 1033 S WANG 2020 919 985 Q CHEN 2022 5467 5477 W KONSTANTINOS 2017 1523 1544 C SKILLEN 2022 33 N CLARIZIA 2016 142 149 L CONSTANTINO 2022 130800 D MALDONADO 2018 15 23 M TOLEDOCAMACHO 2021 36152 36166 S NISHIYAMA 2021 304 307 H KUBACKA 2012 1555 1614 A CHRISTOFORIDIS 2019 368 382 K COLON 2016 48 59 G WANG 2014 5234 52447 H SERRA 2015 1842 1845 M ALAZRI 2019 3946 3958 Z PLATERO 2021 3204 3219 F MEI 2018 9154 9164 B VALERO 2014 3320 3329 J KUMARAVEL 2019 1021 1064 V SCHUBERT 2021 21958 21971 J HADDAD 2021 37556 37563 M CARAVACA 2016 649 657 A CAUDILLOFLORES 2019 117790 U NAIR 2019 2098 2116 V BARBANIETO 2021 6904 6930 I WANG 2022 132322 Z LOPEZMARTIN 2020 1 9 A QURESHI 2017 158 167 M CAUDILLOFLORES 2018 533 545 U COLON 2006 41 51 G POLLIOTTO 2018 27745 27756 V LI 2017 1 12 B KUMAR 2016 282 291 M SHI 2019 2253 2260 Q KUMAR 2021 120654 M HINOJOSAREYES 2017 992 1002 M CAO 2021 119748 G XUE 2019 38477 38485 H LI 2020 2045 2055 C AGUIRRE 2017 485 493 M QI 2022 1845 1854 Y FANG 2019 5047 50567 S PLATERO 2021 1 12 F ZHANG 2014 3742 3748 Y CHEN 2022 e202200190 W CAUDILLOFLORES 2021 130641 U ZHENG 2021 2100161 C LI 2015 15454 15459 Y ZHAO 2019 7708 7712 L PLATEROX2022X118804 PLATEROX2022X118804XF Full 2022-07-29T06:54:37Z FundingBody Spanish Institutions 2022 http://creativecommons.org/licenses/by-nc-nd/4.0/ 2024-08-03T00:00:00.000Z 2024-08-03T00:00:00.000Z http://creativecommons.org/licenses/by-nc-nd/4.0/ This is an open access article under the CC BY-NC-ND license. © 2022 The Author(s). Published by Elsevier B.V. 2022-08-09T01:35:57.231Z http://vtw.elsevier.com/data/voc/AddOnTypes/50.7/aggregated-refined 0 item S0926-860X(22)00327-1 S0926860X22003271 1-s2.0-S0926860X22003271 10.1016/j.apcata.2022.118804 271346 2024-01-01T12:34:28.416125Z 2022-08-05 UNLIMITED SPAIN2022 1-s2.0-S0926860X22003271-main.pdf https://s3-eu-west-1.amazonaws.com/prod-ucs-content-store-eu-west/content/pii:S0926860X22003271/MAIN/application/pdf/769a01c16b2a53fa2d4ef6e655de0b53/main.pdf main.pdf pdf true 4291500 MAIN 8 1-s2.0-S0926860X22003271-main_1.png https://s3-eu-west-1.amazonaws.com/prod-ucs-content-store-eu-west/content/pii:S0926860X22003271/PREVIEW/image/png/d22eae2dfeba82483a09f29fefc7bc9d/main_1.png main_1.png png 59083 849 656 IMAGE-WEB-PDF 1 1-s2.0-S0926860X22003271-fx1.jpg https://s3-eu-west-1.amazonaws.com/prod-ucs-content-store-eu-west/content/pii:S0926860X22003271/fx1/DOWNSAMPLED/image/jpeg/7a2aec11e249caa546627638b787cb54/fx1.jpg fx1 fx1.jpg jpg 1381 37 64 IMAGE-DOWNSAMPLED 1-s2.0-S0926860X22003271-fx2.jpg https://s3-eu-west-1.amazonaws.com/prod-ucs-content-store-eu-west/content/pii:S0926860X22003271/fx2/DOWNSAMPLED/image/jpeg/aa39fb0d009c83df25c2e2f481e91127/fx2.jpg fx2 fx2.jpg jpg 1526 30 64 IMAGE-DOWNSAMPLED 1-s2.0-S0926860X22003271-gr6.jpg https://s3-eu-west-1.amazonaws.com/prod-ucs-content-store-eu-west/content/pii:S0926860X22003271/gr6/DOWNSAMPLED/image/jpeg/ffa62123cb96187682a74a090b38d213/gr6.jpg gr6 gr6.jpg jpg 39783 527 352 IMAGE-DOWNSAMPLED 1-s2.0-S0926860X22003271-gr7.jpg https://s3-eu-west-1.amazonaws.com/prod-ucs-content-store-eu-west/content/pii:S0926860X22003271/gr7/DOWNSAMPLED/image/jpeg/564efdc237da09d4fcc4a65e2bfef1fa/gr7.jpg gr7 gr7.jpg jpg 16607 273 376 IMAGE-DOWNSAMPLED 1-s2.0-S0926860X22003271-gr8.jpg https://s3-eu-west-1.amazonaws.com/prod-ucs-content-store-eu-west/content/pii:S0926860X22003271/gr8/DOWNSAMPLED/image/jpeg/34c05221af567150c57b40aaa1d5abb3/gr8.jpg gr8 gr8.jpg jpg 65965 289 791 IMAGE-DOWNSAMPLED 1-s2.0-S0926860X22003271-gr2.jpg https://s3-eu-west-1.amazonaws.com/prod-ucs-content-store-eu-west/content/pii:S0926860X22003271/gr2/DOWNSAMPLED/image/jpeg/33a46c5d2b183a629bf4112df6b93090/gr2.jpg gr2 gr2.jpg jpg 34947 436 376 IMAGE-DOWNSAMPLED 1-s2.0-S0926860X22003271-ga1.jpg https://s3-eu-west-1.amazonaws.com/prod-ucs-content-store-eu-west/content/pii:S0926860X22003271/ga1/DOWNSAMPLED/image/jpeg/9bdc2522ebddeb5ba477a9206877e9ff/ga1.jpg ga1 true ga1.jpg jpg 21118 168 500 IMAGE-DOWNSAMPLED 1-s2.0-S0926860X22003271-gr3.jpg https://s3-eu-west-1.amazonaws.com/prod-ucs-content-store-eu-west/content/pii:S0926860X22003271/gr3/DOWNSAMPLED/image/jpeg/33a7303ac1c98d132233af3fc879ffdb/gr3.jpg gr3 gr3.jpg jpg 42683 257 659 IMAGE-DOWNSAMPLED 1-s2.0-S0926860X22003271-gr4.jpg https://s3-eu-west-1.amazonaws.com/prod-ucs-content-store-eu-west/content/pii:S0926860X22003271/gr4/DOWNSAMPLED/image/jpeg/37d09b48e73ce8db77e3075fc3c5b600/gr4.jpg gr4 gr4.jpg jpg 41153 411 565 IMAGE-DOWNSAMPLED 1-s2.0-S0926860X22003271-gr5.jpg https://s3-eu-west-1.amazonaws.com/prod-ucs-content-store-eu-west/content/pii:S0926860X22003271/gr5/DOWNSAMPLED/image/jpeg/7a7e95840cdfb3a84a79d9c6fb9f5599/gr5.jpg gr5 gr5.jpg jpg 32723 341 565 IMAGE-DOWNSAMPLED 1-s2.0-S0926860X22003271-gr1.jpg https://s3-eu-west-1.amazonaws.com/prod-ucs-content-store-eu-west/content/pii:S0926860X22003271/gr1/DOWNSAMPLED/image/jpeg/3c6104fc2408c6ff6ab89506177ef102/gr1.jpg gr1 gr1.jpg jpg 23214 249 226 IMAGE-DOWNSAMPLED 1-s2.0-S0926860X22003271-fx1.sml https://s3-eu-west-1.amazonaws.com/prod-ucs-content-store-eu-west/content/pii:S0926860X22003271/fx1/THUMBNAIL/image/gif/8477f0489d9db98b63874a2bb0a0394e/fx1.sml fx1 fx1.sml sml 10979 127 219 IMAGE-THUMBNAIL 1-s2.0-S0926860X22003271-fx2.sml https://s3-eu-west-1.amazonaws.com/prod-ucs-content-store-eu-west/content/pii:S0926860X22003271/fx2/THUMBNAIL/image/gif/ae3a21e3ca1199ec86643f9e5641eab2/fx2.sml fx2 fx2.sml sml 11745 103 219 IMAGE-THUMBNAIL 1-s2.0-S0926860X22003271-gr6.sml https://s3-eu-west-1.amazonaws.com/prod-ucs-content-store-eu-west/content/pii:S0926860X22003271/gr6/THUMBNAIL/image/gif/93392171e276fb6f0be7769f33ccf294/gr6.sml gr6 gr6.sml sml 7003 163 109 IMAGE-THUMBNAIL 1-s2.0-S0926860X22003271-gr7.sml https://s3-eu-west-1.amazonaws.com/prod-ucs-content-store-eu-west/content/pii:S0926860X22003271/gr7/THUMBNAIL/image/gif/b7da49634f2ee9001d7270cdd95a2945/gr7.sml gr7 gr7.sml sml 5016 159 219 IMAGE-THUMBNAIL 1-s2.0-S0926860X22003271-gr8.sml https://s3-eu-west-1.amazonaws.com/prod-ucs-content-store-eu-west/content/pii:S0926860X22003271/gr8/THUMBNAIL/image/gif/40e7de567a83dacda737c03b4ef92b6d/gr8.sml gr8 gr8.sml sml 7781 80 219 IMAGE-THUMBNAIL 1-s2.0-S0926860X22003271-gr2.sml https://s3-eu-west-1.amazonaws.com/prod-ucs-content-store-eu-west/content/pii:S0926860X22003271/gr2/THUMBNAIL/image/gif/eda50ea7940c0884ab105e79da3f68a2/gr2.sml gr2 gr2.sml sml 8712 163 141 IMAGE-THUMBNAIL 1-s2.0-S0926860X22003271-ga1.sml https://s3-eu-west-1.amazonaws.com/prod-ucs-content-store-eu-west/content/pii:S0926860X22003271/ga1/THUMBNAIL/image/gif/9eabe33f11b12f81c72048539827c8ba/ga1.sml ga1 true ga1.sml sml 5504 73 219 IMAGE-THUMBNAIL 1-s2.0-S0926860X22003271-gr3.sml https://s3-eu-west-1.amazonaws.com/prod-ucs-content-store-eu-west/content/pii:S0926860X22003271/gr3/THUMBNAIL/image/gif/13081665a0c80b1262cf8193bc05d7c0/gr3.sml gr3 gr3.sml sml 6111 86 219 IMAGE-THUMBNAIL 1-s2.0-S0926860X22003271-gr4.sml https://s3-eu-west-1.amazonaws.com/prod-ucs-content-store-eu-west/content/pii:S0926860X22003271/gr4/THUMBNAIL/image/gif/318890f3065022f18f7d34143a0afd7c/gr4.sml gr4 gr4.sml sml 7361 159 219 IMAGE-THUMBNAIL 1-s2.0-S0926860X22003271-gr5.sml https://s3-eu-west-1.amazonaws.com/prod-ucs-content-store-eu-west/content/pii:S0926860X22003271/gr5/THUMBNAIL/image/gif/7826442d5a6c3e1d60a2e274644a57ab/gr5.sml gr5 gr5.sml sml 5882 132 219 IMAGE-THUMBNAIL 1-s2.0-S0926860X22003271-gr1.sml https://s3-eu-west-1.amazonaws.com/prod-ucs-content-store-eu-west/content/pii:S0926860X22003271/gr1/THUMBNAIL/image/gif/eef56e4d13d958bdf3f3ae582049a4aa/gr1.sml gr1 gr1.sml sml 24943 164 149 IMAGE-THUMBNAIL 1-s2.0-S0926860X22003271-fx1_lrg.jpg https://s3-eu-west-1.amazonaws.com/prod-ucs-content-store-eu-west/content/pii:S0926860X22003271/fx1/HIGHRES/image/jpeg/f2b715c6500e16013e7f2698793d4582/fx1_lrg.jpg fx1 fx1_lrg.jpg jpg 4945 167 288 IMAGE-HIGH-RES 1-s2.0-S0926860X22003271-fx2_lrg.jpg https://s3-eu-west-1.amazonaws.com/prod-ucs-content-store-eu-west/content/pii:S0926860X22003271/fx2/HIGHRES/image/jpeg/241ab01ffab40abbe7c19f845dd3cf75/fx2_lrg.jpg fx2 fx2_lrg.jpg jpg 5854 135 288 IMAGE-HIGH-RES 1-s2.0-S0926860X22003271-gr6_lrg.jpg https://s3-eu-west-1.amazonaws.com/prod-ucs-content-store-eu-west/content/pii:S0926860X22003271/gr6/HIGHRES/image/jpeg/c5a78e9e247c274bf9d10016829232f3/gr6_lrg.jpg gr6 gr6_lrg.jpg jpg 222039 2339 1561 IMAGE-HIGH-RES 1-s2.0-S0926860X22003271-gr7_lrg.jpg https://s3-eu-west-1.amazonaws.com/prod-ucs-content-store-eu-west/content/pii:S0926860X22003271/gr7/HIGHRES/image/jpeg/76caeaaa03567416f5fc8ad155458a43/gr7_lrg.jpg gr7 gr7_lrg.jpg jpg 100021 1211 1665 IMAGE-HIGH-RES 1-s2.0-S0926860X22003271-gr8_lrg.jpg https://s3-eu-west-1.amazonaws.com/prod-ucs-content-store-eu-west/content/pii:S0926860X22003271/gr8/HIGHRES/image/jpeg/6a541f1f2f191c4c67639932a6f44464/gr8_lrg.jpg gr8 gr8_lrg.jpg jpg 520718 1278 3493 IMAGE-HIGH-RES 1-s2.0-S0926860X22003271-gr2_lrg.jpg https://s3-eu-west-1.amazonaws.com/prod-ucs-content-store-eu-west/content/pii:S0926860X22003271/gr2/HIGHRES/image/jpeg/182938f80b8beb7d01389559afc6b2a0/gr2_lrg.jpg gr2 gr2_lrg.jpg jpg 285866 1929 1664 IMAGE-HIGH-RES 1-s2.0-S0926860X22003271-ga1_lrg.jpg https://s3-eu-west-1.amazonaws.com/prod-ucs-content-store-eu-west/content/pii:S0926860X22003271/ga1/HIGHRES/image/jpeg/a09adf0b84e884ff0f4bddb5c2e97a81/ga1_lrg.jpg ga1 true ga1_lrg.jpg jpg 150912 742 2213 IMAGE-HIGH-RES 1-s2.0-S0926860X22003271-gr3_lrg.jpg https://s3-eu-west-1.amazonaws.com/prod-ucs-content-store-eu-west/content/pii:S0926860X22003271/gr3/HIGHRES/image/jpeg/632efc4b8d436774dad9b0f7135b0718/gr3_lrg.jpg gr3 gr3_lrg.jpg jpg 279021 1137 2911 IMAGE-HIGH-RES 1-s2.0-S0926860X22003271-gr4_lrg.jpg https://s3-eu-west-1.amazonaws.com/prod-ucs-content-store-eu-west/content/pii:S0926860X22003271/gr4/HIGHRES/image/jpeg/2d8b07f4f491fe37c6048dd94c63f923/gr4_lrg.jpg gr4 gr4_lrg.jpg jpg 270024 1817 2495 IMAGE-HIGH-RES 1-s2.0-S0926860X22003271-gr5_lrg.jpg https://s3-eu-west-1.amazonaws.com/prod-ucs-content-store-eu-west/content/pii:S0926860X22003271/gr5/HIGHRES/image/jpeg/257c09699abd49e51e10af80a3d9dfa0/gr5_lrg.jpg gr5 gr5_lrg.jpg jpg 213256 1507 2495 IMAGE-HIGH-RES 1-s2.0-S0926860X22003271-gr1_lrg.jpg https://s3-eu-west-1.amazonaws.com/prod-ucs-content-store-eu-west/content/pii:S0926860X22003271/gr1/HIGHRES/image/jpeg/ea8aa68ffce9e9ce3d5664b68a073b37/gr1_lrg.jpg gr1 gr1_lrg.jpg jpg 107567 1099 998 IMAGE-HIGH-RES 1-s2.0-S0926860X22003271-mmc1.docx https://s3-eu-west-1.amazonaws.com/prod-ucs-content-store-eu-west/content/pii:S0926860X22003271/mmc1/MAIN/application/vnd.openxmlformats-officedocument.wordprocessingml.document/6ebabf3788c701d44ed27cb86f2c353e/mmc1.docx mmc1 mmc1.docx docx 142897 APPLICATION 1-s2.0-S0926860X22003271-si0001.svg https://s3-eu-west-1.amazonaws.com/prod-ucs-content-store-eu-west/content/pii:S0926860X22003271/STRIPIN/image/svg+xml/123e83af57fad62af67cb928d141e198/si0001.svg si0001 si0001.svg svg 1912 ALTIMG 1-s2.0-S0926860X22003271-si0002.svg https://s3-eu-west-1.amazonaws.com/prod-ucs-content-store-eu-west/content/pii:S0926860X22003271/STRIPIN/image/svg+xml/a5c90a3ab0dcd4f6c3eb039429b43337/si0002.svg si0002 si0002.svg svg 3610 ALTIMG 1-s2.0-S0926860X22003271-si0003.svg https://s3-eu-west-1.amazonaws.com/prod-ucs-content-store-eu-west/content/pii:S0926860X22003271/STRIPIN/image/svg+xml/1d6b23c26250a66daad741ae073b3120/si0003.svg si0003 si0003.svg svg 4518 ALTIMG 1-s2.0-S0926860X22003271-si0004.svg https://s3-eu-west-1.amazonaws.com/prod-ucs-content-store-eu-west/content/pii:S0926860X22003271/STRIPIN/image/svg+xml/1f27cab2faf5aae87df44394e3136396/si0004.svg si0004 si0004.svg svg 3626 ALTIMG 1-s2.0-S0926860X22003271-si0005.svg https://s3-eu-west-1.amazonaws.com/prod-ucs-content-store-eu-west/content/pii:S0926860X22003271/STRIPIN/image/svg+xml/238e9b5baad8ebfa5a85ae0d428994b6/si0005.svg si0005 si0005.svg svg 3671 ALTIMG 1-s2.0-S0926860X22003271-si0006.svg https://s3-eu-west-1.amazonaws.com/prod-ucs-content-store-eu-west/content/pii:S0926860X22003271/STRIPIN/image/svg+xml/7a194c70d45e4bf918039e49dbb48a0f/si0006.svg si0006 si0006.svg svg 3663 ALTIMG 1-s2.0-S0926860X22003271-si0007.svg https://s3-eu-west-1.amazonaws.com/prod-ucs-content-store-eu-west/content/pii:S0926860X22003271/STRIPIN/image/svg+xml/873d8ce7d69f3c986a7386e3d6cba16a/si0007.svg si0007 si0007.svg svg 3197 ALTIMG 1-s2.0-S0926860X22003271-si0008.svg https://s3-eu-west-1.amazonaws.com/prod-ucs-content-store-eu-west/content/pii:S0926860X22003271/STRIPIN/image/svg+xml/d55ad0595898cb533e97f097caf45cc5/si0008.svg si0008 si0008.svg svg 3476 ALTIMG 1-s2.0-S0926860X22003271-am.pdf https://s3-eu-west-1.amazonaws.com/prod-ucs-content-store-eu-west/content/egi:10996GHKS7S/MAIN/application/pdf/5ae121dd4e72304023d30e37b0f76c64/am.pdf am am.pdf pdf false 1145243 AAM-PDF APCATA 118804 118804 S0926-860X(22)00327-1 10.1016/j.apcata.2022.118804 The Authors Fig. 1 Photocatalytic gas-phase flow-reactor used for thermo-photocatalytic runs. Fig. 1 Fig. 2 HAADF images for Cu3P90 (upper panel) and Cu5P90 (lower panel) systems. Fig. 2 Fig. 3 a) DRS spectra for Cu/TiO2 systems; b) Difference spectra of different Cu/TiO2 samples with respect to bare TiO2. Fig. 3 Fig. 4 a) H2-TPR profiles (inset shows the deconvolution analysis for Cu5P90 TPR), b) evolution of different Cu species with content; and c) calculated Cu content from H2 consumption for Cu/TiO2 systems. Fig. 4 Fig. 5 a) XPS Cu 2p spectra and b) surface Cu/Ti ratios for Cu/TiO2 systems from XPS analysis. Fig. 5 Fig. 6 a) H2 production and b) Photonic Efficiencies (AQE and AQE syn ) for Cu/TiO2 systems after 4 h of reaction. Fig. 6 Fig. 7 CO Selectivity during the gas-phase methanol thermo-photocatalytic reforming using Cu/TiO2 after 4 h of reaction. Fig. 7 Fig. 8 In situ DRIFTS spectra of Cu/TiO2 systems under methanol steam at different reaction conditions. Fig. 8 Table 1 XPS analysis for Cu/TiO2 systems. Table 1 Surface at% I sat / I Cu 2 p 3 / 2 Cu/Ti ratio Cu+/Cu0 Cu2+ Cu2P90 81 19 0.12 0.110 T200 70 30 0.109 TP200 77 23 0.114 Cu3P90 82 18 0.12 0.148 Cu4P90 59 41 0.25 0.192 Cu5P90 65 35 0.19 0.247 Table 2 Rates for the H2 photoreforming under different conditions. Table 2 Catalysts Reforming rate (mmol/h·g) @ 4 h 50 ºC T 200ºC TP 200ºC Cu1P90 2.2 1.4 8.0 Cu2P90 Image 1 3.7 8.7 Cu3P90 2.8 6.1 12.2 Cu4P90 2.1 6.9 Image 2 Cu5P90 1.9 8.3 14.0 Tuning the co-catalyst loading for the optimization of thermo-photocatalytic hydrogen production over Cu/TiO2 F. Platero Methodology Investigation Writing – original draft A. Caballero Conceptualization Methodology Supervision Colon G. Colón Conceptualization Methodology Writing – original draft Writing – review & editing Supervision ⁎ Instituto de Ciencia de Materiales de Sevilla, Centro Mixto Universidad de Sevilla-CSIC, Américo Vespucio s/n., 41092 Sevilla, Spain Instituto de Ciencia de Materiales de Sevilla, Centro Mixto Universidad de Sevilla-CSIC Américo Vespucio s/n Sevilla 41092 Spain Instituto de Ciencia de Materiales de Sevilla. Centro Mixto Universidad de Sevilla-CSIC. Américo Vespucio s/n. 41092 Sevilla. Spain ⁎ corresponding author. We have optimized the H2 production by methanol thermo-photocatalytic reforming in the gas phase using Cu/TiO2 catalyst by tuning metal loading. Metal co-catalyst has been deposited by means of chemical reduction deposition. We have stated that thermo- and thermo-photocatalytic process leads to a notable H2 production at 200 ºC. By in-situ FTIR studies we evidenced that formate formation follows a different evolution depending on the reforming experiment. These surface formate would lead to CO formation through dehydration reaction. At higher Cu content the low CO selectivity denote that water-gas-shift reaction would predominate and exalt H2 yield. Thus, different optimum Cu content is found for each reforming experiment. While for the photocatalytic reforming Cu/TiO2 (2 wt%) is the best catalyst of the series, we should increase the Cu content to Cu/TiO2 (5 wt%) to achieve the optimum performance for thermo-photocatalytic reforming of methanol. Graphical Abstract ga1 Keywords Thermo-photocatalysis Gas-phase Hydrogen Cu-TiO2. Water-gas-shift Data Availability Data will be made available on request. 1 Introduction It is widely accepted that hydrogen, a clean and sustainable energy vector, is considered the ideal alternative of fossil fuels. Within the actual framework of the socioeconomical and environmental situation, green hydrogen will play a crucial role for a clean energy transition process [1]. Since many years, photocatalytic water splitting towards hydrogen evolution has attracted numerous attentions because of its green sustainability [2,3]. In spite of the huge efforts to generate hydrogen via powder-based solar water-splitting systems to date have unfortunately fallen short of the efficiency values required for large scale plants [4,5]. The challenge is to develop stable and efficient catalysts that can harvest solar light, using co-catalyst alternative to precious materials that would allow the scale-up and practical applications [6,7]. In this sense, promising studies at pilot plant scale have been recently reported [8–11]. Within this frame, green H2 production from alcohol photocatalytic reforming reaction appears as a hot topic in the field of photocatalysis [12,13]. From the enormous literature on this field, TiO2 based systems have provided the best performances [14]. However, some factors such as rapid recombination, the occurrence of backward reaction or even the deactivation by the formed intermediates hindered the development of H2 production at large scale [15]. The use of metal co-catalysts, used as charge trapping sites, have demonstrated necessary in order to enhance the efficiency of the photocatalytic reaction by avoiding the electron–hole recombination processes [16–18]. It has been found that the addition of these noble metals could have different effects on the photocatalytic activity which is also strongly affected not only by the nature of metal but also by other parameters from sample history and metal features [19]. Alternatively to noble metals, copper-based catalysts have been extensively considered as a cheaper option [13,20–23]. In addition to this traditional strategy, the combination of heat and light has been recently suggested as a novel approach pursuing the improving efficiency of the photocatalytic process [24–26]. Thus, by the combination of classical thermo- and photo-catalytic processes, interesting synergistic effects have been reported that drastically enhances the hydrogen production through photoreforming reaction [25]. Due to the mechanistic complexity of this multicatalytic approach, which would involve different simultaneous reactions, the origin of this cooperative effect is still unclear. In principle, the synergistic improvement would be conditioned by the primary importance of single thermo- and photo- contributions on the kinetic behavior and reaction mechanism [27,28]. Moreover, most of the reported results do not cover the influence of the co-catalyst loading on such complex mechanism and the catalytic performance [27,28]. In the present paper we present an interesting study on methanol reforming through a multicatalytic approach, by combining heating and photonic excitation. For this scope, we use a Cu/TiO2 system with different Cu loading that could serve to explore how the mechanism is influenced by metal content and therefore condition the overall reaction performance. 2 Experimental 2.1 Catalysts preparation and characterisation TiO2 (Evonik P90) was used as photoactive support (Table 1 in Supporting Information). TiO2 Evonik P90 exhibits higher surface area than widely used Evonik P25. Since the aim of this study is to see the effect of the amount of Cu loading on the catalytic activity, we decided to use this high surface area anatase to avoid the effect of metal agglomeration at increasing contents. Metal loading was performed through chemical reduction deposition procedure using copper nitrate as metal source. In this case, 0.5 g of support was suspended in 100 mL of water containing the stoichiometric amount of Cu precursor for a nominal loading between 1.0 and 5.0 wt%. Chemical reduction of metal precursor was achieved by using NaBH4 as reducing agent. After adding the reducing agent at certain excess (1:20 molar ratio with respect to Cu), the suspension was stirred at room temperature for 30 min. The effectiveness of the deposition was always checked by adding more NaBH4 to the filtrated liquid. We did not appreciate in any case any turbidity or color changes due to the presence of Cu. The obtained systems were filtered, thoroughly washed with distilled water and finally dried at 90 ºC. As prepared catalysts were labeled as CunP90, being n the nominal metal loading. BET surface area measurements were carried out by N2 adsorption using a Micromeritics 2000 instrument. X-ray diffraction (XRD) patterns were obtained using a Siemens D-501 diffractometer with Ni filter and graphite monochromator, using the Cu Kα radiation as X-ray source., We have calculated the anatase fraction as well the mean crystallite size by Rietveld fitting using HighScore-Plus software, using the line broadening of corresponding diffraction peaks. Diffuse reflectance UV–vis spectroscopy was performed using a Cary 300 instrument. Spectra were recorded in the diffuse reflectance mode using Spectralon® as white standard. Scans range was 240–800 nm. XPS data were recorded on pellets using a customized system incorporating a hemispherical analyser (SPECS Phoibos 100), a non-monochromatized X-ray source (Al Kα; 1486.6 eV, Mg Kα, 1253.6 eV). The analyser was operated at a fixed transmission and 50 eV pass energy with an energy step of 0.1 eV. Binding energies were calibrated using C 1 s (284.6 eV) as an internal reference. Prior to each analysis, the samples were evacuated to 10−9 mbar at room temperature. In a typical experiment, the sample was initially placed in the sample holder and transferred to the spectrometer chamber where XPS spectra were acquired. In-situ FTIR studies were performed in a Harricks praying mantis cell. The spectra were recorded on a Nicolet FT-IR spectrometer at reaction conditions with a resolution of 4 cm−1. Before reaction, catalysts were pretreated in N2 at 50 ºC for 30 min Temperature programmed reduction (H2-TPR) was performed using a Chemstar instrument (Quantachrome). About 30 mg of the catalysts previously degassed at 50 °C for 30 min under Ar flow. The TPR spectra were collected in 10 mL/min mixture of 5% H2/Ar from 50 ºC to 700 °C with a heating rate of 10 °C/min. Transmission electron microscopy were performed by using a FEI Tecnai F30 microscope in STEM mode operated at 300 kV equipped with a Gatan GIF Quantum 963 energy filter. The samples were directly dropped on a nickel grid. 2.2 Photocatalytic runs Gas phase photocatalytic H2 production tests were performed in a flow cell ( Fig. 1). The powder photocatalysts (50 mg) were placed in the cell and then degassed with N2 at 50 ºC. Methanol steam flow (CH3OH = 20% v/v) at 15 mL/min was passed through the sample for 60 min before reaction. After which, the lamp (200 W lamp housing) was switched on and the sample was illuminated through the quartz top-window of the cell. Effluent gases were analysed to quantify H2 production by gas chromatography (Agilent microGC) using a thermal conductivity detector. Only CO and CO2 were detected as side products. CO selectivity (S CO ) were calculated by considering all products detected: S CO % = CO ( H 2 + CO + CO 2 ) × 100 Thermo-photocatalytic runs were performed at 200 ºC. As we have evidenced in a previous study, at this temperature the synergistic effect for thermo-photocatalytic process is maximum [29]. As reference, thermo-catalytic runs were performed in the absence of light under similar reaction conditions. The apparent quantum efficiency for the H2 evolution reaction has been determined from the reaction rate and the flux of incoming photons (calculated for the irradiation wavelengths of 365 nm) [20,30]. AQE = rate mol · s − 1 rate of incident photons mol · s − 1 The synergetic effect of the thermal contribution on thermo-photocatalytic process was evaluated by considering the difference rate with single process rates [31]. rate syn = rate thermo − photo − rate photo + rate thermo From this rate syn value we have calculated the synergetic efficiency (AQE syn ) which specifically accounts the efficiency attributable to the synergy of both thermo- and photo-catalytic processes. 3 Results and discussions 3.1 Copper features study with metal content Copper deposition over TiO2 by chemical reduction leads to well dispersed Cu nanoparticles over the range of studied systems. As it can be observed from STEM images ( Fig. 2), homogeneous dispersion of Cu nanoparticles of ca. 2 nm is obtained. Moreover, no aggregation of Cu clusters is noticed as metal loading increases. From diffuse reflectance spectra ( Fig. 3), important absorption bands can be found at 350–450 nm and 750 nm that can be attributed to Cu clusters at the surface. These new bands progressively increase as copper loading increases, specially bands at 410 nm and 750 nm. Thus, bands within the range 350–450 nm have been ascribed to (Cu–O–Cu)2+ clusters in a highly dispersed state as well as to three-dimensional Cu1+ clusters. [32,33] On the other hand, the band at 750–850 nm has been assigned to 2 E g → 2 T 2 g transitions of Cu2+ located in the distorted or perfect octahedral symmetry. [34] From these results, we could expect that Cu species would consist on highly dispersed CuO and surface doped Cu2+/1+. Both bands progress similarly as metal content increases (Fig. 3 .b). Reduction profile also denotes the evolution of copper clusters as loading increases ( Fig. 4). In all cases a single TPR peak ca. 180 ºC is found for all catalysts. This is a rather lower reduction temperature compared with values reported in the literature, and would be attributed to highly dispersed CuO species at the nanoscale. [35–37] Moreover, from the deconvolution of TPR peaks it is possible to envisage four Cu species, denoted as α to δ. The presence of different reduction peaks in the TPR profile of oxide-supported Cu samples has been extensively reported. [38,39] Thus, it is accepted that large and crystallized CuO particles would be reduced at higher temperature than smaller CuO clusters or highly dispersed Cu2+ species in strong interaction with the oxide support. [40,41] In our case, the reduction temperature around 180 ºC clearly points out the absence of bulk CuO, as was stated above from TEM images. For all samples, species reduced at slightly higher temperature (γ + δ) are prominent. However, as metal loading increases, low reduction temperature species (α + β) become more evident (Fig. 4 .b). Such low reduction temperature species would be associated to finely disperse copper species as support Cu2+ doped and would be hardly detected from TEM analysis. So, only small CuO nanoclusters are noticed. Therefore, for higher Cu content catalyst, Cu species distribution seems to be composed equally by small finely disperse CuO nanoclusters and surface doped Cu2+ species. Quantitative analysis from H2 consumption clearly denotes the efficiency of deposition method. The amount of reduced Cu follows a clear linear evolution being in all cases close to the nominal values (Fig. 4.c). From XPS analysis, the observed broad peaks as well as the presence of a shake-up satellite would denote the coexistence of Cu2+ and Cu+/Cu species ( Fig. 5 .a). Thus, peaks at 932.0 eV and 951.9 eV would correspond to Cu 2p 3/2 and Cu 2p 1/2 spin-orbit split of Cu/Cu2O species. [42] On the other hand, a second contribution at 934.2 eV and 954.1 eV with satellite shakeup at ca. 942 eV, in all the synthesized products should correspond to CuO species. It is also worthy to mention that for lower Cu contents, partially reduced fraction seems to be slightly higher ( Table 1). This fact could be explaining considering a higher dispersion in these samples. Such low dimensional CuO clusters should be easily reduced under XPS conditions. In agreement with TPR analysis, the surface Cu/Ti ratios calculated from XPS signals also follows a linear progression with nominal values, indicating the homogeneous distribution of Cu species over TiO2 surface even at large metal loadings (Fig. 5.b). The Cu/Ti ratios obtained for samples after thermo-catalytic or thermo-photocatalytic runs at 200 ºC do not show a significant variation from fresh sample (Table 1). Therefore, no aggregation should be expected after reaction by effect of temperature. Moreover, as Cu content increases the ratio of oxidized Cu seems to be slightly increased (Table 1), similarly as α + β family evolution from TPR experiment. This can be also observed from satellite relative intensity (I sat /I Cu2p3/2 ), showing the highest value for Cu4P90 catalyst. Indeed, α + β family has been previously associated to small CuO nanoclusters. The higher partial reduced fraction in low Cu content catalysts could therefore be ascribed to highly disperse Cu2+ entities (γ + δ species) that would easily reduce under XPS conditions. 3.2 Thermo-photocatalytic performance of Cu/TiO2 system Fig. 6 shows the H2 production rates and apparent efficiencies and H2 yields of Cu/TiO2 P90 systems. Thus, the obtained rates for photo-, thermo-, and thermo-photocatalytic runs under UV–vis light illumination for 4 h are summarized in Table 2. As it can be observed, the performance for thermo-photocatalytic H2 production are notably higher in all cases with respect to single thermo- and photocatalytic processes (Fig. S1). The apparent quantum efficiencies denote that for photocatalytic performance the maximum value is attained for Cu2P90 catalyst, showing an H2 production of 12 mmol/h·g after 4 h (Fig. 6 .a). A higher Cu loading negatively affects to the photoreforming activity. In principle, the higher photoactivity exhibited by Cu2P90 would be associated to the finely dispersion and stronger interaction with support observed from TPR. [43] As metal loading increases, recombination processes would hinder the photocatalytic performance. It can be also stated that thermo-catalytic process also leads to significant production of H2. As we already discussed, H2 formation under these conditions could be explained considering methanol thermal decomposition (Eq. i) [44,45]. Eq. i C H 3 OH → 2 H 2 + CO ⁢ methanol decomposition In this case, AQE values lineally increases in the whole range of Cu content, reaching an H2 yield of ca 30 mmol/h·g for Cu5P90 catalyst (Fig. 6.a). Therefore, in this case and within the range of metal content studied, thermo-catalytic activity is clearly favoured by the increasing surface Cu over TiO2. Finally, the combined thermo-photoreforming leads to notable values of efficiency, with a maximum yield of ca. 60 mmol/h·g also for Cu5P90 catalyst. However, in this case the photocatalytic performance of Cu5P90 is close to that exhibited by Cu4P90 denoting certain exhausting effect in the thermo-photocatalytic activity with increasing metal loading. Thus, at this Cu loading the optimum metal content could be considered. (Fig. 6.a). Since calculated rate syn always show positive values, the combined process cannot be explained as the sum of both single ones, and a certain synergistic effect can be envisaged for all catalysts. Moreover, the calculated AQE syn clearly denote that the combination of thermo- and photo- processes notably affects to the overall reaction performance and appear clearly affected by metal loading (Fig. 6.b). In this sense, it is also interesting to highlight the evolution of the synergy with Cu loading (Fig. 6.b). For the lowest Cu content, since the photocatalytic performance is rather low, thermal contribution appears important. Minimum AQE syn is found for Cu2P90, for which the photocatalytic performance is maximum. Thermal-photocatalytic synergy reaches a minimum for Cu2P90 catalyst, for which photocatalytic performance is maximum and thermo-catalytic activity is still low. Catalysts with metal contents higher than 2 showed outstanding thermo-photocatalytic AQE that progressively increases with Cu content. However, though thermal reforming lineally grows with Cu, a maximum in the AQE syn is found for Cu4P90 catalysts. This fact would point out a process that would hinder the thermo-photocatalytic performance for Cu5P90. In order to understand the evolution showed by AQE and AQE syn in different studied photoreforming processes, we followed CO and CO2 as interesting intermediates from side reactions that would simultaneously take place ( Fig. 7). Thus, CO can be derived from side reactions that would proceed simultaneously with photoreforming; that is, methanol decomposition as well as formic acid dehydration (Eqs. i and ii) [45]. Eq. ii HCOOH → H 2 O + CO formic acid dehydration From the evolution of CO selectivity, the single photocatalytic process clearly denotes a concomitant formation of CO. The observed CO formation progressively decreases as Cu loading increases. For the thermocatalytic process, low amounts of copper do not lead to CO formation, starting at Cu loading higher than 2 wt%. It is worthy to notice that the combine thermo-photocatalytic process shows a similar trend as photocatalytic one, but with much lower CO selectivity. Thus, for higher Cu loading S CO values are similar to that obtained by thermocatalysis. The marked lower S CO values attained for thermo- and thermo-photocatalytic processes would denote an important CO consumption (probably associated with a higher H2 yield). Thus, two probable processes could be involved to explain the lower CO formation and higher H2 production. On one hand, formic acid dehydrogenation as alternative way to decompose formic acid instead of dehydration; and water gas shift reactions (Eqs. iii and iv). Indeed, the occurrence of water-gas-shift reaction has been previously argued within H2 photoreforming reaction [29,44]. Eq. iii HCOOH → H 2 + C O 2 dehydrogenation Eq. iv CO + H 2 O → H 2 + C O 2 water gas shift ( WGS ) We may also point out that the presence of CO during photoreforming reaction would probably affect to the photocatalytic activity during the reaction time by CO poisoning of the metal active sites [46,47]. 3.3 In-situ FTIR analysis of thermo-photocatalytic reaction In Fig. 8 we depict the FTIR spectra during in-situ photoreforming reaction. From these spectra, two important regions can be envisaged. In the higher wavenumber region, C–H stretching modes can be found. Thus, C–H contributions at 2920/2820 cm−1 have been associated to metoxy species [45,48]. The appearance of these bands is accompanied by a negative broad peak at around 3620 cm–1 due to the disappearance of surface hydroxyl groups through the dissociative adsorption of methanol. As described in the literature, the C–O stretching region located in the region 1800–700 cm–1 also shows the characteristics bands associated to methanol. Thus, at room temperature it can be notice a sharp band at around 1060 and 1135 cm–1 that can be ascribed to C–O stretching modes of methoxy group. The evolution of bands in this region during different experimental conditions is similar for all catalysts, varying the relative intensity of certain bands. Thus, during photocatalytic experiment at 50 ºC, new intense bands appear within this region at 1580 cm–1 and 1360 cm–1. These new bands can be ascribed respectively to the υas(COO) and υs(COO) for bidentate formate ions adsorbed on TiO2 surface. The intensity of these bands remains almost similar as Cu loading increases for Cu contents higher than 2 wt% (Fig. S2). It is worthy to mention that these bands do not appear during thermal treatment. In this case, only the band at 1135 cm–1 seems to be exalted (Fig. S2). Concerning the thermo-photocatalytic process, as temperature increases, bands associated to formates become notably marked. However, at 200 ºC these bands completely disappear. At 120 ºC, such bands are noticeable, showing exponential growing intensities as Cu content increases (Fig. S2). Therefore, the formation of formates seems to be clearly favoured by the increasing metal sites. As previously stated, the presence of formates would determine the different evolution of CO.[29] Thus, for photocatalytic runs we have already showed that S CO values were particularly lower with respect to those found for thermo- and thermo-photocatalytic experiments (Fig. 8). These two facts can be correlated by considering formic acid dehydration reaction which leads to the formation of CO and H2O. As above discussed, during thermo-photocatalytic experiment, at moderate temperatures the formation of formates was exalted and increases with Cu content. It is clear that formate formation is favoured by temperature. The absence of formate bands at reaction temperature clearly indicates that they were completely transformed into CO through dehydration. At the same time, we have also stated that S CO drastically decays. Therefore, during thermo-catalytic reforming at 200 ºC the outstanding H2 formation can be ascribable to the enhanced transformation of methanol into formate which proceed to CO and then through WGS reaction to H2 formation. From both facts it would be inferred that WGS reaction is playing an important role. In this sense, the higher the Cu load, the more important the WGS reaction becomes in the overall process. Thus, it can be argued that the efficiency of the thermo-photocatalytic reaction over Cu/TiO2 systems would be improved with Cu loading. Thus, the different optimum Cu loading attained for photocatalytic and thermo-photocatalytic reforming was conditioned by the thermal contribution through WGS reaction. From these results, it seems that this later process would be favoured by increasing Cu loadings. Thus, while for photocatalytic reforming Cu2P90 showed the optimum value, for the combined thermo-photocatalytic process Cu5P90 would be the best catalyst. Therefore, we evidenced a clear dependency of the mechanism on the metal content. Moreover, as we stated from TPR and XPS Cu species present in each case is different. Thus, while for Cu2P90 Cu2+ with strong interaction with support are the predominant, for Cu5P90 CuO dispersed nanoclusters would be also present. The influence of cluster size on the photocatalytic performance of H2 photoreforming was studied by Zheng et al. which stated that small clusters usually possess higher charge separation efficiency [49]. In this sense, Li et al. showed that through ligand assisted method, ultrafine size clusters of Cu species (with about 1 nm), dispersed on the surface of TiO2 were obtained [50]. These authors reported that the superior H2 evolution performance of CuO/TiO2 mainly originates from the cluster size and unique interfacial structure formed. On the other hand, CuO clusters modulated in the range 4–8 nm by controlling the loading amount of Cu and calcining temperature were obtained for photocatalytic WGS reaction [51]. Therefore, it is clear that different process would require not only a particular metal loading but also an optimum cluster size. Moreover, different copper species distribution could be also correlated with the better performance as temperature increases. 4 Conclusions Copper supported TiO2 with different metal loadings was used as catalyst for the gas phase methanol thermal photoreforming. From the wide characterization of the catalyst, we have shown that copper metal co-catalyst has been efficiently deposited and well dispersed on the support surface within the studied range of metal loading. We have stated the important synergistic effect in the thermal-photocatalytic reaction. Thus, ca 60 mmol/h·gcat was obtained after 4 h at 200 ºC upon illumination. Different optimum metal loading can be envisaged for different methanol reforming experiments. Moreover, as increasing metal loading, the nature of Cu species seems to be modified, subsequently conditioning the catalytic performance. Thus, while for the photocatalytic reforming Cu2P90 was the best catalyst, the thermo-catalytic reforming performance follows a lineal evolution with Cu content in the range of the studied metal content. For thermo-photocatalytic reforming, the optimum value would be Cu5P90 for which the synergistic improvement started to decay. During thermo-photocatalytic reaction different thermo- and photo-processes are involved, resulting in different optimal catalyst formulation. We have shown that while for photocatalytic reaction low co-catalyst loading leads to the better performance, for thermo-photocatalytic process higher loading is needed. These results clearly highlight the necessity of metal loading optimization due to the occurrence of different catalytic mechanism that simultaneously takes place during the thermo-photocatalytic reaction. CRediT authorship contribution statement F. Platero: Methodology, Investigation, Writing – original draft. A. Caballero: Conceptualization, Methodology, Supervision. G. Colón: Conceptualization, Methodology, Writing – original draft, Writing – review & editing, Supervision. Declaration of Competing Interest The authors declare that they have no known competing financial interests or personal relationships that could have appeared to influence the work reported in this paper. Acknowledgments Authors acknowledge the financial support from the EU FEDER and Junta de Andalucía under I+D+i Project P20-00156. We also acknowledge the financial support from PID2020-119946RB-I00 project funded by MCIN/AEI/ 10.13039/501100011033 and, as appropriate, by “ERDF A way of making Europe”, by the “European Union”. Appendix A Supporting information Supplementary data associated with this article can be found in the online version at doi:10.1016/j.apcata.2022.118804. Appendix A Supplementary material Supplementary material . References [1] S. Wu N. Salmon M.M.J. Li R. Bañares-Alcántara S.C.E. Tsang Energy decarbonization via green H2 or NH3? ACS Energy Lett. 7 2022 1021 1033 S. Wu, N. Salmon, M.M.J. Li, R. Bañares-Alcántara, S.C.E. Tsang, Energy Decarbonization via Green H2 or NH3? ACS Energy Lett. 7, (2022), pp. 1021–1033. [2] Q. Wang K. Domen Particulate photocatalysts for light-driven water splitting: mechanisms, challenges, and design strategies Chem. Rev. 120 2020 919 985 Q. Wang, K. Domen, Particulate Photocatalysts for Light-Driven Water Splitting: Mechanisms, Challenges, and Design Strategies, Chem. Rev. 120, (2020), pp. 919–985. [3] W.H. Chen J.E. Lee S.H. Jang S.S. Lam G.H. Rhee K.J. Jeon M. Hussain Y.K. Park A review on the visible light active modified photocatalysts for water splitting for hydrogen production Int. J. Energy Res. 46 2022 5467 5477 W.H. Chen, J.E. Lee, S.H. Jang, S.S. Lam, G.H. Rhee, K.J. Jeon, M. Hussain, Y.K. Park, A review on the visible light active modified photocatalysts for water splitting for hydrogen production. Int. J. Energy Res. 46, (2022) pp. 5467–5477. [4] C. Konstantinos P. Fornasiero Photocatalytic hydrogen production: a rift into the future energy supply ChemCatChem 9 2017 1523 1544 C. Konstantinos, P. Fornasiero, Photocatalytic Hydrogen Production: A Rift into the Future Energy Supply. ChemCatChem 9, (2017), pp. 1523 – 1544. [5] N. Skillen H. Daly L. Lan M. Aljohani C.W.J. Murnaghan X. Fan C. Hardacre G.N. Sheldrake P.K.J. Robertson Photocatalytic reforming of biomass: what role will the technology play in future energy systems Top. Curr. Chem. 380 2022 33 N. Skillen, H. Daly, L. Lan, M. Aljohani, C.W.J. Murnaghan, X. Fan, C. Hardacre, G.N. Sheldrake, P.K.J. Robertson, Photocatalytic Reforming of Biomass: What Role Will the Technology Play in Future Energy Systems. Top. Curr. Chem. 380, (2022), 33. [6] L. Clarizia G. Vitiello G. Luciani I. Somma R. Andreozzi R. Marotta Hydrogen generation through solar photocatalytic processes: a review of the configuration and the properties of effective metal-based semiconductor nanomaterials Appl. Catal. A: Gen. 518 2016 142 149 L. Clarizia, G. Vitiello, G. Luciani, I. Somma, R. Andreozzi, R. Marotta, Hydrogen Generation through Solar Photocatalytic Processes: A Review of the Configuration and the Properties of Effective Metal-Based Semiconductor Nanomaterials. Appl. Catal. A: Gen. 518, (2016), pp. 142 – 149. [7] D.S.M. Constantino M.M. Dias A.M.T. Silva J.L. Faria C.G. Silva Intensification strategies for improving the performance of photocatalytic processes: a review J. Clean. Prod. 34015 2022 130800 D.S.M. Constantino, M.M. Dias, A.M.T. Silva, J.L. Faria, C.G. Silva, Intensification strategies for improving the performance of photocatalytic processes: A review. J. Clean. Prod., 34015, (2022), 130800. [8] M.I. Maldonado A. López-Martín G. Colón J. Peral J.I. Martínez-Costa S. Malato Solar pilot plant scale hydrogen generation by irradiation of Cu/TiO2 composites in presence of sacrificial electron donors Appl. Catal. B Environ. 229 2018 15 23 M.I. Maldonado, A. López-Martín, G. Colón, J. Peral, J.I. Martínez-Costa, S. Malato, Solar pilot plant scale hydrogen generation by irradiation of Cu/TiO2 composites in presence of sacrificial electron donors. Appl. Catal. B: Environ. 229, (2018), pp. 15–23. [9] S.Y. Toledo-Camacho A. Rey M.I. Maldonado J. Llorca S. Contreras F. Medina Photocatalytic hydrogen production from water-methanol and -glycerol mixtures using Pd/TiO2(-WO3) catalysts and validation in a solar pilot plant Int. J. Hydrog. Energy 46 2021 36152 36166 S.Y. Toledo-Camacho, A. Rey, M.I. Maldonado, J. Llorca, S. Contreras, F. Medina, Photocatalytic hydrogen production from water-methanol and -glycerol mixtures using Pd/TiO2(-WO3) catalysts and validation in a solar pilot plant. Int. J. Hydrogen Ener. 46, (2021), pp. 36152 – 36166. [10] H. Nishiyama T. Yamada M. Nakabayashi Y. Maehara M. Yamaguchi Y. Kuromiya Y. Nagatsuma H. Tokudome S. Akiyama T. Watanabe R. Narushima S. Okunaka N. Shibata T. Takata T. Hisatomi K. Domen Photocatalytic solar hydrogen production from water on a 100-m2 scale Nature 598 2021 304 307 H. Nishiyama, T. Yamada, M. Nakabayashi, Y. Maehara, M. Yamaguchi, Y. Kuromiya, Y. Nagatsuma, H. Tokudome, S. Akiyama, T. Watanabe, R. Narushima, S. Okunaka, N. Shibata, T. Takata, T. Hisatomi, K. Domen, Photocatalytic solar hydrogen production from water on a 100-m2 scale. Nature 598, (2021), pp. 304–307. [11] A. Ruiz-Aguirre, J.G. Villachica-Llamosas, M.I. Polo, A. Cabrera-Reina, G. Colón, J. Peral, S. Malato, Assessment of Solar Photocatalytic Hydrogen Generation through Pilot Plant Scale Multiple Approaches: Valorisation, Water Decontamination and Disinfection. Energy (submitted). [12] A. Kubacka M. Fernández-García G. Colón Advanced nanoarchitectures for solar photocatalytic applications Chem. Rev. 112 2012 1555 1614 A. Kubacka, M. Fernández-García, G. Colón, Advanced Nanoarchitectures for Solar Photocatalytic Applications. Chem. Rev. 112, (2012), pp. 1555–1614. [13] K.C. Christoforidis P. Fornasiero Photocatalysis for hydrogen production and CO2 reduction: the case of copper-catalysts ChemCatChem 2019 2019 368 382 K.C. Christoforidis, P. Fornasiero, Photocatalysis for Hydrogen Production and CO2 Reduction: The Case of Copper-Catalysts. ChemCatChem 2019, (2019) pp. 368 – 382. [14] G. Colón Towards the hydrogen production by photocatalysis Appl. Catal. A Gen. 518 2016 48 59 G. Colón, Towards the hydrogen production by photocatalysis. Appl. Catal. A: Gen. 518, (2016), pp. 48–59 [15] H. Wang L. Zhang Z. Chen J. Hu S. Li Z. Wang J. Liu X. Wang Semiconductor heterojunction photocatalysts: design, construction, and photocatalytic performances Chem. Soc. Rev. 43 2014 5234 52447 H. Wang, L. Zhang, Z. Chen, J. Hu, S. Li, Z. Wang, J. Liu, X. Wang, Semiconductor heterojunction photocatalysts: Design, construction, and photocatalytic performances. Chem. Soc. Rev. 43, (2014) pp. 5234 – 52447. [16] M. Serra J. Albero H. García Photocatalytic activity of Au/TiO2 photocatalysts for H2 evolution: role of the Au nanoparticles as a function of the irradiation wavelength ChemPhysChem 16 2015 1842 1845 M. Serra, J. Albero, H. García, Photocatalytic Activity of Au/TiO2 Photocatalysts for H2 Evolution: Role of the Au Nanoparticles as a Function of the Irradiation Wavelength. ChemPhysChem 16, (2015), pp. 1842–1845. [17] Z.H.N. Al-Azri M. Aloufi A. Chan G.I.N. Waterhouse H. Idriss Metal particle size effects on the photocatalytic hydrogen ion reduction ACS Catal. 9 2019 3946 3958 Z.H.N. Al-Azri, M. Aloufi, A. Chan, A. G.I.N. Waterhouse, H. Idriss, Metal Particle Size Effects on the Photocatalytic Hydrogen Ion Reduction. ACS Catal., 9, (2019), pp. 3946–3958. [18] F. Platero A. López-Martín A. Caballero T.C. Rojas M. Nolan G. Colón Overcoming Pd−TiO2 deactivation during H2 production from photoreforming using Cu@Pd nanoparticles supported on TiO2 ACS Appl. Nano Mater. 4 2021 3204 3219 F. Platero, A. López-Martín, A. Caballero, T.C. Rojas, M. Nolan, and G. Colón, Overcoming Pd−TiO2 Deactivation during H2 Production from Photoreforming Using Cu@Pd Nanoparticles Supported on TiO2. ACS Appl. Nano Mater. 4, (2021), pp. 3204–3219. [19] B. Mei K. Han G. Mul Driving surface redox reactions in heterogeneous photocatalysis: the active state of illuminated semiconductor-supported nanoparticles during overall water-splitting ACS Catal. 8 2018 9154 9164 B. Mei, K. Han, G. Mul, Driving Surface Redox Reactions in Heterogeneous Photocatalysis: The Active State of Illuminated Semiconductor-Supported Nanoparticles during Overall Water-Splitting. ACS Catal. 8, (2018), pp. 9154–9164. [20] J.M. Valero S. Obregón G. Colón Active site considerations on the photocatalytic H2 evolution performance of Cu-doped TiO2 obtained by different doping methods ACS Catal. 4 2014 3320 3329 J.M. Valero, S. Obregón, G. Colón, Active Site Considerations on the Photocatalytic H2 Evolution Performance of Cu-Doped TiO2 Obtained by Different Doping Methods. ACS Catal. 4, (2014), pp. 3320−3329. [21] V. Kumaravel S. Mathew J. Bartlett S.C. Pillai Photocatalytic hydrogen production using metal doped TiO2: a review of recent advances Appl. Catal. B: Environ. 5 2019 1021 1064 V. Kumaravel, S. Mathew, J. Bartlett, S.C. Pillai, Photocatalytic hydrogen production using metal doped TiO2: A review of recent advances. Appl. Catal. B: Environ. 5, (2019), pp. 1021–1064. [22] J.S. Schubert L. Kalantari A. Lechner A. Giesriegl S.P. Nandan P. Alaya S. Kashiwaya M. Sauer A. Foelske J. Rosen P. Blaha A. Cherevan D. Eder Elucidating the formation and active state of Cu co-catalysts for photocatalytic hydrogen evolution J. Mater. Chem. A 9 2021 21958 21971 J.S. Schubert, L. Kalantari, A. Lechner, A. Giesriegl, S.P. Nandan, P. Alaya, S. Kashiwaya, M. Sauer, A. Foelske, J. Rosen, P. Blaha, A. Cherevan, D. Eder, Elucidating the formation and active state of Cu co-catalysts for photocatalytic hydrogen evolution. J. Mater. Chem. A 9, (2021), pp. 21958–21971. [23] M. Haddad A. Belhadi L. Boudjellal M. Trari Photocatalytic hydrogen production on the heterojunction CuO/ZnO Int. J. Hydrog. Energy 46 2021 37556 37563 M. Haddad, A. Belhadi, L. Boudjellal, M. Trari, Photocatalytic hydrogen production on the heterojunction CuO/ZnO. Int. J. Hydrogen Ener. 46, (2021), pp. 37556 - 37563 [24] A. Caravaca H. Daly M. Smith A. Mills S. Chansai C. Hardacre Continuous flow gas phase photoreforming of methanol at elevated reaction temperatures sensitised by Pt/TiO2 React. Chem. Eng. 1 2016 649 657 A. Caravaca, H. Daly, M. Smith, A. Mills, S. Chansai, C. Hardacre, Continuous flow gas phase photoreforming of methanol at elevated reaction temperatures sensitised by Pt/TiO2. React. Chem. Eng. 1, (2016), pp. 649–657. [25] U. Caudillo-Flores G. Agostini C. Marini A. Kubacka M. Fernández-García Hydrogen thermo-photo production using Ru/TiO2: heat and light synergistic effects Appl. Catal. B: Environ. 256 2019 117790 U. Caudillo-Flores, G. Agostini, C. Marini, A. Kubacka, M. Fernández-García, Hydrogen thermo-photo production using Ru/TiO2: Heat and light synergistic effects. Appl. Catal. B: Environ. 256, (2019), 117790. [26] V. Nair M.J. Muñoz‐Batista M. Fernández‐García R. Luque J.C. Colmenares Thermo-photocatalysis: environmental and energy applications ChemSusChem 12 2019 2098 2116 V. Nair, M.J. Muñoz‐Batista, M. Fernández‐García, R. Luque, J.C. Colmenares, Thermo-Photocatalysis: Environmental and Energy Applications. ChemSusChem 12, (2019), pp. 2098 –2116. [27] I. Barba-Nieto N. Gómez-Cerezo A. Kubacka M. Fernández-García Oxide-based composites: applications in thermo-photocatalysis Catal. Sci. Technol. 11 2021 6904 6930 I. Barba-Nieto, N. Gómez-Cerezo, A. Kubacka, M. Fernández-García, Oxide-based composites: Applications in thermo-photocatalysis. Catal. Sci. Technol. 11, (2021), pp. 6904–6930. [28] Z. Wang Z. Yang Z. Yang R. Fang Y. Yan J. Ran L. Zhang A. State-of-the-art review on action mechanism of photothermal catalytic reduction of CO2 in full solar spectrum. Chem. Engineer J 4291 2022 132322 Z. Wang, Z. Yang, Z. Yang; R. Fang, Y. Yan, J. Ran, L. Zhang, A. State-of-the-art review on action mechanism of photothermal catalytic reduction of CO2 in full solar spectrum. Chem. Engineer. J. 4291, (2022), 132322. [29] A. López-Martín F. Platero A. Caballero G. Colón Thermo-photocatalytic methanol reforming for hydrogen production over a CuPd–TiO2 catalyst ChemPhotoChem 4 2020 1 9 A. López-Martín, F. Platero, A. Caballero, G. Colón, Thermo-Photocatalytic Methanol Reforming for Hydrogen Production over a CuPd–TiO2 Catalyst. ChemPhotoChem 4, (2020), pp. 1–9. [30] M. Qureshi K. Takanabe Insights on measuring and reporting heterogeneous photocatalysis: efficiency definitions and setup examples Chem. Mater. 29 2017 158 167 M. Qureshi, K. Takanabe, Insights on Measuring and Reporting Heterogeneous Photocatalysis: Efficiency Definitions and Setup Examples. Chem. Mater. 29, (2017), pp. 158−167. [31] U. Caudillo-Flores M.J. Muñoz-Batista M. Fernández-García A. Kubacka Bimetallic Pt-Pd co-catalyst Nb-doped TiO2 materials for H2 photo-production under UV and visible light illumination Appl. Catal. B Environ. 238 2018 533 545 U. Caudillo-Flores, M.J. Muñoz-Batista, M. Fernández-García, A. Kubacka, Bimetallic Pt-Pd co-catalyst Nb-doped TiO2 materials for H2 photo-production under UV and Visible light illumination. Appl. Catal. B: Environ. 238, (2018), pp. 533–545. [32] G. Colón M. Maicu M.C. Hidalgo J.A. Navío Cu-doped TiO2 systems with improved photocatalytic activity Appl. Catal. B Environ. 67 2006 41 51 G. Colón, M. Maicu, M.C. Hidalgo, J.A. Navío, Cu-doped TiO2 systems with improved photocatalytic activity. Appl. Catal. B: Environ. 67, (2006), pp. 41–51. [33] V. Polliotto S. Livraghi A. Krukowska M.V. Dozzi A. Zaleska-Medynska E. Selli E. Giamello Copper-modified TiO2 and ZrTiO4: Cu oxidation state evolution during photocatalytic hydrogen production ACS Appl. Mater. Interfaces 10 2018 27745 27756 V. Polliotto, S. Livraghi, A. Krukowska, M.V. Dozzi, A. Zaleska-Medynska, E. Selli, E. Giamello, Copper-Modified TiO2 and ZrTiO4: Cu Oxidation State Evolution during Photocatalytic Hydrogen Production. ACS Appl. Mater. Interfaces 10, (2018), pp. 27745–27756. [34] B. Li Y. Hao B. Zhang X. Shao L. Hu A multifunctional noble-metal-free catalyst of CuO/TiO2 hybrid nanofibers Appl. Catal. A Gen. 531 2017 1 12 B. Li, Y. Hao, B. Zhang, X. Shao, L. Hu, A multifunctional noble-metal-free catalyst of CuO/TiO2 hybrid nanofibers. Appl. Catal. A: Gen. 531, (2017), pp. 1–12. [35] M.K. Kumar K. Bhavani G. Naresh B. Srinivas A. Venugopal Plasmonic resonance nature of Ag-Cu/TiO2 photocatalyst under solar and artificial light: Synthesis, characterization and evaluation of H2O splitting activity Appl. Catal. B Environ. 199 2016 282 291 M.K. Kumar, K. Bhavani, G. Naresh, B. Srinivas, A. Venugopal, Plasmonic resonance nature of Ag-Cu/TiO2 photocatalyst under solar and artificial light: Synthesis, characterization and evaluation of H2O splitting activity. Appl. Catal. B: Environ. 199, (2016), pp. 282–291. [36] Q. Shi G. Ping X. Wang H. Xu J. Li J. Cui H. Abroshan H. Ding G. Li CuO/TiO2 heterojunction composites: an efficient photocatalyst for selective oxidation of methanol to methyl formate J. Mater. Chem. A 7 2019 2253 2260 Q. Shi, G. Ping, X. Wang, H. Xu, J. Li, J. Cui, H. Abroshan, H. Ding, G. Li, CuO/TiO2 heterojunction composites: an efficient photocatalyst for selective oxidation of methanol to methyl formate. J. Mater. Chem. A, 7, (2019), pp. 2253–2260. [37] M.K. Kumar G. Naresh V.V. Kumar B.S. Vasista B. Sasikumar A. Venugopal Improved H2 yields over Cu-Ni-TiO2 under solar light irradiation: behaviour of alloy nano particles on photocatalytic H2O splitting Appl. Catal. B Environ. 299 2021 120654 M.K. Kumar, G. Naresh, V.V. Kumar, B.S. Vasista, B. Sasikumar, A. Venugopal, Improved H2 yields over Cu-Ni-TiO2 under solar light irradiation: Behaviour of alloy nano particles on photocatalytic H2O splitting. Appl. Catal. B: Environ. 299, (2021), 120654. [38] M. Hinojosa-Reyes R. Camposeco-Solís R. Zanella V. Rodríguez González Hydrogen production by tailoring the brookite and Cu2O ratio of sol-gel Cu-TiO2 photocatalysts Chemosphere 184 2017 992 1002 M. Hinojosa-Reyes, R. Camposeco-Solís, R. Zanella, V. Rodríguez González, Hydrogen production by tailoring the brookite and Cu2O ratio of sol-gel Cu-TiO2 photocatalysts. Chemosphere 184, (2017), pp. 992–1002 [39] G. Cao N.A. Deskins N. Yi Carbon monoxide oxidation over copper and nitrogen modified titanium dioxide Appl. Catal. B Environ. 285 2021 119748 G. Cao, N.A. Deskins, N. Yi, Carbon monoxide oxidation over copper and nitrogen modified titanium dioxide. Appl. Catal. B: Environ. 285, (2021), 119748. [40] H. Xue T. Meng F. Liu X. Guo S. Wang D. Mao Enhanced resistance to calcium poisoning on Zr-modified Cu/ZSM-5 catalysts for the selective catalytic reduction of NO with NH3 RSC Adv. 9 2019 38477 38485 H. Xue, T. Meng, F. Liu, X. Guo, S. Wang, D. Mao, Enhanced resistance to calcium poisoning on Zr-modified Cu/ZSM-5 catalysts for the selective catalytic reduction of NO with NH3. RSC Adv. 9, (2019), pp. 38477–38485. [41] C. Li Y. Yang W. Ren J. Wang T. Zhu W. Xu Effect of Ce Doping on Catalytic Performance of Cu/TiO2 for CO Oxidation Catal. Lett. 150 2020 2045 2055 C. Li, Y. Yang, W. Ren, J. Wang, T. Zhu, W. Xu, Effect of Ce Doping on Catalytic Performance of Cu/TiO2 for CO Oxidation. Catal. Lett. 150, (2020), pp. 2045–2055. [42] M.E. Aguirre R. Zhou A.J. Eugene M.I. Guzman M.A. Grela Cu2O/TiO2 heterostructures for CO2 reduction through a direct Z-scheme: protecting Cu2O from photocorrosion Appl. Catal. B: Environ. 217 2017 485 493 M.E. Aguirre, R. Zhou, A.J. Eugene, M.I. Guzman, M.A. Grela, Cu2O/TiO2 heterostructures for CO2 reduction through a direct Z-scheme: Protecting Cu2O from photocorrosion. Appl. Catal. B: Environ. 217, (2017), pp. 485–493. [43] Y. Qi Z. Yang Y. Jiang H. Han T. Wu L. Wu J. Liu Z. Wang F. Wang Platinum−copper bimetallic nanoparticles supported on TiO2 as catalysts for photo−thermal catalytic toluene combustion ACS Appl. Nano Mater. 5 2022 1845 1854 Y. Qi, Z. Yang, Y. Jiang, H. Han, T. Wu, L. Wu, J. Liu, Z. Wang, F. Wang, Platinum−Copper Bimetallic Nanoparticles Supported on TiO2 as Catalysts for Photo−thermal Catalytic Toluene Combustion. ACS Appl. Nano Mater. 5, (2022), pp. 1845−1854. [44] S. Fang Z. Sun Y.H. Hu Insights into the thermo-photo catalytic production of hydrogen from water on a low-cost NiOx-loaded TiO2 catalyst ACS Catal. 9 2019 5047 50567 S. Fang, Z. Sun, Y.H. Hu, Insights into the Thermo-Photo Catalytic Production of Hydrogen from Water on a Low-Cost NiOx-Loaded TiO2 Catalyst. ACS Catal. 9, (2019), pp. 5047 – 50567. [45] F. Platero A. López-Martín A. Caballero G. Colón Mechanistic considerations on the H2 production by methanol thermal-assisted photocatalytic reforming over Cu/TiO2 catalyst ChemCatChem 13 2021 1 12 F. Platero, A. López-Martín, A. Caballero, G. Colón, Mechanistic Considerations on the H2 Production by Methanol Thermal-assisted Photocatalytic Reforming over Cu/TiO2 Catalyst. ChemCatChem 13, (2021), pp. 1–12. [46] Y.J. Zhang V. Sethuraman R. Michalsky A.A. Peterson Competition between CO2 reduction and H2 evolution on transition metal electrocatalysts ACS Catal. 4 2014 3742 3748 Y.J. Zhang, V. Sethuraman, R. Michalsky, A.A. Peterson, Competition between CO2 Reduction and H2 Evolution on Transition Metal Electrocatalysts. ACS Catal. 4, (2014), pp. 3742−3748. [47] W. Chen J. Cao W. Fu J. Zhang G. Qian J. Yang D. Chen X. Zhou W. Yuan X. Duan Molecular-level insights into the notorious CO poisoning of platinum catalyst Angew. Chem. Int. Ed. 61 2022 e202200190 W. Chen, J. Cao, W. Fu, J. Zhang, G. Qian, J. Yang, D. Chen, X. Zhou, W. Yuan, X. Duan, Molecular-Level Insights into the Notorious CO Poisoning of Platinum Catalyst. Angew. Chem. Int. Ed. 61, (2022), e202200190. [48] U. Caudillo-Flores I. Barba-Nieto M.J. Muñoz-Batista D. Motta-Meira M. Fernández-García A. Kubacka Thermo-photo production of hydrogen using ternary Pt-CeO2-TiO2 catalysts: a spectroscopic and mechanistic study Chem. Eng. J. 425 2021 130641 U. Caudillo-Flores, I. Barba-Nieto, M.J. Muñoz-Batista, D. Motta-Meira, M. Fernández-García, A. Kubacka, Thermo-photo production of hydrogen using ternary Pt-CeO2-TiO2 catalysts: A spectroscopic and mechanistic study. Chem. Engineer. J. 425, (2021), 130641. [49] C. Zheng H. Bu F. Yang Z. Xu H. Zhao Size effect of (CuO) n (n = 1 ∽ 6) clusters on the modification of rutile‐TiO2 photocatalysts Energy Technol. 2021 2100161 C. Zheng, H. Bu, F. Yang, Z. Xu, H. Zhao, Size Effect of (CuO) n (n = 1 ∽ 6) Clusters on the Modification of Rutile‐TiO2 Photocatalysts, Energy Technol. (2021), 2100161. [50] Y.H. Li L.R. Zeng H.G. Yang A novel strategy for tailoring copper oxide cluster with Pt-like activity for photocatalytic hydrogen evolution Int. J. Hydrog. Energy 40 2015 15454 15459 Y.H. Li, L.R. Zeng, H.G. Yang, A novel strategy for tailoring copper oxide cluster with Pt-like activity for photocatalytic hydrogen evolution. Int. J. Hydrogen Ener. 40, (2015), pp. 15454–15459. [51] L. Zhao Y. Qi L. Song S. Ning S. Ouyang H. Xu J. Ye Solar-driven water–gas shift reaction over CuOx/Al2O3 with 1.1% of light-to-energy storage Angew. Chem. Int. Ed. 58 2019 7708 7712 L. Zhao,Y. Qi, L. Song, S. Ning, S. Ouyang, H. Xu, J. Ye, Solar-Driven Water–Gas Shift Reaction over CuOx/Al2O3 with 1.1% of Light-to-Energy Storage. Angew. Chem. Int. Ed. 58, (2019), pp. 7708–7712.",
      "scopus-id": "85135334483",
      "coredata": {
        "eid": "1-s2.0-S0926860X22003271",
        "dc:description": "We have optimized the H2 production by methanol thermo-photocatalytic reforming in the gas phase using Cu/TiO2 catalyst by tuning metal loading. Metal co-catalyst has been deposited by means of chemical reduction deposition. We have stated that thermo- and thermo-photocatalytic process leads to a notable H2 production at 200 ºC. By in-situ FTIR studies we evidenced that formate formation follows a different evolution depending on the reforming experiment. These surface formate would lead to CO formation through dehydration reaction. At higher Cu content the low CO selectivity denote that water-gas-shift reaction would predominate and exalt H2 yield. Thus, different optimum Cu content is found for each reforming experiment. While for the photocatalytic reforming Cu/TiO2 (2 wt%) is the best catalyst of the series, we should increase the Cu content to Cu/TiO2 (5 wt%) to achieve the optimum performance for thermo-photocatalytic reforming of methanol.",
        "openArchiveArticle": "false",
        "prism:coverDate": "2022-08-05",
        "openaccessUserLicense": "http://creativecommons.org/licenses/by-nc-nd/4.0/",
        "prism:aggregationType": "Journal",
        "prism:url": "https://api.elsevier.com/content/article/pii/S0926860X22003271",
        "dc:creator": [
          {
            "@_fa": "true",
            "$": "Platero, F."
          },
          {
            "@_fa": "true",
            "$": "Caballero, A."
          },
          {
            "@_fa": "true",
            "$": "Colón, G."
          }
        ],
        "link": [
          {
            "@_fa": "true",
            "@rel": "self",
            "@href": "https://api.elsevier.com/content/article/pii/S0926860X22003271"
          },
          {
            "@_fa": "true",
            "@rel": "scidir",
            "@href": "https://www.sciencedirect.com/science/article/pii/S0926860X22003271"
          }
        ],
        "dc:format": "application/json",
        "openaccessType": "Full",
        "pii": "S0926-860X(22)00327-1",
        "prism:volume": "643",
        "articleNumber": "118804",
        "prism:publisher": "The Author(s). Published by Elsevier B.V.",
        "dc:title": "Tuning the co-catalyst loading for the optimization of thermo-photocatalytic hydrogen production over Cu/TiO2",
        "prism:copyright": "© 2022 The Author(s). Published by Elsevier B.V.",
        "openaccess": "1",
        "prism:issn": "0926860X",
        "dcterms:subject": [
          {
            "@_fa": "true",
            "$": "Thermo-photocatalysis"
          },
          {
            "@_fa": "true",
            "$": "Gas-phase"
          },
          {
            "@_fa": "true",
            "$": "Hydrogen"
          },
          {
            "@_fa": "true",
            "$": "Cu-TiO2."
          },
          {
            "@_fa": "true",
            "$": "Water-gas-shift"
          }
        ],
        "openaccessArticle": "true",
        "prism:publicationName": "Applied Catalysis A: General",
        "openaccessSponsorType": "FundingBody",
        "prism:pageRange": "118804",
        "pubType": "fla",
        "prism:coverDisplayDate": "5 August 2022",
        "prism:doi": "10.1016/j.apcata.2022.118804",
        "prism:startingPage": "118804",
        "dc:identifier": "doi:10.1016/j.apcata.2022.118804",
        "openaccessSponsorName": "Spanish Institutions 2022"
      },
      "objects": {
        "object": [
          {
            "@category": "standard",
            "@height": "37",
            "@width": "64",
            "@_fa": "true",
            "$": "https://api.elsevier.com/content/object/eid/1-s2.0-S0926860X22003271-fx1.jpg?httpAccept=%2A%2F%2A",
            "@multimediatype": "JPEG image file",
            "@type": "IMAGE-DOWNSAMPLED",
            "@size": "1381",
            "@ref": "fx1",
            "@mimetype": "image/jpeg"
          },
          {
            "@category": "standard",
            "@height": "30",
            "@width": "64",
            "@_fa": "true",
            "$": "https://api.elsevier.com/content/object/eid/1-s2.0-S0926860X22003271-fx2.jpg?httpAccept=%2A%2F%2A",
            "@multimediatype": "JPEG image file",
            "@type": "IMAGE-DOWNSAMPLED",
            "@size": "1526",
            "@ref": "fx2",
            "@mimetype": "image/jpeg"
          },
          {
            "@category": "standard",
            "@height": "527",
            "@width": "352",
            "@_fa": "true",
            "$": "https://api.elsevier.com/content/object/eid/1-s2.0-S0926860X22003271-gr6.jpg?httpAccept=%2A%2F%2A",
            "@multimediatype": "JPEG image file",
            "@type": "IMAGE-DOWNSAMPLED",
            "@size": "39783",
            "@ref": "gr6",
            "@mimetype": "image/jpeg"
          },
          {
            "@category": "standard",
            "@height": "273",
            "@width": "376",
            "@_fa": "true",
            "$": "https://api.elsevier.com/content/object/eid/1-s2.0-S0926860X22003271-gr7.jpg?httpAccept=%2A%2F%2A",
            "@multimediatype": "JPEG image file",
            "@type": "IMAGE-DOWNSAMPLED",
            "@size": "16607",
            "@ref": "gr7",
            "@mimetype": "image/jpeg"
          },
          {
            "@category": "standard",
            "@height": "289",
            "@width": "791",
            "@_fa": "true",
            "$": "https://api.elsevier.com/content/object/eid/1-s2.0-S0926860X22003271-gr8.jpg?httpAccept=%2A%2F%2A",
            "@multimediatype": "JPEG image file",
            "@type": "IMAGE-DOWNSAMPLED",
            "@size": "65965",
            "@ref": "gr8",
            "@mimetype": "image/jpeg"
          },
          {
            "@category": "standard",
            "@height": "436",
            "@width": "376",
            "@_fa": "true",
            "$": "https://api.elsevier.com/content/object/eid/1-s2.0-S0926860X22003271-gr2.jpg?httpAccept=%2A%2F%2A",
            "@multimediatype": "JPEG image file",
            "@type": "IMAGE-DOWNSAMPLED",
            "@size": "34947",
            "@ref": "gr2",
            "@mimetype": "image/jpeg"
          },
          {
            "@category": "standard",
            "@height": "168",
            "@width": "500",
            "@_fa": "true",
            "$": "https://api.elsevier.com/content/object/eid/1-s2.0-S0926860X22003271-ga1.jpg?httpAccept=%2A%2F%2A",
            "@multimediatype": "JPEG image file",
            "@type": "IMAGE-DOWNSAMPLED",
            "@size": "21118",
            "@ref": "ga1",
            "@mimetype": "image/jpeg"
          },
          {
            "@category": "standard",
            "@height": "257",
            "@width": "659",
            "@_fa": "true",
            "$": "https://api.elsevier.com/content/object/eid/1-s2.0-S0926860X22003271-gr3.jpg?httpAccept=%2A%2F%2A",
            "@multimediatype": "JPEG image file",
            "@type": "IMAGE-DOWNSAMPLED",
            "@size": "42683",
            "@ref": "gr3",
            "@mimetype": "image/jpeg"
          },
          {
            "@category": "standard",
            "@height": "411",
            "@width": "565",
            "@_fa": "true",
            "$": "https://api.elsevier.com/content/object/eid/1-s2.0-S0926860X22003271-gr4.jpg?httpAccept=%2A%2F%2A",
            "@multimediatype": "JPEG image file",
            "@type": "IMAGE-DOWNSAMPLED",
            "@size": "41153",
            "@ref": "gr4",
            "@mimetype": "image/jpeg"
          },
          {
            "@category": "standard",
            "@height": "341",
            "@width": "565",
            "@_fa": "true",
            "$": "https://api.elsevier.com/content/object/eid/1-s2.0-S0926860X22003271-gr5.jpg?httpAccept=%2A%2F%2A",
            "@multimediatype": "JPEG image file",
            "@type": "IMAGE-DOWNSAMPLED",
            "@size": "32723",
            "@ref": "gr5",
            "@mimetype": "image/jpeg"
          },
          {
            "@category": "standard",
            "@height": "249",
            "@width": "226",
            "@_fa": "true",
            "$": "https://api.elsevier.com/content/object/eid/1-s2.0-S0926860X22003271-gr1.jpg?httpAccept=%2A%2F%2A",
            "@multimediatype": "JPEG image file",
            "@type": "IMAGE-DOWNSAMPLED",
            "@size": "23214",
            "@ref": "gr1",
            "@mimetype": "image/jpeg"
          },
          {
            "@category": "thumbnail",
            "@height": "127",
            "@width": "219",
            "@_fa": "true",
            "$": "https://api.elsevier.com/content/object/eid/1-s2.0-S0926860X22003271-fx1.sml?httpAccept=%2A%2F%2A",
            "@multimediatype": "GIF image file",
            "@type": "IMAGE-THUMBNAIL",
            "@size": "10979",
            "@ref": "fx1",
            "@mimetype": "image/gif"
          },
          {
            "@category": "thumbnail",
            "@height": "103",
            "@width": "219",
            "@_fa": "true",
            "$": "https://api.elsevier.com/content/object/eid/1-s2.0-S0926860X22003271-fx2.sml?httpAccept=%2A%2F%2A",
            "@multimediatype": "GIF image file",
            "@type": "IMAGE-THUMBNAIL",
            "@size": "11745",
            "@ref": "fx2",
            "@mimetype": "image/gif"
          },
          {
            "@category": "thumbnail",
            "@height": "163",
            "@width": "109",
            "@_fa": "true",
            "$": "https://api.elsevier.com/content/object/eid/1-s2.0-S0926860X22003271-gr6.sml?httpAccept=%2A%2F%2A",
            "@multimediatype": "GIF image file",
            "@type": "IMAGE-THUMBNAIL",
            "@size": "7003",
            "@ref": "gr6",
            "@mimetype": "image/gif"
          },
          {
            "@category": "thumbnail",
            "@height": "159",
            "@width": "219",
            "@_fa": "true",
            "$": "https://api.elsevier.com/content/object/eid/1-s2.0-S0926860X22003271-gr7.sml?httpAccept=%2A%2F%2A",
            "@multimediatype": "GIF image file",
            "@type": "IMAGE-THUMBNAIL",
            "@size": "5016",
            "@ref": "gr7",
            "@mimetype": "image/gif"
          },
          {
            "@category": "thumbnail",
            "@height": "80",
            "@width": "219",
            "@_fa": "true",
            "$": "https://api.elsevier.com/content/object/eid/1-s2.0-S0926860X22003271-gr8.sml?httpAccept=%2A%2F%2A",
            "@multimediatype": "GIF image file",
            "@type": "IMAGE-THUMBNAIL",
            "@size": "7781",
            "@ref": "gr8",
            "@mimetype": "image/gif"
          },
          {
            "@category": "thumbnail",
            "@height": "163",
            "@width": "141",
            "@_fa": "true",
            "$": "https://api.elsevier.com/content/object/eid/1-s2.0-S0926860X22003271-gr2.sml?httpAccept=%2A%2F%2A",
            "@multimediatype": "GIF image file",
            "@type": "IMAGE-THUMBNAIL",
            "@size": "8712",
            "@ref": "gr2",
            "@mimetype": "image/gif"
          },
          {
            "@category": "thumbnail",
            "@height": "73",
            "@width": "219",
            "@_fa": "true",
            "$": "https://api.elsevier.com/content/object/eid/1-s2.0-S0926860X22003271-ga1.sml?httpAccept=%2A%2F%2A",
            "@multimediatype": "GIF image file",
            "@type": "IMAGE-THUMBNAIL",
            "@size": "5504",
            "@ref": "ga1",
            "@mimetype": "image/gif"
          },
          {
            "@category": "thumbnail",
            "@height": "86",
            "@width": "219",
            "@_fa": "true",
            "$": "https://api.elsevier.com/content/object/eid/1-s2.0-S0926860X22003271-gr3.sml?httpAccept=%2A%2F%2A",
            "@multimediatype": "GIF image file",
            "@type": "IMAGE-THUMBNAIL",
            "@size": "6111",
            "@ref": "gr3",
            "@mimetype": "image/gif"
          },
          {
            "@category": "thumbnail",
            "@height": "159",
            "@width": "219",
            "@_fa": "true",
            "$": "https://api.elsevier.com/content/object/eid/1-s2.0-S0926860X22003271-gr4.sml?httpAccept=%2A%2F%2A",
            "@multimediatype": "GIF image file",
            "@type": "IMAGE-THUMBNAIL",
            "@size": "7361",
            "@ref": "gr4",
            "@mimetype": "image/gif"
          },
          {
            "@category": "thumbnail",
            "@height": "132",
            "@width": "219",
            "@_fa": "true",
            "$": "https://api.elsevier.com/content/object/eid/1-s2.0-S0926860X22003271-gr5.sml?httpAccept=%2A%2F%2A",
            "@multimediatype": "GIF image file",
            "@type": "IMAGE-THUMBNAIL",
            "@size": "5882",
            "@ref": "gr5",
            "@mimetype": "image/gif"
          },
          {
            "@category": "thumbnail",
            "@height": "164",
            "@width": "149",
            "@_fa": "true",
            "$": "https://api.elsevier.com/content/object/eid/1-s2.0-S0926860X22003271-gr1.sml?httpAccept=%2A%2F%2A",
            "@multimediatype": "GIF image file",
            "@type": "IMAGE-THUMBNAIL",
            "@size": "24943",
            "@ref": "gr1",
            "@mimetype": "image/gif"
          },
          {
            "@category": "high",
            "@height": "167",
            "@width": "288",
            "@_fa": "true",
            "$": "https://api.elsevier.com/content/object/eid/1-s2.0-S0926860X22003271-fx1_lrg.jpg?httpAccept=%2A%2F%2A",
            "@multimediatype": "JPEG image file",
            "@type": "IMAGE-HIGH-RES",
            "@size": "4945",
            "@ref": "fx1",
            "@mimetype": "image/jpeg"
          },
          {
            "@category": "high",
            "@height": "135",
            "@width": "288",
            "@_fa": "true",
            "$": "https://api.elsevier.com/content/object/eid/1-s2.0-S0926860X22003271-fx2_lrg.jpg?httpAccept=%2A%2F%2A",
            "@multimediatype": "JPEG image file",
            "@type": "IMAGE-HIGH-RES",
            "@size": "5854",
            "@ref": "fx2",
            "@mimetype": "image/jpeg"
          },
          {
            "@category": "high",
            "@height": "2339",
            "@width": "1561",
            "@_fa": "true",
            "$": "https://api.elsevier.com/content/object/eid/1-s2.0-S0926860X22003271-gr6_lrg.jpg?httpAccept=%2A%2F%2A",
            "@multimediatype": "JPEG image file",
            "@type": "IMAGE-HIGH-RES",
            "@size": "222039",
            "@ref": "gr6",
            "@mimetype": "image/jpeg"
          },
          {
            "@category": "high",
            "@height": "1211",
            "@width": "1665",
            "@_fa": "true",
            "$": "https://api.elsevier.com/content/object/eid/1-s2.0-S0926860X22003271-gr7_lrg.jpg?httpAccept=%2A%2F%2A",
            "@multimediatype": "JPEG image file",
            "@type": "IMAGE-HIGH-RES",
            "@size": "100021",
            "@ref": "gr7",
            "@mimetype": "image/jpeg"
          },
          {
            "@category": "high",
            "@height": "1278",
            "@width": "3493",
            "@_fa": "true",
            "$": "https://api.elsevier.com/content/object/eid/1-s2.0-S0926860X22003271-gr8_lrg.jpg?httpAccept=%2A%2F%2A",
            "@multimediatype": "JPEG image file",
            "@type": "IMAGE-HIGH-RES",
            "@size": "520718",
            "@ref": "gr8",
            "@mimetype": "image/jpeg"
          },
          {
            "@category": "high",
            "@height": "1929",
            "@width": "1664",
            "@_fa": "true",
            "$": "https://api.elsevier.com/content/object/eid/1-s2.0-S0926860X22003271-gr2_lrg.jpg?httpAccept=%2A%2F%2A",
            "@multimediatype": "JPEG image file",
            "@type": "IMAGE-HIGH-RES",
            "@size": "285866",
            "@ref": "gr2",
            "@mimetype": "image/jpeg"
          },
          {
            "@category": "high",
            "@height": "742",
            "@width": "2213",
            "@_fa": "true",
            "$": "https://api.elsevier.com/content/object/eid/1-s2.0-S0926860X22003271-ga1_lrg.jpg?httpAccept=%2A%2F%2A",
            "@multimediatype": "JPEG image file",
            "@type": "IMAGE-HIGH-RES",
            "@size": "150912",
            "@ref": "ga1",
            "@mimetype": "image/jpeg"
          },
          {
            "@category": "high",
            "@height": "1137",
            "@width": "2911",
            "@_fa": "true",
            "$": "https://api.elsevier.com/content/object/eid/1-s2.0-S0926860X22003271-gr3_lrg.jpg?httpAccept=%2A%2F%2A",
            "@multimediatype": "JPEG image file",
            "@type": "IMAGE-HIGH-RES",
            "@size": "279021",
            "@ref": "gr3",
            "@mimetype": "image/jpeg"
          },
          {
            "@category": "high",
            "@height": "1817",
            "@width": "2495",
            "@_fa": "true",
            "$": "https://api.elsevier.com/content/object/eid/1-s2.0-S0926860X22003271-gr4_lrg.jpg?httpAccept=%2A%2F%2A",
            "@multimediatype": "JPEG image file",
            "@type": "IMAGE-HIGH-RES",
            "@size": "270024",
            "@ref": "gr4",
            "@mimetype": "image/jpeg"
          },
          {
            "@category": "high",
            "@height": "1507",
            "@width": "2495",
            "@_fa": "true",
            "$": "https://api.elsevier.com/content/object/eid/1-s2.0-S0926860X22003271-gr5_lrg.jpg?httpAccept=%2A%2F%2A",
            "@multimediatype": "JPEG image file",
            "@type": "IMAGE-HIGH-RES",
            "@size": "213256",
            "@ref": "gr5",
            "@mimetype": "image/jpeg"
          },
          {
            "@category": "high",
            "@height": "1099",
            "@width": "998",
            "@_fa": "true",
            "$": "https://api.elsevier.com/content/object/eid/1-s2.0-S0926860X22003271-gr1_lrg.jpg?httpAccept=%2A%2F%2A",
            "@multimediatype": "JPEG image file",
            "@type": "IMAGE-HIGH-RES",
            "@size": "107567",
            "@ref": "gr1",
            "@mimetype": "image/jpeg"
          },
          {
            "@category": "standard",
            "@_fa": "true",
            "$": "https://api.elsevier.com/content/object/eid/1-s2.0-S0926860X22003271-mmc1.docx?httpAccept=%2A%2F%2A",
            "@multimediatype": "Microsoft Word file",
            "@type": "APPLICATION",
            "@size": "142897",
            "@ref": "mmc1",
            "@mimetype": "application/word"
          },
          {
            "@category": "thumbnail",
            "@_fa": "true",
            "$": "https://api.elsevier.com/content/object/eid/1-s2.0-S0926860X22003271-si0001.svg?httpAccept=%2A%2F%2A",
            "@multimediatype": "Scalable Vector Graphics file",
            "@type": "ALTIMG",
            "@size": "1912",
            "@ref": "si0001",
            "@mimetype": "image/svg+xml"
          },
          {
            "@category": "thumbnail",
            "@_fa": "true",
            "$": "https://api.elsevier.com/content/object/eid/1-s2.0-S0926860X22003271-si0002.svg?httpAccept=%2A%2F%2A",
            "@multimediatype": "Scalable Vector Graphics file",
            "@type": "ALTIMG",
            "@size": "3610",
            "@ref": "si0002",
            "@mimetype": "image/svg+xml"
          },
          {
            "@category": "thumbnail",
            "@_fa": "true",
            "$": "https://api.elsevier.com/content/object/eid/1-s2.0-S0926860X22003271-si0003.svg?httpAccept=%2A%2F%2A",
            "@multimediatype": "Scalable Vector Graphics file",
            "@type": "ALTIMG",
            "@size": "4518",
            "@ref": "si0003",
            "@mimetype": "image/svg+xml"
          },
          {
            "@category": "thumbnail",
            "@_fa": "true",
            "$": "https://api.elsevier.com/content/object/eid/1-s2.0-S0926860X22003271-si0004.svg?httpAccept=%2A%2F%2A",
            "@multimediatype": "Scalable Vector Graphics file",
            "@type": "ALTIMG",
            "@size": "3626",
            "@ref": "si0004",
            "@mimetype": "image/svg+xml"
          },
          {
            "@category": "thumbnail",
            "@_fa": "true",
            "$": "https://api.elsevier.com/content/object/eid/1-s2.0-S0926860X22003271-si0005.svg?httpAccept=%2A%2F%2A",
            "@multimediatype": "Scalable Vector Graphics file",
            "@type": "ALTIMG",
            "@size": "3671",
            "@ref": "si0005",
            "@mimetype": "image/svg+xml"
          },
          {
            "@category": "thumbnail",
            "@_fa": "true",
            "$": "https://api.elsevier.com/content/object/eid/1-s2.0-S0926860X22003271-si0006.svg?httpAccept=%2A%2F%2A",
            "@multimediatype": "Scalable Vector Graphics file",
            "@type": "ALTIMG",
            "@size": "3663",
            "@ref": "si0006",
            "@mimetype": "image/svg+xml"
          },
          {
            "@category": "thumbnail",
            "@_fa": "true",
            "$": "https://api.elsevier.com/content/object/eid/1-s2.0-S0926860X22003271-si0007.svg?httpAccept=%2A%2F%2A",
            "@multimediatype": "Scalable Vector Graphics file",
            "@type": "ALTIMG",
            "@size": "3197",
            "@ref": "si0007",
            "@mimetype": "image/svg+xml"
          },
          {
            "@category": "thumbnail",
            "@_fa": "true",
            "$": "https://api.elsevier.com/content/object/eid/1-s2.0-S0926860X22003271-si0008.svg?httpAccept=%2A%2F%2A",
            "@multimediatype": "Scalable Vector Graphics file",
            "@type": "ALTIMG",
            "@size": "3476",
            "@ref": "si0008",
            "@mimetype": "image/svg+xml"
          },
          {
            "@category": "standard",
            "@_fa": "true",
            "$": "https://api.elsevier.com/content/object/eid/1-s2.0-S0926860X22003271-am.pdf?httpAccept=%2A%2F%2A",
            "@multimediatype": "Acrobat PDF file",
            "@type": "AAM-PDF",
            "@size": "1145243",
            "@ref": "am",
            "@mimetype": "application/pdf"
          }
        ]
      },
      "link": {
        "@rel": "abstract",
        "@href": "https://api.elsevier.com/content/abstract/scopus_id/85135334483"
      }
    }
  }
}