{
  "metadata": {
    "title": "Zinc(II) porphyrin-based ionic porous organic polymers (iPOPs) having abundant dual-function sites for promoting cycloaddition of CO<ce:inf loc=post>2</ce:inf> with epoxides",
    "authors": "; ; ",
    "journal": "Applied Catalysis A: General",
    "date": "2023-09-05",
    "doi": "10.1016/j.apcata.2023.119380",
    "abstract": "",
    "uri": "https://api.elsevier.com/content/article/pii/S0926860X23003605",
    "pii": "S0926860X23003605"
  },
  "fulltext": {
    "full-text-retrieval-response": {
      "scopus-eid": "2-s2.0-85167789598",
      "originalText": "serial JL 271346 291210 291744 291809 31 Applied Catalysis A: General APPLIEDCATALYSISAGENERAL 2023-08-14 2023-08-14 2023-08-16 2023-08-16 2023-09-04T08:54:40 1-s2.0-S0926860X23003605 S0926-860X(23)00360-5 S0926860X23003605 10.1016/j.apcata.2023.119380 S300 S300.1 FULL-TEXT 1-s2.0-S0926860X23X00167 2024-01-01T12:35:59.692098Z 0 0 20230905 2023 2023-08-14T14:51:04.439155Z absattachment articleinfo articlenumber articletitlenorm authfirstinitialnorm authfirstsurnamenorm cid cids contenttype copyright crossmark dateloaded dateloadedtxt datesearch datesort dateupdated dco docsubtype doctype doi eid ewtransactionid hubeid indexeddate issn issnnorm itemstage itemtransactionid itemweight openaccess openarchive pg pgfirst pii piinorm pubdatestart pubdatetxt pubyr sortorder srctitle srctitlenorm srctype ssids alllist content subj subheadings suppl tomb volfirst volissue volumelist webpdf webpdfpagecount yearnav figure table e-component body mmlmath acknowledge affil appendices articletitle auth authfirstini authfull authkeywords authlast grantnumber grantsponsor grantsponsorid highlightsabst primabst ref specialabst 0926-860X 0926860X true 665 665 C Volume 665 16 119380 119380 119380 20230905 5 September 2023 2023-09-05 2023 article fla © 2023 Elsevier B.V. All rights reserved. ZINCIIPORPHYRINBASEDIONICPOROUSORGANICPOLYMERSIPOPSABUNDANTDUALFUNCTIONSITESFORPROMOTINGCYCLOADDITIONCO2EPOXIDES WANG D 1 Introduction 2 Experimental section 2.1 Materials and instruments 2.2 Synthesis of ZnTPyPBr4/DVB(1:m)-iPOP (m = 10, 20, 30, 40) 2.3 Catalytic evaluation 3 Results and discussion 3.1 Characterization of ZnTPyPBr4/DVB(1:m)-iPOP (m = 10, 20, 30, 40) 3.2 Catalytic evaluation 4 Conclusion CRediT authorship contribution statement Acknowledgement Appendix A Supplementary material References LU 2022 e202200003 M GRIGNARD 2019 4466 4514 B HUSSAINSOLANGI 2023 N OYEWOLE 2023 K TYAGI 2023 P PESCARMONA 2021 P YUSUF 2023 N KANEKO 2017 2836 2840 S ZHANG 2017 736 744 W LIU 2016 4611 4615 S HE 2022 W CHEN 2015 9807 9816 A WEI 2022 J LAN 2020 216 224 J YU 2020 K ULLAH 2022 752 761 N FRANCISKURISINGAL 2022 J LUO 2021 20941 20956 R PING 2023 R LIU 2022 F LUO 2021 25731 25749 R LYU 2023 3592 3605 H GUO 2022 3331 3340 X XU 2023 W YU 2022 Q ZHANG 2023 W HIGASHINO 2016 12311 12315 T WANG 2023 D EMA 2014 15270 15279 T ALKA 2019 A BAI 2022 5093 5102 X CHEN 2023 8263 8274 M LIU 2021 L LIU 2021 18218 18229 Y MA 2023 L WU 2018 273 282 Y LIU 2019 196 206 D JIANG 2016 3567 3576 X WANGX2023X119380 WANGX2023X119380XD 2025-08-16T00:00:00.000Z 2025-08-16T00:00:00.000Z http://creativecommons.org/licenses/by-nc-nd/4.0/ © 2023 Elsevier B.V. All rights reserved. 2023-08-31T17:37:43.960Z http://vtw.elsevier.com/data/voc/AddOnTypes/50.7/aggregated-refined https://doi.org/10.15223/policy-017 https://doi.org/10.15223/policy-037 https://doi.org/10.15223/policy-012 https://doi.org/10.15223/policy-029 https://doi.org/10.15223/policy-004 item S0926-860X(23)00360-5 S0926860X23003605 1-s2.0-S0926860X23003605 10.1016/j.apcata.2023.119380 271346 2024-01-01T12:35:59.692098Z 2023-09-05 1-s2.0-S0926860X23003605-main.pdf https://s3-eu-west-1.amazonaws.com/prod-ucs-content-store-eu-west/content/pii:S0926860X23003605/MAIN/application/pdf/48c9761b43cd81b074a25f0d4f06e8a8/main.pdf main.pdf pdf true 7451947 MAIN 10 1-s2.0-S0926860X23003605-main_1.png https://s3-eu-west-1.amazonaws.com/prod-ucs-content-store-eu-west/content/pii:S0926860X23003605/PREVIEW/image/png/77618f13c1d8fa5e0b1917bc08e2ccd5/main_1.png main_1.png png 58374 849 656 IMAGE-WEB-PDF 1 1-s2.0-S0926860X23003605-gr11.jpg https://s3-eu-west-1.amazonaws.com/prod-ucs-content-store-eu-west/content/pii:S0926860X23003605/gr11/DOWNSAMPLED/image/jpeg/083aee90d468bd2d12094c377078d6bd/gr11.jpg gr11 gr11.jpg jpg 14251 199 376 IMAGE-DOWNSAMPLED 1-s2.0-S0926860X23003605-fx6.jpg https://s3-eu-west-1.amazonaws.com/prod-ucs-content-store-eu-west/content/pii:S0926860X23003605/fx6/DOWNSAMPLED/image/jpeg/e3152c8d42deb5e8065fbce0c0c2bd37/fx6.jpg fx6 fx6.jpg jpg 2349 43 119 IMAGE-DOWNSAMPLED 1-s2.0-S0926860X23003605-fx5.jpg https://s3-eu-west-1.amazonaws.com/prod-ucs-content-store-eu-west/content/pii:S0926860X23003605/fx5/DOWNSAMPLED/image/jpeg/a39a90f3cb454beaa7047cfc46121640/fx5.jpg fx5 fx5.jpg jpg 1889 39 89 IMAGE-DOWNSAMPLED 1-s2.0-S0926860X23003605-gr1.jpg https://s3-eu-west-1.amazonaws.com/prod-ucs-content-store-eu-west/content/pii:S0926860X23003605/gr1/DOWNSAMPLED/image/jpeg/a7d308299d709a70aeb7af5010666688/gr1.jpg gr1 gr1.jpg jpg 34328 297 339 IMAGE-DOWNSAMPLED 1-s2.0-S0926860X23003605-fx8.jpg https://s3-eu-west-1.amazonaws.com/prod-ucs-content-store-eu-west/content/pii:S0926860X23003605/fx8/DOWNSAMPLED/image/jpeg/378e3227df43b7961a3dd06fe063f8fd/fx8.jpg fx8 fx8.jpg jpg 1884 38 114 IMAGE-DOWNSAMPLED 1-s2.0-S0926860X23003605-gr10.jpg https://s3-eu-west-1.amazonaws.com/prod-ucs-content-store-eu-west/content/pii:S0926860X23003605/gr10/DOWNSAMPLED/image/jpeg/cb03576e0a9039421496578612002db7/gr10.jpg gr10 gr10.jpg jpg 34132 268 678 IMAGE-DOWNSAMPLED 1-s2.0-S0926860X23003605-fx7.jpg https://s3-eu-west-1.amazonaws.com/prod-ucs-content-store-eu-west/content/pii:S0926860X23003605/fx7/DOWNSAMPLED/image/jpeg/e65a7ac7c374c0ecc7699fa6014283bf/fx7.jpg fx7 fx7.jpg jpg 2355 43 119 IMAGE-DOWNSAMPLED 1-s2.0-S0926860X23003605-gr3.jpg https://s3-eu-west-1.amazonaws.com/prod-ucs-content-store-eu-west/content/pii:S0926860X23003605/gr3/DOWNSAMPLED/image/jpeg/afcc28febd798b8f0172afae70f87f31/gr3.jpg gr3 gr3.jpg jpg 92823 380 565 IMAGE-DOWNSAMPLED 1-s2.0-S0926860X23003605-gr2.jpg https://s3-eu-west-1.amazonaws.com/prod-ucs-content-store-eu-west/content/pii:S0926860X23003605/gr2/DOWNSAMPLED/image/jpeg/c8f3efcc6e0c46e2eceb4ca7eb800022/gr2.jpg gr2 gr2.jpg jpg 26021 291 339 IMAGE-DOWNSAMPLED 1-s2.0-S0926860X23003605-fx9.jpg https://s3-eu-west-1.amazonaws.com/prod-ucs-content-store-eu-west/content/pii:S0926860X23003605/fx9/DOWNSAMPLED/image/jpeg/6bf4d5dd05d3497a35a655173829693f/fx9.jpg fx9 fx9.jpg jpg 1544 36 75 IMAGE-DOWNSAMPLED 1-s2.0-S0926860X23003605-gr5.jpg https://s3-eu-west-1.amazonaws.com/prod-ucs-content-store-eu-west/content/pii:S0926860X23003605/gr5/DOWNSAMPLED/image/jpeg/4b2724c5ece42cdcbd6ca3147d5744f6/gr5.jpg gr5 gr5.jpg jpg 63649 578 678 IMAGE-DOWNSAMPLED 1-s2.0-S0926860X23003605-gr4.jpg https://s3-eu-west-1.amazonaws.com/prod-ucs-content-store-eu-west/content/pii:S0926860X23003605/gr4/DOWNSAMPLED/image/jpeg/611536359d68dbe08510619f5c4b6ad0/gr4.jpg gr4 gr4.jpg jpg 118557 795 565 IMAGE-DOWNSAMPLED 1-s2.0-S0926860X23003605-fx2.jpg https://s3-eu-west-1.amazonaws.com/prod-ucs-content-store-eu-west/content/pii:S0926860X23003605/fx2/DOWNSAMPLED/image/jpeg/f6de0922c8068d655f94a504597e2364/fx2.jpg fx2 fx2.jpg jpg 6616 68 376 IMAGE-DOWNSAMPLED 1-s2.0-S0926860X23003605-fx1.jpg https://s3-eu-west-1.amazonaws.com/prod-ucs-content-store-eu-west/content/pii:S0926860X23003605/fx1/DOWNSAMPLED/image/jpeg/a125f0b27af2f1036edc664f34ec2211/fx1.jpg fx1 fx1.jpg jpg 5437 65 376 IMAGE-DOWNSAMPLED 1-s2.0-S0926860X23003605-fx4.jpg https://s3-eu-west-1.amazonaws.com/prod-ucs-content-store-eu-west/content/pii:S0926860X23003605/fx4/DOWNSAMPLED/image/jpeg/4883402377048f2b8ec722f8f80ccda5/fx4.jpg fx4 fx4.jpg jpg 1389 38 67 IMAGE-DOWNSAMPLED 1-s2.0-S0926860X23003605-sc1.jpg https://s3-eu-west-1.amazonaws.com/prod-ucs-content-store-eu-west/content/pii:S0926860X23003605/sc1/DOWNSAMPLED/image/jpeg/551d11e2d368b1959156ea01c6914a5f/sc1.jpg sc1 sc1.jpg jpg 41486 491 565 IMAGE-DOWNSAMPLED 1-s2.0-S0926860X23003605-fx3.jpg https://s3-eu-west-1.amazonaws.com/prod-ucs-content-store-eu-west/content/pii:S0926860X23003605/fx3/DOWNSAMPLED/image/jpeg/6b0b6c5aaa56e4db9cb44d2d13e6348f/fx3.jpg fx3 fx3.jpg jpg 1140 34 51 IMAGE-DOWNSAMPLED 1-s2.0-S0926860X23003605-ga1.jpg https://s3-eu-west-1.amazonaws.com/prod-ucs-content-store-eu-west/content/pii:S0926860X23003605/ga1/DOWNSAMPLED/image/jpeg/a3aa694098159cc90980b2377b55268b/ga1.jpg ga1 true ga1.jpg jpg 24243 200 444 IMAGE-DOWNSAMPLED 1-s2.0-S0926860X23003605-gr7.jpg https://s3-eu-west-1.amazonaws.com/prod-ucs-content-store-eu-west/content/pii:S0926860X23003605/gr7/DOWNSAMPLED/image/jpeg/41edf20b8e129289646b29eae8cab27c/gr7.jpg gr7 gr7.jpg jpg 46521 279 678 IMAGE-DOWNSAMPLED 1-s2.0-S0926860X23003605-gr6.jpg https://s3-eu-west-1.amazonaws.com/prod-ucs-content-store-eu-west/content/pii:S0926860X23003605/gr6/DOWNSAMPLED/image/jpeg/d609f3bbe3784ab62b22e740dc461627/gr6.jpg gr6 gr6.jpg jpg 66354 400 565 IMAGE-DOWNSAMPLED 1-s2.0-S0926860X23003605-gr9.jpg https://s3-eu-west-1.amazonaws.com/prod-ucs-content-store-eu-west/content/pii:S0926860X23003605/gr9/DOWNSAMPLED/image/jpeg/42b313f2a39f20bce1764083476cc33d/gr9.jpg gr9 gr9.jpg jpg 32250 251 715 IMAGE-DOWNSAMPLED 1-s2.0-S0926860X23003605-gr8.jpg https://s3-eu-west-1.amazonaws.com/prod-ucs-content-store-eu-west/content/pii:S0926860X23003605/gr8/DOWNSAMPLED/image/jpeg/583636aabf809b51503d11b07c7bb1ab/gr8.jpg gr8 gr8.jpg jpg 21387 276 339 IMAGE-DOWNSAMPLED 1-s2.0-S0926860X23003605-gr11.sml https://s3-eu-west-1.amazonaws.com/prod-ucs-content-store-eu-west/content/pii:S0926860X23003605/gr11/THUMBNAIL/image/gif/92dee65010dae52bec9245c57698708f/gr11.sml gr11 gr11.sml sml 5672 116 219 IMAGE-THUMBNAIL 1-s2.0-S0926860X23003605-fx6.sml https://s3-eu-west-1.amazonaws.com/prod-ucs-content-store-eu-west/content/pii:S0926860X23003605/fx6/THUMBNAIL/image/gif/2477464f206cae5b0e49708b5ca59a0e/fx6.sml fx6 fx6.sml sml 5064 80 219 IMAGE-THUMBNAIL 1-s2.0-S0926860X23003605-fx5.sml https://s3-eu-west-1.amazonaws.com/prod-ucs-content-store-eu-west/content/pii:S0926860X23003605/fx5/THUMBNAIL/image/gif/5e31cf3bd0e4473f0020cf37bbfba0db/fx5.sml fx5 fx5.sml sml 6347 96 219 IMAGE-THUMBNAIL 1-s2.0-S0926860X23003605-gr1.sml https://s3-eu-west-1.amazonaws.com/prod-ucs-content-store-eu-west/content/pii:S0926860X23003605/gr1/THUMBNAIL/image/gif/0eeea20554658d869fbbed83b7b570ff/gr1.sml gr1 gr1.sml sml 10790 164 187 IMAGE-THUMBNAIL 1-s2.0-S0926860X23003605-fx8.sml https://s3-eu-west-1.amazonaws.com/prod-ucs-content-store-eu-west/content/pii:S0926860X23003605/fx8/THUMBNAIL/image/gif/e8d0f355c3b3412390d6f80bbc84c29e/fx8.sml fx8 fx8.sml sml 4271 74 219 IMAGE-THUMBNAIL 1-s2.0-S0926860X23003605-gr10.sml https://s3-eu-west-1.amazonaws.com/prod-ucs-content-store-eu-west/content/pii:S0926860X23003605/gr10/THUMBNAIL/image/gif/be6d1de7261e376e32ffa61d24f8ef56/gr10.sml gr10 gr10.sml sml 4828 87 219 IMAGE-THUMBNAIL 1-s2.0-S0926860X23003605-fx7.sml https://s3-eu-west-1.amazonaws.com/prod-ucs-content-store-eu-west/content/pii:S0926860X23003605/fx7/THUMBNAIL/image/gif/184610e83ccedd8fbee8d404e951f5dc/fx7.sml fx7 fx7.sml sml 5115 80 219 IMAGE-THUMBNAIL 1-s2.0-S0926860X23003605-gr3.sml https://s3-eu-west-1.amazonaws.com/prod-ucs-content-store-eu-west/content/pii:S0926860X23003605/gr3/THUMBNAIL/image/gif/e91687bad589e1fe574de902e57f0576/gr3.sml gr3 gr3.sml sml 27010 147 219 IMAGE-THUMBNAIL 1-s2.0-S0926860X23003605-gr2.sml https://s3-eu-west-1.amazonaws.com/prod-ucs-content-store-eu-west/content/pii:S0926860X23003605/gr2/THUMBNAIL/image/gif/987bea03cc2f47a3c87e57aac11b28d6/gr2.sml gr2 gr2.sml sml 8995 164 191 IMAGE-THUMBNAIL 1-s2.0-S0926860X23003605-fx9.sml https://s3-eu-west-1.amazonaws.com/prod-ucs-content-store-eu-west/content/pii:S0926860X23003605/fx9/THUMBNAIL/image/gif/3fe9383589fe229eef9f8af48ef0b96d/fx9.sml fx9 fx9.sml sml 6310 104 219 IMAGE-THUMBNAIL 1-s2.0-S0926860X23003605-gr5.sml https://s3-eu-west-1.amazonaws.com/prod-ucs-content-store-eu-west/content/pii:S0926860X23003605/gr5/THUMBNAIL/image/gif/33e67d6ccf8c85e5346ceac79b32b5a4/gr5.sml gr5 gr5.sml sml 8261 164 192 IMAGE-THUMBNAIL 1-s2.0-S0926860X23003605-gr4.sml https://s3-eu-west-1.amazonaws.com/prod-ucs-content-store-eu-west/content/pii:S0926860X23003605/gr4/THUMBNAIL/image/gif/375c1631eb8639b7bcb927fd38e6a067/gr4.sml gr4 gr4.sml sml 10714 163 116 IMAGE-THUMBNAIL 1-s2.0-S0926860X23003605-fx2.sml https://s3-eu-west-1.amazonaws.com/prod-ucs-content-store-eu-west/content/pii:S0926860X23003605/fx2/THUMBNAIL/image/gif/c1d5d79e24c4791ebdcab0aae85a72a4/fx2.sml fx2 fx2.sml sml 2620 40 219 IMAGE-THUMBNAIL 1-s2.0-S0926860X23003605-fx1.sml https://s3-eu-west-1.amazonaws.com/prod-ucs-content-store-eu-west/content/pii:S0926860X23003605/fx1/THUMBNAIL/image/gif/37855d58e8e4b7968f3e37a870d0bf5d/fx1.sml fx1 fx1.sml sml 1796 38 219 IMAGE-THUMBNAIL 1-s2.0-S0926860X23003605-fx4.sml https://s3-eu-west-1.amazonaws.com/prod-ucs-content-store-eu-west/content/pii:S0926860X23003605/fx4/THUMBNAIL/image/gif/7ed7d24116ad97184da2db48f1768975/fx4.sml fx4 fx4.sml sml 6933 124 219 IMAGE-THUMBNAIL 1-s2.0-S0926860X23003605-sc1.sml https://s3-eu-west-1.amazonaws.com/prod-ucs-content-store-eu-west/content/pii:S0926860X23003605/sc1/THUMBNAIL/image/gif/024e2686689dd4217bf70080b0fcba66/sc1.sml sc1 sc1.sml sml 6474 164 189 IMAGE-THUMBNAIL 1-s2.0-S0926860X23003605-fx3.sml https://s3-eu-west-1.amazonaws.com/prod-ucs-content-store-eu-west/content/pii:S0926860X23003605/fx3/THUMBNAIL/image/gif/128584f6cc8699d75638adf5617f2274/fx3.sml fx3 fx3.sml sml 8884 148 219 IMAGE-THUMBNAIL 1-s2.0-S0926860X23003605-ga1.sml https://s3-eu-west-1.amazonaws.com/prod-ucs-content-store-eu-west/content/pii:S0926860X23003605/ga1/THUMBNAIL/image/gif/720a4b5c01cfd4364a1545e867a8d576/ga1.sml ga1 true ga1.sml sml 8970 99 219 IMAGE-THUMBNAIL 1-s2.0-S0926860X23003605-gr7.sml https://s3-eu-west-1.amazonaws.com/prod-ucs-content-store-eu-west/content/pii:S0926860X23003605/gr7/THUMBNAIL/image/gif/6d0b8f77992ff41a07d13b68027a59a3/gr7.sml gr7 gr7.sml sml 6817 90 219 IMAGE-THUMBNAIL 1-s2.0-S0926860X23003605-gr6.sml https://s3-eu-west-1.amazonaws.com/prod-ucs-content-store-eu-west/content/pii:S0926860X23003605/gr6/THUMBNAIL/image/gif/d467458a4d38fd33dfd85fc04b751c67/gr6.sml gr6 gr6.sml sml 12266 155 219 IMAGE-THUMBNAIL 1-s2.0-S0926860X23003605-gr9.sml https://s3-eu-west-1.amazonaws.com/prod-ucs-content-store-eu-west/content/pii:S0926860X23003605/gr9/THUMBNAIL/image/gif/32108a07e959929c437b1b7d9591dd19/gr9.sml gr9 gr9.sml sml 4497 77 219 IMAGE-THUMBNAIL 1-s2.0-S0926860X23003605-gr8.sml https://s3-eu-west-1.amazonaws.com/prod-ucs-content-store-eu-west/content/pii:S0926860X23003605/gr8/THUMBNAIL/image/gif/ae4866a7a8e61d7f879a9c8900b8b035/gr8.sml gr8 gr8.sml sml 7792 164 201 IMAGE-THUMBNAIL 1-s2.0-S0926860X23003605-gr11_lrg.jpg https://s3-eu-west-1.amazonaws.com/prod-ucs-content-store-eu-west/content/pii:S0926860X23003605/HIGHRES/image/jpeg/add8ab606c6b35165ce20845d86f2ae9/gr11_lrg.jpg gr11 gr11_lrg.jpg jpg 60038 882 1663 IMAGE-HIGH-RES 1-s2.0-S0926860X23003605-fx6_lrg.jpg https://s3-eu-west-1.amazonaws.com/prod-ucs-content-store-eu-west/content/pii:S0926860X23003605/HIGHRES/image/jpeg/d6b7d6a5bf85100b9219cd0e28cd4080/fx6_lrg.jpg fx6 fx6_lrg.jpg jpg 9393 192 526 IMAGE-HIGH-RES 1-s2.0-S0926860X23003605-fx5_lrg.jpg https://s3-eu-west-1.amazonaws.com/prod-ucs-content-store-eu-west/content/pii:S0926860X23003605/HIGHRES/image/jpeg/e1cef44ee93c26f73a3a8af8d55583d0/fx5_lrg.jpg fx5 fx5_lrg.jpg jpg 7106 174 399 IMAGE-HIGH-RES 1-s2.0-S0926860X23003605-gr1_lrg.jpg https://s3-eu-west-1.amazonaws.com/prod-ucs-content-store-eu-west/content/pii:S0926860X23003605/HIGHRES/image/jpeg/7a7561cd0a0c9b05ca752f873c7c0de5/gr1_lrg.jpg gr1 gr1_lrg.jpg jpg 164484 1312 1497 IMAGE-HIGH-RES 1-s2.0-S0926860X23003605-fx8_lrg.jpg https://s3-eu-west-1.amazonaws.com/prod-ucs-content-store-eu-west/content/pii:S0926860X23003605/HIGHRES/image/jpeg/00ac45490b476f6963c544aa788f89bd/fx8_lrg.jpg fx8 fx8_lrg.jpg jpg 7145 172 511 IMAGE-HIGH-RES 1-s2.0-S0926860X23003605-gr10_lrg.jpg https://s3-eu-west-1.amazonaws.com/prod-ucs-content-store-eu-west/content/pii:S0926860X23003605/HIGHRES/image/jpeg/c02c827cb1d40b71463074f23cca7772/gr10_lrg.jpg gr10 gr10_lrg.jpg jpg 147301 1183 2994 IMAGE-HIGH-RES 1-s2.0-S0926860X23003605-fx7_lrg.jpg https://s3-eu-west-1.amazonaws.com/prod-ucs-content-store-eu-west/content/pii:S0926860X23003605/HIGHRES/image/jpeg/db3d660be2bcb7ff2fb3226349240c31/fx7_lrg.jpg fx7 fx7_lrg.jpg jpg 9492 192 526 IMAGE-HIGH-RES 1-s2.0-S0926860X23003605-gr3_lrg.jpg https://s3-eu-west-1.amazonaws.com/prod-ucs-content-store-eu-west/content/pii:S0926860X23003605/HIGHRES/image/jpeg/bd54245dcd29b697384f8eb42b2d9970/gr3_lrg.jpg gr3 gr3_lrg.jpg jpg 436222 1677 2495 IMAGE-HIGH-RES 1-s2.0-S0926860X23003605-gr2_lrg.jpg https://s3-eu-west-1.amazonaws.com/prod-ucs-content-store-eu-west/content/pii:S0926860X23003605/HIGHRES/image/jpeg/52c3b093a28d72580609b5db27ce1f93/gr2_lrg.jpg gr2 gr2_lrg.jpg jpg 124650 1285 1497 IMAGE-HIGH-RES 1-s2.0-S0926860X23003605-fx9_lrg.jpg https://s3-eu-west-1.amazonaws.com/prod-ucs-content-store-eu-west/content/pii:S0926860X23003605/HIGHRES/image/jpeg/fedd5c14e62b2c05ecafb2ceecd1c9d5/fx9_lrg.jpg fx9 fx9_lrg.jpg jpg 5791 159 334 IMAGE-HIGH-RES 1-s2.0-S0926860X23003605-gr5_lrg.jpg https://s3-eu-west-1.amazonaws.com/prod-ucs-content-store-eu-west/content/pii:S0926860X23003605/HIGHRES/image/jpeg/1a6761d2bd90a93f84146e6f94ccaf40/gr5_lrg.jpg gr5 gr5_lrg.jpg jpg 301092 2552 2994 IMAGE-HIGH-RES 1-s2.0-S0926860X23003605-gr4_lrg.jpg https://s3-eu-west-1.amazonaws.com/prod-ucs-content-store-eu-west/content/pii:S0926860X23003605/HIGHRES/image/jpeg/4434136761cc8d4ffa8b5cf69e387c71/gr4_lrg.jpg gr4 gr4_lrg.jpg jpg 573629 3509 2495 IMAGE-HIGH-RES 1-s2.0-S0926860X23003605-fx2_lrg.jpg https://s3-eu-west-1.amazonaws.com/prod-ucs-content-store-eu-west/content/pii:S0926860X23003605/HIGHRES/image/jpeg/ce1b5e355cb436d1873ed7028918c564/fx2_lrg.jpg fx2 fx2_lrg.jpg jpg 28563 302 1663 IMAGE-HIGH-RES 1-s2.0-S0926860X23003605-fx1_lrg.jpg https://s3-eu-west-1.amazonaws.com/prod-ucs-content-store-eu-west/content/pii:S0926860X23003605/HIGHRES/image/jpeg/fb43abf586e3852545371cfc47bda66c/fx1_lrg.jpg fx1 fx1_lrg.jpg jpg 24383 286 1663 IMAGE-HIGH-RES 1-s2.0-S0926860X23003605-fx4_lrg.jpg https://s3-eu-west-1.amazonaws.com/prod-ucs-content-store-eu-west/content/pii:S0926860X23003605/HIGHRES/image/jpeg/e6050a14c749ec7d46e10d3fadb5c8de/fx4_lrg.jpg fx4 fx4_lrg.jpg jpg 4724 172 304 IMAGE-HIGH-RES 1-s2.0-S0926860X23003605-sc1_lrg.jpg https://s3-eu-west-1.amazonaws.com/prod-ucs-content-store-eu-west/content/pii:S0926860X23003605/HIGHRES/image/jpeg/f280e202dcce06f9f57f24bcb417eef4/sc1_lrg.jpg sc1 sc1_lrg.jpg jpg 218813 2168 2495 IMAGE-HIGH-RES 1-s2.0-S0926860X23003605-fx3_lrg.jpg https://s3-eu-west-1.amazonaws.com/prod-ucs-content-store-eu-west/content/pii:S0926860X23003605/HIGHRES/image/jpeg/020fe39269482aa00f5484e1b3818c96/fx3_lrg.jpg fx3 fx3_lrg.jpg jpg 3583 156 231 IMAGE-HIGH-RES 1-s2.0-S0926860X23003605-ga1_lrg.jpg https://s3-eu-west-1.amazonaws.com/prod-ucs-content-store-eu-west/content/pii:S0926860X23003605/HIGHRES/image/jpeg/e083d82d9e5c5843787acb2a9b172f44/ga1_lrg.jpg ga1 true ga1_lrg.jpg jpg 168337 886 1969 IMAGE-HIGH-RES 1-s2.0-S0926860X23003605-gr7_lrg.jpg https://s3-eu-west-1.amazonaws.com/prod-ucs-content-store-eu-west/content/pii:S0926860X23003605/HIGHRES/image/jpeg/9b325f260c4bd27196250cb872aefe23/gr7_lrg.jpg gr7 gr7_lrg.jpg jpg 226693 1231 2994 IMAGE-HIGH-RES 1-s2.0-S0926860X23003605-gr6_lrg.jpg https://s3-eu-west-1.amazonaws.com/prod-ucs-content-store-eu-west/content/pii:S0926860X23003605/HIGHRES/image/jpeg/15bb4e4b9a29adc3772f4026fea4a239/gr6_lrg.jpg gr6 gr6_lrg.jpg jpg 312036 1768 2495 IMAGE-HIGH-RES 1-s2.0-S0926860X23003605-gr9_lrg.jpg https://s3-eu-west-1.amazonaws.com/prod-ucs-content-store-eu-west/content/pii:S0926860X23003605/HIGHRES/image/jpeg/c5f3673506f684cc3320ea5bde40d20e/gr9_lrg.jpg gr9 gr9_lrg.jpg jpg 144112 1109 3160 IMAGE-HIGH-RES 1-s2.0-S0926860X23003605-gr8_lrg.jpg https://s3-eu-west-1.amazonaws.com/prod-ucs-content-store-eu-west/content/pii:S0926860X23003605/HIGHRES/image/jpeg/893872f0a7bc7c09451cea30719a386b/gr8_lrg.jpg gr8 gr8_lrg.jpg jpg 103631 1219 1497 IMAGE-HIGH-RES 1-s2.0-S0926860X23003605-mmc1.docx https://s3-eu-west-1.amazonaws.com/prod-ucs-content-store-eu-west/content/pii:S0926860X23003605/mmc1/MAIN/application/vnd.openxmlformats-officedocument.wordprocessingml.document/4d8d447ae910707fb370408e400261d4/mmc1.docx mmc1 mmc1.docx docx 5464251 APPLICATION 1-s2.0-S0926860X23003605-si0001.svg https://s3-eu-west-1.amazonaws.com/prod-ucs-content-store-eu-west/content/pii:S0926860X23003605/image/svg+xml/dde961927108ac9547637998988f19d0/si0001.svg si0001 si0001.svg svg 2872 ALTIMG 1-s2.0-S0926860X23003605-si0002.svg https://s3-eu-west-1.amazonaws.com/prod-ucs-content-store-eu-west/content/pii:S0926860X23003605/image/svg+xml/79dfa8b3448e7edb52617f66980be7c6/si0002.svg si0002 si0002.svg svg 2406 ALTIMG 1-s2.0-S0926860X23003605-si0003.svg https://s3-eu-west-1.amazonaws.com/prod-ucs-content-store-eu-west/content/pii:S0926860X23003605/image/svg+xml/a04649d15740263fc32ad2958ac5fcfd/si0003.svg si0003 si0003.svg svg 2787 ALTIMG 1-s2.0-S0926860X23003605-si0004.svg https://s3-eu-west-1.amazonaws.com/prod-ucs-content-store-eu-west/content/pii:S0926860X23003605/image/svg+xml/8a7bdb6083dad42cfb732aa4f2fa28b2/si0004.svg si0004 si0004.svg svg 1705 ALTIMG 1-s2.0-S0926860X23003605-si0005.svg https://s3-eu-west-1.amazonaws.com/prod-ucs-content-store-eu-west/content/pii:S0926860X23003605/image/svg+xml/af64a7b29f9402929aba2fa8b09bc33e/si0005.svg si0005 si0005.svg svg 1880 ALTIMG 1-s2.0-S0926860X23003605-am.pdf https://s3-eu-west-1.amazonaws.com/prod-ucs-content-store-eu-west/content/egi:10JRJMX1QW3/MAIN/application/pdf/c01ce08eab6e985439da659991b34f66/am.pdf am am.pdf pdf false 2182502 AAM-PDF APCATA 119380 119380 S0926-860X(23)00360-5 10.1016/j.apcata.2023.119380 Elsevier B.V. Fig. 1 FTIR spectra of DVB, ZnTPyPBr4 and ZnTPyPBr4/DVB(1:m)-iPOP (m = 10, 20, 30, 40). Fig. 1 Fig. 2 UV–Vis solid-state spectra of ZnTPyPBr4/DVB(1:m)-iPOP (m = 10, 20, 30, 40). Fig. 2 Fig. 3 SEM images of (A) ZnTPyPBr4/DVB(1:10)-iPOP, (B) ZnTPyPBr4/DVB(1:20)-iPOP, (C) ZnTPyPBr4/DVB(1:30)-iPOP and (D) ZnTPyPBr4/DVB(1:40)-iPOP. Fig. 3 Fig. 4 TEM images of (A) ZnTPyPBr4/DVB(1:10)-iPOP, (B) ZnTPyPBr4/DVB(1:20)-iPOP, (C) ZnTPyPBr4/DVB(1:30)-iPOP, (D) ZnTPyPBr4/DVB(1:40)-iPOP and (E) the TEM-mapping images of ZnTPyPBr4/DVB(1:30)-iPOP. Fig. 4 Fig. 5 XPS spectra of (A) Full scan, (B) N 1s, (C) Zn 2p, and (D) Br 3d of ZnTPyPBr4/DVB(1:30)-iPOP. Fig. 5 Fig. 6 (A) N2 adsorption-desorption isotherms and (B) pore size distribution of ZnTPyPBr4/DVB(1:m)-iPOP (m = 10, 20, 30, 40). Fig. 6 Fig. 7 (A) CO2 adsorption isotherms of all iPOPs and (B) CO2 isovolumetric adsorption enthalpy of ZnTPyPBr4/DVB(1:30)-iPOP. Fig. 7 Fig. 8 TG curves of ZnTPyPBr4/DVB(1:m)-iPOP (m = 10, 20, 30, 40). Fig. 8 Fig. 9 (A) Effect of reaction time and (B) [ECH]/[Cat.] on catalytic activity for the cycloaddition of CO2 with ECH. Fig. 9 Fig. 10 (A) The relationship between ln (1-x) and reaction time at different temperatures and (B) the Arrhenius diagram of the cycloaddition reaction of CO2 and ECH. Fig. 10 Fig. 11 Recycling stability of ZnTPyPBr4/DVB (1:30)-iPOP for cycloaddition of CO2 and ECH. Fig. 11 Scheme 1 Synthetic procedures of ZnTPyPBr4/DVB(1:m)-iPOP (m = 10, 20, 30, 40). Scheme 1 Table 1 Different catalysts catalyzed the reaction of CO2 and ECH. Table 1 Image 1 Entry Catalysts Conv. (%)b Sel. (%)b TONc TOF (h−1)c 1 ZnTPyPBr4/DVB(1:10)-iPOP 90 > 99 450 25 2 ZnTPyPBr4/DVB(1:20)-iPOP 92 > 99 460 26 3 ZnTPyPBr4/DVB(1:30)-iPOP 99 > 99 495 28 4 ZnTPyPBr4/DVB(1:40)-iPOP 95 > 99 475 26 aReaction conditions: ECH (1.25 mmol), catalysts (0.0025 mmol, based on Zn). bThe conversion and selectivity were analyzed by 1H NMR. cTON = ([ECH]/[Cat.]) * conversion; TOF = TON/18(h). Table 2 E a of cycloaddition reactions of ECH and CO2 over different catalysts. Table 2 Entry Catalyst E a (kJ mol−1) Ref. 1 Zn-BTC-2MeIm 113.38 [36] 2 Ti-mSiO2 (C) 47.97 [37] 3 J-m8 (homogeneous) 46.1 [38] 4 ZnTPyPBr4/DVB(1:30)-iPOP 22.64 This work Table 3 Cycloaddition reactions of CO2 and different epoxides catalyzed by ZnTPyPBr4/DVB (1:30)-iPOP a . Table 3 Image 2 Entry Products Conv. (%) b Sel. (%) b TON c TOF (h−1) c 1 Image 3 99 > 99 495 28 2 Image 4 94 > 99 470 26 3 Image 5 86 > 99 430 24 4 Image 6 88 > 99 440 24 5 d Image 7 54 > 99 270 6 6 Image 8 79 > 99 395 22 7 Image 9 9 > 99 45 3 a Reaction conditions: epoxides (1.25 mmol), ZnTPyPBr4/DVB(1:30)-iPOP (0.0025 mmol, based on Zn). b The conversion and selectivity were analyzed by 1H NMR. c TON = ([epoxides]/[catalysts]) * conversion; TOF = TON/t(h). d Reaction conditions: room temperature, 1 bar CO2, 48 h. Zinc(II) porphyrin-based ionic porous organic polymers (iPOPs) having abundant dual-function sites for promoting cycloaddition of CO2 with epoxides Dan Wang Validation Visualization Writing – original draft Writing – review & editing Linjing Ma Investigation Validation Visualization Data curation Methodology Dongping Wang Software Formal analysis Data curation Renhe Wang Visualization Data curation Software Ning Wang Supervision Project administration Resources ⁎ Jun Li Conceptualization Methodology Resources Supervision Project administration Funding acquisition ⁎ Key Laboratory of Synthetic and Natural Functional Molecule of the Ministry of Education, College of Chemistry & Materials Science, Northwest University, Xi’an 710069, China Key Laboratory of Synthetic and Natural Functional Molecule of the Ministry of Education, College of Chemistry & Materials Science, Northwest University Xi’an 710069 China Key Laboratory of Synthetic and Natural Functional Molecule of the Ministry of Education, College of Chemistry & Materials Science, Northwest University, Xi’an 710069, China ⁎ Corresponding authors. A series of zinc(II) porphyrin-based ionic porous organic polymers [ZnTPyPBr4/DVB(1:m)-iPOP (m = 10, 20, 30, 40)] were synthesized by the free-radical copolymerization of pyridinium–functionalized Zinc(II) porphyrin (ZnTPyPBr4) and divinylbenzene (DVB) through solvothermal method and characterized successfully. The iPOPs had high specific surface areas, relative high CO2 adsorption capacity, abundant dual-function sites (Zn and Br-) and high catalytic efficiency for the cycloaddition reaction of CO2 and epoxides under mild conditions (80 ℃，0.5 MPa CO2). In particular, ZnTPyPBr4/DVB(1:30)-iPOP displayed the highest catalytic activity with a conversion of 99 % for the cycloaddition of CO2 and epichlorohydrin, wide applicability for different epoxides and could be recycled five times with almost no loss of activity. Notably, the kinetic experiments demonstrate that ZnTPyPBr4/DVB(1:30)-iPOP exhibited a low activation energy (22.64 kJ mol−1) for the cycloaddition reaction of CO2 and epichlorohydrin in the absence of solvent and cocatalyst. Graphical Abstract A series of zinc(II) porphyrin-based ionic porous organic polymers [ZnTPyPBr4/DVB(1:m)-iPOP (m = 10, 20, 30, 40)] were synthesized and characterized successfully. The iPOPs had abundant dual-function sites (Zn and Br-) and high catalytic efficiency for the cycloaddition reaction of CO2 and epoxides under mild conditions (80 ℃, 0.5 MPa CO2). The kinetic experiments demonstrate that ZnTPyPBr4/DVB(1:30)-iPOP exhibited a low activation energy (22.64 kJ mol−1) for the cycloaddition reaction of CO2 and epichlorohydrin in the absence of solvent and cocatalyst. ga1 Keywords CO2 cycloaddition Epoxides Zinc porphyrin Ionic porous organic polymer Data Availability Data will be made available on request. 1 Introduction Carbon dioxide (CO2), a common gas in the atmosphere, contributes to global warming and climate change owing to its increasing release caused by the large-scale combustion of fossil fuels and deforestation [1]. From another perspective, CO2 is regarded as a nontoxic, ubiquitous, non-flammable, inexpensive and sustainable C1 feedstock in the field of organic synthesis [2]. Therefore, the chemical conversion of CO2 is considered to be a very important strategy in mitigating the above problems [3,4]. In particular, the 100 % atom-economical cycloaddition reaction of CO2 and epoxide has attracted considerable attention for latent applications of cyclic carbonate in lithium-ion batteries, polymer productions and the synthesis of fine chemicals [5,6]. Notably, major hurdles to the transformation of CO2 is its high thermodynamic stability and kinetic inertia, which means an effective catalyst is needed for the successful conversion [7]. In the past few years, numerous homogeneous and heterogeneous catalysts have been developed for the cycloaddition, such as alkali metal salts [8], quaternary phosphonium salts [9,10], porous organic polymers (POPs)[11–13], metal–organic frameworks (MOFs) [14–16]. Compared with homogeneous catalyst, heterogeneous catalyst overcomes the impediment of separation of product and catalyst and is ease of recyclability. As a heterogeneous catalyst, porous organic polymers (POPs) composed of organic building units connected by covalent bonds are very popular in the field of catalysis, especially covalent organic frameworks (COFs) [17–20]. Specifically, POPs are promising catalysts in the cycloaddition of CO2 with epoxides for its hierarchical porous structure, high specific surface areas, adjustable organic functionalities and excellent stability [21]. Synchronously, among POPs, ionic porous organic polymers (iPOPs) exhibit effective catalytic activity owing to the combination of porous networks with charged characteristic [22–25]. More importantly, the bifunctional iPOPs for catalyzing CO2 cycloaddition can be synthesized by incorporating metal active sites and nucleophile into charged frame by appropriate strategies. For instance, recently, Liu et al. reported Lewis acid-base bifunctional pyridine-zinc-based ionic porous organic polymers (Py-Zn@IPOPX, X = Br, I, Ac) constructed by the Schiff base reaction and post-modification strategy, Py-Zn@IPOPI had good catalytic activity for cycloaddition of CO2 and propylene oxide under co-catalyst/ solvent-free conditions [26]. Particularly, owing to the structural designability, rich nitrogen atom and π conjugate structure of molecular, porphyrins are considered to be ideal substrates for the construction of bifunctional iPOPs by the combination of halogen ions introduced to the periphery of the porphyrin and coordinated metal in the center of the porphyrin [27–30]. At present, many porphyrin-based bifunctional iPOPs have been reported and proved that they had excellent catalytic activity for cycloaddition of CO2 with epoxides [31–34]. Earlier this year, our group also reported a zinc(II) porphyrin-based ionic porous organic polymer (ZnTPyPBr4-iPOP) synthesized by free radical self-polymerization of ZnTPyPBr4, which exhibited excellent catalytic performance for the cycloaddition of CO2 and epichlorohydrin. However, the fly in the ointment is that the synthesis temperature of ZnTPyPBr4-iPOP was high (200 ℃) and the BET surface area was small (124.7 m2/g) [35]. Continuing our work, in order to further increase the specific surface area and improve the full contact between substrate and active center, to further achieve effective conversion under mild conditions, a series of zinc(II) porphyrin-based ionic porous organic polymers [ZnTPyPBr4/DVB(1:m)-iPOP (m = 10, 20, 30, 40)] were prepared by the free-radical copolymerization of zinc porphyrin (ZnTPyPBr4) with divinylbenzene (DVB). The polymers had high specific surface areas, relative high CO2 adsorption capacity and abundant dual-function sites, showed good catalytic activity and excellent recyclability in the cycloaddition of CO2 and epoxides under mild conditions (80 ℃, 0.5 MPa CO2). 2 Experimental section 2.1 Materials and instruments All experimental reagents were purchased from commercial sources and used without any further purification, except for H2TPyPBr4 and ZnTPyPBr4, which were synthesized by ourselves (See Scheme 1, Scheme S1 and Fig. S1, S2). Infrared spectra were taken on a BEQ UZNDX 550-FT-IR spectrophotometer (Bruker) with KBr pellets. Solid UV-Vis spectra were performed on a SHIMADZU UV-3600 plus UV-Vis spectrophotometer. UV-Vis spectra were obtained on a Shimadzu UV 1800 UV-Vis spectrophotometer. Scanning electron microscopy (SEM) images were recorded on ZEISS SIGMA. The transmission electron microscopy (TEM) images were observed on a FEI Talos F200X microscope. The surface chemical composition of the sample was determined by X-ray photoelectron spectroscopy (XPS) on the UK Kratos Axis Ultra. The N2 adsorption/desorption isotherms were carried out at 77 K on TriStar II 3020 apparatus (Micromeritics) using nitrogen as the probing gas. CO2 sorption isotherms were performed at 273 K and 298 K using a Micromeritics ASAP 2020 HD88 surface area instrument. The thermal gravimetric analysis (TGA) was recorded on a NETZSCH STA449C instrument from room temperature to 800 °C with a heating rate of 10 °C min−1 in the airflow (20 mL min−1). The PXRD patterns were recorded on a Bruker D8 diffractometer using graphite monochromatic copper radiation (Cu Kα) at 40 kV and 30 mA over the 2θ range from 10° to 60°. The zinc and bromine contents of the catalysts were determined by ICP-OES. 1H NMR spectra were recorded by the AVANCE III 400 MHz instrument. 2.2 Synthesis of ZnTPyPBr4/DVB(1:m)-iPOP (m = 10, 20, 30, 40) As can be seen in Scheme 1, take the synthesis of ZnTPyPBr4/DVB(1:30)-iPOP as an example: firstly, under nitrogen atmosphere, ZnTPyPBr4 (0.20 g, 0.14 mmol, the detailed synthetic procedures were introduced in Supporting information) was dissolved into 1 mL N, N-dimethylformamide (DMF), and then divinylbenzene (DVB, 0.53 g, 4.2 mmol) and azodiisobutyronitrile (initiator: AIBN, 73 mg, 10 wt%) were added successively. The solution was stirred on a magnetic stirrer for 30 min to blend well, and then was placed in a high-pressure reactor at 160 °C for 72 h. After the reaction, the dark green solid powder was obtained, which was washed by DMF for several times and purified by Soxhlet extraction with ethanol as solvent until the solution was colorless. Finally, the dark green powder ZnTPyPBr4/DVB (1:30)-iPOP (0.66 g, yield: 90 %) was obtained by vacuum drying for 8 h. The synthesis processes of other samples (ZnTPyPBr4/DVB(1:m)-iPOP (m = 10, 20, 40)) were similar except that the initial feeding ratio of ZnTPyPBr4 and DVB. ZnTPyPBr4/DVB(1:10)-iPOP: ZnTPyPBr4 (0.20 g, 0.14 mmol), DVB(0.18 g, 1.4 mmol) and initiator AIBN (38 mg, 10 wt%); ZnTPyPBr4/DVB(1:20)-iPOP: ZnTPyPBr4 (0.20 g, 0.14 mmol), DVB(0.36 g, 2.8 mmol) and initiator AIBN (56 mg, 10 wt%); ZnTPyPBr4/DVB(1:40)-iPOP: ZnTPyPBr4 (0.20 g, 0.14 mmol), DVB(0.71 g, 1.4 mmol) and initiator AIBN (91 mg, 10 wt%). 2.3 Catalytic evaluation The cycloaddition of CO2 with epichlorohydrin (ECH) was used to evaluate the catalytic performance. The steps were as follows: firstly, the catalyst and epoxide with the required mass were accurately weighed respectively and added into the quartz glass tube successively, and then the magnetron was added. The quartz glass tube was placed in the magnetic agitator of the 50 mL stainless steel high-temperature and high-pressure reactor, then the reactor was tightly screwed, the CO2 gas cylinder was connected and CO2 was slowly poured into the reactor, and the reactor was left standing for a few minutes. Then the air and CO2 in the kettle were discharged, and the operation was repeated for three times. Finally, 0.5 MPa CO2 was filled into the sealing device, and the reaction temperature was set at 80 ℃. After the reaction, the reactor was first taken out and cooled to room temperature in an ice water bath, then the remaining CO2 in the reactor was slowly drained, the quartz glass tube was taken out, a small amount of trichloromethane was added into the reactor, mixed evenly, and centrifuged to obtain the supernatant. Then 30 μL supernatant was mixed evenly with 0.5 mL deuterium chloroform (CDCl3). 1H NMR was used to analyze the conversion and selectivity of the reaction. The procedure for testing the suitability range of substrate was the same as above, except the ECH was replaced with other epoxides. The experimental steps of recycling were as follows: after each reaction, the solid catalyst was recovered by simple centrifugation and washed three times with trichloromethane. The regenerated solid catalyst was vacuum dried at 60 ℃ for 4 h before entering the next catalytic cycle. 3 Results and discussion 3.1 Characterization of ZnTPyPBr4/DVB(1:m)-iPOP (m = 10, 20, 30, 40) The FTIR spectra of DVB, ZnTPyPBr4 and all iPOPs was illustrated in Fig. 1. The strong stretching vibration absorption peak (1633 cm−1) of CC in olefinic bond appeared in the infrared spectra of DVB and ZnTPyPBr4 while the peak was not obvious in the infrared spectra of all iPOPs. However, all iPOPs showed strong stretching vibration absorption peak of C–H of methylene (–CH2–) at 2928 cm−1, which proved that ZnTPyPBr4 and DVB successfully copolymerized with high degree of polymerization. Furthermore, ZnTPyPBr4 and all iPOPs showed peaks at 992 cm−1 that is the characteristic peak of the N-M of metalloporphyrin, which confirms that the polymerized porphyrin was not destroyed. It is worth noting that for DVB, the strong peak at 989 cm−1 can be attributed to the out-of-plane rocking vibration of protons on olefin carbon (ω = CH). The UV–Vis solid-state spectra of the iPOPs were shown in Fig. 2. ZnTPyPBr4/DVB(1:m)-iPOP (m = 10, 20, 30, 40) exhibited characteristics of metalloporphyrin with one Soret band around 425 nm and two Q bands around 558 and 623 nm, indicating that the molecular structure of zinc porphyrin did not change after polymerization. Notably, compared with ZnTPyPBr4 (Fig. S3), the absorption peak of Soret band of all iPOPs showed obvious blue shift (from 441 nm to 425 nm), which was caused by H-aggregates of ZnTPyPBr4 in iPOPs. The morphologies of all iPOPs were analyzed by SEM and TEM. As shown in Fig. 3, SEM images of ZnTPyPBr4/DVB(1:m)-iPOP showed that the polymers were mainly composed of nano-sized small particles which were loosely deposited to form irregular lamellae aggregates with rough surfaces. TEM images of ZnTPyPBr4/DVB(1:m)-iPOP in Fig. 4 further indicated that the polymers were loosely composed of nanoparticles with many irregular hierarchical pores. In addition, the distribution of elements in ZnTPyPBr4/DVB(1:30)-iPOP was determined by energy dispersive X-ray (EDS) spectroscopy in TEM, as shown in Fig. 4E, C, N, Zn and Br were uniformly distributed in the polymer, demonstrating the successful integration of ZnTPyPBr4 molecules into the polymer framework. The surface chemical composition of ZnTPyPBr4/DVB(1:30)-iPOP was further analyzed by XPS ( Fig. 5). Peaks corresponding to the C 1s, N 1s, Br 3d and Zn 2p levels were shown in the full XPS spectrum, indicating that these elements coexist in ZnTPyPBr4/DVB(1:30)-iPOP. The peaks in the XPS spectrum of N 1s can be classified as photoelectron peak of nitrogen on pyrrole (399.2 eV) and pyridine cationic photoelectron peak (400.5 eV). The XPS spectrum of Zn 2p showed two peaks at the binding energy of 1022.5 eV and 1045.5 eV, corresponding to the characteristic photoelectron peaks of Zn 2p3/2 and Zn 2p1/2, respectively, and the ratio of peak area between the two peaks was 1:2, which proves that Zn2+ was inserted into the porphyrin ring. The fine spectrum of Br 3d showed the characteristic photoelectron peak of Br at 69.1 eV. Moreover, the spectra of Zn 2p and Br 3d confirm the presence of both the Zn2+ active site and the nucleophile Br− active site in ZnTPyPBr4/DVB(1:30)-iPOP. The structural characteristics of iPOPs were studied by nitrogen adsorption and desorption at 77 K. The nitrogen adsorption-desorption isotherms of all iPOPs were shown in Fig. 6A. Among them, the isotherms of these iPOPs were rapidly increased in the region with low relative pressure (P/P0 < 0.1), which was caused by the filling of micropores. While in the region with P/P0 > 0.4, the presence of hysteresis loops indicated the presence of mesopores, which displayed that the iPOPs had a graded porous property. As calculated by the NLDFT method, Fig. 6B showed that the pore size distribution of these iPOPs ranges from 0 nm to 38 nm, further confirming that all iPOPs contained hierarchical pore structures that facilitate the capture of CO2 and the diffusion of reactants and products in catalytic reactions. Notably, the BET surface area and pore volume increased as the ratio of ZnTPyPBr4 to DVB decreased (from 1:10 to 1:40), ZnTPyPBr4/DVB(1:10)-iPOP, ZnTPyPBr4/DVB(1:20)-iPOP, ZnTPyPBr4/DVB(1:30)-iPOP and ZnTPyPBr4/DVB(1:40)-iPOP had large BET specific surface area with 389, 484, 663 and 693 m2 g−1 respectively and large pore volume with 0.30, 0.67, 0.87 and 1.23 cm3 g−1 respectively. At the same time, we can see that the micropores became less and less with the increase of the content of DVB from Fig. 6B, which demonstrated that DVB contributes to the formation of larger pores and the ratio of ZnTPyPBr4 to DVB has a significant effect on the pore structure of iPOPs. The abundant nitrogen atoms and porous structures in ZnTPyPBr4/DVB(1:m)-iPOP (m = 10, 20, 30, 40) can effectively enhance the interaction between CO2 and polymer skeleton. Therefore, CO2 adsorption property of all iPOPs at 273 and 298 K was studied. As shown in Fig. 7A, all iPOPs display good CO2 uptake at 273 K (22.3–24.6 cm3 g−1) and 298 K (12.4–15.2 cm3 g−1), and show similar adsorption capacities for CO2 from the small difference of CO2 uptakes. Among the four iPOPs, the CO2 adsorption property of ZnTPyPBr4/DVB(1:10)-iPOP and ZnTPyPBr4/DVB(1:40)-iPOP were relatively higher. Concretely, the high adsorption capacity of ZnTPyPBr4/DVB(1:10)-iPOP is due to its most micropores and highest ZnTPyPBr4 content. However, the high adsorption capacity of ZnTPyPBr4/DVB(1:40)-iPOP can be attribute to its largest pore volume. In addition, the CO2 isovolumetric adsorption enthalpy (Q st) of iPOPs were calculated by using Clausius–Clapeyron equation (Fig. 7B, Fig. S4–S6), and under low CO2 coverage, the Q st of ZnTPyPBr4/DVB(1:30)-iPOP was 26.1 kJ mol−1, indicating a strong physical interaction between CO2 and the polymer skeleton. In order to explore the thermal stability of heterogeneous catalyst iPOPs, thermogravimetric analysis was performed in N2 atmosphere to obtain its thermogravimetric curves. As can be seen from Fig. 8, all iPOPs samples had excellent thermal stability and significant weight loss occurred at 400 ℃, which may be caused by the decomposition of polymer skeleton. Heterogeneous catalyst iPOPs appeared a residual weight range of 21–40 wt% at 800 ℃, which was due to carbonization of sample, where different residual weights for iPOPs were attributed to their different Zn content and different degrees of crosslinking. The powder X-ray diffraction (PXRD) images of all iPOPs were shown in Fig. S7. All iPOPs samples only showed a dispersion peak produced by amorphous SiO2 from slide glass (background) at 20.5–21.7°, and none of the iPOPs samples showed sharp strong peaks in other locations, which indicated that the iPOPs had amorphous structure. ICP-OES was used to determine the content of active sites (Zn and Br-) in the iPOPs, the data of all iPOPs was summarized in Table S1. As shown in Table S1, the measured values of the content of Zn2+ and Br- in all iPOPs were close to the theoretical values, indicating that these iPOPs had abundant bifunctional active sites, which was important for subsequent catalysis. 3.2 Catalytic evaluation Taking the heterogeneous catalyst ZnTPyPBr4/DVB(1:30)-iPOP as an example, conditions of reactions with 80 ℃, 0.5 MPa CO2, without solvent and cocatalyst were mild. The effects of reaction time and the molar ratio of substrate to catalyst (S/C) on the catalytic activity for cycloaddition reactions of CO2 and ECH were investigated. Fig. 9 showed the effect of reaction time and [ECH]/ [Cat.](S/C) on the catalytic activity of cycloaddition reactions of CO2 and ECH. As can be seen from Fig. 9A, with the increase of reaction time, the conversion of ECH was higher, reaching 99 % in 18 h. However, when the reaction time continued to increase, the conversion of ECH almost did not change. Moreover, the selectivity of the product propylene chlorocarbonate was 99 %. Meanwhile, as shown in Fig. 9B, when S/C decreased from 5000 to 500, the conversion of ECH increased from 30 % to 98 % owing to the increase of catalyst relative amount. Therefore, S/C = 500 was selected as the molar ratio of reaction. Using the reaction time (18 h), reaction temperature (80 ℃), CO2 pressure (0.5 MPa) and S/C (500) as the reaction conditions, the cycloaddition of CO2 and ECH was used the model. The catalytic properties of ZnTPyPBr4/DVB(1:m)-iPOP (m = 10, 20, 30, 40) were evaluated. The results of catalytic experiments were listed in Table 1. As can be seen from Table 1, basically, the conversion of all iPOPs reached more than 90 %, indicating that the four iPOPs had excellent catalytic performance. Meanwhile, the conversion of four iPOPs increased firstly and then decreased with the decrease of the ratio of ZnTPyPBr4 to DVB (from 1:10 to 1:40). When the ratio of ZnTPyPBr4 to DVB was 1:30, the conversion of ECH reached 99 % (Table 1, Entry 3), which may be the result of a combination of the specific surface area and the amount of exposed active sites. Specifically, although ZnTPyPBr4/DVB(1:10)-iPOP and ZnTPyPBr4/DVB(1:20)-iPOP have more exposed active sites than ZnTPyPBr4/DVB(1:30)-iPOP and ZnTPyPBr4/DVB(1:40)-iPOP, the conversion of them were only 90 % and 92 %, respectively (Table 1, Entry 1, 2), which may attribute to their low BET surface area that hindered the diffusion of the reactant (CO2, ECH) in the heterogeneous catalyst. On the contrary, although ZnTPyPBr4/DVB(1:40)-iPOP have highest BET surface area, its conversion was lower than that of ZnTPyPBr4/DVB(1:30)-iPOP (Table 1, Entry 4) owing to the least amount of exposed active sites in the ZnTPyPBr4/DVB(1:40)-iPOP. The highest catalytic activity of ZnTPyPBr4/DVB(1:30)-iPOP may be the result of a relatively suitable ratio of ZnTPyPBr4 to DVB and a high BET specific surface area. These results indicated that both high BET surface area and suitable ratio between monomers are important for the cycloaddition reaction of CO2 and epoxides. Furthermore, ZnTPyPBr4/DVB(1:30)-iPOP was compared with the reported heterogeneous catalyst that catalyzed cycloaddition reaction of CO2 and ECH in Table S2, which demonstrated ZnTPyPBr4/DVB(1:30)-iPOP had excellent catalytic performance. For the cycloaddition reaction of CO2 and ECH, the rate formula of the reaction kinetics equation was shown in Eq. (3.1). In the reaction process, due to the presence of excess CO2, the concentration of CO2 can be considered as a constant. In addition, the amount of catalyst was also fixed, so Eq. (3.1) can be simplified to Eq. (3.2). Because ECH and CO2 cycloaddition reactions were considered to be first order reactions, a= 1. x is the conversion of propylene chlorocarbonate after the reaction time t (h). Eq. (3.2) can be converted to Eq. (3.3). Eq. (3.4) can be obtained by integrating Eq. (3.3) from 0 to t. Therefore, the reaction rate constant k can be represented by the linear slope of linear fitting in Fig. 10A. As can be seen from Fig. 10A, the reaction rate constant k increased with the increase of temperature. According to Arrhenius' rule of thumb, the activation energy E a can be calculated from k at different temperatures as shown in Fig. 10A using Eq. (3.5), where T represents the absolute temperature (K), R is the universal gas constant (8.314 J mol−1 K−1), E a represents the activation energy (kJ mol−1). Moreover, the activation energy of ZnTPyPBr4/DVB(1:30)-iPOP was compared with those of other catalysts, as shown in Table 2. ZnTPyPBr4/DVB(1:30)-iPOP exhibited a low activation energy (22.64 kJ mol−1) at a relatively low CO2 pressure (0.5 MPa) and without cocatalyst. (3.1) r = − d c ECH dt = k c ECH a c CO 2 b (3.2) r = − d c ECH dt = k c ECH a (3.3) r = − d c ECH dt = k c ECH = k 1 − x (3.4) ln 1 − x = − kt + C (3.5) ln k = − E a / RT + C In order to study the application range of cycloaddition reaction of CO2 and epoxides catalyzed by heterogeneous catalyst ZnTPyPBr4/DVB(1:30)-iPOP, six epoxides, namely propylene oxide, epoxybutane, glycidyl phenyl ether, styrene oxide, allyl glycidyl ether and cyclohexene oxide, were selected as substrates of reactions. The catalytic activities of heterogeneous catalyst ZnTPyPBr4/DVB(1:30)-iPOP for different epoxides were explored. The results of catalytic activities were listed in Table 3. As can be seen from Table 3, ZnTPyPBr4/DVB(1:30)-iPOP could effectively catalyze the cycloaddition reaction of CO2 with different epoxides, and all had a high selectivity of 99 %. Among them, the cycloaddition of CO2 and epoxides with small molecular structure (such as propylene oxide and epoxybutane) showed efficient catalytic activity (conversion of 99 % and 94 %, respectively) (Table 3, Entry 1, 2). For the larger substrates, styrene oxide and glycidyl phenyl ether, ZnTPyPBr4/DVB(1:30)-iPOP also showed conversion of 86 % and 88 %, respectively (Table 3, Entry 3, 4). To our surprise, the conversion still reached 54 % after 48 h for the reaction of CO2 with glycidyl phenyl ether at room temperature and 1 bar CO2 (Table 3, Entry 5), which shows the catalytic performance of ZnTPyPBr4/DVB(1:30)-iPOP was excellent. For allyl glycidyl ether, an epoxide with long alkyl side chain, the catalyst also effectively catalyzed its reaction with CO2 (79 %) (Table 3, Entry 6). Nevertheless, the conversion of the catalyst for cyclohexene oxide was only 9 % due to the high steric hindration which hindered the attack of the nucleophile (Br−), making it difficult for cyclohexene oxide to open ring, thus reducing the conversion. (Table 3, Entry 7). The recyclability of heterogeneous catalyst ZnTPyPBr4/DVB(1:30)-iPOP was investigated. Since the catalyst was insoluble in general organic reagents, it can be recovered after each cycle by centrifugation, washing, and drying. Notably, the reaction conditions of cycle experiment were the same as the optimized conditions, except that the reaction time was reduced to 6 h from 18 h for making full use of the active centers of the catalyst during the reaction. In other words, it is difficult to evaluate the stability of catalyst under condition of 18 h because the active centers of the catalyst may not be fully utilized when the conversion reached 99 %. As can be seen in Fig. 11, the experimental results showed that the catalyst was used in 5 cycles, and the conversion of each cycle was kept at 70 %, and the selectivity was kept at 99 %, and there was almost no loss of activity of the catalyst after 5 cycles, which proved that the catalyst had high stability. The SEM images of ZnTPyPBr4/DVB(1:30)-iPOP before used and after 5 cycles (Fig. S8) demonstrated that there was almost no difference between the morphology of the cycled catalyst and that of the newly prepared sample. In addition, the FTIR spectra of ZnTPyPBr4/DVB(1:30)-iPOP before used and after five cycles were consistent (Fig. S9), except the peak appeared at 1790 cm−1 after five cycles, which could be attributed to the stretching vibration of the CO of residual cyclic carbonate on the catalyst after five cycles. Furthermore, in order to further prove the stability of the catalyst, we tested the content of Zn2+ and Br- in ZnTPyPBr4/DVB(1:30)-iPOP after five cycles, and the results showed that the content of Zn2+ and Br- were close to that of the fresh ZnTPyPBr4/DVB(1:30)-iPOP (Table S3), without significant loss of active sites. The results indicated that ZnTPyPBr4/DVB(1:30)-iPOP has excellent stability. 4 Conclusion In summary, four Zinc(II) porphyrin-based ionic porous organic polymers [ZnTPyPBr4/DVB(1:m)-iPOP (m = 10, 20, 30, 40)] with ZnTPyPBr4 and DVB as monomer were prepared by solvothermal method by free radical copolymerization. These bifunctional ionic porous organic polymers had high specific surface areas, relative high CO2 adsorption capacity and abundant bifunctional active sites, which made them exhibited high catalytic activity in the reaction of CO2 cycloaddition to the corresponding cyclic carbonate. Among them, ZnTPyPBr4/DVB (1:30)-iPOP had good substrate applicability and recyclability under the condition of solvent-free and cocatalyst helpless. Therefore, the new efficient bifunctional heterogeneous catalyst is expected to be widely used in the chemical fixation of CO2 into cyclic carbonates. CRediT authorship contribution statement Dan Wang: Validation, Visualization, Writing – original draft, Writing – review & editing. Linjing Ma: Investigation, Validation, Visualization, Data curation, Methodology. Dongping Wang: Software, Formal analysis, Data curation. Renhe Wang: Visualization, Data curation, Software. Ning Wang: Supervision, Project administration, Resources. Jun Li: Conceptualization, Methodology, Resources, Supervision, Project administration, Funding acquisition. Declaration of Competing Interest The authors declare no conflicts of interest. Acknowledgement This work was supported by the Natural Science Basic Research Program of Shaanxi (Program no. 2023-JC-YB-134) and the National Natural Science Foundation of China 21671158 and 21773184. Appendix A Supporting information Supplementary data associated with this article can be found in the online version at doi:10.1016/j.apcata.2023.119380. Appendix A Supplementary material Supplementary material References [1] M. Lu M. Zhang J. Liu Y. Chen J.P. Liao M.Y. Yang Y.P. Cai S.L. Li Y.Q. Lan Angew. Chem. Int. Ed. Engl. 61 2022 e202200003 10.1002/anie.202200003 M. Lu, M. Zhang, J. Liu, Y. Chen, J.P. Liao, M.Y. Yang, Y.P. Cai, S.L. Li.Y.Q. Lan, Angew Chem. Int. Ed. Engl. 61 (2022) e202200003. https://doi.org/10.1002/anie.202200003 [2] B. Grignard S. Gennen C. Jerome A.W. Kleij C. Detrembleur Chem. Soc. Rev. 48 2019 4466 4514 10.1039/c9cs00047j B. Grignard, S. Gennen, C. Jerome, A.W. Kleij. C. Detrembleur, Chem. Soc. Rev. 48 (2019) 4466–4514. https://doi.org/10.1039/c9cs00047j [3] N. Hussain Solangi F. Hussin A. Anjum N. Sabzoi S. Ali Mazari N.M. Mubarak M. Kheireddine Aroua M.T.H. Siddiqui S. Saeed Qureshi J. Mol. Liq. 374 2023 10.1016/j.molliq.2023.121266 N. Hussain Solangi, F. Hussin, A. Anjum, N. Sabzoi, S. Ali Mazari, N.M. Mubarak, M. Kheireddine Aroua, M.T.H. Siddiqui. S. Saeed Qureshi, J. Mol. Liq. 374 (2023). https://doi.org/10.1016/j.molliq.2023.121266 [4] K.A. Oyewole O.B. Okedere K.O. Rabiu K.O. Alawode S. Oyelami Sustain. Environ. 9 2023 10.1080/27658511.2023.2188760 K.A. Oyewole, O.B. Okedere, K.O. Rabiu, K.O. Alawode. S. Oyelami, Sust. Environ. 9 (2023). https://doi.org/10.1080/27658511.2023.2188760 [5] P. Tyagi D. Singh N. Malik S. Kumar R. Singh Malik Mater. Today 2023 10.1016/j.mattod.2023.02.029 P. Tyagi, D. Singh, N. Malik, S. Kumar.R. Singh Malik, Mater. Today (2023). https://doi.org/10.1016/j.mattod.2023.02.029 [6] P.P. Pescarmona Curr. Opin. Chem. Biol. 29 2021 10.1016/j.cogsc.2021.100457 P.P. Pescarmona, Curr. Opin. Chem. Biol. 29 (2021). https://doi.org/10.1016/j.cogsc.2021.100457 [7] N. Yusuf F. Almomani H. Qiblawey Fuel 345 2023 10.1016/j.fuel.2023.128178 N. Yusuf, F. Almomani.H. Qiblawey, Fuel 345 (2023). https://doi.org/10.1016/j.fuel.2023.128178 [8] S. Kaneko S. Shirakawa ACS Sustain. Chem. Eng. 5 2017 2836 2840 10.1021/acssuschemeng.7b00324 S. Kaneko. S. Shirakawa, ACS Sust. Chem. Eng. 5 (2017) 2836–2840. https://doi.org/10.1021/acssuschemeng.7b00324 [9] W. Zhang R. Luo Q. Xu Y. Chen X. Lin X. Zhou H. Ji Chin. J. Catal. 38 2017 736 744 10.1016/s1872-2067(17)62802-x W. Zhang, R. Luo, Q. Xu, Y. Chen, X. Lin, X. Zhou.H. Ji, Chinese J. Catal. 38 (2017) 736–744. https://doi.org/10.1016/s1872–2067(17)62802-x [10] S. Liu N. Suematsu K. Maruoka S. Shirakawa Green Chem. 18 2016 4611 4615 10.1039/c6gc01630h S. Liu, N. Suematsu, K. Maruoka.S. Shirakawa, Green Chem. 18 (2016) 4611–4615. https://doi.org/10.1039/c6gc01630h [11] W. He M. Wen L. Shi R. Wang F. Li J. Solid State Chem. 309 2022 10.1016/j.jssc.2022.122965 W. He, M. Wen, L. Shi, R. Wang.F. Li, J. Solid State Chem. 309 (2022). https://doi.org/10.1016/j.jssc.2022.122965 [12] A. Chen Y. Zhang J. Chen L. Chen Y. Yu J. Mater. Chem. A 3 2015 9807 9816 10.1039/c5ta00993f A. Chen, Y. Zhang, J. Chen, L. Chen.Y. Yu, J. Mater. Chem. A 3 (2015) 9807–9816. https://doi.org/10.1039/c5ta00993f [13] J. Wei D. Wang J. Li J. Zhang N. Wang J. Li Appl. Organomet. Chem. 36 2022 10.1002/aoc.6820 J. Wei, D. Wang, J. Li, J. Zhang, N. Wang.J. Li, Appl. Organomet. Chem. 36 (2022). https://doi.org/10.1002/aoc.6820 [14] J. Lan Y. Qu X. Zhang H. Ma P. Xu J. Sun J. CO2 Util. 35 2020 216 224 10.1016/j.jcou.2019.09.019 J. Lan, Y. Qu, X. Zhang, H. Ma, P. Xu.J. Sun, J. CO2 Util. 35 (2020) 216–224. https://doi.org/10.1016/j.jcou.2019.09.019 [15] K. Yu P. Puthiaraj W.-S. Ahn Appl. Catal. B Environ. 273 2020 10.1016/j.apcatb.2020.119059 K. Yu, P. Puthiaraj.W.-S. Ahn, Appl. Catal. B Environ. 273 (2020). https://doi.org/10.1016/j.apcatb.2020.119059 [16] N. Ullah A. Ramiere W. Raza P. Ye W. Liu X. Cai Z. Peng K.H. Kim J. Colloid Interface Sci. 623 2022 752 761 10.1016/j.jcis.2022.05.082 N. Ullah, A. Ramiere, W. Raza, P. Ye, W. Liu, X. Cai, Z. Peng.K.H. Kim, J. Colloid Interface Sci. 623 (2022) 752–761. https://doi.org/10.1016/j.jcis.2022.05.082 [17] J. Francis Kurisingal H. Kim J. Hyeak Choe C. Seop Hong Coord. Chem. Rev. 473 2022 10.1016/j.ccr.2022.214835 J. Francis Kurisingal, H. Kim, J. Hyeak Choe.C. Seop Hong, Coord. Chem. Rev. 473 (2022). https://doi.org/10.1016/j.ccr.2022.214835 [18] R. Luo Y. Yang K. Chen X. Liu M. Chen W. Xu B. Liu H. Ji Y. Fang J. Mater. Chem. A 9 2021 20941 20956 10.1039/d1ta05428g R. Luo, Y. Yang, K. Chen, X. Liu, M. Chen, W. Xu, B. Liu, H. Ji.Y. Fang, J. Mater. Chem. A 9 (2021) 20941–20956. https://doi.org/10.1039/d1ta05428g [19] R. Ping C. Ma Z. Shen G. Zhang D. Wang F. Liu M. Liu Sep. Purif. Technol. 310 2023 10.1016/j.seppur.2023.123151 R. Ping, C. Ma, Z. Shen, G. Zhang, D. Wang, F. Liu.M. Liu, Sep. Purif. Technol. 310 (2023). https://doi.org/10.1016/j.seppur.2023.123151 [20] F. Liu X. Duan X. Dai S. Du J. Ma F. Liu M. Liu Chem. Eng. J. 445 2022 10.1016/j.cej.2022.136687 F. Liu, X. Duan, X. Dai, S. Du, J. Ma, F. Liu.M. Liu, Chem.Eng.J 445 (2022). https://doi.org/10.1016/j.cej.2022.136687 [21] R. Luo M. Chen F. Zhou J. Zhan Q. Deng Y. Yu Y. Zhang W. Xu Y. Fang J. Mater. Chem. A 9 2021 25731 25749 10.1039/d1ta08146b R. Luo, M. Chen, F. Zhou, J. Zhan, Q. Deng, Y. Yu, Y. Zhang, W. Xu.Y. Fang, J. Mater. Chem. A 9 (2021) 25731–25749. https://doi.org/10.1039/d1ta08146b [22] H. Lyu X. Wang W. Sun E. Xu Y. She A. Liu D. Gao M. Hu J. Guo K. Hu J. Cheng Z. Long Y. Liu P. Zhang Green Chem. 25 2023 3592 3605 10.1039/d3gc00009e H. Lyu, X. Wang, W. Sun, E. Xu, Y. She, A. Liu, D. Gao, M. Hu, J. Guo, K. Hu, J. Cheng, Z. Long, Y. Liu.P. Zhang, Green Chem. 25 (2023) 3592–3605. https://doi.org/10.1039/d3gc00009e [23] X.X. Guo F.L. Zhang Y. Muhammad D.L. Hu Z.T. Cai G.M. Xiao Dalton Trans. 51 2022 3331 3340 10.1039/d1dt04338b X.X. Guo, F.L. Zhang, Y. Muhammad, D.L. Hu, Z.T. Cai.G.M. Xiao, Dalton Trans. 51 (2022) 3331–3340. https://doi.org/10.1039/d1dt04338b [24] W. Xu M. Chen Y. Yang K. Chen Y. Li Z. Zhang R. Luo ChemCatChem 15 2023 10.1002/cctc.202201441 W. Xu, M. Chen, Y. Yang, K. Chen, Y. Li, Z. Zhang.R. Luo, ChemCatChem 15 (2023). https://doi.org/10.1002/cctc.202201441 [25] Q. Yu Y.-Z. Cheng Z. Li D.-H. Yang Q. Bo Meng B.-H. Han Chem. Eng. J. 442 2022 10.1016/j.cej.2022.136275 Q. Yu, Y.-Z. Cheng, Z. Li, D.-H. Yang, Q. Bo Meng.B.-H. Han, Chem.Eng.J 442 (2022). https://doi.org/10.1016/j.cej.2022.136275 [26] W. Zhang R. Ping X. Lu H. Shi F. Liu J. Ma M. Liu Chem. Eng. J. 451 2023 10.1016/j.cej.2022.138715 W. Zhang, R. Ping, X. Lu, H. Shi, F. Liu, J. Ma.M. Liu, Chem.Eng.J 451 (2023). https://doi.org/10.1016/j.cej.2022.138715 [27] T. Higashino T. Yamada T. Sakurai S. Seki H. Imahori Angew. Chem. Int. Ed. Engl. 55 2016 12311 12315 10.1002/anie.201607417 T. Higashino, T. Yamada, T. Sakurai, S. Seki.H. Imahori, Angew Chem. Int. Ed. Engl. 55 (2016) 12311–12315. https://doi.org/10.1002/anie.201607417 [28] D. Wang Z. Gao S. Duan J. Wei L. Ma N. Wang J. Li Appl. Organomet. Chem. 2023 10.1002/aoc.7121 D. Wang, Z. Gao, S. Duan, J. Wei, L. Ma, N. Wang. J. Li, Appl. Organomet. Chem. (2023). https://doi.org/10.1002/aoc.7121 [29] T. Ema Y. Miyazaki J. Shimonishi C. Maeda J.Y. Hasegawa J. Am. Chem. Soc. 136 2014 15270 15279 10.1021/ja507665a T. Ema, Y. Miyazaki, J. Shimonishi, C. Maeda. J.Y. Hasegawa, J. Am. Chem. Soc. 136 (2014) 15270–15279. https://doi.org/10.1021/ja507665a [30] A. Alka V.S. Shetti M. Ravikanth Coord. Chem. Rev. 401 2019 10.1016/j.ccr.2019.213063 A. Alka, V.S. Shetti.M. Ravikanth, Coord. Chem. Rev. 401 (2019). https://doi.org/10.1016/j.ccr.2019.213063 [31] X. Bai Z. Su J. Wei L. Ma S. Duan N. Wang X. Zhang J. Li Ind. Eng. Chem. Res. 61 2022 5093 5102 10.1021/acs.iecr.2c00161 X. Bai, Z. Su, J. Wei, L. Ma, S. Duan, N. Wang, X. Zhang.J. Li, Ind. Eng. Chem. Res. 61 (2022) 5093–5102. https://doi.org/10.1021/acs.iecr.2c00161 [32] M. Chen X. Liu Y. Yang W. Xu K. Chen R. Luo ACS Appl. Mater. Interfaces 15 2023 8263 8274 10.1021/acsami.2c22824 M. Chen, X. Liu, Y. Yang, W. Xu, K. Chen.R. Luo, ACS Appl. Mater. Inter. 15 (2023) 8263–8274. https://doi.org/10.1021/acsami.2c22824 [33] L. Liu S. Jayakumar J. Chen L. Tao H. Li Q. Yang C. Li ACS Appl. Mater. Interfaces 2021 10.1021/acsami.1c04624 L. Liu, S. Jayakumar, J. Chen, L. Tao, H. Li, Q. Yang.C. Li, ACS Appl. Mater. Inter. (2021). https://doi.org/10.1021/acsami.1c04624 [34] Y. Liu S. Wang Z. Dai Y. Xiong Ind. Eng. Chem. Res. 60 2021 18218 18229 10.1021/acs.iecr.1c03340 Y. Liu, S. Wang, Z. Dai.Y. Xiong, Ind. Eng. Chem. Res. 60 (2021) 18218–18229. https://doi.org/10.1021/acs.iecr.1c03340 [35] L. Ma Z. Su N. Wang J. Li Eur. J. Inorg. Chem. 26 2023 10.1002/ejic.202200744 L. Ma, Z. Su, N. Wang. J. Li, Eur. J. Inorg. Chem. 26 (2023). https://doi.org/10.1002/ejic.202200744 [36] Y. Wu X. Song J. Zhang S. Xu N. Xu H. Yang Y. Miao L. Gao J. Zhang G. Xiao Chem. Eng. Res. Des. 140 2018 273 282 10.1016/j.cherd.2018.10.034 Y. Wu, X. Song, J. Zhang, S. Xu, N. Xu, H. Yang, Y. Miao, L. Gao, J. Zhang.G. Xiao, Chem. Eng. Res. Des. 140 (2018) 273–282. https://doi.org/10.1016/j.cherd.2018.10.034 [37] D. Liu G. Li J. Liu Y. Yi Fuel 244 2019 196 206 10.1016/j.fuel.2019.01.167 D. Liu, G. Li, J. Liu.Y. Yi, Fuel 244 (2019) 196–206. https://doi.org/10.1016/j.fuel.2019.01.167 [38] X. Jiang F. Gou F. Chen H. Jing Green Chem. 18 2016 3567 3576 10.1039/c6gc00370b X. Jiang, F. Gou, F. Chen.H. Jing, Green Chem. 18 (2016) 3567–3576. https://doi.org/10.1039/c6gc00370b",
      "scopus-id": "85167789598",
      "coredata": {
        "eid": "1-s2.0-S0926860X23003605",
        "dc:description": "A series of zinc(II) porphyrin-based ionic porous organic polymers [ZnTPyPBr4/DVB(1:m)-iPOP (m = 10, 20, 30, 40)] were synthesized by the free-radical copolymerization of pyridinium–functionalized Zinc(II) porphyrin (ZnTPyPBr4) and divinylbenzene (DVB) through solvothermal method and characterized successfully. The iPOPs had high specific surface areas, relative high CO2 adsorption capacity, abundant dual-function sites (Zn and Br-) and high catalytic efficiency for the cycloaddition reaction of CO2 and epoxides under mild conditions (80 ℃，0.5 MPa CO2). In particular, ZnTPyPBr4/DVB(1:30)-iPOP displayed the highest catalytic activity with a conversion of 99 % for the cycloaddition of CO2 and epichlorohydrin, wide applicability for different epoxides and could be recycled five times with almost no loss of activity. Notably, the kinetic experiments demonstrate that ZnTPyPBr4/DVB(1:30)-iPOP exhibited a low activation energy (22.64 kJ mol−1) for the cycloaddition reaction of CO2 and epichlorohydrin in the absence of solvent and cocatalyst.",
        "openArchiveArticle": "false",
        "prism:coverDate": "2023-09-05",
        "openaccessUserLicense": null,
        "prism:aggregationType": "Journal",
        "prism:url": "https://api.elsevier.com/content/article/pii/S0926860X23003605",
        "dc:creator": [
          {
            "@_fa": "true",
            "$": "Wang, Dan"
          },
          {
            "@_fa": "true",
            "$": "Ma, Linjing"
          },
          {
            "@_fa": "true",
            "$": "Wang, Dongping"
          },
          {
            "@_fa": "true",
            "$": "Wang, Renhe"
          },
          {
            "@_fa": "true",
            "$": "Wang, Ning"
          },
          {
            "@_fa": "true",
            "$": "Li, Jun"
          }
        ],
        "link": [
          {
            "@_fa": "true",
            "@rel": "self",
            "@href": "https://api.elsevier.com/content/article/pii/S0926860X23003605"
          },
          {
            "@_fa": "true",
            "@rel": "scidir",
            "@href": "https://www.sciencedirect.com/science/article/pii/S0926860X23003605"
          }
        ],
        "dc:format": "application/json",
        "openaccessType": null,
        "pii": "S0926-860X(23)00360-5",
        "prism:volume": "665",
        "articleNumber": "119380",
        "prism:publisher": "Elsevier B.V.",
        "dc:title": "Zinc(II) porphyrin-based ionic porous organic polymers (iPOPs) having abundant dual-function sites for promoting cycloaddition of CO2 with epoxides",
        "prism:copyright": "© 2023 Elsevier B.V. All rights reserved.",
        "openaccess": "0",
        "prism:issn": "0926860X",
        "dcterms:subject": [
          {
            "@_fa": "true",
            "$": "CO2 cycloaddition"
          },
          {
            "@_fa": "true",
            "$": "Epoxides"
          },
          {
            "@_fa": "true",
            "$": "Zinc porphyrin"
          },
          {
            "@_fa": "true",
            "$": "Ionic porous organic polymer"
          }
        ],
        "openaccessArticle": "false",
        "prism:publicationName": "Applied Catalysis A: General",
        "openaccessSponsorType": null,
        "prism:pageRange": "119380",
        "pubType": "fla",
        "prism:coverDisplayDate": "5 September 2023",
        "prism:doi": "10.1016/j.apcata.2023.119380",
        "prism:startingPage": "119380",
        "dc:identifier": "doi:10.1016/j.apcata.2023.119380",
        "openaccessSponsorName": null
      },
      "objects": {
        "object": [
          {
            "@category": "standard",
            "@height": "199",
            "@width": "376",
            "@_fa": "true",
            "$": "https://api.elsevier.com/content/object/eid/1-s2.0-S0926860X23003605-gr11.jpg?httpAccept=%2A%2F%2A",
            "@multimediatype": "JPEG image file",
            "@type": "IMAGE-DOWNSAMPLED",
            "@size": "14251",
            "@ref": "gr11",
            "@mimetype": "image/jpeg"
          },
          {
            "@category": "standard",
            "@height": "43",
            "@width": "119",
            "@_fa": "true",
            "$": "https://api.elsevier.com/content/object/eid/1-s2.0-S0926860X23003605-fx6.jpg?httpAccept=%2A%2F%2A",
            "@multimediatype": "JPEG image file",
            "@type": "IMAGE-DOWNSAMPLED",
            "@size": "2349",
            "@ref": "fx6",
            "@mimetype": "image/jpeg"
          },
          {
            "@category": "standard",
            "@height": "39",
            "@width": "89",
            "@_fa": "true",
            "$": "https://api.elsevier.com/content/object/eid/1-s2.0-S0926860X23003605-fx5.jpg?httpAccept=%2A%2F%2A",
            "@multimediatype": "JPEG image file",
            "@type": "IMAGE-DOWNSAMPLED",
            "@size": "1889",
            "@ref": "fx5",
            "@mimetype": "image/jpeg"
          },
          {
            "@category": "standard",
            "@height": "297",
            "@width": "339",
            "@_fa": "true",
            "$": "https://api.elsevier.com/content/object/eid/1-s2.0-S0926860X23003605-gr1.jpg?httpAccept=%2A%2F%2A",
            "@multimediatype": "JPEG image file",
            "@type": "IMAGE-DOWNSAMPLED",
            "@size": "34328",
            "@ref": "gr1",
            "@mimetype": "image/jpeg"
          },
          {
            "@category": "standard",
            "@height": "38",
            "@width": "114",
            "@_fa": "true",
            "$": "https://api.elsevier.com/content/object/eid/1-s2.0-S0926860X23003605-fx8.jpg?httpAccept=%2A%2F%2A",
            "@multimediatype": "JPEG image file",
            "@type": "IMAGE-DOWNSAMPLED",
            "@size": "1884",
            "@ref": "fx8",
            "@mimetype": "image/jpeg"
          },
          {
            "@category": "standard",
            "@height": "268",
            "@width": "678",
            "@_fa": "true",
            "$": "https://api.elsevier.com/content/object/eid/1-s2.0-S0926860X23003605-gr10.jpg?httpAccept=%2A%2F%2A",
            "@multimediatype": "JPEG image file",
            "@type": "IMAGE-DOWNSAMPLED",
            "@size": "34132",
            "@ref": "gr10",
            "@mimetype": "image/jpeg"
          },
          {
            "@category": "standard",
            "@height": "43",
            "@width": "119",
            "@_fa": "true",
            "$": "https://api.elsevier.com/content/object/eid/1-s2.0-S0926860X23003605-fx7.jpg?httpAccept=%2A%2F%2A",
            "@multimediatype": "JPEG image file",
            "@type": "IMAGE-DOWNSAMPLED",
            "@size": "2355",
            "@ref": "fx7",
            "@mimetype": "image/jpeg"
          },
          {
            "@category": "standard",
            "@height": "380",
            "@width": "565",
            "@_fa": "true",
            "$": "https://api.elsevier.com/content/object/eid/1-s2.0-S0926860X23003605-gr3.jpg?httpAccept=%2A%2F%2A",
            "@multimediatype": "JPEG image file",
            "@type": "IMAGE-DOWNSAMPLED",
            "@size": "92823",
            "@ref": "gr3",
            "@mimetype": "image/jpeg"
          },
          {
            "@category": "standard",
            "@height": "291",
            "@width": "339",
            "@_fa": "true",
            "$": "https://api.elsevier.com/content/object/eid/1-s2.0-S0926860X23003605-gr2.jpg?httpAccept=%2A%2F%2A",
            "@multimediatype": "JPEG image file",
            "@type": "IMAGE-DOWNSAMPLED",
            "@size": "26021",
            "@ref": "gr2",
            "@mimetype": "image/jpeg"
          },
          {
            "@category": "standard",
            "@height": "36",
            "@width": "75",
            "@_fa": "true",
            "$": "https://api.elsevier.com/content/object/eid/1-s2.0-S0926860X23003605-fx9.jpg?httpAccept=%2A%2F%2A",
            "@multimediatype": "JPEG image file",
            "@type": "IMAGE-DOWNSAMPLED",
            "@size": "1544",
            "@ref": "fx9",
            "@mimetype": "image/jpeg"
          },
          {
            "@category": "standard",
            "@height": "578",
            "@width": "678",
            "@_fa": "true",
            "$": "https://api.elsevier.com/content/object/eid/1-s2.0-S0926860X23003605-gr5.jpg?httpAccept=%2A%2F%2A",
            "@multimediatype": "JPEG image file",
            "@type": "IMAGE-DOWNSAMPLED",
            "@size": "63649",
            "@ref": "gr5",
            "@mimetype": "image/jpeg"
          },
          {
            "@category": "standard",
            "@height": "795",
            "@width": "565",
            "@_fa": "true",
            "$": "https://api.elsevier.com/content/object/eid/1-s2.0-S0926860X23003605-gr4.jpg?httpAccept=%2A%2F%2A",
            "@multimediatype": "JPEG image file",
            "@type": "IMAGE-DOWNSAMPLED",
            "@size": "118557",
            "@ref": "gr4",
            "@mimetype": "image/jpeg"
          },
          {
            "@category": "standard",
            "@height": "68",
            "@width": "376",
            "@_fa": "true",
            "$": "https://api.elsevier.com/content/object/eid/1-s2.0-S0926860X23003605-fx2.jpg?httpAccept=%2A%2F%2A",
            "@multimediatype": "JPEG image file",
            "@type": "IMAGE-DOWNSAMPLED",
            "@size": "6616",
            "@ref": "fx2",
            "@mimetype": "image/jpeg"
          },
          {
            "@category": "standard",
            "@height": "65",
            "@width": "376",
            "@_fa": "true",
            "$": "https://api.elsevier.com/content/object/eid/1-s2.0-S0926860X23003605-fx1.jpg?httpAccept=%2A%2F%2A",
            "@multimediatype": "JPEG image file",
            "@type": "IMAGE-DOWNSAMPLED",
            "@size": "5437",
            "@ref": "fx1",
            "@mimetype": "image/jpeg"
          },
          {
            "@category": "standard",
            "@height": "38",
            "@width": "67",
            "@_fa": "true",
            "$": "https://api.elsevier.com/content/object/eid/1-s2.0-S0926860X23003605-fx4.jpg?httpAccept=%2A%2F%2A",
            "@multimediatype": "JPEG image file",
            "@type": "IMAGE-DOWNSAMPLED",
            "@size": "1389",
            "@ref": "fx4",
            "@mimetype": "image/jpeg"
          },
          {
            "@category": "standard",
            "@height": "491",
            "@width": "565",
            "@_fa": "true",
            "$": "https://api.elsevier.com/content/object/eid/1-s2.0-S0926860X23003605-sc1.jpg?httpAccept=%2A%2F%2A",
            "@multimediatype": "JPEG image file",
            "@type": "IMAGE-DOWNSAMPLED",
            "@size": "41486",
            "@ref": "sc1",
            "@mimetype": "image/jpeg"
          },
          {
            "@category": "standard",
            "@height": "34",
            "@width": "51",
            "@_fa": "true",
            "$": "https://api.elsevier.com/content/object/eid/1-s2.0-S0926860X23003605-fx3.jpg?httpAccept=%2A%2F%2A",
            "@multimediatype": "JPEG image file",
            "@type": "IMAGE-DOWNSAMPLED",
            "@size": "1140",
            "@ref": "fx3",
            "@mimetype": "image/jpeg"
          },
          {
            "@category": "standard",
            "@height": "200",
            "@width": "444",
            "@_fa": "true",
            "$": "https://api.elsevier.com/content/object/eid/1-s2.0-S0926860X23003605-ga1.jpg?httpAccept=%2A%2F%2A",
            "@multimediatype": "JPEG image file",
            "@type": "IMAGE-DOWNSAMPLED",
            "@size": "24243",
            "@ref": "ga1",
            "@mimetype": "image/jpeg"
          },
          {
            "@category": "standard",
            "@height": "279",
            "@width": "678",
            "@_fa": "true",
            "$": "https://api.elsevier.com/content/object/eid/1-s2.0-S0926860X23003605-gr7.jpg?httpAccept=%2A%2F%2A",
            "@multimediatype": "JPEG image file",
            "@type": "IMAGE-DOWNSAMPLED",
            "@size": "46521",
            "@ref": "gr7",
            "@mimetype": "image/jpeg"
          },
          {
            "@category": "standard",
            "@height": "400",
            "@width": "565",
            "@_fa": "true",
            "$": "https://api.elsevier.com/content/object/eid/1-s2.0-S0926860X23003605-gr6.jpg?httpAccept=%2A%2F%2A",
            "@multimediatype": "JPEG image file",
            "@type": "IMAGE-DOWNSAMPLED",
            "@size": "66354",
            "@ref": "gr6",
            "@mimetype": "image/jpeg"
          },
          {
            "@category": "standard",
            "@height": "251",
            "@width": "715",
            "@_fa": "true",
            "$": "https://api.elsevier.com/content/object/eid/1-s2.0-S0926860X23003605-gr9.jpg?httpAccept=%2A%2F%2A",
            "@multimediatype": "JPEG image file",
            "@type": "IMAGE-DOWNSAMPLED",
            "@size": "32250",
            "@ref": "gr9",
            "@mimetype": "image/jpeg"
          },
          {
            "@category": "standard",
            "@height": "276",
            "@width": "339",
            "@_fa": "true",
            "$": "https://api.elsevier.com/content/object/eid/1-s2.0-S0926860X23003605-gr8.jpg?httpAccept=%2A%2F%2A",
            "@multimediatype": "JPEG image file",
            "@type": "IMAGE-DOWNSAMPLED",
            "@size": "21387",
            "@ref": "gr8",
            "@mimetype": "image/jpeg"
          },
          {
            "@category": "thumbnail",
            "@height": "116",
            "@width": "219",
            "@_fa": "true",
            "$": "https://api.elsevier.com/content/object/eid/1-s2.0-S0926860X23003605-gr11.sml?httpAccept=%2A%2F%2A",
            "@multimediatype": "GIF image file",
            "@type": "IMAGE-THUMBNAIL",
            "@size": "5672",
            "@ref": "gr11",
            "@mimetype": "image/gif"
          },
          {
            "@category": "thumbnail",
            "@height": "80",
            "@width": "219",
            "@_fa": "true",
            "$": "https://api.elsevier.com/content/object/eid/1-s2.0-S0926860X23003605-fx6.sml?httpAccept=%2A%2F%2A",
            "@multimediatype": "GIF image file",
            "@type": "IMAGE-THUMBNAIL",
            "@size": "5064",
            "@ref": "fx6",
            "@mimetype": "image/gif"
          },
          {
            "@category": "thumbnail",
            "@height": "96",
            "@width": "219",
            "@_fa": "true",
            "$": "https://api.elsevier.com/content/object/eid/1-s2.0-S0926860X23003605-fx5.sml?httpAccept=%2A%2F%2A",
            "@multimediatype": "GIF image file",
            "@type": "IMAGE-THUMBNAIL",
            "@size": "6347",
            "@ref": "fx5",
            "@mimetype": "image/gif"
          },
          {
            "@category": "thumbnail",
            "@height": "164",
            "@width": "187",
            "@_fa": "true",
            "$": "https://api.elsevier.com/content/object/eid/1-s2.0-S0926860X23003605-gr1.sml?httpAccept=%2A%2F%2A",
            "@multimediatype": "GIF image file",
            "@type": "IMAGE-THUMBNAIL",
            "@size": "10790",
            "@ref": "gr1",
            "@mimetype": "image/gif"
          },
          {
            "@category": "thumbnail",
            "@height": "74",
            "@width": "219",
            "@_fa": "true",
            "$": "https://api.elsevier.com/content/object/eid/1-s2.0-S0926860X23003605-fx8.sml?httpAccept=%2A%2F%2A",
            "@multimediatype": "GIF image file",
            "@type": "IMAGE-THUMBNAIL",
            "@size": "4271",
            "@ref": "fx8",
            "@mimetype": "image/gif"
          },
          {
            "@category": "thumbnail",
            "@height": "87",
            "@width": "219",
            "@_fa": "true",
            "$": "https://api.elsevier.com/content/object/eid/1-s2.0-S0926860X23003605-gr10.sml?httpAccept=%2A%2F%2A",
            "@multimediatype": "GIF image file",
            "@type": "IMAGE-THUMBNAIL",
            "@size": "4828",
            "@ref": "gr10",
            "@mimetype": "image/gif"
          },
          {
            "@category": "thumbnail",
            "@height": "80",
            "@width": "219",
            "@_fa": "true",
            "$": "https://api.elsevier.com/content/object/eid/1-s2.0-S0926860X23003605-fx7.sml?httpAccept=%2A%2F%2A",
            "@multimediatype": "GIF image file",
            "@type": "IMAGE-THUMBNAIL",
            "@size": "5115",
            "@ref": "fx7",
            "@mimetype": "image/gif"
          },
          {
            "@category": "thumbnail",
            "@height": "147",
            "@width": "219",
            "@_fa": "true",
            "$": "https://api.elsevier.com/content/object/eid/1-s2.0-S0926860X23003605-gr3.sml?httpAccept=%2A%2F%2A",
            "@multimediatype": "GIF image file",
            "@type": "IMAGE-THUMBNAIL",
            "@size": "27010",
            "@ref": "gr3",
            "@mimetype": "image/gif"
          },
          {
            "@category": "thumbnail",
            "@height": "164",
            "@width": "191",
            "@_fa": "true",
            "$": "https://api.elsevier.com/content/object/eid/1-s2.0-S0926860X23003605-gr2.sml?httpAccept=%2A%2F%2A",
            "@multimediatype": "GIF image file",
            "@type": "IMAGE-THUMBNAIL",
            "@size": "8995",
            "@ref": "gr2",
            "@mimetype": "image/gif"
          },
          {
            "@category": "thumbnail",
            "@height": "104",
            "@width": "219",
            "@_fa": "true",
            "$": "https://api.elsevier.com/content/object/eid/1-s2.0-S0926860X23003605-fx9.sml?httpAccept=%2A%2F%2A",
            "@multimediatype": "GIF image file",
            "@type": "IMAGE-THUMBNAIL",
            "@size": "6310",
            "@ref": "fx9",
            "@mimetype": "image/gif"
          },
          {
            "@category": "thumbnail",
            "@height": "164",
            "@width": "192",
            "@_fa": "true",
            "$": "https://api.elsevier.com/content/object/eid/1-s2.0-S0926860X23003605-gr5.sml?httpAccept=%2A%2F%2A",
            "@multimediatype": "GIF image file",
            "@type": "IMAGE-THUMBNAIL",
            "@size": "8261",
            "@ref": "gr5",
            "@mimetype": "image/gif"
          },
          {
            "@category": "thumbnail",
            "@height": "163",
            "@width": "116",
            "@_fa": "true",
            "$": "https://api.elsevier.com/content/object/eid/1-s2.0-S0926860X23003605-gr4.sml?httpAccept=%2A%2F%2A",
            "@multimediatype": "GIF image file",
            "@type": "IMAGE-THUMBNAIL",
            "@size": "10714",
            "@ref": "gr4",
            "@mimetype": "image/gif"
          },
          {
            "@category": "thumbnail",
            "@height": "40",
            "@width": "219",
            "@_fa": "true",
            "$": "https://api.elsevier.com/content/object/eid/1-s2.0-S0926860X23003605-fx2.sml?httpAccept=%2A%2F%2A",
            "@multimediatype": "GIF image file",
            "@type": "IMAGE-THUMBNAIL",
            "@size": "2620",
            "@ref": "fx2",
            "@mimetype": "image/gif"
          },
          {
            "@category": "thumbnail",
            "@height": "38",
            "@width": "219",
            "@_fa": "true",
            "$": "https://api.elsevier.com/content/object/eid/1-s2.0-S0926860X23003605-fx1.sml?httpAccept=%2A%2F%2A",
            "@multimediatype": "GIF image file",
            "@type": "IMAGE-THUMBNAIL",
            "@size": "1796",
            "@ref": "fx1",
            "@mimetype": "image/gif"
          },
          {
            "@category": "thumbnail",
            "@height": "124",
            "@width": "219",
            "@_fa": "true",
            "$": "https://api.elsevier.com/content/object/eid/1-s2.0-S0926860X23003605-fx4.sml?httpAccept=%2A%2F%2A",
            "@multimediatype": "GIF image file",
            "@type": "IMAGE-THUMBNAIL",
            "@size": "6933",
            "@ref": "fx4",
            "@mimetype": "image/gif"
          },
          {
            "@category": "thumbnail",
            "@height": "164",
            "@width": "189",
            "@_fa": "true",
            "$": "https://api.elsevier.com/content/object/eid/1-s2.0-S0926860X23003605-sc1.sml?httpAccept=%2A%2F%2A",
            "@multimediatype": "GIF image file",
            "@type": "IMAGE-THUMBNAIL",
            "@size": "6474",
            "@ref": "sc1",
            "@mimetype": "image/gif"
          },
          {
            "@category": "thumbnail",
            "@height": "148",
            "@width": "219",
            "@_fa": "true",
            "$": "https://api.elsevier.com/content/object/eid/1-s2.0-S0926860X23003605-fx3.sml?httpAccept=%2A%2F%2A",
            "@multimediatype": "GIF image file",
            "@type": "IMAGE-THUMBNAIL",
            "@size": "8884",
            "@ref": "fx3",
            "@mimetype": "image/gif"
          },
          {
            "@category": "thumbnail",
            "@height": "99",
            "@width": "219",
            "@_fa": "true",
            "$": "https://api.elsevier.com/content/object/eid/1-s2.0-S0926860X23003605-ga1.sml?httpAccept=%2A%2F%2A",
            "@multimediatype": "GIF image file",
            "@type": "IMAGE-THUMBNAIL",
            "@size": "8970",
            "@ref": "ga1",
            "@mimetype": "image/gif"
          },
          {
            "@category": "thumbnail",
            "@height": "90",
            "@width": "219",
            "@_fa": "true",
            "$": "https://api.elsevier.com/content/object/eid/1-s2.0-S0926860X23003605-gr7.sml?httpAccept=%2A%2F%2A",
            "@multimediatype": "GIF image file",
            "@type": "IMAGE-THUMBNAIL",
            "@size": "6817",
            "@ref": "gr7",
            "@mimetype": "image/gif"
          },
          {
            "@category": "thumbnail",
            "@height": "155",
            "@width": "219",
            "@_fa": "true",
            "$": "https://api.elsevier.com/content/object/eid/1-s2.0-S0926860X23003605-gr6.sml?httpAccept=%2A%2F%2A",
            "@multimediatype": "GIF image file",
            "@type": "IMAGE-THUMBNAIL",
            "@size": "12266",
            "@ref": "gr6",
            "@mimetype": "image/gif"
          },
          {
            "@category": "thumbnail",
            "@height": "77",
            "@width": "219",
            "@_fa": "true",
            "$": "https://api.elsevier.com/content/object/eid/1-s2.0-S0926860X23003605-gr9.sml?httpAccept=%2A%2F%2A",
            "@multimediatype": "GIF image file",
            "@type": "IMAGE-THUMBNAIL",
            "@size": "4497",
            "@ref": "gr9",
            "@mimetype": "image/gif"
          },
          {
            "@category": "thumbnail",
            "@height": "164",
            "@width": "201",
            "@_fa": "true",
            "$": "https://api.elsevier.com/content/object/eid/1-s2.0-S0926860X23003605-gr8.sml?httpAccept=%2A%2F%2A",
            "@multimediatype": "GIF image file",
            "@type": "IMAGE-THUMBNAIL",
            "@size": "7792",
            "@ref": "gr8",
            "@mimetype": "image/gif"
          },
          {
            "@category": "high",
            "@height": "882",
            "@width": "1663",
            "@_fa": "true",
            "$": "https://api.elsevier.com/content/object/eid/1-s2.0-S0926860X23003605-gr11_lrg.jpg?httpAccept=%2A%2F%2A",
            "@multimediatype": "JPEG image file",
            "@type": "IMAGE-HIGH-RES",
            "@size": "60038",
            "@ref": "gr11",
            "@mimetype": "image/jpeg"
          },
          {
            "@category": "high",
            "@height": "192",
            "@width": "526",
            "@_fa": "true",
            "$": "https://api.elsevier.com/content/object/eid/1-s2.0-S0926860X23003605-fx6_lrg.jpg?httpAccept=%2A%2F%2A",
            "@multimediatype": "JPEG image file",
            "@type": "IMAGE-HIGH-RES",
            "@size": "9393",
            "@ref": "fx6",
            "@mimetype": "image/jpeg"
          },
          {
            "@category": "high",
            "@height": "174",
            "@width": "399",
            "@_fa": "true",
            "$": "https://api.elsevier.com/content/object/eid/1-s2.0-S0926860X23003605-fx5_lrg.jpg?httpAccept=%2A%2F%2A",
            "@multimediatype": "JPEG image file",
            "@type": "IMAGE-HIGH-RES",
            "@size": "7106",
            "@ref": "fx5",
            "@mimetype": "image/jpeg"
          },
          {
            "@category": "high",
            "@height": "1312",
            "@width": "1497",
            "@_fa": "true",
            "$": "https://api.elsevier.com/content/object/eid/1-s2.0-S0926860X23003605-gr1_lrg.jpg?httpAccept=%2A%2F%2A",
            "@multimediatype": "JPEG image file",
            "@type": "IMAGE-HIGH-RES",
            "@size": "164484",
            "@ref": "gr1",
            "@mimetype": "image/jpeg"
          },
          {
            "@category": "high",
            "@height": "172",
            "@width": "511",
            "@_fa": "true",
            "$": "https://api.elsevier.com/content/object/eid/1-s2.0-S0926860X23003605-fx8_lrg.jpg?httpAccept=%2A%2F%2A",
            "@multimediatype": "JPEG image file",
            "@type": "IMAGE-HIGH-RES",
            "@size": "7145",
            "@ref": "fx8",
            "@mimetype": "image/jpeg"
          },
          {
            "@category": "high",
            "@height": "1183",
            "@width": "2994",
            "@_fa": "true",
            "$": "https://api.elsevier.com/content/object/eid/1-s2.0-S0926860X23003605-gr10_lrg.jpg?httpAccept=%2A%2F%2A",
            "@multimediatype": "JPEG image file",
            "@type": "IMAGE-HIGH-RES",
            "@size": "147301",
            "@ref": "gr10",
            "@mimetype": "image/jpeg"
          },
          {
            "@category": "high",
            "@height": "192",
            "@width": "526",
            "@_fa": "true",
            "$": "https://api.elsevier.com/content/object/eid/1-s2.0-S0926860X23003605-fx7_lrg.jpg?httpAccept=%2A%2F%2A",
            "@multimediatype": "JPEG image file",
            "@type": "IMAGE-HIGH-RES",
            "@size": "9492",
            "@ref": "fx7",
            "@mimetype": "image/jpeg"
          },
          {
            "@category": "high",
            "@height": "1677",
            "@width": "2495",
            "@_fa": "true",
            "$": "https://api.elsevier.com/content/object/eid/1-s2.0-S0926860X23003605-gr3_lrg.jpg?httpAccept=%2A%2F%2A",
            "@multimediatype": "JPEG image file",
            "@type": "IMAGE-HIGH-RES",
            "@size": "436222",
            "@ref": "gr3",
            "@mimetype": "image/jpeg"
          },
          {
            "@category": "high",
            "@height": "1285",
            "@width": "1497",
            "@_fa": "true",
            "$": "https://api.elsevier.com/content/object/eid/1-s2.0-S0926860X23003605-gr2_lrg.jpg?httpAccept=%2A%2F%2A",
            "@multimediatype": "JPEG image file",
            "@type": "IMAGE-HIGH-RES",
            "@size": "124650",
            "@ref": "gr2",
            "@mimetype": "image/jpeg"
          },
          {
            "@category": "high",
            "@height": "159",
            "@width": "334",
            "@_fa": "true",
            "$": "https://api.elsevier.com/content/object/eid/1-s2.0-S0926860X23003605-fx9_lrg.jpg?httpAccept=%2A%2F%2A",
            "@multimediatype": "JPEG image file",
            "@type": "IMAGE-HIGH-RES",
            "@size": "5791",
            "@ref": "fx9",
            "@mimetype": "image/jpeg"
          },
          {
            "@category": "high",
            "@height": "2552",
            "@width": "2994",
            "@_fa": "true",
            "$": "https://api.elsevier.com/content/object/eid/1-s2.0-S0926860X23003605-gr5_lrg.jpg?httpAccept=%2A%2F%2A",
            "@multimediatype": "JPEG image file",
            "@type": "IMAGE-HIGH-RES",
            "@size": "301092",
            "@ref": "gr5",
            "@mimetype": "image/jpeg"
          },
          {
            "@category": "high",
            "@height": "3509",
            "@width": "2495",
            "@_fa": "true",
            "$": "https://api.elsevier.com/content/object/eid/1-s2.0-S0926860X23003605-gr4_lrg.jpg?httpAccept=%2A%2F%2A",
            "@multimediatype": "JPEG image file",
            "@type": "IMAGE-HIGH-RES",
            "@size": "573629",
            "@ref": "gr4",
            "@mimetype": "image/jpeg"
          },
          {
            "@category": "high",
            "@height": "302",
            "@width": "1663",
            "@_fa": "true",
            "$": "https://api.elsevier.com/content/object/eid/1-s2.0-S0926860X23003605-fx2_lrg.jpg?httpAccept=%2A%2F%2A",
            "@multimediatype": "JPEG image file",
            "@type": "IMAGE-HIGH-RES",
            "@size": "28563",
            "@ref": "fx2",
            "@mimetype": "image/jpeg"
          },
          {
            "@category": "high",
            "@height": "286",
            "@width": "1663",
            "@_fa": "true",
            "$": "https://api.elsevier.com/content/object/eid/1-s2.0-S0926860X23003605-fx1_lrg.jpg?httpAccept=%2A%2F%2A",
            "@multimediatype": "JPEG image file",
            "@type": "IMAGE-HIGH-RES",
            "@size": "24383",
            "@ref": "fx1",
            "@mimetype": "image/jpeg"
          },
          {
            "@category": "high",
            "@height": "172",
            "@width": "304",
            "@_fa": "true",
            "$": "https://api.elsevier.com/content/object/eid/1-s2.0-S0926860X23003605-fx4_lrg.jpg?httpAccept=%2A%2F%2A",
            "@multimediatype": "JPEG image file",
            "@type": "IMAGE-HIGH-RES",
            "@size": "4724",
            "@ref": "fx4",
            "@mimetype": "image/jpeg"
          },
          {
            "@category": "high",
            "@height": "2168",
            "@width": "2495",
            "@_fa": "true",
            "$": "https://api.elsevier.com/content/object/eid/1-s2.0-S0926860X23003605-sc1_lrg.jpg?httpAccept=%2A%2F%2A",
            "@multimediatype": "JPEG image file",
            "@type": "IMAGE-HIGH-RES",
            "@size": "218813",
            "@ref": "sc1",
            "@mimetype": "image/jpeg"
          },
          {
            "@category": "high",
            "@height": "156",
            "@width": "231",
            "@_fa": "true",
            "$": "https://api.elsevier.com/content/object/eid/1-s2.0-S0926860X23003605-fx3_lrg.jpg?httpAccept=%2A%2F%2A",
            "@multimediatype": "JPEG image file",
            "@type": "IMAGE-HIGH-RES",
            "@size": "3583",
            "@ref": "fx3",
            "@mimetype": "image/jpeg"
          },
          {
            "@category": "high",
            "@height": "886",
            "@width": "1969",
            "@_fa": "true",
            "$": "https://api.elsevier.com/content/object/eid/1-s2.0-S0926860X23003605-ga1_lrg.jpg?httpAccept=%2A%2F%2A",
            "@multimediatype": "JPEG image file",
            "@type": "IMAGE-HIGH-RES",
            "@size": "168337",
            "@ref": "ga1",
            "@mimetype": "image/jpeg"
          },
          {
            "@category": "high",
            "@height": "1231",
            "@width": "2994",
            "@_fa": "true",
            "$": "https://api.elsevier.com/content/object/eid/1-s2.0-S0926860X23003605-gr7_lrg.jpg?httpAccept=%2A%2F%2A",
            "@multimediatype": "JPEG image file",
            "@type": "IMAGE-HIGH-RES",
            "@size": "226693",
            "@ref": "gr7",
            "@mimetype": "image/jpeg"
          },
          {
            "@category": "high",
            "@height": "1768",
            "@width": "2495",
            "@_fa": "true",
            "$": "https://api.elsevier.com/content/object/eid/1-s2.0-S0926860X23003605-gr6_lrg.jpg?httpAccept=%2A%2F%2A",
            "@multimediatype": "JPEG image file",
            "@type": "IMAGE-HIGH-RES",
            "@size": "312036",
            "@ref": "gr6",
            "@mimetype": "image/jpeg"
          },
          {
            "@category": "high",
            "@height": "1109",
            "@width": "3160",
            "@_fa": "true",
            "$": "https://api.elsevier.com/content/object/eid/1-s2.0-S0926860X23003605-gr9_lrg.jpg?httpAccept=%2A%2F%2A",
            "@multimediatype": "JPEG image file",
            "@type": "IMAGE-HIGH-RES",
            "@size": "144112",
            "@ref": "gr9",
            "@mimetype": "image/jpeg"
          },
          {
            "@category": "high",
            "@height": "1219",
            "@width": "1497",
            "@_fa": "true",
            "$": "https://api.elsevier.com/content/object/eid/1-s2.0-S0926860X23003605-gr8_lrg.jpg?httpAccept=%2A%2F%2A",
            "@multimediatype": "JPEG image file",
            "@type": "IMAGE-HIGH-RES",
            "@size": "103631",
            "@ref": "gr8",
            "@mimetype": "image/jpeg"
          },
          {
            "@category": "standard",
            "@_fa": "true",
            "$": "https://api.elsevier.com/content/object/eid/1-s2.0-S0926860X23003605-mmc1.docx?httpAccept=%2A%2F%2A",
            "@multimediatype": "Microsoft Word file",
            "@type": "APPLICATION",
            "@size": "5464251",
            "@ref": "mmc1",
            "@mimetype": "application/word"
          },
          {
            "@category": "thumbnail",
            "@_fa": "true",
            "$": "https://api.elsevier.com/content/object/eid/1-s2.0-S0926860X23003605-si0001.svg?httpAccept=%2A%2F%2A",
            "@multimediatype": "Scalable Vector Graphics file",
            "@type": "ALTIMG",
            "@size": "2872",
            "@ref": "si0001",
            "@mimetype": "image/svg+xml"
          },
          {
            "@category": "thumbnail",
            "@_fa": "true",
            "$": "https://api.elsevier.com/content/object/eid/1-s2.0-S0926860X23003605-si0002.svg?httpAccept=%2A%2F%2A",
            "@multimediatype": "Scalable Vector Graphics file",
            "@type": "ALTIMG",
            "@size": "2406",
            "@ref": "si0002",
            "@mimetype": "image/svg+xml"
          },
          {
            "@category": "thumbnail",
            "@_fa": "true",
            "$": "https://api.elsevier.com/content/object/eid/1-s2.0-S0926860X23003605-si0003.svg?httpAccept=%2A%2F%2A",
            "@multimediatype": "Scalable Vector Graphics file",
            "@type": "ALTIMG",
            "@size": "2787",
            "@ref": "si0003",
            "@mimetype": "image/svg+xml"
          },
          {
            "@category": "thumbnail",
            "@_fa": "true",
            "$": "https://api.elsevier.com/content/object/eid/1-s2.0-S0926860X23003605-si0004.svg?httpAccept=%2A%2F%2A",
            "@multimediatype": "Scalable Vector Graphics file",
            "@type": "ALTIMG",
            "@size": "1705",
            "@ref": "si0004",
            "@mimetype": "image/svg+xml"
          },
          {
            "@category": "thumbnail",
            "@_fa": "true",
            "$": "https://api.elsevier.com/content/object/eid/1-s2.0-S0926860X23003605-si0005.svg?httpAccept=%2A%2F%2A",
            "@multimediatype": "Scalable Vector Graphics file",
            "@type": "ALTIMG",
            "@size": "1880",
            "@ref": "si0005",
            "@mimetype": "image/svg+xml"
          },
          {
            "@category": "standard",
            "@_fa": "true",
            "$": "https://api.elsevier.com/content/object/eid/1-s2.0-S0926860X23003605-am.pdf?httpAccept=%2A%2F%2A",
            "@multimediatype": "Acrobat PDF file",
            "@type": "AAM-PDF",
            "@size": "2182502",
            "@ref": "am",
            "@mimetype": "application/pdf"
          }
        ]
      },
      "link": {
        "@rel": "abstract",
        "@href": "https://api.elsevier.com/content/abstract/scopus_id/85167789598"
      }
    }
  }
}