{
  "metadata": {
    "title": "Linear long-chain α-olefins from hydrodeoxygenation of methyl palmitate over copper phyllosilicate catalysts",
    "authors": "; ; ",
    "journal": "Applied Catalysis A: General",
    "date": "2022-04-05",
    "doi": "10.1016/j.apcata.2022.118555",
    "abstract": "",
    "uri": "https://api.elsevier.com/content/article/pii/S0926860X22000783",
    "pii": "S0926860X22000783"
  },
  "fulltext": {
    "full-text-retrieval-response": {
      "scopus-eid": "2-s2.0-85125250458",
      "originalText": "serial JL 271346 291210 291744 291809 31 Applied Catalysis A: General APPLIEDCATALYSISAGENERAL 2022-02-24 2022-02-24 2022-02-25 2022-02-25 2022-03-25T04:52:44 1-s2.0-S0926860X22000783 S0926-860X(22)00078-3 S0926860X22000783 10.1016/j.apcata.2022.118555 S300 S300.1 FULL-TEXT 1-s2.0-S0926860X22X00069 2024-01-01T12:34:28.416125Z 0 0 20220405 2022 2022-02-24T01:47:34.759812Z absattachment articleinfo articlenumber articletitlenorm authfirstinitialnorm authfirstsurnamenorm cid cids contenttype copyright crossmark dateloaded dateloadedtxt datesearch datesort dateupdated dco docsubtype doctype doi eid ewtransactionid hubeid indexeddate issn issnnorm itemstage itemtransactionid itemweight openaccess openarchive pg pgfirst pii piinorm pubdatestart pubdatetxt pubyr sortorder srctitle srctitlenorm srctype ssids alllist content subj subheadings suppl tomb volfirst volissue volumelist webpdf webpdfpagecount yearnav figure table e-component body acknowledge affil appendices articletitle auth authfirstini authfull authkeywords authlast grantnumber grantsponsor grantsponsorid highlightsabst primabst ref specialabst 0926-860X 0926860X true 635 635 C Volume 635 3 118555 118555 118555 20220405 5 April 2022 2022-04-05 2022 article fla © 2022 Elsevier B.V. All rights reserved. LINEARLONGCHAINOLEFINSHYDRODEOXYGENATIONMETHYLPALMITATEOVERCOPPERPHYLLOSILICATECATALYSTS PRASANSEANG W 1 Introduction 2 Experimental procedure 3 Results and discussion 3.1 Characterization 3.2 Catalytic activity 4 Conclusions CRediT authorship contribution statement Acknowledgements Appendix A Supplementary material References ARTHUR 2013 A FORESTIERE 2009 649 667 A LAPPIN 2014 G ALPHAOLEFINSAPPLICATIONSHANDBOOK TEMBE 1991 2247 2252 G JANAMPELLI 2018 12630 12643 S MISHRA 2018 273 289 V YAN 2017 4600 4609 L BIE 2016 183 190 Y CHEN 2017 124 134 N HAN 2015 107533 107539 F LU 2020 365 411 H LI 2019 1564 1577 J NUMWONG 2020 106393 N JANAMPELLI 2018 219 226 S DELIY 2018 515 I KAEWMEESRI 2021 105128 R PHICHITSURATHAWORN 2020 117644 P ZHANG 2020 117680 P ADKINS 1931 1095 1097 H PESTMAN 1997 255 264 R JANGAM 2021 A THAKUR 2016 1575 1593 D XU 2021 6854 6865 Y KUMAR 2019 186 193 R ZHANG 2017 12624 12632 Z CHEN 2008 172 180 L GONG 2012 13922 13925 J JIANG 2018 5449 5458 J TSOU 2020 54851 54861 Y CHE 2011 C ZHU 2015 1169 1180 S SAGAR 2006 13881 13888 G POOARPORN 2012 937 943 Y DI 2016 244 259 W HELLERKALLAI 1980 355 368 L GAUR 2016 212 218 A MA 2019 2578 2584 K ZOU 2017 1 8 L LEZCANOGONZALEZ 2014 1639 1650 I JANKOWSKA 2020 5651 A LOMATE 2017 3073 3083 S PARRY 1963 371 379 E ZAKI 2001 261 274 M EMEIS 1993 347 354 C XU 2018 1 10 C QIN 2015 79 84 H YE 2016 219 224 C PRASANSEANGX2022X118555 PRASANSEANGX2022X118555XW 2024-02-25T00:00:00.000Z 2024-02-25T00:00:00.000Z http://creativecommons.org/licenses/by-nc-nd/4.0/ © 2022 Elsevier B.V. All rights reserved. 0 2022-06-11T19:36:49.943Z http://vtw.elsevier.com/data/voc/AddOnTypes/50.7/aggregated-refined National Research Council of Thailand NRCT National Research Council of Thailand http://data.elsevier.com/vocabulary/SciValFunders/501100004704 http://sws.geonames.org/1605651/ School of Science, King Mongkut&apos;s Institute of Technology Ladkrabang King Mongkut’s Institute of Technology Ladkrabang KMITL King Mongkut&apos;s Institute of Technology Ladkrabang http://data.elsevier.com/vocabulary/SciValFunders/501100007120 http://sws.geonames.org/1605651/ School of Science, King Mongkut’s Institute of Technology Ladkrabang National Cheng Kung University NCKU National Cheng Kung University http://data.elsevier.com/vocabulary/SciValFunders/501100007750 http://sws.geonames.org/1668284/ Synchrotron Light Research Institute SLRI Synchrotron Light Research Institute http://data.elsevier.com/vocabulary/SciValFunders/501100011752 http://sws.geonames.org/1605651/ Ministry of Education MOE Ministry of Education http://data.elsevier.com/vocabulary/SciValFunders/100009950 http://sws.geonames.org/1605651/ This work is supported by King Mongkut&apos;s Institute of Technology Ladkrabang, Thailand and partly by Higher Education Sprout Project, Ministry of Education to the Headquarters of University Advancement at National Cheng Kung University (NCKU). The authors are also grateful for financial support from the School of Science, King Mongkut&apos;s Institute of Technology Ladkrabang (KMITL) (Grant No. 2565-02-05-022) and National Research Council of Thailand. We would like to thank Synchrotron Light Research Institute (Public organization), Thailand, for the in situ TR-XANES experiments and the Scientific Instruments Center, School of Science, KMITL for characterization techniques. This work is supported by King Mongkut’s Institute of Technology Ladkrabang , Thailand and partly by Higher Education Sprout Project, Ministry of Education to the Headquarters of University Advancement at National Cheng Kung University (NCKU). The authors are also grateful for financial support from the School of Science, King Mongkut’s Institute of Technology Ladkrabang (KMITL) (Grant No. 2565-02-05-022 ) and National Research Council of Thailand . We would like to thank Synchrotron Light Research Institute (Public organization), Thailand, for the in situ TR-XANES experiments and the Scientific Instruments Center, School of Science, KMITL for characterization techniques. https://doi.org/10.15223/policy-017 https://doi.org/10.15223/policy-037 https://doi.org/10.15223/policy-012 https://doi.org/10.15223/policy-029 https://doi.org/10.15223/policy-004 item S0926-860X(22)00078-3 S0926860X22000783 1-s2.0-S0926860X22000783 10.1016/j.apcata.2022.118555 271346 2024-01-01T12:34:28.416125Z 2022-04-05 1-s2.0-S0926860X22000783-main.pdf https://s3-eu-west-1.amazonaws.com/prod-ucs-content-store-eu-west/content/pii:S0926860X22000783/MAIN/application/pdf/b49f2d033e601ad5ca2563726c72f083/main.pdf main.pdf pdf true 8239625 MAIN 11 1-s2.0-S0926860X22000783-main_1.png https://s3-eu-west-1.amazonaws.com/prod-ucs-content-store-eu-west/content/pii:S0926860X22000783/PREVIEW/image/png/f9e31608cc51738a79956e5692e271f4/main_1.png main_1.png png 59694 849 656 IMAGE-WEB-PDF 1 1-s2.0-S0926860X22000783-gr8.jpg https://s3-eu-west-1.amazonaws.com/prod-ucs-content-store-eu-west/content/pii:S0926860X22000783/gr8/DOWNSAMPLED/image/jpeg/bc83b5686e0ef984264c142353e49ab6/gr8.jpg gr8 gr8.jpg jpg 39270 291 678 IMAGE-DOWNSAMPLED 1-s2.0-S0926860X22000783-gr7.jpg https://s3-eu-west-1.amazonaws.com/prod-ucs-content-store-eu-west/content/pii:S0926860X22000783/gr7/DOWNSAMPLED/image/jpeg/e54c4266071dd1860905e4cc1cd2563f/gr7.jpg gr7 gr7.jpg jpg 59774 290 678 IMAGE-DOWNSAMPLED 1-s2.0-S0926860X22000783-gr6.jpg https://s3-eu-west-1.amazonaws.com/prod-ucs-content-store-eu-west/content/pii:S0926860X22000783/gr6/DOWNSAMPLED/image/jpeg/61e9969d2f05b357a3513fa1727d47a4/gr6.jpg gr6 gr6.jpg jpg 125517 426 791 IMAGE-DOWNSAMPLED 1-s2.0-S0926860X22000783-gr5.jpg https://s3-eu-west-1.amazonaws.com/prod-ucs-content-store-eu-west/content/pii:S0926860X22000783/gr5/DOWNSAMPLED/image/jpeg/446be8a21f7bad3837fee4345b094332/gr5.jpg gr5 gr5.jpg jpg 104145 458 678 IMAGE-DOWNSAMPLED 1-s2.0-S0926860X22000783-gr9.jpg https://s3-eu-west-1.amazonaws.com/prod-ucs-content-store-eu-west/content/pii:S0926860X22000783/gr9/DOWNSAMPLED/image/jpeg/700dbb90e7992f9c1487610337c36b52/gr9.jpg gr9 gr9.jpg jpg 37711 328 339 IMAGE-DOWNSAMPLED 1-s2.0-S0926860X22000783-fx7.jpg https://s3-eu-west-1.amazonaws.com/prod-ucs-content-store-eu-west/content/pii:S0926860X22000783/fx7/DOWNSAMPLED/image/jpeg/712d4596d16cbb429f6da75f1de832f7/fx7.jpg fx7 fx7.jpg jpg 328 7 7 IMAGE-DOWNSAMPLED 1-s2.0-S0926860X22000783-gr11.jpg https://s3-eu-west-1.amazonaws.com/prod-ucs-content-store-eu-west/content/pii:S0926860X22000783/gr11/DOWNSAMPLED/image/jpeg/74365d8dd4bf361acda5b27adf39f09d/gr11.jpg gr11 gr11.jpg jpg 46728 259 678 IMAGE-DOWNSAMPLED 1-s2.0-S0926860X22000783-fx6.jpg https://s3-eu-west-1.amazonaws.com/prod-ucs-content-store-eu-west/content/pii:S0926860X22000783/fx6/DOWNSAMPLED/image/jpeg/aa857e063820ff8b8b1277477e4ec910/fx6.jpg fx6 fx6.jpg jpg 371 7 7 IMAGE-DOWNSAMPLED 1-s2.0-S0926860X22000783-gr10.jpg https://s3-eu-west-1.amazonaws.com/prod-ucs-content-store-eu-west/content/pii:S0926860X22000783/gr10/DOWNSAMPLED/image/jpeg/14c06f56274f0cdc5f0e83deac5b5062/gr10.jpg gr10 gr10.jpg jpg 26807 301 339 IMAGE-DOWNSAMPLED 1-s2.0-S0926860X22000783-fx5.jpg https://s3-eu-west-1.amazonaws.com/prod-ucs-content-store-eu-west/content/pii:S0926860X22000783/fx5/DOWNSAMPLED/image/jpeg/cc9b884d8e47f7bea5eba65b277bccea/fx5.jpg fx5 fx5.jpg jpg 379 7 7 IMAGE-DOWNSAMPLED 1-s2.0-S0926860X22000783-fx4.jpg https://s3-eu-west-1.amazonaws.com/prod-ucs-content-store-eu-west/content/pii:S0926860X22000783/fx4/DOWNSAMPLED/image/jpeg/7d712ed4dbb31cd7e6937a97cc574567/fx4.jpg fx4 fx4.jpg jpg 378 7 7 IMAGE-DOWNSAMPLED 1-s2.0-S0926860X22000783-gr12.jpg https://s3-eu-west-1.amazonaws.com/prod-ucs-content-store-eu-west/content/pii:S0926860X22000783/gr12/DOWNSAMPLED/image/jpeg/1768fa7e814764e635fa13be54c51e33/gr12.jpg gr12 gr12.jpg jpg 21267 292 339 IMAGE-DOWNSAMPLED 1-s2.0-S0926860X22000783-sc2.jpg https://s3-eu-west-1.amazonaws.com/prod-ucs-content-store-eu-west/content/pii:S0926860X22000783/sc2/DOWNSAMPLED/image/jpeg/c5380d2abe66a3ec2e30911e8cce23cc/sc2.jpg sc2 sc2.jpg jpg 17073 207 791 IMAGE-DOWNSAMPLED 1-s2.0-S0926860X22000783-gr4.jpg https://s3-eu-west-1.amazonaws.com/prod-ucs-content-store-eu-west/content/pii:S0926860X22000783/gr4/DOWNSAMPLED/image/jpeg/cb928251acd161c980eb435ba224ee11/gr4.jpg gr4 gr4.jpg jpg 50495 294 678 IMAGE-DOWNSAMPLED 1-s2.0-S0926860X22000783-gr3.jpg https://s3-eu-west-1.amazonaws.com/prod-ucs-content-store-eu-west/content/pii:S0926860X22000783/gr3/DOWNSAMPLED/image/jpeg/3b929b819eff5bf359b1fd5840858113/gr3.jpg gr3 gr3.jpg jpg 73904 447 666 IMAGE-DOWNSAMPLED 1-s2.0-S0926860X22000783-gr2.jpg https://s3-eu-west-1.amazonaws.com/prod-ucs-content-store-eu-west/content/pii:S0926860X22000783/gr2/DOWNSAMPLED/image/jpeg/7392d1b8ee46df440cdd76dd9965a288/gr2.jpg gr2 gr2.jpg jpg 25201 342 339 IMAGE-DOWNSAMPLED 1-s2.0-S0926860X22000783-fx8.jpg https://s3-eu-west-1.amazonaws.com/prod-ucs-content-store-eu-west/content/pii:S0926860X22000783/fx8/DOWNSAMPLED/image/jpeg/838047d9eb1de656d998b217b3b5cd59/fx8.jpg fx8 fx8.jpg jpg 364 7 7 IMAGE-DOWNSAMPLED 1-s2.0-S0926860X22000783-gr1.jpg https://s3-eu-west-1.amazonaws.com/prod-ucs-content-store-eu-west/content/pii:S0926860X22000783/gr1/DOWNSAMPLED/image/jpeg/d83fc5365cc21eab416d9df8cb285154/gr1.jpg gr1 gr1.jpg jpg 56981 290 678 IMAGE-DOWNSAMPLED 1-s2.0-S0926860X22000783-fx3.jpg https://s3-eu-west-1.amazonaws.com/prod-ucs-content-store-eu-west/content/pii:S0926860X22000783/fx3/DOWNSAMPLED/image/jpeg/fc90d68a6775d80040da9fa593b237b7/fx3.jpg fx3 fx3.jpg jpg 386 7 7 IMAGE-DOWNSAMPLED 1-s2.0-S0926860X22000783-sc1.jpg https://s3-eu-west-1.amazonaws.com/prod-ucs-content-store-eu-west/content/pii:S0926860X22000783/sc1/DOWNSAMPLED/image/jpeg/fa46572e15d792f408193c1873c67960/sc1.jpg sc1 sc1.jpg jpg 37163 121 678 IMAGE-DOWNSAMPLED 1-s2.0-S0926860X22000783-fx2.jpg https://s3-eu-west-1.amazonaws.com/prod-ucs-content-store-eu-west/content/pii:S0926860X22000783/fx2/DOWNSAMPLED/image/jpeg/ef8a1bb90262cdb3d87fb925ad30fefa/fx2.jpg fx2 fx2.jpg jpg 434 12 12 IMAGE-DOWNSAMPLED 1-s2.0-S0926860X22000783-fx1.jpg https://s3-eu-west-1.amazonaws.com/prod-ucs-content-store-eu-west/content/pii:S0926860X22000783/fx1/DOWNSAMPLED/image/jpeg/654ddfb54bbfcb2b1b4b37674885c360/fx1.jpg fx1 fx1.jpg jpg 502 12 12 IMAGE-DOWNSAMPLED 1-s2.0-S0926860X22000783-ga1.jpg https://s3-eu-west-1.amazonaws.com/prod-ucs-content-store-eu-west/content/pii:S0926860X22000783/ga1/DOWNSAMPLED/image/jpeg/073e8e3b4793f7eaf9fff4915083395a/ga1.jpg ga1 true ga1.jpg jpg 18593 200 324 IMAGE-DOWNSAMPLED 1-s2.0-S0926860X22000783-gr8.sml https://s3-eu-west-1.amazonaws.com/prod-ucs-content-store-eu-west/content/pii:S0926860X22000783/gr8/THUMBNAIL/image/gif/c750bb435f26f8686cb3279079a3ac0d/gr8.sml gr8 gr8.sml sml 6166 94 219 IMAGE-THUMBNAIL 1-s2.0-S0926860X22000783-gr7.sml https://s3-eu-west-1.amazonaws.com/prod-ucs-content-store-eu-west/content/pii:S0926860X22000783/gr7/THUMBNAIL/image/gif/efe390344346250f819ccc2063b07e37/gr7.sml gr7 gr7.sml sml 8461 94 219 IMAGE-THUMBNAIL 1-s2.0-S0926860X22000783-gr6.sml https://s3-eu-west-1.amazonaws.com/prod-ucs-content-store-eu-west/content/pii:S0926860X22000783/gr6/THUMBNAIL/image/gif/564b62cc6ae814c0bda3920b327ccd5b/gr6.sml gr6 gr6.sml sml 15514 118 219 IMAGE-THUMBNAIL 1-s2.0-S0926860X22000783-gr5.sml https://s3-eu-west-1.amazonaws.com/prod-ucs-content-store-eu-west/content/pii:S0926860X22000783/gr5/THUMBNAIL/image/gif/1eed1a3bb35f5672d4bbb4804383999d/gr5.sml gr5 gr5.sml sml 15674 148 219 IMAGE-THUMBNAIL 1-s2.0-S0926860X22000783-gr9.sml https://s3-eu-west-1.amazonaws.com/prod-ucs-content-store-eu-west/content/pii:S0926860X22000783/gr9/THUMBNAIL/image/gif/673af779a7c757e0db7198aea8b82228/gr9.sml gr9 gr9.sml sml 10480 163 169 IMAGE-THUMBNAIL 1-s2.0-S0926860X22000783-fx7.sml https://s3-eu-west-1.amazonaws.com/prod-ucs-content-store-eu-west/content/pii:S0926860X22000783/fx7/THUMBNAIL/image/gif/c3989e0349bbe9130e96b5a1e6ffc06b/fx7.sml fx7 fx7.sml sml 988 35 35 IMAGE-THUMBNAIL 1-s2.0-S0926860X22000783-gr11.sml https://s3-eu-west-1.amazonaws.com/prod-ucs-content-store-eu-west/content/pii:S0926860X22000783/gr11/THUMBNAIL/image/gif/8e0a7e651bd9b3c27f1403f47a7189ab/gr11.sml gr11 gr11.sml sml 6610 84 219 IMAGE-THUMBNAIL 1-s2.0-S0926860X22000783-fx6.sml https://s3-eu-west-1.amazonaws.com/prod-ucs-content-store-eu-west/content/pii:S0926860X22000783/fx6/THUMBNAIL/image/gif/8d43b894e5a83f6752fd33604d5e009f/fx6.sml fx6 fx6.sml sml 1907 35 35 IMAGE-THUMBNAIL 1-s2.0-S0926860X22000783-gr10.sml https://s3-eu-west-1.amazonaws.com/prod-ucs-content-store-eu-west/content/pii:S0926860X22000783/gr10/THUMBNAIL/image/gif/9618020d6e1a23603d49bb41fb45dd22/gr10.sml gr10 gr10.sml sml 8245 164 185 IMAGE-THUMBNAIL 1-s2.0-S0926860X22000783-fx5.sml https://s3-eu-west-1.amazonaws.com/prod-ucs-content-store-eu-west/content/pii:S0926860X22000783/fx5/THUMBNAIL/image/gif/e964777d1cb3fd3c595f527dfbc32a8a/fx5.sml fx5 fx5.sml sml 1737 35 35 IMAGE-THUMBNAIL 1-s2.0-S0926860X22000783-fx4.sml https://s3-eu-west-1.amazonaws.com/prod-ucs-content-store-eu-west/content/pii:S0926860X22000783/fx4/THUMBNAIL/image/gif/a6211d387012d8fb8db1beee57064793/fx4.sml fx4 fx4.sml sml 1829 35 35 IMAGE-THUMBNAIL 1-s2.0-S0926860X22000783-gr12.sml https://s3-eu-west-1.amazonaws.com/prod-ucs-content-store-eu-west/content/pii:S0926860X22000783/gr12/THUMBNAIL/image/gif/b2fd4e8ba5d7f134a869c039541e79c2/gr12.sml gr12 gr12.sml sml 6966 164 190 IMAGE-THUMBNAIL 1-s2.0-S0926860X22000783-sc2.sml https://s3-eu-west-1.amazonaws.com/prod-ucs-content-store-eu-west/content/pii:S0926860X22000783/sc2/THUMBNAIL/image/gif/59b7720443679cc3e1d87846bb8cd254/sc2.sml sc2 sc2.sml sml 1778 57 219 IMAGE-THUMBNAIL 1-s2.0-S0926860X22000783-gr4.sml https://s3-eu-west-1.amazonaws.com/prod-ucs-content-store-eu-west/content/pii:S0926860X22000783/gr4/THUMBNAIL/image/gif/bcb1d20b7f5ba3afcbfa381f7562f2fd/gr4.sml gr4 gr4.sml sml 6586 95 219 IMAGE-THUMBNAIL 1-s2.0-S0926860X22000783-gr3.sml https://s3-eu-west-1.amazonaws.com/prod-ucs-content-store-eu-west/content/pii:S0926860X22000783/gr3/THUMBNAIL/image/gif/9fcad8e65545a308225fd5810382c6a9/gr3.sml gr3 gr3.sml sml 10263 147 219 IMAGE-THUMBNAIL 1-s2.0-S0926860X22000783-gr2.sml https://s3-eu-west-1.amazonaws.com/prod-ucs-content-store-eu-west/content/pii:S0926860X22000783/gr2/THUMBNAIL/image/gif/855b4b729b7d6fec03520e5c7c292b90/gr2.sml gr2 gr2.sml sml 6813 163 162 IMAGE-THUMBNAIL 1-s2.0-S0926860X22000783-fx8.sml https://s3-eu-west-1.amazonaws.com/prod-ucs-content-store-eu-west/content/pii:S0926860X22000783/fx8/THUMBNAIL/image/gif/1b7c1e0b94d0e639a376a7305e0425eb/fx8.sml fx8 fx8.sml sml 1772 35 35 IMAGE-THUMBNAIL 1-s2.0-S0926860X22000783-gr1.sml https://s3-eu-west-1.amazonaws.com/prod-ucs-content-store-eu-west/content/pii:S0926860X22000783/gr1/THUMBNAIL/image/gif/fdbbd4df932e5d37cb8f2eae849e83c2/gr1.sml gr1 gr1.sml sml 8112 94 219 IMAGE-THUMBNAIL 1-s2.0-S0926860X22000783-fx3.sml https://s3-eu-west-1.amazonaws.com/prod-ucs-content-store-eu-west/content/pii:S0926860X22000783/fx3/THUMBNAIL/image/gif/f493edb6bea77a2bad3ffe60a2f6b2e5/fx3.sml fx3 fx3.sml sml 1707 35 35 IMAGE-THUMBNAIL 1-s2.0-S0926860X22000783-sc1.sml https://s3-eu-west-1.amazonaws.com/prod-ucs-content-store-eu-west/content/pii:S0926860X22000783/sc1/THUMBNAIL/image/gif/7472f6e710325bd195508040e6146afc/sc1.sml sc1 sc1.sml sml 5461 39 219 IMAGE-THUMBNAIL 1-s2.0-S0926860X22000783-fx2.sml https://s3-eu-west-1.amazonaws.com/prod-ucs-content-store-eu-west/content/pii:S0926860X22000783/fx2/THUMBNAIL/image/gif/4c43a61d0ca921ade6e7df237868a9d2/fx2.sml fx2 fx2.sml sml 2489 57 57 IMAGE-THUMBNAIL 1-s2.0-S0926860X22000783-fx1.sml https://s3-eu-west-1.amazonaws.com/prod-ucs-content-store-eu-west/content/pii:S0926860X22000783/fx1/THUMBNAIL/image/gif/82576ecac4ba0f0a25a5673e97717f12/fx1.sml fx1 fx1.sml sml 2556 57 57 IMAGE-THUMBNAIL 1-s2.0-S0926860X22000783-ga1.sml https://s3-eu-west-1.amazonaws.com/prod-ucs-content-store-eu-west/content/pii:S0926860X22000783/ga1/THUMBNAIL/image/gif/7496fb311895ce43b165d857d3e665a7/ga1.sml ga1 true ga1.sml sml 13366 135 219 IMAGE-THUMBNAIL 1-s2.0-S0926860X22000783-gr8_lrg.jpg https://s3-eu-west-1.amazonaws.com/prod-ucs-content-store-eu-west/content/pii:S0926860X22000783/gr8/HIGHRES/image/jpeg/adf6a441db5da28c9557c7c4018f8d5f/gr8_lrg.jpg gr8 gr8_lrg.jpg jpg 202731 1286 2994 IMAGE-HIGH-RES 1-s2.0-S0926860X22000783-gr7_lrg.jpg https://s3-eu-west-1.amazonaws.com/prod-ucs-content-store-eu-west/content/pii:S0926860X22000783/gr7/HIGHRES/image/jpeg/0b9c1747b71e678d6f22b6b8e5a13cdb/gr7_lrg.jpg gr7 gr7_lrg.jpg jpg 310285 1281 2994 IMAGE-HIGH-RES 1-s2.0-S0926860X22000783-gr6_lrg.jpg https://s3-eu-west-1.amazonaws.com/prod-ucs-content-store-eu-west/content/pii:S0926860X22000783/gr6/HIGHRES/image/jpeg/eea1b5f91ca5119d2397ace60937973a/gr6_lrg.jpg gr6 gr6_lrg.jpg jpg 954489 1879 3493 IMAGE-HIGH-RES 1-s2.0-S0926860X22000783-gr5_lrg.jpg https://s3-eu-west-1.amazonaws.com/prod-ucs-content-store-eu-west/content/pii:S0926860X22000783/gr5/HIGHRES/image/jpeg/5fd854aa9d32830ad9b9dbd048f2125d/gr5_lrg.jpg gr5 gr5_lrg.jpg jpg 524608 2022 2994 IMAGE-HIGH-RES 1-s2.0-S0926860X22000783-gr9_lrg.jpg https://s3-eu-west-1.amazonaws.com/prod-ucs-content-store-eu-west/content/pii:S0926860X22000783/gr9/HIGHRES/image/jpeg/61e976079054835515f0f04ef6dfdf95/gr9_lrg.jpg gr9 gr9_lrg.jpg jpg 197366 1448 1497 IMAGE-HIGH-RES 1-s2.0-S0926860X22000783-fx7_lrg.jpg https://s3-eu-west-1.amazonaws.com/prod-ucs-content-store-eu-west/content/pii:S0926860X22000783/fx7/HIGHRES/image/jpeg/1540ba8cb7f19af8c3425feb8ec9788b/fx7_lrg.jpg fx7 fx7_lrg.jpg jpg 646 35 35 IMAGE-HIGH-RES 1-s2.0-S0926860X22000783-gr11_lrg.jpg https://s3-eu-west-1.amazonaws.com/prod-ucs-content-store-eu-west/content/pii:S0926860X22000783/gr11/HIGHRES/image/jpeg/81c7c3f9af43fafd7f561853f83fcb1d/gr11_lrg.jpg gr11 gr11_lrg.jpg jpg 234903 1143 2994 IMAGE-HIGH-RES 1-s2.0-S0926860X22000783-fx6_lrg.jpg https://s3-eu-west-1.amazonaws.com/prod-ucs-content-store-eu-west/content/pii:S0926860X22000783/fx6/HIGHRES/image/jpeg/6cd5d36e3cb51477cf0339f553fb53fe/fx6_lrg.jpg fx6 fx6_lrg.jpg jpg 799 35 35 IMAGE-HIGH-RES 1-s2.0-S0926860X22000783-gr10_lrg.jpg https://s3-eu-west-1.amazonaws.com/prod-ucs-content-store-eu-west/content/pii:S0926860X22000783/gr10/HIGHRES/image/jpeg/4b94e7db223a73fc71ee45370e06c66b/gr10_lrg.jpg gr10 gr10_lrg.jpg jpg 133525 1327 1497 IMAGE-HIGH-RES 1-s2.0-S0926860X22000783-fx5_lrg.jpg https://s3-eu-west-1.amazonaws.com/prod-ucs-content-store-eu-west/content/pii:S0926860X22000783/fx5/HIGHRES/image/jpeg/7c365e046edcffeb8c4c253096512ae6/fx5_lrg.jpg fx5 fx5_lrg.jpg jpg 784 35 35 IMAGE-HIGH-RES 1-s2.0-S0926860X22000783-fx4_lrg.jpg https://s3-eu-west-1.amazonaws.com/prod-ucs-content-store-eu-west/content/pii:S0926860X22000783/fx4/HIGHRES/image/jpeg/d4db2ef74115ce917f65efb077e511c4/fx4_lrg.jpg fx4 fx4_lrg.jpg jpg 900 35 35 IMAGE-HIGH-RES 1-s2.0-S0926860X22000783-gr12_lrg.jpg https://s3-eu-west-1.amazonaws.com/prod-ucs-content-store-eu-west/content/pii:S0926860X22000783/gr12/HIGHRES/image/jpeg/7be19afd135910c71631583ded0b6fec/gr12_lrg.jpg gr12 gr12_lrg.jpg jpg 111572 1289 1497 IMAGE-HIGH-RES 1-s2.0-S0926860X22000783-sc2_lrg.jpg https://s3-eu-west-1.amazonaws.com/prod-ucs-content-store-eu-west/content/pii:S0926860X22000783/sc2/HIGHRES/image/jpeg/0752fff969109acabe14b549374b8bb1/sc2_lrg.jpg sc2 sc2_lrg.jpg jpg 106592 915 3493 IMAGE-HIGH-RES 1-s2.0-S0926860X22000783-gr4_lrg.jpg https://s3-eu-west-1.amazonaws.com/prod-ucs-content-store-eu-west/content/pii:S0926860X22000783/gr4/HIGHRES/image/jpeg/02bfdde13c830b9d943f1243bb221c18/gr4_lrg.jpg gr4 gr4_lrg.jpg jpg 271037 1300 2994 IMAGE-HIGH-RES 1-s2.0-S0926860X22000783-gr3_lrg.jpg https://s3-eu-west-1.amazonaws.com/prod-ucs-content-store-eu-west/content/pii:S0926860X22000783/gr3/HIGHRES/image/jpeg/3fa93b8dd4f9c3769a57cb4f35334e2e/gr3_lrg.jpg gr3 gr3_lrg.jpg jpg 443450 1981 2951 IMAGE-HIGH-RES 1-s2.0-S0926860X22000783-gr2_lrg.jpg https://s3-eu-west-1.amazonaws.com/prod-ucs-content-store-eu-west/content/pii:S0926860X22000783/gr2/HIGHRES/image/jpeg/da9d5efc00aaa8db12a08ba862a025c0/gr2_lrg.jpg gr2 gr2_lrg.jpg jpg 147504 1510 1497 IMAGE-HIGH-RES 1-s2.0-S0926860X22000783-fx8_lrg.jpg https://s3-eu-west-1.amazonaws.com/prod-ucs-content-store-eu-west/content/pii:S0926860X22000783/fx8/HIGHRES/image/jpeg/6762b7c4d273338b53e55359b6791903/fx8_lrg.jpg fx8 fx8_lrg.jpg jpg 832 35 35 IMAGE-HIGH-RES 1-s2.0-S0926860X22000783-gr1_lrg.jpg https://s3-eu-west-1.amazonaws.com/prod-ucs-content-store-eu-west/content/pii:S0926860X22000783/gr1/HIGHRES/image/jpeg/f6351b654c687c20919bb3d9b15df76f/gr1_lrg.jpg gr1 gr1_lrg.jpg jpg 345418 1279 2994 IMAGE-HIGH-RES 1-s2.0-S0926860X22000783-fx3_lrg.jpg https://s3-eu-west-1.amazonaws.com/prod-ucs-content-store-eu-west/content/pii:S0926860X22000783/fx3/HIGHRES/image/jpeg/f67fb9662f8ba60a57a955ab23f97936/fx3_lrg.jpg fx3 fx3_lrg.jpg jpg 972 35 35 IMAGE-HIGH-RES 1-s2.0-S0926860X22000783-sc1_lrg.jpg https://s3-eu-west-1.amazonaws.com/prod-ucs-content-store-eu-west/content/pii:S0926860X22000783/sc1/HIGHRES/image/jpeg/25bf10f9a5b4e40d95245db7d5854eb5/sc1_lrg.jpg sc1 sc1_lrg.jpg jpg 187360 534 2994 IMAGE-HIGH-RES 1-s2.0-S0926860X22000783-fx2_lrg.jpg https://s3-eu-west-1.amazonaws.com/prod-ucs-content-store-eu-west/content/pii:S0926860X22000783/fx2/HIGHRES/image/jpeg/f61532c0362478f3aa64db201e66d218/fx2_lrg.jpg fx2 fx2_lrg.jpg jpg 946 57 57 IMAGE-HIGH-RES 1-s2.0-S0926860X22000783-fx1_lrg.jpg https://s3-eu-west-1.amazonaws.com/prod-ucs-content-store-eu-west/content/pii:S0926860X22000783/fx1/HIGHRES/image/jpeg/e922ecd733b7880a7ac307522533e098/fx1_lrg.jpg fx1 fx1_lrg.jpg jpg 1241 57 57 IMAGE-HIGH-RES 1-s2.0-S0926860X22000783-ga1_lrg.jpg https://s3-eu-west-1.amazonaws.com/prod-ucs-content-store-eu-west/content/pii:S0926860X22000783/ga1/HIGHRES/image/jpeg/cb23cb8dad020e6d1596836208131f93/ga1_lrg.jpg ga1 true ga1_lrg.jpg jpg 139373 886 1437 IMAGE-HIGH-RES 1-s2.0-S0926860X22000783-mmc1.pptx https://s3-eu-west-1.amazonaws.com/prod-ucs-content-store-eu-west/content/pii:S0926860X22000783/mmc1/MAIN/application/vnd.openxmlformats-officedocument.presentationml.presentation/62be46c66759baac1c090c0accbd323b/mmc1.pptx mmc1 mmc1.pptx pptx 2435011 APPLICATION 1-s2.0-S0926860X22000783-am.pdf am am.pdf pdf 4080923 AAM-PDF https://s3-eu-west-1.amazonaws.com/prod-ucs-content-store-eu-west/content/egi:10WQBW328RW/MAIN/application/pdf/8a9a0ccb507452167f6264eb5eacca89/am.pdf APCATA 118555 118555 S0926-860X(22)00078-3 10.1016/j.apcata.2022.118555 Elsevier B.V. Fig. 1 XRD patterns of a) calcined and b) reduced CuPS and Cu/SiO2 samples. Fig. 1 Fig. 2 Cu K edge XANES spectra of a) Cu standards and b) CuPS samples and 20Cu/SiO2 after calcination at 400 °C for 2 h. Fig. 2 Fig. 3 Fractions of Cu2+ species ( Image 1 ) Square planar and ( Image 2 ) Octahedral, obtained from linear combination fitting (LCF) of a) 8CuPS, b) 20CuPS, c) 30CuPS and d) 20Cu/SiO2 upon calcination from 50 °C to 400 °C and hold for 120 min. Fig. 3 Fig. 4 a) H2-TPR profiles (from 50 to 900°C) and b) first H2-TPR (solid line) and second H2-TPR (dash line) (from 50 to 250°C) after dissociative N2O adsorption for i) 20Cu/SiO2, ii) 8CuPS, iii) 20CuPS and iv) 30CuPS. Fig. 4 Fig. 5 Fractions of Cu species ( Image 1 ) Cu2+ Square planar; ( Image 2 ) Cu2+ Octahedral; (■) Cu0; ( Image 3 ) Cu+, obtained from linear combination fitting (LCF) of a) 8CuPS, b) 20CuPS, c) 30CuPS and d) 20Cu/SiO2 under reduction in 10%H2/N2 from 50 to 250 °C and hold for 120 min. Fig. 5 Fig. 6 TEM images and particle size distribution histograms of a) 8CuPS, b) 20CuPS, c) 30CuPS and d) 20Cu/SiO2. Fig. 6 Fig. 7 a) NH3-TPD desorption profiles and b) pyridine-adsorbed IR spectra of i) 20Cu/SiO2, ii) 8CuPS, iii) 20CuPS and iv) 30CuPS (B – Brønsted acid sites, L – Lewis acid sites). Fig. 7 Fig. 8 The relationship between a) Lewis acid sites (LAS) vs Cu+ content and b) Brønsted acid sites (BAS) vs Cu0 content. Fig. 8 Fig. 9 Methyl palmitate conversion and yields vs. contact time over 20CuPS catalyst; ( Image 4 ) Conversion; ( Image 5 ) Hexadecanal; ( Image 3 ) Hexadecanol; ( Image 6 ) Hexadecene; ( Image 7 ) Hexadecane; ( Image 8 ) Methanol (Condition: reaction temperature at 250 °C, 20 wt% methyl palmitates in dodecane, feed rate 4.8 mL/min, contact time 94 g.h/mol, activation at 400 °C, reduction at 250 °C,1 atm, and 180 mL/min of H2). Fig. 9 Fig. 10 Products selectivity vs. conversion of methyl palmitate over 20CuPS catalyst; ( Image 5 ) Hexadecanal; ( Image 3 ) Hexadecanol; ( Image 6 ) Hexadecene; ( Image 7 ) Hexadecane. Fig. 10 Fig. 11 The relationship between a) conversion vs Cu surface area and b) Products selectivity and Brønsted acid sites vs Cu loadings. Fig. 11 Fig. 12 Product selectivity at 20% conversion vs Cu+ fractions in CuPS catalysts. Fig. 12 Scheme 1 The demonstration of Cu2+(O h ) transformation to Cu2+(S q ) under the calcination at 400 °C. Scheme 1 Scheme 2 Propose reaction pathway of methyl palmitate conversion over CuPS catalysts. Scheme 2 Table 1 Metal loading, surface area, pore size, pore volume, H2-consumption, Cu surface area and Cu dispersion of CuPS and Cu/SiO2 samples. Table 1 Entry Catalysts Metal content N2 - adsorption H2-TPR Before reduced After reduced H2 consumption (mmol/g) Cu content (wt%) a SCu 0 (m2/g) b DCu (%) b Cu (wt%) c SBET (m2/g) Dpore (Å) Vpore (cm3/g) SBET (m2/g) Dpore (Å) Vpore (cm3/g) 1 8CuPS 7.6 152 290 1.10 115 280 0.80 0.88 5.6 34.4 79.8 2 20CuPS 20.8 344 158 1.35 183 126 0.58 3.02 19.2 92.3 72.9 3 30CuPS 28.0 400 121 1.21 230 98.2 0.56 4.34 27.0 106.3 60.7 4 20Cu/SiO2 18.5 198 207 1.03 178 181 0.79 2.96 18.6 12.7 10.1 a Estimated by H2-TPR. b Calculated by dissociative N2O adsorption. c Determined by XRF. Table 2 Acidity and type of acid sites of all reduced catalysts. Table 2 Entry Catalyst Acidity (µmol/g) a Type of acid site (µmol/g) b Weak acid sites-External silanol (120 °C) Medium acid sites- Cu surface (160 °C) Strong acid sites- Internal silanol (250 °C) Lewis acid (LAS) Brønsted acid (BAS) LAS/Cu+ (x10-2) BAS/Cu S 0 (x10-4) 1 8CuPS 2.1 9.0 9.4 2.35 0.37 1.21 4.3 2 20CuPS 7.1 11.4 9.3 4.08 0.82 1.23 3.8 3 30CuPS 8.2 15.4 10.3 4.28 0.91 1.28 3.6 4 20Cu/SiO2 7.4 5.0 5.3 – – – – a Evaluated by NH3-TPD. b Calculated from FTIR of adsorbed pyridine (Py-IR). Table 3 Catalytic activity, product yields and selectivity in hydrodeoxygenation of methyl palmitate over CuPS catalysts. Table 3 Entry Catalyst W/F (g.h/mol) Conversion (%) Product yields, % (Product selectivity, %) Hexadecene Hexadecane Hexadecanal Hexadecanol Pentadecene Pentadecane 1 20Cu/SiO2 374 13.0 0.7 (5.3) 0.3 (2.3) 2.6 (20.0) 7.8 (60.1) 0.2 (1.3) 0.1 (0.7) 2 20CuPS 374 73.2 30.5(41.7) 17.8 (24.3) 3.3 (4.5) 14.1 (19.2) – – 3 8CuPS 374 19.9 1.6 (8.2) 1.2 (5.9) 3.3 (16.3) 12.2 (61.6) – – 4 30CuPS 374 77.3 32.0 (41.3) 27.0 (35.2) 3.0(3.9) 7.8 (10.1) – – 5 20CuPS 94 21.8 4.2 (19.3) 2.2 (10.1) 3.0 (13.8) 11.9 (54.6) – – 6 30CuPS 63 20.1 5.9 (29.3) 3.1 (15.2) 2.1 (10.6) 9.0 (44.5) – – Condition: reaction temperature: 250 °C, feed rate: 2.4 mL/min, feed: 10 wt% MP in dodecane for contact time of 374 g.h/mol and 20w.t% MP in dodecane for contact time of 94 g.h/mol, activation temperature: 400 °C, reduction temperature: 250 °C, 1 atm, and 180 mL/min of H2. The activity is at 1 h on stream. Linear long-chain α-olefins from hydrodeoxygenation of methyl palmitate over copper phyllosilicate catalysts Warot Prasanseang Investigation Visualization a b Kittisak Choojun Writing – original draft Supervision a b ⁎ Yingyot Poo-arporn Investigation c Ai-Lin Huang Investigation d Yu-Chuan Lin Investigation d Tawan Sooknoi Conceptualization Writing – review & editing Supervision a b ⁎ a Department of Chemistry, School of Science, King Mongkut’s Institute of Technology Ladkrabang, Chalongkrung Road, Ladkrabang, Bangkok 10520, Thailand Department of Chemistry, School of Science, King Mongkut’s Institute of Technology Ladkrabang Chalongkrung Road, Ladkrabang Bangkok 10520 Thailand Department of Chemistry, School of Science, King Mongkut’s Institute of Technology Ladkrabang, Chalongkrung Road, Ladkrabang, Bangkok, 10520, Thailand b Catalytic Chemistry Research Unit, School of Science, King Mongkut’s Institute of Technology Ladkrabang, Chalongkrung Road, Ladkrabang, Bangkok 10520, Thailand Catalytic Chemistry Research Unit, School of Science, King Mongkut’s Institute of Technology Ladkrabang Chalongkrung Road, Ladkrabang Bangkok 10520 Thailand Catalytic Chemistry Research Unit, School of Science, King Mongkut’s Institute of Technology Ladkrabang, Chalongkrung Road, Ladkrabang, Bangkok, 10520, Thailand c Synchrotron Light Research Institute (Public Organization), 111 University Avenue, Muang District, Nakhon Ratchasima 30000, Thailand Synchrotron Light Research Institute (Public Organization) 111 University Avenue, Muang District Nakhon Ratchasima 30000 Thailand Synchrotron Light Research Institute (Public Organization), 111 University Avenue, Muang District, Nakhon Ratchasima, 30000, Thailand d Department of Chemical Engineering, National Cheng Kung University, Tainan 70101, Taiwan, ROC Department of Chemical Engineering, National Cheng Kung University Tainan 70101 Taiwan, ROC Department of Chemical Engineering, National Cheng Kung University, Tainan 70101, Taiwan ⁎ Corresponding author at: Department of Chemistry, School of Science, King Mongkut’s Institute of Technology Ladkrabang, Chalongkrung Road, Ladkrabang, Bangkok 10520, Thailand. Department of Chemistry, School of Science, King Mongkut’s Institute of Technology Ladkrabang Chalongkrung Road, Ladkrabang Bangkok 10520 Thailand Copper phyllosilicate (CuPS) was used as a bifunctional catalyst for hydrodeoxygenation of methyl palmitate (MP) to produce long-chain α-olefins without the loss of carbon backbone. The CuPS catalysts were prepared by ammonia evaporation-hydrothermal method. The crystal structure, surface area, reducibility, Cu dispersion, Cu particle size and acidity of the catalysts were examined by XRD, BET, H2-TPR, TEM, NH3-TPD and Py-IR. The existence of Cu2+ species (octahedral (O h )/square planar (Sq)), Cu+ and Cu0 upon calcination/reduction was investigated by in situ TR-XANES. The Cu dispersion was related to the Cu+ fraction in CuPS, while Brønsted acid sites (BAS) depends on Cu0 particles. The MP conversion to 1-hexadecene proceeds via hydrogenation-dehydration promoted by the synergy of Cu0 surface and Brønsted acid sites at the interface. The α-olefin selectivity depends on a balance between Cu+ and Cu loading. The 20CuPS possessing 10% Cu+ fraction, provides a high conversion of 72% with 45% α-olefin selectivity. Graphical Abstract ga1 Keywords Hydrodeoxygenation Copper phyllosilicate Methyl palmitate Linear long-chain α-olefins Bifunctional catalyst 1 Introduction Linear long-chain α-olefins are necessary intermediate chemicals widely used as detergents, surfactants, plasticizers, synthetic lubricants, synthetic drilling fluids and co-monomers [1–3]. Industrially, they are produced by the oligomerization of ethylene, which is derived from non-renewable feedstock [4]. Alternatively, fatty acid methyl esters (FAMEs), obtained from bio-based resources, offer an renewable route to produce these linear long-chain α-olefins [5–7]. Due to a ample supply of palm oils, especially in South East Asia, South America and Africa, and the available technology to commercially produce FAMEs from palm oils, these bring out the opportunity to use FAMEs as a feedstock to produce linear long-chain α-olefins [8–10]. Typically, the hydrodeoxygenation of FAMEs to α-olefins could proceed via decarbonylation [11] and hydrogenation-dehydration [12]. The decarbonylation yields long-chain α-olefins from the removal of the ester as CO and H2, over various metal catalysts, such as (Pd [13], Pt [14]) Ni [15] and Co [16,17]. However, this process suffers two-carbon loss (the methyl and the carbonyl groups), bearing α-olefins with one carbon shorter than the parent FAMEs backbone. Furthermore, with the ready hydrogen dissociation ability of these metal catalysts, the olefin formed can be subsequently hydrogenated to paraffin. Hydrogenation-dehydration, on the other hand, could provide the α-olefins without the carbon loss over bifunctional catalysts. In this reaction, FAMEs would be selectively hydrogenated at CO to alcohol (C-OH) intermediate that could be subsequently dehydrated to α-olefins. The methanol formed in the first step (hydrogenation) can then be recycled for the FAMEs production from triglyceride [18]. A preferred bifunctional catalyst for hydrogenation-dehydration shall consist of a chemoselective metal for CO hydrogenation and a weak acid for alcohol dehydration. Typically, Cu-based catalysts interact with FAMEs via η1 adsorption of CO, providing selective hydrogenation of ester to alcohol without the decarbonylation [19,20]. Pestman, et al. suggested that the selective CO hydrogenation can be obtained from the synergistic effect of Cu+/Cu0 species in the partially reduced CuO catalysts, where Cu+ species is responsible for η1 adsorption of CO and Cu0 species is active for CO hydrogenation [21]. Other studies also show that the hydrogenation of carboxylic acids yields mainly alcohols over Cu-based catalysts [22–24]. The presence of Cu+ in these catalysts also provides weak acid sites for the subsequent dehydration of the alcohol produced. However, maintaining both Cu+ and Cu0 species in the catalysts with high Cu dispersion is challenging because of the poor interaction between Cu and the support. Furthermore, the Cu agglomerate and/or sintering would be readily at above 10 wt% Cu loading [25,26]. Recently, the copper catalyst derived from copper phyllosilicate (CuPS) precursor has been reported to possess a high Cu dispersion (even at >20 wt% Cu loading) with the presence of both Cu+ and Cu0 species after the reduction. This is due to a strong interaction between Cu2+ and SiO2 in the well-defined lamellar structure [27]. Gong, et al. mentioned that such high dispersion in CuPS is because of the presence of Cu+ species [28]. Jiang, et al. also commented on the presence of Cu+/Cu0 in CuPS for hydrogenation of adipic acid to 1,6-hexanediol [29]. Apart from weak acid sites provided by Cu+ species, the chrysocolla structure of CuPS could offer additional Brønsted acid sites from surface silanol groups [30]. Che, et al. mentioned that the condensation of Si-O-Ni-OH species in the octahedral layer of phyllosilicate structure during the calcination yielded NiOx clusters and Si-OH [31]. Such generated silanols, especially those on the perimeter of metal particles, could have a stronger Brønsted acidity than that of the typical silanol. Even though no catalytic activity of these Brønsted acid sites has been revealed, these sites shall promote the dehydration of alcohols to α-olefins over the CuPS. Moreover, the high selectivity of α-olefins could be obtained since Cu is less active towards the olefin hydrogenation. With this regard, we reported the hydrodeoxygenation (HDO) of FAMEs to produce linear long-chain α-olefins using CuPS catalysts in a gas-phase reactor under atmospheric H2 pressure. Methyl palmitate (MP) was selected as a feed model for FAMEs. The effect of Cu loading on the reducibility and Cu dispersion was evaluated by the dissociative N2O adsorption followed by a subsequent H2-temperature-programmed reduction (H2-TPR) test, and transmission electron microscopy (TEM). The existence and transformation of Cu species in the CuPS upon calcination and reduction were investigated using in situ time-resolved X-ray adsorption near-edge structure spectroscopy (in-situ TR-XANES) and X-ray diffraction spectroscopy (XRD). The influence of Cu loading on the nature of Cu species and its relationships with Brønsted/Lewis acid sites were investigated. The structure-activity relation of active Cu surface area, acid sites, and the selectivity of linear long-chain α-olefin was thereby revealed. 2 Experimental procedure Copper phyllosilicates (CuPS) were prepared by the ammonia evaporation hydrothermal method [32]. Briefly, the appropriate amounts of Cu(NO3)2•3 H2O were dissolved in 30 mL of deionized water. Then, four equivalent moles of NH3 (30 wt% NH4OH solution) were added to the solution under vigorous stirring. After 30 min, 5.84 g of colloidal silica (LUDOX® AS-40, Sigma-Aldrich 420840) were introduced into this mixture and stirred for 24 h. The mixture was then heated at 80 °C in a water bath to evaporate NH3, in which the pH was dropped from 11 to ~7. The remaining mixture was transferred to Teflon-line autoclaved and was then treated hydrothermally at 150 ๐C for 24 h. After that, the suspension was filtered, washed with deionized water, and dried at 60 °C for 24 h. The obtained solids were then calcined in a horizontal tube furnace under air (60 mL/min) at 400 °C (2 °C/min) for 4 h. The samples were denoted as xCuPS where x = 8, 20 and 30 wt% of Cu loading. These samples were reduced at 250 °C (10 °C/min) under H2 (60 mL/min) for 2 h. 20 wt% copper supported on silica (denoted as 20Cu/SiO2) was prepared by incipient wetness impregnation method using copper nitrate trihydrate as a precursor. Briefly, 9.51 g of Cu(NO3)2•3 H2O were dissolved in 30.0 mL of deionized water. After that, 10 g of SiO2 (Davisil Grade 646, Supelco 236845) were impregnated by the prepared solution to the wetness and was dried at 50 °C. The process was repeated until the prepared solution was used up. Then, the obtained solid was dried in an oven at 70 °C for 24 h. The dried sample was calcined in a horizontal tube furnace under air (60 mL/min) at 400 °C (10 °C/min) for 4 h. The obtained samples were reduced at 250 °C (10 °C/min) under H2 (60 mL/min) for 2 h, assigned as 20Cu/SiO2. The amounts of Cu loading in the catalysts were determined by X-ray fluorescence spectrometer (XRF, Bruker s8 tiger). The crystal structure of the samples was examined by X-ray diffractometer (XRD) using D8-Discover diffractometer with CuKα radiation. Nitrogen adsorption and desorption isotherms were measured at − 195 °C after dehydration under vacuum at 150 °C for 12 h on a Quantachrome gas analyzer. The Cu nanoparticle size was measured by transmission electron microscopy (TEM) on a JEM-2010. The sample was dispersed in ethanol and deposited on copper grids coated with transparent carbon foil and dried in vacuum. The reducibility of all samples was evaluated by the self-designed H2-TPR system equipped with a thermal conductivity detector (VICI). Briefly, before the reduction, 15 mg of catalyst was calcined in air at 400 °C (10 °C/min) for 2 h and cooldown under N2. The catalyst was then reduced under 10%H2/Ar from 50 to 900 °C with a heating rate of 10 °C/min. The copper dispersion was estimated by dissociative N2O adsorption technique. Briefly, after the first H2-TPR at 250 °C for 2 h, the sample was subsequently treated in a pure N2O stream at 60 °C for 1 h. After that the N2O was flushed with N2 at 60 °C for 30 min and then raised to 110 °C and hold for 30 min. Finally, the second H2-TPR was then performed from room temperature to 250 °C, to quantify the surface Cu species. The copper dispersion (D Cu ) can be estimated by fraction of surface Cu (2nd H2-TPR) over total Cu (1st H2-TPR). The copper dispersion and specific copper surface area can be calculated, as described by Sagar, et al [33]. The acidity of samples was quantified by NH3 temperature-programmed desorption (NH3-TPD) using 1% NH3/Ar, equipped with a thermal conductivity detector. Briefly, prior to the NH3 adsorption, 50 mg of catalysts were calcined in air at 400 °C (10 °C/min) for 2 h and cooldown under N2. After that, the sample was adsorbed by 1% NH3/Ar at room temperature for 1 h. Then, the remaining 1% NH3/Ar was flushed by He for 1 h. Finally, the NH3 desorption was performed from 50 to 900 °C with a heating rate of 10 °C/min. The Brønsted and Lewis acid sites were analyzed using pyridine-adsorbed infrared spectroscopy (Py-IR, Thermo Scientific Nicolet iS50 spectrometer with an in-situ quartz cell). Briefly, the sample was reduced at 250 °C for 2 h under 10% H2/Ar (50 mL/min). Once it was cooled down to 150 °C, the sample was purged by pyridine vapor for 1 h. After that, excess pyridine was removed under a vacuum (1.2 × 10–3 Pa) for 1 h. Finally, the sample was heated to 200 °C (10 °C/min) and the FTIR spectra were recorded [30]. In situ time-resolved X-ray adsorption near-edge structure (in situ TR-XANES) experiments were performed at BL2.2: TRXAS, Synchrotron Light Research Institute (SLRI), Thailand. An energy dispersive monochromator and position sensitive detector was employed to perform XANES measurement [34]. The Cu K-edge XANES was collected using the integration time of 2000 ms with an average of 10 scans. The oxidation state of copper composition was estimated by Linear Combination Fitting (LCF) of XANES spectra over Athena software using Cu foil, Cu2O, CuO and CuSO4 as a standard. The methyl palmitate conversion was investigated in a continuous fixed-bed reactor made with a glass tube (8 mm O.D.) under the atmospheric pressure of H2. Before the catalytic testing, the catalyst (250 mg) was calcined under air (60 mL/min) at 400 °C with a heating rate of 10 °C/min for 2 h. It was then naturally cooled down to 50°C under N2. Next, the catalyst was reduced under H2 (60 mL/min) at 250 °C (10 °C/min) for 2 h. Finally, the reaction was performed using 10 wt% methyl palmitate in dodecane (2.4 mL/h) under the stream of H2 (180 mL/min). The liquid products were trapped with iso-propanol and collected to analyze by gas chromatography (7890B, Agilent, USA) equipped with a capillary column (MXT-1, 60 m, ID 0.25 mm) and flame ionization detector (FID). The analysis was started by ramping the oven from 50 to 280 °C (12 °C/min) and hold at the final temperature for 5 min. Nitrogen was used as carrier gas with a linear velocity of 30 cm/sec. 3 Results and discussion 3.1 Characterization Cu contents of the prepared catalysts are summarized in Table 1. The observed metal loadings are in agreement with the desired catalyst preparation. All calcined CuPS samples show weak XRD peaks at 30.8˚, 35.0˚, 57.5˚ and 62.4˚, corresponding to the chrysocolla characteristics (Cu2Si2O5(OH)2) of the copper phyllosilicate [27], as shown in Fig. 1a, ii-iv. The characteristic peak of copper phyllosilicate was more pronounced when copper loading was increased, particularly at ≥ 20 wt%Cu. This is because the formation of the chrysocolla structure requires Cu2+ in the octahedral layers [32]. In a supportive manner, a board signal of amorphous SiO2 at 2θ 20˚–30˚ become flatter, especially in 30CuPS [29]. The surface area of the samples is also increased upon the increment of copper content (152–400 m2/g for 8–30 wt%CuPS), as in Table 1 entry 1–3. furthermore, all samples show a type IV N2 adsorption-desorption isotherm (Fig. S1), indicating the mesoporous character of phyllosilicates with the pore diameters in the range of 3–50 nm, similar to those reported in the literature [29]. It is important to mention that the CuO phase was not detected in all calcined CuPS samples, even at 30 wt% loading. However, the characteristic peaks of CuO were clearly pronounced in 20Cu/SiO2 with the crystalline size of 26 nm, as shown in Fig. 1a, i. These observations lead to the suggestion that the Cu2+ species is highly dispersed as well-defined Cu2+ ions strongly interact with the SiO2 layers in octahedral sites in the chrysocolla structure of the phyllosilicates [35]. On the other hand, a much weaker interaction between Cu2+ and SiO2 could lead to an agglomeration of CuO particles upon calcination for the impregnated sample. This also results in a notable drop in surface area (from 331 to198 m2/g) compared with the parent SiO2 support, presumably due to the pore blocking (from 1.33 to 1.03 cm3/g). It is worth noting that the observed mesopores in 20Cu/SiO2 belong to the silica support (Davisil). To gain more details about the Cu species in the calcined CuPS samples, the in situ time-resolved X-ray absorption near-edge spectroscopy (in situ TR-XANES) was performed, as shown in Fig. 2. The Cu edges energy for Cu foil, Cu2O, CuO (square planar geometry, Cu2+(Sq)) and CuSO4 (octahedral geometry, Cu2+(O h )), are 8979.1, 8980.5, 8990.2 and 8992.3 eV, respectively (Table S1). Compared to the Cu standards, all calcined CuPS samples exhibit characteristic edge energy absorption for Cu2+ at ~8991 eV. It is important to emphasize that the values fall between the Cu edge energy of CuSO4 (8992.3 eV) and CuO (8890.2 eV). Hence, it is likely that a mixture of octahedral Cu2+(O h ) and square planar Cu2+(Sq) is present in the calcined CuPS samples. However, the line-shape spectra of the samples are more resemble that of CuSO4, without a pre-edge feature at ~8984 eV that represents the square planer Cu2+(Sq) species (Fig. 2b). This indicates that the majority of the Cu2+ species in the CuPS samples exist in the octahedral geometry, presumably within the chrysocolla structure. To quantify the octahedral Cu2+(O h ) and square planar Cu2+(Sq) species, the linear combination fitting (LCF) of in situ TR-XANES spectra was performed on the calcined samples, as examples shown in Fig. S2. The composition from the LCF as a function of temperature is shown in Fig. 3. At 50°C, the 8CuPS possesses relatively higher fraction of octahedral Cu2+(O h ) (76%), as compared to 20CuPS (66%) and 30CuPS (62%). In consistence with this finding, the Cu edge energy slightly shifts to a lower value for the samples with higher Cu loadings. This could suggest a relatively lower electron density of Cu2+ in 8CuPS, as compared to 20CuPS and 30CuPS. The in situ TR-XANES also demonstrated that the Cu2+(O h ) species are converted into Cu2+(Sq) species, upon heating from 50 °C to 400 °C (Fig. 3, a–c). This is presumably due to (i) the dehydration of adsorbed water at the layer edge and (ii) the dehydroxylation of the interlayered Si-O-Cu-(OH)2, as reported by Heller-Kallai et al. [36]. The dehydroxylation could proceed via protonation of the adjacent hydroxyls, forming a highly dispersed Cu2+(Sq) species, as shown in Scheme 1 . On the contrary, Cu edge energy of calcined 20Cu/SiO2 (8990.2 eV) exactly matches that of the CuO standard (8990.2 eV). Together with a pre-edge feature at ~8984 eV (Fig. 2b), the Cu2+ species in the impregnated sample would virtually exist in 4-coordinate square planar geometry [37]. In line with this view, the LCF shows only Cu2+(Sq) species in 20Cu/SiO2 (Fig. 3d). This result is also consistent with the XRD results where the high crystalline CuO particles are observed. Accordingly, the 20Cu/SiO2 exhibits a relatively broad reduction peak (~220 °C) for large and ununiform CuO particles ( Fig. 4a, i) [32]. While CuPS samples show a sharp reduction peak at lower temperatures (~181–186 °C, Fig. 4a, ii-iv). Together with an absence of CuO peak in the XRD, these features indicate a highly dispersed Cu2+ species in CuPS samples. Moreover, the reduction peak of CuPS samples was decreased from 186 °C (8CuPS) to181 °C (30CuPS). In consistent with in situ TR-XANES, the higher fraction of Cu2+(O h ) species could provide a higher Cu edge energy. This is because the higher number of Cu-O bonding in an octahedral environment, results in an electron deficiency of the Cu2+. Therefore, the Cu2+(O h ) species would interact strongly with the SiO2 layer, leading to a relatively higher reduction temperature, especially for 8CuPS. It is worth noting that Cu content calculated from the H2 consumption of all CuPS samples is less than those determined by the XRF (Table 1), while XRF and H2-TPR estimated Cu contents for 20Cu/SiO2 were nearly identical (18.5 and 18.6 wt%). This suggests that Cu2+ species in CuPS samples might not be fully reduced to metallic Cu, especially at the low Cu loading. As seen in Table S2, approximately 26%, 8% and 4% lower Cu content were observed for 8CuPS, 20CuPS and 30CuPS, respectively. This is in line with a report by Jiang, et al. that Cu+ species were observed in the CuPS, even after the samples were reduced at 300 °C [29]. The presence of Cu+ species could attribute to the strong interaction between Cun+ and SiO2 in the phyllosilicate structure, as discussed earlier. Since 8CuPS shows a notable loss of H2 consumption (Table S2) and relatively higher reduction temperature (Fig. 4a, ii), this sample presumably contains a higher fraction of Cu+ after the reduction. To investigate the nature of Cu species under the reduction condition, the in-situ TR-XANES under 10%H2/N2 was consecutively performed after heating at 400 °C for 2 h, as shown in Fig. 5. From 50–210 °C, a further decrease in Cu2+(O h ) species in all CuPS samples was observed, despite that the fraction of this species remains constant under heating in air at 400 °C (Fig. 3). In response to such decrease, Cu2+(Sq) species gradually increased, suggesting that the dehydroxylation of Cu2+(O h ) species to Cu2+(Sq) species was promoted under hydrogen. It is possible that the hydrogen could reversibly dissociate Si-O-Cu-O-Si forming internal Si-OH and H-Cu-O-Si. The latter species may also react with the adjacent HO-Cu-O-Si, liberating H2 and Cu-O-Cu [38]. As H2 is equally consumed and released in this process, no change in the TPR signal was observed. Nevertheless, in situ TR-XANES experiment has suggested that the coordination of Cu2+ has been modified under hydrogen without change in the oxidation state. The reduction of Cu2+ to Cu+ species could be initially observed at 220 °C, followed by the formation of Cu0 at 230 °C (Fig. 5, a–c). These two species were evolved along with the decreases in Cu2+(O h ) and Cu2+(Sq) species. While the Cu2+(Sq) was retained in high proportion, the increase in Cu+ appears to correspond with the decrease in Cu2+(O h ). Above 210 °C, the decrease in Cu2+(Sq) and the increase in Cu0 species were significant, showing similar rates of phase transformation. This observation suggests that the Cu2+(O h ) species would be partially reduced to Cu+ at below 210°C, presumably due to a strong interaction of Cu+ in octahedral geometry with the SiO2 layers. Nevertheless, some of Cu+ could be further reduced to Cu0, as observed by a decrease in Cu+ fraction at > 225°C. On the other hand, the Cu+ is less stabilized in the square planar geometry, leading to a complete reduction of the Cu2+(Sq) species to Cu0. In comparison, the impregnated sample (20Cu/SiO2), that contained only Cu2+(Sq) species, was fully reduced to Cu0, without Cu+ intermediate species during H2 reduction (Fig. 5, d). Accordingly, the samples possessing a higher fraction of Cu2+(O h ) species (i.e., 8CuPS) would provide a higher Cu+ composition. After holding at 250 °C for 2 h under 10%H2/N2, the Cu+ fraction retained in the samples are in order of 16.2%(8CuPS) > 10.1%(20CuPS) > 7.6%(30CuPS). This trend is consistent with the increase in H2 consumption of respective samples, as discussed in H2-TPR. Although H2-TPR and in situ TR-XANES suggest that CuPS can be readily reduced to Cu metal, no diffraction peak for Cu0 (2θ = 43.2 ˚, 50.4 ˚ and 74.2 ˚) was observed in the XRD pattern of the reduced samples (Fig. 1b, ii-iv). This suggests that very fine Cu0 particles could be formed in the reduced CuPS. In line with this view, TEM shows average Cu particle sizes of the CuPS samples in the range of 1.9–4.9 nm ( Fig. 6, a-c), much smaller than that of Cu/SiO2 (~11 nm, Fig. 6, d). Since the lamellar structure of CuPS could be partially collapsed upon reduction, a notable decrease in surface area of all CuPS samples was observed (Table 1). Nevertheless, the remaining lamellar structure of reduced catalysts (as observed by TEM, Fig. S3) would retain Cu+ species, as discussed earlier. Such Cu+/SiO2 layers may strongly interact with the metallic Cu particles, preventing agglomeration of the Cu0 particles [35,39]. Accordingly, high dispersion of Cu particle can be obtained for all CuPS samples (~60–80%), depending on Cu+ fraction in the samples, as shown in Figs. 4b and 5. Therefore, an increase in Cu loadings (from 8% to 30%) i.e., a decrease in Cu+ fraction, leads to a proportional increase in Cu particle size (from 1.9 to 4.9 nm) i.e., a decrease in Cu dispersion (from ~80–60%), as shown in Fig. S4. On the other hand, the large Cu0 particles of 20Cu/SiO2 could attribute to the low interaction of the bulk CuO with the silica support. This leads to a complete reduction of Cu2+(Sq) species to Cu0 without Cu+ species, as observed in Fig. 5d. Hence, the metallic Cu could be readily agglomerated on 20Cu/SiO2 catalyst after the reduction, resulting in a low Cu dispersion (~10%, Table 1, Fig. 4b, iv). The acid sites of all Cu-based catalysts were investigated by the NH3-TPD, as shown in Fig. 7a. The desorption peaks were deconvoluted into three peaks by the Gaussian deconvolution method. All Cu-based catalysts contain three desorption peaks. The peaks at 120 °C was referred to weak acid sites derived from surface silanol [40], whereas a broad peak at 250 °C could be attributed to the NH3 adsorbed on the internal silanol within the micropores or interlayers [41]. In addition, the peak at 160 °C can be referred to medium acid sites derived from the Cu species [42]. The acidity, calibrated with standard 1% NH3 in He, for each peak is listed in Table 2. It can be seen that medium acid sites of CuPS increased with the Cu loading, from 9 µmol/g (8CuPS) to 16 µmol/g (30CuPS), while sites derived from the silanol groups (Si-OH) was similar. Moreover, the 20Cu/SiO2 showed a much lower medium acid site (5 µmol/g) than the phyllosilicate counterpart (20CuPS, 12 µmol/g). This could attribute to the lower Cu surface area of the impregnated samples, as discussed earlier. To gain more details of the specific acid sites over the reduced catalysts, the Py-IR was performed. As seen in Fig. 7b, the CuPS catalysts show adsorption bands at 1450 and 1606 cm-1, attributed to the pyridine adsorbed on Lewis acid sites (LAS) [43], and the bands at 1530 and 1633 cm-1, evidenced for pyridine bonded with Brønsted acid sites (BAS) [44]. The band at 1490 cm -1, for both BAS and LAS [45] was also observed. The acidity of the samples was calibrated with the HZSM-5 standard (Si/Al ~ 21) with known acidity and listed in Table 2. Unlike CuPS catalysts, 20Cu/SiO2 exhibit only an adsorption band at 1580 cm-1 that could refer to the adsorbed pyridine on the silanol group (Si-OH). The Lewis acid sites (LAS) in CuPS samples could be derived from the remaining Cu+ species, as evidenced by in situ TR-XANES. In support with this view, the LAS was increased linearly with the remaining Cu+ content in the samples, as shown in Fig. 8a. However, the amount of LAS is lower than the overall Cu+ content (LAS/Cu+ <1, Table 2) indicating that only some Cu+ species were exposed to the surface. The rest would remain within the layered structure. The Cu+ species was not present in 20Cu/SiO2 after the reduction, and therefore the LAS adsorption band was barely detected on the impregnated catalyst. The number of BAS was increased with the Cu loading, especially the Cu0 content, as shown in Fig. 8b. The relatively lower BAS, as compared to the Cu content, suggesting that BAS could be derived from the silanol (Si-OH) group at the interface of Cu particles [46]. The perturbation of d-band electrons of Cu metal on the interface Si-OH results in an electron deficiency of hydrogen at the perimeter [42]. Hence, 30CuPS that possesses a higher metallic Cu phase (see Fig. 5) would exhibit a higher number of BAS. However, the number of BAS at the perimeter would also depend on the Cu metal particle size. The smaller the particle size, the higher the number of BAS at the perimeter. In other words, the sample with high Cu dispersion would possess a higher BAS at the perimeter. Accordingly, a higher ratio of BAS/Cu on the surface (Cu s 0) was obtained for 8CuPS with a higher Cu metal dispersion (Table 2). 3.2 Catalytic activity The gas-phase hydrodeoxygenation of methyl palmitate (MP) was performed at 250 °C under atmospheric H2 pressure. The 20CuPS catalyst shows ~5 folds conversion higher than 20Cu/SiO2 catalyst (73% vs. 13%), as shown in Table 3, entry 1 and 2. Such high activity of the 20CuPS catalyst could mainly derive from a higher Cu dispersion (73%), as compared with that of 20Cu/SiO2 (10%). In other words, the 20CuPS possesses an active Cu surface area (92.3 m2/g), higher than that of 20Cu/SiO2 (12.7 m2/g, Table 1). This could attribute to the existent of well-defined Cu2+ species (Cu2+(O h ), Cu2+(Sq)) in 20CuPS structure, as discussed by in situ TR-XANES. These Cu2+ species could be reduced to Cu0 and Cu+ species, and the latter could inhibit the agglomeration of metallic Cu particles after the reduction, resulting in very fine metallic Cu particles, as observed in Fig. 6b. The products from 20CuPS and 20Cu/SiO2 catalysts include hexadecanal, hexadecanol, haxadecene and hexadecane. Among the C16-olefins, 1-hexadecene is mainly obtained, together with a trace amount of inner- and iso-olefins. However, trace amounts of pentadecene and pentadecane, C15-products could be observed for 20Cu/SiO2, presumably via decarbonylation of methyl palmitate. None of these products can be detected over CuPS catalysts even at a higher conversion. This could emphasize the ability of the Cu-based catalyst to suppress decarbonylation reactions, which are typically enhanced by oxophillic metals (Co, Ni, and Fe [15–17]) and noble metal catalysts (Pd and Pt [13,14]). To verify the evolution of these products, the correlation of conversion and product yields with the contact time was investigated for 20CuPS, as shown in Fig. 9. At the initial (< 94 g·h/mol), small amounts of methanol could be observed along with the increase in methyl palmitate conversion. It is worth noting that most of the methanol produced was in the gas phase and cannot be efficiently trapped during analysis. The observed increase in methanol with the conversion suggests that the hydrogenolysis at the C-O bond of the palmitate ester was primarily promoted, presumably via the adsorbed CO η1 species on the Cu surface [10]. In support with the C-O hydrogenolysis, neither methane nor palmitic acid was observed. Instead, hexadecanal and hexadecanol were primarily obtained. The lower yield of hexadecanal, as compared to hexadecanol, could suggest that the hexadecanal would be an intermediate, consecutively hydrogenated to hexadecanol. Hexadecene and hexadecane significantly increase with the conversion while hexadecanal and hexadecanol remain leveled. This suggests that the primarily produced hexadecanol may undergo dehydration to form 1-hexadecene. The dehydration activity of these CuPS catalysts could be related to their acid sites, as discussed earlier. One could expect that 1-hexadecene can be further hydrogenated to hexadecane as shown in Fig. S5a. Alternatively, the hexadecane could also be produced in parallel with 1-hexadecene, as seen by a coherent increase in their selectivity ( Fig. 10). This is because the acidity also promotes so-called “hydro-dehydration” of the protonated hexadecanol to hexadecane [12]. At a high conversion (73.2%), 1-hexadecene and hexadecane were major products. In a supportive manner, only 1-hexadecene and hexadecane were obtained once using hexadecanol as a feed shown in Fig. S5b. Therefore, this could suggest that hydrodeoxygenation of methyl palmitate over CuPS catalysts is a series reaction that yields primarily hexadecanal, and then to hexadecanol. The hexadecanol is dehydrated to 1-hexadecene that can be further hydrogenated to hexadecane. In parallel, the hexadecanol can also be hydro-dehydrated to hexadecane. The reaction pathway can be proposed as shown in Scheme 2. As the Cu content increased from 8 wt to 30 wt%, the conversion proportionally increased from ~20–77% (Table 3, entry 2–4). The catalytic activity corresponds with the active Cu surface area, as shown in Fig. 11a. This is also the case for 20Cu/SiO2, suggesting that hydrogen dissociation on the Cu surface is a rate-determining step for this reaction [35]. At relatively low temperature (~250°C), adsorption of methyl palmitate, a polar molecule with high MW, would be readily facilitated, especially at the interface. Dissociation of H2 and hydrogen spillover to the adsorbed methyl palmitate could be promoted, especially by the catalyst with a high Cu surface area, i.e., 30CuPS. In addition, 1-hexadecene and hexadecane selectivity proportionally increase with Cu loading, as seen from Table 3, entry 2–4. Meanwhile, the hexadecanol selectivity was sharply decreased. This indicates that the dehydration and hydro-dehydration of hexadecanol are readily promoted at higher Cu loading, especially at 30 wt%. This is clearly due to the increase in Brønsted acidity of CuPS catalysts, as seen in an opposite trend for hexadecanol selectivity (Fig. 11b). As BAS at the perimeter is increased, the primarily produced hexadecanol would be readily protonated and dehydrated or hydro-dehydrated to hydrocarbons, as discussed previously. Nevertheless, when the Cu loading increased from 20 wt% to 30 wt%, the hexadecene selectivity was leveled off. While the hexadecane selectivity was steadily promoted over 30CuPS. This could attribute to the higher Cu surface area on 30CuPS catalyst leading to the higher hydro-dehydration ability. It is worth noting that the Lewis acidic Cu+ species do not particularly play a role in alcohol dehydration. This is deduced from higher hydrocarbon selectivity over 30CuPS (~77%), as compared to that over 20CuPS (~66%), despite a similar Cu+ content (~0.33-0.34 mmol/g, Table S2) and Lewis acidity (~4.1–4.3 mmol/g, Table 2). Hence, it is suggested that only the BAS in CuPS catalyst promotes the dehydration and hydro-dehydration of hexadecanol to linear long-chain olefins and paraffin, respectively. As the hydrodeoxygenation of methyl palmitate is a series reaction, the product selectivity would depend on the conversion. Accordingly, the products selectivity was better when CuPS catalysts were tested at the same conversion, as shown in Table 3, entry 3, 5, 6. Even at a similar conversion (~20%), low selectivity of hexadecene was still obtained for 8CuPS. This suggests that, in addition to BAS, Cu dispersion seems to play the role for linear long-chain α-olefin selectivity, as seen in Fig. 12. Since the reduced 8CuPS possess small Cu particles (high dispersion) and a high fraction of Cu+ species (Fig. 5), hexadecanol can be readily desorbed from the surface after its formation. This is presumably because Cu+ is much less effective for η1-coordination of alcohol but interacts strongly with the carbonyl group (CO) of the feed [47]. Accordingly, the presence of Cu+ makes the competitive adsorption by the feed more sensitive, particularly on small Cu particles [48]. This combination leads to weaker adsorption of hexadecanol on such complex Cu+-Cu surfaces. Therefore, the dehydration and hydro-dehydration of long-chain alcohol would be less effective on the small Cu particles and a high fraction of Cu+ species. 4 Conclusions Copper phyllosilicate (CuPS) shows high activity for hydrodeoxygenation of methyl palmitate to linear long-chain α-olefin, i.e., 1-hexadecene. No carbon loss due to decarbonylation was observed for all CuPS catalysts. The hydrodeoxygenation activity was related to the active Cu surface area and Brønsted acid sites at the metal-support interface. In situ TR-XANES experiments evidence that the octahedrally coordinated Cu2+(O h ) species in the chrysocolla structure leads to the formation of the partially reduced Cu species (Cu+) that exerts highly dispersed Cu particles after reduction. In addition, the co-existence of Cu+ at the metal/support interface provides Brønsted acid sites in a closed proximity to the Cu metal particle, which promotes the dehydration of hexadecanol, primarily produced by the hydrogenation of methyl palmitate. However, the CuPS with an excessively high Cu+ fraction was less effective in promoting the dehydration of hexadecanol to 1-hexadecene, due to the competitive adsorption of methyl palmitate, against the hexadecanol, on the small Cu particle. Conversely, the catalyst with a low Cu+ fraction provides larger Cu particles that promote hydro-dehydration to undesirable paraffin. The CuPS catalyst with a high number of BAS and a high Cu0 dispersion, i.e., 20CuPS, is considered as the most effective in the hydrodeoxygenation of methyl palmitate to 1-hexadecene. CRediT authorship contribution statement Warot Prasanseang: Investigation, Visualization, Writing. Kittisak Choojun: Writing – original draft, Supervision. Yingyot Poo-arporn: Investigation. Ai-Lin Huang: Investigation. Yu-Chuan Lin: Investigation. Tawan Sooknoi: Conceptualization, Writing – review & editing, Supervision. Declaration of Competing Interest The authors declare that they have no known competing financial interests or personal relationships that could have appeared to influence the work reported in this paper. Acknowledgements This work is supported by King Mongkut’s Institute of Technology Ladkrabang, Thailand and partly by Higher Education Sprout Project, Ministry of Education to the Headquarters of University Advancement at National Cheng Kung University (NCKU). The authors are also grateful for financial support from the School of Science, King Mongkut’s Institute of Technology Ladkrabang (KMITL) (Grant No. 2565-02-05-022) and National Research Council of Thailand. We would like to thank Synchrotron Light Research Institute (Public organization), Thailand, for the in situ TR-XANES experiments and the Scientific Instruments Center, School of Science, KMITL for characterization techniques. Appendix A Supporting information Supplementary data associated with this article can be found in the online version at doi:10.1016/j.apcata.2022.118555. Appendix A Supplementary material Supplementary material . References [1] A. Arthur W. Madden R. Percy E. Soliman CBE 52 2013 A. Arthur, W. Madden, R. Percy, E. Soliman, CBE. 52 (2013). [2] A. Forestière H. Olivier-Bourbigou L. Saussine Oil Gas Sci. Technol. Rev. IFP 64 2009 649 667 A. Forestière, H. Olivier-Bourbigou, L. Saussine, Oil Gas Sci. Technol. - Rev. IFP 64 (2009) 649–667. [3] G. Lappin Alpha Olefins Applications Handbook 2014 CRC Press G. Lappin, Alpha olefins applications handbook, CRC press 2014. [4] G.L. Tembe M. Ravindranathan Ind. Eng. Chem. Res. 30 1991 2247 2252 G.L. Tembe, M. Ravindranathan, Ind. Eng. Chem. Res. 30 (1991) 2247–2252. [5] S. Janampelli S. Darbha Energy Fuels 32 2018 12630 12643 S. Janampelli, S. Darbha, Energy Fuels 32 (2018) 12630–12643. [6] V.K. Mishra R. Goswami Biofuels 9 2018 273 289 V.K. Mishra, R. Goswami, Biofuels 9 (2018) 273–289. [7] L. Yan X. Liu J. Deng Y. Fu Green Chem. 19 2017 4600 4609 L. Yan, X. Liu, J. Deng, Y. Fu, Green Chem. 19 (2017) 4600–4609. [8] Y. Bie J. Lehtonen J. Kanervo Appl. Catal. A Gen. 526 2016 183 190 Y. Bie, J. Lehtonen, J. Kanervo, Appl Catal A Gen 526 (2016) 183–190. [9] N. Chen N. Wang Y. Ren H. Tominaga E.W. Qian J. Catal. 345 2017 124 134 N. Chen, N. Wang, Y. Ren, H. Tominaga, E.W. Qian, J. Catal. 345 (2017) 124–134. [10] F. Han Q. Guan W. Li RSC Adv. 5 2015 107533 107539 F. Han, Q. Guan, W. Li, RSC Adv. 5 (2015) 107533–107539. [11] H. Lu T.-Y. Yu P.-F. Xu H. Wei Chem. Rev. 121 2020 365 411 H. Lu, T.-Y. Yu, P.-F. Xu, H. Wei, Chem. Rev. 121 (2020) 365–411. [12] J. Li J. Zhang S. Wang G. Xu H. Wang D.G. Vlachos ACS Catal. 9 2019 1564 1577 J. Li, J. Zhang, S. Wang, G. Xu, H. Wang, D.G. Vlachos, ACS Catal. 9 (2019) 1564–1577. [13] N. Numwong P. Prabnasak P. Prayoonpunratn P. Triphatthanaphong C. Thunyaratchatanon T. Mochizuki S.-Y. Chen A. Luengnaruemitchai T. Sooknoi Fuel Process. Technol. 203 2020 106393 N. Numwong, P. Prabnasak, P. Prayoonpunratn, P. Triphatthanaphong, C. Thunyaratchatanon, T. Mochizuki, S.-Y. Chen, A. Luengnaruemitchai, T. Sooknoi, Fuel Process. Technol. 203 (2020) 106393. [14] S. Janampelli S. Darbha Catalysts 309 2018 219 226 S. Janampelli, S. Darbha, Catal. 309 (2018) 219–226. [15] I.V. Deliy I.V. Shamanaev P.V. Aleksandrov E.Y. Gerasimov V.P. Pakharukova E.G. Kodenev I.V. Yakovlev O.B. Lapina G.A. Bukhtiyarova Catalysts 8 2018 515 I.V. Deliy, I.V. Shamanaev, P.V. Aleksandrov, E.Y. Gerasimov, V.P. Pakharukova, E.G. Kodenev, I.V. Yakovlev, O.B. Lapina, G.A. Bukhtiyarova, Catalysts 8 (2018) 515. [16] R. Kaewmeesri J. Nonkumwong W. Kiatkittipong N. Laosiripojana K. Faungnawakij J. Environ. Chem. Eng. 9 2021 105128 R. Kaewmeesri, J. Nonkumwong, W. Kiatkittipong, N. Laosiripojana, K. Faungnawakij, J. Environ. Chem. Eng. 9 (2021) 105128. [17] P. Phichitsurathaworn K. Choojun Y. Poo-arporn T. Sooknoi Appl. Catal. A Gen. 602 2020 117644 P. Phichitsurathaworn, K. Choojun, Y. Poo-arporn, T. Sooknoi, Appl Catal A Gen 602 (2020) 117644. [18] P. Zhang X. Chen Y. Leng Y. Dong P. Jiang M. Fan Fuel 272 2020 117680 P. Zhang, X. Chen, Y. Leng, Y. Dong, P. Jiang, M. Fan, Fuel 272 (2020) 117680. [19] H. Adkins K. Folkers J. Am. Chem. Soc. 53 1931 1095 1097 H. Adkins, K. Folkers, J. Am. Chem. Soc. 53 (1931) 1095–1097. [20] J. Chen, Preparation and use of nonchrome catalysts for Cu/Cr catalyst applications, US Patent 6916457, 2005. [21] R. Pestman R. Koster J. Pieterse V. Ponec J. Catal. 168 1997 255 264 R. Pestman, R. Koster, J. Pieterse, V. Ponec, J. Catal. 168 (1997) 255–264. [22] A. Jangam P. Hongmanorom M. Hui Wai A. Jeffry Poerjoto S. Xi A. Borgna S. Kawi ACS Appl. Energy Mater. 2021 A. Jangam, P. Hongmanorom, M. Hui Wai, A. Jeffry Poerjoto, S. Xi, A. Borgna, S. Kawi, ACS Appl. Energy Mater. (2021). [23] D.S. Thakur A. Kundu J. Am. Oil Chem. Soc. 93 2016 1575 1593 D.S. Thakur, A. Kundu, J Am Oil Chem Soc 93 (2016) 1575–1593. [24] Y. Xu L. Kong H. Huang H. Wang X. Wang S. Wang Y. Zhao X. Ma Catal. Sci. Technol. 11 2021 6854 6865 Y. Xu, L. Kong, H. Huang, H. Wang, X. Wang, S. Wang, Y. Zhao, X. Ma, Catal. Sci. Technol. 11 (2021) 6854–6865. [25] R. Kumar V. Strezov T. Kan H. Weldekidan J. He Energy Procedia 160 2019 186 193 R. Kumar, V. Strezov, T. Kan, H. Weldekidan, J. He, Energy Procedia 160 (2019) 186–193. [26] Z. Zhang F. Zhou K. Chen J. Fu X. Lu P. Ouyang Energy Fuels 31 2017 12624 12632 Z. Zhang, F. Zhou, K. Chen, J. Fu, X. Lu, P. Ouyang, Energy Fuels 31 (2017) 12624–12632. [27] L.-F. Chen P.-J. Guo M.-H. Qiao S.-R. Yan H.-X. Li W. Shen H.-L. Xu K.-N. Fan J. Catal. 257 2008 172 180 L.-F. Chen, P.-J. Guo, M.-H. Qiao, S.-R. Yan, H.-X. Li, W. Shen, H.-L. Xu, K.-N. Fan, J. Catal. 257 (2008) 172–180. [28] J. Gong H. Yue Y. Zhao S. Zhao L. Zhao J. Lv S. Wang X. Ma J. Am. Chem. Soc. 134 2012 13922 13925 J. Gong, H. Yue, Y. Zhao, S. Zhao, L. Zhao, J. Lv, S. Wang, X. Ma, J. Am. Chem. Soc. 134 (2012) 13922–13925. [29] J.W. Jiang C.C. Tu C.H. Chen Y.C. Lin ChemCatChem 10 2018 5449 5458 J.W. Jiang, C.C. Tu, C.H. Chen, Y.C. Lin, ChemCatChem 10 (2018) 5449–5458. [30] Y.-J. Tsou T.D. To Y.-C. Chiang J.-F. Lee R. Kumar P.-W. Chung Y.-C. Lin ACS Appl. Mater. Interfaces 12 2020 54851 54861 Y.-J. Tsou, T.D. To, Y.-C. Chiang, J.-F. Lee, R. Kumar, P.-W. Chung, Y.-C. Lin, ACS Appl. Mater. Interfaces 12 (2020) 54851–54861. [31] C. Che T.D. Glotch D.L. Bish J.R. Michalski W. Xu J. Geophys. Res. Planets 116 2011 C. Che, T.D. Glotch, D.L. Bish, J.R. Michalski, W. Xu, J. Geophys. Res. Planets 116 (2011). [32] S. Zhu X. Gao Y. Zhu W. Fan J. Wang Y. Li Catal. Sci. Technol. 5 2015 1169 1180 S. Zhu, X. Gao, Y. Zhu, W. Fan, J. Wang, Y. Li, Catal. Sci. Technol. 5 (2015) 1169–1180. [33] G.V. Sagar P.V.R. Rao C.S. Srikanth K.V. Chary J. Phys. Chem. 110 2006 13881 13888 G.V. Sagar, P.V.R. Rao, C.S. Srikanth, K.V. Chary, J. Phys. Chem. 110 (2006) 13881–13888. [34] Y. Poo-arporn P. Chirawatkul W. Saengsui S. Chotiwan S. Kityakarn S. Klinkhieo J. Hormes P. Songsiriritthigul J. Synchrotron Radiat. 19 2012 937 943 Y. Poo-arporn, P. Chirawatkul, W. Saengsui, S. Chotiwan, S. Kityakarn, S. Klinkhieo, J. Hormes, P. Songsiriritthigul, J Synchrotron Radiat 19 (2012) 937–943. [35] W. Di J. Cheng S. Tian J. Li J. Chen Q. Sun Appl. Catal. A Gen. 510 2016 244 259 W. Di, J. Cheng, S. Tian, J. Li, J. Chen, Q. Sun, Appl Catal A Gen 510 (2016) 244–259. [36] L. Heller-Kallai l Rozenson Clays Clay Min. 28 1980 355 368 L. Heller-Kallai, l Rozenson, Clays Clay Miner 28 (1980) 355–368. [37] A. Gaur W. Klysubun N.N. Nair B. Shrivastava J. Prasad K. Srivastava J. Mol. Struct. 1118 2016 212 218 A. Gaur, W. Klysubun, N.N. Nair, B. Shrivastava, J. Prasad, K. Srivastava, J. Mol. Struct. 1118 (2016) 212–218. [38] K. Ma Y. Tian Z.-J. Zhao Q. Cheng T. Ding J. Zhang L. Zheng Z. Jiang T. Abe N. Tsubaki Chem. Sci. 10 2019 2578 2584 K. Ma, Y. Tian, Z.-J. Zhao, Q. Cheng, T. Ding, J. Zhang, L. Zheng, Z. Jiang, T. Abe, N. Tsubaki, Chem. Sci. 10 (2019) 2578–2584. [39] L. Zou J. Li D. Zakharov E.A. Stach G. Zhou Nat. Commun. 8 2017 1 8 L. Zou, J. Li, D. Zakharov, E.A. Stach, G. Zhou, Nat. Commun. 8 (2017) 1–8. [40] I. Lezcano-Gonzalez U. Deka B. Arstad A. Van Yperen-De Deyne K. Hemelsoet M. Waroquier V. Van Speybroeck B.M. Weckhuysen A.M. Beale Phys. Chem. 16 2014 1639 1650 I. Lezcano-Gonzalez, U. Deka, B. Arstad, A. Van Yperen-De Deyne, K. Hemelsoet, M. Waroquier, V. Van Speybroeck, B.M. Weckhuysen, A.M. Beale, Phys. Chem 16 (2014) 1639–1650. [41] A. Jankowska A. Chłopek A. Kowalczyk M. Rutkowska M. Michalik S. Liu L. Chmielarz Molecules 25 2020 5651 A. Jankowska, A. Chłopek, A. Kowalczyk, M. Rutkowska, M. Michalik, S. Liu, L. Chmielarz, Molecules 25 (2020) 5651. [42] S. Lomate A. Sultana T. Fujitani Catal. Sci. Technol. 7 2017 3073 3083 S. Lomate, A. Sultana, T. Fujitani, Catal. Sci. Technol. 7 (2017) 3073–3083. [43] E. Parry J. Catal. 2 1963 371 379 E. Parry, J. Catal. 2 (1963) 371–379. [44] M.I. Zaki M.A. Hasan F.A. Al-Sagheer L. Pasupulety Colloids Surf. A Physicochem. Eng. Asp. 190 2001 261 274 M.I. Zaki, M.A. Hasan, F.A. Al-Sagheer, L. Pasupulety, Colloids Surf. A Physicochem. Eng. Asp. 190 (2001) 261–274. [45] C. Emeis J. Catal. 141 1993 347 354 C. Emeis, J. Catal. 141 (1993) 347–354. [46] C. Xu G. Chen Y. Zhao P. Liu X. Duan L. Gu G. Fu Y. Yuan N. Zheng Nat. Commun. 3367 2018 1 10 C. Xu, G. Chen, Y. Zhao, P. Liu, X. Duan, L. Gu, G. Fu, Y. Yuan, N. Zheng, Nat. Commun. 3367 (2018) 1–10. [47] H. Qin C. Guo C. Sun J. Zhang J. Mol. Catal. A Chem. 409 2015 79 84 H. Qin, C. Guo, C. Sun, J. Zhang, J Mol Catal A Chem 409 (2015) 79–84. [48] C.-L. Ye C.-L. Guo J.-L. Zhang Fuel Process. Technol. 143 2016 219 224 C.-L. Ye, C.-L. Guo, J.-L. Zhang, Fuel Process. Technol. 143 (2016) 219–224.",
      "scopus-id": "85125250458",
      "coredata": {
        "eid": "1-s2.0-S0926860X22000783",
        "dc:description": "Copper phyllosilicate (CuPS) was used as a bifunctional catalyst for hydrodeoxygenation of methyl palmitate (MP) to produce long-chain α-olefins without the loss of carbon backbone. The CuPS catalysts were prepared by ammonia evaporation-hydrothermal method. The crystal structure, surface area, reducibility, Cu dispersion, Cu particle size and acidity of the catalysts were examined by XRD, BET, H2-TPR, TEM, NH3-TPD and Py-IR. The existence of Cu2+ species (octahedral (O h )/square planar (Sq)), Cu+ and Cu0 upon calcination/reduction was investigated by in situ TR-XANES. The Cu dispersion was related to the Cu+ fraction in CuPS, while Brønsted acid sites (BAS) depends on Cu0 particles. The MP conversion to 1-hexadecene proceeds via hydrogenation-dehydration promoted by the synergy of Cu0 surface and Brønsted acid sites at the interface. The α-olefin selectivity depends on a balance between Cu+ and Cu loading. The 20CuPS possessing 10% Cu+ fraction, provides a high conversion of 72% with 45% α-olefin selectivity.",
        "openArchiveArticle": "false",
        "prism:coverDate": "2022-04-05",
        "openaccessUserLicense": null,
        "prism:aggregationType": "Journal",
        "prism:url": "https://api.elsevier.com/content/article/pii/S0926860X22000783",
        "dc:creator": [
          {
            "@_fa": "true",
            "$": "Prasanseang, Warot"
          },
          {
            "@_fa": "true",
            "$": "Choojun, Kittisak"
          },
          {
            "@_fa": "true",
            "$": "Poo-arporn, Yingyot"
          },
          {
            "@_fa": "true",
            "$": "Huang, Ai-Lin"
          },
          {
            "@_fa": "true",
            "$": "Lin, Yu-Chuan"
          },
          {
            "@_fa": "true",
            "$": "Sooknoi, Tawan"
          }
        ],
        "link": [
          {
            "@_fa": "true",
            "@rel": "self",
            "@href": "https://api.elsevier.com/content/article/pii/S0926860X22000783"
          },
          {
            "@_fa": "true",
            "@rel": "scidir",
            "@href": "https://www.sciencedirect.com/science/article/pii/S0926860X22000783"
          }
        ],
        "dc:format": "application/json",
        "openaccessType": null,
        "pii": "S0926-860X(22)00078-3",
        "prism:volume": "635",
        "articleNumber": "118555",
        "prism:publisher": "Elsevier B.V.",
        "dc:title": "Linear long-chain α-olefins from hydrodeoxygenation of methyl palmitate over copper phyllosilicate catalysts",
        "prism:copyright": "© 2022 Elsevier B.V. All rights reserved.",
        "openaccess": "0",
        "prism:issn": "0926860X",
        "dcterms:subject": [
          {
            "@_fa": "true",
            "$": "Hydrodeoxygenation"
          },
          {
            "@_fa": "true",
            "$": "Copper phyllosilicate"
          },
          {
            "@_fa": "true",
            "$": "Methyl palmitate"
          },
          {
            "@_fa": "true",
            "$": "Linear long-chain α-olefins"
          },
          {
            "@_fa": "true",
            "$": "Bifunctional catalyst"
          }
        ],
        "openaccessArticle": "false",
        "prism:publicationName": "Applied Catalysis A: General",
        "openaccessSponsorType": null,
        "prism:pageRange": "118555",
        "pubType": "fla",
        "prism:coverDisplayDate": "5 April 2022",
        "prism:doi": "10.1016/j.apcata.2022.118555",
        "prism:startingPage": "118555",
        "dc:identifier": "doi:10.1016/j.apcata.2022.118555",
        "openaccessSponsorName": null
      },
      "objects": {
        "object": [
          {
            "@category": "standard",
            "@height": "291",
            "@width": "678",
            "@_fa": "true",
            "$": "https://api.elsevier.com/content/object/eid/1-s2.0-S0926860X22000783-gr8.jpg?httpAccept=%2A%2F%2A",
            "@multimediatype": "JPEG image file",
            "@type": "IMAGE-DOWNSAMPLED",
            "@size": "39270",
            "@ref": "gr8",
            "@mimetype": "image/jpeg"
          },
          {
            "@category": "standard",
            "@height": "290",
            "@width": "678",
            "@_fa": "true",
            "$": "https://api.elsevier.com/content/object/eid/1-s2.0-S0926860X22000783-gr7.jpg?httpAccept=%2A%2F%2A",
            "@multimediatype": "JPEG image file",
            "@type": "IMAGE-DOWNSAMPLED",
            "@size": "59774",
            "@ref": "gr7",
            "@mimetype": "image/jpeg"
          },
          {
            "@category": "standard",
            "@height": "426",
            "@width": "791",
            "@_fa": "true",
            "$": "https://api.elsevier.com/content/object/eid/1-s2.0-S0926860X22000783-gr6.jpg?httpAccept=%2A%2F%2A",
            "@multimediatype": "JPEG image file",
            "@type": "IMAGE-DOWNSAMPLED",
            "@size": "125517",
            "@ref": "gr6",
            "@mimetype": "image/jpeg"
          },
          {
            "@category": "standard",
            "@height": "458",
            "@width": "678",
            "@_fa": "true",
            "$": "https://api.elsevier.com/content/object/eid/1-s2.0-S0926860X22000783-gr5.jpg?httpAccept=%2A%2F%2A",
            "@multimediatype": "JPEG image file",
            "@type": "IMAGE-DOWNSAMPLED",
            "@size": "104145",
            "@ref": "gr5",
            "@mimetype": "image/jpeg"
          },
          {
            "@category": "standard",
            "@height": "328",
            "@width": "339",
            "@_fa": "true",
            "$": "https://api.elsevier.com/content/object/eid/1-s2.0-S0926860X22000783-gr9.jpg?httpAccept=%2A%2F%2A",
            "@multimediatype": "JPEG image file",
            "@type": "IMAGE-DOWNSAMPLED",
            "@size": "37711",
            "@ref": "gr9",
            "@mimetype": "image/jpeg"
          },
          {
            "@category": "standard",
            "@height": "7",
            "@width": "7",
            "@_fa": "true",
            "$": "https://api.elsevier.com/content/object/eid/1-s2.0-S0926860X22000783-fx7.jpg?httpAccept=%2A%2F%2A",
            "@multimediatype": "JPEG image file",
            "@type": "IMAGE-DOWNSAMPLED",
            "@size": "328",
            "@ref": "fx7",
            "@mimetype": "image/jpeg"
          },
          {
            "@category": "standard",
            "@height": "259",
            "@width": "678",
            "@_fa": "true",
            "$": "https://api.elsevier.com/content/object/eid/1-s2.0-S0926860X22000783-gr11.jpg?httpAccept=%2A%2F%2A",
            "@multimediatype": "JPEG image file",
            "@type": "IMAGE-DOWNSAMPLED",
            "@size": "46728",
            "@ref": "gr11",
            "@mimetype": "image/jpeg"
          },
          {
            "@category": "standard",
            "@height": "7",
            "@width": "7",
            "@_fa": "true",
            "$": "https://api.elsevier.com/content/object/eid/1-s2.0-S0926860X22000783-fx6.jpg?httpAccept=%2A%2F%2A",
            "@multimediatype": "JPEG image file",
            "@type": "IMAGE-DOWNSAMPLED",
            "@size": "371",
            "@ref": "fx6",
            "@mimetype": "image/jpeg"
          },
          {
            "@category": "standard",
            "@height": "301",
            "@width": "339",
            "@_fa": "true",
            "$": "https://api.elsevier.com/content/object/eid/1-s2.0-S0926860X22000783-gr10.jpg?httpAccept=%2A%2F%2A",
            "@multimediatype": "JPEG image file",
            "@type": "IMAGE-DOWNSAMPLED",
            "@size": "26807",
            "@ref": "gr10",
            "@mimetype": "image/jpeg"
          },
          {
            "@category": "standard",
            "@height": "7",
            "@width": "7",
            "@_fa": "true",
            "$": "https://api.elsevier.com/content/object/eid/1-s2.0-S0926860X22000783-fx5.jpg?httpAccept=%2A%2F%2A",
            "@multimediatype": "JPEG image file",
            "@type": "IMAGE-DOWNSAMPLED",
            "@size": "379",
            "@ref": "fx5",
            "@mimetype": "image/jpeg"
          },
          {
            "@category": "standard",
            "@height": "7",
            "@width": "7",
            "@_fa": "true",
            "$": "https://api.elsevier.com/content/object/eid/1-s2.0-S0926860X22000783-fx4.jpg?httpAccept=%2A%2F%2A",
            "@multimediatype": "JPEG image file",
            "@type": "IMAGE-DOWNSAMPLED",
            "@size": "378",
            "@ref": "fx4",
            "@mimetype": "image/jpeg"
          },
          {
            "@category": "standard",
            "@height": "292",
            "@width": "339",
            "@_fa": "true",
            "$": "https://api.elsevier.com/content/object/eid/1-s2.0-S0926860X22000783-gr12.jpg?httpAccept=%2A%2F%2A",
            "@multimediatype": "JPEG image file",
            "@type": "IMAGE-DOWNSAMPLED",
            "@size": "21267",
            "@ref": "gr12",
            "@mimetype": "image/jpeg"
          },
          {
            "@category": "standard",
            "@height": "207",
            "@width": "791",
            "@_fa": "true",
            "$": "https://api.elsevier.com/content/object/eid/1-s2.0-S0926860X22000783-sc2.jpg?httpAccept=%2A%2F%2A",
            "@multimediatype": "JPEG image file",
            "@type": "IMAGE-DOWNSAMPLED",
            "@size": "17073",
            "@ref": "sc2",
            "@mimetype": "image/jpeg"
          },
          {
            "@category": "standard",
            "@height": "294",
            "@width": "678",
            "@_fa": "true",
            "$": "https://api.elsevier.com/content/object/eid/1-s2.0-S0926860X22000783-gr4.jpg?httpAccept=%2A%2F%2A",
            "@multimediatype": "JPEG image file",
            "@type": "IMAGE-DOWNSAMPLED",
            "@size": "50495",
            "@ref": "gr4",
            "@mimetype": "image/jpeg"
          },
          {
            "@category": "standard",
            "@height": "447",
            "@width": "666",
            "@_fa": "true",
            "$": "https://api.elsevier.com/content/object/eid/1-s2.0-S0926860X22000783-gr3.jpg?httpAccept=%2A%2F%2A",
            "@multimediatype": "JPEG image file",
            "@type": "IMAGE-DOWNSAMPLED",
            "@size": "73904",
            "@ref": "gr3",
            "@mimetype": "image/jpeg"
          },
          {
            "@category": "standard",
            "@height": "342",
            "@width": "339",
            "@_fa": "true",
            "$": "https://api.elsevier.com/content/object/eid/1-s2.0-S0926860X22000783-gr2.jpg?httpAccept=%2A%2F%2A",
            "@multimediatype": "JPEG image file",
            "@type": "IMAGE-DOWNSAMPLED",
            "@size": "25201",
            "@ref": "gr2",
            "@mimetype": "image/jpeg"
          },
          {
            "@category": "standard",
            "@height": "7",
            "@width": "7",
            "@_fa": "true",
            "$": "https://api.elsevier.com/content/object/eid/1-s2.0-S0926860X22000783-fx8.jpg?httpAccept=%2A%2F%2A",
            "@multimediatype": "JPEG image file",
            "@type": "IMAGE-DOWNSAMPLED",
            "@size": "364",
            "@ref": "fx8",
            "@mimetype": "image/jpeg"
          },
          {
            "@category": "standard",
            "@height": "290",
            "@width": "678",
            "@_fa": "true",
            "$": "https://api.elsevier.com/content/object/eid/1-s2.0-S0926860X22000783-gr1.jpg?httpAccept=%2A%2F%2A",
            "@multimediatype": "JPEG image file",
            "@type": "IMAGE-DOWNSAMPLED",
            "@size": "56981",
            "@ref": "gr1",
            "@mimetype": "image/jpeg"
          },
          {
            "@category": "standard",
            "@height": "7",
            "@width": "7",
            "@_fa": "true",
            "$": "https://api.elsevier.com/content/object/eid/1-s2.0-S0926860X22000783-fx3.jpg?httpAccept=%2A%2F%2A",
            "@multimediatype": "JPEG image file",
            "@type": "IMAGE-DOWNSAMPLED",
            "@size": "386",
            "@ref": "fx3",
            "@mimetype": "image/jpeg"
          },
          {
            "@category": "standard",
            "@height": "121",
            "@width": "678",
            "@_fa": "true",
            "$": "https://api.elsevier.com/content/object/eid/1-s2.0-S0926860X22000783-sc1.jpg?httpAccept=%2A%2F%2A",
            "@multimediatype": "JPEG image file",
            "@type": "IMAGE-DOWNSAMPLED",
            "@size": "37163",
            "@ref": "sc1",
            "@mimetype": "image/jpeg"
          },
          {
            "@category": "standard",
            "@height": "12",
            "@width": "12",
            "@_fa": "true",
            "$": "https://api.elsevier.com/content/object/eid/1-s2.0-S0926860X22000783-fx2.jpg?httpAccept=%2A%2F%2A",
            "@multimediatype": "JPEG image file",
            "@type": "IMAGE-DOWNSAMPLED",
            "@size": "434",
            "@ref": "fx2",
            "@mimetype": "image/jpeg"
          },
          {
            "@category": "standard",
            "@height": "12",
            "@width": "12",
            "@_fa": "true",
            "$": "https://api.elsevier.com/content/object/eid/1-s2.0-S0926860X22000783-fx1.jpg?httpAccept=%2A%2F%2A",
            "@multimediatype": "JPEG image file",
            "@type": "IMAGE-DOWNSAMPLED",
            "@size": "502",
            "@ref": "fx1",
            "@mimetype": "image/jpeg"
          },
          {
            "@category": "standard",
            "@height": "200",
            "@width": "324",
            "@_fa": "true",
            "$": "https://api.elsevier.com/content/object/eid/1-s2.0-S0926860X22000783-ga1.jpg?httpAccept=%2A%2F%2A",
            "@multimediatype": "JPEG image file",
            "@type": "IMAGE-DOWNSAMPLED",
            "@size": "18593",
            "@ref": "ga1",
            "@mimetype": "image/jpeg"
          },
          {
            "@category": "thumbnail",
            "@height": "94",
            "@width": "219",
            "@_fa": "true",
            "$": "https://api.elsevier.com/content/object/eid/1-s2.0-S0926860X22000783-gr8.sml?httpAccept=%2A%2F%2A",
            "@multimediatype": "GIF image file",
            "@type": "IMAGE-THUMBNAIL",
            "@size": "6166",
            "@ref": "gr8",
            "@mimetype": "image/gif"
          },
          {
            "@category": "thumbnail",
            "@height": "94",
            "@width": "219",
            "@_fa": "true",
            "$": "https://api.elsevier.com/content/object/eid/1-s2.0-S0926860X22000783-gr7.sml?httpAccept=%2A%2F%2A",
            "@multimediatype": "GIF image file",
            "@type": "IMAGE-THUMBNAIL",
            "@size": "8461",
            "@ref": "gr7",
            "@mimetype": "image/gif"
          },
          {
            "@category": "thumbnail",
            "@height": "118",
            "@width": "219",
            "@_fa": "true",
            "$": "https://api.elsevier.com/content/object/eid/1-s2.0-S0926860X22000783-gr6.sml?httpAccept=%2A%2F%2A",
            "@multimediatype": "GIF image file",
            "@type": "IMAGE-THUMBNAIL",
            "@size": "15514",
            "@ref": "gr6",
            "@mimetype": "image/gif"
          },
          {
            "@category": "thumbnail",
            "@height": "148",
            "@width": "219",
            "@_fa": "true",
            "$": "https://api.elsevier.com/content/object/eid/1-s2.0-S0926860X22000783-gr5.sml?httpAccept=%2A%2F%2A",
            "@multimediatype": "GIF image file",
            "@type": "IMAGE-THUMBNAIL",
            "@size": "15674",
            "@ref": "gr5",
            "@mimetype": "image/gif"
          },
          {
            "@category": "thumbnail",
            "@height": "163",
            "@width": "169",
            "@_fa": "true",
            "$": "https://api.elsevier.com/content/object/eid/1-s2.0-S0926860X22000783-gr9.sml?httpAccept=%2A%2F%2A",
            "@multimediatype": "GIF image file",
            "@type": "IMAGE-THUMBNAIL",
            "@size": "10480",
            "@ref": "gr9",
            "@mimetype": "image/gif"
          },
          {
            "@category": "thumbnail",
            "@height": "35",
            "@width": "35",
            "@_fa": "true",
            "$": "https://api.elsevier.com/content/object/eid/1-s2.0-S0926860X22000783-fx7.sml?httpAccept=%2A%2F%2A",
            "@multimediatype": "GIF image file",
            "@type": "IMAGE-THUMBNAIL",
            "@size": "988",
            "@ref": "fx7",
            "@mimetype": "image/gif"
          },
          {
            "@category": "thumbnail",
            "@height": "84",
            "@width": "219",
            "@_fa": "true",
            "$": "https://api.elsevier.com/content/object/eid/1-s2.0-S0926860X22000783-gr11.sml?httpAccept=%2A%2F%2A",
            "@multimediatype": "GIF image file",
            "@type": "IMAGE-THUMBNAIL",
            "@size": "6610",
            "@ref": "gr11",
            "@mimetype": "image/gif"
          },
          {
            "@category": "thumbnail",
            "@height": "35",
            "@width": "35",
            "@_fa": "true",
            "$": "https://api.elsevier.com/content/object/eid/1-s2.0-S0926860X22000783-fx6.sml?httpAccept=%2A%2F%2A",
            "@multimediatype": "GIF image file",
            "@type": "IMAGE-THUMBNAIL",
            "@size": "1907",
            "@ref": "fx6",
            "@mimetype": "image/gif"
          },
          {
            "@category": "thumbnail",
            "@height": "164",
            "@width": "185",
            "@_fa": "true",
            "$": "https://api.elsevier.com/content/object/eid/1-s2.0-S0926860X22000783-gr10.sml?httpAccept=%2A%2F%2A",
            "@multimediatype": "GIF image file",
            "@type": "IMAGE-THUMBNAIL",
            "@size": "8245",
            "@ref": "gr10",
            "@mimetype": "image/gif"
          },
          {
            "@category": "thumbnail",
            "@height": "35",
            "@width": "35",
            "@_fa": "true",
            "$": "https://api.elsevier.com/content/object/eid/1-s2.0-S0926860X22000783-fx5.sml?httpAccept=%2A%2F%2A",
            "@multimediatype": "GIF image file",
            "@type": "IMAGE-THUMBNAIL",
            "@size": "1737",
            "@ref": "fx5",
            "@mimetype": "image/gif"
          },
          {
            "@category": "thumbnail",
            "@height": "35",
            "@width": "35",
            "@_fa": "true",
            "$": "https://api.elsevier.com/content/object/eid/1-s2.0-S0926860X22000783-fx4.sml?httpAccept=%2A%2F%2A",
            "@multimediatype": "GIF image file",
            "@type": "IMAGE-THUMBNAIL",
            "@size": "1829",
            "@ref": "fx4",
            "@mimetype": "image/gif"
          },
          {
            "@category": "thumbnail",
            "@height": "164",
            "@width": "190",
            "@_fa": "true",
            "$": "https://api.elsevier.com/content/object/eid/1-s2.0-S0926860X22000783-gr12.sml?httpAccept=%2A%2F%2A",
            "@multimediatype": "GIF image file",
            "@type": "IMAGE-THUMBNAIL",
            "@size": "6966",
            "@ref": "gr12",
            "@mimetype": "image/gif"
          },
          {
            "@category": "thumbnail",
            "@height": "57",
            "@width": "219",
            "@_fa": "true",
            "$": "https://api.elsevier.com/content/object/eid/1-s2.0-S0926860X22000783-sc2.sml?httpAccept=%2A%2F%2A",
            "@multimediatype": "GIF image file",
            "@type": "IMAGE-THUMBNAIL",
            "@size": "1778",
            "@ref": "sc2",
            "@mimetype": "image/gif"
          },
          {
            "@category": "thumbnail",
            "@height": "95",
            "@width": "219",
            "@_fa": "true",
            "$": "https://api.elsevier.com/content/object/eid/1-s2.0-S0926860X22000783-gr4.sml?httpAccept=%2A%2F%2A",
            "@multimediatype": "GIF image file",
            "@type": "IMAGE-THUMBNAIL",
            "@size": "6586",
            "@ref": "gr4",
            "@mimetype": "image/gif"
          },
          {
            "@category": "thumbnail",
            "@height": "147",
            "@width": "219",
            "@_fa": "true",
            "$": "https://api.elsevier.com/content/object/eid/1-s2.0-S0926860X22000783-gr3.sml?httpAccept=%2A%2F%2A",
            "@multimediatype": "GIF image file",
            "@type": "IMAGE-THUMBNAIL",
            "@size": "10263",
            "@ref": "gr3",
            "@mimetype": "image/gif"
          },
          {
            "@category": "thumbnail",
            "@height": "163",
            "@width": "162",
            "@_fa": "true",
            "$": "https://api.elsevier.com/content/object/eid/1-s2.0-S0926860X22000783-gr2.sml?httpAccept=%2A%2F%2A",
            "@multimediatype": "GIF image file",
            "@type": "IMAGE-THUMBNAIL",
            "@size": "6813",
            "@ref": "gr2",
            "@mimetype": "image/gif"
          },
          {
            "@category": "thumbnail",
            "@height": "35",
            "@width": "35",
            "@_fa": "true",
            "$": "https://api.elsevier.com/content/object/eid/1-s2.0-S0926860X22000783-fx8.sml?httpAccept=%2A%2F%2A",
            "@multimediatype": "GIF image file",
            "@type": "IMAGE-THUMBNAIL",
            "@size": "1772",
            "@ref": "fx8",
            "@mimetype": "image/gif"
          },
          {
            "@category": "thumbnail",
            "@height": "94",
            "@width": "219",
            "@_fa": "true",
            "$": "https://api.elsevier.com/content/object/eid/1-s2.0-S0926860X22000783-gr1.sml?httpAccept=%2A%2F%2A",
            "@multimediatype": "GIF image file",
            "@type": "IMAGE-THUMBNAIL",
            "@size": "8112",
            "@ref": "gr1",
            "@mimetype": "image/gif"
          },
          {
            "@category": "thumbnail",
            "@height": "35",
            "@width": "35",
            "@_fa": "true",
            "$": "https://api.elsevier.com/content/object/eid/1-s2.0-S0926860X22000783-fx3.sml?httpAccept=%2A%2F%2A",
            "@multimediatype": "GIF image file",
            "@type": "IMAGE-THUMBNAIL",
            "@size": "1707",
            "@ref": "fx3",
            "@mimetype": "image/gif"
          },
          {
            "@category": "thumbnail",
            "@height": "39",
            "@width": "219",
            "@_fa": "true",
            "$": "https://api.elsevier.com/content/object/eid/1-s2.0-S0926860X22000783-sc1.sml?httpAccept=%2A%2F%2A",
            "@multimediatype": "GIF image file",
            "@type": "IMAGE-THUMBNAIL",
            "@size": "5461",
            "@ref": "sc1",
            "@mimetype": "image/gif"
          },
          {
            "@category": "thumbnail",
            "@height": "57",
            "@width": "57",
            "@_fa": "true",
            "$": "https://api.elsevier.com/content/object/eid/1-s2.0-S0926860X22000783-fx2.sml?httpAccept=%2A%2F%2A",
            "@multimediatype": "GIF image file",
            "@type": "IMAGE-THUMBNAIL",
            "@size": "2489",
            "@ref": "fx2",
            "@mimetype": "image/gif"
          },
          {
            "@category": "thumbnail",
            "@height": "57",
            "@width": "57",
            "@_fa": "true",
            "$": "https://api.elsevier.com/content/object/eid/1-s2.0-S0926860X22000783-fx1.sml?httpAccept=%2A%2F%2A",
            "@multimediatype": "GIF image file",
            "@type": "IMAGE-THUMBNAIL",
            "@size": "2556",
            "@ref": "fx1",
            "@mimetype": "image/gif"
          },
          {
            "@category": "thumbnail",
            "@height": "135",
            "@width": "219",
            "@_fa": "true",
            "$": "https://api.elsevier.com/content/object/eid/1-s2.0-S0926860X22000783-ga1.sml?httpAccept=%2A%2F%2A",
            "@multimediatype": "GIF image file",
            "@type": "IMAGE-THUMBNAIL",
            "@size": "13366",
            "@ref": "ga1",
            "@mimetype": "image/gif"
          },
          {
            "@category": "high",
            "@height": "1286",
            "@width": "2994",
            "@_fa": "true",
            "$": "https://api.elsevier.com/content/object/eid/1-s2.0-S0926860X22000783-gr8_lrg.jpg?httpAccept=%2A%2F%2A",
            "@multimediatype": "JPEG image file",
            "@type": "IMAGE-HIGH-RES",
            "@size": "202731",
            "@ref": "gr8",
            "@mimetype": "image/jpeg"
          },
          {
            "@category": "high",
            "@height": "1281",
            "@width": "2994",
            "@_fa": "true",
            "$": "https://api.elsevier.com/content/object/eid/1-s2.0-S0926860X22000783-gr7_lrg.jpg?httpAccept=%2A%2F%2A",
            "@multimediatype": "JPEG image file",
            "@type": "IMAGE-HIGH-RES",
            "@size": "310285",
            "@ref": "gr7",
            "@mimetype": "image/jpeg"
          },
          {
            "@category": "high",
            "@height": "1879",
            "@width": "3493",
            "@_fa": "true",
            "$": "https://api.elsevier.com/content/object/eid/1-s2.0-S0926860X22000783-gr6_lrg.jpg?httpAccept=%2A%2F%2A",
            "@multimediatype": "JPEG image file",
            "@type": "IMAGE-HIGH-RES",
            "@size": "954489",
            "@ref": "gr6",
            "@mimetype": "image/jpeg"
          },
          {
            "@category": "high",
            "@height": "2022",
            "@width": "2994",
            "@_fa": "true",
            "$": "https://api.elsevier.com/content/object/eid/1-s2.0-S0926860X22000783-gr5_lrg.jpg?httpAccept=%2A%2F%2A",
            "@multimediatype": "JPEG image file",
            "@type": "IMAGE-HIGH-RES",
            "@size": "524608",
            "@ref": "gr5",
            "@mimetype": "image/jpeg"
          },
          {
            "@category": "high",
            "@height": "1448",
            "@width": "1497",
            "@_fa": "true",
            "$": "https://api.elsevier.com/content/object/eid/1-s2.0-S0926860X22000783-gr9_lrg.jpg?httpAccept=%2A%2F%2A",
            "@multimediatype": "JPEG image file",
            "@type": "IMAGE-HIGH-RES",
            "@size": "197366",
            "@ref": "gr9",
            "@mimetype": "image/jpeg"
          },
          {
            "@category": "high",
            "@height": "35",
            "@width": "35",
            "@_fa": "true",
            "$": "https://api.elsevier.com/content/object/eid/1-s2.0-S0926860X22000783-fx7_lrg.jpg?httpAccept=%2A%2F%2A",
            "@multimediatype": "JPEG image file",
            "@type": "IMAGE-HIGH-RES",
            "@size": "646",
            "@ref": "fx7",
            "@mimetype": "image/jpeg"
          },
          {
            "@category": "high",
            "@height": "1143",
            "@width": "2994",
            "@_fa": "true",
            "$": "https://api.elsevier.com/content/object/eid/1-s2.0-S0926860X22000783-gr11_lrg.jpg?httpAccept=%2A%2F%2A",
            "@multimediatype": "JPEG image file",
            "@type": "IMAGE-HIGH-RES",
            "@size": "234903",
            "@ref": "gr11",
            "@mimetype": "image/jpeg"
          },
          {
            "@category": "high",
            "@height": "35",
            "@width": "35",
            "@_fa": "true",
            "$": "https://api.elsevier.com/content/object/eid/1-s2.0-S0926860X22000783-fx6_lrg.jpg?httpAccept=%2A%2F%2A",
            "@multimediatype": "JPEG image file",
            "@type": "IMAGE-HIGH-RES",
            "@size": "799",
            "@ref": "fx6",
            "@mimetype": "image/jpeg"
          },
          {
            "@category": "high",
            "@height": "1327",
            "@width": "1497",
            "@_fa": "true",
            "$": "https://api.elsevier.com/content/object/eid/1-s2.0-S0926860X22000783-gr10_lrg.jpg?httpAccept=%2A%2F%2A",
            "@multimediatype": "JPEG image file",
            "@type": "IMAGE-HIGH-RES",
            "@size": "133525",
            "@ref": "gr10",
            "@mimetype": "image/jpeg"
          },
          {
            "@category": "high",
            "@height": "35",
            "@width": "35",
            "@_fa": "true",
            "$": "https://api.elsevier.com/content/object/eid/1-s2.0-S0926860X22000783-fx5_lrg.jpg?httpAccept=%2A%2F%2A",
            "@multimediatype": "JPEG image file",
            "@type": "IMAGE-HIGH-RES",
            "@size": "784",
            "@ref": "fx5",
            "@mimetype": "image/jpeg"
          },
          {
            "@category": "high",
            "@height": "35",
            "@width": "35",
            "@_fa": "true",
            "$": "https://api.elsevier.com/content/object/eid/1-s2.0-S0926860X22000783-fx4_lrg.jpg?httpAccept=%2A%2F%2A",
            "@multimediatype": "JPEG image file",
            "@type": "IMAGE-HIGH-RES",
            "@size": "900",
            "@ref": "fx4",
            "@mimetype": "image/jpeg"
          },
          {
            "@category": "high",
            "@height": "1289",
            "@width": "1497",
            "@_fa": "true",
            "$": "https://api.elsevier.com/content/object/eid/1-s2.0-S0926860X22000783-gr12_lrg.jpg?httpAccept=%2A%2F%2A",
            "@multimediatype": "JPEG image file",
            "@type": "IMAGE-HIGH-RES",
            "@size": "111572",
            "@ref": "gr12",
            "@mimetype": "image/jpeg"
          },
          {
            "@category": "high",
            "@height": "915",
            "@width": "3493",
            "@_fa": "true",
            "$": "https://api.elsevier.com/content/object/eid/1-s2.0-S0926860X22000783-sc2_lrg.jpg?httpAccept=%2A%2F%2A",
            "@multimediatype": "JPEG image file",
            "@type": "IMAGE-HIGH-RES",
            "@size": "106592",
            "@ref": "sc2",
            "@mimetype": "image/jpeg"
          },
          {
            "@category": "high",
            "@height": "1300",
            "@width": "2994",
            "@_fa": "true",
            "$": "https://api.elsevier.com/content/object/eid/1-s2.0-S0926860X22000783-gr4_lrg.jpg?httpAccept=%2A%2F%2A",
            "@multimediatype": "JPEG image file",
            "@type": "IMAGE-HIGH-RES",
            "@size": "271037",
            "@ref": "gr4",
            "@mimetype": "image/jpeg"
          },
          {
            "@category": "high",
            "@height": "1981",
            "@width": "2951",
            "@_fa": "true",
            "$": "https://api.elsevier.com/content/object/eid/1-s2.0-S0926860X22000783-gr3_lrg.jpg?httpAccept=%2A%2F%2A",
            "@multimediatype": "JPEG image file",
            "@type": "IMAGE-HIGH-RES",
            "@size": "443450",
            "@ref": "gr3",
            "@mimetype": "image/jpeg"
          },
          {
            "@category": "high",
            "@height": "1510",
            "@width": "1497",
            "@_fa": "true",
            "$": "https://api.elsevier.com/content/object/eid/1-s2.0-S0926860X22000783-gr2_lrg.jpg?httpAccept=%2A%2F%2A",
            "@multimediatype": "JPEG image file",
            "@type": "IMAGE-HIGH-RES",
            "@size": "147504",
            "@ref": "gr2",
            "@mimetype": "image/jpeg"
          },
          {
            "@category": "high",
            "@height": "35",
            "@width": "35",
            "@_fa": "true",
            "$": "https://api.elsevier.com/content/object/eid/1-s2.0-S0926860X22000783-fx8_lrg.jpg?httpAccept=%2A%2F%2A",
            "@multimediatype": "JPEG image file",
            "@type": "IMAGE-HIGH-RES",
            "@size": "832",
            "@ref": "fx8",
            "@mimetype": "image/jpeg"
          },
          {
            "@category": "high",
            "@height": "1279",
            "@width": "2994",
            "@_fa": "true",
            "$": "https://api.elsevier.com/content/object/eid/1-s2.0-S0926860X22000783-gr1_lrg.jpg?httpAccept=%2A%2F%2A",
            "@multimediatype": "JPEG image file",
            "@type": "IMAGE-HIGH-RES",
            "@size": "345418",
            "@ref": "gr1",
            "@mimetype": "image/jpeg"
          },
          {
            "@category": "high",
            "@height": "35",
            "@width": "35",
            "@_fa": "true",
            "$": "https://api.elsevier.com/content/object/eid/1-s2.0-S0926860X22000783-fx3_lrg.jpg?httpAccept=%2A%2F%2A",
            "@multimediatype": "JPEG image file",
            "@type": "IMAGE-HIGH-RES",
            "@size": "972",
            "@ref": "fx3",
            "@mimetype": "image/jpeg"
          },
          {
            "@category": "high",
            "@height": "534",
            "@width": "2994",
            "@_fa": "true",
            "$": "https://api.elsevier.com/content/object/eid/1-s2.0-S0926860X22000783-sc1_lrg.jpg?httpAccept=%2A%2F%2A",
            "@multimediatype": "JPEG image file",
            "@type": "IMAGE-HIGH-RES",
            "@size": "187360",
            "@ref": "sc1",
            "@mimetype": "image/jpeg"
          },
          {
            "@category": "high",
            "@height": "57",
            "@width": "57",
            "@_fa": "true",
            "$": "https://api.elsevier.com/content/object/eid/1-s2.0-S0926860X22000783-fx2_lrg.jpg?httpAccept=%2A%2F%2A",
            "@multimediatype": "JPEG image file",
            "@type": "IMAGE-HIGH-RES",
            "@size": "946",
            "@ref": "fx2",
            "@mimetype": "image/jpeg"
          },
          {
            "@category": "high",
            "@height": "57",
            "@width": "57",
            "@_fa": "true",
            "$": "https://api.elsevier.com/content/object/eid/1-s2.0-S0926860X22000783-fx1_lrg.jpg?httpAccept=%2A%2F%2A",
            "@multimediatype": "JPEG image file",
            "@type": "IMAGE-HIGH-RES",
            "@size": "1241",
            "@ref": "fx1",
            "@mimetype": "image/jpeg"
          },
          {
            "@category": "high",
            "@height": "886",
            "@width": "1437",
            "@_fa": "true",
            "$": "https://api.elsevier.com/content/object/eid/1-s2.0-S0926860X22000783-ga1_lrg.jpg?httpAccept=%2A%2F%2A",
            "@multimediatype": "JPEG image file",
            "@type": "IMAGE-HIGH-RES",
            "@size": "139373",
            "@ref": "ga1",
            "@mimetype": "image/jpeg"
          },
          {
            "@category": "standard",
            "@_fa": "true",
            "$": "https://api.elsevier.com/content/object/eid/1-s2.0-S0926860X22000783-mmc1.pptx?httpAccept=%2A%2F%2A",
            "@multimediatype": "Microsoft Powerpoint file",
            "@type": "APPLICATION",
            "@size": "2435011",
            "@ref": "mmc1",
            "@mimetype": "application/ppt"
          },
          {
            "@category": "standard",
            "@_fa": "true",
            "$": "https://api.elsevier.com/content/object/eid/1-s2.0-S0926860X22000783-am.pdf?httpAccept=%2A%2F%2A",
            "@multimediatype": "Acrobat PDF file",
            "@type": "AAM-PDF",
            "@size": "4080923",
            "@ref": "am",
            "@mimetype": "application/pdf"
          }
        ]
      },
      "link": {
        "@rel": "abstract",
        "@href": "https://api.elsevier.com/content/abstract/scopus_id/85125250458"
      }
    }
  }
}