{
  "metadata": {
    "title": "Kinetic modelling and measurement of catalyst deactivation for the catalytic co-pyrolysis of PP and PET with HZSM-5",
    "authors": "; ; ",
    "journal": "Applied Catalysis A: General",
    "date": "2025-12-25",
    "doi": "10.1016/j.apcata.2025.120574",
    "abstract": "",
    "uri": "https://api.elsevier.com/content/article/pii/S0926860X25004764",
    "pii": "S0926860X25004764"
  },
  "fulltext": {
    "full-text-retrieval-response": {
      "originalText": "serial JL 271346 291210 291744 291809 31 Applied Catalysis A: General APPLIEDCATALYSISAGENERAL 2025-09-20 2025-09-20 2025-09-30 2025-09-30 2025-10-11T16:52:42 1-s2.0-S0926860X25004764 S0926-860X(25)00476-4 S0926860X25004764 10.1016/j.apcata.2025.120574 S300 S300.1 FULL-TEXT 1-s2.0-S0926860X25X00168 2025-10-11T16:06:29.036337Z 0 0 20251225 2025 2025-09-20T07:06:55.30964Z absattachment articleinfo articlenumber articletitlenorm authfirstinitialnorm authfirstsurnamenorm cid cids contenttype copyright crossmark dateloaded dateloadedtxt datesearch datesort dateupdated dco docsubtype doctype doi eid ewtransactionid hubeid indexeddate issn issnnorm itemstage itemtransactionid itemweight openaccess openarchive pg pgfirst pii piinorm pubdatestart pubdatetxt pubyr sortorder srctitle srctitlenorm srctype ssids alllist content subj subheadings suppl tomb volfirst volissue volumelist webpdf webpdfpagecount yearnav figure table e-component body mmlmath acknowledge affil appendices articletitle auth authfirstini authfull authkeywords authlast footnotes grantnumber grantsponsor highlightsabst orcid primabst ref specialabst 0926-860X 0926860X true 708 708 C Volume 708 62 120574 120574 120574 20251225 25 December 2025 2025-12-25 2025 article fla © 2025 Elsevier B.V. All rights are reserved, including those for text and data mining, AI training, and similar technologies. KINETICMODELLINGMEASUREMENTCATALYSTDEACTIVATIONFORCATALYTICCOPYROLYSISPPPETHZSM5 OKONSKY S 1 Introduction 2 Materials and methods 2.1 Materials 2.2 Catalytic pyrolysis experiments via thermogravimetric analysis 2.3 Pyridine and collidine temperature programmed desorption for determination of catalyst acidity 2.4 Nitrogen physisorption for surface analysis of fresh and used catalysts 2.5 Flynn-Wall-Ozawa method for isoconversional activation energy determination 2.6 Least-squares nth-order lumped kinetic modelling 3 Results and discussion 3.1 Effect of operating conditions on catalytic pyrolysis 3.2 Effect of catalyst deactivation on subsequent pyrolysis experiments 3.3 Characterization of fresh and used catalysts 3.4 Isoconversional approach for activation energy determination 3.5 Nth-order kinetic modelling results 4 Conclusion CRediT authorship contribution statement Acknowledgments Appendix A Supplementary material References GEYER 2017 e1700782 R RAGAERT 2017 24 58 K KAISER 2018 K LOPEZ 2017 346 368 G PEREZ 2024 106376 B ARTETXE 2010 2064 2069 M DU 2016 2852 2860 S LEE 2020 5594 5598 H AGUADO 2001 5696 5704 J ESCHENBACHER 2022 121251 A XUE 2017 441 451 Y OKONSKY 2022 2175 2191 S ABOULKAS 2010 1363 1369 A JAYARAMAKRISHNA 2019 48 58 J DURMUS 2005 316 322 A VALANCIENE 2016 341 354 E RAJA 2023 144046 N MARCILLA 2007 197 204 A REJMAN 2023 S DALIGAUX 2021 770 V ELORDI 2009 345 351 G CHEN 2021 117873 Z ELORDI 2011 224 231 G MARCILLA 2006 222 229 A MARCILLA 2007 124 131 A PARRILLO 1994 67 74 D DU 2002 395 400 H MANOS 2000 1203 1208 G PEREZ 2023 143637 B MLEKODAJ 2014 54 61 K JERDY 2023 122986 A TAN 2023 123028 J SIDHU 2023 N SAHA 2008 94 100 B DUBDUB 2023 70 I REJMAN 2025 2980 S OKONSKYX2025X120574 OKONSKYX2025X120574XS 2027-09-30T00:00:00.000Z 2027-09-30T00:00:00.000Z http://creativecommons.org/licenses/by-nc-nd/4.0/ © 2025 Elsevier B.V. All rights are reserved, including those for text and data mining, AI training, and similar technologies. 2025-09-22T18:46:33.090Z http://vtw.elsevier.com/data/voc/AddOnTypes/50.7/aggregated-refined EERE EERE Office of Energy Efficiency and Renewable Energy http://data.elsevier.com/vocabulary/SciValFunders/100006134 http://sws.geonames.org/6252001/ U.S. Department of Energy ERDA U.S. Department of Energy http://data.elsevier.com/vocabulary/SciValFunders/100000015 http://sws.geonames.org/6252001/ DE-EE0007897 Advanced Manufacturing Office http://data.elsevier.com/vocabulary/SciValFunders/100006116 http://sws.geonames.org/6252001 This material is based upon work supported by the U.S. Department of Energy\\u2019s Office of Energy Efficiency and Renewable Energy (EERE) under the Advanced Manufacturing Office Award Number DE-EE0007897 awarded to the REMADE Institute, a division of Sustainable Manufacturing Innovation Alliance Corp. This report was prepared as an account of work sponsored by an agency of the United States Government. Neither the United States Government nor any agency thereof, nor any of their employees, makes any warranty, express or implied, or assumes any legal liability or responsibility for the accuracy, completeness, or usefulness of any information, apparatus, product, or process disclosed, or represents that its use would not infringe privately owned rights. Reference herein to any specific commercial product, process, or service by trade name, trademark, manufacturer, or otherwise does not necessarily constitute or imply its endorsement, recommendation, or favoring by the United States Government or any agency thereof. The views and opinions of authors expressed herein do not necessarily state or reflect those of the United States Government or any agency thereof. https://doi.org/10.15223/policy-017 https://doi.org/10.15223/policy-037 https://doi.org/10.15223/policy-012 https://doi.org/10.15223/policy-029 https://doi.org/10.15223/policy-004 item S0926-860X(25)00476-4 S0926860X25004764 1-s2.0-S0926860X25004764 10.1016/j.apcata.2025.120574 271346 2025-10-11T16:06:29.036337Z 2025-12-25 1-s2.0-S0926860X25004764-main.pdf https://s3-eu-west-1.amazonaws.com/prod-ucs-content-store-eu-west/content/pii:S0926860X25004764/MAIN/application/pdf/06547862ff0f9231eee58672120633ad/main.pdf main.pdf pdf true 6410887 MAIN 11 1-s2.0-S0926860X25004764-main_1.png https://s3-eu-west-1.amazonaws.com/prod-ucs-content-store-eu-west/content/pii:S0926860X25004764/PREVIEW/image/png/947f170584baa289dd4000bc3aae4a23/main_1.png main_1.png png 59564 928 656 IMAGE-WEB-PDF 1 1-s2.0-S0926860X25004764-gr9.jpg https://s3-eu-west-1.amazonaws.com/prod-ucs-content-store-eu-west/content/pii:S0926860X25004764/gr9/DOWNSAMPLED/image/jpeg/960dec3707cfc42a01364e2cc1086d05/gr9.jpg gr9 gr9.jpg jpg 127432 704 678 IMAGE-DOWNSAMPLED 1-s2.0-S0926860X25004764-gr9.sml https://s3-eu-west-1.amazonaws.com/prod-ucs-content-store-eu-west/content/pii:S0926860X25004764/gr9/THUMBNAIL/image/gif/c5c9002250b301b18cb0385fb42ef9b3/gr9.sml gr9 gr9.sml sml 10101 164 158 IMAGE-THUMBNAIL 1-s2.0-S0926860X25004764-gr7.jpg https://s3-eu-west-1.amazonaws.com/prod-ucs-content-store-eu-west/content/pii:S0926860X25004764/gr7/DOWNSAMPLED/image/jpeg/19425305a00c5dd7ad30b5cf9cd75071/gr7.jpg gr7 gr7.jpg jpg 29690 315 376 IMAGE-DOWNSAMPLED 1-s2.0-S0926860X25004764-gr7.sml https://s3-eu-west-1.amazonaws.com/prod-ucs-content-store-eu-west/content/pii:S0926860X25004764/gr7/THUMBNAIL/image/gif/5486615b4524595cb895c397a862a0bd/gr7.sml gr7 gr7.sml sml 8217 164 196 IMAGE-THUMBNAIL 1-s2.0-S0926860X25004764-gr8.jpg https://s3-eu-west-1.amazonaws.com/prod-ucs-content-store-eu-west/content/pii:S0926860X25004764/gr8/DOWNSAMPLED/image/jpeg/c68c4d4d23499ee15f754f177d516bd8/gr8.jpg gr8 gr8.jpg jpg 23258 286 376 IMAGE-DOWNSAMPLED 1-s2.0-S0926860X25004764-gr8.sml https://s3-eu-west-1.amazonaws.com/prod-ucs-content-store-eu-west/content/pii:S0926860X25004764/gr8/THUMBNAIL/image/gif/f6016c8c75bb7fe88da47f33336f717e/gr8.sml gr8 gr8.sml sml 7164 164 215 IMAGE-THUMBNAIL 1-s2.0-S0926860X25004764-gr5.jpg https://s3-eu-west-1.amazonaws.com/prod-ucs-content-store-eu-west/content/pii:S0926860X25004764/gr5/DOWNSAMPLED/image/jpeg/e9d3bc2d5268db8a4b1481b617bc8ffe/gr5.jpg gr5 gr5.jpg jpg 48068 311 678 IMAGE-DOWNSAMPLED 1-s2.0-S0926860X25004764-gr5.sml https://s3-eu-west-1.amazonaws.com/prod-ucs-content-store-eu-west/content/pii:S0926860X25004764/gr5/THUMBNAIL/image/gif/4a2a2437004275acd907269ea93f5b16/gr5.sml gr5 gr5.sml sml 7218 100 219 IMAGE-THUMBNAIL 1-s2.0-S0926860X25004764-gr6.jpg https://s3-eu-west-1.amazonaws.com/prod-ucs-content-store-eu-west/content/pii:S0926860X25004764/gr6/DOWNSAMPLED/image/jpeg/07f0fd767001db89431f6ffaff39cc4a/gr6.jpg gr6 gr6.jpg jpg 30652 289 376 IMAGE-DOWNSAMPLED 1-s2.0-S0926860X25004764-gr6.sml https://s3-eu-west-1.amazonaws.com/prod-ucs-content-store-eu-west/content/pii:S0926860X25004764/gr6/THUMBNAIL/image/gif/c0a1496b737af8e4792ec97a377222bb/gr6.sml gr6 gr6.sml sml 10591 164 213 IMAGE-THUMBNAIL 1-s2.0-S0926860X25004764-gr3.jpg https://s3-eu-west-1.amazonaws.com/prod-ucs-content-store-eu-west/content/pii:S0926860X25004764/gr3/DOWNSAMPLED/image/jpeg/6aeba69bc1f242db8a2666d0c07f97ae/gr3.jpg gr3 gr3.jpg jpg 24882 297 376 IMAGE-DOWNSAMPLED 1-s2.0-S0926860X25004764-gr3.sml https://s3-eu-west-1.amazonaws.com/prod-ucs-content-store-eu-west/content/pii:S0926860X25004764/gr3/THUMBNAIL/image/gif/7984f2cb65173887e94b8bb00448c330/gr3.sml gr3 gr3.sml sml 8545 164 208 IMAGE-THUMBNAIL 1-s2.0-S0926860X25004764-gr4.jpg https://s3-eu-west-1.amazonaws.com/prod-ucs-content-store-eu-west/content/pii:S0926860X25004764/gr4/DOWNSAMPLED/image/jpeg/cce9c69539dff82650a9c75d157323a5/gr4.jpg gr4 gr4.jpg jpg 42333 312 668 IMAGE-DOWNSAMPLED 1-s2.0-S0926860X25004764-gr4.sml https://s3-eu-west-1.amazonaws.com/prod-ucs-content-store-eu-west/content/pii:S0926860X25004764/gr4/THUMBNAIL/image/gif/218792626ecdccb6bc7509d085c3558d/gr4.sml gr4 gr4.sml sml 6652 102 219 IMAGE-THUMBNAIL 1-s2.0-S0926860X25004764-gr1.jpg https://s3-eu-west-1.amazonaws.com/prod-ucs-content-store-eu-west/content/pii:S0926860X25004764/gr1/DOWNSAMPLED/image/jpeg/6e8c40387bc05c12700d64b22d63e8e9/gr1.jpg gr1 gr1.jpg jpg 46916 305 678 IMAGE-DOWNSAMPLED 1-s2.0-S0926860X25004764-gr1.sml https://s3-eu-west-1.amazonaws.com/prod-ucs-content-store-eu-west/content/pii:S0926860X25004764/gr1/THUMBNAIL/image/gif/9a5a4d14c76ad16859897fe54f5d606b/gr1.sml gr1 gr1.sml sml 6907 99 219 IMAGE-THUMBNAIL 1-s2.0-S0926860X25004764-gr2.jpg https://s3-eu-west-1.amazonaws.com/prod-ucs-content-store-eu-west/content/pii:S0926860X25004764/gr2/DOWNSAMPLED/image/jpeg/53119c1cbafd4d421496b2ded60fab06/gr2.jpg gr2 gr2.jpg jpg 45127 305 678 IMAGE-DOWNSAMPLED 1-s2.0-S0926860X25004764-gr2.sml https://s3-eu-west-1.amazonaws.com/prod-ucs-content-store-eu-west/content/pii:S0926860X25004648/gr2/THUMBNAIL/image/gif/00b4194fd6959a9f74d3053bbd3f1718/gr2.sml gr2 gr2.sml sml 6666 99 219 IMAGE-THUMBNAIL 1-s2.0-S0926860X25004764-ga1.jpg https://s3-eu-west-1.amazonaws.com/prod-ucs-content-store-eu-west/content/pii:S0926860X25004764/ga1/DOWNSAMPLED/image/jpeg/68977691ff043cae1a8294e3011ae1e7/ga1.jpg ga1 true ga1.jpg jpg 31505 191 500 IMAGE-DOWNSAMPLED 1-s2.0-S0926860X25004764-ga1.sml https://s3-eu-west-1.amazonaws.com/prod-ucs-content-store-eu-west/content/pii:S0926860X25004648/ga1/THUMBNAIL/image/gif/4c4bb98bed67737c728e46d7655b4eac/ga1.sml ga1 true ga1.sml sml 8088 84 219 IMAGE-THUMBNAIL 1-s2.0-S0926860X25004764-gr9_lrg.jpg https://s3-eu-west-1.amazonaws.com/prod-ucs-content-store-eu-west/content/pii:S0926860X25004764/HIGHRES/image/jpeg/0505e28119c6f26f9b2ea833be2e15a4/gr9_lrg.jpg gr9 gr9_lrg.jpg jpg 716511 3107 2994 IMAGE-HIGH-RES 1-s2.0-S0926860X25004764-gr7_lrg.jpg https://s3-eu-west-1.amazonaws.com/prod-ucs-content-store-eu-west/content/pii:S0926860X25004764/HIGHRES/image/jpeg/69b91698b2172debdaca74dd0faa0004/gr7_lrg.jpg gr7 gr7_lrg.jpg jpg 155908 1392 1663 IMAGE-HIGH-RES 1-s2.0-S0926860X25004764-gr8_lrg.jpg https://s3-eu-west-1.amazonaws.com/prod-ucs-content-store-eu-west/content/pii:S0926860X25004764/HIGHRES/image/jpeg/786705618fc4c6e42a83ed7567da45bd/gr8_lrg.jpg gr8 gr8_lrg.jpg jpg 110830 1265 1663 IMAGE-HIGH-RES 1-s2.0-S0926860X25004764-gr5_lrg.jpg https://s3-eu-west-1.amazonaws.com/prod-ucs-content-store-eu-west/content/pii:S0926860X25004764/HIGHRES/image/jpeg/a59e9081c804b958395dc8c9bfbb6c95/gr5_lrg.jpg gr5 gr5_lrg.jpg jpg 263843 1373 2994 IMAGE-HIGH-RES 1-s2.0-S0926860X25004764-gr6_lrg.jpg https://s3-eu-west-1.amazonaws.com/prod-ucs-content-store-eu-west/content/pii:S0926860X25004764/HIGHRES/image/jpeg/65660e1059200644dbdd792e7630fb34/gr6_lrg.jpg gr6 gr6_lrg.jpg jpg 173141 1280 1663 IMAGE-HIGH-RES 1-s2.0-S0926860X25004764-gr3_lrg.jpg https://s3-eu-west-1.amazonaws.com/prod-ucs-content-store-eu-west/content/pii:S0926860X25004764/HIGHRES/image/jpeg/a23e8d4b92489b57f0dbb231df6304e5/gr3_lrg.jpg gr3 gr3_lrg.jpg jpg 129836 1313 1663 IMAGE-HIGH-RES 1-s2.0-S0926860X25004764-gr4_lrg.jpg https://s3-eu-west-1.amazonaws.com/prod-ucs-content-store-eu-west/content/pii:S0926860X25004764/HIGHRES/image/jpeg/2813ea42683cf405af3cae12e95128af/gr4_lrg.jpg gr4 gr4_lrg.jpg jpg 250479 1379 2956 IMAGE-HIGH-RES 1-s2.0-S0926860X25004764-gr1_lrg.jpg https://s3-eu-west-1.amazonaws.com/prod-ucs-content-store-eu-west/content/pii:S0926860X25004648/HIGHRES/image/jpeg/94c6d0b6620ca167c7cb7b78dbb15ca1/gr1_lrg.jpg gr1 gr1_lrg.jpg jpg 261119 1349 2995 IMAGE-HIGH-RES 1-s2.0-S0926860X25004764-gr2_lrg.jpg https://s3-eu-west-1.amazonaws.com/prod-ucs-content-store-eu-west/content/pii:S0926860X25004648/HIGHRES/image/jpeg/964fcf73c9b0eea8ffa08abf4daada45/gr2_lrg.jpg gr2 gr2_lrg.jpg jpg 264404 1349 2994 IMAGE-HIGH-RES 1-s2.0-S0926860X25004764-ga1_lrg.jpg https://s3-eu-west-1.amazonaws.com/prod-ucs-content-store-eu-west/content/pii:S0926860X25004648/HIGHRES/image/jpeg/cf2118df464bee0c6a493bece9820ba1/ga1_lrg.jpg ga1 true ga1_lrg.jpg jpg 245171 846 2213 IMAGE-HIGH-RES 1-s2.0-S0926860X25004764-mmc1.docx https://s3-eu-west-1.amazonaws.com/prod-ucs-content-store-eu-west/content/pii:S0926860X25004764/mmc1/MAIN/application/vnd.openxmlformats-officedocument.wordprocessingml.document/0de74b870345a531f3fd37a1d534da9d/mmc1.docx mmc1 mmc1.docx docx 46598186 APPLICATION 1-s2.0-S0926860X25004764-si0001.svg https://s3-eu-west-1.amazonaws.com/prod-ucs-content-store-eu-west/content/pii:S0926860X25004764/image/svg+xml/873ff4141b1db49c9d3807c50ae3fe19/si0001.svg si0001 si0001.svg svg 1256 ALTIMG 1-s2.0-S0926860X25004764-si0002.svg https://s3-eu-west-1.amazonaws.com/prod-ucs-content-store-eu-west/content/pii:S0926860X25004764/image/svg+xml/92eeca51b5286895bb24b6242c4173f2/si0002.svg si0002 si0002.svg svg 1126 ALTIMG 1-s2.0-S0926860X25004764-si0003.svg https://s3-eu-west-1.amazonaws.com/prod-ucs-content-store-eu-west/content/pii:S0926860X25004764/image/svg+xml/0f74d6e3e1cc5b898d677ee8d42336c0/si0003.svg si0003 si0003.svg svg 1118 ALTIMG 1-s2.0-S0926860X25004764-si0004.svg https://s3-eu-west-1.amazonaws.com/prod-ucs-content-store-eu-west/content/pii:S0926860X25004764/image/svg+xml/0ec840e82eeafba2ef18e409b45663bf/si0004.svg si0004 si0004.svg svg 1231 ALTIMG 1-s2.0-S0926860X25004764-si0005.svg https://s3-eu-west-1.amazonaws.com/prod-ucs-content-store-eu-west/content/pii:S0926860X25004764/image/svg+xml/f3aabda29af2aa1f517bbf3a1b2a9ad0/si0005.svg si0005 si0005.svg svg 1106 ALTIMG 1-s2.0-S0926860X25004764-si0006.svg https://s3-eu-west-1.amazonaws.com/prod-ucs-content-store-eu-west/content/pii:S0926860X25004764/image/svg+xml/d67a10825fca728cd98d4812a5bb5d8c/si0006.svg si0006 si0006.svg svg 1122 ALTIMG 1-s2.0-S0926860X25004764-si0007.svg https://s3-eu-west-1.amazonaws.com/prod-ucs-content-store-eu-west/content/pii:S0926860X25004764/image/svg+xml/4cc2ba481aedb452fcb0acc08401106a/si0007.svg si0007 si0007.svg svg 4660 ALTIMG 1-s2.0-S0926860X25004764-si0008.svg https://s3-eu-west-1.amazonaws.com/prod-ucs-content-store-eu-west/content/pii:S0926860X25004764/image/svg+xml/c7c4194b53a19c6b4b3b55ce2afd6961/si0008.svg si0008 si0008.svg svg 1053 ALTIMG 1-s2.0-S0926860X25004764-si0009.svg https://s3-eu-west-1.amazonaws.com/prod-ucs-content-store-eu-west/content/pii:S0926860X25004764/image/svg+xml/22f06a7dce04ca1f359cb5f5c20e9e9b/si0009.svg si0009 si0009.svg svg 2933 ALTIMG 1-s2.0-S0926860X25004764-si0010.svg https://s3-eu-west-1.amazonaws.com/prod-ucs-content-store-eu-west/content/pii:S0926860X25004764/image/svg+xml/ebfecb3abcfc9f495c99bf8f1c073b09/si0010.svg si0010 si0010.svg svg 2998 ALTIMG 1-s2.0-S0926860X25004764-si0011.svg https://s3-eu-west-1.amazonaws.com/prod-ucs-content-store-eu-west/content/pii:S0926860X25004764/image/svg+xml/512853066f49a56d85d624891f2dea2e/si0011.svg si0011 si0011.svg svg 1057 ALTIMG 1-s2.0-S0926860X25004764-si0012.svg https://s3-eu-west-1.amazonaws.com/prod-ucs-content-store-eu-west/content/pii:S0926860X25004764/image/svg+xml/3286ddc832715fb45c2690b3723ccb0a/si0012.svg si0012 si0012.svg svg 1292 ALTIMG 1-s2.0-S0926860X25004764-si0013.svg https://s3-eu-west-1.amazonaws.com/prod-ucs-content-store-eu-west/content/pii:S0926860X25004764/image/svg+xml/324c045441bdfaf7dac9cbcb4de6ec0e/si0013.svg si0013 si0013.svg svg 1503 ALTIMG 1-s2.0-S0926860X25004764-si0014.svg https://s3-eu-west-1.amazonaws.com/prod-ucs-content-store-eu-west/content/pii:S0926860X25004764/image/svg+xml/06c249908b53ed22ebeb54d7f575c8d9/si0014.svg si0014 si0014.svg svg 1653 ALTIMG 1-s2.0-S0926860X25004764-si0015.svg https://s3-eu-west-1.amazonaws.com/prod-ucs-content-store-eu-west/content/pii:S0926860X25004764/image/svg+xml/467f99d2816b77f539beea1a14cb92f0/si0015.svg si0015 si0015.svg svg 3083 ALTIMG 1-s2.0-S0926860X25004764-si0016.svg https://s3-eu-west-1.amazonaws.com/prod-ucs-content-store-eu-west/content/pii:S0926860X25004764/image/svg+xml/4355d789aec8929333c3af408474bff2/si0016.svg si0016 si0016.svg svg 1154 ALTIMG 1-s2.0-S0926860X25004764-si0017.svg https://s3-eu-west-1.amazonaws.com/prod-ucs-content-store-eu-west/content/pii:S0926860X25004764/image/svg+xml/28adb87cc0f48bf9203bdf9d44f65468/si0017.svg si0017 si0017.svg svg 1053 ALTIMG 1-s2.0-S0926860X25004764-si0018.svg https://s3-eu-west-1.amazonaws.com/prod-ucs-content-store-eu-west/content/pii:S0926860X25004764/image/svg+xml/a22826e14116d1dd84d82f383eb63920/si0018.svg si0018 si0018.svg svg 1884 ALTIMG 1-s2.0-S0926860X25004764-si0019.svg https://s3-eu-west-1.amazonaws.com/prod-ucs-content-store-eu-west/content/pii:S0926860X25004764/image/svg+xml/d44a49dea8906f7dcae6888add32726e/si0019.svg si0019 si0019.svg svg 4611 ALTIMG 1-s2.0-S0926860X25004764-si0020.svg https://s3-eu-west-1.amazonaws.com/prod-ucs-content-store-eu-west/content/pii:S0926860X25004764/image/svg+xml/4357bf27492e2705ded16395bc5bc91d/si0020.svg si0020 si0020.svg svg 2909 ALTIMG 1-s2.0-S0926860X25004764-si0021.svg https://s3-eu-west-1.amazonaws.com/prod-ucs-content-store-eu-west/content/pii:S0926860X25004764/image/svg+xml/92f7a25def8cfd98b498d19193f65f25/si0021.svg si0021 si0021.svg svg 4951 ALTIMG 1-s2.0-S0926860X25004764-si0022.svg https://s3-eu-west-1.amazonaws.com/prod-ucs-content-store-eu-west/content/pii:S0926860X25004764/image/svg+xml/d33d63da8adcb510af90007181a01a7f/si0022.svg si0022 si0022.svg svg 972 ALTIMG 1-s2.0-S0926860X25004764-si0023.svg https://s3-eu-west-1.amazonaws.com/prod-ucs-content-store-eu-west/content/pii:S0926860X25004764/image/svg+xml/834ae5c259180dd05afaa10456e806f5/si0023.svg si0023 si0023.svg svg 1000 ALTIMG 1-s2.0-S0926860X25004764-si0024.svg https://s3-eu-west-1.amazonaws.com/prod-ucs-content-store-eu-west/content/pii:S0926860X25004764/image/svg+xml/a64ef615734cc0729cd168e43d133229/si0024.svg si0024 si0024.svg svg 1223 ALTIMG 1-s2.0-S0926860X25004764-si0025.svg https://s3-eu-west-1.amazonaws.com/prod-ucs-content-store-eu-west/content/pii:S0926860X25004764/image/svg+xml/d875489fc0b9be18cdb0af313d053260/si0025.svg si0025 si0025.svg svg 1207 ALTIMG 1-s2.0-S0926860X25004764-si0026.svg https://s3-eu-west-1.amazonaws.com/prod-ucs-content-store-eu-west/content/pii:S0926860X25004764/image/svg+xml/04dc5d9db8d7188086c19f3ba3b5c70c/si0026.svg si0026 si0026.svg svg 1016 ALTIMG 1-s2.0-S0926860X25004764-si0027.svg https://s3-eu-west-1.amazonaws.com/prod-ucs-content-store-eu-west/content/pii:S0926860X25004764/image/svg+xml/3d38077e298c2174d789381cc6b4756b/si0027.svg si0027 si0027.svg svg 1012 ALTIMG 1-s2.0-S0926860X25004764-si0028.svg https://s3-eu-west-1.amazonaws.com/prod-ucs-content-store-eu-west/content/pii:S0926860X25004764/image/svg+xml/f6e260c9255099f58d50de9e8bd53201/si0028.svg si0028 si0028.svg svg 3796 ALTIMG 1-s2.0-S0926860X25004764-si0029.svg https://s3-eu-west-1.amazonaws.com/prod-ucs-content-store-eu-west/content/pii:S0926860X25004764/image/svg+xml/3cfeff1e23cc622470d88f57792aaf0d/si0029.svg si0029 si0029.svg svg 1134 ALTIMG 1-s2.0-S0926860X25004764-si0030.svg https://s3-eu-west-1.amazonaws.com/prod-ucs-content-store-eu-west/content/pii:S0926860X25004764/image/svg+xml/5732a10541426c249561c86f45adf64e/si0030.svg si0030 si0030.svg svg 1531 ALTIMG 1-s2.0-S0926860X25004764-si0031.svg https://s3-eu-west-1.amazonaws.com/prod-ucs-content-store-eu-west/content/pii:S0926860X25004764/image/svg+xml/44c75b52cc99a372202a154b42e4d94e/si0031.svg si0031 si0031.svg svg 2487 ALTIMG 1-s2.0-S0926860X25004764-si0032.svg https://s3-eu-west-1.amazonaws.com/prod-ucs-content-store-eu-west/content/pii:S0926860X25004764/image/svg+xml/d67de2805130338a9dade0ba56ea2768/si0032.svg si0032 si0032.svg svg 1130 ALTIMG 1-s2.0-S0926860X25004764-si0033.svg https://s3-eu-west-1.amazonaws.com/prod-ucs-content-store-eu-west/content/pii:S0926860X25004764/image/svg+xml/0d381bf33f85e8511560644d521f1ce3/si0033.svg si0033 si0033.svg svg 4311 ALTIMG 1-s2.0-S0926860X25004764-si0034.svg https://s3-eu-west-1.amazonaws.com/prod-ucs-content-store-eu-west/content/pii:S0926860X25004764/image/svg+xml/2ed55ba3cbb5c6b860f0cb55dc482210/si0034.svg si0034 si0034.svg svg 1470 ALTIMG 1-s2.0-S0926860X25004764-si0035.svg https://s3-eu-west-1.amazonaws.com/prod-ucs-content-store-eu-west/content/pii:S0926860X25004764/image/svg+xml/6c44d11a07ab2e48e9a8cc67f0353af3/si0035.svg si0035 si0035.svg svg 1470 ALTIMG 1-s2.0-S0926860X25004764-si0036.svg https://s3-eu-west-1.amazonaws.com/prod-ucs-content-store-eu-west/content/pii:S0926860X25004764/image/svg+xml/7ded08eafec5fecba3cea6794b3870f2/si0036.svg si0036 si0036.svg svg 3586 ALTIMG 1-s2.0-S0926860X25004764-si0037.svg https://s3-eu-west-1.amazonaws.com/prod-ucs-content-store-eu-west/content/pii:S0926860X25004764/image/svg+xml/b38ee45f1729a27b4852378351fca014/si0037.svg si0037 si0037.svg svg 3578 ALTIMG 1-s2.0-S0926860X25004764-si0038.svg https://s3-eu-west-1.amazonaws.com/prod-ucs-content-store-eu-west/content/pii:S0926860X25004764/image/svg+xml/7d962f2448ab0d933fe8c3a4ffee53c7/si0038.svg si0038 si0038.svg svg 1487 ALTIMG 1-s2.0-S0926860X25004764-si0039.svg https://s3-eu-west-1.amazonaws.com/prod-ucs-content-store-eu-west/content/pii:S0926860X25004764/image/svg+xml/cd12cc30fd111c73efbe58be3548369d/si0039.svg si0039 si0039.svg svg 1487 ALTIMG 1-s2.0-S0926860X25004764-si0040.svg https://s3-eu-west-1.amazonaws.com/prod-ucs-content-store-eu-west/content/pii:S0926860X25004764/image/svg+xml/df2512ffb67bc056dac638914cc616e9/si0040.svg si0040 si0040.svg svg 1292 ALTIMG 1-s2.0-S0926860X25004764-si0041.svg https://s3-eu-west-1.amazonaws.com/prod-ucs-content-store-eu-west/content/pii:S0926860X25004764/image/svg+xml/7d962f2448ab0d933fe8c3a4ffee53c7/si0041.svg si0041 si0041.svg svg 1487 ALTIMG 1-s2.0-S0926860X25004764-si0042.svg https://s3-eu-west-1.amazonaws.com/prod-ucs-content-store-eu-west/content/pii:S0926860X25004764/image/svg+xml/cd12cc30fd111c73efbe58be3548369d/si0042.svg si0042 si0042.svg svg 1487 ALTIMG 1-s2.0-S0926860X25004764-si0043.svg https://s3-eu-west-1.amazonaws.com/prod-ucs-content-store-eu-west/content/pii:S0926860X25004764/image/svg+xml/df2512ffb67bc056dac638914cc616e9/si0043.svg si0043 si0043.svg svg 1292 ALTIMG 1-s2.0-S0926860X25004764-si0044.svg https://s3-eu-west-1.amazonaws.com/prod-ucs-content-store-eu-west/content/pii:S0926860X25004764/image/svg+xml/ecb0d846c060ffaeebf83f344cf6c9b3/si0044.svg si0044 si0044.svg svg 1799 ALTIMG 1-s2.0-S0926860X25004764-si0045.svg https://s3-eu-west-1.amazonaws.com/prod-ucs-content-store-eu-west/content/pii:S0926860X25004764/image/svg+xml/060b54b108442d87382cf0b8ea04f6c8/si0045.svg si0045 si0045.svg svg 2650 ALTIMG 1-s2.0-S0926860X25004764-si0046.svg https://s3-eu-west-1.amazonaws.com/prod-ucs-content-store-eu-west/content/pii:S0926860X25004764/image/svg+xml/9a48259319c79e06f217c2eaa28021d7/si0046.svg si0046 si0046.svg svg 4429 ALTIMG 1-s2.0-S0926860X25004764-si0047.svg https://s3-eu-west-1.amazonaws.com/prod-ucs-content-store-eu-west/content/pii:S0926860X25004764/image/svg+xml/a12f2ffdd5f5129ea1b12d8b4c83bbc8/si0047.svg si0047 si0047.svg svg 4433 ALTIMG 1-s2.0-S0926860X25004764-si0048.svg https://s3-eu-west-1.amazonaws.com/prod-ucs-content-store-eu-west/content/pii:S0926860X25004764/image/svg+xml/c104ed72828d7d19f5206441cc15a546/si0048.svg si0048 si0048.svg svg 1146 ALTIMG 1-s2.0-S0926860X25004764-si0049.svg https://s3-eu-west-1.amazonaws.com/prod-ucs-content-store-eu-west/content/pii:S0926860X25004764/image/svg+xml/0afdf22b8b76422dbe64d33db79416a3/si0049.svg si0049 si0049.svg svg 1020 ALTIMG 1-s2.0-S0926860X25004764-si0050.svg https://s3-eu-west-1.amazonaws.com/prod-ucs-content-store-eu-west/content/pii:S0926860X25004764/image/svg+xml/55b36603a97084b3c8d0b04da980e651/si0050.svg si0050 si0050.svg svg 972 ALTIMG 1-s2.0-S0926860X25004764-si0051.svg https://s3-eu-west-1.amazonaws.com/prod-ucs-content-store-eu-west/content/pii:S0926860X25004764/image/svg+xml/73c7b1111e9a34596d6a128e0d7c5181/si0051.svg si0051 si0051.svg svg 1401 ALTIMG APCATA 120574 120574 S0926-860X(25)00476-4 10.1016/j.apcata.2025.120574 Elsevier B.V. Fig. 1 Effect of the catalyst:feedstock (CF) ratio on the polymer weight percent and derivative TG curves for PP with HZSM-5. Fig. 1 Fig. 2 Effect of the catalyst:feedstock (CF) ratio on the polymer weight percent and derivative TG curves for PET with HZSM-5. Fig. 2 Fig. 3 Additive and actual derivative polymer weight percent curves for the co-pyrolysis of PP and PET (1:1) without catalyst (NC) and with catalyst for a catalyst:feedstock (CF) ratio of 1. Fig. 3 Fig. 4 Polymer weight percent (a) and derivative weight percent (b) plots for pyrolysis of PP with fresh and used HZSM-5 catalyst (2:1 catalyst:feedstock ratio) and without catalyst. Fig. 4 Fig. 5 Derivative weight percent curves for the pyrolysis of PP and PET at varying PP:PET weight ratios with a) fresh HZSM-5 catalyst and with b) Used Once HZSM-5 catalyst. Fig. 5 Fig. 6 Temperature programmed desorption of pyridine and collidine from fresh HZSM-5 catalyst (squares), HZSM-5 coked from PP (circles), and HZSM-5 coked from a 1:1 combination of PP and PET (triangles). Error bars represent the standard error observed for a given point in the TPD curve. Fig. 6 Fig. 7 N2 physisorption plots for fresh HZSM-5 catalyst (black circles), HZSM-5 catalyst coked by PP (red squares), and HZSM-5 catalyst coked by a 1:1 mixture of PP and PET (blue triangles). Fig. 7 Fig. 8 Activation energies determined via the Flynn-Wall-Ozawa (FWO) method for the non-catalytic and catalytic pyrolysis of PP and PET with HZSM-5 at a 1:1 catalyst:feedstock ratio. Fig. 8 Fig. 9 Experimental and modelling results for the catalytic pyrolysis of PET at various catalyst:feedstock ratios (a,b), for the catalytic pyrolysis of PP with HZSM-5 for subsequent catalyst uses at a 2:1 catalyst:feedstock ratio (c,d), and for the catalytic co-pyrolysis of PP and PET with Used Once catalyst at various PP:PET ratios (e,f). Fig. 9 Table 1 Table of optimized kinetic parameters, and the obtained fit percents for experimental data. Table 1 Non-catalytic parameters Optimizedvalue Catalytic parameters Optimizedvalue Deactivation parameters Optimized value ANC,P 6.066E12 AC,P1 1.166E6 dP1,P 0.498 ENC,P 209.5 EC,P1 74.40 dP2,P 0.331 nNC,P 0.875 nC,P1_P 1.004 dP1,T 1.089 ANC,T 3.460E11 nC,P1_C 2.337 dP2,T 0.007 ENC,T 187.1 a 1.370 dT1,T 0.221 nNC,T 0.824 AC,P2 2.663E5 dT2,T 0.209 δ 0.874 EC,P2 82.76 dT1,P 0.001 nC,P2 1.368 dT2,P 0.391 Avg Fit%wt% 97.74 % AC,T1 1.478E11 C f , γ 0.780 Min Fit%wt% 94.92 % EC,T1 155.7 f γ 11.99 nC,T1_T 1.843 n , γ 0.732 Avg Fit%DTG 94.48 % nC,T1_C 0.674 C f , ε 0.408 Min Fit%DTG 87.75 % b 5.045 f ε 0.826 AC,T2 8.015E10 n , ε 1.987 EC,T2 173.0 nC,T2 2.469 Kinetic modelling and measurement of catalyst deactivation for the catalytic co-pyrolysis of PP and PET with HZSM-5 Sean Timothy Okonsky Writing – review & editing Writing – original draft Visualization Validation Software Methodology Investigation Formal analysis Data curation Conceptualization a J.V. Jayarama Krishna Writing – review & editing Methodology Investigation Formal analysis b 1 Do Hyun Lee Data curation b Hilal Ezgi Toraman Writing – review & editing Supervision Resources Project administration Funding acquisition Conceptualization a b c ⁎ a Department of Chemical Engineering, Pennsylvania State University, University Park, PA 16801, USA Department of Chemical Engineering Pennsylvania State University University Park PA 16801 USA Department of Chemical Engineering, Pennsylvania State University, University Park, PA – 16801 USA b Department of Energy and Mineral Engineering, Pennsylvania State University, University Park, PA 16801, USA Department of Energy and Mineral Engineering Pennsylvania State University University Park PA 16801 USA Department of Energy and Mineral Engineering, Pennsylvania State University, University Park, PA – 16801 USA c Institute of Energy and the Environment, Pennsylvania State University, University Park, PA 16801, USA Institute of Energy and the Environment Pennsylvania State University University Park PA 16801 USA Institute of Energy and the Environment, Pennsylvania State University, University Park, PA – 16801 USA ⁎ Corresponding author at: Department of Chemical Engineering, Pennsylvania State University, University Park, PA 16801, USA. Department of Chemical Engineering, Pennsylvania State University, University Park PA 16801 USA 1 Current affiliation: Department of Chemical Engineering, Indian Institute of Technology Dharwad, Dharwad, Karnataka 580011, India. The catalytic pyrolysis and co-pyrolysis of PP and PET with HZSM-5 zeolite catalyst was conducted for various catalyst to feedstock (CF) ratios, PP to PET ratios, and heating rates using a thermogravimetric analyzer (TGA). The Flynn-Wall-Ozawa (FWO) isoconversional approach was used to determine apparent activation energies for the non-catalytic and catalytic pyrolysis of PP and PET. An nth-order reaction scheme was used to model the pyrolysis at various operating conditions through the optimization of the associated kinetic parameters. Additional TGA experiments were conducted with used catalysts to gain insight into catalyst deactivation, and it was found that the inclusion of PET led to more severe deactivation. Collidine temperature programmed desorption (TPD) indicated the loss of external acid sites for catalysts coked by PET pyrolysis, explaining the severe deactivation. Catalyst deactivation was incorporated into the kinetic modelling approach, so that degradation profiles could be predicted for experiments with the used catalysts. Graphical Abstract Keywords Catalytic pyrolysis Kinetic modelling Deactivation Polypropylene PET Data availability The authors do not have permission to share data. 1 Introduction The treatment and disposal of plastic waste is one of the largest environmental issues facing the world today. In 2015 it was estimated that 302 million metric tons (Mt) of plastic waste was generated globally, and only 9 % of this waste was recycled [1]. Polypropylene (PP) had the 2nd highest amount of waste generated (55 Mt), and polyethylene terephthalate (PET) had the 5th highest amount of waste generated (32 Mt) of the various polymer types [1]. Pyrolysis is a promising method for the treatment of plastic waste, as it can convert waste into valuable chemicals and fuel through heating in an inert environment. One advantage of pyrolysis is that it can treat mixed plastics with various polymer types, which is a major shortcoming of mechanical recycling [2]. While the ability of processing mixed plastic waste can help with sorting procedures, it also allows for the processing of inherently mixed plastic wastes, such as multilayer packaging. Multilayer packaging is known to have high percentages of polyolefins, such as PP, which act as a moisture barrier and provide mechanical stability, as well as high percentages of PET which acts as an oxygen barrier [3]. Polyolefins are ideal pyrolysis feedstocks, as their high H:C ratio and absence of heteroatoms can lead to high yields of hydrocarbon rich pyrolysis oil, which can be treated in refineries alongside crude oil [4,5]. The pyrolysis of PET is however not as ideal, as its high oxygen content and low H:C ratio can lead to the formation of waxy oxygenated compounds such as benzoic acid which can clog reactor lines, and reduce the quality of pyrolysis oil [6]. The pyrolysis of PET can become more favorable when a zeolite catalyst is included in the process, as the catalyst aids in deoxygenation reactions which decrease the yield of benzoic acid, and increase the yield of benzene [7,8]. Zeolite catalysts can also aid in the pyrolysis of polyolefins by cracking down larger hydrocarbons into valuable chemicals such as ethylene and propylene [9]. It has been shown that utilizing modified HZSM-5 catalysts for the catalytic pyrolysis of polyolefins led to a reduced energy demand and carbon footprint for the production of high value chemicals in comparison with non-catalytic pyrolysis combined with subsequent steam reforming [10]. For both polymers, zeolites can help to decrease the temperature needed for the degradation of plastic waste, thus reducing the energy requirement for the process [11,12]. Thermogravimetric analysis (TGA) can be used to determine the weight loss profile of polymers during the pyrolysis process as a function of temperature and time. TGA experiments can demonstrate the extent to which a zeolite catalyst can decrease the temperature needed for polymer decomposition. Through running TGA experiments at various heating rates one can apply isoconversional methods to obtain an apparent activation energy for the process [13,14]. Through use of the Kissinger isoconversional method, it was shown that the addition of various zeolites at a 7:1 catalyst:feedstock (CF) ratio were able to decrease the apparent activation energy for PP pyrolysis from 114 kJ/mol to 51–98 kJ/mol [15]. The apparent activation energy for catalytic pyrolysis determined via isoconversional approach is known to be dependent on the CF ratio which is used [16,17]. Certain kinetic modelling approaches have been created for catalytic pyrolysis which allows for one set of kinetic parameters to model the degradation of plastic waste independent of the CF ratio or heating rate which is used [18,19]. This modelling approach was used in our previous work for the pyrolysis and co-pyrolysis of LDPE and PET with HZSM-5, H-Beta, and HY zeolite catalysts [12]. While the model was able to predict the degradation behavior based on which LDPE:PET ratio was used, only one CF ratio (1:1) and one heating rate (10 °C min−1) were used for the modelling. In this work it is our aim to test the catalyst which resulted in the lowest solid residual from our previous study (HZSM-5) for the pyrolysis of PP and PET at various CF ratios, heating rates, and PP:PET ratios, so that a robust set of kinetic parameters can be obtained to model the catalytic pyrolysis of PP and PET for various operating conditions. During the catalytic pyrolysis of plastic waste, a high percentage of coke can form on the catalyst, especially for PET. The formation of coke can hinder active sites as well as block zeolite pores, leading to an overall decrease in catalyst activity, i.e. catalyst deactivation [20]. For the continuous pyrolysis of polyolefins with zeolite catalysts, it has been shown that as the catalyst becomes deactivated by coking, the yield of target products such as C2-C4 olefins begin to decrease [21]. Ammonia temperature programmed desorption has shown that coked catalysts from polyolefin pyrolysis have a decreased acidity [22]. Catalyst deactivation for polyolefin pyrolysis has been studied with TGA by running subsequent experiments over the same catalyst, and observing the shift in degradation profiles which occur for the used catalysts [23,24]. While catalyst deactivation phenomenon has been studied in a variety of ways for polyolefin pyrolysis, to the author’s knowledge no studies have been conducted investigating the impact of PET on catalyst deactivation. Thus, in this study pyrolysis experiments were conducted with the used catalysts coked by both PP and PET for insight on how coke from the two polymers affected the deactivation. It has previously been shown that catalyst deactivation can be predicted via kinetic modelling for polyolefins [25]. In this study this deactivation modelling was expanded upon, to predict deactivation which can occur from the inclusion of PET. In addition, the adsorption and subsequent temperature programmed desorption of pyridine and collidine were conducted for the fresh and used catalysts, in order to determine the effect of coking on the zeolite acidity. Nitrogen physisorption was used as an additional technique to characterize the fresh and used catalysts, to gain insight on how coke from the two polymers affect the surface properties of the catalyst. 2 Materials and methods 2.1 Materials Isotactic polypropylene pellets were obtained from Sigma-Aldrich which had a reported Mw of ∼250,000 mol−1 and a melt flow rate of 0.9 ml−1 at 25 °C. The pellets were milled using a SPEX SamplePrep Freezer/Mill. The resulting polymer powder was then sieved in a sieve shaker and a particle size less than 125 µm and greater than 53 µm was obtained to be used for the experiments. Polyethylene terephthalate powder was obtained from Goodfellow. The powder was specified to be semi crystalline copolymer with > 40 % crystallinity, an inherent viscosity of 0.80 dl g−1, and 1 ppm of acetaldehyde as an additive. The PET powder was also sieved to a particle size of less than 125 µm and greater than 53 µm prior to experimental use. HZSM-5 zeolite catalyst with an SiO2/Al2O3 ratio of 23 (CBV2314) was purchased from Zeolyst International. For calcination, 0.5 mg of the catalyst was loaded into an alumina crucible. The crucible was placed in a quartz tube furnace, with 100 mL min−1 of air flow. The tube furnace was heated at 3 °C min−1 to 550 °C, and held at 550 °C for 5 h, before returning to room temperature. After cooling, the calcined HZSM-5 was transferred to a glovebox to be stored before experimental use. 2.2 Catalytic pyrolysis experiments via thermogravimetric analysis A TA instruments SDT Q600 DSC-TGA thermal analyzer was used to determine the degradation profiles of PP, PET, and their mixtures for various CF ratios. Nitrogen (Linde, 99.999 %) was used as the carrier gas, with a flow rate of 100 mL min−1. Heating rates were varied from 5 to 20 °C min−1. Mixtures of the two polymers and HZSM-5 were made in glass vials prior to catalytic pyrolysis experiments. The weight ratio of the polymers and catalysts added to the vial depended on the CF ratio and PP:PET ratio set for the given experiment. Once added to the vial, the polymer and catalyst were physically mixed with a spatula for a period of 5 min to obtain a homogenous mixture. A given weight of the mixture was added to the TGA crucible, so that 4 mg of polymer would be pyrolyzed. For example, for an experiment with a CF ratio of 2, 12 mg of the polymer-catalyst mixture was added to the TGA crucible. The polymer weight percent and the derivative polymer weight percent were calculated by subtracting a catalyst blank experiment from the pyrolysis experiment using Eqn. S1 – S3, as is explained in the supporting information. All catalytic pyrolysis experiments were repeated at least twice to ensure adequate repeatability. The standard deviation in the solid residual remaining for a given experimental condition varied between 0.2 % and 4.8 %, and on average was 1.2 %. Repeated runs for a given experimental condition are plotted in Fig. S4. After certain pyrolysis experiments, the used catalyst was collected so that it could be used in a subsequent run to gain insight on catalyst deactivation. A larger CF ratio of 2 was used for these experiments, in order to aid in the collection of used catalyst. A minimum of three experiments were conducted for collection of the used catalyst. One portion of the used catalyst was used to produce a new mixture with the polymers to be used for a subsequent pyrolysis experiment, while the other portion was saved for the blank catalyst experiment. In addition to being used for subsequent pyrolysis experiments, used catalysts were also collected for acidity determination as outlined in Section 2.3. 2.3 Pyridine and collidine temperature programmed desorption for determination of catalyst acidity Pyridine (99.8 %, Sigma-Aldrich) and 2,4,6-Trimethylpyridine (99 %, Sigma-Aldrich), also referred to as collidine, were used as probe molecules for insight on the acidity of the fresh and used HZSM-5 catalyst. For adsorption of the probe molecules a saturator was used in combination with a tube furnace. A diagram of the adsorption furnace can be seen in Fig. S1. For the adsorption process 20–30 mg of catalyst was placed in an alumina crucible which was then placed in a quartz tube furnace. 200 mL min−1 of nitrogen (99.999 %, Linde) flowed through the furnace as the temperature was heated to 207 °C and held for 30 min in order to remove any moisture from the catalyst. Then the nitrogen flow was re-directed to flow through a glass saturator filled with the probe molecule of choice before flowing through the tube furnace. The saturator was held in an ice water thermos. Flow was directed through the saturator for a period of 2 h, while the tube furnace was kept at 207 °C, before the flow was redirected to give pure nitrogen flow through the furnace. A temperature of 207 °C was chosen as it is a proven temperature which can be used for the adsorption of pyridine to acid sites in HZSM-5 [26]. The furnace was kept at 207 °C under pure nitrogen flow for 30 min in order to remove any physisorbed probe molecules. The furnace was then cooled to room temperature. Once the furnace was cooled, the pyridine or collidine adsorbed catalyst was collected and then subjected to a temperature programmed desorption (TPD) method in the TGA. For the TPD experiment, ∼10 mg of catalyst with adsorbed probe molecule was added to the TGA crucible. 100 mL min−1 of nitrogen flow was used. The furnace was heated to 200 °C at a ramp rate of 10 °C min−1 and held for 30 min in order to remove moisture and any remaining physisorbed probe molecules. It is known that physisorbed collidine is removed from zeolite catalysts below 200 °C [27]. After the hold at 200 °C, the temperature was ramped to 1000 °C at a ramp rate of 10 °C min−1 and held for 15 min. The loss of weight during the temperature ramp to 1000 °C and its subsequent hold was used to determine the number of adsorbed molecules, and thus the catalyst acidity. An experiment subjecting either a fresh or used HZSM-5 catalyst without any adsorbed probe molecule, to the same TPD method was needed in order to subtract out weight change which was observed during the TPD run which was not due to probe molecule desorption. Equations for the probe molecule TPD (Eqn. S4-S8), as well as associated figures (Fig. S2 – S3) can be found in the supporting information. Pyridine and collidine TPD experiments were conducted at least twice to ensure experimental repeatability. 2.4 Nitrogen physisorption for surface analysis of fresh and used catalysts To conduct nitrogen physisorption experiments of the fresh and used catalysts, a 3Flex surface analysis instrument (Micromeritics) was used. 25 mg of catalyst was added to an analysis tube, and then subjected to a degas procedure. The fresh catalyst was degassed at 300°C under vacuum for 10 h, where the used catalysts were degassed at 200 °C for 5 h to limit the extent of coke removal from the catalyst. After the degas procedure, the catalysts were reweighed, and this weight was used to calculate the various surface properties. Analysis was conducted at 77 K and partial pressure values from 1E-5–0.99 were recorded. Nine partial pressure values in the range of 0.001–0.01 were used to compute the BET surface area, and 8 partial pressure values in the range of 0.08–0.3, resulting in a thickness range of 0.35–0.5 nm, were used with the Harkins-Jura equation for t-plot analysis to calculate the micropore volume, micropore area, and external surface area. The mesopore volume was calculated by summing the total volume of pores with pore widths between 2 and 50 nm determined by the BJH pore distribution from the adsorption isotherm. 2.5 Flynn-Wall-Ozawa method for isoconversional activation energy determination The Flynn-Wall-Ozawa (FWO) method was used to determine activation energy values for the individual pyrolysis of PP and PET both without catalyst, and with catalyst at a CF ratio of 1. Pyrolysis experiments were run at three different heating rates of 5 °C min−1, 10 °C min−1, and 20 °C min−1. The extent of conversion could be calculated for the experiments by referencing the obtained polymer weight% curves: (1) α i = 100 % − Polymer Weight % i 100 % − Polymer Weight % T = 800 ° C where α i is the conversion at some time = i, and Polymer Weight % T = 800 ° C is the polymer weight percent left at the end of the pyrolysis process. In the isoconversional approach, the reaction rate can be expressed as: (2) d α dT = A β exp − E RT f ( α ) where A is the pre-exponential factor [min−1], β is the heating rate [K min−1], E is the activation energy [kJ mol−1], R is the universal gas constant, and f ( α ) is the reaction model. For this work, a 1st order reaction model was assumed, which gives f α = 1 − α and a corresponding integral of g α = − ln ( 1 − α ) . The FWO method uses Doyle’s approximation to integrate the reaction rate equation, simplifying it to be: (3) ln β = ln AE Rg ( α ) − 5.331 − 1.052 E RT Plotting ln β as a function of 1 T for the various heating rates at constant conversion values gives a straight line whose slope and intercept can be used to calculate the activation energy and pre-exponential factor for the given conversion value. The average activation energy and pre-exponential factors obtained from the FWO method for the non-catalytic and catalytic pyrolysis were then used as initial guesses for the nth-order modelling approach. 2.6 Least-squares nth-order lumped kinetic modelling Lumped model fitting approach is a technique which can be used to model the catalytic degradation of plastic waste at various CF ratios and heating rates [18,19]. In our previous work, the lumped model fitting approach was modified to allow for the catalytic co-pyrolysis of LDPE and PET, providing individual reaction schemes for both of the polymers [12]. The same scheme can be used for this work, substituting PP in for LDPE: (R1) PP G 1 → k NC , P (R2) PP + aC 1 + a → k C , P 1 PPC γ G 2 → k C , P 2 + 1 − γ Coke P + a C coked + γ aC (R3) PET δ G 3 → k NC , P + 1 − δ Char (R4) PET + bC 1 + b → k C , T 1 PETC ε G 4 → k C , T 2 + 1 − ε Coke T + b C coked + b ε C The stoichiometric coefficients of a and b represent the grams of catalyst per gram of PP and PET necessary to obtain the complexes of PPC and PETC respectively, where PPC represents PP bound to catalyst sites, and PETC represents PET bound to catalyst sites. γ and ε represent the fraction of catalyst bound polymer which is converted to gaseous species G2 and G4 respectively. The other fractions, 1 − γ and 1 − ε represent the fraction of bound polymer which is converted to coke. γ and ε are a function of how much coke is present on the catalyst being used, and is explained further in Eqs. (9) and (10). δ is the fraction of PET which is converted to gaseous species G3 during the non-catalytic pyrolysis of PET. The rate constant k used for each step in the proposed scheme is expressed by the Arrhenius law: (4) k cat , pol , # = A cat , pol , # × exp ( − E cat , pol , # RT ) where “cat” is labeled as NC for the non-catalytic reaction, and is labeled as C for the catalytic reactions, pol is labeled as P for the PP reaction pathways, and as T for the PET pathways, and # is labeled as 1 for the first step in the catalytic pathway, labeled as 2 for the second step, and is not needed for the non-catalytic pathway. A is the pre-exponential factor [ s − 1 ] , E is the apparent activation energy [ kJ mol − 1 ] , R is the universal gas constant [ 8.314 × 10 − 3 kJ mol − 1 K − 1 ] , and T is the absolute temperature [ K ] . The lumped model fitting approach has also been shown to model how using HZSM-5 for subsequent runs results in catalyst deactivation, leading to polymer degradation at higher temperatures [25]. In order to capture catalyst deactivation phenomena in the modelling process, a new term for catalyst activity, denoted as ϕ, is introduced in which: (5) ϕ pol # = exp [ − d pol # , P × % Coke P + d pol # , T × % Coke T ] where “pol” denotes the polymer in which the deactivation term is being applied to, # denotes the step in the catalytic pathway (either 1 or 2), d pol# , P is a constant which determines the magnitude of deactivation which occurs from coke formed from PP, and d pol# , T is a constant which determines the magnitude of deactivation which occurs from coke formed from PET. %CokeP is the mass percentage of coke from PP on the used catalyst and %CokeT is the mass percentage of coke from PET on the used catalyst. The %Coke terms are defined as follows: (6) % Coke P = 100 [ Coke P ] [ C ] t = 0 + Coke P + [ Coke T ] (7) % Coke T = 100 [ Coke T ] [ C ] t = 0 + Coke P + [ Coke T ] where [ Coke P ] represents the mass fraction of coke formed from PP, [ Coke T ] represents the mass fraction of coke formed from PET, and [ C ] t = 0 represents the mass fraction of catalyst which was used for the initial pyrolysis experiment. A detailed description of the mass balances used to calculate [ Coke P ] , [ Coke T ] , and [ C ] t = 0 can be found in the supporting information. It has been previously determined that the coke yield for catalytic pyrolysis experiments decreases with increasing levels of coke on the catalyst [25]. Thus, the stoichiometric coefficients of γ and ε should be dependent on the percentage of coke which is on the catalyst at the beginning of a given experiment, where the total coke percentage, % Coke total , is defined as: (8) % Coke total = % Coke P + % Coke T The dependence of the stoichiometric coefficients on the total coke percentage is defined to be as follows: (9) γ % Coke total = 1 − C f , γ C f , γ + f γ × ( % Coke total / 100 ) n γ (10) ε % Coke total = 1 − C f , ε C f , ε + f ε × ( % Coke total / 100 ) n ε where C f , f , and n are constants, similar to those used by previous works utilizing kinetic modelling to predict catalyst deactivation phenomenon for the catalytic pyrolysis of polyolefins [25]. A list of differential equations (Eqn. S9 – S21) as well as other relevant equations (Eqn. S22 – S30) which are used to model the polymer degradation can be found in the supporting information. The differential equations were solved for using Euler’s method in Microsoft Excel. The Fit% for the polymer weight% curves and for the derivative polymer weight% (DTG) curves were calculated in the temperature range of 150–600 °C using equations S31 – S38. The sum of the Fit%wt% and Fit%DTG for all modelled experiments were used as the objective function (Eqn. S39). The solver tool in Excel found model variables to optimize the fit for 28 different experimental conditions by maximizing the objective function. A list of the experiments included in the model optimization can be found in Table S1. 3 Results and discussion 3.1 Effect of operating conditions on catalytic pyrolysis The catalytic pyrolysis of PP was conducted at various CF ratios. The resulting polymer weight percent and derivative weight percent curves can be seen in Fig. 1. For non-catalytic pyrolysis the maximum degradation temperature (Tmax) is seen to be 461 °C. The addition of catalyst at a CF ratio of 0.5 drastically decreases Tmax to 351 °C. Increasing the CF ratio to 1 and 2 further decreased Tmax to 296 °C and 280 °C respectively. The smaller shift in Tmax between CF ratios of 1 and 2 indicates a saturation behavior, in which adding more catalyst does not further decrease the degradation temperature. Similar saturation behaviors have been observed for the catalytic pyrolysis of polyolefins at various CF ratios [18,28]. While increasing the CF ratio has the benefit of lower degradation temperatures, it also leads to a higher yield of solid residual left in the TGA crucible, which can be interpreted as catalytic coke. A zoomed in portion of the polymer weight percent curve is shown in Fig. 1 to demonstrate this difference. Higher CF ratios used for the catalytic pyrolysis of polyolefins are known to increase the extent of secondary reactions, where light olefins react to form aromatic hydrocarbons, which can serve as coke precursors [9], thus explaining the trend which is seen. The resulting TGA curves for the pyrolysis of PET at various CF ratios can be seen in Fig. 2. Dissimilar to PP, the addition of catalyst does little to decrease the degradation temperature for PET. The Tmax for PET only shifts slightly from 443 °C to 430 °C as catalyst is added at a CF ratio of 2. This difference in Tmax of 13 °C is significantly less than the Tmax difference of 173 °C that was observed for PP for this CF ratio. The catalytic degradation for PET is seen as a shoulder to the main degradation peak. As the CF ratio is increased, the size of the shoulder similarly increases, indicating that a higher percentage of PET is degrading via the catalyst. This higher percentage of catalytic degradation also corresponds with a higher percentage of solid residual left in the TGA crucible after the run. As the CF ratio increases from 0 to 0.5–1 to 2, the solid residual increases from 11.5 wt% to 14.0–20.9–24.2 wt% respectively. While PET forms solid residual in the absence of catalyst in the form of char, the increased CF ratio leads to an increase in solid residual which exists in the form of coke on the catalyst. For the co-pyrolysis of two polymers, an additive TGA curve can be calculated by referencing the TGA curves resulting from the pyrolysis of two polymers individually [12,29]. The additive curve is a prediction of the TGA curve that would result if no interactions between the polymers were to occur. The additive TGA curves for the co-pyrolysis of PP and PET at a 1:1 PP:PET ratio is plotted in Fig. 3, alongside the co-pyrolysis curves which were experimentally determined, for both non-catalytic pyrolysis and catalytic pyrolysis with a CF ratio of 1. The actual curve for the non-catalytic case closely mirrors the additive curve, indicating that for non-catalytic pyrolysis, there are not interactions between the two polymers affecting the degradation. For catalytic pyrolysis, some slight differences can be seen between the additive and actual TGA curves. For catalytic pyrolysis, two peaks appear which are indicative of PP degradation at lower temperatures, and PET degradation at higher temperatures. The maximum rate of degradation for PP is 15 % less than was expected from the additive curve, which could show that the presence of PET is slightly delaying the degradation of PP. Similar results were seen for the co-pyrolysis of LDPE and PET with HZSM-5, in that the maximum rate of LDPE degradation decreased 40 % from expected [12]. 3.2 Effect of catalyst deactivation on subsequent pyrolysis experiments The catalytic pyrolysis of PP with HZSM-5 at a CF ratio of 2 was conducted in order to obtain used catalyst, referred to as “Used Once” catalyst. The Used Once catalyst was then mixed with fresh PP powder again at a CF ratio of 2 and was subjected to the same pyrolysis experiment. The procedure was repeated once more with the Used Twice catalyst. The polymer weight percent curves and the derivative weight percent curves for these experiments, alongside the non-catalytic curves are plotted in Fig. 4. It can be seen that as the PP is used for consecutive runs with the same catalyst, that the catalyst begins to deactivate slightly, as the Tmax shifts from 280 °C, to 313 °C, and then to 340 °C. For all three uses of the catalyst, the degradation of PP is completed by 400 °C. Another interesting phenomenon that occurs is that as the catalyst is continually used, the solid residual begins to approach closer and closer to zero. Similar trends were also observed for the catalytic pyrolysis of LDPE with HZSM-5 [25]. In order to investigate the impact of PET on the catalyst deactivation, the co-pyrolysis of PP and PET was conducted with HZSM-5 at a CF ratio of 2, for various PP:PET ratios. In Fig. 5a, the resulting derivative weight percent curves for the catalytic co-pyrolysis of PP and PET at these various ratios is seen. It can be observed that regardless of the percentage of PET which is used, the Tmax value, indicative of PP degradation, is always centered at 282 °C. For higher ratios of PET, the secondary degradation peak centered at 420 °C begins to increase in intensity. For the various PP:PET ratios tested, the used catalyst was collected, and then used for catalytic pyrolysis at the same PP:PET ratio that was used for the fresh catalyst. The resulting derivative weight percent curves for the Used Once catalyst can be seen in Fig. 5b. It is seen that as higher percentages of PET are used in co-pyrolysis, the Tmax value for the used catalyst run shifts to higher temperatures. By adding 10 % PET, the Tmax value shifts from 313 °C to 345 °C. When 25 % PET is added, the Tmax shifts drastically to 463 °C, indicating that a high amount of PP is beginning to degrade non-catalytically, due to the deactivated catalyst. However, lower temperature degradation can also be observed in the range of 300 – 400 °C, indicating that some catalytic degradation of PP is still occurring. For the case of 50 % PET, no degradation is occurring below 400 °C, and the curve closely mirrors what is observed for the non-catalytic pyrolysis of PP and PET at a 1:1 PP:PET ratio (Fig. S5). The shift back to the non-catalytic case indicates that at this level of PET, the catalyst is considered to be completely deactivated. 3.3 Characterization of fresh and used catalysts The total acidity and the external acidity of the fresh HZSM-5 catalyst, and the HZSM-5 coked by PP, and by PP and PET at a 1:1 PP:PET ratio, was determined via the temperature programmed desorption of pyridine and collidine. The resulting TPD curves for the three catalysts can be seen in Fig. 6, with the acidity results summarized in Table S2. The fresh HZSM-5 catalyst was observed to have 1.13 mmol of pyridine adsorbed per gram of catalyst. The external acidity of the fresh catalyst was shown to be 0.059 mmol of collidine per gram of catalyst. The three methyl groups on collidine cause it to be unable to adsorb to acid sites inside of the zeolite micropores, and only to acid sites on the external surface of the zeolite. The collidine accessibility factor can be determined by dividing the external acidity by the total acidity, and for the fresh catalyst this was determined to be 5.2 %. Untreated zeolites are known to have low collidine accessibility factors in the range of 4–9 %, as most of the acid sites are found within the pores [30]. For the catalyst coked by PP, the total acidity of the catalyst decreased by 18 % to a level of 0.94 mmol pyridine per gram of catalyst. When the catalyst was coked by a 1:1 mixture of PP and PET, the acidity decreased further by 35 % to a level of 0.70 mmol pyridine per gram of catalyst. The external acidity decreased by 61 % to 0.023 mmol Coll/gcat for the catalyst coked by PP and decreased by 92 % for the catalyst coked by a 1:1 mixture of PP and PET. The collidine accessibility factor, which is defined as the external acidity divided by the total acidity, dropped to 2.5 % for catalyst coked by PP, and dropped further to 0.7 % for the catalyst coked by PP and PET. This low collidine accessibility factor observed for the catalyst coked by PP and PET, indicates that coke from PET is preferentially forming on the external acid sites of the catalyst. Surface analysis results from nitrogen physisorption experiments also show the preferential formation of coke from PET on external acid sites. Surface analysis plots for the same fresh and used catalysts studied with pyridine and collidine TPD are shown in Fig. 7. The reported surface areas and pore volumes calculated from the experiments are listed in Table S2. For catalyst that is coked by PP, the micropore area was observed to drop from 310 m2/g to 288 m2/g (-22 m2/g) and the external surface area was observed to drop from 105 m2/g to 86 m2/g (-19 m2/g), indicating a more substantial drop in micropore area. For the catalyst coked by PP and PET, the micropore area dropped to 260 m2/g (-50 m2/g) and the external surface area dropped to 45 m2/g (-60 m2/g), indicating a more substantial drop in the external surface area. This result is mirrored for the change in micropore and mesopore volume. Micropore volume decreases by 0.014 m3/g and mesopore volume decreased by 0.002 m3/g for PP/cbv2314, where for PP+PET/cbv2314, micropore volume decreases by 0.026 m3/g and mesopore volume decreases by 0.030 m3/g. The surface analysis results indicate that for both PP and PET coke is forming on both internal acid sites inside micropore and on external acid sites on the surface and in mesopores, but there is a preference for coke for PP to form more internally, and for coke from PET to form more externally. The limited amount of external acid sites on the catalyst coked by PP and PET can help to explain the severe deactivation which was observed for this catalyst in Fig. 5b. External acid sites have been shown to be necessary for the low temperature degradation of branched polymers such as LLDPE [31]. By poisoning the external acid sites of HZSM-5 with collidine, it was shown that the catalytic degradation of polyethylene does not occur at low temperatures in which degradation does occur for the non-poisoned catalyst [32]. Our results further confirm the necessity for external acid sites to facilitate the low temperature degradation of PP and show that PET can lead to coking which prevents access to these important catalytic sites. 3.4 Isoconversional approach for activation energy determination The non-catalytic pyrolysis and the catalytic pyrolysis (CF = 1) of PP and PET were conducted at heating rates of 5, 10, and 20 °C min−1. The resulting polymer weight percent curves, as well as the associated conversion curves are displayed in Fig. S6. The FWO method was used to determine the apparent activation energy for each of the pyrolysis experiments. In the FWO approach, the apparent activation energy is determined for each conversion level. The associated plots for whose slope are used for calculation of the activation energies are displayed in Fig. S7. The resulting activation energies, pre-exponential factors, and r-squared values for these plots are listed in Table S3 and Table S4. The activation energy determined for conversion values between 0.1 and 0.9 are plotted in Fig. 8. It can be seen that for the non-catalytic pyrolysis of PP, activation energies lie in the range of 190 kJ mol−1 to 216 kJ mol−1, leading to an average activation energy of 209 kJ mol−1. This activation energy falls well within the range of activation energies reported for the non-catalytic pyrolysis of PP [33]. For the catalytic pyrolysis of PP, the apparent activation energy starts at 102 kJ mol−1 for a conversion of 0.1 and decreases to 72 kJ mol−1 as the conversion increases to 0.9. This downward trend of activation energies in a similar range was also observed for the catalytic pyrolysis of PP with nanocrystalline HZSM-5 (CF =1), as the activation energy decreased from 97 kJ mol−1 to 75 kJ mol−1 as the conversion increased from 0.1 to 0.9 [34]. For the non-catalytic pyrolysis of PET, activation energies lie between 178 mol−1 and 197 kJ mol- 1. Similar results were observed by Perez et al. for the non-catalytic pyrolysis of PET, with activation energies between 186 and 199 kJ mol−1 observed [29]. For the catalytic pyrolysis of PET, the activation energy started at 173 kJ mol−1 but then increases to 209 kJ mol-1 as the conversion was increased from 0.1 to 0.9. It was observed in Fig. 2 the inability of HZSM-5 to decrease the Tmax for PET pyrolysis regardless of the CF ratio used, which leads to similar activation energies whether with or without catalyst. For low conversion values < 0.4, the activation energy is slightly decreased with the catalyst, but as the conversion increases, the activation energy becomes larger for the catalytic pyrolysis. This can be due to the formation of coke on the catalyst, which hinders the reaction. Dubdub et al. reported a lower activation energy of 143 kJ mol−1 for the catalytic pyrolysis of PET with H-Beta (CF = 0.25), however a similar Tmax (437 °C) was observed to the Tmax observed in our study (434 °C) for a 10 °C min−1 heating rate [35]. 3.5 Nth-order kinetic modelling results The resulting kinetic parameters which were found to optimize the fit for the 28 experimental conditions are shown in Table 1. The average fit% for the weight% curves was 97.7 % with a minimum fit% of 94.9 %. The fit% for the derivative weight% curves were found to be lower, with an average fit% of 94.5 % and a minimum value of 87.7 %. Fig. 9 shows selected experimental curves plotted with their modelling counterpart. Fig. 9a and b show the experimental and model curves for the catalytic pyrolysis of PET at various CF ratios. As was discussed in Section 3.1, as the CF ratio is increased, the amount of solid residual left from the pyrolysis experiment also increases. This same trend of larger solid residual for larger CF ratios was able to be observed in the model curves. This is due to larger CF ratios leading to a higher percentage of PET degrading via the catalytic pathway, compared to degrading via the non-catalytic pathway. Due to a higher value of δ (0.874) obtained from the optimization, in comparison with the value for ε obtained for PET catalytic pyrolysis (0.669), the non-catalytic pathway (R3) leads to a lower solid residual. Fig. S8 shows the temperature dependent species balance for PET catalytic pyrolysis which results from the model. As the CF ratio is increased, the ratio of volatiles formed from the catalytic pathway (G4) to volatiles formed from the non-catalytic pathway (G3), as well as the ratio of CokeT to Char, are increased, indicating a higher extent of catalytic degradation. Fig. 9c and d show the experimental and model curves for the catalytic pyrolysis of PP with a CF ratio of 2 for multiple catalytic runs. The model is able to accurately capture the upward shift in degradation temperature as the catalyst is used in its successive runs. This is due to the incorporation of the catalyst activity terms ( ϕ pol , # ) which were introduced in Eq. (5). For the fresh catalyst ϕP,1 and ϕP,2 are both equal to 1. For the used once catalyst, the values of ϕP,1 and ϕP,2 decreased to values of 0.214 and 0.493 respectively. For the used twice catalyst, the values of ϕP,1 and ϕP,2 decreased further to values of 0.118 and 0.375. The constants of dP1,P and dP2,P which give rise to the decreased catalyst activity were optimized to be 0.498 and 0.229 respectively, which were close in magnitude to the deactivation constant of 0.543 which was obtained by Marcilla et al. for the catalytic pyrolysis of LDPE with HZSM-5, while utilizing a single step kinetic modelling pathway [25]. In addition to predicting higher degradation temperatures as the catalyst is further used, the model is also able to predict a decrease in the formed solid residual. The solid residual was predicted to decrease from 6.11 wt% to 2.32 wt% and then to 1.95 wt% for the second and third runs, closely matching the experimental results. Fig. 9e and f show the experimental and model curves for the used once catalyst runs for the co-pyrolysis of PP and PET at various PP:PET ratios containing 10 %, 25 %, and 50 % PET. As higher percentages of PET are included, the deactivation becomes more severe, leading to polymer degradation at higher temperatures. The catalyst activity for the first step of PP catalytic degradation, denoted as ϕP,1, decrease from a value of 0.0908 to 0.0086 as the percentage of PET increases from 10 % to 25 %. Further increasing the PET percentage to 50 % further decreases ϕP,1 to a value of 0.00004. The decrease in catalyst activity for PP leads to an increase in the percent of non-catalytic degradation of PP which occurs for the used catalyst runs. For the case of 10 % PET, all the PP degrades catalytically, for 25 % PET there is a combination of catalytic and non-catalytic degradation of PP, and for the case of 50 % PET there is only non-catalytic degradation of PP, as shown in Fig. S9. In addition to the decrease in catalyst activity for PP via the deactivation constants, a larger reaction order of 2.337 for nC,P1_C helps for the modelling of used catalysts with higher percentages of PET. Since the reaction kinetics are dependent on mass fraction, which can never exceed a value of 1, a higher reaction order is reasonable. Due to the high value of b (5.045) obtained for the PET catalytic pathway (R4), PET is able to easily saturate the catalytic sites, bringing the mass fraction of [C] to low values. The high reaction order for nC,P1_C then makes the catalytic pathway for PP less favorable, leading to a higher extent of non-catalytic degradation for PP. The corresponding experimental and model profiles for the fresh catalyst runs with varying PP:PET ratios are shown in Fig. S10. It is observed that the model is able to fit well the degradation which occurs at lower temperatures for the catalytic co-pyrolysis of PP and PET with the fresh HZSM-5 catalyst. In addition to predicting polymer degradation for the CF ratio, catalyst use state, and PP:PET ratio used, the kinetic modelling was also able to predict degradation behavior for various heating rates which were used. Fig. S11 shows the experimental and modelling results for both the non-catalytic and the catalytic pyrolysis of PP and PET at various heating rates. The model is able to predict well the increase in degradation temperature that occurs as the heating rate is increased. The ability of the nth order kinetic modelling approach to predict degradation profiles for various heating rates is one advantage of the technique, which has also been observed by others [18]. To further validate the robustness of our kinetic model, we conducted two additional experiments under new operating conditions involving different PP:PET ratios (1:1 and 1:3), CF ratios (1:1 and 1.5:1), and heating rates (10 and 40 °C min−1) that were not included in the model optimization process. We then applied the optimized parameters obtained for the nth-order model to test these new cases without modifying any parameter values. The resulting fits are presented in Table S5 while Fig. S12 shows the experimental and modelling results obtained under these conditions. Fig. S12 shows excellent agreement between the experimental and model-predicted DTG and weight loss profiles. These results confirm that the nth-order model generalizes well across different experimental conditions and validates the model accuracy of the fitted parameters beyond the training dataset. 4 Conclusion In this study, the catalytic pyrolysis of PP and PET was conducted with HZSM-5 catalyst in a thermogravimetric analyzer at various CF ratios, PP:PET ratios, and heating rates. It was observed that as the CF ratio was increased, the total solid residual left at the end of pyrolysis also increased, for both PP and for PET. The addition of HZSM-5 drastically decreased the maximum degradation temperature for PP (110–181 °C difference), while only decreasing the degradation temperature slightly for PET (10–13 °C difference). The average apparent activation energy for PP pyrolysis, determined via FWO approach, decreased from 209 mol−1 to 87 mol−1 when HZSM-5 catalyst was added at CF ratio of 1. The activation energy for PET only decreased in the conversion range of 0.1 – 0.4 when HZSM-5 catalyst was added. Catalyst deactivation phenomena was investigated by running subsequent pyrolysis experiments with used catalysts for the pyrolysis experiments. A shift to higher degradation temperatures was observed for the used catalysts. When higher percentages of PET were included in the pyrolysis, a larger shift to higher temperatures was observed for the used catalysts, indicating that PET was deactivating the catalyst to a higher extent. Pyridine and collidine TPD revealed that catalyst coked by both PP and PET resulted in the lowest collidine accessibility factor (0.7 %) when compared to catalyst coked only by PP (2.5 %) and fresh catalyst (5.2 %). This indicates that coke from PET was preferentially forming on external acid sites. This finding was supported by nitrogen physisorption, which revealed that catalyst coked by PP and PET resulted in a larger decrease in its external surface area (-60 m2/g) than its micropore area (-50 m2/g), where catalyst coked by PP resulted in smaller decrease in its external surface area (-19 m2/g) than its micropore area (-22 m2/g). Coke from PET forming on, and thus deactivating, external acid sites, can explain the deactivation phenomenon observed in our catalytic co-pyrolysis experiments with PP and PET in the TGA, as it is well documented that external acid sites are necessary for the catalytic degradation of PP and other polyolefins [31,32,36]. Future works targeting catalyst design for the catalytic pyrolysis of mixed plastic waste should investigate whether coke from PET can be directed towards acid sites on the catalyst, which are different than the acid sites necessary for the catalytic degradation of PP and other polyolefins. An nth order reaction scheme was used to model the catalytic pyrolysis of PP and PET with both the fresh and used catalysts. A good fit of the model to the experimental results were observed for 30 different experimental conditions of various CF ratios, PP:PET ratios, heating rates, and catalyst use states, through the optimization of 37 kinetic parameters. The kinetic modelling was able to predict the extent of polymer degradation which occurs catalytically and non-catalytically, for experiments with high percentages of PET, and with used catalysts, in which a mix of catalytic and non-catalytic degradation is thought to occur. CRediT authorship contribution statement Do Hyun Lee: Data curation. Hilal Ezgi Toraman: Writing – review & editing, Supervision, Resources, Project administration, Funding acquisition, Conceptualization. Sean Timothy Okonsky: Writing – review & editing, Writing – original draft, Visualization, Validation, Software, Methodology, Investigation, Formal analysis, Data curation, Conceptualization. J.V. Jayarama Krishna: Writing – review & editing, Methodology, Investigation, Formal analysis. Declaration of Competing Interest The authors declare that they have no known competing financial interests or personal relationships that could have appeared to influence the work reported in this paper. Acknowledgments This material is based upon work supported by the U.S. Department of Energy’s Office of Energy Efficiency and Renewable Energy (EERE) under the Advanced Manufacturing Office Award Number DE-EE0007897 awarded to the REMADE Institute, a division of Sustainable Manufacturing Innovation Alliance Corp. This report was prepared as an account of work sponsored by an agency of the United States Government. Neither the United States Government nor any agency thereof, nor any of their employees, makes any warranty, express or implied, or assumes any legal liability or responsibility for the accuracy, completeness, or usefulness of any information, apparatus, product, or process disclosed, or represents that its use would not infringe privately owned rights. Reference herein to any specific commercial product, process, or service by trade name, trademark, manufacturer, or otherwise does not necessarily constitute or imply its endorsement, recommendation, or favoring by the United States Government or any agency thereof. The views and opinions of authors expressed herein do not necessarily state or reflect those of the United States Government or any agency thereof. Appendix A Supporting information Supplementary data associated with this article can be found in the online version at doi:10.1016/j.apcata.2025.120574. Appendix A Supplementary material Supplementary material References [1] R. Geyer J.R. Jambeck K.L. Law Production, use, and fate of all plastics ever made Sci. Adv. 3 2017 e1700782 10.1126/sciadv.1700782 R. Geyer, J.R. Jambeck, K.L. Law, Production, use, and fate of all plastics ever made, Science Advances 3 (2017) e1700782. https://doi.org/10.1126/sciadv.1700782. [2] K. Ragaert L. Delva K. Van Geem Mechanical and chemical recycling of solid plastic waste Waste Manag. 69 2017 24 58 10.1016/j.wasman.2017.07.044 K. Ragaert, L. Delva, K. Van Geem, Mechanical and chemical recycling of solid plastic waste, Waste Management 69 (2017) 24–58. https://doi.org/10.1016/j.wasman.2017.07.044. [3] K. Kaiser M. Schmid M. Schlummer Recycling of Polymer-Based multilayer packaging: a review Recycling 3 1 2018 10.3390/recycling3010001 K. Kaiser, M. Schmid, M. Schlummer, Recycling of Polymer-Based Multilayer Packaging: A Review, Recycling 3 (2018) 1. https://doi.org/10.3390/recycling3010001. [4] G. Lopez M. Artetxe M. Amutio J. Bilbao M. Olazar Thermochemical routes for the valorization of waste polyolefinic plastics to produce fuels and chemicals. A review Renew. Sustain. Energy Rev. 73 2017 346 368 10.1016/j.rser.2017.01.142 G. Lopez, M. Artetxe, M. Amutio, J. Bilbao, M. Olazar, Thermochemical routes for the valorization of waste polyolefinic plastics to produce fuels and chemicals. A review, Renewable and Sustainable Energy Reviews 73 (2017) 346–368. https://doi.org/10.1016/j.rser.2017.01.142. [5] B.A. Perez H.E. Toraman Investigating primary decomposition of polypropylene through detailed compositional analysis using two-dimensional gas chromatography and principal component analysis J. Anal. Appl. Pyrolysis 2024 106376 10.1016/j.jaap.2024.106376 B.A. Perez, H.E. Toraman, Investigating primary decomposition of polypropylene through detailed compositional analysis using two-dimensional gas chromatography and principal component analysis, Journal of Analytical and Applied Pyrolysis (2024) 106376. https://doi.org/10.1016/j.jaap.2024.106376. [6] M. Artetxe G. Lopez M. Amutio G. Elordi M. Olazar J. Bilbao Operating conditions for the pyrolysis of Poly-(ethylene terephthalate) in a conical Spouted-Bed reactor Ind. Eng. Chem. Res. 49 2010 2064 2069 10.1021/ie900557c M. Artetxe, G. Lopez, M. Amutio, G. Elordi, M. Olazar, J. Bilbao, Operating Conditions for the Pyrolysis of Poly-(ethylene terephthalate) in a Conical Spouted-Bed Reactor, Ind. Eng. Chem. Res. 49 (2010) 2064–2069. https://doi.org/10.1021/ie900557c. [7] S. Du J.A. Valla R.S. Parnas G.M. Bollas Conversion of polyethylene terephthalate based waste carpet to Benzene-Rich oils through thermal, catalytic, and catalytic steam pyrolysis ACS Sustain. Chem. Eng. 4 2016 2852 2860 10.1021/acssuschemeng.6b00450 S. Du, J.A. Valla, R.S. Parnas, G.M. Bollas, Conversion of Polyethylene Terephthalate Based Waste Carpet to Benzene-Rich Oils through Thermal, Catalytic, and Catalytic Steam Pyrolysis, ACS Sustainable Chem. Eng. 4 (2016) 2852–2860. https://doi.org/10.1021/acssuschemeng.6b00450. [8] H. Lee Y.-M. Kim S.-C. Jung Y.-K. Park Catalytic pyrolysis of polyethylene terephthalate over desilicated beta J. Nanosci. Nanotechnol. 20 2020 5594 5598 10.1166/jnn.2020.17636 H. Lee, Y.-M. Kim, S.-C. Jung, Y.-K. Park, Catalytic Pyrolysis of Polyethylene Terephthalate Over Desilicated Beta, Journal of Nanoscience and Nanotechnology 20 (2020) 5594–5598. https://doi.org/10.1166/jnn.2020.17636. [9] J. Aguado D.P. Serrano J.L. Sotelo R. Van Grieken J.M. Escola Influence of the operating variables on the catalytic conversion of a polyolefin mixture over HMCM-41 and nanosized HZSM-5 Ind. Eng. Chem. Res. 40 2001 5696 5704 10.1021/ie010420c J. Aguado, D.P. Serrano, J.L. Sotelo, R. Van Grieken, J.M. Escola, Influence of the Operating Variables on the Catalytic Conversion of a Polyolefin Mixture over HMCM-41 and Nanosized HZSM-5, Ind. Eng. Chem. Res. 40 (2001) 5696–5704. https://doi.org/10.1021/ie010420c. [10] A. Eschenbacher R.J. Varghese E. Delikonstantis O. Mynko F. Goodarzi K. Enemark-Rasmussen J. Oenema M.S. Abbas-Abadi G.D. Stefanidis K.M. Van Geem Highly selective conversion of mixed polyolefins to valuable base chemicals using phosphorus-modified and steam-treated mesoporous HZSM-5 zeolite with minimal carbon footprint Appl. Catal. B Environ. 309 2022 121251 10.1016/j.apcatb.2022.121251 A. Eschenbacher, R.J. Varghese, E. Delikonstantis, O. Mynko, F. Goodarzi, K. Enemark-Rasmussen, J. Oenema, M.S. Abbas-Abadi, G.D. Stefanidis, K.M. Van Geem, Highly selective conversion of mixed polyolefins to valuable base chemicals using phosphorus-modified and steam-treated mesoporous HZSM-5 zeolite with minimal carbon footprint, Applied Catalysis B: Environmental 309 (2022) 121251. https://doi.org/10.1016/j.apcatb.2022.121251. [11] Y. Xue P. Johnston X. Bai Effect of catalyst contact mode and gas atmosphere during catalytic pyrolysis of waste plastics Energy Convers. Manag. 142 2017 441 451 10.1016/j.enconman.2017.03.071 Y. Xue, P. Johnston, X. Bai, Effect of catalyst contact mode and gas atmosphere during catalytic pyrolysis of waste plastics, Energy Conversion and Management 142 (2017) 441–451. https://doi.org/10.1016/j.enconman.2017.03.071. [12] S.T. Okonsky V.J.K. Jonnalagedda H.E. Toraman Catalytic co-pyrolysis of LDPE and PET with HZSM-5, H-Beta, and HY: experiments and kinetic modelling React. Chem. Eng. 2022 2175 2191 10.1039/D2RE00144F S.T. Okonsky, V.J.K. Jonnalagedda, H.E. Toraman, Catalytic co-pyrolysis of LDPE and PET with HZSM-5, H-Beta, and HY: Experiments and kinetic modelling, React. Chem. Eng. (2022) 2175–2191. https://doi.org/10.1039/D2RE00144F. [13] A. Aboulkas K. El harfi A. El Bouadili Thermal degradation behaviors of polyethylene and polypropylene. Part I: pyrolysis kinetics and mechanisms Energy Convers. Manag. 51 2010 1363 1369 10.1016/j.enconman.2009.12.017 A. Aboulkas, K. El harfi, A. El Bouadili, Thermal degradation behaviors of polyethylene and polypropylene. Part I: Pyrolysis kinetics and mechanisms, Energy Conversion and Management 51 (2010) 1363–1369. https://doi.org/10.1016/j.enconman.2009.12.017. [14] J.V. Jayarama Krishna O.P. Korobeinichev R. Vinu Isothermal fast pyrolysis kinetics of synthetic polymers using analytical pyroprobe J. Anal. Appl. Pyrolysis 139 2019 48 58 10.1016/j.jaap.2019.01.008 J.V. Jayarama Krishna, O.P. Korobeinichev, R. Vinu, Isothermal fast pyrolysis kinetics of synthetic polymers using analytical Pyroprobe, Journal of Analytical and Applied Pyrolysis 139 (2019) 48–58. https://doi.org/10.1016/j.jaap.2019.01.008. [15] A. Durmuş S. Naci Koç G. Selda Pozan A. Kaşgöz Thermal-catalytic degradation kinetics of polypropylene over BEA, ZSM-5 and MOR zeolites Appl. Catal. B Environ. 61 2005 316 322 10.1016/j.apcatb.2005.06.009 A. Durmuş, S. Naci Koç, G. Selda Pozan, A. Kaşgöz, Thermal-catalytic degradation kinetics of polypropylene over BEA, ZSM-5 and MOR zeolites, Applied Catalysis B: Environmental 61 (2005) 316–322. https://doi.org/10.1016/j.apcatb.2005.06.009. [16] E. Valanciene L. Miknius N. Pedisius The influence of zeolite catalyst on kinetics and thermodynamics of polypropylene waste thermal degradation J. Therm. Anal. Calor. 124 2016 341 354 10.1007/s10973-015-5150-7 E. Valanciene, L. Miknius, N. Pedisius, The influence of zeolite catalyst on kinetics and thermodynamics of polypropylene waste thermal degradation, J Therm Anal Calorim 124 (2016) 341–354. https://doi.org/10.1007/s10973-015-5150-7. [17] N. Raja G.M. Monsalve-Bravo Y.V. Kaneti J. Mensah K. Wilson A.F. Lee M. Konarova Thermogravimetric kinetic analysis of catalytic and non-catalytic pyrolysis of simulated municipal solid waste Chem. Eng. J. 470 2023 144046 10.1016/j.cej.2023.144046 N. Raja, G.M. Monsalve-Bravo, Y.V. Kaneti, J. Mensah, K. Wilson, A.F. Lee, M. Konarova, Thermogravimetric kinetic analysis of catalytic and non-catalytic pyrolysis of simulated municipal solid waste, Chemical Engineering Journal 470 (2023) 144046. https://doi.org/10.1016/j.cej.2023.144046. [18] A. Marcilla A. Gómez-Siurana F. Valdés Catalytic cracking of low-density polyethylene over H-Beta and HZSM-5 zeolites: influence of the external surface. Kinetic model Polym. Degrad. Stab. 92 2007 197 204 10.1016/j.polymdegradstab.2006.11.007 A. Marcilla, A. Gómez-Siurana, F. Valdés, Catalytic cracking of low-density polyethylene over H-Beta and HZSM-5 zeolites: Influence of the external surface. Kinetic model, Polymer Degradation and Stability 92 (2007) 197–204. https://doi.org/10.1016/j.polymdegradstab.2006.11.007. [19] S. Rejman I. Vollmer M.J. Werny E.T.C. Vogt F. Meirer B.M. Weckhuysen Transport limitations in polyolefin cracking at the single catalyst particle level Chem. Sci. 2023 10.1039/D3SC03229A S. Rejman, I. Vollmer, M.J. Werny, E.T.C. Vogt, F. Meirer, B.M. Weckhuysen, Transport limitations in polyolefin cracking at the single catalyst particle level, Chem. Sci. (2023). https://doi.org/10.1039/D3SC03229A. [20] V. Daligaux R. Richard M.-H. Manero Deactivation and regeneration of zeolite catalysts used in pyrolysis of plastic Wastes—A process and analytical review Catalysts 11 2021 770 10.3390/catal11070770 V. Daligaux, R. Richard, M.-H. Manero, Deactivation and Regeneration of Zeolite Catalysts Used in Pyrolysis of Plastic Wastes—A Process and Analytical Review, Catalysts 11 (2021) 770. https://doi.org/10.3390/catal11070770. [21] G. Elordi M. Olazar G. Lopez M. Amutio M. Artetxe R. Aguado J. Bilbao Catalytic pyrolysis of HDPE in continuous mode over zeolite catalysts in a conical spouted bed reactor J. Anal. Appl. Pyrolysis 85 2009 345 351 10.1016/j.jaap.2008.10.015 G. Elordi, M. Olazar, G. Lopez, M. Amutio, M. Artetxe, R. Aguado, J. Bilbao, Catalytic pyrolysis of HDPE in continuous mode over zeolite catalysts in a conical spouted bed reactor, Journal of Analytical and Applied Pyrolysis 85 (2009) 345–351. https://doi.org/10.1016/j.jaap.2008.10.015. [22] Z. Chen X. Zhang F. Yang H. Peng X. Zhang S. Zhu L. Che Deactivation of a Y-zeolite based catalyst with coke evolution during the catalytic pyrolysis of polyethylene for fuel oil Appl. Catal. A Gen. 609 2021 117873 10.1016/j.apcata.2020.117873 Z. Chen, X. Zhang, F. Yang, H. Peng, X. Zhang, S. Zhu, L. Che, Deactivation of a Y-zeolite based catalyst with coke evolution during the catalytic pyrolysis of polyethylene for fuel oil, Applied Catalysis A: General 609 (2021) 117873. https://doi.org/10.1016/j.apcata.2020.117873. [23] G. Elordi M. Olazar G. Lopez P. Castaño J. Bilbao Role of pore structure in the deactivation of zeolites (HZSM-5, Hβ and HY) by coke in the pyrolysis of polyethylene in a conical spouted bed reactor Appl. Catal. B Environ. 102 2011 224 231 10.1016/j.apcatb.2010.12.002 G. Elordi, M. Olazar, G. Lopez, P. Castaño, J. Bilbao, Role of pore structure in the deactivation of zeolites (HZSM-5, Hβ and HY) by coke in the pyrolysis of polyethylene in a conical spouted bed reactor, Applied Catalysis B: Environmental 102 (2011) 224–231. https://doi.org/10.1016/j.apcatb.2010.12.002. [24] A. Marcilla M.I. Beltrán R. Navarro TG/FT-IR analysis of HZSM5 and HUSY deactivation during the catalytic pyrolysis of polyethylene J. Anal. Appl. Pyrolysis 76 2006 222 229 10.1016/j.jaap.2005.11.008 A. Marcilla, M.I. Beltrán, R. Navarro, TG/FT-IR analysis of HZSM5 and HUSY deactivation during the catalytic pyrolysis of polyethylene, Journal of Analytical and Applied Pyrolysis 76 (2006) 222–229. https://doi.org/10.1016/j.jaap.2005.11.008. [25] A. Marcilla M.I. Beltrán A. Gómez-Siurana R. Navarro F. Valdés A global kinetic model as a tool to reproduce the deactivation behaviour of the HZSM-5 zeolite in the catalytic cracking of low-density polyethylene Appl. Catal. A Gen. 328 2007 124 131 10.1016/j.apcata.2007.05.038 A. Marcilla, M.I. Beltrán, A. Gómez-Siurana, R. Navarro, F. Valdés, A global kinetic model as a tool to reproduce the deactivation behaviour of the HZSM-5 zeolite in the catalytic cracking of low-density polyethylene, Applied Catalysis A: General 328 (2007) 124–131. https://doi.org/10.1016/j.apcata.2007.05.038. [26] D.J. Parrillo C. Lee R.J. Gorte Heats of adsorption for ammonia and pyridine in H-ZSM-5: evidence for identical Brønsted-acid sites Appl. Catal. A Gen. 110 1994 67 74 10.1016/0926-860X(94)80106-1 D.J. Parrillo, C. Lee, R.J. Gorte, Heats of adsorption for ammonia and pyridine in H-ZSM-5: evidence for identical Brønsted-acid sites, Applied Catalysis A: General 110 (1994) 67–74. https://doi.org/10.1016/0926-860X(94)80106-1. [27] H. Du D.H. Olson Surface acidic properties of a HMCM-22 zeolite: collidine poisoning and hydrocarbon adsorption studies J. Phys. Chem. B 106 2002 395 400 10.1021/jp013310s H. Du, D.H. Olson, Surface Acidic Properties of A HMCM-22 Zeolite: Collidine Poisoning and Hydrocarbon Adsorption Studies, J. Phys. Chem. B 106 (2002) 395–400. https://doi.org/10.1021/jp013310s. [28] G. Manos A. Garforth J. Dwyer Catalytic degradation of High-Density polyethylene on an Ultrastable-Y zeolite. Nature of initial polymer reactions, pattern of formation of gas and liquid products, and temperature effects Ind. Eng. Chem. Res. 39 2000 1203 1208 10.1021/ie990513i G. Manos, A. Garforth, J. Dwyer, Catalytic Degradation of High-Density Polyethylene on an Ultrastable-Y Zeolite. Nature of Initial Polymer Reactions, Pattern of Formation of Gas and Liquid Products, and Temperature Effects, Ind. Eng. Chem. Res. 39 (2000) 1203–1208. https://doi.org/10.1021/ie990513i. [29] B.A. Perez J.V. Jayarama Krishna H.E. Toraman Insights into co-pyrolysis of polyethylene terephthalate and polyamide 6 mixture through experiments, kinetic modeling and machine learning Chem. Eng. J. 468 2023 143637 10.1016/j.cej.2023.143637 B.A. Perez, J.V. Jayarama Krishna, H.E. Toraman, Insights into co-pyrolysis of polyethylene terephthalate and polyamide 6 mixture through experiments, kinetic modeling and machine learning, Chemical Engineering Journal 468 (2023) 143637. https://doi.org/10.1016/j.cej.2023.143637. [30] K. Mlekodaj K. Tarach J. Datka K. Góra-Marek W. Makowski Porosity and accessibility of acid sites in desilicated ZSM-5 zeolites studied using adsorption of probe molecules Microporous Mesoporous Mater. 183 2014 54 61 10.1016/j.micromeso.2013.08.051 K. Mlekodaj, K. Tarach, J. Datka, K. Góra-Marek, W. Makowski, Porosity and accessibility of acid sites in desilicated ZSM-5 zeolites studied using adsorption of probe molecules, Microporous and Mesoporous Materials 183 (2014) 54–61. https://doi.org/10.1016/j.micromeso.2013.08.051. [31] A.C. Jerdy L. Trevisi M. Monwar M.Á. González-Borja R. Abbott L. Lobban S. Crossley Deconvoluting the roles of polyolefin branching and unsaturation on depolymerization reactions over acid catalysts Appl. Catal. B Environ. 337 2023 122986 10.1016/j.apcatb.2023.122986 A.C. Jerdy, L. Trevisi, M. Monwar, M.Á. González-Borja, R. Abbott, L. Lobban, S. Crossley, Deconvoluting the roles of polyolefin branching and unsaturation on depolymerization reactions over acid catalysts, Applied Catalysis B: Environmental 337 (2023) 122986. https://doi.org/10.1016/j.apcatb.2023.122986. [32] J.Z. Tan C.W. Hullfish Y. Zheng B.E. Koel M.L. Sarazen Conversion of polyethylene waste to short chain hydrocarbons under mild temperature and hydrogen pressure with metal-free and metal-loaded MFI zeolites Appl. Catal. B Environ. 338 2023 123028 10.1016/j.apcatb.2023.123028 J.Z. Tan, C.W. Hullfish, Y. Zheng, B.E. Koel, M.L. Sarazen, Conversion of polyethylene waste to short chain hydrocarbons under mild temperature and hydrogen pressure with metal-free and metal-loaded MFI zeolites, Applied Catalysis B: Environmental 338 (2023) 123028. https://doi.org/10.1016/j.apcatb.2023.123028. [33] N. Sidhu I. Mastalski A. Zolghadr B. Patel S. Uppili T. Go S. Maduskar Z. Wang M. Neurock P.J. Dauenhauer On the intrinsic reaction kinetics of polypropylene pyrolysis Matter 2023 10.1016/j.matt.2023.07.020 N. Sidhu, I. Mastalski, A. Zolghadr, B. Patel, S. Uppili, T. Go, S. Maduskar, Z. Wang, M. Neurock, P.J. Dauenhauer, On the intrinsic reaction kinetics of polypropylene pyrolysis, Matter (2023). https://doi.org/10.1016/j.matt.2023.07.020. [34] B. Saha P. Karthik Reddy A.C.K. Chowlu A.K. Ghoshal Model-free kinetics analysis of nanocrystalline HZSM-5 catalyzed pyrolysis of polypropylene (PP) Thermochim. Acta 468 2008 94 100 10.1016/j.tca.2007.12.004 B. Saha, P. Karthik Reddy, A.C.K. Chowlu, A.K. Ghoshal, Model-free kinetics analysis of nanocrystalline HZSM-5 catalyzed pyrolysis of polypropylene (PP), Thermochimica Acta 468 (2008) 94–100. https://doi.org/10.1016/j.tca.2007.12.004. [35] I. Dubdub Z. Alhulaybi Catalytic pyrolysis of PET polymer using nonisothermal thermogravimetric analysis data: kinetics and artificial neural networks studies Polymers 15 2023 70 10.3390/polym15010070 I. Dubdub, Z. Alhulaybi, Catalytic Pyrolysis of PET Polymer Using Nonisothermal Thermogravimetric Analysis Data: Kinetics and Artificial Neural Networks Studies, Polymers 15 (2023) 70. https://doi.org/10.3390/polym15010070. [36] S. Rejman Z.M. Reverdy Z. Bör J.N. Louwen C. Rieg J.M. Dorresteijn J.-K. van der Waal E.T.C. Vogt I. Vollmer B.M. Weckhuysen External acidity as performance descriptor in polyolefin cracking using zeolite-based materials Nat. Commun. 16 2025 2980 10.1038/s41467-025-57158-1 S. Rejman, Z.M. Reverdy, Z. Bör, J.N. Louwen, C. Rieg, J.M. Dorresteijn, J.-K. van der Waal, E.T.C. Vogt, I. Vollmer, B.M. Weckhuysen, External acidity as performance descriptor in polyolefin cracking using zeolite-based materials, Nat Commun 16 (2025) 2980. https://doi.org/10.1038/s41467-025-57158-1.",
      "coredata": {
        "eid": "1-s2.0-S0926860X25004764",
        "dc:description": "The catalytic pyrolysis and co-pyrolysis of PP and PET with HZSM-5 zeolite catalyst was conducted for various catalyst to feedstock (CF) ratios, PP to PET ratios, and heating rates using a thermogravimetric analyzer (TGA). The Flynn-Wall-Ozawa (FWO) isoconversional approach was used to determine apparent activation energies for the non-catalytic and catalytic pyrolysis of PP and PET. An nth-order reaction scheme was used to model the pyrolysis at various operating conditions through the optimization of the associated kinetic parameters. Additional TGA experiments were conducted with used catalysts to gain insight into catalyst deactivation, and it was found that the inclusion of PET led to more severe deactivation. Collidine temperature programmed desorption (TPD) indicated the loss of external acid sites for catalysts coked by PET pyrolysis, explaining the severe deactivation. Catalyst deactivation was incorporated into the kinetic modelling approach, so that degradation profiles could be predicted for experiments with the used catalysts.",
        "openArchiveArticle": "false",
        "prism:coverDate": "2025-12-25",
        "openaccessUserLicense": null,
        "prism:aggregationType": "Journal",
        "prism:url": "https://api.elsevier.com/content/article/pii/S0926860X25004764",
        "dc:creator": [
          {
            "@_fa": "true",
            "$": "Okonsky, Sean Timothy"
          },
          {
            "@_fa": "true",
            "$": "Krishna, J.V. Jayarama"
          },
          {
            "@_fa": "true",
            "$": "Lee, Do Hyun"
          },
          {
            "@_fa": "true",
            "$": "Toraman, Hilal Ezgi"
          }
        ],
        "link": [
          {
            "@_fa": "true",
            "@rel": "self",
            "@href": "https://api.elsevier.com/content/article/pii/S0926860X25004764"
          },
          {
            "@_fa": "true",
            "@rel": "scidir",
            "@href": "https://www.sciencedirect.com/science/article/pii/S0926860X25004764"
          }
        ],
        "dc:format": "application/json",
        "openaccessType": null,
        "pii": "S0926-860X(25)00476-4",
        "prism:volume": "708",
        "articleNumber": "120574",
        "prism:publisher": "Elsevier B.V. All rights are reserved, including those for text and data mining, AI training, and similar technologies.",
        "dc:title": "Kinetic modelling and measurement of catalyst deactivation for the catalytic co-pyrolysis of PP and PET with HZSM-5",
        "prism:copyright": "© 2025 Elsevier B.V. All rights are reserved, including those for text and data mining, AI training, and similar technologies.",
        "openaccess": "0",
        "prism:issn": "0926860X",
        "dcterms:subject": [
          {
            "@_fa": "true",
            "$": "Catalytic pyrolysis"
          },
          {
            "@_fa": "true",
            "$": "Kinetic modelling"
          },
          {
            "@_fa": "true",
            "$": "Deactivation"
          },
          {
            "@_fa": "true",
            "$": "Polypropylene"
          },
          {
            "@_fa": "true",
            "$": "PET"
          }
        ],
        "openaccessArticle": "false",
        "prism:publicationName": "Applied Catalysis A: General",
        "openaccessSponsorType": null,
        "prism:pageRange": "120574",
        "pubType": "fla",
        "prism:coverDisplayDate": "25 December 2025",
        "prism:doi": "10.1016/j.apcata.2025.120574",
        "prism:startingPage": "120574",
        "dc:identifier": "doi:10.1016/j.apcata.2025.120574",
        "openaccessSponsorName": null
      },
      "objects": {
        "object": [
          {
            "@category": "standard",
            "@height": "704",
            "@width": "678",
            "@_fa": "true",
            "$": "https://api.elsevier.com/content/object/eid/1-s2.0-S0926860X25004764-gr9.jpg?httpAccept=%2A%2F%2A",
            "@multimediatype": "JPEG image file",
            "@type": "IMAGE-DOWNSAMPLED",
            "@size": "127432",
            "@ref": "gr9",
            "@mimetype": "image/jpeg"
          },
          {
            "@category": "thumbnail",
            "@height": "164",
            "@width": "158",
            "@_fa": "true",
            "$": "https://api.elsevier.com/content/object/eid/1-s2.0-S0926860X25004764-gr9.sml?httpAccept=%2A%2F%2A",
            "@multimediatype": "GIF image file",
            "@type": "IMAGE-THUMBNAIL",
            "@size": "10101",
            "@ref": "gr9",
            "@mimetype": "image/gif"
          },
          {
            "@category": "standard",
            "@height": "315",
            "@width": "376",
            "@_fa": "true",
            "$": "https://api.elsevier.com/content/object/eid/1-s2.0-S0926860X25004764-gr7.jpg?httpAccept=%2A%2F%2A",
            "@multimediatype": "JPEG image file",
            "@type": "IMAGE-DOWNSAMPLED",
            "@size": "29690",
            "@ref": "gr7",
            "@mimetype": "image/jpeg"
          },
          {
            "@category": "thumbnail",
            "@height": "164",
            "@width": "196",
            "@_fa": "true",
            "$": "https://api.elsevier.com/content/object/eid/1-s2.0-S0926860X25004764-gr7.sml?httpAccept=%2A%2F%2A",
            "@multimediatype": "GIF image file",
            "@type": "IMAGE-THUMBNAIL",
            "@size": "8217",
            "@ref": "gr7",
            "@mimetype": "image/gif"
          },
          {
            "@category": "standard",
            "@height": "286",
            "@width": "376",
            "@_fa": "true",
            "$": "https://api.elsevier.com/content/object/eid/1-s2.0-S0926860X25004764-gr8.jpg?httpAccept=%2A%2F%2A",
            "@multimediatype": "JPEG image file",
            "@type": "IMAGE-DOWNSAMPLED",
            "@size": "23258",
            "@ref": "gr8",
            "@mimetype": "image/jpeg"
          },
          {
            "@category": "thumbnail",
            "@height": "164",
            "@width": "215",
            "@_fa": "true",
            "$": "https://api.elsevier.com/content/object/eid/1-s2.0-S0926860X25004764-gr8.sml?httpAccept=%2A%2F%2A",
            "@multimediatype": "GIF image file",
            "@type": "IMAGE-THUMBNAIL",
            "@size": "7164",
            "@ref": "gr8",
            "@mimetype": "image/gif"
          },
          {
            "@category": "standard",
            "@height": "311",
            "@width": "678",
            "@_fa": "true",
            "$": "https://api.elsevier.com/content/object/eid/1-s2.0-S0926860X25004764-gr5.jpg?httpAccept=%2A%2F%2A",
            "@multimediatype": "JPEG image file",
            "@type": "IMAGE-DOWNSAMPLED",
            "@size": "48068",
            "@ref": "gr5",
            "@mimetype": "image/jpeg"
          },
          {
            "@category": "thumbnail",
            "@height": "100",
            "@width": "219",
            "@_fa": "true",
            "$": "https://api.elsevier.com/content/object/eid/1-s2.0-S0926860X25004764-gr5.sml?httpAccept=%2A%2F%2A",
            "@multimediatype": "GIF image file",
            "@type": "IMAGE-THUMBNAIL",
            "@size": "7218",
            "@ref": "gr5",
            "@mimetype": "image/gif"
          },
          {
            "@category": "standard",
            "@height": "289",
            "@width": "376",
            "@_fa": "true",
            "$": "https://api.elsevier.com/content/object/eid/1-s2.0-S0926860X25004764-gr6.jpg?httpAccept=%2A%2F%2A",
            "@multimediatype": "JPEG image file",
            "@type": "IMAGE-DOWNSAMPLED",
            "@size": "30652",
            "@ref": "gr6",
            "@mimetype": "image/jpeg"
          },
          {
            "@category": "thumbnail",
            "@height": "164",
            "@width": "213",
            "@_fa": "true",
            "$": "https://api.elsevier.com/content/object/eid/1-s2.0-S0926860X25004764-gr6.sml?httpAccept=%2A%2F%2A",
            "@multimediatype": "GIF image file",
            "@type": "IMAGE-THUMBNAIL",
            "@size": "10591",
            "@ref": "gr6",
            "@mimetype": "image/gif"
          },
          {
            "@category": "standard",
            "@height": "297",
            "@width": "376",
            "@_fa": "true",
            "$": "https://api.elsevier.com/content/object/eid/1-s2.0-S0926860X25004764-gr3.jpg?httpAccept=%2A%2F%2A",
            "@multimediatype": "JPEG image file",
            "@type": "IMAGE-DOWNSAMPLED",
            "@size": "24882",
            "@ref": "gr3",
            "@mimetype": "image/jpeg"
          },
          {
            "@category": "thumbnail",
            "@height": "164",
            "@width": "208",
            "@_fa": "true",
            "$": "https://api.elsevier.com/content/object/eid/1-s2.0-S0926860X25004764-gr3.sml?httpAccept=%2A%2F%2A",
            "@multimediatype": "GIF image file",
            "@type": "IMAGE-THUMBNAIL",
            "@size": "8545",
            "@ref": "gr3",
            "@mimetype": "image/gif"
          },
          {
            "@category": "standard",
            "@height": "312",
            "@width": "668",
            "@_fa": "true",
            "$": "https://api.elsevier.com/content/object/eid/1-s2.0-S0926860X25004764-gr4.jpg?httpAccept=%2A%2F%2A",
            "@multimediatype": "JPEG image file",
            "@type": "IMAGE-DOWNSAMPLED",
            "@size": "42333",
            "@ref": "gr4",
            "@mimetype": "image/jpeg"
          },
          {
            "@category": "thumbnail",
            "@height": "102",
            "@width": "219",
            "@_fa": "true",
            "$": "https://api.elsevier.com/content/object/eid/1-s2.0-S0926860X25004764-gr4.sml?httpAccept=%2A%2F%2A",
            "@multimediatype": "GIF image file",
            "@type": "IMAGE-THUMBNAIL",
            "@size": "6652",
            "@ref": "gr4",
            "@mimetype": "image/gif"
          },
          {
            "@category": "standard",
            "@height": "305",
            "@width": "678",
            "@_fa": "true",
            "$": "https://api.elsevier.com/content/object/eid/1-s2.0-S0926860X25004764-gr1.jpg?httpAccept=%2A%2F%2A",
            "@multimediatype": "JPEG image file",
            "@type": "IMAGE-DOWNSAMPLED",
            "@size": "46916",
            "@ref": "gr1",
            "@mimetype": "image/jpeg"
          },
          {
            "@category": "thumbnail",
            "@height": "99",
            "@width": "219",
            "@_fa": "true",
            "$": "https://api.elsevier.com/content/object/eid/1-s2.0-S0926860X25004764-gr1.sml?httpAccept=%2A%2F%2A",
            "@multimediatype": "GIF image file",
            "@type": "IMAGE-THUMBNAIL",
            "@size": "6907",
            "@ref": "gr1",
            "@mimetype": "image/gif"
          },
          {
            "@category": "standard",
            "@height": "305",
            "@width": "678",
            "@_fa": "true",
            "$": "https://api.elsevier.com/content/object/eid/1-s2.0-S0926860X25004764-gr2.jpg?httpAccept=%2A%2F%2A",
            "@multimediatype": "JPEG image file",
            "@type": "IMAGE-DOWNSAMPLED",
            "@size": "45127",
            "@ref": "gr2",
            "@mimetype": "image/jpeg"
          },
          {
            "@category": "thumbnail",
            "@height": "99",
            "@width": "219",
            "@_fa": "true",
            "$": "https://api.elsevier.com/content/object/eid/1-s2.0-S0926860X25004764-gr2.sml?httpAccept=%2A%2F%2A",
            "@multimediatype": "GIF image file",
            "@type": "IMAGE-THUMBNAIL",
            "@size": "6666",
            "@ref": "gr2",
            "@mimetype": "image/gif"
          },
          {
            "@category": "standard",
            "@height": "191",
            "@width": "500",
            "@_fa": "true",
            "$": "https://api.elsevier.com/content/object/eid/1-s2.0-S0926860X25004764-ga1.jpg?httpAccept=%2A%2F%2A",
            "@multimediatype": "JPEG image file",
            "@type": "IMAGE-DOWNSAMPLED",
            "@size": "31505",
            "@ref": "ga1",
            "@mimetype": "image/jpeg"
          },
          {
            "@category": "thumbnail",
            "@height": "84",
            "@width": "219",
            "@_fa": "true",
            "$": "https://api.elsevier.com/content/object/eid/1-s2.0-S0926860X25004764-ga1.sml?httpAccept=%2A%2F%2A",
            "@multimediatype": "GIF image file",
            "@type": "IMAGE-THUMBNAIL",
            "@size": "8088",
            "@ref": "ga1",
            "@mimetype": "image/gif"
          },
          {
            "@category": "high",
            "@height": "3107",
            "@width": "2994",
            "@_fa": "true",
            "$": "https://api.elsevier.com/content/object/eid/1-s2.0-S0926860X25004764-gr9_lrg.jpg?httpAccept=%2A%2F%2A",
            "@multimediatype": "JPEG image file",
            "@type": "IMAGE-HIGH-RES",
            "@size": "716511",
            "@ref": "gr9",
            "@mimetype": "image/jpeg"
          },
          {
            "@category": "high",
            "@height": "1392",
            "@width": "1663",
            "@_fa": "true",
            "$": "https://api.elsevier.com/content/object/eid/1-s2.0-S0926860X25004764-gr7_lrg.jpg?httpAccept=%2A%2F%2A",
            "@multimediatype": "JPEG image file",
            "@type": "IMAGE-HIGH-RES",
            "@size": "155908",
            "@ref": "gr7",
            "@mimetype": "image/jpeg"
          },
          {
            "@category": "high",
            "@height": "1265",
            "@width": "1663",
            "@_fa": "true",
            "$": "https://api.elsevier.com/content/object/eid/1-s2.0-S0926860X25004764-gr8_lrg.jpg?httpAccept=%2A%2F%2A",
            "@multimediatype": "JPEG image file",
            "@type": "IMAGE-HIGH-RES",
            "@size": "110830",
            "@ref": "gr8",
            "@mimetype": "image/jpeg"
          },
          {
            "@category": "high",
            "@height": "1373",
            "@width": "2994",
            "@_fa": "true",
            "$": "https://api.elsevier.com/content/object/eid/1-s2.0-S0926860X25004764-gr5_lrg.jpg?httpAccept=%2A%2F%2A",
            "@multimediatype": "JPEG image file",
            "@type": "IMAGE-HIGH-RES",
            "@size": "263843",
            "@ref": "gr5",
            "@mimetype": "image/jpeg"
          },
          {
            "@category": "high",
            "@height": "1280",
            "@width": "1663",
            "@_fa": "true",
            "$": "https://api.elsevier.com/content/object/eid/1-s2.0-S0926860X25004764-gr6_lrg.jpg?httpAccept=%2A%2F%2A",
            "@multimediatype": "JPEG image file",
            "@type": "IMAGE-HIGH-RES",
            "@size": "173141",
            "@ref": "gr6",
            "@mimetype": "image/jpeg"
          },
          {
            "@category": "high",
            "@height": "1313",
            "@width": "1663",
            "@_fa": "true",
            "$": "https://api.elsevier.com/content/object/eid/1-s2.0-S0926860X25004764-gr3_lrg.jpg?httpAccept=%2A%2F%2A",
            "@multimediatype": "JPEG image file",
            "@type": "IMAGE-HIGH-RES",
            "@size": "129836",
            "@ref": "gr3",
            "@mimetype": "image/jpeg"
          },
          {
            "@category": "high",
            "@height": "1379",
            "@width": "2956",
            "@_fa": "true",
            "$": "https://api.elsevier.com/content/object/eid/1-s2.0-S0926860X25004764-gr4_lrg.jpg?httpAccept=%2A%2F%2A",
            "@multimediatype": "JPEG image file",
            "@type": "IMAGE-HIGH-RES",
            "@size": "250479",
            "@ref": "gr4",
            "@mimetype": "image/jpeg"
          },
          {
            "@category": "high",
            "@height": "1349",
            "@width": "2995",
            "@_fa": "true",
            "$": "https://api.elsevier.com/content/object/eid/1-s2.0-S0926860X25004764-gr1_lrg.jpg?httpAccept=%2A%2F%2A",
            "@multimediatype": "JPEG image file",
            "@type": "IMAGE-HIGH-RES",
            "@size": "261119",
            "@ref": "gr1",
            "@mimetype": "image/jpeg"
          },
          {
            "@category": "high",
            "@height": "1349",
            "@width": "2994",
            "@_fa": "true",
            "$": "https://api.elsevier.com/content/object/eid/1-s2.0-S0926860X25004764-gr2_lrg.jpg?httpAccept=%2A%2F%2A",
            "@multimediatype": "JPEG image file",
            "@type": "IMAGE-HIGH-RES",
            "@size": "264404",
            "@ref": "gr2",
            "@mimetype": "image/jpeg"
          },
          {
            "@category": "high",
            "@height": "846",
            "@width": "2213",
            "@_fa": "true",
            "$": "https://api.elsevier.com/content/object/eid/1-s2.0-S0926860X25004764-ga1_lrg.jpg?httpAccept=%2A%2F%2A",
            "@multimediatype": "JPEG image file",
            "@type": "IMAGE-HIGH-RES",
            "@size": "245171",
            "@ref": "ga1",
            "@mimetype": "image/jpeg"
          },
          {
            "@category": "standard",
            "@_fa": "true",
            "$": "https://api.elsevier.com/content/object/eid/1-s2.0-S0926860X25004764-mmc1.docx?httpAccept=%2A%2F%2A",
            "@multimediatype": "Microsoft Word file",
            "@type": "APPLICATION",
            "@size": "46598186",
            "@ref": "mmc1",
            "@mimetype": "application/word"
          },
          {
            "@category": "thumbnail",
            "@_fa": "true",
            "$": "https://api.elsevier.com/content/object/eid/1-s2.0-S0926860X25004764-si0001.svg?httpAccept=%2A%2F%2A",
            "@multimediatype": "Scalable Vector Graphics file",
            "@type": "ALTIMG",
            "@size": "1256",
            "@ref": "si0001",
            "@mimetype": "image/svg+xml"
          },
          {
            "@category": "thumbnail",
            "@_fa": "true",
            "$": "https://api.elsevier.com/content/object/eid/1-s2.0-S0926860X25004764-si0002.svg?httpAccept=%2A%2F%2A",
            "@multimediatype": "Scalable Vector Graphics file",
            "@type": "ALTIMG",
            "@size": "1126",
            "@ref": "si0002",
            "@mimetype": "image/svg+xml"
          },
          {
            "@category": "thumbnail",
            "@_fa": "true",
            "$": "https://api.elsevier.com/content/object/eid/1-s2.0-S0926860X25004764-si0003.svg?httpAccept=%2A%2F%2A",
            "@multimediatype": "Scalable Vector Graphics file",
            "@type": "ALTIMG",
            "@size": "1118",
            "@ref": "si0003",
            "@mimetype": "image/svg+xml"
          },
          {
            "@category": "thumbnail",
            "@_fa": "true",
            "$": "https://api.elsevier.com/content/object/eid/1-s2.0-S0926860X25004764-si0004.svg?httpAccept=%2A%2F%2A",
            "@multimediatype": "Scalable Vector Graphics file",
            "@type": "ALTIMG",
            "@size": "1231",
            "@ref": "si0004",
            "@mimetype": "image/svg+xml"
          },
          {
            "@category": "thumbnail",
            "@_fa": "true",
            "$": "https://api.elsevier.com/content/object/eid/1-s2.0-S0926860X25004764-si0005.svg?httpAccept=%2A%2F%2A",
            "@multimediatype": "Scalable Vector Graphics file",
            "@type": "ALTIMG",
            "@size": "1106",
            "@ref": "si0005",
            "@mimetype": "image/svg+xml"
          },
          {
            "@category": "thumbnail",
            "@_fa": "true",
            "$": "https://api.elsevier.com/content/object/eid/1-s2.0-S0926860X25004764-si0006.svg?httpAccept=%2A%2F%2A",
            "@multimediatype": "Scalable Vector Graphics file",
            "@type": "ALTIMG",
            "@size": "1122",
            "@ref": "si0006",
            "@mimetype": "image/svg+xml"
          },
          {
            "@category": "thumbnail",
            "@_fa": "true",
            "$": "https://api.elsevier.com/content/object/eid/1-s2.0-S0926860X25004764-si0007.svg?httpAccept=%2A%2F%2A",
            "@multimediatype": "Scalable Vector Graphics file",
            "@type": "ALTIMG",
            "@size": "4660",
            "@ref": "si0007",
            "@mimetype": "image/svg+xml"
          },
          {
            "@category": "thumbnail",
            "@_fa": "true",
            "$": "https://api.elsevier.com/content/object/eid/1-s2.0-S0926860X25004764-si0008.svg?httpAccept=%2A%2F%2A",
            "@multimediatype": "Scalable Vector Graphics file",
            "@type": "ALTIMG",
            "@size": "1053",
            "@ref": "si0008",
            "@mimetype": "image/svg+xml"
          },
          {
            "@category": "thumbnail",
            "@_fa": "true",
            "$": "https://api.elsevier.com/content/object/eid/1-s2.0-S0926860X25004764-si0009.svg?httpAccept=%2A%2F%2A",
            "@multimediatype": "Scalable Vector Graphics file",
            "@type": "ALTIMG",
            "@size": "2933",
            "@ref": "si0009",
            "@mimetype": "image/svg+xml"
          },
          {
            "@category": "thumbnail",
            "@_fa": "true",
            "$": "https://api.elsevier.com/content/object/eid/1-s2.0-S0926860X25004764-si0010.svg?httpAccept=%2A%2F%2A",
            "@multimediatype": "Scalable Vector Graphics file",
            "@type": "ALTIMG",
            "@size": "2998",
            "@ref": "si0010",
            "@mimetype": "image/svg+xml"
          },
          {
            "@category": "thumbnail",
            "@_fa": "true",
            "$": "https://api.elsevier.com/content/object/eid/1-s2.0-S0926860X25004764-si0011.svg?httpAccept=%2A%2F%2A",
            "@multimediatype": "Scalable Vector Graphics file",
            "@type": "ALTIMG",
            "@size": "1057",
            "@ref": "si0011",
            "@mimetype": "image/svg+xml"
          },
          {
            "@category": "thumbnail",
            "@_fa": "true",
            "$": "https://api.elsevier.com/content/object/eid/1-s2.0-S0926860X25004764-si0012.svg?httpAccept=%2A%2F%2A",
            "@multimediatype": "Scalable Vector Graphics file",
            "@type": "ALTIMG",
            "@size": "1292",
            "@ref": "si0012",
            "@mimetype": "image/svg+xml"
          },
          {
            "@category": "thumbnail",
            "@_fa": "true",
            "$": "https://api.elsevier.com/content/object/eid/1-s2.0-S0926860X25004764-si0013.svg?httpAccept=%2A%2F%2A",
            "@multimediatype": "Scalable Vector Graphics file",
            "@type": "ALTIMG",
            "@size": "1503",
            "@ref": "si0013",
            "@mimetype": "image/svg+xml"
          },
          {
            "@category": "thumbnail",
            "@_fa": "true",
            "$": "https://api.elsevier.com/content/object/eid/1-s2.0-S0926860X25004764-si0014.svg?httpAccept=%2A%2F%2A",
            "@multimediatype": "Scalable Vector Graphics file",
            "@type": "ALTIMG",
            "@size": "1653",
            "@ref": "si0014",
            "@mimetype": "image/svg+xml"
          },
          {
            "@category": "thumbnail",
            "@_fa": "true",
            "$": "https://api.elsevier.com/content/object/eid/1-s2.0-S0926860X25004764-si0015.svg?httpAccept=%2A%2F%2A",
            "@multimediatype": "Scalable Vector Graphics file",
            "@type": "ALTIMG",
            "@size": "3083",
            "@ref": "si0015",
            "@mimetype": "image/svg+xml"
          },
          {
            "@category": "thumbnail",
            "@_fa": "true",
            "$": "https://api.elsevier.com/content/object/eid/1-s2.0-S0926860X25004764-si0016.svg?httpAccept=%2A%2F%2A",
            "@multimediatype": "Scalable Vector Graphics file",
            "@type": "ALTIMG",
            "@size": "1154",
            "@ref": "si0016",
            "@mimetype": "image/svg+xml"
          },
          {
            "@category": "thumbnail",
            "@_fa": "true",
            "$": "https://api.elsevier.com/content/object/eid/1-s2.0-S0926860X25004764-si0017.svg?httpAccept=%2A%2F%2A",
            "@multimediatype": "Scalable Vector Graphics file",
            "@type": "ALTIMG",
            "@size": "1053",
            "@ref": "si0017",
            "@mimetype": "image/svg+xml"
          },
          {
            "@category": "thumbnail",
            "@_fa": "true",
            "$": "https://api.elsevier.com/content/object/eid/1-s2.0-S0926860X25004764-si0018.svg?httpAccept=%2A%2F%2A",
            "@multimediatype": "Scalable Vector Graphics file",
            "@type": "ALTIMG",
            "@size": "1884",
            "@ref": "si0018",
            "@mimetype": "image/svg+xml"
          },
          {
            "@category": "thumbnail",
            "@_fa": "true",
            "$": "https://api.elsevier.com/content/object/eid/1-s2.0-S0926860X25004764-si0019.svg?httpAccept=%2A%2F%2A",
            "@multimediatype": "Scalable Vector Graphics file",
            "@type": "ALTIMG",
            "@size": "4611",
            "@ref": "si0019",
            "@mimetype": "image/svg+xml"
          },
          {
            "@category": "thumbnail",
            "@_fa": "true",
            "$": "https://api.elsevier.com/content/object/eid/1-s2.0-S0926860X25004764-si0020.svg?httpAccept=%2A%2F%2A",
            "@multimediatype": "Scalable Vector Graphics file",
            "@type": "ALTIMG",
            "@size": "2909",
            "@ref": "si0020",
            "@mimetype": "image/svg+xml"
          },
          {
            "@category": "thumbnail",
            "@_fa": "true",
            "$": "https://api.elsevier.com/content/object/eid/1-s2.0-S0926860X25004764-si0021.svg?httpAccept=%2A%2F%2A",
            "@multimediatype": "Scalable Vector Graphics file",
            "@type": "ALTIMG",
            "@size": "4951",
            "@ref": "si0021",
            "@mimetype": "image/svg+xml"
          },
          {
            "@category": "thumbnail",
            "@_fa": "true",
            "$": "https://api.elsevier.com/content/object/eid/1-s2.0-S0926860X25004764-si0022.svg?httpAccept=%2A%2F%2A",
            "@multimediatype": "Scalable Vector Graphics file",
            "@type": "ALTIMG",
            "@size": "972",
            "@ref": "si0022",
            "@mimetype": "image/svg+xml"
          },
          {
            "@category": "thumbnail",
            "@_fa": "true",
            "$": "https://api.elsevier.com/content/object/eid/1-s2.0-S0926860X25004764-si0023.svg?httpAccept=%2A%2F%2A",
            "@multimediatype": "Scalable Vector Graphics file",
            "@type": "ALTIMG",
            "@size": "1000",
            "@ref": "si0023",
            "@mimetype": "image/svg+xml"
          },
          {
            "@category": "thumbnail",
            "@_fa": "true",
            "$": "https://api.elsevier.com/content/object/eid/1-s2.0-S0926860X25004764-si0024.svg?httpAccept=%2A%2F%2A",
            "@multimediatype": "Scalable Vector Graphics file",
            "@type": "ALTIMG",
            "@size": "1223",
            "@ref": "si0024",
            "@mimetype": "image/svg+xml"
          },
          {
            "@category": "thumbnail",
            "@_fa": "true",
            "$": "https://api.elsevier.com/content/object/eid/1-s2.0-S0926860X25004764-si0025.svg?httpAccept=%2A%2F%2A",
            "@multimediatype": "Scalable Vector Graphics file",
            "@type": "ALTIMG",
            "@size": "1207",
            "@ref": "si0025",
            "@mimetype": "image/svg+xml"
          },
          {
            "@category": "thumbnail",
            "@_fa": "true",
            "$": "https://api.elsevier.com/content/object/eid/1-s2.0-S0926860X25004764-si0026.svg?httpAccept=%2A%2F%2A",
            "@multimediatype": "Scalable Vector Graphics file",
            "@type": "ALTIMG",
            "@size": "1016",
            "@ref": "si0026",
            "@mimetype": "image/svg+xml"
          },
          {
            "@category": "thumbnail",
            "@_fa": "true",
            "$": "https://api.elsevier.com/content/object/eid/1-s2.0-S0926860X25004764-si0027.svg?httpAccept=%2A%2F%2A",
            "@multimediatype": "Scalable Vector Graphics file",
            "@type": "ALTIMG",
            "@size": "1012",
            "@ref": "si0027",
            "@mimetype": "image/svg+xml"
          },
          {
            "@category": "thumbnail",
            "@_fa": "true",
            "$": "https://api.elsevier.com/content/object/eid/1-s2.0-S0926860X25004764-si0028.svg?httpAccept=%2A%2F%2A",
            "@multimediatype": "Scalable Vector Graphics file",
            "@type": "ALTIMG",
            "@size": "3796",
            "@ref": "si0028",
            "@mimetype": "image/svg+xml"
          },
          {
            "@category": "thumbnail",
            "@_fa": "true",
            "$": "https://api.elsevier.com/content/object/eid/1-s2.0-S0926860X25004764-si0029.svg?httpAccept=%2A%2F%2A",
            "@multimediatype": "Scalable Vector Graphics file",
            "@type": "ALTIMG",
            "@size": "1134",
            "@ref": "si0029",
            "@mimetype": "image/svg+xml"
          },
          {
            "@category": "thumbnail",
            "@_fa": "true",
            "$": "https://api.elsevier.com/content/object/eid/1-s2.0-S0926860X25004764-si0030.svg?httpAccept=%2A%2F%2A",
            "@multimediatype": "Scalable Vector Graphics file",
            "@type": "ALTIMG",
            "@size": "1531",
            "@ref": "si0030",
            "@mimetype": "image/svg+xml"
          },
          {
            "@category": "thumbnail",
            "@_fa": "true",
            "$": "https://api.elsevier.com/content/object/eid/1-s2.0-S0926860X25004764-si0031.svg?httpAccept=%2A%2F%2A",
            "@multimediatype": "Scalable Vector Graphics file",
            "@type": "ALTIMG",
            "@size": "2487",
            "@ref": "si0031",
            "@mimetype": "image/svg+xml"
          },
          {
            "@category": "thumbnail",
            "@_fa": "true",
            "$": "https://api.elsevier.com/content/object/eid/1-s2.0-S0926860X25004764-si0032.svg?httpAccept=%2A%2F%2A",
            "@multimediatype": "Scalable Vector Graphics file",
            "@type": "ALTIMG",
            "@size": "1130",
            "@ref": "si0032",
            "@mimetype": "image/svg+xml"
          },
          {
            "@category": "thumbnail",
            "@_fa": "true",
            "$": "https://api.elsevier.com/content/object/eid/1-s2.0-S0926860X25004764-si0033.svg?httpAccept=%2A%2F%2A",
            "@multimediatype": "Scalable Vector Graphics file",
            "@type": "ALTIMG",
            "@size": "4311",
            "@ref": "si0033",
            "@mimetype": "image/svg+xml"
          },
          {
            "@category": "thumbnail",
            "@_fa": "true",
            "$": "https://api.elsevier.com/content/object/eid/1-s2.0-S0926860X25004764-si0034.svg?httpAccept=%2A%2F%2A",
            "@multimediatype": "Scalable Vector Graphics file",
            "@type": "ALTIMG",
            "@size": "1470",
            "@ref": "si0034",
            "@mimetype": "image/svg+xml"
          },
          {
            "@category": "thumbnail",
            "@_fa": "true",
            "$": "https://api.elsevier.com/content/object/eid/1-s2.0-S0926860X25004764-si0035.svg?httpAccept=%2A%2F%2A",
            "@multimediatype": "Scalable Vector Graphics file",
            "@type": "ALTIMG",
            "@size": "1470",
            "@ref": "si0035",
            "@mimetype": "image/svg+xml"
          },
          {
            "@category": "thumbnail",
            "@_fa": "true",
            "$": "https://api.elsevier.com/content/object/eid/1-s2.0-S0926860X25004764-si0036.svg?httpAccept=%2A%2F%2A",
            "@multimediatype": "Scalable Vector Graphics file",
            "@type": "ALTIMG",
            "@size": "3586",
            "@ref": "si0036",
            "@mimetype": "image/svg+xml"
          },
          {
            "@category": "thumbnail",
            "@_fa": "true",
            "$": "https://api.elsevier.com/content/object/eid/1-s2.0-S0926860X25004764-si0037.svg?httpAccept=%2A%2F%2A",
            "@multimediatype": "Scalable Vector Graphics file",
            "@type": "ALTIMG",
            "@size": "3578",
            "@ref": "si0037",
            "@mimetype": "image/svg+xml"
          },
          {
            "@category": "thumbnail",
            "@_fa": "true",
            "$": "https://api.elsevier.com/content/object/eid/1-s2.0-S0926860X25004764-si0038.svg?httpAccept=%2A%2F%2A",
            "@multimediatype": "Scalable Vector Graphics file",
            "@type": "ALTIMG",
            "@size": "1487",
            "@ref": "si0038",
            "@mimetype": "image/svg+xml"
          },
          {
            "@category": "thumbnail",
            "@_fa": "true",
            "$": "https://api.elsevier.com/content/object/eid/1-s2.0-S0926860X25004764-si0039.svg?httpAccept=%2A%2F%2A",
            "@multimediatype": "Scalable Vector Graphics file",
            "@type": "ALTIMG",
            "@size": "1487",
            "@ref": "si0039",
            "@mimetype": "image/svg+xml"
          },
          {
            "@category": "thumbnail",
            "@_fa": "true",
            "$": "https://api.elsevier.com/content/object/eid/1-s2.0-S0926860X25004764-si0040.svg?httpAccept=%2A%2F%2A",
            "@multimediatype": "Scalable Vector Graphics file",
            "@type": "ALTIMG",
            "@size": "1292",
            "@ref": "si0040",
            "@mimetype": "image/svg+xml"
          },
          {
            "@category": "thumbnail",
            "@_fa": "true",
            "$": "https://api.elsevier.com/content/object/eid/1-s2.0-S0926860X25004764-si0041.svg?httpAccept=%2A%2F%2A",
            "@multimediatype": "Scalable Vector Graphics file",
            "@type": "ALTIMG",
            "@size": "1487",
            "@ref": "si0041",
            "@mimetype": "image/svg+xml"
          },
          {
            "@category": "thumbnail",
            "@_fa": "true",
            "$": "https://api.elsevier.com/content/object/eid/1-s2.0-S0926860X25004764-si0042.svg?httpAccept=%2A%2F%2A",
            "@multimediatype": "Scalable Vector Graphics file",
            "@type": "ALTIMG",
            "@size": "1487",
            "@ref": "si0042",
            "@mimetype": "image/svg+xml"
          },
          {
            "@category": "thumbnail",
            "@_fa": "true",
            "$": "https://api.elsevier.com/content/object/eid/1-s2.0-S0926860X25004764-si0043.svg?httpAccept=%2A%2F%2A",
            "@multimediatype": "Scalable Vector Graphics file",
            "@type": "ALTIMG",
            "@size": "1292",
            "@ref": "si0043",
            "@mimetype": "image/svg+xml"
          },
          {
            "@category": "thumbnail",
            "@_fa": "true",
            "$": "https://api.elsevier.com/content/object/eid/1-s2.0-S0926860X25004764-si0044.svg?httpAccept=%2A%2F%2A",
            "@multimediatype": "Scalable Vector Graphics file",
            "@type": "ALTIMG",
            "@size": "1799",
            "@ref": "si0044",
            "@mimetype": "image/svg+xml"
          },
          {
            "@category": "thumbnail",
            "@_fa": "true",
            "$": "https://api.elsevier.com/content/object/eid/1-s2.0-S0926860X25004764-si0045.svg?httpAccept=%2A%2F%2A",
            "@multimediatype": "Scalable Vector Graphics file",
            "@type": "ALTIMG",
            "@size": "2650",
            "@ref": "si0045",
            "@mimetype": "image/svg+xml"
          },
          {
            "@category": "thumbnail",
            "@_fa": "true",
            "$": "https://api.elsevier.com/content/object/eid/1-s2.0-S0926860X25004764-si0046.svg?httpAccept=%2A%2F%2A",
            "@multimediatype": "Scalable Vector Graphics file",
            "@type": "ALTIMG",
            "@size": "4429",
            "@ref": "si0046",
            "@mimetype": "image/svg+xml"
          },
          {
            "@category": "thumbnail",
            "@_fa": "true",
            "$": "https://api.elsevier.com/content/object/eid/1-s2.0-S0926860X25004764-si0047.svg?httpAccept=%2A%2F%2A",
            "@multimediatype": "Scalable Vector Graphics file",
            "@type": "ALTIMG",
            "@size": "4433",
            "@ref": "si0047",
            "@mimetype": "image/svg+xml"
          },
          {
            "@category": "thumbnail",
            "@_fa": "true",
            "$": "https://api.elsevier.com/content/object/eid/1-s2.0-S0926860X25004764-si0048.svg?httpAccept=%2A%2F%2A",
            "@multimediatype": "Scalable Vector Graphics file",
            "@type": "ALTIMG",
            "@size": "1146",
            "@ref": "si0048",
            "@mimetype": "image/svg+xml"
          },
          {
            "@category": "thumbnail",
            "@_fa": "true",
            "$": "https://api.elsevier.com/content/object/eid/1-s2.0-S0926860X25004764-si0049.svg?httpAccept=%2A%2F%2A",
            "@multimediatype": "Scalable Vector Graphics file",
            "@type": "ALTIMG",
            "@size": "1020",
            "@ref": "si0049",
            "@mimetype": "image/svg+xml"
          },
          {
            "@category": "thumbnail",
            "@_fa": "true",
            "$": "https://api.elsevier.com/content/object/eid/1-s2.0-S0926860X25004764-si0050.svg?httpAccept=%2A%2F%2A",
            "@multimediatype": "Scalable Vector Graphics file",
            "@type": "ALTIMG",
            "@size": "972",
            "@ref": "si0050",
            "@mimetype": "image/svg+xml"
          },
          {
            "@category": "thumbnail",
            "@_fa": "true",
            "$": "https://api.elsevier.com/content/object/eid/1-s2.0-S0926860X25004764-si0051.svg?httpAccept=%2A%2F%2A",
            "@multimediatype": "Scalable Vector Graphics file",
            "@type": "ALTIMG",
            "@size": "1401",
            "@ref": "si0051",
            "@mimetype": "image/svg+xml"
          }
        ]
      }
    }
  }
}