{
  "metadata": {
    "title": "Unravelling the significance of catalyst reduction stage for high tar reforming activity in the presence of syngas impurities",
    "authors": "; ; ",
    "journal": "Applied Catalysis A: General",
    "date": "2022-07-25",
    "doi": "10.1016/j.apcata.2022.118711",
    "abstract": "",
    "uri": "https://api.elsevier.com/content/article/pii/S0926860X22002344",
    "pii": "S0926860X22002344"
  },
  "fulltext": {
    "full-text-retrieval-response": {
      "scopus-eid": "2-s2.0-85131829651",
      "originalText": "serial JL 271346 291210 291744 291809 31 Applied Catalysis A: General APPLIEDCATALYSISAGENERAL 2022-06-08 2022-06-08 2022-06-11 2022-06-11 2022-06-15T04:55:02 1-s2.0-S0926860X22002344 S0926-860X(22)00234-4 S0926860X22002344 10.1016/j.apcata.2022.118711 S300 S300.1 FULL-TEXT 1-s2.0-S0926860X22X00136 2024-01-01T12:34:28.416125Z 0 0 20220725 2022 2022-06-08T15:51:29.533355Z absattachment articleinfo articlenumber articletitlenorm authfirstinitialnorm authfirstsurnamenorm cid cids contenttype copyright crossmark dateloaded dateloadedtxt datesearch datesort dateupdated dco docsubtype doctype doi eid ewtransactionid hubeid indexeddate issn issnnorm itemstage itemtransactionid itemweight openaccess openarchive pg pgfirst pii piinorm pubdatestart pubdatetxt pubyr sortorder srctitle srctitlenorm srctype ssids alllist content subj subheadings suppl tomb volfirst volissue volumelist webpdf webpdfpagecount yearnav figure table e-component body mmlmath acknowledge affil appendices articletitle auth authfirstini authfull authkeywords authlast highlightsabst primabst ref specialabst 0926-860X 0926860X true 642 642 C Volume 642 10 118711 118711 118711 20220725 25 July 2022 2022-07-25 2022 article fla © 2022 Elsevier B.V. All rights reserved. UNRAVELLINGSIGNIFICANCECATALYSTREDUCTIONSTAGEFORHIGHTARREFORMINGACTIVITYINPRESENCESYNGASIMPURITIES BINTEMOHAMED D 1 Introduction 2 Experimental 2.1 Materials 2.2 Tar reforming 2.3 Catalyst characterization 3 Results and discussion 3.1 Catalyst properties 3.2 Effect of catalyst reduction on tar reforming 3.3 Effect of pre-reduction temperature on tar reforming 4 Conclusions CRediT authorship contribution statement Acknowledgments Appendix A Supplementary material References CHAN 2019 227 240 W ZHOU 2018 944 953 B ANIS 2011 2355 2377 S SHEN 2013 371 392 Y LIU 2019 250 272 L ZHANG 2018 1086 1109 Z MURKIN 2016 263 269 C JUANJUAN 2009 27 32 J CHENG 2013 15160 15172 F CHENG 2017 121 132 F GARBARINO 2012 281 289 G GARBARINO 2015 21 34 G GARBARINO 2019 929 941 G CHITSAZAN 2016 386 398 S FORZATTI 1999 165 181 P IZQUIERDO 2018 U KUMAR 2020 070007 R YEO 2019 52 70 T BINTEMOHAMED 2020 117779 D BINTEMOHAMED 2021 119435 D DOU 2019 1008 1018 X VEKSHA 2018 25 38 A GAO 2020 100065 X ASHOK 2015 4398 4409 J KATHIRASER 2016 4327 4336 Y ASHOK 2013 13938 13949 J JANGAM 2021 118013 A ASHOK 2020 106252 J ASHOK 2021 120194 J SHOKROLLAHIYANCHESHMEH 2020 118535 M SHANG 2017 302 309 Z RIBEIRO 2010 11725 11732 N VEKSHA 2019 1294 1303 A WANG 2021 119548 H LIU 2021 230 242 G CHAN 2020 117348 W BLANCO 2012 2107 2115 P ZHOU 1991 617 630 R SAMAIN 2014 1 8 L ZHANG 2015 1359 1365 R REMIRO 2018 353 365 A JIMENEZGONZALEZ 2014 7109 7121 C ZHANG 2017 11333 11345 L GHADAMIYAZDI 2017 22199 22207 M COATS 1994 89 94 A LU 2019 2673 2680 P YONEIMA 2016 1374 1377 T TEOH 2019 115561 F PARK 2004 386 399 C TRIMM 1997 233 238 D SEHESTED 2006 103 110 J OEMAR 2015 17834 17842 U PAKSOY 2018 4321 4334 A LIU 2020 408 418 C ASHOK 2019 100003 J CHENG 2016 1 8 F LEGROS 1999 1967 1978 C LIU 2010 133 142 C GOHIER 2008 1331 1338 A ALIPOUR 2014 633 638 Z HE 2017 14439 14448 L HE 2018 7 14 L ZHOU 2015 2508 2516 L ASHOK 2015 116 128 J ASHOK 2014 289 301 J OEMAR 2016 6569 6580 U QUITETE 2017 9873 9880 C SRINAKRUANG 2006 2419 2426 J HERNANDEZ 2019 117977 A LI 2009 351 360 C ZHANG 2014 40 46 R SATO 2007 1697 1701 K JAYAPRAKASH 2021 106871 S BINTEMOHAMEDX2022X118711 BINTEMOHAMEDX2022X118711XD 2024-06-11T00:00:00.000Z 2024-06-11T00:00:00.000Z http://creativecommons.org/licenses/by-nc-nd/4.0/ © 2022 Elsevier B.V. All rights reserved. 0 2022-11-16T01:12:46.341Z http://vtw.elsevier.com/data/voc/AddOnTypes/50.7/aggregated-refined Nanyang Technological University NTU Nanyang Technological University http://data.elsevier.com/vocabulary/SciValFunders/501100001475 http://sws.geonames.org/1880251/ CESEL FACTS The authors would like to acknowledge Dr. Liang Yen Nan from NEWRI Analytics Cluster, Nanyang Technological University, Singapore, for his assistance in operation of Kratos Axis Supra Spectrophotometer, and other NEWRI, CESEL at CEE, and FACTS at MSE staff for assisting in equipment operations and analysis. Dara Khairunnisa Binte Mohamed would also like to thank the Interdisciplinary Graduate Programme and Nanyang Technological University for the PhD scholarship. The authors would like to acknowledge Dr. Liang Yen Nan from NEWRI Analytics Cluster, Nanyang Technological University, Singapore, for his assistance in operation of Kratos Axis Supra Spectrophotometer, and other NEWRI, CESEL at CEE, and FACTS at MSE staff for assisting in equipment operations and analysis. Dara Khairunnisa Binte Mohamed would also like to thank the Interdisciplinary Graduate Programme and Nanyang Technological University for the PhD scholarship. https://doi.org/10.15223/policy-017 https://doi.org/10.15223/policy-037 https://doi.org/10.15223/policy-012 https://doi.org/10.15223/policy-029 https://doi.org/10.15223/policy-004 item S0926-860X(22)00234-4 S0926860X22002344 1-s2.0-S0926860X22002344 10.1016/j.apcata.2022.118711 271346 2024-01-01T12:34:28.416125Z 2022-07-25 1-s2.0-S0926860X22002344-main.pdf https://s3-eu-west-1.amazonaws.com/prod-ucs-content-store-eu-west/content/pii:S0926860X22002344/MAIN/application/pdf/3fccc2f8dd1b8daaca244a3c98d41210/main.pdf main.pdf pdf true 10820397 MAIN 15 1-s2.0-S0926860X22002344-main_1.png https://s3-eu-west-1.amazonaws.com/prod-ucs-content-store-eu-west/content/pii:S0926860X22002344/PREVIEW/image/png/7474ff18ad3673826a85481f5a55a815/main_1.png main_1.png png 56256 849 656 IMAGE-WEB-PDF 1 1-s2.0-S0926860X22002344-gr8.jpg https://s3-eu-west-1.amazonaws.com/prod-ucs-content-store-eu-west/content/pii:S0926860X22002344/gr8/DOWNSAMPLED/image/jpeg/6a1fd6b44df5d4a631e3d77756e9e11d/gr8.jpg gr8 gr8.jpg jpg 18972 227 376 IMAGE-DOWNSAMPLED 1-s2.0-S0926860X22002344-gr9.jpg https://s3-eu-west-1.amazonaws.com/prod-ucs-content-store-eu-west/content/pii:S0926860X22002344/gr9/DOWNSAMPLED/image/jpeg/2ded3c25b105877059dbc9467fb6df26/gr9.jpg gr9 gr9.jpg jpg 14717 222 376 IMAGE-DOWNSAMPLED 1-s2.0-S0926860X22002344-gr6.jpg https://s3-eu-west-1.amazonaws.com/prod-ucs-content-store-eu-west/content/pii:S0926860X22002344/gr6/DOWNSAMPLED/image/jpeg/dd7b9a695f773e992954926bb0bb3425/gr6.jpg gr6 gr6.jpg jpg 44171 735 376 IMAGE-DOWNSAMPLED 1-s2.0-S0926860X22002344-gr7.jpg https://s3-eu-west-1.amazonaws.com/prod-ucs-content-store-eu-west/content/pii:S0926860X22002344/gr7/DOWNSAMPLED/image/jpeg/d0ea660db560bd8178b38e03db40a7a7/gr7.jpg gr7 gr7.jpg jpg 121237 750 565 IMAGE-DOWNSAMPLED 1-s2.0-S0926860X22002344-gr4.jpg https://s3-eu-west-1.amazonaws.com/prod-ucs-content-store-eu-west/content/pii:S0926860X22002344/gr4/DOWNSAMPLED/image/jpeg/c5739a349882e31e6ee67b6751223c17/gr4.jpg gr4 gr4.jpg jpg 44486 733 376 IMAGE-DOWNSAMPLED 1-s2.0-S0926860X22002344-gr5.jpg https://s3-eu-west-1.amazonaws.com/prod-ucs-content-store-eu-west/content/pii:S0926860X22002344/gr5/DOWNSAMPLED/image/jpeg/068b8f5dcab2d675e439596fc0f50b49/gr5.jpg gr5 gr5.jpg jpg 148080 996 562 IMAGE-DOWNSAMPLED 1-s2.0-S0926860X22002344-gr2.jpg https://s3-eu-west-1.amazonaws.com/prod-ucs-content-store-eu-west/content/pii:S0926860X22002344/gr2/DOWNSAMPLED/image/jpeg/c42177cd440c89bcf404be6fcb423efc/gr2.jpg gr2 gr2.jpg jpg 164896 773 715 IMAGE-DOWNSAMPLED 1-s2.0-S0926860X22002344-gr3.jpg https://s3-eu-west-1.amazonaws.com/prod-ucs-content-store-eu-west/content/pii:S0926860X22002344/gr3/DOWNSAMPLED/image/jpeg/10c6751795d12c7e14519f70d11061c7/gr3.jpg gr3 gr3.jpg jpg 39497 405 565 IMAGE-DOWNSAMPLED 1-s2.0-S0926860X22002344-gr1.jpg https://s3-eu-west-1.amazonaws.com/prod-ucs-content-store-eu-west/content/pii:S0926860X22002344/gr1/DOWNSAMPLED/image/jpeg/a316567d5b6b18e17065e0c6fcd1b322/gr1.jpg gr1 gr1.jpg jpg 28323 283 376 IMAGE-DOWNSAMPLED 1-s2.0-S0926860X22002344-gr10.jpg https://s3-eu-west-1.amazonaws.com/prod-ucs-content-store-eu-west/content/pii:S0926860X22002344/gr10/DOWNSAMPLED/image/jpeg/c42aa0b2146cc02d58ec18aeef494d6b/gr10.jpg gr10 gr10.jpg jpg 48551 304 565 IMAGE-DOWNSAMPLED 1-s2.0-S0926860X22002344-gr11.jpg https://s3-eu-west-1.amazonaws.com/prod-ucs-content-store-eu-west/content/pii:S0926860X22002344/gr11/DOWNSAMPLED/image/jpeg/b80fb0b3665d50e84badb442b31eeac4/gr11.jpg gr11 gr11.jpg jpg 123740 596 791 IMAGE-DOWNSAMPLED 1-s2.0-S0926860X22002344-ga1.jpg https://s3-eu-west-1.amazonaws.com/prod-ucs-content-store-eu-west/content/pii:S0926860X22002344/ga1/DOWNSAMPLED/image/jpeg/83fa3fad69908460ed04cf1cfe446353/ga1.jpg ga1 true ga1.jpg jpg 24469 183 500 IMAGE-DOWNSAMPLED 1-s2.0-S0926860X22002344-gr8.sml https://s3-eu-west-1.amazonaws.com/prod-ucs-content-store-eu-west/content/pii:S0926860X22002344/gr8/THUMBNAIL/image/gif/a953c8ed00e298f13e3e86c078a55c18/gr8.sml gr8 gr8.sml sml 6675 132 219 IMAGE-THUMBNAIL 1-s2.0-S0926860X22002344-gr9.sml https://s3-eu-west-1.amazonaws.com/prod-ucs-content-store-eu-west/content/pii:S0926860X22002344/gr9/THUMBNAIL/image/gif/f54ca0536f31bdaa99e9ccea13f1680e/gr9.sml gr9 gr9.sml sml 6611 130 219 IMAGE-THUMBNAIL 1-s2.0-S0926860X22002344-gr6.sml https://s3-eu-west-1.amazonaws.com/prod-ucs-content-store-eu-west/content/pii:S0926860X22002344/gr6/THUMBNAIL/image/gif/f5db816d26d2ec41159cd9f72844bdad/gr6.sml gr6 gr6.sml sml 3819 162 83 IMAGE-THUMBNAIL 1-s2.0-S0926860X22002344-gr7.sml https://s3-eu-west-1.amazonaws.com/prod-ucs-content-store-eu-west/content/pii:S0926860X22002344/gr7/THUMBNAIL/image/gif/061f2c55b0596aabfef53b1146f1e9b1/gr7.sml gr7 gr7.sml sml 9627 163 123 IMAGE-THUMBNAIL 1-s2.0-S0926860X22002344-gr4.sml https://s3-eu-west-1.amazonaws.com/prod-ucs-content-store-eu-west/content/pii:S0926860X22002344/gr4/THUMBNAIL/image/gif/371b36881fd458f50b07c5266ed6e29b/gr4.sml gr4 gr4.sml sml 3684 164 84 IMAGE-THUMBNAIL 1-s2.0-S0926860X22002344-gr5.sml https://s3-eu-west-1.amazonaws.com/prod-ucs-content-store-eu-west/content/pii:S0926860X22002344/gr5/THUMBNAIL/image/gif/e3e0cb9a8e340d932a43b257a8b2fdae/gr5.sml gr5 gr5.sml sml 7838 163 92 IMAGE-THUMBNAIL 1-s2.0-S0926860X22002344-gr2.sml https://s3-eu-west-1.amazonaws.com/prod-ucs-content-store-eu-west/content/pii:S0926860X22002344/gr2/THUMBNAIL/image/gif/99937c1ac032dd8adc8de3d99ee1e8b5/gr2.sml gr2 gr2.sml sml 13353 163 151 IMAGE-THUMBNAIL 1-s2.0-S0926860X22002344-gr3.sml https://s3-eu-west-1.amazonaws.com/prod-ucs-content-store-eu-west/content/pii:S0926860X22002344/gr3/THUMBNAIL/image/gif/6dfd349d0ecc8e98aba94a93553d97dc/gr3.sml gr3 gr3.sml sml 7735 157 219 IMAGE-THUMBNAIL 1-s2.0-S0926860X22002344-gr1.sml https://s3-eu-west-1.amazonaws.com/prod-ucs-content-store-eu-west/content/pii:S0926860X22002344/gr1/THUMBNAIL/image/gif/eb60f74321d2a0387905551ecf659feb/gr1.sml gr1 gr1.sml sml 10464 164 217 IMAGE-THUMBNAIL 1-s2.0-S0926860X22002344-gr10.sml https://s3-eu-west-1.amazonaws.com/prod-ucs-content-store-eu-west/content/pii:S0926860X22002344/gr10/THUMBNAIL/image/gif/b58dfa9c9733763a4b8b4449025a9ea7/gr10.sml gr10 gr10.sml sml 9019 118 219 IMAGE-THUMBNAIL 1-s2.0-S0926860X22002344-gr11.sml https://s3-eu-west-1.amazonaws.com/prod-ucs-content-store-eu-west/content/pii:S0926860X22002344/gr11/THUMBNAIL/image/gif/479f4e0cffa86ffd989f080e980554fe/gr11.sml gr11 gr11.sml sml 16285 164 218 IMAGE-THUMBNAIL 1-s2.0-S0926860X22002344-ga1.sml https://s3-eu-west-1.amazonaws.com/prod-ucs-content-store-eu-west/content/pii:S0926860X22002344/ga1/THUMBNAIL/image/gif/5720d1c5bcad93eeea420244f885e052/ga1.sml ga1 true ga1.sml sml 7462 80 219 IMAGE-THUMBNAIL 1-s2.0-S0926860X22002344-gr8_lrg.jpg https://s3-eu-west-1.amazonaws.com/prod-ucs-content-store-eu-west/content/pii:S0926860X22002344/gr8/HIGHRES/image/jpeg/f413d00386180c8d77a7f005357dfdc5/gr8_lrg.jpg gr8 gr8_lrg.jpg jpg 101402 1006 1663 IMAGE-HIGH-RES 1-s2.0-S0926860X22002344-gr9_lrg.jpg https://s3-eu-west-1.amazonaws.com/prod-ucs-content-store-eu-west/content/pii:S0926860X22002344/gr9/HIGHRES/image/jpeg/2f722e0c4bc3b31e5ad1c164303172ec/gr9_lrg.jpg gr9 gr9_lrg.jpg jpg 72813 984 1663 IMAGE-HIGH-RES 1-s2.0-S0926860X22002344-gr6_lrg.jpg https://s3-eu-west-1.amazonaws.com/prod-ucs-content-store-eu-west/content/pii:S0926860X22002344/gr6/HIGHRES/image/jpeg/53988a6324989b1ad7c48b52553a517f/gr6_lrg.jpg gr6 gr6_lrg.jpg jpg 228558 3253 1663 IMAGE-HIGH-RES 1-s2.0-S0926860X22002344-gr7_lrg.jpg https://s3-eu-west-1.amazonaws.com/prod-ucs-content-store-eu-west/content/pii:S0926860X22002344/gr7/HIGHRES/image/jpeg/28adda7b9676889162658d7c3ab8dc56/gr7_lrg.jpg gr7 gr7_lrg.jpg jpg 697271 3312 2495 IMAGE-HIGH-RES 1-s2.0-S0926860X22002344-gr4_lrg.jpg https://s3-eu-west-1.amazonaws.com/prod-ucs-content-store-eu-west/content/pii:S0926860X22002344/gr4/HIGHRES/image/jpeg/ddd9cd05507817fb0cb4090ddaaedf89/gr4_lrg.jpg gr4 gr4_lrg.jpg jpg 225115 3240 1663 IMAGE-HIGH-RES 1-s2.0-S0926860X22002344-gr5_lrg.jpg https://s3-eu-west-1.amazonaws.com/prod-ucs-content-store-eu-west/content/pii:S0926860X22002344/gr5/HIGHRES/image/jpeg/fdcecc89c475662d8a6a9b69d839c725/gr5_lrg.jpg gr5 gr5_lrg.jpg jpg 883497 4408 2487 IMAGE-HIGH-RES 1-s2.0-S0926860X22002344-gr2_lrg.jpg https://s3-eu-west-1.amazonaws.com/prod-ucs-content-store-eu-west/content/pii:S0926860X22002344/gr2/HIGHRES/image/jpeg/74bc5b82af27837b71a9c4606010586b/gr2_lrg.jpg gr2 gr2_lrg.jpg jpg 1156283 3416 3160 IMAGE-HIGH-RES 1-s2.0-S0926860X22002344-gr3_lrg.jpg https://s3-eu-west-1.amazonaws.com/prod-ucs-content-store-eu-west/content/pii:S0926860X22002344/gr3/HIGHRES/image/jpeg/c2e0700bd9ec9c10e9eb50c60241b118/gr3_lrg.jpg gr3 gr3_lrg.jpg jpg 204361 1787 2495 IMAGE-HIGH-RES 1-s2.0-S0926860X22002344-gr1_lrg.jpg https://s3-eu-west-1.amazonaws.com/prod-ucs-content-store-eu-west/content/pii:S0926860X22002344/gr1/HIGHRES/image/jpeg/5525066c31e51753fd849558cd4b5e53/gr1_lrg.jpg gr1 gr1_lrg.jpg jpg 151863 1253 1663 IMAGE-HIGH-RES 1-s2.0-S0926860X22002344-gr10_lrg.jpg https://s3-eu-west-1.amazonaws.com/prod-ucs-content-store-eu-west/content/pii:S0926860X22002344/gr10/HIGHRES/image/jpeg/ee99e105c2ae8ab290c95221b0f883d3/gr10_lrg.jpg gr10 gr10_lrg.jpg jpg 250817 1344 2495 IMAGE-HIGH-RES 1-s2.0-S0926860X22002344-gr11_lrg.jpg https://s3-eu-west-1.amazonaws.com/prod-ucs-content-store-eu-west/content/pii:S0926860X22002344/gr11/HIGHRES/image/jpeg/9223fee625795f49bf69b2ab267f324c/gr11_lrg.jpg gr11 gr11_lrg.jpg jpg 800731 2631 3493 IMAGE-HIGH-RES 1-s2.0-S0926860X22002344-ga1_lrg.jpg https://s3-eu-west-1.amazonaws.com/prod-ucs-content-store-eu-west/content/pii:S0926860X22002344/ga1/HIGHRES/image/jpeg/08e887b933707e20308bfcde6e198759/ga1_lrg.jpg ga1 true ga1_lrg.jpg jpg 191430 811 2213 IMAGE-HIGH-RES 1-s2.0-S0926860X22002344-mmc1.docx https://s3-eu-west-1.amazonaws.com/prod-ucs-content-store-eu-west/content/pii:S0926860X22002344/mmc1/MAIN/application/vnd.openxmlformats-officedocument.wordprocessingml.document/39b3134d8e8dc569328e7c0b71f07318/mmc1.docx mmc1 mmc1.docx docx 2355707 APPLICATION 1-s2.0-S0926860X22002344-si0003.svg https://s3-eu-west-1.amazonaws.com/prod-ucs-content-store-eu-west/content/pii:S0926860X22002344/STRIPIN/image/svg+xml/71317cbca1e832ce17da727ec1e0e0d9/si0003.svg si0003 si0003.svg svg 3043 ALTIMG 1-s2.0-S0926860X22002344-si0001.svg https://s3-eu-west-1.amazonaws.com/prod-ucs-content-store-eu-west/content/pii:S0926860X22002344/STRIPIN/image/svg+xml/9869b172c098615644737af0f3d93d6a/si0001.svg si0001 si0001.svg svg 1936 ALTIMG 1-s2.0-S0926860X22002344-si0004.svg https://s3-eu-west-1.amazonaws.com/prod-ucs-content-store-eu-west/content/pii:S0926860X22002344/STRIPIN/image/svg+xml/406ddc96452ae7484921381e55706523/si0004.svg si0004 si0004.svg svg 3719 ALTIMG 1-s2.0-S0926860X22002344-si0005.svg https://s3-eu-west-1.amazonaws.com/prod-ucs-content-store-eu-west/content/pii:S0926860X22002344/STRIPIN/image/svg+xml/12ec61664cc4efe99101cfe0a387757b/si0005.svg si0005 si0005.svg svg 3083 ALTIMG 1-s2.0-S0926860X22002344-si0006.svg https://s3-eu-west-1.amazonaws.com/prod-ucs-content-store-eu-west/content/pii:S0926860X22002344/STRIPIN/image/svg+xml/a85c758129f21b578d917e3280b6985c/si0006.svg si0006 si0006.svg svg 3792 ALTIMG 1-s2.0-S0926860X22002344-si0007.svg https://s3-eu-west-1.amazonaws.com/prod-ucs-content-store-eu-west/content/pii:S0926860X22002344/STRIPIN/image/svg+xml/fb7d994c76ce746c89900cf535e840c9/si0007.svg si0007 si0007.svg svg 3237 ALTIMG 1-s2.0-S0926860X22002344-si0008.svg https://s3-eu-west-1.amazonaws.com/prod-ucs-content-store-eu-west/content/pii:S0926860X22002344/STRIPIN/image/svg+xml/769a9f627fda6d354eac8563a2303070/si0008.svg si0008 si0008.svg svg 3902 ALTIMG 1-s2.0-S0926860X22002344-si0009.svg https://s3-eu-west-1.amazonaws.com/prod-ucs-content-store-eu-west/content/pii:S0926860X22002344/STRIPIN/image/svg+xml/dc9a2f58f6ea1290c7b202cabdd17a74/si0009.svg si0009 si0009.svg svg 3314 ALTIMG 1-s2.0-S0926860X22002344-si0010.svg https://s3-eu-west-1.amazonaws.com/prod-ucs-content-store-eu-west/content/pii:S0926860X22002344/STRIPIN/image/svg+xml/24504c69effed84d46a4c718b67d2343/si0010.svg si0010 si0010.svg svg 4157 ALTIMG 1-s2.0-S0926860X22002344-si0011.svg https://s3-eu-west-1.amazonaws.com/prod-ucs-content-store-eu-west/content/pii:S0926860X22002344/STRIPIN/image/svg+xml/63b8c19ab9c727aa74d3529175260f1c/si0011.svg si0011 si0011.svg svg 3136 ALTIMG 1-s2.0-S0926860X22002344-si0012.svg https://s3-eu-west-1.amazonaws.com/prod-ucs-content-store-eu-west/content/pii:S0926860X22002344/STRIPIN/image/svg+xml/cfba681f2c094dcce2fcdefd5394e1e5/si0012.svg si0012 si0012.svg svg 3014 ALTIMG 1-s2.0-S0926860X22002344-si0013.svg https://s3-eu-west-1.amazonaws.com/prod-ucs-content-store-eu-west/content/pii:S0926860X22002344/STRIPIN/image/svg+xml/2d1fe4c57a971c47f34d34cc008a4f53/si0013.svg si0013 si0013.svg svg 3055 ALTIMG 1-s2.0-S0926860X22002344-si0014.svg https://s3-eu-west-1.amazonaws.com/prod-ucs-content-store-eu-west/content/pii:S0926860X22002344/STRIPIN/image/svg+xml/2a27787882705ff45715a63d6cca30a7/si0014.svg si0014 si0014.svg svg 2966 ALTIMG 1-s2.0-S0926860X22002344-si0015.svg https://s3-eu-west-1.amazonaws.com/prod-ucs-content-store-eu-west/content/pii:S0926860X22002344/STRIPIN/image/svg+xml/e11cf2aae9b178c1101b93c65748bf77/si0015.svg si0015 si0015.svg svg 1223 ALTIMG 1-s2.0-S0926860X22002344-si0016.svg https://s3-eu-west-1.amazonaws.com/prod-ucs-content-store-eu-west/content/pii:S0926860X22002344/STRIPIN/image/svg+xml/a944d99ee20b6c0feae9152b3433e806/si0016.svg si0016 si0016.svg svg 1146 ALTIMG 1-s2.0-S0926860X22002344-si0017.svg https://s3-eu-west-1.amazonaws.com/prod-ucs-content-store-eu-west/content/pii:S0926860X22002344/STRIPIN/image/svg+xml/7748ba9164451783d15dec7022d12a09/si0017.svg si0017 si0017.svg svg 972 ALTIMG 1-s2.0-S0926860X22002344-si0018.svg https://s3-eu-west-1.amazonaws.com/prod-ucs-content-store-eu-west/content/pii:S0926860X22002344/STRIPIN/image/svg+xml/7011a196b0d28955b059ee47823a4766/si0018.svg si0018 si0018.svg svg 1016 ALTIMG 1-s2.0-S0926860X22002344-si0019.svg https://s3-eu-west-1.amazonaws.com/prod-ucs-content-store-eu-west/content/pii:S0926860X22002344/STRIPIN/image/svg+xml/d86ff58baa6e78403c67cbdf0748728c/si0019.svg si0019 si0019.svg svg 1012 ALTIMG 1-s2.0-S0926860X22002344-si0002.svg https://s3-eu-west-1.amazonaws.com/prod-ucs-content-store-eu-west/content/pii:S0926860X22002344/STRIPIN/image/svg+xml/5d7975395d9e4bf048ecf9ded696fb42/si0002.svg si0002 si0002.svg svg 972 ALTIMG 1-s2.0-S0926860X22002344-am.pdf am am.pdf pdf 2568557 AAM-PDF https://s3-eu-west-1.amazonaws.com/prod-ucs-content-store-eu-west/content/egi:10786CM3DDF/MAIN/application/pdf/f0551b390707c9e5adf0e8801c4d5d2a/am.pdf APCATA 118711 118711 S0926-860X(22)00234-4 10.1016/j.apcata.2022.118711 Elsevier B.V. Fig. 1 Tar reforming setup. Fig. 1 Fig. 2 (a) SEM image of catalyst with EDX Ni, Al and O elemental imaging, (b) SEM image of catalyst at high magnification showing nanoparticles, (c) TEM image of catalyst with EDX Ni, Al and O elemental imaging, and (d) HRTEM image of the fresh NiAl2O4 catalyst. Fig. 2 Fig. 3 (a) XRD, (b) TPR and (c) XPS profiles of the fresh NiAl2O4 catalyst. Fig. 3 Fig. 4 (a) Naphthalene, (b) toluene and (c) styrene conversions over pre-reduced and as-calcined NiAl2O4 catalyst. (Experimental conditions: 0.3 mL catalyst, 0.13 vol% naphthalene, 0.13 vol% toluene, 0.13 vol% styrene, 50 ppmv H2S, 500 ppmv HCl, 24 vol% H2O, 9 vol% H2, 9 vol% CO2, 10 vol% CO, GHSV = 40 000 h−1 at 800 °C). Fig. 4 Fig. 5 TEM and EDX images of spent (a) pre-reduced and (b) as-calcined catalysts in the presence of 50 ppmv H2S and 500 ppmv HCl. EDX images shows the elemental mappings of Ni, S and Cl. (c) TEM and EDX images of spent as-calcined catalyst taken at a different location showing carbon formation. Fig. 5 Fig. 6 (a) Naphthalene, (b) toluene and (c) styrene conversions over as-calcined NiAl2O4 catalysts in different concentrations of impurities: 0/50 ppmv H2S and 0/500 ppmv HCl at 800 °C. (Experimental conditions: 0.3 mL catalyst, 0.13 vol% naphthalene, 0.13 vol% toluene, 0.13 vol% styrene, 24 vol% H2O, 9 vol% H2, 9 vol% CO2, 10 vol% CO, GHSV = 40 000 h−1). Fig. 6 Fig. 7 (a) Carbon formation on spent as-calcined catalysts with 0 ppmv H2S and 0 ppmv HCl, and (b) 0 ppmv H2S and 500 ppmv HCl. (c) Raman spectra of the pre-reduced and as-calcined catalysts. Fig. 7 Fig. 8 Ni particle size distribution of spent pre-reduced and as-calcined catalysts. Fig. 8 Fig. 9 Average naphthalene, toluene and styrene conversion of NiAl2O4 catalyst pre-reduced at different temperatures. (Experimental conditions: 0.3 mL catalyst, 0.13 vol% naphthalene, 0.13 vol% toluene, 0.13 vol% styrene, 50 ppmv H2S, 500 ppmv HCl, 24 vol% H2O, 9 vol% H2, 9 vol% CO2, 10 vol% CO, GHSV = 40 000 h−1). Fig. 9 Fig. 10 (a) XPS and (b) XRD profiles of catalysts after reduction at 800 900 and 1000 °C. Fig. 10 Fig. 11 (a) TEM and EDS elemental mappings of Pre-reduced-1000, (b) TEM and EDS elemental mappings of Pre-reduced-900 showing carbon formation, (c)TEM image of carbon formed by tip-growth mechanism on spent catalyst reduced at 1000 °C. Fig. 11 Table 1 Comparison of pre-reduced and previously reported catalysts used for tar reforming in the presence of impurities. Table 1 Catalyst Reaction type T (°C) Time Gas feed Impurities Activity (conversion) Ref. 0.4Ni-0Fe/Al2O3 (23 wt% Ni) Steam reforming of naphthalene 790 5 h Naphthalene = 0.14 vol%, H2 = 10 vol%, H2O = 26 vol%GHSV = 24 000 h−1 H2S: 50 ppmvHCl: 300 ppmv ~40% [22] 0.4Ni-0.1Fe/Al2O3 (25 wt% Ni) Steam reforming of naphthalene 790 5 h Naphthalene = 0.14 vol%, H2 = 10 vol%, H2O = 26 vol%GHSV = 24 000 h−1 H2S: 50 ppmvHCl: 300 ppmv ~42% [22] LaNiO3 Steam reforming of toluene 800 10 h H2O/toluene = 3GHSV = 20 000 mLg−1 h−1 H2S: 50 ppmv 27% [68] LaNi0.5Mn0.5O3 Steam reforming of toluene 800 10 h H2O/toluene = 3GHSV = 20 000 mLg−1 h−1 H2S: 50 ppmv 42% [68] Ni/dolomite(10 wt% Ni) Steam reforming of toluene and naphthalene 800 5 h Toluene+naphthalene = 1.4 mol%, H2O/C (mole ratio) = 5, H2/C = 1.3W(catalyst weight)/F(flow rate) = 0.55 g h/mol H2S: 200 ppm ~65% [69] Ni/Al2O3 (10 wt% Ni) Steam reforming of toluene and naphthalene 800 5 h Toluene+naphthalene = 1.4 mol%, H2O/C (mole ratio) = 5, H2/C = 1.3W(catalyst weight)/F(flow rate) = 0.55 g h/mol H2S: 200 ppm ~38% [69] Ni/SiO2 (10 wt% Ni) Steam reforming of toluene and naphthalene 800 5 h Toluene+naphthalene = 1.4 mol%, H2O/C (mole ratio) = 5, H2/C = 1.3W(catalyst weight)/F(flow rate) = 0.55 g h/mol H2S: 200 ppm 20% [69] Ni/Al2O3 (10 wt% Ni) Steam reforming of benzene 800 2 h Benzene = 0.095 vol%, H2 = 50 vol%, H2O = 48.7 vol%, CO = 5.3 vol%GHSV = 76 000 h−1 H2S: 25 ppm ~25% [70] Ni/Al2O3 (10 wt% Ni) Steam reforming of benzene 800 2 h Benzene = 0.095 vol%, H2 = 50 vol%, H2O = 48.7 vol%, CO = 5.3 vol%GHSV = 76 000 h−1 H2S: 50 ppm ~15% [70] Ni/Al2O3 (10 wt% Ni) Steam reforming of benzene 800 2 h Benzene = 0.095 vol%, H2 = 50 vol%, H2O = 48.7 vol%, CO = 5.3 vol%GHSV = 76 000 h−1 H2S: 75 ppm ~10% [70] Ni/Al2O3 (10 wt% Ni) Steam reforming of benzene 800 2 h Benzene = 0.095 vol%, H2 = 50 vol%, H2O = 48.7 vol%, CO = 5.3 vol%GHSV = 76 000 h−1 H2S: 100 ppm ~7% [70] Ni/Al2O3 (10 wt% Ni) Steam reforming of benzene 800 2 h Benzene = 0.095 vol%, H2 = 50 vol%, H2O = 48.7 vol%, CO = 5.3 vol%GHSV = 76 000 h−1 H2S: 200 ppm ~5% [70] Ni/mayenite(5 wt% Ni) Steam reforming of toluene 800 4 h Toluene = 4000 ppm, steam/C ratio = 1.9SV = 6000 h−1 H2S: 500 ppm ~72% (after 220 min) [71] Ni/mayenite(3 wt% Ni) Steam reforming of toluene 800 4 h Toluene = 4000 ppm, steam/C ratio = 1.9SV = 6000 h−1 H2S: 500 ppm ~66% (after 220 min) [71] Ni/Al2O3 (5 wt% Ni) Steam reforming of toluene 800 4 h Toluene = 4000 ppm, steam/C ratio = 1.9SV = 6000 h−1 H2S: 500 ppm ~72% (after 200 min) [71] Ni/MgO0.5/CaO0.5 (5 wt% Ni) Steam reforming of toluene 800 4 h Toluene = 4000 ppm, steam/C ratio = 1.9SV = 6000 h−1 H2S: 500 ppm ~74% (from 15 to 200 min) [71] Ni/olivine(3 wt% Ni) Steam reforming of toluene 790 3 h S/C (toluene) = 3.5SV = 782 h−1 H2S: 10 ppm ~20% [72] Ni-Ce/olivine(3 wt% Ni) Steam reforming of toluene 790 3 h S/C (toluene) = 3.5SV = 782 h−1 H2S: 10 ppm ~52% [72] Ni-Ce-Mg/olivine(3 wt% Ni) Steam reforming of toluene 790 3 h S/C (toluene) = 3.5SV = 782 h−1 H2S: 10 ppm ~91% [72] NiW-6/MgO-CaO(25 wt% NiO, 6 wt% WO3) Steam reforming of naphthalene and toluene 800 10 h Naphthalene/toluene = 20/60 g/mN 3, H2 = 20 vol%, H2O = 18 vol%, CO2 = 5 vol%, CO = 5 vol%GHSV = 14 000 h−1 H2S: 300 ppm ~61% [73] NiW-12/MgO-CaO(25 wt% NiO, 12 wt% WO3) Steam reforming of naphthalene and toluene 800 10 h Naphthalene/toluene = 20/60 g/mN 3, H2 = 20 vol%, H2O = 18 vol%, CO2 = 5 vol%, CO = 5 vol%GHSV = 14 000 h−1 H2S: 300 ppm ~60% [73] NiW-18/MgO-CaO(25 wt% NiO, 18 wt% WO3) Steam and dry reforming of naphthalene and toluene 800 10 h Naphthalene/toluene = 20/60 g/mN 3, H2 = 20 vol%, H2O = 18 vol%, CO2 = 5 vol%, CO = 5 vol%GHSV = 14 000 h−1 H2S: 300 ppm ~68% [73] NiW-23/MgO-CaO(25 wt% NiO, 23 wt% WO3) Steam and dry reforming of naphthalene and toluene 800 10 h Naphthalene/toluene = 20/60 g/mN 3, H2 = 20 vol%, H2O = 18 vol%, CO2 = 5 vol%, CO = 5 vol%GHSV = 14 000 h−1 H2S: 300 ppm ~65% [73] Ni/MgO-CaO(25 wt% NiO) Steam and dry reforming of naphthalene and toluene 800 10 h Naphthalene/toluene = 20/60 g/mN 3, H2 = 20 vol%, H2O = 18 vol%, CO2 = 5 vol%, CO = 5 vol%GHSV = 14 000 h−1 H2S: 300 ppm ~45% [73] Ni(ur)/Al2O3 (10 wt% Ni) Steam and dry reforming naphthalene 800 10 h Naphthalene = 0.055 vol%, H2O = 24 vol%, H2 = 9 vol%, CO = 10 vol%, CO2 = 9 vol%GHSV = 24 000 h−1 H2S: 50 ppmvHCl: 2000 ppmv 80% [20] Ni(dmf)/Al2O3 (10 wt% Ni) Steam and dry reforming naphthalene 800 10 h Naphthalene = 0.055 vol%, H2O = 24 vol%, H2 = 9 vol%, CO = 10 vol%, CO2 = 9 vol%GHSV = 24 000 h−1 H2S: 50 ppmvHCl: 2000 ppmv 71% [20] Ni(mur)/Al2O3 (10 wt% Ni) Steam and dry reforming naphthalene 800 10 h Naphthalene = 0.055 vol%, H2O = 24 vol%, H2 = 9 vol%, CO = 10 vol%, CO2 = 9 vol%GHSV = 24 000 h−1 H2S: 50 ppmvHCl: 2000 ppmv 62% [20] Ni(mmur)/Al2O3 (10 wt% Ni) Steam and dry reforming naphthalene 800 10 h Naphthalene = 0.055 vol%, H2O = 24 vol%, H2 = 9 vol%, CO = 10 vol%, CO2 = 9 vol%GHSV = 24 000 h−1 H2S: 50 ppmvHCl: 2000 ppmv 59% [20] Ni(dmur)/Al2O3 (10 wt% Ni) Steam and dry reforming naphthalene 800 10 h Naphthalene = 0.055 vol%, H2O = 24 vol%, H2 = 9 vol%, CO = 10 vol%, CO2 = 9 vol%GHSV = 24 000 h−1 H2S: 50 ppmvHCl: 2000 ppmv 68% [20] 0Ce-NMA (7 wt% Ni) CeO2-NiO-MgO-Al2O3 Steam reforming of toluene 750 15 min Steam/ C(Toluene) = 2 H2S: 50 ppmv 70% [74] 5Ce-NMA (7 wt% Ni) CeO2-NiO-MgO-Al2O3 Steam reforming of toluene 750 15 min Steam/ C(Toluene) = 2 H2S: 50 ppmv 59% [74] 10Ce-NMA (7 wt% Ni) CeO2-NiO-MgO-Al2O3 Steam reforming of toluene 750 15 min Steam/ C(Toluene) = 2 H2S: 50 ppmv 56% [74] 15Ce-NMA (7 wt% Ni) CeO2-NiO-MgO-Al2O3 Steam reforming of toluene 750 15 min Steam/ C(Toluene) = 2 H2S: 50 ppmv 65% [74] 20Ce-NMA (7 wt% Ni) CeO2-NiO-MgO-Al2O3 Steam reforming of toluene 750 15 min Steam/ C(Toluene) = 2 H2S: 50 ppmv 80% [74] NiAl2O4 (14 wt% Ni) Steam and dry reforming of naphthalene, toluene and styrene 800 5 h Naphthalene = 0.13 vol%, Toluene = 0.13 vol%, Styrene = 0.13 vol%, H2O = 24 vol%, H2 = 9 vol%, CO = 10 vol%, CO2 = 9 vol%GHSV = 40 000 h−1 H2S: 50 ppmvHCl: 500 ppmv Naphthalene = 61%, Toluene = 50%, Styrene = 96% This work Table 2 Atomic concentrations and surface Ni coverage as measured by XPS analysis and C and S contents of as-calcined and pre-reduced catalysts from CHNS analysis. Table 2 Catalyst Atomic concentration (at%) CHNS Al Ni O S Cl S/Ni Cl/Ni C wt% S wt% Pre-reduced-800 23.3 1.9 74.6 < 0.01 0.20 < 0.01 0.11 b.d.l. b.d.l. As-calcined 41.2 0.6 58.1 0.10 0.07 0.19 0.12 2.99 1.16 b.d.l. – below detection limits. Table 3 Ni active surface area and dispersion at different pre-reduction temperatures determined by H2-pulse chemisorption. Table 3 Catalyst Ni active surface area (m2 gNi −1) Ni dispersion (%) Pre-reduced-800 17.9 18.9 Pre-reduced-900 28.2 29.7 Pre-reduced-1000 16.9 17.8 Table 4 Surface Ni0 and Ni2+ distribution and binding energies in the reduced catalysts determined from XPS analysis. Table 4 Catalyst Peak 1 (Ni0) Peak 2 (Ni2+) Content (at%) Binding energy (eV) Content (at%) Binding energy (eV) Pre-reduced-800 29.2 853.0 70.8 855.6 Pre-reduced-900 33.4 853.0 66.6 856.0 Pre-reduced-1000 36.0 853.4 64.0 856.2 Table 5 Properties of reduced and spent catalysts. Table 5 Catalysts Pre-reduced (before reforming) Pre-reduced (after reforming) BET surface area (m2 g−1) Ni0 a crystallite size (nm) a BET surface area (m2 g−1) Ni0 crystallite size (nm) a Pre-reduced-800 124 11 95 17 Pre-reduced-900 111 11 95 16 Pre-reduced-1000 92 14 86 19 a Calculated from Ni (111) XRD peaks at 2θ = ~44° using the Scherrer equation. Unravelling the significance of catalyst reduction stage for high tar reforming activity in the presence of syngas impurities Dara Khairunnisa Binte Mohamed Conceptualization Formal analysis Investigation Writing – original draft Writing – review & editing a b c Andrei Veksha Writing – review & editing c Quan Luu Manh Ha Conceptualization Supervision Writing – original draft Writing – review & editing c ⁎ Teik-Thye Lim Writing – review & editing a b c Grzegorz Lisak Conceptualization Supervision Writing – review & editing a b c ⁎⁎ a School of Civil and Environmental Engineering, Nanyang Technological University, Singapore 639798, Singapore School of Civil and Environmental Engineering, Nanyang Technological University Singapore 639798 Singapore School of Civil and Environmental Engineering, Nanyang Technological University, Singapore 639798, Singapore b Interdisciplinary Graduate Programme, Nanyang Technological University, 50 Nanyang Avenue, Singapore 639798, Singapore Interdisciplinary Graduate Programme, Nanyang Technological University 50 Nanyang Avenue Singapore 639798 Singapore Interdisciplinary Graduate Programme, Nanyang Technological University, 50 Nanyang Avenue, Singapore 639798, Singapore c Residues and Resource Reclamation Centre, Nanyang Environment and Water Research Institute, Nanyang Technological University, 1 Cleantech Loop, CleanTech One, Singapore 637141, Singapore Residues and Resource Reclamation Centre, Nanyang Environment and Water Research Institute, Nanyang Technological University 1 Cleantech Loop, CleanTech One Singapore 637141 Singapore Residues and Resource Reclamation Centre, Nanyang Environment and Water Research Institute, Nanyang Technological University, 1 Cleantech Loop, CleanTech One, Singapore 637141, Singapore ⁎ Corresponding author. ⁎⁎ Corresponding author at: School of Civil and Environmental Engineering, Nanyang Technological University, Singapore 639798, Singapore. School of Civil and Environmental Engineering, Nanyang Technological University Singapore 639798 Singapore Ni catalysts are used widely in tar reforming for syngas purification. This study investigates the aim of the reduction stage toward Ni catalysts during tar reforming in the presence of syngas impurities. A NiAl2O4 catalyst was used for the reforming of a mixture of tar model compounds (naphthalene, toluene, and styrene) in simulated syngas containing 50 ppmv H2S and 500 ppmv HCl. The catalyst exhibited activity in tar reforming even without the pre-reduction treatment, but it was deactivated rapidly due to the favored reaction between H2S and Ni2+ species, causing increased Ni agglomeration and carbon deposition. Pre-reduction of catalysts enhanced the catalyst stability even in the presence of syngas impurities. Higher reforming activity was achieved by increasing the reduction temperature from 800 °C to 900 °C. However, transformation in the support structure at higher reducing temperature could lead to decreased exposure of Ni due to the collapse of pore structures. Graphical Abstract ga1 Keywords Catalytic reforming Reduction Tar model compound Nickel catalyst Sintering 1 Introduction Tar generated from the thermal decomposition of organic material (e.g., waste and biomass) consists of aromatic hydrocarbons such as toluene, naphthalene, styrene, and others [1,2]. These cause challenges during downstream applications of syngas, which may require a purification step [3,4]. Catalytic tar reforming is considered a potential syngas purification process as it can be operated at temperatures close to the outlet of the gasifier. This high-temperature process eliminates the requirement for gas cooling to remove tar compounds and maintain thermal efficiency [5]. The preferred catalysts used for tar reforming are Ni-based due to their low Ni cost and wide availability [6]. Ni-based catalysts were initially developed for methane steam reforming, after which they were found suitable also for tar reforming [7,8]. Typically, Ni catalysts undergo calcination during the production process that converts Ni species into oxide and spinel compounds. These species can be reduced with H2 prior to reforming to maximize active metal content, namely Ni0 (Eq. 1). The reduction of NiO with H2 proceeds through the following steps: (1) dissociation of H2 over NiO (2) diffusion of H atoms over the Ni surface towards the reduction centers, (3) breaking of Ni-O bonds to form Ni0, (4) nucleation of Ni0 forming clusters of metallic Ni and (5) growth of metallic Ni clusters to form crystallites. These Ni0 crystallites allow the sorption of reactants on the catalyst surface and activate the steam/CO2 reforming of hydrocarbon. (1) NiO + H 2 → Ni + H 2 O It was previously reported that Ni/Al2O3 catalyst could be used for dry CH4 reforming (CH4:CO2:He = 10:10:80 on a volume basis) without pre-reduction and the conversion efficiency was comparable to the pre-reduced catalyst (84% and 87% CH4 conversion, respectively) [9]. Other studies demonstrated that without pre-reduction, Ni catalysts have high activities during steam reforming of various hydrocarbons, including acetic acid [10], ethanol [11–14], acetone [11], furfural [11], glucose [11], phenol [12,13,15], methanol and naphthalene [15]. One of the limitations of these studies is that the testing of catalysts was conducted using model gas compositions that are different from the actual syngas generated during gasification of biomass or waste. Actual syngas, consisting of H2, CO, CO2, H2O, often contain impurities such as S-based compounds, halogens, and others [16–18]. In pre-reduced catalysts, chemisorption of sulfur compounds onto the active Ni forms the inactive Ni-S complex, while halide compounds chemisorb onto the active Ni and increase the surface mobility of the Ni-halide species, which leads to an increased Ni sintering [19–24]. Many studies have focused on the steam reforming of tar model compounds [25–29], as well as removal of model tar in the presence of impurities [19,24,30]. However, tar reforming studies using conditions simulating real conditions, as well as with the use of a mixture of tar compounds and impurities, are still lacking. Such operations can be complex due to the multiple components in the gas feed. Furthermore, it is not well understood how the exposure to syngas containing multiple tar components and impurities can affect the activity of Ni catalysts in its pre-reduced and as-calcined state. Such information could shed light on the development of effective strategies for the application of tar reforming catalysts in practical conditions of municipal solid waste gasification. This study examined the influence of the pre-reduction stage on the tar reforming activity of Ni catalysts in syngas containing main gas components and impurities such as HCl and H2S. A NiAl2O4 catalyst was used due to the high stability and activity of Ni aluminate catalysts in the presence of impurities attributing to a strong Ni and Al2O3 support interaction [20,21]. Ni particles in such catalysts are highly dispersed and thermo-physically stable due to the formation of Ni-O-Al interfaces that prevent Ni agglomeration [31–33]. The as-calcined catalyst and other counterparts pre-reduced at different temperatures were used to reform naphthalene, toluene, and styrene in the gas stream. Those three components are the main stable tar compounds in syngas from biomass and waste [1,34]. The gas composition was prepared to simulate the composition of actual syngas from gasification (H2 9 vol%, CO2 9 vol%, CO 10 vol%, H2O 24 vol%, 500 ppmv HCl and 50 ppmv H2S) [35,36]. The structural changes in the as-calcined and pre-reduced catalysts upon exposure to syngas were characterized and associated with differences in catalytic activity. 2 Experimental 2.1 Materials The NiAl2O4 catalyst (14 wt% Ni) was prepared using a hydrothermal method. Urea was used as a precipitant and cetyltrimethylammonium bromide (CTAB) as a surfactant to improve the dispersion of Ni particles. 1.7506 g nickel(II) nitrate hexahydrate (Ni(NO3)·6 H2O, Sigma-Aldrich), 15.08 g aluminium nitrate nonahydrate (Al(NO3)30.9 H2O, Sigma Aldrich), 5.552 g urea (CO(NH3)2, Sigma-Aldrich) and 1.4037 g CTAB (CH3(CH2)15N(Br)(CH3)3, Sigma Aldrich) were mixed in deionized water to make up a 120 mL solution and sonicated until homogenization. The solution was poured into a 200 mL capacity autoclave reactor and heated to 180 °C for 18 h in an oven. Once the reaction was completed and the solution cooled, the precipitate produced was separated by centrifugation and washed with water for 3–4 times. The precipitate collected was dried overnight at 100 °C in an oven and further calcined for 3 h at 650 °C in air (5 °C min−1 ramping rate). The calcined catalyst was crushed and sieved to obtain 150–315 µm particle sizes for catalytic evaluation. 2.2 Tar reforming The catalyst activity was tested in a tar reforming setup, as illustrated in Fig. 1. Naphthalene, toluene, and styrene were used as model tar compounds for the reforming, as these are the most prevalent tar compounds produced from the gasification of biomass and solid waste [1,34,37,38]. Naphthalene was vaporized using an evaporator and introduced into the gas feed with an N2 gas stream. Toluene and styrene were introduced into the gas stream with a syringe pump connected to the gas line. Another syringe pump filled with an aqueous solution of HCl was used to introduce steam and HCl. Gas lines were heated to above 150 °C to prevent condensation of gas components. In each test, a quartz reactor fitted with a 50–90 µm fritted disc was packed with 0.3 mL catalyst. Two types of experiments were conducted to investigate the influence of catalyst reduction. In one group of experiments, a freshly synthesized catalyst containing Ni in the oxidized state or Ni2+, hereafter referred to as “as-calcined” catalyst, was heated to 800 °C (heating rate = 15 °C min−1) in a pure N2 with 50 mL min− 1 flow and allowed to stabilize at this temperature for 15 min prior to the reforming. No pre-reduction of the catalyst was carried out before reforming. In another group of experiments, the catalysts were reduced in 20 vol% H2/N2 from room temperature and heated with a rate of 15 °C min−1 to 800 900, or 1000 °C and maintained at those temperatures for 30 min prior to the reactions. The catalysts were denoted as “pre-reduced-T”, where T is the corresponding reduction temperature. Tar reforming was carried out at 800 °C in a gas stream mixture containing 0.13 vol% naphthalene, 0.13 vol% toluene and 0.13 vol% styrene –50 ppmv H2S – 500 ppmv HCl – 24 vol% H2O – 9 vol% H2 – 9 vol% CO2 – 10 vol% CO (wet basis) and balance N2. The total gas flow rate was 200 mL-STP min−1 (GHSV = 40 000 h−1). Samples for tar and gas were collected for 5 h at hourly intervals. For the gas sampling procedure, gas was streamed for 5 min into Tedlar bags, and the gas content was analyzed using a calibrated GC (Agilent 7890B) equipped with a flame ionization detector and two thermal conductivity detectors. Sampling for tar compounds was carried out using a pump (Gilian GilAir Plus) directing a 200 mL gas flow through solid phase adsorption (SPA) tube packed with aminopropyl-bonded silica gel (500 mg Bond Elut NH2, 3 mL, Agilent). 2 mL of dichloromethane was used to elute naphthalene, toluene, and styrene from the SPA tubes. The eluate was collected into a vial and diluted to obtain a 1:10 ratio of eluate to dichloromethane. Naphthalene, toluene, and styrene were quantified with a calibrated GC-MS (Agilent 7890B GC and 5977 A MSD). The reforming experiments were triplicated, and the results are expressed as averages of experimental runs ± standard deviations. 2.3 Catalyst characterization The fresh, pre-reduced and spent catalyst samples were characterized by several techniques. Morphology of catalyst was characterized using field emission scanning electron microscopy (FESEM, JEOL JSM-7600 F) and transmission electron microscopy (TEM, JEOL JEM-1400Plus) with an accelerating voltage of 120 kV. Ni, Al, S, Cl, and C elemental mappings of the catalysts were taken with an Energy-Dispersive X-ray spectroscope (EDX, Oxford Instruments) coupled to the FESEM and TEM. ImageJ software was used to calculate the diameters of 150–200 Ni particles, which were assumed to be spherical, in the pre-reduced and spent catalysts to obtain the Ni particle size distribution. BET specific surface areas and total pore volumes were quantified using a Quantachrome Autosorb-1 Analyzer from the measurement of N2 adsorption and desorption isotherms at − 196 °C. X-Ray diffraction (XRD) patterns were analyzed by a X-ray diffractometer with a Cu-Kα radiation source (PANalytical XPert Pro XRD). Ni reducibility of the fresh catalyst was measured with a temperature programmed reduction with hydrogen (H2-TPR) carried out in a 30 mL min−1 flow rate gas mixture of 5% H2/Ar with temperatures from 50° to 900°C (5 °C min−1 ramping rate). The catalyst was pre-treated with 5% O2/Ar at 600 C for 30 min to remove any impurities and cooled to room temperature prior to the TPR test. Ni dispersion and active Ni surface area at different reduction temperatures were determined through H2-pulse chemisorption (Autochem II 2920) at 40 °C. The catalyst samples were firstly reduced in-situ with a 50 mL min−1 flow rate of 10% H2/Ar at 800 900 and 1000 °C for 30 min (10 °C min−1 ramping rate) and cooled to room temperature. H2 pulses were injected until the eluted peak areas were constant. Ni, Al, S and Cl surface contents of the spent catalysts were obtained by X-ray photoelectron spectroscopy (XPS) measurements were performed using a Kratos Axis Supra Spectrophotometer with dual anode monochromatic Kα excitation source. XPS analysis of the pre-reduced samples were obtained ex-situ; samples were kept in a N2 atmosphere as much as possible and the data was collected within 1–2 days after pre-reduction. CASA XPS software was used to process the XPS peaks, and analysis of the binding energies of Ni, Al, S, and Cl were corrected against an adventitious carbon C 1 s with a binding energy of 284.8 eV. Carbon and sulfur content in the spent catalysts were obtained with a CHNS elemental analyzer (Elementar Vario EL Cube). The structural form of carbon deposited was characterized by Raman spectroscopy using a laser wavelength of 532 nm (XploRA PLUS, Horiba Scientific). 3 Results and discussion 3.1 Catalyst properties SEM and TEM images of the freshly synthesized catalyst are shown in Fig. 2a-b and Fig. 2c, respectively. The elemental mappings of Ni, Al and O in Fig. 2a shows that Ni is well dispersed throughout the catalyst. This as-calcined catalyst consists of compact nanoflake structures with lengths and widths of 40–150 and 10–45 nm, respectively. Besides, high resolution TEM analysis (Fig. 2d) showed a lattice spacing of 0.46 nm correlating to the γ -Al2O3 (111) plane. This result was slightly different from the reported lattice spacing of the (111) plane (0.45 nm) [39] and was attributed to the low crystallinity of γ -Al2O3 which limited the accuracy in measurement. The XRD profile ( Fig. 3a) of the as-calcined catalyst showed a mixture of broad γ -Al2O3 (PDF #00–050–0741) and NiAl2O4 (PDF #01–071–0963) peaks, indicating that the Ni was finely dispersed throughout the catalyst support through the diffusion of Ni2+ into the Al2O3 lattice leading to the formation of NiAl2O4. No NiO peaks were observed in the XRD profiles, implying that all Ni was in the NiAl2O4 form or the NiO particles were nanocrystalline and/or highly dispersed. The broad peaks observed in the XRD profile also indicated the non-crystalline structure of the amorphous and porous γ -Al2O3 support [40]. The formation of NiAl2O4 was confirmed by TPR analysis (Fig. 3b), showing a reduction peak at 770 °C, which can be assigned to the reduction of Ni2+ in NiAl2O4, while a minor peak at ~360 °C is also present indicating the presence of a small amount of NiO [41–43]. Regarding the chemical surface states from XPS profile of the catalyst (Fig. 3c), the Ni 2p3/2 binding energy (BE) was found at 856 eV with a shake-up satellite peak at 862 eV. This BE of Ni 2p3/2 is in the range of 856–857 eV, indicating Ni2+ located at the sample surface as NiAl2O4 spinel [43,44]. The catalyst had a porosity of 0.50 mL g−1 and a surface area of 176 m2 g−1. The high dispersion and high porosity of NiAl2O4 were ascribed to the porous and amorphous nature of γ -Al2O3 support [40]. 3.2 Effect of catalyst reduction on tar reforming The as-calcined and pre-reduced-800 NiAl2O4 catalysts were firstly tested for reforming. Catalyst activity during the reforming of toluene, naphthalene, and styrene with 50 ppmv H2S and 500 ppmv HCl is shown in Fig. 4. It should be noted that the catalytic reforming of those molecules only occurs over Ni0 atoms as the active sites. Interestingly, the as-calcined catalyst with mainly Ni2+ species also showed activity. This phenomenon can be explained by the formation of the Ni0 species by the reducing agents (H2 and CO) presented in the simulated syngas. The initial conversion of naphthalene over the as-calcined catalyst was only 45%, and this value rapidly dropped and fluctuated in the range of 10% − 30% over 5 h on stream. In contrast, this naphthalene conversion over the pre-reduced catalyst was significantly higher (75%), and it slightly decreased and stabilized at 61% over the same time on stream (Fig. 4a). Similarly, the styrene conversion over the pre-reduced catalyst was more stable than the as-calcined catalyst. Indeed, styrene was almost fully converted during the experiment with pre-reduced catalyst, showing conversion maintained between 98% and 96% over 5 h on stream, while this value decreased to 90% on the as-calcined catalyst (Fig. 4c). The toluene conversion efficiencies for as-calcined and pre-reduced catalysts were similar. The as-calcined catalyst had an initial conversion efficiency of 73%, decreasing to 46% after 5 h on stream. Similarly, toluene conversion decreased from an initial conversion of 67–50% over 5 h on stream on the pre-reduced catalyst (Fig. 4b). According to these results, the activity and selectivity in the reforming of those tar model compounds were detrimentally affected by the pre-reduction stage of the Ni catalyst, even though syngas contained significant quantities of reductive agents (H2 and CO). These results are different from other studies in which the comparison of pre-reduced and as-calcined catalysts was also examined [10,11]. They showed similar activities for both catalysts when CH4 and acetic acid were reformed, using simple gas composition and not accounting for the contamination of syngas by impurities. Since the molar contents of each tar compound were similar in the gas feed, the different selectivity of catalyst towards the reforming of the three tar compounds could be attributed to the differences in molecular structure [45,46] as well as in thermal stability of molecules at reforming conditions [1]. Additionally, toluene and styrene are more prone to cracking than naphthalene, which suggests the higher conversions could be due to the decomposition by both reforming and cracking reactions [47]. The similar toluene and styrene conversion rates for the as-calcined and pre-reduced catalyst was due to decomposition of the tar compounds by cracking. Overall, the high conversion rates and stability in tar reforming can be achieved on a pre-reduced catalyst to purify syngas containing typical gas components and impurities, such as HCl and H2S. The reforming activity of the NiAl2O4 catalyst in the presence of impurities was compared with other previously reported Ni catalysts ( Table 1). Taking into account the competing reactions on the active Ni sites in the presence of a mixture of tar compounds and the high GHSV value, the activity of the pre-reduced NiAl2O4 catalyst used in this study is comparable to other catalysts used for tar reforming under similar conditions with H2S and/or HCl as impurities. Furthermore, the focus in this study is on the activity of the catalyst in complex conditions, for which such studies are lacking. The comparable reforming activity for the NiAl2O4 catalyst to other catalysts used in simpler conditions suggests the potential for the catalyst to be considered for industrial purposes. Through the findings in study, long term stability studies can then be carried out for the next stage industrial use. Previous studies have shown that H2S preferentially reacts with oxidized Ni species compared to metallic Ni [20]. According to the modeling using HSC Chemistry 9 software, the probable reactions between Ni2+ compounds and H2, CO, H2S, and HCl could proceed as follows: (2) NiO + H 2 → Ni + H 2 O ∆ G= - 46.5 kJ mol - 1 (3) Ni Al 2 O 4 + H 2 → Ni + γ- Al 2 O 3 + H 2 O ∆ G= - 30.0 kJ mol - 1 (4) NiO + CO → Ni + CO 2 ∆ G= - 47.0 kJ mol - 1 (5) Ni Al 2 O 4 + CO → Ni + γ- Al 2 O 3 + CO 2 ∆ G= - 30.5 kJ mol - 1 (6) NiO + H 2 S → NiS + H 2 O ∆ G= - 76.7 kJ mol - 1 (7) Ni Al 2 O 4 + H 2 S → NiS + γ- Al 2 O 3 + H 2 O ∆ G= - 46.0 kJ mol - 1 (8) NiO + 2 HCl → Ni Cl 2 + H 2 O ∆ G= + 10.5 kJ mol - 1 (9) Ni Al 2 O 4 + 2 HCl → Ni Cl 2 + γ- Al 2 O 3 + H 2 O ∆ G= + 27.0 kJ mol - 1 (10) Ni + H 2 S → NiS + H 2 ∆ G= - 30.3 kJ mol - 1 (11) Ni + 2 HCl → Ni Cl 2 + H 2 ∆ G= + 57.0 kJ mol - 1 (12) NiS + H 2 → Ni + H 2 S ∆ G= + 30.3 kJ mol - 1 (13) NiS + CO → Ni + COS ∆ G= + 57.7 kJ mol - 1 Based on Eqs. 2–7, Gibbs energies ( ΔG ) at 800 °C were negative, indicating that reactions between Ni2+ and H2S or H2/CO can spontaneously occur at the temperature used for reforming experiments. However, regarding the lower ∆ G values, reactions in Eqs. 6–7 were more thermodynamically favored than Eqs. 2–3 or Eqs. 4–5. Those comparisons provided hints for the preferable reactions between NiO or NiAl2O4 with H2S over the reduction of those Ni2+ species with H2 or CO. These findings suggest a poisoning pathway of as-calcined catalyst by H2S, which could hinder the Ni2+ reduction by CO or H2 and subsequently lower the content of available active sites for catalytic reforming. Furthermore, the NiS species are also stable in the presence of H2 and CO reductants due to the positive ∆ G values for the reactions between NiS and H2 and CO suggesting a less thermodynamically favored reaction. Therefore, the formation of NiS prevents the ability of Ni formation during reaction by H2 and CO in the syngas. TEM images of the spent catalysts were analyzed to reveal the possible change of catalyst nanostructures during the reactions ( Fig. 5). The spherical black shapes (Fig. 5a and b), which were not observed in the fresh catalyst (Fig. 2), were formed after reforming and are attributable to the agglomerated Ni particles (Fig. 5a and b). This behavior occurs probably due to the exposure to a reducing environment in the presence of sulfur and halogens [22,23,48]. Interestingly, as suggested by the larger particle size in Fig. 5b, a more severe agglomeration effect was observed in the case of the calcined catalyst without pre-reduction. This result can be explained by the sulfidation of oxidized Ni compounds, which is more favored than metallic Ni during the reforming. Indeed, the lower ∆ G was seen in the reaction of H2S with NiO (Eq. 6) compared to that with Ni (Eq. 10). This finding indicated the critical role of the reduction stage when the pre-reduced catalyst showed higher and more stable activity in the reforming of tar model compounds (Fig. 4). EDX imaging also showed clues of possible poison effects as sulfur and Cl were seen co-located with Ni, suggesting Ni-S and Ni-Cl interactions (Fig. 5a and b). Although the reactions between Ni species and HCl are not thermodynamically favored, as seen in Eqs. 8, 9, and 11, previous studies have shown that surface Ni-Cl may still be formed during reforming [1,23]. XPS characterization was performed for the spent catalysts for analysis of surface elements. It was shown that both sulfur and chloride were present on both as-calcined and pre-reduced catalysts in the survey spectra (Fig. S2), which is consistent with EDX data. Results for the quantitative XPS are summarized in Table 2, showing atomic concentrations on the surface of the spent pre-reduced and as-calcined catalyst in which the S/Ni and Cl/Ni ratios of the spent catalysts can be indicated. The ratio of S/Ni for the as-calcined catalyst was 0.19, while it was < 0.01 in the case of the pre-reduced catalyst. Additionally, CHNS elemental analysis showed that sulfur content was 1.2 wt% in the spent as-calcined catalyst and below the detection limit in the pre-reduced catalyst (Table 2). These results suggested higher sulfur chemisorption occurred over the as-calcined catalyst than the pre-reduced catalyst. This finding reconfirmed the suggested favored sulfidation of Ni2+ species, leading to a more severe agglomeration effect in the case of the as-calcined catalyst observed in TEM images (Fig. 5). In contrast, the ratio of Cl/Ni for both pre-reduced and as-calcined catalysts was similar (~0.1), suggesting that the pre-reduction process did not prevent Cl chemisorption into the catalyst. It was previously shown for tar reforming using naphthalene that while both H2S and HCl can induce Ni agglomeration, the loss of reforming activity is associated only with H2S chemisorption [20,22,49]. In addition to severe aggregation of Ni particles, Fig. 5c shows the coke formation over the surface of the spent as-calcined catalyst, while no significant coking was observed on the spent pre-reduced catalyst (Fig. 5a). These data were confirmed by CHNS analysis, suggesting 3 wt% C on the as-calcined catalyst and undetectable C quantities on the pre-reduced catalyst (Table 2). Based on the C and Ni elemental mappings in Fig. 5c, the carbon deposition was formed over the catalyst surface, blocking the Ni particles. Ni particles also appear to be dispersed and trapped within the carbon structures, suggesting that fragmentation of larger Ni particles occurred due to the carbon growth [50]. Previously, it was shown that coke formation could lead to the loss of reforming activity [51,52]. Our data suggest that sulfur poisoning and coke deposition are more severe in the tests on the catalyst without pre-reduction. To establish and differentiate the poisoning effects of sulfur and HCl poisoning on the reforming activity of the as-calcined catalyst, two additional sets of experiments were conducted for comparison: 1) reforming without H2S and HCl, and 2) reforming with 500 ppmv HCl and without H2S ( Fig. 6). It was found in both conditions that all tar compounds were almost completely reformed over at least 5 h on stream on the catalyst even without the pre-reduction stage (Fig. 6). This remarkable finding suggested the potential of the NiAl2O4 catalyst prepared in this work for a safer and more practical tar removal process where no additional hydrogen would be needed for reduction as long as the inlet syngas is free from H2S. Regarding the poisoning effects, the obtained results in Fig. 6 are consistent with previous studies on pre-reduced catalysts [20,22,49], confirming that S poisoning of the as-calcined catalyst was the main reason for the loss of reforming activity. In those studies, the loss in reforming activity was attributed solely to H2S poisoning, whereas HCl poisoning had a minor influence. Additionally, in another study, when HCl concentration was varied from 300 to 2000 ppmv, the reforming activity was not affected [23]. As such, the reforming experiments with 50 ppmv H2S and without HCl were not carried out. It was found that carbon deposition also occurred on as-calcined catalysts during reforming in the absence of H2S (0 ppmv H2S and 0 ppmv HCl, as well as 0 ppmv H2S and 500 ppmv HCl). This behavior can be seen on the TEM images of the spent as-calcined catalysts in Fig. 7a and b. However, CHNS analysis of the as-calcined catalysts in those two cases (not shown) revealed that the carbon contents were not significant (< 1 wt% C) to affect the reforming activity (Fig. 6). This is because the rate of carbon formation is highly dependent on the catalytic activity, and lower carbon formation corresponds to higher activity [53]. In contrast, the presence of 50 ppmv H2S during reforming on the as-calcined catalyst accelerated carbon deposition (3 wt% C) (Table 2). This result suggested that H2S could also increase the coking rate on the as-calcined catalyst, which probably extended the adverse effects on the catalytic activity (Fig. 6). In short, H2S was a critical cause of the deactivation of the as-calcined catalyst. It reduced the catalyst stability and selectivity towards the reforming of three tar compounds by different extents. Among those compounds, the conversion of naphthalene was negatively affected the most, followed by toluene and styrene. The Raman spectra of the spent as-calcined catalysts are shown in Fig. 7c. Two distinctive bands at ~1340 cm−1 and ~1590 cm−1 are seen on the spectrum of the as-calcined catalyst with 50 ppmv H2S and 500 ppmv HCl. These peaks correspond to the D-band and G-band of carbon, respectively. The D-band can be ascribed to amorphous carbon or graphite with structural imperfections, while the G-band corresponds to the ordered structures of graphitic carbon [54]. The IG/ID ratio of the as-calcined catalyst with impurities (50 ppmv H2S and 500 ppmv HCl) was 0.96, suggesting that carbon deposits with high structural disorder and low graphitization degree were formed during reforming [55,56]. This can explain the relatively good activity that was maintained throughout the reforming even in the presence of H2S and HCl without pre-reduction. On the other hand, due to the low carbon content in the as-calcined catalysts without impurities (0 ppmv H2S and 500 ppmv HCl, 0 ppmv H2S and 0 ppmv HCl) as determined through CHNS analysis, the carbon bands at ~1340 cm−1 and ~1590 cm−1 could not be observed. Interestingly, tar reforming reactions on the as-calcined catalyst were also found to increase the sintering of Ni particles, even when no impurities were present in the gas feed ( Fig. 8). There was, however, no impact on the catalyst reforming activity (Fig. 6). These data are consistent with previous observations made using pre-reduced catalysts, demonstrating that agglomeration of Ni did not play an important role in the deactivation of catalyst activity compared to the formation of Ni-S [22,23]. As observed by TEM imaging of the spent catalysts (Fig. 5), Ni particles appeared to be larger for the as-calcined catalyst as compared to the pre-reduced catalyst. The distribution of sintered Ni particles (Fig. 8) also showed that Ni particles were significantly larger for the spent as-calcined catalysts compared to the pre-reduced catalyst at all conditions. One reason for the accelerated agglomeration in tests on the as-calcined catalyst is the difference in reduction conditions. For instance, Ni2+ is reduced directly in the reactions on as-calcined catalysts with 9 vol% H2 and 10 vol% CO at 800 °C. By that, Ni0 particles would have been rapidly formed at this temperature as suggested by the TPR profile (Fig. 2e), and were probably more prone to agglomeration. The rapid reduction of Ni2+ leads to lower Ni dispersion, which would be result in lower activity in the case of the as-calcined catalyst in the presence of impurities [57]. On the other hand, pre-reduction of catalyst was performed gradually by increasing temperature from room temperature to 800 °C in 20 vol% H2. This difference suggested that the gradual reduction of Ni2+ over increasing temperature ensured better distribution of as-formed Ni0. Considering that as-calcined catalysts are more susceptible to sintering, coke deposition, and poisoning of active Ni sites, pre-reduction of catalysts prior to reforming of syngas containing halide and especially sulfur impurities is essential. 3.3 Effect of pre-reduction temperature on tar reforming The effect of pre-reduction temperature on the tar reforming activity was investigated ( Fig. 9). The catalytic activity towards the reforming of naphthalene, toluene, and styrene was improved when the pre-reduction temperature increased from 800° to 900°C (73%, 69% and 98% at 900 °C against 66%, 54% and 97% at 800 °C, respectively). According to the TPR profile in Fig. 3b, although the peak maximum of Ni reduction was at 770 °C, the reduction peak continued until ~870 °C, explaining why 800 °C was not sufficient for the catalyst pre-reduction. The improved activities for the catalyst pre-reduced at 900 °C could be ascribed to the increased intensity of active Ni0 species. However, the further increase in the pre-reduction temperature to 1000 °C had a detrimental impact on the reforming activity. The conversion efficiencies of naphthalene, toluene, and styrene decreased to the levels comparable with the catalyst pre-reduced at 800 °C. According to these results, while increasing reduction temperatures allowing more Ni0 formation would enhance the reforming activity, there is a limit to the optimum temperature at which the catalyst should be pre-reduced. Table 3 shows the Ni active surface of the catalysts pre-reduced at different temperatures, as determined by H2-pulse chemisorption. According to Table 3, the active Ni surface area increased from 17.9 m2 gNi −1 to 28.2 m2 gNi −1 with an increase of pre-reduction temperature from 800 °C to 900 °C and decreased thereafter. This suggests that the highest amount of active Ni0 was available for the reforming of tar compounds when the pre-reduction temperature was 900 °C, resulting in the highest tar conversion. The deconvolution of the XPS profiles of Ni 2p3/2 ( Fig. 10a) pre-reduced at 800 900, and 1000 °C shows the distribution of Ni0 and Ni2+ with corresponding binding energies of ~853 eV and ~856 eV, respectively ( Table 4). The distribution of Ni0 determined through XPS analysis also confirms that increasing the temperature for pre-reduction above 800 °C increased the amount of reduced Ni0 (29.2% at 800 °C against 33.4% and 36.0% at 900 and 1000 °C, respectively). Additionally, the Ni particle size distribution of reduced catalysts (Fig. S3) and TEM images show that Ni particle sizes were similar for catalysts pre-reduced at 800 °C and 900 °C and were well dispersed over the catalyst surface. This further confirms the increase in Ni0 content with increasing pre-reduction temperature as observed by H2-pulse chemisorption and XPS analysis. On the other hand, the reforming activity decreased at 1000 °C despite the higher content of Ni0, suggesting that there were other factors influencing the catalytic activity at this temperature. Fig. 10b shows the XRD profiles of spent pre-reduced catalysts. All catalysts contained sharp peaks corresponding to Ni (PDF #04–003–6597). In the catalyst pre-reduced at 800 °C, broad peaks corresponding to γ -Al2O3 (PDF #00–050–0741) were identified. At higher pre-reduction temperatures, the peak shift can be seen, which is attributed to the transformation of γ -Al2O3 into δ -Al2O3 (PDF #00–056–1186) and θ -Al2O3 (PDF #00–023–1009). At the same time, larger Ni particles were formed during the pre-reduction due to the sintering of the support, as found from the calculation of the Ni0 crystallite size based on the Scherrer equation from the XRD peak of Ni(111) at 2θ = ~44° ( Table 5). This sintering was accompanied by the decrease in the catalyst surface area, as shown in Table 5. The BET surface areas of the pre-reduced catalysts before reforming also decreased at the higher temperature. Similar thermal effects were reported previously, demonstrating that during the phase transformation of alumina from γ → δ→ θ → α, the alumina particles undergo nucleation leading to decreased surface area and porosity [58,59]. According to the obtained results, the sintering of alumina support, causing the collapse of porous network and loss of access to the active Ni sites, is one of the main factors for the loss of reforming activity after pre-reduction at excessively high temperature. This observation was further confirmed through H2-pulse chemisorption experiments, which showed that both the Ni dispersion and Ni active surface area decreased as pre-reduction temperature was increased to 1000 °C (Table 3) due to the increased sintering of Ni particles and support. The losses in Ni dispersion and active surface area resulted in the decreased tar conversion for the catalyst pre-reduced at 1000 °C compared to 900 °C. Additionally, as the temperature for pre-reduction is increased from 900° to 1000°C, the increase in Ni0 content was lower than the increase of Ni0 between 800 and 900 °C pre-reduction temperature (Table 4). However, Al2O3 phase changes and decrease in BET surface area were more drastic for pre-reduction temperature between 900 and 1000 °C. Notably, the surface area of catalysts decreased further after 5 h on stream of reforming (Table 5), implying that the support transformation and sintering continued beyond the pre-reduction stage. This behavior could be a possible reason for the decreased conversion efficiencies of tar compounds after 5 h compared to the initial values. Visual observation of the support morphology shows similar nanoflake structures for all spent catalysts, suggesting that while some changes in the alumina phase are observed in XRD, these changes are not seen physically through TEM imaging (Fig. 5a, Fig. 11a and Fig. 11b). The formation of carbon on catalyst reduced at 1000 °C is evident from TEM characterization of the spent catalysts (Fig. 11a). This is different from the spent catalysts pre-reduced at 800 and 900 °C (Fig. 5a and Fig. 11b), exhibiting no visual sign of coking. EDX analysis confirms that the structures observed on the catalyst surface are indeed carbon. The carbon was filamentous in nature and was formed through a tip-growth mechanism [60], as observed in Fig. 11c, showing Ni particles found on the tip of the carbon nanofibers. The carbon deposition could be ascribed to tar cracking reactions on the Ni particles followed by the dissolution of carbon in the Ni lattice and which is then transferred to the Ni-support interface. As more carbon is deposited at the Ni-support interface, the Ni particle is lifted from the support. It is possible that due to the changes in the support structure, the formation of filamentous carbon was thus enabled under the reforming conditions [61]. However, previous studies have found that the filamentous carbon formed through the tip-growth mechanism may not detrimentally affect the reforming activity in the short term [62–64]. This is because the Ni particles at the tip of the carbon nanotubes/ nanofibers are still accessible for reforming reactions and remain active during reforming. Furthermore, CHNS analysis indicated that the carbon content was below detectable limits, suggesting that the carbon formed did not interfere with the reforming activity significantly. Additionally, the Raman spectra of the spent pre-reduced catalysts (Fig. S4) did not show the identifiable D- and G-bands for carbon, suggesting negligible carbon deposition [31]. These findings explain the relatively high tar conversion rates for the catalyst pre-reduced at 1000 °C. The Ni 2p3/2 XPS profiles of the spent catalysts are shown in Fig. S5. Similar to the XPS of the reduced catalysts, the Ni 2p3/2 profiles of the spent catalysts contained peaks at binding energies of ~852–853 eV and 856 eV, which correspond to the Ni0 and Ni2+ peak, respectively. A peak at ~861 eV corresponds to the satellite peak. The Ni0 binding energy for the spent catalyst pre-reduced at 1000 °C shifted to lower BE (Table S1), suggesting that the interaction between Ni particles and the support decreased [65,66]. The weaker interaction was due to the increased sintering of Ni (Table 4) and the decreased surface area of support allowing carbon to be formed through the tip-growth mechanism. Cl 2p profiles of the spent catalysts are shown in Fig. S5. The peak at BE between ~195–205 eV suggests Cl was chemisorbed on the Ni particles. According to Oemar et al., S 2p XPS can be studied to determine the nature of sulfur species in the spent catalyst [67]. However, due to the low content of sulfur on the spent pre-reduced catalysts (Table S2), the S 2p peaks cannot be distinguished easily. Nevertheless, these findings indicate that for the catalysts pre-reduced at different temperatures, the reforming activity in the presence of H2S and HCl could be dependent on the availability of the active Ni sites. 4 Conclusions This study has shown that the pre-reduction stage of Ni catalysts is important in maintaining stable and high activities during the reforming of tar in syngas containing impurities. Remarkably, NiAl2O4 catalyst could maintain high reforming activities of tar model compounds in H2S-free syngas over at least 5 h on stream even without prior reduction. However, the presence of H2S in the gas mixture caused a significant deactivation of this Ni catalyst. This was because H2S preferentially reacts with oxidized Ni particles, resulting in a lower amount of Ni2+ that can be reduced directly by the H2 or CO present in syngas during reforming. Additionally, this impurity also accelerated the Ni agglomeration and carbon deposition. In contrast, the pre-reduction stage of Ni catalysts can increase the stability of Ni catalysts against those deactivation pathways. The temperature used during this pre-reduction of the catalyst was also an important factor in improving catalyst activity. The catalytic activity can be improved by increasing the temperature of the pre-reduction stage, i.e., from 800 °C to 900 °C. However, further increasing the reduction temperature may lead to a negative effect in tar reforming due to undesired transformation of the support structure. These results in this study could contribute to more information on developing strategies to enhance catalytic activity and prolong the catalyst life during the upgrading of actual syngas. CRediT authorship contribution statement Dara Khairunnisa Binte Mohamed: Conceptualization, Formal analysis, Investigation, Writing – original draft, Writing – review & editing. Andrei Veksha: Writing – review & editing. Quan Luu Manh Ha: Conceptualization, Supervision, Writing – original draft, Writing – review & editing. Teik-Thye Lim: Writing – review & editing. Grzegorz Lisak: Conceptualization, Supervision, Writing – review & editing. Declaration of Competing Interest The authors declare that they have no known competing financial interests or personal relationships that could have appeared to influence the work reported in this paper. Acknowledgments The authors would like to acknowledge Dr. Liang Yen Nan from NEWRI Analytics Cluster, Nanyang Technological University, Singapore, for his assistance in operation of Kratos Axis Supra Spectrophotometer, and other NEWRI, CESEL at CEE, and FACTS at MSE staff for assisting in equipment operations and analysis. Dara Khairunnisa Binte Mohamed would also like to thank the Interdisciplinary Graduate Programme and Nanyang Technological University for the PhD scholarship. Appendix A Supporting information Supplementary data associated with this article can be found in the online version at doi:10.1016/j.apcata.2022.118711. Appendix A Supplementary material Supplementary material . References [1] W.P. Chan A. Veksha J. Lei W.-D. Oh X. Dou A. Giannis G. Lisak T.-T. Lim Appl. Energy 237 2019 227 240 10.1016/j.apenergy.2019.01.031 W.P. Chan, A. Veksha, J. Lei, W.-D. Oh, X. Dou, A. Giannis, G. Lisak, T.-T. Lim, A hot syngas purification system integrated with downdraft gasification of municipal solid waste, Applied Energy, 237 (2019) 227–240 https://doi.org/10.1016/j.apenergy.2019.01.031. [2] B. Zhou A. Dichiara Y. Zhang Q. Zhang J. Zhou Fuel 234 2018 944 953 10.1016/j.fuel.2018.07.105 B. Zhou, A. Dichiara, Y. Zhang, Q. Zhang, J. Zhou, Tar formation and evolution during biomass gasification: An experimental and theoretical study, Fuel, 234 (2018) 944–953 https://doi.org/10.1016/j.fuel.2018.07.105. [3] S. Anis Z.A. Zainal Renew. Sustain. Energy Rev. 15 2011 2355 2377 10.1016/j.rser.2011.02.018 S. Anis, Z.A. Zainal, Tar reduction in biomass producer gas via mechanical, catalytic and thermal methods: A review, Renewable and Sustainable Energy Reviews, 15 (2011) 2355–2377 https://doi.org/10.1016/j.rser.2011.02.018. [4] Y. Shen K. Yoshikawa Renew. Sustain. Energy Rev. 21 2013 371 392 10.1016/j.rser.2012.12.062 Y. Shen, K. Yoshikawa, Recent progresses in catalytic tar elimination during biomass gasification or pyrolysis—A review, Renewable and Sustainable Energy Reviews, 21 (2013) 371–392 https://doi.org/10.1016/j.rser.2012.12.062. [5] L. Liu Z. Zhang S. Das S. Kawi Appl. Catal. B: Environ. 250 2019 250 272 10.1016/j.apcatb.2019.03.039 L. Liu, Z. Zhang, S. Das, S. Kawi, Reforming of tar from biomass gasification in a hybrid catalysis-plasma system: A review, Applied Catalysis B: Environmental, 250 (2019) 250–272 https://doi.org/10.1016/j.apcatb.2019.03.039. [6] Z. Zhang L. Liu B. Shen C. Wu Renew. Sustain. Energy Rev. 94 2018 1086 1109 10.1016/j.rser.2018.07.010 Z. Zhang, L. Liu, B. Shen, C. Wu, Preparation, modification and development of Ni-based catalysts for catalytic reforming of tar produced from biomass gasification, Renewable and Sustainable Energy Reviews, 94 (2018) 1086–1109 https://doi.org/10.1016/j.rser.2018.07.010. [7] C. Murkin J. Brightling Johns. Matthey Technol. Rev. 60 2016 263 269 10.1595/205651316×692923 C. Murkin, J. Brightling, Eighty Years of Steam Reforming, Johnson Matthey Technology Review, 60 (2016) 263–269 https://doi.org/10.1595/205651316×692923. [8] 〈https://www.clariant.com/en/Business-Units/Catalysts/Syngas-Catalysts/Steam-Reforming〉, retrieved on 25 October 2021. [9] J. Juan-Juan M.C. Román-Martínez M.J. Illán-Gómez Appl. Catal. A: Gen. 355 2009 27 32 10.1016/j.apcata.2008.10.058 J. Juan-Juan, M.C. Román-Martínez, M.J. Illán-Gómez, Nickel catalyst activation in the carbon dioxide reforming of methane: Effect of pretreatments, Applied Catalysis A: General, 355 (2009) 27–32 https://doi.org/10.1016/j.apcata.2008.10.058. [10] F. Cheng V. Dupont Int. J. Hydrog. Energy 38 2013 15160 15172 10.1016/j.ijhydene.2013.09.111 F. Cheng, V. Dupont, Nickel catalyst auto-reduction during steam reforming of bio-oil model compound acetic acid, International Journal of Hydrogen Energy, 38 (2013) 15160–15172 https://doi.org/10.1016/j.ijhydene.2013.09.111. [11] F. Cheng V. Dupont M.V. Twigg Appl. Catal. B: Environ. 200 2017 121 132 10.1016/j.apcatb.2016.06.044 F. Cheng, V. Dupont, M.V. Twigg, Direct reduction of nickel catalyst with model bio-compounds, Applied Catalysis B: Environmental, 200 (2017) 121–132 https://doi.org/10.1016/j.apcatb.2016.06.044. [12] G. Garbarino V. Sanchez Escribano E. Finocchio G. Busca Appl. Catal. B: Environ., 113- 114 2012 281 289 10.1016/j.apcatb.2011.11.048 G. Garbarino, V. Sanchez Escribano, E. Finocchio, G. Busca, Steam reforming of phenol–ethanol mixture over 5% Ni/Al2O3, Applied Catalysis B: Environmental, 113–114 (2012) 281–289 https://doi.org/10.1016/j.apcatb.2011.11.048. [13] G. Garbarino C. Wang I. Valsamakis S. Chitsazan P. Riani E. Finocchio M. Flytzani-Stephanopoulos G. Busca Appl. Catal. B: Environ. 174–175 2015 21 34 10.1016/j.apcatb.2015.02.024 G. Garbarino, C. Wang, I. Valsamakis, S. Chitsazan, P. Riani, E. Finocchio, M. Flytzani-Stephanopoulos, G. Busca, A study of Ni/Al2O3 and Ni–La/Al2O3 catalysts for the steam reforming of ethanol and phenol, Applied Catalysis B: Environmental, 174–175 (2015) 21–34 https://doi.org/10.1016/j.apcatb.2015.02.024. [14] G. Garbarino T. Cavattoni P. Riani R. Brescia F. Canepa G. Busca Catal. Lett. 149 2019 929 941 10.1007/s10562-019-02688-9 G. Garbarino, T. Cavattoni, P. Riani, R. Brescia, F. Canepa, G. Busca, On the Role of Support in Metallic Heterogeneous Catalysis: A Study of Unsupported Nickel–Cobalt Alloy Nanoparticles in Ethanol Steam Reforming, Catalysis Letters, 149 (2019) 929–941 https://doi.org/10.1007/s10562–019-02688–9. [15] S. Chitsazan S. Sepehri G. Garbarino M.M. Carnasciali G. Busca Appl. Catal. B: Environ. 187 2016 386 398 10.1016/j.apcatb.2016.01.050 S. Chitsazan, S. Sepehri, G. Garbarino, M.M. Carnasciali, G. Busca, Steam reforming of biomass-derived organics: Interactions of different mixture components on Ni/Al2O3 based catalysts, Applied Catalysis B: Environmental, 187 (2016) 386–398 https://doi.org/10.1016/j.apcatb.2016.01.050. [16] P. Forzatti L. Lietti Catal. Today 52 1999 165 181 10.1016/S0920-5861(99)00074-7 P. Forzatti, L. Lietti, Catalyst deactivation, Catal. Today, 52 (1999) 165–181 https://doi.org/10.1016/S0920–5861(99)00074–7. [17] U. Izquierdo I. García-García M.Á. Gutierrez R.J. Arraibi L.V. Barrio F.J. Cambra L.P. Arias Catalysts 8 2018 10.3390/catal8010012 U. Izquierdo, I. García-García, M.Á. Gutierrez, R.J. Arraibi, L.V. Barrio, F.J. Cambra, L.P. Arias, Catalyst Deactivation and Regeneration Processes in Biogas Tri-Reforming Process. The Effect of Hydrogen Sulfide Addition, Catalysts, 8 (2018) https://doi.org/10.3390/catal8010012. [18] R.N. Kumar V. Aarthi AIP Conf. Proc. 2225 2020 070007 10.1063/5.0005864 R.N. Kumar, V. Aarthi, From biomass to syngas, fuels and chemicals – A review, AIP Conference Proceedings, 2225 (2020) 070007 https://doi.org/10.1063/5.0005864. [19] T.Y. Yeo J. Ashok S. Kawi Renew. Sustain. Energy Rev. 100 2019 52 70 10.1016/j.rser.2018.10.016 T.Y. Yeo, J. Ashok, S. Kawi, Recent developments in sulphur-resilient catalytic systems for syngas production, Renewable and Sustainable Energy Reviews, 100 (2019) 52–70 https://doi.org/10.1016/j.rser.2018.10.016. [20] D.K. Binte Mohamed A. Veksha T.-T. Lim G. Lisak Appl. Catal. A: Gen. 607 2020 117779 10.1016/j.apcata.2020.117779 D.K. Binte Mohamed, A. Veksha, T.-T. Lim, G. Lisak, Highly active and poison-tolerant nickel catalysts for tar reforming synthesized through controlled hydrothermal synthesis, Applied Catalysis A: General, 607 (2020) 117779 https://doi.org/10.1016/j.apcata.2020.117779. [21] D.K. Binte Mohamed A. Veksha T.-T. Lim G. Lisak Appl. Catal. B: Environ. 280 2021 119435 10.1016/j.apcatb.2020.119435 D.K. Binte Mohamed, A. Veksha, T.-T. Lim, G. Lisak, Hydrogen bromide in syngas: Effects on tar reforming, water gas-shift activities and sintering of Ni-based catalysts, Applied Catalysis B: Environmental, 280 (2021) 119435 https://doi.org/10.1016/j.apcatb.2020.119435. [22] X. Dou A. Veksha W.P. Chan W.-D. Oh Y.N. Liang F. Teoh D.K.B. Mohamed A. Giannis G. Lisak T.-T. Lim Fuel 241 2019 1008 1018 10.1016/j.fuel.2018.12.119 X. Dou, A. Veksha, W.P. Chan, W.-D. Oh, Y.N. Liang, F. Teoh, D.K.B. Mohamed, A. Giannis, G. Lisak, T.-T. Lim, Poisoning effects of H2S and HCl on the naphthalene steam reforming and water-gas shift activities of Ni and Fe catalysts, Fuel, 241 (2019) 1008–1018 https://doi.org/10.1016/j.fuel.2018.12.119. [23] A. Veksha A. Giannis W.-D. Oh V.W.C. Chang G. Lisak T.-T. Lim Appl. Catal. A: Gen. 557 2018 25 38 10.1016/j.apcata.2018.03.005 A. Veksha, A. Giannis, W.-D. Oh, V.W.C. Chang, G. Lisak, T.-T. Lim, Catalytic activities and resistance to HCl poisoning of Ni-based catalysts during steam reforming of naphthalene, Applied Catalysis A: General, 557 (2018) 25–38 https://doi.org/10.1016/j.apcata.2018.03.005. [24] X. Gao Z. Wang J. Ashok S. Kawi Chem. Eng. Sci.: X 7 2020 100065 10.1016/j.cesx.2020.100065 X. Gao, Z. Wang, J. Ashok, S. Kawi, A comprehensive review of anti-coking, anti-poisoning and anti-sintering catalysts for biomass tar reforming reaction, Chemical Engineering Science: X, 7 (2020) 100065 https://doi.org/10.1016/j.cesx.2020.100065. [25] J. Ashok Y. Kathiraser M.L. Ang S. Kawi Catal. Sci. Tech. 5 2015 4398 4409 10.1039/C5CY00650C J. Ashok, Y. Kathiraser, M.L. Ang, S. Kawi, Ni and/or Ni–Cu alloys supported over SiO2 catalysts synthesized via phyllosilicate structures for steam reforming of biomass tar reaction, Catal. Sci. Tech., 5 (2015) 4398–4409 10.1039/C5CY00650C. [26] Y. Kathiraser J. Ashok S. Kawi Catal. Sci. Tech. 6 2016 4327 4336 10.1039/C5CY01910A Y. Kathiraser, J. Ashok, S. Kawi, Synthesis and evaluation of highly dispersed SBA-15 supported Ni–Fe bimetallic catalysts for steam reforming of biomass derived tar reaction, Catal. Sci. Tech., 6 (2016) 4327–4336 10.1039/C5CY01910A. [27] J. Ashok S. Kawi Int. J. Hydrog. Energy 38 2013 13938 13949 10.1016/j.ijhydene.2013.08.029 J. Ashok, S. Kawi, Steam reforming of toluene as a biomass tar model compound over CeO2 promoted Ni/CaO–Al2O3 catalytic systems, International Journal of Hydrogen Energy, 38 (2013) 13938–13949 https://doi.org/10.1016/j.ijhydene.2013.08.029. [28] A. Jangam S. Das S. Pati S. Kawi Appl. Catal. A: Gen. 613 2021 118013 10.1016/j.apcata.2021.118013 A. Jangam, S. Das, S. Pati, S. Kawi, Catalytic reforming of tar model compound over La1-xSrx-Co0.5Ti0.5O3-δ dual perovskite catalysts: Resistance to sulfide and chloride compounds, Applied Catalysis A: General, 613 (2021) 118013 https://doi.org/10.1016/j.apcata.2021.118013. [29] J. Ashok N. Dewangan S. Das P. Hongmanorom M.H. Wai K. Tomishige S. Kawi Fuel Process. Technol. 199 2020 106252 10.1016/j.fuproc.2019.106252 J. Ashok, N. Dewangan, S. Das, P. Hongmanorom, M.H. Wai, K. Tomishige, S. Kawi, Recent progress in the development of catalysts for steam reforming of biomass tar model reaction, Fuel Processing Technology, 199 (2020) 106252 https://doi.org/10.1016/j.fuproc.2019.106252. [30] J. Ashok S. Das N. Dewangan S. Kawi Fuel 291 2021 120194 10.1016/j.fuel.2021.120194 J. Ashok, S. Das, N. Dewangan, S. Kawi, Steam reforming of surrogate diesel model over hydrotalcite-derived MO-CaO-Al2O3 (M = Ni & Co) catalysts for SOFC applications, Fuel, 291 (2021) 120194 https://doi.org/10.1016/j.fuel.2021.120194. [31] M. Shokrollahi Yancheshmeh O. Alizadeh Sahraei M. Aissaoui M.C. Iliuta Appl. Catal. B: Environ. 265 2020 118535 10.1016/j.apcatb.2019.118535 M. Shokrollahi Yancheshmeh, O. Alizadeh Sahraei, M. Aissaoui, M.C. Iliuta, A novel synthesis of NiAl2O4 spinel from a Ni-Al mixed-metal alkoxide as a highly efficient catalyst for hydrogen production by glycerol steam reforming, Applied Catalysis B: Environmental, 265 (2020) 118535 https://doi.org/10.1016/j.apcatb.2019.118535. [32] Z. Shang S. Li L. Li G. Liu X. Liang Appl. Catal. B: Environ. 201 2017 302 309 10.1016/j.apcatb.2016.08.019 Z. Shang, S. Li, L. Li, G. Liu, X. Liang, Highly active and stable alumina supported nickel nanoparticle catalysts for dry reforming of methane, Applied Catalysis B: Environmental, 201 (2017) 302–309 https://doi.org/10.1016/j.apcatb.2016.08.019. [33] N.F.P. Ribeiro R.C.R. Neto S.F. Moya M.M.V.M. Souza M. Schmal Int. J. Hydrog. Energy 35 2010 11725 11732 10.1016/j.ijhydene.2010.08.024 N.F.P. Ribeiro, R.C.R. Neto, S.F. Moya, M.M.V.M. Souza, M. Schmal, Synthesis of NiAl2O4 with high surface area as precursor of Ni nanoparticles for hydrogen production, International Journal of Hydrogen Energy, 35 (2010) 11725–11732 https://doi.org/10.1016/j.ijhydene.2010.08.024. [34] A. Veksha A. Giannis G. Yuan J. Tng W.P. Chan V.W.C. Chang G. Lisak T.-T. Lim Renew. Energy 136 2019 1294 1303 10.1016/j.renene.2018.09.104 A. Veksha, A. Giannis, G. Yuan, J. Tng, W.P. Chan, V.W.C. Chang, G. Lisak, T.-T. Lim, Distribution and modeling of tar compounds produced during downdraft gasification of municipal solid waste, Renewable Energy, 136 (2019) 1294–1303 https://doi.org/10.1016/j.renene.2018.09.104. [35] H. Wang G. Liu A. Veksha A. Giannis T.-T. Lim G. Lisak Energy 218 2021 119548 10.1016/j.energy.2020.119548 H. Wang, G. Liu, A. Veksha, A. Giannis, T.-T. Lim, G. Lisak, Effective H2S control during chemical looping combustion by iron ore modified with alkaline earth metal oxides, Energy, 218 (2021) 119548 https://doi.org/10.1016/j.energy.2020.119548. [36] G. Liu H. Wang S. Deplazes A. Veksha C. Wirz-Töndury A. Giannis T.T. Lim G. Lisak Combust. Flame 223 2021 230 242 10.1016/j.combustflame.2020.09.021 G. Liu, H. Wang, S. Deplazes, A. Veksha, C. Wirz-Töndury, A. Giannis, T.T. Lim, G. Lisak, Ba–Al-decorated iron ore as bifunctional oxygen carrier and HCl sorbent for chemical looping combustion of syngas, Combustion and Flame, 223 (2021) 230–242 https://doi.org/10.1016/j.combustflame.2020.09.021. [37] W.P. Chan S.A.M.B. Yusoff A. Veksha A. Giannis T.-T. Lim G. Lisak Fuel 268 2020 117348 10.1016/j.fuel.2020.117348 W.P. Chan, S.A.M.B. Yusoff, A. Veksha, A. Giannis, T.-T. Lim, G. Lisak, Analytical assessment of tar generated during gasification of municipal solid waste: Distribution of GC–MS detectable tar compounds, undetectable tar residues and inorganic impurities, Fuel, 268 (2020) 117348 https://doi.org/10.1016/j.fuel.2020.117348. [38] P.H. Blanco C. Wu J.A. Onwudili P.T. Williams Energy Fuels 26 2012 2107 2115 10.1021/ef300031j P.H. Blanco, C. Wu, J.A. Onwudili, P.T. Williams, Characterization of Tar from the Pyrolysis/Gasification of Refuse Derived Fuel: Influence of Process Parameters and Catalysis, Energy & Fuels, 26 (2012) 2107–2115 https://doi.org/10.1021/ef300031j. [39] R.-S. Zhou R.L. Snyder Acta Crystallogr. Sect. B 47 1991 617 630 10.1107/S0108768191002719 R.-S. Zhou, R.L. Snyder, Structures and transformation mechanisms of the [eta], [gamma] and [theta] transition aluminas, Acta Crystallographica Section B, 47 (1991) 617–630 https://doi.org/10.1107/S0108768191002719. [40] L. Samain A. Jaworski M. Edén D.M. Ladd D.-K. Seo F. Javier Garcia-Garcia U. Häussermann J. Solid State Chem. 217 2014 1 8 10.1016/j.jssc.2014.05.004 L. Samain, A. Jaworski, M. Edén, D.M. Ladd, D.-K. Seo, F. Javier Garcia-Garcia, U. Häussermann, Structural analysis of highly porous γ-Al2O3, Journal of Solid State Chemistry, 217 (2014) 1–8 https://doi.org/10.1016/j.jssc.2014.05.004. [41] R.-j Zhang G.-f Xia M.-f Li Y. Wu H. Nie D.-d Li J. Fuel Chem. Technol. 43 2015 1359 1365 10.1016/S1872-5813(15)30040-2 R.-j Zhang, G.-f Xia, M.-f Li, Y. Wu, H. Nie, D.-d Li, Effect of support on the performance of Ni-based catalyst in methane dry reforming, Journal of Fuel Chemistry and Technology, 43 (2015) 1359–1365 https://doi.org/10.1016/S1872–5813(15)30040–2. [42] A. Remiro A. Arandia L. Oar-Arteta J. Bilbao A.G. Gayubo Appl. Catal. B: Environ. 237 2018 353 365 10.1016/j.apcatb.2018.06.005 A. Remiro, A. Arandia, L. Oar-Arteta, J. Bilbao, A.G. Gayubo, Regeneration of NiAl2O4 spinel type catalysts used in the reforming of raw bio-oil, Applied Catalysis B: Environmental, 237 (2018) 353–365 https://doi.org/10.1016/j.apcatb.2018.06.005. [43] C. Jiménez-González Z. Boukha B. de Rivas J.R. González-Velasco J.I. Gutiérrez-Ortiz R. López-Fonseca Energy Fuels 28 2014 7109 7121 10.1021/ef501612y C. Jiménez-González, Z. Boukha, B. de Rivas, J.R. González-Velasco, J.I. Gutiérrez-Ortiz, R. López-Fonseca, Behavior of Coprecipitated NiAl2O4/Al2O3 Catalysts for Low-Temperature Methane Steam Reforming, Energy & Fuels, 28 (2014) 7109–7121 https://doi.org/10.1021/ef501612y. [44] L. Zhang X. Wang C. Chen X. Zou W. Ding X. Lu Int. J. Hydrog. Energy 42 2017 11333 11345 10.1016/j.ijhydene.2017.03.140 L. Zhang, X. Wang, C. Chen, X. Zou, W. Ding, X. Lu, Dry reforming of methane to syngas over lanthanum-modified mesoporous nickel aluminate/γ-alumina nanocomposites by one-pot synthesis, International Journal of Hydrogen Energy, 42 (2017) 11333–11345 https://doi.org/10.1016/j.ijhydene.2017.03.140. [45] M. Ghadami Yazdi P.H. Moud K. Marks W. Piskorz H. Öström T. Hansson A. Kotarba K. Engvall M. Göthelid J. Phys. Chem. C. 121 2017 22199 22207 10.1021/acs.jpcc.7b07757 M. Ghadami Yazdi, P.H. Moud, K. Marks, W. Piskorz, H. Öström, T. Hansson, A. Kotarba, K. Engvall, M. Göthelid, Naphthalene on Ni(111): Experimental and Theoretical Insights into Adsorption, Dehydrogenation, and Carbon Passivation, The Journal of Physical Chemistry C, 121 (2017) 22199–22207 https://doi.org/10.1021/acs.jpcc.7b07757. [46] A.M. Coats E. Cooper R. Raval Surf. Sci., 307- 309 1994 89 94 10.1016/0039-6028(94)90375-1 A.M. Coats, E. Cooper, R. Raval, Toluene adsorption on Ni(111), Surface Science, 307–309 (1994) 89–94 https://doi.org/10.1016/0039–6028(94)90375–1. [47] P. Lu Q. Huang Y. Chi F. Wang J. Yan Proc. Combust. Inst. 37 2019 2673 2680 10.1016/j.proci.2018.06.051 P. Lu, Q. Huang, Y. Chi, F. Wang, J. Yan, Catalytic cracking of tar derived from the pyrolysis of municipal solid waste fractions over biochar, Proceedings of the Combustion Institute, 37 (2019) 2673–2680 https://doi.org/10.1016/j.proci.2018.06.051. [48] T. Yoneima K. Fukushima N. Saito K. Nakashima Mater. Trans. 57 2016 1374 1377 10.2320/matertrans.M2015464 T. Yoneima, K. Fukushima, N. Saito, K. Nakashima, Effect of Sulfur on the Sintering of Nickel Particles, MATERIALS TRANSACTIONS, 57 (2016) 1374–1377 https://doi.org/10.2320/matertrans.M2015464. [49] F. Teoh A. Veksha V.W.K. Chia W.D.C. Udayanga D.K. Binte Mohamed A. Giannis T.-T. Lim G. Lisak Fuel 254 2019 115561 10.1016/j.fuel.2019.05.144 F. Teoh, A. Veksha, V.W.K. Chia, W.D.C. Udayanga, D.K. Binte Mohamed, A. Giannis, T.-T. Lim, G. Lisak, Nickel-based catalysts for steam reforming of naphthalene utilizing gasification slag from municipal solid waste as a support, Fuel, 254 (2019) 115561 https://doi.org/10.1016/j.fuel.2019.05.144. [50] C. Park M.A. Keane J. Catal. 221 2004 386 399 10.1016/j.jcat.2003.08.014 C. Park, M.A. Keane, Catalyst support effects in the growth of structured carbon from the decomposition of ethylene over nickel, Journal of Catalysis, 221 (2004) 386–399 https://doi.org/10.1016/j.jcat.2003.08.014. [51] D.L. Trimm Catal. Today 37 1997 233 238 10.1016/S0920-5861(97)00014-X D.L. Trimm, Coke formation and minimisation during steam reforming reactions, Catal. Today, 37 (1997) 233–238 https://doi.org/10.1016/S0920–5861(97)00014-X. [52] J. Sehested Catal. Today 111 2006 103 110 10.1016/j.cattod.2005.10.002 J. Sehested, Four challenges for nickel steam-reforming catalysts, Catal. Today, 111 (2006) 103–110 https://doi.org/10.1016/j.cattod.2005.10.002. [53] U. Oemar M.L. Ang K. Hidajat S. Kawi RSC Adv. 5 2015 17834 17842 10.1039/C4RA16983B U. Oemar, M.L. Ang, K. Hidajat, S. Kawi, Enhancing performance of Ni/La2O3 catalyst by Sr-modification for steam reforming of toluene as model compound of biomass tar, RSC Advances, 5 (2015) 17834–17842 https://doi.org/10.1039/C4RA16983B. [54] A.I. Paksoy B.S. Caglayan E. Ozensoy A.N. Ökte A.E. Aksoylu Int. J. Hydrog. Energy 43 2018 4321 4334 10.1016/j.ijhydene.2018.01.009 A.I. Paksoy, B.S. Caglayan, E. Ozensoy, A.N. Ökte, A.E. Aksoylu, The effects of Co/Ce loading ratio and reaction conditions on CDRM performance of CoCe/ZrO2 catalysts, International Journal of Hydrogen Energy, 43 (2018) 4321–4334 https://doi.org/10.1016/j.ijhydene.2018.01.009. [55] C. Liu D. Chen Y. Cao T. zhang Y. Mao W. Wang Z. Wang S. Kawi Renew. Energy 161 2020 408 418 10.1016/j.renene.2020.07.089 C. Liu, D. Chen, Y. Cao, T. zhang, Y. Mao, W. Wang, Z. Wang, S. Kawi, Catalytic steam reforming of in-situ tar from rice husk over MCM-41 supported LaNiO3 to produce hydrogen rich syngas, Renewable Energy, 161 (2020) 408–418 https://doi.org/10.1016/j.renene.2020.07.089. [56] J. Ashok S. Das N. Dewangan S. Kawi Energy Convers. Manag.: X 1 2019 100003 10.1016/j.ecmx.2019.100003 J. Ashok, S. Das, N. Dewangan, S. Kawi, H2S and NOx tolerance capability of CeO2 doped La1−xCexCo0.5Ti0.5O3−δ perovskites for steam reforming of biomass tar model reaction, Energy Conversion and Management: X, 1 (2019) 100003 https://doi.org/10.1016/j.ecmx.2019.100003. [57] F. Cheng V. Dupont M.V. Twigg Appl. Catal. A: Gen. 527 2016 1 8 10.1016/j.apcata.2016.08.013 F. Cheng, V. Dupont, M.V. Twigg, Temperature-programmed reduction of nickel steam reforming catalyst with glucose, Applied Catalysis A: General, 527 (2016) 1–8 https://doi.org/10.1016/j.apcata.2016.08.013. [58] C. Legros C. Carry P. Bowen H. Hofmann J. Eur. Ceram. Soc. 19 1999 1967 1978 10.1016/S0955-2219(99)00016-3 C. Legros, C. Carry, P. Bowen, H. Hofmann, Sintering of a transition alumina: effects of phase transformation, powder characteristics and thermal cycle, Journal of the European Ceramic Society, 19 (1999) 1967–1978 https://doi.org/10.1016/S0955–2219(99)00016–3. [59] C. Liu Y. Liu Q. Ma H. He Chem. Eng. J. 163 2010 133 142 10.1016/j.cej.2010.07.046 C. Liu, Y. Liu, Q. Ma, H. He, Mesoporous transition alumina with uniform pore structure synthesized by alumisol spray pyrolysis, Chemical Engineering Journal, 163 (2010) 133–142 https://doi.org/10.1016/j.cej.2010.07.046. [60] A. Gohier C.P. Ewels T.M. Minea M.A. Djouadi Carbon 46 2008 1331 1338 10.1016/j.carbon.2008.05.016 A. Gohier, C.P. Ewels, T.M. Minea, M.A. Djouadi, Carbon nanotube growth mechanism switches from tip- to base-growth with decreasing catalyst particle size, Carbon, 46 (2008) 1331–1338 https://doi.org/10.1016/j.carbon.2008.05.016. [61] Z. Alipour M. Rezaei F. Meshkani J. Energy Chem. 23 2014 633 638 10.1016/S2095-4956(14)60194-7 Z. Alipour, M. Rezaei, F. Meshkani, Effect of Ni loadings on the activity and coke formation of MgO-modified Ni/Al2O3 nanocatalyst in dry reforming of methane, Journal of Energy Chemistry, 23 (2014) 633–638 https://doi.org/10.1016/S2095–4956(14)60194–7. [62] L. He S. Hu L. Jiang S.S.A. Syed-Hassan Y. Wang K. Xu S. Su J. Xiang L. Xiao H. Chi X. Chen Int. J. Hydrog. Energy 42 2017 14439 14448 10.1016/j.ijhydene.2017.04.230 L. He, S. Hu, L. Jiang, S.S.A. Syed-Hassan, Y. Wang, K. Xu, S. Su, J. Xiang, L. Xiao, H. Chi, X. Chen, Opposite effects of self-growth amorphous carbon and carbon nanotubes on the reforming of toluene with Ni/α-Al2O3 for hydrogen production, International Journal of Hydrogen Energy, 42 (2017) 14439–14448 https://doi.org/10.1016/j.ijhydene.2017.04.230. [63] L. He S. Hu L. Jiang G. Liao X. Chen H. Han L. Xiao Q. Ren Y. Wang S. Su J. Xiang Fuel Process. Technol. 176 2018 7 14 10.1016/j.fuproc.2018.03.007 L. He, S. Hu, L. Jiang, G. Liao, X. Chen, H. Han, L. Xiao, Q. Ren, Y. Wang, S. Su, J. Xiang, Carbon nanotubes formation and its influence on steam reforming of toluene over Ni/Al2O3 catalysts: Roles of catalyst supports, Fuel Processing Technology, 176 (2018) 7–14 https://doi.org/10.1016/j.fuproc.2018.03.007. [64] L. Zhou L. Li N. Wei J. Li J.-M. Basset ChemCatChem 7 2015 2508 2516 10.1002/cctc.201500379 L. Zhou, L. Li, N. Wei, J. Li, J.-M. Basset, Effect of NiAl2O4 Formation on Ni/Al2O3 Stability during Dry Reforming of Methane, ChemCatChem, 7 (2015) 2508–2516 https://doi.org/10.1002/cctc.201500379. [65] J. Ashok Y. Kathiraser M.L. Ang S. Kawi Appl. Catal. B: Environ., 172- 173 2015 116 128 10.1016/j.apcatb.2015.02.017 J. Ashok, Y. Kathiraser, M.L. Ang, S. Kawi, Bi-functional hydrotalcite-derived NiO–CaO–Al2O3 catalysts for steam reforming of biomass and/or tar model compound at low steam-to-carbon conditions, Applied Catalysis B: Environmental, 172–173 (2015) 116–128 https://doi.org/10.1016/j.apcatb.2015.02.017. [66] J. Ashok S. Kawi ACS Catal. 4 2014 289 301 10.1021/cs400621p J. Ashok, S. Kawi, Nickel–Iron Alloy Supported over Iron–Alumina Catalysts for Steam Reforming of Biomass Tar Model Compound, ACS Catalysis, 4 (2014) 289–301 https://doi.org/10.1021/cs400621p. [67] U. Oemar Z. Bian K. Hidajat S. Kawi Catal. Sci. Tech. 6 2016 6569 6580 10.1039/C6CY00635C U. Oemar, Z. Bian, K. Hidajat, S. Kawi, Sulfur resistant LaxCe1−xNi0.5Cu0.5O3 catalysts for an ultra-high temperature water gas shift reaction, Catal. Sci. Tech., 6 (2016) 6569–6580 https://doi.org/10.1039/C6CY00635C. [68] C.P.B. Quitete R.L. Manfro M.M.V.M. Souza Int. J. Hydrog. Energy 42 2017 9873 9880 10.1016/j.ijhydene.2017.02.187 C.P.B. Quitete, R.L. Manfro, M.M.V.M. Souza, Perovskite-based catalysts for tar removal by steam reforming: Effect of the presence of hydrogen sulfide, International Journal of Hydrogen Energy, 42 (2017) 9873–9880 https://doi.org/10.1016/j.ijhydene.2017.02.187. [69] J. Srinakruang K. Sato T. Vitidsant K. Fujimoto Fuel 85 2006 2419 2426 10.1016/j.fuel.2006.04.026 J. Srinakruang, K. Sato, T. Vitidsant, K. Fujimoto, Highly efficient sulfur and coking resistance catalysts for tar gasification with steam, Fuel, 85 (2006) 2419–2426 https://doi.org/10.1016/j.fuel.2006.04.026. [70] A.D. Hernandez N. Kaisalo P. Simell M. Scarsella Appl. Catal. B: Environ. 258 2019 117977 10.1016/j.apcatb.2019.117977 A.D. Hernandez, N. Kaisalo, P. Simell, M. Scarsella, Effect of H2S and thiophene on the steam reforming activity of nickel and rhodium catalysts in a simulated coke oven gas stream, Applied Catalysis B: Environmental, 258 (2019) 117977 https://doi.org/10.1016/j.apcatb.2019.117977. [71] C. Li D. Hirabayashi K. Suzuki Appl. Catal. B: Environ. 88 2009 351 360 10.1016/j.apcatb.2008.11.004 C. Li, D. Hirabayashi, K. Suzuki, A crucial role of O2− and O22− on mayenite structure for biomass tar steam reforming over Ni/Ca12Al14O33, Applied Catalysis B: Environmental, 88 (2009) 351–360 https://doi.org/10.1016/j.apcatb.2008.11.004. [72] R. Zhang H. Wang X. Hou Chemosphere 97 2014 40 46 10.1016/j.chemosphere.2013.10.087 R. Zhang, H. Wang, X. Hou, Catalytic reforming of toluene as tar model compound: Effect of Ce and Ce–Mg promoter using Ni/olivine catalyst, Chemosphere, 97 (2014) 40–46 https://doi.org/10.1016/j.chemosphere.2013.10.087. [73] K. Sato K. Fujimoto Catal. Commun. 8 2007 1697 1701 10.1016/j.catcom.2007.01.028 K. Sato, K. Fujimoto, Development of new nickel based catalyst for tar reforming with superior resistance to sulfur poisoning and coking in biomass gasification, Catalysis Communications, 8 (2007) 1697–1701 https://doi.org/10.1016/j.catcom.2007.01.028. [74] S. Jayaprakash N. Dewangan A. Jangam S. Kawi Fuel Process. Technol. 219 2021 106871 10.1016/j.fuproc.2021.106871 S. Jayaprakash, N. Dewangan, A. Jangam, S. Kawi, H2S-resistant CeO2-NiO-MgO-Al2O3 LDH-derived catalysts for steam reforming of toluene, Fuel Processing Technology, 219 (2021) 106871 https://doi.org/10.1016/j.fuproc.2021.106871.",
      "scopus-id": "85131829651",
      "coredata": {
        "eid": "1-s2.0-S0926860X22002344",
        "dc:description": "Ni catalysts are used widely in tar reforming for syngas purification. This study investigates the aim of the reduction stage toward Ni catalysts during tar reforming in the presence of syngas impurities. A NiAl2O4 catalyst was used for the reforming of a mixture of tar model compounds (naphthalene, toluene, and styrene) in simulated syngas containing 50 ppmv H2S and 500 ppmv HCl. The catalyst exhibited activity in tar reforming even without the pre-reduction treatment, but it was deactivated rapidly due to the favored reaction between H2S and Ni2+ species, causing increased Ni agglomeration and carbon deposition. Pre-reduction of catalysts enhanced the catalyst stability even in the presence of syngas impurities. Higher reforming activity was achieved by increasing the reduction temperature from 800 °C to 900 °C. However, transformation in the support structure at higher reducing temperature could lead to decreased exposure of Ni due to the collapse of pore structures.",
        "openArchiveArticle": "false",
        "prism:coverDate": "2022-07-25",
        "openaccessUserLicense": null,
        "prism:aggregationType": "Journal",
        "prism:url": "https://api.elsevier.com/content/article/pii/S0926860X22002344",
        "dc:creator": [
          {
            "@_fa": "true",
            "$": "Binte Mohamed, Dara Khairunnisa"
          },
          {
            "@_fa": "true",
            "$": "Veksha, Andrei"
          },
          {
            "@_fa": "true",
            "$": "Ha, Quan Luu Manh"
          },
          {
            "@_fa": "true",
            "$": "Lim, Teik-Thye"
          },
          {
            "@_fa": "true",
            "$": "Lisak, Grzegorz"
          }
        ],
        "link": [
          {
            "@_fa": "true",
            "@rel": "self",
            "@href": "https://api.elsevier.com/content/article/pii/S0926860X22002344"
          },
          {
            "@_fa": "true",
            "@rel": "scidir",
            "@href": "https://www.sciencedirect.com/science/article/pii/S0926860X22002344"
          }
        ],
        "dc:format": "application/json",
        "openaccessType": null,
        "pii": "S0926-860X(22)00234-4",
        "prism:volume": "642",
        "articleNumber": "118711",
        "prism:publisher": "Elsevier B.V.",
        "dc:title": "Unravelling the significance of catalyst reduction stage for high tar reforming activity in the presence of syngas impurities",
        "prism:copyright": "© 2022 Elsevier B.V. All rights reserved.",
        "openaccess": "0",
        "prism:issn": "0926860X",
        "dcterms:subject": [
          {
            "@_fa": "true",
            "$": "Catalytic reforming"
          },
          {
            "@_fa": "true",
            "$": "Reduction"
          },
          {
            "@_fa": "true",
            "$": "Tar model compound"
          },
          {
            "@_fa": "true",
            "$": "Nickel catalyst"
          },
          {
            "@_fa": "true",
            "$": "Sintering"
          }
        ],
        "openaccessArticle": "false",
        "prism:publicationName": "Applied Catalysis A: General",
        "openaccessSponsorType": null,
        "prism:pageRange": "118711",
        "pubType": "fla",
        "prism:coverDisplayDate": "25 July 2022",
        "prism:doi": "10.1016/j.apcata.2022.118711",
        "prism:startingPage": "118711",
        "dc:identifier": "doi:10.1016/j.apcata.2022.118711",
        "openaccessSponsorName": null
      },
      "objects": {
        "object": [
          {
            "@category": "standard",
            "@height": "227",
            "@width": "376",
            "@_fa": "true",
            "$": "https://api.elsevier.com/content/object/eid/1-s2.0-S0926860X22002344-gr8.jpg?httpAccept=%2A%2F%2A",
            "@multimediatype": "JPEG image file",
            "@type": "IMAGE-DOWNSAMPLED",
            "@size": "18972",
            "@ref": "gr8",
            "@mimetype": "image/jpeg"
          },
          {
            "@category": "standard",
            "@height": "222",
            "@width": "376",
            "@_fa": "true",
            "$": "https://api.elsevier.com/content/object/eid/1-s2.0-S0926860X22002344-gr9.jpg?httpAccept=%2A%2F%2A",
            "@multimediatype": "JPEG image file",
            "@type": "IMAGE-DOWNSAMPLED",
            "@size": "14717",
            "@ref": "gr9",
            "@mimetype": "image/jpeg"
          },
          {
            "@category": "standard",
            "@height": "735",
            "@width": "376",
            "@_fa": "true",
            "$": "https://api.elsevier.com/content/object/eid/1-s2.0-S0926860X22002344-gr6.jpg?httpAccept=%2A%2F%2A",
            "@multimediatype": "JPEG image file",
            "@type": "IMAGE-DOWNSAMPLED",
            "@size": "44171",
            "@ref": "gr6",
            "@mimetype": "image/jpeg"
          },
          {
            "@category": "standard",
            "@height": "750",
            "@width": "565",
            "@_fa": "true",
            "$": "https://api.elsevier.com/content/object/eid/1-s2.0-S0926860X22002344-gr7.jpg?httpAccept=%2A%2F%2A",
            "@multimediatype": "JPEG image file",
            "@type": "IMAGE-DOWNSAMPLED",
            "@size": "121237",
            "@ref": "gr7",
            "@mimetype": "image/jpeg"
          },
          {
            "@category": "standard",
            "@height": "733",
            "@width": "376",
            "@_fa": "true",
            "$": "https://api.elsevier.com/content/object/eid/1-s2.0-S0926860X22002344-gr4.jpg?httpAccept=%2A%2F%2A",
            "@multimediatype": "JPEG image file",
            "@type": "IMAGE-DOWNSAMPLED",
            "@size": "44486",
            "@ref": "gr4",
            "@mimetype": "image/jpeg"
          },
          {
            "@category": "standard",
            "@height": "996",
            "@width": "562",
            "@_fa": "true",
            "$": "https://api.elsevier.com/content/object/eid/1-s2.0-S0926860X22002344-gr5.jpg?httpAccept=%2A%2F%2A",
            "@multimediatype": "JPEG image file",
            "@type": "IMAGE-DOWNSAMPLED",
            "@size": "148080",
            "@ref": "gr5",
            "@mimetype": "image/jpeg"
          },
          {
            "@category": "standard",
            "@height": "773",
            "@width": "715",
            "@_fa": "true",
            "$": "https://api.elsevier.com/content/object/eid/1-s2.0-S0926860X22002344-gr2.jpg?httpAccept=%2A%2F%2A",
            "@multimediatype": "JPEG image file",
            "@type": "IMAGE-DOWNSAMPLED",
            "@size": "164896",
            "@ref": "gr2",
            "@mimetype": "image/jpeg"
          },
          {
            "@category": "standard",
            "@height": "405",
            "@width": "565",
            "@_fa": "true",
            "$": "https://api.elsevier.com/content/object/eid/1-s2.0-S0926860X22002344-gr3.jpg?httpAccept=%2A%2F%2A",
            "@multimediatype": "JPEG image file",
            "@type": "IMAGE-DOWNSAMPLED",
            "@size": "39497",
            "@ref": "gr3",
            "@mimetype": "image/jpeg"
          },
          {
            "@category": "standard",
            "@height": "283",
            "@width": "376",
            "@_fa": "true",
            "$": "https://api.elsevier.com/content/object/eid/1-s2.0-S0926860X22002344-gr1.jpg?httpAccept=%2A%2F%2A",
            "@multimediatype": "JPEG image file",
            "@type": "IMAGE-DOWNSAMPLED",
            "@size": "28323",
            "@ref": "gr1",
            "@mimetype": "image/jpeg"
          },
          {
            "@category": "standard",
            "@height": "304",
            "@width": "565",
            "@_fa": "true",
            "$": "https://api.elsevier.com/content/object/eid/1-s2.0-S0926860X22002344-gr10.jpg?httpAccept=%2A%2F%2A",
            "@multimediatype": "JPEG image file",
            "@type": "IMAGE-DOWNSAMPLED",
            "@size": "48551",
            "@ref": "gr10",
            "@mimetype": "image/jpeg"
          },
          {
            "@category": "standard",
            "@height": "596",
            "@width": "791",
            "@_fa": "true",
            "$": "https://api.elsevier.com/content/object/eid/1-s2.0-S0926860X22002344-gr11.jpg?httpAccept=%2A%2F%2A",
            "@multimediatype": "JPEG image file",
            "@type": "IMAGE-DOWNSAMPLED",
            "@size": "123740",
            "@ref": "gr11",
            "@mimetype": "image/jpeg"
          },
          {
            "@category": "standard",
            "@height": "183",
            "@width": "500",
            "@_fa": "true",
            "$": "https://api.elsevier.com/content/object/eid/1-s2.0-S0926860X22002344-ga1.jpg?httpAccept=%2A%2F%2A",
            "@multimediatype": "JPEG image file",
            "@type": "IMAGE-DOWNSAMPLED",
            "@size": "24469",
            "@ref": "ga1",
            "@mimetype": "image/jpeg"
          },
          {
            "@category": "thumbnail",
            "@height": "132",
            "@width": "219",
            "@_fa": "true",
            "$": "https://api.elsevier.com/content/object/eid/1-s2.0-S0926860X22002344-gr8.sml?httpAccept=%2A%2F%2A",
            "@multimediatype": "GIF image file",
            "@type": "IMAGE-THUMBNAIL",
            "@size": "6675",
            "@ref": "gr8",
            "@mimetype": "image/gif"
          },
          {
            "@category": "thumbnail",
            "@height": "130",
            "@width": "219",
            "@_fa": "true",
            "$": "https://api.elsevier.com/content/object/eid/1-s2.0-S0926860X22002344-gr9.sml?httpAccept=%2A%2F%2A",
            "@multimediatype": "GIF image file",
            "@type": "IMAGE-THUMBNAIL",
            "@size": "6611",
            "@ref": "gr9",
            "@mimetype": "image/gif"
          },
          {
            "@category": "thumbnail",
            "@height": "162",
            "@width": "83",
            "@_fa": "true",
            "$": "https://api.elsevier.com/content/object/eid/1-s2.0-S0926860X22002344-gr6.sml?httpAccept=%2A%2F%2A",
            "@multimediatype": "GIF image file",
            "@type": "IMAGE-THUMBNAIL",
            "@size": "3819",
            "@ref": "gr6",
            "@mimetype": "image/gif"
          },
          {
            "@category": "thumbnail",
            "@height": "163",
            "@width": "123",
            "@_fa": "true",
            "$": "https://api.elsevier.com/content/object/eid/1-s2.0-S0926860X22002344-gr7.sml?httpAccept=%2A%2F%2A",
            "@multimediatype": "GIF image file",
            "@type": "IMAGE-THUMBNAIL",
            "@size": "9627",
            "@ref": "gr7",
            "@mimetype": "image/gif"
          },
          {
            "@category": "thumbnail",
            "@height": "164",
            "@width": "84",
            "@_fa": "true",
            "$": "https://api.elsevier.com/content/object/eid/1-s2.0-S0926860X22002344-gr4.sml?httpAccept=%2A%2F%2A",
            "@multimediatype": "GIF image file",
            "@type": "IMAGE-THUMBNAIL",
            "@size": "3684",
            "@ref": "gr4",
            "@mimetype": "image/gif"
          },
          {
            "@category": "thumbnail",
            "@height": "163",
            "@width": "92",
            "@_fa": "true",
            "$": "https://api.elsevier.com/content/object/eid/1-s2.0-S0926860X22002344-gr5.sml?httpAccept=%2A%2F%2A",
            "@multimediatype": "GIF image file",
            "@type": "IMAGE-THUMBNAIL",
            "@size": "7838",
            "@ref": "gr5",
            "@mimetype": "image/gif"
          },
          {
            "@category": "thumbnail",
            "@height": "163",
            "@width": "151",
            "@_fa": "true",
            "$": "https://api.elsevier.com/content/object/eid/1-s2.0-S0926860X22002344-gr2.sml?httpAccept=%2A%2F%2A",
            "@multimediatype": "GIF image file",
            "@type": "IMAGE-THUMBNAIL",
            "@size": "13353",
            "@ref": "gr2",
            "@mimetype": "image/gif"
          },
          {
            "@category": "thumbnail",
            "@height": "157",
            "@width": "219",
            "@_fa": "true",
            "$": "https://api.elsevier.com/content/object/eid/1-s2.0-S0926860X22002344-gr3.sml?httpAccept=%2A%2F%2A",
            "@multimediatype": "GIF image file",
            "@type": "IMAGE-THUMBNAIL",
            "@size": "7735",
            "@ref": "gr3",
            "@mimetype": "image/gif"
          },
          {
            "@category": "thumbnail",
            "@height": "164",
            "@width": "217",
            "@_fa": "true",
            "$": "https://api.elsevier.com/content/object/eid/1-s2.0-S0926860X22002344-gr1.sml?httpAccept=%2A%2F%2A",
            "@multimediatype": "GIF image file",
            "@type": "IMAGE-THUMBNAIL",
            "@size": "10464",
            "@ref": "gr1",
            "@mimetype": "image/gif"
          },
          {
            "@category": "thumbnail",
            "@height": "118",
            "@width": "219",
            "@_fa": "true",
            "$": "https://api.elsevier.com/content/object/eid/1-s2.0-S0926860X22002344-gr10.sml?httpAccept=%2A%2F%2A",
            "@multimediatype": "GIF image file",
            "@type": "IMAGE-THUMBNAIL",
            "@size": "9019",
            "@ref": "gr10",
            "@mimetype": "image/gif"
          },
          {
            "@category": "thumbnail",
            "@height": "164",
            "@width": "218",
            "@_fa": "true",
            "$": "https://api.elsevier.com/content/object/eid/1-s2.0-S0926860X22002344-gr11.sml?httpAccept=%2A%2F%2A",
            "@multimediatype": "GIF image file",
            "@type": "IMAGE-THUMBNAIL",
            "@size": "16285",
            "@ref": "gr11",
            "@mimetype": "image/gif"
          },
          {
            "@category": "thumbnail",
            "@height": "80",
            "@width": "219",
            "@_fa": "true",
            "$": "https://api.elsevier.com/content/object/eid/1-s2.0-S0926860X22002344-ga1.sml?httpAccept=%2A%2F%2A",
            "@multimediatype": "GIF image file",
            "@type": "IMAGE-THUMBNAIL",
            "@size": "7462",
            "@ref": "ga1",
            "@mimetype": "image/gif"
          },
          {
            "@category": "high",
            "@height": "1006",
            "@width": "1663",
            "@_fa": "true",
            "$": "https://api.elsevier.com/content/object/eid/1-s2.0-S0926860X22002344-gr8_lrg.jpg?httpAccept=%2A%2F%2A",
            "@multimediatype": "JPEG image file",
            "@type": "IMAGE-HIGH-RES",
            "@size": "101402",
            "@ref": "gr8",
            "@mimetype": "image/jpeg"
          },
          {
            "@category": "high",
            "@height": "984",
            "@width": "1663",
            "@_fa": "true",
            "$": "https://api.elsevier.com/content/object/eid/1-s2.0-S0926860X22002344-gr9_lrg.jpg?httpAccept=%2A%2F%2A",
            "@multimediatype": "JPEG image file",
            "@type": "IMAGE-HIGH-RES",
            "@size": "72813",
            "@ref": "gr9",
            "@mimetype": "image/jpeg"
          },
          {
            "@category": "high",
            "@height": "3253",
            "@width": "1663",
            "@_fa": "true",
            "$": "https://api.elsevier.com/content/object/eid/1-s2.0-S0926860X22002344-gr6_lrg.jpg?httpAccept=%2A%2F%2A",
            "@multimediatype": "JPEG image file",
            "@type": "IMAGE-HIGH-RES",
            "@size": "228558",
            "@ref": "gr6",
            "@mimetype": "image/jpeg"
          },
          {
            "@category": "high",
            "@height": "3312",
            "@width": "2495",
            "@_fa": "true",
            "$": "https://api.elsevier.com/content/object/eid/1-s2.0-S0926860X22002344-gr7_lrg.jpg?httpAccept=%2A%2F%2A",
            "@multimediatype": "JPEG image file",
            "@type": "IMAGE-HIGH-RES",
            "@size": "697271",
            "@ref": "gr7",
            "@mimetype": "image/jpeg"
          },
          {
            "@category": "high",
            "@height": "3240",
            "@width": "1663",
            "@_fa": "true",
            "$": "https://api.elsevier.com/content/object/eid/1-s2.0-S0926860X22002344-gr4_lrg.jpg?httpAccept=%2A%2F%2A",
            "@multimediatype": "JPEG image file",
            "@type": "IMAGE-HIGH-RES",
            "@size": "225115",
            "@ref": "gr4",
            "@mimetype": "image/jpeg"
          },
          {
            "@category": "high",
            "@height": "4408",
            "@width": "2487",
            "@_fa": "true",
            "$": "https://api.elsevier.com/content/object/eid/1-s2.0-S0926860X22002344-gr5_lrg.jpg?httpAccept=%2A%2F%2A",
            "@multimediatype": "JPEG image file",
            "@type": "IMAGE-HIGH-RES",
            "@size": "883497",
            "@ref": "gr5",
            "@mimetype": "image/jpeg"
          },
          {
            "@category": "high",
            "@height": "3416",
            "@width": "3160",
            "@_fa": "true",
            "$": "https://api.elsevier.com/content/object/eid/1-s2.0-S0926860X22002344-gr2_lrg.jpg?httpAccept=%2A%2F%2A",
            "@multimediatype": "JPEG image file",
            "@type": "IMAGE-HIGH-RES",
            "@size": "1156283",
            "@ref": "gr2",
            "@mimetype": "image/jpeg"
          },
          {
            "@category": "high",
            "@height": "1787",
            "@width": "2495",
            "@_fa": "true",
            "$": "https://api.elsevier.com/content/object/eid/1-s2.0-S0926860X22002344-gr3_lrg.jpg?httpAccept=%2A%2F%2A",
            "@multimediatype": "JPEG image file",
            "@type": "IMAGE-HIGH-RES",
            "@size": "204361",
            "@ref": "gr3",
            "@mimetype": "image/jpeg"
          },
          {
            "@category": "high",
            "@height": "1253",
            "@width": "1663",
            "@_fa": "true",
            "$": "https://api.elsevier.com/content/object/eid/1-s2.0-S0926860X22002344-gr1_lrg.jpg?httpAccept=%2A%2F%2A",
            "@multimediatype": "JPEG image file",
            "@type": "IMAGE-HIGH-RES",
            "@size": "151863",
            "@ref": "gr1",
            "@mimetype": "image/jpeg"
          },
          {
            "@category": "high",
            "@height": "1344",
            "@width": "2495",
            "@_fa": "true",
            "$": "https://api.elsevier.com/content/object/eid/1-s2.0-S0926860X22002344-gr10_lrg.jpg?httpAccept=%2A%2F%2A",
            "@multimediatype": "JPEG image file",
            "@type": "IMAGE-HIGH-RES",
            "@size": "250817",
            "@ref": "gr10",
            "@mimetype": "image/jpeg"
          },
          {
            "@category": "high",
            "@height": "2631",
            "@width": "3493",
            "@_fa": "true",
            "$": "https://api.elsevier.com/content/object/eid/1-s2.0-S0926860X22002344-gr11_lrg.jpg?httpAccept=%2A%2F%2A",
            "@multimediatype": "JPEG image file",
            "@type": "IMAGE-HIGH-RES",
            "@size": "800731",
            "@ref": "gr11",
            "@mimetype": "image/jpeg"
          },
          {
            "@category": "high",
            "@height": "811",
            "@width": "2213",
            "@_fa": "true",
            "$": "https://api.elsevier.com/content/object/eid/1-s2.0-S0926860X22002344-ga1_lrg.jpg?httpAccept=%2A%2F%2A",
            "@multimediatype": "JPEG image file",
            "@type": "IMAGE-HIGH-RES",
            "@size": "191430",
            "@ref": "ga1",
            "@mimetype": "image/jpeg"
          },
          {
            "@category": "standard",
            "@_fa": "true",
            "$": "https://api.elsevier.com/content/object/eid/1-s2.0-S0926860X22002344-mmc1.docx?httpAccept=%2A%2F%2A",
            "@multimediatype": "Microsoft Word file",
            "@type": "APPLICATION",
            "@size": "2355707",
            "@ref": "mmc1",
            "@mimetype": "application/word"
          },
          {
            "@category": "thumbnail",
            "@_fa": "true",
            "$": "https://api.elsevier.com/content/object/eid/1-s2.0-S0926860X22002344-si0003.svg?httpAccept=%2A%2F%2A",
            "@multimediatype": "Scalable Vector Graphics file",
            "@type": "ALTIMG",
            "@size": "3043",
            "@ref": "si0003",
            "@mimetype": "image/svg+xml"
          },
          {
            "@category": "thumbnail",
            "@_fa": "true",
            "$": "https://api.elsevier.com/content/object/eid/1-s2.0-S0926860X22002344-si0001.svg?httpAccept=%2A%2F%2A",
            "@multimediatype": "Scalable Vector Graphics file",
            "@type": "ALTIMG",
            "@size": "1936",
            "@ref": "si0001",
            "@mimetype": "image/svg+xml"
          },
          {
            "@category": "thumbnail",
            "@_fa": "true",
            "$": "https://api.elsevier.com/content/object/eid/1-s2.0-S0926860X22002344-si0004.svg?httpAccept=%2A%2F%2A",
            "@multimediatype": "Scalable Vector Graphics file",
            "@type": "ALTIMG",
            "@size": "3719",
            "@ref": "si0004",
            "@mimetype": "image/svg+xml"
          },
          {
            "@category": "thumbnail",
            "@_fa": "true",
            "$": "https://api.elsevier.com/content/object/eid/1-s2.0-S0926860X22002344-si0005.svg?httpAccept=%2A%2F%2A",
            "@multimediatype": "Scalable Vector Graphics file",
            "@type": "ALTIMG",
            "@size": "3083",
            "@ref": "si0005",
            "@mimetype": "image/svg+xml"
          },
          {
            "@category": "thumbnail",
            "@_fa": "true",
            "$": "https://api.elsevier.com/content/object/eid/1-s2.0-S0926860X22002344-si0006.svg?httpAccept=%2A%2F%2A",
            "@multimediatype": "Scalable Vector Graphics file",
            "@type": "ALTIMG",
            "@size": "3792",
            "@ref": "si0006",
            "@mimetype": "image/svg+xml"
          },
          {
            "@category": "thumbnail",
            "@_fa": "true",
            "$": "https://api.elsevier.com/content/object/eid/1-s2.0-S0926860X22002344-si0007.svg?httpAccept=%2A%2F%2A",
            "@multimediatype": "Scalable Vector Graphics file",
            "@type": "ALTIMG",
            "@size": "3237",
            "@ref": "si0007",
            "@mimetype": "image/svg+xml"
          },
          {
            "@category": "thumbnail",
            "@_fa": "true",
            "$": "https://api.elsevier.com/content/object/eid/1-s2.0-S0926860X22002344-si0008.svg?httpAccept=%2A%2F%2A",
            "@multimediatype": "Scalable Vector Graphics file",
            "@type": "ALTIMG",
            "@size": "3902",
            "@ref": "si0008",
            "@mimetype": "image/svg+xml"
          },
          {
            "@category": "thumbnail",
            "@_fa": "true",
            "$": "https://api.elsevier.com/content/object/eid/1-s2.0-S0926860X22002344-si0009.svg?httpAccept=%2A%2F%2A",
            "@multimediatype": "Scalable Vector Graphics file",
            "@type": "ALTIMG",
            "@size": "3314",
            "@ref": "si0009",
            "@mimetype": "image/svg+xml"
          },
          {
            "@category": "thumbnail",
            "@_fa": "true",
            "$": "https://api.elsevier.com/content/object/eid/1-s2.0-S0926860X22002344-si0010.svg?httpAccept=%2A%2F%2A",
            "@multimediatype": "Scalable Vector Graphics file",
            "@type": "ALTIMG",
            "@size": "4157",
            "@ref": "si0010",
            "@mimetype": "image/svg+xml"
          },
          {
            "@category": "thumbnail",
            "@_fa": "true",
            "$": "https://api.elsevier.com/content/object/eid/1-s2.0-S0926860X22002344-si0011.svg?httpAccept=%2A%2F%2A",
            "@multimediatype": "Scalable Vector Graphics file",
            "@type": "ALTIMG",
            "@size": "3136",
            "@ref": "si0011",
            "@mimetype": "image/svg+xml"
          },
          {
            "@category": "thumbnail",
            "@_fa": "true",
            "$": "https://api.elsevier.com/content/object/eid/1-s2.0-S0926860X22002344-si0012.svg?httpAccept=%2A%2F%2A",
            "@multimediatype": "Scalable Vector Graphics file",
            "@type": "ALTIMG",
            "@size": "3014",
            "@ref": "si0012",
            "@mimetype": "image/svg+xml"
          },
          {
            "@category": "thumbnail",
            "@_fa": "true",
            "$": "https://api.elsevier.com/content/object/eid/1-s2.0-S0926860X22002344-si0013.svg?httpAccept=%2A%2F%2A",
            "@multimediatype": "Scalable Vector Graphics file",
            "@type": "ALTIMG",
            "@size": "3055",
            "@ref": "si0013",
            "@mimetype": "image/svg+xml"
          },
          {
            "@category": "thumbnail",
            "@_fa": "true",
            "$": "https://api.elsevier.com/content/object/eid/1-s2.0-S0926860X22002344-si0014.svg?httpAccept=%2A%2F%2A",
            "@multimediatype": "Scalable Vector Graphics file",
            "@type": "ALTIMG",
            "@size": "2966",
            "@ref": "si0014",
            "@mimetype": "image/svg+xml"
          },
          {
            "@category": "thumbnail",
            "@_fa": "true",
            "$": "https://api.elsevier.com/content/object/eid/1-s2.0-S0926860X22002344-si0015.svg?httpAccept=%2A%2F%2A",
            "@multimediatype": "Scalable Vector Graphics file",
            "@type": "ALTIMG",
            "@size": "1223",
            "@ref": "si0015",
            "@mimetype": "image/svg+xml"
          },
          {
            "@category": "thumbnail",
            "@_fa": "true",
            "$": "https://api.elsevier.com/content/object/eid/1-s2.0-S0926860X22002344-si0016.svg?httpAccept=%2A%2F%2A",
            "@multimediatype": "Scalable Vector Graphics file",
            "@type": "ALTIMG",
            "@size": "1146",
            "@ref": "si0016",
            "@mimetype": "image/svg+xml"
          },
          {
            "@category": "thumbnail",
            "@_fa": "true",
            "$": "https://api.elsevier.com/content/object/eid/1-s2.0-S0926860X22002344-si0017.svg?httpAccept=%2A%2F%2A",
            "@multimediatype": "Scalable Vector Graphics file",
            "@type": "ALTIMG",
            "@size": "972",
            "@ref": "si0017",
            "@mimetype": "image/svg+xml"
          },
          {
            "@category": "thumbnail",
            "@_fa": "true",
            "$": "https://api.elsevier.com/content/object/eid/1-s2.0-S0926860X22002344-si0018.svg?httpAccept=%2A%2F%2A",
            "@multimediatype": "Scalable Vector Graphics file",
            "@type": "ALTIMG",
            "@size": "1016",
            "@ref": "si0018",
            "@mimetype": "image/svg+xml"
          },
          {
            "@category": "thumbnail",
            "@_fa": "true",
            "$": "https://api.elsevier.com/content/object/eid/1-s2.0-S0926860X22002344-si0019.svg?httpAccept=%2A%2F%2A",
            "@multimediatype": "Scalable Vector Graphics file",
            "@type": "ALTIMG",
            "@size": "1012",
            "@ref": "si0019",
            "@mimetype": "image/svg+xml"
          },
          {
            "@category": "thumbnail",
            "@_fa": "true",
            "$": "https://api.elsevier.com/content/object/eid/1-s2.0-S0926860X22002344-si0002.svg?httpAccept=%2A%2F%2A",
            "@multimediatype": "Scalable Vector Graphics file",
            "@type": "ALTIMG",
            "@size": "972",
            "@ref": "si0002",
            "@mimetype": "image/svg+xml"
          },
          {
            "@category": "standard",
            "@_fa": "true",
            "$": "https://api.elsevier.com/content/object/eid/1-s2.0-S0926860X22002344-am.pdf?httpAccept=%2A%2F%2A",
            "@multimediatype": "Acrobat PDF file",
            "@type": "AAM-PDF",
            "@size": "2568557",
            "@ref": "am",
            "@mimetype": "application/pdf"
          }
        ]
      },
      "link": {
        "@rel": "abstract",
        "@href": "https://api.elsevier.com/content/abstract/scopus_id/85131829651"
      }
    }
  }
}