{
  "metadata": {
    "title": "Stable Pt catalysts anchored by Mn-SBA-15 support for propane dehydrogenation",
    "authors": "; ; ",
    "journal": "Applied Catalysis A: General",
    "date": "2024-01-25",
    "doi": "10.1016/j.apcata.2024.119559",
    "abstract": "",
    "uri": "https://api.elsevier.com/content/article/pii/S0926860X24000036",
    "pii": "S0926860X24000036"
  },
  "fulltext": {
    "full-text-retrieval-response": {
      "scopus-eid": "2-s2.0-85182278770",
      "originalText": "serial JL 271346 291210 291744 291809 31 Applied Catalysis A: General APPLIEDCATALYSISAGENERAL 2024-01-08 2024-01-08 2024-01-12 2024-01-12 2024-01-19T20:53:16 1-s2.0-S0926860X24000036 S0926-860X(24)00003-6 S0926860X24000036 10.1016/j.apcata.2024.119559 S300 S300.1 FULL-TEXT 1-s2.0-S0926860X23X00210 2024-02-15T01:10:37.15229Z 0 0 20240125 2024 2024-01-08T16:43:09.673708Z absattachment articleinfo articlenumber articletitlenorm authfirstinitialnorm authfirstsurnamenorm cid cids contenttype copyright crossmark dateloaded dateloadedtxt datesearch datesort dateupdated dco docsubtype doctype doi eid ewtransactionid hubeid indexeddate issn issnnorm itemstage itemtransactionid itemweight openaccess openarchive pg pgfirst pii piinorm pubdatestart pubdatetxt pubyr sortorder srctitle srctitlenorm srctype ssids alllist content subj subheadings suppl tomb volfirst volissue volumelist webpdf webpdfpagecount yearnav figure table body mmlmath acknowledge affil articletitle auth authfirstini authfull authkeywords authlast grantnumber grantsponsor grantsponsorid highlightsabst primabst ref specialabst 0926-860X 0926860X true 670 670 C Volume 670 35 119559 119559 119559 20240125 25 January 2024 2024-01-25 2024 article fla © 2024 Published by Elsevier B.V. STABLEPTCATALYSTSANCHOREDBYMNSBA15SUPPORTFORPROPANEDEHYDROGENATION FAN X 1 Introduction 2 Experimental 2.1 Preparation of the catalysts 2.1.1 Synthesis of Mn-SBA-15 2.1.2 Synthesis of Pt/xMn-SBA-15 2.2 Catalyst characterization 2.3 Catalytic activity test 3 Results and discussions 3.1 Characterization of Mn-SBA-15 support 3.2 Characterization of Pt/Mn-SBA-15 catalysts 3.3 Catalytic activity measurements 3.4 Analysis of catalyst structure and carbon deposition 4 Conclusions CRediT authorship contribution statement Acknowledgements References CHEN 2021 3315 3354 S OTROSHCHENKO 2021 473 527 T LI 2021 4359 4381 C CHERNYAK 2022 7994 8044 S LIU 2014 183 192 X SRISAKWATTANA 2021 118053 T HE 2023 129044 Y WANG 2021 304 314 Y CHEN 2022 12720 12743 X FENG 2022 819 838 B MOTAGAMWALA 2021 217 222 A LIU 2020 628 638 L LEZCANOGONZALEZ 2022 e202101828 I DENG 2020 117826 L XU 2020 818 828 Z SEARLES 2018 11674 11679 K SRINATH 2021 11320 11335 N NAKAYA 2020 2838 Y TOLEK 2020 100 108 W SUN 2011 165 174 P QIAN 2022 17264 17274 R CYBULSKIS 2017 4173 4181 V SUN 2020 19450 19459 Q SUN 2018 4454 G WANG 2020 1248 1255 L WU 2018 14870 14877 Z ROCHLITZ 2022 13384 13393 L FAN 2020 450 460 X ZHAO 1998 548 552 D ZHOU 2011 594 604 Y YANG 2022 121224 L SHAHBAZI 2011 505 518 A FAN 2015 339 350 X LIU 2022 161 171 D WANG 2019 442 455 Y KIANI 2021 10131 10137 D MA 2022 3678 3688 D ZHANG 2022 1044 1055 B WANG 2022 451 457 Y GAO 2022 332 339 X ZHANG 2021 16259 16266 B WANG 2022 e202104367 X WANG 2018 8647 8654 H CHOI 2023 411 412 Y IGLESIASJUEZ 2010 268 279 A ZHANG 2006 860 866 Y FANX2024X119559 FANX2024X119559XX 2026-01-12T00:00:00.000Z 2026-01-12T00:00:00.000Z http://creativecommons.org/licenses/by-nc-nd/4.0/ © 2024 Published by Elsevier B.V. 2024-01-19T14:53:32.829Z http://vtw.elsevier.com/data/voc/AddOnTypes/50.7/aggregated-refined Xingliao Talent Program XLYC2203138 National Natural Science Foundation of China 22172101 92145301 NSFC National Natural Science Foundation of China http://data.elsevier.com/vocabulary/SciValFunders/501100001809 http://sws.geonames.org/1814991/ Science and Technology Planning Project of Shenyang Shenyang Municipal Bureau of Science and Technology http://data.elsevier.com/vocabulary/SciValFunders/501100007765 http://sws.geonames.org/1814991/ Shenyang Normal University SNU Shenyang Normal University http://data.elsevier.com/vocabulary/SciValFunders/501100012145 http://sws.geonames.org/1814991/ Applied Basic Research Program of Liaoning Province 2023JH2/101600059 We acknowledge the financial support from National Natural Science Foundation of China ( 22172101 , 92145301 ), the Science and Technology Planning Project of Shenyang ( 22−322-3−28 ), Xingliao Talent Program ( XLYC2203138 ), Applied Basic Research Program of Liaoning Province ( 2023JH2/101600059 ), Major Incubation Program of Shenyang Normal University . https://doi.org/10.15223/policy-017 https://doi.org/10.15223/policy-037 https://doi.org/10.15223/policy-012 https://doi.org/10.15223/policy-029 https://doi.org/10.15223/policy-004 item S0926-860X(24)00003-6 S0926860X24000036 1-s2.0-S0926860X24000036 10.1016/j.apcata.2024.119559 271346 2024-02-15T01:10:37.15229Z 2024-01-25 1-s2.0-S0926860X24000036-main.pdf https://s3-eu-west-1.amazonaws.com/prod-ucs-content-store-eu-west/content/pii:S0926860X24000036/MAIN/application/pdf/75dae5a4fd4f73b71189719750e6f605/main.pdf main.pdf pdf true 6404048 MAIN 9 1-s2.0-S0926860X24000036-main_1.png https://s3-eu-west-1.amazonaws.com/prod-ucs-content-store-eu-west/content/pii:S0926860X24000036/PREVIEW/image/png/ba80463bca457a060f95397e6463fa01/main_1.png main_1.png png 57282 849 656 IMAGE-WEB-PDF 1 1-s2.0-S0926860X24000036-gr9.jpg https://s3-eu-west-1.amazonaws.com/prod-ucs-content-store-eu-west/content/pii:S0926860X24000036/gr9/DOWNSAMPLED/image/jpeg/31b7b7bacdd5c819daba5655474a2fc3/gr9.jpg gr9 gr9.jpg jpg 66655 432 395 IMAGE-DOWNSAMPLED 1-s2.0-S0926860X24000036-gr8.jpg https://s3-eu-west-1.amazonaws.com/prod-ucs-content-store-eu-west/content/pii:S0926860X24000036/gr8/DOWNSAMPLED/image/jpeg/38fdc9414d9dd00d10ff21fadfe37565/gr8.jpg gr8 gr8.jpg jpg 38493 196 715 IMAGE-DOWNSAMPLED 1-s2.0-S0926860X24000036-gr7.jpg https://s3-eu-west-1.amazonaws.com/prod-ucs-content-store-eu-west/content/pii:S0926860X24000036/gr7/DOWNSAMPLED/image/jpeg/baf82f132bff0967822340161b6ffa46/gr7.jpg gr7 gr7.jpg jpg 28769 379 395 IMAGE-DOWNSAMPLED 1-s2.0-S0926860X24000036-gr6.jpg https://s3-eu-west-1.amazonaws.com/prod-ucs-content-store-eu-west/content/pii:S0926860X24000036/gr6/DOWNSAMPLED/image/jpeg/9f9196cd203548d7c44991fbee25db1e/gr6.jpg gr6 gr6.jpg jpg 167390 799 791 IMAGE-DOWNSAMPLED 1-s2.0-S0926860X24000036-gr5.jpg https://s3-eu-west-1.amazonaws.com/prod-ucs-content-store-eu-west/content/pii:S0926860X24000036/gr5/DOWNSAMPLED/image/jpeg/86a0d4eaaa271973a4816d9f68904326/gr5.jpg gr5 gr5.jpg jpg 51029 287 678 IMAGE-DOWNSAMPLED 1-s2.0-S0926860X24000036-gr4.jpg https://s3-eu-west-1.amazonaws.com/prod-ucs-content-store-eu-west/content/pii:S0926860X24000036/gr4/DOWNSAMPLED/image/jpeg/39c92b9194968d20f684189ddd16cceb/gr4.jpg gr4 gr4.jpg jpg 42532 251 678 IMAGE-DOWNSAMPLED 1-s2.0-S0926860X24000036-gr10.jpg https://s3-eu-west-1.amazonaws.com/prod-ucs-content-store-eu-west/content/pii:S0926860X24000036/gr10/DOWNSAMPLED/image/jpeg/0883a1c56395d2ed2c9d6f0310b99f78/gr10.jpg gr10 gr10.jpg jpg 53892 612 420 IMAGE-DOWNSAMPLED 1-s2.0-S0926860X24000036-gr3.jpg https://s3-eu-west-1.amazonaws.com/prod-ucs-content-store-eu-west/content/pii:S0926860X24000036/gr3/DOWNSAMPLED/image/jpeg/ea790619ed615eda3668a73b115ef776/gr3.jpg gr3 gr3.jpg jpg 53088 225 678 IMAGE-DOWNSAMPLED 1-s2.0-S0926860X24000036-gr11.jpg https://s3-eu-west-1.amazonaws.com/prod-ucs-content-store-eu-west/content/pii:S0926860X24000036/gr11/DOWNSAMPLED/image/jpeg/768b1ed388e2c45a5ae58d45c18a6d0f/gr11.jpg gr11 gr11.jpg jpg 22290 327 395 IMAGE-DOWNSAMPLED 1-s2.0-S0926860X24000036-gr2.jpg https://s3-eu-west-1.amazonaws.com/prod-ucs-content-store-eu-west/content/pii:S0926860X24000036/gr2/DOWNSAMPLED/image/jpeg/e75b1b6fd957f7d0ffc0703fe6f59ad3/gr2.jpg gr2 gr2.jpg jpg 23149 364 395 IMAGE-DOWNSAMPLED 1-s2.0-S0926860X24000036-ga1.jpg https://s3-eu-west-1.amazonaws.com/prod-ucs-content-store-eu-west/content/pii:S0926860X24000036/ga1/DOWNSAMPLED/image/jpeg/211226a800874597024074f13543e942/ga1.jpg ga1 true ga1.jpg jpg 23256 162 500 IMAGE-DOWNSAMPLED 1-s2.0-S0926860X24000036-gr1.jpg https://s3-eu-west-1.amazonaws.com/prod-ucs-content-store-eu-west/content/pii:S0926860X24000036/gr1/DOWNSAMPLED/image/jpeg/2baad6b088eb8f65ef018d97d6478466/gr1.jpg gr1 gr1.jpg jpg 17661 343 395 IMAGE-DOWNSAMPLED 1-s2.0-S0926860X24000036-gr9.sml https://s3-eu-west-1.amazonaws.com/prod-ucs-content-store-eu-west/content/pii:S0926860X24000036/gr9/THUMBNAIL/image/gif/5784171cb5a22aeba3dbf24803faf3cc/gr9.sml gr9 gr9.sml sml 11911 164 150 IMAGE-THUMBNAIL 1-s2.0-S0926860X24000036-gr8.sml https://s3-eu-west-1.amazonaws.com/prod-ucs-content-store-eu-west/content/pii:S0926860X24000036/gr8/THUMBNAIL/image/gif/e9a004d9921dd8b8232e192660868a5f/gr8.sml gr8 gr8.sml sml 4652 60 219 IMAGE-THUMBNAIL 1-s2.0-S0926860X24000036-gr7.sml https://s3-eu-west-1.amazonaws.com/prod-ucs-content-store-eu-west/content/pii:S0926860X24000036/gr7/THUMBNAIL/image/gif/bc9fe66a8cc508525355dee08830988f/gr7.sml gr7 gr7.sml sml 5681 164 171 IMAGE-THUMBNAIL 1-s2.0-S0926860X24000036-gr6.sml https://s3-eu-west-1.amazonaws.com/prod-ucs-content-store-eu-west/content/pii:S0926860X24000036/gr6/THUMBNAIL/image/gif/4fb5c3ea6650eaefe1f2e8f30f58eb17/gr6.sml gr6 gr6.sml sml 18551 164 162 IMAGE-THUMBNAIL 1-s2.0-S0926860X24000036-gr5.sml https://s3-eu-west-1.amazonaws.com/prod-ucs-content-store-eu-west/content/pii:S0926860X24000036/gr5/THUMBNAIL/image/gif/0a65c8f139e049c49968277b3cc4aa6d/gr5.sml gr5 gr5.sml sml 6907 93 219 IMAGE-THUMBNAIL 1-s2.0-S0926860X24000036-gr4.sml https://s3-eu-west-1.amazonaws.com/prod-ucs-content-store-eu-west/content/pii:S0926860X24000036/gr4/THUMBNAIL/image/gif/59a0c5cb48b81861eeb42414f8b5434d/gr4.sml gr4 gr4.sml sml 5411 81 219 IMAGE-THUMBNAIL 1-s2.0-S0926860X24000036-gr10.sml https://s3-eu-west-1.amazonaws.com/prod-ucs-content-store-eu-west/content/pii:S0926860X24000036/gr10/THUMBNAIL/image/gif/6aed1b21028e7c0ec50e7aa59f6575ef/gr10.sml gr10 gr10.sml sml 6027 163 112 IMAGE-THUMBNAIL 1-s2.0-S0926860X24000036-gr3.sml https://s3-eu-west-1.amazonaws.com/prod-ucs-content-store-eu-west/content/pii:S0926860X24000036/gr3/THUMBNAIL/image/gif/bb8dc6c27286d0ab1ad6fb83bc25a7b3/gr3.sml gr3 gr3.sml sml 7834 73 219 IMAGE-THUMBNAIL 1-s2.0-S0926860X24000036-gr11.sml https://s3-eu-west-1.amazonaws.com/prod-ucs-content-store-eu-west/content/pii:S0926860X24000036/gr11/THUMBNAIL/image/gif/435950481b4a7ecae19847f6193a285c/gr11.sml gr11 gr11.sml sml 5623 164 198 IMAGE-THUMBNAIL 1-s2.0-S0926860X24000036-gr2.sml https://s3-eu-west-1.amazonaws.com/prod-ucs-content-store-eu-west/content/pii:S0926860X24000036/gr2/THUMBNAIL/image/gif/f423bf93307a36d857d2efea6f7a4692/gr2.sml gr2 gr2.sml sml 5904 164 178 IMAGE-THUMBNAIL 1-s2.0-S0926860X24000036-ga1.sml https://s3-eu-west-1.amazonaws.com/prod-ucs-content-store-eu-west/content/pii:S0926860X24000036/ga1/THUMBNAIL/image/gif/964a19fcdedff33cb3d97ce5b17098bd/ga1.sml ga1 true ga1.sml sml 6458 71 219 IMAGE-THUMBNAIL 1-s2.0-S0926860X24000036-gr1.sml https://s3-eu-west-1.amazonaws.com/prod-ucs-content-store-eu-west/content/pii:S0926860X24000036/gr1/THUMBNAIL/image/gif/3ce4b48b7db42f6d568f3e5a0c92234d/gr1.sml gr1 gr1.sml sml 5281 163 188 IMAGE-THUMBNAIL 1-s2.0-S0926860X24000036-gr9_lrg.jpg https://s3-eu-west-1.amazonaws.com/prod-ucs-content-store-eu-west/content/pii:S0926860X24000036/HIGHRES/image/jpeg/c0435cc871be4f4362e83cbad32d7300/gr9_lrg.jpg gr9 gr9_lrg.jpg jpg 520935 1910 1746 IMAGE-HIGH-RES 1-s2.0-S0926860X24000036-gr8_lrg.jpg https://s3-eu-west-1.amazonaws.com/prod-ucs-content-store-eu-west/content/pii:S0926860X24000036/HIGHRES/image/jpeg/2da423873c3d36d57439071eb52a11db/gr8_lrg.jpg gr8 gr8_lrg.jpg jpg 235655 866 3160 IMAGE-HIGH-RES 1-s2.0-S0926860X24000036-gr7_lrg.jpg https://s3-eu-west-1.amazonaws.com/prod-ucs-content-store-eu-west/content/pii:S0926860X24000036/HIGHRES/image/jpeg/5906a8c3e2a6e77a26c61f308459f763/gr7_lrg.jpg gr7 gr7_lrg.jpg jpg 187048 1677 1749 IMAGE-HIGH-RES 1-s2.0-S0926860X24000036-gr6_lrg.jpg https://s3-eu-west-1.amazonaws.com/prod-ucs-content-store-eu-west/content/pii:S0926860X24000036/HIGHRES/image/jpeg/a3f841bb5b904c6890895453716a531d/gr6_lrg.jpg gr6 gr6_lrg.jpg jpg 803802 3528 3493 IMAGE-HIGH-RES 1-s2.0-S0926860X24000036-gr5_lrg.jpg https://s3-eu-west-1.amazonaws.com/prod-ucs-content-store-eu-west/content/pii:S0926860X24000036/HIGHRES/image/jpeg/23fce706befa5f2812fd5cd821353885/gr5_lrg.jpg gr5 gr5_lrg.jpg jpg 335456 1268 2994 IMAGE-HIGH-RES 1-s2.0-S0926860X24000036-gr4_lrg.jpg https://s3-eu-west-1.amazonaws.com/prod-ucs-content-store-eu-west/content/pii:S0926860X24000036/HIGHRES/image/jpeg/45c4be4a2c950457e97b79c34ae90315/gr4_lrg.jpg gr4 gr4_lrg.jpg jpg 281983 1109 2994 IMAGE-HIGH-RES 1-s2.0-S0926860X24000036-gr10_lrg.jpg https://s3-eu-west-1.amazonaws.com/prod-ucs-content-store-eu-west/content/pii:S0926860X24000036/HIGHRES/image/jpeg/618a8f276ce986b4d1ee6aeb67809187/gr10_lrg.jpg gr10 gr10_lrg.jpg jpg 384305 2707 1858 IMAGE-HIGH-RES 1-s2.0-S0926860X24000036-gr3_lrg.jpg https://s3-eu-west-1.amazonaws.com/prod-ucs-content-store-eu-west/content/pii:S0926860X24000036/HIGHRES/image/jpeg/9274c0d12a9d8e8bd990368b89d47a14/gr3_lrg.jpg gr3 gr3_lrg.jpg jpg 380746 992 2994 IMAGE-HIGH-RES 1-s2.0-S0926860X24000036-gr11_lrg.jpg https://s3-eu-west-1.amazonaws.com/prod-ucs-content-store-eu-west/content/pii:S0926860X24000036/HIGHRES/image/jpeg/d937822deadddae0bd408cf7a7c662de/gr11_lrg.jpg gr11 gr11_lrg.jpg jpg 139435 1447 1746 IMAGE-HIGH-RES 1-s2.0-S0926860X24000036-gr2_lrg.jpg https://s3-eu-west-1.amazonaws.com/prod-ucs-content-store-eu-west/content/pii:S0926860X24000036/HIGHRES/image/jpeg/17db12f040f7b1b2f241568921870961/gr2_lrg.jpg gr2 gr2_lrg.jpg jpg 148975 1610 1746 IMAGE-HIGH-RES 1-s2.0-S0926860X24000036-ga1_lrg.jpg https://s3-eu-west-1.amazonaws.com/prod-ucs-content-store-eu-west/content/pii:S0926860X24000036/HIGHRES/image/jpeg/a54a7ae1e663b220cb8be714fa768161/ga1_lrg.jpg ga1 true ga1_lrg.jpg jpg 167866 715 2213 IMAGE-HIGH-RES 1-s2.0-S0926860X24000036-gr1_lrg.jpg https://s3-eu-west-1.amazonaws.com/prod-ucs-content-store-eu-west/content/pii:S0926860X24000036/HIGHRES/image/jpeg/5e031c645a649741c06e3ac7debfb826/gr1_lrg.jpg gr1 gr1_lrg.jpg jpg 107045 1518 1746 IMAGE-HIGH-RES 1-s2.0-S0926860X24000036-si0001.svg https://s3-eu-west-1.amazonaws.com/prod-ucs-content-store-eu-west/content/pii:S0926860X24000036/image/svg+xml/6f6abee4fad2f24f4d46061034c64f8e/si0001.svg si0001 si0001.svg svg 4412 ALTIMG 1-s2.0-S0926860X24000036-si0002.svg https://s3-eu-west-1.amazonaws.com/prod-ucs-content-store-eu-west/content/pii:S0926860X24000036/image/svg+xml/d32c0987b4ecc1004d84685510c4370d/si0002.svg si0002 si0002.svg svg 4019 ALTIMG 1-s2.0-S0926860X24000036-si0003.svg https://s3-eu-west-1.amazonaws.com/prod-ucs-content-store-eu-west/content/pii:S0926860X24000036/image/svg+xml/0ac83f5f0ea1a54bd0c029555f04471b/si0003.svg si0003 si0003.svg svg 3484 ALTIMG 1-s2.0-S0926860X24000036-am.pdf am am.pdf pdf 2246489 AAM-PDF https://s3-eu-west-1.amazonaws.com/prod-ucs-content-store-eu-west/content/egi:10XPDG0SN4Q/MAIN/application/pdf/9f56a0cf75937a76fb4d143794513567/am.pdf APCATA 119559 119559 S0926-860X(24)00003-6 10.1016/j.apcata.2024.119559 Fig. 1 Zeta potential of xMn-SBA-15 supports. Fig. 1 Fig. 2 SAXRD patterns of Pt/xMn-SBA-15 catalysts. Fig. 2 Fig. 3 XRD patterns of (A) calcined 10Mn-SBA-15 support and Pt/xMn-SBA-15 catalysts and (B) reduced Pt/xMn-SBA-15 catalysts. Fig. 3 Fig. 4 (A) N2 adsorption-desorption isotherms and (B) pore size distributions of Pt/xMn-SBA-15 catalysts. Fig. 4 Fig. 5 Raman spectra of (A) the calcined Pt/xMn-SBA-15 catalysts and (B) the reduced Pt/xMn-SBA-15 catalysts. a: Pt/SBA-15; b: Pt/5Mn-SBA-15; c: Pt/10Mn-SBA-15; d: Pt/20Mn-SBA-15. Fig. 5 Fig. 6 STEM, TEM images and EDS mapping of Pt/SBA-15 (A), Pt/5Mn-SBA-15 (B), Pt/10Mn-SBA-15 (C, D, E and F) and Pt/20Mn-SBA-15 (G, H and I) catalysts. The insets of Figs. 6A, 6B, 6D and 6H are the nanoparticle size distribution of Pt. Fig. 6 Fig. 7 DRIFT spectra of CO adsorption on Pt/xMn-SBA-15 catalysts. Fig. 7 Fig. 8 Time on stream for (A) Propane conversion and (B) propene selectivity over 10Mn-SBA-15 support and Pt/xMn-SBA-15 catalysts; (C) The deactivation rate constant of Pt/xMn-SBA-15 catalysts. Fig. 8 Fig. 9 XRD patterns of spent Pt/xMn-SBA-15 catalysts. Fig. 9 Fig. 10 Raman spectra of spent Pt/xMn-SBA-15 catalysts. Fig. 10 Fig. 11 TG curves of Pt/xMn-SBA-15 catalysts after 6 h reaction. a: Pt/ SBA-15; b: Pt/5Mn-SBA-15; c: Pt/10Mn-SBA-15; d: Pt/20Mn-SBA-15. Fig. 11 Table 1 Mn content on xMn-SBA-15 supports measured by ICP-MS. Table 1 Samples Mn content (wt%) 5Mn-SBA-1510Mn-SBA-1520Mn-SBA-15 0.050.162.10 Table 2 Textural properties of Pt/xMn-SBA-15 catalysts. Table 2 Samples SBETa(m2·g−1) dBJH b(nm) Vt c(cm3·g−1) Pt/SBA-15 428.5 7.3 0.93 Pt/5Mn-SBA-15 397.9 7.1 0.86 Pt/10Mn-SBA-15 486.4 6.1 0.91 Pt/20Mn-SBA-15 478.6 4.7 0.72 a Calculated by the BET method. b Average pore diameter was calculated using the BJH method. c Calculated by BJH cumulative volume of pores between 1.7 nm and 300 nm diameter. Table 3 Catalytic performances of propane dehydrogenation over 10Mn-SBA-15 support and Pt/xMn-SBA-15 catalysts. Table 3 Samples Propane conversion/% Propene selectivity/% TOFb/ s−1 STYc/mol gPt −1 h−1 ID/IG Initial Finala Initial Finala 10Mn-SBA-15 3.6 3.2 52.9 52.8 Pt/SBA-15 42.6 15.7 98.5 98.0 2.2 4.49 1.45 Pt/5Mn-SBA-15 46.0 31.4 98.7 99.2 1.7 4.86 1.77 Pt/10Mn-SBA-15 51.2 49.3 97.4 98.8 0.6 5.34 0.58 Pt/20Mn-SBA-15 50.2 45.4 98.7 99.3 0.4 5.30 0.70 a PDH reaction after 6 h b TOF calculated with the initial propane conversion. c STY of propene obtained at the initial propane conversion. Stable Pt catalysts anchored by Mn-SBA-15 support for propane dehydrogenation Xiaoqiang Fan Conceptualization Data curation Formal analysis Investigation Project administration Writing – original draft Writing – review & editing Resources Visualization a Ying Yang Data curation Formal analysis Investigation Methodology Validation Visualization a Jiaxin Song Data curation Methodology Formal analysis Visualization b Yiou Shan Data curation Formal analysis Validation a Xuehua Yu Formal analysis Methodology a Lian Kong Formal analysis Methodology a Xia Xiao Formal analysis Methodology a Zean Xie Formal analysis Methodology a Zhen Zhao Conceptualization Project administration Resources Supervision Writing – review & editing a b ⁎ a Institute of Catalysis for Energy and Environment, College of Chemistry and Chemical Engineering, Shenyang Normal University, Shenyang 110034, China Institute of Catalysis for Energy and Environment, College of Chemistry and Chemical Engineering, Shenyang Normal University Shenyang 110034 China Institute of Catalysis for Energy and Environment, College of Chemistry and Chemical Engineering, Shenyang Normal University, Shenyang 110034 b State Key Laboratory of Heavy Oil Processing, China University of Petroleum, Beijing 102249, China State Key Laboratory of Heavy Oil Processing, China University of Petroleum Beijing 102249 China State Key Laboratory of Heavy Oil Processing, China University of Petroleum, Beijing 102249 ⁎ Corresponding author at: Institute of Catalysis for Energy and Environment, College of Chemistry and Chemical Engineering, Shenyang Normal University, Shenyang 110034, China. Institute of Catalysis for Energy and Environment, College of Chemistry and Chemical Engineering, Shenyang Normal University Shenyang 110034 China The development of stable Pt-based catalysts is important for propane dehydrogenation process. In this work, Mn-SBA-15 supports with different Mn doping amounts were prepared by in situ hydrothermal method using citric acid and urea. Compared with Pt/SBA-15 catalyst, the significantly improved dispersion and stability of Pt on Pt/Mn-SBA-15 catalysts were demonstrated by X-ray diffraction and transmission electron microscopy results. CO DRIFT spectra analysis showed the electron transfer from Mn to Pt occurred, which led to an increase in the electron density of Pt. And the propane dehydrogenation performances over Pt/Mn-SBA-15 were enhanced significantly. Among them, the Pt/10Mn-SBA-15 shows the highest initial propane conversion of 51.2% and lowest deactivation rate constant of 0.013 h−1. The reason may be that appropriate amount of Mn can modify Pt by both electronic effect and geometric effect. And the strong metal-support interaction formed by highly dispersed MnO x anchor sites in Mn-SBA-15 support maintains the stability of Pt during the propane dehydrogenation reaction. Graphical Abstract ga1 Keywords Propane dehydrogenation Support anchoring effect Stable Pt-based Data availability Data will be made available on request. 1 Introduction Propylene is a basic raw material used in the production of polypropylene, acrylonitrile, acrolein, acetone, and other industrial products.[1–3] The traditional methods of obtaining propylene are the catalytic cracking of oil and the cracking of naphtha, which makes it unable to meet current demand.[4] Propane dehydrogenation (PDH) to propylene as an on-purpose propylene production route provides an alternative approach and has attracted extensive attention.[5,6]. Platinum-based catalysts are widely used in PDH reactions because of their superior propane C–H bond activation.[7,8] Most Pt-based catalysts operate at above 500 °C to attain high propane conversion. However, such harsh reaction conditions in PDH reactions cause catalyst deactivation due to Pt sintering and coke deposition.[9] The modification of Pt with a second metal is an efficient strategy to enhance the stability of these catalysts.[10] Promoters, such as Sn, [11–15] Ga, [16–18] In, [19–21] Zn, [22,23] and Cu[24,25] can enhance the catalytic performance of Pt-based catalysts by improving the geometric dispersion of Pt and modifying its electric structure. Recently, Mn was reported to act as a promoter that can considerably enhance the PDH performance of Pt-based catalysts.[26,27] Our previous work had found that a highly dispersed MnO x decorated dendritic mesoporous silica nanoparticle (DMSN) support shows exceptionally ability to disperse and stabilize Pt clusters. The alloying of Pt and Mn allows electron transfer from Mn to Pt to occur, which leads to an increase in the electron density of Pt and enhances propene desorption.[28] Compared with a DMSN support, SBA-15 shows a highly ordered mesoporous structure.[29] Most importantly, it is prepared in acidic conditions, which avoids the direct precipitation of Mn precursors as MnO x agglomerates or crystals under alkaline conditions during the synthesis of DMSN. That is, acidic conditions are conducive to the formation of highly dispersed MnO x anchor sites. However, the rapid hydrolysis of the silica precursor in strongly acidic conditions makes the rapid formation of monolith SBA-15 and Mn precursor the dominant species in the solution because of the large difference in condensation speed between the silica and Mn precursors. A weakly acidic system, in which the hydrolysis of silica precursor is slow [30], is beneﬁcial for in situ functional modification. Herein, the Mn-SBA-15 supports were prepared under weakly acidic conditions using citric acid and urea to balance the condensation speed of silica and Mn precursors to promote the formation of highly dispersed MnO x anchor sites. In order to investigate the optimal interaction between the active component Pt and Mn-SBA-15 support, different contents of transition metal Mn species were included as additives during the preparation of SBA-15, and a synergistic effect between Pt active sites and the support in PDH performance of the catalysts were explored. The PDH performance over Pt/SBA-15 can be significantly enhanced by introducing Mn. The addition of Mn with an appropriate amount in SBA-15 supports enhances the interaction of metal Pt and support, resulting in high dispersion and stability of Pt on Pt/Mn-SAB-15 catalysts, which results in improved PDH performance. 2 Experimental 2.1 Preparation of the catalysts 2.1.1 Synthesis of Mn-SBA-15 The Mn-SBA-15 support was synthesized using an in situ hydrothermal method. In a typical procedure, 3 g of P123 was added to 112 mL of deionized water and stirred until the P123 was completely dissolved. Then 6.9 g of citric acid, 3.6 g of urea, Mn(NO3)2, and 13.4 mL of tetraethyl orthosilicate were added and stirred for 24 h. The mixture was transferred to a stainless steel Teflon-lined autoclave and maintained at 100 °C for 24 h, and then the autoclave was cooled. The samples were filtered, washed, and dried at 60 °C for 24 h. Finally, the Mn-SBA-15 support was obtained by calcining at 550 °C for 6 h. The theoretical doping of the transition metal Mn doping amounts are 5 wt%, 10 wt%, and 20 wt%. For clarity, the Mn-SBA-15 supports are named xMn-SBA-15, where x represents the Mn doping amount. The preparation of the SBA-15 support was performed using the procedure as that for Mn-SBA-15 except for the absence of Mn(NO3)2. 2.1.2 Synthesis of Pt/xMn-SBA-15 Pt/xMn-SBA-15 catalysts were prepared using the incipient wetness impregnation method with H2PtCl6·6 H2O as the precursor. An aqueous solution of H2PtCl6·6 H2O was added to the Mn-SBA-15 support. Then, the mixture was ultrasonic treatment for 30 min and dried at 60 °C for 12 h. After which, the samples were calcined at 500 °C for 4 h. For comparison, Pt/SBA-15 was also prepared using the SBA-15 support. The Pt loading amount was 0.5 wt% on all samples. 2.2 Catalyst characterization XRD characterization was performed using a type UltimaⅣ diffractometer from RIGAKU. The small angle test range was 0.6–5° at a speed of 1 min−1. The wide angle test range was 10°− 90°, and the scan speed was 5° min−1. N2-adsorption/desorption was performed on a Model 3020 physical adsorption instrument. The real Mn content of the samples was tested on an AGILENT 7900 inductively coupled plasma (ICP) mass spectrometer. Raman spectroscopy was conducted using a LabRAM HR Evolution Raman spectrometer. The fresh catalysts were tested using a 325 nm laser with a range of 400–1200 cm−1, and the spent samples were tested using a 532 nm laser with a range of 1000–1800 cm−1. The zeta potential of the Mn-SBA-15 supports was tested on a Malvern Nano ZS90 analyzer. A total of 10 mg of sample was added to 1000 mL of aqueous solution, sonicated for 15 min, and the sample was transferred to the test pool for further testing. The spent catalysts were analyzed using a STA449F5 thermoweight analyzer. CO-DRIFT spectra were carried out on a Bruker VERTEX 80 v Fourier-transformed infrared spectrometer with an MCT detector. The samples were pretreated by 10% H2/Ar at 300 °C. After switching to Ar flow and cooled to 60 °C, the samples were exposed to 10% CO/Ar for 30 min. Finally, the samples were purged with Ar and the spectra were recorded. 2.3 Catalytic activity test The activity measurements for PDH were conducted in a conventional quartz tubular microreactor. A total of 200 mg of catalyst was placed into the quartz reactor and reduced at 500 °C in 10% H2/Ar for 4 h before the reaction. A mixture of propane and N2 with a C3H8:N2 ratio of 1:2 (total 12 mL·min−1) were introduced for activity evaluation at the temperature of 590 °C. The reaction products were analyzed using an online Agilent 7890B gas chromatography. The conversion of propane, selectivity for propene, and deactivation rate constant were defined as follows: X C 3 H 8 = C H 4 + 2 C 2 H 4 + 2 C 2 H 6 + 3 C 3 H 6 C H 4 + 2 C 2 H 4 + 2 C 2 H 6 + 3 C 3 H 6 + 3 C 3 H 8 × 100 % S C 3 H 6 = 3 C 3 H 6 C H 4 + 2 C 2 H 4 + 2 C 2 H 6 + 3 C 3 H 6 × 100 % k d = ln 1 − X f i n a l X f i n a l − ln 1 − X i n i t i a l X i n i t i a l t where Xinitial and Xfinal represent the initial and final propane conversion, respectively. 3 Results and discussions 3.1 Characterization of Mn-SBA-15 support In order to attain the real content of Mn on the Mn-SBA-15 supports, ICP characterization was conducted, and the results are shown in Table 1. Theoretically, the Mn doping amount in the support is 5 wt%, 10 wt%, and 20 wt%, respectively. From Table 1, the actual metal loads were much lower than the theoretical loadings, which implies that Mn species can only be partially doped into the surface or framework of SBA-15 support during the hydrothermal process.[31] This may be caused by the acidic conditions making the Mn precursor the dominant species in the solution. Moreover, the real Mn doping amount increases with an increase in the theoretical Mn doping amount, indicating the doping effect can be enhanced upon increasing the amount of Mn(NO3)2 in material preparation. Fig. 1 shows the zeta potential of xMn-SBA-15 supports. As shown in Fig. 1, all xMn-SBA-15 supports have negative charges in aqueous solution due to the presence of silanol groups on the surface of the SBA-15 support. With an increase in Mn doping amount, the zeta potential of the supports showed a trend of first increasing and then decreasing, with the highest potential obtained with the 10Mn-SBA-15 support. This may be caused by the formation of Si–O–Mn, which consumes a part of the silanol group, and decreases the amount of negative charge on the surface of the SBA-15 support. The zeta potential drops once more on 20Mn-SBA-15 support. This may be due to the aggregation of MnOx species on the high Mn loading sample. The aggregated MnOx species reduced the consumption of surface silanol groups of SBA-15, which results in the drops of the zeta potential. It has been found that there were mostly hydroxyl groups on the surface of the silica nanoparticles that had the highest absolute value of zeta potential among the supports. In contrast to the SBA-15 support, the modification of Mn2+ consumed the surface silanol groups of SBA-15; thus, the xMn-SBA-15 supports have fewer negative charges. During the impregnation process, the negatively charged SBA-15 support exhibited repulsion of the [PtCl6]2− species. However, the relative positive sites caused by Mn decoration can anchor [PtCl6]2− species, making it more suitable for the formation of Pt active centers with high stability and dispersion, which is more conducive to the dispersion of platinum particles. 3.2 Characterization of Pt/Mn-SBA-15 catalysts Fig. 2 shows small-angle XRD patterns of the Pt/xMn-SBA-15 catalysts. All Pt/xMn-SBA-15 catalysts show characteristic peaks belonging to (100), (110), and (200) planes of the hexagonal lattice of SBA-15 between 2θ angles of 0.5° and 2°[32], indicating that all Pt/xMn-SBA-15 catalysts had an ordered mesoporous structure. The intensity of the diffraction peaks decreases with an increase in Mn doping amount, indicating that the addition of Mn reduces the degree of mesoporous order in SBA-15. It may be because Mn species enter into the SiO2 framework, influencing the cooperative assembly of the silica precursor to the ordered mesoporous structure. When the doping amount is raised to 20%, the diffraction peak shifts to a high degree, indicating a decrease in mesopore size. This may be caused by the formation of MnOx species on the surface of mesopores. Fig. 3A displays the wide-angle XRD patterns of calcined Pt/xMn-SBA-15 catalysts and 10Mn-SBA-15 support. All samples show a characteristic diffraction peak attributed to amorphous SiO2 at 2θ of 23.5°. There is no diffraction peak ascribed to MnOx on the sample of the 10Mn-SBA-15 support, indicating the high dispersion of Mn species. In addition, the characteristic diffraction peaks at 2θ of 39.8° and 46.2° attributed to Pt(111) and Pt(200) appeared on the Pt/SBA-15 catalyst, indicating the formation of Pt particles.[34] After Mn doping, the Pt/5Mn-SBA-15 catalyst has a characteristic peak attributed to Pt(111) at 2θ of 39.8°, with the diffraction peak intensity lower than that of the Pt/SBA-15 catalyst. It indicates that the addition of Mn is beneficial to improve the dispersion of Pt. With an increase in Mn doping amount, no diffraction peak is ascribed to Pt in the patterns, indicating that Pt exists in a highly dispersed form on the support. In addition, there is no characteristic diffraction peak of the MnOx species, which may be because the Mn species replaced silicon atoms in the SBA-15 support, was doped into the framework of SBA-15, or formed an amorphous phase below the detection limit. The XRD results show that Mn doping does not destroy the original ordered mesoporous structure of the SBA-15 support, and the appropriate Mn doping amount is beneficial to improve the dispersion of Pt, which is favorable for improving the PDH performance of the catalyst. Fig. 3B shows the XRD patterns of the reduced Pt/xMn-SBA-15 catalysts. It can be seen from Fig. 3B that the reduced Pt/SBA-15 and Pt/5Mn-SBA-15 catalysts show characteristic peaks attributed to Pt(111) and Pt(200), and the diffraction peak intensity of the Pt/5Mn-SBA-15 catalyst is lower than that of the Pt/SBA-15 catalyst, which shows that the addition of Mn is beneficial to improving the dispersion of Pt. The reduced Pt/20Mn-SBA-15 catalyst showed a characteristic peak attributed to PtMn3(111) at a 2θ angle of 40.7°[35], indicating the formation of PtMn3 alloy. For Pt/10Mn-SBA-15 catalysts, the characteristic peaks attributed to PtxMny were not detected, which may be due to the formation of highly dispersed active sites on the catalysts. Fig. 4 shows the N2-adsorption/desorption isotherms and pore size distributions of Pt/xMn-SBA-15 catalysts with different Mn doping amounts. As shown in Fig. 4 A, Pt/xMn-SBA-15 catalysts show type Ⅳ isotherms with an H1 hysteresis loop, indicating typical mesoporous structural characteristics.[33] The hysteresis loop of the catalyst moves to the relatively low pressure for the Pt/20Mn-SBA-15 catalyst, which indicates that the pore size of the sample decreases. It can be seen from Fig. 4B that the pore size distribution of the Pt/xMn-SBA-15 catalyst is uniform, and the pore size of the catalyst gradually decreases with an increase in Mn doping amount, especially on the Pt/20Mn-SBA-15 catalyst. This is consistent with the SAXRD results. Table 2 lists the textural properties of the Pt/xMn-SBA-15 catalysts. Among them, the specific surface areas of the Pt/SBA-15 and Pt/5Mn-SBA-15 catalysts are 428.5 m2·g−1 and 397.9 m2·g−1, respectively. The specific surface areas are relatively small because Pt is agglomerated in the mesopores, confirmed by the characterization results from the wide-angle XRD analysis. For the Pt/10Mn-SBA-15 and Pt/20Mn-SBA-15 catalysts, the specific surface areas are 486.4 m2·g−1 and 478.6 m2·g−1, higher than those of Pt/SBA-15 and Pt/5Mn-SBA-15 catalysts. This may be caused by the influence of Mn(NO3)2 content on the cooperative assembly of Mn and Si precursor during the preparation of Mn-SBA-15 and the high dispersion of Pt and Mn species. The pore size and pore volume of the Pt/SBA-15 catalyst are 7.3 nm and 0.93 cm3·g−1, respectively, and those of the Pt/5Mn-SBA-15 catalyst are 7.1 nm and 0.86 cm3·g−1, respectively. When the Mn doping amount increases to 10%, the pore size of the catalyst decreases from 7.1 nm to 6.1 nm. When the Mn doping amount reaches 20%, the pore size of the catalyst continues to decrease to 4.7 nm, and the pore volume decreases to 0.72 cm3·g−1. This is because, with the increasing Mn content, the surface of the support is gradually covered with MnOx species, resulting in smaller pore sizes and lower pore volumes. Fig. 5 shows the Raman spectra of calcined and reduced Pt/xMn-SBA-15 catalysts. All spectra of the calcined Pt/xMn-SBA-15 show a band at about 489 cm−1 from D1 defect modes related to the tri-cycloxiloxane ring of the SBA-15 support.[36] The calcined Pt/SBA-15 sample gives rise to a band at 982 cm−1 ascribed to the surface Si-OH stretching mode. [36] This band shifts to 978 cm−1 in the Pt/xMn-SBA-15 catalysts, indicating the formation of the Si−O−Mn bond. [37] Moreover, the band at 582 cm−1 of the Pt/20Mn-SBA-15 sample represents the Si−O−Mn vibration.[38] This phenomenon indicates that Mn is highly dispersed on the surface of the support or enters into the framework of SBA-15. This is consistent with the characterization results from wide-angle XRD characterization. Fig. 5B displays the Raman spectra of the reduced Pt/xMn-SBA-15 catalysts. It can be seen from Fig. 5B that the disappearance of the peak shift at 980 cm−1 for Pt/Mn-SBA-15 and Pt/SBA-15, indicating the consumption of Mn species on the surface Si−O−Mn and the formation of PtxMny alloy. In order to investigate the morphology of the catalysts and the dispersion of Pt, the TEM, STEM images and EDS mapping are shown in Fig. 6. The highly ordered mesoporous structure is shown in all samples, indicating the formation of SBA-15 and Mn-SBA-15 support. The similar morphologies of the SBA-15 and Mn-SBA-15 supports illustrate the negligible effect on the mesoporous structure caused by in situ Mn doping during the synthesis of these supports. Moreover, the Pt nanoparticles with a size of about 10.2 nm are distributed on the Pt/SBA-15 samples, as shown in Fig. 6A. A more uniformly distributed nanoparticles are shown over Pt/5Mn-SBA-15 catalyst in Fig. 6B. And the size of Pt nanoparticles decreases to about 7.6 nm over Pt/5Mn-SBA-15 catalysts, indicating the addition of Mn increase the dispersion of Pt. With the increasing of Mn content, the nanoparticle sizes further decrease with the size of 2.2 nm and 1.5 nm on Pt/10Mn-SBA-15 and Pt/20Mn-SBA-15 catalyst, as shown in the inset of Figs. 6D and 6H. The metal dispersion is obviously improved because of the formation of highly dispersed MnOx anchor sites on the surface of Mn-SBA-15 support. Fig. 6F shows the EDS mapping and the linear scanning of a nanoparticle of Pt/10Mn-SBA-15catalyst. It can be seen that the dispersion of Mn mainly in the outside of the nanoparticle and the support, indicating the anchor effect of Mn to Pt. According to the TEM results, the addition of Mn improves the dispersion of Pt and makes it stable because of strong metal-support interaction caused by the MnOx anchor sites. In situ, DRIFT spectra of CO adsorption were performed to identify the influence of Mn on the surface structure and electronic properties of Pt/xMn-SBA-15 catalysts, the results of which are displayed in Fig. 7. For the Pt/SBA-15 catalyst, the absorption band appearing at 2071 cm−1 is ascribed to linear CO adsorbed on terrace sites of the Pt species.[39] Based on the DRIFT spectra of the Pt/5Mn-SBA-15 and Pt/10Mn-SBA-15 catalysts, there are two bands centered at 2058 cm−1 and 2062 cm−1 which occur upon the introduction of Mn, which are attributed to linear CO adsorbed on step sites. [40] The red shift of the CO stretching frequency and the change in adsorption position from the Pt/SBA-15 to Pt/Mn-SBA-15 catalysts indicates the formation of the PtMn alloy phase and electron transfer from Mn to Pt. [17,41] However, with a further increase in Mn doping, it is obvious that the intensity of the adsorption band decreased on the Pt/20MnSBA-15 catalyst, indicating that excessive Mn doping will lead to some active site Pt becoming covered, which will affect the activity of these Pt/xMn-SBA-15 catalysts. 3.3 Catalytic activity measurements The performances of Pt/xMn-SBA-15 catalysts doped with different transition metal Mn contents were evaluated for PDH reaction. Moreover, the activity of 10Mn-SBA-15 support and Pt/SBA-15 were also evaluated. Fig. 8 shows the PDH performance of the 10Mn-SBA-15 support and Pt/xMn-SBA-15 catalysts. It can be seen from Fig. 8 and Table 3 that the 10Mn-SBA-15 support is inactive in PDH, with an initial propane conversion and propylene selectivity of 3.6% and 52.9%, respectively. This indicates that the Mn species in the xMn-SBA-15 support has no catalytic dehydrogenation ability. For the Pt/SBA-15 catalyst, the initial propane conversion is 42.6%, which indicates that Pt acted as the active site to activate the propane C–H bond. The propane conversion dropped rapidly to 15.7% after 6 h of reaction over the Pt/SBA-15 catalyst, indicating rapid deactivation. When the transition metal Mn species is added, the PDH performance of these catalysts is improved. The initial propane conversion first increased and then decreased with an increase in the Mn content. The highest propane conversion is 51.2% over Pt/10Mn-SBA-15. More importantly, the deactivation is suppressed after the addition of the Mn species, which can be demonstrated by the lower deactivation rate constant, as shown in Fig. 6C. Based on Fig. 8B, displaying the change in propylene selectivity with time, it can be observed that the propylene selectivity of Pt/xMn-SBA-15, including the Pt/SBA-15 catalyst, is above 97%. It indicates these catalysts produce fewer by-products, and SBA-15 is a suitable support for the PDH reaction. In summary, the PDH performance over Pt/xMn-SBA-15 catalysts first increased and then decreased, among which the Pt/10Mn-SBA-15 catalyst shows the highest propane conversion and the lowest deactivation rate constant of 0.013 h−1. The TOF were calculated over these catalysts and shown in Table 3. It can been seen that the TOF decrease with the increasing of Mn content. It is because of the electron transfer from Mn to Pt makes the increasing of Pt electron density and resulting in favorable desorption of propene and decreased C-H activation of propane. Moreover, because of the geometric effect of Mn, the dispersion of Pt increases with the increasing of Mn content. Therefore, although the TOF decreases, the space time yield of propene (STY) increasing with the increasing of Mn content. Upon analyzing and comparing the catalytic performance of Pt/xMn-SBA-15 catalyst for PDH, it was found that with an increase in Mn doping amount, the PDH activity of these catalysts first increased and then decreased. This is due to the addition of Mn increasing the interaction between metal Pt and SBA-15 support, resulting in improved Pt dispersion. The low Mn doping amount for Pt/5Mn-SBA-15 is insufficient to anchor Pt with a certain agglomeration phenomenon of Pt occurring on the surface of SBA-15 support. Excessive Mn doping on Pt/20Mn-SBA-15 may result in the covering of Pt and a reduction in catalytic performance. With an appropriate amount of Mnn+ species in the support over Pt/10Mn-SBA-15, synergy with the SBA-15 support can be enhanced. A strong interaction between Pt and Mn formed and the electron transfer from Mn to Pt occurred, which led to an increase in the electron density of Pt and resulted in enhanced PDH performance. 3.4 Analysis of catalyst structure and carbon deposition In order to investigate the structural change in Pt/xMn-SBA-15 during the PDH reaction, XRD patterns over Pt/xMn-SBA-15 catalysts before and after the reaction are shown in Fig. 9. The increased intensity of characteristic peaks ascribed to Pt over spent Pt/SBA-15 catalyst indicates the aggregation of Pt during the PDH reaction, which results in decreased propane conversion and rapid deactivation during the reaction. This also occurs on the Pt/5Mn-SBA-15 catalyst to a reduced extent. For the Pt/10Mn-SBA-15 catalyst, there are no diffraction peaks after the reaction, indicating that the highly dispersed Pt or PtMn species possess high stability under harsh reaction conditions. The high stability of these PtMn sites contributed to the enhanced catalytic stability. Raman spectroscopy was used to characterize the coke deposition of the spent catalysts. As shown in Fig. 10, the bands at 1330 cm−1 and 1600 cm−1 in all samples belonging to the D and G bands[42]. This shows that Pt/xMn-SBA-15 catalysts have a similar type of carbon deposition. Among them, the characteristic peak at 1330 cm−1 indicates that the generated carbon deposit exists in a disordered state[43]. The characteristic peak at 1600 cm−1 indicates carbon species with a high order in the catalyst[44]. In addition, the ratio of D-band to G-band (ID/IG) can indicate the graphitization degree of the coke.[45] The results of the ID/IG ratio are listed in Table 3. The Pt/SBA-15 and Pt/5Mn-SBA-15 catalysts show high ID/IG ratios, which indicates that the graphitization degree of coke deposits generated by catalysts with larger Pt particles is low. With an increase in the transition metal Mn doping amount, the Pt/10Mn-SBA-15 and Pt/20Mn-SBA-15 catalysts show smaller ID/IG ratios, which indicates that the graphitization degree of coke deposits generated by catalysts with better Pt dispersion is high, and the coke deposits generated by these catalysts are mainly graphitized carbon deposits. In order to further investigate the coke deposition on the catalyst, thermogravimetric analysis was conducted and the results are shown in Fig. 11. The amount of coke increases with an increase in the Mn doping amount. There are two types of weight loss, which represent two types of coke deposition. First, weight loss at low temperatures represents the formation of coke deposits on the Pt active site. Second, the coke precursor on the metal is transferred to the xMn-SBA-15 support, after which coke deposits are formed. Among the Pt/xMn-SBA-15 catalysts, the coke deposited on metals or support is not obvious on the Pt/SBA-15 catalyst. Moreover, the weight loss is 2.5%, indicating that the amount of coke is low. This is related to the low activity of the Pt/SBA-15 catalyst. Compared with the Pt/SBA-15 catalyst, coke was mainly deposited on the support, not the metal, when using Pt/Mn-SBA-15 catalysts, indicating the addition Mn favorable coke migration from metal to support, similar to the effect of promoter Sn.[46] It shows that the addition of appropriate transition metal Mn species is beneficial to the transfer of coke deposits from active sites to the support, thus exposing more active sites and maintaining activity. 4 Conclusions The Mn-SBA-15 supports were prepared by in situ hydrothermal method under the condition of citric acid and urea. The addition of Mn in SBA-15 supports enhances the interaction of metal Pt and support, resulting in high Pt dispersion on Pt/Mn-SAB-15 catalysts. Moreover, the electron-donating property of Mn species increases the electron density on Pt, which is beneficial to the desorption of propylene product and can effectively inhibit the deep dehydrogenation, thus improving the PDH performance of the catalyst. Pt/xMn-SBA-15 catalysts doped with different contents of transition metal Mn species were applied to PDH, among which Pt/10Mn-SBA-15 catalyst showed the highest catalytic performance. After 6 h reaction, the propane conversion decreased from 51.2% to 49.3%, and the propylene selectivity remained above 97%. The reason is that an appropriate amount Mn doping can effectively stabilize the high dispersion Pt active sites by the strong metal-support interaction, thus enhancing PDH performance of the Pt/10Mn-SBA-15 catalyst. CRediT authorship contribution statement Zhao Zhen: Conceptualization, Project administration, Resources, Supervision, Writing – review & editing. Xie Zean: Formal analysis, Methodology. Kong Lian: Formal analysis, Methodology. Xiao Xia: Formal analysis, Methodology. Shan Yiou: Data curation, Formal analysis, Validation. Yu Xuehua: Formal analysis, Methodology. Yang Ying: Data curation, Formal analysis, Investigation, Methodology, Validation, Visualization. Song Jiaxin: Data curation, Methodology, Formal analysis, Visualization. Fan Xiaoqiang: Conceptualization, Data curation, Formal analysis, Investigation, Project administration, Writing – original draft, Writing – review & editing, Resources, Visualization. Declaration of Competing Interest The authors declare that they have no known competing financial interests or personal relationships that could have appeared to influence the work reported in this paper. Acknowledgements We acknowledge the financial support from National Natural Science Foundation of China (22172101, 92145301), the Science and Technology Planning Project of Shenyang (22−322-3−28), Xingliao Talent Program (XLYC2203138), Applied Basic Research Program of Liaoning Province (2023JH2/101600059), Major Incubation Program of Shenyang Normal University. References [1] S. Chen X. Chang G. Sun T. Zhang Y. Xu Y. Wang C. Pei J. Gong Chem. Soc. Rev. 50 2021 3315 3354 S. Chen, X. Chang, G. Sun, T. Zhang, Y. Xu, Y. Wang, C. Pei, J. Gong, Chem. Soc. Rev. 50 (2021) 3315–3354. [2] T. Otroshchenko G. Jiang V.A. Kondratenko U. Rodemerck E.V. Kondratenko Chem. Soc. Rev. 50 2021 473 527 T. Otroshchenko, G. Jiang, V.A. Kondratenko, U. Rodemerck, E.V. Kondratenko, Chem. Soc. Rev. 50 (2021) 473–527. [3] C. Li G. Wang Chem. Soc. Rev. 50 2021 4359 4381 C. Li, G. Wang, Chem. Soc. Rev. 50 (2021) 4359–4381. [4] S.A. Chernyak M. Corda J.P. Dath V.V. Ordomsky A.Y. Khodakov Chem. Soc. Rev. 51 2022 7994 8044 S.A. Chernyak, M. Corda, J.P. Dath, V.V. Ordomsky, A.Y. Khodakov, Chem. Soc. Rev. 51 (2022) 7994–8044. [5] X. Liu W.Z. Lang L.L. Long C.L. Hu L.F. Chu Y.J. Guo Chem. Eng. J. 247 2014 183 192 X. Liu, W.Z. Lang, L.L. Long, C.L. Hu, L.F. Chu, Y.J. Guo, Chem. Eng. J. 247 (2014) 183–192. [6] T. Srisakwattana S. Watmanee S. Wannakao C. Saiyasombat P. Praserthdam J. Panpranot Appl. Catal. A Gen. 615 2021 118053 T. Srisakwattana, S. Watmanee, S. Wannakao, C. Saiyasombat, P. Praserthdam, J. Panpranot, Appl. Catal. A Gen. 615 (2021) 118053. [7] Y. He H. Deng Y. Zhang X. Wang W. Zheng Z. Ren L. Tan Y. Tang L. Wu Fuel 352 2023 129044 Y. He, H. Deng, Y. Zhang, X. Wang, W. Zheng, Z. Ren, L. Tan, Y. Tang, L. Wu, Fuel 352 (2023) 129044. [8] Y. Wang Y. Suo X. Lv Z. Wang Z.Y. Yuan J. Colloid Interf. Sci. 593 2021 304 314 Y. Wang, Y. Suo, X. Lv, Z. Wang, Z.Y. Yuan, J. Colloid. Interf. Sci. 593 (2021) 304–314. [9] X. Chen M. Peng D. Xiao H. Liu D. Ma ACS Catal. 12 2022 12720 12743 X. Chen, M. Peng, D. Xiao, H. Liu, D. Ma, ACS Catal. 12 (2022) 12720−12743. [10] B. Feng Y.C. Wei W.Y. Song C.M. Xu Petrol. Sci. 19 2022 819 838 B. Feng, Y.C. Wei, W.Y. Song, C.M. Xu, Petrol. Sci. 19 (2022) 819−838. [11] A.H. Motagamwala R. Almallahi J. Wortman V.O. Igenegbai S. Linic Science 373 2021 217 222 A.H. Motagamwala, R. Almallahi, J. Wortman, V.O. Igenegbai, S. Linic, Science 373 (2021) 217−222. [12] L. Liu M. Lopez-Haro C.W. Lopes S. Rojas-Buzo P. Concepcion R. Manzorro L. Simonelli A. Sattler P. Serna J.J. Calvino A. Corma Nat. Catal. 3 2020 628 638 L. Liu, M. Lopez-Haro, C.W. Lopes, S. Rojas-Buzo, P. Concepcion, R. Manzorro, L. Simonelli, A. Sattler, P. Serna, J.J. Calvino, A. Corma, Nat. Catal. 3 (2020) 628−638. [13] I. Lezcano-González P. Cong E. Campbell M. Panchal M. Agote-Arán V. Celorrio Q. He R. Oord B.M. Weckhuysen A.M. Beale ChemCatChem 14 2022 e202101828 I. Lezcano-González, P. Cong, E. Campbell, M. Panchal, M. Agote-Arán, V. Celorrio, Q. He, R. Oord, B.M. Weckhuysen, A.M. Beale, ChemCatChem 14 (2022) e202101828. [14] L. Deng Z. Zhou T. Shishido Appl. Catal. A Gen. 606 2020 117826 L. Deng, Z. Zhou, T. Shishido, Appl. Catal. A Gen. 606 (2020) 117826. [15] Z. Xu Y. Yue X. Bao Z. Xie H. Zhu ACS Catal. 10 2020 818 828 Z. Xu, Y. Yue, X. Bao, Z. Xie, H. Zhu, ACS Catal. 10 (2020) 818−828. [16] K. Searles K.W. Chan J.A.M. Burak D. Zemlyanov O. Safonova C. Copéret J. Am. Chem. Soc. 140 2018 11674 11679 K. Searles, K.W. Chan, J.A.M. Burak, D. Zemlyanov, O. Safonova, C. Copéret, J. Am. Chem. Soc. 140 (2018) 11674−11679. [17] N.V. Srinath A. Longo H. Poelman R.K. Ramachandran J.Y. Feng J. Dendooven M.F. Reyniers V.V. Galvita ACS Catal. 11 2021 11320 11335 N.V. Srinath, A. Longo, H. Poelman, R.K. Ramachandran, J.Y. Feng, J. Dendooven, M.F. Reyniers, V.V. Galvita, A.C.S. Catal. 11 (2021) 11320−11335. [18] Y. Nakaya J. Hirayama S. Yamazoe K. Shimizu S. Furukawa Nat. Commun. 11 2020 2838 Y. Nakaya, J. Hirayama, S. Yamazoe, K. Shimizu, S. Furukawa, Nat. Commun. 11 (2020) 2838. [19] W. Tolek K. Suriye P. Praserthdam J. Panpranot Catal. Today 358 2020 100 108 W. Tolek, K. Suriye, P. Praserthdam, J. Panpranot, Catal. Today 358 (2020) 100–108. [20] P. Sun G. Siddiqi W.C. Vining M. Chi A.T. Bell J. Catal. 282 2011 165 174 P. Sun, G. Siddiqi, W.C. Vining, M. Chi, A.T. Bell, J. Catal. 282 (2011) 165–174. [21] R. Qian S. Luo F. Jing W. Fang Ind. Eng. Chem. Res. 61 2022 17264 17274 R. Qian, S. Luo, F. Jing, W. Fang, Ind. Eng. Chem. Res. 61 (2022) 17264−17274. [22] V.J. Cybulskis B.C. Bukowski H.T. Tseng J.R. Gallagher Z. Wu E. Wegener A.J. Kropf B. Ravel F.H. Ribeiro J. Greeley J.T. Miller ACS Catal. 7 2017 4173 4181 V.J. Cybulskis, B.C. Bukowski, H.T. Tseng, J.R. Gallagher, Z. Wu, E. Wegener, A.J. Kropf, B. Ravel, F.H. Ribeiro, J. Greeley, J.T. Miller, A.C.S. Catal. 7 (2017) 4173−4181. [23] Q. Sun N. Wang Q. Fan L. Zeng A. Mayoral S. Miao R. Yang Z. Jiang W. Zhou J. Zhang T. Zhang J. Xu P. Zhang J. Cheng D.C. Yang R. Jia L. Li Q. Zhang Y. Wang O. Terasaki J. Yu Angew. Chem. Int. Ed. 26 26 2020 19450 19459 Q. Sun, N. Wang, Q. Fan, L. Zeng, A. Mayoral, S. Miao, R. Yang, Z. Jiang, W. Zhou, J. Zhang, T. Zhang, J. Xu, P. Zhang, J. Cheng, D.C. Yang, R. Jia, L. Li, Q. Zhang, Y. Wang, O. Terasaki, J. Yu, Angew. Chem. Int. Edit. 26 (2020) 19450–19459. [24] G. Sun Z.J. Zhao R. Mu S. Zha L. Li S. Chen K. Zang J. Luo Z. Li S.C. Purdy A.J. Kropf J.T. Miller L. Zeng J. Gong Nat. Commun. 9 2018 4454 G. Sun, Z.J. Zhao, R. Mu, S. Zha, L. Li, S. Chen, K. Zang, J. Luo, Z. Li, S.C. Purdy, A.J. Kropf, J.T. Miller, L. Zeng, J. Gong, Nat. Commun. 9 (2018) 4454. [25] L. Wang Y. Wang C.W. Zhang J. Wen X. Weng L. Shi Catal. Sci. Technol. 10 2020 1248 1255 L. Wang, Y. Wang, C.W. Zhang, J. Wen, X. Weng, L. Shi, Catal. Sci. Technol. 10 (2020) 1248−1255. [26] Z. Wu B.C. Bukowski Z. Li C. Milligan L. Zhou T. Ma Y. Wu Y. Ren F.H. Ribeiro W.N. Delgass J. Greeley G. Zhang J.T. Miller J. Am. Chem. Soc. 140 2018 14870 14877 Z. Wu, B.C. Bukowski, Z. Li, C. Milligan, L. Zhou, T. Ma, Y. Wu, Y. Ren, F.H. Ribeiro, W.N. Delgass, J. Greeley, G. Zhang, J.T. Miller, J. Am. Chem. Soc. 140 (2018) 14870−14877. [27] L. Rochlitz Q. Pessemesse J.W. Fischer D. Klose A.H. Clark M. Plodinec G. Jeschke P.A. Payard C. Copéret J. Am. Chem. Soc. 144 2022 13384 13393 L. Rochlitz, Q. Pessemesse, J.W. Fischer, D. Klose, A.H. Clark, M. Plodinec, G. Jeschke, P.A. Payard, C. Copéret, J. Am. Chem. Soc. 144 (2022) 13384−13393. [28] X. Fan D. Liu X. Sun X. Yu D. Li Y. Yang H. Liu J. Diao Z. Xie L. Kong X. Xiao Z. Zhao J. Catal. 389 2020 450 460 X. Fan, D. Liu, X. Sun, X. Yu, D. Li, Y. Yang, H. Liu, J. Diao, Z. Xie, L. Kong, X. Xiao, Z. Zhao, J. Catal. 389 (2020) 450−460. [29] D.Y. Zhao J.L. Feng Q.S. Huo N. Melosh G.H. Fredrickson B.F. Chmelka G.D. Stucky Science 279 1998 548 552 D.Y. Zhao, J.L. Feng, Q.S. Huo, N. Melosh, G.H. Fredrickson, B.F. Chmelka, G.D. Stucky, Science 279 (1998) 548–552. [30] Y. Zhou W.G. Lin J. Yang L. Gao N. Lin J.Y. Yang Q. Hou Y. Wang J.H. Zhu J. Colloid Interf. Sci. 364 2011 594 604 Y. Zhou, W.G. Lin, J. Yang, L. Gao, N. Lin, J.Y. Yang, Q. Hou, Y. Wang, J.H. Zhu, J. Colloid Interf. Sci. 364 (2011) 594–604. [31] L. Yang Q. Liu R. Han K. Fu Y. Su Y. Zheng X. Wu C. Song N. Ji X. Lu D. Ma Appl. Catal. B Environ. 309 2022 121224 L. Yang, Q. Liu, R. Han, K. Fu, Y. Su, Y. Zheng, X. Wu, C. Song, N. Ji, X. Lu, D. Ma, Appl. Catal. B Environ. 309 (2022) 121224. [32] A. Shahbazi H. Younesi A. Badiei Chem. Eng. J. 168 2011 505 518 A. Shahbazi, H. Younesi, A. Badiei, Chem. Eng. J. 168 (2011) 505−518. [33] X. Fan J. Li Z. Zhao Y. Wei J. Liu A. Duan G. Jiang Catal. Sci. Technol. 5 2015 339 350 X. Fan, J. Li, Z. Zhao, Y. Wei, J. Liu, A. Duan, G. Jiang, Catal. Sci. Technol. 5 (2015) 339−350. [34] D. Liu H. Hu Y. Yang J. Cui X. Fan Z. Zhao L. Kong X. Xiao Z. Xie Catal. Today 402 2022 161 171 D. Liu, H. Hu, Y. Yang, J. Cui, X. Fan, Z. Zhao, L. Kong, X. Xiao, Z. Xie, Catal. Today 402 (2022) 161−171. [35] Y. Wang H. Zhuo H. Sun X. Zhang X. Dai C. Luan C. Qin H. Zhao J. Li M. Wang J.Y. Ye S.G. Sun ACS Catal. 9 2019 442 455 Y. Wang, H. Zhuo, H. Sun, X. Zhang, X. Dai, C. Luan, C. Qin, H. Zhao, J. Li, M. Wang, J.Y. Ye, S.G. Sun, A.C.S. Catal. 9 (2019) 442−455. [36] D. Kiani S. Sourav J. Baltrusaitis I.E. Wachs ACS Catal. 11 2021 10131 10137 D. Kiani, S. Sourav, J. Baltrusaitis, I.E. Wachs, ACS Catal. 11 (2021) 10131−10137. [37] D. Ma W. Liu Y. Huang D. Xia Q. Lian C. He Environ. Sci. Technol. 56 2022 3678 3688 D. Ma, W. Liu, Y. Huang, D. Xia, Q. Lian, C. He, Environ. Sci. Technol. 56 (2022) 3678−3688. [38] B. Zhang L. Zhou M. Qi Z. Li J. Han K. Li Y. Zhang F. Dehghani R. Liu J. Yun Ind. Eng. Chem. Res. 61 2022 1044 1055 B. Zhang, L. Zhou, M. Qi, Z. Li, J. Han, K. Li, Y. Zhang, F. Dehghani, R. Liu, J. Yun, Ind. Eng. Chem. Res. 61 (2022) 1044−1055. [39] Y. Wang J. Wang P. Zheng C. Sun J. Luo X. Xie J. Energy Chem. 67 2022 451 457 Y. Wang, J. Wang, P. Zheng, C. Sun, J. Luo, X. Xie, J. Energy Chem. 67 (2022) 451−457. [40] X.Q. Gao W.C. Li B. Qiu J. Sheng F. Wu A.H. Lu J. Energy Chem. 70 2022 332 339 X.Q. Gao, W.C. Li, B. Qiu, J. Sheng, F. Wu, A.H. Lu, J. Energy Chem. 70 (2022) 332−339. [41] B. Zhang L. Zheng Z. Zhai G. Li G. Liu ACS Appl. Mater. Interfaces 13 2021 16259 16266 B. Zhang, L. Zheng, Z. Zhai, G. Li, G. Liu, ACS Appl. Mater. Interfaces 13 (2021) 16259−16266. [42] X. Wang H. Hu N. Zhang J. Song X. Fan Z. Zhao L. Kong X. Xiao Z. Xie ChemistrySelect 7 2022 e202104367 X. Wang, H. Hu, N. Zhang, J. Song, X. Fan, Z. Zhao, L. Kong, X. Xiao, Z. Xie, ChemistrySelect 7 (2022) e202104367. [43] H.Z. Wang L.L. Sun Z.J. Sui Y.A. Zhu G.H. Ye D. Chen X.G. Zhou W.K. Yuan Ind. Eng. Chem. Res. 57 2018 8647 8654 H.Z. Wang, L.L. Sun, Z.J. Sui, Y.A. Zhu, G.H. Ye, D. Chen, X.G. Zhou, W.K. Yuan, Ind. Eng. Chem. Res. 57 (2018) 8647−8654. [44] Y.S. Choi J.R. Kim J.H. Hwang H. Roh H.L. Koh Catal. Today 2023 411 412 113957 Y.S. Choi, J.R. Kim, J.H. Hwang, H. Roh, H.L. Koh, Catal. Today 411−412 (2023) 113957. [45] A. Iglesias-Juez A. Beale K. Maaijen T.C. Weng P. Glatzel B.M. Weckhuysen J. Catal. 276 2010 268 279 A. Iglesias-Juez, A. Beale, K. Maaijen, T.C. Weng, P. Glatzel, B.M. Weckhuysen, J. Catal. 276 (2010) 268–279. [46] Y. Zhang Y. Zhou A. Qiu Y. Wang Y. Xu P. Wu Catal. Commun. 7 2006 860 866 Y. Zhang, Y. Zhou, A. Qiu, Y. Wang, Y. Xu, P. Wu, Catal. Commun. 7 (2006) 860–866.",
      "scopus-id": "85182278770",
      "coredata": {
        "eid": "1-s2.0-S0926860X24000036",
        "dc:description": "The development of stable Pt-based catalysts is important for propane dehydrogenation process. In this work, Mn-SBA-15 supports with different Mn doping amounts were prepared by in situ hydrothermal method using citric acid and urea. Compared with Pt/SBA-15 catalyst, the significantly improved dispersion and stability of Pt on Pt/Mn-SBA-15 catalysts were demonstrated by X-ray diffraction and transmission electron microscopy results. CO DRIFT spectra analysis showed the electron transfer from Mn to Pt occurred, which led to an increase in the electron density of Pt. And the propane dehydrogenation performances over Pt/Mn-SBA-15 were enhanced significantly. Among them, the Pt/10Mn-SBA-15 shows the highest initial propane conversion of 51.2% and lowest deactivation rate constant of 0.013 h−1. The reason may be that appropriate amount of Mn can modify Pt by both electronic effect and geometric effect. And the strong metal-support interaction formed by highly dispersed MnO x anchor sites in Mn-SBA-15 support maintains the stability of Pt during the propane dehydrogenation reaction.",
        "openArchiveArticle": "false",
        "prism:coverDate": "2024-01-25",
        "openaccessUserLicense": null,
        "prism:aggregationType": "Journal",
        "prism:url": "https://api.elsevier.com/content/article/pii/S0926860X24000036",
        "dc:creator": [
          {
            "@_fa": "true",
            "$": "Fan, Xiaoqiang"
          },
          {
            "@_fa": "true",
            "$": "Yang, Ying"
          },
          {
            "@_fa": "true",
            "$": "Song, Jiaxin"
          },
          {
            "@_fa": "true",
            "$": "Shan, Yiou"
          },
          {
            "@_fa": "true",
            "$": "Yu, Xuehua"
          },
          {
            "@_fa": "true",
            "$": "Kong, Lian"
          },
          {
            "@_fa": "true",
            "$": "Xiao, Xia"
          },
          {
            "@_fa": "true",
            "$": "Xie, Zean"
          },
          {
            "@_fa": "true",
            "$": "Zhao, Zhen"
          }
        ],
        "link": [
          {
            "@_fa": "true",
            "@rel": "self",
            "@href": "https://api.elsevier.com/content/article/pii/S0926860X24000036"
          },
          {
            "@_fa": "true",
            "@rel": "scidir",
            "@href": "https://www.sciencedirect.com/science/article/pii/S0926860X24000036"
          }
        ],
        "dc:format": "application/json",
        "openaccessType": null,
        "pii": "S0926-860X(24)00003-6",
        "prism:volume": "670",
        "articleNumber": "119559",
        "prism:publisher": "Published by Elsevier B.V.",
        "dc:title": "Stable Pt catalysts anchored by Mn-SBA-15 support for propane dehydrogenation",
        "prism:copyright": "© 2024 Published by Elsevier B.V.",
        "openaccess": "0",
        "prism:issn": "0926860X",
        "dcterms:subject": [
          {
            "@_fa": "true",
            "$": "Propane dehydrogenation"
          },
          {
            "@_fa": "true",
            "$": "Support anchoring effect"
          },
          {
            "@_fa": "true",
            "$": "Stable Pt-based"
          }
        ],
        "openaccessArticle": "false",
        "prism:publicationName": "Applied Catalysis A: General",
        "openaccessSponsorType": null,
        "prism:pageRange": "119559",
        "pubType": "fla",
        "prism:coverDisplayDate": "25 January 2024",
        "prism:doi": "10.1016/j.apcata.2024.119559",
        "prism:startingPage": "119559",
        "dc:identifier": "doi:10.1016/j.apcata.2024.119559",
        "openaccessSponsorName": null
      },
      "objects": {
        "object": [
          {
            "@category": "standard",
            "@height": "432",
            "@width": "395",
            "@_fa": "true",
            "$": "https://api.elsevier.com/content/object/eid/1-s2.0-S0926860X24000036-gr9.jpg?httpAccept=%2A%2F%2A",
            "@multimediatype": "JPEG image file",
            "@type": "IMAGE-DOWNSAMPLED",
            "@size": "66655",
            "@ref": "gr9",
            "@mimetype": "image/jpeg"
          },
          {
            "@category": "standard",
            "@height": "196",
            "@width": "715",
            "@_fa": "true",
            "$": "https://api.elsevier.com/content/object/eid/1-s2.0-S0926860X24000036-gr8.jpg?httpAccept=%2A%2F%2A",
            "@multimediatype": "JPEG image file",
            "@type": "IMAGE-DOWNSAMPLED",
            "@size": "38493",
            "@ref": "gr8",
            "@mimetype": "image/jpeg"
          },
          {
            "@category": "standard",
            "@height": "379",
            "@width": "395",
            "@_fa": "true",
            "$": "https://api.elsevier.com/content/object/eid/1-s2.0-S0926860X24000036-gr7.jpg?httpAccept=%2A%2F%2A",
            "@multimediatype": "JPEG image file",
            "@type": "IMAGE-DOWNSAMPLED",
            "@size": "28769",
            "@ref": "gr7",
            "@mimetype": "image/jpeg"
          },
          {
            "@category": "standard",
            "@height": "799",
            "@width": "791",
            "@_fa": "true",
            "$": "https://api.elsevier.com/content/object/eid/1-s2.0-S0926860X24000036-gr6.jpg?httpAccept=%2A%2F%2A",
            "@multimediatype": "JPEG image file",
            "@type": "IMAGE-DOWNSAMPLED",
            "@size": "167390",
            "@ref": "gr6",
            "@mimetype": "image/jpeg"
          },
          {
            "@category": "standard",
            "@height": "287",
            "@width": "678",
            "@_fa": "true",
            "$": "https://api.elsevier.com/content/object/eid/1-s2.0-S0926860X24000036-gr5.jpg?httpAccept=%2A%2F%2A",
            "@multimediatype": "JPEG image file",
            "@type": "IMAGE-DOWNSAMPLED",
            "@size": "51029",
            "@ref": "gr5",
            "@mimetype": "image/jpeg"
          },
          {
            "@category": "standard",
            "@height": "251",
            "@width": "678",
            "@_fa": "true",
            "$": "https://api.elsevier.com/content/object/eid/1-s2.0-S0926860X24000036-gr4.jpg?httpAccept=%2A%2F%2A",
            "@multimediatype": "JPEG image file",
            "@type": "IMAGE-DOWNSAMPLED",
            "@size": "42532",
            "@ref": "gr4",
            "@mimetype": "image/jpeg"
          },
          {
            "@category": "standard",
            "@height": "612",
            "@width": "420",
            "@_fa": "true",
            "$": "https://api.elsevier.com/content/object/eid/1-s2.0-S0926860X24000036-gr10.jpg?httpAccept=%2A%2F%2A",
            "@multimediatype": "JPEG image file",
            "@type": "IMAGE-DOWNSAMPLED",
            "@size": "53892",
            "@ref": "gr10",
            "@mimetype": "image/jpeg"
          },
          {
            "@category": "standard",
            "@height": "225",
            "@width": "678",
            "@_fa": "true",
            "$": "https://api.elsevier.com/content/object/eid/1-s2.0-S0926860X24000036-gr3.jpg?httpAccept=%2A%2F%2A",
            "@multimediatype": "JPEG image file",
            "@type": "IMAGE-DOWNSAMPLED",
            "@size": "53088",
            "@ref": "gr3",
            "@mimetype": "image/jpeg"
          },
          {
            "@category": "standard",
            "@height": "327",
            "@width": "395",
            "@_fa": "true",
            "$": "https://api.elsevier.com/content/object/eid/1-s2.0-S0926860X24000036-gr11.jpg?httpAccept=%2A%2F%2A",
            "@multimediatype": "JPEG image file",
            "@type": "IMAGE-DOWNSAMPLED",
            "@size": "22290",
            "@ref": "gr11",
            "@mimetype": "image/jpeg"
          },
          {
            "@category": "standard",
            "@height": "364",
            "@width": "395",
            "@_fa": "true",
            "$": "https://api.elsevier.com/content/object/eid/1-s2.0-S0926860X24000036-gr2.jpg?httpAccept=%2A%2F%2A",
            "@multimediatype": "JPEG image file",
            "@type": "IMAGE-DOWNSAMPLED",
            "@size": "23149",
            "@ref": "gr2",
            "@mimetype": "image/jpeg"
          },
          {
            "@category": "standard",
            "@height": "162",
            "@width": "500",
            "@_fa": "true",
            "$": "https://api.elsevier.com/content/object/eid/1-s2.0-S0926860X24000036-ga1.jpg?httpAccept=%2A%2F%2A",
            "@multimediatype": "JPEG image file",
            "@type": "IMAGE-DOWNSAMPLED",
            "@size": "23256",
            "@ref": "ga1",
            "@mimetype": "image/jpeg"
          },
          {
            "@category": "standard",
            "@height": "343",
            "@width": "395",
            "@_fa": "true",
            "$": "https://api.elsevier.com/content/object/eid/1-s2.0-S0926860X24000036-gr1.jpg?httpAccept=%2A%2F%2A",
            "@multimediatype": "JPEG image file",
            "@type": "IMAGE-DOWNSAMPLED",
            "@size": "17661",
            "@ref": "gr1",
            "@mimetype": "image/jpeg"
          },
          {
            "@category": "thumbnail",
            "@height": "164",
            "@width": "150",
            "@_fa": "true",
            "$": "https://api.elsevier.com/content/object/eid/1-s2.0-S0926860X24000036-gr9.sml?httpAccept=%2A%2F%2A",
            "@multimediatype": "GIF image file",
            "@type": "IMAGE-THUMBNAIL",
            "@size": "11911",
            "@ref": "gr9",
            "@mimetype": "image/gif"
          },
          {
            "@category": "thumbnail",
            "@height": "60",
            "@width": "219",
            "@_fa": "true",
            "$": "https://api.elsevier.com/content/object/eid/1-s2.0-S0926860X24000036-gr8.sml?httpAccept=%2A%2F%2A",
            "@multimediatype": "GIF image file",
            "@type": "IMAGE-THUMBNAIL",
            "@size": "4652",
            "@ref": "gr8",
            "@mimetype": "image/gif"
          },
          {
            "@category": "thumbnail",
            "@height": "164",
            "@width": "171",
            "@_fa": "true",
            "$": "https://api.elsevier.com/content/object/eid/1-s2.0-S0926860X24000036-gr7.sml?httpAccept=%2A%2F%2A",
            "@multimediatype": "GIF image file",
            "@type": "IMAGE-THUMBNAIL",
            "@size": "5681",
            "@ref": "gr7",
            "@mimetype": "image/gif"
          },
          {
            "@category": "thumbnail",
            "@height": "164",
            "@width": "162",
            "@_fa": "true",
            "$": "https://api.elsevier.com/content/object/eid/1-s2.0-S0926860X24000036-gr6.sml?httpAccept=%2A%2F%2A",
            "@multimediatype": "GIF image file",
            "@type": "IMAGE-THUMBNAIL",
            "@size": "18551",
            "@ref": "gr6",
            "@mimetype": "image/gif"
          },
          {
            "@category": "thumbnail",
            "@height": "93",
            "@width": "219",
            "@_fa": "true",
            "$": "https://api.elsevier.com/content/object/eid/1-s2.0-S0926860X24000036-gr5.sml?httpAccept=%2A%2F%2A",
            "@multimediatype": "GIF image file",
            "@type": "IMAGE-THUMBNAIL",
            "@size": "6907",
            "@ref": "gr5",
            "@mimetype": "image/gif"
          },
          {
            "@category": "thumbnail",
            "@height": "81",
            "@width": "219",
            "@_fa": "true",
            "$": "https://api.elsevier.com/content/object/eid/1-s2.0-S0926860X24000036-gr4.sml?httpAccept=%2A%2F%2A",
            "@multimediatype": "GIF image file",
            "@type": "IMAGE-THUMBNAIL",
            "@size": "5411",
            "@ref": "gr4",
            "@mimetype": "image/gif"
          },
          {
            "@category": "thumbnail",
            "@height": "163",
            "@width": "112",
            "@_fa": "true",
            "$": "https://api.elsevier.com/content/object/eid/1-s2.0-S0926860X24000036-gr10.sml?httpAccept=%2A%2F%2A",
            "@multimediatype": "GIF image file",
            "@type": "IMAGE-THUMBNAIL",
            "@size": "6027",
            "@ref": "gr10",
            "@mimetype": "image/gif"
          },
          {
            "@category": "thumbnail",
            "@height": "73",
            "@width": "219",
            "@_fa": "true",
            "$": "https://api.elsevier.com/content/object/eid/1-s2.0-S0926860X24000036-gr3.sml?httpAccept=%2A%2F%2A",
            "@multimediatype": "GIF image file",
            "@type": "IMAGE-THUMBNAIL",
            "@size": "7834",
            "@ref": "gr3",
            "@mimetype": "image/gif"
          },
          {
            "@category": "thumbnail",
            "@height": "164",
            "@width": "198",
            "@_fa": "true",
            "$": "https://api.elsevier.com/content/object/eid/1-s2.0-S0926860X24000036-gr11.sml?httpAccept=%2A%2F%2A",
            "@multimediatype": "GIF image file",
            "@type": "IMAGE-THUMBNAIL",
            "@size": "5623",
            "@ref": "gr11",
            "@mimetype": "image/gif"
          },
          {
            "@category": "thumbnail",
            "@height": "164",
            "@width": "178",
            "@_fa": "true",
            "$": "https://api.elsevier.com/content/object/eid/1-s2.0-S0926860X24000036-gr2.sml?httpAccept=%2A%2F%2A",
            "@multimediatype": "GIF image file",
            "@type": "IMAGE-THUMBNAIL",
            "@size": "5904",
            "@ref": "gr2",
            "@mimetype": "image/gif"
          },
          {
            "@category": "thumbnail",
            "@height": "71",
            "@width": "219",
            "@_fa": "true",
            "$": "https://api.elsevier.com/content/object/eid/1-s2.0-S0926860X24000036-ga1.sml?httpAccept=%2A%2F%2A",
            "@multimediatype": "GIF image file",
            "@type": "IMAGE-THUMBNAIL",
            "@size": "6458",
            "@ref": "ga1",
            "@mimetype": "image/gif"
          },
          {
            "@category": "thumbnail",
            "@height": "163",
            "@width": "188",
            "@_fa": "true",
            "$": "https://api.elsevier.com/content/object/eid/1-s2.0-S0926860X24000036-gr1.sml?httpAccept=%2A%2F%2A",
            "@multimediatype": "GIF image file",
            "@type": "IMAGE-THUMBNAIL",
            "@size": "5281",
            "@ref": "gr1",
            "@mimetype": "image/gif"
          },
          {
            "@category": "high",
            "@height": "1910",
            "@width": "1746",
            "@_fa": "true",
            "$": "https://api.elsevier.com/content/object/eid/1-s2.0-S0926860X24000036-gr9_lrg.jpg?httpAccept=%2A%2F%2A",
            "@multimediatype": "JPEG image file",
            "@type": "IMAGE-HIGH-RES",
            "@size": "520935",
            "@ref": "gr9",
            "@mimetype": "image/jpeg"
          },
          {
            "@category": "high",
            "@height": "866",
            "@width": "3160",
            "@_fa": "true",
            "$": "https://api.elsevier.com/content/object/eid/1-s2.0-S0926860X24000036-gr8_lrg.jpg?httpAccept=%2A%2F%2A",
            "@multimediatype": "JPEG image file",
            "@type": "IMAGE-HIGH-RES",
            "@size": "235655",
            "@ref": "gr8",
            "@mimetype": "image/jpeg"
          },
          {
            "@category": "high",
            "@height": "1677",
            "@width": "1749",
            "@_fa": "true",
            "$": "https://api.elsevier.com/content/object/eid/1-s2.0-S0926860X24000036-gr7_lrg.jpg?httpAccept=%2A%2F%2A",
            "@multimediatype": "JPEG image file",
            "@type": "IMAGE-HIGH-RES",
            "@size": "187048",
            "@ref": "gr7",
            "@mimetype": "image/jpeg"
          },
          {
            "@category": "high",
            "@height": "3528",
            "@width": "3493",
            "@_fa": "true",
            "$": "https://api.elsevier.com/content/object/eid/1-s2.0-S0926860X24000036-gr6_lrg.jpg?httpAccept=%2A%2F%2A",
            "@multimediatype": "JPEG image file",
            "@type": "IMAGE-HIGH-RES",
            "@size": "803802",
            "@ref": "gr6",
            "@mimetype": "image/jpeg"
          },
          {
            "@category": "high",
            "@height": "1268",
            "@width": "2994",
            "@_fa": "true",
            "$": "https://api.elsevier.com/content/object/eid/1-s2.0-S0926860X24000036-gr5_lrg.jpg?httpAccept=%2A%2F%2A",
            "@multimediatype": "JPEG image file",
            "@type": "IMAGE-HIGH-RES",
            "@size": "335456",
            "@ref": "gr5",
            "@mimetype": "image/jpeg"
          },
          {
            "@category": "high",
            "@height": "1109",
            "@width": "2994",
            "@_fa": "true",
            "$": "https://api.elsevier.com/content/object/eid/1-s2.0-S0926860X24000036-gr4_lrg.jpg?httpAccept=%2A%2F%2A",
            "@multimediatype": "JPEG image file",
            "@type": "IMAGE-HIGH-RES",
            "@size": "281983",
            "@ref": "gr4",
            "@mimetype": "image/jpeg"
          },
          {
            "@category": "high",
            "@height": "2707",
            "@width": "1858",
            "@_fa": "true",
            "$": "https://api.elsevier.com/content/object/eid/1-s2.0-S0926860X24000036-gr10_lrg.jpg?httpAccept=%2A%2F%2A",
            "@multimediatype": "JPEG image file",
            "@type": "IMAGE-HIGH-RES",
            "@size": "384305",
            "@ref": "gr10",
            "@mimetype": "image/jpeg"
          },
          {
            "@category": "high",
            "@height": "992",
            "@width": "2994",
            "@_fa": "true",
            "$": "https://api.elsevier.com/content/object/eid/1-s2.0-S0926860X24000036-gr3_lrg.jpg?httpAccept=%2A%2F%2A",
            "@multimediatype": "JPEG image file",
            "@type": "IMAGE-HIGH-RES",
            "@size": "380746",
            "@ref": "gr3",
            "@mimetype": "image/jpeg"
          },
          {
            "@category": "high",
            "@height": "1447",
            "@width": "1746",
            "@_fa": "true",
            "$": "https://api.elsevier.com/content/object/eid/1-s2.0-S0926860X24000036-gr11_lrg.jpg?httpAccept=%2A%2F%2A",
            "@multimediatype": "JPEG image file",
            "@type": "IMAGE-HIGH-RES",
            "@size": "139435",
            "@ref": "gr11",
            "@mimetype": "image/jpeg"
          },
          {
            "@category": "high",
            "@height": "1610",
            "@width": "1746",
            "@_fa": "true",
            "$": "https://api.elsevier.com/content/object/eid/1-s2.0-S0926860X24000036-gr2_lrg.jpg?httpAccept=%2A%2F%2A",
            "@multimediatype": "JPEG image file",
            "@type": "IMAGE-HIGH-RES",
            "@size": "148975",
            "@ref": "gr2",
            "@mimetype": "image/jpeg"
          },
          {
            "@category": "high",
            "@height": "715",
            "@width": "2213",
            "@_fa": "true",
            "$": "https://api.elsevier.com/content/object/eid/1-s2.0-S0926860X24000036-ga1_lrg.jpg?httpAccept=%2A%2F%2A",
            "@multimediatype": "JPEG image file",
            "@type": "IMAGE-HIGH-RES",
            "@size": "167866",
            "@ref": "ga1",
            "@mimetype": "image/jpeg"
          },
          {
            "@category": "high",
            "@height": "1518",
            "@width": "1746",
            "@_fa": "true",
            "$": "https://api.elsevier.com/content/object/eid/1-s2.0-S0926860X24000036-gr1_lrg.jpg?httpAccept=%2A%2F%2A",
            "@multimediatype": "JPEG image file",
            "@type": "IMAGE-HIGH-RES",
            "@size": "107045",
            "@ref": "gr1",
            "@mimetype": "image/jpeg"
          },
          {
            "@category": "thumbnail",
            "@_fa": "true",
            "$": "https://api.elsevier.com/content/object/eid/1-s2.0-S0926860X24000036-si0001.svg?httpAccept=%2A%2F%2A",
            "@multimediatype": "Scalable Vector Graphics file",
            "@type": "ALTIMG",
            "@size": "4412",
            "@ref": "si0001",
            "@mimetype": "image/svg+xml"
          },
          {
            "@category": "thumbnail",
            "@_fa": "true",
            "$": "https://api.elsevier.com/content/object/eid/1-s2.0-S0926860X24000036-si0002.svg?httpAccept=%2A%2F%2A",
            "@multimediatype": "Scalable Vector Graphics file",
            "@type": "ALTIMG",
            "@size": "4019",
            "@ref": "si0002",
            "@mimetype": "image/svg+xml"
          },
          {
            "@category": "thumbnail",
            "@_fa": "true",
            "$": "https://api.elsevier.com/content/object/eid/1-s2.0-S0926860X24000036-si0003.svg?httpAccept=%2A%2F%2A",
            "@multimediatype": "Scalable Vector Graphics file",
            "@type": "ALTIMG",
            "@size": "3484",
            "@ref": "si0003",
            "@mimetype": "image/svg+xml"
          },
          {
            "@category": "standard",
            "@_fa": "true",
            "$": "https://api.elsevier.com/content/object/eid/1-s2.0-S0926860X24000036-am.pdf?httpAccept=%2A%2F%2A",
            "@multimediatype": "Acrobat PDF file",
            "@type": "AAM-PDF",
            "@size": "2246489",
            "@ref": "am",
            "@mimetype": "application/pdf"
          }
        ]
      },
      "link": {
        "@rel": "abstract",
        "@href": "https://api.elsevier.com/content/abstract/scopus_id/85182278770"
      }
    }
  }
}