{
  "metadata": {
    "title": "Regioselective hydrophosphorylation of alkynes by a functionalized heterogeneous Cu-chitosan based catalyst",
    "authors": "; ; ",
    "journal": "Applied Catalysis A: General",
    "date": "2024-08-25",
    "doi": "10.1016/j.apcata.2024.119900",
    "abstract": "",
    "uri": "https://api.elsevier.com/content/article/pii/S0926860X24003454",
    "pii": "S0926860X24003454"
  },
  "fulltext": {
    "full-text-retrieval-response": {
      "scopus-eid": "2-s2.0-85201447600",
      "originalText": "serial JL 271346 291210 291744 291809 31 Applied Catalysis A: General APPLIEDCATALYSISAGENERAL 2024-08-03 2024-08-03 2024-08-21 2024-08-21 2024-08-29T16:53:03 1-s2.0-S0926860X24003454 S0926-860X(24)00345-4 S0926860X24003454 10.1016/j.apcata.2024.119900 S300 S300.1 FULL-TEXT 1-s2.0-S0926860X24X00125 2024-10-12T07:43:32.210959Z 0 0 20240825 2024 2024-08-03T01:10:08.104826Z absattachment articleinfo articlenumber articletitlenorm authfirstinitialnorm authfirstsurnamenorm cid cids contenttype copyright crossmark dateloaded dateloadedtxt datesearch datesort dateupdated dco docsubtype doctype doi eid ewtransactionid hubeid indexeddate issn issnnorm itemstage itemtransactionid itemweight openaccess openarchive pg pgfirst pii piinorm pubdatestart pubdatetxt pubyr sortorder srctitle srctitlenorm srctype ssids alllist content subj subheadings suppl tomb volfirst volissue volumelist webpdf webpdfpagecount yearnav figure table e-component body acknowledge affil appendices articletitle auth authfirstini authfull authkeywords authlast grantnumber grantsponsor grantsponsorid highlightsabst orcid primabst ref specialabst 0926-860X 0926860X true 684 684 C Volume 684 5 119900 119900 119900 20240825 25 August 2024 2024-08-25 2024 article fla © 2024 Elsevier B.V. All rights are reserved, including those for text and data mining, AI training, and similar technologies. REGIOSELECTIVEHYDROPHOSPHORYLATIONALKYNESBYAFUNCTIONALIZEDHETEROGENEOUSCUCHITOSANBASEDCATALYST REN Y 1 Introduction 2 Experimental 2.1 Synthesis of chitosan-framework 2.2 Synthesis of [Cu]@CTT catalyst 2.3 General considerations 2.4 General procedure for the preparation of (E) anti-Markovnikov adducts 3 Results and discussion 4 Conclusion CRediT authorship contribution statement Acknowledgements Appendix A Supplementary material References CLEVENGER 2020 6124 6196 A GUO 2018 10049 10293 H GOURA 2015 6854 6965 J PRADERE 2014 9154 9218 U SONG 2017 2487 2491 S CHEN 2019 11517 11521 X DUTARTRE 2016 5771 5794 M METCALF 2009 65 94 W PARVOLE 2008 3893 3903 J SENHAJI 2004 1039 1050 O SCHMIDER 2005 9548 9555 M XU 1986 691 692 Y LIU 2013 659 666 L LIU 2014 2322 2326 L HU 2011 5516 5521 J WU 2014 8118 8127 Y TANG 2017 1683 1692 L LIU 2018 4190 4196 L HU 2014 4464 4467 G GUI 2011 5516 5521 Q GU 2017 4226 4230 J SHEN 2019 2065 2070 J LIU 2019 13941 13947 W CHEN 2018 3139 3155 T ZHANG 2017 2054 2057 P TROSTYANSKAYA 2014 2556 2562 I NIU 2007 272 274 M LIU 2014 6816 6822 L CHEN 2013 1065 1067 T HAN 2001 5929 5932 L ROOY 2006 2918 2923 S HUANG 2012 141 146 Y HAN 2004 5080 5081 L HOU 2021 2981 2987 H LIU 2019 13941 13947 W BASIOUNY 2019 7143 7153 M HUANG 2018 8743 8749 T WANG 2018 10599 10605 H NIU 2007 272 274 M WANG 2014 118 121 T SHEN 2014 3007 3012 C ANURADHA 2017 6865 6876 S SUN 2002 755 758 W MATVIIV 2021 80 88 R RENX2024X119900 RENX2024X119900XY 2026-08-21T00:00:00.000Z 2026-08-21T00:00:00.000Z http://creativecommons.org/licenses/by-nc-nd/4.0/ © 2024 Elsevier B.V. All rights are reserved, including those for text and data mining, AI training, and similar technologies. 2024-09-05T08:21:52.029Z http://vtw.elsevier.com/data/voc/AddOnTypes/50.7/aggregated-refined Scientific Research Fund of Hunan Provincial Education Department 23A0497 23B0634 Scientific Research Foundation of Hunan Provincial Education Department http://data.elsevier.com/vocabulary/SciValFunders/100014472 http://sws.geonames.org/1814991/ http://sws.geonames.org/1814991 http://sws.geonames.org/1814991 Natural Science Foundation of Hunan Province 2023JJ30274 2023JJ30275 Natural Science Foundation of Hunan Province http://data.elsevier.com/vocabulary/SciValFunders/501100004735 http://sws.geonames.org/1814991/ This work was supported by Natural Science Foundation of Hunan Province (2023JJ30274, 2023JJ30275), and Scientific Research Fund of Hunan Provincial Education Department (23A0497, 23B0634). https://doi.org/10.15223/policy-017 https://doi.org/10.15223/policy-037 https://doi.org/10.15223/policy-012 https://doi.org/10.15223/policy-029 https://doi.org/10.15223/policy-004 item S0926-860X(24)00345-4 S0926860X24003454 1-s2.0-S0926860X24003454 10.1016/j.apcata.2024.119900 271346 2024-10-12T07:43:32.210959Z 2024-08-25 1-s2.0-S0926860X24003454-main.pdf https://s3-eu-west-1.amazonaws.com/prod-ucs-content-store-eu-west/content/pii:S0926860X24003454/MAIN/application/pdf/0d6959df1af65dfe65f951cdde1b15be/main.pdf main.pdf pdf true 4673132 MAIN 8 1-s2.0-S0926860X24003454-main_1.png https://s3-eu-west-1.amazonaws.com/prod-ucs-content-store-eu-west/content/pii:S0926860X24003454/PREVIEW/image/png/ecce08a7eb30465143fbe81b96bc1364/main_1.png main_1.png png 59688 849 656 IMAGE-WEB-PDF 1 1-s2.0-S0926860X24003454-sc5.jpg https://s3-eu-west-1.amazonaws.com/prod-ucs-content-store-eu-west/content/pii:S0926860X24003454/sc5/DOWNSAMPLED/image/jpeg/ffab07113d64b65de8c61116b54a2dec/sc5.jpg sc5 sc5.jpg jpg 45028 435 376 IMAGE-DOWNSAMPLED 1-s2.0-S0926860X24003454-sc4.jpg https://s3-eu-west-1.amazonaws.com/prod-ucs-content-store-eu-west/content/pii:S0926860X24003454/sc4/DOWNSAMPLED/image/jpeg/0018b109abbddf9027449333d4573138/sc4.jpg sc4 sc4.jpg jpg 7164 58 376 IMAGE-DOWNSAMPLED 1-s2.0-S0926860X24003454-sc3.jpg https://s3-eu-west-1.amazonaws.com/prod-ucs-content-store-eu-west/content/pii:S0926860X24003454/sc3/DOWNSAMPLED/image/jpeg/6826c3b35577d8877c564a339377d8d8/sc3.jpg sc3 sc3.jpg jpg 13349 128 376 IMAGE-DOWNSAMPLED 1-s2.0-S0926860X24003454-fx4.jpg https://s3-eu-west-1.amazonaws.com/prod-ucs-content-store-eu-west/content/pii:S0926860X24003454/fx4/DOWNSAMPLED/image/jpeg/ab879cb848942bdd7f7f177e4baff591/fx4.jpg fx4 fx4.jpg jpg 4963 51 336 IMAGE-DOWNSAMPLED 1-s2.0-S0926860X24003454-sc2.jpg https://s3-eu-west-1.amazonaws.com/prod-ucs-content-store-eu-west/content/pii:S0926860X24003454/sc2/DOWNSAMPLED/image/jpeg/42c49ed767ac9aff6982d9977eb29c51/sc2.jpg sc2 sc2.jpg jpg 28841 146 791 IMAGE-DOWNSAMPLED 1-s2.0-S0926860X24003454-gr4.jpg https://s3-eu-west-1.amazonaws.com/prod-ucs-content-store-eu-west/content/pii:S0926860X24003454/gr4/DOWNSAMPLED/image/jpeg/8a3da908fb5a6dce04eed88c7b715626/gr4.jpg gr4 gr4.jpg jpg 14568 288 376 IMAGE-DOWNSAMPLED 1-s2.0-S0926860X24003454-gr3.jpg https://s3-eu-west-1.amazonaws.com/prod-ucs-content-store-eu-west/content/pii:S0926860X24003454/gr3/DOWNSAMPLED/image/jpeg/ebf97fc25dfb0c59b8ba77f94fe4ea5c/gr3.jpg gr3 gr3.jpg jpg 17383 289 376 IMAGE-DOWNSAMPLED 1-s2.0-S0926860X24003454-gr2.jpg https://s3-eu-west-1.amazonaws.com/prod-ucs-content-store-eu-west/content/pii:S0926860X24003454/gr2/DOWNSAMPLED/image/jpeg/dccda74d897c38ed2574c501163b944c/gr2.jpg gr2 gr2.jpg jpg 23019 297 376 IMAGE-DOWNSAMPLED 1-s2.0-S0926860X24003454-gr1.jpg https://s3-eu-west-1.amazonaws.com/prod-ucs-content-store-eu-west/content/pii:S0926860X24003454/gr1/DOWNSAMPLED/image/jpeg/95a015102bef755c28f91fe9cdc2f590/gr1.jpg gr1 gr1.jpg jpg 29280 345 376 IMAGE-DOWNSAMPLED 1-s2.0-S0926860X24003454-sc6.jpg https://s3-eu-west-1.amazonaws.com/prod-ucs-content-store-eu-west/content/pii:S0926860X24003454/sc6/DOWNSAMPLED/image/jpeg/e5f1dfc53ef241a5c37922fbad97c004/sc6.jpg sc6 sc6.jpg jpg 12011 161 376 IMAGE-DOWNSAMPLED 1-s2.0-S0926860X24003454-gr7.jpg https://s3-eu-west-1.amazonaws.com/prod-ucs-content-store-eu-west/content/pii:S0926860X24003454/gr7/DOWNSAMPLED/image/jpeg/1e275d9fc0b7cfe61b1b0280e7ec9c8a/gr7.jpg gr7 gr7.jpg jpg 22424 300 376 IMAGE-DOWNSAMPLED 1-s2.0-S0926860X24003454-gr6.jpg https://s3-eu-west-1.amazonaws.com/prod-ucs-content-store-eu-west/content/pii:S0926860X24003454/gr6/DOWNSAMPLED/image/jpeg/02cac32f200d45351d64928673f81101/gr6.jpg gr6 gr6.jpg jpg 15809 296 376 IMAGE-DOWNSAMPLED 1-s2.0-S0926860X24003454-gr5.jpg https://s3-eu-west-1.amazonaws.com/prod-ucs-content-store-eu-west/content/pii:S0926860X24003454/gr5/DOWNSAMPLED/image/jpeg/c66ea712dd250bfe08443ff375112231/gr5.jpg gr5 gr5.jpg jpg 97581 454 659 IMAGE-DOWNSAMPLED 1-s2.0-S0926860X24003454-ga1.jpg https://s3-eu-west-1.amazonaws.com/prod-ucs-content-store-eu-west/content/pii:S0926860X24003454/ga1/DOWNSAMPLED/image/jpeg/81d814ab888f6bb60c9066677ae8af88/ga1.jpg ga1 true ga1.jpg jpg 22498 133 500 IMAGE-DOWNSAMPLED 1-s2.0-S0926860X24003454-fx3.jpg https://s3-eu-west-1.amazonaws.com/prod-ucs-content-store-eu-west/content/pii:S0926860X24003454/fx3/DOWNSAMPLED/image/jpeg/df0ef15e395c2270e312cc50c6fbe037/fx3.jpg fx3 fx3.jpg jpg 37450 378 365 IMAGE-DOWNSAMPLED 1-s2.0-S0926860X24003454-sc1.jpg https://s3-eu-west-1.amazonaws.com/prod-ucs-content-store-eu-west/content/pii:S0926860X24003454/sc1/DOWNSAMPLED/image/jpeg/a8bc90512dd64ad6785ab8d7a7fba1c5/sc1.jpg sc1 sc1.jpg jpg 74754 595 508 IMAGE-DOWNSAMPLED 1-s2.0-S0926860X24003454-fx2.jpg https://s3-eu-west-1.amazonaws.com/prod-ucs-content-store-eu-west/content/pii:S0926860X24003454/fx2/DOWNSAMPLED/image/jpeg/e8e08e8e3c419d22b34943d0366a8301/fx2.jpg fx2 fx2.jpg jpg 24797 293 360 IMAGE-DOWNSAMPLED 1-s2.0-S0926860X24003454-fx1.jpg https://s3-eu-west-1.amazonaws.com/prod-ucs-content-store-eu-west/content/pii:S0926860X24003454/fx1/DOWNSAMPLED/image/jpeg/b3e5b95357509c7ae414ea45a1c219ca/fx1.jpg fx1 fx1.jpg jpg 4999 51 332 IMAGE-DOWNSAMPLED 1-s2.0-S0926860X24003454-sc5.sml https://s3-eu-west-1.amazonaws.com/prod-ucs-content-store-eu-west/content/pii:S0926860X24003454/sc5/THUMBNAIL/image/gif/a0b74f2b499fbe0269d5b3fb93311c98/sc5.sml sc5 sc5.sml sml 4850 163 141 IMAGE-THUMBNAIL 1-s2.0-S0926860X24003454-sc4.sml https://s3-eu-west-1.amazonaws.com/prod-ucs-content-store-eu-west/content/pii:S0926860X24003454/sc4/THUMBNAIL/image/gif/d41fbd5c4e979e1c77fc16c92825e70d/sc4.sml sc4 sc4.sml sml 2781 34 219 IMAGE-THUMBNAIL 1-s2.0-S0926860X24003454-sc3.sml https://s3-eu-west-1.amazonaws.com/prod-ucs-content-store-eu-west/content/pii:S0926860X24003454/sc3/THUMBNAIL/image/gif/1bff0fd87e0ce54454fd02065d660a42/sc3.sml sc3 sc3.sml sml 4453 75 219 IMAGE-THUMBNAIL 1-s2.0-S0926860X24003454-fx4.sml https://s3-eu-west-1.amazonaws.com/prod-ucs-content-store-eu-west/content/pii:S0926860X24003454/fx4/THUMBNAIL/image/gif/53b2e794e1d1a53c21b836759cd9b7ff/fx4.sml fx4 fx4.sml sml 2405 33 219 IMAGE-THUMBNAIL 1-s2.0-S0926860X24003454-sc2.sml https://s3-eu-west-1.amazonaws.com/prod-ucs-content-store-eu-west/content/pii:S0926860X24003454/sc2/THUMBNAIL/image/gif/91d5257ec5e43a080e3243ebaaa6d65c/sc2.sml sc2 sc2.sml sml 3287 40 219 IMAGE-THUMBNAIL 1-s2.0-S0926860X24003454-gr4.sml https://s3-eu-west-1.amazonaws.com/prod-ucs-content-store-eu-west/content/pii:S0926860X24003454/gr4/THUMBNAIL/image/gif/f1233290ebdc719a623400b730e6ef6b/gr4.sml gr4 gr4.sml sml 5344 164 214 IMAGE-THUMBNAIL 1-s2.0-S0926860X24003454-gr3.sml https://s3-eu-west-1.amazonaws.com/prod-ucs-content-store-eu-west/content/pii:S0926860X24003454/gr3/THUMBNAIL/image/gif/144a75d4c418422ae0b0f464af7208f1/gr3.sml gr3 gr3.sml sml 6015 164 214 IMAGE-THUMBNAIL 1-s2.0-S0926860X24003454-gr2.sml https://s3-eu-west-1.amazonaws.com/prod-ucs-content-store-eu-west/content/pii:S0926860X24003454/gr2/THUMBNAIL/image/gif/4d920280b7d8737526471de6a6a932fb/gr2.sml gr2 gr2.sml sml 7752 164 207 IMAGE-THUMBNAIL 1-s2.0-S0926860X24003454-gr1.sml https://s3-eu-west-1.amazonaws.com/prod-ucs-content-store-eu-west/content/pii:S0926860X24003454/gr1/THUMBNAIL/image/gif/1af874471efd62889065dae402d8300c/gr1.sml gr1 gr1.sml sml 7913 164 179 IMAGE-THUMBNAIL 1-s2.0-S0926860X24003454-sc6.sml https://s3-eu-west-1.amazonaws.com/prod-ucs-content-store-eu-west/content/pii:S0926860X24003454/sc6/THUMBNAIL/image/gif/11adad87162bf79e228248835b7e2472/sc6.sml sc6 sc6.sml sml 3896 94 219 IMAGE-THUMBNAIL 1-s2.0-S0926860X24003454-gr7.sml https://s3-eu-west-1.amazonaws.com/prod-ucs-content-store-eu-west/content/pii:S0926860X24003454/gr7/THUMBNAIL/image/gif/d433eef2e484d95e66d918d6ab5dfc84/gr7.sml gr7 gr7.sml sml 7996 164 205 IMAGE-THUMBNAIL 1-s2.0-S0926860X24003454-gr6.sml https://s3-eu-west-1.amazonaws.com/prod-ucs-content-store-eu-west/content/pii:S0926860X24003454/gr6/THUMBNAIL/image/gif/88efc328df711912889750baf7750afe/gr6.sml gr6 gr6.sml sml 5667 164 208 IMAGE-THUMBNAIL 1-s2.0-S0926860X24003454-gr5.sml https://s3-eu-west-1.amazonaws.com/prod-ucs-content-store-eu-west/content/pii:S0926860X24003454/gr5/THUMBNAIL/image/gif/4498ef35291779af1fa16316bae5358c/gr5.sml gr5 gr5.sml sml 23548 151 219 IMAGE-THUMBNAIL 1-s2.0-S0926860X24003454-ga1.sml https://s3-eu-west-1.amazonaws.com/prod-ucs-content-store-eu-west/content/pii:S0926860X24003454/ga1/THUMBNAIL/image/gif/d5ea64791a95412c943cfbc5aee814a3/ga1.sml ga1 true ga1.sml sml 4658 58 219 IMAGE-THUMBNAIL 1-s2.0-S0926860X24003454-fx3.sml https://s3-eu-west-1.amazonaws.com/prod-ucs-content-store-eu-west/content/pii:S0926860X24003454/fx3/THUMBNAIL/image/gif/9fbd85c24b7ddb59f415db8f82c455a5/fx3.sml fx3 fx3.sml sml 6958 163 158 IMAGE-THUMBNAIL 1-s2.0-S0926860X24003454-sc1.sml https://s3-eu-west-1.amazonaws.com/prod-ucs-content-store-eu-west/content/pii:S0926860X24003454/sc1/THUMBNAIL/image/gif/3d3f6557b550b52fe49412f15c2d8a01/sc1.sml sc1 sc1.sml sml 6747 164 140 IMAGE-THUMBNAIL 1-s2.0-S0926860X24003454-fx2.sml https://s3-eu-west-1.amazonaws.com/prod-ucs-content-store-eu-west/content/pii:S0926860X24003454/fx2/THUMBNAIL/image/gif/fb8b17ed5b86c6d6791fe9276595d000/fx2.sml fx2 fx2.sml sml 7564 164 201 IMAGE-THUMBNAIL 1-s2.0-S0926860X24003454-fx1.sml https://s3-eu-west-1.amazonaws.com/prod-ucs-content-store-eu-west/content/pii:S0926860X24003454/fx1/THUMBNAIL/image/gif/6df34b85915213fa0479b52ebe3a4e49/fx1.sml fx1 fx1.sml sml 2360 34 219 IMAGE-THUMBNAIL 1-s2.0-S0926860X24003454-sc5_lrg.jpg https://s3-eu-west-1.amazonaws.com/prod-ucs-content-store-eu-west/content/pii:S0926860X24003454/HIGHRES/image/jpeg/d4b6c228dba1f9f910f35ac6e7a465a9/sc5_lrg.jpg sc5 sc5_lrg.jpg jpg 274014 1925 1663 IMAGE-HIGH-RES 1-s2.0-S0926860X24003454-sc4_lrg.jpg https://s3-eu-west-1.amazonaws.com/prod-ucs-content-store-eu-west/content/pii:S0926860X24003454/HIGHRES/image/jpeg/e0449bc43190432162d4bf24f7e461f6/sc4_lrg.jpg sc4 sc4_lrg.jpg jpg 43268 258 1663 IMAGE-HIGH-RES 1-s2.0-S0926860X24003454-sc3_lrg.jpg https://s3-eu-west-1.amazonaws.com/prod-ucs-content-store-eu-west/content/pii:S0926860X24003454/HIGHRES/image/jpeg/52c16fd3f3f482c36d92f42e2856da0e/sc3_lrg.jpg sc3 sc3_lrg.jpg jpg 90083 568 1663 IMAGE-HIGH-RES 1-s2.0-S0926860X24003454-fx4_lrg.jpg https://s3-eu-west-1.amazonaws.com/prod-ucs-content-store-eu-west/content/pii:S0926860X24003454/HIGHRES/image/jpeg/7b61060cd54d6bad1f72422c1f754ecf/fx4_lrg.jpg fx4 fx4_lrg.jpg jpg 20844 224 1490 IMAGE-HIGH-RES 1-s2.0-S0926860X24003454-sc2_lrg.jpg https://s3-eu-west-1.amazonaws.com/prod-ucs-content-store-eu-west/content/pii:S0926860X24003454/HIGHRES/image/jpeg/e71e3c07053102de3c0130386f02ba22/sc2_lrg.jpg sc2 sc2_lrg.jpg jpg 125383 645 3493 IMAGE-HIGH-RES 1-s2.0-S0926860X24003454-gr4_lrg.jpg https://s3-eu-west-1.amazonaws.com/prod-ucs-content-store-eu-west/content/pii:S0926860X24003454/HIGHRES/image/jpeg/f6d42131e23a37ce9d75cad2fb39857d/gr4_lrg.jpg gr4 gr4_lrg.jpg jpg 70666 1274 1663 IMAGE-HIGH-RES 1-s2.0-S0926860X24003454-gr3_lrg.jpg https://s3-eu-west-1.amazonaws.com/prod-ucs-content-store-eu-west/content/pii:S0926860X24003454/HIGHRES/image/jpeg/f7181ed57d9a6292105c1dbbf00f39be/gr3_lrg.jpg gr3 gr3_lrg.jpg jpg 82976 1276 1663 IMAGE-HIGH-RES 1-s2.0-S0926860X24003454-gr2_lrg.jpg https://s3-eu-west-1.amazonaws.com/prod-ucs-content-store-eu-west/content/pii:S0926860X24003454/HIGHRES/image/jpeg/21a4b5e0ce215e0c3edf335854b0d492/gr2_lrg.jpg gr2 gr2_lrg.jpg jpg 129820 1314 1663 IMAGE-HIGH-RES 1-s2.0-S0926860X24003454-gr1_lrg.jpg https://s3-eu-west-1.amazonaws.com/prod-ucs-content-store-eu-west/content/pii:S0926860X24003454/HIGHRES/image/jpeg/f235f24f4f256c0309f77749921a167d/gr1_lrg.jpg gr1 gr1_lrg.jpg jpg 148275 1525 1663 IMAGE-HIGH-RES 1-s2.0-S0926860X24003454-sc6_lrg.jpg https://s3-eu-west-1.amazonaws.com/prod-ucs-content-store-eu-west/content/pii:S0926860X24003454/HIGHRES/image/jpeg/52a6f1cd7d118ae5ee74ea4a4ab759e7/sc6_lrg.jpg sc6 sc6_lrg.jpg jpg 72867 712 1663 IMAGE-HIGH-RES 1-s2.0-S0926860X24003454-gr7_lrg.jpg https://s3-eu-west-1.amazonaws.com/prod-ucs-content-store-eu-west/content/pii:S0926860X24003454/HIGHRES/image/jpeg/0e9f67d456568143831a7d32df9bab14/gr7_lrg.jpg gr7 gr7_lrg.jpg jpg 118118 1327 1663 IMAGE-HIGH-RES 1-s2.0-S0926860X24003454-gr6_lrg.jpg https://s3-eu-west-1.amazonaws.com/prod-ucs-content-store-eu-west/content/pii:S0926860X24003454/HIGHRES/image/jpeg/246ec046d2c31d4cbfac83fb2ebef416/gr6_lrg.jpg gr6 gr6_lrg.jpg jpg 73801 1310 1663 IMAGE-HIGH-RES 1-s2.0-S0926860X24003454-gr5_lrg.jpg https://s3-eu-west-1.amazonaws.com/prod-ucs-content-store-eu-west/content/pii:S0926860X24003454/HIGHRES/image/jpeg/4007730bf1ab4d0c3ce2a0f4b8a18774/gr5_lrg.jpg gr5 gr5_lrg.jpg jpg 470677 2006 2911 IMAGE-HIGH-RES 1-s2.0-S0926860X24003454-ga1_lrg.jpg https://s3-eu-west-1.amazonaws.com/prod-ucs-content-store-eu-west/content/pii:S0926860X24003454/HIGHRES/image/jpeg/5c97bcd572335b8558371f569d99ad32/ga1_lrg.jpg ga1 true ga1_lrg.jpg jpg 174195 587 2213 IMAGE-HIGH-RES 1-s2.0-S0926860X24003454-fx3_lrg.jpg https://s3-eu-west-1.amazonaws.com/prod-ucs-content-store-eu-west/content/pii:S0926860X24003454/HIGHRES/image/jpeg/d70d489107093af41e8614ecd0190a8b/fx3_lrg.jpg fx3 fx3_lrg.jpg jpg 283636 1677 1621 IMAGE-HIGH-RES 1-s2.0-S0926860X24003454-sc1_lrg.jpg https://s3-eu-west-1.amazonaws.com/prod-ucs-content-store-eu-west/content/pii:S0926860X24003454/HIGHRES/image/jpeg/30f9cf0a621721f8e93e9a3bd5f56007/sc1_lrg.jpg sc1 sc1_lrg.jpg jpg 495110 2630 2245 IMAGE-HIGH-RES 1-s2.0-S0926860X24003454-fx2_lrg.jpg https://s3-eu-west-1.amazonaws.com/prod-ucs-content-store-eu-west/content/pii:S0926860X24003454/HIGHRES/image/jpeg/9371f86a58a0ce8e79e7591f787e1bee/fx2_lrg.jpg fx2 fx2_lrg.jpg jpg 136406 1301 1599 IMAGE-HIGH-RES 1-s2.0-S0926860X24003454-fx1_lrg.jpg https://s3-eu-west-1.amazonaws.com/prod-ucs-content-store-eu-west/content/pii:S0926860X24003454/HIGHRES/image/jpeg/15c32fe77c78264a60749087768e37f7/fx1_lrg.jpg fx1 fx1_lrg.jpg jpg 20859 227 1474 IMAGE-HIGH-RES 1-s2.0-S0926860X24003454-mmc1.docx https://s3-eu-west-1.amazonaws.com/prod-ucs-content-store-eu-west/content/pii:S0926860X24003454/mmc1/MAIN/application/vnd.openxmlformats-officedocument.wordprocessingml.document/05b95d09b42dfa45ca8f3546d912d998/mmc1.docx mmc1 mmc1.docx docx 5083117 APPLICATION 1-s2.0-S0926860X24003454-am.pdf am am.pdf pdf 2264974 AAM-PDF https://s3-eu-west-1.amazonaws.com/prod-ucs-content-store-eu-west/content/egi:10L68RG7SQP/MAIN/application/pdf/fa8281db5b2b2c0b30f023f5bbe747a4/am.pdf APCATA 119900 119900 S0926-860X(24)00345-4 10.1016/j.apcata.2024.119900 Elsevier B.V. Fig. 1 FT-IR spectra of (a) chitosan, (b) Chitosan@2,4,6-trichloro-1,3,5-triazine, (c) [Cu]@CTT (Cu(OAc)2@chitosan@2,4,6-trichloro-1,3,5-triazine). Fig. 1 Fig. 2 XRD patterns of the materials. Fig. 2 Fig. 3 Nitrogen adsorption/desorption isotherms. Fig. 3 Fig. 4 Pore size distribution. Fig. 4 Fig. 5 SEM image and EDS analysis of [Cu]@CTT. Fig. 5 Fig. 6 XPS spectra. Fig. 6 Fig. 7 XPS analysis for Cu@CTT. Fig. 7 Scheme 1 Methods for the synthesis of alkenylphosphoryl compound. Scheme 1 Scheme 2 Synthesis of [Cu]@CTT catalyst. Scheme 2 Scheme 3 Investigation of the internal alkynes. Scheme 3 Scheme 4 Large-scale production of (E)-diphenyl(styryl)phosphine oxide. Scheme 4 Scheme 5 Control experiments. Scheme 5 Scheme 6 Proposed mechanisms. Scheme 6 Table 1 Optimization of the reaction conditions a . Table 1 Image 1 Entry Solvent base [Cu]@CTT temp. yield b 1 Toluene Et3N 10 mg 100 °C 66 % 2 DCE Et3N 10 mg 100 °C 72 % 3 DMF Et3N 10 mg 100 °C trace 4 DMSO Et3N 10 mg 100 °C trace 5 CH3CN Et3N 10 mg 100 °C 55 % 6 1,4-dioxane Et3N 10 mg 100 °C 89 % 7 THF Et3N 10 mg 100 °C 79 % 8 EtOAc Et3N 10 mg 100 °C trace 9 MeOH Et3N 10 mg 100 °C 11 % 10 1,4-dioxane DBU 10 mg 100 °C 69 % 11 1,4-dioxane DIEA 10 mg 100 °C 71 % 12 1,4-dioxane Cs2CO3 10 mg 100 °C 50 % 13 1,4-dioxane K3PO4 10 mg 100 °C 55 % 14 1,4-dioxane CH3COONa 10 mg 100 °C 49 % 15 1,4-dioxane K2CO3 10 mg 100 °C 45 % 16 1,4-dioxane - 10 mg 100 °C 96 % 17 1,4-dioxane - 5 mg 100 °C 83 % 18 1,4-dioxane - 2 mg 100 °C 51 % 19 1,4-dioxane - 1 mg 100 °C 13 % 20 1,4-dioxane - - 100 °C n.d. 21 1,4-dioxane - 10 mg 120 °C 95 % 22 1,4-dioxane - 10 mg 80 °C 87 % 23 1,4-dioxane - 10 mg 60 °C 39 % 24 1,4-dioxane - 10 mg 40°C trace a Reaction were operated with diphenylphosphine oxide (0.2 mmol), phenylacetylene (0.2 mmol), base (2.0 eq), [Cu]@CTT and solvent (1.0 mL) under N2 conditions. b Yield was determined by GC analysis, using dodecane as the internal standard. Table 2 Substrate scope of P–H compounds a . Table 2 Image 2 a Reaction conditions: P–H compounds (0.2 mmol), phenylacetylene (0.2 mmol), [Cu]@CTT (10 mg), 1,4-dioxane (1.0 mL), N2, 100 °C, 12 h. b Isolated yields. c Yield was determined by GC analysis, using dodecane as the internal standard. Table 3 Substrate scope of alkynes a . Table 3 Image 3 a Reaction conditions: diphenylphosphine oxide (0.2 mmol), alkynes (0.2 mmol), [Cu]@CTT (10 mg), 1,4-dioxane (1.0 mL), N2, 100 °C, 12 h. b Isolated yields. Table 4 Recycling tests for the [Cu]@CTT-catalyzed regioselective hydrophosphoryaltion of 2a with 1a. Table 4 Image 4 Run 1st 2nd 3rd 4th 5th Yield b 96 % 93 % 91 % 88 % 84 % a Reaction conditions: diphenylphosphine oxide (1.0 mmol), phenylacetylene (1.0 mmol), [Cu]@CTT (30 mg), 1,4-dioxane (2.0 mL), N2, 100 °C, 12 h. b Yield was determined by GC analysis, using dodecane as the internal standard. Regioselective hydrophosphorylation of alkynes by a functionalized heterogeneous Cu-chitosan based catalyst Yining Ren Data curation Liyong Chen Data curation Mingyu Xie Data curation Shipan Xu Investigation Data curation Yu Liu Conceptualization Longzhi Zhu Writing – original draft ⁎ Weifeng Xu Writing – review & editing ⁎ Biquan Xiong Writing – review & editing Conceptualization ⁎ Department of Chemistry and Chemical Engineering, Hunan Institute of Science and Technology, Yueyang 414006, PR China Department of Chemistry and Chemical Engineering, Hunan Institute of Science and Technology Yueyang 414006 PR China Department of Chemistry and Chemical Engineering, Hunan Institute of Science and Technology, Yueyang, 414006, P R China. ⁎ Corresponding authors. The functionalized heterogeneous Cu-chitosan based catalyst was developed for the regioselective hydrophosphorylation of alkynes with secondary H-phosphine oxides. The functionalized chitosan framework was produced through a cross-coupling reaction between chitosan and 2,4,6-trichloro-1,3,5-triazine. Following this, the coordination of Cu(OAc)2 with the functionalized chitosan framework led to the synthesis of the heterogeneous Cu-chitosan based catalyst. Various techniques, such as powder FT-IR spectroscopy, X-ray diffraction (XRD), N2 physical adsorption, X-ray photoelectron spectroscopy (XPS), and scanning electron microscopy (SEM), were employed to characterize the catalyst. Subsequently, the resulting Cu(OAc)2@chitosan@2,4,6-trichloro-1,3,5-triazine catalyst exhibited remarkable catalytic activity in the regioselective hydrophosphorylation of alkynes with the formation of P–C bonds, displaying exceptional E/Z selectivity. This successful catalysis led to the synthesis of a range of (E) anti-Markovnikov adducts with high yields. The catalyst shows high recyclability in this transformation. On the basis of step-by-step control experiments, a plausible mechanism is proposed. Graphical Abstract Keywords P–H bonds Construction of P–C bonds Hydrophosphorylation Heterogeneous catalysis Anti-Markovnikov addition Data availability Data will be made available on request. 1 Introduction Organophosphorus compounds are widely used in catalysis, medicinal chemistry, coordination chemistry, materials and organic synthesis. [1] In particular, owing to the unique biological and pharmacological activities of alkenyl functionalized organophosphorus compounds, construction of the P–C bonds for the synthesis of these compounds is of great interest and particular importance. [2] Traditionally, the formation of P–C bonds for alkenylphosphine oxides involves transition metal-catalyzed cross-coupling reactions of H-phosphine oxides (P(O)–H) with alkenyl halides in the presence of a base. [3] Another effective method is the oxidative decarboxylative hydrophosphorylation of cinnamic acids with H-phosphine oxides to generate alkenylphosphoryl compounds. [4] A notable advancement in this field was made in 2014 by Gao et al., who introduced a novel copper-catalyzed protocol for the decarboxylative coupling of alkynyl acids with P(O)H compounds to synthesize (E)-1-alkenylphosphine oxides. [5] Furthermore, the transition metal-catalyzed dehydrogenative coupling reaction of H-phosphine oxides with olefins presents an effective route for the synthesis of alkenylphosphoryl compounds. [6] However, despite the significance of these methods, challenges such as the use of oxidants, bases, poor atomic economy, and environmental unfriendliness remain prevalent ( Scheme 1). The metal-catalyzed addition of H-phosphine oxides to an unsaturated carbon-carbon triple bonds is an efficient and simple method for producing alkenyl phosphine oxides, utilizing a variety of metals such as Pd, [7] Cu, [8] Rh, [9] Ni, [10] Co, [11] La, [12] etc. [13] In 2007, Zhao and Fu et al. reported a copper-catalyzed additions of P(O)–H compounds to alkynes, resulting in high regio- and stereoselective generation of E-alkenylphosphine oxides. [14] Lei et al. also contributed to the field by disclosing an Ag-promoted oxidative cross-coupling reaction between terminal alkynes and secondary phosphine oxides. [15] Subsequently, in 2018, Han et al. introduced a novel palladium-catalyzed hydrophosphorylation of alkynes with P(O)–H compounds, leading to the production of Markovnikov adducts in high yields with excellent regioselectivity. [7a] While significant progress has been made in selective hydrophosphorylation of alkynes in homogeneous catalytic systems, studies on heterogeneous catalysis remain limited. In this context, a novel heterogeneous Cu-chitosan based catalyst was developed to synthesize anti-Markovnikov products of (E)-alkenylphosphoryl compounds through regioselective hydrophosphorylation of alkynes, facilitating P–C bond formation. Particularly noteworthy is that this transformation eliminates the need for noble metal catalysts, additional ligands and bases. 2 Experimental 2.1 Synthesis of chitosan-framework Chitosan (deacetylation ≥ 95 %, viscosity: 100–200 mPa·s, 1.0 g), 2,4,6-trichloro-1,3,5-triazine (1.0 g), and K2CO3 (3.0 g) were added in acetone (50 mL) and heated at 100 °C for 24 h under an air atmosphere. After the reaction, HCl aqueous was added to neutralize the excess K2CO3. The resulting solid was washed with water and acetone for three times (10 mL/time), respectively, dried under vacuum to afford the corresponding chitosan@2,4,6-trichloro-1,3,5-triazine (yellow powder). 2.2 Synthesis of [Cu]@CTT catalyst Chitosan@2,4,6-trichloro-1,3,5-triazine (1.0 g) and Cu(OAc)2·H2O (1.0 g) were stirred in acetone (50 mL) at 60 °C for 24 hours under an air atmosphere. After the completion of the reaction, the resulting solid material was subjected to a series of washing steps. The solid was first rinsed twice with 10 mL of water and then with 10 mL of acetone. Following the washing steps, the solid was dried under vacuum to obtain the final product, a green powder identified as Cu(OAc)2@chitosan@2,4,6-trichloro-1,3,5-triazine, and is commonly referred to as [Cu]@CTT. 2.3 General considerations All solvents used in the reactions were freshly distilled. The other reagents were recrystallized or distilled as necessary. 1H (400 MHz), 13C{1H} (100 MHz), 31P{1H} (160 MHz) and 19F{1H} (376 MHz) were recorded on a 400 MHz spectrometer in CDCl3. 1H NMR chemical shifts were reported using TMS as the internal standard while 13C{1H} NMR chemical shifts were reported relative to CDCl3. The electron ionization method was used for HRMS measurements, and the mass analyzer type was double-focusing. 2.4 General procedure for the preparation of (E) anti-Markovnikov adducts A mixture of P–H compounds (0.2 mmol), alkynes (0.2 mmol), and [Cu]@CTT (10 mg) was dissolved in 1,4-dioxane (1.0 mL) and stirred under N2 atmosphere at 100 °C for 12 h. Removal of the solvent under a reduced pressure gave the crude product. Pure product was obtained by passing the crude product through a short silica gel column using hexane/EtOAc (1:1–1:2) as eluent. 3 Results and discussion Organic carriers, such as chitosan, offer advantages over traditional heterogeneous catalytic systems compared with inorganic carriers. Chitosan, a polysaccharide compound derived from various sources and biodegradable, possesses multiple easily modifiable groups, making it well-suited for chelating metals. Despite its poor solubility in most organic solvents, chitosan can be easily treated through incineration or carbonization methods after catalyst deactivation, allowing for the production of single atom catalysts, thereby serving as an excellent green carbon-based carrier for heterogeneous catalysts. The synthesis of a functionalized chitosan@2,4,6-trichloro-1,3,5-triazine (CTT) carrier involves the reaction of chitosan with 2,4,6-trichloro-1,3,5-triazine in the presence of K2CO3. Following this, the [Cu]@CTT catalyst (Cu(OAc)2@chitosan@2,4,6-trichloro-1,3,5-triazine) is prepared by using chitosan@2,4,6-trichloro-1,3,5-triazine to react with Cu(OAc)2·H2O in acetone. The crude catalyst undergoes a simple filtration process, after which it is washed with water and dried under reduced pressure to obtain the purified [Cu]@CTT catalyst ( Scheme 2). Initially, chitosan (CS), 2,4,6-trichloro-1,3,5-triazine modified chitosan, and modified chitosan copper complex ([Cu]@CTT) were characterized using Fourier Transform Infrared (FT-IR) spectroscopy to assess changes in the functional groups and molecular structure. The FT-IR spectra of CS exhibited characteristic peaks at 3427 cm−1 (O-H stretching vibration peak), 2906 cm−1 (C-H stretching vibration peak), 1590 cm−1 (N-H stretching vibration peak), 1378 cm−1 (C-H stretching vibration peak), 1252 cm−1 (C-O-C stretching vibration peak), and 1094 cm−1 (C-O stretching vibration peak as shown in Fig. 1 a). Compared to CS, the FT-IR spectrum of CTT displayed a new peak at 2151 cm−1, which is attributed to the C-N stretching vibration peak of 2,4,6-trichloro-1,3,5-triazine (Fig. 1 b), indicating the successful modification of CS with 2,4,6-trichloro-1,3,5-triazine. Moreover, in the [Cu]@CTT spectrum (Fig. 1 c), new peaks at 3339 cm−1 and 1469 cm−1 were observed, representing the stretching modes of Cu-O and Cu-N bonds, respectively. This data supports the successful synthesis of [Cu]@CTT through covalent interaction, as confirmed by the spectral analysis. [16] The X-ray diffraction analysis was performed to investigate the structural regularity of [Cu]@CTT ( Fig. 2). The powder X-ray diffraction patterns revealed two distinct peaks at 16.2° and 32.2°, consistent with the reference pattern of α-Cu(OAc)2. To investigate the structural properties of the [Cu]@CTT catalyst, a nitrogen adsorption-desorption isotherm curve experiment was conducted. The results, as illustrated in Fig. 3, revealed that the [Cu]@CTT catalyst exhibits a characteristic IUPAC type-III adsorption/desorption behavior, suggesting the presence of a hierarchical porous structure within the catalyst. This behavior can be attributed to the presence of slit-shaped pores located between the chitosan layers. The specific surface area of the [Cu]@CTT catalyst was determined to be 32.1 m2/g. Additionally, the pore size distribution analysis of the catalyst, as depicted in Fig. 4, indicated that the majority of pores are concentered around 2.3 nm. This observation suggests that the [Cu]@CTT catalyst possesses a significant number of micropores, making it well-suited for facilitating the access of small organic molecules. The synthesized [Cu]@CTT catalyst was investigated using SEM and EDS analysis, as illustrated in Fig. 5. The scanning electron microscope captured various morphologies of [Cu]@CTT, revealing a surface with folds resembling a network structure. This unique surface morphology facilitates enhanced contact between the catalyst and organic small molecules. Furthermore, EDS analysis confirmed the presence of Cu, N, and O elements within the catalyst. The elemental surface composition and oxidation states of the metal components were determined using X-ray photoelectron spectroscopy (XPS). In the survey of XPS spectrum, peaks corresponding to Cu2p, O1s, N1s, and C1s were identified at binding energies of 933.3, 688.5, 529.9, 397.7, and 283.3 eV, respectively ( Fig. 6). A detailed analysis of the high-resolution Cu2p spectrum, as shown in Fig. 7, revealed peaks at 933.3 and 952.9 eV, which correspond to Cu1 2p3/2 and Cu1’ 2p1/2, respectively. The peak at 933.3 eV was attributed to Cu(II)-N coordination. [17] The presence of Cu2, Cu2’, Cu3, Cu3’, Cu4, and Cu4’ in [Cu]@CTT may stem from the varying Cu2+-chelating abilities of the functional groups within CTT. This observation provides evidence that the copper species have been effectively immobilized on the chitosan carrier. In the initial stage of the study, we attempted to use the synthesized Cu-based chitosan material ([Cu]@CTT) as the catalyst for the hydrophosphorylation reaction of alkynes with P-H bonds. To accomplish this, we introduced a catalytic amount of [Cu]@CTT (10 mg) into the reaction between diphenylphosphine oxide (1a) and phenylacetylene (2a), which was stirred at 100 °C in toluene under a N2 atmosphere, and supplemented with 2.0 equivalents of Et3N. The progress of the reaction, as monitored by GC and GC-MS analyses, led to the formation of the hydrophosphorylation product 3a in 66 % yield ( Table 1, entry 1). Various solvents including DCE, DMF, DMSO, CH3CN, 1,4-dioxane, THF, EtOAc, and MeOH were subsequently explored (Table 1, entries 2–9), with the optimal solvent being identified as 1,4-dioxane, yielding the E-configuration hydrophosphorylation product at the yield of 89 %. Screening of different base species such as DBU, DIEA, Cs2CO3, K3PO4, CH3COONa, and K2CO3 (Table 1, entries 10–16) revealed that the reaction performed best without the addition of any base. Notably, a reduction in the amount of [Cu]@CTT catalyst significantly lowered the yield of 3a. Omission of the [Cu]@CTT catalyst entirely resulted in no formation of the target product (Table 1, entries 16–20). Adjusting the reaction temperature from 100 °C to 40 °C led to a notable decrease in the desired product 3a; however, further temperature increment from 100 to 120 °C did not exhibit substantial effects on the reaction outcome. Consequently, the optimal reaction conditions entailed the use of diphenylphosphine oxide (0.2 mmol), phenylacetylene (0.2 mmol), [Cu]@CTT (10 mg), 1,4-dioxane (1.0 mL), N2 atmosphere, 100 °C, and a reaction time of 12 hours (Table 1, entry 16). The Cu-catalyzed E-selective hydrophosphorylation reaction can be utilized with various types of diaryl H-phosphine oxides, as demonstrated by the findings in Table 2. It is evident that when diaryl phosphine oxides contain electron-donating groups, such as di-p-tolylphosphine oxide (1b), di-m-tolylphosphine oxide (1c), bis(4-methoxyphenyl)phosphine oxide (1d), and bis(3,5-dimethylphenyl)phosphine oxide (1e), they can efficiently react with compound 2a under the optimized conditions, yielding the corresponding E-configuration hydrophosphorylation products 3b-3e in isolated yields ranging from 87 % to 91 %. Similarly, when electron-withdrawing groups are substituted in the aryl ring of diaryl H-phosphine oxides, as seen in bis(3-fluorophenyl)phosphine oxide (1 f) and bis(4-(trifluoromethyl)phenyl)phosphine oxide (1 g), the starting materials can be employed for the transformation, leading to the synthesis of target products 3 f and 3 g in yields of 86 % and 84 %, respectively. Furthermore, utilizing di(naphthalen-1-yl)phosphine oxide (1 h), di(naphthalen-2-yl)phosphine oxide (1i), and dibenzo[c,e][1,2]oxaphosphinine 6-oxide (1j) as substrates in the reaction also resulted in the successful synthesis of the desired hydrophosphorylation products, with yields ranging from 83 % to 88 %. The above case fully demonstrates that the presence of electron withdrawing or donating groups on the aromatic rings of most diaryl H-phosphine oxides does not significantly impact the formation of the target product in this conversion. In contrast, diethyl phosphonate (1k) and diphenyl phosphonate (1 l) did not exhibit reactivity in the reaction, leading to the absence of the corresponding hydrophosphorylation products (3k) and (3 l) formation post-reaction. As depicted in Table 3, a range of substituted alkynes (2b-2ad) were screened under the optimized E-configuration transformation reaction conditions. It is clear that aryl alkynes bearing electron-donating groups such as 1-ethyl-4-ethynylbenzene (2b), 1-ethynyl-4-propylbenzene (2c), 1-ethynyl-4-pentylbenzene (2d), 1-ethynyl-4-methoxybenzene (2e), and 1-ethoxy-4-ethynylbenzene (2 f) exhibit high reactivity toward the reaction, affording the expected E-configuration hydrophosphorylation products of 4a-4e in 88–93 % yields. When 4-ethynyl-1,1′-biphenyl (2 g) was employed as the substrate for the reaction, the corresponding product (E)-(2-([1,1′-biphenyl]-4-yl)vinyl)diphenylphosphine oxide (4 f) is generated in 87 % yield. Additionally, the electron-withdrawing groups substituted in the aryl ring of alkynes, such as 1-ethynyl-3-nitrobenzene (2 h), 1-ethynyl-3-fluorobenzene (2i), 1-bromo-4-ethynylbenzene (2j) and 1-bromo-3-ethynylbenzene (2k), they also showed satisfactory results, yielding the desired E-configuration hydrophosphorylation products 4 g-4j with 85–87 % yields. When 2-ethynylpyridine (2 l) and 3-ethynylthiophene (2 m) of heterocyclic alkynes were employed, the expected products (E)-diphenyl(2-(pyridin-2-yl)vinyl)phosphine oxide (4k) and (E)-diphenyl(2-(thiophen-3-yl)vinyl)phosphine oxide (4 l) could be produced in 83 % and 81 % yield, respectively. As expected, (prop-2-yn-1-yloxy)benzene (2 n) was also appropriate for this transformation to afford the hydrophosphorylation product 4 m in 90 % yield. Additionally, 1-methyl-3-(prop-2-yn-1-yloxy)benzene (2o), 1-methyl-4-(prop-2-yn-1-yloxy)benzene (2p), 1-(tert-butyl)-4-(prop-2-yn-1-yloxy)benzene (2q), 1-methoxy-4-(prop-2-yn-1-yloxy)benzene (2r), 1-methoxy-2-(prop-2-yn-1-yloxy)benzene (2 s), and 2-(prop-2-yn-1-yloxy)-1,1′-biphenyl (2t) were also showed satisfactory results, giving the desired hydrophosphorylation products 4n-4s with 82–89 % yields. When alkynes bearing multiple electron-donating groups, such as 2,4-di-tert-butyl-1-(prop-2-yn-1-yloxy)benzene (2 u) and (3-methoxy-4-(prop-2-yn-1-yloxy)phenyl)methanol (2 v), were employed, the corresponding products (E)-(3-(2,4-di-tert-butylphenoxy)prop-1-en-1-yl)diphenylphosphine oxide (4t) and (E)-(3-(4-(hydroxymethyl)-2-methoxyphenoxy)prop-1-en-1-yl)diphenylphosphine oxide (4 u) were synthesized with yields of 87 % and 83 %, respectively. Additionally, alkynes like 1-fluoro-2-(prop-2-yn-1-yloxy)benzene (2w) and 1-chloro-4-(prop-2-yn-1-yloxy)benzene (2x) yielded the hydrophosphorylation products 4 v and 4w, with yields of 82 % and 86 %, respectively. Upon employing alkynes such as 1-(prop-2-yn-1-yloxy)naphthalene (2 y), 2-(prop-2-yn-1-yloxy)naphthalene (2z), 2-bromo-6-(prop-2-yn-1-yloxy)naphthalene (2aa), and 6-(prop-2-yn-1-yloxy)-1,2,3,4-tetrahydronaphthalene (2ab), the products 4x-4aa were obtained with yields between 86 % and 91 %. Lastly, the use of ethyl propiolate (2ac) resulted in the product of (E)-ethyl 3- (diphenylphosphoryl)acrylate (4ab) with 86 % yield. Notably,ethinyl estradiol (2ad) demonstrated good efficacy in the transformation, producing the hydrophosphorylation product 4ac with 81 % yield. As shown in Scheme 3, we investigated the reactivity of internal alkyne prop-1-yn-1-ylbenzene (2ae) with diphenylphosphine oxide (1a) under the standard conditions, which produced product 4ad in 86 % yield. In contrast, the use of 1,2-diphenylethyne (2af) as the substrate to react with 1a resulted in the formation of only a trace amount of the desired product 4ae. Instead, the main product obtained was 1,2,3-triphenylphosphindole 1-oxide (4ae’) in a 52 % yield. In order to demonstrate the practical application of this reaction, a large-scale reaction of diphenylphosphine oxide (10 mmol) with phenylacetylene (10 mmol) catalyzed by Cu@CTT was performed under the optimized conditions. After simple purification, the target product 3a could be generated in 83 % yield (2.53 g, Scheme 4). Recyclability is a key criterion for assessing the effectiveness of heterogeneous catalysts. The [Cu]@CTT catalyst has been found to exhibit exceptional recyclability in the regioselective hydrophosphorylation of alkynes, with minimal leaching of copper source (approximately 22 ppm based on ICP-AES analysis). Table 4 details the recycling test results with this catalyst, showing consistent yields of the desired product at 96–84 % after five cycles. To gain the insight of the mechanism for the selective hydrophosphorylation of alkynes with secondary H-phosphine oxides, some control experiments were conducted under the optimal reaction conditions as shown in Scheme 5. When the reactions were performed with the addition of two equivalents of the radical scavenger 2,2,6,6-tetramethylpiperidine N-oxyl (TEMPO) and 2,6-di-tert-butyl-4-methylphenol (BHT), the corresponding target product 3a were detected in 82 % and 93 % yields. These results suggest that the reaction may proceed not via a free radical process (eqs 1 and 2). Notably, diphenylphosphane (5a) was also showed positive results for this transformation, and provide the expected P-H addition product 6a in 86 % yield (eq 3). However, when we adopted diphenylphosphinic acid and water as the reactant to react with ethynylbenzene, to verify whether copper ions in the catalyst preferentially activate the terminal alkyne group in phenylacetylene by capturing by-products, as monitored by GC-MS, there is no other product formed during the reaction (eqs 4 and 5). The above experiment proves that during the reaction process, it is possible that the phosphoryl group coordinates preferentially with copper ions to initiate the hydrophosphorylation process. Under the optimal reaction conditions, we also explored the reactions of diphenylphosphine oxide with styrene (5c), but are still failed to from any new products in the reaction (eq 6). In order to clarify the transfer mechanism of hydrogen atom during the reaction, we selected Ph2P(O)D (1a’) as the substrate to react with 2a under the optimal reaction conditions. As monitored 1H NMR analysis, the hydrogen atom of olefin carbon in 3a’ was partially deuterated by Ph2P(O)D, a KIE (k H /k D ) constant was determined as 1.5 (eq 7). A plausible mechanism for this transformation is proposed as depicted in Scheme 6. First, phenylacetylene (2a) undergoes a reaction with the Cu-chitosan based catalyst, resulting in the formation of a reactive intermediate A. Subsequently, diarylphosphine oxide coordinates with the intermediate A, leading to the generation of intermediate B. The transfer insertion of the diphenylphosphine oxide component into the triple bond triggers the formation of a copper complex C. Following protonation, complex C transforms into D, which then proceeds to engage with another molecule of diphenylphosphine oxide and phenylacetylene. This binding event results in the generation of the anti-Markovnikov adduct product 3 and facilitates the regeneration of complex B. 4 Conclusion In summary, we developed a novel method for the anti-Markovnikov type regioselective hydrophosphorylation of alkynes with secondary H-phosphine oxides via a functionalized heterogeneous Cu-chitosan based catalyst. This approach avoids the use of highly toxic alkenyl halides, bases and oxidants, and a broad substrate scope of secondary H-phosphine oxides and alkynes containing different functional groups were tolerated well for this transformation. This method proceeds smoothly with heterogeneous Cu-chitosan based catalyst as the only additive, featuring recyclability as well as high atom economy in terms of green chemistry. The protocol also exhibits high potential for the construction of biologically active (E)-phosphoyl substituted alkenes and its derivatives. CRediT authorship contribution statement Yining Ren: Data curation. Liyong Chen: Data curation. Mingyu Xie: Data curation. Shipan Xu: Investigation, Data curation. Yu Liu: Conceptualization. Longzhi Zhu: Writing – original draft. Weifeng Xu: Writing – review & editing. Biquan Xiong: Writing – review & editing, Conceptualization. Declaration of Competing Interest The authors declare that they have no known competing financial interests or personal relationships that could have appeared to influence the work reported in this paper. Acknowledgements This work was supported by Natural Science Foundation of Hunan Province (2023JJ30274, 2023JJ30275), and Scientific Research Fund of Hunan Provincial Education Department (23A0497, 23B0634). Appendix A Supporting information Supplementary data associated with this article can be found in the online version at doi:10.1016/j.apcata.2024.119900. Appendix A Supplementary material Supplementary material. References [1] (a) A.L. Clevenger R.M. Stolley J. Aderibigbe J. Louie Chem. Rev. 120 2020 6124 6196 (a)A.L. Clevenger, R.M. Stolley, J. Aderibigbe, J. Louie, Chem. Rev. 120 (2020) 6124-6196; (b) H. Guo, Y.C. Fan, Z. Sun, Y. Wu, O. Kwon, Chem. Rev. 118 (2018) 10049-10293; (c) J. Goura, V. Chandrasekhar, Chem. Rev. 115 (2015) 6854-6965. (d) U. Pradere, E.C. Garnier-Amblard, S.J. Coats, F. Amblard, R.F. Schinazi, Chem. Rev. 114 (2014) 9154-9218; (e) S. Song, Y. Zhang, A. Yeerlan, B. Zhu, J. Liu, N. Jiao, Angew. Chem. Int. Ed. 56 (2017) 2487-2491; (f) X.-Y. Chen, M. Pu, H.-G. Cheng, T. Sperge, F. Schoenebeck, Angew. Chem. Int. Ed. 131 (2019) 11517-11521; (g) M. Dutartre, J. Bayardon, S. Juge, Chem. Soc. Rev. 45 (2016) 5771-5794. (b) H. Guo Y.C. Fan Z. Sun Y. Wu O. Kwon Chem. Rev. 118 2018 10049 10293 (a)A.L. Clevenger, R.M. Stolley, J. Aderibigbe, J. Louie, Chem. Rev. 120 (2020) 6124-6196; (b) H. Guo, Y.C. Fan, Z. Sun, Y. Wu, O. Kwon, Chem. Rev. 118 (2018) 10049-10293; (c) J. Goura, V. Chandrasekhar, Chem. Rev. 115 (2015) 6854-6965. (d) U. Pradere, E.C. Garnier-Amblard, S.J. Coats, F. Amblard, R.F. Schinazi, Chem. Rev. 114 (2014) 9154-9218; (e) S. Song, Y. Zhang, A. Yeerlan, B. Zhu, J. Liu, N. Jiao, Angew. Chem. Int. Ed. 56 (2017) 2487-2491; (f) X.-Y. Chen, M. Pu, H.-G. Cheng, T. Sperge, F. Schoenebeck, Angew. Chem. Int. Ed. 131 (2019) 11517-11521; (g) M. Dutartre, J. Bayardon, S. Juge, Chem. Soc. Rev. 45 (2016) 5771-5794. (c) J. Goura V. Chandrasekhar Chem. Rev. 115 2015 6854 6965 (a)A.L. Clevenger, R.M. Stolley, J. Aderibigbe, J. Louie, Chem. Rev. 120 (2020) 6124-6196; (b) H. Guo, Y.C. Fan, Z. Sun, Y. Wu, O. Kwon, Chem. Rev. 118 (2018) 10049-10293; (c) J. Goura, V. Chandrasekhar, Chem. Rev. 115 (2015) 6854-6965. (d) U. Pradere, E.C. Garnier-Amblard, S.J. Coats, F. Amblard, R.F. Schinazi, Chem. Rev. 114 (2014) 9154-9218; (e) S. Song, Y. Zhang, A. Yeerlan, B. Zhu, J. Liu, N. Jiao, Angew. Chem. Int. Ed. 56 (2017) 2487-2491; (f) X.-Y. Chen, M. Pu, H.-G. Cheng, T. Sperge, F. Schoenebeck, Angew. Chem. Int. Ed. 131 (2019) 11517-11521; (g) M. Dutartre, J. Bayardon, S. Juge, Chem. Soc. Rev. 45 (2016) 5771-5794. (d) U. Pradere E.C. Garnier-Amblard S.J. Coats F. Amblard R.F. Schinazi Chem. Rev. 114 2014 9154 9218 (a)A.L. Clevenger, R.M. Stolley, J. Aderibigbe, J. Louie, Chem. Rev. 120 (2020) 6124-6196; (b) H. Guo, Y.C. Fan, Z. Sun, Y. Wu, O. Kwon, Chem. Rev. 118 (2018) 10049-10293; (c) J. Goura, V. Chandrasekhar, Chem. Rev. 115 (2015) 6854-6965. (d) U. Pradere, E.C. Garnier-Amblard, S.J. Coats, F. Amblard, R.F. Schinazi, Chem. Rev. 114 (2014) 9154-9218; (e) S. Song, Y. Zhang, A. Yeerlan, B. Zhu, J. Liu, N. Jiao, Angew. Chem. Int. Ed. 56 (2017) 2487-2491; (f) X.-Y. Chen, M. Pu, H.-G. Cheng, T. Sperge, F. Schoenebeck, Angew. Chem. Int. Ed. 131 (2019) 11517-11521; (g) M. Dutartre, J. Bayardon, S. Juge, Chem. Soc. Rev. 45 (2016) 5771-5794. (e) S. Song Y. Zhang A. Yeerlan B. Zhu J. Liu N. Jiao Angew. Chem. Int. Ed. 56 2017 2487 2491 (a)A.L. Clevenger, R.M. Stolley, J. Aderibigbe, J. Louie, Chem. Rev. 120 (2020) 6124-6196; (b) H. Guo, Y.C. Fan, Z. Sun, Y. Wu, O. Kwon, Chem. Rev. 118 (2018) 10049-10293; (c) J. Goura, V. Chandrasekhar, Chem. Rev. 115 (2015) 6854-6965. (d) U. Pradere, E.C. Garnier-Amblard, S.J. Coats, F. Amblard, R.F. Schinazi, Chem. Rev. 114 (2014) 9154-9218; (e) S. Song, Y. Zhang, A. Yeerlan, B. Zhu, J. Liu, N. Jiao, Angew. Chem. Int. Ed. 56 (2017) 2487-2491; (f) X.-Y. Chen, M. Pu, H.-G. Cheng, T. Sperge, F. Schoenebeck, Angew. Chem. Int. Ed. 131 (2019) 11517-11521; (g) M. Dutartre, J. Bayardon, S. Juge, Chem. Soc. Rev. 45 (2016) 5771-5794. (f) X.-Y. Chen M. Pu H.-G. Cheng T. Sperge F. Schoenebeck Angew. Chem. Int. Ed. 131 2019 11517 11521 (a)A.L. Clevenger, R.M. Stolley, J. Aderibigbe, J. Louie, Chem. Rev. 120 (2020) 6124-6196; (b) H. Guo, Y.C. Fan, Z. Sun, Y. Wu, O. Kwon, Chem. Rev. 118 (2018) 10049-10293; (c) J. Goura, V. Chandrasekhar, Chem. Rev. 115 (2015) 6854-6965. (d) U. Pradere, E.C. Garnier-Amblard, S.J. Coats, F. Amblard, R.F. Schinazi, Chem. Rev. 114 (2014) 9154-9218; (e) S. Song, Y. Zhang, A. Yeerlan, B. Zhu, J. Liu, N. Jiao, Angew. Chem. Int. Ed. 56 (2017) 2487-2491; (f) X.-Y. Chen, M. Pu, H.-G. Cheng, T. Sperge, F. Schoenebeck, Angew. Chem. Int. Ed. 131 (2019) 11517-11521; (g) M. Dutartre, J. Bayardon, S. Juge, Chem. Soc. Rev. 45 (2016) 5771-5794. (g) M. Dutartre J. Bayardon S. Juge Chem. Soc. Rev. 45 2016 5771 5794 (a)A.L. Clevenger, R.M. Stolley, J. Aderibigbe, J. Louie, Chem. Rev. 120 (2020) 6124-6196; (b) H. Guo, Y.C. Fan, Z. Sun, Y. Wu, O. Kwon, Chem. Rev. 118 (2018) 10049-10293; (c) J. Goura, V. Chandrasekhar, Chem. Rev. 115 (2015) 6854-6965. (d) U. Pradere, E.C. Garnier-Amblard, S.J. Coats, F. Amblard, R.F. Schinazi, Chem. Rev. 114 (2014) 9154-9218; (e) S. Song, Y. Zhang, A. Yeerlan, B. Zhu, J. Liu, N. Jiao, Angew. Chem. Int. Ed. 56 (2017) 2487-2491; (f) X.-Y. Chen, M. Pu, H.-G. Cheng, T. Sperge, F. Schoenebeck, Angew. Chem. Int. Ed. 131 (2019) 11517-11521; (g) M. Dutartre, J. Bayardon, S. Juge, Chem. Soc. Rev. 45 (2016) 5771-5794. [2] (a) W.W. Metcalf W.A. van der Donk Annu. Rev. Biochem. 78 2009 65 94 (a) W.W. Metcalf, W.A. van der Donk, Annu. Rev. Biochem. 78 (2009) 65-94; (b) J. Parvole, P. Jannasch, Macromolecules 41 (2008) 3893-3903; (c) O. Senhaji, J.J. Robin, M. Achchoubi, B. Boutevin, Macromol. Chem. Phys. 205 (2004) 1039-1050; (d) M. Schmider, E. Muh, J.E. Klee, R. Mulhaupt, Macromolecules 38 (2005) 9548-9555. (b) J. Parvole P. Jannasch Macromolecules 41 2008 3893 3903 (a) W.W. Metcalf, W.A. van der Donk, Annu. Rev. Biochem. 78 (2009) 65-94; (b) J. Parvole, P. Jannasch, Macromolecules 41 (2008) 3893-3903; (c) O. Senhaji, J.J. Robin, M. Achchoubi, B. Boutevin, Macromol. Chem. Phys. 205 (2004) 1039-1050; (d) M. Schmider, E. Muh, J.E. Klee, R. Mulhaupt, Macromolecules 38 (2005) 9548-9555. (c) O. Senhaji J.J. Robin M. Achchoubi B. Boutevin Macromol. Chem. Phys. 205 2004 1039 1050 (a) W.W. Metcalf, W.A. van der Donk, Annu. Rev. Biochem. 78 (2009) 65-94; (b) J. Parvole, P. Jannasch, Macromolecules 41 (2008) 3893-3903; (c) O. Senhaji, J.J. Robin, M. Achchoubi, B. Boutevin, Macromol. Chem. Phys. 205 (2004) 1039-1050; (d) M. Schmider, E. Muh, J.E. Klee, R. Mulhaupt, Macromolecules 38 (2005) 9548-9555. (d) M. Schmider E. Muh J.E. Klee R. Mulhaupt Macromolecules 38 2005 9548 9555 (a) W.W. Metcalf, W.A. van der Donk, Annu. Rev. Biochem. 78 (2009) 65-94; (b) J. Parvole, P. Jannasch, Macromolecules 41 (2008) 3893-3903; (c) O. Senhaji, J.J. Robin, M. Achchoubi, B. Boutevin, Macromol. Chem. Phys. 205 (2004) 1039-1050; (d) M. Schmider, E. Muh, J.E. Klee, R. Mulhaupt, Macromolecules 38 (2005) 9548-9555. [3] (a) Y. Xu J. Xia H. Guo Synthesis 8 1986 691 692 (a) Y. Xu, J. Xia, H. Guo, Synthesis 8 (1986) 691-692; (b) L. Liu, Y. Wang, Z. Zeng, P. Xu, Y. Gao, Y. Yin, Y. Zhao, Adv. Synth. Catal. 355 (2013) 659-666; (c) L. Liu, Y. Lv, Y. Wu, X. Gao, H. Zeng, Y. Gao, G. Tang, Y. Zhao, R.S.C. Adv. 4 (2014) 2322-2326. (b) L. Liu Y. Wang Z. Zeng P. Xu Y. Gao Y. Yin Y. Zhao Adv. Synth. Catal. 355 2013 659 666 (a) Y. Xu, J. Xia, H. Guo, Synthesis 8 (1986) 691-692; (b) L. Liu, Y. Wang, Z. Zeng, P. Xu, Y. Gao, Y. Yin, Y. Zhao, Adv. Synth. Catal. 355 (2013) 659-666; (c) L. Liu, Y. Lv, Y. Wu, X. Gao, H. Zeng, Y. Gao, G. Tang, Y. Zhao, R.S.C. Adv. 4 (2014) 2322-2326. (c) L. Liu Y. Lv Y. Wu X. Gao H. Zeng Y. Gao G. Tang Y. Zhao R.S.C. Adv 4 2014 2322 2326 (a) Y. Xu, J. Xia, H. Guo, Synthesis 8 (1986) 691-692; (b) L. Liu, Y. Wang, Z. Zeng, P. Xu, Y. Gao, Y. Yin, Y. Zhao, Adv. Synth. Catal. 355 (2013) 659-666; (c) L. Liu, Y. Lv, Y. Wu, X. Gao, H. Zeng, Y. Gao, G. Tang, Y. Zhao, R.S.C. Adv. 4 (2014) 2322-2326. [4] (a) J. Hu N. Zhao B. Yang G. Wang L.-N. Guo Y.-M. Liang S.-D. Yang Chem. Eur. J. 17 2011 5516 5521 (a)J. Hu, N. Zhao, B. Yang, G. Wang, L.-N. Guo, Y.-M. Liang, S.-D. Yang, Chem. Eur. J. 17 (2011), 5516-5521; (b) Y. Wu, L. Liu, K. Yan, P. Xu, Y. Gao, Y. Zhao, J. Org. Chem. 79 (2014) 8118-8127; (c) L. Tang, L. Wen, T. Sun, D. Zhang, Z. Yang, C. Feng, Z. Wang, J. Org. Chem. 6 (2017) 1683-1692; (d) L. Liu, D. Zhou, J. Dong, Y. Zhou, S.-F. Yin, L.-B. Han, J. Org. Chem. 83 (2018) 4190-4196. (b) Y. Wu L. Liu K. Yan P. Xu Y. Gao Y. Zhao J. Org. Chem. 79 2014 8118 8127 (a)J. Hu, N. Zhao, B. Yang, G. Wang, L.-N. Guo, Y.-M. Liang, S.-D. Yang, Chem. Eur. J. 17 (2011), 5516-5521; (b) Y. Wu, L. Liu, K. Yan, P. Xu, Y. Gao, Y. Zhao, J. Org. Chem. 79 (2014) 8118-8127; (c) L. Tang, L. Wen, T. Sun, D. Zhang, Z. Yang, C. Feng, Z. Wang, J. Org. Chem. 6 (2017) 1683-1692; (d) L. Liu, D. Zhou, J. Dong, Y. Zhou, S.-F. Yin, L.-B. Han, J. Org. Chem. 83 (2018) 4190-4196. (c) L. Tang L. Wen T. Sun D. Zhang Z. Yang C. Feng Z. Wang J. Org. Chem. 6 2017 1683 1692 (a)J. Hu, N. Zhao, B. Yang, G. Wang, L.-N. Guo, Y.-M. Liang, S.-D. Yang, Chem. Eur. J. 17 (2011), 5516-5521; (b) Y. Wu, L. Liu, K. Yan, P. Xu, Y. Gao, Y. Zhao, J. Org. Chem. 79 (2014) 8118-8127; (c) L. Tang, L. Wen, T. Sun, D. Zhang, Z. Yang, C. Feng, Z. Wang, J. Org. Chem. 6 (2017) 1683-1692; (d) L. Liu, D. Zhou, J. Dong, Y. Zhou, S.-F. Yin, L.-B. Han, J. Org. Chem. 83 (2018) 4190-4196. (d) L. Liu D. Zhou J. Dong Y. Zhou S.-F. Yin L.-B. Han J. Org. Chem. 83 2018 4190 4196 (a)J. Hu, N. Zhao, B. Yang, G. Wang, L.-N. Guo, Y.-M. Liang, S.-D. Yang, Chem. Eur. J. 17 (2011), 5516-5521; (b) Y. Wu, L. Liu, K. Yan, P. Xu, Y. Gao, Y. Zhao, J. Org. Chem. 79 (2014) 8118-8127; (c) L. Tang, L. Wen, T. Sun, D. Zhang, Z. Yang, C. Feng, Z. Wang, J. Org. Chem. 6 (2017) 1683-1692; (d) L. Liu, D. Zhou, J. Dong, Y. Zhou, S.-F. Yin, L.-B. Han, J. Org. Chem. 83 (2018) 4190-4196. [5] G. Hu Y. Gao Y. Zhao Org. Lett. 16 2014 4464 4467 G. Hu, Y. Gao, Y. Zhao, Org. Lett. 16 (2014) 4464-4467. [6] (a) Q. Gui L. Hu X. Chen J. Liu Z. Tan Chem. Commun. 17 2011 5516 5521 (a) Q. Gui, L. Hu, X. Chen, J. Liu, Z. Tan, Chem. Commun. 17 (2011) 5516-5521; (b) J. Gu, C. Cai, Org. Biomol. Chem. 15 (2017) 4226-4230; (c) J. Shen, R.-X. Yu, Y. Luo, L.-X. Zhu, Y. Zhang, X. Wang, B. Xiao, J.-B. Cheng, B. Yan, G.-Z. Li, Eur. J. Org. Chem. 10 (2019) 2065-2070; (d) W.-Q. Liu, T. Lei, S. Zhou, X.-L. Yang, J. Li, B. Chen, J. Sivaguru, C.-H. Tung, L.-Z. Wu, J. Am. Chem. Soc. 141 (2019) 13941-13947. (b) J. Gu C. Cai Org. Biomol. Chem. 15 2017 4226 4230 (a) Q. Gui, L. Hu, X. Chen, J. Liu, Z. Tan, Chem. Commun. 17 (2011) 5516-5521; (b) J. Gu, C. Cai, Org. Biomol. Chem. 15 (2017) 4226-4230; (c) J. Shen, R.-X. Yu, Y. Luo, L.-X. Zhu, Y. Zhang, X. Wang, B. Xiao, J.-B. Cheng, B. Yan, G.-Z. Li, Eur. J. Org. Chem. 10 (2019) 2065-2070; (d) W.-Q. Liu, T. Lei, S. Zhou, X.-L. Yang, J. Li, B. Chen, J. Sivaguru, C.-H. Tung, L.-Z. Wu, J. Am. Chem. Soc. 141 (2019) 13941-13947. (c) J. Shen R.-X. Yu Y. Luo L.-X. Zhu Y. Zhang X. Wang B. Xiao J.-B. Cheng B. Yan G.-Z. Li Eur. J. Org. Chem. 10 2019 2065 2070 (a) Q. Gui, L. Hu, X. Chen, J. Liu, Z. Tan, Chem. Commun. 17 (2011) 5516-5521; (b) J. Gu, C. Cai, Org. Biomol. Chem. 15 (2017) 4226-4230; (c) J. Shen, R.-X. Yu, Y. Luo, L.-X. Zhu, Y. Zhang, X. Wang, B. Xiao, J.-B. Cheng, B. Yan, G.-Z. Li, Eur. J. Org. Chem. 10 (2019) 2065-2070; (d) W.-Q. Liu, T. Lei, S. Zhou, X.-L. Yang, J. Li, B. Chen, J. Sivaguru, C.-H. Tung, L.-Z. Wu, J. Am. Chem. Soc. 141 (2019) 13941-13947. (d) W.-Q. Liu T. Lei S. Zhou X.-L. Yang J. Li B. Chen J. Sivaguru C.-H. Tung L.-Z. Wu J. Am. Chem. Soc. 141 2019 13941 13947 (a) Q. Gui, L. Hu, X. Chen, J. Liu, Z. Tan, Chem. Commun. 17 (2011) 5516-5521; (b) J. Gu, C. Cai, Org. Biomol. Chem. 15 (2017) 4226-4230; (c) J. Shen, R.-X. Yu, Y. Luo, L.-X. Zhu, Y. Zhang, X. Wang, B. Xiao, J.-B. Cheng, B. Yan, G.-Z. Li, Eur. J. Org. Chem. 10 (2019) 2065-2070; (d) W.-Q. Liu, T. Lei, S. Zhou, X.-L. Yang, J. Li, B. Chen, J. Sivaguru, C.-H. Tung, L.-Z. Wu, J. Am. Chem. Soc. 141 (2019) 13941-13947. [7] (a) T. Chen C.Q. Zhao L.-B. Han J. Am. Chem. Soc. 140 2018 3139 3155 (a) T. Chen, C.Q. Zhao, L.-B. Han, J. Am. Chem. Soc. 140 (2018) 3139-3155; (b) P. Zhang, J. Ying, G. Tang, Y. Zhao, Org. Chem. Front. 4 (2017) 2054-2057. (b) P. Zhang J. Ying G. Tang Y. Zhao Org. Chem. Front. 4 2017 2054 2057 (a) T. Chen, C.Q. Zhao, L.-B. Han, J. Am. Chem. Soc. 140 (2018) 3139-3155; (b) P. Zhang, J. Ying, G. Tang, Y. Zhao, Org. Chem. Front. 4 (2017) 2054-2057. [8] (a) I.G. Trostyanskaya I.P. Beletskaya Tetrahedron 70 2014 2556 2562 (a) I.G. Trostyanskaya, I.P. Beletskaya, Tetrahedron 70 (2014) 2556-2562; (b) M. Niu, H. Fu, Y. Jiang, Y. Zhao, Chem. Commun. (2007) 272-274; (c) L. Liu, Y. Wu, Z. Wang, J. Zhu, Y. Zhao, J. Org. Chem. 79 (2014) 6816-6822; (b) M. Niu H. Fu Y. Jiang Y. Zhao Chem. Commun. 2007 272 274 (a) I.G. Trostyanskaya, I.P. Beletskaya, Tetrahedron 70 (2014) 2556-2562; (b) M. Niu, H. Fu, Y. Jiang, Y. Zhao, Chem. Commun. (2007) 272-274; (c) L. Liu, Y. Wu, Z. Wang, J. Zhu, Y. Zhao, J. Org. Chem. 79 (2014) 6816-6822; (c) L. Liu Y. Wu Z. Wang J. Zhu Y. Zhao J. Org. Chem. 79 2014 6816 6822 (a) I.G. Trostyanskaya, I.P. Beletskaya, Tetrahedron 70 (2014) 2556-2562; (b) M. Niu, H. Fu, Y. Jiang, Y. Zhao, Chem. Commun. (2007) 272-274; (c) L. Liu, Y. Wu, Z. Wang, J. Zhu, Y. Zhao, J. Org. Chem. 79 (2014) 6816-6822; [9] (a) T. Chen Y. Zhou C. Guo L.-B. Han Chem. Lett. 42 2013 1065 1067 (a) T. Chen, Y. Zhou, C. Guo, L.-B. Han, Chem. Lett. 42 (2013) 1065­1067; (b) L.-B. Han, C.-Q. Zhao, M. Tanaka, J. Org. Chem. 66 (2001) 5929-5932; (c) S.V. Rooy, C. Cao, B.O. Patrick, A. Lam, J.A. Love, Inorg. Chim. Acta. 359 (2006) 2918-2923; (d) Y. Huang, W. Hao, G. Ding, M.-Z. Cai, J. Organomet. Chem. 715 (2012) 141-146. (b) L.-B. Han C.-Q. Zhao M. Tanaka J. Org. Chem. 66 2001 5929 5932 (a) T. Chen, Y. Zhou, C. Guo, L.-B. Han, Chem. Lett. 42 (2013) 1065­1067; (b) L.-B. Han, C.-Q. Zhao, M. Tanaka, J. Org. Chem. 66 (2001) 5929-5932; (c) S.V. Rooy, C. Cao, B.O. Patrick, A. Lam, J.A. Love, Inorg. Chim. Acta. 359 (2006) 2918-2923; (d) Y. Huang, W. Hao, G. Ding, M.-Z. Cai, J. Organomet. Chem. 715 (2012) 141-146. (c) S.V. Rooy C. Cao B.O. Patrick A. Lam J.A. Love Inorg. Chim. Acta 359 2006 2918 2923 (a) T. Chen, Y. Zhou, C. Guo, L.-B. Han, Chem. Lett. 42 (2013) 1065­1067; (b) L.-B. Han, C.-Q. Zhao, M. Tanaka, J. Org. Chem. 66 (2001) 5929-5932; (c) S.V. Rooy, C. Cao, B.O. Patrick, A. Lam, J.A. Love, Inorg. Chim. Acta. 359 (2006) 2918-2923; (d) Y. Huang, W. Hao, G. Ding, M.-Z. Cai, J. Organomet. Chem. 715 (2012) 141-146. (d) Y. Huang W. Hao G. Ding M.-Z. Cai J. Organomet. Chem. 715 2012 141 146 (a) T. Chen, Y. Zhou, C. Guo, L.-B. Han, Chem. Lett. 42 (2013) 1065­1067; (b) L.-B. Han, C.-Q. Zhao, M. Tanaka, J. Org. Chem. 66 (2001) 5929-5932; (c) S.V. Rooy, C. Cao, B.O. Patrick, A. Lam, J.A. Love, Inorg. Chim. Acta. 359 (2006) 2918-2923; (d) Y. Huang, W. Hao, G. Ding, M.-Z. Cai, J. Organomet. Chem. 715 (2012) 141-146. [10] (a) L.-B. Han C. Zhang H. Yazawa S. Shimada J. Am. Chem. Soc. 126 2004 5080 5081 (a) L.-B. Han, C. Zhang, H. Yazawa, S. Shimada, J. Am. Chem. Soc. 126 (2004) 5080-5081. (b) H. Hou, B. Zhou, J. Wang, D. Zhao, D. Sun, X. Chen, Y. Han, C. Yan, Y. Shi, S. Zhu, Org. Lett. 23 (2021) 2981-2987. (b) H. Hou B. Zhou J. Wang D. Zhao D. Sun X. Chen Y. Han C. Yan Y. Shi S. Zhu Org. Lett. 23 2021 2981 2987 (a) L.-B. Han, C. Zhang, H. Yazawa, S. Shimada, J. Am. Chem. Soc. 126 (2004) 5080-5081. (b) H. Hou, B. Zhou, J. Wang, D. Zhao, D. Sun, X. Chen, Y. Han, C. Yan, Y. Shi, S. Zhu, Org. Lett. 23 (2021) 2981-2987. [11] W.Q. Liu T. Lei S. Zhou X.-L. Yang J. Li B. Chen J. Sivaguru C.-H. Tung L.-Z. Wu J. Am. Chem. Soc. 141 2019 13941 13947 W.Q. Liu, T. Lei, S. Zhou, X.-L. Yang, J. Li, B. Chen, J. Sivaguru, C.-H. Tung, L.-Z. Wu, J. Am. Chem. Soc. 141 (2019) 13941-13947. [12] M.M.I. Basiouny D.A. Dollard J.A.R. Schmidt ACS Catal. 9 2019 7143 7153 M.M.I. Basiouny, D.A. Dollard, J.A.R. Schmidt, ACS Catal. 9 (2019) 7143-7153. [13] (a) T. Huang Y. Saga H. Guo A. Yoshimura A. Ogawa L.-B. Han J. Org. Chem. 83 2018 8743 8749 (a) T. Huang, Y. Saga, H. Guo, A. Yoshimura, A. Ogawa, L.-B. Han, J. Org. Chem. 83 (2018) 8743-8749; (b) H. Wang, Y. Li, Z. Tang, S. Wang, H. Zhang, H. Cong, A. Lei, ACS Catal. 8 (2018), 10599-10605. (b) H. Wang Y. Li Z. Tang S. Wang H. Zhang H. Cong A. Lei ACS Catal. 8 2018 10599 10605 (a) T. Huang, Y. Saga, H. Guo, A. Yoshimura, A. Ogawa, L.-B. Han, J. Org. Chem. 83 (2018) 8743-8749; (b) H. Wang, Y. Li, Z. Tang, S. Wang, H. Zhang, H. Cong, A. Lei, ACS Catal. 8 (2018), 10599-10605. 14] M. Niu H. Fu Y. Jiang Y. Zhao Chem. Commun. 2007 272 274 M. Niu, H. Fu, Y. Jiang, Y. Zhao, Chem. Commun. (2007) 272-274. [15] T. Wang S. Chen A. Shao M. Gao Y. Huang A. Lei Org. Lett. 17 2014 118 121 T. Wang, S. Chen, A. Shao, M. Gao, Y. Huang, A. Lei, Org. Lett. 17 (2014) 118-121. [16] (a) C. Shen J. Xu W. Yu P. Zhang Green. Chem. 16 2014 3007 3012 (a) C. Shen, J. Xu, W. Yu, P. Zhang, Green Chem. 16 (2014) 3007-3012; (b) Anuradha, S. Layek, B. Agrahari, D.D. Pathak, ChemistrySelect 2 (2017) 6865-6876; (c) W. Sun, C.-G. Xia and H.-W. Wang, New J. Chem. 26 (2002) 755-758. (b) S. Anuradha B. Layek D.D. Pathak Agrahari ChemistrySelect 2 2017 6865 6876 (a) C. Shen, J. Xu, W. Yu, P. Zhang, Green Chem. 16 (2014) 3007-3012; (b) Anuradha, S. Layek, B. Agrahari, D.D. Pathak, ChemistrySelect 2 (2017) 6865-6876; (c) W. Sun, C.-G. Xia and H.-W. Wang, New J. Chem. 26 (2002) 755-758. (c) W. Sun C.-G. Xia H.-W. Wang N. J. Chem. 26 2002 755 758 (a) C. Shen, J. Xu, W. Yu, P. Zhang, Green Chem. 16 (2014) 3007-3012; (b) Anuradha, S. Layek, B. Agrahari, D.D. Pathak, ChemistrySelect 2 (2017) 6865-6876; (c) W. Sun, C.-G. Xia and H.-W. Wang, New J. Chem. 26 (2002) 755-758. [17] R.B. Matviiv M.Ya Rudysh V.Yo Stadnyk A.O. Fedorchuk P.A. Shchepanskyi R.S. Brezvin O.Y. Khyzhun Curr. Appl. Phys. 21 2021 80 88 R.B. Matviiv, M.Ya Rudysh, V.Yo Stadnyk, A.O. Fedorchuk, P.A. Shchepanskyi, R.S. Brezvin, O.Y. Khyzhun, Curr. Appl. Phys. 21 (2021) 80-88.",
      "scopus-id": "85201447600",
      "coredata": {
        "eid": "1-s2.0-S0926860X24003454",
        "dc:description": "The functionalized heterogeneous Cu-chitosan based catalyst was developed for the regioselective hydrophosphorylation of alkynes with secondary H-phosphine oxides. The functionalized chitosan framework was produced through a cross-coupling reaction between chitosan and 2,4,6-trichloro-1,3,5-triazine. Following this, the coordination of Cu(OAc)2 with the functionalized chitosan framework led to the synthesis of the heterogeneous Cu-chitosan based catalyst. Various techniques, such as powder FT-IR spectroscopy, X-ray diffraction (XRD), N2 physical adsorption, X-ray photoelectron spectroscopy (XPS), and scanning electron microscopy (SEM), were employed to characterize the catalyst. Subsequently, the resulting Cu(OAc)2@chitosan@2,4,6-trichloro-1,3,5-triazine catalyst exhibited remarkable catalytic activity in the regioselective hydrophosphorylation of alkynes with the formation of P–C bonds, displaying exceptional E/Z selectivity. This successful catalysis led to the synthesis of a range of (E) anti-Markovnikov adducts with high yields. The catalyst shows high recyclability in this transformation. On the basis of step-by-step control experiments, a plausible mechanism is proposed.",
        "openArchiveArticle": "false",
        "prism:coverDate": "2024-08-25",
        "openaccessUserLicense": null,
        "prism:aggregationType": "Journal",
        "prism:url": "https://api.elsevier.com/content/article/pii/S0926860X24003454",
        "dc:creator": [
          {
            "@_fa": "true",
            "$": "Ren, Yining"
          },
          {
            "@_fa": "true",
            "$": "Chen, Liyong"
          },
          {
            "@_fa": "true",
            "$": "Xie, Mingyu"
          },
          {
            "@_fa": "true",
            "$": "Xu, Shipan"
          },
          {
            "@_fa": "true",
            "$": "Liu, Yu"
          },
          {
            "@_fa": "true",
            "$": "Zhu, Longzhi"
          },
          {
            "@_fa": "true",
            "$": "Xu, Weifeng"
          },
          {
            "@_fa": "true",
            "$": "Xiong, Biquan"
          }
        ],
        "link": [
          {
            "@_fa": "true",
            "@rel": "self",
            "@href": "https://api.elsevier.com/content/article/pii/S0926860X24003454"
          },
          {
            "@_fa": "true",
            "@rel": "scidir",
            "@href": "https://www.sciencedirect.com/science/article/pii/S0926860X24003454"
          }
        ],
        "dc:format": "application/json",
        "openaccessType": null,
        "pii": "S0926-860X(24)00345-4",
        "prism:volume": "684",
        "articleNumber": "119900",
        "prism:publisher": "Elsevier B.V. All rights are reserved, including those for text and data mining, AI training, and similar technologies.",
        "dc:title": "Regioselective hydrophosphorylation of alkynes by a functionalized heterogeneous Cu-chitosan based catalyst",
        "prism:copyright": "© 2024 Elsevier B.V. All rights are reserved, including those for text and data mining, AI training, and similar technologies.",
        "openaccess": "0",
        "prism:issn": "0926860X",
        "dcterms:subject": [
          {
            "@_fa": "true",
            "$": "P–H bonds"
          },
          {
            "@_fa": "true",
            "$": "Construction of P–C bonds"
          },
          {
            "@_fa": "true",
            "$": "Hydrophosphorylation"
          },
          {
            "@_fa": "true",
            "$": "Heterogeneous catalysis"
          },
          {
            "@_fa": "true",
            "$": "Anti-Markovnikov addition"
          }
        ],
        "openaccessArticle": "false",
        "prism:publicationName": "Applied Catalysis A: General",
        "openaccessSponsorType": null,
        "prism:pageRange": "119900",
        "pubType": "fla",
        "prism:coverDisplayDate": "25 August 2024",
        "prism:doi": "10.1016/j.apcata.2024.119900",
        "prism:startingPage": "119900",
        "dc:identifier": "doi:10.1016/j.apcata.2024.119900",
        "openaccessSponsorName": null
      },
      "objects": {
        "object": [
          {
            "@category": "standard",
            "@height": "435",
            "@width": "376",
            "@_fa": "true",
            "$": "https://api.elsevier.com/content/object/eid/1-s2.0-S0926860X24003454-sc5.jpg?httpAccept=%2A%2F%2A",
            "@multimediatype": "JPEG image file",
            "@type": "IMAGE-DOWNSAMPLED",
            "@size": "45028",
            "@ref": "sc5",
            "@mimetype": "image/jpeg"
          },
          {
            "@category": "standard",
            "@height": "58",
            "@width": "376",
            "@_fa": "true",
            "$": "https://api.elsevier.com/content/object/eid/1-s2.0-S0926860X24003454-sc4.jpg?httpAccept=%2A%2F%2A",
            "@multimediatype": "JPEG image file",
            "@type": "IMAGE-DOWNSAMPLED",
            "@size": "7164",
            "@ref": "sc4",
            "@mimetype": "image/jpeg"
          },
          {
            "@category": "standard",
            "@height": "128",
            "@width": "376",
            "@_fa": "true",
            "$": "https://api.elsevier.com/content/object/eid/1-s2.0-S0926860X24003454-sc3.jpg?httpAccept=%2A%2F%2A",
            "@multimediatype": "JPEG image file",
            "@type": "IMAGE-DOWNSAMPLED",
            "@size": "13349",
            "@ref": "sc3",
            "@mimetype": "image/jpeg"
          },
          {
            "@category": "standard",
            "@height": "51",
            "@width": "336",
            "@_fa": "true",
            "$": "https://api.elsevier.com/content/object/eid/1-s2.0-S0926860X24003454-fx4.jpg?httpAccept=%2A%2F%2A",
            "@multimediatype": "JPEG image file",
            "@type": "IMAGE-DOWNSAMPLED",
            "@size": "4963",
            "@ref": "fx4",
            "@mimetype": "image/jpeg"
          },
          {
            "@category": "standard",
            "@height": "146",
            "@width": "791",
            "@_fa": "true",
            "$": "https://api.elsevier.com/content/object/eid/1-s2.0-S0926860X24003454-sc2.jpg?httpAccept=%2A%2F%2A",
            "@multimediatype": "JPEG image file",
            "@type": "IMAGE-DOWNSAMPLED",
            "@size": "28841",
            "@ref": "sc2",
            "@mimetype": "image/jpeg"
          },
          {
            "@category": "standard",
            "@height": "288",
            "@width": "376",
            "@_fa": "true",
            "$": "https://api.elsevier.com/content/object/eid/1-s2.0-S0926860X24003454-gr4.jpg?httpAccept=%2A%2F%2A",
            "@multimediatype": "JPEG image file",
            "@type": "IMAGE-DOWNSAMPLED",
            "@size": "14568",
            "@ref": "gr4",
            "@mimetype": "image/jpeg"
          },
          {
            "@category": "standard",
            "@height": "289",
            "@width": "376",
            "@_fa": "true",
            "$": "https://api.elsevier.com/content/object/eid/1-s2.0-S0926860X24003454-gr3.jpg?httpAccept=%2A%2F%2A",
            "@multimediatype": "JPEG image file",
            "@type": "IMAGE-DOWNSAMPLED",
            "@size": "17383",
            "@ref": "gr3",
            "@mimetype": "image/jpeg"
          },
          {
            "@category": "standard",
            "@height": "297",
            "@width": "376",
            "@_fa": "true",
            "$": "https://api.elsevier.com/content/object/eid/1-s2.0-S0926860X24003454-gr2.jpg?httpAccept=%2A%2F%2A",
            "@multimediatype": "JPEG image file",
            "@type": "IMAGE-DOWNSAMPLED",
            "@size": "23019",
            "@ref": "gr2",
            "@mimetype": "image/jpeg"
          },
          {
            "@category": "standard",
            "@height": "345",
            "@width": "376",
            "@_fa": "true",
            "$": "https://api.elsevier.com/content/object/eid/1-s2.0-S0926860X24003454-gr1.jpg?httpAccept=%2A%2F%2A",
            "@multimediatype": "JPEG image file",
            "@type": "IMAGE-DOWNSAMPLED",
            "@size": "29280",
            "@ref": "gr1",
            "@mimetype": "image/jpeg"
          },
          {
            "@category": "standard",
            "@height": "161",
            "@width": "376",
            "@_fa": "true",
            "$": "https://api.elsevier.com/content/object/eid/1-s2.0-S0926860X24003454-sc6.jpg?httpAccept=%2A%2F%2A",
            "@multimediatype": "JPEG image file",
            "@type": "IMAGE-DOWNSAMPLED",
            "@size": "12011",
            "@ref": "sc6",
            "@mimetype": "image/jpeg"
          },
          {
            "@category": "standard",
            "@height": "300",
            "@width": "376",
            "@_fa": "true",
            "$": "https://api.elsevier.com/content/object/eid/1-s2.0-S0926860X24003454-gr7.jpg?httpAccept=%2A%2F%2A",
            "@multimediatype": "JPEG image file",
            "@type": "IMAGE-DOWNSAMPLED",
            "@size": "22424",
            "@ref": "gr7",
            "@mimetype": "image/jpeg"
          },
          {
            "@category": "standard",
            "@height": "296",
            "@width": "376",
            "@_fa": "true",
            "$": "https://api.elsevier.com/content/object/eid/1-s2.0-S0926860X24003454-gr6.jpg?httpAccept=%2A%2F%2A",
            "@multimediatype": "JPEG image file",
            "@type": "IMAGE-DOWNSAMPLED",
            "@size": "15809",
            "@ref": "gr6",
            "@mimetype": "image/jpeg"
          },
          {
            "@category": "standard",
            "@height": "454",
            "@width": "659",
            "@_fa": "true",
            "$": "https://api.elsevier.com/content/object/eid/1-s2.0-S0926860X24003454-gr5.jpg?httpAccept=%2A%2F%2A",
            "@multimediatype": "JPEG image file",
            "@type": "IMAGE-DOWNSAMPLED",
            "@size": "97581",
            "@ref": "gr5",
            "@mimetype": "image/jpeg"
          },
          {
            "@category": "standard",
            "@height": "133",
            "@width": "500",
            "@_fa": "true",
            "$": "https://api.elsevier.com/content/object/eid/1-s2.0-S0926860X24003454-ga1.jpg?httpAccept=%2A%2F%2A",
            "@multimediatype": "JPEG image file",
            "@type": "IMAGE-DOWNSAMPLED",
            "@size": "22498",
            "@ref": "ga1",
            "@mimetype": "image/jpeg"
          },
          {
            "@category": "standard",
            "@height": "378",
            "@width": "365",
            "@_fa": "true",
            "$": "https://api.elsevier.com/content/object/eid/1-s2.0-S0926860X24003454-fx3.jpg?httpAccept=%2A%2F%2A",
            "@multimediatype": "JPEG image file",
            "@type": "IMAGE-DOWNSAMPLED",
            "@size": "37450",
            "@ref": "fx3",
            "@mimetype": "image/jpeg"
          },
          {
            "@category": "standard",
            "@height": "595",
            "@width": "508",
            "@_fa": "true",
            "$": "https://api.elsevier.com/content/object/eid/1-s2.0-S0926860X24003454-sc1.jpg?httpAccept=%2A%2F%2A",
            "@multimediatype": "JPEG image file",
            "@type": "IMAGE-DOWNSAMPLED",
            "@size": "74754",
            "@ref": "sc1",
            "@mimetype": "image/jpeg"
          },
          {
            "@category": "standard",
            "@height": "293",
            "@width": "360",
            "@_fa": "true",
            "$": "https://api.elsevier.com/content/object/eid/1-s2.0-S0926860X24003454-fx2.jpg?httpAccept=%2A%2F%2A",
            "@multimediatype": "JPEG image file",
            "@type": "IMAGE-DOWNSAMPLED",
            "@size": "24797",
            "@ref": "fx2",
            "@mimetype": "image/jpeg"
          },
          {
            "@category": "standard",
            "@height": "51",
            "@width": "332",
            "@_fa": "true",
            "$": "https://api.elsevier.com/content/object/eid/1-s2.0-S0926860X24003454-fx1.jpg?httpAccept=%2A%2F%2A",
            "@multimediatype": "JPEG image file",
            "@type": "IMAGE-DOWNSAMPLED",
            "@size": "4999",
            "@ref": "fx1",
            "@mimetype": "image/jpeg"
          },
          {
            "@category": "thumbnail",
            "@height": "163",
            "@width": "141",
            "@_fa": "true",
            "$": "https://api.elsevier.com/content/object/eid/1-s2.0-S0926860X24003454-sc5.sml?httpAccept=%2A%2F%2A",
            "@multimediatype": "GIF image file",
            "@type": "IMAGE-THUMBNAIL",
            "@size": "4850",
            "@ref": "sc5",
            "@mimetype": "image/gif"
          },
          {
            "@category": "thumbnail",
            "@height": "34",
            "@width": "219",
            "@_fa": "true",
            "$": "https://api.elsevier.com/content/object/eid/1-s2.0-S0926860X24003454-sc4.sml?httpAccept=%2A%2F%2A",
            "@multimediatype": "GIF image file",
            "@type": "IMAGE-THUMBNAIL",
            "@size": "2781",
            "@ref": "sc4",
            "@mimetype": "image/gif"
          },
          {
            "@category": "thumbnail",
            "@height": "75",
            "@width": "219",
            "@_fa": "true",
            "$": "https://api.elsevier.com/content/object/eid/1-s2.0-S0926860X24003454-sc3.sml?httpAccept=%2A%2F%2A",
            "@multimediatype": "GIF image file",
            "@type": "IMAGE-THUMBNAIL",
            "@size": "4453",
            "@ref": "sc3",
            "@mimetype": "image/gif"
          },
          {
            "@category": "thumbnail",
            "@height": "33",
            "@width": "219",
            "@_fa": "true",
            "$": "https://api.elsevier.com/content/object/eid/1-s2.0-S0926860X24003454-fx4.sml?httpAccept=%2A%2F%2A",
            "@multimediatype": "GIF image file",
            "@type": "IMAGE-THUMBNAIL",
            "@size": "2405",
            "@ref": "fx4",
            "@mimetype": "image/gif"
          },
          {
            "@category": "thumbnail",
            "@height": "40",
            "@width": "219",
            "@_fa": "true",
            "$": "https://api.elsevier.com/content/object/eid/1-s2.0-S0926860X24003454-sc2.sml?httpAccept=%2A%2F%2A",
            "@multimediatype": "GIF image file",
            "@type": "IMAGE-THUMBNAIL",
            "@size": "3287",
            "@ref": "sc2",
            "@mimetype": "image/gif"
          },
          {
            "@category": "thumbnail",
            "@height": "164",
            "@width": "214",
            "@_fa": "true",
            "$": "https://api.elsevier.com/content/object/eid/1-s2.0-S0926860X24003454-gr4.sml?httpAccept=%2A%2F%2A",
            "@multimediatype": "GIF image file",
            "@type": "IMAGE-THUMBNAIL",
            "@size": "5344",
            "@ref": "gr4",
            "@mimetype": "image/gif"
          },
          {
            "@category": "thumbnail",
            "@height": "164",
            "@width": "214",
            "@_fa": "true",
            "$": "https://api.elsevier.com/content/object/eid/1-s2.0-S0926860X24003454-gr3.sml?httpAccept=%2A%2F%2A",
            "@multimediatype": "GIF image file",
            "@type": "IMAGE-THUMBNAIL",
            "@size": "6015",
            "@ref": "gr3",
            "@mimetype": "image/gif"
          },
          {
            "@category": "thumbnail",
            "@height": "164",
            "@width": "207",
            "@_fa": "true",
            "$": "https://api.elsevier.com/content/object/eid/1-s2.0-S0926860X24003454-gr2.sml?httpAccept=%2A%2F%2A",
            "@multimediatype": "GIF image file",
            "@type": "IMAGE-THUMBNAIL",
            "@size": "7752",
            "@ref": "gr2",
            "@mimetype": "image/gif"
          },
          {
            "@category": "thumbnail",
            "@height": "164",
            "@width": "179",
            "@_fa": "true",
            "$": "https://api.elsevier.com/content/object/eid/1-s2.0-S0926860X24003454-gr1.sml?httpAccept=%2A%2F%2A",
            "@multimediatype": "GIF image file",
            "@type": "IMAGE-THUMBNAIL",
            "@size": "7913",
            "@ref": "gr1",
            "@mimetype": "image/gif"
          },
          {
            "@category": "thumbnail",
            "@height": "94",
            "@width": "219",
            "@_fa": "true",
            "$": "https://api.elsevier.com/content/object/eid/1-s2.0-S0926860X24003454-sc6.sml?httpAccept=%2A%2F%2A",
            "@multimediatype": "GIF image file",
            "@type": "IMAGE-THUMBNAIL",
            "@size": "3896",
            "@ref": "sc6",
            "@mimetype": "image/gif"
          },
          {
            "@category": "thumbnail",
            "@height": "164",
            "@width": "205",
            "@_fa": "true",
            "$": "https://api.elsevier.com/content/object/eid/1-s2.0-S0926860X24003454-gr7.sml?httpAccept=%2A%2F%2A",
            "@multimediatype": "GIF image file",
            "@type": "IMAGE-THUMBNAIL",
            "@size": "7996",
            "@ref": "gr7",
            "@mimetype": "image/gif"
          },
          {
            "@category": "thumbnail",
            "@height": "164",
            "@width": "208",
            "@_fa": "true",
            "$": "https://api.elsevier.com/content/object/eid/1-s2.0-S0926860X24003454-gr6.sml?httpAccept=%2A%2F%2A",
            "@multimediatype": "GIF image file",
            "@type": "IMAGE-THUMBNAIL",
            "@size": "5667",
            "@ref": "gr6",
            "@mimetype": "image/gif"
          },
          {
            "@category": "thumbnail",
            "@height": "151",
            "@width": "219",
            "@_fa": "true",
            "$": "https://api.elsevier.com/content/object/eid/1-s2.0-S0926860X24003454-gr5.sml?httpAccept=%2A%2F%2A",
            "@multimediatype": "GIF image file",
            "@type": "IMAGE-THUMBNAIL",
            "@size": "23548",
            "@ref": "gr5",
            "@mimetype": "image/gif"
          },
          {
            "@category": "thumbnail",
            "@height": "58",
            "@width": "219",
            "@_fa": "true",
            "$": "https://api.elsevier.com/content/object/eid/1-s2.0-S0926860X24003454-ga1.sml?httpAccept=%2A%2F%2A",
            "@multimediatype": "GIF image file",
            "@type": "IMAGE-THUMBNAIL",
            "@size": "4658",
            "@ref": "ga1",
            "@mimetype": "image/gif"
          },
          {
            "@category": "thumbnail",
            "@height": "163",
            "@width": "158",
            "@_fa": "true",
            "$": "https://api.elsevier.com/content/object/eid/1-s2.0-S0926860X24003454-fx3.sml?httpAccept=%2A%2F%2A",
            "@multimediatype": "GIF image file",
            "@type": "IMAGE-THUMBNAIL",
            "@size": "6958",
            "@ref": "fx3",
            "@mimetype": "image/gif"
          },
          {
            "@category": "thumbnail",
            "@height": "164",
            "@width": "140",
            "@_fa": "true",
            "$": "https://api.elsevier.com/content/object/eid/1-s2.0-S0926860X24003454-sc1.sml?httpAccept=%2A%2F%2A",
            "@multimediatype": "GIF image file",
            "@type": "IMAGE-THUMBNAIL",
            "@size": "6747",
            "@ref": "sc1",
            "@mimetype": "image/gif"
          },
          {
            "@category": "thumbnail",
            "@height": "164",
            "@width": "201",
            "@_fa": "true",
            "$": "https://api.elsevier.com/content/object/eid/1-s2.0-S0926860X24003454-fx2.sml?httpAccept=%2A%2F%2A",
            "@multimediatype": "GIF image file",
            "@type": "IMAGE-THUMBNAIL",
            "@size": "7564",
            "@ref": "fx2",
            "@mimetype": "image/gif"
          },
          {
            "@category": "thumbnail",
            "@height": "34",
            "@width": "219",
            "@_fa": "true",
            "$": "https://api.elsevier.com/content/object/eid/1-s2.0-S0926860X24003454-fx1.sml?httpAccept=%2A%2F%2A",
            "@multimediatype": "GIF image file",
            "@type": "IMAGE-THUMBNAIL",
            "@size": "2360",
            "@ref": "fx1",
            "@mimetype": "image/gif"
          },
          {
            "@category": "high",
            "@height": "1925",
            "@width": "1663",
            "@_fa": "true",
            "$": "https://api.elsevier.com/content/object/eid/1-s2.0-S0926860X24003454-sc5_lrg.jpg?httpAccept=%2A%2F%2A",
            "@multimediatype": "JPEG image file",
            "@type": "IMAGE-HIGH-RES",
            "@size": "274014",
            "@ref": "sc5",
            "@mimetype": "image/jpeg"
          },
          {
            "@category": "high",
            "@height": "258",
            "@width": "1663",
            "@_fa": "true",
            "$": "https://api.elsevier.com/content/object/eid/1-s2.0-S0926860X24003454-sc4_lrg.jpg?httpAccept=%2A%2F%2A",
            "@multimediatype": "JPEG image file",
            "@type": "IMAGE-HIGH-RES",
            "@size": "43268",
            "@ref": "sc4",
            "@mimetype": "image/jpeg"
          },
          {
            "@category": "high",
            "@height": "568",
            "@width": "1663",
            "@_fa": "true",
            "$": "https://api.elsevier.com/content/object/eid/1-s2.0-S0926860X24003454-sc3_lrg.jpg?httpAccept=%2A%2F%2A",
            "@multimediatype": "JPEG image file",
            "@type": "IMAGE-HIGH-RES",
            "@size": "90083",
            "@ref": "sc3",
            "@mimetype": "image/jpeg"
          },
          {
            "@category": "high",
            "@height": "224",
            "@width": "1490",
            "@_fa": "true",
            "$": "https://api.elsevier.com/content/object/eid/1-s2.0-S0926860X24003454-fx4_lrg.jpg?httpAccept=%2A%2F%2A",
            "@multimediatype": "JPEG image file",
            "@type": "IMAGE-HIGH-RES",
            "@size": "20844",
            "@ref": "fx4",
            "@mimetype": "image/jpeg"
          },
          {
            "@category": "high",
            "@height": "645",
            "@width": "3493",
            "@_fa": "true",
            "$": "https://api.elsevier.com/content/object/eid/1-s2.0-S0926860X24003454-sc2_lrg.jpg?httpAccept=%2A%2F%2A",
            "@multimediatype": "JPEG image file",
            "@type": "IMAGE-HIGH-RES",
            "@size": "125383",
            "@ref": "sc2",
            "@mimetype": "image/jpeg"
          },
          {
            "@category": "high",
            "@height": "1274",
            "@width": "1663",
            "@_fa": "true",
            "$": "https://api.elsevier.com/content/object/eid/1-s2.0-S0926860X24003454-gr4_lrg.jpg?httpAccept=%2A%2F%2A",
            "@multimediatype": "JPEG image file",
            "@type": "IMAGE-HIGH-RES",
            "@size": "70666",
            "@ref": "gr4",
            "@mimetype": "image/jpeg"
          },
          {
            "@category": "high",
            "@height": "1276",
            "@width": "1663",
            "@_fa": "true",
            "$": "https://api.elsevier.com/content/object/eid/1-s2.0-S0926860X24003454-gr3_lrg.jpg?httpAccept=%2A%2F%2A",
            "@multimediatype": "JPEG image file",
            "@type": "IMAGE-HIGH-RES",
            "@size": "82976",
            "@ref": "gr3",
            "@mimetype": "image/jpeg"
          },
          {
            "@category": "high",
            "@height": "1314",
            "@width": "1663",
            "@_fa": "true",
            "$": "https://api.elsevier.com/content/object/eid/1-s2.0-S0926860X24003454-gr2_lrg.jpg?httpAccept=%2A%2F%2A",
            "@multimediatype": "JPEG image file",
            "@type": "IMAGE-HIGH-RES",
            "@size": "129820",
            "@ref": "gr2",
            "@mimetype": "image/jpeg"
          },
          {
            "@category": "high",
            "@height": "1525",
            "@width": "1663",
            "@_fa": "true",
            "$": "https://api.elsevier.com/content/object/eid/1-s2.0-S0926860X24003454-gr1_lrg.jpg?httpAccept=%2A%2F%2A",
            "@multimediatype": "JPEG image file",
            "@type": "IMAGE-HIGH-RES",
            "@size": "148275",
            "@ref": "gr1",
            "@mimetype": "image/jpeg"
          },
          {
            "@category": "high",
            "@height": "712",
            "@width": "1663",
            "@_fa": "true",
            "$": "https://api.elsevier.com/content/object/eid/1-s2.0-S0926860X24003454-sc6_lrg.jpg?httpAccept=%2A%2F%2A",
            "@multimediatype": "JPEG image file",
            "@type": "IMAGE-HIGH-RES",
            "@size": "72867",
            "@ref": "sc6",
            "@mimetype": "image/jpeg"
          },
          {
            "@category": "high",
            "@height": "1327",
            "@width": "1663",
            "@_fa": "true",
            "$": "https://api.elsevier.com/content/object/eid/1-s2.0-S0926860X24003454-gr7_lrg.jpg?httpAccept=%2A%2F%2A",
            "@multimediatype": "JPEG image file",
            "@type": "IMAGE-HIGH-RES",
            "@size": "118118",
            "@ref": "gr7",
            "@mimetype": "image/jpeg"
          },
          {
            "@category": "high",
            "@height": "1310",
            "@width": "1663",
            "@_fa": "true",
            "$": "https://api.elsevier.com/content/object/eid/1-s2.0-S0926860X24003454-gr6_lrg.jpg?httpAccept=%2A%2F%2A",
            "@multimediatype": "JPEG image file",
            "@type": "IMAGE-HIGH-RES",
            "@size": "73801",
            "@ref": "gr6",
            "@mimetype": "image/jpeg"
          },
          {
            "@category": "high",
            "@height": "2006",
            "@width": "2911",
            "@_fa": "true",
            "$": "https://api.elsevier.com/content/object/eid/1-s2.0-S0926860X24003454-gr5_lrg.jpg?httpAccept=%2A%2F%2A",
            "@multimediatype": "JPEG image file",
            "@type": "IMAGE-HIGH-RES",
            "@size": "470677",
            "@ref": "gr5",
            "@mimetype": "image/jpeg"
          },
          {
            "@category": "high",
            "@height": "587",
            "@width": "2213",
            "@_fa": "true",
            "$": "https://api.elsevier.com/content/object/eid/1-s2.0-S0926860X24003454-ga1_lrg.jpg?httpAccept=%2A%2F%2A",
            "@multimediatype": "JPEG image file",
            "@type": "IMAGE-HIGH-RES",
            "@size": "174195",
            "@ref": "ga1",
            "@mimetype": "image/jpeg"
          },
          {
            "@category": "high",
            "@height": "1677",
            "@width": "1621",
            "@_fa": "true",
            "$": "https://api.elsevier.com/content/object/eid/1-s2.0-S0926860X24003454-fx3_lrg.jpg?httpAccept=%2A%2F%2A",
            "@multimediatype": "JPEG image file",
            "@type": "IMAGE-HIGH-RES",
            "@size": "283636",
            "@ref": "fx3",
            "@mimetype": "image/jpeg"
          },
          {
            "@category": "high",
            "@height": "2630",
            "@width": "2245",
            "@_fa": "true",
            "$": "https://api.elsevier.com/content/object/eid/1-s2.0-S0926860X24003454-sc1_lrg.jpg?httpAccept=%2A%2F%2A",
            "@multimediatype": "JPEG image file",
            "@type": "IMAGE-HIGH-RES",
            "@size": "495110",
            "@ref": "sc1",
            "@mimetype": "image/jpeg"
          },
          {
            "@category": "high",
            "@height": "1301",
            "@width": "1599",
            "@_fa": "true",
            "$": "https://api.elsevier.com/content/object/eid/1-s2.0-S0926860X24003454-fx2_lrg.jpg?httpAccept=%2A%2F%2A",
            "@multimediatype": "JPEG image file",
            "@type": "IMAGE-HIGH-RES",
            "@size": "136406",
            "@ref": "fx2",
            "@mimetype": "image/jpeg"
          },
          {
            "@category": "high",
            "@height": "227",
            "@width": "1474",
            "@_fa": "true",
            "$": "https://api.elsevier.com/content/object/eid/1-s2.0-S0926860X24003454-fx1_lrg.jpg?httpAccept=%2A%2F%2A",
            "@multimediatype": "JPEG image file",
            "@type": "IMAGE-HIGH-RES",
            "@size": "20859",
            "@ref": "fx1",
            "@mimetype": "image/jpeg"
          },
          {
            "@category": "standard",
            "@_fa": "true",
            "$": "https://api.elsevier.com/content/object/eid/1-s2.0-S0926860X24003454-mmc1.docx?httpAccept=%2A%2F%2A",
            "@multimediatype": "Microsoft Word file",
            "@type": "APPLICATION",
            "@size": "5083117",
            "@ref": "mmc1",
            "@mimetype": "application/word"
          },
          {
            "@category": "standard",
            "@_fa": "true",
            "$": "https://api.elsevier.com/content/object/eid/1-s2.0-S0926860X24003454-am.pdf?httpAccept=%2A%2F%2A",
            "@multimediatype": "Acrobat PDF file",
            "@type": "AAM-PDF",
            "@size": "2264974",
            "@ref": "am",
            "@mimetype": "application/pdf"
          }
        ]
      },
      "link": {
        "@rel": "abstract",
        "@href": "https://api.elsevier.com/content/abstract/scopus_id/85201447600"
      }
    }
  }
}