{
  "metadata": {
    "title": "Mononuclear iron-dependent electrocatalytic activity of metal-nitrogen-carbon catalysts for efficient oxygen reduction reaction",
    "authors": "; ; ",
    "journal": "Applied Catalysis A: General",
    "date": "2019-08-05",
    "doi": "10.1016/j.apcata.2019.117120",
    "abstract": "",
    "uri": "https://api.elsevier.com/content/article/pii/S0926860X19302741",
    "pii": "S0926860X19302741"
  },
  "fulltext": {
    "full-text-retrieval-response": {
      "scopus-eid": "2-s2.0-85067896373",
      "originalText": "serial JL 271346 291210 291744 291809 31 Applied Catalysis A: General APPLIEDCATALYSISAGENERAL 2019-06-25 2019-06-25 2019-06-28 2019-06-28 2019-07-23T08:52:24 1-s2.0-S0926860X19302741 S0926-860X(19)30274-1 S0926860X19302741 10.1016/j.apcata.2019.117120 S300 S300.1 FULL-TEXT 1-s2.0-S0926860X19X00125 2024-01-01T12:33:10.553292Z 0 0 20190805 2019 2019-06-25T02:49:35.970005Z absattachment articleinfo articlenumber articletitlenorm authfirstinitialnorm authfirstsurnamenorm cid cids contenttype copyright crossmark dateloaded dateloadedtxt datesearch datesort dateupdated dco docsubtype doctype doi eid ewtransactionid hubeid indexeddate issn issnnorm itemstage itemtransactionid itemweight openaccess openarchive pg pgfirst pii piinorm pubdatestart pubdatetxt pubyr sectiontitle sortorder srctitle srctitlenorm srctype ssids alllist content subj subheadings suppl tomb volfirst volissue volumelist webpdf webpdfpagecount yearnav figure table body mmlmath acknowledge affil articletitle auth authfirstini authfull authkeywords authlast grantnumber grantsponsor highlightsabst primabst ref specialabst 0926-860X 0926860X true 583 583 C Volume 583 5 117120 117120 117120 20190805 5 August 2019 2019-08-05 2019 Regular papers article fla © 2019 Elsevier B.V. All rights reserved. MONONUCLEARIRONDEPENDENTELECTROCATALYTICACTIVITYMETALNITROGENCARBONCATALYSTSFOREFFICIENTOXYGENREDUCTIONREACTION LIU M 1 Introduction 1.1 Experimental section 1.1.1 Materials preparation 1.1.2 Materials characterization 1.1.3 Electrochemical measurements 2 Results and discussion 2.1 Effect of pyrolysis temperatures on the mononuclear iron catalysts 2.2 ORR activity of the catalysts prepared at different pyrolysis temperature 2.3 Structure of mononuclear Iron in catalysts 3 Conclusions Acknowledgements References KRAMM 2014 978 985 U WANG 2014 7746 7786 Z LIU 2016 11357 11364 T LIU 2018 7052 7060 M DENG 2017 219 229 H YE 2017 281 289 Y YUAN 2018 252 260 K WANG 2016 110 119 X OSMIERI 2017 253 265 L JASINSKI 1964 1212 R SHEN 2017 1449 1470 M JIA 2016 821 827 H QIAN 2017 4017 4023 Z XIAO 2018 2824 2832 M KIM 2017 9567 9575 J MAMTANI 2016 7249 7259 K LIAO 2002 205 219 M RAMASWAMY 2013 15443 15449 N GUMECI 2015 21494 21500 C LI 2016 2418 2432 J XIA 2016 2650 2676 W TYLUS 2014 8999 9008 U PYLYPENKO 2008 7875 7883 S SEROV 2012 213 218 A HU 2018 2208 2215 B LIU 2019 21 29 M KABIRI 2014 523 533 S SA 2016 15046 15056 Y WANG 2014 3928 3936 M TANG 2017 550 556 H YANG 2017 4587 4596 J WEN 2012 1399 1404 Z WANG 2018 516 526 Q MA 2018 491 498 J YANG 2005 2465 2469 Q YANG 2014 3939 3946 Y LIAO 2013 3663 3670 Y QIAN 2016 9884 9896 Y LIU 2017 5908 5915 B ZHANG 2014 1242 1246 J RYBARCZYK 2015 44969 44977 M DENG 2015 2100 2104 J RAMASWAMY 2011 18015 18026 N LI 2015 27405 27413 F LIAO 2002 205 219 M DOMINGUEZ 2015 24487 24494 C JIA 2016 65 82 Q JIA 2015 12496 12505 Q COOK 2009 194701 P ZHOU 2014 15787 15791 J DOMASHEVSKAYA 2007 180 185 E LIUX2019X117120 LIUX2019X117120XM 2021-06-28T00:00:00.000Z 2021-06-28T00:00:00.000Z http://creativecommons.org/licenses/by-nc-nd/4.0/ © 2019 Elsevier B.V. All rights reserved. 2019-06-29T22:01:36.106Z http://vtw.elsevier.com/data/voc/AddOnTypes/50.7/nlp S0926860X19302741 Natural Science Funds of China 51872020 Beijing Synchrotron Radiation Facility European Synchrotron Radiation Facility http://data.elsevier.com/vocabulary/SciValFunders/501100001671 http://sws.geonames.org/3017382/ The authors gratefully acknowledge the support of the Natural Science Funds of China (Grant Nos. 51872020 ) and the beam line 1W1B of the Beijing Synchrotron Radiation Facility (BSRF) for providing the beam time. item S0926-860X(19)30274-1 S0926860X19302741 1-s2.0-S0926860X19302741 10.1016/j.apcata.2019.117120 271346 2024-01-01T12:33:10.553292Z 2019-08-05 1-s2.0-S0926860X19302741-main.pdf https://s3.amazonaws.com/prod-ucs-content-store-us-east/content/pii:S0926860X19302741/MAIN/application/pdf/a8840931fffb03ae9c86916f8e5c1f08/main.pdf main.pdf pdf true 2447342 MAIN 8 1-s2.0-S0926860X19302741-main_1.png https://s3.amazonaws.com/prod-ucs-content-store-us-east/content/pii:S0926860X19302741/PREVIEW/image/png/4f70cf912103355f044611b6961dfa11/main_1.png main_1.png png 56081 849 656 IMAGE-WEB-PDF 1 1-s2.0-S0926860X19302741-gr1.sml https://s3.amazonaws.com/prod-ucs-content-store-us-east/content/pii:S0926860X19302741/gr1/THUMBNAIL/image/gif/4f0f05452f89d73792a1e8e581114a9c/gr1.sml gr1 gr1.sml sml 6549 52 219 IMAGE-THUMBNAIL 1-s2.0-S0926860X19302741-gr3.sml https://s3.amazonaws.com/prod-ucs-content-store-us-east/content/pii:S0926860X19302741/gr3/THUMBNAIL/image/gif/c76c04e082ab39c1a0dc2240181caf4c/gr3.sml gr3 gr3.sml sml 14921 164 210 IMAGE-THUMBNAIL 1-s2.0-S0926860X19302741-gr2.sml https://s3.amazonaws.com/prod-ucs-content-store-us-east/content/pii:S0926860X19302741/gr2/THUMBNAIL/image/gif/0ee2674b2c6c3e4fd235b9fff37f7a22/gr2.sml gr2 gr2.sml sml 17847 164 163 IMAGE-THUMBNAIL 1-s2.0-S0926860X19302741-ga1.sml https://s3.amazonaws.com/prod-ucs-content-store-us-east/content/pii:S0926860X19302741/ga1/THUMBNAIL/image/gif/401573facbcd83ed40f338c0696cfeba/ga1.sml ga1 true ga1.sml sml 9008 164 213 IMAGE-THUMBNAIL 1-s2.0-S0926860X19302741-gr5.sml https://s3.amazonaws.com/prod-ucs-content-store-us-east/content/pii:S0926860X19302741/gr5/THUMBNAIL/image/gif/e3fce83bfd43c7bfd98b29d8ddf65b75/gr5.sml gr5 gr5.sml sml 10535 164 219 IMAGE-THUMBNAIL 1-s2.0-S0926860X19302741-gr4.sml https://s3.amazonaws.com/prod-ucs-content-store-us-east/content/pii:S0926860X19302741/gr4/THUMBNAIL/image/gif/0f5a4e93c89cb82be85086bc0337cdba/gr4.sml gr4 gr4.sml sml 9881 163 214 IMAGE-THUMBNAIL 1-s2.0-S0926860X19302741-gr7.sml https://s3.amazonaws.com/prod-ucs-content-store-us-east/content/pii:S0926860X19302741/gr7/THUMBNAIL/image/gif/31ea374f10248121b06074ddc686f1c7/gr7.sml gr7 gr7.sml sml 4500 85 219 IMAGE-THUMBNAIL 1-s2.0-S0926860X19302741-gr6.sml https://s3.amazonaws.com/prod-ucs-content-store-us-east/content/pii:S0926860X19302741/gr6/THUMBNAIL/image/gif/9240893b492b7483c087bebe7cec9892/gr6.sml gr6 gr6.sml sml 14011 164 219 IMAGE-THUMBNAIL 1-s2.0-S0926860X19302741-gr1.jpg https://s3.amazonaws.com/prod-ucs-content-store-us-east/content/pii:S0926860X19302741/gr1/DOWNSAMPLED/image/jpeg/2269272e927df166558a0d64b999c9ef/gr1.jpg gr1 gr1.jpg jpg 35424 156 661 IMAGE-DOWNSAMPLED 1-s2.0-S0926860X19302741-gr3.jpg https://s3.amazonaws.com/prod-ucs-content-store-us-east/content/pii:S0926860X19302741/gr3/DOWNSAMPLED/image/jpeg/ed728b193427af28e868e01630231b7c/gr3.jpg gr3 gr3.jpg jpg 88999 442 566 IMAGE-DOWNSAMPLED 1-s2.0-S0926860X19302741-gr2.jpg https://s3.amazonaws.com/prod-ucs-content-store-us-east/content/pii:S0926860X19302741/gr2/DOWNSAMPLED/image/jpeg/c9c486226b6c116ab4477a6e75f7c5b0/gr2.jpg gr2 gr2.jpg jpg 97698 493 491 IMAGE-DOWNSAMPLED 1-s2.0-S0926860X19302741-ga1.jpg https://s3.amazonaws.com/prod-ucs-content-store-us-east/content/pii:S0926860X19302741/ga1/DOWNSAMPLED/image/jpeg/1fde3c5f0b9fd2cd665f4ff84c65e405/ga1.jpg ga1 true ga1.jpg jpg 14938 200 260 IMAGE-DOWNSAMPLED 1-s2.0-S0926860X19302741-gr5.jpg https://s3.amazonaws.com/prod-ucs-content-store-us-east/content/pii:S0926860X19302741/gr5/DOWNSAMPLED/image/jpeg/9ffc900aef6d2c069e82591577061dfd/gr5.jpg gr5 gr5.jpg jpg 61399 424 566 IMAGE-DOWNSAMPLED 1-s2.0-S0926860X19302741-gr4.jpg https://s3.amazonaws.com/prod-ucs-content-store-us-east/content/pii:S0926860X19302741/gr4/DOWNSAMPLED/image/jpeg/040e9294688418c6764eef6a1a72b962/gr4.jpg gr4 gr4.jpg jpg 59551 432 566 IMAGE-DOWNSAMPLED 1-s2.0-S0926860X19302741-gr7.jpg https://s3.amazonaws.com/prod-ucs-content-store-us-east/content/pii:S0926860X19302741/gr7/DOWNSAMPLED/image/jpeg/ca3a3fe8e738241b2825d26d40826360/gr7.jpg gr7 gr7.jpg jpg 28862 220 566 IMAGE-DOWNSAMPLED 1-s2.0-S0926860X19302741-gr6.jpg https://s3.amazonaws.com/prod-ucs-content-store-us-east/content/pii:S0926860X19302741/gr6/DOWNSAMPLED/image/jpeg/feaacf8414511e2b837a9414a6191122/gr6.jpg gr6 gr6.jpg jpg 83581 424 566 IMAGE-DOWNSAMPLED 1-s2.0-S0926860X19302741-gr1_lrg.jpg https://s3.amazonaws.com/prod-ucs-content-store-us-east/content/pii:S0926860X19302741/gr1/HIGHRES/image/jpeg/48bf79996c138d42931d6738564d66f2/gr1_lrg.jpg gr1 gr1_lrg.jpg jpg 293731 690 2925 IMAGE-HIGH-RES 1-s2.0-S0926860X19302741-gr3_lrg.jpg https://s3.amazonaws.com/prod-ucs-content-store-us-east/content/pii:S0926860X19302741/gr3/HIGHRES/image/jpeg/465e574008034c94c5e4efde1f3eaa60/gr3_lrg.jpg gr3 gr3_lrg.jpg jpg 702625 1959 2508 IMAGE-HIGH-RES 1-s2.0-S0926860X19302741-gr2_lrg.jpg https://s3.amazonaws.com/prod-ucs-content-store-us-east/content/pii:S0926860X19302741/gr2/HIGHRES/image/jpeg/8d1238ddadabf1ff40a316ed39e28a93/gr2_lrg.jpg gr2 gr2_lrg.jpg jpg 953050 2184 2175 IMAGE-HIGH-RES 1-s2.0-S0926860X19302741-ga1_lrg.jpg https://s3.amazonaws.com/prod-ucs-content-store-us-east/content/pii:S0926860X19302741/ga1/HIGHRES/image/jpeg/1f16bbedc86018a8763e5643ece24bdb/ga1_lrg.jpg ga1 true ga1_lrg.jpg jpg 99911 886 1151 IMAGE-HIGH-RES 1-s2.0-S0926860X19302741-gr5_lrg.jpg https://s3.amazonaws.com/prod-ucs-content-store-us-east/content/pii:S0926860X19302741/gr5/HIGHRES/image/jpeg/965bdb9aafa6ff101f500a3a19c1d4af/gr5_lrg.jpg gr5 gr5_lrg.jpg jpg 497818 1877 2508 IMAGE-HIGH-RES 1-s2.0-S0926860X19302741-gr4_lrg.jpg https://s3.amazonaws.com/prod-ucs-content-store-us-east/content/pii:S0926860X19302741/gr4/HIGHRES/image/jpeg/47c141a8b6831e75587f20a715e7044b/gr4_lrg.jpg gr4 gr4_lrg.jpg jpg 434982 1916 2508 IMAGE-HIGH-RES 1-s2.0-S0926860X19302741-gr7_lrg.jpg https://s3.amazonaws.com/prod-ucs-content-store-us-east/content/pii:S0926860X19302741/gr7/HIGHRES/image/jpeg/74e6b0cc63ab6c383777b1653988a2ba/gr7_lrg.jpg gr7 gr7_lrg.jpg jpg 204439 976 2508 IMAGE-HIGH-RES 1-s2.0-S0926860X19302741-gr6_lrg.jpg https://s3.amazonaws.com/prod-ucs-content-store-us-east/content/pii:S0926860X19302741/gr6/HIGHRES/image/jpeg/6189169dd192fea29c97f0c6c18af742/gr6_lrg.jpg gr6 gr6_lrg.jpg jpg 627076 1879 2508 IMAGE-HIGH-RES 1-s2.0-S0926860X19302741-si1.gif https://s3.amazonaws.com/prod-ucs-content-store-us-east/content/pii:S0926860X19302741/STRIPIN/image/gif/1390d5469e53b3458b4447deceb01978/si1.gif si1 si1.gif gif 439 50 117 ALTIMG 1-s2.0-S0926860X19302741-si2.gif https://s3.amazonaws.com/prod-ucs-content-store-us-east/content/pii:S0926860X19302741/STRIPIN/image/gif/b1ce2b9364b5b6b1ca43c15e395b16af/si2.gif si2 si2.gif gif 585 45 147 ALTIMG 1-s2.0-S0926860X19302741-am.pdf am am.pdf pdf 7286350 AAM-PDF https://s3-eu-west-1.amazonaws.com/prod-ucs-content-store-eu-west/content/egi:1008CKQH1BT/MAIN/application/pdf/1ef348e48af6e007b703ece0f5c7152f/am.pdf https://s3.amazonaws.com/prod-ucs-content-store-us-east/content/egi:1008CKQH1BT/MAIN/application/pdf/1ef348e48af6e007b703ece0f5c7152f/am.pdf APCATA 117120 117120 S0926-860X(19)30274-1 10.1016/j.apcata.2019.117120 Elsevier B.V. Fig. 1 Illustration for the preparation procedure of the mononuclear iron catalysts. Fig. 1 Fig. 2 TEM images of the mononuclear iron catalysts prepared at different pyrolysis temperature, (A) 700 ℃; (B) 800 ℃; (C) 900 ℃ and (D) 1000 ℃. (Insets: the corresponding HRTEM images). Fig. 2 Fig. 3 (A) XRD patterns, (B) Raman and (C) partial enlarged Raman spectra of the mononuclear iron catalysts fabricated at different temperature. (D) High-resolution XPS spectra of the N 1s and its related curved-fitted components of the catalysts. (N1, N2, N3 refers to pyridinic, pyrrolic and graphitic N, respectively). Fig. 3 Fig. 4 (A) RDE polarization curves of the mononuclear Fe catalysts fabricated at different temperature and a commercial Pt/C (20 wt% Pt) in O2-saturated 1 M NaOH solution with a sweep rate of 5 mV s-1 and a rotation rate of 1600 rpm; (B) The half-wave potentials of the above catalysts; (C) The mass-specific activities at 0.9 V vs. RHE; (D) Tafel plots at the low overpotential region. Fig. 4 Fig. 5 (A) The RRDE polarization curves of these catalysts in O2-saturated 1 M NaOH solution; (B) The calculated peroxide yield and electron transfer number (n); (C) Chronoaperometric response of the Cat-800 and Pt/C at 0.7 V (vs. RHE); (D) Current loss ratio during the chronoapermetric test. Fig. 5 Fig. 6 (A) The Fourier transform at the Fe K-edge of EXAFS spectra of the mononuclear iron catalysts fabricated at different temperature (700, 800, 900 and 1000℃); (B) The corresponding Fe K-edge XANES spectra (the insets is a schematic illustration of the nonplanar structure of the FeN4 groups); (C) XPS spectra of the Co 2p of these catalysts; (D) The corresponding Fe L-edge XANES spectra. Fig. 6 Fig. 7 (A) relationship between half-wave potential and content of the covalent FeN4 groups; (B) correlation between mass specific activity (MSA) and content of the covalent FeN bonds. Fig. 7 Table 1 Contents of various types of nitrogen sites in the mononuclear Fe catalysts fabricated different temperature, determined by XPS. Table 1 Sample N(at%) Pyridinic-N(%) Pyrrolic-N(%) Graphitic-N(%) Fe-N(%) 700 6.9 22.3 28.4 30.6 18.7 800 4.5 27.3 26.5 24.6 21.6 900 2.8 19.5 36.6 29.9 13.9 1000 2.5 6.9 42.7 42.9 7.5 Mononuclear iron-dependent electrocatalytic activity of metal-nitrogen-carbon catalysts for efficient oxygen reduction reaction Min Liu Jingjun Liu ⁎ Ye Song Zhilin Li Feng Wang ⁎ State Key Laboratory of Chemical Resource Engineering, Beijing Key Laboratory of Electrochemical Process and Technology for Materials, Beijing University of Chemical Technology, Beijing 100029, PR China State Key Laboratory of Chemical Resource Engineering Beijing Key Laboratory of Electrochemical Process and Technology for Materials Beijing University of Chemical Technology Beijing 100029 PR China ⁎ Corresponding author. Graphical abstract As a low-cost nonprecious metal-based catalyst, the mononuclear iron embedded in nitrogen-doped carbons has been regarded as one type of the best electrocatalytic materials for the oxygen reduction reaction (ORR). Herein, we proposed a silica-protective-layer assisted strategy for fabricating the catalysts with mononuclear iron site coordinated with adjacent nitrogen and carbon atoms, through high temperature pyrolysis of melamine, carbon black and FeCl3. At 800 °C, the fabricated catalyst features completely atomic level iron-nitrogen-carbon catalysts without Fe-based phases. In concentrated 1 M NaOH solution, this catalyst displays a remarkably improved catalytic activity with half-wave potential of 0.90 V. The mass activity of catalyst can reach 1.06 times that of commercial Pt/C (20 wt%, Pt). The correlation of the mononuclear iron composition and coordination structure with the promoted ORR kinetics was discussed in detail. The superior activity can be attributed to lots of the mononuclear iron moieties with a non-planar Fe(II)-N4 structure and increased surface area of the as-synthesized heterogeneous catalyst. Keywords Mononuclear iron catalysts Silica template Pyrolysis temperature Non-planar Fe(II)-N4 structure Oxygen reduction reaction 1 Introduction To overcome the challenges of environmental pollution and depletion of fossil energy, it is required to develop a wide range of renewable energy technologies, such as fuel cells [1], metal-air batteries [2]. For these above clean energy systems, one of the major cornerstones is that the oxygen reduction reaction (ORR) is a sluggish kinetic. To date, Platinum (Pt) and Pt-based alloys have been considered as the most efficient catalysts for the ORR. However, their scare reserve, high cost, poor durability, and low poison resistance significantly prohibit the practical application. To overcome these obstacles, tremendous efforts are being devoted to developing an efficient electrocatalyst based on earth-abundant elements, including C, N, Co, or Fe [3–6]. Among these nonprecious catalysts, iron and nitrogen co-doped carbon is a promising candidate because of its superior activity and electrochemical stability toward the ORR [7–9]. In 1960′s, Jasinski initially studied the mononuclear cobalt catalysts with cobalt centered macrocyclic compounds [10]. After this study, numerous materials with a Fe site coordinated to four adjacent nitrogen atoms (Fe-N4) have been widely synthesized as non-precious metal catalysts for the ORR [11–13]. In the Fe-N4 configuration, the metal is mononuclear Fe ion, which presents two oxidation states, low-spin Fe(II) and high-spin Fe(III) [8,14]. In recent years, a growing body of literature based on spectroscopic studies suggests that the low-spin Fe(II)-N4 moieties with unfilled dz2 orbitals can contribute to the chemical adsorption of O2 molecules, which have been reported as the primarily active sites for reducing O2 [15–20]. Then, the mononuclear Fe (II) central sites undergoes Fe(II)/Fe(III) redox transition and the lost electron will be gained by the absorbed O2, leading a weakened OO bond and promoting the initiation step of the oxygen reduction process [21,22]. In contrast, the mononuclear Fe (III) ions are inactive sites for the ORR. Thus, it may be an effective strategy to obtain the mononuclear Fe (II) sites instead of inactive phases by using silica as a protective material during the pyrolysis. For example, Pylypenko first reported that the silica-assisted iron catalyst had shown considerably high catalytic activity for ORR [23]. Meanwhile, the silica-protected layer can maintain the physical and chemical integrity even at high temperature, avoiding the formation of multinuclear iron phases [24]. Furthermore, during the design of the electrocatalysts on mononuclear iron catalyst, Liang suggest that the SiO2 layer can facilitate the coordination between nitrogen atoms and the mononuclear Fe (II) to form unique Fe(II)-N4 species, preventing the agglomeration of iron species [25]. Therefore, the unique physical and chemical properties of silica can greatly motivated extensive interests in synthesizing the mononuclear Fe heterogeneous catalysts without impurities. In our previous work [26], the silica plays a crucial role in the formation of the completely atomic level Fe-N-C catalysts, which is used as a space-confined template. This synthesis method can avoid the formation of Fe-based impurity phases. The as-synthesized Fe-N-C catalysts display a remarkably enhanced ORR activity, relative to a commercial Pt/C catalyst. However, the effect of different pyrolysis temperatures of melamine on embedding behaviors of Fe atoms into carbon matrix remains unclear. It needs to further understand how the pyrolysis temperature control the chemical structures and valence state of the embedded iron atoms in the catalysts containing nitrogen and carbon atoms, which may governor ORR activity. So, this work may highlight the formation process of the Fe-N-C catalysts and can open a path for rationally designing mononuclear iron-based electrocatalysts. 1.1 Experimental section 1.1.1 Materials preparation Mononuclear Fe ion embedded in nitrogen-doped carbon is synthesized as following steps. In brief, prior to SiO2 coating, a carbon black (Vulcan XC-72, Cabot) was modified with nitric acid to improve the dispersion of carbon black in aqueous solution and the affinity to positive ions. After the surface modification, 0.1 g pre-acid-treated carbon black was added to 20 ml ethanol solution and stirred by a magnetic bar at room temperature. Once the carbon black was uniformly dispersed, 0.1 g melamine and 5 mL FeCl3 solution (0.18 M) were added into the solution and stirred for overnight to make sure that the Fe3+ ions and melamine can be evenly absorbed on the surface of carbon matrix through electrostatic interaction. Then the mixture was pre-heated to 250 ℃ in a quartz-tube furnace at a ramp of 5 ℃ min−1 and held at that temperature for 1 h under Argon (Ar) gas. The pre-treated hybrids was subsequently mixed with 2 mL tetraethyl orthosilicate in an agate mortar, followed by adding 2 mL formic acid and drying at 80 ℃ to form a well-distributed silica layer. Then the silica-protected hybrids was placed in an alumina crucible, heated to 800 ℃ at a ramping rate of 5 ℃min-1 and maintained at this temperature for 1 h with an inert Ar gas environment. Finally, the resulting mononuclear Fe heterogeneous catalyst was stirred with 3:1 (v/v)=ehanol:10% HF solution at room temperature for 2 h to remove the silica layer, followed by filtering and washing with ethanol and water several times until the filtrate became neutral and then dried at 80 ℃. According to the pyrolysis temperature, the obtained catalysts are denoted as Cat-700, Cat-800, Cat-900 and Cat-1000. 1.1.2 Materials characterization Structure and morphology of the as-synthesized catalysts are characterized by X-ray diffraction (XRD, Rigaku RINT 2200 V/PC, Cu Kα), Raman spectroscopy (LabRam HR800) with a visible laser (λ = 532 nm) and transmission electron microscopy (TEM, JEM 2100, 120 kV). Surface characterization of the mononuclear Fe catalysts was performed using an X-ray photoelectron spectroscopy (XPS) (Thermo ESCALAB 250). To determine the exact structure and electronic state of mononuclear Fe site in the carbon, X-ray absorption spectroscopy at Fe k-edge was conducted at the 1W1B beamline of Beijing Synchrotron Radiation Laboratory. 1.1.3 Electrochemical measurements ORR performance is evaluated in 1 M NaOH solution using a glassy carbon rotating ring disk electrode (RRDE, 5.61 mm of disk outer diameter, Pine Research Instrumentation, USA). The catalyst ink was prepared by mixing 5 mg of the catalyst powder with 20 μL of Nafion solution (5% wt.) and 1 mL of ethanol. The ink was sonicated for over 30 min to achieve a good dispersion. 20 μL of the catalyst ink was dropped on the glassy carbon surface, resulting in a catalyst loading on the electrode of 0.4 mg cm−2. As a comparison, a commercial Pt/C (20 wt% Pt, E-TEK) was also tested and the loading on the electrode is 0.1 mg cm−2. A saturated calomel electrode (SCE) and a graphitic rod were used as the reference and the counter electrode, respectively. All potentials reported in this work have been converted to the RHE scale. 2 Results and discussion 2.1 Effect of pyrolysis temperatures on the mononuclear iron catalysts Fig. 1 shows the typical preparation procedure of the mononuclear iron catalysts, through a facial two-step method. In the first step, the functional groups (carboxylic or hydroxyl groups) present on the acid-treated carbon can serve as active site for chemical adsorption of FeCl3 and melamine through electrostatic interaction [27]. Then, their hybrids are encapsulated by SiO2 layer. In the second step, the silica-assisted hybrids are annealed at different temperatures, then followed by a leaching treatment with HF solution to remove the coated SiO2. During the pyrolysis stage, the silica layer can exhibit a significant confinement effect for the Fe atoms, which are more effectively transformed into highly dispersed Fe site coordinated with adjacent nitrogen atoms instead of inactive phases such as metallic Fe or its carbides [25]. In our previous report, we identified silica as an independent factor contributing to formation of the pure Fe-N-C catalyst without Fe-based impurity phases [26]. Even with the aid of the protective silica layer, the pyrolysis temperature may strongly affect the chemical structure, oxidation state of the mononuclear iron catalysts. To comprehensively study this effect, different pyrolysis temperatures (700, 800, 900 and 1000℃) are employed in the synthesis of the mononuclear Fe catalysts. Their morphologies were first examined by TEM, as shown in Fig. 2 . All these catalysts are mainly composed of isolated carbon blank nanoparticles with sizes ranging from 30 to 40 nm. However, with increasing the pyrolysis temperature, the morphologies of these catalysts change significantly. For the catalysts fabricated at 700 and 800℃ (Fig. 1A and B), besides the carbon nanoparticles, no obvious Fe-based particles (such as Fe3C, FexOy, or metallic Fe phase) can be found in these catalysts, because the silica layer can restrict the free migration of iron species, avoiding the formation of these particles during the pyrolysis [25,28]. In this case, iron atoms will be well dispersed along the carbon framework and probably act with gaseous substances containing nitrogen atoms to form the mononuclear Fe-related species (Fe-N4) instead of Fe-based particles [29,30]. When pyrolysis temperature increases to 900 and 1000℃, the resultant catalysts exhibit a slightly altered structure as shown in Fig. 2C and D; some crystalline nanoparticles in the range of 40–50 nm with darker contrast are clearly observed. The large nanoparticles are well crystallized with a lattice distance of 0.201 nm which are assigned to (031) lattice plane of the Fe3C, preliminarily proving the formation of Fe3C particles. The formation of Fe3C is likely due to the structure change of the mononuclear Fe catalyst at elevated temperature, in which the bond between iron and nitrogen atoms is broken. After the destruction of Fe-N structure, the Fe atoms can further migrate and agglomerate to react with carbon atoms across the silica shell at high temperature, leading to the generation of large-sized Fe3C nanoparticles. Furthermore, besides the formation of Fe3C particles, the HRTEM images of the catalysts obtained 900 and 1000℃ clearly exhibit that some highly graphitic carbon shells with interplanar spacing of about 0.34 nm are grown on the surface of these nanoparticles because of the catalytic manner of Fe3C particles as suggested by previous reports [31–33]. The above outcomes indicate that the importance in choice of pyrolysis temperature for the final properties of silica-assisted mononuclear iron catalysts. To obtain further insight into the structural change of the silica-assisted mononuclear Fe catalysts (fabricated at different temperature), X-ray diffraction (XRD) patterns were performed as shown in Fig. 3 A. Two relatively wide diffraction peaks located at 26° and 43° are observed in the catalysts, which are assigned to the (002) and (100) diffraction planes of carbon, respectively. Moreover, as the pyrolysis temperature increases from 700 to 1000 ℃, the (002) diffraction peak of carbon shifts to higher angel direction, illustrating an improvement of graphitization degree in the carbon matrix [5,34]. It can be further confirmed by the Raman spectra. As observed in Fig. 3B, the Raman microscopy reveals the D and G bands of graphitic carbon at 1357 and 1580 cm−1, respectively. The D band correspond to the sp3-bonded carbon while the G band is due to the presence of sp2-bonded carbon atoms in two-dimensional hexagonal graphitic layers [5]. The intensity ratio of the D to G band (ID/IG) is normally employed to express the graphitization of carbon materials. A lower value is associated with a higher degree of graphitization. Through Lorentzian curve-fitting [35], the calculated ID/IG value is decreased from 0.98 to 0.88, indicating the increased degree of graphitization of carbon. Apart from the shifted peak position of carbon with increasing pyrolysis temperature, the catalysts (fabricated at 900 and 1000 ℃) also show a series diffraction peaks attributed to crystal planes of Fe3C (PDF#35-0772). The crystalline structure of the Fe3C species is further illustrated by Raman spectra. As depicted in Fig. 3C, two characteristic peaks in the Raman scattering line are observed at 219 and 284 cm−1, which corresponds respectively to the A1g and Eg symmetric phonon modes of crystalline Fe3C [36,37]. On the contrary, it is noted that no any diffraction peaks or Raman scattering peaks corresponding to Fe3C phase are detected in Cat-700 and 800, excluding the presence of any crystalline particles of Fe3C. According to previous reports [29], the Fe atoms in the mononuclear Fe catalysts may be fixed by coordination with N atoms, forming the Fe-N4 moieties. Thus, we conclude that an appropriate pyrolysis temperature (700 and 800℃) is indispensable condition for the synthesis of the desired catalyst with Fe-N moieties. Furthermore, these Fe-N moieties can be partially or completely destroyed and transferred to Fe3C species above 800 ℃. To capture the evolution of the Fe-N moieties during pyrolysis, the N1 s X-ray photoelectron spectroscopy (XPS) was further conducted. As depicted in Fig. 3D, the N 1s spectra present four well fitted peaks at 398.9, 399.8, 401.1 and 402.9 eV cooresponding to pyridinic N, FeN, pyrrolic N and graphitic N, respectively [38–40]. For the mononuclear Fe catalysts, the FeN groups contributes largely to improve the ORR activity [41]. The quantitative values of different types of nitrogen can be calculated by the integral area of the corresponding peaks. As observed in Table 1 , with increasing the pyrolysis temperature in the range from 700 to 1000 ℃, the correspondingly contents of the FeN groups increase first and then decrease. Among all the tested catalysts, the one carbonized at 800 ℃ exhibits the highest Fe-N content. The reason for the maximun content of FeN bond may be associated with the maximun chemical contact area formed on the surface of carbon matrix, depending on dispersion of the atomic Fe. When the catalyst was heat-treated above 800 ℃, the atomic Fe tend to agglomerate and form bulk Fe3C particles, which leads to the destroy of the FeN bond and then the covalent bond content rapidly decreases. 2.2 ORR activity of the catalysts prepared at different pyrolysis temperature To investigate the effect of pyrolysis temperature on the ORR activities of the mononuclear iron catalysts, rotating-disk electrode (RDE) measurement was performed in 1 M NaOH solution with a continuous supply of oxygen at room temperature. Fig. 4 A shows the linear sweep voltammetry (LSV) curves of the mononuclear iron catalysts fabricated at different temperatures. For comparison, a commercial Pt/C catalyst (20 wt% Pt, relative to carbon) is also tested under the same condition. As indicated in Fig. 4B and C, the measured half-wave potential (E1/2) and mass-specific activities (MSA, Ik normalized by the catalysts mass loading) follow the order: Cat-800> Pt/C > Cat-700> Cat-900> Cat-1000. Among the tested catalysts, the mononuclear iron catalyst synthesized at 800℃ shows the highest catalytic activity based on E1/2 values (0.90) and the mass-specific activity (5.2 mA/mg), at 0.9 vs RHE. This increase in ORR activity is presumably causally connected with an increase in FeN groups (Fig. 3D) [40,41]. As the pyrolysis temperature increased to 900 and 1000℃, the E1/2 value and the magnitude of the mass-specific activity decreased as a result of structural destruction of mononuclear Fe site and the formation of Fe3C nanoparticles entrapped in carbon shells. Some researchers proposed that the Fe3C particles entrapped in carbon shells cannot directly participate in the ORR process [15,42]. Moreover, the large particles may influence the catalyst with a low surface area, reducing access for O2 molecules to the catalyst surface. Tafel slope is further calculated to give a deep insight into the reaction kinetics on the mononuclear iron catalysts. As shown in Fig. 4D, at the low overpotential region, linear regressions of the catalysts show that the slopes are all close to 60 mV dec−1 except for Catalyst-1000 where the slope is close to 74 mV dec−1. Such Tafel behavior has also been revealed for the commercial Pt/C catalyst [41]. As observed, the Tafel slope of Cat-800 is ˜61.9 mV dec−1, which is nearly close to that of the Pt/C (˜60 mV dec−1), suggesting that the catalytic mechanism of ORR on Cat-800 resembles that on Pt (˜62.7 mV dec−1). That is, at the low overpotential region, the reaction rate of Fe-N-C catalyst was mainly controlled by the pseudo two-electron reduction reaction, involving the electron transfer from central Fe sites to oxygen molecule and the OO bond breaking [41]. In addition, at 0.90 V, Cat-800 showed much higher kinetic current densities than those of other Fe-N-C catalysts, confirming fast reaction kinetics of the Cat-800 for the ORR. To further probe the ORR pathway over the mononuclear iron catalysts, rotating ring-disk (RRDE) measurements were conducted in O2-saturated 1 M NaOH solution. Based on the data in Fig. 5 A, the electron transfer number per O2 (n) and the percentage of hydrogen peroxide (H2O2) produced during the ORR process can be calculated by the following formulas: (1) n = 4 I d I d + I r N - 1 (2) H 2 O 2 % = 200 I r I r + N I d Where Ir , Id and N are the ring current, disk current and the RRDE collection efficiency (0.37 in the present work), respectively. The calculated electron transferred number (n) and H2O2 percentage are plotted as a function of electrode potential (from 0.3 V to 0.9 V vs. RHE), as shown in Fig. 5B. Obviously, it can been seen that the Cat-700 and Cat-800 catalysts can catalyze a one-step four-electron dominated ORR processes (n = 3.7–3.9), giving much less H2O2 yields (around 15%), which is alomost equal to that of commerical Pt/C. In contrast, the overall electron transfer numbers for Cat-900 and Cat-1000 are in the range of 2.9–3.5, with the corresponding percentages of H2O2 being 40–50%. Thus, it can be inferred that the ORR on Cat-900 and Cat-1000 is a mixed process of 2- and 4-electron transfer pathway. Previous works suggested that the favorite ORR process is the four-electron transfer process from O2 to OH− rather than to H2O2 [43,44]. Based on the preceding results, the mononuclear iron catalyst fabricated at 800℃ could be selected as the best catalyst for ORR. Besides the high electro-activity, the long-term stability is also a key parameter for high-performance ORR electrocatalyst. So, we use the current-time (i-t) chronoamperometric measurement to evaluate the stability of the Cat-800 toward ORR. As observed from Fig. 5C, the decay in the relative currents of oxygen reduction on the Cat-800 and Pt/C catalysts is remarkably different. After continuous operation for 10000 s, the mononuclear iron catalyst presents low attenuation with high current retention of 96.5%. However, the commercial Pt/C loses 12% of its initial current value, as shown in Fig. 5D. The comparison of i-t curves reveals that the mononuclear iron catalyst is electrochemically more stable compared to the commercial Pt/C catalyst in the alkaline medium. The excellent performance of this mononuclear Fe catalyst fabricated at 800℃ makes it a promising inexpensive electrocatalyst for ORR in alkaline media. 2.3 Structure of mononuclear Iron in catalysts For these sinthyesized mononuclear iron catalysts, the formed Fe-N moieties with unfilled dz2 orbitals can promote the chemical adsorption and dissociation of O2 molecule [20,40,45]. The abundant FeN bond could be a vital factor for enhancing the electrochemical performance, and act as greatly efficient active sites for enhancing the catalytic activities [19,46]. In attempt to further understand the nature of Fe-N moieties, X-ray absorption spectroscopy (XAS) at Fe k-edge, a sensitive characterization for identifying nanocrystalline species, was conducted to analyze the coordination environment of iron. Fig. 6 A shows the Fourier-transformed k3-weighted EXAFS spectra at the Fe K edge, which yield precise metal-ligand distances in the catalyst. The catalysts prepared at 700 and 800 ℃ present a prominent peak at 1.47 Å, which is due to the formation of Fe-N4 coordination, resembling the FePc reference sample [20,47]. Nevertheless, the structural features of Cat-900 and Cat-1000 significantly differ from those of the catalyst fabricated at 700 ℃ and at 800 ℃, as suggested by the weak but still recognizable peak at 1.47 Å. Besides, a broad peak at 2.2 Å arising from the Fe-Fe coordination of Fe carbides (Fe3C) can be clearly observed in these catalysts [47]. It offers a direct proof that with increasing the pyrolysis temperature, the FeN bond in the monuclear iron catalyst is inevitably broken and subsequently react with free C atoms, leading to the generation of Fe3C nanoparticles. From the XANES spectra depicted in Fig. 6B, the similarity in pre-edge energy at 7117 eV is evident in the reference FePc and mononclear Fe catalysts catalysts (fabricated at 700 and 800 ℃), indicating a silmilar Fe-N4 configuration [20,47]. It is significantly different from that of Cat-900 and Cat-1000, which show more metallic chatacter. Moreover, the intensity and position of the characteristic peaks in the mononuclear iron catalysts (fabricated at 700 and 800 ℃) have changed. Compared with the FePc reference sample, the characteristic Peak C at 7131 eV increased, the peaks at 7137 (Peak D) depressed and the peak E at 7160 Å moved to lower energie field, indicating the formation of non-planar Fe-N4 moieties in the mononuclear iron catalyst [48]. In order to gain more information about the electronic sturcture of central Fe in the Fe-N4 moieties, the Fe 2p X-ray photoelectron spectroscopy (XPS) was conducted as shown in Fig. 6C. However, the spectra of the catalysts have a high noise to signal ratio due to its low iron content, and therefore was not deconvoluted. Hence, we analyzed the XANES spectra of Fe L-edge because it results from electronic transition between 2p level and the largely unoccupied 3d electron state, which are highly sensitive to the valence and spin states of the probed Fe atom [49]. As observed from Fig. 6D, two main spectral features are resoved at 710 eV (L3-edge) and 723 eV (L2-edge) regions for all catalysts. The former comes from transitions from Fe 2p3/2 to Fe 3d states, while the latter involves transition from Fe 2p1/2 to Fe 3d states [50]. From the overall spectral shape, especially the L3-edge, it can be concluded that there are structural differences between these mononuclear iron catalysts (fabricated at different pyrolysis temperature). First of all, the mean oxidation state of Fe in these mononuclear iron catalysts (fabricated at 700 and 800 ℃) than that the catalysts (fabricated at 900 and1000 ℃), as evidenced by the absorption edge position. Secondly, a splitting of the L3 peaks is observed, which corresponds to metal-ligand electronic interactions. With the increased pyrolysis temperature, the intensity of the splitting peaks exhibits visible changes. The mononuclear Fe catalysts (fabricated at 700 and 800 ℃) contains only one peak at the energy of 708.5 eV, indicating the existence of divalent ions Fe(II) in the Fe-N4 moieties [18,22,48,51]. When the temperature was further elevated to 900 °C and 1000 °C, trivalent ions Fe(III)appear in these spectra owing to the generation of Fe3C nanoparticles. Based on the aforementioned analysis, it is resonable to expect that the ORR performance of the mononuclear iron catalysts should depend on the high percentage of nonplanar Fe(II)N4 groups. In order to understand the coorelation ship between Fe(II)-N4 sites and ORR activity, we plotted the half-wave potentials of the catalysts as a function of the contents of Fe(II)-N moieties. With increasing the Fe(II)-N content, the corresponding half-wave potential is positively shifted, as shown in Fig. 7 A. A linear trend is observed for the half-wave potentials and contens of the Fe(II)-N moieties in the monunclear Fe catalysts, suggesting that the ORR activity is significantly dependent on the Fe(II)N bond. Moreover, the mass-specific activities also show a silmilar linear tendency. These results illustrate that the mononuclear iron catalysts fabricated at 800 °C with 21.6% nonplanar Fe(II)-N4 moieties display highest ORR activity. In our previous study [27], we have found that the Fe(II) center in the nonplanar Fe(II)-N4 moieties is active sites for oxygen reduction in the Fe-N-C catalysts. Along with the process of ORR on the central Fe(II), the structure of Fe(II)-N4 moieties will switch from non-planer to planer, which may shorten Fe(III)N bond distance and decrease electronic density of the iron, thereby facilitate the axial adsorption of active O2. 3 Conclusions In summary, we have successfully synthesized a series of mononuclear iron catalysts at different pyrolysis temperature by using silica as the protective layer. During the high-temperature pyrolysis process, the formation of the catalytically active Fe-N4 sites is strongly influenced by the pyrolysis temperature and, in turn, the ORR activity of the catalysts is also controlled by the content and non-planar structure of the active sites. Among the catalysts, the resultant Cat-800 with highest content of Fe-N4 moieties exhibits a significantly enhanced ORR activity, which is surprisingly superior to that of the commercial Pt/C. The remarkably enhanced ORR activity can be attributed to the easily switching behavior of the out-of-plane Fe(II) to in-of-plane Fe(III) ions in the Fe-N4 structure, caused by an electron back-donation between these iron atoms coordinated with N atoms in the mononuclear Fe catalysts. This study may open a new route for rational design and synthesis of efficient mononuclear iron electrocatalysts towards the ORR. Acknowledgements The authors gratefully acknowledge the support of the Natural Science Funds of China (Grant Nos. 51872020) and the beam line 1W1B of the Beijing Synchrotron Radiation Facility (BSRF) for providing the beam time. References [1] U.I. Kramm N. Larouche D. Schmeisser J.P. Dodelet J. Am. Chem. Soc. 136 2014 978 985 [2] Z.L. Wang D. Xu J.J. Xu X.B. Zhang Chem. Soc. Rev. 43 2014 7746 7786 [3] T. Liu P. Zhao X. Hua W. Luo S. Chen G. Cheng J. Mater. Chem. A 4 2016 11357 11364 [4] M. Liu J. Liu Z. Li F. Wang ACS Appl. Mater. Interfaces 10 2018 7052 7060 [5] H. Deng Q. Li J. Liu F. Wang Carbon 112 2017 219 229 [6] Y. Ye F. Cai H. Li H. Wu G. Wang Y. Li S. Miao S. Xie R. Si J. Wang X. Bao Nano Energy 38 2017 281 289 [7] K. Yuan S. Sfaelou M. Qiu D. Lützenkirchen-Hecht X. Zhuang Y. Chen C. Yuan X. Feng U. Scherf ACS Energy Lett. 3 2018 252 260 [8] X. Wang H. Zhang H. Lin S. Gupta C. Wang Z. Tao H. Fu T. Wang J. Zheng G. Wu X. Li Nano Energy 25 2016 110 119 [9] L. Osmieri R. Escudero-Cid A.H.A. Monteverde Videla P. Ocón S. Specchia Appl. Catal. B 201 2017 253 265 [10] R. Jasinski Nature 201 1964 1212 [11] M. Shen C. Wei K. Ai L. Lu Nano Res. 10 2017 1449 1470 [12] H. Jia Z. Sun D. Jiang S. Yang P. Du Inorg. Chem. Front. 3 2016 821 827 [13] Z. Qian Z. Hu Z. Zhang Z. Li M. Dou F. Wang Catal. Sci. Technol. 7 2017 4017 4023 [14] M. Xiao J. Zhu L. Ma Z. Jin J. Ge X. Deng Y. Hou Q. He J. Li Q. Jia S. Mukerjee R. Yang Z. Jiang D. Su C. Liu W. Xing ACS Catal. 8 2018 2824 2832 [15] J.H. Kim Y.J. Sa H.Y. Jeong S.H. Joo ACS Appl. Mater. Interfaces 9 2017 9567 9575 [16] K. Mamtani D. Jain D. Zemlyanov G. Celik J. Luthman G. Renkes A.C. Co U.S. Ozkan ACS Catal. 6 2016 7249 7259 [17] M.S. Liao S. Scheiner J. Chem. Phys. 117 2002 205 219 [18] N. Ramaswamy U. Tylus Q. Jia S. Mukerjee J. Am. Chem. Soc. 135 2013 15443 15449 [19] C. Gumeci N. Leonard Y. Liu S. McKinney B. Halevi S.C. Barton J. Mater. Chem. A 3 2015 21494 21500 [20] J. Li S. Ghoshal W. Liang M. Sougrati F. Jaouen B. Halevi S. McKinney G. McCool C. Ma X. Yuan Z. Ma S. Mukerjee Q. Jia Energy Environ. Sci. 9 2016 2418 2432 [21] W. Xia A. Mahmood Z. Liang R. Zou S. Guo Angew. Chemie Int. Ed. 55 2016 2650 2676 [22] U. Tylus Q. Jia K. Strickland N. Ramaswamy A. Serov P. Atanassov S. Mukerjee J. Phys. Chem. C 118 2014 8999 9008 [23] S. Pylypenko S. Mukherjee T.S. Olson P. Atanassov Electrochim. Acta 53 2008 7875 7883 [24] A. Serov M.H. Robson M. Smolnik P. Atanassov Electrochim. Acta 80 2012 213 218 [25] B. Hu Z. Wu S. Chu H. Zhu H. Liang J. Zhang S. Yu Energy Environ. Sci. 11 2018 2208 2215 [26] M. Liu J. Liu Z. Li Y. Song F. Wang J. Catal. 370 2019 21 29 [27] S. Kabiri D.N.H. Tran T. Altalhi D. Losic Carbon 80 2014 523 533 [28] Y.J. Sa D.J. Seo J. Woo J.T. Lim J.Y. Cheon S.Y. Yang J.M. Lee D. Kang T.J. Shin H.S. Shin H.Y. Jeong C.S. Kim M.G. Kim T.-Y. Kim S.H. Joo J. Am. Chem. Soc. 138 2016 15046 15056 [29] M.Q. Wang W.-H. Yang H.H. Wang C. Chen Z.-Y. Zhou S.-G. Sun ACS Catal. 4 2014 3928 3936 [30] H. Tang Y. Zeng Y. Zeng R. Wang S. Cai C. Liao H. Cai X. Lu P. Tsiakaras Appl. Catal. B 202 2017 550 556 [31] J. Yang J. Hu M. Weng R. Tan L. Tian J. Yang J. Amine J. Zheng H. Chen F. Pan ACS Appl. Mater. Interfaces 9 2017 4587 4596 [32] Z. Wen S. Ci F. Zhang X. Feng S. Cui S. Mao S. Luo Z. He J. Chen Adv. Mater. 24 2012 1399 1404 [33] Q. Wang Y. Lei Z. Chen N. Wu Y. Wang B. Wang Y. Wang J. Mater. Chem. A 6 2018 516 526 [34] J. Ma D. Xiao C.L. Chen Q. Luo Y. Yu J. Zhou C. Guo K. Li J. Ma L. Zheng X. Zuo J. Power Sources 378 2018 491 498 [35] Q.H. Yang P.X. Hou M. Unno S. Yamauchi R. Saito T. Kyotani Nano Lett. 5 2005 2465 2469 [36] Y. Yang X. Fan G. Casillas Z. Peng G. Ruan G. Wang M.J. Yacaman J.M. Tour ACS Nano 8 2014 3939 3946 [37] Y. Liao K. Pan L. Wang Q. Pan W. Zhou X. Miao B. Jiang C. Tian G. Tian G. Wang H. Fu ACS Appl. Mater. Interfaces 5 2013 3663 3670 [38] Y. Qian P. Du P. Wu C. Cai D.F. Gervasio J. Phys. Chem. C 120 2016 9884 9896 [39] B. Liu W. Dai Z. Liang J. Ye L. Ouyang Int. J. Hydrogen Energy 42 2017 5908 5915 [40] J. Zhang D. He H. Su X. Chen M. Pan S. Mu J. Mater. Chem. A 2 2014 1242 1246 [41] M.K. Rybarczyk M. Lieder M. Jablonska RSC Adv. 5 2015 44969 44977 [42] J. Deng P. Ren D. Deng X. Bao Angew. Chemie Int. Ed. 54 2015 2100 2104 [43] N. Ramaswamy S. Mukerjee J. Phys. Chem. C 115 2011 18015 18026 [44] F. Li H. Shu C. Hu Z. Shi X. Liu P. Liang X. Chen ACS Appl. Mater. Interfaces 7 2015 27405 27413 [45] M.S. Liao S. Scheiner J. Chem. Phys. 117 2002 205 219 [46] C. Domínguez F.J. Pérez-Alonso M.A. Salam S.A. Al-Thabaiti M.A. Peña L. Barrio S. Rojas J. Mater. Chem. A 3 2015 24487 24494 [47] Q. Jia N. Ramaswamy U. Tylus K. Strickland J. Li A. Serov K. Artyushkova P. Atanassov J. Anibal C. Gumeci S.C. Barton M.-T. Sougrati F. Jaouen B. Halevi S. Mukerjee Nano Energy 29 2016 65 82 [48] Q. Jia N. Ramaswamy H. Hafiz U. Tylus K. Strickland G. Wu B. Barbiellini A. Bansil E.F. Holby P. Zelenay S. Mukerjee ACS Nano 9 2015 12496 12505 [49] P.L. Cook X. Liu W. Yang F. Himpsel J. Chem. Phys. 131 2009 194701 [50] J. Zhou P.N. Duchesne Y. Hu J. Wang P. Zhang Y. Li T. Regier H. Dai J. Chem. Soc. Faraday Trans. 16 2014 15787 15791 [51] E.P. Domashevskaya S.A. Storozhilov S.Y. Turishchev V.M. Kashkarov V.A. Terekhov O.V. Stognej Y.E. Kalinin S.L. Molodtsov J. Electron Spectros. Relat. Phenomena 156–158 2007 180 185",
      "scopus-id": "85067896373",
      "coredata": {
        "eid": "1-s2.0-S0926860X19302741",
        "dc:description": "As a low-cost nonprecious metal-based catalyst, the mononuclear iron embedded in nitrogen-doped carbons has been regarded as one type of the best electrocatalytic materials for the oxygen reduction reaction (ORR). Herein, we proposed a silica-protective-layer assisted strategy for fabricating the catalysts with mononuclear iron site coordinated with adjacent nitrogen and carbon atoms, through high temperature pyrolysis of melamine, carbon black and FeCl3. At 800 °C, the fabricated catalyst features completely atomic level iron-nitrogen-carbon catalysts without Fe-based phases. In concentrated 1 M NaOH solution, this catalyst displays a remarkably improved catalytic activity with half-wave potential of 0.90 V. The mass activity of catalyst can reach 1.06 times that of commercial Pt/C (20 wt%, Pt). The correlation of the mononuclear iron composition and coordination structure with the promoted ORR kinetics was discussed in detail. The superior activity can be attributed to lots of the mononuclear iron moieties with a non-planar Fe(II)-N4 structure and increased surface area of the as-synthesized heterogeneous catalyst.",
        "openArchiveArticle": "false",
        "prism:coverDate": "2019-08-05",
        "openaccessUserLicense": null,
        "prism:aggregationType": "Journal",
        "prism:url": "https://api.elsevier.com/content/article/pii/S0926860X19302741",
        "dc:creator": [
          {
            "@_fa": "true",
            "$": "Liu, Min"
          },
          {
            "@_fa": "true",
            "$": "Liu, Jingjun"
          },
          {
            "@_fa": "true",
            "$": "Song, Ye"
          },
          {
            "@_fa": "true",
            "$": "Li, Zhilin"
          },
          {
            "@_fa": "true",
            "$": "Wang, Feng"
          }
        ],
        "link": [
          {
            "@_fa": "true",
            "@rel": "self",
            "@href": "https://api.elsevier.com/content/article/pii/S0926860X19302741"
          },
          {
            "@_fa": "true",
            "@rel": "scidir",
            "@href": "https://www.sciencedirect.com/science/article/pii/S0926860X19302741"
          }
        ],
        "dc:format": "application/json",
        "openaccessType": null,
        "pii": "S0926-860X(19)30274-1",
        "prism:volume": "583",
        "articleNumber": "117120",
        "prism:publisher": "Elsevier B.V.",
        "dc:title": "Mononuclear iron-dependent electrocatalytic activity of metal-nitrogen-carbon catalysts for efficient oxygen reduction reaction",
        "prism:copyright": "© 2019 Elsevier B.V. All rights reserved.",
        "openaccess": "0",
        "prism:issn": "0926860X",
        "dcterms:subject": [
          {
            "@_fa": "true",
            "$": "Mononuclear iron catalysts"
          },
          {
            "@_fa": "true",
            "$": "Silica template"
          },
          {
            "@_fa": "true",
            "$": "Pyrolysis temperature"
          },
          {
            "@_fa": "true",
            "$": "Non-planar Fe(II)-N4 structure"
          },
          {
            "@_fa": "true",
            "$": "Oxygen reduction reaction"
          }
        ],
        "openaccessArticle": "false",
        "prism:publicationName": "Applied Catalysis A: General",
        "openaccessSponsorType": null,
        "prism:pageRange": "117120",
        "pubType": "fla",
        "prism:coverDisplayDate": "5 August 2019",
        "prism:doi": "10.1016/j.apcata.2019.117120",
        "prism:startingPage": "117120",
        "dc:identifier": "doi:10.1016/j.apcata.2019.117120",
        "openaccessSponsorName": null
      },
      "objects": {
        "object": [
          {
            "@category": "thumbnail",
            "@height": "52",
            "@width": "219",
            "@_fa": "true",
            "$": "https://api.elsevier.com/content/object/eid/1-s2.0-S0926860X19302741-gr1.sml?httpAccept=%2A%2F%2A",
            "@multimediatype": "GIF image file",
            "@type": "IMAGE-THUMBNAIL",
            "@size": "6549",
            "@ref": "gr1",
            "@mimetype": "image/gif"
          },
          {
            "@category": "thumbnail",
            "@height": "164",
            "@width": "210",
            "@_fa": "true",
            "$": "https://api.elsevier.com/content/object/eid/1-s2.0-S0926860X19302741-gr3.sml?httpAccept=%2A%2F%2A",
            "@multimediatype": "GIF image file",
            "@type": "IMAGE-THUMBNAIL",
            "@size": "14921",
            "@ref": "gr3",
            "@mimetype": "image/gif"
          },
          {
            "@category": "thumbnail",
            "@height": "164",
            "@width": "163",
            "@_fa": "true",
            "$": "https://api.elsevier.com/content/object/eid/1-s2.0-S0926860X19302741-gr2.sml?httpAccept=%2A%2F%2A",
            "@multimediatype": "GIF image file",
            "@type": "IMAGE-THUMBNAIL",
            "@size": "17847",
            "@ref": "gr2",
            "@mimetype": "image/gif"
          },
          {
            "@category": "thumbnail",
            "@height": "164",
            "@width": "213",
            "@_fa": "true",
            "$": "https://api.elsevier.com/content/object/eid/1-s2.0-S0926860X19302741-ga1.sml?httpAccept=%2A%2F%2A",
            "@multimediatype": "GIF image file",
            "@type": "IMAGE-THUMBNAIL",
            "@size": "9008",
            "@ref": "ga1",
            "@mimetype": "image/gif"
          },
          {
            "@category": "thumbnail",
            "@height": "164",
            "@width": "219",
            "@_fa": "true",
            "$": "https://api.elsevier.com/content/object/eid/1-s2.0-S0926860X19302741-gr5.sml?httpAccept=%2A%2F%2A",
            "@multimediatype": "GIF image file",
            "@type": "IMAGE-THUMBNAIL",
            "@size": "10535",
            "@ref": "gr5",
            "@mimetype": "image/gif"
          },
          {
            "@category": "thumbnail",
            "@height": "163",
            "@width": "214",
            "@_fa": "true",
            "$": "https://api.elsevier.com/content/object/eid/1-s2.0-S0926860X19302741-gr4.sml?httpAccept=%2A%2F%2A",
            "@multimediatype": "GIF image file",
            "@type": "IMAGE-THUMBNAIL",
            "@size": "9881",
            "@ref": "gr4",
            "@mimetype": "image/gif"
          },
          {
            "@category": "thumbnail",
            "@height": "85",
            "@width": "219",
            "@_fa": "true",
            "$": "https://api.elsevier.com/content/object/eid/1-s2.0-S0926860X19302741-gr7.sml?httpAccept=%2A%2F%2A",
            "@multimediatype": "GIF image file",
            "@type": "IMAGE-THUMBNAIL",
            "@size": "4500",
            "@ref": "gr7",
            "@mimetype": "image/gif"
          },
          {
            "@category": "thumbnail",
            "@height": "164",
            "@width": "219",
            "@_fa": "true",
            "$": "https://api.elsevier.com/content/object/eid/1-s2.0-S0926860X19302741-gr6.sml?httpAccept=%2A%2F%2A",
            "@multimediatype": "GIF image file",
            "@type": "IMAGE-THUMBNAIL",
            "@size": "14011",
            "@ref": "gr6",
            "@mimetype": "image/gif"
          },
          {
            "@category": "standard",
            "@height": "156",
            "@width": "661",
            "@_fa": "true",
            "$": "https://api.elsevier.com/content/object/eid/1-s2.0-S0926860X19302741-gr1.jpg?httpAccept=%2A%2F%2A",
            "@multimediatype": "JPEG image file",
            "@type": "IMAGE-DOWNSAMPLED",
            "@size": "35424",
            "@ref": "gr1",
            "@mimetype": "image/jpeg"
          },
          {
            "@category": "standard",
            "@height": "442",
            "@width": "566",
            "@_fa": "true",
            "$": "https://api.elsevier.com/content/object/eid/1-s2.0-S0926860X19302741-gr3.jpg?httpAccept=%2A%2F%2A",
            "@multimediatype": "JPEG image file",
            "@type": "IMAGE-DOWNSAMPLED",
            "@size": "88999",
            "@ref": "gr3",
            "@mimetype": "image/jpeg"
          },
          {
            "@category": "standard",
            "@height": "493",
            "@width": "491",
            "@_fa": "true",
            "$": "https://api.elsevier.com/content/object/eid/1-s2.0-S0926860X19302741-gr2.jpg?httpAccept=%2A%2F%2A",
            "@multimediatype": "JPEG image file",
            "@type": "IMAGE-DOWNSAMPLED",
            "@size": "97698",
            "@ref": "gr2",
            "@mimetype": "image/jpeg"
          },
          {
            "@category": "standard",
            "@height": "200",
            "@width": "260",
            "@_fa": "true",
            "$": "https://api.elsevier.com/content/object/eid/1-s2.0-S0926860X19302741-ga1.jpg?httpAccept=%2A%2F%2A",
            "@multimediatype": "JPEG image file",
            "@type": "IMAGE-DOWNSAMPLED",
            "@size": "14938",
            "@ref": "ga1",
            "@mimetype": "image/jpeg"
          },
          {
            "@category": "standard",
            "@height": "424",
            "@width": "566",
            "@_fa": "true",
            "$": "https://api.elsevier.com/content/object/eid/1-s2.0-S0926860X19302741-gr5.jpg?httpAccept=%2A%2F%2A",
            "@multimediatype": "JPEG image file",
            "@type": "IMAGE-DOWNSAMPLED",
            "@size": "61399",
            "@ref": "gr5",
            "@mimetype": "image/jpeg"
          },
          {
            "@category": "standard",
            "@height": "432",
            "@width": "566",
            "@_fa": "true",
            "$": "https://api.elsevier.com/content/object/eid/1-s2.0-S0926860X19302741-gr4.jpg?httpAccept=%2A%2F%2A",
            "@multimediatype": "JPEG image file",
            "@type": "IMAGE-DOWNSAMPLED",
            "@size": "59551",
            "@ref": "gr4",
            "@mimetype": "image/jpeg"
          },
          {
            "@category": "standard",
            "@height": "220",
            "@width": "566",
            "@_fa": "true",
            "$": "https://api.elsevier.com/content/object/eid/1-s2.0-S0926860X19302741-gr7.jpg?httpAccept=%2A%2F%2A",
            "@multimediatype": "JPEG image file",
            "@type": "IMAGE-DOWNSAMPLED",
            "@size": "28862",
            "@ref": "gr7",
            "@mimetype": "image/jpeg"
          },
          {
            "@category": "standard",
            "@height": "424",
            "@width": "566",
            "@_fa": "true",
            "$": "https://api.elsevier.com/content/object/eid/1-s2.0-S0926860X19302741-gr6.jpg?httpAccept=%2A%2F%2A",
            "@multimediatype": "JPEG image file",
            "@type": "IMAGE-DOWNSAMPLED",
            "@size": "83581",
            "@ref": "gr6",
            "@mimetype": "image/jpeg"
          },
          {
            "@category": "high",
            "@height": "690",
            "@width": "2925",
            "@_fa": "true",
            "$": "https://api.elsevier.com/content/object/eid/1-s2.0-S0926860X19302741-gr1_lrg.jpg?httpAccept=%2A%2F%2A",
            "@multimediatype": "JPEG image file",
            "@type": "IMAGE-HIGH-RES",
            "@size": "293731",
            "@ref": "gr1",
            "@mimetype": "image/jpeg"
          },
          {
            "@category": "high",
            "@height": "1959",
            "@width": "2508",
            "@_fa": "true",
            "$": "https://api.elsevier.com/content/object/eid/1-s2.0-S0926860X19302741-gr3_lrg.jpg?httpAccept=%2A%2F%2A",
            "@multimediatype": "JPEG image file",
            "@type": "IMAGE-HIGH-RES",
            "@size": "702625",
            "@ref": "gr3",
            "@mimetype": "image/jpeg"
          },
          {
            "@category": "high",
            "@height": "2184",
            "@width": "2175",
            "@_fa": "true",
            "$": "https://api.elsevier.com/content/object/eid/1-s2.0-S0926860X19302741-gr2_lrg.jpg?httpAccept=%2A%2F%2A",
            "@multimediatype": "JPEG image file",
            "@type": "IMAGE-HIGH-RES",
            "@size": "953050",
            "@ref": "gr2",
            "@mimetype": "image/jpeg"
          },
          {
            "@category": "high",
            "@height": "886",
            "@width": "1151",
            "@_fa": "true",
            "$": "https://api.elsevier.com/content/object/eid/1-s2.0-S0926860X19302741-ga1_lrg.jpg?httpAccept=%2A%2F%2A",
            "@multimediatype": "JPEG image file",
            "@type": "IMAGE-HIGH-RES",
            "@size": "99911",
            "@ref": "ga1",
            "@mimetype": "image/jpeg"
          },
          {
            "@category": "high",
            "@height": "1877",
            "@width": "2508",
            "@_fa": "true",
            "$": "https://api.elsevier.com/content/object/eid/1-s2.0-S0926860X19302741-gr5_lrg.jpg?httpAccept=%2A%2F%2A",
            "@multimediatype": "JPEG image file",
            "@type": "IMAGE-HIGH-RES",
            "@size": "497818",
            "@ref": "gr5",
            "@mimetype": "image/jpeg"
          },
          {
            "@category": "high",
            "@height": "1916",
            "@width": "2508",
            "@_fa": "true",
            "$": "https://api.elsevier.com/content/object/eid/1-s2.0-S0926860X19302741-gr4_lrg.jpg?httpAccept=%2A%2F%2A",
            "@multimediatype": "JPEG image file",
            "@type": "IMAGE-HIGH-RES",
            "@size": "434982",
            "@ref": "gr4",
            "@mimetype": "image/jpeg"
          },
          {
            "@category": "high",
            "@height": "976",
            "@width": "2508",
            "@_fa": "true",
            "$": "https://api.elsevier.com/content/object/eid/1-s2.0-S0926860X19302741-gr7_lrg.jpg?httpAccept=%2A%2F%2A",
            "@multimediatype": "JPEG image file",
            "@type": "IMAGE-HIGH-RES",
            "@size": "204439",
            "@ref": "gr7",
            "@mimetype": "image/jpeg"
          },
          {
            "@category": "high",
            "@height": "1879",
            "@width": "2508",
            "@_fa": "true",
            "$": "https://api.elsevier.com/content/object/eid/1-s2.0-S0926860X19302741-gr6_lrg.jpg?httpAccept=%2A%2F%2A",
            "@multimediatype": "JPEG image file",
            "@type": "IMAGE-HIGH-RES",
            "@size": "627076",
            "@ref": "gr6",
            "@mimetype": "image/jpeg"
          },
          {
            "@category": "thumbnail",
            "@height": "50",
            "@width": "117",
            "@_fa": "true",
            "$": "https://api.elsevier.com/content/object/eid/1-s2.0-S0926860X19302741-si1.gif?httpAccept=%2A%2F%2A",
            "@multimediatype": "GIF image file",
            "@type": "ALTIMG",
            "@size": "439",
            "@ref": "si1",
            "@mimetype": "image/gif"
          },
          {
            "@category": "thumbnail",
            "@height": "45",
            "@width": "147",
            "@_fa": "true",
            "$": "https://api.elsevier.com/content/object/eid/1-s2.0-S0926860X19302741-si2.gif?httpAccept=%2A%2F%2A",
            "@multimediatype": "GIF image file",
            "@type": "ALTIMG",
            "@size": "585",
            "@ref": "si2",
            "@mimetype": "image/gif"
          },
          {
            "@category": "standard",
            "@_fa": "true",
            "$": "https://api.elsevier.com/content/object/eid/1-s2.0-S0926860X19302741-am.pdf?httpAccept=%2A%2F%2A",
            "@multimediatype": "Acrobat PDF file",
            "@type": "AAM-PDF",
            "@size": "7286350",
            "@ref": "am",
            "@mimetype": "application/pdf"
          }
        ]
      },
      "link": {
        "@rel": "abstract",
        "@href": "https://api.elsevier.com/content/abstract/scopus_id/85067896373"
      }
    }
  }
}