{
  "metadata": {
    "title": "Can we achieve efficient photocatalytic partial oxidation of methane to methanol: A perspective on oxygen reaction pathways",
    "authors": "; ; ",
    "journal": "Applied Catalysis A: General",
    "date": "2023-03-25",
    "doi": "10.1016/j.apcata.2023.119082",
    "abstract": "",
    "uri": "https://api.elsevier.com/content/article/pii/S0926860X23000625",
    "pii": "S0926860X23000625"
  },
  "fulltext": {
    "full-text-retrieval-response": {
      "scopus-eid": "2-s2.0-85147412211",
      "originalText": "serial JL 271346 291210 291744 291809 31 Applied Catalysis A: General APPLIEDCATALYSISAGENERAL 2023-02-04 2023-02-04 2023-02-06 2023-02-06 2023-09-04T16:53:03 1-s2.0-S0926860X23000625 S0926-860X(23)00062-5 S0926860X23000625 10.1016/j.apcata.2023.119082 S300 S300.1 FULL-TEXT 1-s2.0-S0926860X23X00052 2024-01-01T12:35:59.692098Z 0 0 20230325 2023 2023-02-04T01:22:15.078276Z absattachment articleinfo articlenumber articletitlenorm authfirstinitialnorm authfirstsurnamenorm cid cids contenttype copyright crossmark dateloaded dateloadedtxt datesearch datesort dateupdated dco docsubtype doctype doi eid ewtransactionid hubeid indexeddate issn issnnorm itemstage itemtransactionid itemweight openaccess openarchive pg pgfirst pii piinorm pubdatestart pubdatetxt pubyr sortorder srctitle srctitlenorm srctype ssids alllist content subj subheadings suppl tomb volfirst volissue volumelist webpdf webpdfpagecount yearnav figure table body mmlmath acknowledge affil articletitle auth authfirstini authfull authkeywords authlast grantnumber grantsponsor grantsponsorid highlightsabst orcid primabst ref specialabst vitae 0926-860X 0926860X true 654 654 C Volume 654 4 119082 119082 119082 20230325 25 March 2023 2023-03-25 2023 article fla © 2023 Elsevier B.V. All rights reserved. CANACHIEVEEFFICIENTPHOTOCATALYTICPARTIALOXIDATIONMETHANEMETHANOLAPERSPECTIVEOXYGENREACTIONPATHWAYS WANG Z 1 Introduction 2 Fundamentals of photocatalytic methane oxidation to methanol 3 The oxygen sources of methanol from POM 3.1 Photocatalytic POM to methanol with O2 3.1.1 Semiconductor/metal cocatalyst systems 3.1.2 Bismuth-based photocatalyst systems 3.2 Photocatalytic POM to methanol with H2O 3.2.1 WO3 systems 3.2.2 Bismuth-based photocatalyst systems 3.2.3 Zeolite system 3.2.4 Composite photocatalyst systems 3.3 Photocatalytic POM to methanol with H2O and O2 3.4 Photocatalytic POM to methanol with H2O2 3.4.1 Externally added H2O2 3.4.2 In-situ produced H2O2 3.5 Photocatalytic POM to methanol with NOx 4 Challenges and future perspectives CRediT authorship contribution statement Acknowledgements References MCFARLAND 2012 340 342 E SCHWACH 2017 8497 8520 P AGARWAL 2017 223 227 N OH 2021 119653 C SONG 2019 1606 1636 H ZHOU 2019 506 Y OLAHANGEW 2005 2636 2639 G YU 2022 16 22 D TANG 2014 2580 2591 P RAVI 2017 16464 16483 M RAVI 2019 485 494 M TIAN 2021 3526 3541 Y VILLA 2021 2023 2033 K CHEN 2016 12273 X YU 2019 700 X LI 2019 469 475 Z SONG 2019 20507 20515 H LUO 2022 740 750 L HOFFMANN 1995 69 96 M SONG 2020 14318 14326 H FENG 2021 4652 N XIE 2022 1375 P FAN 2021 509 515 Y DEOLIVEIRA 2022 121827 J GONDAL 2004 372 377 M VILLA 2015 200 203 K VILLA 2016 30 36 K HAMEED 2014 327 335 A COOPER 2015 2969 2974 J PARK 2013 2321 2337 Y ZHU 2018 6683 6691 W MURCIALOPEZ 2014 3013 3019 S WECKHUYSEN 2015 7022 7024 B MURCIALOPEZ 2017 2878 2885 S LU 2021 10271 10366 H LUO 2021 1218 L AN 2022 B TAYLOR 2000 259 267 C XIE 2018 889 896 J ZENG 2022 120919 Y BAI 2020 954 S DASILVA 2022 7419 7422 M SHI 2020 2740 2753 S LIU 2015 970 974 J TABATA 2002 1 58 K MURCIALOPEZ 2015 7249 7252 S HU 2008 80 84 Y YANG 2020 117104 J VILLA 2015 150 155 K SUSHKEVICH 2017 523 527 V WANGX2023X119082 WANGX2023X119082XZ 2025-02-06T00:00:00.000Z 2025-02-06T00:00:00.000Z http://creativecommons.org/licenses/by-nc-nd/4.0/ © 2023 Elsevier B.V. All rights reserved. 2023-02-10T01:17:11.273Z http://vtw.elsevier.com/data/voc/AddOnTypes/50.7/aggregated-refined https://doi.org/10.15223/policy-017 https://doi.org/10.15223/policy-037 https://doi.org/10.15223/policy-012 https://doi.org/10.15223/policy-029 https://doi.org/10.15223/policy-004 item S0926-860X(23)00062-5 S0926860X23000625 1-s2.0-S0926860X23000625 10.1016/j.apcata.2023.119082 271346 2024-01-01T12:35:59.692098Z 2023-03-25 1-s2.0-S0926860X23000625-main.pdf https://s3-eu-west-1.amazonaws.com/prod-ucs-content-store-eu-west/content/pii:S0926860X23000625/MAIN/application/pdf/5d6f6d2a9188d3a25bee42a127492bea/main.pdf main.pdf pdf true 2883528 MAIN 9 1-s2.0-S0926860X23000625-main_1.png https://s3-eu-west-1.amazonaws.com/prod-ucs-content-store-eu-west/content/pii:S0926860X23000625/PREVIEW/image/png/9867b844c78154b05acf04cd933328cc/main_1.png main_1.png png 57858 849 656 IMAGE-WEB-PDF 1 1-s2.0-S0926860X23000625-gr4.jpg https://s3-eu-west-1.amazonaws.com/prod-ucs-content-store-eu-west/content/pii:S0926860X23000625/gr4/DOWNSAMPLED/image/jpeg/ec6a8914d5009fe67b10e7b40a64bb44/gr4.jpg gr4 gr4.jpg jpg 23027 322 376 IMAGE-DOWNSAMPLED 1-s2.0-S0926860X23000625-gr3.jpg https://s3-eu-west-1.amazonaws.com/prod-ucs-content-store-eu-west/content/pii:S0926860X23000625/gr3/DOWNSAMPLED/image/jpeg/e6c4d62228e00a137f8384c0ec7fc875/gr3.jpg gr3 gr3.jpg jpg 29615 269 678 IMAGE-DOWNSAMPLED 1-s2.0-S0926860X23000625-gr2.jpg https://s3-eu-west-1.amazonaws.com/prod-ucs-content-store-eu-west/content/pii:S0926860X23000625/gr2/DOWNSAMPLED/image/jpeg/f27045f26c6a2b55d901a236f4a2f272/gr2.jpg gr2 gr2.jpg jpg 19564 206 376 IMAGE-DOWNSAMPLED 1-s2.0-S0926860X23000625-ga1.jpg https://s3-eu-west-1.amazonaws.com/prod-ucs-content-store-eu-west/content/pii:S0926860X23000625/ga1/DOWNSAMPLED/image/jpeg/3efcc286f123bf3fb52ffde99de00a94/ga1.jpg ga1 true ga1.jpg jpg 11079 245 273 IMAGE-DOWNSAMPLED 1-s2.0-S0926860X23000625-gr1.jpg https://s3-eu-west-1.amazonaws.com/prod-ucs-content-store-eu-west/content/pii:S0926860X23000625/gr1/DOWNSAMPLED/image/jpeg/e21979ca1c90cd3f80852ab21496b597/gr1.jpg gr1 gr1.jpg jpg 13877 235 376 IMAGE-DOWNSAMPLED 1-s2.0-S0926860X23000625-gr8.jpg https://s3-eu-west-1.amazonaws.com/prod-ucs-content-store-eu-west/content/pii:S0926860X23000625/gr8/DOWNSAMPLED/image/jpeg/38867681b0d3632059d83a6c7289739b/gr8.jpg gr8 gr8.jpg jpg 13222 318 376 IMAGE-DOWNSAMPLED 1-s2.0-S0926860X23000625-gr7.jpg https://s3-eu-west-1.amazonaws.com/prod-ucs-content-store-eu-west/content/pii:S0926860X23000625/gr7/DOWNSAMPLED/image/jpeg/63fba03f6d710c708fc8f5402a8588d0/gr7.jpg gr7 gr7.jpg jpg 48585 527 376 IMAGE-DOWNSAMPLED 1-s2.0-S0926860X23000625-gr6.jpg https://s3-eu-west-1.amazonaws.com/prod-ucs-content-store-eu-west/content/pii:S0926860X23000625/gr6/DOWNSAMPLED/image/jpeg/79864100c613e9788115984410b3a133/gr6.jpg gr6 gr6.jpg jpg 73535 544 678 IMAGE-DOWNSAMPLED 1-s2.0-S0926860X23000625-gr5.jpg https://s3-eu-west-1.amazonaws.com/prod-ucs-content-store-eu-west/content/pii:S0926860X23000625/gr5/DOWNSAMPLED/image/jpeg/fae8fdcae1962f2c561b0cccd93601fa/gr5.jpg gr5 gr5.jpg jpg 14737 148 376 IMAGE-DOWNSAMPLED 1-s2.0-S0926860X23000625-gr4.sml https://s3-eu-west-1.amazonaws.com/prod-ucs-content-store-eu-west/content/pii:S0926860X23000625/gr4/THUMBNAIL/image/gif/87de28e5e09f879257e2e0e48d552acf/gr4.sml gr4 gr4.sml sml 7887 164 191 IMAGE-THUMBNAIL 1-s2.0-S0926860X23000625-gr3.sml https://s3-eu-west-1.amazonaws.com/prod-ucs-content-store-eu-west/content/pii:S0926860X23000625/gr3/THUMBNAIL/image/gif/ee94744da4281df02fc06f6f4bf508ec/gr3.sml gr3 gr3.sml sml 4829 87 219 IMAGE-THUMBNAIL 1-s2.0-S0926860X23000625-gr2.sml https://s3-eu-west-1.amazonaws.com/prod-ucs-content-store-eu-west/content/pii:S0926860X23000625/gr2/THUMBNAIL/image/gif/d663150668f4cd0d40b63f947e0833e1/gr2.sml gr2 gr2.sml sml 6953 120 219 IMAGE-THUMBNAIL 1-s2.0-S0926860X23000625-ga1.sml https://s3-eu-west-1.amazonaws.com/prod-ucs-content-store-eu-west/content/pii:S0926860X23000625/ga1/THUMBNAIL/image/gif/219f653e1815e3599f683f4b3f06027f/ga1.sml ga1 true ga1.sml sml 9720 164 183 IMAGE-THUMBNAIL 1-s2.0-S0926860X23000625-gr1.sml https://s3-eu-west-1.amazonaws.com/prod-ucs-content-store-eu-west/content/pii:S0926860X23000625/gr1/THUMBNAIL/image/gif/17e776ab12ba3a042088803f1468218f/gr1.sml gr1 gr1.sml sml 6545 137 219 IMAGE-THUMBNAIL 1-s2.0-S0926860X23000625-gr8.sml https://s3-eu-west-1.amazonaws.com/prod-ucs-content-store-eu-west/content/pii:S0926860X23000625/gr8/THUMBNAIL/image/gif/01040012d43cbe6e4d2a2a874250f603/gr8.sml gr8 gr8.sml sml 3354 164 194 IMAGE-THUMBNAIL 1-s2.0-S0926860X23000625-gr7.sml https://s3-eu-west-1.amazonaws.com/prod-ucs-content-store-eu-west/content/pii:S0926860X23000625/gr7/THUMBNAIL/image/gif/ff61a1ee2435759000ec5807dc925434/gr7.sml gr7 gr7.sml sml 8324 164 117 IMAGE-THUMBNAIL 1-s2.0-S0926860X23000625-gr6.sml https://s3-eu-west-1.amazonaws.com/prod-ucs-content-store-eu-west/content/pii:S0926860X23000625/gr6/THUMBNAIL/image/gif/d3073f609dc26721e154e5897d3c7134/gr6.sml gr6 gr6.sml sml 9417 164 204 IMAGE-THUMBNAIL 1-s2.0-S0926860X23000625-gr5.sml https://s3-eu-west-1.amazonaws.com/prod-ucs-content-store-eu-west/content/pii:S0926860X23000625/gr5/THUMBNAIL/image/gif/92ed248cb3fece630f3f73b2090972e7/gr5.sml gr5 gr5.sml sml 6197 86 219 IMAGE-THUMBNAIL 1-s2.0-S0926860X23000625-gr4_lrg.jpg https://s3-eu-west-1.amazonaws.com/prod-ucs-content-store-eu-west/content/pii:S0926860X23000625/HIGHRES/image/jpeg/9c3b03950dc2b8e07204ff5707af4347/gr4_lrg.jpg gr4 gr4_lrg.jpg jpg 103481 1426 1663 IMAGE-HIGH-RES 1-s2.0-S0926860X23000625-gr3_lrg.jpg https://s3-eu-west-1.amazonaws.com/prod-ucs-content-store-eu-west/content/pii:S0926860X23000625/HIGHRES/image/jpeg/aff02a97127c4fb6b36de663babcd230/gr3_lrg.jpg gr3 gr3_lrg.jpg jpg 126908 1188 2994 IMAGE-HIGH-RES 1-s2.0-S0926860X23000625-gr2_lrg.jpg https://s3-eu-west-1.amazonaws.com/prod-ucs-content-store-eu-west/content/pii:S0926860X23000625/HIGHRES/image/jpeg/6ce84fe031f66df92fe87d7441f15b05/gr2_lrg.jpg gr2 gr2_lrg.jpg jpg 91017 913 1663 IMAGE-HIGH-RES 1-s2.0-S0926860X23000625-ga1_lrg.jpg https://s3-eu-west-1.amazonaws.com/prod-ucs-content-store-eu-west/content/pii:S0926860X23000625/HIGHRES/image/jpeg/121caab894d9763784464fb66d65d2fc/ga1_lrg.jpg ga1 true ga1_lrg.jpg jpg 89269 1085 1211 IMAGE-HIGH-RES 1-s2.0-S0926860X23000625-gr1_lrg.jpg https://s3-eu-west-1.amazonaws.com/prod-ucs-content-store-eu-west/content/pii:S0926860X23000625/HIGHRES/image/jpeg/3d8448256d2da21404b5aeb54748ffc6/gr1_lrg.jpg gr1 gr1_lrg.jpg jpg 75223 1040 1663 IMAGE-HIGH-RES 1-s2.0-S0926860X23000625-gr8_lrg.jpg https://s3-eu-west-1.amazonaws.com/prod-ucs-content-store-eu-west/content/pii:S0926860X23000625/HIGHRES/image/jpeg/16ed13f9e64b9c9be2999b5b52de26d1/gr8_lrg.jpg gr8 gr8_lrg.jpg jpg 63601 1407 1663 IMAGE-HIGH-RES 1-s2.0-S0926860X23000625-gr7_lrg.jpg https://s3-eu-west-1.amazonaws.com/prod-ucs-content-store-eu-west/content/pii:S0926860X23000625/HIGHRES/image/jpeg/05c1d6d8865a795ee2c19a2d8277e286/gr7_lrg.jpg gr7 gr7_lrg.jpg jpg 218942 2332 1663 IMAGE-HIGH-RES 1-s2.0-S0926860X23000625-gr6_lrg.jpg https://s3-eu-west-1.amazonaws.com/prod-ucs-content-store-eu-west/content/pii:S0926860X23000625/HIGHRES/image/jpeg/b02c34155ca680bdfd23b3705cfbafda/gr6_lrg.jpg gr6 gr6_lrg.jpg jpg 378397 2402 2994 IMAGE-HIGH-RES 1-s2.0-S0926860X23000625-gr5_lrg.jpg https://s3-eu-west-1.amazonaws.com/prod-ucs-content-store-eu-west/content/pii:S0926860X23000625/HIGHRES/image/jpeg/d1a8bdcd0ea21bb2ddd298706f98edd7/gr5_lrg.jpg gr5 gr5_lrg.jpg jpg 70111 656 1663 IMAGE-HIGH-RES 1-s2.0-S0926860X23000625-si0001.svg https://s3-eu-west-1.amazonaws.com/prod-ucs-content-store-eu-west/content/pii:S0926860X23000625/image/svg+xml/6370227f38df08cf3800bfb7c847e2f8/si0001.svg si0001 si0001.svg svg 3213 ALTIMG 1-s2.0-S0926860X23000625-si0002.svg https://s3-eu-west-1.amazonaws.com/prod-ucs-content-store-eu-west/content/pii:S0926860X23000625/image/svg+xml/23f390274498c8d0789b83b7c6efecdd/si0002.svg si0002 si0002.svg svg 2621 ALTIMG 1-s2.0-S0926860X23000625-si0003.svg https://s3-eu-west-1.amazonaws.com/prod-ucs-content-store-eu-west/content/pii:S0926860X23000625/image/svg+xml/b16d3bcc249d541c9b28ef14cbe28194/si0003.svg si0003 si0003.svg svg 3302 ALTIMG 1-s2.0-S0926860X23000625-si0004.svg https://s3-eu-west-1.amazonaws.com/prod-ucs-content-store-eu-west/content/pii:S0926860X23000625/image/svg+xml/07a1783300568fb80c90e10332cd5535/si0004.svg si0004 si0004.svg svg 3140 ALTIMG 1-s2.0-S0926860X23000625-si0005.svg https://s3-eu-west-1.amazonaws.com/prod-ucs-content-store-eu-west/content/pii:S0926860X23000625/image/svg+xml/05823f5196969b2098366cbfbce10de1/si0005.svg si0005 si0005.svg svg 3367 ALTIMG 1-s2.0-S0926860X23000625-si0006.svg https://s3-eu-west-1.amazonaws.com/prod-ucs-content-store-eu-west/content/pii:S0926860X23000625/image/svg+xml/e360629e9dd3a1c288a8833b3362b258/si0006.svg si0006 si0006.svg svg 2370 ALTIMG 1-s2.0-S0926860X23000625-si0007.svg https://s3-eu-west-1.amazonaws.com/prod-ucs-content-store-eu-west/content/pii:S0926860X23000625/image/svg+xml/532664a217417b2c5fc2875c53d35654/si0007.svg si0007 si0007.svg svg 1713 ALTIMG 1-s2.0-S0926860X23000625-si0008.svg https://s3-eu-west-1.amazonaws.com/prod-ucs-content-store-eu-west/content/pii:S0926860X23000625/image/svg+xml/d4160ef941ede9af04f0dfd0b8a59d2f/si0008.svg si0008 si0008.svg svg 1576 ALTIMG 1-s2.0-S0926860X23000625-si0009.svg https://s3-eu-west-1.amazonaws.com/prod-ucs-content-store-eu-west/content/pii:S0926860X23000625/image/svg+xml/b64d4acec29edd65ea283323c5bd4080/si0009.svg si0009 si0009.svg svg 2763 ALTIMG 1-s2.0-S0926860X23000625-si0010.svg https://s3-eu-west-1.amazonaws.com/prod-ucs-content-store-eu-west/content/pii:S0926860X23000625/image/svg+xml/e9fc910f59eca2184fe4054015ddfa1f/si0010.svg si0010 si0010.svg svg 2528 ALTIMG 1-s2.0-S0926860X23000625-si0011.svg https://s3-eu-west-1.amazonaws.com/prod-ucs-content-store-eu-west/content/pii:S0926860X23000625/image/svg+xml/1e244fa627681a502e9a276047022604/si0011.svg si0011 si0011.svg svg 2593 ALTIMG 1-s2.0-S0926860X23000625-si0012.svg https://s3-eu-west-1.amazonaws.com/prod-ucs-content-store-eu-west/content/pii:S0926860X23000625/image/svg+xml/315745496078087cde90c97e20564bd3/si0012.svg si0012 si0012.svg svg 2107 ALTIMG 1-s2.0-S0926860X23000625-si0013.svg https://s3-eu-west-1.amazonaws.com/prod-ucs-content-store-eu-west/content/pii:S0926860X23000625/image/svg+xml/676f2cae7179537eb2f898b88bd4af37/si0013.svg si0013 si0013.svg svg 2929 ALTIMG 1-s2.0-S0926860X23000625-si0014.svg https://s3-eu-west-1.amazonaws.com/prod-ucs-content-store-eu-west/content/pii:S0926860X23000625/image/svg+xml/ceb69a18ebf0b99992758da8e111f0dd/si0014.svg si0014 si0014.svg svg 2208 ALTIMG 1-s2.0-S0926860X23000625-si0015.svg https://s3-eu-west-1.amazonaws.com/prod-ucs-content-store-eu-west/content/pii:S0926860X23000625/image/svg+xml/50157eeb3403fd77c37b2ef0f6bb3472/si0015.svg si0015 si0015.svg svg 1722 ALTIMG 1-s2.0-S0926860X23000625-si0016.svg https://s3-eu-west-1.amazonaws.com/prod-ucs-content-store-eu-west/content/pii:S0926860X23000625/image/svg+xml/1008be80c182c97e26b2383c9df02db0/si0016.svg si0016 si0016.svg svg 2358 ALTIMG 1-s2.0-S0926860X23000625-si0017.svg https://s3-eu-west-1.amazonaws.com/prod-ucs-content-store-eu-west/content/pii:S0926860X23000625/image/svg+xml/f613578a2d409930b15fe1509c704438/si0017.svg si0017 si0017.svg svg 1928 ALTIMG 1-s2.0-S0926860X23000625-si0018.svg https://s3-eu-west-1.amazonaws.com/prod-ucs-content-store-eu-west/content/pii:S0926860X23000625/image/svg+xml/6d006068f14e9fd3c26e84638d37716b/si0018.svg si0018 si0018.svg svg 2601 ALTIMG 1-s2.0-S0926860X23000625-si0019.svg https://s3-eu-west-1.amazonaws.com/prod-ucs-content-store-eu-west/content/pii:S0926860X23000625/image/svg+xml/0c8a2248a425c1c6ec70e9727b2ad52f/si0019.svg si0019 si0019.svg svg 2212 ALTIMG 1-s2.0-S0926860X23000625-si0020.svg https://s3-eu-west-1.amazonaws.com/prod-ucs-content-store-eu-west/content/pii:S0926860X23000625/image/svg+xml/eb49088c7f3767906714f74ce9bbf42d/si0020.svg si0020 si0020.svg svg 1936 ALTIMG 1-s2.0-S0926860X23000625-si0021.svg https://s3-eu-west-1.amazonaws.com/prod-ucs-content-store-eu-west/content/pii:S0926860X23000625/image/svg+xml/4f8f8c2c32fa61dfaead2bb7a55cae72/si0021.svg si0021 si0021.svg svg 2115 ALTIMG 1-s2.0-S0926860X23000625-si0022.svg https://s3-eu-west-1.amazonaws.com/prod-ucs-content-store-eu-west/content/pii:S0926860X23000625/image/svg+xml/36637df8dc2772d4daf957d1cca6d81f/si0022.svg si0022 si0022.svg svg 2354 ALTIMG 1-s2.0-S0926860X23000625-am.pdf https://s3-eu-west-1.amazonaws.com/prod-ucs-content-store-eu-west/content/egi:10ZPDJJL9F3/MAIN/application/pdf/dce28a194ac0f20f6dc207043c93586d/am.pdf am am.pdf pdf false 578350 AAM-PDF APCATA 119082 119082 S0926-860X(23)00062-5 10.1016/j.apcata.2023.119082 Elsevier B.V. Fig. 1 Fundamentals of photocatalytic methane oxidation to methanol. Fig. 1 Fig. 2 The reaction mechanism of ZnO loaded with suitable cocatalysts (Pt, Pd, Au, Ag) to promote the conversion of methane. Reprinted from [17] with permission of American Chemical Society. Fig. 2 Fig. 3 The reaction mechanism ZnO loaded with highly dispersed dual Au and Cu) to promote the conversion of methane. Reprinted from [18] with permission of American Chemical Society. Fig. 3 Fig. 4 The reaction mechanism Cu2@C3N4 photocatalyst for photocatalytic methane oxidation to methanol. Reprinted from [22] with permission of Springer Nature under the terms of the Creative Commons CC BY license. Fig. 4 Fig. 5 Proposed reaction pathway for the selective oxidation of methane to methanol on WO3 and WO3/F. Reprinted from [26] with permission of Elsevier B.V. Fig. 5 Fig. 6 Schematic of charge transfer during methane partial oxidation on 0.33 metalwt % FeOx/TiO2. Reprinted from [39] with permission of Springer Nature. Fig. 6 Fig. 7 (a) Scheme of DMC on SAs Rh-CeO2 NWs in the presence of H2O2, (b) reaction paths of DMC on SAs Rh-CeO2 NWs. Reprinted from [41] with permission of Springer Nature under the terms of the Creative Commons CC BY license. Fig. 7 Fig. 8 The mechanism of methane oxidation to methanol by Cu-PHI photocatalyst in Reference [42]. Fig. 8 Table 1 A summary of photocatalytic partial oxidation of methane to methanol. Table 1 O source Year Reaction condition Photocatalytic Performance T/℃ Light source Photocatalyst Methane conversion/ % Methanol selectivity/ % Methanol productivity/μmol g−1 h−1 Ref. O2 2019 25 ± 2 300 W Xe lamp (100 mW cm–2, 300–500 nm) 0.1 wt % Au/ZnO 0.4 68.6 5717.5 [17] 2022 25 300 W Xe lamp (450 mW cm−2) Au0.2Cu0.15–ZnO 79.2 8888.4 [18] 2020 25 ± 2 300 W Xe lamp (450 mW cm−2, 300–500 nm) Au-CoOx/TiO2 0.07 95.0 2540 [20] 2021 25 300 W Xe lamp (450 mW cm−2, 300–500 nm) Ag/TiO2 ∼80.0 4800 [21] 2022 50 300 W Xe lamp (100 mW cm−2, 420 nm) Cu2@C3N4 13.1 98.9 1,399,300 [22] 2021 65 Hg lamp (170 mW cm−2, 300–400 nm) q-BiVO4 96.6 370 [23] 2022 25 Six Philips 18 W lamps Bi2O3 65.0 3771 [24] H2O 2016 55 UVC–visible light ≥ 185 nm WO3/La 1 % ∼47.0 ∼17.3 [27] 2015 55 UVC–visible light 185 nm WO3/F 17.9 ∼8 [26] 2014 55 Argon ion laser 100 mJ WO3/Ag+ 480 [28] 2018 65 350 W Xe lamp BiVO4 thin platelets 0.87 58.2 65.7 [31] 2018 65 350 W Xe lamp BiVO4 thick platelets 0.72 85.7 79.2 [31] 2018 65 350 W Xe lamp BiVO4 bipyramids 0.96 85.0 111.9 [31] 2014 55 450 W Hg lamp ≥ 185 nm Bi2WO6 1.4 27.6 15.3 [32] 2017 70 450 W Hg lamp HBEA 41.2 10 [34] 2017 70 450 W Hg lamp V-HBEA 80.6 11.3 [34] 2017 70 450 W Hg lamp Bi-V-HBEA 81.3 10.7 [34] 2022 300 W Xe lamp ≥ 300 nm300 mW cm−2 RuO x /ZnO/CeO2 97.7 133.54 [8] O2 + H2O 2022 25 400–780 nm PMOF-RuFe(OH) 100.0 8810 ± 340 [37] 2021 90 0.4–1.2 W Xe lamp Au1/BP nanosheets 99.0 56.75 [36] H2O2 + H2O 2020 25 ± 1 300 W Xe lamp (82 mW cm−2 420–780 nm) 1.98 % FeOOH/m-WO3 91.0 211.2 [48] 2021 25 300 W Xe lamp （λ ≥ 420 nm） 0.1 wt % Au1/WO3 75.0 589.0 [40] 2018 25 300 W xenon lamp 0.33metal wt % FeO x /TiO2 15.0 90.0 350.0 [39] 2020 50 0.29 wt % Rh-CeO2 SAs 93.9 1231.7 [41] 2022 25 Visible-light irradiation 0.5 % metal loading Cu-PHI ∼11 725.0 [42] 2019 35 AM 1.5 G sunlight, > 420 nm visible light g-CN 140.0 [43] 2019 500 W Xe lamp (60 mm of spot diameter) Cu-0.5/PCN 24.5 [6] 2015 55 Hg lamp WO3/Fe3+ (1 mM) 58.5 115.0 [49] NO2 - 2015 25 ± 1 Hg lamp ≥ 185 nm BiVO4 ∼92.0 3.1 [46] NO 2008 21.85 Hg lamp > 270 nm 1.2 wt % V -MCM-41 (acid) 6.0 87.6 2.5 [47] Can we achieve efficient photocatalytic partial oxidation of methane to methanol: A perspective on oxygen reaction pathways Zitong Wang Conceptualization Writing – original draft Writing – review & editing Zhiwen Zhang Conceptualization Zhiliang Wang Conceptualization Funding acquisition Haijiao Lu Conceptualization Writing – review & editing Funding acquisition ⁎ Lianzhou Wang Writing – review & editing Funding acquisition ⁎ Nanomaterials Centre, School of Chemical Engineering, and Australian Institute for Bioengineering and Nanotechnology, The University of Queensland, St Lucia, QLD 4072, Australia Nanomaterials Centre, School of Chemical Engineering, and Australian Institute for Bioengineering and Nanotechnology, The University of Queensland St Lucia QLD 4072 Australia Nanomaterials Centre, School of Chemical Engineering, and Australian Institute for Bioengineering and Nanotechnology, The University of Queensland, St Lucia, QLD 4072, Australia ⁎ Corresponding authors. As the primary component of natural gas, methane is an essential raw material in chemical industries. Meanwhile, it is also a powerful greenhouse gas that causes severe global warming effects. On-site conversion of methane to value-added chemicals and fuels, especially transportable and storable methanol, is a dream reaction. However, traditional methane oxidation methods will consume huge amounts of energy and lead to carbon emission. Utilizing only renewable solar energy, photocatalysis has attracted increasing interest for methane oxidation to methanol due to its low energy consumption and environmental friendliness. In this work, a perspective on photocatalytic methane oxidation to methanol is proposed by analyzing the oxygen source of methanol, which can be a new strategy to modulate the methane oxidation reaction. It provides a new angle to understand the mechanism of the reaction, and inspirations for optimizing the efficiency and selectivity of methanol production from photocatalytic methane oxidation. Graphical Abstract ga1 Keywords Methane oxidation Photocatalysis Methanol production Oxygen source Selectivity Data Availability No data was used for the research described in the article. 1 Introduction Methane (CH4) is the primary constituent of natural gas. In the field of chemical industries, CH4 has been a critical raw material for manufacturing valuable chemicals [1–3]. However, methane has a significant impact on the environment and is the most abundant greenhouse gas second to carbon dioxide (CO2), with its impact on global warming 25 times that of CO2 [4]. What is more, as methane is mined primarily in remote areas, the gas must be transported over long distances. Liquification of methane gas is unavoidable for transportation considering its low boiling-point (109 K) at atmospheric pressure [5]. Therefore, on-site conversion of methane to value-added chemicals and fuels, especially transportable and storable derivatives, such as methanol (CH3OH), is highly desirable from the aspects of both chemical synthesis and environment [2,6]. Among various products of CH4 conversion, CH3OH is one of the most desirable products. It can act as a versatile C1 building block for higher-value chemicals in the chemical industry. What is more, it is also a promising fuel due to the high energy density [7,8]. Therefore, methane oxidation to methanol has attracted growing attention and is expected to have broad development prospects. From the perspective of chemical structure, methane has the strongest C-H bond among hydrocarbons (436 kJ mol−1). Therefore, breaking the C-H bond in methane is a significant challenge to synthesize other fuels from methane [9–11]. For CH4, the energy level of the highest occupied molecular orbital (HOMO) is low, and the lowest unoccupied molecular orbital (LUMO) is high. Therefore, it is difficult to remove the electrons from HOMO for oxidation and to donate electrons to LUMO for reduction, which means that CH4 is inherently extremely stable [6]. Thermal catalytic oxidation is the traditional method to achieve methane oxidation to methanol. However, thermal catalytic process is energy-intensive, and emits huge amounts of CO2, and has high risk of overoxidation. Electrocatalytic methane oxidation is another common method to oxidate methane to methanol. However, it needs expensive Pt as electrode, and generally consumes strong acids as electrolyte, both of which are undesirable in terms of cost and operation. In addition, the conversion rate and selectivity of methane are greatly affected by temperature, and there is unavoidable competition between water oxidation and methane overoxidation in electrocatalytic oxidation [6]. In comparison, photocatalytic partial oxidation of methane (POM) has some advantages over the thermocatalysis and electrocatalysis. First, photocatalytic POM utilizes only solar energy, which is a clean and direct energy source, without environmental impact of thermocatalysis or pre-conversion of other energy sources to electricity for electrocatalysis. Second, the conversion of methane does not vary greatly with temperature, allowing a mild synthetic process at room temperature with less energy input compared with high-temperature thermocatalytic synthesis. Third, the reaction system is of low cost and operation complexity. In this perspective, we will focus on the photocatalytic methanol production by POM. In recent years, some articles have reviewed the photocatalytic oxidation of methane to methanol. Tian et al. discussed photocatalysts, oxidants, sacrificial reagents, and CH4 activation mechanisms from the aspects of semiconductor systems and non-semiconductor systems [12]. Villa et al. summarized that the design of nanostructured photocatalysts have a significant impact on the oxidation of methane to methanol [13]. Although these reviews summarized some recent progress in photocatalytic methane oxidation to methanol, they do not specifically discuss the oxygen source of methanol in the methane oxidation process. In fact, oxygen source during methanol formation is key to understanding the reaction mechanism. In this perspective, the oxidants and oxygen sources (O2, H2O, H2O2, NOx, etc.) are discussed to provide a unique insight into the activation of CH4 and the selectivity of photocatalytic POM to CH3OH. 2 Fundamentals of photocatalytic methane oxidation to methanol The principle of photocatalysis is to use semiconductor materials to utilize light energy to drive chemical reactions. When light energy is greater than or equal to the energy gap of the semiconductor, the electrons in the valence band (VB) will be excited to the conduction band (CB). The electrons can a reduction reaction to happen on the condition that the reaction potential is less negative than the VB, and holes will oxidize substances with a less positive potential. Meanwhile, it is well known that recombination of electrons and holes will lead to a lower efficiency and productivity due to less reactive species for redox reactions. Without oxygen source in the system, the main products of photocatalytic methane oxidation are ethane and hydrogen, while with proper source of oxygen, liquid oxygenates (e.g. HCOOH, CH3OH, CH3OOH) can be obtained. However, care must be taken that highly active oxygen species on the surface of photocatalyst may result in overoxidation of methane to undesirable CO2/CO. In literature, O2, H2O, H2O2, and NOx have been demonstrated to be potential oxygen sources for methanol from photocatalytic methane oxidation. As illustrated in Fig. 1, the mechanism of these reactions generally involves the cleavage of C-H bond of CH4 to form •CH3 radical as a result of oxidation by holes, and the direct/indirect formation of •OH (H2O, H2O2, and NOx) or •OOH radical (O2) at the same time. The reaction of •CH3 radical and •OH or •OOH radical produces the dream product CH3OH or CH3OOH as primary product, and CH3OOH can be further reduced to generate CH3OH as final product. The source of oxygen in the methanol product has been mostly investigated by isotope labeling experiments, which can be identified in the following section. 3 The oxygen sources of methanol from POM 3.1 Photocatalytic POM to methanol with O2 3.1.1 Semiconductor/metal cocatalyst systems Studies have demonstrated that typical oxide semiconductors, such as ZnO and TiO2, loaded with metal cocatalysts, can activate O2 into highly reactive oxygen species, ultimately leading to serious overoxidation of CH4 [14–16]. However, in a recent work, ZnO photocatalysts loaded with suitable cocatalysts (Pt, Pd, Au, Ag) were designed to promote the conversion of methane to methanol [17]. At room temperature, O2 was the only oxidizer for methane oxidation in water. The surface-active oxygen (hole center) of photo-excited ZnO dominates the breakage of C–H bond in CH4 to •CH3 radical. It is critical to control the activation of O2 over cocatalysts to produce mild reactive oxygen species, •OOH radicals, with the assistance of protonation of water. This allows the selective generation of liquid oxygenates, and avoids overoxidation of CH4 to CO2 and CO. In addition, it was found that Pt and Pd were more selective for the production of CH3OH or H2O (4-electron process), compared with Au and Ag favorable for CH3OOH or H2O2 (2-electron process). The specific reaction process was shown in Fig. 2. In the isotope experiments, 100 % CH3 18OH was obtained with 18O2 and H2 16O in the reaction system, while no CH3 18OH was detected when using 16O2 and H2 18O. Therefore, it can be concluded that O in the CH3OH is entirely from O2 rather than H2O. More recently, ZnO photocatalysts loaded with highly dispersed dual Au and Cu have also been developed for photocatalytic POM to methanol [18]. Among all the samples of different Au:Cu ratios, Au0.2Cu0.15–ZnO has the highest selectivity of methanol and suppresses overoxidation of products. The mechanism is that Cu species play a role as photo-induced electron mediators to promote the activation of O2 to •OOH, and Au is an efficient hole acceptor to enhance H2O oxidation to •OH. As shown in Fig. 3, isotopic measurement revealed that O2 was the only oxygen source for CH3OH and other oxygenates, while H2O played a role to promote CH4 activation. However, the performance of ZnO is hampered by its stability. In this regard, TiO2 is a more promising photocatalyst for methane conversion to methanol, as it is very stable and has excellent catalytic performance [19]. Song et al. synthesized dual-cocatalyst (nanometals (Au, Pd, Ag, Pt) and cobalt oxide) modified TiO2 photocatalysts [20]. The photocatalysts can promote the conversion of methane to methanol at the room temperature. The nanometals can promote the separation of photo-excited electron and reduction of O2 to promote the conversion CH4 to CH3OH, while the CoO x prevents further oxidation of CH3OH to HCHO and CO2, which maintains the high selectivity of CH3OH. By isotope labelling, GC-MS spectra confirmed that O2 was the only oxygen source of the formed primary products (CH3OOH and CH3OH) in the reaction. Another recent study revealed that optimized {001}-dominated TiO2 with Ag cocatalyst had a durable CH3OH yield of 4.8 mmol g−1 h−1 and a selectivity of ∼80 %, which are much higher than those of {101}-dominated TiO2 with Ag cocatalyst [21]. This study provides inspiration for controlled CH4 reforming to CH3OH by regulating the generation of photo-induced oxygen vacancies. Interestingly, dimeric copper centers supported on graphitic carbon nitride (denoted as Cu2@C3N4) were synthesized for both thermocatalytic and photocatalytic POM [22]. Compared with thermocatalysis using H2O2 as oxidants, photocatalytic methane oxidation using Cu2@C3N4 utilizes O2, which will be reduced to peroxide species as oxidants for POM. In addition, the photon excitation is also believed to enhance the methane activation compared with the thermocatalytic process. The photoexcited electrons in the g-C3N4 substrate leads to the reduction of O2 to form H2O2, and H2O2 migrates onto the dicopper-oxo center activated to form • OOH or • OH. Meanwhile, the holes transfer from the g-C3N4 substrate to the dicopper-oxo center, where CH4 is activated and oxidized to form • CH3. Then, the oxygen species recombine with • CH3 to form methyl oxygenates. According to the reaction mechanism, the O in the CH3OH product comes from O2 ( Fig. 4). 3.1.2 Bismuth-based photocatalyst systems In recent years, bismuth-based photocatalysts have become attracted increasing interest. Bismuth photocatalysts have hybridized band structures between Bi 6 s and O 2p orbitals, the enhanced charge carrier mobility due to a less localized character of the s orbitals and a decrease in the band gap. BiVO4 is an n-type semiconductor with a narrow band gap energy (2.4–2.5 eV), which can absorb visible light up to 500 nm. Quantum-sized bismuth vanadate nanoparticles (q-BiVO4) have been demonstrated to be a promising photocatalyst for the conversion of methane to methanol [23]. Under visible light irradiation, q-BiVO4 is excited and produce • OH radical to break C-H bond of CH4, and the generated • CH3 radical reacts with proton and electron to produce CH3OH as the dominant product. It should be noticed that CH3OH will be further oxidized to HCHO under UV light irradiation. With an increasing volume of H2O, the selectivity of CH3OH increases from 20 % to 62.8 % with the yield of 6.8 mmol g−1, and less HCHO is formed. Therefore, increasing the volume of water solvent is an effective strategy to increase selectivity of methanol. Isotope tests revealed that the O in CH3OH product absolutely originated from O2 rather than H2O, indicating O2 as the only oxygen source for CH3OH formation. Apart from BiVO4, Bi2O3 is also a promising photocatalyst for CH4 oxidation, as its VB position is favorable to produce •OH (Eqs. (1)–(3)), which is beneficial for CH3OH formation and a CB unfavorable to produce O2•-, which is inclined to overoxidize CH4 [24]. CH4 oxidation with isotopically labeled oxygen (18O2) results revealed that O2 was the oxygen source for the CH3OH (Eqs. 4–5). (1) Bi 2 O 3 ( s ) → hv ( visible − light ) h + + e − (2) H 2 O + h + → OH ( aq ) ∙ + H + ( aq ) (3) CH 4 aq + OH aq ∙ → CH 3 aq ∙ + H 2 O l (4) CH 3 ( aq ) ∙ + O 2 ( g ) → CH 3 O 2 ( aq ) ∙ (5) CH 3 O 2 ( aq ) ∙ + OH ( aq ) ∙ → CH 3 OH ( aq ) 3.2 Photocatalytic POM to methanol with H2O 3.2.1 WO3 systems WO3 is a stable, safe, and moderate oxidizing semiconductor material, which can active the C-H in methane, and therefore, is a promising catalyst of methane oxidation to methanol. In comparison with TiO2 and NiO, WO3 showed the largest conversion rate of methane to methanol under UV laser irradiation [25]. In fact, the hydroxyl group on the surface of WO3 is the main reason for promoting methanol formation in photocatalytic methane oxidation. In order to study the importance of hydroxyl groups on WO3 surface for methane oxidation, WO3/F was used to evaluate the role of hydroxyl groups in methane oxidation [26]. Since free hydroxyl radicals (•OHfree) and hydroxyl radicals (•OHads) play different roles in the reactions, there are two possible mechanisms in the reaction system. In the first mechanism, the photo-generated holes react with H2O to produce •OHfree. Photo-generated holes or •OHfree can oxidize CH4 to CH3 •, CH3 • can reacts with H2O and •OHfree to produce CH3OH. In the second mechanism, the photo-generated holes react with H2O adsorbed on the WO3 surface to produce •OHads (Eqs. (6)–(10)). •OHads can oxidize CH4 to CH3 •, CH3 • can reacts with H2O and •OHads to produce CH3OH (Eqs. (11), (13)). In the process, •OHfree can promote to produce C2H6 in the system (Eq. (12)). (6) W O 3 → hv e CB − + h VB + (7) e CB − + H + → H . (8) H . + H . → H 2 (9) h VB + + H 2 O ads → H O ads . + H + (10) h VB + + H O ads − → H O ads . (11) CH 4 + H O ads . → CH 3 . + H 2 O (12) CH 3 . + CH 3 . → C 2 H 6 (13) CH 3 . + H 2 O ads → CH 3 OH + 1 2 H 2 Fluorination on WO3 surface has a negative impact on the production of methanol. As shown in Fig. 5, after fluorination, F occupies the location of •OH on the WO3 surface, and therefore the formation of CH3OH by •OH reacting with CH3 • was significantly decreased and CH3 • radicals easily couple to form C2H6. La doping on the mesoporous WO3 surface was reported to improve the selectivity and yield of methanol [27]. Compared with pure WO3, WO3/La has 50 % higher methanol selectivity, as La plays a multiple role in the system. First, La can prevent the structure being destroyed after removing silica support during the synthesis. Second, La can promote the adsorption of water on the surface of WO3, which can facilitate the formation of OH group and further the production of CH3OH. Ag+ impregnated WO3 was also prepared to explore the mechanism of methane conversion to methanol [28]. The production of H2 and concentration of •OH radicals increased when increasing the loading amount of Ag+ (0–5 %) on WO3 surface. The reason is that methanol molecules compete with water molecules for photo-generated holes, which results in its simultaneous degradation. Therefore, it is essential to remove methanol continuously to increase the yield of methanol and prevent the further oxidation of methanol after formation via POM. 3.2.2 Bismuth-based photocatalyst systems Among bismuth-based photocatalysts, Bi2WO6 and BiVO4 have been two of the most studied oxides for photocatalytic applications due to favorable properties [29,30]. It was observed that activity of BiVO4 microcrystals for photocatalytic POM to methanol showed facet-dependent phenomenon [31]. The results suggest that controlling the morphologies of microcrystals can tune the conversion of methane to methanol. Thick platelet and bipyramidal BiVO4 have a higher selectivity of methanol than thin platelet, with bipyramidal BiVO4 showing the highest selectivity and activity for methanol production. The bipyramids combine efficient extraction of holes from nearly the entire surface of the microcrystal and intermediate surface reactivity, leading to high selectivity for POM. Furthermore, the performance of bismuth-based photocatalysts, Bi2WO6, BiVO4, and coupled Bi2WO6/TiO2–P25 was compared for photocatalytic POM to methanol [32]. Results turned out that BiVO4 has the highest selectivity of methanol and better stability than Bi2WO6 and coupled Bi2WO6/TiO2–P25. Interestingly, although the methane conversion rate of coupled Bi2WO6/TiO2–P25 was higher than that of Bi2WO6, overoxidation of CH4 was more likely to occur, which was not desirable for methanol production. In addition, as Fe3+ can react with H2O2 to produce •OH, O2 can increase •OH concentration and increases availability of holes in the valence band, adding Fe3+ or O2 in the system also led to boosted methane conversion and unwished overoxidation. 3.2.3 Zeolite system Zeolites are porous aluminosilicates with special frameworks of regular channels and unique features favorable for industrial processes [33]. Some active guests can be put inside the framework of zeolite to improve the catalytic performance. Some heteroatoms, such as Ti, Cr, V, and Cu, have been dispersed into zeolites structure to make new photocatalyst. For example, V-containing β zeolites have been explored as photocatalyst to study the selectivity and yield of photocatalytic methane oxidation to methanol [34]. Beta zeolite (H-BEA) was proven to be the efficient photocatalyst material for the oxidation of methane. The addition of V and Bi-V to the zeolite framework significantly decreases the amount of acid sites due to the formation of V2O5 on the surface, which is able to block the acid Al–O units and part of the Si–OH groups, thus improving the selectivity to less oxidized products (e.g. CH3OH). The most significant result was that BiVO4/V2O5/zeolite heterojunction showed a complete selectivity to methanol. 3.2.4 Composite photocatalyst systems Single-component photocatalysts suffer from many inherent drawbacks, such as narrow light absorption, high charge carrier recombination rate, and low quantum efficiency, and stability [35]. Therefore, some studies seek to fabricate composite photocatalyst systems to overcome the shortcomings. RuO x decorated ZnO/CeO2 photocatalyst was designed to promote the conversion of methane to methanol [8]. ZnO can active C-H in methane because of spontaneous polarization and prevent overoxidation of methane. CeO2 can improve the performance and stability of photocatalyst. RuO x clusters can reduce defects in ZnO/CeO2 to suppress the CO generation and facilitate the generation of hydroxyl radical (•OH) which can effectively activate CH4 and avoid overoxidation. As a result, a high selectivity of 98 % was achieved for photocatalytic CH4 oxidation to methanol. 3.3 Photocatalytic POM to methanol with H2O and O2 Au single atoms modified black phosphorus (Au1/BP) nanosheets were synthesized for methane conversion to methanol [36]. O2 can be activated by BP in the dark (Eq. 14). The electrons from the VB of BP were excited by photons, reacted with O2 at the triplet ground states (3O2) and generated O2 − (Eq. 15). O2 − recombined the photo-generated holes to form the excited O2 at the singlet states, 1O2. 1O2 reacted with H2O to form OH* and HOO* (can form •OH radicals by splitting, Eqs. (16)–(17)), and then react with CH4 to form water and CH3* stabilized by an Au atom (Eq. (18)). The combination of OH* and CH3* on the Au atom led to the formation of CH3OH (Eq. (19)) with an energy barrier of 1.10 eV, which was identified as the rate-limiting step of the reaction. Isotopic labelling experiment was carried out to detect oxygen source of CH3OH by using H2 18O and 32O2. It turned out that both CH3 18OH and CH3 16OH were detected, suggesting that both H2O and O2 were oxygen sources of CH3OH in this system. (14) O 2 + 3 P → P = O + P − O − P (15) O 2 3 e − → O 2 − (16) O 2 1 H 2 O → HO O * + O H * (17) HO O * → ∙ OH + O * (18) CH 4 * + P = O → CH 3 * + P − OH (19) CH 3 * + O H * → CH 3 OH A photocatalyst consisted of mono-iron hydroxyl sites within a metal–organic framework (PMOF-RuFe(OH)) has been developed to promote the conversion of methane to methanol under visible light [37]. With both H2O and O2 flowing, the selectivity of methanol was 100 %. Confined mono-iron hydroxyl sites can lower the barrier for C–H bond activation by binding CH4 through an [Fe–OH···CH4] intermediate. When H2O was absent or anhydrous benzene was used as solvent, CO2 was the only product of CH4 oxidation, suggesting overoxidation of CH4. When using H2O as solvent, the selectivity and yield of CH3OH increased. Using H2 18O/16O2 for isotopic labeling experiments further validated the involvement of both H2O and O2 in CH4 oxidation. 75 % of CH3 16OH and 25 % of CH3 18OH were detected, indicating both H2O and O2 provided oxygen for CH3OH product. 3.4 Photocatalytic POM to methanol with H2O2 For some photocatalysts, their band structures may not possess enough oxidizing potential to generate hydroxyl radicals (·OH) from water. In this scenario, it can be an effective strategy to involve H2O2 to produce·OH radicals for methane oxidation, as reported by Taylor and Noceti in 2020 [38]. H2O2 can be either externally added to the system or in-situ produced by photocatalytic reaction, such as water oxidation. It should be noted that an appropriate amount of·OH (externally added) or a gentle path to produce·OH (in-situ produced) should be the key factors for selective POM to methanol [6]. 3.4.1 Externally added H2O2 Fe cocatalyst loaded onto anatase TiO2 was synthesized using a rapid and facile impregnation method [39]. Due to the lower CB potential of iron oxide than TiO2, photo-generated electrons of TiO2 transferred to the CB of iron oxide. After reduction by the electron on iron oxide, H2O2 was decomposed into a ·OH radical and OH- ion. Meanwhile, CH4 reacted with photo-generated holes in the VB of TiO2 to form methyl radicals (·CH3), which further combined with ·OH radical to form CH3OH ( Fig. 6). In this system, ·OH radical from H2O2 is the main oxygen source for methanol. Similarly, dispersed amorphous FeOOH coupling with ordered mesoporous WO3 (m-WO3) was synthesized on KIT-6 silica hard template. Photo-induced holes on the VB of m-WO3 can active the methane to produce methyl radicals (·CH3), while photo-induced holes on FeOOH can decompose H2O2 to produce hydroxyl radicals (·OH). ·OH radical was the main oxidant to produce methanol, and the oxygen source of CH3OH was dominantly H2O2. In addition, dispersed gold on the tungsten trioxide (Au1/WO3) exhibited similar reaction steps on the Au1/WO3 surface for photocatalytic CH4 oxidation to CH3OH [40]. It is worth mentioning that the Au1 species have the tip-enhanced local electrons field to promote C-H cleavage to produce methanol. In addition, as CH3OH has a low adsorption energy on Au1, CH3OH overoxidation was avoided and thus the selectivity of CH3OH was increased. Interestingly, H2O2 can decompose into ∙OH on two neighboring Ce (III) atoms and decompose into ∙OOH on Ce (IV) in cerium dioxide (CeO2) nanowires supported rhodium (Rh) single-atom (SAs Rh-CeO2 NWs) [41]. ∙H radical will combine with lattice O of CeO2 ([O]) connected with the Ce (IV) in CeO2 NWs to form ∙[O]H. The adsorbed CH4 on Rh SAs can be oxidized by ∙OH radical into ∙CH3 and H2O. Then, CH3OOH and CH3[O]H will be formed through ∙CH3 reacting with the ∙OOH and ∙[O]H radicals. According to the reaction mechanism, the oxygen sources of CH3OOH and CH3[O]H are both H2O2 and lattice O. The reaction process was illustrated in Fig. 7. Highly dispersed transition metal atoms (Fe, Co, Cu) on crystalline carbon nitrides (PHI) were also prepared for photocatalytic POM in the presence of H2O2 at mild temperature [42]. After decomposition, H2O2 will form Cu-OH bond and ∙OH radicals. ∙OH radical will react with CH4 to form ∙CH3, and the Cu-OH bonds can react with ∙CH3 to produce CH3OH ( Fig. 8). The process can avoid the overoxidation of CH4 and thus increase the selectivity of CH3OH. In addition, study has reported that both H2O2 and H2O worked as the oxygen sources of CH3OH using fluffy free carbon nitride photocatalysts [43]. Isotope tracing experiments (H2 18O and H2 16O2) revealed that the ratio of CH3 18OH in the products was estimated to be 13.5 %. As H2O2 produces·OH very slowly, H2O has more opportunities to react with·CH3 radicals to produce CH3OH. 3.4.2 In-situ produced H2O2 Although it is a common strategy to obtain·OH radicals from the decomposition of externally added H2O2, it should be noted that only the catalyst-surface bound·OH species are mild enough to be highly selective for POM to methanol. Excess free·OH radicals may cause further oxidation or even mineralization [6]. Therefore, Zhou et al. introduce Cu species into polymeric carbon nitride (PCN) to form a unique photocatalyst (Cu-0.5/PCN) which can achieve in-situ generation (via water oxidation) and decomposition (to·OH radical) of H2O2 to control the amount of·OH radical [6]. As the holes in the VB of Cu-0.5/PCN cannot oxidize H2O into·OH, the generation of·OH was attributed to the decomposition of in-situ formed H2O2 by two-electron water oxidation pathway [44]. Although the main product using Cu-0.5/PCN is ethanol rather than methanol using pristine PCN, the strategy of in-situ producing H2O2 can be widely referenced and modulated for methane oxidation. 3.5 Photocatalytic POM to methanol with NOx It has been demonstrated in some experiments of thermocatalytic oxidation of methane that NOx may become possible oxidants to improve the selectivity of methanol in the process of oxidizing methane to methanol [45]. Nitrite ions (NO2 -) were utilized as oxidant to promote conversion of methane to methanol using BiVO4 photocatalyst [46]. As a UV filter, they have the function to slightly inhibit the photolysis of water, finally leading to the formation of ˙OH (Eqs. (20)–(21)). However, on the other hand, as a source and scavenger of free ˙OH radicals, they can balance the concentration of ˙OH (Eq. (22)) to avoid overoxidation and suppress the formation of ethane by coupling. (20) NO 2 − + hv → N ∙ + O ∙ − (21) O ∙ − + H 2 O ↔ OH ∙ + OH − (22) NO 2 − + OH ∙ → NO 2 ∙ + OH − What is more, NO has also been reported to provide O for photocatalytic POM to methanol, which turned out to be dependent on the local structure of the V-oxide species of designed V-MCM-41 (mesoporous molecular sieves) as photocatalyst [47]. In fact, the charge transfer excited states of the isolated tetrahedral V-oxide species supported on the catalyst surface provided active sites for photocatalytic POM to methanol. The state-of-the-art of photocatalytic POM to methanol from the perspective of oxygen source is summarized in Table 1. 4 Challenges and future perspectives The conversion of methane into methanol has been widely recognized as a dream reaction in chemical industry. Utilizing only solar energy to achieve this reaction can be a holy grail, in comparison with the high energy consumption and carbon emission of thermocatalysis, and the premature design and expensive noble-metal electrode of photoelectrocatalysis. Although the research in this direction is surging forward, it is still a significant challenge to achieve photocatalytic methane oxidation to methanol with high efficiency and selectivity. In this work, we provided a new perspective on photocatalytic methane oxidation to methanol. By analyzing the oxygen source of methanol product mostly by isotopic labeling experiments, the reaction mechanism can be better understood. It is clear that when no other oxygen-containing substances exist in the system, H2O is the only source of O in methanol product. However, although the oxygen source of methanol in most studies is only O2 when O2 is used as the oxidant with the presence of H2O, some studies show that a small part of the oxygen source comes from H2O. What is more, the oxygen source is mainly H2O2 when it is used as an oxidant, but there still exists a small portion of H2O originated methanol. However, when H2O is the only source of oxygen, heating is generally needed (55–70 ℃) and the productivity and efficiency of photocatalytic POM to methanol is low (<100 μmol g −1 h −1). In comparison, with O2 or H2O2 as the source of oxygen, the reaction can occur at room temperature with a much higher productivity (>2000 μmol g −1 h −1 (O2), 200–1000 μmol g −1 h −1 (externally added H2O2), and ∼20 μmol g −1 h −1 (in-situ produced H2O2)). What is more, the past 3 years have witnessed excitingly high selectivity (95–100 %) of methanol production from photocatalytic POM for some photocatalytic systems using these common oxygen sources. Meanwhile, NOx has also demonstrated some promise as oxygen source with methanol selectivity > 87 % despite low methanol productivity (< 5 μmol g −1 h −1). In a summary, seeing from the state-of-the-art, O2 seems to be the most promising source of oxygen from the aspects of both productivity and selectivity. However, future research on using O2 and other oxygen sources may provide further progress and new insights. However, due to technical limitations, the isotope is impure, and the concentration of the labeled isotope cannot reach 100 %. In addition, isotope exchange reaction is another important factor to influence the accuracy of isotope labelling in the experiments, lowering the temperature and optimizing the reaction device are effective ways to limit the isotope exchange reaction, but lowering the temperature will reduce the conversion rate of methane. Therefore, how to adjust the temperature to reduce the influence of isotope exchange reaction on the interpretation of oxygen source and reduce the influence on the reaction conversion rate is the problem worthy of discussion. Moreover, other catalytic processes, such as thermocatalysis, can provide reference for photocatalytic methane oxidation to methanol. For example, Cu-exchanged mordenite zeolite (CuMOR) catalyst was an excellent thermocatalyst, with the productivity stabilized at 0.202 mol CH3OH per mole Cu, and selectivity of methanol 97 % [50]. The study demonstrates that Cu-O-Cu core is the crucial in the catalytic process, and the reactive oxygen species in the Cu-O-Cu core can react with methane to generate methoxy groups and reduce Cu2+ to Cu1+. As mentioned above, Cu2@C3N4 can be used as both thermocatalyst and photocatalyst for methanol production from methane oxidation [22] and zeolite-based photocatalysts have been reported for POM to methanol [34]. We expect that interdisciplinary research will break through the bottlenecks of efficiency and selectivity of photocatalytic POM to methanol for practical implementation. CRediT authorship contribution statement Z.T. Wang, Conceptualization, Writing – original draft, Writing – review & editing. Z.W. Zhang: Conceptualization. Z.L. Wang: Conceptualization, Funding acquisition. H.J. Lu: Conceptualization, Writing – review & editing, Funding acquisition. L.Z. Wang: Writing – review & editing, Funding acquisition. Declaration of Competing Interest The authors declare that they have no known competing financial interests or personal relationships that could have appeared to influence the work reported in this paper. Acknowledgements The authors gratefully acknowledge the support from the Australian Research Council through its DECRA (DE210100930, DE230100357), Discovery Project (DP200101900), and Laureate Fellowship (FL190100139) schemes. Z. Wang acknowledges the financial support from Research Donation Generic (2020003431) from the Faculty of Engineering, Architecture and Information Technology, The University of Queensland. References [1] E. McFarland Science 338 2012 340 342 E. McFarland, Science, 338 (2012) 340–342. [2] P. Schwach X. Pan X. Bao Chem. Rev. 117 2017 8497 8520 P. Schwach, X. Pan, X. Bao, Chem. Rev. 117 (2017) 8497–8520. [3] N. Agarwal S.J. Freakley R.U. McVicker S.M. Althahban N. Dimitratos Q. He D.J. Morgan R.L. Jenkins D.J. Willock S.H. Taylor C.J. Kiely G.J. Hutchings Science 358 2017 223 227 N. Agarwal, S.J. Freakley, R.U. McVicker, S.M. Althahban, N. Dimitratos, Q. He, D.J. Morgan, R.L. Jenkins, D.J. Willock, S.H. Taylor, C.J. Kiely, G.J. Hutchings, Science 358 (2017) 223–227. [4] C. Oh J. Kim Y.J. Hwang M. Ma J.H. Park Appl. Catal. B: Environ. 283 2021 119653 C. Oh, J. Kim, Y.J. Hwang, M. Ma, J.H. Park, Appl. Catal. B: Environ. 283 (2021) 119653. [5] H. Song X.G. Meng Z.J. Wang H.M. Liu J.H. Ye Joule 3 2019 1606 1636 H. Song, X.G. Meng, Z.J. Wang, H.M. Liu, J.H. Ye, Joule 3 (2019) 1606–1636. [6] Y.Y. Zhou L. Zhang W.Z. Wang Nat. Commun. 10 2019 506 Y.Y. Zhou, L. Zhang, W.Z. Wang, Nat. Commun. 10 (2019) 506. [7] G.A. Olah Angew Chem. Int. Ed. 44 2005 2636 2639 G.A. Olah, Angew. Chem. Int. Ed. 44 (2005) 2636–2639. [8] D. Yu Y.Y. Jia Z. Yang H.W. Zhang J.W. Zhao Y.B. Zhao B. Weng W.X. Dai Z.H. Li P.Z. Wang J.A. Steele M.B.J. Roeffaers S. Dai H.W. Huang J.L. Long ACS Sustain. Chem. Eng. 10 2022 16 22 D. Yu, Y.Y. Jia, Z. Yang, H.W. Zhang, J.W. Zhao, Y.B. Zhao, B. Weng, W.X. Dai, Z.H. Li, P.Z. Wang, J.A. Steele, M.B.J. Roeffaers, S. Dai, H.W. Huang, J.L. Long, ACS Sustain. Chem. Eng. 10 (2022) 16–22. [9] P. Tang Q.J. Zhu Z.X. Wu D. Ma Energy Environ. Sci. 7 2014 2580 2591 P. Tang, Q.J. Zhu, Z.X. Wu, D. Ma, Energy Environ. Sci. 7 (2014) 2580–2591. [10] M. Ravi M. Ranocchiari J.A. van Bokhoven Angew. Chem. Int. Ed. 56 2017 16464 16483 M. Ravi, M. Ranocchiari, J.A. van Bokhoven, Angew. Chem. Int. Ed. 56 (2017) 16464–16483. [11] M. Ravi V.L. Sushkevich A.J. Knorpp M.A. Newton D. Palagin A.B. Pinar M. Ranocchiari J.A. van Bokhoven Nat. Catal. 2 2019 485 494 M. Ravi, V.L. Sushkevich, A.J. Knorpp, M.A. Newton, D. Palagin, A.B. Pinar, M. Ranocchiari, J.A. van Bokhoven, Nat. Catal. 2 (2019) 485–494. [12] Y.D. Tian L.Y. Piao X.B. Chen Green Chem. 23 2021 3526 3541 Y.D. Tian, L.Y. Piao, X.B. Chen, Green Chem. 23 (2021) 3526–3541. [13] K. Villa J.R. Galán-Mascarós ChemSusChem 14 2021 2023 2033 B.S. Liu, H. Wu, I.P. Parkin, A.C.S. Omega, 5 (2020) 14847–14856. [14] X. Chen Y. Li X. Pan D. Cortie X. Huang Z. Yi Nat. Commun. 7 2016 12273 X. Chen, Y. Li, X. Pan, D. Cortie, X. Huang, Z. Yi, Nat. Commun. 7 (2016) 12273. [15] X. Yu V. De Waele A. Lofberg V. Ordomsky A.Y. Khodakov Nat. Commun. 10 2019 700 X. Yu, V. De Waele, A. Lofberg, V. Ordomsky, A.Y. Khodakov, Nat. Commun. 10 (2019) 700. [16] Z.H. Li X.Y. Pan Z.G. Yi. J Mater. Chem. A 7 2019 469 475 Z.H. Li, X.Y. Pan, Z.G. Yi. J, Mater. Chem. A 7 (2019) 469–475. [17] H. Song X.G. Meng S.Y. Wang W. Zhou X.S. Wang T. Kako J.H. Ye J. Am. Chem. Soc. 141 2019 20507 20515 H. Song, X.G. Meng, S.Y. Wang, W. Zhou, X.S. Wang, T. Kako, J.H. Ye, J. Am. Chem. Soc. 141 (2019) 20507–20515. [18] L. Luo Z.Y. Gong Y.X. Xu J.N. Ma H.F. Liu J.L. Xing J.W. Tang J. Am. Chem. Soc. 144 2022 740 750 L. Luo, Z.Y. Gong, Y.X. Xu, J.N. Ma, H.F. Liu, J.L. Xing, J.W. Tang, J. Am. Chem. Soc. 144 (2022) 740–750. [19] M.R. Hoffmann S.T. Martin W.Y. Choi D.W. Bahnemann Chem. Rev. 95 1995 69 96 M.R. Hoffmann, S.T. Martin, W.Y. Choi, D.W. Bahnemann, Chem. Rev. 95 (1995) 69–96. [20] H. Song X.G. Meng S.Y. Wang W. Zhou S. Song T. Kako J.H. Ye ACS Catal. 10 2020 14318 14326 H. Song, X.G. Meng, S.Y. Wang, W. Zhou, S. Song, T. Kako, J.H. Ye, ACS Catal. 10 (2020) 14318–14326. [21] N.D. Feng H.W. Lin H. Song L.X. Yang D.M. Tang F. Deng J.H. Ye Nat. Commun. 12 2021 4652 N.D. Feng, H.W. Lin, H. Song, L.X. Yang, D.M. Tang, F. Deng, J.H. Ye, Nat. Commun. 12 (2021) 4652. [22] P.F. Xie J. Ding Z.H. Yao T.C. Pu P. Zhang Z.N. Huang C.H. Wang J.L. Zhang N. Zecher-Freeman H. Zong D.S. Yuan S.W. Deng R. Shahbazian-Yassar C. Wang Nat. Commun. 13 2022 1375 P.F. Xie, J. Ding, Z.H. Yao, T.C. Pu, P. Zhang, Z.N. Huang, C.H. Wang, J.L. Zhang, N. Zecher-Freeman, H. Zong, D.S. Yuan, S.W. Deng, R. Shahbazian-Yassar, C. Wang, Nat. Commun. 13 (2022) 1375. [23] Y.Y. Fan W.C. Zhou X.Y. Qiu H.D. Li Y.H. Jiang Z.H. Sun D.X. Han L. Niu Z.Y. Tang Nat. Sustain. 4 2021 509 515 Y.Y. Fan, W.C. Zhou, X.Y. Qiu, H.D. Li, Y.H. Jiang, Z.H. Sun, D.X. Han, L. Niu, Z.Y. Tang, Nat. Sustain. 4 (2021) 509–515. [24] J.A. de Oliveira J.C. da Cruz O.R. Nascimento C. Ribeiroa Appl. Catal. B: Environ. 318 2022 121827 J.A. de Oliveira, J.C. da Cruz, O.R. Nascimento, C. Ribeiroa, Appl. Catal. B: Environ. 318 (2022) 121827. [25] M.A. Gondal A. Hameed Z.H. Yamani A. Arfaj Chem. Phys. Lett. 392 2004 372 377 M.A. Gondal, A. Hameed, Z.H. Yamani, A. Arfaj, Chem. Phys. Lett. 392 (2004) 372–377. [26] K. Villa S. Murcia-Lopez T. Andreu J.R. Morante Catal. Commun. 58 2015 200 203 K. Villa, S. Murcia-Lopez, T. Andreu, J.R. Morante, Catal. Commun. 58 (2015) 200–203. [27] K. Villa S. Murcia-Lopez J.R. Morante T. Andreu Appl. Catal. B: Environ. 187 2016 30 36 K. Villa, S. Murcia-Lopez, J.R. Morante, T. Andreu, Appl. Catal. B: Environ. 187 (2016) 30–36. [28] A. Hameed I.M.I. Ismail M. Aslam M.A. Gondal Appl. Catal. A-Gen. 470 2014 327 335 A. Hameed, I.M.I. Ismail, M. Aslam, M.A. Gondal, Appl. Catal. A-Gen. 470 (2014) 327–335. [29] J.K. Cooper S. Gul F.M. Toma L. Chen Y.S. Liu J.H. Guo J.W. Ager J. Yano I.D. Sharp J. Phys. Chem. C 119 2015 2969 2974 J.K. Cooper, S. Gul, F.M. Toma, L. Chen, Y.S. Liu, J.H. Guo, J.W. Ager, J. Yano, I.D. Sharp, J. Phys. Chem. C 119 (2015) 2969–2974. [30] Y. Park K.J. McDonald K.S. Choi Chem. Soc. Rev. 42 2013 2321 2337 Y. Park, K.J. McDonald, K.S. Choi, Chem. Soc. Rev. 42 (2013) 2321–2337. [31] W.L. Zhu M.K. Shen G.Z. Fan A. Yang J.R. Meyer Y.N. Ou B. Yin J. Fortner M. Foston Z.S. Li Z.G. Zou B. Sadtler ACS Appl. Nano Mater. 1 2018 6683 6691 W.L. Zhu, M.K. Shen, G.Z. Fan, A. Yang, J.R. Meyer, Y.N. Ou, B. Yin, J. Fortner, M. Foston, Z.S. Li, Z.G. Zou, B. Sadtler, ACS Appl. Nano Mater., 1 (2018) 6683–6691. [32] S. Murcia-Lopez K. Villa T. Andreu J.R. Morante ACS Catal. 4 2014 3013 3019 S. Murcia-Lopez, K. Villa, T. Andreu, J.R. Morante, ACS Catal. 4 (2014) 3013–3019. [33] B.M. Weckhuysen J.H. Yu Chem. Soc. Rev. 44 2015 7022 7024 B.M. Weckhuysen, J.H. Yu, Chem. Soc. Rev. 44 (2015) 7022–7024. [34] S. Murcia-Lopez M.C. Bacariza K. Villa J.M. Lopes C. Henriques J.R. Morante T. Andreu ACS Catal. 7 2017 2878 2885 S. Murcia-Lopez, M.C. Bacariza, K. Villa, J.M. Lopes, C. Henriques, J.R. Morante, T. Andreu, ACS Catal. 7 (2017) 2878–2885. [35] H. Lu J. Tournet K. Dastafkan Y. Liu Y.H. Ng S.K. Karuturi C. Zhao Z. Yin Chem. Rev. 121 2021 10271 10366 H. Lu, J. Tournet, K. Dastafkan, Y. Liu, Y.H. Ng, S.K. Karuturi, C. Zhao, Z. Yin, Chem. Rev. 121 (2021) 10271–10366. [36] L.H. Luo J. Luo H.L. Li F.N. Ren Y.F. Zhang A.D. Liu W.X. Li J. Zeng Nat. Commun. 12 2021 1218 L.H. Luo, J. Luo, H.L. Li, F.N. Ren, Y.F. Zhang, A.D. Liu, W.X. Li, J. Zeng, Nat. Commun. 12 (2021) 1218. [37] B. An Z. Li Z. Wang X.D. Zeng X. Han Y.Q. Cheng A.M. Sheveleva Z.Y. Zhang F. Tuna E.J.L. McInnes M.D. Frogley A.J. Ramirez-Cuesta L.S. Natrajan C. Wang W.N. Lin S.H. Yang M. Schroder Nat. Mater. 21 2022 959-959 B. An, Z. Li, Z. Wang, X.D. Zeng, X. Han, Y.Q. Cheng, A.M. Sheveleva, Z.Y. Zhang, F. Tuna, E.J.L. McInnes, M.D. Frogley, A.J. Ramirez-Cuesta, L.S. Natrajan, C. Wang, W.N. Lin, S.H. Yang, M. Schroder, Nat. Mater. 21 (2022) 959–959. [38] C.E. Taylor R.P. Noceti Catal. Today 55 2000 259 267 C.E. Taylor, R.P. Noceti, Catal. Today 55 (2000) 259–267. [39] J.J. Xie R.X. Jin A. Li Y.P. Bi Q.S. Ruan Y.C. Deng Y.J. Zhang S.Y. Yao G. Sankar D. Ma J.W. Tang Nat. Catal. 1 2018 889 896 J.J. Xie, R.X. Jin, A. Li, Y.P. Bi, Q.S. Ruan, Y.C. Deng, Y.J. Zhang, S.Y. Yao, G. Sankar, D. Ma, J.W. Tang, Nat. Catal. 1 (2018) 889–896. [40] Y. Zeng Z.Y. Tang X.Y. Wu A.H. Huang X. Luo G.Q. Xu Y.F. Zhu S.L. Wang Appl. Catal. B: Environ. 306 2022 120919 Y. Zeng, Z.Y. Tang, X.Y. Wu, A.H. Huang, X. Luo, G.Q. Xu, Y.F. Zhu, S.L. Wang, Appl. Catal. B: Environ. 306 (2022) 120919. [41] S.X. Bai F.F. Liu B.L. Huang F. Li H.P. Lin T. Wu M.Z. Sun J.B. Wu Q. Shao Y. Xu X.Q. Huang Nat. Commun. 11 2020 954 S.X. Bai, F.F. Liu, B.L. Huang, F. Li, H.P. Lin, T. Wu, M.Z. Sun, J.B. Wu, Q. Shao, Y. Xu, X.Q. Huang, Nat. Commun. 11 (2020), 954. [42] M.A.R. da Silva J.C. Gil N.V. Tarakina G.T.S.T. Silva J.B.G. Filho K. Krambrock M. Antonietti C. Ribeiro I.F. Teixeira Chem. Commun. 58 2022 7419 7422 M.A.R. da Silva, J.C. Gil, N.V. Tarakina, G.T.S.T. Silva, J.B.G. Filho, K. Krambrock, M. Antonietti, C. Ribeiro, I.F. Teixeira, Chem. Commun. 58 (2022) 7419–7422. [43] S.L. Shi Z.X. Sun C.Y. Bao T.S. Gao Y.H. Hu Int. J. Energy Res. 44 2020 2740 2753 S.L. Shi, Z.X. Sun, C.Y. Bao, T.S. Gao, Y.H. Hu, Int. J. Energy Res. 44 (2020) 2740–2753. [44] J. Liu Y. Liu N.Y. Liu Y.Z. Han X. Zhang H. Huang Y. Lifshitz S.T. Lee J. Zhong Z.H. Kang Science 347 2015 970 974 J. Liu, Y. Liu, N.Y. Liu, Y.Z. Han, X. Zhang, H. Huang, Y. Lifshitz, S.T. Lee, J. Zhong, Z.H. Kang, Science 347 (2015) 970–974. [45] K. Tabata Y. Teng T. Takemoto E. Suzuki M.A. Banares M.A. Pena J.L.G. Fierro Catal. Rev. 44 2002 1 58 K. Tabata, Y. Teng, T. Takemoto, E. Suzuki, M.A. Banares, M.A. Pena, J.L.G. Fierro, Catal. Rev. 44 (2002) 1–58. [46] S. Murcia-Lopez K. Villa T. Andreu J.R. Morante Chem. Commun. 51 2015 7249 7252 S. Murcia-Lopez, K. Villa, T. Andreu, J.R. Morante, Chem. Commun. 51 (2015) 7249–7252. [47] Y. Hu Y. Nagai D. Rahmawaty C.H. Wei M. Anpo Catal. Lett. 124 2008 80 84 Y. Hu, Y. Nagai, D. Rahmawaty, C.H. Wei, M. Anpo, Catal. Lett. 124 (2008) 80–84. [48] J. Yang J.Y. Hao J.P. Wei J. Dai Y. Li Fuel 266 2020 117104 J. Yang, J.Y. Hao, J.P. Wei, J. Dai, Y. Li, Fuel 266 (2020), 117104. [49] K. Villa S. Murcia-Lopez T. Andreu J.R. Morante Appl. Catal. B: Environ. 163 2015 150 155 K. Villa, S. Murcia-Lopez, T. Andreu, J.R. Morante, Appl. Catal. B: Environ. 163 (2015) 150–155. [50] V.L. Sushkevich D. Palagin M. Ranocchiari J.A. van Bokhoven Science 356 2017 523 527 V.L. Sushkevich, D. Palagin, M. Ranocchiari, J.A. van Bokhoven, Science 356 (2017) 523–527. Dr. Haijiao Lu obtained her bachelor’s degree in Science from Nankai University (China) and in Engineering from Tianjin University (China) in 2014. Supervised by Academician of Chinese Academy of Engineering Prof. Jingkang Wang, she obtained PhD degree from Tianjin University (China) in 2019. During her PhD, she also worked as a visiting PhD student at University of Cambridge (UK). She worked as a postdoctoral research fellow at the Australian National University in 2019-2021, and then at the University of Queensland (UQ) with Australian Laureate Fellow Prof. Lianzhou Wang from 2021. Her research is characterized by interdisciplinary feature, which lies at the intersection of materials science, photo(electro)catalysis, and chemical engineering. She has been working as an ARC DECRA Research Fellow at UQ from 2023. Lianzhou Wang is Professor and Australian Research Council (ARC) Australian Laureate Fellow in School of Chemical Engineering, Director of Nanomaterials Centre (Nanomac), and Senior Group Leader of Australian Institute for Bioengineering and Nanotechnology (AIBN), UQ. He received his PhD degree from Shanghai Institute of Ceramics, Chinese Academy of Sciences in 1999. Before joining UQ in 2004, he has worked at two leading national research institutions (NIMS and AIST) of Japan as a research fellow for five years. Since joining UQ, he has worked as ARC Queen Elizabeth II Fellow (2006), Senior Lecturer (2007), Associate Professor (2010), Professor (2012-now) and ARC Future Fellow (2012-2016), and is now an ARC Australian Laureate Fellow (2019-2024) at Chemical Engineering School and AIBN. Professor Wang's research focuses on the synthesis, characterization and application of semiconductor nanomaterials for use in renewable energy conversion/storage systems including photocatalysts for solar hydrogen and valuable chemical production, rechargeable batteries and low-cost solar cells.",
      "scopus-id": "85147412211",
      "coredata": {
        "eid": "1-s2.0-S0926860X23000625",
        "dc:description": "As the primary component of natural gas, methane is an essential raw material in chemical industries. Meanwhile, it is also a powerful greenhouse gas that causes severe global warming effects. On-site conversion of methane to value-added chemicals and fuels, especially transportable and storable methanol, is a dream reaction. However, traditional methane oxidation methods will consume huge amounts of energy and lead to carbon emission. Utilizing only renewable solar energy, photocatalysis has attracted increasing interest for methane oxidation to methanol due to its low energy consumption and environmental friendliness. In this work, a perspective on photocatalytic methane oxidation to methanol is proposed by analyzing the oxygen source of methanol, which can be a new strategy to modulate the methane oxidation reaction. It provides a new angle to understand the mechanism of the reaction, and inspirations for optimizing the efficiency and selectivity of methanol production from photocatalytic methane oxidation.",
        "openArchiveArticle": "false",
        "prism:coverDate": "2023-03-25",
        "openaccessUserLicense": null,
        "prism:aggregationType": "Journal",
        "prism:url": "https://api.elsevier.com/content/article/pii/S0926860X23000625",
        "dc:creator": [
          {
            "@_fa": "true",
            "$": "Wang, Zitong"
          },
          {
            "@_fa": "true",
            "$": "Zhang, Zhiwen"
          },
          {
            "@_fa": "true",
            "$": "Wang, Zhiliang"
          },
          {
            "@_fa": "true",
            "$": "Lu, Haijiao"
          },
          {
            "@_fa": "true",
            "$": "Wang, Lianzhou"
          }
        ],
        "link": [
          {
            "@_fa": "true",
            "@rel": "self",
            "@href": "https://api.elsevier.com/content/article/pii/S0926860X23000625"
          },
          {
            "@_fa": "true",
            "@rel": "scidir",
            "@href": "https://www.sciencedirect.com/science/article/pii/S0926860X23000625"
          }
        ],
        "dc:format": "application/json",
        "openaccessType": null,
        "pii": "S0926-860X(23)00062-5",
        "prism:volume": "654",
        "articleNumber": "119082",
        "prism:publisher": "Elsevier B.V.",
        "dc:title": "Can we achieve efficient photocatalytic partial oxidation of methane to methanol: A perspective on oxygen reaction pathways",
        "prism:copyright": "© 2023 Elsevier B.V. All rights reserved.",
        "openaccess": "0",
        "prism:issn": "0926860X",
        "dcterms:subject": [
          {
            "@_fa": "true",
            "$": "Methane oxidation"
          },
          {
            "@_fa": "true",
            "$": "Photocatalysis"
          },
          {
            "@_fa": "true",
            "$": "Methanol production"
          },
          {
            "@_fa": "true",
            "$": "Oxygen source"
          },
          {
            "@_fa": "true",
            "$": "Selectivity"
          }
        ],
        "openaccessArticle": "false",
        "prism:publicationName": "Applied Catalysis A: General",
        "openaccessSponsorType": null,
        "prism:pageRange": "119082",
        "pubType": "fla",
        "prism:coverDisplayDate": "25 March 2023",
        "prism:doi": "10.1016/j.apcata.2023.119082",
        "prism:startingPage": "119082",
        "dc:identifier": "doi:10.1016/j.apcata.2023.119082",
        "openaccessSponsorName": null
      },
      "objects": {
        "object": [
          {
            "@category": "standard",
            "@height": "322",
            "@width": "376",
            "@_fa": "true",
            "$": "https://api.elsevier.com/content/object/eid/1-s2.0-S0926860X23000625-gr4.jpg?httpAccept=%2A%2F%2A",
            "@multimediatype": "JPEG image file",
            "@type": "IMAGE-DOWNSAMPLED",
            "@size": "23027",
            "@ref": "gr4",
            "@mimetype": "image/jpeg"
          },
          {
            "@category": "standard",
            "@height": "269",
            "@width": "678",
            "@_fa": "true",
            "$": "https://api.elsevier.com/content/object/eid/1-s2.0-S0926860X23000625-gr3.jpg?httpAccept=%2A%2F%2A",
            "@multimediatype": "JPEG image file",
            "@type": "IMAGE-DOWNSAMPLED",
            "@size": "29615",
            "@ref": "gr3",
            "@mimetype": "image/jpeg"
          },
          {
            "@category": "standard",
            "@height": "206",
            "@width": "376",
            "@_fa": "true",
            "$": "https://api.elsevier.com/content/object/eid/1-s2.0-S0926860X23000625-gr2.jpg?httpAccept=%2A%2F%2A",
            "@multimediatype": "JPEG image file",
            "@type": "IMAGE-DOWNSAMPLED",
            "@size": "19564",
            "@ref": "gr2",
            "@mimetype": "image/jpeg"
          },
          {
            "@category": "standard",
            "@height": "245",
            "@width": "273",
            "@_fa": "true",
            "$": "https://api.elsevier.com/content/object/eid/1-s2.0-S0926860X23000625-ga1.jpg?httpAccept=%2A%2F%2A",
            "@multimediatype": "JPEG image file",
            "@type": "IMAGE-DOWNSAMPLED",
            "@size": "11079",
            "@ref": "ga1",
            "@mimetype": "image/jpeg"
          },
          {
            "@category": "standard",
            "@height": "235",
            "@width": "376",
            "@_fa": "true",
            "$": "https://api.elsevier.com/content/object/eid/1-s2.0-S0926860X23000625-gr1.jpg?httpAccept=%2A%2F%2A",
            "@multimediatype": "JPEG image file",
            "@type": "IMAGE-DOWNSAMPLED",
            "@size": "13877",
            "@ref": "gr1",
            "@mimetype": "image/jpeg"
          },
          {
            "@category": "standard",
            "@height": "318",
            "@width": "376",
            "@_fa": "true",
            "$": "https://api.elsevier.com/content/object/eid/1-s2.0-S0926860X23000625-gr8.jpg?httpAccept=%2A%2F%2A",
            "@multimediatype": "JPEG image file",
            "@type": "IMAGE-DOWNSAMPLED",
            "@size": "13222",
            "@ref": "gr8",
            "@mimetype": "image/jpeg"
          },
          {
            "@category": "standard",
            "@height": "527",
            "@width": "376",
            "@_fa": "true",
            "$": "https://api.elsevier.com/content/object/eid/1-s2.0-S0926860X23000625-gr7.jpg?httpAccept=%2A%2F%2A",
            "@multimediatype": "JPEG image file",
            "@type": "IMAGE-DOWNSAMPLED",
            "@size": "48585",
            "@ref": "gr7",
            "@mimetype": "image/jpeg"
          },
          {
            "@category": "standard",
            "@height": "544",
            "@width": "678",
            "@_fa": "true",
            "$": "https://api.elsevier.com/content/object/eid/1-s2.0-S0926860X23000625-gr6.jpg?httpAccept=%2A%2F%2A",
            "@multimediatype": "JPEG image file",
            "@type": "IMAGE-DOWNSAMPLED",
            "@size": "73535",
            "@ref": "gr6",
            "@mimetype": "image/jpeg"
          },
          {
            "@category": "standard",
            "@height": "148",
            "@width": "376",
            "@_fa": "true",
            "$": "https://api.elsevier.com/content/object/eid/1-s2.0-S0926860X23000625-gr5.jpg?httpAccept=%2A%2F%2A",
            "@multimediatype": "JPEG image file",
            "@type": "IMAGE-DOWNSAMPLED",
            "@size": "14737",
            "@ref": "gr5",
            "@mimetype": "image/jpeg"
          },
          {
            "@category": "thumbnail",
            "@height": "164",
            "@width": "191",
            "@_fa": "true",
            "$": "https://api.elsevier.com/content/object/eid/1-s2.0-S0926860X23000625-gr4.sml?httpAccept=%2A%2F%2A",
            "@multimediatype": "GIF image file",
            "@type": "IMAGE-THUMBNAIL",
            "@size": "7887",
            "@ref": "gr4",
            "@mimetype": "image/gif"
          },
          {
            "@category": "thumbnail",
            "@height": "87",
            "@width": "219",
            "@_fa": "true",
            "$": "https://api.elsevier.com/content/object/eid/1-s2.0-S0926860X23000625-gr3.sml?httpAccept=%2A%2F%2A",
            "@multimediatype": "GIF image file",
            "@type": "IMAGE-THUMBNAIL",
            "@size": "4829",
            "@ref": "gr3",
            "@mimetype": "image/gif"
          },
          {
            "@category": "thumbnail",
            "@height": "120",
            "@width": "219",
            "@_fa": "true",
            "$": "https://api.elsevier.com/content/object/eid/1-s2.0-S0926860X23000625-gr2.sml?httpAccept=%2A%2F%2A",
            "@multimediatype": "GIF image file",
            "@type": "IMAGE-THUMBNAIL",
            "@size": "6953",
            "@ref": "gr2",
            "@mimetype": "image/gif"
          },
          {
            "@category": "thumbnail",
            "@height": "164",
            "@width": "183",
            "@_fa": "true",
            "$": "https://api.elsevier.com/content/object/eid/1-s2.0-S0926860X23000625-ga1.sml?httpAccept=%2A%2F%2A",
            "@multimediatype": "GIF image file",
            "@type": "IMAGE-THUMBNAIL",
            "@size": "9720",
            "@ref": "ga1",
            "@mimetype": "image/gif"
          },
          {
            "@category": "thumbnail",
            "@height": "137",
            "@width": "219",
            "@_fa": "true",
            "$": "https://api.elsevier.com/content/object/eid/1-s2.0-S0926860X23000625-gr1.sml?httpAccept=%2A%2F%2A",
            "@multimediatype": "GIF image file",
            "@type": "IMAGE-THUMBNAIL",
            "@size": "6545",
            "@ref": "gr1",
            "@mimetype": "image/gif"
          },
          {
            "@category": "thumbnail",
            "@height": "164",
            "@width": "194",
            "@_fa": "true",
            "$": "https://api.elsevier.com/content/object/eid/1-s2.0-S0926860X23000625-gr8.sml?httpAccept=%2A%2F%2A",
            "@multimediatype": "GIF image file",
            "@type": "IMAGE-THUMBNAIL",
            "@size": "3354",
            "@ref": "gr8",
            "@mimetype": "image/gif"
          },
          {
            "@category": "thumbnail",
            "@height": "164",
            "@width": "117",
            "@_fa": "true",
            "$": "https://api.elsevier.com/content/object/eid/1-s2.0-S0926860X23000625-gr7.sml?httpAccept=%2A%2F%2A",
            "@multimediatype": "GIF image file",
            "@type": "IMAGE-THUMBNAIL",
            "@size": "8324",
            "@ref": "gr7",
            "@mimetype": "image/gif"
          },
          {
            "@category": "thumbnail",
            "@height": "164",
            "@width": "204",
            "@_fa": "true",
            "$": "https://api.elsevier.com/content/object/eid/1-s2.0-S0926860X23000625-gr6.sml?httpAccept=%2A%2F%2A",
            "@multimediatype": "GIF image file",
            "@type": "IMAGE-THUMBNAIL",
            "@size": "9417",
            "@ref": "gr6",
            "@mimetype": "image/gif"
          },
          {
            "@category": "thumbnail",
            "@height": "86",
            "@width": "219",
            "@_fa": "true",
            "$": "https://api.elsevier.com/content/object/eid/1-s2.0-S0926860X23000625-gr5.sml?httpAccept=%2A%2F%2A",
            "@multimediatype": "GIF image file",
            "@type": "IMAGE-THUMBNAIL",
            "@size": "6197",
            "@ref": "gr5",
            "@mimetype": "image/gif"
          },
          {
            "@category": "high",
            "@height": "1426",
            "@width": "1663",
            "@_fa": "true",
            "$": "https://api.elsevier.com/content/object/eid/1-s2.0-S0926860X23000625-gr4_lrg.jpg?httpAccept=%2A%2F%2A",
            "@multimediatype": "JPEG image file",
            "@type": "IMAGE-HIGH-RES",
            "@size": "103481",
            "@ref": "gr4",
            "@mimetype": "image/jpeg"
          },
          {
            "@category": "high",
            "@height": "1188",
            "@width": "2994",
            "@_fa": "true",
            "$": "https://api.elsevier.com/content/object/eid/1-s2.0-S0926860X23000625-gr3_lrg.jpg?httpAccept=%2A%2F%2A",
            "@multimediatype": "JPEG image file",
            "@type": "IMAGE-HIGH-RES",
            "@size": "126908",
            "@ref": "gr3",
            "@mimetype": "image/jpeg"
          },
          {
            "@category": "high",
            "@height": "913",
            "@width": "1663",
            "@_fa": "true",
            "$": "https://api.elsevier.com/content/object/eid/1-s2.0-S0926860X23000625-gr2_lrg.jpg?httpAccept=%2A%2F%2A",
            "@multimediatype": "JPEG image file",
            "@type": "IMAGE-HIGH-RES",
            "@size": "91017",
            "@ref": "gr2",
            "@mimetype": "image/jpeg"
          },
          {
            "@category": "high",
            "@height": "1085",
            "@width": "1211",
            "@_fa": "true",
            "$": "https://api.elsevier.com/content/object/eid/1-s2.0-S0926860X23000625-ga1_lrg.jpg?httpAccept=%2A%2F%2A",
            "@multimediatype": "JPEG image file",
            "@type": "IMAGE-HIGH-RES",
            "@size": "89269",
            "@ref": "ga1",
            "@mimetype": "image/jpeg"
          },
          {
            "@category": "high",
            "@height": "1040",
            "@width": "1663",
            "@_fa": "true",
            "$": "https://api.elsevier.com/content/object/eid/1-s2.0-S0926860X23000625-gr1_lrg.jpg?httpAccept=%2A%2F%2A",
            "@multimediatype": "JPEG image file",
            "@type": "IMAGE-HIGH-RES",
            "@size": "75223",
            "@ref": "gr1",
            "@mimetype": "image/jpeg"
          },
          {
            "@category": "high",
            "@height": "1407",
            "@width": "1663",
            "@_fa": "true",
            "$": "https://api.elsevier.com/content/object/eid/1-s2.0-S0926860X23000625-gr8_lrg.jpg?httpAccept=%2A%2F%2A",
            "@multimediatype": "JPEG image file",
            "@type": "IMAGE-HIGH-RES",
            "@size": "63601",
            "@ref": "gr8",
            "@mimetype": "image/jpeg"
          },
          {
            "@category": "high",
            "@height": "2332",
            "@width": "1663",
            "@_fa": "true",
            "$": "https://api.elsevier.com/content/object/eid/1-s2.0-S0926860X23000625-gr7_lrg.jpg?httpAccept=%2A%2F%2A",
            "@multimediatype": "JPEG image file",
            "@type": "IMAGE-HIGH-RES",
            "@size": "218942",
            "@ref": "gr7",
            "@mimetype": "image/jpeg"
          },
          {
            "@category": "high",
            "@height": "2402",
            "@width": "2994",
            "@_fa": "true",
            "$": "https://api.elsevier.com/content/object/eid/1-s2.0-S0926860X23000625-gr6_lrg.jpg?httpAccept=%2A%2F%2A",
            "@multimediatype": "JPEG image file",
            "@type": "IMAGE-HIGH-RES",
            "@size": "378397",
            "@ref": "gr6",
            "@mimetype": "image/jpeg"
          },
          {
            "@category": "high",
            "@height": "656",
            "@width": "1663",
            "@_fa": "true",
            "$": "https://api.elsevier.com/content/object/eid/1-s2.0-S0926860X23000625-gr5_lrg.jpg?httpAccept=%2A%2F%2A",
            "@multimediatype": "JPEG image file",
            "@type": "IMAGE-HIGH-RES",
            "@size": "70111",
            "@ref": "gr5",
            "@mimetype": "image/jpeg"
          },
          {
            "@category": "thumbnail",
            "@_fa": "true",
            "$": "https://api.elsevier.com/content/object/eid/1-s2.0-S0926860X23000625-si0001.svg?httpAccept=%2A%2F%2A",
            "@multimediatype": "Scalable Vector Graphics file",
            "@type": "ALTIMG",
            "@size": "3213",
            "@ref": "si0001",
            "@mimetype": "image/svg+xml"
          },
          {
            "@category": "thumbnail",
            "@_fa": "true",
            "$": "https://api.elsevier.com/content/object/eid/1-s2.0-S0926860X23000625-si0002.svg?httpAccept=%2A%2F%2A",
            "@multimediatype": "Scalable Vector Graphics file",
            "@type": "ALTIMG",
            "@size": "2621",
            "@ref": "si0002",
            "@mimetype": "image/svg+xml"
          },
          {
            "@category": "thumbnail",
            "@_fa": "true",
            "$": "https://api.elsevier.com/content/object/eid/1-s2.0-S0926860X23000625-si0003.svg?httpAccept=%2A%2F%2A",
            "@multimediatype": "Scalable Vector Graphics file",
            "@type": "ALTIMG",
            "@size": "3302",
            "@ref": "si0003",
            "@mimetype": "image/svg+xml"
          },
          {
            "@category": "thumbnail",
            "@_fa": "true",
            "$": "https://api.elsevier.com/content/object/eid/1-s2.0-S0926860X23000625-si0004.svg?httpAccept=%2A%2F%2A",
            "@multimediatype": "Scalable Vector Graphics file",
            "@type": "ALTIMG",
            "@size": "3140",
            "@ref": "si0004",
            "@mimetype": "image/svg+xml"
          },
          {
            "@category": "thumbnail",
            "@_fa": "true",
            "$": "https://api.elsevier.com/content/object/eid/1-s2.0-S0926860X23000625-si0005.svg?httpAccept=%2A%2F%2A",
            "@multimediatype": "Scalable Vector Graphics file",
            "@type": "ALTIMG",
            "@size": "3367",
            "@ref": "si0005",
            "@mimetype": "image/svg+xml"
          },
          {
            "@category": "thumbnail",
            "@_fa": "true",
            "$": "https://api.elsevier.com/content/object/eid/1-s2.0-S0926860X23000625-si0006.svg?httpAccept=%2A%2F%2A",
            "@multimediatype": "Scalable Vector Graphics file",
            "@type": "ALTIMG",
            "@size": "2370",
            "@ref": "si0006",
            "@mimetype": "image/svg+xml"
          },
          {
            "@category": "thumbnail",
            "@_fa": "true",
            "$": "https://api.elsevier.com/content/object/eid/1-s2.0-S0926860X23000625-si0007.svg?httpAccept=%2A%2F%2A",
            "@multimediatype": "Scalable Vector Graphics file",
            "@type": "ALTIMG",
            "@size": "1713",
            "@ref": "si0007",
            "@mimetype": "image/svg+xml"
          },
          {
            "@category": "thumbnail",
            "@_fa": "true",
            "$": "https://api.elsevier.com/content/object/eid/1-s2.0-S0926860X23000625-si0008.svg?httpAccept=%2A%2F%2A",
            "@multimediatype": "Scalable Vector Graphics file",
            "@type": "ALTIMG",
            "@size": "1576",
            "@ref": "si0008",
            "@mimetype": "image/svg+xml"
          },
          {
            "@category": "thumbnail",
            "@_fa": "true",
            "$": "https://api.elsevier.com/content/object/eid/1-s2.0-S0926860X23000625-si0009.svg?httpAccept=%2A%2F%2A",
            "@multimediatype": "Scalable Vector Graphics file",
            "@type": "ALTIMG",
            "@size": "2763",
            "@ref": "si0009",
            "@mimetype": "image/svg+xml"
          },
          {
            "@category": "thumbnail",
            "@_fa": "true",
            "$": "https://api.elsevier.com/content/object/eid/1-s2.0-S0926860X23000625-si0010.svg?httpAccept=%2A%2F%2A",
            "@multimediatype": "Scalable Vector Graphics file",
            "@type": "ALTIMG",
            "@size": "2528",
            "@ref": "si0010",
            "@mimetype": "image/svg+xml"
          },
          {
            "@category": "thumbnail",
            "@_fa": "true",
            "$": "https://api.elsevier.com/content/object/eid/1-s2.0-S0926860X23000625-si0011.svg?httpAccept=%2A%2F%2A",
            "@multimediatype": "Scalable Vector Graphics file",
            "@type": "ALTIMG",
            "@size": "2593",
            "@ref": "si0011",
            "@mimetype": "image/svg+xml"
          },
          {
            "@category": "thumbnail",
            "@_fa": "true",
            "$": "https://api.elsevier.com/content/object/eid/1-s2.0-S0926860X23000625-si0012.svg?httpAccept=%2A%2F%2A",
            "@multimediatype": "Scalable Vector Graphics file",
            "@type": "ALTIMG",
            "@size": "2107",
            "@ref": "si0012",
            "@mimetype": "image/svg+xml"
          },
          {
            "@category": "thumbnail",
            "@_fa": "true",
            "$": "https://api.elsevier.com/content/object/eid/1-s2.0-S0926860X23000625-si0013.svg?httpAccept=%2A%2F%2A",
            "@multimediatype": "Scalable Vector Graphics file",
            "@type": "ALTIMG",
            "@size": "2929",
            "@ref": "si0013",
            "@mimetype": "image/svg+xml"
          },
          {
            "@category": "thumbnail",
            "@_fa": "true",
            "$": "https://api.elsevier.com/content/object/eid/1-s2.0-S0926860X23000625-si0014.svg?httpAccept=%2A%2F%2A",
            "@multimediatype": "Scalable Vector Graphics file",
            "@type": "ALTIMG",
            "@size": "2208",
            "@ref": "si0014",
            "@mimetype": "image/svg+xml"
          },
          {
            "@category": "thumbnail",
            "@_fa": "true",
            "$": "https://api.elsevier.com/content/object/eid/1-s2.0-S0926860X23000625-si0015.svg?httpAccept=%2A%2F%2A",
            "@multimediatype": "Scalable Vector Graphics file",
            "@type": "ALTIMG",
            "@size": "1722",
            "@ref": "si0015",
            "@mimetype": "image/svg+xml"
          },
          {
            "@category": "thumbnail",
            "@_fa": "true",
            "$": "https://api.elsevier.com/content/object/eid/1-s2.0-S0926860X23000625-si0016.svg?httpAccept=%2A%2F%2A",
            "@multimediatype": "Scalable Vector Graphics file",
            "@type": "ALTIMG",
            "@size": "2358",
            "@ref": "si0016",
            "@mimetype": "image/svg+xml"
          },
          {
            "@category": "thumbnail",
            "@_fa": "true",
            "$": "https://api.elsevier.com/content/object/eid/1-s2.0-S0926860X23000625-si0017.svg?httpAccept=%2A%2F%2A",
            "@multimediatype": "Scalable Vector Graphics file",
            "@type": "ALTIMG",
            "@size": "1928",
            "@ref": "si0017",
            "@mimetype": "image/svg+xml"
          },
          {
            "@category": "thumbnail",
            "@_fa": "true",
            "$": "https://api.elsevier.com/content/object/eid/1-s2.0-S0926860X23000625-si0018.svg?httpAccept=%2A%2F%2A",
            "@multimediatype": "Scalable Vector Graphics file",
            "@type": "ALTIMG",
            "@size": "2601",
            "@ref": "si0018",
            "@mimetype": "image/svg+xml"
          },
          {
            "@category": "thumbnail",
            "@_fa": "true",
            "$": "https://api.elsevier.com/content/object/eid/1-s2.0-S0926860X23000625-si0019.svg?httpAccept=%2A%2F%2A",
            "@multimediatype": "Scalable Vector Graphics file",
            "@type": "ALTIMG",
            "@size": "2212",
            "@ref": "si0019",
            "@mimetype": "image/svg+xml"
          },
          {
            "@category": "thumbnail",
            "@_fa": "true",
            "$": "https://api.elsevier.com/content/object/eid/1-s2.0-S0926860X23000625-si0020.svg?httpAccept=%2A%2F%2A",
            "@multimediatype": "Scalable Vector Graphics file",
            "@type": "ALTIMG",
            "@size": "1936",
            "@ref": "si0020",
            "@mimetype": "image/svg+xml"
          },
          {
            "@category": "thumbnail",
            "@_fa": "true",
            "$": "https://api.elsevier.com/content/object/eid/1-s2.0-S0926860X23000625-si0021.svg?httpAccept=%2A%2F%2A",
            "@multimediatype": "Scalable Vector Graphics file",
            "@type": "ALTIMG",
            "@size": "2115",
            "@ref": "si0021",
            "@mimetype": "image/svg+xml"
          },
          {
            "@category": "thumbnail",
            "@_fa": "true",
            "$": "https://api.elsevier.com/content/object/eid/1-s2.0-S0926860X23000625-si0022.svg?httpAccept=%2A%2F%2A",
            "@multimediatype": "Scalable Vector Graphics file",
            "@type": "ALTIMG",
            "@size": "2354",
            "@ref": "si0022",
            "@mimetype": "image/svg+xml"
          },
          {
            "@category": "standard",
            "@_fa": "true",
            "$": "https://api.elsevier.com/content/object/eid/1-s2.0-S0926860X23000625-am.pdf?httpAccept=%2A%2F%2A",
            "@multimediatype": "Acrobat PDF file",
            "@type": "AAM-PDF",
            "@size": "578350",
            "@ref": "am",
            "@mimetype": "application/pdf"
          }
        ]
      },
      "link": {
        "@rel": "abstract",
        "@href": "https://api.elsevier.com/content/abstract/scopus_id/85147412211"
      }
    }
  }
}