{
  "metadata": {
    "title": "Optimizing lattice oxygen mobility and acidity of heteropoly acid catalysts for oxidation of isobutane to methacrylic acid",
    "authors": "; ; ",
    "journal": "Applied Catalysis A: General",
    "date": "2023-01-05",
    "doi": "10.1016/j.apcata.2022.118974",
    "abstract": "",
    "uri": "https://api.elsevier.com/content/article/pii/S0926860X22004975",
    "pii": "S0926860X22004975"
  },
  "fulltext": {
    "full-text-retrieval-response": {
      "scopus-eid": "2-s2.0-85142337894",
      "originalText": "serial JL 271346 291210 291744 291809 31 Applied Catalysis A: General APPLIEDCATALYSISAGENERAL 2022-11-20 2022-11-20 2022-11-23 2022-11-23 2022-12-14T20:52:52 1-s2.0-S0926860X22004975 S0926-860X(22)00497-5 S0926860X22004975 10.1016/j.apcata.2022.118974 S300 S300.2 FULL-TEXT 1-s2.0-S0926860X22X00203 2024-01-01T12:34:28.416125Z 0 0 20230105 2023 2022-11-20T07:06:32.500796Z absattachment articleinfo articlenumber articletitlenorm authfirstinitialnorm authfirstsurnamenorm cid cids contenttype copyright crossmark dateloaded dateloadedtxt datesearch datesort dateupdated dco docsubtype doctype doi eid ewtransactionid hubeid indexeddate issn issnnorm itemstage itemtransactionid itemweight openaccess openarchive pg pgfirst pii piinorm pubdatestart pubdatetxt pubyr sortorder srctitle srctitlenorm srctype ssids alllist content subj subheadings suppl tomb volfirst volissue volumelist webpdf webpdfpagecount yearnav figure e-component body acknowledge affil appendices articletitle auth authfirstini authfull authkeywords authlast grantnumber grantsponsor grantsponsorid highlightsabst orcid primabst ref specialabst 0926-860X 0926860X true 649 649 C Volume 649 14 118974 118974 118974 20230105 5 January 2023 2023-01-05 2023 article fla © 2022 Elsevier B.V. All rights reserved. OPTIMIZINGLATTICEOXYGENMOBILITYACIDITYHETEROPOLYACIDCATALYSTSFOROXIDATIONISOBUTANEMETHACRYLICACID WANG Y 1 Introduction 2 Experimental 2.1 Catalyst synthesis 2.2 Catalyst characterizations 2.3 Catalytic reaction 3 Results and discussion 4 Conclusions CRediT authorship contribution statement Acknowledgement Appendix A Supplementary material References GUO 2008 697 702 X DARABIMAHBOUB 2016 6525 6535 M JABER 2018 7703 7738 M TAI 2007 42 49 J SCHINDLER 2001 183 195 G JALOWIECKIDUHAMEL 1996 237 241 L HU 2000 360 375 J KANNO 2010 1 8 M CAO 2018 1657 1667 Y DARABIMAHBOUB 2018 105 116 M HUYNH 2009 166 176 Q KNAPP 2001 111 119 C LIU 2016 85 92 S SULTAN 2004 141 152 M JING 2014 121 135 F SCHINDLER 2001 183 195 G YASUDA 2019 164 172 S BOHNKE 2006 8794 8800 H GAIGNEAUX 2000 5724 5737 E PAUL 1997 3391 3399 S MISONO 2002 89 96 M WANG 2015 4893 4962 S WATZENBERGER 1990 247 258 O WANG 2018 2129 2165 M SCHINDLER 2003 117 121 G MIZUNO 1996 309 317 N HE 2017 104 112 J LIU 2018 5774 5781 Y LIU 2018 5774 5781 Y KENDELL 2008 526 532 S DENG 2005 165 170 Q ZHANG 2013 4484 4490 H MIZUNO 1996 87 94 N BRUCKNER 2007 369 380 A MESTL 2001 13 34 G ISHIKAWA 2020 10535 10545 S MO 2020 118464 S XING 2022 3065 3072 X YOU 2018 064101 R DARABIMAHBOUB 2018 7703 7738 M MISONO 1987 269 321 M BRUCKMAN 1989 173 187 K HE 2018 104 112 J LIU 2017 4970 4979 J WU 2018 2 11 R MA 2016 172 180 Z BALLARINI 2007 263 269 N JULIANACASARINA 2017 101 109 C ANIRUDHAN 2013 82 93 T FARSI 2013 633 638 M WANG 2016 105 112 F LIU 2022 118789 Y WANGX2023X118974 WANGX2023X118974XY 2024-11-23T00:00:00.000Z 2024-11-23T00:00:00.000Z http://creativecommons.org/licenses/by-nc-nd/4.0/ © 2022 Elsevier B.V. All rights reserved. 2022-11-25T23:49:30.002Z http://vtw.elsevier.com/data/voc/AddOnTypes/50.7/aggregated-refined 0 https://doi.org/10.15223/policy-017 https://doi.org/10.15223/policy-037 https://doi.org/10.15223/policy-012 https://doi.org/10.15223/policy-029 https://doi.org/10.15223/policy-004 item S0926-860X(22)00497-5 S0926860X22004975 1-s2.0-S0926860X22004975 10.1016/j.apcata.2022.118974 271346 2024-01-01T12:34:28.416125Z 2023-01-05 1-s2.0-S0926860X22004975-main.pdf https://s3-eu-west-1.amazonaws.com/prod-ucs-content-store-eu-west/content/pii:S0926860X22004975/MAIN/application/pdf/64bac10d1d204a486cefd31ed855b5ae/main.pdf main.pdf pdf true 8260975 MAIN 10 1-s2.0-S0926860X22004975-main_1.png https://s3-eu-west-1.amazonaws.com/prod-ucs-content-store-eu-west/content/pii:S0926860X22004975/PREVIEW/image/png/aa519ea6915f2a60f179e1fec2563d19/main_1.png main_1.png png 60894 849 656 IMAGE-WEB-PDF 1 1-s2.0-S0926860X22004975-gr1.jpg https://s3-eu-west-1.amazonaws.com/prod-ucs-content-store-eu-west/content/pii:S0926860X22004975/gr1/DOWNSAMPLED/image/jpeg/c7fc44971f1949304727a3caf697e54d/gr1.jpg gr1 gr1.jpg jpg 178668 813 678 IMAGE-DOWNSAMPLED 1-s2.0-S0926860X22004975-gr3.jpg https://s3-eu-west-1.amazonaws.com/prod-ucs-content-store-eu-west/content/pii:S0926860X22004975/gr3/DOWNSAMPLED/image/jpeg/6c896e1a5e68c483239cfe0660a39024/gr3.jpg gr3 gr3.jpg jpg 84472 258 791 IMAGE-DOWNSAMPLED 1-s2.0-S0926860X22004975-gr10.jpg https://s3-eu-west-1.amazonaws.com/prod-ucs-content-store-eu-west/content/pii:S0926860X22004975/gr10/DOWNSAMPLED/image/jpeg/538e4b6b2d5cb31fd9e5a4e86d272de0/gr10.jpg gr10 gr10.jpg jpg 75213 340 678 IMAGE-DOWNSAMPLED 1-s2.0-S0926860X22004975-gr2.jpg https://s3-eu-west-1.amazonaws.com/prod-ucs-content-store-eu-west/content/pii:S0926860X22004975/gr2/DOWNSAMPLED/image/jpeg/a83574f4da5017fff0654642111896ce/gr2.jpg gr2 gr2.jpg jpg 48792 480 376 IMAGE-DOWNSAMPLED 1-s2.0-S0926860X22004975-ga1.jpg https://s3-eu-west-1.amazonaws.com/prod-ucs-content-store-eu-west/content/pii:S0926860X22004975/ga1/DOWNSAMPLED/image/jpeg/6a7897bc75b385e5cb45bc7c1ab66ab8/ga1.jpg ga1 true ga1.jpg jpg 19561 200 400 IMAGE-DOWNSAMPLED 1-s2.0-S0926860X22004975-gr9.jpg https://s3-eu-west-1.amazonaws.com/prod-ucs-content-store-eu-west/content/pii:S0926860X22004975/gr9/DOWNSAMPLED/image/jpeg/ea2a6f748a7c47e65785ecc694e2cc48/gr9.jpg gr9 gr9.jpg jpg 78851 330 678 IMAGE-DOWNSAMPLED 1-s2.0-S0926860X22004975-gr8.jpg https://s3-eu-west-1.amazonaws.com/prod-ucs-content-store-eu-west/content/pii:S0926860X22004975/gr8/DOWNSAMPLED/image/jpeg/2fcbdbc37ec5f85b772032c07cf1d944/gr8.jpg gr8 gr8.jpg jpg 48690 300 678 IMAGE-DOWNSAMPLED 1-s2.0-S0926860X22004975-gr5.jpg https://s3-eu-west-1.amazonaws.com/prod-ucs-content-store-eu-west/content/pii:S0926860X22004975/gr5/DOWNSAMPLED/image/jpeg/8e12d81557e69ae7fc8e4441f4953f27/gr5.jpg gr5 gr5.jpg jpg 52599 276 791 IMAGE-DOWNSAMPLED 1-s2.0-S0926860X22004975-gr4.jpg https://s3-eu-west-1.amazonaws.com/prod-ucs-content-store-eu-west/content/pii:S0926860X22004975/gr4/DOWNSAMPLED/image/jpeg/5594ba7fe296ee4de0a1117af4df1a33/gr4.jpg gr4 gr4.jpg jpg 46076 188 565 IMAGE-DOWNSAMPLED 1-s2.0-S0926860X22004975-gr7.jpg https://s3-eu-west-1.amazonaws.com/prod-ucs-content-store-eu-west/content/pii:S0926860X22004975/gr7/DOWNSAMPLED/image/jpeg/93cde33f9c39f3f8146c4fddf5f4b631/gr7.jpg gr7 gr7.jpg jpg 62362 321 751 IMAGE-DOWNSAMPLED 1-s2.0-S0926860X22004975-gr6.jpg https://s3-eu-west-1.amazonaws.com/prod-ucs-content-store-eu-west/content/pii:S0926860X22004975/gr6/DOWNSAMPLED/image/jpeg/3d49158278aa51ccf86478cefc197fe2/gr6.jpg gr6 gr6.jpg jpg 54629 259 791 IMAGE-DOWNSAMPLED 1-s2.0-S0926860X22004975-gr1.sml https://s3-eu-west-1.amazonaws.com/prod-ucs-content-store-eu-west/content/pii:S0926860X22004975/gr1/THUMBNAIL/image/gif/eb5e4821107878bddd146196d37bf02a/gr1.sml gr1 gr1.sml sml 13128 163 136 IMAGE-THUMBNAIL 1-s2.0-S0926860X22004975-gr3.sml https://s3-eu-west-1.amazonaws.com/prod-ucs-content-store-eu-west/content/pii:S0926860X22004975/gr3/THUMBNAIL/image/gif/0f6c9640dbad2c8f8ebc492b660fe882/gr3.sml gr3 gr3.sml sml 11357 71 219 IMAGE-THUMBNAIL 1-s2.0-S0926860X22004975-gr10.sml https://s3-eu-west-1.amazonaws.com/prod-ucs-content-store-eu-west/content/pii:S0926860X22004975/gr10/THUMBNAIL/image/gif/59929069c7924cbc826b0f09dc9422d5/gr10.sml gr10 gr10.sml sml 12264 110 219 IMAGE-THUMBNAIL 1-s2.0-S0926860X22004975-gr2.sml https://s3-eu-west-1.amazonaws.com/prod-ucs-content-store-eu-west/content/pii:S0926860X22004975/gr2/THUMBNAIL/image/gif/aea7dafccae48aaec026d8143af8391d/gr2.sml gr2 gr2.sml sml 8519 163 128 IMAGE-THUMBNAIL 1-s2.0-S0926860X22004975-ga1.sml https://s3-eu-west-1.amazonaws.com/prod-ucs-content-store-eu-west/content/pii:S0926860X22004975/ga1/THUMBNAIL/image/gif/358f19140d52928e5e54e21aede0b08e/ga1.sml ga1 true ga1.sml sml 7293 110 219 IMAGE-THUMBNAIL 1-s2.0-S0926860X22004975-gr9.sml https://s3-eu-west-1.amazonaws.com/prod-ucs-content-store-eu-west/content/pii:S0926860X22004975/gr9/THUMBNAIL/image/gif/1eef922b423eaed806220d5fce8d5319/gr9.sml gr9 gr9.sml sml 12064 107 219 IMAGE-THUMBNAIL 1-s2.0-S0926860X22004975-gr8.sml https://s3-eu-west-1.amazonaws.com/prod-ucs-content-store-eu-west/content/pii:S0926860X22004975/gr8/THUMBNAIL/image/gif/1150a3c432dcc3e993ca751d86ce82b1/gr8.sml gr8 gr8.sml sml 7840 97 219 IMAGE-THUMBNAIL 1-s2.0-S0926860X22004975-gr5.sml https://s3-eu-west-1.amazonaws.com/prod-ucs-content-store-eu-west/content/pii:S0926860X22004975/gr5/THUMBNAIL/image/gif/6677af2a8eaa2b1e6b3dd42ecc04d422/gr5.sml gr5 gr5.sml sml 7032 77 219 IMAGE-THUMBNAIL 1-s2.0-S0926860X22004975-gr4.sml https://s3-eu-west-1.amazonaws.com/prod-ucs-content-store-eu-west/content/pii:S0926860X22004975/gr4/THUMBNAIL/image/gif/ce69be20b3b851dc661ace18073c0e34/gr4.sml gr4 gr4.sml sml 13525 73 219 IMAGE-THUMBNAIL 1-s2.0-S0926860X22004975-gr7.sml https://s3-eu-west-1.amazonaws.com/prod-ucs-content-store-eu-west/content/pii:S0926860X22004975/gr7/THUMBNAIL/image/gif/416346cc0749e4f22ca509fa92c9ed62/gr7.sml gr7 gr7.sml sml 9444 94 219 IMAGE-THUMBNAIL 1-s2.0-S0926860X22004975-gr6.sml https://s3-eu-west-1.amazonaws.com/prod-ucs-content-store-eu-west/content/pii:S0926860X22004975/gr6/THUMBNAIL/image/gif/018988889c5d1b55703c70f174e9f19b/gr6.sml gr6 gr6.sml sml 8164 72 219 IMAGE-THUMBNAIL 1-s2.0-S0926860X22004975-gr1_lrg.jpg https://s3-eu-west-1.amazonaws.com/prod-ucs-content-store-eu-west/content/pii:S0926860X22004975/HIGHRES/image/jpeg/5436d4c023fc6f028f5bdee09ed3b4a0/gr1_lrg.jpg gr1 gr1_lrg.jpg jpg 1004862 3592 2994 IMAGE-HIGH-RES 1-s2.0-S0926860X22004975-gr3_lrg.jpg https://s3-eu-west-1.amazonaws.com/prod-ucs-content-store-eu-west/content/pii:S0926860X22004975/HIGHRES/image/jpeg/39c5efee932e90cbd32955ad7a26980c/gr3_lrg.jpg gr3 gr3_lrg.jpg jpg 419498 1140 3493 IMAGE-HIGH-RES 1-s2.0-S0926860X22004975-gr10_lrg.jpg https://s3-eu-west-1.amazonaws.com/prod-ucs-content-store-eu-west/content/pii:S0926860X22004975/HIGHRES/image/jpeg/4e08bdea50b672d6700f04d0f48667a6/gr10_lrg.jpg gr10 gr10_lrg.jpg jpg 372017 1500 2994 IMAGE-HIGH-RES 1-s2.0-S0926860X22004975-gr2_lrg.jpg https://s3-eu-west-1.amazonaws.com/prod-ucs-content-store-eu-west/content/pii:S0926860X22004975/HIGHRES/image/jpeg/34bd2028e75421613d028302b9fc7aeb/gr2_lrg.jpg gr2 gr2_lrg.jpg jpg 239352 2123 1663 IMAGE-HIGH-RES 1-s2.0-S0926860X22004975-ga1_lrg.jpg https://s3-eu-west-1.amazonaws.com/prod-ucs-content-store-eu-west/content/pii:S0926860X22004975/HIGHRES/image/jpeg/999884618fa25993af486cc18cf5b848/ga1_lrg.jpg ga1 true ga1_lrg.jpg jpg 152459 886 1770 IMAGE-HIGH-RES 1-s2.0-S0926860X22004975-gr9_lrg.jpg https://s3-eu-west-1.amazonaws.com/prod-ucs-content-store-eu-west/content/pii:S0926860X22004975/HIGHRES/image/jpeg/9f4b8b942176a5e82ca446369c713101/gr9_lrg.jpg gr9 gr9_lrg.jpg jpg 385675 1458 2994 IMAGE-HIGH-RES 1-s2.0-S0926860X22004975-gr8_lrg.jpg https://s3-eu-west-1.amazonaws.com/prod-ucs-content-store-eu-west/content/pii:S0926860X22004975/HIGHRES/image/jpeg/d39e43e34b1305861d2629c53e5d7613/gr8_lrg.jpg gr8 gr8_lrg.jpg jpg 238902 1324 2994 IMAGE-HIGH-RES 1-s2.0-S0926860X22004975-gr5_lrg.jpg https://s3-eu-west-1.amazonaws.com/prod-ucs-content-store-eu-west/content/pii:S0926860X22004975/HIGHRES/image/jpeg/1b651435d0807c4e7161e10a26e46f56/gr5_lrg.jpg gr5 gr5_lrg.jpg jpg 254050 1221 3493 IMAGE-HIGH-RES 1-s2.0-S0926860X22004975-gr4_lrg.jpg https://s3-eu-west-1.amazonaws.com/prod-ucs-content-store-eu-west/content/pii:S0926860X22004975/HIGHRES/image/jpeg/243ffa74db781e018aaabc54b3ffa7ef/gr4_lrg.jpg gr4 gr4_lrg.jpg jpg 212234 832 2495 IMAGE-HIGH-RES 1-s2.0-S0926860X22004975-gr7_lrg.jpg https://s3-eu-west-1.amazonaws.com/prod-ucs-content-store-eu-west/content/pii:S0926860X22004975/HIGHRES/image/jpeg/2bc2080658001a337296b6cca928907c/gr7_lrg.jpg gr7 gr7_lrg.jpg jpg 309208 1422 3326 IMAGE-HIGH-RES 1-s2.0-S0926860X22004975-gr6_lrg.jpg https://s3-eu-west-1.amazonaws.com/prod-ucs-content-store-eu-west/content/pii:S0926860X22004975/HIGHRES/image/jpeg/7684d8913c9666681837f7f377d056b3/gr6_lrg.jpg gr6 gr6_lrg.jpg jpg 270081 1143 3493 IMAGE-HIGH-RES 1-s2.0-S0926860X22004975-mmc1.pdf https://s3-eu-west-1.amazonaws.com/prod-ucs-content-store-eu-west/content/pii:S0926860X22004975/mmc1/MAIN/application/pdf/e7f217ca3ddf6317b32738ed42103e74/mmc1.pdf mmc1 mmc1.pdf pdf false 3429250 APPLICATION 1-s2.0-S0926860X22004975-am.pdf https://s3-eu-west-1.amazonaws.com/prod-ucs-content-store-eu-west/content/egi:10BNV62F521/MAIN/application/pdf/abe0c0871ec4b314adc3289893b81ca7/am.pdf am am.pdf pdf false 3207183 AAM-PDF APCATA 118974 118974 S0926-860X(22)00497-5 10.1016/j.apcata.2022.118974 Elsevier B.V. Fig. 1 Isobutane conversion and MAA selectivity, product selectivity, and MAA and MAL yields of the oxidation of isobutane catalyzed by various (Cs2.2Cu0.26V0.38)xPMo12O40 catalysts with i-C4H10:O2 ratios of (a, b, c) 1.8 and (d, e, f) 1.0 at T1 (300 °C), T2 (320 °C), T3 (335 °C) and T4 (350 °C). Fig. 1 Fig. 2 (a & b) Liquid chromatography-mass spectrometry spectra of the high-boiling point by-products adhered to the outlet inner wall of quartz reactor. (c) Stability test of Cs2.2Cu0.26V0.38PMo12O40 catalyst in the oxidation of isobutane with an i-C4H10:O2 ratio of 1.0 at 335 ℃. Fig. 2 Fig. 3 (A) XRD patterns, (B) FT-IR spectra and (C) Raman spectra of (Cs2.2Cu0.26V0.38)1.3PMo12O40 (a), (Cs2.2Cu0.26V0.38)1.1PMo12O40 (b), Cs2.2Cu0.26V0.38PMo12O40 (c) and (Cs2.2Cu0.26V0.38)0.88PMo12O40 (d): as synthesized catalysts (1), used catalysts in the oxidation of isobutane at 350 °C with i-C4H10:O2 ratios of 1.8 (2) and 1.0 (3). Fig. 3 Fig. 4 SEM image of as synthesized Cs2.2Cu0.26V0.38PMo12O40 catalyst (a), used Cs2.2Cu0.26V0.38PMo12O40 catalysts in the oxidation of isobutane with i-C4H10:O2 ratios of 1.8 (b) and 1.0 (c). Fig. 4 Fig. 5 (A) O 1 s, (B) Mo 3d and (C) V 2p3/2 XPS spectra of as-synthesized (a) and used Cs2.2Cu0.26V0.38PMo12O40 catalysts in the oxidation of isobutane with i-C4H10:O2 ratios of 1.8 (b) and 1.0 (c). Fig. 5 Fig. 6 (A) Oads/(Olattice+Oads)%, (B) Mo6+/(Mo6++Mo5+)% and (C) V5+/(V5++V4+)% of as-synthesized (a) and used (Cs2.2Cu0.26V0.38)xPMo12O40 catalysts in the oxidation of isobutane with i-C4H10:O2 ratios of 1.8 (b) and 1.0 (c). Fig. 6 Fig. 7 (A) UV-Vis spectra of as-synthesized (a) and used (Cs2.2Cu0.26V0.38)xPMo12O40 catalysts in the oxidation of isobutane with i-C4H10:O2 ratios of 1.8 (b) and 1.0 (c). (B) reflectivity and (C) peak positions of UV-Vis spectra of as-synthesized (a) and used (Cs2.2Cu0.26V0.38)xPMo12O40 catalysts. Fig. 7 Fig. 8 (A) NH3-TPD and (B) differential NH3 adsorption heat of (Cs2.2Cu0.26V0.38)1.3PMo12O40 (a), (Cs2.2Cu0.26V0.38)1.1PMo12O40 (b), Cs2.2Cu0.26V0.38PMo12O40 (c) and (Cs2.2Cu0.26V0.38)0.88PMo12O40 (d) following NH3 adsorption at 100 °C. Fig. 8 Fig. 9 In situ DRIFTS spectra of NH3 adsorption on (A) (Cs2.2Cu0.26V0.38)1.3PMo12O40 and (B) Cs2.2Cu0.26V0.38PMo12O40 at 100 °C followed by evacuation and heating at elevated temperatures. Fig. 9 Fig. 10 In situ DRIFTS spectra of MAA adsorption on (A) (Cs2.2Cu0.26V0.38)1.3PMo12O40 and (B) Cs2.2Cu0.26V0.38PMo12O40 at 100 °C followed by evacuation and heating at elevated temperatures. Fig. 10 Optimizing lattice oxygen mobility and acidity of heteropoly acid catalysts for oxidation of isobutane to methacrylic acid Yichuan Wang Conceptualization Formal analysis Investigation Data curation Writing – original draft a Zeyue Wei Formal analysis a Xuanyu Zhang Formal analysis Funding acquisition a Weixin Huang Conceptualization Formal analysis Data curation Writing – review & editing Supervision Project administration Funding acquisition a b ⁎ a Hefei National Laboratory for Physical Sciences at the Microscale, iChEM, Key Laboratory of Surface and Interface Chemistry and Energy Catalysis of Anhui Higher Education Institutes and Department of Chemical Physics, University of Science and Technology of China, Hefei 230026, PR China Hefei National Laboratory for Physical Sciences at the Microscale, iChEM, Key Laboratory of Surface and Interface Chemistry and Energy Catalysis of Anhui Higher Education Institutes and Department of Chemical Physics, University of Science and Technology of China Hefei 230026 PR China Hefei National Laboratory for Physical Sciences at the Microscale, Key Laboratory of Surface and Interface Chemistry and Energy Catalysis of Anhui Higher Education Institutes and Department of Chemical Physics, University of Science and Technology of China, Hefei 230026, P. R. China b Dalian National Laboratory for Clean Energy, Chinese Academy of Sciences, Dalian 116023, PR China Dalian National Laboratory for Clean Energy, Chinese Academy of Sciences Dalian 116023 PR China Dalian National Laboratory for Clean Energy, Chinese Academy of Sciences, Dalian 116023, P. R. China ⁎ Corresponding author at: Hefei National Laboratory for Physical Sciences at the Microscale, iChEM, Key Laboratory of Surface and Interface Chemistry and Energy Catalysis of Anhui Higher Education Institutes and Department of Chemical Physics, University of Science and Technology of China, Hefei 230026, PR China. Hefei National Laboratory for Physical Sciences at the Microscale, iChEM, Key Laboratory of Surface and Interface Chemistry and Energy Catalysis of Anhui Higher Education Institutes and Department of Chemical Physics, University of Science and Technology of China Hefei 230026 PR China In this paper, a series of heteropoly acids, (Cs2.2Cu0.26V0.38)xPMo12O40 (x = 1.3, 1.1, 1.0, 0.88), are prepared, characterized and examined as the catalysts for the oxidation of isobutane to MAA. Under the employed reaction condition, Cs2.23Cu0.26V0.38PMo12O40 exhibits an isobutane conversion of 20% and a MAA selectivity of 51% at 335 °C, giving a MAA yield of 0.68 mmolMAA·h−1·gcatalyst −1. Lattice oxygen mobility and acidity of (Cs2.2Cu0.26V0.38)xPMo12O40 catalysts play key roles. A fast migration rate and a moderate release rate of lattice oxygen are beneficial to the selective oxidation of isobutane to MAA. Cs2.2Cu0.26V0.38PMo12O40 exhibits strong acid sites facilitating MAA desorption and surface sites strongly binding MAA, causing MAA polymerization which blocks the active sites and decreases the long-term catalytic activity. These results demonstrate that the optimization of lattice oxygen mobility and surface acidity is an effective strategy to fabricate efficient heteropoly acid catalysts for the oxidation of isobutane to MAA. Graphical Abstract ga1 Keywords Polyoxometalate Keggin-type structure Selective oxidation Structure-activity relation Reaction mechanism Data availability Data will be made available on request. 1 Introduction Methacrylic acid (MAA) is industrially used for esterification to produce methyl methacrylate (MMA), the monomer for poly-(methyl-methacrylate) (PMMA) [1–3]. Currently, large-scale synthesis routes of MAA include acetone cyanohydrin, isobutylene oxidation and ethylene carbonylation, which involve toxic or expensive raw materials or complex multi-step synthesis processes [3,4]. The low-cost and one-step oxidation of isobutane (i-C4H10) to MAA has attracted more and more attention [5,6]. Heteropoly acids exhibit unique characteristics in catalyzing selective oxidation reactions. For example, H3PMo12O40 catalyzes the dehydrogenation reaction of isobutyraldehyde to methacrolein (MAL) [7], in which the aldehyde group remains intact and the C-H bond at the α position is activated, whereas it also catalyzes the selective oxidation of MAL to MAA, in which the reaction occurs at the aldehyde group with other functional groups intact [6,8,9]. Therefore, heteropoly acids with modified H3PMo12O40 Keggin structures have been much examined as the catalysts for the oxidation of isobutane to MAA [9–14]. It is generally accepted that the oxidation of isobutane to MAA catalyzed by modified H3PMo12O40 catalysts follows the Mars-van Krevelen mechanism [14–25], in which the lattice oxygen around Mo6+ atoms is abstracted by isobutane, accompanied by the reduction of Mo6+ into Mo5+. Incorporation of vanadium into the secondary framework of the Keggin structure was reported beneficial to the oxidation of isobutane by weakening the Mo6+-O bond energy and facilitating the oxidation of Mo5+ into Mo6+ through the redox reaction of V5++Mo5+→ V4++Mo6+. Transition metals [26–28], such as Fe and Cu, were also reported as an efficient intermediary for the transfer of lattice oxygen in the secondary structure of phosphomolybdic acid to increase the oxidation capacity of the catalyst [16,29–31]. The acidity of heteropoly acid catalysts is another important factor for the oxidation of isobutane. It was reported that the surface acid sites mediate the oxidative dehydrogenation of isobutene [27,32]. Replacing the protons of heteropoly acid catalysts with Cs, Fe or Cu cations is commonly used to modify the surface acidity and consequently the catalytic performance in the oxidation of isobutene [28]. Meanwhile, adding water to the reactants was reported beneficial to the recovery of the surface acidity [33–35]. So far, the reported highest selectivity of MAA and MAL is ∼50% by the oxidation of isobutane with isobutane/oxygen ratios of around 2 [36]. Thus, tuning the lattice oxygen mobility and surface acidity with various additives [37], mostly being V, Cs, Cu and Fe, has been much used to optimize the catalytic performance of heteropoly acid catalysts in the oxidation of isobutene [29,30]. In this paper, we report a new approach to synthesize a series of heteropoly acid catalysts with the fixed relative amounts of V, Cs and Cu additives and varied ratios between V, Cs and Cu to the PMo12O40 unit [28]. Via such an approach, we successfully acquire an active Cs2.2Cu0.26V0.38PMo12O40 heteropoly acid catalyst that exhibits an isobutane conversion of 20% and MAA selectivity and yield respectively of 51% and 0.68 mmolMAA·h−1·gcatalyst −1 in the oxidation of isobutane with an isobutane/oxygen ratio of 1.0 at 335 °C. 2 Experimental 2.1 Catalyst synthesis All chemical reagents with analytical grade were used as received. Cs2CO3 was purchased from Shanghai Aladdin Biochemical Technology Co., Ltd. Cu(NO3)2 and H3PMo12O40·xH2O were purchased from Sinopharm Chemical Reagent Co., Ltd. VOSO4 was purchased from Sigma-Aldrich (Shanghai) Trading Co., Ltd. Calculated volumes of 0.04 g/mL H3PMo12O40·xH2O aqueous solution were firstly heated to 80 °C to become transparent and clear, to which three 10 mL aqueous solutions containing calculated amounts of Cs2CO3, Cu(NO3)2 and VOSO4 were added dropwise under stirring. The mixed solution was stirred for additional 30 min and then evaporated at 100 °C. The acquired powders were collected and heated in a muffle furnace to 350 °C at a rate of 5 °C/min and kept for 3 h, and then cooled to room temperature to obtain the heteropoly acid catalysts. 2.2 Catalyst characterizations Catalyst compositions were analyzed by an Optima 7300 DV inductively coupled plasma atomic emission spectrometer (ICP-AES). Specific surface areas were measured on a Tristar II 3020M automatic specific surface area and pore analyzer. Thermogravimetric-differential thermosgravimetric (TG-DTG) measurements were carried out on a Q5000IR thermogravimetric analyzer. UV–vis spectra were obtained on a SOLID3700 ultraviolet-visible-near-infrared spectrophotometer. X-ray diffraction (XRD) patterns were recorded on a Smartlab multi-function rotating target X-ray diffractometer. Transmission infrared spectra were acquired on a Nicolet 8700 Fourier Transform Infrared Spectrometer. Raman spectra were acquired on a LabRamHR laser Raman spectrometer using 514 nm laser excitation source. X-ray photoelectron spectra (XPS) were measured on a Thermo ESCALAB 250Xi X-ray photoelectron spectrometer using monochromatic Al Ka (hν = 1486.6 eV) excitation source. Scanning electron microscope (SEM) images were acquired on a GeminiSEM 500 Schottky field emission scanning electron microscope. Transmission electron microscope (TEM) images were acquired on a JEM-2100F field emission transmission electron microscope (FETEM). High-angle annular dark field (HAADF) TEM images and element mapping images were obtained on a Talos F200X high-resolution transmission electron microscope. NH3 temperature-programmed desorption (NH3-TPD) measurements was carried out on a DAS-7200 automatic dynamic adsorption instrument. During the NH3-TPD experiments, 100 mg sample was loaded in a quartz tube, pretreated with Ar (30 mL/min) at 200 ℃ for 1 h, and cooled to 100 ℃. The gas stream was then switched to 1% NH3/He (30 mL/min) for 3 h, after which the gas stream was switched back to Ar (30 mL/min) for purge until the baseline was stable. Then the sample was heated to 750 °C at a rate of 10 °C/min, during which the NH3 desorption was monitored using an online HIDEN QGA gas analysis system. Diffuse reflectance infrared Fourier transform spectroscopy (DRIFT) experiments of NH3 adsorption were performed on a Nicolet 6700 Fourier Infrared Spectrometer equipped with a Harrick reactor and a MCT detector. The sample was pretreated at 500 °C in a N2 (20 mL/min) atmosphere and then cooled to 100 °C, during which the spectrum at desired temperatures were taken as the as the background spectrum. Then the gas stream was switched to 1% NH3/He (20 mL/min) for 30 min and switched back to N2 (20 mL/min) to purge the NH3 until the spectrum was stable. Then the sample was heated to 500 ℃ at a rate of 10 ℃/min, during which the DRIFTS spectra were measured at desirable temperatures. DRIFTS experiments of MAA adsorption were carried out similarly to those of NH3 adsorption, except that a 270 ppm MAA/N2 gas stream was used to replace the 1% NH3/He gas stream. All DRIFTS spectra were measured with 128 scans at a resolution of 4 cm−1. Pulse adsorption-microcalorimetry measurements of NH3 were carried out on a home-setup consisting of a Setaram Sensys EVO 600 Tian-Calvet microcalorimeter and an Micromeritics Autochem II 2920 automated chemisorption apparatus [38]. A 40 mg sample was placed in the sample quartz tube and degassed in He (flow rate: 50 mL/min) at 200 °C for 60 min, then the sample was cooled to 100 °C, on which pulse adsorption of 0.5 mL 1% NH3/He was carried out. The adsorption amount and accompanying heat flow were quantified by the chemisorption apparatus and microcalorimeter, respectively, from which differential adsorption heats were calculated. 2.3 Catalytic reaction The catalytic oxidation of isobutane was carried out in a home-established fixed-bed flow reactor. 2 g catalyst (20–40 mesh) was loaded in a quartz tube reactor with an inner diameter of 8 mm and heated in the reaction gas of i-C4H10/O2/N2 = 25%/14%/61% (i-C4H10:O2 ratio of 1.8) or 25%/25%/50% (i-C4H10:O2 ratio of 1.0) at a flow rate of 20 mL/min. The catalyst was heated to desirable temperatures and kept for 2 h to reach a steady state. Then the outlet gas was analyzed by an online Shimadzu GC-2014 gas chromatography equipped with five types of columns, including PQ 80/100 mesh 3.2 × 2.1 mm × 1.0 m, MS-13X 80/100 mesh 3.2 × 2.1 mm × 3.0 m, Rtx-1 0.32 mm× 5 µm× 5 m, HP-Al2O3/s 0.32 mm × 25 m× 8 µm, Rtx-1 0.32 mm × 60 m× 5 µm. The pipeline between the reactor out of the furnace and the injection port of the chromatograph was kept at 150 °C to ensure the major products such as MAA and MAL in the gas phase. The i-C4H10 conversion and product selectivity were calculated as the following: i-C4H10 conversion% = ([i-C4H10]inlet - [i-C4H10]outlet)/[i-C4H10]inlet × 100% Selectivity% = [i-C4H10]converted to specified product/([i-C4H10]inlet - [i-C4H10]outlet) × 100% The high-boiling point by-products adhered to the quartz reactor inner wall were also dissolved in ethanol and qualitatively analyzed using a LC-LTQ-Orbitrap XL liquid chromatography-mass spectrometry (LC-MS). 3 Results and discussion Totally four catalysts (Cs2.2Cu0.26V0.38)xPMo12O40 with a fixed Cs:Cu:V= 2.2:0.26:0.38 ratio and varied x values of 1.3, 1.1,1.0 and 0.88 were synthesized, and their compositions were confirmed by ICP-AES (Table S1). Fig. 1a-c shows catalytic performance of various (Cs2.2Cu0.26V0.38)xPMo12O40 catalysts in the oxidation of isobutane with an i-C4H10:O2 ratio of 1.8 (i-C4H10/O2/N2 = 25%/14%/61%), a typical value adopted in previous studies [39]. The detailed data is summarized in Table S2. The detected products included MAA, MAL, CH3COOH (AcOH), CO2 and CO. (Cs2.2Cu0.26V0.38)1.3PMo12O40 exhibited a high activity in catalyzing the i-C4H10 oxidation but a very low selectivity toward MAA. The i-C4H10 conversion was 13% with an almost full consumption of O2 (Fig. S1) at 300 °C, and the major products were COx while the MAA selectivity was only 4.5%. With the reaction temperature increasing up to 350 °C, the i-C4H10 conversion increased slowly to 15% due to the almost full consumption of O2 while the product selectivity did not vary much. (Cs2.2Cu0.26V0.38)1.1PMo12O40 was less active than (Cs2.2Cu0.26V0.38)1.3PMo12O40 but much more selective toward MAA production. The i-C4H10 conversion and MAA selectivity were 6.7% and 32% at 300 °C, respectively. As the temperature increased to 320 °C, the i-C4H10 conversion reached 15% with the almost full consumption of O2, while the MAA selectivity did not vary. Then its catalytic performance remained unchanged with the further increase of the reaction temperature up to 350 °C. Cs2.2Cu0.26V0.38PMo12O40 exhibited the i-C4H10 conversion and MAA selectivity of 6.3% and 53% at 300 °C, respectively. The i-C4H10 conversion kept increasing to 18% as the reaction temperature increased up to 350 °C, while the MAA selectivity did not change at 320 °C but then decreased at elevated temperatures. (Cs2.2Cu0.26V0.38)0.88PMo12O40 exhibited the i-C4H10 conversion and MAA selectivity of 6.0% and 51% at 300 °C, respectively. The i-C4H10 conversion kept increasing to 17% as the reaction temperature increased up to 335 °C with the almost full consumption of O2 and then did not change, while the MAA selectivity kept decreasing to 34% at 350 °C. The highest MAA yield was 7.5% achieved over Cs2.2Cu0.26V0.38PMo12O40 at 335 °C. O2 was not fully consumed at 335 °C during the oxidation of isobutane with a i-C4H10:O2 ratio of 1.8 catalyzed by the Cs2.2Cu0.26V0.38PMo12O40 catalyst, thus the oxidation of isobutane with an i-C4H10:O2 ratio of 1.0 (i-C4H10/O2/N2 = 25%/25%/50%) was used to further evaluate the catalytic performance of various (Cs2.2Cu0.26V0.38)xPMo12O40 catalysts (Fig. 1d-f). The detailed data is summarized in Table S3. At the same reaction temperature and over the same catalyst, the i-C4H10 conversion achieved with an i-C4H10:O2 ratio of 1.0 was higher than with an i-C4H10:O2 ratio of 1.8. The highest i-C4H10 conversions for each catalyst were around 25%. Cs2.2Cu0.26V0.38PMo12O40 exhibited better catalytic performance toward MAA production than other catalysts. Its conversion of i-C4H10 increased from 7.8% to 29% as the reaction temperature increased from 300° to 350°C, while the MAA selectivity increased initially from 52% to 59% and then decreased to 51% and 32%. Cs2.2Cu0.26V0.38PMo12O40 exhibited the highest MAA yield of 10% at 335 °C (isobutane conversion of 20% and MAA selectivity of 51%), corresponding to 0.68 mmolMAA·h−1·gcatalyst −1. Together with a MAL yield of 1.5%, Cs2.2Cu0.26V0.38PMo12O40 exhibited a MAA+MAL yield of 12% at 335 °C for the oxidation of isobutane with an i-C4H10:O2 ratio of 1.0, which is much higher than previously-reported data using Keggin-type heteropolyacid catalysts (Table S4). As shown in Fig. 1b and e, the carbon balance for the oxidation of isobutane catalyzed by (Cs2.2Cu0.26V0.38)xPMo12O40 catalysts was approximately 80%, except that catalyzed by Cs2.2Cu0.26V0.38PMo12O40 at 320 ℃. We did observe the presence of black by-products on the outlet inner wall of quartz reactor (Fig. S2), which were dissolved in ethanol and then analyzed with GC-MS. As shown in Fig. 2a and b, the black by-products mainly showed a peak with a retention time of 9.3–9.6 min in the LC spectrum and a molecular ion peak with m/z of 414.2546 in the MS spectrum. The corresponding molecular formula was deduced as C29H34O2 with an unsaturation degree of 13, whose boiling point is higher than the pipeline temperature (150 °C). The formation of C29H34O2 is likely due to the polymerization of surface intermediates formed during the catalytic reaction [4]. Catalyst stability of Cs2.23Cu0.26V0.38PMo12O40 catalyst in the oxidation of isobutane with a i-C4H10:O2 ratio of 1.0 at 335 ℃ was tested (Fig. 2c). The catalyst was stable in the initial five hours, but then the i-C4H10 conversion decreased from around 19% to around 9% and then did not vary much while the MAA selectivity remained stably around 55%. Structures of various as-synthesized and used catalysts were characterized. BET surface areas of (Cs2.2Cu0.26V0.38)1.3PMo12O40, (Cs2.2Cu0.26V0.38)1.1PMo12O40, Cs2.2Cu0.26V0.38PMo12O40 and (Cs2.2Cu0.26V0.38)0.88PMo12O40 catalysts were measured as 6.3, 4.0, 8.0 and 3.6 m2/g, respectively. TG curves (Fig. S3) show that as-synthesized (Cs2.2Cu0.26V0.38)xPMo12O40 catalysts undergo obvious weight loss processes above 600 °C. Their stability enhances with the Cs amount, consistent with previous reports [40]. In the XRD patterns ( Fig. 3A), all catalysts showed strong diffraction peaks arising from the (110), (211), (222), (400) and (332) crystal planes of Keggin type heteropoly compounds, consistent with those with a stable cubic secondary structure [28]. In the FT-IR spectra (Fig. 3B), four characteristic peaks of the Keggin structure appeared at 1062, 968, 867 and 795 cm−1 for all catalysts, corresponding to the P–O stretch vibration, M=Ot peripheral metal atoms–terminal oxygen stretch vibration, Mo–Ob–Mo inter-octahedral bridges stretch vibration and Mo–Ob–Mo intra-octahedral bridges stretch vibration, respectively [1]. The observed vibrational features in the FT-IR spectra and diffraction peaks in the XRD patterns are characteristics of the Keggin structural framework (primary structure) and secondary structure of heteropolyacid, respectively (Fig. S4). Thus, our (Cs2.2Cu0.26V0.38)xPMo12O40 catalysts synthesized by adding Cs, Cu, and V to H3PMo12O40 well maintain the primary and secondary Keggin structures, which also keep stable in the catalytic oxidation of isobutane. In the Raman spectra (Fig. 3C), the observed peaks at 228, 238 and 258 cm−1 were attributed to the deformation vibration features of the MoO (end oxygen) and whole Keggin structure [41], the observed peaks at 605, 878 and 961 cm−1 were attributed to the stretch vibration features of Mo-Oc-Mo, Mo-Ob-Mo and P-O, respectively, and the observed peaks at 973 and 990 cm−1 arose from the stretch vibration features of MoOd [11]. All these vibrational features belong to the typical vibration features of the Keggin structure [28] . It can be seen that the peak intensities of used catalysts were much weaker than of corresponding as-synthesized catalysts, which can be related to the consumption of lattice oxygen in the Keggin structure during the catalytic oxidation of isobutane. The used (Cs2.2Cu0.26V0.38)1.3PMo12O40, (Cs2.2Cu0.26V0.38)1.2PMo12O40 and (Cs2.2Cu0.26V0.38)0.88PMo12O40 catalysts exhibited the vibrational peaks with similar intensities after the oxidation of isobutane with i-C4H10:O2 ratios of 1.8 and 1.0, suggesting that the recovery of surface lattice oxygen did not vary much with the gas-phase oxygen concentration; however, the used Cs2.2Cu0.26V0.38PMo12O40 catalyst after the oxidation of isobutane with an i-C4H10:O2 ratio of 1.0 exhibited much stronger vibrational features than after with an i-C4H10:O2 ratio of 1.8, suggesting a faster recovery of surface lattice oxygen. These observations indicate that the Cs2.2Cu0.26V0.38PMo12O40 catalyst is more able to activate gas-phase molecular oxygen into surface lattice oxygen than other (Cs2.2Cu0.26V0.38)xPMo12O40 catalysts. As shown in SEM images ( Fig. 4 and Fig. S5), all as synthesized catalysts consisted of spherical nanoparticles, which remained after the catalytic activity evaluations. Elemental mapping images of Cs2.2Cu0.26V0.38PMo12O40 (Fig. S6) demonstrated a uniform distribution of all elements within the catalyst nanoparticle. Fig. 5 and Figs. S7-S9 show O 1s, Mo 3d and V 2p3/2 XPS spectra of as-synthesized and used (Cs2.2Cu0.26V0.38)xPMo12O40 catalysts. For the as-synthesized catalysts, features of lattice oxygen (Olattice) and adsorbed oxygen (Oads) species with an O 1s binding energy respectively at 531.1 and 532.2 eV, Mo6+ species with a Mo 3d5/2 binding energy at 233.3 eV, and V5+ and V4+ species with a V 2p3/2 binding energy respectively at 517.9 and 516.9 eV appear in the O 1s, Mo 3d, and V 2p3/2 XPS spectra, respectively [28,36]. After the oxidation of isobutane with i-C4H10:O2 ratios of either 1.8 or and 1.0, features of Olattice and Oads species, and V5+ and V4+ species still exist, while in addition to the dominant feature of Mo6+ species, a minor feature of Mo5+ species with a Mo 3d5/2 binding energy at 231.8 eV emerges. The O 1s, Mo 3d and V 2p3/2 XPS spectra were peak-fitted (Figs. S10-S12) and the acquired results were summarized in Table S5. Fig. 6 compares Oads/(Olattice+Oads)%, Mo6+/(Mo6++Mo5+)% and V5+/(V5++V4+)% of as-synthesized and used (Cs2.2Cu0.26V0.38)xPMo12O40 catalysts. Among the as-synthesized catalysts, (Cs2.2Cu0.26V0.38)1.3PMo12O40 exhibits the highest Oads/(Olattice+Oads) ratio, while among the used catalysts in the oxidation of isobutane with i-C4H10:O2 ratios of either 1.8 or 1.0, Cs2.2Cu0.26V0.38PMo12O40 exhibits the highest Oads/(Olattice+Oads) ratios. The adsorbed oxygen species was observed to easily convert to the lattice oxygen species [36]. The oxidation of isobutane over heteropoly acids follows a Mars-van Krevelen (MvK) mechanism [15,16], in which the lattice oxygen species surrounding the Mo6+ cations on the catalyst surface is abstracted by isobutene [16]. Thus, Cs2.2Cu0.26V0.38PMo12O40 exhibits higher capacity than other catalysts to replenish the consumed lattice oxygen species during the oxidation of isobutane. This is also supported by the changes of Mo oxidation states in various catalysts. All as-synthesized (Cs2.2Cu0.26V0.38)xPMo12O40 catalysts only contain the Mo6+ species. After the oxidation of isobutane, the Mo5+ species emerges in all used catalysts due to the consumptions of the lattice oxygen species surrounding the Mo6+ cations. It can be seen that the Mo5+ ratios in used Cs2.2Cu0.26V0.38PMo12O40 are smaller than in other used catalysts, supporting higher capacity of Cs2.2Cu0.26V0.38PMo12O40 to replenish the consumed lattice oxygen species. Although the used V precursor for catalyst preparations only contains the V4+ species, all as-synthesized (Cs2.2Cu0.26V0.38)xPMo12O40 catalysts contain both V4+ and V5+ species and the V5+ ratio increases as the x value decreases. After the reaction with an i-C4H10:O2 ratio of 1.8, the V5+ ratio in the used (Cs2.2Cu0.26V0.38)1.3PMo12O40 and (Cs2.2Cu0.26V0.38)1.2PMo12O40 catalysts increases slightly, whereas the V5+ ratio in the used Cs2.2Cu0.26V0.38PMo12O40 and (Cs2.2Cu0.26V0.38)0.88PMo12O40 catalysts decreases. Among the Olattice and Oads species, the Olattice species is more capable of oxidizing the metal cations than the Oads species. Thus, the V 2p3/2 XPS results suggest that the (Cs2.2Cu0.26V0.38)1.3PMo12O40 and (Cs2.2Cu0.26V0.38)1.1PMo12O40 catalysts are active in activating O2 into the Olattice species under the isobutane oxidation reaction conditions, resulting more V5+ species in the used catalysts than in the corresponding as-synthesized catalysts, whereas the Cs2.2Cu0.26V0.38PMo12O40 and (Cs2.2Cu0.26V0.38)0.88PMo12O40 catalysts are less active, resulting less V5+ species in the used catalysts than in the corresponding as-synthesized catalysts. Upon the decrease of the i-C4H10:O2 ratio from 1.8 to 1.0 and consequently the increase of O2 concentration and i-C4H10 conversions, the V5+ ratio in the used (Cs2.2Cu0.26V0.38)1.3PMo12O40 and (Cs2.2Cu0.26V0.38)1.1PMo12O40 catalysts keeps increasing, and the V5+ ratio in the used Cs2.2Cu0.26V0.38PMo12O40 catalyst keeps decreasing, but the V5+ ratio in the used (Cs2.2Cu0.26V0.38)0.88PMo12O40 catalyst increases greatly. Meanwhile, the Mo6+ ratio slightly decreases in the used (Cs2.2Cu0.26V0.38)1.3PMo12O40 catalyst but increases in the used (Cs2.2Cu0.26V0.38)1.1PMo12O40, Cs2.2Cu0.26V0.38PMo12O40 and (Cs2.2Cu0.26V0.38)0.88PMo12O40 catalysts. In the MvK mechanism of the oxidation of isobutane over heteropoly acids [15,16], the Olattice species surrounding the Mo6+ cations on the catalyst surface is abstracted by isobutene and the resulting surface oxygen vacancies is replenished mainly by indirect migration of neighboring Olattice species and minorly by direct O2 activation at the surface oxygen vacancy sites. The increase of V5+ ratio and decrease of Mo6+ ratio of (Cs2.2Cu0.26V0.38)1.3PMo12O40 catalyst suggest a strong O2 activation into Olattice at the V sites but a migration rate of Olattice from the V sites to the Mo sites not fast enough to replenish all consumed Olattice species at the Mo sites. The increase of both V5+ and Mo6+ ratios of (Cs2.2Cu0.26V0.38)1.1PMo12O40 catalyst suggest a strong O2 activation into Olattice at the V sites and a migration rate of Olattice from the V sites to the Mo sites fast enough to replenish all consumed Olattice species at the Mo sites. The decrease of V5+ ratio and the increase of Mo6+ ratio of Cs2.2Cu0.26V0.38PMo12O40 catalyst suggest a weak O2 activation into Olattice at the V sites and a migration rate of Olattice from the V sites to the Mo sites fast enough to replenish all consumed Olattice species at the Mo sites. Although exhibiting a weak O2 activation into Olattice at the V sites and a migration rate of Olattice from the V sites to the Mo sites fast enough to replenish all consumed Olattice species at the Mo sites, the low V content and relatively high O2 pressure with an i-C4H10:O2 ratio of 1.0 result in the increase of both V5+ and Mo6+ ratios of (Cs2.2Cu0.26V0.38)0.88PMo12O40 catalyst. These XPS results demonstrate that an appropriate release rate of Olattice species, a high activity to activate O2 to Oads species, an appropriate activity to convert Oads species into Olattice species and a fast migration rate of Olattice species of Cs2.23Cu0.26V0.38PMo12O40 catalyst under the reaction conditions enables it to supply active Olattice species for the oxidation of isobutane in a limited way and facilely replenish the consumed Olattice species, beneficial for actively and selectively catalyzing the oxidation of isobutane to MAA, while a fast release rate of Olattice species, a high activity to activate O2 to Olattice species and a fast migration rate of Olattice species of (Cs2.2Cu0.26V0.38)1.3PMo12O40 catalyst under the reaction conditions lead to high i-C4H10 conversion and CO2 selectivity. Fig. 7A shows UV-Vis spectra of various as-synthesized and used (Cs2.2Cu0.26V0.38)xPMo12O40 catalysts. The reflectivity of UV-Vis spectra reflects the overall symmetry of the keggin structure of heteropoly acids, such as the symmetry of the MoO6 structure; meanwhile, the features between 210 and 230 nm and 500–600 nm in the UV–vis spectra correspond to the O2-→Mo6+ electron transfer in the heteropoly acid keggin structure [42], in which the longer the wavelength，the weaker the Mo-O bond energy [28]. As shown in Fig. 7B, the used catalysts exhibit weaker reflectivity than corresponding as-synthesized catalysts, suggesting poorer overall symmetry of the keggin structure of used catalysts, which can be associated with the consumption of lattice oxygen in the MoO6 structure during the isobutane oxidation. Among the used catalysts, Cs2.2Cu0.26V0.38PMo12O40 gives slightly stronger reflectivity, indicating better overall symmetry of the keggin structure. This suggests that Cs2.2Cu0.26V0.38PMo12O40 exhibits a higher capacity of to replenish the consumed lattice oxygen species than other catalysts, consistent with the above XPS results. As shown in Fig. 7C, the peak positions of as-synthesized and used (Cs2.2Cu0.26V0.38)1.3PMo12O40 catalysts are higher than those of other as-synthesized and used (Cs2.2Cu0.26V0.38)xPMo12O40 catalysts, suggesting its weaker Mo-O bond energy, consistent with its higher catalytic activity and CO2 selectivity. Meanwhile, the peak position of as-synthesized (Cs2.2Cu0.26V0.38)xPMo12O40 catalysts are higher corresponding used catalysts, which can be related to the consumption of lattice oxygen species in used catalysts, resulting in enhanced Mo-O bond energy. Fig. 8A shows NH3-TPD following NH3 adsorption on various as-synthesized catalysts at 100 °C. Two NH3 desorption peaks can be identified, one peak is between 180 and 230 ℃ and the other is between 375 and 560 ℃, which are tentatively assigned to NH3 adsorbed at weak and strong acid sites, respectively. (Cs2.2Cu0.26V0.38)1.3PMo12O40 exhibits a larger NH3 desorption peak from the weak acid sites than from the strong acid sites, while (Cs2.2Cu0.26V0.38)1.1PMo12O40, Cs2.2Cu0.26V0.38PMo12O40 and (Cs2.2Cu0.26V0.38)0.88PMo12O40 exhibit larger NH3 desorption peaks from the strong acid sites. The NH3 desorption peaks increase from (Cs2.2Cu0.26V0.38)1.3PMo12O40 to (Cs2.2Cu0.26V0.38)1.1PMo12O40 and Cs2.2Cu0.26V0.38PMo12O40 but then decreases to and (Cs2.2Cu0.26V0.38)0.88PMo12O40, meanwhile, Cs2.2Cu0.26V0.38PMo12O40 exhibits the largest NH3 desorption peak from the strong acid sites. Fig. 8B shows the measured differential NH3 adsorption heats following NH3 adsorption on various as-synthesized catalysts at 100 °C. The initial NH3 adsorption heat follows an order of Cs2.2Cu0.26V0.38PMo12O40 > (Cs2.2Cu0.26V0.38)1.1PMo12O40 ≈ (Cs2.2Cu0.26V0.38)0.88PMo12O40 > (Cs2.2Cu0.26V0.38)1.3PMo12O40, while the total NH3 adsorption amount follows an order of Cs2.2Cu0.26V0.38PMo12O40 > (Cs2.2Cu0.26V0.38)1.1PMo12O40 > (Cs2.2Cu0.26V0.38)0.88PMo12O40 > (Cs2.2Cu0.26V0.38)1.3PMo12O40. These results demonstrate that Cs2.2Cu0.26V0.38PMo12O40 has the strongest acid sites and the largest amount of total acid sites while (Cs2.2Cu0.26V0.38)1.3PMo12O40 exhibits the weakest acid sites and the smallest amount of total acid sites, consistent with the NH3-TPD results. NH3 adsorption on as-synthesized (Cs2.2Cu0.26V0.38)1.3PMo12O40 and Cs2.2Cu0.26V0.38PMo12O40 at 100 °C was further studied using in situ DRIFTS spectra ( Fig. 9). NH3 adsorption at 100 °C gives vibrational features at 1610∼1633/3310∼3324 cm−1 that can be assigned to NH3 adsorbed at the Lewis acid sites and at 1407, 1430∼1460, 1672∼1678, 2765∼2817, 2985 and 3158 cm−1 that can be assigned to NH3 adsorbed at various Brønsted acid sites [43–45]. Upon subsequent heating, it can be seen that the vibrational features at 1407, 1430∼1460 and 1672∼1678 cm−1 vary simultaneously with those at 3158, 2765∼2817 and 2985 cm−1. Thus, three types of Brønsted acid sites exist, at which adsorbed NH3 gives vibrational features at 1407/3158, 1430∼1460/2765∼2817 and 1672∼1678/2985 cm−1. The features at 1430∼1460/2765∼2817 cm−1 disappear firstly, followed by those at 1672∼1678/2985 cm−1 and 1610∼1633/3310∼3324 cm−1, and finally by those at 1407/3158 cm−1. Thus, the features at 1430∼1460/2765∼2817 cm−1 seem to arise from NH3 adsorbed at the weak acid sites, the features at 1672∼1678/2985 cm−1 and 1610∼1633/3310∼3324 cm−1 from the medium acid sites, and the features at 1407/3158 cm−1 strong acid sites. The in situ DRIFTS results show that Cs2.2Cu0.26V0.38PMo12O40 exhibits a much higher density of strong acid sites than (Cs2.2Cu0.26V0.38)1.3PMo12O40, consistent with NH3-TPD and differential NH3 adsorption heat results. It was previously reported that a strong acidity of the catalyst for the oxidation of isobutane to MAA facilitates the desorption of MAA from the catalyst surface [8,11,46]. Thus, the strong acidity of Cs2.23Cu0.26V0.38PMo12O40 is responsible for the high MAA selectivity. MAA adsorption on as-synthesized (Cs2.2Cu0.26V0.38)1.3PMo12O40 and Cs2.2Cu0.26V0.38PMo12O40 at 100 °C was also studied using in situ DRIFTS spectra ( Fig. 10). Following adsorption on (Cs2.2Cu0.26V0.38)1.3PMo12O40 at 100 °C, four vibrational features were observed at 3490, 3370, 2964 and 1630 cm−1. The features at 2964 and 1630 cm−1 can be assigned to the =C-H and CC vibrations of adsorbed MAA [47,48], while the features at 3490 and 3370 cm−1 can be assigned to O-H vibration of adsorbed MAA, suggesting the formation of two types of adsorbed MAA species. Upon subsequent heating, the MAA adsorbed species with the O-H vibration at 3370 cm−1 firstly desorbs from the surface, followed by the MAA adsorbed species with the O-H vibration at 3490 cm−1. All adsorbed MAA species desorb from (Cs2.2Cu0.26V0.38)1.3PMo12O40 after heating at 400 °C. MAA adsorption on Cs2.2Cu0.26V0.38PMo12O40 gives stronger CC and O-H vibrational features than on (Cs2.2Cu0.26V0.38)1.3PMo12O40, but a weaker =C-H vibrational feature; meanwhile, the CC vibrational feature is weaker than the O-H vibrational feature for MAA adsorption on Cs2.2Cu0.26V0.38PMo12O40 but is stronger on (Cs2.2Cu0.26V0.38)1.3PMo12O40. Upon subsequent heating, the MAA adsorbed species with the O-H vibration at 3200 cm−1 firstly desorbs from the surface, followed by the MAA adsorbed species with the O-H vibration at 3444 cm−1. All adsorbed MAA species desorb from Cs2.2Cu0.26V0.38PMo12O40 after heating at 450 °C. These results demonstrate that MAA adsorbs more strongly on Cs2.2Cu0.26V0.38PMo12O40 than on (Cs2.2Cu0.26V0.38)1.3PMo12O40 and minor dissociative adsorption likely occurs on Cs2.2Cu0.26V0.38PMo12O40. Therefore, although Cs2.2Cu0.26V0.38PMo12O40 exhibits strong acidity beneficial for MAA desorption, it has surface sites capable of strongly binding MAA, at which the polymerization of surface intermediates likely occurs to form C29H34O2, as observed in the catalytic reaction. The used Cs2.2Cu0.26V0.38PMo12O40 catalyst after the oxidation of isobutane with a i-C4H10:O2 ratio of 1.0 at 335 °C for 100 h was characterized in detail. Its XRD patterns (Fig. S13) are similar to those of as-synthesized catalyst. SEM images and elemental mapping images of used Cs2.2Cu0.26V0.38PMo12O40 catalyst (Figs. S14 and S15) show that the catalyst sintered into irregular shapes, but still exhibited a uniform elemental distribution. TG-DSC curves of as-synthesized and used Cs2.2Cu0.26V0.38PMo12O40 catalysts (Fig. S16) show that the used catalyst exhibits an exothermic peak between 400 and 600 °C corresponding to the combustion process of carbon deposits on the catalyst surface, but no obvious weight loss was observed. This suggests that the carbon balance loss is predominantly due to the formation of high boiling point by-products on the outlet inner wall of quartz reactor instead of the carbon deposition on the catalyst surface. This also explains why the initial decrease of the i-C4H10 conversion does not deactivate the Cs2.2Cu0.26V0.38PMo12O40 catalyst. As shown in Fig. S17, the C 1s and O 1s XPS spectra of used Cs2.2Cu0.26V0.38PMo12O40 catalyst also suggest the presence of carbon deposition on the surface, while the Mo 3d and V 2p3/2 XPS spectra show the Mo6+/Mo5+ and V5+/V4+ signals, respectively. 4 Conclusions Via a study of (Cs2.2Cu0.26V0.38)xPMo12O40 (x = 1.3, 1.1, 1.0, 0.88) heteropoly acid catalysts, we have successfully identified Cs2.2Cu0.26V0.38PMo12O40 as an active and selective catalyst for the oxidation of isobutane to MAA, which exhibits an isobutane conversion of 20% and a MAA selectivity of 51% at 335 °C, giving a MAA yield of 0.68 mmolMAA·h−1·gcatalyst −1. The roles of lattice oxygen mobility and acidity of (Cs2.2Cu0.26V0.38)xPMo12O40 catalysts were demonstrated. A fast migration rate and a moderate release rate of lattice oxygen are beneficial to the selective oxidation of isobutane to MAA. Meanwhile, a strong acidity is beneficial for the MAA desorption. However, surface sites strongly binding MAA are present on the Cs2.2Cu0.26V0.38PMo12O40 catalyst, causing MAA polymerization into high-boiling point by-products which eventually blocks the active sites and decreases the long-term catalytic activity. Presently, MAA can be produced indirectly from isobutane, including isobutane dehydrogenation to isobutene (isobutane conversion: 40.59%; isobutene selectivity: 90.60%) [49], selective oxidation of isobutene to methacrolein (isobutene conversion: 95.2%; MAL selectivity: 92.2%) [50] and selective oxidation of methacrolein to methacrylic acid (MAL conversion: 82.0%; MAA selectivity: 83.4%) [51], whose overall performance is better than that of direct selective oxidation of isobutane to methacrylic acid. Future studies of heteropoly acid catalysts for the selective oxidation of isobutane to MAA will be devoted, on one hand, to increasing the intrinsic catalytic activity via simultaneous optimizations of migration and release rates of lattice oxygen for efficiently catalyzing the selective oxidation of isobutane to MAA and surface acidity for promoting the desorption of adsorbed MAA, on the other hand, to increasing the surface area of heteropoly acid catalysts with high intrinsic catalytic activity. CRediT authorship contribution statement Yichuan Wang: Conceptualization, Formal analysis, Investigation, Data curation, Writing – original draft, Zeyue Wei: Formal analysis, Xuanyu Zhang: Formal analysis, Funding acquisition, Weixin Huang: Conceptualization, Formal analysis, Data curation, Writing – review & editing, Supervision, Project administration, Funding acquisition. Declaration of Competing Interest The authors declare that they have no known competing financial interests or personal relationships that could have appeared to influence the work reported in this paper. Acknowledgement This work is financially supported by the SHAANXI YANCHANG PETROLEUM (GROUP) CO.,LTD., the National Natural Science Foundation of China (22202189), the Fundamental Research Funds for the Central Universities (20720220007, 20720220008), the Chinese Academy of Sciences, and the Changjiang Scholars Program of Ministry of Education of China. Appendix A Supporting information Supplementary data associated with this article can be found in the online version at doi:10.1016/j.apcata.2022.118974. Appendix A Supplementary material Supplementary material . References [1] X. Guo C. Huang Y. Li Korean J. Chem. Eng. 25 2008 697 702 X. Guo, C. Huang, and Y. Li, Effect of cesium content on the structure and catalytic performances of heteropoly compounds in one-step synthesis of methylmethacrylate from methacrolein, Korean J. Chem. Eng. 25 (2008) 697–702. [2] M.J. Darabi Mahboub S. Lotfi J.L. Dubois G.S. Patience Catal. Sci. Technol. 6 2016 6525 6535 M.J. Darabi Mahboub, S. Lotfi, J.L. Dubois, and G.S. Patience, Gas phase oxidation of 2-methyl-1,3-propanediol to methacrylic acid over heteropolyacid catalysts, Catal. Sci. Technol. 6 (2016) 6525–6535. [3] M. Jaber D. Mahboub J. Dubois F. Cavani M. Rostamizadeh G.S. Patience Chem. Soc. Rev. 47 2018 7703 7738 M. Jaber, D. Mahboub, J. Dubois, F. Cavani, M. Rostamizadeh, and G.S. Patience, Catalysis for the synthesis of methacrylic acid and methyl methacrylate, Chem. Soc. Rev. 47 (2018) 7703–7738. [4] J. Tai R.J. Davis Catal. Today 123 2007 42 49 J. Tai and R.J. Davis, Synthesis of methacrylic acid by aldol condensation of propionic acid with formaldehyde over acid – base bifunctional catalysts, Catal. Today 123 (2007) 42–49. [5] G. Schindler T. Ui K. Nagai Appl. Catal. A: Gen. 206 2001 183 195 G. Schindler, T. Ui, and K. Nagai, Kinetics of isobutane selective oxidation over Mo-V-P-As-Cs-Cu-O heteropoly acid catalyst, Appl. Catal. A: Gen. 206 (2001) 183–195. [6] L. Jalowiecki-Duhamel A. Monnier Y. Barbaux G. Hecquet Catal. Today 32 1996 237 241 L. Jalowiecki-Duhamel, A. Monnier, Y. Barbaux, and G. Hecquet, Oxidation of isobutane on a heteropolycompound hydrogen reservoir, Catal. Today 32 (1996) 237–241. [7] J. Hu R.C. Burns J. Catal. 375 2000 360 375 J. Hu and R.C. Burns, The Effect of Cation Type and H+ on the Catalytic Activity of the Keggin Anion [PMo12O40]3− in the Oxidative Dehydrogenation of Isobutyraldehyde Isobutyraldehyde, J. Catal. 375 (2000) 360–375. [8] M. Kanno T. Yasukawa W. Ninomiya K. Ooyachi Y. Kamiya J. Catal. 273 2010 1 8 M. Kanno, T. Yasukawa, W. Ninomiya, K. Ooyachi, and Y. Kamiya, Catalytic oxidation of methacrolein to methacrylic acid over silica-supported 11-molybdo-1-vanadophosphoric acid with different heteropolyacid loadings, J. Catal. 273 (2010) 1–8. [9] Y.L. Cao L. Wang B.H. Xu S.J. Zhang Chem. Eng. J. 334 2018 1657 1667 Y.L. Cao, L. Wang, B.H. Xu, and S.J. Zhang, The Chitin/Keggin-type heteropolyacid hybrid microspheres as catalyst for oxidation of methacrolein to methacrylic acid, Chem. Eng. J. 334 (2018) 1657–1667. [10] M.J. Darabi Mahboub J. Wright D.C. Boffito J.L. Dubois G.S. Patience Appl. Catal. A: Gen. 554 2018 105 116 M.J. Darabi Mahboub, J. Wright, D.C. Boffito, J.L. Dubois, and G.S. Patience, Cs, V, Cu Keggin-type catalysts partially oxidize 2-methyl-1,3-propanediol to methacrylic acid, Appl. Catal. A: Gen. 554 (2018) 105–116. [11] Q. Huynh Y. Schuurman P. Delichere S. Loridant J.M.M. Millet J. Catal. 261 2009 166 176 Q. Huynh, Y. Schuurman, P. Delichere, S. Loridant, and J.M. M. Millet, Study of Te and V as counter-cations in Keggin type phosphomolybdic polyoxometalate catalysts for isobutane oxidation, J. Catal. 261 (2009) 166–176. [12] C. Knapp T. Ui K. Nagai N. Mizuno Catal. Today 71 2001 111 119 C. Knapp, T. Ui, K. Nagai, and N. Mizuno, Stability of iron in the Keggin anion of heteropoly acid catalysts for selective oxidation of isobutane, Catal. Today 71 (2001) 111–119. [13] S. Liu J. Energy Chem. 25 2016 85 92 S. Liu, Effects of Cs-substitution and partial reduction on catalytic performance of Keggin-type phosphomolybdic polyoxometalates for selective oxidation of isobutane, J. Energy Chem. 25 (2016) 85–92. [14] M. Sultan S. Paul M. Fournier D. Vanhove Appl. Catal. A: Gen. 259 2004 141 152 M. Sultan, S. Paul, M. Fournier, and D. Vanhove, Evaluation and design of heteropolycompound catalysts for the selective oxidation of isobutane into methacrylic acid, Appl. Catal. A: Gen. 259 (2004) 141–152. [15] F. Jing B. Katryniok F. Dumeignil E. Bordes-Richard S. Paul J. Catal. 309 2014 121 135 F. Jing, B. Katryniok, F. Dumeignil, E. Bordes-Richard, and S. Paul, Catalytic selective oxidation of isobutane to methacrylic acid on supported (NH4)3HPMo11VO40 catalysts, J. Catal. 309 (2014) 121–135. [16] G.P. Schindler T. Ui K. Nagai Appl. Catal. A: Gen. 206 2001 183 195 G.P. Schindler, T. Ui, and K. Nagai, Kinetics of isobutane selective oxidation over Mo-V-P-As-Cs-Cu-O heteropoly acid catalyst, Appl. Catal. A: Gen. 206 (2001) 183–195. [17] S. Yasuda J. Hirata M. Kanno W. Ninomiya R. Otomo Y. Kamiya Appl. Catal. A: Gen. 570 2019 164 172 S. Yasuda, J. Hirata, M. Kanno, W. Ninomiya, R. Otomo, and Y. Kamiya, The role of steam in selective oxidation of methacrolein over H3PMo12O40, Appl. Catal. A: Gen. 570 (2019) 164–172. [18] H. Böhnke J. Gaube J. Petzoldt Ind. Eng. Chem. Res 45 2006 8794 8800 H. Böhnke, J. Gaube, and J. Petzoldt, Selective oxidation of methacrolein towards methacrylic acid on mixed oxide (Mo, V, W) catalysts. Part 1. Studies on kinetics, Ind. Eng. Chem. Res. 45 (2006) 8794–8800. [19] E.M. Gaigneaux M.J. Genet P. Ruiz B. Delmon J. Phys. Chem. B 104 2000 5724 5737 E.M. Gaigneaux, M.J. Genet, P. Ruiz, and B. Delmon, Catalytic behavior of molybdenum suboxides in the selective oxidation of isobutene to methacrolein, J. Phys. Chem. B 104 (2000) 5724–5737. [20] S. Paul V. Le Courtois D. Vanhove Ind. Eng. Chem. Res. 36 1997 3391 3399 S. Paul, V. Le Courtois, and D. Vanhove, Kinetic Investigation of Isobutane Selective Oxidation over a Heteropolyanion Catalyst, Ind. Eng. Chem. Res. 36 (1997) 3391–3399. [21] M. Misono , Top. Catal. 21 2002 89 96 M. Misono, Selective oxidation of butanes. Toward green / sustainable chemistry, Top. Catal. 21 (2002) 89–96. [22] S.S. Wang G.Y. Yang Chem. Rev. 115 2015 4893 4962 S.S. Wang and G.Y. Yang, Recent Advances in Polyoxometalate-Catalyzed Reactions, Chem. Rev. 115 (2015) 4893–4962. [23] O. Watzenberger G. Emig D.T. Lynch J. Catal. 124 1990 247 258 O. Watzenberger, G. Emig, and D.T. Lynch, Oxydehydrogenation of isobutyric acid with heteropolyacid catalysts: Experimental observations of deactivation, J. Catal. 124 (1990) 247–258. [24] M. Wang J. Ma H. Liu N. Luo Z. Zhao F. Wang ACS Catal. 8 2018 2129 2165 M. Wang, J. Ma, H. Liu, N. Luo, Z. Zhao, and F. Wang, Sustainable Productions of Organic Acids and Their Derivatives from Biomass via Selective Oxidative Cleavage of C-C Bond, ACS Catal. 8 (2018) 2129–2165. [25] G.P. Schindler C. Knapp T. Ui K. Nagai Top. Catal. 22 2003 117 121 G.P. Schindler, C. Knapp, T. Ui, and K. Nagai, Enhancing the productivity of isobutane selective oxidation over a Mo-V-P-As-Cs-Cu-O heteropoly acid catalyst, Top. Catal. 22 (2003) 117–121. [26] N. Mizuno J. Mol. Catal. A: Chem. 114 1996 309 317 N. Mizuno, Catalytic performance of Cs2.5Fe0.08 H1.26PVMo11O40 for direct oxidation of lower alkanes, J. Mol. Catal. A: Chem. 114 (1996) 309–317. [27] J. He Y. Liu W. Chu W. Yang Appl. Catal. A: Gen. 556 2017 104 112 J. He, Y. Liu, W. Chu, and W. Yang, Effect of V-containing precursors on the structure and catalytic performance of Cs-substituted phosphomolybdates for isobutane oxidation, Appl. Catal. A: Gen. 556 (2017) 104–112. [28] (a) Y. Liu J. He W. Chu W. Yang Catal. Sci. Technol. 8 2018 5774 5781 (a)Y. Liu, J. He, W. Chu, and W. Yang, Polyoxometalate catalysts with co-substituted VO2+ and transition metals and their catalytic performance for the oxidation of isobutane, Catal. Sci. Technol. 8 (2018) 5774–5781. (b) Y. Liu, J. He, W. Chu, and W. Yang, Polyoxometalate catalysts with co-substituted VO2+ and transition metals and their catalytic performance for the oxidation of isobutane, Catal. Sci. Technol. 8 (2018) 5774–5781. (b) Y. Liu J. He W. Chu W. Yang Catal. Sci. Technol. 8 2018 5774 5781 (a)Y. Liu, J. He, W. Chu, and W. Yang, Polyoxometalate catalysts with co-substituted VO2+ and transition metals and their catalytic performance for the oxidation of isobutane, Catal. Sci. Technol. 8 (2018) 5774–5781. (b) Y. Liu, J. He, W. Chu, and W. Yang, Polyoxometalate catalysts with co-substituted VO2+ and transition metals and their catalytic performance for the oxidation of isobutane, Catal. Sci. Technol. 8 (2018) 5774–5781. [29] S.M. Kendell T.C. Brown R.C. Burns Catal. Today 131 2008 526 532 S.M. Kendell, T.C. Brown, and R.C. Burns, Accurate low-pressure kinetics for isobutane oxidation over phosphomolybdic acid and copper (II) phosphomolybdates, Catal. Today 131 (2008) 526–532. [30] Q. Deng S. Jiang T. Cai Z. Peng Z. Fang J. Mol. Catal. A: Chem. 229 2005 165 170 Q. Deng, S. Jiang, T. Cai, Z. Peng, and Z. Fang, Selective oxidation of isobutane over HxFe0.12Mo11VPAs0.3Oy heteropoly compound catalyst, J. Mol. Catal. A: Chem. 229 (2005) 165–170. [31] H. Zhang R. Yan L. Yang Y. Diao L. Wang S. Zhang Ind. Eng. Chem. Res. 52 2013 4484 4490 H. Zhang, R. Yan, L. Yang, Y. Diao, L. Wang, and S. Zhang, Investigation of Cu-and Fe-doped CsH3PMo11VO40 heteropoly compounds for the selective oxidation of methacrolein to methacrylic acid, Ind. Eng. Chem. Res. 52 (2013) 4484–4490. [32] N. Mizuno M. Tateishi M. Iwamoto J. Catal. 163 1996 87 94 N. Mizuno, M. Tateishi, and M. Iwamoto, Oxidation of isobutane catalyzed by CsxH3-xPMo12O40-based heteropoly compounds, J. Catal. 163(1996) 87–94. [33] A. Brückner J. Catal. 245 2007 369 380 A. Brückner, Structural evolution of H4PVMo11O40∙xH2O during calcination and isobutane oxidation: New insights into vanadium sites by a comprehensive in situ approach, J. Catal. 245(2007) 369–380. [34] G. Mestl Appl. Catal. A: Gen. 210 2001 13 34 G. Mestl, Thermally and chemically induced structural transformations of Keggin-type heteropoly acid catalysts, Appl. Catal. A: Gen. 210 (2001) 13–34. [35] S. Ishikawa N. Noda M. Wada S. Tsurumi W. Ueda ACS Catal. 10 2020 10535 10545 S. Ishikawa, N. Noda, M. Wada, S. Tsurumi, and W. Ueda, Selective Oxidation of Methacrolein over Crystalline Mo3VOxCatalysts and Comparison of Their Catalytic Properties with Heteropoly Acid Catalysts, ACS Catal. 10 (2020) 10535–10545. [36] S. Mo Appl. Catal. B: Environ. 264 2020 118464 S. Mo, Highly efficient mesoporous MnO2 catalysts for the total toluene oxidation: Oxygen-Vacancy defect engineering and involved intermediates using in situ DRIFTS, Appl. Catal. B: Environ. 264 (2020) 118464. [37] X. Xing T. Zhao J. Cheng Chin. Chem. Lett. 33 2022 3065 3072 X. Xing, T. Zhao, J. Cheng, Promotional effect of Cu additive for the selective catalytic oxidation of n-butylamine over CeZrOx catalyst, Chin. Chem. Lett. 33 (2022) 3065–3072. [38] R. You Z. Li Rev. Sci. Instrum. 89 2018 064101 R. You and Z. Li, A flow-pulse adsorption-microcalorimetry system for studies of adsorption processes on powder catalysts, Rev. Sci. Instrum. 89 (2018) 064101. [39] M.J. Darabi Mahboub J.L. Dubois F. Cavani M. Rostamizadeh G.S. Patience Chem. Soc. Rev. 47 2018 7703 7738 M.J. Darabi Mahboub, J.L. Dubois, F. Cavani, M. Rostamizadeh, and G.S. Patience, Catalysis for the synthesis of methacrylic acid and methyl methacrylate, Chem. Soc. Rev. 47 (2018) 7703–7738. [40] M. Misono Catal. Rev. -Sci. Eng. 29 1987 269 321 M. Misono, Heterogeneous catalysis by heteropoly compounds of molybdenum and tungsten, Catal. Rev.-Sci. Eng. 29 (1987) 269–321. [41] K. Bruckman J. Haber E.M. Serwicka Faraday Discuss. Chem. Soc. 87 1989 173 187 K. Bruckman, J. Haber, and E.M. Serwicka, Acid-base and oxidation catalysis on heteropolysalts with surface acid layers, Faraday Discuss. Chem. Soc. 87 (1989) 173–187. [42] J. He Y. Liu W. Chu W. Yang Appl. Catal. A: Gen. 556 2018 104 112 J. He, Y. Liu, W. Chu, and W. Yang, Effect of V-containing precursors on the structure and catalytic performance of Cs-substituted phosphomolybdates for isobutane oxidation, Appl. Catal. A: Gen. 556 (2018) 104–112. [43] J. Liu J. Phys. Chem. C. 121 2017 4970 4979 J. Liu, Facet−Activity Relationship of TiO2 in Fe2O3/TiO2 Nanocatalysts for Selective Catalytic Reduction of NO with NH3: In Situ DRIFTs and DFT Studies, J. Phys. Chem. C. 121 (2017) 4970−4979. [44] R. Wu N. Zhang L. Li H. He L. Song W. Qiu Catalysts 8 2018 2 11 R. Wu, N. Zhang, L. Li, H. He, L. Song, and W. Qiu, Drift study on promotion effect of the keggin structure over V2O5-MoO3/TiO2 catalysts for low temperature NH3-SCR reaction, Catalysts 8 (2018) 2–11. [45] Z. Ma X. Wu H. Härelind D. Weng B. Wang Z. Si J. Mol. Catal. A: Chem. 423 2016 172 180 Z. Ma, X. Wu, H. Härelind, D. Weng, B. Wang, and Z. Si, NH3-SCR reaction mechanisms of NbOx/Ce0.75Zr0.25O2 catalyst: DRIFTS and kinetics studies, J. Mol. Catal. A: Chem. 423 (2016) 172–180. [46] N. Ballarini F. Candiracci F. Cavani H. Degrand J. Dubois G. Lucarelli Appl. Catal. A: Gen. 325 2007 263 269 N. Ballarini, F. Candiracci, F. Cavani, H. Degrand, J. Dubois, and G. Lucarelli, The dispersion of Keggin-type P/Mo polyoxometalates inside silica gel, and the preparation of catalysts for the oxidation of isobutane to methacrolein and methacrylic acid, Appl. Catal. A: Gen. 325 (2007) 263–269. [47] C.R.T.T. Juliana Casarina Affonso Celso Gonçalves Jrb Mariana Gava Segatellia React. Funct. Polym. 121 2017 101 109 C.R. T.T. Juliana Casarina, Affonso Celso Gonçalves Jrb, Mariana Gava Segatellia, Poly(methacrylic acid)/SiO2/Al2O3 based organic-inorganic hybrid adsorbent for adsorption of imazethapyr herbicide from aqueous medium Juliana. Reactive and Functional Polymers. 121 (2017) 101–109. [48] T.S. Anirudhan S.R. Rejeena Sep. Purif. Technol. 119 2013 82 93 S.R. R.T.S. Anirudhan, Poly(methacrylic acid-co-vinyl sulfonic acid)-grafted-magnetite/nanocellulose superabsorbent composite for the selective recovery and separation of immunoglobulin from aqueous solutions, Separation and Purification Technology. 119 (2013) 82–93. [49] M. Farsi A. Jahanmiri M.R. Rahimpour J. Ener. Chem. 22 2013 633 638 M. Farsi, A. Jahanmiri, M.R. Rahimpour, Optimal operating conditions of radial flow moving-bed reactors for isobutane dehydrogenation, J. Ener. Chem. 22 (2013) 633–638. [50] F. Wang G. Wang X. Niu Int. J. Chem. React. Eng. 14 2016 105 112 F. Wang, G. Wang, X. Niu, Study on the effect of nickel doping on Mo-Bi based catalyst for selective oxidation of isobutene to methacrolein, Int. J. Chem. React. Eng. 14 (2016) 105–112. [51] Y. Liu S. Wang Y. Li X. Cai M. Zhu X. Han Appl. Catal. A: Gen. 643 2022 118789 Y. Liu, S. Wang, Y. Li, X. Cai, M. Zhu, X. Han, (NH4)Cu0.2H2.8PMo11VO40 via a hydrothermal homogeneous precipitation method for selective oxidation of methacrolein to methacrylic acid, Appl. Catal. A: Gen. 643 (2022) 118789.",
      "scopus-id": "85142337894",
      "coredata": {
        "eid": "1-s2.0-S0926860X22004975",
        "dc:description": "In this paper, a series of heteropoly acids, (Cs2.2Cu0.26V0.38)xPMo12O40 (x = 1.3, 1.1, 1.0, 0.88), are prepared, characterized and examined as the catalysts for the oxidation of isobutane to MAA. Under the employed reaction condition, Cs2.23Cu0.26V0.38PMo12O40 exhibits an isobutane conversion of 20% and a MAA selectivity of 51% at 335 °C, giving a MAA yield of 0.68 mmolMAA·h−1·gcatalyst −1. Lattice oxygen mobility and acidity of (Cs2.2Cu0.26V0.38)xPMo12O40 catalysts play key roles. A fast migration rate and a moderate release rate of lattice oxygen are beneficial to the selective oxidation of isobutane to MAA. Cs2.2Cu0.26V0.38PMo12O40 exhibits strong acid sites facilitating MAA desorption and surface sites strongly binding MAA, causing MAA polymerization which blocks the active sites and decreases the long-term catalytic activity. These results demonstrate that the optimization of lattice oxygen mobility and surface acidity is an effective strategy to fabricate efficient heteropoly acid catalysts for the oxidation of isobutane to MAA.",
        "openArchiveArticle": "false",
        "prism:coverDate": "2023-01-05",
        "openaccessUserLicense": null,
        "prism:aggregationType": "Journal",
        "prism:url": "https://api.elsevier.com/content/article/pii/S0926860X22004975",
        "dc:creator": [
          {
            "@_fa": "true",
            "$": "Wang, Yichuan"
          },
          {
            "@_fa": "true",
            "$": "Wei, Zeyue"
          },
          {
            "@_fa": "true",
            "$": "Zhang, Xuanyu"
          },
          {
            "@_fa": "true",
            "$": "Huang, Weixin"
          }
        ],
        "link": [
          {
            "@_fa": "true",
            "@rel": "self",
            "@href": "https://api.elsevier.com/content/article/pii/S0926860X22004975"
          },
          {
            "@_fa": "true",
            "@rel": "scidir",
            "@href": "https://www.sciencedirect.com/science/article/pii/S0926860X22004975"
          }
        ],
        "dc:format": "application/json",
        "openaccessType": null,
        "pii": "S0926-860X(22)00497-5",
        "prism:volume": "649",
        "articleNumber": "118974",
        "prism:publisher": "Elsevier B.V.",
        "dc:title": "Optimizing lattice oxygen mobility and acidity of heteropoly acid catalysts for oxidation of isobutane to methacrylic acid",
        "prism:copyright": "© 2022 Elsevier B.V. All rights reserved.",
        "openaccess": "0",
        "prism:issn": "0926860X",
        "dcterms:subject": [
          {
            "@_fa": "true",
            "$": "Polyoxometalate"
          },
          {
            "@_fa": "true",
            "$": "Keggin-type structure"
          },
          {
            "@_fa": "true",
            "$": "Selective oxidation"
          },
          {
            "@_fa": "true",
            "$": "Structure-activity relation"
          },
          {
            "@_fa": "true",
            "$": "Reaction mechanism"
          }
        ],
        "openaccessArticle": "false",
        "prism:publicationName": "Applied Catalysis A: General",
        "openaccessSponsorType": null,
        "prism:pageRange": "118974",
        "pubType": "fla",
        "prism:coverDisplayDate": "5 January 2023",
        "prism:doi": "10.1016/j.apcata.2022.118974",
        "prism:startingPage": "118974",
        "dc:identifier": "doi:10.1016/j.apcata.2022.118974",
        "openaccessSponsorName": null
      },
      "objects": {
        "object": [
          {
            "@category": "standard",
            "@height": "813",
            "@width": "678",
            "@_fa": "true",
            "$": "https://api.elsevier.com/content/object/eid/1-s2.0-S0926860X22004975-gr1.jpg?httpAccept=%2A%2F%2A",
            "@multimediatype": "JPEG image file",
            "@type": "IMAGE-DOWNSAMPLED",
            "@size": "178668",
            "@ref": "gr1",
            "@mimetype": "image/jpeg"
          },
          {
            "@category": "standard",
            "@height": "258",
            "@width": "791",
            "@_fa": "true",
            "$": "https://api.elsevier.com/content/object/eid/1-s2.0-S0926860X22004975-gr3.jpg?httpAccept=%2A%2F%2A",
            "@multimediatype": "JPEG image file",
            "@type": "IMAGE-DOWNSAMPLED",
            "@size": "84472",
            "@ref": "gr3",
            "@mimetype": "image/jpeg"
          },
          {
            "@category": "standard",
            "@height": "340",
            "@width": "678",
            "@_fa": "true",
            "$": "https://api.elsevier.com/content/object/eid/1-s2.0-S0926860X22004975-gr10.jpg?httpAccept=%2A%2F%2A",
            "@multimediatype": "JPEG image file",
            "@type": "IMAGE-DOWNSAMPLED",
            "@size": "75213",
            "@ref": "gr10",
            "@mimetype": "image/jpeg"
          },
          {
            "@category": "standard",
            "@height": "480",
            "@width": "376",
            "@_fa": "true",
            "$": "https://api.elsevier.com/content/object/eid/1-s2.0-S0926860X22004975-gr2.jpg?httpAccept=%2A%2F%2A",
            "@multimediatype": "JPEG image file",
            "@type": "IMAGE-DOWNSAMPLED",
            "@size": "48792",
            "@ref": "gr2",
            "@mimetype": "image/jpeg"
          },
          {
            "@category": "standard",
            "@height": "200",
            "@width": "400",
            "@_fa": "true",
            "$": "https://api.elsevier.com/content/object/eid/1-s2.0-S0926860X22004975-ga1.jpg?httpAccept=%2A%2F%2A",
            "@multimediatype": "JPEG image file",
            "@type": "IMAGE-DOWNSAMPLED",
            "@size": "19561",
            "@ref": "ga1",
            "@mimetype": "image/jpeg"
          },
          {
            "@category": "standard",
            "@height": "330",
            "@width": "678",
            "@_fa": "true",
            "$": "https://api.elsevier.com/content/object/eid/1-s2.0-S0926860X22004975-gr9.jpg?httpAccept=%2A%2F%2A",
            "@multimediatype": "JPEG image file",
            "@type": "IMAGE-DOWNSAMPLED",
            "@size": "78851",
            "@ref": "gr9",
            "@mimetype": "image/jpeg"
          },
          {
            "@category": "standard",
            "@height": "300",
            "@width": "678",
            "@_fa": "true",
            "$": "https://api.elsevier.com/content/object/eid/1-s2.0-S0926860X22004975-gr8.jpg?httpAccept=%2A%2F%2A",
            "@multimediatype": "JPEG image file",
            "@type": "IMAGE-DOWNSAMPLED",
            "@size": "48690",
            "@ref": "gr8",
            "@mimetype": "image/jpeg"
          },
          {
            "@category": "standard",
            "@height": "276",
            "@width": "791",
            "@_fa": "true",
            "$": "https://api.elsevier.com/content/object/eid/1-s2.0-S0926860X22004975-gr5.jpg?httpAccept=%2A%2F%2A",
            "@multimediatype": "JPEG image file",
            "@type": "IMAGE-DOWNSAMPLED",
            "@size": "52599",
            "@ref": "gr5",
            "@mimetype": "image/jpeg"
          },
          {
            "@category": "standard",
            "@height": "188",
            "@width": "565",
            "@_fa": "true",
            "$": "https://api.elsevier.com/content/object/eid/1-s2.0-S0926860X22004975-gr4.jpg?httpAccept=%2A%2F%2A",
            "@multimediatype": "JPEG image file",
            "@type": "IMAGE-DOWNSAMPLED",
            "@size": "46076",
            "@ref": "gr4",
            "@mimetype": "image/jpeg"
          },
          {
            "@category": "standard",
            "@height": "321",
            "@width": "751",
            "@_fa": "true",
            "$": "https://api.elsevier.com/content/object/eid/1-s2.0-S0926860X22004975-gr7.jpg?httpAccept=%2A%2F%2A",
            "@multimediatype": "JPEG image file",
            "@type": "IMAGE-DOWNSAMPLED",
            "@size": "62362",
            "@ref": "gr7",
            "@mimetype": "image/jpeg"
          },
          {
            "@category": "standard",
            "@height": "259",
            "@width": "791",
            "@_fa": "true",
            "$": "https://api.elsevier.com/content/object/eid/1-s2.0-S0926860X22004975-gr6.jpg?httpAccept=%2A%2F%2A",
            "@multimediatype": "JPEG image file",
            "@type": "IMAGE-DOWNSAMPLED",
            "@size": "54629",
            "@ref": "gr6",
            "@mimetype": "image/jpeg"
          },
          {
            "@category": "thumbnail",
            "@height": "163",
            "@width": "136",
            "@_fa": "true",
            "$": "https://api.elsevier.com/content/object/eid/1-s2.0-S0926860X22004975-gr1.sml?httpAccept=%2A%2F%2A",
            "@multimediatype": "GIF image file",
            "@type": "IMAGE-THUMBNAIL",
            "@size": "13128",
            "@ref": "gr1",
            "@mimetype": "image/gif"
          },
          {
            "@category": "thumbnail",
            "@height": "71",
            "@width": "219",
            "@_fa": "true",
            "$": "https://api.elsevier.com/content/object/eid/1-s2.0-S0926860X22004975-gr3.sml?httpAccept=%2A%2F%2A",
            "@multimediatype": "GIF image file",
            "@type": "IMAGE-THUMBNAIL",
            "@size": "11357",
            "@ref": "gr3",
            "@mimetype": "image/gif"
          },
          {
            "@category": "thumbnail",
            "@height": "110",
            "@width": "219",
            "@_fa": "true",
            "$": "https://api.elsevier.com/content/object/eid/1-s2.0-S0926860X22004975-gr10.sml?httpAccept=%2A%2F%2A",
            "@multimediatype": "GIF image file",
            "@type": "IMAGE-THUMBNAIL",
            "@size": "12264",
            "@ref": "gr10",
            "@mimetype": "image/gif"
          },
          {
            "@category": "thumbnail",
            "@height": "163",
            "@width": "128",
            "@_fa": "true",
            "$": "https://api.elsevier.com/content/object/eid/1-s2.0-S0926860X22004975-gr2.sml?httpAccept=%2A%2F%2A",
            "@multimediatype": "GIF image file",
            "@type": "IMAGE-THUMBNAIL",
            "@size": "8519",
            "@ref": "gr2",
            "@mimetype": "image/gif"
          },
          {
            "@category": "thumbnail",
            "@height": "110",
            "@width": "219",
            "@_fa": "true",
            "$": "https://api.elsevier.com/content/object/eid/1-s2.0-S0926860X22004975-ga1.sml?httpAccept=%2A%2F%2A",
            "@multimediatype": "GIF image file",
            "@type": "IMAGE-THUMBNAIL",
            "@size": "7293",
            "@ref": "ga1",
            "@mimetype": "image/gif"
          },
          {
            "@category": "thumbnail",
            "@height": "107",
            "@width": "219",
            "@_fa": "true",
            "$": "https://api.elsevier.com/content/object/eid/1-s2.0-S0926860X22004975-gr9.sml?httpAccept=%2A%2F%2A",
            "@multimediatype": "GIF image file",
            "@type": "IMAGE-THUMBNAIL",
            "@size": "12064",
            "@ref": "gr9",
            "@mimetype": "image/gif"
          },
          {
            "@category": "thumbnail",
            "@height": "97",
            "@width": "219",
            "@_fa": "true",
            "$": "https://api.elsevier.com/content/object/eid/1-s2.0-S0926860X22004975-gr8.sml?httpAccept=%2A%2F%2A",
            "@multimediatype": "GIF image file",
            "@type": "IMAGE-THUMBNAIL",
            "@size": "7840",
            "@ref": "gr8",
            "@mimetype": "image/gif"
          },
          {
            "@category": "thumbnail",
            "@height": "77",
            "@width": "219",
            "@_fa": "true",
            "$": "https://api.elsevier.com/content/object/eid/1-s2.0-S0926860X22004975-gr5.sml?httpAccept=%2A%2F%2A",
            "@multimediatype": "GIF image file",
            "@type": "IMAGE-THUMBNAIL",
            "@size": "7032",
            "@ref": "gr5",
            "@mimetype": "image/gif"
          },
          {
            "@category": "thumbnail",
            "@height": "73",
            "@width": "219",
            "@_fa": "true",
            "$": "https://api.elsevier.com/content/object/eid/1-s2.0-S0926860X22004975-gr4.sml?httpAccept=%2A%2F%2A",
            "@multimediatype": "GIF image file",
            "@type": "IMAGE-THUMBNAIL",
            "@size": "13525",
            "@ref": "gr4",
            "@mimetype": "image/gif"
          },
          {
            "@category": "thumbnail",
            "@height": "94",
            "@width": "219",
            "@_fa": "true",
            "$": "https://api.elsevier.com/content/object/eid/1-s2.0-S0926860X22004975-gr7.sml?httpAccept=%2A%2F%2A",
            "@multimediatype": "GIF image file",
            "@type": "IMAGE-THUMBNAIL",
            "@size": "9444",
            "@ref": "gr7",
            "@mimetype": "image/gif"
          },
          {
            "@category": "thumbnail",
            "@height": "72",
            "@width": "219",
            "@_fa": "true",
            "$": "https://api.elsevier.com/content/object/eid/1-s2.0-S0926860X22004975-gr6.sml?httpAccept=%2A%2F%2A",
            "@multimediatype": "GIF image file",
            "@type": "IMAGE-THUMBNAIL",
            "@size": "8164",
            "@ref": "gr6",
            "@mimetype": "image/gif"
          },
          {
            "@category": "high",
            "@height": "3592",
            "@width": "2994",
            "@_fa": "true",
            "$": "https://api.elsevier.com/content/object/eid/1-s2.0-S0926860X22004975-gr1_lrg.jpg?httpAccept=%2A%2F%2A",
            "@multimediatype": "JPEG image file",
            "@type": "IMAGE-HIGH-RES",
            "@size": "1004862",
            "@ref": "gr1",
            "@mimetype": "image/jpeg"
          },
          {
            "@category": "high",
            "@height": "1140",
            "@width": "3493",
            "@_fa": "true",
            "$": "https://api.elsevier.com/content/object/eid/1-s2.0-S0926860X22004975-gr3_lrg.jpg?httpAccept=%2A%2F%2A",
            "@multimediatype": "JPEG image file",
            "@type": "IMAGE-HIGH-RES",
            "@size": "419498",
            "@ref": "gr3",
            "@mimetype": "image/jpeg"
          },
          {
            "@category": "high",
            "@height": "1500",
            "@width": "2994",
            "@_fa": "true",
            "$": "https://api.elsevier.com/content/object/eid/1-s2.0-S0926860X22004975-gr10_lrg.jpg?httpAccept=%2A%2F%2A",
            "@multimediatype": "JPEG image file",
            "@type": "IMAGE-HIGH-RES",
            "@size": "372017",
            "@ref": "gr10",
            "@mimetype": "image/jpeg"
          },
          {
            "@category": "high",
            "@height": "2123",
            "@width": "1663",
            "@_fa": "true",
            "$": "https://api.elsevier.com/content/object/eid/1-s2.0-S0926860X22004975-gr2_lrg.jpg?httpAccept=%2A%2F%2A",
            "@multimediatype": "JPEG image file",
            "@type": "IMAGE-HIGH-RES",
            "@size": "239352",
            "@ref": "gr2",
            "@mimetype": "image/jpeg"
          },
          {
            "@category": "high",
            "@height": "886",
            "@width": "1770",
            "@_fa": "true",
            "$": "https://api.elsevier.com/content/object/eid/1-s2.0-S0926860X22004975-ga1_lrg.jpg?httpAccept=%2A%2F%2A",
            "@multimediatype": "JPEG image file",
            "@type": "IMAGE-HIGH-RES",
            "@size": "152459",
            "@ref": "ga1",
            "@mimetype": "image/jpeg"
          },
          {
            "@category": "high",
            "@height": "1458",
            "@width": "2994",
            "@_fa": "true",
            "$": "https://api.elsevier.com/content/object/eid/1-s2.0-S0926860X22004975-gr9_lrg.jpg?httpAccept=%2A%2F%2A",
            "@multimediatype": "JPEG image file",
            "@type": "IMAGE-HIGH-RES",
            "@size": "385675",
            "@ref": "gr9",
            "@mimetype": "image/jpeg"
          },
          {
            "@category": "high",
            "@height": "1324",
            "@width": "2994",
            "@_fa": "true",
            "$": "https://api.elsevier.com/content/object/eid/1-s2.0-S0926860X22004975-gr8_lrg.jpg?httpAccept=%2A%2F%2A",
            "@multimediatype": "JPEG image file",
            "@type": "IMAGE-HIGH-RES",
            "@size": "238902",
            "@ref": "gr8",
            "@mimetype": "image/jpeg"
          },
          {
            "@category": "high",
            "@height": "1221",
            "@width": "3493",
            "@_fa": "true",
            "$": "https://api.elsevier.com/content/object/eid/1-s2.0-S0926860X22004975-gr5_lrg.jpg?httpAccept=%2A%2F%2A",
            "@multimediatype": "JPEG image file",
            "@type": "IMAGE-HIGH-RES",
            "@size": "254050",
            "@ref": "gr5",
            "@mimetype": "image/jpeg"
          },
          {
            "@category": "high",
            "@height": "832",
            "@width": "2495",
            "@_fa": "true",
            "$": "https://api.elsevier.com/content/object/eid/1-s2.0-S0926860X22004975-gr4_lrg.jpg?httpAccept=%2A%2F%2A",
            "@multimediatype": "JPEG image file",
            "@type": "IMAGE-HIGH-RES",
            "@size": "212234",
            "@ref": "gr4",
            "@mimetype": "image/jpeg"
          },
          {
            "@category": "high",
            "@height": "1422",
            "@width": "3326",
            "@_fa": "true",
            "$": "https://api.elsevier.com/content/object/eid/1-s2.0-S0926860X22004975-gr7_lrg.jpg?httpAccept=%2A%2F%2A",
            "@multimediatype": "JPEG image file",
            "@type": "IMAGE-HIGH-RES",
            "@size": "309208",
            "@ref": "gr7",
            "@mimetype": "image/jpeg"
          },
          {
            "@category": "high",
            "@height": "1143",
            "@width": "3493",
            "@_fa": "true",
            "$": "https://api.elsevier.com/content/object/eid/1-s2.0-S0926860X22004975-gr6_lrg.jpg?httpAccept=%2A%2F%2A",
            "@multimediatype": "JPEG image file",
            "@type": "IMAGE-HIGH-RES",
            "@size": "270081",
            "@ref": "gr6",
            "@mimetype": "image/jpeg"
          },
          {
            "@category": "standard",
            "@_fa": "true",
            "$": "https://api.elsevier.com/content/object/eid/1-s2.0-S0926860X22004975-mmc1.pdf?httpAccept=%2A%2F%2A",
            "@multimediatype": "Acrobat PDF file",
            "@type": "APPLICATION",
            "@size": "3429250",
            "@ref": "mmc1",
            "@mimetype": "application/pdf"
          },
          {
            "@category": "standard",
            "@_fa": "true",
            "$": "https://api.elsevier.com/content/object/eid/1-s2.0-S0926860X22004975-am.pdf?httpAccept=%2A%2F%2A",
            "@multimediatype": "Acrobat PDF file",
            "@type": "AAM-PDF",
            "@size": "3207183",
            "@ref": "am",
            "@mimetype": "application/pdf"
          }
        ]
      },
      "link": {
        "@rel": "abstract",
        "@href": "https://api.elsevier.com/content/abstract/scopus_id/85142337894"
      }
    }
  }
}