{
  "metadata": {
    "title": "An efficient method for the synthesis of cyclic carbonates from CO<ce:inf loc=post>2</ce:inf> and epoxides using an effective two-component catalyst system: Polymer-supported quaternary onium salts and aqueous solutions of metal salts",
    "authors": "; ; ",
    "journal": "Applied Catalysis A: General",
    "date": "2014-07-22",
    "doi": "10.1016/j.apcata.2014.05.033",
    "abstract": "",
    "uri": "https://api.elsevier.com/content/article/pii/S0926860X14003676",
    "pii": "S0926860X14003676"
  },
  "fulltext": {
    "full-text-retrieval-response": {
      "scopus-eid": "2-s2.0-84903213724",
      "originalText": "serial JL 271346 291210 291744 291809 31 Applied Catalysis A: General APPLIEDCATALYSISAGENERAL 2014-06-04 2014-06-04 2014-07-21T16:56:42 1-s2.0-S0926860X14003676 S0926-860X(14)00367-6 S0926860X14003676 10.1016/j.apcata.2014.05.033 S300 S300.1 FULL-TEXT 1-s2.0-S0926860X14X0013X 2024-01-01T12:30:29.635264Z 0 0 20140722 2014 2014-06-04T00:00:00Z absattachment articleinfo articletitlenorm authfirstinitialnorm authfirstsurnamenorm cid cids contenttype copyright crossmark dateloaded dateloadedtxt datesearch datesort dateupdated dco docsubtype doctype doi eid ewtransactionid hubeid indexeddate issn issnnorm itemstage itemtransactionid itemweight openaccess openarchive pg pgfirst pglast pii piinorm pubdatestart pubdatetxt pubyr sectiontitle sortorder srctitle srctitlenorm srctype subheadings suppl tomb volfirst volissue volumelist webpdf webpdfpagecount yearnav figure table e-component body mmlmath acknowledge affil appendices articletitle auth authfirstini authfull authkeywords authlast highlightsabst primabst ref specialabst alllist content subj ssids 0926-860X 0926860X true 482 482 C Volume 482 34 266 274 266 274 20140722 22 July 2014 2014-07-22 2014 Articles article fla Copyright © 2014 Elsevier B.V. All rights reserved. EFFICIENTMETHODFORSYNTHESISCYCLICCARBONATESCO2EPOXIDESUSINGEFFECTIVETWOCOMPONENTCATALYSTSYSTEMPOLYMERSUPPORTEDQUATERNARYONIUMSALTSAQUEOUSSOLUTIONSMETALSALTS SIEWNIAK A 1 Introduction 2 Experimental 2.1 Synthesis of polymer-supported quaternary ammonium salts 2.2 Synthesis of cyclic carbonates 3 Results and discussion 3.1 Choice of the catalytic system 3.2 The effect of reaction conditions 3.3 The effect of the type of co-catalyst 3.4 The effect of type of polymer-supported quaternary salt 3.5 The effect of amount of catalyst PS-TBMAC 3.6 The effect of water 3.7 Synthesis of cyclic carbonates from various epoxides and CO2 3.8 Catalyst recycling test 4 Conclusion Acknowledgment Appendix A Supplementary data References SAKAKURA 2007 2365 2387 T CLEMENTS 2003 663 674 J FRECH 1996 61 66 R WAKIHARA 1998 M LITHIUMIONBATTERIESFUNDAMENTALSPERFORMANCE MATSUO 1997 1375 1380 J PEPPEL 1958 767 770 W BAYARDON 2007 5971 5974 J SCHAFFNER 2010 4554 4581 B NORTH 2009 862 865 M KIHARA 1993 6198 6202 N ZHOU 2010 765 768 X BHANAGE 2001 259 266 B SHEN 2003 1559 1562 Y TIAN 2012 2029 2035 D NORTH 2012 2736 2740 M CASTROOSMA 2012 1021 1026 J ANSELMO 2012 49 53 D WANG 2007 1493 1495 J MIAO 2008 68 82 C LI 2012 621 636 R PATIL 2010 213 235 Y KIM 2013 1973 1984 D NORTH 2010 1514 1539 M LU 2012 1462 1484 X PESCARMONA 2012 2169 2187 P PENG 2001 639 641 J KIM 2002 1027 1028 Y ZHANG 2006 61 69 S KAWANAMI 2003 896 897 H LAI 2006 6951 6953 G CALO 2002 2561 2563 V SHIM 2006 744 746 J BAI 2012 600 603 D CHANG 2007 241 247 T KOSSEV 2003 29 37 K DHARMAN 2009 1754 1757 M HAN 2011 1023 1028 L CAO 2012 416 424 T HAN 2012 67 72 L ZHANG 2012 1376 1381 Y WATILE 2012 1051 1055 R ZHENG 2009 455 458 X ZHAO 2007 284 289 Y WANG 2006 143 148 J XIONG 2013 1 9 Y TAKAHASHI 2006 1664 1666 T MOLINARI 1979 3920 3927 H CHOI 2013 242 248 H STARKS 1994 C PHASETRANSFERCATALYSISFUNDAMENTALSAPPLICATIONSINDUSTRIALPERSPECTIVES DU 2006 1271 1275 Y TAKAMUKU 1991 10098 10103 T LI 2004 8307 8310 F SIEWNIAKX2014X266 SIEWNIAKX2014X266X274 SIEWNIAKX2014X266XA SIEWNIAKX2014X266X274XA item S0926-860X(14)00367-6 S0926860X14003676 1-s2.0-S0926860X14003676 10.1016/j.apcata.2014.05.033 271346 2024-01-01T12:30:29.635264Z 2014-07-22 1-s2.0-S0926860X14003676-main.pdf https://s3.amazonaws.com/prod-ucs-content-store-us-east/content/pii:S0926860X14003676/MAIN/application/pdf/7c705e1e84f290f770ccfc758c526086/main.pdf https://s3-eu-west-1.amazonaws.com/prod-ucs-content-store-eu-west/content/pii:S0926860X14003676/MAIN/application/pdf/7c705e1e84f290f770ccfc758c526086/main.pdf main.pdf pdf true 1538364 MAIN 9 1-s2.0-S0926860X14003676-main_1.png https://s3.amazonaws.com/prod-ucs-content-store-us-east/content/pii:S0926860X14003676/PREVIEW/image/png/c46d477a75b3b5729294836d295e638c/main_1.png https://s3-eu-west-1.amazonaws.com/prod-ucs-content-store-eu-west/content/pii:S0926860X14003676/PREVIEW/image/png/c46d477a75b3b5729294836d295e638c/main_1.png main_1.png png 57472 849 656 IMAGE-WEB-PDF 1 1-s2.0-S0926860X14003676-si2.gif https://s3.amazonaws.com/prod-ucs-content-store-us-east/content/pii:S0926860X14003676/STRIPIN/image/gif/101f669f4fe1b7d5fac96c8d738290a0/si2.gif https://s3-eu-west-1.amazonaws.com/prod-ucs-content-store-eu-west/content/pii:S0926860X14003676/STRIPIN/image/gif/101f669f4fe1b7d5fac96c8d738290a0/si2.gif si2 si2.gif gif 618 31 135 ALTIMG 1-s2.0-S0926860X14003676-si1.gif https://s3.amazonaws.com/prod-ucs-content-store-us-east/content/pii:S0926860X14003676/STRIPIN/image/gif/bd0dff0f6e8d91ad9eebdf34c48c612e/si1.gif https://s3-eu-west-1.amazonaws.com/prod-ucs-content-store-eu-west/content/pii:S0926860X14003676/STRIPIN/image/gif/bd0dff0f6e8d91ad9eebdf34c48c612e/si1.gif si1 si1.gif gif 1566 41 301 ALTIMG 1-s2.0-S0926860X14003676-mmc1.docx https://s3.amazonaws.com/prod-ucs-content-store-us-east/content/pii:S0926860X14003676/mmc1/MAIN/application/msword/5487e2a7d83aa99c8d86f5d48503813e/mmc1.docx https://s3-eu-west-1.amazonaws.com/prod-ucs-content-store-eu-west/content/pii:S0926860X14003676/mmc1/MAIN/application/msword/5487e2a7d83aa99c8d86f5d48503813e/mmc1.docx mmc1 mmc1.docx docx 12350 APPLICATION 1-s2.0-S0926860X14003676-sc1_lrg.jpg https://s3.amazonaws.com/prod-ucs-content-store-us-east/content/pii:S0926860X14003676/sc1/HIGHRES/image/jpeg/ebed3238dc3d85ab9ec7af9e0e56286b/sc1_lrg.jpg https://s3-eu-west-1.amazonaws.com/prod-ucs-content-store-eu-west/content/pii:S0926860X14003676/sc1/HIGHRES/image/jpeg/ebed3238dc3d85ab9ec7af9e0e56286b/sc1_lrg.jpg sc1 sc1_lrg.jpg jpg 165831 1530 2167 IMAGE-HIGH-RES 1-s2.0-S0926860X14003676-gr3_lrg.jpg https://s3.amazonaws.com/prod-ucs-content-store-us-east/content/pii:S0926860X14003676/gr3/HIGHRES/image/jpeg/f22f8d423d2871c1931d0b510b3ae322/gr3_lrg.jpg https://s3-eu-west-1.amazonaws.com/prod-ucs-content-store-eu-west/content/pii:S0926860X14003676/gr3/HIGHRES/image/jpeg/f22f8d423d2871c1931d0b510b3ae322/gr3_lrg.jpg gr3 gr3_lrg.jpg jpg 410815 1402 2440 IMAGE-HIGH-RES 1-s2.0-S0926860X14003676-gr2_lrg.jpg https://s3.amazonaws.com/prod-ucs-content-store-us-east/content/pii:S0926860X14003676/gr2/HIGHRES/image/jpeg/3fdb7f981bdf7ea030e2636247074e01/gr2_lrg.jpg https://s3-eu-west-1.amazonaws.com/prod-ucs-content-store-eu-west/content/pii:S0926860X14003676/gr2/HIGHRES/image/jpeg/3fdb7f981bdf7ea030e2636247074e01/gr2_lrg.jpg gr2 gr2_lrg.jpg jpg 110438 1276 2438 IMAGE-HIGH-RES 1-s2.0-S0926860X14003676-gr1_lrg.jpg https://s3.amazonaws.com/prod-ucs-content-store-us-east/content/pii:S0926860X14003676/gr1/HIGHRES/image/jpeg/e1d8527045b2bed21907ccdb88fbb70a/gr1_lrg.jpg https://s3-eu-west-1.amazonaws.com/prod-ucs-content-store-eu-west/content/pii:S0926860X14003676/gr1/HIGHRES/image/jpeg/e1d8527045b2bed21907ccdb88fbb70a/gr1_lrg.jpg gr1 gr1_lrg.jpg jpg 427664 1556 2917 IMAGE-HIGH-RES 1-s2.0-S0926860X14003676-fx9_lrg.jpg https://s3.amazonaws.com/prod-ucs-content-store-us-east/content/pii:S0926860X14003676/fx9/HIGHRES/image/jpeg/b0ee262725ca38fd574be96ca1ec14db/fx9_lrg.jpg https://s3-eu-west-1.amazonaws.com/prod-ucs-content-store-eu-west/content/pii:S0926860X14003676/fx9/HIGHRES/image/jpeg/b0ee262725ca38fd574be96ca1ec14db/fx9_lrg.jpg fx9 fx9_lrg.jpg jpg 5520 49 41 IMAGE-HIGH-RES 1-s2.0-S0926860X14003676-fx8_lrg.jpg https://s3.amazonaws.com/prod-ucs-content-store-us-east/content/pii:S0926860X14003676/fx8/HIGHRES/image/jpeg/9f941335893eb5d1a5caaebb901c3c59/fx8_lrg.jpg https://s3-eu-west-1.amazonaws.com/prod-ucs-content-store-eu-west/content/pii:S0926860X14003676/fx8/HIGHRES/image/jpeg/9f941335893eb5d1a5caaebb901c3c59/fx8_lrg.jpg fx8 fx8_lrg.jpg jpg 3184 23 23 IMAGE-HIGH-RES 1-s2.0-S0926860X14003676-fx7_lrg.jpg https://s3.amazonaws.com/prod-ucs-content-store-us-east/content/pii:S0926860X14003676/fx7/HIGHRES/image/jpeg/1d46bb4bb8ebce9af3b3e8d4a1694869/fx7_lrg.jpg https://s3-eu-west-1.amazonaws.com/prod-ucs-content-store-eu-west/content/pii:S0926860X14003676/fx7/HIGHRES/image/jpeg/1d46bb4bb8ebce9af3b3e8d4a1694869/fx7_lrg.jpg fx7 fx7_lrg.jpg jpg 4219 21 21 IMAGE-HIGH-RES 1-s2.0-S0926860X14003676-fx6_lrg.jpg https://s3.amazonaws.com/prod-ucs-content-store-us-east/content/pii:S0926860X14003676/fx6/HIGHRES/image/jpeg/efb9d34db943ca525dfb2dcc2689d0a3/fx6_lrg.jpg https://s3-eu-west-1.amazonaws.com/prod-ucs-content-store-eu-west/content/pii:S0926860X14003676/fx6/HIGHRES/image/jpeg/efb9d34db943ca525dfb2dcc2689d0a3/fx6_lrg.jpg fx6 fx6_lrg.jpg jpg 4161 25 24 IMAGE-HIGH-RES 1-s2.0-S0926860X14003676-fx5_lrg.jpg https://s3.amazonaws.com/prod-ucs-content-store-us-east/content/pii:S0926860X14003676/fx5/HIGHRES/image/jpeg/4fbd54193bb4e6f083ce6cf78f47f9f2/fx5_lrg.jpg https://s3-eu-west-1.amazonaws.com/prod-ucs-content-store-eu-west/content/pii:S0926860X14003676/fx5/HIGHRES/image/jpeg/4fbd54193bb4e6f083ce6cf78f47f9f2/fx5_lrg.jpg fx5 fx5_lrg.jpg jpg 3937 23 26 IMAGE-HIGH-RES 1-s2.0-S0926860X14003676-fx4_lrg.jpg https://s3.amazonaws.com/prod-ucs-content-store-us-east/content/pii:S0926860X14003676/fx4/HIGHRES/image/jpeg/7833dca92ad29b71808bdf88c7c8f940/fx4_lrg.jpg https://s3-eu-west-1.amazonaws.com/prod-ucs-content-store-eu-west/content/pii:S0926860X14003676/fx4/HIGHRES/image/jpeg/7833dca92ad29b71808bdf88c7c8f940/fx4_lrg.jpg fx4 fx4_lrg.jpg jpg 4028 23 22 IMAGE-HIGH-RES 1-s2.0-S0926860X14003676-fx3_lrg.jpg https://s3.amazonaws.com/prod-ucs-content-store-us-east/content/pii:S0926860X14003676/fx3/HIGHRES/image/jpeg/e93d56562329ac8e4e32415a051e7c88/fx3_lrg.jpg https://s3-eu-west-1.amazonaws.com/prod-ucs-content-store-eu-west/content/pii:S0926860X14003676/fx3/HIGHRES/image/jpeg/e93d56562329ac8e4e32415a051e7c88/fx3_lrg.jpg fx3 fx3_lrg.jpg jpg 6970 23 23 IMAGE-HIGH-RES 1-s2.0-S0926860X14003676-fx17_lrg.jpg https://s3.amazonaws.com/prod-ucs-content-store-us-east/content/pii:S0926860X14003676/fx17/HIGHRES/image/jpeg/9cec4ebac34eeccb949734af0e37246c/fx17_lrg.jpg https://s3-eu-west-1.amazonaws.com/prod-ucs-content-store-eu-west/content/pii:S0926860X14003676/fx17/HIGHRES/image/jpeg/9cec4ebac34eeccb949734af0e37246c/fx17_lrg.jpg fx17 fx17_lrg.jpg jpg 16263 294 611 IMAGE-HIGH-RES 1-s2.0-S0926860X14003676-fx16_lrg.jpg https://s3.amazonaws.com/prod-ucs-content-store-us-east/content/pii:S0926860X14003676/fx16/HIGHRES/image/jpeg/95486b7510156b6f6d0eaf1496b05d91/fx16_lrg.jpg https://s3-eu-west-1.amazonaws.com/prod-ucs-content-store-eu-west/content/pii:S0926860X14003676/fx16/HIGHRES/image/jpeg/95486b7510156b6f6d0eaf1496b05d91/fx16_lrg.jpg fx16 fx16_lrg.jpg jpg 11017 295 381 IMAGE-HIGH-RES 1-s2.0-S0926860X14003676-fx15_lrg.jpg https://s3.amazonaws.com/prod-ucs-content-store-us-east/content/pii:S0926860X14003676/fx15/HIGHRES/image/jpeg/f720cf60498e358df96c191363a861c5/fx15_lrg.jpg https://s3-eu-west-1.amazonaws.com/prod-ucs-content-store-eu-west/content/pii:S0926860X14003676/fx15/HIGHRES/image/jpeg/f720cf60498e358df96c191363a861c5/fx15_lrg.jpg fx15 fx15_lrg.jpg jpg 24381 598 588 IMAGE-HIGH-RES 1-s2.0-S0926860X14003676-fx14_lrg.jpg https://s3.amazonaws.com/prod-ucs-content-store-us-east/content/pii:S0926860X14003676/fx14/HIGHRES/image/jpeg/5f9efd919008b3d2fe584145e1ae0dfc/fx14_lrg.jpg https://s3-eu-west-1.amazonaws.com/prod-ucs-content-store-eu-west/content/pii:S0926860X14003676/fx14/HIGHRES/image/jpeg/5f9efd919008b3d2fe584145e1ae0dfc/fx14_lrg.jpg fx14 fx14_lrg.jpg jpg 15762 420 487 IMAGE-HIGH-RES 1-s2.0-S0926860X14003676-fx13_lrg.jpg https://s3.amazonaws.com/prod-ucs-content-store-us-east/content/pii:S0926860X14003676/fx13/HIGHRES/image/jpeg/a933d9ae05598edde95eba26a19eeef9/fx13_lrg.jpg https://s3-eu-west-1.amazonaws.com/prod-ucs-content-store-eu-west/content/pii:S0926860X14003676/fx13/HIGHRES/image/jpeg/a933d9ae05598edde95eba26a19eeef9/fx13_lrg.jpg fx13 fx13_lrg.jpg jpg 13030 493 405 IMAGE-HIGH-RES 1-s2.0-S0926860X14003676-fx12_lrg.jpg https://s3.amazonaws.com/prod-ucs-content-store-us-east/content/pii:S0926860X14003676/fx12/HIGHRES/image/jpeg/915147200ebd2932b42c5159e0148b97/fx12_lrg.jpg https://s3-eu-west-1.amazonaws.com/prod-ucs-content-store-eu-west/content/pii:S0926860X14003676/fx12/HIGHRES/image/jpeg/915147200ebd2932b42c5159e0148b97/fx12_lrg.jpg fx12 fx12_lrg.jpg jpg 7850 214 377 IMAGE-HIGH-RES 1-s2.0-S0926860X14003676-fx11_lrg.jpg https://s3.amazonaws.com/prod-ucs-content-store-us-east/content/pii:S0926860X14003676/fx11/HIGHRES/image/jpeg/cfa9d6c425117e6d97225195d170a21a/fx11_lrg.jpg https://s3-eu-west-1.amazonaws.com/prod-ucs-content-store-eu-west/content/pii:S0926860X14003676/fx11/HIGHRES/image/jpeg/cfa9d6c425117e6d97225195d170a21a/fx11_lrg.jpg fx11 fx11_lrg.jpg jpg 10173 425 261 IMAGE-HIGH-RES 1-s2.0-S0926860X14003676-fx10_lrg.jpg https://s3.amazonaws.com/prod-ucs-content-store-us-east/content/pii:S0926860X14003676/fx10/HIGHRES/image/jpeg/c6873971eb0c8eae6c62c9520237fc23/fx10_lrg.jpg https://s3-eu-west-1.amazonaws.com/prod-ucs-content-store-eu-west/content/pii:S0926860X14003676/fx10/HIGHRES/image/jpeg/c6873971eb0c8eae6c62c9520237fc23/fx10_lrg.jpg fx10 fx10_lrg.jpg jpg 4750 190 216 IMAGE-HIGH-RES 1-s2.0-S0926860X14003676-fx1_lrg.jpg https://s3.amazonaws.com/prod-ucs-content-store-us-east/content/pii:S0926860X14003676/fx1/HIGHRES/image/jpeg/5b5a89210972ff80c2a5fbd7ad71ed67/fx1_lrg.jpg https://s3-eu-west-1.amazonaws.com/prod-ucs-content-store-eu-west/content/pii:S0926860X14003676/fx1/HIGHRES/image/jpeg/5b5a89210972ff80c2a5fbd7ad71ed67/fx1_lrg.jpg fx1 true fx1_lrg.jpg jpg 104359 845 2213 IMAGE-HIGH-RES 1-s2.0-S0926860X14003676-fx2_lrg.gif https://s3.amazonaws.com/prod-ucs-content-store-us-east/content/pii:S0926860X14003676/fx2/HIGHRES/image/gif/501760026ac9600e5ee22119a5028ff0/fx2_lrg.gif https://s3-eu-west-1.amazonaws.com/prod-ucs-content-store-eu-west/content/pii:S0926860X14003676/fx2/HIGHRES/image/gif/501760026ac9600e5ee22119a5028ff0/fx2_lrg.gif fx2 fx2_lrg.gif gif 13345 836 2663 IMAGE-HIGH-RES 1-s2.0-S0926860X14003676-sc1.jpg https://s3.amazonaws.com/prod-ucs-content-store-us-east/content/pii:S0926860X14003676/sc1/DOWNSAMPLED/image/jpeg/f5008946aee79b137c2f6790b107c109/sc1.jpg https://s3-eu-west-1.amazonaws.com/prod-ucs-content-store-eu-west/content/pii:S0926860X14003676/sc1/DOWNSAMPLED/image/jpeg/f5008946aee79b137c2f6790b107c109/sc1.jpg sc1 sc1.jpg jpg 30181 345 489 IMAGE-DOWNSAMPLED 1-s2.0-S0926860X14003676-gr3.jpg https://s3.amazonaws.com/prod-ucs-content-store-us-east/content/pii:S0926860X14003676/gr3/DOWNSAMPLED/image/jpeg/99152c2e632aefec6b0514f4e3556b7e/gr3.jpg https://s3-eu-west-1.amazonaws.com/prod-ucs-content-store-eu-west/content/pii:S0926860X14003676/gr3/DOWNSAMPLED/image/jpeg/99152c2e632aefec6b0514f4e3556b7e/gr3.jpg gr3 gr3.jpg jpg 55395 317 551 IMAGE-DOWNSAMPLED 1-s2.0-S0926860X14003676-gr2.jpg https://s3.amazonaws.com/prod-ucs-content-store-us-east/content/pii:S0926860X14003676/gr2/DOWNSAMPLED/image/jpeg/0dee164424a2653593f8c302fe3f5c45/gr2.jpg https://s3-eu-west-1.amazonaws.com/prod-ucs-content-store-eu-west/content/pii:S0926860X14003676/gr2/DOWNSAMPLED/image/jpeg/0dee164424a2653593f8c302fe3f5c45/gr2.jpg gr2 gr2.jpg jpg 18509 288 550 IMAGE-DOWNSAMPLED 1-s2.0-S0926860X14003676-gr1.jpg https://s3.amazonaws.com/prod-ucs-content-store-us-east/content/pii:S0926860X14003676/gr1/DOWNSAMPLED/image/jpeg/8cfe2a82894ce2d3897344af134bf410/gr1.jpg https://s3-eu-west-1.amazonaws.com/prod-ucs-content-store-eu-west/content/pii:S0926860X14003676/gr1/DOWNSAMPLED/image/jpeg/8cfe2a82894ce2d3897344af134bf410/gr1.jpg gr1 gr1.jpg jpg 60150 352 659 IMAGE-DOWNSAMPLED 1-s2.0-S0926860X14003676-fx9.jpg https://s3.amazonaws.com/prod-ucs-content-store-us-east/content/pii:S0926860X14003676/fx9/DOWNSAMPLED/image/jpeg/b61fef8af351a0d895b6f741b56e82dc/fx9.jpg https://s3-eu-west-1.amazonaws.com/prod-ucs-content-store-eu-west/content/pii:S0926860X14003676/fx9/DOWNSAMPLED/image/jpeg/b61fef8af351a0d895b6f741b56e82dc/fx9.jpg fx9 fx9.jpg jpg 3974 11 9 IMAGE-DOWNSAMPLED 1-s2.0-S0926860X14003676-fx8.jpg https://s3.amazonaws.com/prod-ucs-content-store-us-east/content/pii:S0926860X14003676/fx8/DOWNSAMPLED/image/jpeg/b88554598afa9a7eaa80bcd929b028d6/fx8.jpg https://s3-eu-west-1.amazonaws.com/prod-ucs-content-store-eu-west/content/pii:S0926860X14003676/fx8/DOWNSAMPLED/image/jpeg/b88554598afa9a7eaa80bcd929b028d6/fx8.jpg fx8 fx8.jpg jpg 3178 8 8 IMAGE-DOWNSAMPLED 1-s2.0-S0926860X14003676-fx7.jpg https://s3.amazonaws.com/prod-ucs-content-store-us-east/content/pii:S0926860X14003676/fx7/DOWNSAMPLED/image/jpeg/327a88e70eaab9abf5dc82644c587197/fx7.jpg https://s3-eu-west-1.amazonaws.com/prod-ucs-content-store-eu-west/content/pii:S0926860X14003676/fx7/DOWNSAMPLED/image/jpeg/327a88e70eaab9abf5dc82644c587197/fx7.jpg fx7 fx7.jpg jpg 3647 7 7 IMAGE-DOWNSAMPLED 1-s2.0-S0926860X14003676-fx6.jpg https://s3.amazonaws.com/prod-ucs-content-store-us-east/content/pii:S0926860X14003676/fx6/DOWNSAMPLED/image/jpeg/79ccda3a6d670c3d005e18374666b4b1/fx6.jpg https://s3-eu-west-1.amazonaws.com/prod-ucs-content-store-eu-west/content/pii:S0926860X14003676/fx6/DOWNSAMPLED/image/jpeg/79ccda3a6d670c3d005e18374666b4b1/fx6.jpg fx6 fx6.jpg jpg 3639 9 9 IMAGE-DOWNSAMPLED 1-s2.0-S0926860X14003676-fx5.jpg https://s3.amazonaws.com/prod-ucs-content-store-us-east/content/pii:S0926860X14003676/fx5/DOWNSAMPLED/image/jpeg/2e5f3f7e4a9473f99ecf26992ab20d87/fx5.jpg https://s3-eu-west-1.amazonaws.com/prod-ucs-content-store-eu-west/content/pii:S0926860X14003676/fx5/DOWNSAMPLED/image/jpeg/2e5f3f7e4a9473f99ecf26992ab20d87/fx5.jpg fx5 fx5.jpg jpg 3531 8 9 IMAGE-DOWNSAMPLED 1-s2.0-S0926860X14003676-fx4.jpg https://s3.amazonaws.com/prod-ucs-content-store-us-east/content/pii:S0926860X14003676/fx4/DOWNSAMPLED/image/jpeg/6da1e24183bfad24c7b53ef81effc685/fx4.jpg https://s3-eu-west-1.amazonaws.com/prod-ucs-content-store-eu-west/content/pii:S0926860X14003676/fx4/DOWNSAMPLED/image/jpeg/6da1e24183bfad24c7b53ef81effc685/fx4.jpg fx4 fx4.jpg jpg 3568 8 8 IMAGE-DOWNSAMPLED 1-s2.0-S0926860X14003676-fx3.jpg https://s3.amazonaws.com/prod-ucs-content-store-us-east/content/pii:S0926860X14003676/fx3/DOWNSAMPLED/image/jpeg/6c37f422ab745fcff24cad24b79e8faf/fx3.jpg https://s3-eu-west-1.amazonaws.com/prod-ucs-content-store-eu-west/content/pii:S0926860X14003676/fx3/DOWNSAMPLED/image/jpeg/6c37f422ab745fcff24cad24b79e8faf/fx3.jpg fx3 fx3.jpg jpg 6654 8 8 IMAGE-DOWNSAMPLED 1-s2.0-S0926860X14003676-fx17.jpg https://s3.amazonaws.com/prod-ucs-content-store-us-east/content/pii:S0926860X14003676/fx17/DOWNSAMPLED/image/jpeg/6ab30be32d7348f38ae55c8280e6a99f/fx17.jpg https://s3-eu-west-1.amazonaws.com/prod-ucs-content-store-eu-west/content/pii:S0926860X14003676/fx17/DOWNSAMPLED/image/jpeg/6ab30be32d7348f38ae55c8280e6a99f/fx17.jpg fx17 fx17.jpg jpg 2433 66 138 IMAGE-DOWNSAMPLED 1-s2.0-S0926860X14003676-fx16.jpg https://s3.amazonaws.com/prod-ucs-content-store-us-east/content/pii:S0926860X14003676/fx16/DOWNSAMPLED/image/jpeg/44f528a3bc4334f519cbc72e1f443523/fx16.jpg https://s3-eu-west-1.amazonaws.com/prod-ucs-content-store-eu-west/content/pii:S0926860X14003676/fx16/DOWNSAMPLED/image/jpeg/44f528a3bc4334f519cbc72e1f443523/fx16.jpg fx16 fx16.jpg jpg 1795 67 86 IMAGE-DOWNSAMPLED 1-s2.0-S0926860X14003676-fx15.jpg https://s3.amazonaws.com/prod-ucs-content-store-us-east/content/pii:S0926860X14003676/fx15/DOWNSAMPLED/image/jpeg/fb2e8e2a5137d9a96cc629e476c2e01b/fx15.jpg https://s3-eu-west-1.amazonaws.com/prod-ucs-content-store-eu-west/content/pii:S0926860X14003676/fx15/DOWNSAMPLED/image/jpeg/fb2e8e2a5137d9a96cc629e476c2e01b/fx15.jpg fx15 fx15.jpg jpg 3257 134 132 IMAGE-DOWNSAMPLED 1-s2.0-S0926860X14003676-fx14.jpg https://s3.amazonaws.com/prod-ucs-content-store-us-east/content/pii:S0926860X14003676/fx14/DOWNSAMPLED/image/jpeg/8f434118e1ac9a16a4ddd9b3adb5ec92/fx14.jpg https://s3-eu-west-1.amazonaws.com/prod-ucs-content-store-eu-west/content/pii:S0926860X14003676/fx14/DOWNSAMPLED/image/jpeg/8f434118e1ac9a16a4ddd9b3adb5ec92/fx14.jpg fx14 fx14.jpg jpg 2246 95 110 IMAGE-DOWNSAMPLED 1-s2.0-S0926860X14003676-fx13.jpg https://s3.amazonaws.com/prod-ucs-content-store-us-east/content/pii:S0926860X14003676/fx13/DOWNSAMPLED/image/jpeg/07a44f17fcda9d44a98b9d7a943e1a24/fx13.jpg https://s3-eu-west-1.amazonaws.com/prod-ucs-content-store-eu-west/content/pii:S0926860X14003676/fx13/DOWNSAMPLED/image/jpeg/07a44f17fcda9d44a98b9d7a943e1a24/fx13.jpg fx13 fx13.jpg jpg 2018 111 91 IMAGE-DOWNSAMPLED 1-s2.0-S0926860X14003676-fx12.jpg https://s3.amazonaws.com/prod-ucs-content-store-us-east/content/pii:S0926860X14003676/fx12/DOWNSAMPLED/image/jpeg/ddb18c647b6ddc57ae0f17a61f9b3722/fx12.jpg https://s3-eu-west-1.amazonaws.com/prod-ucs-content-store-eu-west/content/pii:S0926860X14003676/fx12/DOWNSAMPLED/image/jpeg/ddb18c647b6ddc57ae0f17a61f9b3722/fx12.jpg fx12 fx12.jpg jpg 1362 48 85 IMAGE-DOWNSAMPLED 1-s2.0-S0926860X14003676-fx11.jpg https://s3.amazonaws.com/prod-ucs-content-store-us-east/content/pii:S0926860X14003676/fx11/DOWNSAMPLED/image/jpeg/06ac2c95e9ee491ab637171da5bb838a/fx11.jpg https://s3-eu-west-1.amazonaws.com/prod-ucs-content-store-eu-west/content/pii:S0926860X14003676/fx11/DOWNSAMPLED/image/jpeg/06ac2c95e9ee491ab637171da5bb838a/fx11.jpg fx11 fx11.jpg jpg 1721 94 58 IMAGE-DOWNSAMPLED 1-s2.0-S0926860X14003676-fx10.jpg https://s3.amazonaws.com/prod-ucs-content-store-us-east/content/pii:S0926860X14003676/fx10/DOWNSAMPLED/image/jpeg/2efd4752e8913e9db6fb5e105ac77c51/fx10.jpg https://s3-eu-west-1.amazonaws.com/prod-ucs-content-store-eu-west/content/pii:S0926860X14003676/fx10/DOWNSAMPLED/image/jpeg/2efd4752e8913e9db6fb5e105ac77c51/fx10.jpg fx10 fx10.jpg jpg 935 42 48 IMAGE-DOWNSAMPLED 1-s2.0-S0926860X14003676-fx1.jpg https://s3.amazonaws.com/prod-ucs-content-store-us-east/content/pii:S0926860X14003676/fx1/DOWNSAMPLED/image/jpeg/a599ef6b625fa7d4eecfd5cb57873f7e/fx1.jpg https://s3-eu-west-1.amazonaws.com/prod-ucs-content-store-eu-west/content/pii:S0926860X14003676/fx1/DOWNSAMPLED/image/jpeg/a599ef6b625fa7d4eecfd5cb57873f7e/fx1.jpg fx1 true fx1.jpg jpg 15656 191 500 IMAGE-DOWNSAMPLED 1-s2.0-S0926860X14003676-fx2.gif https://s3.amazonaws.com/prod-ucs-content-store-us-east/content/pii:S0926860X14003676/fx2/DOWNSAMPLED/image/gif/da2ff87b0ec9d2f1ff884ebe76423fb6/fx2.gif https://s3-eu-west-1.amazonaws.com/prod-ucs-content-store-eu-west/content/pii:S0926860X14003676/fx2/DOWNSAMPLED/image/gif/da2ff87b0ec9d2f1ff884ebe76423fb6/fx2.gif fx2 fx2.gif gif 1696 94 300 IMAGE-DOWNSAMPLED 1-s2.0-S0926860X14003676-fx2.sml https://s3.amazonaws.com/prod-ucs-content-store-us-east/content/pii:S0926860X14003676/fx2/THUMBNAIL/image/gif/df0110c9eefbb122787e9ab8b08fb957/fx2.sml https://s3-eu-west-1.amazonaws.com/prod-ucs-content-store-eu-west/content/pii:S0926860X14003676/fx2/THUMBNAIL/image/gif/df0110c9eefbb122787e9ab8b08fb957/fx2.sml fx2 fx2.sml sml 1130 69 219 IMAGE-THUMBNAIL 1-s2.0-S0926860X14003676-sc1.sml https://s3.amazonaws.com/prod-ucs-content-store-us-east/content/pii:S0926860X14003676/sc1/THUMBNAIL/image/gif/dac8075d39b3f6603ae9f3cd26fd4291/sc1.sml https://s3-eu-west-1.amazonaws.com/prod-ucs-content-store-eu-west/content/pii:S0926860X14003676/sc1/THUMBNAIL/image/gif/dac8075d39b3f6603ae9f3cd26fd4291/sc1.sml sc1 sc1.sml sml 2622 155 219 IMAGE-THUMBNAIL 1-s2.0-S0926860X14003676-gr3.sml https://s3.amazonaws.com/prod-ucs-content-store-us-east/content/pii:S0926860X14003676/gr3/THUMBNAIL/image/gif/d870153616025a254773b55a5bd6ac1b/gr3.sml https://s3-eu-west-1.amazonaws.com/prod-ucs-content-store-eu-west/content/pii:S0926860X14003676/gr3/THUMBNAIL/image/gif/d870153616025a254773b55a5bd6ac1b/gr3.sml gr3 gr3.sml sml 6871 126 219 IMAGE-THUMBNAIL 1-s2.0-S0926860X14003676-gr2.sml https://s3.amazonaws.com/prod-ucs-content-store-us-east/content/pii:S0926860X14003676/gr2/THUMBNAIL/image/gif/b9bcbedc6939a6c40207889d2d628128/gr2.sml https://s3-eu-west-1.amazonaws.com/prod-ucs-content-store-eu-west/content/pii:S0926860X14003676/gr2/THUMBNAIL/image/gif/b9bcbedc6939a6c40207889d2d628128/gr2.sml gr2 gr2.sml sml 2552 115 219 IMAGE-THUMBNAIL 1-s2.0-S0926860X14003676-gr1.sml https://s3.amazonaws.com/prod-ucs-content-store-us-east/content/pii:S0926860X14003676/gr1/THUMBNAIL/image/gif/d0e8b4837c929b64faa1fc63bb0e1c66/gr1.sml https://s3-eu-west-1.amazonaws.com/prod-ucs-content-store-eu-west/content/pii:S0926860X14003676/gr1/THUMBNAIL/image/gif/d0e8b4837c929b64faa1fc63bb0e1c66/gr1.sml gr1 gr1.sml sml 5022 117 219 IMAGE-THUMBNAIL 1-s2.0-S0926860X14003676-fx9.sml https://s3.amazonaws.com/prod-ucs-content-store-us-east/content/pii:S0926860X14003676/fx9/THUMBNAIL/image/gif/dcfd610e8852d63781e263fbf6d23748/fx9.sml https://s3-eu-west-1.amazonaws.com/prod-ucs-content-store-eu-west/content/pii:S0926860X14003676/fx9/THUMBNAIL/image/gif/dcfd610e8852d63781e263fbf6d23748/fx9.sml fx9 fx9.sml sml 1263 49 41 IMAGE-THUMBNAIL 1-s2.0-S0926860X14003676-fx8.sml https://s3.amazonaws.com/prod-ucs-content-store-us-east/content/pii:S0926860X14003676/fx8/THUMBNAIL/image/gif/39e74340a101ad7bab1b5ae8495ba189/fx8.sml https://s3-eu-west-1.amazonaws.com/prod-ucs-content-store-eu-west/content/pii:S0926860X14003676/fx8/THUMBNAIL/image/gif/39e74340a101ad7bab1b5ae8495ba189/fx8.sml fx8 fx8.sml sml 835 23 23 IMAGE-THUMBNAIL 1-s2.0-S0926860X14003676-fx7.sml https://s3.amazonaws.com/prod-ucs-content-store-us-east/content/pii:S0926860X14003676/fx7/THUMBNAIL/image/gif/7de501a88b1d9fe5e83884fe405798f5/fx7.sml https://s3-eu-west-1.amazonaws.com/prod-ucs-content-store-eu-west/content/pii:S0926860X14003676/fx7/THUMBNAIL/image/gif/7de501a88b1d9fe5e83884fe405798f5/fx7.sml fx7 fx7.sml sml 946 21 21 IMAGE-THUMBNAIL 1-s2.0-S0926860X14003676-fx6.sml https://s3.amazonaws.com/prod-ucs-content-store-us-east/content/pii:S0926860X14003676/fx6/THUMBNAIL/image/gif/afcc3bddf8b3a454790ad93d950f9324/fx6.sml https://s3-eu-west-1.amazonaws.com/prod-ucs-content-store-eu-west/content/pii:S0926860X14003676/fx6/THUMBNAIL/image/gif/afcc3bddf8b3a454790ad93d950f9324/fx6.sml fx6 fx6.sml sml 997 25 24 IMAGE-THUMBNAIL 1-s2.0-S0926860X14003676-fx5.sml https://s3.amazonaws.com/prod-ucs-content-store-us-east/content/pii:S0926860X14003676/fx5/THUMBNAIL/image/gif/819f3b38dfe908b25e861bd7b37beb05/fx5.sml https://s3-eu-west-1.amazonaws.com/prod-ucs-content-store-eu-west/content/pii:S0926860X14003676/fx5/THUMBNAIL/image/gif/819f3b38dfe908b25e861bd7b37beb05/fx5.sml fx5 fx5.sml sml 920 23 26 IMAGE-THUMBNAIL 1-s2.0-S0926860X14003676-fx4.sml https://s3.amazonaws.com/prod-ucs-content-store-us-east/content/pii:S0926860X14003676/fx4/THUMBNAIL/image/gif/518c713314ca36e5e262ea7e446465e2/fx4.sml https://s3-eu-west-1.amazonaws.com/prod-ucs-content-store-eu-west/content/pii:S0926860X14003676/fx4/THUMBNAIL/image/gif/518c713314ca36e5e262ea7e446465e2/fx4.sml fx4 fx4.sml sml 912 23 22 IMAGE-THUMBNAIL 1-s2.0-S0926860X14003676-fx3.sml https://s3.amazonaws.com/prod-ucs-content-store-us-east/content/pii:S0926860X14003676/fx3/THUMBNAIL/image/gif/c40caf48531783154d528de3bc49dc0e/fx3.sml https://s3-eu-west-1.amazonaws.com/prod-ucs-content-store-eu-west/content/pii:S0926860X14003676/fx3/THUMBNAIL/image/gif/c40caf48531783154d528de3bc49dc0e/fx3.sml fx3 fx3.sml sml 973 23 23 IMAGE-THUMBNAIL 1-s2.0-S0926860X14003676-fx17.sml https://s3.amazonaws.com/prod-ucs-content-store-us-east/content/pii:S0926860X14003676/fx17/THUMBNAIL/image/gif/445a64b0df55b3b8dc5e1886cebfaef6/fx17.sml https://s3-eu-west-1.amazonaws.com/prod-ucs-content-store-eu-west/content/pii:S0926860X14003676/fx17/THUMBNAIL/image/gif/445a64b0df55b3b8dc5e1886cebfaef6/fx17.sml fx17 fx17.sml sml 2546 105 219 IMAGE-THUMBNAIL 1-s2.0-S0926860X14003676-fx16.sml https://s3.amazonaws.com/prod-ucs-content-store-us-east/content/pii:S0926860X14003676/fx16/THUMBNAIL/image/gif/9725469fcca8c924e9ae5fbe8fbc5532/fx16.sml https://s3-eu-west-1.amazonaws.com/prod-ucs-content-store-eu-west/content/pii:S0926860X14003676/fx16/THUMBNAIL/image/gif/9725469fcca8c924e9ae5fbe8fbc5532/fx16.sml fx16 fx16.sml sml 2928 164 212 IMAGE-THUMBNAIL 1-s2.0-S0926860X14003676-fx15.sml https://s3.amazonaws.com/prod-ucs-content-store-us-east/content/pii:S0926860X14003676/fx15/THUMBNAIL/image/gif/36e1e92f49747f8435b3c4ced308b50d/fx15.sml https://s3-eu-west-1.amazonaws.com/prod-ucs-content-store-eu-west/content/pii:S0926860X14003676/fx15/THUMBNAIL/image/gif/36e1e92f49747f8435b3c4ced308b50d/fx15.sml fx15 fx15.sml sml 2526 164 161 IMAGE-THUMBNAIL 1-s2.0-S0926860X14003676-fx14.sml https://s3.amazonaws.com/prod-ucs-content-store-us-east/content/pii:S0926860X14003676/fx14/THUMBNAIL/image/gif/4ccbe48fbd4365d483ca41d47034598a/fx14.sml https://s3-eu-west-1.amazonaws.com/prod-ucs-content-store-eu-west/content/pii:S0926860X14003676/fx14/THUMBNAIL/image/gif/4ccbe48fbd4365d483ca41d47034598a/fx14.sml fx14 fx14.sml sml 2707 164 190 IMAGE-THUMBNAIL 1-s2.0-S0926860X14003676-fx13.sml https://s3.amazonaws.com/prod-ucs-content-store-us-east/content/pii:S0926860X14003676/fx13/THUMBNAIL/image/gif/0a025b8e2d1fee9fa2a5c22648bbcb88/fx13.sml https://s3-eu-west-1.amazonaws.com/prod-ucs-content-store-eu-west/content/pii:S0926860X14003676/fx13/THUMBNAIL/image/gif/0a025b8e2d1fee9fa2a5c22648bbcb88/fx13.sml fx13 fx13.sml sml 2188 163 134 IMAGE-THUMBNAIL 1-s2.0-S0926860X14003676-fx12.sml https://s3.amazonaws.com/prod-ucs-content-store-us-east/content/pii:S0926860X14003676/fx12/THUMBNAIL/image/gif/2586d027a44f9c2655e18a144ae9652b/fx12.sml https://s3-eu-west-1.amazonaws.com/prod-ucs-content-store-eu-west/content/pii:S0926860X14003676/fx12/THUMBNAIL/image/gif/2586d027a44f9c2655e18a144ae9652b/fx12.sml fx12 fx12.sml sml 2501 124 219 IMAGE-THUMBNAIL 1-s2.0-S0926860X14003676-fx11.sml https://s3.amazonaws.com/prod-ucs-content-store-us-east/content/pii:S0926860X14003676/fx11/THUMBNAIL/image/gif/d56f7e215784955c192e7da1e0b405e8/fx11.sml https://s3-eu-west-1.amazonaws.com/prod-ucs-content-store-eu-west/content/pii:S0926860X14003676/fx11/THUMBNAIL/image/gif/d56f7e215784955c192e7da1e0b405e8/fx11.sml fx11 fx11.sml sml 2104 163 100 IMAGE-THUMBNAIL 1-s2.0-S0926860X14003676-fx10.sml https://s3.amazonaws.com/prod-ucs-content-store-us-east/content/pii:S0926860X14003676/fx10/THUMBNAIL/image/gif/aff6673e70073513a3abcc4f08ddb5e4/fx10.sml https://s3-eu-west-1.amazonaws.com/prod-ucs-content-store-eu-west/content/pii:S0926860X14003676/fx10/THUMBNAIL/image/gif/aff6673e70073513a3abcc4f08ddb5e4/fx10.sml fx10 fx10.sml sml 2849 190 216 IMAGE-THUMBNAIL 1-s2.0-S0926860X14003676-fx1.sml https://s3.amazonaws.com/prod-ucs-content-store-us-east/content/pii:S0926860X14003676/fx1/THUMBNAIL/image/gif/cc1a69f6316194e0f3a5114e9e42a359/fx1.sml https://s3-eu-west-1.amazonaws.com/prod-ucs-content-store-eu-west/content/pii:S0926860X14003676/fx1/THUMBNAIL/image/gif/cc1a69f6316194e0f3a5114e9e42a359/fx1.sml fx1 true fx1.sml sml 2077 84 219 IMAGE-THUMBNAIL APCATA 14853 S0926-860X(14)00367-6 10.1016/j.apcata.2014.05.033 Elsevier B.V. Fig. 1 Variation of the conversion of CO2 with time on stream during the reaction of CO2 with PO at different temperatures: ( ) 130°C; ( ) 110°C; ( ) 90°C; ( ) 70°C; ( ) 50°C. Reaction conditions: PO, 0.214mol; PS-TBMAC, 2.140mmol; 77% aqueous solution of ZnI2, 0.6mmol; initial CO2 pressure, 0.9MPa; agitation speed, 500rpm. Y-PC yield, S-reaction selectivity. Fig. 2 Variation of the PC yield and selectivity during the reaction of CO2 with PO at different initial CO2 pressures: ( ) PC yield; ( ) selectivity. Reaction conditions: PO, 0.214mol; PS-TBMAC, 2.140mmol; 77% aqueous solution of ZnI2, 0.6mmol; reaction temperature, 110°C; agitation speed, 500rpm; reaction time, 2h. Fig. 3 Variation of the PC yield and selectivity during the reaction of CO2 with PO in the presence of recycled PS-TBMAC catalyst: ( ) PC yield; ( ) selectivity. Reaction conditions: PO, 0.214mol; PS-TBMAC, 2.140mmol; 77% aqueous solution of ZnI2, 0.6mmol; reaction temperature, 110°C; agitation speed, 500rpm; reaction time, 2h. Scheme 1 The proposed mechanism for the cycloaddition of CO2 to epoxide in the presence of the two-component catalyst system consisting of polymer-supported quaternary salts and aqueous solution of ZnI2. Table 1 Elementary analysis of the obtained polymer-supported quaternary onium salts. Entry Catalyst C (%) H (%) N (%) Amount of attached catalyst (mmol/g) 1 PS1-TBMAC 81.96 9.83 2.02 1.40±0.01 2 PS2-TBMAC 71.97 9.72 3.33 2.40±0.02 3 PS3-TBMAC 80.75 9.96 2.35 1.70±0.01 4 PS4-TEMAC 76.34 8.96 2.50 1.80±0.15 5 PS4-THMAC 81.89 9.63 2.06 1.50±0.02 Table 2 Yields of propylene carbonate obtained by the reaction of CO2 with PO. a Entry Catalyst Co-catalyst Time (h) Yield of PC c (%) Selectivity (%) 1 PS-TBMAC – 4 48 97 2 PS-TBMAC ZnI2 3 76 99 3 PS-TBMAC ZnI2 b 2 91 97 4 – – 4 0 0 5 PS – 4 0 0 6 – ZnI2/ZnI2 b 4 0 0 7 PS-TBMAC H2O d 4 55 96 8 BTBAC – 4 43 98 9 BTBAC ZnI2 b 2 73 98 10 TBMAC – 4 34 95 11 TBMAC ZnI2 b 2 67 95 12 TBAC – 4 23 79 13 TBAC ZnI2 b 2 53 77 a Reaction conditions: PO, 0.214mol; quaternary salt, 2.140mmol; ZnI2, 0.6mmol; reaction temperature, 110°C; initial CO2 pressure, 0.9MPa; agitation speed, 500rpm. b 77% aqueous solution of zinc iodide: ZnI2, 0.6mmol; H2O, 3.0mmol. c Determined by GC analysis. d H2O, 3.0mmol. Table 3 The effect of the type of co-catalyst on the reaction of CO2 with PO in the presence of PS-TBMAC. a Entry Co-catalyst Time (h) Yield of PC b (%) Selectivity (%) 1 ZnCl2 3 57 98 2 ZnBr2 3 68 99 3 ZnI2 2 76 99 4 CaCl2 3 54 98 a Reaction conditions: PO, 0.214mol; PS-TBMAC, 2.140mmol; co-catalyst, 0.6mmol; reaction temperature, 110°C; initial CO2 pressure, 0.9MPa; agitation speed, 500rpm. b Determined by GC analysis. Table 4 The effect of type of polymer-supported quaternary salt on the reaction of CO2 with PO. a Entry Catalyst Merrifield's polymer Amount of attached catalyst (mmol/g) Yield of PC b (%) Selectivity (%) Cross-linking degree (%) Cl loading (mmol/g) Particle size (mesh) 1 PS-TBMAC 1.0 – 200–400 1.2 91 97 2 PS-TBMPC 1.0 – 200–400 1.4 48 96 3 PS1-TBMAC 2.0 2.25 200–400 1.4 62 93 4 PS2-TBMAC 5.5 5.5 16–50 2.4 47 93 5 PS3-TBMAC 1.0 2.0–3.0 100–200 1.7 45 95 6 PS4-TEMAC 1.0 2.5–3.0 200–400 1.8 70 95 7 PS4-THMAC 1.0 2.5–3.0 200–400 1.5 43 95 8 Amberlite® IRA-400 8.0 – 16–50 3.5 17 77 9 Amberlite® IRA-410 – – 20–50 3.4 21 78 a Reaction conditions: PO, 0.214mol; polymer-supported catalyst, 2.140mmol; 77% aqueous solution of zinc iodide, 0.6mmol; reaction temperature, 110°C; initial CO2 pressure, 0.9MPa; agitation speed, 500rpm; reaction time, 2h. b Determined by GC analysis. Table 5 The effect of amount of PS-TBMAC catalyst on the reaction of CO2 with PO. a Entry PS-TBMAC/PO (mol %) Amount of catalyst (mmol) Yield of PC b (%) Selectivity (%) 1 0.5 1.07 66 96 2 1.0 2.14 91 97 3 1.5 3.21 93 96 a Reaction conditions: PO, 0.214mol; 77% aqueous solution of zinc iodide, 0.6mmol; reaction temperature, 110°C; initial CO2 pressure, 0.9MPa; agitation speed, 500rpm; reaction time, 2h. b Determined by GC analysis. Table 6 The effect of water addition on the reaction of CO2 with PO in the presence of PS-TBMAC and ZnI2–water added directly into the reaction mixture. a Entry H2O/PO (molar ratio) H2O/ZnI2 (molar ratio) Yield of PC b (%) Selectivity (%) 1 0.3 107 33 70 2 0.1 36 42 86 3 0.05 18 47 92 4 0.015 5 64 96 a Reaction conditions: PO, 0.214mol; PS-TBMAC, 2.140mmol; ZnI2, 0.6mmol; reaction temperature, 110°C; initial CO2 pressure, 0.9MPa; agitation speed, 500rpm; reaction time, 2h. b Determined by GC analysis. Table 7 The effect of water addition on the reaction of CO2 with PO–water added into the reaction mixture as an aqueous solution of metal salt. a Entry Co-catalyst H2O/PO (molar ratio) H2O/co-catalyst (molar ratio) Yield of PC b (%) Selectivity (%) 1 ZnI2 0.015 5 91 97 2 ZnI2 0.020 8 82 96 3 ZnI2 0.040 15 49 93 4 ZnBr2 0.015 5 84 98 5 CaCl2 0.015 5 47 95 a Reaction conditions: PO, 0.214mol; PS-TBMAC, 2.140mmol; aqueous solution of co-catalyst; metal salt as a co-catalyst, 0.6mmol; reaction temperature, 110°C; initial CO2 pressure, 0.9MPa; agitation speed, 500rpm; reaction time, 2h. b Determined by GC analysis. Table 8 Yields of cyclic carbonates obtained by the reaction of CO2 with various epoxides. a Entry Epoxide Cyclic carbonate Time (h) Yield of cyclic carbonate b (%) Selectivity (%) 1 2 91 (88) c 97 2 2 85 98 3 2 71 (65) c >99 4 10 7 >99 a Reaction conditions: PO, 0.214mol; PS-TBMAC, 2.140mmol; 77% aqueous solution of zinc iodide, 0.6mmol; reaction temperature, 110°C; initial CO2 pressure, 0.9MPa; agitation speed, 500rpm. b Determined by GC analysis. c Isolated yield. An efficient method for the synthesis of cyclic carbonates from CO2 and epoxides using an effective two-component catalyst system: Polymer-supported quaternary onium salts and aqueous solutions of metal salts Agnieszka Siewniak ⁎ Katarzyna Jasiak Stefan Baj Silesian University of Technology, Department of Chemical Organic Technology and Petrochemistry, Krzywoustego 4, 44-100 Gliwice, Poland Silesian University of Technology, Department of Chemical Organic Technology and Petrochemistry Krzywoustego 4 Gliwice 44-100 Poland ⁎ Corresponding author. Tel.: +48 32 2372917; fax: +48 32 2371032. Graphical abstract A highly efficient method for the synthesis of cyclic carbonates from carbon dioxide and epoxides in the presence of polymer-supported quaternary onium salts (PS-Q+X−) and aqueous solution of metal salts under mild conditions, is described. In comparison with conventional homogeneous catalysts, immobilized tributylmethylammonium chloride (PS-TBMAC) is a recyclable, effective catalyst for the studied reaction. The presence of an aqueous solution of zinc iodide as a co-catalyst enhances significantly the catalytic activity of PS-TBMAC. Using this two-component catalyst system (polymer-supported quaternary onium salts and aqueous solution of metal salts), the reaction of CO2 with selected epoxides can be conducted with high product yield (71–91%) and selectivity (97–99%) under mild reaction conditions (temperature 110°C and initial CO2 pressure 0.9MPa). Propylene carbonate was obtained in the best yield (91%). In addition, the advantages of this method include a short reaction time, solvent-free conditions, and an easy separation of catalyst system. Keywords Cyclic alkylene carbonates Carbon dioxide Epoxides Polymer-supported quaternary onium salts Metal salts 1 Introduction More stringent regulations for allowable emissions of greenhouse gases, including carbon dioxide, have caused increasing interest in methods for their reduction. Carbon dioxide can be used as a cheap, readily available, non-flammable and non-toxic resource of carbon in chemical syntheses [1]. The processing of carbon dioxide into useful chemical products is one of the forward directions in CO2 management. Amongst these products, five-membered alkylene carbonates (1,3-dioxolan-2-ones) are taken into consideration. It is obvious that the use of CO2 in chemical syntheses will not prevent the greenhouse effect, as it is impossible to considerably reduce the amounts of this gas in the Earth's atmosphere. However, the idea of using it in the production of chemicals agrees most of all with the principles of “green chemistry”, which concern the reuse of waste materials and the use of safe reagents, although not only, to prevent environmental pollution. Cyclic alkylene carbonates, especially ethylene carbonate and propylene carbonate, are characterized by a broad spectrum of applications [2]. Amongst others, they are used as plasticizers [3], electrolytes for lithium-ion batteries [4], paint strippers [5], reaction intermediates in fine chemicals synthesis, and in the pharmaceutical and cosmetic industries [6,7]. Moreover, they play an important role in the synthesis of polymers [8], e.g. polycarbonates [9], and they are used as polar aprotic solvents [10–13]. The synthesis of cyclic alkylene carbonates as a result of the reaction of carbon dioxide with epoxide is one of the CO2 reactions of industrial importance. The process is a strongly exothermic one; however it requires catalytic activation because of the thermodynamic stability of carbon dioxide. The use of relatively inexpensive reagents is an advantage of the method, and reaction runs with 100% atom economy. The parameters of the process depend mainly on the catalytic system used. Amongst others, the following substances are used as catalysts for reaction to produce alkylene carbonates from CO2: alkali metal salts [14,15], metal oxides [16], metal complexes [17–22]. Recently, several review papers have been published, which indicates a continued interest in the development of methods for the synthesis of cyclic carbonates from carbon dioxide and epoxide [1,23–29]. In recent years, increased interest in use of ionic liquids (IL) both as solvents as well as catalysts, has been observed. This is a result of their many unique properties, such as thermal and chemical stabilities, high activity, and negligible vapour pressure. Peng and Deng, as some of the first, described the application of 1-butyl-3-methylimidazolium tetrafluoroborate as a catalyst in reaction between propylene oxide and CO2. Selectivity of the reaction was 100%. The ionic liquid could be reused even five times over without a significant decrease in catalytic activity [30]. In order to further improve the yield of the synthesis of cyclic carbonates, some catalyst systems consisting of ionic liquid and Lewis acidic compounds as co-catalysts were investigated [31,32]. Kawanami et al. reported the reaction between epoxide and CO2 under supercritical conditions in the presence of ionic liquid containing 1-alkyl-3-methylimidazolium cation in structure. An increase of length of the alkyl chain in cation of ionic liquid caused an increase of yield and selectivity of the reaction, and a significant shortening of the reaction time. It may be a result of the better solubility of epoxide and CO2 in such ionic liquids with a longer alkyl chain [33]. There are also reports regarding the use of immobilized ionic liquids as catalysts for the synthesis of cyclic carbonates. For example, Shen et al. reported that the synthesis of propylene carbonate with a good conversion of propylene oxide, catalyzed by ionic liquid, functionalized silica gel [34]. Special attention should be paid to quaternary onium salts because of their high catalytic activity. In a patent issued in 1956, quaternary onium salts were described as highly effective catalysts for the synthesis of alkylene carbonates by the reaction of carbon dioxide with an appropriate epoxide. Cyclic carbonates were obtained with a yield of 50–97% depending on the type of epoxide and reaction conditions [35]. Since then, significant progress has been made to improve the efficiency of these catalysts. The results reported by Caló et al. show that the use of a TBAI/TBAB mixture, instead of the tetrabutylammonium bromide alone, caused a shortening of the reaction time [36]. Moreover, Ra et al. found that the catalytic activity of the quaternary ammonium salts depended on the melting points of the halides. The yield of reaction in the presence of tetramethylammonium bromide or tetraethylammonium bromide was low. This may be due to the fact that these ammonium bromides have high mp's, i.e. they are solids at the reaction temperature [37]. The catalyst systems, including both quaternary onium salts, and salts or complexes of metals, were started to be used to increase the yield of the synthesis of alkylene carbonates. In case of the synthesis of cyclic carbonates in the presence of tetrabutylammonium iodide and zinc iodide, the efficiency of such a catalytic system depended on TBAI/ZnI2 molar ratio, which should have a 4:1 optimum. The yield of reaction varied between 90 and 98%, depending on the type of epoxide. This method was mainly used for the synthesis of alkylene carbonates containing an alkyl or aryl group [38]. In 2012, cyanocobalamin and tetrabutylammonium halide were used by Bai et al. as an excellent catalyst system for the synthesis of cyclic carbonates [39]. The yield of this reaction mostly depended on the type of quaternary onium salt anion, and increased in the order of TBAC<TBAF< TBAI<TBAB. After the reaction, cyanocobalamin was reused three times; however a significant decrease in the yield of propylene carbonate was observed with every use of cyanocobalamin. SalenCo(III) (Cl3CCO2)/PTAT have also been reported as a catalytic system for the reaction between epoxide and CO2. The use of such a catalytic system has allowed for the obtaining of cyclic carbonates with a high yield under extremely mild conditions (atmospheric pressure, room temperature) [40]. There are several reported works on the reaction between epoxide and CO2 in the presence of two-component catalyst systems [41,42]. It should be noted that the difficult separation of the catalyst from the post-reaction mixture is one of the main problems that occur when homogeneous catalysts are used. One of the solutions is to immobilize quaternary onium salts and ionic liquids on catalyst insoluble supports, which will allow to connect effectively advantages of homogeneous catalysis with a heterogeneous one. In recent years, various solid materials such as inorganic materials [43,44], carbon nanotubes [45], polymer supports [46,47] and magnetic nanoparticles [48] have been used for the immobilization of homogeneous catalysts. In the case of using immobilized tetraalkyl-onium salts, the reactions between CO2 and epoxide were usually carried out at high temperatures, 150–160°C [46,49–51], and/or under high pressure between 4 and 10MPa [44,49–52], and the reaction times were usually 6–24h. Therefore, our challenge was to develop a method with an active catalytic system containing polymer-supported quaternary salts which simultaneously allows for easy separation of the catalyst and its recycling and to conduct the reaction under relatively mild conditions. Herein, for the reaction of carbon dioxide with epoxides, catalyst systems consisting of quaternary onium salts immobilized on polymeric supports and metal salts, e.g. ZnI2, were used. We found that using an aqueous solution of ZnI2 can improve the reaction yield. Using propylene oxide (PO) as a model substrate, comparative experiments of the reaction of CO2 with PO were carried out in order to determine the effects of catalytic reaction parameters, including temperature, initial CO2 pressure and the effect of the amount of co-catalyst on the propylene carbonate's (PC) yield and selectivity (Eq. 1). (Eq. 1 The model reaction between CO2 and PO.) 2 Experimental 2.1 Synthesis of polymer-supported quaternary ammonium salts The method of quaternization of trialkylamine with chloromethylated polystyrene has been described elsewhere [53]. Four cross-linked polystyrene matrixes (PS-1–4) differing in size of particles, cross-linking degree, and number of functional groups, were used in the synthesis of immobilized catalysts based quaternary onium salts. Typical procedure: 2–3g of polymer support (chloromethylated polystyrene cross-linked with divinylbenzene) and 3-mol excess of amine (tributylamine TBA, triethylamine TEA or trihexylamine THA) in 4ml of anhydrous N,N-dimethylformamide (DMF) was refluxed for 6 days at 60°C using 500rpm speed of agitation. Upon completion of the reaction, the catalyst was filtered out and washed successively by methanol, acetone and methanol again. Next, the catalyst was purified by Soxhlet extraction performed for 60h using diethyl ether as solvent. Afterwards, the catalyst was dried under vacuum (10mbar, 10h). Catalyst characterization: Elementary analysis was performed using a PerkinElmer 2400 series 2 CHNO/S analyzer. Cysteine and acetanilide were used as standards. The results of elementary analysis are shown in Table 1 . 2.2 Synthesis of cyclic carbonates All the reactions were carried out in a 100ml stainless steel pressure reactor (Mettler Toledo) with a mechanical stirrer (pitched-blade) immersed in solid-state thermostat (EasyMax™ 102) with an automatic temperature control system. The pressure reactor was also equipped with temperature and pressure sensors and rapture disc. Typical procedure: PO (15ml, 0.21mol), the appropriate amount of a two-component catalyst system consisting of quaternary onium salts and metal salts, were added into a reactor. The reactor was purged with carbon dioxide twice, and then heated to the desired temperature (50–130°C). CO2 was charged into a reactor from a reservoir tank to a chosen constant pressure (0.4–1.2MPa). iControl® software was used to monitor the reaction progress. Analysis: After the reaction was completed, the reactor was cooled to ambient temperature, and the excess CO2 was vented. The catalyst system was separated from the reaction mixture by simple filtration. Samples from organic layer were taken, dissolved in CH2Cl2, and analyzed by gas chromatography (PerkinElmer GC, Clarus 500) equipped with a capillary column (SPB™-5: 30m×0.25mm×0.25μm film thickness). 1-Octane was used as an internal standard substance. In order to determine any by-products in the reaction between CO2 and epoxides, GC–MS analysis was performed on GC–MS system (Agilent Technologies 7890A GC system, Agilent Technologies 5975C inert XL EI/CI MSD with Triple-Axis Detector) equipped with a capillary column (HP5/MS-5: 30m×250μm×0.25μm film thickness). Product isolation: After the completion of the reaction, the mixture was cooled to room temperature and filtered to remove solid ZnI2 and PS-TBMAC. The solid was washed with CH2Cl2 (3× 10ml) and then three times with 5ml of water. The organic phase was dried over anhydrous MgSO4 and distilled under reduced pressure. As for the synthesis of styrene carbonate, its purification was obtained by column chromatography using 20% hexane in chloroform as the eluting solvent. Next, the reaction product was analyzed by 1H NMR spectroscopy (Varian 600MHz NMR System) and GC–MS. The yields of obtained cyclic carbonates were determined on the basis of isolated products according to the equation: Y = Δ n epoxide n o epoxide = ν epoxide ν CC ⋅ n CC n o epoxide ⋅ 100 % where n, number of moles; n o, initial number of moles; CC, cyclic carbonate; ν, stoichiometric coefficients, ν =1 in this case.or on the basis of the variation of the product amount with time determined by GC analysis of the samples taken from the organic phase. During the synthesis of cyclic carbonates only observed by-products were the corresponding glycols. Due to the fact that we could not measure changes in the concentrations of propylene oxide by GC analysis, the selectivity of the reaction between CO2 and epoxide to the cyclic carbonate was determined according to the equation: S = n CC n CC + n G ⋅ 100 % where n, number of moles; CC, cyclic carbonate; G, glycol. Catalyst recycling: After the completion of the reaction, the immobilized catalyst was simply recovered by filtration, washed with dichloromethane (3× 10ml). During the filtration of the reaction mixture, a part of zinc iodide crystallized on the filter. This precipitate can be easily separated. The remaining part of zinc iodide was separated by addition of water (15ml) to the filtrate – organic phase. Addition of water caused precipitation of zinc iodide, which then could be easily recovered by filtration and after a preparation of 77% aqueous solution, can be used again. The separated PS-TBMAC during the filtration was dried in vacuum and then reused for the next run. 3 Results and discussion 3.1 Choice of the catalytic system The study on the model reaction between CO2 and propylene oxide was started by examining the catalytic reactivity of the polymer-supported quaternary ammonium salts. Tributylmethylammonium chloride immobilized on polystyrene cross-linked with divinylbenzene (PS-TBMAC) was chosen as a catalyst. The reactions were carried out under the following conditions: temperature 110°C and initial CO2 pressure 0.9MPa, agitation speed 500rpm. As shown in Table 2 , the yield of propylene carbonate (PC) in the presence PS-TBMAC was only 48% after 4h (entry 1). To increase the efficiency of the reaction, the model reaction was carried out with dry zinc iodide as a co-catalyst. ZnI2 can act as a Lewis acid, which is involved in the activation of the epoxide [54]. The use of this two-component catalyst system resulted in an increase in the PC yield to 76%, and the shortening of the reaction time to 3h (Table 2, entry 2). It is also known that the water added to the reaction system on the one hand can activate the epoxide ring opening, whilst on the other hand it can contribute to a hydrolysis reaction of epoxide. Water was therefore added in the form of an aqueous solution of ZnI2, instead of directly to the reaction mixture. The combination of PS-TBMAC with the aqueous ZnI2 solution caused an increase in the PC yield to 91% after 2h (Table 2, entry 3). This promising result prompted us to investigate the effect of the addition of water as well as the manner for its introduction into the reaction mixture, which is described below (see Section 3.6). Control reactions showed that in the absence of a catalyst or only in the presence of the polymer support or ZnI2, no reaction took place (Table 2, entries 4–6). The PC yield in the reaction of CO2 with PO using PS-TBMAC and H2O was 55% (Table 2, entry 7). To compare the catalytic activity of PS-TBMAC with its homogeneous counterparts, reactions in the presence of catalysts such as TBMAC and BTBAC, with and without ZnI2 as a co-catalyst, were carried out (Table 2, entries 8–13). The results indicate that an immobilized catalyst on the polymer support PS-TBMAC showed higher activity in model reaction in comparison to homogeneous quaternary salts. GC analysis revealed that trialkylamine, which is the product of the catalyst's degradation, was present in the post-reaction mixture. The results indicate that polymer-supported quaternary onium salt was more stable at a high reaction temperature than a non-immobilized catalyst [55]. In the case of the reaction carried out in the presence of TBAC as a catalyst (Table 2, entries 12 and 13, respectively), the formation of propylene carbonate and 1,2-propylene glycol (confirmed by GC–MS analysis) was observed, which resulted in a low selectivity of the reaction to the propylene carbonate (77–79%). This low selectivity is probably due to the fact that the tetrabutylammonium chloride hydrate was used in these experiments and a Karl Fischer titration showed a high content of water in the catalyst. In the literature, there are reports concerning the use of supported quaternary onium salts as catalysts for the synthesis of cyclic carbonates from CO2 and epoxides. For example, He et al. reported the reaction between epoxide and carbon dioxide under supercritical conditions (temperature 120°C, initial CO2 pressure 8MPa, reaction time 6h) in the presence of poly(ethylene glycol)-supported quaternary ammonium salt [56]. More recently, polymer-supported quaternary phosphonium salt was described as a highly effective catalyst for the synthesis of alkylene carbonates. The reaction was carried out under the following conditions: 150°C and 5MPa, 6h [51]. In comparison with these above methods, we have proposed the use of catalytic system PS-TBMAC/aq. ZnI2 which allowed for the obtaining of cyclic carbonates with a comparatively high yield under milder reaction conditions (temperature 110°C, initial CO2 pressure 0.9MPa, reaction time 2h). Going on the results obtained, it can be stated that the PS-TBMAC/aq. ZnI2 system appeared the most effective catalyst for the model reaction between CO2 and propylene oxide. 3.2 The effect of reaction conditions The effect of reaction parameters including temperature and initial CO2 pressure on the yield of propylene carbonate synthesis in the presence of system PS-TBMAC/aq. ZnI2, was determined. Fig. 1 shows the dependence of the PC yield on the reaction temperature. With a temperature rise from 50 to 110°C, the PC yield and reaction rate increased, but a further increase in temperature did not accelerate the reaction nor increase its yield. This may be due to the fact that solubility of CO2 in the reaction system decreases in temperatures above 110°C. Consequently, due to a lower CO2 content in the reaction mixture, we did not observe the acceleration of the model reaction and an increase in the PC yield at 130°C. A similar phenomenon was described by Park [45]. It should be noted that throughout the whole examined temperature range, selectivity remained constant. The reaction yield is also dependent on the initial pressure of CO2. Fig. 2 shows that increasing the pressure from 0.4MPa to 0.9MPa significantly affected the yield of propylene carbonate causing its increase from 2 to 91%. High pressure can effectively improve the absorption of CO2 into the solution of epoxide, contributing to a shift in the equilibrium towards the formation of the PC. However, if the CO2 pressure increased above 0.9MPa, the PC yield drop was observed. This may be due to the fact that the higher concentration of CO2 in the reaction mixture could hinder the interaction between epoxide and the catalyst [45,46]. 3.3 The effect of the type of co-catalyst In order to determine the effect of the type of co-catalyst for the reaction of CO2 with propylene oxide, a series of metal salts, ZnI2, ZnBr2, ZnCl2, CaCl2, were used. These experiments were carried out in the presence of a constant amount of catalyst (PS-TBMAC – 2.14mmol) under the optimized conditions (temperature 110°C, initial CO2 pressure 0.9MPa). Metal salts were added to the reaction mixture as dry solids. Table 3 shows that both the type of anion and the cation of the co-catalyst were important for the activity of a two-component catalyst system. The PC yield was increased with an increase of the nucleophilicity of anion in the co-catalyst: ZnCl2 <ZnBr2 <ZnI2 [54]. To improve the coordination of the epoxide by metal salts, the model reaction should be carried in the presence of stronger Lewis acid. Therefore, based on the results, the catalytic activity of the co-catalyst increased in the order of CaCl2 <ZnCl2. 3.4 The effect of type of polymer-supported quaternary salt The structure of the polymer-supported quaternary onium salts: cross-linking degree, size of particles, number of functional groups, also has an effect on the course of the model reaction. The experiments were carried out under identical conditions: 110°C and 0.9MPa, 500rpm. The PC yield affected by the type of amine which was quaternizated with chloromethylated polystyrene cross-linked with 1% DVB: tributylamine (91%)>triethylamine (70%)>trihexylamine (43%) (Table 4 , entries 1, 6 and 7). The catalyst with tributylmethylammonium group was more active than one with tributylmethylphosphonium group (the PC yield 48%) immobilized on the same polymer support (Table 4, entries 1 and 2). Moreover, catalysts based on tributylamine immobilized on polymer supports of various parameters, were also tested. As shown in Table 4, the PC yield decreased from 91% to 62% with an increasing degree of cross-linking from 1% to 2% (entries 1 and 3). This may be due to the difficult access of the reactants to the active sites of the immobilized catalyst. Among catalysts synthesized from tributylamine low PC yield was obtained when it was immobilized on a polymer-support of the highest degree of cross-linking: 5.5% and the largest size of particles: 16–50 mesh (Table 4, entry 4). Similarly, the use of commercially available ion-exchange resins such as Amberlite 410 and Amberlite 400, with short alkyl groups at the nitrogen atom of the functional group, with a high degree of cross-linking and large-diameter particles, allowed propylene carbonate with a yield of only 21% and 17% to be obtained (Table 4, entries 8 and 9). 3.5 The effect of amount of catalyst PS-TBMAC The influence of the amount of quaternary salt on the course of the synthesis of propylene carbonate was examined using PS-TBMAC in quantities of 1.7, 2.14, and 3.21mmol (0.5, 1.0, 1.5mol % relative to PO). Other reaction conditions remained unchanged: 110°C, 0.9MPa, 500rpm, aqueous solution of ZnI2. As shown in Table 5 , the reaction yield increased with the rise of the quantity of catalyst to 2.14mmol. By comparison, an increase in the amount of PS-TBMAC above 2.14mmol has an insignificant effect on the reaction yield. In consequence, we chose 2.14mmol as the optimal amount of PS-TBMAC catalyst for the reaction of CO2 with propylene oxide. 3.6 The effect of water As shown in Table 2, the two-component catalyst system PS-TBMAC/dry solid ZnI2 exhibited an unsatisfactory yield of a model reaction between propylene oxide and CO2 (76%). Therefore, in order to improve the obtained result, the effect of the addition of water was tested. The investigated molar ratio of H2O/PO ranged from 0 to 0.3. Other reaction conditions were unchanged (temperature 110°C and initial CO2 pressure 0.9MPa). The results summarized in Table 6 indicate that in the case of our two-component catalytic system: PS-TBMAC/dry solid ZnI2, the addition of water directly into the reaction mixture led to a decrease of the PC yield (33–64%). Simultaneously, it can be seen that for a molar ratio of H2O/PO higher than 0.05 the selectivity of the process decreased (Table 6, entries 1 and 2). This can be explained by the formation of 1,2-propylene glycol from PO in the presence of water. 1,2-propylene glycol was determined by GC–MS analysis. Small amounts of water (the molar ratio of H2O/PO below 0.05) did not cause a significant drop of the reaction selectivity. In the next step, we wanted to check whether the manner for introduction of water into the reaction mixture may affect the reaction course. Therefore, for the H2O/PO molar ratio of 0.015, we conducted the model reaction in the presence of water, which was added to the reaction mixture as an aqueous solution of zinc iodide (H2O/ZnI2 molar ratio of 5). It can be seen that the PC yield increased (91%) when an aqueous solution of zinc iodide was used (Table 7 , entry 1) instead of ZnI2 and water added separately (64%). As pointed out by Yamaguchi [57], zinc iodide (II) can form complexes with water in aqueous solutions, when the molar ratio of H2O/ZnI2 ranges from 5 to 10. For this reason, additionally, we investigated the synthesis of propylene carbonate in the presence of aqueous solutions of zinc iodide in which molar ratio of H2O/ZnI2 was 8 and greater than 10 (Table 7, entries 2 and 3). For the molar H2O/ZnI2 ratio of 8 the PC yield was high (82%), as in the case of using aqueous solution of zinc iodide at H2O/ZnI2 molar ratio of 5. The zinc iodide probably formed a complex with the water, which caused an increase in activity. Use of an aqueous solution of ZnBr2 (H2O/ZnBr2 molar ratio of 5) also resulted in a good yield of propylene carbonate (Table 7, entry 4). We also investigated the effect of the use of aqueous solution of calcium chloride (H2O/CaCl2 molar ratio of 5) on the course of a model reaction, but a similar dependence was not observed in this case. Based on Refs. [54,58], we can assume that complex of ZnI2 with water (L x ZnI2 in Scheme 1 ) might play a key role in promoting the activation of the epoxy ring. An anion of quaternary onium salt makes a nucleophilic attack on a less-hindered carbon atom in the epoxide ring, producing a metal alkoxide anion, which interacts with the CO2 molecule to form a zinc carbonate active species. Next, five-membered cyclic carbonate is produced as a result of intramolecular cyclic elimination. Herein, the halide complexes of zinc (II) in aqueous solution could be effective as co-catalysts for the synthesis of cyclic carbonates. 3.7 Synthesis of cyclic carbonates from various epoxides and CO2 The two-component catalyst system PS-TBMAC/aq. ZnI2 was applied to the synthesis of cyclic carbonates from the selected epoxides, namely: propylene oxide, epichlorohydrin, styrene oxide, and cyclohexene oxide (Table 8 ). The experiments were carried out under optimized conditions: temperature 110°C, initial CO2 pressure 0.9MPa, 500rpm. It is worth mentioning that the highest product yield (91%) was observed for propylene oxide. Nevertheless, carbonates obtained from epichlorohydrin or styrene oxide were also successfully synthesized with yields of 85% and 71%, respectively. Cyclohexene oxide was the least active amongst all the epoxides used, which can be the result of higher steric hindrance at the C atom of the cyclohexene ring [45]. 3.8 Catalyst recycling test To examine the reusability of PS-TBMAC, the model reaction between CO2 and propylene oxide was carried out under optimized reaction conditions (110°C, CO2 pressure 0.9MPa, 2h). For each cycle we added a fresh 77% aqueous solution of zinc iodide as a co-catalyst. The immobilized catalyst PS-TBMAC was easily separated from the post-reaction mixture by filtration, washed with CH2Cl2 and water, and after drying in vacuum, was used directly for the next run. ZnI2 can be also recovered and recycled in the form of an aqueous solution. The yield of the model reaction was slightly lower (88%) than with a fresh solution of zinc iodide (91%). This probability may be due to losses in the recovery of zinc iodide. As shown in Fig. 3 , the catalyst (PS-TBMAC) could be reused three times without a significant decrease in the catalytic activity. However, after four cycles a slight catalytic activity drop was observed, which is likely due to the decomposition of the catalyst functional groups, confirmed by the presence of trace amounts of tributylamine in the reaction mixture (determined by GC–MS analysis). Moreover, in each cycle the reaction was proceeded with an almost constant PC selectivity (94–97%). Therefore, it can be concluded that the possibility of easy separation of this catalyst from a post-reaction mixture and its recyclability are advantages of the proposed catalytic system. These benefits are important for reduction of the process cost. 4 Conclusion Identifying the optimized reaction conditions, including the type of catalyst, temperature, CO2 pressure, amount of catalyst, and addition of water has led to the obtaining of cyclic carbonates with a high yield (71–91%). The immobilization of quaternary onium played an important role in the catalytic performance. PS-TBMAC is characterized by low cost, reusability, and good catalytic activity. An addition of 77% aqueous solution of zinc iodide resulted in an increased reaction rate and yield of PC, as compared to the reaction without a co-catalyst. The advantages of cyclic carbonate synthesis using an effective two-component catalyst system consisting of PS-TBMAC and aqueous solution of ZnI2, are: mild conditions, short reaction time, and high product yield and selectivity. Therefore, in the future, the proposed method could be applied on an industrial scale. Acknowledgment The project was funded by the National Science Centre (NCN), Poland (Grant No. 2011/03/B/ST8/06178). Appendix A Supplementary data Supplementary data associated with this article can be found, in the online version, at http://dx.doi.org/10.1016/j.apcata.2014.05.033. Appendix A Supplementary data The following are the supplementary data to this article: References [1] T. Sakakura J.-C. Choi H. Yasuda Chem. Rev. 107 2007 2365 2387 [2] J.H. Clements Ind. Eng. Chem. Res. 42 2003 663 674 [3] R. Frech S. Chintapalli Solid State Ionics 85 1996 61 66 [4] M. Wakihara O. Yamamoto Lithium Ion Batteries Fundamentals and Performance 1998 Kodansha Ltd. Tokyo [5] J.R. Machac, E.T., Marquis, S.A. Woodrum, US Patent 6,169,061 B1 (2001). [6] Y. Sun, J.-C. Liu, E.S., Kimbleton, J.C.T. Wang, US Patent 5,993,787 A (1999). [7] G. Fujii, US Patent 7,074,746 B2 (2006). [8] G. Maruyama, K. Susuki, K. Kuze, S. Ukyo, S. Koketsu, US Patent 8,030,417 B2 (2011). [9] J. Matsuo F. Sanda T. Endo J. Polym. Sci. A: Polym. Chem. 35 1997 1375 1380 [10] W.J. Peppel Ind. Eng. Chem. 50 1958 767 770 [11] J. Bayardon J. Holz B. Schäffner V. Andrushko S. Verevkin A. Preetz A. Börner Angew. Chem. Int. Ed. 46 2007 5971 5974 [12] B. Schäffner F. Schäffner S.P. Verevkin A. Börner Chem. Rev. 110 2010 4554 4581 [13] M. North F. Pizzato P. Villuendas ChemSusChem 2 2009 862 865 [14] N. Kihara N. Hara T. Endo J. Org. Chem. 58 1993 6198 6202 [15] X. Zhou Y. Zhang X. Yang J. Yao G. Wang Chin. J. Catal. 31 2010 765 768 [16] B.M. Bhanage S. Fujita Y. Ikushima M. Arai Appl. Catal. A: General 219 2001 259 266 [17] Y.-M. Shen W.-L. Duan M. Shi J. Org. Chem. 68 2003 1559 1562 [18] D. Tian B. Liu Q. Gan H. Li D.J. Darensbourg ACS Catal. 2 2012 2029 2035 [19] M. North P. Villuendas C. Young Tetrahedron Lett. 53 2012 2736 2740 [20] J.A. Castro-Osma A. Lara-Sánchez M. North A. Otero P. Villuendas Catal. Sci. Technol. 2 2012 1021 1026 [21] D. Anselmo V. Bocokić A. Decortes E.C. Escudero-Adán J. Benet- Buchholz J.N.H. Reek A.W. Kleij Polyhedron 32 2012 49 53 [22] J. Wang J. Wu N. Tang Inorg. Chem. Commun. 10 2007 1493 1495 [23] C.-X. Miao J.-Q. Wang L.-N. He Open Org. Chem. J. 2 2008 68 82 [24] R. Li X. Tong X. Li C. Hu Pure Appl. Chem. 84 2012 621 636 [25] Y.P. Patil P.J. Tambade S.R. Jagtap B.M. Bhanage Chem. Eng. China 4 2010 213 235 [26] D.-W. Kim R. Roshan J. Tharun A. Cherian D.-W. Park Korean J. Chem. Eng. 30 2013 1973 1984 [27] M. North R. Pasqual C. Young Green Chem. 12 2010 1514 1539 [28] X.-B. Lu D.J. Darensbourg Chem. Soc. Rev. 41 2012 1462 1484 [29] P.P. Pescarmona M. Taherimehr Catal. Sci. Technol. 2 2012 2169 2187 [30] J. Peng Y. Deng N. J. Chem. 25 2001 639 641 [31] Y.-J. Kim M. Cheong Bull. Korean Chem. Soc. 23 2002 1027 1028 [32] S. Zhang Y. Chen F. Li X. Lu W. Dai R. Mori Catal. Today 115 2006 61 69 [33] H. Kawanami A. Sasaki K. Matsui Y. Ikushima Chem. Commun. 2003 896 897 [34] G. Lai J. Peng J. Li H. Qiu J. Jiang K. Jiang Y. Shen Tetrahedron Lett. 47 2006 6951 6953 [35] M. Lichtenwalter, J.F. Cooper, US Patent 2,773,070 (1956). [36] V. Caló A. Nacci A. Monopoli A. Fanizzi Org. Lett. 4 2002 2561 2563 [37] J.-J. Shim D. Kim C.S. Ra Bull. Korean Chem. Soc. 27 2006 744 746 [38] V. Caló, A. Nacci, M. Politi, EP Patent 2,055,699 A1 (2009). [39] D. Bai H. Jing G. Wang Appl. Organomet. Chem. 26 2012 600 603 [40] T. Chang H. Jing L. Jin W. Qiu J. Mol. Catal. A: Chem. 264 2007 241 247 [41] K. Kossev N. Koseva K. Troev J. Mol. Catal. A: Chem. 194 2003 29 37 [42] M.M. Dharman J.-I. Yu J.-Y. Ahn D.-W. Park Green Chem. 11 2009 1754 1757 [43] L. Han H.-J. Choi S.-J. Choi B. Liu D.-W. Park Green Chem. 13 2011 1023 1028 [44] T. Cao L. Sun Y. Shi L. Hua R. Zhang L. Guo W. Zhu Z. Hou Chin. J. Catal. 33 2012 416 424 [45] L. Han H. Li S.-J. Choi M.-S. Park S.-M. Lee Y.-J. Kim D.-W. Park Appl. Catal. A: Gen. 429–430 2012 67 72 [46] Y.-Y. Zhang L. Chen S.-F. Yin S.-L. Luo C.-T. Au Catal. Lett. 142 2012 1376 1381 [47] R.A. Watile K.M. Deshmukh K.P. Dhake B.M. Bhanage Catal. Sci. Technol. 2 2012 1051 1055 [48] X. Zheng S. Luo L. Zhang J.-P. Cheng Green Chem. 11 2009 455 458 [49] Y. Zhao J.-S. Tian X.-H. Qi Z.-N. Han Y.-Y. Zhuang L.-N. He J. Mol. Catal. A: Chem. 271 2007 284 289 [50] J.-Q. Wang D.-L. Kong J.-Y. Chen F. Cai L.-N. He J. Mol. Catal. A: Chem. 249 2006 143 148 [51] Y. Xiong F. Bai Z. Cui N. Guo R. Wang J. Chem. 2013 2013 1 9 [52] T. Takahashi T. Watahiki S. Kitazume H. Yasuda T. Sakakura Chem. Commun. 2006 1664 1666 [53] H. Molinari F. Montanari S. Quici P. Tundo J. Am. Chem. Soc. 101 1979 3920 3927 [54] H.-J. Choi M. Selvaraj D.-W. Park Chem. Eng. Sci. 100 2013 242 248 [55] C.M. Starks C.L. Liotta M. Halpern Phase-Transfer Catalysis. Fundamentals, Applications, and Industrial Perspectives 1994 Chapman & Hall New York/London [56] Y. Du J.-Q. Wang J.-Y. Chen F. Cai J.-S. Tian D.-L. Kong L.-N. He Tetrahedron Lett. 47 2006 1271 1275 [57] T. Takamuku T. Yamaguchi H. Wakita J. Phys. Chem. 95 1991 10098 10103 [58] F. Li L. Xiao C. Xia B. Hu Tetrahedron Lett. 45 2004 8307 8310",
      "scopus-id": "84903213724",
      "coredata": {
        "eid": "1-s2.0-S0926860X14003676",
        "dc:description": "A highly efficient method for the synthesis of cyclic carbonates from carbon dioxide and epoxides in the presence of polymer-supported quaternary onium salts (PS-Q+X−) and aqueous solution of metal salts under mild conditions, is described. In comparison with conventional homogeneous catalysts, immobilized tributylmethylammonium chloride (PS-TBMAC) is a recyclable, effective catalyst for the studied reaction. The presence of an aqueous solution of zinc iodide as a co-catalyst enhances significantly the catalytic activity of PS-TBMAC. Using this two-component catalyst system (polymer-supported quaternary onium salts and aqueous solution of metal salts), the reaction of CO2 with selected epoxides can be conducted with high product yield (71–91%) and selectivity (97–99%) under mild reaction conditions (temperature 110°C and initial CO2 pressure 0.9MPa). Propylene carbonate was obtained in the best yield (91%). In addition, the advantages of this method include a short reaction time, solvent-free conditions, and an easy separation of catalyst system.",
        "openArchiveArticle": "false",
        "prism:coverDate": "2014-07-22",
        "openaccessUserLicense": null,
        "prism:aggregationType": "Journal",
        "prism:url": "https://api.elsevier.com/content/article/pii/S0926860X14003676",
        "dc:creator": [
          {
            "@_fa": "true",
            "$": "Siewniak, Agnieszka"
          },
          {
            "@_fa": "true",
            "$": "Jasiak, Katarzyna"
          },
          {
            "@_fa": "true",
            "$": "Baj, Stefan"
          }
        ],
        "link": [
          {
            "@_fa": "true",
            "@rel": "self",
            "@href": "https://api.elsevier.com/content/article/pii/S0926860X14003676"
          },
          {
            "@_fa": "true",
            "@rel": "scidir",
            "@href": "https://www.sciencedirect.com/science/article/pii/S0926860X14003676"
          }
        ],
        "dc:format": "application/json",
        "openaccessType": null,
        "pii": "S0926-860X(14)00367-6",
        "prism:volume": "482",
        "prism:publisher": "Elsevier B.V.",
        "dc:title": "An efficient method for the synthesis of cyclic carbonates from CO2 and epoxides using an effective two-component catalyst system: Polymer-supported quaternary onium salts and aqueous solutions of metal salts",
        "prism:copyright": "Copyright © 2014 Elsevier B.V. All rights reserved.",
        "openaccess": "0",
        "prism:issn": "0926860X",
        "dcterms:subject": [
          {
            "@_fa": "true",
            "$": "Cyclic alkylene carbonates"
          },
          {
            "@_fa": "true",
            "$": "Carbon dioxide"
          },
          {
            "@_fa": "true",
            "$": "Epoxides"
          },
          {
            "@_fa": "true",
            "$": "Polymer-supported quaternary onium salts"
          },
          {
            "@_fa": "true",
            "$": "Metal salts"
          }
        ],
        "openaccessArticle": "false",
        "prism:publicationName": "Applied Catalysis A: General",
        "openaccessSponsorType": null,
        "prism:pageRange": "266-274",
        "prism:endingPage": "274",
        "pubType": "fla",
        "prism:coverDisplayDate": "22 July 2014",
        "prism:doi": "10.1016/j.apcata.2014.05.033",
        "prism:startingPage": "266",
        "dc:identifier": "doi:10.1016/j.apcata.2014.05.033",
        "openaccessSponsorName": null
      },
      "objects": {
        "object": [
          {
            "@category": "thumbnail",
            "@height": "31",
            "@width": "135",
            "@_fa": "true",
            "$": "https://api.elsevier.com/content/object/eid/1-s2.0-S0926860X14003676-si2.gif?httpAccept=%2A%2F%2A",
            "@multimediatype": "GIF image file",
            "@type": "ALTIMG",
            "@size": "618",
            "@ref": "si2",
            "@mimetype": "image/gif"
          },
          {
            "@category": "thumbnail",
            "@height": "41",
            "@width": "301",
            "@_fa": "true",
            "$": "https://api.elsevier.com/content/object/eid/1-s2.0-S0926860X14003676-si1.gif?httpAccept=%2A%2F%2A",
            "@multimediatype": "GIF image file",
            "@type": "ALTIMG",
            "@size": "1566",
            "@ref": "si1",
            "@mimetype": "image/gif"
          },
          {
            "@category": "standard",
            "@_fa": "true",
            "$": "https://api.elsevier.com/content/object/eid/1-s2.0-S0926860X14003676-mmc1.docx?httpAccept=%2A%2F%2A",
            "@multimediatype": "Microsoft Word file",
            "@type": "APPLICATION",
            "@size": "12350",
            "@ref": "mmc1",
            "@mimetype": "application/word"
          },
          {
            "@category": "high",
            "@height": "1530",
            "@width": "2167",
            "@_fa": "true",
            "$": "https://api.elsevier.com/content/object/eid/1-s2.0-S0926860X14003676-sc1_lrg.jpg?httpAccept=%2A%2F%2A",
            "@multimediatype": "JPEG image file",
            "@type": "IMAGE-HIGH-RES",
            "@size": "165831",
            "@ref": "sc1",
            "@mimetype": "image/jpeg"
          },
          {
            "@category": "high",
            "@height": "1402",
            "@width": "2440",
            "@_fa": "true",
            "$": "https://api.elsevier.com/content/object/eid/1-s2.0-S0926860X14003676-gr3_lrg.jpg?httpAccept=%2A%2F%2A",
            "@multimediatype": "JPEG image file",
            "@type": "IMAGE-HIGH-RES",
            "@size": "410815",
            "@ref": "gr3",
            "@mimetype": "image/jpeg"
          },
          {
            "@category": "high",
            "@height": "1276",
            "@width": "2438",
            "@_fa": "true",
            "$": "https://api.elsevier.com/content/object/eid/1-s2.0-S0926860X14003676-gr2_lrg.jpg?httpAccept=%2A%2F%2A",
            "@multimediatype": "JPEG image file",
            "@type": "IMAGE-HIGH-RES",
            "@size": "110438",
            "@ref": "gr2",
            "@mimetype": "image/jpeg"
          },
          {
            "@category": "high",
            "@height": "1556",
            "@width": "2917",
            "@_fa": "true",
            "$": "https://api.elsevier.com/content/object/eid/1-s2.0-S0926860X14003676-gr1_lrg.jpg?httpAccept=%2A%2F%2A",
            "@multimediatype": "JPEG image file",
            "@type": "IMAGE-HIGH-RES",
            "@size": "427664",
            "@ref": "gr1",
            "@mimetype": "image/jpeg"
          },
          {
            "@category": "high",
            "@height": "49",
            "@width": "41",
            "@_fa": "true",
            "$": "https://api.elsevier.com/content/object/eid/1-s2.0-S0926860X14003676-fx9_lrg.jpg?httpAccept=%2A%2F%2A",
            "@multimediatype": "JPEG image file",
            "@type": "IMAGE-HIGH-RES",
            "@size": "5520",
            "@ref": "fx9",
            "@mimetype": "image/jpeg"
          },
          {
            "@category": "high",
            "@height": "23",
            "@width": "23",
            "@_fa": "true",
            "$": "https://api.elsevier.com/content/object/eid/1-s2.0-S0926860X14003676-fx8_lrg.jpg?httpAccept=%2A%2F%2A",
            "@multimediatype": "JPEG image file",
            "@type": "IMAGE-HIGH-RES",
            "@size": "3184",
            "@ref": "fx8",
            "@mimetype": "image/jpeg"
          },
          {
            "@category": "high",
            "@height": "21",
            "@width": "21",
            "@_fa": "true",
            "$": "https://api.elsevier.com/content/object/eid/1-s2.0-S0926860X14003676-fx7_lrg.jpg?httpAccept=%2A%2F%2A",
            "@multimediatype": "JPEG image file",
            "@type": "IMAGE-HIGH-RES",
            "@size": "4219",
            "@ref": "fx7",
            "@mimetype": "image/jpeg"
          },
          {
            "@category": "high",
            "@height": "25",
            "@width": "24",
            "@_fa": "true",
            "$": "https://api.elsevier.com/content/object/eid/1-s2.0-S0926860X14003676-fx6_lrg.jpg?httpAccept=%2A%2F%2A",
            "@multimediatype": "JPEG image file",
            "@type": "IMAGE-HIGH-RES",
            "@size": "4161",
            "@ref": "fx6",
            "@mimetype": "image/jpeg"
          },
          {
            "@category": "high",
            "@height": "23",
            "@width": "26",
            "@_fa": "true",
            "$": "https://api.elsevier.com/content/object/eid/1-s2.0-S0926860X14003676-fx5_lrg.jpg?httpAccept=%2A%2F%2A",
            "@multimediatype": "JPEG image file",
            "@type": "IMAGE-HIGH-RES",
            "@size": "3937",
            "@ref": "fx5",
            "@mimetype": "image/jpeg"
          },
          {
            "@category": "high",
            "@height": "23",
            "@width": "22",
            "@_fa": "true",
            "$": "https://api.elsevier.com/content/object/eid/1-s2.0-S0926860X14003676-fx4_lrg.jpg?httpAccept=%2A%2F%2A",
            "@multimediatype": "JPEG image file",
            "@type": "IMAGE-HIGH-RES",
            "@size": "4028",
            "@ref": "fx4",
            "@mimetype": "image/jpeg"
          },
          {
            "@category": "high",
            "@height": "23",
            "@width": "23",
            "@_fa": "true",
            "$": "https://api.elsevier.com/content/object/eid/1-s2.0-S0926860X14003676-fx3_lrg.jpg?httpAccept=%2A%2F%2A",
            "@multimediatype": "JPEG image file",
            "@type": "IMAGE-HIGH-RES",
            "@size": "6970",
            "@ref": "fx3",
            "@mimetype": "image/jpeg"
          },
          {
            "@category": "high",
            "@height": "294",
            "@width": "611",
            "@_fa": "true",
            "$": "https://api.elsevier.com/content/object/eid/1-s2.0-S0926860X14003676-fx17_lrg.jpg?httpAccept=%2A%2F%2A",
            "@multimediatype": "JPEG image file",
            "@type": "IMAGE-HIGH-RES",
            "@size": "16263",
            "@ref": "fx17",
            "@mimetype": "image/jpeg"
          },
          {
            "@category": "high",
            "@height": "295",
            "@width": "381",
            "@_fa": "true",
            "$": "https://api.elsevier.com/content/object/eid/1-s2.0-S0926860X14003676-fx16_lrg.jpg?httpAccept=%2A%2F%2A",
            "@multimediatype": "JPEG image file",
            "@type": "IMAGE-HIGH-RES",
            "@size": "11017",
            "@ref": "fx16",
            "@mimetype": "image/jpeg"
          },
          {
            "@category": "high",
            "@height": "598",
            "@width": "588",
            "@_fa": "true",
            "$": "https://api.elsevier.com/content/object/eid/1-s2.0-S0926860X14003676-fx15_lrg.jpg?httpAccept=%2A%2F%2A",
            "@multimediatype": "JPEG image file",
            "@type": "IMAGE-HIGH-RES",
            "@size": "24381",
            "@ref": "fx15",
            "@mimetype": "image/jpeg"
          },
          {
            "@category": "high",
            "@height": "420",
            "@width": "487",
            "@_fa": "true",
            "$": "https://api.elsevier.com/content/object/eid/1-s2.0-S0926860X14003676-fx14_lrg.jpg?httpAccept=%2A%2F%2A",
            "@multimediatype": "JPEG image file",
            "@type": "IMAGE-HIGH-RES",
            "@size": "15762",
            "@ref": "fx14",
            "@mimetype": "image/jpeg"
          },
          {
            "@category": "high",
            "@height": "493",
            "@width": "405",
            "@_fa": "true",
            "$": "https://api.elsevier.com/content/object/eid/1-s2.0-S0926860X14003676-fx13_lrg.jpg?httpAccept=%2A%2F%2A",
            "@multimediatype": "JPEG image file",
            "@type": "IMAGE-HIGH-RES",
            "@size": "13030",
            "@ref": "fx13",
            "@mimetype": "image/jpeg"
          },
          {
            "@category": "high",
            "@height": "214",
            "@width": "377",
            "@_fa": "true",
            "$": "https://api.elsevier.com/content/object/eid/1-s2.0-S0926860X14003676-fx12_lrg.jpg?httpAccept=%2A%2F%2A",
            "@multimediatype": "JPEG image file",
            "@type": "IMAGE-HIGH-RES",
            "@size": "7850",
            "@ref": "fx12",
            "@mimetype": "image/jpeg"
          },
          {
            "@category": "high",
            "@height": "425",
            "@width": "261",
            "@_fa": "true",
            "$": "https://api.elsevier.com/content/object/eid/1-s2.0-S0926860X14003676-fx11_lrg.jpg?httpAccept=%2A%2F%2A",
            "@multimediatype": "JPEG image file",
            "@type": "IMAGE-HIGH-RES",
            "@size": "10173",
            "@ref": "fx11",
            "@mimetype": "image/jpeg"
          },
          {
            "@category": "high",
            "@height": "190",
            "@width": "216",
            "@_fa": "true",
            "$": "https://api.elsevier.com/content/object/eid/1-s2.0-S0926860X14003676-fx10_lrg.jpg?httpAccept=%2A%2F%2A",
            "@multimediatype": "JPEG image file",
            "@type": "IMAGE-HIGH-RES",
            "@size": "4750",
            "@ref": "fx10",
            "@mimetype": "image/jpeg"
          },
          {
            "@category": "high",
            "@height": "845",
            "@width": "2213",
            "@_fa": "true",
            "$": "https://api.elsevier.com/content/object/eid/1-s2.0-S0926860X14003676-fx1_lrg.jpg?httpAccept=%2A%2F%2A",
            "@multimediatype": "JPEG image file",
            "@type": "IMAGE-HIGH-RES",
            "@size": "104359",
            "@ref": "fx1",
            "@mimetype": "image/jpeg"
          },
          {
            "@category": "high",
            "@height": "836",
            "@width": "2663",
            "@_fa": "true",
            "$": "https://api.elsevier.com/content/object/eid/1-s2.0-S0926860X14003676-fx2_lrg.gif?httpAccept=%2A%2F%2A",
            "@multimediatype": "GIF image file",
            "@type": "IMAGE-HIGH-RES",
            "@size": "13345",
            "@ref": "fx2",
            "@mimetype": "image/gif"
          },
          {
            "@category": "standard",
            "@height": "345",
            "@width": "489",
            "@_fa": "true",
            "$": "https://api.elsevier.com/content/object/eid/1-s2.0-S0926860X14003676-sc1.jpg?httpAccept=%2A%2F%2A",
            "@multimediatype": "JPEG image file",
            "@type": "IMAGE-DOWNSAMPLED",
            "@size": "30181",
            "@ref": "sc1",
            "@mimetype": "image/jpeg"
          },
          {
            "@category": "standard",
            "@height": "317",
            "@width": "551",
            "@_fa": "true",
            "$": "https://api.elsevier.com/content/object/eid/1-s2.0-S0926860X14003676-gr3.jpg?httpAccept=%2A%2F%2A",
            "@multimediatype": "JPEG image file",
            "@type": "IMAGE-DOWNSAMPLED",
            "@size": "55395",
            "@ref": "gr3",
            "@mimetype": "image/jpeg"
          },
          {
            "@category": "standard",
            "@height": "288",
            "@width": "550",
            "@_fa": "true",
            "$": "https://api.elsevier.com/content/object/eid/1-s2.0-S0926860X14003676-gr2.jpg?httpAccept=%2A%2F%2A",
            "@multimediatype": "JPEG image file",
            "@type": "IMAGE-DOWNSAMPLED",
            "@size": "18509",
            "@ref": "gr2",
            "@mimetype": "image/jpeg"
          },
          {
            "@category": "standard",
            "@height": "352",
            "@width": "659",
            "@_fa": "true",
            "$": "https://api.elsevier.com/content/object/eid/1-s2.0-S0926860X14003676-gr1.jpg?httpAccept=%2A%2F%2A",
            "@multimediatype": "JPEG image file",
            "@type": "IMAGE-DOWNSAMPLED",
            "@size": "60150",
            "@ref": "gr1",
            "@mimetype": "image/jpeg"
          },
          {
            "@category": "standard",
            "@height": "11",
            "@width": "9",
            "@_fa": "true",
            "$": "https://api.elsevier.com/content/object/eid/1-s2.0-S0926860X14003676-fx9.jpg?httpAccept=%2A%2F%2A",
            "@multimediatype": "JPEG image file",
            "@type": "IMAGE-DOWNSAMPLED",
            "@size": "3974",
            "@ref": "fx9",
            "@mimetype": "image/jpeg"
          },
          {
            "@category": "standard",
            "@height": "8",
            "@width": "8",
            "@_fa": "true",
            "$": "https://api.elsevier.com/content/object/eid/1-s2.0-S0926860X14003676-fx8.jpg?httpAccept=%2A%2F%2A",
            "@multimediatype": "JPEG image file",
            "@type": "IMAGE-DOWNSAMPLED",
            "@size": "3178",
            "@ref": "fx8",
            "@mimetype": "image/jpeg"
          },
          {
            "@category": "standard",
            "@height": "7",
            "@width": "7",
            "@_fa": "true",
            "$": "https://api.elsevier.com/content/object/eid/1-s2.0-S0926860X14003676-fx7.jpg?httpAccept=%2A%2F%2A",
            "@multimediatype": "JPEG image file",
            "@type": "IMAGE-DOWNSAMPLED",
            "@size": "3647",
            "@ref": "fx7",
            "@mimetype": "image/jpeg"
          },
          {
            "@category": "standard",
            "@height": "9",
            "@width": "9",
            "@_fa": "true",
            "$": "https://api.elsevier.com/content/object/eid/1-s2.0-S0926860X14003676-fx6.jpg?httpAccept=%2A%2F%2A",
            "@multimediatype": "JPEG image file",
            "@type": "IMAGE-DOWNSAMPLED",
            "@size": "3639",
            "@ref": "fx6",
            "@mimetype": "image/jpeg"
          },
          {
            "@category": "standard",
            "@height": "8",
            "@width": "9",
            "@_fa": "true",
            "$": "https://api.elsevier.com/content/object/eid/1-s2.0-S0926860X14003676-fx5.jpg?httpAccept=%2A%2F%2A",
            "@multimediatype": "JPEG image file",
            "@type": "IMAGE-DOWNSAMPLED",
            "@size": "3531",
            "@ref": "fx5",
            "@mimetype": "image/jpeg"
          },
          {
            "@category": "standard",
            "@height": "8",
            "@width": "8",
            "@_fa": "true",
            "$": "https://api.elsevier.com/content/object/eid/1-s2.0-S0926860X14003676-fx4.jpg?httpAccept=%2A%2F%2A",
            "@multimediatype": "JPEG image file",
            "@type": "IMAGE-DOWNSAMPLED",
            "@size": "3568",
            "@ref": "fx4",
            "@mimetype": "image/jpeg"
          },
          {
            "@category": "standard",
            "@height": "8",
            "@width": "8",
            "@_fa": "true",
            "$": "https://api.elsevier.com/content/object/eid/1-s2.0-S0926860X14003676-fx3.jpg?httpAccept=%2A%2F%2A",
            "@multimediatype": "JPEG image file",
            "@type": "IMAGE-DOWNSAMPLED",
            "@size": "6654",
            "@ref": "fx3",
            "@mimetype": "image/jpeg"
          },
          {
            "@category": "standard",
            "@height": "66",
            "@width": "138",
            "@_fa": "true",
            "$": "https://api.elsevier.com/content/object/eid/1-s2.0-S0926860X14003676-fx17.jpg?httpAccept=%2A%2F%2A",
            "@multimediatype": "JPEG image file",
            "@type": "IMAGE-DOWNSAMPLED",
            "@size": "2433",
            "@ref": "fx17",
            "@mimetype": "image/jpeg"
          },
          {
            "@category": "standard",
            "@height": "67",
            "@width": "86",
            "@_fa": "true",
            "$": "https://api.elsevier.com/content/object/eid/1-s2.0-S0926860X14003676-fx16.jpg?httpAccept=%2A%2F%2A",
            "@multimediatype": "JPEG image file",
            "@type": "IMAGE-DOWNSAMPLED",
            "@size": "1795",
            "@ref": "fx16",
            "@mimetype": "image/jpeg"
          },
          {
            "@category": "standard",
            "@height": "134",
            "@width": "132",
            "@_fa": "true",
            "$": "https://api.elsevier.com/content/object/eid/1-s2.0-S0926860X14003676-fx15.jpg?httpAccept=%2A%2F%2A",
            "@multimediatype": "JPEG image file",
            "@type": "IMAGE-DOWNSAMPLED",
            "@size": "3257",
            "@ref": "fx15",
            "@mimetype": "image/jpeg"
          },
          {
            "@category": "standard",
            "@height": "95",
            "@width": "110",
            "@_fa": "true",
            "$": "https://api.elsevier.com/content/object/eid/1-s2.0-S0926860X14003676-fx14.jpg?httpAccept=%2A%2F%2A",
            "@multimediatype": "JPEG image file",
            "@type": "IMAGE-DOWNSAMPLED",
            "@size": "2246",
            "@ref": "fx14",
            "@mimetype": "image/jpeg"
          },
          {
            "@category": "standard",
            "@height": "111",
            "@width": "91",
            "@_fa": "true",
            "$": "https://api.elsevier.com/content/object/eid/1-s2.0-S0926860X14003676-fx13.jpg?httpAccept=%2A%2F%2A",
            "@multimediatype": "JPEG image file",
            "@type": "IMAGE-DOWNSAMPLED",
            "@size": "2018",
            "@ref": "fx13",
            "@mimetype": "image/jpeg"
          },
          {
            "@category": "standard",
            "@height": "48",
            "@width": "85",
            "@_fa": "true",
            "$": "https://api.elsevier.com/content/object/eid/1-s2.0-S0926860X14003676-fx12.jpg?httpAccept=%2A%2F%2A",
            "@multimediatype": "JPEG image file",
            "@type": "IMAGE-DOWNSAMPLED",
            "@size": "1362",
            "@ref": "fx12",
            "@mimetype": "image/jpeg"
          },
          {
            "@category": "standard",
            "@height": "94",
            "@width": "58",
            "@_fa": "true",
            "$": "https://api.elsevier.com/content/object/eid/1-s2.0-S0926860X14003676-fx11.jpg?httpAccept=%2A%2F%2A",
            "@multimediatype": "JPEG image file",
            "@type": "IMAGE-DOWNSAMPLED",
            "@size": "1721",
            "@ref": "fx11",
            "@mimetype": "image/jpeg"
          },
          {
            "@category": "standard",
            "@height": "42",
            "@width": "48",
            "@_fa": "true",
            "$": "https://api.elsevier.com/content/object/eid/1-s2.0-S0926860X14003676-fx10.jpg?httpAccept=%2A%2F%2A",
            "@multimediatype": "JPEG image file",
            "@type": "IMAGE-DOWNSAMPLED",
            "@size": "935",
            "@ref": "fx10",
            "@mimetype": "image/jpeg"
          },
          {
            "@category": "standard",
            "@height": "191",
            "@width": "500",
            "@_fa": "true",
            "$": "https://api.elsevier.com/content/object/eid/1-s2.0-S0926860X14003676-fx1.jpg?httpAccept=%2A%2F%2A",
            "@multimediatype": "JPEG image file",
            "@type": "IMAGE-DOWNSAMPLED",
            "@size": "15656",
            "@ref": "fx1",
            "@mimetype": "image/jpeg"
          },
          {
            "@category": "standard",
            "@height": "94",
            "@width": "300",
            "@_fa": "true",
            "$": "https://api.elsevier.com/content/object/eid/1-s2.0-S0926860X14003676-fx2.gif?httpAccept=%2A%2F%2A",
            "@multimediatype": "GIF image file",
            "@type": "IMAGE-DOWNSAMPLED",
            "@size": "1696",
            "@ref": "fx2",
            "@mimetype": "image/gif"
          },
          {
            "@category": "thumbnail",
            "@height": "69",
            "@width": "219",
            "@_fa": "true",
            "$": "https://api.elsevier.com/content/object/eid/1-s2.0-S0926860X14003676-fx2.sml?httpAccept=%2A%2F%2A",
            "@multimediatype": "GIF image file",
            "@type": "IMAGE-THUMBNAIL",
            "@size": "1130",
            "@ref": "fx2",
            "@mimetype": "image/gif"
          },
          {
            "@category": "thumbnail",
            "@height": "155",
            "@width": "219",
            "@_fa": "true",
            "$": "https://api.elsevier.com/content/object/eid/1-s2.0-S0926860X14003676-sc1.sml?httpAccept=%2A%2F%2A",
            "@multimediatype": "GIF image file",
            "@type": "IMAGE-THUMBNAIL",
            "@size": "2622",
            "@ref": "sc1",
            "@mimetype": "image/gif"
          },
          {
            "@category": "thumbnail",
            "@height": "126",
            "@width": "219",
            "@_fa": "true",
            "$": "https://api.elsevier.com/content/object/eid/1-s2.0-S0926860X14003676-gr3.sml?httpAccept=%2A%2F%2A",
            "@multimediatype": "GIF image file",
            "@type": "IMAGE-THUMBNAIL",
            "@size": "6871",
            "@ref": "gr3",
            "@mimetype": "image/gif"
          },
          {
            "@category": "thumbnail",
            "@height": "115",
            "@width": "219",
            "@_fa": "true",
            "$": "https://api.elsevier.com/content/object/eid/1-s2.0-S0926860X14003676-gr2.sml?httpAccept=%2A%2F%2A",
            "@multimediatype": "GIF image file",
            "@type": "IMAGE-THUMBNAIL",
            "@size": "2552",
            "@ref": "gr2",
            "@mimetype": "image/gif"
          },
          {
            "@category": "thumbnail",
            "@height": "117",
            "@width": "219",
            "@_fa": "true",
            "$": "https://api.elsevier.com/content/object/eid/1-s2.0-S0926860X14003676-gr1.sml?httpAccept=%2A%2F%2A",
            "@multimediatype": "GIF image file",
            "@type": "IMAGE-THUMBNAIL",
            "@size": "5022",
            "@ref": "gr1",
            "@mimetype": "image/gif"
          },
          {
            "@category": "thumbnail",
            "@height": "49",
            "@width": "41",
            "@_fa": "true",
            "$": "https://api.elsevier.com/content/object/eid/1-s2.0-S0926860X14003676-fx9.sml?httpAccept=%2A%2F%2A",
            "@multimediatype": "GIF image file",
            "@type": "IMAGE-THUMBNAIL",
            "@size": "1263",
            "@ref": "fx9",
            "@mimetype": "image/gif"
          },
          {
            "@category": "thumbnail",
            "@height": "23",
            "@width": "23",
            "@_fa": "true",
            "$": "https://api.elsevier.com/content/object/eid/1-s2.0-S0926860X14003676-fx8.sml?httpAccept=%2A%2F%2A",
            "@multimediatype": "GIF image file",
            "@type": "IMAGE-THUMBNAIL",
            "@size": "835",
            "@ref": "fx8",
            "@mimetype": "image/gif"
          },
          {
            "@category": "thumbnail",
            "@height": "21",
            "@width": "21",
            "@_fa": "true",
            "$": "https://api.elsevier.com/content/object/eid/1-s2.0-S0926860X14003676-fx7.sml?httpAccept=%2A%2F%2A",
            "@multimediatype": "GIF image file",
            "@type": "IMAGE-THUMBNAIL",
            "@size": "946",
            "@ref": "fx7",
            "@mimetype": "image/gif"
          },
          {
            "@category": "thumbnail",
            "@height": "25",
            "@width": "24",
            "@_fa": "true",
            "$": "https://api.elsevier.com/content/object/eid/1-s2.0-S0926860X14003676-fx6.sml?httpAccept=%2A%2F%2A",
            "@multimediatype": "GIF image file",
            "@type": "IMAGE-THUMBNAIL",
            "@size": "997",
            "@ref": "fx6",
            "@mimetype": "image/gif"
          },
          {
            "@category": "thumbnail",
            "@height": "23",
            "@width": "26",
            "@_fa": "true",
            "$": "https://api.elsevier.com/content/object/eid/1-s2.0-S0926860X14003676-fx5.sml?httpAccept=%2A%2F%2A",
            "@multimediatype": "GIF image file",
            "@type": "IMAGE-THUMBNAIL",
            "@size": "920",
            "@ref": "fx5",
            "@mimetype": "image/gif"
          },
          {
            "@category": "thumbnail",
            "@height": "23",
            "@width": "22",
            "@_fa": "true",
            "$": "https://api.elsevier.com/content/object/eid/1-s2.0-S0926860X14003676-fx4.sml?httpAccept=%2A%2F%2A",
            "@multimediatype": "GIF image file",
            "@type": "IMAGE-THUMBNAIL",
            "@size": "912",
            "@ref": "fx4",
            "@mimetype": "image/gif"
          },
          {
            "@category": "thumbnail",
            "@height": "23",
            "@width": "23",
            "@_fa": "true",
            "$": "https://api.elsevier.com/content/object/eid/1-s2.0-S0926860X14003676-fx3.sml?httpAccept=%2A%2F%2A",
            "@multimediatype": "GIF image file",
            "@type": "IMAGE-THUMBNAIL",
            "@size": "973",
            "@ref": "fx3",
            "@mimetype": "image/gif"
          },
          {
            "@category": "thumbnail",
            "@height": "105",
            "@width": "219",
            "@_fa": "true",
            "$": "https://api.elsevier.com/content/object/eid/1-s2.0-S0926860X14003676-fx17.sml?httpAccept=%2A%2F%2A",
            "@multimediatype": "GIF image file",
            "@type": "IMAGE-THUMBNAIL",
            "@size": "2546",
            "@ref": "fx17",
            "@mimetype": "image/gif"
          },
          {
            "@category": "thumbnail",
            "@height": "164",
            "@width": "212",
            "@_fa": "true",
            "$": "https://api.elsevier.com/content/object/eid/1-s2.0-S0926860X14003676-fx16.sml?httpAccept=%2A%2F%2A",
            "@multimediatype": "GIF image file",
            "@type": "IMAGE-THUMBNAIL",
            "@size": "2928",
            "@ref": "fx16",
            "@mimetype": "image/gif"
          },
          {
            "@category": "thumbnail",
            "@height": "164",
            "@width": "161",
            "@_fa": "true",
            "$": "https://api.elsevier.com/content/object/eid/1-s2.0-S0926860X14003676-fx15.sml?httpAccept=%2A%2F%2A",
            "@multimediatype": "GIF image file",
            "@type": "IMAGE-THUMBNAIL",
            "@size": "2526",
            "@ref": "fx15",
            "@mimetype": "image/gif"
          },
          {
            "@category": "thumbnail",
            "@height": "164",
            "@width": "190",
            "@_fa": "true",
            "$": "https://api.elsevier.com/content/object/eid/1-s2.0-S0926860X14003676-fx14.sml?httpAccept=%2A%2F%2A",
            "@multimediatype": "GIF image file",
            "@type": "IMAGE-THUMBNAIL",
            "@size": "2707",
            "@ref": "fx14",
            "@mimetype": "image/gif"
          },
          {
            "@category": "thumbnail",
            "@height": "163",
            "@width": "134",
            "@_fa": "true",
            "$": "https://api.elsevier.com/content/object/eid/1-s2.0-S0926860X14003676-fx13.sml?httpAccept=%2A%2F%2A",
            "@multimediatype": "GIF image file",
            "@type": "IMAGE-THUMBNAIL",
            "@size": "2188",
            "@ref": "fx13",
            "@mimetype": "image/gif"
          },
          {
            "@category": "thumbnail",
            "@height": "124",
            "@width": "219",
            "@_fa": "true",
            "$": "https://api.elsevier.com/content/object/eid/1-s2.0-S0926860X14003676-fx12.sml?httpAccept=%2A%2F%2A",
            "@multimediatype": "GIF image file",
            "@type": "IMAGE-THUMBNAIL",
            "@size": "2501",
            "@ref": "fx12",
            "@mimetype": "image/gif"
          },
          {
            "@category": "thumbnail",
            "@height": "163",
            "@width": "100",
            "@_fa": "true",
            "$": "https://api.elsevier.com/content/object/eid/1-s2.0-S0926860X14003676-fx11.sml?httpAccept=%2A%2F%2A",
            "@multimediatype": "GIF image file",
            "@type": "IMAGE-THUMBNAIL",
            "@size": "2104",
            "@ref": "fx11",
            "@mimetype": "image/gif"
          },
          {
            "@category": "thumbnail",
            "@height": "190",
            "@width": "216",
            "@_fa": "true",
            "$": "https://api.elsevier.com/content/object/eid/1-s2.0-S0926860X14003676-fx10.sml?httpAccept=%2A%2F%2A",
            "@multimediatype": "GIF image file",
            "@type": "IMAGE-THUMBNAIL",
            "@size": "2849",
            "@ref": "fx10",
            "@mimetype": "image/gif"
          },
          {
            "@category": "thumbnail",
            "@height": "84",
            "@width": "219",
            "@_fa": "true",
            "$": "https://api.elsevier.com/content/object/eid/1-s2.0-S0926860X14003676-fx1.sml?httpAccept=%2A%2F%2A",
            "@multimediatype": "GIF image file",
            "@type": "IMAGE-THUMBNAIL",
            "@size": "2077",
            "@ref": "fx1",
            "@mimetype": "image/gif"
          }
        ]
      },
      "link": {
        "@rel": "abstract",
        "@href": "https://api.elsevier.com/content/abstract/scopus_id/84903213724"
      }
    }
  }
}