{
  "metadata": {
    "title": "Exfoliated graphite as a heat-conductive frame for a new pelletized Fischer–Tropsch synthesis catalyst",
    "authors": "; ; ",
    "journal": "Applied Catalysis A: General",
    "date": "2020-07-05",
    "doi": "10.1016/j.apcata.2020.117639",
    "abstract": "",
    "uri": "https://api.elsevier.com/content/article/pii/S0926860X20302325",
    "pii": "S0926860X20302325"
  },
  "fulltext": {
    "full-text-retrieval-response": {
      "scopus-eid": "2-s2.0-85085564018",
      "originalText": "serial JL 271346 291210 291744 291809 31 Applied Catalysis A: General APPLIEDCATALYSISAGENERAL 2020-05-17 2020-05-17 2020-06-01 2020-06-01 2020-06-09T12:52:51 1-s2.0-S0926860X20302325 S0926-860X(20)30232-5 S0926860X20302325 10.1016/j.apcata.2020.117639 S300 S300.1 FULL-TEXT 1-s2.0-S0926860X20X00111 2024-01-01T12:33:10.553292Z 0 0 20200705 2020 2020-05-17T14:31:44.830644Z absattachment articleinfo articlenumber articletitlenorm authfirstinitialnorm authfirstsurnamenorm cid cids contenttype copyright crossmark dateloaded dateloadedtxt datesearch datesort dateupdated dco docsubtype doctype doi eid ewtransactionid hubeid indexeddate issn issnnorm itemstage itemtransactionid itemweight openaccess openarchive pg pgfirst pii piinorm pubdatestart pubdatetxt pubyr sortorder srctitle srctitlenorm srctype ssids alllist content subj subheadings suppl tomb volfirst volissue volumelist webpdf webpdfpagecount yearnav figure table body affil articletitle auth authfirstini authfull authkeywords authlast footnotes highlightsabst orcid primabst ref specialabst 0926-860X 0926860X true 601 601 C Volume 601 11 117639 117639 117639 20200705 5 July 2020 2020-07-05 2020 article fla © 2020 Elsevier B.V. All rights reserved. EXFOLIATEDGRAPHITEAHEATCONDUCTIVEFRAMEFORANEWPELLETIZEDFISCHERTROPSCHSYNTHESISCATALYST ASALIEVA E 1 Introduction 2 Experimental 3 Results and discussion 3.1 Characterization of heat-conductive additives 3.2 Characterization of CoAl and CoG supports 3.3 Characterization of CoAl and CoG catalysts and the impact of catalytic testing 3.4 Cobalt on the surface of the heat-conductive frames 3.5 The results of catalytic testing 4 Conclusion CRediT authorship contribution statement References BAYER 2016 44 C FRATALOCCHI 2018 829 L VISCONTI 2011 1294 C PHILIPPE 2009 S305 R SHENG 2012 445 446 M KHASUN 2008 28 A DEKLERK 2010 279 A CATALYSISINREFININGFISCHERTROPSCHSYNCRUDE VANSTEEN 2008 655 E MAITLIS 2013 372 P GREENERFISSHERTROPSSHPROCESSES DIEHL 2009 11 F LACROIX 2011 62 M ASALIEVA 2015 260 E HILMEN 2001 227 A HOLMEN 2013 150 A SINEVA 2015 1176 L YANG 2017 481 X KIM 2018 21978 J ALMEIDA 2007 79 L VISCONTI 2009 93 C LUO 2019 143 Q SHENG 2011 254 M ASALIEVA 2015 2371 E XING 2013 24 C LIU 2013 279 Y NI 2017 325 Z KUANG 2019 67 T HAJJAR 2017 1341 Z SHARIATI 2019 9 J TANG 2018 1971 L KIM 2018 21978 J ZHAO 2019 251 Z MORDKOVICH 2015 9539 V ASALIEVAX2020X117639 ASALIEVAX2020X117639XE 2022-06-01T00:00:00.000Z 2022-06-01T00:00:00.000Z http://creativecommons.org/licenses/by-nc-nd/4.0/ © 2020 Elsevier B.V. All rights reserved. item S0926-860X(20)30232-5 S0926860X20302325 1-s2.0-S0926860X20302325 10.1016/j.apcata.2020.117639 271346 2024-01-01T12:33:10.553292Z 2020-07-05 1-s2.0-S0926860X20302325-main.pdf https://s3-eu-west-1.amazonaws.com/prod-ucs-content-store-eu-west/content/pii:S0926860X20302325/MAIN/application/pdf/443f4adbf646ced6413898397640a833/main.pdf main.pdf pdf true 9359892 MAIN 11 1-s2.0-S0926860X20302325-main_1.png https://s3-eu-west-1.amazonaws.com/prod-ucs-content-store-eu-west/content/pii:S0926860X20302325/PREVIEW/image/png/7f7b6f2ce44848280352e077ef1b6c1d/main_1.png main_1.png png 54191 849 656 IMAGE-WEB-PDF 1 1-s2.0-S0926860X20302325-gr1.jpg https://s3-eu-west-1.amazonaws.com/prod-ucs-content-store-eu-west/content/pii:S0926860X20302325/gr1/DOWNSAMPLED/image/jpeg/222086d8bff62a9a45643782bf9876df/gr1.jpg gr1 gr1.jpg jpg 19663 225 301 IMAGE-DOWNSAMPLED 1-s2.0-S0926860X20302325-gr2.jpg https://s3-eu-west-1.amazonaws.com/prod-ucs-content-store-eu-west/content/pii:S0926860X20302325/gr2/DOWNSAMPLED/image/jpeg/a9523467f2d564d46e6a27bca81a3b8b/gr2.jpg gr2 gr2.jpg jpg 46583 217 565 IMAGE-DOWNSAMPLED 1-s2.0-S0926860X20302325-gr3.jpg https://s3-eu-west-1.amazonaws.com/prod-ucs-content-store-eu-west/content/pii:S0926860X20302325/gr3/DOWNSAMPLED/image/jpeg/d175993c9fa257d8f0cc9eb0cc31f64d/gr3.jpg gr3 gr3.jpg jpg 49919 256 565 IMAGE-DOWNSAMPLED 1-s2.0-S0926860X20302325-gr4.jpg https://s3-eu-west-1.amazonaws.com/prod-ucs-content-store-eu-west/content/pii:S0926860X20302325/gr4/DOWNSAMPLED/image/jpeg/4b7b04930188d35be81ee633f96bcce3/gr4.jpg gr4 gr4.jpg jpg 45851 208 565 IMAGE-DOWNSAMPLED 1-s2.0-S0926860X20302325-gr5.jpg https://s3-eu-west-1.amazonaws.com/prod-ucs-content-store-eu-west/content/pii:S0926860X20302325/gr5/DOWNSAMPLED/image/jpeg/02ed914963664453b7188cbc7305e94f/gr5.jpg gr5 gr5.jpg jpg 44783 174 565 IMAGE-DOWNSAMPLED 1-s2.0-S0926860X20302325-gr6.jpg https://s3-eu-west-1.amazonaws.com/prod-ucs-content-store-eu-west/content/pii:S0926860X20302325/gr6/DOWNSAMPLED/image/jpeg/aa6c9104897adb47c9e521e98d1b60a2/gr6.jpg gr6 gr6.jpg jpg 59860 212 565 IMAGE-DOWNSAMPLED 1-s2.0-S0926860X20302325-gr19.jpg https://s3-eu-west-1.amazonaws.com/prod-ucs-content-store-eu-west/content/pii:S0926860X20302325/gr19/DOWNSAMPLED/image/jpeg/3af815a8c39a212b292a72819bf29bfe/gr19.jpg gr19 gr19.jpg jpg 29628 240 470 IMAGE-DOWNSAMPLED 1-s2.0-S0926860X20302325-gr7.jpg https://s3-eu-west-1.amazonaws.com/prod-ucs-content-store-eu-west/content/pii:S0926860X20302325/gr7/DOWNSAMPLED/image/jpeg/887ec2252bf8010479e95a9eb51520ea/gr7.jpg gr7 gr7.jpg jpg 47324 212 565 IMAGE-DOWNSAMPLED 1-s2.0-S0926860X20302325-gr8.jpg https://s3-eu-west-1.amazonaws.com/prod-ucs-content-store-eu-west/content/pii:S0926860X20302325/gr8/DOWNSAMPLED/image/jpeg/2da2c780a8cb60e39547027d203f253f/gr8.jpg gr8 gr8.jpg jpg 27986 236 470 IMAGE-DOWNSAMPLED 1-s2.0-S0926860X20302325-gr17.jpg https://s3-eu-west-1.amazonaws.com/prod-ucs-content-store-eu-west/content/pii:S0926860X20302325/gr17/DOWNSAMPLED/image/jpeg/a1a8b4da370aab44424a53a07f96e6d8/gr17.jpg gr17 gr17.jpg jpg 30001 190 376 IMAGE-DOWNSAMPLED 1-s2.0-S0926860X20302325-gr9.jpg https://s3-eu-west-1.amazonaws.com/prod-ucs-content-store-eu-west/content/pii:S0926860X20302325/gr9/DOWNSAMPLED/image/jpeg/900211495dc5b9a2d2a17bedef26e369/gr9.jpg gr9 gr9.jpg jpg 33130 236 470 IMAGE-DOWNSAMPLED 1-s2.0-S0926860X20302325-gr18.jpg https://s3-eu-west-1.amazonaws.com/prod-ucs-content-store-eu-west/content/pii:S0926860X20302325/gr18/DOWNSAMPLED/image/jpeg/5463b34588ae5a74dfbc5d6c71ddace9/gr18.jpg gr18 gr18.jpg jpg 37027 189 376 IMAGE-DOWNSAMPLED 1-s2.0-S0926860X20302325-gr15.jpg https://s3-eu-west-1.amazonaws.com/prod-ucs-content-store-eu-west/content/pii:S0926860X20302325/gr15/DOWNSAMPLED/image/jpeg/5a351ac5b1a6707d2015245ff36b7f59/gr15.jpg gr15 gr15.jpg jpg 34687 213 659 IMAGE-DOWNSAMPLED 1-s2.0-S0926860X20302325-gr16.jpg https://s3-eu-west-1.amazonaws.com/prod-ucs-content-store-eu-west/content/pii:S0926860X20302325/gr16/DOWNSAMPLED/image/jpeg/097062915454f7c8d09abb043c09120d/gr16.jpg gr16 gr16.jpg jpg 43457 235 659 IMAGE-DOWNSAMPLED 1-s2.0-S0926860X20302325-gr13.jpg https://s3-eu-west-1.amazonaws.com/prod-ucs-content-store-eu-west/content/pii:S0926860X20302325/gr13/DOWNSAMPLED/image/jpeg/ae89a16b155c2d7b78706d0853c8910b/gr13.jpg gr13 gr13.jpg jpg 44797 243 659 IMAGE-DOWNSAMPLED 1-s2.0-S0926860X20302325-gr14.jpg https://s3-eu-west-1.amazonaws.com/prod-ucs-content-store-eu-west/content/pii:S0926860X20302325/gr14/DOWNSAMPLED/image/jpeg/0bdc1e142d1b4248d08731aab40f9ab5/gr14.jpg gr14 gr14.jpg jpg 30965 183 659 IMAGE-DOWNSAMPLED 1-s2.0-S0926860X20302325-gr11.jpg https://s3-eu-west-1.amazonaws.com/prod-ucs-content-store-eu-west/content/pii:S0926860X20302325/gr11/DOWNSAMPLED/image/jpeg/0dccfa31e60b553837f42aefaf3083bd/gr11.jpg gr11 gr11.jpg jpg 27885 189 659 IMAGE-DOWNSAMPLED 1-s2.0-S0926860X20302325-gr12.jpg https://s3-eu-west-1.amazonaws.com/prod-ucs-content-store-eu-west/content/pii:S0926860X20302325/gr12/DOWNSAMPLED/image/jpeg/9641d8507d7637ad5a2d3659cb679f7b/gr12.jpg gr12 gr12.jpg jpg 37921 251 659 IMAGE-DOWNSAMPLED 1-s2.0-S0926860X20302325-gr20.jpg https://s3-eu-west-1.amazonaws.com/prod-ucs-content-store-eu-west/content/pii:S0926860X20302325/gr20/DOWNSAMPLED/image/jpeg/9926e5e31616fe8987ffd5d49559cf97/gr20.jpg gr20 gr20.jpg jpg 39516 237 470 IMAGE-DOWNSAMPLED 1-s2.0-S0926860X20302325-gr10.jpg https://s3-eu-west-1.amazonaws.com/prod-ucs-content-store-eu-west/content/pii:S0926860X20302325/gr10/DOWNSAMPLED/image/jpeg/05e4379ab21245245fdfae9a8e569fba/gr10.jpg gr10 gr10.jpg jpg 13757 200 339 IMAGE-DOWNSAMPLED 1-s2.0-S0926860X20302325-gr21.jpg https://s3-eu-west-1.amazonaws.com/prod-ucs-content-store-eu-west/content/pii:S0926860X20302325/gr21/DOWNSAMPLED/image/jpeg/cb073f054bea8a3b381826629795b11b/gr21.jpg gr21 gr21.jpg jpg 12979 206 339 IMAGE-DOWNSAMPLED 1-s2.0-S0926860X20302325-ga1.jpg https://s3-eu-west-1.amazonaws.com/prod-ucs-content-store-eu-west/content/pii:S0926860X20302325/ga1/DOWNSAMPLED/image/jpeg/e2b85595cd132bd6016ef4e4582c33b0/ga1.jpg ga1 true ga1.jpg jpg 36533 200 496 IMAGE-DOWNSAMPLED 1-s2.0-S0926860X20302325-gr1.sml https://s3-eu-west-1.amazonaws.com/prod-ucs-content-store-eu-west/content/pii:S0926860X20302325/gr1/THUMBNAIL/image/gif/2d641729ad51882f0be8eedcd4339df1/gr1.sml gr1 gr1.sml sml 19999 164 219 IMAGE-THUMBNAIL 1-s2.0-S0926860X20302325-gr2.sml https://s3-eu-west-1.amazonaws.com/prod-ucs-content-store-eu-west/content/pii:S0926860X20302325/gr2/THUMBNAIL/image/gif/8ffc1e5d8f3b41a0421bc93660690d4e/gr2.sml gr2 gr2.sml sml 13423 84 219 IMAGE-THUMBNAIL 1-s2.0-S0926860X20302325-gr3.sml https://s3-eu-west-1.amazonaws.com/prod-ucs-content-store-eu-west/content/pii:S0926860X20302325/gr3/THUMBNAIL/image/gif/3104c4afa86676b84bafaa27272430bf/gr3.sml gr3 gr3.sml sml 12911 99 219 IMAGE-THUMBNAIL 1-s2.0-S0926860X20302325-gr4.sml https://s3-eu-west-1.amazonaws.com/prod-ucs-content-store-eu-west/content/pii:S0926860X20302325/gr4/THUMBNAIL/image/gif/c669c7cb7442b16d97beaef8a00ad62d/gr4.sml gr4 gr4.sml sml 13995 81 219 IMAGE-THUMBNAIL 1-s2.0-S0926860X20302325-gr5.sml https://s3-eu-west-1.amazonaws.com/prod-ucs-content-store-eu-west/content/pii:S0926860X20302325/gr5/THUMBNAIL/image/gif/bcae1b6e181557bf39ef0f9212fb36d0/gr5.sml gr5 gr5.sml sml 9877 67 219 IMAGE-THUMBNAIL 1-s2.0-S0926860X20302325-gr6.sml https://s3-eu-west-1.amazonaws.com/prod-ucs-content-store-eu-west/content/pii:S0926860X20302325/gr6/THUMBNAIL/image/gif/3d633b71ef253a49948fb418ff28e768/gr6.sml gr6 gr6.sml sml 15285 82 219 IMAGE-THUMBNAIL 1-s2.0-S0926860X20302325-gr19.sml https://s3-eu-west-1.amazonaws.com/prod-ucs-content-store-eu-west/content/pii:S0926860X20302325/gr19/THUMBNAIL/image/gif/2c218899e2fd5214902eb691c29495e4/gr19.sml gr19 gr19.sml sml 14873 112 219 IMAGE-THUMBNAIL 1-s2.0-S0926860X20302325-gr7.sml https://s3-eu-west-1.amazonaws.com/prod-ucs-content-store-eu-west/content/pii:S0926860X20302325/gr7/THUMBNAIL/image/gif/ccc3cc8134d8c81f879e3fee70fe9d75/gr7.sml gr7 gr7.sml sml 12400 82 219 IMAGE-THUMBNAIL 1-s2.0-S0926860X20302325-gr8.sml https://s3-eu-west-1.amazonaws.com/prod-ucs-content-store-eu-west/content/pii:S0926860X20302325/gr8/THUMBNAIL/image/gif/3d4b033e619e6e7bcbfdcfa24b74541c/gr8.sml gr8 gr8.sml sml 13929 110 219 IMAGE-THUMBNAIL 1-s2.0-S0926860X20302325-gr17.sml https://s3-eu-west-1.amazonaws.com/prod-ucs-content-store-eu-west/content/pii:S0926860X20302325/gr17/THUMBNAIL/image/gif/070841b99bd504fd2b2ea52c391da416/gr17.sml gr17 gr17.sml sml 18834 110 219 IMAGE-THUMBNAIL 1-s2.0-S0926860X20302325-gr9.sml https://s3-eu-west-1.amazonaws.com/prod-ucs-content-store-eu-west/content/pii:S0926860X20302325/gr9/THUMBNAIL/image/gif/145c44fcc13fbb06ffda0b5540237776/gr9.sml gr9 gr9.sml sml 13883 110 219 IMAGE-THUMBNAIL 1-s2.0-S0926860X20302325-gr18.sml https://s3-eu-west-1.amazonaws.com/prod-ucs-content-store-eu-west/content/pii:S0926860X20302325/gr18/THUMBNAIL/image/gif/05f35fb55010074f0452b1ed49af0b2b/gr18.sml gr18 gr18.sml sml 21020 110 219 IMAGE-THUMBNAIL 1-s2.0-S0926860X20302325-gr15.sml https://s3-eu-west-1.amazonaws.com/prod-ucs-content-store-eu-west/content/pii:S0926860X20302325/gr15/THUMBNAIL/image/gif/49be9b7df961252ab14d19d48cf93d73/gr15.sml gr15 gr15.sml sml 6327 71 219 IMAGE-THUMBNAIL 1-s2.0-S0926860X20302325-gr16.sml https://s3-eu-west-1.amazonaws.com/prod-ucs-content-store-eu-west/content/pii:S0926860X20302325/gr16/THUMBNAIL/image/gif/7de4d2982f8fa8bf0185e4cb1fceff3c/gr16.sml gr16 gr16.sml sml 7939 78 219 IMAGE-THUMBNAIL 1-s2.0-S0926860X20302325-gr13.sml https://s3-eu-west-1.amazonaws.com/prod-ucs-content-store-eu-west/content/pii:S0926860X20302325/gr13/THUMBNAIL/image/gif/834ff0c6b25311154fa4d1c0ce9d00a7/gr13.sml gr13 gr13.sml sml 7545 81 219 IMAGE-THUMBNAIL 1-s2.0-S0926860X20302325-gr14.sml https://s3-eu-west-1.amazonaws.com/prod-ucs-content-store-eu-west/content/pii:S0926860X20302325/gr14/THUMBNAIL/image/gif/21c5b43d7287dfa492650da96d23bcff/gr14.sml gr14 gr14.sml sml 6254 61 219 IMAGE-THUMBNAIL 1-s2.0-S0926860X20302325-gr11.sml https://s3-eu-west-1.amazonaws.com/prod-ucs-content-store-eu-west/content/pii:S0926860X20302325/gr11/THUMBNAIL/image/gif/cc471164529cf454d295ce31492f42ee/gr11.sml gr11 gr11.sml sml 5606 63 219 IMAGE-THUMBNAIL 1-s2.0-S0926860X20302325-gr12.sml https://s3-eu-west-1.amazonaws.com/prod-ucs-content-store-eu-west/content/pii:S0926860X20302325/gr12/THUMBNAIL/image/gif/947e86e39efc7b47c029db925e5c3c27/gr12.sml gr12 gr12.sml sml 7295 83 219 IMAGE-THUMBNAIL 1-s2.0-S0926860X20302325-gr20.sml https://s3-eu-west-1.amazonaws.com/prod-ucs-content-store-eu-west/content/pii:S0926860X20302325/gr20/THUMBNAIL/image/gif/8a0b797c0b9c80d9c61880e2d0c9d597/gr20.sml gr20 gr20.sml sml 14755 110 219 IMAGE-THUMBNAIL 1-s2.0-S0926860X20302325-gr10.sml https://s3-eu-west-1.amazonaws.com/prod-ucs-content-store-eu-west/content/pii:S0926860X20302325/gr10/THUMBNAIL/image/gif/6c3b830bcd68acf5a8e6f6aab7f3d8c9/gr10.sml gr10 gr10.sml sml 6591 130 219 IMAGE-THUMBNAIL 1-s2.0-S0926860X20302325-gr21.sml https://s3-eu-west-1.amazonaws.com/prod-ucs-content-store-eu-west/content/pii:S0926860X20302325/gr21/THUMBNAIL/image/gif/6253cbcbedf7247b609e75b24985f19d/gr21.sml gr21 gr21.sml sml 6795 133 219 IMAGE-THUMBNAIL 1-s2.0-S0926860X20302325-ga1.sml https://s3-eu-west-1.amazonaws.com/prod-ucs-content-store-eu-west/content/pii:S0926860X20302325/ga1/THUMBNAIL/image/gif/65ba660ad4b42bc66b8f2fe2a302d775/ga1.sml ga1 true ga1.sml sml 11396 88 219 IMAGE-THUMBNAIL 1-s2.0-S0926860X20302325-gr1_lrg.jpg https://s3-eu-west-1.amazonaws.com/prod-ucs-content-store-eu-west/content/pii:S0926860X20302325/gr1/HIGHRES/image/jpeg/df9abd98c2ec13044867b7a48e3b5e67/gr1_lrg.jpg gr1 gr1_lrg.jpg jpg 333923 997 1333 IMAGE-HIGH-RES 1-s2.0-S0926860X20302325-gr2_lrg.jpg https://s3-eu-west-1.amazonaws.com/prod-ucs-content-store-eu-west/content/pii:S0926860X20302325/gr2/HIGHRES/image/jpeg/60b19828cd61c02fdb5d3bceb39be6c3/gr2_lrg.jpg gr2 gr2_lrg.jpg jpg 652912 962 2500 IMAGE-HIGH-RES 1-s2.0-S0926860X20302325-gr3_lrg.jpg https://s3-eu-west-1.amazonaws.com/prod-ucs-content-store-eu-west/content/pii:S0926860X20302325/gr3/HIGHRES/image/jpeg/f60e49bf73c077df2d0269657d94c854/gr3_lrg.jpg gr3 gr3_lrg.jpg jpg 735391 1134 2500 IMAGE-HIGH-RES 1-s2.0-S0926860X20302325-gr4_lrg.jpg https://s3-eu-west-1.amazonaws.com/prod-ucs-content-store-eu-west/content/pii:S0926860X20302325/gr4/HIGHRES/image/jpeg/8cd7e2bddbdbfc9493ff217ceed5ed42/gr4_lrg.jpg gr4 gr4_lrg.jpg jpg 540887 920 2500 IMAGE-HIGH-RES 1-s2.0-S0926860X20302325-gr5_lrg.jpg https://s3-eu-west-1.amazonaws.com/prod-ucs-content-store-eu-west/content/pii:S0926860X20302325/gr5/HIGHRES/image/jpeg/932a729cd40baaeb4e737d22554bd76d/gr5_lrg.jpg gr5 gr5_lrg.jpg jpg 557920 768 2500 IMAGE-HIGH-RES 1-s2.0-S0926860X20302325-gr6_lrg.jpg https://s3-eu-west-1.amazonaws.com/prod-ucs-content-store-eu-west/content/pii:S0926860X20302325/gr6/HIGHRES/image/jpeg/0ef282d8c64b4e34b2f446f8d3380faa/gr6_lrg.jpg gr6 gr6_lrg.jpg jpg 785732 939 2500 IMAGE-HIGH-RES 1-s2.0-S0926860X20302325-gr19_lrg.jpg https://s3-eu-west-1.amazonaws.com/prod-ucs-content-store-eu-west/content/pii:S0926860X20302325/gr19/HIGHRES/image/jpeg/014abc1f69b1743dab43e89208badc18/gr19_lrg.jpg gr19 gr19_lrg.jpg jpg 636842 1064 2083 IMAGE-HIGH-RES 1-s2.0-S0926860X20302325-gr7_lrg.jpg https://s3-eu-west-1.amazonaws.com/prod-ucs-content-store-eu-west/content/pii:S0926860X20302325/gr7/HIGHRES/image/jpeg/9b198e4875c88db101b923e45eaa0a11/gr7_lrg.jpg gr7 gr7_lrg.jpg jpg 585268 938 2500 IMAGE-HIGH-RES 1-s2.0-S0926860X20302325-gr8_lrg.jpg https://s3-eu-west-1.amazonaws.com/prod-ucs-content-store-eu-west/content/pii:S0926860X20302325/gr8/HIGHRES/image/jpeg/e17bf3bd7b5ec4f0b254b63859e0c30c/gr8_lrg.jpg gr8 gr8_lrg.jpg jpg 612899 1047 2083 IMAGE-HIGH-RES 1-s2.0-S0926860X20302325-gr17_lrg.jpg https://s3-eu-west-1.amazonaws.com/prod-ucs-content-store-eu-west/content/pii:S0926860X20302325/gr17/HIGHRES/image/jpeg/c1e3a4953bd5a34491bf1862c87a63ff/gr17_lrg.jpg gr17 gr17_lrg.jpg jpg 437456 841 1667 IMAGE-HIGH-RES 1-s2.0-S0926860X20302325-gr9_lrg.jpg https://s3-eu-west-1.amazonaws.com/prod-ucs-content-store-eu-west/content/pii:S0926860X20302325/gr9/HIGHRES/image/jpeg/5e170053067b3e0fd9d5986a241b6f29/gr9_lrg.jpg gr9 gr9_lrg.jpg jpg 707803 1047 2083 IMAGE-HIGH-RES 1-s2.0-S0926860X20302325-gr18_lrg.jpg https://s3-eu-west-1.amazonaws.com/prod-ucs-content-store-eu-west/content/pii:S0926860X20302325/gr18/HIGHRES/image/jpeg/8ccf9ad87ef0a4f79d125db99b94f7f1/gr18_lrg.jpg gr18 gr18_lrg.jpg jpg 497695 838 1667 IMAGE-HIGH-RES 1-s2.0-S0926860X20302325-gr15_lrg.jpg https://s3-eu-west-1.amazonaws.com/prod-ucs-content-store-eu-west/content/pii:S0926860X20302325/gr15/HIGHRES/image/jpeg/480776db5ea221ae303b998dd8211e8b/gr15_lrg.jpg gr15 gr15_lrg.jpg jpg 318270 943 2917 IMAGE-HIGH-RES 1-s2.0-S0926860X20302325-gr16_lrg.jpg https://s3-eu-west-1.amazonaws.com/prod-ucs-content-store-eu-west/content/pii:S0926860X20302325/gr16/HIGHRES/image/jpeg/15a5add5875300274baa4f8a08cdd697/gr16_lrg.jpg gr16 gr16_lrg.jpg jpg 410437 1038 2917 IMAGE-HIGH-RES 1-s2.0-S0926860X20302325-gr13_lrg.jpg https://s3-eu-west-1.amazonaws.com/prod-ucs-content-store-eu-west/content/pii:S0926860X20302325/gr13/HIGHRES/image/jpeg/bc8917a83a497fd51a449b2969d761ab/gr13_lrg.jpg gr13 gr13_lrg.jpg jpg 423132 1076 2917 IMAGE-HIGH-RES 1-s2.0-S0926860X20302325-gr14_lrg.jpg https://s3-eu-west-1.amazonaws.com/prod-ucs-content-store-eu-west/content/pii:S0926860X20302325/gr14/HIGHRES/image/jpeg/2ab49cd1b49674b65f43ec1d85ade567/gr14_lrg.jpg gr14 gr14_lrg.jpg jpg 308750 810 2917 IMAGE-HIGH-RES 1-s2.0-S0926860X20302325-gr11_lrg.jpg https://s3-eu-west-1.amazonaws.com/prod-ucs-content-store-eu-west/content/pii:S0926860X20302325/gr11/HIGHRES/image/jpeg/6319ee2b0b38bcceab1e7ed6b2f26ebb/gr11_lrg.jpg gr11 gr11_lrg.jpg jpg 280379 838 2917 IMAGE-HIGH-RES 1-s2.0-S0926860X20302325-gr12_lrg.jpg https://s3-eu-west-1.amazonaws.com/prod-ucs-content-store-eu-west/content/pii:S0926860X20302325/gr12/HIGHRES/image/jpeg/c626a62d6dc16a6465095e80cdb278dc/gr12_lrg.jpg gr12 gr12_lrg.jpg jpg 368382 1111 2917 IMAGE-HIGH-RES 1-s2.0-S0926860X20302325-gr20_lrg.jpg https://s3-eu-west-1.amazonaws.com/prod-ucs-content-store-eu-west/content/pii:S0926860X20302325/gr20/HIGHRES/image/jpeg/f5f8eb3f26bd754c579e15bef4cb8fcf/gr20_lrg.jpg gr20 gr20_lrg.jpg jpg 733805 1051 2083 IMAGE-HIGH-RES 1-s2.0-S0926860X20302325-gr10_lrg.jpg https://s3-eu-west-1.amazonaws.com/prod-ucs-content-store-eu-west/content/pii:S0926860X20302325/gr10/HIGHRES/image/jpeg/bec0755b98200643d7d223034711613d/gr10_lrg.jpg gr10 gr10_lrg.jpg jpg 106250 887 1500 IMAGE-HIGH-RES 1-s2.0-S0926860X20302325-gr21_lrg.jpg https://s3-eu-west-1.amazonaws.com/prod-ucs-content-store-eu-west/content/pii:S0926860X20302325/gr21/HIGHRES/image/jpeg/df1772c9e7777e852a1d2a428ebb5d11/gr21_lrg.jpg gr21 gr21_lrg.jpg jpg 109719 910 1500 IMAGE-HIGH-RES 1-s2.0-S0926860X20302325-ga1_lrg.jpg https://s3-eu-west-1.amazonaws.com/prod-ucs-content-store-eu-west/content/pii:S0926860X20302325/ga1/HIGHRES/image/jpeg/0b9b240d9a63e52da834fc6acac44f4d/ga1_lrg.jpg ga1 true ga1_lrg.jpg jpg 484621 886 2197 IMAGE-HIGH-RES 1-s2.0-S0926860X20302325-am.pdf am am.pdf pdf 3508394 AAM-PDF https://s3-eu-west-1.amazonaws.com/prod-ucs-content-store-eu-west/content/egi:10X6F69MFLK/MAIN/application/pdf/4a25d3e83da0833c7cbd154c3d892702/am.pdf APCATA 117639 117639 S0926-860X(20)30232-5 10.1016/j.apcata.2020.117639 Elsevier B.V. Fig. 1 Microstructure of exfoliated graphite as shown by SEM. Fig. 1 Fig. 2 SEM image of heat-conductive additive: aluminum metal powder (a); exfoliated graphite (b). Fig. 2 Fig. 3 SEM image of support pellet shear surface: CoAl (a); CoG (b). Fig. 3 Fig. 4 SEM image of catalyst surface: CoAl (a); CoG (b). Fig. 4 Fig. 5 X-ray tomography visualization of catalyst pellet: CоAl cross-section (a); 3D visualization of a halved pellet at the example of CoAl (b); CоG cross-section (c). Fig. 5 Fig. 6 EDS-assisted element mapping linked to SEM image of CoAl catalyst surface. Fig. 6 Fig. 7 EDS-assisted element mapping linked to SEM image of CoG catalyst surface. Fig. 7 Fig. 8 TEM images of cobalt oxide crystallites of composites before catalytic tests: CоAl (a); CоG (b). Fig. 8 Fig. 9 TEM images of cobalt oxide crystallites of composite catalysts after catalytic tests: CоAl (а); CоG (b). Fig. 9 Fig. 10 TPR of composites. Fig. 10 Fig. 11 TG and DTA curves of the catalysts before catalytic tests: CоAl (а); CоG (b). Fig. 11 Fig. 12 3D mass-spectra (a) and 2D cross-section for m/z 18 (b) of CoAl catalyst before catalytic tests. Fig. 12 Fig. 13 3D mass-spectra (a) and 2D cross-section for m/z 44 (b) of CоG catalyst before catalytic tests. Fig. 13 Fig. 14 TG and DTA curves of the catalysts after catalytic tests: CоAl (а); CоG (b). Fig. 14 Fig. 15 3D mass-spectra (a) and 2D cross-section for m/z 44 (b) of CoAl catalyst after catalytic tests. Fig. 15 Fig. 16 3D mass-spectra (a) and 2D cross-section for m/z 44 (b) of CoG catalyst after catalytic tests. Fig. 16 Fig. 17 SEM image of Co/Al model system surface and its basic elements mapping. Fig. 17 Fig. 18 SEM image of Co/G model system surface and its basic elements mapping. Fig. 18 Fig. 19 TEM images of Co/Al model system cobalt oxide crystallites. Fig. 19 Fig. 20 TEM images of Co/G model system cobalt oxide crystallites. Fig. 20 Fig. 21 TPR curves of model systems. Fig. 21 Table 1 Composition of supports. Table 1 Sample Content (wt.%) a heat conductive additive zeolite binder aluminum graphite CoAl 50 – 30 20 CoG – 20 30 50 Ref – – 80 20 a Percentages are given here for dry mixture of components. Table 2 Structural properties of supports. Table 2 Sample Surface area (m2/g) Pore volume (cm3/g) CoAl 210 0.67 CoG 364 0.55 Ref 591 0.65 Table 3 Structural properties and thermal conductivity of the catalysts. Table 3 Sample Surface area (m2/g) Pore volume (cm3/g) Thermal conductivity (W/m K) CoAl 148 0.39 3.89 CoG 252 0.35 8.62 Ref 401 0.38 0.25 Table 4 Main FTS parameters. Table 4 Sample Synthesis temperature, °C CO conversion, % C5+ HCs selectivity, % CH4 selectivity, % C2–C4 HCs selectivity, % C5+ HCs productivity, g/kg∙h GHSV 1000 h−1 CoAl 220 84 53 22 13 118 CoG 225 77 55 21 12 113 Ref 215 72 59 18 17 98 GHSV 3000 h−1 CoAl 223 71 66 18 13 375 CoG 225 81 69 17 11 455 Ref 224 47 56 20 21 190 Table 5 Composition of produced C5+ hydrocarbons. Table 5 Sample Synthesis temperature, °C C5+ HCs composition, wt. % α Olefins N-paraffins Isoparaffins GHSV 1000 h−1 CoAl 220 16 56 28 0.75 CoG 225 8 62 30 0.75 Ref 215 23 45 32 0.77 GHSV 3000 h−1 CoAl 223 38 40 22 0.73 CoG 225 30 48 22 0.73 Ref 224 29 32 39 0.75 Exfoliated graphite as a heat-conductive frame for a new pelletized Fischer–Tropsch synthesis catalyst Ekaterina Asalieva Investigation Writing - original draft a * Lilia Sineva Conceptualization Project administration a Svetlana Sinichkina Validation b Igor Solomonik Investigation a Kirill Gryaznov Methodology Investigation a Ekaterina Pushina Formal analysis a Ekaterina Kulchakovskaya Investigation a 1 Andrei Gorshkov Investigation b Boris Kulnitskiy Formal analysis a Danila Ovsyannikov Formal analysis a Sergey Zholudev Formal analysis a Vladimir Mordkovich Conceptualization Writing - review & editing Supervision a b a Federal State Budgetary Institution “Technological Institute for Superhard and Novel Carbon Materials”, Moscow, Troitsk 108840, Russia Federal State Budgetary Institution “Technological Institute for Superhard and Novel Carbon Materials” Troitsk Moscow 108840 Russia Federal State Budgetary Institution “Technological Institute for Superhard and Novel Carbon Materials”, Moscow, Troitsk 108840, Russia b OOO INFRA, Moscow, 125009, Russia OOO INFRA Moscow 125009 Russia 2OOO INFRA, Moscow 125009, Russia. ⁎ Corresponding author. 1 Current address: Institute of Petroleum Chemistry, Siberian Division of the Russian Academy of Sciences, Tomsk 634021, Russia. Graphical abstract The introduction of exfoliated graphite into pelletized Co-based catalysts affects in the most positive way both catalytic and physico-chemical properties. Unlike other carbons, the exfoliated graphite allows combination of extended surface with high thermal conductivity. An open-ended system of slit-type pores is revealed by X-ray tomography. Electron microscopy shows graphitic platelets forming an all-penetrating heat-conductive frame. Element distribution analysis shows that this catalyst cannot be considered as a cobalt-on-carbon catalyst since the graphitic component carries insignificant amount of cobalt and serves as a heat-conductive frame only. Thermal conductivity of a catalyst with graphite frame is 2 times higher than that of its industrial predecessor with Al metal frame and 30 times higher than that of a catalyst without heat-conductive additive. Testing in exothermal Fischer–Tropsch synthesis shows a favorable influence of the graphitic additive, i.e. such catalyst shows productivity of 455 g/kg/h at GHSV of 3000 h−1. Keywords Catalyst Fischer-tropsch synthesis Thermal conductivity Exfoliated graphite Aluminum Cobalt 1 Introduction Low-temperature Fischer–Tropsch synthesis (FTS) is known as a highly exothermic catalytic process (146–176 kJ per 1 mol of CO) for production of liquid hydrocarbons mixture from CO and H2 over Co-based catalysts [1]. Co-based catalysts require precision in controlling the process temperature because uneven temperature distribution and local overheats shift the reaction conditions out of the narrow FTS range leading to intensive formation of methane by direct CO hydrogenation and to accelerated deactivation of the catalyst [2–6]. The reaction temperature control in a heterogeneous fixed bed as a key factor for any prospective highly productive catalytic system may become possible if an efficient heat removal is arranged. The conventional catalysts contain usually 15–30 wt.% of cobalt often promoted by noble metals [7–10]. A support should be characterized by high enough surface area, mechanical strength and durability under hydrothermal conditions. Conventional FTS catalysts produced by impregnation of alumina, silica or titania with cobalt salt solutions have been thoroughly investigated by the moment, so their structure, morphology and active center behavior are commonly known. The removal of FTS-generated heat from such ceramic pelletized catalysts is limited, which is a reason for more attention to the problem of thermal conductivity of a support in recent research [3,5,11–14]. It is especially important for zeolite-containing hybrid catalysts [15]. One should note however that a heat-conductive frame of a support is not the only way for FTS-generated heat to leave a catalyst pellet. The removal of reaction products from the pellet through its pore system (especially meso- and macro-pores) is also important [11,12]. So the efficient mass transport is crucial especially taking into account the fact that while the reactants enter the catalytic bed in gaseous form the products are mostly liquid and hence experience diffusion limitations in transport [2,13,12–14]. The materials with hierarchical porosity are very attractive for such catalytic processes because different pores provide different important functions such as high surface area of micro/meso-pores for fixation of active centers or mass transfer to the outer limits of the pellet by macro-pores [16,17]. Unfortunately, high porosity and high surface area are accompanied with quite poor thermal conductivity, which kills the positive effect achieved by the porous system. The use of monolithic supports (cordierite or γ–Al2O3 or steel or iron-chromium alloy or aluminum or carbon) or foams (silicon carbide or aluminum) is often considered as a good way for intensification of heat- and mass transfer [3,11,13,14,18–20]. Another promising technique is introduction of a heat-conductive additive into conventional support material while a catalyst is in preparation. The microfibers (copper or aluminum) or powders (aluminum or copper or zinc or carbon) were suggested as such additives [5,12,14,21–23]. It is important that a catalytic bed comprising the aluminum powder-doped pellets showed a three-fold productivity jump as compared with conventional pelletized fixed bed [12,23]. Another popular direction of development is the use of heat-conductive carbons as supports for cobalt. There are reports on the use of various carbons such as carbon nanotubes, graphitized carbon, non-porous carbon spheres, graphite, graphene oxide, activated charcoal and nanoporous graphene in the literature [24–33]. Other reasons for the use of carbon supports in FTS catalysts include weak metal-carbon interaction, which allow easy activation and higher catalytic activity as a result. However the carbon supports often bring lower C5+ selectivity because of support role in gasification reactions, which leads to higher yield of undesirable CH4 and CO2 [22]. Another drawback is catalyst manufacturing complications, which often include sophisticated encapsulation of cobalt nanoparticles with carbon and lead to irreproducible properties of the catalyst. One can observe that the main problem is a contradiction between high thermal conductivity requirement, which is met by highly crystallized graphite only, and high surface/porosity requirement, which is met by poorly crystallized or amorphous carbons. Moreover, high thermal conductivity is usually coupled with durability to gasification, i.e. durability to the involvement into reactions with FTS environment components (H2, CO2, H2O), which might lead to significant or even complete loss of the carbon support. Taking into account the above-mentioned contradiction, a new type of nanostructured graphite namely exfoliated graphite nano-platelets (xGnP) or graphene may present interest as a prospective heat-conductive component for FTS catalysts. The xGnP has a foam-like structure as demonstrated in Fig. 1 . Highly crystallized natural graphite serves as a precursor for xGnP production. Oxidative intercalation in graphite followed by explosive de-intercalation leads to exfoliation of bulk graphite crystals into thin ribbon-like packs, which comprise very limited number of graphenes each and represent shards of a precursor large graphite crystal. As a result, a low-density highly-porous crumpled xGnP structure is formed [34]. It is remarkable that high porosity is combined here with very high crystallinity inherited from a precursor graphite. It was recently reported that a pelletized catalyst with exfoliated graphite-based heat-conductive frame was issued by OOO INFRA as a commercial product [35,36]. The purpose of this paper was to report a new pelletized FTS catalyst with a heat-conductive frame made of exfoliated graphite and to investigate some properties of it. The research was focused on step-by-step comparison with the earlier discovered predecessor catalyst [12, 23, 37] using aluminum metal powder in its heat-conductive frame. It is necessary to note that a comparison of catalytic properties of industry-targeted pelletized catalysts is inevitably reported as results produced at so called optimum conditions i.e. in a fixed pelletized bed at the temperature, which provides the best combination of conversion and C5+ selectivity (meaning the highest possible productivity of the bed) at a fixed GHSV. 2 Experimental The supports were prepared by mixing heat-conductive component (exfoliated graphite (UNICHIMTEK) or aluminum metal powder (PAP-2 grade by RUSAL)), H-Beta zeolite (Zeolyst, SiO2/Al2O3 = 38) and boehmite (Sasol) as a binder with the liquid phase comprising a mixture of 9.4 % HNO3, triethyleneglycol and C2H5OH (Table 1 ) until a homogenized paste was formed. The relative concentrations of liquid phase are disclosed in [35]. The reference sample, prepared for comparative FTS activity test, did not contain a heat-conductive component. As soon as the paste homogeneity was reached it was formed by a piston extruder through a 1.5–2.5 mm diameter die. Then the extrudates were dried, calcined and cut to pellets of 2–3 mm length. Fabricated supports have the form of pellets of structured porous composite material, the pellets have size of 2.5 × 2.5 mm for CoAl, 1.5 × 2 mm for CoG and 2.5 × 3 for Ref sample. Exfoliated graphite was supplied by UNICHIMTEK as “Thermally expanded graphite (Natural scaly graphite” TRG-50/4 in the form of lightweight flaky powder with density when delivered 12 g/l. TRG-50/4 represents immediate precursor of graphitic foil grade C, i.e. it is a powder just before rolling into a foil. Specification stipulates the same chemical composition as for grade C foil, in particular carbon content >99.5 %. Cobalt was used as an active component in FTS. All catalysts were prepared by two-step incipient wetness impregnation of supports with water solution of Co(NO3)2·6H2O, every step was followed by calcination in air flow at 250 °C for 1 h. Cobalt loading was 20 wt.% calculated on support weight. CoAl and Ref catalysts were prepared according to the techniques described in detail elsewhere [12,23]. The new catalyst with exfoliated graphite was prepared according to [35]. In addition to CoAl, CoG and Ref catalyst samples, there were model systems prepared by wet impregnation of aluminum metal powder (Co/Al) or exfoliated graphite (Co/G) with the sole purpose to compare cobalt distribution on the surface of the heat-conductive frame. The study of catalytic properties is given here as a comparison of industry-targeted pelletized catalysts and reports as such the results produced at so called optimum conditions i.e. in a fixed pelletized bed at the temperature, which provides the best combination of conversion and C5+ selectivity (meaning the highest possible productivity of the bed) at a fixed GHSV. The Fischer–Tropsch synthesis was carried out in a steel fixed-bed tubular reactor with 10 mm inner diameter, catalyst loading was 2.5 cm3. CoAl catalyst loading was 1.66 g, CoG — 1.52 g and Ref — 1.97 g. The catalyst was activated in pure hydrogen before synthesis; the hydrogen was supplied at gas-hour space velocity (GHSV) of 3000 h−1 at 400 °C and 0.1 MPa for 1 h. GHSV was calculated at the reactor outlet at room temperature and atmosphere pressure conditions. Catalyst degree of reduction was estimated by oxygen titration as 40–50 %. After activation the catalyst was heated in synthesis gas stream at 2 MPa, raising the temperature from 170 to 220–235 °C by 3–10 °C steps every 6 h. Synthesis gas (molar ratio H2/CO = 2 with 5 vol.% of N2 as balance and internal reference) was supplied at 1000 h−1 GHSV while the temperature was raised and optimized (until reaching the maximum possible C5+ hydrocarbons productivity). The reactor was run for 36–42 h before the steady state. Then the GHSV was increased stepwise to 3000 h−1 and the temperature was optimized for every GHSV. Composition of gaseous and liquid products was determined chromatographically. The analysis of feed mixture and gaseous products (CH4, CO2, C2–C4 hydrocarbons) was performed by gas adsorption chromatography (thermal conductivity detector, carrier gas — helium, gas flow rate 20 mL/min). The column with CaA molecular sieves (3 m × 3 mm) was used to separate CO and CH4. The HayeSep column (3 m × 3 mm) was used to separate CO2 and C2–C4 hydrocarbons. The temperature-programmed mode was used (60–200 °C, heating rate 10 °C/min). Material balance was calculated on a daily basis. Material balance closure was at least 98 %. Composition of C5+ hydrocarbons was determined by gas-liquid chromatography (flame ionization detector, carrier gas — helium, gas flow rate 30 mL/min). The 50 m length capillary column with DP-Petro plate was used. The temperature-programmed mode was used (50–270 °C, heating rate 4 °C/min). Carbon chain growth probability was calculated from Anderson–Schultz–Flory molecular-mass distribution according to Flory equation: Wn = (1–α)2 × nα n –1, where α — chain growth probability; Wn — mass content of n-paraffin with carbon number n obtained from chromatogram. The material balance was composed after each change in the synthesis conditions (temperature or flow rate) for 25 days, and reproducibility of measurements was ≥98 %. Thermal conductivity was measured for cylindrical pellets, every measurement was repeated at 10 independent samples in order to minimize data scattering, which, however, never exceeded 2%. In order to receive the value of thermal conductivity, it was necessary to measure heat capacity and temperature conductivity and then calculate the thermal conductivity value according to the formula λ = α × Cp × ρ, where ρ — apparent density calculated from geometric parameters of a sample, kg/m3; α — temperature conductivity, m2/s; Cp — heat capacity, J/(kg K). Heat capacity was measured by calorimetry at DSC8000 (PerkinElmer). The temperature conductivity was measured by laser flash method at LFA 457/2/G MicroFlash analyzer (NETZSCH). The electron microscopy study of the samples of heat-conductive additives, supports and catalysts were carried out on scanning electron microscopes VEGA 3 (TESCAN) and JSM-7600 F (JEOL) and on the transmission electron microscope JEM-2010 (JEOL) equipped with the EELS and EDS attachments. Temperature-programmed reduction investigations were carried out at Autosorb-1C (Quantachrome Instruments). Structural characteristics of the porous systems of the supports and catalysts were obtained by NOVA 1200e (Quantachrome Instruments). XRD analysis was performed at 25 °C with the purpose to estimate cobalt crystallite size on Empyrean Panalytical Diffractometer (Cu-Kα radiation, Bragg-Brentano HD module as monochromator, solid state semiconductor Pixel3D detector). Thermal analysis in oxidizing atmosphere (synthetic air) was performed for the catalysts before and after FTS tests on a STA 449 F1 (Netzsch) equipped with an analyzer of evolved gases and quadrupole mass analyzer. 3 Results and discussion 3.1 Characterization of heat-conductive additives Fig. 2 demonstrates SEM images of the heat-conductive additives used. In both images the particles of sophisticated morphology can be seen. In case of exfoliated graphite a typical size of the particle is 150 × 300 × 160 μm3; while in case of aluminum metal powder it is 20 × 30 × 1 μm3. Aluminum metal powder is distinguished as flat flakes (Fig. 2a), while exfoliated graphite has an inherent bulk folded structure (Fig. 2b). The morphology of the heat-conductive component plays an important role in creating the heat-conductive frame in the support. 3.2 Characterization of CoAl and CoG supports SEM images of support pellet shear surface (end cleavage) shown in Fig. 3 manifest a kind of planet-in-the-space view with aluminum or graphite flakes looking like long clouds. This witnesses that the pellets have well-developed porosity and extended surface. The introduction of a heat-conductive additive brings specific texture and forms a heat-conducting frame. One can see macropores and the heat-conducting frame comprised of aluminum metal flakes in Fig. 3a. The exfoliated graphite-based sample displays crumbly macroporous structure with clearly seen transport pore system (Fig. 3b). The data on structural properties of investigated supports are given in Table 2 . Surface area and pore volume vary according to the type of heat-conductive additive. Aluminum-based sample is characterized by larger pore volume and graphite-based one demonstrates extended surface area. Results on structural properties of supports pore system are in agreement with pellets surface SEM images (Fig. 3). 3.3 Characterization of CoAl and CoG catalysts and the impact of catalytic testing Fig. 4 demonstrates SEM images of CoAl and CoG catalysts surface. It is clearly seen that the composite texture depends on type of heat-conductive additive. The surface structure of CoAl catalyst (Fig. 4a) is formed by parallel shiny flakes of aluminum metal with zeolite and binder particles between and around the heat-conductive frame. The total surface of catalyst pellet obtained by impregnation is covered by cobalt oxide particles that impart a dull tint to the photograph. One can observe large transport mesopores diverging along the pellet in all directions, which suggests through porosity. The surface of CoG sample does not possess the brightness specific to aluminum metal flakes (Fig. 4b). The composite is characterized by a larger three-dimensional porous system, penetrating the pellet surface in all directions. The heat-conducting frame formed by particles of exfoliated graphite is visible in the form of a lattice. Structural properties of the catalysts are given in Table 3 . Impregnation of support with active metal (20 wt.% of cobalt) leads to decrease in composite surface area, which is to be expected. Graphite-based sample exhibits more developed surface area. Catalyst pore volume is 0.35–0.39 cm3/g. Data on catalyst thermal conductivity prove that the introduction of aluminum metal powder as well as the introduction of exfoliated graphite provides the formation of effective heat-conductive frame. In contrast, thermal conductivity of a Ref pellet, which does not contain heat-conductive additive (80 wt.% of zeolite and 20 wt.% of binder) is 0.25 W/m K only. It is remarkable that just 20 % weight of exfoliated graphite gives thermal conductivity twice as high as in case of 50 % weight of aluminum in CoAl sample. The visualization of cross-sections of a catalyst pellet obtained by X-ray tomography (Fig. 5 ) confirms the above assumption that the pellets feature developed through porosity in every direction that in turn ensures effective mass transport properties during FTS. CoG catalyst is characterized by even more developed interconnecting pore system and transport channels, which penetrate the pellet in every direction. In addition, the pores of CoG are predominantly slit-type. Fig. 6 demonstrates element mapping of the CoAl catalyst surface linked to SEM image. Elemental analysis was carried out with EDS attachment for this particular surface section. One can see an aluminum metal flake, which dominates the image of Fig. 6. Al-atoms in surrounding areas are explained by the presence of binder and zeolite. Si-atoms distribution map, which represents zeolite localization only, evidences that zeolite particles are concentrated predominately around the aluminum flake and only a small part of them are placed directly on flake surface. O-atoms are distributed evenly enough, however their localization does not give us significant information, since this element is a part of zeolite, binder, cobalt oxides and oxide coating on aluminum metal flake surface. Co-atoms distribution indicates that catalytically active phase is allocated evenly enough over the support surface. However, one can observe directly on the surface of aluminum flake a local minimum in density distribution, but it is not as significant as in case of Si-atoms. The element mapping of the CoG catalyst surface linked to SEM image presented in Fig. 7 manifests a frontal platelet of exfoliated graphite stack in the middle of the image (C-atoms mapping). Al-atoms are located on the platelet sidewall and around it and indicate distribution of binder and zeolite. The arrangement of O-atoms with slight differences follows the pattern of the mapping of aluminum. Co-atoms distribution indicates that the cobalt-containing phase is localized predominantly above the oxygen- and aluminum-containing phases. The density of Co-atoms on the carbon surface is very low. It proves that the CoG catalyst cannot be considered as cobalt-on-carbon catalyst since the graphitic component carries insignificant amount of cobalt and serves as a heat-conductive frame only. The cobalt-containing phases of investigated catalysts are discerned as crystallites and agglomerates according to the data of TEM microscopy (Fig. 8 ). Cobalt oxide crystallites formed in the presence of both CoAl and CoG catalysts are described by similar particle size of 10–15 nm averagely. The data on crystallite size are confirmed by XRD analysis. The average cobalt oxide crystallite size for CoAl sample is 17 nm as determined by XRD peak profile analysis. CoG sample is characterized by 13 nm average crystallite size. The impact of catalytic testing on the properties of both CoAl and CoG testing was studied at the samples kindly provided by OOO INFRA after scale-up runs. It is important to analyze the effect of catalytic tests on the cobalt-containing phase particle size and on the patterns of thermal analysis, which reflect the appearance of new after-test deposits. TEM images (Fig. 9 ) evidence that 50 -h catalytic run leads to enlargement of cobalt oxide crystallites up to 20–60 nm. This fact can be explained by formation of catalyst stable surface during its activation. The CoG catalyst is characterized by noticeably larger crystallites size of 30 nm average, confirmed by XRD peak profile analysis. It is that longer catalytic run time up to 2000 h revealed no further enlargement of crystallites size both for CoAl (reported elsewhere [23]) and CoG. The temperature-programmed reduction (TPR) curves of investigated catalysts are shown in Fig. 10 . The type and shape of the curves depend on the nature of heat-conductive additive. It is known that melting of Co(NO3)2∙6H2O succeeded by gradual dehydration leads to formation of anhydrous Co(NO3)2 which is further decomposed to Cо2O3. At the temperatures around 180 °C Cо2O3 begins to form Cо3O4 phase. In addition to the processes described above, the catalyst undergoes various transformations, which include interaction of the cobalt-containing compounds with the surface of support. These surface processes cause the appearance of a shoulder in TPR curve at 280–320 °C for CoG catalyst, in particular the most important process is the reduction of stainierite phase, which was formed by Cо2O3 immobilization by surface hydroxyls. CoO phase, which is a result of such partial reduction, forms bulk Co3O4 by interaction with residual Cо2O3. In the case of CoAl one can observe significant decrease in the intensity of TPR curve at temperatures below 340 °C accompanied by almost complete disappearance of stainierite phase. The reason for that is Cо2O3 reduction to Cо3O4 at the early stage of catalyst formation due to the use of more organic components for paste formation. Hydrogen consumption at temperatures of 350–360оC and 380оC, as well as shoulders at 420–480о observed in TPR curves characterize the continuing gradual reduction of the bulk Co3O4 phase to form CoO crystallites and CoO–Cо3O4 solid solution. The phase of agglomerated CoO–Cо3O4 solid solution is reduced showing a broad peak at 350−500 °C. The total reduction peak at 400–420 °C is caused by bulky CoO crystallites transformation to cobalt metal. The broad maximum at temperatures of 480–600 °C corresponds to reduction of multilayer cobalt oxide phases, which are immobilized at the surface of support. The CoAl does not manifest this peak because of hydrogen release in the same temperature range, which is caused by residual organics thermolysis. Aluminum metal melting induces intensive release of hydrogen, which is reflected as a narrow reverse peak at 650–680 °C. The shift in the maximum of high-temperature peak in TPR curve for CoG catalyst indicates that the binder and its intermediate products of thermolysis significantly affect the formation of cobalt aluminates. Moreover, such high-temperature peak is derived from reduction of not only near-surface structures of defective cobalt-containing spinel, but also from reduction of other crystallized bulk structures. Octahedrally coordinated cobalt is reduced at the temperatures of 450–650 °C while tetrahedrally coordinated one — at 680–800 °C. The data obtained from TPR of catalysts indicate that the type of heat-conductive additive affects the nature of active metal interaction with the surface of support. The resulting cobalt oxides crystallites can vary in composition and size. The TG and DTA curves obtained during thermal analysis of CoAl and CoG catalysts before catalytic tests are presented in Fig. 11 . The TG curve of the CoAl sample (Fig. 11a) exhibits effects associated both with a decrease and an increase in the weight of the catalyst. The first peak arises from the loss of water as evidenced by the data obtained by analysis of the evolved gases. The second peak is caused by oxidation of aluminum metal. The narrow endothermal effect at 620–660 °C in the DTA curve corresponds to melting of aluminum metal, while the exothermal effects at 500–620 and 800–1000 °C correspond to the metal oxidation. It means that some aluminum metal particles start oxidation and melting earlier due to defects in their protective coatings. Then aluminum particles melt, become spherical, the surface area decreases dramatically, and, as a result, the rate of aluminum metal oxidation decreases. Temperature increase provides continued oxidation that ends with alumina formation. It is practically important to prove that the oxidation of aluminum metal begins below the melting temperature since that oxidation leads to destruction of the entire catalyst. This information makes it possible to establish a range of safe operating temperatures for the CoAl catalyst. The TG curve of the CoG sample (Fig. 11b) exhibits effects associated with catalyst weight decrease. Stepless weight loss from the beginning of the analysis up to 500 °C is caused by loss of water as evidenced by the data obtained by the evolved gas analysis. Further dramatic weight loss is associated with graphite oxidation accompanied with CO2 release. The broad exothermal peak at 600–800 °C corresponds to gradual oxidation of graphite. Fig. 12 represents 3D mass-spectra and their 2D cross-section for m/z 18 (water) of CoAl catalyst before catalytic tests. 3D mass-spectra display the evolution of response intensity in the temperature range up to 1200 °C for different m/z numbers (Fig. 12a). The curve reflects two main effects. The peak observed at temperatures up to 200 °C corresponds to plasticizer (TEG) decomposition with the release of CO and water at m/z of 14 and 18, respectively. Intensive water release is also observed at higher temperatures, presumably indicating dehydration processes. Fig. 12b demonstrates the dependence of response intensity on temperature for parent mass peak with m/z = 18, which corresponds to positively charged water ion. It is evident that CoAl catalyst sample loses water over the entire temperature range. Fig. 13 a represents 3D mass-spectra, which display the evolution of response intensity at the temperatures up to 1200 °C for different m/z masses of CoG catalyst before catalytic tests. The dependence of response intensity on temperature for parent mass peak with m/z = 44, which corresponds to CO2 release, is represented in Fig. 13b. Carbon dioxide emission proceeds in two steps. The broad indistinct peak in low temperature region (200–440 °C) is compliant with plasticizer (TEG) decomposition and more distinct high-temperature peak (550–800 °C) corresponds to oxidation of graphite. The TG and DTA curves obtained during thermal analysis of CoAl and CoG catalysts after catalytic tests are presented in Fig. 14 . The difference with the before-test result is revealed as an additional exothermal peak at 250–370 °C in DTA curve of CoAl catalyst (Fig. 14a), which is most probably associated with oxidation of carbon-containing compounds formed on the catalyst surface during FTS catalytic tests. The appearance of additional exothermal peak in DTA curve and respective effect of weight decrease in TG curve of CoG catalyst at 320–450 °C (Fig. 14b) can be also explained by oxidation of carbon-containing compounds formed on the catalyst surface during FTS catalytic tests. Fig. 15 represents 3D mass-spectra and 2D cross-section for mass number 44 of CoAl catalyst after catalytic tests. 3D mass-spectra display the evolution of response intensity in the temperature range up to 1200 °C for different m/z masses (Fig. 15a). Fig. 15b demonstrates the dependence of response intensity on temperature for parent mass peak with m/z = 44, referring to CO2 release. Carbon dioxide evolves in a narrow peak at 270–320 °C and corresponds to oxidation of carbon-containing compounds, which is consistent with exothermic peak in DTA curve of the sample (Fig. 14a). Fig. 16 a demonstrates 3D mass-spectra, which displays the evolution of response intensity in the temperature range up to 1200 °C for different m/z masses of CoG catalyst after catalytic tests. One can observe additional peaks around 400 °C with m/z masses 18 and 27. The dependence of response intensity on temperature for parent mass peak with m/z = 44, which corresponds to CO2 emission, is represented in Fig. 16b. Carbon dioxide emission proceeds in two steps in the same way as for catalyst sample before catalytic tests (Fig. 13b). However the intensity of low temperature peak increases significantly after catalytic testing, which could be explained by oxidation of carbon-containing compounds formed on the catalyst surface during FTS. The obtained data are in agreement with exothermic peak in DTA curve (Fig. 14b). 3.4 Cobalt on the surface of the heat-conductive frames Although it was shown above in this paper by element distribution analysis that CoG catalyst cannot be considered as a cobalt-on-carbon catalyst (since the graphitic component carries insignificant amount of cobalt and serves as a heat-conductive frame only), it is still interesting to investigate that insignificant cobalt deposited on the graphitic surface and compare with cobalt on aluminum metal flakes. The model systems of cobalt impregnated on aluminum metal powder (Co/Al) and on exfoliated graphite (Co/G) were studied to understand cobalt distribution on the heat-conductive frame surface. Fig. 17 demonstrate SEM image of Co/Al model system surface and its mapping of basic atoms obtained by elemental analysis with EDS attachment for this particular surface section. The data indicate that cobalt is distributed evenly enough over the metal surface. However some decrease in the density of the active metal atoms can be observed in the midst of large scale surface. Cobalt distribution on this model system surface is more uniform than on the surface of CoAl catalysts (Fig. 6). It is worth notice that the cobalt on aluminum metal flakes is actually linked to the surface aluminum oxide because no bare aluminum metal surface is possible in this kind of a system. The SEM image of the Co/G model system surface and its mapping of basic atoms presented in Fig. 18 indicate that cobalt distribution is not so uniform. It can be assumed that active metal tends to localization on end faces of exfoliated graphite platelets, which is in agreement with data obtained for graphite-containing catalyst (Fig. 7). According to TEM data (Fig. 19 ) cobalt-containing phase of aluminum-containing model system is dispersed to nano-crystallites. Such crystallites are evenly distributed through the outer surface of the flakes and arranged in clusters. The average size of an individual crystallite is about 5–10 nm. Fig. 20 demonstrates TEM images of exfoliated graphite surface with immobilized crystallites of cobalt oxides. It is obvious that crystallites are larger than that of Co/Al model system (Fig. 19). The average size of individual crystallite is about 20 nm. It is remarkable that the cobalt oxide crystallites form rather large island-like clusters made of small groups of cobalt oxides crystallites. Fig. 21 displays TPR curves of aluminum- and graphite-containing model systems. The data witness difference between these two heat-conductive additives in the nature of interaction with active metal. The main effect registered for Co/G model system is the reduction of macro-crystalline Cо3O4 that clearly indicates a very weak interaction of impregnated cobalt nitrate with the surface of exfoliated graphite. It is obvious that even in the composition of CoG catalyst the exfoliated graphite serves mainly as an additive that forms a heat-conductive frame while its interaction with cobalt-containing phases is negligible. At the same time for CoG catalyst (Fig. 10) most of cobalt captured during the reduction process is associated with unordered surface or bulk structures. Formation of such structures is determined by alumina component of the catalysts. 3.5 The results of catalytic testing The investigated catalysts were active in FTS. The main FTS parameters and composition of produced C5+ hydrocarbons (HCs) are given in the Tables 4 and 5 . The parameters for the Ref catalyst without heat-conductive additive are given as reference. The introduction of a heat-conductive frame into pellets resulted at 1000 h−1 in the increase of CO conversion from 72 for Ref up to 77–84 % for both CoAl and CoG. The selectivity of target product formation slightly decreased from 59 to 53–55 %. Methane selectivity increased from 17 to 21–22 % with the introduction of a heat-conductive frame regardless to its nature. CO2 selectivity increased from 5 to 12 %. The introduction of a heat-conductive additive increased the catalyst productivity at 1000 h−1 from 98 to 113–118 g/kg∙h. The reference catalyst was characterized by the following composition of the produced C5+ hydrocarbons: 23 % of olefins, 45 % of n-paraffins, 32 % of isoparaffins, chain growth probability (α) 0.77. The introduction of aluminum metal powder resulted in decrease of olefins content to 16 % and isoparaffins content to 28 % and increase of n-paraffins content up to 56 %. Chain growth probability slightly decreased to 0.75. The CoG catalyst generated C5+ hydrocarbons containing the lowest olefins content (8%) and the highest n-paraffins content (62 %). The content of isoparaffins was 30 % while the chain growth probability was 0.75. The increase of synthesis gas gas-hour space velocity (GHSV) up to 3000 h−1 revealed more significant differences among the investigated catalysts (Table 4,5). Thus, the introduction of heat-conductive additive allowed to increase significantly CO conversion from 47 % up to 71–81 %, target product selectivity — from 56 up to 66–69 %, and C5+ hydrocarbons productivity — from 190 up to 375–455 g/kg∙h. Methane selectivity decreased from 21 % for Ref to 17–18 % for CoG/CoAl, while CO2 selectivity was 2–3% regardless to the catalyst composition. The highest productivity was reached in the presence of exfoliated graphite-containing catalyst. The introduction of a heat-conductive frame resulted at 3000 h−1 in the increase of olefins content from 29 up to 30–38 %; also in the increase in n-paraffins from 32 up to 40–48 %, while the isoparaffins content decreased from 39 to 22 %. Chain growth probability slightly decreased to 0.73. The similar values of C5+ hydrocarbons, methane selectivity and CO2 selectivity in the presence of both aluminum- and graphite-containing catalysts support the mentioned above suggestion that graphic surface does not contribute in the FTS, i.e. the active cobalt is in very similar state in both CoAl and CoG catalysts. Moreover, both catalysts have similar deactivation behavior [37]. 4 Conclusion A new pelletized FTS catalyst with a heat-conductive frame made of exfoliated graphite was reported and investigated. The research was focused on step-by-step comparison with the earlier discovered predecessor catalyst with aluminum metal powder in its heat-conductive frame. The investigation of exfoliated graphite as a heat-conductive additive to pelletized Co catalysts for Fischer–Tropsch synthesis showed that the introduction of such additive influences most positively on both catalytic and physico-chemical properties of a catalyst. The exfoliated graphite-based support is characterized by extended surface, which affords impregnation with significant amounts of active metal. Unlike other carbon additives, the exfoliated graphite allows combination of extended surface with high thermal conductivity and durability to gasification. The flaky nature of exfoliated graphite leads to formation of open-ended transport pore system. As shown by X-ray tomography, such pores are predominantly slit-type, which is favorable for the transport of FTS products such as liquid hydrocarbons and water. Electron microscopy data support the direct thermal conductivity measurements in conclusion of formation of all-penetrating heat-conductive frame made of graphitic platelets. Thermal conductivity of a catalyst with exfoliated graphite frame is 2 times higher than that of a catalyst with aluminum metal frame and 30 times higher than that of a catalyst without heat-conducting additives. Element distribution analysis shows that this catalyst cannot be considered as a cobalt-on-carbon catalyst since the graphitic component carries insignificant amount of cobalt and serves as a heat-conductive frame only. Thermal analysis of the catalysts revealed an advantage of the catalyst with exfoliated graphite frame in thermal stability. Indeed, this catalyst survives any overheats while the aluminum metal-based counterpart is limited by 450 °C or even lower because of irreversible effects related with aluminum metal pre-melting and oxidation. Testing under FTS conditions showed that the introduction of a heat-conductive additive improves catalytic properties significantly. A favorable influence of higher thermal conductivity of a pellet is first of all revealed by much higher allowable GHSV (or shorter contact time). The catalyst with exfoliated graphite frame shows productivity of 455 g/kg/h at elevated GHSV of 3000 h−1. CRediT authorship contribution statement Ekaterina Asalieva: Investigation, Writing - original draft. Lilia Sineva: Conceptualization, Project administration. Svetlana Sinichkina: Validation. Igor Solomonik: Investigation. Kirill Gryaznov: Methodology, Investigation. Ekaterina Pushina: Formal analysis. Ekaterina Kulchakovskaya: Investigation. Andrei Gorshkov: Investigation. Boris Kulnitskiy: Formal analysis. Danila Ovsyannikov: Formal analysis. Sergey Zholudev: Formal analysis. Vladimir Mordkovich: Conceptualization, Writing - review & editing, Supervision. Declaration of Competing Interest The authors declare that they have no known competing financial interests or personal relationships that could have appeared to influence the work reported in this paper. References [1] C. Bayer J. Gazarian V. Lecocq S. Maury A. Forret J.M. Schweitzer V. Souchon Oil & Gas Science and Technology – Rev. IFP Energies nouvelles 71 2016 44 C. Bayer, J. Gazarian, V. Lecocq, S. Maury, A. Forret, J.M. Schweitzer and V. Souchon, Oil & Gas Science and Technology – Rev. IFP Energies nouvelles, 2016, 71, 44. [2] L. Fratalocchi C.G. Visconti G. Groppi L. Lietti E. Tronconi Chem. Eng. J. 349 2018 829 L. Fratalocchi, C.G. Visconti, G. Groppi, L. Lietti and E. Tronconi, Chemical Engineering Journal, 2018, 349, 829. [3] C.G. Visconti E. Tronconi G. Groppi L. Lietti M. Iovane S. Rossini R. Zennaro Chem. Eng. J. 171 2011 1294 C.G. Visconti, E. Tronconi, G. Groppi, L. Lietti, M. Iovane, S. Rossini and R. Zennaro, Chemical Engineering Journal, 2011, 171, 1294. [4] R. Philippe M. Lacroix L. Dreibine C. Pham-Huu D. Edouard S. Savin F. Luck D. Schweich Catal. Today 147 2009 S305 R. Philippe, M. Lacroix, L. Dreibine, C. Pham-Huu, D. Edouard, S. Savin, F. Luck and D. Schweich, Catalysis Today, 2009, 147, S305. [5] M. Sheng H. Yang D.R. Cahela W.R. Yantz Jr. C.F. Gonzalez B.J. Tatarchuk Appl. Catal. A Gen. 2012 445 446 143 M. Sheng, H. Yang, D. R. Cahela, W. R. Yantz Jr., C. F. Gonzalez and B. J. Tatarchuk, Applied Catalysis A: General, 2012, 445–446, 143. [6] A.A. Khasun Gazokhimiya 1 2008 28 A.A. Khasun, Gazokhimiya, 2008, 1, 28. [7] A. de Klerk E. Furimsky Catalysis in the Refining of Fischer–Tropsch Syncrude 2010 RSC Publishing Cambridge, UK 279 A. de Klerk and E.Furimsky, Catalysis in the Refining of Fischer–Tropsch Syncrude, RSC Publishing, Cambridge, UK, 2010, 279. [8] E. van Steen M. Claeys Chem. Eng. Technol. 31 2008 655 E. van Steen and M.Claeys, Chemical Engineering & Technology, 2008, 31, 655. [9] Peter M. Maitlis Arno de Klerk Greener Fisсher–Tropsсh Processes 2013 Weinheim Wiley–VCH Germany 372 Peter M. Maitlis and Arno de Klerk, Greener Fisсher–Tropsсh Processes, Weinheim Wiley–VCH, Germany, 2013, 372. [10] F. Diehl A.Y. Khodakov Oil Gas Sci. Technol. 64 2009 11 F. Diehl and A.Y. Khodakov, Oil & Gas Science and Technology, 2009, 64, 11. [11] M. Lacroix L. Dreibine B. de Tymowski F. Vigneron D. Edouard D. Bégin P. Nguyen C. Pham S. Savin-Poncet F. Luck M.-J. Ledoux C. Pham-Huum Appl. Catal. A Gen. 397 2011 62 M. Lacroix, L. Dreibine, B. de Tymowski, F. Vigneron, D. Edouard, D. Bégin, P. Nguyen, C. Pham, S. Savin-Poncet, F. Luck, M.-J. Ledoux and C. Pham-Huum, Applied Catalysis A: General, 2011, 397, 62. [12] E. Asalieva K. Gryaznov E. Kulchakovskaya I. Ermolaev L. Sineva V. Mordkovich Appl. Catal. A Gen. 505 2015 260 E. Asalieva, K. Gryaznov, E. Kulchakovskaya, I. Ermolaev, L. Sineva and V. Mordkovich, Applied Catalysis A: General, 2015, 505, 260. [13] A.-M. Hilmen E. Bergene O.A. Lindvag D. Schanke S. Eri A. Holmen Catal. Today 69 2001 227 A.-M. Hilmen, E. Bergene, O.A. Lindvag, D. Schanke, S. Eri and A. Holmen, Catalysis Today, 2001, 69, 227. [14] A. Holmen H.J. Venvik R. Myrstad J. Zhu D. Chen Catal. Today 216 2013 150 A. Holmen, H. J. Venvik, R. Myrstad, J. Zhu and D. Chen, Catalysis Today, 2013, 216, 150. [15] L.V. Sineva E.Yu. Asalieva V.Z. Mordkovich Russian Chemical Review 84 2015 1176 L. V. Sineva, E. Yu. Asalieva and V.Z. Mordkovich, Russian Chemical Review, 2015, 84, 1176. [16] X.Y. Yang L.H. Chen Y. Li J.C. Rooke C. Sanchez B.L. Su Chem. Soc. Rev. 46 2017 481 X. Y. Yang, L. H. Chen, Y. Li, J. C. Rooke, C. Sanchez and B. L. Su, Chemical Society Reviews, 2017, 46, 481. [17] J. Kim V. Nese J. Joos K. Jeske N. Duyckaerts N. Pfänder G. Prieto J. Mater. Chem. A Mater. Energy Sustain. 6 2018 21978 J. Kim, V. Nese, J. Joos, K. Jeske, N. Duyckaerts, N. Pfänder and G. Prieto, Journal of Material Chemistry A, 2018, 6, 21978. [18] L.C. Almeida O. Gonzalez O. Sanz A. Paul M.A. Centeno J.A. Odriozola M. Montes Stud. Surf. Sci. Catal. 167 2007 79 L.C. Almeida, O. Gonzalez, O. Sanz, A. Paul, M.A. Centeno, J.A. Odriozola and M. Montes, Studies in Surface Science and Catalysis, 2007, 167, 79. [19] C.G. Visconti E. Tronconi L. Lietti G. Groppi P. Forzatti C. Cristiani R. Zennaro S. Rossini E. Tronconi Appl. Catal. A Gen. 370 2009 93 C. G. Visconti, E. Tronconi, L. Lietti, G. Groppi, P. Forzatti, C. Cristiani, R. Zennaro, S. Rossini and E. Tronconi, Applied Catalysis A: General, 2009, 370, 93. [20] Q.-X. Luo L.-P. Guo S.-Y. Yao J. Bao Z.-T. Liu Z.-W. Liu J. Catal. 369 2019 143 Q.-X. Luo, L.-P. Guo, S.-Y. Yao, J. Bao, Z.-T. Liu and Z.-W. Liu, Journal of Catalysis, 2019, 369, 143. [21] M. Sheng H. Yang D.R. Cahela B.J. Tatarchuk J. Catal. 281 2011 254 M. Sheng, H. Yang, D. R. Cahela and B. J. Tatarchuk, Journal of catalysis, 2011, 281, 254. [22] Patent WO 2011053192 A2, 2012. [23] E.Yu. Asalieva L.V. Sineva E.A. Zhukova V.Z. Mordkovich B.M. Bulychev Russ. Chem. Bull. 64 2015 2371 E. Yu. Asalieva, L. V. Sineva, E. A. Zhukova, V. Z. Mordkovich and B. M. Bulychev, Russian Chemical Bulletin, 2015, 64, 2371. [24] C. Xing G. Yang D. Wang C. Zeng Y. Jin R. Yang Y. Suehiro N. Tsubaki Catal. Today 215 2013 24 C. Xing, G. Yang, D. Wang, C. Zeng, Y. Jin, R. Yang, Y. Suehiro and N. Tsubaki, Catalysis Today, 2013, 215, 24. [25] Y. Liu T. Dintzer O. Ersen C. Pham-Huu J. Energy Chem. 22 2013 279 Y. Liu, T. Dintzer, O. Ersen and C. Pham-Huu, Journal of Energy Chemistry, 2013, 22, 279. [26] Z. Ni S. Kang J. Bai Y. Li Y. Huang Z. Wang H. Qin X. Li J. Colloid Interface Sci. 505 2017 325 Z. Ni, S. Kang, J. Bai, Y. Li, Y. Huang, Z. Wang, H. Qin and X. Li, Journal of Colloid and Interface Science, 2017, 505, 325. [27] T. Kuang S. Lyu S. Liu Y. Zhang J. Li G. Wang L. Wang J. Energy Chem. 33 2019 67 T. Kuang, S. Lyu, S. Liu, Y. Zhang, J. Li, G. Wang and L. Wang, Journal of Energy Chemistry, 2019, 33, 67. [28] Z. Hajjar M.D. Rad S. Soltanali Res. Chem. Intermed. 43 2017 1341 Z. Hajjar, M.D. Rad and S. Soltanali, Research on Chemical Intermediates, 2017, 43, 1341. [29] J. Shariati A. Haghtalab A. Mosayebi J. Energy Chem. 28 2019 9 J. Shariati, A. Haghtalab and A. Mosayebi, Journal of Energy Chemistry, 2019, 28, 9. [30] L. Tang X.-L. Dong W. Xu L. He A.-H. Lu Chinese J. Catal. 39 2018 1971 L. Tang, X.-L. Dong, W. Xu, L. He and A.-H. Lu, Chinese Journal of Catalysis, 2018, 39, 1971. [31] J. Kim V. Nese J. Joos K. Jeske N. Duyckaerts N. Pfänder G. Prieto J. Mater. Chem. A 6 2018 21978 J. Kim, V. Nese, J. Joos, K. Jeske, N. Duyckaerts, N. Pfänder and G. Prieto, Journal of Materials Chemistry A, 2018, 6, 21978. [32] Z. Zhao W. Lu C. Feng X. Chen H. Zhu R. Yang W. Dong M. Zhao Y. Lyu T. Liu Z. Jiang Y. Ding J. Catal. 370 2019 251 Z. Zhao, W. Lu, C. Feng, X. Chen, H. Zhu, R. Yang, W. Dong, M. Zhao, Y. Lyu, T. Liu, Z. Jiang and Y. Ding, Journal of Catalysis, 2019, 370, 251. [33] Patent RU 2564354 C1, 2015. [34] Patent WO 2018217136 A1, 2018. [35] www.infratechnology.com. Accessed on Feb.14, 2020. [36] V.Z. Mordkovich V.S. Ermolaev E.B. Mitberg L.V. Sineva I.G. Solomonik I.S. Ermolaev E.Yu. Asalieva Res. Chem. Intermed. 41 2015 9539 V.Z. Mordkovich, V.S. Ermolaev, E.B. Mitberg, L.V. Sineva, I.G. Solomonik, I.S. Ermolaev and E.Yu. Asalieva, Research on Chemical Intermediates, 2015, 41, 9539.",
      "scopus-id": "85085564018",
      "coredata": {
        "eid": "1-s2.0-S0926860X20302325",
        "dc:description": "The introduction of exfoliated graphite into pelletized Co-based catalysts affects in the most positive way both catalytic and physico-chemical properties. Unlike other carbons, the exfoliated graphite allows combination of extended surface with high thermal conductivity. An open-ended system of slit-type pores is revealed by X-ray tomography. Electron microscopy shows graphitic platelets forming an all-penetrating heat-conductive frame. Element distribution analysis shows that this catalyst cannot be considered as a cobalt-on-carbon catalyst since the graphitic component carries insignificant amount of cobalt and serves as a heat-conductive frame only. Thermal conductivity of a catalyst with graphite frame is 2 times higher than that of its industrial predecessor with Al metal frame and 30 times higher than that of a catalyst without heat-conductive additive. Testing in exothermal Fischer–Tropsch synthesis shows a favorable influence of the graphitic additive, i.e. such catalyst shows productivity of 455 g/kg/h at GHSV of 3000 h−1.",
        "openArchiveArticle": "false",
        "prism:coverDate": "2020-07-05",
        "openaccessUserLicense": null,
        "prism:aggregationType": "Journal",
        "prism:url": "https://api.elsevier.com/content/article/pii/S0926860X20302325",
        "dc:creator": [
          {
            "@_fa": "true",
            "$": "Asalieva, Ekaterina"
          },
          {
            "@_fa": "true",
            "$": "Sineva, Lilia"
          },
          {
            "@_fa": "true",
            "$": "Sinichkina, Svetlana"
          },
          {
            "@_fa": "true",
            "$": "Solomonik, Igor"
          },
          {
            "@_fa": "true",
            "$": "Gryaznov, Kirill"
          },
          {
            "@_fa": "true",
            "$": "Pushina, Ekaterina"
          },
          {
            "@_fa": "true",
            "$": "Kulchakovskaya, Ekaterina"
          },
          {
            "@_fa": "true",
            "$": "Gorshkov, Andrei"
          },
          {
            "@_fa": "true",
            "$": "Kulnitskiy, Boris"
          },
          {
            "@_fa": "true",
            "$": "Ovsyannikov, Danila"
          },
          {
            "@_fa": "true",
            "$": "Zholudev, Sergey"
          },
          {
            "@_fa": "true",
            "$": "Mordkovich, Vladimir"
          }
        ],
        "link": [
          {
            "@_fa": "true",
            "@rel": "self",
            "@href": "https://api.elsevier.com/content/article/pii/S0926860X20302325"
          },
          {
            "@_fa": "true",
            "@rel": "scidir",
            "@href": "https://www.sciencedirect.com/science/article/pii/S0926860X20302325"
          }
        ],
        "dc:format": "application/json",
        "openaccessType": null,
        "pii": "S0926-860X(20)30232-5",
        "prism:volume": "601",
        "articleNumber": "117639",
        "prism:publisher": "Elsevier B.V.",
        "dc:title": "Exfoliated graphite as a heat-conductive frame for a new pelletized Fischer–Tropsch synthesis catalyst",
        "prism:copyright": "© 2020 Elsevier B.V. All rights reserved.",
        "openaccess": "0",
        "prism:issn": "0926860X",
        "dcterms:subject": [
          {
            "@_fa": "true",
            "$": "Catalyst"
          },
          {
            "@_fa": "true",
            "$": "Fischer-tropsch synthesis"
          },
          {
            "@_fa": "true",
            "$": "Thermal conductivity"
          },
          {
            "@_fa": "true",
            "$": "Exfoliated graphite"
          },
          {
            "@_fa": "true",
            "$": "Aluminum"
          },
          {
            "@_fa": "true",
            "$": "Cobalt"
          }
        ],
        "openaccessArticle": "false",
        "prism:publicationName": "Applied Catalysis A: General",
        "openaccessSponsorType": null,
        "prism:pageRange": "117639",
        "pubType": "fla",
        "prism:coverDisplayDate": "5 July 2020",
        "prism:doi": "10.1016/j.apcata.2020.117639",
        "prism:startingPage": "117639",
        "dc:identifier": "doi:10.1016/j.apcata.2020.117639",
        "openaccessSponsorName": null
      },
      "objects": {
        "object": [
          {
            "@category": "standard",
            "@height": "225",
            "@width": "301",
            "@_fa": "true",
            "$": "https://api.elsevier.com/content/object/eid/1-s2.0-S0926860X20302325-gr1.jpg?httpAccept=%2A%2F%2A",
            "@multimediatype": "JPEG image file",
            "@type": "IMAGE-DOWNSAMPLED",
            "@size": "19663",
            "@ref": "gr1",
            "@mimetype": "image/jpeg"
          },
          {
            "@category": "standard",
            "@height": "217",
            "@width": "565",
            "@_fa": "true",
            "$": "https://api.elsevier.com/content/object/eid/1-s2.0-S0926860X20302325-gr2.jpg?httpAccept=%2A%2F%2A",
            "@multimediatype": "JPEG image file",
            "@type": "IMAGE-DOWNSAMPLED",
            "@size": "46583",
            "@ref": "gr2",
            "@mimetype": "image/jpeg"
          },
          {
            "@category": "standard",
            "@height": "256",
            "@width": "565",
            "@_fa": "true",
            "$": "https://api.elsevier.com/content/object/eid/1-s2.0-S0926860X20302325-gr3.jpg?httpAccept=%2A%2F%2A",
            "@multimediatype": "JPEG image file",
            "@type": "IMAGE-DOWNSAMPLED",
            "@size": "49919",
            "@ref": "gr3",
            "@mimetype": "image/jpeg"
          },
          {
            "@category": "standard",
            "@height": "208",
            "@width": "565",
            "@_fa": "true",
            "$": "https://api.elsevier.com/content/object/eid/1-s2.0-S0926860X20302325-gr4.jpg?httpAccept=%2A%2F%2A",
            "@multimediatype": "JPEG image file",
            "@type": "IMAGE-DOWNSAMPLED",
            "@size": "45851",
            "@ref": "gr4",
            "@mimetype": "image/jpeg"
          },
          {
            "@category": "standard",
            "@height": "174",
            "@width": "565",
            "@_fa": "true",
            "$": "https://api.elsevier.com/content/object/eid/1-s2.0-S0926860X20302325-gr5.jpg?httpAccept=%2A%2F%2A",
            "@multimediatype": "JPEG image file",
            "@type": "IMAGE-DOWNSAMPLED",
            "@size": "44783",
            "@ref": "gr5",
            "@mimetype": "image/jpeg"
          },
          {
            "@category": "standard",
            "@height": "212",
            "@width": "565",
            "@_fa": "true",
            "$": "https://api.elsevier.com/content/object/eid/1-s2.0-S0926860X20302325-gr6.jpg?httpAccept=%2A%2F%2A",
            "@multimediatype": "JPEG image file",
            "@type": "IMAGE-DOWNSAMPLED",
            "@size": "59860",
            "@ref": "gr6",
            "@mimetype": "image/jpeg"
          },
          {
            "@category": "standard",
            "@height": "240",
            "@width": "470",
            "@_fa": "true",
            "$": "https://api.elsevier.com/content/object/eid/1-s2.0-S0926860X20302325-gr19.jpg?httpAccept=%2A%2F%2A",
            "@multimediatype": "JPEG image file",
            "@type": "IMAGE-DOWNSAMPLED",
            "@size": "29628",
            "@ref": "gr19",
            "@mimetype": "image/jpeg"
          },
          {
            "@category": "standard",
            "@height": "212",
            "@width": "565",
            "@_fa": "true",
            "$": "https://api.elsevier.com/content/object/eid/1-s2.0-S0926860X20302325-gr7.jpg?httpAccept=%2A%2F%2A",
            "@multimediatype": "JPEG image file",
            "@type": "IMAGE-DOWNSAMPLED",
            "@size": "47324",
            "@ref": "gr7",
            "@mimetype": "image/jpeg"
          },
          {
            "@category": "standard",
            "@height": "236",
            "@width": "470",
            "@_fa": "true",
            "$": "https://api.elsevier.com/content/object/eid/1-s2.0-S0926860X20302325-gr8.jpg?httpAccept=%2A%2F%2A",
            "@multimediatype": "JPEG image file",
            "@type": "IMAGE-DOWNSAMPLED",
            "@size": "27986",
            "@ref": "gr8",
            "@mimetype": "image/jpeg"
          },
          {
            "@category": "standard",
            "@height": "190",
            "@width": "376",
            "@_fa": "true",
            "$": "https://api.elsevier.com/content/object/eid/1-s2.0-S0926860X20302325-gr17.jpg?httpAccept=%2A%2F%2A",
            "@multimediatype": "JPEG image file",
            "@type": "IMAGE-DOWNSAMPLED",
            "@size": "30001",
            "@ref": "gr17",
            "@mimetype": "image/jpeg"
          },
          {
            "@category": "standard",
            "@height": "236",
            "@width": "470",
            "@_fa": "true",
            "$": "https://api.elsevier.com/content/object/eid/1-s2.0-S0926860X20302325-gr9.jpg?httpAccept=%2A%2F%2A",
            "@multimediatype": "JPEG image file",
            "@type": "IMAGE-DOWNSAMPLED",
            "@size": "33130",
            "@ref": "gr9",
            "@mimetype": "image/jpeg"
          },
          {
            "@category": "standard",
            "@height": "189",
            "@width": "376",
            "@_fa": "true",
            "$": "https://api.elsevier.com/content/object/eid/1-s2.0-S0926860X20302325-gr18.jpg?httpAccept=%2A%2F%2A",
            "@multimediatype": "JPEG image file",
            "@type": "IMAGE-DOWNSAMPLED",
            "@size": "37027",
            "@ref": "gr18",
            "@mimetype": "image/jpeg"
          },
          {
            "@category": "standard",
            "@height": "213",
            "@width": "659",
            "@_fa": "true",
            "$": "https://api.elsevier.com/content/object/eid/1-s2.0-S0926860X20302325-gr15.jpg?httpAccept=%2A%2F%2A",
            "@multimediatype": "JPEG image file",
            "@type": "IMAGE-DOWNSAMPLED",
            "@size": "34687",
            "@ref": "gr15",
            "@mimetype": "image/jpeg"
          },
          {
            "@category": "standard",
            "@height": "235",
            "@width": "659",
            "@_fa": "true",
            "$": "https://api.elsevier.com/content/object/eid/1-s2.0-S0926860X20302325-gr16.jpg?httpAccept=%2A%2F%2A",
            "@multimediatype": "JPEG image file",
            "@type": "IMAGE-DOWNSAMPLED",
            "@size": "43457",
            "@ref": "gr16",
            "@mimetype": "image/jpeg"
          },
          {
            "@category": "standard",
            "@height": "243",
            "@width": "659",
            "@_fa": "true",
            "$": "https://api.elsevier.com/content/object/eid/1-s2.0-S0926860X20302325-gr13.jpg?httpAccept=%2A%2F%2A",
            "@multimediatype": "JPEG image file",
            "@type": "IMAGE-DOWNSAMPLED",
            "@size": "44797",
            "@ref": "gr13",
            "@mimetype": "image/jpeg"
          },
          {
            "@category": "standard",
            "@height": "183",
            "@width": "659",
            "@_fa": "true",
            "$": "https://api.elsevier.com/content/object/eid/1-s2.0-S0926860X20302325-gr14.jpg?httpAccept=%2A%2F%2A",
            "@multimediatype": "JPEG image file",
            "@type": "IMAGE-DOWNSAMPLED",
            "@size": "30965",
            "@ref": "gr14",
            "@mimetype": "image/jpeg"
          },
          {
            "@category": "standard",
            "@height": "189",
            "@width": "659",
            "@_fa": "true",
            "$": "https://api.elsevier.com/content/object/eid/1-s2.0-S0926860X20302325-gr11.jpg?httpAccept=%2A%2F%2A",
            "@multimediatype": "JPEG image file",
            "@type": "IMAGE-DOWNSAMPLED",
            "@size": "27885",
            "@ref": "gr11",
            "@mimetype": "image/jpeg"
          },
          {
            "@category": "standard",
            "@height": "251",
            "@width": "659",
            "@_fa": "true",
            "$": "https://api.elsevier.com/content/object/eid/1-s2.0-S0926860X20302325-gr12.jpg?httpAccept=%2A%2F%2A",
            "@multimediatype": "JPEG image file",
            "@type": "IMAGE-DOWNSAMPLED",
            "@size": "37921",
            "@ref": "gr12",
            "@mimetype": "image/jpeg"
          },
          {
            "@category": "standard",
            "@height": "237",
            "@width": "470",
            "@_fa": "true",
            "$": "https://api.elsevier.com/content/object/eid/1-s2.0-S0926860X20302325-gr20.jpg?httpAccept=%2A%2F%2A",
            "@multimediatype": "JPEG image file",
            "@type": "IMAGE-DOWNSAMPLED",
            "@size": "39516",
            "@ref": "gr20",
            "@mimetype": "image/jpeg"
          },
          {
            "@category": "standard",
            "@height": "200",
            "@width": "339",
            "@_fa": "true",
            "$": "https://api.elsevier.com/content/object/eid/1-s2.0-S0926860X20302325-gr10.jpg?httpAccept=%2A%2F%2A",
            "@multimediatype": "JPEG image file",
            "@type": "IMAGE-DOWNSAMPLED",
            "@size": "13757",
            "@ref": "gr10",
            "@mimetype": "image/jpeg"
          },
          {
            "@category": "standard",
            "@height": "206",
            "@width": "339",
            "@_fa": "true",
            "$": "https://api.elsevier.com/content/object/eid/1-s2.0-S0926860X20302325-gr21.jpg?httpAccept=%2A%2F%2A",
            "@multimediatype": "JPEG image file",
            "@type": "IMAGE-DOWNSAMPLED",
            "@size": "12979",
            "@ref": "gr21",
            "@mimetype": "image/jpeg"
          },
          {
            "@category": "standard",
            "@height": "200",
            "@width": "496",
            "@_fa": "true",
            "$": "https://api.elsevier.com/content/object/eid/1-s2.0-S0926860X20302325-ga1.jpg?httpAccept=%2A%2F%2A",
            "@multimediatype": "JPEG image file",
            "@type": "IMAGE-DOWNSAMPLED",
            "@size": "36533",
            "@ref": "ga1",
            "@mimetype": "image/jpeg"
          },
          {
            "@category": "thumbnail",
            "@height": "164",
            "@width": "219",
            "@_fa": "true",
            "$": "https://api.elsevier.com/content/object/eid/1-s2.0-S0926860X20302325-gr1.sml?httpAccept=%2A%2F%2A",
            "@multimediatype": "GIF image file",
            "@type": "IMAGE-THUMBNAIL",
            "@size": "19999",
            "@ref": "gr1",
            "@mimetype": "image/gif"
          },
          {
            "@category": "thumbnail",
            "@height": "84",
            "@width": "219",
            "@_fa": "true",
            "$": "https://api.elsevier.com/content/object/eid/1-s2.0-S0926860X20302325-gr2.sml?httpAccept=%2A%2F%2A",
            "@multimediatype": "GIF image file",
            "@type": "IMAGE-THUMBNAIL",
            "@size": "13423",
            "@ref": "gr2",
            "@mimetype": "image/gif"
          },
          {
            "@category": "thumbnail",
            "@height": "99",
            "@width": "219",
            "@_fa": "true",
            "$": "https://api.elsevier.com/content/object/eid/1-s2.0-S0926860X20302325-gr3.sml?httpAccept=%2A%2F%2A",
            "@multimediatype": "GIF image file",
            "@type": "IMAGE-THUMBNAIL",
            "@size": "12911",
            "@ref": "gr3",
            "@mimetype": "image/gif"
          },
          {
            "@category": "thumbnail",
            "@height": "81",
            "@width": "219",
            "@_fa": "true",
            "$": "https://api.elsevier.com/content/object/eid/1-s2.0-S0926860X20302325-gr4.sml?httpAccept=%2A%2F%2A",
            "@multimediatype": "GIF image file",
            "@type": "IMAGE-THUMBNAIL",
            "@size": "13995",
            "@ref": "gr4",
            "@mimetype": "image/gif"
          },
          {
            "@category": "thumbnail",
            "@height": "67",
            "@width": "219",
            "@_fa": "true",
            "$": "https://api.elsevier.com/content/object/eid/1-s2.0-S0926860X20302325-gr5.sml?httpAccept=%2A%2F%2A",
            "@multimediatype": "GIF image file",
            "@type": "IMAGE-THUMBNAIL",
            "@size": "9877",
            "@ref": "gr5",
            "@mimetype": "image/gif"
          },
          {
            "@category": "thumbnail",
            "@height": "82",
            "@width": "219",
            "@_fa": "true",
            "$": "https://api.elsevier.com/content/object/eid/1-s2.0-S0926860X20302325-gr6.sml?httpAccept=%2A%2F%2A",
            "@multimediatype": "GIF image file",
            "@type": "IMAGE-THUMBNAIL",
            "@size": "15285",
            "@ref": "gr6",
            "@mimetype": "image/gif"
          },
          {
            "@category": "thumbnail",
            "@height": "112",
            "@width": "219",
            "@_fa": "true",
            "$": "https://api.elsevier.com/content/object/eid/1-s2.0-S0926860X20302325-gr19.sml?httpAccept=%2A%2F%2A",
            "@multimediatype": "GIF image file",
            "@type": "IMAGE-THUMBNAIL",
            "@size": "14873",
            "@ref": "gr19",
            "@mimetype": "image/gif"
          },
          {
            "@category": "thumbnail",
            "@height": "82",
            "@width": "219",
            "@_fa": "true",
            "$": "https://api.elsevier.com/content/object/eid/1-s2.0-S0926860X20302325-gr7.sml?httpAccept=%2A%2F%2A",
            "@multimediatype": "GIF image file",
            "@type": "IMAGE-THUMBNAIL",
            "@size": "12400",
            "@ref": "gr7",
            "@mimetype": "image/gif"
          },
          {
            "@category": "thumbnail",
            "@height": "110",
            "@width": "219",
            "@_fa": "true",
            "$": "https://api.elsevier.com/content/object/eid/1-s2.0-S0926860X20302325-gr8.sml?httpAccept=%2A%2F%2A",
            "@multimediatype": "GIF image file",
            "@type": "IMAGE-THUMBNAIL",
            "@size": "13929",
            "@ref": "gr8",
            "@mimetype": "image/gif"
          },
          {
            "@category": "thumbnail",
            "@height": "110",
            "@width": "219",
            "@_fa": "true",
            "$": "https://api.elsevier.com/content/object/eid/1-s2.0-S0926860X20302325-gr17.sml?httpAccept=%2A%2F%2A",
            "@multimediatype": "GIF image file",
            "@type": "IMAGE-THUMBNAIL",
            "@size": "18834",
            "@ref": "gr17",
            "@mimetype": "image/gif"
          },
          {
            "@category": "thumbnail",
            "@height": "110",
            "@width": "219",
            "@_fa": "true",
            "$": "https://api.elsevier.com/content/object/eid/1-s2.0-S0926860X20302325-gr9.sml?httpAccept=%2A%2F%2A",
            "@multimediatype": "GIF image file",
            "@type": "IMAGE-THUMBNAIL",
            "@size": "13883",
            "@ref": "gr9",
            "@mimetype": "image/gif"
          },
          {
            "@category": "thumbnail",
            "@height": "110",
            "@width": "219",
            "@_fa": "true",
            "$": "https://api.elsevier.com/content/object/eid/1-s2.0-S0926860X20302325-gr18.sml?httpAccept=%2A%2F%2A",
            "@multimediatype": "GIF image file",
            "@type": "IMAGE-THUMBNAIL",
            "@size": "21020",
            "@ref": "gr18",
            "@mimetype": "image/gif"
          },
          {
            "@category": "thumbnail",
            "@height": "71",
            "@width": "219",
            "@_fa": "true",
            "$": "https://api.elsevier.com/content/object/eid/1-s2.0-S0926860X20302325-gr15.sml?httpAccept=%2A%2F%2A",
            "@multimediatype": "GIF image file",
            "@type": "IMAGE-THUMBNAIL",
            "@size": "6327",
            "@ref": "gr15",
            "@mimetype": "image/gif"
          },
          {
            "@category": "thumbnail",
            "@height": "78",
            "@width": "219",
            "@_fa": "true",
            "$": "https://api.elsevier.com/content/object/eid/1-s2.0-S0926860X20302325-gr16.sml?httpAccept=%2A%2F%2A",
            "@multimediatype": "GIF image file",
            "@type": "IMAGE-THUMBNAIL",
            "@size": "7939",
            "@ref": "gr16",
            "@mimetype": "image/gif"
          },
          {
            "@category": "thumbnail",
            "@height": "81",
            "@width": "219",
            "@_fa": "true",
            "$": "https://api.elsevier.com/content/object/eid/1-s2.0-S0926860X20302325-gr13.sml?httpAccept=%2A%2F%2A",
            "@multimediatype": "GIF image file",
            "@type": "IMAGE-THUMBNAIL",
            "@size": "7545",
            "@ref": "gr13",
            "@mimetype": "image/gif"
          },
          {
            "@category": "thumbnail",
            "@height": "61",
            "@width": "219",
            "@_fa": "true",
            "$": "https://api.elsevier.com/content/object/eid/1-s2.0-S0926860X20302325-gr14.sml?httpAccept=%2A%2F%2A",
            "@multimediatype": "GIF image file",
            "@type": "IMAGE-THUMBNAIL",
            "@size": "6254",
            "@ref": "gr14",
            "@mimetype": "image/gif"
          },
          {
            "@category": "thumbnail",
            "@height": "63",
            "@width": "219",
            "@_fa": "true",
            "$": "https://api.elsevier.com/content/object/eid/1-s2.0-S0926860X20302325-gr11.sml?httpAccept=%2A%2F%2A",
            "@multimediatype": "GIF image file",
            "@type": "IMAGE-THUMBNAIL",
            "@size": "5606",
            "@ref": "gr11",
            "@mimetype": "image/gif"
          },
          {
            "@category": "thumbnail",
            "@height": "83",
            "@width": "219",
            "@_fa": "true",
            "$": "https://api.elsevier.com/content/object/eid/1-s2.0-S0926860X20302325-gr12.sml?httpAccept=%2A%2F%2A",
            "@multimediatype": "GIF image file",
            "@type": "IMAGE-THUMBNAIL",
            "@size": "7295",
            "@ref": "gr12",
            "@mimetype": "image/gif"
          },
          {
            "@category": "thumbnail",
            "@height": "110",
            "@width": "219",
            "@_fa": "true",
            "$": "https://api.elsevier.com/content/object/eid/1-s2.0-S0926860X20302325-gr20.sml?httpAccept=%2A%2F%2A",
            "@multimediatype": "GIF image file",
            "@type": "IMAGE-THUMBNAIL",
            "@size": "14755",
            "@ref": "gr20",
            "@mimetype": "image/gif"
          },
          {
            "@category": "thumbnail",
            "@height": "130",
            "@width": "219",
            "@_fa": "true",
            "$": "https://api.elsevier.com/content/object/eid/1-s2.0-S0926860X20302325-gr10.sml?httpAccept=%2A%2F%2A",
            "@multimediatype": "GIF image file",
            "@type": "IMAGE-THUMBNAIL",
            "@size": "6591",
            "@ref": "gr10",
            "@mimetype": "image/gif"
          },
          {
            "@category": "thumbnail",
            "@height": "133",
            "@width": "219",
            "@_fa": "true",
            "$": "https://api.elsevier.com/content/object/eid/1-s2.0-S0926860X20302325-gr21.sml?httpAccept=%2A%2F%2A",
            "@multimediatype": "GIF image file",
            "@type": "IMAGE-THUMBNAIL",
            "@size": "6795",
            "@ref": "gr21",
            "@mimetype": "image/gif"
          },
          {
            "@category": "thumbnail",
            "@height": "88",
            "@width": "219",
            "@_fa": "true",
            "$": "https://api.elsevier.com/content/object/eid/1-s2.0-S0926860X20302325-ga1.sml?httpAccept=%2A%2F%2A",
            "@multimediatype": "GIF image file",
            "@type": "IMAGE-THUMBNAIL",
            "@size": "11396",
            "@ref": "ga1",
            "@mimetype": "image/gif"
          },
          {
            "@category": "high",
            "@height": "997",
            "@width": "1333",
            "@_fa": "true",
            "$": "https://api.elsevier.com/content/object/eid/1-s2.0-S0926860X20302325-gr1_lrg.jpg?httpAccept=%2A%2F%2A",
            "@multimediatype": "JPEG image file",
            "@type": "IMAGE-HIGH-RES",
            "@size": "333923",
            "@ref": "gr1",
            "@mimetype": "image/jpeg"
          },
          {
            "@category": "high",
            "@height": "962",
            "@width": "2500",
            "@_fa": "true",
            "$": "https://api.elsevier.com/content/object/eid/1-s2.0-S0926860X20302325-gr2_lrg.jpg?httpAccept=%2A%2F%2A",
            "@multimediatype": "JPEG image file",
            "@type": "IMAGE-HIGH-RES",
            "@size": "652912",
            "@ref": "gr2",
            "@mimetype": "image/jpeg"
          },
          {
            "@category": "high",
            "@height": "1134",
            "@width": "2500",
            "@_fa": "true",
            "$": "https://api.elsevier.com/content/object/eid/1-s2.0-S0926860X20302325-gr3_lrg.jpg?httpAccept=%2A%2F%2A",
            "@multimediatype": "JPEG image file",
            "@type": "IMAGE-HIGH-RES",
            "@size": "735391",
            "@ref": "gr3",
            "@mimetype": "image/jpeg"
          },
          {
            "@category": "high",
            "@height": "920",
            "@width": "2500",
            "@_fa": "true",
            "$": "https://api.elsevier.com/content/object/eid/1-s2.0-S0926860X20302325-gr4_lrg.jpg?httpAccept=%2A%2F%2A",
            "@multimediatype": "JPEG image file",
            "@type": "IMAGE-HIGH-RES",
            "@size": "540887",
            "@ref": "gr4",
            "@mimetype": "image/jpeg"
          },
          {
            "@category": "high",
            "@height": "768",
            "@width": "2500",
            "@_fa": "true",
            "$": "https://api.elsevier.com/content/object/eid/1-s2.0-S0926860X20302325-gr5_lrg.jpg?httpAccept=%2A%2F%2A",
            "@multimediatype": "JPEG image file",
            "@type": "IMAGE-HIGH-RES",
            "@size": "557920",
            "@ref": "gr5",
            "@mimetype": "image/jpeg"
          },
          {
            "@category": "high",
            "@height": "939",
            "@width": "2500",
            "@_fa": "true",
            "$": "https://api.elsevier.com/content/object/eid/1-s2.0-S0926860X20302325-gr6_lrg.jpg?httpAccept=%2A%2F%2A",
            "@multimediatype": "JPEG image file",
            "@type": "IMAGE-HIGH-RES",
            "@size": "785732",
            "@ref": "gr6",
            "@mimetype": "image/jpeg"
          },
          {
            "@category": "high",
            "@height": "1064",
            "@width": "2083",
            "@_fa": "true",
            "$": "https://api.elsevier.com/content/object/eid/1-s2.0-S0926860X20302325-gr19_lrg.jpg?httpAccept=%2A%2F%2A",
            "@multimediatype": "JPEG image file",
            "@type": "IMAGE-HIGH-RES",
            "@size": "636842",
            "@ref": "gr19",
            "@mimetype": "image/jpeg"
          },
          {
            "@category": "high",
            "@height": "938",
            "@width": "2500",
            "@_fa": "true",
            "$": "https://api.elsevier.com/content/object/eid/1-s2.0-S0926860X20302325-gr7_lrg.jpg?httpAccept=%2A%2F%2A",
            "@multimediatype": "JPEG image file",
            "@type": "IMAGE-HIGH-RES",
            "@size": "585268",
            "@ref": "gr7",
            "@mimetype": "image/jpeg"
          },
          {
            "@category": "high",
            "@height": "1047",
            "@width": "2083",
            "@_fa": "true",
            "$": "https://api.elsevier.com/content/object/eid/1-s2.0-S0926860X20302325-gr8_lrg.jpg?httpAccept=%2A%2F%2A",
            "@multimediatype": "JPEG image file",
            "@type": "IMAGE-HIGH-RES",
            "@size": "612899",
            "@ref": "gr8",
            "@mimetype": "image/jpeg"
          },
          {
            "@category": "high",
            "@height": "841",
            "@width": "1667",
            "@_fa": "true",
            "$": "https://api.elsevier.com/content/object/eid/1-s2.0-S0926860X20302325-gr17_lrg.jpg?httpAccept=%2A%2F%2A",
            "@multimediatype": "JPEG image file",
            "@type": "IMAGE-HIGH-RES",
            "@size": "437456",
            "@ref": "gr17",
            "@mimetype": "image/jpeg"
          },
          {
            "@category": "high",
            "@height": "1047",
            "@width": "2083",
            "@_fa": "true",
            "$": "https://api.elsevier.com/content/object/eid/1-s2.0-S0926860X20302325-gr9_lrg.jpg?httpAccept=%2A%2F%2A",
            "@multimediatype": "JPEG image file",
            "@type": "IMAGE-HIGH-RES",
            "@size": "707803",
            "@ref": "gr9",
            "@mimetype": "image/jpeg"
          },
          {
            "@category": "high",
            "@height": "838",
            "@width": "1667",
            "@_fa": "true",
            "$": "https://api.elsevier.com/content/object/eid/1-s2.0-S0926860X20302325-gr18_lrg.jpg?httpAccept=%2A%2F%2A",
            "@multimediatype": "JPEG image file",
            "@type": "IMAGE-HIGH-RES",
            "@size": "497695",
            "@ref": "gr18",
            "@mimetype": "image/jpeg"
          },
          {
            "@category": "high",
            "@height": "943",
            "@width": "2917",
            "@_fa": "true",
            "$": "https://api.elsevier.com/content/object/eid/1-s2.0-S0926860X20302325-gr15_lrg.jpg?httpAccept=%2A%2F%2A",
            "@multimediatype": "JPEG image file",
            "@type": "IMAGE-HIGH-RES",
            "@size": "318270",
            "@ref": "gr15",
            "@mimetype": "image/jpeg"
          },
          {
            "@category": "high",
            "@height": "1038",
            "@width": "2917",
            "@_fa": "true",
            "$": "https://api.elsevier.com/content/object/eid/1-s2.0-S0926860X20302325-gr16_lrg.jpg?httpAccept=%2A%2F%2A",
            "@multimediatype": "JPEG image file",
            "@type": "IMAGE-HIGH-RES",
            "@size": "410437",
            "@ref": "gr16",
            "@mimetype": "image/jpeg"
          },
          {
            "@category": "high",
            "@height": "1076",
            "@width": "2917",
            "@_fa": "true",
            "$": "https://api.elsevier.com/content/object/eid/1-s2.0-S0926860X20302325-gr13_lrg.jpg?httpAccept=%2A%2F%2A",
            "@multimediatype": "JPEG image file",
            "@type": "IMAGE-HIGH-RES",
            "@size": "423132",
            "@ref": "gr13",
            "@mimetype": "image/jpeg"
          },
          {
            "@category": "high",
            "@height": "810",
            "@width": "2917",
            "@_fa": "true",
            "$": "https://api.elsevier.com/content/object/eid/1-s2.0-S0926860X20302325-gr14_lrg.jpg?httpAccept=%2A%2F%2A",
            "@multimediatype": "JPEG image file",
            "@type": "IMAGE-HIGH-RES",
            "@size": "308750",
            "@ref": "gr14",
            "@mimetype": "image/jpeg"
          },
          {
            "@category": "high",
            "@height": "838",
            "@width": "2917",
            "@_fa": "true",
            "$": "https://api.elsevier.com/content/object/eid/1-s2.0-S0926860X20302325-gr11_lrg.jpg?httpAccept=%2A%2F%2A",
            "@multimediatype": "JPEG image file",
            "@type": "IMAGE-HIGH-RES",
            "@size": "280379",
            "@ref": "gr11",
            "@mimetype": "image/jpeg"
          },
          {
            "@category": "high",
            "@height": "1111",
            "@width": "2917",
            "@_fa": "true",
            "$": "https://api.elsevier.com/content/object/eid/1-s2.0-S0926860X20302325-gr12_lrg.jpg?httpAccept=%2A%2F%2A",
            "@multimediatype": "JPEG image file",
            "@type": "IMAGE-HIGH-RES",
            "@size": "368382",
            "@ref": "gr12",
            "@mimetype": "image/jpeg"
          },
          {
            "@category": "high",
            "@height": "1051",
            "@width": "2083",
            "@_fa": "true",
            "$": "https://api.elsevier.com/content/object/eid/1-s2.0-S0926860X20302325-gr20_lrg.jpg?httpAccept=%2A%2F%2A",
            "@multimediatype": "JPEG image file",
            "@type": "IMAGE-HIGH-RES",
            "@size": "733805",
            "@ref": "gr20",
            "@mimetype": "image/jpeg"
          },
          {
            "@category": "high",
            "@height": "887",
            "@width": "1500",
            "@_fa": "true",
            "$": "https://api.elsevier.com/content/object/eid/1-s2.0-S0926860X20302325-gr10_lrg.jpg?httpAccept=%2A%2F%2A",
            "@multimediatype": "JPEG image file",
            "@type": "IMAGE-HIGH-RES",
            "@size": "106250",
            "@ref": "gr10",
            "@mimetype": "image/jpeg"
          },
          {
            "@category": "high",
            "@height": "910",
            "@width": "1500",
            "@_fa": "true",
            "$": "https://api.elsevier.com/content/object/eid/1-s2.0-S0926860X20302325-gr21_lrg.jpg?httpAccept=%2A%2F%2A",
            "@multimediatype": "JPEG image file",
            "@type": "IMAGE-HIGH-RES",
            "@size": "109719",
            "@ref": "gr21",
            "@mimetype": "image/jpeg"
          },
          {
            "@category": "high",
            "@height": "886",
            "@width": "2197",
            "@_fa": "true",
            "$": "https://api.elsevier.com/content/object/eid/1-s2.0-S0926860X20302325-ga1_lrg.jpg?httpAccept=%2A%2F%2A",
            "@multimediatype": "JPEG image file",
            "@type": "IMAGE-HIGH-RES",
            "@size": "484621",
            "@ref": "ga1",
            "@mimetype": "image/jpeg"
          },
          {
            "@category": "standard",
            "@_fa": "true",
            "$": "https://api.elsevier.com/content/object/eid/1-s2.0-S0926860X20302325-am.pdf?httpAccept=%2A%2F%2A",
            "@multimediatype": "Acrobat PDF file",
            "@type": "AAM-PDF",
            "@size": "3508394",
            "@ref": "am",
            "@mimetype": "application/pdf"
          }
        ]
      },
      "link": {
        "@rel": "abstract",
        "@href": "https://api.elsevier.com/content/abstract/scopus_id/85085564018"
      }
    }
  }
}