{
  "metadata": {
    "title": "Efficient hydrodesulfurization catalysts based on Keggin polyoxometalates",
    "authors": "; ; ",
    "journal": "Applied Catalysis A: General",
    "date": "2015-11-30",
    "doi": "10.1016/j.apcata.2015.10.001",
    "abstract": "",
    "uri": "https://api.elsevier.com/content/article/pii/S0926860X15301782",
    "pii": "S0926860X15301782"
  },
  "fulltext": {
    "full-text-retrieval-response": {
      "scopus-eid": "2-s2.0-84944717398",
      "originalText": "serial JL 271346 291210 291744 291809 31 Applied Catalysis A: General APPLIEDCATALYSISAGENERAL 2015-10-14 2015-10-14 2015-11-11 2015-11-11 2016-04-30T09:04:01 1-s2.0-S0926860X15301782 S0926-860X(15)30178-2 S0926860X15301782 10.1016/j.apcata.2015.10.001 S300 S300.2 FULL-TEXT 1-s2.0-S0926860X15X00172 2024-01-01T12:30:29.635264Z 0 0 20151101 20151130 2015 2015-10-14T15:46:11.840607Z absattachment articleinfo articletitlenorm authfirstinitialnorm authfirstsurnamenorm cid cids contenttype copyright crossmark dateloaded dateloadedtxt datesearch datesort dateupdated dco docsubtype doctype doi eid ewtransactionid hubeid indexeddate issn issnnorm itemstage itemtransactionid itemweight openaccess openarchive pg pgfirst pglast pii piinorm pubdateend pubdatestart pubdatetxt pubyr sectiontitle sortorder srctitle srctitlenorm srctype ssids alllist content subj subheadings suppl tomb volfirst volissue volumelist webpdf webpdfpagecount yearnav figure table e-component body acknowledge affil appendices articletitle auth authfirstini authfull authkeywords authlast grantsponsor highlightsabst primabst ref specialabst 0926-860X 0926860X true 508 508 C Volume 508 5 16 24 16 24 201511 November 2015 2015-11-01 2015-11-30 2015 Articles article fla Copyright © 2015 Elsevier B.V. All rights reserved. EFFICIENTHYDRODESULFURIZATIONCATALYSTSBASEDKEGGINPOLYOXOMETALATES NORTH J 1 Introduction 2 Materials and methods 2.1 Chemicals and materials 2.2 Preparation of HDS pre-catalysts 2.3 Techniques 2.4 Catalyst testing 3 Results and discussion 3.1 Pre-catalyst characterization 3.2 Catalyst performance in HDS of thiophene 3.2.1 Bulk catalysts 3.2.2 Supported catalysts 4 Conclusions Acknowledgements Appendix A Supplementary data References BABICH 2003 607 631 I PRINS 2008 2695 2718 R HANDBOOKHETEROGENEOUSCATALYSIS CARNELL 1989 204 208 P CATALYSTHANDBOOK OKAMOTO 2008 9 17 Y RINALDI 2009 130 136 N NIQUILLEROTHLISBERGER 2007 198 207 A LEWANDOWSKI 2007 31 34 M NAGAI 2007 178 190 M KANDA 2014 410 419 Y PRINS 2012 1413 1436 R DAMYANOVA 1989 177 186 S MAITRA 1989 187 197 A GRIBOVAL 1999 102 110 A CABELLO 2000 79 86 C SHAFI 2000 251 256 R GRIBOVAL 2001 173 183 A KRALEVA 2006 203 212 E PALCHEVA 2010 216 223 R BENTAYEB 2012 55 63 K NIKULSHIN 2012 620 631 P MENDEZ 2013 249 258 F PAWELEC 2001 295 307 B ALSALME 2016 102 108 A POPE 1983 M HETEROPOLYISOPOLYOXOMETALATES OKUHARA 1996 113 252 T KOZHEVNIKOV 1998 171 198 I KOZHEVNIKOV 2002 I CATALYSISBYPOLYOXOMETALATES STULL 1947 517 550 D YUVARAJ 2003 1044 1047 S ROCCHICCIOLIDELTCHEFF 1983 207 216 C KNOZINGER 2008 1154 H HANDBOOKHETEROGENEOUSCATALYSIS ALSALME 2010 181 189 A HAPPEL 1971 206 209 J NORTHX2015X16 NORTHX2015X16X24 NORTHX2015X16XJ NORTHX2015X16X24XJ 2017-11-11T00:00:00Z UnderEmbargo http://creativecommons.org/licenses/by-nc-nd/4.0/ item S0926-860X(15)30178-2 S0926860X15301782 1-s2.0-S0926860X15301782 10.1016/j.apcata.2015.10.001 271346 2024-01-01T12:30:29.635264Z 2015-11-01 2015-11-30 1-s2.0-S0926860X15301782-main.pdf https://s3-eu-west-1.amazonaws.com/prod-ucs-content-store-eu-west/content/pii:S0926860X15301782/MAIN/application/pdf/0dcde40c2212802554ea678509344542/main.pdf https://s3.amazonaws.com/prod-ucs-content-store-us-east/content/pii:S0926860X15301782/MAIN/application/pdf/0dcde40c2212802554ea678509344542/main.pdf main.pdf pdf true 5415861 MAIN 9 1-s2.0-S0926860X15301782-main_1.png https://s3-eu-west-1.amazonaws.com/prod-ucs-content-store-eu-west/content/pii:S0926860X15301782/PREVIEW/image/png/1e80753ca73e1b49eecb7526bf9c5400/main_1.png https://s3.amazonaws.com/prod-ucs-content-store-us-east/content/pii:S0926860X15301782/PREVIEW/image/png/1e80753ca73e1b49eecb7526bf9c5400/main_1.png main_1.png png 55526 849 656 IMAGE-WEB-PDF 1 1-s2.0-S0926860X15301782-fx1.sml https://s3-eu-west-1.amazonaws.com/prod-ucs-content-store-eu-west/content/pii:S0926860X15301782/fx1/THUMBNAIL/image/gif/71fff95d79be61f59e3538c674aee73f/fx1.sml https://s3.amazonaws.com/prod-ucs-content-store-us-east/content/pii:S0926860X15301782/fx1/THUMBNAIL/image/gif/71fff95d79be61f59e3538c674aee73f/fx1.sml fx1 true fx1.sml sml 3004 88 219 IMAGE-THUMBNAIL 1-s2.0-S0926860X15301782-fx2.sml https://s3-eu-west-1.amazonaws.com/prod-ucs-content-store-eu-west/content/pii:S0926860X15301782/fx2/THUMBNAIL/image/gif/3bceaa4ce7d55ff93377b52a1e1a7012/fx2.sml https://s3.amazonaws.com/prod-ucs-content-store-us-east/content/pii:S0926860X15301782/fx2/THUMBNAIL/image/gif/3bceaa4ce7d55ff93377b52a1e1a7012/fx2.sml fx2 fx2.sml sml 2283 88 219 IMAGE-THUMBNAIL 1-s2.0-S0926860X15301782-gr1.sml https://s3-eu-west-1.amazonaws.com/prod-ucs-content-store-eu-west/content/pii:S0926860X15301782/gr1/THUMBNAIL/image/gif/9958cc40338b627c132a593be36bab8d/gr1.sml https://s3.amazonaws.com/prod-ucs-content-store-us-east/content/pii:S0926860X15301782/gr1/THUMBNAIL/image/gif/9958cc40338b627c132a593be36bab8d/gr1.sml gr1 gr1.sml sml 14450 137 219 IMAGE-THUMBNAIL 1-s2.0-S0926860X15301782-gr10.sml https://s3-eu-west-1.amazonaws.com/prod-ucs-content-store-eu-west/content/pii:S0926860X15301782/gr10/THUMBNAIL/image/gif/eecd0f48b21f4069d0a589162054e607/gr10.sml https://s3.amazonaws.com/prod-ucs-content-store-us-east/content/pii:S0926860X15301782/gr10/THUMBNAIL/image/gif/eecd0f48b21f4069d0a589162054e607/gr10.sml gr10 gr10.sml sml 16235 134 219 IMAGE-THUMBNAIL 1-s2.0-S0926860X15301782-gr2.sml https://s3-eu-west-1.amazonaws.com/prod-ucs-content-store-eu-west/content/pii:S0926860X15301782/gr2/THUMBNAIL/image/gif/54fc0c78ba9a2b684c1ab9726d33d813/gr2.sml https://s3.amazonaws.com/prod-ucs-content-store-us-east/content/pii:S0926860X15301782/gr2/THUMBNAIL/image/gif/54fc0c78ba9a2b684c1ab9726d33d813/gr2.sml gr2 gr2.sml sml 18106 139 219 IMAGE-THUMBNAIL 1-s2.0-S0926860X15301782-gr3.sml https://s3-eu-west-1.amazonaws.com/prod-ucs-content-store-eu-west/content/pii:S0926860X15301782/gr3/THUMBNAIL/image/gif/ac25ed38b53f606d46e097b62d08fc2b/gr3.sml https://s3.amazonaws.com/prod-ucs-content-store-us-east/content/pii:S0926860X15301782/gr3/THUMBNAIL/image/gif/ac25ed38b53f606d46e097b62d08fc2b/gr3.sml gr3 gr3.sml sml 11760 150 219 IMAGE-THUMBNAIL 1-s2.0-S0926860X15301782-gr4.sml https://s3-eu-west-1.amazonaws.com/prod-ucs-content-store-eu-west/content/pii:S0926860X15301782/gr4/THUMBNAIL/image/gif/79762f8ececf0fdb413c938c4fd1c516/gr4.sml https://s3.amazonaws.com/prod-ucs-content-store-us-east/content/pii:S0926860X15301782/gr4/THUMBNAIL/image/gif/79762f8ececf0fdb413c938c4fd1c516/gr4.sml gr4 gr4.sml sml 15072 127 219 IMAGE-THUMBNAIL 1-s2.0-S0926860X15301782-gr5.sml https://s3-eu-west-1.amazonaws.com/prod-ucs-content-store-eu-west/content/pii:S0926860X15301782/gr5/THUMBNAIL/image/gif/8a4f94178128f32708963f17680f9a93/gr5.sml https://s3.amazonaws.com/prod-ucs-content-store-us-east/content/pii:S0926860X15301782/gr5/THUMBNAIL/image/gif/8a4f94178128f32708963f17680f9a93/gr5.sml gr5 gr5.sml sml 11367 141 219 IMAGE-THUMBNAIL 1-s2.0-S0926860X15301782-gr6.sml https://s3-eu-west-1.amazonaws.com/prod-ucs-content-store-eu-west/content/pii:S0926860X15301782/gr6/THUMBNAIL/image/gif/2b171e1991f32dbc98a6a12d90983987/gr6.sml https://s3.amazonaws.com/prod-ucs-content-store-us-east/content/pii:S0926860X15301782/gr6/THUMBNAIL/image/gif/2b171e1991f32dbc98a6a12d90983987/gr6.sml gr6 gr6.sml sml 12761 151 219 IMAGE-THUMBNAIL 1-s2.0-S0926860X15301782-gr7.sml https://s3-eu-west-1.amazonaws.com/prod-ucs-content-store-eu-west/content/pii:S0926860X15301782/gr7/THUMBNAIL/image/gif/7aedd1fbff01a41cebb0a2041a5de74c/gr7.sml https://s3.amazonaws.com/prod-ucs-content-store-us-east/content/pii:S0926860X15301782/gr7/THUMBNAIL/image/gif/7aedd1fbff01a41cebb0a2041a5de74c/gr7.sml gr7 gr7.sml sml 9152 141 219 IMAGE-THUMBNAIL 1-s2.0-S0926860X15301782-gr8.sml https://s3-eu-west-1.amazonaws.com/prod-ucs-content-store-eu-west/content/pii:S0926860X15301782/gr8/THUMBNAIL/image/gif/3c548688d70e1c93d4dfdb0b21ba6b7e/gr8.sml https://s3.amazonaws.com/prod-ucs-content-store-us-east/content/pii:S0926860X15301782/gr8/THUMBNAIL/image/gif/3c548688d70e1c93d4dfdb0b21ba6b7e/gr8.sml gr8 gr8.sml sml 13697 127 219 IMAGE-THUMBNAIL 1-s2.0-S0926860X15301782-gr9.sml https://s3-eu-west-1.amazonaws.com/prod-ucs-content-store-eu-west/content/pii:S0926860X15301782/gr9/THUMBNAIL/image/gif/cfd5dfb93dca533237b3e72f64c673c2/gr9.sml https://s3.amazonaws.com/prod-ucs-content-store-us-east/content/pii:S0926860X15301782/gr9/THUMBNAIL/image/gif/cfd5dfb93dca533237b3e72f64c673c2/gr9.sml gr9 gr9.sml sml 13739 158 219 IMAGE-THUMBNAIL 1-s2.0-S0926860X15301782-fx1.jpg https://s3-eu-west-1.amazonaws.com/prod-ucs-content-store-eu-west/content/pii:S0926860X15301782/fx1/DOWNSAMPLED/image/jpeg/5c6b7bfb8bfad30e444b7324502eac4c/fx1.jpg https://s3.amazonaws.com/prod-ucs-content-store-us-east/content/pii:S0926860X15301782/fx1/DOWNSAMPLED/image/jpeg/5c6b7bfb8bfad30e444b7324502eac4c/fx1.jpg fx1 true fx1.jpg jpg 13881 200 500 IMAGE-DOWNSAMPLED 1-s2.0-S0926860X15301782-fx2.jpg https://s3-eu-west-1.amazonaws.com/prod-ucs-content-store-eu-west/content/pii:S0926860X15301782/fx2/DOWNSAMPLED/image/jpeg/7ebe6b64cde4d691bfeda3a74707481b/fx2.jpg https://s3.amazonaws.com/prod-ucs-content-store-us-east/content/pii:S0926860X15301782/fx2/DOWNSAMPLED/image/jpeg/7ebe6b64cde4d691bfeda3a74707481b/fx2.jpg fx2 fx2.jpg jpg 8659 200 500 IMAGE-DOWNSAMPLED 1-s2.0-S0926860X15301782-gr1.jpg https://s3-eu-west-1.amazonaws.com/prod-ucs-content-store-eu-west/content/pii:S0926860X15301782/gr1/DOWNSAMPLED/image/jpeg/785762e074dd724829696f56f52b3676/gr1.jpg https://s3.amazonaws.com/prod-ucs-content-store-us-east/content/pii:S0926860X15301782/gr1/DOWNSAMPLED/image/jpeg/785762e074dd724829696f56f52b3676/gr1.jpg gr1 gr1.jpg jpg 57382 294 470 IMAGE-DOWNSAMPLED 1-s2.0-S0926860X15301782-gr10.jpg https://s3-eu-west-1.amazonaws.com/prod-ucs-content-store-eu-west/content/pii:S0926860X15301782/gr10/DOWNSAMPLED/image/jpeg/aacea5e43afb4d20fb383a60a71eae62/gr10.jpg https://s3.amazonaws.com/prod-ucs-content-store-us-east/content/pii:S0926860X15301782/gr10/DOWNSAMPLED/image/jpeg/aacea5e43afb4d20fb383a60a71eae62/gr10.jpg gr10 gr10.jpg jpg 80921 404 659 IMAGE-DOWNSAMPLED 1-s2.0-S0926860X15301782-gr2.jpg https://s3-eu-west-1.amazonaws.com/prod-ucs-content-store-eu-west/content/pii:S0926860X15301782/gr2/DOWNSAMPLED/image/jpeg/0f065e44415121dc562a121afe3278f7/gr2.jpg https://s3.amazonaws.com/prod-ucs-content-store-us-east/content/pii:S0926860X15301782/gr2/DOWNSAMPLED/image/jpeg/0f065e44415121dc562a121afe3278f7/gr2.jpg gr2 gr2.jpg jpg 68137 298 470 IMAGE-DOWNSAMPLED 1-s2.0-S0926860X15301782-gr3.jpg https://s3-eu-west-1.amazonaws.com/prod-ucs-content-store-eu-west/content/pii:S0926860X15301782/gr3/DOWNSAMPLED/image/jpeg/d722fdf87bbe468a337053912dab8d47/gr3.jpg https://s3.amazonaws.com/prod-ucs-content-store-us-east/content/pii:S0926860X15301782/gr3/DOWNSAMPLED/image/jpeg/d722fdf87bbe468a337053912dab8d47/gr3.jpg gr3 gr3.jpg jpg 38697 322 470 IMAGE-DOWNSAMPLED 1-s2.0-S0926860X15301782-gr4.jpg https://s3-eu-west-1.amazonaws.com/prod-ucs-content-store-eu-west/content/pii:S0926860X15301782/gr4/DOWNSAMPLED/image/jpeg/f3e06a307001b9c5f624ed741b8778e7/gr4.jpg https://s3.amazonaws.com/prod-ucs-content-store-us-east/content/pii:S0926860X15301782/gr4/DOWNSAMPLED/image/jpeg/f3e06a307001b9c5f624ed741b8778e7/gr4.jpg gr4 gr4.jpg jpg 45011 272 470 IMAGE-DOWNSAMPLED 1-s2.0-S0926860X15301782-gr5.jpg https://s3-eu-west-1.amazonaws.com/prod-ucs-content-store-eu-west/content/pii:S0926860X15301782/gr5/DOWNSAMPLED/image/jpeg/7829985e34b7ec310eae5158b67b1954/gr5.jpg https://s3.amazonaws.com/prod-ucs-content-store-us-east/content/pii:S0926860X15301782/gr5/DOWNSAMPLED/image/jpeg/7829985e34b7ec310eae5158b67b1954/gr5.jpg gr5 gr5.jpg jpg 36910 302 470 IMAGE-DOWNSAMPLED 1-s2.0-S0926860X15301782-gr6.jpg https://s3-eu-west-1.amazonaws.com/prod-ucs-content-store-eu-west/content/pii:S0926860X15301782/gr6/DOWNSAMPLED/image/jpeg/0b91d96a33ea9e3b83aa3a5dafa73c84/gr6.jpg https://s3.amazonaws.com/prod-ucs-content-store-us-east/content/pii:S0926860X15301782/gr6/DOWNSAMPLED/image/jpeg/0b91d96a33ea9e3b83aa3a5dafa73c84/gr6.jpg gr6 gr6.jpg jpg 41819 324 470 IMAGE-DOWNSAMPLED 1-s2.0-S0926860X15301782-gr7.jpg https://s3-eu-west-1.amazonaws.com/prod-ucs-content-store-eu-west/content/pii:S0926860X15301782/gr7/DOWNSAMPLED/image/jpeg/debf03d1e90c02a926f35677a30b23b2/gr7.jpg https://s3.amazonaws.com/prod-ucs-content-store-us-east/content/pii:S0926860X15301782/gr7/DOWNSAMPLED/image/jpeg/debf03d1e90c02a926f35677a30b23b2/gr7.jpg gr7 gr7.jpg jpg 39968 302 470 IMAGE-DOWNSAMPLED 1-s2.0-S0926860X15301782-gr8.jpg https://s3-eu-west-1.amazonaws.com/prod-ucs-content-store-eu-west/content/pii:S0926860X15301782/gr8/DOWNSAMPLED/image/jpeg/bc9e4bbcf773ffdf4bf54944f96fcc90/gr8.jpg https://s3.amazonaws.com/prod-ucs-content-store-us-east/content/pii:S0926860X15301782/gr8/DOWNSAMPLED/image/jpeg/bc9e4bbcf773ffdf4bf54944f96fcc90/gr8.jpg gr8 gr8.jpg jpg 80540 383 659 IMAGE-DOWNSAMPLED 1-s2.0-S0926860X15301782-gr9.jpg https://s3-eu-west-1.amazonaws.com/prod-ucs-content-store-eu-west/content/pii:S0926860X15301782/gr9/DOWNSAMPLED/image/jpeg/92a582e2b76d460e76e0f6f1eaecf687/gr9.jpg https://s3.amazonaws.com/prod-ucs-content-store-us-east/content/pii:S0926860X15301782/gr9/DOWNSAMPLED/image/jpeg/92a582e2b76d460e76e0f6f1eaecf687/gr9.jpg gr9 gr9.jpg jpg 79995 474 659 IMAGE-DOWNSAMPLED 1-s2.0-S0926860X15301782-fx1_lrg.jpg https://s3-eu-west-1.amazonaws.com/prod-ucs-content-store-eu-west/content/pii:S0926860X15301782/fx1/HIGHRES/image/jpeg/7d26d174e8a603a58198b2c2e3dc55c9/fx1_lrg.jpg https://s3.amazonaws.com/prod-ucs-content-store-us-east/content/pii:S0926860X15301782/fx1/HIGHRES/image/jpeg/7d26d174e8a603a58198b2c2e3dc55c9/fx1_lrg.jpg fx1 true fx1_lrg.jpg jpg 110190 886 2213 IMAGE-HIGH-RES 1-s2.0-S0926860X15301782-fx2_lrg.jpg https://s3-eu-west-1.amazonaws.com/prod-ucs-content-store-eu-west/content/pii:S0926860X15301782/fx2/HIGHRES/image/jpeg/655c4e16f0bd53fb2e0e8955ae4a1f51/fx2_lrg.jpg https://s3.amazonaws.com/prod-ucs-content-store-us-east/content/pii:S0926860X15301782/fx2/HIGHRES/image/jpeg/655c4e16f0bd53fb2e0e8955ae4a1f51/fx2_lrg.jpg fx2 fx2_lrg.jpg jpg 63668 886 2213 IMAGE-HIGH-RES 1-s2.0-S0926860X15301782-gr1_lrg.jpg https://s3-eu-west-1.amazonaws.com/prod-ucs-content-store-eu-west/content/pii:S0926860X15301782/gr1/HIGHRES/image/jpeg/b68f5b2bc2dbc8d0d8ecb4377f3a858f/gr1_lrg.jpg https://s3.amazonaws.com/prod-ucs-content-store-us-east/content/pii:S0926860X15301782/gr1/HIGHRES/image/jpeg/b68f5b2bc2dbc8d0d8ecb4377f3a858f/gr1_lrg.jpg gr1 gr1_lrg.jpg jpg 380819 1304 2083 IMAGE-HIGH-RES 1-s2.0-S0926860X15301782-gr10_lrg.jpg https://s3-eu-west-1.amazonaws.com/prod-ucs-content-store-eu-west/content/pii:S0926860X15301782/gr10/HIGHRES/image/jpeg/531817176b998a4e20f9cffa6e060f76/gr10_lrg.jpg https://s3.amazonaws.com/prod-ucs-content-store-us-east/content/pii:S0926860X15301782/gr10/HIGHRES/image/jpeg/531817176b998a4e20f9cffa6e060f76/gr10_lrg.jpg gr10 gr10_lrg.jpg jpg 376401 1787 2917 IMAGE-HIGH-RES 1-s2.0-S0926860X15301782-gr2_lrg.jpg https://s3-eu-west-1.amazonaws.com/prod-ucs-content-store-eu-west/content/pii:S0926860X15301782/gr2/HIGHRES/image/jpeg/84ac362840f87f930e0c8eb47823aea7/gr2_lrg.jpg https://s3.amazonaws.com/prod-ucs-content-store-us-east/content/pii:S0926860X15301782/gr2/HIGHRES/image/jpeg/84ac362840f87f930e0c8eb47823aea7/gr2_lrg.jpg gr2 gr2_lrg.jpg jpg 378144 1322 2083 IMAGE-HIGH-RES 1-s2.0-S0926860X15301782-gr3_lrg.jpg https://s3-eu-west-1.amazonaws.com/prod-ucs-content-store-eu-west/content/pii:S0926860X15301782/gr3/HIGHRES/image/jpeg/e0621db96c91cf27dffcea590e20bc26/gr3_lrg.jpg https://s3.amazonaws.com/prod-ucs-content-store-us-east/content/pii:S0926860X15301782/gr3/HIGHRES/image/jpeg/e0621db96c91cf27dffcea590e20bc26/gr3_lrg.jpg gr3 gr3_lrg.jpg jpg 181439 1427 2083 IMAGE-HIGH-RES 1-s2.0-S0926860X15301782-gr4_lrg.jpg https://s3-eu-west-1.amazonaws.com/prod-ucs-content-store-eu-west/content/pii:S0926860X15301782/gr4/HIGHRES/image/jpeg/18d9948aa17fe92a61f4145245e9c596/gr4_lrg.jpg https://s3.amazonaws.com/prod-ucs-content-store-us-east/content/pii:S0926860X15301782/gr4/HIGHRES/image/jpeg/18d9948aa17fe92a61f4145245e9c596/gr4_lrg.jpg gr4 gr4_lrg.jpg jpg 184336 1204 2083 IMAGE-HIGH-RES 1-s2.0-S0926860X15301782-gr5_lrg.jpg https://s3-eu-west-1.amazonaws.com/prod-ucs-content-store-eu-west/content/pii:S0926860X15301782/gr5/HIGHRES/image/jpeg/846b939b4e7828c8791b886336ab2568/gr5_lrg.jpg https://s3.amazonaws.com/prod-ucs-content-store-us-east/content/pii:S0926860X15301782/gr5/HIGHRES/image/jpeg/846b939b4e7828c8791b886336ab2568/gr5_lrg.jpg gr5 gr5_lrg.jpg jpg 173449 1340 2083 IMAGE-HIGH-RES 1-s2.0-S0926860X15301782-gr6_lrg.jpg https://s3-eu-west-1.amazonaws.com/prod-ucs-content-store-eu-west/content/pii:S0926860X15301782/gr6/HIGHRES/image/jpeg/96bb00339f9ecc62c8e4684a1faf45ba/gr6_lrg.jpg https://s3.amazonaws.com/prod-ucs-content-store-us-east/content/pii:S0926860X15301782/gr6/HIGHRES/image/jpeg/96bb00339f9ecc62c8e4684a1faf45ba/gr6_lrg.jpg gr6 gr6_lrg.jpg jpg 193940 1436 2083 IMAGE-HIGH-RES 1-s2.0-S0926860X15301782-gr7_lrg.jpg https://s3-eu-west-1.amazonaws.com/prod-ucs-content-store-eu-west/content/pii:S0926860X15301782/gr7/HIGHRES/image/jpeg/0ea10221620f7ceb7a4d4a2245bcb8a3/gr7_lrg.jpg https://s3.amazonaws.com/prod-ucs-content-store-us-east/content/pii:S0926860X15301782/gr7/HIGHRES/image/jpeg/0ea10221620f7ceb7a4d4a2245bcb8a3/gr7_lrg.jpg gr7 gr7_lrg.jpg jpg 162606 1340 2083 IMAGE-HIGH-RES 1-s2.0-S0926860X15301782-gr8_lrg.jpg https://s3-eu-west-1.amazonaws.com/prod-ucs-content-store-eu-west/content/pii:S0926860X15301782/gr8/HIGHRES/image/jpeg/2cd47c8d2d222389845ccde462c02ac1/gr8_lrg.jpg https://s3.amazonaws.com/prod-ucs-content-store-us-east/content/pii:S0926860X15301782/gr8/HIGHRES/image/jpeg/2cd47c8d2d222389845ccde462c02ac1/gr8_lrg.jpg gr8 gr8_lrg.jpg jpg 413265 1697 2917 IMAGE-HIGH-RES 1-s2.0-S0926860X15301782-gr9_lrg.jpg https://s3-eu-west-1.amazonaws.com/prod-ucs-content-store-eu-west/content/pii:S0926860X15301782/gr9/HIGHRES/image/jpeg/cffc3de5ce6c183c3797cc302b13745b/gr9_lrg.jpg https://s3.amazonaws.com/prod-ucs-content-store-us-east/content/pii:S0926860X15301782/gr9/HIGHRES/image/jpeg/cffc3de5ce6c183c3797cc302b13745b/gr9_lrg.jpg gr9 gr9_lrg.jpg jpg 400475 2098 2917 IMAGE-HIGH-RES 1-s2.0-S0926860X15301782-mmc1.docx https://s3-eu-west-1.amazonaws.com/prod-ucs-content-store-eu-west/content/pii:S0926860X15301782/mmc1/MAIN/application/msword/0b359ab7649eebc3e14bfe48717ee36b/mmc1.docx https://s3.amazonaws.com/prod-ucs-content-store-us-east/content/pii:S0926860X15301782/mmc1/MAIN/application/msword/0b359ab7649eebc3e14bfe48717ee36b/mmc1.docx mmc1 mmc1.docx docx 6268323 APPLICATION APCATA 15577 S0926-860X(15)30178-2 10.1016/j.apcata.2015.10.001 Elsevier B.V. Fig. 1 XRD for bulk catalysts (air calcined at 350°C for 2h): (1) H3[PW12O40], (2) Co1.5[PW12O40], (3) Co1.5[PMo12O40] and (4) Co1.5[PMo12O40] spent catalyst. Fig. 2 XRD for supported catalysts (air calcined at 350°C for 2h): (1) 30%H3[PMo12O40]/SiO2, (2) 30%Ni1.5[PMo12O40]/Al2O3, (3) 30%Co1.5[PMo12O40]/Al2O3, (4) 30%Co1.5[PMo12O40]/Al2O3 spent catalyst, (5) γ-alumina. Fig. 3 DRIFT spectra of bulk Co1.5[PMo12O40] pre-catalyst (solid line) and spent catalyst (dashed line). Fig. 4 DRIFT spectra of bulk NiH[PW12O40] pre-catalyst (solid line) and spent catalyst (dashed line). Fig. 5 DRIFT spectra of 30%Co1.5[PMo12O40]/Al2O3 pre-catalyst (solid line) and spent catalyst (dashed line). Fig. 6 DRIFT spectra of adsorbed pyridine on bulk NiH[PMo12O40]: pre-catalyst (solid line) and spent catalyst (dashed line). Fig. 7 H2-TPR for pre-catalysts: (1) 30%H3[PMo12O40]/Al2O3, (2) 30%Co1.5[PMo12O40]/Al2O3. Fig. 8 Time course for HDS of thiophene over 30%Co1.5[PMo12O40]/Al2O3 at different space times W/F =152–608ghmol−1 (350–400°C, 1bar pressure, 2.63kPa thiophene partial pressure in H2 flow). Fig. 9 Time course for HDS of thiophene over 15%Co1.5[PMo12O40]/Al2O3 (0.20g) at different space times W/F =152–304ghmol−1 (400°C, 1bar pressure, 2.63kPa thiophene partial pressure in H2 flow). Fig. 10 Time course for HDS of thiophene over industrial CoMo catalyst ICI 41–6 (0.20g) at different space times W/F =152–304ghmol−1 (400°C, 1bar pressure, 2.63kPa thiophene partial pressure in H2 flow). Table 1 HDS of thiophene over bulk POM catalysts a . Catalyst Conversion (%) Selectivity (%) C4H10 1-C4H8 trans-2-C4H8 cis-2-C4H8 others b H3[PW12O40] 0.6 CoH[PW12O40] 0.6 Co1.5[PW12O40] 0.3 NiH[PW12O40] 0.7 Ni1.5[PW12O40] 0.6 H3[PMo12O40] 2.2 21 13 14 10 42 CoH[PMo12O40] 2.0 10 10 12 8 60 Co1.5[PMo12O40]c 1.9 14 13 13 9 51 NiH[PMo12O40] 2.6 15 15 24 15 31 Ni1.5[PMo12O40]d 3.5 16 16 26 17 25 a 400°C, 1bar pressure, 3h time on stream, 0.20g catalyst amount, 2.63kPa thiophene partial pressure in H2 flow, 20mLmin−1 flow rate, W/F =152ghmol−1, catalyst pre-sulfided for 1h at reaction temperature. b C1–C3 hydrocarbons and isobutane. Table 2 Hydrodesulfurisation of thiophene over non-promoted supported HPA catalysts a . Catalyst b Conversion (%) Selectivity c (%) C4H10 1-C4H8 trans-2-C4H8 cis-2-C4H8 H3[PW12O40]/SiO2 0.9 H3[PW12O40]/TiO2 11 11 22 41 27 H3[PW12O40]/Al2O3 4.3 5.2 21 45 28 H3[PMo12O40]/SiO2 19 10 19 43 28 H3[PMo12O40]/TiO2 29 17 20 38 25 H3[PMo12O40]/Al2O3 49 25 18 35 23 a 400°C, 1bar pressure, 4h time on stream, 0.20g catalyst amount, 2.63kPa thiophene partial pressure in H2 flow, 20mLmin−1 flow rate, W/F =152ghmol−1, catalyst pre-sulfided for 1h at reaction temperature. b 30wt% HPA loading. c Traces of C1–C3 hydrocarbons also formed. Table 3 Hydrodesulfurization of thiophene over γ-Al2O3-supported POM catalysts promoted by Ni and Co a . Catalyst b Temperature (°C) Conversion (%) Selectivity c (%) C4H10 1-C4H8 trans-2-C4H8 cis-2-C4H8 NiIIH[PW12O40]/Al2O3 350 3 20 16 38 26 400 23 13 20 38 29 Ni1.5[PW12O40]/Al2O3 350 4 18 14 38 30 400 16 21 10 41 28 CoH[PW12O40]/Al2O3 350 1 10 23 41 26 400 6 21 15 39 25 Co1.5[PW12O40]/Al2O3 350 2 19 12 41 28 400 5 21 11 40 28 NiH[PMo12O40]/Al2O3 350 40 27 16 34 23 400 65 29 16 32 23 Ni1.5[PMo12O40]/Al2O3 350 47 24 16 35 25 400 75 40 14 27 19 CoH[PMo12O40]/Al2O3 350 46 33 15 31 21 400 76 34 16 30 20 Co1.5[PMo12O40]/Al2O3 350 52 26 17 32 25 400 83 38 15 28 19 Co1.5[PMo12O40]/Al2O3 d 400 54 23 18 35 24 CoMo ICI 41-6 e 400 37 23 18 35 24 a 1bar pressure, 3h time on stream, 0.20g catalyst amount, 2.63kPa thiophene partial pressure in H2 flow, 20mLmin−1 flow rate, W/F =152ghmol−1, catalyst pre-sulfided for 1h at reaction temperature. b 30wt% POM loading. c Traces of C1–C3 hydrocarbons and iso-butane also formed. d 15%Co1.5[PMo12O40]/Al2O3; 8h time on stream. e 8h time on stream. Efficient hydrodesulfurization catalysts based on Keggin polyoxometalates Jocelyn North a Olivia Poole a Abdullah Alotaibi a Hossein Bayahia a Elena F. Kozhevnikova a Ali Alsalme b M. Rafiq H. Siddiqui b Ivan V. Kozhevnikov a ⁎ a Department of Chemistry, University of Liverpool, Liverpool L69 7ZD, United Kingdom Department of Chemistry University of Liverpool Liverpool L69 7ZD United Kingdom b Department of Chemistry, King Saud University, P.O. Box 2455, Riyadh, Saudi Arabia Department of Chemistry King Saud University P.O. Box 2455 Riyadh Saudi Arabia ⁎ Corresponding author. Graphical abstract Bulk and supported hydrodesulfurization catalysts based on Mo and W and containing Co or Ni as promoters and phosphorus as a modifier are prepared through the polyoxometalate route using Keggin type phosphomolybdates and phosphotungstates and tested in the HDS of thiophene at 350–400°C and 1 bar pressure. The corresponding oxidic pre-catalysts retain intact Keggin structure of the parent polyoxometalates and possess Brønsted and Lewis acidity. In the course of sulfidation, the oxidic pre-catalysts transform into an active sulfidic phase with the loss of Keggin structure and catalyst acidity. Catalyst activity increases in the order of supports: SiO2 <TiO2 <γ-Al2O3. CoMoP/γ-Al2O3 catalyst prepared through the polyoxometalate route shows higher HDS activity and butene selectivity than industrial catalyst of comparable composition. The results indicate that polyoxometalate catalyst preparation route can be considered a performance enhancement methodology for HDS catalysis. Keywords Desulfurization Thiophene Heterogeneous catalysis Polyoxometalate Molybdenum Cobalt 1 Introduction Hydrodesulfurization (HDS) driven by ever stringent environmental legislation is one of the most important processes of the petroleum industry. It removes sulfur from oil fractions by catalytic hydrotreatment to upgrade the quality of fuels [1,2]. Present day HDS technology largely employs sulfided Co(Ni)Mo/γ-Al2O3 catalysts [1–3]. These catalysts, although durable, are not sufficiently active and selective to achieve the required very low sulfur content in transportation fuels. Consequently, research into improvement of HDS catalysts continues all over the world. Recent developments include new methods of preparation of Co(Ni)Mo catalysts such as chemical vapor deposition improving the dispersion of active phases [4], addition of phosphorus [4] and citric acid [5], new active phases for HDS catalysts, e.g., noble metals [6], transition metal carbides [7], nitrides [8] and phosphides [9,10]. The Co(Ni)Mo/Al2O3 HDS catalysts are obtained by in-situ sulfidation of an oxidic precursor (pre-catalyst), which is usually prepared by impregnation of γ-alumina support with appropriate Mo and Co(Ni) compounds from aqueous solution, most typically using ammonium heptamolybdate and adding Co(II) or Ni(II) nitrate as a promoter, often with addition of phosphoric acid as a modifier [1–3]. Depending on the pH and P and Mo concentrations, such impregnation solutions contain P–Mo heteropoly anions such as P2Mo5O23 6−, PMo9O31(OH)3 6−, PMo11O39 7−, PMo12O40 3− and P2Mo18O62 6− [2]. On the other hand, heteropoly compounds, especially molybdophosphates incorporating Co(II) and/or Ni(II) promoters as counter cations or addenda atoms, can be used directly for the preparation of oxidic precursors for HDS catalysts [11–23]. In the past decades, heteropoly compounds, also known as polyoxometalates (POM) [24], have attracted much interest as catalysts of various reactions and as such found application in several large-scale industrial processes [25–27]. Various types of heteropoly compounds have been used for the preparation of HDS pre-catalysts, the common Keggin type heteropoly compounds comprising heteropoly anions of the composition [XM12O40]n− (M =Mo6+, W6+; X =P5+, Si4+) most frequently applied. Catalyst preparation methodology through the polyoxometalate route has important advantages such as (i) incorporation of all the elements required for HDS catalyst within heteropoly compound thus allowing the preparation of oxidic precursor in a single impregnation step, (ii) close interaction between the key elements in the pre-catalyst and sulfided catalyst and (iii) extraneous counter ions can be excluded from the impregnation solution to reduce waste [16,17]. In this work, which follows up our recent study on polyoxometalate NiMo/SiO2 HDS catalysts [23], we prepared bulk and supported Co and Ni phosphomolybdate and phosphotungstate catalysts via the POM route from Co(II) and Ni(II) salts of phosphomolybdic H3[PMo12O40] and phosphotungstic H3[PW12O40] heteropoly acids (HPA) and tested for their activity in the HDS of thiophene, which is relevant to the hydrotreating of FCC naphtha [1,2]. Our aim was to investigate the effect of POM composition and catalyst support on the catalytic activity, the role of Brønsted and Lewis acidity of the pre-catalyst and to follow the evolution of pre-catalyst in the course of HDS reaction. It is demonstrated that CoMo/Al2O3 catalyst prepared through the POM route has the potential of reducing hydrogen consumption in HDS process and the loss of high octane alkenes in the final gasoline pool. Therefore, the POM catalyst preparation route can be considered a performance enhancement methodology for HDS catalysis. 2 Materials and methods 2.1 Chemicals and materials Phosphomolybdic and phosphotungstic acid hydrates (H3[PMo12O40]·12H2O and H3[PW12O40]·28H2O), Ni(NO3)2·6H2O, Co(NO3)2·6H2O and thiophene (99%) were from Sigma–Aldrich. Catalyst supports Aerosil 300 silica (SBET=300m2g−1), P25 titania (anatase/rutile=3:1, SBET=51m2 g−1) and Aluminiumoxid C γ-alumina (SBET=120m2 g−1) were from Degussa. 2.2 Preparation of HDS pre-catalysts Bulk Ni(II) and Co(II) salts of H3[PMo12O40] and H3[PW12O40] with M(II)/HPA molar ratios of 1:1 and 1.5:1 (i.e., M(II)/Mo(VI) or M(II)/W(VI) ratio of 1:12 and 1:8) were prepared by dissolving the HPA in a minimum amount of deionized water at room temperature followed by addition of the required amount of the corresponding metal nitrate (Co(NO3)2 or Ni(NO3)2) with stirring. Excess water was distilled off using a rotary evaporator and the resulting residue oven dried at 100°C overnight. The solids were calcined in air at 350°C for 2h with a heating rate of 10°Cmin−1and finally ground into a powder of 45–180μm particle size. Supported H3[PMo12O40] and H3[PW12O40] pre-catalysts with 30wt% HPA loading based on anhydrous HPA were prepared by wet impregnation of support (γ-Al2O3, SiO2 or TiO2) with an aqueous solution of HPA at room temperature with stirring for 2h. Solid residues were isolated by rotary evaporation, oven dried at 100°C and air calcined at 350°C for 2h at a heating rate of 10°Cmin−1. The pre-catalysts were then ground into a powder with a particle size of 45–180μm. γ-Al2O3-supported Ni(II) and Co(II) phosphomolybdate and phosphotungstate pre-catalysts with M(II)/HPA molar ratios of 1:1 and 1.5:1 and 30wt% POM loading were prepared similarly by impregnation of γ-Al2O3 with HPA and Ni(NO3)2 or Co(NO3)2 in required quantities from aqueous solution. The slurry was stirred for 2h at room temperature followed by rotary evaporation to remove water. The residue was dried overnight at 100°C and air calcined at 350°C for 2h resulting in lightly colored powders, which were ground into 45–180μm particle size. Industrial CoMo/Al2O3 pre-catalyst (ICI Catalyst 41–6, Co/Mo=0.62mol/mol), containing CoO (4.0%), MoO3 (12.0%), SiO2 (1.0%) and γ-Al2O3 (balance) [3], was crushed and sieved to a powder with a particle size of 45–180μm. It had a surface area of 220m2 g−1 and a pore volume of 0.6cm3 g−1 [3]. For comparison with the industrial ICI 41–6 catalyst, 15%Co1.5[PMo12O40]/Al2O3 pre-catalyst containing similar Mo loading (13% MoO3) but a lower Co/Mo molar ratio of 0.125 was prepared by grinding 30%Co1.5[PMo12O40]/Al2O3 with equal quantity of γ-Al2O3 support. The powder was pressed into a pellet then crushed to a 45–180μm catalyst powder. 2.3 Techniques Catalyst surface area, pore volume and pore size were determined on a Micromeritics ASAP 2010 instrument by measuring nitrogen adsorption at −196°C. Before measurement the catalysts were pre-treated at 240°C in vacuum. Powder X-ray diffractograms were collected on a PANalytical Xpert diffractometer using Cu Kα radiation (λ =0.1542nm). ICP-AES analysis of sulfur was carried out on a Spectro Ciros emission spectrometer. Fourier transform infrared (FTIR) spectra of pre-catalysts and spent catalysts were recorded on a Nicolet Nexus FTIR spectrometer using powdered catalyst mixtures with KBr. In FTIR spectra of γ-Al2O3-supported catalysts, the absorption of support was subtracted using a γ-Al2O3-KBr mixture as the background. DRIFT (diffuse reflectance infrared Fourier transform) spectra of adsorbed pyridine were taken on the same spectrometer. Catalyst samples were ground with KBr (1–10wt% in KBr) and pre-treated at 150°C/10−3 kPa for 1h. The samples were then exposed to pyridine vapor at room temperature for 1h, followed by pumping out at 150°C/10−3 kPa for 1h to remove physisorbed pyridine. The DRIFT spectra of adsorbed pyridine were recorded at room temperature at a 4cm−1 resolution. Temperature programmed reduction (H2-TPR) of catalysts was carried out on a Micromeritics TPD/TPR 2900 apparatus equipped with a thermal conductivity detector. Catalyst samples (20–30mg) were heated up to 950°C at a rate of 10°Cmin−1 in a H2–N2 (5:95) gas flow (60mLmin−1). 2.4 Catalyst testing The HDS of thiophene was carried out in flowing H2 at 350–400°C under atmospheric pressure in a down-flow quartz fixed-bed reactor (9mm i.d.) with online GC analysis (Varian 3800 instrument with a 30m×0.25mm×0.5μm HP-INNOWAX capillary column and a flame ionization detector) (Supplementary material, Fig. S1). For more accurate offline GC analysis of C1–C4 hydrocarbon products, a 60m×0.32mm GS-GasPro capillary column was used, which allowed for complete separation of these hydrocarbons. The temperature in the reactor was controlled by a Eurotherm controller using a thermocouple placed at the top of the catalyst bed. Thiophene was fed by passing hydrogen flow controlled by a Brooks mass flow controller through a stainless steel saturator which held liquid thiophene at 0°C to keep the chosen thiophene partial pressure of 2.63kPa in hydrogen flow [28]. The reactor was packed with 0.2–0.4g of pre-catalyst powder of 45–180μm particle size. The gas feed entered the reactor at the top at a flow rate of 10–20mLmin−1 (space time W/F =152608ghmol−1, where W (g) is the catalyst weight and F (molh−1) is the molar flow rate of thiophene). Prior to reaction monitoring, the pre-catalysts were sulfided in situ in the feed flow containing thiophene (2.63kPa) in H2 for 1h at the reaction temperature. The downstream flow was analyzed by the on-line GC to continuously monitor thiophene conversion. Product selectivity was determined at selected times on stream by offline GC analysis using the GS-GasPro capillary column. The selectivity was defined as the percentage of thiophene converted into a particular product and quoted in mol.%. The mean absolute percentage error in conversion and selectivity was ≤5% and the carbon balance was maintained within 95%. 3 Results and discussion 3.1 Pre-catalyst characterization Bulk HPA and M(II)-HPA (M =Co, Ni) pre-catalysts prepared had a very low surface area (2.3–5.7m2 g−1) and pore volume (0.004–0.012cm3 g−1), which is typical of these compounds [25–27]; their pore diameter was in the range of 58–114Å (Table S1). The M(II)-HPA pre-catalysts with the sub-stoichiometric M(II)/HPA molar ratio of 1:1 can be viewed as the partially substituted heteropoly salts MIIH[PMo12O40] and MIIH[PW12O40]. For the stoichiometric M(II)/HPA ratio of 1.5:1, the pre-catalysts could be attributed to neutral salts MII 1.5[PMo12O40] and MII 1.5[PW12O40], although HPA salts prepared to be neutral often contain protons due to incomplete substitution and Keggin ion degradation [27]. It should be noted that Ni(II) and Co(II) nitrates decompose to form metal oxides upon calcination above 300°C: M(NO3)2 →MO+2NO2 +O2 [29]. From powder X-ray diffraction (XRD), bulk H3[PMo12O40] and H3[PW12O40] calcined at 350°C were crystalline materials with close packed cubic structure. Bulk metal salts of H3[PW12O40] were crystalline too, whereas the salts of H3[PMo12O40] were amorphous as exemplified for Co(II) salts in Fig. 1 . Supported HPA and M(II)-HPA pre-catalysts (30wt% loading) prepared through Keggin POMs were mesoporous materials with a BET surface area of 29–172m2 g−1, 0.14–0.86cm3 g−1 pore volume and 119–249Å pore diameter depending on support (γ-Al2O3, SiO2 or TiO2) (Table S2). The Co1.5[PMo12O40]/Al2O3 pre-catalyst, which showed the highest activity among the catalysts studied (see below), had a surface area of 69m2 g−1, 0.27cm3 g−1 pore volume and 157Å pore diameter. For this catalyst, nitrogen adsorption isotherm and pore size distribution are shown in Figs. S2 and S3. H3[PMo12O40] exhibited a crystal phase on SiO2 and Al2O3, but was amorphous on TiO2 (Fig. S4). H3[PW12O40] was crystalline on SiO2 and TiO2, but amorphous on Al2O3 (Fig. S4). Co(II) and Ni(II) salts of H3[PMo12O40] were crystalline on Al2O3 (Fig. 2 ), whereas the salts of H3[PW12O40] did not show POM crystal phase on Al2O3 (Fig. S5). Regardless of crystallinity, the Keggin primary structure of PMo and PW heteropoly anions remained intact in all these materials, bulk and supported, as demonstrated by infrared spectroscopy. Fig. 3 and Fig. 4 show the DRIFT spectra of bulk Co1.5[PMo12O40] and NiH[PW12O40] pre-catalysts (powdered with KBr), which match perfectly the literature spectra of H3[PMo12O40] and H3[PW12O40] and their salts [30]. Fig. 5 shows the DRIFT spectrum of Co1.5[PMo12O40]/Al2O3 pre-catalyst, with the strong absorption band of alumina at 900cm−1 largely subtracted. It also matches quite well the literature spectra of bulk H3[PMo12O40] and its salts (cm−1): 1062–1068 (PO), 954-963 (MoO), 869–880 (MoOMo corner-sharing) and 785–805 (MoOMo edge-sharing) [30]. In the spectrum of Co1.5[PMo12O40]/Al2O3, the weak Mo-O-Mo bands at 865 and 803cm−1 are partly obscured by the γ-Al2O3 band at 900cm−1. M(II)-HPA pre-catalysts possess Brønsted and Lewis acidity owing to the presence of heteropoly acid protons and M(II). These materials showed the characteristic peaks of Brønsted (∼1540cm−1) and Lewis (∼1450cm−1) acid sites in their DRIFT spectra of adsorbed pyridine, together with the band at 1490cm−1 attributed to both types of acid sites [31] as exemplified for bulk NiH[PMo12O40] in Fig. 6 . This acidity, however, was lost during the HDS reaction as a result of catalyst sulfidation (see below). Fig. 7 shows the H2-TPR (temperature programmed reduction) of H3[PMo12O40]/Al2O3 and Co1.5[PMo12O40]/Al2O3 pre-catalysts. Both exhibit two reduction peaks at about 550 and 800°C. The Keggin structure of HPMo would probably collapse to form MoO3 and P2O5 before the reduction took place. These peaks can be attributed to reduction of Mo(VI) to Mo(IV). As Mo(VI) is in large excess over Co(II) in the Co1.5[PMo12O40]/Al2O3 pre-catalyst, reduction of Co(II) is probably masked by the Mo peaks. Similar H2-TPR results have been reported previously for Ni(II)-[PMo12O40]/SiO2 [23] and non-promoted HPMo/TiO2 [17]. 3.2 Catalyst performance in HDS of thiophene 3.2.1 Bulk catalysts Bulk M(II)-HPA pre-catalysts have low surface areas and porosities (Table S1) and therefore could be expected to have low HDS activities. Nevertheless, it is interesting to test these catalysts because their evolution in the course of HDS reaction is easier to follow with spectroscopic techniques as compared to supported catalysts. Table 1 shows the performance of the bulk HPA and M(II)-HPA catalysts in the HDS of thiophene at 400°C and a space time W/F =152ghmol−1. It is clearly seen that tungsten catalysts possessing more stable POM structure [27] are less active (<1% thiophene conversion) than more labile molybdenum catalysts (2–3.5% conversion). Ni–Mo catalysts show marginally higher activities than Co–Mo ones, the latter being practically equal in activity to the non-promoted H3[PMo12O40]. The main reaction products include n-butane (10–21% selectivity) and n-butenes (1-butene, trans-2-butene and cis-2-butene) (30–59%), as represented by Eq. (1). On top of that, significant amount of C1–C3 cracking by-products (25–60%) and a little of isobutane was also formed, which may be explained by strong acidity of the bulk HPA pre-catalysts (see above). All bulk catalysts, initially lightly colored, turned black after reaction. This was also the case for supported M(II)-HPA catalysts (see below). The change of color indicates catalyst sulfidation. Indeed, from post-reaction characterization, sulfur content in spent Ni1.5[PMo12O40] and Co1.5[PMo12O40] catalysts was found to be 7.5 and 4.5wt%, which corresponds to 18 and 10% catalyst sulfidation, respectively, as estimated assuming formation of MoS2 and NiS or CoS. This implies transformation of M(II)-H3[PMo12O40] pre-catalysts into active metal sulfide phases. A small amount of coke was also found in spent catalysts (0.32% carbon content in spent Co1.5[PMo12O40]). Amorphous bulk Co(II)-H3[PMo12O40] and Ni(II)-H3[PMo12O40] pre-catalysts remained amorphous after HDS reaction (Fig. 1). It was found that they lost their Keggin structure during the reaction as can be seen from Fig. 3, which shows the DRIFT spectra for Co1.5[PMo12O40] (pre-catalyst versus spent catalyst). In contrast, the more stable and less active M(II)-H3[PW12O40] catalysts retained the Keggin structure after reaction as clearly seen from the DRIFT spectra for NiH[PW12O40] (Fig. 4). As to the M(II)-H3[PMo12O40] catalysts, not only their Keggin structure but also their acidity, both Brønsted and Lewis, was lost in the course of HDS reaction, as seen from the DRIFT spectra of adsorbed pyridine for the NiH[PMo12O40] pre-catalyst and spent catalyst (Fig. 6). The overall picture emerging from these results is that the M(II)-H3[PMo12O40] oxidic pre-catalysts with labile POM structure readily undergo sulfidation with the loss of Keggin structure and acidity to form an HDS active sulfidic phase. In contrast, the more stable M(II)-H3[PW12O40] pre-catalysts are rather resistant to sulfidation hence having difficulty to form active HDS catalysts, which results in their low catalytic activity. 3.2.2 Supported catalysts Table 2 shows the HDS of thiophene over non-promoted supported HPA catalysts at 400°C. These catalysts had considerably higher activities than their bulk counterparts, which can be attributed to higher HPA dispersion in supported catalysts. Again, for the reasons given above, Mo catalysts showed higher HDS activities in comparison to W catalysts. The type of support played an important role; the HDS activity (thiophene conversion) of Mo catalysts increased in the order of supports: SiO2 <TiO2 <γ-Al2O3, which is in agreement with previous reports [1,2]. This activity order does not correlate with support surface area (Table S2), but is in line with increasing HPA-support interaction in this series [27,32], which might increase dispersion of active species on the surface of support. It should be noted that the supported HPA catalysts were much more selective than the bulk ones, giving butane-butene product mixtures with only traces of C1–C3 cracking by-products (cf. results in Table 1 and Table 2). Therefore, as the alumina-supported Mo catalysts showed better HDS activities, our further studies were focused on these catalysts. Table 3 shows the HDS of thiophene at 350–400°C over γ-Al2O3-supported catalysts promoted by Co and Ni prepared through the POM route. It is evident that Mo catalysts are again much more active than their W counterparts. As expected, addition of Co and Ni promoters significantly increased thiophene conversion. The catalyst activity also increased with increasing the M(II)/HPA molar ratio. In all cases the catalyst activity predictably increased with increasing the temperature from 350 to 400°C. Among the catalysts studied, 30%Co1.5[PMo12O40]/Al2O3 was found to be the most active one in the HDS of thiophene, closely followed by 30%Ni1.5[PMo12O40]/Al2O3 (Table 3). The 30%Co1.5[PMo12O40]/Al2O3 catalyst was tested for a longer time on stream (132h in total) at different space times; the results are shown in Fig. 8 . At 350°C and W/F =152ghmol−1, thiophene conversion gradually increased with the time on stream from 47 to 55% in 4h. This can be explained by increasing catalyst sulfidation to form an active sulfidic phase. At 400°C and the same space time, the sulfided catalyst performed with a steady conversion of 83%. A notable increase in butene selectivity occurred along the time on stream (from 38 to 47%) at the expense of n-butane formation. This may be explained by inhibition of catalyst hydrogenation activity due to coke formation. The conversion further scaled with the W/F to 96% at W/F =304ghmol−1 and 99% at 608ghmol−1 without evidence of catalyst deactivation. The selectivity to n-butane increased with thiophene conversion at the expense of butenes reaching 75% at 99% conversion (Fig. 8). Only traces of C1–C3 cracking by-products were observed (Fig. S6), which can be explained by the loss of catalyst acidity upon sulfidation. After reaction, the lightly colored 30%Co1.5[PMo12O40]/Al2O3 pre-catalyst turned black, however its texture practically did not change (Table S2). Post-reaction characterization revealed only a small amount of coke in the spent catalyst (0.69wt% carbon content). The sulfur content was found to be 8.2wt%. This corresponds to 64% catalyst sulfidation assuming formation of MoS2 and CoS and implies transformation of the pre-catalyst into an active metal sulfide phase on the alumina surface (hence the black color). Upon sulfidation, the Keggin structure of P–Mo polyoxometalate was completely destroyed as clearly seen from the DRIFT spectra of the pre-catalyst and spent catalyst (Fig. 5). Previously, non-promoted H3[PW12O40] has been found to lose its Keggin structure upon the HDS of dibenzothiophene as evidenced by 31P MAS NMR [15]. No correlation was found between the activity of the M(II)-H3[PMo12O40] catalysts in the HDS of thiophene and the redox behavior of the corresponding pre-catalysts in H2-TPR (Fig. 7). It is obvious that the HDS proceeds at much lower temperatures (350–400°C) compared to the H2-TPR (550–800°C). This implies that sulfidation of these pre-catalysts to form catalytically active phases occurs at lower temperatures than their reduction with H2. It should be noted, however, that the H2-TPR was carried out under transient conditions. Slow isothermal catalyst reduction with H2 may be possible at lower temperatures below 550°C. Thermodynamic analysis of reaction products provides further evidence about the HDS process. The equilibrium ratio of n-butene isomers has been found to be 1-butene/trans-2-butene/cis-2-butene=1:1.8:1.2 at 400°C and 1bar [33]. This is close to the ratio obtained here with M(II)-H3[PMo12O40] catalysts (Table 3), which shows that the butenes produced were at equilibrium. On the other hand, hydrogenation of butenes to n-butane was far from equilibrium, with butane/butene molar ratios 2–3 orders of magnitude lower than the equilibrium values. This indicates that butene-to-butane hydrogenation was a slow process, and as a result, n-butane selectivity predictably increased with thiophene conversion. For comparison with industrial oxide pre-catalyst CoMo/γ-Al2O3 (ICI Catalyst 41-6) with 12% MoO3 content and a Co/Mo molar ratio of 0.62 [3], the 30%Co1.5[PMo12O40]/Al2O3 pre-catalyst was diluted with γ-Al2O3 to 15%Co1.5[PMo12O40]/Al2O3 with a similar MoO3 content (13%) but a lower Co/Mo molar ratio of 0.125. This catalyst was tested at 400°C to give 54% thiophene conversion with 77% total butene selectivity at W/F =152ghmol−1 and 74% conversion with 64% butene selectivity at W/F =304ghmol−1 (Fig. 9 , Table 3). The industrial catalyst ICI 41-6 under the same conditions gave 37% conversion with 74% butene selectivity at W/F =152ghmol−1 and 54% conversion with 62% butene selectivity at W/F =304ghmol−1 (Fig. 10 , Table 3). The spent ICI 41-6 catalyst contained 0.26% of coke and its sulfidation was 65% based on the formation of MoS2 and CoS, which is close to the sulfidation of the 30%Co1.5[PMo12O40]/Al2O3 catalyst (see above). Both 15%Co1.5[PMo12O40]/Al2O3 and ICI 41-6 catalysts showed a slight decrease in n-butane selectivity with the time on stream (Figs. 9 and 10) probably due to inhibition of their hydrogenation activity by coking, similar to that displayed in Fig. 8. In the latter case, however, this trend is more notable due to much longer time on stream. Therefore, the Co1.5[PMo12O40]/Al2O3 catalyst, despite its lower Co/Mo ratio, gave higher thiophene conversion compared to the industrial catalyst per equal catalyst weight. It also gave higher butene selectivity thus exhibiting lower hydrogenation activity compared to the industrial catalyst, which can be explained by the lower Co content. Overall, these results demonstrate that the Co1.5[PMo12O40]/Al2O3 catalyst prepared through the POM route has enhanced HDS performance compared to the conventional industrial CoMo/Al2O3 catalyst. This can be attributed to close interaction between oxomolybdenum species with Co promoter and to the presence of phosphorus modifier in the Co1.5[PMo12O40]/Al2O3 catalyst. 4 Conclusions It has been demonstrated that the Co1.5[PMo12O40]/Al2O3 catalyst (Co/Mo=0.125mol/mol) prepared through the POM route using Keggin type phosphomolybdate has high activity in the HDS of thiophene. Compared to the industrial CoMo/Al2­O3 catalyst with similar Mo loading and a higher Co/Mo ratio of 0.62, the new catalyst shows higher thiophene conversion and higher butene selectivity. Therefore Co1.5[PMo12O40]/Al2O3 catalyst has the potential of reducing hydrogen consumption in HDS process and the loss of high octane alkenes in the final gasoline pool. On the basis of these results, the POM catalyst preparation route is considered to be a performance enhancement methodology for HDS catalysis. Acknowledgements This research was partly funded by the National Plan for Science, Technology and Innovation (MAARIFAH), King Abdulaziz City for Science and Technology, Saudi Arabia, Award No. 11-NAN-1852-02. We thank Shaqra University, Shaqra, Saudi Arabia for PhD studentship (A. Alotaibi). Appendix A Supplementary data Supplementary data associated with this article can be found, in the online version, at http://dx.doi.org/10.1016/j.apcata.2015.10.001. Appendix A Supplementary data The following are Supplementary data to this article: References [1] I.V. Babich J.A. Moulijn Fuel 82 2003 607 631 [2] R. Prins G. Ertl H. Knözinger F. Schüth J. Weitkamp Handbook of Heterogeneous Catalysis 6 2008 Wiley-VCH Weinheim 2695 2718 [3] P.J.H. Carnell M.V. Twigg Catalyst Handbook 1989 Wolfe Publishing London 204 208 [4] Y. Okamoto Catal. Today 132 2008 9 17 [5] N. Rinaldi Usman K. Al-Dalama T. Kubota Y. Okamoto Appl. Catal. A 360 2009 130 136 [6] A. Niquille-Röthlisberger R. Prins Catal. Today 123 2007 198 207 [7] M. Lewandowski A. Szymánska-Kolasa P. Da Costa C. Sayag Catal. Today 119 2007 31 34 [8] M. Nagai Appl. Catal. A 322 2007 178 190 [9] Y. Kanda C. Temma A. Sawada M. Sugioka Y. Uemichi Appl. Catal. A 475 2014 410 419 [10] R. Prins M.E. Bussell Catal. Lett. 142 2012 1413 1436 [11] S. Damyanova A. Spojakina D. Shopov Appl. Catal. 48 1989 177 186 [12] A.M. Maitra N.W. Cant D.L. Trimm Appl. Catal. 48 1989 187 197 [13] A. Griboval P. Blanchard L. Gengembre E. Payen M. Fournier J.L. Dubois J.R. Bernard J. Catal. 188 1999 102 110 [14] C.I. Cabello I.L. Botto H.J. Thomas Appl. Catal. A 197 2000 79 86 [15] R. Shafi M.R.H. Siddiqui G.J. Hutchings E.G. Derouane I.V. Kozhenikov Appl. Catal. A 204 2000 251 256 [16] A. Griboval P. Blanchard E. Payen M. Fournier J.L. Dubois J.R. Bernard Appl. Catal. A 217 2001 173 183 [17] E. Kraleva A. Spojakina K. Jiratova L. Petrov Catal. Lett. 112 2006 203 212 [18] R. Palcheva A. Spojakina K. Jiratova L. Kaluza Catal. Lett. 137 2010 216 223 [19] K. Ben Tayeb C. Lamonier C. Lancelot M. Fournier A. Bonduelle-Skrzypczak F. Bertoncini Appl. Catal. B 126 2012 55 63 [20] P.A. Nikul’shin A.V. Mozhaev D.I. Ishutenko P.P. Minaev A.I. Lyashenko A.A. Pimerzin Kinet. Catal. 53 2012 620 631 [21] F.J. Méndez A. Llanos M. Echeverría R. Jáuregui Y. Villasana Y. Díaz G. Liendo-Polanco M.A. Ramos-García T. Zoltan J.L. Brito Fuel 110 2013 249 258 [22] B. Pawelec R. Mariscal J.L.G. Fierro A. Greenwood P.T. Vasudevan Appl. Catal. A 206 2001 295 307 [23] A. Alsalme N. Alzaqri A. Alsaleh M.R.H. Siddiqui A. Alotaibi E.F. Kozhevnikova I.V. Kozhevnikov Appl. Catal. B 182 2016 102 108 [24] M.T. Pope Heteropoly and Isopoly Oxometalates 1983 Springer Berlin [25] T. Okuhara N. Mizuno M. Misono Adv. Catal. 41 1996 113 252 [26] I.V. Kozhevnikov Chem. Rev. 98 1998 171 198 [27] I.V. Kozhevnikov Catalysis by Polyoxometalates 2002 Wiley & Sons Chichester [28] D.R. Stull Ind. Eng. Chem. 39 1947 517 550 [29] S. Yuvaraj L. Fan-Yuan C. Tsong-Huei Y. Chuin-Tih S. Yuvaraj L. Fan-Yuan C. Tsong-Huei Y. Chuin-Tih J. Phys. Chem. B 107 2003 1044 1047 [30] C. Rocchiccioli-Deltcheff M. Fournier R. Franck R. Thouvenot Inorg. Chem. 22 1983 207 216 [31] H. Knözinger G. Ertl H. Knözinger F. Schüth J. Weitkamp Handbook of Heterogeneous Catalysis vol. 2 2008 Wiley-VCH Weinheim 1154 [32] A.M. Alsalme P.V. Wiper Y.Z. Khimyak E.F. Kozhevnikova I.V. Kozhevnikov J. Catal. 276 2010 181 189 [33] J. Happel M.A. Hnatow R. Mezaki J. Chem. Eng. Data 16 1971 206 209",
      "scopus-id": "84944717398",
      "coredata": {
        "eid": "1-s2.0-S0926860X15301782",
        "dc:description": "Bulk and supported hydrodesulfurization catalysts based on Mo and W and containing Co or Ni as promoters and phosphorus as a modifier are prepared through the polyoxometalate route using Keggin type phosphomolybdates and phosphotungstates and tested in the HDS of thiophene at 350–400°C and 1 bar pressure. The corresponding oxidic pre-catalysts retain intact Keggin structure of the parent polyoxometalates and possess Brønsted and Lewis acidity. In the course of sulfidation, the oxidic pre-catalysts transform into an active sulfidic phase with the loss of Keggin structure and catalyst acidity. Catalyst activity increases in the order of supports: SiO2 <TiO2 <γ-Al2O3. CoMoP/γ-Al2O3 catalyst prepared through the polyoxometalate route shows higher HDS activity and butene selectivity than industrial catalyst of comparable composition. The results indicate that polyoxometalate catalyst preparation route can be considered a performance enhancement methodology for HDS catalysis.",
        "openArchiveArticle": "false",
        "prism:coverDate": "2015-11-30",
        "openaccessUserLicense": null,
        "prism:aggregationType": "Journal",
        "prism:url": "https://api.elsevier.com/content/article/pii/S0926860X15301782",
        "dc:creator": [
          {
            "@_fa": "true",
            "$": "North, Jocelyn"
          },
          {
            "@_fa": "true",
            "$": "Poole, Olivia"
          },
          {
            "@_fa": "true",
            "$": "Alotaibi, Abdullah"
          },
          {
            "@_fa": "true",
            "$": "Bayahia, Hossein"
          },
          {
            "@_fa": "true",
            "$": "Kozhevnikova, Elena F."
          },
          {
            "@_fa": "true",
            "$": "Alsalme, Ali"
          },
          {
            "@_fa": "true",
            "$": "Siddiqui, M. Rafiq H."
          },
          {
            "@_fa": "true",
            "$": "Kozhevnikov, Ivan V."
          }
        ],
        "link": [
          {
            "@_fa": "true",
            "@rel": "self",
            "@href": "https://api.elsevier.com/content/article/pii/S0926860X15301782"
          },
          {
            "@_fa": "true",
            "@rel": "scidir",
            "@href": "https://www.sciencedirect.com/science/article/pii/S0926860X15301782"
          }
        ],
        "dc:format": "application/json",
        "openaccessType": null,
        "pii": "S0926-860X(15)30178-2",
        "prism:volume": "508",
        "prism:publisher": "Elsevier B.V.",
        "dc:title": "Efficient hydrodesulfurization catalysts based on Keggin polyoxometalates",
        "prism:copyright": "Copyright © 2015 Elsevier B.V. All rights reserved.",
        "openaccess": "0",
        "prism:issn": "0926860X",
        "dcterms:subject": [
          {
            "@_fa": "true",
            "$": "Desulfurization"
          },
          {
            "@_fa": "true",
            "$": "Thiophene"
          },
          {
            "@_fa": "true",
            "$": "Heterogeneous catalysis"
          },
          {
            "@_fa": "true",
            "$": "Polyoxometalate"
          },
          {
            "@_fa": "true",
            "$": "Molybdenum"
          },
          {
            "@_fa": "true",
            "$": "Cobalt"
          }
        ],
        "openaccessArticle": "false",
        "prism:publicationName": "Applied Catalysis A: General",
        "openaccessSponsorType": null,
        "prism:pageRange": "16-24",
        "prism:endingPage": "24",
        "pubType": "fla",
        "prism:coverDisplayDate": "November 2015",
        "prism:doi": "10.1016/j.apcata.2015.10.001",
        "prism:startingPage": "16",
        "dc:identifier": "doi:10.1016/j.apcata.2015.10.001",
        "openaccessSponsorName": null
      },
      "objects": {
        "object": [
          {
            "@category": "thumbnail",
            "@height": "88",
            "@width": "219",
            "@_fa": "true",
            "$": "https://api.elsevier.com/content/object/eid/1-s2.0-S0926860X15301782-fx1.sml?httpAccept=%2A%2F%2A",
            "@multimediatype": "GIF image file",
            "@type": "IMAGE-THUMBNAIL",
            "@size": "3004",
            "@ref": "fx1",
            "@mimetype": "image/gif"
          },
          {
            "@category": "thumbnail",
            "@height": "88",
            "@width": "219",
            "@_fa": "true",
            "$": "https://api.elsevier.com/content/object/eid/1-s2.0-S0926860X15301782-fx2.sml?httpAccept=%2A%2F%2A",
            "@multimediatype": "GIF image file",
            "@type": "IMAGE-THUMBNAIL",
            "@size": "2283",
            "@ref": "fx2",
            "@mimetype": "image/gif"
          },
          {
            "@category": "thumbnail",
            "@height": "137",
            "@width": "219",
            "@_fa": "true",
            "$": "https://api.elsevier.com/content/object/eid/1-s2.0-S0926860X15301782-gr1.sml?httpAccept=%2A%2F%2A",
            "@multimediatype": "GIF image file",
            "@type": "IMAGE-THUMBNAIL",
            "@size": "14450",
            "@ref": "gr1",
            "@mimetype": "image/gif"
          },
          {
            "@category": "thumbnail",
            "@height": "134",
            "@width": "219",
            "@_fa": "true",
            "$": "https://api.elsevier.com/content/object/eid/1-s2.0-S0926860X15301782-gr10.sml?httpAccept=%2A%2F%2A",
            "@multimediatype": "GIF image file",
            "@type": "IMAGE-THUMBNAIL",
            "@size": "16235",
            "@ref": "gr10",
            "@mimetype": "image/gif"
          },
          {
            "@category": "thumbnail",
            "@height": "139",
            "@width": "219",
            "@_fa": "true",
            "$": "https://api.elsevier.com/content/object/eid/1-s2.0-S0926860X15301782-gr2.sml?httpAccept=%2A%2F%2A",
            "@multimediatype": "GIF image file",
            "@type": "IMAGE-THUMBNAIL",
            "@size": "18106",
            "@ref": "gr2",
            "@mimetype": "image/gif"
          },
          {
            "@category": "thumbnail",
            "@height": "150",
            "@width": "219",
            "@_fa": "true",
            "$": "https://api.elsevier.com/content/object/eid/1-s2.0-S0926860X15301782-gr3.sml?httpAccept=%2A%2F%2A",
            "@multimediatype": "GIF image file",
            "@type": "IMAGE-THUMBNAIL",
            "@size": "11760",
            "@ref": "gr3",
            "@mimetype": "image/gif"
          },
          {
            "@category": "thumbnail",
            "@height": "127",
            "@width": "219",
            "@_fa": "true",
            "$": "https://api.elsevier.com/content/object/eid/1-s2.0-S0926860X15301782-gr4.sml?httpAccept=%2A%2F%2A",
            "@multimediatype": "GIF image file",
            "@type": "IMAGE-THUMBNAIL",
            "@size": "15072",
            "@ref": "gr4",
            "@mimetype": "image/gif"
          },
          {
            "@category": "thumbnail",
            "@height": "141",
            "@width": "219",
            "@_fa": "true",
            "$": "https://api.elsevier.com/content/object/eid/1-s2.0-S0926860X15301782-gr5.sml?httpAccept=%2A%2F%2A",
            "@multimediatype": "GIF image file",
            "@type": "IMAGE-THUMBNAIL",
            "@size": "11367",
            "@ref": "gr5",
            "@mimetype": "image/gif"
          },
          {
            "@category": "thumbnail",
            "@height": "151",
            "@width": "219",
            "@_fa": "true",
            "$": "https://api.elsevier.com/content/object/eid/1-s2.0-S0926860X15301782-gr6.sml?httpAccept=%2A%2F%2A",
            "@multimediatype": "GIF image file",
            "@type": "IMAGE-THUMBNAIL",
            "@size": "12761",
            "@ref": "gr6",
            "@mimetype": "image/gif"
          },
          {
            "@category": "thumbnail",
            "@height": "141",
            "@width": "219",
            "@_fa": "true",
            "$": "https://api.elsevier.com/content/object/eid/1-s2.0-S0926860X15301782-gr7.sml?httpAccept=%2A%2F%2A",
            "@multimediatype": "GIF image file",
            "@type": "IMAGE-THUMBNAIL",
            "@size": "9152",
            "@ref": "gr7",
            "@mimetype": "image/gif"
          },
          {
            "@category": "thumbnail",
            "@height": "127",
            "@width": "219",
            "@_fa": "true",
            "$": "https://api.elsevier.com/content/object/eid/1-s2.0-S0926860X15301782-gr8.sml?httpAccept=%2A%2F%2A",
            "@multimediatype": "GIF image file",
            "@type": "IMAGE-THUMBNAIL",
            "@size": "13697",
            "@ref": "gr8",
            "@mimetype": "image/gif"
          },
          {
            "@category": "thumbnail",
            "@height": "158",
            "@width": "219",
            "@_fa": "true",
            "$": "https://api.elsevier.com/content/object/eid/1-s2.0-S0926860X15301782-gr9.sml?httpAccept=%2A%2F%2A",
            "@multimediatype": "GIF image file",
            "@type": "IMAGE-THUMBNAIL",
            "@size": "13739",
            "@ref": "gr9",
            "@mimetype": "image/gif"
          },
          {
            "@category": "standard",
            "@height": "200",
            "@width": "500",
            "@_fa": "true",
            "$": "https://api.elsevier.com/content/object/eid/1-s2.0-S0926860X15301782-fx1.jpg?httpAccept=%2A%2F%2A",
            "@multimediatype": "JPEG image file",
            "@type": "IMAGE-DOWNSAMPLED",
            "@size": "13881",
            "@ref": "fx1",
            "@mimetype": "image/jpeg"
          },
          {
            "@category": "standard",
            "@height": "200",
            "@width": "500",
            "@_fa": "true",
            "$": "https://api.elsevier.com/content/object/eid/1-s2.0-S0926860X15301782-fx2.jpg?httpAccept=%2A%2F%2A",
            "@multimediatype": "JPEG image file",
            "@type": "IMAGE-DOWNSAMPLED",
            "@size": "8659",
            "@ref": "fx2",
            "@mimetype": "image/jpeg"
          },
          {
            "@category": "standard",
            "@height": "294",
            "@width": "470",
            "@_fa": "true",
            "$": "https://api.elsevier.com/content/object/eid/1-s2.0-S0926860X15301782-gr1.jpg?httpAccept=%2A%2F%2A",
            "@multimediatype": "JPEG image file",
            "@type": "IMAGE-DOWNSAMPLED",
            "@size": "57382",
            "@ref": "gr1",
            "@mimetype": "image/jpeg"
          },
          {
            "@category": "standard",
            "@height": "404",
            "@width": "659",
            "@_fa": "true",
            "$": "https://api.elsevier.com/content/object/eid/1-s2.0-S0926860X15301782-gr10.jpg?httpAccept=%2A%2F%2A",
            "@multimediatype": "JPEG image file",
            "@type": "IMAGE-DOWNSAMPLED",
            "@size": "80921",
            "@ref": "gr10",
            "@mimetype": "image/jpeg"
          },
          {
            "@category": "standard",
            "@height": "298",
            "@width": "470",
            "@_fa": "true",
            "$": "https://api.elsevier.com/content/object/eid/1-s2.0-S0926860X15301782-gr2.jpg?httpAccept=%2A%2F%2A",
            "@multimediatype": "JPEG image file",
            "@type": "IMAGE-DOWNSAMPLED",
            "@size": "68137",
            "@ref": "gr2",
            "@mimetype": "image/jpeg"
          },
          {
            "@category": "standard",
            "@height": "322",
            "@width": "470",
            "@_fa": "true",
            "$": "https://api.elsevier.com/content/object/eid/1-s2.0-S0926860X15301782-gr3.jpg?httpAccept=%2A%2F%2A",
            "@multimediatype": "JPEG image file",
            "@type": "IMAGE-DOWNSAMPLED",
            "@size": "38697",
            "@ref": "gr3",
            "@mimetype": "image/jpeg"
          },
          {
            "@category": "standard",
            "@height": "272",
            "@width": "470",
            "@_fa": "true",
            "$": "https://api.elsevier.com/content/object/eid/1-s2.0-S0926860X15301782-gr4.jpg?httpAccept=%2A%2F%2A",
            "@multimediatype": "JPEG image file",
            "@type": "IMAGE-DOWNSAMPLED",
            "@size": "45011",
            "@ref": "gr4",
            "@mimetype": "image/jpeg"
          },
          {
            "@category": "standard",
            "@height": "302",
            "@width": "470",
            "@_fa": "true",
            "$": "https://api.elsevier.com/content/object/eid/1-s2.0-S0926860X15301782-gr5.jpg?httpAccept=%2A%2F%2A",
            "@multimediatype": "JPEG image file",
            "@type": "IMAGE-DOWNSAMPLED",
            "@size": "36910",
            "@ref": "gr5",
            "@mimetype": "image/jpeg"
          },
          {
            "@category": "standard",
            "@height": "324",
            "@width": "470",
            "@_fa": "true",
            "$": "https://api.elsevier.com/content/object/eid/1-s2.0-S0926860X15301782-gr6.jpg?httpAccept=%2A%2F%2A",
            "@multimediatype": "JPEG image file",
            "@type": "IMAGE-DOWNSAMPLED",
            "@size": "41819",
            "@ref": "gr6",
            "@mimetype": "image/jpeg"
          },
          {
            "@category": "standard",
            "@height": "302",
            "@width": "470",
            "@_fa": "true",
            "$": "https://api.elsevier.com/content/object/eid/1-s2.0-S0926860X15301782-gr7.jpg?httpAccept=%2A%2F%2A",
            "@multimediatype": "JPEG image file",
            "@type": "IMAGE-DOWNSAMPLED",
            "@size": "39968",
            "@ref": "gr7",
            "@mimetype": "image/jpeg"
          },
          {
            "@category": "standard",
            "@height": "383",
            "@width": "659",
            "@_fa": "true",
            "$": "https://api.elsevier.com/content/object/eid/1-s2.0-S0926860X15301782-gr8.jpg?httpAccept=%2A%2F%2A",
            "@multimediatype": "JPEG image file",
            "@type": "IMAGE-DOWNSAMPLED",
            "@size": "80540",
            "@ref": "gr8",
            "@mimetype": "image/jpeg"
          },
          {
            "@category": "standard",
            "@height": "474",
            "@width": "659",
            "@_fa": "true",
            "$": "https://api.elsevier.com/content/object/eid/1-s2.0-S0926860X15301782-gr9.jpg?httpAccept=%2A%2F%2A",
            "@multimediatype": "JPEG image file",
            "@type": "IMAGE-DOWNSAMPLED",
            "@size": "79995",
            "@ref": "gr9",
            "@mimetype": "image/jpeg"
          },
          {
            "@category": "high",
            "@height": "886",
            "@width": "2213",
            "@_fa": "true",
            "$": "https://api.elsevier.com/content/object/eid/1-s2.0-S0926860X15301782-fx1_lrg.jpg?httpAccept=%2A%2F%2A",
            "@multimediatype": "JPEG image file",
            "@type": "IMAGE-HIGH-RES",
            "@size": "110190",
            "@ref": "fx1",
            "@mimetype": "image/jpeg"
          },
          {
            "@category": "high",
            "@height": "886",
            "@width": "2213",
            "@_fa": "true",
            "$": "https://api.elsevier.com/content/object/eid/1-s2.0-S0926860X15301782-fx2_lrg.jpg?httpAccept=%2A%2F%2A",
            "@multimediatype": "JPEG image file",
            "@type": "IMAGE-HIGH-RES",
            "@size": "63668",
            "@ref": "fx2",
            "@mimetype": "image/jpeg"
          },
          {
            "@category": "high",
            "@height": "1304",
            "@width": "2083",
            "@_fa": "true",
            "$": "https://api.elsevier.com/content/object/eid/1-s2.0-S0926860X15301782-gr1_lrg.jpg?httpAccept=%2A%2F%2A",
            "@multimediatype": "JPEG image file",
            "@type": "IMAGE-HIGH-RES",
            "@size": "380819",
            "@ref": "gr1",
            "@mimetype": "image/jpeg"
          },
          {
            "@category": "high",
            "@height": "1787",
            "@width": "2917",
            "@_fa": "true",
            "$": "https://api.elsevier.com/content/object/eid/1-s2.0-S0926860X15301782-gr10_lrg.jpg?httpAccept=%2A%2F%2A",
            "@multimediatype": "JPEG image file",
            "@type": "IMAGE-HIGH-RES",
            "@size": "376401",
            "@ref": "gr10",
            "@mimetype": "image/jpeg"
          },
          {
            "@category": "high",
            "@height": "1322",
            "@width": "2083",
            "@_fa": "true",
            "$": "https://api.elsevier.com/content/object/eid/1-s2.0-S0926860X15301782-gr2_lrg.jpg?httpAccept=%2A%2F%2A",
            "@multimediatype": "JPEG image file",
            "@type": "IMAGE-HIGH-RES",
            "@size": "378144",
            "@ref": "gr2",
            "@mimetype": "image/jpeg"
          },
          {
            "@category": "high",
            "@height": "1427",
            "@width": "2083",
            "@_fa": "true",
            "$": "https://api.elsevier.com/content/object/eid/1-s2.0-S0926860X15301782-gr3_lrg.jpg?httpAccept=%2A%2F%2A",
            "@multimediatype": "JPEG image file",
            "@type": "IMAGE-HIGH-RES",
            "@size": "181439",
            "@ref": "gr3",
            "@mimetype": "image/jpeg"
          },
          {
            "@category": "high",
            "@height": "1204",
            "@width": "2083",
            "@_fa": "true",
            "$": "https://api.elsevier.com/content/object/eid/1-s2.0-S0926860X15301782-gr4_lrg.jpg?httpAccept=%2A%2F%2A",
            "@multimediatype": "JPEG image file",
            "@type": "IMAGE-HIGH-RES",
            "@size": "184336",
            "@ref": "gr4",
            "@mimetype": "image/jpeg"
          },
          {
            "@category": "high",
            "@height": "1340",
            "@width": "2083",
            "@_fa": "true",
            "$": "https://api.elsevier.com/content/object/eid/1-s2.0-S0926860X15301782-gr5_lrg.jpg?httpAccept=%2A%2F%2A",
            "@multimediatype": "JPEG image file",
            "@type": "IMAGE-HIGH-RES",
            "@size": "173449",
            "@ref": "gr5",
            "@mimetype": "image/jpeg"
          },
          {
            "@category": "high",
            "@height": "1436",
            "@width": "2083",
            "@_fa": "true",
            "$": "https://api.elsevier.com/content/object/eid/1-s2.0-S0926860X15301782-gr6_lrg.jpg?httpAccept=%2A%2F%2A",
            "@multimediatype": "JPEG image file",
            "@type": "IMAGE-HIGH-RES",
            "@size": "193940",
            "@ref": "gr6",
            "@mimetype": "image/jpeg"
          },
          {
            "@category": "high",
            "@height": "1340",
            "@width": "2083",
            "@_fa": "true",
            "$": "https://api.elsevier.com/content/object/eid/1-s2.0-S0926860X15301782-gr7_lrg.jpg?httpAccept=%2A%2F%2A",
            "@multimediatype": "JPEG image file",
            "@type": "IMAGE-HIGH-RES",
            "@size": "162606",
            "@ref": "gr7",
            "@mimetype": "image/jpeg"
          },
          {
            "@category": "high",
            "@height": "1697",
            "@width": "2917",
            "@_fa": "true",
            "$": "https://api.elsevier.com/content/object/eid/1-s2.0-S0926860X15301782-gr8_lrg.jpg?httpAccept=%2A%2F%2A",
            "@multimediatype": "JPEG image file",
            "@type": "IMAGE-HIGH-RES",
            "@size": "413265",
            "@ref": "gr8",
            "@mimetype": "image/jpeg"
          },
          {
            "@category": "high",
            "@height": "2098",
            "@width": "2917",
            "@_fa": "true",
            "$": "https://api.elsevier.com/content/object/eid/1-s2.0-S0926860X15301782-gr9_lrg.jpg?httpAccept=%2A%2F%2A",
            "@multimediatype": "JPEG image file",
            "@type": "IMAGE-HIGH-RES",
            "@size": "400475",
            "@ref": "gr9",
            "@mimetype": "image/jpeg"
          },
          {
            "@category": "standard",
            "@_fa": "true",
            "$": "https://api.elsevier.com/content/object/eid/1-s2.0-S0926860X15301782-mmc1.docx?httpAccept=%2A%2F%2A",
            "@multimediatype": "Microsoft Word file",
            "@type": "APPLICATION",
            "@size": "6268323",
            "@ref": "mmc1",
            "@mimetype": "application/word"
          }
        ]
      },
      "link": {
        "@rel": "abstract",
        "@href": "https://api.elsevier.com/content/abstract/scopus_id/84944717398"
      }
    }
  }
}