{
  "metadata": {
    "title": "Ethyl palmitate decarboxylation using colloidal SiO<ce:inf loc=post>2</ce:inf>- templated mesoporous Ni-ZrO<ce:inf loc=post>2</ce:inf> catalysts",
    "authors": "; ; ",
    "journal": "Applied Catalysis A: General",
    "date": "2024-01-25",
    "doi": "10.1016/j.apcata.2023.119547",
    "abstract": "",
    "uri": "https://api.elsevier.com/content/article/pii/S0926860X23005276",
    "pii": "S0926860X23005276"
  },
  "fulltext": {
    "full-text-retrieval-response": {
      "scopus-eid": "2-s2.0-85181733214",
      "originalText": "serial JL 271346 291210 291744 291809 31 Applied Catalysis A: General APPLIEDCATALYSISAGENERAL 2023-12-20 2023-12-20 2024-01-02 2024-01-02 2024-01-19T20:53:16 1-s2.0-S0926860X23005276 S0926-860X(23)00527-6 S0926860X23005276 10.1016/j.apcata.2023.119547 S300 S300.1 FULL-TEXT 1-s2.0-S0926860X23X00210 2024-02-07T11:24:12.852236Z 0 0 20240125 2024 2023-12-20T02:31:28.168719Z absattachment articleinfo articlenumber articletitlenorm authfirstinitialnorm authfirstsurnamenorm cid cids contenttype copyright crossmark dateloaded dateloadedtxt datesearch datesort dateupdated dco docsubtype doctype doi eid ewtransactionid hubeid indexeddate issn issnnorm itemstage itemtransactionid itemweight openaccess openarchive pg pgfirst pii piinorm pubdatestart pubdatetxt pubyr sortorder srctitle srctitlenorm srctype ssids alllist content subj subheadings suppl tomb volfirst volissue volumelist webpdf webpdfpagecount yearnav figure table e-component body mmlmath acknowledge affil appendices articletitle auth authfirstini authfull authkeywords authlast grantnumber grantsponsor grantsponsorid highlightsabst primabst ref specialabst 0926-860X 0926860X true 670 670 C Volume 670 27 119547 119547 119547 20240125 25 January 2024 2024-01-25 2024 article fla © 2023 Elsevier B.V. All rights reserved. ETHYLPALMITATEDECARBOXYLATIONUSINGCOLLOIDALSIO2TEMPLATEDMESOPOROUSNIZRO2CATALYSTS CHAVARRIAESCAMILLA H 1 Introduction 2 Experimental 2.1 Chemicals 2.2 Catalyst preparation 2.3 Catalyst characterization 2.4 Catalytic test 2.5 Quantum chemical modeling 3 Results and discussion 3.1 Catalyst characterization 3.1.1 Thermal analysis 3.1.2 Elemental composition 3.1.3 X-ray diffraction 3.1.4 Scanning electron microscopy (SEM) 3.1.5 Textural analysis 3.1.6 High-resolution transmission electron microscopy 3.1.7 Fourier Transform Infrared Spectroscopy 3.1.8 29Si-MAS NMR 3.1.9 Temperature programed reduction (TPR) 3.1.10 X-ray photoelectron spectroscopy 3.2 Decarboxylation (DCO2) of ethyl palmitate 3.3 Quantum chemical modeling 4 Conclusions CRediT authorship contribution statement Acknowledgment Appendix A Supplementary material References RATHOR 2016 380 393 D SIMAKOVA 2010 28 31 I LESTARIA 2009 1109 1119 S LAPUERTA 2010 3106 3113 M HOEKMAN 2009 14 22 S VERIANSYAH 2012 578 585 B PENG 2013 4732 4741 B SANTILLANJIMENEZ 2013 1010 1017 E BERENBLYUM 2011 336 341 A IMMER 2010 5291 5299 J KALNES 2007 T YANG 2013 165 174 Y PINTO 2014 84 93 F ZUO 2012 3747 3755 H VILJAVA 2000 83 92 T LAURENT 1994 281 291 E DAROCHAFILHO 1993 543 549 G MORGAN 2012 346 355 T PENG 2012 2072 2075 B SNARE 2006 5708 5715 M PENG 2012 9400 9405 B GU 2014 313 344 D RUMPLECKER 2007 485 496 A KRAUPNER 2010 6019 A BRUNAUER 1938 309 319 S BARRETT 1951 373 380 E DELLEY 1990 508 517 B DELLEY 2000 7756 7764 B PERDEW 1996 3865 3868 J TKATCHENKO 2009 073005 A CHERMETTE 1999 129 154 H BAHAMON 2021 2947 2957 D DONGARE 2004 80 86 M DONGARE 2001 209 216 M KUNDAKOVIC 1998 13 29 L JUDGE 1971 1772 J KNOTTER 2000 4345 4351 D VEYTIZOU 2001 315 323 C TYAGI 2010 699 709 B ZHANG 2011 572 579 Y ZHANG 2010 27 32 Y MERCERA 1990 127 148 P BERRY 1999 3631 3638 F THOMMES 2015 1051 1069 M VALENTE 2009 5809 5818 J ZITOUNI 2021 120783 A ELVIRA 2013 120 131 M LEE 1988 2951 2959 S FIDALGO 2001 144 154 A COMITE 2003 151 165 A IANNAZZO 2003 49 68 V ABOELFETOH 2009 83 94 E LAPINA 2011 47 57 O AVENDANO 2005 133 138 R PIETROGIACOMI 2021 2495 D MORI 2003 79 85 H GROSVENOR 2006 1771 1779 A CARLEY 1999 L868 L874 A LONGXIANG 1996 99 104 T ECHEANDIA 2010 1 12 S PECK 2012 4483 4490 M WANG 2013 1638 1651 N KESAVAN 2017 10331 10340 J GANDLA 2015 S HALIM 2016 406 417 J WANG 2016 27 34 X OYEYEMI 2015 3429 3439 V FRAGOSOMONTESDEOCA 2022 126659 A PESTMAN 1997 255 264 R PESTMAN 1998 142 152 R SELAKOVIC 2022 Z FORAITA 2015 2423 2434 S MIAO 2016 4048 4058 B LOPEZ 2020 110452 M LARMIER 2017 2358 2363 K CHAVARRIAESCAMILLAX2024X119547 CHAVARRIAESCAMILLAX2024X119547XH 2026-01-02T00:00:00.000Z 2026-01-02T00:00:00.000Z http://creativecommons.org/licenses/by-nc-nd/4.0/ © 2023 Elsevier B.V. All rights reserved. 2024-01-12T13:40:30.416Z http://vtw.elsevier.com/data/voc/AddOnTypes/50.7/aggregated-refined CONACYT 61048 CONACYT Consejo Nacional de Ciencia y Tecnología http://data.elsevier.com/vocabulary/SciValFunders/501100003141 http://sws.geonames.org/3996063/ To CONACYT for the grant awarded for the completion of PhD studies and the IMP D.61048 project for their financial support used to carry out the experimental tests in the present investigation. https://doi.org/10.15223/policy-017 https://doi.org/10.15223/policy-037 https://doi.org/10.15223/policy-012 https://doi.org/10.15223/policy-029 https://doi.org/10.15223/policy-004 item S0926-860X(23)00527-6 S0926860X23005276 1-s2.0-S0926860X23005276 10.1016/j.apcata.2023.119547 271346 2024-02-07T11:24:12.852236Z 2024-01-25 1-s2.0-S0926860X23005276-main.pdf https://s3-eu-west-1.amazonaws.com/prod-ucs-content-store-eu-west/content/pii:S0926860X23005276/MAIN/application/pdf/158faf5ec86127ae898d13131bd91c0f/main.pdf main.pdf pdf true 9572861 MAIN 15 1-s2.0-S0926860X23005276-main_1.png https://s3-eu-west-1.amazonaws.com/prod-ucs-content-store-eu-west/content/pii:S0926860X23005276/PREVIEW/image/png/eb089581ddcedb4eba85ba0e43f770cb/main_1.png main_1.png png 55415 849 656 IMAGE-WEB-PDF 1 1-s2.0-S0926860X23005276-sc1.jpg https://s3-eu-west-1.amazonaws.com/prod-ucs-content-store-eu-west/content/pii:S0926860X23005276/sc1/DOWNSAMPLED/image/jpeg/dbd793c6c46b08b6b64c0de139cebad2/sc1.jpg sc1 sc1.jpg jpg 25820 190 678 IMAGE-DOWNSAMPLED 1-s2.0-S0926860X23005276-gr1.jpg https://s3-eu-west-1.amazonaws.com/prod-ucs-content-store-eu-west/content/pii:S0926860X23005276/gr1/DOWNSAMPLED/image/jpeg/bcfc5ffc44d1b531f9dec09bf0545c42/gr1.jpg gr1 gr1.jpg jpg 15535 181 339 IMAGE-DOWNSAMPLED 1-s2.0-S0926860X23005276-ga1.jpg https://s3-eu-west-1.amazonaws.com/prod-ucs-content-store-eu-west/content/pii:S0926860X23005276/ga1/DOWNSAMPLED/image/jpeg/fdce6a49b1b43efbbaa31a75d79f37ba/ga1.jpg ga1 true ga1.jpg jpg 20883 200 355 IMAGE-DOWNSAMPLED 1-s2.0-S0926860X23005276-gr3.jpg https://s3-eu-west-1.amazonaws.com/prod-ucs-content-store-eu-west/content/pii:S0926860X23005276/gr3/DOWNSAMPLED/image/jpeg/a4dc71955a24c0406a28963d47193899/gr3.jpg gr3 gr3.jpg jpg 33442 303 395 IMAGE-DOWNSAMPLED 1-s2.0-S0926860X23005276-gr11.jpg https://s3-eu-west-1.amazonaws.com/prod-ucs-content-store-eu-west/content/pii:S0926860X23005276/gr11/DOWNSAMPLED/image/jpeg/8d27e8b6c979c8c6e4ff7e7d02a3e382/gr11.jpg gr11 gr11.jpg jpg 44229 693 282 IMAGE-DOWNSAMPLED 1-s2.0-S0926860X23005276-gr2.jpg https://s3-eu-west-1.amazonaws.com/prod-ucs-content-store-eu-west/content/pii:S0926860X23005276/gr2/DOWNSAMPLED/image/jpeg/793b46e0f542e4b4fa5a666797f1c39c/gr2.jpg gr2 gr2.jpg jpg 80856 821 565 IMAGE-DOWNSAMPLED 1-s2.0-S0926860X23005276-gr12.jpg https://s3-eu-west-1.amazonaws.com/prod-ucs-content-store-eu-west/content/pii:S0926860X23005276/gr12/DOWNSAMPLED/image/jpeg/c27e5c9d75ff9236009e3a3f04c5e2fc/gr12.jpg gr12 gr12.jpg jpg 18583 228 226 IMAGE-DOWNSAMPLED 1-s2.0-S0926860X23005276-gr5.jpg https://s3-eu-west-1.amazonaws.com/prod-ucs-content-store-eu-west/content/pii:S0926860X23005276/gr5/DOWNSAMPLED/image/jpeg/cc6ec5c0fff45b1d12f760a471a83ca5/gr5.jpg gr5 gr5.jpg jpg 35611 308 395 IMAGE-DOWNSAMPLED 1-s2.0-S0926860X23005276-gr4.jpg https://s3-eu-west-1.amazonaws.com/prod-ucs-content-store-eu-west/content/pii:S0926860X23005276/gr4/DOWNSAMPLED/image/jpeg/ac9fa230b875631a488350ff800cfc1f/gr4.jpg gr4 gr4.jpg jpg 92723 944 339 IMAGE-DOWNSAMPLED 1-s2.0-S0926860X23005276-gr10.jpg https://s3-eu-west-1.amazonaws.com/prod-ucs-content-store-eu-west/content/pii:S0926860X23005276/gr10/DOWNSAMPLED/image/jpeg/285d3246fd77a9a44b4e71f3894732e9/gr10.jpg gr10 gr10.jpg jpg 47886 724 282 IMAGE-DOWNSAMPLED 1-s2.0-S0926860X23005276-gr7.jpg https://s3-eu-west-1.amazonaws.com/prod-ucs-content-store-eu-west/content/pii:S0926860X23005276/gr7/DOWNSAMPLED/image/jpeg/4383e39b40161587657d904ca0dbe080/gr7.jpg gr7 gr7.jpg jpg 62194 564 565 IMAGE-DOWNSAMPLED 1-s2.0-S0926860X23005276-gr15.jpg https://s3-eu-west-1.amazonaws.com/prod-ucs-content-store-eu-west/content/pii:S0926860X23005276/gr15/DOWNSAMPLED/image/jpeg/febb7543f280a88c36989690b64ed1c7/gr15.jpg gr15 gr15.jpg jpg 100791 757 565 IMAGE-DOWNSAMPLED 1-s2.0-S0926860X23005276-gr6.jpg https://s3-eu-west-1.amazonaws.com/prod-ucs-content-store-eu-west/content/pii:S0926860X23005276/gr6/DOWNSAMPLED/image/jpeg/7232626f1cf3baa1c624e166da4f465d/gr6.jpg gr6 gr6.jpg jpg 144835 813 565 IMAGE-DOWNSAMPLED 1-s2.0-S0926860X23005276-gr9.jpg https://s3-eu-west-1.amazonaws.com/prod-ucs-content-store-eu-west/content/pii:S0926860X23005276/gr9/DOWNSAMPLED/image/jpeg/487bb86cafb637e27dc0cbbe0901606c/gr9.jpg gr9 gr9.jpg jpg 23035 280 339 IMAGE-DOWNSAMPLED 1-s2.0-S0926860X23005276-gr13.jpg https://s3-eu-west-1.amazonaws.com/prod-ucs-content-store-eu-west/content/pii:S0926860X23005276/gr13/DOWNSAMPLED/image/jpeg/518ee8e8c436d7bd8fb92645585bacb9/gr13.jpg gr13 gr13.jpg jpg 59576 368 508 IMAGE-DOWNSAMPLED 1-s2.0-S0926860X23005276-gr8.jpg https://s3-eu-west-1.amazonaws.com/prod-ucs-content-store-eu-west/content/pii:S0926860X23005276/gr8/DOWNSAMPLED/image/jpeg/7c47d59cc15108a97cf4e24833edeeb3/gr8.jpg gr8 gr8.jpg jpg 27702 299 395 IMAGE-DOWNSAMPLED 1-s2.0-S0926860X23005276-gr14.jpg https://s3-eu-west-1.amazonaws.com/prod-ucs-content-store-eu-west/content/pii:S0926860X23005276/gr14/DOWNSAMPLED/image/jpeg/02ad1ca5c6a2ed3c38605f5383dc289a/gr14.jpg gr14 gr14.jpg jpg 48956 299 565 IMAGE-DOWNSAMPLED 1-s2.0-S0926860X23005276-sc1.sml https://s3-eu-west-1.amazonaws.com/prod-ucs-content-store-eu-west/content/pii:S0926860X23005276/sc1/THUMBNAIL/image/gif/0311690ad91d12274f18ce5c49518012/sc1.sml sc1 sc1.sml sml 3834 61 219 IMAGE-THUMBNAIL 1-s2.0-S0926860X23005276-gr1.sml https://s3-eu-west-1.amazonaws.com/prod-ucs-content-store-eu-west/content/pii:S0926860X23005276/gr1/THUMBNAIL/image/gif/767f87a674c562475a4663c1d59cc7c1/gr1.sml gr1 gr1.sml sml 9700 117 219 IMAGE-THUMBNAIL 1-s2.0-S0926860X23005276-ga1.sml https://s3-eu-west-1.amazonaws.com/prod-ucs-content-store-eu-west/content/pii:S0926860X23005276/ga1/THUMBNAIL/image/gif/07c5d9024de9606bbf3eb2deb7141c77/ga1.sml ga1 true ga1.sml sml 10309 123 219 IMAGE-THUMBNAIL 1-s2.0-S0926860X23005276-gr3.sml https://s3-eu-west-1.amazonaws.com/prod-ucs-content-store-eu-west/content/pii:S0926860X23005276/gr3/THUMBNAIL/image/gif/c6cfcf208724e0f775dfa5a77ad3885e/gr3.sml gr3 gr3.sml sml 9562 164 214 IMAGE-THUMBNAIL 1-s2.0-S0926860X23005276-gr11.sml https://s3-eu-west-1.amazonaws.com/prod-ucs-content-store-eu-west/content/pii:S0926860X23005276/gr11/THUMBNAIL/image/gif/7900c08819dca588541b1e650a912f65/gr11.sml gr11 gr11.sml sml 4405 162 66 IMAGE-THUMBNAIL 1-s2.0-S0926860X23005276-gr2.sml https://s3-eu-west-1.amazonaws.com/prod-ucs-content-store-eu-west/content/pii:S0926860X23005276/gr2/THUMBNAIL/image/gif/a5f53a5660825f72e3c7c79c20f33e5c/gr2.sml gr2 gr2.sml sml 4203 164 113 IMAGE-THUMBNAIL 1-s2.0-S0926860X23005276-gr12.sml https://s3-eu-west-1.amazonaws.com/prod-ucs-content-store-eu-west/content/pii:S0926860X23005276/gr12/THUMBNAIL/image/gif/79897208efe894cf145da8b8e0d2f862/gr12.sml gr12 gr12.sml sml 17902 164 162 IMAGE-THUMBNAIL 1-s2.0-S0926860X23005276-gr5.sml https://s3-eu-west-1.amazonaws.com/prod-ucs-content-store-eu-west/content/pii:S0926860X23005276/gr5/THUMBNAIL/image/gif/d1da80135f34639fe33575c36ad784eb/gr5.sml gr5 gr5.sml sml 9022 164 210 IMAGE-THUMBNAIL 1-s2.0-S0926860X23005276-gr4.sml https://s3-eu-west-1.amazonaws.com/prod-ucs-content-store-eu-west/content/pii:S0926860X23005276/gr4/THUMBNAIL/image/gif/9383e8fdbb5e6de2bf4ddf42a8cff934/gr4.sml gr4 gr4.sml sml 7154 162 58 IMAGE-THUMBNAIL 1-s2.0-S0926860X23005276-gr10.sml https://s3-eu-west-1.amazonaws.com/prod-ucs-content-store-eu-west/content/pii:S0926860X23005276/gr10/THUMBNAIL/image/gif/13342906c0bf5ede29aa504afe7216aa/gr10.sml gr10 gr10.sml sml 4434 162 63 IMAGE-THUMBNAIL 1-s2.0-S0926860X23005276-gr7.sml https://s3-eu-west-1.amazonaws.com/prod-ucs-content-store-eu-west/content/pii:S0926860X23005276/gr7/THUMBNAIL/image/gif/f7a59479208a3237409ebe8d68ceef39/gr7.sml gr7 gr7.sml sml 10834 164 164 IMAGE-THUMBNAIL 1-s2.0-S0926860X23005276-gr15.sml https://s3-eu-west-1.amazonaws.com/prod-ucs-content-store-eu-west/content/pii:S0926860X23005276/gr15/THUMBNAIL/image/gif/de79e3999eaf55a87a7f4f90e43785c6/gr15.sml gr15 gr15.sml sml 9874 163 122 IMAGE-THUMBNAIL 1-s2.0-S0926860X23005276-gr6.sml https://s3-eu-west-1.amazonaws.com/prod-ucs-content-store-eu-west/content/pii:S0926860X23005276/gr6/THUMBNAIL/image/gif/c0ee245e43da59a4d208d0fd3281b0fd/gr6.sml gr6 gr6.sml sml 12957 164 114 IMAGE-THUMBNAIL 1-s2.0-S0926860X23005276-gr9.sml https://s3-eu-west-1.amazonaws.com/prod-ucs-content-store-eu-west/content/pii:S0926860X23005276/gr9/THUMBNAIL/image/gif/62a204d3bcf3862a8939c1dded3d0a6c/gr9.sml gr9 gr9.sml sml 7534 164 198 IMAGE-THUMBNAIL 1-s2.0-S0926860X23005276-gr13.sml https://s3-eu-west-1.amazonaws.com/prod-ucs-content-store-eu-west/content/pii:S0926860X23005276/gr13/THUMBNAIL/image/gif/27c38da9975b23237b3486baff829f37/gr13.sml gr13 gr13.sml sml 17576 159 219 IMAGE-THUMBNAIL 1-s2.0-S0926860X23005276-gr8.sml https://s3-eu-west-1.amazonaws.com/prod-ucs-content-store-eu-west/content/pii:S0926860X23005276/gr8/THUMBNAIL/image/gif/edf757665db6e6708bd6b5ea43a5a504/gr8.sml gr8 gr8.sml sml 7477 164 217 IMAGE-THUMBNAIL 1-s2.0-S0926860X23005276-gr14.sml https://s3-eu-west-1.amazonaws.com/prod-ucs-content-store-eu-west/content/pii:S0926860X23005276/gr14/THUMBNAIL/image/gif/43b2fd4d9ce82be2ef03826d7043cd5d/gr14.sml gr14 gr14.sml sml 13494 116 219 IMAGE-THUMBNAIL 1-s2.0-S0926860X23005276-sc1_lrg.jpg https://s3-eu-west-1.amazonaws.com/prod-ucs-content-store-eu-west/content/pii:S0926860X23005276/HIGHRES/image/jpeg/2205958875085460b79f7cdf28bf34fc/sc1_lrg.jpg sc1 sc1_lrg.jpg jpg 122487 839 2994 IMAGE-HIGH-RES 1-s2.0-S0926860X23005276-gr1_lrg.jpg https://s3-eu-west-1.amazonaws.com/prod-ucs-content-store-eu-west/content/pii:S0926860X23005276/HIGHRES/image/jpeg/1e32a327de74f8214509a30b965a1981/gr1_lrg.jpg gr1 gr1_lrg.jpg jpg 70077 799 1497 IMAGE-HIGH-RES 1-s2.0-S0926860X23005276-ga1_lrg.jpg https://s3-eu-west-1.amazonaws.com/prod-ucs-content-store-eu-west/content/pii:S0926860X23005276/HIGHRES/image/jpeg/ed64d4cdf6170aad926c4588482035d6/ga1_lrg.jpg ga1 true ga1_lrg.jpg jpg 182031 886 1574 IMAGE-HIGH-RES 1-s2.0-S0926860X23005276-gr3_lrg.jpg https://s3-eu-west-1.amazonaws.com/prod-ucs-content-store-eu-west/content/pii:S0926860X23005276/HIGHRES/image/jpeg/8bf090afabc5e0d51d15a5204c6986d3/gr3_lrg.jpg gr3 gr3_lrg.jpg jpg 236411 1340 1746 IMAGE-HIGH-RES 1-s2.0-S0926860X23005276-gr11_lrg.jpg https://s3-eu-west-1.amazonaws.com/prod-ucs-content-store-eu-west/content/pii:S0926860X23005276/HIGHRES/image/jpeg/145105562a9c6daf6844fd48d496c13c/gr11_lrg.jpg gr11 gr11_lrg.jpg jpg 247783 3063 1247 IMAGE-HIGH-RES 1-s2.0-S0926860X23005276-gr2_lrg.jpg https://s3-eu-west-1.amazonaws.com/prod-ucs-content-store-eu-west/content/pii:S0926860X23005276/HIGHRES/image/jpeg/d3c80045046c243b360eb38960b96c6c/gr2_lrg.jpg gr2 gr2_lrg.jpg jpg 510145 3624 2495 IMAGE-HIGH-RES 1-s2.0-S0926860X23005276-gr12_lrg.jpg https://s3-eu-west-1.amazonaws.com/prod-ucs-content-store-eu-west/content/pii:S0926860X23005276/HIGHRES/image/jpeg/832993fcd572eef5a495d557060ed3e5/gr12_lrg.jpg gr12 gr12_lrg.jpg jpg 77728 1008 998 IMAGE-HIGH-RES 1-s2.0-S0926860X23005276-gr5_lrg.jpg https://s3-eu-west-1.amazonaws.com/prod-ucs-content-store-eu-west/content/pii:S0926860X23005276/HIGHRES/image/jpeg/92c1d0e55fb47c5cf60afb2886bd9e70/gr5_lrg.jpg gr5 gr5_lrg.jpg jpg 230574 1362 1746 IMAGE-HIGH-RES 1-s2.0-S0926860X23005276-gr4_lrg.jpg https://s3-eu-west-1.amazonaws.com/prod-ucs-content-store-eu-west/content/pii:S0926860X23005276/HIGHRES/image/jpeg/6f699b285a810ca3de24e636d393b808/gr4_lrg.jpg gr4 gr4_lrg.jpg jpg 454478 4169 1497 IMAGE-HIGH-RES 1-s2.0-S0926860X23005276-gr10_lrg.jpg https://s3-eu-west-1.amazonaws.com/prod-ucs-content-store-eu-west/content/pii:S0926860X23005276/HIGHRES/image/jpeg/f62c7c08295ab3432903b47e36b82e1c/gr10_lrg.jpg gr10 gr10_lrg.jpg jpg 294765 3201 1247 IMAGE-HIGH-RES 1-s2.0-S0926860X23005276-gr7_lrg.jpg https://s3-eu-west-1.amazonaws.com/prod-ucs-content-store-eu-west/content/pii:S0926860X23005276/HIGHRES/image/jpeg/44573cab3e2070c8eb455c4e798e2f6d/gr7_lrg.jpg gr7 gr7_lrg.jpg jpg 295435 2491 2495 IMAGE-HIGH-RES 1-s2.0-S0926860X23005276-gr15_lrg.jpg https://s3-eu-west-1.amazonaws.com/prod-ucs-content-store-eu-west/content/pii:S0926860X23005276/HIGHRES/image/jpeg/b25cfb2f6e612630190c1ba32dcd80a0/gr15_lrg.jpg gr15 gr15_lrg.jpg jpg 501693 3341 2495 IMAGE-HIGH-RES 1-s2.0-S0926860X23005276-gr6_lrg.jpg https://s3-eu-west-1.amazonaws.com/prod-ucs-content-store-eu-west/content/pii:S0926860X23005276/HIGHRES/image/jpeg/463a66ffe8e10aa6ca9f2c1e5b0ca3fc/gr6_lrg.jpg gr6 gr6_lrg.jpg jpg 871543 3591 2495 IMAGE-HIGH-RES 1-s2.0-S0926860X23005276-gr9_lrg.jpg https://s3-eu-west-1.amazonaws.com/prod-ucs-content-store-eu-west/content/pii:S0926860X23005276/HIGHRES/image/jpeg/77e408f9824a8ee0777c136e158f04f8/gr9_lrg.jpg gr9 gr9_lrg.jpg jpg 149780 1237 1498 IMAGE-HIGH-RES 1-s2.0-S0926860X23005276-gr13_lrg.jpg https://s3-eu-west-1.amazonaws.com/prod-ucs-content-store-eu-west/content/pii:S0926860X23005276/HIGHRES/image/jpeg/378aaf24c2c15a90c0ebbdede365d7fd/gr13_lrg.jpg gr13 gr13_lrg.jpg jpg 267648 1625 2245 IMAGE-HIGH-RES 1-s2.0-S0926860X23005276-gr8_lrg.jpg https://s3-eu-west-1.amazonaws.com/prod-ucs-content-store-eu-west/content/pii:S0926860X23005276/HIGHRES/image/jpeg/57e2b20bdca66c924be7806c015d8824/gr8_lrg.jpg gr8 gr8_lrg.jpg jpg 173721 1321 1748 IMAGE-HIGH-RES 1-s2.0-S0926860X23005276-gr14_lrg.jpg https://s3-eu-west-1.amazonaws.com/prod-ucs-content-store-eu-west/content/pii:S0926860X23005276/HIGHRES/image/jpeg/5f65b950fa0c15f9b9e6e3706a132fa6/gr14_lrg.jpg gr14 gr14_lrg.jpg jpg 212129 1322 2495 IMAGE-HIGH-RES 1-s2.0-S0926860X23005276-mmc1.docx https://s3-eu-west-1.amazonaws.com/prod-ucs-content-store-eu-west/content/pii:S0926860X23005276/mmc1/MAIN/application/vnd.openxmlformats-officedocument.wordprocessingml.document/474eb95fd46fcb97b8f10c38d8920c05/mmc1.docx mmc1 mmc1.docx docx 377655 APPLICATION 1-s2.0-S0926860X23005276-si0001.svg https://s3-eu-west-1.amazonaws.com/prod-ucs-content-store-eu-west/content/pii:S0926860X23005276/image/svg+xml/9c108e8a082331394324892f43af032c/si0001.svg si0001 si0001.svg svg 5385 ALTIMG 1-s2.0-S0926860X23005276-si0002.svg https://s3-eu-west-1.amazonaws.com/prod-ucs-content-store-eu-west/content/pii:S0926860X23005276/image/svg+xml/4372b2cceb89ab7b1e26061ed9d24535/si0002.svg si0002 si0002.svg svg 4850 ALTIMG 1-s2.0-S0926860X23005276-si0003.svg https://s3-eu-west-1.amazonaws.com/prod-ucs-content-store-eu-west/content/pii:S0926860X23005276/image/svg+xml/b8d4e52e43e740364f2cbf9697514c9e/si0003.svg si0003 si0003.svg svg 1353 ALTIMG 1-s2.0-S0926860X23005276-si0004.svg https://s3-eu-west-1.amazonaws.com/prod-ucs-content-store-eu-west/content/pii:S0926860X23005276/image/svg+xml/a8fcea6a2a43ba0784889e10549f97d7/si0004.svg si0004 si0004.svg svg 2228 ALTIMG 1-s2.0-S0926860X23005276-si0005.svg https://s3-eu-west-1.amazonaws.com/prod-ucs-content-store-eu-west/content/pii:S0926860X23005276/image/svg+xml/c0e17dc8169d1fa25c5d81337e717baf/si0005.svg si0005 si0005.svg svg 1353 ALTIMG 1-s2.0-S0926860X23005276-si0006.svg https://s3-eu-west-1.amazonaws.com/prod-ucs-content-store-eu-west/content/pii:S0926860X23005276/image/svg+xml/54d4e113b654b925f2fd39a9519bf843/si0006.svg si0006 si0006.svg svg 3055 ALTIMG 1-s2.0-S0926860X23005276-si0007.svg https://s3-eu-west-1.amazonaws.com/prod-ucs-content-store-eu-west/content/pii:S0926860X23005276/image/svg+xml/0b6a1d285c45816873d25c08413a1069/si0007.svg si0007 si0007.svg svg 911 ALTIMG 1-s2.0-S0926860X23005276-am.pdf am am.pdf pdf 3972066 AAM-PDF https://s3-eu-west-1.amazonaws.com/prod-ucs-content-store-eu-west/content/egi:10FXH4RNMH0/MAIN/application/pdf/c2e5a7ffb44a311bebd811b3afe21889/am.pdf APCATA 119547 119547 S0926-860X(23)00527-6 10.1016/j.apcata.2023.119547 Elsevier B.V. Fig. 1 Molecular model of a) pentanoic acid and b) possible sites of doping of ZrO2. Fig. 1 Fig. 2 a) DTA and b) TGA curves of 10 wt% Ni/ZrO2 dried samples. Fig. 2 Fig. 3 X-ray diffraction patterns of NiZrSi-0, NiZrSi-10 and NiZrSi-30 catalysts. Fig. 3 Fig. 4 Morphology by SEM images of the catalysts a) NiZrSi-0, b) NiZrSi-10 and c) NiZrSi-30. Fig. 4 Fig. 5 Adsorption-desorption isotherms and porous distribution (insert) of catalysts NiZrSi-0, NiZrSi-10, NiZrSi-30 and NiZrSi-30NL. Fig. 5 Fig. 6 HR-TEM images of the a) NiZrSi-0, b) NiZrSi-10 and c) NiZrSi-30 catalysts and their FFT corresponding of the inserts. Fig. 6 Fig. 7 ADF image of reduced samples a) NiZrSi-0, b) NiZrSi-10, c) NiZrSi-30 and d) Ni nanoparticle size distribution graph. Fig. 7 Fig. 8 Infrared spectra of NiZrSi-30NL and NiZrSi-X catalysts. Fig. 8 Fig. 9 29Si-MAS NMR spectrum of NiZrSi-10, NiZrSi-30 and NiZrSi-30NL catalysts. Fig. 9 Fig. 10 XPS deconvolution of Ni 2p3/2 of the a) NiZrSi-0, b) NiZrSi-10 and c) NiZrSi-30 reduced catalysts. Fig. 10 Fig. 11 XPS deconvolution of O 1s of: a) NiZrSi-0, b) NiZrSi-10 and c) NiZrSi-30 reduced catalysts. Fig. 11 Fig. 12 Geometry of cubic ZrO2 doped with Ni. Fig. 12 Fig. 13 HOMO and LUMO orbitals of doped and undoped NiZrO2. Fig. 13 Fig. 14 a) Possible crystallographic plane (1 0 0) for the symmetry of the system and b) Atomistic structure of the chemical model for the Zr22O46Ni2 surface. Fig. 14 Fig. 15 Decarboxylation route of carboxylic acid over Ni-ZrO2 catalysts. Fig. 15 Scheme 1 Proposed reaction pathways for ethyl palmitate deoxygenation to alkanes on mesoporous Ni-ZrO2 catalysts. Scheme 1 Table 1 Elemental chemical composition obtained by EDXS, wt%. Table 1 Catalyst Ni Zr O Si a Na b NiO NiZrSi-0 13.8 61.6 24.6 - - 17.4 NiZrSi-10 10.1 59.0 25.9 5.0 - 12.8 NiZrSi-30 8.6 46.6 31.6 11.3 1.9 11.0 a Residual SiO2 (not leached on alkaline treatment). b Sodium remaining from the alkaline treatment used to remove SiO2. Table 2 Textural properties of NiZrSi-x catalysts. Table 2 Catalyst a Specific Surface Area (m2/g) Total Pore Volume (cm3/g) NiZrSi-0 52 0.07 NiZrSi-10 176 0.12 NiZrSi-30 312 0.35 NiZrSi-30NL 256 0.25 a Solids outgassed at 300 °C before measurements. Table 3 Surface atomic ratios of reduced NiZrSi-X catalysts. Table 3 Catalyst Binding Energy (eV) MD a Ni0/NiT b (%) Ni2+ Ni0 Ni δ (+) NiZrSi-0 855.6 857.8 852.6 --- 0.047 8.96 NiZrSi-10 856.5 858.8 --- 854.1 0.066 24.36 NiZrSi-30 854.8 856.9 852.8 --- 0.043 11.61 a Metallic dispersion (Ni/Ni+Zr+Si). b Ni reduced or partially reduced percentage on the surface. Table 4 O 1 s species of the reduced NiZrSi-X catalysts. Table 4 Catalyst Binding Energy (eV) Ovac / Olattice Lattice Vacancy Si-O-Si or M-OH H2O ads NiZrSi-0 530.1 531.4 532.8 -- 0.40 NiZrSi-10 530.5 531.9 533.1 534.6 0.96 NiZrSi-30 530.5 531.8 532.8 534.1 1.47 Table 5 Conversion and selectivity in the decarboxylation of ethyl palmitate. Table 5 Catalysts Selectivity (%) X (%) C 15 /C 16 ratio n-C 15 C 16 Hexadecanoic acid Other paraffins a Other Products b n-C 16 C 16 = NiZrSi-0 44.6 2.4 18.6 17.0 1.8 15.6 78.2 2.1 NiZrSi-10 70.6 3.9 1.5 4.8 6.0 13.2 94.1 13.1 NiZrSi-30 43.2 22.2 5.4 16.7 1.9 10.6 57.9 1.6 NiZrSi-30NL 5.2 8.2 7.7 47.6 2.4 28.9 32.4 0.3 a Other paraffins: Ethane / Pentane / Hexane / Heptane / Octane / Tetradecane / Heptadecane; b Other products: Ethanol / Naphthalene decahydro-2-methyl / Heptylcyclohexane / Cyclohexane, (4-methylpentyl) / Naphthalene 1,2,3,4-tetrahydro-5-methyl / Naphthalene 1-methyl / Naphthalene 1,2,3,4 -tetrahydro-1,4-dimethyl / 5-dodecanone. Table 6 Composition of gas phase products. Table 6 Catalyst Composition (mol%) H2 CO2 CO CH4 C2 C3 C4 C5/C6 + NiZrSi-0 95.40 0.04 0 4.45 0.08 0 0.01 0.02 NiZrSi-10 86.67 0.07 0 13.18 0.06 0.01 0 0.01 NiZrSi-30 93.97 0.02 0 5.75 0.16 0.06 0.03 0.01 NiZrSi-30NL 99.54 0.01 0.03 0.10 0.22 0 0 0.10 Table 7 E gap of the two systems. Table 7 System E gap (kcal/mol) Zr4O8 65.260 Zr3O7Ni1 26.167 Ethyl palmitate decarboxylation using colloidal SiO2- templated mesoporous Ni-ZrO2 catalysts Chavarria-Escamilla Hervey G. Chavarría-Escamilla Data curation Investigation Writing – original draft a Angeles-Chavez Carlos Ángeles-Chávez Investigation Methodology a Carolina Zuriaga-Monroy Methodology Software a Martinez-Magadan José M. Martínez-Magadán Software Visualization a Cortes-Jacome María A. Cortés-Jácome Investigation Methodology a Lopez-Salinas Esteban López-Salinas Formal analysis Validation a Cedeno-Caero L. Cedeño-Caero b José A. Toledo-Antonio a ⁎ a Instituto Mexicano del Petróleo, Eje Central Lázaro Cárdenas # 152, Ciudad de México 07730, Mexico Instituto Mexicano del Petróleo Eje Central Lázaro Cárdenas # 152 Ciudad de México 07730 Mexico Instituto Mexicano del Petróleo, Eje Central Lázaro Cárdenas # 152, Ciudad de México, 07730, México b UNICAT, Departamento de Ingeniería Química, Facultad de Química, Universidad Nacional Autónoma de México, Ciudad de México 04510, Mexico UNICAT, Departamento de Ingeniería Química, Facultad de Química, Universidad Nacional Autónoma de México Ciudad de México 04510 Mexico UNICAT, Departamento de Ingeniería Química, Facultad de Química, Universidad Nacional Autónoma de México, Ciudad de México, 04510, México ⁎ Corresponding author. A series of 10 wt% NiO-xSiO2-ZrO2 (x = 0–30 wt%) catalysts were synthesized using a one-pot coprecipitation method with different of colloidal SiO2 contents, as a hard template, in order to imprint mesoporous cavities after a post-synthesis selective alkaline NaOH/H2O lixiviation. The final catalysts were characterized by XRD, HRTEM, textural measurements, 29Si-MAS NMR, FTIR, and XPS; the lixiviated, calcined and H2-reduced powders, were evaluated in the decarboxylation (DCO2) of ethyl palmitate as a liquid-solid phase model reaction at 300 °C, and 20 kg/cm2 H2 pressure. Optimal amount of colloidal SiO2 was 10 wt%. SiO2 effect (as colloid in fresh preparations and/or residual SiO2, after lixiviation) on ZrO2 is twofold. (i) to upgrade mesoporosity and (ii) to stabilize the porous structure. Residual SiO2 (from incomplete lixiviation) plays a beneficial role as examined by 29Si-NMR, being chemically bonded to ZrO2 and acting as props of the mesopores. Total pore volume and specific surface area values increased 5 and 6 times, respectively, when using a 30 wt% SiO2 in comparison with a non-silicated NiO-ZrO2 preparation. DCO2 of ethyl palmitate benefit from better mesoporosity and a great number of oxygen vacancies from Ni isomorphic substitution into cubic ZrO2 (as indicated by XPS); being at the origin of the reaction mechanism. For instance, a 10 wt% SiO2 NiO-ZrO2 catalyst is 1.6 times more selective (to n-pentadecane) and 1.2 times more active than a non-silicated NiO-ZrO2, yielding decarboxylated (i.e., deoxygenated) renewable linear hydrocarbons similar to those in a Diesel composition. However, DFT calculations indicate that adsorbed CO2 (as a formate species) desorbs, once fully hydrogenated, as methane regenerating the oxygen vacancies but consuming H2 as well, in agreement with the high methane concentration detected in gas phase. Graphical Abstract ga1 Keywords Ethyl palmitate decarboxylation Mesoporous Ni-ZrO2 Oxygen vacancies CO2 Hydrogenation Quantum chemical modelling Data Availability Data will be made available on request. 1 Introduction The global growth of oil consumption is the main culprit of the rise in greenhouse gasses (GHG) emissions (mainly CO2 and CH4). Alternatively, reduction in GHG can be achieved replacing fossil fuels with renewable fuels [1]. The production of renewable fuels from biomass-derived feedstocks has gained significant attention due to their potential to reduce greenhouse gas emissions and mitigate the depletion of fossil fuels. Also, combustion of biomass-derived fuels represents a cyclic process, since produced CO2 and H2O are raw materials environmentally available for creating new biomass via photosynthesis; in other words, CO2 emissions do not increase the inventory of emissions in the atmosphere [2,3]. Unfortunately, the high oxygen content of biomass-derived compounds is a great handicap for their use as hydrocarbons replacement. The removal of oxygen moieties from these compounds is essential to produce renewable fuels. Different reaction pathways, such as hydrodeoxygenation (HDO), decarbonylation (DCO), and decarboxylation (DCO2), have been explored for the deoxygenation of biomass-derived compounds [4–12]. The HDO of vegetable oils, operates at pressure and temperature like those reported for conventional oil fraction’s hydrotreatment processes (HDT) [13–17], using sulfurized NiMo or CoMo catalysts, which represents a risk of product contamination with sulfur [18,19]. Lamentably, these catalysts deactivate with produced water (i.e., as a byproduct), then, addition of sulfur compounds is required to reactivate the active sites [20]. The DCO removes the carbonyl group in the form of CO and H2O whereas DCO2 is the chemical reaction by which the carboxyl group is removed in the form of CO2 [9]. The DCO and DCO2 eliminate the carbonyl or carboxyl group yielding n-paraffins with one carbon atom less chain long compared with the respective fatty acid [5,13,21]. In agreement with the stoichiometric reaction, the DCO2 does not need the presence of hydrogen to remove the carboxyl group; but instead, it requires a flow of hydrogen to avoid the formation of coke that could be strongly absorbed in the catalyst and deactivate it [22]. The DCO and DCO2 deoxygenation routes represent lower costs due to the lower consumption of hydrogen, compared with the HDO route. The order of lowest to highest hydrogen consumption is as follows: DCO2 <DCO <HDO [9]. For this purpose, Ni has been widely used as a component of HDT catalysts due to its high hydrogenating activity and low cost [9,10,23]. A comparison of Ni deoxygenating activity with that of other metals ranges in the third place only preceded by more expensive noble metals such as Pd and Pt [24]. Accordingly, Ni supported on carbon, Ni/C catalyst, has been studied on the deoxygenation of stearic acid at 300 °C, 9.5 kg/cm2 and 1.5 h, with and without H2 [10]. Only 19% of stearic acid was converted when inert atmosphere was used, whereas by using 10% and 100% volume of H2, conversions of 64% and 80% were reached, respectively [10]. In another approach, Lercher et al. studied the deoxygenation of stearic acid using 10% Ni/HZSM-5 catalyst by varying zeolite’s Si/Al ratio. With a ratio Si/Al= 45, the conversion was 100% and selectivity of 43% toward C17 and C18 paraffins, whereas with a Si/Al= 200 ratio, the selectivity to paraffins increased to 93% [23]. On the other hand, the same authors studied the role of the support by dispersing 10 wt% of nickel in Al2O3, SiO2, TiO2, and ZrO2 [9,23,25] in the deoxygenation of stearic acid. The Ni/Al2O3 and Ni/SiO2 catalysts reached a conversion of 63% and 45%, respectively. Contrary to what was observed with Ni/ZrO2 and Ni/TiO2 catalysts that attained a conversion of 100% and selectivity of 87% and 96% to C17, respectively. The increase in the catalytic activity was explained assuming the presence of oxygen vacancies in the support generated at the metal-support interface. The development of efficient catalysts for the deoxygenation of biomass-derived compounds is crucial to produce renewable fuels. In recent years, Ni/ZrO2 catalysts have emerged as promising candidates for the deoxygenation of biomass-derived compounds. Ni/ZrO2 catalysts have attracted significant attention due to their ability to promote HDO, DCO, and DCO2 reactions and high catalytic activity and selectivity. In addition, the incorporation of Ni species onto ZrO2 support enhances the catalytic activity and stability. In this regard, different methods have been proposed to generate mesoporosity in non-porous solid catalysts. Hard template method has attracted increasing attention [26] given that this method involves the use of an inorganic material (i.e., colloidal SiO2), which acts as a template (a temporary guest) on which the component oxides of the catalyst are formed around it (the continuous component). The inorganic template can be removed by selective aqueous alkaline treatment leaving imprinted cavities (i.e., mesopores). Fe3C, Co3O4, Al2O3, ZrO2 are some of the mesoporous catalysts prepared by hard template method [26–28]. In this paper we explore a facile one-pot synthesis of NiO-ZrO2, including colloidal SiO2 as temporary template, aiming at improving the porosity of the resulting catalyst, after a soft alkaline removal and a conventional activation procedure. The effect of various concentrations of colloidal SiO2 was also studied. The final catalysts were evaluated in DCO2 of biomass-derived ethyl palmitate as a model compound. Efforts to correlate catalysts characterization results with DCO2 performance prompted us to propose a reaction scheme and to visualize the nature of the active sites. 2 Experimental 2.1 Chemicals All chemicals were obtained from commercial suppliers: nickel (II) nitrate hexahydrate (≥99%), zirconium nitrate hydrate (≥99%), colloidal silica (Grace Davison), ammonium hydroxide (30%), ethyl palmitate (≥99%) and dodecane (≥99%). 2.2 Catalyst preparation The catalysts were synthesized by a co-precipitation method, using colloidal silica as template. An appropriate amount of colloidal silica (12–15 nm diameter) was first dispersed in 100 mL of double distillate water, solution A, in order to obtain 10 and 30 wt% of SiO2 on the final material. In another container, 3.90 g of Ni(NO3).6 H2O and 16.90 g of ZrO(NO3)2.xH2O were dissolved in 500 mL of double distilled water, solution B. Then a solution C was prepared adjusting the concentration of NH4OH solution at 20 vol% by adding double distillate water. Thereafter, solution B and C were added dropwise simultaneously into the solution A maintaining constant pH at 9.5. The resulting suspension was aged for 18 h, then it was filtered, and washed with alkaline solution (NH4OH) at pH 9. Subsequently, the resulting solid was dried at 120 ºC and calcined at 650 ºC in air atmosphere during 4 h. In order to create the mesoporosity, hard template, i.e., colloidal silica, was removed by leaching process with an alkaline 1 M NaOH solution at pH 13.5. Then, it was washed again with alkaline NH4OH solution to remove residual sodium and finally it was dried at 120 ºC. The catalysts synthesized were labeled as NiZrSi-X where X indicates the wt% of colloidal silica. A Ni-ZrO2 catalyst without using SiO2 as hard template was prepared as a reference. 2.3 Catalyst characterization Differential thermal analysis (DTA) was developed on Perkin–Elmer device ATD 1700. Weight loss curve was determined by Thermogravimetric analysis (TGA) with a Perkin–Elmer TG-7. The heating rate was 10 °C/min, from room temperature to 1000 °C and flowing air at 20 cm3/min. Morphological and structural characterization was performed by electron microscopy using a scanning electron microscope (Nova NanoLab DualBeam FEI) and a transmission electron microscope (JEM-2200FS), which operate at 200 kV with a polepiece of ultrahigh resolution and an omega filter. Elemental chemical composition was obtained by energy dispersive X-ray spectroscopy in spectrometers EDAX and Bruker attached to the microscopes, respectively. For the transmission electron microscopy analysis, the sample was first ground in an agate mortar, and thereafter the fine powders were added into isopropanol and dispersed under ultrasonic agitation. Then, an aliquot of this solution was deposited on a 200-mesh copper grid covered with a polymeric thin film. The crystal structure of the samples was characterized by X-ray diffraction in a SIEMENS diffractometer model D-500, coupled with an X-ray copper tube, Kα= 1.5406. The equipment operates at 40 kV voltage and 40 mA of current intensity. The X-ray patterns were acquired in a range of 4 to 80°, with step size 2θ= 0.02°. FT-IR studies were carried out in a Perkin Elmer model Spectrum 100 series equipment, with a spectral frequency range of 650–4000 cm−1. The analysis was carried out at room temperature in transmittance mode, with a resolution of 1 cm−1. NMR-MAS 29Si analysis were acquired in a Bruker Avance 400 MHz which work with a 4-millimeter probe. Kaolinite was used as an external reference, having a chemical shift of − 91.2 ppm. Textural properties (surface specific area (SSA), pore size and total pore volume) were determined in an ASAP-2460 equipment in a MicroActive equipment. Prior to the measurements, samples were outgassed at 300 °C with high vacuum during 3 h. The SSA was calculated from adsorption isotherms using the multi-point Brunauer–Emmett–Teller (BET) method within a partial pressure P/P0 range from 0.05 to 0.35 [29,30]. The pore size distribution was determined by Barret-Joyner-Halenda (BJH) method [31] from the adsorption branch, the pore volume was measured from the total volume of nitrogen adsorbed at P/P0 = 0.98–0.99. Reducibility of NiO on catalysts was determined by temperature programed reduction (TPR) analysis performed in a conventional TPR apparatus using a flow of a H2/Ar mixture (70% H2(v/v), 25 cm3/min) at atmospheric pressure and a heating rate of 10◦C/min from room temperature up to 900 °C. To determine H2 consumption apparatus (TCD signal) was previously calibrated with silver oxide. XPS studies were performed using a Escalab 250 Thermo Fisher Scientific spectrometer, with a base pressure of 2 × 10−9 mbar, equipped with a glove chamber with nitrogen atmosphere (used to minimize the oxidation of the reduced catalysts). A photo-monochromatic X-ray source of Al Kα (hv=1486.6 eV) was used for data acquisition. The spectra of each component were fitted using the Thermo Avantage software (v5.957, Copyright 1999–2016). The binding energies (BE) of each component were referenced to adventitious C1s peak at 284.6 eV. The XPS nickel spectra in the Ni 2p3/2 region were deconvolved considering one satellite signal for each Ni 2p3/2 signal and to deconvolve the O 1s spectra, four different species were considered. 2.4 Catalytic test Ethyl palmitate decarboxylation was carried out in a batch reactor (300 mL Parr Autoclave) using powdered NiZrSi-X catalysts. The solids (catalyst mass=0.4 g) were activated by ex-situ reduction in an H2 stream at 500 °C for 1 h. The activated catalyst was recovered into 40 mL of n-dodecane, used as a solvent, then 0.4 g of ethyl palmitate was added. The reaction was carried out at 300 °C and H2 pressure of 20 kg/cm2, during 1 h and continuous stirring at 1000 rpm. The product analyses were carried out by gas chromatography coupled to a mass spectrometer (GC-MS). The conversion and selectivity were calculated using the following equations: Conversion % = Moles of transformed reagent Moles of reagent feed * 100 Selectivity % = Product moles Moles of transformed reagent * 100 2.5 Quantum chemical modeling DFT studies were performed using a ZrO2 surface as a model for the catalyst, and for simplicity a pentadecanoic acid was selected as a model of hexadecanoic acid, Fig. 1. The catalytic system was doped with NiO, and selected the most energetically favorable, Fig. 1. Then, the most reactive crystallographic plane was obtained, and a supercell was built. Molecular geometries for the single and interacting models were fully optimized with cell axes through Density Functional Theory (DFT) energy minimization by using Material Studio (MS) [32] , energy minimization by using the DMol3 code [33,34] GGA/PBE functional [35], the double numerical polarization (DNP) basis set were employed [36]. All predefined parameters were set at the fine accuracy option. The energy band gap, E gap , is defined as: E gap = E LUMO − E HOMO a large E gap indicates low chemical reactivity and a small gap indicates high chemical reactivity [37]. The interaction energies ∆E [38] of the pentanoic acid and the other species on the Ni-ZrO2 catalyst were calculated as: ∆ E = E species , surface − ( E species + E surface ) Where E surface , E species and E species,surface are the total quantum energy of the Ni-ZrO2 surface, the species to interact and the species contained on Ni-ZrO2, respectively. The high absolute value of the interaction energy denotes a strong attraction. 3 Results and discussion 3.1 Catalyst characterization 3.1.1 Thermal analysis Thermal analysis was used to determine the crystallization temperature of the zirconia in sample NiZrSi-0 without calcination, and the DTA and TGA curves are shown in Fig. 2. Two endothermic events occur at the beginning of the thermal process, see Fig. 2a. The first one at 95 °C, with a weight loss of 12.4%, is attributed to the desorption of physiosorbed water, see Fig. 2b. The second thermal event occurred at 193 °C with a weight loss of 8.3% and comes from the dehydroxylation stage. Once the dehydroxylation process ended, a small exothermic peak can be distinguished at 340 °C, see Fig. 2a, this event could be associated with the crystallization process of NiO species [39]. A very sharp exothermic peak appeared at 634 °C corresponding to the crystallization of cubic phase of zirconia being stabilized by Ni atoms incorporated into the lattice of ZrO2 structure. Accordingly, similar behaviors occurred on zirconia stabilized with CuO, CaO or Y2O3 [39–41]; by introducing cations with lower oxidation state than Zr4+, oxygen vacancies are generated into the structure to maintain charge neutrality. Based on this result, all samples were calcined at 650 °C. A temperature that is slightly higher than the temperature detected in the thermal analysis to promote the crystallization process. 3.1.2 Elemental composition Chemical composition determined by EDXS is summarized in Table 1 indicating all chemical elements detected in calcined and SiO2- leached samples. NiZrSi-0 catalyst, without any colloidal silica, contains around 14 wt% Ni; this content dropped from 14 to 8 wt% as the amount of colloidal silica in each sample increased. On the other hand, a considerable amount of SiO2 was detected after the leaching process, increasing along the colloidal SiO2 content, suggesting that silica was only partially removed upon leaching and at least a fraction of silicon remained either occluded and/or bonded to zirconia and nickel atoms. Accordingly, there are other harsher means of thoroughly extracting SiO2 particles by using concentrated or aqueous HF [42,43] at the expense of extracting Ni2+ and/or ZrO2 (e.g., because of high solubility at low pH), being detrimental when applying as a catalyst. Below we will demonstrate that residual SiO2, in fact, plays a beneficial role in the final catalyst. As well, Na atoms of around 2 wt% remained in sample NiZrSi-30, that is with the highest silica after leaching and washing procedures. 3.1.3 X-ray diffraction XRD results are displayed in Fig. 3. The first XRD pattern corresponds to the sample without colloidal silica, NiZrSi-0 shows four main peaks at 30, 35, 50 and 60° on the 2-theta scale, corresponding to the Miller indices (1 1 1), (2 0 0), (2 2 0) and (3 1 1), of the cubic phase of zirconium oxide JCPDS 49–1645 card. Additionally, two low intensity peaks were detected at 44 and 63° on the 2-theta scale, corresponding to the Miller indices (2 0 0) and (2 2 0) of nickel oxide according to the JCPDS 04–0835 card. Therefore, the NiZrSi-0 is composed mainly of the c-zirconia and c-NiO phases. The formation of the c-zirconia phase at 650 °C indicates that cubic structure of ZrO2 was stabilized by NiO as reported in the literature for NiO and other dopants to stabilize the cubic structure of zirconia such as CaO, CuO, Y2O3 [39–41]. The XRD patterns of the NiZrSi-10 and NiZrSi-30 samples, also included in Fig. 3, show a strong decrease in the crystallinity degree as the silica content increases this suggests a decrease in the crystallite size and/or the generation of two-dimensional defects as grain boundaries in the crystal structure produced by the introduction of SiO2 molecules. A broad peak around 30° in the two-theta scale, reveals the presence of amorphous zircon (ZrSiO4), even though the samples were annealed at 650; crystallization of cubic phase of Ni-ZrO2 was inhibited due to solid state reaction between ZrO2 and SiO2 [44]. In fact, it has been reported that Zr-Si mixed oxides remain amorphous even after calcination at 900 °C [45–47]. The increase of SiO2 wt% on the catalysts hinders the nucleation and growth of the ZrO2 crystalline particles [48]. This strong effect has been ascribed to a good chemical homogeneity resulting from a high mixing degree of Si and Zr [45–47]. Only the XRD pattern of NiZrSi-10 sample showed two additional peaks at 53 and 60° suggesting the presence of both cubic nanocrystalline Ni-ZrO2 and zircon phases, as it will be addressed latter in our HRTEM results. The main structural unit of zircon is a chain of alternating, edge-sharing SiO4 tetrahedral and ZrO2 triangular dodecahedra characterized by empty octahedric cavities. The metal dopants, like Ni, can be accommodated into the zircon network in interstitial positions; it can substitute for either Zr4+ and Si4+ in their lattice positions [49]. These results also indicate that Si atoms remaining after leaching are strongly interacting with ZrO2 and they are not removed during the NaOH leaching process. 3.1.4 Scanning electron microscopy (SEM) Surface morphology observed in samples are displayed in SEM micrographs in Fig. 4. The NiZrSi-0 showed an almost flat surface formed by the agglomeration of nanoparticles with sizes around 50 nm (Fig. 4a). SEM micrographs in Figs. 4b–4c show the surface modification of the particles produced after the leaching process of colloidal silica with NaOH solution. A severe surface degradation is appreciated in the SEM micrographs as the silica content increases. The deterioration grade could be associated with the amount of silica molecules or particles removed upon leaching. For instance, the surface of the particles in the NiZrSi-10 sample prepared with the lowest silica concentration shows small cavities and/or pores generated during the silica extraction due to the small amount of silica that remained without reacting with the NiO and ZrO2 molecules, see Fig. 4b. The SEM micrograph shows a surface lightly modified compared with the surface of the particles without silica, Fig. 4a, and severely degraded in NiZrSi-30 prepared with the higher concentration, see Fig. 4c. Huge cavities with a high presence of big pores in the holes are appreciated in the SEM micrograph, indicating high remotion of silica molecules and/or particles, as revealed by the amounts of silicon in the NiZrSi-30 sample after leaching, 11 wt%. In other words, a greater silica remotion a greater surface deterioration is generated, see Fig. 4b-c. 3.1.5 Textural analysis The main purpose of templating colloidal silica into ZrO2−x(OH)x was to, once selectively removed, SiO2 particles would leave a porous imprint or cavities into the resulting ZrO2 structure. With this aim, calcined NiO-ZrO2-(SiO2) and then SiO2-lixiviated would show improved textural properties in comparison with that prepared without any SiO2 addition. N2 adsorption-desorption isotherms of SiO2-leached and calcined NiO/ZrO2 catalysts are shown in Fig. 5. According to the IUPAC classification, all curve shapes were of type IV isotherm, which is characteristic of mesoporous materials [50]. Furthermore, the hysteresis loops on a relative pressure range 0.4–0.99 correspond to H3 type, which are attributed to aggregated particles, leading to slit-shaped pores [50,51]. In the case of NiZrSi-0 sample, synthesized without any hard SiO2-template and used as a reference, the hysteresis occurred at the relative pressure range 0.4–0.75, whereas in samples containing silica, the hysteresis loops opened up to 0.99 increasing considerably the total N2 adsorption volume. This is a strong indication that larger pore sizes were generated by extracting the hard template, even though and as indicated in Table 1, removal of SiO2 was incomplete. This remanent SiO2 may be seen as impurities or hindrances but in fact they act as beneficial props to uphold the resulting mesopores as will be demonstrated in Si29-MAS NMR below. The pore size distribution was plotted from adsorption branch in insert of Fig. 5, show a mesoporous distribution somewhat different than the reference Ni-ZrO2, that is, both smaller and larger mesopores are created when adding and then removing the hard template. The smaller mesopores (between 2 and 5 nm) might be associated with the original ones of Ni-ZrO2 without SiO2, but partially occluded with residual SiO2. The larger mesopores (between 10 and 20 nm) which are close to the initial colloid size (12–15 nm) or corresponding thereof aggregates, form the imbedded-leached SiO2 colloidal particles. However, residual SiO2 (after partial leaching) may be as well located in these large mesopores. These later mesopores are crucial in increasing surface specific area (see Table 2), as well as the total pore volume and consequently upgrade the accessibility to bulky molecules, like ethyl palmitate. When increasing colloidal SiO2 content above 30% (i.e., 50% SiO2) (not shown), large mesopores distribution becomes highly heterogeneous (roughly from 10 to 100 nm) pointing out an agglomeration of several colloidal particles leaving cavities of disordered sizes after leaching. As well, the small mesopores (2–5 nm) disappeared, probably because of occlusion of excess residual SiO2. Specific surface area (SSA) determined by applying BET equation and total pore volume obtained from BJH method, are indicated in Table 2. As expected, SSA increased as the amount of SiO2 content increase, until reaching a maximum at 30 wt% in sample NiZrSi-30. As can be noted in Table 2, SSA increases 6 times with the addition of silica template, from 52 to 312 m2/g in NiZrSi-0 and NiZrSi-30, respectively, whereas the total pore volume increases 5 times. The improvement in textural properties is clearly attributed to the porosity generated upon hard template leaching, which represent an effective feature to increase accessibility to the active sites, as will be discussed below. Nonetheless, too much colloidal SiO2, as in 30 wt% without leaching, results in worsening of textural properties as explained above and pointed out in Table 2. 3.1.6 High-resolution transmission electron microscopy The crystallinity of the particles was analyzed by HRTEM, and the results are shown in Fig. 6. Atomic resolution image of Fig. 6a of the sample, without colloidal silica, shows the atomic ordering in the nanoparticles, indicating a highly crystalline sample as revealed by XRD results. The Fast Fourier transform (FFT) pattern obtained from Fig. 6a revealed a d-spacing of 0.283 and 0.180 nm that fit to the {1 1 1} and {2 2 0} planes of the c-ZrO2 structure reported in the JCPDS 04–0835 card, which was viewed along the zone axis [1 1 ̅ 0]. In the NiZrSi-10 sample, the atomic resolution image of Fig. 6b shows a crystal nanoparticle surrounded by an atomic short-range ordering material, typical of the arrangement of amorphous material evidenced by the broad and diffuse halo feature shown in the FFT pattern of Fig. 6b. The crystallographic analysis performed on the crystal nanoparticle revealed the same c-zirconia structure as detected in the NiZrSi-0 sample. The FFT pattern of Fig. 6b showed d-spacing of 0.284 and 0.297 nm that fitted to the {1 1 1} and {0 0 2} planes of the c-ZrO2 structure reported in the JCPDS 04–0835 card. Then, the sample is formed by small crystallites of c-Ni-ZrO2 imbedded in and amorphous material, very possibly composed of O-Si-Ni-Zr atoms. As the silicon concentration increased in the sample, only short-range ordering was detected in the atomic resolution image, showing a highly disordered structure without any sign of nanocrystals or ordered clusters (see Fig. 6c). A diffuse halo feature related to amorphous arrangement was revealed in the FFT pattern displayed in Fig. 6c. In the image, it is not possible to visualize a crystal long-range ordering, which indicates the loss of crystallinity in the particles. The results suggest that the silicon atoms interact strongly with the ZrO2 molecules, inhibiting the ordered growth of the atoms, hindering a crystal growth, and therefore the formation of the c-Ni-ZrO2 phase. Fig. 7 shows the results of the high-angle annular dark-field scanning transmission electron microscopy (HAADF-STEM) analysis performed on the reduced samples. The annular dark field (ADF) image of Fig. 7a of the catalyst without silica does not show clear evidence of metallic Ni nanoparticles on the zirconia crystal surface, such as those observed in samples NiZrSi-10 and NiZrSi-30; see Figs. 7b and 7c. In the catalysts with silica, the Ni ions in the crystalline lattice are segregated during the reduction process, nucleating, and growing as metallic Ni nanoparticles on the surface of the Zr-Si particles. Additionally, as it was appreciated in the particle size distribution plot in Fig. 7d, the metallic Ni nanoparticle size is strongly influenced by the silica concentration in the catalyst. For example, the catalyst NiZrSi-10 revealed an average size of 3.0 ± 0.8 nm, while the NiZrSi-30 catalyst was around 6 ± 2 nm, respectively. 3.1.7 Fourier Transform Infrared Spectroscopy Infrared spectra plotted in the range 1500 to 650 cm−1 for all samples are showed in Fig. 8. A broad peak around ∼950 cm−1 was observed for samples containing the silica, which was not appeared in the spectra of the NiZrSi-0 catalyst. This band has been assigned to the vibrating modes of Zr-O-Si bonds [52,53]. The broadening of this band could be associated to overlapping of multiple vibrations such as Si-OH and Si-O-Zr [52–54]. However, a shift in the position of the vibrating band varying from 926 to 951 cm−1, for sample with zero and low residual Si content, NiZrSi-0 and − 10, and samples with higher amount of Silica, NiZrSi-30, suggesting that this variation must be associated to a decrease in number of Zr-O-Si moieties in mixed oxides. In fact, in a sample without removing silica template (NiZrSi-30NL) but thermally treated, the Si—O—Si asymmetric vibrating band occurred at 1040 cm−1, with its corresponding band at ∼791 cm−1 characteristic of the symmetric stretching of Si-O-Si bonds [52,54,55]. Similar variation of Si vibrating bands has been reported for Si-O-Me hetero-linkages (Me=V, Ti or Al), when Si atoms were introduced into the structure of other metal oxides, such as V2O5, TiO2, and Al2O3 [56–58]. Therefore, the variation in the asymmetric vibrating band in FTIR spectra must be associated to the number of coordination of Si atoms with Zr atoms, i.e. higher vibrating band position correspond to Si atoms surrounded four Si atoms Si(OSi)4 and lower vibrating band to a Si atoms neighboring with two or three Zr atoms Si(OZr)x(OSi) where x = 2 or 3, as observed in NMR results (see below). 3.1.8 29Si-MAS NMR To throw light on the nature of residual SiO2 particles (after the alkaline extraction procedure) and to clear out whether these particles were occluded and/ or chemically bonded, 29Si MAS NMR spectroscopy of the catalysts prepared using colloidal silica as template are shown in Fig. 9. The spectrum of the NiZrSi-10 catalyst shows a Q1 peak at chemical shift − 83 ppm corresponding to the Si(OZr)3(OSi) or Si(OH)3(OSi) [59], associated to Si atoms surrounded by just one Si tetrahedron and three O—Zr or OH bonds. In contrast, 29Si NMR spectra of NiZrSi-30 catalyst shows Q2 and Q3 peaks at chemical shifts of ∼ − 88 and 95 ppm indicating that Si atoms are bonded to two and three SiO4 tetrahedra, Si(OZr)2(OSi)2 and Si(OZr)(OSi)3, respectively [59,60]. As comparison, a non-leached NiZrSi-30 sample, was made up mainly of Q4 peak at a chemical shift of ∼ − 110 ppm, corresponding to Si atoms bonded to four Si tetrahedra, Si(OSi)4. However, a shoulder around ∼ − 95 ppm, suggest the presence of some Si atoms in a Q3 environment. From these results, a linear correlation can be stablished between 29Si NMR chemical shift and Si—O—Si FTIR vibrating bands, confirming that variation observed for Si—O—Si bonds in FTIR depend on the number of Si—O—Zr in the coordination sphere of Si atoms, i.e. an Si Q1 environment shows a Si—O—Si vibrating band at 926 cm−1, whereas for Si atoms in mainly Q4 the vibrating band appearing at 1050 cm−1 (see FTIR Fig. 8). In other words, the amount of (SiO-)x bonds attached to surface (ZrO-)y bonds depends on the SiO2 loading. Higher loadings lead to occluded or physically interacting SiO2 particles. 3.1.9 Temperature programed reduction (TPR) TPR studies were carried out on NiZrSi-0, NiZiSi-10 and NiZrSi-30. All samples showed at least three reduction peaks at temperatures below 500 °C, which can be attributed to surface (peaks a) and bulk reduction of large and small NiO particles (peaks b) having weak and strong interaction with the support, respectively [61,62]. As can be seen in TPR Fig. S1, incorporation of Si in samples NiZrSi-10, increased considerably the intensity of the reduction peaks of surface Ni species (peaks a and b below 500 °C), whereas the intensity of the peak at 685 °C decreased (peaks c), which result from the reduction of Ni species in strong interaction stabilizing the cubic structure of ZrO2. In fact and given that the reduction temperature prior to being used as a catalyst was 500 °C, reducibility of Ni species at 500 °C was measured by the H2 consumption. The reducibility percent determined were 32%, 91% and 59% for NiZrSi-0, NiZiSi-10 and NiZiSi-30, respectively. These results suggest that a considerable amount of NiO loaded is reduced at 500 °C in all samples, coexisting both reduced and unreduced Ni atoms on the surface as confirmed by XPS (below). 3.1.10 X-ray photoelectron spectroscopy Aiming at examining the composition of the surface layer of the catalysts, reduced NiZrSi-X catalysts were further investigated using XPS to provide more information about the oxidation state of the components and as well as the type of oxygen. The core levels of Ni 2p3/2 orbitals are presented in Fig. 10. In all cases, multiple peaks with their corresponding shake-up related satellites signals (dashed lines) were required to fit the Ni 2p3/2 orbital, (see Fig. 10); binding energy (B.E.) are reported in Table 3. Accordingly, the peak at 852.6–852.8 eV has been assigned to the Ni 2p3/2 orbital of metallic Ni0 [63]. Whereas peak at B.E. around 854.1 eV (see Table 3), corresponds to a Ni 2p3/2 orbital of partially reduced Ni δ(+) species into NiO1−x [64,65]. As well, the peak at 854.8 - 856.5 eV correspond to the Ni 2p3/2 orbital from a Ni2+ atom screened by lattice oxygen into NiO particles [64] and the peak at 856.0 - 858.8 eV correspond to Ni 2p3/2 orbital of Ni2+ non-locally screened by other elements included in the atomic framework [66–69]. Then, the latter two contributions have been assigned to Ni2+ into the lattice. Noteworthy in Table 3, in sample NiZrSi-10, Ni atoms were not completely reduced, the B.E of the corresponding reduced Ni species appeared at 854.1 eV, which indicate that partially reduced Ni δ(+) species into NiO1−x were obtained; only the samples NiZrSi-0 and NiZrSi-30 were made up of completely reduced Ni species with Ni 2p3/2 orbital at ca. 852.8 eV. Therefore, the percentage of reduced Ni species to total surface Ni was estimated including partially reduced Ni δ(+) species (see last column in Table 3), surface atomic ratio Ni0/Nitotal. A higher amount of Ni species, at least partially reduced, were detected in sample NiZrSi-10. Apparently, the presence of silicon atoms inhibits the reduction of Ni species probably due to strong interaction with Si and Zr atoms. Additionally, the dispersion of Ni species calculated as surface atomic ratio Ni/(Ni+Zr+Si) follows the same trend as that of reduced Ni species, the higher the Ni dispersion, the higher the reduced Ni species. Thus, a high Ni dispersion was identified in NiZrSi-10 catalyst, which correlate well with catalytic performance during ethyl palmitate deoxygenation reaction, as will be shown below. Fig. 11 shows the XPS spectra of O 1s of reduced NiZrSi-X catalysts. In the sample without Si, NiZrSi-0, only three peaks were required for the best fit. The first peak at 530.1–530.5 eV, has been assigned to oxygen atoms in fully oxidized surroundings of Zr–O–Zr or Ni–O–Zr bonds of metal oxides or mixed of metal oxides in the zirconia lattice [70], the second peak at 531.4–531.9 eV can be assigned to oxygen atoms linked to vacancy sites [39] or terminal oxygen atoms. The third peak around 532–8-533.3 eV has been attributed to M—OH [70–72]. On the other hand, the samples with Si required four peaks for the best fit, the first three peaks are the same of the non-SiO2 sample but differing in the third peak. This peak can be assigned to M–OH and/or Si—O—Si bonds [70–72] and the fourth peak around 534.1–534.8 eV comes from adsorbed water molecules [72]; the contribution of adsorbed water was observed only in samples containing silicon as a fourth peak of the O 1s orbital. In fact, the intensity of peak at 532.8–533.1 eV, increased considerably in samples containing silicon, (NiZrSi-10 and NiZrSi-30) compared with that without silica (NiZrSi-0), see Table 4, then, it can be stablished that in sample without Si, NiZrSi-0, the peak at 532.8 eV comes mainly from M—OH whereas in samples with silicon, the increment of this peak is mainly attributed to the Si—O—Si contribution of Si(OSi)4, Si(OZr)(OSi)3, Si(OZr)2(OSi)2 or Si(OZr)3(OSi) structures as observed by FTIR and NMR [72]. The contribution of O 1s orbital at 531.4–531.9 eV attributed to oxygen vacancy sites increased considerably in samples containing silicon, see Ovac /Olattice atomic ratio on Table 4. The increment of oxygen vacancy sites is due to the amorphization caused by silicon remaining bonded to Zr or Ni after the leaching process, which hinder the crystallization of cubic phase of zirconia phase, as observed in our XRD results. 3.2 Decarboxylation (DCO2) of ethyl palmitate Synthesized catalysts were tested in the DCO2 of ethyl palmitate, as model molecule of fatty oils. Catalysts performance was measured in terms of conversion and selectivity to indicated products and by-products after 1 h of reaction as indicated in Table 5. As can be seen, the main products obtained from all catalysts were n-pentadecane (n-C15), n-hexadecane (n-C16), 1-hexadecene (C16 =) and carboxylic acids, mainly hexadecanoic acid. These results suggest that the reaction proceeds first via Ni-catalyzed hydrogenolysis of a O—C bond of the ester group in ethyl palmitate producing ethane and hexadecanoic acid, in agreement with the energy required to break the O—C bond (85.7 Kcal/mol), being lower than that to break a C—O bond (97.7 Kcal/mol) [73] to produce ethanol and aldehyde (hexadecanal). However, traces of ethanol and hexadecanal were also detected on the liquid product, suggesting that rupture of C—O bond also occur but to a lesser extent. Therefore, both reaction pathways are proposed to occur as a first step for the ethyl palmitate deoxygenation, as can be seen in Scheme 1. Thereafter, hexadecanoic acid reacts in two ways: i) by direct decarboxylation to produce n-C15 and CO2; and ii) by hydrogenation of carboxylate group of hexadecanoic acid to yield hexadecanal and H2O. Then, hexadecanal reacts by two pathways: i) by decarbonylation producing n-C15 and CO and ii) by hydrogenation, yielding 1-hexadecanol. Nonetheless, 1-hexadecanol was not detected, since it remains in a hydrogenation/dehydrogenation equilibrium with hexadecanal [9], and in addition, it undergoes very fast dehydration to yield 1-hexadecene, which is hydrogenated later to produce n-hexadecane, as shown in Scheme 1. In the case of the gas phase, traces of CO2 were detected, whereas the main product was methane, originated from methanation of CO2 and CO with H2, see Table 6. The catalyst prepared without silica, NiZrSi-0, having a well crystallized cubic phase (see XRD in Fig. 3), showed ethyl palmitate conversion of 78.3 mol%, but a considerable amount (17 mol%) of products remained oxygenated as hexadecanoic acid, whereas deoxygenated products were 44.6 mol% of n-C15 via decarboxylation/decarbonylation paths and 21 mol% of C16 from the hydrogenation route. C16 products were mainly 1-hexadecene which indicate that it comes from dehydration of 1-hexadecanol (see Scheme 1), which is in agreement with a hydrodeoxygenation via hydrogenation of the carboxylic acid to aldehyde, which is subsequently hydrogenated to alcohol, as reported elsewhere [23]. The C15/C16 selectivity ratio was 2.1 for NiZrSi-0 catalyst suggesting that deoxygenation proceed largely from decarboxylation-decarbonylation pathways. This catalyst was prepared by coprecipitation, where Ni was incorporated into the structure of ZrO2 stabilizing the cubic phase. Accordingly, substitution of Zr4+ by a metal with lower oxidation state into the ZrO2 lattice stabilize the cubic crystal phase by generating oxygen vacancies into the structure [39–41]. These surface oxygen defects act as adsorption sites of carboxylic acid group, which can be directly decarboxylated desorbing C15 and CO2, or the α-H of the adsorbed carboxylate can be abstracted to form a ketene intermediate which is then hydrogenated by H* species generated by heterolytic dissociation of H2 on oxygen defect sites [74], or on the metallic particles [75,76], to produce the aldehyde (hexadecanal). Then, it is decarbonylated on Ni centers to yield n-C15 and CO [9,23,25]. Although, it has been reported [77] that decarboxylation reaction is unsuccessful to produce deoxygenated products, and it has been established that the carboxyl group need to be reduced to an aldehyde to break off the C-C single bond to eliminate the carbonyl group. In our case, traces of CO2 were detected instead of CO (see Table 6), confirming that the deoxygenation reaction proceeds mainly by direct decarboxylation of the carboxyl group adsorbed on the oxygen-vacant sites generated by introduction of Ni into the ZrO2 cubic structure [9]. Accordingly, decarboxylation is the preferred pathway of palmitic acid conversion over oxygen defect sites of m-ZrO2, whereas it switches to hydrogenation when Ni0 nanoparticles were deposited on it [9,78]. It is important to recall that porosity was generated into well crystallized cubic structure of Ni-ZrO2, (see XRD and HRTEM, Figs. 3 and 6) when the catalyst was prepared using 10 wt% of colloidal silica as hard template, Ni atoms incorporated (isomorphic substitution) into cubic ZrO2 structure are resistant to be reduced (see TPR results, Fig. S1), and more accessible oxygen defects are exposed in comparison with NiZrSi-0 sample synthesized without silica. Residual Si atoms remaining after the leaching procedure are bonded in a Q1 environment (see RMN and FTIR results) preventing the collapse of the porous structure. This catalyst (NiZrSi-10) showed the highest conversion of ethyl palmitate, 94.1 mol%, with only 4.8 mol% selectivity to hexadecenoic acid in contrast to 17 mol%, when using NiZrSi-0 sample. The main deoxygenated products obtained were 70.6 mol% of n-C15 and 5.4 mol% to C16, (n-C16 and C16 =) giving a C15/C16 ratio of 13.1 indicating that the deoxygenation reaction occurs mainly through decarboxylation/decarbonylation path. Evidently, increasing the porosity and SSA resulted in a better diffusion and accessibility of reactants/products inside the catalyst, i.e ethyl palmitate and palmitic acid, to the Ni particles and oxygen vacancy sites generated by introducing Ni atoms into the cubic structure of ZrO2. Some Ni atoms exposed NiZrSi-10 surface were not completely reduced (see XPS, B.E. = 854.1 eV), having a very strong interaction within the structure of the ZrO2 phase and thus, forming oxygen vacancies which are the active sites for decarboxylation/decarbonylation. Therefore, the decarboxylation reaction proceeded mainly through this path. Additionally, a substantial increase in the concentration of methane, from methanation of CO2 [79] and traces of CO2, confirm the improvement of catalytic performance via a decarboxylation pathway. In fact, as will be indicated below in our DFT results, CO2 never desorbs from the O vacancy site, it remains adsorbed as formate specie, and it is hydrogenated until it desorbs as methane. A catalyst prepared with 30 wt% silica, NiZrSi-30, showed lower catalytic activity, where ethyl palmitate conversion was 57.9 mol% and selectivity towards n-C15 and C-16 of 43.2 and 27.6 mol% respectively, giving a C15/C16 ratio of 1.6 and selectivity towards hexadecenoic acid was 16.7 mol%. In spite of NiZrSi-30 having 312 m2/g of SSA, decarboxylation activity was lower than that of NiZrSi-10 catalyst (see Table 5). This fact, can be explained as follows, in NiZrSi-30 catalyst, a larger amount of residual Si remained bonded in a Q2 and Q3 environment, Si(OZr)2(OSi)2 and Si(OZr)(OSi)3, (see NMR results), hindering the crystallization and stabilization of cubic structure of ZrO2 because of Ni (see XRD and HRTEM results). It remained as a microcrystalline or amorphous phase, then the increment observed in the amount of O vacancy sites (see XPS, Table 4) comes from the amorphous phase instead of the ZrO2 stabilized structure, the surface Ni atoms interaction with the amorphous Zr-Si-O phase is weaker than that when in isomorphic substitution in cubic ZrO2 structure, so Ni is reduced (see XPS, Table 3). In other words, there are not enough vacant NiZrO2 active sites to carry on decarboxylation/decarbonylation of palmitic acid. In fact, the C15/C16 selectivity ratio dropped from 13.1 to 1.6 in NiZrSi-10 and NiZrSi-30, respectively, suggesting that the reaction proceeds in larger extend via hydrogenation on metallic Ni particles in sample NiZrSi-30. Finally, a non-lixiviated NiZrSi-30 sample (NiZrSi-30NL) was evaluated as reference, in order to clear out the importance of porosity. As can be seen in Table 5, a lower ethyl palmitate conversion was attained compared with a lixiviated NiZrSi-30 catalysts and the other catalysts. Here, the major product obtained was palmitic acid, and in turn a little amount of this carboxylic acid was deoxygenated to paraffins C15 and C16, giving a selectivity ratio of n-C15/C16 of 0.3, which indicate that reaction proceeds mainly by a hydrogenation path. These results suggest that the porosity generated by silica extraction contribute to the diffusion of ethyl palmitate and palmitic acid into the internal active sites of the particles and that Ni introduced into the amorphous Zr-Si-O phase orient the reaction through the hydrogenation path. Furthermore, by comparing the catalytic activity of non-lixiviated NiZrSi-30NL with that of NiZrSi-10, it can be concluded that porosity is required but more important is to maintain a cubic ZrO2 structure stabilized by Ni, where oxygen vacancies generated act as active sites to catalyze the deoxygenation via decarboxylation or decarbonylation paths (see Scheme 1). Accordingly, the most important parameter on ethyl palmitate deoxygenation reaction is the presence and proximity of reduced or partially reduced Ni particles and oxygen surface vacancies of cubic structure of ZrO2 stabilized by Ni, in agreement with the findings of M. López et at [80]. Oxygen vacancies, generated by the introduction of Ni atoms into the cubic structure of ZrO2, have been proposed as the adsorption sites [9,75,76,80]. Whereas the homolithically dissociated protons, H* , required for the reaction come from adjacent Ni metal centers. For deoxygenation reactions, both vacancies and metal centers are necessary. Here in, it is hypothesized that well reduced Ni particles (Ni0) such as those observed in NiZrSi-0 and NiZrSi-30, provide dissociated protons more efficiently than in partially reduced (Ni δ(+)) detected on NiZrSi-10. Therefore, NiZrSi-0 and NiZrSi-30 samples exposing zero-valent Ni0 atoms catalyze HDO reaction through hydrogenation path requiring a larger amount of hydrogen to be desorbed as C16 molecules. In contrast, NiZrSi-10 expose partially reduced Ni δ(+), develops the deoxygenation reaction via decarboxylation. Therefore, decarboxylation requires less amount of H2 to be desorbed as C15. Nevertheless, the -COOH formate species remain bonded to Zr atoms on the surface in agreement with our DFT results. Finally, the mesoporosity imprinted by SiO2 leaching process favors the diffusion of reactants/products inside the catalyst, allowing accessibility to oxygen vacancies and Ni particles. 3.3 Quantum chemical modeling HRTEM analysis (see above) revealed the crystal planes seen along to the < 110 > zone axis, parallel to the electron beam, exhibiting (100) and (111) surfaces on the edge of the c-NiZrO2 crystals in HRTEM image. With a view to look for the most reactive crystal plane of Ni-substituted ZrO2 and taking into account the generation of oxygen vacancies as indicated by XPS (see above), a quantum chemical modeling study was carried on. After attempting several cell doping strategies with NiO, the more energetically favorable configuration, see Table 7 and Fig. 12, was doped with 1 Ni atom in the corner of the system (Zr3O7Ni1 stoichiometric configuration). The boundary molecular orbitals HOMO (highest occupied molecular orbital) and LUMO (lowest unoccupied molecular orbital) were obtained in undoped and in Ni doped ZrO2 bulks, Fig. 13. In undoped bulk, HOMO is distributed mainly in the O atoms, whereas LUMO is mainly found in the Zr atoms. In Ni doped ZrO2 bulk, HOMO is located mainly in the Ni dopant atom and LUMO is in the Ni atom and in the oxygen atoms. This means that doped with Ni into ZrO2, changes the ability of O atoms from electron donors in undoped ZrO2 to electron acceptors in Ni doped ZrO2, whereas the ability to accept electrons remain around Zr and Ni atoms mainly. As the doping atom is exposed in the bulk, it was considered the crystallographic plane that this atom is exposed, and for the symmetry we selected the (1 0 0) plane, Fig. 14a. A simulation cell (SC) was built with dimensions asc= 10.140, bsc= 10.140 and csc= 21.337 Å, obtained as a 2 × 2 × 1 supercell from the system of ZrO2, the vacuum space was 15 Å. As the bulk was grown twice, and according with the Egap, Fig. 14b, the most reactive system is the one with only one atom doping and, in the corner, for that reason this supercell was promoted twice, and this atom was over the surface and generated two vacancies. The simulated [1 0 0] plane was placed in contact with the pentanoic acid, Fig. 15, the OH group of the carboxylic acid occupies the oxygen vacancy site, and the H is bonded to the Ni atom. The other oxygen of carboxylic acid is attached to two neighboring Zr atoms, once the interaction was complete. The initial double bond O═C of carboxylic acid, changed its position to the oxygen initially as OH group, Fig. 15a, the resulted interaction energy was − 40.174 kcal/mol. Thereafter, H2 molecule was added to the system, and it dissociated, breaking the C—C bond of the carboxylic acid, releasing butane and leaving a bidentate formate specie HCOO* bonded to the surface, as indicated in Fig. 15b. The interaction energy was − 50.168 kcal/mol. When increasing the presence of H2 molecules, the hydrogenation of the adsorbed formate specie continues passing by dioxymethylene H2COO* and methoxy H3CO* intermediate species, Fig. 15c-d, until it desorbs as methane, Fig. 15e, with a final interaction energy of − 211.472 kcal/mol. These results clarify our experimental findings, that once the ester i.e., ethyl palmitate, has been converted into the carboxylic acid, i.e. palmitic acid, deoxygenation occurs by the adsorption of the carboxylic acid on the oxygen vacancy site, where the two oxygen atoms of the carboxylic acid are bonded to Ni and Zr close to the vacancy and the other one to two neighbor Zr atoms, thereafter hydrogenation of OOC—C bond occurs releasing an alkane lacking one carbon moiety (n-C15) and the CO2 remain strongly adsorbed on the oxygen vacancy site as a formate specie (HCOO*). The hydrogenation of formate species continues transforming into dioxymethylene and methoxy species until they are desorbed as methane. In summary, upon decarboxylation on Ni-ZrO2 catalyst, the CO2 do not desorb, it remains strongly adsorbed as HCOO- formate specie, where is later hydrogenated and desorb as methane, explaining the increment of methane concentration in the gas-phase when n-C15 increased mainly on NiZrSi-10 catalysts. Accordingly, and by using DFT calculations, adsorbed formate species is the intermediate moiety when hydrogenating CO2 with H2 to obtain methanol on a CuO-ZrO2 catalyst [81]. 4 Conclusions When developing solid catalysts for decarboxylation of long-chain fatty acids esters (i.e. ethyl palmitate), three main features are crucial for upgrading catalytic performance: i) adequate mesoporosity, ii) oxygen vacancies generated by a low valent reducible NiOx, and iii) available (100) crystal planes of Ni-doped ZrO2, being the most reactive one, according to quantum chemical modeling. Larger mesopores imprinted by hard templating ZrO2 with colloidal SiO2 allow a better diffusion and more effective contact of bulky esters with the active sites. Isomorphic substituted Ni2+ into ZrO2 plays two fundamental roles: i) stabilizing ZrO2 cubic phase and, ii) promoting the number of oxygen vacancies. Tuning mesopores size and distribution yields a NiO-ZrO2 (NiZrSi-10) catalyst 6.2 times more selective to decarboxylation/decarbonylation n-pentadecane than to hydrogenation of C16 hydrocarbons in comparison with a non-silicated NiO-ZrO2 (NiZrSi-0). Both linear n-alkanes are within a conventional Diesel composition. The advantage of selectively orienting towards decarboxylation (i.e n-pentadecane) versus hydrogenation (i.e., n-hexadecane) is based on hydrogen consumption; H2 being scarce and expensive. The decarboxylation route uses one molecule of H2 and while hydrogenation needs 3–4 molecules. Nonetheless and according to our DFT results, H2 is consumed by the adsorbed intermediate formate species until it desorbs as methane, restoring the active site as an oxygen vacancy. CRediT authorship contribution statement Toledo Jose Antonio: Conceptualization, Supervision, Writing – review & editing. Ángeles-Chávez Carlos: Investigation, Methodology. Chavarría-Escamilla Hervey G.: Data curation, Investigation, Writing – original draft. Cedeño Caero Luis: Investigation. Martínez-Magadán José M.: Software, Visualization. Zuriaga-Monroy Carolina: Methodology, Software. López-Salinas Esteban: Formal analysis, Validation. Cortés-Jácome María A.: Investigation, Methodology. Declaration of Competing Interest The authors declare that they have no known competing financial interests or personal relationships that could have appeared to influence the work reported in this paper. Acknowledgment To CONACYT for the grant awarded for the completion of PhD studies and the IMP D.61048 project for their financial support used to carry out the experimental tests in the present investigation. Appendix A Supporting information Supplementary data associated with this article can be found in the online version at doi:10.1016/j.apcata.2023.119547. Appendix A Supplementary material Supplementary material . References [1] N.-Olof Nylund, P. Aakko-Saksa, Kai. Sipilä, Valtion teknillinen tutkimuskeskus., Status and Outlook for Biofuels, Other Alternative Fuels and New Vehicles, VTT, 2008. [2] B.E. Nada ElSolh, J. Schmid Fatma Ashour, The Manufacture of Biodiesel from the Used Vegetable Oil, 2011. [3] D. Rathor A.-S. Nizami A. Singh D. Pant Biofuel Res. J. 3 2016 380 393 D. Rathor, A.-S. Nizami, A. Singh, D. Pant, Biofuel Research Journal 3 (2016) 380–393. [4] I. Simakova O. Simakova P. Mäki-Arvela D.Yu Murzin Catal. Today 150 2010 28 31 I. Simakova, O. Simakova, P. Mäki-Arvela, D.Yu Murzin, Catal Today 150 (2010) 28–31. [5] S. Lestariâ P.ã MÃki-Arvela J. Beltramini G. â Q. â M. Lu D.Yu Murzin ChemSusChem 2 2009 1109 1119 S. Lestariâ, P.ã MÃki-Arvela, J. Beltramini, G. â Q. â M. Lu, D.Yu Murzin, ChemSusChem 2 (2009) 1109–1119. [6] M. Lapuerta O. Armas J.J. Hernández A. Tsolakis Fuel 89 2010 3106 3113 M. Lapuerta, O. Armas, J.J. Hernández, A. Tsolakis, Fuel 89 (2010) 3106–3113. [7] S.K. Hoekman Renew. Energy 34 2009 14 22 S.K. Hoekman, Renew Energy 34 (2009) 14–22. [8] B. Veriansyah J.Y. Han S.K. Kim S.-A. Hong Y.J. Kim J.S. Lim Y.-W. Shu S.-G. Oh J. Kim Fuel 94 2012 578 585 B. Veriansyah, J.Y. Han, S.K. Kim, S.-A. Hong, Y.J. Kim, J.S. Lim, Y.-W. Shu, S.-G. Oh, J. Kim, Fuel 94 (2012) 578–585. [9] B. Peng C. Zhao S. Kasakov S. Foraita J.A. Lercher Chem. - A Eur. J. 19 2013 4732 4741 B. Peng, C. Zhao, S. Kasakov, S. Foraita, J.A. Lercher, Chemistry - A European Journal 19 (2013) 4732–4741. [10] E. Santillan-Jimenez T. Morgan J. Lacny S. Mohapatra M. Crocker Fuel 103 2013 1010 1017 E. Santillan-Jimenez, T. Morgan, J. Lacny, S. Mohapatra, M. Crocker, Fuel 103 (2013) 1010–1017. [11] A.S. Berenblyum T.A. Podoplelova R.S. Shamsiev E.A. Katsman V.Ya Danyushevsky Pet. Chem. 51 2011 336 341 A.S. Berenblyum, T.A. Podoplelova, R.S. Shamsiev, E.A. Katsman, V.Ya Danyushevsky, Petroleum Chemistry 51 (2011) 336–341. [12] J.G. Immer H.H. Lamb Energy Fuels 24 2010 5291 5299 J.G. Immer, H.H. Lamb, Energy & Fuels 24 (2010) 5291–5299. [13] A.T. Bell, B.C. Gates, D. Ray, Basic Research Needs: Catalysis for Energy (No. PNNL-17214), 2008. [14] T.N. Kalnes, M.M. McCall, D.R. Shonnard, in: Thermochemical Conversion of Biomass to Liquid Fuels and Chemicals, The Royal Society of Chemistry, 2010, pp. 468–495. [15] T. Kalnes T. Marker D.R. Shonnard Int. J. Chem. React. Eng. 5 2007 T. Kalnes, T. Marker, D.R. Shonnard, International Journal of Chemical Reactor Engineering 5 (2007). [16] Y. Yang Q. Wang X. Zhang L. Wang G. Li Fuel Process. Technol. 116 2013 165 174 Y. Yang, Q. Wang, X. Zhang, L. Wang, G. Li, Fuel Processing Technology 116 (2013) 165–174. [17] F. Pinto F.T. Varela M. Gonçalves R. Neto André P. Costa B. Mendes Fuel 116 2014 84 93 F. Pinto, F.T. Varela, M. Gonçalves, R. Neto André, P. Costa, B. Mendes, Fuel 116 (2014) 84–93. [18] H. Zuo Q. Liu T. Wang L. Ma Q. Zhang Q. Zhang Energy Fuels 26 2012 3747 3755 H. Zuo, Q. Liu, T. Wang, L. Ma, Q. Zhang, Q. Zhang, Energy & Fuels 26 (2012) 3747–3755. [19] T. Viljava R. Komulainen A. Krause Catal. Today 60 2000 83 92 T. Viljava, R. Komulainen, A. Krause, Catal Today 60 (2000) 83–92. [20] E. Laurent B. Delmon J. Catal. 146 1994 281 291 E. Laurent, B. Delmon, J Catal 146 (1994) 281–291. [21] G.N. da Rocha Filho D. Brodzki G. Djéga-Mariadassou Fuel 72 1993 543 549 G.N. da Rocha Filho, D. Brodzki, G. Djéga-Mariadassou, Fuel 72 (1993) 543–549. [22] T. Morgan E. Santillan-Jimenez A.E. Harman-Ware Y. Ji D. Grubb M. Crocker Chem. Eng. J. 189–190 2012 346 355 T. Morgan, E. Santillan-Jimenez, A.E. Harman-Ware, Y. Ji, D. Grubb, M. Crocker, Chemical Engineering Journal 189–190 (2012) 346–355. [23] B. Peng Y. Yao C. Zhao J.A. Lercher Angew. Chem. Int. Ed. 51 2012 2072 2075 B. Peng, Y. Yao, C. Zhao, J.A. Lercher, Angewandte Chemie International Edition 51 (2012) 2072–2075. [24] M. Snåre I. Kubičková P. Mäki-Arvela K. Eränen D.Yu Murzin Ind. Eng. Chem. Res 45 2006 5708 5715 M. Snåre, I. Kubičková, P. Mäki-Arvela, K. Eränen, D.Yu Murzin, Ind Eng Chem Res 45 (2006) 5708–5715. [25] B. Peng X. Yuan C. Zhao J.A. Lercher J. Am. Chem. Soc. 134 2012 9400 9405 B. Peng, X. Yuan, C. Zhao, J.A. Lercher, J Am Chem Soc 134 (2012) 9400–9405. [26] D. Gu F. Schüth Chem. Soc. Rev. 43 2014 313 344 D. Gu, F. Schüth, Chem. Soc. Rev. 43 (2014) 313–344. [27] A. Rumplecker F. Kleitz E.-L. Salabas F. Schüth Chem. Mater. 19 2007 485 496 A. Rumplecker, F. Kleitz, E.-L. Salabas, F. Schüth, Chemistry of Materials 19 (2007) 485–496. [28] A. Kraupner Markus Antonietti R. Palkovits K. Schlicht C. Giordano J. Mater. Chem. 20 2010 6019 A. Kraupner, Markus Antonietti, R. Palkovits, K. Schlicht, C. Giordano, J Mater Chem 20 (2010) 6019. [29] S. Brunauer P.H. Emmett E. Teller J. Am. Chem. Soc. 60 1938 309 319 S. Brunauer, P.H. Emmett, E. Teller, J Am Chem Soc 60 (1938) 309–319. [30] M. Naderi, in: Progress in Filtration and Separation, Elsevier, 2015, pp. 585–608. [31] E.P. Barrett L.G. Joyner P.P. Halenda J. Am. Chem. Soc. 73 1951 373 380 E.P. Barrett, L.G. Joyner, P.P. Halenda, J Am Chem Soc 73 (1951) 373–380. [32] Accelrys Software Inc, (n.d.). [33] B. Delley J. Chem. Phys. 92 1990 508 517 B. Delley, J Chem Phys 92 (1990) 508–517. [34] B. Delley J. Chem. Phys. 113 2000 7756 7764 B. Delley, J Chem Phys 113 (2000) 7756–7764. [35] J.P. Perdew K. Burke M. Ernzerhof Phys. Rev. Lett. 77 1996 3865 3868 J.P. Perdew, K. Burke, M. Ernzerhof, Phys Rev Lett 77 (1996) 3865–3868. [36] A. Tkatchenko M. Scheffler Phys. Rev. Lett. 102 2009 073005 A. Tkatchenko, M. Scheffler, Phys Rev Lett 102 (2009) 073005. [37] H. Chermette J. Comput. Chem. 20 1999 129 154 H. Chermette, J Comput Chem 20 (1999) 129–154. [38] D. Bahamon M. Khalil A. Belabbes Y. Alwahedi L.F. Vega K. Polychronopoulou RSC Adv. 11 2021 2947 2957 D. Bahamon, M. Khalil, A. Belabbes, Y. Alwahedi, L.F. Vega, K. Polychronopoulou, RSC Adv 11 (2021) 2947–2957. [39] M.K. Dongare K. Malshe C.S. Gopinath I.K. Murwani E. Kemnitz J. Catal. 222 2004 80 86 M.K. Dongare, K. Malshe, C.S. Gopinath, I.K. Murwani, E. Kemnitz, J Catal 222 (2004) 80–86. [40] M.K. Dongare V. Ramaswamy C.S. Gopinath A.V. Ramaswamy S. Scheurell M. Brueckner E. Kemnitz J. Catal. 199 2001 209 216 M.K. Dongare, V. Ramaswamy, C.S. Gopinath, A.V. Ramaswamy, S. Scheurell, M. Brueckner, E. Kemnitz, J Catal 199 (2001) 209–216. [41] L. Kundakovic M. Flytzani-Stephanopoulos Appl. Catal. A Gen. 171 1998 13 29 L. Kundakovic, M. Flytzani-Stephanopoulos, Appl Catal A Gen 171 (1998) 13–29. [42] J.S. Judge J. Electrochem Soc. 118 1971 1772 J.S. Judge, J Electrochem Soc 118 (1971) 1772. [43] D.M. Knotter J. Am. Chem. Soc. 122 2000 4345 4351 D.M. Knotter, J Am Chem Soc 122 (2000) 4345–4351. [44] C. Veytizou J.F. Quinson O. Valfort G. Thomas Solid State Ion.-. 139 2001 315 323 C. Veytizou, J.F. Quinson, O. Valfort, G. Thomas, Solid State Ion 139 (2001) 315–323. [45] B. Tyagi K.B. Sidhpuria B. Shaik R.V. Jasra J. Porous Mater. 17 2010 699 709 B. Tyagi, K.B. Sidhpuria, B. Shaik, R.V. Jasra, Journal of Porous Materials 17 (2010) 699–709. [46] Y. Zhang L. Pan C. Gao Y. Zhao J. Solgel Sci. Technol. 58 2011 572 579 Y. Zhang, L. Pan, C. Gao, Y. Zhao, J Solgel Sci Technol 58 (2011) 572–579. [47] Y. Zhang L. Pan C. Gao Y. Wang Y. Zhao J. Solgel Sci. Technol. 56 2010 27 32 Y. Zhang, L. Pan, C. Gao, Y. Wang, Y. Zhao, J Solgel Sci Technol 56 (2010) 27–32. [48] P.D.L. Mercera J.G. Van Ommen E.B.M. Doesburg A.J. Burggraaf J.R.H. Ross Appl. Catal. 57 1990 127 148 P.D.L. Mercera, J.G. Van Ommen, E.B.M. Doesburg, A.J. Burggraaf, J.R.H. Ross, Appl Catal 57 (1990) 127–148. [49] F.J. Berry D. Eadon J. Holloway L.E. Smart J. Mater. Sci. 15 1999 3631 3638 F.J. Berry, D. Eadon, J. Holloway, L.E. Smart, J Mater Sci 15 (1999) 3631–3638. [50] M. Thommes K. Kaneko A.V. Neimark J.P. Olivier F. Rodriguez-Reinoso J. Rouquerol K.S.W. Sing Pure Appl. Chem. 87 2015 1051 1069 M. Thommes, K. Kaneko, A.V. Neimark, J.P. Olivier, F. Rodriguez-Reinoso, J. Rouquerol, K.S.W. Sing, Pure and Applied Chemistry 87 (2015) 1051–1069. [51] J.S. Valente M. Sánchez-Cantú E. Lima F. Figueras Chem. Mater. 21 2009 5809 5818 J.S. Valente, M. Sánchez-Cantú, E. Lima, F. Figueras, Chemistry of Materials 21 (2009) 5809–5818. [52] A. Zitouni R. Bachir W. Bendedouche S. Bedrane Fuel 297 2021 120783 A. Zitouni, R. Bachir, W. Bendedouche, S. Bedrane, Fuel 297 (2021) 120783. [53] M.R. Elvira M.A. Mazo A. Tamayo F. Rubio J. Rubio J.L. Oteo J. Chem. Chem. Eng. 7 2013 120 131 M.R. Elvira, M.A. Mazo, A. Tamayo, F. Rubio, J. Rubio, J.L. Oteo, J. Chem. Chem. Eng 7 (2013) 120–131. [54] S.W. Lee R.A. Condrate J. Mater. Sci. 23 1988 2951 2959 S.W. Lee, R.A. Condrate, J Mater Sci 23 (1988) 2951–2959. [55] A. Fidalgo L.M. Ilharco J. Non Cryst. Solids 283 2001 144 154 A. Fidalgo, L.M. Ilharco, J Non Cryst Solids 283 (2001) 144–154. [56] A. Comite A. Sorrentino G. Capannelli M. Di Serio R. Tesser E. Santacesaria J. Mol. Catal. A Chem. 198 2003 151 165 A. Comite, A. Sorrentino, G. Capannelli, M. Di Serio, R. Tesser, E. Santacesaria, J Mol Catal A Chem 198 (2003) 151–165. [57] V. Iannazzo Appl. Catal. A Gen. 246 2003 49 68 V. Iannazzo, Appl Catal A Gen 246 (2003) 49–68. [58] E.F. Aboelfetoh R. Pietschnig Catal. Lett. 127 2009 83 94 E.F. Aboelfetoh, R. Pietschnig, Catal Letters 127 (2009) 83–94. [59] O.B. Lapina D.F. Khabibulin V.V. Terskikh Solid State Nucl. Magn. Reson 39 2011 47 57 O.B. Lapina, D.F. Khabibulin, V.V. Terskikh, Solid State Nucl Magn Reson 39 (2011) 47–57. [60] R.G.R. Avendaño J.A. de los Reyes J.A. Montoya T. Viveros J. Solgel Sci. Technol. 33 2005 133 138 R.G.R. Avendaño, J.A. de los Reyes, J.A. Montoya, T. Viveros, J Solgel Sci Technol 33 (2005) 133–138. [61] D. Pietrogiacomi M.C. Campa I. Pettiti S. Tuti G. Luccisano L. Ardemani I. Luisetto D. Gazzoli Materials 14 2021 2495 D. Pietrogiacomi, M.C. Campa, I. Pettiti, S. Tuti, G. Luccisano, L. Ardemani, I. Luisetto, D. Gazzoli, Materials 14 (2021) 2495. [62] H. Mori Appl. Catal. A Gen. 245 2003 79 85 H. Mori, Appl Catal A Gen 245 (2003) 79–85. [63] A.P. Grosvenor M.C. Biesinger R.St.C. Smart N.S. McIntyre Surf. Sci. 600 2006 1771 1779 A.P. Grosvenor, M.C. Biesinger, R.St.C. Smart, N.S. McIntyre, Surf Sci 600 (2006) 1771–1779. [64] A.F. Carley S.D. Jackson J.N. O’Shea M.W. Roberts Surf. Sci. 440 1999 L868 L874 A.F. Carley, S.D. Jackson, J.N. O’Shea, M.W. Roberts, Surf Sci 440 (1999) L868–L874. [65] T. Long-Xiang Z. Feng-Mei Z. Lu-Bin React. Kinet. Catal. Lett. 57 1996 99 104 T. Long-Xiang, Z. Feng-Mei, Z. Lu-Bin, Reaction Kinetics & Catalysis Letters 57 (1996) 99–104. [66] S. Echeandia P.L. Arias V.L. Barrio B. Pawelec J.L.G. Fierro Appl. Catal. B 101 2010 1 12 S. Echeandia, P.L. Arias, V.L. Barrio, B. Pawelec, J.L.G. Fierro, Appl Catal B 101 (2010) 1–12. [67] M.A. Peck M.A. Langell Chem. Mater. 24 2012 4483 4490 M.A. Peck, M.A. Langell, Chemistry of Materials 24 (2012) 4483–4490. [68] N. Wang K. Shen L. Huang X. Yu W. Qian W. Chu ACS Catal. 3 2013 1638 1651 N. Wang, K. Shen, L. Huang, X. Yu, W. Qian, W. Chu, ACS Catal 3 (2013) 1638–1651. [69] J.K. Kesavan I. Luisetto S. Tuti C. Meneghini C. Battocchio G. Iucci J. Mater. Sci. 52 2017 10331 10340 J.K. Kesavan, I. Luisetto, S. Tuti, C. Meneghini, C. Battocchio, G. Iucci, J Mater Sci 52 (2017) 10331–10340. [70] S. Gandla S.R. Gollu R. Sharma V. Sarangi D. Gupta Appl. Phys. Lett. 107 2015 S. Gandla, S.R. Gollu, R. Sharma, V. Sarangi, D. Gupta, Appl Phys Lett 107 (2015). [71] J. Halim K.M. Cook M. Naguib P. Eklund Y. Gogotsi J. Rosen M.W. Barsoum Appl. Surf. Sci. 362 2016 406 417 J. Halim, K.M. Cook, M. Naguib, P. Eklund, Y. Gogotsi, J. Rosen, M.W. Barsoum, Appl Surf Sci 362 (2016) 406–417. [72] X. Wang C.A. Plackowski A.V. Nguyen Powder Technol. 295 2016 27 34 X. Wang, C.A. Plackowski, A.V. Nguyen, Powder Technol 295 (2016) 27–34. [73] V.B. Oyeyemi J.M. Dieterich D.B. Krisiloff T. Tan E.A. Carter J. Phys. Chem. A 119 2015 3429 3439 V.B. Oyeyemi, J.M. Dieterich, D.B. Krisiloff, T. Tan, E.A. Carter, J Phys Chem A 119 (2015) 3429–3439. [74] A.A. Fragoso-Montes de Oca J.G. Hernández-Cortez C. Angeles-Chavez J.S. Valente J.A. Toledo-Antonio Mater. Chem. Phys. 291 2022 126659 A.A. Fragoso-Montes de Oca, J.G. Hernández-Cortez, C. Angeles-Chavez, J.S. Valente, J.A. Toledo-Antonio, Mater Chem Phys 291 (2022) 126659. [75] R. Pestman R.M. Koster J.A.Z. Pieterse V. Ponec J. Catal. 168 1997 255 264 R. Pestman, R.M. Koster, J.A.Z. Pieterse, V. Ponec, J Catal 168 (1997) 255–264. [76] R. Pestman R.M. Koster E. Boellaard A.M. van der Kraan V. Ponec J. Catal. 174 1998 142 152 R. Pestman, R.M. Koster, E. Boellaard, A.M. van der Kraan, V. Ponec, J Catal 174 (1998) 142–152. [77] Ž. Selaković A.M. Nikolić V. Ajdačić I.M. Opsenica Eur. J. Org. Chem. 2022 2022 Ž. Selaković, A.M. Nikolić, V. Ajdačić, I.M. Opsenica, European J Org Chem 2022 (2022). [78] S. Foraita J.L. Fulton Z.A. Chase A. Vjunov P. Xu E. Baráth D.M. Camaioni C. Zhao J.A. Lercher Chem. - A Eur. J. 21 2015 2423 2434 S. Foraita, J.L. Fulton, Z.A. Chase, A. Vjunov, P. Xu, E. Baráth, D.M. Camaioni, C. Zhao, J.A. Lercher, Chemistry - A European Journal 21 (2015) 2423–2434. [79] B. Miao S.S.K. Ma X. Wang H. Su S.H. Chan Catal. Sci. Technol. 6 2016 4048 4058 B. Miao, S.S.K. Ma, X. Wang, H. Su, S.H. Chan, Catal Sci Technol 6 (2016) 4048–4058. [80] M. López R. Palacio A.-S. Mamede J.J. Fernández S. Royer Microporous Mesoporous Mater. 309 2020 110452 M. López, R. Palacio, A.-S. Mamede, J.J. Fernández, S. Royer, Microporous and Mesoporous Materials 309 (2020) 110452. [81] K. Larmier W.-C. Liao S. Tada E. Lam R. Verel A. Bansode A. Urakawa A. Comas-Vives C. Copéret Angew. Chem. 129 2017 2358 2363 K. Larmier, W.-C. Liao, S. Tada, E. Lam, R. Verel, A. Bansode, A. Urakawa, A. Comas-Vives, C. Copéret, Angewandte Chemie 129 (2017) 2358–2363.",
      "scopus-id": "85181733214",
      "coredata": {
        "eid": "1-s2.0-S0926860X23005276",
        "dc:description": "A series of 10 wt% NiO-xSiO2-ZrO2 (x = 0–30 wt%) catalysts were synthesized using a one-pot coprecipitation method with different of colloidal SiO2 contents, as a hard template, in order to imprint mesoporous cavities after a post-synthesis selective alkaline NaOH/H2O lixiviation. The final catalysts were characterized by XRD, HRTEM, textural measurements, 29Si-MAS NMR, FTIR, and XPS; the lixiviated, calcined and H2-reduced powders, were evaluated in the decarboxylation (DCO2) of ethyl palmitate as a liquid-solid phase model reaction at 300 °C, and 20 kg/cm2 H2 pressure. Optimal amount of colloidal SiO2 was 10 wt%. SiO2 effect (as colloid in fresh preparations and/or residual SiO2, after lixiviation) on ZrO2 is twofold. (i) to upgrade mesoporosity and (ii) to stabilize the porous structure. Residual SiO2 (from incomplete lixiviation) plays a beneficial role as examined by 29Si-NMR, being chemically bonded to ZrO2 and acting as props of the mesopores. Total pore volume and specific surface area values increased 5 and 6 times, respectively, when using a 30 wt% SiO2 in comparison with a non-silicated NiO-ZrO2 preparation. DCO2 of ethyl palmitate benefit from better mesoporosity and a great number of oxygen vacancies from Ni isomorphic substitution into cubic ZrO2 (as indicated by XPS); being at the origin of the reaction mechanism. For instance, a 10 wt% SiO2 NiO-ZrO2 catalyst is 1.6 times more selective (to n-pentadecane) and 1.2 times more active than a non-silicated NiO-ZrO2, yielding decarboxylated (i.e., deoxygenated) renewable linear hydrocarbons similar to those in a Diesel composition. However, DFT calculations indicate that adsorbed CO2 (as a formate species) desorbs, once fully hydrogenated, as methane regenerating the oxygen vacancies but consuming H2 as well, in agreement with the high methane concentration detected in gas phase.",
        "openArchiveArticle": "false",
        "prism:coverDate": "2024-01-25",
        "openaccessUserLicense": null,
        "prism:aggregationType": "Journal",
        "prism:url": "https://api.elsevier.com/content/article/pii/S0926860X23005276",
        "dc:creator": [
          {
            "@_fa": "true",
            "$": "Chavarría-Escamilla, Hervey G."
          },
          {
            "@_fa": "true",
            "$": "Ángeles-Chávez, Carlos"
          },
          {
            "@_fa": "true",
            "$": "Zuriaga-Monroy, Carolina"
          },
          {
            "@_fa": "true",
            "$": "Martínez-Magadán, José M."
          },
          {
            "@_fa": "true",
            "$": "Cortés-Jácome, María A."
          },
          {
            "@_fa": "true",
            "$": "López-Salinas, Esteban"
          },
          {
            "@_fa": "true",
            "$": "Cedeño-Caero, L."
          },
          {
            "@_fa": "true",
            "$": "Toledo-Antonio, José A."
          }
        ],
        "link": [
          {
            "@_fa": "true",
            "@rel": "self",
            "@href": "https://api.elsevier.com/content/article/pii/S0926860X23005276"
          },
          {
            "@_fa": "true",
            "@rel": "scidir",
            "@href": "https://www.sciencedirect.com/science/article/pii/S0926860X23005276"
          }
        ],
        "dc:format": "application/json",
        "openaccessType": null,
        "pii": "S0926-860X(23)00527-6",
        "prism:volume": "670",
        "articleNumber": "119547",
        "prism:publisher": "Elsevier B.V.",
        "dc:title": "Ethyl palmitate decarboxylation using colloidal SiO2- templated mesoporous Ni-ZrO2 catalysts",
        "prism:copyright": "© 2023 Elsevier B.V. All rights reserved.",
        "openaccess": "0",
        "prism:issn": "0926860X",
        "dcterms:subject": [
          {
            "@_fa": "true",
            "$": "Ethyl palmitate decarboxylation"
          },
          {
            "@_fa": "true",
            "$": "Mesoporous Ni-ZrO2"
          },
          {
            "@_fa": "true",
            "$": "Oxygen vacancies"
          },
          {
            "@_fa": "true",
            "$": "CO2 Hydrogenation"
          },
          {
            "@_fa": "true",
            "$": "Quantum chemical modelling"
          }
        ],
        "openaccessArticle": "false",
        "prism:publicationName": "Applied Catalysis A: General",
        "openaccessSponsorType": null,
        "prism:pageRange": "119547",
        "pubType": "fla",
        "prism:coverDisplayDate": "25 January 2024",
        "prism:doi": "10.1016/j.apcata.2023.119547",
        "prism:startingPage": "119547",
        "dc:identifier": "doi:10.1016/j.apcata.2023.119547",
        "openaccessSponsorName": null
      },
      "objects": {
        "object": [
          {
            "@category": "standard",
            "@height": "190",
            "@width": "678",
            "@_fa": "true",
            "$": "https://api.elsevier.com/content/object/eid/1-s2.0-S0926860X23005276-sc1.jpg?httpAccept=%2A%2F%2A",
            "@multimediatype": "JPEG image file",
            "@type": "IMAGE-DOWNSAMPLED",
            "@size": "25820",
            "@ref": "sc1",
            "@mimetype": "image/jpeg"
          },
          {
            "@category": "standard",
            "@height": "181",
            "@width": "339",
            "@_fa": "true",
            "$": "https://api.elsevier.com/content/object/eid/1-s2.0-S0926860X23005276-gr1.jpg?httpAccept=%2A%2F%2A",
            "@multimediatype": "JPEG image file",
            "@type": "IMAGE-DOWNSAMPLED",
            "@size": "15535",
            "@ref": "gr1",
            "@mimetype": "image/jpeg"
          },
          {
            "@category": "standard",
            "@height": "200",
            "@width": "355",
            "@_fa": "true",
            "$": "https://api.elsevier.com/content/object/eid/1-s2.0-S0926860X23005276-ga1.jpg?httpAccept=%2A%2F%2A",
            "@multimediatype": "JPEG image file",
            "@type": "IMAGE-DOWNSAMPLED",
            "@size": "20883",
            "@ref": "ga1",
            "@mimetype": "image/jpeg"
          },
          {
            "@category": "standard",
            "@height": "303",
            "@width": "395",
            "@_fa": "true",
            "$": "https://api.elsevier.com/content/object/eid/1-s2.0-S0926860X23005276-gr3.jpg?httpAccept=%2A%2F%2A",
            "@multimediatype": "JPEG image file",
            "@type": "IMAGE-DOWNSAMPLED",
            "@size": "33442",
            "@ref": "gr3",
            "@mimetype": "image/jpeg"
          },
          {
            "@category": "standard",
            "@height": "693",
            "@width": "282",
            "@_fa": "true",
            "$": "https://api.elsevier.com/content/object/eid/1-s2.0-S0926860X23005276-gr11.jpg?httpAccept=%2A%2F%2A",
            "@multimediatype": "JPEG image file",
            "@type": "IMAGE-DOWNSAMPLED",
            "@size": "44229",
            "@ref": "gr11",
            "@mimetype": "image/jpeg"
          },
          {
            "@category": "standard",
            "@height": "821",
            "@width": "565",
            "@_fa": "true",
            "$": "https://api.elsevier.com/content/object/eid/1-s2.0-S0926860X23005276-gr2.jpg?httpAccept=%2A%2F%2A",
            "@multimediatype": "JPEG image file",
            "@type": "IMAGE-DOWNSAMPLED",
            "@size": "80856",
            "@ref": "gr2",
            "@mimetype": "image/jpeg"
          },
          {
            "@category": "standard",
            "@height": "228",
            "@width": "226",
            "@_fa": "true",
            "$": "https://api.elsevier.com/content/object/eid/1-s2.0-S0926860X23005276-gr12.jpg?httpAccept=%2A%2F%2A",
            "@multimediatype": "JPEG image file",
            "@type": "IMAGE-DOWNSAMPLED",
            "@size": "18583",
            "@ref": "gr12",
            "@mimetype": "image/jpeg"
          },
          {
            "@category": "standard",
            "@height": "308",
            "@width": "395",
            "@_fa": "true",
            "$": "https://api.elsevier.com/content/object/eid/1-s2.0-S0926860X23005276-gr5.jpg?httpAccept=%2A%2F%2A",
            "@multimediatype": "JPEG image file",
            "@type": "IMAGE-DOWNSAMPLED",
            "@size": "35611",
            "@ref": "gr5",
            "@mimetype": "image/jpeg"
          },
          {
            "@category": "standard",
            "@height": "944",
            "@width": "339",
            "@_fa": "true",
            "$": "https://api.elsevier.com/content/object/eid/1-s2.0-S0926860X23005276-gr4.jpg?httpAccept=%2A%2F%2A",
            "@multimediatype": "JPEG image file",
            "@type": "IMAGE-DOWNSAMPLED",
            "@size": "92723",
            "@ref": "gr4",
            "@mimetype": "image/jpeg"
          },
          {
            "@category": "standard",
            "@height": "724",
            "@width": "282",
            "@_fa": "true",
            "$": "https://api.elsevier.com/content/object/eid/1-s2.0-S0926860X23005276-gr10.jpg?httpAccept=%2A%2F%2A",
            "@multimediatype": "JPEG image file",
            "@type": "IMAGE-DOWNSAMPLED",
            "@size": "47886",
            "@ref": "gr10",
            "@mimetype": "image/jpeg"
          },
          {
            "@category": "standard",
            "@height": "564",
            "@width": "565",
            "@_fa": "true",
            "$": "https://api.elsevier.com/content/object/eid/1-s2.0-S0926860X23005276-gr7.jpg?httpAccept=%2A%2F%2A",
            "@multimediatype": "JPEG image file",
            "@type": "IMAGE-DOWNSAMPLED",
            "@size": "62194",
            "@ref": "gr7",
            "@mimetype": "image/jpeg"
          },
          {
            "@category": "standard",
            "@height": "757",
            "@width": "565",
            "@_fa": "true",
            "$": "https://api.elsevier.com/content/object/eid/1-s2.0-S0926860X23005276-gr15.jpg?httpAccept=%2A%2F%2A",
            "@multimediatype": "JPEG image file",
            "@type": "IMAGE-DOWNSAMPLED",
            "@size": "100791",
            "@ref": "gr15",
            "@mimetype": "image/jpeg"
          },
          {
            "@category": "standard",
            "@height": "813",
            "@width": "565",
            "@_fa": "true",
            "$": "https://api.elsevier.com/content/object/eid/1-s2.0-S0926860X23005276-gr6.jpg?httpAccept=%2A%2F%2A",
            "@multimediatype": "JPEG image file",
            "@type": "IMAGE-DOWNSAMPLED",
            "@size": "144835",
            "@ref": "gr6",
            "@mimetype": "image/jpeg"
          },
          {
            "@category": "standard",
            "@height": "280",
            "@width": "339",
            "@_fa": "true",
            "$": "https://api.elsevier.com/content/object/eid/1-s2.0-S0926860X23005276-gr9.jpg?httpAccept=%2A%2F%2A",
            "@multimediatype": "JPEG image file",
            "@type": "IMAGE-DOWNSAMPLED",
            "@size": "23035",
            "@ref": "gr9",
            "@mimetype": "image/jpeg"
          },
          {
            "@category": "standard",
            "@height": "368",
            "@width": "508",
            "@_fa": "true",
            "$": "https://api.elsevier.com/content/object/eid/1-s2.0-S0926860X23005276-gr13.jpg?httpAccept=%2A%2F%2A",
            "@multimediatype": "JPEG image file",
            "@type": "IMAGE-DOWNSAMPLED",
            "@size": "59576",
            "@ref": "gr13",
            "@mimetype": "image/jpeg"
          },
          {
            "@category": "standard",
            "@height": "299",
            "@width": "395",
            "@_fa": "true",
            "$": "https://api.elsevier.com/content/object/eid/1-s2.0-S0926860X23005276-gr8.jpg?httpAccept=%2A%2F%2A",
            "@multimediatype": "JPEG image file",
            "@type": "IMAGE-DOWNSAMPLED",
            "@size": "27702",
            "@ref": "gr8",
            "@mimetype": "image/jpeg"
          },
          {
            "@category": "standard",
            "@height": "299",
            "@width": "565",
            "@_fa": "true",
            "$": "https://api.elsevier.com/content/object/eid/1-s2.0-S0926860X23005276-gr14.jpg?httpAccept=%2A%2F%2A",
            "@multimediatype": "JPEG image file",
            "@type": "IMAGE-DOWNSAMPLED",
            "@size": "48956",
            "@ref": "gr14",
            "@mimetype": "image/jpeg"
          },
          {
            "@category": "thumbnail",
            "@height": "61",
            "@width": "219",
            "@_fa": "true",
            "$": "https://api.elsevier.com/content/object/eid/1-s2.0-S0926860X23005276-sc1.sml?httpAccept=%2A%2F%2A",
            "@multimediatype": "GIF image file",
            "@type": "IMAGE-THUMBNAIL",
            "@size": "3834",
            "@ref": "sc1",
            "@mimetype": "image/gif"
          },
          {
            "@category": "thumbnail",
            "@height": "117",
            "@width": "219",
            "@_fa": "true",
            "$": "https://api.elsevier.com/content/object/eid/1-s2.0-S0926860X23005276-gr1.sml?httpAccept=%2A%2F%2A",
            "@multimediatype": "GIF image file",
            "@type": "IMAGE-THUMBNAIL",
            "@size": "9700",
            "@ref": "gr1",
            "@mimetype": "image/gif"
          },
          {
            "@category": "thumbnail",
            "@height": "123",
            "@width": "219",
            "@_fa": "true",
            "$": "https://api.elsevier.com/content/object/eid/1-s2.0-S0926860X23005276-ga1.sml?httpAccept=%2A%2F%2A",
            "@multimediatype": "GIF image file",
            "@type": "IMAGE-THUMBNAIL",
            "@size": "10309",
            "@ref": "ga1",
            "@mimetype": "image/gif"
          },
          {
            "@category": "thumbnail",
            "@height": "164",
            "@width": "214",
            "@_fa": "true",
            "$": "https://api.elsevier.com/content/object/eid/1-s2.0-S0926860X23005276-gr3.sml?httpAccept=%2A%2F%2A",
            "@multimediatype": "GIF image file",
            "@type": "IMAGE-THUMBNAIL",
            "@size": "9562",
            "@ref": "gr3",
            "@mimetype": "image/gif"
          },
          {
            "@category": "thumbnail",
            "@height": "162",
            "@width": "66",
            "@_fa": "true",
            "$": "https://api.elsevier.com/content/object/eid/1-s2.0-S0926860X23005276-gr11.sml?httpAccept=%2A%2F%2A",
            "@multimediatype": "GIF image file",
            "@type": "IMAGE-THUMBNAIL",
            "@size": "4405",
            "@ref": "gr11",
            "@mimetype": "image/gif"
          },
          {
            "@category": "thumbnail",
            "@height": "164",
            "@width": "113",
            "@_fa": "true",
            "$": "https://api.elsevier.com/content/object/eid/1-s2.0-S0926860X23005276-gr2.sml?httpAccept=%2A%2F%2A",
            "@multimediatype": "GIF image file",
            "@type": "IMAGE-THUMBNAIL",
            "@size": "4203",
            "@ref": "gr2",
            "@mimetype": "image/gif"
          },
          {
            "@category": "thumbnail",
            "@height": "164",
            "@width": "162",
            "@_fa": "true",
            "$": "https://api.elsevier.com/content/object/eid/1-s2.0-S0926860X23005276-gr12.sml?httpAccept=%2A%2F%2A",
            "@multimediatype": "GIF image file",
            "@type": "IMAGE-THUMBNAIL",
            "@size": "17902",
            "@ref": "gr12",
            "@mimetype": "image/gif"
          },
          {
            "@category": "thumbnail",
            "@height": "164",
            "@width": "210",
            "@_fa": "true",
            "$": "https://api.elsevier.com/content/object/eid/1-s2.0-S0926860X23005276-gr5.sml?httpAccept=%2A%2F%2A",
            "@multimediatype": "GIF image file",
            "@type": "IMAGE-THUMBNAIL",
            "@size": "9022",
            "@ref": "gr5",
            "@mimetype": "image/gif"
          },
          {
            "@category": "thumbnail",
            "@height": "162",
            "@width": "58",
            "@_fa": "true",
            "$": "https://api.elsevier.com/content/object/eid/1-s2.0-S0926860X23005276-gr4.sml?httpAccept=%2A%2F%2A",
            "@multimediatype": "GIF image file",
            "@type": "IMAGE-THUMBNAIL",
            "@size": "7154",
            "@ref": "gr4",
            "@mimetype": "image/gif"
          },
          {
            "@category": "thumbnail",
            "@height": "162",
            "@width": "63",
            "@_fa": "true",
            "$": "https://api.elsevier.com/content/object/eid/1-s2.0-S0926860X23005276-gr10.sml?httpAccept=%2A%2F%2A",
            "@multimediatype": "GIF image file",
            "@type": "IMAGE-THUMBNAIL",
            "@size": "4434",
            "@ref": "gr10",
            "@mimetype": "image/gif"
          },
          {
            "@category": "thumbnail",
            "@height": "164",
            "@width": "164",
            "@_fa": "true",
            "$": "https://api.elsevier.com/content/object/eid/1-s2.0-S0926860X23005276-gr7.sml?httpAccept=%2A%2F%2A",
            "@multimediatype": "GIF image file",
            "@type": "IMAGE-THUMBNAIL",
            "@size": "10834",
            "@ref": "gr7",
            "@mimetype": "image/gif"
          },
          {
            "@category": "thumbnail",
            "@height": "163",
            "@width": "122",
            "@_fa": "true",
            "$": "https://api.elsevier.com/content/object/eid/1-s2.0-S0926860X23005276-gr15.sml?httpAccept=%2A%2F%2A",
            "@multimediatype": "GIF image file",
            "@type": "IMAGE-THUMBNAIL",
            "@size": "9874",
            "@ref": "gr15",
            "@mimetype": "image/gif"
          },
          {
            "@category": "thumbnail",
            "@height": "164",
            "@width": "114",
            "@_fa": "true",
            "$": "https://api.elsevier.com/content/object/eid/1-s2.0-S0926860X23005276-gr6.sml?httpAccept=%2A%2F%2A",
            "@multimediatype": "GIF image file",
            "@type": "IMAGE-THUMBNAIL",
            "@size": "12957",
            "@ref": "gr6",
            "@mimetype": "image/gif"
          },
          {
            "@category": "thumbnail",
            "@height": "164",
            "@width": "198",
            "@_fa": "true",
            "$": "https://api.elsevier.com/content/object/eid/1-s2.0-S0926860X23005276-gr9.sml?httpAccept=%2A%2F%2A",
            "@multimediatype": "GIF image file",
            "@type": "IMAGE-THUMBNAIL",
            "@size": "7534",
            "@ref": "gr9",
            "@mimetype": "image/gif"
          },
          {
            "@category": "thumbnail",
            "@height": "159",
            "@width": "219",
            "@_fa": "true",
            "$": "https://api.elsevier.com/content/object/eid/1-s2.0-S0926860X23005276-gr13.sml?httpAccept=%2A%2F%2A",
            "@multimediatype": "GIF image file",
            "@type": "IMAGE-THUMBNAIL",
            "@size": "17576",
            "@ref": "gr13",
            "@mimetype": "image/gif"
          },
          {
            "@category": "thumbnail",
            "@height": "164",
            "@width": "217",
            "@_fa": "true",
            "$": "https://api.elsevier.com/content/object/eid/1-s2.0-S0926860X23005276-gr8.sml?httpAccept=%2A%2F%2A",
            "@multimediatype": "GIF image file",
            "@type": "IMAGE-THUMBNAIL",
            "@size": "7477",
            "@ref": "gr8",
            "@mimetype": "image/gif"
          },
          {
            "@category": "thumbnail",
            "@height": "116",
            "@width": "219",
            "@_fa": "true",
            "$": "https://api.elsevier.com/content/object/eid/1-s2.0-S0926860X23005276-gr14.sml?httpAccept=%2A%2F%2A",
            "@multimediatype": "GIF image file",
            "@type": "IMAGE-THUMBNAIL",
            "@size": "13494",
            "@ref": "gr14",
            "@mimetype": "image/gif"
          },
          {
            "@category": "high",
            "@height": "839",
            "@width": "2994",
            "@_fa": "true",
            "$": "https://api.elsevier.com/content/object/eid/1-s2.0-S0926860X23005276-sc1_lrg.jpg?httpAccept=%2A%2F%2A",
            "@multimediatype": "JPEG image file",
            "@type": "IMAGE-HIGH-RES",
            "@size": "122487",
            "@ref": "sc1",
            "@mimetype": "image/jpeg"
          },
          {
            "@category": "high",
            "@height": "799",
            "@width": "1497",
            "@_fa": "true",
            "$": "https://api.elsevier.com/content/object/eid/1-s2.0-S0926860X23005276-gr1_lrg.jpg?httpAccept=%2A%2F%2A",
            "@multimediatype": "JPEG image file",
            "@type": "IMAGE-HIGH-RES",
            "@size": "70077",
            "@ref": "gr1",
            "@mimetype": "image/jpeg"
          },
          {
            "@category": "high",
            "@height": "886",
            "@width": "1574",
            "@_fa": "true",
            "$": "https://api.elsevier.com/content/object/eid/1-s2.0-S0926860X23005276-ga1_lrg.jpg?httpAccept=%2A%2F%2A",
            "@multimediatype": "JPEG image file",
            "@type": "IMAGE-HIGH-RES",
            "@size": "182031",
            "@ref": "ga1",
            "@mimetype": "image/jpeg"
          },
          {
            "@category": "high",
            "@height": "1340",
            "@width": "1746",
            "@_fa": "true",
            "$": "https://api.elsevier.com/content/object/eid/1-s2.0-S0926860X23005276-gr3_lrg.jpg?httpAccept=%2A%2F%2A",
            "@multimediatype": "JPEG image file",
            "@type": "IMAGE-HIGH-RES",
            "@size": "236411",
            "@ref": "gr3",
            "@mimetype": "image/jpeg"
          },
          {
            "@category": "high",
            "@height": "3063",
            "@width": "1247",
            "@_fa": "true",
            "$": "https://api.elsevier.com/content/object/eid/1-s2.0-S0926860X23005276-gr11_lrg.jpg?httpAccept=%2A%2F%2A",
            "@multimediatype": "JPEG image file",
            "@type": "IMAGE-HIGH-RES",
            "@size": "247783",
            "@ref": "gr11",
            "@mimetype": "image/jpeg"
          },
          {
            "@category": "high",
            "@height": "3624",
            "@width": "2495",
            "@_fa": "true",
            "$": "https://api.elsevier.com/content/object/eid/1-s2.0-S0926860X23005276-gr2_lrg.jpg?httpAccept=%2A%2F%2A",
            "@multimediatype": "JPEG image file",
            "@type": "IMAGE-HIGH-RES",
            "@size": "510145",
            "@ref": "gr2",
            "@mimetype": "image/jpeg"
          },
          {
            "@category": "high",
            "@height": "1008",
            "@width": "998",
            "@_fa": "true",
            "$": "https://api.elsevier.com/content/object/eid/1-s2.0-S0926860X23005276-gr12_lrg.jpg?httpAccept=%2A%2F%2A",
            "@multimediatype": "JPEG image file",
            "@type": "IMAGE-HIGH-RES",
            "@size": "77728",
            "@ref": "gr12",
            "@mimetype": "image/jpeg"
          },
          {
            "@category": "high",
            "@height": "1362",
            "@width": "1746",
            "@_fa": "true",
            "$": "https://api.elsevier.com/content/object/eid/1-s2.0-S0926860X23005276-gr5_lrg.jpg?httpAccept=%2A%2F%2A",
            "@multimediatype": "JPEG image file",
            "@type": "IMAGE-HIGH-RES",
            "@size": "230574",
            "@ref": "gr5",
            "@mimetype": "image/jpeg"
          },
          {
            "@category": "high",
            "@height": "4169",
            "@width": "1497",
            "@_fa": "true",
            "$": "https://api.elsevier.com/content/object/eid/1-s2.0-S0926860X23005276-gr4_lrg.jpg?httpAccept=%2A%2F%2A",
            "@multimediatype": "JPEG image file",
            "@type": "IMAGE-HIGH-RES",
            "@size": "454478",
            "@ref": "gr4",
            "@mimetype": "image/jpeg"
          },
          {
            "@category": "high",
            "@height": "3201",
            "@width": "1247",
            "@_fa": "true",
            "$": "https://api.elsevier.com/content/object/eid/1-s2.0-S0926860X23005276-gr10_lrg.jpg?httpAccept=%2A%2F%2A",
            "@multimediatype": "JPEG image file",
            "@type": "IMAGE-HIGH-RES",
            "@size": "294765",
            "@ref": "gr10",
            "@mimetype": "image/jpeg"
          },
          {
            "@category": "high",
            "@height": "2491",
            "@width": "2495",
            "@_fa": "true",
            "$": "https://api.elsevier.com/content/object/eid/1-s2.0-S0926860X23005276-gr7_lrg.jpg?httpAccept=%2A%2F%2A",
            "@multimediatype": "JPEG image file",
            "@type": "IMAGE-HIGH-RES",
            "@size": "295435",
            "@ref": "gr7",
            "@mimetype": "image/jpeg"
          },
          {
            "@category": "high",
            "@height": "3341",
            "@width": "2495",
            "@_fa": "true",
            "$": "https://api.elsevier.com/content/object/eid/1-s2.0-S0926860X23005276-gr15_lrg.jpg?httpAccept=%2A%2F%2A",
            "@multimediatype": "JPEG image file",
            "@type": "IMAGE-HIGH-RES",
            "@size": "501693",
            "@ref": "gr15",
            "@mimetype": "image/jpeg"
          },
          {
            "@category": "high",
            "@height": "3591",
            "@width": "2495",
            "@_fa": "true",
            "$": "https://api.elsevier.com/content/object/eid/1-s2.0-S0926860X23005276-gr6_lrg.jpg?httpAccept=%2A%2F%2A",
            "@multimediatype": "JPEG image file",
            "@type": "IMAGE-HIGH-RES",
            "@size": "871543",
            "@ref": "gr6",
            "@mimetype": "image/jpeg"
          },
          {
            "@category": "high",
            "@height": "1237",
            "@width": "1498",
            "@_fa": "true",
            "$": "https://api.elsevier.com/content/object/eid/1-s2.0-S0926860X23005276-gr9_lrg.jpg?httpAccept=%2A%2F%2A",
            "@multimediatype": "JPEG image file",
            "@type": "IMAGE-HIGH-RES",
            "@size": "149780",
            "@ref": "gr9",
            "@mimetype": "image/jpeg"
          },
          {
            "@category": "high",
            "@height": "1625",
            "@width": "2245",
            "@_fa": "true",
            "$": "https://api.elsevier.com/content/object/eid/1-s2.0-S0926860X23005276-gr13_lrg.jpg?httpAccept=%2A%2F%2A",
            "@multimediatype": "JPEG image file",
            "@type": "IMAGE-HIGH-RES",
            "@size": "267648",
            "@ref": "gr13",
            "@mimetype": "image/jpeg"
          },
          {
            "@category": "high",
            "@height": "1321",
            "@width": "1748",
            "@_fa": "true",
            "$": "https://api.elsevier.com/content/object/eid/1-s2.0-S0926860X23005276-gr8_lrg.jpg?httpAccept=%2A%2F%2A",
            "@multimediatype": "JPEG image file",
            "@type": "IMAGE-HIGH-RES",
            "@size": "173721",
            "@ref": "gr8",
            "@mimetype": "image/jpeg"
          },
          {
            "@category": "high",
            "@height": "1322",
            "@width": "2495",
            "@_fa": "true",
            "$": "https://api.elsevier.com/content/object/eid/1-s2.0-S0926860X23005276-gr14_lrg.jpg?httpAccept=%2A%2F%2A",
            "@multimediatype": "JPEG image file",
            "@type": "IMAGE-HIGH-RES",
            "@size": "212129",
            "@ref": "gr14",
            "@mimetype": "image/jpeg"
          },
          {
            "@category": "standard",
            "@_fa": "true",
            "$": "https://api.elsevier.com/content/object/eid/1-s2.0-S0926860X23005276-mmc1.docx?httpAccept=%2A%2F%2A",
            "@multimediatype": "Microsoft Word file",
            "@type": "APPLICATION",
            "@size": "377655",
            "@ref": "mmc1",
            "@mimetype": "application/word"
          },
          {
            "@category": "thumbnail",
            "@_fa": "true",
            "$": "https://api.elsevier.com/content/object/eid/1-s2.0-S0926860X23005276-si0001.svg?httpAccept=%2A%2F%2A",
            "@multimediatype": "Scalable Vector Graphics file",
            "@type": "ALTIMG",
            "@size": "5385",
            "@ref": "si0001",
            "@mimetype": "image/svg+xml"
          },
          {
            "@category": "thumbnail",
            "@_fa": "true",
            "$": "https://api.elsevier.com/content/object/eid/1-s2.0-S0926860X23005276-si0002.svg?httpAccept=%2A%2F%2A",
            "@multimediatype": "Scalable Vector Graphics file",
            "@type": "ALTIMG",
            "@size": "4850",
            "@ref": "si0002",
            "@mimetype": "image/svg+xml"
          },
          {
            "@category": "thumbnail",
            "@_fa": "true",
            "$": "https://api.elsevier.com/content/object/eid/1-s2.0-S0926860X23005276-si0003.svg?httpAccept=%2A%2F%2A",
            "@multimediatype": "Scalable Vector Graphics file",
            "@type": "ALTIMG",
            "@size": "1353",
            "@ref": "si0003",
            "@mimetype": "image/svg+xml"
          },
          {
            "@category": "thumbnail",
            "@_fa": "true",
            "$": "https://api.elsevier.com/content/object/eid/1-s2.0-S0926860X23005276-si0004.svg?httpAccept=%2A%2F%2A",
            "@multimediatype": "Scalable Vector Graphics file",
            "@type": "ALTIMG",
            "@size": "2228",
            "@ref": "si0004",
            "@mimetype": "image/svg+xml"
          },
          {
            "@category": "thumbnail",
            "@_fa": "true",
            "$": "https://api.elsevier.com/content/object/eid/1-s2.0-S0926860X23005276-si0005.svg?httpAccept=%2A%2F%2A",
            "@multimediatype": "Scalable Vector Graphics file",
            "@type": "ALTIMG",
            "@size": "1353",
            "@ref": "si0005",
            "@mimetype": "image/svg+xml"
          },
          {
            "@category": "thumbnail",
            "@_fa": "true",
            "$": "https://api.elsevier.com/content/object/eid/1-s2.0-S0926860X23005276-si0006.svg?httpAccept=%2A%2F%2A",
            "@multimediatype": "Scalable Vector Graphics file",
            "@type": "ALTIMG",
            "@size": "3055",
            "@ref": "si0006",
            "@mimetype": "image/svg+xml"
          },
          {
            "@category": "thumbnail",
            "@_fa": "true",
            "$": "https://api.elsevier.com/content/object/eid/1-s2.0-S0926860X23005276-si0007.svg?httpAccept=%2A%2F%2A",
            "@multimediatype": "Scalable Vector Graphics file",
            "@type": "ALTIMG",
            "@size": "911",
            "@ref": "si0007",
            "@mimetype": "image/svg+xml"
          },
          {
            "@category": "standard",
            "@_fa": "true",
            "$": "https://api.elsevier.com/content/object/eid/1-s2.0-S0926860X23005276-am.pdf?httpAccept=%2A%2F%2A",
            "@multimediatype": "Acrobat PDF file",
            "@type": "AAM-PDF",
            "@size": "3972066",
            "@ref": "am",
            "@mimetype": "application/pdf"
          }
        ]
      },
      "link": {
        "@rel": "abstract",
        "@href": "https://api.elsevier.com/content/abstract/scopus_id/85181733214"
      }
    }
  }
}