{
  "metadata": {
    "title": "CuZnAl embedded silicoaluminate catalyst promotion for the hydrogenation of carbon dioxide to dimethyl ether",
    "authors": "; ; ",
    "journal": "Applied Catalysis A: General",
    "date": "2025-06-25",
    "doi": "10.1016/j.apcata.2025.120286",
    "abstract": "",
    "uri": "https://api.elsevier.com/content/article/pii/S0926860X25001875",
    "pii": "S0926860X25001875"
  },
  "fulltext": {
    "full-text-retrieval-response": {
      "scopus-eid": "2-s2.0-105002581080",
      "originalText": "serial JL 271346 291210 291744 291809 31 Applied Catalysis A: General APPLIEDCATALYSISAGENERAL 2025-04-14 2025-04-14 2025-04-16 2025-04-16 2025-05-03T04:52:33 1-s2.0-S0926860X25001875 S0926-860X(25)00187-5 S0926860X25001875 10.1016/j.apcata.2025.120286 S300 S300.1 FULL-TEXT 1-s2.0-S0926860X25X00089 2025-05-03T03:59:01.047171Z 0 0 20250625 2025 2025-04-14T15:53:29.634618Z absattachment articleinfo articlenumber articletitlenorm authfirstinitialnorm authfirstsurnamenorm cid cids contenttype copyright crossmark dateloaded dateloadedtxt datesearch datesort dateupdated dco docsubtype doctype doi eid ewtransactionid hubeid indexeddate issn issnnorm itemstage itemtransactionid itemweight openaccess openarchive pg pgfirst pii piinorm pubdatestart pubdatetxt pubyr sortorder srctitle srctitlenorm srctype ssids alllist content subj subheadings suppl tomb volfirst volissue volumelist webpdf webpdfpagecount yearnav figure table e-component body mmlmath acknowledge affil appendices articletitle auth authfirstini authfull authkeywords authlast grantnumber grantsponsor grantsponsorid highlightsabst orcid primabst ref specialabst 0926-860X 0926860X true 700 700 C Volume 700 3 120286 120286 120286 20250625 25 June 2025 2025-06-25 2025 article fla © 2025 Elsevier B.V. All rights are reserved, including those for text and data mining, AI training, and similar technologies. CUZNALEMBEDDEDSILICOALUMINATECATALYSTPROMOTIONFORHYDROGENATIONCARBONDIOXIDEDIMETHYLETHER WEI Y 1 Introduction 2 Experimental 2.1 Catalyst preparation 2.2 Catalyst Characterization 2.3 Catalytic tests 3 Results and discussion 3.1 Catalyst characterization 3.2 Catalytic performance for CO 2 hydrogenation 4 Conclusion CRediT authorship contribution statement Acknowledgments Appendix A Supplementary material References HE 2013 9620 9633 M LIU 2018 S CATIZZONE 2021 55 77 E WU 2016 1859 1865 Y WALT 2015 11772 11782 S STANDL 2020 402 S CORDEROLANZAC 2022 320 329 T QIN 2015 1613 1627 Z STANGELAND 2018 4081 4094 K LIU 2022 C XIA 2023 S BONURA 2018 398 406 G REN 2019 1125 1133 S HUSSAIN 2023 A ZHA 2012 345 352 F ATEKA 2018 401 418 A YAO 2020 8635 8643 L BONURA 2013 16 24 G PHIENLUPHON 2015 605 611 R PINKAEW 2013 727 732 K WANG 2014 248 256 Y SANCHEZCONTADOR 2019 585 597 M SANCHEZCONTADOR 2018 258 268 M NIE 2012 419 425 R YANG 2011 229 235 G YANG 2010 8129 8136 G JEONG 2017 4484 4489 C SUN 2020 1276 1281 Y LIU 2022 Z MA 2024 Z WANG 2021 5422 5434 H LIU 2016 1004 1009 X CREPEAU 2006 15172 15185 G BONELLI 2004 95 106 B PHUNG 2015 110 115 T XU 2018 C BUSCA 2019 215 249 G WANG 2022 S VERMA 2024 R LI 2020 T WANG 2020 2648 2658 Z WISCHERT 2012 14430 14449 R CHUPAS 2011 8522 8524 P AKARMAZYAN 2014 136 148 S LIU 2011 1738 1742 D JONES 2014 17787 17800 A CUI 2021 2661 2672 X BONURA 2021 G GIULIANO 2021 A JIANG 2020 7984 8034 X ALOISE 2020 A SECCI 2023 F WEIX2025X120286 WEIX2025X120286XY 2027-04-16T00:00:00.000Z 2027-04-16T00:00:00.000Z http://creativecommons.org/licenses/by-nc-nd/4.0/ © 2025 Elsevier B.V. All rights are reserved, including those for text and data mining, AI training, and similar technologies. 2025-04-18T01:21:42.704Z http://vtw.elsevier.com/data/voc/AddOnTypes/50.7/aggregated-refined Fundamental Research Funds for the Central Universities 23CX10005A Fundamental Research Funds for the Central Universities http://data.elsevier.com/vocabulary/SciValFunders/501100012226 http://sws.geonames.org/1814991 http://sws.geonames.org/1814991 Ordos Key Research and Development Program YF20232313 http://sws.geonames.org/1814991 Taishan Scholar Foundation tspd20210308 Taishan Scholar Foundation of Shandong Province http://data.elsevier.com/vocabulary/SciValFunders/501100010029 http://sws.geonames.org/1814991 2022YFA1503400 Key Technologies Research and Development Program http://data.elsevier.com/vocabulary/SciValFunders/501100012165 http://sws.geonames.org/1814991 Key Project of National Key Research and Development Program of China National Natural Science Foundation of China 22472203 22272200 22372197 National Natural Science Foundation of China http://data.elsevier.com/vocabulary/SciValFunders/501100001809 http://sws.geonames.org/1814991 This work was financially supported by National Natural Science Foundation of China (22272200, 22472203 and 22372197), Key Project of National Key Research and Development Program of China (2022YFA1503400), Ordos Key Research and Development Program (YF20232313), Ordos industrial innovation talent team, Fundamental Research Funds for the Central Universities\\uFF0823CX10005A\\uFF09and Taishan Scholar Foundation (tspd20210308). https://doi.org/10.15223/policy-017 https://doi.org/10.15223/policy-037 https://doi.org/10.15223/policy-012 https://doi.org/10.15223/policy-029 https://doi.org/10.15223/policy-004 item S0926-860X(25)00187-5 S0926860X25001875 1-s2.0-S0926860X25001875 10.1016/j.apcata.2025.120286 271346 2025-05-03T03:59:01.047171Z 2025-06-25 1-s2.0-S0926860X25001875-main.pdf https://s3-eu-west-1.amazonaws.com/prod-ucs-content-store-eu-west/content/pii:S0926860X25001875/MAIN/application/pdf/e83b657ac14e1252c24c8b070cb33ae4/main.pdf main.pdf pdf true 8992967 MAIN 11 1-s2.0-S0926860X25001875-main_1.png https://s3-eu-west-1.amazonaws.com/prod-ucs-content-store-eu-west/content/pii:S0926860X25001875/PREVIEW/image/png/ffc19dc1e0c74afd2135529494c832bb/main_1.png main_1.png png 57816 849 656 IMAGE-WEB-PDF 1 1-s2.0-S0926860X25001875-gr4.jpg https://s3-eu-west-1.amazonaws.com/prod-ucs-content-store-eu-west/content/pii:S0926860X25001875/gr4/DOWNSAMPLED/image/jpeg/55d903020cf8d47c698d40ba51e5aa09/gr4.jpg gr4 gr4.jpg jpg 47968 308 678 IMAGE-DOWNSAMPLED 1-s2.0-S0926860X25001875-gr3.jpg https://s3-eu-west-1.amazonaws.com/prod-ucs-content-store-eu-west/content/pii:S0926860X25001875/gr3/DOWNSAMPLED/image/jpeg/413192678eb3909c1949ea75c712d5f7/gr3.jpg gr3 gr3.jpg jpg 37631 259 678 IMAGE-DOWNSAMPLED 1-s2.0-S0926860X25001875-gr6.jpg https://s3-eu-west-1.amazonaws.com/prod-ucs-content-store-eu-west/content/pii:S0926860X25001875/gr6/DOWNSAMPLED/image/jpeg/26c12ed73f76ac1350ef4699fd3f075f/gr6.jpg gr6 gr6.jpg jpg 87415 542 791 IMAGE-DOWNSAMPLED 1-s2.0-S0926860X25001875-gr5.jpg https://s3-eu-west-1.amazonaws.com/prod-ucs-content-store-eu-west/content/pii:S0926860X25001875/gr5/DOWNSAMPLED/image/jpeg/b6f54d064e2b8efedef169bac25cea4e/gr5.jpg gr5 gr5.jpg jpg 54016 469 678 IMAGE-DOWNSAMPLED 1-s2.0-S0926860X25001875-gr2.jpg https://s3-eu-west-1.amazonaws.com/prod-ucs-content-store-eu-west/content/pii:S0926860X25001875/gr2/DOWNSAMPLED/image/jpeg/3796a1489166d63c778eabe0780c1cd0/gr2.jpg gr2 gr2.jpg jpg 92639 424 791 IMAGE-DOWNSAMPLED 1-s2.0-S0926860X25001875-ga1.jpg https://s3-eu-west-1.amazonaws.com/prod-ucs-content-store-eu-west/content/pii:S0926860X25001875/ga1/DOWNSAMPLED/image/jpeg/9222a354a9c65410dd22e7d3f9d56acd/ga1.jpg ga1 true ga1.jpg jpg 19839 200 349 IMAGE-DOWNSAMPLED 1-s2.0-S0926860X25001875-gr1.jpg https://s3-eu-west-1.amazonaws.com/prod-ucs-content-store-eu-west/content/pii:S0926860X25001875/gr1/DOWNSAMPLED/image/jpeg/87ce7c1f0e1dedfa243b23f17f6dd607/gr1.jpg gr1 gr1.jpg jpg 164550 669 791 IMAGE-DOWNSAMPLED 1-s2.0-S0926860X25001875-sc1.jpg https://s3-eu-west-1.amazonaws.com/prod-ucs-content-store-eu-west/content/pii:S0926860X25001875/sc1/DOWNSAMPLED/image/jpeg/29fbf26b10c7d4bb43d367a395ad5f41/sc1.jpg sc1 sc1.jpg jpg 14197 124 565 IMAGE-DOWNSAMPLED 1-s2.0-S0926860X25001875-gr7.jpg https://s3-eu-west-1.amazonaws.com/prod-ucs-content-store-eu-west/content/pii:S0926860X25001875/gr7/DOWNSAMPLED/image/jpeg/59f51011ea2cee421ab0eaef4444464f/gr7.jpg gr7 gr7.jpg jpg 42217 347 508 IMAGE-DOWNSAMPLED 1-s2.0-S0926860X25001875-gr4.sml https://s3-eu-west-1.amazonaws.com/prod-ucs-content-store-eu-west/content/pii:S0926860X25001875/gr4/THUMBNAIL/image/gif/c5d079ebb1f0903973eecee70c663b55/gr4.sml gr4 gr4.sml sml 8083 99 219 IMAGE-THUMBNAIL 1-s2.0-S0926860X25001875-gr3.sml https://s3-eu-west-1.amazonaws.com/prod-ucs-content-store-eu-west/content/pii:S0926860X25001875/gr3/THUMBNAIL/image/gif/d8995eef0b02af35d0cb8ae8ce409cd6/gr3.sml gr3 gr3.sml sml 6051 84 219 IMAGE-THUMBNAIL 1-s2.0-S0926860X25001875-gr6.sml https://s3-eu-west-1.amazonaws.com/prod-ucs-content-store-eu-west/content/pii:S0926860X25001875/gr6/THUMBNAIL/image/gif/5d9098135c5a17f652056ca07bf42cad/gr6.sml gr6 gr6.sml sml 12075 150 219 IMAGE-THUMBNAIL 1-s2.0-S0926860X25001875-gr5.sml https://s3-eu-west-1.amazonaws.com/prod-ucs-content-store-eu-west/content/pii:S0926860X25001875/gr5/THUMBNAIL/image/gif/3016e8326250e28eb536d4c5753fadbe/gr5.sml gr5 gr5.sml sml 8301 151 219 IMAGE-THUMBNAIL 1-s2.0-S0926860X25001875-gr2.sml https://s3-eu-west-1.amazonaws.com/prod-ucs-content-store-eu-west/content/pii:S0926860X25001875/gr2/THUMBNAIL/image/gif/9d3a9ddaffaab25ce0cdb28171a68031/gr2.sml gr2 gr2.sml sml 10547 117 219 IMAGE-THUMBNAIL 1-s2.0-S0926860X25001875-ga1.sml https://s3-eu-west-1.amazonaws.com/prod-ucs-content-store-eu-west/content/pii:S0926860X25001875/ga1/THUMBNAIL/image/gif/b470d70ab9855f6b730d20f576bc4127/ga1.sml ga1 true ga1.sml sml 12099 126 219 IMAGE-THUMBNAIL 1-s2.0-S0926860X25001875-gr1.sml https://s3-eu-west-1.amazonaws.com/prod-ucs-content-store-eu-west/content/pii:S0926860X25002054/gr1/THUMBNAIL/image/gif/f7dd25362c78081efee294772eec5f5a/gr1.sml gr1 gr1.sml sml 19283 164 194 IMAGE-THUMBNAIL 1-s2.0-S0926860X25001875-sc1.sml https://s3-eu-west-1.amazonaws.com/prod-ucs-content-store-eu-west/content/pii:S0926860X25001875/sc1/THUMBNAIL/image/gif/045f90ee1df2390eb26990d3dae8c119/sc1.sml sc1 sc1.sml sml 3005 48 219 IMAGE-THUMBNAIL 1-s2.0-S0926860X25001875-gr7.sml https://s3-eu-west-1.amazonaws.com/prod-ucs-content-store-eu-west/content/pii:S0926860X25002054/gr7/THUMBNAIL/image/gif/d511a338f6f73a1beea61648ef362f21/gr7.sml gr7 gr7.sml sml 9968 150 219 IMAGE-THUMBNAIL 1-s2.0-S0926860X25001875-gr4_lrg.jpg https://s3-eu-west-1.amazonaws.com/prod-ucs-content-store-eu-west/content/pii:S0926860X25001875/HIGHRES/image/jpeg/09230eed3b047ebde7913fe93df7ba18/gr4_lrg.jpg gr4 gr4_lrg.jpg jpg 260403 1358 2994 IMAGE-HIGH-RES 1-s2.0-S0926860X25001875-gr3_lrg.jpg https://s3-eu-west-1.amazonaws.com/prod-ucs-content-store-eu-west/content/pii:S0926860X25001875/HIGHRES/image/jpeg/a4cb6ac7bf42c9d41e2ce9d45b9247d9/gr3_lrg.jpg gr3 gr3_lrg.jpg jpg 198065 1145 2994 IMAGE-HIGH-RES 1-s2.0-S0926860X25001875-gr6_lrg.jpg https://s3-eu-west-1.amazonaws.com/prod-ucs-content-store-eu-west/content/pii:S0926860X25001875/HIGHRES/image/jpeg/b2b37ddce60e5fe27b1209b6c13ec242/gr6_lrg.jpg gr6 gr6_lrg.jpg jpg 441959 2395 3493 IMAGE-HIGH-RES 1-s2.0-S0926860X25001875-gr5_lrg.jpg https://s3-eu-west-1.amazonaws.com/prod-ucs-content-store-eu-west/content/pii:S0926860X25001875/HIGHRES/image/jpeg/92fbe2007287141ccf49eb7693712548/gr5_lrg.jpg gr5 gr5_lrg.jpg jpg 314725 2069 2994 IMAGE-HIGH-RES 1-s2.0-S0926860X25001875-gr2_lrg.jpg https://s3-eu-west-1.amazonaws.com/prod-ucs-content-store-eu-west/content/pii:S0926860X25001875/HIGHRES/image/jpeg/dcbfe1696b30c50e07becd7dcc526bff/gr2_lrg.jpg gr2 gr2_lrg.jpg jpg 500085 1871 3493 IMAGE-HIGH-RES 1-s2.0-S0926860X25001875-ga1_lrg.jpg https://s3-eu-west-1.amazonaws.com/prod-ucs-content-store-eu-west/content/pii:S0926860X25001875/HIGHRES/image/jpeg/eed8d74eba9cf105bbcfbe597e191fa0/ga1_lrg.jpg ga1 true ga1_lrg.jpg jpg 149794 886 1545 IMAGE-HIGH-RES 1-s2.0-S0926860X25001875-gr1_lrg.jpg https://s3-eu-west-1.amazonaws.com/prod-ucs-content-store-eu-west/content/pii:S0926860X25002054/HIGHRES/image/jpeg/d75e7bc95f96deb52e2d9c2eaf43f508/gr1_lrg.jpg gr1 gr1_lrg.jpg jpg 1198999 2955 3493 IMAGE-HIGH-RES 1-s2.0-S0926860X25001875-sc1_lrg.jpg https://s3-eu-west-1.amazonaws.com/prod-ucs-content-store-eu-west/content/pii:S0926860X25002054/HIGHRES/image/jpeg/81f9f10e93b9c28249482f1459a6244f/sc1_lrg.jpg sc1 sc1_lrg.jpg jpg 76954 546 2495 IMAGE-HIGH-RES 1-s2.0-S0926860X25001875-gr7_lrg.jpg https://s3-eu-west-1.amazonaws.com/prod-ucs-content-store-eu-west/content/pii:S0926860X25002054/HIGHRES/image/jpeg/99e69a7f0fe49ba4b9e9ebdf98519253/gr7_lrg.jpg gr7 gr7_lrg.jpg jpg 215925 1533 2245 IMAGE-HIGH-RES 1-s2.0-S0926860X25001875-mmc1.docx https://s3-eu-west-1.amazonaws.com/prod-ucs-content-store-eu-west/content/pii:S0926860X25001875/mmc1/MAIN/application/vnd.openxmlformats-officedocument.wordprocessingml.document/6763839582be1b5b41bbcb5dd491c17f/mmc1.docx mmc1 mmc1.docx docx 14577828 APPLICATION 1-s2.0-S0926860X25001875-si0001.svg https://s3-eu-west-1.amazonaws.com/prod-ucs-content-store-eu-west/content/pii:S0926860X25001875/image/svg+xml/2f6f31cbdae3a21deab842331ab2cc79/si0001.svg si0001 si0001.svg svg 3906 ALTIMG 1-s2.0-S0926860X25001875-si0002.svg https://s3-eu-west-1.amazonaws.com/prod-ucs-content-store-eu-west/content/pii:S0926860X25001875/image/svg+xml/86da8ea0653344f09af00f2ff1032754/si0002.svg si0002 si0002.svg svg 2913 ALTIMG 1-s2.0-S0926860X25001875-si0003.svg https://s3-eu-west-1.amazonaws.com/prod-ucs-content-store-eu-west/content/pii:S0926860X25001875/image/svg+xml/b0811503cd7f52cbe913aa115faaa696/si0003.svg si0003 si0003.svg svg 2244 ALTIMG APCATA 120286 120286 S0926-860X(25)00187-5 10.1016/j.apcata.2025.120286 Elsevier B.V. Fig. 1 (a) Schematic diagram of catalyst synthesis, TEM images of the catalysts: (b) CZA@SiO2, (c) (d) CZA@8SA-J-0.2, (e) CZA@4SA-J-0.2 and (f) CZA@8SA-J-0, HADDF images and EDS elemental mapping results of the catalyst: (g) CZA@8SA-J-0.2, (h) CZA@8SA-J-0. Fig. 1 Fig. 2 (a) N2 adsorption desorption curve of CZA@xSA-J-0.2, (b) pore size distribution curve of CZA@xSA-J-0.2, (c) NH3-TPD spectra of CZA@xSA-J-0.2. (d) N2 adsorption desorption curve of CZA@8SA-J-y, (e) pore size distribution curve of CZA@8SA-J-y, (c) NH3-TPD curves of CZA@8SA-J-y. Fig. 2 Fig. 3 (a)3000 cm−1-4000cm−1, (b) 950 cm−1-1200 cm−1 vacuum FT-IR spectra of CZA@8SA-J-y. Fig. 3 Fig. 4 (a) Cu2p XPS spectra and (b) Zn2p XPS spectra with different CTAB additive amount. Fig. 4 Fig. 5 (a) 1D 27Al MAS NMR spectrum of different amounts of CTAB added; (b) Relative peak area of 1D MAS 27Al spectra. Fig. 5 Fig. 6 Reaction performance of catalysts with (a) different Si/Al and (b) CTAB addition levels; (c) The relationship between DME selectivity of catalyst and catalyst pore size and acid content under different CTAB addition amount; (d) Reaction performance of CZA@8SA-J-0.1 at different temperatures. Fig. 6 Fig. 7 In situ DRIFT spectra of CZA@8SA-J-0.1 at different temperatures. Fig. 7 Scheme 1 Schematic diagram of acid production with CTAB added. Scheme 1 Table 1 Pore Structure properties of CZA@8SA-J-y Catalysts. Table 1 Sample SBET/(m2/g) Smeso/(m2/g) Vt/(cm3/g) Pore Size/(nm) CZA@8SA-J−0.4 163 133 0.407 9.31 CZA@8SA-J−0.2 208 191 0.531 6.73 CZA@8SA-J−0.1 176 170 0.30 5.47 CZA@8SA-J−0.05 168 154 0.37 5.37 CZA@8SA-J−0 142 129 0.31 5.05 SBET, Smeso and Vt are denoted as total specific surface area by BET method, mesoporous specific surface area average pore size by BJH method and pore volume determined at p/p0 = 0.995, respectively. Table 2 Normalized molar composition of three aluminum species. Table 2 Samples Composition % AlIV AlV AlVI AlIV+AlV CZA@8SA-J−0 36.26 22.32 41.42 58.58 CZA@8SA-J−0.1 27.43 40.23 32.34 67.66 CZA@8SA-J−0.2 42.68 32.59 24.72 75.28 CuZnAl embedded silicoaluminate catalyst promotion for the hydrogenation of carbon dioxide to dimethyl ether Yifan Wei Writing – original draft Validation Methodology Investigation Formal analysis Data curation a Jingyi Liu Writing – original draft Validation Methodology Investigation Formal analysis Data curation a Hanbo Li Writing – original draft Methodology Investigation Formal analysis Data curation a Xian Zhang Supervision Project administration Methodology Conceptualization b Ying Zhang Writing – review & editing Validation Methodology Formal analysis a Jiangong Yang Supervision Project administration Methodology Funding acquisition b Mingpei Wang Supervision Project administration Conceptualization b Zhen Liu Writing – review & editing Project administration Methodology Formal analysis Conceptualization a b ⁎ Zifeng Yan Writing – review & editing Supervision Project administration Funding acquisition Conceptualization a a State Key Laboratory of Heavy Oil Processing, College of Chemistry and Chemical Engineering, China University of Petroleum (East China), Qingdao, Shandong 266580, China State Key Laboratory of Heavy Oil Processing, College of Chemistry and Chemical Engineering, China University of Petroleum (East China) Qingdao Shandong 266580 China State Key Laboratory of Heavy Oil Processing, College of Chemistry and Chemical Engineering, China University of Petroleum (East China), Qingdao, 266580, Shandong, China b Ordos Carbon Neutral Research Institute, Ordos, Inner Mongolia 017000, China Ordos Carbon Neutral Research Institute Ordos Inner Mongolia 017000 China Ordos Carbon Neutral Research Institute, Ordos, 017000, Inner Mongolia, China ⁎ Corresponding author at: State Key Laboratory of Heavy Oil Processing, College of Chemistry and Chemical Engineering, China University of Petroleum (East China), Qingdao, Shandong 266580, China. State Key Laboratory of Heavy Oil Processing, College of Chemistry and Chemical Engineering, China University of Petroleum (East China) Qingdao Shandong 266580 China The resource utilization of CO2 serves as a feasible method for emission reduction and the establishment of an artificial carbon cycle. This study primarily focuses on the direct synthesis of dimethyl ether (DME) from the hydrogenation of CO2. We have prepared bifunctional catalysts with metal oxides embedded in amorphous silicon-aluminum by an improved Stöber method. By precisely adjusting the Si/Al molar ratio and the CTAB/Si molar ratio in the synthesis precursor solution, structural characteristics and acid properties of the catalyst could be effectively regulated. The results indicated that compared to Cu/ZnO/Al2O3, the catalyst significantly enhanced the selectivity of DME and methanol (MeOH), reduced the selectivity of CO with a moderate conversion rate of CO2. The highest DME selectivity of 37.94 % was achieved at an Si/Al ratio of 8, with the total selectivity for methanol and DME reaching 52.96 %. The addition of cetyltrimethylammonium bromide (CTAB) increased the proportion of Brønsted acid sites and medium-strong acid sites, thereby enhancing methanol dehydration and suppressing the reverse water-gas shift reaction. The optimal selectivity for DME of 43 % was obtained over catalyst prepared with a CTAB/Si molar ratio of 0.1. This study provides a new strategy for the structural design of bifunctional catalysts for CO2 hydrogenation. Graphical Abstract Keywords Carbon dioxide hydrogenation Dimethyl ether Bifunctional catalyst Embedding structure Data availability Data will be made available on request. 1 Introduction CO2 utilization is a viable method for emission reduction and a new approach to artificial carbon cycling [1,2]. Due to the high thermodynamic stability of CO2 molecules and their potential as weak oxidizing agent, hydrogenation transformation of CO2 into oxygen-containing compounds was an ideal method. Among the oxygenated compounds from CO2 hydrogenation, methanol and dimethyl ether (DME) attracted significant attention due to their higher selectivity [3–5]. Methanol and DME were the most important basic raw materials in the chemical industry and could be used to synthesize a variety of high value-added chemical products, occupying an important position in the development of chemicals and materials. DME could not only be used as a fuel additive but also serve as a raw material for producing light olefins. The DMTO (dimethyl ether to olefins) process could be combined or replace the MTO (methanol to olefins) [6], and MTP (methanol to propylene) [7] processes. The thermodynamic results also indicated that the reaction of CO2 to DME had lower enthalpy and Gibbs free energy than the reaction of CO2 to methanol [8,9]. Further conversion of methanol to DME could break the thermodynamic limitations of CO2 to methanol and suppress the side reaction reverse water gas shift reaction (RWGS). By calculating the equilibrium yields of DME and methanol in the CO2 hydrogenation reaction, it was found that under the equilibrium yield of DME in the CO2 hydrogenation process is much higher than that of methanol under identical reaction conditions [10]. A typical DME synthesis bifunctional catalyst usually includes methanol synthesis components like Cu/ZnO/Al2O3 (CZA) and methanol dehydration components like acidic solid [11]. The commonly used combination methods were physical mixing method [12,13], impregnation method [14], co-precipitation method [15], etc. These methods were all designed to make the methanol synthesis component and the methanol dehydration component more efficiently coupled and to enhance the synergy of the two components. Ateka et al. [16] compared different combination strategies for CuO-ZnO-MnO and SAPO-18. The study found that when the two catalysts were mixed at an optimal mass ratio of 2/1 (methanol synthesis component/methanol dehydration component), the CO2 conversion rate of the catalyst prepared by the chemical loading method was twice that of the dual-bed strategy, with a 10 % increase in DME selectivity. This chemical loading strategy enhanced the \"synthesis-dehydration\" synergistic effect of methanol intermediates by constructing nanoscale intimate contact between metal-acidic sites, thereby improving the efficiency of methanol synthesis and dehydration. Yao et al. [17] demonstrated that the proximity of the two functional active centers facilitated the transfer of methoxy intermediates from methanol synthesis sites to dehydration sites. They further investigated the impact of different composite configurations on reaction pathways and discovered that when the two active centers were sufficiently close without mutual coverage, DME could be generated through a shortcut methoxy-DME pathway without requiring methanol formation as an intermediate, thereby more effectively enhancing DME selectivity. Bonura et al. [18] further explored the influence of mixed catalyst types on catalytic performance. They observed that catalysts composed of mechanically mixed Cu-ZnO-ZrO2 and HZSM-5 zeolite (mass ratio 1:1) outperformed chemically loaded catalysts. This phenomenon was attributed to the potential blockage of the zeolite's pores by metal particles during the metal loading process, which compromised catalytic performance. As a typical tandem reaction, CO2 was converted to methanol, and then methanol was dehydrated to DME. From the perspective of the reaction pathway, the core-shell structure and its similar structure are undoubtedly the most suitable catalyst configuration for complex reaction systems. The core-shell structure of Cu/ZnO/Al2O3 catalyst made the intermediate methanol formed on the Cu/ZnO/Al2O3 core more evenly mixed with the dehydration active site, which makes the reaction closer to the optimal transmission path [19–21]. This structure optimized the transport path of reactants compared to physically mixed or non-core-shell composite catalysts. Sanchez Contador et al. [22,23] prepared a CuO-ZnO-ZrO2@SAPO-11 core-shell catalyst using a physical bonding method with a SiO2 solution as the binder. In this configuration, methanol synthesis occurred in the CuO-ZnO-ZrO2 core, followed by diffusion and subsequent dehydration in the surrounding SAPO-11 acidic shell. For the hydrogenation of a CO2+CO mixture, this core-shell catalyst achieved a DME yield of 8.7 % and 81 % DME selectivity. The core-shell catalyst exhibited distinct advantages over mixed catalysts. The core-shell structure also effectively minimized adverse effects caused by interactions between different phases. Nie et al. [24] specifically emphasized the importance of confining Cu species within the core, which effectively prevented their migration to acidic functional regions, thereby maintaining the catalyst’s efficiency and stability. Although the physical bonding method was simple to implement, it often resulted in weak adhesion, and the presence of a SiO2 layer between the methanol synthesis and dehydration components covered some acidic sites, reducing DME selectivity. In addition to the physical bonding method, the core-shell structure could also be achieved by growing solid acids on the surface of metal oxides. However, there are various difficulties when growing zeolites on the surface of metal complexes in order to form a core-shell configuration. On the one hand, it was difficult to prepare defect-free H-type zeolite shells on the surface of metal oxides without precursors such as NaOH, KOH, Cl-, Br- in the synthesis solution [25]. If sodium hydroxide was added to prepare the zeolite shell, ion exchange was required, which could rapidly deactivate the metal compound core. On the other hand, metal oxide catalysts were prone to dissolution and dispersion during the hydrothermal synthesis process of the zeolite film. Zeolite, particularly ZSM-5, was the most commonly used methanol dehydration catalyst, but the strong acidic sites also encouraged the formation of by-products and the deposition of coke, resulting in catalyst deactivation. Numerous studies had proposed strategies to address the above issues. Yang et al. [26] successfully synthesized an HZSM-5 zeolite shell directly using an aluminum-free, near-neutral S-1 zeolite synthesis solution, where aluminum migrated from the CZA core catalyst to serve as the sole aluminum source for constructing the zeolite framework. During the synthesis, the aluminum-containing core catalyst acted both as a substrate for zeolite membrane growth and as the exclusive aluminum source, enabling defect-free and tightly wrapped coverage of the zeolite shell on its surface. Compared to traditional HZSM-5 zeolite membrane synthesis methods, this approach effectively minimized damage to the substrate caused by hydrothermal precursor solutions. Under reaction conditions of 523 K and 5.0 MPa, the catalyst prepared via the traditional HZSM-5 zeolite membrane method exhibited a CO2 conversion rate of 5.59 %, whereas the Silicalite-1 synthesis method increased CO2 conversion to 30.40 % with 78.57 % DME selectivity. Tsubaki et al. [25] first synthesized a neutral Silicalite-1 zeolite shell layer on a bimetallic Cr/ZnO core catalyst as an intermediate layer for the subsequent direct synthesis of an HZSM-5 zeolite shell. This dual-layer approach facilitated the formation of HZSM-5 membranes on millimeter-scale bimetallic substrates. The resulting zeolite capsule catalyst enabled precise control over DME synthesis, achieving 50.84 % DME selectivity under conditions of 623 K and 5.0 MPa. Embedding Cu-based catalysts into the bulk phase of solid acid catalysts to form embedded core-shell-like bifunctional catalysts also demonstrated excellent catalytic performance [27,28]. Sun et al. [28] prepared a bifunctional catalyst with Cu-ZnO particles fully embedded in mesoporous alumina by introducing pre-synthesized copper-zinc oxalate into an aluminum isopropoxide-containing precursor via an evaporation-induced assembly method. This embedded structure exhibited spatial confinement effects, which not only enhanced methanol dehydration rates but also suppressed Cu sintering during the reaction. According to our earlier research, amorphous silica-alumina species (SA) could also provide sufficient acid strength for dehydration. It was more moderate than ZSM-5 strong acid, which prevented the creation of coke and other byproducts [29]. The relatively mild synthesis conditions reduced the damage to metal oxides. However, the acid strength of amorphous silicon aluminum was too weak, which will led to the decrease of methanol dehydration. As a result, controlling the acidity of amorphous silicon aluminum remained challenging. Here, we described a simple procedure for embedding methanol synthesis component CZA into the methanol dehydration component SA using a modified Stöber method followed by dry-gel crystallization, which produced SA with good aluminum dispersion and improved acidity without significant destruction of CZA. The effects of initial Si/Al and CTAB/Si on the structure and acidity of the catalyst were systematically studied. XRD, XPS, TEM, BET and NMR characterization techniques were used to find the effect of this on the morphology, structural characteristics, coordination environment and acidic properties of SA after synthesis. The embedded structure catalyst was used for the direct synthesis of dimethyl ether from CO2. The effects of preparation conditions and reaction temperature on the catalytic performance were studied and discussed in detail. 2 Experimental 2.1 Catalyst preparation CuO-ZnO-Al2O3 catalyst (CZA) for methanol synthesis was synthesized using conventional co precipitation method [29], where the atomic ratio of Cu: Zn: Al was 6:3:1. Under stirring, A calculated amount of 0.1 mol/L Na2CO3 solution was added dropwise to a 0.1 mol/L mixed solution of Cu, Zn, and Al nitrate while stirring at the same drop rate, and the precipitation environment was kept at 65 °C and pH 6.5–7.5. Aging in a water bath under stirring conditions was lasted for another 1 hour after precipitation. The obtained precipitate is filtered, washed, dried, and then placed in a muffle furnace for 4 hours at 350 °C to obtain the methanol synthesis catalyst CZA. A embedded bifunctional catalyst, denoted as CZA@xSA-J-y, was prepared using the modified Stöber method [30] (x: the molar ratio of Si to Al in the initial raw materials, y: the molar ratio of CTAB to Si in the initial raw materials). The schematic diagram of catalyst synthesis is shown in Fig. 1(a). Typically, isopropyl alcohol aluminum (amount was calculated according to Si to Al molar ratios of 4.0, 8.0, and 12.0 in the initial raw materials) and a certain amount of CTAB (with CTAB to Si molar ratios of 0.4, 0.2, 0.1, 0.05, and 0) were added to 400 mL of anhydrous ethanol. After complete dissolution, 1 g of CZA was added to above prepared solution. Subsequently, 2.04 g of TEOS was dripped into the mixed solution. The mixture was stirred at room temperature for another 3 hours to allow complete hydrolysis of TEOS. Then, 40 mL of deionized water and 10 mL of ammonia water were added to the aforementioned suspension, which was further stirred at room temperature for an additional 4 hours. The suspension was filtered and washed with 2000 mL of pure water for several times. Next, a certain amount of CZA@xSA-y was placed into a polytetrafluoroethylene (PTFE) vial, which was positioned on top of a lining, with deionized water added below the lining (1 g of solid: 3 mL of water). The reaction vessel was then placed in a drying oven and treated at 150 °C for 48 hours. After the hydrothermal treatment, the samples were filtered, washed to neutral, and dried overnight in a 100 °C drying oven. The dried samples were calcined in a muffle furnace at a certain temperature for 6 hours to remove the organic compounds, resulting in the final catalyst, CZA@xSA-J-y. 2.2 Catalyst Characterization The catalyst was analyzed by X-ray diffraction using the X′ Pert Pro MPD polycrystalline powder X-ray diffractometer at 40 kV and 40 mA produced by Panaco in the Netherlands. The diffraction source used was Cu Kα (λ=0.15406 nm) with a range of 3°-90°. The elemental composition of the sample was analyzed using an X-ray fluorescence spectrometer (XRF), which was an AXIOS Petro X-ray fluorescence spectrometer produced by Panaco in the Netherlands. Before analysis, mixed the sample evenly with trimethyl cellulose in equal proportions, then mixed it with boric acid and press it into shape before testing. The acid strength and acidity of the sample were characterized using NH3-TPD. The instrument used was the Auto Chem Ⅱ 2920 fully automatic chemical adsorption instrument produced by Micromeritics in the United States. After compressing the 100 mg sample into tablets (20–40 mesh), placed it in a U-shaped sample tube for NH3-TPD measurement. Firstly, helium gas was introduced to pretreat the sample at high temperature for a certain period of time. After it cooling down to programmed temperature of 60 °C, NH3/He mixture was introduced for adsorption. Then, helium flow was used to purge until the TCD baseline reached stable, and the sample was heated to 600 °C with increasing temperature rate of 10 °C/min, while, the effluent was monitored by TCD. The elemental composition and chemical valence of the samples were analyzed by X-ray photoelectron spectroscopy (XPS) by Thermo Scientific Escalab 250Xi X-ray photoelectron spectroscopy. The specific surface area and pore volume of the sample were measured using the TriStar 3020 physical adsorption instrument from Micromeritics in the United States. Before testing, the sample was first degassed at room temperature for 30 minutes, and then degassed at 300 °C for 4 hours. The pore structure data of the catalyst were determined by measuring the adsorption desorption data of nitrogen at boiling point (77 K). Transmission electron microscopy (TEM), high-angle annular dark-filed scanning transmission electron microscopy (HAADF-STEM) and energy dispersive X-ray analysis (EDX) were conducted by the JEM-2010UHR field mission transmission electron microscopy operated at 200 kV. Before sample testing, ultrasonic dispersion was required to disperse it into an ethanol solution, and then the supernatant is dropped onto a copper mesh. Use JSM-7900F scanning electron microscope (SEM) for sample morphology collection with an acceleration voltage of 0.5–20 kV. The reducibility of the sample was tested using an Auto Chem II 2920 dynamic chemical adsorption analyzer. The sample (20–40 mesh) was placed in the sample tube and dried under a programmed temperature increase from room temperature to 300 °C. The sample was purged with He gas flow for 1 h and cooled to room temperature. Subsequently, 10 vol% H2/Ar gas was introduced while heating the sample from room temperature to 600 °C. For the CO2-TPD measurement, 100 mg of sample was weighed and placed in the reaction tube. It was dried under a programmed temperature increase from room temperature to 300 °C. The sample was purged with He gas flow for 1 h. 10 % CO2/He mixture gas was introduced until saturation was achieved. The gas flow was then switched to He for 1 h of purging. Finally, the temperature was increased to 700 °C in He atmosphere at a heating rate, with the desorbed gas detected by a TCD detector. Fourier - transform infrared spectrometry was used for analysis (FT-IR). Prepared the sample into uniform thin sheets with appropriate thickness to ensure effective penetration of infrared light. Placed the sample into the sample chamber, gradually evacuated to the desired vacuum level (10−2-10−3 Pa), and heated up to 300 °C to remove moisture. Using a Brooke 400 M wide cavity solid-state nuclear magnetic resonance spectrometer, the 27Al NMS NMR was measured to obtain the coordination information of aluminum ions. In situ DRIFTS analysis was performed to monitor species generated on the catalyst during the reaction. All spectra were recorded with over 20 cumulative scans at a resolution of 4 cm−1 in the range of 850–4000 cm−1. The catalyst sample (∼5 mg) was first reduced under a H2 atmosphere at 300 °C for 30 min and then cooled to 25 °C in N2. Subsequently, the gas feed was switched to a mixture of CO2 and H2 (V(CO2)/V(H2) = 1:3) under normal pressure. After heating to the target temperature, the spectra were recorded. 2.3 Catalytic tests CO2 hydrogenation reaction was carried out in a continuous flow fixed bed reactor with 8 mm inner diameter. 1.0 g of catalyst (20–40 mesh) was loaded in the constant temperature section of the reaction tube with quartz sands filling at both side of the catalyst bed. Before the reaction, the catalyst was reduced at 280 °C for 4 hours using H2/N2 (1/9, volume ratio) with a flow rate of 100 mL·gcat −1·h−1. After lowering to the reaction temperature, the reaction began under the following conditions: 260 °C, 3.0 MPa, V (H2)/V(CO2)= 3.0, and a space velocity (SV) of 1800 mL·gcat −1·h−1. Gas phase products were analyzed online using a gas chromatograph with TCD detector. The CO2 conversion rate and product selectivity were calculated using the carbon atom conservation method, and the calculation formula is as follows: (2-1) X CO 2 = ∑ i = 1 n n i f i A i / ( ∑ i = 1 n n i f i A i + f CO 2 A CO 2 ) × 100 % (2-2) S i = n i f i A i / ∑ i = 1 n n i f i A i × 100 % (2-3) Y i = X CO 2 × S i × 100 % Among them, X CO2, i, S i, n i, f i, A i and Y i represent CO2 conversion rate, different product components, selectivity of product i, number of carbon atoms in product i, correction factor of product i, peak area of product i, and yield of product i, respectively. 3 Results and discussion 3.1 Catalyst characterization Firstly, we investigated the influence of different silicon-to-aluminum ratios on the structure and acidic characteristics of catalysts. Traditional Stöber method was firstly employed to prepare CZA@SiO2 without aluminum addition. The TEM image of the as-prepared CZA@SiO2 in Fig. 1(b) demonstrated that the average particle size of CZA metal oxide nanoparticles coated with pure SiO2 was 100 nm, which exhibited as spherical morphology. After adding an aluminum source, pure phase SiO2 spheres of the shell were transformed into flower-like silicoaluminate(SA)species, and the average particle size of metal oxide nanoparticles also decreased relatively. The surface of the CZA@4SA-J-0.2 (Fig. 1(e)) tended to flatten as the Si/Al ratio decreased to 4, and the coating effect deteriorated. Simultaneously, the particle size of CZA nanoparticles further decreased, and miscible phases containing Cu, Zn, Al, and Si gradually formed, with some CZA nanoparticles even being exposed on the shell surface. The element distribution of CZA@8SA-J-0.2 was shown by EDS (Fig. 1(g), Fig. S1), which also showed the uniform distribution of Si and Al throughout SA and the distribution of Cu in metal oxide particles. At the same time, it was observed that the metal oxide was relatively completely embedded into SA. Fig. S2 illustrated the X-ray diffraction (XRD) patterns of the embedded bifunctional catalyst CZA@8SA-J-0.2 and parent CZA. The XRD patterns of the catalysts revealed characteristic peaks corresponding to CuO (JCPDS NO. 41–0254) and ZnO (JCPDS NO. 36–1451). The dispersion peak at position 20°-30° indicated that the SA overlaying the CZA surface was amorphous. The N2 adsorption desorption results of catalysts with different Si/Al ratios were shown in Fig. 2(a)(b) and Table S1. The N2 adsorption-desorption curves were IV-type isotherms with H3-type hysteresis loops, indicating the catalyst's mesoporous structure. CZA@8SA-J-0.2 displayed high adsorption at relative pressures of 0.6–1.0, suggesting its pores were mainly slit-shaped, formed by the stacking of plate-like particles. The results of physical adsorption-desorption indicated that CZA@8SA-J-0.2 exhibited the largest specific surface area (208 m2/g) with the largest average pore diameter (6.73 nm), attributed to the existence of abundant flaky silicon aluminum species. In contrast, CZA@12SA-J-0.2 showed the highest micropore specific surface area, likely resulting from an excess silica source that promoted the formation of isolated SiO2 spheres. The XRF data (Table S2) demonstrated that the surface silicon-to-aluminum ratio of SA matched the feed silicon-to-aluminum ratio trend but with much lower values, which indicated that less silicon was crystallized on the surface during the dry-gel crystallization. Ammonia Temperature Programmed Desorption (NH3-TPD) analysis was conducted to investigate the surface acidity of the catalyst, and presented in Fig. 2(c) and Table S2. The TPD curves exhibited three distinct desorption peaks, which can be assigned to weak (W), medium (M), and strong (S) acid sites with desorption temperatures ranged at 120 °C, 280 °C, and 350 °C, respectively [31]. The weak acid sites were attributed to weakly adsorbed NH3 molecules on surface Si-OH or Al-OH groups [32]. The medium and strong acid sites were attributed to strongly adsorbed NH3 molecules on Brønsted and Lewis acid sites, respectively. As presented in Fig. 2(c) the CZA@12SA-J-0.2 catalyst had a significantly higher number of weak acid sites compared to CZA@8SA-J-0.2 and CZA@4SA-J-0.2, which was due to the excessive addition of silicon, leading to a remarkable increase in the number of surface Si-OH groups. Moreover, with a decrease in Si/Al, the total acidity tended to increase at first and subsequently decease. When the feeding Si/Al reached at ratio of 8, the proportion of strong and medium acids was the highest, which corresponds to its higher DME selectivity. However, aluminum species had a tendency to condense into neutral compounds like Al(OH)3 at low Si/Al ratios, which impaired dehydration efficiency. To further understand the mechanism of CTAB in the acid site formation of catalysts, a series of catalysts CZA@8SA-J-y (y = 0, 0.05, 0.1, 0.2, and 0.4) were prepared by altering the amount of CTAB addition. As evidenced by TEM pictures (Fig. 1(c)(d)(f))), the catalyst without CTAB addition no longer had a flake-like morphology, and the surface of the SA tended to flatten. The results of N2 physical adsorption and desorption (Fig. 2(d)(e), Table 1) demonstrated that the specific surface area of the bifunctional catalyst was not significantly affected by the addition of CTAB. However, this resulted in a shift of the pore size distribution toward larger pore sizes. The average pore size of the catalyst increased with the increase of CTAB. The results of XRF (Table S3) showed that the silicon-to-aluminum ratio of the SA remained essentially consistent across varying CTAB addition levels. And XRF results showed that the catalyst contained only Cu, Zn, Si, Al, O elements, no Br and other impurity elements. This indicated that Br in CTAB was not retained in the catalyst, thereby ruling out the influence of Br on the catalyst. CTAB, as a cationic surfactant, likely adsorbed onto the negatively charged CZA particle surfaces via its positively charged head groups, while Br– counterions remained in the solution or were released into the synthesis medium during the adsorption process. However, NH3-TPD results (Table S3, Fig. 2(f)) indicated that the acidity of the SA were different. The proportion of medium and strong acids increased with higher CTAB content. However, the total acid content showed a downward trend, of which the maximum acid level of 2.452 mmol/g was obtained in CZA@8SA-J-0 (Table S3). The action mechanism of CTAB was further studied via vacuum transmission infrared spectroscopy ( Fig. 3). The catalysts exhibited a sharp IR peak near 3740 cm−1, which was primarily attributed to the stretching vibrations of isolated silanol (Si-OH) and aluminol (Al-OH) groups on the catalyst surface [33–35]. As the CTAB addition increased, the peak intensity at 3740 cm−1 gradually decreased, indicating that the isolated Si-OH and Al-OH groups underwent bonding interactions within the silicoaluminate matrix. Two primary bonding mechanisms were included. Firstly, upon calcination, CTAB decomposed, triggering the migration of metal ions (Cu and Zn) to the silicoaluminate surface. These ions reacted with surface hydroxyl groups (Si-OH and Al-OH), forming Cu(Zn)-O-Si and Cu(Zn)-O-Al bonds [36]. Simultaneously, Si-OH and Al-OH groups bonded to generate silicoaluminate bridging hydroxyl groups (Si-OH-Al) [33], which functioned as Brønsted acid sites critical for catalytic activity. The asymmetric stretching vibration peak of Si–O–Si bonds typically appeared near 1100 cm−1. However, due to the structural disorder inherent in amorphous materials compared to crystalline counterparts, this peak broadened or shifted in position. For amorphous silicoaluminate materials, the asymmetric stretching vibration of Si-O-Si bonds was observed across a range of 1050–1200 cm−1, while the vibrations of Si-O-M bonds (M: Al, Cu, Zn) occurred at 950–1050 cm−1 [37]. The formation of such Cu (Zn)-O-Si and Cu (Zn)-O-Al bonds can be further confirmed by XPS. The electronic states of Cu and Zn were determined by XPS at different levels of CTAB addition, as shown in Fig. 4. The binding energy (BE) of the Cu 2p peak of pure CZA catalyst located at 934.02 eV belongs to the Cu2+ oxidation state. The spectrum of Cu 2p in the CZA@8SA-J-y catalyst showed two peaks at around 933 eV and 935 eV, respectively, corresponding to two oxidation states of Cu+ and Cu2+. As the amount of CTAB added increased, the binding energy of Cu 2p3/2 orbitals increased. The reason for this phenomenon was that the bifunctional catalyst prepared with this method could facilitate the formation of Cu-O-Si and Cu-O-Al interfaces, which enhanced the metal-support interaction and promote an increase in the binding energy of Cu species [38]. Similarly, the binding energy of Zn 2p3/2 orbitals also increased with the increase of CTAB addition. H2-TPR results (Fig. S3(b)) showed that with the increase of CTAB content, the reduction temperature of the catalyst increased, which further proved that the binding energy of Cu species increased, and the catalyst was more difficult to be reduced. The concentration and strength of basic sites were evaluated through CO2-TPD experiments, with the results shown in Fig. S3(a) and Table S3. The desorption curve peaks could be divided into 200 °C, 400 °C, and 500 °C, which were attributed to weak, moderate, and strong basic sites on the catalyst surface, respectively. The weak basic sites resulted from CO2 binding to surface OH- groups, while the moderate basic sites were due to CO2 binding to metal-oxygen pairs (Cu-O and Zn-O). The strong basic sites arose from CO2 adsorption on surface O2- anions. It was noted that the amount of desorbed CO2 molecules increased with higher CTAB content (Table S3), along with an increased proportion of desorption from strong basic sites. This indicated that the addition of more CTAB could promote the number of CO2 adsorption active centers. This might be attributed to the fact that higher CTAB content facilitated the disintegration of the Cu-ZnO structure and the dispersion of CuO, exposing more oxygen vacancies on the catalyst surface. This also explained the increased CO2 conversion rate of CZA@8SA-J-0.4. To further elucidate the impact of CTAB addition on aluminum coordination and the formation mechanism of Brønsted acid sites (e.g., Si-OH-Al bridging hydroxyl groups), one-dimensional 1D nuclear magnetic resonance aluminum spectra spectroscopy was employed. The results of 1D 27Al MAS NMR ( Fig. 5, Table 2) showed that the amount of Al VI decreased with the addition of CTAB, while the amount of Al IV and Al V increased. As is well known, Al IV and Al VI were the main Al coordination sites on amorphous SA. When strongly distorted or metastable aluminum atoms (Al IV and Al V) were incorporated into the vicinity of silanol groups, the local structure of silanol groups near aluminum exhibited a \"pseudo bridged silanol\" model(as shown in Scheme 1) [37,39]. These metastable aluminums could undergo electron transfer to adjacent Si-OH groups, thereby enhancing the acidity of adjacent silanol groups and forming Brønsted acid sites [40]. 3.2 Catalytic performance for CO 2 hydrogenation Catalytic performances of CO2 hydrogenation to DME were conducted as a result of CO2 conversion and product selectivity, as shown in Fig. 6 and Tables S5-S7. The main by-product of the reaction was CO, with a small amount of CH4, but no C2+ hydrocarbons were detected. Compared with the CZA catalyst, the bifunctional catalyst significantly reduced the selectivity of CO after the introduction of acidic components. Taking CZA@8SA-J-0.1 as an example, the CO selectivity of the CZA catalyst was 70.45 % (Table S4), while the CO selectivity of CZA@8SA-J-0.1 was reduced to 43.46 %. To investigate the effect of the Si/Al ratio on the performance of the bifunctional catalyst, a series of catalysts with varying Si/Al ratios (denoted as CZA@xSA-J-0.2, x = 4, 8, 12) were tested (Fig. 6(a), Table S5). The catalyst with Si/Al ratio of 8 exhibited the highest selectivity for DME at 37.94 %, with a combined selectivity for methanol and DME of 52.96 %. This superior performance was attributed to the optimal Si/Al ratio, which endowed CZA@8SA-J-0.2 with the highest total acidity and the highest proportion of medium-strong acid sites. The catalyst CZA@12SA-J-0.2 showed a DME selectivity of 36.39 % and a combined selectivity for methanol and DME of 50 %, which was close to the performance of CZA@8SA-J-0.2. However, the acid amount of CZA@12SA-J-0.2 (1.381 mmol/g) was significantly lower than that of CZA@8SA-J-0.2 (1.877 mmol/g). This indicated that increasing the amount of aluminum source does not significantly enhance the dehydration of methanol. Excessive aluminum addition did not promote better combination between silicon and aluminum, and the independently nucleated aluminum species increased the number of weak acid sites on the catalyst. The increase in acid amount was primarily due to the adsorption of NH3 on the surface-rich Al-OH groups. Further reducing the Si/Al ratio, the catalyst CZA@4SA-J-0.2 had an increased proportion of weak acid sites, but the DME selectivity decreased to 29.20 %. Catalysts CZA@8SA-J-y with varying CTAB/Si ratios from 0 to 0.4 were further evaluated, and the results are summarized in Fig. 6(b) and Table S6. As the CTAB/Si ratio increased from 0 to 0.1, the selectivity for DME increased from 26.10 % to 43.00 %, and the selectivity for CO decreased from 61.29 % to 43.46 %. However, according to the NH3-TPD results (Table S3), CZA@8SA-J-0 and CZA@8SA-J-0.1 catalysts exhibit comparable acid amounts but different methanol dehydration performances. According to the 1D 27Al MAS NMR results (Fig. 5), the addition of CTAB changed the aluminum coordination, increasing the amount of Brønsted acid sites by raising the levels of Al IV and Al V. The increased Brønsted acid sites enhance the dehydration performance, which also explains why the CZA@8SA-J-0.1 catalyst exhibits better methanol dehydration properties, despite having a similar acid amount to the CZA@8SA-J-0 catalyst. Additionally, Al V species have been identified as defects in Al VI species with oxygen vacancies and can also act as Lewis acid sites, which can catalyze a variety of reactions, such as alcohol dehydration [41–43]. The synergy between acid sites can significantly improve the performance in acid-catalyzed reactions. The CO2 conversion decreased from 11.47 % to 9.44 %, which may be due to the suppressed RWGS reaction. However, as further increasing the amount of CTAB from 0.1 to 0.4, the selectivity of DME for the CZA@8SA-J-y catalyst decreased from 43.00 % to 27.80 %, and CO selectivity increased from 43.46 % to 60.53 %. According to literature [44,45], both the structural characteristics and surface acidity of catalyst could significantly affect the performance of methanol dehydration. The restrictive effect of the pore structure could also affect the accessible acid amount during the actual reaction process. According to the results of N2 adsorption and desorption (Table 1), it was found that the increase in CTAB addition caused the pore size distribution to shift towards larger pores. Wang Yan et al. found that there is no linear relationship between the specific surface area and the CO2 to DME reaction activity of the bifunctional catalyst [21], but there were differences in the synthesis of DME from methanol over dehydration active site with different pore sizes. This was also consistent with the experimental results of adding CTAB at a dosage of 0.1–0.4. Jones et al. provided an explanation for this phenomenon. They [46] found that as the pore size decreased, the local electric field's van der Waals interaction force with the transition state of the reactants increased, and reducing the reaction energy barrier and thus increasing the reaction activity. The limitation of pore structure could also affect the amount of acid that could be reached during the actual reaction process. We correlated the total acid amount, average pore size, and DME yield and found that within the range of CTAB/Si values from 0.1 to 0.4, there was no clear correlation between the total acid amount and DME yield, but there was a strong negative correlation between the average pore size and DME yield (Fig. 6(c)). The effect of catalysts at different reaction temperatures on CO2 conversion was also conducted and the results could be seen from Fig. 6(d) and Table S7. As the reaction temperature increased from 200 °C to 290 °C, the conversion of CO2 also increased. The highest conversion rate of CO2 of 12.56 % was obtained when the reaction was operated at 290 °C. As the reaction temperature continued to rise, the CO2 conversion began to decline, indicating that the reaction kinetics were the primary limiting factor for the conversion of carbon dioxide to methanol at low temperatures. As the reaction temperature continued to increase, the reaction had a tendency to shift towards the positive direction at high temperatures while the thermodynamics of the reaction became dominated, and RWGS reaction was enhanced, which leading to a gradually decrease on DME selectivity. A 48-hour reaction stability test was conducted on the CZA@8SA-J-0.1 catalyst at 260 °C and 3 MPa. Reaction performance was recorded every 2 hours during the test. The result was shown in Fig. S4. After 20 of reaction, the CO2 conversion rate exhibited a declining trend, while the selectivity toward methanol and DME generally continued to rise. After 40 hours of reaction, the selectivity of the target products began to show a moderate decline. Throughout the entire process, minor fluctuations in methanol and DME selectivity were observed, but the overall performance remained stable. The CZA@xSA-J-y catalyst prepared in this study exhibited excellent catalytic performance in the direct CO2 hydrogenation to dimethyl ether (DME). Compared with previously reported catalysts (Table S8), the present catalyst achieved moderate-to-high DME selectivity under comparable reaction conditions. Specifically, comprehensive characterization analyses revealed that its unique surface acidity and structural features facilitated methanol dehydration. The core-shell-like structure of CZA@xSA-J-y enhanced DME selectivity compared to the conventional CZA/SA catalyst [29]. Furthermore, relative to the hydrothermally synthesized CZAS@SA catalyst, the preparation method in this study not only retained the effective confinement effect of the shell layer on the Cu/ZnO/Al2O3 core catalyst [47] but also avoided structural damage to the core caused by harsh hydrothermal synthesis environments, thereby achieving higher CO2 conversion rates. In situ DRIFTS analysis was further conducted on the CO2 hydrogenation reaction over the CZA@8SA-J-0.1 catalyst to verify surface intermediates. The results were shown in Fig. 7. The bands near 2340 cm−1 and 2332 cm−1 were attributed to CO2 adsorbed on the catalyst surface. CO2 exhibited two distinct adsorption states on the catalyst surface: monodentate carbonate (1450 cm−1) and bidentate carbonate (1530 cm−1). As reported by G. Bonura et al., CO2 was converted into carbonates on copper active sites, followed by a stepwise hydrogenation pathway via formate species (\"O-C-O→(HO-COO-)→HCOO-→HOCHO-→HOCH2O-→CH2O(+HO-)→CH3O-\") to ultimately form methoxy species [47]. Through DRIFTS measurements at multiple temperatures, the characteristic peaks detected at 1338 cm−1 and 1594 cm−1 were assigned to adsorbed formate (*HCOO), while the peak at 1690 cm−1 corresponded to formic acid (*HCOOH) [48]. Their intensities were relatively low at lower temperatures. Concurrently, methoxy species (CH3O*) were identified on the catalyst surface (1079 cm−1), along with gaseous DME (937 cm−1, 1201 cm−1). The formation of surface formate and methoxy intermediates confirmed methanol production via the formate pathway. Subsequently, two co-adsorbed methanol molecules underwent coupling on Brønsted acid sites of the dehydration component to form DME (associative mechanism), or one adsorbed methanol molecule first dissociated into surface methoxy species, which then reacted with another methanol molecule to produce DME (dissociative mechanism) [49,50]. However, for both cases the methanol condensation is consistent with the cooperation of Brønsted acidic sites located on the dehydration component [51,52]. Two types of surface-adsorbed CO were observed at 1940 cm−1 (bridged CO) and 2159 cm−1 (linear CO). Increasing the reaction temperature promoted the reverse water-gas shift (RWGS) reaction, leading to an enhanced amount of adsorbed CO on the catalyst surface. 4 Conclusion In summary, CuO-ZnO-Al2O3 embedded amorphous silicoaluminate was prepared by combination of co-precipitation method and improved Stöber method. By simply adjusting the Si/Al and CTAB/Si molar ratio of the precursors, the structural and acid properties of the catalyst could be accurately controlled. The total acid content of preparing catalyst firstly increased first and then decreased as Si/Al decrease. The maximum percentage of medium-strong acid and strong acid was obtained when Si/Al was 8, which corresponds to the higher DME selectivity of 37.94 %. The coordination type of Al could be altered by the addition of CTAB, resulting in the increase the proportion of metastable aluminum (Al IV and Al V) responsible for Brønsted acid generation. Moreover, the increase of CTAB could also enhance the interaction between silicon and aluminum and reduce the independent nucleation of neutral Al(OH)3 species. However, the addition of excessive CTAB would increase the average pore size of the catalyst and reduce the amount of accessible acid sites, resulting in a decrease of dehydration performance. The highest selectivity of DME is 43 % was obtained on the catalyst prepared with the CTAB/Si molar ratio of 0.1. In conclusion, the reported method provides an effective strategy for the preparation of bifunctional core-shell-like structure catalysts with high activity and selectivity of CO2 hydrogenation to DME. CRediT authorship contribution statement Wang Mingpei: Supervision, Project administration, Conceptualization. Liu Zhen: Writing – review & editing, Project administration, Methodology, Formal analysis, Conceptualization. Yan Zifeng: Writing – review & editing, Supervision, Project administration, Funding acquisition, Conceptualization. Wei Yifan: Writing – original draft, Validation, Methodology, Investigation, Formal analysis, Data curation. Liu Jingyi: Writing – original draft, Validation, Methodology, Investigation, Formal analysis, Data curation. Li Hanbo: Writing – original draft, Methodology, Investigation, Formal analysis, Data curation. Zhang Xian: Supervision, Project administration, Methodology, Conceptualization. Zhang Ying: Writing – review & editing, Validation, Methodology, Formal analysis. Yang Jiangong: Supervision, Project administration, Methodology, Funding acquisition. Declaration of Competing Interest The authors declare the following financial interests/personal relationships which may be considered as potential competing interests: Zhen Liu reports financial support was provided by Ordos Carbon Neutral Research Institute. If there are other authors, they declare that they have no known competing financial interests or personal relationships that could have appeared to influence the work reported in this paper. Acknowledgments This work was financially supported by National Natural Science Foundation of China (22272200, 22472203 and 22372197), Key Project of National Key Research and Development Program of China (2022YFA1503400), Ordos Key Research and Development Program (YF20232313), Ordos industrial innovation talent team, Fundamental Research Funds for the Central Universities（23CX10005A）and Taishan Scholar Foundation (tspd20210308). Appendix A Supporting information Supplementary data associated with this article can be found in the online version at doi:10.1016/j.apcata.2025.120286. Appendix A Supplementary material Supplementary material References [1] M. He Y. Sun B. Han Green Carbon Science: Scientific Basis for Integrating Carbon Resource Processing, Utilization, and Recycling Angew. Chem. Int. Ed. 52 37 2013 9620 9633 10.1002/anie.201209384 He M., Sun Y., Han B. Green Carbon Science: Scientific Basis for Integrating Carbon Resource Processing, Utilization, and Recycling. Angewandte Chemie International Edition. 2013, 52(37), 9620-9633, https://doi.org/10.1002/anie.201209384. [2] S. Liu H. Yang X. Huang Identifying Active Sites of Nitrogen-Doped Carbon Materials for the CO2 Reduction Reaction Adv. Funct. Mater. 28 21 2018 10.1002/adfm.201800499 Liu S., Yang H., Huang X., et al. Identifying Active Sites of Nitrogen-Doped Carbon Materials for the CO2 Reduction Reaction. Advanced Functional Materials. 2018, 28(21), https://doi.org/10.1002/adfm.201800499. [3] E. Catizzone C. Freda G. Braccio Dimethyl ether as circular hydrogen carrier: Catalytic aspects of hydrogenation/dehydrogenation steps J. Energy Chem. 58 2021 55 77 10.1016/j.jechem.2020.09.040 Catizzone E., Freda C., Braccio G., et al. Dimethyl ether as circular hydrogen carrier: Catalytic aspects of hydrogenation/dehydrogenation steps. Journal of Energy Chemistry. 2021, 58, 55-77, https://doi.org/10.1016/j.jechem.2020.09.040. [4] Y. Wu Z. Li C. Xia Silica-Gel-Supported Dual Acidic Ionic Liquids as Efficient Catalysts for the Synthesis of Polyoxymethylene Dimethyl Ethers Ind. Eng. Chem. Res. 55 7 2016 1859 1865 10.1021/acs.iecr.5b04177 Wu Y., Li Z., Xia C. Silica-Gel-Supported Dual Acidic Ionic Liquids as Efficient Catalysts for the Synthesis of Polyoxymethylene Dimethyl Ethers. Industrial & Engineering Chemistry Research. 2016, 55(7), 1859-1865, https://doi.org/10.1021/acs.iecr.5b04177. [5] S.G. Walt N.B. Ram A. von Conta Role of Multi-Electron Effects in the Asymmetry of Strong-Field Ionization and Fragmentation of Polar Molecules: The Methyl Halide Series J. Phys. Chem. A 119 49 2015 11772 11782 10.1021/acs.jpca.5b07331 Walt S.G., Ram N.B., von Conta A., et al. Role of Multi-Electron Effects in the Asymmetry of Strong-Field Ionization and Fragmentation of Polar Molecules: The Methyl Halide Series. The Journal of Physical Chemistry A. 2015, 119(49), 11772-11782, https://doi.org/10.1021/acs.jpca.5b07331. [6] S. Standl F.M. Kirchberger wind T. Kuehle Single-event kinetic model for methanol-to-olefins (MTO) over ZSM-5: Fundamental kinetics for the olefin co-feed reactivity Chem. Eng. J. 2020 402 10.1016/j.cej.2020.126023 Standl S., Kirchberger F.M., Kuehle wind T., et al. Single-event kinetic model for methanol-to-olefins (MTO) over ZSM-5: Fundamental kinetics for the olefin co-feed reactivity. Chemical Engineering Journal. 2020, 402, https://doi.org/10.1016/j.cej.2020.126023. [7] T. Cordero-Lanzac C. Martinez A.T. Aguayo Activation of n-pentane while prolonging HZSM-5 catalyst lifetime during its combined reaction with methanol or dimethyl ether Catal. Today 383 2022 320 329 10.1016/j.cattod.2020.09.015 Cordero-Lanzac T., Martinez C., Aguayo A.T., et al. Activation of n-pentane while prolonging HZSM-5 catalyst lifetime during its combined reaction with methanol or dimethyl ether. Catalysis Today. 2022, 383, 320-329, https://doi.org/10.1016/j.cattod.2020.09.015. [8] Z. Qin T. Su H. Ji Experimental and theoretical study of the intrinsic kinetics for dimethyl ether synthesis from CO2 over Cu-Fe-Zr/HZSM-5 AIChE J. 61 5 2015 1613 1627 10.1002/cphc.201601283 Qin Z., Su T., Ji H., et al. Experimental and theoretical study of the intrinsic kinetics for dimethyl ether synthesis from CO2 over Cu-Fe-Zr/HZSM-5. AIChE Journal. 2015, 61(5), 1613-1627, https://doi.org/10.1002/cphc.201601283. [9] K. Stangeland H. Li Z. Yu Thermodynamic Analysis of Chemical and Phase Equilibria in CO2 Hydrogenation to Methanol, Dimethyl Ether, and Higher Alcohols Ind. Eng. Chem. Res. 57 11 2018 4081 4094 10.1021/acs.iecr.7b04866 Stangeland K., Li H., Yu Z. Thermodynamic Analysis of Chemical and Phase Equilibria in CO2 Hydrogenation to Methanol, Dimethyl Ether, and Higher Alcohols. Industrial & Engineering Chemistry Research. 2018, 57(11), 4081-4094, https://doi.org/10.1021/acs.iecr.7b04866. [10] C. Liu Z. Liu Perspective on CO2 Hydrogenation for Dimethyl Ether Economy Catalysts 12 11 2022 10.3390/catal12111375 Liu C., Liu Z. Perspective on CO2 Hydrogenation for Dimethyl Ether Economy. Catalysts. 2022, 12(11), https://doi.org/10.3390/catal12111375. [11] S. Xia J. Gong J. Yin Effects of precursor phase distribution on the performance of Cu-based catalysts for direct CO2 conversion to dimethyl ether J. Energy Inst. 109 2023 10.1016/j.joei.2023.101302 Xia S., Gong J., Yin J., et al. Effects of precursor phase distribution on the performance of Cu-based catalysts for direct CO2 conversion to dimethyl ether. Journal of the Energy Institute. 2023, 109, https://doi.org/10.1016/j.joei.2023.101302. [12] G. Bonura M. Migliori L. Frusteri Acidity control of zeolite functionality on activity and stability of hybrid catalysts during DME production via CO2 hydrogenation J. CO2 Util. 24 2018 398 406 10.1016/j.jcou.2018.01.028 Bonura G., Migliori M., Frusteri L., et al. Acidity control of zeolite functionality on activity and stability of hybrid catalysts during DME production via CO2 hydrogenation. Journal of CO2 Utilization. 2018, 24, 398-406, https://doi.org/10.1016/j.jcou.2018.01.028. [13] S. Ren W.R. Shoemaker X. Wang Highly active and selective Cu-ZnO based catalyst for methanol and dimethyl ether synthesis via CO2 hydrogenation Fuel 239 2019 1125 1133 10.1016/j.fuel.2018.11.105 Ren S., Shoemaker W.R., Wang X., et al. Highly active and selective Cu-ZnO based catalyst for methanol and dimethyl ether synthesis via CO2 hydrogenation. Fuel. 2019, 239, 1125-1133, https://doi.org/10.1016/j.fuel.2018.11.105. [14] A. Hussain K. Lin N.V. Mdlovu Hydrogenation of CO2 to dimethyl ether over nanosized WOx-ZrO2/Cu-ZnO-ZrO2 catalysts J. Environ. Chem. Eng. 11 3 2023 10.1016/j.jece.2023.109908 Hussain A., Lin K., Mdlovu N.V., et al. Hydrogenation of CO2 to dimethyl ether over nanosized WOx-ZrO2/Cu-ZnO-ZrO2 catalysts. Journal of Environmental Chemical Engineering. 2023, 11(3), https://doi.org/10.1016/j.jece.2023.109908. [15] F. Zha J. Ding Y. Chang Cu-Zn-Al Oxide Cores Packed by Metal-Doped Amorphous Silica-Alumina Membrane for Catalyzing the Hydrogenation of Carbon Dioxide to Dimethyl Ether Ind. Eng. Chem. Res. 51 1 2012 345 352 10.1021/ie202090f Zha F., Ding J., Chang Y., et al. Cu-Zn-Al Oxide Cores Packed by Metal-Doped Amorphous Silica-Alumina Membrane for Catalyzing the Hydrogenation of Carbon Dioxide to Dimethyl Ether. Industrial & Engineering Chemistry Research. 2012, 51(1), 345-352, https://doi.org/10.1021/ie202090f. [16] A. Ateka M. Sanchez-Contador J. Erena Catalyst configuration for the direct synthesis of dimethyl ether from CO and CO2 hydrogenation on CuO-ZnO-MnO/SAPO-18 catalysts Fuel Process. Technol. 124 1 2018 401 418 10.1016/j.fuproc.2018.07.009 Ateka A., Sanchez-Contador M., Erena J., et al. Catalyst configuration for the direct synthesis of dimethyl ether from CO and CO2 hydrogenation on CuO-ZnO-MnO/SAPO-18 catalysts. Fuel Processing Technology. 2018, 124(1), 401-418, https://doi.org/10.1016/j.fuproc.2018.07.009. [17] L. Yao X. Shen Y. Pan Unravelling Proximity-Driven Synergetic Effect within CIZO-SAPO Bifunctional Catalyst for CO2 Hydrogenation to DME Energy Fuels 34 7 2020 8635 8643 10.1021/acs.energyfuels.0c01256 Yao L., Shen X., Pan Y., et al. Unravelling Proximity-Driven Synergetic Effect within CIZO-SAPO Bifunctional Catalyst for CO2 Hydrogenation to DME. Energy & Fuels. 2020, 34(7), 8635-8643, https://doi.org/10.1021/acs.energyfuels.0c01256. [18] G. Bonura M. Cordaro L. Spadaro Hybrid Cu-ZnO-ZrO2/H-ZSM5 system for the direct synthesis of DME by CO2 hydrogenation Appl. Catal. B: Environ. Energy 140 2013 16 24 10.1016/j.apcatb.2013.03.048 Bonura G., Cordaro M., Spadaro L., et al. Hybrid Cu-ZnO-ZrO2/H-ZSM5 system for the direct synthesis of DME by CO2 hydrogenation. Applied Catalysis B: Environment and Energy. 2013, 140, 16-24, https://doi.org/10.1016/j.apcatb.2013.03.048. [19] R. Phienluphon K. Pinkaew G. Yang Designing core (Cu/ZnO/Al2O3)-shell (SAPO-11) zeolite capsule catalyst with a facile physical way for dimethyl ether direct synthesis from syngas Chem. Eng. J. 270 2015 605 611 10.1016/j.cej.2015.02.071 Phienluphon R., Pinkaew K., Yang G., et al. Designing core (Cu/ZnO/Al2O3)-shell (SAPO-11) zeolite capsule catalyst with a facile physical way for dimethyl ether direct synthesis from syngas. Chemical Engineering Journal. 2015, 270, 605-611, https://doi.org/10.1016/j.cej.2015.02.071. [20] K. Pinkaew G. Yang T. Vitidsant A new core-shell-like capsule catalyst with SAPO-46 zeolite shell encapsulated Cr/ZnO for the controlled tandem synthesis of dimethyl ether from syngas Fuel 111 2013 727 732 10.1016/j.fuel.2013.03.027 Pinkaew K., Yang G., Vitidsant T., et al. A new core-shell-like capsule catalyst with SAPO-46 zeolite shell encapsulated Cr/ZnO for the controlled tandem synthesis of dimethyl ether from syngas. Fuel. 2013, 111, 727-732, https://doi.org/10.1016/j.fuel.2013.03.027. [21] Y. Wang W. Wang Y. Chen Synthesis of dimethyl ether from syngas over core-shell structure catalyst CuO-ZnO-Al2O3@SiO2-Al2O3 Chem. Eng. J. 250 2014 248 256 10.1016/j.cej.2014.04.018 Wang Y., Wang W., Chen Y., et al. Synthesis of dimethyl ether from syngas over core-shell structure catalyst CuO-ZnO-Al2O3@SiO2-Al2O3. Chemical Engineering Journal. 2014, 250, 248-256, https://doi.org/10.1016/j.cej.2014.04.018. [22] M. Sanchez-Contador A. Ateka M. Ibanez Influence of the operating conditions on the behavior and deactivation of a CuO-ZnO-ZrO2@SAPO-11 core-shell-like catalyst in the direct synthesis of DME[J] Renew. Energy 138 2019 585 597 10.1016/j.renene.2019.01.093 Sanchez-Contador M., Ateka A., Ibanez M., et al. Influence of the operating conditions on the behavior and deactivation of a CuO-ZnO-ZrO2@SAPO-11 core-shell-like catalyst in the direct synthesis of DME[J]. Renewable Energy. 2019, 138, 585-597, https://doi.org/10.1016/j.renene.2019.01.093. [23] M. Sanchez-Contador A. Ateka A.T. Aguayo Direct synthesis of dimethyl ether from CO and CO2 over a core-shell structured CuO-ZnO-ZrO2@SAPO-11 catalyst[J] Fuel Process. Technol. 179 2018 258 268 10.1016/j.fuproc.2018.07.009 Sanchez-Contador M., Ateka A., Aguayo A.T., et al. Direct synthesis of dimethyl ether from CO and CO2 over a core-shell structured CuO-ZnO-ZrO2@SAPO-11 catalyst[J]. Fuel Processing Technology. 2018, 179, 258-268, https://doi.org/10.1016/j.fuproc.2018.07.009. [24] R. Nie H. Lei S. Pan Core-shell structured CuO-ZnO@H-ZSM-5 catalysts for CO hydrogenation to dimethyl ether Fuel 96 1 2012 419 425 10.1016/j.fuel.2011.12.048 Nie R., Lei H., Pan S., et al. Core-shell structured CuO-ZnO@H-ZSM-5 catalysts for CO hydrogenation to dimethyl ether. Fuel. 2012, 96(1), 419-425, https://doi.org/10.1016/j.fuel.2011.12.048. [25] G. Yang M. Thongkam T. Vitidsant A double-shell capsule catalyst with core-shell-like structure for one-step exactly controlled synthesis of dimethyl ether from CO2 containing syngas Catal. Today 171 1 2011 229 235 10.1016/j.cattod.2011.02.021 Yang G., Thongkam M., Vitidsant T., et al. A double-shell capsule catalyst with core-shell-like structure for one-step exactly controlled synthesis of dimethyl ether from CO2 containing syngas. Catalysis Today. 2011, 171(1), 229-235, https://doi.org/10.1016/j.cattod.2011.02.021. [26] G. Yang N. Tsubaki J. Shamoto Confinement Effect and Synergistic Function of H-ZSM-5/Cu-ZnO-Al2O3 Capsule Catalyst for One-Step Controlled Synthesis J. Am. Chem. Soc. 132 23 2010 8129 8136 10.1021/ja101882a Yang G., Tsubaki N., Shamoto J., et al. Confinement Effect and Synergistic Function of H-ZSM-5/Cu-ZnO-Al2O3 Capsule Catalyst for One-Step Controlled Synthesis. Journal of the American Chemical Society. 2010, 132(23), 8129-8136, https://doi.org/10.1021/ja101882a. [27] C. Jeong H. Ham J.W. Bae Facile Structure Tuning of a Methanol-Synthesis Catalyst towards the Direct Synthesis of Dimethyl Ether from Syngas ChemCatChem 9 24 2017 4484 4489 10.1002/cctc.201701167 Jeong C., Ham H., Bae J.W., et al. Facile Structure Tuning of a Methanol-Synthesis Catalyst towards the Direct Synthesis of Dimethyl Ether from Syngas. ChemCatChem. 2017, 9(24), 4484-4489, https://doi.org/10.1002/cctc.201701167. [28] Y. Sun Z. Zhao Implanting Copper-Zinc Nanoparticles into the Matrix of Mesoporous Alumina as a Highly Selective Bifunctional Catalyst for Direct Synthesis of Dimethyl Ether from Syngas ChemCatChem 12 5 2020 1276 1281 10.1002/cctc.201902166 Sun Y., Zhao Z. Implanting Copper-Zinc Nanoparticles into the Matrix of Mesoporous Alumina as a Highly Selective Bifunctional Catalyst for Direct Synthesis of Dimethyl Ether from Syngas. ChemCatChem. 2020, 12(5), 1276-1281, https://doi.org/10.1002/cctc.201902166. [29] Z. Liu X. An M. Song Dry gel assisting crystallization of bifunctional CuO-ZnO-Al2O3/SiO2-Al2O3 catalysts for CO2 hydrogenation Biomass-.-. Bioenergy 163 2022 10.1016/j.biombioe.2022.106525 Liu Z., An X., Song M., et al. Dry gel assisting crystallization of bifunctional CuO-ZnO-Al2O3/SiO2-Al2O3 catalysts for CO2 hydrogenation. Biomass & Bioenergy. 2022, 163, https://doi.org/10.1016/j.biombioe.2022.106525. [30] Z. Ma H. Li X. Zhang Promoter modified hydrophobic core-shell Fe-based catalysts for Fischer-Tropsch synthesis: Enhancing its performance in suppressing water gas shift reaction Fuel 374 2024 10.1016/j.fuel.2024.132485 Ma Z., Li H., Zhang X., et al. Promoter modified hydrophobic core-shell Fe-based catalysts for Fischer-Tropsch synthesis: Enhancing its performance in suppressing water gas shift reaction. Fuel. 2024, 374, https://doi.org/10.1016/j.fuel.2024.132485. [31] H. Wang J. Jia S. Liu Highly Efficient NO Abatement over Cu-ZSM-5 with Special Nanosheet Features Environ. Sci. Technol. 55 8 2021 5422 5434 10.1021/acs.est.0c08684 Wang H., Jia J., Liu S., et al. Highly Efficient NO Abatement over Cu-ZSM-5 with Special Nanosheet Features. Environmental Science & Technology. 2021, 55(8), 5422-5434, https://doi.org/10.1021/acs.est.0c08684. [32] X.S. Liu X.D. Wu D. Weng Modification of Cu/ZSM-5 catalyst with CeO2 for selective catalytic reduction of NOx with ammonia J. Rare Earths 34 10 2016 1004 1009 10.1016/S1002-0721(16)60127-8 Liu X.S., Wu X.D., Weng D., et al. Modification of Cu/ZSM-5 catalyst with CeO2 for selective catalytic reduction of NOx with ammonia. Journal of Rare Earths. 2016, 34(10), 1004-1009, https://doi.org/10.1016/S1002-0721(16)60127-8. [33] G. Crepeau V. Montouillout A. Vimont Nature, structure and strength of the acidic sites of amorphous silica alumina: an IR and NMR study J. Phys. Chem. B 110 31 2006 15172 15185 10.1021/jp062252d Crepeau G., Montouillout V., Vimont A., et al. Nature, structure and strength of the acidic sites of amorphous silica alumina: an IR and NMR study. The Journal of Physical Chemistry B. 2006, 110(31), 15172-15185, https://doi.org/10.1021/jp062252d. [34] B. Bonelli B. Onida J.D. Chen Spectroscopic characterisation of the strength and stability of the acidic sites of Al-rich microporous micelle-templated silicates Microporous Mesoporous Mater. 67 1 2004 95 106 10.1016/j.micromeso.2003.10.007 Bonelli B., Onida B., Chen J.D., et al. Spectroscopic characterisation of the strength and stability of the acidic sites of Al-rich microporous micelle-templated silicates. Microporous and Mesoporous Materials. 2004, 67(1), 95-106, https://doi.org/10.1016/j.micromeso.2003.10.007. [35] T.K. Phung G. Busca Ethanol dehydration on silica-aluminas: Active sites and ethylene/diethyl ether selectivities Catal. Commun. 68 2015 110 115 10.1016/j.catcom.2015.05.009 Phung T.K., Busca G. Ethanol dehydration on silica-aluminas: Active sites and ethylene/diethyl ether selectivities. Catalysis Communications. 2015, 68, 110-115, https://doi.org/10.1016/j.catcom.2015.05.009. [36] C. Xu G. Chen Y. Zhao Interfacing with silica boosts the catalysis of copper Nat. Commun. 9 2018 10.1038/s41467-018-05757-6 Xu C., Chen G., Zhao Y., et al. Interfacing with silica boosts the catalysis of copper. Nature Communications. 2018, 9, https://doi.org/10.1038/s41467-018-05757-6. [37] G. Busca Catalytic materials based on silica and alumina: Structural features and generation of surface acidity Prog. Mater. Sci. 104 2019 215 249 10.1016/j.pmatsci.2019.04.003 Busca G. Catalytic materials based on silica and alumina: Structural features and generation of surface acidity. Progress in Materials Science. 2019, 104: 215-249, https://doi.org/10.1016/j.pmatsci.2019.04.003. [38] S. Wang K. Feng D. Zhang Stable Cu Catalysts Supported by Two-dimensional SiO2 with Strong Metal-Support Interaction Adv. Sci. 9 9 2022 10.1002/advs.202104972 Wang S., Feng K., Zhang D., et al. Stable Cu Catalysts Supported by Two-dimensional SiO2 with Strong Metal-Support Interaction. Advanced Science. 2022, 9(9), https://doi.org/10.1002/advs.202104972. [39] R. Verma C. Singhvi A. Venkatesh Defects tune the acidic strength of amorphous aluminosilicates Nat. Commun. 15 1 2024 10.1038/s41467-024-51233-9 Verma R., Singhvi C., Venkatesh A., et al. Defects tune the acidic strength of amorphous aluminosilicates. Nature Communications. 2024, 15(1), https://doi.org/10.1038/s41467-024-51233-9. [40] T. Li L. Zhang Z. Tao Synthesis and characterization of amorphous silica-alumina with enhanced acidity and its application in hydro-isomerization/cracking Fuel 279 2020 10.1016/j.fuel.2020.118487 Li T., Zhang L., Tao Z., et al. Synthesis and characterization of amorphous silica-alumina with enhanced acidity and its application in hydro-isomerization/cracking. Fuel. 2020, 279, https://doi.org/10.1016/j.fuel.2020.118487. [41] Z. Wang Y. Jiang A. Baiker Pentacoordinated Aluminum Species: New Frontier for Tailoring Acidity-Enhanced Silica-Alumina Catalysts Acc. Chem. Res. 53 11 2020 2648 2658 10.1021/acs.accounts.0c00459 Wang Z., Jiang Y., Baiker A., et al. Pentacoordinated Aluminum Species: New Frontier for Tailoring Acidity-Enhanced Silica-Alumina Catalysts. Accounts of Chemical Research. 2020, 53(11), 2648-2658, https://doi.org/10.1021/acs.accounts.0c00459. [42] Raphael Wischert Pierre Laurent Christophe Coperet γ-Alumina: The Essential and Unexpected Role of Water for the Structure, Stability, and Reactivity of \"Defect\" Sites J. Am. Chem. Soc. 134 35 2012 14430 14449 10.1021/ja3042383 Wischert Raphael，Laurent Pierre，Coperet Christophe, et al. γ-Alumina: The Essential and Unexpected Role of Water for the Structure, Stability, and Reactivity of \"Defect\" Sites. Journal of the American Chemical Society. 2012, 134(35), 14430-14449, https://doi.org/10.1021/ja3042383. [43] Peter J. Chupas Karena W. Chapman Gregory J. Halder Elucidating the Structure of Surface Acid Sites on γ-Al2O3 J. Am. Chem. Soc. 133 22 2011 8522 8524 10.1021/ja2029574 Chupas Peter J.，Chapman Karena W.，Halder Gregory J. Elucidating the Structure of Surface Acid Sites on γ-Al2O3. Journal of the American Chemical Society. 2011, 133(22), 8522-8524, https://doi.org/10.1021/ja2029574. [44] S.S. Akarmazyan P. Panagiotopoulou A. Kambolis Methanol dehydration to dimethylether over Al2O3 catalysts Appl. Catal. B: Environ. Energy 145 2014 136 148 10.1016/j.apcatb.2012.11.043 Akarmazyan S.S., Panagiotopoulou P., Kambolis A., et al. Methanol dehydration to dimethylether over Al2O3 catalysts. Applied Catalysis B: Environment and Energy. 2014, 145, 136-148, https://doi.org/10.1016/j.apcatb.2012.11.043. [45] Dianhua Liu Chunfeng Yao Jianqiang Zhang Catalytic dehydration of methanol to dimethyl ether over modified γ-Al2O3 catalyst Fuel 90 5 2011 1738 1742 10.1016/j.fuel.2011.01.038 Liu Dianhua, Yao Chunfeng, Zhang Jianqiang, et al. Catalytic dehydration of methanol to dimethyl ether over modified γ-Al2O3 catalyst. Fuel. 2011, 90(5), 1738-1742, https://doi.org/10.1016/j.fuel.2011.01.038. [46] A.J. Jones S.I. Zones E. Iglesia Implications of Transition State Confinement within Small Voids for Acid Catalysis J. Phys. Chem. C. 118 31 2014 17787 17800 10.1021/jp5050095 Jones A.J., Zones S.I., Iglesia E. Implications of Transition State Confinement within Small Voids for Acid Catalysis. The Journal of Physical Chemistry C. 2014, 118(31), 17787-17800, https://doi.org/10.1021/jp5050095. [47] X. Cui W. Yan H. Yang Preserving the Active Cu-ZnO Interface for Selective Hydrogenation of CO2 to Dimethyl Ether and Methanol ACS Sustain. Chem. Eng. 9 7 2021 2661 2672 10.1021/acssuschemeng.0c07258 Cui X., Yan W., Yang H., et al. Preserving the Active Cu-ZnO Interface for Selective Hydrogenation of CO2 to Dimethyl Ether and Methanol. ACS Sustainable Chemistry & Engineering. 2021, 9(7), 2661-2672, https://doi.org/10.1021/acssuschemeng.0c07258. [48] G. Bonura S. Todaro L. Frusteri Inside the reaction mechanism of direct CO2 conversion to DME over zeolite-based hybrid catalysts Appl. Catal. B: Environ. Energy 294 2021 10.1016/j.apcatb.2021.120255 Bonura G., Todaro S., Frusteri L., et al. Inside the reaction mechanism of direct CO2 conversion to DME over zeolite-based hybrid catalysts. Applied Catalysis B: Environment and Energy. 2021, 294, https://doi.org/10.1016/j.apcatb.2021.120255. [49] A. Giuliano E. Catizzone C. Freda Process Simulation and Environmental Aspects of Dimethyl Ether Production from Digestate-Derived Syngas Int. J. Environ. Res. Public Health 18 2 2021 10.3390/ijerph18020807 Giuliano A., Catizzone E., Freda C. Process Simulation and Environmental Aspects of Dimethyl Ether Production from Digestate-Derived Syngas. International Journal of Environmental Research and Public Health. 2021, 18(2), https://doi.org/10.3390/ijerph18020807. [50] X. Jiang X. Nie X. Guo Recent Advances in Carbon Dioxide Hydrogenation to Methanol via Heterogeneous Catalysis Chem. Rev. 120 15 2020 7984 8034 10.1021/acs.chemrev.9b00723 Jiang X., Nie X., Guo X., et al. Recent Advances in Carbon Dioxide Hydrogenation to Methanol via Heterogeneous Catalysis. Chemical Reviews. 2020, 120(15), 7984-8034, https://doi.org/10.1021/acs.chemrev.9b00723 [51] Alfredo Aloise Alessia Marino Francesco Dalena Desilicated ZSM-5 zeolite: Catalytic performances assessment in methanol to DME dehydration Microporous Mesoporous Mater. 302 2020 10.1016/j.micromeso.2020.110198 Alfredo Aloise, Marino Alessia, Dalena Francesco, et al. Desilicated ZSM-5 zeolite: Catalytic performances assessment in methanol to DME dehydration. Microporous and Mesoporous Materials, 2020, 302, https://doi.org/10.1016/j.micromeso.2020.110198. [52] Fausto Secci Valentina Mameli Elisabetta Rombi On the role of the nature and density of acid sites on mesostructured aluminosilicates dehydration catalysts for dimethyl ether production from CO2 J. Environ. Chem. Eng. 11 3 2023 10.1016/j.jece.2023.110018 Fausto Secci, Mameli Valentina, Rombi Elisabetta, et al. On the role of the nature and density of acid sites on mesostructured aluminosilicates dehydration catalysts for dimethyl ether production from CO2. Journal of Environmental Chemical Engineering, 2023, 11(3), https://doi.org/10.1016/j.jece.2023.110018.",
      "scopus-id": "105002581080",
      "coredata": {
        "eid": "1-s2.0-S0926860X25001875",
        "dc:description": "The resource utilization of CO2 serves as a feasible method for emission reduction and the establishment of an artificial carbon cycle. This study primarily focuses on the direct synthesis of dimethyl ether (DME) from the hydrogenation of CO2. We have prepared bifunctional catalysts with metal oxides embedded in amorphous silicon-aluminum by an improved Stöber method. By precisely adjusting the Si/Al molar ratio and the CTAB/Si molar ratio in the synthesis precursor solution, structural characteristics and acid properties of the catalyst could be effectively regulated. The results indicated that compared to Cu/ZnO/Al2O3, the catalyst significantly enhanced the selectivity of DME and methanol (MeOH), reduced the selectivity of CO with a moderate conversion rate of CO2. The highest DME selectivity of 37.94 % was achieved at an Si/Al ratio of 8, with the total selectivity for methanol and DME reaching 52.96 %. The addition of cetyltrimethylammonium bromide (CTAB) increased the proportion of Brønsted acid sites and medium-strong acid sites, thereby enhancing methanol dehydration and suppressing the reverse water-gas shift reaction. The optimal selectivity for DME of 43 % was obtained over catalyst prepared with a CTAB/Si molar ratio of 0.1. This study provides a new strategy for the structural design of bifunctional catalysts for CO2 hydrogenation.",
        "openArchiveArticle": "false",
        "prism:coverDate": "2025-06-25",
        "openaccessUserLicense": null,
        "prism:aggregationType": "Journal",
        "prism:url": "https://api.elsevier.com/content/article/pii/S0926860X25001875",
        "dc:creator": [
          {
            "@_fa": "true",
            "$": "Wei, Yifan"
          },
          {
            "@_fa": "true",
            "$": "Liu, Jingyi"
          },
          {
            "@_fa": "true",
            "$": "Li, Hanbo"
          },
          {
            "@_fa": "true",
            "$": "Zhang, Xian"
          },
          {
            "@_fa": "true",
            "$": "Zhang, Ying"
          },
          {
            "@_fa": "true",
            "$": "Yang, Jiangong"
          },
          {
            "@_fa": "true",
            "$": "Wang, Mingpei"
          },
          {
            "@_fa": "true",
            "$": "Liu, Zhen"
          },
          {
            "@_fa": "true",
            "$": "Yan, Zifeng"
          }
        ],
        "link": [
          {
            "@_fa": "true",
            "@rel": "self",
            "@href": "https://api.elsevier.com/content/article/pii/S0926860X25001875"
          },
          {
            "@_fa": "true",
            "@rel": "scidir",
            "@href": "https://www.sciencedirect.com/science/article/pii/S0926860X25001875"
          }
        ],
        "dc:format": "application/json",
        "openaccessType": null,
        "pii": "S0926-860X(25)00187-5",
        "prism:volume": "700",
        "articleNumber": "120286",
        "prism:publisher": "Elsevier B.V. All rights are reserved, including those for text and data mining, AI training, and similar technologies.",
        "dc:title": "CuZnAl embedded silicoaluminate catalyst promotion for the hydrogenation of carbon dioxide to dimethyl ether",
        "prism:copyright": "© 2025 Elsevier B.V. All rights are reserved, including those for text and data mining, AI training, and similar technologies.",
        "openaccess": "0",
        "prism:issn": "0926860X",
        "dcterms:subject": [
          {
            "@_fa": "true",
            "$": "Carbon dioxide hydrogenation"
          },
          {
            "@_fa": "true",
            "$": "Dimethyl ether"
          },
          {
            "@_fa": "true",
            "$": "Bifunctional catalyst"
          },
          {
            "@_fa": "true",
            "$": "Embedding structure"
          }
        ],
        "openaccessArticle": "false",
        "prism:publicationName": "Applied Catalysis A: General",
        "openaccessSponsorType": null,
        "prism:pageRange": "120286",
        "pubType": "fla",
        "prism:coverDisplayDate": "25 June 2025",
        "prism:doi": "10.1016/j.apcata.2025.120286",
        "prism:startingPage": "120286",
        "dc:identifier": "doi:10.1016/j.apcata.2025.120286",
        "openaccessSponsorName": null
      },
      "objects": {
        "object": [
          {
            "@category": "standard",
            "@height": "308",
            "@width": "678",
            "@_fa": "true",
            "$": "https://api.elsevier.com/content/object/eid/1-s2.0-S0926860X25001875-gr4.jpg?httpAccept=%2A%2F%2A",
            "@multimediatype": "JPEG image file",
            "@type": "IMAGE-DOWNSAMPLED",
            "@size": "47968",
            "@ref": "gr4",
            "@mimetype": "image/jpeg"
          },
          {
            "@category": "standard",
            "@height": "259",
            "@width": "678",
            "@_fa": "true",
            "$": "https://api.elsevier.com/content/object/eid/1-s2.0-S0926860X25001875-gr3.jpg?httpAccept=%2A%2F%2A",
            "@multimediatype": "JPEG image file",
            "@type": "IMAGE-DOWNSAMPLED",
            "@size": "37631",
            "@ref": "gr3",
            "@mimetype": "image/jpeg"
          },
          {
            "@category": "standard",
            "@height": "542",
            "@width": "791",
            "@_fa": "true",
            "$": "https://api.elsevier.com/content/object/eid/1-s2.0-S0926860X25001875-gr6.jpg?httpAccept=%2A%2F%2A",
            "@multimediatype": "JPEG image file",
            "@type": "IMAGE-DOWNSAMPLED",
            "@size": "87415",
            "@ref": "gr6",
            "@mimetype": "image/jpeg"
          },
          {
            "@category": "standard",
            "@height": "469",
            "@width": "678",
            "@_fa": "true",
            "$": "https://api.elsevier.com/content/object/eid/1-s2.0-S0926860X25001875-gr5.jpg?httpAccept=%2A%2F%2A",
            "@multimediatype": "JPEG image file",
            "@type": "IMAGE-DOWNSAMPLED",
            "@size": "54016",
            "@ref": "gr5",
            "@mimetype": "image/jpeg"
          },
          {
            "@category": "standard",
            "@height": "424",
            "@width": "791",
            "@_fa": "true",
            "$": "https://api.elsevier.com/content/object/eid/1-s2.0-S0926860X25001875-gr2.jpg?httpAccept=%2A%2F%2A",
            "@multimediatype": "JPEG image file",
            "@type": "IMAGE-DOWNSAMPLED",
            "@size": "92639",
            "@ref": "gr2",
            "@mimetype": "image/jpeg"
          },
          {
            "@category": "standard",
            "@height": "200",
            "@width": "349",
            "@_fa": "true",
            "$": "https://api.elsevier.com/content/object/eid/1-s2.0-S0926860X25001875-ga1.jpg?httpAccept=%2A%2F%2A",
            "@multimediatype": "JPEG image file",
            "@type": "IMAGE-DOWNSAMPLED",
            "@size": "19839",
            "@ref": "ga1",
            "@mimetype": "image/jpeg"
          },
          {
            "@category": "standard",
            "@height": "669",
            "@width": "791",
            "@_fa": "true",
            "$": "https://api.elsevier.com/content/object/eid/1-s2.0-S0926860X25001875-gr1.jpg?httpAccept=%2A%2F%2A",
            "@multimediatype": "JPEG image file",
            "@type": "IMAGE-DOWNSAMPLED",
            "@size": "164550",
            "@ref": "gr1",
            "@mimetype": "image/jpeg"
          },
          {
            "@category": "standard",
            "@height": "124",
            "@width": "565",
            "@_fa": "true",
            "$": "https://api.elsevier.com/content/object/eid/1-s2.0-S0926860X25001875-sc1.jpg?httpAccept=%2A%2F%2A",
            "@multimediatype": "JPEG image file",
            "@type": "IMAGE-DOWNSAMPLED",
            "@size": "14197",
            "@ref": "sc1",
            "@mimetype": "image/jpeg"
          },
          {
            "@category": "standard",
            "@height": "347",
            "@width": "508",
            "@_fa": "true",
            "$": "https://api.elsevier.com/content/object/eid/1-s2.0-S0926860X25001875-gr7.jpg?httpAccept=%2A%2F%2A",
            "@multimediatype": "JPEG image file",
            "@type": "IMAGE-DOWNSAMPLED",
            "@size": "42217",
            "@ref": "gr7",
            "@mimetype": "image/jpeg"
          },
          {
            "@category": "thumbnail",
            "@height": "99",
            "@width": "219",
            "@_fa": "true",
            "$": "https://api.elsevier.com/content/object/eid/1-s2.0-S0926860X25001875-gr4.sml?httpAccept=%2A%2F%2A",
            "@multimediatype": "GIF image file",
            "@type": "IMAGE-THUMBNAIL",
            "@size": "8083",
            "@ref": "gr4",
            "@mimetype": "image/gif"
          },
          {
            "@category": "thumbnail",
            "@height": "84",
            "@width": "219",
            "@_fa": "true",
            "$": "https://api.elsevier.com/content/object/eid/1-s2.0-S0926860X25001875-gr3.sml?httpAccept=%2A%2F%2A",
            "@multimediatype": "GIF image file",
            "@type": "IMAGE-THUMBNAIL",
            "@size": "6051",
            "@ref": "gr3",
            "@mimetype": "image/gif"
          },
          {
            "@category": "thumbnail",
            "@height": "150",
            "@width": "219",
            "@_fa": "true",
            "$": "https://api.elsevier.com/content/object/eid/1-s2.0-S0926860X25001875-gr6.sml?httpAccept=%2A%2F%2A",
            "@multimediatype": "GIF image file",
            "@type": "IMAGE-THUMBNAIL",
            "@size": "12075",
            "@ref": "gr6",
            "@mimetype": "image/gif"
          },
          {
            "@category": "thumbnail",
            "@height": "151",
            "@width": "219",
            "@_fa": "true",
            "$": "https://api.elsevier.com/content/object/eid/1-s2.0-S0926860X25001875-gr5.sml?httpAccept=%2A%2F%2A",
            "@multimediatype": "GIF image file",
            "@type": "IMAGE-THUMBNAIL",
            "@size": "8301",
            "@ref": "gr5",
            "@mimetype": "image/gif"
          },
          {
            "@category": "thumbnail",
            "@height": "117",
            "@width": "219",
            "@_fa": "true",
            "$": "https://api.elsevier.com/content/object/eid/1-s2.0-S0926860X25001875-gr2.sml?httpAccept=%2A%2F%2A",
            "@multimediatype": "GIF image file",
            "@type": "IMAGE-THUMBNAIL",
            "@size": "10547",
            "@ref": "gr2",
            "@mimetype": "image/gif"
          },
          {
            "@category": "thumbnail",
            "@height": "126",
            "@width": "219",
            "@_fa": "true",
            "$": "https://api.elsevier.com/content/object/eid/1-s2.0-S0926860X25001875-ga1.sml?httpAccept=%2A%2F%2A",
            "@multimediatype": "GIF image file",
            "@type": "IMAGE-THUMBNAIL",
            "@size": "12099",
            "@ref": "ga1",
            "@mimetype": "image/gif"
          },
          {
            "@category": "thumbnail",
            "@height": "164",
            "@width": "194",
            "@_fa": "true",
            "$": "https://api.elsevier.com/content/object/eid/1-s2.0-S0926860X25001875-gr1.sml?httpAccept=%2A%2F%2A",
            "@multimediatype": "GIF image file",
            "@type": "IMAGE-THUMBNAIL",
            "@size": "19283",
            "@ref": "gr1",
            "@mimetype": "image/gif"
          },
          {
            "@category": "thumbnail",
            "@height": "48",
            "@width": "219",
            "@_fa": "true",
            "$": "https://api.elsevier.com/content/object/eid/1-s2.0-S0926860X25001875-sc1.sml?httpAccept=%2A%2F%2A",
            "@multimediatype": "GIF image file",
            "@type": "IMAGE-THUMBNAIL",
            "@size": "3005",
            "@ref": "sc1",
            "@mimetype": "image/gif"
          },
          {
            "@category": "thumbnail",
            "@height": "150",
            "@width": "219",
            "@_fa": "true",
            "$": "https://api.elsevier.com/content/object/eid/1-s2.0-S0926860X25001875-gr7.sml?httpAccept=%2A%2F%2A",
            "@multimediatype": "GIF image file",
            "@type": "IMAGE-THUMBNAIL",
            "@size": "9968",
            "@ref": "gr7",
            "@mimetype": "image/gif"
          },
          {
            "@category": "high",
            "@height": "1358",
            "@width": "2994",
            "@_fa": "true",
            "$": "https://api.elsevier.com/content/object/eid/1-s2.0-S0926860X25001875-gr4_lrg.jpg?httpAccept=%2A%2F%2A",
            "@multimediatype": "JPEG image file",
            "@type": "IMAGE-HIGH-RES",
            "@size": "260403",
            "@ref": "gr4",
            "@mimetype": "image/jpeg"
          },
          {
            "@category": "high",
            "@height": "1145",
            "@width": "2994",
            "@_fa": "true",
            "$": "https://api.elsevier.com/content/object/eid/1-s2.0-S0926860X25001875-gr3_lrg.jpg?httpAccept=%2A%2F%2A",
            "@multimediatype": "JPEG image file",
            "@type": "IMAGE-HIGH-RES",
            "@size": "198065",
            "@ref": "gr3",
            "@mimetype": "image/jpeg"
          },
          {
            "@category": "high",
            "@height": "2395",
            "@width": "3493",
            "@_fa": "true",
            "$": "https://api.elsevier.com/content/object/eid/1-s2.0-S0926860X25001875-gr6_lrg.jpg?httpAccept=%2A%2F%2A",
            "@multimediatype": "JPEG image file",
            "@type": "IMAGE-HIGH-RES",
            "@size": "441959",
            "@ref": "gr6",
            "@mimetype": "image/jpeg"
          },
          {
            "@category": "high",
            "@height": "2069",
            "@width": "2994",
            "@_fa": "true",
            "$": "https://api.elsevier.com/content/object/eid/1-s2.0-S0926860X25001875-gr5_lrg.jpg?httpAccept=%2A%2F%2A",
            "@multimediatype": "JPEG image file",
            "@type": "IMAGE-HIGH-RES",
            "@size": "314725",
            "@ref": "gr5",
            "@mimetype": "image/jpeg"
          },
          {
            "@category": "high",
            "@height": "1871",
            "@width": "3493",
            "@_fa": "true",
            "$": "https://api.elsevier.com/content/object/eid/1-s2.0-S0926860X25001875-gr2_lrg.jpg?httpAccept=%2A%2F%2A",
            "@multimediatype": "JPEG image file",
            "@type": "IMAGE-HIGH-RES",
            "@size": "500085",
            "@ref": "gr2",
            "@mimetype": "image/jpeg"
          },
          {
            "@category": "high",
            "@height": "886",
            "@width": "1545",
            "@_fa": "true",
            "$": "https://api.elsevier.com/content/object/eid/1-s2.0-S0926860X25001875-ga1_lrg.jpg?httpAccept=%2A%2F%2A",
            "@multimediatype": "JPEG image file",
            "@type": "IMAGE-HIGH-RES",
            "@size": "149794",
            "@ref": "ga1",
            "@mimetype": "image/jpeg"
          },
          {
            "@category": "high",
            "@height": "2955",
            "@width": "3493",
            "@_fa": "true",
            "$": "https://api.elsevier.com/content/object/eid/1-s2.0-S0926860X25001875-gr1_lrg.jpg?httpAccept=%2A%2F%2A",
            "@multimediatype": "JPEG image file",
            "@type": "IMAGE-HIGH-RES",
            "@size": "1198999",
            "@ref": "gr1",
            "@mimetype": "image/jpeg"
          },
          {
            "@category": "high",
            "@height": "546",
            "@width": "2495",
            "@_fa": "true",
            "$": "https://api.elsevier.com/content/object/eid/1-s2.0-S0926860X25001875-sc1_lrg.jpg?httpAccept=%2A%2F%2A",
            "@multimediatype": "JPEG image file",
            "@type": "IMAGE-HIGH-RES",
            "@size": "76954",
            "@ref": "sc1",
            "@mimetype": "image/jpeg"
          },
          {
            "@category": "high",
            "@height": "1533",
            "@width": "2245",
            "@_fa": "true",
            "$": "https://api.elsevier.com/content/object/eid/1-s2.0-S0926860X25001875-gr7_lrg.jpg?httpAccept=%2A%2F%2A",
            "@multimediatype": "JPEG image file",
            "@type": "IMAGE-HIGH-RES",
            "@size": "215925",
            "@ref": "gr7",
            "@mimetype": "image/jpeg"
          },
          {
            "@category": "standard",
            "@_fa": "true",
            "$": "https://api.elsevier.com/content/object/eid/1-s2.0-S0926860X25001875-mmc1.docx?httpAccept=%2A%2F%2A",
            "@multimediatype": "Microsoft Word file",
            "@type": "APPLICATION",
            "@size": "14577828",
            "@ref": "mmc1",
            "@mimetype": "application/word"
          },
          {
            "@category": "thumbnail",
            "@_fa": "true",
            "$": "https://api.elsevier.com/content/object/eid/1-s2.0-S0926860X25001875-si0001.svg?httpAccept=%2A%2F%2A",
            "@multimediatype": "Scalable Vector Graphics file",
            "@type": "ALTIMG",
            "@size": "3906",
            "@ref": "si0001",
            "@mimetype": "image/svg+xml"
          },
          {
            "@category": "thumbnail",
            "@_fa": "true",
            "$": "https://api.elsevier.com/content/object/eid/1-s2.0-S0926860X25001875-si0002.svg?httpAccept=%2A%2F%2A",
            "@multimediatype": "Scalable Vector Graphics file",
            "@type": "ALTIMG",
            "@size": "2913",
            "@ref": "si0002",
            "@mimetype": "image/svg+xml"
          },
          {
            "@category": "thumbnail",
            "@_fa": "true",
            "$": "https://api.elsevier.com/content/object/eid/1-s2.0-S0926860X25001875-si0003.svg?httpAccept=%2A%2F%2A",
            "@multimediatype": "Scalable Vector Graphics file",
            "@type": "ALTIMG",
            "@size": "2244",
            "@ref": "si0003",
            "@mimetype": "image/svg+xml"
          }
        ]
      },
      "link": {
        "@rel": "abstract",
        "@href": "https://api.elsevier.com/content/abstract/scopus_id/105002581080"
      }
    }
  }
}