{
  "metadata": {
    "title": "CuOx/CeO<ce:inf loc=post>2</ce:inf> catalyst derived from metal organic framework for reverse water-gas shift reaction",
    "authors": "; ; ",
    "journal": "Applied Catalysis A: General",
    "date": "2018-07-25",
    "doi": "10.1016/j.apcata.2018.05.024",
    "abstract": "",
    "uri": "https://api.elsevier.com/content/article/pii/S0926860X18302527",
    "pii": "S0926860X18302527"
  },
  "fulltext": {
    "full-text-retrieval-response": {
      "scopus-eid": "2-s2.0-85047821291",
      "originalText": "serial JL 271346 291210 291744 291809 31 Applied Catalysis A: General APPLIEDCATALYSISAGENERAL 2018-05-25 2018-05-25 2018-06-01 2018-06-01 2019-06-28T12:52:34 1-s2.0-S0926860X18302527 S0926-860X(18)30252-7 S0926860X18302527 10.1016/j.apcata.2018.05.024 S300 S300.3 FULL-TEXT 1-s2.0-S0926860X18X00118 2024-01-01T12:33:10.553292Z 0 0 20180725 2018 2018-05-25T17:57:40.449797Z absattachment articleinfo articletitlenorm authfirstinitialnorm authfirstsurnamenorm cid cids contenttype copyright crossmark dateloaded dateloadedtxt datesearch datesort dateupdated dco docsubtype doctype doi eid ewtransactionid hubeid indexeddate issn issnnorm itemstage itemtransactionid itemweight openaccess openarchive pg pgfirst pglast pii piinorm pubdatestart pubdatetxt pubyr sortorder srctitle srctitlenorm srctype ssids alllist content subj subheadings suppl tomb volfirst volissue volumelist webpdf webpdfpagecount yearnav figure table e-component body mmlmath acknowledge affil appendices articletitle auth authfirstini authfull authkeywords authlast highlightsabst primabst ref specialabst 0926-860X 0926860X true 562 562 C Volume 562 5 28 36 28 36 20180725 25 July 2018 2018-07-25 2018 article fla © 2018 Elsevier B.V. All rights reserved. CUOXCEO2CATALYSTDERIVEDMETALORGANICFRAMEWORKFORREVERSEWATERGASSHIFTREACTION RONDALLORET M 1 Introduction 2 Experimental 3 Result and discussion 3.1 Thermogravimetric analysis of materials before pyrolysis 3.2 Catalytic testing of the first generation of catalysts 3.3 Characterization of the first generation of catalysts 3.4 Synthesis, characterization and catalytic testing of the second generation of catalysts 4 Conclusion Acknowledgements Appendix A Supplementary data References PAN 2014 3809 3818 K CHEN 2000 45 48 C WANG 2011 3703 3727 W LIU 1999 351 354 Y CHEN 2004 97 106 C SANTOS 2015 V GAMARRA 2013 224 238 D AVGOUROPOULOS 2006 1 11 G ROGGE 2017 46 S RANOCCHIARI 2011 6388 6396 M LIU 2014 6011 6061 J FURUKAWA 2013 1230444 H GASCON 2014 361 378 J JIANG 2009 11302 11303 H ROSLER 2015 199 217 C LI 2010 10887 10892 Y KIM 2013 8940 8946 T CHUI 1999 283 S DHAKSHINAMOORTHY 2012 11275 11288 A CHEN 2011 446 449 L CHEN 2009 2298 2306 L WU 2013 11126 11129 R TROVARELLI 1999 353 367 A BOARO 2004 225 237 M DEOLIVEIRAJARDIM 2015 E JARDIM 2015 201 211 E DEOJARDIM 2014 119 129 E SHIRLEY 1972 D MARTINEZJOARISTI 2012 A MOTOC 2016 S RAMOSFERNANDEZ 2008 E GONCALVES 2012 308 317 A MARASHI 2009 M RICOFRANCES 2016 169 178 S ZENG 2013 3597 3605 S KIM 2003 10684 10692 J ZHU 2009 346 353 P AVGOUROPOULOS 2005 87 93 G AVGOUROPOULOS 2003 155 167 G LIU 1996 283 294 W MORETTI 2011 E REINA 2016 67 72 T WEZENDONK 2016 T SANTOS 2015 V WU 2015 53275 53279 C IIJIMA 2006 2825 2829 J ZHENG 2017 5752 5763 S DING 2016 7220 7230 J MORETTI 2015 385 395 E CECILIA 2015 J RAMOSFERNANDEZ 2008 165 169 E RONDALLORETX2018X28 RONDALLORETX2018X28X36 RONDALLORETX2018X28XM RONDALLORETX2018X28X36XM 2020-06-01T00:00:00.000Z http://creativecommons.org/licenses/by-nc-nd/4.0/ © 2018 Elsevier B.V. All rights reserved. item S0926-860X(18)30252-7 S0926860X18302527 1-s2.0-S0926860X18302527 10.1016/j.apcata.2018.05.024 271346 2024-01-01T12:33:10.553292Z 2018-07-25 1-s2.0-S0926860X18302527-main.pdf https://s3.amazonaws.com/prod-ucs-content-store-us-east/content/pii:S0926860X18302527/MAIN/application/pdf/58a0f78db3e7c76f1a935480d716e27a/main.pdf main.pdf pdf true 3548401 MAIN 9 1-s2.0-S0926860X18302527-main_1.png https://s3.amazonaws.com/prod-ucs-content-store-us-east/content/pii:S0926860X18302527/PREVIEW/image/png/3ef29cbfd6e03dfb1d714830af21985f/main_1.png main_1.png png 53623 849 656 IMAGE-WEB-PDF 1 1-s2.0-S0926860X18302527-fx1.sml https://s3.amazonaws.com/prod-ucs-content-store-us-east/content/pii:S0926860X18302527/fx1/THUMBNAIL/image/gif/303b198e411f01e8d125849b9b4338b6/fx1.sml fx1 true fx1.sml sml 10703 164 214 IMAGE-THUMBNAIL 1-s2.0-S0926860X18302527-gr1.sml https://s3.amazonaws.com/prod-ucs-content-store-us-east/content/pii:S0926860X18302527/gr1/THUMBNAIL/image/gif/ff7af2757d4b92711ec392563e226e91/gr1.sml gr1 gr1.sml sml 4569 164 155 IMAGE-THUMBNAIL 1-s2.0-S0926860X18302527-gr10.sml https://s3.amazonaws.com/prod-ucs-content-store-us-east/content/pii:S0926860X18302527/gr10/THUMBNAIL/image/gif/8af45a3ef26352e8f7239ae1a4793885/gr10.sml gr10 gr10.sml sml 6367 130 219 IMAGE-THUMBNAIL 1-s2.0-S0926860X18302527-gr11.sml https://s3.amazonaws.com/prod-ucs-content-store-us-east/content/pii:S0926860X18302527/gr11/THUMBNAIL/image/gif/671b5ccce00f78ccdce74307fd3a879f/gr11.sml gr11 gr11.sml sml 5703 164 219 IMAGE-THUMBNAIL 1-s2.0-S0926860X18302527-gr2.sml https://s3.amazonaws.com/prod-ucs-content-store-us-east/content/pii:S0926860X18302527/gr2/THUMBNAIL/image/gif/db1f4dc588cac52407c90542efacb639/gr2.sml gr2 gr2.sml sml 6664 136 219 IMAGE-THUMBNAIL 1-s2.0-S0926860X18302527-gr3.sml https://s3.amazonaws.com/prod-ucs-content-store-us-east/content/pii:S0926860X18302527/gr3/THUMBNAIL/image/gif/65ac9521dd777f9c74a435366da22a97/gr3.sml gr3 gr3.sml sml 5829 164 150 IMAGE-THUMBNAIL 1-s2.0-S0926860X18302527-gr4.sml https://s3.amazonaws.com/prod-ucs-content-store-us-east/content/pii:S0926860X18302527/gr4/THUMBNAIL/image/gif/b5549b3604c1b08a9b8f360107881c57/gr4.sml gr4 gr4.sml sml 6317 158 219 IMAGE-THUMBNAIL 1-s2.0-S0926860X18302527-gr5.sml https://s3.amazonaws.com/prod-ucs-content-store-us-east/content/pii:S0926860X18302527/gr5/THUMBNAIL/image/gif/72063d4352a2ed91e2b051a3c1168f90/gr5.sml gr5 gr5.sml sml 7963 135 219 IMAGE-THUMBNAIL 1-s2.0-S0926860X18302527-gr6.sml https://s3.amazonaws.com/prod-ucs-content-store-us-east/content/pii:S0926860X18302527/gr6/THUMBNAIL/image/gif/baffc3c06fb9024ee189cd75513b3c5c/gr6.sml gr6 gr6.sml sml 5328 164 124 IMAGE-THUMBNAIL 1-s2.0-S0926860X18302527-gr7.sml https://s3.amazonaws.com/prod-ucs-content-store-us-east/content/pii:S0926860X18302527/gr7/THUMBNAIL/image/gif/29aa9d8fb635ac0395d2ed6469bafe51/gr7.sml gr7 gr7.sml sml 8150 164 72 IMAGE-THUMBNAIL 1-s2.0-S0926860X18302527-gr8.sml https://s3.amazonaws.com/prod-ucs-content-store-us-east/content/pii:S0926860X18302527/gr8/THUMBNAIL/image/gif/58b38d47c34fce966cf4ab0173964be0/gr8.sml gr8 gr8.sml sml 4661 137 219 IMAGE-THUMBNAIL 1-s2.0-S0926860X18302527-gr9.sml https://s3.amazonaws.com/prod-ucs-content-store-us-east/content/pii:S0926860X18302527/gr9/THUMBNAIL/image/gif/7694ecaa0e7938bea43f76f8eebdaea4/gr9.sml gr9 gr9.sml sml 12635 114 219 IMAGE-THUMBNAIL 1-s2.0-S0926860X18302527-fx1.jpg https://s3.amazonaws.com/prod-ucs-content-store-us-east/content/pii:S0926860X18302527/fx1/DOWNSAMPLED/image/jpeg/d4fc98bbf3c88870c37e6b53115dce3f/fx1.jpg fx1 true fx1.jpg jpg 17137 200 261 IMAGE-DOWNSAMPLED 1-s2.0-S0926860X18302527-gr1.jpg https://s3.amazonaws.com/prod-ucs-content-store-us-east/content/pii:S0926860X18302527/gr1/DOWNSAMPLED/image/jpeg/e7fd87398e6c194d841b2fcc5e00c344/gr1.jpg gr1 gr1.jpg jpg 14113 315 298 IMAGE-DOWNSAMPLED 1-s2.0-S0926860X18302527-gr10.jpg https://s3.amazonaws.com/prod-ucs-content-store-us-east/content/pii:S0926860X18302527/gr10/DOWNSAMPLED/image/jpeg/f2d68dbcf70a18acb70e52680dd7033a/gr10.jpg gr10 gr10.jpg jpg 46049 402 677 IMAGE-DOWNSAMPLED 1-s2.0-S0926860X18302527-gr11.jpg https://s3.amazonaws.com/prod-ucs-content-store-us-east/content/pii:S0926860X18302527/gr11/DOWNSAMPLED/image/jpeg/bcbf4f5dbbbd9181a3e256ff8b9551f4/gr11.jpg gr11 gr11.jpg jpg 17741 281 375 IMAGE-DOWNSAMPLED 1-s2.0-S0926860X18302527-gr2.jpg https://s3.amazonaws.com/prod-ucs-content-store-us-east/content/pii:S0926860X18302527/gr2/DOWNSAMPLED/image/jpeg/45d4193537bd193c9763b82664c42614/gr2.jpg gr2 gr2.jpg jpg 21986 234 376 IMAGE-DOWNSAMPLED 1-s2.0-S0926860X18302527-gr3.jpg https://s3.amazonaws.com/prod-ucs-content-store-us-east/content/pii:S0926860X18302527/gr3/DOWNSAMPLED/image/jpeg/fa170cae4717c54e613a81fbbf0de567/gr3.jpg gr3 gr3.jpg jpg 22485 328 300 IMAGE-DOWNSAMPLED 1-s2.0-S0926860X18302527-gr4.jpg https://s3.amazonaws.com/prod-ucs-content-store-us-east/content/pii:S0926860X18302527/gr4/DOWNSAMPLED/image/jpeg/4741132444ffca7e1dbca5f62164c858/gr4.jpg gr4 gr4.jpg jpg 22068 272 376 IMAGE-DOWNSAMPLED 1-s2.0-S0926860X18302527-gr5.jpg https://s3.amazonaws.com/prod-ucs-content-store-us-east/content/pii:S0926860X18302527/gr5/DOWNSAMPLED/image/jpeg/505fdc9a0e2207e6a267d0b5905c0a21/gr5.jpg gr5 gr5.jpg jpg 65099 440 715 IMAGE-DOWNSAMPLED 1-s2.0-S0926860X18302527-gr6.jpg https://s3.amazonaws.com/prod-ucs-content-store-us-east/content/pii:S0926860X18302527/gr6/DOWNSAMPLED/image/jpeg/22e7d0defae07c432cf23e001135e9d9/gr6.jpg gr6 gr6.jpg jpg 37585 497 376 IMAGE-DOWNSAMPLED 1-s2.0-S0926860X18302527-gr7.jpg https://s3.amazonaws.com/prod-ucs-content-store-us-east/content/pii:S0926860X18302527/gr7/DOWNSAMPLED/image/jpeg/5c31d031f47522871a176db4763fe403/gr7.jpg gr7 gr7.jpg jpg 87317 855 376 IMAGE-DOWNSAMPLED 1-s2.0-S0926860X18302527-gr8.jpg https://s3.amazonaws.com/prod-ucs-content-store-us-east/content/pii:S0926860X18302527/gr8/DOWNSAMPLED/image/jpeg/3a6ce3b926790d6799b012286dbca63c/gr8.jpg gr8 gr8.jpg jpg 15644 235 376 IMAGE-DOWNSAMPLED 1-s2.0-S0926860X18302527-gr9.jpg https://s3.amazonaws.com/prod-ucs-content-store-us-east/content/pii:S0926860X18302527/gr9/DOWNSAMPLED/image/jpeg/e431b30b24ead9c46e812b65c29eda96/gr9.jpg gr9 gr9.jpg jpg 41960 294 565 IMAGE-DOWNSAMPLED 1-s2.0-S0926860X18302527-fx1_lrg.jpg https://s3.amazonaws.com/prod-ucs-content-store-us-east/content/pii:S0926860X18302527/fx1/HIGHRES/image/jpeg/9147eddb0e7db8b26f9cbe51846921d6/fx1_lrg.jpg fx1 true fx1_lrg.jpg jpg 144199 886 1158 IMAGE-HIGH-RES 1-s2.0-S0926860X18302527-gr1_lrg.jpg https://s3.amazonaws.com/prod-ucs-content-store-us-east/content/pii:S0926860X18302527/gr1/HIGHRES/image/jpeg/ee70a03e97cbf04b69ab966986560f15/gr1_lrg.jpg gr1 gr1_lrg.jpg jpg 115998 1398 1321 IMAGE-HIGH-RES 1-s2.0-S0926860X18302527-gr10_lrg.jpg https://s3.amazonaws.com/prod-ucs-content-store-us-east/content/pii:S0926860X18302527/gr10/HIGHRES/image/jpeg/59bc2b41328f3a83172fc85b291c49c8/gr10_lrg.jpg gr10 gr10_lrg.jpg jpg 394883 1781 2999 IMAGE-HIGH-RES 1-s2.0-S0926860X18302527-gr11_lrg.jpg https://s3.amazonaws.com/prod-ucs-content-store-us-east/content/pii:S0926860X18302527/gr11/HIGHRES/image/jpeg/5025bbfc70c9cf6fa5b38590e592bb35/gr11_lrg.jpg gr11 gr11_lrg.jpg jpg 135466 1244 1663 IMAGE-HIGH-RES 1-s2.0-S0926860X18302527-gr2_lrg.jpg https://s3.amazonaws.com/prod-ucs-content-store-us-east/content/pii:S0926860X18302527/gr2/HIGHRES/image/jpeg/26819317d19745655b8664843b611327/gr2_lrg.jpg gr2 gr2_lrg.jpg jpg 173659 1037 1664 IMAGE-HIGH-RES 1-s2.0-S0926860X18302527-gr3_lrg.jpg https://s3.amazonaws.com/prod-ucs-content-store-us-east/content/pii:S0926860X18302527/gr3/HIGHRES/image/jpeg/70804e0f35641a63b5091cdf8d822adf/gr3_lrg.jpg gr3 gr3_lrg.jpg jpg 171011 1455 1330 IMAGE-HIGH-RES 1-s2.0-S0926860X18302527-gr4_lrg.jpg https://s3.amazonaws.com/prod-ucs-content-store-us-east/content/pii:S0926860X18302527/gr4/HIGHRES/image/jpeg/cfb977b80a260b22b4c38f804b9e56f3/gr4_lrg.jpg gr4 gr4_lrg.jpg jpg 167915 1206 1667 IMAGE-HIGH-RES 1-s2.0-S0926860X18302527-gr5_lrg.jpg https://s3.amazonaws.com/prod-ucs-content-store-us-east/content/pii:S0926860X18302527/gr5/HIGHRES/image/jpeg/63730b84c31e4137eac90287fa8e1034/gr5_lrg.jpg gr5 gr5_lrg.jpg jpg 598151 1948 3167 IMAGE-HIGH-RES 1-s2.0-S0926860X18302527-gr6_lrg.jpg https://s3.amazonaws.com/prod-ucs-content-store-us-east/content/pii:S0926860X18302527/gr6/HIGHRES/image/jpeg/b926dfb4fb55e0a9e4c05627bfa89cbf/gr6_lrg.jpg gr6 gr6_lrg.jpg jpg 298195 2203 1667 IMAGE-HIGH-RES 1-s2.0-S0926860X18302527-gr7_lrg.jpg https://s3.amazonaws.com/prod-ucs-content-store-us-east/content/pii:S0926860X18302527/gr7/HIGHRES/image/jpeg/c16bae3481017c8ba311f98fa27d1870/gr7_lrg.jpg gr7 gr7_lrg.jpg jpg 1966337 3789 1667 IMAGE-HIGH-RES 1-s2.0-S0926860X18302527-gr8_lrg.jpg https://s3.amazonaws.com/prod-ucs-content-store-us-east/content/pii:S0926860X18302527/gr8/HIGHRES/image/jpeg/553ac9e0f249c8d542880ec8c7f11602/gr8_lrg.jpg gr8 gr8_lrg.jpg jpg 125706 1041 1667 IMAGE-HIGH-RES 1-s2.0-S0926860X18302527-gr9_lrg.jpg https://s3.amazonaws.com/prod-ucs-content-store-us-east/content/pii:S0926860X18302527/gr9/HIGHRES/image/jpeg/6d7998b18ee84375e24b926b7988d1f3/gr9_lrg.jpg gr9 gr9_lrg.jpg jpg 1083197 1302 2500 IMAGE-HIGH-RES 1-s2.0-S0926860X18302527-mmc1.docx https://s3.amazonaws.com/prod-ucs-content-store-us-east/content/pii:S0926860X18302527/mmc1/MAIN/application/vnd.openxmlformats-officedocument.wordprocessingml.document/24fc300385f5c8701d3e4bf2cefbbc36/mmc1.docx mmc1 mmc1.docx docx 416577 APPLICATION 1-s2.0-S0926860X18302527-si1.gif https://s3.amazonaws.com/prod-ucs-content-store-us-east/content/pii:S0926860X18302527/STRIPIN/image/gif/74aa579440918c3818b0842dc3b9131a/si1.gif si1 si1.gif gif 580 25 322 ALTIMG 1-s2.0-S0926860X18302527-si2.gif https://s3.amazonaws.com/prod-ucs-content-store-us-east/content/pii:S0926860X18302527/STRIPIN/image/gif/9571aabda80f67e83502d4311b5edbe9/si2.gif si2 si2.gif gif 709 52 232 ALTIMG 1-s2.0-S0926860X18302527-si3.gif https://s3.amazonaws.com/prod-ucs-content-store-us-east/content/pii:S0926860X18302527/STRIPIN/image/gif/b283a7bdfc24ad0cc8775c7caad383fe/si3.gif si3 si3.gif gif 689 52 221 ALTIMG APCATA 16673 S0926-860X(18)30252-7 10.1016/j.apcata.2018.05.024 Elsevier B.V. Fig. 1 Thermogravimetric profiles of the parent Cu-BTC and the impregnated Cu-BTCs with different compositions: 20Cu80Ce and 40Cu80Ce. Fig. 1 Fig. 2 CO2 conversion versus time on stream for four different catalysts. Fig. 2 Fig. 3 XRD patterns of the different samples. Full circles: CeO2 fluorite structure; full squares: metallic copper; full triangles: CuO; full stars: Cu2O. Fig. 3 Fig. 4 TPR profiles of the different catalysts. Fig. 4 Fig. 5 Cu 2p 3/2 core level spectra of the different catalysts. A) unreduced catalysts, B) reduced catalysts (400 °C flowing hydrogen 1 h). Fig. 5 Fig. 6 XAES at the LMM transition for the four samples studied. Fig. 6 Fig. 7 TEM images of the different samples. Fig. 7 Fig. 8 Comparison of the catalytic performance of the samples Pf20-80 (Air, 1 bar) and Pf20-80 (N2,1 bar) in RGWS. Fig. 8 Fig. 9 TEM images of sample Pf20-80 (Air, 1 bar). Fig. 9 Fig. 10 Cu 2p 3/2 core level spectra of the different catalysts, Pf20-80 (Air, 1 bar) and Pf20-80 (N2, 1 bar). A) un-reduced catalysts, B) reduced catalysts at 400 °C under flowing hydrogen atmosphere. Fig. 10 Fig. 11 Comparison of the catalytic performance of the samples Pf20-80 (Air,1bar) and the reference catalysts in RGWS. Fig. 11 Table 1 Catalyst composition and experimental conditions of the pyrolysis treatments. Table 1 Catalyst Composition, molar % Decomposition method Atmosphere Pressure, bar Cu Ce P20-80 (N2,1 bar) 20 80 Pyrolysis N2 1 P40-60 (N2,1 bar) 40 60 Pyrolysis N2 1 Pf20-80 (N2,1 bar) 20 80 Flash Pyrolysis N2 1 Pf40-60 (N2,1 bar) 40 60 Flash Pyrolysis N2 1 Pf20-80 (Air,1 bar) 20 80 Flash Pyrolysis Air 1 Table 2 Crystallite size of Cu and CeO2 calculated using the Scherrer equation. Table 2 Catalyst 2 θ D Cu, nm 2 θ D CeO2, nm P20-80 (N2,1 bar) – 28.6 22 P40-60 (N2,1 bar) 43.3 27 28.6 35 Pf20-80 (N2,1 bar) – 28.6 23 Pf40-60 (N2,1 bar) 43.3 32 28.6 33 Table 3 Atomic percentage of Ce(III) and atomic ratio Cu/Ce calculated by XPS. Table 3 Ce (III) (%) Cu/Ce Pf20-80 (N2,1 bar) 31.20 0.16 Pf20-80 (N2,1 bar) Reduced 34.50 0.48 Pf20-80 (Air,1 bar) 32.63 0.28 Pf20-80 (Air,1 bar) Reduced 34.34 0.14 CuOx/CeO2 catalyst derived from metal organic framework for reverse water-gas shift reaction Maria Ronda-Lloret Soledad Rico-Francés Antonio Sepúlveda-Escribano Enrique V. Ramos-Fernandez ⁎ Laboratorio de Materiales Avanzados, Departamento de Química Inorgánica – Instituto, Universitario de Materiales de Alicante, Universidad de Alicante, Apartado 99, E-03080, Alicante, Spain Laboratorio de Materiales Avanzados Departamento de Química Inorgánica – Instituto Universitario de Materiales de Alicante Universidad de Alicante Apartado 99 Alicante E-03080 Spain ⁎ Corresponding autor. Graphical abstract Herein, we have studied an alternative route for preparing CuOx/CeO2 catalysts using metal organic frameworks (MOFs) as precursors. Usually, CuOx/CeO2 materials are prepared by wet impregnation of ceria support. In this study, we have impregnated a Cu-MOF with a ceria precursor and then pyrolized the impregnated MOF using different conditions and procedures. The prepared catalysts have been characterized by using a wide range of techniques such as XRD, XPS, Raman, and TPR. We have found that the pyrolysis method determines the dispersion of the oxidized copper species on the ceria surface what, in turn, controls the catalytic activity and selectivity of the catalysts in the reverse water-gas shift (RWGS) reaction. We have compared the behavior of the MOF-derived catalysts against an optimized catalyst prepared by a conventional method (wet impregnation), finding that the MOF-derived catalyst shows better catalytic performance. Keywords Metal organic framework RWGS Ceria Copper oxide 1 Introduction CO2 is one of the most dominating greenhouse gases, which mainly comes from fossil fuels (coal, natural gas and oil) combustion for energy generation, transportation and chemical industry [1]. The utilization of CO2 for the production of chemicals is one of the proposed ways to mitigate the global warming, by which CO2 is used as a cheap, nontoxic and abundant C1 source. Conversion of CO2 to CO through the Reverse Water-Gas Shift (RWGS) reaction (Eq. (1)) is one of the studied processes for CO2 utilization to obtain CO which, together with H2, can be used to produce valuable chemicals via the Fischer-Tropsch reaction [2]. (1) C O 2 + H 2 ↔ C O + H 2 O Δ H 25 ° C = 41 , 2 K J / m o l However, CO2 reduction is highly endothermic and it requires high operation temperatures. Noble metals-based catalysts can be used for this reaction but, due to their high cost and limited natural abundance, the finding of an alternative catalytic materials is highly requested. Copper-based catalysts have been the most studied catalytic systems for the WGS reaction, and they have also been applied to the RWGS reaction [3]. Liu et al. developed a series of Cu-Ni/ γ-Al2O3 bimetallic catalysts for CO2 hydrogenation. They studied the effect of the Ni/Cu ratio on conversion and selectivity, and founded that Cu favors CO formation, meanwhile Ni favors CH4 formation [4]. However, the main problem of Cu-based catalysts is their poor thermal stability; at high temperatures, copper nanoparticles sinter and the catalyst deactivates. This fact can be avoided by adding a thermal stabilizer. For example, the addition of a small amount of iron effectively improves the catalytic activity and stability of Cu/SiO2 catalysts at high temperature [5]. An usual approach in heterogeneous catalysis to avoid particles sinterization is the use of supports (as SiO2, ZnO, TiO2, CeO2 and γ-Al2O3) in order to increase the active phase dispersion (textural promotor) and/or acting as chemical promotors, increasing selectivity and/or conversion [6]. In this sense, CuOx/CeO2 has been proposed as a promising system for RWGS. The preparation of CuOx/CeO2 catalysts is far for being trivial. It is well known and demonstrated by Martinez-Arias et al. [7,8]. that the catalytic activity of this system depends on the contact of both ceria and copper species. Copper and ceria are prompt to sinter at temperatures about 400 °C, that is the temperature commonly used for catalysts calcination. For this reason, the preparation of CuOx/CeO2 catalysts made out from CuOx nanoparticles and CeO2 oxide nanoparticles is of great interest. The use of Metal-Organic Frameworks (MOFs) as precursors of metal catalysts is a relatively new field of research that worth being explored for the preparation of highly dispersed supported active phases. MOFs are coordination compounds based on metallic ions or clusters connected with organic linkers by coordination bonds and other weak interactions, creating three-dimensional networks [9,10]. Due to their interesting properties (large pore surface area, highly designable pore shape and pore size, high dispersion of its components, hybrid characteristics and structural flexibility) they have a wide range of applications [11,12]. Foremost among them are included gas separation and storage [13,14] and heterogeneous catalysis [14]. MOFs have been proved to act as heterogeneous catalysts because (i) the framework itself can act as a catalyst, in which case, metallic centers or pseudo-organic linkers (like porphyrin [11]) are responsible of the catalytic activity, (ii) they can act as host materials for supporting catalysts [15,16] and (iii) they can act as precursors of catalysts by framework decomposition, which is a new way to use MOFs as catalysts [17]. During the thermal decomposition process the metal ions in the MOFs are transformed into metallic or metal oxide nanoparticles and the organic linkers form carbonaceous structures, that can act as a support and facilitate the active phase dispersion [18]. MOFs can be considered optimum precursors for catalysts preparation, decreasing the problems related to achieve good active phase dispersion. The MOF denominated Cu3(BTC)2, or HKUST-1, is one of the most extensively studied copper-based MOFs as catalyst precursor since it was synthesized by Chui et al. in 1999 [19]. Cu3(BTC)2 has a structure constituted by clusters of two copper ions coordinated with four carboxylate groups of organic linkers, generating paddle-wheel building blocks. In this structure, each copper ion of the building block is coordinated with one water molecule, which can be removed or exchanged by other ligands easily [20]. Thermal treatment of this MOF has been studied in several works. Thus, calcination in air produces microporous CuO materials with different archaeologies [21], decomposition in inert atmosphere leads to symmetrical coralloid Cu 3D superstructures [22] and a combination of both thermal treatments has also been studied [22,23]. In our approach, we will use a MOF as copper precursor. The precursor of the copper species is not impregnated on a support as traditionally, but the support is impregnated on the MOF, which already contains the the copper. CeO2 is used in this work due to its interesting properties: it is a partially reducible oxide (oxidation states +4 and +3 and has highly mobile oxygen atoms. The oxygen storage capacity (OSC) is the most attractive characteristic of this oxide; it is able to storage and supply active oxygen depending on the conditions [24,25]. Thus, through the use of a copper-based MOF as metallic precursor and of CeO2 as final support/promoter, it is intended to prepare a stable and active catalyst in the RWGS reaction. 2 Experimental Catalysts with different atomic percentage of copper and cerium (Table 1 ) were prepared in two steps. The first one was the impregnation of the MOF (Basolite ® C 300) with a cerium precursor ((NH4)2Ce(NO3)6, ≥ 99.99%, Aldrich) in methanol (MeOH, 99.98%, Aldrich), with a ratio of 10 mL/gsolid. The slurry formed was stirred during 24 h under He bubbling until dryness. The second step consisted in the decomposition of the prepared materials using different methodologies and conditions. For the catalysts, the decomposition was carried out in a laboratory-scale pilot plant provided with a steel reactor, able to work at pressures between 0.1 and 1.5 MPa under different atmospheres (air, nitrogen, helium). Samples were introduced in a pyrex glass tube of 6.5 cm diameter and 21 cm height, which was fit in the steel reactor. Thermal treatments were carried out in a fluidized sand bath, since the heat transfer is very fast and it avoids large temperature gradients. Two decomposition methods were studied in this system: 1) Pyrolysis (P): the reactor, loaded with the sample (10 g), was introduced in a fluidized sand bath heated at 550 °C. Once the thermocouple of the inner part (controlling the sample temperature) of the reactor reached the desired temperature (550 °C), the sample were kept in the fluidized sand bath for an hour. 2) Flash pyrolysis (Pf): the reactor, loaded with the sample (10 g), was introduced in a fluidized sand bath heated at 550 °C. Once the thermocouple of the inner part of the reactor reached the desired temperature (550 °C), the reactor was removed from the fluidized sand bath. The samples were prepared using different conditions and compositions (Cu/Ce ratios). The labeling and experimental details are summarized in Table 1. It is important for the readers to know that in the first test we did, we used a glass plug flow reactor and it burst during the decomposition of the impregnated precursors. In order to compare our catalyst with a reference material we have also prepared a catalyst based on previously reported works [26–28]. The ceria support was prepared as follow: 13 g of Ce(NO3)3·9H2O (Aldrich, 99%) and 8 g of urea (Fluka, 98%) were dissolved in 400 ml of ultra-pure water. The mixture was heated at 90 °C with constant stirring for 11 h. Finally, 12 ml ammonia solution (Panreac, 30%) was added drop-wise to ensure complete precipitation. The solid was separated by filtration, washed with ultrapure water, and finally dried at 110 °C overnight. The powder sample was calcined in air at 500 °C for 4 h, using a rate of 3 °C·min−1. The ceria support was impregnated with an aqueous solution of Cu(NO3)2·3H2O (Panreac, 99.999%) with the appropriate concentration to achieve 4 and 8 wt.% Cu loading. Then, catalysts were dried at 90 °C overnight and calcined in air at 500 °C for 4 h, with a heating rate of 3 °C·min−1. Thermogravimetric experiments were carried out in a Mettler Toledo TGA/SDTA, located in the Research Technical Services of the University of Alicante (SSTTI). An alumina crucible containing10 mg of sample was heated under 50 ml·min−1 air flow up to 625 °C, at a heating rate of 10 °C·min−1. XPS spectra were collected using a Thermo Scientific K-ALPHA with Al-K radiation (1486.6 eV), monochromatized by a twin crystal monochromator, yielding a focused X-ray spot with a diameter of 400 μm, at 3 mA × 12 kV when charge compensation was achieved with the system flood gun that provides low energy electrons and low energy argon ions from a single source. The alpha hemispherical analyzer was operated in the constant energy mode with survey scan pass energies of 200 eV to measure the whole energy band and 50 eV in a narrow scan to selectively measure the particular elements. An estimation of the intensities was done after a calculation of each peak integral, S-shaped background subtraction and fitting the experimental curve to a combination of a Lorentzian (30%) and Gaussian (70%) lines [29]. Binding energies (BE), referenced to the C 1 s line at 284.6 eV, have an accuracy of ± 0.2 eV. Before the analysis, catalysts were pre-treated under a reducing atmosphere (flowing 50 ml·min−1 of hydrogen) at 250 °C and then immersed in octane, which was evaporated under vacuum conditions. Catalysts reducibility was studied with temperature-programmed reduction experiments in a mass spectrometer (Pfeiffer, OmniStar GSD 301), under a mixture of 5% H2/He (50 ml·min−1 and heating rate of 10 °C·min−1) and after a cleaning treatment (He flow at 150 °C for 2 h). Hydrogen consumption was calculated after a calibration with CuO. The Raman equipment used (Jobin-Yvon Horiba coupled to an Olympus microscope with a lens of 50x/0.5 LMPlanFI and He/Ne laser excitation source (633 nm), resolution of 3 cm−1) also belongs to the SSTTI at the University of Alicante. Its calibration was carried out by checking the Si signal at 520 cm−1. The morphology of the samples was studied with micrographies obtained using a JEOL electron microscope (model JEM-2010), working at 200 kV. The device contains an OXFORD INCA Energy TEM 100 analytical system and a SIS MegaView II camera. Samples before analysis were reduced in the same conditions as XPS experiments, and then, suspended and placed on copper grids. Catalytic tests with 100 mg of sample were carried out in a reaction system connected to a gas chromatograph (Agilent Technologies, 7890 A model). Previously to the reaction, samples were reduced with a hydrogen flow until they reached the reaction temperature (400 °C, ramp 5 °C·min−1), and then the reaction was carried out within 24 h approximately. Reaction conditions were: 15% CO2 and 15% H2, balanced with He, with a total gas flow of 50 ml·min−1. CO2 conversion and CO selectivity were calculated using the following equations: (2) X C O 2 % = C O 2 i n - C O 2 o u t C O 2 i n · 100 (3) S C O % = C O o u t C O 2 i n - C O 2 o u t · 100 3 Result and discussion 3.1 Thermogravimetric analysis of materials before pyrolysis The decomposition temperatures of the MOF and the MOF impregnated with the ceria precursor, were studied under inner atmosphere. Fig. 1 , shows the thermogravimetric analysis of Cu3(BTC)2, denominated as Cu(BTC), and the same material impregnated with two different amounts of ceria precursor, with Cu:Ce atomic ratios of 20:80 (20Cu80Ce) and 40:60 (40Cu60Ce). As we can see, the Cu-BTC material has two well defined weight losses: one below 100 °C, that is when the solvent starts to be desorbed, and another one at a higher temperature (350 °C), that corresponds to the sample decomposition. This decomposition temperature is normally found for this type of materials [30,31]. If we calculate the residual amount of solid remaining after the total decomposition, we can see that 67 wt.% is left (we are taking into account the solvent loss below 100 °C, since it does not take part of the MOF). This percentage perfectly fits with the theoretical amount of Cu plus C present in the MOF, the HKUST-1 molecular formula being C18H6CuO12; it points out that the MOF decomposes into C and metallic Cu. When the MOF is impregnated with the ceria precursor ((NH4)2Ce(NO3)6) the onset temperature of decomposition of the system is 260 °C. It is due to the decomposition of the ceria precursor that generates NOx, [32,33]. We can also see a weight loss around 340 °C, which is ascribed to the decomposition of the MOF itself. Actually, the sample containing less HKUST-1 (20Cu80Ce) presents a less pronounced weight loss at 340 °C. These results show an important factor we need to take into account for proposing a safe and efficient method to prepare our catalysts. The large amount of hazardous gases produced (NOx) and their fast production guide us to use a high-pressure reactor that can outstand the possible and sudden increase of pressure. Furthermore, we also used these experiments to set the pyrolysis temperature of the catalysts (550 °C). At this temperature, we are sure that the MOF and the ceria precursor have fully decomposed. 3.2 Catalytic testing of the first generation of catalysts The properties of the catalysts are obviously affected by the way they are prepared. The first parameter that we checked was the effect of the catalysts composition. For that reason, we prepared a catalyst in which we aimed to have two different Cu contents. In this way, we impregnated the HKUST-1 with two different amounts of ceria precursor targeting two molar ratio 20Cu:80Ce and 40Cu:60Ce. The second studied parameter was the decomposition method. We carried out the decomposition following the two procedures described in the experimental section, labelled as P and Pf. In both cases, we used N2 atmosphere and a pressure of 1 bar. Fig. 2 reports the catalytic activity of the above-mentioned samples. As we can see, the samples having high Cu content show poor catalytic activity, with solid P40-60 (N2, 1 bar) being completely inactive. The catalyst Pf40-60 (N2, 1 bar) has some activity during the first stages of the reaction, but the conversion level is as low as 1% after 20 h on stream. In spite of the fact that these samples have higher amount of Cu species, the conversion is much lower than that of their counterparts. It is important to remark that the selectivity is 100% towards CO. The catalysts with low Cu content show a better catalytic behavior in the RWGS reaction. Thus, sample Pf20-80 (N2, 1 bar) produces an initial conversion of 16% which decreases up to 9% after 20 h on stream. The sample prepared by the P method and low Cu content behaves worse than the sample prepared by the Pf method, but still shows catalytic activity. It can be summarized that a high Cu content diminish the catalytic activity, and that the Pf method yields gives better catalysts than the P method. In order to see the influence of the copper loading the results have been plotted as mmol CO2 converted per minute and per gram of copper (see supporting information fig S5). We can see that the difference in catalytic activity between samples having low and high content of copper is very pronounced, being the one having low Cu content the most active one. However, we have to remark that in this reaction both, copper and ceria, participate in the catalytic cycle and this comparison does not take into account the influence of the ceria support. 3.3 Characterization of the first generation of catalysts In order to elucidate the properties of the prepared catalysts and how they affect to the catalytic performance, we have carried out a complete characterization study by using a wide variety of techniques. Fig. 3 show the XRD patterns of the prepared catalysts. We can see the characteristic peaks of the cubic fluorite structure of ceria. It is surprising to see how the samples with high ceria content (20Cu80Ce) show less defined peaks, this indicating lower crystallinity. It is counter intuitive, since one might expect larger ceria crystal in samples having higher amount of ceria. This result indicates that the MOF matrix or Cu play an important role in the formation of ceria crystals. It is also important to remark that in the 20Cu80Ce samples no peaks of copper oxide or metallic copper were detected. Taking into account that the total Cu content is 7.7 wt.% in these samples, it should be detectable by XRD. Thus, these results indicate that Cu species are well dispersed all over the support, and their small crystallite size makes them non-detectable by XRD analysis. If we look now up the samples with lower ceria content (40Cu60Ce), we can see the peaks of metallic copper at 43.3° and 51°, copper (I) oxide at 35.8 ° and 38.9° and copper (II) oxide at 36.7°. It points out that these catalysts contain crystalline copper particles with relatively large crystal size, which is measurable by XRD analysis. This means that catalysts 40Cu60Ce present lower copper dispersion, independently of the pyrolysis method used in their synthesis. Table 2 shows the crystallite sizes of Cu species and CeO2, calculated using the Scherrer equation [34]. The CeO2 crystal size for samples 40Cu60Ce is larger than for samples 20Cu80Ce. As it has been mentioned before, the larger the amount of ceria is, the lower the crystal size of ceria becomes. The pyrolysis method does not affect much the crystal size of the CeO2; thus, the sample pyrolyzed by method P gives an average ceria crystal size of 22 nm, while the Pf method gives 23 nm, essentially the same. Both the large size of the copper particles and the large ceria crystal size might explain the poor catalytic activity of the samples 40Cu60Ce. However, the difference in the catalytic performance of samples 20Cu80Ce (Pf and P) cannot be explained only with the XRD results, since copper species are not detected and the crystal size of ceria particles is very similar. In order to corroborate these results, we also did Raman spectroscopy studies (Fig. S1). We could see that all samples show a peak centered at 467 cm−1, which is typically assigned to CeO2 vibrations and particularly ascribed to the triply degenerated TO mode [35]. The main differences found are that samples with high Cu loading show two additional peaks at 223 and 292 cm−1, which are ascribed to the vibrational mode of CuO. This means that the high copper loading samples have larger CuO particles, in agreement with XRD. In order to get further insight into the properties of the catalysts, especially in terms of redox properties, we carried out temperature-programmed reduction (TPR) experiments. The analysis of the results provided by these experiments is far for being trivial, since every copper and ceria species can be reduced at different temperature depending on their particle size, oxidation state or interactions among the different species. We analyzed CuO and CeO2 as reference materials. Fig. S2 shows the TPR profile of both materials; where it can be seen that the CuO profile presents a broad peak centered at 320 °C, while the reduction of ceria takes place in two different processes; one at low temperature (450 °C) where the surface ceria is reduced, and another one at high temperature (800 °C) where the bulk ceria is reduced. Three well defined peaks can be seen in the TPR profiles of our samples (Fig. 4 ): the peaks so-called α, β, and γ peaks [36,37], all of them located at lower temperature than the reduction of pure copper or pure ceria. In literature, we can find two types of TPR profile for CuOx/CeO2: the two steps reduction [38] and the three steps reduction profiles [39,26]. In the most complex system when three peaks are found, the assignation of the peaks is as follow. There is a lot of literature explaining these three peaks in a slightly different way. The α peak (at lowest temperature) is due to the reduction of highly dispersed CuOx species, which are in close contact with the support. The assignation of this peak is very straightforward and there is an agreement between different research groups developing CuOx/CeO2 catalysts[8,40–42]. The β peak is ascribed to the reduction of CuOx particles well dispersed on CeO2. The assignation of this peak has been studied by Flytzani et. al [42] and others [8,43], who have ascribed this peak to these type of species. Finally, the γ peak corresponds to the reduction of the larger CuO particles. It is generally assumed that the lower the temperature of reduction, the smaller the particles size and the stronger the CuOx-CeO2 interaction[44,37]. Thus, it is clear that the sample Pf20-80 (N2, 1 bar) presents the α, β, γ peaks at lower temperatures than its counterparts, this indicating the small copper oxide particle size. When the pyrolysis is carried out using the P method, the peaks shift at higher temperatures and get broader, this indicating that both the particle size is larger and particle size distribution is wider. The samples having high Cu content (40Cu60Ce) showed a very broad band in which is difficult to distinguish the α, β, γ peaks. It points to a very poor dispersion of the copper particles, as it was also shown by XRD analysis. Furthermore, we could also quantify how much hydrogen was consumed (Table 3 ) during the reduction processes. The samples pyrolized using the Pf method show more hydrogen consumption than the samples prepared by the P method, independently of the copper content. This fact is surprising, since one can think that the higher the content of copper the more hydrogen would be consumed. However, a high Cu content implies the decomposition of a larger amount of HKUST-1, this producing a more reductor environment. The linker of the MOF can act as a reductor agent and generate metallic copper, which explains the lower hydrogen consumption in TPR experiments: an important amount of copper species are already reduced upon the MOF decomposition. Actually, the diffraction peaks corresponding to metallic copper particles (peaks at 34° and 51°) are clearly evidenced in the XRD patterns. The reduction of the metal oxide during the thermal decomposition of a MOF has been already demonstrated by Santos et al. [45,46]. They used Fe-BTC metal organic framework or MIL-100 to prepare highly active Fischer-Tropsch catalysts. With the use of X-ray absorption measurements together with Mössbauer spectroscopy they demonstrated that during the thermal decomposition of the MOF cationic iron was reduced to metallic Fe. Moreover, iron carbide could be formed if the temperature of decomposition was high enough. In our case, we decomposed also the ceria precursor, thus generating NOx that has a high oxidant character. In this way, we have a competition between the reductor character of the linker (carbon material) and the oxidant character of the NOx. So, if we want to increase the copper content we produce a more reductor environment, since we decompose a larger amount of MOF. The duration of the pyrolysis treatment also affects significantly the redox properties. Thus, the TPR profile of catalyst P40-60 (N2, 1 bar) shows a very weak feature of copper oxide reduction. In this case the amount of linker is higher and the time of pyrolysis is longer, so most of the copper oxide is reduced upon the pyrolysis treatment. Metallic copper sinters at lower temperatures than copper oxide [47]. Actually, the reduction assisted sintering of copper particles is widely used in electronics to lower the sintering temperature. As a consequence of getting reduced Cu species, we get large copper particles having poor redox properties and poor catalytic activity [47]. We have checked the oxidation state of copper species after the pyrolysis treatments by X-ray photoelectron spectroscopy and X-ray excited Auger electron spectroscopy (XAES). Fig. 5 shows the Cu 2p 3/2 core level of all the catalysts prepared. The profile of the spectra already shows the high heterogeneity of the samples. Binding energies above 933.5 eV and the presence of shake-up peaks are characteristic of CuO species, while binding energies below 932.5 eV are typically assigned to Cu2O or metallic copper. For all samples, we can see that CuO is present as well as Cu2O or metallic copper. Samples having low Cu content present more defined peaks at high binding energies, indicating the higher concentration of CuO (as we could already conclude from the TPR profiles). The samples having high Cu content show signals at low binding energies. These results are also in line with the TPR profiles and confirm that the linker decomposition produces a reductor environment and, consequently, higher amount of reduced copper particles with a poor dispersion. The analysis of Cu 2p 3/2 core level is especially difficult. Since the Cu+ and metallic copper have statistically the same binding energy, they are difficult to distinguish. XAES is more suitable for distinguishing between Cu+ or Cu°. Fig. 6 . shows the XAES spectra at the LMM Auger transition for the four samples. It can be observed that the sample having low Cu loading presents two clear bands. One centered at 917.5 eV that is ascribed to Cu°, and a second one at lower kinetic energy that ascribed to Cu+[26,48–50]. It points out that even for low Cu content, some of the copper is reduced. However, for the samples having high Cu content only one peak centered at 917.5 eV is detected. It indicates that the presence of the linker pushes the reduction of Cu2+ to Cu°, since no Cu+ was found. This fact is another evidence that our pyrolysis methods generate a reductor environment that promotes the reduction of copper, while when more linker is present in the pyrolysis the more reductor environment is achieved. Before reaction, the catalysts are activated at 400 °C under flowing hydrogen in order to reduce the CuO species and enhance the Cu-CeO2 interaction. For that reason, we have also analyzed the XPS spectra of the samples after reduction. Fig. 5 shows the Cu 2p 3/2 transition of this catalysts and we can see that the signal can be deconvoluted into two peaks. The more intense one at low binding energy [48] is ascribed to metallic copper species. It was also corroborated by XAES looking at LMM transition. The second peak at higher binding energy must be associated to Cu2+. However, its intensity is very low and the satellite peaks associated to Cu2+ are hardly detected [7,26,28,51]. We can say that after reduction at 400 °C the copper species are reduced to a large extent in all the catalysts. The main difference between catalysts with high and low copper loading is the position of the Cu 2p 3/2 peak. For samples 20Cu40Ce, it is located at lower binding energies. This can be attributed to an electron enrichement of the Cu species produced by their strong interaction with ceria, as we have previously demonstrated for different metals supported either on ceria or on other reducible supports[28,52,53]. The better dispersion of the CuO particles in the 20Cu40Ce catalysts leads to a better interaction of the reduced copper species with the ceria support. This strong interaction seems to be crucial for the catalytic performance, since samples having high loading of Cu show very poor catalytic activity or do not have activity at all. It is interesting to mention that in all samples a peak appears at higher binding energies (around 933.5 eV), indicating that copper is not fully reduced to the metallic state. Fig. 7 shows the transmission electron microscopy images of the samples. As we can see, the morphology of the samples with high Cu loading is totally different to that of their counterparts with lower Cu content. We can see that samples 20Cu80Ce present a very homogeneous aspect. There are dark spots homogenously distributed and we could not see agglomerates. It is difficult to observe differences between samples P20-80 (N2, 1 bar) and Pf20-80 (N2, 1 bar). Thus, it should be emphasized that, despite having high ceria content, the particles are very finely dispersed. Samples 40Cu60Ce show large crystals with different contrast that can be interpreted as due to the presence of both CuO and CeO2 crystals. This is consistent with the finding obtained with other characterization techniques. Bearing in mind all the results presented above, we observe that the crystal size of ceria and copper oxide is critical for the catalyst performance. Some of the results are in line with traditional synthetic routes: high copper loading leads to low copper dispersion. However, it is interesting to notice that the ceria crystal size is smaller in catalysts with the largest ceria content, what is related to the MOF matrix and to the way the catalysts are prepared. 3.4 Synthesis, characterization and catalytic testing of the second generation of catalysts We have also learnt that the reductive environment generated during the pyrolysis of the catalysts’ precursor leads to the reduction of CuO to copper, thus favoring the sintering of the particles. In order to avoid this reduction, it might be interesting to pyrolyse the samples in an oxidant environment. To do so, we used air instead of nitrogen during the pyrolysis and we continued studying the samples with low Cu content in such a way that the amount of linker present is diminished. Fig. 8 reports the catalytic activity of sample Pf20-80 (Air, 1 bar). For the sake of clarity, we have also included in the figure the catalytic behavior of sample Pf20-80 (N2, 1 bar). As one can see, the sample obtained by pyrolyzing the precursor in air has higher catalytic activity (CO2 conversion) compared to the sample pyrolized in N2. If we assume that during the air pyrolysis we burn off all the carbon residue, the content of Cu increases from 7.7 wt.% for sample Pf20-80 (N2, 1 bar) to 8.4 wt.% for sample Pf20-80 (Air, 1 bar). However, the conversion increases ∼7%. This increase in conversion cannot be explained only by the increase in Cu loading but by the different physico-chemical properties of the final catalyst such as Cu dispersion and electronic properties, which can also be modulated by the different copper-ceria interaction. We have also analyzed the sample prepared in air by XRD, TPR, TEM and XPS. In order to not enlarging excessively this paper, we only include in the paper the TEM and the XPS results. The results of the other techniques are included as Supporting Information. Summarizing them, XRD analysis shows only the cubic structure of the ceria support (having an average crystal size of 22 nm) and copper species where not detected. The TPR profile of the sample Pf20-80 (Air,1 bar) shows three well defined peaks α, β, γ, which are located at the same temperature than for the sample Pf20-80 (N2,1 bar), pointing out a good dispersion of the CuO particles. The TEM images (Fig. 9 ) show that the Pf20-80 (Air,1 bar) catalyst is homogeneously distributed in dark tiny spots. We have not analyzed the sample statistically due to the difficulty for distinguishing between CuO and CeO2 crystals (very similar contrast), but the general view of the sample indicates that the crystals present in the sample are very well spread, giving us the first evidence that CuO is well dispersed. XPS can give us evidences of the electronic nature of copper before and after the catalyst is reduced. Fig. 10 shows the Cu 2p 3/2 core level spectra of Pf20-80(Air, 1 bar) catalyst (for the sake of comparison, the Cu 2p 3/2 spectra of the sample Pf20-80(N2, 1 bar) was plotted in the same graph). The spectra of the sample Pf20-80(Air, 1 bar) presents the characteristic peaks of oxidic copper. The peak ascribed to the reduced copper (below 932 eV) is not detected, while it could be observed in the spectra of the sample pyrolyzed under N2 atmosphere. It points out that during the decomposition in the presence of air, the production of less reduced copper is favored [7]. When we reduced the samples at 400 °C under flowing hydrogen, copper species are fully reduced in catalyst Pf20-80(Air, 1 bar) (Fig. 10), while for catalyst Pf20-80(N2, 1 bar) there are still some residual oxidized species. It indicates that the copper species present in catalyst Pf20-80(Air, 1 bar) are smaller and strongly interacting with the CeO2 support. Consequently, they can be reduced easier than the Cu species of Pf20-80(N2, 1 bar), since the interaction is enhanced and the redox synergy (Cu-Ce) favors the reducibility [44]. Furthermore, the peak in the 2p 3/2 spectra of sample Pf20-80(Air, 1 bar) is located at a lower binding energy (around 0.3 eV less) than that of catalyst Pf20-80(N2, 1 bar). It indicates that the copper in the former are electron-enriched, what seems to be crucial for the catalytic performance. We have also calculated the surface composition of these two samples from the XPS data. Table 3 shows the surface Cu/Ce atomic ratio found in the catalysts before and after reduction. The percentage of Ce(III) found in the samples, as obtained from XPS analysis, has also been included. Firstly, the amount of Ce(III) increases a similar extent, with the reduction process. But, what is more important, the final surface Cu/Ce ratio, as obtained by XPS, is clearly affected by the atmosphere at which the catalysts precursor has been pyrolyzed, and by the reduction treatment. Thus, the sample obtained by pyrolysis under nitrogen (Pf20-80 (N2, 1 bar)) contains a lower relative amount of surface copper than the catalyst obtained by pyrolysis under air (Cu/Ce 0.16 vs. 0.28). But the behavior during the reduction treatment is opposite, as it produces a strong surface segregation of copper in the former, and an important decrease of the surface Cu content in the catalyst obtained under oxidative pyrolysis. As reported by other authors [34,37], this surface migration of ceria is indicative of a strong metal-support interaction effect. It is clear for the catalytic results we have obtained with these catalysts that the induction of this strong copper-ceria interaction is crucial in the reverse water-gas shift reaction. In order to compare our preparation method with a conventional one, we have prepared a reference catalyst containing 8 wt.% Cu loading supported on ceria. For the preparation of this catalyst we have used an optimized impregnation method to get high copper dispersion and interaction of the metal with the support (see experimental section). The physicochemical properties of this catalyst are reported elsewhere [26]. Fig. 11 shows the comparison of the best catalyst prepared in this work with a reference catalyst prepared by traditional impregnation method. As we can see, the reference catalyst has an initial activity higher than the one prepared from the Cu MOF. However, for the reference catalyst the deactivation is more pronounced and after 20 h it shows lower conversion than our catalyst. It indicates that our catalyst deactivates in a lesser extent that when is prepared using a traditional method. 4 Conclusion We have found that the pyrolysis conditions of the impregnated MOF are critical to get active and selective catalysts in RWGS. By changing the pyrolysis atmosphere we can get an oxidant environment that keeps copper oxidized during the decomposition and prevents sintering. We can summarize that the presence of air in the decomposition induces the formation of copper oxide species, which have more difficulties to sinter than metallic copper. It favors the interaction with the ceria support and consequently it leads to a better catalytic performance. In this way, we can prepare highly CuO dispersed on CeO2 that can be easily reduced and interact strongly with the ceria. All these factors make this catalyst the most active among the ones prepared here. Furthermore, the catalysts we prepared here outperform the same catalysts prepared by a traditional method such as wet impregnation using conventional metal precursors. Acknowledgements Financial support from Generalitat Valenciana (project PROMETEOII/2014/004) and MINECO (Project MAT2013-45008-P) is gratefully acknowledged. EVRF also thanks MINECO for his Ramon y Cajal fellow RYC-2012-11427 and the following project MAT2016-81732-ERC. Appendix A Supplementary data Supplementary material related to this article can be found, in the online version, at doi:https://doi.org/10.1016/j.apcata.2018.05.024. Appendix A Supplementary data The following is Supplementary data to this article: References [1] K.L. Pan W.C. Chung M.B. Chang IEEE Trans. Plasma Sci. 42 2014 3809 3818 10.1109/TPS.2014.2360238 [2] C.-S. Chen W.-H. Cheng S.-S. Lin Catal. Lett. 68 2000 45 48 10.1002/adma.201402322 [3] W. Wang S.P. Wang X.B. Ma J.L. Gong Chem. Soc. Rev. 40 2011 3703 3727 10.1039/c1cs15008a [4] Y. Liu D. Liu Int. J. Hydrogen Energy 24 1999 351 354 10.1016/S0360-3199(98)00038-X [5] C.S. Chen W.H. Cheng S.S. Lin Appl. Catal. A Gen. 257 2004 97 106 10.1016/S0926-860X(03)00637-9 [6] V.P. Santos T. Wezendonk J.J.D. Jaén I. Dugulan M. Nasalevich H.-U. Islam A. Chojecki S. Sartipi X. Sun A. Hakeem A.C.J. Koeken M. Ruitenbeek T. Davidian G.R. Meima G. Sankar F. Kapteijn M. Makkee J. Gascon Nat. Commun. 6 6451 2015 10.1038/ncomms7451 [7] D. Gamarra A.L. Cámara M. Monte S.B. Rasmussen L.E. Chinchilla A.B. Hungría G. Munuera N. Gyorffy Z. Schay V.C. Corberán J.C. Conesa A. Martínez-Arias Appl. Catal. B: Environ. 130–131 2013 224 238 10.1016/j.apcatb.2012.11.008 [8] G. Avgouropoulos T. Ioannides Appl. Catal. B: Environ. 67 2006 1 11 10.1016/j.apcatb.2006.04.005 [9] D. Farrusseng, Edited by Handbook of Solid State Chemistry Hydrogen as a Future Energy Carrier Synthesis of Inorganic Materials Metal-Organic Frameworks Hydrogen and Fuel Cells Handbook of Hydrogen Storage, n.d. [10] S.M.J. Rogge A. Bavykina J. Hajek H. Garcia A.I. Olivos-Suarez A. Sepúlveda-Escribano A. Vimont G. Clet P. Bazin F. Kapteijn M. Daturi E.V. Ramos-Fernandez F.X.I. Llabrés Xamena V. Van Speybroeck J. Gascon Chem. Soc. Rev. 2017 46 10.1039/c7cs00033b [11] M. Ranocchiari J.A. van Bokhoven Phys. Chem. Chem. Phys. 13 2011 6388 6396 10.1039/c0cp02394a [12] J. Liu L. Chen H. Cui J. Zhang L. Zhang C.-Y. Su Chem. Soc. Rev. 43 2014 6011 6061 10.1039/C4CS00094C [13] H. Furukawa K.E. Cordova M. O’Keeffe O.M. Yaghi Science. 341 2013 1230444 10.1126/science.1230444 [14] J. Gascon A. Corma F. Kapteijn F.X. Llabre i Xamena ACS Catal. 4 2014 361 378 10.1021/cs400959k [15] H. Jiang B. Liu T. Akita M. Haruta H. Sakurai N. Ku E.V. Sciences T. Metropolitan V. Uni J. Am. Chem. Soc. 2 2009 11302 11303 10.1021/ja9047653 [16] C. Rösler R. Fischer CrystEngComm. 17 2015 199 217 10.1039/C4CE01251H [17] Y. Li P. Song J. Zheng X. Li Chem. A: Eur. J. 16 2010 10887 10892 10.1002/chem.201000391 [18] T.K. Kim K.J. Lee J.Y. Cheon J.H. Lee S.H. Joo H.R. Moon J. Am. Chem. Soc. 135 2013 8940 8946 10.1021/ja401869h [19] S.S.-Y. Chui S.M.-F. Lo J.P.H. Charmant A.G. Orpen I.D. Williams Science (80-.) 1999 283 10.1126/science.283.5405.1148 [20] A. Dhakshinamoorthy M. Alvaro H. Garcia Chem. Commun. (Camb). 48 2012 11275 11288 10.1039/c2cc34329k [21] L. Chen C. Zhao Z. Wei S. Wang Y. Gu Mater. Lett. 65 2011 446 449 10.1016/j.matlet.2010.10.059 [22] L. Chen Y. Shen J. Bai C. Wang J. Solid State Chem. 182 2009 2298 2306 10.1016/j.jssc.2009.06.007 [23] R. Wu X. Qian F. Yu H. Liu K. Zhou J. Wei Y. Huang J. Mater. Chem. A 1 2013 11126 11129 10.1039/c3ta12621h [24] A. Trovarelli C. de Leitenburg M. Boaro G. Dolcetti Catal. Today. 50 1999 353 367 10.1016/S0920-5861(98)00515-X [25] M. Boaro F. Giordano S. Recchia V.D. Santo M. Giona A. Trovarelli Appl. Catal. B: Environ. 52 2004 225 237 10.1016/j.apcatb.2004.03.021 [26] E. De Oliveira Jardim S. Rico-Francés Z. Abdelouahab-Reddam F. Coloma J. Silvestre-Albero A. Sepúlveda-Escribano E.V. Ramos-Fernandez Appl. Catal. A: Gen. 502 2015 10.1016/j.apcata.2015.05.033 [27] E.O. Jardim S. Rico-Francés F. Coloma J.A. Anderson E.V. Ramos-Fernandez J. Silvestre-Albero A. Sepúlveda-Escribano Appl. Catal. A: Gen. 492 2015 201 211 10.1016/j.apcata.2014.12.032 [28] E. de O. Jardim S. Rico-Francés F. Coloma E.V. Ramos-Fernández J. Silvestre-Albero A. Sepúlveda-Escribano Appl. Catal. A: Gen. 487 2014 119 129 10.1016/j.apcata.2014.09.003 [29] D.A. Shirley Phys. Rev. B. 5 1972 10.1103/PhysRevB.5.4709 [30] A. Martinez Joaristi J. Juan-Alcañiz P. Serra-Crespo F. Kapteijn J. Gascon Cryst. Growth Des. 12 2012 10.1021/cg300552w [31] S. Motoc F. Manea A. Iacob A. Martinez-Joaristi J. Gascon A. Pop J. Schoonman Sensors (Switzerland) 16 2016 10.3390/s16101719 [32] E.V. Ramos-Fernández J.C. Serrano-Ruiz J. Silvestre-Albero A. Sepúlveda-Escribano F. Rodríguez-Reinoso J. Mater. Sci. 43 2008 10.1007/s10853-007-2361-8 [33] A. Gonçalves J. Silvestre-Albero E.V. Ramos-Fernández J.C. Serrano-Ruiz J.J.M. Órfão A. Sepúlveda-Escribano M.F.R. Pereira Appl. Catal. B: Environ. 113–114 2012 308 317 10.1016/j.apcatb.2011.11.052 [34] M.S. Marashi J.V. Khaki J. Alloys Compd. 482 2009 10.1016/j.jallcom.2009.04.066 [35] S. Rico-Francés E.O. Jardim T.A. Wezendonk F. Kapteijn J. Gascon A. Sepúlveda-Escribano E.V. Ramos-Fernandez Appl. Catal. B: Environ. 180 2016 169 178 10.1016/j.apcatb.2015.06.031 [36] S. Zeng W. Zhang M. Śliwa H. Su Int. J. Hydrogen Energy. 38 2013 3597 3605 10.1016/j.ijhydene.2013.01.030 [37] R. Wang, ChemCatChem. (n.d.) n/a--n/a doi:10.1002/cctc.201700972. [38] J.Y. Kim J.A. Rodriguez J.C. Hanson A.I. Frenkel P.L. Lee J. Am. Chem. Soc. 125 2003 10684 10692 10.1021/ja0301673 [39] P. Zhu J. Li Q. Huang S. Yan M. Liu R. Zhou J. Nat. Gas Chem. 18 2009 346 353 10.1016/S1003-9953(08)60119-X [40] G. Avgouropoulos T. Ioannides H. Matralis Appl. Catal. B: Environ. 56 2005 87 93 10.1016/j.apcatb.2004.07.017 [41] G. Avgouropoulos T. Ioannides Appl. Catal. A: Gen. 244 2003 155 167 10.1016/S0926-860X(02)00558-6 [42] W. Liu M. Flytzani-Stephanopoulos Chem. Eng. J. Biochem. Eng. J. 64 1996 283 294 https://www.scopus.com/inward/record.uri?eid=2-s2.0-0030276222&partnerID=40&md5=cc013b54d6d399f133269748f874ccfc [43] E. Moretti L. Storaro A. Talon M. Lenarda P. Riello R. Frattini M.D.V.M. de Yuso A. Jiménez-López E. Rodríguez-Castellón F. Ternero A. Caballero J.P. Holgado Appl. Catal. B: Environ. 102 2011 10.1016/j.apcatb.2011.01.004 [44] T.R. Reina S. Ivanova O.H. Laguna M.A. Centeno J.A. Odriozola Appl. Catal. B: Environ. 197 2016 67 72 10.1016/j.apcatb.2016.03.022 [45] T.A. Wezendonk V.P. Santos M.A. Nasalevich Q.S.E. Warringa A.I. Dugulan A. Chojecki A.C.J. Koeken M. Ruitenbeek G. Meima H.-U. Islam G. Sankar M. Makkee F. Kapteijn J. Gascon ACS Catal. 6 2016 10.1021/acscatal.6b00426 [46] V.P. Santos T. Wezendonk J.J.D. Jaén I. Dugulan M. Nasalevich H.-U. Islam A. Chojecki S. Sartipi X. Sun A. Hakeem A.C.J. Koeken M. Ruitenbeek T. Davidian G.R. Meima G. Sankar F. Kapteijn M. Makkee J. Gascon Nat. Commun. 6 6451 2015 10.1038/ncomms7451 [47] C.-J. Wu S.-L. Cheng Y.-J. Sheng H.-K. Tsao RSC Adv. 5 2015 53275 53279 10.1039/C5RA08167J [48] J. Iijima J.-W. Lim S.-H. Hong S. Suzuki K. Mimura M. Isshiki Appl. Surf. Sci. 253 2006 2825 2829 10.1016/j.apsusc.2006.05.063 [49] S. Zheng K. Zhu W. Li Y. Ji New J. Chem. 41 2017 5752 5763 10.1039/C6NJ03960J [50] J. Ding Y. Liu J. Zhang K. Liu H. Xiao F. Kong Y. Sun J. Chen Catal. Sci. Technol. 6 2016 7220 7230 10.1039/C6CY00715E [51] E. Moretti L. Storaro A. Talon P. Riello A.I. Molina E. Rodríguez-Castellón Appl. Catal. B: Environ. 168–169 2015 385 395 10.1016/j.apcatb.2014.12.032 [52] J.A. Cecilia A. Arango-Díaz V. Rico-Pérez A. Bueno-López E. Rodríguez-Castellón Catal. Today 2015 10.1016/j.cattod.2015.02.012 [53] E.V. Ramos-Fernández B. Samaranch P. Ramírez de la Piscina N. Homs J.L.G. Fierro F. Rodríguez-Reinoso A. Sepúlveda-Escribano Appl. Catal. A: Gen. 349 2008 165 169 10.1016/j.apcata.2008.07.024",
      "scopus-id": "85047821291",
      "coredata": {
        "eid": "1-s2.0-S0926860X18302527",
        "dc:description": "Herein, we have studied an alternative route for preparing CuOx/CeO2 catalysts using metal organic frameworks (MOFs) as precursors. Usually, CuOx/CeO2 materials are prepared by wet impregnation of ceria support. In this study, we have impregnated a Cu-MOF with a ceria precursor and then pyrolized the impregnated MOF using different conditions and procedures. The prepared catalysts have been characterized by using a wide range of techniques such as XRD, XPS, Raman, and TPR. We have found that the pyrolysis method determines the dispersion of the oxidized copper species on the ceria surface what, in turn, controls the catalytic activity and selectivity of the catalysts in the reverse water-gas shift (RWGS) reaction. We have compared the behavior of the MOF-derived catalysts against an optimized catalyst prepared by a conventional method (wet impregnation), finding that the MOF-derived catalyst shows better catalytic performance.",
        "openArchiveArticle": "false",
        "prism:coverDate": "2018-07-25",
        "openaccessUserLicense": null,
        "prism:aggregationType": "Journal",
        "prism:url": "https://api.elsevier.com/content/article/pii/S0926860X18302527",
        "dc:creator": [
          {
            "@_fa": "true",
            "$": "Ronda-Lloret, Maria"
          },
          {
            "@_fa": "true",
            "$": "Rico-Francés, Soledad"
          },
          {
            "@_fa": "true",
            "$": "Sepúlveda-Escribano, Antonio"
          },
          {
            "@_fa": "true",
            "$": "Ramos-Fernandez, Enrique V."
          }
        ],
        "link": [
          {
            "@_fa": "true",
            "@rel": "self",
            "@href": "https://api.elsevier.com/content/article/pii/S0926860X18302527"
          },
          {
            "@_fa": "true",
            "@rel": "scidir",
            "@href": "https://www.sciencedirect.com/science/article/pii/S0926860X18302527"
          }
        ],
        "dc:format": "application/json",
        "openaccessType": null,
        "pii": "S0926-860X(18)30252-7",
        "prism:volume": "562",
        "prism:publisher": "Elsevier B.V.",
        "dc:title": "CuOx/CeO2 catalyst derived from metal organic framework for reverse water-gas shift reaction",
        "prism:copyright": "© 2018 Elsevier B.V. All rights reserved.",
        "openaccess": "0",
        "prism:issn": "0926860X",
        "dcterms:subject": [
          {
            "@_fa": "true",
            "$": "Metal organic framework"
          },
          {
            "@_fa": "true",
            "$": "RWGS"
          },
          {
            "@_fa": "true",
            "$": "Ceria"
          },
          {
            "@_fa": "true",
            "$": "Copper oxide"
          }
        ],
        "openaccessArticle": "false",
        "prism:publicationName": "Applied Catalysis A: General",
        "openaccessSponsorType": null,
        "prism:pageRange": "28-36",
        "prism:endingPage": "36",
        "pubType": "fla",
        "prism:coverDisplayDate": "25 July 2018",
        "prism:doi": "10.1016/j.apcata.2018.05.024",
        "prism:startingPage": "28",
        "dc:identifier": "doi:10.1016/j.apcata.2018.05.024",
        "openaccessSponsorName": null
      },
      "objects": {
        "object": [
          {
            "@category": "thumbnail",
            "@height": "164",
            "@width": "214",
            "@_fa": "true",
            "$": "https://api.elsevier.com/content/object/eid/1-s2.0-S0926860X18302527-fx1.sml?httpAccept=%2A%2F%2A",
            "@multimediatype": "GIF image file",
            "@type": "IMAGE-THUMBNAIL",
            "@size": "10703",
            "@ref": "fx1",
            "@mimetype": "image/gif"
          },
          {
            "@category": "thumbnail",
            "@height": "164",
            "@width": "155",
            "@_fa": "true",
            "$": "https://api.elsevier.com/content/object/eid/1-s2.0-S0926860X18302527-gr1.sml?httpAccept=%2A%2F%2A",
            "@multimediatype": "GIF image file",
            "@type": "IMAGE-THUMBNAIL",
            "@size": "4569",
            "@ref": "gr1",
            "@mimetype": "image/gif"
          },
          {
            "@category": "thumbnail",
            "@height": "130",
            "@width": "219",
            "@_fa": "true",
            "$": "https://api.elsevier.com/content/object/eid/1-s2.0-S0926860X18302527-gr10.sml?httpAccept=%2A%2F%2A",
            "@multimediatype": "GIF image file",
            "@type": "IMAGE-THUMBNAIL",
            "@size": "6367",
            "@ref": "gr10",
            "@mimetype": "image/gif"
          },
          {
            "@category": "thumbnail",
            "@height": "164",
            "@width": "219",
            "@_fa": "true",
            "$": "https://api.elsevier.com/content/object/eid/1-s2.0-S0926860X18302527-gr11.sml?httpAccept=%2A%2F%2A",
            "@multimediatype": "GIF image file",
            "@type": "IMAGE-THUMBNAIL",
            "@size": "5703",
            "@ref": "gr11",
            "@mimetype": "image/gif"
          },
          {
            "@category": "thumbnail",
            "@height": "136",
            "@width": "219",
            "@_fa": "true",
            "$": "https://api.elsevier.com/content/object/eid/1-s2.0-S0926860X18302527-gr2.sml?httpAccept=%2A%2F%2A",
            "@multimediatype": "GIF image file",
            "@type": "IMAGE-THUMBNAIL",
            "@size": "6664",
            "@ref": "gr2",
            "@mimetype": "image/gif"
          },
          {
            "@category": "thumbnail",
            "@height": "164",
            "@width": "150",
            "@_fa": "true",
            "$": "https://api.elsevier.com/content/object/eid/1-s2.0-S0926860X18302527-gr3.sml?httpAccept=%2A%2F%2A",
            "@multimediatype": "GIF image file",
            "@type": "IMAGE-THUMBNAIL",
            "@size": "5829",
            "@ref": "gr3",
            "@mimetype": "image/gif"
          },
          {
            "@category": "thumbnail",
            "@height": "158",
            "@width": "219",
            "@_fa": "true",
            "$": "https://api.elsevier.com/content/object/eid/1-s2.0-S0926860X18302527-gr4.sml?httpAccept=%2A%2F%2A",
            "@multimediatype": "GIF image file",
            "@type": "IMAGE-THUMBNAIL",
            "@size": "6317",
            "@ref": "gr4",
            "@mimetype": "image/gif"
          },
          {
            "@category": "thumbnail",
            "@height": "135",
            "@width": "219",
            "@_fa": "true",
            "$": "https://api.elsevier.com/content/object/eid/1-s2.0-S0926860X18302527-gr5.sml?httpAccept=%2A%2F%2A",
            "@multimediatype": "GIF image file",
            "@type": "IMAGE-THUMBNAIL",
            "@size": "7963",
            "@ref": "gr5",
            "@mimetype": "image/gif"
          },
          {
            "@category": "thumbnail",
            "@height": "164",
            "@width": "124",
            "@_fa": "true",
            "$": "https://api.elsevier.com/content/object/eid/1-s2.0-S0926860X18302527-gr6.sml?httpAccept=%2A%2F%2A",
            "@multimediatype": "GIF image file",
            "@type": "IMAGE-THUMBNAIL",
            "@size": "5328",
            "@ref": "gr6",
            "@mimetype": "image/gif"
          },
          {
            "@category": "thumbnail",
            "@height": "164",
            "@width": "72",
            "@_fa": "true",
            "$": "https://api.elsevier.com/content/object/eid/1-s2.0-S0926860X18302527-gr7.sml?httpAccept=%2A%2F%2A",
            "@multimediatype": "GIF image file",
            "@type": "IMAGE-THUMBNAIL",
            "@size": "8150",
            "@ref": "gr7",
            "@mimetype": "image/gif"
          },
          {
            "@category": "thumbnail",
            "@height": "137",
            "@width": "219",
            "@_fa": "true",
            "$": "https://api.elsevier.com/content/object/eid/1-s2.0-S0926860X18302527-gr8.sml?httpAccept=%2A%2F%2A",
            "@multimediatype": "GIF image file",
            "@type": "IMAGE-THUMBNAIL",
            "@size": "4661",
            "@ref": "gr8",
            "@mimetype": "image/gif"
          },
          {
            "@category": "thumbnail",
            "@height": "114",
            "@width": "219",
            "@_fa": "true",
            "$": "https://api.elsevier.com/content/object/eid/1-s2.0-S0926860X18302527-gr9.sml?httpAccept=%2A%2F%2A",
            "@multimediatype": "GIF image file",
            "@type": "IMAGE-THUMBNAIL",
            "@size": "12635",
            "@ref": "gr9",
            "@mimetype": "image/gif"
          },
          {
            "@category": "standard",
            "@height": "200",
            "@width": "261",
            "@_fa": "true",
            "$": "https://api.elsevier.com/content/object/eid/1-s2.0-S0926860X18302527-fx1.jpg?httpAccept=%2A%2F%2A",
            "@multimediatype": "JPEG image file",
            "@type": "IMAGE-DOWNSAMPLED",
            "@size": "17137",
            "@ref": "fx1",
            "@mimetype": "image/jpeg"
          },
          {
            "@category": "standard",
            "@height": "315",
            "@width": "298",
            "@_fa": "true",
            "$": "https://api.elsevier.com/content/object/eid/1-s2.0-S0926860X18302527-gr1.jpg?httpAccept=%2A%2F%2A",
            "@multimediatype": "JPEG image file",
            "@type": "IMAGE-DOWNSAMPLED",
            "@size": "14113",
            "@ref": "gr1",
            "@mimetype": "image/jpeg"
          },
          {
            "@category": "standard",
            "@height": "402",
            "@width": "677",
            "@_fa": "true",
            "$": "https://api.elsevier.com/content/object/eid/1-s2.0-S0926860X18302527-gr10.jpg?httpAccept=%2A%2F%2A",
            "@multimediatype": "JPEG image file",
            "@type": "IMAGE-DOWNSAMPLED",
            "@size": "46049",
            "@ref": "gr10",
            "@mimetype": "image/jpeg"
          },
          {
            "@category": "standard",
            "@height": "281",
            "@width": "375",
            "@_fa": "true",
            "$": "https://api.elsevier.com/content/object/eid/1-s2.0-S0926860X18302527-gr11.jpg?httpAccept=%2A%2F%2A",
            "@multimediatype": "JPEG image file",
            "@type": "IMAGE-DOWNSAMPLED",
            "@size": "17741",
            "@ref": "gr11",
            "@mimetype": "image/jpeg"
          },
          {
            "@category": "standard",
            "@height": "234",
            "@width": "376",
            "@_fa": "true",
            "$": "https://api.elsevier.com/content/object/eid/1-s2.0-S0926860X18302527-gr2.jpg?httpAccept=%2A%2F%2A",
            "@multimediatype": "JPEG image file",
            "@type": "IMAGE-DOWNSAMPLED",
            "@size": "21986",
            "@ref": "gr2",
            "@mimetype": "image/jpeg"
          },
          {
            "@category": "standard",
            "@height": "328",
            "@width": "300",
            "@_fa": "true",
            "$": "https://api.elsevier.com/content/object/eid/1-s2.0-S0926860X18302527-gr3.jpg?httpAccept=%2A%2F%2A",
            "@multimediatype": "JPEG image file",
            "@type": "IMAGE-DOWNSAMPLED",
            "@size": "22485",
            "@ref": "gr3",
            "@mimetype": "image/jpeg"
          },
          {
            "@category": "standard",
            "@height": "272",
            "@width": "376",
            "@_fa": "true",
            "$": "https://api.elsevier.com/content/object/eid/1-s2.0-S0926860X18302527-gr4.jpg?httpAccept=%2A%2F%2A",
            "@multimediatype": "JPEG image file",
            "@type": "IMAGE-DOWNSAMPLED",
            "@size": "22068",
            "@ref": "gr4",
            "@mimetype": "image/jpeg"
          },
          {
            "@category": "standard",
            "@height": "440",
            "@width": "715",
            "@_fa": "true",
            "$": "https://api.elsevier.com/content/object/eid/1-s2.0-S0926860X18302527-gr5.jpg?httpAccept=%2A%2F%2A",
            "@multimediatype": "JPEG image file",
            "@type": "IMAGE-DOWNSAMPLED",
            "@size": "65099",
            "@ref": "gr5",
            "@mimetype": "image/jpeg"
          },
          {
            "@category": "standard",
            "@height": "497",
            "@width": "376",
            "@_fa": "true",
            "$": "https://api.elsevier.com/content/object/eid/1-s2.0-S0926860X18302527-gr6.jpg?httpAccept=%2A%2F%2A",
            "@multimediatype": "JPEG image file",
            "@type": "IMAGE-DOWNSAMPLED",
            "@size": "37585",
            "@ref": "gr6",
            "@mimetype": "image/jpeg"
          },
          {
            "@category": "standard",
            "@height": "855",
            "@width": "376",
            "@_fa": "true",
            "$": "https://api.elsevier.com/content/object/eid/1-s2.0-S0926860X18302527-gr7.jpg?httpAccept=%2A%2F%2A",
            "@multimediatype": "JPEG image file",
            "@type": "IMAGE-DOWNSAMPLED",
            "@size": "87317",
            "@ref": "gr7",
            "@mimetype": "image/jpeg"
          },
          {
            "@category": "standard",
            "@height": "235",
            "@width": "376",
            "@_fa": "true",
            "$": "https://api.elsevier.com/content/object/eid/1-s2.0-S0926860X18302527-gr8.jpg?httpAccept=%2A%2F%2A",
            "@multimediatype": "JPEG image file",
            "@type": "IMAGE-DOWNSAMPLED",
            "@size": "15644",
            "@ref": "gr8",
            "@mimetype": "image/jpeg"
          },
          {
            "@category": "standard",
            "@height": "294",
            "@width": "565",
            "@_fa": "true",
            "$": "https://api.elsevier.com/content/object/eid/1-s2.0-S0926860X18302527-gr9.jpg?httpAccept=%2A%2F%2A",
            "@multimediatype": "JPEG image file",
            "@type": "IMAGE-DOWNSAMPLED",
            "@size": "41960",
            "@ref": "gr9",
            "@mimetype": "image/jpeg"
          },
          {
            "@category": "high",
            "@height": "886",
            "@width": "1158",
            "@_fa": "true",
            "$": "https://api.elsevier.com/content/object/eid/1-s2.0-S0926860X18302527-fx1_lrg.jpg?httpAccept=%2A%2F%2A",
            "@multimediatype": "JPEG image file",
            "@type": "IMAGE-HIGH-RES",
            "@size": "144199",
            "@ref": "fx1",
            "@mimetype": "image/jpeg"
          },
          {
            "@category": "high",
            "@height": "1398",
            "@width": "1321",
            "@_fa": "true",
            "$": "https://api.elsevier.com/content/object/eid/1-s2.0-S0926860X18302527-gr1_lrg.jpg?httpAccept=%2A%2F%2A",
            "@multimediatype": "JPEG image file",
            "@type": "IMAGE-HIGH-RES",
            "@size": "115998",
            "@ref": "gr1",
            "@mimetype": "image/jpeg"
          },
          {
            "@category": "high",
            "@height": "1781",
            "@width": "2999",
            "@_fa": "true",
            "$": "https://api.elsevier.com/content/object/eid/1-s2.0-S0926860X18302527-gr10_lrg.jpg?httpAccept=%2A%2F%2A",
            "@multimediatype": "JPEG image file",
            "@type": "IMAGE-HIGH-RES",
            "@size": "394883",
            "@ref": "gr10",
            "@mimetype": "image/jpeg"
          },
          {
            "@category": "high",
            "@height": "1244",
            "@width": "1663",
            "@_fa": "true",
            "$": "https://api.elsevier.com/content/object/eid/1-s2.0-S0926860X18302527-gr11_lrg.jpg?httpAccept=%2A%2F%2A",
            "@multimediatype": "JPEG image file",
            "@type": "IMAGE-HIGH-RES",
            "@size": "135466",
            "@ref": "gr11",
            "@mimetype": "image/jpeg"
          },
          {
            "@category": "high",
            "@height": "1037",
            "@width": "1664",
            "@_fa": "true",
            "$": "https://api.elsevier.com/content/object/eid/1-s2.0-S0926860X18302527-gr2_lrg.jpg?httpAccept=%2A%2F%2A",
            "@multimediatype": "JPEG image file",
            "@type": "IMAGE-HIGH-RES",
            "@size": "173659",
            "@ref": "gr2",
            "@mimetype": "image/jpeg"
          },
          {
            "@category": "high",
            "@height": "1455",
            "@width": "1330",
            "@_fa": "true",
            "$": "https://api.elsevier.com/content/object/eid/1-s2.0-S0926860X18302527-gr3_lrg.jpg?httpAccept=%2A%2F%2A",
            "@multimediatype": "JPEG image file",
            "@type": "IMAGE-HIGH-RES",
            "@size": "171011",
            "@ref": "gr3",
            "@mimetype": "image/jpeg"
          },
          {
            "@category": "high",
            "@height": "1206",
            "@width": "1667",
            "@_fa": "true",
            "$": "https://api.elsevier.com/content/object/eid/1-s2.0-S0926860X18302527-gr4_lrg.jpg?httpAccept=%2A%2F%2A",
            "@multimediatype": "JPEG image file",
            "@type": "IMAGE-HIGH-RES",
            "@size": "167915",
            "@ref": "gr4",
            "@mimetype": "image/jpeg"
          },
          {
            "@category": "high",
            "@height": "1948",
            "@width": "3167",
            "@_fa": "true",
            "$": "https://api.elsevier.com/content/object/eid/1-s2.0-S0926860X18302527-gr5_lrg.jpg?httpAccept=%2A%2F%2A",
            "@multimediatype": "JPEG image file",
            "@type": "IMAGE-HIGH-RES",
            "@size": "598151",
            "@ref": "gr5",
            "@mimetype": "image/jpeg"
          },
          {
            "@category": "high",
            "@height": "2203",
            "@width": "1667",
            "@_fa": "true",
            "$": "https://api.elsevier.com/content/object/eid/1-s2.0-S0926860X18302527-gr6_lrg.jpg?httpAccept=%2A%2F%2A",
            "@multimediatype": "JPEG image file",
            "@type": "IMAGE-HIGH-RES",
            "@size": "298195",
            "@ref": "gr6",
            "@mimetype": "image/jpeg"
          },
          {
            "@category": "high",
            "@height": "3789",
            "@width": "1667",
            "@_fa": "true",
            "$": "https://api.elsevier.com/content/object/eid/1-s2.0-S0926860X18302527-gr7_lrg.jpg?httpAccept=%2A%2F%2A",
            "@multimediatype": "JPEG image file",
            "@type": "IMAGE-HIGH-RES",
            "@size": "1966337",
            "@ref": "gr7",
            "@mimetype": "image/jpeg"
          },
          {
            "@category": "high",
            "@height": "1041",
            "@width": "1667",
            "@_fa": "true",
            "$": "https://api.elsevier.com/content/object/eid/1-s2.0-S0926860X18302527-gr8_lrg.jpg?httpAccept=%2A%2F%2A",
            "@multimediatype": "JPEG image file",
            "@type": "IMAGE-HIGH-RES",
            "@size": "125706",
            "@ref": "gr8",
            "@mimetype": "image/jpeg"
          },
          {
            "@category": "high",
            "@height": "1302",
            "@width": "2500",
            "@_fa": "true",
            "$": "https://api.elsevier.com/content/object/eid/1-s2.0-S0926860X18302527-gr9_lrg.jpg?httpAccept=%2A%2F%2A",
            "@multimediatype": "JPEG image file",
            "@type": "IMAGE-HIGH-RES",
            "@size": "1083197",
            "@ref": "gr9",
            "@mimetype": "image/jpeg"
          },
          {
            "@category": "standard",
            "@_fa": "true",
            "$": "https://api.elsevier.com/content/object/eid/1-s2.0-S0926860X18302527-mmc1.docx?httpAccept=%2A%2F%2A",
            "@multimediatype": "Microsoft Word file",
            "@type": "APPLICATION",
            "@size": "416577",
            "@ref": "mmc1",
            "@mimetype": "application/word"
          },
          {
            "@category": "thumbnail",
            "@height": "25",
            "@width": "322",
            "@_fa": "true",
            "$": "https://api.elsevier.com/content/object/eid/1-s2.0-S0926860X18302527-si1.gif?httpAccept=%2A%2F%2A",
            "@multimediatype": "GIF image file",
            "@type": "ALTIMG",
            "@size": "580",
            "@ref": "si1",
            "@mimetype": "image/gif"
          },
          {
            "@category": "thumbnail",
            "@height": "52",
            "@width": "232",
            "@_fa": "true",
            "$": "https://api.elsevier.com/content/object/eid/1-s2.0-S0926860X18302527-si2.gif?httpAccept=%2A%2F%2A",
            "@multimediatype": "GIF image file",
            "@type": "ALTIMG",
            "@size": "709",
            "@ref": "si2",
            "@mimetype": "image/gif"
          },
          {
            "@category": "thumbnail",
            "@height": "52",
            "@width": "221",
            "@_fa": "true",
            "$": "https://api.elsevier.com/content/object/eid/1-s2.0-S0926860X18302527-si3.gif?httpAccept=%2A%2F%2A",
            "@multimediatype": "GIF image file",
            "@type": "ALTIMG",
            "@size": "689",
            "@ref": "si3",
            "@mimetype": "image/gif"
          }
        ]
      },
      "link": {
        "@rel": "abstract",
        "@href": "https://api.elsevier.com/content/abstract/scopus_id/85047821291"
      }
    }
  }
}