{
  "metadata": {
    "title": "Dehydration of fructose into 5-hydroxymethylfurfural in a biphasic system using EDTA as a temperature-responsive catalyst",
    "authors": "; ; ",
    "journal": "Applied Catalysis A: General",
    "date": "2019-01-05",
    "doi": "10.1016/j.apcata.2018.10.023",
    "abstract": "",
    "uri": "https://api.elsevier.com/content/article/pii/S0926860X18305210",
    "pii": "S0926860X18305210"
  },
  "fulltext": {
    "full-text-retrieval-response": {
      "scopus-eid": "2-s2.0-85055777539",
      "originalText": "serial JL 271346 291210 291744 291809 31 Applied Catalysis A: General APPLIEDCATALYSISAGENERAL 2018-10-24 2018-10-24 2018-11-03 2018-11-03 2021-01-12T12:52:35 1-s2.0-S0926860X18305210 S0926-860X(18)30521-0 S0926860X18305210 10.1016/j.apcata.2018.10.023 S300 S300.2 FULL-TEXT 1-s2.0-S0926860X18X00180 2024-01-01T12:33:10.553292Z 0 0 20190105 2019 2018-10-24T15:19:31.327846Z absattachment articleinfo articletitlenorm authfirstinitialnorm authfirstsurnamenorm cid cids contenttype copyright crossmark dateloaded dateloadedtxt datesearch datesort dateupdated dco docsubtype doctype doi eid ewtransactionid hubeid indexeddate issn issnnorm itemstage itemtransactionid itemweight openaccess openarchive pg pgfirst pglast pii piinorm pubdatestart pubdatetxt pubyr sectiontitle sortorder srctitle srctitlenorm srctype ssids alllist content subj subheadings suppl tomb volfirst volissue volumelist webpdf webpdfpagecount yearnav figure table body mmlmath acknowledge affil articletitle auth authfirstini authfull authkeywords authlast grantnumber grantsponsor highlightsabst orcid primabst ref specialabst 0926-860X 0926860X true 569 569 C Volume 569 13 93 100 93 100 20190105 5 January 2019 2019-01-05 2019 Regular Papers article fla © 2018 Elsevier B.V. All rights reserved. DEHYDRATIONFRUCTOSE5HYDROXYMETHYLFURFURALINABIPHASICSYSTEMUSINGEDTAATEMPERATURERESPONSIVECATALYST CAO Z 1 Introduction 2 Materials and methods 2.1 Materials 2.2 Synthesis of 5-HMF 2.3 Analytical techniques 3 Results and discussion 3.1 The pH of the reaction system 3.2 Dehydration of fructose in different solvent systems 3.3 Dehydration of fructose under different conditions 3.4 Catalyst recyclability 3.5 Carbon balance 3.6 Reaction mechanism 3.7 Dehydration of fructose using commercially available catalysts 4 Conclusions Acknowledgments References MILLER 2013 550 554 S DODDS 2007 1250 1251 D ROSTRUPNIELSEN 2005 1421 1422 J MCGLADE 2013 571 584 C LUTHI 2008 379 382 D VANPUTTEN 2013 1499 1597 R BOZELL 2010 539 554 J ROMANLESHKOV 2006 1933 1937 Y VIGIER 2012 285 289 K BICKER 2003 280 284 M ASGHARI 2006 2163 2173 F DE 2011 2859 2868 S BECKERLE 2012 158 164 K BINDER 2009 1979 1985 J HU 2008 1280 1283 S QI 2010 1071 1077 X TEONG 2014 2015 2026 S CHHEDA 2007 342 350 J CHOUDHARY 2013 3997 4006 V YANG 2012 302 306 Y ZHU 2011 2016 2018 H MONDAL 2015 3570 3578 S YANG 2011 4469 4471 F MCNEFF 2010 65 69 C OSATIASHTIANI 2014 333 342 A JAIN 2015 72 76 A ZHAO 2016 123 130 J YUE 2016 1 10 C NAKAJIMA 2011 4224 4227 K PENG 2015 3208 3212 Y ZHU 2016 1 9 L SADABA 2015 4133 4145 I HARA 2014 931 941 M KUSTER 1977 185 191 B LI 2009 1182 1187 Y HU 2009 873 877 S VANDAM 1986 95 101 H LANSALOTMATRAS 2003 517 520 C ILGEN 2009 1948 1954 F CHIDAMBARAM 2010 1253 1262 M KUSTER 1990 314 321 B MIRZAEI 2016 2282 2286 H TAKAGAKI 2009 6276 6278 A GURBUZ 2013 1270 1274 E XIE 2016 Y HANDBOOKCHEMICALPRODUCTS DESPAX 2014 5 9 S ZHANG 2016 874 887 J RIVALIER 1995 165 171 P DUTTA 2013 355 369 S ANTAL 1990 91 M NEWTH 1951 83 106 F JIMENEZMORALES 2014 22 28 I CAOX2019X93 CAOX2019X93X100 CAOX2019X93XZ CAOX2019X93X100XZ 2020-11-03T00:00:00.000Z 2020-11-03T00:00:00.000Z http://creativecommons.org/licenses/by-nc-nd/4.0/ © 2018 Elsevier B.V. All rights reserved. 2020-03-05T14:09:53.823Z http://vtw.elsevier.com/data/voc/AddOnTypes/50.7/nlp S0926860X18305210 Technology Support Program of Jiangsu Province Science and Technology Support Program of Jiangsu Province http://data.elsevier.com/vocabulary/SciValFunders/501100004610 http://sws.geonames.org/1814991/ CAST CAST China Academy of Space Technology http://data.elsevier.com/vocabulary/SciValFunders/501100010574 http://sws.geonames.org/1814991/ National Natural Science Foundation of China 21776132 NSFC National Natural Science Foundation of China http://data.elsevier.com/vocabulary/SciValFunders/501100001809 http://sws.geonames.org/1814991/ Changjiang Scholars and Innovative Research Teams in Universities IRT_14R28 21390204 This work was supported by the Program of the National Natural Science Foundation of China (Grant No.: 21776132 ), the Young Elite Scientist Sponsorship Program for the CAST , the Changjiang Scholars and Innovative Research Teams in Universities (Grant No.: IRT_14R28 ), the Major Research Plan of the National Natural Science Foundation of China (Grant No.: 21390204 ), the Technology Support Program of Jiangsu Province (Grant No. BE2014715 ), and the Jiangsu National Synergetic Innovation Center for Advanced Bio-Manufacture . item S0926-860X(18)30521-0 S0926860X18305210 1-s2.0-S0926860X18305210 10.1016/j.apcata.2018.10.023 271346 2024-01-01T12:33:10.553292Z 2019-01-05 1-s2.0-S0926860X18305210-main.pdf https://s3-eu-west-1.amazonaws.com/prod-ucs-content-store-eu-west/content/pii:S0926860X18305210/MAIN/application/pdf/8a3b78ee47e93e1e1675d1145d6ad0a8/main.pdf main.pdf pdf true 2024188 MAIN 8 1-s2.0-S0926860X18305210-main_1.png https://s3-eu-west-1.amazonaws.com/prod-ucs-content-store-eu-west/content/pii:S0926860X18305210/PREVIEW/image/png/3c9e13ae7c51814b507fa4d050e7bf34/main_1.png main_1.png png 57233 849 656 IMAGE-WEB-PDF 1 1-s2.0-S0926860X18305210-ga1.jpg https://s3-eu-west-1.amazonaws.com/prod-ucs-content-store-eu-west/content/pii:S0926860X18305210/ga1/DOWNSAMPLED/image/jpeg/0644de4f991699a2c83b64db707e4855/ga1.jpg ga1 true ga1.jpg jpg 31445 192 500 IMAGE-DOWNSAMPLED 1-s2.0-S0926860X18305210-gr1.jpg https://s3-eu-west-1.amazonaws.com/prod-ucs-content-store-eu-west/content/pii:S0926860X18305210/gr1/DOWNSAMPLED/image/jpeg/1f048ed7a0b87df22fefbddd1887dd33/gr1.jpg gr1 gr1.jpg jpg 43950 567 379 IMAGE-DOWNSAMPLED 1-s2.0-S0926860X18305210-gr10.jpg https://s3-eu-west-1.amazonaws.com/prod-ucs-content-store-eu-west/content/pii:S0926860X18305210/gr10/DOWNSAMPLED/image/jpeg/0bedfe82672cbec675eaa399895fd17f/gr10.jpg gr10 gr10.jpg jpg 49545 430 567 IMAGE-DOWNSAMPLED 1-s2.0-S0926860X18305210-gr11.jpg https://s3-eu-west-1.amazonaws.com/prod-ucs-content-store-eu-west/content/pii:S0926860X18305210/gr11/DOWNSAMPLED/image/jpeg/e5ae1590e00170da74cbd8c8a9dfd022/gr11.jpg gr11 gr11.jpg jpg 19464 230 486 IMAGE-DOWNSAMPLED 1-s2.0-S0926860X18305210-gr2.jpg https://s3-eu-west-1.amazonaws.com/prod-ucs-content-store-eu-west/content/pii:S0926860X18305210/gr2/DOWNSAMPLED/image/jpeg/94ee117337766107b940d4cb8897ed15/gr2.jpg gr2 gr2.jpg jpg 20356 199 565 IMAGE-DOWNSAMPLED 1-s2.0-S0926860X18305210-gr3.jpg https://s3-eu-west-1.amazonaws.com/prod-ucs-content-store-eu-west/content/pii:S0926860X18305210/gr3/DOWNSAMPLED/image/jpeg/b1185c2ec30dbed50ba97ad655e60475/gr3.jpg gr3 gr3.jpg jpg 26642 317 567 IMAGE-DOWNSAMPLED 1-s2.0-S0926860X18305210-gr4.jpg https://s3-eu-west-1.amazonaws.com/prod-ucs-content-store-eu-west/content/pii:S0926860X18305210/gr4/DOWNSAMPLED/image/jpeg/6ffb1e6e0db99bb0c04420734b09b951/gr4.jpg gr4 gr4.jpg jpg 25464 294 375 IMAGE-DOWNSAMPLED 1-s2.0-S0926860X18305210-gr5.jpg https://s3-eu-west-1.amazonaws.com/prod-ucs-content-store-eu-west/content/pii:S0926860X18305210/gr5/DOWNSAMPLED/image/jpeg/795caa579339ff9840b0125165fd9623/gr5.jpg gr5 gr5.jpg jpg 21737 287 372 IMAGE-DOWNSAMPLED 1-s2.0-S0926860X18305210-gr6.jpg https://s3-eu-west-1.amazonaws.com/prod-ucs-content-store-eu-west/content/pii:S0926860X18305210/gr6/DOWNSAMPLED/image/jpeg/40f9357851fee8ced4d276d399b77e36/gr6.jpg gr6 gr6.jpg jpg 29914 233 565 IMAGE-DOWNSAMPLED 1-s2.0-S0926860X18305210-gr7.jpg https://s3-eu-west-1.amazonaws.com/prod-ucs-content-store-eu-west/content/pii:S0926860X18305210/gr7/DOWNSAMPLED/image/jpeg/6318d508af7928f2db4548eee4bad373/gr7.jpg gr7 gr7.jpg jpg 45576 297 377 IMAGE-DOWNSAMPLED 1-s2.0-S0926860X18305210-gr8.jpg https://s3-eu-west-1.amazonaws.com/prod-ucs-content-store-eu-west/content/pii:S0926860X18305210/gr8/DOWNSAMPLED/image/jpeg/d579f4d6413febc19520188cb9bbaee2/gr8.jpg gr8 gr8.jpg jpg 19276 163 567 IMAGE-DOWNSAMPLED 1-s2.0-S0926860X18305210-gr9.jpg https://s3-eu-west-1.amazonaws.com/prod-ucs-content-store-eu-west/content/pii:S0926860X18305210/gr9/DOWNSAMPLED/image/jpeg/1ba6b374e533e3f590bfaf5ddb477297/gr9.jpg gr9 gr9.jpg jpg 32579 283 741 IMAGE-DOWNSAMPLED 1-s2.0-S0926860X18305210-ga1.sml https://s3-eu-west-1.amazonaws.com/prod-ucs-content-store-eu-west/content/pii:S0926860X18305210/ga1/THUMBNAIL/image/gif/fd073292cc66baa60761c46350f0c174/ga1.sml ga1 true ga1.sml sml 9625 84 219 IMAGE-THUMBNAIL 1-s2.0-S0926860X18305210-gr1.sml https://s3-eu-west-1.amazonaws.com/prod-ucs-content-store-eu-west/content/pii:S0926860X18305210/gr1/THUMBNAIL/image/gif/caf891a9eb479cbc28e24f6bb5948cc6/gr1.sml gr1 gr1.sml sml 15126 163 109 IMAGE-THUMBNAIL 1-s2.0-S0926860X18305210-gr10.sml https://s3-eu-west-1.amazonaws.com/prod-ucs-content-store-eu-west/content/pii:S0926860X18305210/gr10/THUMBNAIL/image/gif/56119727725193e8e6d09ac8a03b6f46/gr10.sml gr10 gr10.sml sml 13222 164 216 IMAGE-THUMBNAIL 1-s2.0-S0926860X18305210-gr11.sml https://s3-eu-west-1.amazonaws.com/prod-ucs-content-store-eu-west/content/pii:S0926860X18305210/gr11/THUMBNAIL/image/gif/613f6cf2d9eddfdac517bc10d285dffa/gr11.sml gr11 gr11.sml sml 4111 103 219 IMAGE-THUMBNAIL 1-s2.0-S0926860X18305210-gr2.sml https://s3-eu-west-1.amazonaws.com/prod-ucs-content-store-eu-west/content/pii:S0926860X18305210/gr2/THUMBNAIL/image/gif/199bbbed52afb5cc3066ecb3a08cffdc/gr2.sml gr2 gr2.sml sml 11245 77 219 IMAGE-THUMBNAIL 1-s2.0-S0926860X18305210-gr3.sml https://s3-eu-west-1.amazonaws.com/prod-ucs-content-store-eu-west/content/pii:S0926860X18305210/gr3/THUMBNAIL/image/gif/9647456f328b704c700a1792cd9241f2/gr3.sml gr3 gr3.sml sml 4944 122 219 IMAGE-THUMBNAIL 1-s2.0-S0926860X18305210-gr4.sml https://s3-eu-west-1.amazonaws.com/prod-ucs-content-store-eu-west/content/pii:S0926860X18305210/gr4/THUMBNAIL/image/gif/ab91149814761b2a16c02845f846538d/gr4.sml gr4 gr4.sml sml 7033 164 209 IMAGE-THUMBNAIL 1-s2.0-S0926860X18305210-gr5.sml https://s3-eu-west-1.amazonaws.com/prod-ucs-content-store-eu-west/content/pii:S0926860X18305210/gr5/THUMBNAIL/image/gif/5fb2713b63444f51355ffaddf8d302c2/gr5.sml gr5 gr5.sml sml 7154 164 212 IMAGE-THUMBNAIL 1-s2.0-S0926860X18305210-gr6.sml https://s3-eu-west-1.amazonaws.com/prod-ucs-content-store-eu-west/content/pii:S0926860X18305210/gr6/THUMBNAIL/image/gif/51b0b6861d6bad90b24469fc986d0607/gr6.sml gr6 gr6.sml sml 14754 90 219 IMAGE-THUMBNAIL 1-s2.0-S0926860X18305210-gr7.sml https://s3-eu-west-1.amazonaws.com/prod-ucs-content-store-eu-west/content/pii:S0926860X18305210/gr7/THUMBNAIL/image/gif/117dad76a29c551fcd40ef6825717c97/gr7.sml gr7 gr7.sml sml 14778 164 208 IMAGE-THUMBNAIL 1-s2.0-S0926860X18305210-gr8.sml https://s3-eu-west-1.amazonaws.com/prod-ucs-content-store-eu-west/content/pii:S0926860X18305210/gr8/THUMBNAIL/image/gif/d880065828b53e19a605673e987fe42b/gr8.sml gr8 gr8.sml sml 10227 63 219 IMAGE-THUMBNAIL 1-s2.0-S0926860X18305210-gr9.sml https://s3-eu-west-1.amazonaws.com/prod-ucs-content-store-eu-west/content/pii:S0926860X18305210/gr9/THUMBNAIL/image/gif/6934c55311d8065291aff127833d49e4/gr9.sml gr9 gr9.sml sml 5441 84 219 IMAGE-THUMBNAIL 1-s2.0-S0926860X18305210-ga1_lrg.jpg https://s3-eu-west-1.amazonaws.com/prod-ucs-content-store-eu-west/content/pii:S0926860X18305210/ga1/HIGHRES/image/jpeg/0ed2d4f30e44a13a427dde4033be7b91/ga1_lrg.jpg ga1 true ga1_lrg.jpg jpg 306919 848 2213 IMAGE-HIGH-RES 1-s2.0-S0926860X18305210-gr1_lrg.jpg https://s3-eu-west-1.amazonaws.com/prod-ucs-content-store-eu-west/content/pii:S0926860X18305210/gr1/HIGHRES/image/jpeg/90d184239236e1094c4c87f7488938b3/gr1_lrg.jpg gr1 gr1_lrg.jpg jpg 409630 2507 1677 IMAGE-HIGH-RES 1-s2.0-S0926860X18305210-gr10_lrg.jpg https://s3-eu-west-1.amazonaws.com/prod-ucs-content-store-eu-west/content/pii:S0926860X18305210/gr10/HIGHRES/image/jpeg/abed569d6c1f80db40b160df3678ea2f/gr10_lrg.jpg gr10 gr10_lrg.jpg jpg 464812 1903 2510 IMAGE-HIGH-RES 1-s2.0-S0926860X18305210-gr11_lrg.jpg https://s3-eu-west-1.amazonaws.com/prod-ucs-content-store-eu-west/content/pii:S0926860X18305210/gr11/HIGHRES/image/jpeg/4754b8c0fae7b3f1de6c43c604836d3c/gr11_lrg.jpg gr11 gr11_lrg.jpg jpg 156616 1017 2153 IMAGE-HIGH-RES 1-s2.0-S0926860X18305210-gr2_lrg.jpg https://s3-eu-west-1.amazonaws.com/prod-ucs-content-store-eu-west/content/pii:S0926860X18305210/gr2/HIGHRES/image/jpeg/ff1aede1dda17a68beba1d0b6bbc6bd8/gr2_lrg.jpg gr2 gr2_lrg.jpg jpg 226237 881 2500 IMAGE-HIGH-RES 1-s2.0-S0926860X18305210-gr3_lrg.jpg https://s3-eu-west-1.amazonaws.com/prod-ucs-content-store-eu-west/content/pii:S0926860X18305210/gr3/HIGHRES/image/jpeg/d9714a34bea5414ecca0f8ab75c13d6e/gr3_lrg.jpg gr3 gr3_lrg.jpg jpg 220968 1403 2510 IMAGE-HIGH-RES 1-s2.0-S0926860X18305210-gr4_lrg.jpg https://s3-eu-west-1.amazonaws.com/prod-ucs-content-store-eu-west/content/pii:S0926860X18305210/gr4/HIGHRES/image/jpeg/3497f138f645f28cc05f02db4a9e1e92/gr4_lrg.jpg gr4 gr4_lrg.jpg jpg 190991 1300 1660 IMAGE-HIGH-RES 1-s2.0-S0926860X18305210-gr5_lrg.jpg https://s3-eu-west-1.amazonaws.com/prod-ucs-content-store-eu-west/content/pii:S0926860X18305210/gr5/HIGHRES/image/jpeg/03d809ee047aa46f9d042f098d3c7c2a/gr5_lrg.jpg gr5 gr5_lrg.jpg jpg 246471 1272 1647 IMAGE-HIGH-RES 1-s2.0-S0926860X18305210-gr6_lrg.jpg https://s3-eu-west-1.amazonaws.com/prod-ucs-content-store-eu-west/content/pii:S0926860X18305210/gr6/HIGHRES/image/jpeg/dd979a79cca1c018dc1aa147a116c79c/gr6_lrg.jpg gr6 gr6_lrg.jpg jpg 413973 1029 2500 IMAGE-HIGH-RES 1-s2.0-S0926860X18305210-gr7_lrg.jpg https://s3-eu-west-1.amazonaws.com/prod-ucs-content-store-eu-west/content/pii:S0926860X18305210/gr7/HIGHRES/image/jpeg/c8b026413bcae5f3e8e52a77b4ebcd53/gr7_lrg.jpg gr7 gr7_lrg.jpg jpg 730225 1315 1669 IMAGE-HIGH-RES 1-s2.0-S0926860X18305210-gr8_lrg.jpg https://s3-eu-west-1.amazonaws.com/prod-ucs-content-store-eu-west/content/pii:S0926860X18305210/gr8/HIGHRES/image/jpeg/aa30dfc67e96858c227ad6ee7f5afbf5/gr8_lrg.jpg gr8 gr8_lrg.jpg jpg 262007 723 2510 IMAGE-HIGH-RES 1-s2.0-S0926860X18305210-gr9_lrg.jpg https://s3-eu-west-1.amazonaws.com/prod-ucs-content-store-eu-west/content/pii:S0926860X18305210/gr9/HIGHRES/image/jpeg/c17e1800b77de7cb95567d35c2de6523/gr9_lrg.jpg gr9 gr9_lrg.jpg jpg 286416 1254 3281 IMAGE-HIGH-RES 1-s2.0-S0926860X18305210-si1.gif https://s3-eu-west-1.amazonaws.com/prod-ucs-content-store-eu-west/content/pii:S0926860X18305210/STRIPIN/image/gif/3184b2a9effdbdea9635c125f82592a5/si1.gif si1 si1.gif gif 2082 47 610 ALTIMG 1-s2.0-S0926860X18305210-si2.gif https://s3-eu-west-1.amazonaws.com/prod-ucs-content-store-eu-west/content/pii:S0926860X18305210/STRIPIN/image/gif/3be8b0c5920d687d53d76316376e4151/si2.gif si2 si2.gif gif 1394 44 388 ALTIMG 1-s2.0-S0926860X18305210-am.pdf https://s3-eu-west-1.amazonaws.com/prod-ucs-content-store-eu-west/content/egi:10QTZNJ7TMN/MAIN/application/pdf/53450c767868436c217642db6576595c/am.pdf https://s3.amazonaws.com/prod-ucs-content-store-us-east/content/egi:10QTZNJ7TMN/MAIN/application/pdf/53450c767868436c217642db6576595c/am.pdf am am.pdf pdf false 5315835 AAM-PDF APCATA 16852 S0926-860X(18)30521-0 10.1016/j.apcata.2018.10.023 Elsevier B.V. Fig. 1 The pH of the EDTA and water mixture (10 mg in 1.0 ml water). a: at room temperature, b: at 120 °C, c: at 160 °C. Condition: EDTA (7.3 mg, 0.025 mmol), PVP (100.0 mg), water 1.0 ml; e, f, g (at room temperature, 120 °C, 160 °C, without EDTA). Fig. 1 Fig. 2 Color change of EDTA. (a) before reaction, (b) after reaction in the water system, (c) after reaction in the biphasic system (water:PVP/MIBK:2-But.). Fig. 2 Fig. 3 HPLC of the organic phase with the DMSO (a) or PVP (b) modified aqueous phase. Fig. 3 Fig. 4 Temperature and time effects on fructose dehydration. Reaction conditions: fructose (90.0 mg, 0.500 mmol), EDTA (7.3 mg, 0.025 mmol), PVP (100.0 mg), solvent 5.0 mL (water/MIBK/2-butanol = 1.0:2.8:1.2, v/v). Fig. 4 Fig. 5 Effects of catalyst loading on fructose dehydration. Reaction conditions: fructose (90.0 mg, 0.500 mmol), PVP (100.0 mg), solvent 5.0 mL (water/MIBK/2-But. = 1.0:2.8:1.2, v/v), reaction temperature 160 °C, reaction time 120 min. Fig. 5 Fig. 6 Temperature-dependent solubility of EDTA. (a) before the reaction (at room temperature), (b) after the reaction (at 160 °C), (c) after the reaction (at room temperature). Fig. 6 Fig. 7 Catalyst recyclability test. Reaction conditions: fructose (900.0 mg, 5.0 mmol), EDTA (73.0 mg, 0.25 mmol), PVP (1000.0 mg), solvent 50.0 mL (water/MIBK/2-But. = 1:2.8:1.2 v/v), reaction temperature 160 °C, reaction time 120 min. Fig. 7 Fig. 8 The color change of EDTA during the process of catalyst reuse. (a) before reaction, (b) after the first run, (c) after the fifth reused, (d) after recrystallization. Fig. 8 Fig. 9 Chemical structure analysis of EDTA. (a) FTIR, (b) TG. Fig. 9 Fig. 10 Carbon balance of fructose dehydration to HMF under EDTA catalysis. Fig. 10 Fig. 11 The reaction mechanism of fructose dehydration catalyzed by EDTA. Fig. 11 Table 1 Fructose-to-HMF transformation over the EDTA catalyst a . Table 1 Ent. Aqueous phase Organic phase Conv. (%) Yield Total b (%) Yield Org. c (%) Yield Aq. d (%) 1 e water 32 ± 2 3 ± 0.4 2 water 91 ± 3 32 ± 2 3 DMSO 55 ± 3 32 ± 2 4 DMF 2.4 ± 0.1 1.3 ± 0.1 5 DMA 1.6 ± 0.1 0.7 ± 0.1 6 γ-VAL 0.4 ± 0.1 0.2 ± 0.1 7 water n-butanol 83 ± 4 61 ± 3 49 ± 2 12 ± 1 8 water MIBK 98 ± 1 67 ± 2 54 ± 2 13 ± 1 9 water EtOAc 95 ± 5 62 ± 2 52 ± 2 9 ± 1 10 water MeTHF 92 ± 5 66 ± 2 57 ± 2 9 ± 1 11 water:DMSO (8:2, v/v) MIBK 92 ± 6 80 ± 2 60 ± 2 20 ± 1 12 water:PVP (40:1, m/m) MIBK 96 ± 2 70 ± 4 57 ± 2 13 ± 2 13 water:PVP (20:1, m/m) MIBK 96 ± 3 73 ± 2 59 ± 2 13 ± 1 14 water:PVP (10:1, m/m) MIBK 95 ± 5 78 ± 2 62 ± 1 16 ± 1 15 water:PVP (5:1, m/m) MIBK 84 ± 3 68 ± 2 55 ± 1 13 ± 1 16 water:PVP (10:1, m/m) MIBK:2-But. (9:1, v/v) 95 ± 4 80 ± 1 64 ± 1 16 ± 1 17 water:PVP (10:1, m/m) MIBK:2-But. (8:2, v/v) 93 ± 4 85 ± 2 69 ± 1 15 ± 1 18 water:PVP (10:1, m/m) MIBK:2-But. (7:3, v/v) 95 ± 3 89 ± 3 75 ± 2 14 ± 1 19 water:PVP (10:1, m/m) MIBK:2-But. (6:4, v/v) 93 ± 4 84 ± 2 68 ± 1 15 ± 1 20 water:PVP (10:1, m/m) MIBK:2-But. (5:5, v/v) 94 ± 4 80 ± 2 65 ± 1 15 ± 1 21 water:PVP (10:1, m/m) MIBK:2-But. (4:6, v/v) 94 ± 5 78 ± 1 62 ± 2 15 ± 1 a Reaction conditions: fructose 0.5 mmol, EDTA 0.025 mmol, solvent 5 mL (biphasic systems: aqueous phase 1 mL, organic phase 4 mL), temperature 160 °C, reaction time 120 min. b Total yield of HMF, Y Total(%)=Y Org.(%)+ Y Aq.(%). c Yield of HMF in the organic phase. d Yield of HMF in the aqueous phase. e Without EDTA. Table 2 Effect of fructose concentration on the yield of 5-HMF a . Table 2 Entry Fructose conc. b (mol/L) Conv. (%) YieldTotal(%) 1 0.25 96 ± 3 90 ± 2 2 0.50 95 ± 3 89 ± 3 3 1.00 86 ± 3 81 ± 2 4 1.50 81 ± 5 72 ± 4 a Reaction conditions: fructose and EDTA (20/1, mol/mol), PVP 0.1 g, solvent 5 mL (water/MIBK/2-But. = 1:2.8:1.2 v/v), temperature 160 °C, reaction time 120 min. b Molar concentration of fructose in the aqueous phase. Table 3 Fructose-to-HMF transformation over commercially available catalysts a . Table 3 Entry Catalyst Time (min) Conv. (%) YieldTotal (%) 1 EDTA 120 95 ± 3 89 ± 3 2 FA b 120 38 ± 3 17 ± 3 3 p-TsOH c 120 56 ± 2 31 ± 3 4 TFA d 120 67 ± 4 27 ± 3 5 CA e 120 91 ± 5 86 ± 4 6 HCl 120 99 ± 4 90 ± 3 7 H2SO4 120 99 ± 5 89 ± 4 8 f Amb-15 120 99 ± 4 91 ± 4 9 f Amb-15 g 120 81 ± 4 70 ± 4 a Reaction conditions: fructose 0.5 mmol, catalyst (homogeneous 5 mol%, heterogeneous 30 wt%), PVP 0.1 g, solvent 5 mL (water/MIBK/2-But. = 1:2.8:1.2 v/v), temperature 160 °C, reaction time 120 min. b formic acid. c p-toluenesulfonic acid. d trifluoroacetic acid. e citric acid. f 30 wt% of catalyst was used. g the catalyst after the first cycle was reused. Dehydration of fructose into 5-hydroxymethylfurfural in a biphasic system using EDTA as a temperature-responsive catalyst Zhi Cao a b Ming Li a b c Yong Chen a b c Tao Shen a b Chenglun Tang a b Chenjie Zhu a b c ⁎ Hanjie Ying a b c ⁎ a College of Biotechnology and Pharmaceutical Engineering, Nanjing Tech University, Nanjing, China College of Biotechnology and Pharmaceutical Engineering Nanjing Tech University Nanjing China b National Engineering Technique Research Center for Biotechnology, Nanjing, China National Engineering Technique Research Center for Biotechnology Nanjing China c Jiangsu National Synergetic Innovation Center for Advanced Bio-Manufacture, China Jiangsu National Synergetic Innovation Center for Advanced Bio-Manufacture China ⁎ Corresponding authors at: College of Biotechnology and Pharmaceutical Engineering, Nanjing Tech University, Nanjing, China. College of Biotechnology and Pharmaceutical Engineering Nanjing Tech University Nanjing China Graphical abstract The widely available reagent ethylenediaminetetraacetic acid (EDTA) was used as a temperature-responsive catalyst to produce 5-hydroxymethylfurfural (HMF) from fructose. Using this catalyst, a remarkable HMF yield of 89 ± 3% was achieved in a water-MIBK biphasic system containing polyvinylpyrrolidone (PVP) and 2-butanol. The pH of the reaction system based on EDTA as a catalyst was shown to be temperature-responsive. Moreover, the EDTA catalyst could be recycled simply by cooling the reaction liquid to room temperature due to its temperature-dependent solubility in water. A slight decrease in the yield of HMF (from 89 ± 3 to 81 ± 2%) was observed after EDTA repeated use for five cycles, and a yield of 88 ± 2% was achieved again after purification of the recycled EDTA via recrystallization with NaOH/HCl. The FTIR spectrum of recycled EDTA was almost the same as that of fresh catalyst, and TG analysis showed the decomposition temperature of EDTA is about 260 °C. Furthermore, a leaching test revealed that only 4.3 ± 0.2% of the initial EDTA was lost after five-time reuse. Keywords 5-Hydroxymethylfurfural Temperature-responsive Ethylenediaminetetraacetic acid (EDTA) Fructose dehydration Biphasic system 1 Introduction Fossil fuels such as petroleum, coal, and natural gas provide a majority of the world’s energy today. Especially petroleum is not only used for energy supply, but also for the production of carbon-based chemicals [1]. However, the ever-growing demand for energy resources, the decline of petroleum resources, and increasing CO2 emissions are increasing the interest in the biomass utilization [2–5]. The transformation of carbohydrates into platform chemicals for the production of valuable fine chemicals, biofuels, and biomaterials is an important part of biomass utilization and has drawn the attention of researchers all over the world [6]. Among the sugar-based platform chemicals, 5-hydroxymethylfurfural (HMF) is a versatile one, and had has been listed in the “Top10 + 4″ chemicals by the US Department of Energy (DOE) in 2004 [7]. In general, HMF can be easily produced by mineral acid-catalyzed dehydration of fructose in water, polar organic, ionic liquid, as well as in biphasic systems [6–10]. In water, the process of sugar-to-HMF conversion always has a lower selectivity due to the side reactions of HMF, such as rehydration to levulinic acid and polymerization to humins [6,11]. In polar organic and ionic liquids, the side reactions can be efficiently suppressed and a desirable HMF yield can be achieved [12–16]. Nevertheless, the energy-intensive separation of HMF from these solvents is an obstruction of their commercial application [17]. In comparison, biphasic systems have been extensively studied since the produced HMF can be continuously extracted from the aqueous phase to the organic phase, which prevents HMF from decomposition or polymerization [6,8,17,18]. Various homogeneous acids, such as HCl. H2SO4 [8], AlCl3 [12], and CrCl3 [19] have been used for the preparation of HMF in biphasic systems. Homogeneous acids show moderate catalytic ability in sugar dehydration to produce HMF. However, their innate drawbacks such as equipment corrosion, environmental pollution, and lower selectivity, hinder the industrial application of these catalysts [17,20,21]. Instead of homogeneous acids, solid acids can be easily separated and recovered from the reaction system [21]. They are also less corrosive and therefore highly recommended as catalysts for HMF production [22,23]. Different solid acids, such as TiO2 [24], sulfated ZrO2 [25], zirconium phosphate [26], sulfonated carbon [27], Nb-doped tungstate [28], niobic acid [29], and the MOF catalyst [30], have been evaluated for the preparation of HMF in biphasic systems. High selectivity can be obtained using these acids, but they generally show lower activity than their homogeneous counterparts because they have a lower degree of active site exposure to reactants. In addition, the active sites of solid acids are prone to be deactivated due to leaching or humin deposition [31–33]. The less corrosive organic acids, such as formic acid [34], acetic acid [35], oxalic acid and citric acid [36], as well as p-toluene sulfonic acid [37–39], and trifluoroacetic acid [40] have also been used as a catalyst to produce HMF. A medium yield of HMF (50∼67%) can be achieved over these organic acids. However, these homogeneous organic acids are difficult to recycle from the reaction liquid. Furthermore, they cannot be used in the biphasic systems due to their high solubility both in the aqueous and the organic phase. Herein, we explored a widely available organic acid, ethylenediaminetetraacetic acid (EDTA), as the catalyst to produce HMF from fructose. We selected EDTA due to its temperature-responsive solubility in water. EDTA is insoluble in water at room temperature and became soluble at high temperatures. It is also insoluble in common organic solvents such as DMSO, DMF, MIBK, and THF even at temperatures up to 180 °C. According to the temperature-response capacity and the selective solubility of EDTA, a novel biphasic catalytic system was designed. In this study, we first showed the temperature-responsive properties of EDTA and the change in solution pH during the reaction. Then, the effect of the reaction medium, phase modifiers, reaction temperature and time, as well as fructose content and catalyst dosage were investigated to optimize the process. Furthermore, we also explored the recyclability of the catalyst and developed an effective method to restore the recycled catalyst. Finally, the chemical structure and leaching of EDTA were investigated to verify the stability and recycling capacity of the catalyst. 2 Materials and methods 2.1 Materials Fructose, EDTA, polyvinylpyrrolidone (PVP), and methyl isobutyl ketone (MIBK) of analytical grade were purchased from Aladdin (Shanghai, China). HMF and fructose of chromatographic grade, used as standards for high-performance liquid chromatography (HPLC) analysis, were obtained from Sigma (Shanghai, China). Other chemicals were of analytical grade and were used without further puriﬁcation. 2.2 Synthesis of 5-HMF The catalytic experiments were carried out in a 15-mL ﬂasks incubated in an oil-bath. In a typical experimental run, fructose (90.0 mg, 0.500 mmol), EDTA (7.3 mg, 0.025 mmol), PVP (100.0 mg), H2O (1.0 mL), MIBK (2.8 mL), 2-butanol (1.2 mL) were loaded into the ﬂask. After being sealed, the flask was put into the oil bath preheated to 160 °C. After magnetic stirring at 1000 rpm for 120 min, the reaction mixture was cooled to room temperature and the organic layer was separated by extraction. The EDTA in the aqueous phase was recovered by filtration. 2.3 Analytical techniques Fructose and HMF in the aqueous or organic layer were determined by HPLC on an Agilent 1260 series instrument (Hewlett-Packard, USA) equipped with an RI 1260 refractive index detector and an Aminex HPX-87H® column (300 nm × 7.8 mm, catalog #125-0140; Bio-Rad, USA). The column was operated at 55 °C with 5 mM H2SO4 as the mobile phase at a flow rate of 0.6 mL/min. The fructose conversion (mol%) and HMF yield (mol%) were calculated as follows: Fructose conversion (mol%): (1) Conv ⋅ = ( 1 − moles of fructose residual in the water phase moles of fructose loaded in the reaction ) × 100 % HMF yield (mol%): (2) Yield = moles of HMF in product moles of fructose loaded in the reaction × 100 % The experimental results were analyzed using three parallel measurements. FTIR spectra (4000–500 cm−1) were recorded using KBr discs on a Nicolet IS5 IR spectrometer (Thermo-Fisher Scientific, USA). 3 Results and discussion 3.1 The pH of the reaction system In the process of fructose dehydration over acid catalysts, the pH significantly influences the HMF yield and fructose conversion [11]. As a temperature-responsive property (discussed in detail in 3.4, catalyst recyclability), the changes of the dissolution state of EDTA influence the pH of the reaction system. Thus, it is essential to inspect the aqueous phase pH of this catalytic system. Since it is difficult to determine the pH of the complex reaction system directly under reaction conditions, we used the pH of EDTA-water mixture measured using a pH indicator under a designated temperature as a proxy. As shown in Fig. 1 , the pH value of the EDTA-water mixture decreased with the temperature increases, however, no observable changes of solution pH were detected in the control experiment. Thus, the changes of solution pH could be attributed to the dissolution and dissociation of EDTA, which increases along with the rising temperature. At room temperature, the pH value of the mixture is 3.84–4.14 (based on calculations) and 4.1 (detected by pH meter), indicating the determination of the pH with pH strips is not a very reliable way of measurement since the chromatic aberration and non-temperature compensation of pH indicator. However, the pH value of EDTA-water mixture decreased with the temperature increases could be safely concluded. 3.2 Dehydration of fructose in different solvent systems Many studies concentrated on dehydrating sugars in water due to its green properties, low rice, and high sugar solubility [11]. Thus, we first tested the fructose-to-HMF conversion in water under the catalysis of EDTA. As shown in Table 1 , in a blank experiment of fructose dehydration (entry 1, without EDTA), only 3 ± 0.4% yield of HMF and 32 ± 2% conversion of fructose were achieved. After adding EDTA (entry 2), the fructose conversion increased to 91 ± 3%, showing that the reaction of fructose dehydration can be significantly promoted by EDTA. However, the yield of HMF was still low (32 ± 2%), even though 91 ± 3% of the fructose was converted. This phenomenon can be explained by the fact that HMF agglutinates or cross-polymerizes with reactive intermediates at high temperatures to form humins or other insoluble polymers, visible as a dark brown solid at the end of the reaction (Fig. 2 b). This phenomenon has been reported to cause a decrease in the HMF yield and selectivity [24,41]. Conducting fructose dehydration in organic solvents is an efficient way to decrease HMF decomposition/rehydration/condensation [6]. Hence, we performed the fructose dehydration reaction in dimethyl sulfoxide (DMSO), dimethylformamide (DMF), dimethylacetamide (DMA), and γ-valerolactone (γ-VAL) due to their known capacity to suppress undesirable side-reactions [42–44]. However, the yield of HMF in these systems was comparatively low due to lower fructose conversion (Table 1, entry 3–6). The low solubility of EDTA in these polar organic solvents even at increased temperatures up to 180 °C seems to be the main reason for the low catalytic activity of EDTA in these solvents. On the other hand, the lower dielectric constants of these polar organic solvents than that of water (36∼49 vs 81) [45], may be another reason for the lower fructose conversion. By contrast, 32 ± 2% HMF was produced with 55 ± 3% fructose converted when the fructose dehydration was performed in DMSO. Here, the course of the fructose-to-HMF conversion could be facilitated by the acidic species released by DMSO at high temperatures, as has been reported in previous studies [46,47]. Another approach to minimize HMF agglutination or degradation is to carry out the fructose dehydration in a water-organic biphasic system. As shown in Table 1 (entries 7–10), the HMF yield showed a significant increase when the reaction was carried out in biphasic systems because the produced HMF could continuously be extracted from the H2O phase into the organic phase, suppressing side reactions [48]. A higher HMF yield of 67 ± 2% with a fructose conversion of 98 ± 1% was achieved in the H2O/MIBK (1/4, v/v) system (Table 1 entry 8). However, the poor partitioning of HMF into the organic phase left a considerable amount of HMF in the aqueous phase, which further polymerized to form humins. Phase modification could be used to further suppress the side reactions. In this work, we used DMSO, PVP, and 2-butanol as phase modifiers, since their outstanding performance in improvement HMF synthesis had already been reported [8]. When DMSO and PVP were used as aqueous-phase modifiers to suppress undesired side-reactions, the HMF yield was obviously increased (entry 11–15). However, while DMSO can improve the solubility of HMF in the aqueous phase [8], it can also partition into the organic phase which is difficult to remove in the subsequent purification process (Fig. S3a). By comparison, PVP is more suitable for aqueous phase modification due to its insolubility in MIBK (Fig. 3 b). The conversion of fructose continuously decreased from 96 ± 2% to 84 ± 3%, along with the increase of the PVP to H2O ratio from 1:40 to 1:5 (w/w). By contrast, the yield of HMF showed an increasing trend along with the increase of the PVP to H2O ratio from 1:40 to 1:10 (w/w), while a decrease was observed with further increase of the ratio to 1:5 (w/w), and a 78 ± 2% yield of HMF was obtained when the ratio of PVP to H2O was 1:10 (entries 12–15). As shown in entries 16–21, the fructose conversion did not exhibit much variation in the system comprising water:PVP (10:1, w/w) with MIBK containing 10–60% 2-butanol (v/v) as the extracting solvent, and a maximum HMF yield of 89 ± 3% was obtained at a 2-butanol content of 30% (v/v) in MIBK. At a low 2-butanol content (≤30%, v/v), the HMF yield increased with the increase of 2-butanol, since it promoted the partition of HMF. A further increase of the 2-butanol content led to a decrease of the HMF yield, likely because 2-butanol entered into the aqueous phase at the higher conetnration and thus hindered HMF partition into the organic phase and promoted the side reactions. These results led us to the conclusion that the biphasic system comprising water:PVP (10/1, w/w)/MIBK:2-butanol (7/3, v/v) is favorable for the EDTA-catalyzed conversion of fructose to HMF. At the end of the reaction, the EDTA showed little change in color compared to the water system, which also supports the idea that the biphasic system helps to reduce the formation and accumulation of humins during the reactions (Fig. 2c). 3.3 Dehydration of fructose under different conditions The effect of temperature and time on the fructose conversion and HMF yield were studied first. Experiments were conducted in the temperature range of 120–180 °C at 20 °C intervals. As shown in Fig. 4 , the fructose conversion was only 15 ± 1% and 48 ± 2% after reaction at 120 °C and 140 °C for 240 min. By contrast, almost complete conversion of fructose (>99%) could be achieved within 150 min when the temperature was increased to 160 °C, and further elevating the reaction temperature to 180 °C obviously shortened the reaction time to 60 min, which indicated that high temperatures are favorable for fructose conversion under the catalysis of EDTA. A maximum HMF yield of 89 ± 3% was obtained at 160 °C for 120 min, and an evident decline was observed after prolonging the reaction time or elevating the reaction temperature. The lower yield of HMF at the high temperatures or long reaction times may be ascribed to the promotion of unfavorable reactions, such as condensation or cross-polymerizations of HMF with reactive intermediates leading to the formation of insoluble humins [39]. Thus, 160 °C and 120 min were regarded as the optimal reaction temperature and time, which were used for subsequent experiments. The effect of the substrate concentration on the fructose conversion and HMF yield was inspected after the optimal temperature and time were identified. As presented in Table 2 , the highest HMF yield of 90 ± 2% was achieved at 0.25 mol/L of fructose. Increasing the fructose concentration further led to a lower HMF yield and fructose conversion, indicating that the higher fructose concentration weakens the ability of EDTA to catalyze the reaction. This phenomenon can be explained by the di-fructose-di-anhydrides formed by fructose at high concentrations, which contain reactive hydroxyl groups, resulting in a higher rate of cross-polymerization with reactive intermediates and HMF [41]. Nevertheless, 0.50 mol/L fructose resulted in a similar HMF yield (89 ± 3% vs 90 ± 2%) and selectivity (HMF yield/fructose conversion, 94 ± 1% vs 94 ± 1%) to that of 0.25 mol/L fructose. From an industrial point of view, it is of interest to work at a relatively high fructose concentration to reduce the cost of HMF separation and increase the space-time yield of HMF. Hence, we concluded that the optimal fructose concentration in the aqueous phase for the subsequent experimental design was 0.50 mol/L. The influence of the catalyst dosage on the fructose conversion and HMF yield was inspected by running the fructose dehydration reaction with different amounts of EDTA. As shown in Fig. 5 , the fructose conversion and HMF yield are obviously dependent on the catalyst dosage. Without EDTA addition, an HMF yield of 16 ± 1% and the fructose conversion of 42 ± 2% were achieved, showing the poor efficiency of fructose-to-HMF conversion under only thermal treatment in this biphasic system. By contrast, 50 ± 2% HMF was produced with 68 ± 3% fructose converted after 2 mol% EDTA was added. When the EDTA dosage was increased to 5 mol%, a sharp increase of the HMF yield (89 ± 3%) was observed, and the fructose conversion also significantly increased from 68 ± 3 to 95 ± 3%. A further increase of the EDTA dosage only resulted in a negligible increase of the HMF yield and fructose conversion. Thus, 5 mol% of EDTA was an efficient catalyst loading for the conversion of fructose into HMF. 3.4 Catalyst recyclability The catalytic stability over reuse cycles is a key factor in the practical application of catalysts. Since EDTA is insoluble in water at room temperature (Figs. 6 a and c) and becomes soluble at the reaction temperature (Fig. 6b), it is easy to recycle the EDTA catalyst due to its temperature-responsive properties. After each cycle, EDTA was recovered through filtration after cooling the reaction mixture to room temperature, washed with water and dried at 60 °C for 8 h, then used for the next run. As shown in Fig. 7 , the catalytic activity of the EDTA resulted in >90% fructose conversion and remained fairly constant even after reuse for five times, nevertheless, the yield of HMF suffered a slight decrease (from 89 ± 3–81 ± 2%). We assumed that the decline of EDTA catalytic performance can be attributed to the accumulation of humins. To verify this hypothesis, the recovered EDTA was dissolved in 20 ml of a 5 mM NaOH solution after the fifth run. The humins were removed by filtration and the EDTA catalyst subsequently recrystallized by adjusting the pH to 5∼6 with HCl (0.1 M). The recrystallized EDTA was reused after removal of excess HCl by washing with deionized water and kept at 60 °C overnight for drying. As shown in Fig. 7, the HMF yield was restored to 88 ± 2% after purification of the EDTA catalyst by recrystallization. The color change of the fresh, recycled (after the first run and fifth rounds of reuse), and recrystallized EDTA catalysts (Fig. 8 ) is also a strong indicator that the accumulation of humins is the main reason for the decline of HMF yield with repeated recycling. The chemical structure of the fresh and spent EDTA catalyst was also investigated by IR characterization. As shown in Fig. 9 a, the recycled EDTA (after purification) showed almost the same spectrum as the fresh sample, suggesting that EDTA still kept the original chemical structure even after five and ten rounds of recycling. In addition, the temperature of EDTA decomposition under air and N2 are about 260 °C (at 10 °C/min, Fig. 9b), suggesting that EDTA is rather stable under the reaction conditions. The high chemical stability of EDTA is the main reason for its exceptional reusability. The leached amount of EDTA was determined by weighing the recycled EDTA (after recrystallization), which showed that only 4.3 ± 0.2% of the initial amount was leached after five reaction cycles, indicating that the EDTA catalyst can be efficiently recycled. The excellent reusability can be attributed, on the other hand, to the temperature-responsive properties of the material. 3.5 Carbon balance A scheme of the carbon balance under the optimal reaction conditions is shown in Fig. 10 . In the reaction setup, 9.0 g of fructose (300 mmol C) was dehydrated using 0.73 g EDTA and 10.0 g PVP in the biphasic solvent system comprising H2O/MIBK/2-butanol (500 ml, water/MIBK/2-But. = 1:2.8:1.2, v/v). After the reaction, the organic- and aqueous phases were separated, after which the EDTA catalyst in the aqueous phase was recovered through filtration, and the MIBK and 2-butanol were recovered from the organic phase under a vacuum. The crude product containing HMF was recrystallized in water. After filtering out the water-insoluble matter using a 0.22-mm filter, the primary refined HMF product was recovered by freeze drying. As shown in Fig. 5, 4.67 g of refined HMF (222.38 mmol C) and 0.92 g of HMF oligomers (11.15 mmol C) were obtained from the organic phase. In the aqueous phase, 0.56 g unreacted fructose (18.67 mmol C) and 0.90 g HMF (42.86 mmol C) were detected. In the recycled EDTA, 0.06 g of humins (2.91 mmol C, based on the carbon content in the HMF oligomer) was identified. Thus, 297.97 mmol C was recovered and identified, and we attributed the rest of the carbon (2.03 mmol) to the unidentified matter in the aqueous phase. The total HMF yield was about 88 mol%, which was 20∼35% higher compared to the reported HMF yields obtained using conventional organic acids [34–40]. 3.6 Reaction mechanism Two general mechanistic pathways are recognized in sugar dehydration-the acyclic and cyclic routes [6,49]. Here, the dehydration of fructose to HMF is considered to proceed via cyclic pathways, since EDTA showed an extremely weak catalytic activity on glucose (HMF yield < 5%). Based on our results and previous reports, a plausible reaction mechanism of fructose dehydration under EDTA catalysis was proposed as depicted in Fig. 11 . At high temperatures, EDTA dissolves into the water and the hydrogen ions (H+), which are believed to be responsible for the dehydration of fructose, dissociate. Under the catalysis by the hydrogen ions (H+), the dehydration is started by withdrawing a water molecule from the hemiacetal at C2 of d-fructofuranose to form 2,5-anhydro-d-mannose [50]. Subsequently, two consecutive β-dehydrations in the ring result in HMF [51]. The rehydration of HMF to levulinic acid is a constant side-reaction in the process of sugar-to-HMF conversion [6,8,12]. However, levulinic acid was not detected in our catalytic system. Previous studies reported that the formation of levulinic acid requires highly acidic conditions [15,52], which suggests that EDTA, a medium acid, is not strong enough to rehydrate HMF. 3.7 Dehydration of fructose using commercially available catalysts Several other commercially available compounds were also used as the catalysts to dehydrate fructose in this biphasic system. As shown in Table 3 , the homogeneous organic acids produced a lower yield of HMF even if the higher conversion of fructose was observed (entries, 2–4). The reason for the low HMF yield under these organic acid catalysts could be attributed to their high solubility in the organic phase, which prevented them from contacting the fructose and degraded the produced HMF. HMF yields of 86 ± 4, 90 ± 3, and 89 ± 4% are achieved under the catalysis of CA, HCl, and H2SO4. However, it is difficult to recycle these catalysts because they are homogeneous. A higher HMF yield of 91 ± 4% was achieved over Amb-15, which is a widely used solid acid (entry 8). However, it suffers from higher catalyst loading and lower reusability (entry 9). Considering the catalytic and recoverable efficiency, it can be concluded that EDTA is an efficient commercially available catalyst for the production HMF from fructose. 4 Conclusions In summary, a novel catalytic system based on a widely available tetravalent organic acid EDTA was developed for the conversion of fructose to HMF. An optimal HMF yield of 89 ± 3% was achieved over EDTA in the biphasic system comprising H2O:PVP/MIBK:2-But (1.0 g:0.1 g/2.8 mL:1.2 mL). Interestingly, the EDTA catalyst showed temperature-responsive properties and could be easily recycled by cooling the reaction mixture to room temperature. The HMF yield dropped to 81 ± 2% from 89 ± 3% after being reused for five times. The catalytic ability of EDTA could be renewed after removing humins by purification by purification in NaOH/HCl, implying that the loss of activity was mainly due to the accumulation of humins. FTIR spectra of fresh and recycled EDTA (purified with NaOH/HCl) shown that the EDTA catalyst indeed maintained its chemical structure under the reaction conditions. Moreover, only 4.3 ± 0.2% of initial EDTA was leached after five rounds of recycling, which showed the high recycling capacity of this catalyst. Considering all these aspects, it can be concluded that EDTA is an efficient organic acid catalyst for the conversion of fructose to HMF and has great potential for practical applications. Acknowledgments This work was supported by the Program of the National Natural Science Foundation of China (Grant No.: 21776132), the Young Elite Scientist Sponsorship Program for the CAST, the Changjiang Scholars and Innovative Research Teams in Universities (Grant No.: IRT_14R28), the Major Research Plan of the National Natural Science Foundation of China (Grant No.: 21390204), the Technology Support Program of Jiangsu Province (Grant No. BE2014715), and the Jiangsu National Synergetic Innovation Center for Advanced Bio-Manufacture. References [1] S.A. Miller ACS Macro Lett. 2 2013 550 554 [2] D.R. Dodds R.A. Gross Science 318 2007 1250 1251 [3] J.R. Rostrup-Nielsen Science 38 2005 1421 1422 [4] C. McGlade J. Speirs S. Sorrel Energy 55 2013 571 584 [5] D. Lüthi M.L. Floch B. Bereiter T. Blunier J.-M. Barnola U. Siegenthaler D. Raynaud J. Jouzel H. Fischer K. Kawamura T.F. Stocker Nature 453 2008 379 382 [6] R.-J. Van Putten J.C. Van der Waal E.D. Jong C.B. Rasrendra H.J. Heeres J.G. De Vries Chem. Rev. 113 2013 1499 1597 [7] J.J. Bozell G.R. Petersen Green Chem. 12 2010 539 554 [8] Y. Roman-Leshkov J.N. Chheda J.A. Dumesic Science 312 2006 1933 1937 [9] K.D.O. Vigier A. Benguerba J. Barrault F. Jerome Green Chem. 14 2012 285 289 [10] M. Bicker J. Hirth H. Vogel Green Chem. 5 2003 280 284 [11] F.S. Asghari H. Yoshida Ind. Eng. Chem. Res. 45 2006 2163 2173 [12] S. De S. Dutta B. Saha Green Chem. 13 2011 2859 2868 [13] K. Beckerle J. Okuda J. Mol. Catal. A Chem. 356 2012 158 164 [14] J.B. Binder R.T. Raines J. Am. Chem. Soc. 131 2009 1979 1985 [15] S. Hu Z. Zhang Y. Zhou B. Han H. Fan W. Li J. Song Y. Xie Green Chem. 10 2008 1280 1283 [16] X. Qi M. Watanabe T.M. Aida R.L. Smith ChemSusChem 3 2010 1071 1077 [17] S.P. Teong G. Yi Y. Zhang Green Chem. 16 2014 2015 2026 [18] J.N. Chheda Y. Roman-Leshkov J.A. Dumesic Green Chem. 9 2007 342 350 [19] V. Choudhary S.H. Mushrif C. Ho A. Anderko V. Nikolakis N.S. Marinkovic A.L. Frenkel S.I. Sandler D.G. Vlachos J. Am. Chem. Soc. 135 2013 3997 4006 [20] Y. Yang X. Xiang D. Tong C. Hu M.M. Abu-Omar Bioresour. Technol. 116 2012 302 306 [21] H. Zhu Q. Cao C. Li X. Mu Carbohyd. Res. 346 2011 2016 2018 [22] S. Mondal J. Mondal A. Bhaumik ChemCatChem 7 2015 3570 3578 [23] F. Yang Q. Liu M. Yue X. Bai Y. Du Chem. Commun. (Camb.) 47 2011 4469 4471 [24] C.V. McNeff D.T. Nowlan L.C. McNeff B. Yan R.L. Fedie Appl. Catal. A Gen. 384 2010 65 69 [25] A. Osatiashtiani A.F. Lee D.R. Brown J.A. Melero G. Morales K. Wilson Catal. Sci. Technol. 4 2014 333 342 [26] A. Jain A.M. Shore S.C. Jonnalagadda K.V. Ramanujachary A. Mugweru Appl. Catal. A Gen. 489 2015 72 76 [27] J. Zhao C. Zhou C. He Y. Dai X. Jia Y. Yang Catal. Today 264 2016 123 130 [28] C. Yue G. Li E.A. Pidko J.J. Wiesfeld M. Rigutto E.J.M. Hensen ChemSusChem 9 2016 1 10 [29] K. Nakajima Y. Baba R. Noma M. Kitano J.N. Kondo S. Hayashi M. Hara J. Am. Chem. Soc. 133 2011 4224 4227 [30] Y. Peng Z. Hu Y. Gao D. Yuan Z. Kang Y. Qian N. Yan D. Zhao ChemSusChem 8 2015 3208 3212 [31] L. Zhu J. Dai M. Liu D. Tang S. Liu C. Hu ChemSusChem 9 2016 1 9 [32] I. Sádaba M.L. Granados A. Riisager E. Taarning Green Chem. 17 2015 4133 4145 [33] M. Hara Bull. Chem. Soc. Jpn. 87 2014 931 941 [34] B.F.M. Kuster H.M.G. Temmink Carbohyd. Res. 54 1977 185 191 [35] Y. Li X. Lu L. Yuan X. Liu Biomass Bioenergy 33 2009 1182 1187 [36] S. Hu Z. Zhang Y. Zhou J. Song H. Fan B. Han Green Chem. 11 2009 873 877 [37] H.E. van Dam A.P.G. Kieboom H. van Bekkum StarchStaerke 38 1986 95 101 [38] C. Lansalot-Matras C. Moreau Catal. Commun. 4 2003 517 520 [39] F. Ilgen D. Ott D. Kralisch C. Reil A. Palmberger B. Konig Green Chem. 11 2009 1948 1954 [40] M. Chidambaram A.T. Bell Green Chem. 12 2010 1253 1262 [41] B.F.M. Kuster StarchStaerke 42 1990 314 321 [42] H.M. Mirzaei B. Karimi Green Chem. 18 2016 2282 2286 [43] A. Takagaki M. Ohara S. Nishimura K. Ebitani Chem. Commun. (Camb.) 41 2009 6276 6278 [44] E.I. Gürbüz J.M.R. Gallo D.M. Alonso S.G. Wettstein W.Y. Lim J.A. Dumesic Angew. Chem. Int. Ed. 52 2013 1270 1274 [45] Y. Xie Y. Yang Z. Xi X. Gao Hand Book of Chemical Products sixth ed. 2016 Chemical Industry Bei Jing [46] S. Despax C. Maurer B. Estrine J.L. Bras N. Hoffmann S. Marinkovic J. Muzart Catal. Commun. 51 2014 5 9 [47] J. Zhang A. Das R.S. Assary L.A. Curtiss E. Weitz Appl. Catal. B 181 2016 874 887 [48] P. Rivalier J. Duhamet C. Moreau R. Durand Catal. Today 24 1995 165 171 [49] S. Dutta S. De B. Saha Biomass Bioenergy 55 2013 355 369 [50] M.J. Antal W.S.L. Mok G.N. Richards Carbohydr. Res. 199 1990 91 [51] F.H. Newth Adv. Carbohydr. Chem. 6 1951 83 106 [52] I. Jiménez-Morales A. Teckchandani-Ortiz J. Santamaría-González P. Maireles-Torre A. Jiménez-López Appl. Catal. B: Environ. 144 2014 22 28",
      "scopus-id": "85055777539",
      "coredata": {
        "eid": "1-s2.0-S0926860X18305210",
        "dc:description": "The widely available reagent ethylenediaminetetraacetic acid (EDTA) was used as a temperature-responsive catalyst to produce 5-hydroxymethylfurfural (HMF) from fructose. Using this catalyst, a remarkable HMF yield of 89 ± 3% was achieved in a water-MIBK biphasic system containing polyvinylpyrrolidone (PVP) and 2-butanol. The pH of the reaction system based on EDTA as a catalyst was shown to be temperature-responsive. Moreover, the EDTA catalyst could be recycled simply by cooling the reaction liquid to room temperature due to its temperature-dependent solubility in water. A slight decrease in the yield of HMF (from 89 ± 3 to 81 ± 2%) was observed after EDTA repeated use for five cycles, and a yield of 88 ± 2% was achieved again after purification of the recycled EDTA via recrystallization with NaOH/HCl. The FTIR spectrum of recycled EDTA was almost the same as that of fresh catalyst, and TG analysis showed the decomposition temperature of EDTA is about 260 °C. Furthermore, a leaching test revealed that only 4.3 ± 0.2% of the initial EDTA was lost after five-time reuse.",
        "openArchiveArticle": "false",
        "prism:coverDate": "2019-01-05",
        "openaccessUserLicense": null,
        "prism:aggregationType": "Journal",
        "prism:url": "https://api.elsevier.com/content/article/pii/S0926860X18305210",
        "dc:creator": [
          {
            "@_fa": "true",
            "$": "Cao, Zhi"
          },
          {
            "@_fa": "true",
            "$": "Li, Ming"
          },
          {
            "@_fa": "true",
            "$": "Chen, Yong"
          },
          {
            "@_fa": "true",
            "$": "Shen, Tao"
          },
          {
            "@_fa": "true",
            "$": "Tang, Chenglun"
          },
          {
            "@_fa": "true",
            "$": "Zhu, Chenjie"
          },
          {
            "@_fa": "true",
            "$": "Ying, Hanjie"
          }
        ],
        "link": [
          {
            "@_fa": "true",
            "@rel": "self",
            "@href": "https://api.elsevier.com/content/article/pii/S0926860X18305210"
          },
          {
            "@_fa": "true",
            "@rel": "scidir",
            "@href": "https://www.sciencedirect.com/science/article/pii/S0926860X18305210"
          }
        ],
        "dc:format": "application/json",
        "openaccessType": null,
        "pii": "S0926-860X(18)30521-0",
        "prism:volume": "569",
        "prism:publisher": "Elsevier B.V.",
        "dc:title": "Dehydration of fructose into 5-hydroxymethylfurfural in a biphasic system using EDTA as a temperature-responsive catalyst",
        "prism:copyright": "© 2018 Elsevier B.V. All rights reserved.",
        "openaccess": "0",
        "prism:issn": "0926860X",
        "dcterms:subject": [
          {
            "@_fa": "true",
            "$": "5-Hydroxymethylfurfural"
          },
          {
            "@_fa": "true",
            "$": "Temperature-responsive"
          },
          {
            "@_fa": "true",
            "$": "Ethylenediaminetetraacetic acid (EDTA)"
          },
          {
            "@_fa": "true",
            "$": "Fructose dehydration"
          },
          {
            "@_fa": "true",
            "$": "Biphasic system"
          }
        ],
        "openaccessArticle": "false",
        "prism:publicationName": "Applied Catalysis A: General",
        "openaccessSponsorType": null,
        "prism:pageRange": "93-100",
        "prism:endingPage": "100",
        "pubType": "fla",
        "prism:coverDisplayDate": "5 January 2019",
        "prism:doi": "10.1016/j.apcata.2018.10.023",
        "prism:startingPage": "93",
        "dc:identifier": "doi:10.1016/j.apcata.2018.10.023",
        "openaccessSponsorName": null
      },
      "objects": {
        "object": [
          {
            "@category": "standard",
            "@height": "192",
            "@width": "500",
            "@_fa": "true",
            "$": "https://api.elsevier.com/content/object/eid/1-s2.0-S0926860X18305210-ga1.jpg?httpAccept=%2A%2F%2A",
            "@multimediatype": "JPEG image file",
            "@type": "IMAGE-DOWNSAMPLED",
            "@size": "31445",
            "@ref": "ga1",
            "@mimetype": "image/jpeg"
          },
          {
            "@category": "standard",
            "@height": "567",
            "@width": "379",
            "@_fa": "true",
            "$": "https://api.elsevier.com/content/object/eid/1-s2.0-S0926860X18305210-gr1.jpg?httpAccept=%2A%2F%2A",
            "@multimediatype": "JPEG image file",
            "@type": "IMAGE-DOWNSAMPLED",
            "@size": "43950",
            "@ref": "gr1",
            "@mimetype": "image/jpeg"
          },
          {
            "@category": "standard",
            "@height": "430",
            "@width": "567",
            "@_fa": "true",
            "$": "https://api.elsevier.com/content/object/eid/1-s2.0-S0926860X18305210-gr10.jpg?httpAccept=%2A%2F%2A",
            "@multimediatype": "JPEG image file",
            "@type": "IMAGE-DOWNSAMPLED",
            "@size": "49545",
            "@ref": "gr10",
            "@mimetype": "image/jpeg"
          },
          {
            "@category": "standard",
            "@height": "230",
            "@width": "486",
            "@_fa": "true",
            "$": "https://api.elsevier.com/content/object/eid/1-s2.0-S0926860X18305210-gr11.jpg?httpAccept=%2A%2F%2A",
            "@multimediatype": "JPEG image file",
            "@type": "IMAGE-DOWNSAMPLED",
            "@size": "19464",
            "@ref": "gr11",
            "@mimetype": "image/jpeg"
          },
          {
            "@category": "standard",
            "@height": "199",
            "@width": "565",
            "@_fa": "true",
            "$": "https://api.elsevier.com/content/object/eid/1-s2.0-S0926860X18305210-gr2.jpg?httpAccept=%2A%2F%2A",
            "@multimediatype": "JPEG image file",
            "@type": "IMAGE-DOWNSAMPLED",
            "@size": "20356",
            "@ref": "gr2",
            "@mimetype": "image/jpeg"
          },
          {
            "@category": "standard",
            "@height": "317",
            "@width": "567",
            "@_fa": "true",
            "$": "https://api.elsevier.com/content/object/eid/1-s2.0-S0926860X18305210-gr3.jpg?httpAccept=%2A%2F%2A",
            "@multimediatype": "JPEG image file",
            "@type": "IMAGE-DOWNSAMPLED",
            "@size": "26642",
            "@ref": "gr3",
            "@mimetype": "image/jpeg"
          },
          {
            "@category": "standard",
            "@height": "294",
            "@width": "375",
            "@_fa": "true",
            "$": "https://api.elsevier.com/content/object/eid/1-s2.0-S0926860X18305210-gr4.jpg?httpAccept=%2A%2F%2A",
            "@multimediatype": "JPEG image file",
            "@type": "IMAGE-DOWNSAMPLED",
            "@size": "25464",
            "@ref": "gr4",
            "@mimetype": "image/jpeg"
          },
          {
            "@category": "standard",
            "@height": "287",
            "@width": "372",
            "@_fa": "true",
            "$": "https://api.elsevier.com/content/object/eid/1-s2.0-S0926860X18305210-gr5.jpg?httpAccept=%2A%2F%2A",
            "@multimediatype": "JPEG image file",
            "@type": "IMAGE-DOWNSAMPLED",
            "@size": "21737",
            "@ref": "gr5",
            "@mimetype": "image/jpeg"
          },
          {
            "@category": "standard",
            "@height": "233",
            "@width": "565",
            "@_fa": "true",
            "$": "https://api.elsevier.com/content/object/eid/1-s2.0-S0926860X18305210-gr6.jpg?httpAccept=%2A%2F%2A",
            "@multimediatype": "JPEG image file",
            "@type": "IMAGE-DOWNSAMPLED",
            "@size": "29914",
            "@ref": "gr6",
            "@mimetype": "image/jpeg"
          },
          {
            "@category": "standard",
            "@height": "297",
            "@width": "377",
            "@_fa": "true",
            "$": "https://api.elsevier.com/content/object/eid/1-s2.0-S0926860X18305210-gr7.jpg?httpAccept=%2A%2F%2A",
            "@multimediatype": "JPEG image file",
            "@type": "IMAGE-DOWNSAMPLED",
            "@size": "45576",
            "@ref": "gr7",
            "@mimetype": "image/jpeg"
          },
          {
            "@category": "standard",
            "@height": "163",
            "@width": "567",
            "@_fa": "true",
            "$": "https://api.elsevier.com/content/object/eid/1-s2.0-S0926860X18305210-gr8.jpg?httpAccept=%2A%2F%2A",
            "@multimediatype": "JPEG image file",
            "@type": "IMAGE-DOWNSAMPLED",
            "@size": "19276",
            "@ref": "gr8",
            "@mimetype": "image/jpeg"
          },
          {
            "@category": "standard",
            "@height": "283",
            "@width": "741",
            "@_fa": "true",
            "$": "https://api.elsevier.com/content/object/eid/1-s2.0-S0926860X18305210-gr9.jpg?httpAccept=%2A%2F%2A",
            "@multimediatype": "JPEG image file",
            "@type": "IMAGE-DOWNSAMPLED",
            "@size": "32579",
            "@ref": "gr9",
            "@mimetype": "image/jpeg"
          },
          {
            "@category": "thumbnail",
            "@height": "84",
            "@width": "219",
            "@_fa": "true",
            "$": "https://api.elsevier.com/content/object/eid/1-s2.0-S0926860X18305210-ga1.sml?httpAccept=%2A%2F%2A",
            "@multimediatype": "GIF image file",
            "@type": "IMAGE-THUMBNAIL",
            "@size": "9625",
            "@ref": "ga1",
            "@mimetype": "image/gif"
          },
          {
            "@category": "thumbnail",
            "@height": "163",
            "@width": "109",
            "@_fa": "true",
            "$": "https://api.elsevier.com/content/object/eid/1-s2.0-S0926860X18305210-gr1.sml?httpAccept=%2A%2F%2A",
            "@multimediatype": "GIF image file",
            "@type": "IMAGE-THUMBNAIL",
            "@size": "15126",
            "@ref": "gr1",
            "@mimetype": "image/gif"
          },
          {
            "@category": "thumbnail",
            "@height": "164",
            "@width": "216",
            "@_fa": "true",
            "$": "https://api.elsevier.com/content/object/eid/1-s2.0-S0926860X18305210-gr10.sml?httpAccept=%2A%2F%2A",
            "@multimediatype": "GIF image file",
            "@type": "IMAGE-THUMBNAIL",
            "@size": "13222",
            "@ref": "gr10",
            "@mimetype": "image/gif"
          },
          {
            "@category": "thumbnail",
            "@height": "103",
            "@width": "219",
            "@_fa": "true",
            "$": "https://api.elsevier.com/content/object/eid/1-s2.0-S0926860X18305210-gr11.sml?httpAccept=%2A%2F%2A",
            "@multimediatype": "GIF image file",
            "@type": "IMAGE-THUMBNAIL",
            "@size": "4111",
            "@ref": "gr11",
            "@mimetype": "image/gif"
          },
          {
            "@category": "thumbnail",
            "@height": "77",
            "@width": "219",
            "@_fa": "true",
            "$": "https://api.elsevier.com/content/object/eid/1-s2.0-S0926860X18305210-gr2.sml?httpAccept=%2A%2F%2A",
            "@multimediatype": "GIF image file",
            "@type": "IMAGE-THUMBNAIL",
            "@size": "11245",
            "@ref": "gr2",
            "@mimetype": "image/gif"
          },
          {
            "@category": "thumbnail",
            "@height": "122",
            "@width": "219",
            "@_fa": "true",
            "$": "https://api.elsevier.com/content/object/eid/1-s2.0-S0926860X18305210-gr3.sml?httpAccept=%2A%2F%2A",
            "@multimediatype": "GIF image file",
            "@type": "IMAGE-THUMBNAIL",
            "@size": "4944",
            "@ref": "gr3",
            "@mimetype": "image/gif"
          },
          {
            "@category": "thumbnail",
            "@height": "164",
            "@width": "209",
            "@_fa": "true",
            "$": "https://api.elsevier.com/content/object/eid/1-s2.0-S0926860X18305210-gr4.sml?httpAccept=%2A%2F%2A",
            "@multimediatype": "GIF image file",
            "@type": "IMAGE-THUMBNAIL",
            "@size": "7033",
            "@ref": "gr4",
            "@mimetype": "image/gif"
          },
          {
            "@category": "thumbnail",
            "@height": "164",
            "@width": "212",
            "@_fa": "true",
            "$": "https://api.elsevier.com/content/object/eid/1-s2.0-S0926860X18305210-gr5.sml?httpAccept=%2A%2F%2A",
            "@multimediatype": "GIF image file",
            "@type": "IMAGE-THUMBNAIL",
            "@size": "7154",
            "@ref": "gr5",
            "@mimetype": "image/gif"
          },
          {
            "@category": "thumbnail",
            "@height": "90",
            "@width": "219",
            "@_fa": "true",
            "$": "https://api.elsevier.com/content/object/eid/1-s2.0-S0926860X18305210-gr6.sml?httpAccept=%2A%2F%2A",
            "@multimediatype": "GIF image file",
            "@type": "IMAGE-THUMBNAIL",
            "@size": "14754",
            "@ref": "gr6",
            "@mimetype": "image/gif"
          },
          {
            "@category": "thumbnail",
            "@height": "164",
            "@width": "208",
            "@_fa": "true",
            "$": "https://api.elsevier.com/content/object/eid/1-s2.0-S0926860X18305210-gr7.sml?httpAccept=%2A%2F%2A",
            "@multimediatype": "GIF image file",
            "@type": "IMAGE-THUMBNAIL",
            "@size": "14778",
            "@ref": "gr7",
            "@mimetype": "image/gif"
          },
          {
            "@category": "thumbnail",
            "@height": "63",
            "@width": "219",
            "@_fa": "true",
            "$": "https://api.elsevier.com/content/object/eid/1-s2.0-S0926860X18305210-gr8.sml?httpAccept=%2A%2F%2A",
            "@multimediatype": "GIF image file",
            "@type": "IMAGE-THUMBNAIL",
            "@size": "10227",
            "@ref": "gr8",
            "@mimetype": "image/gif"
          },
          {
            "@category": "thumbnail",
            "@height": "84",
            "@width": "219",
            "@_fa": "true",
            "$": "https://api.elsevier.com/content/object/eid/1-s2.0-S0926860X18305210-gr9.sml?httpAccept=%2A%2F%2A",
            "@multimediatype": "GIF image file",
            "@type": "IMAGE-THUMBNAIL",
            "@size": "5441",
            "@ref": "gr9",
            "@mimetype": "image/gif"
          },
          {
            "@category": "high",
            "@height": "848",
            "@width": "2213",
            "@_fa": "true",
            "$": "https://api.elsevier.com/content/object/eid/1-s2.0-S0926860X18305210-ga1_lrg.jpg?httpAccept=%2A%2F%2A",
            "@multimediatype": "JPEG image file",
            "@type": "IMAGE-HIGH-RES",
            "@size": "306919",
            "@ref": "ga1",
            "@mimetype": "image/jpeg"
          },
          {
            "@category": "high",
            "@height": "2507",
            "@width": "1677",
            "@_fa": "true",
            "$": "https://api.elsevier.com/content/object/eid/1-s2.0-S0926860X18305210-gr1_lrg.jpg?httpAccept=%2A%2F%2A",
            "@multimediatype": "JPEG image file",
            "@type": "IMAGE-HIGH-RES",
            "@size": "409630",
            "@ref": "gr1",
            "@mimetype": "image/jpeg"
          },
          {
            "@category": "high",
            "@height": "1903",
            "@width": "2510",
            "@_fa": "true",
            "$": "https://api.elsevier.com/content/object/eid/1-s2.0-S0926860X18305210-gr10_lrg.jpg?httpAccept=%2A%2F%2A",
            "@multimediatype": "JPEG image file",
            "@type": "IMAGE-HIGH-RES",
            "@size": "464812",
            "@ref": "gr10",
            "@mimetype": "image/jpeg"
          },
          {
            "@category": "high",
            "@height": "1017",
            "@width": "2153",
            "@_fa": "true",
            "$": "https://api.elsevier.com/content/object/eid/1-s2.0-S0926860X18305210-gr11_lrg.jpg?httpAccept=%2A%2F%2A",
            "@multimediatype": "JPEG image file",
            "@type": "IMAGE-HIGH-RES",
            "@size": "156616",
            "@ref": "gr11",
            "@mimetype": "image/jpeg"
          },
          {
            "@category": "high",
            "@height": "881",
            "@width": "2500",
            "@_fa": "true",
            "$": "https://api.elsevier.com/content/object/eid/1-s2.0-S0926860X18305210-gr2_lrg.jpg?httpAccept=%2A%2F%2A",
            "@multimediatype": "JPEG image file",
            "@type": "IMAGE-HIGH-RES",
            "@size": "226237",
            "@ref": "gr2",
            "@mimetype": "image/jpeg"
          },
          {
            "@category": "high",
            "@height": "1403",
            "@width": "2510",
            "@_fa": "true",
            "$": "https://api.elsevier.com/content/object/eid/1-s2.0-S0926860X18305210-gr3_lrg.jpg?httpAccept=%2A%2F%2A",
            "@multimediatype": "JPEG image file",
            "@type": "IMAGE-HIGH-RES",
            "@size": "220968",
            "@ref": "gr3",
            "@mimetype": "image/jpeg"
          },
          {
            "@category": "high",
            "@height": "1300",
            "@width": "1660",
            "@_fa": "true",
            "$": "https://api.elsevier.com/content/object/eid/1-s2.0-S0926860X18305210-gr4_lrg.jpg?httpAccept=%2A%2F%2A",
            "@multimediatype": "JPEG image file",
            "@type": "IMAGE-HIGH-RES",
            "@size": "190991",
            "@ref": "gr4",
            "@mimetype": "image/jpeg"
          },
          {
            "@category": "high",
            "@height": "1272",
            "@width": "1647",
            "@_fa": "true",
            "$": "https://api.elsevier.com/content/object/eid/1-s2.0-S0926860X18305210-gr5_lrg.jpg?httpAccept=%2A%2F%2A",
            "@multimediatype": "JPEG image file",
            "@type": "IMAGE-HIGH-RES",
            "@size": "246471",
            "@ref": "gr5",
            "@mimetype": "image/jpeg"
          },
          {
            "@category": "high",
            "@height": "1029",
            "@width": "2500",
            "@_fa": "true",
            "$": "https://api.elsevier.com/content/object/eid/1-s2.0-S0926860X18305210-gr6_lrg.jpg?httpAccept=%2A%2F%2A",
            "@multimediatype": "JPEG image file",
            "@type": "IMAGE-HIGH-RES",
            "@size": "413973",
            "@ref": "gr6",
            "@mimetype": "image/jpeg"
          },
          {
            "@category": "high",
            "@height": "1315",
            "@width": "1669",
            "@_fa": "true",
            "$": "https://api.elsevier.com/content/object/eid/1-s2.0-S0926860X18305210-gr7_lrg.jpg?httpAccept=%2A%2F%2A",
            "@multimediatype": "JPEG image file",
            "@type": "IMAGE-HIGH-RES",
            "@size": "730225",
            "@ref": "gr7",
            "@mimetype": "image/jpeg"
          },
          {
            "@category": "high",
            "@height": "723",
            "@width": "2510",
            "@_fa": "true",
            "$": "https://api.elsevier.com/content/object/eid/1-s2.0-S0926860X18305210-gr8_lrg.jpg?httpAccept=%2A%2F%2A",
            "@multimediatype": "JPEG image file",
            "@type": "IMAGE-HIGH-RES",
            "@size": "262007",
            "@ref": "gr8",
            "@mimetype": "image/jpeg"
          },
          {
            "@category": "high",
            "@height": "1254",
            "@width": "3281",
            "@_fa": "true",
            "$": "https://api.elsevier.com/content/object/eid/1-s2.0-S0926860X18305210-gr9_lrg.jpg?httpAccept=%2A%2F%2A",
            "@multimediatype": "JPEG image file",
            "@type": "IMAGE-HIGH-RES",
            "@size": "286416",
            "@ref": "gr9",
            "@mimetype": "image/jpeg"
          },
          {
            "@category": "thumbnail",
            "@height": "47",
            "@width": "610",
            "@_fa": "true",
            "$": "https://api.elsevier.com/content/object/eid/1-s2.0-S0926860X18305210-si1.gif?httpAccept=%2A%2F%2A",
            "@multimediatype": "GIF image file",
            "@type": "ALTIMG",
            "@size": "2082",
            "@ref": "si1",
            "@mimetype": "image/gif"
          },
          {
            "@category": "thumbnail",
            "@height": "44",
            "@width": "388",
            "@_fa": "true",
            "$": "https://api.elsevier.com/content/object/eid/1-s2.0-S0926860X18305210-si2.gif?httpAccept=%2A%2F%2A",
            "@multimediatype": "GIF image file",
            "@type": "ALTIMG",
            "@size": "1394",
            "@ref": "si2",
            "@mimetype": "image/gif"
          },
          {
            "@category": "standard",
            "@_fa": "true",
            "$": "https://api.elsevier.com/content/object/eid/1-s2.0-S0926860X18305210-am.pdf?httpAccept=%2A%2F%2A",
            "@multimediatype": "Acrobat PDF file",
            "@type": "AAM-PDF",
            "@size": "5315835",
            "@ref": "am",
            "@mimetype": "application/pdf"
          }
        ]
      },
      "link": {
        "@rel": "abstract",
        "@href": "https://api.elsevier.com/content/abstract/scopus_id/85055777539"
      }
    }
  }
}