{
  "metadata": {
    "title": "Hydrous ruthenium oxide: A new generation remarkable catalyst precursor for energy efficient and sustainable production of γ-valerolactone from levulinic acid in aqueous medium",
    "authors": "; ",
    "journal": "Applied Catalysis A: General",
    "date": "2019-01-05",
    "doi": "10.1016/j.apcata.2018.10.018",
    "abstract": "",
    "uri": "https://api.elsevier.com/content/article/pii/S0926860X18305167",
    "pii": "S0926860X18305167"
  },
  "fulltext": {
    "full-text-retrieval-response": {
      "scopus-eid": "2-s2.0-85055867691",
      "originalText": "serial JL 271346 291210 291744 291809 31 Applied Catalysis A: General APPLIEDCATALYSISAGENERAL 2018-10-22 2018-10-22 2018-11-03 2018-11-03 2021-01-12T12:52:35 1-s2.0-S0926860X18305167 S0926-860X(18)30516-7 S0926860X18305167 10.1016/j.apcata.2018.10.018 S300 S300.2 FULL-TEXT 1-s2.0-S0926860X18X00180 2024-01-01T12:33:10.553292Z 0 0 20190105 2019 2018-10-22T15:11:12.402326Z absattachment articleinfo articletitlenorm authfirstinitialnorm authfirstsurnamenorm cid cids contenttype copyright crossmark dateloaded dateloadedtxt datesearch datesort dateupdated dco docsubtype doctype doi eid ewtransactionid hubeid indexeddate issn issnnorm itemstage itemtransactionid itemweight openaccess openarchive pg pgfirst pglast pii piinorm pubdatestart pubdatetxt pubyr sectiontitle sortorder srctitle srctitlenorm srctype ssids alllist content subj subheadings suppl tomb volfirst volissue volumelist webpdf webpdfpagecount yearnav figure table e-component body acknowledge affil appendices articletitle auth authfirstini authfull authkeywords authlast grantsponsor highlightsabst otherkwds primabst ref specialabst 0926-860X 0926860X true 569 569 C Volume 569 16 117 125 117 125 20190105 5 January 2019 2019-01-05 2019 Regular Papers article fla © 2018 Elsevier B.V. All rights reserved. HYDROUSRUTHENIUMOXIDEANEWGENERATIONREMARKABLECATALYSTPRECURSORFORENERGYEFFICIENTSUSTAINABLEPRODUCTIONVALEROLACTONELEVULINICACIDINAQUEOUSMEDIUM GUNDEKARI S 1 Introduction 2 Experimental section 2.1 Catalysts preparation 2.1.1 Preparation of HRO 2.1.2 Preparation of HRO-N 2.1.3 HRO-S 2.1.4 Preparation of HRO/H-β 2.1.5 Preparation of RuO2 2.2 Hydrogenation of levulinic acid 3 Results and discussion 3.1 Catalyst characterization 3.2 Catalytic activity 3.3 Mechanistic studies 3.4 In situ formation of Ru(0) from HRO during the reaction: characterization study 3.5 Recyclability of catalyst 3.6 Scale-up study 3.7 Continuous production of γ-VL 4 Conclusions Acknowledgements Appendix A Supplementary data References SLADE 2011 2645 2657 R VENNESTROM 2011 10502 10509 P HUBER 2006 4044 4098 G GALLEZOT 2012 1538 1558 P WERPY 2004 T TOPVALUEADDEDCHEMICALSBIOMASSVOLUMEIRESULTSSCREENINGFORPOTENTIALCANDIDATESSUGARSSYNTHESISGAS HOLLADAY 2007 J TOPVALUEADDEDCHEMICALSBIOMASSVOLUMEIIRESULTSSCREENINGFORPOTENTIALCANDIDATESBIOREFINERYLIGNIN PATEL 2006 M MEDIUMLONGTERMOPPORTUNITIESRISKSBIOTECHNOLOGYPRODUCTIONBULKCHEMICALSRENEWABLERESOURCESTHEPOTENTIALWHITEBIOTECHNOLOGYUTRECHTUNIVERSITYFRAUNHOFERINISTITUTESYSTEMINNOVATIONRESERACHUNIVERSIDADCOMPLUTENSEDEMADRIDPLANTINTERNATIONALABREWPROJECTREPORT TAYLOR 2015 R SUGARPLATFORMBIOFUELSBIOCHEMICALSE4TECHUKLTDCONSORZIOPERLARICERCAELADIMOSTRAZIONESULLEENERGIERINNOVABILIRECORDSTICHTINGDIENSTLANDBOUWKUNDIGONDERZOEKPARTWAGENINGENUNIVERSITYRESEARCHCENTREFINALREPORTFOREUROPEANCOMMISSIONDIRECTORATEGENERALENERGY LEE 2014 7887 7916 A CHHEDA 2007 7164 7183 J CORMA 2007 2411 2502 A VICTOR 2014 44706 44711 A LIN 2012 9773 9777 H GALLETTI 2012 1824 1835 A RACKEMANN 2011 198 214 D PATEL 2010 311 321 A GUO 2007 839 841 Y DU 2011 7815 7819 X LANGE 2007 3488 3490 J CLIMENT 2014 516 547 M AMARASEKARA 2011 2451 2457 A ALONSO 2013 584 595 D HORVATH 2008 238 242 I WRIGHT 2012 1657 1667 W LIGUORI 2015 1882 1894 F TANG 2014 608 620 X OSATIASHTIANI 2017 1125 1135 A GEILEN 2010 5510 5514 F LI 2012 2388 2390 W ORTIZCERVANTES 2015 1424 1431 C TUKACS 2012 2057 2065 J TUKACS 2014 2908 2912 J WETTSTEIN 2012 321 329 S BRADEN 2011 1755 1765 D FTOUNI 2017 2891 2896 J GALLETTI 2012 688 694 A ALSHAAL 2012 1260 1263 M PRIMO 2011 3613 3615 A RUPPERT 2015 1538 1547 A SUDHAKAR 2014 101 104 M YAO 2014 245 250 Y LUO 2013 175 186 W MORENOMARRODAN 2014 3434 3438 C SWARNAJAYA 2015 9044 9049 V CAO 2017 2201 2211 W FILIZ 2017 1744 1753 B ALBANI 2017 2361 2370 D SONG 2017 21 30 W ORTIZCERVANTES 2013 124 128 C YANG 2014 1 6 Y YANG 2014 1419 1425 Y WEI 2017 1720 1732 Z MICHEL 2014 12450 12453 C KOMANOYA 2011 188 194 T AKPA 2012 30 41 B KIM 1974 66 72 K LUXTON 2011 30 39 T ADEYEMO 2011 307 315 A SCHEIBA 2006 439 446 F MA 2010 34 44 J TAN 2015 7379 7384 J XIAO 2016 593 599 C GUNDEKARIX2019X117 GUNDEKARIX2019X117X125 GUNDEKARIX2019X117XS GUNDEKARIX2019X117X125XS 2020-11-03T00:00:00.000Z 2020-11-03T00:00:00.000Z http://creativecommons.org/licenses/by-nc-nd/4.0/ © 2018 Elsevier B.V. All rights reserved. 2020-11-18T19:48:21.796Z http://vtw.elsevier.com/data/voc/AddOnTypes/50.7/nlp S0926860X18305167 CSIR OLP-0031 CSC-0123 MLP-0028 CSIR Council of Scientific and Industrial Research, India http://data.elsevier.com/vocabulary/SciValFunders/501100001412 http://sws.geonames.org/1269750/ CSIR-CSMCRI Communication No. 082/2017. S.G. thanks CSIR, New Delhi, for a Senior Research Fellowship. The authors thank CSIR , New Delhi for financial support under the projects OLP-0031, MLP-0028 and CSC-0123. The authors thank Analytical Division & Centralized Instrumental Facilities of this institute for analytical support. The authors thank Dr. Joyee Mitra and Mr. Gajula Sampath for proof correction of the manuscript. item S0926-860X(18)30516-7 S0926860X18305167 1-s2.0-S0926860X18305167 10.1016/j.apcata.2018.10.018 271346 2024-01-01T12:33:10.553292Z 2019-01-05 1-s2.0-S0926860X18305167-main.pdf https://s3-eu-west-1.amazonaws.com/prod-ucs-content-store-eu-west/content/pii:S0926860X18305167/MAIN/application/pdf/c3c0abc34765a39e84fde6b5082f531c/main.pdf main.pdf pdf true 1611892 MAIN 9 1-s2.0-S0926860X18305167-main_1.png https://s3-eu-west-1.amazonaws.com/prod-ucs-content-store-eu-west/content/pii:S0926860X18305167/PREVIEW/image/png/d1103ba408585060c7df265112563cd6/main_1.png main_1.png png 53655 849 656 IMAGE-WEB-PDF 1 1-s2.0-S0926860X18305167-fx1.jpg https://s3-eu-west-1.amazonaws.com/prod-ucs-content-store-eu-west/content/pii:S0926860X18305167/fx1/DOWNSAMPLED/image/jpeg/25660d0d3d21c984f00c49b7787fea61/fx1.jpg fx1 fx1.jpg jpg 3964 49 274 IMAGE-DOWNSAMPLED 1-s2.0-S0926860X18305167-fx2.jpg https://s3-eu-west-1.amazonaws.com/prod-ucs-content-store-eu-west/content/pii:S0926860X18305167/fx2/DOWNSAMPLED/image/jpeg/8164f918db20e843bf3220d72e6a56c5/fx2.jpg fx2 fx2.jpg jpg 3725 47 271 IMAGE-DOWNSAMPLED 1-s2.0-S0926860X18305167-ga1.jpg https://s3-eu-west-1.amazonaws.com/prod-ucs-content-store-eu-west/content/pii:S0926860X18305167/ga1/DOWNSAMPLED/image/jpeg/2a444286d256aaf3e9c8ab9bd7524eb5/ga1.jpg ga1 true ga1.jpg jpg 22387 200 368 IMAGE-DOWNSAMPLED 1-s2.0-S0926860X18305167-gr1.jpg https://s3-eu-west-1.amazonaws.com/prod-ucs-content-store-eu-west/content/pii:S0926860X18305167/gr1/DOWNSAMPLED/image/jpeg/73cd4044acc3c7eb14bc0ddbdec2fc85/gr1.jpg gr1 gr1.jpg jpg 31964 353 509 IMAGE-DOWNSAMPLED 1-s2.0-S0926860X18305167-gr2.jpg https://s3-eu-west-1.amazonaws.com/prod-ucs-content-store-eu-west/content/pii:S0926860X18305167/gr2/DOWNSAMPLED/image/jpeg/7f424ffce7ff160ef7fc22d9b10fe670/gr2.jpg gr2 gr2.jpg jpg 43544 228 716 IMAGE-DOWNSAMPLED 1-s2.0-S0926860X18305167-gr3.jpg https://s3-eu-west-1.amazonaws.com/prod-ucs-content-store-eu-west/content/pii:S0926860X18305167/gr3/DOWNSAMPLED/image/jpeg/0261ed553877a4a7a617691da4f03739/gr3.jpg gr3 gr3.jpg jpg 80162 462 716 IMAGE-DOWNSAMPLED 1-s2.0-S0926860X18305167-gr4.jpg https://s3-eu-west-1.amazonaws.com/prod-ucs-content-store-eu-west/content/pii:S0926860X18305167/gr4/DOWNSAMPLED/image/jpeg/51b54906f2da4da110c66f101b50e3d6/gr4.jpg gr4 gr4.jpg jpg 18832 246 376 IMAGE-DOWNSAMPLED 1-s2.0-S0926860X18305167-gr5.jpg https://s3-eu-west-1.amazonaws.com/prod-ucs-content-store-eu-west/content/pii:S0926860X18305167/gr5/DOWNSAMPLED/image/jpeg/0de42f31e48a4555e687a521230ee36a/gr5.jpg gr5 gr5.jpg jpg 16660 228 377 IMAGE-DOWNSAMPLED 1-s2.0-S0926860X18305167-gr6.jpg https://s3-eu-west-1.amazonaws.com/prod-ucs-content-store-eu-west/content/pii:S0926860X18305167/gr6/DOWNSAMPLED/image/jpeg/1307f3b00412602086ed67e0113f5df4/gr6.jpg gr6 gr6.jpg jpg 18150 254 376 IMAGE-DOWNSAMPLED 1-s2.0-S0926860X18305167-gr7.jpg https://s3-eu-west-1.amazonaws.com/prod-ucs-content-store-eu-west/content/pii:S0926860X18305167/gr7/DOWNSAMPLED/image/jpeg/f1ea78fea10e8eb5ad824d6bedcb368a/gr7.jpg gr7 gr7.jpg jpg 31909 181 566 IMAGE-DOWNSAMPLED 1-s2.0-S0926860X18305167-gr8.jpg https://s3-eu-west-1.amazonaws.com/prod-ucs-content-store-eu-west/content/pii:S0926860X18305167/gr8/DOWNSAMPLED/image/jpeg/6f1c303ea74c937eb76f4c34d5fb3035/gr8.jpg gr8 gr8.jpg jpg 35260 293 698 IMAGE-DOWNSAMPLED 1-s2.0-S0926860X18305167-gr9.jpg https://s3-eu-west-1.amazonaws.com/prod-ucs-content-store-eu-west/content/pii:S0926860X18305167/gr9/DOWNSAMPLED/image/jpeg/29af5b2b3d6b2cd9f8c38b367457a79b/gr9.jpg gr9 gr9.jpg jpg 26579 274 471 IMAGE-DOWNSAMPLED 1-s2.0-S0926860X18305167-fx1.sml https://s3-eu-west-1.amazonaws.com/prod-ucs-content-store-eu-west/content/pii:S0926860X18305167/fx1/THUMBNAIL/image/gif/aa2cf635583fb2c87e53a9fa838871b6/fx1.sml fx1 fx1.sml sml 2390 39 219 IMAGE-THUMBNAIL 1-s2.0-S0926860X18305167-fx2.sml https://s3-eu-west-1.amazonaws.com/prod-ucs-content-store-eu-west/content/pii:S0926860X18305167/fx2/THUMBNAIL/image/gif/a0017005a4b728204206b7f33b7a9a38/fx2.sml fx2 fx2.sml sml 2343 38 219 IMAGE-THUMBNAIL 1-s2.0-S0926860X18305167-ga1.sml https://s3-eu-west-1.amazonaws.com/prod-ucs-content-store-eu-west/content/pii:S0926860X18305167/ga1/THUMBNAIL/image/gif/5c1a8fad1495b7965bc11fa47f9d60c1/ga1.sml ga1 true ga1.sml sml 9592 119 219 IMAGE-THUMBNAIL 1-s2.0-S0926860X18305167-gr1.sml https://s3-eu-west-1.amazonaws.com/prod-ucs-content-store-eu-west/content/pii:S0926860X18305167/gr1/THUMBNAIL/image/gif/5d17e22d8aceeae5f5d43975849f33bb/gr1.sml gr1 gr1.sml sml 5757 152 219 IMAGE-THUMBNAIL 1-s2.0-S0926860X18305167-gr2.sml https://s3-eu-west-1.amazonaws.com/prod-ucs-content-store-eu-west/content/pii:S0926860X18305167/gr2/THUMBNAIL/image/gif/7279043c38898878768e90809550a1c9/gr2.sml gr2 gr2.sml sml 4807 70 219 IMAGE-THUMBNAIL 1-s2.0-S0926860X18305167-gr3.sml https://s3-eu-west-1.amazonaws.com/prod-ucs-content-store-eu-west/content/pii:S0926860X18305167/gr3/THUMBNAIL/image/gif/894af83bcb6dde118b4670e3cbe3e1d1/gr3.sml gr3 gr3.sml sml 9435 141 219 IMAGE-THUMBNAIL 1-s2.0-S0926860X18305167-gr4.sml https://s3-eu-west-1.amazonaws.com/prod-ucs-content-store-eu-west/content/pii:S0926860X18305167/gr4/THUMBNAIL/image/gif/a320ed2bdc83b364b7eb317d251ab69b/gr4.sml gr4 gr4.sml sml 5867 143 219 IMAGE-THUMBNAIL 1-s2.0-S0926860X18305167-gr5.sml https://s3-eu-west-1.amazonaws.com/prod-ucs-content-store-eu-west/content/pii:S0926860X18305167/gr5/THUMBNAIL/image/gif/e441ec9ffbd1f2c90819c7c8b29903ca/gr5.sml gr5 gr5.sml sml 5136 133 219 IMAGE-THUMBNAIL 1-s2.0-S0926860X18305167-gr6.sml https://s3-eu-west-1.amazonaws.com/prod-ucs-content-store-eu-west/content/pii:S0926860X18305167/gr6/THUMBNAIL/image/gif/84d159c683c5a14ff7013fbefce17d62/gr6.sml gr6 gr6.sml sml 5760 148 219 IMAGE-THUMBNAIL 1-s2.0-S0926860X18305167-gr7.sml https://s3-eu-west-1.amazonaws.com/prod-ucs-content-store-eu-west/content/pii:S0926860X18305167/gr7/THUMBNAIL/image/gif/1e46f00c48dc3c694263ba442610d381/gr7.sml gr7 gr7.sml sml 10835 70 219 IMAGE-THUMBNAIL 1-s2.0-S0926860X18305167-gr8.sml https://s3-eu-west-1.amazonaws.com/prod-ucs-content-store-eu-west/content/pii:S0926860X18305167/gr8/THUMBNAIL/image/gif/b2cf3c400f702fa88da4b5bd14e29e6c/gr8.sml gr8 gr8.sml sml 5832 92 219 IMAGE-THUMBNAIL 1-s2.0-S0926860X18305167-gr9.sml https://s3-eu-west-1.amazonaws.com/prod-ucs-content-store-eu-west/content/pii:S0926860X18305167/gr9/THUMBNAIL/image/gif/b7149d73222ff0e7cc69000d360522eb/gr9.sml gr9 gr9.sml sml 5801 127 219 IMAGE-THUMBNAIL 1-s2.0-S0926860X18305167-fx1_lrg.jpg https://s3-eu-west-1.amazonaws.com/prod-ucs-content-store-eu-west/content/pii:S0926860X18305167/fx1/HIGHRES/image/jpeg/4d45269ba03172744ad5baf5afe19794/fx1_lrg.jpg fx1 fx1_lrg.jpg jpg 25386 215 1214 IMAGE-HIGH-RES 1-s2.0-S0926860X18305167-fx2_lrg.jpg https://s3-eu-west-1.amazonaws.com/prod-ucs-content-store-eu-west/content/pii:S0926860X18305167/fx2/HIGHRES/image/jpeg/68c205fce2b4db74f38276802c005ab7/fx2_lrg.jpg fx2 fx2_lrg.jpg jpg 25512 208 1200 IMAGE-HIGH-RES 1-s2.0-S0926860X18305167-ga1_lrg.jpg https://s3-eu-west-1.amazonaws.com/prod-ucs-content-store-eu-west/content/pii:S0926860X18305167/ga1/HIGHRES/image/jpeg/548bca262581a4930c7392fe67ebd861/ga1_lrg.jpg ga1 true ga1_lrg.jpg jpg 160483 886 1630 IMAGE-HIGH-RES 1-s2.0-S0926860X18305167-gr1_lrg.jpg https://s3-eu-west-1.amazonaws.com/prod-ucs-content-store-eu-west/content/pii:S0926860X18305167/gr1/HIGHRES/image/jpeg/10bc5493120ff24e79d8bf0b54ee40ee/gr1_lrg.jpg gr1 gr1_lrg.jpg jpg 253251 1563 2255 IMAGE-HIGH-RES 1-s2.0-S0926860X18305167-gr2_lrg.jpg https://s3-eu-west-1.amazonaws.com/prod-ucs-content-store-eu-west/content/pii:S0926860X18305167/gr2/HIGHRES/image/jpeg/e33ca40f063b05a9839ed5ad36da229a/gr2_lrg.jpg gr2 gr2_lrg.jpg jpg 336248 1009 3169 IMAGE-HIGH-RES 1-s2.0-S0926860X18305167-gr3_lrg.jpg https://s3-eu-west-1.amazonaws.com/prod-ucs-content-store-eu-west/content/pii:S0926860X18305167/gr3/HIGHRES/image/jpeg/cf1e59e5d2e4da37ac63c72631fa7c95/gr3_lrg.jpg gr3 gr3_lrg.jpg jpg 623749 2044 3170 IMAGE-HIGH-RES 1-s2.0-S0926860X18305167-gr4_lrg.jpg https://s3-eu-west-1.amazonaws.com/prod-ucs-content-store-eu-west/content/pii:S0926860X18305167/gr4/HIGHRES/image/jpeg/938355882c865554f9ae44ecc029bc28/gr4_lrg.jpg gr4 gr4_lrg.jpg jpg 154964 1090 1668 IMAGE-HIGH-RES 1-s2.0-S0926860X18305167-gr5_lrg.jpg https://s3-eu-west-1.amazonaws.com/prod-ucs-content-store-eu-west/content/pii:S0926860X18305167/gr5/HIGHRES/image/jpeg/b5623e8f386fdae4e61faeae2652b912/gr5_lrg.jpg gr5 gr5_lrg.jpg jpg 127148 1012 1670 IMAGE-HIGH-RES 1-s2.0-S0926860X18305167-gr6_lrg.jpg https://s3-eu-west-1.amazonaws.com/prod-ucs-content-store-eu-west/content/pii:S0926860X18305167/gr6/HIGHRES/image/jpeg/de62da92691e902ec62e8c279d01ce89/gr6_lrg.jpg gr6 gr6_lrg.jpg jpg 149995 1125 1668 IMAGE-HIGH-RES 1-s2.0-S0926860X18305167-gr7_lrg.jpg https://s3-eu-west-1.amazonaws.com/prod-ucs-content-store-eu-west/content/pii:S0926860X18305167/gr7/HIGHRES/image/jpeg/0fb20c0716eb390b9137f5c82e365525/gr7_lrg.jpg gr7 gr7_lrg.jpg jpg 349582 801 2507 IMAGE-HIGH-RES 1-s2.0-S0926860X18305167-gr8_lrg.jpg https://s3-eu-west-1.amazonaws.com/prod-ucs-content-store-eu-west/content/pii:S0926860X18305167/gr8/HIGHRES/image/jpeg/62f5ae255a469ceea6ff2586bd99c8de/gr8_lrg.jpg gr8 gr8_lrg.jpg jpg 270897 1295 3090 IMAGE-HIGH-RES 1-s2.0-S0926860X18305167-gr9_lrg.jpg https://s3-eu-west-1.amazonaws.com/prod-ucs-content-store-eu-west/content/pii:S0926860X18305167/gr9/HIGHRES/image/jpeg/5b07e60576ffff583a1837ee4d3fb6e9/gr9_lrg.jpg gr9 gr9_lrg.jpg jpg 203605 1213 2086 IMAGE-HIGH-RES 1-s2.0-S0926860X18305167-mmc1.docx https://s3-eu-west-1.amazonaws.com/prod-ucs-content-store-eu-west/content/pii:S0926860X18305167/mmc1/MAIN/application/vnd.openxmlformats-officedocument.wordprocessingml.document/64fbfc74197687dd6c0985b830c67c06/mmc1.docx mmc1 mmc1.docx docx 1192664 APPLICATION 1-s2.0-S0926860X18305167-am.pdf https://s3-eu-west-1.amazonaws.com/prod-ucs-content-store-eu-west/content/egi:10M0LVF0ZTK/MAIN/application/pdf/4c3af0a6a9eef4f67c20dd8dfccafd29/am.pdf https://s3.amazonaws.com/prod-ucs-content-store-us-east/content/egi:10M0LVF0ZTK/MAIN/application/pdf/4c3af0a6a9eef4f67c20dd8dfccafd29/am.pdf https://ucs.elsevier.com/asset/1b6b914d-13f6-4cb7-860a-b3e6e55ee8ee am am.pdf pdf false 4251693 AAM-PDF APCATA 16847 S0926-860X(18)30516-7 10.1016/j.apcata.2018.10.018 Elsevier B.V. Fig. 1 Proposed reaction mechanism for LA to γ-VL conversion using Ru-HRO catalyst. Fig. 1 Fig. 2 PXRD of materials (A) HRO, HRO-N, HRO-S and RuO2; (B) HRO, H-β, HRO/H-β, Ru-HRO@H-β, and Ru-HRO@H-β-5, Reaction conditions for Ru-HRO@H-β and Ru-HRO@H-β-5 mentioned in Fig. S7 A in the ESI. Fig. 2 Fig. 3 PXRD of materials (A) HRO and Ru-HRO; (B) Ru-HRO with reaction cycles, Reaction conditions: LA (1 g (8.62 mmol)), solvent (40 ml), 100 mg of HRO, 100 °C, 10 bar H2 for 10 min.; (C) Reduction of HRO to Ru(0) in different solvents, Reaction conditions: LA (8.62 mmol), solvent (40 ml), 100 °C, 10 bar H2, 15 min. Fig. 3 Fig. 4 FT-IR Spectra of HRO, Ru-HRO-2 and RuO2. Fig. 4 Fig. 5 TGA profile for HRO, Ru-HRO-2 and RuO2. Fig. 5 Fig. 6 TPR profile of HRO, Ru-HRO-2, and RuO2. Fig. 6 Fig. 7 TEM images of materials (A) HRO (B) Ru-HRO and (C) HRO/H-β. Fig. 7 Fig. 8 XPS of materials (A) HRO and (B) Ru-HRO-2. Fig. 8 Fig. 9 Time-on-Stream studies of continuous production of LA to γ-VL using HRO/H-β catalyst precursor. Fig. 9 Table 1 LA to γ-VL using HRO and HRO/H-β catalyst precursors. Table 1 Entry Material used Material amount (mg) Wt% of Ru w.r.t LA T (°C) H2 pressure (bar) Reaction time Conversion of LA (%) Yield of γ-VL (%) 1 Blank – – 120 20 1 h 0 0 2 HRO 10 0.5 120 20 1 h 100 100 3 HRO 5.0 0.25 120 20 1 h 100 99 4 HRO 2.5 0.125 120 20 1 h 76 76 5 HRO 3.5 0.175 120 20 1 h 100 100 6 HRO 3.5 0.175 120 10 1 h 100 99 7 HRO 3.5 0.175 120 0 1 h 0 0 8 HRO 3.5 0.175 120 5 1 h 100 100 9 HRO 3.5 0.175 100 5 1 h 100 100 10 HRO 3.5 0.175 50 5 1 h 100 100 11 HRO 3.5 0.175 50 5 30 m 85 84 12 HRO 3.5 0.175 50 10 30 m 100 100 13 HRO/H-β 100 0.32 50 10 30 m 100 100 14 HRO/H-β 50 0.16 50 10 30 m 100 100 15 HRO/H-β 35 0.11 50 10 30 m 94 94 16 HRO/H-β 50 0.16 100 10 7 m 100 100 17 HRO/H-β 50 0.16 100 5 7 m 100 100 18 HRO/H-β 50 0.16 150 5 3.5 m 100 100 19 HRO/H-β 50 0.16 200 5 1.5 m 100 100 20 HRO 3.5 0.175 100 10 10 m 100 100 21 HRO-N 3.5 0.175 100 10 10 m 100 100 22 HRO-S 3.5 0.175 100 10 10 m 100 100 Reaction conditions: LA (1 g, 8.62 mmol), H2O (40 ml). Conversion of LA and yield of γ-VL determined by UHPLC. HRO/H-β (3.2 wt% of Ru). Table 2 Comparison of catalytic activities of Ru-HRO@H-β with other previously reported catalysts for LA to γ-VL conversion. Table 2 Entry Material used Ru (wt%) w.r.t LA T (°C) H2 pressure (bar) Reaction time Conversion of LA (%) Yield of γ-VL (%) av Productivity of γ-VL (molγ-VL gRu −1 h−1) 1 a 2% Ru/RGO 0.06 30 40 5 h 100 99.9 290.2 2 a Ru/GO 0.06 40 40 2 h 0 0 0 3 a 2% Ru/FLG 0.06 20 40 8 h 99.3 98.3 176.2 4 b 5% Ru/C 0.25 25 12 50 h 100 97.5 6.9 5 HRO/H-β 0.32 30 40 6 h 70 70 31.7 6 c Ru/H-β 0.32 30 40 6 h 29 29 13.1 7 d 5% Ru/C 0.32 30 40 6 h 33 33 14.9 8 d 5% Ru/Al2O3 0.32 30 40 6 h 24 24 10.8 Reaction conditions: LA (1 g, 8.62 mmol), H2O (40 ml). a LA in aqueous medium [61 and 62]. b Neat LA [37]. c Externally reduced catalyst from HRO/H-β at 400 °C for 4 h under H2 flow. d Procured catalysts. Table 3 Mechanistic control experiments. Table 3 Entry Substrate Solvent Material used Sel. (%) of reaction intermediates Conversion of LA/ML (%) Selectivity of γ-VL (%) γ-HP M γ-HP AL 1 LA H2O RuO2 – – – 0 0 2 LA H2O HRO – – – 100 100 3 LA CH3-OH HRO – – – 5 100 4 LA THF HRO – – – 2 100 5 ML H2O HRO – 48 – 66 52 6 a LA H2O HRO – – – 0 0 Reaction conditions: LA/ML (8.62 mmol), solvent (40 ml), 5 mg of material, 100 °C, 10 bar H2 for 15 min. Conversion of LA/ML and selectivity of products/intermediates determined by GC–MS. ML: Methyl levulinate. γ-HP: γ-hydroxypentanoic acid. M γ-HP: Methyl γ-hydroxypentaote. AL: Angilica lactone. a Reaction conducted in the absence of hydrogen. Table 4 Textural properties of materials. Table 4 Material BET Surface area (m²/g) Pore volume (cm³/g) Pore size (nm) HRO 85 0.1 6.6 Ru-HRO 59 0.1 5.4 H-β 500 0.3 5.0 HRO/H-β 397 0.3 5.4 Ru-HRO@H-β 361 0.3 5.4 Hydrous ruthenium oxide: A new generation remarkable catalyst precursor for energy efficient and sustainable production of γ-valerolactone from levulinic acid in aqueous medium Sreedhar Gundekari a b Kannan Srinivasan a b ⁎ a Inorganic Materials and Catalysis Division, CSIR-Central Salt and Marine Chemicals Research Institute, Council of Scientific and Industrial Research (CSIR), GB Marg, Bhavnagar, 364 002, India Inorganic Materials and Catalysis Division CSIR-Central Salt and Marine Chemicals Research Institute Council of Scientific and Industrial Research (CSIR) GB Marg Bhavnagar 364 002 India b Academy of Scientific and Innovative Research, CSIR-Central Salt and Marine Chemicals Research Institute, GB Marg, Bhavnagar, 364 002, India Academy of Scientific and Innovative Research CSIR-Central Salt and Marine Chemicals Research Institute GB Marg Bhavnagar 364 002 India ⁎ Corresponding author at: Inorganic Materials and Catalysis Division, CSIR-Central Salt and Marine Chemicals Research Institute, Council of Scientific and Industrial Research (CSIR), Bhavnagar, 364 002, India. Inorganic Materials and Catalysis Division CSIR-Central Salt and Marine Chemicals Research Institute Council of Scientific and Industrial Research (CSIR) Bhavnagar 364 002 India Graphical abstract A novel material, hydrous ruthenium oxide (HRO) as potential catalyst precursor, is reported for the selective hydrogenation of levulinic acid (LA) to γ-valerolactone (γ-VL) in high yields under the mildest conditions in an aqueous medium. Various characterization studies such as PXRD, FT-IR, TGA, SEM, TEM and XPS show that the active catalyst, referred here as Ru-HRO is generated in situ from HRO during the reaction. Such in situ generation of the active catalyst thus avoided prior reduction or pre-treatment which is often reported for Ru-based catalysts for this reaction. It is pertinent to mention that the activity of the in situ generated catalyst is higher than the ex situ reduced catalyst. The effect of H-β as support for HRO showed a pronounced influence on the active catalyst (Ru-HRO@H-β) by decreasing the Ru loading required (compared to ‘as such’ HRO) and rendered easier separation after the reaction. Interestingly, the HRO-derived catalyst works only under aqueous medium unlike in many organic solvents reported elsewhere. A reaction mechanism is proposed by using several controlled experiments which reveal hydrogenation of LA to γ-hydroxypentanoic acid (γ-HP) and followed by cyclisation (intramolecular esterification) to γ-VL with the removal of H2O. The catalyst showed similar activity upon recycling for up to five cycles and for the reaction scale (of LA) from 1 g to 200 g. Further, liquid phase continuous hydrogenation of LA to γ-VL is successfully demonstrated using in situ generated Ru-HRO@H-β (dual bed) in aqueous medium under optimized reaction condition (1.5 ml/min of aqueous LA feed flow (5 wt%), 100 °C, 10 bar H2 and 2 ml/min flow of H2 feed), that showed complete conversion of LA with 98–100% yield of γ-VL for 40 h time-on-stream. Simple preparation method, milder reaction conditions, high activity, recyclability, and ability to deploy under continuous conditions makes this catalytic process attractive for industrial production of γ-VL. Abbreviations LA levulinic acid γ-VL γ-valerolactone ML methyl levulinate γ-HP γ-hydroxypentanoic acid Mγ-HP methyl γ-hydroxypentaote AL angilica lactone HRO hydrous ruthenium oxide (prepared using CaCO3 as precipitating agent) HRO-N hydrous ruthenium oxide (prepared using NaOH as precipitating agent) HRO-S hydrous ruthenium oxide (Sigma-Aldrich) HRO/H-β HRO supported on H-β zeolite Ru-HRO in situ generated Ru along with HRO (After 1st cycle using HRO catalyst precursor) Ru-HRO-2 in situ generated Ru along with HRO (After 2nd cycle) Ru-HRO@H-β in situ generated Ru(0) with remained HRO supported on H-β zeolite Ru/H-β externally reduced (400 °C for 4 h under H2 flow) catalyst from HRO/H-β Keywords Levulinic acid γ-valerolactone Hydrous ruthenium oxide In situ catalyst External reduction 1 Introduction The ever-increasing energy demands and concerns due to constant depletion of fossil fuel reserves compel biomass as the most viable alternative source to cater the requirements of chemicals and fuels. The use of bio-based feedstock limits the greenhouse house gas (GHG) emissions and enhances the rural development when compared with fossil feedstock [1–4]. Several research groups worldwide are involved in the production of varieties of chemical building blocks from biomass for societal needs such as biodiesel, furans, carboxylic acids, polyols, aromatics and other organic components by thermochemical and bio/chemo-catalytic transformations [5–11]. Levulinic acid (LA), a keto carboxylic acid that can easily be obtained through acid hydrolysis of lignocellulosic biomass, is of utmost industrial importance owing to the facile transformation of its functional groups resulting in a gamut of value added products [12–21]. γ-valerolactone (γ-VL), an attractive platform chemical obtained by selective hydrogenation of LA, is used in the preparation of a variety of fuels, polymers and chemical intermediates and acts itself as a greener alternative solvent for various chemical transformations and is also reported as a good medium for the conversion of lignocellulose components (Figs. S1–S3 in the ESI) [22,23]. The research groups of Regina Palkovits, Pierluigi Barbaro, Shijie Liu, and Karen Wilson and others have contributed extensive reviews on heterogeneous as well as homogeneous catalytic processes for the conversion of LA to γ-VL using different hydrogenation sources such as molecular hydrogen, formic acid, alcohols etc. [24–27]. Molecular hydrogen is the most common and industrially suitable hydrogenating agent to convert LA to γ-VL. Complexes of Ru/Ir/Pd etc. are quite active for the mentioned conversion [28–32]; however, homogeneous catalytic systems suffer from an inherent problem of separation and disposal of the spent catalyst. Often the synthesis of such complexes requires expensive chemicals and multistep reaction protocols thus decreasing their suitability for industrial processes. A number of heterogeneous catalytic systems have been reported based on supported noble (Ru, Pd, Pt, Au) and non-noble (Ni, Cu, Co, Mo etc) metal based catalysts, each showing considerable activity towards LA to γ-VL conversion. Among them, Ru catalysts are widely reported showing better activity under comparatively milder reaction conditions. The prior art of this conversion using Ru-based catalysts are presented in Table S1A–C in the ESI. Considering Ru-based catalysts, the hydrogenation of LA to γ-VL was initially studied with 5% Ru/C and reported a maximum conversion of LA and yield of γ-VL in different solvent medium. To increase the stability of the catalyst in acidic medium (used in the production of levulinic acid from cellulose), bimetallic catalytic system was introduced by doping Ru/C with Sn and Re [33,34] These catalysts (RuSn/C and RuRe/C) showed good stability compared to conventional Ru/C. Furthermore, to improve the stability of Ru catalyst, ZrO2 as support in acidic dioxane medium was studied which avoided the deactivation/leaching issues when compared with carbon supported Ru catalyst [35]. Enhancement in the rate of reaction was observed while using Amberlyst-70 as a co-catalyst to Ru/C. Using this bi-catalytic system in aqueous medium, γ-VL was obtained in 99% yield at 70 °C, 5 bar H2 in 3 h. The authors concluded that presence of acid co-catalyst facilitates reaction via two mechanistic pathways, and thus enabling under milder reaction conditions [36]. In an endeavour to develop an efficient process for this conversion, various research groups have reported Ru catalysts on different kinds of supports including acidic, basic as well as neutral supports (e.g., carbon, Al2O3, SiO2, ZrO2@C, TiO2, hydroxyapatite, polyethersulfone, H-β, Dowex resin, TiSi2O6 and Mg-LaO) in literature [37–48]. The Ru nanoparticles derived from [Ru3(CO)12] showed 100% yield of γ-VL from LA at 130 °C, 5 bar H2 in 12 h in water [49]. Ru nanoparticles supported on ordered mesoporous carbon (OMC) showed superior activity compared to commercial Ru/C under equivalent conditions (150 °C, 45 b H2, 2 h), and the catalyst showed better recyclability and stability [50]. Ni doped Ru (Ru0.9Ni0.1) catalyst on OMC is highly active and stable up to several reaction cycles under same reaction conditions as that of Ru/OMC [51]. Researchers, to improve the catalyst efficiency further, modified the OMC by using a N-dopant (5% Ru/NOMC) and reported 100% yield of γ-VL at 120 °C, 13 bar H2 in 4 h in methanolic medium [52]. However, the reported catalytic systems for LA to γ-VL conversion have several drawbacks including high energy requirements for the preparation of catalyst (TableS1A–C in the ESI) which at many times higher than that required for the reaction, harsh reaction conditions (high temperature and H2 pressure), use of environmentally polluting organic solvents, increase in cost owing to the use of expensive catalyst precursors involving multistep processes, poor recyclability due to leaching of metal from the catalytic support etc. These drawbacks preclude the effective use of such catalysts for industrial scale synthesis of γ-VL from LA. Considering above drawbacks from literature, this work is aimed to synthesize a Ru-based heterogeneous catalyst, here hydrous ruthenium oxide (HRO), by a simple method that would preclude the use of acidic additives or co-catalyst for the selective hydrogenation of LA to γ-VL under benign reaction conditions in aqueous medium without suffering from the previously mentioned deficiencies. Nearly stoichiometric yield (>99%) was obtained under the mildest reaction conditions (50 °C in 30 min) hitherto not reported. 2 Experimental section 2.1 Catalysts preparation 2.1.1 Preparation of HRO HRO catalyst was prepared by a simple precipitation method, a solution 0.001 M of RuCl3 was added to appropriate amount of CaCO3 aqueous solution and allowed to stand for 1 h without any stirring and heating. The obtained precipitate was washed with water for several times for removal of chloride ions (confirmed with AgNO3 solution) and dried for 3 h at 100 °C. The prepared material is as assigned the code HRO. 2.1.2 Preparation of HRO-N In a typical synthesis of HRO, 0.001 M RuCl3 solution was adjusted to pH > 13.2 with drop wise addition of 1 M aq. NaOH solution, stirred at room temperature for 24 h and allowed to stand undisturbed for 12 h. The obtained precipitate was washed with water for several times for removal of chloride ions and dried for 3 h at 100 °C. The prepared material is referred to as HRO-N in the following sections. 2.1.3 HRO-S Hydrous ruthenium oxide (HRO-S) was purchased from Sigma Aldrich and used as a standard for comparison purposes with our synthesized catalysts. 2.1.4 Preparation of HRO/H-β HRO supported on H-β zeolite was prepared by simultaneous precipitation of HRO and its impregnation on H-β zeolite. The 0.001 M of RuCl3 solution is mixed with appropriate amount of aqueous CaCO3 solution and desired amount of zeolite, the resulting mixture was stirred up to 12 h at room temperature; the obtained precipitate was washed with water and dried for 3 h at 100 °C. The material is known as HRO/ H-β. Recovered HRO/H-β after catalysis has been referred to as Ru-HRO@H-β. 2.1.5 Preparation of RuO2 RuO2 catalyst was prepared by calcination of HRO at 550 °C for 3 h at 10 °C/min ramp rate. 2.2 Hydrogenation of levulinic acid Levulinic acid (98%), methyl levulinate (≥ 98%), γ-valerolactone (99%), TiO2, Carbon, MgAl-LDH, RuO2.xH2O and RuCl3.xH2O were purchased from Sigma-Aldrich, 5% Ru/Al2O3 was purchased from Johnson Matthey, metal salts and hydrogen (>99.99% purity) were purchased from the local market, India. The zeolite was purchased from Zeochem, Switzerland. The LA hydrogenation experiments were carried out in a Hastelloy Amar high pressure reactor (Mumbai, India). The reactions were repeated in a stainless steel Autoclave Engineering high pressure reactor (USA), 100 ml equipped with an electrically heated jacket and mechanical stirrer. The reactor was loaded with the catalyst and the substrate (LA) dissolved in the solvent, purged with N2 three times before pressurizing with a fixed amount of H2 and the reaction was carried out at desirable temperatures and time duration. After completion of the reaction the reactor was cooled to room temperature and the excess H2 was released. The catalyst was separated by simple centrifugation and used for next cycle without any pre-treatment. The quantitative analysis of product mixture was done by using Shimadzu-UHPLC system equipped with PDI detector using Supelcogel-610H column. 3 Results and discussion 3.1 Catalyst characterization The synthesised HROs were characterized by various analytical techniques like PXRD, XPS, SEM, TEM, NH3-TPD, TPR, TGA, FT-IR and ICP. PXRD patterns of HROs (HRO: prepared by using CaCO3 as precipitating agent, HRO-N: prepared by using NaOH as precipitating agent and HRO-S (Sigma-Aldrich)) did not show any diffraction peaks and confirms that the material is amorphous in nature Fig. 2 A. The calcined HRO denoted as RuO2 showed intense peaks of 110, 101, 200, 211, 220, 002, 310, 112, 301 and 201 planes corresponding to tetragonal RuO2 (JCPDS card no. 21-1172) Fig. 2A. After impregnation of HRO on Na/H-β zeolite the crystallinity of the parent zeolite remained unchanged Fig. 2B. FT-IR spectra of HROs (Fig. 4) showed a broad band centred at 3440 cm−1 due to OH stretching of strongly bonded water molecules. The absence of such band in the case of RuO2 is due to the lack of water molecules on its surface. In TGA of HRO material (Fig. 5), a sharp weight loss was observed in the temperature range of 260–310 °C attributed to removal of strongly held H2O molecules. On the other hand, RuO2 did not show any weight loss in the entire temperature range studied viz., 50–800 °C, suggesting the absence of H2O molecules. The TPR profile of HRO and RuO2 showed a broad reduction peak in the range of 150–600 °C and 300–800 °C suggests a lesser reduction temperature of HRO than RuO2 (Fig. 6). In NH3-TPD analysis, HRO gave intense desorption peak at 240 °C indicating that the material has high acidity and the temperature window suggests sites with weak to moderate strength (Fig. S4 in the ESI). The TEM images of HRO (Fig. 7A) showed that the particles are highly agglomerated which may due to the interaction of neighbouring Ru particles through oxygen atoms. The agglomeration among particles was also confirmed by SEM (Fig. S5A in the ESI). The TEM images of HRO/H-β zeolite showed that the corresponding particles of HRO are well-dispersed on H-β zeolite support (Fig. 7C). The HRO material was synthesized in several batches to check the consistency of Ru loading wherein the ICP-OES results showed 95–100% efficient reproducibility of the material. The calculated Ru (in wt. %) of HRO loaded on different supports (cellulose, carbon, TiO2, MgAl-LDH and H-β) shows highest loading of 3.2 wt% for H-β against an expected loading of 4 wt%. The textural properties of materials are mentioned in Table 4. The BET surface area of HRO was found to be 85 m2/g and that of H-β support is 500 m2/g. After impreganation of HRO material on H-β (HRO/H-β), a decrease in the surface area was observed to 397 m2/g, probably due to coverage/blockage of pores by HRO partcicles. 3.2 Catalytic activity The catalytic activity of HRO material towards selective hydrogenation of LA to γ-VL was tested in aqueous medium pressurized with 20 bar H2 at 120 °C. The active catalyst generated in situ during the reaction, referred here as Ru-HRO, whose composition would be discussed vide infra, exhibited complete conversion in 1 h. A control experiment without any catalyst did not give any appreciable LA conversion (Table 1 , entries 1 and 2). We strived to achieve a more economical process by altering the material loading, pressure of H2, and the reaction temperature. HRO content varied from 10 mg (0.5 wt% of Ru w.r.t LA) to 2.5 mg (0.125 wt% of Ru w.r.t LA) keeping the reaction temperature and pressure constant. It was observed that 3.5 mg of HRO (0.175 wt% of Ru w.r.t LA) was sufficient for complete conversion of 1 g LA to 0.86 g γ-VL at 120 °C and 20 bar H2 (Table 1, entries 2–5). We decreased the H2 pressure from initial 20 bar to atmospheric pressure, keeping HRO loading fixed at 3.5 mg. It was observed that 5 bar H2 is optimal for selective hydrogenation of LA at 120 °C (Table 1, entries 5–8). Further, reaction was successful even by decreasing the reaction temperature from 120 °C to 50 °C without any compromise in the conversion of LA and selectivity of γ-VL (Table 1, entries 8–10). In addition, it was observed that a decrease in reaction time to 30 min at 5 bar H2 pressure and 50 °C resulted in only a slight loss of activity showing 85% conversion compared to 100% after 1 h (Table 1, entries 11 and 10) and it was improved to 100% by increasing H2 pressure to 10 bar (Table 1, entry 12). This is one of the mildest reaction conditions for the complete and selective conversion of LA to γ-VL in shortest time reported so far (Table S1 in the ESI). The HRO material amount used for the reaction is 3.5 mg for the hydrogenation of 1 g LA, and the inconvenience in using such a small quantity of the catalyst precursor may pose difficulty in recovering the entire catalyst from the reaction mixture. To circumvent this problem, we tried to impregnate the HRO material on assorted supports like carbon, TiO2, MgAl-LDH, H-β and cellulose with theoretical Ru content of 4 wt%. Among them, H-β zeolite showed a high degree of dispersion of HRO with higher Ru loading of 3.2 wt% as inferred from ICP-OES measurements. An initial reaction using 100 mg of HRO/H-β showed quantitative conversion of LA to γ-VL under the previously optimized reaction conditions of 10 bar H2 at 50 °C for 30 min (Table 1, entry 13). When weight of the catalyst was further decreased, a similar result (100% yield of γ-VL) was observed when the amount of HRO/H-β was 50 mg, and while in the case of 35 mg, though the selectivity of γ-VL was maintained, the conversion of LA decreased to 94% (Table 1, entry 14 and 15). Thus, further reactions were performed using 50 mg of HRO/H-β catalyst precursor (equivalent to 0.16 wt% of Ru w.r.t LA). The use of H-β zeolite support played a positive role by further decreasing the required Ru loading (compared to as such HRO), presumably due to the better dispersion of Ru centres on its surface thereby making the active sites available to react with LA. The recovery of supported catalyst (Ru-HRO@H-β) after the reaction by filtration is easier compared to simple Ru-HRO catalyst. Another aim of this study was to accomplish the production of γ-VL in very short time. To this effect, we increased the temperature progressively from 50 °C to 200 °C and the reaction time was reduced from 30 min to about 1.5 min under mentioned H2 pressure. Quantitative yields of γ-VL were obtained at 100 °C, 150 °C and 200 °C in 7 min, 3.5 min and 1.5 min respectively (Table 1, entries 14 and 16–19), rendering them amongst most accelerated conversions of LA to γ-VL. The catalytic activity of HRO catalyst precursor was compared with that of HRO-N synthesized with NaOH as the precipitating agent and also with commercial HRO procured from Sigma Aldrich (HRO-S). It was observed that HRO from all sources showed similar catalytic activity (Table 1, entries 20–22). Many Ruthenium-based catalysts were reported for LA to γ-VL conversion in which some of the catalysts showed excellent yield of γ-VL even at room temperature. For example, Y. Zhu et al. reported excellent catalytic activity for Ru/reduced graphene oxide (RGO), reduced at 150 °C, 40 bar H2, 2 h, for this reaction with 100% conversion of LA and 99.9% selectivity of γ-VL at room temperature in aqueous medium (Table 2 , entry 1). While on the contrary, under similar reaction conditions, the non-reduced catalyst (Ru/GO) was completely inactive suggests the absence of the active Ru(0) species under the conditions studied (Table 2, entry 2) [61]. W. Huang et al. disclosed few-layer graphene (FLG) supported reduced ruthenium catalyst (externally reduced via chemical reduction using polyol) which showed 98% yield of γ-VL at 20 °C at 40 bar H2 in 8 h (Table 2, entry 3) [62]. Furthermore, R. Palkovits’ research group have also demonstrated room temperature synthesis of γ-VL from neat LA using Ru/C with 97.5% yield in 50 h, and observed a decrease in the catalytic activity upon reuse (Table 2, entry 4) [37]. We explored the catalytic activity of in situ catalytic system, Ru-HRO@H-β, at room temperature with an endeavour to compare the activity with such externally reduced catalysts with maintaining similar Ru content and reaction conditions. The experiments were conducted with aqueous LA as etching of the reactor walls observed when concentrated LA solutions (>25 wt%) or neat LA was used. The present in situ catalytic system generated at ambient temperature (Ru-HRO@H-β) from HRO/H-β showed good activity compared to externally reduced catalysts. Under similar conditions, conventional ex situ reduced catalysts such as Ru/H-β, Ru/C, and Ru/Al2O3 showed moderate conversion of LA (24–33%) while Ru-HRO@H-β catalyst showed 70% (Table 2, entry 5–8). 3.3 Mechanistic studies Michael et al. reported that the catalytic activity of Ru increases in aqueous medium than while using in organic solvents, and attributed to the hydrogen bonding interaction of co-adsorbed water molecules with reactants on the catalyst surface, in other words facilitates easy access of reactants with the active sites of the catalyst [53]. Based on which, we conceived an idea that HRO based materials which are acidic and has strongly bonded water molecules to RuOx could serve as an efficient catalytic system for the conversion of LA to γ-VL. This material was previously reported to be effective for the conversion of cellulose to glucose [54]. Our idea was validated as Ru-HRO (derived from HRO) was found to be an exceptional catalyst for the selective conversion of LA to γ-VL under mild reaction conditions. Galletti et al. proposed two mechanistic pathways for the synthesis of γ-VL from LA. Path a involves the hydrogenation of LA to γ-hydroxypentanoic acid (γ-HP) followed by intramolecular esterification to obtain γ-VL, and path b in which the enol form of LA is esterified to α-angelica lactone (α-AL) followed by hydrogenation to γ-VL (Fig. S6 in the ESI) [36]. Using HRO material, the conversion of LA to γ-VL was too fast to observe either of the two reported intermediates, thus precluding the identification of the mechanistic pathway (Table 3 , entry 2). To pinpoint a mechanistic pathway, we employed methyl levulinate (ML) as the substrate instead of LA under our reaction conditions. If the reaction followed path a, the conversion of ML to γ-VL would involve transformation of ML to methyl γ-hydroxypentanoate which would then convert to γ-VL by intramolecular trans-esterification. The ML reaction product mixture contained 48% selectivity (32% yield) of un-cyclised methyl γ-hydroxypentanoate (M γ-HP) as observed by GC–MS (Table 3, entry 5). This observation supported that path a mechanism (hydrogenation followed by intramolecular esterification) is operating in LA to γ-VL conversion over this catalyst. Further, the LA in presence of HRO material and in the absence of H2 did not show the formation of α-angelica lactone (LA remained unconverted), which would be an expected intermediate if the reaction followed path b (Table 3, entry 6). Thus from above experiments, it can be concluded that the reaction undergoes through path a mechanism. The reaction conducted with simple RuO2 interestingly showed no activity for the reaction (Table 3, entry 1), indicating a clear evidence for the necessity of adsorbed water molecules on HRO for the conversion of LA to γ-VL. The bonded H2O molecules of HRO easily adsorb LA molecules on its surface through hydrogen bonding, and for this reason the HRO catalyst shows superior activity compared to other conventionally used Ru-based catalysts. In addition, TPR studies corroborated a lesser reduction temperature for HRO catalyst compared to RuO2. The reactivity of HRO material was assessed in other solvents besides in aqueous medium such as THF and methanol (Table 3, entries 3–4). Negligible activity was observed in them. This suggests the necessity of water molecules in the reaction and/or optimal concentration and particle size of Ru(0) formed in situ upon reduction of HRO, as corroborated from the PXRD measurements of the used catalyst which showed less intense reflection for Ru(0) in these solvents compared to while conducting the reaction in H2O (Fig. 3C). In other words, aqueous medium is only favourable for facile reduction of HRO. Initially, the Run+ of HRO undergoes reduction to Ru(0) which is the active species for hydrogenation. In presence of this in situ formed Ru(0), the hydrogen molecules get absorbed on the metal surface and form metal-hydrogen bond. Theoretical calculations reported show that even a single chemisorbed water molecule on Ru catalyst is enough for enhancing the catalytic hydrogenation activity of ketones [53,55]. The adjacent of Ru-H might have H2O molecules adsorbed on unreduced HRO that interact with LA through hydrogen bonding, and would undergo hydrogenation to γ-HP by attacking of H of Ru. The formed γ-HP, being unstable, undergo immediately intramolecular esterification and forms the γ-VL. Based on the above discussions, a proposed reaction mechanistic pathway is given in Fig. 1 . 3.4 In situ formation of Ru(0) from HRO during the reaction: characterization study The nature of HRO material and Ru metal formed under the reaction conditions were monitored by various analytical techniques like PXRD, XPS, SEM, TEM, TPR, TGA and FT-IR. The fresh HRO material was amorphous in nature as confirmed by lack of any diffraction peaks in PXRD. However, after the reaction, the obtained material showed a peak at 2θ = 43° (101 plane) that could be ascribed to hexagonal closed-packed (hcp) structure of Ru (Fig. 3A), confirming the occurrence of reduction of HRO to Ru(0) under the reaction conditions. The FT-IR spectrum of HRO showed an intense band at ∼3440 cm−1 that corresponds to O-H stretching vibration of adsorbed hydrogen-bonded H2O molecules. This band was also observed for the used catalyst after the reaction (Ru-HRO-2, 2 stand after 2nd cycle), however, with reduced intensity. This suggests that the HRO material is not fully reduced to Ru(0) in one cycle, and the reduction of HRO gradually occurs and increases with the reaction cycles. RuO2 which is inactive for the reaction showed a very weak band in the above range probably due to the presence of physisorbed or weakly-held H2O molecules (Fig. 4). To know the reduction property increment of HRO (unsupported) while increasing the reaction cycles were confirmed by PXRD. Recovered the material from 1st (Ru-HRO), 3rd (Ru-HRO-3), and 5th (Ru-HRO-5) cycles dried and used for analysis. The reaction conditions and PXRD profile of above mentioned cycles were mentioned in Fig. 3B. Increasing the intensity of Ru(0) peak (2θ = 43°; 101 plane) with increasing the reaction cycles recovered material was observed. Similar observation was noted for the H-β supported catalyst as well wherein for the first cycle obtained material (Ru-HRO@H-β), Ru(0) peak is not intense while after the 5th cycle, the obtained material (Ru-HRO@H-β-5) showed good intense peak of Ru(0). Further, the decrease in concentration of H2O molecules upon reaction cycles was also confirmed by TGA analysis, wherein fresh HRO showed a weight loss of up to 24% in the temperature range 150–350 °C due to the removal of strongly bound H2O molecules, while the weight loss in the similar range was 6% for Ru-HRO-2. This attests to the fact that even after the reduction, some of the water molecules are still adsorbed and available (Fig. 5). The reduction behaviour of HRO catalyst precursor to Ru(0) metal under the reaction conditions was further supported by TPR analysis (Fig. 6). The TPR of both fresh HRO and Ru-HRO-2 showed a reduction peak around 200–600 °C, however, with a reduced intensity for latter which confirms that the catalyst was not reduced in one reaction cycle. The SEM and TEM images of HRO material showed highly agglomerated particles expected due to the Ru-O-Ru linkage in the fresh catalyst precursor. After the reaction, the used catalyst (Ru-HRO-2) showed a decrease in agglomeration suggesting the breakage of Ru-O-Ru linkages while forming Ru metal (Figs. 7A–B and S5A–B). In situ Ru(0) formation under reaction conditions was also supported by electron binding energies (eV) using XPS measurements (Fig. 8 A). XPS of HRO material exhibited peak at 282.7 eV, arising from the 3d5/2 electron and assigned to Ru(+6) of RuO3. Another peak of HRO at 281.3 eV corresponds to 3d5/2 of RuO2(+4) [56–60]. The HRO material under reaction conditions in presence of H2 is reduced from Ru(+4) to Ru(0) and Ru(+6) to Ru(+4) as confirmed by the shift in the peak positions from Ru (+6) of HRO 282.7 (3d5/2) eV to Ru(+4) at 281.3 (3d5/2), the Ru(+4) of HRO 281.3 (3d5/2) to Ru(0) with peak positions at 280.1 (3d5/2) (Fig. 8B). In addition, the BET surface area of HRO decreased after the reaction (Ru-HRO) to 59 m2/g and similar observation was noted even for supported material (397 m2/g for HRO/H-β to 361 m2/g for Ru-HRO@H-β). The decrease in the surface area could possibly be due to change in the nature of ruthenium owing to the ‘in situ’ reduction (Table 4). 3.5 Recyclability of catalyst Assessment of recyclability of catalyst is necessary when using precious metal catalysts for industrial applications. After each cycle, the Ru-HRO@H-β catalyst was separated by simple centrifugation and was used as such for the next cycle without any pre-treatment. This procedure was followed for five consecutive cycles and no loss in the catalytic activity was observed at 100 °C, 10 bar H2 for 10 min (Fig. S7A in the ESI). To know the actual stability/activity of catalyst, we monitored the reusability while simultaneously evaluating the kinetics at a lower temperature (60 °C), 10 bar H2, and at different time intervals (20, 40, and 60 min) showed in Fig. S7B in the ESI. We observed upon reuse a slight decrease in the catalytic activity of Ru-HRO@H-β (in the initial 20 min. of the reaction). This could possibly due to hindered diffusion and binding of LA molecules on the surface of the catalyst (and in turn on the approach towards the active site Ru(0)) due to continued removal of water molecules upon reuse (Figs. 4 and 5). It is worth mentioning here that in all reuse studies, 100% selectivity was observed for γ-VL. Furthermore, the ICP-OES data confirmed that the leaching of Ru was negligible even after the 5th catalytic cycle. 3.6 Scale-up study Scale-up studies were performed by progressively increasing the concentration of LA from 2.5 to 25 wt%. Negligible leaching of Ru was observed up to 12.5 wt% of LA; however, with a further increase to 25 wt% showed a considerable Ru leaching. The leaching studies at different concentration of LA are given in Table S2 in the ESI. A reaction with 12.5 wt% of LA at 20 g scale was conducted in aqueous medium using 1 g of HRO/H-β catalyst precursor at 50 bar H2, 150 °C for 30 min. Further, this reaction was conducted 9 times to confirm the reproducibility. All reactions showed 99–100% yield of γ-VL (Fig. S8 in the ESI). The aqueous product mixture was extracted with dichloromethane and evaporated using a rotary evaporator to obtain pure γ-VL. The collected DCM was reused for subsequent extractions. 3.7 Continuous production of γ-VL Continuous liquid phase hydrogenation of LA to γ-VL using HRO/H-β (3.2 wt% of Ru) catalyst precursor (dual bed 2 + 2 g) in aqueous medium using molecular H2 as hydrogen source was carried out. For this study, several parameters (60 h on catalytic bed) such as flow rate of aqueous LA (5 wt%) feed (2 to 1.5 ml), reaction temperature (225 to 75 °C), H2 pressure (20 to 5 bar), flow rate of H2 feed (50 to 2 ml/min) were varied. At optimised reaction conditions viz., 1.5 ml/min of aqueous LA feed flow, 100 °C, 10 bar H2 and 2 ml/min flow of H2, the catalyst showed complete conversion of LA with 99–100% yield of γ-VL for 40 h time-on-stream (60 to 100 h) (Fig. 9 ). Any deactivation and leaching of Ru was not observed during the continuous phase reaction; however, after 100 h, draining/oozing of catalytic bed from the reactor was observed as the reaction was performed in liquid flow. The flow force is effected on the removal of the catalytic bed. Reaction under continuous phase also followed similar mechanism viz., through the hydroxypentanoic intermediate pathway, confirmed by using ML as substrate. 4 Conclusions We have successfully demonstrated HRO as an efficient catalyst precursor for hydrogenation of LA to γ-VL in high yield (100%) under mild reaction conditions (example 50 °C, 10 bar H2 for 30 min) in aqueous medium. Mechanistic investigations studies through several analytical techniques such as PXRD, FT-IR, TGA, SEM, TPR, TEM and XPS unravelled that the ruthenium in HRO was reduced in situ to Ru(0), the active species for the reaction. Presence of bonded H2O molecules of HRO play a pivotal role in the facile production of γ-VL. The ease of reuse of HRO is demonstrated by supporting it on H-β catalyst and the supported catalyst is reusable up to five times without any loss in its activity. The catalyst also showed excellent activity and stability towards continuous liquid phase hydrogenation of LA to γ-VL with 99–100% yield under milder reaction conditions (100 °C) over 40 h time on stream. The present catalytic system has pronounced advantages including working under mild reaction conditions, using water as a solvent, facile and selective formation of γ-VL with avoiding the use of additives and/or co-catalysts that are commonly reported earlier in literature. Further, the endeavour of using in situ generated catalyst (Ru-HRO) to avoid conventionally deployed resource intensive external reduction for this reaction was also substantiated by its higher catalytic activity over the ‘ex situ’ generated catalyst. The report, thus establishes Ru-HRO as an eco-friendly new generation fast and selective hydrogenation catalyst, that works under mild reaction conditions. Acknowledgements CSIR-CSMCRI Communication No. 082/2017. S.G. thanks CSIR, New Delhi, for a Senior Research Fellowship. The authors thank CSIR, New Delhi for financial support under the projects OLP-0031, MLP-0028 and CSC-0123. The authors thank Analytical Division & Centralized Instrumental Facilities of this institute for analytical support. The authors thank Dr. Joyee Mitra and Mr. Gajula Sampath for proof correction of the manuscript. Appendix A Supplementary data Supplementary material related to this article can be found, in the online version, at doi:https://doi.org/10.1016/j.apcata.2018.10.018. Appendix A Supplementary data The following is Supplementary data to this article: References [1] R. Slade R. Gross A. Bauen Energy Environ. Sci. 4 2011 2645 2657 [2] P.N.R. Vennestrøm C.M. Osmundsen C.H. Christensen E. Taarning Angew. Chem. Int. Ed. 50 2011 10502 10509 [3] G.W. Huber S. Iborra A. Corma Chem. Rev. 106 2006 4044 4098 [4] P. Gallezot Chem. Soc. Rev. 41 2012 1538 1558 [5] T. Werpy G. Petersen A. Aden J. Bozell J. Holladay J. White A. Manheim D. Elliot L. Lasure S. Jones M. Gerber K. Ibsen L. Lumberg S. Kelley Top Value Added Chemicals from Biomass Volume I-Results of Screening for Potential Candidates from Sugars and Synthesis Gas 2004 Pacific Northwest National Laboratory (PNNL), and National Renewable Energy Laboratory (NREL), U.S. Department of Energy (DOE) report [6] J. Holladay J. White J. Bozell D. Johnson Top Value-Added Chemicals from Biomass Volume II-Results of Screening for Potential Candidates from Biorefinery Lignin 2007 Pacific Northwest National Laboratory, University of Tennessee and National Renewable Energy Laboratory, U.S. Department of Energy (DOE) report [7] M. patel M. Crank V. Dornburg B. Hermann L. Roes Medium and Long-term Opportunities and Risks of the Biotechnology production of Bulk Chemicals from Renewable Resources-The Potential of White Biotechnology Utrecht University, Fraunhofer inistitute of System and Innovation Reserach, Universidad complutense demadrid, Plant international, A BREW project report 2006 [8] R. Taylor L. Nattrass G. Alberts P. Robson C. Chudziak A. Bauen I.M. Libelli G. Lotti M. Prussi R. Nistri D. Chiaramonti A.L. Contreras H. Bos G. Eggink J. Springer R. Bakker R.V. Ree From the Sugar Platform to biofuels and biochemicals. E4tech (UK) Ltd, Consorzio per la Ricerca e la Dimostrazione sulle Energie Rinnovabili (RE-CORD), Stichting Dienst Landbouwkundig Onderzoek, part of Wageningen University and Research Centre, Final report for the European Commission Directorate-General Energy 2015 [9] A.F. Lee J.A. Bennett J.C. Manayil K. Wilson Chem. Soc. Rev. 43 2014 7887 7916 [10] J.N. Chheda G.W. Huber J.A. Dumesic Angew. Chem. Int. Ed. 46 2007 7164 7183 [11] A. Corma S. Iborra A. Velty Chem. Rev. 107 2007 2411 2502 [12] A. Victor I.N. Pulidindi A. Gedanken RSC Adv. 4 2014 44706 44711 [13] H. Lin J. Strull Y. Liu Z. Karmiol K. Plank G. Miller Z. Guo L. Yang Energy Environ. Sci. 5 2012 9773 9777 [14] A.M.R. Galletti C. Antonetti V.D. Luise D. Licursi N.N.o.D. Nasso Bio Res. 7 2012 1824 1835 [15] D.W. Rackemann W.O.S. Doherty Biofuels, Bioprod. Biorefin. 5 2011 198 214 [16] A.D. Patel J.C. Serrano-Ruiz J.A. Dumesic R.P. Anex Chem. Eng. J. 160 2010 311 321 [17] Y. Guo K. Li J.H. Clark Green Chem. 9 2007 839 841 [18] X.L. Du L. He S. Zhao Y.M. Liu Y. Cao H.Y. He K.N. Fan Angew. Chem. Int. Ed. 50 2011 7815 7819 [19] J.-P. Lange J.Z. Vestering R.J. Haan Chem. Commun. 2007 3488 3490 [20] M.J. Climent A. Corma S. Iborra Green Chem. 16 2014 516 547 [21] A.S. Amarasekara S.A. Hawkins Eur. Polym. J. 47 2011 2451 2457 [22] D.M. Alonso S.G. Wettstein J.A. Dumesic Green Chem. 15 2013 584 595 [23] I.T. Horváth H. Mehdi V. Fábos L. Boda L.T. Mika Green Chem. 10 2008 238 242 [24] W.R.H. Wright R. Palkovits ChemSusChem 5 2012 1657 1667 [25] F. Liguori C. Moreno-Marrodan P. Barbaro ACS Catal. 5 2015 1882 1894 [26] X. Tang X. Zeng Z. Li L. Hu Y. Sun S. Liu T. Lei L. Lin Renew. Sustain. Energy Rev. 40 2014 608 620 [27] A. Osatiashtiani A.F. Lee K. Wilson J. Chem. Technol. Biotechnol. 92 2017 1125 1135 [28] F.M. Geilen B. Engendahl A. Harwardt W. Marquardt J. Klankermayer W. Leitner Angew. Chem. Int. Ed. 49 2010 5510 5514 [29] W. Li J.-H. Xie H. Lin Q.-L. Zhou Green Chem. 14 2012 2388 2390 [30] C. Ortiz-Cervantes M. Flores-Alamo J.J. García ACS Catal. 5 2015 1424 1431 [31] J.M. Tukacs D. Király A. Strádi G. Novodarszki Z. Eke G. Dibó T. Kégl L.T. Mika Green Chem. 14 2012 2057 2065 [32] J.M. Tukacs M. Novak G. Dibo L.T. Mika Catal. Sci. Technol. 4 2014 2908 2912 [33] S.G. Wettstein J.Q. Bond D.M. Alonso H.N. Pham A.K. Datye J.A. Dumesic Appl. Catal. B: Environ. 117–118 2012 321 329 [34] D.J. Braden C.A. Henao J. Heltzel C.C. Maravelias J.A. Dumesic Green Chem. 13 2011 1755 1765 [35] J. Ftouni H.C. Genuino A. Munoz-Murillo P.C.A. Bruijnincx B.M. Weckhuysen ChemSusChem 10 2017 2891 2896 [36] A.M.R. Galletti C. Antonetti V. De Luise M. Martinelli Green Chem. 14 2012 688 694 [37] M.G. Al-Shaal W.R.H. Wright R. Palkovits Green Chem. 14 2012 1260 1263 [38] A. Primo P. Concepcion A. Corma Chem. Commun. 47 2011 3613 3615 [39] A.M. Ruppert J. Grams M. Jedrzejczyk J. Matras-Michalska N. Keller K. Ostojska P. Sautet ChemSusChem 8 2015 1538 1547 [40] M. Sudhakar M. Lakshmi Kantam V. Swarna Jaya R. Kishore K.V. Ramanujachary A. Venugopal Catal. Commun. 50 2014 101 104 [41] Y. Yao Z. Wang S. Zhao D. Wang Z. Wu M. Zhang Catal. Today 234 2014 245 250 [42] W. Luo U. Deka A.M. Beale E.R.H. van Eck P.C.A. Bruijnincx B.M. Weckhuysen J. Catal. 301 2013 175 186 [43] C. Moreno-Marrodan P. Barbaro Green Chem. 16 2014 3434 3438 [44] V. Swarna Jaya M. Sudhakar S. Naveen Kumar A. Venugopal RSC Adv. 5 2015 9044 9049 [45] W.X. Cao W.H. Luo H.G. Ge Y. Su A.Q. Wang T. Zhang Green Chem. 19 2017 2201 2211 [46] B.C. Filiz E.S. Gnanakumar A. Martinez-Arias R. Gengler P. Rudolf G. Rothenberg N.R. Shiju Catal. Lett. 147 2017 1744 1753 [47] D. Albani Q. Li G. Vile S. Mitchell N. Almora-Barrios P.T. Witte N. Lopez J. Perez-Ramirez Green Chem. 19 2017 2361 2370 [48] W.J. Song Z. Chen W.K. Lai I. Rodriguez-Ramos X.D. Yi W.Z. Weng W.P. Fang Appl. Catal. A Gen. 540 2017 21 30 [49] C. Ortiz-Cervantes J.J. García Inorg. Chim. Acta Rev. 397 2013 124 128 [50] Y. Yang C. Sun Y. Ren S. Hao D. Jiang Sci. Rep. 4 2014 1 6 article number: 4540 [51] Y. Yang G. Gao X. Zhang F. Li ACS Catal. 4 2014 1419 1425 [52] Z.J. Wei J.T. Lou C.M. Su D.C. Guo Y.X. Liu S.G. Deng ChemSusChem 10 2017 1720 1732 [53] C. Michel J. Zaffran A.M. Ruppert J. Matras-Michalska M. Jedrzejczyk J. Grams P. Sautet Chem. Commun. 50 2014 12450 12453 [54] T. Komanoya H. Kobayashi K. Hara W.-J. Chun A. Fukuoka Appl. Catal. A Gen. 407 2011 188 194 [55] B.S. Akpa C. D’Agostino L.F. Gladden K. Hindle H. Manyar J. McGregor R. Li M. Neurock N. Sinha E.H. Stitt D. Weber J.A. Zeitler D.W. Rooney J. Catal. 289 2012 30 41 [56] K.S. Kim N. Winograd J. Catal. 35 1974 66 72 [57] T.P. Luxton M.J. Eick K.G. Scheckel J. Colloid Interface Sci. 359 2011 30 39 [58] A. Adeyemo G. Hunter P.K. Dutta Sens. Actuators B Chem. 152 2011 307 315 [59] F. Scheiba M. Scholz L. Cao R. Schafranek C. Roth C. Cremers X. Qiu U. Stimming H. Fuess Fuel Cells 6 2006 439 446 [60] J.-H. Ma Y.-Y. Feng J. Yu D. Zhao A.-J. Wang B.-Q. Xu J. Catal. 275 2010 34 44 [61] J. Tan J. Cui X. Cui T. Deng X. Li Y. Zhu Y. Li ACS Catal. 5 2015 7379 7384 [62] C. Xiao T.-W. Goh Z. Qi S. Goes K. Brashler C. Perez W. Huang ACS Catal. 6 2016 593 599",
      "scopus-id": "85055867691",
      "coredata": {
        "eid": "1-s2.0-S0926860X18305167",
        "dc:description": "A novel material, hydrous ruthenium oxide (HRO) as potential catalyst precursor, is reported for the selective hydrogenation of levulinic acid (LA) to γ-valerolactone (γ-VL) in high yields under the mildest conditions in an aqueous medium. Various characterization studies such as PXRD, FT-IR, TGA, SEM, TEM and XPS show that the active catalyst, referred here as Ru-HRO is generated in situ from HRO during the reaction. Such in situ generation of the active catalyst thus avoided prior reduction or pre-treatment which is often reported for Ru-based catalysts for this reaction. It is pertinent to mention that the activity of the in situ generated catalyst is higher than the ex situ reduced catalyst. The effect of H-β as support for HRO showed a pronounced influence on the active catalyst (Ru-HRO@H-β) by decreasing the Ru loading required (compared to ‘as such’ HRO) and rendered easier separation after the reaction. Interestingly, the HRO-derived catalyst works only under aqueous medium unlike in many organic solvents reported elsewhere. A reaction mechanism is proposed by using several controlled experiments which reveal hydrogenation of LA to γ-hydroxypentanoic acid (γ-HP) and followed by cyclisation (intramolecular esterification) to γ-VL with the removal of H2O. The catalyst showed similar activity upon recycling for up to five cycles and for the reaction scale (of LA) from 1 g to 200 g. Further, liquid phase continuous hydrogenation of LA to γ-VL is successfully demonstrated using in situ generated Ru-HRO@H-β (dual bed) in aqueous medium under optimized reaction condition (1.5 ml/min of aqueous LA feed flow (5 wt%), 100 °C, 10 bar H2 and 2 ml/min flow of H2 feed), that showed complete conversion of LA with 98–100% yield of γ-VL for 40 h time-on-stream. Simple preparation method, milder reaction conditions, high activity, recyclability, and ability to deploy under continuous conditions makes this catalytic process attractive for industrial production of γ-VL.",
        "openArchiveArticle": "false",
        "prism:coverDate": "2019-01-05",
        "openaccessUserLicense": null,
        "prism:aggregationType": "Journal",
        "prism:url": "https://api.elsevier.com/content/article/pii/S0926860X18305167",
        "dc:creator": [
          {
            "@_fa": "true",
            "$": "Gundekari, Sreedhar"
          },
          {
            "@_fa": "true",
            "$": "Srinivasan, Kannan"
          }
        ],
        "link": [
          {
            "@_fa": "true",
            "@rel": "self",
            "@href": "https://api.elsevier.com/content/article/pii/S0926860X18305167"
          },
          {
            "@_fa": "true",
            "@rel": "scidir",
            "@href": "https://www.sciencedirect.com/science/article/pii/S0926860X18305167"
          }
        ],
        "dc:format": "application/json",
        "openaccessType": null,
        "pii": "S0926-860X(18)30516-7",
        "prism:volume": "569",
        "prism:publisher": "Elsevier B.V.",
        "dc:title": "Hydrous ruthenium oxide: A new generation remarkable catalyst precursor for energy efficient and sustainable production of γ-valerolactone from levulinic acid in aqueous medium",
        "prism:copyright": "© 2018 Elsevier B.V. All rights reserved.",
        "openaccess": "0",
        "prism:issn": "0926860X",
        "dcterms:subject": [
          {
            "@_fa": "true",
            "$": "Levulinic acid"
          },
          {
            "@_fa": "true",
            "$": "γ-valerolactone"
          },
          {
            "@_fa": "true",
            "$": "Hydrous ruthenium oxide"
          },
          {
            "@_fa": "true",
            "$": "In situ catalyst"
          },
          {
            "@_fa": "true",
            "$": "External reduction"
          }
        ],
        "openaccessArticle": "false",
        "prism:publicationName": "Applied Catalysis A: General",
        "openaccessSponsorType": null,
        "prism:pageRange": "117-125",
        "prism:endingPage": "125",
        "pubType": "fla",
        "prism:coverDisplayDate": "5 January 2019",
        "prism:doi": "10.1016/j.apcata.2018.10.018",
        "prism:startingPage": "117",
        "dc:identifier": "doi:10.1016/j.apcata.2018.10.018",
        "openaccessSponsorName": null
      },
      "objects": {
        "object": [
          {
            "@category": "standard",
            "@height": "49",
            "@width": "274",
            "@_fa": "true",
            "$": "https://api.elsevier.com/content/object/eid/1-s2.0-S0926860X18305167-fx1.jpg?httpAccept=%2A%2F%2A",
            "@multimediatype": "JPEG image file",
            "@type": "IMAGE-DOWNSAMPLED",
            "@size": "3964",
            "@ref": "fx1",
            "@mimetype": "image/jpeg"
          },
          {
            "@category": "standard",
            "@height": "47",
            "@width": "271",
            "@_fa": "true",
            "$": "https://api.elsevier.com/content/object/eid/1-s2.0-S0926860X18305167-fx2.jpg?httpAccept=%2A%2F%2A",
            "@multimediatype": "JPEG image file",
            "@type": "IMAGE-DOWNSAMPLED",
            "@size": "3725",
            "@ref": "fx2",
            "@mimetype": "image/jpeg"
          },
          {
            "@category": "standard",
            "@height": "200",
            "@width": "368",
            "@_fa": "true",
            "$": "https://api.elsevier.com/content/object/eid/1-s2.0-S0926860X18305167-ga1.jpg?httpAccept=%2A%2F%2A",
            "@multimediatype": "JPEG image file",
            "@type": "IMAGE-DOWNSAMPLED",
            "@size": "22387",
            "@ref": "ga1",
            "@mimetype": "image/jpeg"
          },
          {
            "@category": "standard",
            "@height": "353",
            "@width": "509",
            "@_fa": "true",
            "$": "https://api.elsevier.com/content/object/eid/1-s2.0-S0926860X18305167-gr1.jpg?httpAccept=%2A%2F%2A",
            "@multimediatype": "JPEG image file",
            "@type": "IMAGE-DOWNSAMPLED",
            "@size": "31964",
            "@ref": "gr1",
            "@mimetype": "image/jpeg"
          },
          {
            "@category": "standard",
            "@height": "228",
            "@width": "716",
            "@_fa": "true",
            "$": "https://api.elsevier.com/content/object/eid/1-s2.0-S0926860X18305167-gr2.jpg?httpAccept=%2A%2F%2A",
            "@multimediatype": "JPEG image file",
            "@type": "IMAGE-DOWNSAMPLED",
            "@size": "43544",
            "@ref": "gr2",
            "@mimetype": "image/jpeg"
          },
          {
            "@category": "standard",
            "@height": "462",
            "@width": "716",
            "@_fa": "true",
            "$": "https://api.elsevier.com/content/object/eid/1-s2.0-S0926860X18305167-gr3.jpg?httpAccept=%2A%2F%2A",
            "@multimediatype": "JPEG image file",
            "@type": "IMAGE-DOWNSAMPLED",
            "@size": "80162",
            "@ref": "gr3",
            "@mimetype": "image/jpeg"
          },
          {
            "@category": "standard",
            "@height": "246",
            "@width": "376",
            "@_fa": "true",
            "$": "https://api.elsevier.com/content/object/eid/1-s2.0-S0926860X18305167-gr4.jpg?httpAccept=%2A%2F%2A",
            "@multimediatype": "JPEG image file",
            "@type": "IMAGE-DOWNSAMPLED",
            "@size": "18832",
            "@ref": "gr4",
            "@mimetype": "image/jpeg"
          },
          {
            "@category": "standard",
            "@height": "228",
            "@width": "377",
            "@_fa": "true",
            "$": "https://api.elsevier.com/content/object/eid/1-s2.0-S0926860X18305167-gr5.jpg?httpAccept=%2A%2F%2A",
            "@multimediatype": "JPEG image file",
            "@type": "IMAGE-DOWNSAMPLED",
            "@size": "16660",
            "@ref": "gr5",
            "@mimetype": "image/jpeg"
          },
          {
            "@category": "standard",
            "@height": "254",
            "@width": "376",
            "@_fa": "true",
            "$": "https://api.elsevier.com/content/object/eid/1-s2.0-S0926860X18305167-gr6.jpg?httpAccept=%2A%2F%2A",
            "@multimediatype": "JPEG image file",
            "@type": "IMAGE-DOWNSAMPLED",
            "@size": "18150",
            "@ref": "gr6",
            "@mimetype": "image/jpeg"
          },
          {
            "@category": "standard",
            "@height": "181",
            "@width": "566",
            "@_fa": "true",
            "$": "https://api.elsevier.com/content/object/eid/1-s2.0-S0926860X18305167-gr7.jpg?httpAccept=%2A%2F%2A",
            "@multimediatype": "JPEG image file",
            "@type": "IMAGE-DOWNSAMPLED",
            "@size": "31909",
            "@ref": "gr7",
            "@mimetype": "image/jpeg"
          },
          {
            "@category": "standard",
            "@height": "293",
            "@width": "698",
            "@_fa": "true",
            "$": "https://api.elsevier.com/content/object/eid/1-s2.0-S0926860X18305167-gr8.jpg?httpAccept=%2A%2F%2A",
            "@multimediatype": "JPEG image file",
            "@type": "IMAGE-DOWNSAMPLED",
            "@size": "35260",
            "@ref": "gr8",
            "@mimetype": "image/jpeg"
          },
          {
            "@category": "standard",
            "@height": "274",
            "@width": "471",
            "@_fa": "true",
            "$": "https://api.elsevier.com/content/object/eid/1-s2.0-S0926860X18305167-gr9.jpg?httpAccept=%2A%2F%2A",
            "@multimediatype": "JPEG image file",
            "@type": "IMAGE-DOWNSAMPLED",
            "@size": "26579",
            "@ref": "gr9",
            "@mimetype": "image/jpeg"
          },
          {
            "@category": "thumbnail",
            "@height": "39",
            "@width": "219",
            "@_fa": "true",
            "$": "https://api.elsevier.com/content/object/eid/1-s2.0-S0926860X18305167-fx1.sml?httpAccept=%2A%2F%2A",
            "@multimediatype": "GIF image file",
            "@type": "IMAGE-THUMBNAIL",
            "@size": "2390",
            "@ref": "fx1",
            "@mimetype": "image/gif"
          },
          {
            "@category": "thumbnail",
            "@height": "38",
            "@width": "219",
            "@_fa": "true",
            "$": "https://api.elsevier.com/content/object/eid/1-s2.0-S0926860X18305167-fx2.sml?httpAccept=%2A%2F%2A",
            "@multimediatype": "GIF image file",
            "@type": "IMAGE-THUMBNAIL",
            "@size": "2343",
            "@ref": "fx2",
            "@mimetype": "image/gif"
          },
          {
            "@category": "thumbnail",
            "@height": "119",
            "@width": "219",
            "@_fa": "true",
            "$": "https://api.elsevier.com/content/object/eid/1-s2.0-S0926860X18305167-ga1.sml?httpAccept=%2A%2F%2A",
            "@multimediatype": "GIF image file",
            "@type": "IMAGE-THUMBNAIL",
            "@size": "9592",
            "@ref": "ga1",
            "@mimetype": "image/gif"
          },
          {
            "@category": "thumbnail",
            "@height": "152",
            "@width": "219",
            "@_fa": "true",
            "$": "https://api.elsevier.com/content/object/eid/1-s2.0-S0926860X18305167-gr1.sml?httpAccept=%2A%2F%2A",
            "@multimediatype": "GIF image file",
            "@type": "IMAGE-THUMBNAIL",
            "@size": "5757",
            "@ref": "gr1",
            "@mimetype": "image/gif"
          },
          {
            "@category": "thumbnail",
            "@height": "70",
            "@width": "219",
            "@_fa": "true",
            "$": "https://api.elsevier.com/content/object/eid/1-s2.0-S0926860X18305167-gr2.sml?httpAccept=%2A%2F%2A",
            "@multimediatype": "GIF image file",
            "@type": "IMAGE-THUMBNAIL",
            "@size": "4807",
            "@ref": "gr2",
            "@mimetype": "image/gif"
          },
          {
            "@category": "thumbnail",
            "@height": "141",
            "@width": "219",
            "@_fa": "true",
            "$": "https://api.elsevier.com/content/object/eid/1-s2.0-S0926860X18305167-gr3.sml?httpAccept=%2A%2F%2A",
            "@multimediatype": "GIF image file",
            "@type": "IMAGE-THUMBNAIL",
            "@size": "9435",
            "@ref": "gr3",
            "@mimetype": "image/gif"
          },
          {
            "@category": "thumbnail",
            "@height": "143",
            "@width": "219",
            "@_fa": "true",
            "$": "https://api.elsevier.com/content/object/eid/1-s2.0-S0926860X18305167-gr4.sml?httpAccept=%2A%2F%2A",
            "@multimediatype": "GIF image file",
            "@type": "IMAGE-THUMBNAIL",
            "@size": "5867",
            "@ref": "gr4",
            "@mimetype": "image/gif"
          },
          {
            "@category": "thumbnail",
            "@height": "133",
            "@width": "219",
            "@_fa": "true",
            "$": "https://api.elsevier.com/content/object/eid/1-s2.0-S0926860X18305167-gr5.sml?httpAccept=%2A%2F%2A",
            "@multimediatype": "GIF image file",
            "@type": "IMAGE-THUMBNAIL",
            "@size": "5136",
            "@ref": "gr5",
            "@mimetype": "image/gif"
          },
          {
            "@category": "thumbnail",
            "@height": "148",
            "@width": "219",
            "@_fa": "true",
            "$": "https://api.elsevier.com/content/object/eid/1-s2.0-S0926860X18305167-gr6.sml?httpAccept=%2A%2F%2A",
            "@multimediatype": "GIF image file",
            "@type": "IMAGE-THUMBNAIL",
            "@size": "5760",
            "@ref": "gr6",
            "@mimetype": "image/gif"
          },
          {
            "@category": "thumbnail",
            "@height": "70",
            "@width": "219",
            "@_fa": "true",
            "$": "https://api.elsevier.com/content/object/eid/1-s2.0-S0926860X18305167-gr7.sml?httpAccept=%2A%2F%2A",
            "@multimediatype": "GIF image file",
            "@type": "IMAGE-THUMBNAIL",
            "@size": "10835",
            "@ref": "gr7",
            "@mimetype": "image/gif"
          },
          {
            "@category": "thumbnail",
            "@height": "92",
            "@width": "219",
            "@_fa": "true",
            "$": "https://api.elsevier.com/content/object/eid/1-s2.0-S0926860X18305167-gr8.sml?httpAccept=%2A%2F%2A",
            "@multimediatype": "GIF image file",
            "@type": "IMAGE-THUMBNAIL",
            "@size": "5832",
            "@ref": "gr8",
            "@mimetype": "image/gif"
          },
          {
            "@category": "thumbnail",
            "@height": "127",
            "@width": "219",
            "@_fa": "true",
            "$": "https://api.elsevier.com/content/object/eid/1-s2.0-S0926860X18305167-gr9.sml?httpAccept=%2A%2F%2A",
            "@multimediatype": "GIF image file",
            "@type": "IMAGE-THUMBNAIL",
            "@size": "5801",
            "@ref": "gr9",
            "@mimetype": "image/gif"
          },
          {
            "@category": "high",
            "@height": "215",
            "@width": "1214",
            "@_fa": "true",
            "$": "https://api.elsevier.com/content/object/eid/1-s2.0-S0926860X18305167-fx1_lrg.jpg?httpAccept=%2A%2F%2A",
            "@multimediatype": "JPEG image file",
            "@type": "IMAGE-HIGH-RES",
            "@size": "25386",
            "@ref": "fx1",
            "@mimetype": "image/jpeg"
          },
          {
            "@category": "high",
            "@height": "208",
            "@width": "1200",
            "@_fa": "true",
            "$": "https://api.elsevier.com/content/object/eid/1-s2.0-S0926860X18305167-fx2_lrg.jpg?httpAccept=%2A%2F%2A",
            "@multimediatype": "JPEG image file",
            "@type": "IMAGE-HIGH-RES",
            "@size": "25512",
            "@ref": "fx2",
            "@mimetype": "image/jpeg"
          },
          {
            "@category": "high",
            "@height": "886",
            "@width": "1630",
            "@_fa": "true",
            "$": "https://api.elsevier.com/content/object/eid/1-s2.0-S0926860X18305167-ga1_lrg.jpg?httpAccept=%2A%2F%2A",
            "@multimediatype": "JPEG image file",
            "@type": "IMAGE-HIGH-RES",
            "@size": "160483",
            "@ref": "ga1",
            "@mimetype": "image/jpeg"
          },
          {
            "@category": "high",
            "@height": "1563",
            "@width": "2255",
            "@_fa": "true",
            "$": "https://api.elsevier.com/content/object/eid/1-s2.0-S0926860X18305167-gr1_lrg.jpg?httpAccept=%2A%2F%2A",
            "@multimediatype": "JPEG image file",
            "@type": "IMAGE-HIGH-RES",
            "@size": "253251",
            "@ref": "gr1",
            "@mimetype": "image/jpeg"
          },
          {
            "@category": "high",
            "@height": "1009",
            "@width": "3169",
            "@_fa": "true",
            "$": "https://api.elsevier.com/content/object/eid/1-s2.0-S0926860X18305167-gr2_lrg.jpg?httpAccept=%2A%2F%2A",
            "@multimediatype": "JPEG image file",
            "@type": "IMAGE-HIGH-RES",
            "@size": "336248",
            "@ref": "gr2",
            "@mimetype": "image/jpeg"
          },
          {
            "@category": "high",
            "@height": "2044",
            "@width": "3170",
            "@_fa": "true",
            "$": "https://api.elsevier.com/content/object/eid/1-s2.0-S0926860X18305167-gr3_lrg.jpg?httpAccept=%2A%2F%2A",
            "@multimediatype": "JPEG image file",
            "@type": "IMAGE-HIGH-RES",
            "@size": "623749",
            "@ref": "gr3",
            "@mimetype": "image/jpeg"
          },
          {
            "@category": "high",
            "@height": "1090",
            "@width": "1668",
            "@_fa": "true",
            "$": "https://api.elsevier.com/content/object/eid/1-s2.0-S0926860X18305167-gr4_lrg.jpg?httpAccept=%2A%2F%2A",
            "@multimediatype": "JPEG image file",
            "@type": "IMAGE-HIGH-RES",
            "@size": "154964",
            "@ref": "gr4",
            "@mimetype": "image/jpeg"
          },
          {
            "@category": "high",
            "@height": "1012",
            "@width": "1670",
            "@_fa": "true",
            "$": "https://api.elsevier.com/content/object/eid/1-s2.0-S0926860X18305167-gr5_lrg.jpg?httpAccept=%2A%2F%2A",
            "@multimediatype": "JPEG image file",
            "@type": "IMAGE-HIGH-RES",
            "@size": "127148",
            "@ref": "gr5",
            "@mimetype": "image/jpeg"
          },
          {
            "@category": "high",
            "@height": "1125",
            "@width": "1668",
            "@_fa": "true",
            "$": "https://api.elsevier.com/content/object/eid/1-s2.0-S0926860X18305167-gr6_lrg.jpg?httpAccept=%2A%2F%2A",
            "@multimediatype": "JPEG image file",
            "@type": "IMAGE-HIGH-RES",
            "@size": "149995",
            "@ref": "gr6",
            "@mimetype": "image/jpeg"
          },
          {
            "@category": "high",
            "@height": "801",
            "@width": "2507",
            "@_fa": "true",
            "$": "https://api.elsevier.com/content/object/eid/1-s2.0-S0926860X18305167-gr7_lrg.jpg?httpAccept=%2A%2F%2A",
            "@multimediatype": "JPEG image file",
            "@type": "IMAGE-HIGH-RES",
            "@size": "349582",
            "@ref": "gr7",
            "@mimetype": "image/jpeg"
          },
          {
            "@category": "high",
            "@height": "1295",
            "@width": "3090",
            "@_fa": "true",
            "$": "https://api.elsevier.com/content/object/eid/1-s2.0-S0926860X18305167-gr8_lrg.jpg?httpAccept=%2A%2F%2A",
            "@multimediatype": "JPEG image file",
            "@type": "IMAGE-HIGH-RES",
            "@size": "270897",
            "@ref": "gr8",
            "@mimetype": "image/jpeg"
          },
          {
            "@category": "high",
            "@height": "1213",
            "@width": "2086",
            "@_fa": "true",
            "$": "https://api.elsevier.com/content/object/eid/1-s2.0-S0926860X18305167-gr9_lrg.jpg?httpAccept=%2A%2F%2A",
            "@multimediatype": "JPEG image file",
            "@type": "IMAGE-HIGH-RES",
            "@size": "203605",
            "@ref": "gr9",
            "@mimetype": "image/jpeg"
          },
          {
            "@category": "standard",
            "@_fa": "true",
            "$": "https://api.elsevier.com/content/object/eid/1-s2.0-S0926860X18305167-mmc1.docx?httpAccept=%2A%2F%2A",
            "@multimediatype": "Microsoft Word file",
            "@type": "APPLICATION",
            "@size": "1192664",
            "@ref": "mmc1",
            "@mimetype": "application/word"
          },
          {
            "@category": "standard",
            "@_fa": "true",
            "$": "https://api.elsevier.com/content/object/eid/1-s2.0-S0926860X18305167-am.pdf?httpAccept=%2A%2F%2A",
            "@multimediatype": "Acrobat PDF file",
            "@type": "AAM-PDF",
            "@size": "4251693",
            "@ref": "am",
            "@mimetype": "application/pdf"
          }
        ]
      },
      "link": {
        "@rel": "abstract",
        "@href": "https://api.elsevier.com/content/abstract/scopus_id/85055867691"
      }
    }
  }
}