{
  "metadata": {
    "title": "Ammonia synthesis over Cs- or Ba-promoted ruthenium catalyst supported on strontium niobate",
    "authors": "; ; ",
    "journal": "Applied Catalysis A: General",
    "date": "2018-03-25",
    "doi": "10.1016/j.apcata.2018.01.006",
    "abstract": "",
    "uri": "https://api.elsevier.com/content/article/pii/S0926860X18300140",
    "pii": "S0926860X18300140"
  },
  "fulltext": {
    "full-text-retrieval-response": {
      "scopus-eid": "2-s2.0-85041490911",
      "originalText": "serial JL 271346 291210 291744 291809 31 Applied Catalysis A: General APPLIEDCATALYSISAGENERAL 2018-02-04 2018-02-04 2018-02-04 2018-02-04 2018-02-22T00:54:40 1-s2.0-S0926860X18300140 S0926-860X(18)30014-0 S0926860X18300140 10.1016/j.apcata.2018.01.006 S300 S300.1 FULL-TEXT 1-s2.0-S0926860X18X00039 2024-01-01T12:31:47.592716Z 0 0 20180325 2018 2018-02-04T22:09:29.567907Z absattachment articleinfo articletitlenorm authfirstinitialnorm authfirstsurnamenorm cid cids contenttype copyright crossmark dateloaded dateloadedtxt datesearch datesort dateupdated dco docsubtype doctype doi eid ewtransactionid hubeid indexeddate issn issnnorm itemstage itemtransactionid itemweight openaccess openarchive pg pgfirst pglast pii piinorm pubdatestart pubdatetxt pubyr sortorder srctitle srctitlenorm srctype ssids alllist content subj subheadings suppl tomb volfirst volissue volumelist webpdf webpdfpagecount yearnav figure table e-component body mmlmath acknowledge affil appendices articletitle auth authfirstini authfull authkeywords authlast grantnumber grantsponsor grantsponsorid highlightsabst primabst ref specialabst 0926-860X 0926860X true 554 554 C Volume 554 2 1 9 1 9 20180325 25 March 2018 2018-03-25 2018 article fla © 2018 Elsevier B.V. All rights reserved. AMMONIASYNTHESISOVERCSBAPROMOTEDRUTHENIUMCATALYSTSUPPORTEDSTRONTIUMNIOBATE CHEN M 1 Introduction 2 Experimental 2.1 Preparation of Sr2Nb2O7 support 2.2 Preparation of supported Ru catalyst 2.3 Ammonia synthesis 2.4 Characterization 3 Results and discussion 3.1 Effect of Sr/Nb molar ratio on the morphology of strontium niobate samples 3.2 Catalytic activity of Ru/Sr2Nb2O7 3.3 Catalytic activity of Ba- or Cs-promoted Ru/Sr2Nb2O7 3.4 Catalytic stability of Ba- or Cs-Ru/Sr2Nb2O7 4 Conclusions Acknowledgements Appendix A Supplementary data References KIMBALL 2017 S MINERALCOMMODITYSUMMARIES ERISMAN 2008 636 639 J FRYUK 2004 498 499 M 2017 IOWAENERGYCENTERNH3FUEL SCHUTH 2012 6278 6289 F WANG 2013 9907 9917 W GAMBAROTTA 2004 5298 5308 S POOL 2004 527 530 A NIELSEN 1968 280 281 A SCHUTZE 1994 195 214 J CHERKASOV 2015 24 33 N SZMIGIEL 2002 205 212 D YOU 2007 321 331 Z YANGA 2010 867 870 X KAROLEWSKAA 2012 280 286 M HELLMANA 2009 1731 1739 A SATO 2017 674 679 K FORNI 1999 269 275 L KOWALCZYK 1998 153 160 Z GOETHEL 1988 220 226 P KOWALCZYK 1996 403 409 Z AIKA 1992 126 140 K IZUMI 1995 10336 10345 Y MUHLER 1996 317 326 M ROSOWSKI 1997 443 460 F BIELAWA 2001 1061 1063 H SIPORIN 2004 315 322 S AIKA 1985 296 304 K AIKA 1986 57 68 K MURATA 1992 110 117 S MURATA 1992 118 125 S MIYAZAKI 2001 364 371 A FERNANDEZA 2014 194 202 C BECUE 1998 129 137 T MCCLAINE 2000 105 116 B MCCLAINE 2002 379 386 B KITANO 2012 934 940 M INOUE 2014 674 680 Y KITANO 2015 6731 M KOBAYASHI 2017 47 50 Y NIWA 1996 138 142 Y AIKA 1972 424 431 K HINRICHSEN 1999 177 188 O TRUSZKIEWICZ 2009 181 190 E SONG 2004 8576 8584 Z INOUE 2016 7577 7584 Y AIKA 1985 305 311 K LIANG 2010 1446 1448 S CHO 2010 2447 2450 I MUTHURAJAN 2008 892 894 H XIE 2015 3430 3433 S LIN 2008 1329 1331 B FAN 2013 3277 3287 W BETTA 1974 57 60 R BORODZINSKI 1997 5613 5620 A HAVELIA 2013 5434 5441 S HANSEN 2002 7 12 T RAROGPILECKA 2005 11 19 W CHENX2018X1 CHENX2018X1X9 CHENX2018X1XM CHENX2018X1X9XM 2020-02-04T00:00:00.000Z UnderEmbargo http://creativecommons.org/licenses/by-nc-nd/4.0/ © 2018 Elsevier B.V. All rights reserved. item S0926-860X(18)30014-0 S0926860X18300140 1-s2.0-S0926860X18300140 10.1016/j.apcata.2018.01.006 271346 2024-01-01T12:31:47.592716Z 2018-03-25 1-s2.0-S0926860X18300140-main.pdf https://s3-eu-west-1.amazonaws.com/prod-ucs-content-store-eu-west/content/pii:S0926860X18300140/MAIN/application/pdf/24c065b86a2b94c231c95642911faca9/main.pdf https://s3.amazonaws.com/prod-ucs-content-store-us-east/content/pii:S0926860X18300140/MAIN/application/pdf/24c065b86a2b94c231c95642911faca9/main.pdf main.pdf pdf true 1330297 MAIN 9 1-s2.0-S0926860X18300140-main_1.png https://s3-eu-west-1.amazonaws.com/prod-ucs-content-store-eu-west/content/pii:S0926860X18300140/PREVIEW/image/png/582c74ed60e1ab7c99f7bd6b856451cb/main_1.png https://s3.amazonaws.com/prod-ucs-content-store-us-east/content/pii:S0926860X18300140/PREVIEW/image/png/582c74ed60e1ab7c99f7bd6b856451cb/main_1.png main_1.png png 55284 849 656 IMAGE-WEB-PDF 1 1-s2.0-S0926860X18300140-fx1.sml https://s3-eu-west-1.amazonaws.com/prod-ucs-content-store-eu-west/content/pii:S0926860X18300140/fx1/THUMBNAIL/image/gif/7c7e0a5a0d31321477bd9a314454b560/fx1.sml https://s3.amazonaws.com/prod-ucs-content-store-us-east/content/pii:S0926860X18300140/fx1/THUMBNAIL/image/gif/7c7e0a5a0d31321477bd9a314454b560/fx1.sml fx1 true fx1.sml sml 5476 164 139 IMAGE-THUMBNAIL 1-s2.0-S0926860X18300140-gr1.sml https://s3-eu-west-1.amazonaws.com/prod-ucs-content-store-eu-west/content/pii:S0926860X18300140/gr1/THUMBNAIL/image/gif/bee2e9357fe0907187b897ef0502a04e/gr1.sml https://s3.amazonaws.com/prod-ucs-content-store-us-east/content/pii:S0926860X18300140/gr1/THUMBNAIL/image/gif/bee2e9357fe0907187b897ef0502a04e/gr1.sml gr1 gr1.sml sml 6376 163 133 IMAGE-THUMBNAIL 1-s2.0-S0926860X18300140-gr2.sml https://s3-eu-west-1.amazonaws.com/prod-ucs-content-store-eu-west/content/pii:S0926860X18300140/gr2/THUMBNAIL/image/gif/33a9183bc64cde5403d45aca4ce92bd3/gr2.sml https://s3.amazonaws.com/prod-ucs-content-store-us-east/content/pii:S0926860X18300140/gr2/THUMBNAIL/image/gif/33a9183bc64cde5403d45aca4ce92bd3/gr2.sml gr2 gr2.sml sml 16407 164 145 IMAGE-THUMBNAIL 1-s2.0-S0926860X18300140-gr3.sml https://s3-eu-west-1.amazonaws.com/prod-ucs-content-store-eu-west/content/pii:S0926860X18300140/gr3/THUMBNAIL/image/gif/00215019942c53460f9dcdf9ef5d2729/gr3.sml https://s3.amazonaws.com/prod-ucs-content-store-us-east/content/pii:S0926860X18300140/gr3/THUMBNAIL/image/gif/00215019942c53460f9dcdf9ef5d2729/gr3.sml gr3 gr3.sml sml 3334 163 152 IMAGE-THUMBNAIL 1-s2.0-S0926860X18300140-gr4.sml https://s3-eu-west-1.amazonaws.com/prod-ucs-content-store-eu-west/content/pii:S0926860X18300140/gr4/THUMBNAIL/image/gif/a185f46d6c254851ec8ac29b57689634/gr4.sml https://s3.amazonaws.com/prod-ucs-content-store-us-east/content/pii:S0926860X18300140/gr4/THUMBNAIL/image/gif/a185f46d6c254851ec8ac29b57689634/gr4.sml gr4 gr4.sml sml 13848 164 156 IMAGE-THUMBNAIL 1-s2.0-S0926860X18300140-gr5.sml https://s3-eu-west-1.amazonaws.com/prod-ucs-content-store-eu-west/content/pii:S0926860X18300140/gr5/THUMBNAIL/image/gif/782264c280470e4955b58224582e556e/gr5.sml https://s3.amazonaws.com/prod-ucs-content-store-us-east/content/pii:S0926860X18300140/gr5/THUMBNAIL/image/gif/782264c280470e4955b58224582e556e/gr5.sml gr5 gr5.sml sml 4163 120 219 IMAGE-THUMBNAIL 1-s2.0-S0926860X18300140-gr6.sml https://s3-eu-west-1.amazonaws.com/prod-ucs-content-store-eu-west/content/pii:S0926860X18300140/gr6/THUMBNAIL/image/gif/4d4ee8cce1d6e01ab836a9426e41a511/gr6.sml https://s3.amazonaws.com/prod-ucs-content-store-us-east/content/pii:S0926860X18300140/gr6/THUMBNAIL/image/gif/4d4ee8cce1d6e01ab836a9426e41a511/gr6.sml gr6 gr6.sml sml 8867 129 219 IMAGE-THUMBNAIL 1-s2.0-S0926860X18300140-fx1.jpg https://s3-eu-west-1.amazonaws.com/prod-ucs-content-store-eu-west/content/pii:S0926860X18300140/fx1/DOWNSAMPLED/image/jpeg/dd98c7383df0cf82afa439d33f88b8b5/fx1.jpg https://s3.amazonaws.com/prod-ucs-content-store-us-east/content/pii:S0926860X18300140/fx1/DOWNSAMPLED/image/jpeg/dd98c7383df0cf82afa439d33f88b8b5/fx1.jpg fx1 true fx1.jpg jpg 10805 245 208 IMAGE-DOWNSAMPLED 1-s2.0-S0926860X18300140-gr1.jpg https://s3-eu-west-1.amazonaws.com/prod-ucs-content-store-eu-west/content/pii:S0926860X18300140/gr1/DOWNSAMPLED/image/jpeg/0560a04dd1eb45adbb01e326849e2207/gr1.jpg https://s3.amazonaws.com/prod-ucs-content-store-us-east/content/pii:S0926860X18300140/gr1/DOWNSAMPLED/image/jpeg/0560a04dd1eb45adbb01e326849e2207/gr1.jpg gr1 gr1.jpg jpg 35679 416 339 IMAGE-DOWNSAMPLED 1-s2.0-S0926860X18300140-gr2.jpg https://s3-eu-west-1.amazonaws.com/prod-ucs-content-store-eu-west/content/pii:S0926860X18300140/gr2/DOWNSAMPLED/image/jpeg/48e631b54f8e13578a63f4576c1609bd/gr2.jpg https://s3.amazonaws.com/prod-ucs-content-store-us-east/content/pii:S0926860X18300140/gr2/DOWNSAMPLED/image/jpeg/48e631b54f8e13578a63f4576c1609bd/gr2.jpg gr2 gr2.jpg jpg 194536 766 678 IMAGE-DOWNSAMPLED 1-s2.0-S0926860X18300140-gr3.jpg https://s3-eu-west-1.amazonaws.com/prod-ucs-content-store-eu-west/content/pii:S0926860X18300140/gr3/DOWNSAMPLED/image/jpeg/530d46095cbb246580959a3afd35423f/gr3.jpg https://s3.amazonaws.com/prod-ucs-content-store-us-east/content/pii:S0926860X18300140/gr3/DOWNSAMPLED/image/jpeg/530d46095cbb246580959a3afd35423f/gr3.jpg gr3 gr3.jpg jpg 13662 364 339 IMAGE-DOWNSAMPLED 1-s2.0-S0926860X18300140-gr4.jpg https://s3-eu-west-1.amazonaws.com/prod-ucs-content-store-eu-west/content/pii:S0926860X18300140/gr4/DOWNSAMPLED/image/jpeg/6dd1bd0577eb2193ff5f12c6218afc2d/gr4.jpg https://s3.amazonaws.com/prod-ucs-content-store-us-east/content/pii:S0926860X18300140/gr4/DOWNSAMPLED/image/jpeg/6dd1bd0577eb2193ff5f12c6218afc2d/gr4.jpg gr4 gr4.jpg jpg 158287 711 678 IMAGE-DOWNSAMPLED 1-s2.0-S0926860X18300140-gr5.jpg https://s3-eu-west-1.amazonaws.com/prod-ucs-content-store-eu-west/content/pii:S0926860X18300140/gr5/DOWNSAMPLED/image/jpeg/8b302ac915f2e682771da381b36abd12/gr5.jpg https://s3.amazonaws.com/prod-ucs-content-store-us-east/content/pii:S0926860X18300140/gr5/DOWNSAMPLED/image/jpeg/8b302ac915f2e682771da381b36abd12/gr5.jpg gr5 gr5.jpg jpg 30364 372 678 IMAGE-DOWNSAMPLED 1-s2.0-S0926860X18300140-gr6.jpg https://s3-eu-west-1.amazonaws.com/prod-ucs-content-store-eu-west/content/pii:S0926860X18300140/gr6/DOWNSAMPLED/image/jpeg/86ad98118eecbeedfe13e4ee862f5b7b/gr6.jpg https://s3.amazonaws.com/prod-ucs-content-store-us-east/content/pii:S0926860X18300140/gr6/DOWNSAMPLED/image/jpeg/86ad98118eecbeedfe13e4ee862f5b7b/gr6.jpg gr6 gr6.jpg jpg 58424 399 678 IMAGE-DOWNSAMPLED 1-s2.0-S0926860X18300140-fx1_lrg.jpg https://s3-eu-west-1.amazonaws.com/prod-ucs-content-store-eu-west/content/pii:S0926860X18300140/fx1/HIGHRES/image/jpeg/a1dd16ddec0276f7a5cb32ae84ba1b5f/fx1_lrg.jpg https://s3.amazonaws.com/prod-ucs-content-store-us-east/content/pii:S0926860X18300140/fx1/HIGHRES/image/jpeg/a1dd16ddec0276f7a5cb32ae84ba1b5f/fx1_lrg.jpg fx1 true fx1_lrg.jpg jpg 77913 1085 922 IMAGE-HIGH-RES 1-s2.0-S0926860X18300140-gr1_lrg.jpg https://s3-eu-west-1.amazonaws.com/prod-ucs-content-store-eu-west/content/pii:S0926860X18300140/gr1/HIGHRES/image/jpeg/7587780c9ebde223098b917b025ec465/gr1_lrg.jpg https://s3.amazonaws.com/prod-ucs-content-store-us-east/content/pii:S0926860X18300140/gr1/HIGHRES/image/jpeg/7587780c9ebde223098b917b025ec465/gr1_lrg.jpg gr1 gr1_lrg.jpg jpg 274654 1842 1500 IMAGE-HIGH-RES 1-s2.0-S0926860X18300140-gr2_lrg.jpg https://s3-eu-west-1.amazonaws.com/prod-ucs-content-store-eu-west/content/pii:S0926860X18300140/gr2/HIGHRES/image/jpeg/f300be4a1f84d7ebd47260ac48367b87/gr2_lrg.jpg https://s3.amazonaws.com/prod-ucs-content-store-us-east/content/pii:S0926860X18300140/gr2/HIGHRES/image/jpeg/f300be4a1f84d7ebd47260ac48367b87/gr2_lrg.jpg gr2 gr2_lrg.jpg jpg 2166943 3388 3000 IMAGE-HIGH-RES 1-s2.0-S0926860X18300140-gr3_lrg.jpg https://s3-eu-west-1.amazonaws.com/prod-ucs-content-store-eu-west/content/pii:S0926860X18300140/gr3/HIGHRES/image/jpeg/fe57d4042eaac6b6aecc3832cff5d64e/gr3_lrg.jpg https://s3.amazonaws.com/prod-ucs-content-store-us-east/content/pii:S0926860X18300140/gr3/HIGHRES/image/jpeg/fe57d4042eaac6b6aecc3832cff5d64e/gr3_lrg.jpg gr3 gr3_lrg.jpg jpg 102552 1611 1500 IMAGE-HIGH-RES 1-s2.0-S0926860X18300140-gr4_lrg.jpg https://s3-eu-west-1.amazonaws.com/prod-ucs-content-store-eu-west/content/pii:S0926860X18300140/gr4/HIGHRES/image/jpeg/754d584f30e3838d9c6b9e261a352b0e/gr4_lrg.jpg https://s3.amazonaws.com/prod-ucs-content-store-us-east/content/pii:S0926860X18300140/gr4/HIGHRES/image/jpeg/754d584f30e3838d9c6b9e261a352b0e/gr4_lrg.jpg gr4 gr4_lrg.jpg jpg 2336998 3147 3000 IMAGE-HIGH-RES 1-s2.0-S0926860X18300140-gr5_lrg.jpg https://s3-eu-west-1.amazonaws.com/prod-ucs-content-store-eu-west/content/pii:S0926860X18300140/gr5/HIGHRES/image/jpeg/b23c6bd5c11e7a7c51184da71684dad8/gr5_lrg.jpg https://s3.amazonaws.com/prod-ucs-content-store-us-east/content/pii:S0926860X18300140/gr5/HIGHRES/image/jpeg/b23c6bd5c11e7a7c51184da71684dad8/gr5_lrg.jpg gr5 gr5_lrg.jpg jpg 236288 1645 3000 IMAGE-HIGH-RES 1-s2.0-S0926860X18300140-gr6_lrg.jpg https://s3-eu-west-1.amazonaws.com/prod-ucs-content-store-eu-west/content/pii:S0926860X18300140/gr6/HIGHRES/image/jpeg/ecd6d2221f4d662f46401c3ba537be9c/gr6_lrg.jpg https://s3.amazonaws.com/prod-ucs-content-store-us-east/content/pii:S0926860X18300140/gr6/HIGHRES/image/jpeg/ecd6d2221f4d662f46401c3ba537be9c/gr6_lrg.jpg gr6 gr6_lrg.jpg jpg 532694 1764 3000 IMAGE-HIGH-RES 1-s2.0-S0926860X18300140-mmc1.docx https://s3-eu-west-1.amazonaws.com/prod-ucs-content-store-eu-west/content/pii:S0926860X18300140/mmc1/MAIN/application/vnd.openxmlformats-officedocument.wordprocessingml.document/573054b96bdf5c39c58d91a8bbbad10d/mmc1.docx https://s3.amazonaws.com/prod-ucs-content-store-us-east/content/pii:S0926860X18300140/mmc1/MAIN/application/vnd.openxmlformats-officedocument.wordprocessingml.document/573054b96bdf5c39c58d91a8bbbad10d/mmc1.docx mmc1 mmc1.docx docx 1601540 APPLICATION 1-s2.0-S0926860X18300140-si1.gif https://s3-eu-west-1.amazonaws.com/prod-ucs-content-store-eu-west/content/pii:S0926860X18300140/STRIPIN/image/gif/47f7859796cf545b2ad6ecb4be6d5d81/si1.gif https://s3.amazonaws.com/prod-ucs-content-store-us-east/content/pii:S0926860X18300140/STRIPIN/image/gif/47f7859796cf545b2ad6ecb4be6d5d81/si1.gif si1 si1.gif gif 1223 37 107 ALTIMG 1-s2.0-S0926860X18300140-si2.gif https://s3-eu-west-1.amazonaws.com/prod-ucs-content-store-eu-west/content/pii:S0926860X18300140/STRIPIN/image/gif/fdb7807a6a2bd40f843a280308eab95e/si2.gif https://s3.amazonaws.com/prod-ucs-content-store-us-east/content/pii:S0926860X18300140/STRIPIN/image/gif/fdb7807a6a2bd40f843a280308eab95e/si2.gif si2 si2.gif gif 1082 37 81 ALTIMG 1-s2.0-S0926860X18300140-si3.gif https://s3-eu-west-1.amazonaws.com/prod-ucs-content-store-eu-west/content/pii:S0926860X18300140/STRIPIN/image/gif/d4786bedccc4528cf654d0111917d488/si3.gif https://s3.amazonaws.com/prod-ucs-content-store-us-east/content/pii:S0926860X18300140/STRIPIN/image/gif/d4786bedccc4528cf654d0111917d488/si3.gif si3 si3.gif gif 1247 45 99 ALTIMG 1-s2.0-S0926860X18300140-si4.gif https://s3-eu-west-1.amazonaws.com/prod-ucs-content-store-eu-west/content/pii:S0926860X18300140/STRIPIN/image/gif/bbb716e98ac60c088469b61eb4c042d0/si4.gif https://s3.amazonaws.com/prod-ucs-content-store-us-east/content/pii:S0926860X18300140/STRIPIN/image/gif/bbb716e98ac60c088469b61eb4c042d0/si4.gif si4 si4.gif gif 1147 37 99 ALTIMG APCATA 16513 S0926-860X(18)30014-0 10.1016/j.apcata.2018.01.006 Elsevier B.V. Fig. 1 XRD patterns of strontium niobate samples prepared by a hydrothermal reaction at 473 K for 24 h with different molar ratio of Sr/Nb: (a) Sr/Nb = 0.5, (b) Sr/Nb = 1.0, (c) Sr/Nb = 1.5, (d) Sr/Nb = 2.0, (e) Sr/Nb = 2.5, and (f) Sr/Nb = 3.0. ♦: Sr2Nb2O7, ↓:SrNb2O6, ●:Nb2O5. Fig. 1 Fig. 2 SEM images of strontium niobate samples prepared by a hydrothermal reaction at 473 K for 24 h with different molar ratio of Sr/Nb: (a) Sr/Nb = 0.5, (b) Sr/Nb = 1.0, (c) Sr/Nb = 1.5, (d) Sr/Nb = 2.0, (e) Sr/Nb = 2.5, and (f) Sr/Nb = 3.0. Fig. 2 Fig. 3 Ammonia synthesis rate over 2 wt% Ru catalyst supported on strontium niobates prepared with different nominal molar ratio of Sr/Nb. Reaction conditions: prior to activity tests, the catalysts (100.0 mg) were reduced in a H2 flow of 15 mL min−1 at 573 K for 3 h; the activities were tested in 60 mL (STP) min−1 synthesis gas (3H2 + N2, 99.999%) at 673 K and 0.1 MPa. Fig. 3 Fig. 4 (a) TEM image of 2 wt%Ru/2.0SrNb, (b) size distribution of Ru crystallites of 2 wt%Ru/2.0SrNb, the average Ru crystallite size (d) = 1.37 nm, standard deviation (σ) = 0.20 (c) TEM image of 4Ba-2 wt%Ru/2.0SrNb, and (d) TEM image of 8Cs-2 wt%Ru/2.0SrNb. Prior to TEM observations, the catalysts were reduced in synthesis gas (3H2 + N2, 60 mL (STP) min−1) at their corresponding optimal activation temperature: 573 K (2 wt%Ru/2.0SrNb), 773 K (4Ba-2 wt%Ru/2.0SrNb), and 673 K (8Cs-2 wt%Ru/2.0SrNb) for 3 h. Fig. 4 Fig. 5 NH3 synthesis rate over (a) 4Ba-2 wt%Ru/2.0SrNb and (b) 8Cs-2 wt%Ru/2.0SrNb as a function of time on stream. Reaction conditions: 100.0 mg catalyst, 60 mL (STP) min−1 synthesis gas (3H2 + N2), 673 K, 0.1 MPa. Fig. 5 Fig. 6 XRD patterns of (a) 4Ba-2 wt%Ru/2.0SrNb and (b) 8Cs-2 wt%Ru/2.0SrNb measured at different phases: as-prepared (fresh), after activity tests (used), and after stability tests (aged). Reaction conditions: 100.0 mg catalyst, 60 mL (STP) min−1 synthesis gas (3H2 + N2), 0.1MPa. ♦: Sr2Nb2O7, ∇: Ba(NO3)2,↓: CsNO3, and ◊: CsOH. Fig. 6 Table 1 Molar ratio of Sr/Nb analyzed by ICP and BET specific surface area of the strontium niobate products synthesized with different nominal molar ratio of Sr/Nb. Table 1 Sample Nominal Sr/Nb Measued Sr/Nb BET surface area (mole mole−1) (mole mole−1) (m2 g−1) 0.5SrNb 0.5 0.53 11 1.0SrNb 1.0 0.98 72 1.5SrNb 1.5 1.01 83 2.0SrNb 2.0 1.03 87 2.5SrNb 2.5 1.04 97 3.0SrNb 3.0 1.04 97 Table 2 Ammonia synthesis rate and BET surface area of 2 wt%Ru/2.0SrNb (Sr2Nb2O7) catalysts promoted by barium or cesium. Table 2 Catalyst BET surface area (m2 g−1) NH3 synthesis rate ( μ m o l g cat -1 h -1 ) 623 K 673 K 723 K Ru/2.0SrNb 83 48 239 574 1Ba-Ru/2.0SrNb 75 177 246 1510 2Ba-Ru/2.0SrNb 68 76 631 2885 4Ba-Ru/2.0SrNb 52 154 1279 3585 8Ba-Ru/2.0SrNb 32 105 868 3031 1Cs-Ru/2.0SrNb 81 223 281 508 2Cs-Ru/2.0SrNb 70 58 300 838 4Cs-Ru/2.0SrNb 45 337 1721 3526 8Cs-Ru/2.0SrNb 26 856 4170 4889 12Cs-Ru/2.0SrNb 15 683 2725 3498 Ammonia synthesis conditions: 100.0 mg catalyst, 60 mL (STP) min−1 synthesis gas (3H2 + N2, 99.999%), 0.1 MPa. Prior to activity tests, the catalysts were activated at 573 K for 3 h in 60 mL (STP) min−1 synthesis gas (3H2 + N2, 99.999%). Each rate of ammonia synthesis was determined over 30 min after 30-min stabilization under given conditions. Values before the promoter in the catalyst names are the molar ratios of Ba or Cs to Ru. Table 3 Ammonia synthesis rate over 4Ba-2 wt%Ru/2.0SrNb activated at different temperatures in synthesis gas (3H2 + N2, 60 mL (STP) min−1) for 3 h. Table 3 Activation temperature (K) NH3 synthesis rate at 0.1 MPa ( μ m o l g cat -1 h -1 ) 623 K 673 K 723 K 573 154 1279 3585 673 392 2265 4006 723 384 2295 4206 773 421 2317 3972 873 299 1801 3768 Table 4 Ammonia synthesis rate over 8Cs-2wt%Ru/2.0SrNb activated at different temperatures in synthesis gas (3H2 + N2, 60 mL (STP) min−1) for 3 h. Table 4 Activation temperature (K) NH3 synthesis rate at 0.1 MPa ( μ m o l g cat -1 h -1 ) 623 K 673 K 723 K 573 856 4170 4889 673 1060 4986 4912 723 825 4365 5035 873 397 2456 4290 Table 5 Results of H2-chemisorption over 2 wt%Ru/2.0SrNb catalysts. Table 5 Catalyst Activation temp. (K) H2 uptake ( μ m o l g cat -1 ) H/Ru (%) Ru crystallite size (nm) Ru/2.0SrNb 573 82.2 92.9 1.4 Ru/2.0SrNb 673 56.1 72.8 1.8 Ru/2.0SrNb 773 47.8 62.1 2.1 Ru/2.0SrNb 873 9.2 11.1 11.6 4Ba-Ru/2.0SrNb 773 5.3 5.3 24.3 8Cs-Ru/2.0SrNb 673 1.4 1.4 90.8 The crystallite size of Ru was calculated according to the equation [55]: d V A = 6 ∙ v m a m ∙ D , for Ru, Vm  = 13.65Å3, am  = 6.35 Å2, dVA : average diameter, D: dispersion of Ru on supports. Table 6 TOF for ammonia formation over Ba or Cs promoted 2 wt%Ru/2.0SrNb catalysts. Table 6 Catalyst Activation temp. H/Ru TOF × 104 (s−1) (K) (%) 623 K 673 K 723 K Ru/2.0SrNb 773 62.1 2.4 12.3 34.5 2Ba-Ru/2.0SrNb 773 (62.1) 4.7 19.4 67.8 4Ba-Ru/2.0SrNb 773 (62.1) 9.5 52.4 89.8 8Ba-Ru/2.0SrNb 773 (62.1) 6.2 36.0 79.2 Ru/2.0SrNb 673 72.8 2.1 10.5 29.4 4Cs-Ru/2.0SrNb 673 (72.8) 9.1 53.4 91.1 8Cs-Ru/2.0SrNb 673 (72.8) 20.4 96.2 94.8 12Cs-Ru/2.0SrNb 673 (72.8) 9.6 56.8 93.4 Note: Dispersion value obtained via H2-pulse titration method over unpromoted 2 wt%Ru/2.0SrNb catalyst activated at 673 or 773 K was used respectively for Cs or Ba-promoted catalysts becaue the Cs or Ba promoters were found to cover Ru crystallites under H2-pulse titration conditions. Table 7 Comparison of ammonia synthesis activity (0.1 MPa, 673K) over Ru catalyst supported on different substrates. Table 7 Catalysts Ru loading (%) Dispersion (%) TOF (s−1) NH3 synthesis rate (μmol g−1 cat h−1) NH3 synthesis rate (mmol g−1 Ru h−1) Reference Ba-Ru/Sr2Nb2O7 2 62.1 0.0052 2317 116 This work Cs-Ru/ Sr2Nb2O7 2 72.8 0.0096 4986 250 This work Ba-Ru/AC 1 25.2 0.003 148 15 [37] Ba-Ru/AC 9.1 14.3 0.003 2228 25 [37] Cs-Ru/MgO 1 50.3 0.013 2264 226 [37] Cs-Ru/MgO 6 18.6 0.008 3353 56 [37] Ru/C12A7:e- 1.2 3.2 0.197 2757 230 [37] Ru/C12A7:e- 4 2 0.076 2122 53 [37] Ru/Pr2O3 5 17 0.050 3600 72 [17] Table 8 BET specific surface area of 4Ba or 8Cs-2 wt%Ru/Sr2Nb2O7 catalyst measured at different phases. Table 8 Catalyst BET surface area (m2 g−1) Fresh Used Aged 4Ba-2 wt%Ru/Sr2Nb2O7 52 51 52 8Cs-2 wt%Ru/Sr2Nb2O7 26 29 31 Ammonia synthesis over Cs- or Ba-promoted ruthenium catalyst supported on strontium niobate Minxuan Chen a b Mingwei Yuan a b Jinjun Li a Zhixiong You a b ⁎ a School of Resources and Environmental Sciences, Wuhan University, Wuhan 430079, PR China School of Resources and Environmental Sciences Wuhan University Wuhan 430079 PR China b International Cooperation Base for Sustainable Utilization of Resources and Energy in Hubei Province, Wuhan 430072, PR China International Cooperation Base for Sustainable Utilization of Resources and Energy in Hubei Province Wuhan 430072 PR China ⁎ Corresponding author. Graphical abstract Strontium niobates with different crystalline structure and morphology have been prepared via a hydrothermal method and applied as a support for ruthenium catalyst in ammonia synthesis. The sample synthesized with a nominal Sr/Nb = 2.0, having a pure Sr2Nb2O7 crystalline phase and specific surface area of 87 m2 g−1, exhibits the best performance as support for Ru catalyst. The flake-structured Sr2Nb2O7 substrate induced epitaxial growth of truncated pyramid shaped ruthenium nanoparticles with a dispersion as high as 93%, which have abundant steps and B5 sites playing a key role in ammonia synthesis catalysis. Adding Cs- or Ba-promoter enhanced the activity of Ru/Sr2Nb2O7 catalyst drastically. The highest ammonia synthesis rate over 8Cs- or 4Ba-2 wt%Ru/Sr2Nb2O7 was 4986 and 2317 (μmol g−1 cat h−1) at 0.1 MPa and 673 K, respectively. In addition, both catalysts were stable over reaction for 72 h at 673 K and 0.1 MPa. Thus, the synthesized Sr2Nb2O7 is expected to be a practically promising oxide support for ruthenium ammonia synthesis catalsyts. Keywords Ammonia synthesis Ruthenium catalysts Strontium niobate Cs-promotion Ba-promotion 1 Introduction Ammonia is an important commodity chemical manufactured globally at a scale of 170 million metric tons per year in 2016 [1]. So far, more than 80% of the synthesized ammonia is utilized to produce fertilizers for food crop’s growth [2]. Thus, ammonia synthesis is an effective artificial nitrogen-fixation technique, which supplies 40–60% of nitrogen source for human bodies [3]. Additionally, ammonia is recently attracting extensive research interests as a potential carrier for renewable energies or hydrogen due to its characteristics of (1) carbon-free, (2) high hydrogen content (17.8 wt %), (3) easy liquification (0.86 MPa at 293 K or 239.7 K at 0.1 MPa) and (4) mature technologies and infrastructures for production, transportation and storage [4–6]. Currently, ammonia is mainly synthesized from N2 and H2 via Haber-Bosch process using fused iron (Fe-Al2O3-K2O) catalysts. Since dinitrogen molecule has extremely high dissociation energy (945 kJ mol−1) [7,8] of its triple bond, the Haber-Bosch process must be operated at high temperatures (673–873 K) and high pressures (20–40 MPa) to achieve a reasonable performance [9,10]. Due to such stringent operational conditions, the Haber-Bosch synthesis becomes one of the most energy-intensive industrialized processes; it is estimated to consume approximately 1% of the world’s power production [11]. Moreover, the H2 feed of the present ammonia synthesis plants are mostly obtained from steam reforming of natural gas (one type of fossile resource), which is unsustainable and will be substituted by renewable H2 souceses, such as biomass gasification or water electrolysis (electricity is generated from renewable energies). These renewable low-pressure H2 sources are relatively dispersive, which demands catalysts that are more efficient to accelerate ammonia synthesis at milder reaction conditions. For these reasons, searching for noval catalysts that have reasonable performance at moderate reaction conditions is one of the key challenges for promoting the traditional Haber-Bosch process and for applying ammonia as a carrier for sustainable energies or hydrogen in the future. Ruthenium-based catalysts have been extensively investigated as the second-generation ammonia synthesis catalysts because they exhibit higher activity at mild reaction conditions and less sensitivity to NH3 concentration in gas phase as compared to the traditional fused iron catalysts [12–17]. Ru catalysts supported on high surface area graphite (HSAG) have been industrially applied in the KBR advanced ammonia synthesis process (KAAP) since 1992 [18]. However, carbon supports react readily with H2 to form methane at ammonia synthesis conditions in the presence of Ru. Methanation in this manner causes gradual degradation of the carbon support, limiting the lifetime of Ru/C catalyst [19–21]. It is thus still of importance to find a suitable oxide support for ruthenium catalyst. So far, a variety of metal oxides, such as MgO [22–27], Al2O3 [28–33],Co3O4 [15],barium hexaaluminate [13], zeolite [34–36], mayenite electride [37–40], Pr2O3 [17], CeO2 [41] and etc., have been proposed as supports for Ru ammonia synthesis catalysts. Among these oxides, magnesia, barium hexaaluminate, praseodymium oxide and electride are currently promising oxide supports for Ru catalysts due to their electronic and/or structural promotion to the activity of Ru nanoparticles for ammonia synthesis [13,17,37,42]. However, the high reactivity to H2O of MgO and electride inhibit their widespread use in industry. The rate-determing step in ammonia synthesis is dissociation of N2 molecules on the surface of Ru crystallites [29,43]. The dissociation rate has been reported to depend significantly on the morphology (size and shape) and electronic state of Ru crystallites, which can be modified by the supports and/or promoters [44,45]. Previous studies have proved that: (1) flat Ru crystallites epitaxially grown on layered substrates show better performance than round Ru particles because more abundant B5 sites can be found on the surface of the former [13,45,46]; and (2) compounds such as alkali, alkaline earth, or electrides that can donate electrons to Ru metal, resulting in a decreased ionization potential of Ru, thereby allowing electron transfers from the metal to the antibonding orbitals of the N atom and reducing the activation energy for the dissociative adsorption of N2 molecules [47]. Therefore, an ideal support for Ru catalysts should modify the shape and size of Ru crystallites to achieve abundant B5 sites on their surface and have ability to donate electron to Ru metallic atoms. Rencently, strontium niobates are widely investigated as photocatalyts because they have special optical, ferroelectric and piezoelectric properties [48–51]. It has been reported that the morphology of strontium niobates can be tailored by changing synthetic parameters during preparation [52]. Based on the previous knowledge, we expect that niobates with layered structure may influence the shape and size of Ru crystallites and thus work as promising supports for Ru catalysts. Herein, we demonstrate that Ba- or Cs-promoted Ru supported on Sr2Nb2O7 substrate exhibits superior activity and stablibity for ammonia synthesis. 2 Experimental 2.1 Preparation of Sr2Nb2O7 support The Sr2Nb2O7 support was synthesized via a hydrothermal method. First, a precursor of niobium (Nb2O5·nH2O) was synthesized from NbCl5 via a hydrothermal method as previously reported work [53]. An alcohol solution of NbCl5 (0.37 mol L−1) was prepared by dissolving appropriate amount of NbCl5 (Aldrich, 99.0%) in ethanol (Sinopharm Chemical Reagent, analytical purity). Then, the pH of the solution was adjusted to around 10.5 by adding 4 wt% NH4OH aqueous solution with stirring. After 4 h-stirring at room temperature, the mixture was transferred into a Teflon-lined autoclave and treated at 473 K for 24 h. Subsequently, the solid product was recovered by centrifugation at 8000 rpm for 30 min and washed repeatedly with distilled water until the filtrate was confirmed to be free of chloride anions using AgNO3. Finally, the product was dried at 353 K under a vacuum of around 1.0 KPa. Second, the resultant Nb2O5∙nH2O and Sr(OH)2∙8H2O (aldrich, 99.5%) with different molar ratio were mixed in 45 ml distilled water. After stiring for 30 min, the pH of supernatant was in the range of 12.85–13.50; the mixture was transferred into a Teflon-lined autoclave and heated at 473 K for 24 h. The resultant product was filtered, washed thoroughly with deionized water until the pH of the filtrate was nearly 7. The product was dried in vacuum (∼ 1.0 KPa) at 353 K for 10 h. 2.2 Preparation of supported Ru catalyst Ruthenium catalysts were prepared by impregnation method. The dried Sr2Nb2O7 samples were ground with an agate morta and pestle, and dispersed in a tetrahydrofuran (THF) solution of Ru3(CO)12 (Aldrich, 99.0%) with stirring at room temperature for 12 h. Then the solvent was removed using a rotary evaporator (313 K, 10 KPa). The dried samples were treated in an Ar (99.999%) flow of 5 mL min−1 at 723 K for 3 h. The catalysts obtained had a nominal Ru loading of 2 wt%. The Cs- or Ba-promoted Ru/Sr2Nb2O7 catalysts were prepared by impregating the treated Ru/Sr2Nb2O7 samples in an aqueous solution of CsNO3 or Ba(NO3)2, respectively. 2.3 Ammonia synthesis The dried catalyst samples were gound, pelletized, crushed and sieved. The fractions from 220 to 450 μm were collected and loaded into a quartz tubular reactor (I.D. = 7 mm). Before activity measurements, the catalysts were treated in a H2 (99.999%) flow at 573–873 K for 3 h to reduce ruthenium cations to metallic state and to decompose CsNO3 or Ba(NO3)2. The catalytic activities were measured in a synthesis gas (H2/N2 = 3/1, 99.999%) flow of 60 mL (STP) min−1 over 0.10 g sample. The reaction temperature was varied from 573 to 773 K at 0.1 MPa. The produced ammonia was absorbed by a 1 × 10−3 mol L−1 solution of sulfuric acid, and the rate of ammonia formation was determined from the decreasing rate in the conductivity of the sulfuric acid solution for measurement after a 30-min stabilization at appropriate reaction conditions. 2.4 Characterization The crystalline structure of the samples was analyzed by a X-ray diffraction (XRD) technique performed on a PANalytical X’Pert Pro diffractometer equipped with a Cu-Kα radiation source (λ = 1.5405 Å). All diffraction patterns were recorded in a 2θ range of 10–70◦ at a scan speed of 2◦/min. The N2 adsorption-desorption isotherm data collected at 77.3 K using an automatic specific surface area/pore size distribution measurement apparatus (BELSORPmini II, BEL, Japan) was applied for evaluating Brunauer-Emmett-Teller (BET) surface area of the prepared samples. Pior to analysis, the samples were degassed at 473 K under 10−2 KPa for 2 h. The specific surface areas were calculated from the linear part of the BET plot where P/P0 ratios are 0.05–0.25. The content of Nb and Sr in the products were measured by an inductively coupled plasma-atomic emission spectrum (ICP-AES, IRIS Intrepid II XSP, Thermo Fisher Scientific Inc., USA). The morphology of the synthesized Sr2Nb2O7 samples was observed on a Zeiss Sigma scanning electron microscopy (SEM) at an acceleration voltage of 20 kV. The images of Ru nanocrystallites on the supports were recorded on a transmission electron microscope (TEM, JEM-2100, JEOL, Japan) at an acceleration voltage of 200 kV. The acidity of the supports was evaluated by a temperature-programmed desorption (TPD) of ammonia technique carried on a laboratoray-made flow system connected to a gas chromatograph (GC) (GC-2020, Trustworthy, China) equipped with a thermal conductivity detector (TCD). Before the desorption test, the catalyst (100.0 mg) was pretreated in a N2 (99.999%) flow of 15 mL min−1 at 773 K for 3 h, then cooled to 373 K, and finally exposed to a flow of 5 vol% NH3 (balanced by 99.999% N2) of 10 mL min−1 for 30 min, to allow the sample to reach adsorption equilibrium. The physically adsorbed ammonia molecules were then removed by purging the catalyst with a N2 (99.999%) flow of 15 mL min−1 at 373 K for 30 min. In the desorption test, the catalyst was heated from 373 to 1073 K at 10 K min−1, and the desorbed ammonia was carried in N2 flow (15 mL min−1) into the GC for quantification. The density of exposed Ru atoms on the catalysts was determined by a H2-pulse titration method performed at 323 K assuming chemisorption stoichiometry of H:Ru = 1:1 [25,54]. Before measurements, the catalyst (100.0 mg) was first reduced in a H2 (99.999%) flow of 45 mL min−1 at 573 − 823 K for 3 h, and then kept at the same temperature under a Ar (99.999%) flow of 15 mL min−1 for 1 h to remove the adsorbed H atoms on reduced samples. After cooling to 323 K under Ar, H2-pluse measurements were performed by repeatedly injecting 1.0 mL of 5 vol% H2 in N2 (one pulse) until a constant TCD signal was achieved. 3 Results and discussion 3.1 Effect of Sr/Nb molar ratio on the morphology of strontium niobate samples Fig. 1 shows the XRD patterns of the synthesized strontium niobate samples. Obviously, the molar ratio of Sr(OH)2/Nb2O5 play a key role in the formation of crystalline structure of the obtained materials. When equal amount of Sr(OH)2 and Nb2O5 (Sr/Nb = 0.5) was mixed and hydrothermally treated, SrNb2O6, Nb2O5 and Sr2Nb2O7 phases (Fig. 1a) were observed in the sample. Raising the Sr/Nb to 1.0, we obtained a sample containing mainly orthorhombic Sr2Nb2O7 phase (PDF#70-0114), the other two phases disappeared (Fig. 1b). Further increasing the Sr/Nb to a value above 1.0, no obvious change in the crystalline structure of the samples was observed (Fig. 1c–f). This result appears to demonstrate that the added Sr(OH)2 exceeding the stoichiometry of Sr2Nb2O7 has little effect on the crystalline structure of the resultant strontium niobates. To confirm the XRD results, we hydrothermally treated appropriate amount of synthesized niobates in a mixture of equal volume of 36% hydrochloric acid and of 30% hydrogen peroxide aqueous solution at 453 K for 10 h to obtain a clear solution for ICP measurements. The ICP results (Table 1 ) reveal that the measured Sr/Nb values agree well with the nominal Sr/Nb (calculated with the added amount of Sr and Nb precursors during synthesis) when they are lower than 1.0. On the other hand, the measured Sr/Nb values for all the niobate samples prepared with a nominal Sr/Nb > 1.0 are close to 1.0, which explains why all the samples prepared with nominal Sr/Nb ≥ 1.0 displays the same XRD pattern. These results suggest that the excessively added Sr(OH)2 was lost during the filtrating and water-washing process after hydrothermal treatment. Corresponding to their crystalline structures, the textural properties of the samples chareacterized by BET specific surface area (Table 1) and SEM (Fig. 2 ) shows a similar trend. The sample prepared with a nominal Sr/Nb = 0.5, having a relatively small surface area of 11 m2 g−1, was composed of elongated crystalline grains in size of ∼200 × 1000 nm (Fig. 2a). Increasing the addition amount of Sr(OH)2 to Sr/Nb ≥ 1.0, we obtained large aggrates comprising of Sr2Nb2O7 flakes. The size of the flakes decreases slightly with increasing in the nominal Sr/Nb, in accordance with the varying in BET surface area. These results imply that the excessively added Sr(OH)2 accelerates the nucleation rate of niobates in hydrothermal synthesis; as a result, aggregates of smaller flakes are formed. 3.2 Catalytic activity of Ru/Sr2Nb2O7 Fig. 3 compares the ammonia synthesis rates over 2 wt% Ru catalysts supported on strontium niobates synthesized with different nominal molar ratio of Sr/Nb at 673 K and 0.1 MPa. The activity increases with increasing in the added amount of Sr(OH)2 of the surports when the nominal Sr/Nb ≤ 2.0. The 2 wt%Ru/Sr2Nb2O7 catalyst prepared with a nominal Sr/Nb = 2.0 gives the highest activity of 239 μ m o l g cat -1 h -1 . Further raising the nominal Sr/Nb to values above 2.0 decreased the activity slightly (Fig. 3). Therefore, we choosed Sr2Nb2O7 prepared at Sr/Nb = 2.0 as the support for Ru catalysts to study the effect of promoters. 3.3 Catalytic activity of Ba- or Cs-promoted Ru/Sr2Nb2O7 Addition of Ba- or Cs-promoter lowered the BET surface area of the catalysts from 83 to 32 and 15 m2 g−1, respectively (as shown in Table 2 ). The promotion effect of barium and cesium is compared in Table 2. For both Ba- or Cs-Ru/Sr2Nb2O7 catalysts, the ammonia synthesis rate increased first and then decreased with increasing in the addition amount of promoters. The optimal molar ratio of Ba or Cs promoter to Ru is 4 or 8, respectively. The highest activity over 4Ba- or 8Cs-2 wt%Ru/Sr2Nb2O7 at 673 K and 0.1 MPa was 1279 or 4170 μ m o l g cat -1 h -1 , which was 5 or 17 times larger than that of the unpromoted catalyst. Tables 3 and 4 list the ammonia synthesis rates over 4Ba- and 8Cs-2 wt%Ru/Sr2Nb2O7 activated in synthesis gas (3H2 + N2) flow at different temperatures for 3 h. As one can see, raising the activation temperature first enhanced and then lowered the ammonia synthesis rate of both catalysts. The corresponding optimal activation temperature was 773 and 673 K for Ba- and Cs-promoted catalysts, respectively. Two phenomena may occur during the activation process: One is the decomposition of Ba(NO3)2 or CsNO3 to their oxide and/or hydroxide form; the other is the formation and growth of Ru particles. When the catalysts are activated at low temperatures, the promoter’s nitrate precursor may not decompose completely; on the other hand, as the activation temperature is high, the Ru particles may sinter to some extent. The fraction of exposed Ru atoms on the catalysts was measured by H2-pulse titration method (Table 5 ). It is clearly seen from Table 5 that the Ru particles on the unpromoted samples activated at 573 K was significantly dispersed (D = 92.9%), and the calculated average size was 1.4 nm using the method described by Borodziński et al. [55]. The morphology of the 2 wt% Ru/Sr2Nb2O7 catalyst reduced in synthesis gas (3H2 + N2, 60 mL (STP) min−1) at 573 K for 3 h was observed by TEM (Fig. 4 a). Ru crystallites are uniformly deposited on the Sr2Nb2O7 substrate. The size of more than 500 Ru crystallites shows a monomodal distribution with an average size (d) of 1.37 nm and a standard deviation (σ) of 0.20 (Fig. 4b). This result confirms that the high dispersion of Ru crystallites obtained via H2-pulse titration method is reasonable and spillover of hydrogen atom to the support is ignorable. The lattice spacing of the Sr2Nb2O7 substrate (Fig. 4a) is 0.275, 0.277, and 0.283 nm, corresponding to the (002) and (151) planes of the orthorhombic Sr2Nb2O7 crystallites (Fig. s1). From the XRD pattern of Sr2Nb2O7 synthesized with a nominal Sr/Nb = 2.0 as shown in Fig. s1, one can see that the (002) and (151) peaks are the top two most intensive diffractions, suggesting that they are the preferentially exposed facets of the Sr2Nb2O7 flakes. These exposed facets composed of oxygen anions can induce the epitaxial growth of Ru crsytallites [56] in a manner similar to the hexagonally close-packed carbon atoms of graphite reported by Song et al. [45] and to the mirror planes of barium hexaaluminates as reported by You et al. [13]. Given the nearest-neighbor atom distances on the Ru (001) surfaces (0.271 nm) and on the (002) (0.285 nm) or (151) (0.278 nm) planes of Sr2Nb2O7, the mismatch of the Ru (001) lattice with respect to the oxygen lattice on (002) or (151) planes is 4.9% or 2.5%, respectively. Such a small mismatch facilitates the epitaxial growth of ruthenium nanocrystallites with high dispersion on Sr2Nb2O7 substrate. Activating the catalyst at higher temperatures (673 and 773 K) lowered the dispersion to 72.8% and 62.1%, corresponding to an average size of 1.8 and 2.1 nm, respectively (Table 5). These results are in good agreement with the values calculated from TEM observations (Fig. s2c, d). The Ru nanoparticles epitaxially grown on Sr2Nb2O7 substrate are flat in a height of 1–2 (reduced at 673 K, Fig. s2a) and 2–3 nm (reduced at 773K, Fig. s2c). The section of Ru particles projected normal to the exposed facets of Sr2Nb2O7 substrate are trapezium-shaped, these side facets of the flat Ru nanoparticles are composed of steps, having more abundant B5 sites than that for round particles. This peculiar shape of Ru particles must contribute to the high performance of the Ru/Sr2Nb2O7 catalysts as that observed for Ru/barium hexaaluminate [13] and Ru/graphite [45]. Ru particels abruptly grew from 2.1 to 11.6 nm when the 2 wt%Ru/Sr2Nb2O7 catalyst was activated at 873 K for 3 h. Addition of Ba- or Cs-promoters to the Ru/Sr2Nb2O7 system reduced the H2 uptake significantly (Table 5). It implies that the number of exposed Ru atoms are very small at 323 K. The low H2-uptake can be caused by two reasons: One is Ru particles sintered drastically as Ba- or Cs-promoter was added; the other is Ru particles are covered by Ba- or Cs-promoters at H2-pulse measurement conditions. Based on the H2-uptake values, we can calculate the average size of Ru particles on 4Ba- and 8Cs-Ru/Sr2Nb2O7 catalysts to be 24.3 and 90.8 nm, which were not observed with TEM (Fig.4c&d). Thus, the coverage of Ru particles by Ba- or Cs-promoter at 323 K should be the reason why the H2-uptake was low for promoted catalysts. Similar phenomena have been oberserved by other research groups [13,57]. TEM results (Fig. 4b and c) also support the deduction that the Ru particles were covered by Ba- or Cs-promoters at room temperature because we could find a few particles, which had comparable size to those on the unpromoted catalyst. These Ru particles became exposed to the reactants at ammonia synthesis conditions. Consequently, we chose the dispersion values of unpromoted catalyst to calculate the turn over frequency (TOF) of Ba- or Cs-promoted catalysts (Table 6 ). The obtained results are considered reasonable because it has been reported that the dispersion of Ru nanoparticles are maintained on the addition of promoters when the catalysts are reduced at mild conditions [19,57,58]. The acidity of oxide support is known to be detrimental to the activity of Ru catalysts for ammonia synthesis. The surface acidity of Sr2Nb2O7, Nb2O5, γ-Al2O3 and MgO determined by TPD of ammonia is shown in Fig. s3, and the amount of chemisorbed ammonia on these supports is given in Table s1. The adsorbed ammonia amount by specific surface area of oxides follows the sequence of γ-Al2O3 >> Nb2O5 > MgO > Sr2Nb2O7. The acid strength of the oxides, reflected by the desorption temperatures, was also very different. The ammonia molecules bound on Sr2Nb2O7 desorbed at 400–700 K with the main peak top at around 520 K. The ammonia TPD profile of MgO over similar temperature range splitted into two main peaks located at about 490 and 630 K. This result suggests that the acid sites are weaker on Sr2Nb2O7 than on MgO. γ-Al2O3 and Nb2O5 desorbed ammonia over a wide temperature range (400–1075 K), indicating that the two oxides had high density of strong acid sites. These strong acid sites on Nb2O5 should be the reason why 2 wt%Ru/Nb2O5 catalysts shows poor activity for ammonia synthesis (Table s2). Table 7 compares the catalytic performance of Ba- or Cs-Ru/Sr2Nb2O7 catalyst with that of Ru catalyst supported on other substrates. Due to the different Ru-loading, we calculate the ammonia synthesis rates based on Ru weight. One can see that Ba- or Cs-promoted Ru/Sr2Nb2O7 catalyst exhibits a distinguished activity for ammonia synthesis, which is 10% higher than that of Cs-Ru/MgO, and 10 times higher than that of Ba-Ru/AC (industrialized catalyst). Although the mayenite electride supported Ru catalyst showed a comparable activity to our catalysts, the synthesis and reduction of mayenite electride are slightly difficult, and the electride slowly degrades by water vapor and oxygen in air. 3.4 Catalytic stability of Ba- or Cs-Ru/Sr2Nb2O7 Stability is another factor that should be considered as important as activity for practical catalysts. The ammonia synthesis rate over Ba-Ru/Sr2Nb2O7 and Cs-Ru/Sr2Nb2O7 measured at 673 K and 0.1 MPa for 72 h time on stream is shown in Fig. 5 a and b. Obviously, no deactivation was found for the two catalysts, suggesting the catalysts were stable. After stability tests, the corresponding surface area of the aged Ba-Ru/Sr2Nb2O7 and Cs-Ru/Sr2Nb2O7 was 52 and 31 m2 g −1, which was slightly larger than that of the fresh and used samples (Table 8 ). It suggests that the textural morphology of the catalysts is stable under ammonia synthesis conditions. Fig. 6 presents the XRD patterns of the Ba- or Cs-Ru/Sr2Nb2O7 catalyst at three different phases: as-prepared (fresh), after 5-h activity tests (used) and after 72-h stability test (aged). The crystalline phase of Ba(NO3)2 (Fig. 6a) and CsNO3 (Fig. 6b) was found in the fresh catalysts. After activity tests, no Ba containing phases were detected by XRD, suggesting the barium promoter existed in amorphous or well-dispersed state; on the other hand, the CsNO3 promoter was converted to CsOH. During the 72-h time on stream tests, the crystalline structure of Sr2Nb2O7 substrate showed no obvious change; but a minor reduction in the crystalline degree of the supports was observed, in accordance with the slight increase in specific surface area of the aged catalysts (Table 8). 4 Conclusions Strontium niobates with a large surface area was prepared using hydrothermal method and examined as support for Ru catalyst for ammonia synthesis. The Ba- or Cs-promoted Ru catalyst supported on Sr2Nb2O7 synthesized with nominal Sr/Nb = 2.0 showed superior catalytic activity and stability for ammonia synthesis than Cs-Ru/MgO, which was considered as one of the most ative oxide support at present. The exposed (002) and (151) facets of Sr2Nb2O7 substrate induced the epitaxial growth of Ru nanocrystallites in truncated pyramid shape with abundant steps and B5 sites, which played a key role in catalysis of ammonia synthesis. Thus, strontium niobate can be a practically promising potential candidate for Ru ammonia synthesis catalysts. Acknowledgements This work was financially supported by the National Natural Science Foundation of China (21573163) and the Natural Science Foundation of Hubei Province (2015CFA017). Appendix A Supplementary data Supplementary material related to this article can be found, in the online version, at doi:https://doi.org/10.1016/j.apcata.2018.01.006. Appendix A Supplementary data The following are Supplementary data to this article: References [1] Suzette M. Kimball Mineral Commodity Summaries US 2017 [2] J.W. Erisman M.A. Sutton J. Galloway Z. Klimont W. Winiwarter Nature Genet. 1 2008 636 639 [3] M.D. Fryuk Nature 427 2004 498 499 [4] Iowa Energy Center, NH3 Fuel 2017 (accessed Oct. 23, 2017) https://nh3fuel.files.wordpress.com/2013/01/nh3brochuresept2010.pdf [5] F. Schüth R. Palkovits R. Schlögl D.S. Su Energy Environ. Sci. 5 2012 6278 6289 [6] W. Wang J.M. Herreros A. Tsolakis A.P.E. York Int. J. Hydrogen Energy 38 2013 9907 9917 [7] S. Gambarotta J. Scott Angew. Chem. Int. Ed. 43 2004 5298 5308 [8] A.J. Pool E. Lobkovsky P.J. Chirik Nature 427 2004 527 530 [9] A. Nielsen J. Catal. 11 1968 280 281 [10] J. Schütze W. Mahdi B. Herzog R. Schlögl Top. Catal. 1 1994 195 214 [11] N. Cherkasov A.O. Ibhadon P. Fitzpatrick Chem. Eng. Process. 90 2015 24 33 [12] D. Szmigiel H. Bielawa M. Kurtz J. Catal. 205 2002 205 212 [13] Z. You K. Inazu K. Aika T. Baba J. Catal. 251 2007 321 331 [14] X. Yanga W. Zhanga C. Xiaa X. Xionga X. Mua B. Hu Cat Comm. 11 2010 867 870 [15] M. Karolewskaa E. Truszkiewicza B. Mierzwab L. Kepinski W. Raróg-Pilecka Appl. Catal. A 445 2012 280 286 [16] A. Hellmana K. Honkala I.N. Remediakis Á. Logadóttir A. Carlsson S. Dahl C.H. Christensen J.K. Nørskov Surf. Sci. 603 2009 1731 1739 [17] K. Sato K. Imamura Y. Kawano S. Miyahara T. Yamamoto S. Matsumurac K. Nagaoka Chem. Sci. 8 2017 674 679 [18] L. Forni D. Molinari I. Rossetti N. Pernicone Appl. Catal. A. 185 1999 269 275 [19] Z. Kowalczyk S. Jodzis W. Raróg J. Zieli´nski J. Pielaszek Appl. Catal. A. 173 1998 153 160 [20] P.J. Goethel P.T. Yang J. Catal. 111 1988 220 226 [21] Z. Kowalczyk J. Sentek S. Jodzis R. Diduszko A. Presz A. Terzyk Z. Kucharski J. Suwalski Carbon. 34 1996 403 409 [22] K. Aika T. Takano S. Murata J. Catal. 136 1992 126 140 [23] Y. Izumi K. Aika J. Phys. Chem. 99 1995 10336 10345 [24] M. Muhler F. Rosowski O. Hinrichsen A. Hornung G. Ertl Stud. Surf. Sci. Catal. 101 1996 317 326 [25] F. Rosowski A. Hornung O. Hinrichsen D. Herein M. Muhler G. Ertl Appl. Catal. A. 151 1997 443 460 [26] H. Bielawa O. Hinrichsen A. Birkner M. Muhler Angew. Chem. Int. Ed. 40 2001 1061 1063 [27] S.E. Siporin R.J. Davis J. Catal. 222 2004 315 322 [28] K. Aika K. Shimazaki Y. Hattori A. Ohya S. Ohshima K. Shirota A. Ozaki J. Catal. 92 1985 296 304 [29] K. Aika M. Kumasaka T. Oma O. Kato H. Matsuda N. Watanabe K. Yamazaki A. Ozaki T. Onishi Appl. Catal. 28 1986 57 68 [30] S. Murata K. Aika J. Catal. 136 1992 110 117 [31] S. Murata K. Aika J. Catal. 136 1992 118 125 [32] A. Miyazaki I. Balint K. Aika Y. Nakano J. Catal. 204 2001 364 371 [33] C. Fernándeza C. Sassoyeb D.P. Debeckera C. Sanchezb P. RuizaaInstitute Appl. Catal. A 474 2014 194 202 [34] T. Becue R.J. Davis J.M. Garces J. Catal. 179 1998 129 137 [35] B.C. McClaine T. Becue C. Lock R.J. Davis J. Mol. Catal. A-Chem. 163 2000 105 116 [36] B.C. McClaine R.J. Davis J. Catal. 211 2002 379 386 [37] M. Kitano Y. Inoue Y. Yamazaki F. Hayashi S. Kanbara S. Matsuishi T. Yokoyama S.W. Kim M. Hara H. Hosono Nat. Chem. 4 2012 934 940 [38] Y. Inoue M. Kitano S. Kim T. Yokoyama M. Hara H. Hosono ACS Catal. 4 2014 674 680 [39] M. Kitano S. Kanbara Y. Inoue N. Kuganathan P.V. Sushko T. Yokoyama M. Hara H. Hosono Nat. Commun. 6 2015 6731 [40] Y. Kobayashi M. Kitano S. Kawamura T. Yokoyama H. Hosono Catal. Sci. Technol. 7 2017 47 50 [41] Y. Niwa K. Aika J. Catal. 162 1996 138 142 [42] K. Aika H. Hori A. Ozaki J. Catal. 27 1972 424 431 [43] O. Hinrichsen Catal. Today 53 1999 177 188 [44] E. Truszkiewicz W. Raróg-Pilecka K. Schmidt-Szałowski S. Jodzis E. Wilczkowska D. Łomotb Z. Kaszkur Z. Karpin Z. Kowalczyk J. Catal. 265 2009 181 190 [45] Z. Song T. Cai J.C. Hanson J.A. Rodriguez J. Hrbek J. Am. Chem. Soc. 126 2004 8576 8584 [46] Y. Inoue M. Kitano K. Kishida H. Abe Y. Niwa M. Sasase Y. Fujita H. Ishikawa T. Yokoyama M. Hara H. Hosono ACS Catal. 6 2016 7577 7584 [47] K. Aika A. Ohya A. Ozaki Y. Inoue I. Yasumori J. Catal. 92 1985 305 311 [48] S. Liang L. Wu J. Bi W. Wang J. Gao Z. Li X. Fu Chem. Commun. 46 2010 1446 1448 [49] In. Cho S. Lee J. Noh D.W. Kim H.S. Jung D. Kim K.S. Hong Cryst. Growth Des. 10 2010 2447 2450 [50] H. Muthurajan H.H. Kumar N.K. Rao S. Pradhan R.K. Jha V. Ravi Mater. Lett. 62 2008 892 894 [51] S. Xie Y. Wang Q. Zhang W. Deng Y. Wang Chem. Commun. 51 2015 3430 3433 [52] B. Lin J. Ma Y. Yao Y. Ren X. Jiang Y. Sun Z. Liu J. Am. Ceram. Soc. 91 2008 1329 1331 [53] W. Fan Q. Zhang W. Deng Y. Wang Chem. Mater. 25 2013 3277 3287 [54] R.A.D. Betta J. Catal. 34 1974 57 60 [55] A. Borodzinski M. Bonarowska Langmuir 13 1997 5613 5620 [56] S. Havelia S. Wang K.R. Balasubramaniam A.M. Schultz G.S. Rohrer P.A. Salvador Cryst. Eng. Commun. 15 2013 5434 5441 [57] T.W. Hansen P.L. Hansen S. Dahl C.J.H. Jacobsen Catal. Lett. 84 2002 7 12 [58] W. Raróg-Pilecka E. Mi´skiewicz D. Szmigiel Z. Kowalczyk J. Catal. 231 2005 11 19",
      "scopus-id": "85041490911",
      "coredata": {
        "eid": "1-s2.0-S0926860X18300140",
        "dc:description": "Strontium niobates with different crystalline structure and morphology have been prepared via a hydrothermal method and applied as a support for ruthenium catalyst in ammonia synthesis. The sample synthesized with a nominal Sr/Nb = 2.0, having a pure Sr2Nb2O7 crystalline phase and specific surface area of 87 m2 g−1, exhibits the best performance as support for Ru catalyst. The flake-structured Sr2Nb2O7 substrate induced epitaxial growth of truncated pyramid shaped ruthenium nanoparticles with a dispersion as high as 93%, which have abundant steps and B5 sites playing a key role in ammonia synthesis catalysis. Adding Cs- or Ba-promoter enhanced the activity of Ru/Sr2Nb2O7 catalyst drastically. The highest ammonia synthesis rate over 8Cs- or 4Ba-2 wt%Ru/Sr2Nb2O7 was 4986 and 2317 (μmol g−1 cat h−1) at 0.1 MPa and 673 K, respectively. In addition, both catalysts were stable over reaction for 72 h at 673 K and 0.1 MPa. Thus, the synthesized Sr2Nb2O7 is expected to be a practically promising oxide support for ruthenium ammonia synthesis catalsyts.",
        "openArchiveArticle": "false",
        "prism:coverDate": "2018-03-25",
        "openaccessUserLicense": null,
        "prism:aggregationType": "Journal",
        "prism:url": "https://api.elsevier.com/content/article/pii/S0926860X18300140",
        "dc:creator": [
          {
            "@_fa": "true",
            "$": "Chen, Minxuan"
          },
          {
            "@_fa": "true",
            "$": "Yuan, Mingwei"
          },
          {
            "@_fa": "true",
            "$": "Li, Jinjun"
          },
          {
            "@_fa": "true",
            "$": "You, Zhixiong"
          }
        ],
        "link": [
          {
            "@_fa": "true",
            "@rel": "self",
            "@href": "https://api.elsevier.com/content/article/pii/S0926860X18300140"
          },
          {
            "@_fa": "true",
            "@rel": "scidir",
            "@href": "https://www.sciencedirect.com/science/article/pii/S0926860X18300140"
          }
        ],
        "dc:format": "application/json",
        "openaccessType": null,
        "pii": "S0926-860X(18)30014-0",
        "prism:volume": "554",
        "prism:publisher": "Elsevier B.V.",
        "dc:title": "Ammonia synthesis over Cs- or Ba-promoted ruthenium catalyst supported on strontium niobate",
        "prism:copyright": "© 2018 Elsevier B.V. All rights reserved.",
        "openaccess": "0",
        "prism:issn": "0926860X",
        "dcterms:subject": [
          {
            "@_fa": "true",
            "$": "Ammonia synthesis"
          },
          {
            "@_fa": "true",
            "$": "Ruthenium catalysts"
          },
          {
            "@_fa": "true",
            "$": "Strontium niobate"
          },
          {
            "@_fa": "true",
            "$": "Cs-promotion"
          },
          {
            "@_fa": "true",
            "$": "Ba-promotion"
          }
        ],
        "openaccessArticle": "false",
        "prism:publicationName": "Applied Catalysis A: General",
        "openaccessSponsorType": null,
        "prism:pageRange": "1-9",
        "prism:endingPage": "9",
        "pubType": "fla",
        "prism:coverDisplayDate": "25 March 2018",
        "prism:doi": "10.1016/j.apcata.2018.01.006",
        "prism:startingPage": "1",
        "dc:identifier": "doi:10.1016/j.apcata.2018.01.006",
        "openaccessSponsorName": null
      },
      "objects": {
        "object": [
          {
            "@category": "thumbnail",
            "@height": "164",
            "@width": "139",
            "@_fa": "true",
            "$": "https://api.elsevier.com/content/object/eid/1-s2.0-S0926860X18300140-fx1.sml?httpAccept=%2A%2F%2A",
            "@multimediatype": "GIF image file",
            "@type": "IMAGE-THUMBNAIL",
            "@size": "5476",
            "@ref": "fx1",
            "@mimetype": "image/gif"
          },
          {
            "@category": "thumbnail",
            "@height": "163",
            "@width": "133",
            "@_fa": "true",
            "$": "https://api.elsevier.com/content/object/eid/1-s2.0-S0926860X18300140-gr1.sml?httpAccept=%2A%2F%2A",
            "@multimediatype": "GIF image file",
            "@type": "IMAGE-THUMBNAIL",
            "@size": "6376",
            "@ref": "gr1",
            "@mimetype": "image/gif"
          },
          {
            "@category": "thumbnail",
            "@height": "164",
            "@width": "145",
            "@_fa": "true",
            "$": "https://api.elsevier.com/content/object/eid/1-s2.0-S0926860X18300140-gr2.sml?httpAccept=%2A%2F%2A",
            "@multimediatype": "GIF image file",
            "@type": "IMAGE-THUMBNAIL",
            "@size": "16407",
            "@ref": "gr2",
            "@mimetype": "image/gif"
          },
          {
            "@category": "thumbnail",
            "@height": "163",
            "@width": "152",
            "@_fa": "true",
            "$": "https://api.elsevier.com/content/object/eid/1-s2.0-S0926860X18300140-gr3.sml?httpAccept=%2A%2F%2A",
            "@multimediatype": "GIF image file",
            "@type": "IMAGE-THUMBNAIL",
            "@size": "3334",
            "@ref": "gr3",
            "@mimetype": "image/gif"
          },
          {
            "@category": "thumbnail",
            "@height": "164",
            "@width": "156",
            "@_fa": "true",
            "$": "https://api.elsevier.com/content/object/eid/1-s2.0-S0926860X18300140-gr4.sml?httpAccept=%2A%2F%2A",
            "@multimediatype": "GIF image file",
            "@type": "IMAGE-THUMBNAIL",
            "@size": "13848",
            "@ref": "gr4",
            "@mimetype": "image/gif"
          },
          {
            "@category": "thumbnail",
            "@height": "120",
            "@width": "219",
            "@_fa": "true",
            "$": "https://api.elsevier.com/content/object/eid/1-s2.0-S0926860X18300140-gr5.sml?httpAccept=%2A%2F%2A",
            "@multimediatype": "GIF image file",
            "@type": "IMAGE-THUMBNAIL",
            "@size": "4163",
            "@ref": "gr5",
            "@mimetype": "image/gif"
          },
          {
            "@category": "thumbnail",
            "@height": "129",
            "@width": "219",
            "@_fa": "true",
            "$": "https://api.elsevier.com/content/object/eid/1-s2.0-S0926860X18300140-gr6.sml?httpAccept=%2A%2F%2A",
            "@multimediatype": "GIF image file",
            "@type": "IMAGE-THUMBNAIL",
            "@size": "8867",
            "@ref": "gr6",
            "@mimetype": "image/gif"
          },
          {
            "@category": "standard",
            "@height": "245",
            "@width": "208",
            "@_fa": "true",
            "$": "https://api.elsevier.com/content/object/eid/1-s2.0-S0926860X18300140-fx1.jpg?httpAccept=%2A%2F%2A",
            "@multimediatype": "JPEG image file",
            "@type": "IMAGE-DOWNSAMPLED",
            "@size": "10805",
            "@ref": "fx1",
            "@mimetype": "image/jpeg"
          },
          {
            "@category": "standard",
            "@height": "416",
            "@width": "339",
            "@_fa": "true",
            "$": "https://api.elsevier.com/content/object/eid/1-s2.0-S0926860X18300140-gr1.jpg?httpAccept=%2A%2F%2A",
            "@multimediatype": "JPEG image file",
            "@type": "IMAGE-DOWNSAMPLED",
            "@size": "35679",
            "@ref": "gr1",
            "@mimetype": "image/jpeg"
          },
          {
            "@category": "standard",
            "@height": "766",
            "@width": "678",
            "@_fa": "true",
            "$": "https://api.elsevier.com/content/object/eid/1-s2.0-S0926860X18300140-gr2.jpg?httpAccept=%2A%2F%2A",
            "@multimediatype": "JPEG image file",
            "@type": "IMAGE-DOWNSAMPLED",
            "@size": "194536",
            "@ref": "gr2",
            "@mimetype": "image/jpeg"
          },
          {
            "@category": "standard",
            "@height": "364",
            "@width": "339",
            "@_fa": "true",
            "$": "https://api.elsevier.com/content/object/eid/1-s2.0-S0926860X18300140-gr3.jpg?httpAccept=%2A%2F%2A",
            "@multimediatype": "JPEG image file",
            "@type": "IMAGE-DOWNSAMPLED",
            "@size": "13662",
            "@ref": "gr3",
            "@mimetype": "image/jpeg"
          },
          {
            "@category": "standard",
            "@height": "711",
            "@width": "678",
            "@_fa": "true",
            "$": "https://api.elsevier.com/content/object/eid/1-s2.0-S0926860X18300140-gr4.jpg?httpAccept=%2A%2F%2A",
            "@multimediatype": "JPEG image file",
            "@type": "IMAGE-DOWNSAMPLED",
            "@size": "158287",
            "@ref": "gr4",
            "@mimetype": "image/jpeg"
          },
          {
            "@category": "standard",
            "@height": "372",
            "@width": "678",
            "@_fa": "true",
            "$": "https://api.elsevier.com/content/object/eid/1-s2.0-S0926860X18300140-gr5.jpg?httpAccept=%2A%2F%2A",
            "@multimediatype": "JPEG image file",
            "@type": "IMAGE-DOWNSAMPLED",
            "@size": "30364",
            "@ref": "gr5",
            "@mimetype": "image/jpeg"
          },
          {
            "@category": "standard",
            "@height": "399",
            "@width": "678",
            "@_fa": "true",
            "$": "https://api.elsevier.com/content/object/eid/1-s2.0-S0926860X18300140-gr6.jpg?httpAccept=%2A%2F%2A",
            "@multimediatype": "JPEG image file",
            "@type": "IMAGE-DOWNSAMPLED",
            "@size": "58424",
            "@ref": "gr6",
            "@mimetype": "image/jpeg"
          },
          {
            "@category": "high",
            "@height": "1085",
            "@width": "922",
            "@_fa": "true",
            "$": "https://api.elsevier.com/content/object/eid/1-s2.0-S0926860X18300140-fx1_lrg.jpg?httpAccept=%2A%2F%2A",
            "@multimediatype": "JPEG image file",
            "@type": "IMAGE-HIGH-RES",
            "@size": "77913",
            "@ref": "fx1",
            "@mimetype": "image/jpeg"
          },
          {
            "@category": "high",
            "@height": "1842",
            "@width": "1500",
            "@_fa": "true",
            "$": "https://api.elsevier.com/content/object/eid/1-s2.0-S0926860X18300140-gr1_lrg.jpg?httpAccept=%2A%2F%2A",
            "@multimediatype": "JPEG image file",
            "@type": "IMAGE-HIGH-RES",
            "@size": "274654",
            "@ref": "gr1",
            "@mimetype": "image/jpeg"
          },
          {
            "@category": "high",
            "@height": "3388",
            "@width": "3000",
            "@_fa": "true",
            "$": "https://api.elsevier.com/content/object/eid/1-s2.0-S0926860X18300140-gr2_lrg.jpg?httpAccept=%2A%2F%2A",
            "@multimediatype": "JPEG image file",
            "@type": "IMAGE-HIGH-RES",
            "@size": "2166943",
            "@ref": "gr2",
            "@mimetype": "image/jpeg"
          },
          {
            "@category": "high",
            "@height": "1611",
            "@width": "1500",
            "@_fa": "true",
            "$": "https://api.elsevier.com/content/object/eid/1-s2.0-S0926860X18300140-gr3_lrg.jpg?httpAccept=%2A%2F%2A",
            "@multimediatype": "JPEG image file",
            "@type": "IMAGE-HIGH-RES",
            "@size": "102552",
            "@ref": "gr3",
            "@mimetype": "image/jpeg"
          },
          {
            "@category": "high",
            "@height": "3147",
            "@width": "3000",
            "@_fa": "true",
            "$": "https://api.elsevier.com/content/object/eid/1-s2.0-S0926860X18300140-gr4_lrg.jpg?httpAccept=%2A%2F%2A",
            "@multimediatype": "JPEG image file",
            "@type": "IMAGE-HIGH-RES",
            "@size": "2336998",
            "@ref": "gr4",
            "@mimetype": "image/jpeg"
          },
          {
            "@category": "high",
            "@height": "1645",
            "@width": "3000",
            "@_fa": "true",
            "$": "https://api.elsevier.com/content/object/eid/1-s2.0-S0926860X18300140-gr5_lrg.jpg?httpAccept=%2A%2F%2A",
            "@multimediatype": "JPEG image file",
            "@type": "IMAGE-HIGH-RES",
            "@size": "236288",
            "@ref": "gr5",
            "@mimetype": "image/jpeg"
          },
          {
            "@category": "high",
            "@height": "1764",
            "@width": "3000",
            "@_fa": "true",
            "$": "https://api.elsevier.com/content/object/eid/1-s2.0-S0926860X18300140-gr6_lrg.jpg?httpAccept=%2A%2F%2A",
            "@multimediatype": "JPEG image file",
            "@type": "IMAGE-HIGH-RES",
            "@size": "532694",
            "@ref": "gr6",
            "@mimetype": "image/jpeg"
          },
          {
            "@category": "standard",
            "@_fa": "true",
            "$": "https://api.elsevier.com/content/object/eid/1-s2.0-S0926860X18300140-mmc1.docx?httpAccept=%2A%2F%2A",
            "@multimediatype": "Microsoft Word file",
            "@type": "APPLICATION",
            "@size": "1601540",
            "@ref": "mmc1",
            "@mimetype": "application/word"
          },
          {
            "@category": "thumbnail",
            "@height": "37",
            "@width": "107",
            "@_fa": "true",
            "$": "https://api.elsevier.com/content/object/eid/1-s2.0-S0926860X18300140-si1.gif?httpAccept=%2A%2F%2A",
            "@multimediatype": "GIF image file",
            "@type": "ALTIMG",
            "@size": "1223",
            "@ref": "si1",
            "@mimetype": "image/gif"
          },
          {
            "@category": "thumbnail",
            "@height": "37",
            "@width": "81",
            "@_fa": "true",
            "$": "https://api.elsevier.com/content/object/eid/1-s2.0-S0926860X18300140-si2.gif?httpAccept=%2A%2F%2A",
            "@multimediatype": "GIF image file",
            "@type": "ALTIMG",
            "@size": "1082",
            "@ref": "si2",
            "@mimetype": "image/gif"
          },
          {
            "@category": "thumbnail",
            "@height": "45",
            "@width": "99",
            "@_fa": "true",
            "$": "https://api.elsevier.com/content/object/eid/1-s2.0-S0926860X18300140-si3.gif?httpAccept=%2A%2F%2A",
            "@multimediatype": "GIF image file",
            "@type": "ALTIMG",
            "@size": "1247",
            "@ref": "si3",
            "@mimetype": "image/gif"
          },
          {
            "@category": "thumbnail",
            "@height": "37",
            "@width": "99",
            "@_fa": "true",
            "$": "https://api.elsevier.com/content/object/eid/1-s2.0-S0926860X18300140-si4.gif?httpAccept=%2A%2F%2A",
            "@multimediatype": "GIF image file",
            "@type": "ALTIMG",
            "@size": "1147",
            "@ref": "si4",
            "@mimetype": "image/gif"
          }
        ]
      },
      "link": {
        "@rel": "abstract",
        "@href": "https://api.elsevier.com/content/abstract/scopus_id/85041490911"
      }
    }
  }
}