{
  "metadata": {
    "title": "The atom-efficient production of glycerol carbonate via transesterification between dimethyl carbonate and glycerol over fluorinated Al<ce:inf loc=post>2</ce:inf>O<ce:inf loc=post>3</ce:inf>-ZrO<ce:inf loc=post>2</ce:inf> solid solution catalysts with suitable acidic-basic property",
    "authors": "; ; ",
    "journal": "Applied Catalysis A: General",
    "date": "2023-09-05",
    "doi": "10.1016/j.apcata.2023.119370",
    "abstract": "",
    "uri": "https://api.elsevier.com/content/article/pii/S0926860X23003502",
    "pii": "S0926860X23003502"
  },
  "fulltext": {
    "full-text-retrieval-response": {
      "scopus-eid": "2-s2.0-85168824567",
      "originalText": "serial JL 271346 291210 291744 291809 31 Applied Catalysis A: General APPLIEDCATALYSISAGENERAL 2023-08-10 2023-08-10 2023-08-19 2023-08-19 2023-09-04T08:54:40 1-s2.0-S0926860X23003502 S0926-860X(23)00350-2 S0926860X23003502 10.1016/j.apcata.2023.119370 S300 S300.1 FULL-TEXT 1-s2.0-S0926860X23X00167 2024-01-01T12:35:59.692098Z 0 0 20230905 2023 2023-08-10T14:54:38.916862Z absattachment articleinfo articlenumber articletitlenorm authfirstinitialnorm authfirstsurnamenorm cid cids contenttype copyright crossmark dateloaded dateloadedtxt datesearch datesort dateupdated dco docsubtype doctype doi eid ewtransactionid hubeid indexeddate issn issnnorm itemstage itemtransactionid itemweight openaccess openarchive pg pgfirst pii piinorm pubdatestart pubdatetxt pubyr sortorder srctitle srctitlenorm srctype ssids alllist content subj subheadings suppl tomb volfirst volissue volumelist webpdf webpdfpagecount yearnav figure table e-component body mmlmath acknowledge affil appendices articletitle auth authfirstini authfull authkeywords authlast grantnumber grantsponsor grantsponsorid highlightsabst primabst ref specialabst 0926-860X 0926860X true 665 665 C Volume 665 21 119370 119370 119370 20230905 5 September 2023 2023-09-05 2023 article fla © 2023 Elsevier B.V. All rights reserved. ATOMEFFICIENTPRODUCTIONGLYCEROLCARBONATEVIATRANSESTERIFICATIONBETWEENDIMETHYLCARBONATEGLYCEROLOVERFLUORINATEDAL2O3ZRO2SOLIDSOLUTIONCATALYSTSSUITABLEACIDICBASICPROPERTY WANG D 1 Introduction 2 Experimental 2.1 Catalyst preparation 2.2 Catalyst characterization 2.3 Catalytic reaction 3 Results and discussion 3.1 Textural and structural properties of the catalytic samples 3.2 Surface acidic-basic property 4 Catalytic performance 4.1 DMC transesterification with glycerol 4.2 Catalytic performance of samples for the GLC synthesis 4.3 Influence of the reaction condition on the GLC synthesis 4.4 Effect of acidic-basic sites in transesterification of DMC with glycerol 4.5 Reusability of catalyst of Al2O3-ZrO2-1 F 4.6 Activity comparison of Al2O3-ZrO2-1 F with other catalysts in previous documents 5 Green metrics of transesterification of glycerol with DMC 6 Conclusion CRediT authorship contribution statement Acknowledgements Appendix A Supplementary material References DO 2022 169 184 T KARL 2003 1719 1723 T SHAHID 2011 4732 4745 E PAGLIARO 2007 4434 4440 M LIU 2019 1779 D SHAN 2022 120870 J MANE 2022 6751 6781 R AN 2020 12437 12453 Z VO 2022 120723 T XU 2022 407 416 S MALAIKA 2021 119609 A KULAL 2021 4388 4397 N GUEDES 2023 106659 P ROKICKI 2005 529 539 G SHAIKH 1996 951 976 A LEI 2020 106007 Y DECARO 2019 1 13 P LI 2022 5698 5711 Y WANG 2023 122457 H SAHANI 2021 67 88 S ZHANG 2020 117313 X OCHOAGOMEZ 2009 315 324 J PATTANAIK 2021 1433 1443 P YU 2023 141486 J TAKAGAKI 2010 578 581 A LIU 2020 10273 G LIU 2014 135 143 P DEVI 2018 477 488 P KEOGH 2022 122484 J PARAMESWARAM 2018 135 142 G CHANG 2020 21 29 C PRADHAN 2021 127860 G ZHANG 2020 117313 X GAO 2016 32 41 P LIMA 2012 7774 7781 E WANG 2017 e1701290 J PRADHAN 2016 297 309 S TADA 2022 7748 7759 S ZHANG 2018 130 137 X REZAEI 2008 346 354 M YANG 2019 730 739 X TANABE 1989 14 16 M NEWSOLIDACIDSBASESCATALYTICPROPERTIES TICHIT 2002 1530 1538 D ZHANG 2017 1181 1196 X WU 2007 106 111 G WU 2010 107 113 G WAN 2018 267 275 Y WANG 2019 330 341 S SHE 2023 106916 Q POOLWONG 2021 43 60 J KHAYOON 2013 272 281 M ZHENG 2015 1759 1765 L SIMANJUNTAK 2011 220 225 F LIU 2014 152 160 Z ALONSO 2007 2074 2080 D CASTRO 2011 1316 1323 C AHMADZADEH 2018 340 S DOLATABADI 2020 100885 M TOBISZEWSKI 2015 10928 10946 M SHELDON 2017 18 43 R KAMKENG 2021 128138 A BUDZINSKI 2019 37 42 K MONTEITH 2020 123 135 E WANGX2023X119370 WANGX2023X119370XD 2025-08-19T00:00:00.000Z 2025-08-19T00:00:00.000Z http://creativecommons.org/licenses/by-nc-nd/4.0/ © 2023 Elsevier B.V. All rights reserved. 2023-09-01T06:51:19.381Z http://vtw.elsevier.com/data/voc/AddOnTypes/50.7/aggregated-refined https://doi.org/10.15223/policy-017 https://doi.org/10.15223/policy-037 https://doi.org/10.15223/policy-012 https://doi.org/10.15223/policy-029 https://doi.org/10.15223/policy-004 item S0926-860X(23)00350-2 S0926860X23003502 1-s2.0-S0926860X23003502 10.1016/j.apcata.2023.119370 271346 2024-01-01T12:35:59.692098Z 2023-09-05 1-s2.0-S0926860X23003502-main.pdf https://s3-eu-west-1.amazonaws.com/prod-ucs-content-store-eu-west/content/pii:S0926860X23003502/MAIN/application/pdf/70100ec4da84c2edb138c584b0d4fe09/main.pdf main.pdf pdf true 9691259 MAIN 14 1-s2.0-S0926860X23003502-main_1.png https://s3-eu-west-1.amazonaws.com/prod-ucs-content-store-eu-west/content/pii:S0926860X23003502/PREVIEW/image/png/edde83c212e2bc5f2d77612cdcc14921/main_1.png main_1.png png 57419 849 656 IMAGE-WEB-PDF 1 1-s2.0-S0926860X23003502-ga1.jpg https://s3-eu-west-1.amazonaws.com/prod-ucs-content-store-eu-west/content/pii:S0926860X23003502/ga1/DOWNSAMPLED/image/jpeg/8eda47fc3fd868a2a68f292bb12cf3df/ga1.jpg ga1 true ga1.jpg jpg 27456 200 402 IMAGE-DOWNSAMPLED 1-s2.0-S0926860X23003502-sc1.jpg https://s3-eu-west-1.amazonaws.com/prod-ucs-content-store-eu-west/content/pii:S0926860X23003502/sc1/DOWNSAMPLED/image/jpeg/a5fe8c90f35a002633879f235c8f1abb/sc1.jpg sc1 sc1.jpg jpg 28748 203 565 IMAGE-DOWNSAMPLED 1-s2.0-S0926860X23003502-sc2.jpg https://s3-eu-west-1.amazonaws.com/prod-ucs-content-store-eu-west/content/pii:S0926860X23003502/sc2/DOWNSAMPLED/image/jpeg/7f33f67be4bb7cc181ec5877f9173f89/sc2.jpg sc2 sc2.jpg jpg 38610 462 565 IMAGE-DOWNSAMPLED 1-s2.0-S0926860X23003502-gr1.jpg https://s3-eu-west-1.amazonaws.com/prod-ucs-content-store-eu-west/content/pii:S0926860X23003502/gr1/DOWNSAMPLED/image/jpeg/5abaa6fdf28f116ec5a28de1dbd29ca2/gr1.jpg gr1 gr1.jpg jpg 65568 406 751 IMAGE-DOWNSAMPLED 1-s2.0-S0926860X23003502-gr4.jpg https://s3-eu-west-1.amazonaws.com/prod-ucs-content-store-eu-west/content/pii:S0926860X23003502/gr4/DOWNSAMPLED/image/jpeg/12a1a9779e31c08f476f86ba3b1c54a5/gr4.jpg gr4 gr4.jpg jpg 147619 700 678 IMAGE-DOWNSAMPLED 1-s2.0-S0926860X23003502-gr5.jpg https://s3-eu-west-1.amazonaws.com/prod-ucs-content-store-eu-west/content/pii:S0926860X23003502/gr5/DOWNSAMPLED/image/jpeg/72b1f78e2482f38239f7e6b1fd6ede87/gr5.jpg gr5 gr5.jpg jpg 168712 660 678 IMAGE-DOWNSAMPLED 1-s2.0-S0926860X23003502-gr2.jpg https://s3-eu-west-1.amazonaws.com/prod-ucs-content-store-eu-west/content/pii:S0926860X23003502/gr2/DOWNSAMPLED/image/jpeg/8f30c42177cf4abc652513fe94d31101/gr2.jpg gr2 gr2.jpg jpg 47978 277 678 IMAGE-DOWNSAMPLED 1-s2.0-S0926860X23003502-gr3.jpg https://s3-eu-west-1.amazonaws.com/prod-ucs-content-store-eu-west/content/pii:S0926860X23003502/gr3/DOWNSAMPLED/image/jpeg/c087ba97b58eac0b5a86abf9177588f4/gr3.jpg gr3 gr3.jpg jpg 36412 355 376 IMAGE-DOWNSAMPLED 1-s2.0-S0926860X23003502-gr8.jpg https://s3-eu-west-1.amazonaws.com/prod-ucs-content-store-eu-west/content/pii:S0926860X23003502/gr8/DOWNSAMPLED/image/jpeg/6554c9bebe7ac08e994b6c187fb025c0/gr8.jpg gr8 gr8.jpg jpg 15783 292 376 IMAGE-DOWNSAMPLED 1-s2.0-S0926860X23003502-gr9.jpg https://s3-eu-west-1.amazonaws.com/prod-ucs-content-store-eu-west/content/pii:S0926860X23003502/gr9/DOWNSAMPLED/image/jpeg/a3578678955fbe6a42db40a1dee41deb/gr9.jpg gr9 gr9.jpg jpg 17412 289 376 IMAGE-DOWNSAMPLED 1-s2.0-S0926860X23003502-gr6.jpg https://s3-eu-west-1.amazonaws.com/prod-ucs-content-store-eu-west/content/pii:S0926860X23003502/gr6/DOWNSAMPLED/image/jpeg/b765bf5b7e124deb08ccb7b0e8f3f12c/gr6.jpg gr6 gr6.jpg jpg 79623 600 684 IMAGE-DOWNSAMPLED 1-s2.0-S0926860X23003502-gr7.jpg https://s3-eu-west-1.amazonaws.com/prod-ucs-content-store-eu-west/content/pii:S0926860X23003502/gr7/DOWNSAMPLED/image/jpeg/7d6b174977a44dc5511737fca5a975ae/gr7.jpg gr7 gr7.jpg jpg 96317 471 678 IMAGE-DOWNSAMPLED 1-s2.0-S0926860X23003502-ga1.sml https://s3-eu-west-1.amazonaws.com/prod-ucs-content-store-eu-west/content/pii:S0926860X23003502/ga1/THUMBNAIL/image/gif/d406304956df360500d0b72d9e873027/ga1.sml ga1 true ga1.sml sml 9020 109 219 IMAGE-THUMBNAIL 1-s2.0-S0926860X23003502-sc1.sml https://s3-eu-west-1.amazonaws.com/prod-ucs-content-store-eu-west/content/pii:S0926860X23003502/sc1/THUMBNAIL/image/gif/7128131df927104b2215a5761a51ee87/sc1.sml sc1 sc1.sml sml 5837 79 219 IMAGE-THUMBNAIL 1-s2.0-S0926860X23003502-sc2.sml https://s3-eu-west-1.amazonaws.com/prod-ucs-content-store-eu-west/content/pii:S0926860X23003502/sc2/THUMBNAIL/image/gif/437c1db6cc79f4b1285f2bf73c316d3e/sc2.sml sc2 sc2.sml sml 8293 164 200 IMAGE-THUMBNAIL 1-s2.0-S0926860X23003502-gr1.sml https://s3-eu-west-1.amazonaws.com/prod-ucs-content-store-eu-west/content/pii:S0926860X23003502/gr1/THUMBNAIL/image/gif/15c0b04ae44cba68a0f8fa49b8eb8325/gr1.sml gr1 gr1.sml sml 7888 118 219 IMAGE-THUMBNAIL 1-s2.0-S0926860X23003502-gr4.sml https://s3-eu-west-1.amazonaws.com/prod-ucs-content-store-eu-west/content/pii:S0926860X23003502/gr4/THUMBNAIL/image/gif/266dd6b0f92c793c15c1724aa3e9b40b/gr4.sml gr4 gr4.sml sml 16498 163 158 IMAGE-THUMBNAIL 1-s2.0-S0926860X23003502-gr5.sml https://s3-eu-west-1.amazonaws.com/prod-ucs-content-store-eu-west/content/pii:S0926860X23003502/gr5/THUMBNAIL/image/gif/f0d67c0a932073bbad65dbdf47a87399/gr5.sml gr5 gr5.sml sml 22614 163 168 IMAGE-THUMBNAIL 1-s2.0-S0926860X23003502-gr2.sml https://s3-eu-west-1.amazonaws.com/prod-ucs-content-store-eu-west/content/pii:S0926860X23003502/gr2/THUMBNAIL/image/gif/437694d1cdc5427bd0ab23b4df201fe3/gr2.sml gr2 gr2.sml sml 6305 89 219 IMAGE-THUMBNAIL 1-s2.0-S0926860X23003502-gr3.sml https://s3-eu-west-1.amazonaws.com/prod-ucs-content-store-eu-west/content/pii:S0926860X23003502/gr3/THUMBNAIL/image/gif/7ed6aecf307585936652ca4bc8fd8baf/gr3.sml gr3 gr3.sml sml 7406 164 174 IMAGE-THUMBNAIL 1-s2.0-S0926860X23003502-gr8.sml https://s3-eu-west-1.amazonaws.com/prod-ucs-content-store-eu-west/content/pii:S0926860X23003502/gr8/THUMBNAIL/image/gif/022c8a233a624a6209bc5cb354361b82/gr8.sml gr8 gr8.sml sml 6330 164 211 IMAGE-THUMBNAIL 1-s2.0-S0926860X23003502-gr9.sml https://s3-eu-west-1.amazonaws.com/prod-ucs-content-store-eu-west/content/pii:S0926860X23003502/gr9/THUMBNAIL/image/gif/71dd43069b93ba07cb93d0eefcb7a895/gr9.sml gr9 gr9.sml sml 5394 163 213 IMAGE-THUMBNAIL 1-s2.0-S0926860X23003502-gr6.sml https://s3-eu-west-1.amazonaws.com/prod-ucs-content-store-eu-west/content/pii:S0926860X23003502/gr6/THUMBNAIL/image/gif/e96ff2e8b53be8d469e8e0bebca9596f/gr6.sml gr6 gr6.sml sml 11190 164 187 IMAGE-THUMBNAIL 1-s2.0-S0926860X23003502-gr7.sml https://s3-eu-west-1.amazonaws.com/prod-ucs-content-store-eu-west/content/pii:S0926860X23003502/gr7/THUMBNAIL/image/gif/8cd9a3afca6aa567a92641a3b6f709f9/gr7.sml gr7 gr7.sml sml 15218 152 219 IMAGE-THUMBNAIL 1-s2.0-S0926860X23003502-ga1_lrg.jpg https://s3-eu-west-1.amazonaws.com/prod-ucs-content-store-eu-west/content/pii:S0926860X23003502/HIGHRES/image/jpeg/7b6e4d764a51ae0f58f3654c3aa3b11f/ga1_lrg.jpg ga1 true ga1_lrg.jpg jpg 191891 886 1782 IMAGE-HIGH-RES 1-s2.0-S0926860X23003502-sc1_lrg.jpg https://s3-eu-west-1.amazonaws.com/prod-ucs-content-store-eu-west/content/pii:S0926860X23003502/HIGHRES/image/jpeg/4a625b43b40d8b8f72dc0105a341827a/sc1_lrg.jpg sc1 sc1_lrg.jpg jpg 132126 896 2495 IMAGE-HIGH-RES 1-s2.0-S0926860X23003502-sc2_lrg.jpg https://s3-eu-west-1.amazonaws.com/prod-ucs-content-store-eu-west/content/pii:S0926860X23003502/HIGHRES/image/jpeg/0cd376ba0b1da4ee25208ac6ea6124d5/sc2_lrg.jpg sc2 sc2_lrg.jpg jpg 182795 2042 2495 IMAGE-HIGH-RES 1-s2.0-S0926860X23003502-gr1_lrg.jpg https://s3-eu-west-1.amazonaws.com/prod-ucs-content-store-eu-west/content/pii:S0926860X23003502/HIGHRES/image/jpeg/3c116cb339edcb1c254e9185fad49cc8/gr1_lrg.jpg gr1 gr1_lrg.jpg jpg 412172 1798 3326 IMAGE-HIGH-RES 1-s2.0-S0926860X23003502-gr4_lrg.jpg https://s3-eu-west-1.amazonaws.com/prod-ucs-content-store-eu-west/content/pii:S0926860X23003502/HIGHRES/image/jpeg/681846de54fd452c1de50aceadb6a183/gr4_lrg.jpg gr4 gr4_lrg.jpg jpg 818730 3093 2994 IMAGE-HIGH-RES 1-s2.0-S0926860X23003502-gr5_lrg.jpg https://s3-eu-west-1.amazonaws.com/prod-ucs-content-store-eu-west/content/pii:S0926860X23003502/HIGHRES/image/jpeg/22bf3897bf524006fc02f6c1c2f8469b/gr5_lrg.jpg gr5 gr5_lrg.jpg jpg 974857 2913 2994 IMAGE-HIGH-RES 1-s2.0-S0926860X23003502-gr2_lrg.jpg https://s3-eu-west-1.amazonaws.com/prod-ucs-content-store-eu-west/content/pii:S0926860X23003502/HIGHRES/image/jpeg/c07575a661430cee1b112386bf8fbaa6/gr2_lrg.jpg gr2 gr2_lrg.jpg jpg 313497 1223 2994 IMAGE-HIGH-RES 1-s2.0-S0926860X23003502-gr3_lrg.jpg https://s3-eu-west-1.amazonaws.com/prod-ucs-content-store-eu-west/content/pii:S0926860X23003502/HIGHRES/image/jpeg/209a00606580ab87c8c3abfe59b87b73/gr3_lrg.jpg gr3 gr3_lrg.jpg jpg 230282 1569 1663 IMAGE-HIGH-RES 1-s2.0-S0926860X23003502-gr8_lrg.jpg https://s3-eu-west-1.amazonaws.com/prod-ucs-content-store-eu-west/content/pii:S0926860X23003502/HIGHRES/image/jpeg/c349cf53458807b81bf11348cf1de373/gr8_lrg.jpg gr8 gr8_lrg.jpg jpg 95987 1290 1663 IMAGE-HIGH-RES 1-s2.0-S0926860X23003502-gr9_lrg.jpg https://s3-eu-west-1.amazonaws.com/prod-ucs-content-store-eu-west/content/pii:S0926860X23003502/HIGHRES/image/jpeg/eb47284e4c804258bb682cef775bd5cf/gr9_lrg.jpg gr9 gr9_lrg.jpg jpg 109581 1278 1665 IMAGE-HIGH-RES 1-s2.0-S0926860X23003502-gr6_lrg.jpg https://s3-eu-west-1.amazonaws.com/prod-ucs-content-store-eu-west/content/pii:S0926860X23003502/HIGHRES/image/jpeg/9b30953f8e9080fcd4f445af786bacca/gr6_lrg.jpg gr6 gr6_lrg.jpg jpg 491252 2653 3022 IMAGE-HIGH-RES 1-s2.0-S0926860X23003502-gr7_lrg.jpg https://s3-eu-west-1.amazonaws.com/prod-ucs-content-store-eu-west/content/pii:S0926860X23003502/HIGHRES/image/jpeg/1086c64014840d6a8f06501cd2bd623b/gr7_lrg.jpg gr7 gr7_lrg.jpg jpg 732880 2079 2994 IMAGE-HIGH-RES 1-s2.0-S0926860X23003502-mmc1.doc https://s3-eu-west-1.amazonaws.com/prod-ucs-content-store-eu-west/content/pii:S0926860X23003502/mmc1/MAIN/application/msword/fbdfcbc99e1ae8263a176130f7510a2e/mmc1.doc mmc1 mmc1.doc doc 990720 APPLICATION 1-s2.0-S0926860X23003502-si0001.svg https://s3-eu-west-1.amazonaws.com/prod-ucs-content-store-eu-west/content/pii:S0926860X23003502/image/svg+xml/9c4c0fdfb26a0359d9dd71054f6d610e/si0001.svg si0001 si0001.svg svg 5567 ALTIMG 1-s2.0-S0926860X23003502-si0002.svg https://s3-eu-west-1.amazonaws.com/prod-ucs-content-store-eu-west/content/pii:S0926860X23003502/image/svg+xml/95f350249cc1b6124f9cdd15bb6e29fb/si0002.svg si0002 si0002.svg svg 5345 ALTIMG 1-s2.0-S0926860X23003502-si0003.svg https://s3-eu-west-1.amazonaws.com/prod-ucs-content-store-eu-west/content/pii:S0926860X23003502/image/svg+xml/aadd85c9f022c9c18be86660edb2bd62/si0003.svg si0003 si0003.svg svg 3140 ALTIMG 1-s2.0-S0926860X23003502-si0004.svg https://s3-eu-west-1.amazonaws.com/prod-ucs-content-store-eu-west/content/pii:S0926860X23003502/image/svg+xml/b9b5c1830778d75d87fde55f306ffba3/si0004.svg si0004 si0004.svg svg 6694 ALTIMG 1-s2.0-S0926860X23003502-si0005.svg https://s3-eu-west-1.amazonaws.com/prod-ucs-content-store-eu-west/content/pii:S0926860X23003502/image/svg+xml/8670632db6498ea0990547e55f27b817/si0005.svg si0005 si0005.svg svg 4007 ALTIMG 1-s2.0-S0926860X23003502-si0006.svg https://s3-eu-west-1.amazonaws.com/prod-ucs-content-store-eu-west/content/pii:S0926860X23003502/image/svg+xml/99704b3f30da2e75aa8b20e1a3b849ae/si0006.svg si0006 si0006.svg svg 7748 ALTIMG 1-s2.0-S0926860X23003502-si0007.svg https://s3-eu-west-1.amazonaws.com/prod-ucs-content-store-eu-west/content/pii:S0926860X23003502/image/svg+xml/6461aa344ec7afedaaab58d72eafe179/si0007.svg si0007 si0007.svg svg 6731 ALTIMG 1-s2.0-S0926860X23003502-am.pdf am am.pdf pdf 2843776 AAM-PDF https://s3-eu-west-1.amazonaws.com/prod-ucs-content-store-eu-west/content/egi:10F0J7K7N74/MAIN/application/pdf/fe68d4941cf55270427168db48e20228/am.pdf APCATA 119370 119370 S0926-860X(23)00350-2 10.1016/j.apcata.2023.119370 Elsevier B.V. Fig. 1 Wide-angle XRD patterns of various catalysts (a); Lattice spacing of the phase of t-ZrO2 (101) as a function of the value of n for Al2O3-ZrO2-nF catalysts (b); Low-angle XRD patterns of Al2O3-ZrO2-nF catalysts (c). Fig. 1 Fig. 2 N2 adsorption/desorption isotherms (a); Pore-size distributions (b) of Al2O3-ZrO2-nF catalysts. Fig. 2 Fig. 3 Raman spectra of various catalytic samples. Fig. 3 Fig. 4 SEM images of catalytic samples ZrO2 (a); Al2O3-ZrO2-0 F (b); Al2O3-ZrO2-0.5 F (c); Al2O3-ZrO2-1 F (d); Al2O3-ZrO2-2 F (e); and elemental mapping images of Zr, Al, F and O for the Al2O3-ZrO2-1 F sample (f). Fig. 4 Fig. 5 TEM images of ZrO2 (a); Al2O3-ZrO2-1 F (b); and HR-TEM of ZrO2 (c); Al2O3-ZrO2-1 F (d). Fig. 5 Fig. 6 NH3-TPD (a); and CO2-TPD profiles of ZrO2 and Al2O3-ZrO2-nF catalysts. Fig. 6 Fig. 7 Effect of reaction temperature (a); reaction time (b); catalyst amount (c); and reusability of Al2O3-ZrO2-1 F catalyst (d) for the GLC synthesis from glycerol and DMC. Fig. 7 Fig. 8 Glycerol conversion against acidity/basicity ratio for all the catalysts of this work.Reaction conditions: 110 oC; 1.5 h; catalyst amount, 0.1 g; 40 mmol glycerol, 40 mmol DMC. Fig. 8 Fig. 9 The correlation between the glycerol conversion and the acidity/basicity ratio for all the catalysts. Reaction conditions: 110 oC; 20 min; catalyst amount, 0.1 g; 40 mmol glycerol, 40 mmol DMC. Fig. 9 Scheme 1 Possible reaction system for the transesterification of DMC with glycerol in this work. Scheme 1 Scheme 2 The cooperative effect of acidic-basic sites of Al2O3-ZrO2-nF catalysts on the synthesis of GLC from reaction of glycerol and DMC. Scheme 2 Table 1 Textural, chemical acidic and basic properties of ZrO2, F-ZrO2 and Al2O3-ZrO2-nF catalysts. Table 1 Sample Atomic ratio in fresh catalysts Atomic ratio in used catalysts a S BET (m2 g-1) Pore volume (cm3 g-1) Total acidity (μmol g-1) Total basicity (μmol g-1) A/B b Al:Zr F:Al Al:Zr F:Al Al2O3 - - - - 227 0.27 111.5 38.3 2.91 ZrO2 0 - 0 - 218 0.29 57.2 46.0 1.24 Al2O3-ZrO2-0 F 0.17 0:1 0.17 0:1 203 0.23 101.6 51.7 1.97 Al2O3-ZrO2-0.5 F 0.18 0.46:1 0.18 0.46:1 189 0.37 86.8 90.2 0.96 Al2O3-ZrO2-1 F 0.18 0.93:1 0.18 0.93:1 168 0.28 80.3 105.3 0.76 Al2O3-ZrO2-2 F 0.19 1.88:1 0.18 1.87:1 145 0.31 73.1 126.5 0.58 F-ZrO2 - - - - 162 0.22 32.7 135.6 0.24 a Reaction conditions: 40 mmol glycerol; 40 mmol DMC; reaction temperature, 110 oC; reaction time, 1.5 h; catalyst amount, 0.1 g. b : The acidity/basicity ratio of catalyst. Table 2 Effect of DMC to glycerol molar ratio on the catalytic performance of various catalysts. Table 2 Entry Catalyst Starting mole (mmol) DMC to glycerolmolar ratio Glycerolconversion (%) Product selectivity (%) GLC yield (%) DMC Glycerol GLC GDC GD 1 - 80 40 2:1 20.5 100 0 0 20.5 2 ZrO2 80 40 2:1 46.6 100 0 0 46.6 3 Al2O3 80 40 2:1 32.5 100 0 0 32.5 4 Al2O3-ZrO2-0 F 80 40 2:1 52.9 99.6 0.2 0.2 52.7 5 Al2O3-ZrO2-0.5 F 80 40 2:1 79.8 98.4 0.5 1.1 78.5 6 Al2O3-ZrO2-1 F 80 40 2:1 100 95.2 1.6 3.2 95.2 7 Al2O3-ZrO2-2 F 80 40 2:1 93.7 93.1 2.1 4.8 87.2 8 ZrO2 40 40 1:1 26.3 100 0 0 26.3 9 Al2O3 40 40 1:1 19.0 100 0 0 19.0 10 Al2O3-ZrO2-0 F 40 40 1:1 35.3 99.8 0 0.2 35.2 11 Al2O3-ZrO2-0.5 F 40 40 1:1 68.6 98.3 0.5 1.2 67.4 12 Al2O3-ZrO2-1 F 40 40 1:1 98.4 92.7 1.2 6.1 91.2 13 Al2O3-ZrO2-2 F 40 40 1:1 87.1 88.4 4.0 7.6 77.0 14 F-ZrO2 40 40 1:1 72.2 78.1 9.6 12.3 56.4 Reaction conditions: reaction temperature, 110 oC; Reaction time, 1.5 h; catalyst amount, 0.1 g. Table 3 Activity comparison of Al2O3-ZrO2-1 F with other reference catalysts with equimolar DMC/glycerol ratio. Table 3 Entry Catalyst Glycerol conversion (%) DMC/glycerol ratio Indicialglycerol (mmol) Temperature (oC) Time (h) Catalyst amount (g) TOF (h-1) a Reference First cycle Fifth cycle 1 Al2O3-ZrO2-1 F 98.4 97.6 1:1 40 110 1.5 0.1 36.2 This work 2 SrTiO3-200b 77.7 Not provided 1:1 21.73 120 1.5 0.1 15.5 [50] 3 YNbO4-200b 82.5 Not provided 1:1 21.73 120 4 0.1 15.2 [50] 4 Mg1.2Ca0.8O2 ≈ 70 Not provided 1:1 108.6 90 1.5 0.3 ≈ 23.3 [51] 5 Mg1.2Ca0.8O2 100 ≈ 90 2:1 108.6 90 1.5 0.3 33.3 [51] 6 KF/γ-Al2O3 91.4 80.8 1:1 40 110 1.5 0.1 33.7 [54] 7 Ti-SBA-15 78.3 77.5 1:1 40 110 1.5 0.1 28.8 [28] 8 MgO@ZIF-8 80.6 79.1 1:1 40 110 1.5 0.1 29.7 [31] a The values of the TOF were calculated according to the glycerol conversion obtained in the first cycle. Table 4 The values of E-factor, PMI and AU for the GLC synthesis over various catalysts a . Table 4 Entry Catalyst E-factor PMI AU (%) 1 ZrO2 0 5.95 100 2 Al2O3 0 8.23 100 3 Al2O3-ZrO2-0 F 0 4.44 99.8 4 Al2O3-ZrO2-0.5 F 0 2.32 98.0 5 Al2O3-ZrO2-1 F 0 1.71 92.2 6 Al2O3-ZrO2-2 F 0 2.03 86.5 7 F-ZrO2 0 2.77 74.3 a The data were calculated based on the catalytic results from entries 8–14 in Table 2 using formulas 5–7. The atom-efficient production of glycerol carbonate via transesterification between dimethyl carbonate and glycerol over fluorinated Al2O3-ZrO2 solid solution catalysts with suitable acidic-basic property Dengfeng Wang Project administration Supervision Writing − review & editing, Project administration, Supervision Dong Bai Data curation, Investigation Jie Xiong Data curation, Formal analysis Zheng Chen Supervision, Funding acquisition Xueying Zhao Software, Investigation Hongwei Wu Writing − review & editing ⁎ Jianfeng Shan Funding acquisition, Investigation ⁎ Shuwei Wei Resources, Visualization, Supervision, Writing − review & editing ⁎ Xuelan Zhang Conceptualization, Methodology, Data curation, Writing − original draft, Investigation ⁎ College of Chemistry, Chemical Engineering and Materials Science, Zaozhuang University, Zaozhuang 277160, PR China College of Chemistry, Chemical Engineering and Materials Science, Zaozhuang University Zaozhuang 277160 PR China College of Chemistry, Chemical Engineering and Materials Science, Zaozhuang University, Zaozhuang, 277160, P.R. China ⁎ Corresponding authors. A series of Al2O3-ZrO2-nF solid solution catalysts (n was the F: Al atomic ratios) with Al: Zr molar ratio of 0.2, was fabricated by addition of varied amounts of (AlF6)3- into the ZrO2 via a co-precipitation method. To our delight, the acidic-basic properties of Al2O3-ZrO2-nF can be tuned by the change of n. Then, the role of acidic-basic sites was investigated for the glycerol carbonate (GLC) production from glycerol and dimethyl carbonate (DMC). Despite that the more basic samples exhibited higher reactivities compared to that of the more acidic ones, the cooperative effect between the acidic-basic pairs can enhance the catalyst activity strongly. So, the catalyst with F/Al= 1.0 can realize the quantitative and selective transformation of glycerol to GLC applying DMC/glycerol of 1:1 ratio with a GLC yield of 91.2%, owing to its appropriate acidic-basic property. Furthermore, the uniform solid solution structure can prevent the generation of free Al or F species, assuring the catalytic material an excellent stability. More importantly, several green parameters including process mass intensity, environmental factor and atom utilization were calculated to confirm the environmental and economic compatibility of the GLC synthesis over the model catalyst. Graphical Abstract ga1 Keywords Glycerol Transesterification Glycerol carbonate ZrO2-based catalyst Fluorine content Data availability The authors do not have permission to share data. 1 Introduction In recent decades, the fast-growing consumption of fossil resources has not only given rise to their depletion, but also led to many environmental problems. Especially, the CO2 concentration in the atmosphere has continuously risen year by year, mainly responsible for the global warming [1,2]. Herein, the conversion of biomass into renewable fuels is generally accepted as a promising strategy, offering new, green energy resources without CO2 emissions. In this sense, the biodiesel industry, involving the transesterification of seed oils with methanol, has been rapidly developed [3]. However, a huge amount of crude glycerol with low-price is also co-formed, undoubtedly lowering the biodiesel business competitiveness to some degree. Therefore, it is an enormous significance to explore effective catalytic means for the glycerol conversion into valuable chemicals [4–6]. Over the past decades, several interesting techniques such as reduction into 1,2-propanediol [7], selective oxidation into dihydroxyacetone [8,9], dehydration into lactic acid [10], glycerol conversion into fuel additives [11], and carboxylation into glycerol carbonate (GLC) [12] have been proposed. Thanks to its outstanding merits of high flash point, high boiling point, low toxicity, and biodegradability, GLC has been applied broadly as surfactants, polar solvents, gas separation membranes and wetting agents for cosmetic clays [13]. In addition, it can also be used as a multi-functional and high-reactive starting material for the polymer formation [14]. It is famous that GLC could be created between reaction of glycerol with diverse types of the carbonate group, such as phosgene [15], CO [16], and CO2 [12]. However, the industrial application of the above-mentioned methodologies has been constrained dramatically by their corresponding disadvantages like application of high-toxic raw materials, easy explosion, low glycerol conversion and requirement of harsh reaction conditions [17]. Different from these approaches, the reaction between glycerol and urea can be performed following the atom-economic rule with a glycerol/urea molar ratio of 1:1. Unfortunately, a great deal of toxic and corrosive NH3 is co-generated and must be removed timely under vacuum. Otherwise, the GLC yield would be extremely low [18]. Besides, the industrial utilization of this process is hampered to some extent by its inferior GLC selectivity because of the co-manufacture of many by-products [19]. Alternatively, a greener and simpler synthetic technique would be the transesterification between glycerol and organic carbonates, which can be carried out below 150 oC without release of poisonous chemicals [20]. Of diverse carbonate candidates, dimethyl carbonate (DMC) is the first choice due to its facile separation of co-product of methanol, which can decrease the entire process cost significantly, thanks to the low boiling point of methanol [20,21]. Homogeneous catalysts (NaOH, Na2CO3) exhibited high reactivities for the GLC synthesis, but they suffered from poor recovery and environment pollution greatly [22]. Herein, numerous heterogeneous catalysts such as single oxides [22], mixed oxides [23], supported catalysts [24], hydrotalcites [25], calcined hydrotalcites [26,27], silica-based catalysts [28], and aluminates [29] have been estimated for the transesterification of glycerol and DMC in the prior documents. Despite that many meaningful results have been obtained, the synthesis of GLC is often conducted with DMC/glycerol molar ratios between 3 and 5. Obviously, this is not in accordance with the principle of “atom economy”, since there would be excess DMC molecules in the reaction system, creating much cost and high inconvenience for the following GLC purification. Therefore, we are still lacking of a novel catalyst fulfilling the efficient GLC production with a yield over 90% using an equimolar DMC/glycerol ratio, under mild and solvent-free conditions. On the other hand, the importance of acidic-basic pairs for the transesterification is widely accepted by a lot of researchers, but there still exists a controversy that which center gives a major contribution for the high yield of GLC. For example, Liu et al. observed that the catalytic ability of transition metal doping Mg-Al mixed oxides originated from their surface basic sites [27]. Similarly, G. Parameswaram et al. proposed that the high reactivity of MgO-CeO2 samples was ascribed to the existence of strong basic sites [30]. However, Parmila et al. demonstrated that the acidic nature of Ti-SBA-15 was the decisive factor for the GLC synthesis [28]. Besides, some other reports considered that the activities of samples depended on the synergistic effect of acidic-basic sites [31,32]. In our previous experiment, we merely evaluated the relationship between basic properties and catalytic performances of CaO-ZrO2, but lacking of systematic study of influence of catalyst acidic nature on the GLC synthesis [33]. So, the role of acidic-basic pairs for the GLC manufacture should be better understood and this issue is still widely open for a further investigation. In this work, a series of fluorinated Al2O3-ZrO2 catalysts with a large range of F content were fabricated utilizing Na3AlF6 as the F source. Precise insights into the nature of acidic-basic pairs for the GLC synthesis were achieved due to their varied acidic-basic properties along with different catalytic performances. To our delight, we found that this catalytic system could provide an efficient GLC production under mild and atom-economic conditions with a high GLC yield of 91.2%. At the same time, the overall investigation concerning green chemistry metrics proved that this catalytic process was significantly promising for its economic and environmentally benign advantages. Finally, the developed catalyst can be reused up to four cycles without a notable loss of activity due to its stable and uniform solid solution structure. 2 Experimental 2.1 Catalyst preparation Al2O3-ZrO2-nF catalysts with the same Al3+/Zr4+ atomic ratio of 0.2, but varying F/Al molar ratios (n = 0, 0.5, 1, 2), were obtained by a co-precipitation procedure followed by the reflux treatment [21]. In the present work, Al(NO3)3·9 H2O or a mixture of Al(NO3)3·9 H2O and Na3AlF6 was employed as the source of aluminum, while fluorine was only from Na3AlF6. Taking Al2O3-ZrO2-1 F catalyst as an example to illustrate the detailed preparation process: 8.58 g Zr(NO3)4·5 H2O, 1.25 g Al(NO3)3·9 H2O together with 0.14 g Na3AlF6 were dissolved into 100 mL deionized water. Another 100 mL aqueous solution containing 5.76 g (NH4)2CO3 was prepared as the precipitant. Then, these two solutions were simultaneously added dropwise into a beaker with vigorous stirring at 50 oC to generate a white precipitate. The slurry was continuously stirred for another 2 h at 50 oC, and then moved into a flask, refluxed in deionized water at 80 oC for 6 h. After cooled to room temperature, the suspension liquid was filtered and rinsed with deionized water for several times until the pH of filtrate became neutral. Finally, the solid sample was dried at 100 oC for 8 h and calcined at 600 oC for 6 h under N2 atmosphere. For pure Al2O3 and ZrO2, the synthesis method was similar to the aforementioned procedure, but only Al(NO3)3·9 H2O or Zr(NO3)4·5 H2O was selected to prepare the corresponding oxide, respectively. Additionally, AlF3 and ZrF4 were purchased from commercial reagent companies without any purification. For comparison, F-containing ZrO2 catalyst without Al was prepared by the impregnation method. Briefly, 1.0 g grinded pristine ZrO2 obtained by the co-precipitation process was put into a 20 mL aqueous solution having 0.1 g NaF. After stirred for 2 h, the impregnated catalytic material (denoted as F-ZrO2) was treated at 50 oC in vacuo to remove water overnight. 2.2 Catalyst characterization X-ray diffraction (XRD) patterns of samples were recorded on an X-ray diffractometer (Rigaku MiniFlex) using Cu Kα radiation (λ = 1.5418 Å) with a step of 4o/min in a 2θ range of 5–80o. Inductively coupled plasma-optical emission spectroscopy (ICP-OES) was employed to determine the chemical compositions of catalysts using the Thermo iCAP 6300 instrument. In addition, fluorine content in the catalysts was analyzed by the ion-selective electrode method. Textural properties of catalysts were studied by nitrogen physisorption experiments at − 196 oC on a Micromeritics ASAP-2020 instrument. Before analysis, the samples were preheated at 300 oC for 6 h under vacuum to purify the sample surface. The BET isotherm and BJH model were employed to determine the specific area and pore volume, respectively. The Raman spectra were acquired on a Horiba-Jobin-Yvon spectrometer using a He-Ne laser light source excited by the 532 nm laser. Scanning electron microscope (SEM) image of catalysts was obtained on a Hitachi S4800 apparatus performing at an accelerating voltage of 20.00 kv. The transmission electron microscopy (TEM) of catalysts was conducted on a JEOL JEM-2100 device at 200 kV. Acidic-basic properties of samples were measured by the temperature programmed desorption of ammonia (NH3-TPD) and carbon dioxide (CO2-TPD) using NH3 and CO2 as probe molecules, respectively. Prior the test, 100 mg of catalysts were pretreated in Ar at 300 oC for 2 h to clean their surfaces. Next, the samples were treated in the flow of NH3/CO2 (40 mL·min-1) for 3 h and then were flushed with Ar flow (40 mL·min-1) to eliminate physical adsorbed molecules. Finally, the TPD tests were started from 30 to 600 oC with a speed of 10 oC /min under Ar flow (40 mL·min-1), and the desorbed probe molecules were monitored by an AMETEK mass spectrometer. Their peak areas were quantitatively calculated by injection of pure NH3 and CO2 pulses preliminarily, respectively. 2.3 Catalytic reaction The catalytic experiments for the solventless reaction of glycerol and DMC were evaluated in a 50 mL stainless-steel autoclave with a magnetic stirrer. In a typical test, 0.1 g freshly prepared catalysts, 40 mmol glycerol and 40 mmol DMC were successively put into the reactor. Afterwards, the reaction mixture was stirred constantly at 110 oC for 1.5 h, and quickly cooled to room temperature by a cold-water bath to stop the reaction. The solid catalyst was separated from the reaction products by filtration, washed with methanol several times and dried at 80 oC over night for the next run. The liquid products were analyzed by a GC equipped with a HP-5 capillary column and a flame ionization detector. The column was initially set as 80 oC for 3 min, then increased to 240 oC with a heating rate of 30 oC/min, and kept this temperature for another 3 min. The FID and injection temperatures were fixed at 250 oC and 260 oC, respectively. The products quantification was calculated on the basis of the response factors of the reactants and products. The reactant conversion (X reactant), products selectivity (S product) and products yield (Y product) were defined as Eqs. (1)−(3), respectively: (1) X reactant = Initial reactant mol − Unreacted reactant ( mol ) Inicial reactant ( mol ) × 100 % (2) S product = Product ( mol ) Inicial reactant ( mol ) − Unreacted reactant ( mol ) × 100 % (3) Y product = X reactant × S product × 100 % (4) TOF = Inicial glycerol mol × X glycerol × M glycerol ( g mol − 1 ) m catalyst g × Reaction time ( h ) × 100 The turnover frequency (TOF) was determined by the formula 4, where M glycerol , m catalyst are molecular weight of glycerol and catalyst amount, respectively. Here, the catalyst amount instead of the number of active sites because that the catalytic activities of samples were not related to Al, F, Zr or O atoms, but to the acidic-basic pairs. 3 Results and discussion 3.1 Textural and structural properties of the catalytic samples Chemical analysis demonstrated that the Al/Zr atomic ratio in Al2O3-ZrO2-nF samples were very close to 0.2 (see Table 1). Additionally, the F/Al atomic ratio in fluorinated Al2O3-ZrO2 was found to be close to the nominal values, except for Al2O3-ZrO2-2 F. According to previous documents, these results were relevant to the stability of (AlF6)3- species in solution [34,35]. Due to the ionic equilibrium between (AlF6)3- and (AlF4)- in aqueous solution containing aluminum-sodium fluoride mixtures, only (AlF6)3- can be precipitated and incorporated into solid structure under alkaline conditions. In this work, during procedure of co-precipitation, (AlF6)3- was formed constantly to meet the Le-Chatelier’s principle. As too large amount of (AlF6)3- species was added to fabricate catalyst of Al2O3-ZrO2-2 F, some (AlF4)- species, which could not enter the solid structure, might still exist in the mother solution, giving rise to the lower F content for Al2O3-ZrO2-2 F compared to its corresponding nominal value. Fig. 1(a) displays the XRD patterns of all the catalytic samples. For the prepared Al2O3 sample, characteristic diffraction peaks of γ-Al2O3 appeared at 2θ = 31.9o, 37.6o, 45.8o, and 66.8o (γ-Al2O3, JCPDS 29–0063). As to the ZrO2 obtained via the co-precipitation method, it was mainly in the monoclinic ZrO2 phase (m-ZrO2, JCPDS 37–1484) mixed with some in the tetragonal ZrO2 phase (t-ZrO2, JCPDS 79–1769) [36]. After the introduction of guest atoms of Al3+ and F-, Al2O3-ZrO2-nF samples only remained t-ZrO2 peaks, implying the transformation of m-ZrO2 to t-ZrO2. Besides, no diffraction lines ascribed to Al2O3, fluorides such as AlF3 and ZrF4 emerged. More importantly, the t-ZrO2 peak (101 plane) at around 30o gradually moved to the lower angle with the increase of F/Al atomic ratio. We compared the lattice values of this plane for each Al2O3-ZrO2-nF sample in Fig. 1(b). Obviously, the spacing parameters increased monotonically with the raise of n due to the relatively higher ionic radius of F- (1.4 Å) in comparison of that of Zr4+ (0.84 Å) [37] . Furthermore, the d 101 value of Al2O3-ZrO2-0 F was lower than that of pure ZrO2 (0.29453 nm) because of the lowest ionic radius of Al3+ (0.54 Å) among the three kinds of ions. Thereby, it can be said that Al and F species had been incorporated into t-ZrO2 matrix, resulting in the generation of a solid solution structure [37,38]. The low-angle XRD patterns of ZrO2 and Al2O3-ZrO2-nF catalysts are shown in Fig. 1(c). An obvious peak can be found at about 1o for pure sample of ZrO2, pointing out that it possessed a relatively uniform mesoporous structure [21,39]. However, introduction of guest species into ZrO2 caused the decline of intensity of this peak. In particular, catalyst of Al2O3-ZrO2-2 F showed the lowest intensity, suggesting that it exhibited a poorly ordered mesoporous structure compared to other samples. This might give an adverse effect on their BET surface areas and exposure of active sites, in turn, unfavorable for their catalytic activities. To better illustrate the mesoporous structure of ZrO2 and Al2O3-ZrO2-nF catalysts, they were further analyzed by N2 absorption/desorption characterization. Fig. 2 shows their N2 absorption-desorption isotherms and BJH pore size distribution profiles. Clearly, all the samples had type IV isotherms and exhibited meso-pores with a pore volume of 0.23–0.37 cm3 g-1 (see Table 1) [40]. Meanwhile, the isotherms hysteresis loops varied remarkably with the change of the F content. Larger hysteresis loops were found in ZrO2 and Al2O3-ZrO2-0 F samples, implying the formation of well-defined pore and larger BET surface areas. Addition of F gave rise to the decline of intensity of the hysteresis loops. Especially, only a diminutive H3-shaped hysteresis loop emerged when the value of n was 2, indication of its poorly defined mesoporous structure, which was well consistent with the results of low-angle XRD. Moreover, pore size distribution profiles displayed that the range of pore diameter broadened as the increase of F content, also verifying the conclusion above-mentioned. The BET surface area (S BET) of catalytic materials is given in Table 1. It was easy to find that the order of S BET was inverse with that of value of n. As a result, Al2O3-ZrO2-2 F exhibited the lowest S BET of 145 m2 g-1. The solid solution structure of the Al2O3-ZrO2-nF samples was further affirmed by Raman spectroscopy with a 532 nm laser. For comparison, Al2O3, AlF3 and ZrF4 were examined together and the spectra are shown in Fig. 3. Clearly, pristine ZrO2 showed the characteristic bands associated with m-ZrO2 phase at approximate 331, 380, 538 and 560 cm-1. Meanwhile, the leftover peaks centered at about 269, 316, 470 and 645 cm-1 could be assigned to t-ZrO2 phase. Interestingly, upon adding foreign Al3+ or F- species, the resulted catalytic materials of Al2O3-ZrO2-nF only presented characteristic peaks of t-ZrO2 phase, confirming that doping guest atoms can stabilize the tetragonal structure of ZrO2. We also noted that the peaks at 269 and 645 cm-1 continuously shifted to lower wavenumbers with the increase of n. Furthermore, the Raman shifts belonged to Al2O3, AlF3 or ZrF4 were not observed for Al2O3-ZrO2-nF. All these facts proved again that the guest species had entered into t-ZrO2 lattice, producing a solid solution structure. The SEM images of the ZrO2 and Al2O3-ZrO2-nF catalysts are shown in Fig. 4. It can be seen that all the catalytic samples mainly consisted of irregular sphere-like particles. As to catalysts of ZrO2 and Al2O3-ZrO2-0 F, their crystal sizes were detected between 10 and 20 nm. Upon introduction of F-, some fragments appeared and the spherical structure became vaguer slightly as the increase of n value. Besides, compared to the fluorine-free materials, the dispersion of particles was poorer over fluorine-containing samples and the particles agglomerated severely for the catalyst of Al2O3-ZrO2-2 F. Meanwhile, the elemental maps of Zr, Al, F and O for the sample of Al2O3-ZrO2-1 F are given in Fig. 4(f), in which a relatively uniform distribution of these elements can be observed. This also revealed that F- had been incorporated the catalyst structure successfully. To have more accurate information at the nanoscale, both the ZrO2 and Al2O3-ZrO2-nF catalysts were further investigated by TEM (see Fig. 5). It can be seen that ZrO2 and Al2O3-ZrO2-1 F were mainly composed of spherical nanoparticles with a diameter range of 10–20 nm, fully in line with their SEM images in Fig. 4. Furthermore, the nanoparticles present in both materials were interconnected. As a result, it can be expected that there might be some slit pore differences between the nanocrystals and micrometer-scale morphology. Indeed, two kinds of crystal (m-ZrO2 and t-ZrO2) structures and crystal lattice spacings were apparently observed for ZrO2 sample, and the m-ZrO2 was in predominant. As to the catalyst of Al2O3-ZrO2-1 F, the measured lattice parameters were around 2.95 Å and 2.73 Å, relevant to the (101) and (110) plane of t-ZrO2, respectively [41]. Similar experimental results were also detected for another three fluorinated Al2O3-ZrO2 catalysts (see Fig. S1). These phenomena well agreed with the XRD and Raman experimental results and further affirmed that adding Al3+ and F- could bring about the conversion of the m-ZrO2 to t-ZrO2 phase. 3.2 Surface acidic-basic property The NH3-TPD profiles of the catalysts are shown in Fig. 6(a). It can be seen that all the TPD curves consist of several NH3 desorption peaks, suggesting a variety of acidic sites with different strength available on the surface of catalytic samples. According to the desorption temperatures, the acidic sites could be split into three groups, which were corresponding to weak acidic sites (below 200 oC), medium acidic sites (between 200 and 400 oC) and strong acidic sites (over 400 oC), respectively [42]. Moreover, the desorption curves of the weak and acidic sites can be further divided into four peaks, named as α 1 peak (below 150 oC), α 2 peak (between 150 oC and 200 oC), β 1 peak (between 200 oC and 300 oC) and β 2 peak (between 300 oC and 400 oC), respectively. Meanwhile, the surface acidity of catalysts is shown in Table 1, and the acidic sites distribution on these catalysts is given in Table S1. Evidently, bare ZrO2 exhibited the lowest acidity of 57.2 μmol g-1 among these catalysts. Furthermore, its weak acidic sites contribution to the total acidic sites was about 68%, whereas that of the strong acidic sites was only 10.8%. Interestingly, addition of Al3+ into ZrO2 gave a great impact on the distribution of acidic sites of catalytic samples. In comparison with the catalyst of ZrO2, the medium and strong acidic sites of the Al-containing samples became more intense at the expense of the weak counterparts. Especially, the proportion of medium and strong acidic sites over Al2O3-ZrO2-0 F was 83.5%, which was approximate 2.5 times that of Al-free material (ZrO2). More importantly, its acidity was improved obviously due to that Al2O3 was more acidic than ZrO2 [43]. Upon incorporation of (AlF6)3- into it, a consecutive decline of acidic density can be seen with the rise of value of n. These results can be explained as follows: on the one hand, addition of foreign atoms into ZrO2 gave rise to an evident reduction in the surface area (see Table 1), which was negative for the exposure of acidic sites. On the other hand, introduction of Al3+ can enhance the catalyst acidity. Therefore, the beneficial effect derived from Al3+ surpassed the harmful effect caused by the decline of surface area on Al2O3-ZrO2-nF acidic properties, judging from that they had greater numbers of acidic sites than that of ZrO2. However, as to the fluorine-modified Al2O3-ZrO2 catalysts (Al2O3-ZrO2-0.5 F, Al2O3-ZrO2-1 F and Al2O3-ZrO2-2 F), considering that they contained similar content of Al, so, the passive effect of surface area on their total acidic densities was in a dominant position. Thus, their surface acidities decreased as the following order: Al2O3-ZrO2-0 F> Al2O3-ZrO2-0.5 F> Al2O3-ZrO2-1 F> Al2O3-ZrO2-2 F> ZrO2. Fig. 6(b) illustrates the CO2-TPD profiles of ZrO2 and Al2O3-ZrO2-nF samples. It could be observed that all the materials contained three kinds of basic sites. The desorption peaks in the range of 50–200 oC, 200–400 oC and 400–600 oC were ascribed to weak, medium and strong basic sites, respectively [42]. In case of ZrO2 and Al2O3-ZrO2-0 F catalysts, the above-mentioned basic sites were corresponding to OH- groups, metal-oxygen pairs and unsaturated O2- atoms, respectively [19,21,39]. After introduction of (AlF6)3- into the catalytic samples, the metal-fluorine pairs and unsaturated F- atoms were also produced, contributing to medium and strong basic sites, separately [44]. At the same time, the desorption profiles of fluorinated samples assigned to medium basic sites could be further divided into two peaks (δ 1 and δ 2 peak). Furthermore, with the increase of F content, the desorption peak of strong basic sites gradually shifted to higher temperature, indicating that the basic strength of catalysts was promoted with the rise of n. Besides, the number of the basic sites was analyzed, and the results are demonstrated in Table1 and Table S1. Compared to that of pristine ZrO2, the contribution of medium and strong basic sites presented an obvious increase for sample of Al2O3-ZrO2-0 F. However, a little enhancement was found for the total number of basic sites. That’s to say, Al3+ alone hardly increased the basicity of ZrO2 enormously, for Al2O3 was usually regarded as a more acidic oxide [22,45]. The highly acidic character of Al2O3 was also proved by the NH3-TPD/CO2-TPD profiles in Fig. S2 (a), which clearly showed that Al2O3 had a broad NH3 desorption peak over a wide temperature range of 95–600 oC. In contrast, it only showed a small CO2 desorption peak. As a result, the acidity and basicity of the prepared Al2O3 were 111.5 μmol g-1 and 38.3 μmol g-1, respectively (see Table 1). In theory, low surface area led to the decrease of the exposed basic sites. Nevertheless, doping (AlF6)3- into ZrO2 can increase the basicity of the resulted catalysts remarkably, in spite of its adverse influence on their surface areas. A plausible explanation for such phenomenon could be suggested as follows: it was well known that the creation of metal-fluorine pairs hardly reduced the number of metal-oxygen pairs, because that the metal content in pairs (M-O and M-F) only occupied very little proportion of the entire metal content in mixed metal oxide catalysts [46]. Thereby, increase of F content brought about the increase of metal-fluorine pairs, in turn promoting the medium basic sites amount consistently. In addition, the strong basic sites associated with coordinatively unsaturated O2- and F- were mainly generated by the cleavage of metal-oxygen and metal-fluorine pairs. Previous studies revealed that with the increase of F additive, more and more unsaturated O2- and F- would be present on the catalyst surface, undoubtedly resulting in the enhancement of amounts of basic sites [35,44,45]. In light of the similar amounts of weak basic site for the F-containing samples, so, their total basicity elevated continuously as the rise of value of n. Together with aforementioned results, it can be concluded that the beneficial effect caused by the rise of F prevailed its disadvantage influence on the basicity of the Al2O3-ZrO2-nF catalysts. The higher the F loading, the greater number of the basic sites. Consequently, Al2O3-ZrO2-2 F exhibited the highest basic density among all the catalytic materials. To summarize, our NH3-TPD and CO2-TPD experiments demonstrated that the incorporation of Al3+ and (AlF6)3- into ZrO2 not only promoted the acidity of the prepared Al2O3-ZrO2-nF catalysts, but also boosted their basicity distinctly. Moreover, F content also had a considerable influence on the acidic-basic sites distribution and strength of the catalysts, therefore might affect their catalytic performances towards the GLC synthesis enormously. 4 Catalytic performance 4.1 DMC transesterification with glycerol In order to clarify the reaction system of the transesterification between DMC and glycerol in the present work, GC-MS was applied to identify the chemical components in the liquid reaction products. Based on the experimental results, the possible reaction network is depicted in Scheme 1. As expected, the main reaction path is the transesterification of DMC with glycerol, producing the target product of GLC (Box A). A secondary possible product of diglycerol tri-carbonate from reaction of DMC and glycerol, which was reported by other researchers, was not detected [14,47]. Instead, an undesired-product of glycerol decarbonate (GDC) was identified due to the further transesterification between the hydroxyl group of GLC and another DMC molecule (Box B). In addition to these two compounds, another by-product of glycidol (GD), formed via the decarboxylation of GLC, was also found in this contribution. 4.2 Catalytic performance of samples for the GLC synthesis Initially, all the catalytic samples were evaluated for the solventless GLC synthesis with a glycerol/DMC molar ratio of 1:2 at 110 oC. The test results in terms of glycerol conversion, GLC selectivity and GLC yield are displayed in Table 2. Without a catalyst, the reaction can take place to some extent, but the glycerol conversion was only 20.5%. When ZrO2 was selected as the catalyst, the catalytic result was still far from satisfactory (Entry 2). Under the same reaction conditions, Al2O3 exhibited a lower glycerol conversion of 32.5% than that of ZrO2 (Entry 3). In comparison with ZrO2, Al2O3-ZrO2-0 F gave a marginal increase of glycerol conversion (52.9%), revealing that merely addition of Al3+ into ZrO2 hardly promoted this reaction (Entry 4). In contrast, all the F-containing catalytic materials afforded higher glycerol conversions than that of Al2O3-ZrO2-0 F, implying the positive effect of F on this reaction. Importantly, the glycerol conversion gradually increased as the rise of F content and reached the maximum value of 100% when n was 1.0 (Entry 6). However, further increase of F content led to an evident decrease of catalyst activity due to that Al2O3-ZrO2-2 F gave an inferior glycerol conversion of 93.7% (Entry 7). Different from this trend, the GLC selectivity decreased consecutively as the increase of n. As a consequence, Al2O3-ZrO2-1 F possessed the highest GLC yield of 95.2% of all the catalytic materials. Considering the distinct reactivities of F-containing catalysts, the reaction conditions were further optimized to realize the sustainability of GLC production by reducing the overdose of DMC. Theoretically, decline of DMC/glycerol ratio was passive for the glycerol conversion owing to the equilibrium restriction. Therefore, an evident reduction of glycerol conversion was noted from 79.8% to 68.6% as the DMC/glycerol ratio decreased from 2:1–1:1 over catalytic material of Al2O3-ZrO2-0.5 F (Entries 5, 11). Unlike this sample, both Al2O3-ZrO2-1 F and Al2O3-ZrO2-2 F still kept high activities (Entries 12, 13). And only a negligible decrease (1.6%−6.6%) was found over them under the identical conditions. Thus, the catalytic abilities of Al2O3-ZrO2-1 F and Al2O3-ZrO2-2 F were well-tolerated towards the reduction of DMC amount. Importantly, it should be mentioned that a high selectivity of GLC (92.7%) was achieved over Al2O3-ZrO2-1 F (Entry 12), whereas a more notable decrease in selectivity from 93.1% to 88.4% was observed over catalyst of Al2O3-ZrO2-2 F (Entry 13). As a result, we can obtain an excellent GLC yield of 91.2% using Al2O3-ZrO2-1 F, surpassing the activities of other samples greatly. Herein, Al2O3-ZrO2-1 F was chosen as the model catalyst to further optimize the reaction parameters with an equimolar DMC/glycerol ratio under solvent-less condition. 4.3 Influence of the reaction condition on the GLC synthesis The influence of reaction temperature on the GLC synthesis is illustrated in Fig. 7(a). Apparently, the catalytic performance was highly affected by the reaction temperature. The glycerol conversion improved consistently with the increase of temperature from 90 oC to 110 oC. However, the yield of GLC reached its peak value of 91.2% at 110 oC. Above this temperature, a drop of GLC yield could be observed, which might be attributed to the formation of GDC from GLC. Meanwhile, the decomposition of GLC into GD also aggravated gradually at a relatively high temperature. Thus, the optimum temperature for the GLC synthesis should be 110 oC. The catalytic performance of Al2O3-ZrO2-1 F was also be influenced markedly by the reaction time (Fig. 7(b)). Notably, the glycerol conversion promoted monotonically within 1.5 h. Further increase of reaction time only gave rise to a slight increase of glycerol conversion but an evident decrease of GLC yield. Consequently, the highest GLC yield of 91.2% could be obtained at 1.5 h. Therefore, the suitable reaction time was 1.5 h. The effect of catalyst amount on the reaction is shown in Fig. 7(c). It can be observed that the glycerol conversion improved gradually from 68.2% to 98.4% when the catalyst amount increased from 0.02 g to 0.1 g. However, both the glycerol conversion and GLC yield reduced slightly as the catalyst amount further increased to 0.14 g. This is mainly because of the enhanced resistance of the mass transfer in the tri-phase system of solid catalyst-glycerol-DMC, which was also reported in other documents [32,48]. Meanwhile, the consumption of GLC in further reaction such as manufacture of GDC and GD might be another cause for the decline of the GLC yield. In summary, under optimum reaction conditions, both glycerol conversion and GLC yield can surpass 90% with an equimolar glycerol/DMC ratio over Al2O3-ZrO2-1 F sample. To the best of our knowledge, this is the first time for achieving the efficient synthesis of GLC via atom economic transesterification of DMC and glycerol in lab scale under mild reaction conditions without solvent. 4.4 Effect of acidic-basic sites in transesterification of DMC with glycerol It was generally acknowledged that GLC production can be boosted by the both acidic and basic sites [21,22,28,31,32]. In principle, acidic sites are beneficial for the DMC adsorption via linking with carbonyl oxygen atom of DMC, whereas basic sites facilitate the activation of glycerol molecules with release of H δ+ from its hydroxyl group, providing glycerol anions (see Scheme 2). Next, nucleophilic reaction between glycerol anions and absorbed DMC molecules takes place, generating monoglyceride intermediates. Similar to above-mentioned process, cyclic rearrangement of the monoglyceride intermediate is further catalyzed over the acidic-basic sites to give the target product of GLC, accompanying methanol as the side-product [31,32]. According to the discussion aforementioned, incorporation of Al3+ and (AlF6)3- into ZrO2 can increase the catalyst acidity and basicity, respectively. This point was strongly supported by the fact that compared to bare ZrO2, Al2O3-ZrO2-nF samples had enhanced NH3 uptakes, whereas F containing samples possessed more desorbed CO2. Thus, it was reasonable to speculate that the improved activity of Al2O3-ZrO2-nF samples could be assigned to the increased acidity and basicity by the addition of Al3+ and F- ions. After a careful search, no obvious relation was established between catalytic abilities and the acidic-basic property, because that the most active sample of Al2O3-ZrO2-1 F did not possess the highest acidic or basic strength among these catalysts (see Fig. 6). In order to better understand the function of acidic-basic sites and their collaborative effect on the transesterification reaction, we further investigate the correlation between acidity, basicity, or a unifying parameter of acidity-basicity (acidity/basicity ratio, named as A/B) of the examined samples and their catalytic performances. As shown in Fig. 8, the more basic catalytic materials with A/B value below 1.0 (Al2O3-ZrO2-0.5 F, Al2O3-ZrO2-1 F, Al2O3-ZrO2-2 F and F-ZrO2 catalysts) displayed relatively high reactivities. Conversely, when the parameter of A/B was above 1.0, the more acidic catalysts such as Al2O3, ZrO2 and Al2O3-ZrO2-0.5 F exhibited relatively inferior glycerol conversions. In other words, activation of glycerol on basic sites seemed to be more critical than the absorption of DMC on acidic sites for the synthesis of GLC. However, it should be noted that the highest glycerol conversion was obtained over catalyst of Al2O3-ZrO2-1 F, although it had a higher A/B value than that of Al2O3-ZrO2-2 F. This suggested that the catalytic abilities of catalysts were not merely dependent on the surface basicity. Both the concentration of acidic and basic sites could improve the reaction of glycerol and DMC. Thanks to its suitable A/B value among all the catalytic materials, Al2O3-ZrO2-1 F demonstrated the highest catalytic ability. In case of samples with highly acidic character such as Al2O3, ZrO2 and Al2O3-ZrO2-0 F, their inferior activities might be ascribed to that they did not possess enough amounts of basic sites to activate glycerol. Similarly, although the basicity of Al2O3-ZrO2-0.5 F was improved to some degree, the glycerol conversion was still lower than that acquired on Al2O3-ZrO2-1 F sample. This point indicated that the basic density of Al2O3-ZrO2-0.5 F was still inadequate for realizing the efficient synthesis of GLC. Unlike these three materials, Al2O3-ZrO2-2 F exhibited relatively more base sites, but the acidic sites were poor availably on its surface. Accordingly, it gave a lower reactivity, probably owing to the lack of acidic sites that could simultaneously activate DMC molecules. As a result, the driving force towards the GLC manufacture was still insufficient for this sample. Additionally, F-ZrO2 catalyst without Al was also prepared using impregnation method to affirm the importance of cooperation of acidic-basic pairs for the efficient synthesis of GLC. Clearly, sample of F-ZrO2 was a typical basic catalyst with a large and broad CO2-desorbed peak in the range of 100–600 oC (see Fig. S2(b)) and its basicity could be 135.6 μmolg-1. In contrast, there was only a small peak at around 150 oC in its NH3-TPD profile, implying poor availability of acidic sites on its surface (32.7 μmolg-1). Not surprisingly, F-ZrO2 catalyst only afforded a lower glycerol conversion of 72.2% than that of Al2O3-ZrO2-1 F, owing to weak collaboration of acidic and basic sites (see Table 2, Entry 14). In addition, to better understand the correlation between glycerol conversion and acidic/basic property (acidity/basicity ratio determined by NH3/CO2-TPD, named as A/B) and support the mechanism shown in Scheme 2, we illustrated the catalytic activity at 20 min when the reaction was at beginning in Fig. 9. It shows the highest glycerol conversion for a balanced A/B material (Al2O3-ZrO2-1 F), whereas lower glycerol conversion were found for the more acidic or basic materials.Thus, it could be stated that the outstanding catalytic ability of Al2O3-ZrO2-1 F probably originated from its optimum synergistic effect of acidic and basic sites. A well balance of acidic and basic sites was extremely decisive for the excellent synthesis of GLC. Too high or too low A/B value was disadvantageous to achieve a high glycerol conversion. The key to the transesterification of glycerol and DMC was to precisely regulate the acid-base properties of the catalysts. Furthermore, such acidic-basic synergistic catalytic mechanism for the GLC manufacture has been also emphasized and recognized widely by other studies. Pradhan et al. concluded that the acidic proton of primary hydroxyl group of glycerol was abstracted by Lewis basic site of CaO with simultaneous activation of carbonyl carbon of DMC by Lewis acidic site of TiO2 of CaO/TiO2 catalyst [32]. More recently, She et al. reported that the Lewis basic sites derived from -M-OH group of sodium montmorillonite facilitated the generation of glyceroxide anions, whereas the Lewis acidic sites originated from MII (MIII) atoms were beneficial to the carbonyl activation of DMC [49]. Chang et al. also proposed that the deprotonation of glycerol (on basic sites) were likely more important than the activation of DMC (on acidic sites) for the transesterification of glycerol and DMC over MgO@ZIF-8 catalysts. More importantly, the enhanced activity of MgO@ZIF-8 suggests a synergistic effect between MgO and ZIF-8, which was attributed to the collaboration between the basic and acidic sites on the surface [31]. 4.5 Reusability of catalyst of Al2O3-ZrO2-1 F Addition to the catalytic ability, the stability of the catalyst is another vital character for its potential industrial application. Therefore, the reusability of Al2O3-ZrO2-1 F was further estimated under the optimized reaction conditions. After each reaction, the used Al2O3-ZrO2-1 F was recycled by filtration, washed using methanol for three times, dried at 80 oC for 3 h. Then, it was directly reused for the next run. Fig. 7(d) shows that no evident declines were demonstrated for glycerol conversion, GLC yield and GLC selectivity after Al2O3-ZrO2-1 F was reused four times, indicative of its outstandingly high stability. Moreover, Fig. S3 displays the comparison of the XRD patterns between the fresh and the recycled Al2O3-ZrO2-1 F catalyst (Al2O3-ZrO2-1 F-fourth). Clearly, the reused sample still maintained the original t-ZrO2-like structure. At the same time, Al2O3-ZrO2-1 F-fourth also possessed a high BET surface area of 162 m2 g-1, given by N2 absorption/desorption technique. Furthermore, CO2-TPD and NH3-TPD characterizations revealed that the acidic and basic densities of Al2O3-ZrO2-1 F-fourth were 77.1 μmol g-1 and 101.8 μmol g-1, respectively. More interestingly, afore-mentioned systematic characterization displayed that the prepared sample of Al2O3-ZrO2-1 F had a solid solution structure, where both F and Al species were well incorporated into t-ZrO2 matrix. Considering that the acidity and basicity of Al2O3-ZrO2-1 F were mostly associated with these two guests, so, the formation of solid solution can inhibit the leaching of active sites. Meanwhile, the solid structure also prevented the contamination of basic sites by the H2O and CO2 in the atmosphere to some degree, which was no doubt good for the catalyst to keep the high catalytic ability. 4.6 Activity comparison of Al2O3-ZrO2-1 F with other catalysts in previous documents Various solid catalysts have been explored for the synthesis of GLC. Of them, perovskite-like ternary oxides such as SrTiO3-200 and YNbO4-200 were tested with an equimolar DMC/glycerol ratio, but the glycerol conversions were only 77.7% and 82.5%, respectively (Entries 2, 3 in Table 3) [50]. Mg-Ca mixed oxide (Mg1.2Ca0.8O2), a typical base catalyst, could give about 70% glycerol conversion with DMC to glycerol ratio of 1 (Entry 4) [51]. The major shortcoming related to Ca-based sample was the poor catalyst stability, which might be due to the interaction between active CaO phase and glycerol, creating a calcium glycerol species into liquid phase [32,52,53]. Indeed, a severe catalyst deactivation was also observed for this Ca-based sample, leading to about 10% decline after reused four times with DMC/glycerol ratio of 2 (Entry 5). Except these three catalysts, other reference catalytic samples were usually utilized with DMC/glycerol ratio of 3–5. As a consequence, it was difficult to directly compare our Al2O3-ZrO2-1 F catalyst with previously reported materials. Thereby, we prepared and compared three representative reported samples under our reaction conditions. Basic catalytic sample of KF/γ-Al2O3, which was fabricated by wet impregnation approach, provided a relatively high glycerol conversion of 91.4% at the first cycle (Entry 6). Unfortunately, a serious catalyst deactivation was noticed and the glycerol conversion declined to 80.8% at the fifth cycle [54]. According to previous documents, this behavior was mainly attributed to the leaching of potassium species from the catalyst [55,56]. Unlike KF/γ-Al2O3, solid acid catalyst of Ti-SBA-15 showed a relatively high stability for the GLC synthesis, but the glycerol conversion was only 78.3% (Entry 7) [28]. MgO-loaded ZIF-8 catalyst (MgO@ZIF-8), which was regarded as a bifunctional acidic-basic catalyst [31], could not realize the atom-efficient synthesis of GLC, for the glycerol conversion was only 80.5% (Entry 8). The superior and distinctive reactivity of our Al2O3-ZrO2-1 F compared with other samples was more convincing in terms of TOF (intrinsic activity). Obviously, the TOFs of the catalysts were in the sequence of Al2O3-ZrO2-1 F> KF/γ-Al2O3 > MgO@ZIF-8 > Ti-SBA-15 > Mg1.2Ca0.8O2 > SrTiO3-200 > YNbO4-200 with DMC to glycerol ratio of 1. Hence, it was evidenced that Al2O3-ZrO2-1 F was a highly active and robust solid catalyst for the green, atom-efficient synthesis of GLC in lab under moderate reaction conditions. 5 Green metrics of transesterification of glycerol with DMC Generally speaking, green chemistry aims to fulfil the efficient utilization of raw feedstocks without the employment of toxic regents and solvents during the production of chemical products. Beside this, the waste formed during the entire process should be treated properly, avoiding environmental pollution [57,58]. In this work, we selected three kinds of green parameters including environmental factor (E-factor), process mass intensity (PMI), and atom utilization (AU) to evaluate the transesterification of glycerol with DMC, and the values of the three parameters over different catalysts are shown in Table 4. First, E-factor was determined by the ratio between total amounts of waste to the target product (see formula 5) [59]. Obviously, this parameter would be increased with the increase amount of waste created during the reaction. Therefore, a lower value of E-factor was more favorable for environment and its value was preferably between 0 and 1 [60]. (5) E − factor = Mass of waste ( g ) Mass of products ( g ) In this work, methanol was an easily recoverable solvent. Similarly, the by-products of GD and GDC were important intermediates in the field of fine chemistry. Despite that CO2 is considered as a greenhouse gas, it could be also utilized as a cheap and nontoxic carbon source to produce bio-products, solid materials, fuels, chemicals and materials [61]. Thus, all these compounds were reasonably considered as useful products. In view of these facts, the E-factor value for the production of GLC applying all the catalyst was 0, strongly suggesting that these catalytic samples had an ecofriendly and environmentally benign nature. Besides, process mass intensity is often chosen as an important parameter to assess the sustainability of the reaction, and mainly calculated according to the mass of all the materials (i.e., catalysts, solvents and reactants) in the reaction system [62,63]. Thereby, this factor is usually calculated by the following formula: (6) PMI = Total mass in the reaction system Mass of isolated product = Mass of catalysts + Mass of solvents + Mass of reactants Mass of target product Clearly, the lower value of PMI, the better sustainability of the reaction. In this work, the transesterification of DMC with glycerol was carried out without solvent no matter which catalyst was used. According to the catalytic results in Table 2, the mass of glycerol, DMC, catalyst as well as the target product of GLC could be obtained. Then, the values of PMI over various catalytic materials were determined using these data based on formula (6) (see Table 4). Apparently, it was easy to find that the lowest PMI value of 1.71 was achieved over Al2O3-ZrO2-1 F, which also exhibited the best catalytic performance in terms of GLC yield under the optimal reaction conditions. Similarly, another parameter of AU was applied to determine the percentage ratio of the desired product to mass of all products including desired and side products. Judging from this parameter, it is significantly convenient for study of the greenness of a reaction in light of co-generated waste [59]. Generally speaking, the solvents could be excluded for calculation of AU. Thus, the value of AU can be defined as: (7) Atom utiliazatin AU % = Mass of the desired product Total mass of all the substances products × 100 % During transesterification glycerol with DMC, the main by-product was methanol, which can be regarded as a solvent in chemical synthesis process. As a result, methanol can be ignored for the calculation of AU. Considering that only little amounts of GDC, CO2 and GD were co-created (see Scheme 1 and Fig. 7), the reaction process possessed a high value of AU (92.2%) catalyzed by the catalyst of Al2O3-ZrO2-1 F under the best reaction conditions above-mentioned (see Table 4). In spite of the higher values of AU obtained over other samples such as ZrO2, Al2O3, Al2O3-ZrO2-0 F and Al2O3-ZrO2-0.5 F, Al2O3-ZrO2-1 F was reasonably regarded as the best catalyst in this work, judging from its high reactivity, environmental and economic compatibility for the GLC manufacture. 6 Conclusion To clarify the function of acidic-basic pairs for the synthesis of GLC via DMC transesterification with glycerol, we have fabricated a cheap, practical, heterogeneous fluorinated Al2O3-ZrO2 catalyst system using Na3AlF6 as F source with a mesoporous structure. XRD, Raman and TEM characterization results suggested that incorporation of guest atoms into zirconia resulted in the transformation of m-ZrO2 to t-ZrO2. Furthermore, both Al and F species had entered into t-ZrO2 lattice to generate a solid solution structure, endowing the catalysts a high stability. Importantly, the acidic-basic properties of Al2O3-ZrO2-nF catalysts could be controlled by simple adjustment of F: Al atomic ratio. Combined NH3/CO2-TPD characterization and catalytic test results of all the examined catalysts, it was shown that the basic samples displayed a promoted activity than their acidic counterparts. Interestingly, Al2O3-ZrO2-1 F exhibited higher reactivity than that of Al2O3-ZrO2-2 F, which contained the highest basic density of these catalysts, indicating that the synergistic effect between acidic and basic sites could enhance the catalytic activity tremendously. Thanks to its suitable amounts of acidic and basic sites, Al2O3-ZrO2-1 F can realize the atom-efficient synthesis of GLC with 91.2% GLC yield using equimolar amount of DMC and glycerol for the first time. In addition, the overall investigation of green chemistry metrics suggested that the catalytic sample of Al2O3-ZrO2-1 F was economical as well as ecologically friendly in nature. Hereby, this work provides a practical and robust acid-basic bifunctional ZrO2-based catalytic system for the green and efficient synthesis of GLC via atom economic transesterification between DMC and glycerol. CRediT authorship contribution statement Xuelan Zhang: Conceptualization, Methodology, Data curation, Writing − original draft preparation, Investigation. Bai Dong: Data curation, Investigation. Jie Xiong: Data curation, Formal analysis. Zheng Chen: Supervision, Funding acquisition. Xueying Zhao: Software, Investigation. Hongwei Wu: Writing − review & editing. Jianfeng Shan: Funding acquisition, Investigation. Shuwei Wei: Resources, Visualization, Supervision, Writing − review & editing. Dengfeng Wang: Writing − review & editing, Project administration, Supervision. Declaration of Competing Interest The authors declare that they have no known competing financial interests or personal relationships that could have appeared to influence the work reported in this paper. Acknowledgements This work is supported by National Natural Science Foundation of China (22008207), Natural Science Foundation of Shandong Province (ZR2022MB067, ZR2022QB113, ZR2020MB030, ZR2020QB049), Science and Technology Research Program for Colleges and Universities in Shandong Province (KJ2018BZC048), Qingchuang Science and Technology Plan of Universities in Shandong Province (2021KJ057), the Joint Fund of the Yulin University and the Dalian National Laboratory for Clean Energy (YLU-DNL Fund 2021005), and Key Research and Development Program of Shandong Province (2018GGX107010). Appendix A Supporting information Supplementary data associated with this article can be found in the online version at doi:10.1016/j.apcata.2023.119370. Appendix A Supplementary material Supplementary material . References [1] T.N. Do C. You J. Kim A CO2 utilization framework for liquid fuels and chemical production: techno-economic and environmental analysis Energ. Environ. Sci. 15 2022 169 184 T.N. Do, C. You, J. Kim, A CO2 utilization framework for liquid fuels and chemical production: techno-economic and environmental analysis, Energ. Environ. Sci. 15 (2022) 169–184. [2] T.R. Karl K.E. Trenberth Modern global climate change Science 302 2003 1719 1723 T.R. Karl, K.E. Trenberth, Modern Global Climate Change, Science, 302 (2003) 1719–1723. [3] E.M. Shahid Y. Jamal Production of biodiesel: A technical review Renew. Sustain. Energ. Rev. 15 2011 4732 4745 E.M. Shahid, Y. Jamal, Production of biodiesel: A technical review, Renewable and Sustainable Energ. Rev. 15 (2011) 4732–4745. [4] M. Pagliaro R. Ciriminna H. Kimura M. Rossi C. Della Pina From glycerol to value-added products Angew. Chem. Int. Ed. 46 2007 4434 4440 M. Pagliaro, R. Ciriminna, H. Kimura, M. Rossi, C. Della Pina, From Glycerol to Value-Added Products, Angew. Chem. Int. Edit. 46 (2007) 4434–4440. [5] D. Liu J.C. Liu W. Cai J. Ma H.B. Yang H. Xiao J. Li Y. Xiong Y. Huang B. Liu Selective photoelectrochemical oxidation of glycerol to high value-added dihydroxyacetone Nat. Commun. 10 2019 1779 D. Liu, J.C. Liu, W. Cai, J. Ma, H.B. Yang, H. Xiao, J. Li, Y. Xiong, Y. Huang, B. Liu, Selective photoelectrochemical oxidation of glycerol to high value-added dihydroxyacetone, Nat. Commun. 10 (2019) 1779. [6] J. Shan Y. Xue D. Wang Z. Chen S. Zhu Direct production of ethanol with high yield from glycerol via synergistic catalysis by Pd/CoOx and Cu/SBA-15 Appl. Catal. B: Environ. 302 2022 120870 J. Shan, Y. Xue, D. Wang, Z. Chen, S. Zhu, Direct production of ethanol with high yield from glycerol via synergistic catalysis by Pd/CoOx and Cu/SBA-15, Appl. Catal. B: Environ. 302 (2022) 120870. [7] R. Mane Y. Jeon C. Rode A review on non-noble metal catalysts for glycerol hydrodeoxygenation to 1,2-propanediol with and without external hydrogen Green. Chem. 24 2022 6751 6781 R. Mane, Y. Jeon, C. Rode, A review on non-noble metal catalysts for glycerol hydrodeoxygenation to 1,2-propanediol with and without external hydrogen, Green Chem. 24 (2022) 6751–6781. [8] Z. An H. Ma H. Han Z. Huang Y. Jiang W. Wang Y. Zhu H. Song X. Shu X. Xiang J. He Insights into the multiple synergies of supports in the selective oxidation of glycerol to dihydroxyacetone: layered double hydroxide supported Au ACS Catal. 10 2020 12437 12453 Z. An, H. Ma, H. Han, Z. Huang, Y. Jiang, W. Wang, Y. Zhu, H. Song, X. Shu, X. Xiang, J. He, Insights into the Multiple Synergies of Supports in the Selective Oxidation of Glycerol to Dihydroxyacetone: Layered Double Hydroxide Supported Au, ACS Catal. 10 (2020) 12437–12453. [9] T.-G. Vo P.-Y. Ho C.-Y. Chiang Operando mechanistic studies of selective oxidation of glycerol to dihydroxyacetone over amorphous cobalt oxide Appl. Catal. B: Environ. 300 2022 120723 T.-G. Vo, P.-Y. Ho, C.-Y. Chiang, Operando mechanistic studies of selective oxidation of glycerol to dihydroxyacetone over amorphous cobalt oxide, Appl. Catal. B: Environ. 300 (2022) 120723. [10] S. Xu Q. Tian Y. Xiao W. Zhang S. Liao J. Li C. Hu Regulating the competitive reaction pathway in glycerol conversion to lactic acid/glycolic acid selectively J. Catal. 413 2022 407 416 S. Xu, Q. Tian, Y. Xiao, W. Zhang, S. Liao, J. Li, C. Hu, Regulating the competitive reaction pathway in glycerol conversion to lactic acid/glycolic acid selectively, J. Catal. 413 (2022) 407–416. [11] A. Malaika K. Ptaszyńska M. Kozłowski Conversion of renewable feedstock to bio-carbons dedicated for the production of green fuel additives from glycerol Fuel 288 2021 119609 A. Malaika, K. Ptaszyńska, M. Kozłowski, Conversion of renewable feedstock to bio-carbons dedicated for the production of green fuel additives from glycerol, Fuel 288 (2021) 119609. [12] N. Kulal R. Vetrivel N.S. Ganesh Krishna G.V. Shanbhag Zn-Doped CeO2 Nanorods for Glycerol Carbonylation with CO2 ACS Appl. Nano Mater. 4 2021 4388 4397 N. Kulal, R. Vetrivel, N.S. Ganesh Krishna, G.V. Shanbhag, Zn-Doped CeO2 Nanorods for Glycerol Carbonylation with CO2, ACS Appl. Nano Mater. 4 (2021) 4388–4397. [13] P.H.P. Guedes R.F. Luz R.M. Cavalcante A.F. Young Process simulation for technical and economic evaluation of acrolein and glycerol carbonate production from glycerol Biomss Bioenerg. 168 2023 106659 P.H.P. Guedes, R.F. Luz, R.M. Cavalcante, A.F. Young, Process simulation for technical and economic evaluation of acrolein and glycerol carbonate production from glycerol, Biomss Bioenerg. 168 (2023) 106659. [14] G. Rokicki P. Rakoczy P. Parzuchowski M. Sobiecki Hyperbranched aliphatic polyethers obtained from environmentally benign monomer: glycerol carbonate Green. Chem. 7 2005 529 539 G. Rokicki, P. Rakoczy, P. Parzuchowski, M. Sobiecki, Hyperbranched aliphatic polyethers obtained from environmentally benign monomer: glycerol carbonate, Green Chem. 7 (2005) 529–539. [15] A.-A.G. Shaikh S. Sivaram Organic carbonates Chem. Rev. 96 1996 951 976 A.-A.G. Shaikh, S. Sivaram, Organic Carbonates, Chem. Rev. 96 (1996) 951–976. [16] Y. Lei G. Lan M. Fan G. Li Palladium coordinated in N-heterocyclic carbene-functionalized porous organic polymer for efficient oxidative carbonylation of glycerol Catal. Commun. 140 2020 106007 Y. Lei, G. Lan, M. Fan, G. Li, Palladium coordinated in N-heterocyclic carbene-functionalized porous organic polymer for efficient oxidative carbonylation of glycerol, Catal. Commun. 140 (2020) 106007. [17] P. de Caro M. Bandres M. Urrutigoïty C. Cecutti S. Thiebaud-Roux Recent progress in synthesis of glycerol carbonate and evaluation of its plasticizing properties Front. Chem. 7 2019 1 13 P. de Caro, M. Bandres, M. Urrutigoïty, C. Cecutti, S. Thiebaud-Roux, Recent Progress in Synthesis of Glycerol Carbonate and Evaluation of Its Plasticizing Properties, Front. Chem. 7 (2019) 1–13. [18] Y. Li H. Liu Z. Zheng Z. Fu D. He Q. Zhang Synthesis of glycerol carbonate via alcoholysis of urea with glycerol: current status and future prospects Ind. Eng. Chem. Res. 61 2022 5698 5711 Y. Li, H. Liu, Z. Zheng, Z. Fu, D. He, Q. Zhang, Synthesis of Glycerol Carbonate via Alcoholysis of Urea with Glycerol: Current Status and Future Prospects, Ind. Eng. Chem. Res. 61 (2022) 5698–5711. [19] H. Wang Y.Z. Cui J.H. Shi X. Tao G.Sh Zhu Porous carbon supported Lewis acid-base sites as metal-free catalysts for the carbonylation of glycerol with urea Appl. Catal. B: Environ. 330 2023 122457 H. Wang, Y.Z. Cui, J.H. Shi, X. Tao, G.Sh Zhu, Porous carbon supported Lewis acid-base sites as metal-free catalysts for the carbonylation of glycerol with urea, Appl. Catal. B: Environ. 330 (2023) 122457. [20] S. Sahani S.N. Upadhyay Y.C. Sharma Critical review on production of glycerol carbonate from byproduct glycerol through transesterification Ind. Eng. Chem. Res. 60 2021 67 88 S. Sahani, S.N. Upadhyay, Y.C. Sharma, Critical Review on Production of Glycerol Carbonate from Byproduct Glycerol through Transesterification, Ind. Eng. Chem. Res. 60 (2021) 67–88. [21] X. Zhang S. Wei X. Zhao Z. Chen H. Wu P. Rong Y. Sun Y. Li H. Yu D. Wang Preparation of mesoporous CaO-ZrO2 catalysts without template for the continuous synthesis of glycerol carbonate in a fixed-bed reactor Appl. Catal. A: Gen. 590 2020 117313 X. Zhang, S. Wei, X. Zhao, Z. Chen, H. Wu, P. Rong, Y. Sun, Y. Li, H. Yu, D. Wang, Preparation of mesoporous CaO-ZrO2 catalysts without template for the continuous synthesis of glycerol carbonate in a fixed-bed reactor, Appl. Catal. A: Gen. 590 (2020) 117313. [22] J.R. Ochoa-Gómez O. Gómez-Jiménez-Aberasturi B. Maestro-Madurga A. Pesquera-Rodríguez C. Ramírez-López L. Lorenzo-Ibarreta J. Torrecilla-Soria M.C. Villarán-Velasco Synthesis of glycerol carbonate from glycerol and dimethyl carbonate by transesterification: Catalyst screening and reaction optimization Appl. Catal. A: Gen. 366 2009 315 324 J.R. Ochoa-Gómez, O. Gómez-Jiménez-Aberasturi, B. Maestro-Madurga, A. Pesquera-Rodríguez, C. Ramírez-López, L. Lorenzo-Ibarreta, J. Torrecilla-Soria, M.C. Villarán-Velasco, Synthesis of glycerol carbonate from glycerol and dimethyl carbonate by transesterification: Catalyst screening and reaction optimization, Appl. Catal. A: Gen. 366 (2009) 315–324. [23] P.P. Pattanaik P.M. Kumar N. Raju N. Lingaiah Continuous Synthesis of Glycerol Carbonate by Transesterification of Glycerol with Dimethyl Carbonate Over Fe-La Mixed Oxide Catalysts Catal. Lett. 151 2021 1433 1443 P.P. Pattanaik, P.M. Kumar, N. Raju, N. Lingaiah, Continuous Synthesis of Glycerol Carbonate by Transesterification of Glycerol with Dimethyl Carbonate Over Fe-La Mixed Oxide Catalysts, Catal. Lett. 151 (2021) 1433–1443. [24] J.L. Yu K. Wang Sh.B. Shao W. Li Sh.F. Du X.F. Chen C. Chao X.F. Fan Effect of ionic radius and valence state of alkali and alkaline earth metals on promoting the catalytic performance of La2O3 catalysts for glycerol carbonate production Chem. Eng. J. 458 2023 141486 J.L. Yu, K. Wang, Sh.B. Shao, W. Li, Sh.F. Du, X.F. Chen, C. Chao, X.F. Fan, Effect of ionic radius and valence state of alkali and alkaline earth metals on promoting the catalytic performance of La2O3 catalysts for glycerol carbonate production, Chem. Eng. J. 458 (2023) 141486. [25] A. Takagaki K. Iwatani S. Nishimura K. Ebitani Synthesis of glycerol carbonate from glycerol and dialkyl carbonates using hydrotalcite as a reusable heterogeneous base catalyst Green. Chem. 12 2010 578 581 A. Takagaki, K. Iwatani, S. Nishimura, K. Ebitani, Synthesis of glycerol carbonate from glycerol and dialkyl carbonates using hydrotalcite as a reusable heterogeneous base catalyst, Green Chem. 12 (2010) 578–581. [26] G. Liu J. Yang X. Xu Synthesis of hydrotalcite-type mixed oxide catalysts from waste steel slag for transesterification of glycerol and dimethyl carbonate Sci. Rep. -UK 10 2020 10273 G. Liu, J. Yang, X. Xu, Synthesis of hydrotalcite-type mixed oxide catalysts from waste steel slag for transesterification of glycerol and dimethyl carbonate, Sci. Rep.-UK, 10 (2020) 10273. [27] P. Liu M. Derchi E.J.M. Hensen Promotional effect of transition metal doping on the basicity and activity of calcined hydrotalcite catalysts for glycerol carbonate synthesis Appl. Catal. B: Environ. 144 2014 135 143 P. Liu, M. Derchi, E.J.M. Hensen, Promotional effect of transition metal doping on the basicity and activity of calcined hydrotalcite catalysts for glycerol carbonate synthesis, Appl. Catal. B: Environ. 144 (2014) 135–143. [28] P. Devi U. Das A.K. Dalai Production of glycerol carbonate using a novel Ti-SBA-15 catalyst Chem. Eng. J. 346 2018 477 488 P. Devi, U. Das, A.K. Dalai, Production of glycerol carbonate using a novel Ti-SBA-15 catalyst, Chem. Eng. J. 346 (2018) 477–488. [29] J. Keogh G. Deshmukh H. Manyar Green synthesis of glycerol carbonate via transesterification of glycerol using mechanochemically prepared sodium aluminate catalysts Fuel 310 2022 122484 J. Keogh, G. Deshmukh, H. Manyar, Green synthesis of glycerol carbonate via transesterification of glycerol using mechanochemically prepared sodium aluminate catalysts, Fuel 310 (2022) 122484. [30] G. Parameswaram P.S.N. Rao A. Srivani G.N. Rao N. Lingaiah Magnesia-ceria mixed oxide catalysts for the selective transesterification of glycerol to glycerol carbonate Mol. Catal. 451 2018 135 142 G. Parameswaram, P.S.N. Rao, A. Srivani, G.N. Rao, N. Lingaiah, Magnesia-ceria mixed oxide catalysts for the selective transesterification of glycerol to glycerol carbonate, Mol. Catal. 451 (2018) 135–142. [31] C.-W. Chang Z.-J. Gong N.-C. Huang C.-Y. Wang W.-Y. Yu MgO nanoparticles confined in ZIF-8 as acid-base bifunctional catalysts for enhanced glycerol carbonate production from transesterification of glycerol and dimethyl carbonate Catal. Today 351 2020 21 29 C.-W. Chang, Z.-J. Gong, N.-C. Huang, C.-Y. Wang, W.-Y. Yu, MgO nanoparticles confined in ZIF-8 as acid-base bifunctional catalysts for enhanced glycerol carbonate production from transesterification of glycerol and dimethyl carbonate, Catal. Today 351 (2020) 21–29. [32] G. Pradhan Y.C. Sharma A greener and cheaper approach towards synthesis of glycerol carbonate from bio waste glycerol using CaO-TiO2 Nanocatalysts J. Clean. Prod. 315 2021 127860 G. Pradhan, Y.C. Sharma, A greener and cheaper approach towards synthesis of glycerol carbonate from bio waste glycerol using CaO-TiO2 Nanocatalysts, J. Clean. Prod. 315 (2021) 127860. [33] X.L. Zhang Sh.W. Wei X.Y. Zhao Zh Chen H.W. Wu P. Rong Y. Sun Y. Li H. Yu D.F. Wang Preparation of mesoporous CaO-ZrO2 catalysts without template for the contineous synthesis of glycerol carbonate in a fixed-bed reactor Appl. Catal. A: Gen. 590 2020 117313 X.L. Zhang, Sh.W. Wei, X.Y. Zhao, Zh Chen, H.W. Wu, P. Rong, Y. Sun, Y. Li, H. Yu, D.F. Wang, Preparation of mesoporous CaO-ZrO2 catalysts without template for the contineous synthesis of glycerol carbonate in a fixed-bed reactor, Appl. Catal. A: Gen. 590 (2020) 117313. [34] P. Gao H.Y. Yang L.N. Zhang Ch Zhang L.Sh Zhong H. Wang W. Wei Y.H. Sun Fluorinated Cu/Zn/Al/Zr hydrotalcites derived nanocatalysts for CO2 hydrogenation to methanol J. CO2 Util. 16 2016 32 41 P. Gao, H.Y. Yang, L.N. Zhang, Ch Zhang, L.Sh Zhong, H. Wang, W. Wei, Y.H. Sun, Fluorinated Cu/Zn/Al/Zr hydrotalcites derived nanocatalysts for CO2 hydrogenation to methanol, J. CO2 Util. 16 (2016) 32–41. [35] E. Lima M.D. Martinez-Ortiz R.I.G. Reyes M. Vera Inorg. Chem. 51 2012 7774 7781 E. Lima, M.D. Martinez-Ortiz, R.I.G. Reyes, M. Vera, Inorg. Chem. 51 (2012) 7774–7781. [36] J. Wang G. Li Z. Li Ch Tang Zh Feng H. An H. Liu T. Liu C. Li A highly selective and stable ZnO-ZrO2 solid solution catalyst for CO2 hydrogenation to methanol Sci. Adv. 3 2017 e1701290 J. Wang, G. Li, Z. Li, Ch Tang, Zh Feng, H. An, H. Liu, T. Liu, C. Li, A highly selective and stable ZnO-ZrO2 solid solution catalyst for CO2 hydrogenation to methanol, Sci. Adv. 3 (2017) e1701290. [37] S. Pradhan V. Sahu B.G. Mishra CaO-ZrO2 nanocomposite oxide prepared by urea hydrolysis method as heterogeneous base catalyst for synthesis of chromene analogues J. Mol. Catal. A: Chem. 425 2016 297 309 S. Pradhan, V. Sahu, B.G. Mishra, CaO-ZrO2 nanocomposite oxide prepared by urea hydrolysis method as heterogeneous base catalyst for synthesis of chromene analogues, J. Mol. Catal. A: Chem. 425 (2016) 297–309. [38] S. Tada N. Ochiai H. Kinoshita M. Yoshida N. Shimada T. Joutsuka M. Nishijima T. Honma N. Yamauchi Y. Kobayashi K. Iyoki Active Sites on Zn x Zr1-x O2-x Solid Solution Catalysts for CO2-to-Methanol Hydrogenation ACS Catal. 12 2022 7748 7759 S. Tada, N. Ochiai, H. Kinoshita, M. Yoshida, N. Shimada, T. Joutsuka, M. Nishijima, T. Honma, N. Yamauchi, Y. Kobayashi, K. Iyoki, Active Sites on ZnxZr1-xO2-x Solid Solution Catalysts for CO2-to-Methanol Hydrogenation, ACS Catal. 12 (2022) 7748–7759. [39] X. Zhang D. Wang G. Wu X. Wang X. Jiang S. Liu D. Zhou D. Xu J. Gao One-pot template-free preparation of mesoporous MgO-ZrO2 catalyst for the synthesis of dipropyl carbonate Appl. Catal. A: Gen. 555 2018 130 137 X. Zhang, D. Wang, G. Wu, X. Wang, X. Jiang, S. Liu, D. Zhou, D. Xu, J. Gao, One-pot template-free preparation of mesoporous MgO-ZrO2 catalyst for the synthesis of dipropyl carbonate, Appl. Catal. A: Gen. 555 (2018) 130–137. [40] M. Rezaei S.M. Alavi S. Sahebdelfar P. Bai X. Liu Z.-F. Yan CO2 reforming of CH4 over nanocrystalline zirconia-supported nickel catalysts Appl. Catal. B: Environ. 77 2008 346 354 M. Rezaei, S.M. Alavi, S. Sahebdelfar, P. Bai, X. Liu, Z.-F. Yan, CO2 reforming of CH4 over nanocrystalline zirconia-supported nickel catalysts, Appl. Catal. B: Environ. 77 (2008) 346–354. [41] X. Yang X. Yu M. Jing W. Song J. Liu M. Ge Defective Mn x Zr1-x O2 Solid Solution for the Catalytic Oxidation of Toluene: Insights into the Oxygen Vacancy Contribution ACS Appl. Mater. Inter. 11 2019 730 739 X. Yang, X. Yu, M. Jing, W. Song, J. Liu, M. Ge, Defective MnxZr1-xO2 Solid Solution for the Catalytic Oxidation of Toluene: Insights into the Oxygen Vacancy Contribution, ACS Appl. Mater. Inter. 11 (2019) 730–739. [42] M.M.K. Tanabe Y. Ono H. Hattori New Solid Acids and Bases: Their Catalytic Properties 1989 Elsevier, Amsterdam 14 16 M.M.K. Tanabe, Y. Ono, H. Hattori, New solid acids and bases: their catalytic properties, Elsevier, Amsterdam, 1989, pp. 14–16. [43] D. Tichit N. Das B. Coq R. Durand Preparation of Zr-containing layered double hydroxides and characterization of the acido-basic properties of their mixed oxides Chem. Mater. 14 2002 1530 1538 D. Tichit, N. Das, B. Coq, R. Durand, Preparation of Zr-Containing Layered Double Hydroxides and Characterization of the Acido-Basic Properties of Their Mixed Oxides, Chem. Mater. 14 (2002) 1530–1538. [44] X. Zhang D. Wang J. Ma W. Wei Fluorinated Mg-Al hydrotalcites derived basic catalysts for transesterification of glycerol with dimethyl carbonate Catal. Lett. 147 2017 1181 1196 X. Zhang, D. Wang, J. Ma, W. Wei, Fluorinated Mg-Al Hydrotalcites Derived Basic Catalysts for Transesterification of Glycerol with Dimethyl Carbonate, Catal. Lett. 147 (2017) 1181–1196. [45] G. Wu X. Wang B. Chen J. Li N. Zhao W. Wei Y. Sun Fluorine-modified mesoporous Mg-Al mixed oxides: Mild and stable base catalysts for O-methylation of phenol with dimethyl carbonate Appl. Catal. A: Gen. 329 2007 106 111 G. Wu, X. Wang, B. Chen, J. Li, N. Zhao, W. Wei, Y. Sun, Fluorine-modified mesoporous Mg-Al mixed oxides: Mild and stable base catalysts for O-methylation of phenol with dimethyl carbonate, Appl. Catal. A: Gen. 329 (2007) 106–111. [46] G. Wu X. Wang W. Wei Y. Sun Fluorine-modified Mg-Al mixed oxides: A solid base with variable basic sites and tunable basicity Appl. Catal. A: Gen. 377 2010 107 113 G. Wu, X. Wang, W. Wei, Y. Sun, Fluorine-modified Mg-Al mixed oxides: A solid base with variable basic sites and tunable basicity, Appl. Catal. A: Gen. 377 (2010) 107–113. [47] Y. Wan Y. Lei G. Lan D. Liu G. Li R. Bai Synthesis of glycerol carbonate from glycerol and dimethyl carbonate over DABCO embedded porous organic polymer as a bifunctional and robust catalyst Appl. Catal. A: Gen. 562 2018 267 275 Y. Wan, Y. Lei, G. Lan, D. Liu, G. Li, R. Bai, Synthesis of glycerol carbonate from glycerol and dimethyl carbonate over DABCO embedded porous organic polymer as a bifunctional and robust catalyst, Appl. Catal. A: Gen. 562 (2018) 267–275. [48] S. Wang J. Wang P. Sun L. Xu P.U. Okoye S. Li L. Zhang A. Guo J. Zhang A. Zhang Disposable baby diapers waste derived catalyst for synthesizing glycerol carbonate by the transesterification of glycerol with dimethyl carbonate J. Clean. Prod. 211 2019 330 341 S. Wang, J. Wang, P. Sun, L. Xu, P.U. Okoye, S. Li, L. Zhang, A. Guo, J. Zhang, A. Zhang, Disposable baby diapers waste derived catalyst for synthesizing glycerol carbonate by the transesterification of glycerol with dimethyl carbonate, J. Clean. Prod. 211 (2019) 330–341. [49] Q.M. She M.Y. Qiu K.J. Li J.H. Liu Ch.H. Zhou Acidic and basic sites on the surface of sodium montmorillonite active for catalytic transesterification of glycerol to glycrol carbonate Appl. Clay Sci. 238 2023 106916 Q.M. She, M.Y. Qiu, K.J. Li, J.H. Liu, Ch.H. Zhou, Acidi and basic sites on the surface of sodium montmorillonite active for catalytic transesterification of glycerol to glycrol carbonate, Appl. Clay Sci. 238 (2023) 106916. [50] J. Poolwong S. Del Gobbo V. D'Elia Transesterification of dimethyl carbonate with glycerol by perovskite-based mixed metal oxide nanoparticles for the atom-efficient production of glycerol carbonate J. Ind. Eng. Chem. 104 2021 43 60 J. Poolwong, S. Del Gobbo, V. D'Elia, Transesterification of dimethyl carbonate with glycerol by perovskite-based mixed metal oxide nanoparticles for the atom-efficient production of glycerol carbonate, J. Ind. Eng. Chem. 104 (2021) 43–60. [51] M.S. Khayoon B.H. Hameed Mg1+x Ca1-x O2 as reusable and efficient heterogeneous catalyst for the synthesis of glycerol carbonate via the transesterification of glycerol with dimethyl carbonate Appl. Catal. A: Gen. 466 2013 272 281 M.S. Khayoon, B.H. Hameed, Mg1+xCa1-xO2 as reusable and efficient heterogeneous catalyst for the synthesis of glycerol carbonate via the transesterification of glycerol with dimethyl carbonate, Appl. Catal. A: Gen. 466 (2013) 272–281. [52] L. Zheng S. Xia X. Lu Z. Hou Transesterification of glycerol with dimethyl carbonate over calcined Ca-Al hydrocalumite Chin. J. Catal. 36 2015 1759 1765 L. Zheng, S. Xia, X. Lu, Z. Hou, Transesterification of glycerol with dimethyl carbonate over calcined Ca-Al hydrocalumite, Chinese J. Catal. 36 (2015) 1759–1765. [53] F.S.H. Simanjuntak T.K. Kim S.D. Lee B.S. Ahn H.S. Kim H. Lee CaO-catalyzed synthesis of glycerol carbonate from glycerol and dimethyl carbonate: Isolation and characterization of an active Ca species Appl. Catal. A: Gen. 401 2011 220 225 F.S.H. Simanjuntak, T.K. Kim, S.D. Lee, B.S. Ahn, H.S. Kim, H. Lee, CaO-catalyzed synthesis of glycerol carbonate from glycerol and dimethyl carbonate: Isolation and characterization of an active Ca species, Appl. Catal. A: Gen. 401 (2011) 220–225. [54] Z. Liu J. Wang M. Kang N. Yin X. Wang Y. Tan Y. Zhu Synthesis of glycerol carbonate by transesterification of glycerol and dimethyl carbonate over KF/γ-Al2O3 catalyst J. Braz. Chem. Soc. 25 2014 152 160 Z. Liu, J. Wang, M. Kang, N. Yin, X. Wang, Y. Tan, Y. Zhu, Synthesis of Glycerol Carbonate by Transesterification of Glycerol and Dimethyl Carbonate over KF/γ-Al2O3 Catalyst, J. Brazil. Chem. Soc. 25 (2014) 152–160. [55] D.M. Alonso R. Mariscal R. Moreno-Tost M.D.Z. Poves M.L. Granados Potassium leaching during triglyceride transesterification using K/γ-Al2O3 catalysts Catal. Commun. 8 2007 2074 2080 D.M. Alonso, R. Mariscal, R. Moreno-Tost, M.D.Z. Poves, M.L. Granados, Potassium leaching during triglyceride transesterification using K/γ-Al2O3 catalysts, Catal. Commun. 8 (2007) 2074–2080. [56] C.S. Castro D. Cardoso P.A.P. Nascente J.M. Assaf MgAlLi mixed oxides derived from hydrotalcite for catalytic transesterification Catal. Lett. 141 2011 1316 1323 C.S. Castro, D. Cardoso, P.A.P. Nascente, J.M. Assaf, MgAlLi Mixed Oxides Derived from Hydrotalcite for Catalytic Transesterification, Catal. Lett. 141 (2011) 1316–1323. [57] S. Ahmadzadeh M. Dolatabadi In situ generation of hydroxyl radical for efficient degradation of 2,4-dichlorophenol from aqueous solutions Environ. Monit. Assess. 190 2018 340 S. Ahmadzadeh, M. Dolatabadi, In situ generation of hydroxyl radical for efficient degradation of 2,4-dichlorophenol from aqueous solutions, Environ. Monit. Assess. 190 (2018) 340. [58] M. Dolatabadi M. Mehrabpour M. Esfandyari S. Ahmadzadeh Adsorption of tetracycline antibiotic onto modified zeolite: Experimental investigation and modeling MethodsX 7 2020 100885 M. Dolatabadi, M. Mehrabpour, M. Esfandyari, S. Ahmadzadeh, Adsorption of tetracycline antibiotic onto modified zeolite: Experimental investigation and modeling, MethodsX 7 (2020) 100885. [59] M. Tobiszewski M. Marć A. Gałuszka J. Namieśnik Green Chemistry Metrics with Special Reference to Green Analytical Chemistry Molecules 20 2015 10928 10946 M. Tobiszewski, M. Marć, A. Gałuszka, J. Namieśnik, Green Chemistry Metrics with Special Reference to Green Analytical Chemistry, Molecules 20 (2015) 10928–10946. [60] R.A. Sheldon The E factor 25 years on: the rise of green chemistry and sustainability Green. Chem. 19 2017 18 43 R.A. Sheldon, The E factor 25 years on: the rise of green chemistry and sustainability, Green Chem. 19 (2017) 18–43. [61] A.D.N. Kamkeng M.H. Wang J. Hu W.L. Du F. Qian Transformation technologies for CO2 utilisation: Current status, challenges and futrue prospects Chem. Eng. J. 409 2021 128138 A.D.N. Kamkeng, M.H. Wang, J. Hu, W.L. Du, F. Qian, Transformation technologies for CO2 utilisation: Current status, challenges and futrue prospects, Chem. Eng. J. 409 (2021) 128138. [62] K. Budzinski M. Blewis P. Dahlin D. D'Aquila J. Esparza J. Gavin S.V. Ho C. Hutchens D. Kahn S.G. Koenig R. Kottmeier J. Millard M. Snyder B. Stanard L. Sun Introduction of a process mass intensity metric for biologics N. Biotechnol. 49 2019 37 42 K. Budzinski, M. Blewis, P. Dahlin, D. D'Aquila, J. Esparza, J. Gavin, S.V. Ho, C. Hutchens, D. Kahn, S.G. Koenig, R. Kottmeier, J. Millard, M. Snyder, B. Stanard, L. Sun, Introduction of a process mass intensity metric for biologics, New Biotechnol. 49 (2019) 37–42. [63] E.R. Monteith P. Mampuys L. Summerton J.H. Clark B.U.W. Maes C.R. McElroy Why we might be misusing process mass intensity (PMI) and a methodology to apply it effectively as a discovery level metric Green. Chem. 22 2020 123 135 E.R. Monteith, P. Mampuys, L. Summerton, J.H. Clark, B.U.W. Maes, C.R. McElroy, Why we might be misusing process mass intensity (PMI) and a methodology to apply it effectively as a discovery level metric, Green Chem. 22 (2020) 123–135.",
      "scopus-id": "85168824567",
      "coredata": {
        "eid": "1-s2.0-S0926860X23003502",
        "dc:description": "A series of Al2O3-ZrO2-nF solid solution catalysts (n was the F: Al atomic ratios) with Al: Zr molar ratio of 0.2, was fabricated by addition of varied amounts of (AlF6)3- into the ZrO2 via a co-precipitation method. To our delight, the acidic-basic properties of Al2O3-ZrO2-nF can be tuned by the change of n. Then, the role of acidic-basic sites was investigated for the glycerol carbonate (GLC) production from glycerol and dimethyl carbonate (DMC). Despite that the more basic samples exhibited higher reactivities compared to that of the more acidic ones, the cooperative effect between the acidic-basic pairs can enhance the catalyst activity strongly. So, the catalyst with F/Al= 1.0 can realize the quantitative and selective transformation of glycerol to GLC applying DMC/glycerol of 1:1 ratio with a GLC yield of 91.2%, owing to its appropriate acidic-basic property. Furthermore, the uniform solid solution structure can prevent the generation of free Al or F species, assuring the catalytic material an excellent stability. More importantly, several green parameters including process mass intensity, environmental factor and atom utilization were calculated to confirm the environmental and economic compatibility of the GLC synthesis over the model catalyst.",
        "openArchiveArticle": "false",
        "prism:coverDate": "2023-09-05",
        "openaccessUserLicense": null,
        "prism:aggregationType": "Journal",
        "prism:url": "https://api.elsevier.com/content/article/pii/S0926860X23003502",
        "dc:creator": [
          {
            "@_fa": "true",
            "$": "Wang, Dengfeng"
          },
          {
            "@_fa": "true",
            "$": "Bai, Dong"
          },
          {
            "@_fa": "true",
            "$": "Xiong, Jie"
          },
          {
            "@_fa": "true",
            "$": "Chen, Zheng"
          },
          {
            "@_fa": "true",
            "$": "Zhao, Xueying"
          },
          {
            "@_fa": "true",
            "$": "Wu, Hongwei"
          },
          {
            "@_fa": "true",
            "$": "Shan, Jianfeng"
          },
          {
            "@_fa": "true",
            "$": "Wei, Shuwei"
          },
          {
            "@_fa": "true",
            "$": "Zhang, Xuelan"
          }
        ],
        "link": [
          {
            "@_fa": "true",
            "@rel": "self",
            "@href": "https://api.elsevier.com/content/article/pii/S0926860X23003502"
          },
          {
            "@_fa": "true",
            "@rel": "scidir",
            "@href": "https://www.sciencedirect.com/science/article/pii/S0926860X23003502"
          }
        ],
        "dc:format": "application/json",
        "openaccessType": null,
        "pii": "S0926-860X(23)00350-2",
        "prism:volume": "665",
        "articleNumber": "119370",
        "prism:publisher": "Elsevier B.V.",
        "dc:title": "The atom-efficient production of glycerol carbonate via transesterification between dimethyl carbonate and glycerol over fluorinated Al2O3-ZrO2 solid solution catalysts with suitable acidic-basic property",
        "prism:copyright": "© 2023 Elsevier B.V. All rights reserved.",
        "openaccess": "0",
        "prism:issn": "0926860X",
        "dcterms:subject": [
          {
            "@_fa": "true",
            "$": "Glycerol"
          },
          {
            "@_fa": "true",
            "$": "Transesterification"
          },
          {
            "@_fa": "true",
            "$": "Glycerol carbonate"
          },
          {
            "@_fa": "true",
            "$": "ZrO2-based catalyst"
          },
          {
            "@_fa": "true",
            "$": "Fluorine content"
          }
        ],
        "openaccessArticle": "false",
        "prism:publicationName": "Applied Catalysis A: General",
        "openaccessSponsorType": null,
        "prism:pageRange": "119370",
        "pubType": "fla",
        "prism:coverDisplayDate": "5 September 2023",
        "prism:doi": "10.1016/j.apcata.2023.119370",
        "prism:startingPage": "119370",
        "dc:identifier": "doi:10.1016/j.apcata.2023.119370",
        "openaccessSponsorName": null
      },
      "objects": {
        "object": [
          {
            "@category": "standard",
            "@height": "200",
            "@width": "402",
            "@_fa": "true",
            "$": "https://api.elsevier.com/content/object/eid/1-s2.0-S0926860X23003502-ga1.jpg?httpAccept=%2A%2F%2A",
            "@multimediatype": "JPEG image file",
            "@type": "IMAGE-DOWNSAMPLED",
            "@size": "27456",
            "@ref": "ga1",
            "@mimetype": "image/jpeg"
          },
          {
            "@category": "standard",
            "@height": "203",
            "@width": "565",
            "@_fa": "true",
            "$": "https://api.elsevier.com/content/object/eid/1-s2.0-S0926860X23003502-sc1.jpg?httpAccept=%2A%2F%2A",
            "@multimediatype": "JPEG image file",
            "@type": "IMAGE-DOWNSAMPLED",
            "@size": "28748",
            "@ref": "sc1",
            "@mimetype": "image/jpeg"
          },
          {
            "@category": "standard",
            "@height": "462",
            "@width": "565",
            "@_fa": "true",
            "$": "https://api.elsevier.com/content/object/eid/1-s2.0-S0926860X23003502-sc2.jpg?httpAccept=%2A%2F%2A",
            "@multimediatype": "JPEG image file",
            "@type": "IMAGE-DOWNSAMPLED",
            "@size": "38610",
            "@ref": "sc2",
            "@mimetype": "image/jpeg"
          },
          {
            "@category": "standard",
            "@height": "406",
            "@width": "751",
            "@_fa": "true",
            "$": "https://api.elsevier.com/content/object/eid/1-s2.0-S0926860X23003502-gr1.jpg?httpAccept=%2A%2F%2A",
            "@multimediatype": "JPEG image file",
            "@type": "IMAGE-DOWNSAMPLED",
            "@size": "65568",
            "@ref": "gr1",
            "@mimetype": "image/jpeg"
          },
          {
            "@category": "standard",
            "@height": "700",
            "@width": "678",
            "@_fa": "true",
            "$": "https://api.elsevier.com/content/object/eid/1-s2.0-S0926860X23003502-gr4.jpg?httpAccept=%2A%2F%2A",
            "@multimediatype": "JPEG image file",
            "@type": "IMAGE-DOWNSAMPLED",
            "@size": "147619",
            "@ref": "gr4",
            "@mimetype": "image/jpeg"
          },
          {
            "@category": "standard",
            "@height": "660",
            "@width": "678",
            "@_fa": "true",
            "$": "https://api.elsevier.com/content/object/eid/1-s2.0-S0926860X23003502-gr5.jpg?httpAccept=%2A%2F%2A",
            "@multimediatype": "JPEG image file",
            "@type": "IMAGE-DOWNSAMPLED",
            "@size": "168712",
            "@ref": "gr5",
            "@mimetype": "image/jpeg"
          },
          {
            "@category": "standard",
            "@height": "277",
            "@width": "678",
            "@_fa": "true",
            "$": "https://api.elsevier.com/content/object/eid/1-s2.0-S0926860X23003502-gr2.jpg?httpAccept=%2A%2F%2A",
            "@multimediatype": "JPEG image file",
            "@type": "IMAGE-DOWNSAMPLED",
            "@size": "47978",
            "@ref": "gr2",
            "@mimetype": "image/jpeg"
          },
          {
            "@category": "standard",
            "@height": "355",
            "@width": "376",
            "@_fa": "true",
            "$": "https://api.elsevier.com/content/object/eid/1-s2.0-S0926860X23003502-gr3.jpg?httpAccept=%2A%2F%2A",
            "@multimediatype": "JPEG image file",
            "@type": "IMAGE-DOWNSAMPLED",
            "@size": "36412",
            "@ref": "gr3",
            "@mimetype": "image/jpeg"
          },
          {
            "@category": "standard",
            "@height": "292",
            "@width": "376",
            "@_fa": "true",
            "$": "https://api.elsevier.com/content/object/eid/1-s2.0-S0926860X23003502-gr8.jpg?httpAccept=%2A%2F%2A",
            "@multimediatype": "JPEG image file",
            "@type": "IMAGE-DOWNSAMPLED",
            "@size": "15783",
            "@ref": "gr8",
            "@mimetype": "image/jpeg"
          },
          {
            "@category": "standard",
            "@height": "289",
            "@width": "376",
            "@_fa": "true",
            "$": "https://api.elsevier.com/content/object/eid/1-s2.0-S0926860X23003502-gr9.jpg?httpAccept=%2A%2F%2A",
            "@multimediatype": "JPEG image file",
            "@type": "IMAGE-DOWNSAMPLED",
            "@size": "17412",
            "@ref": "gr9",
            "@mimetype": "image/jpeg"
          },
          {
            "@category": "standard",
            "@height": "600",
            "@width": "684",
            "@_fa": "true",
            "$": "https://api.elsevier.com/content/object/eid/1-s2.0-S0926860X23003502-gr6.jpg?httpAccept=%2A%2F%2A",
            "@multimediatype": "JPEG image file",
            "@type": "IMAGE-DOWNSAMPLED",
            "@size": "79623",
            "@ref": "gr6",
            "@mimetype": "image/jpeg"
          },
          {
            "@category": "standard",
            "@height": "471",
            "@width": "678",
            "@_fa": "true",
            "$": "https://api.elsevier.com/content/object/eid/1-s2.0-S0926860X23003502-gr7.jpg?httpAccept=%2A%2F%2A",
            "@multimediatype": "JPEG image file",
            "@type": "IMAGE-DOWNSAMPLED",
            "@size": "96317",
            "@ref": "gr7",
            "@mimetype": "image/jpeg"
          },
          {
            "@category": "thumbnail",
            "@height": "109",
            "@width": "219",
            "@_fa": "true",
            "$": "https://api.elsevier.com/content/object/eid/1-s2.0-S0926860X23003502-ga1.sml?httpAccept=%2A%2F%2A",
            "@multimediatype": "GIF image file",
            "@type": "IMAGE-THUMBNAIL",
            "@size": "9020",
            "@ref": "ga1",
            "@mimetype": "image/gif"
          },
          {
            "@category": "thumbnail",
            "@height": "79",
            "@width": "219",
            "@_fa": "true",
            "$": "https://api.elsevier.com/content/object/eid/1-s2.0-S0926860X23003502-sc1.sml?httpAccept=%2A%2F%2A",
            "@multimediatype": "GIF image file",
            "@type": "IMAGE-THUMBNAIL",
            "@size": "5837",
            "@ref": "sc1",
            "@mimetype": "image/gif"
          },
          {
            "@category": "thumbnail",
            "@height": "164",
            "@width": "200",
            "@_fa": "true",
            "$": "https://api.elsevier.com/content/object/eid/1-s2.0-S0926860X23003502-sc2.sml?httpAccept=%2A%2F%2A",
            "@multimediatype": "GIF image file",
            "@type": "IMAGE-THUMBNAIL",
            "@size": "8293",
            "@ref": "sc2",
            "@mimetype": "image/gif"
          },
          {
            "@category": "thumbnail",
            "@height": "118",
            "@width": "219",
            "@_fa": "true",
            "$": "https://api.elsevier.com/content/object/eid/1-s2.0-S0926860X23003502-gr1.sml?httpAccept=%2A%2F%2A",
            "@multimediatype": "GIF image file",
            "@type": "IMAGE-THUMBNAIL",
            "@size": "7888",
            "@ref": "gr1",
            "@mimetype": "image/gif"
          },
          {
            "@category": "thumbnail",
            "@height": "163",
            "@width": "158",
            "@_fa": "true",
            "$": "https://api.elsevier.com/content/object/eid/1-s2.0-S0926860X23003502-gr4.sml?httpAccept=%2A%2F%2A",
            "@multimediatype": "GIF image file",
            "@type": "IMAGE-THUMBNAIL",
            "@size": "16498",
            "@ref": "gr4",
            "@mimetype": "image/gif"
          },
          {
            "@category": "thumbnail",
            "@height": "163",
            "@width": "168",
            "@_fa": "true",
            "$": "https://api.elsevier.com/content/object/eid/1-s2.0-S0926860X23003502-gr5.sml?httpAccept=%2A%2F%2A",
            "@multimediatype": "GIF image file",
            "@type": "IMAGE-THUMBNAIL",
            "@size": "22614",
            "@ref": "gr5",
            "@mimetype": "image/gif"
          },
          {
            "@category": "thumbnail",
            "@height": "89",
            "@width": "219",
            "@_fa": "true",
            "$": "https://api.elsevier.com/content/object/eid/1-s2.0-S0926860X23003502-gr2.sml?httpAccept=%2A%2F%2A",
            "@multimediatype": "GIF image file",
            "@type": "IMAGE-THUMBNAIL",
            "@size": "6305",
            "@ref": "gr2",
            "@mimetype": "image/gif"
          },
          {
            "@category": "thumbnail",
            "@height": "164",
            "@width": "174",
            "@_fa": "true",
            "$": "https://api.elsevier.com/content/object/eid/1-s2.0-S0926860X23003502-gr3.sml?httpAccept=%2A%2F%2A",
            "@multimediatype": "GIF image file",
            "@type": "IMAGE-THUMBNAIL",
            "@size": "7406",
            "@ref": "gr3",
            "@mimetype": "image/gif"
          },
          {
            "@category": "thumbnail",
            "@height": "164",
            "@width": "211",
            "@_fa": "true",
            "$": "https://api.elsevier.com/content/object/eid/1-s2.0-S0926860X23003502-gr8.sml?httpAccept=%2A%2F%2A",
            "@multimediatype": "GIF image file",
            "@type": "IMAGE-THUMBNAIL",
            "@size": "6330",
            "@ref": "gr8",
            "@mimetype": "image/gif"
          },
          {
            "@category": "thumbnail",
            "@height": "163",
            "@width": "213",
            "@_fa": "true",
            "$": "https://api.elsevier.com/content/object/eid/1-s2.0-S0926860X23003502-gr9.sml?httpAccept=%2A%2F%2A",
            "@multimediatype": "GIF image file",
            "@type": "IMAGE-THUMBNAIL",
            "@size": "5394",
            "@ref": "gr9",
            "@mimetype": "image/gif"
          },
          {
            "@category": "thumbnail",
            "@height": "164",
            "@width": "187",
            "@_fa": "true",
            "$": "https://api.elsevier.com/content/object/eid/1-s2.0-S0926860X23003502-gr6.sml?httpAccept=%2A%2F%2A",
            "@multimediatype": "GIF image file",
            "@type": "IMAGE-THUMBNAIL",
            "@size": "11190",
            "@ref": "gr6",
            "@mimetype": "image/gif"
          },
          {
            "@category": "thumbnail",
            "@height": "152",
            "@width": "219",
            "@_fa": "true",
            "$": "https://api.elsevier.com/content/object/eid/1-s2.0-S0926860X23003502-gr7.sml?httpAccept=%2A%2F%2A",
            "@multimediatype": "GIF image file",
            "@type": "IMAGE-THUMBNAIL",
            "@size": "15218",
            "@ref": "gr7",
            "@mimetype": "image/gif"
          },
          {
            "@category": "high",
            "@height": "886",
            "@width": "1782",
            "@_fa": "true",
            "$": "https://api.elsevier.com/content/object/eid/1-s2.0-S0926860X23003502-ga1_lrg.jpg?httpAccept=%2A%2F%2A",
            "@multimediatype": "JPEG image file",
            "@type": "IMAGE-HIGH-RES",
            "@size": "191891",
            "@ref": "ga1",
            "@mimetype": "image/jpeg"
          },
          {
            "@category": "high",
            "@height": "896",
            "@width": "2495",
            "@_fa": "true",
            "$": "https://api.elsevier.com/content/object/eid/1-s2.0-S0926860X23003502-sc1_lrg.jpg?httpAccept=%2A%2F%2A",
            "@multimediatype": "JPEG image file",
            "@type": "IMAGE-HIGH-RES",
            "@size": "132126",
            "@ref": "sc1",
            "@mimetype": "image/jpeg"
          },
          {
            "@category": "high",
            "@height": "2042",
            "@width": "2495",
            "@_fa": "true",
            "$": "https://api.elsevier.com/content/object/eid/1-s2.0-S0926860X23003502-sc2_lrg.jpg?httpAccept=%2A%2F%2A",
            "@multimediatype": "JPEG image file",
            "@type": "IMAGE-HIGH-RES",
            "@size": "182795",
            "@ref": "sc2",
            "@mimetype": "image/jpeg"
          },
          {
            "@category": "high",
            "@height": "1798",
            "@width": "3326",
            "@_fa": "true",
            "$": "https://api.elsevier.com/content/object/eid/1-s2.0-S0926860X23003502-gr1_lrg.jpg?httpAccept=%2A%2F%2A",
            "@multimediatype": "JPEG image file",
            "@type": "IMAGE-HIGH-RES",
            "@size": "412172",
            "@ref": "gr1",
            "@mimetype": "image/jpeg"
          },
          {
            "@category": "high",
            "@height": "3093",
            "@width": "2994",
            "@_fa": "true",
            "$": "https://api.elsevier.com/content/object/eid/1-s2.0-S0926860X23003502-gr4_lrg.jpg?httpAccept=%2A%2F%2A",
            "@multimediatype": "JPEG image file",
            "@type": "IMAGE-HIGH-RES",
            "@size": "818730",
            "@ref": "gr4",
            "@mimetype": "image/jpeg"
          },
          {
            "@category": "high",
            "@height": "2913",
            "@width": "2994",
            "@_fa": "true",
            "$": "https://api.elsevier.com/content/object/eid/1-s2.0-S0926860X23003502-gr5_lrg.jpg?httpAccept=%2A%2F%2A",
            "@multimediatype": "JPEG image file",
            "@type": "IMAGE-HIGH-RES",
            "@size": "974857",
            "@ref": "gr5",
            "@mimetype": "image/jpeg"
          },
          {
            "@category": "high",
            "@height": "1223",
            "@width": "2994",
            "@_fa": "true",
            "$": "https://api.elsevier.com/content/object/eid/1-s2.0-S0926860X23003502-gr2_lrg.jpg?httpAccept=%2A%2F%2A",
            "@multimediatype": "JPEG image file",
            "@type": "IMAGE-HIGH-RES",
            "@size": "313497",
            "@ref": "gr2",
            "@mimetype": "image/jpeg"
          },
          {
            "@category": "high",
            "@height": "1569",
            "@width": "1663",
            "@_fa": "true",
            "$": "https://api.elsevier.com/content/object/eid/1-s2.0-S0926860X23003502-gr3_lrg.jpg?httpAccept=%2A%2F%2A",
            "@multimediatype": "JPEG image file",
            "@type": "IMAGE-HIGH-RES",
            "@size": "230282",
            "@ref": "gr3",
            "@mimetype": "image/jpeg"
          },
          {
            "@category": "high",
            "@height": "1290",
            "@width": "1663",
            "@_fa": "true",
            "$": "https://api.elsevier.com/content/object/eid/1-s2.0-S0926860X23003502-gr8_lrg.jpg?httpAccept=%2A%2F%2A",
            "@multimediatype": "JPEG image file",
            "@type": "IMAGE-HIGH-RES",
            "@size": "95987",
            "@ref": "gr8",
            "@mimetype": "image/jpeg"
          },
          {
            "@category": "high",
            "@height": "1278",
            "@width": "1665",
            "@_fa": "true",
            "$": "https://api.elsevier.com/content/object/eid/1-s2.0-S0926860X23003502-gr9_lrg.jpg?httpAccept=%2A%2F%2A",
            "@multimediatype": "JPEG image file",
            "@type": "IMAGE-HIGH-RES",
            "@size": "109581",
            "@ref": "gr9",
            "@mimetype": "image/jpeg"
          },
          {
            "@category": "high",
            "@height": "2653",
            "@width": "3022",
            "@_fa": "true",
            "$": "https://api.elsevier.com/content/object/eid/1-s2.0-S0926860X23003502-gr6_lrg.jpg?httpAccept=%2A%2F%2A",
            "@multimediatype": "JPEG image file",
            "@type": "IMAGE-HIGH-RES",
            "@size": "491252",
            "@ref": "gr6",
            "@mimetype": "image/jpeg"
          },
          {
            "@category": "high",
            "@height": "2079",
            "@width": "2994",
            "@_fa": "true",
            "$": "https://api.elsevier.com/content/object/eid/1-s2.0-S0926860X23003502-gr7_lrg.jpg?httpAccept=%2A%2F%2A",
            "@multimediatype": "JPEG image file",
            "@type": "IMAGE-HIGH-RES",
            "@size": "732880",
            "@ref": "gr7",
            "@mimetype": "image/jpeg"
          },
          {
            "@category": "standard",
            "@_fa": "true",
            "$": "https://api.elsevier.com/content/object/eid/1-s2.0-S0926860X23003502-mmc1.doc?httpAccept=%2A%2F%2A",
            "@multimediatype": "Microsoft Word file",
            "@type": "APPLICATION",
            "@size": "990720",
            "@ref": "mmc1",
            "@mimetype": "application/word"
          },
          {
            "@category": "thumbnail",
            "@_fa": "true",
            "$": "https://api.elsevier.com/content/object/eid/1-s2.0-S0926860X23003502-si0001.svg?httpAccept=%2A%2F%2A",
            "@multimediatype": "Scalable Vector Graphics file",
            "@type": "ALTIMG",
            "@size": "5567",
            "@ref": "si0001",
            "@mimetype": "image/svg+xml"
          },
          {
            "@category": "thumbnail",
            "@_fa": "true",
            "$": "https://api.elsevier.com/content/object/eid/1-s2.0-S0926860X23003502-si0002.svg?httpAccept=%2A%2F%2A",
            "@multimediatype": "Scalable Vector Graphics file",
            "@type": "ALTIMG",
            "@size": "5345",
            "@ref": "si0002",
            "@mimetype": "image/svg+xml"
          },
          {
            "@category": "thumbnail",
            "@_fa": "true",
            "$": "https://api.elsevier.com/content/object/eid/1-s2.0-S0926860X23003502-si0003.svg?httpAccept=%2A%2F%2A",
            "@multimediatype": "Scalable Vector Graphics file",
            "@type": "ALTIMG",
            "@size": "3140",
            "@ref": "si0003",
            "@mimetype": "image/svg+xml"
          },
          {
            "@category": "thumbnail",
            "@_fa": "true",
            "$": "https://api.elsevier.com/content/object/eid/1-s2.0-S0926860X23003502-si0004.svg?httpAccept=%2A%2F%2A",
            "@multimediatype": "Scalable Vector Graphics file",
            "@type": "ALTIMG",
            "@size": "6694",
            "@ref": "si0004",
            "@mimetype": "image/svg+xml"
          },
          {
            "@category": "thumbnail",
            "@_fa": "true",
            "$": "https://api.elsevier.com/content/object/eid/1-s2.0-S0926860X23003502-si0005.svg?httpAccept=%2A%2F%2A",
            "@multimediatype": "Scalable Vector Graphics file",
            "@type": "ALTIMG",
            "@size": "4007",
            "@ref": "si0005",
            "@mimetype": "image/svg+xml"
          },
          {
            "@category": "thumbnail",
            "@_fa": "true",
            "$": "https://api.elsevier.com/content/object/eid/1-s2.0-S0926860X23003502-si0006.svg?httpAccept=%2A%2F%2A",
            "@multimediatype": "Scalable Vector Graphics file",
            "@type": "ALTIMG",
            "@size": "7748",
            "@ref": "si0006",
            "@mimetype": "image/svg+xml"
          },
          {
            "@category": "thumbnail",
            "@_fa": "true",
            "$": "https://api.elsevier.com/content/object/eid/1-s2.0-S0926860X23003502-si0007.svg?httpAccept=%2A%2F%2A",
            "@multimediatype": "Scalable Vector Graphics file",
            "@type": "ALTIMG",
            "@size": "6731",
            "@ref": "si0007",
            "@mimetype": "image/svg+xml"
          },
          {
            "@category": "standard",
            "@_fa": "true",
            "$": "https://api.elsevier.com/content/object/eid/1-s2.0-S0926860X23003502-am.pdf?httpAccept=%2A%2F%2A",
            "@multimediatype": "Acrobat PDF file",
            "@type": "AAM-PDF",
            "@size": "2843776",
            "@ref": "am",
            "@mimetype": "application/pdf"
          }
        ]
      },
      "link": {
        "@rel": "abstract",
        "@href": "https://api.elsevier.com/content/abstract/scopus_id/85168824567"
      }
    }
  }
}