{
  "metadata": {
    "title": "Palladium nanoparticle decorated high nitrogen-doped graphene with high catalytic activity for Suzuki–Miyaura and Ullmann-type coupling reactions in aqueous media",
    "authors": "; ; ",
    "journal": "Applied Catalysis A: General",
    "date": "2014-11-30",
    "doi": "10.1016/j.apcata.2014.09.045",
    "abstract": "",
    "uri": "https://api.elsevier.com/content/article/pii/S0926860X14006073",
    "pii": "S0926860X14006073"
  },
  "fulltext": {
    "full-text-retrieval-response": {
      "scopus-eid": "2-s2.0-84928941974",
      "originalText": "serial JL 271346 291210 291744 291809 31 Applied Catalysis A: General APPLIEDCATALYSISAGENERAL 2014-10-07 2014-10-07 2014-11-13T11:31:23 1-s2.0-S0926860X14006073 S0926-860X(14)00607-3 S0926860X14006073 10.1016/j.apcata.2014.09.045 S300 S300.1 FULL-TEXT 1-s2.0-S0926860X14X00190 2024-01-01T12:30:29.635264Z 0 0 20141101 20141130 2014 2014-10-07T07:00:46.279473Z absattachment articleinfo articletitlenorm authfirstinitialnorm authfirstsurnamenorm cid cids contenttype copyright crossmark dateloaded dateloadedtxt datesearch datesort dateupdated dco docsubtype doctype doi eid ewtransactionid hubeid indexeddate issn issnnorm itemstage itemtransactionid itemweight openaccess openarchive pg pgfirst pglast pii piinorm pubdateend pubdatestart pubdatetxt pubyr sectiontitle sortorder srctitle srctitlenorm srctype ssids alllist content subj subheadings suppl tomb volfirst volissue volumelist webpdf webpdfpagecount yearnav figure table e-component body acknowledge affil appendices articletitle auth authfirstini authfull authkeywords authlast highlightsabst primabst ref specialabst 0926-860X 0926860X true 488 488 C Volume 488 32 265 274 265 274 201411 November 2014 2014-11-01 2014-11-30 2014 Articles article fla Copyright © 2014 Elsevier B.V. All rights reserved. PALLADIUMNANOPARTICLEDECORATEDHIGHNITROGENDOPEDGRAPHENEHIGHCATALYTICACTIVITYFORSUZUKIMIYAURAULLMANNTYPECOUPLINGREACTIONSINAQUEOUSMEDIA MOVAHED S 1 Introduction 2 Experimental 2.1 Characterization 2.2 Preparation of graphene oxide (GO) 2.3 Preparation of high nitrogen-doped graphene (HNG) 2.4 Preparation of palladium nanoparticle-high nitrogen-doped graphene (Pd NPs-HNG) 2.5 Preparation of nitrogen-doped graphene (NG) 2.6 Preparation of palladium nanoparticle-nitrogen-doped graphene (Pd NPs-NG) 2.7 Preparation of reduced graphene oxide (RGO) 2.8 Preparation of palladium nanoparticle-reduced graphene oxide (Pd NPs-RGO) 2.9 General procedure for the Suzuki–Miyaura cross-coupling reaction 2.10 General procedure for the Ullmann homo-coupling reaction 3 Results and discussion 3.1 Synthesis and characterization of catalyst 4 The catalytic activity of Pd NPs–HNG nanocomposite toward the Suzuki–Miyaura cross-coupling reaction 4.1 Reusability of Pd NPs-HNG in Suzuki–Miyaura cross-coupling reaction 5 The catalytic activity of Pd NPs-HNG nanocomposite toward the Ullmann homo-coupling reaction 5.1 Reusability of Pd NPs-HNG nanocomposite in Ullmann homo-coupling reaction 6 Conclusion Acknowledgement Appendix A Supplementary data References HASSAN 2002 1359 J SCHEUERMANN 2009 8262 G DJAKOVICH 2008 303 348 L ROLEPALLADIUMNANOPARTICLESCATALYSTSFORCARBONCARBONCOUPLINGREACTIONSINNANOPARTICLESCATALYSIS NIE 2014 1 6 R NIE 2012 586 596 R SIAMAKI 2011 1 A ZHU 2010 3906 Y HUANG 2012 666 X HUANG 2011 1876 X MACHADO 2012 54 B NIE 2013 9037 R LIANG 2011 780 Y WANG 2012 781 H USACHOV 2011 5401 D GONG 2009 760 K GOPALAKRISHNAN 2011 304 K GAO 2013 2109 Y MOVAHED 2014 5243 S MOVAHED 2014 14586 S HUMMERS 1958 1339 W KOVTYUKHOVA 1999 771 N SUN 2012 4498 L PARAMBHATH 2012 7826 V LONG 2010 16096 D XIONG 2010 6099 Z JORIO 2011 A RAMANSPECTROSCOPYINGRAPHENERELATEDSYSTEMS FU 2010 1461 X DENG 2011 1188 D ALLEN 2010 132 M LEE 2003 12958 Y KANG 2004 233411 H EWELS 2005 1345 C DRESSELHAUS 2005 47 M DRESSELHAUS 2002 1 M YANG 2014 2623 Z LEONARDI 2014 617 S TSAI 2011 1349 C LONG 2010 16096 D HASIK 2002 916 M ZHOU 2010 1437 Y LI 2010 429 Y KAMAL 2012 2513 A WANG 2006 1284 L DHITAL 2012 20250 R SHAOA 2010 421 L MUKHOPADHYAY 2001 6117 S MONOPOLI 2010 3908 A MUKHOPADHYAY 1999 14763 S MUKHOPADHYAY 2000 211 S KARIMI 2014 745 B GALLON 2007 7251 B MOVAHEDX2014X265 MOVAHEDX2014X265X274 MOVAHEDX2014X265XS MOVAHEDX2014X265X274XS item S0926-860X(14)00607-3 S0926860X14006073 1-s2.0-S0926860X14006073 10.1016/j.apcata.2014.09.045 271346 2024-01-01T12:30:29.635264Z 2014-11-01 2014-11-30 1-s2.0-S0926860X14006073-main.pdf https://s3.amazonaws.com/prod-ucs-content-store-us-east/content/pii:S0926860X14006073/MAIN/application/pdf/8f08961cd36593a8212478274d8e2027/main.pdf https://s3-eu-west-1.amazonaws.com/prod-ucs-content-store-eu-west/content/pii:S0926860X14006073/MAIN/application/pdf/8f08961cd36593a8212478274d8e2027/main.pdf main.pdf pdf true 2659268 MAIN 10 1-s2.0-S0926860X14006073-main_1.png https://s3-eu-west-1.amazonaws.com/prod-ucs-content-store-eu-west/content/pii:S0926860X14006073/PREVIEW/image/png/cf5c72b6809244693b92b395054045bf/main_1.png https://s3.amazonaws.com/prod-ucs-content-store-us-east/content/pii:S0926860X14006073/PREVIEW/image/png/cf5c72b6809244693b92b395054045bf/main_1.png main_1.png png 58079 849 656 IMAGE-WEB-PDF 1 1-s2.0-S0926860X14006073-sc1_lrg.jpg https://s3.amazonaws.com/prod-ucs-content-store-us-east/content/pii:S0926860X14006073/sc1/HIGHRES/image/jpeg/96623de8db5156d900ce92b1fcb5c5ae/sc1_lrg.jpg https://s3-eu-west-1.amazonaws.com/prod-ucs-content-store-eu-west/content/pii:S0926860X14006073/sc1/HIGHRES/image/jpeg/96623de8db5156d900ce92b1fcb5c5ae/sc1_lrg.jpg sc1 sc1_lrg.jpg jpg 464717 1397 3235 IMAGE-HIGH-RES 1-s2.0-S0926860X14006073-gr6_lrg.jpg https://s3.amazonaws.com/prod-ucs-content-store-us-east/content/pii:S0926860X14006073/gr6/HIGHRES/image/jpeg/6028e4783717ed7f96643a5674fd8327/gr6_lrg.jpg https://s3-eu-west-1.amazonaws.com/prod-ucs-content-store-eu-west/content/pii:S0926860X14006073/gr6/HIGHRES/image/jpeg/6028e4783717ed7f96643a5674fd8327/gr6_lrg.jpg gr6 gr6_lrg.jpg jpg 215502 495 1997 IMAGE-HIGH-RES 1-s2.0-S0926860X14006073-gr5_lrg.jpg https://s3.amazonaws.com/prod-ucs-content-store-us-east/content/pii:S0926860X14006073/gr5/HIGHRES/image/jpeg/621ed01a51fb72cde95eac691f4cea03/gr5_lrg.jpg https://s3-eu-west-1.amazonaws.com/prod-ucs-content-store-eu-west/content/pii:S0926860X14006073/gr5/HIGHRES/image/jpeg/621ed01a51fb72cde95eac691f4cea03/gr5_lrg.jpg gr5 gr5_lrg.jpg jpg 285416 1527 2333 IMAGE-HIGH-RES 1-s2.0-S0926860X14006073-gr4_lrg.jpg https://s3.amazonaws.com/prod-ucs-content-store-us-east/content/pii:S0926860X14006073/gr4/HIGHRES/image/jpeg/1f7f185abe74cbe49f3dbeb0f85ff8a2/gr4_lrg.jpg https://s3-eu-west-1.amazonaws.com/prod-ucs-content-store-eu-west/content/pii:S0926860X14006073/gr4/HIGHRES/image/jpeg/1f7f185abe74cbe49f3dbeb0f85ff8a2/gr4_lrg.jpg gr4 gr4_lrg.jpg jpg 504384 1969 1350 IMAGE-HIGH-RES 1-s2.0-S0926860X14006073-gr3_lrg.jpg https://s3.amazonaws.com/prod-ucs-content-store-us-east/content/pii:S0926860X14006073/gr3/HIGHRES/image/jpeg/4fdc1d101362459245066bd43e3940f0/gr3_lrg.jpg https://s3-eu-west-1.amazonaws.com/prod-ucs-content-store-eu-west/content/pii:S0926860X14006073/gr3/HIGHRES/image/jpeg/4fdc1d101362459245066bd43e3940f0/gr3_lrg.jpg gr3 gr3_lrg.jpg jpg 1026273 3132 3333 IMAGE-HIGH-RES 1-s2.0-S0926860X14006073-gr2_lrg.jpg https://s3.amazonaws.com/prod-ucs-content-store-us-east/content/pii:S0926860X14006073/gr2/HIGHRES/image/jpeg/7ae6704cfb34410a2d3cabd6625981d2/gr2_lrg.jpg https://s3-eu-west-1.amazonaws.com/prod-ucs-content-store-eu-west/content/pii:S0926860X14006073/gr2/HIGHRES/image/jpeg/7ae6704cfb34410a2d3cabd6625981d2/gr2_lrg.jpg gr2 gr2_lrg.jpg jpg 174721 1012 2500 IMAGE-HIGH-RES 1-s2.0-S0926860X14006073-gr1_lrg.jpg https://s3.amazonaws.com/prod-ucs-content-store-us-east/content/pii:S0926860X14006073/gr1/HIGHRES/image/jpeg/ff6cc1722a9e87d5361616372c172837/gr1_lrg.jpg https://s3-eu-west-1.amazonaws.com/prod-ucs-content-store-eu-west/content/pii:S0926860X14006073/gr1/HIGHRES/image/jpeg/ff6cc1722a9e87d5361616372c172837/gr1_lrg.jpg gr1 gr1_lrg.jpg jpg 186356 1595 1667 IMAGE-HIGH-RES 1-s2.0-S0926860X14006073-fx5_lrg.jpg https://s3.amazonaws.com/prod-ucs-content-store-us-east/content/pii:S0926860X14006073/fx5/HIGHRES/image/jpeg/005a7466494c0a4ab716bfbeac619118/fx5_lrg.jpg https://s3-eu-west-1.amazonaws.com/prod-ucs-content-store-eu-west/content/pii:S0926860X14006073/fx5/HIGHRES/image/jpeg/005a7466494c0a4ab716bfbeac619118/fx5_lrg.jpg fx5 fx5_lrg.jpg jpg 28437 268 1477 IMAGE-HIGH-RES 1-s2.0-S0926860X14006073-fx4_lrg.jpg https://s3.amazonaws.com/prod-ucs-content-store-us-east/content/pii:S0926860X14006073/fx4/HIGHRES/image/jpeg/976f970c87e7776bfc31894fef9312ec/fx4_lrg.jpg https://s3-eu-west-1.amazonaws.com/prod-ucs-content-store-eu-west/content/pii:S0926860X14006073/fx4/HIGHRES/image/jpeg/976f970c87e7776bfc31894fef9312ec/fx4_lrg.jpg fx4 fx4_lrg.jpg jpg 30375 382 1195 IMAGE-HIGH-RES 1-s2.0-S0926860X14006073-fx3_lrg.jpg https://s3.amazonaws.com/prod-ucs-content-store-us-east/content/pii:S0926860X14006073/fx3/HIGHRES/image/jpeg/90a7b9610d5f4cae07e1257816550776/fx3_lrg.jpg https://s3-eu-west-1.amazonaws.com/prod-ucs-content-store-eu-west/content/pii:S0926860X14006073/fx3/HIGHRES/image/jpeg/90a7b9610d5f4cae07e1257816550776/fx3_lrg.jpg fx3 fx3_lrg.jpg jpg 42155 261 1994 IMAGE-HIGH-RES 1-s2.0-S0926860X14006073-fx2_lrg.jpg https://s3.amazonaws.com/prod-ucs-content-store-us-east/content/pii:S0926860X14006073/fx2/HIGHRES/image/jpeg/152c03bb77eb45ebadc0dbd91deb597b/fx2_lrg.jpg https://s3-eu-west-1.amazonaws.com/prod-ucs-content-store-eu-west/content/pii:S0926860X14006073/fx2/HIGHRES/image/jpeg/152c03bb77eb45ebadc0dbd91deb597b/fx2_lrg.jpg fx2 fx2_lrg.jpg jpg 45730 358 1918 IMAGE-HIGH-RES 1-s2.0-S0926860X14006073-fx1_lrg.jpg https://s3.amazonaws.com/prod-ucs-content-store-us-east/content/pii:S0926860X14006073/fx1/HIGHRES/image/jpeg/654e25785063635cd48ca65970b7c835/fx1_lrg.jpg https://s3-eu-west-1.amazonaws.com/prod-ucs-content-store-eu-west/content/pii:S0926860X14006073/fx1/HIGHRES/image/jpeg/654e25785063635cd48ca65970b7c835/fx1_lrg.jpg fx1 true fx1_lrg.jpg jpg 168911 886 1194 IMAGE-HIGH-RES 1-s2.0-S0926860X14006073-sc1.jpg https://s3.amazonaws.com/prod-ucs-content-store-us-east/content/pii:S0926860X14006073/sc1/DOWNSAMPLED/image/jpeg/b9ec0f5a889f35c72280646d656a0dd9/sc1.jpg https://s3-eu-west-1.amazonaws.com/prod-ucs-content-store-eu-west/content/pii:S0926860X14006073/sc1/DOWNSAMPLED/image/jpeg/b9ec0f5a889f35c72280646d656a0dd9/sc1.jpg sc1 sc1.jpg jpg 58072 316 731 IMAGE-DOWNSAMPLED 1-s2.0-S0926860X14006073-gr6.jpg https://s3.amazonaws.com/prod-ucs-content-store-us-east/content/pii:S0926860X14006073/gr6/DOWNSAMPLED/image/jpeg/a06c041fdf7e4e22fa193ba74a654160/gr6.jpg https://s3-eu-west-1.amazonaws.com/prod-ucs-content-store-eu-west/content/pii:S0926860X14006073/gr6/DOWNSAMPLED/image/jpeg/a06c041fdf7e4e22fa193ba74a654160/gr6.jpg gr6 gr6.jpg jpg 42218 186 752 IMAGE-DOWNSAMPLED 1-s2.0-S0926860X14006073-gr5.jpg https://s3.amazonaws.com/prod-ucs-content-store-us-east/content/pii:S0926860X14006073/gr5/DOWNSAMPLED/image/jpeg/6d6371dca89da5fd68950583e57e384f/gr5.jpg https://s3-eu-west-1.amazonaws.com/prod-ucs-content-store-eu-west/content/pii:S0926860X14006073/gr5/DOWNSAMPLED/image/jpeg/6d6371dca89da5fd68950583e57e384f/gr5.jpg gr5 gr5.jpg jpg 36560 345 527 IMAGE-DOWNSAMPLED 1-s2.0-S0926860X14006073-gr4.jpg https://s3.amazonaws.com/prod-ucs-content-store-us-east/content/pii:S0926860X14006073/gr4/DOWNSAMPLED/image/jpeg/ca051f582270650ec34525b071d79879/gr4.jpg https://s3-eu-west-1.amazonaws.com/prod-ucs-content-store-eu-west/content/pii:S0926860X14006073/gr4/DOWNSAMPLED/image/jpeg/ca051f582270650ec34525b071d79879/gr4.jpg gr4 gr4.jpg jpg 76457 741 508 IMAGE-DOWNSAMPLED 1-s2.0-S0926860X14006073-gr3.jpg https://s3.amazonaws.com/prod-ucs-content-store-us-east/content/pii:S0926860X14006073/gr3/DOWNSAMPLED/image/jpeg/f9368ae8711c5cba60a029a0c8594f16/gr3.jpg https://s3-eu-west-1.amazonaws.com/prod-ucs-content-store-eu-west/content/pii:S0926860X14006073/gr3/DOWNSAMPLED/image/jpeg/f9368ae8711c5cba60a029a0c8594f16/gr3.jpg gr3 gr3.jpg jpg 123485 708 753 IMAGE-DOWNSAMPLED 1-s2.0-S0926860X14006073-gr2.jpg https://s3.amazonaws.com/prod-ucs-content-store-us-east/content/pii:S0926860X14006073/gr2/DOWNSAMPLED/image/jpeg/615039ff62cb3e52a698537f542ebde3/gr2.jpg https://s3-eu-west-1.amazonaws.com/prod-ucs-content-store-eu-west/content/pii:S0926860X14006073/gr2/DOWNSAMPLED/image/jpeg/615039ff62cb3e52a698537f542ebde3/gr2.jpg gr2 gr2.jpg jpg 25131 229 565 IMAGE-DOWNSAMPLED 1-s2.0-S0926860X14006073-gr1.jpg https://s3.amazonaws.com/prod-ucs-content-store-us-east/content/pii:S0926860X14006073/gr1/DOWNSAMPLED/image/jpeg/fc9b46aaf3effe702b81649a39b3d13e/gr1.jpg https://s3-eu-west-1.amazonaws.com/prod-ucs-content-store-eu-west/content/pii:S0926860X14006073/gr1/DOWNSAMPLED/image/jpeg/fc9b46aaf3effe702b81649a39b3d13e/gr1.jpg gr1 gr1.jpg jpg 28935 360 376 IMAGE-DOWNSAMPLED 1-s2.0-S0926860X14006073-fx5.jpg https://s3.amazonaws.com/prod-ucs-content-store-us-east/content/pii:S0926860X14006073/fx5/DOWNSAMPLED/image/jpeg/99feb0e4243bd6972574be37d7caa595/fx5.jpg https://s3-eu-west-1.amazonaws.com/prod-ucs-content-store-eu-west/content/pii:S0926860X14006073/fx5/DOWNSAMPLED/image/jpeg/99feb0e4243bd6972574be37d7caa595/fx5.jpg fx5 fx5.jpg jpg 3833 60 333 IMAGE-DOWNSAMPLED 1-s2.0-S0926860X14006073-fx4.jpg https://s3.amazonaws.com/prod-ucs-content-store-us-east/content/pii:S0926860X14006073/fx4/DOWNSAMPLED/image/jpeg/94a61c810998080212bc2129f8f10929/fx4.jpg https://s3-eu-west-1.amazonaws.com/prod-ucs-content-store-eu-west/content/pii:S0926860X14006073/fx4/DOWNSAMPLED/image/jpeg/94a61c810998080212bc2129f8f10929/fx4.jpg fx4 fx4.jpg jpg 3892 86 270 IMAGE-DOWNSAMPLED 1-s2.0-S0926860X14006073-fx3.jpg https://s3.amazonaws.com/prod-ucs-content-store-us-east/content/pii:S0926860X14006073/fx3/DOWNSAMPLED/image/jpeg/3c0e7bab256b5c7be0b928bc77d6ca1f/fx3.jpg https://s3-eu-west-1.amazonaws.com/prod-ucs-content-store-eu-west/content/pii:S0926860X14006073/fx3/DOWNSAMPLED/image/jpeg/3c0e7bab256b5c7be0b928bc77d6ca1f/fx3.jpg fx3 fx3.jpg jpg 5672 59 450 IMAGE-DOWNSAMPLED 1-s2.0-S0926860X14006073-fx2.jpg https://s3.amazonaws.com/prod-ucs-content-store-us-east/content/pii:S0926860X14006073/fx2/DOWNSAMPLED/image/jpeg/cd4d2ce5d4f4ec3af35903b03f96d0bb/fx2.jpg https://s3-eu-west-1.amazonaws.com/prod-ucs-content-store-eu-west/content/pii:S0926860X14006073/fx2/DOWNSAMPLED/image/jpeg/cd4d2ce5d4f4ec3af35903b03f96d0bb/fx2.jpg fx2 fx2.jpg jpg 5885 81 433 IMAGE-DOWNSAMPLED 1-s2.0-S0926860X14006073-fx1.jpg https://s3.amazonaws.com/prod-ucs-content-store-us-east/content/pii:S0926860X14006073/fx1/DOWNSAMPLED/image/jpeg/9d52c8eec35bd0b45cf294ffb5525251/fx1.jpg https://s3-eu-west-1.amazonaws.com/prod-ucs-content-store-eu-west/content/pii:S0926860X14006073/fx1/DOWNSAMPLED/image/jpeg/9d52c8eec35bd0b45cf294ffb5525251/fx1.jpg fx1 true fx1.jpg jpg 14144 200 269 IMAGE-DOWNSAMPLED 1-s2.0-S0926860X14006073-sc1.sml https://s3.amazonaws.com/prod-ucs-content-store-us-east/content/pii:S0926860X14006073/sc1/THUMBNAIL/image/gif/3c790c4080f755965f340e8d2d636a9b/sc1.sml https://s3-eu-west-1.amazonaws.com/prod-ucs-content-store-eu-west/content/pii:S0926860X14006073/sc1/THUMBNAIL/image/gif/3c790c4080f755965f340e8d2d636a9b/sc1.sml sc1 sc1.sml sml 4170 95 219 IMAGE-THUMBNAIL 1-s2.0-S0926860X14006073-gr6.sml https://s3.amazonaws.com/prod-ucs-content-store-us-east/content/pii:S0926860X14006073/gr6/THUMBNAIL/image/gif/15d44eb2c9decd4f080568ba8c479bfe/gr6.sml https://s3-eu-west-1.amazonaws.com/prod-ucs-content-store-eu-west/content/pii:S0926860X14006073/gr6/THUMBNAIL/image/gif/15d44eb2c9decd4f080568ba8c479bfe/gr6.sml gr6 gr6.sml sml 5868 54 219 IMAGE-THUMBNAIL 1-s2.0-S0926860X14006073-gr5.sml https://s3.amazonaws.com/prod-ucs-content-store-us-east/content/pii:S0926860X14006073/gr5/THUMBNAIL/image/gif/80bba597d77d143a77a666051a3019ef/gr5.sml https://s3-eu-west-1.amazonaws.com/prod-ucs-content-store-eu-west/content/pii:S0926860X14006073/gr5/THUMBNAIL/image/gif/80bba597d77d143a77a666051a3019ef/gr5.sml gr5 gr5.sml sml 5042 143 219 IMAGE-THUMBNAIL 1-s2.0-S0926860X14006073-gr4.sml https://s3.amazonaws.com/prod-ucs-content-store-us-east/content/pii:S0926860X14006073/gr4/THUMBNAIL/image/gif/72e1e2245c543349adcca76c9e96524e/gr4.sml https://s3-eu-west-1.amazonaws.com/prod-ucs-content-store-eu-west/content/pii:S0926860X14006073/gr4/THUMBNAIL/image/gif/72e1e2245c543349adcca76c9e96524e/gr4.sml gr4 gr4.sml sml 7400 163 112 IMAGE-THUMBNAIL 1-s2.0-S0926860X14006073-gr3.sml https://s3.amazonaws.com/prod-ucs-content-store-us-east/content/pii:S0926860X14006073/gr3/THUMBNAIL/image/gif/c43cef02c7fba0fbbc96c4a679959583/gr3.sml https://s3-eu-west-1.amazonaws.com/prod-ucs-content-store-eu-west/content/pii:S0926860X14006073/gr3/THUMBNAIL/image/gif/c43cef02c7fba0fbbc96c4a679959583/gr3.sml gr3 gr3.sml sml 6474 164 174 IMAGE-THUMBNAIL 1-s2.0-S0926860X14006073-gr2.sml https://s3.amazonaws.com/prod-ucs-content-store-us-east/content/pii:S0926860X14006073/gr2/THUMBNAIL/image/gif/4a23dacab00f5df70d74adb213175c36/gr2.sml https://s3-eu-west-1.amazonaws.com/prod-ucs-content-store-eu-west/content/pii:S0926860X14006073/gr2/THUMBNAIL/image/gif/4a23dacab00f5df70d74adb213175c36/gr2.sml gr2 gr2.sml sml 3028 89 219 IMAGE-THUMBNAIL 1-s2.0-S0926860X14006073-gr1.sml https://s3.amazonaws.com/prod-ucs-content-store-us-east/content/pii:S0926860X14006073/gr1/THUMBNAIL/image/gif/8677fd7fb5c24d13e5056de727c9a4cd/gr1.sml https://s3-eu-west-1.amazonaws.com/prod-ucs-content-store-eu-west/content/pii:S0926860X14006073/gr1/THUMBNAIL/image/gif/8677fd7fb5c24d13e5056de727c9a4cd/gr1.sml gr1 gr1.sml sml 4209 164 171 IMAGE-THUMBNAIL 1-s2.0-S0926860X14006073-fx5.sml https://s3.amazonaws.com/prod-ucs-content-store-us-east/content/pii:S0926860X14006073/fx5/THUMBNAIL/image/gif/16fadddc0307b5cb6afcbd52afd93203/fx5.sml https://s3-eu-west-1.amazonaws.com/prod-ucs-content-store-eu-west/content/pii:S0926860X14006073/fx5/THUMBNAIL/image/gif/16fadddc0307b5cb6afcbd52afd93203/fx5.sml fx5 fx5.sml sml 1685 40 219 IMAGE-THUMBNAIL 1-s2.0-S0926860X14006073-fx4.sml https://s3.amazonaws.com/prod-ucs-content-store-us-east/content/pii:S0926860X14006073/fx4/THUMBNAIL/image/gif/68316ffac52cce89e453cc5a9e7d5f75/fx4.sml https://s3-eu-west-1.amazonaws.com/prod-ucs-content-store-eu-west/content/pii:S0926860X14006073/fx4/THUMBNAIL/image/gif/68316ffac52cce89e453cc5a9e7d5f75/fx4.sml fx4 fx4.sml sml 2049 70 219 IMAGE-THUMBNAIL 1-s2.0-S0926860X14006073-fx3.sml https://s3.amazonaws.com/prod-ucs-content-store-us-east/content/pii:S0926860X14006073/fx3/THUMBNAIL/image/gif/8146748b893daa3af6e7231419f1554d/fx3.sml https://s3-eu-west-1.amazonaws.com/prod-ucs-content-store-eu-west/content/pii:S0926860X14006073/fx3/THUMBNAIL/image/gif/8146748b893daa3af6e7231419f1554d/fx3.sml fx3 fx3.sml sml 1666 29 219 IMAGE-THUMBNAIL 1-s2.0-S0926860X14006073-fx2.sml https://s3.amazonaws.com/prod-ucs-content-store-us-east/content/pii:S0926860X14006073/fx2/THUMBNAIL/image/gif/4fd92b77aba58af4beb368a023872711/fx2.sml https://s3-eu-west-1.amazonaws.com/prod-ucs-content-store-eu-west/content/pii:S0926860X14006073/fx2/THUMBNAIL/image/gif/4fd92b77aba58af4beb368a023872711/fx2.sml fx2 fx2.sml sml 1799 41 219 IMAGE-THUMBNAIL 1-s2.0-S0926860X14006073-fx1.sml https://s3.amazonaws.com/prod-ucs-content-store-us-east/content/pii:S0926860X14006073/fx1/THUMBNAIL/image/gif/151b7ea7d5e1e43d4c9999553dc06c67/fx1.sml https://s3-eu-west-1.amazonaws.com/prod-ucs-content-store-eu-west/content/pii:S0926860X14006073/fx1/THUMBNAIL/image/gif/151b7ea7d5e1e43d4c9999553dc06c67/fx1.sml fx1 true fx1.sml sml 17496 163 219 IMAGE-THUMBNAIL 1-s2.0-S0926860X14006073-mmc1.doc https://s3.amazonaws.com/prod-ucs-content-store-us-east/content/pii:S0926860X14006073/mmc1/MAIN/application/msword/3b6c4591400afe1a32424f09486a14e7/mmc1.doc https://s3-eu-west-1.amazonaws.com/prod-ucs-content-store-eu-west/content/pii:S0926860X14006073/mmc1/MAIN/application/msword/3b6c4591400afe1a32424f09486a14e7/mmc1.doc mmc1 mmc1.doc doc 3602944 APPLICATION APCATA 15026 S0926-860X(14)00607-3 10.1016/j.apcata.2014.09.045 Elsevier B.V. Scheme 1 Schematic illustration of the procedure of Pd NPs-HNG. Fig. 1 Raman spectra of GO, HNG, Pd NPs-HNG. Fig. 2 XRD patterns of GO, HNG, Pd NPs-HNG. Fig. 3 (a) Full-range XPS spectrum of Pd NPs-HNG nanocomposite. (b) C 1s, (c) N 1s, (d) Pd 3d, and (e) O 1s core-level region XPS spectra of Pd NPs-HNG nanocomposite, respectively. Fig. 4 Scanning electron micrograph of (a) Pd NPs-HNG and the corresponding quantitative EDS element mapping of (b) N and (c) Pd. Transmission electron micrographs of (d) NG and (e) Pd NPs-HNG. A uniform dispersion of Pd NPs on NG sheet is clearly visible. Fig. 5 Full-range XPS spectrum of Pd NPs-HNG nanocomposite after 6th run. Fig. 6 Transmission electron micrographs of Pd NPs-HNG nanocomposite after 6th run. Table 1 Screening of the Suzuki–Miyaura cross-coupling reaction conditions. a Entry Catalyst Base Solvent Yield (%) b 1 Pd NPs-HNG KOH EtOH:H2O (1:1) 38 2 Pd NPs-HNG K3PO4 EtOH:H2O (1:1) 51 3 Pd NPs-HNG K2CO3 EtOH:H2O (1:1) 98 4 Pd NPs-HNG i-Pr2EtN EtOH:H2O (1:1) 15 5 Pd NPs-HNG K2CO3 H2O 40 6 Pd NPs-HNG K2CO3 EtOH 59 7 Pd NPs-HNG K2CO3 MeOH 48 8 Pd NPs-NG K2CO3 EtOH:H2O (1:1) 81 9 Pd NPs-RGO K2CO3 EtOH:H2O (1:1) 59 10 Pd NPs-HNG - EtOH:H2O (1:1) Trace 11 HNG K2CO3 EtOH:H2O (1:1) Trace a 1-Iodo-4-methylbenzene (1.0mmol), phenyl boronic acid (1.3mmol), base (3.0mmol), catalyst (0.025mol% of Pd), 60°C, 2.5h and solvent (2mL). b GC yield, n-dodecane was used as an internal standard. Table 2 Pd NPs-HNG nanocomposite-catalyzed Suzuki–Miyaura cross-coupling reaction. a Entry R X R′ Yield (%) a TON/TOF(h−1) 1 H I H 98 3920/1568 2 4-Me I H 98 3920/1568 3 2-Me I H 85 3400/1360 4 1,3,5-Trimethyl I H 73 2920/1168 5 MeCO I H 98 3920/1568 6 H Br H 94 3760/1504 7 4-Me Br H 85 3400/1360 8 4-NO2 Br H 98 3920/1568 9 4-Me Br Me 98 3920/1568 10 c H Cl H 57 570/23.75 11 c 4-Me Cl H 69 690/28.75 12 c 4-MeCO Cl H 76 760/31.66 a Reaction conditions: aryl halide (1mmol), aryl boronic acid (1.3mmol), K2CO3 (3.0mmol), Pd NPs-HNG (0.025mol% of Pd), 60°C, 2.5h and EtOH:H2O (1:1) (2mL). b Isolated yield by thin-layer chromatography. c 1mmol TBAB, Pd NPs-HNG (0.1mol% of Pd), 90°C, and 24h. Table 3 Reusability of the Pd NPs-HNG nanocomposite in Suzuki–Miyaura cross-coupling of phenyl boronic acid with phenyl iodide. a Reaction cycle 1st 2nd 3rd 4th 5th Yield (%) b 98 98 98 96 95 a Phenyl iodide (1.0mmol), phenyl boronic acid (1.3mmol), K2CO3 (3.0mmol), Pd NP-HNG (0.025mol% of Pd), 60°C, 2.5h and EtOH:H2O (1:1) (2mL). b GC yield, n-dodecane was used as an internal standard. Table 4 Screening of the Ullmann homo-coupling reaction conditions. a Entry Catalyst Base Yield b 1 Pd NPs-HNG K2CO3 23 2 Pd NPs-HNG Cs2CO3 65 3 Pd NPs-HNG K3PO4 98 4 Pd NPs-HNG NaOAc 19 5 Pd NPs-HNG i-Pr2EtN 78 6 Pd NPs-HNG KOH 71 7 Pd NPs-NG K3PO4 69 8 Pd NPs-RGO K3PO4 38 9 Pd NPs-HNG – Trace 10 HNG K3PO4 Trace a Phenyl iodide (1.0mmol), base (3.0mmol), catalyst (0.25mol% of Pd), 100°C, 18h and water (2mL). b GC yield, n-dodecane was used as an internal standard. Table 5 Pd NPs-HNG nanocomposite-catalyzed Ullmann homocoupling. a Entry R X Pd NPs–HNG (mol%) Time (h) Yield b TON/TOF(h−1) 1 H I 0.25 18 98 392/21.77 2 4-OMe I 0.25 18 97 388/21.55 3 4-Me I 0.25 18 94 376/21.88 4 2-Me I 0.25 24 83 332/13.83 5 4-MeCO I 0.25 18 98 392/21.77 6 NO2 I 0.25 18 98 392/21.77 7 H Br 1 24 92 92/3.83 8 NO2 Br 1 18 98 98/5.44 9 4-Me Br 1.25 18 91 72.8/4.04 10 H Cl 2 36 90 45/1.25 11 4-Me Cl 2 36 87 43.5/1.21 12 4-MeCO Cl 2 36 92 46/1.27 a Reaction conditions: aryl halide, K3PO4 (3.0mmol), 100°C and H2O (2mL). b Isolated yield by thin-layer chromatography. Table 6 Reusability of the Pd NPs-HNG nanocomposite in Ullmann homo coupling of phenyl iodide. a Reaction cycle 1st 2nd 3rd 4th 5th Yield (%) b 98 97 93 87 84 a Phenyl iodide (1.0mmol), K3PO4 (3.0mmol), Pd NPs-HNG (0.25mol% of Pd), 100°C, 18h and H2O (2mL). b GC yield, n-dodecane was used as an internal standard. Palladium nanoparticle decorated high nitrogen-doped graphene with high catalytic activity for Suzuki–Miyaura and Ullmann-type coupling reactions in aqueous media Siyavash Kazemi Movahed Minoo Dabiri Ayoob Bazgir ⁎ Faculty of Chemistry, Shahid Beheshti University, G.C. Tehran 1983969411, Iran Faculty of Chemistry, Shahid Beheshti University G.C. Tehran 1983969411 Iran ⁎ Corresponding author. Tel.: +98 21 2990 3104; fax: +98 21 2243 1661. Graphical abstract Palladium nanoparticle are decorated over a highly nitrogen-doped graphene (Pd NPs-HNG) in a facile manner by reducing palladium chloride in the presence of ethylene glycol as reducing, stabilizing, and dispersing agent. The obtained catalyst can act as an efficient catalyst for the Suzuki–Miyaura and Ullmann-type coupling reactions of a broad spectrum of aryl halides in aqueous media. The remarkable reactivity of the Pd NPs-HNG nanocomposite toward Suzuki–Miyaura and Ullmann-type coupling reactions is attributed to the high degree of nitrogen loading in graphene sheets. The N-doped graphene as polycyclic heteroaromatic molecule acts as both the catalyst support and the electron source (reducing agent) for Ullmann homocoupling. The catalyst could be recovered and reused several times without a significant loss of activity. Keywords C–C coupling Heterogeneous catalysis N-doped graphene Palladium nanoparticle. 1 Introduction Aryl–aryl bond formation is one of the most important tools of modern organic synthesis. These bonds are very often found in commercial dyes, natural products, and organic conductors or semiconductors as well as the backbone of some ligands for asymmetric catalysis [1]. Various nanoparticle-based heterogeneous or semi-heterogeneous catalysts such as palladium nanoparticles in ionic liquids, polymers, organic–inorganic fluorinated hybrid materials, and glass–polymer composite materials as well as on common inorganic substrates, including carbon materials, silica, alumina, or zeolites have been described in literature for aryl–aryl coupling reactions, e.g., Suzuki–Miyaura, and Ullmann reactions [2–5]. Although, the heterogeneous supports allow efficient recycling, a decrease in the activity of the immobilized catalysts is frequently observed [6]. Therefore, the development of heterogeneous palladium nanocatalysts with high activity, stability, and recyclability is an important goal of nanomaterial research. This can have a considerable impact on the future of the chemical and pharmaceutical industries in the future. Graphene has stimulated wide interest because of the properties associated with the two-dimensional (2D) crystal structure formed by sp2-hybridized carbon. Extensive studies have shown great promise for applications in fields such as electronics, sensors, batteries, super capacitors, and catalysts [7–10]. Theoretical as well as experimental studies have revealed that a doped graphene can be used to tailor its band structure, modulate electronic properties, manipulate surface chemistry, and open the band gap in graphene for device applications. Among the numerous potential dopants, nitrogen is considered as an excellent element for the chemical doping because of its similar atom size and five valence electrons available to form strong valence bonds with carbon atoms. N-dopants in the carbon skeleton can weaken the formation of “re-graphitized” carbon regions and also be usually regarded as favorable anchor sites or defects for enhancing particle nucleation and reducing the particle size [11–14]. At the same time, it was disclosed that introduction of nitrogen can modify the electronic structure of the carbon matrix, strengthening the interaction between carbon and guest molecules [15,16]. This endow carbon with a metal-like “d” band electronic structure to host the reactive species due to its high charge and spin density caused by the adjacent nitrogen [17]. Based on the above introduction and also a part of our ongoing studies in the synthesis of graphene nanocomposite catalysts for cross- and homo-coupling reactions [18,19], herein, we report a novel protocol for the Suzuki–Miyaura and Ullmann-type coupling reaction by palladium nanoparticles-high N-doped graphene (Pd NPs-HNG) nanocomposite in aqueous solution under aerobic conditions. Additionally, the effects of solvent polarity, base, and temperature on yield, and recycling potential of the catalyst have all been assessed. 2 Experimental 2.1 Characterization All chemicals were purchased from commercial suppliers and all solvents were purified and dried using standard procedures. IR spectra were recorded on a Bomem MB-Series FT-IR spectrophotometer. Diffraction data were collected on a STOE STADI P with scintillation detector, secondary monochromator, and Cu Kα radiation (λ =1.5406Å). X-ray photoelectron spectroscopy (XPS) analysis was performed using a Gammadata-scienta ESCA 200 hemispherical analyzer equipped with an Al Kα (1486.6eV) X-ray source. Raman spectra of GO, HNG, and Pd NPs-HNG nanocomposite were recorded on a Bruker SENTERR (2009) with an excitation beam wavelength at 785nm. Scanning electron microscope images and EDX mapping of Pd NPs-HNG nanocomposite were obtained on a Philips XL-30 ESEM electron microscope. Transmission electron microscope images of HNG, Pd NPs-RGO, Pd NPs-NG, and Pd NPs-HNG nanocomposites were taken using Philips CM-30 transmission electron microscope with an accelerating voltage of 150kV and Zeiss EM10C transmission electron microscope with an accelerating voltage of 80kV. 1H NMR spectra were recorded on a BRUKERDRX-300 AVANCE spectrometer. NMR spectra were obtained in DMSO-d 6 using TMS as internal standard. Melting points of products were measured on an Elecrtothermal 9100 apparatus and are uncorrected. The concentration of palladium was estimated using Shimadzu AA-680 flame atomic absorption spectrophotometer and inductively coupled plasma optical emission spectrometer (ICP-OES) Varian Vista PRO Radial. Elemental analysis of HNG and NG nanocomposites were performed using an Elementar Analysen system GmbH VarioEL CHNS. Gas chromatography was performed on a Trace GC ultra from the Thermo Company equipped with FID detector and Rtx®-1 capillary column. 2.2 Preparation of graphene oxide (GO) The graphite powder (2.5g) was first treated with a mixture of 12.5mL of concentrated H2SO4 with 2.5g of K2S2O8 and 2.5g of P2O5. The mixture was kept at 80°C for 6h. Subsequently, the mixture was cooled to room temperature and diluted with 500mL of deionized (DI) water and left overnight. The mixture was then filtered and washed with DI water to remove the residual acid. The product was dried under ambient conditions overnight. The pre-oxidized graphite was then subjected to oxidation by Hummers's method. The pretreated graphite powder was put into cold (0°C) concentrated H2SO4 (125mL). Then KMnO4 (15g) was added gradually under stirring, and the temperature of the mixture was kept below 20°C by cooling. The mixture was then stirred at 35°C for 4h and then diluted with DI water (250mL). Because adding water to concentrated sulfuric acid medium releases a large amount of heat, the dilution was carried out in an ice bath to keep the temperature below 50°C. After adding all of the 250mL DI water, the mixture was stirred for 2h, and then an additional 750mL DI water was added. Shortly thereafter, 20mL of 30% H2O2 was added to the mixture and the color of the mixture changed into brilliant yellow and began bubbling. The mixture was filtered and washed with 0.1M HCl to remove metal ions, followed by 500mL DI water to remove the acid, and then was dialyzed against DI water. The resulting GO solid was dried in air [20,21]. 2.3 Preparation of high nitrogen-doped graphene (HNG) Aqueous dispersion solution of GO (10mL, 40mg) was diluted with 25mL of deionized water, and then urea (12g) was added into the GO dispersion under sonication for 3h. After that, the solution was sealed in a 50mL of Teflon-lined autoclave and maintained at 180°C for 12h. The solids (N-doped graphene sheets) were filtered and washed several times with distilled water. Finally, the sample was collected and dried in a vacuum oven at 80°C [22]. The nitrogen loading was determined to be 11.24wt% by elemental analysis (CHN). 2.4 Preparation of palladium nanoparticle-high nitrogen-doped graphene (Pd NPs-HNG) About 40mg of HNG was dispersed in 40mL of a mixture of ethylene glycol (EG) and deionized (DI) water (3:1) by ultrasonication for 1h and followed by stirring for 12h. Further, PdCl2 (7.3mg) was added under mechanically stirred conditions for 24h. The pH of the entire solution was adjusted to 11 by NaOH (2.5M), and the solution was refluxed at 110°C for 7h to ensure complete reduction of Pd. Finally, the suspension was filtered and the solid washed with deionized water repeatedly until filtrated solution became neutral and then dried in vacuum oven at 50°C [23]. The loading of palladium was measured to be 0.80mmolg−1 by inductively coupled plasma-optical emission spectrometry (ICP-OES). 2.5 Preparation of nitrogen-doped graphene (NG) The pH of aqueous dispersion of GO (70mL, 140mg) was adjusted at 10 using 30% ammonia. Then 2mL of hydrazine hydrate was added with the magnetically stirring for 10min. The solution was then transferred into a Teflon-lined autoclave and heated at 80°C for 3h. The reduced graphene sheets were collected with centrifugation, followed by washing several times with deionized water and then dried in vacuum oven at 50°C [24]. The nitrogen loading was determined to be 3.2wt% by elemental analysis (CHN). 2.6 Preparation of palladium nanoparticle-nitrogen-doped graphene (Pd NPs-NG) About 40mg of NG was dispersed in 40mL of a mixture of ethylene glycol (EG) and deionized water (3:1) by ultrasonication for 1h and followed by stirring for 12h. Further, PdCl2 (7.3mg) was added under mechanically stirred conditions for 24h. The pH of the entire solution was adjusted to 11 by NaOH (2.5M), and then the solution was refluxed at 110°C for 7h to ensure complete reduction of Pd. Finally, the suspension was filtered and the solid washed with deionized water repeatedly until filtrated solution became neutral and then dried in vacuum oven at 50°C. The loading of palladium was measured to be 0.74mmolg−1 by inductively coupled plasma-optical emission spectrometry (ICP-OES). 2.7 Preparation of reduced graphene oxide (RGO) GO (0.6g) was dispersed in 100mL of deionized water. Then, NaBH4 (1.0g) was gradually added and the mixture was heated at 100°C for 24h. The resulted precipitation was centrifuged, repeatedly washed with deionized water and ethanol. The final product was dried in vacuum oven at 80°C overnight [25]. 2.8 Preparation of palladium nanoparticle-reduced graphene oxide (Pd NPs-RGO) About 40mg of RGO was dispersed in 40mL of a mixture of ethylene glycol (EG) and deionized water (3:1) by ultrasonication for 1h and followed by stirring for 12h. Further, the PdCl2 (7.3mg) was added under mechanically stirred conditions for 24h. The pH of the entire solution was adjusted to 11 by NaOH (2.5M), and the solution was refluxed at 110°C for 7h to ensure complete reduction of Pd. Finally, the suspension was filtered and the solid washed with deionized water repeatedly until filtrated solution became neutral and then dried in vacuum oven at 50°C. The loading of palladium was measured to be 0.69mmolg−1 by inductively coupled plasma-optical emission spectrometry (ICP-OES). 2.9 General procedure for the Suzuki–Miyaura cross-coupling reaction A mixture of Pd NPs-HNG nanocomposite (0.025–0.1mol% of Pd), K2CO3 (3mmol), aryl halide (1.0mmol), aryl boronic acid (1.3mmol), and EtOH/H2O (2mL, 1:1) was stirred in air at 60°C. After completion of the reaction as indicated by TLC, the heterogeneous mixture was cooled to room temperature and filtered through a pad of celite. The filtrate was concentrated and then the residue was purified by thin-layer chromatography (ethyl acetate and n-hexane) to yield a pure product. The catalyst was recovered by filtration and washed extensively with acetone and drying in the air. 2.10 General procedure for the Ullmann homo-coupling reaction A mixture of Pd NPs-HNG nanocomposite (0.25–2mol% of Pd), K3PO4 (3mmol), aryl halide (1.0mmol), and 2mL of H2O was stirred in air at 100°C. After completion of the reaction as indicated by TLC, the heterogeneous mixture was cooled to room temperature and filtered through a pad of celite. The filtrate was concentrated and then the residue was purified by thin-layer chromatography (ethyl acetate and n-hexane) to yield a pure product. The catalyst was recovered by filtration and washed extensively with acetone and drying in the air. 3 Results and discussion 3.1 Synthesis and characterization of catalyst The process for the preparation of Pd NPs-HNG nanocomposite is schematically described in Scheme 1 . The N-doped graphene with high nitrogen content (11.24wt% of N) were synthesized through a one-pot hydrothermal process using urea as the chemical dopant in the presence of graphene oxide (GO) aqueous dispersion [22]. Then, the decoration of Pd NPs was carried out on HNG by a modified polyol reduction technique [23]. Raman spectroscopy is a very useful tool for investigating the electronic and phonon structure graphene-based materials [26]. The Raman spectra of prepared GO, HNG, and Pd NPs-HNG are shown in Fig. 1 . The characteristic D and G bands of carbon materials are observed around 1285 and 1570cm−1, respectively. The D band is characteristic of a breathing mode for k-point phonons of A1g, while the G band is the result of the first-order scattering of the E2g mode of sp2 carbon domains [27]. Both bands can be influenced by doping [28]. The D band is significantly enhanced in HNG with respect to GO because pyridinic and pyrrolic nitrogens are accompanied by defects inside the graphene network and functional edges of graphene sheets [29,30]. The G band of HNG shifts to the higher frequency (8.77cm−1) with respect to that of graphene oxide. Previous theoretical simulations on N-doped carbon nanotubes suggest that substitution of carbon atoms with graphitic nitrogen was n-type doping, while pyridinic and pyrrolic nitrogens were of p-type doping [31,33]. Because HNG contains more pyridinic and pyrrolic nitrogens, G band shift in HNG is in agreement with the earlier observation upshift in p-type doped graphite and carbon nanotubes [34,35]. In addition, a small shoulder appears for the Pd NPs-HNG at the higher wavenumbers along with the G-band. This is known as the D’ band. The origin of this band is attributed to the interaction of localized vibration modes of impurities (or dopants) with the extended phonon modes of graphene being responsible for the G-band [23]. After conjugation of the Pd NPs onto the HNG sheets, the G-band is observed to shift further toward higher wavenumbers (3.95cm−1). The intensity ratio of G-band and D-band (ID/IG) is a general parameter, reflecting the carbon hybridization state of materials and the degree of disorder [36]. As shown, after the hydrothermal synthesis of GO with urea, the ID/IG was 1.58 for the resulting HNG, while the ID/IG of GO was 1.49. The higher value of ID/IG observed with HNG clearly demonstrates the heteroatomic doping of nitrogen into the graphene frame and the enhanced degree of disorder [36]. The ID/IG decreases to 1.35 for the Pd NPs-HNG, possibly as a result of the Pd NPs growth at the defective regions on the HNG surface [37]. Nitrogen doping of graphene can help in enhancing the palladium binding to the defected sites on the adsorbent, thereby lowering the possibility of metal−metal cohesion [23]. X-ray diffraction (XRD) patterns of GO, HNG, and Pd NPs-HNG are illustrated in Fig. 2 . The GO peak at 2θ =10.9° corresponds to a d-spacing of 0.81nm resulting from the insertion of hydroxyl and epoxy groups between the graphite sheets as a result of the oxidation process of graphite [38]. However, the peak at 2θ =10.9° entirely collapsed after hydrothermal reaction, and a broad diffraction peak around 25° of the graphite (002) plane was observed for the synthesized HNG sample, indicating the framework of the reduced sample was composed of few-layer stacked graphene sheets [39]. Besides, the interlayer distance was reduced from 0.81nm of GO to 0.35nm of HNG, which certified the recovery of the π-conjugated system after the reduction of GO [19]. In the XRD pattern of the Pd NPs-HNG, the peaks at around 2θ =39.75°, 46.18°, 67.62° can be assigned to the (111), (200), (220) crystalline planes of the face center cubic (fcc) structure of palladium (JCPDS No. 87-0643), respectively. Also, an additional broad diffraction peak appears at 2θ =25° which can be indexed to the disordered HNG sheets. The electronic property of Pd NPs–HNG nanocomposite was probed by X-ray photoelectron spectroscopy (XPS) analysis. As shown in Fig. 3a, the peaks corresponding to C 1s, N 1s, O 1s, and Pd 3 s, 3p and 3d was clearly observed in the XPS survey spectrum. The C 1s peak of Pd NPs-HNG is shown in Fig. 3b. The main peak at 284.31eV is associated with the C–C, implying that most of the carbon atoms in the Pd NPs-HNG are arranged in a conjugated honeycomb lattice [22]. Additionally, the other two peaks located at 285.35 and 287.87eV are ascribed to C=N and C–N, respectively. From the N 1s XPS scan shown in Fig. 3c, it is observed that three different types of nitrogen are present in the Pd NPs-HNG system, namely pyridinic nitrogen (397.02eV, 5.01%), pyrrolic nitrogen (399.10eV, 71.21%), and graphitic nitrogen (401.14eV, 23.78%) [22]. The pyridinic and pyrrolic nitrogen atoms are present in abundance as compared to the graphitic nitrogen and donate one and two p-electrons to the graphene sheet, respectively [22]. From XPS analysis, it is observed that the content of pyrrolic nitrogen is more in the Pd NPs-HNG nanocomposite. The Pd0 3d5/2 and 3d3/2 peaks are observed at 335.48 and 340.83eV, respectively (Fig. 3d). Palladium in the oxidation state of II is also detected (peaks at 337.58 and 342.99eV). The absence of chlorine in the XPS spectrum of the Pd NPs–HNG nanocomposite corroborates that this higher oxidation state of Pd is due to the formation of Pd−O bond or Pd−N bond [40] not that of PdCl2. The high-resolution scan from 528 to 540eV reveals the presence of O 1s (531.87eV), Pd 3p3/2 (533.83eV), and Pd-O or Pd-N 3p3/2 (536.42eV) peaks in the order of their percentage contribution (Fig. 3e) [23]. Fig. 4a depicts the SEM micrograph of the Pd NPs-HNG sample. Several graphene layers and folds in their planes are visible. The density and distribution of elements the N and Pd on the Pd NPs-HNG nanocomposite are evaluated by quantitative energy-dispersive X-ray spectroscope (EDS) mapping. As it can be seen in Fig. 4b and c, Pd only located at the edges of N-doped graphene sheets, and N and Pd elements are uniformly dispersed on the entire surface of Pd NPs-HNG nanocomposite. Fig. 4d and e shows a comparison between the morphologies of NG and Pd NPs-HNG, as investigated by TEM. The micrograph of HNG possesses similar wrinkled sheet morphology (Fig. 4d). As Fig. 4e shows, the surfaces of HNG are covered with good dispersion of Pd NPs with an average size of ∼15nm. The TEM micrographs of Pd NPs-RGO and Pd NPs-NG (Fig. S1a–c and d–f) show large size (∼50nm) and small size (∼5nm) palladium, respectively. The TEM micrographs also show agglomerate Pd particles supported on the reduced graphene oxide, and nitrogen-doped graphene sheets. A comparison between Fig. S1 and Fig. 4d revealed that dispersion of NPs is excellent in the high nitrogen-doped graphene. Some of the agglomeration of Pd NPs in Pd NPs-HNG nanocomposite may be due to the incorporation, which affects the nucleation of Pd NP [41]. This is attributed to the fact that the N-doping creates a defective topology in the graphene network, which then act as nucleation sites for the Pd particle to get attached during the modified polyol synthesis method [23]. Additionally, Pd NPs are not found outside the NG sheets. 4 The catalytic activity of Pd NPs–HNG nanocomposite toward the Suzuki–Miyaura cross-coupling reaction The catalytic activity of the Pd NPs-HNG nanocomposite was then tested in the Suzuki–Miyaura cross-coupling reaction. We chose the coupling between 1-iodo-4-methylbenzene and phenyl boronic acid as a model reaction in EtOH:H2O (1:1) as solvent at 60°C in the presence of KOH as base and with a catalyst loading of 0.025mol% of Pd. Under this condition, we found that the cross-coupling reaction proceeded well, affording the promising moderate yields (38%) of the corresponding biaryl (Table 1 , entry 1). Various bases such as K3PO4, Cs2CO3, and K2CO3 were also screened for their effect on the reaction in EtOH:H2O (1:1) as solvent at 60°C. A superior yield obtained when K2CO3 was used as the base (Table 1, entries 1–4). Then, different solvents were screened in the model reaction using K2CO3 as the base (Table 1, entries 5–7). It was found that the reaction using EtOH:H2O (1:1) after 2.5h resulted in a higher yield. Additionally, in order to investigate the effect of the nitrogen loading, we used Pd NPs-NG and Pd NPs-RGO in the model reaction. The observed yields of biaryl in both cases were remarkably inferior (Table 1, entries 8 and 9). It is well known that the activity of Pd-supported catalysts depends dramatically on the metal dispersion and the particle size. In particular, C–C bond coupling reactions such as Suzuki reaction are very demanding from the point of view of palladium particle size [42]. Probably for this reason, the activity of Pd NPs supported on NG and HNG sheets are higher than that of Pd NPs supported on RGO. Additionally, an increase in the nitrogen loading in graphene sheet leads to an increase in the biphenyl yield. Probably, the nitrogen atoms in the graphene sheets can act as a ligand for Pd NPs. Notably, base-free reaction and the reaction using the pristine HNG without any Pd NPs gave no conversion in the present system under the same reaction conditions (Table 1, entries 10 and 11). With the optimized reaction conditions in hand, we next managed to examine the scope and limitation of Suzuki reaction with various types of aryl halides derivatives and aryl boronic acids (Table 2 ). It can be seen from Table 2 that the Suzuki–Miyaura cross-coupling reaction with most substrates preceded in good yields. Aryl bromides and iodides bearing electron-donating and electron-withdrawing groups reacted well and giving good yields. The hindered substrates such as 2-iodotoluene and 2-iodo-1,3,5-trimethylbenzene converted into the corresponding products with a moderate yield (Table 2, entries 3 and 4). Unfortunately, the catalytic system was less effective for the reaction of aryl chlorides and moderate yields were obtained in the presence of tetra butyl ammonium bromide (TBAB) (Table 2, entries 10–12). 4.1 Reusability of Pd NPs-HNG in Suzuki–Miyaura cross-coupling reaction The reusability of the Pd NPs-HNG nanocomposite was examined in the Suzuki–Miyaura cross-coupling reaction of phenyl boronic acid with phenyl iodide. It was found that the recovery can be successfully achieved in five successive reaction runs (Table 3 ). The heterogeneous nature of the catalysis was proved using a hot filtration test and atomic absorption spectroscopy (AAS) analysis. To determine whether the catalyst is actually functioning in a heterogeneous manner or whether it is merely a reservoir for more active soluble palladium species, we performed a hot filtration test in the Suzuki cross-coupling reaction of phenyl boronic acid with phenyl iodide after ∼50% of the coupling reaction is completed. The hot filtrates were then transferred to another flask containing K2CO3 (3equiv.) in EtOH:H2O (1:1) (2mL) at 60°C. Upon further heating of catalyst-free solution for 4h, no considerable progress (∼4% by GC analysis) was observed. Moreover, using AAS of the same reaction solution at the midpoint of completion indicated that no significant quantities of palladium are lost to the reaction liquors during the process. 5 The catalytic activity of Pd NPs-HNG nanocomposite toward the Ullmann homo-coupling reaction Finally, diverse symmetrical biphenyls were synthesized in high yields via reductive homo-couplings of aryl halides using Pd NPs-HNG nanocomposite without any external reductant. To optimize the reaction conditions, iodobenzene was selected as a model substrate in the presence of various bases (Table 4 , entries 1-6). By using water as the solvent at 100°C with a catalyst loading of 0.25mol% of Pd, a superior yield was obtained when K3PO4 was used as the base (Table 4, entry 3). Additionally, the Pd NPs-NG and Pd NPs-RGO were tested in the model reaction and yields of biphenyl in both cases were remarkably lower (Table 4, entries 7 and 8). The base-free reaction and the reaction using the pristine HNG without any Pd NPs gave no conversion in the present system under the same reaction conditions (entries 9–10). Notably, the side products benzene or phenol did not form in all of experiments, which results from dehalogenation or hydrodehalogenation of Ph–I, respectively. The hydrodehalogenation product obtained from the complete quenching of the reaction due to the lower stability of Pd NPs [43]. Further investigations of the efficiency and scope of the method were performed, and the results are summarized in Table 5 . The Pd NPs-HNG was proved to be a very active catalyst for the homo-coupling of a broad spectrum of aryl halides. As illustrated in Table 5, both electron-donating (Table 5, entries 2 and 3) and electron-withdrawing (Table 5, entries 4 and 5) aryl iodides were coupled cleanly to provide the corresponding biaryls in good to excellent yields. Aryl iodide with meta-substituent delivered the corresponding biaryl in good yield (Table 5, entry 4), showing that the steric hindrance played little effect in the formation of intermediate aryl-palladium complexes [44]. In the case of aryl bromides and chlorides, good to excellent biaryl yields were obtained after the prolongation of reaction times and the increase in the amount of palladium to 2mol% (Table 5, entries 7-13). It should be noted that the desired biaryls were delivered in good yields in the Pd NPs-HNG catalytic system without the reduction of nitro or carbonyl groups (Table 2, entries 4-5, 8, and 12-13). The by-products from hydrodechlorination of the chloroarenes with electron-withdrawing groups in homo-coupling reaction were also obtained in some cases [45]. Notably, it was proved that Pd NPs-HNG exhibited excellent catalytic activity and selectivity for the Ullmann homo-coupling of these substrates, and no hydrodechlorination products were observed under the investigated conditions (Table 5, entries 10-13). The external reducing agents such as ethanol [46], formate salts [47], glucose [48], hydrogen gas [49], or zinc [50] are used for Ullmann homo-coupling. Recently, Karimi et al. reported Pd@IFMC as a catalyst for Ullmann homo-coupling reaction without any chemical and stoichiometric co-reducing agents [51]. We believed N-doped graphene as polycyclic heteroaromatic molecule acts as both the catalyst support and the electron source (reducing agent). This feature is demonstrated previously for polyaniline nanofiber [52]. Although, an increase in the nitrogen loading in graphene sheet leads to an increase biphenyl yield that an indicated nitrogen-bonding configuration in graphene sheets plays the key role in the Ullmann homo-coupling. 5.1 Reusability of Pd NPs-HNG nanocomposite in Ullmann homo-coupling reaction The reusability of the Pd NPs-HNG nanocomposite was examined in the Ullmann homo-coupling reaction of phenyl iodide. It was found that the recovery can be successfully achieved in five successive reaction runs (Table 6 ). XPS analysis of Pd NPs-HNG nanocomposite after the 6th run revealed the presence high concentration of K and P, which may suggest that some base remains attached to the surface of the solid (Fig. 5 ). This observation may be due to the adsorption of residual K3PO4 to the HNG surface, which avoided the need of further addition in the subsequent experiments. The TEM micrographs of Pd NPs-HNG recycled after 6th run shows the surfaces of HNG are covered with good dispersion of Pd NPs with an average size of ∼12nm (Fig. 6 ). 6 Conclusion In conclusion, we demonstrated that palladium nanoparticles supported on high nitrogen-doped graphene are a highly active catalyst for Suzuki–Miyaura cross-coupling of a range of aryl halides. Moreover, we have shown this nanocomposite as competent catalysts for the Ullmann homo-couplings of different aryl halides to afford symmetrical biaryls in excellent yields without any chemical and stoichiometric co-reducing agents. It was found that when the loading the nitrogen increases from 0% to 3.2 and 11.2wt%, the biphenyl yields increase from 38 to 69% and 98%, respectively, that an indicated nitrogen-bonding configuration in graphene sheets plays the key role in the Ullmann homo-coupling. We believed N-doped graphene as polycyclic heteroaromatic molecule acts as both the catalyst support and the electron source (reducing agent) for Ullmann homocoupling. Leaching tests such as hot filtration test and AAS analysis indicate that the catalytic reaction is mainly heterogeneous in nature. The reusability of this catalyst is high, and the catalyst can be reused several times without a significant decrease in its catalytic activity. Acknowledgement We gratefully acknowledge the financial support from the Research Council of Shahid Beheshti University. Appendix A Supplementary data Supplementary data associated with this article can be found, in the online version, at http://dx.doi.org/10.1016/j.apcata.2014.09.045. Appendix A Supplementary data References [1] J. Hassan M. Sevignon C. Gozzi E. Schulz M. Lemaire Chem. Rev. 102 2002 1359 [2] G.M. Scheuermann L. Rumi P. Steurer W. Bannwarth R. Mulhaupt J. Am. Chem. Soc. 131 2009 8262 (and ref. therein) [3] L. Djakovich K. Köhler J.G. de Vries D. Astruc The Role of Palladium Nanoparticles as Catalysts for Carbon-Carbon Coupling Reactions in Nanoparticles and Catalysis 1st ed. 2008 Wiley-VCH Weinheim, Germany 303 348 [4] R. Nie J. Shi W. Du Z. Hou Appl. Catal. A: Gen. 473 2014 1 6 [5] R. Nie J. Wang L. Wang Y. Qin P. Chen Z. Hou Carbon 50 2012 586 596 [6] A.R. Siamaki A.E.R.S. Khder V. Abdelsayed M.S. El-Shall B.F. Gupton J. Catal. 279 2011 1 [7] Y. Zhu S. Murali W. Cai X. Li J.W. Suk J.R. Potts R.S. Ruoff Adv. Mater. 22 2010 3906 [8] X. Huang X. Qi F. Boey H. Zhang Chem. Soc. Rev. 41 2012 666 [9] X. Huang Z. Yin S. Wu X. Qi Q. He Q. Zhang Q. Yan F. Boey H. Zhang Small 7 2011 1876 [10] B.F. Machado P. Serp Catal. Sci. Technol. 2 2012 54 [11] R. Nie J. Shi W. Du W. Ning Z. Hou F.-S. Xiao J. Mater. Chem. A 1 2013 9037 [12] Y. Liang Y. Li H. Wang J. Zhou J. Wang T. Regier H. Dai Nat. Mater. 10 2011 780 [13] H. Wang T. Maiyalagan X. Wang ACS Catal. 2 2012 781 [14] D. Usachov O. Vilkov A. Gruneis D. Haberer A. Fedorov V.K. Adamchuk A.B. Preobrajenski P. Dudin A. Barinov M. Oehzelt C. Laubschat D.V. Vyalikh Nano Lett. 11 2011 5401 [15] K. Gong F. Du Z. Xia M. Durstock L. Dai Science 323 2009 760 [16] K. Gopalakrishnan H.M. Joshi P. Kumar L.S. Panchakarla C.N.R. Rao Chem. Phys. Lett. 511 2011 304 [17] Y. Gao G. Hu J. Zhong Z. Shi Y. Zhu D.S. Su J. Wang X. Bao D. Ma Angew. Chem. Int. Ed. 52 2013 2109 [18] S.K. Movahed M. Fakharian M. Dabiri A. Bazgir RSC Adv. 4 2014 5243 [19] S.K. Movahed R. Esmatpoursalmani A. Bazgir RSC Adv. 4 2014 14586 [20] W.S. Hummers R.E. Offeman J. Am. Chem. Soc. 80 1958 1339 [21] N.I. Kovtyukhova P.J. Olliver B.R. Martin T.E. Mallouk S.A. Chizhik E.V. Buzaneva A.D. Gorchinsky Chem. Mater. 11 1999 771 [22] L. Sun L. Wang C. Tian T. Tan Y. Xie K. Shi M. Li H. Fu RSC Adv. 2 2012 4498 [23] V.B. Parambhath R. Nagar S. Ramaprabhu Langmuir 28 2012 7826 [24] D. Long W. Li L. Ling J. Miyawaki I. Mochida S.-H. Yoon Langmuir 26 2010 16096 [25] Z. Xiong L.L. Zhang J. Ma X.S. Zhao Chem. Commun. 46 2010 6099 [26] A. Jorio M.S. Dresselhaus R. Saito G.F. Dresselhaus Raman Spectroscopy in Graphene Related Systems 2011 Wiley-VCH Berlin [27] X. Fu F. Bei X. Wang S. O’Brien J.R. Lombardi Nanoscale 2 2010 1461 [28] D. Deng X. Pan L. Yu Y. Cui Y. Jiang J. Qi W.-X. Li Q. Fu X. Ma Q. Xue G. Sun X. Bao Chem. Mater. 23 2011 1188 [29] M.J. Allen V.C. Tung R.B. Kaner Chem. Rev. 110 2010 132 [30] Y.T. Lee N.S. Kim S.Y. Bae J. Park S.C. Yu H. Ryu H.J. Lee J. Phys. Chem. B 107 2003 12958 [31] H.S. Kang S. Jeong Phys. Rev. B 70 2004 233411 [33] C.P. Ewels M.J. Glerup Nanosci. Nanotech. 5 2005 1345 [34] M.S. Dresselhaus G. Dresselhaus R. Saito A. Jorio Phys. Rep. 409 2005 47 [35] M.S. Dresselhaus G. Dresselhaus Adv. Phys. 51 2002 1 [36] Z.-Y. Yang Y.-X. Zhang L. Jing Y.-F. Zhao Y.-M. Yan K.-N. Sun J. Mater. Chem. A 2 2014 2623 [37] S.G. Leonardi D. Aloisio N. Donato P.A. Russo M.C. Ferro N. Pinna G. Neri ChemElectroChem 1 2014 617 [38] C.-W. Tsai M.-H. Tu C.-J. Chen T.-F. Hung R.-S. Liu W.-R. Liu M.-Y. Lo Y.-M. Peng L. Zhang J. Zhang D.-S. Shyd X.-K. Xing RSC Adv. 1 2011 1349 [39] D.H. Long W. Li L.C. Ling J. Miyawaki I. Mochida S.H. Yoon Langmuir 26 2010 16096 [40] M. Hasik A. Bernasik A. Drelinkiewicz K. Kowalski E. Wenda J. Camra Surf. Sci. 507–510 2002 916 [41] Y. Zhou K. Neyerlin T.S. Olson S. Pylypenko J. Bult H.N. Dinh T. Gennett Z. Shao R. O’Hayre Energy Environ. Sci. 3 2010 1437 [42] Y. Li X. Fan J. Qi J. Ji S. Wang G. Zhang F. Zhang Nano Res. 3 2010 429 (and ref. therein) [43] A. Kamal V. Srinivasulu B.N. Seshadri N. Markandeya A. Alarifi N. Shankaraiah Green Chem. 14 2012 2513 [44] L. Wang Y. Zhang L. Liu Y. Wang J. Org. Chem. 71 2006 1284 [45] R.N. Dhital C. Kamonsatikul E. Somsook K. Bobuatong M. Ehara S. Karanjit H. Sakurai J. Am. Chem. Soc. 134 2012 20250 [46] L. Shaoa Y. Du M. Zeng X. Li W. Shen S. Zuo Y. Lu X.-M. Zhang C. Qi Appl. Organometal. Chem. 24 2010 421 [47] S. Mukhopadhyay G. Rothenberg N. Qafisheh Y. Sasson Tetrahedron Lett. 42 2001 6117 [48] A. Monopoli V. Calò F. Ciminale P. Cotugno C. Angelici N. Cioffi A. Nacci J. Org. Chem. 75 2010 3908 [49] S. Mukhopadhyay G. Rothenberg H. Wiener Y. Sasson Tetrahedron 55 1999 14763 [50] S. Mukhopadhyay G. Rothenberg D. Gitis Y. Sasson Org. Lett. 2 2000 211 [51] B. Karimi H. Behzadnia H. Vali ChemCatChem 6 2014 745 [52] B.J. Gallon R.W. Kojima R.B. Kaner P.L. Diaconescu Angew. Chem. Int. Ed. 46 2007 7251",
      "scopus-id": "84928941974",
      "coredata": {
        "eid": "1-s2.0-S0926860X14006073",
        "dc:description": "Palladium nanoparticle are decorated over a highly nitrogen-doped graphene (Pd NPs-HNG) in a facile manner by reducing palladium chloride in the presence of ethylene glycol as reducing, stabilizing, and dispersing agent. The obtained catalyst can act as an efficient catalyst for the Suzuki–Miyaura and Ullmann-type coupling reactions of a broad spectrum of aryl halides in aqueous media. The remarkable reactivity of the Pd NPs-HNG nanocomposite toward Suzuki–Miyaura and Ullmann-type coupling reactions is attributed to the high degree of nitrogen loading in graphene sheets. The N-doped graphene as polycyclic heteroaromatic molecule acts as both the catalyst support and the electron source (reducing agent) for Ullmann homocoupling. The catalyst could be recovered and reused several times without a significant loss of activity.",
        "openArchiveArticle": "false",
        "prism:coverDate": "2014-11-30",
        "openaccessUserLicense": null,
        "prism:aggregationType": "Journal",
        "prism:url": "https://api.elsevier.com/content/article/pii/S0926860X14006073",
        "dc:creator": [
          {
            "@_fa": "true",
            "$": "Movahed, Siyavash Kazemi"
          },
          {
            "@_fa": "true",
            "$": "Dabiri, Minoo"
          },
          {
            "@_fa": "true",
            "$": "Bazgir, Ayoob"
          }
        ],
        "link": [
          {
            "@_fa": "true",
            "@rel": "self",
            "@href": "https://api.elsevier.com/content/article/pii/S0926860X14006073"
          },
          {
            "@_fa": "true",
            "@rel": "scidir",
            "@href": "https://www.sciencedirect.com/science/article/pii/S0926860X14006073"
          }
        ],
        "dc:format": "application/json",
        "openaccessType": null,
        "pii": "S0926-860X(14)00607-3",
        "prism:volume": "488",
        "prism:publisher": "Elsevier B.V.",
        "dc:title": "Palladium nanoparticle decorated high nitrogen-doped graphene with high catalytic activity for Suzuki–Miyaura and Ullmann-type coupling reactions in aqueous media",
        "prism:copyright": "Copyright © 2014 Elsevier B.V. All rights reserved.",
        "openaccess": "0",
        "prism:issn": "0926860X",
        "dcterms:subject": [
          {
            "@_fa": "true",
            "$": "C–C coupling"
          },
          {
            "@_fa": "true",
            "$": "Heterogeneous catalysis"
          },
          {
            "@_fa": "true",
            "$": "N-doped graphene"
          },
          {
            "@_fa": "true",
            "$": "Palladium nanoparticle."
          }
        ],
        "openaccessArticle": "false",
        "prism:publicationName": "Applied Catalysis A: General",
        "openaccessSponsorType": null,
        "prism:pageRange": "265-274",
        "prism:endingPage": "274",
        "pubType": "fla",
        "prism:coverDisplayDate": "November 2014",
        "prism:doi": "10.1016/j.apcata.2014.09.045",
        "prism:startingPage": "265",
        "dc:identifier": "doi:10.1016/j.apcata.2014.09.045",
        "openaccessSponsorName": null
      },
      "objects": {
        "object": [
          {
            "@category": "high",
            "@height": "1397",
            "@width": "3235",
            "@_fa": "true",
            "$": "https://api.elsevier.com/content/object/eid/1-s2.0-S0926860X14006073-sc1_lrg.jpg?httpAccept=%2A%2F%2A",
            "@multimediatype": "JPEG image file",
            "@type": "IMAGE-HIGH-RES",
            "@size": "464717",
            "@ref": "sc1",
            "@mimetype": "image/jpeg"
          },
          {
            "@category": "high",
            "@height": "495",
            "@width": "1997",
            "@_fa": "true",
            "$": "https://api.elsevier.com/content/object/eid/1-s2.0-S0926860X14006073-gr6_lrg.jpg?httpAccept=%2A%2F%2A",
            "@multimediatype": "JPEG image file",
            "@type": "IMAGE-HIGH-RES",
            "@size": "215502",
            "@ref": "gr6",
            "@mimetype": "image/jpeg"
          },
          {
            "@category": "high",
            "@height": "1527",
            "@width": "2333",
            "@_fa": "true",
            "$": "https://api.elsevier.com/content/object/eid/1-s2.0-S0926860X14006073-gr5_lrg.jpg?httpAccept=%2A%2F%2A",
            "@multimediatype": "JPEG image file",
            "@type": "IMAGE-HIGH-RES",
            "@size": "285416",
            "@ref": "gr5",
            "@mimetype": "image/jpeg"
          },
          {
            "@category": "high",
            "@height": "1969",
            "@width": "1350",
            "@_fa": "true",
            "$": "https://api.elsevier.com/content/object/eid/1-s2.0-S0926860X14006073-gr4_lrg.jpg?httpAccept=%2A%2F%2A",
            "@multimediatype": "JPEG image file",
            "@type": "IMAGE-HIGH-RES",
            "@size": "504384",
            "@ref": "gr4",
            "@mimetype": "image/jpeg"
          },
          {
            "@category": "high",
            "@height": "3132",
            "@width": "3333",
            "@_fa": "true",
            "$": "https://api.elsevier.com/content/object/eid/1-s2.0-S0926860X14006073-gr3_lrg.jpg?httpAccept=%2A%2F%2A",
            "@multimediatype": "JPEG image file",
            "@type": "IMAGE-HIGH-RES",
            "@size": "1026273",
            "@ref": "gr3",
            "@mimetype": "image/jpeg"
          },
          {
            "@category": "high",
            "@height": "1012",
            "@width": "2500",
            "@_fa": "true",
            "$": "https://api.elsevier.com/content/object/eid/1-s2.0-S0926860X14006073-gr2_lrg.jpg?httpAccept=%2A%2F%2A",
            "@multimediatype": "JPEG image file",
            "@type": "IMAGE-HIGH-RES",
            "@size": "174721",
            "@ref": "gr2",
            "@mimetype": "image/jpeg"
          },
          {
            "@category": "high",
            "@height": "1595",
            "@width": "1667",
            "@_fa": "true",
            "$": "https://api.elsevier.com/content/object/eid/1-s2.0-S0926860X14006073-gr1_lrg.jpg?httpAccept=%2A%2F%2A",
            "@multimediatype": "JPEG image file",
            "@type": "IMAGE-HIGH-RES",
            "@size": "186356",
            "@ref": "gr1",
            "@mimetype": "image/jpeg"
          },
          {
            "@category": "high",
            "@height": "268",
            "@width": "1477",
            "@_fa": "true",
            "$": "https://api.elsevier.com/content/object/eid/1-s2.0-S0926860X14006073-fx5_lrg.jpg?httpAccept=%2A%2F%2A",
            "@multimediatype": "JPEG image file",
            "@type": "IMAGE-HIGH-RES",
            "@size": "28437",
            "@ref": "fx5",
            "@mimetype": "image/jpeg"
          },
          {
            "@category": "high",
            "@height": "382",
            "@width": "1195",
            "@_fa": "true",
            "$": "https://api.elsevier.com/content/object/eid/1-s2.0-S0926860X14006073-fx4_lrg.jpg?httpAccept=%2A%2F%2A",
            "@multimediatype": "JPEG image file",
            "@type": "IMAGE-HIGH-RES",
            "@size": "30375",
            "@ref": "fx4",
            "@mimetype": "image/jpeg"
          },
          {
            "@category": "high",
            "@height": "261",
            "@width": "1994",
            "@_fa": "true",
            "$": "https://api.elsevier.com/content/object/eid/1-s2.0-S0926860X14006073-fx3_lrg.jpg?httpAccept=%2A%2F%2A",
            "@multimediatype": "JPEG image file",
            "@type": "IMAGE-HIGH-RES",
            "@size": "42155",
            "@ref": "fx3",
            "@mimetype": "image/jpeg"
          },
          {
            "@category": "high",
            "@height": "358",
            "@width": "1918",
            "@_fa": "true",
            "$": "https://api.elsevier.com/content/object/eid/1-s2.0-S0926860X14006073-fx2_lrg.jpg?httpAccept=%2A%2F%2A",
            "@multimediatype": "JPEG image file",
            "@type": "IMAGE-HIGH-RES",
            "@size": "45730",
            "@ref": "fx2",
            "@mimetype": "image/jpeg"
          },
          {
            "@category": "high",
            "@height": "886",
            "@width": "1194",
            "@_fa": "true",
            "$": "https://api.elsevier.com/content/object/eid/1-s2.0-S0926860X14006073-fx1_lrg.jpg?httpAccept=%2A%2F%2A",
            "@multimediatype": "JPEG image file",
            "@type": "IMAGE-HIGH-RES",
            "@size": "168911",
            "@ref": "fx1",
            "@mimetype": "image/jpeg"
          },
          {
            "@category": "standard",
            "@height": "316",
            "@width": "731",
            "@_fa": "true",
            "$": "https://api.elsevier.com/content/object/eid/1-s2.0-S0926860X14006073-sc1.jpg?httpAccept=%2A%2F%2A",
            "@multimediatype": "JPEG image file",
            "@type": "IMAGE-DOWNSAMPLED",
            "@size": "58072",
            "@ref": "sc1",
            "@mimetype": "image/jpeg"
          },
          {
            "@category": "standard",
            "@height": "186",
            "@width": "752",
            "@_fa": "true",
            "$": "https://api.elsevier.com/content/object/eid/1-s2.0-S0926860X14006073-gr6.jpg?httpAccept=%2A%2F%2A",
            "@multimediatype": "JPEG image file",
            "@type": "IMAGE-DOWNSAMPLED",
            "@size": "42218",
            "@ref": "gr6",
            "@mimetype": "image/jpeg"
          },
          {
            "@category": "standard",
            "@height": "345",
            "@width": "527",
            "@_fa": "true",
            "$": "https://api.elsevier.com/content/object/eid/1-s2.0-S0926860X14006073-gr5.jpg?httpAccept=%2A%2F%2A",
            "@multimediatype": "JPEG image file",
            "@type": "IMAGE-DOWNSAMPLED",
            "@size": "36560",
            "@ref": "gr5",
            "@mimetype": "image/jpeg"
          },
          {
            "@category": "standard",
            "@height": "741",
            "@width": "508",
            "@_fa": "true",
            "$": "https://api.elsevier.com/content/object/eid/1-s2.0-S0926860X14006073-gr4.jpg?httpAccept=%2A%2F%2A",
            "@multimediatype": "JPEG image file",
            "@type": "IMAGE-DOWNSAMPLED",
            "@size": "76457",
            "@ref": "gr4",
            "@mimetype": "image/jpeg"
          },
          {
            "@category": "standard",
            "@height": "708",
            "@width": "753",
            "@_fa": "true",
            "$": "https://api.elsevier.com/content/object/eid/1-s2.0-S0926860X14006073-gr3.jpg?httpAccept=%2A%2F%2A",
            "@multimediatype": "JPEG image file",
            "@type": "IMAGE-DOWNSAMPLED",
            "@size": "123485",
            "@ref": "gr3",
            "@mimetype": "image/jpeg"
          },
          {
            "@category": "standard",
            "@height": "229",
            "@width": "565",
            "@_fa": "true",
            "$": "https://api.elsevier.com/content/object/eid/1-s2.0-S0926860X14006073-gr2.jpg?httpAccept=%2A%2F%2A",
            "@multimediatype": "JPEG image file",
            "@type": "IMAGE-DOWNSAMPLED",
            "@size": "25131",
            "@ref": "gr2",
            "@mimetype": "image/jpeg"
          },
          {
            "@category": "standard",
            "@height": "360",
            "@width": "376",
            "@_fa": "true",
            "$": "https://api.elsevier.com/content/object/eid/1-s2.0-S0926860X14006073-gr1.jpg?httpAccept=%2A%2F%2A",
            "@multimediatype": "JPEG image file",
            "@type": "IMAGE-DOWNSAMPLED",
            "@size": "28935",
            "@ref": "gr1",
            "@mimetype": "image/jpeg"
          },
          {
            "@category": "standard",
            "@height": "60",
            "@width": "333",
            "@_fa": "true",
            "$": "https://api.elsevier.com/content/object/eid/1-s2.0-S0926860X14006073-fx5.jpg?httpAccept=%2A%2F%2A",
            "@multimediatype": "JPEG image file",
            "@type": "IMAGE-DOWNSAMPLED",
            "@size": "3833",
            "@ref": "fx5",
            "@mimetype": "image/jpeg"
          },
          {
            "@category": "standard",
            "@height": "86",
            "@width": "270",
            "@_fa": "true",
            "$": "https://api.elsevier.com/content/object/eid/1-s2.0-S0926860X14006073-fx4.jpg?httpAccept=%2A%2F%2A",
            "@multimediatype": "JPEG image file",
            "@type": "IMAGE-DOWNSAMPLED",
            "@size": "3892",
            "@ref": "fx4",
            "@mimetype": "image/jpeg"
          },
          {
            "@category": "standard",
            "@height": "59",
            "@width": "450",
            "@_fa": "true",
            "$": "https://api.elsevier.com/content/object/eid/1-s2.0-S0926860X14006073-fx3.jpg?httpAccept=%2A%2F%2A",
            "@multimediatype": "JPEG image file",
            "@type": "IMAGE-DOWNSAMPLED",
            "@size": "5672",
            "@ref": "fx3",
            "@mimetype": "image/jpeg"
          },
          {
            "@category": "standard",
            "@height": "81",
            "@width": "433",
            "@_fa": "true",
            "$": "https://api.elsevier.com/content/object/eid/1-s2.0-S0926860X14006073-fx2.jpg?httpAccept=%2A%2F%2A",
            "@multimediatype": "JPEG image file",
            "@type": "IMAGE-DOWNSAMPLED",
            "@size": "5885",
            "@ref": "fx2",
            "@mimetype": "image/jpeg"
          },
          {
            "@category": "standard",
            "@height": "200",
            "@width": "269",
            "@_fa": "true",
            "$": "https://api.elsevier.com/content/object/eid/1-s2.0-S0926860X14006073-fx1.jpg?httpAccept=%2A%2F%2A",
            "@multimediatype": "JPEG image file",
            "@type": "IMAGE-DOWNSAMPLED",
            "@size": "14144",
            "@ref": "fx1",
            "@mimetype": "image/jpeg"
          },
          {
            "@category": "thumbnail",
            "@height": "95",
            "@width": "219",
            "@_fa": "true",
            "$": "https://api.elsevier.com/content/object/eid/1-s2.0-S0926860X14006073-sc1.sml?httpAccept=%2A%2F%2A",
            "@multimediatype": "GIF image file",
            "@type": "IMAGE-THUMBNAIL",
            "@size": "4170",
            "@ref": "sc1",
            "@mimetype": "image/gif"
          },
          {
            "@category": "thumbnail",
            "@height": "54",
            "@width": "219",
            "@_fa": "true",
            "$": "https://api.elsevier.com/content/object/eid/1-s2.0-S0926860X14006073-gr6.sml?httpAccept=%2A%2F%2A",
            "@multimediatype": "GIF image file",
            "@type": "IMAGE-THUMBNAIL",
            "@size": "5868",
            "@ref": "gr6",
            "@mimetype": "image/gif"
          },
          {
            "@category": "thumbnail",
            "@height": "143",
            "@width": "219",
            "@_fa": "true",
            "$": "https://api.elsevier.com/content/object/eid/1-s2.0-S0926860X14006073-gr5.sml?httpAccept=%2A%2F%2A",
            "@multimediatype": "GIF image file",
            "@type": "IMAGE-THUMBNAIL",
            "@size": "5042",
            "@ref": "gr5",
            "@mimetype": "image/gif"
          },
          {
            "@category": "thumbnail",
            "@height": "163",
            "@width": "112",
            "@_fa": "true",
            "$": "https://api.elsevier.com/content/object/eid/1-s2.0-S0926860X14006073-gr4.sml?httpAccept=%2A%2F%2A",
            "@multimediatype": "GIF image file",
            "@type": "IMAGE-THUMBNAIL",
            "@size": "7400",
            "@ref": "gr4",
            "@mimetype": "image/gif"
          },
          {
            "@category": "thumbnail",
            "@height": "164",
            "@width": "174",
            "@_fa": "true",
            "$": "https://api.elsevier.com/content/object/eid/1-s2.0-S0926860X14006073-gr3.sml?httpAccept=%2A%2F%2A",
            "@multimediatype": "GIF image file",
            "@type": "IMAGE-THUMBNAIL",
            "@size": "6474",
            "@ref": "gr3",
            "@mimetype": "image/gif"
          },
          {
            "@category": "thumbnail",
            "@height": "89",
            "@width": "219",
            "@_fa": "true",
            "$": "https://api.elsevier.com/content/object/eid/1-s2.0-S0926860X14006073-gr2.sml?httpAccept=%2A%2F%2A",
            "@multimediatype": "GIF image file",
            "@type": "IMAGE-THUMBNAIL",
            "@size": "3028",
            "@ref": "gr2",
            "@mimetype": "image/gif"
          },
          {
            "@category": "thumbnail",
            "@height": "164",
            "@width": "171",
            "@_fa": "true",
            "$": "https://api.elsevier.com/content/object/eid/1-s2.0-S0926860X14006073-gr1.sml?httpAccept=%2A%2F%2A",
            "@multimediatype": "GIF image file",
            "@type": "IMAGE-THUMBNAIL",
            "@size": "4209",
            "@ref": "gr1",
            "@mimetype": "image/gif"
          },
          {
            "@category": "thumbnail",
            "@height": "40",
            "@width": "219",
            "@_fa": "true",
            "$": "https://api.elsevier.com/content/object/eid/1-s2.0-S0926860X14006073-fx5.sml?httpAccept=%2A%2F%2A",
            "@multimediatype": "GIF image file",
            "@type": "IMAGE-THUMBNAIL",
            "@size": "1685",
            "@ref": "fx5",
            "@mimetype": "image/gif"
          },
          {
            "@category": "thumbnail",
            "@height": "70",
            "@width": "219",
            "@_fa": "true",
            "$": "https://api.elsevier.com/content/object/eid/1-s2.0-S0926860X14006073-fx4.sml?httpAccept=%2A%2F%2A",
            "@multimediatype": "GIF image file",
            "@type": "IMAGE-THUMBNAIL",
            "@size": "2049",
            "@ref": "fx4",
            "@mimetype": "image/gif"
          },
          {
            "@category": "thumbnail",
            "@height": "29",
            "@width": "219",
            "@_fa": "true",
            "$": "https://api.elsevier.com/content/object/eid/1-s2.0-S0926860X14006073-fx3.sml?httpAccept=%2A%2F%2A",
            "@multimediatype": "GIF image file",
            "@type": "IMAGE-THUMBNAIL",
            "@size": "1666",
            "@ref": "fx3",
            "@mimetype": "image/gif"
          },
          {
            "@category": "thumbnail",
            "@height": "41",
            "@width": "219",
            "@_fa": "true",
            "$": "https://api.elsevier.com/content/object/eid/1-s2.0-S0926860X14006073-fx2.sml?httpAccept=%2A%2F%2A",
            "@multimediatype": "GIF image file",
            "@type": "IMAGE-THUMBNAIL",
            "@size": "1799",
            "@ref": "fx2",
            "@mimetype": "image/gif"
          },
          {
            "@category": "thumbnail",
            "@height": "163",
            "@width": "219",
            "@_fa": "true",
            "$": "https://api.elsevier.com/content/object/eid/1-s2.0-S0926860X14006073-fx1.sml?httpAccept=%2A%2F%2A",
            "@multimediatype": "GIF image file",
            "@type": "IMAGE-THUMBNAIL",
            "@size": "17496",
            "@ref": "fx1",
            "@mimetype": "image/gif"
          },
          {
            "@category": "standard",
            "@_fa": "true",
            "$": "https://api.elsevier.com/content/object/eid/1-s2.0-S0926860X14006073-mmc1.doc?httpAccept=%2A%2F%2A",
            "@multimediatype": "Microsoft Word file",
            "@type": "APPLICATION",
            "@size": "3602944",
            "@ref": "mmc1",
            "@mimetype": "application/word"
          }
        ]
      },
      "link": {
        "@rel": "abstract",
        "@href": "https://api.elsevier.com/content/abstract/scopus_id/84928941974"
      }
    }
  }
}