{
  "metadata": {
    "title": "An experimental and first principles DFT investigation on the effect of Cu addition to Ni/Al<ce:inf loc=post>2</ce:inf>O<ce:inf loc=post>3</ce:inf> catalyst for the dry reforming of methane",
    "authors": "; ; ",
    "journal": "Applied Catalysis A: General",
    "date": "2020-07-25",
    "doi": "10.1016/j.apcata.2020.117699",
    "abstract": "",
    "uri": "https://api.elsevier.com/content/article/pii/S0926860X20302921",
    "pii": "S0926860X20302921"
  },
  "fulltext": {
    "full-text-retrieval-response": {
      "scopus-eid": "2-s2.0-85087715153",
      "originalText": "serial JL 271346 291210 291744 291809 31 90 Applied Catalysis A: General APPLIEDCATALYSISAGENERAL 2020-07-01 2020-07-01 2020-07-10 2020-07-10 2020-09-04T12:52:53 1-s2.0-S0926860X20302921 S0926-860X(20)30292-1 S0926860X20302921 10.1016/j.apcata.2020.117699 S300 S300.2 FULL-TEXT 1-s2.0-S0926860X20X00123 2024-01-01T12:33:10.553292Z 0 0 20200725 2020 2020-07-01T15:44:07.800315Z absattachment articleinfo articlenumber articletitlenorm authfirstinitialnorm authfirstsurnamenorm cid cids contenttype copyright crossmark dateloaded dateloadedtxt datesearch datesort dateupdated dco docsubtype doctype doi eid ewtransactionid fundingbodyid hubeid indexeddate issn issnnorm itemstage itemtransactionid itemweight oauserlicense openaccess openarchive pg pgfirst pii piinorm pubdatestart pubdatetxt pubyr sortorder sponsoredaccesstype srctitle srctitlenorm srctype ssids alllist content oa subj subheadings suppl tomb volfirst volissue volumelist webpdf webpdfpagecount yearnav figure table e-component body mmlmath acknowledge affil appendices articletitle auth authfirstini authfull authkeywords authlast grantsponsor highlightsabst orcid primabst ref specialabst 0926-860X 0926860X UNLIMITED QNL true 602 602 C Volume 602 56 117699 117699 117699 20200725 25 July 2020 2020-07-25 2020 article fla © 2020 The Authors. Published by Elsevier B.V. EXPERIMENTALFIRSTPRINCIPLESDFTINVESTIGATIONEFFECTCUADDITIONNIAL2O3CATALYSTFORDRYREFORMINGMETHANE CHATLA A 1 Introduction 2 Methodology 2.1 Catalyst synthesis 2.2 Characterization 2.3 Activity test 2.4 Density functional theory 2.5 Measurements of deactivation rates on Ni and Ni-Cu catalysts 3 Results and discussion 3.1 Textural characterization of fresh catalysts 3.2 H2-temperature programmed reduction (TPR) 3.3 XRD analysis of fresh calcined and reduced catalyst samples 3.4 Transmission electron microscopy (TEM) 3.5 CO chemisorption 3.6 Catalytic performance study for dry reforming of methane 3.6.1 Catalyst stability test 3.7 Effect of Ni-Cu alloy formation on suppressing coke 3.7.1 Powder XRD analysis 3.7.2 O2-TPO analysis over coked-catalysts 3.7.3 TEM and SEM analysis 3.7.4 TGA-DSC analysis of spent catalyst 3.8 Investigating the role of Cu on the bimetallic Ni-Cu system via density functional theory calculations 3.9 Measuring the extents of sintering/coking via deactivation profile modeling 4 Conclusions CRediT authorship contribution statement Acknowledgments Appendix A Supplementary data References VANSANTEN 2011 891 911 R XIONG 2015 2640 2658 H ZUO 2018 9821 9835 Z LIU 2019 3349 3359 Z LI 2018 21 29 D JIA 2019 159 169 X ABDULLAH 2017 170 185 B HAN 2017 625 632 J WU 2019 2693 2700 Z DAMA 2018 146 158 S KIM 2017 1937 1949 S PASSOS 2019 A KHZOUZ 2018 672 683 M WANG 2018 214 227 Y VENUGOPAL 2017 6374 6377 A TAN 2018 10148 10158 Q LUA 2013 469 A TAVARES 1999 681 M LAROSA 2007 1685 D KITLA 2013 517 530 A POPOVA 2009 567 N NAGHASH 2006 2480 A WANG 1990 63 Q SONG 2018 324 333 K LIU 2013 3904 3909 H RAHEMI 2014 50 59 N NATAJ 2018 1475 1488 S LEE 2004 1 6 J HALLICHE 1996 373 377 D KRESSE 1996 15 50 G KRESSE 1993 558 561 G KRESSE 1994 14251 14269 G KRESSE 1996 11169 11186 G BLOCHL 1994 17953 17979 P KRESSE 1999 1758 1775 G HAMMER 1999 7413 7421 B HAMMER 2000 71 B THEORETICALSURFACESCIENCECATALYSISCALCULATIONSCONCEPTSADVANCESINCATALYSIS BLAYLOCK 2011 828 D MONKHORST 1976 5188 5192 H METHFESSEL 1989 3616 3621 M ZHU 2009 260 267 Y HENKELMAN 1999 7010 7022 G OLSEN 2004 97769792 R HUA 2014 569 B LEE 2004 1 J BARTHOLOMEW 1983 131 141 C CHOUDHURY 2019 H ARGYLE 2014 415 429 M CROSS 2019 124 133 A YIN 2011 77 88 A LI 2016 171 181 D BAYAT 2017 88 96 N NAGHASH 2006 2480 2488 A MIRANDA 2015 166 180 B FREITAS 2018 31 41 I GANDARIAS 2012 79 89 I LI 2009 299 307 D WANG 2016 3594 3605 N WU 2015 94102 T YEN 2015 5505 55511 H DEROGATIS 2008 501 509 L BENGAARD 2002 365384 H CHEN 2004 173 180 H KAWI 2015 3556 3575 S ZHOU 2015 2508 2516 L HUANG 2017 3563 3571 Q WANG 2014 640 648 C GEORGAKILAS 2015 4744 4822 V CAO 2018 51 60 Y ZHAO 2017 3772 3778 F DAMYANOVA 2009 250 261 S ZHANG 2015 94016 94024 Q ZHANG 2015 14135 14144 R LIU 2013 712 H LIU 2012 8177 8184 H CHATLAX2020X117699 CHATLAX2020X117699XA Full 2020-07-27T10:05:30Z FundingBody Qatar National Library http://creativecommons.org/licenses/by/4.0/ 2021-07-10T00:00:00.000Z 2021-07-10T00:00:00.000Z http://creativecommons.org/licenses/by-nc-nd/4.0/ This is an open access article under the CC BY license. © 2020 The Authors. Published by Elsevier B.V. 2020-07-27T10:01:27.767Z http://vtw.elsevier.com/data/voc/AddOnTypes/50.7/eoas QNRF Qatar National Research Fund http://data.elsevier.com/vocabulary/SciValFunders/100008982 http://sws.geonames.org/289688 item S0926-860X(20)30292-1 S0926860X20302921 1-s2.0-S0926860X20302921 10.1016/j.apcata.2020.117699 271346 2024-01-01T12:33:10.553292Z 2020-07-25 UNLIMITED QNL 1-s2.0-S0926860X20302921-main.pdf https://s3-eu-west-1.amazonaws.com/prod-ucs-content-store-eu-west/content/pii:S0926860X20302921/MAIN/application/pdf/1f9b01cf492a2d6fb90cc6161b87b3bb/main.pdf main.pdf pdf true 5884697 MAIN 15 1-s2.0-S0926860X20302921-main_1.png https://s3-eu-west-1.amazonaws.com/prod-ucs-content-store-eu-west/content/pii:S0926860X20302921/PREVIEW/image/png/a779d99c78ed3d8d40d1f2f6f3d77287/main_1.png main_1.png png 54423 849 656 IMAGE-WEB-PDF 1 1-s2.0-S0926860X20302921-gr1.jpg https://s3-eu-west-1.amazonaws.com/prod-ucs-content-store-eu-west/content/pii:S0926860X20302921/gr1/DOWNSAMPLED/image/jpeg/5873f84776b6e8bf3de90f3dbc7d8d01/gr1.jpg gr1 gr1.jpg jpg 25162 407 340 IMAGE-DOWNSAMPLED 1-s2.0-S0926860X20302921-gr13.jpg https://s3-eu-west-1.amazonaws.com/prod-ucs-content-store-eu-west/content/pii:S0926860X20302921/gr13/DOWNSAMPLED/image/jpeg/91f58b97a0c7173985d8c2d7893e08cb/gr13.jpg gr13 gr13.jpg jpg 50426 274 566 IMAGE-DOWNSAMPLED 1-s2.0-S0926860X20302921-gr4.jpg https://s3-eu-west-1.amazonaws.com/prod-ucs-content-store-eu-west/content/pii:S0926860X20302921/gr4/DOWNSAMPLED/image/jpeg/00ac17b005613ca885411f471360f770/gr4.jpg gr4 gr4.jpg jpg 140829 697 717 IMAGE-DOWNSAMPLED 1-s2.0-S0926860X20302921-gr5.jpg https://s3-eu-west-1.amazonaws.com/prod-ucs-content-store-eu-west/content/pii:S0926860X20302921/gr5/DOWNSAMPLED/image/jpeg/71b8990b68281d6323ecff8f8c5800a7/gr5.jpg gr5 gr5.jpg jpg 81288 604 679 IMAGE-DOWNSAMPLED 1-s2.0-S0926860X20302921-gr2.jpg https://s3-eu-west-1.amazonaws.com/prod-ucs-content-store-eu-west/content/pii:S0926860X20302921/gr2/DOWNSAMPLED/image/jpeg/2ffa488e8f03706435f0e58b0cf5a4ee/gr2.jpg gr2 gr2.jpg jpg 35028 451 340 IMAGE-DOWNSAMPLED 1-s2.0-S0926860X20302921-gr3.jpg https://s3-eu-west-1.amazonaws.com/prod-ucs-content-store-eu-west/content/pii:S0926860X20302921/gr3/DOWNSAMPLED/image/jpeg/d5c374407b77048d476a0b71afefd66e/gr3.jpg gr3 gr3.jpg jpg 155562 771 717 IMAGE-DOWNSAMPLED 1-s2.0-S0926860X20302921-gr8.jpg https://s3-eu-west-1.amazonaws.com/prod-ucs-content-store-eu-west/content/pii:S0926860X20302921/gr8/DOWNSAMPLED/image/jpeg/776d58c183d4e14daa98217aae93d46c/gr8.jpg gr8 gr8.jpg jpg 167289 788 717 IMAGE-DOWNSAMPLED 1-s2.0-S0926860X20302921-gr9.jpg https://s3-eu-west-1.amazonaws.com/prod-ucs-content-store-eu-west/content/pii:S0926860X20302921/gr9/DOWNSAMPLED/image/jpeg/867356c3111a89c750441e3e4d7d18ca/gr9.jpg gr9 gr9.jpg jpg 205588 816 717 IMAGE-DOWNSAMPLED 1-s2.0-S0926860X20302921-gr6.jpg https://s3-eu-west-1.amazonaws.com/prod-ucs-content-store-eu-west/content/pii:S0926860X20302921/gr6/DOWNSAMPLED/image/jpeg/65f6140a3ccda7f7c06cf86a2357996d/gr6.jpg gr6 gr6.jpg jpg 59566 605 679 IMAGE-DOWNSAMPLED 1-s2.0-S0926860X20302921-gr7.jpg https://s3-eu-west-1.amazonaws.com/prod-ucs-content-store-eu-west/content/pii:S0926860X20302921/gr7/DOWNSAMPLED/image/jpeg/a0a8d1140639776407cf468aa304428f/gr7.jpg gr7 gr7.jpg jpg 19542 294 340 IMAGE-DOWNSAMPLED 1-s2.0-S0926860X20302921-ga1.jpg https://s3-eu-west-1.amazonaws.com/prod-ucs-content-store-eu-west/content/pii:S0926860X20302921/ga1/DOWNSAMPLED/image/jpeg/e964b201876c5b8f3a19738fb505ac43/ga1.jpg ga1 true ga1.jpg jpg 32986 195 500 IMAGE-DOWNSAMPLED 1-s2.0-S0926860X20302921-gr11.jpg https://s3-eu-west-1.amazonaws.com/prod-ucs-content-store-eu-west/content/pii:S0926860X20302921/gr11/DOWNSAMPLED/image/jpeg/57fc146e6a3e20949dd44ef25bc78879/gr11.jpg gr11 gr11.jpg jpg 29531 432 491 IMAGE-DOWNSAMPLED 1-s2.0-S0926860X20302921-gr12.jpg https://s3-eu-west-1.amazonaws.com/prod-ucs-content-store-eu-west/content/pii:S0926860X20302921/gr12/DOWNSAMPLED/image/jpeg/83c81d5da8fec8b39d0d98f895ea0551/gr12.jpg gr12 gr12.jpg jpg 26004 291 566 IMAGE-DOWNSAMPLED 1-s2.0-S0926860X20302921-gr10.jpg https://s3-eu-west-1.amazonaws.com/prod-ucs-content-store-eu-west/content/pii:S0926860X20302921/gr10/DOWNSAMPLED/image/jpeg/5a2f4a58dbcfbf7ba5c308e257ade855/gr10.jpg gr10 gr10.jpg jpg 29728 230 566 IMAGE-DOWNSAMPLED 1-s2.0-S0926860X20302921-gr1.sml https://s3-eu-west-1.amazonaws.com/prod-ucs-content-store-eu-west/content/pii:S0926860X20302921/gr1/THUMBNAIL/image/gif/58e5ee3828951e4e5fce07aa8235018a/gr1.sml gr1 gr1.sml sml 7573 164 137 IMAGE-THUMBNAIL 1-s2.0-S0926860X20302921-gr13.sml https://s3-eu-west-1.amazonaws.com/prod-ucs-content-store-eu-west/content/pii:S0926860X20302921/gr13/THUMBNAIL/image/gif/2a2832595735006515fc13628c9a0eb0/gr13.sml gr13 gr13.sml sml 12786 106 219 IMAGE-THUMBNAIL 1-s2.0-S0926860X20302921-gr4.sml https://s3-eu-west-1.amazonaws.com/prod-ucs-content-store-eu-west/content/pii:S0926860X20302921/gr4/THUMBNAIL/image/gif/ba5bcfc83c56aedb9389ab624458c332/gr4.sml gr4 gr4.sml sml 19637 164 169 IMAGE-THUMBNAIL 1-s2.0-S0926860X20302921-gr5.sml https://s3-eu-west-1.amazonaws.com/prod-ucs-content-store-eu-west/content/pii:S0926860X20302921/gr5/THUMBNAIL/image/gif/c700a7785a736ddab7ebe154f5ca15f1/gr5.sml gr5 gr5.sml sml 10158 164 184 IMAGE-THUMBNAIL 1-s2.0-S0926860X20302921-gr2.sml https://s3-eu-west-1.amazonaws.com/prod-ucs-content-store-eu-west/content/pii:S0926860X20302921/gr2/THUMBNAIL/image/gif/55dfdb56597cb5195797634b86fdcc49/gr2.sml gr2 gr2.sml sml 8290 163 123 IMAGE-THUMBNAIL 1-s2.0-S0926860X20302921-gr3.sml https://s3-eu-west-1.amazonaws.com/prod-ucs-content-store-eu-west/content/pii:S0926860X20302921/gr3/THUMBNAIL/image/gif/135d2e30c8b11c303ebbaa146c8023be/gr3.sml gr3 gr3.sml sml 18003 163 152 IMAGE-THUMBNAIL 1-s2.0-S0926860X20302921-gr8.sml https://s3-eu-west-1.amazonaws.com/prod-ucs-content-store-eu-west/content/pii:S0926860X20302921/gr8/THUMBNAIL/image/gif/21c6879e97b78ab1962b248825e1e104/gr8.sml gr8 gr8.sml sml 18698 164 149 IMAGE-THUMBNAIL 1-s2.0-S0926860X20302921-gr9.sml https://s3-eu-west-1.amazonaws.com/prod-ucs-content-store-eu-west/content/pii:S0926860X20302921/gr9/THUMBNAIL/image/gif/5e8a4091d04e2b669952392d07cc2281/gr9.sml gr9 gr9.sml sml 16697 164 144 IMAGE-THUMBNAIL 1-s2.0-S0926860X20302921-gr6.sml https://s3-eu-west-1.amazonaws.com/prod-ucs-content-store-eu-west/content/pii:S0926860X20302921/gr6/THUMBNAIL/image/gif/f4cd0db992cfff0b7316b858f3ddcb78/gr6.sml gr6 gr6.sml sml 8760 164 184 IMAGE-THUMBNAIL 1-s2.0-S0926860X20302921-gr7.sml https://s3-eu-west-1.amazonaws.com/prod-ucs-content-store-eu-west/content/pii:S0926860X20302921/gr7/THUMBNAIL/image/gif/845d720b1c388f144d417ae07475e361/gr7.sml gr7 gr7.sml sml 9729 164 190 IMAGE-THUMBNAIL 1-s2.0-S0926860X20302921-ga1.sml https://s3-eu-west-1.amazonaws.com/prod-ucs-content-store-eu-west/content/pii:S0926860X20302921/ga1/THUMBNAIL/image/gif/43320c9a1c2e20bdda5b57e5def1807a/ga1.sml ga1 true ga1.sml sml 10886 85 219 IMAGE-THUMBNAIL 1-s2.0-S0926860X20302921-gr11.sml https://s3-eu-west-1.amazonaws.com/prod-ucs-content-store-eu-west/content/pii:S0926860X20302921/gr11/THUMBNAIL/image/gif/2db0f3c149445646fe4484454ffd5689/gr11.sml gr11 gr11.sml sml 5931 164 186 IMAGE-THUMBNAIL 1-s2.0-S0926860X20302921-gr12.sml https://s3-eu-west-1.amazonaws.com/prod-ucs-content-store-eu-west/content/pii:S0926860X20302921/gr12/THUMBNAIL/image/gif/1768ae93728940406312d41c6180bb5b/gr12.sml gr12 gr12.sml sml 5332 113 219 IMAGE-THUMBNAIL 1-s2.0-S0926860X20302921-gr10.sml https://s3-eu-west-1.amazonaws.com/prod-ucs-content-store-eu-west/content/pii:S0926860X20302921/gr10/THUMBNAIL/image/gif/45a448c9bc9216fb79bd688013d07f84/gr10.sml gr10 gr10.sml sml 7494 89 219 IMAGE-THUMBNAIL 1-s2.0-S0926860X20302921-gr1_lrg.jpg https://s3-eu-west-1.amazonaws.com/prod-ucs-content-store-eu-west/content/pii:S0926860X20302921/gr1/HIGHRES/image/jpeg/e85652398063ab4e05f163db75ac3a1f/gr1_lrg.jpg gr1 gr1_lrg.jpg jpg 198324 1807 1508 IMAGE-HIGH-RES 1-s2.0-S0926860X20302921-gr13_lrg.jpg https://s3-eu-west-1.amazonaws.com/prod-ucs-content-store-eu-west/content/pii:S0926860X20302921/gr13/HIGHRES/image/jpeg/533580912ceb5526b47e2c0caf06d200/gr13_lrg.jpg gr13 gr13_lrg.jpg jpg 560254 1215 2508 IMAGE-HIGH-RES 1-s2.0-S0926860X20302921-gr4_lrg.jpg https://s3-eu-west-1.amazonaws.com/prod-ucs-content-store-eu-west/content/pii:S0926860X20302921/gr4/HIGHRES/image/jpeg/1def4ddfbc8b4e5e08145639b87f5422/gr4_lrg.jpg gr4 gr4_lrg.jpg jpg 1686211 3085 3175 IMAGE-HIGH-RES 1-s2.0-S0926860X20302921-gr5_lrg.jpg https://s3-eu-west-1.amazonaws.com/prod-ucs-content-store-eu-west/content/pii:S0926860X20302921/gr5/HIGHRES/image/jpeg/0d0e197f3ae1787943b19da949a72080/gr5_lrg.jpg gr5 gr5_lrg.jpg jpg 560689 2674 3008 IMAGE-HIGH-RES 1-s2.0-S0926860X20302921-gr2_lrg.jpg https://s3-eu-west-1.amazonaws.com/prod-ucs-content-store-eu-west/content/pii:S0926860X20302921/gr2/HIGHRES/image/jpeg/6205a0c33c0321a293e0e33d0db0117b/gr2_lrg.jpg gr2 gr2_lrg.jpg jpg 296503 1999 1508 IMAGE-HIGH-RES 1-s2.0-S0926860X20302921-gr3_lrg.jpg https://s3-eu-west-1.amazonaws.com/prod-ucs-content-store-eu-west/content/pii:S0926860X20302921/gr3/HIGHRES/image/jpeg/610a7b92954d0dc6a14ca0e741322824/gr3_lrg.jpg gr3 gr3_lrg.jpg jpg 1840946 3415 3175 IMAGE-HIGH-RES 1-s2.0-S0926860X20302921-gr8_lrg.jpg https://s3-eu-west-1.amazonaws.com/prod-ucs-content-store-eu-west/content/pii:S0926860X20302921/gr8/HIGHRES/image/jpeg/fe250685126daf61b8a83eae55b46ccd/gr8_lrg.jpg gr8 gr8_lrg.jpg jpg 2016381 3490 3175 IMAGE-HIGH-RES 1-s2.0-S0926860X20302921-gr9_lrg.jpg https://s3-eu-west-1.amazonaws.com/prod-ucs-content-store-eu-west/content/pii:S0926860X20302921/gr9/HIGHRES/image/jpeg/f295b47604267793d280a6851d7385e4/gr9_lrg.jpg gr9 gr9_lrg.jpg jpg 2543554 3613 3175 IMAGE-HIGH-RES 1-s2.0-S0926860X20302921-gr6_lrg.jpg https://s3-eu-west-1.amazonaws.com/prod-ucs-content-store-eu-west/content/pii:S0926860X20302921/gr6/HIGHRES/image/jpeg/70437f586644a0a459c58afcd2666502/gr6_lrg.jpg gr6 gr6_lrg.jpg jpg 428447 2682 3008 IMAGE-HIGH-RES 1-s2.0-S0926860X20302921-gr7_lrg.jpg https://s3-eu-west-1.amazonaws.com/prod-ucs-content-store-eu-west/content/pii:S0926860X20302921/gr7/HIGHRES/image/jpeg/df58c619e00dd1a3f4b458255b3207b4/gr7_lrg.jpg gr7 gr7_lrg.jpg jpg 158840 1302 1508 IMAGE-HIGH-RES 1-s2.0-S0926860X20302921-ga1_lrg.jpg https://s3-eu-west-1.amazonaws.com/prod-ucs-content-store-eu-west/content/pii:S0926860X20302921/ga1/HIGHRES/image/jpeg/c30a3ae9a89b3a298149796938d243af/ga1_lrg.jpg ga1 true ga1_lrg.jpg jpg 224779 862 2213 IMAGE-HIGH-RES 1-s2.0-S0926860X20302921-gr11_lrg.jpg https://s3-eu-west-1.amazonaws.com/prod-ucs-content-store-eu-west/content/pii:S0926860X20302921/gr11/HIGHRES/image/jpeg/4b498bbef0c5ff82b47730489abf5e8c/gr11_lrg.jpg gr11 gr11_lrg.jpg jpg 246860 1912 2175 IMAGE-HIGH-RES 1-s2.0-S0926860X20302921-gr12_lrg.jpg https://s3-eu-west-1.amazonaws.com/prod-ucs-content-store-eu-west/content/pii:S0926860X20302921/gr12/HIGHRES/image/jpeg/f2a1bc686403fc93f9cdd8c417355e41/gr12_lrg.jpg gr12 gr12_lrg.jpg jpg 219975 1289 2508 IMAGE-HIGH-RES 1-s2.0-S0926860X20302921-gr10_lrg.jpg https://s3-eu-west-1.amazonaws.com/prod-ucs-content-store-eu-west/content/pii:S0926860X20302921/gr10/HIGHRES/image/jpeg/65eab0b40d3e531ecafd39072972dfe2/gr10_lrg.jpg gr10 gr10_lrg.jpg jpg 240759 1017 2508 IMAGE-HIGH-RES 1-s2.0-S0926860X20302921-mmc1.pdf https://s3-eu-west-1.amazonaws.com/prod-ucs-content-store-eu-west/content/pii:S0926860X20302921/mmc1/MAIN/application/pdf/709f996d9204abe40c637bb873101c05/mmc1.pdf mmc1 mmc1.pdf pdf false 673349 APPLICATION 1-s2.0-S0926860X20302921-si1.svg https://s3-eu-west-1.amazonaws.com/prod-ucs-content-store-eu-west/content/pii:S0926860X20302921/STRIPIN/image/svg+xml/8d79baa5bc9b5aed0026e14808075529/si1.svg si1 si1.svg svg 20450 ALTIMG 1-s2.0-S0926860X20302921-am.pdf https://s3-eu-west-1.amazonaws.com/prod-ucs-content-store-eu-west/content/egi:10T2GBKWDZ5/MAIN/application/pdf/5b38e57f51cfddb4ae3324a9bfa30216/am.pdf am am.pdf pdf false 1808396 AAM-PDF APCATA 117699 117699 S0926-860X(20)30292-1 10.1016/j.apcata.2020.117699 The Authors Fig. 1 H2-TPR analysis of fresh calcined (a) Ni/γ-Al2O3, (b) Ni10Cu1/γ-Al2O3, (c) Ni8Cu1/γ-Al2O3 and (d) Ni3Cu1/γ-Al2O3 samples. Fig. 1 Fig. 2 PXRD patterns of reduced catalysts samples. (*: γ-Al2O3, ○: Ni0, ♦: Ni-Cu alloy, □: NiAl2O4). Fig. 2 Fig. 3 (a) TEM, (b–c) HRTEM, (d) High-angle annular dark-field scanning transmission electron microscopy (HAADF-STEM), (e) Ni metal particle size distribution, and (f–h) Elemental mapping of reduced Ni/Al2O3 catalyst. Fig. 3 Fig. 4 (a) TEM, (b–e) HRTEM, (f) High-angle annular dark-field scanning transmission electron microscopy (HAADF-STEM), (g) Ni metal particle size distribution, and (h–j) Elemental mapping of reduced Ni8Cu1/Al2O3 catalyst. Fig. 4 Fig. 5 (a) CH4, (b) CO2 conversions rates, and (c) H2/CO ratio versus TOS for CO2 reforming of methane at 650 °C. (The DRM activity data collected by a Cirrus 2 Mass spectrometer (MKS Instruments). Fig. 5 Fig. 6 (a) CH4, (b) CO2 conversions rates, and (b) H2/CO ratio versus TOS for CO2 reforming of methane at 650 °C. (The DRM activity data was collected by a Cirrus 2 Mass spectrometer (MKS Instruments). Fig. 6 Fig. 7 O2-TPO profile of spent catalysts after DRM performance at 650 °C for 70 h TOS. Fig. 7 Fig. 8 (a) TEM, (b–c) HRTEM, (d) High-angle annular dark-field scanning transmission electron microscopy (HAADF-STEM), and (e–h) Elemental mapping of spent Ni/Al2O3 catalyst. (Inset: Ni metal particle size distribution). Fig. 8 Fig. 9 (a)TEM, (b–c) HRTEM, b) High-angle annular dark-field scanning transmission electron microscopy (HAADF-STEM), and (e–h) Elemental mapping of spent Ni8Cu1/Al2O3 catalyst. (Inset: Ni metal particle size distribution). Fig. 9 Fig. 10 (a) TGA and (b) DSC profiles of spent Ni/Al2O3 and Ni8Cu1/Al2O3 catalysts after DRM performance at 650 °C. Fig. 10 Fig. 11 Energy profile for CH4 dehydrogenation for various surfaces studied. Fig. 11 Fig. 12 Activation barriers of (a) C formation via the CH dissociation pathway and (b) C elimination by oxidation with O to form CO. Fig. 12 Fig. 13 Fraction of total deactivation corresponding to sintering (yellow bars) and carbon deposition (blue bars) with TOS in the (a) Ni/Al2O3 and (b) Ni8Cu1/Al2O3 catalysts. Red dots correspond to the loss of total activity (experimental). (For interpretation of the references to colour in this figure legend, the reader is referred to the web version of this article). Fig. 13 Table 1 Physicochemical properties of Ni/Al2O3 and bimetallic Ni-Cu/Al2O3 catalysts. Table 1 Catalyst (Ni: Cu) Atomic ratio Nominal metal loading (wt%) aNi metal loading (wt%) BET-SA (m2/g) Pore volume (cm3/g) bNiO crystalli te size (nm) cNi0 particle size (nm) dMetal dispersion (%) eNi0 particle size (nm) γ-Al2O3 – – – 153 0.88 – – – – Ni/γ-Al2O3 – 10 9.58 132 0.77 10 11 8 9 (9.5)f Ni10Cu1/γ-Al2O3 10:1 10 9.02 138 0.87 7.4 9 6 – Ni8Cu1/γ-Al2O3 8:1 10 8.20 132 0.83 6.5 7 3 4 (7.2)f Ni3Cu1/γ-Al2O3 3:1 10 7.34 133 0.80 8.4 10 2.5 – aEstimated from ICP-OEC, bCalculated for XRD fresh calcined samples by using Scherrer’s equation cCalculated for XRD fresh reduced samples by using Scherrer’s equation dFrom CO chemisorption, refer text for explanation eFrom TEM analysis of reduced catalysts fFrom TEM analysis of spent catalysts. Table 2 Adsorption Energies of carbon atom on surfaces with varying amounts of copper. Table 2 Surface Stable adsorption Site Adsorption energies (eV) Monometallic (pure) Ni(111) HCP −7.50 1/9 ML (Low Cu loading) Ni/Cu(111) FCC −6.98 1/3 ML (Medium Cu loading) Ni/Cu(111) HCP −6.33 1 ML (High Cu loading) Ni/Cu(111) FCC −5.62 Table 3 Ni and Ni-Cu catalysts deactivation rate parameters for the rapid and slow deactivation regions during DRM at and extrapolated activities at TOS 70 h. Table 3 Catalyst Rapid deactivation (Sintering) Slow deactivation (C deposit) Mechanism Contribution TOS (h) Kd (1/h) ass, fast TOS (h) Kd (1/h) ass, slow Ni/Al2O3 0–30 0.13 0.99 30–70 0.01 0.01 Sintering (1 %) C deposit (99 %) Ni8Cu1/Al2O3 0–30 6.95 0.94 30–70 0.005 0.36 Sintering (23 %) C deposit (77 %) An experimental and first principles DFT investigation on the effect of Cu addition to Ni/Al2O3 catalyst for the dry reforming of methane Anjaneyulu Chatla Conceptualization Investigation Writing - original draft a Minhaj M. Ghouri Conceptualization Software Formal analysis a Omar Wissam El Hassan Investigation a c Nosaiba Mohamed Investigation Formal analysis a Anuj V. Prakash Validation Writing - review & editing a Nimir O. Elbashir Supervision Conceptualization Methodology Project administration a b * a Chemical Engineering Program, Texas A&M University at Qatar, P.O. 23874, Doha, Qatar Chemical Engineering Program Texas A&M University at Qatar P.O. 23874 Doha Qatar Chemical Engineering Program, Texas A&M University at Qatar, P.O. 23874, Doha, Qatar b Gas & Fuels Research Center, Texas A&M University, College Station, TX 77843-3122, USA Gas & Fuels Research Center Texas A&M University College Station TX 77843-3122 USA Gas & Fuels Research Center, Texas A&M University, College Station, Texas 77843-3122, USA c Qatar Environment and Energy Research Institute (QEERI), Hamad Bin Khalifa University, P.O. 34110, Doha, Qatar Qatar Environment and Energy Research Institute (QEERI) Hamad Bin Khalifa University P.O. 34110 Doha Qatar Qatar Environment and Energy Research Institute (QEERI), Hamad Bin Khalifa University, P.O. 34110, Doha, Qatar ⁎ Corresponding author at: Chemical Engineering Program, Texas A&M University at Qatar, P.O. 23874, Doha, Qatar. Chemical Engineering Program Texas A&M University at Qatar P.O. 23874 Doha Qatar Graphical abstract The influence of varying Cu atomic ratios in a bimetallic Ni-Cu catalytic system for the CO2 or Dry Reforming of Methane (DRM) is investigated experimentally, in conjunction with ab-initio Density Functional Theory (DFT) and Generalized Power Law Expression (GPLE)-based mathematical modeling approaches. Among the synthesized catalysts, an 8:1 Ni:Cu ratio shows highest activity with stable H2/CO selectivity compared to its monometallic counterpart. Detailed physico-chemical characterization of the catalysts indicate that copper addition minimizes deactivation by forming a Ni-Cu alloy that increases reducibility of the NiO and limits the tendency of the active site toward coke formation. DFT calculations reveal increased energy barrier for carbon adsorption, whilst promoting facile removal of deposited carbon. GPLE analysis of the deactivation profiles suggest coking as the primary deactivation route in monometallic Ni catalyst; although much lesser in extent, deactivation of Ni8Cu1/Al2O3 catalyst is induced by both sintering and coking regimes. Keywords DRM Ni-Cu alloy DFT Generalized Power Law Expression (GPLE) Bi-metallic catalyst Catalyst deactivation 1 Introduction Research interest in the area of dry (CO2) reforming of methane (DRM) to syngas (a mixture of H2 and CO) is exponentially increasing, as evidenced by the number of papers published each year. A search on Scopus for “Dry CO2 reforming methane” yields a total of 5000+ articles/patents since 1991, with 817 publications on the subject in 2018 alone. An apparent reason for this is DRM’s ability to consume two major greenhouse gases (CO2 and CH4) to produce syngas, from which cleaner fuels via Fisher-Tropsch [1] and value-added chemicals [2] are synthesized. However, a major obstacle towards the large-scale commercialization of this reaction is the highly endothermic nature of the reaction itself [Eq (1)] and is therefore typically performed at very high reaction temperatures, industrially (>800 °C) [3]. Dry Reforming of Methane: (1) CH4 + CO2 → 2H2 + 2CO ΔH0 298K = +247 kJ/mol Another impeding factor for the broader commercialization of this process is the inevitable deactivation of the catalyst via severe carbon deposition (“coke”) and sintering of the active metal phases. Many strategies have been devoted to developing an active and highly stable catalyst for DRM. Although catalysts based on noble metals are superior in terms of activity and durability, their higher price and limited abundance hinder their usage in industrial applications [4]. Therefore, non-noble metals such as Ni and Co-based catalysts are generally preferred for their comparable activity, economical pricing, and higher availability. In particular, Ni-based catalysts are preferred for wide-scale industrial applications [5,6] but suffer from rapid catalyst deactivation due to coke formation, which can block and eventually decrease the number of active sites [7]. In general, carbon formation occurs via methane cracking [Eq (2)] and the Boudouard reaction [Eq (3)]. Methane cracking: (2) CH4 → 2H2 + C ΔH0 298K = +75 kJ/mol. Boudouard reaction: (3) 2CO → CO2 + C ΔH0 298K = −172 kJ/mol. Several approaches have been investigated in a bid to mitigate these problems–variation of the support type, promoters, and method of catalyst synthesis [8–10]. One of the most promising ways of improving the catalytic performance of Ni catalysts is to have Ni alloyed with other metals such as Fe, Co, or Cu [9,11,12]. Cu is relatively inexpensive and is, therefore, an ideal alloying metal. Ni-Cu alloys are currently receiving considerable interest in many chemical reactions, including DRM [13–16]. Cu and Ni have analogous crystal structures - both are face-centered cubic (fcc) metals with very similar lattice constants (3.615 Å for copper and 3.524 Å for Nickel), and can, therefore, form a stable fcc Cu-Ni alloy. A general assumption is that this alloy is homogeneous in composition and is unlikely to form Cu islands on the surface of Ni. However, recent studies have shown that Cu tends to segregate on the surface of the Cu/Ni alloy, depending on the temperature and reaction conditions applied [17–19]. The surface-enrichment with a Cu/Ni alloy is proposed to be the reason why these catalysts exhibit better resistance to carbon deposition [17–21]. For instance, Kitla et al. [20] used H2 chemisorption and CO-DRIFTS spectroscopy to conclude that the surface of Cu/Ni bimetallic particles is strongly enriched by Cu, this surface enrichment by Cu considerably reduces the coking tendency of the Ni-based catalyst. Naghash et al. [22] used XRD, XPS, and Auger measurements to demonstrate the propensity of Cu to segregate as a means to reduce interfacial surface energies. Furthermore, Wang et al. [23] concluded that the surface concentration of Cu in Cu/Ni bimetallic catalysts is higher than in bulk Ni by a factor of 2-3. There are several reports in the literature of similar Ni-Cu catalysts for DRM which, exhibit enhanced catalytic activity and stability compared to mono-metallic Ni catalysts [24–26]. Nataj et al. [27] and Lee et al. [28] observed that the addition of about 1 wt% of Cu to a 10 wt% Ni catalyst led to a highly stable bi-metallic catalyst with greater than 90 % methane conversion compared to a monometallic Ni catalyst. However, Halliche et al. [29] observed the opposite phenomenon wherein Cu addition to Ni/α-Al2O3 system displayed a decrease in activity and an increase in coke deposition. While there are several separate reports on experimental and ab-initio studies on Ni-Cu catalysts for DRM, no investigation till date has combined both approaches to provide comprehensive insight into the reason for their higher activity and the different selectivity performance in terms of H2/CO ratio. In this work, three bi-metallic catalysts with different Ni: Cu atomic ratios were synthesized and tested for DRM activity at 650 °C. At this temperature, both coking and sintering phenomena co-exist, therefore the resultant data is used to describe the effect of Cu on metal sintering and suppression of coke deposition. This ability to resist deposition by carbon is explained via ab-initio Density Functional Theory (DFT) simulations. Furthermore, a Generalized Power Law Expression (GPLE) is implemented to measure the extents of deactivation attributable to sintering and coke deposition on both the Ni-Cu and monometallic catalysts. This combined experimental, DFT, and mathematical deconvolution study of deactivation provides mechanistic insight into the effect of Cu doping and lends credence to the industrial application of these superior bimetallic catalysts over mono-metallic counterparts for the DRM reaction. 2 Methodology 2.1 Catalyst synthesis Nickel nitrate hexahydrate (Ni (NO3)2.6H2O, Sigma Aldrich) and Copper nitrate hemi (pentahydrate) (Cu (NO3)2 2.5H2O, ACROS) were used as Ni and Cu precursors respectively, and γ-Al2O3 (Sasol Puralox) powder as the support. All reagents were used without further purification. The required amount of Ni (NO3)2 6H2O precursor was dissolved in deionized water, which is equal to the pore volume of support (γ-Al2O3) and then added to support by incipient wetness impregnation to obtain the desired Ni loading (10 wt% Ni). The impregnated support was then transferred into a porcelain crucible and kept in an oven for drying at 110 °C for 12 h in static air. The dried catalyst was calcined in static air at 600 °C for 5 h in a muffle furnace with a temperature ramp of 1 °C/min. For the bimetallic catalysts, the same procedure was followed, bimetallic Ni-Cu/Al2O3 catalysts were also prepared by conventional co-incipient wetness impregnation method. The required amount of both Ni (NO3)2·6H2O and Cu (NO3)2·2.5H2O were used as metal-precursors to obtain a nominal metal (Ni + Cu) loading of 10 wt.%. The Ni: Cu atomic ratio was fixed to 3:1(higher Cu loading), 8:1(medium Cu loading) and 10:1 (Lower Cu loading), respectively. After mixing the precursor aqueous solutions with the γ-Al2O3, the mixtures were then dried at 110 °C for 12 h. The dried catalyst was then subjected to calcination in static air at 600 °C for 5 h in a muffle furnace with a temperature ramp of 1 °C/min. In this report, we have denoted the three bimetallic catalysts as Ni3Cu1/Al2O3 (Ni/Cu atomic ratio = 3/1, ‘high’ Cu loading), Ni8Cu1/Al2O3 (Ni/Cu atomic ratio = 8/1, ‘medium’ Cu loading) and Ni10Cu1/Al2O3 (Ni/Cu atomic ratio = 10/1, ‘low’ Cu loading). 2.2 Characterization The fresh and spent catalysts were characterized with various techniques (BET-SA, H2-TPR, XRD, CO pulse chemisorption, O2-TPO, SEM, TEM, and TGA-DSC) and the technical information can be found in the supplementary information document (ESI-Section1). 2.3 Activity test CO2 reforming of methane was examined in a Microactivity-Efficient benchtop reactor (Micromeritics) using a vertical quartz reactor (i.d. 9 mm) at atmospheric pressure. For tests of catalytic activity and stability, the reaction was carried out at 650 °C for 10 h over 5.5 mg of catalyst and 100 mg SiO2 diluent. 10 % CH4/10 % CO2/80 % He (reactant gas), and hydrogen (reducing gas) were purchased and used as-is from National Industrial Gas Plants, Qatar. Before reaction, the catalyst was reduced in-situ with pure H2 (50 ml min−1) at 650 °C for 1 h. Subsequently, the catalyst was cooled down to the targeted reaction temperature in Helium before the introduction of reactant gas. The composition of reactant gas was (10 %CH4:10 % CO2: 80 %He), and the total flow rate was 30 ml min−1. The effluent gas was online analyzed by a Cirrus 2 Mass spectrometer (MKS Instruments). 2.4 Density functional theory In this section, we clearly outline the methodology employed in the DFT calculations section of the current work. All the calculations reported in this work were performed using the Vienna Ab Initio simulation package (VASP) code [30–33]. Blöchl’s all-electron-like projector augmented wave (PAW) method [34,35] was used to treat the interactions between the ion cores and the valence electrons. The generalized gradient approximation (GGA) functional with the revised form of Perdew-Burke-Ernzerhoff (RPBE), as revised by Hammer et al., was used to describe the exchange-correlation [36]. The RPBE functional has been observed to be more accurate than the other functionals such as PW91 or PBE in calculating heats of adsorption on nickel for molecules relevant in the reforming reactions [37,38]. The wave functions at each k-point are expanded with a plane-wave basis set with a kinetic energy cut-off of 400 eV. Brillouin zone sampling of the surface slabs was performed using a 3 × 3 × 1 grid generated via the Monkhorst-Pack scheme [39]. The Methfessel-Paxton smearing method of first-order is employed to determine the electron occupancies with a smearing parameter σ of 0.2 eV [40]. The presence of a magnetic element (Ni) in the systems studied in this work warrants the inclusion of the spin polarization effects in these calculations, which are properly addressed in this work. Earlier DFT works on Ni have demonstrated the necessity to account for surface magnetism for an accurate quantitative description of the total energies [41]. The convergence criteria for the electronic degrees of freedom is converged when the energy differences of the consecutive steps in a normal geometry optimization calculation is less than 10−4 eV, whereas for transition state calculation:10-6 eV. The convergence of forces is assumed to be achieved when the forces acting on atoms is less than 0.01 eV/Å in all the calculations. Dimer method [42,43] has been employed to obtain the geometries of transition states. The transition state structures are assumed to be converged if the forces acting on the atoms are all less than 0.01 eV/Å for the various degrees of freedom set in the calculation. The adsorption energy, Eads , is calculated as: (4) Eads = E ( adsorbate / slab ) − Eslab − Eadsorbate where Eadsorbate/slab is the total energy of the slab model with adsorbate; Eslab is the total energy of the bare slab model; Eadsorbate is the total energy of the isolated adsorbate obtained by putting it in a 20 × 20.5 × 21 Å box. In this study, slab models are used to represent the Cu/Ni bimetallic catalyst. The Cu/Ni alloy is represented as a ‘surface alloy,’ motivated by the reported experimental observation (that copper prefers to segregate on the surface in a Cu/Ni system [17–19,44,45]. In this study, the (111) orientation of this lattice was chosen due to its abundance in nickel-based alloys. A four-layer slab with a p(3 × 3) supercell repetition is used to model a Ni (111) surface. To avoid the interactions between the neighboring unit cells, the two z-direction neighbors are separated by a vacuum of approximately 7 layers, which comes to a distance of around 14.25 Å. The Cu/Ni (111) surface alloy was then constructed by replacing varying amounts of nickel atoms with a similar number of copper atoms. Three different Cu-Ni slab models were developed. (a) High coverage CuNi (with 1/9 ML (Monolayer) of Cu on Ni) to represent the high copper content experimental catalyst, Ni3Cu1/Al2O3, (b) Medium coverage of Cu-Ni (with 1/3 ML of Cu on Ni) to represent the medium copper content catalyst, Ni8Cu1/Al2O3, and (c) Low coverage Cu-Ni (1/9 ML coverage of Cu on Ni) to represent the low copper content catalyst, Ni10Cu1/Al2O3. The results on these slab model surfaces are compared with the pure Ni surface. The developed slab models are provided in supplementary information (Figure S1). Unless otherwise specified, the bottom-most layer in the slab models was constrained at its bulk position while the top three layers and its adsorbates were allowed to relax during geometry optimization and transition state (TS) search. 2.5 Measurements of deactivation rates on Ni and Ni-Cu catalysts The generalized power law expression (GPLE) can be used to model the catalyst deactivation regimes such as activity loss due to sintering and coke deposition for different catalytic systems [46–48]. In this work, the GPLE has been applied to compare the catalyst deactivation behavior in the mono-metallic (Ni/γ-Al2O3) and bi-metallic (Ni-Cu/ γ-Al2O3) systems for DRM reaction. The underlying assumptionα in the GPLE model is that the catalyst activity will reach a steady-state activity (SSA) after a long time on stream (TOS) and the activity can be expressed as follow: (5) − d a d t = k d f ( c ) d ( a − a s s ) d where a is the normalized activity, kd is the deactivation constant, d is the order of the deactivation, f(c)d represents the kinetic function that depends on the concentration and ass indicates the SSA. The normalized form of the deactivation equation for first-order GPLE is: (6) a(t) = (1 −ass ) exp(−k 1 t) + ass while for the second deactivation rate: (7) a(t) = (k 2 t + (1 −ass )−1)−1 + ass Quantities assessment of the deactivation caused due to sintering and carbon deposition can be conducted if the activity data fit well to the first or second GPLE [48]. Accordingly, we used the nonlinear least-squares regression in Microsoft Excel to estimate the model parameters. A more detailed discussion on the calculation steps can be found in the supplementary material (ESI, Section 2). 3 Results and discussion 3.1 Textural characterization of fresh catalysts All the fresh calcined catalysts’ textural properties are presented in Table 1 . The bare support γ-Al2O3 has a BET-SA of 153 m2/g and an average pore volume of 0.88 mL/g. In comparison, the metal loaded catalysts have a lower surface area and pore volume compared to bare γ-Al2O3, which could be due to the high metal content (10 wt.%). Ni and Cu particles might block the pores of γ-Al2O3 during metal impregnation, which results in the slight decrease of the pore volume of catalysts. Moreover, when the three bimetallic catalysts Ni10Cu1/Al2O3, Ni8Cu1/Al2O3, and Ni3Cu1/Al2O3 were compared, it was observed that the surface area and the pore volume had very similar values, which makes sense theoretically because the total metal loading was similar in all the catalysts. 3.2 H2-temperature programmed reduction (TPR) Fig. 1 shows the H2-TPR profile of fresh calcined monometallic Ni and Nix-Cu bi-metallic catalysts supported on γ-Al2O3. The monometallic Ni/γ-Al2O3 (Fig. 1(a)) exhibited broad multiple reduction peaks in the range from 500 °C to 800 °C. The low-temperature reduction peak at 570 °C corresponds to NiO weakly interacting with the support (‘bulk NiO’), and the high-temperature range peaks to strongly interacting NiO and NiAl2O4 species. The presence of multiple reduction peaks may be attributed to the presence of different NiOx species produced as a result of varying interactions with γ-Al2O3 [13]. Whereas amongst all the bimetallic Ni-Cu catalysts, the higher Ni: Cu atomic catalyst, i.e., Ni3Cu1/Al2O3, (Fig. 1(d)) exhibits three significant reduction peaks, The peak at relatively low temperature 204 °C can be ascribed to the reduction of bulk CuO [49]; the peak located at 400 °C can be assigned to the reduction of NiO that is strongly interacting with CuO; the reduction peak above 730 °C can be assigned to the reduction of NiAl2O4 species [13]. It is interesting to note that the low-temperature peak at 240 °C in the high Cu-loaded catalyst (Fig. 1(d)) disappears as Cu loading decreases (Fig. 1(b) and(c)), implying the complete incorporation of Cu2+ into the NiO framework via NiCu alloy formation [50,51]. Furthermore, the high-temperature peaks (> 700 °C) in the mono-metallic Ni catalysts appear to have decreased in intensity and shifted to lower temperatures, signifying the effect of Cu addition on decreasing the formation of nickel aluminate spinel. These observations are corroborated with reported literature [52]. The obtained results indicate that the difference in the reduction behavior mainly depends on metal-support interaction and metal-metal interactions in the case of alloys. 3.3 XRD analysis of fresh calcined and reduced catalyst samples XRD patterns of fresh calcined samples are provided in the supplementary information (Figure S2). The XRD pattern of calcined monometallic Ni/γ-Al2O3 has prominent diffraction peaks at 2θ = 37.2°, 45.5°, 60.2°, and 66.6° which can be attributed to a mixture of both NiAl2O4 and γ-Al2O3 phases. The reflections at 2θ = 43.3°, 66.9°, and 75.4° are assigned to the fcc NiO [53,54]. The average crystallite size, as calculated by the Scherrer equation, is 10 nm. The calcined bimetallic NiCu catalysts also show peaks in very similar 2θ positions. However, broader NiO diffraction peaks were also observed at 2θ = 43.3°, 64.3° and 75.3° corresponding to an average crystallite size of 6.5 to 8.4 nm which is lower than that for the monometallic catalyst (Table 1). One possible explanation is that CuO may help stabilize the NiO via the formation of a NiO-CuO solid solution during calcination, thus preventing agglomeration and formation of larger crystallites. Both CuO and NiO have similar lattice structures and can, therefore, readily form a homogenous NiO-CuO solid solution [55,56]. This solid solution subsequently transforms into a Ni-Cu alloy on H2 reduction and plays a crucial role in enhancing the performance as well as the stability of the catalyst. No apparent crystalline phases due to CuO, Cu2O, or other Cu related phases are detected probably due to the copper percentage being lower than the X-ray detection limits, or it might because the particles are in an amorphous state. It is worth noting that the diffraction peak intensities corresponding to NiO (2θ = 43.3°, 64.3°, and 75.3°) decrease while peak intensity at 45.5° increases on increasing Cu addition. This is suggestive of a decrease in bulk NiO and a rise in the formation of NiO-CuO solid solution formation, which in turn stabilizes NiO and prevents the formation of larger crystallites during calcination. XRD patterns of reduced monometallic and bimetallic catalysts are shown in Fig. 2 . Reflections at 2θ = 44.4° and 51.7° are attributed to metallic Ni-Cu alloy along with metallic Ni, Al2O3, and NiAl2O4 phases [57]. The Cu modified catalysts have a smaller crystallite size of 7−10 nm, while that of the monometallic catalyst is slightly larger at 11 nm, indicating that Ni-Cu alloy formation during reduction stabilizes the crystallites and minimizes agglomeration. These results also validate the assignment of lower temperature H2-TPR peaks of the Ni-Cu/Al2O3 catalyst to strong Ni-Cu interactions. 3.4 Transmission electron microscopy (TEM) TEM analysis for both Ni/Al2O3 and Ni8Cu1/Al2O3 catalysts was performed to measure differences in particle sizes between the reduced monometallic Ni and bimetallic catalysts and to confirm the formation of Ni-Cu alloy. Fig. 3 depicts representative TEM, HR-TEM, HAADF-STEM images, and elemental maps of the reduced monometallic Ni/Al2O3 catalyst. Fig. 3(a) shows two kinds of Ni particles, both segregated and well dispersed on the surface. The HR-TEM image of monometallic Ni/Al2O3 (Fig. 3 (b–c))illustrates lattice fringes with an inter-fringe distance of 0.20 and 0.183 nm, corresponding to the (111) and (200) planes of metallic Ni [58]. Ni particle dispersion was also observed by high-angle annular dark-field scanning transmission electron microscopy (HAADF-STEM) (Fig. 3(d)). A bi-modal particle size distribution plot is observed in Fig. 3(e) alluding to the presence of both smaller, well-dispersed particles as well as larger metal agglomerates. The particles range from 2 to 16 nm in diameter with an average size of 9 nm. In addition, the elemental distribution of Ni and Al, obtained by Energy-Dispersive X-Ray Spectroscopy (EDS) (Fig. 3(f–h)), shows the spatial distribution of Ni particles on the support. Fig. 4 shows representative STEM and HAADF-STEM images for the reduced Ni8Cu1/Al2O3 catalyst, chosen on account of its higher DRM activity, as described in section 3.6.1. Fig. 4(a–e) illustrates the TEM and HRTEM images of a representative Ni-Cu alloy nanoparticle with an inter-fringe distance of 0.219 and 0.164 nm, corresponding to (111) and (200) planes of Ni-Cu alloy [59,60]. From the frequency-size distribution (Fig. 4(f–g)), it is apparent that the metal particles are in the range of 1 to 8 nm with a mean diameter of 4 nm, which is much lower than for the mono-metallic Ni catalyst. The elemental distribution of Cu and Ni, obtained by Energy-Dispersive X-Ray Spectroscopy (EDS) (Fig. 4(h–j)), shows the overlapping spatial distributions of both Ni and Cu. This is evidence that Cu is completely incorporated into the Ni lattice, resulting in distinct Ni-Cu alloy particles [60], agreeing with XRD results. This observation is significant as it directly affects the electronic properties of the active Ni-Cu center, which in turn enhances the catalytic performance. 3.5 CO chemisorption CO chemisorption was performed to measure the percentage of active sites exposed on the surface in terms of metal dispersion. The metal dispersion is calculated based on the moles of CO consumed to saturate the surface; in addition to summarizing the physicochemical properties of the calcined and reduced catalysts. Table 1 presents the CO chemisorption results of the reduced Ni and Ni-Cu bimetallic catalysts. Contrary to expectations, the monometallic Ni catalyst provided the highest metal dispersion (8 %), while the bimetallic Ni-Cu catalysts showed lower metal dispersions of 2.5 %, 3 %, and 6 %. Since Cu cannot chemisorb CO [49], it is possible that the Cu-Ni alloy formed suppresses CO chemisorption [61]. The dispersion also decreases with increasing Cu content, an anomaly that may be attributed to the segregation of Cu to the surface at higher loadings. These segregated Cu clusters further lower the amount of CO that can be adsorbed, resulting in the abnormally lower estimates for metal dispersion. 3.6 Catalytic performance study for dry reforming of methane The performance of the prepared catalysts was tested for DRM reaction at 650 °C to investigate the effect of Ni/Cu atomic ratio on the activity and stability of bimetallic Ni-Cu/Al2O3 catalysts. The intermediate reaction temperature allows for deactivation via coke formation as well as sintering, which permits investigation into the influence of Cu addition on mitigating them. The apparent reaction rates of CH4 and CO2 (mol/min/gNi) and H2/CO ratio are presented in Fig. 5 (a–c). For the monometallic Ni/Al2O3 catalyst, a higher CH4 conversion rate of 0.125 mol/min/gNi and a CO2 conversion rate of 0.144 mol/min/gNi was observed, with an H2/CO ratio of 0.78. As is typical for DRM, the CO2 conversion rate exceeded that of CH4with the H2/CO ratio < 1. This is expected, since the reverse water gas shift side reaction is also active at this temperature, consuming CO2 and H2 to produce CO and H2O. After 10 h time on stream, the reaction rates declined to 0.08 mol/min/gNi for CH4 and 0.09 mol/min/gNi for CO2. Additionally, the H2/CO ratio dropped to 0.61, signifying a gradual decline in catalyst activity. For Ni reforming catalysts, sintering is typically presumed to occur within the first few hours of reaction, after which the contribution of coking to deactivation exceeds that of sintering. In the case of sintering, weak metal-support interactions and formation of larger particles by atomic or crystallite migration can form larger Ni particles. These larger particles are susceptible to deactivate more severely by carbon formation, since graphitic carbon formation is structure sensitive and occurs readily on crystallites above a critical size [62]. Compared to the mono-metallic Ni catalyst, the addition of Cu has a perceptible effect on catalyst activity. Among the three bi-metallic catalysts prepared, the ‘medium’ Ni/Cu atomic ratio, Ni8Cu1/Al2O3, displayed the highest activity and stability, maintaining almost constant CH4 and CO2 conversion rates of 0.20 and 0.23 mol/min/gNi respectively. The catalyst with the lowest Ni/Cu atomic ratio, Ni10Cu1/Al2O3, maintained a lower CH4 consumption rate of 0.16 mol/min/gNi later declining slightly to 0.14 mol/min/gNi over 10 h Time-onStream (TOS). In addition to a lower rate of deactivation, the bimetallic catalysts with ‘lowest’ and ‘medium’ Cu content exhibited better, and more importantly, stable, H2/CO ratios than the monometallic Ni catalyst. As will be explained in section 3.8, DFT simulations show that the rate of carbon gasification is higher than the rate of formation of surface-adsorbed carbon, producing this stable H2:CO rate. Another reason behind the sustained activity of this ‘medium’ Cu catalyst could be the formation of a Ni-Cu alloy as evidenced from its TPR profile (Fig. 1) and STEM-EDS mapping (Fig. 4) which limits the extent of coking compared to the mono-metallic Ni catalyst. It is worth noting that the TEM results indicate a much lower average particle size for the reduced bimetallic catalyst (Table 1), which indicates improved active phase dispersion and therefore, better coke-resistance. Interestingly, the catalyst with ‘highest’ Cu content, Ni3Cu1/Al2O3 catalyst (Ni:Cu atomic ratio 3:1), showed significantly reduced conversion rates compared to not just the other Ni-Cu catalysts, but even to the monometallic Ni one. A higher amount of copper suppresses DRM catalytic activity almost wholly, an observation also corroborated by previous investigations on Ni-Cu/Al2O3 and Ni-Cu/SiO2 catalysts [28,63]. The excess Cu is likely migrating to the surface due to its lower surface energy compared to Ni, resulting in a Cu-enriched Ni-Cu alloy surface [24]. This surface enrichment may lead to a decrease in the number of Ni sites on the surface that are active for DRM, thus limiting the catalytic activity. Low amounts of Cu dopant (Ni:Cu = 10:1), on the other hand, appear to be insufficient in improving the stability of the Ni catalyst. The quantity of Cu is not enough to mitigate Ni sintering via alloy formation. Thus, unlocking the synergistic effect between Ni and Cu requires careful tuning of the atomic ratios on the surface and not merely within the bulk. The importance of surface-alloy formation is also evident from the 70 -h stability tests, as discussed in the next section. 3.6.1 Catalyst stability test To investigate catalyst stability, the monometallic and the best-performing ‘medium Cu’ Ni8Cu1/Al2O3 bimetallic catalysts were tested for DRM over 70 h at 650 °C. The rates of CH4 and CO2 consumption are presented in Fig. 6 (a, b), while Fig. 6(c) compares the syngas ratio of H2/CO. Significant deactivation is observed on monometallic Ni/Al2O3, with a linear decrease in the CH4 and CO2 conversion rates and H2/CO ratio; as discussed previously, this may likely be due to coke deposition and sintering of the Ni metal particles. After 70 h of DRM reaction, the CH4 conversion rate decreased from an initial 0.12 to 0.012 mol/min/gNi while the CO2 conversion rate decreased from 0.14 to 0.02 mol/min/gNi. In contrast, the bimetallic Ni8Cu1/Al2O3 catalyst sustained a much higher activity over 70 h, with CH4 and CO2 conversion rates decreasing slightly from 0.20 to 0.16 mol/min/gNi, and 0.21 to 0.17 mol/min/gNi respectively. As discussed earlier, the excellent stability of this Ni8Cu1/Al2O3 catalyst may be attributed to the smaller particle size and the formation of a Ni-Cu alloy which retards both active metal sintering and carbon formation. It is interesting to note that the H2/CO ratio is nearly constant over 70 h DRM despite the decline in CH4 and CO2 conversion rates; this demonstrates the ability of the bimetallic catalyst to suppress undesired side reactions like the Reverse-Water-Gas-Shift (RWGS) and the coke-forming Boudard reaction. These results once again demonstrate the role of an ‘optimal’ Ni:Cu atomic ratio in keeping the alloy structure intact. As seen from the previous section, an excess of Cu can be counter-productive, as Cu (not active for DRM) can precipitate to the surface during the reaction and lower the presence of exposed Ni. Controlling catalyst synthesis consequently goes a long way in obtaining a surface composition that promotes Ni-Cu synergism, which in turn, minimizes carbon deposition and enhances removal, producing a stable H2/CO ratio. A DFT investigation into the effect of such Ni-Cu surface alloys of specific compositions provides further insight and is discussed in the next section. 3.7 Effect of Ni-Cu alloy formation on suppressing coke 3.7.1 Powder XRD analysis From the X-Ray diffractograms of the spent Ni and ‘medium Cu’ Ni8Cu1 catalysts (Figure S3, ESI), an additional diffraction peak was observed at 2θ = 26.6° for both catalysts, along with the expected reflections. This reflection was assigned to graphitic carbon, accumulated on the surface of the spent catalyst [52]. On comparing the carbon peak intensities, it is obvious that Ni/Al2O3 catalyst deactivated faster as a result of a higher degree of coking than the Ni-Cu catalyst, indicating that the bimetallic Ni8Cu1/Al2O3 catalyst exhibits better coke resistance than its monometallic counterpart. No attempt was made to measure crystallite size via the Scherrer equation due to a lower signal: noise ratio of the PXRD pattern. Another important observation is that the shape of the characteristic Ni-Cu alloy peak at 2θ = 44.4° remains largely intact, indicating that the Ni-Cu alloy formed is structurally stable. 3.7.2 O2-TPO analysis over coked-catalysts To understand the differences in the nature of carbon formed on the mono and bi-metallic catalysts O2-TPO was performed over the used catalysts after 70 h DRM (Fig. 7 ). The TPO profiles of the catalysts run for 10 h TOS is given in Figure S4. In Fig. 7, the presence of a predominantly graphitic-type of carbon is observed on the monometallic Ni catalyst as evidenced from the intense CO2 peak at 650 °C, produced as a result of the oxidation of deposited coke. Especially in reforming, graphitic forms of deposited carbon typically encapsulate the active metal sites and therefore deactivate them [64]. In the case of the bimetallic catalysts, the TPO curve peaks at a much lower 590 °C, due to the lower energy required for oxidation. This indicated that the type of carbon formed in the bimetallic catalyst is predominantly amorphous (filamentous/polymeric) and is highly reactive. Furthermore, the amount of coke accumulated in the spent Ni8Cu1/Al2O3 is notably lower than in the spent Ni/Al2O3, as inferred from the areas under the TPO curves. The rate of coking for the monometallic catalyst is 1.19E-03 mg C/h/gcat, much higher than for the bimetallic catalyst at 4.21E-04 mg C/h/gcat. This indicates that Cu plays a vital role in effectively minimizing coke formation. These results agree well with the XRD analysis of the spent catalysts. 3.7.3 TEM and SEM analysis To further investigate the morphology and the nature of carbon formed on the used catalysts, TEM analysis was performed on monometallic Ni/Al2O3 and ‘medium Cu’ bimetallic Ni8Cu1/Al2O3 catalysts after 10 h DRM reaction (Figs. 8 and 9 ). Various forms of carbon are seen deposited on the surface of the Ni/Al2O3 catalyst (Fig. 8(a, b)): multi-walled carbon nanotubes, nano-onions, and other filamentous structures. Of the nanotubes formed, some of them had Ni particles at the tip or embedded within the closed-end tube, while the others lacked any apparent Ni crystallite. Carbon nanotubes (CNTs) keep growing from the Ni surface resulting in the degradation of the active structure and eventually lead to total deactivation of the catalyst [65]. While CNTs do not immediately lead to catalyst deactivation, graphitic forms of carbon cause rapid deactivation by encapsulating active sites. A representative HR-TEM image in Fig. 8(c) clearly shows a Ni particle entrapped in the encapsulating carbon onion. High-angle annular dark-field scanning transmission electron microscopy (HAADF-STEM) image (Fig. 8(d)) further highlights Ni particles, identified as bright spots, trapped either within graphitic carbon nano-onions or in CNTs. Calculating the average Ni particle size from TEM indicates that the Ni size was left mostly intact, with only a slight increase from 9 to 9.4 nm. It has been reported that the primary reason for the deactivation of a Ni/Al2O3 catalyst is carbon deposition during DRM on the catalyst surface [66]. Scanning-transmission electron microscope high-angle annular dark-field (STEM-HAADF) image of Ni, Al, and C clearly shows (Fig. 8(e–g)) how carbon deposition detaches Ni particles from the support either via CNT growth or via graphitic carbon encapsulation. The overlaid EDS images of Ni, Al, and C are shown in Fig. 8(h). Fig. 9(a) shows a representative TEM image of ‘medium Cu’ bimetallic Ni8Cu1/Al2O3 catalyst. Interestingly, except for some amorphous carbon, neither CNTs nor encapsulating graphitic carbon forms were observed on the bi-metallic catalyst even after 10 h of the DRM reaction. It is likely that the carbon, initially deposited on the bimetallic surface, is active and readily oxidized by CO2 via a lower energy pathway [67]. The carbon thus formed is expected to be amorphous, minimizing the formation of structured graphitic carbon, which can deactivate the catalyst. The HR-TEM images (Fig. 9(b–c)) also validate the homogeneous, alloy nature of the dispersed Ni-Cu nanoparticles. A lattice fringe spacing of 0.21 is measured for the active particle, consistent with (111) planes of Ni-Cu alloys [59]. After 10 h of DRM reaction, this inter-fringe distance remains the same (Fig. 9(c)), indicating that the Ni-Cu alloy is intact and plays a critical role in suppressing the coke formation specifically the formation of graphene-like layers that eventually lead to CNTs and encapsulating carbon nano-onions [68]. Scanning-transmission electron microscope high-angle annular dark-field (STEM-HAADF) image of the used Ni8Cu1/Al2O3 (Fig. 9(d)) reveals particles in the range of 2–14 nm (mean - 7.2 nm), indicating that the Ni particle grew from 4 to 7.2 nm after DRM reaction. These results strongly suggest particle sintering as the primary contributor to deactivation, as opposed to significant carbon deposition in the mono-metallic Ni catalyst. STEM-HAADF image of Cu and Ni and the overlaid image (Fig. 9(e–h)) reveal that the Cu and Ni atoms comprising the active nanoparticles were homogeneously dispersed and supports the formation of the Ni-Cu alloy phase. These results strongly suggest that the Ni-Cu alloy nanoparticles were formed with high phase purities, which is consistent with the XRD results. The overlaid STEM-HAADF images of Ni and Cu (Fig. 9(h)) coincide well with each other further confirming the retention of the Ni-Cu alloyed phase even after the DRM reaction. Scanning Electron Microscopy (SEM) analysis has been performed over the fresh (Figure S5) and deactivated catalysts (Figure S6). Both the supported monometallic and bimetallic fresh, calcined catalysts exhibit similar morphological features and as such were indistinguishable from each other. However, after 70 h TOS activity and durability test at 650 °C, there are obvious differences in the morphologies in the used catalysts. Figure S6(a) shows the SEM images of used monometallic Ni/Al2O3 catalyst, exhibiting a large amount of coke deposition in the form of carbon nanofibers/CNTs. The CNTs, in combination with graphitic carbon (not seen in the figure), produce catalyst deactivation with time on stream via gradual encapsulation of the Ni active sites, and pore–blockage. These forms of carbon require higher temperatures to be oxidized, as evidenced by O2-TPO, implying they are more recalcitrant, and therefore cause faster deactivation. On the other hand, the SEM micrograph of the bimetallic Ni8Cu1/Al2O3 catalyst (Figure S6(b)) indicates that coverage of the catalyst by carbon has occurred to a much lower extent. On the surface is what appears to be a more amorphous type of carbon, which is more reactive and can be eliminated readily. These findings correlate well with the conclusions drawn from XRD and O2-TPO analysis. 3.7.4 TGA-DSC analysis of spent catalyst To quantify the coke formed on the used catalysts and identify the nature of carbon present, ThermoGravimetric Analysis (TGA), coupled with Differential Scanning Calorimetry (DSC), was performed. Fig. 10 (a) displays the TGA profiles of the used monometallic Ni/Al2O3 and bimetallic Ni8Cu1/Al2O3 catalysts after 10 h of DRM at 650 °C. As discussed in section 3.7.2, the temperature required for oxidation corresponds to the type of carbon species involved, and DSC provides this information in terms of heat flow per gram sample as a function of temperature (W/g°C, Fig. 10(b)). Based on the literature, the carbon forms may be classified in terms of oxidation temperature as (a) highly reactive activated carbon species that oxidize at low temperatures (<350 °C); (b) the amorphous carbon and carbon nano-filaments/fibers/CNTs that oxidize between 350−550 °C; and (c) non-reactive graphitic carbon species that oxidize at higher temperatures of >650 °C [27,69]. As depicted in Fig. 10(a), the monometallic Ni/Al2O3 catalyst shows a significant weight loss (43 %) in the range of 550−700 °C, probably due to oxidation of both filamentous and non-reactive graphitic carbon, which severely degrade catalyst performance. In contrast, the bimetallic Ni8Cu1/Al2O3 catalysts display a much lower weight loss of 6.4 %, suggesting that the quantity of filamentous and graphitic carbon formed is minimal, in agreement with XRD and O2-TPO results. It has been demonstrated that a catalyst with smaller metal-particles and higher dispersion typically possess stronger metal-support interactions [70,71], which minimizes coke deposition. These results are consistent with the SEM results shown in Figure S6. Fig. 10(b)presents the DSC profiles of the used Ni/Al2O3 and Ni8Cu1/Al2O3 catalyst after 10 h of DRM reaction. Contrary to its TPO profile, the monometallic Ni/Al2O3 displays two exotherm peaks - one at 636 °C and the other at 707 °C, indicating that at least two types of carbon species were formed. The stronger exotherm at 636 °C may be assigned to the oxidation of filamentous carbon, and the peak at the higher 706 °C might be due to oxidation of graphitic carbon [66,67,72]. This temperature range overlaps relatively well with that observed via TGA. The bimetallic Ni8Cu1/Al2O3 catalyst, on the other hand, has a single exothermic peak at an intermediate temperature of 675 °C, likely corresponding to the oxidation of a combination of amorphous and filamentous carbon. These results are in good agreement with the SEM and O2-TPO analysis. By this point, it is quite apparent that the bimetallic Ni8Cu1/Al2O3 catalyst is relatively more stable than its mono-metallic counterpart, able to impede coke deposition significantly via the addition of a small amount of Cu. This analysis is further validated in the next sections via ab-intio DFT simulations as well as computational modeling of the catalyst deactivation profile. 3.8 Investigating the role of Cu on the bimetallic Ni-Cu system via density functional theory calculations In the current work, DFT calculations have been used to gain insights into the enhanced catalytic activity of Ni/Cu alloy bimetallic catalysts. The adsorption of carbon on the surface slab models with varying amounts of copper is studied as a first step. Adsorption energies of the reaction intermediates on a particular catalytic surface quantify the affinity of this intermediate towards this surface. In particular, the C adsorption energy on a specific surface could be used to evaluate the affinity for coke formation of this surface. A lower C adsorption energy on a catalyst surface implies a lower surface coverage of C from a thermodynamic point of view. Therefore, it can be claimed that this surface leads to a lower tendency for carbon deposition and improvement of the coke resistance of the catalyst. Table 2 lists the adsorption energies of carbon on various surfaces as well as the most stable adsorption sites. It was observed that the carbon atom preferred to adsorb on the three-fold hollow sites. According to the definition used to calculate adsorption energies, more negative adsorption energy implies stronger adsorption of the intermediate to the surface. Stronger adsorption of carbon, therefore, implies that the surface has a higher tendency for coke deposition. As can be seen from Table 2, carbon adsorbs most strongly on the monometallic (pure) Ni (111) surface with an adsorption energy of -7.50 eV, indicating its higher tendency towards coke deposition. We observe that as the amount of copper dopant amount increases, the carbon adsorption energies (in other words, the coking tendency of a particular surface) decreases from -6.98 eV for the low copper loading catalyst to -5.62 eV for high-copper loading catalyst. Thus, as far as the coking affinity of the surface is concerned, the surface with 1.0 ML copper coverage (high copper loading) is observed to have the least tendency for coking amongst all catalysts studied with a carbon adsorption energy of only -5.62 eV. These favorable carbon adsorption energies provided the impetus to investigate activation barriers for the step-wise dehydrogenation of methane in the DRM reaction. Fig. 11 compares the reaction energy profile for the steps involved in CH4 dehydrogenation on a pure nickel surface to that of the high Cu loading (1.0 ML) and medium Cu loading (1/3 ML) systems. As can be seen from the figure, the reaction energy barriers for the dehydrogenation steps are prohibitively high for the DRM reaction to sustainably proceed for long reaction times. In the case of pure Ni and ‘medium’ Cu-loaded systems, the relative barriers of all intermediates such as CH3*+H*, CH2*+2H*, CH*+3H*, and C*+4H* are of the order of 0.5–1.0 eV. In contrast, the relative energy barriers of these intermediates on the high Cu loading system is much more endothermic, of the order of ∼2.0–4.0 eV. Thus, while Table 2 may indicate that the high Cu loading is better in terms of resisting carbon formation, the activation barriers for CH4 dehydrogenation on this system (shown in Fig. 11) are relatively very high that it is rather difficult for the reaction to proceed. We also observe from this figure that the activation barriers for the step-wise dehydrogenation of methane in the case of 1/3 ML medium copper loading are very comparable to those of pure Ni. Moreover, while the individual barriers for CH4 dehydrogenation are high enough to reduce the total amount of carbon that can be deposited, they are not high enough for the reaction to not proceed. Of particular interest in the medium Cu loading of 1/3 ML is the activation barriers for the carbon formation as well as carbon ‘elimination’ or gasification (to CO) reactions. The activation barriers for carbon formation reaction through CH dissociation CH* → C* + H* are plotted for the ‘medium Cu’ system in Fig. 12 (a) and carbon elimination via oxidation with oxygen to form CO, C* + O* → CO* in Fig. 12(b). In both of these figures, we have not included the barriers for the ‘high Cu’ coverage system. The reason for this is the extremely thermodynamically unfavorable nature of CH intermediate, as can be observed from Fig. 12. Similarly, the barrier for C gasification is too high for this reaction to proceed. From the Fig. 12(a), we see that the activation barrier for CH* dissociation reaction to form atomic carbon and hydrogen is of the order of 1.41 and 1.45 eV for the pure Nickel system and ‘low Cu’ coverage system, respectively. For the system with ‘medium’ coverage of Cu, the barrier for carbon formation is increased to 1.89 eV, a significant increase of almost 0.45 eV. As the final step in the dehydrogenation of methane, the dissociation of CH to elemental C is expected to be the major contributor toward catalyst deactivation by coking. Thus, it can be concluded from the DFT calculations of Cu-Ni slab models that the activation barrier for carbon formation on ‘medium’ coverage Cu-Ni is considerably increased, rendering it comparatively difficult for carbon deposition to take place on this system. Similarly, in Fig. 12(b), the barriers for carbon elimination via gasification from the surface oxidation with O2 to form CO is depicted for pure, ‘low’ and ‘medium’ coverage systems. It is observed that the barrier for carbon elimination is considerably lowered to 0.53 eV for medium Cu doped system when compared to low Thus, carbon formation (via the dehydrogenation of methane) is suppressed on Cu/Ni surfaces, while the capacity for carbon gasification to CO is enhanced considerably. This observation is in line with previous DFT studies on Cu/Ni bimetallic catalysts [73–75]. In their work, Zhang et al. [73] modeled two types of Cu/Ni catalysts: (1) Homogeneous (1:1) Cu/Ni system and (2) surface Cu enriched (segregated) Cu/Ni system. They have observed that carbon deposition is inhibited, and carbon elimination accelerated on segregated Cu/Ni bimetallic alloy. Previously, Liu et al. [74,75] have shown that carbon formation through CH4 dissociation is suppressed on segregated CuNi(111), but promoted on homogeneous CuNi(111). These results, in conjunction with those of the current study, imply that not only is the amount of copper important in minimizing coke deposition but the specific structural arrangement of Ni and Cu on the surface, which promotes synergistic Ni-Cu interaction. Having established the existence of Cu/Ni experimentally by TPR, STEM, and XRD in the catalyst, DFT goes a step further to provide atomistic-level insight into how Cu addition promotes carbon removal, while simultaneously minimizing carbon deposition – which is the objective of the investigation. In summary, DFT demonstrates that increasing Cu loading produces a trend in catalytic activity. Adding 1/9 ML Cu (“low Cu”) has a negligible effect on carbon deposition and removal to CO, compared to the pure Ni surface. On the other hand, higher Cu loading (1 ML) prevents C deposition as it retards CH4 dehydrogenation, meaning, DRM cannot proceed favorably on this surface. Thus, DFT calculations can indicate precisely why the ‘medium Cu’ sample (Ni:Cu-8:1) is a better compromise between the low and high Cu loaded systems. 3.9 Measuring the extents of sintering/coking via deactivation profile modeling To provide a quantitative assessment of the respective contributions of metal sintering and coking to the deactivation of the mono- and ‘medium Cu’ bi-metallic catalyst, the normalized activity data for 70 h TOS is modeled using the fitting parameters from the GPLE, as described in the supplementary information. For the mono-metallic Ni/Al2O3 catalyst, both the first and second-order GPLEs fit the experimental deactivation data quite well with R2 values of 0.98 and 0.81, respectively (Table S1). The calculated catalyst steady-state activity, ass approaches almost zero, given an infinite amount of time-on-stream for both first and second-order GPLE models (Figure S7(a)). This goes against the primary requirement in GPLE fitting that the deactivation must be asymptotic and should not reach a zero value. In this specific scenario, ass tends to zero, most probably due to the high rate of the carbon deposition, which eventually covers the catalyst surface, preventing accessibility of the reactants to the active site. For the “medium” Cu bimetallic Ni8Cu1/Al2O3 catalyst (Figure S7(b)), the ass value calculated using the second-order GPLE model for a similar TOS of 70 h was found to be at a much higher 0.615. The αααααα value predicted by the second-order GPLE model is considerably lower than the ass value of 0.725 (Table S1) calculated by the first-order model. Comparing both first and second-order fitting trends, it is apparent that the second-order model is more realistic in predicting ass value, as previously reported for other catalytic systems [48]. Having confirmed the applicability of the GPLE to model the experimental deactivation profile, the next step was to de-convolute the total deactivation into that caused by sintering and coking, respectively. From a visual appraisal of the experimental deactivation profile, it is readily evident that deactivation in the monometallic catalyst is controlled differently compared to the bi-metallic catalytic system. Therefore deconvolution was performed following the method described by Argyle et al. [48]. Fig. 13 depicts the loss of total activity as well as the fractional contribution of sintering (f 1) and coking (f 2) to the total loss via deactivation (ftot ) for monometallic and bimetallic catalyst over 70 h TOS. For the monometallic Ni/Al2O3 catalyst, the model results suggest that sintering is the dominant mode of deactivation initially, but declines to negligible values within a few hours, being surpassed by carbon deposition which ends up contributing up to >95 % (Table 3 ) of the total deactivation. These results are corroborated by the TEM, TPO and TGA analysis of the spent catalyst, as discussed in section 3.7. Attempts to determine the sintering of the catalyst in terms of dispersion loss using CO chemisorption were unsuccessful for both the mono and bimetallic spent catalysts, and so, cannot be used to validate the models’ results. In contrast to the monometallic catalyst, the deconvolution of the deactivation profile of the bimetallic Ni8Cu1/Al2O3 catalyst shows that nearly 23 % (Table 3) of the total deactivation loss is due sintering even after 70 h TOS. One has to remember that these numbers correspond to a fraction of the total deactivation which is still far lesser for the bi-metallic catalyst. Wu. et al. [59]observes that the addition of Cu promotes the sintering resistance of a bimetallic Ni-Cu catalyst supported on silica nano-sheets. This is in contrast to the current study, wherein the modeling results are suggestive of a higher sintering contribution to the deactivation of the Ni-Cu bimetallic catalyst. However, the sintering occurs to a relatively lesser degree and, from experimental testing, does not appear to impact the overall catalyst activity significantly. 4 Conclusions The addition of an appropriate amount of Cu into Ni-Cu bimetallic catalyst affords significantly improved activity (0.17 mol/min/gNi) when compared to their monometallic Ni/Al2O3 counterpart (0.012 mol/min/gNi). Additionally, the ‘medium’ Cu bimetallic catalyst yields a stable H2/CO ratio of ∼0.9 even when the activity begins to decline, while the ratio decreased rapidly for the monometallic catalyst, reaching 0.35 at the end of 70 h time on stream. Catalyst characterization by TPR reveals that Cu increases the reducibility of Ni, while XRD and TEM validate the formation of smaller bi-metallic crystallites (4 nm vs. 9 nm avg. crystallite size for monometallic Ni) and the formation of a Ni-Cu alloy. CO chemisorption indicates lower dispersion for the bimetallic catalysts, attributed to Cu’s inhibitory effect on CO adsorption. TEM results, on the other hand, show a greater dispersion for the bimetallic catalyst. XRD, TPO, SEM and TGA-DSC analysis of used catalysts confirm that the monometallic Ni deactivated rapidly primarily due to a large amount of graphitic carbon formation. In contrast, the ‘medium’ Cu loaded Ni8Cu1 catalyst produced a more amorphous or ‘active’ form of carbon, with minimal graphitic carbon formation. The experimental evidence is well supported by ab-initio DFT simulations of carbon deposition on mono-metallic Ni and bi-metallic Ni-Cu surfaces. From DFT, it is observed that the addition of Cu increases the activation energy barriers for CHx dehydrogenation to C by nearly 1.5 times and considerably decreases activation energy barrier for carbon elimination through carbon gasification for medium Cu doped system when compared to the low Cu doped system and pure Ni system. Furthermore, these results are consistent with catalyst deactivation modeling studies carried out by using the Generalized Power Law Expression. The results indicate that the rapid deactivation of the monometallic Ni catalyst is primarily due to significant coke formation whereas, the medium Cu loaded Ni8Cu1 catalyst experienced minimal deactivation owing to a higher degree of particle sintering in the initial phases, later balanced out by coke formation. The combined computational and experimental analysis presented indicate that the percent of Cu present and, more importantly, the surface arrangement of Ni and Cu atoms, i.e., surface composition, are critical for ‘optimal’ performance for DRM. The Cu content has to be high enough to allow alloying with Ni, but not high to point where excess Cu segregates and forms independent clusters on the surface of the catalyst. The combination of detailed experimental investigation and theoretical calculations in this work opens up further possibilities in the use of bi-metallic catalysts for the dry reforming of methane reaction. CRediT authorship contribution statement Anjaneyulu Chatla: Conceptualization, Investigation, Writing - original draft. Minhaj M. Ghouri: Conceptualization, Software, Formal analysis. Omar Wissam El Hassan: Investigation. Nosaiba Mohamed: Investigation, Formal analysis. Anuj V. Prakash: Validation, Writing - review & editing. Nimir O. Elbashir: Supervision, Conceptualization, Methodology, Project administration. Acknowledgments This paper was made possible by an NPRP exceptional grant award [NPRP-X-100-2-024] from the Qatar National Research Fund (a member of the Qatar Foundation). The statements made herein are solely the responsibility of the authors. The authors are grateful for the constructive discussions we had with professors and researchers of the member organizations (Northwestern University, Texas A&M University, Qatar University, and Total Research and Technology, Feluy) and with Dr. Dragomir Bukur (Emeritus Professor, Texas A&M University). All DFT simulations were performed on the supercomputing clusters RAAD & RAAD2. The hardware and software support from Texas Advanced Scientific Computing Center, Texas A&M University at Qatar is gratefully acknowledged. We also gratefully acknowledge Dr. Said A. Mansour of the Qatar Environment and Energy Research Institute (QEERI) for the TEM imaging services he has provided. Appendix A Supplementary data Supplementary material related to this article can be found, in the online version, at doi:https://doi.org/10.1016/j.apcata.2020.117699. Appendix A Supplementary data The following is supplementary data to this article: References [1] R.A. van Santen M.M. Ghouri S. Shetty E.J.M. Hensen Catal. Sci. Technol. 1 2011 891 911 R.A. van Santen, M.M. Ghouri, S. Shetty, E.J.M. Hensen, Structure sensitivity of the Fischer–Tropsch reaction; molecular kinetics simulations, Catalysis Science and Technology, 1 (2011) 891-911. [2] H. Xiong L.L. Jewell N.J. Coville ACS Catal. 5 2015 2640 2658 H. Xiong, L.L. Jewell, N.J. Coville, Shaped Carbons As Supports for the Catalytic Conversion of Syngas to Clean Fuels, ACS Catalysis, 5 (2015) 2640-2658. [3] Z. Zuo S. Liu Z. Wang C. Liu W. Huang J. Huang P. Liu ACS Catal. 8 2018 9821 9835 Z. Zuo, S. Liu, Z. Wang, C. Liu, W. Huang, J. Huang, P. Liu, Dry Reforming of Methane on Single-Site Ni/MgO Catalysts: Importance of Site Confinement, ACS Catalysis, 8 (2018) 9821-9835. [4] Z. Liu F. Zhang N. Rui X. Li L. Lin L.E. Betancourt D. Su W. Xu J. Cen K. Attenkofer H. Idriss J.A. Rodriguez S.D. Senanayake ACS Catal. 2019 3349 3359 Z. Liu, F. Zhang, N. Rui, X. Li, L. Lin, L.E. Betancourt, D. Su, W. Xu, J. Cen, K. Attenkofer, H. Idriss, J.A. [5] D. Li S. Xu K. Song C. Chen Y. Zhan L. Jiang Appl. Catal. A Gen. 552 2018 21 29 D. Li, S. Xu, K. Song, C. Chen, Y. Zhan, L. Jiang, Hydrotalcite-derived Co/Mg(Al)O as a stable and cokeresistant catalyst for low-temperature carbon dioxide reforming of methane, Applied Catalysis A: General, 552 (2018) 21-29. [6] X. Jia X. Zhang N. Rui X. Hu C.-j. Liu Appl. Catal. B: Environ. 244 2019 159 169 X. Jia, X. Zhang, N. Rui, X. Hu, C.-j. Liu, Structural effect of Ni/ZrO2 catalyst on CO2 methanation with enhanced activity, Applied Catalysis B: Environmental, 244 (2019) 159-169. [7] B. Abdullah N.A. Abd Ghani D.-V.N. Vo J. Clean. Prod. 162 2017 170 185 B. Abdullah, N.A. Abd Ghani, D.-V.N. Vo, Recent advances in dry reforming of methane over Ni-based catalysts, Journal of Cleaner Production, 162 (2017) 170-185. [8] J.W. Han J.S. Park M.S. Choi H. Lee Appl. Catal. B: Environ. 203 2017 625 632 J.W. Han, J.S. Park, M.S. Choi, H. Lee, Uncoupling the size and support effects of Ni catalysts for dry reforming of methane, Applied Catalysis B: Environmental, 203 (2017) 625-632. [9] Z. Wu B. Yang S. Miao W. Liu J. Xie S. Lee M.J. Pellin D. Xiao D. Su D. Ma ACS Catal. 2019 2693 2700 Z. Wu, B. Yang, S. Miao, W. Liu, J. Xie, S. Lee, M.J. Pellin, D. Xiao, D. Su, D. Ma, Lattice Strained Ni-Co alloy as a High-Performance Catalyst for Catalytic Dry Reforming of Methane, ACS Catalysis, (2019) 2693-2700. [10] S. Dama S.R. Ghodke R. Bobade H.R. Gurav S. Chilukuri Appl. Catal. B: Environ. 224 2018 146 158 S. Dama, S.R. Ghodke, R. Bobade, H.R. Gurav, S. Chilukuri, Active and durable alkaline earth metal substituted perovskite catalysts for dry reforming of methane, Applied Catalysis B: Environmental, 224 (2018) 146-158. [11] S.M. Kim P.M. Abdala T. Margossian D. Hosseini L. Foppa A. Armutlulu W. van Beek A. Comas-Vives C. Copéret C. Müller J. Am. Chem. Soc. 139 2017 1937 1949 S.M. Kim, P.M. Abdala, T. Margossian, D. Hosseini, L. Foppa, A. Armutlulu, W. van Beek, A. Comas-Vives, C. Copéret, C. Müller, Cooperativity and Dynamics Increase the Performance of NiFe Dry Reforming Catalysts, Journal of the American Chemical Society, 139 (2017) 1937-1949. [12] A.R. Passos S.H. Pulcinelli C.V. Santilli V. Briois Catal. Today 2019 A.R. Passos, S.H. Pulcinelli, C.V. Santilli, V. Briois, Operando monitoring of metal sites and coke evolution during non-oxidative and oxidative ethanol steam reforming over Ni and NiCu ex-hydrotalcite catalysts, Catalysis Today, (2019). [13] M. Khzouz E.I. Gkanas S. Du J. Wood Fuel 232 2018 672 683 M. Khzouz, E.I. Gkanas, S. Du, J. Wood, Catalytic performance of Ni-Cu/Al2O3 for effective syngas production by methanol steam reforming, Fuel, 232 (2018) 672-683. [14] Y. Wang M. Chen Z. Yang T. Liang S. Liu Z. Zhou X. Li Appl. Catal. A Gen. 550 2018 214 227 Y. Wang, M. Chen, Z. Yang, T. Liang, S. Liu, Z. Zhou, X. Li, Bimetallic Ni-M (M = Co, Cu and Zn) supported on attapulgite as catalysts for hydrogen production from glycerol steam reforming, Applied Catalysis A: [15] A. Venugopal C. Anjaneyulu S.N. Kumar V.V. Kumar G. Naresh M.S. Scurrell Energy Fuels 31 2017 6374 6377 A. Venugopal, C. Anjaneyulu, S.N. Kumar, V.V. Kumar, G. Naresh, M.S. Scurrell, Prospects for Lower Carbon Routes for Conversion of Natural Gas to Energy, Energy & Fuels, 31 (2017) 6374-6377. [16] Q. Tan Z. Shi D. Wu Ind. Eng. Chem. Res. 57 2018 10148 10158 Q. Tan, Z. Shi, D. Wu, CO2 Hydrogenation to Methanol over a Highly Active Cu–Ni/CeO2–Nanotube Catalyst, Industrial & Engineering Chemistry Research, 57 (2018) 10148-10158. [17] A.C. Lua H.Y. Wang Appl. Catal. B: Environ. 132 2013 469 A.C. Lua, H.Y. Wang, Decomposition of Methane over Unsupported Porous Nickel and Alloy Catalyst, Appl. Catal. B: Environ., 132 (2013) 469. [18] M.T. Tavares I. Alstrup C.A. Bernardo Mater. Corros. 50 1999 681 M.T. Tavares, I. Alstrup, C.A. Bernardo, Coking and Decoking during Methanation and Methane Decomposition on Ni-Cu Supported Catalysts, Mater. Corros., 50 (1999) 681. [19] D. La Rosa M.L. Faro G. Monforte V. Antonuccia A.S. Aricòa A. Sinb ECS Trans. 7 2007 1685 D. La Rosa, M.L. Faro, G. Monforte, V. Antonuccia, A.S. Aricòa, A. Sinb, Recent Advances on the Development of NiCu Alloy Catalysts for IT-SOFCs, ECS Trans., 7 (2007) 1685. [20] A. Kitla O.V. Safonova K. Föttinger Catal. Lett. 143 2013 517 530 A. Kitla, O.V. Safonova, K. Föttinger, Infrared Studies on Bimetallic Copper/Nickel Catalysts Supported on Zirconia and Ceria/Zirconia, Catalysis Letters, 143 (2013) 517-530. [21] N.M. Popova R.K. Salakhova K. Dosumov S.A. Tungatarova A.S. Sass Z.T. Zheksenbaeva L.V. Komashko V.P. Grigor’eva A. Shapovalov Kinet. Catal. 50 2009 567 N.M. Popova, R.K. Salakhova, K. Dosumov, S.A. Tungatarova, A.S. Sass, Z.T. Zheksenbaeva, L.V. Komashko, V.P. Grigor’eva, A. Shapovalov, A Nickel-copper-chromium Catalyst for Selective Methane Oxidation to Synthesis Gas at Short Residence Times, Kinet. Catal., 50 (2009) 567. [22] A.R. Naghash T.H. Etsell S. Xu Chem. Mater. 18 2006 2480 A.R. Naghash, T.H. Etsell, S. Xu, XRD and XPS study of Cu-Ni Interactions on Reduced Copper-nickelaluminum Oxide Solid Solution Catalysts, Chem. Mater., 18 (2006) 2480. [23] Q. Wang J. Yao J. Rong M. Huang C. Yuan Catal. Lett. 4 1990 63 Q. Wang, J. Yao, J. Rong, M. Huang, C. Yuan, Structure and Catalytic Properties of Cu-Ni Bimetallic Catalysts for Hydrogenation, Catal. Lett., 4 (1990) 63. [24] K. Song M. Lu S. Xu C. Chen Y. Zhan D. Li C. Au L. Jiang K. Tomishige Appl. Catal. B: Environ. 239 2018 324 333 K. Song, M. Lu, S. Xu, C. Chen, Y. Zhan, D. Li, C. Au, L. Jiang, K. Tomishige, Effect of alloy composition on catalytic performance and coke-resistance property of Ni-Cu/Mg(Al)O catalysts for dry reforming of methane, Applied Catalysis B: Environmental, 239 (2018) 324-333. [25] H. Liu C. Guan X. Li L. Cheng J. Zhao N. Xue W. Ding ChemCatChem 5 2013 3904 3909 H. Liu, C. Guan, X. Li, L. Cheng, J. Zhao, N. Xue, W. Ding, The Key Points of Highly Stable Catalysts for Methane Reforming with Carbon Dioxide, ChemCatChem, 5 (2013) 3904-3909. [26] N. Rahemi M. Haghighi A.A. Babaluo S. Allahyari M.F. Jafari Energy Convers. Manage. 84 2014 50 59 N. Rahemi, M. Haghighi, A.A. Babaluo, S. Allahyari, M.F. Jafari, Syngas production from reforming of greenhouse gases CH4/CO2 over Ni–Cu/Al2O3 nanocatalyst: Impregnated vs. plasma-treated catalyst, Energy Conversion and Management, 84 (2014) 50-59. [27] S.M.M. Nataj S.M. Alavi G. Mazloom J. Energy Chem. 27 2018 1475 1488 S.M.M. Nataj, S.M. Alavi, G. Mazloom, Modeling and optimization of methane dry reforming over Ni–Cu/Al2O3 catalyst using Box–Behnken design, Journal of Energy Chemistry, 27 (2018) 1475-1488. [28] J.-H. Lee E.-G. Lee O.-S. Joo K.-D. Jung Appl. Catal. A Gen. 269 2004 1 6 J.-H. Lee, E.-G. Lee, O.-S. Joo, K.-D. Jung, Stabilization of Ni/Al2O3 catalyst by Cu addition for CO2 reforming of methane, Applied Catalysis A: General, 269 (2004) 1-6. [29] D. Halliche R. Bouarab O. Cherifi M.M. Bettahar Catal. Today 29 1996 373 377 D. Halliche, R. Bouarab, O. Cherifi, M.M. Bettahar, Carbon dioxide reforming of methane on modified Ni/α-Al2O3 catalysts, Catalysis Today, 29 (1996) 373-377. [30] G. Kresse J. Furthmüller Comput. Mater. Sci. 6 1996 15 50 G. Kresse, J. Furthmüller, Efficiency of ab-initio total energy calculations for metals and semiconductors using a plane-wave basis set, Computational Materials Science, 6 (1996) 15-50. [31] G. Kresse J. Hafner Phys. Rev. B 47 1993 558 561 G. Kresse, J. Hafner, Ab initio, Physical Review B, 47 (1993) 558-561. [32] G. Kresse J. Hafner Phys. Rev. B 49 1994 14251 14269 G. Kresse, J. Hafner, Ab initio, Physical Review B, 49 (1994) 14251-14269. [33] G. Kresse J. Furthmüller Phys. Rev. B 54 1996 11169 11186 G. Kresse, J. Furthmüller, Efficient iterative schemes for ab initio total-energy calculations using a plane-wave basis set, Physical Review B, 54 (1996) 11169-11186. [34] P.E. Blöchl Phys. Rev. B 50 1994 17953 17979 P.E. Blöchl, Projector augmented-wave method, Physical Review B, 50 (1994) 17953-17979. [35] G. Kresse D. Joubert Phys. Rev. B 59 1999 1758 1775 G. Kresse, D. Joubert, From ultrasoft pseudopotentials to the projector augmented-wave method, Physical Review B, 59 (1999) 1758-1775. [36] B. Hammer L.B. Hansen J.K. Nørskov Phys. Rev. B 59 1999 7413 7421 B. Hammer, L.B. Hansen, J.K. Nørskov, Improved adsorption energetics within density-functional theory using revised Perdew-Burke-Ernzerhof functionals, Physical Review B, 59 (1999) 7413-7421. [37] B. Hammer J.K. Nørskov Theoretical Surface Science and Catalysis—Calculations and Concepts Advances in Catalysis 45 2000 71 B. Hammer, J.K. Nørskov, Theoretical surface science and catalysis—calculations and concepts Advances in Catalysis, 45 (2000) 71. [38] D.W. Blaylock Y.-A. Zhu W.H. Green Top. Catal. 54 2011 828 D.W. Blaylock, Y.-A. Zhu, W.H. Green, Computational Investigation of the Thermochemistry and Kinetics of Steam Methane Reforming Over a Multi-Faceted Nickel Catalyst, Topics in Catalysis, 54 (2011) 828. [39] H.J. Monkhorst J.D. Pack Phys. Rev. B 13 1976 5188 5192 H.J. Monkhorst, J.D. Pack, Special points for Brillouin-zone integrations, Physical Review B, 13 (1976) 5188-5192. [40] M. Methfessel A.T. Paxton Phys. Rev. B 40 1989 3616 3621 M. Methfessel, A.T. Paxton, High-precision sampling for Brillouin-zone integration in metals, Physical Review B, 40 (1989) 3616-3621. [41] Y.-A. Zhu D. Chen X.-G. Zhou W.-K. Yuan Catal. Today 148 2009 260 267 Y.-A. Zhu, D. Chen, X.-G. Zhou, W.-K. Yuan, DFT studies of dry reforming of methane on Ni catalyst, Catalysis Today, 148 (2009) 260-267. [42] G. Henkelman H. Jónsson J. Chem. Phys. 111 1999 7010 7022 G. Henkelman, H. Jónsson, A dimer method for finding saddle points on high dimensional potential surfaces using only first derivatives, The Journal of Chemical Physics, 111 (1999) 7010-7022. [43] R.A. Olsen G.J. Kroes G. Henkelman A. Arnaldsson H. Jónsson J. Chem. Phys. 121 2004 97769792 R.A. Olsen, G.J. Kroes, G. Henkelman, A. Arnaldsson, H. Jónsson, Comparison of methods for finding saddle points without knowledge of the final states, The Journal of Chemical Physics, 121 (2004) 97769792. [44] B. Hua M. Li W. Zhang J. Pu B. Chi L. Jian J. Electrochem. Soc. 161 2014 569 B. Hua, M. Li, W. Zhang, J. Pu, B. Chi, L. Jian, Methane On-Cell Reforming by Alloys Reduced from Ni0.5Cu0.5Fe2O4 for Direct-Hydrocarbon Solid Oxide Fuel Cells, J. Electrochem. Soc., 161 (2014) 569. [45] J.H. Lee E.G. Lee O.S. Joo K.D. Jung Appl. Catal. A Gen. 269 2004 1 J.H. Lee, E.G. Lee, O.S. Joo, K.D. Jung, Stabilization of Ni/Al2O3 Catalyst by Cu Addition for CO2 Reforming of Methane, Appl. Catal. A: Gen., 269 (2004) 1. [46] C.H. Bartholomew W.L. Sorensen J. Catal. 81 1983 131 141 C.H. Bartholomew, W.L. Sorensen, Sintering kinetics of silica- and alumina-supported nickel in hydrogen atmosphere, Journal of Catalysis, 81 (1983) 131-141. [47] H.A. Choudhury X. Cheng S. Afzal A.V. Prakash B.J. Tatarchuk N.O. Elbashir Catal. Today 2019 H.A. Choudhury, X. Cheng, S. Afzal, A.V. Prakash, B.J. Tatarchuk, N.O. Elbashir, Understanding the deactivation process of a microfibrous entrapped cobalt catalyst in supercritical fluid Fischer-Tropsch Synthesis, Catalysis Today, (2019). [48] M.D. Argyle T.S. Frost C.H. Bartholomew Top. Catal. 57 2014 415 429 M.D. Argyle, T.S. Frost, C.H. Bartholomew, Cobalt Fischer–Tropsch Catalyst Deactivation Modeled Using Generalized Power Law Expressions, Topics in Catalysis, 57 (2014) 415-429. [49] A. Cross J.T. Miller V. Danghyan A.S. Mukasyan E.E. Wolf Appl. Catal. A Gen. 572 2019 124 133 A. Cross, J.T. Miller, V. Danghyan, A.S. Mukasyan, E.E. Wolf, Highly active and stable Ni-Cu supported catalysts prepared by combustion synthesis for hydrogen production from ethanol, Applied Catalysis A: [50] A. Yin C. Wen X. Guo W.-L. Dai K. Fan J. Catal. 280 2011 77 88 A. Yin, C. Wen, X. Guo, W.-L. Dai, K. Fan, Influence of Ni species on the structural evolution of Cu/SiO2 catalyst for the chemoselective hydrogenation of dimethyl oxalate, Journal of Catalysis, 280 (2011) 77-88. [51] D. Li M. Lu K. Aragaki M. Koike Y. Nakagawa K. Tomishige Appl. Catal. B: Environ. 192 2016 171 181 D. Li, M. Lu, K. Aragaki, M. Koike, Y. Nakagawa, K. Tomishige, Characterization and catalytic performance of hydrotalcite-derived Ni-Cu alloy nanoparticles catalysts for steam reforming of 1methylnaphthalene, Applied Catalysis B: Environmental, 192 (2016) 171-181. [52] N. Bayat M. Rezaei F. Meshkani Fuel 195 2017 88 96 N. Bayat, M. Rezaei, F. Meshkani, Methane dissociation to COx-free hydrogen and carbon nanofiber over Ni-Cu/Al2O3 catalysts, Fuel, 195 (2017) 88-96. [53] A.R. Naghash T.H. Etsell S. Xu Chem. Mater. 18 2006 2480 2488 A.R. Naghash, T.H. Etsell, S. Xu, XRD and XPS Study of Cu−Ni Interactions on Reduced [54] B.C. Miranda R.J. Chimentão J. Szanyi A.H. Braga J.B.O. Santos F. Gispert-Guirado J. Llorca F. Medina Appl. Catal. B 166-167 2015 166 180 B.C. Miranda, R.J. Chimentão, J. Szanyi, A.H. Braga, J.B.O. Santos, F. Gispert-Guirado, J. Llorca, F. Medina, Influence of copper on nickel-based catalysts in the conversion of glycerol, Applied Catalysis B: [55] I.C. Freitas R.L. Manfro M.M.V.M. Souza Appl. Catal. B: Environ. 220 2018 31 41 I.C. Freitas, R.L. Manfro, M.M.V.M. Souza, Hydrogenolysis of glycerol to propylene glycol in continuous system without hydrogen addition over Cu-Ni catalysts, Applied Catalysis B: Environmental, 220 (2018) 31-41. [56] I. Gandarias J. Requies P.L. Arias U. Armbruster A. Martin J. Catal. 290 2012 79 89 I. Gandarias, J. Requies, P.L. Arias, U. Armbruster, A. Martin, Liquid-phase glycerol hydrogenolysis by formic acid over Ni–Cu/Al2O3 catalysts, Journal of Catalysis, 290 (2012) 79-89. [57] D. Li J. Chen Y. Li Int. J. Hydrogen Energy 34 2009 299 307 D. Li, J. Chen, Y. Li, Evidence of composition deviation of metal particles of a Ni–Cu/Al2O3 catalyst during methane decomposition to COx-free hydrogen, International Journal of Hydrogen Energy, 34 (2009) 299-307. [58] N. Wang W. Qian W. Chu F. Wei Catal. Sci. Technol. 6 2016 3594 3605 N. Wang, W. Qian, W. Chu, F. Wei, Crystal-plane effect of nanoscale CeO2 on the catalytic performance of Ni/CeO2 catalysts for methane dry reforming, Catalysis Science & Technology, 6 (2016) 3594-3605. [59] T. Wu Q. Zhang W. Cai P. Zhang X. Song Z. Sun L. Gao Appl. Catal. A Gen. 503 2015 94102 T. Wu, Q. Zhang, W. Cai, P. Zhang, X. Song, Z. Sun, L. Gao, Phyllosilicate evolved hierarchical Ni- and Cu– Ni/SiO2 nanocomposites for methane dry reforming catalysis, Applied Catalysis A: General, 503 (2015) 94102. [60] H. Yen Y. Seo S. Kaliaguine F. Kleitz ACS Catal. 5 2015 5505 55511 H. Yen, Y. Seo, S. Kaliaguine, F. Kleitz, Role of Metal–Support Interactions, Particle Size, and Metal– Metal Synergy in CuNi Nanocatalysts for H2 Generation, ACS Catalysis, 5 (2015) 5505-5511. [61] L. De Rogatis T. Montini B. Lorenzut P. Fornasiero Energy Environ. Sci. 1 2008 501 509 L. De Rogatis, T. Montini, B. Lorenzut, P. Fornasiero, NixCuy/Al2O3 based catalysts for hydrogen production, Energy & Environmental Science, 1 (2008) 501-509. [62] H.S. Bengaard J.K. Nørskov J. Sehested B.S. Clausen L.P. Nielsen A.M. Molenbroek J.R. RostrupNielsen J. Catal. 209 2002 365384 H.S. Bengaard, J.K. Nørskov, J. Sehested, B.S. Clausen, L.P. Nielsen, A.M. Molenbroek, J.R. RostrupNielsen, Steam Reforming and Graphite Formation on Ni Catalysts, Journal of Catalysis, 209 (2002) 365384. [63] H.-W. Chen C.-Y. Wang C.-H. Yu L.-T. Tseng P.-H. Liao Catal. Today 97 2004 173 180 H.-W. Chen, C.-Y. Wang, C.-H. Yu, L.-T. Tseng, P.-H. Liao, Carbon dioxide reforming of methane reaction catalyzed by stable nickel copper catalysts, Catalysis Today, 97 (2004) 173-180. [64] S. Kawi Y. Kathiraser J. Ni U. Oemar Z. Li E.T. Saw ChemSusChem 8 2015 3556 3575 S. Kawi, Y. Kathiraser, J. Ni, U. Oemar, Z. Li, E.T. Saw, Progress in Synthesis of Highly Active and Stable Nickel-Based Catalysts for Carbon Dioxide Reforming of Methane, ChemSusChem, 8 (2015) 3556-3575. [65] L. Zhou L. Li N. Wei J. Li J.-M. Basset ChemCatChem 7 2015 2508 2516 L. Zhou, L. Li, N. Wei, J. Li, J.-M. Basset, Effect of NiAl2O4 Formation on Ni/Al2O3 Stability during Dry Reforming of Methane, ChemCatChem, 7 (2015) 2508-2516. [66] Q. Huang X. Fang Q. Cheng Q. Li X. Xu L. Xu W. Liu Z. Gao W. Zhou X. Wang ChemCatChem 9 2017 3563 3571 Q. Huang, X. Fang, Q. Cheng, Q. Li, X. Xu, L. Xu, W. Liu, Z. Gao, W. Zhou, X. Wang, Synthesis of a Highly [67] C. Wang N. Sun N. Zhao W. Wei J. Zhang T. Zhao Y. Sun C. Sun H. Liu C.E. Snape ChemCatChem 6 2014 640 648 C. Wang, N. Sun, N. Zhao, W. Wei, J. Zhang, T. Zhao, Y. Sun, C. Sun, H. Liu, C.E. Snape, The Properties of Individual Carbon Residuals and Their Influence on The Deactivation of Ni–CaO–ZrO2 Catalysts in CH4 Dry Reforming, ChemCatChem, 6 (2014) 640-648. [68] V. Georgakilas J.A. Perman J. Tucek R. Zboril Chem. Rev. 115 2015 4744 4822 V. Georgakilas, J.A. Perman, J. Tucek, R. Zboril, Broad Family of Carbon Nanoallotropes: Classification, Chemistry, and Applications of Fullerenes, Carbon Dots, Nanotubes, Graphene, Nanodiamonds, and Combined Superstructures, Chemical Reviews, 115 (2015) 4744-4822. [69] Y. Cao P. Maitarad M. Gao T. Taketsugu H. Li T. Yan L. Shi D. Zhang Appl. Catal. B 238 2018 51 60 Y. Cao, P. Maitarad, M. Gao, T. Taketsugu, H. Li, T. Yan, L. Shi, D. Zhang, Defect-induced efficient dry reforming of methane over two-dimensional Ni/h-boron nitride nanosheet catalysts, Applied Catalysis B: [70] F. Zhao M. Gong K. Cao Y. Zhang J. Li R. Chen ChemCatChem 9 2017 3772 3778 F. Zhao, M. Gong, K. Cao, Y. Zhang, J. Li, R. Chen, Atomic Layer Deposition of Ni on Cu Nanoparticles for Methanol Synthesis from CO2 Hydrogenation, ChemCatChem, 9 (2017) 3772-3778. [71] S. Damyanova B. Pawelec K. Arishtirova J.L.G. Fierro C. Sener T. Dogu Appl. Catal. B 92 2009 250 261 S. Damyanova, B. Pawelec, K. Arishtirova, J.L.G. Fierro, C. Sener, T. Dogu, MCM-41 supported PdNi catalysts for dry reforming of methane, Applied Catalysis B: Environmental, 92 (2009) 250-261. [72] Q. Zhang M. Wang T. Zhang Y. Wang X. Tang P. Ning RSC Adv. 5 2015 94016 94024 Q. Zhang, M. Wang, T. Zhang, Y. Wang, X. Tang, P. Ning, A stable Ni/SBA-15 catalyst prepared by the ammonia evaporation method for dry reforming of methane, RSC Advances, 5 (2015) 94016-94024. [73] R. Zhang X. Guo B. Wang L. Ling J. Phys. Chem. C 119 2015 14135 14144 R. Zhang, X. Guo, B. Wang, L. Ling, Insight Into the Effect of CuNi(111) and FeNi(111) Surface Structure and Second Metal Composition on Surface Carbon Elimination by O or OH: A Comparison Study with Ni(111) Surface, The Journal of Physical Chemistry C, 119 (2015) 14135-14144. [74] H. Liu B. Wang M. Fan N. Henson Y. Zhang B.F. Towler Fuel 113 2013 712 H. Liu, B. Wang, M. Fan, N. Henson, Y. Zhang, B.F. Towler, Study on Carbon Deposition Associated with Catalytic CH4 Reforming by Using Density Functional Theory, Fuel, 113 (2013) 712. [75] H. Liu R. Zhang R. Yan J. Li B. Wang K. Xie Appl. Surf. Sci. 258 2012 8177 8184 H. Liu, R. Zhang, R. Yan, J. Li, B. Wang, K. Xie, Insight into CH4 dissociation on NiCu catalyst: A firstprinciples study, Applied Surface Science, 258 (2012) 8177-8184",
      "scopus-id": "85087715153",
      "coredata": {
        "eid": "1-s2.0-S0926860X20302921",
        "dc:description": "The influence of varying Cu atomic ratios in a bimetallic Ni-Cu catalytic system for the CO2 or Dry Reforming of Methane (DRM) is investigated experimentally, in conjunction with ab-initio Density Functional Theory (DFT) and Generalized Power Law Expression (GPLE)-based mathematical modeling approaches. Among the synthesized catalysts, an 8:1 Ni:Cu ratio shows highest activity with stable H2/CO selectivity compared to its monometallic counterpart. Detailed physico-chemical characterization of the catalysts indicate that copper addition minimizes deactivation by forming a Ni-Cu alloy that increases reducibility of the NiO and limits the tendency of the active site toward coke formation. DFT calculations reveal increased energy barrier for carbon adsorption, whilst promoting facile removal of deposited carbon. GPLE analysis of the deactivation profiles suggest coking as the primary deactivation route in monometallic Ni catalyst; although much lesser in extent, deactivation of Ni8Cu1/Al2O3 catalyst is induced by both sintering and coking regimes.",
        "openArchiveArticle": "false",
        "prism:coverDate": "2020-07-25",
        "openaccessUserLicense": "http://creativecommons.org/licenses/by/4.0/",
        "prism:aggregationType": "Journal",
        "prism:url": "https://api.elsevier.com/content/article/pii/S0926860X20302921",
        "dc:creator": [
          {
            "@_fa": "true",
            "$": "Chatla, Anjaneyulu"
          },
          {
            "@_fa": "true",
            "$": "Ghouri, Minhaj M."
          },
          {
            "@_fa": "true",
            "$": "El Hassan, Omar Wissam"
          },
          {
            "@_fa": "true",
            "$": "Mohamed, Nosaiba"
          },
          {
            "@_fa": "true",
            "$": "Prakash, Anuj V."
          },
          {
            "@_fa": "true",
            "$": "Elbashir, Nimir O."
          }
        ],
        "link": [
          {
            "@_fa": "true",
            "@rel": "self",
            "@href": "https://api.elsevier.com/content/article/pii/S0926860X20302921"
          },
          {
            "@_fa": "true",
            "@rel": "scidir",
            "@href": "https://www.sciencedirect.com/science/article/pii/S0926860X20302921"
          }
        ],
        "dc:format": "application/json",
        "openaccessType": "Full",
        "pii": "S0926-860X(20)30292-1",
        "prism:volume": "602",
        "articleNumber": "117699",
        "prism:publisher": "The Authors. Published by Elsevier B.V.",
        "dc:title": "An experimental and first principles DFT investigation on the effect of Cu addition to Ni/Al2O3 catalyst for the dry reforming of methane",
        "prism:copyright": "© 2020 The Authors. Published by Elsevier B.V.",
        "openaccess": "1",
        "prism:issn": "0926860X",
        "dcterms:subject": [
          {
            "@_fa": "true",
            "$": "DRM"
          },
          {
            "@_fa": "true",
            "$": "Ni-Cu alloy"
          },
          {
            "@_fa": "true",
            "$": "DFT"
          },
          {
            "@_fa": "true",
            "$": "Generalized Power Law Expression (GPLE)"
          },
          {
            "@_fa": "true",
            "$": "Bi-metallic catalyst"
          },
          {
            "@_fa": "true",
            "$": "Catalyst deactivation"
          }
        ],
        "openaccessArticle": "true",
        "prism:publicationName": "Applied Catalysis A: General",
        "openaccessSponsorType": "FundingBody",
        "prism:pageRange": "117699",
        "pubType": "fla",
        "prism:coverDisplayDate": "25 July 2020",
        "prism:doi": "10.1016/j.apcata.2020.117699",
        "prism:startingPage": "117699",
        "dc:identifier": "doi:10.1016/j.apcata.2020.117699",
        "openaccessSponsorName": "Qatar National Library"
      },
      "objects": {
        "object": [
          {
            "@category": "standard",
            "@height": "407",
            "@width": "340",
            "@_fa": "true",
            "$": "https://api.elsevier.com/content/object/eid/1-s2.0-S0926860X20302921-gr1.jpg?httpAccept=%2A%2F%2A",
            "@multimediatype": "JPEG image file",
            "@type": "IMAGE-DOWNSAMPLED",
            "@size": "25162",
            "@ref": "gr1",
            "@mimetype": "image/jpeg"
          },
          {
            "@category": "standard",
            "@height": "274",
            "@width": "566",
            "@_fa": "true",
            "$": "https://api.elsevier.com/content/object/eid/1-s2.0-S0926860X20302921-gr13.jpg?httpAccept=%2A%2F%2A",
            "@multimediatype": "JPEG image file",
            "@type": "IMAGE-DOWNSAMPLED",
            "@size": "50426",
            "@ref": "gr13",
            "@mimetype": "image/jpeg"
          },
          {
            "@category": "standard",
            "@height": "697",
            "@width": "717",
            "@_fa": "true",
            "$": "https://api.elsevier.com/content/object/eid/1-s2.0-S0926860X20302921-gr4.jpg?httpAccept=%2A%2F%2A",
            "@multimediatype": "JPEG image file",
            "@type": "IMAGE-DOWNSAMPLED",
            "@size": "140829",
            "@ref": "gr4",
            "@mimetype": "image/jpeg"
          },
          {
            "@category": "standard",
            "@height": "604",
            "@width": "679",
            "@_fa": "true",
            "$": "https://api.elsevier.com/content/object/eid/1-s2.0-S0926860X20302921-gr5.jpg?httpAccept=%2A%2F%2A",
            "@multimediatype": "JPEG image file",
            "@type": "IMAGE-DOWNSAMPLED",
            "@size": "81288",
            "@ref": "gr5",
            "@mimetype": "image/jpeg"
          },
          {
            "@category": "standard",
            "@height": "451",
            "@width": "340",
            "@_fa": "true",
            "$": "https://api.elsevier.com/content/object/eid/1-s2.0-S0926860X20302921-gr2.jpg?httpAccept=%2A%2F%2A",
            "@multimediatype": "JPEG image file",
            "@type": "IMAGE-DOWNSAMPLED",
            "@size": "35028",
            "@ref": "gr2",
            "@mimetype": "image/jpeg"
          },
          {
            "@category": "standard",
            "@height": "771",
            "@width": "717",
            "@_fa": "true",
            "$": "https://api.elsevier.com/content/object/eid/1-s2.0-S0926860X20302921-gr3.jpg?httpAccept=%2A%2F%2A",
            "@multimediatype": "JPEG image file",
            "@type": "IMAGE-DOWNSAMPLED",
            "@size": "155562",
            "@ref": "gr3",
            "@mimetype": "image/jpeg"
          },
          {
            "@category": "standard",
            "@height": "788",
            "@width": "717",
            "@_fa": "true",
            "$": "https://api.elsevier.com/content/object/eid/1-s2.0-S0926860X20302921-gr8.jpg?httpAccept=%2A%2F%2A",
            "@multimediatype": "JPEG image file",
            "@type": "IMAGE-DOWNSAMPLED",
            "@size": "167289",
            "@ref": "gr8",
            "@mimetype": "image/jpeg"
          },
          {
            "@category": "standard",
            "@height": "816",
            "@width": "717",
            "@_fa": "true",
            "$": "https://api.elsevier.com/content/object/eid/1-s2.0-S0926860X20302921-gr9.jpg?httpAccept=%2A%2F%2A",
            "@multimediatype": "JPEG image file",
            "@type": "IMAGE-DOWNSAMPLED",
            "@size": "205588",
            "@ref": "gr9",
            "@mimetype": "image/jpeg"
          },
          {
            "@category": "standard",
            "@height": "605",
            "@width": "679",
            "@_fa": "true",
            "$": "https://api.elsevier.com/content/object/eid/1-s2.0-S0926860X20302921-gr6.jpg?httpAccept=%2A%2F%2A",
            "@multimediatype": "JPEG image file",
            "@type": "IMAGE-DOWNSAMPLED",
            "@size": "59566",
            "@ref": "gr6",
            "@mimetype": "image/jpeg"
          },
          {
            "@category": "standard",
            "@height": "294",
            "@width": "340",
            "@_fa": "true",
            "$": "https://api.elsevier.com/content/object/eid/1-s2.0-S0926860X20302921-gr7.jpg?httpAccept=%2A%2F%2A",
            "@multimediatype": "JPEG image file",
            "@type": "IMAGE-DOWNSAMPLED",
            "@size": "19542",
            "@ref": "gr7",
            "@mimetype": "image/jpeg"
          },
          {
            "@category": "standard",
            "@height": "195",
            "@width": "500",
            "@_fa": "true",
            "$": "https://api.elsevier.com/content/object/eid/1-s2.0-S0926860X20302921-ga1.jpg?httpAccept=%2A%2F%2A",
            "@multimediatype": "JPEG image file",
            "@type": "IMAGE-DOWNSAMPLED",
            "@size": "32986",
            "@ref": "ga1",
            "@mimetype": "image/jpeg"
          },
          {
            "@category": "standard",
            "@height": "432",
            "@width": "491",
            "@_fa": "true",
            "$": "https://api.elsevier.com/content/object/eid/1-s2.0-S0926860X20302921-gr11.jpg?httpAccept=%2A%2F%2A",
            "@multimediatype": "JPEG image file",
            "@type": "IMAGE-DOWNSAMPLED",
            "@size": "29531",
            "@ref": "gr11",
            "@mimetype": "image/jpeg"
          },
          {
            "@category": "standard",
            "@height": "291",
            "@width": "566",
            "@_fa": "true",
            "$": "https://api.elsevier.com/content/object/eid/1-s2.0-S0926860X20302921-gr12.jpg?httpAccept=%2A%2F%2A",
            "@multimediatype": "JPEG image file",
            "@type": "IMAGE-DOWNSAMPLED",
            "@size": "26004",
            "@ref": "gr12",
            "@mimetype": "image/jpeg"
          },
          {
            "@category": "standard",
            "@height": "230",
            "@width": "566",
            "@_fa": "true",
            "$": "https://api.elsevier.com/content/object/eid/1-s2.0-S0926860X20302921-gr10.jpg?httpAccept=%2A%2F%2A",
            "@multimediatype": "JPEG image file",
            "@type": "IMAGE-DOWNSAMPLED",
            "@size": "29728",
            "@ref": "gr10",
            "@mimetype": "image/jpeg"
          },
          {
            "@category": "thumbnail",
            "@height": "164",
            "@width": "137",
            "@_fa": "true",
            "$": "https://api.elsevier.com/content/object/eid/1-s2.0-S0926860X20302921-gr1.sml?httpAccept=%2A%2F%2A",
            "@multimediatype": "GIF image file",
            "@type": "IMAGE-THUMBNAIL",
            "@size": "7573",
            "@ref": "gr1",
            "@mimetype": "image/gif"
          },
          {
            "@category": "thumbnail",
            "@height": "106",
            "@width": "219",
            "@_fa": "true",
            "$": "https://api.elsevier.com/content/object/eid/1-s2.0-S0926860X20302921-gr13.sml?httpAccept=%2A%2F%2A",
            "@multimediatype": "GIF image file",
            "@type": "IMAGE-THUMBNAIL",
            "@size": "12786",
            "@ref": "gr13",
            "@mimetype": "image/gif"
          },
          {
            "@category": "thumbnail",
            "@height": "164",
            "@width": "169",
            "@_fa": "true",
            "$": "https://api.elsevier.com/content/object/eid/1-s2.0-S0926860X20302921-gr4.sml?httpAccept=%2A%2F%2A",
            "@multimediatype": "GIF image file",
            "@type": "IMAGE-THUMBNAIL",
            "@size": "19637",
            "@ref": "gr4",
            "@mimetype": "image/gif"
          },
          {
            "@category": "thumbnail",
            "@height": "164",
            "@width": "184",
            "@_fa": "true",
            "$": "https://api.elsevier.com/content/object/eid/1-s2.0-S0926860X20302921-gr5.sml?httpAccept=%2A%2F%2A",
            "@multimediatype": "GIF image file",
            "@type": "IMAGE-THUMBNAIL",
            "@size": "10158",
            "@ref": "gr5",
            "@mimetype": "image/gif"
          },
          {
            "@category": "thumbnail",
            "@height": "163",
            "@width": "123",
            "@_fa": "true",
            "$": "https://api.elsevier.com/content/object/eid/1-s2.0-S0926860X20302921-gr2.sml?httpAccept=%2A%2F%2A",
            "@multimediatype": "GIF image file",
            "@type": "IMAGE-THUMBNAIL",
            "@size": "8290",
            "@ref": "gr2",
            "@mimetype": "image/gif"
          },
          {
            "@category": "thumbnail",
            "@height": "163",
            "@width": "152",
            "@_fa": "true",
            "$": "https://api.elsevier.com/content/object/eid/1-s2.0-S0926860X20302921-gr3.sml?httpAccept=%2A%2F%2A",
            "@multimediatype": "GIF image file",
            "@type": "IMAGE-THUMBNAIL",
            "@size": "18003",
            "@ref": "gr3",
            "@mimetype": "image/gif"
          },
          {
            "@category": "thumbnail",
            "@height": "164",
            "@width": "149",
            "@_fa": "true",
            "$": "https://api.elsevier.com/content/object/eid/1-s2.0-S0926860X20302921-gr8.sml?httpAccept=%2A%2F%2A",
            "@multimediatype": "GIF image file",
            "@type": "IMAGE-THUMBNAIL",
            "@size": "18698",
            "@ref": "gr8",
            "@mimetype": "image/gif"
          },
          {
            "@category": "thumbnail",
            "@height": "164",
            "@width": "144",
            "@_fa": "true",
            "$": "https://api.elsevier.com/content/object/eid/1-s2.0-S0926860X20302921-gr9.sml?httpAccept=%2A%2F%2A",
            "@multimediatype": "GIF image file",
            "@type": "IMAGE-THUMBNAIL",
            "@size": "16697",
            "@ref": "gr9",
            "@mimetype": "image/gif"
          },
          {
            "@category": "thumbnail",
            "@height": "164",
            "@width": "184",
            "@_fa": "true",
            "$": "https://api.elsevier.com/content/object/eid/1-s2.0-S0926860X20302921-gr6.sml?httpAccept=%2A%2F%2A",
            "@multimediatype": "GIF image file",
            "@type": "IMAGE-THUMBNAIL",
            "@size": "8760",
            "@ref": "gr6",
            "@mimetype": "image/gif"
          },
          {
            "@category": "thumbnail",
            "@height": "164",
            "@width": "190",
            "@_fa": "true",
            "$": "https://api.elsevier.com/content/object/eid/1-s2.0-S0926860X20302921-gr7.sml?httpAccept=%2A%2F%2A",
            "@multimediatype": "GIF image file",
            "@type": "IMAGE-THUMBNAIL",
            "@size": "9729",
            "@ref": "gr7",
            "@mimetype": "image/gif"
          },
          {
            "@category": "thumbnail",
            "@height": "85",
            "@width": "219",
            "@_fa": "true",
            "$": "https://api.elsevier.com/content/object/eid/1-s2.0-S0926860X20302921-ga1.sml?httpAccept=%2A%2F%2A",
            "@multimediatype": "GIF image file",
            "@type": "IMAGE-THUMBNAIL",
            "@size": "10886",
            "@ref": "ga1",
            "@mimetype": "image/gif"
          },
          {
            "@category": "thumbnail",
            "@height": "164",
            "@width": "186",
            "@_fa": "true",
            "$": "https://api.elsevier.com/content/object/eid/1-s2.0-S0926860X20302921-gr11.sml?httpAccept=%2A%2F%2A",
            "@multimediatype": "GIF image file",
            "@type": "IMAGE-THUMBNAIL",
            "@size": "5931",
            "@ref": "gr11",
            "@mimetype": "image/gif"
          },
          {
            "@category": "thumbnail",
            "@height": "113",
            "@width": "219",
            "@_fa": "true",
            "$": "https://api.elsevier.com/content/object/eid/1-s2.0-S0926860X20302921-gr12.sml?httpAccept=%2A%2F%2A",
            "@multimediatype": "GIF image file",
            "@type": "IMAGE-THUMBNAIL",
            "@size": "5332",
            "@ref": "gr12",
            "@mimetype": "image/gif"
          },
          {
            "@category": "thumbnail",
            "@height": "89",
            "@width": "219",
            "@_fa": "true",
            "$": "https://api.elsevier.com/content/object/eid/1-s2.0-S0926860X20302921-gr10.sml?httpAccept=%2A%2F%2A",
            "@multimediatype": "GIF image file",
            "@type": "IMAGE-THUMBNAIL",
            "@size": "7494",
            "@ref": "gr10",
            "@mimetype": "image/gif"
          },
          {
            "@category": "high",
            "@height": "1807",
            "@width": "1508",
            "@_fa": "true",
            "$": "https://api.elsevier.com/content/object/eid/1-s2.0-S0926860X20302921-gr1_lrg.jpg?httpAccept=%2A%2F%2A",
            "@multimediatype": "JPEG image file",
            "@type": "IMAGE-HIGH-RES",
            "@size": "198324",
            "@ref": "gr1",
            "@mimetype": "image/jpeg"
          },
          {
            "@category": "high",
            "@height": "1215",
            "@width": "2508",
            "@_fa": "true",
            "$": "https://api.elsevier.com/content/object/eid/1-s2.0-S0926860X20302921-gr13_lrg.jpg?httpAccept=%2A%2F%2A",
            "@multimediatype": "JPEG image file",
            "@type": "IMAGE-HIGH-RES",
            "@size": "560254",
            "@ref": "gr13",
            "@mimetype": "image/jpeg"
          },
          {
            "@category": "high",
            "@height": "3085",
            "@width": "3175",
            "@_fa": "true",
            "$": "https://api.elsevier.com/content/object/eid/1-s2.0-S0926860X20302921-gr4_lrg.jpg?httpAccept=%2A%2F%2A",
            "@multimediatype": "JPEG image file",
            "@type": "IMAGE-HIGH-RES",
            "@size": "1686211",
            "@ref": "gr4",
            "@mimetype": "image/jpeg"
          },
          {
            "@category": "high",
            "@height": "2674",
            "@width": "3008",
            "@_fa": "true",
            "$": "https://api.elsevier.com/content/object/eid/1-s2.0-S0926860X20302921-gr5_lrg.jpg?httpAccept=%2A%2F%2A",
            "@multimediatype": "JPEG image file",
            "@type": "IMAGE-HIGH-RES",
            "@size": "560689",
            "@ref": "gr5",
            "@mimetype": "image/jpeg"
          },
          {
            "@category": "high",
            "@height": "1999",
            "@width": "1508",
            "@_fa": "true",
            "$": "https://api.elsevier.com/content/object/eid/1-s2.0-S0926860X20302921-gr2_lrg.jpg?httpAccept=%2A%2F%2A",
            "@multimediatype": "JPEG image file",
            "@type": "IMAGE-HIGH-RES",
            "@size": "296503",
            "@ref": "gr2",
            "@mimetype": "image/jpeg"
          },
          {
            "@category": "high",
            "@height": "3415",
            "@width": "3175",
            "@_fa": "true",
            "$": "https://api.elsevier.com/content/object/eid/1-s2.0-S0926860X20302921-gr3_lrg.jpg?httpAccept=%2A%2F%2A",
            "@multimediatype": "JPEG image file",
            "@type": "IMAGE-HIGH-RES",
            "@size": "1840946",
            "@ref": "gr3",
            "@mimetype": "image/jpeg"
          },
          {
            "@category": "high",
            "@height": "3490",
            "@width": "3175",
            "@_fa": "true",
            "$": "https://api.elsevier.com/content/object/eid/1-s2.0-S0926860X20302921-gr8_lrg.jpg?httpAccept=%2A%2F%2A",
            "@multimediatype": "JPEG image file",
            "@type": "IMAGE-HIGH-RES",
            "@size": "2016381",
            "@ref": "gr8",
            "@mimetype": "image/jpeg"
          },
          {
            "@category": "high",
            "@height": "3613",
            "@width": "3175",
            "@_fa": "true",
            "$": "https://api.elsevier.com/content/object/eid/1-s2.0-S0926860X20302921-gr9_lrg.jpg?httpAccept=%2A%2F%2A",
            "@multimediatype": "JPEG image file",
            "@type": "IMAGE-HIGH-RES",
            "@size": "2543554",
            "@ref": "gr9",
            "@mimetype": "image/jpeg"
          },
          {
            "@category": "high",
            "@height": "2682",
            "@width": "3008",
            "@_fa": "true",
            "$": "https://api.elsevier.com/content/object/eid/1-s2.0-S0926860X20302921-gr6_lrg.jpg?httpAccept=%2A%2F%2A",
            "@multimediatype": "JPEG image file",
            "@type": "IMAGE-HIGH-RES",
            "@size": "428447",
            "@ref": "gr6",
            "@mimetype": "image/jpeg"
          },
          {
            "@category": "high",
            "@height": "1302",
            "@width": "1508",
            "@_fa": "true",
            "$": "https://api.elsevier.com/content/object/eid/1-s2.0-S0926860X20302921-gr7_lrg.jpg?httpAccept=%2A%2F%2A",
            "@multimediatype": "JPEG image file",
            "@type": "IMAGE-HIGH-RES",
            "@size": "158840",
            "@ref": "gr7",
            "@mimetype": "image/jpeg"
          },
          {
            "@category": "high",
            "@height": "862",
            "@width": "2213",
            "@_fa": "true",
            "$": "https://api.elsevier.com/content/object/eid/1-s2.0-S0926860X20302921-ga1_lrg.jpg?httpAccept=%2A%2F%2A",
            "@multimediatype": "JPEG image file",
            "@type": "IMAGE-HIGH-RES",
            "@size": "224779",
            "@ref": "ga1",
            "@mimetype": "image/jpeg"
          },
          {
            "@category": "high",
            "@height": "1912",
            "@width": "2175",
            "@_fa": "true",
            "$": "https://api.elsevier.com/content/object/eid/1-s2.0-S0926860X20302921-gr11_lrg.jpg?httpAccept=%2A%2F%2A",
            "@multimediatype": "JPEG image file",
            "@type": "IMAGE-HIGH-RES",
            "@size": "246860",
            "@ref": "gr11",
            "@mimetype": "image/jpeg"
          },
          {
            "@category": "high",
            "@height": "1289",
            "@width": "2508",
            "@_fa": "true",
            "$": "https://api.elsevier.com/content/object/eid/1-s2.0-S0926860X20302921-gr12_lrg.jpg?httpAccept=%2A%2F%2A",
            "@multimediatype": "JPEG image file",
            "@type": "IMAGE-HIGH-RES",
            "@size": "219975",
            "@ref": "gr12",
            "@mimetype": "image/jpeg"
          },
          {
            "@category": "high",
            "@height": "1017",
            "@width": "2508",
            "@_fa": "true",
            "$": "https://api.elsevier.com/content/object/eid/1-s2.0-S0926860X20302921-gr10_lrg.jpg?httpAccept=%2A%2F%2A",
            "@multimediatype": "JPEG image file",
            "@type": "IMAGE-HIGH-RES",
            "@size": "240759",
            "@ref": "gr10",
            "@mimetype": "image/jpeg"
          },
          {
            "@category": "standard",
            "@_fa": "true",
            "$": "https://api.elsevier.com/content/object/eid/1-s2.0-S0926860X20302921-mmc1.pdf?httpAccept=%2A%2F%2A",
            "@multimediatype": "Acrobat PDF file",
            "@type": "APPLICATION",
            "@size": "673349",
            "@ref": "mmc1",
            "@mimetype": "application/pdf"
          },
          {
            "@category": "thumbnail",
            "@_fa": "true",
            "$": "https://api.elsevier.com/content/object/eid/1-s2.0-S0926860X20302921-si1.svg?httpAccept=%2A%2F%2A",
            "@multimediatype": "Scalable Vector Graphics file",
            "@type": "ALTIMG",
            "@size": "20450",
            "@ref": "si1",
            "@mimetype": "image/svg+xml"
          },
          {
            "@category": "standard",
            "@_fa": "true",
            "$": "https://api.elsevier.com/content/object/eid/1-s2.0-S0926860X20302921-am.pdf?httpAccept=%2A%2F%2A",
            "@multimediatype": "Acrobat PDF file",
            "@type": "AAM-PDF",
            "@size": "1808396",
            "@ref": "am",
            "@mimetype": "application/pdf"
          }
        ]
      },
      "link": {
        "@rel": "abstract",
        "@href": "https://api.elsevier.com/content/abstract/scopus_id/85087715153"
      }
    }
  }
}