{
  "metadata": {
    "title": "On the nature of the deactivation of supported palladium nanoparticle catalysts in the decarboxylation of fatty acids",
    "authors": "; ; ",
    "journal": "Applied Catalysis A: General",
    "date": "2011-04-15",
    "doi": "10.1016/j.apcata.2011.01.042",
    "abstract": "",
    "uri": "https://api.elsevier.com/content/article/pii/S0926860X11000585",
    "pii": "S0926860X11000585"
  },
  "fulltext": {
    "full-text-retrieval-response": {
      "scopus-eid": "2-s2.0-79952988604",
      "originalText": "serial JL 271346 291210 291744 291809 31 Applied Catalysis A: General APPLIEDCATALYSISAGENERAL 2011-02-04 2011-02-04 2013-05-16T08:32:17 1-s2.0-S0926860X11000585 S0926-860X(11)00058-5 S0926860X11000585 10.1016/j.apcata.2011.01.042 S300 S300.1 FULL-TEXT 1-s2.0-S0926860X11X00054 2024-01-01T12:28:01.610683Z 0 0 20110415 2011 2011-02-04T00:00:00Z articleinfo crossmark dco dateupdated tomb dateloaded datesearch indexeddate issuelist volumelist yearnav absattachment articletitlenorm authfirstinitialnorm authfirstsurnamenorm cid cids contenttype copyright dateloadedtxt docsubtype doctype doi eid ewtransactionid hubeid issfirst issn issnnorm itemstage itemtransactionid itemweight openaccess openarchive pg pgfirst pglast pii piinorm pubdatestart pubdatetxt pubyr sectiontitle sortorder srctitle srctitlenorm srctype subheadings volfirst volissue webpdf webpdfpagecount figure table e-component body mmlmath acknowledge affil appendices articletitle auth authfirstini authfull authkeywords authlast primabst ref specialabst alllist content subj ssids 0926-860X 0926860X false 396 396 1 2 1 2 Volume 396, Issues 1–2 13 85 90 85 90 20110415 15 April 2011 2011-04-15 2011 Articles article fla Copyright © 2011 Elsevier B.V. All rights reserved. NATUREDEACTIVATIONSUPPORTEDPALLADIUMNANOPARTICLECATALYSTSINDECARBOXYLATIONFATTYACIDS PING E 1 Introduction 2 Experimental methods 2.1 Chemicals 2.2 Material synthesis 2.3 Material characterization 2.4 Decarboxylation procedure 3 Results and discussion 4 Conclusions Acknowledgements Appendix A Supplementary data References NARASIMHARAO 2007 19 30 K ASH 2007 M ELECTRONICOUTLOOKREPORTECONOMICRESEARCHSERVICE SNARE 2008 933 945 M MAKIARVELA 2008 3543 3549 P LESTARI 2008 247 251 S SNARE 2007 29 34 M MAKIARVELA 2007 30 41 P SNARE 2006 5708 5715 M KUBICKOVA 2005 197 200 I SIMAKOVA 2010 28 31 I BERNAS 2010 2033 2039 H SIMAKOVA 2009 100 108 I LESTARI 2009 48 51 S LESTARI 2009 3842 3845 S PING 2010 174 180 E LESTARI 2010 250 257 S IMMER 2010 134 139 J LUKENS 1999 5403 5409 W IMMER 2010 5291 5299 J PINGX2011X85 PINGX2011X85X90 PINGX2011X85XE PINGX2011X85X90XE item S0926-860X(11)00058-5 S0926860X11000585 1-s2.0-S0926860X11000585 10.1016/j.apcata.2011.01.042 271346 2024-01-01T12:28:01.610683Z 2011-04-15 1-s2.0-S0926860X11000585-main.pdf https://s3.amazonaws.com/prod-ucs-content-store-us-east/content/pii:S0926860X11000585/MAIN/application/pdf/7d089d5eef76960d4ece1c3dcdb18ec1/main.pdf https://s3-eu-west-1.amazonaws.com/prod-ucs-content-store-eu-west/content/pii:S0926860X11000585/MAIN/application/pdf/7d089d5eef76960d4ece1c3dcdb18ec1/main.pdf main.pdf pdf true 649438 MAIN 6 1-s2.0-S0926860X11000585-main_1.png https://s3-eu-west-1.amazonaws.com/prod-ucs-content-store-eu-west/content/pii:S0926860X11000585/PREVIEW/image/png/a19ad340f83a6ef9d690b8a420276fb8/main_1.png https://s3.amazonaws.com/prod-ucs-content-store-us-east/content/pii:S0926860X11000585/PREVIEW/image/png/a19ad340f83a6ef9d690b8a420276fb8/main_1.png main_1.png png 57924 849 656 IMAGE-WEB-PDF 1 1-s2.0-S0926860X11000585-si3.gif https://s3-eu-west-1.amazonaws.com/prod-ucs-content-store-eu-west/content/pii:S0926860X11000585/STRIPIN/image/gif/b3164ce78997fc27cbfffe3cd789c458/si1.gif https://s3.amazonaws.com/prod-ucs-content-store-us-east/content/pii:S0926860X11000585/STRIPIN/image/gif/b3164ce78997fc27cbfffe3cd789c458/si1.gif si3 si3.gif gif 404 20 73 ALTIMG 1-s2.0-S0926860X11000585-si2.gif https://s3-eu-west-1.amazonaws.com/prod-ucs-content-store-eu-west/content/pii:S0926860X11000585/STRIPIN/image/gif/ad858be18235f04b1e6ba39aff076a16/si2.gif https://s3.amazonaws.com/prod-ucs-content-store-us-east/content/pii:S0926860X11000585/STRIPIN/image/gif/ad858be18235f04b1e6ba39aff076a16/si2.gif si2 si2.gif gif 374 18 64 ALTIMG 1-s2.0-S0926860X11000585-si1.gif https://s3-eu-west-1.amazonaws.com/prod-ucs-content-store-eu-west/content/pii:S0926860X11000585/STRIPIN/image/gif/b3164ce78997fc27cbfffe3cd789c458/si1.gif https://s3.amazonaws.com/prod-ucs-content-store-us-east/content/pii:S0926860X11000585/STRIPIN/image/gif/b3164ce78997fc27cbfffe3cd789c458/si1.gif si1 si1.gif gif 404 20 73 ALTIMG 1-s2.0-S0926860X11000585-gr9_lrg.jpg https://s3.amazonaws.com/prod-ucs-content-store-us-east/content/pii:S0926860X11000585/gr9/HIGHRES/image/jpeg/aaf39b93fe14b0b22ed3ce1d37f747f0/gr9_lrg.jpg https://s3-eu-west-1.amazonaws.com/prod-ucs-content-store-eu-west/content/pii:S0926860X11000585/gr9/HIGHRES/image/jpeg/aaf39b93fe14b0b22ed3ce1d37f747f0/gr9_lrg.jpg gr9 gr9_lrg.jpg jpg 84286 910 1719 IMAGE-HIGH-RES 1-s2.0-S0926860X11000585-gr8_lrg.jpg https://s3.amazonaws.com/prod-ucs-content-store-us-east/content/pii:S0926860X11000585/gr8/HIGHRES/image/jpeg/1f23f8a252d8119f8d99ed59020cf7f6/gr8_lrg.jpg https://s3-eu-west-1.amazonaws.com/prod-ucs-content-store-eu-west/content/pii:S0926860X11000585/gr8/HIGHRES/image/jpeg/1f23f8a252d8119f8d99ed59020cf7f6/gr8_lrg.jpg gr8 gr8_lrg.jpg jpg 135808 933 1668 IMAGE-HIGH-RES 1-s2.0-S0926860X11000585-gr7_lrg.jpg https://s3.amazonaws.com/prod-ucs-content-store-us-east/content/pii:S0926860X11000585/gr7/HIGHRES/image/jpeg/3ca13b07e4c030c244add712f6b3c3c2/gr7_lrg.jpg https://s3-eu-west-1.amazonaws.com/prod-ucs-content-store-eu-west/content/pii:S0926860X11000585/gr7/HIGHRES/image/jpeg/3ca13b07e4c030c244add712f6b3c3c2/gr7_lrg.jpg gr7 gr7_lrg.jpg jpg 94262 967 1669 IMAGE-HIGH-RES 1-s2.0-S0926860X11000585-gr6_lrg.jpg https://s3.amazonaws.com/prod-ucs-content-store-us-east/content/pii:S0926860X11000585/gr6/HIGHRES/image/jpeg/d126c33121e4b1c6e118becba4d37e93/gr6_lrg.jpg https://s3-eu-west-1.amazonaws.com/prod-ucs-content-store-eu-west/content/pii:S0926860X11000585/gr6/HIGHRES/image/jpeg/d126c33121e4b1c6e118becba4d37e93/gr6_lrg.jpg gr6 gr6_lrg.jpg jpg 403062 1023 2500 IMAGE-HIGH-RES 1-s2.0-S0926860X11000585-gr5_lrg.jpg https://s3.amazonaws.com/prod-ucs-content-store-us-east/content/pii:S0926860X11000585/gr5/HIGHRES/image/jpeg/7870f728918308dd1b6d78d78fdbdac3/gr5_lrg.jpg https://s3-eu-west-1.amazonaws.com/prod-ucs-content-store-eu-west/content/pii:S0926860X11000585/gr5/HIGHRES/image/jpeg/7870f728918308dd1b6d78d78fdbdac3/gr5_lrg.jpg gr5 gr5_lrg.jpg jpg 152377 1035 1598 IMAGE-HIGH-RES 1-s2.0-S0926860X11000585-gr4_lrg.jpg https://s3.amazonaws.com/prod-ucs-content-store-us-east/content/pii:S0926860X11000585/gr4/HIGHRES/image/jpeg/3a3e04d5ee00535500c7d669685cc9fe/gr4_lrg.jpg https://s3-eu-west-1.amazonaws.com/prod-ucs-content-store-eu-west/content/pii:S0926860X11000585/gr4/HIGHRES/image/jpeg/3a3e04d5ee00535500c7d669685cc9fe/gr4_lrg.jpg gr4 gr4_lrg.jpg jpg 123522 1029 1577 IMAGE-HIGH-RES 1-s2.0-S0926860X11000585-gr3_lrg.jpg https://s3.amazonaws.com/prod-ucs-content-store-us-east/content/pii:S0926860X11000585/gr3/HIGHRES/image/jpeg/aadf48fe06c6c3f511fec5523375a83c/gr3_lrg.jpg https://s3-eu-west-1.amazonaws.com/prod-ucs-content-store-eu-west/content/pii:S0926860X11000585/gr3/HIGHRES/image/jpeg/aadf48fe06c6c3f511fec5523375a83c/gr3_lrg.jpg gr3 gr3_lrg.jpg jpg 134580 900 1575 IMAGE-HIGH-RES 1-s2.0-S0926860X11000585-gr2_lrg.jpg https://s3.amazonaws.com/prod-ucs-content-store-us-east/content/pii:S0926860X11000585/gr2/HIGHRES/image/jpeg/927a071b5ac938bf5ff62e8e4fa14806/gr2_lrg.jpg https://s3-eu-west-1.amazonaws.com/prod-ucs-content-store-eu-west/content/pii:S0926860X11000585/gr2/HIGHRES/image/jpeg/927a071b5ac938bf5ff62e8e4fa14806/gr2_lrg.jpg gr2 gr2_lrg.jpg jpg 77175 975 1593 IMAGE-HIGH-RES 1-s2.0-S0926860X11000585-gr1_lrg.jpg https://s3.amazonaws.com/prod-ucs-content-store-us-east/content/pii:S0926860X11000585/gr1/HIGHRES/image/jpeg/de3e543663493666ff52045a3c49b57f/gr1_lrg.jpg https://s3-eu-west-1.amazonaws.com/prod-ucs-content-store-eu-west/content/pii:S0926860X11000585/gr1/HIGHRES/image/jpeg/de3e543663493666ff52045a3c49b57f/gr1_lrg.jpg gr1 gr1_lrg.jpg jpg 957851 961 2500 IMAGE-HIGH-RES 1-s2.0-S0926860X11000585-fx1_lrg.jpg https://s3.amazonaws.com/prod-ucs-content-store-us-east/content/pii:S0926860X11000585/fx1/HIGHRES/image/jpeg/6a0911cba150c277873206c16d31c988/fx1_lrg.jpg https://s3-eu-west-1.amazonaws.com/prod-ucs-content-store-eu-west/content/pii:S0926860X11000585/fx1/HIGHRES/image/jpeg/6a0911cba150c277873206c16d31c988/fx1_lrg.jpg fx1 true fx1_lrg.jpg jpg 256481 886 2213 IMAGE-HIGH-RES 1-s2.0-S0926860X11000585-gr9.jpg https://s3.amazonaws.com/prod-ucs-content-store-us-east/content/pii:S0926860X11000585/gr9/DOWNSAMPLED/image/jpeg/b52a7ae352aa628000126896571aeb3e/gr9.jpg https://s3-eu-west-1.amazonaws.com/prod-ucs-content-store-eu-west/content/pii:S0926860X11000585/gr9/DOWNSAMPLED/image/jpeg/b52a7ae352aa628000126896571aeb3e/gr9.jpg gr9 gr9.jpg jpg 12310 205 388 IMAGE-DOWNSAMPLED 1-s2.0-S0926860X11000585-gr8.jpg https://s3.amazonaws.com/prod-ucs-content-store-us-east/content/pii:S0926860X11000585/gr8/DOWNSAMPLED/image/jpeg/a077d9fb908b87009c5ae64fe5da66dc/gr8.jpg https://s3-eu-west-1.amazonaws.com/prod-ucs-content-store-eu-west/content/pii:S0926860X11000585/gr8/DOWNSAMPLED/image/jpeg/a077d9fb908b87009c5ae64fe5da66dc/gr8.jpg gr8 gr8.jpg jpg 17742 210 376 IMAGE-DOWNSAMPLED 1-s2.0-S0926860X11000585-gr7.jpg https://s3.amazonaws.com/prod-ucs-content-store-us-east/content/pii:S0926860X11000585/gr7/DOWNSAMPLED/image/jpeg/c535b12daabe915fffe733494bca2bd5/gr7.jpg https://s3-eu-west-1.amazonaws.com/prod-ucs-content-store-eu-west/content/pii:S0926860X11000585/gr7/DOWNSAMPLED/image/jpeg/c535b12daabe915fffe733494bca2bd5/gr7.jpg gr7 gr7.jpg jpg 12732 218 377 IMAGE-DOWNSAMPLED 1-s2.0-S0926860X11000585-gr6.jpg https://s3.amazonaws.com/prod-ucs-content-store-us-east/content/pii:S0926860X11000585/gr6/DOWNSAMPLED/image/jpeg/67253be8665ec7fd54eb1026acd07e93/gr6.jpg https://s3-eu-west-1.amazonaws.com/prod-ucs-content-store-eu-west/content/pii:S0926860X11000585/gr6/DOWNSAMPLED/image/jpeg/67253be8665ec7fd54eb1026acd07e93/gr6.jpg gr6 gr6.jpg jpg 33063 231 565 IMAGE-DOWNSAMPLED 1-s2.0-S0926860X11000585-gr5.jpg https://s3.amazonaws.com/prod-ucs-content-store-us-east/content/pii:S0926860X11000585/gr5/DOWNSAMPLED/image/jpeg/1f190d1f50217910f587796d8b73de9b/gr5.jpg https://s3-eu-west-1.amazonaws.com/prod-ucs-content-store-eu-west/content/pii:S0926860X11000585/gr5/DOWNSAMPLED/image/jpeg/1f190d1f50217910f587796d8b73de9b/gr5.jpg gr5 gr5.jpg jpg 16819 234 361 IMAGE-DOWNSAMPLED 1-s2.0-S0926860X11000585-gr4.jpg https://s3.amazonaws.com/prod-ucs-content-store-us-east/content/pii:S0926860X11000585/gr4/DOWNSAMPLED/image/jpeg/65b70e0c3efca6745f001f87f8ae1f0f/gr4.jpg https://s3-eu-west-1.amazonaws.com/prod-ucs-content-store-eu-west/content/pii:S0926860X11000585/gr4/DOWNSAMPLED/image/jpeg/65b70e0c3efca6745f001f87f8ae1f0f/gr4.jpg gr4 gr4.jpg jpg 14657 232 356 IMAGE-DOWNSAMPLED 1-s2.0-S0926860X11000585-gr3.jpg https://s3.amazonaws.com/prod-ucs-content-store-us-east/content/pii:S0926860X11000585/gr3/DOWNSAMPLED/image/jpeg/0b9a05eb6fe2278c291875cd9d0b649c/gr3.jpg https://s3-eu-west-1.amazonaws.com/prod-ucs-content-store-eu-west/content/pii:S0926860X11000585/gr3/DOWNSAMPLED/image/jpeg/0b9a05eb6fe2278c291875cd9d0b649c/gr3.jpg gr3 gr3.jpg jpg 21061 203 355 IMAGE-DOWNSAMPLED 1-s2.0-S0926860X11000585-gr2.jpg https://s3.amazonaws.com/prod-ucs-content-store-us-east/content/pii:S0926860X11000585/gr2/DOWNSAMPLED/image/jpeg/36bfdd5703dd31b40f18b968d58d2e14/gr2.jpg https://s3-eu-west-1.amazonaws.com/prod-ucs-content-store-eu-west/content/pii:S0926860X11000585/gr2/DOWNSAMPLED/image/jpeg/36bfdd5703dd31b40f18b968d58d2e14/gr2.jpg gr2 gr2.jpg jpg 10246 220 360 IMAGE-DOWNSAMPLED 1-s2.0-S0926860X11000585-gr1.jpg https://s3.amazonaws.com/prod-ucs-content-store-us-east/content/pii:S0926860X11000585/gr1/DOWNSAMPLED/image/jpeg/c597e68949a2446acf07c713fa5bc56f/gr1.jpg https://s3-eu-west-1.amazonaws.com/prod-ucs-content-store-eu-west/content/pii:S0926860X11000585/gr1/DOWNSAMPLED/image/jpeg/c597e68949a2446acf07c713fa5bc56f/gr1.jpg gr1 gr1.jpg jpg 64612 217 565 IMAGE-DOWNSAMPLED 1-s2.0-S0926860X11000585-fx1.jpg https://s3.amazonaws.com/prod-ucs-content-store-us-east/content/pii:S0926860X11000585/fx1/DOWNSAMPLED/image/jpeg/de4a89a2764c7d79abab949f66bf0ef4/fx1.jpg https://s3-eu-west-1.amazonaws.com/prod-ucs-content-store-eu-west/content/pii:S0926860X11000585/fx1/DOWNSAMPLED/image/jpeg/de4a89a2764c7d79abab949f66bf0ef4/fx1.jpg fx1 true fx1.jpg jpg 23797 200 500 IMAGE-DOWNSAMPLED 1-s2.0-S0926860X11000585-gr9.sml https://s3.amazonaws.com/prod-ucs-content-store-us-east/content/pii:S0926860X11000585/gr9/THUMBNAIL/image/gif/316a79eea56bb0526eb249b151132eb2/gr9.sml https://s3-eu-west-1.amazonaws.com/prod-ucs-content-store-eu-west/content/pii:S0926860X11000585/gr9/THUMBNAIL/image/gif/316a79eea56bb0526eb249b151132eb2/gr9.sml gr9 gr9.sml sml 3009 116 219 IMAGE-THUMBNAIL 1-s2.0-S0926860X11000585-gr8.sml https://s3.amazonaws.com/prod-ucs-content-store-us-east/content/pii:S0926860X11000585/gr8/THUMBNAIL/image/gif/abc29cb821bd4c5dcda46dac81fea1f6/gr8.sml https://s3-eu-west-1.amazonaws.com/prod-ucs-content-store-eu-west/content/pii:S0926860X11000585/gr8/THUMBNAIL/image/gif/abc29cb821bd4c5dcda46dac81fea1f6/gr8.sml gr8 gr8.sml sml 4155 122 219 IMAGE-THUMBNAIL 1-s2.0-S0926860X11000585-gr7.sml https://s3.amazonaws.com/prod-ucs-content-store-us-east/content/pii:S0926860X11000585/gr7/THUMBNAIL/image/gif/4d93d9ff3a1343b23c496fa47604794e/gr7.sml https://s3-eu-west-1.amazonaws.com/prod-ucs-content-store-eu-west/content/pii:S0926860X11000585/gr7/THUMBNAIL/image/gif/4d93d9ff3a1343b23c496fa47604794e/gr7.sml gr7 gr7.sml sml 2722 127 219 IMAGE-THUMBNAIL 1-s2.0-S0926860X11000585-gr6.sml https://s3.amazonaws.com/prod-ucs-content-store-us-east/content/pii:S0926860X11000585/gr6/THUMBNAIL/image/gif/02f22fdf1003122d84d6317d0ab56089/gr6.sml https://s3-eu-west-1.amazonaws.com/prod-ucs-content-store-eu-west/content/pii:S0926860X11000585/gr6/THUMBNAIL/image/gif/02f22fdf1003122d84d6317d0ab56089/gr6.sml gr6 gr6.sml sml 5388 90 219 IMAGE-THUMBNAIL 1-s2.0-S0926860X11000585-gr5.sml https://s3.amazonaws.com/prod-ucs-content-store-us-east/content/pii:S0926860X11000585/gr5/THUMBNAIL/image/gif/48f4b443653a658b6e180f8f817a9337/gr5.sml https://s3-eu-west-1.amazonaws.com/prod-ucs-content-store-eu-west/content/pii:S0926860X11000585/gr5/THUMBNAIL/image/gif/48f4b443653a658b6e180f8f817a9337/gr5.sml gr5 gr5.sml sml 4643 142 219 IMAGE-THUMBNAIL 1-s2.0-S0926860X11000585-gr4.sml https://s3.amazonaws.com/prod-ucs-content-store-us-east/content/pii:S0926860X11000585/gr4/THUMBNAIL/image/gif/803e94d74e3c265f1ce61bb05a57d5df/gr4.sml https://s3-eu-west-1.amazonaws.com/prod-ucs-content-store-eu-west/content/pii:S0926860X11000585/gr4/THUMBNAIL/image/gif/803e94d74e3c265f1ce61bb05a57d5df/gr4.sml gr4 gr4.sml sml 4119 143 219 IMAGE-THUMBNAIL 1-s2.0-S0926860X11000585-gr3.sml https://s3.amazonaws.com/prod-ucs-content-store-us-east/content/pii:S0926860X11000585/gr3/THUMBNAIL/image/gif/0eb4f95b33758ab1a568729eb9536230/gr3.sml https://s3-eu-west-1.amazonaws.com/prod-ucs-content-store-eu-west/content/pii:S0926860X11000585/gr3/THUMBNAIL/image/gif/0eb4f95b33758ab1a568729eb9536230/gr3.sml gr3 gr3.sml sml 4672 125 219 IMAGE-THUMBNAIL 1-s2.0-S0926860X11000585-gr2.sml https://s3.amazonaws.com/prod-ucs-content-store-us-east/content/pii:S0926860X11000585/gr2/THUMBNAIL/image/gif/bdbcb45c660647fabdfac7ab50d8a84f/gr2.sml https://s3-eu-west-1.amazonaws.com/prod-ucs-content-store-eu-west/content/pii:S0926860X11000585/gr2/THUMBNAIL/image/gif/bdbcb45c660647fabdfac7ab50d8a84f/gr2.sml gr2 gr2.sml sml 3013 134 219 IMAGE-THUMBNAIL 1-s2.0-S0926860X11000585-gr1.sml https://s3.amazonaws.com/prod-ucs-content-store-us-east/content/pii:S0926860X11000585/gr1/THUMBNAIL/image/gif/32e87c9fcaecfb3dde56ec719538336c/gr1.sml https://s3-eu-west-1.amazonaws.com/prod-ucs-content-store-eu-west/content/pii:S0926860X11000585/gr1/THUMBNAIL/image/gif/32e87c9fcaecfb3dde56ec719538336c/gr1.sml gr1 gr1.sml sml 6729 84 219 IMAGE-THUMBNAIL 1-s2.0-S0926860X11000585-fx1.sml https://s3.amazonaws.com/prod-ucs-content-store-us-east/content/pii:S0926860X11000585/fx1/THUMBNAIL/image/gif/11946c82042355df9a451f7a165a61cd/fx1.sml https://s3-eu-west-1.amazonaws.com/prod-ucs-content-store-eu-west/content/pii:S0926860X11000585/fx1/THUMBNAIL/image/gif/11946c82042355df9a451f7a165a61cd/fx1.sml fx1 true fx1.sml sml 5137 88 219 IMAGE-THUMBNAIL 1-s2.0-S0926860X11000585-mmc1.doc https://s3.amazonaws.com/prod-ucs-content-store-us-east/content/pii:S0926860X11000585/mmc1/MAIN/application/msword/98ecd8ea330b22ac1d4a690dae5cd868/mmc1.doc https://s3-eu-west-1.amazonaws.com/prod-ucs-content-store-eu-west/content/pii:S0926860X11000585/mmc1/MAIN/application/msword/98ecd8ea330b22ac1d4a690dae5cd868/mmc1.doc mmc1 mmc1.doc doc 26112 APPLICATION APCATA 13018 S0926-860X(11)00058-5 10.1016/j.apcata.2011.01.042 Elsevier B.V. Fig. 1 TEM images of Pd-MCF catalyst showing the (a) foam-like silica substrate and (b) small Pd nanoparticles. Fig. 2 Decarboxylation kinetics of 0.15M stearic acid for (•) fresh Pd-MCF (♦) spent Pd-MCF. Fig. 3 XPS spectra of (top) fresh Pd-MCF and (bottom) spent Pd-MCF. Fig. 4 FT-EXAFS spectra of (black) fresh Pd-MCF and (orange) spent Pd-MCF.(For interpretation of the references to color in this figure legend, the reader is referred to the web version of the article.) Fig. 5 FT-EXAFS of (black) fresh Pd-MCF, (red) spent Pd-MCF calcined at 350°C, and (blue) spent Pd-MCF calcined at 600°C. Fig. 6 TEM images showing broad foam-like structure of (a) fresh Pd-MCF and (b) spent Pd-MCF [black bar=500nm]. Fig. 7 13C CP-MAS NMR of spent Pd-MCF. Fig. 8 FT-IR spectra of (top) spent Pd-MCF and (bottom) Pd-MCF-regen. Fig. 9 Decarboxylation kinetics of 0.15M stearic acid for (•) fresh Pd-MCF (♦) spent Pd-MCF (■) Pd-MCF-regen. Table 1 Physical and chemical characteristics of Pd-MCF catalysts. SA BET ( m 2 / g SiO 2 ) V pore ( cc/g SiO 2 ) d cell a (nm) d window a (nm) Organic b (wt%) Pd c (wt %) d Pd d (nm) SA Pd e ( m 2 / g SiO 2 ) MCF 710 2.9 37 17 – – – – Pd-MCF 670 2.5 36 16 – 5.5 2 12.7 spent Pd-MCF 515 1.7 34 16 16 5.5 2 0.6 Pd-MCF-350 550 2.0 34 16 10 5.3 5 2.1 Pd-MCF-600 650 2.4 35 16 0.3 5.6 9 3.0 Pd-MCF-regen 660 2.4 35 16 1.5 5.4 2 12.2 a BdB-FHH. b TGA. c EA. d EXAFS/TEM. e H2–O2 chemisorption. On the nature of the deactivation of supported palladium nanoparticle catalysts in the decarboxylation of fatty acids Eric W. Ping a John Pierson b Robert Wallace b Jeffrey T. Miller c Thomas F. Fuller a Christopher W. Jones a ⁎ a School of Chemical & Biomolecular Engineering, Georgia Institute of Technology, 311 Ferst Drive NW, Atlanta, GA 30332, USA b Georgia Tech Research Institute, Georgia Institute of Technology, 311 Ferst Drive NW, Atlanta, GA 30332, USA c Argonne National Laboratory, Chemical Sciences and Engineering Division, 9700 S. Cass Ave., Argonne, IL 60439, USA ⁎ Corresponding author. Tel.: +1 404 385 1683; fax: +1 404 894 2866. Graphical abstract Research highlights ► Highly dispersed palladium nanoparticles supported on silica mesoporous foam. ► Severe deactivation after one cycle in decarboxylation of stearic acid to n-C17. ► Deactivation caused by deposition of reactants and products—no measurable coking. ► Catalyst regains substantial activity after extraction of residual organics. Supported palladium catalysts are effective catalysts for the hydrogen-free decarboxylation of fatty acids. However, the catalysts deactivate severely after one use. Here, the recyclability of a well-defined, mesoporous silica-supported palladium nanoparticle catalyst is evaluated in the batch decarboxylation of stearic acid at 300°C under inert atmosphere, producing n-heptadecane. The nature of the catalyst deactivation is examined in detail via an array of characterization techniques. X-ray photoelectron spectroscopy (XPS) demonstrates that little palladium surface oxidation occurs over the course of the reaction, and a combination of X-ray absorption spectroscopy and transmission electron microscopy (TEM) suggests negligible particle sintering or agglomeration. Physisorption and chemisorption measurements demonstrate substantial loss in total surface area and porosity as well as accessible palladium surface area with these losses attributed to significant organic deposition on the catalyst, as verified via thermogravimetric analysis. High temperature calcination is applied to combust and remove these residues, but resultant nanoparticle agglomeration is significant. Solid state nuclear magnetic resonance spectroscopy (NMR), Fourier transform infrared spectroscopy (FT-IR) and solid dissolution followed by organic extraction methodologies demonstrate that the carbonaceous deposits are not coke but rather strongly adsorbed reactants and products. Detrimental coke formation, as suggested by prior literature, is verified to be absent, as extraction of the surface-deposited organic species yields nearly complete recovery of the total surface area, pore volume, and active palladium surface area. Furthermore, the regenerated catalyst exhibits a corresponding significant recovery of decarboxylation activity. Keywords Diesel Bio-fuel Deactivation Fatty acid Bio-diesel 1 Introduction In the past decade, a push to develop alternative fuels has been driven by the threat of decreasing petroleum reserves, the desire for greater domestic energy independence, and increased risk and cost in retrieving local fossil fuel reserves. Additionally, and most importantly from an environmental sustainability point of view, anthropogenic CO2 emissions have increased the atmospheric CO2 concentrations to significantly elevated levels [1,2]. Whether motivated by the threat of global climate change [3] or impending carbon emission regulations (tax, cap and trade, etc.), the need for viable renewable transportation fuels is greater than ever. From an economic standpoint, biofuels requiring highly refined feedstocks are simply not practical, as the cost of the feedstock alone generally eclipses that of a competitive final fuel [4]. Accordingly, much research has been put into utilizing attractive but low volume, lower-value feedstocks, such as animal by-products and other sources with high contents of fatty-acids [5]. In fact, two industrial processes have been announced in the last two years using high-acid waste streams composed of mainly animal byproducts: a ConocoPhillips partnership with Tyson to produce green diesel from chicken, pork & beef byproducts [6] and NExBTL's process for renewable diesel from plant and animal byproducts [7]. These processes, however, along with long-established hydroprocessing techniques, utilize high pressures of hydrogen to facilitate deoxygenation to paraffinic oils, increasing the operating cost of production facilities dramatically. Recently, the Murzin group reported catalysts capable of deoxygenating long-chain acids and derivatives without the use of high hydrogen pressures or without hydrogen altogether [8–14]. Their research demonstrated that a palladium on carbon catalyst can deoxygenate free fatty acids via decarboxylation in the absence of hydrogen overpressures to form the resultant alkane. Further research on this decarboxylation reaction has been carried out with continuing work from the Murzin group [15–19] and others [20–22], examining the effects of differing reaction atmospheres, temperatures, degrees of acid unsaturation, catalyst supports, and reactor types, with a wide variety of results. One observation that remains constant across the studies, however, is that the supported palladium catalysts readily deactivate during the decarboxylation reaction [12,16–18,20,22], having a detrimental effect on catalyst turnover and recycle. The trend in the literature is to recognize a decrease in catalyst surface area and pore volume, and therefore identify the most likely catalyst deactivation mechanism as coking. Although this may be a reasonable suggestion, additional evidence to support this and rule out other deactivation methods has not yet been reported. The approach in our initial study of fatty acid decarboxylation [20] was to develop a well-defined supported palladium catalyst that could be fully characterized both before and after deactivation. A mesocellular foam (MCF) silica support was chosen to allow post-mortem carbon-based characterization techniques that would not involve significant background subtraction or interference associated with use of the commonly studied activated carbon supports. Similarly, thermal oxidative treatments such as calcination could be applied to investigate the nature of the deactivation without the potential to alter the physical properties of the support itself, as may be the case with carbon-based supports. This silica support was also designed to have very large pores to allow not only for better internal mass transfer of reactants and products during reaction, but to provide a substrate on which the nature of the reported deposition could be more easily elucidated. Finally the catalyst was synthesized in such a way to deposit a very narrow size distribution of palladium nanoparticles uniformly throughout the silica particle, yielding a well-defined catalyst on which a battery of material properties could be compared before and after reaction. Furthermore, with a small average nanoparticle size (∼2nm), various characterization techniques could be used to track not only changes in nanoparticle particle size and morphology, but the high metal dispersion would facilitate spectroscopic confirmation of alterations in nanoparticle surface oxidation or chemical poisoning. Herein we apply this catalyst (Fig. 1 ) to the standard literature decarboxylation reaction of stearic acid to n-heptadecane with the aim of (i) elucidating the nature of the deactivation and (ii) developing a procedure to regenerate the catalytic activity. 2 Experimental methods 2.1 Chemicals The following chemicals were commercially available and used as received: dodecane (anhydrous, Sigma–Aldrich), N,O-bis(trimethylsilyl)acetamide (BSA, 95%, Sigma–Aldrich), pyridine (ACS grade >99%, Sigma–Aldrich), dichloromethane (DCM, ACS grade, EMD chemicals), stearic acid (>97%, Fluka), tetrahydrofuran (THF, ACS grade, EMD chemicals), hexane (anhydrous, Sigma–Aldrich), diethyl ether (anhydrous, Sigma–Aldrich), and potassium bromide (KBr, 99%, Alfa Aesar). Tridecane was purchased from Sigma–Aldrich, distilled over CaH2, and stored in a nitrogen glove box. 2.2 Material synthesis The Pd-MCF catalyst was synthesized as reported previously [20]. In this work, only the urea-functionalized precatalyst was utilized prior to metallation, mild calcination, and reduction under hydrogen flow. All samples were dried under vacuum and stored in a nitrogen glove box prior to further use in reaction or various characterization techniques. 2.3 Material characterization Nitrogen adsorption isotherms were measured at 77K on a Micromeritics ASAP 2010. Surface area was determined by the Brunauer-Emmett-Teller method, in general using relative pressures less than 0.15. The Broekhoff-de Boer method with the Frenkel-Halsey-Hill (BdB-FHH) modification, applied first to these materials by Stucky and co-workers [23], was used to calculate pore size distributions for both the large cells (adsorption upswing, assuming spherical capillary condensation) and the interconnecting windows (desorption downswing, assuming cylindrical capillary evaporation). A Netzsch STA409 was used for thermogravimetric analysis (TGA) under an air flow diluted by nitrogen. Samples were heated under flow at 10°C/min from 30 to 900°C, with the total organic content estimated from the weight loss between 150 and 800°C. Onboard differential scanning calorimetry (DSC) was used to identify peak temperatures of combustion exotherms. Total active metal surface area was determined by H2–O2–H2 titration chemisorption measurements in a Micromeritics AutoChem II 2920. To ensure full metal reduction, samples were reduced in 5% H2 flow at 300°C prior to analysis with sequential titrations of H2 and O2. H2 uptake at room temperature was monitored by a thermal conductivity detector (TCD), and as in previous studies [20], background uptake titrations on the bare support confirm negligible uptake from the catalyst substrate. Catalyst dissolution was performed by stirring 250mg catalyst in 100mL aqueous strong base (1g KOH/g H2O), resulting in free palladium nanoparticles, soluble silica salts, and any residual organics. The organic fraction was separated via extractions with diethyl ether and characterized with 1H NMR and GC–MS. Solution phase 1H nuclear magnetic resonance (NMR) measurements were performed using a Mercury Vx 400MHz with CDCl3 as solvent. Solid state 13C NMR spectra were measured using cross polarization magic-angle spinning (CP-MAS) measurements on a Bruker DSX 300 spectrometer at frequencies of 75.5MHz. The sample was packed into a 7mm rotor and spun at 5kHz, and a single pulse of π/2 and repetition time of 4s was used. The spectrum was recorded after 14,000 scans. The chemical shifts of 13C were referenced to adamantane. Infrared spectra were acquired using KBr pellets with a Bruker Vertex 80v with dual FT-IR and FT-Raman benches and Ram-II module. Powder X-ray diffraction (XRD) patterns were obtained on a Philips Analytical X’Pert diffractometer, Cu Kα radiation, equipped with an X’celerator detector and nickel filter. The scattered intensities were collected from 0.5° to 90° (2θ) by scanning at 0.008° (2θ) steps. X-ray photoelectron spectroscopy (XPS) was performed on a powder sample grid with a Thermo Scientific K-Alpha XPS at room temperature and 10−8 mbar vacuum. For palladium 3d scans, a 200μm incident spot size was measured with 0.1eV step size between 329 and 347eV and constant analyzer pass energy of 50eV, using the carbon 1s binding energy of 284.8eV as reference. Extended X-ray absorption fine structure (EXAFS) spectra were acquired at the Argonne National Lab, using the synchrotron radiation at the Advanced Photon Source, Beamline 10-ID. Absorbance spectra were measured from 24.2 to 25.2keV around the palladium k-edge (24.351keV). Phase shift and backscattering amplitudes were obtained from Pd foil. The EXAFS coordination parameters were obtained by a least square fit r-space of k 2-weighted Fourier transform data using standard procedures and WINXAS 3.1 software. The quality of the fits were equally good with both k 1 and k 3 weightings. Quantitative analyses of reaction kinetics and conversions were performed on a Shimadzu GC-2010 gas chromatograph with flame ionization detector (GC-FID) equipped with an SHRX5 column (15m, 0.25μm film thickness, 0.25mm i.d.). Verification of organic products and extracts was performed on a Shimadzu GCMS-QP2010S gas chromatograph with mass spectrometer detector (GC–MS) equipped with an SHR5XLB column (30m, 0.25μm film thickness, 0.25mm i.d.). Scanning electron microscopy (SEM) was performed on sonicated and gold-sputtered samples using an Hitachi S-800 operating at 10kV. Catalyst samples were also dispersed in ethanol and deposited on polymer/copper grids for analysis via transmission electron microscopy (TEM) on both a JEOL 100CX II (100kV) and an Hitachi HF-2000 field emission gun (FEG) (200kV). Quantitative elemental analyses were performed by inductively coupled plasma optical emission spectrometry (ICP-OES) by Columbia Analytical Services, Tuscon AZ. 2.4 Decarboxylation procedure Batch decarboxylation of stearic acid was carried out in a 300°C oil bath in a manner similar to our previous report [20]. In general, 15mL glass pressure tubes were charged with 25mg Pd-MCF, 2.7mL of 0.15M stearic acid in dodecane, and 50μL tridecane as internal standard. Residual acidic protons in samples taken for kinetic analysis were derivatized with trimethylsilyl groups via reaction with BSA in pyridine prior to injection into the GC-FID. Spent catalyst was extracted from the reaction vessels with 25mL THF, filtered through a 0.5μm filter, washed with two subsequent aliquots THF, and dried under vacuum at 100°C overnight. Prior to reuse, the spent catalyst was re-reduced under H2 flow at 300°C for 2h. 3 Results and discussion The kinetics of the decarboxylation of stearic acid to n-heptadecane are shown in Fig. 2 for the fresh Pd-MCF catalyst and the catalyst reused after one 6h reaction. The catalyst activity is nearly completely lost after one use, with the used catalyst unable to achieve more than 4% conversion after six hours. H2–O2 chemisorption titrations quantifying hydrogen uptake as a measure of available active metal surface area were carried out on both the fresh and spent catalyst (Table 1 ). A greater than 20-fold decrease in active palladium surface area was measured for the spent catalyst, from 12.7m2/g to 0.6m2/g, consistent with the large decrease in stearic acid reactivity. The nature of this loss of palladium active sites is discussed below. Characterization of the fresh and spent catalyst via XPS was performed to determine whether the catalyst deactivation could be attributed to changes in the oxidation state of the palladium metal (Fig. 3 ). The palladium 3d5/2 and 3d3/2 spectra show characteristic zero-valent binding energies (335.3eV and 340.4eV, respectively) with negligible shift between fresh and spent catalysts. Additionally, the EXAFS spectra of the fresh and spent catalyst, shown in Fig. 4 , both exhibit the same Pd–Pd metallic bond character with no discernible appearance of a Pd–O scattering path in the spent catalyst. The consistent nature of the results from these two techniques allows us to reasonably disregard bulk or surface oxidation as likely deactivation candidates. Another useful observation drawn from comparing the fresh and spent EXAFS spectra is that there is negligible palladium particle size growth over the course of reaction. Although unlikely to cause the severe deactivation depicted in Fig. 2, palladium nanoparticle sintering, agglomeration, and ripening are still common nanoparticle phenomena that can be discarded as significant deactivation sources in this system. In fact, the slight peak shift exhibited by the spent catalyst in Fig. 4 suggests a small decrease in average nanoparticle size as compared to the fresh sample. This change is, however, attributed to a lattice contraction due to a loss of the interstitial hydride formed during the pretreatment reduction in flowing H2, rather than a palladium loss mechanism (as confirmed by quantitative palladium elemental analysis, Table 1). Surface area and porosity data from N2 physisorption for the fresh and spent catalysts provide some further insight into the difference in material properties between the samples (Table 1); the catalyst clearly loses substantial surface area and pore volume after reaction. On the other hand, observations from microscopy suggest that the MCF support remains intact, maintaining its mesoporous foam-like structure after reaction (Fig. 6 ), and therefore support collapse cannot reasonably be blamed for the porosity loss. Instead, substantial organic deposition was confirmed via TGA, with a measured total organic fraction of approximately 16% by weight (Table 1). It is hereafter hypothesized that this organic deposition plays the primary role in the catalyst deactivation; therefore its efficient removal becomes paramount. One of the benefits of utilizing a silica-supported catalyst is that any carbonaceous deposits can be removed via calcination. Discussed here are results from 3h calcinations in flowing air at 350°C and 600°C, temperatures chosen from TGA data as an intermediate oxidation temperature and a temperature at which the major organic components are readily removed, respectively. After 350°C calcination, during which approximately 40% of the deposited organics are removed, surface area, pore volume and hydrogen uptake all increase as compared to the spent catalyst, but fail to rebound to their original values (Table 1). After calcination at 600°C, over 98% of the deposited organics are removed, and the material exhibits nearly complete recovery of surface area and pore volume. However, the catalyst is unable to adsorb as much hydrogen as the original catalyst, and the explanation for this is illustrated in the EXAFS spectra shown in Fig. 5 . Metallic Pd has two peaks between about 2–3Å for a single Pd–Pd distance. The magnitude of the Fourier transform is proportional to the Pd–Pd coordination number, or average nanoparticle radius. The increasing amplitude of the metallic Pd–Pd scattering path as calcination temperature is increased is indicative of an increase in nanoparticle size. So while high temperature calcination can successfully remove the majority of the organic deposition from the spent catalyst, as expected, the palladium nanoparticles significantly agglomerate at these temperatures. Quantitatively, the calcination program that was effective at removing more than 98% of the organics decreased the accessible palladium available for reaction by more than 75%. Ideally, another methodology would be developed to remove the organics without significantly affecting the morphology and distribution of the palladium nanoparticles. The first step in developing this new methodology was to identify the carbonaceous species deposited on the catalyst, and here an array of characterization techniques was applied. 13C CP-MAS NMR spectra of the spent catalyst were initially measured (Fig. 7 ) as an attempt to elucidate the functionality of the organic molecules present on the material. Whereas the presence of aliphatic carbon could be confirmed, the relatively low organic loading, in combination with the inherent line-broadening associated with solid-state NMR, made it difficult to identify other moieties, and definitive speciation was not possible. Upon examination of the FT-IR spectrum of the spent catalyst (Fig. 8 ), the CO stretch indicative of an alkyl carboxylic acid group was clearly visible around 1700cm−1. Additionally, the obvious presence of multiple sp3 C–H stretches in the 2850–2950cm−1 range was consistent with the NMR spectrum. For a more direct speciation of the deposited molecules, the spent catalyst was dissolved in an aqueous strong base solution, yielding soluble silica salts, free palladium nanoparticles and the residual organics. After phase-extracting the organic components, solution 1H NMR and GC–MS were used to identify the residual compounds. Three main organic components were definitively identified: dodecane (n-C12), heptadecane (n-C17), and stearic acid (n-C17–COOH)– or, in the context of the investigated reaction, solvent, product, and reactant, respectively. Imposing the assumption that a mixture of these three compounds accounts for the organic deposition on the spent catalyst is consistent with the aforementioned characterization results. Now operating under the hypothesis that reactants and products, and not large deposits of coke, are potentially responsible for the catalyst deactivation, systematic solvent washes were applied to remove the residual reaction products and reactants. It is also hypothesized, and currently under further investigation, that the deactivation can be attributed to high palladium surface coverage of reactant acid in non-reactive binding configurations, in a manner similar to common nanoparticle-surfactant layer interactions. This coverage dependent decarboxylation activity of palladium has been elucidated recently by Immer and Lamb [24]. Sequential agitated 12h washes at 80°C with THF, hexane, and DCM yielded the highest organic removal (via TGA); after drying and reduction, the material is denoted Pd-MCF-regen (Table 1). As can be seen in the tabulated data, the regenerated catalyst regains nearly all of the lost surface area, porosity, and active metal surface area after the removal of 90% of the organic deposition. FT-IR spectroscopy of the regenerated catalyst (Fig. 8) shows almost complete disappearance of the peaks corresponding to the deposited organics (sp3 carbon C–H at 2850–2950cm−1, alkyl carboxylic acid CO at 1700cm−1). While no evidence of dimeric or oligomeric compounds has been observed in the use of fully saturated reactant acids in this study, we cannot definitively rule out the possibility of their existence in trace quantities. However, previous reports have only seen oligomerization in the decarboxylation of unsaturated acids [8,13]. Reaction kinetics are shown in Fig. 9 for the fresh, spent, and regenerated catalyst. The 6h conversion of stearic acid to n-heptadecane using the regenerated catalyst is a nearly 20-fold improvement over the recycled spent catalyst. 4 Conclusions The deactivation of a supported palladium nanoparticle catalyst during fatty acid decarboxylation has been investigated, and the nature of the cause of the deactivation has been conclusively elucidated for the first time. A well-defined silica-supported catalyst Pd-MCF, previously developed for our initial study [20], was fully characterized before and after use in the 300°C batch decarboxylation of stearic acid under inert atmosphere. After one use, the catalyst activity was reduced dramatically, achieving less than 5% conversion to n-heptadecane in the second use. XPS of the spent catalyst showed no change in the oxidation state of the palladium nanoparticles, while TEM and EXAFS verified negligible changes in their size or morphology, ruling out sintering or agglomeration as a key cause of deactivation. The spent catalyst surface area and pore volume decreased significantly, attributed to a 16% by weight deposition of organics rather than a structural or morphological change in the silica substrate. Contrary to previous assumptions, the majority of this carbonaceous deposition was found not to be traditional coke, but instead residual reactants, solvent and product (by NMR, FT-IR, and GC–MS). Attempts to remove the organic species from the spent catalyst via calcinations resulted in significant palladium nanoparticle growth, with the average particle size increasing to over 9nm after treatment in air at 600°C. Sequential hot extractions with solvents THF, hexane and DCM decreased the organic content of the spent catalyst by 90%, and FT-IR confirmed the removal of residual acids and alkanes. After reduction in H2 at 300°C, the regenerated catalyst showed a 19-fold increase in decarboxylation activity compared to the original spent catalyst. Acknowledgements The authors acknowledge financial support for this research from The State of Georgia Food Industry Partnership and the Georgia Tech Research Institute Agricultural Technology Research Program. The authors especially thank Dr. Neng Guo for his XAS guidance, Dr. Sunho Choi and Megan Lydon for their microscopy help, Wei Long and Praveen Bollini for XPS assistance, and Dr. Johannes Leisen and Dun-yen Kang for their NMR expertise. Use of the Advanced Photon Source is supported by the U.S. Department of Energy, Office of Science, and Office of Basic Energy Sciences, under Contract DE-AC02-06CH11357. MRCAT operations are supported by the Department of Energy and the MRCAT member institutions. Appendix A Supplementary data Supplementary data associated with this article can be found, in the online version, at doi:10.1016/j.apcata.2011.01.042. Appendix A Supplementary data References [1] U S DOE, Energy Information Administration: Official Energy Statistics, 2009, http://tonto.eia.doe.gov/oog/info/twip/twip_gasoline.html (accessed: August 2010). [2] US DOE, Energy Information Administration: Emissions of Greenhouse Gases in the US, 2008, http://www.eia.doe.gov/oiaf/1605/ggrpt/carbon.html (accessed July 2010). [3] D.Q.S. Solomon, M. Manning, Z. Chen, M. Marquis, K.B. Averyt, M. Tignor, H.L. Miller, IPCC, 2007: Summary for Policymakers, in Climate Change 2007: The Physical Science Basis, Contribution of Working Group I to the Fourth Assessment Report of the Intergovernmental Panel on Climate Change, Cambridge, United Kingdom/New York, NY, USA, 2007. [4] K. Narasimharao A. Lee K. Wilson Journal of Biobased Materials and Bioenergy 1 2007 19 30 [5] M. Ash E. Dohlman Electronic Outlook Report from the Economic Research Service 2007 United States Department of Agriculture pp. 1–83 [6] Tyson, ConocoPhillips/Tyson Renewable Fuels, 2007, http://www.tyson.com/RenewableEnergy/Initiative/Conoco/Default.aspx (accessed July 2010). [7] NesteOil, NExBTL Diesel, 2009, http://www.nesteoil.com/default.asp?path=1,41,535,547,3716,3884 (accessed July 2010). [8] M. Snare I. Kubickova P. Maki-Arvela D. Chichova K. Eranen D.Y. Murzin Fuel 87 2008 933 945 [9] P. Maki-Arvela M. Snare K. Eranen J. Myllyoja D.Y. Murzin Fuel 87 2008 3543 3549 [10] S. Lestari I. Simakova A. Tokarev P. Maki-Arvela K. Eranen D.Y. Murzin Catalysis Letters 122 2008 247 251 [11] M. Snare I. Kubickova P. Maki-Arvela K. Eranen J. Warna D.Y. Murzin Chemical Engineering Journal 134 2007 29 34 [12] P. Maki-Arvela I. Kubickova M. Snare K. Eranen D.Y. Murzin Energy & Fuels 21 2007 30 41 [13] M. Snare I. Kubickova P. Maki-Arvela K. Eranen D.Y. Murzin Industrial & Engineering Chemistry Research 45 2006 5708 5715 [14] I. Kubickova M. Snare K. Eranen P. Maki-Arvela D.Y. Murzin Catalysis Today 106 2005 197 200 [15] I. Simakova O. Simakova P. Maki-Arvela D.Y. Murzin Catalysis Today 150 2010 28 31 [16] H. Bernas K. Eranen I. Simakova A.R. Leino K. Kordas J. Myllyoja P. Maki-Arvela T. Salmi D.Y. Murzin Fuel 89 2010 2033 2039 [17] I. Simakova O. Simakova P. Maki-Arvela A. Simakov M. Estrada D.Y. Murzin Applied Catalysis A: General 355 2009 100 108 [18] S. Lestari P. Maki-Arvela I. Simakova J. Beltramini G.Q.M. Lu D.Y. Murzin Catalysis Letters 130 2009 48 51 [19] S. Lestari P. Maki-Arvela H. Bernas O. Simakova R. Sjoholm J. Beltramini G.Q.M. Lu J. Myllyoja I. Simakova D.Y. Murzin Energy & Fuels 23 2009 3842 3845 [20] E.W. Ping R. Wallace J. Pierson T.F. Fuller C.W. Jones Microporous Mesoporous Materials 132 2010 174 180 [21] S. Lestari P. Maki-Arvela K. Eranen J. Beltramini G.Q.M. Lu D.Y. Murzin Catalysis Letters 134 2010 250 257 [22] J.G. Immer M.J. Kelly H.H. Lamb Applied Catalysis A: General 375 2010 134 139 [23] W.W. Lukens P. Schmidt-Winkel D.Y. Zhao J.L. Feng G.D. Stucky Langmuir 15 1999 5403 5409 [24] J.G. Immer H.H. Lamb Energy & Fuels 24 2010 5291 5299",
      "scopus-id": "79952988604",
      "coredata": {
        "eid": "1-s2.0-S0926860X11000585",
        "dc:description": "Supported palladium catalysts are effective catalysts for the hydrogen-free decarboxylation of fatty acids. However, the catalysts deactivate severely after one use. Here, the recyclability of a well-defined, mesoporous silica-supported palladium nanoparticle catalyst is evaluated in the batch decarboxylation of stearic acid at 300°C under inert atmosphere, producing n-heptadecane. The nature of the catalyst deactivation is examined in detail via an array of characterization techniques. X-ray photoelectron spectroscopy (XPS) demonstrates that little palladium surface oxidation occurs over the course of the reaction, and a combination of X-ray absorption spectroscopy and transmission electron microscopy (TEM) suggests negligible particle sintering or agglomeration. Physisorption and chemisorption measurements demonstrate substantial loss in total surface area and porosity as well as accessible palladium surface area with these losses attributed to significant organic deposition on the catalyst, as verified via thermogravimetric analysis. High temperature calcination is applied to combust and remove these residues, but resultant nanoparticle agglomeration is significant. Solid state nuclear magnetic resonance spectroscopy (NMR), Fourier transform infrared spectroscopy (FT-IR) and solid dissolution followed by organic extraction methodologies demonstrate that the carbonaceous deposits are not coke but rather strongly adsorbed reactants and products. Detrimental coke formation, as suggested by prior literature, is verified to be absent, as extraction of the surface-deposited organic species yields nearly complete recovery of the total surface area, pore volume, and active palladium surface area. Furthermore, the regenerated catalyst exhibits a corresponding significant recovery of decarboxylation activity.",
        "openArchiveArticle": "false",
        "prism:coverDate": "2011-04-15",
        "openaccessUserLicense": null,
        "prism:aggregationType": "Journal",
        "prism:url": "https://api.elsevier.com/content/article/pii/S0926860X11000585",
        "dc:creator": [
          {
            "@_fa": "true",
            "$": "Ping, Eric W."
          },
          {
            "@_fa": "true",
            "$": "Pierson, John"
          },
          {
            "@_fa": "true",
            "$": "Wallace, Robert"
          },
          {
            "@_fa": "true",
            "$": "Miller, Jeffrey T."
          },
          {
            "@_fa": "true",
            "$": "Fuller, Thomas F."
          },
          {
            "@_fa": "true",
            "$": "Jones, Christopher W."
          }
        ],
        "link": [
          {
            "@_fa": "true",
            "@rel": "self",
            "@href": "https://api.elsevier.com/content/article/pii/S0926860X11000585"
          },
          {
            "@_fa": "true",
            "@rel": "scidir",
            "@href": "https://www.sciencedirect.com/science/article/pii/S0926860X11000585"
          }
        ],
        "dc:format": "application/json",
        "openaccessType": null,
        "pii": "S0926-860X(11)00058-5",
        "prism:volume": "396",
        "prism:publisher": "Elsevier B.V.",
        "dc:title": "On the nature of the deactivation of supported palladium nanoparticle catalysts in the decarboxylation of fatty acids",
        "prism:copyright": "Copyright © 2011 Elsevier B.V. All rights reserved.",
        "openaccess": "0",
        "prism:issn": "0926860X",
        "prism:issueIdentifier": "1-2",
        "dcterms:subject": [
          {
            "@_fa": "true",
            "$": "Diesel"
          },
          {
            "@_fa": "true",
            "$": "Bio-fuel"
          },
          {
            "@_fa": "true",
            "$": "Deactivation"
          },
          {
            "@_fa": "true",
            "$": "Fatty acid"
          },
          {
            "@_fa": "true",
            "$": "Bio-diesel"
          }
        ],
        "openaccessArticle": "false",
        "prism:publicationName": "Applied Catalysis A: General",
        "prism:number": "1-2",
        "openaccessSponsorType": null,
        "prism:pageRange": "85-90",
        "prism:endingPage": "90",
        "pubType": "fla",
        "prism:coverDisplayDate": "15 April 2011",
        "prism:doi": "10.1016/j.apcata.2011.01.042",
        "prism:startingPage": "85",
        "dc:identifier": "doi:10.1016/j.apcata.2011.01.042",
        "openaccessSponsorName": null
      },
      "objects": {
        "object": [
          {
            "@category": "thumbnail",
            "@height": "20",
            "@width": "73",
            "@_fa": "true",
            "$": "https://api.elsevier.com/content/object/eid/1-s2.0-S0926860X11000585-si3.gif?httpAccept=%2A%2F%2A",
            "@multimediatype": "GIF image file",
            "@type": "ALTIMG",
            "@size": "404",
            "@ref": "si3",
            "@mimetype": "image/gif"
          },
          {
            "@category": "thumbnail",
            "@height": "18",
            "@width": "64",
            "@_fa": "true",
            "$": "https://api.elsevier.com/content/object/eid/1-s2.0-S0926860X11000585-si2.gif?httpAccept=%2A%2F%2A",
            "@multimediatype": "GIF image file",
            "@type": "ALTIMG",
            "@size": "374",
            "@ref": "si2",
            "@mimetype": "image/gif"
          },
          {
            "@category": "thumbnail",
            "@height": "20",
            "@width": "73",
            "@_fa": "true",
            "$": "https://api.elsevier.com/content/object/eid/1-s2.0-S0926860X11000585-si1.gif?httpAccept=%2A%2F%2A",
            "@multimediatype": "GIF image file",
            "@type": "ALTIMG",
            "@size": "404",
            "@ref": "si1",
            "@mimetype": "image/gif"
          },
          {
            "@category": "high",
            "@height": "910",
            "@width": "1719",
            "@_fa": "true",
            "$": "https://api.elsevier.com/content/object/eid/1-s2.0-S0926860X11000585-gr9_lrg.jpg?httpAccept=%2A%2F%2A",
            "@multimediatype": "JPEG image file",
            "@type": "IMAGE-HIGH-RES",
            "@size": "84286",
            "@ref": "gr9",
            "@mimetype": "image/jpeg"
          },
          {
            "@category": "high",
            "@height": "933",
            "@width": "1668",
            "@_fa": "true",
            "$": "https://api.elsevier.com/content/object/eid/1-s2.0-S0926860X11000585-gr8_lrg.jpg?httpAccept=%2A%2F%2A",
            "@multimediatype": "JPEG image file",
            "@type": "IMAGE-HIGH-RES",
            "@size": "135808",
            "@ref": "gr8",
            "@mimetype": "image/jpeg"
          },
          {
            "@category": "high",
            "@height": "967",
            "@width": "1669",
            "@_fa": "true",
            "$": "https://api.elsevier.com/content/object/eid/1-s2.0-S0926860X11000585-gr7_lrg.jpg?httpAccept=%2A%2F%2A",
            "@multimediatype": "JPEG image file",
            "@type": "IMAGE-HIGH-RES",
            "@size": "94262",
            "@ref": "gr7",
            "@mimetype": "image/jpeg"
          },
          {
            "@category": "high",
            "@height": "1023",
            "@width": "2500",
            "@_fa": "true",
            "$": "https://api.elsevier.com/content/object/eid/1-s2.0-S0926860X11000585-gr6_lrg.jpg?httpAccept=%2A%2F%2A",
            "@multimediatype": "JPEG image file",
            "@type": "IMAGE-HIGH-RES",
            "@size": "403062",
            "@ref": "gr6",
            "@mimetype": "image/jpeg"
          },
          {
            "@category": "high",
            "@height": "1035",
            "@width": "1598",
            "@_fa": "true",
            "$": "https://api.elsevier.com/content/object/eid/1-s2.0-S0926860X11000585-gr5_lrg.jpg?httpAccept=%2A%2F%2A",
            "@multimediatype": "JPEG image file",
            "@type": "IMAGE-HIGH-RES",
            "@size": "152377",
            "@ref": "gr5",
            "@mimetype": "image/jpeg"
          },
          {
            "@category": "high",
            "@height": "1029",
            "@width": "1577",
            "@_fa": "true",
            "$": "https://api.elsevier.com/content/object/eid/1-s2.0-S0926860X11000585-gr4_lrg.jpg?httpAccept=%2A%2F%2A",
            "@multimediatype": "JPEG image file",
            "@type": "IMAGE-HIGH-RES",
            "@size": "123522",
            "@ref": "gr4",
            "@mimetype": "image/jpeg"
          },
          {
            "@category": "high",
            "@height": "900",
            "@width": "1575",
            "@_fa": "true",
            "$": "https://api.elsevier.com/content/object/eid/1-s2.0-S0926860X11000585-gr3_lrg.jpg?httpAccept=%2A%2F%2A",
            "@multimediatype": "JPEG image file",
            "@type": "IMAGE-HIGH-RES",
            "@size": "134580",
            "@ref": "gr3",
            "@mimetype": "image/jpeg"
          },
          {
            "@category": "high",
            "@height": "975",
            "@width": "1593",
            "@_fa": "true",
            "$": "https://api.elsevier.com/content/object/eid/1-s2.0-S0926860X11000585-gr2_lrg.jpg?httpAccept=%2A%2F%2A",
            "@multimediatype": "JPEG image file",
            "@type": "IMAGE-HIGH-RES",
            "@size": "77175",
            "@ref": "gr2",
            "@mimetype": "image/jpeg"
          },
          {
            "@category": "high",
            "@height": "961",
            "@width": "2500",
            "@_fa": "true",
            "$": "https://api.elsevier.com/content/object/eid/1-s2.0-S0926860X11000585-gr1_lrg.jpg?httpAccept=%2A%2F%2A",
            "@multimediatype": "JPEG image file",
            "@type": "IMAGE-HIGH-RES",
            "@size": "957851",
            "@ref": "gr1",
            "@mimetype": "image/jpeg"
          },
          {
            "@category": "high",
            "@height": "886",
            "@width": "2213",
            "@_fa": "true",
            "$": "https://api.elsevier.com/content/object/eid/1-s2.0-S0926860X11000585-fx1_lrg.jpg?httpAccept=%2A%2F%2A",
            "@multimediatype": "JPEG image file",
            "@type": "IMAGE-HIGH-RES",
            "@size": "256481",
            "@ref": "fx1",
            "@mimetype": "image/jpeg"
          },
          {
            "@category": "standard",
            "@height": "205",
            "@width": "388",
            "@_fa": "true",
            "$": "https://api.elsevier.com/content/object/eid/1-s2.0-S0926860X11000585-gr9.jpg?httpAccept=%2A%2F%2A",
            "@multimediatype": "JPEG image file",
            "@type": "IMAGE-DOWNSAMPLED",
            "@size": "12310",
            "@ref": "gr9",
            "@mimetype": "image/jpeg"
          },
          {
            "@category": "standard",
            "@height": "210",
            "@width": "376",
            "@_fa": "true",
            "$": "https://api.elsevier.com/content/object/eid/1-s2.0-S0926860X11000585-gr8.jpg?httpAccept=%2A%2F%2A",
            "@multimediatype": "JPEG image file",
            "@type": "IMAGE-DOWNSAMPLED",
            "@size": "17742",
            "@ref": "gr8",
            "@mimetype": "image/jpeg"
          },
          {
            "@category": "standard",
            "@height": "218",
            "@width": "377",
            "@_fa": "true",
            "$": "https://api.elsevier.com/content/object/eid/1-s2.0-S0926860X11000585-gr7.jpg?httpAccept=%2A%2F%2A",
            "@multimediatype": "JPEG image file",
            "@type": "IMAGE-DOWNSAMPLED",
            "@size": "12732",
            "@ref": "gr7",
            "@mimetype": "image/jpeg"
          },
          {
            "@category": "standard",
            "@height": "231",
            "@width": "565",
            "@_fa": "true",
            "$": "https://api.elsevier.com/content/object/eid/1-s2.0-S0926860X11000585-gr6.jpg?httpAccept=%2A%2F%2A",
            "@multimediatype": "JPEG image file",
            "@type": "IMAGE-DOWNSAMPLED",
            "@size": "33063",
            "@ref": "gr6",
            "@mimetype": "image/jpeg"
          },
          {
            "@category": "standard",
            "@height": "234",
            "@width": "361",
            "@_fa": "true",
            "$": "https://api.elsevier.com/content/object/eid/1-s2.0-S0926860X11000585-gr5.jpg?httpAccept=%2A%2F%2A",
            "@multimediatype": "JPEG image file",
            "@type": "IMAGE-DOWNSAMPLED",
            "@size": "16819",
            "@ref": "gr5",
            "@mimetype": "image/jpeg"
          },
          {
            "@category": "standard",
            "@height": "232",
            "@width": "356",
            "@_fa": "true",
            "$": "https://api.elsevier.com/content/object/eid/1-s2.0-S0926860X11000585-gr4.jpg?httpAccept=%2A%2F%2A",
            "@multimediatype": "JPEG image file",
            "@type": "IMAGE-DOWNSAMPLED",
            "@size": "14657",
            "@ref": "gr4",
            "@mimetype": "image/jpeg"
          },
          {
            "@category": "standard",
            "@height": "203",
            "@width": "355",
            "@_fa": "true",
            "$": "https://api.elsevier.com/content/object/eid/1-s2.0-S0926860X11000585-gr3.jpg?httpAccept=%2A%2F%2A",
            "@multimediatype": "JPEG image file",
            "@type": "IMAGE-DOWNSAMPLED",
            "@size": "21061",
            "@ref": "gr3",
            "@mimetype": "image/jpeg"
          },
          {
            "@category": "standard",
            "@height": "220",
            "@width": "360",
            "@_fa": "true",
            "$": "https://api.elsevier.com/content/object/eid/1-s2.0-S0926860X11000585-gr2.jpg?httpAccept=%2A%2F%2A",
            "@multimediatype": "JPEG image file",
            "@type": "IMAGE-DOWNSAMPLED",
            "@size": "10246",
            "@ref": "gr2",
            "@mimetype": "image/jpeg"
          },
          {
            "@category": "standard",
            "@height": "217",
            "@width": "565",
            "@_fa": "true",
            "$": "https://api.elsevier.com/content/object/eid/1-s2.0-S0926860X11000585-gr1.jpg?httpAccept=%2A%2F%2A",
            "@multimediatype": "JPEG image file",
            "@type": "IMAGE-DOWNSAMPLED",
            "@size": "64612",
            "@ref": "gr1",
            "@mimetype": "image/jpeg"
          },
          {
            "@category": "standard",
            "@height": "200",
            "@width": "500",
            "@_fa": "true",
            "$": "https://api.elsevier.com/content/object/eid/1-s2.0-S0926860X11000585-fx1.jpg?httpAccept=%2A%2F%2A",
            "@multimediatype": "JPEG image file",
            "@type": "IMAGE-DOWNSAMPLED",
            "@size": "23797",
            "@ref": "fx1",
            "@mimetype": "image/jpeg"
          },
          {
            "@category": "thumbnail",
            "@height": "116",
            "@width": "219",
            "@_fa": "true",
            "$": "https://api.elsevier.com/content/object/eid/1-s2.0-S0926860X11000585-gr9.sml?httpAccept=%2A%2F%2A",
            "@multimediatype": "GIF image file",
            "@type": "IMAGE-THUMBNAIL",
            "@size": "3009",
            "@ref": "gr9",
            "@mimetype": "image/gif"
          },
          {
            "@category": "thumbnail",
            "@height": "122",
            "@width": "219",
            "@_fa": "true",
            "$": "https://api.elsevier.com/content/object/eid/1-s2.0-S0926860X11000585-gr8.sml?httpAccept=%2A%2F%2A",
            "@multimediatype": "GIF image file",
            "@type": "IMAGE-THUMBNAIL",
            "@size": "4155",
            "@ref": "gr8",
            "@mimetype": "image/gif"
          },
          {
            "@category": "thumbnail",
            "@height": "127",
            "@width": "219",
            "@_fa": "true",
            "$": "https://api.elsevier.com/content/object/eid/1-s2.0-S0926860X11000585-gr7.sml?httpAccept=%2A%2F%2A",
            "@multimediatype": "GIF image file",
            "@type": "IMAGE-THUMBNAIL",
            "@size": "2722",
            "@ref": "gr7",
            "@mimetype": "image/gif"
          },
          {
            "@category": "thumbnail",
            "@height": "90",
            "@width": "219",
            "@_fa": "true",
            "$": "https://api.elsevier.com/content/object/eid/1-s2.0-S0926860X11000585-gr6.sml?httpAccept=%2A%2F%2A",
            "@multimediatype": "GIF image file",
            "@type": "IMAGE-THUMBNAIL",
            "@size": "5388",
            "@ref": "gr6",
            "@mimetype": "image/gif"
          },
          {
            "@category": "thumbnail",
            "@height": "142",
            "@width": "219",
            "@_fa": "true",
            "$": "https://api.elsevier.com/content/object/eid/1-s2.0-S0926860X11000585-gr5.sml?httpAccept=%2A%2F%2A",
            "@multimediatype": "GIF image file",
            "@type": "IMAGE-THUMBNAIL",
            "@size": "4643",
            "@ref": "gr5",
            "@mimetype": "image/gif"
          },
          {
            "@category": "thumbnail",
            "@height": "143",
            "@width": "219",
            "@_fa": "true",
            "$": "https://api.elsevier.com/content/object/eid/1-s2.0-S0926860X11000585-gr4.sml?httpAccept=%2A%2F%2A",
            "@multimediatype": "GIF image file",
            "@type": "IMAGE-THUMBNAIL",
            "@size": "4119",
            "@ref": "gr4",
            "@mimetype": "image/gif"
          },
          {
            "@category": "thumbnail",
            "@height": "125",
            "@width": "219",
            "@_fa": "true",
            "$": "https://api.elsevier.com/content/object/eid/1-s2.0-S0926860X11000585-gr3.sml?httpAccept=%2A%2F%2A",
            "@multimediatype": "GIF image file",
            "@type": "IMAGE-THUMBNAIL",
            "@size": "4672",
            "@ref": "gr3",
            "@mimetype": "image/gif"
          },
          {
            "@category": "thumbnail",
            "@height": "134",
            "@width": "219",
            "@_fa": "true",
            "$": "https://api.elsevier.com/content/object/eid/1-s2.0-S0926860X11000585-gr2.sml?httpAccept=%2A%2F%2A",
            "@multimediatype": "GIF image file",
            "@type": "IMAGE-THUMBNAIL",
            "@size": "3013",
            "@ref": "gr2",
            "@mimetype": "image/gif"
          },
          {
            "@category": "thumbnail",
            "@height": "84",
            "@width": "219",
            "@_fa": "true",
            "$": "https://api.elsevier.com/content/object/eid/1-s2.0-S0926860X11000585-gr1.sml?httpAccept=%2A%2F%2A",
            "@multimediatype": "GIF image file",
            "@type": "IMAGE-THUMBNAIL",
            "@size": "6729",
            "@ref": "gr1",
            "@mimetype": "image/gif"
          },
          {
            "@category": "thumbnail",
            "@height": "88",
            "@width": "219",
            "@_fa": "true",
            "$": "https://api.elsevier.com/content/object/eid/1-s2.0-S0926860X11000585-fx1.sml?httpAccept=%2A%2F%2A",
            "@multimediatype": "GIF image file",
            "@type": "IMAGE-THUMBNAIL",
            "@size": "5137",
            "@ref": "fx1",
            "@mimetype": "image/gif"
          },
          {
            "@category": "standard",
            "@_fa": "true",
            "$": "https://api.elsevier.com/content/object/eid/1-s2.0-S0926860X11000585-mmc1.doc?httpAccept=%2A%2F%2A",
            "@multimediatype": "Microsoft Word file",
            "@type": "APPLICATION",
            "@size": "26112",
            "@ref": "mmc1",
            "@mimetype": "application/word"
          }
        ]
      },
      "link": {
        "@rel": "abstract",
        "@href": "https://api.elsevier.com/content/abstract/scopus_id/79952988604"
      }
    }
  }
}