{
  "metadata": {
    "title": "CO methanation over TiO<ce:inf loc=post>2</ce:inf>-supported nickel catalysts: A carbon formation study",
    "authors": "; ; ",
    "journal": "Applied Catalysis A: General",
    "date": "2015-08-05",
    "doi": "10.1016/j.apcata.2015.06.029",
    "abstract": "",
    "uri": "https://api.elsevier.com/content/article/pii/S0926860X15300429",
    "pii": "S0926860X15300429"
  },
  "fulltext": {
    "full-text-retrieval-response": {
      "scopus-eid": "2-s2.0-84934759326",
      "originalText": "serial JL 271346 291210 291744 291809 31 Applied Catalysis A: General APPLIEDCATALYSISAGENERAL 2015-06-25 2015-06-25 2015-07-03 2015-07-03 2019-04-29T05:44:28 1-s2.0-S0926860X15300429 S0926-860X(15)30042-9 S0926860X15300429 10.1016/j.apcata.2015.06.029 S300 S300.2 FULL-TEXT 1-s2.0-S0926860X15X00111 2024-01-01T12:30:29.635264Z 0 0 20150805 2015 2015-06-25T17:35:54.652694Z absattachment articleinfo articletitlenorm authfirstinitialnorm authfirstsurnamenorm cid cids contenttype copyright crossmark dateloaded dateloadedtxt datesearch datesort dateupdated dco docsubtype doctype doi eid ewtransactionid hubeid indexeddate issn issnnorm itemstage itemtransactionid itemweight openaccess openarchive pg pgfirst pglast pii piinorm pubdatestart pubdatetxt pubyr sectiontitle sortorder srctitle srctitlenorm srctype ssids alllist content subj subheadings suppl tomb volfirst volissue volumelist webpdf webpdfpagecount yearnav figure table body mmlmath acknowledge affil articletitle auth authfirstini authfull authkeywords authlast highlightsabst primabst ref specialabst 0926-860X 0926860X true 502 502 C Volume 502 35 276 286 276 286 20150805 5 August 2015 2015-08-05 2015 Articles article fla Copyright © 2015 Elsevier B.V. All rights reserved. COMETHANATIONOVERTIO2SUPPORTEDNICKELCATALYSTSACARBONFORMATIONSTUDY BARRIENTOS J 1 Introduction 2 Methods 2.1 Catalyst preparation 2.2 Catalyst characterization techniques 2.3 Catalytic testing 3 Results and discussion 3.1 Characterization of supports and catalysts 3.2 Effect of H2/CO ratio and syngas partial pressure 3.3 Effect of temperature 3.4 Effect of water 3.5 Effect of the reduction temperature 4 Conclusions Acknowledgements References KOPYSCINSKI 2010 1763 1783 J GAO 2013 919 927 J NGUYEN 2013 233 238 T GROBL 2012 451 461 T VITASARI 2011 3825 3837 C STEUBING 2014 57 68 B LEBARBIER 2014 223 232 V ZWART 2005 591 597 R HUANG 2013 300 306 Y SHINDE 2014 1027 1035 V ZHANG 2013 14533 14544 J ZHANG 2013 1745 1755 G GORKE 2005 132 139 O LIU 2012 599 605 Z KOPYSCINSKI 2011 924 934 J KOPYSCINSKI 2011 1612 1621 J WATSON 1980 G METHANATIONCATALYSTS ICRESEARCH ATKINSON 1977 417 419 G SHEN 1981 152 165 W ENGER 2012 437 488 B MCCARTY 1977 1315 1323 J MCCARTY 1979 406 416 J BARTHOLOMEW 1982 67 112 C BARTHOLOMEW 2001 17 60 C BARTHOLOMEW 1983 34 46 C BENGAARD 2002 365 384 H HARMS 1980 B HELVEG 2011 42 46 S ROSTRUPNIELSEN 2001 1 12 J STUDIESINSURFACESCIENCECATALYSIS WHISKERCARBONREVISITED ROSTRUPNIELSEN 2007 134 138 J BARTHOLOMEW 1979 257 269 C PHILLIPS 1970 28 34 T WILLIAMS 1972 352 355 A BARTHOLOMEW 1980 375 396 C STUDIESINSURFACESCIENCECATALYSIS SULFURPOISONINGNICKELINCOHYDROGENATION BARTHOLOMEW 1982 19 29 C GUO 2014 61 69 C ZHANG 2013 75 81 G JIA 2013 490 499 C BARRIENTOS 2014 143 149 J VANNICE 1979 236 248 M BARTHOLOMEW 1988 147 162 C MIRODATOS 1987 275 287 C VANDELOOSDRECHT 1997 217 226 J CHARY 2008 886 893 K RYNKOWSKI 1996 169 175 J KHALIL 2001 106 111 T KELLER 1999 3189 3202 N HOHLEIN 1984 241 250 B MOELLER 1974 69 74 F FORNEY 1970 A PROCESSMAKEHIGHBTUGASCOAL LOGDBERG 2010 84 98 S MOODLEY 2009 102 110 D SATTERFIELD 1970 C MASSTRANSFERINHETEROGENEOUSCATALYSIS OBORG 2007 89 100 STORSAETER 2005 405 419 S LUALDI 2012 M SCHOOLCHEMICALSCIENCEENGINEERING FISCHERTROPSCHSYNTHESISOVERCOBALTBASEDCATALYSTSFORBTLAPPLICATIONS TAUSTER 1987 389 394 S TAUSTER 1978 29 35 S VANNICE 1982 199 202 M TAUSTER 1978 170 175 S DEBOKX 1987 33 46 P VANNICE 1975 462 473 M VANNICE 1976 152 162 M VANNICE 1975 449 461 M SUGHRUE 1982 239 256 E SAIB 2010 271 282 A TSAKOUMIS 2010 162 182 N DRY 2004 533 600 M STUDIESINSURFACESCIENCECATALYSIS CHAPTER7FTCATALYSTS SCHANKE 1995 269 284 D JACOBS 2002 215 226 G KISS 2003 127 140 G KUIJPERS 1984 241 251 E KUIJPERS 1983 158 161 E ROBERTS 1979 G IGLESIA 1993 221 302 E ZIELINSKI 1993 187 198 J BARRIENTOSX2015X276 BARRIENTOSX2015X276X286 BARRIENTOSX2015X276XJ BARRIENTOSX2015X276X286XJ 2017-07-03T00:00:00Z http://creativecommons.org/licenses/by-nc-nd/4.0/ item S0926-860X(15)30042-9 S0926860X15300429 1-s2.0-S0926860X15300429 10.1016/j.apcata.2015.06.029 271346 2024-01-01T12:30:29.635264Z 2015-08-05 1-s2.0-S0926860X15300429-main.pdf https://s3.amazonaws.com/prod-ucs-content-store-us-east/content/pii:S0926860X15300429/MAIN/application/pdf/81059c1702e0719e44c5d1e8a14016a7/main.pdf main.pdf pdf true 2228589 MAIN 11 1-s2.0-S0926860X15300429-main_1.png https://s3.amazonaws.com/prod-ucs-content-store-us-east/content/pii:S0926860X15300429/PREVIEW/image/png/cccddb4a3255a71de6a16014def06a56/main_1.png main_1.png png 56700 849 656 IMAGE-WEB-PDF 1 1-s2.0-S0926860X15300429-fx1.sml https://s3.amazonaws.com/prod-ucs-content-store-us-east/content/pii:S0926860X15300429/fx1/THUMBNAIL/image/gif/2d03d8337ba6939b214d0b669061621b/fx1.sml fx1 true fx1.sml sml 5116 88 219 IMAGE-THUMBNAIL 1-s2.0-S0926860X15300429-gr1.sml https://s3.amazonaws.com/prod-ucs-content-store-us-east/content/pii:S0926860X15300429/gr1/THUMBNAIL/image/gif/6dbbc6c8dcd6340d1b12ed7f3d6f387a/gr1.sml gr1 gr1.sml sml 16977 73 219 IMAGE-THUMBNAIL 1-s2.0-S0926860X15300429-gr10.sml https://s3.amazonaws.com/prod-ucs-content-store-us-east/content/pii:S0926860X15300429/gr10/THUMBNAIL/image/gif/935ee0a30cedc81f65dddb9d34af09b0/gr10.sml gr10 gr10.sml sml 11197 164 200 IMAGE-THUMBNAIL 1-s2.0-S0926860X15300429-gr11.sml https://s3.amazonaws.com/prod-ucs-content-store-us-east/content/pii:S0926860X15300429/gr11/THUMBNAIL/image/gif/06190eaef165f1875b7923173a7181d2/gr11.sml gr11 gr11.sml sml 13758 164 139 IMAGE-THUMBNAIL 1-s2.0-S0926860X15300429-gr12.sml https://s3.amazonaws.com/prod-ucs-content-store-us-east/content/pii:S0926860X15300429/gr12/THUMBNAIL/image/gif/4985ec51053a615829627966f47b8076/gr12.sml gr12 gr12.sml sml 18831 164 208 IMAGE-THUMBNAIL 1-s2.0-S0926860X15300429-gr13.sml https://s3.amazonaws.com/prod-ucs-content-store-us-east/content/pii:S0926860X15300429/gr13/THUMBNAIL/image/gif/6ecbda28700430a6f4b5de6e4030770c/gr13.sml gr13 gr13.sml sml 13514 164 213 IMAGE-THUMBNAIL 1-s2.0-S0926860X15300429-gr14.sml https://s3.amazonaws.com/prod-ucs-content-store-us-east/content/pii:S0926860X15300429/gr14/THUMBNAIL/image/gif/ecf1eee10e3ab88107c3bddb0bd9f8e0/gr14.sml gr14 gr14.sml sml 16093 164 216 IMAGE-THUMBNAIL 1-s2.0-S0926860X15300429-gr15.sml https://s3.amazonaws.com/prod-ucs-content-store-us-east/content/pii:S0926860X15300429/gr15/THUMBNAIL/image/gif/c79921807dbf54563ffb4e844a8e3782/gr15.sml gr15 gr15.sml sml 13762 164 210 IMAGE-THUMBNAIL 1-s2.0-S0926860X15300429-gr2.sml https://s3.amazonaws.com/prod-ucs-content-store-us-east/content/pii:S0926860X15300429/gr2/THUMBNAIL/image/gif/8e4e126c20b14fa025da883cf95e47c3/gr2.sml gr2 gr2.sml sml 13935 73 219 IMAGE-THUMBNAIL 1-s2.0-S0926860X15300429-gr3.sml https://s3.amazonaws.com/prod-ucs-content-store-us-east/content/pii:S0926860X15300429/gr3/THUMBNAIL/image/gif/c924132b944e5da024e785aa0711b03e/gr3.sml gr3 gr3.sml sml 13784 164 199 IMAGE-THUMBNAIL 1-s2.0-S0926860X15300429-gr4.sml https://s3.amazonaws.com/prod-ucs-content-store-us-east/content/pii:S0926860X15300429/gr4/THUMBNAIL/image/gif/3c796bc7d3d5da82b34c4e93accaf848/gr4.sml gr4 gr4.sml sml 13919 164 212 IMAGE-THUMBNAIL 1-s2.0-S0926860X15300429-gr5.sml https://s3.amazonaws.com/prod-ucs-content-store-us-east/content/pii:S0926860X15300429/gr5/THUMBNAIL/image/gif/b8546db9ff94a9a0981160e3294a3ff0/gr5.sml gr5 gr5.sml sml 16621 164 211 IMAGE-THUMBNAIL 1-s2.0-S0926860X15300429-gr6.sml https://s3.amazonaws.com/prod-ucs-content-store-us-east/content/pii:S0926860X15300429/gr6/THUMBNAIL/image/gif/63fb130ce6ab1094505528f53baa9b0b/gr6.sml gr6 gr6.sml sml 17679 164 212 IMAGE-THUMBNAIL 1-s2.0-S0926860X15300429-gr7.sml https://s3.amazonaws.com/prod-ucs-content-store-us-east/content/pii:S0926860X15300429/gr7/THUMBNAIL/image/gif/2fe0ea2387908ec1cc5f80e3c3d40a0b/gr7.sml gr7 gr7.sml sml 11212 164 198 IMAGE-THUMBNAIL 1-s2.0-S0926860X15300429-gr8.sml https://s3.amazonaws.com/prod-ucs-content-store-us-east/content/pii:S0926860X15300429/gr8/THUMBNAIL/image/gif/2a2bcd7daea4ef139d4cafa4dc4d3ef3/gr8.sml gr8 gr8.sml sml 15048 164 212 IMAGE-THUMBNAIL 1-s2.0-S0926860X15300429-gr9.sml https://s3.amazonaws.com/prod-ucs-content-store-us-east/content/pii:S0926860X15300429/gr9/THUMBNAIL/image/gif/89380fd5ccbd3ed3cc991da76a0a3625/gr9.sml gr9 gr9.sml sml 15580 164 209 IMAGE-THUMBNAIL 1-s2.0-S0926860X15300429-fx1.jpg https://s3.amazonaws.com/prod-ucs-content-store-us-east/content/pii:S0926860X15300429/fx1/DOWNSAMPLED/image/jpeg/2ae2f48d0afcca31e4e3cdf79cae664b/fx1.jpg fx1 true fx1.jpg jpg 22258 200 500 IMAGE-DOWNSAMPLED 1-s2.0-S0926860X15300429-gr1.jpg https://s3.amazonaws.com/prod-ucs-content-store-us-east/content/pii:S0926860X15300429/gr1/DOWNSAMPLED/image/jpeg/1c8c3a0541b7eaf791031eb94a0a4ea7/gr1.jpg gr1 gr1.jpg jpg 49771 220 659 IMAGE-DOWNSAMPLED 1-s2.0-S0926860X15300429-gr10.jpg https://s3.amazonaws.com/prod-ucs-content-store-us-east/content/pii:S0926860X15300429/gr10/DOWNSAMPLED/image/jpeg/eafa8dad8e7c8e488b50857000812e5e/gr10.jpg gr10 gr10.jpg jpg 35782 308 376 IMAGE-DOWNSAMPLED 1-s2.0-S0926860X15300429-gr11.jpg https://s3.amazonaws.com/prod-ucs-content-store-us-east/content/pii:S0926860X15300429/gr11/DOWNSAMPLED/image/jpeg/476693634d90177d877669883e55134c/gr11.jpg gr11 gr11.jpg jpg 57938 444 376 IMAGE-DOWNSAMPLED 1-s2.0-S0926860X15300429-gr12.jpg https://s3.amazonaws.com/prod-ucs-content-store-us-east/content/pii:S0926860X15300429/gr12/DOWNSAMPLED/image/jpeg/81f8c8bd75050989aa2fba35fdd5819a/gr12.jpg gr12 gr12.jpg jpg 55100 297 376 IMAGE-DOWNSAMPLED 1-s2.0-S0926860X15300429-gr13.jpg https://s3.amazonaws.com/prod-ucs-content-store-us-east/content/pii:S0926860X15300429/gr13/DOWNSAMPLED/image/jpeg/4a9da82897f4d8d2335e14fa61bf6d26/gr13.jpg gr13 gr13.jpg jpg 40467 289 376 IMAGE-DOWNSAMPLED 1-s2.0-S0926860X15300429-gr14.jpg https://s3.amazonaws.com/prod-ucs-content-store-us-east/content/pii:S0926860X15300429/gr14/DOWNSAMPLED/image/jpeg/daeb0fdad71771745db0124978500604/gr14.jpg gr14 gr14.jpg jpg 45421 286 376 IMAGE-DOWNSAMPLED 1-s2.0-S0926860X15300429-gr15.jpg https://s3.amazonaws.com/prod-ucs-content-store-us-east/content/pii:S0926860X15300429/gr15/DOWNSAMPLED/image/jpeg/06b2df3b5d1be015d3a055dc81fb4a1a/gr15.jpg gr15 gr15.jpg jpg 40021 294 377 IMAGE-DOWNSAMPLED 1-s2.0-S0926860X15300429-gr2.jpg https://s3.amazonaws.com/prod-ucs-content-store-us-east/content/pii:S0926860X15300429/gr2/DOWNSAMPLED/image/jpeg/08ba9420871d0f37fc4b5ceae214f525/gr2.jpg gr2 gr2.jpg jpg 39180 213 640 IMAGE-DOWNSAMPLED 1-s2.0-S0926860X15300429-gr3.jpg https://s3.amazonaws.com/prod-ucs-content-store-us-east/content/pii:S0926860X15300429/gr3/DOWNSAMPLED/image/jpeg/32e0de152738d89f87b3ebecfd819867/gr3.jpg gr3 gr3.jpg jpg 44739 309 376 IMAGE-DOWNSAMPLED 1-s2.0-S0926860X15300429-gr4.jpg https://s3.amazonaws.com/prod-ucs-content-store-us-east/content/pii:S0926860X15300429/gr4/DOWNSAMPLED/image/jpeg/78d20efd9ba0ab2653b209ac48cc8533/gr4.jpg gr4 gr4.jpg jpg 41801 292 377 IMAGE-DOWNSAMPLED 1-s2.0-S0926860X15300429-gr5.jpg https://s3.amazonaws.com/prod-ucs-content-store-us-east/content/pii:S0926860X15300429/gr5/DOWNSAMPLED/image/jpeg/539e0bd862e6e322d1389bb8db7eca89/gr5.jpg gr5 gr5.jpg jpg 49100 292 376 IMAGE-DOWNSAMPLED 1-s2.0-S0926860X15300429-gr6.jpg https://s3.amazonaws.com/prod-ucs-content-store-us-east/content/pii:S0926860X15300429/gr6/DOWNSAMPLED/image/jpeg/3f978adba4f8662be3e0fd6641c6b547/gr6.jpg gr6 gr6.jpg jpg 51635 291 376 IMAGE-DOWNSAMPLED 1-s2.0-S0926860X15300429-gr7.jpg https://s3.amazonaws.com/prod-ucs-content-store-us-east/content/pii:S0926860X15300429/gr7/DOWNSAMPLED/image/jpeg/34e0a3f7de8a36b3a7c4971f8483ff71/gr7.jpg gr7 gr7.jpg jpg 35542 312 377 IMAGE-DOWNSAMPLED 1-s2.0-S0926860X15300429-gr8.jpg https://s3.amazonaws.com/prod-ucs-content-store-us-east/content/pii:S0926860X15300429/gr8/DOWNSAMPLED/image/jpeg/c0565e8f8e884f500efd6952e7d00e69/gr8.jpg gr8 gr8.jpg jpg 43106 291 376 IMAGE-DOWNSAMPLED 1-s2.0-S0926860X15300429-gr9.jpg https://s3.amazonaws.com/prod-ucs-content-store-us-east/content/pii:S0926860X15300429/gr9/DOWNSAMPLED/image/jpeg/95fedb0efb2ebfe02347767e2bed896b/gr9.jpg gr9 gr9.jpg jpg 41466 295 376 IMAGE-DOWNSAMPLED 1-s2.0-S0926860X15300429-fx1_lrg.jpg https://s3.amazonaws.com/prod-ucs-content-store-us-east/content/pii:S0926860X15300429/fx1/HIGHRES/image/jpeg/a239765405d337c05afb8df5c11be97f/fx1_lrg.jpg fx1 true fx1_lrg.jpg jpg 163357 886 2213 IMAGE-HIGH-RES 1-s2.0-S0926860X15300429-gr1_lrg.jpg https://s3.amazonaws.com/prod-ucs-content-store-us-east/content/pii:S0926860X15300429/gr1/HIGHRES/image/jpeg/7b36762704e7c09911556db3d1fd98c9/gr1_lrg.jpg gr1 gr1_lrg.jpg jpg 653023 976 2917 IMAGE-HIGH-RES 1-s2.0-S0926860X15300429-gr10_lrg.jpg https://s3.amazonaws.com/prod-ucs-content-store-us-east/content/pii:S0926860X15300429/gr10/HIGHRES/image/jpeg/d3162fa9007bdce212db7fe89471ebc7/gr10_lrg.jpg gr10 gr10_lrg.jpg jpg 153693 1367 1667 IMAGE-HIGH-RES 1-s2.0-S0926860X15300429-gr11_lrg.jpg https://s3.amazonaws.com/prod-ucs-content-store-us-east/content/pii:S0926860X15300429/gr11/HIGHRES/image/jpeg/869384a2b6af0c397b03cdf246491be8/gr11_lrg.jpg gr11 gr11_lrg.jpg jpg 295782 1968 1667 IMAGE-HIGH-RES 1-s2.0-S0926860X15300429-gr12_lrg.jpg https://s3.amazonaws.com/prod-ucs-content-store-us-east/content/pii:S0926860X15300429/gr12/HIGHRES/image/jpeg/959dace94468c5258ed193e3fcbc41b0/gr12_lrg.jpg gr12 gr12_lrg.jpg jpg 229416 1315 1667 IMAGE-HIGH-RES 1-s2.0-S0926860X15300429-gr13_lrg.jpg https://s3.amazonaws.com/prod-ucs-content-store-us-east/content/pii:S0926860X15300429/gr13/HIGHRES/image/jpeg/391717226377bc8f3b218fa2fff5f1ad/gr13_lrg.jpg gr13 gr13_lrg.jpg jpg 161901 1281 1667 IMAGE-HIGH-RES 1-s2.0-S0926860X15300429-gr14_lrg.jpg https://s3.amazonaws.com/prod-ucs-content-store-us-east/content/pii:S0926860X15300429/gr14/HIGHRES/image/jpeg/3d76114d1c99764f0dfb06aec90a99fa/gr14_lrg.jpg gr14 gr14_lrg.jpg jpg 171243 1267 1667 IMAGE-HIGH-RES 1-s2.0-S0926860X15300429-gr15_lrg.jpg https://s3.amazonaws.com/prod-ucs-content-store-us-east/content/pii:S0926860X15300429/gr15/HIGHRES/image/jpeg/423d3cab5eab1ac08e3d0cc3b1b1353d/gr15_lrg.jpg gr15 gr15_lrg.jpg jpg 136993 1303 1669 IMAGE-HIGH-RES 1-s2.0-S0926860X15300429-gr2_lrg.jpg https://s3.amazonaws.com/prod-ucs-content-store-us-east/content/pii:S0926860X15300429/gr2/HIGHRES/image/jpeg/15ffcf5b8db7df6e7948d52a41549e13/gr2_lrg.jpg gr2 gr2_lrg.jpg jpg 565095 945 2833 IMAGE-HIGH-RES 1-s2.0-S0926860X15300429-gr3_lrg.jpg https://s3.amazonaws.com/prod-ucs-content-store-us-east/content/pii:S0926860X15300429/gr3/HIGHRES/image/jpeg/7e6b37b9de2b1f4f6f9f900c301c46ea/gr3_lrg.jpg gr3 gr3_lrg.jpg jpg 191936 1370 1667 IMAGE-HIGH-RES 1-s2.0-S0926860X15300429-gr4_lrg.jpg https://s3.amazonaws.com/prod-ucs-content-store-us-east/content/pii:S0926860X15300429/gr4/HIGHRES/image/jpeg/5bb0df7326f745b9fefc4ddc29a36abb/gr4_lrg.jpg gr4 gr4_lrg.jpg jpg 197140 1291 1669 IMAGE-HIGH-RES 1-s2.0-S0926860X15300429-gr5_lrg.jpg https://s3.amazonaws.com/prod-ucs-content-store-us-east/content/pii:S0926860X15300429/gr5/HIGHRES/image/jpeg/a42ceb0d41cf9c950e08fa249bae96d2/gr5_lrg.jpg gr5 gr5_lrg.jpg jpg 188290 1295 1667 IMAGE-HIGH-RES 1-s2.0-S0926860X15300429-gr6_lrg.jpg https://s3.amazonaws.com/prod-ucs-content-store-us-east/content/pii:S0926860X15300429/gr6/HIGHRES/image/jpeg/cd750a643be097c2d747923d4b3c9c6a/gr6_lrg.jpg gr6 gr6_lrg.jpg jpg 207949 1290 1668 IMAGE-HIGH-RES 1-s2.0-S0926860X15300429-gr7_lrg.jpg https://s3.amazonaws.com/prod-ucs-content-store-us-east/content/pii:S0926860X15300429/gr7/HIGHRES/image/jpeg/8cf7afe55c2b037dfda68bda53aac495/gr7_lrg.jpg gr7 gr7_lrg.jpg jpg 149437 1383 1669 IMAGE-HIGH-RES 1-s2.0-S0926860X15300429-gr8_lrg.jpg https://s3.amazonaws.com/prod-ucs-content-store-us-east/content/pii:S0926860X15300429/gr8/HIGHRES/image/jpeg/281ee8c720dd87ef1b8bdc67504ade2d/gr8_lrg.jpg gr8 gr8_lrg.jpg jpg 156055 1289 1667 IMAGE-HIGH-RES 1-s2.0-S0926860X15300429-gr9_lrg.jpg https://s3.amazonaws.com/prod-ucs-content-store-us-east/content/pii:S0926860X15300429/gr9/HIGHRES/image/jpeg/5338a46260c96b600d4f18d5e9bff831/gr9_lrg.jpg gr9 gr9_lrg.jpg jpg 163896 1309 1667 IMAGE-HIGH-RES 1-s2.0-S0926860X15300429-si1.gif https://s3.amazonaws.com/prod-ucs-content-store-us-east/content/pii:S0926860X15300429/STRIPIN/image/gif/537ab6374b1e01e48c265c4290ecc058/si1.gif si1 si1.gif gif 615 33 144 ALTIMG APCATA 15441 S0926-860X(15)30042-9 10.1016/j.apcata.2015.06.029 Elsevier B.V. Fig. 1 TEM images of the 20Ni/TiO2 batch 2 after reduction at 773K for 4h. Fig. 2 TEM images of the 20Ni/TiO2 batch 2 after reduction at 573K for 4h. Fig. 3 CO conversion during methanation synthesis at 1bar, 583K and different inlet H2/CO ratios. The operating conditions of the different experiments are presented in Table 1. (a) Exp. 1 (inlet H2/CO ratio=2), (b) Exp. 2 (inlet H2/CO ratio=3), (c) Exp. 3 (inlet H2/CO ratio=6) and (d) Exp. 4 (inlet H2/CO ratio=9). Fig. 4 TPH profile after 6h of methanation synthesis at 1bar and 583K for the experiments: (a) Exp. 1 (inlet H2/CO ratio=2), (b) Exp. 2 (inlet H2/CO ratio=3), (c) Exp.3 (inlet H2/CO ratio=6) and (d) Exp. 4 (inlet H2/CO ratio=9). Fig. 5 CO conversion during methanation synthesis at 20bar, 583K and different inlet H2/CO ratios. The operating conditions of the different experiments are presented in Table 1. (a) Exp. 7 (inlet H2/CO ratio=2), (b) Exp. 9 (inlet H2/CO ratio=3) and (c) Exp. 11 (inlet H2/CO ratio=6). Fig. 6 TPH profiles after 6h of methanation synthesis at 583K for the experiments: (a) Exp. 1 (inlet H2/CO ratio=2 and P =1bar), (b) Exp. 7 (inlet H2/CO ratio=2 and P=20bar), (c) Exp. 2 (inlet H2/CO ratio=3 and P =1bar), (d) Exp. 9 (inlet H2/CO ratio=3 and P =20bar), (e) Exp. 3 (inlet H2/CO ratio=6 and P =1bar) and (f) Exp. 11 (inlet H2/CO ratio=6 and P =20bar). Fig. 7 CO conversion during methanation synthesis at 20bar, 583K and two different inlet H2/CO ratios. The operating conditions of these two periods are presented in Table 2. (a) Period F (inlet H2/CO ratio=3) and (b) Period G (inlet H2/CO ratio=6). Catalyst: 20 Ni/TiO2 batch 2 after reduction at 773K for 4h. Fig. 8 CO conversion during methanation synthesis at 1bar, inlet H2/CO ratio=3 and different temperatures. The operating conditions of the different experiments are presented in Table 1. (a) Exp. 5 (553K), (b) Exp. 2 (583K) and (c) Exp. 6 (613K). Fig. 9 TPH profiles after 6h of methanation synthesis at 1bar and an inlet H2/CO ratio=3 for the experiments: (a) Exp. 5 (553K), (b) Exp. 2 (583K) and (c) Exp. 6 (613K). Fig. 10 CO conversion during methanation synthesis at 20bar, an inlet H2/CO ratio=3 and two different temperatures. The operating conditions of these two periods are presented in Table 2. (a) Period H (583K) and (b) Period I (613K). Catalyst: 20 Ni/TiO2 batch 2 after reduction at 773K for 4h. Fig. 11 CO conversion during methanation synthesis at 20bar, 583K and different inlet gas compositions. The operating conditions of the different experiments are presented in Table 1. (a) Exp. 7 (H2/CO ration=2 and 20% He), (b) Exp. 8 (H2/CO ratio=2 and 20% H2O), (c) Exp. 9 (H2/CO ratio=3 and 5% He), (d) Exp10 (H2/CO ratio=3 and 5% H2O), (e) Exp. 11 (H2/CO ratio=6 and 20% He) and (f) Exp. 12 (H2/CO ratio=6 and 20% H2O). Fig. 12 TPH profiles after 6h of methanation synthesis at 20bar, 583K for the experiments: (a) Exp. 7 (H2/CO ratio=2 and 20% He), (b) Exp. 8 (H2/CO ratio=2 and 20% H2O), (c) Exp. 9 (H2/CO ratio=3 and 5% He), (d) Exp. 10 (H2/CO ratio=3 and 5% H2O), (e) Exp. 11 (H2/CO ratio=6 and 20% He) and (f) Exp. 12 (H2/CO ratio=6 and 20% H2O). Fig. 13 CO conversion during methanation synthesis at 20bar, 583K and different inlet gas compositions. The operating conditions of these four periods are presented in Table 2. (a) Period B (20% He), (b) Period C (10 % He and 10 % H2O), (c) Period D (20 % H2O) and (d) Period E (20 % He). Catalyst: 20 Ni/TiO2 batch 2 after reduction at 773K for 4h. Fig. 14 CO conversion during methanation synthesis for the 20 Ni/TiO2 batch 2 catalyst after reduction at a) 773K for 4h (adapted from [43]) and b) 573K for 16h. Operating conditions: 20bar, inlet H2/CO ratio=3 and GHSV=75,000Nml/hg for both experiments. Fig. 15 CO conversion during methanation synthesis at 20bar, 583K and two different inlet gas compositions. The operating conditions of these two periods are presented in Table 3. (a) Period B (20 % He) and (b) Period C (10 % He and 10 % H2O). Catalyst: 20 Ni/TiO2 batch 2 after reduction at 573K for 16h. Table 1 Operating conditions used in the systematic study performed on the 20Ni/TiO2 batch 1 catalyst. Experiment name P (bar) T (K) H2/CO a χHe b χH2O c GHSV (Nml/hg) Exp. 1 1 583 2 0 0 19740 Exp. 2 1 583 3 0 0 58740 Exp. 3 1 583 6 0 0 102660 Exp. 4 1 583 9 0 0 94920 Exp. 5 1 553 3 0 0 11220 Exp. 6 1 613 3 0 0 198480 Exp. 7 20 583 2 0.2 0 75060 Exp.8 20 583 2 0 0.2 74760 Exp. 9 20 583 3 0.05 0 104460 Exp. 10 20 583 3 0 0.05 103740 Exp. 11 20 583 6 0.2 0 145620 Exp. 12 20 583 6 0 0.2 145620 a H2/CO: molar H2/CO ratio in the gas feed. b χHe: helium molar fraction in the gas feed. c χH2O: water molar fraction in the gas feed. Table 2 Operating conditions used during test with 20 Ni/TIO2 batch 2 reduced at 773K. Period Time on stream (h) P (bar) T (K) H2/CO a χHe b χH2O c GHSV (Nml/hg) A 0–23 20 583 3 0.2 0 94.020 B 24–47 20 583 3 0.2 0 56.340 C 48–57 20 583 3 0.1 0.1 56.340 D 58–71 20 583 3 0 0.2 56.340 E 72–78 20 583 3 0.2 0 56.340 F 79–101 20 583 3 0 0 15.000 G 102–122 20 583 6 0 0 36.360 H 123–146 20 583 3 0 0 21.060 I 150–167 20 613 3 0 0 21.060 a H2/CO: molar H2/CO ratio in the gas feed. b χHe: helium molar fraction in the gas feed. c χH2O: water molar fraction in the gas feed. Table 3 Operating conditions used during the test with 20 Ni/TiO2 batch 2 reduced at 573K. Period Time on stream (h) P (bar) T (K) H2/CO a χHe b χH2O c GHSV (Nml/hg) A 0–24 20 583 3 0 0 74.880 B 25–44 20 583 3 0.4 0 56.160 C 45–65 20 583 3 0.2 0.2 56.160 a H2/CO: molar H2/CO ratio in the gas feed. b χHe: helium molar fraction in the gas feed. c χH2O: water molar fraction in the gas feed. Table 4 Physical properties of the support material and the catalysts after calcination. Material Average pore diameter (nm) a Surface area (A) (m2/gcat) Pore volume (V) (cm3/gcat) TiO2 409 14 1.39 20Ni/TiO2 batch 1 279 9 0.63 20Ni/TiO2 batch 2 248 13 0.82 a The average pore diameter (d p) estimated from surface area (A) and pore volume (V) according to: d p =4V/A. Table 5 Physicochemical properties of the studied catalysts. Catalyst Reduction conditions (xNi)ICP-MS (%) a (xNi)XPS (%) b DoR (%) c D H (%) d d(Ni)H (nm) e d(NiO)XRD (nm) f d(Ni)XRD (nm) g d(Ni)TEM (nm) h 20Ni/TiO2 batch 1 773K for 4h 20.4 17.2 100 1.2 84 23 25 22 20Ni/TiO2 batch 2 773K for 4h 19.8 20.3 100 0 – 15 13 17 20Ni/TiO2 batch 2 573K for 4 h 19.7 28.1 92 1.3 69 15 15 15 20Ni/TiO2 batch 2 573K for 16h – – 97 1.6 59 15 15 – a Weight percentage of Ni estimated from ICP-MS after catalyst reduction and passivation. b Weight percentage of Ni estimated from XPS after catalyst reduction and passivation. c Degree of reduction as estimated by H2-TPR after catalyst reduction. d Metal dispersion estimated by H2 chemisorption after catalyst reduction. e Average Ni particle size estimated by H2 chemisorption after catalyst reduction. f Average NiO particle size estimated by X-ray diffraction after catalyst calcination. g Average Ni particle size estimated by X-ray diffraction after catalyst reduction and passivation. h Average Ni particle size estimated by transmission electron microscopy after catalyst reduction and passivation. Table 6 Ni crystal sizes calculated on spent samples exposed to H2O or He. Experiment name Characteristic reaction conditions d(Ni)XRD after 6h on stream (nm) Exp. 7 P =20 bar, Feed: H2/CO=2 and 20% He 29 Exp. 8 P =20 bar, Feed: H2/CO=2 and 20% H2O 29 Exp. 9 P =20 bar, Feed: H2/CO=3 and 5% He 29 Exp. 10 P =20 bar, Feed: H2/CO=3 and 5% H2O 27 Table 7 Metallic surface area of the 20Ni/TiO2 batch 1 catalyst during methanation synthesis at 1bar, 583K and an inlet H2/CO ratio=3. The metallic surface area was estimated by H2 chemisorption. Time on stream (min) Metallic surface area (m2/g) 0 0.11 5 1.32 10 1.40 CO methanation over TiO2-supported nickel catalysts: A carbon formation study J. Barrientos a ⁎ M. Lualdi a R. Suárez París a V. Montes b M. Boutonnet a S. Järås a a KTH (Royal Institute of Technology), Chemical Technology, Teknikringen 42, S-100 44 Stockholm, Sweden KTH (Royal Institute of Technology) Chemical Technology Teknikringen 42 Stockholm S-100 44 Sweden b Organic Chemistry Department, Campus de Excelencia Internacional CeiA3, University of Córdoba, E-14014 Córdoba, Spain Organic Chemistry Department Campus de Excelencia Internacional CeiA3 University of Córdoba Córdoba E-14014 Spain ⁎ Corresponding author. Graphical abstract A systematic study on titania-supported nickel catalysts was performed in order to evaluate the effect of different process conditions on catalyst stability. Reaction tests and temperature-programmed-hydrogenation analyses were used in order to evaluate the effect of temperature, feed composition, water and reduction conditions on catalyst deactivation and carbon deposition. It was shown that high H2/CO ratios and syngas partial pressures decrease the rate of carbon formation. Moreover, increasing temperature enhanced the formation of more stable carbon species and thus catalyst deactivation. The temperature-programmed hydrogenation analyses also revealed that water reduces the rate of carbon deposition. However, water enhanced catalyst deactivation when the catalysts were reduced at high temperatures. This negative effect of water is probably due to a progressive destruction of the strong-metal-support interaction characteristic of titania-supported nickel catalysts reduced at high temperatures. Keywords Methanation Deactivation Nickel Titania Carbon formation 1 Introduction Synthetic natural gas (SNG) production from coal and biomass has attracted particular attention due to the increasing demand of natural gas and the imminent depletion of this fossil source [1–3]. Moreover, the use of biomass for this purpose can improve the security in the energy supply and, at the same time, reduce anthropogenic greenhouse gas emissions [4–6]. The conventional route for SNG production is based on the conversion of carbon feedstocks into synthesis gas via gasification and its subsequent catalytic conversion to SNG via methanation [7,8]. Methanation is a key step in the production of SNG and great efforts are made in the development of efficient catalysts [9–14] and reactor systems [15–20]. Among all the materials which catalyze the methanation reaction, nickel-based catalysts are preferred due to their high activity, selectivity towards methane and relatively low cost [21,22]. Nevertheless, the stability of nickel-based catalysts is threatened by multiple causes of deactivation occurring at different operating conditions. At low temperatures (473–573K) and high CO partial pressures, there is a high risk for nickel carbonyl formation which results in the loss of nickel and/or nickel particle sintering [23,24]. At moderately high temperatures (up to 723K) there is a potential for formation of polymeric carbon, also known as “gum” formation [3,25–28]. At higher temperatures (>773K) activity decay can occur due to thermal sintering of the support [29], formation of whisker carbon [30–33] and/or nickel crystal growth due to particle migration and mitigation [34]. Moreover, the presence of impurities in the feed gas, such as sulfur compounds, can also result in a severe loss of activity [35]. Therefore, catalyst optimization aims for materials with high stability under a wide range of conditions [21]. Alumina-supported nickel catalysts are, probably, the most used methanation catalysts due to their satisfactory activity and stability [2,36,37]. The effect of different operating parameters on the deactivation of Ni/γ-Al2O3 catalysts has also been widely studied. Shen et al. [23] studied the effect of temperature and CO partial pressure on nickel carbonyl formation. Ni/γ-Al2O3 catalysts have also been used to study carbon formation [25–28] and sulfur poisoning [35,38,39]. It is also important to mention the work of Bartholomew et al. [29] in which they investigated the effect of different parameters such as temperature, presence of water and alumina physicochemical properties on sintering. In the recent years, further work on catalyst development has been done and several studies have found catalysts exhibiting better performance than Ni/Al2O3. For instance, Guo et al. [40] reported that the addition of ZrO2 to Ni/Al2O3 catalysts enhances the resistance against carbon formation and sintering. Moreover, Zhang et al. [13,41] have recently compared Ni/SiC with Ni/Al2O3 and have found higher stability on Ni/SiC. In addition, Jia et al. [42] found higher stability on Ni/CaTiO3 than on Ni/Al2O3 catalysts under high temperature conditions. Finally, in our previous work [43], it was also found that Ni/TiO2 catalysts can exhibit significantly higher resistance towards carbon formation and nickel particle sintering than other supported catalysts under low temperature conditions. Moreover, the influence of different operating parameters on the deactivation of different supported catalysts could differ from that already studied on Ni/γ-Al2O3. For instance, TiO2-supported nickel catalysts present higher resistance towards nickel carbonyl formation than SiO2-supported nickel catalysts [43,44]. Metal-support interactions can also have an effect on the amount and type of carbon formed [43,45–47]. Furthermore, the conditions at which support sintering and phase transformation occur vary with different carriers [48–51]. Finally, it was shown in our previous study [43] that different amounts and species of carbon form for different supported nickel catalysts. Therefore, investigation on the effect of operating conditions on the stability of different catalysts is worthwhile. Furthermore, methanation is performed at a very wide range of conditions [1,52]. For instance, it can be performed adiabatically (such as in the TREMP™ process [3,20,53]), or quasi-isothermally (such as in fluidized bed reactor concepts [54–56]). As a result, methanation is practiced in a temperature range of 200 to 700°C and pressures from 20 to 60bar [1,52]. Indeed, it is not surprising to find in literature different procedures and reaction conditions to evaluate methanation catalysts, fact that complicates the comparison between catalysts from different studies. Once more, a good understanding of the effect of reaction parameters on the deactivation of different catalysts would help these comparisons. In this work, two different Ni/TiO2 catalysts were prepared and systematically tested under different methanation conditions. The aim of this study is to evaluate the effect of catalyst reduction conditions, reaction temperature, pressure, syngas composition and presence of water on catalyst deactivation and specially, on carbon formation. 2 Methods 2.1 Catalyst preparation Two titania-supported nickel catalysts were prepared by using incipient wetness impregnation. The Ni loading in both catalysts was 20wt%. The TiO2 (Degussa P25) support material was first dried at 393K for 6h and then calcined in flowing air for 10h at 973K (ramp=1K/min). After calcination, the support material was impregnated with an aqueous solution of Ni(NO3)2·6H2O (puriss. p.a.; ≥98.5% (KT), Fluka), dried for 3h at 393K and subsequently calcined in air at 723K for 3h (heating rate: 2.5K/min). The two prepared catalysts were named 20Ni/TiO2 batch 1 and 20Ni/TiO2 batch 2. These two catalyst batches were also used in our previous work [43]. The volume of aqueous solution required to dissolve the nickel salt was higher than the pore volume of the support. Therefore, the aqueous solution was deposited batch wise, drying the samples at 393K for 2h after every deposition. The same volume of Ni(NO3)2 aqueous solution was employed for both catalysts. The only difference in the preparation procedure between these two batches was the total number of depositions with intermediate drying used to complete the impregnation. A larger number of depositions was employed in the preparation of 20Ni/TiO2 batch 2. 2.2 Catalyst characterization techniques A Micromeritics Mercury Porosimeter, AutoPore IV was used in order to characterize the TiO2 support and the catalyst samples where the macropore contribution to the pore volume and surface area is significant. The degree of reduction (DoR) was estimated from temperature-programmed reduction (TPR) after in situ reduction of the samples and subsequent purging with helium for 1h at the reduction temperature. The TPR of the samples was performed at a heating rate of 10K/min up to 1203K in a flow of 5% H2 in Ar while monitoring the difference on thermal conductivity between the inlet and outlet gas. The thermal conductivity detector (TCD) signal was calibrated by the reduction of Ag2O powder. The DoR was calculated assuming that the unreduced nickel was composed of Ni (II) as evidenced from X-ray diffraction. The DoR calculation procedure has been described in [57]. Hydrogen static chemisorption was performed on the reduced catalysts in order to estimate the nickel dispersion (D H, %) and the nickel crystallite size (d(Ni0)H, nm). The chemisorption measurements were conducted on a Micromeritics ASAP 2020C unit at 308K, after reducing about 0.15g of the calcined catalyst samples in flowing H2 at different conditions. The average particle size of Ni was calculated according to [58]: (1) d ( N i 0 ) H = 97 D H × DoR X-ray diffraction (XRD) measurements were performed on a Siemens D5000 difractometer with Cu-Kα radiation (2θ =10–90°, step size=0.02°) equipped with a Ni filter. The measurements were carried out both after calcination and after reduction and passivation of the catalyst samples. Average crystallite diameter of Ni (d(Ni0)XRD, nm) and NiO (d(NiO)XRD, nm) were estimated by using the Scherrer formula and assuming spherical particles [59]. Transmission electron microscopy (TEM) images were obtained using a JEOL JEM 1400 microscope. All samples were mounted on 3mm holey carbon copper grids. The average particle size was calculated with 80–100 particles. X-ray photoelectron spectroscopy (XPS) data were recorded on 4mm×4mm pellets 0.5mm thick that were obtained by gently pressing the powdered materials following outgassing to a pressure below about 2×10−8 Torr at 423K in the instrument pre-chamber to remove chemisorbed volatile species. The main chamber of the Leibold–Heraeus LHS10 spectrometer used, capable of operating down to less than 2×10−9 Torr, was equipped with an EA-200MCD hemispherical electron analyzer with a dual X-ray source using AlKα (hv=1486.6eV) at 120W, at 30mA, with C(1s) as energy reference (284.6eV). Elemental analysis of metal-containing samples was performed by the staff at the Central Service for Research Support (SCAI) of the University of Córdoba. It was performed using inductively coupled plasma mass spectrometry (ICP-MS). Measurements were made on a PerkinElmer ELAN DRC-e instrument following dissolution of the sample in a 1:3HNO3/HCl mixture with a soft heating. Calibration was done by using PE Pure Plus atomic spectroscopy standards, also from PerkinElmer. Elemental analysis of metal-containing samples was performed by the staff at the Central Service for Research Support (SCAI) of the University of Córdoba. It was performed using inductively coupled plasma mass spectrometry (ICP-MS). Measurements were made on a PerkinElmer ELAN DRC-e instrument, which calibration was done by using PE Pure Plus atomic spectroscopy standards, also from PerkinElmer. Firstly, 100mg of sample were dissolved in 5ml of a solution consisting of a 1:3HNO3/HCl mixture with a soft heating (approximately 323K). Then, the solution was diluted with ultra-pure water until reaching a concentration of 100ppm of Ni. Temperature-programmed hydrogenation (TPH) was performed on the spent samples in order to study the type and amount of carbon present after reaction. The TPH of the samples was performed in situ by passing a flow of pure H2 (233Nml/mingcat) through the catalyst bed while increasing the temperature at a heating rate of 5K/min up to 963K. The evolution of methane was monitored during the treatment with a HiQuad™ QMG700 mass spectrometer (m/z =15, instead of 16 to avoid the interference of ionized oxygen from water vapor as in [60]). The pressure in the MS chamber, the SEM voltage and the signal reading time were set, respectively, at 5×10−6 mbar, 2000kV and 1s for all the experiments. 2.3 Catalytic testing The methanation tests were performed in a down-flow stainless steel fixed-bed reactor (i.d. 9mm) with a catalyst loading of 0.1–0.25g (pellet size: 53–90μm) diluted with a minimum 3.5g of SiC (average pellet size: 75μm). As already mentioned in the introduction section, different operating conditions were studied. Nevertheless, the major part of the experiments were performed at 583K, at a maximum pressure of 20bar and a molar inlet H2/CO ratio of 3. At these conditions, the small pellet size used for the methanation catalysts ensured the absence of any mass transfer limitations. A maximum intraparticle temperature difference of 1K was estimated by using the method described by Satterfield [61]. The reactor was heated by means of an oven and the catalyst bed temperature was regulated by cascade control with two thermocouples: one sliding thermocouple placed inside the catalyst bed and another one placed in the oven. This diluted reaction system, together with an aluminum jacket placed between the reactor and the oven, allowed for a quasi-isothermal operation. The observed variation in temperature along the catalyst bed was approximately ±2K in all the experiments. A more detailed description of the equipment is given in [62–64]. Prior to reaction, the catalyst was reduced in situ in pure H2 (450Nml/mingcat) at atmospheric pressure at 773K (heating rate: 5K/min) for 4h. After reduction, the catalyst was cooled to reaction temperature and then flushed with He before increasing the pressure to the desired level. Afterwards, the methanation experiments started with a stepwise increase of the syngas flow, together with a stepwise decrease of the He flow, in order to avoid a large temperature rise in the catalyst bed due to the exothermic reaction. The syngas feed contained between 1 and 3% of N2 as an internal standard. A systematic study was performed on the 20Ni/TiO2 batch 1. The different operating conditions used in this study are presented in Table 1 . As can be expected, variations in operating conditions such as temperature, composition and pressure will result in different kinetic rates. Therefore, different gas-hourly space velocities (GHSV) were used in these experiments in order to ensure a kinetically controlled CO conversion (the CO conversion at equilibrium is practically 100% at these conditions [21,52]). For all the experiments, the reaction was stopped after 6h on stream in order to compare, by means of TPH, carbon formation between different experiments. Furthermore, the 20Ni/TiO2 batch 2 was used in two different runs which lasted for longer times on stream. In one of the runs the catalyst was reduced at 773K for 4h while for the other run it was reduced at 573K for 16h (heating rate: 5K/min for both experiments). Different operating conditions were used during these runs in order to better evaluate the effect of different variables on the deactivation rate. The different operating conditions used in these two experiments are described in Tables 2 and 3 for the samples reduced at 773K and 573K, respectively. The gas products were analyzed on-line using a GC Agilent 6890 equipped with a TCD and a flame ionization detector (FID). H2, N2, CO, CH4 and CO2 were separated by a Carbosieve II packed column and analyzed on the TCD. C1–C6 hydrocarbons were separated by an alumina-plot column and quantified on the FID. Further description of the product analysis and data treatment is given in [64]. 3 Results and discussion 3.1 Characterization of supports and catalysts Table 4 shows the physical properties of the support material and the catalysts after calcination. These materials are characterized by their low surface area and large pores. Table 5 summarizes the physicochemical properties of the two studied catalysts after different reduction conditions. Figs. 1 and 2 present representative TEM images of the 20Ni/TiO2 batch 2 after reduction at 773K and 573K, respectively, which have been used to estimate the average nickel particle size. The images allow for a clear distinction between nickel crystallites and the titania support. The Ni average particle diameter was estimated from H2 static chemisorption, X-ray diffraction and transmission electron microscopy. As can be seen in Table 5, the two catalyst batches differed in Ni particle size. This difference is due to the different number of aqueous solution depositions during the impregnation as explained in the catalyst preparation section. Moreover, the measurements predicted by H2 chemisorption deviate significantly from those obtained by XRD and TEM. This phenomenon has been observed in other studies which use titania-supported catalysts and has been explained by a decrease of the H2 and CO adsorption properties due to the presence of a strong metal-support interaction (SMSI) [44,65–67]. It has been suggested that the reduction at high temperatures (around 773K) leads to the formation of intermetallic compounds [68] and/or partially reduced titania species (TiOx, x <2) [47,69] which are responsible for these phenomena. Another interesting observation is the difference in metal dispersion (DH) between the two catalyst batches. The metal dispersion after reduction at 773K is higher for the “batch 1” than for the “batch 2”. This difference can be explained by their difference in average nickel particle size. According to Van de Loosdrecht et al. [47], these TiO x species can form on small nickel crystallites after reduction at low temperatures. In other words, this metal-support interaction is more severe for small Ni particles. Thus, it is reasonable that the chemisorption of H2 is weaker for the 20/NiTiO2 batch 2. In attempting to understand the influence of the reduction temperature on the presence of this SMSI, the 20 Ni/TIO2 batch 2 was exposed to a series of reduction treatments at different temperatures with intermediate H2 static chemisorption analyses. First, the catalyst was in situ reduced at 573K for 4h and analyzed. The obtained nickel dispersion was D H =1.3 %. Subsequently, the same sample was reduced at 673K for 4h. The measured nickel dispersion was then DH =1.2 %. Finally, the sample was reduced at 773K for 4h. No available nickel surface area was observed after this last treatment. Conclusively, these H2-chemisorption analyses in series showed that this SMSI is definitely present after reduction at 773K. This statement is further supported by the difference in Ni wt% estimated from XPS, which is an indication of the Ni content in the catalyst surface. As can be seen in Table 5, the estimated nickel content is lower after reduction at 773K fact that indicates that the nickel surface is partially covered by TiO x species. Finally, it is worthwhile mentioning that the dispersion values obtained after reduction at 573K and 673K are still very low and the corresponding nickel crystal sizes are still larger than those observed by TEM measurements. In consequence, it is possible that this SMSI is also present after reduction at lower temperatures, however, to a lesser extent. 3.2 Effect of H2/CO ratio and syngas partial pressure As mentioned previously, the 20Ni/TIO2 batch 1 was used in a systematic study in order to evaluate the effect of different reaction conditions. This section presents and compares the experiments performed using different inlet H2/CO ratios and syngas partial pressures. In Fig. 3 , the CO conversion as a function of time on stream is presented for the experiments performed at 583K, atmospheric pressure and different inlet H2/CO ratios. This figure shows that the CO conversion, and thus the catalyst activity, is higher when using higher H2/CO ratios. In the previous work from Vannice [67,70,71], it was found that H2 and CO have, respectively, a positive and negative kinetic effect on the methanation rate. It was, therefore, not surprising to observe this difference in catalyst activity for these experiments. Furthermore, it can be deduced from Fig. 3 that the catalyst presents more stability when it is exposed to high H2/CO ratios. Two main deactivation phenomena are likely to occur at these low-temperature conditions: nickel carbonyl-promoted sintering and carbon deposition. Nevertheless, the formation of nickel carbonyls at these low CO partial pressures should be significantly suppressed [23]. In consequence, differences in carbon formation should explain the differences observed in catalyst stability. After 6h of reaction, the catalyst was cooled down to room temperature in helium. Afterwards, TPH was performed in situ on the catalyst samples at atmospheric pressure. The TPH profiles presented in Fig. 4 were obtained after the experiments presented in Fig. 3. As can be deduced from this figure, there is a clear effect of the inlet H2/CO ratio on the amount and species of carbon formed. On one hand, it can be concluded that the rate of carbon formation decreases with increasing H2/CO ratio. On the other hand, it can be observed that low H2/CO ratios lead to the formation of more stable carbon species. According to Bartholomew [27,28], three carbon species can form at the employed reaction temperature: atomic carbon (Cα), polymeric carbon (Cβ) and vermicular filaments (C v) presenting hydrogenation peaks at 473K, 673K and 673–873K, respectively [26–28]. The TPH profile of the experiment which used a H2/CO ratio=9 presents, mainly, a hydrogenation peak around 450K. This carbon specie can be identified as atomic carbon. The other experiments present their main hydrogenation peak at a temperature between 550 and 600K. According to the hydrogenating peak temperatures defined previously, the nature of these carbon species is uncertain. Nevertheless, this carbon species is hydrogenating around the reaction temperature. This can suggest that this species is atomic carbon which remained adsorbed on the nickel surface when the reaction was stopped. However, this statement contradicts the fact that, atomic carbon could be hydrogenated at much lower temperatures for the experiment performed using a H2/CO ratio=9. Moreover, it can be deduced from the TPH profile of the experiment performed using a H2/CO ratio=6 that another carbon species hydrogenating around 473K is present. In addition, this distinction between these two mentioned carbon species hydrogenating below the reaction temperature was also observed in our previous work [43]. Thereby, the authors suggest that this carbon specie hydrogenating between 550 and 600K is a type of polymeric carbon and is responsible for catalyst deactivation. Furthermore, the TPH profiles of the experiments performed using H2/CO ratios of 2, 3 and 6 present other hydrogenation peaks at temperatures between 600 and 800K. These type of carbon species can be identified as Cβ. However, some of these carbon species, especially those hydrogenating around 800K, could be identified as C v. It must be mentioned though, that this identification of carbon deposits is based only on the hydrogenation peak temperatures from literature [27,28]. Hence, the nature of these carbon species is uncertain. The experiment “Exp. 2” (inlet H2/CO ratio=3, P =1bar and T =583K) was repeated in order to analyze the spent sample by TEM and ICP-MS. The nickel loading obtained was 19.5% and no appreciable growth of the Ni particles was observed in the TEM images. Therefore, it could be concluded that no significant carbonyl-induced sintering neither Ni loss occurs for the experiments performed at atmospheric pressure. In Fig. 5 , the CO conversion as a function of time on stream is presented for the experiments performed at 20bar, 583K and different inlet H2/CO ratios. Once more, the catalyst exhibited higher activity and stability when exposed to higher H2/CO ratios. It must be noticed that the CO partial pressures in the presented experiments were considerably higher than those performed at atmospheric pressure. Therefore, there is a higher risk for nickel carbonyl formation or for a carbonyl induced sintering. In consequence, the inlet H2/CO ratio and thus, the inlet CO partial pressure are expected to have a significant effect on catalyst stability. After reaction, the catalysts were cooled down to room temperature in helium and brought down to atmospheric pressure in order to perform TPH in situ on the spent samples. Fig. 6 presents the TPH profiles obtained after the experiments presented in Figs. 3 and 5. It can be deduced from this figure that the amount of carbon formed is significantly reduced when operating at higher syngas partial pressures. Moreover, it can also be deduced that the main carbon specie formed on the nickel surface at high syngas partial pressures, during this 6h of reaction, is Cα. Fig. 6 reveals that the formation of polymeric carbon hydrogenating at 600K and 800K is significantly reduced when operating at high pressures. It is important though, not to conclude that polymeric carbon formation is completely suppressed at 20bar. In our previous work [43], it was shown that the dominant carbon species after 2h of reaction was Cα whereas, after 24h, the dominant species was that hydrogenating at 600K. Therefore, larger amounts of this type of polymeric carbon would be observed in the TPH profiles if the reaction was stopped at longer time on streams. The small amounts of polymeric carbon obtained in the high pressure experiments do not allow for a clear evaluation of the effect of H2/CO ratio. Indeed, the main difference between these experiments is the amount of Cα on the nickel surface, which is not directly related to catalyst deactivation. The effect of H2/CO ratio at high pressure was then evaluated by comparing deactivation rates, however, at longer time on streams when the deactivation due to nickel particle sintering is less significant. In Fig. 7 , the CO conversion as a function of time on stream is plotted for two different periods. The H2/CO ratios used were 3 and 6 for the first and second period, respectively. The deactivation rates, expressed in CO conversion loss per hour, are presented in the figure next to each period in order to better evaluate the effect of H2/CO ratio on catalyst deactivation. The figure shows that, at longer time on streams, the inlet H2/CO ratio has a small effect on catalyst deactivation, as it could be predicted from the carbon formation study at atmospheric pressure. 3.3 Effect of temperature This section presents and compares the experiments performed at different temperatures. In Fig. 8 , the CO conversion during methanation synthesis is plotted for the experiments performed at atmospheric pressure and three different temperatures: 553, 583 and 613K. Before analyzing the figure, it should be noticed that different GHSV were employed for these 3 experiments in order to expose the catalyst to kinetically controlled CO conversions. These GHSV were also defined based on expected activities with varying temperature in order to work at sufficiently high CO conversions that allow for a decent evaluation of the deactivation profiles. The figure reveals that the CO conversion obtained after 6h for the experiment performed at 613K was unexpectedly low. In order to evaluate that, it must be noticed that the employed space velocity was about 3 times higher than that employed at 583K. Moreover, the apparent activation energy of this reaction has been estimated in, approximately, 102kJ/mol [72,73]. Taking these two arguments into account, a higher CO conversion was expected when operating at 613K. This figure reveals, thereby, that the catalyst deactivated considerably faster at 613K than at the other temperatures. As described previously, TPH was performed on the spent samples after reaction. Fig. 9 presents the TPH profiles obtained after the experiments presented in Fig. 8. It can be deduced from the figure that the amount of carbon formed increased with increasing temperature. It can also be clearly observed that the formation rate of the carbon species hydrogenating around 750–800K was significantly high for the experiment performed at 613K, fact that can justify the differences in catalyst stability observed in Fig. 8. In the work of Sughrue et al. [73], they hypothesized three different mechanistic regions for CO methanation on nickel-based catalysts. According to the mentioned study, H2 adsorption is the rate-limiting step between 475 and 525K; CO dissociation and carbon hydrogenation are rate-limiting between 525 and 575K and; at temperatures above 575K, carbon hydrogenation is rate-determining. Thereby, it is probable that the rate of carbon polymerization increases significantly at temperatures above 575K, fact that is in agreement with the TPH results shown in Fig. 9. The effect of temperature on catalyst deactivation was also evaluated at high syngas partial pressures at longer times on stream. The effect of temperature on catalyst stability is illustrated in Fig. 10 . The results show that the deactivation rate is significantly higher when increasing the temperature from 583K to 613K. This phenomenon can be justified with the previous information obtained at atmospheric pressure. This significant acceleration of the deactivation rate is most probably due to an increase in the formation rate of this stable carbon species which hydrogenated around 750–800K. 3.4 Effect of water It is generally known that water, the major by-product in CO hydrogenation reactions, accelerates the deactivation of Fischer–Tropsch catalysts [58,74,75]. On one hand iron-based FT catalysts suffer from hydrothermal sintering when operating at high conversions, and so exposing the catalysts to high water partial pressures [76]. On the other hand, water has shown to enhance the oxidation of small clusters and the formation of inactive metal-support spinel species in cobalt-based FT catalysts [74,77–79]. Indeed, it is generally recommended to keep the water partial pressure below 5–6 atm by operating at CO conversions lower than 50–60% and/or using series of reactors with intermediate water removal [58]. In literature, studies concerning the effect of water on the stability of nickel-based methanation catalysts are, to the best of our knowledge, rather scarce. Bartholomew et al. [29] studied sintering of alumina-supported nickel catalysts in H2/H2O atmospheres. In contrast with the present work, that study was performed at considerably high temperatures and low concentrations of water. In the work of Mirodatos et al. [46], they also evaluated the effect of H2O on sintering. In agreement with Bartholomew et al. [29] they found that water does not induce sintering of nickel at low temperatures. However, it must be mentioned that this was evaluated at atmospheric pressure. Furthermore, it is generally accepted that water reduces the rates of carbon deposition [80]. In other words, water enhances the rate of carbon gasification [81]. Indeed, steam is co-fed with synthesis gas in some industrial coal-to-SNG applications in order to thermodynamically inhibit carbon deposition [80,82]. In this section, the effect of water is discussed by comparing the experiments performed at 20bar, 583K and different H2/CO ratios. Fig. 11 presents the CO conversion as a function of time on stream for experiments in which either steam or helium was mixed with the synthesis gas feed. A lower water concentration was employed for a H2/CO ratio=3 in order to evaluate if water has the same effect for different inlet concentrations. The figure reveals an evident negative effect of water on the resulting catalyst activity after 6h on stream. These results indicate that, for all the tested H2/CO ratios, water enhances catalyst deactivation and/or has a negative kinetic effect. As performed in the previous sections, TPH was done on the spent samples in order to qualitatively compare the amounts and species of carbon formed on the catalyst surface. Fig. 12 presents the TPH profiles obtained after the experiments presented in Fig. 11. It can be deduced from this figure that, as expected, water partially removes the amount of carbon present on the catalyst. It would be noteworthy to mention that, according to the authors of the present work, the only carbon specie found on these TPH profiles is Cα since the hydrogenation peak temperatures of these profiles are close to 473K. In this sense, we doubt that water could present any positive influence on catalyst stability during this 6h on stream. The spent samples were analyzed with XRD in order to evaluate if water could enhance sintering of the nickel particles. Table 6 presents the calculated nickel crystal sizes obtained after the experiments presented in Fig. 11. It can be clearly deduced that H2O does not enhance sintering of nickel particles at the employed operating conditions. Furthermore, no NiO neither NiTiO3 compounds could be observed in any of these difractograms. As previously presented, different water and helium feed concentrations were employed in a longer test in order to better evaluate the effect of water on the performance of Ni/TiO2 catalysts. Fig. 13 presents the CO conversion as a function of time on stream for these periods in which water and helium were co-fed with synthesis gas. In the first presented period the synthesis gas feed contained 20% He. In the next period, the synthesis gas feed contained 10% He and 10% H2O. Then, the flow of He was completely replaced by H2O. The operating conditions employed in the last period were exactly identical to those employed in the first. Fig. 13 reveals that water does not only accelerate catalyst deactivation but also has a negative kinetic effect. This last statement can be clearly observed by comparing the two last presented periods. These two observations are in accordance with the work from Sughrue and Bartholomew [73] in which they also found that, between 498 and 573K, water inhibited the methanation rate on Ni/Al2O3 catalysts and, in some cases, it was causing an irreversible loss of catalyst activity. Unfortunately, the results presented in this section cannot explain this detrimental effect of water on catalyst stability. Water has shown to decrease the amount of surface carbon species and has not shown to induce sintering of the nickel particles at the employed reaction conditions. At this point, the authors can speculate that, likewise cobalt-supported FT catalysts, water enhances the formation of inactive nickel-support species. However, these species were not detectable by XRD. In the present paper, the authors present an additional explanation for this controversial effect of water on catalyst deactivation. It was previously suggested by Iglesia et al. [83] that water can destroy the metal-support interaction present in titania-supported ruthenium-based FT catalysts. In a similar manner, we also suggest that water can oxidize the TiO x (x <2) species formed after reduction of the catalyst at high temperatures. These TiO x species are believed to enhance the rate of CO dissociation by accepting oxygen atoms on the nickel-support interface [47,84]. Moreover, according to Sughrue et al. [73], CO dissociation is co-rate limiting step at the employed reaction temperature. Thereby, it would not be surprising to observe an important decline in activity if this SMSI is disappearing. It is therefore, that we decided to further study the effect of water on catalyst samples reduced at 573K, temperature at which this SMSI is not present [47] or present in a lesser extent. In that sense, if the aforementioned explanation is valid, a lesser detrimental effect of water on catalyst stability would be observed on catalysts reduced at low temperature. This additional insight on the effect of water on catalyst stability is presented in the following section. 3.5 Effect of the reduction temperature The 20Ni/TiO2 batch 2 catalyst was reduced in situ at two different temperatures (573 and 773K) and tested at the same reaction conditions in order to study the effect of the reduction temperature on the activity and the stability of the catalyst. In Fig. 14 the CO conversion during the first 24h of methanation synthesis is presented for these two experiments. As it can be observed, the activity of the catalyst is significantly higher after reduction at 773K. This observation can be explained by the difference between the metal dispersion values obtained after reduction at these two temperatures (see Table 5), which indicates that, most probably, the metal-support interaction is stronger on the sample reduced at 773K. Fig. 14 also reveals that the loss of CO conversion is more severe on the sample reduced at 773K. This phenomenon may be explained with the fact that the sample reduced at 773K led to a considerably higher CO conversion and thus, it was exposed to higher water partial pressure. In the previous section, we suggested that water could destroy the SMSI present on Ni/TiO2 catalysts and so enhance catalyst deactivation. In order to evaluate this, different water and helium feed concentrations were employed on a longer test, however using the 20Ni/TIO2 batch 2 catalyst reduced at 573K. Fig. 15 presents the CO conversion as a function of time on stream for these periods in which water and helium were co-fed with synthesis gas. In the first presented period the synthesis gas feed contained 20% He. In the last period, the synthesis gas feed contained 10% He and 10% H2O. Fig. 15 shows that water has a negative kinetic effect but no clear enhancement of catalyst deactivation. This second observation is in discordance with the results presented in Fig. 13, in which water clearly accelerates catalyst deactivation. In other words, water only showed a clear detrimental effect on the catalyst reduced at 773K, which presents a stronger metal-support interaction. In order to further support the hypothesis that water enhances the oxidation of TiO x species, the authors of the present work studied, by means of H2 static chemisorption, the change in metallic surface area with reaction time on stream. As mentioned previously, these TiO x species do not only favor CO dissociation but also inhibit the chemisorption of H2 on the nickel surface. In consequence, it is expected to observe an increase in the estimated metallic surface area if water oxidizes these TiO x species. For this purpose, a catalyst sample was reduced in H2 for 4h at 773K and analyzed in a Micromeritics ASAP 2020C unit. After this first analysis, the methanation synthesis was performed in the same unit at atmospheric pressure, 583K and a H2/CO=3 for two reaction periods of 5min with intermediate H2 static chemisorption analyses. In Table 7 , the metallic surface area is presented for different reaction times on stream. As it can be observed, there is an increase of the estimated nickel surface area during reaction. 4 Conclusions In this work, a systematic study was performed on titania-supported nickel catalysts in order to evaluate the effect of different process conditions on the stability of these catalysts and mainly, on carbon formation. In addition, longer reaction tests were carried out in order to compare the observations derived from the systematic study with those observed at longer reaction times on stream. It was found that the inlet H2/CO ratio has a clear effect on both the amount and type of carbon species formed on the catalyst surface. The lower the H2/CO ratio the larger and the more stable is the carbon formed. The results of this study also revealed that the syngas partial pressure has again, a significant effect on carbon formation. The rate of carbon deposition is considerably lower at 20bar than at atmospheric pressure. As a result, the inlet H2/CO ratio has a less significant effect on carbon deposition when operating at high syngas partial pressures. Moreover, the effect of temperature on catalyst deactivation and carbon formation was assessed both at atmospheric pressure and at 20bar. In the systematic study performed at atmospheric pressure it was found that, for the studied temperature range (553–613K), the rate polymeric carbon formation increases significantly with temperature. This observation was in accordance with the clear enhancement of the deactivation rate with temperature at 20bar. The presence of water was found to decrease the rate of carbon deposition. Nevertheless, it accelerated catalyst deactivation. In addition, it was shown that water did not induce sintering of the nickel particles. Therefore, the authors suggest that, among other possible deactivation causes such as formation of inactive metal-support compounds, water is destroying the SMSI present on titania-supported nickel catalysts. This statement was supported by two different observations. On one hand, water presented a lesser, or even negligible detrimental effect on catalyst deactivation when the catalyst was reduced at 573K, temperature at which the catalyst probably presents a lower degree of reduction of TiO2 to TiO x (x <2). On the other hand, it was shown that the metallic surface area estimated by H2 chemisorption increased after methanation synthesis, fact that indicates that the water produced during reaction partially destroyed this SMSI. Acknowledgements The research leading to these results has received funding from the European Union Seventh Framework Programme (FP7/2013) under grant agreement n° 308733. The authors acknowledge the financial support provided by the Swedish Energy Agency. Junta de Andalucía is also acknowledged for financial support (P09-FQM-4781 project) and the Central Service for Research Support (SCAI) of the University of Córdoba. Professor J.R. Rostrup-Nielsen is specially acknowledged for enlightening discussion in this study. References [1] J. Kopyscinski T.J. Schildhauer S.M.A. Biollaz Fuel 89 2010 1763 1783 [2] J. Gao C. Jia J. Li M. Zhang F. Gu G. Xu Z. Zhong F. Su J. Energy Chem. 22 2013 919 927 [3] T.T.M. Nguyen L. Wissing M.S. Skjøth-Rasmussen Catal. Today 215 2013 233 238 [4] T. Gröbl H. Walter M. Haider Appl. Energy 97 2012 451 461 [5] C.R. Vitasari M. Jurascik K.J. Ptasinski Energy 36 2011 3825 3837 [6] B. Steubing I. Ballmer M. Gassner L. Gerber L. Pampuri S. Bischof O. Thees R. Zah Renew. Energy 61 2014 57 68 [7] V.M. Lebarbier R.A. Dagle L. Kovarik K.O. Albrecht X. Li L. Li C.E. Taylor X. Bao Y. Wang Appl. Catal. B: Environ. 144 2014 223 232 [8] R.W.R. Zwart H. Boerrigter Energy Fuels 19 2005 591 597 [9] Y. Huang, J. Li, P. Wu, C. Gao, Z. Wu, X. Zhou, W. Gao, E. Song, Preparation of methanation catalyst for synthesizing substitute natural gas involves mixing aluminum nitrate nonahydrate, magnesium nitrate hexahydrate, and organic substance containing oxygen, heating, and adding precipitating agent, Northwest Res Inst Chem Ind (NWRE-Non-standard) Xi'an Yuanchuang Chem Technology co Ltd (XIAN-Non-standard). [10] Y. Huang J.-J. Wang Z.-M. Liu G.-D. Lin H.-B. Zhang Appl. Cata. A: Gen. 466 2013 300 306 [11] V.M. Shinde G. Madras AIChE J. 60 2014 1027 1035 [12] J. Zhang Z. Xin X. Meng Y. Lv M. Tao Ind. Eng. Chem. Res. 52 2013 14533 14544 [13] G. Zhang J. Peng T. Sun S. Wang Cuihua Xuebao/Chin. J. Catal. 34 2013 1745 1755 [14] K. Pedersen, J.R. Rostrup-Nielsen, I.G.H. Jorgensen, K.J. Andersen, Methanation with sulphur-tolerant catalyst – comprising vanadium and/or molybdenum on Gp=IVB metal oxide, Haldor Topsoe as (Tops-C). [15] O. Görke P. Pfeifer K. Schubert Catal. Today 110 2005 132 139 [16] Z. Liu B. Chu X. Zhai Y. Jin Y. Cheng Fuel 95 2012 599 605 [17] H. Fan, Z. Li, Q. Zhang, X. Cui, S. Yan, Slurry bed methane synthesis by generating coal gas by gasification, purifying and converting to obtain methane raw material gas, and dispersing Raney nickel catalyst in inert liquid medium, Sedin Eng Co Ltd. (SEDI-Non-standard) Univ Taiyuan Technology (UYTA-Non-standard). [18] J. Kopyscinski T.J. Schildhauer S.M.A. Biollaz Chem. Eng. Sci. 66 2011 924 934 [19] J. Kopyscinski T.J. Schildhauer S.M.A. Biollaz Chem. Eng. Sci. 66 2011 1612 1621 [20] J.H. Jensen, J.M., Poulsen, N.U. Andersen, From coal to clean energy, Haldor Topsoe. [21] G.H. Watson I.C. Research Methanation Catalysts 1980 IEA Coal Research [22] G.B. Atkinson L.J. Nicks J. Catal. 46 1977 417 419 [23] W.M. Shen J.A. Dumesic C.G. Hill Jr. J. Catal. 68 1981 152 165 [24] B.C. Enger A. Holmen Catal. Rev. 54 2012 437 488 [25] J.G. McCarty P.R. Wentrcek H. Wise Am. Chem. Soc. Div. Pet. Chem. Prepr. 22 1977 1315 1323 [26] J.G. McCarty H. Wise J. Catal. 57 1979 406 416 [27] C.H. Bartholomew Catal. Rev. 24 1982 67 112 [28] C.H. Bartholomew Appl. Cata. A: Gen. 212 2001 17 60 [29] C.H. Bartholomew R.B. Pannell R.W. Fowler J. Catal. 79 1983 34 46 [30] H.S. Bengaard J.K. Nørskov J. Sehested B.S. Clausen L.P. Nielsen A.M. Molenbroek J.R. Rostrup-Nielsen J. Catal. 209 2002 365 384 [31] B. Harms E. Hohlein Oil Gas J. 78 1980 [32] S. Helveg J. Sehested J.R. Rostrup-Nielsen Catal. Today 178 2011 42 46 [33] J.R. Rostrup-Nielsen J. Sehested Whisker carbon revisited G.W.R.J.J. Spivey B.H. Davis Studies in Surface Science and Catalysis 2001 Elsevier 1 12 [34] J.R. Rostrup-Nielsen K. Pedersen J. Sehested Appl. Catal. A: Gen. 330 2007 134 138 [35] C.H. Bartholomew G.D. Weatherbee G.A. Jarvi J. Catal. 60 1979 257 269 [36] T.R. Phillips T.A. Yarwood J. Mulhall G.E. Turner J. Catal. 17 1970 28 34 [37] A. Williams G.A. Butler J. Hammonds J. Catal. 24 1972 352 355 [38] C.H. Bartholomew J.R. Katzer Sulfur poisoning of nickel in CO hydrogenation B. Delmon G.F. Froment Studies in Surface Science and Catalysis 1980 Elsevier 375 396 [39] C.H. Bartholomew A.H. Uken Appl. Catal. 4 1982 19 29 [40] C. Guo Y. Wu H. Qin J. Zhang Fuel Process. Technol. 124 2014 61 69 [41] G. Zhang T. Sun J. Peng S. Wang Appl. Cata. A: Gen. 462–463 2013 75 81 [42] C. Jia J. Gao J. Li F. Gu G. Xu Z. Zhong F. Su Catal. Sci. Technol. 3 2013 490 499 [43] J. Barrientos M. Lualdi M. Boutonnet S. Järås Appl. Catal. A: Gen. 486 2014 143 149 [44] M.A. Vannice R.L. Garten J. Catal. 56 1979 236 248 [45] C.H. Bartholomew M.V. Strasburg H.-Y. Hsieh Appl. Catal. 36 1988 147 162 [46] C. Mirodatos H. Praliaud M. Primet J. Catal. 107 1987 275 287 [47] J. van de Loosdrecht A.M. van der Kraan A.J. van Dillen J.W. Geus J. Catal. 170 1997 217 226 [48] K.V.R. Chary P.V. Ramana Rao V. Venkat Rao Catal. Commun. 9 2008 886 893 [49] J. Rynkowski A. Kaźmierczak A. Praźmowska-Wilanowska T. Paryjczak React. Kinet. Catal. Lett. 58 1996 169 175 [50] T. Khalil F. Abou El-Nour B. El-Gammal A.R. Boccaccini Powder Technol. 114 2001 106 111 [51] N. Keller C. Pham-Huu S. Roy M.J. Ledoux C. Estournes J. Guille J. Mater. Sci. 34 1999 3189 3202 [52] B. Höhlein H. Niessen J. Range H.J.R. Schiebahn M. Vorwerk Nucl. Eng. Des. 78 1984 241 250 [53] F.W. Moeller H. Roberts B. Britz Hydrocarb. Process. 53 1974 69 74 [54] A.J. Forney S.J. Gasior W.P. Haynes S. Katell Process to Make High-btu Gas From Coal 1970 U S Bur Mine [55] A.J. Forney, W.P., Haynes, J.J., Elliott, S.J., Gasior, G.E., Johnson, J.P. Strakey Jr, Synthane coal-to-gas process, 1973, 199–207. [56] R.C. Streeter, D. Anderson, J.T. Cobb Jr, Proceedings of Synthetic Pipeline Gas Symposium (Chicago) (1976) 95–127. [57] S. Lögdberg M. Lualdi S. Järås J.C. Walmsley E.A. Blekkan E. Rytter A. Holmen J. Catal. 274 2010 84 98 [58] C.H. Bartholomew, R.J. Farrauto, Fundamentals of Industrial Catalytic Processes: Second Edition, Wiley-AIChE, 2010. [59] M.P. Lemaitre, J.L. Delannay F, Characterization of Heteogeneous Catalysts, Marcel Dekker Inc, New York, 1984. [60] D.J. Moodley J. van de Loosdrecht A.M. Saib M.J. Overett A.K. Datye J.W. Niemantsverdriet Appl. Catal. A: Gen. 354 2009 102 110 [61] C.N. Satterfield Mass Transfer in Heterogeneous Catalysis 1970 M.I.T. Press [62] Ø. Borg S. Eri E.A. Blekkan S. Storsæter H. Wigum E. Rytter A. Holmen J. Catal. 248 2007 89 100 [63] S. Storsæter Ø. Borg E.A. Blekkan A. Holmen J. Catal. 231 2005 405 419 [64] M. Lualdi Fischer–Tropsch synthesis over cobalt-based catalysts for BTL applications School of Chemical Science and Engineering 2012 Kungliga Tekniska Högskolan Stockholm [65] S.J. Tauster Acc. Chem. Res. 20 1987 389 394 [66] S.J. Tauster S.C. Fung J. Catal. 55 1978 29 35 [67] M.A. Vannice J. Catal. 74 1982 199 202 [68] S.J. Tauster S.C. Fung R.L. Garten J. Am. Chem. Soc. 100 1978 170 175 [69] P.K. de Bokx R.L.C. Bonne J.W. Geus Appl. Catal. 30 1987 33 46 [70] M.A. Vannice J. Catal. 37 1975 462 473 [71] M.A. Vannice J. Catal. 44 1976 152 162 [72] M.A. Vannice J. Catal. 37 1975 449 461 [73] E.L. Sughrue C.H. Bartholomew Appl. Catal. 2 1982 239 256 [74] A.M. Saib D.J. Moodley I.M. Ciobîc M.M. Hauman B.H. Sigwebela C.J. Weststrate J.W. Niemantsverdriet J. Van De Loosdrecht Catal. Today 154 2010 271 282 [75] N.E. Tsakoumis M. Rønning Ø. Borg E. Rytter A. Holmen Catal. Today 154 2010 162 182 [76] M.E. Dry Chapter 7 – FT catalysts S. André D. Mark Studies in Surface Science and Catalysis 2004 Elsevier 533 600 [77] D. Schanke A.M. Hilmen E. Bergene K. Kinnari E. Rytter E. Ådnanes A. Holmen Catal. Lett. 34 1995 269 284 [78] G. Jacobs P.M. Patterson Y. Zhang T. Das J. Li B.H. Davis Appl. Cata. A: Gen. 233 2002 215 226 [79] G. Kiss C.E. Kliewer G.J. DeMartin C.C. Culross J.E. Baumgartner J. Catal. 217 2003 127 140 [80] E.G.M. Kuijpers R.B. Tjepkema J.W. Geus J. Mol. Catal. 25 1984 241 251 [81] E.G.M. Kuijpers J.W. Geus Fuel 62 1983 158 161 [82] G.F.I. Roberts D. Hebden C.T. Brooks J.D. Sudbury Application of slagging gasification to the production of sng from coal, agard Conference Proceedings 1979 [83] E. Iglesia S.C. Reyes R.J. Madon S.L. Soled Adv. Catal. 39 1993 221 302 [84] J. Zieliński J. Mol. Catal. 79 1993 187 198",
      "scopus-id": "84934759326",
      "coredata": {
        "eid": "1-s2.0-S0926860X15300429",
        "dc:description": "A systematic study on titania-supported nickel catalysts was performed in order to evaluate the effect of different process conditions on catalyst stability. Reaction tests and temperature-programmed-hydrogenation analyses were used in order to evaluate the effect of temperature, feed composition, water and reduction conditions on catalyst deactivation and carbon deposition. It was shown that high H2/CO ratios and syngas partial pressures decrease the rate of carbon formation. Moreover, increasing temperature enhanced the formation of more stable carbon species and thus catalyst deactivation. The temperature-programmed hydrogenation analyses also revealed that water reduces the rate of carbon deposition. However, water enhanced catalyst deactivation when the catalysts were reduced at high temperatures. This negative effect of water is probably due to a progressive destruction of the strong-metal-support interaction characteristic of titania-supported nickel catalysts reduced at high temperatures.",
        "openArchiveArticle": "false",
        "prism:coverDate": "2015-08-05",
        "openaccessUserLicense": null,
        "prism:aggregationType": "Journal",
        "prism:url": "https://api.elsevier.com/content/article/pii/S0926860X15300429",
        "dc:creator": [
          {
            "@_fa": "true",
            "$": "Barrientos, J."
          },
          {
            "@_fa": "true",
            "$": "Lualdi, M."
          },
          {
            "@_fa": "true",
            "$": "Suárez París, R."
          },
          {
            "@_fa": "true",
            "$": "Montes, V."
          },
          {
            "@_fa": "true",
            "$": "Boutonnet, M."
          },
          {
            "@_fa": "true",
            "$": "Järås, S."
          }
        ],
        "link": [
          {
            "@_fa": "true",
            "@rel": "self",
            "@href": "https://api.elsevier.com/content/article/pii/S0926860X15300429"
          },
          {
            "@_fa": "true",
            "@rel": "scidir",
            "@href": "https://www.sciencedirect.com/science/article/pii/S0926860X15300429"
          }
        ],
        "dc:format": "application/json",
        "openaccessType": null,
        "pii": "S0926-860X(15)30042-9",
        "prism:volume": "502",
        "prism:publisher": "Elsevier B.V.",
        "dc:title": "CO methanation over TiO2-supported nickel catalysts: A carbon formation study",
        "prism:copyright": "Copyright © 2015 Elsevier B.V. All rights reserved.",
        "openaccess": "0",
        "prism:issn": "0926860X",
        "dcterms:subject": [
          {
            "@_fa": "true",
            "$": "Methanation"
          },
          {
            "@_fa": "true",
            "$": "Deactivation"
          },
          {
            "@_fa": "true",
            "$": "Nickel"
          },
          {
            "@_fa": "true",
            "$": "Titania"
          },
          {
            "@_fa": "true",
            "$": "Carbon formation"
          }
        ],
        "openaccessArticle": "false",
        "prism:publicationName": "Applied Catalysis A: General",
        "openaccessSponsorType": null,
        "prism:pageRange": "276-286",
        "prism:endingPage": "286",
        "pubType": "fla",
        "prism:coverDisplayDate": "5 August 2015",
        "prism:doi": "10.1016/j.apcata.2015.06.029",
        "prism:startingPage": "276",
        "dc:identifier": "doi:10.1016/j.apcata.2015.06.029",
        "openaccessSponsorName": null
      },
      "objects": {
        "object": [
          {
            "@category": "thumbnail",
            "@height": "88",
            "@width": "219",
            "@_fa": "true",
            "$": "https://api.elsevier.com/content/object/eid/1-s2.0-S0926860X15300429-fx1.sml?httpAccept=%2A%2F%2A",
            "@multimediatype": "GIF image file",
            "@type": "IMAGE-THUMBNAIL",
            "@size": "5116",
            "@ref": "fx1",
            "@mimetype": "image/gif"
          },
          {
            "@category": "thumbnail",
            "@height": "73",
            "@width": "219",
            "@_fa": "true",
            "$": "https://api.elsevier.com/content/object/eid/1-s2.0-S0926860X15300429-gr1.sml?httpAccept=%2A%2F%2A",
            "@multimediatype": "GIF image file",
            "@type": "IMAGE-THUMBNAIL",
            "@size": "16977",
            "@ref": "gr1",
            "@mimetype": "image/gif"
          },
          {
            "@category": "thumbnail",
            "@height": "164",
            "@width": "200",
            "@_fa": "true",
            "$": "https://api.elsevier.com/content/object/eid/1-s2.0-S0926860X15300429-gr10.sml?httpAccept=%2A%2F%2A",
            "@multimediatype": "GIF image file",
            "@type": "IMAGE-THUMBNAIL",
            "@size": "11197",
            "@ref": "gr10",
            "@mimetype": "image/gif"
          },
          {
            "@category": "thumbnail",
            "@height": "164",
            "@width": "139",
            "@_fa": "true",
            "$": "https://api.elsevier.com/content/object/eid/1-s2.0-S0926860X15300429-gr11.sml?httpAccept=%2A%2F%2A",
            "@multimediatype": "GIF image file",
            "@type": "IMAGE-THUMBNAIL",
            "@size": "13758",
            "@ref": "gr11",
            "@mimetype": "image/gif"
          },
          {
            "@category": "thumbnail",
            "@height": "164",
            "@width": "208",
            "@_fa": "true",
            "$": "https://api.elsevier.com/content/object/eid/1-s2.0-S0926860X15300429-gr12.sml?httpAccept=%2A%2F%2A",
            "@multimediatype": "GIF image file",
            "@type": "IMAGE-THUMBNAIL",
            "@size": "18831",
            "@ref": "gr12",
            "@mimetype": "image/gif"
          },
          {
            "@category": "thumbnail",
            "@height": "164",
            "@width": "213",
            "@_fa": "true",
            "$": "https://api.elsevier.com/content/object/eid/1-s2.0-S0926860X15300429-gr13.sml?httpAccept=%2A%2F%2A",
            "@multimediatype": "GIF image file",
            "@type": "IMAGE-THUMBNAIL",
            "@size": "13514",
            "@ref": "gr13",
            "@mimetype": "image/gif"
          },
          {
            "@category": "thumbnail",
            "@height": "164",
            "@width": "216",
            "@_fa": "true",
            "$": "https://api.elsevier.com/content/object/eid/1-s2.0-S0926860X15300429-gr14.sml?httpAccept=%2A%2F%2A",
            "@multimediatype": "GIF image file",
            "@type": "IMAGE-THUMBNAIL",
            "@size": "16093",
            "@ref": "gr14",
            "@mimetype": "image/gif"
          },
          {
            "@category": "thumbnail",
            "@height": "164",
            "@width": "210",
            "@_fa": "true",
            "$": "https://api.elsevier.com/content/object/eid/1-s2.0-S0926860X15300429-gr15.sml?httpAccept=%2A%2F%2A",
            "@multimediatype": "GIF image file",
            "@type": "IMAGE-THUMBNAIL",
            "@size": "13762",
            "@ref": "gr15",
            "@mimetype": "image/gif"
          },
          {
            "@category": "thumbnail",
            "@height": "73",
            "@width": "219",
            "@_fa": "true",
            "$": "https://api.elsevier.com/content/object/eid/1-s2.0-S0926860X15300429-gr2.sml?httpAccept=%2A%2F%2A",
            "@multimediatype": "GIF image file",
            "@type": "IMAGE-THUMBNAIL",
            "@size": "13935",
            "@ref": "gr2",
            "@mimetype": "image/gif"
          },
          {
            "@category": "thumbnail",
            "@height": "164",
            "@width": "199",
            "@_fa": "true",
            "$": "https://api.elsevier.com/content/object/eid/1-s2.0-S0926860X15300429-gr3.sml?httpAccept=%2A%2F%2A",
            "@multimediatype": "GIF image file",
            "@type": "IMAGE-THUMBNAIL",
            "@size": "13784",
            "@ref": "gr3",
            "@mimetype": "image/gif"
          },
          {
            "@category": "thumbnail",
            "@height": "164",
            "@width": "212",
            "@_fa": "true",
            "$": "https://api.elsevier.com/content/object/eid/1-s2.0-S0926860X15300429-gr4.sml?httpAccept=%2A%2F%2A",
            "@multimediatype": "GIF image file",
            "@type": "IMAGE-THUMBNAIL",
            "@size": "13919",
            "@ref": "gr4",
            "@mimetype": "image/gif"
          },
          {
            "@category": "thumbnail",
            "@height": "164",
            "@width": "211",
            "@_fa": "true",
            "$": "https://api.elsevier.com/content/object/eid/1-s2.0-S0926860X15300429-gr5.sml?httpAccept=%2A%2F%2A",
            "@multimediatype": "GIF image file",
            "@type": "IMAGE-THUMBNAIL",
            "@size": "16621",
            "@ref": "gr5",
            "@mimetype": "image/gif"
          },
          {
            "@category": "thumbnail",
            "@height": "164",
            "@width": "212",
            "@_fa": "true",
            "$": "https://api.elsevier.com/content/object/eid/1-s2.0-S0926860X15300429-gr6.sml?httpAccept=%2A%2F%2A",
            "@multimediatype": "GIF image file",
            "@type": "IMAGE-THUMBNAIL",
            "@size": "17679",
            "@ref": "gr6",
            "@mimetype": "image/gif"
          },
          {
            "@category": "thumbnail",
            "@height": "164",
            "@width": "198",
            "@_fa": "true",
            "$": "https://api.elsevier.com/content/object/eid/1-s2.0-S0926860X15300429-gr7.sml?httpAccept=%2A%2F%2A",
            "@multimediatype": "GIF image file",
            "@type": "IMAGE-THUMBNAIL",
            "@size": "11212",
            "@ref": "gr7",
            "@mimetype": "image/gif"
          },
          {
            "@category": "thumbnail",
            "@height": "164",
            "@width": "212",
            "@_fa": "true",
            "$": "https://api.elsevier.com/content/object/eid/1-s2.0-S0926860X15300429-gr8.sml?httpAccept=%2A%2F%2A",
            "@multimediatype": "GIF image file",
            "@type": "IMAGE-THUMBNAIL",
            "@size": "15048",
            "@ref": "gr8",
            "@mimetype": "image/gif"
          },
          {
            "@category": "thumbnail",
            "@height": "164",
            "@width": "209",
            "@_fa": "true",
            "$": "https://api.elsevier.com/content/object/eid/1-s2.0-S0926860X15300429-gr9.sml?httpAccept=%2A%2F%2A",
            "@multimediatype": "GIF image file",
            "@type": "IMAGE-THUMBNAIL",
            "@size": "15580",
            "@ref": "gr9",
            "@mimetype": "image/gif"
          },
          {
            "@category": "standard",
            "@height": "200",
            "@width": "500",
            "@_fa": "true",
            "$": "https://api.elsevier.com/content/object/eid/1-s2.0-S0926860X15300429-fx1.jpg?httpAccept=%2A%2F%2A",
            "@multimediatype": "JPEG image file",
            "@type": "IMAGE-DOWNSAMPLED",
            "@size": "22258",
            "@ref": "fx1",
            "@mimetype": "image/jpeg"
          },
          {
            "@category": "standard",
            "@height": "220",
            "@width": "659",
            "@_fa": "true",
            "$": "https://api.elsevier.com/content/object/eid/1-s2.0-S0926860X15300429-gr1.jpg?httpAccept=%2A%2F%2A",
            "@multimediatype": "JPEG image file",
            "@type": "IMAGE-DOWNSAMPLED",
            "@size": "49771",
            "@ref": "gr1",
            "@mimetype": "image/jpeg"
          },
          {
            "@category": "standard",
            "@height": "308",
            "@width": "376",
            "@_fa": "true",
            "$": "https://api.elsevier.com/content/object/eid/1-s2.0-S0926860X15300429-gr10.jpg?httpAccept=%2A%2F%2A",
            "@multimediatype": "JPEG image file",
            "@type": "IMAGE-DOWNSAMPLED",
            "@size": "35782",
            "@ref": "gr10",
            "@mimetype": "image/jpeg"
          },
          {
            "@category": "standard",
            "@height": "444",
            "@width": "376",
            "@_fa": "true",
            "$": "https://api.elsevier.com/content/object/eid/1-s2.0-S0926860X15300429-gr11.jpg?httpAccept=%2A%2F%2A",
            "@multimediatype": "JPEG image file",
            "@type": "IMAGE-DOWNSAMPLED",
            "@size": "57938",
            "@ref": "gr11",
            "@mimetype": "image/jpeg"
          },
          {
            "@category": "standard",
            "@height": "297",
            "@width": "376",
            "@_fa": "true",
            "$": "https://api.elsevier.com/content/object/eid/1-s2.0-S0926860X15300429-gr12.jpg?httpAccept=%2A%2F%2A",
            "@multimediatype": "JPEG image file",
            "@type": "IMAGE-DOWNSAMPLED",
            "@size": "55100",
            "@ref": "gr12",
            "@mimetype": "image/jpeg"
          },
          {
            "@category": "standard",
            "@height": "289",
            "@width": "376",
            "@_fa": "true",
            "$": "https://api.elsevier.com/content/object/eid/1-s2.0-S0926860X15300429-gr13.jpg?httpAccept=%2A%2F%2A",
            "@multimediatype": "JPEG image file",
            "@type": "IMAGE-DOWNSAMPLED",
            "@size": "40467",
            "@ref": "gr13",
            "@mimetype": "image/jpeg"
          },
          {
            "@category": "standard",
            "@height": "286",
            "@width": "376",
            "@_fa": "true",
            "$": "https://api.elsevier.com/content/object/eid/1-s2.0-S0926860X15300429-gr14.jpg?httpAccept=%2A%2F%2A",
            "@multimediatype": "JPEG image file",
            "@type": "IMAGE-DOWNSAMPLED",
            "@size": "45421",
            "@ref": "gr14",
            "@mimetype": "image/jpeg"
          },
          {
            "@category": "standard",
            "@height": "294",
            "@width": "377",
            "@_fa": "true",
            "$": "https://api.elsevier.com/content/object/eid/1-s2.0-S0926860X15300429-gr15.jpg?httpAccept=%2A%2F%2A",
            "@multimediatype": "JPEG image file",
            "@type": "IMAGE-DOWNSAMPLED",
            "@size": "40021",
            "@ref": "gr15",
            "@mimetype": "image/jpeg"
          },
          {
            "@category": "standard",
            "@height": "213",
            "@width": "640",
            "@_fa": "true",
            "$": "https://api.elsevier.com/content/object/eid/1-s2.0-S0926860X15300429-gr2.jpg?httpAccept=%2A%2F%2A",
            "@multimediatype": "JPEG image file",
            "@type": "IMAGE-DOWNSAMPLED",
            "@size": "39180",
            "@ref": "gr2",
            "@mimetype": "image/jpeg"
          },
          {
            "@category": "standard",
            "@height": "309",
            "@width": "376",
            "@_fa": "true",
            "$": "https://api.elsevier.com/content/object/eid/1-s2.0-S0926860X15300429-gr3.jpg?httpAccept=%2A%2F%2A",
            "@multimediatype": "JPEG image file",
            "@type": "IMAGE-DOWNSAMPLED",
            "@size": "44739",
            "@ref": "gr3",
            "@mimetype": "image/jpeg"
          },
          {
            "@category": "standard",
            "@height": "292",
            "@width": "377",
            "@_fa": "true",
            "$": "https://api.elsevier.com/content/object/eid/1-s2.0-S0926860X15300429-gr4.jpg?httpAccept=%2A%2F%2A",
            "@multimediatype": "JPEG image file",
            "@type": "IMAGE-DOWNSAMPLED",
            "@size": "41801",
            "@ref": "gr4",
            "@mimetype": "image/jpeg"
          },
          {
            "@category": "standard",
            "@height": "292",
            "@width": "376",
            "@_fa": "true",
            "$": "https://api.elsevier.com/content/object/eid/1-s2.0-S0926860X15300429-gr5.jpg?httpAccept=%2A%2F%2A",
            "@multimediatype": "JPEG image file",
            "@type": "IMAGE-DOWNSAMPLED",
            "@size": "49100",
            "@ref": "gr5",
            "@mimetype": "image/jpeg"
          },
          {
            "@category": "standard",
            "@height": "291",
            "@width": "376",
            "@_fa": "true",
            "$": "https://api.elsevier.com/content/object/eid/1-s2.0-S0926860X15300429-gr6.jpg?httpAccept=%2A%2F%2A",
            "@multimediatype": "JPEG image file",
            "@type": "IMAGE-DOWNSAMPLED",
            "@size": "51635",
            "@ref": "gr6",
            "@mimetype": "image/jpeg"
          },
          {
            "@category": "standard",
            "@height": "312",
            "@width": "377",
            "@_fa": "true",
            "$": "https://api.elsevier.com/content/object/eid/1-s2.0-S0926860X15300429-gr7.jpg?httpAccept=%2A%2F%2A",
            "@multimediatype": "JPEG image file",
            "@type": "IMAGE-DOWNSAMPLED",
            "@size": "35542",
            "@ref": "gr7",
            "@mimetype": "image/jpeg"
          },
          {
            "@category": "standard",
            "@height": "291",
            "@width": "376",
            "@_fa": "true",
            "$": "https://api.elsevier.com/content/object/eid/1-s2.0-S0926860X15300429-gr8.jpg?httpAccept=%2A%2F%2A",
            "@multimediatype": "JPEG image file",
            "@type": "IMAGE-DOWNSAMPLED",
            "@size": "43106",
            "@ref": "gr8",
            "@mimetype": "image/jpeg"
          },
          {
            "@category": "standard",
            "@height": "295",
            "@width": "376",
            "@_fa": "true",
            "$": "https://api.elsevier.com/content/object/eid/1-s2.0-S0926860X15300429-gr9.jpg?httpAccept=%2A%2F%2A",
            "@multimediatype": "JPEG image file",
            "@type": "IMAGE-DOWNSAMPLED",
            "@size": "41466",
            "@ref": "gr9",
            "@mimetype": "image/jpeg"
          },
          {
            "@category": "high",
            "@height": "886",
            "@width": "2213",
            "@_fa": "true",
            "$": "https://api.elsevier.com/content/object/eid/1-s2.0-S0926860X15300429-fx1_lrg.jpg?httpAccept=%2A%2F%2A",
            "@multimediatype": "JPEG image file",
            "@type": "IMAGE-HIGH-RES",
            "@size": "163357",
            "@ref": "fx1",
            "@mimetype": "image/jpeg"
          },
          {
            "@category": "high",
            "@height": "976",
            "@width": "2917",
            "@_fa": "true",
            "$": "https://api.elsevier.com/content/object/eid/1-s2.0-S0926860X15300429-gr1_lrg.jpg?httpAccept=%2A%2F%2A",
            "@multimediatype": "JPEG image file",
            "@type": "IMAGE-HIGH-RES",
            "@size": "653023",
            "@ref": "gr1",
            "@mimetype": "image/jpeg"
          },
          {
            "@category": "high",
            "@height": "1367",
            "@width": "1667",
            "@_fa": "true",
            "$": "https://api.elsevier.com/content/object/eid/1-s2.0-S0926860X15300429-gr10_lrg.jpg?httpAccept=%2A%2F%2A",
            "@multimediatype": "JPEG image file",
            "@type": "IMAGE-HIGH-RES",
            "@size": "153693",
            "@ref": "gr10",
            "@mimetype": "image/jpeg"
          },
          {
            "@category": "high",
            "@height": "1968",
            "@width": "1667",
            "@_fa": "true",
            "$": "https://api.elsevier.com/content/object/eid/1-s2.0-S0926860X15300429-gr11_lrg.jpg?httpAccept=%2A%2F%2A",
            "@multimediatype": "JPEG image file",
            "@type": "IMAGE-HIGH-RES",
            "@size": "295782",
            "@ref": "gr11",
            "@mimetype": "image/jpeg"
          },
          {
            "@category": "high",
            "@height": "1315",
            "@width": "1667",
            "@_fa": "true",
            "$": "https://api.elsevier.com/content/object/eid/1-s2.0-S0926860X15300429-gr12_lrg.jpg?httpAccept=%2A%2F%2A",
            "@multimediatype": "JPEG image file",
            "@type": "IMAGE-HIGH-RES",
            "@size": "229416",
            "@ref": "gr12",
            "@mimetype": "image/jpeg"
          },
          {
            "@category": "high",
            "@height": "1281",
            "@width": "1667",
            "@_fa": "true",
            "$": "https://api.elsevier.com/content/object/eid/1-s2.0-S0926860X15300429-gr13_lrg.jpg?httpAccept=%2A%2F%2A",
            "@multimediatype": "JPEG image file",
            "@type": "IMAGE-HIGH-RES",
            "@size": "161901",
            "@ref": "gr13",
            "@mimetype": "image/jpeg"
          },
          {
            "@category": "high",
            "@height": "1267",
            "@width": "1667",
            "@_fa": "true",
            "$": "https://api.elsevier.com/content/object/eid/1-s2.0-S0926860X15300429-gr14_lrg.jpg?httpAccept=%2A%2F%2A",
            "@multimediatype": "JPEG image file",
            "@type": "IMAGE-HIGH-RES",
            "@size": "171243",
            "@ref": "gr14",
            "@mimetype": "image/jpeg"
          },
          {
            "@category": "high",
            "@height": "1303",
            "@width": "1669",
            "@_fa": "true",
            "$": "https://api.elsevier.com/content/object/eid/1-s2.0-S0926860X15300429-gr15_lrg.jpg?httpAccept=%2A%2F%2A",
            "@multimediatype": "JPEG image file",
            "@type": "IMAGE-HIGH-RES",
            "@size": "136993",
            "@ref": "gr15",
            "@mimetype": "image/jpeg"
          },
          {
            "@category": "high",
            "@height": "945",
            "@width": "2833",
            "@_fa": "true",
            "$": "https://api.elsevier.com/content/object/eid/1-s2.0-S0926860X15300429-gr2_lrg.jpg?httpAccept=%2A%2F%2A",
            "@multimediatype": "JPEG image file",
            "@type": "IMAGE-HIGH-RES",
            "@size": "565095",
            "@ref": "gr2",
            "@mimetype": "image/jpeg"
          },
          {
            "@category": "high",
            "@height": "1370",
            "@width": "1667",
            "@_fa": "true",
            "$": "https://api.elsevier.com/content/object/eid/1-s2.0-S0926860X15300429-gr3_lrg.jpg?httpAccept=%2A%2F%2A",
            "@multimediatype": "JPEG image file",
            "@type": "IMAGE-HIGH-RES",
            "@size": "191936",
            "@ref": "gr3",
            "@mimetype": "image/jpeg"
          },
          {
            "@category": "high",
            "@height": "1291",
            "@width": "1669",
            "@_fa": "true",
            "$": "https://api.elsevier.com/content/object/eid/1-s2.0-S0926860X15300429-gr4_lrg.jpg?httpAccept=%2A%2F%2A",
            "@multimediatype": "JPEG image file",
            "@type": "IMAGE-HIGH-RES",
            "@size": "197140",
            "@ref": "gr4",
            "@mimetype": "image/jpeg"
          },
          {
            "@category": "high",
            "@height": "1295",
            "@width": "1667",
            "@_fa": "true",
            "$": "https://api.elsevier.com/content/object/eid/1-s2.0-S0926860X15300429-gr5_lrg.jpg?httpAccept=%2A%2F%2A",
            "@multimediatype": "JPEG image file",
            "@type": "IMAGE-HIGH-RES",
            "@size": "188290",
            "@ref": "gr5",
            "@mimetype": "image/jpeg"
          },
          {
            "@category": "high",
            "@height": "1290",
            "@width": "1668",
            "@_fa": "true",
            "$": "https://api.elsevier.com/content/object/eid/1-s2.0-S0926860X15300429-gr6_lrg.jpg?httpAccept=%2A%2F%2A",
            "@multimediatype": "JPEG image file",
            "@type": "IMAGE-HIGH-RES",
            "@size": "207949",
            "@ref": "gr6",
            "@mimetype": "image/jpeg"
          },
          {
            "@category": "high",
            "@height": "1383",
            "@width": "1669",
            "@_fa": "true",
            "$": "https://api.elsevier.com/content/object/eid/1-s2.0-S0926860X15300429-gr7_lrg.jpg?httpAccept=%2A%2F%2A",
            "@multimediatype": "JPEG image file",
            "@type": "IMAGE-HIGH-RES",
            "@size": "149437",
            "@ref": "gr7",
            "@mimetype": "image/jpeg"
          },
          {
            "@category": "high",
            "@height": "1289",
            "@width": "1667",
            "@_fa": "true",
            "$": "https://api.elsevier.com/content/object/eid/1-s2.0-S0926860X15300429-gr8_lrg.jpg?httpAccept=%2A%2F%2A",
            "@multimediatype": "JPEG image file",
            "@type": "IMAGE-HIGH-RES",
            "@size": "156055",
            "@ref": "gr8",
            "@mimetype": "image/jpeg"
          },
          {
            "@category": "high",
            "@height": "1309",
            "@width": "1667",
            "@_fa": "true",
            "$": "https://api.elsevier.com/content/object/eid/1-s2.0-S0926860X15300429-gr9_lrg.jpg?httpAccept=%2A%2F%2A",
            "@multimediatype": "JPEG image file",
            "@type": "IMAGE-HIGH-RES",
            "@size": "163896",
            "@ref": "gr9",
            "@mimetype": "image/jpeg"
          },
          {
            "@category": "thumbnail",
            "@height": "33",
            "@width": "144",
            "@_fa": "true",
            "$": "https://api.elsevier.com/content/object/eid/1-s2.0-S0926860X15300429-si1.gif?httpAccept=%2A%2F%2A",
            "@multimediatype": "GIF image file",
            "@type": "ALTIMG",
            "@size": "615",
            "@ref": "si1",
            "@mimetype": "image/gif"
          }
        ]
      },
      "link": {
        "@rel": "abstract",
        "@href": "https://api.elsevier.com/content/abstract/scopus_id/84934759326"
      }
    }
  }
}