{
  "metadata": {
    "title": "Spinel Co<ce:inf loc=post>3</ce:inf>O<ce:inf loc=post>4</ce:inf> oxides-support synergistic effect on catalytic oxidation of toluene",
    "authors": "; ; ",
    "journal": "Applied Catalysis A: General",
    "date": "2021-03-25",
    "doi": "10.1016/j.apcata.2021.118044",
    "abstract": "",
    "uri": "https://api.elsevier.com/content/article/pii/S0926860X21000582",
    "pii": "S0926860X21000582"
  },
  "fulltext": {
    "full-text-retrieval-response": {
      "scopus-eid": "2-s2.0-85101750056",
      "originalText": "serial JL 271346 291210 291744 291809 31 Applied Catalysis A: General APPLIEDCATALYSISAGENERAL 2021-02-18 2021-02-18 2021-03-01 2021-03-01 2021-03-13T00:52:18 1-s2.0-S0926860X21000582 S0926-860X(21)00058-2 S0926860X21000582 10.1016/j.apcata.2021.118044 S300 S300.1 FULL-TEXT 1-s2.0-S0926860X21X0004X 2024-01-01T12:34:28.416125Z 0 0 20210325 2021 2021-02-18T16:40:25.604842Z absattachment articleinfo articlenumber articletitlenorm authfirstinitialnorm authfirstsurnamenorm cid cids contenttype copyright crossmark dateloaded dateloadedtxt datesearch datesort dateupdated dco docsubtype doctype doi eid ewtransactionid hubeid indexeddate issn issnnorm itemstage itemtransactionid itemweight openaccess openarchive pg pgfirst pii piinorm pubdatestart pubdatetxt pubyr sortorder srctitle srctitlenorm srctype ssids alllist content subj subheadings suppl tomb volfirst volissue volumelist webpdf webpdfpagecount yearnav figure table e-component body mmlmath acknowledge affil appendices articletitle auth authfirstini authfull authkeywords authlast grantnumber grantsponsor grantsponsorid highlightsabst orcid primabst ref specialabst 0926-860X 0926860X true 614 614 C Volume 614 13 118044 118044 118044 20210325 25 March 2021 2021-03-25 2021 article fla © 2021 Elsevier B.V. All rights reserved. SPINELCO3O4OXIDESSUPPORTSYNERGISTICEFFECTCATALYTICOXIDATIONTOLUENE CHAI G 1 Introduction 2 Experimental 2.1 Catalyst preparation 2.2 Catalysts characterization 2.3 Catalytic activity measurement 2.4 Oxygen isotopic exchange 3 Results and discussion 4 Conclusions CRediT authorship contribution statement Acknowledgements Appendix A Supplementary data References ZHANG 2016 270 278 Z HE 2019 4471 4568 C ZHANG 2020 147320 C LI 2018 1675 1683 J CAO 2020 127215 J XIAO 2017 41827 41836 Z LIU 2019 137 144 Z ZHU 2017 1324 1328 Y SHANG 2017 33 44 Z DU 2014 73 77 Y MACHELI 2020 176 182 L ZHU 2013 1154 1164 Z DAI 2016 538 544 L BAI 2013 677 683 B ZHANG 2015 78 82 Y LI 2018 67 76 G HU 2010 363 368 L HU 2008 16136 16137 L GONZALEZPRIOR 2016 384 393 J ZHANG 2017 136 143 W LIOTTA 2013 3085 3102 L DERIVAS 2012 184 192 B WANG 2019 408 416 C BECK 2011 325 331 OUSMANE 2011 629 637 M WANG 2016 99577 99585 C GIROIRFENDLER 2016 29 37 A HUANG 2010 694 700 Q WANG 2017 392 402 C XIAO 2012 5762 5766 X XIA 2014 67 70 S OJALA 2010 527 533 S RICHARD 2014 11342 11345 M MARTIN 1996 9429 9438 D FANG 2018 12363 12369 N GRASSELLI 2002 79 88 R REN 2018 498 509 Q LIU 2020 145174 W MARS 1954 41 59 P ZHANG 2020 118894 W WYRWALSKI 2007 393 399 F JONGSOMJIT 2004 209 215 B WANG 2006 223 230 C ZHANG 2018 83 91 W ROYER 2005 364 375 S JIANG 2013 1 8 S BAYATI 2014 22316 22325 R LABAKI 2003 261 271 M SHAH 2019 475 P FORTUNATO 2011 18 24 M FANG 2020 15476 15488 Y FORTUNATO 2011 18 24 M CHAI 2020 867 G KIM 2002 285 299 S RUI 2017 159 166 Z CHAIX2021X118044 CHAIX2021X118044XG 2023-03-01T00:00:00.000Z 2023-03-01T00:00:00.000Z http://creativecommons.org/licenses/by-nc-nd/4.0/ © 2021 Elsevier B.V. All rights reserved. 2022-06-11T09:42:36.946Z http://vtw.elsevier.com/data/voc/AddOnTypes/50.7/aggregated-refined National Key Research and Development Program of China NKRDPC National Key Research and Development Program of China http://data.elsevier.com/vocabulary/SciValFunders/501100012166 http://sws.geonames.org/1814991/ China Scholarship Council CSC China Scholarship Council http://data.elsevier.com/vocabulary/SciValFunders/501100004543 http://sws.geonames.org/1814991/ Fundamental Research Funds for the Central Universities 222201717003 Fundamental Research Funds for the Central Universities http://data.elsevier.com/vocabulary/SciValFunders/501100012226 http://sws.geonames.org/1814991/ Centre National de la Recherche Scientifique CNRS Centre National de la Recherche Scientifique http://data.elsevier.com/vocabulary/SciValFunders/501100004794 http://sws.geonames.org/3017382/ Institute de Recherches sur la Catalyse et l&apos;Environnement de Lyon ZR2020QB139 National Natural Science Foundation of China-Shandong Joint Fund for Marine Science Research Centers http://data.elsevier.com/vocabulary/SciValFunders/501100013143 http://sws.geonames.org/1814991 Université Claude Bernard Lyon UCBL Université Claude Bernard Lyon 1 http://data.elsevier.com/vocabulary/SciValFunders/501100006687 http://sws.geonames.org/3017382/ 2016YFC0204300 National Key Research and Development Program of China Stem Cell and Translational Research http://data.elsevier.com/vocabulary/SciValFunders/501100013290 http://sws.geonames.org/1814991 Institute de Recherches sur la Catalyse et l’Environnement de Lyon Fundamental Research Funds for the Central Universities http://data.elsevier.com/vocabulary/SciValFunders/501100013804 http://sws.geonames.org/1814991 Natural Science Foundation of Shandong Province Natural Science Foundation of Shandong Province http://data.elsevier.com/vocabulary/SciValFunders/501100007129 http://sws.geonames.org/1814991/ Qingdao University of Science and Technology QUST Qingdao University of Science and Technology http://data.elsevier.com/vocabulary/SciValFunders/501100007938 http://sws.geonames.org/1814991/ National Natural Science Foundation of China 21577035 21607163 21922602 NSFC National Natural Science Foundation of China http://data.elsevier.com/vocabulary/SciValFunders/501100001809 http://sws.geonames.org/1814991/ Yankuang Technology Co. Ltd This work was financially supported by the National Key Research and Development Program of China (2016YFC0204300), the National Natural Science Foundation of China (21577035, 21922602, 21607163), the Natural Science Foundation of Shandong Province (ZR2020QB139), and the Fundamental Research Funds for the Central Universities (222201717003). The contribution of Qingdao University of Science and Technology, Yankuang Technology Co. Ltd, and the China Scholarship Council and the Institute de Recherches sur la Catalyse et l&apos;Environnement de Lyon (IRCELYON), Centre National de la Recherche Scientifique (CNRS) and Université Claude Bernard Lyon 1 (UCBL1) are also acknowledged. This work was financially supported by the National Key Research and Development Program of China ( 2016YFC0204300 ), the National Natural Science Foundation of China ( 21577035 , 21922602 , 21607163 ), the Natural Science Foundation of Shandong Province ( ZR2020QB139 ), and the Fundamental Research Funds for the Central Universities ( 222201717003 ). The contribution of Qingdao University of Science and Technology , Yankuang Technology Co. Ltd , and the China Scholarship Council and the Institute de Recherches sur la Catalyse et l’Environnement de Lyon (IRCELYON) , Centre National de la Recherche Scientifique (CNRS) and Université Claude Bernard Lyon 1 (UCBL1) are also acknowledged. https://doi.org/10.15223/policy-017 https://doi.org/10.15223/policy-037 https://doi.org/10.15223/policy-012 https://doi.org/10.15223/policy-029 https://doi.org/10.15223/policy-004 item S0926-860X(21)00058-2 S0926860X21000582 1-s2.0-S0926860X21000582 10.1016/j.apcata.2021.118044 271346 2024-01-01T12:34:28.416125Z 2021-03-25 1-s2.0-S0926860X21000582-main.pdf https://s3-eu-west-1.amazonaws.com/prod-ucs-content-store-eu-west/content/pii:S0926860X21000582/MAIN/application/pdf/a3512583aecab552a4ed52ec388c2ae3/main.pdf main.pdf pdf true 3034863 MAIN 9 1-s2.0-S0926860X21000582-main_1.png https://s3-eu-west-1.amazonaws.com/prod-ucs-content-store-eu-west/content/pii:S0926860X21000582/PREVIEW/image/png/69799d52a1194bb6cb20b66c76355939/main_1.png main_1.png png 51739 849 656 IMAGE-WEB-PDF 1 1-s2.0-S0926860X21000582-gr2.jpg https://s3-eu-west-1.amazonaws.com/prod-ucs-content-store-eu-west/content/pii:S0926860X21000582/gr2/DOWNSAMPLED/image/jpeg/5582e72a0902ff911472d1a0ddac2e31/gr2.jpg gr2 gr2.jpg jpg 98794 550 565 IMAGE-DOWNSAMPLED 1-s2.0-S0926860X21000582-ga1.jpg https://s3-eu-west-1.amazonaws.com/prod-ucs-content-store-eu-west/content/pii:S0926860X21000582/ga1/DOWNSAMPLED/image/jpeg/871fd8f2e98ac70ae58e3624712f356f/ga1.jpg ga1 true ga1.jpg jpg 23095 200 324 IMAGE-DOWNSAMPLED 1-s2.0-S0926860X21000582-gr1.jpg https://s3-eu-west-1.amazonaws.com/prod-ucs-content-store-eu-west/content/pii:S0926860X21000582/gr1/DOWNSAMPLED/image/jpeg/f0361e70df069c8331b336d438f93898/gr1.jpg gr1 gr1.jpg jpg 34539 493 300 IMAGE-DOWNSAMPLED 1-s2.0-S0926860X21000582-gr4.jpg https://s3-eu-west-1.amazonaws.com/prod-ucs-content-store-eu-west/content/pii:S0926860X21000582/gr4/DOWNSAMPLED/image/jpeg/e4d4f98f2cc87528ee6226cc6229e643/gr4.jpg gr4 gr4.jpg jpg 41811 349 565 IMAGE-DOWNSAMPLED 1-s2.0-S0926860X21000582-gr3.jpg https://s3-eu-west-1.amazonaws.com/prod-ucs-content-store-eu-west/content/pii:S0926860X21000582/gr3/DOWNSAMPLED/image/jpeg/e65ccd1afd30b07cfceade8f801ce0e7/gr3.jpg gr3 gr3.jpg jpg 19304 259 298 IMAGE-DOWNSAMPLED 1-s2.0-S0926860X21000582-gr6.jpg https://s3-eu-west-1.amazonaws.com/prod-ucs-content-store-eu-west/content/pii:S0926860X21000582/gr6/DOWNSAMPLED/image/jpeg/5ada593964e69f01c359c5b4c9188b5b/gr6.jpg gr6 gr6.jpg jpg 12685 229 299 IMAGE-DOWNSAMPLED 1-s2.0-S0926860X21000582-gr5.jpg https://s3-eu-west-1.amazonaws.com/prod-ucs-content-store-eu-west/content/pii:S0926860X21000582/gr5/DOWNSAMPLED/image/jpeg/b78f4a269828bf9c22ddcddbbbba2812/gr5.jpg gr5 gr5.jpg jpg 21894 225 299 IMAGE-DOWNSAMPLED 1-s2.0-S0926860X21000582-gr8.jpg https://s3-eu-west-1.amazonaws.com/prod-ucs-content-store-eu-west/content/pii:S0926860X21000582/gr8/DOWNSAMPLED/image/jpeg/9d1fafb163540163f475205b603ad10e/gr8.jpg gr8 gr8.jpg jpg 13988 225 301 IMAGE-DOWNSAMPLED 1-s2.0-S0926860X21000582-gr7.jpg https://s3-eu-west-1.amazonaws.com/prod-ucs-content-store-eu-west/content/pii:S0926860X21000582/gr7/DOWNSAMPLED/image/jpeg/68f87eb89c56d14553a8143a76d4bb00/gr7.jpg gr7 gr7.jpg jpg 40014 601 300 IMAGE-DOWNSAMPLED 1-s2.0-S0926860X21000582-gr2.sml https://s3-eu-west-1.amazonaws.com/prod-ucs-content-store-eu-west/content/pii:S0926860X21000582/gr2/THUMBNAIL/image/gif/54dee8d65f53815f264f3ab772ca3c3e/gr2.sml gr2 gr2.sml sml 17500 164 168 IMAGE-THUMBNAIL 1-s2.0-S0926860X21000582-ga1.sml https://s3-eu-west-1.amazonaws.com/prod-ucs-content-store-eu-west/content/pii:S0926860X21000582/ga1/THUMBNAIL/image/gif/9d5ac5a742bebf8fb64647c4635607a3/ga1.sml ga1 true ga1.sml sml 12595 135 219 IMAGE-THUMBNAIL 1-s2.0-S0926860X21000582-gr1.sml https://s3-eu-west-1.amazonaws.com/prod-ucs-content-store-eu-west/content/pii:S0926860X21000582/gr1/THUMBNAIL/image/gif/86ce97b482ff3d34034c950d8de3ddc3/gr1.sml gr1 gr1.sml sml 5028 163 99 IMAGE-THUMBNAIL 1-s2.0-S0926860X21000582-gr4.sml https://s3-eu-west-1.amazonaws.com/prod-ucs-content-store-eu-west/content/pii:S0926860X21000582/gr4/THUMBNAIL/image/gif/f7bae093e117430a2cea05f942bb7b50/gr4.sml gr4 gr4.sml sml 8655 135 219 IMAGE-THUMBNAIL 1-s2.0-S0926860X21000582-gr3.sml https://s3-eu-west-1.amazonaws.com/prod-ucs-content-store-eu-west/content/pii:S0926860X21000582/gr3/THUMBNAIL/image/gif/b23580e9ddaccf9088d97873c40fd7ec/gr3.sml gr3 gr3.sml sml 7583 164 189 IMAGE-THUMBNAIL 1-s2.0-S0926860X21000582-gr6.sml https://s3-eu-west-1.amazonaws.com/prod-ucs-content-store-eu-west/content/pii:S0926860X21000582/gr6/THUMBNAIL/image/gif/741e9056e3748d5878470e41dee84da0/gr6.sml gr6 gr6.sml sml 5691 164 214 IMAGE-THUMBNAIL 1-s2.0-S0926860X21000582-gr5.sml https://s3-eu-west-1.amazonaws.com/prod-ucs-content-store-eu-west/content/pii:S0926860X21000582/gr5/THUMBNAIL/image/gif/71254fe24a6a03c95e6aec35211744e2/gr5.sml gr5 gr5.sml sml 10098 164 217 IMAGE-THUMBNAIL 1-s2.0-S0926860X21000582-gr8.sml https://s3-eu-west-1.amazonaws.com/prod-ucs-content-store-eu-west/content/pii:S0926860X21000582/gr8/THUMBNAIL/image/gif/45bbdba0b1b9429ebb2c2e00ef7d63b5/gr8.sml gr8 gr8.sml sml 6144 163 219 IMAGE-THUMBNAIL 1-s2.0-S0926860X21000582-gr7.sml https://s3-eu-west-1.amazonaws.com/prod-ucs-content-store-eu-west/content/pii:S0926860X21000582/gr7/THUMBNAIL/image/gif/d97f1f8f03f7410fd3ba14d9854edb82/gr7.sml gr7 gr7.sml sml 4600 162 81 IMAGE-THUMBNAIL 1-s2.0-S0926860X21000582-gr2_lrg.jpg https://s3-eu-west-1.amazonaws.com/prod-ucs-content-store-eu-west/content/pii:S0926860X21000582/gr2/HIGHRES/image/jpeg/1b1e1cf889cc917b059eba7808f2ca34/gr2_lrg.jpg gr2 gr2_lrg.jpg jpg 1167070 2435 2500 IMAGE-HIGH-RES 1-s2.0-S0926860X21000582-ga1_lrg.jpg https://s3-eu-west-1.amazonaws.com/prod-ucs-content-store-eu-west/content/pii:S0926860X21000582/ga1/HIGHRES/image/jpeg/7e49938150813c4d0196ed08a14288eb/ga1_lrg.jpg ga1 true ga1_lrg.jpg jpg 186199 886 1437 IMAGE-HIGH-RES 1-s2.0-S0926860X21000582-gr1_lrg.jpg https://s3-eu-west-1.amazonaws.com/prod-ucs-content-store-eu-west/content/pii:S0926860X21000582/gr1/HIGHRES/image/jpeg/b6be4479fea3e4dd23f3e74f5e8a0c8c/gr1_lrg.jpg gr1 gr1_lrg.jpg jpg 294579 2184 1329 IMAGE-HIGH-RES 1-s2.0-S0926860X21000582-gr4_lrg.jpg https://s3-eu-west-1.amazonaws.com/prod-ucs-content-store-eu-west/content/pii:S0926860X21000582/gr4/HIGHRES/image/jpeg/d75a2c1c44723b1ca8b3ebfd79dc4edc/gr4_lrg.jpg gr4 gr4_lrg.jpg jpg 371076 1545 2500 IMAGE-HIGH-RES 1-s2.0-S0926860X21000582-gr3_lrg.jpg https://s3-eu-west-1.amazonaws.com/prod-ucs-content-store-eu-west/content/pii:S0926860X21000582/gr3/HIGHRES/image/jpeg/6ddfe96689ca8b7667ce7a5a1a0c3220/gr3_lrg.jpg gr3 gr3_lrg.jpg jpg 156718 1148 1323 IMAGE-HIGH-RES 1-s2.0-S0926860X21000582-gr6_lrg.jpg https://s3-eu-west-1.amazonaws.com/prod-ucs-content-store-eu-west/content/pii:S0926860X21000582/gr6/HIGHRES/image/jpeg/1fa0a3591fb86924dfa68fe7b29bf1b6/gr6_lrg.jpg gr6 gr6_lrg.jpg jpg 95958 1015 1324 IMAGE-HIGH-RES 1-s2.0-S0926860X21000582-gr5_lrg.jpg https://s3-eu-west-1.amazonaws.com/prod-ucs-content-store-eu-west/content/pii:S0926860X21000582/gr5/HIGHRES/image/jpeg/99770dc2bf3c63e19b80ce52dd78d24c/gr5_lrg.jpg gr5 gr5_lrg.jpg jpg 183246 998 1324 IMAGE-HIGH-RES 1-s2.0-S0926860X21000582-gr8_lrg.jpg https://s3-eu-west-1.amazonaws.com/prod-ucs-content-store-eu-west/content/pii:S0926860X21000582/gr8/HIGHRES/image/jpeg/80a4da986dde1a0b3851b722ce0f05a2/gr8_lrg.jpg gr8 gr8_lrg.jpg jpg 106994 995 1333 IMAGE-HIGH-RES 1-s2.0-S0926860X21000582-gr7_lrg.jpg https://s3-eu-west-1.amazonaws.com/prod-ucs-content-store-eu-west/content/pii:S0926860X21000582/gr7/HIGHRES/image/jpeg/d1e14675938296005263cdd83108aa9b/gr7_lrg.jpg gr7 gr7_lrg.jpg jpg 318131 2662 1328 IMAGE-HIGH-RES 1-s2.0-S0926860X21000582-mmc1.doc https://s3-eu-west-1.amazonaws.com/prod-ucs-content-store-eu-west/content/pii:S0926860X21000582/mmc1/MAIN/application/msword/0f7cf2156bcbf7a62a13b9038e2f8e80/mmc1.doc mmc1 mmc1.doc doc 1068032 APPLICATION 1-s2.0-S0926860X21000582-si1.svg https://s3-eu-west-1.amazonaws.com/prod-ucs-content-store-eu-west/content/pii:S0926860X21000582/STRIPIN/image/svg+xml/08fed0453f83126603ca103d2b80e64c/si1.svg si1 si1.svg svg 5463 ALTIMG 1-s2.0-S0926860X21000582-si2.svg https://s3-eu-west-1.amazonaws.com/prod-ucs-content-store-eu-west/content/pii:S0926860X21000582/STRIPIN/image/svg+xml/589adcab27ebedee43ae218155ae2653/si2.svg si2 si2.svg svg 3356 ALTIMG 1-s2.0-S0926860X21000582-am.pdf am am.pdf pdf 3397444 AAM-PDF https://s3-eu-west-1.amazonaws.com/prod-ucs-content-store-eu-west/content/egi:102WFG3HGNT/MAIN/application/pdf/593344ec05ab8211304ff06b165748d3/am.pdf APCATA 118044 118044 S0926-860X(21)00058-2 10.1016/j.apcata.2021.118044 Elsevier B.V. Fig. 1 (A) N2 adsorption-desorption isotherms and (B) XRD patterns of the synthesized catalysts and the supports. Fig. 1 Fig. 2 SEM images of (A) Bulk Co3O4, (B) Co3O4/YSZ and (C) Co3O4/TiO2 catalysts and low and high magnification TEM images of (D) and (D1) Bulk Co3O4, (E) and (E1) Co3O4/YSZ and (F) and (F1) Co3O4/TiO2 catalysts, respectivetly. Fig. 2 Fig. 3 H2-TPR profiles of the catalysts. Fig. 3 Fig. 4 XPS analysis of (A) Co 2p and (B) O 1s spectra for Bulk Co3O4 and supported catalysts. Fig. 4 Fig. 5 Toluene conversion as a function of reaction temperature during the third cooling ramp of the bulk Co3O4 catalyst, Co3O4 supported catalysts and dual catalyst bed. Fig. 5 Fig. 6 Long-term stability test performed with Co3O4/YSZ and Co3O4/TiO2 catalysts. Fig. 6 Fig. 7 Oxygen isotopic distribution and αg evolution during TPOIE experiments over (A) Bulk Co3O4, (B) Co3O4/YSZ and (C) Co3O4/TiO2 catalysts. Fig. 7 Fig. 8 Evolution of Ne during the TPOIE experiments over bulk Co3O4, Co3O4/YSZ and Co3O4/TiO2 catalysts. Fig. 8 Table 1 Physico-chemical properties of bulk Co3O4 and supported catalysts. Table 1 Catalysts ICP, Co wt.% BET, SSA (m2 g−1) Average pore size (nm) Pore volume (cm3 g−1) Crystalline size (nm) a Bulk Co3O4 71 5 10 0.010 87.8 YSZ – 13 15 0.048 22.3 Co3O4/YSZ 15 11 16 0.044 72.5 TiO2 – 61 15 0.276 21.0 Co3O4/TiO2 15 47 13 0.193 45.3 a Calculated from XRD measurements, using Scherrer’s equation based on the (311) crystal face (2θ = 36.8°) for Co3O4, and (111) and (101) crystal face (2θ = 30.1° and 2θ = 25.2°) for YSZ and TiO2 supports, respectively. Table 2 Theoretical and experimental H2-consumption and chemical surface composition of supported catalysts. Table 2 Catalysts Total H2-consumption (μmol g−1) a Theoretical Total H2-consumption (μmol g−1) a ApeakⅡ / ApeakⅠ b Co2+/Co3+ c Bulk Co3O4 18,674 16,063 2.15 (3.00) 0.42 YSZ – – – – Co3O4/YSZ 2980 3394 4.93 (3.00) 0.49 TiO2 265 25,000 – – Co3O4/TiO2 3245 3394 3.05 (3.00) 0.44 a Note that the amount of Co3O4 for unsupportedcatalyst was 5 times bigger than that for supported catalysts. b Calculated from the TPR profiles of the catalysts. Value in parentheses correspond to the theoretical one. c Obtained from the XPS measurements. Table 3 Catalytic performance and kinetic analysis of the catalysts for toluene oxidation. Table 3 Catalysts T50 (oC) T90 (oC) r × 108 (mol g−1 s−1) a lnA Ea (kJ mol−1) b Co3O4/YSZ 276 280 20.1 25.2 191 Co3O4/TiO2 359 377 0.2 20.0 184 Co3O4+SiC 291 312 12.3 47.1 287 Co3O4+YSZ 316 392 – – – Co3O4+TiO2 372 399 – – – a Calculated at 275 °C. b Obtained at toluene conversion less than 10%. Table 4 Numbers of total and exchanged oxygen atoms at 400 °C during TPOIE experiments. Table 4 Catalysts Ne (1020 at. g−1) a NO (1020 at g−1) b O atoms exchanged (%) Co3O4/YSZ 41.7 96.2 43.3 Co3O4 6.2 100.0 6.2 Co3O4/TiO2 1.1 140.6 0.8 Co3O4+YSZ 18.0 96.2 18.7 Co3O4+TiO2 8.9 140.6 6.3 Note that bare TiO2 and YSZ are not able to exchange lattice O atom at 400 °C. a Ne is the number of O exchanged atoms at 400 °C normalized per gram of the catalyst. b NO is the theoretical total number of O atoms available per gram of catalyst based on the stoichiometry of Co3O4, YSZ, and TiO2. Table 5 Comparison between the performance of Co3O4/YSZ and those of other supported Co3O4 or noble metal catalysts. Table 5 Catalysts Reaction condition Toluene conversion Reference Co/γ-Al2O3 0.5 g catalyst Less than 5% at 350 °C [54] 1000 ppm toluene 40 cm3/min Co3O4/CNTs-120 0.2 g catalyst T50 = 218 °C [46] 850 ppm toluene T90 = 232 °C 60 mL/min Co3O4/Beta 0.2 g catalyst T50 = 274 °C [46] 850 ppm toluene T90 = 293 °C 60 mL/min Co3O4/ZSM-5 0.2 g catalyst T50 = 294 °C [46] 850 ppm toluene T90 = 315 °C 60 mL/min Co3O4/SBA-15 0.2 g catalyst T50 = 316 °C [46] 850 ppm toluene T90 = 342 °C 60 mL/min Pd/SBA-15 0.2 g catalyst T50 = 254 °C [46] 850 ppm toluene T90 = 272 °C 60 mL/min Au/CeO2 0.2 g catalyst T50 = 211 °C [25] 1000 ppm toluene T90 = 263 °C 120 mL/min Au/TiO2 0.2 g catalyst T50 = 325 °C [25] 1000 ppm toluene T90 = 344 °C 120 mL/min Pt/TiNT 0.2 g catalyst T50 = 143 °C [55] 500 ppm T90 = 168 °C 100 mL/min Co3O4/YSZ 0.1 g catalyst T50 = 276 °C This work 1000 ppm toluene T90 = 280 °C 100 mL/min Spinel Co3O4 oxides-support synergistic effect on catalytic oxidation of toluene Guangtao Chai Validation Formal analysis Investigation Data curation Writing - original draft Writing - review & editing Visualization a b Dan Du Validation Formal analysis Data curation a Chao Wang Conceptualization Methodology Investigation Writing - review & editing Funding acquisition a * Chuanhui Zhang Methodology Formal analysis a Luis Cardenas Methodology Data curation b Nicolas Bion Methodology Data curation Formal analysis c Yanglong Guo Validation Writing - review & editing Supervision Funding acquisition a * Sonia Gil Validation Formal analysis Data curation Writing - review & editing Visualization Supervision Project administration b * Anne Giroir-Fendler Validation Supervision Funding acquisition b * a Key Laboratory for Advanced Materials, Research Institute of Industrial Catalysis, School of Chemistry and Molecular Engineering, East China University of Science and Technology, Shanghai, 200237, PR China Key Laboratory for Advanced Materials Research Institute of Industrial Catalysis School of Chemistry and Molecular Engineering East China University of Science and Technology Shanghai 200237 PR China Key Laboratory for Advanced Materials, Research Institute of Industrial Catalysis, School of Chemistry and Molecular Engineering, East China University of Science and Technology, Shanghai 200237, P.R. China b Univ. Lyon, CNRS, Université Claude Bernard Lyon 1, CNRS, IRCELYON, 2 Avenue Albert Einstein, Villeurbanne, F-69622, France Univ. Lyon CNRS Université Claude Bernard Lyon 1 CNRS IRCELYON 2 Avenue Albert Einstein Villeurbanne F-69622 France Univ. Lyon, CNRS, Université Claude Bernard Lyon 1, CNRS, IRCELYON, 2 avenue Albert Einstein, Villeurbanne F-69622, France c University of Poitiers, CNRS, UMR 7285, InStitut De Chimie Des Milieux Et Matériaux De Poitiers (IC2MP), 4 Rue Michel Brunet—TSA 51106, 86073, Cedex 9, France University of Poitiers CNRS UMR 7285 InStitut De Chimie Des Milieux Et Matériaux De Poitiers (IC2MP) 4 Rue Michel Brunet—TSA 51106 Cedex 9 86073 France University of Poitiers, CNRS, UMR 7285, Institut de Chimie des Milieux et Matériaux de Poitiers (IC2MP), 4 rue Michel Brunet—TSA 51106–86073 Cedex 9, France ⁎ Corresponding authors. Graphical abstract Bulk spinel Co3O4 oxide and supported Co3O4 catalysts (Co3O4/YSZ and Co3O4/TiO2) were synthesized by one-step hydrothermal method. Their physicochemical properties were characterized by inductively coupled plasma optical emission spectroscopy, N2-sorption, powder X-ray diffraction, scanning electron microscopy, transmission electron microscopy, hydrogen-temperature programmed reduction and X-ray photoelectron spectroscopy.These characterization strategies were applied to corroborate and better understand the interaction between Co3O4 and the supports induced by the synergistic effect of support and the subsequent catalytic performance in toluene oxidation. The catalytic stability was evaluated by three consecutive runs and a long-term test. A highest toluene catalytic activity was achieved over Co3O4/YSZ supported catalyst comparing to that of the bulk Co3O4 and Co3O4/TiO2 catalysts, which could be attributed to its better low-temperature reducibility, oxygen activation and mobility induced by the intrinsic support properties. Thus, the positive interaction between spinel Co3O4 phase and YSZ support promoted the intrinsic catalytic properties for toluene oxidation, which was verify by testing a dual catalyst bed system consisting of bulk Co3O4 catalyst and YSZ support beds. These results were further confirmed by temperature-programmed oxygen isotopic exchange experiments, which indicated that the activation and diffusion of oxygen species on the YSZ oxygen vacancy sites were promoted by Co3O4, resulting in a significant increase of the reaction rate for toluene oxidation. Keywords Bulk Co3O4 Synergistic effect of support TiO2 YSZ Toluene Oxidation Isotopic exchange 1 Introduction During the past decades, public attraction has been drawn on emission control of volatile organic compounds (VOCs). Their release is linked to the increase of photochemical smog and atmospheric ozone, which could cause great harm to the environment and human health. VOCs is a widely ranging class of chemicals, commonly existing in many commercial waste streams and containing over three hundred compounds. Toluene is one of the most common and toxic VOCs, which needs to be abated by developing a clean technology. Heterogeneous catalytic oxidation is regarded as one of the most promising methods to remove kinds of VOCs with low energy consumption and high selective conversion into harmless products (CO2 and H2O) [1–3]. Cobalt oxides have been applied in many fields, such as high-performance lithium-ion batteries, gas sensors, supercapacitor electrode and so on [4–8]. Particularly, due to the low cost, remarkable catalytic performance, and excellent stability in different reactions, cobalt oxides are greatly applied in heterogeneous catalytic process like diesel soot combustion, NOx removal, Fischer-Tropsch synthesis, reforming reaction, hydrogenation and many oxidation reactions [9–22]. In our previous work [23], it has been demonstrated that the cobalt oxides presented a high catalytic activity for vinyl chloride oxidation, which was correlated with the tunable morphology of Co3O4 nanocrystals. It was found that the catalytic activity and stability of cube-shaped Co3O4 catalyst was higher than that of sphere-shaped Co3O4 catalyst in the oxidation of vinyl chloride. This cube morphology was traduced in an enhanced amount of surface Co2+ and adsorbed oxygen active sites, which were finally the responsible of the above-mentioned higher activity. Moreover, recently supported catalysts have been widely researched in order to improve the catalytic performance by modifying the physicochemical properties of bare oxides with the introduction of the supports. The structural properties of the support can make significant impact on catalyst properties and performances, including reducibility, surface acidity, catalytic activity and stability [12,24–29]. Zhu and co-workers [12] synthesized a series of ZSM-5 supported Co3O4 catalysts together with bulk cobalt oxide. The ZSM-5 supported Co3O4 catalysts exhibited much better performance than bulk cobalt oxide catalyst, which was attributed to the easy reducibility of Co3+, the higher amount of surface lattice oxygen and the fast migration of oxygen ions into the lattice of cobalt oxide. Ousmane and co-workers [25] deposited gold particles on four different kinds of supports to prepare Au-supported catalysts and applied them in the abatement of propene and toluene. The interaction of gold nanoparticles with the support was spotlighted as an essential factor to enhance the catalytic performance of these catalysts. Therefore, understanding the support effects over bulk oxides is crucial, notably regarding the choice of an appropriate carrier material to improve the catalytic activity. For this propose, Co3O4 supported catalysts, using YSZ or TiO2 as a support, were synthetized by our previous one-step hydrothermal method in order to obtain a spinel cubic Co3O4 crystalline structure [23]. For this purpose, the oxide supports were directly introduced into the cobalt precursor solution, before starting the cobalt oxide crystallization. Toluene oxidation was chosen as a model reaction to evaluate their catalytic activity, noteworthy regarding the effect of YSZ or TiO2 supports. Therefore, the main aim of the present study was to evaluate the role of different supports on toluene catalytic oxidation reaction, stablishing the composition and catalytic activity relationship induced by the spinel Co3O4 phase and support synergistic combination. A standard set of characterization techniques, including X-ray diffraction, various spectroscopies and temperature programmed techniques, was used to evaluated catalyst physicochemical properties and to better understand the synergistic support effect. Three consecutive cycles and a long-term test were applied to test the stability of the catalysts. Furthermore, a powerful oxygen isotopic exchange technique was also carried out to get a better understanding of their catalytic behavior. 2 Experimental 2.1 Catalyst preparation Bulk spinel cubic Co3O4 catalyst was prepared by hydrothermal process according to the literature with some modifications [23,30,31]. In brief, 8.73 g Co(NO3)2·6H2O and 0.30 g NaOH were dissolved in 30 mL H2O, respectively. Then, these two solutions were mixed and kept stirring for 30 min. Subsequently, the mixed reactant was transferred into a Teflon-lined stainless-steel autoclave and then heated at 180 °C for 5 h. After cooling down to room temperature, the obtained product was washed with ethanol and distilled water for several times and further dried at 60 °C. It was further calcined at 500 °C for 3 h in air to get the final product of Co3O4. The hydrothermal process was also applied in the preparation of spinel Co3O4-supported catalysts, where the amount of the precursors were the same as those used for bulk Co3O4 catalyst. Co(NO3)2·6H2O and NaOH were dissolved in H2O. The solution was maintained at room temperature for 30 min under stirring. Subsequently, the calcined support was slowly added into the stirring solution with the calculated amount to obtain 20 wt.% Co3O4 (approximately 15 wt.% Co) in the Co3O4-supported catalysts. Then, this solution was transferred into a Teflon-lined stainless-steel autoclave for catalyst hydrothermal synthesis. The hydrothermal, washing and drying procedures were the same than that used for bulk Co3O4 catalyst preparation. The supports used in this work were: TiO2 (DT-51, Millennium Inorganic Chemicals) and YSZ (8 mol% Y2O3-stabilized ZrO2, TOSOH). These commercial supports were pre-calcined at 500 °C under air atmosphere for 3 h before starting the hydrothermal synthesis. The final catalysts were denoted as Co3O4/TiO2 and Co3O4/YSZ. 2.2 Catalysts characterization The Co content of the catalyst was measured by Inductively Coupled Plasma Optical Emission Spectrometry (ICP-OES) from HORIBA Jobin Yvon Activa equipped with a CCD detector. Powder X-ray diffraction (XRD) patterns of the catalysts were measured using a Bruker D5005 diffractometer equipped with Cu Kα (λ = 0.15418 nm). The scan range was from 10 to 80° (2θ) with a step size of 0.02° at a scanning speed of 2 s∙step−1. The nitrogen adsorption and desorption isotherms were measured at 77 K on a Micromeritics Tristar 3000 surface area and porosity analyzer after pre-desorption at 200 °C for 5 h. The specific surface area of each catalyst was calculated from the linear part according to the Brunauer-Emmett-Teller (BET) method. Hydrogen Temperature programmed reduction (H2-TPR) experiments were performed to measure the reducibility of the catalysts on Micromeritics AutoChem HP 2950 apparatus. 0.15 g sample was placed in a quartz reactor and flowed over by the reducing gas (20 vol% H2/Ar) with a flow rate of 30 mL∙min−1. The temperature range was from 25 to 900 °C with a heating rate of 5 °C min−1. The water produced during the reduction was cooled down through a cold trap. The amount of H2 uptake in the process was measured using a thermal conductivity detector (TCD). Before the analysis, the samples were pre-treated at 250 °C for 10 min with a gas flow of O2/He. Scanning electron microscopy (SEM) observations of the catalysts were performed on a JSM-7800F microscope. Transmission electron microscopy (TEM) observations of the catalysts were performed on a JEOL 2010 LaB6. The specimen for TEM was prepared by grinding the catalyst into powder in a mortar, dispersing it in ethanol and placing a droplet of the suspension onto a copper grid coated with carbon. X-ray photoelectron spectroscopy (XPS) measurements were carried out on a commercial Ultra-DLD (Kratos analytical) photo-electron spectrometer using a monochromatized Al Kα (1486.6 eV) source. The charge energy shift of the XPS spectra was corrected fixing the adventitious carbon C 1s peak at 284.6 eV. 2.3 Catalytic activity measurement Catalytic oxidation of toluene was carried out in a fixed-bed flow reactor (220 nm in length and 4 mm in internal diameter) at atmospheric pressure, using 0.10 g catalyst (except for bulk Co3O4 catalyst that the amount of catalyst was 0.02 g, mixed with 0.08 g silicon carbide (SiC) to keep the same amount of cobalt). Regardless of catalyst used, the 0.1 g of catalyst was subsequently mixed with SiC to avoid any hot spot, preserving the final height of the catalytic bed for bulk and supported catalysts.The catalytic reaction was carried out with a mixture of toluene (1000 ppm) and synthetic air (20 vol.% O2 / 80 vol.% N2) under a flow rate of 100 mL min−1. The concentration of CO2 was analyzed by PerkinElmer Clarus 500 GC equipped with a TCD. The reaction temperature program was started from room temperature to 80ºC with an initial temperature ramp of 5 °C min−1. Then a 30 min plateau was set to stabilize the signal, followed by a second temperature ramp of 2 °C min−1 up to 450ºC. After the heating run, the catalytic activity was also tested during the cooling range with a ramp of 1 °C min−1. This sequence was repeated three times for all the catalysts. Furthermore, the catalytic stability was evaluated by long-term test for the supported catalysts. The conversion was calculated according to the following equation. Toluene Conversion (%) = [CO2]realtime/[CO2]theoretical*100 Where [CO2]realtime represented the real-time concentration of CO2 during the reaction, and [CO2]theoretical represented the theory concentration of CO2 for the total oxidation of toluene. 2.4 Oxygen isotopic exchange The oxygen isotopic exchange experiments were performed in a closed setup already described elsewhere [32,33]. A U-type reactor was placed in a closed recycle system which was connected on one side to a Pfeiffer Vacuum QMS 200 mass spectrometer for the monitoring of the gas phase composition, and the other side to a vacuum pump. A recycling pump placed in the system removed limitations due to gas-phase diffusion. Temperature programmed oxygen isotopic exchange (TPOIE) experiments were performed on 20 mg of catalysts. Samples were pretreated under pure 16O2 flow at 700 °C during 1 h prior to cooling down to either 200 °C and then evacuated for 30 min. A 55 mbar dose of pure 18O2 (Isotec, 99.9%) was then introduced in the system and the heterolytic exchange reaction started (18O2(g)+16O(s)→ 18O16O(g)+18O(s) simple exchange). The temperature was increased from 200 to 700 °C with a ramp rate of 2 °C min−1. Temporal evolution of the concentrations of 18O2, 18O16O, and 16O2 isotopomers was continuously followed by collecting every 3 s the m/z = 36, 34, and 32 values, respectively. The m/z = 28 value was also monitored to detect any possible leak in the system. The determination of the atomic fraction of 18O in the gas-phase (αg), the number of O atoms exchanged (Ne) were described elsewhere [32,34]. Typically: α g = P 36 + 1 2 P 34 P 36 + P 34 + P 32 where P36, P34, and P32 are the partial pressures of 18O2, 18O16O, and 16O2 respectively, N e = N g * ( 1 - α g ) with Ng the number of 18O atoms in gas-phase at the beginning of the reaction. 3 Results and discussion The physico-chemical properties of the bulk Co3O4 and supported catalysts were summarized in Table 1 . The percentage of cobalt in bulk Co3O4 catalyst was 71% from the ICP-OES characterization, which was slightly lower than the expected value. The N2 adsorption-desorption isotherm of the catalysts was shown in Fig. 1 A. Both Co3O4 supported catalysts presented a profile of the type IV isotherm, showing a hysteresis loop due to capillary condensation representative of a porous material. The specific surface area (SSA) of bulk Co3O4 catalyst was 5 m2 g−1. As expected, the Co3O4-supported catalysts showed higher SSA than the bulk one (11 and 47 m2 g−1 forCo3O4/YSZ and Co3O4/TiO2 catalysts, respectively). These values are below the SSA values of bare supports but very close to additive SSA (0.2*SSA (raw Co3O4) + 0.8*SSA (YSZ or TiO2)). The SSA and pore volume of Co3O4/YSZ catalyst decreased slightly when compared with those of YSZ support, whereas its average pore size was nearly the same as that of YSZ. This fact could indicate that most part of Co3O4 oxide was deposed on the surface of YSZ instead of entering the pores. However, for Co3O4/TiO2 catalyst, the SSA, pore volume and average pore size showed a remarkable decline in comparison to that of the TiO2 support, which suggested a partial blockage of the pores of TiO2 by Co3O4 particles. XRD patterns of the catalysts and the corresponding supports are displayed in Fig. 1 (B). These XRD results clearly confirmed the formation of a pure spinel cubic Co3O4 phase (JCPDS file No.42-1467) in both bulk and supported catalysts. The YSZ and TiO2 supports after calcination showed a cubic structure (JCPDS file No.30-1468) and a tetragonal structure (JCPDS file No.65-5714), respectively, which were not modified during the preparation of the Co3O4-supported catalysts. Moreover, the crystallite size of bulk Co3O4 and Co3O4-supported catalysts was calculated using Scherrer’s equation based on the (311) crystal face (2θ = 36.8°), Table 1. The Co3O4 crystalline size slightly decreased for Co3O4/YSZ catalyst, whereas a significant decrease was observed for Co3O4/TiO2 catalyst, suggesting that the support could prevent the crystal growth of Co3O4 particles, as recently reported in literature for SiO2-supported CeO2 catalysts [35]. This fact could also explain the above-mentioned blockage of TiO2 pores by the cobalt ions adsorption into TiO2 support during the synthesis process. The crystallite sizes of YSZ and TiO2 in both bare oxides were also calculated using Scherrer’s equation based on the (111) crystal face (2θ = 30.1°) and (101) crystal face (2θ = 25.2°), respectively. SEM and TEM measurements were carried out to get insight into the overall morphology of the synthesized catalysts and, notably, to evaluate the Co3O4 particles distribution over the supports. Thus, a cubic Co3O4 morphology was clearly found for bulk Co3O4 catalyst (Fig. 2 A), in agreement with our previous work in which a more detail analysis of morphology was reported [23]. However, this cubic morphology was no clear for Co3O4-supported catalysts, which could be probably attributed to the fact that the YSZ (Fig. 2 B) and TiO2 (Fig. 2 C) particles partially coating large spinel cobalt oxide grains. The latter hypothesis is in agreement with the submicron size of Co3O4 and nanometric diameters of the YSZ and TiO2 grains observed by low and high magnification TEM images (Fig. 2 E and F and E1 and F1, respectively). These images seem to indicate that the support modified the Co3O4 particles morphology, in which the observed Co3O4 grains are quite rough and irregular comparing to that observed for bulk Co3O4 catalyst (Fig. 2 D and D1). Moreover, a comparison of the micro-metric size of the Co3O4 grains revealed by TEM with the size of the crystallites derived from XRD (87.8−45.3 nm) could also indicate that observed spinel grains are actually composed of several compacted crystallites. Nevertheless, although the spinel Co3O4 grains on both Co3O4/YSZ (Fig. 2 E, E1) and Co3O4/TiO2 (Fig. 2 F, F1) catalysts seem to be partially agglomerated, its particle size was smaller than that of the bulk Co3O4 catalyst (Fig. 2 D, D1). These results are in agreement with the above-mentioned XRD measurements. To sum up, according to the XRD results, both bulk and supported catalysts exhibited a crystalline structure typical of spinel cubic Co3O4 materials, and the incorporation of YSZ and TiO2 as a support appears to have an important influence on crystal growth of Co3O4 particles. The latter hypothesis was also observed by TEM images, in which the micro-metric Co3O4 grains seem to be partially covered by the nano-metric YSZ and TiO2 grains. The morphology of Co3O4 particles was also modified by the incorporation of both supports. However, further studies should be performed to completely understand the support effect on Co3O4 morphology, including fast Fourier transform (FFT) measurements in high resolution TEM images. In addition, the reducibility of bulk Co3O4 and supported Co3O4 catalysts, a key parameter in VOCs oxidation reactions [36–38], was evaluated by H2-TPR, Fig. 3 . It is noteworthy that the catalytic oxidation of toluene proceeds through a Mars-Van Krevelen (MvK)-type of mechanism [39], including the oxidation of toluene with surface oxygen species and so, the reduction of oxidized catalyst sites by toluene, which will be further re-oxidized by gas phase oxygen to form surface oxygen species again. For that, the catalytic performances for toluene oxidation are expected to be improved through a redox ability at the lowest possible temperature. For bulk Co3O4 catalyst, two reduction peaks were clearly observed, Fig. 3. The first reduction peak centered at 324 °C was associated with the reduction of Co3+ to Co2+, while the second peak located at 366 °C was assigned to the subsequent reduction of Co2+ to Co° [22]. Note that the deconvolution profiles of these first and second reduction peaks are denoted as I and II in Fig. 3. The H2-TPR analyses of the supports was also performed for comparison purpose in order to understand their reducibility and those of the supported catalysts. These results showed that TiO2 exhibited a single reduction peak at high temperature (at 470 °C) due to the partial reduction of TiO2, while YSZ displayed no obvious reduction peak in the given temperature range. Compared with bulk Co3O4 catalyst and the bare supports, obvious modifications of the onset reduction temperature, at which the reduction of Co3+ ions to Co2+ started, and as a consequence, the low-temperature reducibility were found for supported catalysts (Co3O4/YSZ and Co3O4/TiO2 catalysts). For Co3O4/YSZ catalyst, a clear shift of the reduction temperature (reduction of Co3+ to Co2+ at 291 °C) was observed, which indicates that the synergistic effect of YSZ support promotes the reduction of Co3O4 particles. Among others, this could be related to the smaller crystallite size of Co3O4[40]. Moreover, the anionic vacancies of YSZ support can also play an important role in term of reducibility and catalytic redox cycles. Thus, some cobalt species can occupy these anionic vacancies, making them easier to be reduced, which could also explain the better reducibility of Co3O4/YSZ catalyst [41]. Therefore, the positive interaction between Co3O4 and YSZ contributed to the lower reduction temperatures observed for this supported Co3O4/YSZ catalyst, increasing its low-temperature reducibility. Further temperature-programmed oxygen isotopic exchange (TPOIE) experiments were carried out to have a better understanding of the phenomena. On the contrary, an opposite effect was observed in presence of TiO2. Two reduction peaks at 344 and 386 °C were found for Co3O4/TiO2 catalyst. The first reduction peak could be assigned to the reduction of surface oxygen and Co3+ to Co2+, whereas the second one could be attributed to not only the reduction of Co2+ but also the partial reduction of TiO2 (Ti4+ into Ti3+). The reduction peaks of Co3O4/TiO2 catalyst shifted to higher temperature compared with those of the bulk Co3O4 catalyst, even though it possessed a small Co3O4 crystallite size. This shift of reduction temperature suggests a strong interaction between cobalt oxides and TiO2 support. The cobalt oxides seem to be strongly adsorbed on the TiO2 support, which could give rise to the formation of hardily reducible sub-surface interacted Co3O4–TiO2 or CoTiO3 species [42,43], decreasing the redox ability, which could be detrimental for the oxidation of toluene since Mvk mechanism [36]. Nevertheless, this shift of the reduction temperature might also arise from a coating effect, knowing that the Co3O4 spinel grains seem to be partially covered by TiO2 particles (see Fig. 2F), which could make a more difficult reducibility. Both possible assumptions affected the reducibility of Co3O4/TiO2 catalyst in a negative way, suggesting an inhibiting effect due to the synergistic combination of Co3O4 andTiO2 support [27]. Moreover, the total theoretical and experimental H2-comsumption and the ratio of two reduction peaks’ area (ApeakⅡ / ApeakⅠ) were calculated and are presented in Table 2 . The ratio of ApeakⅡ / ApeakⅠ can give an idea about the ratio of Co2+/Co3+ in the bulk structure of the catalysts. Thus, the lowest ratio obtained for bulk Co3O4 catalyst (2.15) comparing to that of Co3O4/YSZ and Co3O4/TiO2 supported catalysts (4.93 and 3.05, respectively) suggests that a higher amount of Co2+ species is provided by supported catalysts. Moreover, the total experimental H2-consumption of bulk Co3O4 catalyst was higher than the theoretical value, which was mainly because the surface adsorbed oxygen species and higher amount of Co3+ species consumed extra hydrogen. However, the experimental H2-consumption of supported Co3O4/YSZ and Co3O4/TiO2 catalysts decreased when compared with the theoretical values, even considering the additional consumption of H2 by the partial reduction of TiO2 in Co3O4/TiO2 catalyst. This could be ascribed to fact that more Co2+ species are presented in these two supported catalysts than expected. The surface chemical composition of the catalysts was investigated by X-ray Photoelectron Spectroscopy (XPS). XPS analysis on Co 2p and O 1s allowed to verify the electronic and structural changes induced by TiO2 and YSZ supports on spinel-Co3O4 (Fig. 4 A and B). Thus, Co 2p spectra of the bulk and supported catalysts display two main signals at binding energy (B.E.) of ∼ 795 and 780 eV, corresponding to Co 2p1/2 and Co 2p3/2 spin-orbital peaks of Co3O4 spinel. The energy difference (∼ 15.4 eV) between these two signals is in good agreement with the values in the literature, which indicates the presence of Co3O4[20]. Since the analysis of Co 2p1/2 and Co 2p3/2 provides the same chemical information, the Co 2p3/2 spectra were deconvoluted based on the fitting procedure reported by González-Prior [19] (shown in Fig. 4). The peak at B.E. of 779.1 eV was attributed to surface Co3+ species, while the peak at B.E. of 780.8 eV was assigned to surface Co2+ species. Particularly, it should be noticed that a certain amount of CoO (lower than 10% of the total amount of cobalt) was also observed in the Co 2p spectra, Fig.4 (A) of the supported catalysts, as revealed by the XPS signal at ∼ 784.5 eV [19,44]. The surface Co2+/Co3+ molar ratio was calculated and listed in Table 2, which are in good agreement with the bulk Co2+/Co3+ ratio suggested by H2-TPR results (see ratio of ApeakⅡ / ApeakⅠ). Co3O4/YSZ catalyst, unlike spinel-Co3O4, exhibit more relative tetrahedral sites occupied by Co2+, probably as a consequence of hydroxyl groups, OH− chemisorbed on vacant lattice sites. Note that these Co2+ cations are reported to be very active sites for CO, propane and toluene oxidation [20,45]. Thus, this higher surface Co2+ species could be correlated with an MvK mechanism, where the oxygen molecule adsorption takes place on an available reduced site (Co2 +-□). Fig. 4 B shows core level spectra of O1 s for bulk Co3O4, Co3O4/TiO2 and Co3O4/YSZ, respectively. The O1 s spectra, Fig.4 (B), of bulk Co3O4 and Co3O4/TiO2 catalysts can be fitted into two components attributable to: 1) the presence of surface lattice oxygen (Olatt.), which is identified at lower binding energy around 529.6 eV, and 2) the adsorbed oxygen at the surface oxygen vacancies and oxygen-containing group such as hydroxyl species (Oads), which is located at 531.3 eV [38,46]. The spectrum of bulk Co3O4 shows 42% of Oads and 52% of Olatt., whereas Co3O4/TiO2 exhibits 22% of Oads and 78% of Olatt.. In contrast, the spectrum of Co3O4/YSZ can be fitted into three contributions, namely Oads., Olatt. and nonstoichiometric zirconia (located at a binding energy around 528.5 eV) [47], representing 23%, 62% and 15%, respectively. Note that this nonstoichiometric zirconia may induce structural changes through bonds lengths variations concomitant with a significant amorphization of the structure. Thus, the nonstoichiometric zirconia together with oxygen vacancies could participate to the oxidation mechanism, favoring the oxygen activation and mobility, as it was reported in the literature for zirconia and ceria oxides [48,49]. The catalytic performance of bulk Co3O4 and Co3O4 supported catalysts were evaluated in the total oxidation of toluene, which acted as a model reaction for VOCs oxidation. The toluene conversion as a function of reaction temperature during the third catalytic run (cooling ramp) was showed in Fig. 5 . The values of T50 and T90 (the temperature for 50% and 90% conversion of toluene) were presented in Table 3 . The catalytic activity was enhanced in presence of YSZ as a catalytic support, which could be related to the synergistic effect of support and/or the positive interaction of cobalt oxides and YSZ support. This synergy combination seems to favor the creation of highly active sites [27]. Moreover, the presence of oxygen vacancies on YSZ support are expected to facilitate the oxygen mobility, favoring the redox cycles and improving the catalytic activity [50]. As a matter of fact, the anionic oxygen vacancies on YSZ (as well as the nonstoichiometric zirconia) could facilitate the oxygen transfer or mobility from YSZ to the catalyst surface, whose will probably participate in the oxidation reaction or improve the catalytic activity of cobalt catalyst. Furthermore, toluene conversion to CO2 over Co3O4/YSZ catalyst increased rapidly from 30% to nearly 100% from 275 to 285 °C, suggesting that an enough number of high reactive active sites are presented in this catalyst. This very steep slope was recently reported by by Y. Fang et al. [51]. Note that the CO concentration produced over Co3O4/YSZ catalyst was below 30 ppm in whole temperature range (shown in Fig. S1), which can be consider negligible, confirming the great selectivity of toluene oxidation to CO2. However, an opposite effect was observed for TiO2-supported catalyst, which showed a toluene catalytic activity even worse to that of the bulk Co3O4 catalyst. In order to verify the Co3O4 and support interaction effect, the toluene catalytic tests were also performed with a dual catalyst bed system consisting of bulk Co3O4 catalyst and YSZ or TiO2 support beds. From the profiles as well as T50 and T90, the catalytic activity of the catalysts followed the order of Co3O4/YSZ > Co3O4+SiC > Co3O4/TiO2> Co3O4+YSZ > Co3O4+TiO2. A drastically decreases of catalytic activity was produced without intimate contact, which suggests that a close interaction between Co3O4 phase and support is beneficial for toluene oxidation. Moreover, these results confirmed that the catalytic properties for toluene oxidation are highly influenced by the intrinsic properties of the support and the cobalt oxides-support interaction induced by its synergy combination. Indeed, for Co3O4/YSZ catalyst, spinel Co3O4 phase and YSZ support interact resulting in an overall effect that is greater than the sum of individual effects of any of them and/or that of dual catalyst beds. Thus, the highest catalytic activity of Co3O4/YSZ catalyst could be attributed to the synergistic effect induced by YSZ support, which helps to decrease the particle size of Co3O4 oxides and promotes the reducibility and oxygen mobility of Co3O4/YSZ catalyst. Otherwise, the higher concentration of Co2+ species and the presence of oxygen vacancies (including Oads and nonstoichiometric zirconia contribution) on the catalyst surface of Co3O4/YSZ (XPS measurements), which can participate in the reaction mechanism for oxidation of toluene, seem to improve the oxygen activation and the catalytic redox cycle and, as a consequence, the catalytic performance of this catalyst. Although the Co2+ concentration on the surface of Co3O4/TiO2 was also slightly higher than that on bulk Co3O4, the strong interaction between Co3O4 and TiO2 lead to a worse reducibility, which is unfavorable for toluene oxidation on this catalyst. Note that the coating effect can also be reason of a lower catalytic activity (less available active sites for VOC activation and oxidation). Moreover, the presence of oxygen vacancies on YSZ seems to promote the oxygen adsorption and oxygen mobility from YSZ toward the support surface, as it was early mentioned, which became highly reactive [27,52]. TPOIE experiments were carried out to better understanding of the phenomena. Nevertheless, further studies are needed to understand exactly the reaction mechanism. For this purpose, in our next study, in-situ DRIFTS experiments using labelled oxygen and kinetics modellings will be implemented. The toluene oxidation reaction rates of bulk and supported catalysts, which were calculated at 275 °C, confirmed the above-mentioned conclusions, Table 3. As expected, the supported Co3O4/YSZ catalyst exhibited the largest reaction rate (20.1 × 10−8 mol g-1 s-1) comparing to that of bulk Co3O4 and Co3O4/TiO2 catalysts (12.3 × 10−8 and 0.2 × 10−8 mol g-1 s-1, respectively). The Arrhenius plots for bulk Co3O4 and supported Co3O4 catalysts at less the 10% of toluene conversion are depicted in Fig. S2. The apparent activation energies (Ea) and pre-exponential factors (A) were consequently calculated from the slops of the lines and their intercepts, respectively, Table 3. The most active catalyst, Co3O4/YSZ, showed an Ea value of 191 kJ mol-1, which was similar compared with value reported in the literature for Co−CO3-3 T catalyst [53] and higher than that of Co3O4 sample S-160 [38]. The pre-exponential factors increased as the activation energies did. This unusual phenomenon could be explained by a compensation effect, as reported in the literature [40]. The catalytic stability was also evaluated by performing three consecutive catalytic runs of toluene oxidation for each catalyst. As shown in Fig. S3 (cooling ramps), reproducible results were obtained for toluene oxidation during the three consecutive runs. No appreciable deactivation was detected after three runs. Moreover, the catalytic stability in long-term test was also evaluated over Co3O4/YSZ and Co3O4/TiO2 supported catalysts for 50 h. The corresponding profiles of toluene conversion as a function of time on stream are illustrated in Fig. 6 . It could be observed that Co3O4/YSZ and Co3O4/TiO2 catalysts could exhibit a good catalytic durability at 280 and 365 °C, respectively. Co3O4/YSZ showed approximately 70% toluene conversion at the beginning and the conversion stayed very stable for 50 h, suggesting its potential in the practical application. Nevertheless, further experiments should be performed to verify the catalyst efficiency under real gas streams, including the presence of water vapor in the feed stream. Temperature-programmed oxygen isotopic exchange (TPOIE) experiments were performed to better understand the catalytic results and to determine the oxygen activation and mobility over bulk Co3O4, Co3O4/YSZ and Co3O4/TiO2 catalysts. The isotopic distribution as well as the evolution of the 18O atomic fraction (αg) are presented as a function of the temperature in Fig. 7 . One can clearly see that the distribution and the temperature of exchange depend on the sample. Over bulk Co3O4 (Fig. 7A), the exchange activity started slightly below 300 °C with the appearance of 16O2 (P32) but the formation of 16O18O (P34) became rapidly predominant indicating the preponderance of the simple mechanism of the heterolytic exchange (18O2 (gaz) + 16O (s) = 16O18O (gaz) + 18O (s)). Over Co3O4/YSZ (Fig. 7B), the oxygen exchange was shifted to lower temperatures with a quick increase of the 16O2 formation from 250 °C. The formation of 16O2 on Co3O4/YSZ catalyst could be due to two successive single atom exchange mechanisms over Co3O4 and YSZ as it was previously observed over a dual bed composed of LaMnO3 and YSZ [33]. Contrary to the YSZ support, it can be seen on Fig. 7C that the TiO2 support inhibited the oxygen exchange activity with a very slow evolution of the isotopic distribution from 400 °C. The comparison is made easier with Fig. 8 in which the number of exchanged atoms (Ne) were reported for the three samples as a function of temperature. As shown in Fig. 8, the oxygen exchange of the bulk Co3O4 catalyst started at around 290 °C to reach Ne = 13.9*1020 at. g−1 at 500 °C, while the profile of Co3O4 supported on YSZ showed that oxygen exchange occurred at a lower temperature (around 250 °C) compared to that of bulk Co3O4 catalyst. Moreover, a strong increase of Ne value (43.9*1020 at. g−1 at 500 °C) for YSZ supported catalyst was obtained, which evidenced a beneficial effect due to the ionic conducting support. Contrary to Co3O4/YSZ catalyst, the oxygen exchange of Co3O4/TiO2 catalyst is delayed compared with single Co3O4 with a decrease of Ne value (10.2*1020 at. g−1 at 500ºC). Moreover, Co3O4/YSZ catalyst showed a plateau at about 400 °C, which corresponds to an equilibrium of 18O concentration between the solid and the gas phase, whereas this temperature seems to be the beginning of Co3O4/TiO2 catalyst exchange. The numbers of exchanged O atoms at 400 °C are compared in Table 4 , where it can be seen that the exchange fraction for Co3O4/YSZ catalyst corresponded to 43.3% of the total number of O atoms in the solid taking into account both Co3O4 and YSZ oxides. It is worth noting that bare TiO2 and YSZ are not able to exchange lattice O atom at 400 °C. At this temperature, only 6.2 and 0.8% of O atoms are exchanged in Co3O4 and Co3O4/TiO2 respectively. In order to highlight the synergistic effect observed for Co3O4/YSZ and the inhibiting effect in the case of Co3O4/TiO2, the mechanical mixtures was also studied (Fig. S4 and Table 4). The mechanical mixture (Co3O4+YSZ, Fig. S4A) has an intermediate behavior in between Co3O4 and Co3O4/YSZ with 18.0*1020 at. g−1 at 400 °C. It demonstrated that the interaction between Co3O4 and YSZ on Co3O4/YSZ catalyst was better than the contact obtained with a mechanical mixture to promote the activation and diffusion of oxygen. It was well known that the oxygen activation on the YSZ surface as well as their activity in catalytic oxidation started at a moderate temperature (around 500 °C). Then, it was demonstrated that the Co3O4 activated the O2 molecule on the YSZ oxygen vacancy sites, resulting in a significant increase of the oxidation rate of toluene oxidation. The curve observed for the mechanical mixture Co3O4 + TiO2 (Fig. S4B) was close to the curve monitored for single Co3O4 with the same fraction of exchanged atoms at 400 °C (6.2 and 6.3% for Co3O4 and Co3O4 + TiO2, respectively). This inhibiting effect is therefore specific of the TiO2-supported Co3O4 catalyst. This fact could be attributed to the strong adsorption of cobalt oxides on the lattice oxygen of TiO2 as well as to the support coating effect, avoiding the ability to oxygen exchange. This behavior could also explain the high reduction temperature needed to reduce the cobalt species previously archived by H2-TPR experiment (Fig. 3). Thus, the decrease of toluene oxidation efficiency of Co3O4/TiO2 supported catalyst (Fig. 5) could be related to the decrease of reducibility and oxygen mobility induced by the partial coating of the cobalt oxide by titanium oxide, which can block some of the active cobalt sites reflecting in a lower activity. Finally, a comparison between the catalytic performance of Co3O4/YSZ catalyst and those of supported Co3O4 or noble metal catalysts that have been reported in the literatures is displayed in Table 5 . The performance of Co3O4/YSZ was better than 15 wt.% Co/γ-Al2O3[54], Co3O4/ZSM-5 [46], Co3O4/SBA-15 [46] and Au/TiO2[46], similar to those of Co3O4/Beta [46] and Pd/SBA-15 [46] catalysts and worse than that of the Co3O4/CNTs-120 [46], Au/CeO2[25] and Pt/TiNT [55] catalysts. 4 Conclusions The synergistic effect between spinel Co3O4 oxides and YSZ or TiO2 supports on total oxidation of toluene was evaluated. For this propose, bulk Co3O4 and Co3O4 supported catalysts were synthetized by one-step hydrothermal preparation method. Obtained results showed that both physicochemical and catalytic properties were significantly modified by the support. Co3O4 oxides appeared to interact with TiO2 and YSZ. These interactions affected the toluene catalytic activity in a positive way for the Co3O4/YSZ catalyst, while TiO2 catalyst showed an opposite effect, even worse to that of the bulk Co3O4 catalyst. The low-temperature reducibility, oxygen activation and mobility of Co3O4/YSZ catalyst were promoted by the synergy combination of Co3O4 phase and YSZ support, according to H2-TPR and isotopic exchange measurements. Indeed, the Co3O4 phase seems to activate the O2 molecule on YSZ oxygen vacancy sites, resulting in a significant increase of the oxidation rate of toluene oxidation. On the contrary, the strong adsorption of Co3O4 on the TiO2 support and/or the possible coating effect seem to decrease the catalyst reducibility and avoid the ability to oxygen activation and mobility. Moreover, the synergistic effect induced by YSZ support was corroborated by testing a dual catalyst bed system consisting of bulk Co3O4 catalyst and YSZ support beds. The expected additive effect of said was lower than that of Co3O4 oxides and YSZ support working in intimate combination. CRediT authorship contribution statement Guangtao Chai: Validation, Formal analysis, Investigation, Data curation, Writing - original draft, Writing - review & editing, Visualization. Dan Du: Validation, Formal analysis, Data curation. Chao Wang: Conceptualization, Methodology, Investigation, Writing - review & editing, Funding acquisition. Chuanhui Zhang: Methodology, Formal analysis. Luis Cardenas: Methodology, Data curation. Nicolas Bion: Methodology, Data curation, Formal analysis. Yanglong Guo: Validation, Writing - review & editing, Supervision, Funding acquisition. Sonia Gil: Validation, Formal analysis, Data curation, Writing - review & editing, Visualization, Supervision, Project administration. Anne Giroir-Fendler: Validation, Supervision, Funding acquisition. Declaration of Competing Interest The authors report no declarations of interest. Acknowledgements This work was financially supported by the National Key Research and Development Program of China (2016YFC0204300), the National Natural Science Foundation of China (21577035, 21922602, 21607163), the Natural Science Foundation of Shandong Province (ZR2020QB139), and the Fundamental Research Funds for the Central Universities (222201717003). The contribution of Qingdao University of Science and Technology, Yankuang Technology Co. Ltd, and the China Scholarship Council and the Institute de Recherches sur la Catalyse et l’Environnement de Lyon (IRCELYON), Centre National de la Recherche Scientifique (CNRS) and Université Claude Bernard Lyon 1 (UCBL1) are also acknowledged. Appendix A Supplementary data Supplementary material related to this article can be found, in the online version, at doi:https://doi.org/10.1016/j.apcata.2021.118044. Appendix A Supplementary data The following is Supplementary data to this article: References [1] Z. Zhang Z. Jiang W. Shangguan Catal. Today 264 2016 270 278 Z. Zhang, Z. Jiang, W. Shangguan, Low-temperature catalysis for VOCs removal in technology and application: a state-of-the-art review, Catal. Today 264 (2016) 270–278. [2] C. He J. Cheng X. Zhang M. Douthwaite S. Pattisson Z. Hao Chem. Rev. 119 2019 4471 4568 C. He, J. Cheng, X. Zhang, M. Douthwaite, S. Pattisson, Z. Hao, Chem. Recent advances in the catalytic oxidation of volatile organic compounds: a review based on pollutant sorts and sources, Rev. 119 (2019) 4471–4568. [3] C. Zhang Y. Wang G. Li L. Chen Q. Zhang D. Wang X. Li Z. Wang Appl. Surf. Sci. 532 2020 147320 C. Zhang, Y. Wang, G. Li, L. Chen, Q. Zhang, D. Wang, X. Li, Z. Wang, Tuning smaller Co3O4 nanoparticles onto HZSM-5 zeolite via complexing agents for boosting toluene oxidation performance, Appl. Surf. Sci. 532 (2020) 147320. [4] J. Li Z. Li F. Ning L. Zhou R. Zhang M. Shao M. Wei ACS Omega 3 2018 1675 1683 J. Li, Z. Li, F. Ning, L. Zhou, R. Zhang, M. Shao, M. Wei, Ultrathin mesoporous Co3O4 nanosheet arrays for high-performance lithium-ion batteries, ACS Omega 3 (2018) 1675-1683. [5] J. Cao S. Wang X. Zhao Y. Xing J. Li D. Li Mater. Lett. 263 2020 127215 J. Cao, S. Wang, X. Zhao, Y. Xing, J. Li, D. Li, Facile synthesis and enhanced toluene gas sensing performances of Co3O4 hollow nanosheets, Mater. Lett. 263 (2020) 127215. [6] Z. Xiao L. Fan B. Xu S. Zhang W. Kang Z. Kang H. Lin X. Liu S. Zhang D. Sun ACS Appl. Mater. Interfaces 9 2017 41827 41836 Z. Xiao, L. Fan, B. Xu, S. Zhang, W. Kang, Z. Kang, H. Lin, X. Liu, S. Zhang, D. Sun, Green fabrication of ultrathin Co3O4 nanosheets from metal-organic framework for robust high-rate supercapacitors, ACS Appl. Mater. Interfaces 9 (2017) 41827-41836. [7] Z. Liu W. Zhou S. Wang W. Du H. Zhang C. Ding Y. Du L. Zhu J. Alloys. Compd. 774 2019 137 144 Z. Liu, W. Zhou, S. Wang, W. Du, H. Zhang, C. Ding, Y. Du, L. Zhu, Facile synthesis of homogeneous core-shell Co3O4 mesoporous nanospheres as high performance electrode materials for supercapacitor, J. Alloys Compd. 774 (2019) 137-144. [8] Y.P. Zhu T.Y. Ma M. Jaroniec S.Z. Qiao Angew. Chem. Int. Ed. 56 2017 1324 1328 Y.P. Zhu, T.Y. Ma, M. Jaroniec, S.Z. Qiao, Self-templating synthesis of hollow Co3O4 microtube arrays for highly efficient water electrolysis, Angew. Chem., Int. Ed. 56 (2017) 1324-1328. [9] Z. Shang M. Sun S. Chang X. Che X. Cao L. Wang Y. Guo W. Zhan Y. Guo G. Lu Appl. Catal. B 209 2017 33 44 Z. Shang, M. Sun, S. Chang, X. Che, X. Cao, L. Wang, Y. Guo, W. Zhan, Y. Guo, G. Lu, Activity and stability of Co3O4-based catalysts for soot oxidation: the enhanced effect of Bi2O3 on activation and transfer of oxygen, Appl. Catal., B 209 (2017) 33-44. [10] Y. Du W. Huang Z. Hua Y. Wang X. Cui M. Wu Z. Shu L. Zhang J. Wang H. Chen J. Shi Catal. Commun. 57 2014 73 77 Y. Du, W. Huang, Z. Hua, Y. Wang, X. Cui, M. Wu, Z. Shu, L. Zhang, J. Wang, H. Chen, J. Shi, A facile ultrasonic process for the preparation of Co3O4 nanoflowers for room-temperature removal of low-concentration NOx, Catal. Commun. 57 (2014) 73-77. [11] L. Macheli A. Roy E. Carleschi R.P. Doyle E.V. Steen Catal. Today 343 2020 176 182 L. Macheli, A. Roy, E. Carleschi, R.P. Doyle, E.V. Steen, Surface modification of Co3O4 nanocubes with TEOS for an improved performance in the Fischer-Tropsch synthesis, Catal. Today 343 (2020) 176-182. [12] Z. Zhu G. Lu Z. Zhang Y. Guo Y. Guo Y. Wang ACS Catal. 2 2013 1154 1164 Z. Zhu, G. Lu, Z. Zhang, Y. Guo, Y. Guo, Y. Wang, Highly active and stable Co3O4/ZSM-5 catalyst for propane oxidation: effect of the preparation method, ACS Catal. 2 (2013) 1154-1164. [13] L. Dai Q. Qin X. Zhao C. Xu C. Hu S. Mo Y.O. Wang S. Lin Z. Tang N. Zheng ACS Cent. Sci. 2 2016 538 544 L. Dai, Q. Qin, X. Zhao, C. Xu, C. Hu, S. Mo, Y.O. Wang, S. Lin, Z. Tang, N. Zheng, Electrochemical partial reforming of ethanol into ethyl acetate using ultrathin Co3O4 nanosheets as a highly selective anode catalyst, ACS Cent. Sci. 2 (2016) 538-544. [14] B. Bai H. Arandiyan J. Li Appl. Catal. B 142-143 2013 677 683 B. Bai, H. Arandiyan, J. Li, Comparison of the performance for oxidation of formaldehyde on nano-Co3O4, 2D-Co3O4, and 3D-Co3O4 catalysts, Appl. Catal., B 142-143 (2013) 677-683. [15] Y. Zhang F. Ding C. Deng S. Zhen X. Li Y. Xue Y.-M. Yan K. Sun Catal. Commun. 67 2015 78 82 Y. Zhang, F. Ding, C. Deng, S. Zhen, X. Li, Y. Xue, Y.-M. Yan, K. Sun, Crystal plane-dependent electrocatalytic activity of Co3O4 toward oxygen evolution reaction, Catal. Commun. 67 (2015) 78-82. [16] G. Li C. Zhang Z. Wang H. Huang H. Peng X. Li Appl. Catal. A 550 2018 67 76 G. Li, C. Zhang, Z. Wang, H. Huang, H. Peng, X. Li, Fabrication of mesoporous Co3O4 oxides by acid treatment and their catalytic performance for toluene oxidation, Appl. Catal., A 550 (2018) 67-76. [17] L. Hu K. Sun Q. Peng B. Xu Y. Li Nano Res. 3 2010 363 368 L. Hu, K. Sun, Q. Peng, B. Xu, Y. Li, Surface active sites on Co3O4 nanobelt and nanocube model catalysts for CO oxidation, Nano Res. 3 (2010) 363-368. [18] L. Hu Q. Peng Y. Li J. Am. Chem. Soc. 130 2008 16136 16137 L. Hu, Q. Peng, Y. Li, Selective synthesis of Co3O4 nanocrystal with different shape and crystal plane effect on catalytic property for methane combustion, J. Am. Chem. Soc. 130 (2008) 16136-16137. [19] J. González-Prior R. López-Fonseca J.I. Gutiérrez-Ortiz B. de Rivas Appl. Catal. B 199 2016 384 393 J. González-Prior, R. López-Fonseca, J.I. Gutiérrez-Ortiz, B. de Rivas, Oxidation of 1,2-dichloroethane over nanocube-shaped Co3O4 catalysts, Appl. Catal., B 199 (2016) 384-393. [20] W. Zhang F. Wu J. Li Z. You Appl. Surf. Sci. 411 2017 136 143 W. Zhang, F. Wu, J. Li, Z. You, Dispersion-precipitation synthesis of highly active nanosized Co3O4 for catalytic oxidation of carbon monoxide and propane, Appl. Surf. Sci. 411 (2017) 136-143. [21] L.F. Liotta H. Wu G. Pantaleo A.M. Venezia Catal. Sci. Technol. 3 2013 3085 3102 L.F. Liotta, H. Wu, G. Pantaleo, A.M. Venezia, Co3O4 nanocrystals and Co3O4-MOx binary oxides for CO, CH4 and VOC oxidation at low temperatures: a review, Catal. Sci. Technol. 3 (2013) 3085-3102. [22] B. de Rivas R. López-Fonseca C. Jiménez-González J.I. Gutiérrez-Ortiz Chem. Eng. J. 184 2012 184 192 B. de Rivas, R. López-Fonseca, C. Jiménez-González, J.I. Gutiérrez-Ortiz, Highly active behavior of nanocrystalline Co3O4 from oxalate nanorods in the oxidation of chlorinated short chain alkanes, Chem. Eng. J. 184 (2012) 184-192. [23] C. Wang W. Hua G. Chai C. Zhang Y. Guo Catalysts 9 2019 408 416 C. Wang, W. Hua, G. Chai, C. Zhang, Y. Guo, Insights into the morphological effect of Co3O4 crystallite on catalytic oxidation of vinyl chloride, Catalysts 9 (2019) 408-416. [24] Beck G. Magesh B. Kuppan Z. Schay O. Geszti T. Benkó R.P. Viswanath P. Selvam B. Viswanathan L. Guczi Catal. Today 164 2011 325 331 Beck, G. Magesh, B. Kuppan, Z. Schay, O. Geszti, T. Benkó, R.P. Viswanath, P. Selvam, B. Viswanathan, L. Guczi, Specific role of polymorphs of supporting titania in catalytic CO oxidation on gold, Catal. Today 164 (2011) 325-331. [25] M. Ousmane L.F. Liotta G.Di Carlo G. Pantaleo A.M. Venezia G. Deganello L. Retailleau A. Boreave A. Giroir-Fendler Appl. Catal. B 101 2011 629 637 M. Ousmane, L.F. Liotta, G.Di Carlo, G. Pantaleo, A.M. Venezia, G. Deganello, L. Retailleau, A. Boreave, A. Giroir-Fendler, Supported Au catalysts for low-temperature abatement of propene and toluene, as model VOCs: support effect, Appl. Catal., B 101 (2011) 629-637. [26] C. Wang C. Zhang W. Hua Y. Guo G. Lu S. Gil A. Giroir-Fendler RSC Adv. 6 2016 99577 99585 C. Wang, C. Zhang, W. Hua, Y. Guo, G. Lu, S. Gil, A. Giroir-Fendler, Low-temperature catalytic oxidation of vinyl chloride over Ru modified Co3O4 catalysts, RSC Adv. 6 (2016) 99577-99585. [27] A. Giroir-Fendler M. Alves-Fortunato M. Richard C. Wang J.A. Díaz S. Gil C. Zhang F. Can N. Bion Y. Guo Appl. Catal. B 180 2016 29 37 A. Giroir-Fendler, M. Alves-Fortunato, M. Richard, C. Wang, J.A. Díaz, S. Gil, C. Zhang, F. Can, N. Bion, Y. Guo, Synthesis of oxide supported LaMnO3 perovskites to enhance yields in toluene combustion, Appl. Catal., B 180 (2016) 29-37. [28] Q. Huang X. Xue R. Zhou J. Hazard. Mater. 183 2010 694 700 Q. Huang, X. Xue, R. Zhou, Decomposition of 1,2-dichloroethane over CeO2 modified USY zeolite catalysts: effect of acidity and redox property on the catalytic behavior, J. Hazard. Mater. 183 (2010) 694-700. [29] C. Wang C. Zhang W. Hua Y. Guo G. Lu S. Gil A. Giroir-Fendler Chem. Eng. J. 315 2017 392 402 C. Wang, C. Zhang, W. Hua, Y. Guo, G. Lu, S. Gil, A. Giroir-Fendler, Catalytic oxidation of vinyl chloride emissions over Co-Ce composite oxide catalysts, Chem. Eng. J. 315 (2017) 392-402. [30] X. Xiao X. Liu H. Zhao D. Chen F. Liu J. Xiang Z. Hu Y. Li Adv. Mater. 24 2012 5762 5766 X. Xiao, X. Liu, H. Zhao, D. Chen, F. Liu, J. Xiang, Z. Hu, Y. Li, Facile shape control of Co3O4 and the effect of the crystal plane on electrochemical performance, Adv. Mater. 24 (2012) 5762-5766. [31] S. Xia M. Yu J. Hu J. Feng J. Chen M. Shi X. Weng Electrochem. Commun. 40 2014 67 70 S. Xia, M. Yu, J. Hu, J. Feng, J. Chen, M. Shi, X. Weng, A model of interface-related enhancement based on the contrast between Co3O4 sphere and cube for electrochemical detection of hydrogen peroxide, Electrochem. Commun. 40 (2014) 67-70. [32] S. Ojala N. Bion S. Rijo Gomes R.L. Keiski D. Duprez ChemCatChem 2 2010 527 533 S. Ojala, N. Bion, S. Rijo Gomes, R.L. Keiski, D. Duprez, Isotopic oxygen exchange over Pd/Al2O3 Catalyst: Study on C18O2 and 18O2 exchange, ChemCatChem 2 (2010) 527-533. [33] M. Richard F. Can D. Duprez S. Gil A. Giroir-Fendler N. Bion Angew. Chem. Int. Ed. 53 2014 11342 11345 M. Richard, F. Can, D. Duprez, S. Gil, A. Giroir-Fendler, N. Bion, Remarkable enhancement of O2 activation on yttrium-stabilized zirconia surface in a dual catalyst bed, Angew. Chem. Int. Ed. 53 (2014) 11342-11345. [34] D. Martin D. Duprez J. Phys. Chem. 100 1996 9429 9438 D. Martin, D. Duprez, Mobility of surface species on oxides. 1. isotopic exchange of 18O2 with 16O of SiO2, Al2O3, ZrO2, MgO, CeO2, and CeO2-Al2O3. activation by noble metals. correlation with oxide basicity, J. Phys. Chem. 100 (1996) 9429-9438. [35] N. Fang Y. Ding C. Liu Z. Chen Ceram. Int. 44 2018 12363 12369 N. Fang, Y. Ding, C. Liu, Z. Chen, Role of SiO2 in synthesis of SiO2-supported CeO2 composites, Ceram. Int. 44 (2018) 12363-12369. [36] R.K. Grasselli Top. Catal. 21 2002 79 88 R.K. Grasselli, Fundamental principles of selective heterogeneous oxidation catalysis, Top. Catal. 21 (2002) 79-88. [37] Q. Ren S. Mo R. Peng Z. Feng M. Zhang L. Chen M. Fu J. Wu D. Ye J. Mater. Chem. A 6 2018 498 509 Q. Ren, S. Mo, R. Peng, Z. Feng, M. Zhang, L. Chen, M. Fu, J. Wu, D. Ye, Controllable synthesis of 3D hierarchical Co3O4 nanocatalysts with various morphologies for the catalytic oxidation of toluene, J. Mater. Chem. A 6 (2018) 498-509. [38] W. Liu R. Liu X. Zhang Appl. Surf. Sci. 507 2020 145174 W. Liu, R. Liu, X. Zhang, Controllable synthesis of 3D hierarchical Co3O4 catalysts and their excellent catalytic performance for toluene combustion, Appl. Surf. Sci. 507 (2020) 145174. [39] P. Mars D.W. van Krevelen Chem. Eng. Sci. 3 1954 41 59 P. Mars, D.W. van Krevelen, Oxidations carried out by means of vanadium oxide catalysts, Chem. Eng. Sci. 3 (1954) 41-59. [40] W. Zhang J. Díez-Ramírez P. Anguita C. Descorme J.L. Valverde A. Giroir-Fendler Appl. Catal. B 273 2020 118894 W. Zhang, J. Díez-Ramírez, P. Anguita, C. Descorme, J.L. Valverde, A. Giroir-Fendler, Nanocrystalline Co3O4 catalysts for toluene and propane oxidation: effect of the precipitation agent, Appl. Catal., B 273 (2020) 118894. [41] F. Wyrwalski J.-F. Lamonier S. Siffert A. Aboukaïs Appl. Catal. B 70 2007 393 399 F. Wyrwalski, J.-F. Lamonier, S. Siffert, A. Aboukaïs, Additional effects of cobalt precursor and zirconia support modifications for the design of efficient VOC oxidation catalysts, Appl. Catal., B 70 (2007) 393-399. [42] B. Jongsomjit C. Sakdamnuson J.G. Goodwin Jr. P. Praserthdam Catal. Letters 94 2004 209 215 B. Jongsomjit, C. Sakdamnuson, J. G. Goodwin Jr, P. Praserthdam, Co-support compound formation in titania-supported cobalt catalyst, Catal. Letters 94 (2004) 209-215. [43] C.B. Wang C.W. Tang H.C. Tsai S.H. Chien Catal. Letters 107 2006 223 230 C.B. Wang, C.W. Tang, H.C. Tsai, S.H. Chien, Characterization and catalytic oxidation of carbon monoxide over supported cobalt catalysts, Catal. Letters 107 (2006) 223-230. [44] W. Zhang F. Pan J. Li Z. Wang W. Ding Y. Qin F. Wu Appl. Surf. Sci. 442 2018 83 91 W. Zhang, F. Pan, J. Li, Z. Wang, W. Ding, Y. Qin, F. Wu, Surface-complexation synthesis of silica-supported high-loading well-dispersed reducible nano-Co3O4 catalysts using CoⅢ ammine hydroxo complexes, Appl. Surf. Sci. 442 (2018) 83-91. [45] S. Royer D. Duprez S. Kaliaguine J. Catal. 234 2005 364 375 S. Royer, D. Duprez, S. Kaliaguine, Role of bulk and grain boundary oxygen mobility in the catalytic oxidation activity of LaCo1-xFexO3, J. Catal. 234 (2005) 364-375. [46] S. Jiang S. Song Appl. Catal. B 140-141 2013 1 8 S. Jiang, S. Song, Enhancing the performance of Co3O4/CNTs for the catalytic combustion of toluene by tuning the surface structures of CNTs, Appl. Catal., B 140-141 (2013) 1-8. [47] R. Bayati R. Molaei A. Richmond S. Nori F. Wu D. Kumar J. Narayan J.G. Reynolds C.L. Reynolds ACS Appl. Mater. Interfaces 6 2014 22316 22325 R. Bayati, R. Molaei, A. Richmond, S. Nori, F. Wu, D. Kumar, J. Narayan, J.G. Reynolds, C.L. Reynolds, Modification of properties of yttria stabilized zirconia epitaxial thin films by excimer laser annealing, ACS Appl. Mater. Interfaces 6 (2014) 22316-22325. [48] M. Labaki S. Siffert J.-F. Lamonier E.A. Zhilinskaya A. Aboukaïs Appl. Catal. B 43 2003 261 271 M. Labaki, S. Siffert, J.-F. Lamonier, E.A. Zhilinskaya, A. Aboukaïs, Total oxidation of propene and toluene in the presence of zirconia doped by copper and yttrium: role of anionic vacancies, Appl. Catal., B 43 (2003) 261-271. [49] P.M. Shah J.W.H. Burnett D.J. Morgan T.E. Davies S.H. Taylor Catalysts 9 2019 475 P.M. Shah, J.W.H. Burnett, D.J. Morgan, T.E. Davies, S.H. Taylor, Ceria-zirconia mixed metal oxides prepared via mechanochemical grinding of carbonates for the total oxidation of propane and naphthalene, Catalysts 9 (2019) 475. [50] M.A. Fortunato D. Aubert C. Capdeillayre C. Daniel A. Hadjar A. Princivalle C. Guizard P. Vernoux Appl. Catal. A 403 2011 18 24 M.A. Fortunato, D. Aubert, C. Capdeillayre, C. Daniel, A. Hadjar, A. Princivalle, C. Guizard, P. Vernoux, Dispersion measurement of platinum supported on yttria-stabilised zirconia by pulse H2 chemisorption, Appl. Catal., A 403 (2011) 18-24. [51] Y. Fang L. Li J. Yang S. Hoang L. Wang J. Xu W. Yang C. Pan Y. Zhu H. Deng Z. Luo C. Sun D. Gao Z. Li Y. Guo Environ. Sci. Technol. 54 2020 15476 15488 Y. Fang, L. Li, J. Yang, S. Hoang, L. Wang, J. Xu, W. Yang, C. Pan, Y. Zhu, H. Deng, Z. Luo, C. Sun, D. Gao, Z. Li, Y. Guo, Engineering the nucleophilic active oxygen species in CuTiOx for efficient low-temperature propene combustion, Environ. Sci. Technol. 54 (2020) 15476-15488. [52] M.A. Fortunato D. Aubert C. Capdeillayre C. Daniel A. Hadjar A. Princivalle C. Guizard P. Vernoux Appl. Catal. A 403 2011 18 24 M.A. Fortunato, D. Aubert, C. Capdeillayre, C. Daniel, A. Hadjar, A. Princivalle, C. Guizard, P. Vernoux, Dispersion measurement of platinum supported on yttria-stabilised zirconia by pulse H2 chemisorption, Appl. Catal., A 403 (2011) 18-24. [53] G. Chai W. Zhang Y. Guo J.L. Valverde A. Giroir-Fendler Catalysts 10 2020 867 G. Chai, W. Zhang, Y. Guo, J.L. Valverde, A. Giroir-Fendler, The influence of residual sodium on the catalytic oxidation of propane and toluene over Co3O4 catalysts, Catalysts 10 (2020) 867. [54] S.C. Kim J. Hazard. Mater. 91 2002 285 299 S.C. Kim, The catalytic oxidation of aromatic hydrocarbons over supported metal oxide, J. Hazard. Mater. 91 (2002) 285-299. [55] Z. Rui M. Tang W. Ji J. Ding H. Ji Catal. Today 297 2017 159 166 Z. Rui, M. Tang, W. Ji, J. Ding, H. Ji, Insight into the enhanced performance of TiO2 nanotube supported Pt catalyst for toluene oxidation, Catal. Today 297 (2017) 159-166.",
      "scopus-id": "85101750056",
      "coredata": {
        "eid": "1-s2.0-S0926860X21000582",
        "dc:description": "Bulk spinel Co3O4 oxide and supported Co3O4 catalysts (Co3O4/YSZ and Co3O4/TiO2) were synthesized by one-step hydrothermal method. Their physicochemical properties were characterized by inductively coupled plasma optical emission spectroscopy, N2-sorption, powder X-ray diffraction, scanning electron microscopy, transmission electron microscopy, hydrogen-temperature programmed reduction and X-ray photoelectron spectroscopy.These characterization strategies were applied to corroborate and better understand the interaction between Co3O4 and the supports induced by the synergistic effect of support and the subsequent catalytic performance in toluene oxidation. The catalytic stability was evaluated by three consecutive runs and a long-term test. A highest toluene catalytic activity was achieved over Co3O4/YSZ supported catalyst comparing to that of the bulk Co3O4 and Co3O4/TiO2 catalysts, which could be attributed to its better low-temperature reducibility, oxygen activation and mobility induced by the intrinsic support properties. Thus, the positive interaction between spinel Co3O4 phase and YSZ support promoted the intrinsic catalytic properties for toluene oxidation, which was verify by testing a dual catalyst bed system consisting of bulk Co3O4 catalyst and YSZ support beds. These results were further confirmed by temperature-programmed oxygen isotopic exchange experiments, which indicated that the activation and diffusion of oxygen species on the YSZ oxygen vacancy sites were promoted by Co3O4, resulting in a significant increase of the reaction rate for toluene oxidation.",
        "openArchiveArticle": "false",
        "prism:coverDate": "2021-03-25",
        "openaccessUserLicense": null,
        "prism:aggregationType": "Journal",
        "prism:url": "https://api.elsevier.com/content/article/pii/S0926860X21000582",
        "dc:creator": [
          {
            "@_fa": "true",
            "$": "Chai, Guangtao"
          },
          {
            "@_fa": "true",
            "$": "Du, Dan"
          },
          {
            "@_fa": "true",
            "$": "Wang, Chao"
          },
          {
            "@_fa": "true",
            "$": "Zhang, Chuanhui"
          },
          {
            "@_fa": "true",
            "$": "Cardenas, Luis"
          },
          {
            "@_fa": "true",
            "$": "Bion, Nicolas"
          },
          {
            "@_fa": "true",
            "$": "Guo, Yanglong"
          },
          {
            "@_fa": "true",
            "$": "Gil, Sonia"
          },
          {
            "@_fa": "true",
            "$": "Giroir-Fendler, Anne"
          }
        ],
        "link": [
          {
            "@_fa": "true",
            "@rel": "self",
            "@href": "https://api.elsevier.com/content/article/pii/S0926860X21000582"
          },
          {
            "@_fa": "true",
            "@rel": "scidir",
            "@href": "https://www.sciencedirect.com/science/article/pii/S0926860X21000582"
          }
        ],
        "dc:format": "application/json",
        "openaccessType": null,
        "pii": "S0926-860X(21)00058-2",
        "prism:volume": "614",
        "articleNumber": "118044",
        "prism:publisher": "Elsevier B.V.",
        "dc:title": "Spinel Co3O4 oxides-support synergistic effect on catalytic oxidation of toluene",
        "prism:copyright": "© 2021 Elsevier B.V. All rights reserved.",
        "openaccess": "0",
        "prism:issn": "0926860X",
        "dcterms:subject": [
          {
            "@_fa": "true",
            "$": "Bulk Co3O4"
          },
          {
            "@_fa": "true",
            "$": "Synergistic effect of support"
          },
          {
            "@_fa": "true",
            "$": "TiO2"
          },
          {
            "@_fa": "true",
            "$": "YSZ"
          },
          {
            "@_fa": "true",
            "$": "Toluene"
          },
          {
            "@_fa": "true",
            "$": "Oxidation"
          },
          {
            "@_fa": "true",
            "$": "Isotopic exchange"
          }
        ],
        "openaccessArticle": "false",
        "prism:publicationName": "Applied Catalysis A: General",
        "openaccessSponsorType": null,
        "prism:pageRange": "118044",
        "pubType": "fla",
        "prism:coverDisplayDate": "25 March 2021",
        "prism:doi": "10.1016/j.apcata.2021.118044",
        "prism:startingPage": "118044",
        "dc:identifier": "doi:10.1016/j.apcata.2021.118044",
        "openaccessSponsorName": null
      },
      "objects": {
        "object": [
          {
            "@category": "standard",
            "@height": "550",
            "@width": "565",
            "@_fa": "true",
            "$": "https://api.elsevier.com/content/object/eid/1-s2.0-S0926860X21000582-gr2.jpg?httpAccept=%2A%2F%2A",
            "@multimediatype": "JPEG image file",
            "@type": "IMAGE-DOWNSAMPLED",
            "@size": "98794",
            "@ref": "gr2",
            "@mimetype": "image/jpeg"
          },
          {
            "@category": "standard",
            "@height": "200",
            "@width": "324",
            "@_fa": "true",
            "$": "https://api.elsevier.com/content/object/eid/1-s2.0-S0926860X21000582-ga1.jpg?httpAccept=%2A%2F%2A",
            "@multimediatype": "JPEG image file",
            "@type": "IMAGE-DOWNSAMPLED",
            "@size": "23095",
            "@ref": "ga1",
            "@mimetype": "image/jpeg"
          },
          {
            "@category": "standard",
            "@height": "493",
            "@width": "300",
            "@_fa": "true",
            "$": "https://api.elsevier.com/content/object/eid/1-s2.0-S0926860X21000582-gr1.jpg?httpAccept=%2A%2F%2A",
            "@multimediatype": "JPEG image file",
            "@type": "IMAGE-DOWNSAMPLED",
            "@size": "34539",
            "@ref": "gr1",
            "@mimetype": "image/jpeg"
          },
          {
            "@category": "standard",
            "@height": "349",
            "@width": "565",
            "@_fa": "true",
            "$": "https://api.elsevier.com/content/object/eid/1-s2.0-S0926860X21000582-gr4.jpg?httpAccept=%2A%2F%2A",
            "@multimediatype": "JPEG image file",
            "@type": "IMAGE-DOWNSAMPLED",
            "@size": "41811",
            "@ref": "gr4",
            "@mimetype": "image/jpeg"
          },
          {
            "@category": "standard",
            "@height": "259",
            "@width": "298",
            "@_fa": "true",
            "$": "https://api.elsevier.com/content/object/eid/1-s2.0-S0926860X21000582-gr3.jpg?httpAccept=%2A%2F%2A",
            "@multimediatype": "JPEG image file",
            "@type": "IMAGE-DOWNSAMPLED",
            "@size": "19304",
            "@ref": "gr3",
            "@mimetype": "image/jpeg"
          },
          {
            "@category": "standard",
            "@height": "229",
            "@width": "299",
            "@_fa": "true",
            "$": "https://api.elsevier.com/content/object/eid/1-s2.0-S0926860X21000582-gr6.jpg?httpAccept=%2A%2F%2A",
            "@multimediatype": "JPEG image file",
            "@type": "IMAGE-DOWNSAMPLED",
            "@size": "12685",
            "@ref": "gr6",
            "@mimetype": "image/jpeg"
          },
          {
            "@category": "standard",
            "@height": "225",
            "@width": "299",
            "@_fa": "true",
            "$": "https://api.elsevier.com/content/object/eid/1-s2.0-S0926860X21000582-gr5.jpg?httpAccept=%2A%2F%2A",
            "@multimediatype": "JPEG image file",
            "@type": "IMAGE-DOWNSAMPLED",
            "@size": "21894",
            "@ref": "gr5",
            "@mimetype": "image/jpeg"
          },
          {
            "@category": "standard",
            "@height": "225",
            "@width": "301",
            "@_fa": "true",
            "$": "https://api.elsevier.com/content/object/eid/1-s2.0-S0926860X21000582-gr8.jpg?httpAccept=%2A%2F%2A",
            "@multimediatype": "JPEG image file",
            "@type": "IMAGE-DOWNSAMPLED",
            "@size": "13988",
            "@ref": "gr8",
            "@mimetype": "image/jpeg"
          },
          {
            "@category": "standard",
            "@height": "601",
            "@width": "300",
            "@_fa": "true",
            "$": "https://api.elsevier.com/content/object/eid/1-s2.0-S0926860X21000582-gr7.jpg?httpAccept=%2A%2F%2A",
            "@multimediatype": "JPEG image file",
            "@type": "IMAGE-DOWNSAMPLED",
            "@size": "40014",
            "@ref": "gr7",
            "@mimetype": "image/jpeg"
          },
          {
            "@category": "thumbnail",
            "@height": "164",
            "@width": "168",
            "@_fa": "true",
            "$": "https://api.elsevier.com/content/object/eid/1-s2.0-S0926860X21000582-gr2.sml?httpAccept=%2A%2F%2A",
            "@multimediatype": "GIF image file",
            "@type": "IMAGE-THUMBNAIL",
            "@size": "17500",
            "@ref": "gr2",
            "@mimetype": "image/gif"
          },
          {
            "@category": "thumbnail",
            "@height": "135",
            "@width": "219",
            "@_fa": "true",
            "$": "https://api.elsevier.com/content/object/eid/1-s2.0-S0926860X21000582-ga1.sml?httpAccept=%2A%2F%2A",
            "@multimediatype": "GIF image file",
            "@type": "IMAGE-THUMBNAIL",
            "@size": "12595",
            "@ref": "ga1",
            "@mimetype": "image/gif"
          },
          {
            "@category": "thumbnail",
            "@height": "163",
            "@width": "99",
            "@_fa": "true",
            "$": "https://api.elsevier.com/content/object/eid/1-s2.0-S0926860X21000582-gr1.sml?httpAccept=%2A%2F%2A",
            "@multimediatype": "GIF image file",
            "@type": "IMAGE-THUMBNAIL",
            "@size": "5028",
            "@ref": "gr1",
            "@mimetype": "image/gif"
          },
          {
            "@category": "thumbnail",
            "@height": "135",
            "@width": "219",
            "@_fa": "true",
            "$": "https://api.elsevier.com/content/object/eid/1-s2.0-S0926860X21000582-gr4.sml?httpAccept=%2A%2F%2A",
            "@multimediatype": "GIF image file",
            "@type": "IMAGE-THUMBNAIL",
            "@size": "8655",
            "@ref": "gr4",
            "@mimetype": "image/gif"
          },
          {
            "@category": "thumbnail",
            "@height": "164",
            "@width": "189",
            "@_fa": "true",
            "$": "https://api.elsevier.com/content/object/eid/1-s2.0-S0926860X21000582-gr3.sml?httpAccept=%2A%2F%2A",
            "@multimediatype": "GIF image file",
            "@type": "IMAGE-THUMBNAIL",
            "@size": "7583",
            "@ref": "gr3",
            "@mimetype": "image/gif"
          },
          {
            "@category": "thumbnail",
            "@height": "164",
            "@width": "214",
            "@_fa": "true",
            "$": "https://api.elsevier.com/content/object/eid/1-s2.0-S0926860X21000582-gr6.sml?httpAccept=%2A%2F%2A",
            "@multimediatype": "GIF image file",
            "@type": "IMAGE-THUMBNAIL",
            "@size": "5691",
            "@ref": "gr6",
            "@mimetype": "image/gif"
          },
          {
            "@category": "thumbnail",
            "@height": "164",
            "@width": "217",
            "@_fa": "true",
            "$": "https://api.elsevier.com/content/object/eid/1-s2.0-S0926860X21000582-gr5.sml?httpAccept=%2A%2F%2A",
            "@multimediatype": "GIF image file",
            "@type": "IMAGE-THUMBNAIL",
            "@size": "10098",
            "@ref": "gr5",
            "@mimetype": "image/gif"
          },
          {
            "@category": "thumbnail",
            "@height": "163",
            "@width": "219",
            "@_fa": "true",
            "$": "https://api.elsevier.com/content/object/eid/1-s2.0-S0926860X21000582-gr8.sml?httpAccept=%2A%2F%2A",
            "@multimediatype": "GIF image file",
            "@type": "IMAGE-THUMBNAIL",
            "@size": "6144",
            "@ref": "gr8",
            "@mimetype": "image/gif"
          },
          {
            "@category": "thumbnail",
            "@height": "162",
            "@width": "81",
            "@_fa": "true",
            "$": "https://api.elsevier.com/content/object/eid/1-s2.0-S0926860X21000582-gr7.sml?httpAccept=%2A%2F%2A",
            "@multimediatype": "GIF image file",
            "@type": "IMAGE-THUMBNAIL",
            "@size": "4600",
            "@ref": "gr7",
            "@mimetype": "image/gif"
          },
          {
            "@category": "high",
            "@height": "2435",
            "@width": "2500",
            "@_fa": "true",
            "$": "https://api.elsevier.com/content/object/eid/1-s2.0-S0926860X21000582-gr2_lrg.jpg?httpAccept=%2A%2F%2A",
            "@multimediatype": "JPEG image file",
            "@type": "IMAGE-HIGH-RES",
            "@size": "1167070",
            "@ref": "gr2",
            "@mimetype": "image/jpeg"
          },
          {
            "@category": "high",
            "@height": "886",
            "@width": "1437",
            "@_fa": "true",
            "$": "https://api.elsevier.com/content/object/eid/1-s2.0-S0926860X21000582-ga1_lrg.jpg?httpAccept=%2A%2F%2A",
            "@multimediatype": "JPEG image file",
            "@type": "IMAGE-HIGH-RES",
            "@size": "186199",
            "@ref": "ga1",
            "@mimetype": "image/jpeg"
          },
          {
            "@category": "high",
            "@height": "2184",
            "@width": "1329",
            "@_fa": "true",
            "$": "https://api.elsevier.com/content/object/eid/1-s2.0-S0926860X21000582-gr1_lrg.jpg?httpAccept=%2A%2F%2A",
            "@multimediatype": "JPEG image file",
            "@type": "IMAGE-HIGH-RES",
            "@size": "294579",
            "@ref": "gr1",
            "@mimetype": "image/jpeg"
          },
          {
            "@category": "high",
            "@height": "1545",
            "@width": "2500",
            "@_fa": "true",
            "$": "https://api.elsevier.com/content/object/eid/1-s2.0-S0926860X21000582-gr4_lrg.jpg?httpAccept=%2A%2F%2A",
            "@multimediatype": "JPEG image file",
            "@type": "IMAGE-HIGH-RES",
            "@size": "371076",
            "@ref": "gr4",
            "@mimetype": "image/jpeg"
          },
          {
            "@category": "high",
            "@height": "1148",
            "@width": "1323",
            "@_fa": "true",
            "$": "https://api.elsevier.com/content/object/eid/1-s2.0-S0926860X21000582-gr3_lrg.jpg?httpAccept=%2A%2F%2A",
            "@multimediatype": "JPEG image file",
            "@type": "IMAGE-HIGH-RES",
            "@size": "156718",
            "@ref": "gr3",
            "@mimetype": "image/jpeg"
          },
          {
            "@category": "high",
            "@height": "1015",
            "@width": "1324",
            "@_fa": "true",
            "$": "https://api.elsevier.com/content/object/eid/1-s2.0-S0926860X21000582-gr6_lrg.jpg?httpAccept=%2A%2F%2A",
            "@multimediatype": "JPEG image file",
            "@type": "IMAGE-HIGH-RES",
            "@size": "95958",
            "@ref": "gr6",
            "@mimetype": "image/jpeg"
          },
          {
            "@category": "high",
            "@height": "998",
            "@width": "1324",
            "@_fa": "true",
            "$": "https://api.elsevier.com/content/object/eid/1-s2.0-S0926860X21000582-gr5_lrg.jpg?httpAccept=%2A%2F%2A",
            "@multimediatype": "JPEG image file",
            "@type": "IMAGE-HIGH-RES",
            "@size": "183246",
            "@ref": "gr5",
            "@mimetype": "image/jpeg"
          },
          {
            "@category": "high",
            "@height": "995",
            "@width": "1333",
            "@_fa": "true",
            "$": "https://api.elsevier.com/content/object/eid/1-s2.0-S0926860X21000582-gr8_lrg.jpg?httpAccept=%2A%2F%2A",
            "@multimediatype": "JPEG image file",
            "@type": "IMAGE-HIGH-RES",
            "@size": "106994",
            "@ref": "gr8",
            "@mimetype": "image/jpeg"
          },
          {
            "@category": "high",
            "@height": "2662",
            "@width": "1328",
            "@_fa": "true",
            "$": "https://api.elsevier.com/content/object/eid/1-s2.0-S0926860X21000582-gr7_lrg.jpg?httpAccept=%2A%2F%2A",
            "@multimediatype": "JPEG image file",
            "@type": "IMAGE-HIGH-RES",
            "@size": "318131",
            "@ref": "gr7",
            "@mimetype": "image/jpeg"
          },
          {
            "@category": "standard",
            "@_fa": "true",
            "$": "https://api.elsevier.com/content/object/eid/1-s2.0-S0926860X21000582-mmc1.doc?httpAccept=%2A%2F%2A",
            "@multimediatype": "Microsoft Word file",
            "@type": "APPLICATION",
            "@size": "1068032",
            "@ref": "mmc1",
            "@mimetype": "application/word"
          },
          {
            "@category": "thumbnail",
            "@_fa": "true",
            "$": "https://api.elsevier.com/content/object/eid/1-s2.0-S0926860X21000582-si1.svg?httpAccept=%2A%2F%2A",
            "@multimediatype": "Scalable Vector Graphics file",
            "@type": "ALTIMG",
            "@size": "5463",
            "@ref": "si1",
            "@mimetype": "image/svg+xml"
          },
          {
            "@category": "thumbnail",
            "@_fa": "true",
            "$": "https://api.elsevier.com/content/object/eid/1-s2.0-S0926860X21000582-si2.svg?httpAccept=%2A%2F%2A",
            "@multimediatype": "Scalable Vector Graphics file",
            "@type": "ALTIMG",
            "@size": "3356",
            "@ref": "si2",
            "@mimetype": "image/svg+xml"
          },
          {
            "@category": "standard",
            "@_fa": "true",
            "$": "https://api.elsevier.com/content/object/eid/1-s2.0-S0926860X21000582-am.pdf?httpAccept=%2A%2F%2A",
            "@multimediatype": "Acrobat PDF file",
            "@type": "AAM-PDF",
            "@size": "3397444",
            "@ref": "am",
            "@mimetype": "application/pdf"
          }
        ]
      },
      "link": {
        "@rel": "abstract",
        "@href": "https://api.elsevier.com/content/abstract/scopus_id/85101750056"
      }
    }
  }
}