{
  "metadata": {
    "title": "Deactivation study of the hydrodeoxygenation of <ce:italic>p</ce:italic>-methylguaiacol over silica supported rhodium and platinum catalysts",
    "authors": "; ; ",
    "journal": "Applied Catalysis A: General",
    "date": "2017-06-05",
    "doi": "10.1016/j.apcata.2017.03.039",
    "abstract": "",
    "uri": "https://api.elsevier.com/content/article/pii/S0926860X17301485",
    "pii": "S0926860X17301485"
  },
  "fulltext": {
    "full-text-retrieval-response": {
      "scopus-eid": "2-s2.0-85017274481",
      "originalText": "serial JL 271346 291210 291744 291809 31 90 Applied Catalysis A: General APPLIEDCATALYSISAGENERAL 2017-03-31 2017-03-31 2017-04-10 2017-04-10 2017-05-16T05:33:33 1-s2.0-S0926860X17301485 S0926-860X(17)30148-5 S0926860X17301485 10.1016/j.apcata.2017.03.039 S300 S300.1 FULL-TEXT 1-s2.0-S0926860X17X00082 2025-07-16T14:34:32.714048Z 0 0 20170605 2017 2017-03-31T15:20:46.508966Z absattachment articleinfo articletitlenorm authfirstinitialnorm authfirstsurnamenorm cid cids contenttype copyright crossmark dateloaded dateloadedtxt datesearch datesort dateupdated dco docsubtype doctype doi eid ewtransactionid fundingbodyid hubeid indexeddate issn issnnorm itemstage itemtransactionid itemweight oauserlicense openaccess openarchive pg pgfirst pglast pii piinorm pubdatestart pubdatetxt pubyr sortorder sponsoredaccesstype srctitle srctitlenorm srctype ssids alllist content oa subj subheadings suppl tomb volfirst volissue volumelist webpdf webpdfpagecount yearnav figure table e-component body acknowledge affil appendices articletitle auth authfirstini authfull authkeywords authlast grantnumber grantsponsor highlightsabst primabst pubtype ref specialabst 0926-860X 0926860X UNLIMITED EPSRC true 539 539 C Volume 539 6 29 37 29 37 20170605 5 June 2017 2017-06-05 2017 article fla © 2017 The Authors. Published by Elsevier B.V. DEACTIVATIONSTUDYHYDRODEOXYGENATIONPMETHYLGUAIACOLOVERSILICASUPPORTEDRHODIUMPLATINUMCATALYSTS BOUXIN F 1 Introduction 2 Experimental 2.1 Materials 2.2 Design of the fixed-bed unit 2.3 Catalytic hydrodeoxygenation of p-methylguaiacol 2.4 Analysis of the oily products 2.4.1 Analytes preparation 2.4.2 GC/FID experimental conditions 2.5 Catalysts characterization 2.5.1 Temperature programmed oxidation analysis 2.5.2 Surface area and pore volumes distribution 2.5.3 Metal dispersion and surface areas 2.5.4 CHNS elemental analysis 2.5.5 Raman spectroscopy analysis 3 Results/discussion 3.1 p-Methylguaiacol conversion and selectivity 3.2 Yields of p-cresol, m-cresol and 4-methylcatechol as function of time 3.3 Hydrogenation of p-cresol, m-cresol and methylcatechol as function of the time 3.4 Characteristics of the Pt and Rh post-reaction catalysts 4 Conclusion Acknowledgments Appendix A Supplementary data References MANTE 2014 3364 3377 O SAIDI 2014 103 129 M BU 2012 470 477 Q RAGAUSKAS 2014 709 A RUDDY 2014 454 490 D MU 2014 6 10 W OLCESE 2012 63 73 R GUTIERREZ 2009 239 246 A ZHOU 2015 262 272 L ZHOU 2016 1442 1454 L NIMMANWUDIPONG 2012 1190 1196 T ZHANG 2016 7409 7417 X ZHAO 2016 305 310 H CHEN 2012 77 83 R LONGWITZ 2004 14497 14502 S MINEVA 2001 10723 10730 T LIU 2013 3665 3672 J FARRAUTO 1997 306 311 R FUNDAMENTALSINDUSTRIALCATALYTICPROCESSES RUNNEBAUM 2012 113 118 R ARGYLE 2015 145 269 M FOSTER 2012 118 128 A BOUXINX2017X29 BOUXINX2017X29X37 BOUXINX2017X29XF BOUXINX2017X29X37XF Full 2017-04-11T16:25:29Z FundingBody Engineering and Physical Sciences Research Council http://creativecommons.org/licenses/by/4.0/ 2019-04-10T00:00:00.000Z http://creativecommons.org/licenses/by-nc-nd/4.0/ This is an open access article under the CC BY license. © 2017 The Authors. Published by Elsevier B.V. item S0926-860X(17)30148-5 S0926860X17301485 1-s2.0-S0926860X17301485 10.1016/j.apcata.2017.03.039 271346 2024-01-01T12:31:47.592716Z 2017-06-05 UNLIMITED EPSRC 1-s2.0-S0926860X17301485-main.pdf https://s3-eu-west-1.amazonaws.com/prod-ucs-content-store-eu-west/content/pii:S0926860X17301485/MAIN/application/pdf/ef614d15df954f6808615eab1cc59f03/main.pdf https://s3.amazonaws.com/prod-ucs-content-store-us-east/content/pii:S0926860X17301485/MAIN/application/pdf/ef614d15df954f6808615eab1cc59f03/main.pdf main.pdf pdf true 1551359 MAIN 9 1-s2.0-S0926860X17301485-main_1.png https://s3-eu-west-1.amazonaws.com/prod-ucs-content-store-eu-west/content/pii:S0926860X17301485/PREVIEW/image/png/b2a0e18edfb6f7629d098359fe79502c/main_1.png https://s3.amazonaws.com/prod-ucs-content-store-us-east/content/pii:S0926860X17301485/PREVIEW/image/png/b2a0e18edfb6f7629d098359fe79502c/main_1.png main_1.png png 58277 849 656 IMAGE-WEB-PDF 1 1-s2.0-S0926860X17301485-fx1.sml https://s3-eu-west-1.amazonaws.com/prod-ucs-content-store-eu-west/content/pii:S0926860X17301485/fx1/THUMBNAIL/image/gif/b251d9ac75681069ecb1fb013da6d0c1/fx1.sml https://s3.amazonaws.com/prod-ucs-content-store-us-east/content/pii:S0926860X17301485/fx1/THUMBNAIL/image/gif/b251d9ac75681069ecb1fb013da6d0c1/fx1.sml fx1 true fx1.sml sml 9368 149 219 IMAGE-THUMBNAIL 1-s2.0-S0926860X17301485-gr1.sml https://s3-eu-west-1.amazonaws.com/prod-ucs-content-store-eu-west/content/pii:S0926860X17301485/gr1/THUMBNAIL/image/gif/b64f39383a14a5f6744eb3975208f3d5/gr1.sml https://s3.amazonaws.com/prod-ucs-content-store-us-east/content/pii:S0926860X17301485/gr1/THUMBNAIL/image/gif/b64f39383a14a5f6744eb3975208f3d5/gr1.sml gr1 gr1.sml sml 5385 164 198 IMAGE-THUMBNAIL 1-s2.0-S0926860X17301485-gr2.sml https://s3-eu-west-1.amazonaws.com/prod-ucs-content-store-eu-west/content/pii:S0926860X17301485/gr2/THUMBNAIL/image/gif/cffa8a2806d1b9bb9447dee6da12ceac/gr2.sml https://s3.amazonaws.com/prod-ucs-content-store-us-east/content/pii:S0926860X17301485/gr2/THUMBNAIL/image/gif/cffa8a2806d1b9bb9447dee6da12ceac/gr2.sml gr2 gr2.sml sml 7071 158 219 IMAGE-THUMBNAIL 1-s2.0-S0926860X17301485-gr3.sml https://s3-eu-west-1.amazonaws.com/prod-ucs-content-store-eu-west/content/pii:S0926860X17301485/gr3/THUMBNAIL/image/gif/a34cf8218ffea9cce91346b1c7299592/gr3.sml https://s3.amazonaws.com/prod-ucs-content-store-us-east/content/pii:S0926860X17301485/gr3/THUMBNAIL/image/gif/a34cf8218ffea9cce91346b1c7299592/gr3.sml gr3 gr3.sml sml 5312 157 219 IMAGE-THUMBNAIL 1-s2.0-S0926860X17301485-gr4.sml https://s3-eu-west-1.amazonaws.com/prod-ucs-content-store-eu-west/content/pii:S0926860X17301485/gr4/THUMBNAIL/image/gif/ea0cdbef6e24d7718e99ecf46529f149/gr4.sml https://s3.amazonaws.com/prod-ucs-content-store-us-east/content/pii:S0926860X17301485/gr4/THUMBNAIL/image/gif/ea0cdbef6e24d7718e99ecf46529f149/gr4.sml gr4 gr4.sml sml 5512 146 219 IMAGE-THUMBNAIL 1-s2.0-S0926860X17301485-gr5.sml https://s3-eu-west-1.amazonaws.com/prod-ucs-content-store-eu-west/content/pii:S0926860X17301485/gr5/THUMBNAIL/image/gif/00ae7c3098b0fbdf67b834b99b76c315/gr5.sml https://s3.amazonaws.com/prod-ucs-content-store-us-east/content/pii:S0926860X17301485/gr5/THUMBNAIL/image/gif/00ae7c3098b0fbdf67b834b99b76c315/gr5.sml gr5 gr5.sml sml 4033 162 78 IMAGE-THUMBNAIL 1-s2.0-S0926860X17301485-gr6.sml https://s3-eu-west-1.amazonaws.com/prod-ucs-content-store-eu-west/content/pii:S0926860X17301485/gr6/THUMBNAIL/image/gif/eea2da69d69ef7a9a9aeacc6e7bf6e69/gr6.sml https://s3.amazonaws.com/prod-ucs-content-store-us-east/content/pii:S0926860X17301485/gr6/THUMBNAIL/image/gif/eea2da69d69ef7a9a9aeacc6e7bf6e69/gr6.sml gr6 gr6.sml sml 4126 163 67 IMAGE-THUMBNAIL 1-s2.0-S0926860X17301485-gr7.sml https://s3-eu-west-1.amazonaws.com/prod-ucs-content-store-eu-west/content/pii:S0926860X17301485/gr7/THUMBNAIL/image/gif/badba15a963fbb41093f47ff96e06a56/gr7.sml https://s3.amazonaws.com/prod-ucs-content-store-us-east/content/pii:S0926860X17301485/gr7/THUMBNAIL/image/gif/badba15a963fbb41093f47ff96e06a56/gr7.sml gr7 gr7.sml sml 3054 162 78 IMAGE-THUMBNAIL 1-s2.0-S0926860X17301485-gr8.sml https://s3-eu-west-1.amazonaws.com/prod-ucs-content-store-eu-west/content/pii:S0926860X17301485/gr8/THUMBNAIL/image/gif/b4a8b87cb6600a98b587849f56c4c0fb/gr8.sml https://s3.amazonaws.com/prod-ucs-content-store-us-east/content/pii:S0926860X17301485/gr8/THUMBNAIL/image/gif/b4a8b87cb6600a98b587849f56c4c0fb/gr8.sml gr8 gr8.sml sml 6027 163 109 IMAGE-THUMBNAIL 1-s2.0-S0926860X17301485-fx1.jpg https://s3-eu-west-1.amazonaws.com/prod-ucs-content-store-eu-west/content/pii:S0926860X17301485/fx1/DOWNSAMPLED/image/jpeg/4e30f76ca79ec4bb3303604af0e999f3/fx1.jpg https://s3.amazonaws.com/prod-ucs-content-store-us-east/content/pii:S0926860X17301485/fx1/DOWNSAMPLED/image/jpeg/4e30f76ca79ec4bb3303604af0e999f3/fx1.jpg fx1 true fx1.jpg jpg 16079 200 293 IMAGE-DOWNSAMPLED 1-s2.0-S0926860X17301485-gr1.jpg https://s3-eu-west-1.amazonaws.com/prod-ucs-content-store-eu-west/content/pii:S0926860X17301485/gr1/DOWNSAMPLED/image/jpeg/b381cd094699f9e6a6a0606267773869/gr1.jpg https://s3.amazonaws.com/prod-ucs-content-store-us-east/content/pii:S0926860X17301485/gr1/DOWNSAMPLED/image/jpeg/b381cd094699f9e6a6a0606267773869/gr1.jpg gr1 gr1.jpg jpg 51883 529 640 IMAGE-DOWNSAMPLED 1-s2.0-S0926860X17301485-gr2.jpg https://s3-eu-west-1.amazonaws.com/prod-ucs-content-store-eu-west/content/pii:S0926860X17301485/gr2/DOWNSAMPLED/image/jpeg/94ad282290aca87efc066bbc69c8fdcb/gr2.jpg https://s3.amazonaws.com/prod-ucs-content-store-us-east/content/pii:S0926860X17301485/gr2/DOWNSAMPLED/image/jpeg/94ad282290aca87efc066bbc69c8fdcb/gr2.jpg gr2 gr2.jpg jpg 45541 461 640 IMAGE-DOWNSAMPLED 1-s2.0-S0926860X17301485-gr3.jpg https://s3-eu-west-1.amazonaws.com/prod-ucs-content-store-eu-west/content/pii:S0926860X17301485/gr3/DOWNSAMPLED/image/jpeg/0581e6997483c023ee8673c7eddfe3a7/gr3.jpg https://s3.amazonaws.com/prod-ucs-content-store-us-east/content/pii:S0926860X17301485/gr3/DOWNSAMPLED/image/jpeg/0581e6997483c023ee8673c7eddfe3a7/gr3.jpg gr3 gr3.jpg jpg 27514 350 489 IMAGE-DOWNSAMPLED 1-s2.0-S0926860X17301485-gr4.jpg https://s3-eu-west-1.amazonaws.com/prod-ucs-content-store-eu-west/content/pii:S0926860X17301485/gr4/DOWNSAMPLED/image/jpeg/974fd0f4d553facb98784e45d41e9924/gr4.jpg https://s3.amazonaws.com/prod-ucs-content-store-us-east/content/pii:S0926860X17301485/gr4/DOWNSAMPLED/image/jpeg/974fd0f4d553facb98784e45d41e9924/gr4.jpg gr4 gr4.jpg jpg 19224 250 376 IMAGE-DOWNSAMPLED 1-s2.0-S0926860X17301485-gr5.jpg https://s3-eu-west-1.amazonaws.com/prod-ucs-content-store-eu-west/content/pii:S0926860X17301485/gr5/DOWNSAMPLED/image/jpeg/8f36b074bc5f3245ab4ece39448b6f6c/gr5.jpg https://s3.amazonaws.com/prod-ucs-content-store-us-east/content/pii:S0926860X17301485/gr5/DOWNSAMPLED/image/jpeg/8f36b074bc5f3245ab4ece39448b6f6c/gr5.jpg gr5 gr5.jpg jpg 55503 783 376 IMAGE-DOWNSAMPLED 1-s2.0-S0926860X17301485-gr6.jpg https://s3-eu-west-1.amazonaws.com/prod-ucs-content-store-eu-west/content/pii:S0926860X17301485/gr6/DOWNSAMPLED/image/jpeg/9b6092108d61cf118da1c058843d2ee1/gr6.jpg https://s3.amazonaws.com/prod-ucs-content-store-us-east/content/pii:S0926860X17301485/gr6/DOWNSAMPLED/image/jpeg/9b6092108d61cf118da1c058843d2ee1/gr6.jpg gr6 gr6.jpg jpg 77153 913 376 IMAGE-DOWNSAMPLED 1-s2.0-S0926860X17301485-gr7.jpg https://s3-eu-west-1.amazonaws.com/prod-ucs-content-store-eu-west/content/pii:S0926860X17301485/gr7/DOWNSAMPLED/image/jpeg/29a230359ad26898eda7978c7a3891a3/gr7.jpg https://s3.amazonaws.com/prod-ucs-content-store-us-east/content/pii:S0926860X17301485/gr7/DOWNSAMPLED/image/jpeg/29a230359ad26898eda7978c7a3891a3/gr7.jpg gr7 gr7.jpg jpg 42001 782 376 IMAGE-DOWNSAMPLED 1-s2.0-S0926860X17301485-gr8.jpg https://s3-eu-west-1.amazonaws.com/prod-ucs-content-store-eu-west/content/pii:S0926860X17301485/gr8/DOWNSAMPLED/image/jpeg/39c2bdf00a2a350f4687883880043302/gr8.jpg https://s3.amazonaws.com/prod-ucs-content-store-us-east/content/pii:S0926860X17301485/gr8/DOWNSAMPLED/image/jpeg/39c2bdf00a2a350f4687883880043302/gr8.jpg gr8 gr8.jpg jpg 85056 732 489 IMAGE-DOWNSAMPLED 1-s2.0-S0926860X17301485-fx1_lrg.jpg https://s3-eu-west-1.amazonaws.com/prod-ucs-content-store-eu-west/content/pii:S0926860X17301485/fx1/HIGHRES/image/jpeg/1f6569a9f7270db24e08403f5b3360ff/fx1_lrg.jpg https://s3.amazonaws.com/prod-ucs-content-store-us-east/content/pii:S0926860X17301485/fx1/HIGHRES/image/jpeg/1f6569a9f7270db24e08403f5b3360ff/fx1_lrg.jpg fx1 true fx1_lrg.jpg jpg 114630 886 1300 IMAGE-HIGH-RES 1-s2.0-S0926860X17301485-gr1_lrg.jpg https://s3-eu-west-1.amazonaws.com/prod-ucs-content-store-eu-west/content/pii:S0926860X17301485/gr1/HIGHRES/image/jpeg/77396d7a4c476aed2ad24c8a7015d7be/gr1_lrg.jpg https://s3.amazonaws.com/prod-ucs-content-store-us-east/content/pii:S0926860X17301485/gr1/HIGHRES/image/jpeg/77396d7a4c476aed2ad24c8a7015d7be/gr1_lrg.jpg gr1 gr1_lrg.jpg jpg 380551 2340 2833 IMAGE-HIGH-RES 1-s2.0-S0926860X17301485-gr2_lrg.jpg https://s3-eu-west-1.amazonaws.com/prod-ucs-content-store-eu-west/content/pii:S0926860X17301485/gr2/HIGHRES/image/jpeg/3119850aa502673326795cc9d4774627/gr2_lrg.jpg https://s3.amazonaws.com/prod-ucs-content-store-us-east/content/pii:S0926860X17301485/gr2/HIGHRES/image/jpeg/3119850aa502673326795cc9d4774627/gr2_lrg.jpg gr2 gr2_lrg.jpg jpg 406558 2042 2833 IMAGE-HIGH-RES 1-s2.0-S0926860X17301485-gr3_lrg.jpg https://s3-eu-west-1.amazonaws.com/prod-ucs-content-store-eu-west/content/pii:S0926860X17301485/gr3/HIGHRES/image/jpeg/35853a1ead5eab891bf1dde3d22c9f24/gr3_lrg.jpg https://s3.amazonaws.com/prod-ucs-content-store-us-east/content/pii:S0926860X17301485/gr3/HIGHRES/image/jpeg/35853a1ead5eab891bf1dde3d22c9f24/gr3_lrg.jpg gr3 gr3_lrg.jpg jpg 193185 1550 2167 IMAGE-HIGH-RES 1-s2.0-S0926860X17301485-gr4_lrg.jpg https://s3-eu-west-1.amazonaws.com/prod-ucs-content-store-eu-west/content/pii:S0926860X17301485/gr4/HIGHRES/image/jpeg/53348bdb7bfcaad0d0683730c1ac8d0a/gr4_lrg.jpg https://s3.amazonaws.com/prod-ucs-content-store-us-east/content/pii:S0926860X17301485/gr4/HIGHRES/image/jpeg/53348bdb7bfcaad0d0683730c1ac8d0a/gr4_lrg.jpg gr4 gr4_lrg.jpg jpg 134947 1108 1667 IMAGE-HIGH-RES 1-s2.0-S0926860X17301485-gr5_lrg.jpg https://s3-eu-west-1.amazonaws.com/prod-ucs-content-store-eu-west/content/pii:S0926860X17301485/gr5/HIGHRES/image/jpeg/035a416ad15bd30073903fe61016aa42/gr5_lrg.jpg https://s3.amazonaws.com/prod-ucs-content-store-us-east/content/pii:S0926860X17301485/gr5/HIGHRES/image/jpeg/035a416ad15bd30073903fe61016aa42/gr5_lrg.jpg gr5 gr5_lrg.jpg jpg 391115 3471 1667 IMAGE-HIGH-RES 1-s2.0-S0926860X17301485-gr6_lrg.jpg https://s3-eu-west-1.amazonaws.com/prod-ucs-content-store-eu-west/content/pii:S0926860X17301485/gr6/HIGHRES/image/jpeg/a0e44fe84e18e7b2647886b13f1a06c8/gr6_lrg.jpg https://s3.amazonaws.com/prod-ucs-content-store-us-east/content/pii:S0926860X17301485/gr6/HIGHRES/image/jpeg/a0e44fe84e18e7b2647886b13f1a06c8/gr6_lrg.jpg gr6 gr6_lrg.jpg jpg 561279 4049 1667 IMAGE-HIGH-RES 1-s2.0-S0926860X17301485-gr7_lrg.jpg https://s3-eu-west-1.amazonaws.com/prod-ucs-content-store-eu-west/content/pii:S0926860X17301485/gr7/HIGHRES/image/jpeg/b54ec197791b088b1a018ee11c54b2ff/gr7_lrg.jpg https://s3.amazonaws.com/prod-ucs-content-store-us-east/content/pii:S0926860X17301485/gr7/HIGHRES/image/jpeg/b54ec197791b088b1a018ee11c54b2ff/gr7_lrg.jpg gr7 gr7_lrg.jpg jpg 276073 3466 1667 IMAGE-HIGH-RES 1-s2.0-S0926860X17301485-gr8_lrg.jpg https://s3-eu-west-1.amazonaws.com/prod-ucs-content-store-eu-west/content/pii:S0926860X17301485/gr8/HIGHRES/image/jpeg/b47f0ba39e5e1843d351ab25d0870197/gr8_lrg.jpg https://s3.amazonaws.com/prod-ucs-content-store-us-east/content/pii:S0926860X17301485/gr8/HIGHRES/image/jpeg/b47f0ba39e5e1843d351ab25d0870197/gr8_lrg.jpg gr8 gr8_lrg.jpg jpg 638950 3243 2167 IMAGE-HIGH-RES 1-s2.0-S0926860X17301485-mmc1.docx https://s3-eu-west-1.amazonaws.com/prod-ucs-content-store-eu-west/content/pii:S0926860X17301485/mmc1/MAIN/application/msword/cf2158b457ab55a9b409a46d6670fd7a/mmc1.docx https://s3.amazonaws.com/prod-ucs-content-store-us-east/content/pii:S0926860X17301485/mmc1/MAIN/application/msword/cf2158b457ab55a9b409a46d6670fd7a/mmc1.docx mmc1 mmc1.docx docx 19815 APPLICATION APCATA 16198 S0926-860X(17)30148-5 10.1016/j.apcata.2017.03.039 The Authors Fig. 1 Reaction pathways for the HDO of p-methylguaiacol. [DMO: demethoxylation, DME: demethylation, DDO: direct deoxygenation, HYD: hydrogenation, DeHYD: dehydrogenation, DHY: dehydration]. Fig. 1 Fig. 2 Fixed bed reactor experimental set-up. Fig. 2 Fig. 3 p-Methylguaiacol conversion at 300°C, 4 barg hydrogen, WHSV of 2.5h−1 and H2/PMG molar ratio of 15. Fig. 3 Fig. 4 Deactivation plot for Pt/silica and Rh/silica (A). Fig. 4 Fig. 5 Selectivity obtained from (A) Pt/silica, (B) Rh/silica (A) at 1h, 12h and 32h TOS and (C) Rh/silica (JM) at 1h, 10h and 33h TOS (only compounds with selectivity >2% are reported). Fig. 5 Fig. 6 Variation of product yield with time over (A) Pt/silica, (B) Rh/silica (A) and (C) Rh/silica (JM). Conditions: 300°C, 4bar hydrogen, WHSV of 2.5h−1 and H2/PMG molar ratio of 15. Fig. 6 Fig. 7 Molar ratio of (blue square) p-cresol (1)/hydrogenated p-cresol products(6–7), (red triangle) m-cresol (5)/hydrogenated m-cresol products (8–9) and (green dot) methylcatechol (3)/hydrogenated methylcatechols products (10–11) as function of the time on stream at 300°C, 2.5 WHSV, 4 bar of H2 and H2/PMG molar ratio of 15 [A:1.55%Pt/SiO2 (A); B: 2.5%Rh/SiO2 (A); C: 2.5%Rh/SiO2 (JM)]. (For interpretation of the references to colour in this figure legend, the reader is referred to the web version of this article.) Fig. 7 Fig. 8 TPO analysis (A) of the spent catalysts [blue: Rh/SiO2(JM); red: Rh/SiO2(A); green: Pt/SiO2(A)] and CO2-TPO profile (B). Fig. 8 Table 1 Catalyst characterisation before and after reaction. Table 1 Catalyst surface area/m2 g−1 Metal crystallite size/nm Metal surface area/m2 g−1 Metal dispersion/% Carbon content/% 1.55%Pt-SiO2 (A) 242 15 0.83 7.2 0.1 1.55%Pt-SiO2 (A) Post Reaction 167 23 0.31 4.8 5.7 2.5%Rh-SiO2 (A) 234 16 4.15 6.8 0.1 2.5%Rh-SiO2 (A) Post Reaction 189 18 3.90 6.1 4.9 2.5%Rh-SiO2 (JM) 473 40 2.04 2.8 0.2 2.5%Rh-SiO2 (JM) Post Reaction 269 43 1.31 2.6 13.1 Feature Article Deactivation study of the hydrodeoxygenation of p-methylguaiacol over silica supported rhodium and platinum catalysts F.P. Bouxin a b ⁎ X. Zhang c I.N. Kings d A.F. Lee c M.J.H. Simmons d K. Wilson c S.D. Jackson a ⁎⁎ a Centre for Catalysis Research, School of Chemistry, University of Glasgow, Glasgow G12 8QQ, Scotland, UK Centre for Catalysis Research School of Chemistry University of Glasgow Glasgow Scotland G12 8QQ UK b Joint BioEnergy Institute, Lawrence Berkeley National Lab, Emeryville, 94608, USA Joint BioEnergy Institute Lawrence Berkeley National Lab Emeryville 94608 USA c European Bioenergy Engineering, University of Aston, Birmingham B4 7ET, UK European Bioenergy Engineering University of Aston Birmingham B4 7ET UK d School of Chemical Engineering, University of Birmingham, Birmingham B15 2TT, UK School of Chemical Engineering University of Birmingham Birmingham B15 2TT UK ⁎ Corresponding author at: Joint BioEnergy Institute, Lawrence Berkeley National Lab, Emeryville, 94608, USA. Joint BioEnergy Institute Lawrence Berkeley National Lab Emeryville 94608 USA ⁎⁎ Corresponding author. Graphical abstract Hydrodeoxygenation of para-methylguaiacol using silica supported Rh or Pt catalysts was investigated using a fixed-bed reactor at 300°C, under 4 barg hydrogen and a WHSV of 2.5h−1. The activity, selectivity and deactivation of the catalysts were examined in relation to time on stream. Three catalysts were tested: 2.5% Rh/silica supplied by Johnson Matthey (JM), 2.5% Rh/silica and 1.55% Pt/silica both prepared in-house. The Rh/silica (JM) showed the best stability with steady-state reached after 6h on stream and a constant activity over 3days of reaction. In contrast the other two catalysts did not reach steady state within the timeframe of the tests, with continuous deactivation over the time on stream. Nevertheless higher coking was observed on the Rh/silica (JM) catalyst, while all three catalysts showed evidence of sintering. The Pt catalyst (A) showed higher selectivity for the production of 4-methylcatechol while the Rh catalysts were more selective toward the cresols. In all cases, complete hydrodeoxygenation of the methylguaiacol to methylcyclohexane was not observed. Keywords Hydrodeoxygenation p-Methylguaiacol Rhodium Platinum Deactivation 1 Introduction Bio-oils upgrading can be performed using a variety of different approaches. In order to blend with crude oil, or to drop-in to existing petroleum processes, the oxygen content (30–50%) of the bio-oil has to be reduced. Deoxygenation of the bio-oils can be achieved using a zeolite cracking approach [1] or catalytic hydrodeoxygenation [2,3]. Reductive media such as hydrogen or a hydrogen donor solvent are typically used for hydrodeoxygenation or the hydrogen transfer reaction. While hydrodeoxygenation of bio-oils has been studied for decades, the catalytic mechanisms and reasons for catalyst deactivation are still not fully understood [4]. The chemical composition of the bio-oils is extremely complex and depends on the amount of cellulose, hemicelluloses and lignin in the biomass feedstock and the pyrolysis conditions. During the pyrolytic process, celluloses and hemicelluloses produce sugars and furans which undergo additional decomposition to generate esters, acids, alcohols, ketones and aldehydes [2]. The phenolic compounds (phenols, guaiacols and syringols) are produced from the lignin component. Amongst all the compounds present in the bio-oil, the phenolics are by far the most studied. The reasons are their multiple functional groups, their high proportion in the bio-oil and their tendency to promote catalyst deactivation. Another reason of the extensive use of phenolics as model compounds for bio-oil upgrading relies on the higher bond dissociation energy required to break aryl-hydroxyl or aryl-methoxy linkages compared to alkyl hydroxyl or alkyl ether linkages [5]. Within the pyrolysis of aromatic compounds, guaiacol has received the most attention [6,7]. During the upgrading process, guaiacol can undergo demethoxylation, demethylation and partial or complete hydrogenation. Various catalysts have been studied for the hydrodeoxygenation of guaiacol. In a previous study, noble metals catalysts such as Pt, Pd or Rh, when compared to conventional sulfided CoMo/Al2O3, showed better performance and exhibited a lower carbon deposit [8]. A comparative study of Pt/Al2O3, Rh/Al2O3 and presulfided NiMo catalysts for the HDO of microalgae oil reported the better stability of the noble metal catalysts reaching a steady state after 5h time on stream. The NiMo catalyst which did not reach steady state after 7h reaction was prone to higher carbon deposition [9,10]. Catalyst supports also play a significant role in the stability of the catalysts. Previous works reported that use of basic magnesia supports reduced the coking of the catalyst when compared to acidic alumina supports [11]. In this paper we report on the HDO reaction of p-methylguaiacol (PMG) over silica-supported rhodium and platinum catalysts. Silica was selected as the catalyst support for this study due to its less acidic properties with the aim of reducing carbon deposition. Instead of guaiacol, HDO was performed using p-methylguaiacol as the model compound, as it is one of the main components of the pyrolytic oil formed from lignocellulosic feedstocks. Also unlike guaiacol, the methylation in the para position allowed discrimination of different reaction pathways via the generation of m- or p-cresol as illustrated in Fig. 1 . The complete list of product names was given in Table S.1. Two 2.5% Rh/silica catalysts and a 1.55% Pt/silica catalyst were tested for this study. 2 Experimental 2.1 Materials p-Methylguaiacol (PMG) and reference products were purchased from Sigma-Aldrich. A 2.5% Rh/SiO2 catalyst was obtained from Johnson Matthey and prepared by incipient-wetness impregnation rhodium chloride salt on a Grace-Davison silica support (catalyst reference M02026). A 1.55% Pt/SiO2 and a 2.5% Rh/SiO2 catalysts were prepared by incipient-wetness impregnation of aqueous ammonium tetrachloroplatinate(II) (Alfa Aesar, 99.9%, (NH4)2PtCl4) and Rhodium (III) chloride, (Sigma, 99.9%, RhCl3, xH2O) over fumed silica (Sigma-Aldrich, 0.2–0.3mm avg. part. Size). Detailed protocols for Pt/SiO2 (A) and Rh/SiO2 (A) catalysts prepared by Aston University was described in previous work [12]. Each catalyst was ground and sieved to between 350 and 850μm before use. The characteristics of the catalysts are listed in Table 1 . All other reagents and solvents were purchased from Sigma-Aldrich and used without further purification. 2.2 Design of the fixed-bed unit In a previous study, the eluent gas stream of guaiacol HDO was quantified using on-line GC analysis [13]. However in our system the complexity of the HDO products mixture (see Fig. 1) was not compatible with on-line GC analysis of the deoxygenated/hydrogenated oil. For example, para and meta-cresols could only be GC-differentiated after a silylation step. Therefore a collector was required to sample the condensable products at different time on stream without interrupting the reaction. In a previous paper the liquid products were collected by bubbling the vaporised products into a cold liquid such as isopropanol [7]. This technique has the advantage to give an absolute value for each product, however this technique was felt more suitable for a low pressure system. In the present study, liquefaction of the product gas stream was obtained after passing through a condenser at 5°C. As illustrated in Fig. 2 , after passing through the condenser, the gas-liquid were separated and the liquid collected by gravitation into a ¼ inch stainless steel tubing before filling the collector from the bottom. A system of valves permitted isolation of the collector for sampling without disturbing the pressure of the system. The light products were also collected into a U-shape pipe, cooled to −60°C connected after the pressure relief valve. The analysis of the light trap showed that only 5% of the toluene (lightest compound detected) was not condensed after passing through the condenser. No other products were detected to have passed the condenser in the gas phase except a trace of p-methylguaiacol (PMG) due to its large excess in the product stream. However, due to the lack of precision on the sampling volume (liquid hold-up in the condenser), an exact mass balance and an absolute quantification of each product could not achieved. As consequence, only a relative molar quantification of products was performed with the conversion, yield and selectivity as defined in Eqs. (1)–(3): (1) Conversion=(Σ moles of products)/(Σ products+mol of PMG out) (2) Yield=mol of product (i)/(Σ moles of products+mol of PMG out) (3) Selectivity=mol of product (i)/Σ moles of products 2.3 Catalytic hydrodeoxygenation of p-methylguaiacol The catalytic test was performed in a continuous-flow, fixed-bed reactor over 0.45g of silica supported noble metal catalyst. Similar catalyst bed volumes of 0.84–0.88cm−3 were estimated from the bulk densities of the catalysts of 0.51, 0.52 and 0.54gcm−3 for the Rh/SiO2 (A), Pt/SiO2 (A) and Rh/SiO2 (JM), respectively. With a reactor inner diameter of 0.40cm, the bed catalyst length was around 6.7–7.0cm. The catalyst was pre-reduced in-situ before reaction at 300°C for 2h under 100mLmin−1 of 40% H2/Argon. After the catalyst was reduced, p-methylguaiacol (PMG) was pumped into the gas flow and vaporised at 200°C. The reaction temperature was 300°C with a hydrogen partial pressure of 4 barg giving a H2:PMG molar ratio of 15. The total pressure was made up to 10 barg using argon. The weight hourly space velocity (WHSV) of PMG was 2.5h−1, while the gas hourly space velocity (GHSV) was 7200h−1 with gas flow rate of 100mLmin−1. Gas mass flow controllers were used to feed hydrogen and argon while a Gilson HPLC pump was used to feed the p-methylguaiacol. In order to avoid condensation, gas lines before and after the reactor were heated to 220°C. A condenser at 5°C was used to liquefy the products before sampling. The HDO products (100–200mg) were diluted in 5mL of dichloromethane (DCM). 2.4 Analysis of the oily products 2.4.1 Analytes preparation In order to fully quantify the products and due to the significant variation of products’ abundance, three distinct solutions were prepared from the same mixture of products/internal standards (IS). First, an aliquot of the HDO products in DCM (100μL) was mixed with 50μL of IS (C10 at 0.86 and C17 at 10.2gL−1). Then, 20μL of this mix was silylated while the remaining mixture was diluted with 0.5mL of dichloromethane. Finally, 5–10μL of the diluted solution was also silylated to quantify the PMG, methylcatechol and cresol products. The non-silylated solutions were injected to quantify the light products such as methylcyclohexane and toluene but also the 4-methyl-2-methoxycyclohexanone which co-eluted with the trimethylsilyl methylcyclohexanol. This technique permitted a full quantification of minor and major products. 2.4.2 GC/FID experimental conditions Qualitative analyses of the HDO products were performed on a Shimadzu GC-2010 coupled to a MS-QP2010S. Samples were injected on a ZB-5MS capillary column (30m×0.25mm×0.25μm). The quantitative analyses were performed on an HP 5890 gas chromatograph fitted with a Supelco DB-5 capillary column (30m×0.32mm, 1mm thickness). Quantification was obtained using decane C10 and heptadecane C17 as internal standards and the relative response coefficients were based on exact products when possible or on response coefficients of similar product structure for non-commercial products. 2.5 Catalysts characterization 2.5.1 Temperature programmed oxidation analysis Temperature programmed oxidation (TPO) was carried out using a combined TGA/DSC SDT Q600 thermal analyser coupled to an ESS mass spectrometer for evolved gas analysis. A sample loading of 10–15mg was used and samples were typically heated from 30°C to 900°C using a ramp rate of 10°Cmin−1 under 2% O2/Ar, with a flow rate of 100mLmin−1. For mass spectrometric analysis, various mass fragments were followed such 18 (H2O), 28 (CO), and 44 (CO2). All TGA work was kindly carried out by Andy Monaghan at the University of Glasgow. 2.5.2 Surface area and pore volumes distribution Nitrogen porosimetry was conducted on the Quantachrome Nova 4000e porosimeter and analysed with the software of NovaWin version 11. Samples were degassed at 120°C for 2h under vacuum conditions prior to analysis by nitrogen adsorption at −196°C. Adsorption/desorption isotherms were recorded for all parent and Pt-impregnated and Rh-impregnated silicas. The BET (Brunauer-Emmett-Teller) surface areas were derived over the relative pressure range between 0.01 and 0.2. Pore diameters and volumes were calculated using the BJH method according to desorption isotherms for relative pressures >0.35. 2.5.3 Metal dispersion and surface areas Pt and Rh dispersions were measured via CO pulse chemisorption on a Quantachrome ChemBET 3000 system. Samples were outgassed at 150°C under flowing He (20mLmin−1) for 1h, prior to reduction at 150°C under flowing hydrogen (10mLmin−1) for 1h before room temperature analysis (this reduction protocol is milder than that employed during Pt or Rh impregnation and does not induce particle sintering). A CO:Pt surface stoichiometry of 0.68 was assumed according to the literature [14,15]; the CO-Rh interaction was much more complicated because the CO bond is very sensitive to the particular electron distribution, such as the spin-states and the initial occupations of the Rh 5s electronic states [16]; therefore, the CO:Rh ratio was difficult to determine. For estimation, a CO:Rh surface stoichiometry of 1 could be assumed on the basis of literature [16,17]. 2.5.4 CHNS elemental analysis Carbon loadings (accumulated on the spent catalysts) were obtained using a Thermo Flash 2000 organic elemental analyser, calibrated to a sulphanilimide standard, with the resulting chromatograms analysed using Thermo Scientific's Eager Xperience software. Vanadium pentoxide was added to aid sample combustion. 2.5.5 Raman spectroscopy analysis Raman spectra of post reaction catalysts were obtained with a Horiba Jobin Yvon LabRAM High Resolution spectrometer. A 532.17nm line of a coherent Kimmon IK series He-Cd laser was used as the excitation source for the laser. Laser light was focused for 10s using a 50× objective lens and grating of 600. The scattered light was collected in a backscattering configuration and was detected using nitrogen cooled charge-coupled detector. A scanning range of 100 and 4100cm−1 was used. 3 Results/discussion 3.1 p-Methylguaiacol conversion and selectivity The activity/selectivity of the three catalysts was studied with the time on stream. The main purpose of these experiments was to determine if the catalyst activity reached a steady state or if deactivation was continuous. Low activity of the catalyst was not an issue but identification of the variation of catalyst activity and product selectivity were critical for a future kinetic study of the hydrodeoxygenation of p-methylguaiacol. Catalyst testing was performed at 300°C, a WHSV of 2.5h−1, 4 barg hydrogen and a H2:PMG molar ratio of 15:1. The rhodium/silica (JM) catalyst and both Rh/silica (A) and Pt/SiO2 (A) catalysts were studied over several days (see Fig. 3 ). Rh/SiO2 (JM) showed fast deactivation initially but this was followed by a period of constant activity, whereas although the Rh/SiO2 (A) showed the same deactivation profile initially, no steady state was observed. The deactivation profile of the Pt/SiO2 catalyst was different from that of the rhodium catalysts in that it exhibited a constant loss of activity. This linear deactivation has previously been reported on HDO of guaiacol over Pt/Al2O3 and Pt/MgO [11]. The deactivation of the Pt/silica was plotted (Fig. 4 ) using the relationship, ln[Xt0/(1−Xt)]=ln(kτw)−kdt, where, Xt is the conversion the reactant at time t, k is the rate constant, τw represents weight time, kd the deactivation rate constant and t is time [18]. The deactivation plot gave a deactivation rate constant of 0.02h−1 (R2 =0.92). However, the Rh/Silica (A) data fitted a logarithmic curve with regression coefficient (R2) of 0.99 which showed that the deactivation mechanism was not time independent. The catalysts initial selectivity and those after ∼12h and ∼32h TOS are shown in Fig. 5 . Compared to the Pt/SiO2 (A) and the Rh/SiO2 (A), the Rh/SiO2 (JM) was the only catalyst that showed constant selectivity from 10h to 33h TOS. After 32h on stream, 42 mol% of the products were p-methylcatechol with Rh/SiO2 (A) whereas with Rh/SiO2 (JM) the selectivity to p-methylcatechol was only 12 mol%. This significant variation may be explained by the different nature of silica support used. As illustrated in Fig. 6 , Rh/SiO2 (A) produced p-methylcatechol with the same rate from 12 to 72h TOS. While deoxygenation and hydrogenation reaction were deactivated over time, the demethylation of the PMG was not affected. The high demethylation activity for the Rh/silica (A) can be suggested by higher acidity of the silica support. For the Pt/SiO2 (A), the selectivity toward the 4-methyl catechol increased from 8 to 25mol% from 1h to 32h TOS while the selectivity toward the m- and p-cresol decreased from 22.6 and 40.1mol% to 13.6 and 34.0mol%. Comparing the two rhodium catalysts some notable differences are observed. Initially the Rh/silica (A) shows a high selectivity to toluene and a low selectivity to 4-methyl catechol but by 32h TOS the selectivity has reversed. This behaviour raises the question as to whether it is possible to remove two OH groups before desorption, effectively by-passing the formation of p-cresol as an intermediate. This behaviour is not seen with the Rh/silica (JM) catalyst where the selectivity is relatively unchanged over the TOS. There are two significant differences between the rhodium catalysts. Different silica supports were used and the metal crystallite size is different (Table 1). Their preparations were identical so the significant difference of products selectivity between the two rhodium catalysts could be attributed to either the nature of the silica support or a metal particle size effect. A more in-depth investigation of these effects will be required to fully interpret these changes in selectivity. 3.2 Yields of p-cresol, m-cresol and 4-methylcatechol as function of time The variations of the molar yield of the principle products (those with yields >2mol%) are shown in Fig. 6 for the three catalysts. With Rh/SiO2 (JM) and Pt/SiO2 (A) catalysts p-cresol was the main product. For the Rh/SiO2 (A), p-cresol was the main product for the first 24h TOS, subsequently methylcatechol was the main product. As illustrated in Fig. 6, Pt/Silica (A) showed similar conversion rate of p-methylguaiacol to 4-methyl catechol than Rh/Silica (A) from 24h to 72h. However, the Pt/silica catalyst showed a different deactivation profile for the three main products (p-cresol, m-cresol and 4-methylcatechol), with the yield of 4-methylcatechol decreasing more slowly than the yields of both para- and meta-cresol suggesting that catalyst deactivation affected the demethylation of the p-methylguaiacol less than the demethoxylation and direct deoxygenation. Platinum has been reported to favour the demethylation of guaiacol and this could explain the high demethylation activity in the early stages [19]. In the case of both Rh catalysts, there was low conversion of p-methylguaiacol to 4-methylcatechol initially, which then increased and stabilized to a constant production after 10h or 5h on stream for Rh/silica (A) or Rh/silica (JM) respectively. Indeed, for the Rh/silica (A) catalyst, 4-methylcatechol becomes the principal product. This is explained by the concomitant loss of deoxygenation of the methylcatechol to m- or p-cresol. The yields of the p-cresol and m-cresol also stabilized after 10h on stream for the Rh/silica (JM) catalyst consistent with it achieving steady state. On the other hand, the Rh/silica (A) and Pt/silica did not reach a steady state within the time of the study. It could be speculated that Rh/silica (A) required a longer reaction time in order to reach a steady state as illustrated by the deactivation profile in Fig. 3. However, in the case of the Pt/silica catalyst, the continuous deactivation profile suggested that the catalyst may not reach a steady state condition. Extended testing would be required to determine whether a low activity steady state was reached or whether the system was subject to continuous deactivation. As illutrated in Fig. 1, the production of m-cresol or p-cresol required the demethylation and direct deoxygenation. The p-cresol can also be produced directly from the demethoxylation of the methylguaiacol. As illustrated in Figure S.1, the ratios p-cresol/m-cresol were 3.1, 2.4 and 2.2 after 12h TOS for Rh (JM), Rh (A) and Pt (A) catalysts, respectively. The production of p-cresol via demethoxylation was more pronounced in the case of the Rh (JM) and can be explained by the low activity of the catalyst toward demethylation. On the other hand, the Rh (A) and Pt (A) catalysts produced a p-cresol/m-cresol ratio closer to two suggesting that both demethoxylation and demethylation/direct deoxygenation pathways were more balanced. This can be explained by the higher activity of both catalysts toward the demethylation (Fig. 6). However, while the Rh (JM) showed a constant ratio between the m- and p-cresol, the Rh (A) and Pt (A) showed an increase of the ratio with TOS. As consequence, the pathways for the production of m-cresol and p-cresol were not affected the same way with the deactivation of the Pt (A) and Rh (A) catalysts. It could be suggested that the demethoxylation was less affected than the direct deoxygenation. However, different rate of hydrogenation of the p-cresol and m-cresol could also explained this difference and will be discussed in the next section. 3.3 Hydrogenation of p-cresol, m-cresol and methylcatechol as function of the time Hydrogenation can be affected differently according to the nature of the intermediate products and the catalyst used. According to the reaction pathways illustrated in Fig. 1, the molar ratio of p-cresol (1), m-cresol (5), p-methylcatechol (3) and the hydrogenated products of the p-cresol (6–7), m-cresol (8–9), p-methylcatechol (10–11) was calculated for the three catalysts. As illustrated in Fig. 7 A, the hydrogenation of the p-cresol and m-cresol on the Pt/silica (A) catalyst was in the same range and followed the same loss of activity. From 3h to 72h on stream the ratio increased from 3.9 and 3.7 to 8.5 and 6.4 for the p-cresol and m-cresol, respectively. In the case of both Rh catalysts (Fig. 7B and C), the hydrogenation rate of m-cresol was around twice the rate of hydrogenation of the p-cresol after 48h. For the Rh/silica (A) catalyst, while the loss of hydrogenation activity for the p-cresol was in the same range than for Pt/silica catalyst, the loss of hydrogenation activity related to m-cresol was far more pronounced. Finally, the Rh/silica (JM) catalyst showed a loss of hydrogenation activity for both cresols up to 10h on stream followed with a constant ratio around 18 and 10 for p-cresol and m-cresol. As illustrated in Fig. 7, the evolution of 4-methylcatechol hydrogenation was less affected for the Pt/silica (A) and Rh/silica (JM) catalysts than the Rh/silica (A) catalyst. In the case of Rh/silica (A), the molar ratio of methylcatechol(5):hydrogenated products of methylcatechol (10–11) increased from 2 to 9 after 56h on steam while the ratio only increased from 2 to 2.8 for Rh/silica (JM). In contrast, the ratio slightly decreased from 2.2 to 1.4 for the Pt catalyst. While the hydrogenation of the cresols over the Pt catalyst decreased with time on stream, the hydrogenation of the catechol inversely increased leading to a constant overall selectivity to hydrogenated products. In all cases, the ratio between non hydrogenated:hydrogenated products showed that the catalysts were more active for the hydrogenation of the methylcatechol than the cresols. This suggested that the presence of vicinal alcohol favoured the adsorption of the catechol on the catalysts. 3.4 Characteristics of the Pt and Rh post-reaction catalysts Previous work had suggested that catalyst deactivation was due to carbon deposition on the surface of the catalyst with the initiation of coke formation suggested to be located at the acid site of the support [20]. As illustrated in Fig. 8 , TPO analysis of the spent catalysts clearly showed the presence of carbonaceous deposits. It is interesting to note that the Rh/silica (JM) catalyst showed the highest amount of carbon laydown yet it reached a steady state in contrast to the other catalysts. It is also notable that the two catalysts with the same support show quite similar mass loss, which could be expected if the carbon deposit was principally associated with the support. The extent of overall carbon laydown however is very low when considered as a percentage of the feed. Over the Rh/silica (JM) 0.18% of the feed was deposited on the catalyst, while for Rh/silica (A) only 0.03% was deposited. Over Pt/silica (A) the amount deposited was only 0.04% of the feed. Looking in detail at the TPO the Rh/silica (JM) catalyst showed mass loss at low temperature (∼160°C) suggesting the released of adsorbed species as there is no concomitant generation of carbon dioxide. There are weight losses resulting in carbon dioxide evolution at ∼250°C and 300°C. At these temperatures the surface species are likely to be pseudo-molecular with a significant H:C ratio. There are then two weight loss events at 445°C and 469°C, which are accompanied with carbon dioxide evolution. These weight losses reveal the presence of two similar carbonaceous deposits; the lower temperature species is unique to the Rh/silica (JM) catalyst, while the higher temperature event is common to all three catalysts. The rapidity of the weight loss at 469°C indicates fast combustion of the deposit suggesting that this deposit is hydrocarbonaceous in nature and is associated with the metal. There is a further weight loss event at 583–640°C, on all the catalysts, which is accompanied with carbon dioxide evolution. This high temperature weight loss can be associated with the combustion of graphitic species (Raman spectroscopy revealed a weak G-band at ∼1590cm−1 on all the catalysts) on the silica supports, which would be consistent with the loss in surface area as measured by BET (Table 1). The carbon content of the used catalysts was also determined by CHN analysis (Table 1) and showed the same trend as that found with the TGA. The surface area of the Rh/silica (JM) catalyst was nearly twice that of the Pt/silica and Rh/silica (A) catalysts which could explain the higher carbon deposition. Reduction of the surface areas of 20%, 30% and 43% for Rh (A), Pt (A) and Rh (JM) respectively, are attributed to the carbon blocking pores. As illustrated in Table 1, after reaction the metal dispersion was reduced in all three catalysts. The Pt catalyst showed the largest drop with metal dispersion reducing from 7.2 to 4.8% and a concomitant increase in metal crystallite size. Sintering of Pt/silica catalysts under HDO conditions has been observed in a previous study and can be explained by a weak interaction between Pt and the silica support [21]. This sintering, in conjunction with the carbon laydown, would explain the continuing loss of activity of the Pt/silica catalyst. In contrast, the metal dispersion of the Rh/silica (JM) and Rh/Silica (A) was only reduced from 2.8 to 2.6 and from 6.8 to 6.1, respectively, indicating a much stronger interaction between support and Rh metal. Finally, by the end of the reaction, the metal surface area of the Rh/silica (A) was three times higher than that of the Rh/silica (JM) catalyst, yet the p-methylguaiacol conversion was lower, indicating that there was not a simple correlation between metal surface area and activity. 4 Conclusion Both Rh/silica catalysts showed both similar deactivation profiles with a fast deactivation at early time on stream followed with slow deactivation for the Rh/silica (A) or constant activity for the Rh/silica (JM). The Pt/silica (A) catalyst showed continuous deactivation correlated with metal sintering and carbon laydown. The carbon deposit, higher in the case of the Rh/silica (JM) compared to the Pt and Rh/silica (A), could be explained by the different nature of the silica support. Detailed analysis of the product distributions with time revealed that the specific activity of the catalysts for demethylation, demethoxylation and hydrogenation were affected differently by the catalyst deactivation. The demethylation activity was the least affected by the catalyst deactivation, whereas hydrogenation activity was severely decreased for the Rh/silica (A) catalyst. This behaviour suggests that different sites are responsible for demethylation and hydrogenation activity. The Pt catalyst showed a shift of hydrogenation selectivity from cresols to 4-methylcatechol and the production of 4-methyl cyclohexan-1,2-diol. TPO analysis of the deposited carbon revealed at least three carbonaceous species on the surface of the rhodium catalysts, while only two different carbon species were detected on the platinum catalyst. Only the Rh/silica (JM) reached a prolonged steady state after 10h on stream and modelling of the kinetics of PMG HDO will be reported in a subsequent paper. Acknowledgments UK Catalysis Hub is kindly thanked for resources and support provided via our membership of the UK Catalysis Hub Consortium and funded by EPSRC (grants EP/K014706/1, EP/K014668/1, EP/K014854/1, EP/K014714/1 and EP/M013219/1). The authors thank Andy Monaghan for expert technical assistance. Appendix A Supplementary data Supplementary data associated with this article can be found, in the online version, at http://dx.doi.org/10.1016/j.apcata.2017.03.039. Appendix A Supplementary data The following are Supplementary data to this article: References [1] O.D. Mante F.A. Agblevor Green Chem. 16 2014 3364 3377 [2] M. Saidi F. Samimi D. Karimipourfard T. Nimmanwudipong B.C. Gates M.R. Rahimpour Energy Environ. Sci. 7 2014 103 129 [3] Q. Bu H. Lei A.H. Zacher L. Wang S. Ren J. Liang Y. Wei Y. Liu J. Tang Q. Zhang R. Ruan Bioresour. Technol. 124 2012 470 477 [4] A.J. Ragauskas G.T. Beckham M.J. Biddy R. Chandra F. Chen M.F. Davis B.H. Davison R.A. Dixon P. Gilna M. Keller P. Langan A.K. Naskar J.N. Saddler T.J. Tschaplinski G.A. Tuskan C.E. Wyman Science (Washington, DC, USA) 344 2014 709 [5] D.A. Ruddy J.A. Schaidle J.R. Ferrell III J. Wang L. Moens J.E. Hensley Green Chem. 16 2014 454 490 [6] W. Mu H. Ben X. Du X. Zhang F. Hu W. Liu A.J. Ragauskas Y. Deng Bioresour. Technol. 173 2014 6 10 [7] R.N. Olcese M. Bettahar D. Petitjean B. Malaman F. Giovanella A. Dufour Appl. Catal. B: Environ. 115–116 2012 63 73 [8] A. Gutierrez R.K. Kaila M.L. Honkela R. Slioor A.O.I. Krause Catal. Today 147 2009 239 246 [9] L. Zhou A. Lawal Energy Fuels 29 2015 262 272 [10] L. Zhou A. Lawal Catal. Sci. Technol. 6 2016 1442 1454 [11] T. Nimmanwudipong C. Aydin J. Lu R.C. Runnebaum K.C. Brodwater N.D. Browning D.E. Block B.C. Gates Catal. Lett. 142 2012 1190 1196 [12] X. Zhang L.J. Durndell M.A. Isaacs C.M.A. Parlett A.F. Lee K. Wilson ACS Catal. 6 2016 7409 7417 [13] H.Y. Zhao D. Li P. Bui S.T. Oyama Appl. Catal. A: Gen. 391 2016 305 310 [14] R. Chen Z. Chen B. Ma X. Hao N. Kapur J. Hyun K. Cho B. Shan Comput. Theor. Chem. 987 2012 77 83 [15] S.R. Longwitz J. Schnadt E.K. Vestergaard R.T. Vang E. Lgsgaard I. Stensgaard H. Brune F. Besenbacher J. Phys. Chem. B 108 2004 14497 14502 [16] T. Mineva N. Russo H.-J. Freund J. Phys. Chem. A 105 2001 10723 10730 [17] J. Liu R. Tao Z. Guo J.R. Regalbuto C.L. Marshall R.F. Klie J.T. Miller R.J. Meyer ChemCatChem 5 2013 3665 3672 [18] R.J. Farrauto C.H. Bartholomew Fundamentals of Industrial Catalytic Processes C.A. Hall 1997 306 311 [19] R.C. Runnebaum T. Nimmanwudipong D.E. Block B.C. Gates Catal. Sci. Technol. 2 2012 113 118 [20] M.D. Argyle C.H. Bartholomew Catalysts 5 2015 145 269 [21] A.J. Foster P.T.M. Do R.F. Lobo Top. Catal. 55 2012 118 128",
      "scopus-id": "85017274481",
      "coredata": {
        "eid": "1-s2.0-S0926860X17301485",
        "dc:description": "Hydrodeoxygenation of para-methylguaiacol using silica supported Rh or Pt catalysts was investigated using a fixed-bed reactor at 300°C, under 4 barg hydrogen and a WHSV of 2.5h−1. The activity, selectivity and deactivation of the catalysts were examined in relation to time on stream. Three catalysts were tested: 2.5% Rh/silica supplied by Johnson Matthey (JM), 2.5% Rh/silica and 1.55% Pt/silica both prepared in-house. The Rh/silica (JM) showed the best stability with steady-state reached after 6h on stream and a constant activity over 3days of reaction. In contrast the other two catalysts did not reach steady state within the timeframe of the tests, with continuous deactivation over the time on stream. Nevertheless higher coking was observed on the Rh/silica (JM) catalyst, while all three catalysts showed evidence of sintering. The Pt catalyst (A) showed higher selectivity for the production of 4-methylcatechol while the Rh catalysts were more selective toward the cresols. In all cases, complete hydrodeoxygenation of the methylguaiacol to methylcyclohexane was not observed.",
        "openArchiveArticle": "false",
        "prism:coverDate": "2017-06-05",
        "openaccessUserLicense": "http://creativecommons.org/licenses/by/4.0/",
        "prism:aggregationType": "Journal",
        "prism:url": "https://api.elsevier.com/content/article/pii/S0926860X17301485",
        "dc:creator": [
          {
            "@_fa": "true",
            "$": "Bouxin, F.P."
          },
          {
            "@_fa": "true",
            "$": "Zhang, X."
          },
          {
            "@_fa": "true",
            "$": "Kings, I.N."
          },
          {
            "@_fa": "true",
            "$": "Lee, A.F."
          },
          {
            "@_fa": "true",
            "$": "Simmons, M.J.H."
          },
          {
            "@_fa": "true",
            "$": "Wilson, K."
          },
          {
            "@_fa": "true",
            "$": "Jackson, S.D."
          }
        ],
        "link": [
          {
            "@_fa": "true",
            "@rel": "self",
            "@href": "https://api.elsevier.com/content/article/pii/S0926860X17301485"
          },
          {
            "@_fa": "true",
            "@rel": "scidir",
            "@href": "https://www.sciencedirect.com/science/article/pii/S0926860X17301485"
          }
        ],
        "dc:format": "application/json",
        "openaccessType": "Full",
        "pii": "S0926-860X(17)30148-5",
        "prism:volume": "539",
        "prism:publisher": "The Authors. Published by Elsevier B.V.",
        "dc:title": "Deactivation study of the hydrodeoxygenation of p-methylguaiacol over silica supported rhodium and platinum catalysts",
        "prism:copyright": "© 2017 The Authors. Published by Elsevier B.V.",
        "openaccess": "1",
        "prism:issn": "0926860X",
        "dcterms:subject": [
          {
            "@_fa": "true",
            "$": "Hydrodeoxygenation"
          },
          {
            "@_fa": "true",
            "$": "p-Methylguaiacol"
          },
          {
            "@_fa": "true",
            "$": "Rhodium"
          },
          {
            "@_fa": "true",
            "$": "Platinum"
          },
          {
            "@_fa": "true",
            "$": "Deactivation"
          }
        ],
        "openaccessArticle": "true",
        "prism:publicationName": "Applied Catalysis A: General",
        "openaccessSponsorType": "FundingBody",
        "prism:pageRange": "29-37",
        "prism:endingPage": "37",
        "pubType": "fla",
        "prism:coverDisplayDate": "5 June 2017",
        "prism:doi": "10.1016/j.apcata.2017.03.039",
        "prism:startingPage": "29",
        "dc:identifier": "doi:10.1016/j.apcata.2017.03.039",
        "openaccessSponsorName": "Engineering and Physical Sciences Research Council"
      },
      "objects": {
        "object": [
          {
            "@category": "thumbnail",
            "@height": "149",
            "@width": "219",
            "@_fa": "true",
            "$": "https://api.elsevier.com/content/object/eid/1-s2.0-S0926860X17301485-fx1.sml?httpAccept=%2A%2F%2A",
            "@multimediatype": "GIF image file",
            "@type": "IMAGE-THUMBNAIL",
            "@size": "9368",
            "@ref": "fx1",
            "@mimetype": "image/gif"
          },
          {
            "@category": "thumbnail",
            "@height": "164",
            "@width": "198",
            "@_fa": "true",
            "$": "https://api.elsevier.com/content/object/eid/1-s2.0-S0926860X17301485-gr1.sml?httpAccept=%2A%2F%2A",
            "@multimediatype": "GIF image file",
            "@type": "IMAGE-THUMBNAIL",
            "@size": "5385",
            "@ref": "gr1",
            "@mimetype": "image/gif"
          },
          {
            "@category": "thumbnail",
            "@height": "158",
            "@width": "219",
            "@_fa": "true",
            "$": "https://api.elsevier.com/content/object/eid/1-s2.0-S0926860X17301485-gr2.sml?httpAccept=%2A%2F%2A",
            "@multimediatype": "GIF image file",
            "@type": "IMAGE-THUMBNAIL",
            "@size": "7071",
            "@ref": "gr2",
            "@mimetype": "image/gif"
          },
          {
            "@category": "thumbnail",
            "@height": "157",
            "@width": "219",
            "@_fa": "true",
            "$": "https://api.elsevier.com/content/object/eid/1-s2.0-S0926860X17301485-gr3.sml?httpAccept=%2A%2F%2A",
            "@multimediatype": "GIF image file",
            "@type": "IMAGE-THUMBNAIL",
            "@size": "5312",
            "@ref": "gr3",
            "@mimetype": "image/gif"
          },
          {
            "@category": "thumbnail",
            "@height": "146",
            "@width": "219",
            "@_fa": "true",
            "$": "https://api.elsevier.com/content/object/eid/1-s2.0-S0926860X17301485-gr4.sml?httpAccept=%2A%2F%2A",
            "@multimediatype": "GIF image file",
            "@type": "IMAGE-THUMBNAIL",
            "@size": "5512",
            "@ref": "gr4",
            "@mimetype": "image/gif"
          },
          {
            "@category": "thumbnail",
            "@height": "162",
            "@width": "78",
            "@_fa": "true",
            "$": "https://api.elsevier.com/content/object/eid/1-s2.0-S0926860X17301485-gr5.sml?httpAccept=%2A%2F%2A",
            "@multimediatype": "GIF image file",
            "@type": "IMAGE-THUMBNAIL",
            "@size": "4033",
            "@ref": "gr5",
            "@mimetype": "image/gif"
          },
          {
            "@category": "thumbnail",
            "@height": "163",
            "@width": "67",
            "@_fa": "true",
            "$": "https://api.elsevier.com/content/object/eid/1-s2.0-S0926860X17301485-gr6.sml?httpAccept=%2A%2F%2A",
            "@multimediatype": "GIF image file",
            "@type": "IMAGE-THUMBNAIL",
            "@size": "4126",
            "@ref": "gr6",
            "@mimetype": "image/gif"
          },
          {
            "@category": "thumbnail",
            "@height": "162",
            "@width": "78",
            "@_fa": "true",
            "$": "https://api.elsevier.com/content/object/eid/1-s2.0-S0926860X17301485-gr7.sml?httpAccept=%2A%2F%2A",
            "@multimediatype": "GIF image file",
            "@type": "IMAGE-THUMBNAIL",
            "@size": "3054",
            "@ref": "gr7",
            "@mimetype": "image/gif"
          },
          {
            "@category": "thumbnail",
            "@height": "163",
            "@width": "109",
            "@_fa": "true",
            "$": "https://api.elsevier.com/content/object/eid/1-s2.0-S0926860X17301485-gr8.sml?httpAccept=%2A%2F%2A",
            "@multimediatype": "GIF image file",
            "@type": "IMAGE-THUMBNAIL",
            "@size": "6027",
            "@ref": "gr8",
            "@mimetype": "image/gif"
          },
          {
            "@category": "standard",
            "@height": "200",
            "@width": "293",
            "@_fa": "true",
            "$": "https://api.elsevier.com/content/object/eid/1-s2.0-S0926860X17301485-fx1.jpg?httpAccept=%2A%2F%2A",
            "@multimediatype": "JPEG image file",
            "@type": "IMAGE-DOWNSAMPLED",
            "@size": "16079",
            "@ref": "fx1",
            "@mimetype": "image/jpeg"
          },
          {
            "@category": "standard",
            "@height": "529",
            "@width": "640",
            "@_fa": "true",
            "$": "https://api.elsevier.com/content/object/eid/1-s2.0-S0926860X17301485-gr1.jpg?httpAccept=%2A%2F%2A",
            "@multimediatype": "JPEG image file",
            "@type": "IMAGE-DOWNSAMPLED",
            "@size": "51883",
            "@ref": "gr1",
            "@mimetype": "image/jpeg"
          },
          {
            "@category": "standard",
            "@height": "461",
            "@width": "640",
            "@_fa": "true",
            "$": "https://api.elsevier.com/content/object/eid/1-s2.0-S0926860X17301485-gr2.jpg?httpAccept=%2A%2F%2A",
            "@multimediatype": "JPEG image file",
            "@type": "IMAGE-DOWNSAMPLED",
            "@size": "45541",
            "@ref": "gr2",
            "@mimetype": "image/jpeg"
          },
          {
            "@category": "standard",
            "@height": "350",
            "@width": "489",
            "@_fa": "true",
            "$": "https://api.elsevier.com/content/object/eid/1-s2.0-S0926860X17301485-gr3.jpg?httpAccept=%2A%2F%2A",
            "@multimediatype": "JPEG image file",
            "@type": "IMAGE-DOWNSAMPLED",
            "@size": "27514",
            "@ref": "gr3",
            "@mimetype": "image/jpeg"
          },
          {
            "@category": "standard",
            "@height": "250",
            "@width": "376",
            "@_fa": "true",
            "$": "https://api.elsevier.com/content/object/eid/1-s2.0-S0926860X17301485-gr4.jpg?httpAccept=%2A%2F%2A",
            "@multimediatype": "JPEG image file",
            "@type": "IMAGE-DOWNSAMPLED",
            "@size": "19224",
            "@ref": "gr4",
            "@mimetype": "image/jpeg"
          },
          {
            "@category": "standard",
            "@height": "783",
            "@width": "376",
            "@_fa": "true",
            "$": "https://api.elsevier.com/content/object/eid/1-s2.0-S0926860X17301485-gr5.jpg?httpAccept=%2A%2F%2A",
            "@multimediatype": "JPEG image file",
            "@type": "IMAGE-DOWNSAMPLED",
            "@size": "55503",
            "@ref": "gr5",
            "@mimetype": "image/jpeg"
          },
          {
            "@category": "standard",
            "@height": "913",
            "@width": "376",
            "@_fa": "true",
            "$": "https://api.elsevier.com/content/object/eid/1-s2.0-S0926860X17301485-gr6.jpg?httpAccept=%2A%2F%2A",
            "@multimediatype": "JPEG image file",
            "@type": "IMAGE-DOWNSAMPLED",
            "@size": "77153",
            "@ref": "gr6",
            "@mimetype": "image/jpeg"
          },
          {
            "@category": "standard",
            "@height": "782",
            "@width": "376",
            "@_fa": "true",
            "$": "https://api.elsevier.com/content/object/eid/1-s2.0-S0926860X17301485-gr7.jpg?httpAccept=%2A%2F%2A",
            "@multimediatype": "JPEG image file",
            "@type": "IMAGE-DOWNSAMPLED",
            "@size": "42001",
            "@ref": "gr7",
            "@mimetype": "image/jpeg"
          },
          {
            "@category": "standard",
            "@height": "732",
            "@width": "489",
            "@_fa": "true",
            "$": "https://api.elsevier.com/content/object/eid/1-s2.0-S0926860X17301485-gr8.jpg?httpAccept=%2A%2F%2A",
            "@multimediatype": "JPEG image file",
            "@type": "IMAGE-DOWNSAMPLED",
            "@size": "85056",
            "@ref": "gr8",
            "@mimetype": "image/jpeg"
          },
          {
            "@category": "high",
            "@height": "886",
            "@width": "1300",
            "@_fa": "true",
            "$": "https://api.elsevier.com/content/object/eid/1-s2.0-S0926860X17301485-fx1_lrg.jpg?httpAccept=%2A%2F%2A",
            "@multimediatype": "JPEG image file",
            "@type": "IMAGE-HIGH-RES",
            "@size": "114630",
            "@ref": "fx1",
            "@mimetype": "image/jpeg"
          },
          {
            "@category": "high",
            "@height": "2340",
            "@width": "2833",
            "@_fa": "true",
            "$": "https://api.elsevier.com/content/object/eid/1-s2.0-S0926860X17301485-gr1_lrg.jpg?httpAccept=%2A%2F%2A",
            "@multimediatype": "JPEG image file",
            "@type": "IMAGE-HIGH-RES",
            "@size": "380551",
            "@ref": "gr1",
            "@mimetype": "image/jpeg"
          },
          {
            "@category": "high",
            "@height": "2042",
            "@width": "2833",
            "@_fa": "true",
            "$": "https://api.elsevier.com/content/object/eid/1-s2.0-S0926860X17301485-gr2_lrg.jpg?httpAccept=%2A%2F%2A",
            "@multimediatype": "JPEG image file",
            "@type": "IMAGE-HIGH-RES",
            "@size": "406558",
            "@ref": "gr2",
            "@mimetype": "image/jpeg"
          },
          {
            "@category": "high",
            "@height": "1550",
            "@width": "2167",
            "@_fa": "true",
            "$": "https://api.elsevier.com/content/object/eid/1-s2.0-S0926860X17301485-gr3_lrg.jpg?httpAccept=%2A%2F%2A",
            "@multimediatype": "JPEG image file",
            "@type": "IMAGE-HIGH-RES",
            "@size": "193185",
            "@ref": "gr3",
            "@mimetype": "image/jpeg"
          },
          {
            "@category": "high",
            "@height": "1108",
            "@width": "1667",
            "@_fa": "true",
            "$": "https://api.elsevier.com/content/object/eid/1-s2.0-S0926860X17301485-gr4_lrg.jpg?httpAccept=%2A%2F%2A",
            "@multimediatype": "JPEG image file",
            "@type": "IMAGE-HIGH-RES",
            "@size": "134947",
            "@ref": "gr4",
            "@mimetype": "image/jpeg"
          },
          {
            "@category": "high",
            "@height": "3471",
            "@width": "1667",
            "@_fa": "true",
            "$": "https://api.elsevier.com/content/object/eid/1-s2.0-S0926860X17301485-gr5_lrg.jpg?httpAccept=%2A%2F%2A",
            "@multimediatype": "JPEG image file",
            "@type": "IMAGE-HIGH-RES",
            "@size": "391115",
            "@ref": "gr5",
            "@mimetype": "image/jpeg"
          },
          {
            "@category": "high",
            "@height": "4049",
            "@width": "1667",
            "@_fa": "true",
            "$": "https://api.elsevier.com/content/object/eid/1-s2.0-S0926860X17301485-gr6_lrg.jpg?httpAccept=%2A%2F%2A",
            "@multimediatype": "JPEG image file",
            "@type": "IMAGE-HIGH-RES",
            "@size": "561279",
            "@ref": "gr6",
            "@mimetype": "image/jpeg"
          },
          {
            "@category": "high",
            "@height": "3466",
            "@width": "1667",
            "@_fa": "true",
            "$": "https://api.elsevier.com/content/object/eid/1-s2.0-S0926860X17301485-gr7_lrg.jpg?httpAccept=%2A%2F%2A",
            "@multimediatype": "JPEG image file",
            "@type": "IMAGE-HIGH-RES",
            "@size": "276073",
            "@ref": "gr7",
            "@mimetype": "image/jpeg"
          },
          {
            "@category": "high",
            "@height": "3243",
            "@width": "2167",
            "@_fa": "true",
            "$": "https://api.elsevier.com/content/object/eid/1-s2.0-S0926860X17301485-gr8_lrg.jpg?httpAccept=%2A%2F%2A",
            "@multimediatype": "JPEG image file",
            "@type": "IMAGE-HIGH-RES",
            "@size": "638950",
            "@ref": "gr8",
            "@mimetype": "image/jpeg"
          },
          {
            "@category": "standard",
            "@_fa": "true",
            "$": "https://api.elsevier.com/content/object/eid/1-s2.0-S0926860X17301485-mmc1.docx?httpAccept=%2A%2F%2A",
            "@multimediatype": "Microsoft Word file",
            "@type": "APPLICATION",
            "@size": "19815",
            "@ref": "mmc1",
            "@mimetype": "application/word"
          }
        ]
      },
      "link": {
        "@rel": "abstract",
        "@href": "https://api.elsevier.com/content/abstract/scopus_id/85017274481"
      }
    }
  }
}