{
  "metadata": {
    "title": "1,3-Butadiene production from aqueous ethanol over ZnO/MgO-SiO<ce:inf loc=post>2</ce:inf> catalysts: Insight into H<ce:inf loc=post>2</ce:inf>O effect on catalytic performance",
    "authors": "; ; ",
    "journal": "Applied Catalysis A: General",
    "date": "2021-04-25",
    "doi": "10.1016/j.apcata.2021.118081",
    "abstract": "",
    "uri": "https://api.elsevier.com/content/article/pii/S0926860X21000958",
    "pii": "S0926860X21000958"
  },
  "fulltext": {
    "full-text-retrieval-response": {
      "scopus-eid": "2-s2.0-85102903792",
      "originalText": "serial JL 271346 291210 291744 291809 31 Applied Catalysis A: General APPLIEDCATALYSISAGENERAL 2021-03-16 2021-03-16 2021-03-21 2021-03-21 2021-04-14T00:52:17 1-s2.0-S0926860X21000958 S0926-860X(21)00095-8 S0926860X21000958 10.1016/j.apcata.2021.118081 S300 S300.1 FULL-TEXT 1-s2.0-S0926860X21X00063 2024-01-01T12:34:28.416125Z 0 0 20210425 2021 2021-03-16T16:26:32.447633Z absattachment articleinfo articlenumber articletitlenorm authfirstinitialnorm authfirstsurnamenorm cid cids contenttype copyright crossmark dateloaded dateloadedtxt datesearch datesort dateupdated dco docsubtype doctype doi eid ewtransactionid hubeid indexeddate issn issnnorm itemstage itemtransactionid itemweight openaccess openarchive pg pgfirst pii piinorm pubdatestart pubdatetxt pubyr sortorder srctitle srctitlenorm srctype ssids alllist content subj subheadings suppl tomb volfirst volissue volumelist webpdf webpdfpagecount yearnav figure table e-component body mmlmath acknowledge affil appendices articletitle auth authfirstini authfull authkeywords authlast footnotes grantnumber grantsponsor grantsponsorid highlightsabst orcid primabst ref specialabst 0926-860X 0926860X true 616 616 C Volume 616 13 118081 118081 118081 20210425 25 April 2021 2021-04-25 2021 article fla © 2021 Elsevier B.V. All rights reserved. 13BUTADIENEPRODUCTIONAQUEOUSETHANOLOVERZNOMGOSIO2CATALYSTSINSIGHTH2OEFFECTCATALYTICPERFORMANCE KYRIIENKO P 1 Introduction 2 Experimental 2.1 Catalyst preparation 2.2 Catalyst characterization 2.3 Catalytic activity measurement 3 Results and discussion 3.1 Acid-base characteristics of ZnO/MgO-SiO2 catalysts 3.2 Catalytic properties of ZnO/MgO-SiO2 samples in ethanol-water mixture conversion 3.3 Water vapor effect on functional properties of ZnO/MgO-SiO2 catalysts 4 Conclusions CRediT authorship contribution statement Acknowledgements Appendix A Supplementary data References SHELDON 2017 18 43 R PANG 2019 89 191 J CESPI 2016 1625 1638 D FARZAD 2017 37 48 S MAKSHINA 2014 7917 7953 E POMALAZA 2016 203 G KYRIIENKO 2020 213 242 P BINSAMSUDIN 2020 4199 4214 I CAI 2018 137 143 D TALALAY 1942 403 429 A BHATTACHARYYA 1963 45 51 S VELASQUEZOCHOA 2016 1653 1663 J LARINA 2019 3964 3978 O LARINA 2019 903 915 O LARINA 2020 16600 16611 O KYRIIENKO 2020 329 337 P CABELLOGONZALEZ 2019 263 272 G KYRIIENKO 2019 241 247 P ZHU 2016 722 733 Q ZHANG 2018 34069 34077 M HUANG 2017 168 180 X TAIFAN 2018 20894 20906 W TAIFAN 2019 269 285 W HAYASHI 2016 25191 25209 Y JANSSENS 2015 994 1008 W ANGELICI 2015 6005 6015 C LARINA 2016 387 393 O WANG 2020 117565 X DAROS 2017 988 1000 S POMALAZA 2020 4860 4911 G MAKSHINA 2012 338 344 E ANGELICI 2014 2505 2515 C SHYLESH 2016 1462 1472 S LARINA 2015 1162 1168 O VELASQUEZOCHOA 2017 2128 2135 J SZABO 2020 110984 B GUNKO 1998 161 179 V GUNKO 2005 427 445 V CHAGAS 2019 5625 5632 L SILVESTER 2017 2250 2261 L KVISLE 1988 117 131 S LARINA 2015 252 258 O CONNELL 1987 285 298 G GOERNE 1998 1043 1047 T LARINA 2015 1162 1168 O LI 2019 1 9 S ANGELICI 2015 2869 2879 C CHUNG 2016 4034 4045 S DAROS 2016 2376 2386 S ANGELICI 2013 1595 1614 C DICOSIMO 1996 149 166 J HENDERSON 2002 1 308 M SHIMIZU 2005 131 138 K COENEN 2021 228 239 K HE 2018 1097 1100 R YAN 2018 2760 2773 T KYRIIENKOX2021X118081 KYRIIENKOX2021X118081XP 2023-03-21T00:00:00.000Z 2023-03-21T00:00:00.000Z http://creativecommons.org/licenses/by-nc-nd/4.0/ © 2021 Elsevier B.V. All rights reserved. 2022-06-07T00:40:45.078Z http://vtw.elsevier.com/data/voc/AddOnTypes/50.7/aggregated-refined National Academy of Sciences of Ukraine 0119U101562 0119U102378 0120U101212 NASU National Academy of Sciences of Ukraine http://data.elsevier.com/vocabulary/SciValFunders/501100004742 http://sws.geonames.org/690791/ This work was financially supported by program of The National Academy of Sciences of Ukraine KPKVK 6541230 “Support for the development of priority areas of scientific research” (0120U101212) and KPKVK 6541030 “New functional substances and materials of chemical production” (0119U101562) and “Influence of structural dimensional and acid-base characteristics of Cu (Zn, Ag)/La (Zr)-SiO2, CuNi/Mg (Ce)-Al2O3 catalysts on their functional properties in the conversion of bioethanol into valuable products” (0119U102378). https://doi.org/10.15223/policy-017 https://doi.org/10.15223/policy-037 https://doi.org/10.15223/policy-012 https://doi.org/10.15223/policy-029 https://doi.org/10.15223/policy-004 item S0926-860X(21)00095-8 S0926860X21000958 1-s2.0-S0926860X21000958 10.1016/j.apcata.2021.118081 271346 2024-01-01T12:34:28.416125Z 2021-04-25 1-s2.0-S0926860X21000958-main.pdf https://s3-eu-west-1.amazonaws.com/prod-ucs-content-store-eu-west/content/pii:S0926860X21000958/MAIN/application/pdf/46d1dae0e6b371b8203325379635356f/main.pdf main.pdf pdf true 4697369 MAIN 12 1-s2.0-S0926860X21000958-main_1.png https://s3-eu-west-1.amazonaws.com/prod-ucs-content-store-eu-west/content/pii:S0926860X21000958/PREVIEW/image/png/3198d38d1d25a88743bf6015f835e16b/main_1.png main_1.png png 58106 849 656 IMAGE-WEB-PDF 1 1-s2.0-S0926860X21000958-gr1.jpg https://s3-eu-west-1.amazonaws.com/prod-ucs-content-store-eu-west/content/pii:S0926860X21000958/gr1/DOWNSAMPLED/image/jpeg/e8f2d5fede626ecb3280396e01a21a54/gr1.jpg gr1 gr1.jpg jpg 53012 314 491 IMAGE-DOWNSAMPLED 1-s2.0-S0926860X21000958-gr3.jpg https://s3-eu-west-1.amazonaws.com/prod-ucs-content-store-eu-west/content/pii:S0926860X21000958/gr3/DOWNSAMPLED/image/jpeg/8d85b17255317e232fe67a3e5d161ee7/gr3.jpg gr3 gr3.jpg jpg 50399 743 340 IMAGE-DOWNSAMPLED 1-s2.0-S0926860X21000958-ga1.jpg https://s3-eu-west-1.amazonaws.com/prod-ucs-content-store-eu-west/content/pii:S0926860X21000958/ga1/DOWNSAMPLED/image/jpeg/c55f309348a12fd24befdf586d9e76fb/ga1.jpg ga1 true ga1.jpg jpg 19311 200 325 IMAGE-DOWNSAMPLED 1-s2.0-S0926860X21000958-gr2.jpg https://s3-eu-west-1.amazonaws.com/prod-ucs-content-store-eu-west/content/pii:S0926860X21000958/gr2/DOWNSAMPLED/image/jpeg/7ab991585acdeec92aa4c3736262942d/gr2.jpg gr2 gr2.jpg jpg 33654 322 378 IMAGE-DOWNSAMPLED 1-s2.0-S0926860X21000958-gr9.jpg https://s3-eu-west-1.amazonaws.com/prod-ucs-content-store-eu-west/content/pii:S0926860X21000958/gr9/DOWNSAMPLED/image/jpeg/54291f08dc4eef72b36dc9a8c1f82838/gr9.jpg gr9 gr9.jpg jpg 48094 346 566 IMAGE-DOWNSAMPLED 1-s2.0-S0926860X21000958-gr8.jpg https://s3-eu-west-1.amazonaws.com/prod-ucs-content-store-eu-west/content/pii:S0926860X21000958/gr8/DOWNSAMPLED/image/jpeg/b9462a53d3330f24616cae929f13c08e/gr8.jpg gr8 gr8.jpg jpg 34501 502 303 IMAGE-DOWNSAMPLED 1-s2.0-S0926860X21000958-fx1.jpg https://s3-eu-west-1.amazonaws.com/prod-ucs-content-store-eu-west/content/pii:S0926860X21000958/fx1/DOWNSAMPLED/image/jpeg/936a56f9ba6c57400acad04b60fe9def/fx1.jpg fx1 fx1.jpg jpg 6120 47 479 IMAGE-DOWNSAMPLED 1-s2.0-S0926860X21000958-gr5.jpg https://s3-eu-west-1.amazonaws.com/prod-ucs-content-store-eu-west/content/pii:S0926860X21000958/gr5/DOWNSAMPLED/image/jpeg/660ebae4c84bda2a3cb530d702b48c26/gr5.jpg gr5 gr5.jpg jpg 43666 420 303 IMAGE-DOWNSAMPLED 1-s2.0-S0926860X21000958-gr4.jpg https://s3-eu-west-1.amazonaws.com/prod-ucs-content-store-eu-west/content/pii:S0926860X21000958/gr4/DOWNSAMPLED/image/jpeg/1c1d46d0932e263c02447b95b531a377/gr4.jpg gr4 gr4.jpg jpg 34908 305 566 IMAGE-DOWNSAMPLED 1-s2.0-S0926860X21000958-gr7.jpg https://s3-eu-west-1.amazonaws.com/prod-ucs-content-store-eu-west/content/pii:S0926860X21000958/gr7/DOWNSAMPLED/image/jpeg/0a671b812757fb9b04ecf351fb43a774/gr7.jpg gr7 gr7.jpg jpg 27132 274 566 IMAGE-DOWNSAMPLED 1-s2.0-S0926860X21000958-gr6.jpg https://s3-eu-west-1.amazonaws.com/prod-ucs-content-store-eu-west/content/pii:S0926860X21000958/gr6/DOWNSAMPLED/image/jpeg/7212b6c0ffdf1a20be65d277a3ea33df/gr6.jpg gr6 gr6.jpg jpg 26957 281 566 IMAGE-DOWNSAMPLED 1-s2.0-S0926860X21000958-gr1.sml https://s3-eu-west-1.amazonaws.com/prod-ucs-content-store-eu-west/content/pii:S0926860X21000958/gr1/THUMBNAIL/image/gif/d55ddd12e1e439dfb08fa23d18d2b8c8/gr1.sml gr1 gr1.sml sml 8883 140 219 IMAGE-THUMBNAIL 1-s2.0-S0926860X21000958-gr3.sml https://s3-eu-west-1.amazonaws.com/prod-ucs-content-store-eu-west/content/pii:S0926860X21000958/gr3/THUMBNAIL/image/gif/8acf8b8072588ded9fd6b0bb43545b81/gr3.sml gr3 gr3.sml sml 2886 164 75 IMAGE-THUMBNAIL 1-s2.0-S0926860X21000958-ga1.sml https://s3-eu-west-1.amazonaws.com/prod-ucs-content-store-eu-west/content/pii:S0926860X21000958/ga1/THUMBNAIL/image/gif/43380487441f5468f2df305ab84b98ff/ga1.sml ga1 true ga1.sml sml 9056 135 219 IMAGE-THUMBNAIL 1-s2.0-S0926860X21000958-gr2.sml https://s3-eu-west-1.amazonaws.com/prod-ucs-content-store-eu-west/content/pii:S0926860X21000958/gr2/THUMBNAIL/image/gif/c6458e3a0d41482a35e761b92afdca4b/gr2.sml gr2 gr2.sml sml 8383 164 192 IMAGE-THUMBNAIL 1-s2.0-S0926860X21000958-gr9.sml https://s3-eu-west-1.amazonaws.com/prod-ucs-content-store-eu-west/content/pii:S0926860X21000958/gr9/THUMBNAIL/image/gif/2a1017588c23139e7d2acf2685950ede/gr9.sml gr9 gr9.sml sml 8610 134 219 IMAGE-THUMBNAIL 1-s2.0-S0926860X21000958-gr8.sml https://s3-eu-west-1.amazonaws.com/prod-ucs-content-store-eu-west/content/pii:S0926860X21000958/gr8/THUMBNAIL/image/gif/e38cca8c15d3d281dec7dffe4030bae7/gr8.sml gr8 gr8.sml sml 5205 164 99 IMAGE-THUMBNAIL 1-s2.0-S0926860X21000958-fx1.sml https://s3-eu-west-1.amazonaws.com/prod-ucs-content-store-eu-west/content/pii:S0926860X21000958/fx1/THUMBNAIL/image/gif/47589b9801ab2a748e2684aaba00927b/fx1.sml fx1 fx1.sml sml 1465 21 219 IMAGE-THUMBNAIL 1-s2.0-S0926860X21000958-gr5.sml https://s3-eu-west-1.amazonaws.com/prod-ucs-content-store-eu-west/content/pii:S0926860X21000958/gr5/THUMBNAIL/image/gif/1a854a7cb791176bfe20ce6c35228d9f/gr5.sml gr5 gr5.sml sml 6462 164 118 IMAGE-THUMBNAIL 1-s2.0-S0926860X21000958-gr4.sml https://s3-eu-west-1.amazonaws.com/prod-ucs-content-store-eu-west/content/pii:S0926860X21000958/gr4/THUMBNAIL/image/gif/081966380425b75820e56accff442403/gr4.sml gr4 gr4.sml sml 8371 118 219 IMAGE-THUMBNAIL 1-s2.0-S0926860X21000958-gr7.sml https://s3-eu-west-1.amazonaws.com/prod-ucs-content-store-eu-west/content/pii:S0926860X21000958/gr7/THUMBNAIL/image/gif/a76bae59f070ab8953163d497cc34680/gr7.sml gr7 gr7.sml sml 6085 106 219 IMAGE-THUMBNAIL 1-s2.0-S0926860X21000958-gr6.sml https://s3-eu-west-1.amazonaws.com/prod-ucs-content-store-eu-west/content/pii:S0926860X21000958/gr6/THUMBNAIL/image/gif/9cc48021795451f14a60a14acbb727f2/gr6.sml gr6 gr6.sml sml 6217 109 219 IMAGE-THUMBNAIL 1-s2.0-S0926860X21000958-gr1_lrg.jpg https://s3-eu-west-1.amazonaws.com/prod-ucs-content-store-eu-west/content/pii:S0926860X21000958/gr1/HIGHRES/image/jpeg/155dda91017f7953ab6b2d950f934fce/gr1_lrg.jpg gr1 gr1_lrg.jpg jpg 517441 1389 2175 IMAGE-HIGH-RES 1-s2.0-S0926860X21000958-gr3_lrg.jpg https://s3-eu-west-1.amazonaws.com/prod-ucs-content-store-eu-west/content/pii:S0926860X21000958/gr3/HIGHRES/image/jpeg/5d016df412b686cfe71529909248344f/gr3_lrg.jpg gr3 gr3_lrg.jpg jpg 519474 3294 1508 IMAGE-HIGH-RES 1-s2.0-S0926860X21000958-ga1_lrg.jpg https://s3-eu-west-1.amazonaws.com/prod-ucs-content-store-eu-west/content/pii:S0926860X21000958/ga1/HIGHRES/image/jpeg/236332fa9babf7e75968072f0515bffe/ga1_lrg.jpg ga1 true ga1_lrg.jpg jpg 176875 886 1442 IMAGE-HIGH-RES 1-s2.0-S0926860X21000958-gr2_lrg.jpg https://s3-eu-west-1.amazonaws.com/prod-ucs-content-store-eu-west/content/pii:S0926860X21000958/gr2/HIGHRES/image/jpeg/be478082950b83fabd4d67f6ca5f3aa4/gr2_lrg.jpg gr2 gr2_lrg.jpg jpg 239685 1429 1675 IMAGE-HIGH-RES 1-s2.0-S0926860X21000958-gr9_lrg.jpg https://s3-eu-west-1.amazonaws.com/prod-ucs-content-store-eu-west/content/pii:S0926860X21000958/gr9/HIGHRES/image/jpeg/5bc7b220a60cdfd329a06a367472373b/gr9_lrg.jpg gr9 gr9_lrg.jpg jpg 373785 1535 2508 IMAGE-HIGH-RES 1-s2.0-S0926860X21000958-gr8_lrg.jpg https://s3-eu-west-1.amazonaws.com/prod-ucs-content-store-eu-west/content/pii:S0926860X21000958/gr8/HIGHRES/image/jpeg/2f695a24f2b7dde9bf1270da3dc67abf/gr8_lrg.jpg gr8 gr8_lrg.jpg jpg 271581 2221 1341 IMAGE-HIGH-RES 1-s2.0-S0926860X21000958-fx1_lrg.jpg https://s3-eu-west-1.amazonaws.com/prod-ucs-content-store-eu-west/content/pii:S0926860X21000958/fx1/HIGHRES/image/jpeg/ad34da701e83ff76da55c21d158a1fd4/fx1_lrg.jpg fx1 fx1_lrg.jpg jpg 42543 208 2123 IMAGE-HIGH-RES 1-s2.0-S0926860X21000958-gr5_lrg.jpg https://s3-eu-west-1.amazonaws.com/prod-ucs-content-store-eu-west/content/pii:S0926860X21000958/gr5/HIGHRES/image/jpeg/dbaab16e107b95e32e5a378083f96b38/gr5_lrg.jpg gr5 gr5_lrg.jpg jpg 356821 1861 1341 IMAGE-HIGH-RES 1-s2.0-S0926860X21000958-gr4_lrg.jpg https://s3-eu-west-1.amazonaws.com/prod-ucs-content-store-eu-west/content/pii:S0926860X21000958/gr4/HIGHRES/image/jpeg/cbbd2300ce6c513d64b92d0f97c66907/gr4_lrg.jpg gr4 gr4_lrg.jpg jpg 253210 1351 2508 IMAGE-HIGH-RES 1-s2.0-S0926860X21000958-gr7_lrg.jpg https://s3-eu-west-1.amazonaws.com/prod-ucs-content-store-eu-west/content/pii:S0926860X21000958/gr7/HIGHRES/image/jpeg/96aeac0582b48bc7da20b4deb774b663/gr7_lrg.jpg gr7 gr7_lrg.jpg jpg 207701 1212 2508 IMAGE-HIGH-RES 1-s2.0-S0926860X21000958-gr6_lrg.jpg https://s3-eu-west-1.amazonaws.com/prod-ucs-content-store-eu-west/content/pii:S0926860X21000958/gr6/HIGHRES/image/jpeg/16e175fb6af9862c5602ecfec70b0097/gr6_lrg.jpg gr6 gr6_lrg.jpg jpg 205730 1243 2508 IMAGE-HIGH-RES 1-s2.0-S0926860X21000958-mmc1.docx https://s3-eu-west-1.amazonaws.com/prod-ucs-content-store-eu-west/content/pii:S0926860X21000958/mmc1/MAIN/application/vnd.openxmlformats-officedocument.wordprocessingml.document/9c35018de962fab1b5d2d143b24dd116/mmc1.docx mmc1 mmc1.docx docx 2929291 APPLICATION 1-s2.0-S0926860X21000958-si1.svg https://s3-eu-west-1.amazonaws.com/prod-ucs-content-store-eu-west/content/pii:S0926860X21000958/STRIPIN/image/svg+xml/ab14b7b75550bcf007557b39cf999558/si1.svg si1 si1.svg svg 18568 ALTIMG 1-s2.0-S0926860X21000958-si2.svg https://s3-eu-west-1.amazonaws.com/prod-ucs-content-store-eu-west/content/pii:S0926860X21000958/STRIPIN/image/svg+xml/5ee914beaf5fa53194b62452738c64b4/si2.svg si2 si2.svg svg 10227 ALTIMG 1-s2.0-S0926860X21000958-si3.svg https://s3-eu-west-1.amazonaws.com/prod-ucs-content-store-eu-west/content/pii:S0926860X21000958/STRIPIN/image/svg+xml/badf80d7e9ec2364fab93ed017c25b30/si3.svg si3 si3.svg svg 7091 ALTIMG 1-s2.0-S0926860X21000958-si4.svg https://s3-eu-west-1.amazonaws.com/prod-ucs-content-store-eu-west/content/pii:S0926860X21000958/STRIPIN/image/svg+xml/4c836dd350d5bd4797bcbda31056cf63/si4.svg si4 si4.svg svg 7334 ALTIMG 1-s2.0-S0926860X21000958-si5.svg https://s3-eu-west-1.amazonaws.com/prod-ucs-content-store-eu-west/content/pii:S0926860X21000958/STRIPIN/image/svg+xml/1a5469c50a745dca390869093c65d3e2/si5.svg si5 si5.svg svg 2910 ALTIMG 1-s2.0-S0926860X21000958-am.pdf am am.pdf pdf 3279481 AAM-PDF https://s3-eu-west-1.amazonaws.com/prod-ucs-content-store-eu-west/content/egi:100D8DP66QB/MAIN/application/pdf/dd80fe92fe46cda9e4f46145630bba3b/am.pdf APCATA 118081 118081 S0926-860X(21)00095-8 10.1016/j.apcata.2021.118081 Elsevier B.V. Fig. 1 CO2-OPTPD (А) and NH3-OPTPD (B) profiles of the samples: 1 – ZnO/MgO, 2 – ZnO/MgO-SiO2 (3:1), 3 – ZnO/MgO-SiO2 (1:1), 4 – ZnO/MgO-SiO2 (1:3), 5 – ZnO/SiO2. Fig. 1 Fig. 2 FTIR spectra of pyridine adsorbed on the studied samples after desorption at 423 K. Fig. 2 Fig. 3 The yields of 1,3-butadiene (A), acetaldehyde (B), ethylene + diethyl ether (C) in the conversion of 96 vol% ethanol and ethanol-water mixture (80 vol% ethanol) over ZnO/MgO-SiO2 catalysts. The yield values for the conversion of 96 % ethanol were calculated according to the data [47]. Reaction conditions: WHSV = 1 gEtOH·gcat −1 h−1, T =648 K, time-on-stream = 1-5 h. Fig. 3 Fig. 4 The formation rates of propylene and acetone versus time on stream in isopropanol conversion reaction (A) and the signals of the reagents and reaction products in the isopropanol-TPSR (B) over ZnO/MgO-SiO2 (1:1) catalyst. Fig. 4 Fig. 5 H2O-OPTPD profiles of the samples: 1 – ZnO/MgO, 2 – ZnO/MgO-SiO2 (3:1), 3 – ZnO/MgO-SiO2 (1:1), 4 – ZnO/MgO-SiO2 (1:3), 5 – ZnO/SiO2. Fig. 5 Fig. 6 NH3/H2O-OPTPD profiles of the catalyst samples: the signals of NH3 (А) and H2O (B). Fig. 6 Fig. 7 CO2/H2O-OPTPD profiles of the catalyst samples: the signals of CO2 (А) and H2O (B). Fig. 7 Fig. 8 FTIR spectra of adsorbed H2O and CO2 after H2O pre-adsorption on ZnO/MgO-SiO2 (1:1) catalyst at different desorption temperatures. Fig. 8 Fig. 9 The signals of the reagents and reaction products in the EtOH-TPSR over ZnO/MgO-SiO2 (1:1) in the presence of: A – 96 vol% ethanol; B – ethanol-water mixture (80 vol% ethanol). Fig. 9 Table 1 Acid-base characteristics of ZnO/MgO-SiO2 samples. Table 1 Sample Tmax, K Eb, kJ mol−1 Basicity, a a.u. a Tmax, K Ea, kJ mol−1 Acidity, a a.u. a ZnO/MgO 414 93 0.456 374 98 0.087 493 118 0.286 405 104 0.066 604 153 0.258 464 111 0.078 Total 1.000 0.231 ZnO/MgO-SiO2 (3:1) 405 102 0.124 383 104 0.080 444 109 0.163 447 115 0.245 550 123 0.285 502 129 0.367 Total 0.571 0.692 ZnO/MgO-SiO2 (1:1) 394 88 0.111 391 106 0.059 448 98 0.137 449 116 0.452 507 122 0.271 508 129 0.274 564 140 0.215 Total 0.519 1.000 ZnO/MgO-SiO2 (1:3) 392 94 0.053 404 100 0.115 438 104 0.057 457 108 0.230 515 130 0.060 566 136 0.081 Total 0.170 0.426 ZnO/SiO2 380 94 0.023 340 90 0.056 470 109 0.021 392 105 0.079 529 121 0.011 449 118 0.148 573 137 0.054 Total 0.055 0.337 a The ratio of the peak area with a certain temperature of the probe molecule desorption maximum to the peak area under the curve corresponding to the sample with maximum acidity/basicity. The deconvoluted OPTPD profiles are presented elsewhere (ESI, Figs. S1 and S2). Table 2 The indices of ethanol-water conversion over ZnO/MgO-SiO2 catalysts. Table 2 Catalysts T, К Ethanol conversion, a % Selectivity, C% 1,3-Butadiene Yield, C% 1,3-Butadiene Acetaldehyde Ethylene + Diethyl ether ZnO/MgO 648 2.7 5.8 52.2 37.0 0.2 673 5.8 6.3 48.5 44.6 0.4 698 10.4 8.8 45.0 44.2 0.9 ZnO/MgO-SiO2 (3:1) 648 16.2 62.5 23.7 10.5 10.1 673 29.2 63.8 19.9 10.9 18.6 698 38.6 61.7 15.7 12.5 23.8 ZnO/MgO-SiO2 (1:1) 648 21.9 59.8 19.3 18.5 13.1 673 36.6 59.7 15.3 20.0 21.8 698 44.8 56.2 14.8 20.8 25.2 ZnO/MgO-SiO2 (1:3) 648 13.3 34.1 30.5 35.2 4.5 673 22.5 36.1 25.3 37.5 8.1 698 38.3 37.2 21.0 38.8 14.2 ZnO/SiO2 648 13.7 16.4 50.3 34.2 2.2 673 24.7 18.3 47.8 34.0 4.5 698 32.6 18.4 45.1 36.0 6.0 a Reaction conditions: 80 vol% ethanol – 20 vol% water as a feed, WHSV = 1 gEtOH·gcat −1 h−1, time-on-stream = 1−5 h. Table 3 Water retention capacity and activation energy of H2O molecule desorption for ZnO/MgO-SiO2 samples. Table 3 Sample Tmax, K E, kJ mol−1 Water retention capacity, a a.u. ZnO/MgO 380 88 0.128 441 114 0.150 522 122 0.086 566 129 0.050 Total 0.413 ZnO/MgO-SiO2 (3:1) 373 92 0.220 415 106 0.150 539 132 0.140 Total 0.510 ZnO/MgO-SiO2 (1:1) 366 92 0.233 405 100 0.281 530 134 0.486 Total 1.000 ZnO/MgO-SiO2 (1:3) 366 92 0.161 423 105 0.230 507 120 0.045 Total 0.436 ZnO/SiO2 376 103 0.050 415 109 0.072 530 133 0.063 Total 0.185 a The ratio of the peak area with a certain temperature of the probe molecule desorption maximum to the peak area under the curve corresponding to the sample with maximum water retention capacity. The deconvoluted OPTPD profiles are presented elsewhere (ESI, Fig. S5). Table 4 Retention capacity of CO2 and H2O and activation energy of the molecule desorption during CO2/H2O-OPTPD for ZnO/MgO-SiO2 samples. Table 4 Sample Tmax, K Eb, kJ mol−1 CO2, a a.u. a Tmax, K Ea, kJ mol−1 H2O, a a.u. a ZnO/MgO 474 109 0.106 498 113 0.345 508 121 0.508 540 122 0.655 576 136 0.387 – – Total 1.000 1.000 ZnO/MgO-SiO2 (1:1) 480 110 0.050 494 112 0.173 528 124 0.142 549 127 0.567 Total 0.192 0.740 ZnO/SiO2 477 110 0.002 493 112 0.032 – – 535 125 0.077 – – 590 137 0.139 Total 0.002 0.249 a The ratio of the peak area with a certain temperature of the desorption maximum of the probe molecule to the peak area under the curve corresponding to the sample with maximum retention capacity. The deconvoluted CO2/H2O-OPTPD profiles are presented elsewhere (ESI, Fig. S6). 1,3-Butadiene production from aqueous ethanol over ZnO/MgO-SiO2 catalysts: Insight into H2O effect on catalytic performance Pavlo I. Kyriienko a * Olga V. Larina a * Dmytro Yu. Balakin b Anatolii O. Stetsuk b Yurii M. Nychiporuk c Sergiy O. Soloviev a Svitlana M. Orlyk a a L.V. Pisarzhevsky Institute of Physical Chemistry of the National Academy of Sciences of Ukraine, 31 Prosp. Nauky, 03028, Kyiv, Ukraine L.V. Pisarzhevsky Institute of Physical Chemistry of the National Academy of Sciences of Ukraine 31 Prosp. Nauky Kyiv 03028 Ukraine L.V.Pisarzhevsky Institute of Physical Chemistry of the National Academy of Sciences of Ukraine, 31 Prosp. Nauky, 03028 Kyiv, Ukraine. b Institute of Physics of the National Academy of Sciences of Ukraine, 46 Prosp. Nauky, 03028, Kyiv, Ukraine Institute of Physics of the National Academy of Sciences of Ukraine 46 Prosp. Nauky Kyiv 03028 Ukraine Institute of Physics of the National Academy of Sciences of Ukraine, 46 Prosp. Nauky, 03028 Kyiv, Ukraine. c Chuiko Institute of Surface Chemistry of the National Academy of Sciences of Ukraine, 17 General Naumov Str., Kyiv, 03164, Ukraine Chuiko Institute of Surface Chemistry of the National Academy of Sciences of Ukraine 17 General Naumov Str. Kyiv 03164 Ukraine Chuiko Institute of Surface Chemistry of the National Academy of Sciences of Ukraine, 17 General Naumov Str., Kyiv, 03164, Ukraine. ⁎ Corresponding authors. Graphical abstract A series of ZnO/MgO-SiO2 systems have been prepared and characterized by one-pass temperature-programmed desorption of CO2, NH3 and H2O, FTIR spectroscopy with adsorbed pyridine and CO2, temperature programmed surface reaction of ethanol and isopropanol, and reaction of isopropanol conversion. Effect of MgO:SiO2 ratio in the catalysts on catalytic performance in 1,3-butadiene production from aqueous ethanol have been investigated. The results indicate that hydrophilicity of ZnO/MgO-SiO2 are determined by MgO:SiO2 ratio, and chemisorption of water occurs preferably on Mg-containing sites. The presence of water in the initial ethanol leads to a decrease in formation of the CC coupling products. The hydrated sites formed in the interface of magnesia and silica remain active in the CC coupling reaction even in the presence of water. 1,3-Butadiene selectivity >60 % in the conversion of aqueous ethanol (80 vol%) is achieved in the presence of ZnO/MgO-SiO2 catalysts with the ratio of MgO:SiO2 = (1:1) and (3:1). Keywords Aqueous ethanol 1,3-Butadiene ZnO/MgO-SiO2 H2O effect 1 Introduction The development of large-volume chemical processes based on bio-raw materials to replace the processes based on fossil raw materials is considered as one of the important tasks of sustainable chemistry. The creation and improvement of CC coupling catalytic processes based on bio-alcohols is a very important direction in this field of study [1,2]. One such process is the production of 1,3-butadiene (BD) from bioethanol (ethanol-to-butadiene process, ETB-process) [3–5]. According to the recent reviews [6–9], the scheme of ethanol conversion into BD by Lebedev method involves the following reactions: i) dehydrogenation of ethanol (EtOH) to acetaldehyde, ii) aldol-crotonic condensation of acetaldehyde to produce crotonaldehyde, iii) Meerwein–Ponndorf–Verlei (MPV) reduction of crotonaldehyde by EtOH to crotyl alcohol, iv) dehydration of crotyl alcohol to produce BD. The relations between dehydrogenating and acid-base characteristics of the catalyst determine its effectivity in the ETB process. For implementation of the ETB process in industry the effect of water vapor in the feed mixture should be studied in detail [7,8], as it would help predict the viability of using more affordable concentrated (50–80 %) aqueous ethanol, which can be obtained by rapid membrane filtration of a fermentation broth [10,11]. Back in the early 1940s, Lebedev with colleagues were showed a decrease in the yield indices of BD and ethylene with increasing the water content of an ethanol-water feed mixture, while the yield of acetaldehyde increases [12]. In the recent studies on the ETB process with ethanol-water mixture as a feed in the presence of the catalysts of different oxide and zeolite nature (Lebedev industrial catalyst [12], Zn-Al [13], Mg-Si [14], Zn-Zr-Si [15], Zn-La-Zr-Si [16–18], Zn-Hf-Si [19], Ta(Zr)-BEA zeolites [17,20]) BD selectivity decreases with increasing water fraction in the input stream, while the selectivity to acetaldehyde and EtOH dehydration products (ethylene + diethyl ether (DEE)) increases. In the conversion of EtOH–AA–H2O mixture in the presence of MgO–SiO2 [21] or ZnO–ZrO2–SiO2 [22] an increase in the concentration of water vapor of the reaction mixture (RM) leads to decrease in the yield of both BD and ethylene. Based on Fourier-transform infrared (FTIR) spectroscopic results of adsorbed pyridine, Velasquez Ochoa et al. for MgO-SiO2 (at 323 K) [14] and later González et al. for ZnO-HfO2/SiO2 (at 653 K) [19] showed a possibility of the formation of a small number of Brönsted acid sites (BAS) in the presence of water vapor in the feed, that explained the increase in ethylene selectivity. Based on in situ FTIR spectroscopic results of ethanol (or acetone) and H2O co-adsorption, H2O was found to not significantly affect EtOH dehydrogenation in the conversion of ethanol-aqueous mixtures in the presence of Zn-La-Zr-Si oxide catalysts. At the reaction temperatures of 573−673 K H2O blocks Lewis acid sites (LAS), which are active sites of aldol condensation of acetaldehyde, it is a key step of the ETB process. This is consistent with the catalytic results obtained: BD selectivity decreases and acetaldehyde selectivity increases with increasing water content in the ethanol-water mixture [16]. However, there is no complete idea of the water vapor effect on the ETB process, and this issue being important in various aspects remains open. Catalysts based on MgO-SiO2 system including those doped with copper, zinc and silver are objects of study in the ETB process most frequently [8,23,32,24–31]. The activity of such catalysts largely depends on the MgO:SiO2 ratio, which affects acid-base characteristics of the catalyst surface. The introduction of metallic (Cu, Ag, Au) and oxide (ZnO, Ga2O3, In2O3) promoters of ethanol dehydrogenation into MgO-SiO2 systems contributes to increase in their activity and BD selectivity in the ETB process [27,30,33–38]. In particular, in our previous work, the relationship between the acid characteristics and catalytic properties of ZnO/MgO-SiO2 was showed [36]. The novelty of this work lies in the assessment of the catalytic behavior of ZnO/MgO-SiO2 systems when using ethanol-water mixtures in the ETB process. The purpose is to study the effect of acid-base characteristics of ZnO/MgO-SiO2 surface on its catalytic properties in the conversion of aqueous ethanol into 1,3-butadiene. This is aimed at a deeper understanding of the H2O effect on the three oxide catalyst properties in the process of BD obtaining from ethanol-water mixtures. 2 Experimental 2.1 Catalyst preparation The ZnO/MgO, ZnO/SiO2 and ZnO/MgO–SiO2 catalytic systems were prepared by impregnation of magnesium oxide, silica gel and MgO–SiO2 mixtures, respectively, with aqueous solutions of zinc acetate. The obtained samples were dried (393 K, 2 h) and calcined at (773 K, 3 h). Used MgO–SiO2 systems with different MgO:SiO2 ratio were prepared by mixing pre-milled components (fraction of <0.1 mm), namely commercial silica gel (283 m2 g−1) with commercial magnesium oxide (118 m2 g−1), followed by wet-kneading procedure, drying (393 K, 2 h) and calcination (773 K, 3 h). 2.2 Catalyst characterization The study of acid-base characteristics of the samples were performed by one-pass temperature-programmed desorption (OPTPD) of CO2 and NH3 controlled by two mass spectrometers. The experiment was carried out on an ultra-high-vacuum (UHV) installation of the “black chamber” type [39], which allows complex researches of adsorption-desorption processes on a solid surface to be made in situ. The work space of a stainless steel UHV chamber is surrounded by a double-walled jacket, which cooled with liquid nitrogen. The inner walls of this jacket facing the UHV chamber are covered with a titanium film. All this eliminates the distorting effect of secondary processes on the walls of the vacuum chamber and allows single-flight regime detection of desorbed particles from the sample surface. Desorption molecules of CO2 and NH3 from the samples controlled by the time-of-flight mass spectrometer (MSX-3-PC “Electron”, Ukraine) and monopole mass spectrometer (MX7304A-PC “Selmi”, Ukraine). A distance between the sample and the mass spectrometry detector is 0.5 cm. Before adsorption of the probe molecules, the samples with a weight of 20 mg were annealed in a vacuum (a chamber pressure of 10−7 Pa) at 773 K for 1 h, and then cooled to room temperature. Adsorption of the probe molecules was carried out using CO2 and gaseous solution of NH3 in Ar for 12 h. The following desorption procedure was carried out with a heating rate of 0.3 K/sec. The adsorption/desorption experiments of water vapor (H2O-OPTPD), CO2 after H2O pre-adsorption (CO2/H2O-OPTPD), and NH3 after H2O pre-adsorption (NH3/H2O-OPTPD) were performed in the same way. After activation of the sample surface by an annealing in a vacuum (a chamber pressure of 10−7 Pa) at 773 K, the adsorption of H2O was carried out using water vapor at room temperature for 2 h. Before adsorption of CO2 after H2O pre-adsorption, residual and physically adsorbed H2O molecules were removed by vacuuming. The adsorption of CO2 was carried out at room temperature for 12 h with following annealing in a vacuum at 423 K to remove residual and physically adsorbed species. Before adsorption of NH3 after H2O pre-adsorption, residual and physically adsorbed H2O molecules were removed by vacuuming at 423 K, leaving at the surface only chemisorbed H2O molecules. The adsorption of NH3 was carried out at room temperature for 12 h with following remove residual and physically adsorbed species. The following H2O-OPTPD and CO2/H2O-OPTPD procedures were carried out with a heating rate of 0.3 K/sec. NH3/H2O-OPTPD procedures were carried out with a heating rate of 0.15 K/sec. The experiments of temperature programmed surface reaction (TPSR) of ethanol and isopropanol were also performed on the UHV installation of the “black chamber” type and controlled by the time-of-flight mass spectrometer (MSX-3-PC “Electron”, Ukraine) and monopole mass spectrometer (MX7304A-PC “Selmi”, Ukraine). After the preliminary treatment (10−7 Pa, 773 K, 1 h), the samples were contacted with ethanol (96 and 80 vol%) and isopropanol at room temperature for 1 h, then temperature-programmed heating (a rate of 0.15 K/sec) simultaneously with mass spectrometric analysis of the desorption products were performed. The reaction products of ethanol-TPSR were analyzed with the following mass-to-charge (m/z) signals: 2 for H2, 18 for H2O, 26 for C2H4, 44 for C2H4O, 45 for C2H6O, 54 for C4H6, 57 for C4H8O, and 70 for C4H6O. The products of isopropanol-TPSR were identified with m/z values: 41 for C3H6, 43 and 58 for C3H6O (acetone), 45 for C3H8O (isopropanol), 55 and 83 for C6H10O (mesityl oxide), 82 for C9H14O (isophorone). The deconvolution of OPTPD profiles was performed in the Origin program. Acidity and basicity values were calculated as a ratio of the peak area with a certain temperature of the probe molecule desorption maximum to the peak area under the curve corresponding to the sample with maximum acidity/basicity. The distribution function f (Ea) of the activation energy for desorption of the probe molecules (CO2, NH3, H2O) was calculated using the integral Eq. (1) for each peak separately. (1) A ( T ) = c 1 T [ Θ ( T ) ] n 2 π σ 2 exp − ( T − T max ) 2 2 σ 2 ∫ E min E max f ( E ) exp − E R g T d E , where A – a total amount of the desorbed compound with a certain m/z; c1 – constant; σ – a half-width of the desorption peak; Tmax – a temperature of the probe molecule desorption maximum; Θ(T) – a temperature dependence of the surface coverage by the probe molecules; n – reaction order (n = 1 for molecularly adsorbed-desorbed molecules, n = 2 for associatively desorbed molecules); Emin and Emax – minimum and maximum values of activation energy (E) during integration. The Eq. (1) was solved using the CONTIN regularization procedure with an unfixed regularization parameter (calculated based on the F-test and determination of the confidence region) [39,40]. It was assumed that normalized desorption and surface coverage by the probe molecule Θ(T) satisfied the following condition: (2) ∫ T min T max A ( T ) ∫ A ( T ′ ) d T ′ + Θ ( T ) d T = 1 The nature of acid sites of the sample surface was studied by pyridine adsorption followed by infrared spectroscopy. Fourier-transform infrared (FTIR) measurements were performed on a Spectrum One FTIR spectrometer (Perkin Elmer, USA). Typically, 24 scans with a resolution of 1 cm−1 were codded to give one spectrum. The catalyst sample was pressed at ∼2 ton·cm-2 into thin wafers of ca. 12 mg·cm-2 and placed inside the IR cell. Before adsorption of pyridine, the cell was connected to a vacuum-adsorption apparatus allowing a residual pressure below 10-3 Pa. The samples were outgassed (10−3 Pa) at 693 K for 1 h. Then, pyridine was adsorbed at 423 K for 15 min. The spectra were recorded under ambient conditions after pyridine desorption at 423 K and 523 K. All measured spectra were recalculated to a “normalized” wafer weight and its surface area. In situ FTIR measurements of adsorbed H2O and CO2 after H2O pre-adsorption were performed using hand-made quartz cell equipped with NaCl windows. The sample was pressed at ∼5 ton cm−2 into thin wafers of ca. 12 mg·cm−2, placed inside the IR cell and heat-treated at 773 K in argon (Ar) constant flow (∼100 mL min−1) for 1 h. To inject water vapor into the IR cell, Ar was passed through H2O-containing gas bubbler at room temperature for 30 min. After that, the sample was heated to 373 K in the Ar flow and lasted until the intensity of the IR bands of chemisorbed H2O became unchanged. Then, the sample was cooled to room temperature and CO2-containing gas (20 vol% CO2 in Ar, 30 mL min−1) was passed through the IR cell for 30 min. To remove residual and physically adsorbed CO2, the sample was outgassed in the Ar flow for 1 h. The spectra of adsorbed molecules were recorded at different desorption temperatures. The reaction of isopropanol conversion is often used for studying acid-base properties of catalysts and their ability to promote alcohol dehydration and dehydrogenation [30,41,42]. Therefore, the acid-base properties of the samples were also evaluated using the reaction of isopropanol conversion in the absence/presence of water vapor in the feed at 573 K and atmospheric pressure. Sample (a weight of 0.01 g) with grains of 0.25–0.5 mm was loaded into a fixed-bed flow quartz reactor. Before reaction, the sample was heated to 773 K in a flow of Ar and held for 0.5 h, then cooled to the reaction temperature. The feed of 1.5 mol% isopropanol and 1.0 mol% H2O in Ar was obtained by bubbling argon through liquid isopropanol (273 K) and water (room temperature) in saturators. The gas flow rate was 2.5 std cm3 sec−1 (gas hourly space velocity of 900 000 std cm3 g−1 h−1). The isopropanol conversion value is not more than 20 %. The reagents and reaction products were analyzed on a gas chromatograph (KristalLyuks 4000 M, MetaChrome) equipped with FID detector and a capillary column (HP-FFAP, 30 m ×0.25 mm). The rates of propylene and acetone formation were calculated using the formula: r = C·F·w−1·S −1, where C is a concentration of propylene or acetone in the flow (μmol cm−3) determined by preliminary calibration of the chromatograph; F is a gas flow rate (std cm3 sec-1); w is a weight of the sample (g); S is a specific surface area of the catalyst sample, S = 158 m2 g-1 for ZnO/MgO-SiO2 (1:1). 2.3 Catalytic activity measurement Catalytic activity tests were carried out in a fixed-bed flow quartz reactor with an inner diameter of 4 mm at 648–673 K and atmospheric pressure. Samples (160 mg) with grains of 0.25–0.5 mm were loaded into the reactor. Aqueous ethanol (80 vol% EtOH) or rectified ethanol (96 vol% EtOH) feed was introduced to an evaporator via a syringe infusion pump, and argon with a flow of 7 or 7,5 mL·min−1 has carried the feed into the reactor, respectively. The aqueous ethanol containing 80 vol% EtOH was chosen based on the recent patent [11]. Reaction was carried out at weight hourly space velocity (WHSV) of 1.0 gEtOH∙gcat −1 h−1 (calculated by 100 % EtOH) and gas hourly space velocity (total volume = alcohol + water + argon) of ∼3400 std cm3·gcat −1· h−1. Before the reaction, the catalysts were annealed at 773 K under flowing argon for 1 h. The reagent and reaction products were analyzed on a gas chromatograph (KristalLyuks 4000 M, MetaChrome) equipped with FID detector and a capillary column (HP-FFAP, 50 m ×0.32 mm). Catalytic performance was characterized by EtOH conversion (X, %), selectivity (Si, %) to general products and their yield (Yi, %): X = n E t O H 0 - n E t O H n E t O H 0 ∙ 100 % , S i = n i n E t O H 0 - n E t O H ∙ 100 % , Y i = X ∙ S i 100 , where n0 EtOH is the initial amount of C1 moles of EtOH; nEtOH and ni are the amounts of C1 moles of unreacted EtOH and product i in the stream of the reaction products, respectively; 0.587 is the maximum possible amount of 1,3-BD (g) that can be produced from 1 g of EtOH from a stoichiometric equation. Carbon balance was calculated as total carbon amount in the analyzed products, divided by the initial total amount of carbon, and it was generally better than 95 %. 3 Results and discussion 3.1 Acid-base characteristics of ZnO/MgO-SiO2 catalysts Fig. 1 presents CO2-OPTPD and NH3-OPTPD profiles of the studied two- (ZnO/MgO, ZnO/SiO2) and three- (ZnO/MgO-SiO2) component catalytic systems. The acid-base characteristics of the samples, namely acidity/basicity and activation energy of the probe molecule desorption (Ea ), have been calculated based on the deconvoluted OPTPD profiles for each peak separately (see ESI, Figs. S1 and S2) and listed in Table 1 . There are weak (<100 kJ mol−1), medium strength (100–120 kJ mol−1) and strong (100–120 kJ mol−1) acid/base sites. The ZnO/MgO sample is characterized by the highest total basicity. In the case of the ZnO/MgO-SiO2 system, the number of medium and strong base sites decreases as the MgO content decreases (Table 1). The nonlinear dependence of the number and strength of the base sites on the magnesium content in the system can be attributed to the different nature/structure of the sites. Lewis base sites (LBS) could be formed by Mg-O pairs with different coordination numbers at lattice points assigning a particular geometry and Brönsted base sites (BBS) could be formed as [Mg-O(H)-Mg] and [Mg-O-Mg(OH)] surface structures [24,27]. Moreover, in the procedure for the preparation of MgO-SiO2 by wet kneading of the components, a part of base sites of the hydrated surface of magnesium oxide can interact with silica, resulting in the formation of Lewis acid sites [Mg-O-Si] [6,43,44]. Thus, the defects and, accordingly, new base sites, in particular [Mg-O(H)-Si], are formed on the surface of magnesium oxide [24,45,46]. The ZnO/SiO2 sample is characterized by the lowest total basicity, the base sites on the surface of which are due to the presence of bulk ZnO in the composition. The total basicity of ZnO/SiO2 is 20 times lower than that of ZnO/MgO. Therefore, the high basicity of ZnO/MgO and ZnO/MgO-SiO2 systems is resulted from magnesium oxide. According to NH3-OPTPD data (Fig. 1B, Table 1), ZnO/MgO-SiO2(1:1) sample is characterized by the highest total acidity. With an increase/decrease in the MgO:SiO2 ratio, the total acidity of ZnO/MgO-SiO2 decreases. Meanwhile, the values for the two-component catalytic systems are lower than those for the three-component ones. Since the acidity of ZnO/MgO is lower than those for ZnO/MgO-SiO2 samples and ZnO/SiO2, silica can be assumed to take part in the formation of acid sites on the surface of ZnO/MgO-SiO2 system. On the ZnO/SiO2 surface, acid sites can be formed only by zinc cations. High values of total acidity for ZnO/MgO-SiO2 samples in comparison with ZnO/SiO2 may indicate that on the surface of ZnO/MgO-SiO2 there are acid sites formed by both Mg- and Zn-containing species. Comparison of the acidity values of the studied samples and the activation energy E of the probe molecule (NH3) desorption reveals both ZnO and MgO to be involved in the formation of acid sites of different strength. However, a greater number of strong acid sites are formed with the participation of magnesium oxide. FTIR spectra of adsorbed pyridine for the samples under study are shown in Fig. 2 . Analysis of the spectra indicates the presence of Lewis acid sites (LAS) of various nature on the surface of two- and three-component catalytic systems, namely [Zn-O-Si] (1453 cm−1) [30,36], [Mg-O-Si] (1449 cm−1) [22,24,37] and weak acid sites of magnesium oxide (1439 cm−1) [30,38,39]. The absorption band at 1446 cm−1 can be attributed to weakly bound pyridine with hydroxyl groups on the surface [27,47]. The intensity of these absorption bands and, accordingly, the number of acid sites of a certain nature is determined by the quantitative composition of ZnO/MgO-SiO2, in particular, by the MgO:SiO2 ratio. The amount of LAS [Zn-O-Si] increases with an increase in the amount of silica in ZnO/MgO-SiO2, as indicated by an increase in the intensity of the band at 1453 cm−1. The FTIR spectrum of ZnO/SiO2 sample exhibits the most intensive absorption band at 1453 cm−1. The highest intensity of the absorption band attributed to LAS [Mg-O-Si] is observed for ZnO/MgO-SiO2(1:1) sample, while the intensity of the absorption band attributed to OH groups is low. On the contrary, the intensity of the absorption band at 1446 cm−1 is higher than that at 1449 cm−1 for the samples with the ratio of MgO:SiO2 = (3:1) and (1:3). The FTIR spectrum of ZnO/MgO sample shows low-intensity band in the absorption region of stretching vibrations of pyridine coordinated to the LAS of magnesium oxide (1439 cm−1). Thus, ZnO/MgO is characterized by the highest basicity, the number of medium and strong base sites of ZnO/MgO-SiO2 system decreases as the MgO content decreases. The tendency of acidity change in the series of the studied samples is different: the acidity of ZnO/MgO-SiO2 system decreases with an increase/decrease in the MgO:SiO2 ratio. On the surface of two- and three-component catalytic systems, there are Lewis acid sites of various nature: [Zn-O-Si], [Mg-O-Si] and weak acid sites of magnesium oxide (Mg2+). 3.2 Catalytic properties of ZnO/MgO-SiO2 samples in ethanol-water mixture conversion Table 2 shows the indices of ethanol-water mixture conversion over the studied two- (ZnO/MgO, ZnO/SiO2) and three-component (ZnO/MgO-SiO2) catalytic systems. In the presence of three-component catalysts, ethanol conversion and the selectivity of BD formation exceed those for two-component ones. At the same time, the indices of ethanol conversion in the presence of ZnO/MgO-SiO2(1:3) and ZnO/SiO2 are comparable, and BD selectivity is twice as high over the first sample. The lowest indices of the ETB process are achieved in the presence of ZnO/MgO. It can be concluded that BD formation during the conversion of an ethanol-water mixture occurs more selectively on active sites formed by Zn2+ and Mg2+ with SiO2. Similar tendencies in the change in the ETB process indices were observed during the conversion of rectified ethanol over ZnO/MgO-SiO2 catalysts (ESI, Fig. S3). The higher MgO content in ZnO/MgO-SiO2 catalyst increases the selectivity of BD formation from the ethanol-water mixture. Meanwhile, the highest values of ethanol conversion (44.8 % at T =698 K) and BD yield (25.2 %) are achieved over ZnO/MgO-SiO2(1:1) catalyst, which is characterized by the largest number of surface active sites, in particular LAS [Mg-O-Si] formed as interfacial chemical bonds in binary MgO-SiO2 system [48,49]. The similar volcano-shaped trend of BD yield with a maximum value for MgO:SiO2 = 1:1 was observed over MgO-SiO2 systems by Chung et al. [50]. By changing the selectivity of acetaldehyde formation, ZnO/MgO-SiO2 catalysts with different ratios of MgO:SiO2 are arranged in the following sequence: (1:3) > (3:1) > (1:1). The selectivity of the formation of ethanol dehydration by-products (ethylene, DEE) is higher in the presence of ZnO/MgO-SiO2(1:3) catalyst and decreases with increasing the MgO content in the catalyst. Shylesh et al. [35] for Au/MgO-SiO2 catalysts and Da Ros et al. [51] for Zr,Zn-containing MgO/SiO2 systems prepared by co-precipitation showed a similar effect of MgO:SiO2 ratio on the product selectivity during the ETB process. Fig. 3 shows the achieved yields of BD, acetaldehyde, and ethylene + DEE during the conversion of 96 vol% ethanol and an ethanol-water mixture (80 vol% ethanol) in the presence of ZnO/MgO-SiO2 catalysts with different ratios of MgO:SiO2, as well as ZnO/MgO and ZnO/SiO2. The corresponding values of ethanol conversion and product selectivity are shown in ESI, Fig. S3. These data make it possible to evaluate the unfavorable effect of water in the composition of the initial mixture on the process indices. An increase in the water content in the initial reaction mixture from 4 to 20 vol% leads to a significant decrease in BD yield over all catalyst samples under study (Fig. 3). In the presence of two-component oxide catalysts, BD yield declines due to a decrease in both ethanol conversion and BD selectivity (Fig. S3), but to varying degrees: by an order of magnitude for ZnO/MgO and ∼3 times for ZnO/SiO2. In the presence of three-component system (ZnO/MgO-SiO2), the decrease of BD yield is preferably conditioned by a decrease in ethanol conversion, rather than BD selectivity. The relative decrease in BD yield depends on the MgO content in the catalyst composition. For ZnO/MgO-SiO2(3:1) catalyst, BD yield is halved; for the catalysts with a lower MgO content, it is reduced by more than 2.5 times. Meanwhile, an inverse dependence of the yield of acetaldehyde and ethanol dehydration products on the MgO:SiO2 ratio in the catalyst is observed; the yield of these products sharply decreases for ZnO/MgO-SiO2(3:1). In the presence of ZnO/MgO-SiO2(1:3) the yield of dehydration products is twice as high during the conversion of 80 vol% ethanol-water mixture as during the conversion of 96 vol% ethanol. Herewith, for all ZnO/MgO-SiO2 catalyst samples, the selectivity to ethanol dehydration products during the conversion of the ethanol-water mixture is higher than during the conversion of rectified ethanol. Velasquez Ochoa et al. [14] showed a decrease in ethanol conversion (54 % → 23 %) and BD selectivity (27.5 % → 18 %) with the feed change from 2 mol% ethanol in N2 to 2 mol% ethanol +0.5 mol% H2O in N2 during the ETB process over MgO-SiO2 catalyst. Meanwhile, the selectivity to acetaldehyde and ethylene increased. Similar changes in the ethanol conversion and product selectivity were observed for a mixed Hf-Zn catalyst containing Hf/SiO2 and zinc-silicate hemimorphite by Cabello González et al. [19] and for Zn-La-Zr-Si oxide catalyst by Larina et al. [16]. The above mentioned works explained the unfavorable effect of water by the adsorption of H2O molecules on the LASs being active in aldol condensation of acetaldehyde. With an increase in temperature of the ETB process with 80 vol% ethanol from 648 to 698 K (Table 2), the yield of BD and ethylene increases in the presence of three-component systems, and the yield of acetaldehyde decreases. Such a change in the product content (in particular, ethylene and acetaldehyde) is consistent with thermodynamics of the key steps (reactions) of the ETB process: with an increase in temperature, ethanol dehydration becomes a more preferable reaction than its dehydrogenation [52]. When comparing the values of ethanol conversion and BD selectivity during ETB process with 96 and 80 vol% ethanol over ZnO/MgO-SiO2 catalyst with an increase in temperature (ESI, Fig. S4), it follows that high temperature partially counteracts the influence of water on ethanol-to-butadiene conversion. This is in line with the results obtained for Zn-La-Zr-Si [16] and Zn-Hf-Si [19] oxide catalysts. Moreover, the selectivity to other products during the ETB process over ZnO/MgO-SiO2 catalyst is lower when 80 vol% ethanol is used as the feed than 96 vol% ethanol (Fig. S4). Therefore, the adsorption of H2O on acid-base sites of the catalyst surface decreases the probability of occurrence of side condensation reactions through which heavy products are formed, as noted for other catalysts [17,19]. In the case of rerunning of the ETB process with different feeds (96 and 80 vol% ethanol) in the presence of ZnO/MgO-SiO2 system after intermediate calcination in airflow at 773 K, the process performance reaches again initial levels (under stationary conditions). This indicates the reversibility of the unfavorable effect of water on active sites of the catalyst. At the same time, high selectivity of the ETB process in terms of BD (>60 %) is retained over ZnO/MgO-SiO2 catalysts with a ratio of MgO:SiO2 = (1:1) and (3:1) even when the ethanol-water mixture (80 vol% ethanol) is used as a feed. 3.3 Water vapor effect on functional properties of ZnO/MgO-SiO2 catalysts As was noted in Experimental, acid-base properties of the catalysts and their ability to promote alcohol dehydration and dehydrogenation were evaluated using the reaction of isopropanol conversion. Isopropanol tends to dehydrate to propylene over surface acid site, and dehydrogenate to form acetone on surface base site. Fig. 4 A shows the formation rates of propylene and acetone versus time on stream in isopropanol conversion reaction over ZnO/MgO-SiO2 (1:1) catalyst. To evaluate water vapor effect on functional properties of the catalyst, the reaction has been studied with and without H2O in the feed. The formation rates of both products (propylene and acetone) change with time on stream. The propylene one rises slightly at first 50 min and then slowly decreases, wherein the acetone one declines drastically and become quite stable at time of stream of 180 min. The presence of H2O in the feed lead to decrease the formation rates of both propylene and acetone, herewith the tendency of change versus time on stream is saved. Thus, the quantity of both dehydrogenation and dehydration sites of the ZnO/MgO-SiO2(1:1) sample considerably decrease after H2O addition in the feed during isopropanol conversion reaction. Fig. 4B shows the signals of the reagent and reaction products in the isopropanol-TPSR over ZnO/MgO-SiO2 (1:1). The isopropanol-TPSR curves have two regions with desorption maxima at 350−450 K and above 473 K. There are the signals of the products of isopropanol conversion over dehydrogenation and dehydration sites, namely acetone and propylene [30]. The signals of mesityl oxide and isophorone are detected too. The formation of such products is possible as a result of the condensation of acetone into diacetone alcohol with further dehydration (to produce mesityl oxide) and the condensation of mesityl oxide with acetone (to produce isophorone). Since for the formation of mesityl oxide from isopropanol, the required sequence of reactions includes dehydrogenation, condensation and dehydration, strong basic sites of MgO are needed for obtaining mesityl oxide and then isophorone. However, these sites are deactivated during the reaction (at high values of time-on-stream), as noted earlier by Di Cosimo et al. [53]. It can be assumed that the decrease in the formation of acetone with time (Fig. 4A) results from the partial deactivation of strong basic sites on MgO surface. To evaluate the hydrophilic character of catalyst surface (water retention capacity), one-pass temperature-programmed desorption of water vapor (H2O-OPTPD) is often used (H2O as a probe molecule for acid sites on catalyst surface). During the chemisorption of water on the surface of oxide system, there are the formation of a strong adsorption bond between the oxygen atom of H2O and a cation site of the surface (LAS), and a strong hydrogen-bonding interaction with a surface oxygen anion (LBS) [54,55]. Fig. 5 shows H2O-OPTPD profiles of ZnO/MgO-SiO2 catalysts. The most intensive desorption peaks for all studied samples are observed in low-temperature region with a maximum at 360−380 K. In high-temperature region (above 450 K), the shape of H2O desorption peaks changes from sample to sample, and their intensity (which is characterized by the area under the curve) decreases as the MgO content in the catalyst decreases. The characteristics of the samples, namely water retention capacity and activation energy of the probe molecule (H2O) desorption (E), have been calculated based on the deconvoluted H2O-OPTPD profiles for each peak separately (see ESI, Fig. S5) and listed in Table 3 . The quantity of hydrophilic sites of the surface is estimated by total water retention capacity, and the strength of the sites is estimated by activation energy of desorption. There are weak (<100 kJ mol−1), medium strength (100–120 kJ mol−1) and strong (100–120 kJ mol−1) hydrophilic sites. The mentioned characteristics depend on the MgO content in ZnO/MgO-SiO2 system. ZnO/MgO-SiO2(1:1) is characterized by the largest number of hydrophilic surface sites, and ZnO/MgO-SiO2(3:1) contains almost half of them (Table 3). Meanwhile, the number of weak sites (E < 100 kJ mol−1), on which physical adsorption of water occurs, changes insignificantly, and the number of strong sites (E ≥ 120 kJ mol−1) decreases by about three times. For the two-component system ZnO/MgO, the relative number of the sites with Е ≥ 120 kJ mol−1 is comparable to the value for ZnO/MgO-SiO2(3:1); at the same time, weak sites (Е <100 kJ mol−1) are half of the number. For ZnO/MgO-SiO2(1:3), the relative number of the sites with Е ≥ 120 kJ mol−1 is an order of magnitude lower than for ZnO/MgO-SiO2(3:1), while the number of the sites with Е = 100−120 kJ mol−1 for these samples is comparable. For ZnO/SiO2, the number of hydrophilic sites is more than half as compared to that for MgO-containing samples. Therefore, the adsorption of water can be assumed to preferably occur on Mg-containing sites of the surface. The change in total water retention capacity depending on the MgO:SiO2 ratio in ZnO/MgO-SiO2 system (Table 3) is similar to the change in acidity (according to NH3-OPTPD results, Table 1). This may indicate the preferred adsorption of water molecules by Lewis acid sites. The high value of the relative water retention capacity for ZnO/MgO sample, especially for the sites with E ≥ 120 kJ mol−1, probably indicates the chemisorption of water molecules by the surface of magnesium oxide and the formation of [Mg-O(H)-Mg] or [MgOMgOH] sites. According to the data shown in Fig. 3 for ZnO/MgO-SiO2 catalyst, the relative decrease in BD yield during the conversion of an ethanol-water mixture (80 vol% ethanol) compared to 96 vol% ethanol increases with a decrease in the MgO content in the composition, and ZnO/MgO sample is not active in the formation of BD (AA prevails in the reaction products). The sites [Mg-O(H)-Mg] and [MgOMgOH] on the hydrated surface of individual magnesium oxide are less active in CC coupling reaction, but basic hydroxyl groups are suitable for dehydrogenation [35]. It can be assumed that hydrated sites formed with the participation of magnesium and silicon oxides remain active in CC-coupling reaction even in the presence of water in the reaction mixture. However, according to H2O-OPTPD results, the maximum temperature of water desorption from the surface of the studied systems is 648 K. Since the ETB process is carried out at higher temperatures, the effect of water on the ETB process indices can be concluded to result from the competitive adsorption of water, ethanol and intermediate reaction products on active sites of the catalyst surface. To assess an effect of the water adsorption on the acid characteristics of ZnO/MgO-SiO2 catalyst, adsorption/desorption experiments of NH3 was carried out after H2O pre-adsorption. Fig. 6 presents NH3/H2O-OPTPD profiles of ZnO/MgO-SiO2 samples with a different MgO:SiO2 ratio. 1 1 We are aware that such approach of a study and interpretation of NH3/H2O-OPTPD profiles is rather evaluative, since ammonia dissolves in water. And it is difficult to separate NH3 adsorbed on the hydrated acid sites and NH3 chemically bonded to the water chemisorbed onto magnesium oxide and silica. ZnO/MgO-SiO2(1:1) is characterized by the highest total retention capacity of NH3 and H2O both in case of their sequential adsorption (ESI, Table S1) and individual adsorption (Tables 1 and 3). The change in total NH3 retention capacity after H2O pre-adsorption, depending on the MgO:SiO2 ratio in ZnO/MgO-SiO2 system, is similar to the change in acidity (according to NH3-OPTPD results). Moreover, the values of total NH3 retention capacity after H2O pre-adsorption for ZnO/MgO-SiO2(3:1) and ZnO/MgO-SiO2(1:3) samples vis-à-vis ZnO/MgO-SiO2(1:1) are higher than the values of total acidity for these samples. It can be caused by the interaction of ammonia with a hydrated surface of MgO and silica. The higher MgO content in ZnO/MgO-SiO2 samples, the higher temperature of NH3 desorption maximum in both NH3/H2O-OPTPD (Fig. 6A) and NH3-OPTPD (Fig. 1B) profiles. Meanwhile, the higher temperatures of the NH3 desorption maxima are observed in NH3/H2O-OPTPD profiles, as opposed to NH3-OPTPD ones (Table 1 and ESI, Table S1). Therefore, there is a change in the acid characteristics of ZnO/MgO-SiO2 surface upon the water adsorption. Fig. 6B shows the signals of H2O molecules chemisorbed on the surface of ZnO/MgO-SiO2 samples and desorbed during NH3/H2O-OPTPD. To ensure only chemisorbed H2O molecules to be remained on the surface before the adsorption of NH3, the samples were evacuated at 423 K. For the sample with MgO:SiO2 ratio of (3:1), the value of total H2O retention capacity is comparable to the ZnO/MgO-SiO2(1:1) one, and for the sample with MgO:SiO2 ratio of (1:3), it is much lower (ESI, Table S1). However, the temperature of H2O desorption maxima is about 525 K for all samples. The proximity of temperatures of NH3 and H2O desorption maxima in NH3/H2O-OPTPD profiles and a similarity of the profiles, may indicate desorption of ammonia and water to lead to the destruction of the surface compounds containing both components. The higher retention capacity of H2O for the systems with MgO:SiO2 ratio of (3:1) and (1:1) is likely to be caused by the interaction of water vapor with MgO, and not just acid sites of the catalyst surface. Moreover, for ZnO/MgO-SiO2(1:1) sample, a significant amount of H2O desorbed at the temperatures above 648 K may be resulted from H2O adsorption on LAS [Mg-O-Si] and [Zn-O-Si]. To investigate the effect of competitive adsorption of water and reagents/reaction products on active sites of the catalyst surface, adsorption/desorption experiments of CO2 was performed after H2O pre-adsorption. Fig. 7 presents CO2/H2O-OPTPD profiles of the studied two- (ZnO/MgO, ZnO/SiO2) and three- (ZnO/MgO-SiO2) component catalytic systems. The hydrated surface of ZnO/MgO is characterized by the highest retention capacity of CO2 (Table 4 ), as with the OPTPD experiments without H2O pre-adsorption (Table 3). Therefore, both dehydrated and hydrated magnesium oxide in the catalyst composition is characterized by a sufficiently high basicity. The difference in the values of activation energy for CO2 desorption from the base sites in the cases of CO2-OPTPD and CO2/H2O-OPTPD may be due to the presence of BBS on the hydrated surface of ZnO/MgO catalyst. Meanwhile, ZnO/MgO sample after H2O pre-adsorption is also characterized by the highest water retention capacity. The hydrated surface of ZnO/SiO2 is characterized by the lowest retention capacity of CO2, while the water retention capacity is a quarter of that for ZnO/MgO. H2O molecules are suggested to chemisorb on the acid sites [Zn-O-Si] and on silica itself. The retention capacity of CO2 for ZnO/MgO-SiO2(1:1) sample is five times lower than for ZnO/MgO, while the water retention capacity is lower by almost one quarter. In the ZnO/MgO-SiO2 (1:1) sample a significant portion of magnesium oxide is evidenced to interact with silica to form acid sites [Mg-O-Si], and as a result, the portion of strong base sites of the hydrated surface decreases. FTIR spectra of adsorbed CO2 after H2O pre-adsorption on ZnO/MgO-SiO2 (1:1) catalyst are shown in Fig. 8 . The absorption band at 1630 cm−1 can be attributed to chemisorbed H2O molecules, as proved by its presence in FTIR spectra of adsorbed H2O. The shoulder at 1660 cm−1 and the band at 1495 cm−1 are ascribed to bicarbonates formed on weakly basic OH groups of the catalyst surface [27,35,56], and the intensity of these bands decreases with an increase in temperature. The absorption bands at 1630 cm−1 can be attributed to asymmetric stretching vibrations of OCO of bidentate carbonate species which may be formed by the interaction of CO2 with intermediate strength Mg‒O pairs. However, the absence of the band at 1340−1320 cm−1 attributable to the asymmetric stretching OCO vibrations of bidentate carbonate species may reflect their hydration followed by the formation of bicarbonates. The presence of the bands at 1530 and 1420 cm−1 assigned to asymmetric and symmetric stretching vibrations of unidentate carbonates results from CO2 interaction with strong basic O2- anions of the catalyst surface. Therefore, there are Lewis and Brönsted base sites on the hydrated surface of the ZnO/MgO-SiO2 catalyst. As known, a temperature of the maximum in the product desorption peak during temperature programmed surface reaction of ethanol over a catalyst is directly related to the strength of adsorbate-adsorbent interactions [57]. Comparing the intensities of the desorption profiles of ethanol conversion products in the presence of rectified ethanol and ethanol-water mixture allows one to estimate the effect of water vapor on the interaction of an ethanol molecule with the surface of ZnO/MgO-SiO2 (1:1). Fig. 9 shows the signals of the reagent and reaction products, namely H2, H2O, acetaldehyde, ethylene, ethanol, 1,3-butadiene, crotyl alcohol, crotonaldehyde, in the EtOH-TPSR over ZnO/MgO-SiO2 (1:1) in the presence of 96 vol% ethanol and ethanol-water mixture (80 vol% ethanol). The EtOH-TPSR curves have two regions with desorption maxima at 350−400 K and above 473 K, which was also observed for MgO-SiO2 [57], ZnO/MgO-SiO2 [30] та Zn–Y/beta [58] catalysts. The peaks in low-temperature region can be attributed to the products of dissociative adsorption of ethanol on highly active areas of the surface, and the peaks in high-temperature region can be attributed to the products of ethanol and acetaldehyde conversion adsorbed on less reactive sites of the catalyst surface. Meanwhile, there are some differences in intensity and shape of the product desorption curves in the presence of 96 vol% ethanol and the ethanol-water mixture. In the case of 96 vol% ethanol, there is one peak in low-temperature region with a maximum at 393 K on the water desorption curve. In the case of the ethanol-water mixture, a high-intensity peak with a maximum at 413 K and a shoulder at 373 K can be distinguished. The shoulder coincides with the first maximum on the deconvoluted H2O-OPTPD profile for this sample (Fig. 5). Therefore, the desorption of both water of the initial reaction mixture and that formed during the dehydration of ethanol to ethylene can concluded to occur at temperatures of 350−400 K. In high-temperature region of EtOH-TPSR curves in the presence of the ethanol-water mixture the intensity of desorption of unreacted ethanol is higher than that for 96 vol% ethanol, which is consistent with higher ethanol conversion value for 96 vol% ethanol (Fig. S4). Furthermore, in the case of 80 vol% ethanol the intensity of desorption of acetaldehyde is higher than that for 96 vol% ethanol, while the intensity of desorption of the CC coupling products (1,3-butadiene, crotyl alcohol) is lower. This may indicate that water blocks active sites of CC coupling reaction of acetaldehyde. The tendencies of change in the intensity of desorption of water and ethylene + BD are similar, and thus the desorption of water formed in the reactions of ethanol and crotyl alcohol dehydration is assumed to be preferable in the temperature range above 473 K. It should be noted that the intensity of ethylene desorption during EtOH-TPSR is insignificantly higher in the case of ethanol-water mixture used as the feed than in the case of 96 vol% ethanol. Furthermore, in the case of ethanol-water mixture the signal of crotyl alcohol is low enough. This may indicate the modification of active surface sites by water molecules with in situ formation of acid sites (for example, partial transformation of Lewis acid sites into Brönsted ones [14]), on which the dehydrogenation reaction is carried out rather than aldol condensation. This assumption is consistent with the mentioned change of acetaldehyde desorption intensity with the change of 96 vol% ethanol to the ethanol-water mixture. By comparing desorption intensities of the products of CC coupling reactions during EtOH-TPSR and isopropanol-TPSR, the maxima of the formation of the CC coupling products are noted to be comparable. Therefore, the active sites of similar nature are needed to carry out CC coupling reaction of various carbonyl compounds formed from alcohol (ethanol, isopropanol). The results obtained indicate that the hydrophilic properties of ZnO/MgO-SiO2 are determined by the MgO:SiO2 ratio, and the chemisorption of water occurs preferably on Mg-containing sites. A symbatic change in acidity of the catalysts with their hydrophilicity is observed. The presence of water in the ethanol feed (or ethanol-water mixture) leads, first of all, to a decrease in the formation of CC coupling products, probably due to the competing adsorption of water vapor on active sites of aldol condensation of acetaldehyde. It is also possible to transform a part of surface active sites (of ethanol conversion), in particular, Lewis acid sites into Brönsted ones. It is assumed that active sites on the hydrated surface of individual magnesium oxide are practically inactive in CC coupling reaction, and hydrated sites formed with the participation of magnesium and silicon oxides remain active in CC coupling reaction even in the presence of water in the reaction mixture. 4 Conclusions Three-component oxide samples of ZnO/MgO–SiO2 with various MgO:SiO2 ratios (1:1–3:1), also ZnO/MgO and ZnO/SiO2 were characterized as catalysts for the conversion of aqueous ethanol into 1,3-butadiene. Acid-base properties of the samples were evaluated by one-pass temperature-programmed desorption (OPTPD) of CO2 and NH3 controlled by time-of-flight mass spectrometry and Fourier-transform infrared spectroscopy of adsorbed pyridine. ZnO/MgO is characterized by the highest basicity; the number of medium and strong base sites of ZnO/MgO-SiO2 system decreases as the MgO content decreases. On the surface of two- and three-component catalytic systems there are Lewis acid sites of various nature: [Zn-O-Si], [Mg-O-Si] and weak acid sites of magnesium oxide (Mg2+). Based on the OPTPD data of CO2 and NH3 after the probe molecule adsorption on the hydrated catalyst surface, it is qualitatively shown that the water adsorption leads to a change in the acid-base characteristics of the surface. To evaluate water vapor effect on functional properties of the catalyst, water vapor adsorption/desorption over the surface, temperature programmed surface reaction of ethanol and isopropanol conversion reaction in the absence/presence of water vapor in the feed were performed. The results obtained indicate that the hydrophilicity of ZnO/MgO-SiO2 is determined by the MgO:SiO2 ratio, and the chemisorption of water occurs preferably on Mg-containing sites with the formation of Brönsted base sites. The presence of water in the initial reaction mixture leads to a decrease in the formation of CC coupling products, probably due to the adsorption of water vapor on active sites of aldol condensation of acetaldehyde. The hydrated sites formed in the interface of magnesia and silica remain active in CC coupling reaction even in the presence of water in the reaction mixture. The selectivity of BD formation > 60 % is achieved in the conversion of ethanol-water mixture (80 vol% ethanol) in the presence of ZnO/MgO-SiO2 catalysts with the ratio of MgO:SiO2 = (1:1) and (3:1). CRediT authorship contribution statement Pavlo I. Kyriienko: management and coordination responsibility for the research activity planning and execution, conceptualization of idea, performing the experiments and data collection, writing of original draft; reviewing and editing of the manuscript; presentation of the published work. Olga V. Larina: conceptualization of idea, specifically performing the experiments and data collection, writing of original draft, reviewing and editing of the manuscript; presentation of the published work. Dmytro Yu. Balakin: specifically performing the experiments (one-pass temperature-programmed desorption and temperature programmed surface reaction), application of computational and other formal techniques to analyze study data, processing and discussion of the data, specifically critical review, commentary. Anatolii O. Stetsuk: manufacture of special research instruments for one-pass temperature-programmed desorption and temperature programmed surface reaction. Yurii M. Nychiporuk: specifically performing the experiments (one-pass temperature-programmed desorption and temperature programmed surface reaction), application of computational to analyze study data. Sergiy O. Soloviev: specifically critical review and commentary; reviewing and editing of the manuscript; management and coordination responsibility for the research activity planning; acquisition of the financial support for the project leading to this publication. Svitlana M. Orlyk: specifically critical review and commentary; reviewing and editing of the manuscript; management and coordination responsibility for the research activity planning; acquisition of the financial support for the project leading to this publication. Declaration of Competing Interest The authors declare that they have no known competing financial interests or personal relationships that could have appeared to influence the work reported in this paper. Acknowledgements This work was financially supported by program of The National Academy of Sciences of Ukraine KPKVK 6541230 “Support for the development of priority areas of scientific research” (0120U101212) and KPKVK 6541030 “New functional substances and materials of chemical production” (0119U101562) and “Influence of structural dimensional and acid-base characteristics of Cu (Zn, Ag)/La (Zr)-SiO2, CuNi/Mg (Ce)-Al2O3 catalysts on their functional properties in the conversion of bioethanol into valuable products” (0119U102378). Appendix A Supplementary data Supplementary material related to this article can be found, in the online version, at doi: https://doi.org/10.1016/j.apcata.2021.118081. Appendix A Supplementary data The following is Supplementary data to this article: References [1] R.A. Sheldon Green Chem. 19 2017 18 43 R.A. Sheldon, Green Chem. 19 (2017) 18–43. [2] J. Pang M. Zheng T. Zhang Adv. Catal. 64 2019 89 191 J. Pang, M. Zheng, T. Zhang, Adv. Catal. 64 (2019) 89–191. [3] D. Cespi F. Passarini I. Vassura F. Cavani Green Chem. 18 2016 1625 1638 D. Cespi, F. Passarini, I. Vassura, F. Cavani, Green Chem. 18 (2016) 1625–1638. [4] S. Farzad M.A. Mandegari J.F. Görgens Bioresour. Technol. 239 2017 37 48 S. Farzad, M.A. Mandegari, J.F. Görgens, Bioresour. Technol. 239 (2017) 37–48. [5] Michelin’s bio-butadiene technology moving to validation phase. https://www.biofuelsdigest.com/bdigest/2019/09/26/michelins-bio-butadiene-technology-moving-to-validation-phase/, 2019 (accessed 26 September 2019). [6] E.V. Makshina M. Dusselier W. Janssens J. Degrève P.A. Jacobs B.F. Sels Chem. Soc. Rev. 43 2014 7917 7953 E. V. Makshina, M. Dusselier, W. Janssens, J. Degrève, P.A. Jacobs, B.F. Sels, Chem. Soc. Rev. 43 (2014) 7917–7953. [7] G. Pomalaza M. Capron V. Ordomsky F. Dumeignil Catalysts 6 2016 203 G. Pomalaza, M. Capron, V. Ordomsky, F. Dumeignil, Catalysts 6 (2016) 203. [8] P.I. Kyriienko O.V. Larina S.O. Soloviev S.M. Orlyk Theor. Exp. Chem. 56 2020 213 242 P.I. Kyriienko, O.V. Larina, S.O. Soloviev, S.M. Orlyk, Theor. Exp. Chem. 56 (2020) 213–242. [9] I. Bin Samsudin H. Zhang S. Jaenicke G.-K. Chuah Chem. – An Asian J. 15 2020 4199 4214 I. Bin Samsudin, H. Zhang, S. Jaenicke, G.-K. Chuah, Chem. - An Asian J. 15 (2020) 4199–4214. [10] D. Cai Q. Zhu C. Chen S. Hu P. Qin B. Wang T. Tan J. Taiwan Inst. Chem. Eng. 82 2018 137 143 D. Cai, Q. Zhu, C. Chen, S. Hu, P. Qin, B. Wang, T. Tan, J. Taiwan Inst. Chem. Eng. 82 (2018) 137–143. [11] R. Dastillung, B. Fischer, M. Jacquin, R. Huyghe, Method for the Production of Butadiene from Ethanol in One Low-Water- and Low-Energy-Consumption Reaction Step, US 20170267604 A1, 2017. [12] A. Talalay L. Talalay Rubber Chem. Technol. 15 1942 403 429 A. Talalay, L. Talalay, Rubber Chem. Technol. 15 (1942) 403–429. [13] S.K. Bhattacharyya B.N. Avasthi Ind. Eng. Chem. Process Des. Dev. 2 1963 45 51 S.K. Bhattacharyya, B.N. Avasthi, Ind. Eng. Chem. Process Des. Dev. 2 (1963) 45–51. [14] J. Velasquez Ochoa C. Bandinelli O. Vozniuk A. Chieregato A. Malmusi C. Recchi F. Cavani Green Chem. 18 2016 1653 1663 J. Velasquez Ochoa, C. Bandinelli, O. Vozniuk, A. Chieregato, A. Malmusi, C. Recchi, F. Cavani, Green Chem. 18 (2016) 1653–1663. [15] O.V. Larina P.I. Kyriienko D.Y. Balakin M. Vorokhta I. Khalakhan Y.M. Nychiporuk V. Matolín S.O. Solovieva S.M. Orlyk Catal. Sci. Technol. 9 2019 3964 3978 O. V. Larina, P.I. Kyriienko, D.Y. Balakin, M. Vorokhta, I. Khalakhan, Y.M. Nychiporuk, V. Matolín, S.O. Solovieva, S.M. Orlyk, Catal. Sci. Technol. 9 (2019) 3964–3978. [16] O.V. Larina I.M. Remezovskyi P.I. Kyriienko S.O. Soloviev S.M. Orlyk React. Kinet. Mech. Catal. 127 2019 903 915 O. V Larina, I.M. Remezovskyi, P.I. Kyriienko, S.O. Soloviev, S.M. Orlyk, React. Kinet. Mech. Catal. 127 (2019) 903–915. [17] O.V. Larina N.D. Shcherban P.I. Kyriienko I.M. Remezovskyi P.S. Yaremov I. Khalakhan G. Mali S.O. Soloviev S.M. Orlyk S. Dzwigaj ACS Sustain. Chem. Eng. 8 2020 16600 16611 O. V. Larina, N.D. Shcherban, P.I. Kyriienko, I.M. Remezovskyi, P.S. Yaremov, I. Khalakhan, G. Mali, S.O. Soloviev, S.M. Orlyk, S. Dzwigaj, ACS Sustain. Chem. Eng. 8 (2020) 16600–16611. [18] P.I. Kyriienko O.V. Larina N.D. Scherban I.M. Remezovskyi L.M. Alekseenko P.S. Yaremov S.O. Soloviev S.M. Orlyk Theor. Exp. Chem. 56 2020 329 337 P.I. Kyriienko, O. V Larina, N.D. Scherban, I.M. Remezovskyi, L.M. Alekseenko, P.S. Yaremov, S.O. Soloviev, S.M. Orlyk, Theor. Exp. Chem. 56 (2020) 329–337. [19] G.M. Cabello González P. Concepciónb A.L. Villanueva Peralesa A. Martínezb M. Campoya F. Vidal-Barrero Fuel Process. Technol. 193 2019 263 272 G.M. Cabello González, P. Concepciónb, A.L. Villanueva Peralesa, A. Martínezb, M. Campoya, F. Vidal-Barrero, Fuel Process. Technol. 193 (2019) 263–272. [20] P.I. Kyriienko O.V. Larina S. Dzwigaj S.O. Soloviev S.M. Orlyk Theor. Exp. Chem. 55 2019 241 247 P.I. Kyriienko, O. V Larina, S. Dzwigaj, S.O. Soloviev, S.M. Orlyk, Theor. Exp. Chem. 55 (2019) 241–247. [21] Q. Zhu B. Wang T. Tan ACS Sustain. Chem. Eng. 5 2016 722 733 Q. Zhu, B. Wang, T. Tan, ACS Sustain. Chem. Eng. 5 (2016) 722–733. [22] M. Zhang X. Tan T. Zhang Z. Hanab H. Jiang RSC Adv. 8 2018 34069 34077 M. Zhang, X. Tan, T. Zhang, Z. Hanab, H. Jiang, RSC Adv. 8 (2018) 34069–34077. [23] X. Huang Y. Men J. Wang W. An Y. Wang Catal. Sci. Technol. 7 2017 168 180 X. Huang, Y. Men, J. Wang, W. An, Y. Wang, Catal. Sci. Technol. 7 (2017) 168–180. [24] W.E. Taifan J. Baltrusaitis J. Phys. Chem. C 122 2018 20894 20906 W.E. Taifan, J. Baltrusaitis, J. Phys. Chem. C 122 (2018) 20894–20906. [25] W.E. Taifan Y. Li J.P. Baltrus L. Zhang A.I. Frenkel J. Baltrusaitis ACS Catal. 9 2019 269 285 W.E. Taifan, Y. Li, J.P. Baltrus, L. Zhang, A.I. Frenkel, J. Baltrusaitis, ACS Catal. 9 (2019) 269–285. [26] Y. Hayashi S. Akiyama A. Miyaji Y. Sekiguchi Y. Sakamoto A. Shiga T. Koyama K. Motokura T. Baba Phys. Chem. Chem. Phys. 18 2016 25191 25209 Y. Hayashi, S. Akiyama, A. Miyaji, Y. Sekiguchi, Y. Sakamoto, A. Shiga, T. Koyama, K. Motokura, T. Baba, Phys. Chem. Chem. Phys. 18 (2016) 25191–25209. [27] W. Janssens E.V. Makshina P. Vanelderen F. De Clippel K. Houthoofd S. Kerkhofs J.A. Martens P.A. Jacobs B.F. Sels ChemSusChem 8 2015 994 1008 W. Janssens, E. V. Makshina, P. Vanelderen, F. De Clippel, K. Houthoofd, S. Kerkhofs, J.A. Martens, P.A. Jacobs, B.F. Sels, ChemSusChem 8 (2015) 994–1008. [28] C. Angelici F. Meirer A.M.J. Van Der Eerden H.L. Schaink A. Goryachev J.P. Hofmann E.J.M. Hensen B.M. Weckhuysen P.C.A. Bruijnincx ACS Catal. 5 2015 6005 6015 C. Angelici, F. Meirer, A.M.J. Van Der Eerden, H.L. Schaink, A. Goryachev, J.P. Hofmann, E.J.M. Hensen, B.M. Weckhuysen, P.C.A. Bruijnincx, ACS Catal. 5 (2015) 6005–6015. [29] O.V. Larina P.I. Kyriienko V.V. Trachevskii N.V. Vlasenko S.O. Soloviev Theor. Exp. Chem. 51 2016 387 393 O. V. Larina, P.I. Kyriienko, V. V. Trachevskii, N. V. Vlasenko, S.O. Soloviev, Theor. Exp. Chem. 51 (2016) 387–393. [30] X. Wang Y. Men J. Wang S. Liu Q. Song M. Yang Appl. Catal. A Gen. 598 2020 117565 X. Wang, Y. Men, J. Wang, S. Liu, Q. Song, M. Yang, Appl. Catal. A Gen. 598 (2020) 117565. [31] S. Da Ros M.D. Jones D. Mattia M. Schwaab E. Barbosa-Coutinho R.C. Rabelo-Neto F. Bellot Noronha J. Carlos Pinto Chem. Eng. J. 308 2017 988 1000 S. Da Ros, M.D. Jones, D. Mattia, M. Schwaab, E. Barbosa-Coutinho, R.C. Rabelo-Neto, F. Bellot Noronha, J. Carlos Pinto, Chem. Eng. J. 308 (2017) 988–1000. [32] G. Pomalaza P. Arango M. Capron F. Dumeignil Catal. Sci. Technol. 10 2020 4860 4911 G. Pomalaza, P. Arango, M. Capron, F. Dumeignil, Catal. Sci. Technol. 10 (2020) 4860–4911. [33] E.V. Makshina W. Janssens B.F. Sels P.A. Jacobs Catal. Today 198 2012 338 344 E. V. Makshina, W. Janssens, B.F. Sels, P.A. Jacobs, Catal. Today 198 (2012) 338–344. [34] C. Angelici M.E.Z. Velthoen B.M. Weckhuysen P.C.A. Bruijnincx ChemSusChem 2014 2505 2515 C. Angelici, M.E.Z. Velthoen, B.M. Weckhuysen, P.C.A. Bruijnincx, ChemSusChem (2014) 2505–2515. [35] S. Shylesh A.A. Gokhale C.D. Scown D. Kim C.R. Ho A.T. Bell ChemSusChem 9 2016 1462 1472 S. Shylesh, A.A. Gokhale, C.D. Scown, D. Kim, C.R. Ho, A.T. Bell, ChemSusChem 9 (2016) 1462–1472. [36] O.V. Larina P.I. Kyriienko S.O. Soloviev Catal. Lett. 145 2015 1162 1168 O. V. Larina, P.I. Kyriienko, S.O. Soloviev, Catal. Letters 145 (2015) 1162–1168. [37] J. Velasquez Ochoa A. Malmusi C. Recchi F. Cavani ChemCatChem 8 2017 2128 2135 J. Velasquez Ochoa, A. Malmusi, C. Recchi, F. Cavani, ChemCatChem 8 (2017) 2128–2135. [38] B. Szabó G. Novodárszki Z. May J. Valyon J. Hancsók R. Barthos Mol. Catal. 491 2020 110984 B. Szabó, G. Novodárszki, Z. May, J. Valyon, J. Hancsók, R. Barthos, Mol. Catal. 491 (2020) 110984. [39] V.M. Gun’ko V.I. Zarko B.A. Chuikov V.V. Dudnik Y.G. Ptushinskii E.F. Voronin E.M. Pakhlov A.A. Chuiko Int. J. Mass Spectrom. Ion Process. 172 1998 161 179 V.M. Gun’ko, V.I. Zarko, B.A. Chuikov, V.V. Dudnik, Y.G. Ptushinskii, E.F. Voronin, E.M. Pakhlov, A.A. Chuiko, Int. J. Mass Spectrom. Ion Process. 172 (1998) 161–179. [40] V.M. Gun’ko I.F. Mironyuk V.I. Zarko E.F. Voronin V.V. Turov E.M. Pakhlov E.V. Goncharuk Y.M. Nychiporuk N.N. Vlasova P.P. Gorbik O.A. Mishchuk A.A. Chuiko T.V. Kulik B.B. Palyanytsya S.V. Pakhovchishin J. Skubiszewska-Ziȩba W. Janusz A.V. Turov R. Leboda J. Colloid Interface Sci. 289 2005 427 445 V.M. Gun’ko, I.F. Mironyuk, V.I. Zarko, E.F. Voronin, V. V. Turov, E.M. Pakhlov, E.V. Goncharuk, Y.M. Nychiporuk, N.N. Vlasova, P.P. Gorbik, O.A. Mishchuk, A.A. Chuiko, T. V. Kulik, B.B. Palyanytsya, S. V. Pakhovchishin, J. Skubiszewska-Ziȩba, W. Janusz, A. V. Turov, R. Leboda, J. Colloid Interface Sci. 289 (2005) 427–445. [41] L.H. Chagas P.C. Zonetti C.R.V. Matheus C.R.K. Rabello O.C. Alves L.G. Appel ChemCatChem 11 2019 5625 5632 L.H. Chagas, P.C. Zonetti, C.R.V. Matheus, C.R.K. Rabello, O.C. Alves, L.G. Appel, ChemCatChem 11 (2019) 5625–5632. [42] L. Silvester J.-F. Lamonier C. Lamonier M. Capron R.-N. Vannier A.-S. Mamede F. Dumeignil ChemCatChem 9 2017 2250 2261 L. Silvester, J.-F. Lamonier, C. Lamonier, M. Capron, R.-N. Vannier, A.-S. Mamede, F. Dumeignil, ChemCatChem 9 (2017) 2250–2261. [43] S. Kvisle A. Aguero R.P.A. Sneeden Appl. Catal. 43 1988 117 131 S. Kvisle, A. Aguero, R.P.A. Sneeden, Appl. Catal. 43 (1988) 117–131. [44] O.V. Larina P.I. Kyriienko S.O. Soloviev Theor. Exp. Chem. 51 2015 252 258 O.V. Larina, P.I. Kyriienko, S.O. Soloviev, Theor. Exp. Chem. 51 (2015) 252–258. [45] G. Connell J.A. Dumesic J. Catal. 105 1987 285 298 G. Connell, J.A. Dumesic, J. Catal. 105 (1987) 285–298. [46] T.M.L. Goerne R. Gomez J.J. Navarrete E. López-Salinas J. Sol–Gel Sci. Technol. 13 1998 1043 1047 T. Maria, R. Gomez, J.J. Navarrete, E. López-Salinas, J. Sol-Gel Sci. Technol. 13 (1998) 1043–1047. [47] O.V. Larina P.I. Kyriienko S.O. Soloviev Catal. Lett. 145 2015 1162 1168 O. V. Larina, P.I. Kyriienko, S.O. Soloviev, Catal. Letters 145 (2015) 1162–1168. [48] S. Li Y. Men J. Wang S. Liu X. Wang F. Ji S. Chai Q. Song Appl. Catal. A Gen. 577 2019 1 9 S. Li, Y. Men, J. Wang, S. Liu, X. Wang, F. Ji, S. Chai, Q. Song, Appl. Catal. A Gen. 577 (2019) 1–9. [49] C. Angelici M.E.Z. Velthoen B.M. Weckhuysen P.C.A. Bruijnincx Catal. Sci. Technol. 5 2015 2869 2879 C. Angelici, M.E.Z. Velthoen, B.M. Weckhuysen, P.C.A. Bruijnincx, Catal. Sci. Technol. 5 (2015) 2869–2879. [50] S.-H. Chung C. Angelici S.O.M. Hinterding M. Weingarth M. Baldus K. Houben B.M. Weckhuysen P.C.A. Bruijnincx ACS Catal. 6 2016 4034 4045 S.-H. Chung, C. Angelici, S.O.M. Hinterding, M. Weingarth, M. Baldus, K. Houben, B.M. Weckhuysen, P.C.A. Bruijnincx, ACS Catal. 6 (2016) 4034–4045. [51] S. Da Ros M.D. Jones D. Mattia J.C. Pinto M. Schwaab F.B. Noronha S.A. Kondrat T.C. Clarke S.H. Taylor ChemCatChem 8 2016 2376 2386 S. Da Ros, M.D. Jones, D. Mattia, J.C. Pinto, M. Schwaab, F.B. Noronha, S.A. Kondrat, T.C. Clarke, S.H. Taylor, ChemCatChem 8 (2016) 2376–2386. [52] C. Angelici B.M. Weckhuysen P.C.A. Bruijnincx ChemSusChem 6 2013 1595 1614 C. Angelici, B.M. Weckhuysen, P.C.A. Bruijnincx, ChemSusChem 6 (2013) 1595–1614. [53] J.I. Di Cosimo V.K. Díez C. Ferretti C.R. Apesteguía Appl. Catal. A Gen. 137 1996 149 166 J.I. Di Cosimo, V.K. Díez, C. Ferretti, C.R. Apesteguía, Appl. Catal. A Gen. 137 (1996) 149–166. [54] M.A. Henderson Surf. Sci. Rep. 46 2002 1 308 M.A. Henderson, Surf. Sci. Rep. 46 (2002) 1–308. [55] K. Shimizu E. Hayashi T. Hatamachi T. Kodama J. Catal. 231 2005 131 138 K. Shimizu, E. Hayashi, T. Hatamachi, T. Kodama, J. Catal. 231 (2005) 131–138. [56] K. Coenen F. Gallucci B. Mezari E. Hensen M.V.S. Annaland J. CO2 Util. 24 2021 228 239 K. Coenen, F. Gallucci, B. Mezari, E. Hensen, M.V.S. Annaland, J. CO2 Util. 24 (2021) 228–239. [57] R. He Y. Men X. Huang J. Wang S. Li X. Wang Chem. Lett. 47 2018 1097 1100 R. He, Y. Men, X. Huang, J. Wang, S. Li, X. Wang, Chem. Lett. 47 (2018) 1097–1100. [58] T. Yan W. Dai G. Wu S. Lang M. Hunger N. Guan L. Li ACS Catal. 8 2018 2760 2773 T. Yan, W. Dai, G. Wu, S. Lang, M. Hunger, N. Guan, L. Li, ACS Catal. 8 (2018) 2760–2773.",
      "scopus-id": "85102903792",
      "coredata": {
        "eid": "1-s2.0-S0926860X21000958",
        "dc:description": "A series of ZnO/MgO-SiO2 systems have been prepared and characterized by one-pass temperature-programmed desorption of CO2, NH3 and H2O, FTIR spectroscopy with adsorbed pyridine and CO2, temperature programmed surface reaction of ethanol and isopropanol, and reaction of isopropanol conversion. Effect of MgO:SiO2 ratio in the catalysts on catalytic performance in 1,3-butadiene production from aqueous ethanol have been investigated. The results indicate that hydrophilicity of ZnO/MgO-SiO2 are determined by MgO:SiO2 ratio, and chemisorption of water occurs preferably on Mg-containing sites. The presence of water in the initial ethanol leads to a decrease in formation of the CC coupling products. The hydrated sites formed in the interface of magnesia and silica remain active in the CC coupling reaction even in the presence of water. 1,3-Butadiene selectivity >60 % in the conversion of aqueous ethanol (80 vol%) is achieved in the presence of ZnO/MgO-SiO2 catalysts with the ratio of MgO:SiO2 = (1:1) and (3:1).",
        "openArchiveArticle": "false",
        "prism:coverDate": "2021-04-25",
        "openaccessUserLicense": null,
        "prism:aggregationType": "Journal",
        "prism:url": "https://api.elsevier.com/content/article/pii/S0926860X21000958",
        "dc:creator": [
          {
            "@_fa": "true",
            "$": "Kyriienko, Pavlo I."
          },
          {
            "@_fa": "true",
            "$": "Larina, Olga V."
          },
          {
            "@_fa": "true",
            "$": "Balakin, Dmytro Yu."
          },
          {
            "@_fa": "true",
            "$": "Stetsuk, Anatolii O."
          },
          {
            "@_fa": "true",
            "$": "Nychiporuk, Yurii M."
          },
          {
            "@_fa": "true",
            "$": "Soloviev, Sergiy O."
          },
          {
            "@_fa": "true",
            "$": "Orlyk, Svitlana M."
          }
        ],
        "link": [
          {
            "@_fa": "true",
            "@rel": "self",
            "@href": "https://api.elsevier.com/content/article/pii/S0926860X21000958"
          },
          {
            "@_fa": "true",
            "@rel": "scidir",
            "@href": "https://www.sciencedirect.com/science/article/pii/S0926860X21000958"
          }
        ],
        "dc:format": "application/json",
        "openaccessType": null,
        "pii": "S0926-860X(21)00095-8",
        "prism:volume": "616",
        "articleNumber": "118081",
        "prism:publisher": "Elsevier B.V.",
        "dc:title": "1,3-Butadiene production from aqueous ethanol over ZnO/MgO-SiO2 catalysts: Insight into H2O effect on catalytic performance",
        "prism:copyright": "© 2021 Elsevier B.V. All rights reserved.",
        "openaccess": "0",
        "prism:issn": "0926860X",
        "dcterms:subject": [
          {
            "@_fa": "true",
            "$": "Aqueous ethanol"
          },
          {
            "@_fa": "true",
            "$": "1,3-Butadiene"
          },
          {
            "@_fa": "true",
            "$": "ZnO/MgO-SiO2"
          },
          {
            "@_fa": "true",
            "$": "H2O effect"
          }
        ],
        "openaccessArticle": "false",
        "prism:publicationName": "Applied Catalysis A: General",
        "openaccessSponsorType": null,
        "prism:pageRange": "118081",
        "pubType": "fla",
        "prism:coverDisplayDate": "25 April 2021",
        "prism:doi": "10.1016/j.apcata.2021.118081",
        "prism:startingPage": "118081",
        "dc:identifier": "doi:10.1016/j.apcata.2021.118081",
        "openaccessSponsorName": null
      },
      "objects": {
        "object": [
          {
            "@category": "standard",
            "@height": "314",
            "@width": "491",
            "@_fa": "true",
            "$": "https://api.elsevier.com/content/object/eid/1-s2.0-S0926860X21000958-gr1.jpg?httpAccept=%2A%2F%2A",
            "@multimediatype": "JPEG image file",
            "@type": "IMAGE-DOWNSAMPLED",
            "@size": "53012",
            "@ref": "gr1",
            "@mimetype": "image/jpeg"
          },
          {
            "@category": "standard",
            "@height": "743",
            "@width": "340",
            "@_fa": "true",
            "$": "https://api.elsevier.com/content/object/eid/1-s2.0-S0926860X21000958-gr3.jpg?httpAccept=%2A%2F%2A",
            "@multimediatype": "JPEG image file",
            "@type": "IMAGE-DOWNSAMPLED",
            "@size": "50399",
            "@ref": "gr3",
            "@mimetype": "image/jpeg"
          },
          {
            "@category": "standard",
            "@height": "200",
            "@width": "325",
            "@_fa": "true",
            "$": "https://api.elsevier.com/content/object/eid/1-s2.0-S0926860X21000958-ga1.jpg?httpAccept=%2A%2F%2A",
            "@multimediatype": "JPEG image file",
            "@type": "IMAGE-DOWNSAMPLED",
            "@size": "19311",
            "@ref": "ga1",
            "@mimetype": "image/jpeg"
          },
          {
            "@category": "standard",
            "@height": "322",
            "@width": "378",
            "@_fa": "true",
            "$": "https://api.elsevier.com/content/object/eid/1-s2.0-S0926860X21000958-gr2.jpg?httpAccept=%2A%2F%2A",
            "@multimediatype": "JPEG image file",
            "@type": "IMAGE-DOWNSAMPLED",
            "@size": "33654",
            "@ref": "gr2",
            "@mimetype": "image/jpeg"
          },
          {
            "@category": "standard",
            "@height": "346",
            "@width": "566",
            "@_fa": "true",
            "$": "https://api.elsevier.com/content/object/eid/1-s2.0-S0926860X21000958-gr9.jpg?httpAccept=%2A%2F%2A",
            "@multimediatype": "JPEG image file",
            "@type": "IMAGE-DOWNSAMPLED",
            "@size": "48094",
            "@ref": "gr9",
            "@mimetype": "image/jpeg"
          },
          {
            "@category": "standard",
            "@height": "502",
            "@width": "303",
            "@_fa": "true",
            "$": "https://api.elsevier.com/content/object/eid/1-s2.0-S0926860X21000958-gr8.jpg?httpAccept=%2A%2F%2A",
            "@multimediatype": "JPEG image file",
            "@type": "IMAGE-DOWNSAMPLED",
            "@size": "34501",
            "@ref": "gr8",
            "@mimetype": "image/jpeg"
          },
          {
            "@category": "standard",
            "@height": "47",
            "@width": "479",
            "@_fa": "true",
            "$": "https://api.elsevier.com/content/object/eid/1-s2.0-S0926860X21000958-fx1.jpg?httpAccept=%2A%2F%2A",
            "@multimediatype": "JPEG image file",
            "@type": "IMAGE-DOWNSAMPLED",
            "@size": "6120",
            "@ref": "fx1",
            "@mimetype": "image/jpeg"
          },
          {
            "@category": "standard",
            "@height": "420",
            "@width": "303",
            "@_fa": "true",
            "$": "https://api.elsevier.com/content/object/eid/1-s2.0-S0926860X21000958-gr5.jpg?httpAccept=%2A%2F%2A",
            "@multimediatype": "JPEG image file",
            "@type": "IMAGE-DOWNSAMPLED",
            "@size": "43666",
            "@ref": "gr5",
            "@mimetype": "image/jpeg"
          },
          {
            "@category": "standard",
            "@height": "305",
            "@width": "566",
            "@_fa": "true",
            "$": "https://api.elsevier.com/content/object/eid/1-s2.0-S0926860X21000958-gr4.jpg?httpAccept=%2A%2F%2A",
            "@multimediatype": "JPEG image file",
            "@type": "IMAGE-DOWNSAMPLED",
            "@size": "34908",
            "@ref": "gr4",
            "@mimetype": "image/jpeg"
          },
          {
            "@category": "standard",
            "@height": "274",
            "@width": "566",
            "@_fa": "true",
            "$": "https://api.elsevier.com/content/object/eid/1-s2.0-S0926860X21000958-gr7.jpg?httpAccept=%2A%2F%2A",
            "@multimediatype": "JPEG image file",
            "@type": "IMAGE-DOWNSAMPLED",
            "@size": "27132",
            "@ref": "gr7",
            "@mimetype": "image/jpeg"
          },
          {
            "@category": "standard",
            "@height": "281",
            "@width": "566",
            "@_fa": "true",
            "$": "https://api.elsevier.com/content/object/eid/1-s2.0-S0926860X21000958-gr6.jpg?httpAccept=%2A%2F%2A",
            "@multimediatype": "JPEG image file",
            "@type": "IMAGE-DOWNSAMPLED",
            "@size": "26957",
            "@ref": "gr6",
            "@mimetype": "image/jpeg"
          },
          {
            "@category": "thumbnail",
            "@height": "140",
            "@width": "219",
            "@_fa": "true",
            "$": "https://api.elsevier.com/content/object/eid/1-s2.0-S0926860X21000958-gr1.sml?httpAccept=%2A%2F%2A",
            "@multimediatype": "GIF image file",
            "@type": "IMAGE-THUMBNAIL",
            "@size": "8883",
            "@ref": "gr1",
            "@mimetype": "image/gif"
          },
          {
            "@category": "thumbnail",
            "@height": "164",
            "@width": "75",
            "@_fa": "true",
            "$": "https://api.elsevier.com/content/object/eid/1-s2.0-S0926860X21000958-gr3.sml?httpAccept=%2A%2F%2A",
            "@multimediatype": "GIF image file",
            "@type": "IMAGE-THUMBNAIL",
            "@size": "2886",
            "@ref": "gr3",
            "@mimetype": "image/gif"
          },
          {
            "@category": "thumbnail",
            "@height": "135",
            "@width": "219",
            "@_fa": "true",
            "$": "https://api.elsevier.com/content/object/eid/1-s2.0-S0926860X21000958-ga1.sml?httpAccept=%2A%2F%2A",
            "@multimediatype": "GIF image file",
            "@type": "IMAGE-THUMBNAIL",
            "@size": "9056",
            "@ref": "ga1",
            "@mimetype": "image/gif"
          },
          {
            "@category": "thumbnail",
            "@height": "164",
            "@width": "192",
            "@_fa": "true",
            "$": "https://api.elsevier.com/content/object/eid/1-s2.0-S0926860X21000958-gr2.sml?httpAccept=%2A%2F%2A",
            "@multimediatype": "GIF image file",
            "@type": "IMAGE-THUMBNAIL",
            "@size": "8383",
            "@ref": "gr2",
            "@mimetype": "image/gif"
          },
          {
            "@category": "thumbnail",
            "@height": "134",
            "@width": "219",
            "@_fa": "true",
            "$": "https://api.elsevier.com/content/object/eid/1-s2.0-S0926860X21000958-gr9.sml?httpAccept=%2A%2F%2A",
            "@multimediatype": "GIF image file",
            "@type": "IMAGE-THUMBNAIL",
            "@size": "8610",
            "@ref": "gr9",
            "@mimetype": "image/gif"
          },
          {
            "@category": "thumbnail",
            "@height": "164",
            "@width": "99",
            "@_fa": "true",
            "$": "https://api.elsevier.com/content/object/eid/1-s2.0-S0926860X21000958-gr8.sml?httpAccept=%2A%2F%2A",
            "@multimediatype": "GIF image file",
            "@type": "IMAGE-THUMBNAIL",
            "@size": "5205",
            "@ref": "gr8",
            "@mimetype": "image/gif"
          },
          {
            "@category": "thumbnail",
            "@height": "21",
            "@width": "219",
            "@_fa": "true",
            "$": "https://api.elsevier.com/content/object/eid/1-s2.0-S0926860X21000958-fx1.sml?httpAccept=%2A%2F%2A",
            "@multimediatype": "GIF image file",
            "@type": "IMAGE-THUMBNAIL",
            "@size": "1465",
            "@ref": "fx1",
            "@mimetype": "image/gif"
          },
          {
            "@category": "thumbnail",
            "@height": "164",
            "@width": "118",
            "@_fa": "true",
            "$": "https://api.elsevier.com/content/object/eid/1-s2.0-S0926860X21000958-gr5.sml?httpAccept=%2A%2F%2A",
            "@multimediatype": "GIF image file",
            "@type": "IMAGE-THUMBNAIL",
            "@size": "6462",
            "@ref": "gr5",
            "@mimetype": "image/gif"
          },
          {
            "@category": "thumbnail",
            "@height": "118",
            "@width": "219",
            "@_fa": "true",
            "$": "https://api.elsevier.com/content/object/eid/1-s2.0-S0926860X21000958-gr4.sml?httpAccept=%2A%2F%2A",
            "@multimediatype": "GIF image file",
            "@type": "IMAGE-THUMBNAIL",
            "@size": "8371",
            "@ref": "gr4",
            "@mimetype": "image/gif"
          },
          {
            "@category": "thumbnail",
            "@height": "106",
            "@width": "219",
            "@_fa": "true",
            "$": "https://api.elsevier.com/content/object/eid/1-s2.0-S0926860X21000958-gr7.sml?httpAccept=%2A%2F%2A",
            "@multimediatype": "GIF image file",
            "@type": "IMAGE-THUMBNAIL",
            "@size": "6085",
            "@ref": "gr7",
            "@mimetype": "image/gif"
          },
          {
            "@category": "thumbnail",
            "@height": "109",
            "@width": "219",
            "@_fa": "true",
            "$": "https://api.elsevier.com/content/object/eid/1-s2.0-S0926860X21000958-gr6.sml?httpAccept=%2A%2F%2A",
            "@multimediatype": "GIF image file",
            "@type": "IMAGE-THUMBNAIL",
            "@size": "6217",
            "@ref": "gr6",
            "@mimetype": "image/gif"
          },
          {
            "@category": "high",
            "@height": "1389",
            "@width": "2175",
            "@_fa": "true",
            "$": "https://api.elsevier.com/content/object/eid/1-s2.0-S0926860X21000958-gr1_lrg.jpg?httpAccept=%2A%2F%2A",
            "@multimediatype": "JPEG image file",
            "@type": "IMAGE-HIGH-RES",
            "@size": "517441",
            "@ref": "gr1",
            "@mimetype": "image/jpeg"
          },
          {
            "@category": "high",
            "@height": "3294",
            "@width": "1508",
            "@_fa": "true",
            "$": "https://api.elsevier.com/content/object/eid/1-s2.0-S0926860X21000958-gr3_lrg.jpg?httpAccept=%2A%2F%2A",
            "@multimediatype": "JPEG image file",
            "@type": "IMAGE-HIGH-RES",
            "@size": "519474",
            "@ref": "gr3",
            "@mimetype": "image/jpeg"
          },
          {
            "@category": "high",
            "@height": "886",
            "@width": "1442",
            "@_fa": "true",
            "$": "https://api.elsevier.com/content/object/eid/1-s2.0-S0926860X21000958-ga1_lrg.jpg?httpAccept=%2A%2F%2A",
            "@multimediatype": "JPEG image file",
            "@type": "IMAGE-HIGH-RES",
            "@size": "176875",
            "@ref": "ga1",
            "@mimetype": "image/jpeg"
          },
          {
            "@category": "high",
            "@height": "1429",
            "@width": "1675",
            "@_fa": "true",
            "$": "https://api.elsevier.com/content/object/eid/1-s2.0-S0926860X21000958-gr2_lrg.jpg?httpAccept=%2A%2F%2A",
            "@multimediatype": "JPEG image file",
            "@type": "IMAGE-HIGH-RES",
            "@size": "239685",
            "@ref": "gr2",
            "@mimetype": "image/jpeg"
          },
          {
            "@category": "high",
            "@height": "1535",
            "@width": "2508",
            "@_fa": "true",
            "$": "https://api.elsevier.com/content/object/eid/1-s2.0-S0926860X21000958-gr9_lrg.jpg?httpAccept=%2A%2F%2A",
            "@multimediatype": "JPEG image file",
            "@type": "IMAGE-HIGH-RES",
            "@size": "373785",
            "@ref": "gr9",
            "@mimetype": "image/jpeg"
          },
          {
            "@category": "high",
            "@height": "2221",
            "@width": "1341",
            "@_fa": "true",
            "$": "https://api.elsevier.com/content/object/eid/1-s2.0-S0926860X21000958-gr8_lrg.jpg?httpAccept=%2A%2F%2A",
            "@multimediatype": "JPEG image file",
            "@type": "IMAGE-HIGH-RES",
            "@size": "271581",
            "@ref": "gr8",
            "@mimetype": "image/jpeg"
          },
          {
            "@category": "high",
            "@height": "208",
            "@width": "2123",
            "@_fa": "true",
            "$": "https://api.elsevier.com/content/object/eid/1-s2.0-S0926860X21000958-fx1_lrg.jpg?httpAccept=%2A%2F%2A",
            "@multimediatype": "JPEG image file",
            "@type": "IMAGE-HIGH-RES",
            "@size": "42543",
            "@ref": "fx1",
            "@mimetype": "image/jpeg"
          },
          {
            "@category": "high",
            "@height": "1861",
            "@width": "1341",
            "@_fa": "true",
            "$": "https://api.elsevier.com/content/object/eid/1-s2.0-S0926860X21000958-gr5_lrg.jpg?httpAccept=%2A%2F%2A",
            "@multimediatype": "JPEG image file",
            "@type": "IMAGE-HIGH-RES",
            "@size": "356821",
            "@ref": "gr5",
            "@mimetype": "image/jpeg"
          },
          {
            "@category": "high",
            "@height": "1351",
            "@width": "2508",
            "@_fa": "true",
            "$": "https://api.elsevier.com/content/object/eid/1-s2.0-S0926860X21000958-gr4_lrg.jpg?httpAccept=%2A%2F%2A",
            "@multimediatype": "JPEG image file",
            "@type": "IMAGE-HIGH-RES",
            "@size": "253210",
            "@ref": "gr4",
            "@mimetype": "image/jpeg"
          },
          {
            "@category": "high",
            "@height": "1212",
            "@width": "2508",
            "@_fa": "true",
            "$": "https://api.elsevier.com/content/object/eid/1-s2.0-S0926860X21000958-gr7_lrg.jpg?httpAccept=%2A%2F%2A",
            "@multimediatype": "JPEG image file",
            "@type": "IMAGE-HIGH-RES",
            "@size": "207701",
            "@ref": "gr7",
            "@mimetype": "image/jpeg"
          },
          {
            "@category": "high",
            "@height": "1243",
            "@width": "2508",
            "@_fa": "true",
            "$": "https://api.elsevier.com/content/object/eid/1-s2.0-S0926860X21000958-gr6_lrg.jpg?httpAccept=%2A%2F%2A",
            "@multimediatype": "JPEG image file",
            "@type": "IMAGE-HIGH-RES",
            "@size": "205730",
            "@ref": "gr6",
            "@mimetype": "image/jpeg"
          },
          {
            "@category": "standard",
            "@_fa": "true",
            "$": "https://api.elsevier.com/content/object/eid/1-s2.0-S0926860X21000958-mmc1.docx?httpAccept=%2A%2F%2A",
            "@multimediatype": "Microsoft Word file",
            "@type": "APPLICATION",
            "@size": "2929291",
            "@ref": "mmc1",
            "@mimetype": "application/word"
          },
          {
            "@category": "thumbnail",
            "@_fa": "true",
            "$": "https://api.elsevier.com/content/object/eid/1-s2.0-S0926860X21000958-si1.svg?httpAccept=%2A%2F%2A",
            "@multimediatype": "Scalable Vector Graphics file",
            "@type": "ALTIMG",
            "@size": "18568",
            "@ref": "si1",
            "@mimetype": "image/svg+xml"
          },
          {
            "@category": "thumbnail",
            "@_fa": "true",
            "$": "https://api.elsevier.com/content/object/eid/1-s2.0-S0926860X21000958-si2.svg?httpAccept=%2A%2F%2A",
            "@multimediatype": "Scalable Vector Graphics file",
            "@type": "ALTIMG",
            "@size": "10227",
            "@ref": "si2",
            "@mimetype": "image/svg+xml"
          },
          {
            "@category": "thumbnail",
            "@_fa": "true",
            "$": "https://api.elsevier.com/content/object/eid/1-s2.0-S0926860X21000958-si3.svg?httpAccept=%2A%2F%2A",
            "@multimediatype": "Scalable Vector Graphics file",
            "@type": "ALTIMG",
            "@size": "7091",
            "@ref": "si3",
            "@mimetype": "image/svg+xml"
          },
          {
            "@category": "thumbnail",
            "@_fa": "true",
            "$": "https://api.elsevier.com/content/object/eid/1-s2.0-S0926860X21000958-si4.svg?httpAccept=%2A%2F%2A",
            "@multimediatype": "Scalable Vector Graphics file",
            "@type": "ALTIMG",
            "@size": "7334",
            "@ref": "si4",
            "@mimetype": "image/svg+xml"
          },
          {
            "@category": "thumbnail",
            "@_fa": "true",
            "$": "https://api.elsevier.com/content/object/eid/1-s2.0-S0926860X21000958-si5.svg?httpAccept=%2A%2F%2A",
            "@multimediatype": "Scalable Vector Graphics file",
            "@type": "ALTIMG",
            "@size": "2910",
            "@ref": "si5",
            "@mimetype": "image/svg+xml"
          },
          {
            "@category": "standard",
            "@_fa": "true",
            "$": "https://api.elsevier.com/content/object/eid/1-s2.0-S0926860X21000958-am.pdf?httpAccept=%2A%2F%2A",
            "@multimediatype": "Acrobat PDF file",
            "@type": "AAM-PDF",
            "@size": "3279481",
            "@ref": "am",
            "@mimetype": "application/pdf"
          }
        ]
      },
      "link": {
        "@rel": "abstract",
        "@href": "https://api.elsevier.com/content/abstract/scopus_id/85102903792"
      }
    }
  }
}