{
  "metadata": {
    "title": "The effect of support surface hydroxyls on selective CO methanation with Ru based catalysts",
    "authors": "; ; ",
    "journal": "Applied Catalysis A: General",
    "date": "2022-07-05",
    "doi": "10.1016/j.apcata.2022.118678",
    "abstract": "",
    "uri": "https://api.elsevier.com/content/article/pii/S0926860X22002010",
    "pii": "S0926860X22002010"
  },
  "fulltext": {
    "full-text-retrieval-response": {
      "scopus-eid": "2-s2.0-85130844936",
      "originalText": "serial JL 271346 291210 291744 291809 31 Applied Catalysis A: General APPLIEDCATALYSISAGENERAL 2022-05-23 2022-05-23 2022-05-27 2022-05-27 2022-06-09T08:53:05 1-s2.0-S0926860X22002010 S0926-860X(22)00201-0 S0926860X22002010 10.1016/j.apcata.2022.118678 S300 S300.1 FULL-TEXT 1-s2.0-S0926860X22X00124 2024-01-01T12:34:28.416125Z 0 0 20220705 2022 2022-05-23T15:42:25.318732Z absattachment articleinfo articlenumber articletitlenorm authfirstinitialnorm authfirstsurnamenorm cid cids contenttype copyright crossmark dateloaded dateloadedtxt datesearch datesort dateupdated dco docsubtype doctype doi eid ewtransactionid hubeid indexeddate issn issnnorm itemstage itemtransactionid itemweight openaccess openarchive pg pgfirst pii piinorm pubdatestart pubdatetxt pubyr sortorder srctitle srctitlenorm srctype ssids alllist content subj subheadings suppl tomb volfirst volissue volumelist webpdf webpdfpagecount yearnav figure table body mmlmath acknowledge affil articletitle auth authfirstini authfull authkeywords authlast grantnumber grantsponsor grantsponsorid highlightsabst primabst ref specialabst 0926-860X 0926860X true 641 641 C Volume 641 8 118678 118678 118678 20220705 5 July 2022 2022-07-05 2022 article fla © 2022 Elsevier B.V. All rights reserved. EFFECTSUPPORTSURFACEHYDROXYLSSELECTIVECOMETHANATIONRUBASEDCATALYSTS MARTINEZT L 1 Introduction 2 Experimental 2.1 Catalysts 2.2 Characterization techniques 2.3 Catalytic activity 3 Results and discussion 3.1 Screening of different supports 3.2 Calcination temperature 3.3 Ru loading 4 Conclusions CRediT authorship contribution statement Acknowledgements References TAO 2017 267 276 M SU 2016 553 565 X RONSCH 2016 273 296 S PUGA 2016 1268 1278 V ABDELMAGEED 2018 5399 5414 M ABDELMAGEED 2015 8672 8675 M ABDELMAGEED 2015 6753 6763 M SOLYMOSI 1980 471 474 F BOBADILLA 2019 248 257 L LAGUNA 2022 216 225 O ABDELMAGEED 2013 148 160 M PANAGIOTOPOULOU 2009 470 478 P TAKENAKA 2004 1065 1073 T DEBECKERA 2018 615 625 K ABE 2009 315 321 T CISNEROS 2021 119483 S LI 2021 120597 X BALARAJU 2010 107 114 M SASSOYE 2011 3230 3237 C JACOB 2008 136 140 K TAUSTER 1978 170 175 S LI 1999 D PANAGIOTOPOULOU 2008 45 54 P LIN 2004 51 58 H BICKLEY 1991 178 190 R MARTINEZT 2016 189 197 L SANCHEZ 2016 8117 8128 K FUKUHARA 2017 12 18 C LIU 2012 599 605 Z MEN 2007 81 87 Y KOBORI 1981 92 93 Y LOVELESS 2013 6107 6121 B JIMENEZBARRERA 2018 986 995 E WASYLENKO 2007 5497 5502 W LOVELESS 2013 6107 6121 B MUNUERA 1972 113 117 G BOEHM 1966 179 274 H MUNOZMURILLO 2018 420 427 A GUNASOORIYA 2016 3660 3664 G NAVARROJAEN 2019 750 761 S OSTERLUND 2010 203 219 L HENDERSON 1997 221 229 M BOEHM 1966 179 274 H HENDERSON 1994 315 328 M SOLYMOSI 1981 2645 2657 F NAWDALI 2000 247 256 M INUI 1980 385 388 T KWAK 2013 2449 2455 J FERNANDEZ 2014 194 202 C FERNANDEZ 2015 48 56 C KARELOVIC 2012 237 249 A KIM 2016 8117 8128 BEULS 2012 2 10 A JACQUEMIN 2010 462 466 M KWAK 2013 2449 2455 J ISMAIL 2011 982 991 A FUJITA 1997 63 68 S OVER 2003 3 17 M DAHL 2000 381 390 S FORNI 1999 269 275 L HU 2007 103 110 J LANGE 2015 55 62 F ROSSETI 2005 315 320 I GONZALEZCARBALLO 2011 102 108 J TRUSZKIEWICZ 2017 1299 1305 E MARTINEZTX2022X118678 MARTINEZTX2022X118678XL 2024-05-27T00:00:00.000Z 2024-05-27T00:00:00.000Z http://creativecommons.org/licenses/by-nc-nd/4.0/ © 2022 Elsevier B.V. All rights reserved. 0 https://doi.org/10.15223/policy-017 https://doi.org/10.15223/policy-037 https://doi.org/10.15223/policy-012 https://doi.org/10.15223/policy-029 https://doi.org/10.15223/policy-004 item S0926-860X(22)00201-0 S0926860X22002010 1-s2.0-S0926860X22002010 10.1016/j.apcata.2022.118678 271346 2024-01-01T12:34:28.416125Z 2022-07-05 1-s2.0-S0926860X22002010-main.pdf https://s3-eu-west-1.amazonaws.com/prod-ucs-content-store-eu-west/content/pii:S0926860X22002010/MAIN/application/pdf/7044d9f88a37ccf93471c27a16d629f8/main.pdf main.pdf pdf true 6564984 MAIN 12 1-s2.0-S0926860X22002010-main_1.png https://s3-eu-west-1.amazonaws.com/prod-ucs-content-store-eu-west/content/pii:S0926860X22002010/PREVIEW/image/png/4ecdc849b12bf33395fbeb16a230f38f/main_1.png main_1.png png 53855 849 656 IMAGE-WEB-PDF 1 1-s2.0-S0926860X22002010-gr6.jpg https://s3-eu-west-1.amazonaws.com/prod-ucs-content-store-eu-west/content/pii:S0926860X22002010/gr6/DOWNSAMPLED/image/jpeg/ba84314666e3c6cc64e5fda0125e208c/gr6.jpg gr6 gr6.jpg jpg 29344 314 376 IMAGE-DOWNSAMPLED 1-s2.0-S0926860X22002010-gr7.jpg https://s3-eu-west-1.amazonaws.com/prod-ucs-content-store-eu-west/content/pii:S0926860X22002010/gr7/DOWNSAMPLED/image/jpeg/613093a25380bc37c608bcc7307758eb/gr7.jpg gr7 gr7.jpg jpg 37166 538 376 IMAGE-DOWNSAMPLED 1-s2.0-S0926860X22002010-gr8.jpg https://s3-eu-west-1.amazonaws.com/prod-ucs-content-store-eu-west/content/pii:S0926860X22002010/gr8/DOWNSAMPLED/image/jpeg/7f724a9943dbbcd19e2e12b2a65fc24a/gr8.jpg gr8 gr8.jpg jpg 47405 565 678 IMAGE-DOWNSAMPLED 1-s2.0-S0926860X22002010-gr9.jpg https://s3-eu-west-1.amazonaws.com/prod-ucs-content-store-eu-west/content/pii:S0926860X22002010/gr9/DOWNSAMPLED/image/jpeg/53177e37446f97a7d87fb260626cc6b6/gr9.jpg gr9 gr9.jpg jpg 28124 350 376 IMAGE-DOWNSAMPLED 1-s2.0-S0926860X22002010-gr2.jpg https://s3-eu-west-1.amazonaws.com/prod-ucs-content-store-eu-west/content/pii:S0926860X22002010/gr2/DOWNSAMPLED/image/jpeg/22944c3b1b8b0641b00aa0ebc2a6dc94/gr2.jpg gr2 gr2.jpg jpg 16646 325 376 IMAGE-DOWNSAMPLED 1-s2.0-S0926860X22002010-ga1.jpg https://s3-eu-west-1.amazonaws.com/prod-ucs-content-store-eu-west/content/pii:S0926860X22002010/ga1/DOWNSAMPLED/image/jpeg/d0b3468d3849b07fd0ab32d3d1ada464/ga1.jpg ga1 true ga1.jpg jpg 30424 245 245 IMAGE-DOWNSAMPLED 1-s2.0-S0926860X22002010-gr3.jpg https://s3-eu-west-1.amazonaws.com/prod-ucs-content-store-eu-west/content/pii:S0926860X22002010/gr3/DOWNSAMPLED/image/jpeg/17cfb6e74a28428a6c3409b0cacec33d/gr3.jpg gr3 gr3.jpg jpg 59340 273 791 IMAGE-DOWNSAMPLED 1-s2.0-S0926860X22002010-gr4.jpg https://s3-eu-west-1.amazonaws.com/prod-ucs-content-store-eu-west/content/pii:S0926860X22002010/gr4/DOWNSAMPLED/image/jpeg/a5ca896d94263c75848372850edc7d9c/gr4.jpg gr4 gr4.jpg jpg 27473 261 678 IMAGE-DOWNSAMPLED 1-s2.0-S0926860X22002010-gr5.jpg https://s3-eu-west-1.amazonaws.com/prod-ucs-content-store-eu-west/content/pii:S0926860X22002010/gr5/DOWNSAMPLED/image/jpeg/997731ccd6de632c477ad164425edf92/gr5.jpg gr5 gr5.jpg jpg 54612 585 678 IMAGE-DOWNSAMPLED 1-s2.0-S0926860X22002010-gr11.jpg https://s3-eu-west-1.amazonaws.com/prod-ucs-content-store-eu-west/content/pii:S0926860X22002010/gr11/DOWNSAMPLED/image/jpeg/8866990236e8d83b1947f1c06926457e/gr11.jpg gr11 gr11.jpg jpg 27866 255 678 IMAGE-DOWNSAMPLED 1-s2.0-S0926860X22002010-gr1.jpg https://s3-eu-west-1.amazonaws.com/prod-ucs-content-store-eu-west/content/pii:S0926860X22002010/gr1/DOWNSAMPLED/image/jpeg/0ff8289e16d02b4a3c1d4f95b45a1d70/gr1.jpg gr1 gr1.jpg jpg 87253 434 565 IMAGE-DOWNSAMPLED 1-s2.0-S0926860X22002010-gr10.jpg https://s3-eu-west-1.amazonaws.com/prod-ucs-content-store-eu-west/content/pii:S0926860X22002010/gr10/DOWNSAMPLED/image/jpeg/8c05062d28bd118c446b7c71c689fbe8/gr10.jpg gr10 gr10.jpg jpg 65545 501 678 IMAGE-DOWNSAMPLED 1-s2.0-S0926860X22002010-gr6.sml https://s3-eu-west-1.amazonaws.com/prod-ucs-content-store-eu-west/content/pii:S0926860X22002010/gr6/THUMBNAIL/image/gif/d1d2a40891d4a3b88c42e5c0545f0ec7/gr6.sml gr6 gr6.sml sml 9797 164 196 IMAGE-THUMBNAIL 1-s2.0-S0926860X22002010-gr7.sml https://s3-eu-west-1.amazonaws.com/prod-ucs-content-store-eu-west/content/pii:S0926860X22002010/gr7/THUMBNAIL/image/gif/a97240695358b9c78d0be2bec25b4966/gr7.sml gr7 gr7.sml sml 5123 163 114 IMAGE-THUMBNAIL 1-s2.0-S0926860X22002010-gr8.sml https://s3-eu-west-1.amazonaws.com/prod-ucs-content-store-eu-west/content/pii:S0926860X22002010/gr8/THUMBNAIL/image/gif/38a7f7267f168004b3452237f19e46d1/gr8.sml gr8 gr8.sml sml 6033 163 196 IMAGE-THUMBNAIL 1-s2.0-S0926860X22002010-gr9.sml https://s3-eu-west-1.amazonaws.com/prod-ucs-content-store-eu-west/content/pii:S0926860X22002010/gr9/THUMBNAIL/image/gif/a4d8dcc861d9b37ea2a19368e0e0fbe0/gr9.sml gr9 gr9.sml sml 7119 164 176 IMAGE-THUMBNAIL 1-s2.0-S0926860X22002010-gr2.sml https://s3-eu-west-1.amazonaws.com/prod-ucs-content-store-eu-west/content/pii:S0926860X22002010/gr2/THUMBNAIL/image/gif/6916ba4b7e4bf60cb45ec79430c537df/gr2.sml gr2 gr2.sml sml 4985 164 190 IMAGE-THUMBNAIL 1-s2.0-S0926860X22002010-ga1.sml https://s3-eu-west-1.amazonaws.com/prod-ucs-content-store-eu-west/content/pii:S0926860X22002010/ga1/THUMBNAIL/image/gif/e48b1209eceee0934faff4046841f29d/ga1.sml ga1 true ga1.sml sml 22030 164 164 IMAGE-THUMBNAIL 1-s2.0-S0926860X22002010-gr3.sml https://s3-eu-west-1.amazonaws.com/prod-ucs-content-store-eu-west/content/pii:S0926860X22002010/gr3/THUMBNAIL/image/gif/e4bb8a84d3281091dfb54aded3423c64/gr3.sml gr3 gr3.sml sml 10423 76 219 IMAGE-THUMBNAIL 1-s2.0-S0926860X22002010-gr4.sml https://s3-eu-west-1.amazonaws.com/prod-ucs-content-store-eu-west/content/pii:S0926860X22002010/gr4/THUMBNAIL/image/gif/abe7f4fd16c6cad5f44b07e9242c1e85/gr4.sml gr4 gr4.sml sml 3883 84 219 IMAGE-THUMBNAIL 1-s2.0-S0926860X22002010-gr5.sml https://s3-eu-west-1.amazonaws.com/prod-ucs-content-store-eu-west/content/pii:S0926860X22002010/gr5/THUMBNAIL/image/gif/ad66049e210a06dd434488e713c78b8c/gr5.sml gr5 gr5.sml sml 7495 164 190 IMAGE-THUMBNAIL 1-s2.0-S0926860X22002010-gr11.sml https://s3-eu-west-1.amazonaws.com/prod-ucs-content-store-eu-west/content/pii:S0926860X22002010/gr11/THUMBNAIL/image/gif/98499b315d52fdffbc058da54d211234/gr11.sml gr11 gr11.sml sml 4272 82 219 IMAGE-THUMBNAIL 1-s2.0-S0926860X22002010-gr1.sml https://s3-eu-west-1.amazonaws.com/prod-ucs-content-store-eu-west/content/pii:S0926860X22002010/gr1/THUMBNAIL/image/gif/0eaf129223ab49d507b70f7ecb1824cc/gr1.sml gr1 gr1.sml sml 14993 163 213 IMAGE-THUMBNAIL 1-s2.0-S0926860X22002010-gr10.sml https://s3-eu-west-1.amazonaws.com/prod-ucs-content-store-eu-west/content/pii:S0926860X22002010/gr10/THUMBNAIL/image/gif/b4ab1708972ce053456939f33fc77416/gr10.sml gr10 gr10.sml sml 14590 162 219 IMAGE-THUMBNAIL 1-s2.0-S0926860X22002010-gr6_lrg.jpg https://s3-eu-west-1.amazonaws.com/prod-ucs-content-store-eu-west/content/pii:S0926860X22002010/gr6/HIGHRES/image/jpeg/f94a417a070fd02ec2ec90b2c3c710d3/gr6_lrg.jpg gr6 gr6_lrg.jpg jpg 179917 1390 1663 IMAGE-HIGH-RES 1-s2.0-S0926860X22002010-gr7_lrg.jpg https://s3-eu-west-1.amazonaws.com/prod-ucs-content-store-eu-west/content/pii:S0926860X22002010/gr7/HIGHRES/image/jpeg/2a820db8fcf1557b7e1571c3ade37567/gr7_lrg.jpg gr7 gr7_lrg.jpg jpg 188229 2379 1663 IMAGE-HIGH-RES 1-s2.0-S0926860X22002010-gr8_lrg.jpg https://s3-eu-west-1.amazonaws.com/prod-ucs-content-store-eu-west/content/pii:S0926860X22002010/gr8/HIGHRES/image/jpeg/d2e32bb652decc59231d5f2721900c1d/gr8_lrg.jpg gr8 gr8_lrg.jpg jpg 288379 2497 2994 IMAGE-HIGH-RES 1-s2.0-S0926860X22002010-gr9_lrg.jpg https://s3-eu-west-1.amazonaws.com/prod-ucs-content-store-eu-west/content/pii:S0926860X22002010/gr9/HIGHRES/image/jpeg/3dcd7e1591ed056e3959154f5b9309e1/gr9_lrg.jpg gr9 gr9_lrg.jpg jpg 159859 1548 1663 IMAGE-HIGH-RES 1-s2.0-S0926860X22002010-gr2_lrg.jpg https://s3-eu-west-1.amazonaws.com/prod-ucs-content-store-eu-west/content/pii:S0926860X22002010/gr2/HIGHRES/image/jpeg/7004c591f52a520a1696499f0c5744b5/gr2_lrg.jpg gr2 gr2_lrg.jpg jpg 96030 1437 1663 IMAGE-HIGH-RES 1-s2.0-S0926860X22002010-ga1_lrg.jpg https://s3-eu-west-1.amazonaws.com/prod-ucs-content-store-eu-west/content/pii:S0926860X22002010/ga1/HIGHRES/image/jpeg/5f6641111fef72a4f43f84f48e9a5c97/ga1_lrg.jpg ga1 true ga1_lrg.jpg jpg 279724 1085 1085 IMAGE-HIGH-RES 1-s2.0-S0926860X22002010-gr3_lrg.jpg https://s3-eu-west-1.amazonaws.com/prod-ucs-content-store-eu-west/content/pii:S0926860X22002010/gr3/HIGHRES/image/jpeg/dcb9aea78f0d2cbad89b4145584f121d/gr3_lrg.jpg gr3 gr3_lrg.jpg jpg 310615 1205 3493 IMAGE-HIGH-RES 1-s2.0-S0926860X22002010-gr4_lrg.jpg https://s3-eu-west-1.amazonaws.com/prod-ucs-content-store-eu-west/content/pii:S0926860X22002010/gr4/HIGHRES/image/jpeg/e7cd344485d79c447613e120454ce82b/gr4_lrg.jpg gr4 gr4_lrg.jpg jpg 150044 1154 2994 IMAGE-HIGH-RES 1-s2.0-S0926860X22002010-gr5_lrg.jpg https://s3-eu-west-1.amazonaws.com/prod-ucs-content-store-eu-west/content/pii:S0926860X22002010/gr5/HIGHRES/image/jpeg/9e9583045cf45c7ee981f8c553e36da5/gr5_lrg.jpg gr5 gr5_lrg.jpg jpg 380707 2584 2994 IMAGE-HIGH-RES 1-s2.0-S0926860X22002010-gr11_lrg.jpg https://s3-eu-west-1.amazonaws.com/prod-ucs-content-store-eu-west/content/pii:S0926860X22002010/gr11/HIGHRES/image/jpeg/f85edb25d92e53b03b0cdbeed65fa4dd/gr11_lrg.jpg gr11 gr11_lrg.jpg jpg 152688 1125 2994 IMAGE-HIGH-RES 1-s2.0-S0926860X22002010-gr1_lrg.jpg https://s3-eu-west-1.amazonaws.com/prod-ucs-content-store-eu-west/content/pii:S0926860X22002010/gr1/HIGHRES/image/jpeg/3d07ae5c06260b1ade92197f66538e3c/gr1_lrg.jpg gr1 gr1_lrg.jpg jpg 499553 1915 2495 IMAGE-HIGH-RES 1-s2.0-S0926860X22002010-gr10_lrg.jpg https://s3-eu-west-1.amazonaws.com/prod-ucs-content-store-eu-west/content/pii:S0926860X22002010/gr10/HIGHRES/image/jpeg/ba48f5a897380e3bf6a55fd97b967d0a/gr10_lrg.jpg gr10 gr10_lrg.jpg jpg 320981 2211 2994 IMAGE-HIGH-RES 1-s2.0-S0926860X22002010-si0001.svg https://s3-eu-west-1.amazonaws.com/prod-ucs-content-store-eu-west/content/pii:S0926860X22002010/STRIPIN/image/svg+xml/b38f9019536fecff4ca8747e3fd80159/si0001.svg si0001 si0001.svg svg 3570 ALTIMG 1-s2.0-S0926860X22002010-si0002.svg https://s3-eu-west-1.amazonaws.com/prod-ucs-content-store-eu-west/content/pii:S0926860X22002010/STRIPIN/image/svg+xml/9c0de95cd1a78b73f8feb0bd2e071933/si0002.svg si0002 si0002.svg svg 4117 ALTIMG 1-s2.0-S0926860X22002010-si0003.svg https://s3-eu-west-1.amazonaws.com/prod-ucs-content-store-eu-west/content/pii:S0926860X22002010/STRIPIN/image/svg+xml/e10ac45f2fc4330b13762431c0981cad/si0003.svg si0003 si0003.svg svg 3861 ALTIMG 1-s2.0-S0926860X22002010-si0004.svg https://s3-eu-west-1.amazonaws.com/prod-ucs-content-store-eu-west/content/pii:S0926860X22002010/STRIPIN/image/svg+xml/1fc3f2ea14e835e57f734031b057f5e2/si0004.svg si0004 si0004.svg svg 1288 ALTIMG 1-s2.0-S0926860X22002010-si0005.svg https://s3-eu-west-1.amazonaws.com/prod-ucs-content-store-eu-west/content/pii:S0926860X22002010/STRIPIN/image/svg+xml/7c96ee001070b93e8d47f63a9fe03704/si0005.svg si0005 si0005.svg svg 2034 ALTIMG 1-s2.0-S0926860X22002010-si0006.svg https://s3-eu-west-1.amazonaws.com/prod-ucs-content-store-eu-west/content/pii:S0926860X22002010/STRIPIN/image/svg+xml/ece5deb2b7747a7a28c7020fdd7de33b/si0006.svg si0006 si0006.svg svg 4275 ALTIMG 1-s2.0-S0926860X22002010-si0007.svg https://s3-eu-west-1.amazonaws.com/prod-ucs-content-store-eu-west/content/pii:S0926860X22002010/STRIPIN/image/svg+xml/ced2c2a96099a6ea930bc8dcf89b8d7b/si0007.svg si0007 si0007.svg svg 1308 ALTIMG 1-s2.0-S0926860X22002010-si0008.svg https://s3-eu-west-1.amazonaws.com/prod-ucs-content-store-eu-west/content/pii:S0926860X22002010/STRIPIN/image/svg+xml/228997876aed189c197166a1819657dd/si0008.svg si0008 si0008.svg svg 1029 ALTIMG 1-s2.0-S0926860X22002010-am.pdf am am.pdf pdf 45302988 AAM-PDF https://s3-eu-west-1.amazonaws.com/prod-ucs-content-store-eu-west/content/egi:10D4DMDZTCR/MAIN/application/pdf/2f819b5f92ec3b023ff6e4114bcace04/am.pdf APCATA 118678 118678 S0926-860X(22)00201-0 10.1016/j.apcata.2022.118678 Elsevier B.V. Fig. 1 XRD patterns of (a) commercial TiO2 supports, (b) Ru/TiO2 catalysts, (c and d) zoom of highlighted zones. Fig. 1 Fig. 2 H2 -TPR profiles for Ru/TiO2-P25 treated in synthetic air or hydrogen. Fig. 2 Fig. 3 TEM micrographs and particle size distribution for reduced Ru/TiO2-P25 treated with (a) synthetic air, (b) hydrogen, (c) distribution of metal Ru particles. Fig. 3 Fig. 4 Oxidative and/or reductive atmosphere effect on selective methanation of CO with Ru/TiO2-P25. Feed composition: 1%CO, 15% CO2, 50%H2 (balance N2); WHSV: 80,000 mL.g−1.h−1. Fig. 4 Fig. 5 (a) XRD pattern for Ru/TiO2-P25 samples treated at different temperatures with synthetic air, (b) zoom between 2θ = 27° and 36.5°, (c) zoom between 2θ = 27° and 29°. Fig. 5 Fig. 6 Raman spectra for Ru/TiO2-P25 samples treated at different temperatures with synthetic air (A: Anatase TiO2, R: Rutile TiO2, RuO2: Rutile RuO2). Fig. 6 Fig. 7 H2 -TPR profiles for Ru/TiO2-P25 samples treated at different temperatures. (reducibility percentages at the upper right). Fig. 7 Fig. 8 Calcination temperature effect on selective methanation of CO with Ru/TiO2-P25 previously treated with synthetic air. Feed composition: 1%CO, 15% CO2, 50%H2 (balance N2); WHSV: 80,000 mL.g−1.h−1. Fig. 8 Fig. 9 in situ Raman spectra for methanation with different atmospheres on Ru/TiO2-P25 at 220 ºC. Fig. 9 Fig. 10 in-situ XRD in synthetic air with the increasing calcination temperature for (a) TiO2-P25, (b) 5%Ru/TiO2-P25, (c) 10%Ru/TiO2-P25, (d) 20%Ru/TiO2-P25. Fig. 10 Fig. 11 Ru loading effect on selective methanation of CO with Ru/TiO2-P25 previously treated with synthetic air at 400 °C. Feed composition: 1%CO, 15% CO2, 50%H2 (balance N2); WHSV: 80,000 mL.g−1.h−1. Fig. 11 Table 1 Comparative conditions and CO conversion temperatures. Table 1 Catalysts Conditions SCO methanation. Highest XCO (100%) and SCH4 (Optimal temperatures) Reference 10 wt% Ru/TiO2 CO (300 ppm); H2 60 vol%; CO2 21 vol% 21; H2O vol% 16; N2 for balance. 180 °C and 200 °C [10] 2.2 wt% Ru/zeolite CO (0–6000 ppm); N2 3%; CO2 15.5%; H2 for balance. CO 6000 ppm converted at 190 °C [11] 0.5–5.0 wt% Ru/ Al2O3, TiO2, YSZ, CeO2 and SiO2. 1%CO, 15%CO2 and 50%H2 (balance He). 5%Ru/TiO2 at 230 °C [12] 10 wt% Ni/catalysts and5 wt% Ru/catalysts -H2 (33:5 kPa), CO (0:8 kPa) and He(67:0 kPa)-H2 (60:0 kPa), CO2 (15:0 kPa), H2O (0:8 kPa), CO (0:5 kPa) and He (25:0 kPa). XCO at 250 °CNi/MgO (0%) <Ni/Al2O3 (7.9%)<Ni/SiO2 (30.0%)<Ni/TiO2 (42.0%) <Ni/ZrO2 (71.0%).XCO (100%) at 300 °C with Ni/ZrO2 XCO (100%) at 250 °C, Ru/TiO2 ([CO] final= 20 ppm). [13] 2.2 wt% of Ru/TiO2 mixed supports 20 mL/min (CO2 (10 vol%), H2 (40 vol%) diluted in He). RuO2 phase located on rutile TiO2 at 200 °C. [14] Ru/TiO2 anatase CO2 and H2 in a molecular ratio of 1:4. Methanation of CO2 100% yield at ca. 160 °C. [15] 2.3 wt%Ru/TiO2 modified with Si 0.6 vol% CO, 15.5 vol% CO2, 3.0 vol% N2, balance H2, 190 °C [16] 3%Ru/commercial anatase-TiO2 0.5 vol% CO, 16 vol% CO2, 67 vol% H2, 10 vol% N2. Total flow 20 mL min− 1 CO concentration below 10 ppm with greater than 50% selectivity in range of 200 − 265°C [17] Table 2 Physicochemical characteristics of TiO2 catalysts. Table 2 Name XRF Ru (%) Crystallite size (nm) Band gap (eV) SBET (m2/g) Pore RuO2 TiO2 Anatase Rutile V (cm3/g) D (nm) TiO2-P25 – 30 59 3.10 50 0.16 21 Ru/TiO2-P25 5.0 16 31 62 3.09 45 0.19 23 TiO2-G5 – 25 – 3.22 74 0.34 12 Ru/TiO2-G5 4.5 23 24 – – 80 0.31 15 TiO2-DT51 – 27 – 3.22 63 0.31 12 Ru/TiO2-DT51 4.8 17 28 – 2.98 70 0.26 15 TiO2-(R+A) – 30 191 3.23 53 0.19 15 Ru/TiO2-(R+A) 5.0 27 30 430 2.87 59 0,17 15 Table 3 Mol of CO converted. (g.Ru−1.min−1(x103)). Table 3 Catalysts Mol of CO converted. g.Ru−1.min−1 (x103) 200 ºC 210 ºC Ru/TiO2 P25 75 115 Ru /TiO2G5 cal. 5 19 Ru/TiO2 DT51 0 15 Ru/TiO2 (R+A) 0 0 Table 4 Effect of atmosphere on physicochemical properties of Ru/TiO2–P25. Table 4 Pretreatment Reduced samples Fresh samples Ru crystallite size (nm) (2θ ≅ 44.01°) Ru particle size (nm) from TEM analysis SBET (m2/g) % of reducibility from H2-TPR results Synthetic air 3.8 2.4 43 89 H2 Peak not observed 1.2 45 9 Table 5 Some physicochemical parameters for Ru/TiO2-P25 calcined at different temperatures in synthetic air. Table 5 Physicochemical parameters Dried at 130 ºC 300 ºC 400 ºC 450 ºC 600 ºC TiO2 anatase crystallite size (nm) (2θ ≅ 25.3°) 29.6 30.4 30.5 30.6 52.5 TiO2 rutile crystallite size (nm) (2θ ≅ 27.5°) 59.4 53.4 55.5 58.8 107.6 SBET (m2/g) 50 39 36 39 13 Ru Dispersion(reduced sample) (%) – 64 60 61 51 Ru Particle size (reduced sample) (nm) – 1.3 1.4 1.4 1.6 Table 6 Metal loading effect on physicochemical parameters for Ru/TiO2-P25 samples calcined at 400 °C with synthetic air. Table 6 Physicochemical parameters Ru (2 wt%) Ru (5 wt%) Ru (10 wt%) Ru (20 wt%) Ru (wt%) from XRF 2.5 5.1 10.2 18.3 SBET (m2/g) 50 36 35 12 TiO2 anatase crystallite size (nm) 29.5 30.5 29.0 29.0 TiO2 rutile crystallite size (nm) 54.9 55.5 40.0 30.0 RuO2 rutile crystallite size (nm) Peak not observed 14.8 22.0 24.0 The effect of support surface hydroxyls on selective CO methanation with Ru based catalysts L.M. Martínez T Methodology Investigation Formal analysis Writing – review & editing a ⁎ Munoz A. Muñoz Methodology Investigation a Perez A. Pérez Investigation Formal analysis a b O.H. Laguna Methodology Investigation Formal analysis a c L.F. Bobadilla Methodology Investigation Formal analysis a M.A. Centeno Supervision Visualization Writing – review & editing a J.A. Odriozola Project administration Funding acquisition a a Departamento de Química Inorgánica e Instituto de Ciencia de Materiales de Sevilla (ICMS), Centro Mixto CSIC-Universidad de Sevilla, Calle Américo Vespucio 49, Seville 41092, Spain Departamento de Química Inorgánica e Instituto de Ciencia de Materiales de Sevilla (ICMS), Centro Mixto CSIC-Universidad de Sevilla Calle Américo Vespucio 49 Seville 41092 Spain Departamento de Química Inorgánica e Instituto de Ciencia de Materiales de Sevilla (ICMS), Centro Mixto CSIC-Universidad de Sevilla, Calle Américo Vespucio 49, 41092 Seville, Spain b Línea de Investigación en Tecnología Ambiental y de Materiales (ITAM), Departamento de Química, Facultad de Ciencias, Pontificia Universidad Javeriana, Carrera 7 No. 43-82, Bogotá D.C., Colombia Línea de Investigación en Tecnología Ambiental y de Materiales (ITAM), Departamento de Química, Facultad de Ciencias, Pontificia Universidad Javeriana Carrera 7 No. 43-82 Bogotá D.C Colombia Línea de Investigación en Tecnología Ambiental y de Materiales (ITAM), Departamento de Química, Facultad de Ciencias, Pontificia Universidad Javeriana, Carrera 7 No. 43–82, Bogotá D.C., Colombia c Escuela Politécnica Superior de Linares, Universidad de Jaén, Av. De la Universidad s/n, Linares (Jaén) 23700, Spain Escuela Politécnica Superior de Linares, Universidad de Jaén Av. De la Universidad s/n Linares (Jaén) 23700 Spain Escuela Politécnica Superior de Linares, Universidad de Jaén, Av. De la Universidad s/n, 23700 Linares (Jaén), Spain ⁎ Corresponding author. The aim of this work was to clarify the effect of the support on CO selective methanation with Ru/TiO2 catalysts. TPR, XRD and TEM measurements confirmed that the changes in the activity and selectivity should be ascribed to anatase:rutile ratio, RuO2 +TiO2 solid solution formation, as well as the metal content and the thermal treatment used. All these characteristics result in active and selective catalysts in which the suppression of the reverse water gas shift reaction was observed. The catalytic performance must be explained by both the formation of more active Ru species as a result of support influence and the higher Ru dispersion. The study allows to conclude that for CO activation the role of support surface hydroxyls seems to be determinant for both the activity and selectivity of Ru/TiO2 catalysts. Graphical Abstract ga1 Keywords Ru/TiO2 catalysts TiO2 rutile TiO2 anatase RuO2 rutile CO methanation CO2 methanation Support surface hydroxyls 1 Introduction Selective methanation of CO (Eq. 1) in H2-rich gas mixtures is an interesting alternative to the commonly used preferential oxidation of CO (PROX reaction, Eq. 2) to selectively remove small amounts of CO from H2 rich feed gases for low-temperature polymer electrolyte fuel cells (PEFCs) [1–4]. Since these feed gases are often obtained from reforming hydrocarbons or biomass, and after Water Gas Shift (WGS) units, they also contain signiﬁcant amounts of CO2 in addition to CO. Therefore, the reaction has to be highly selective for the methanation of CO, as the methanation of CO2 (Eq. 3) would lead to intolerable losses of H2. (1) CO + 3 H2 ↔ CH4 + H2O ΔHº= −206 Kj/mol (2) CO + O2↔ CO2 ΔHº=−283 KJ/mol (3) CO2 + 4 H2↔CH4 + 2 H2O ΔHº= −165 Kj/mol Among other, textural properties, active metal particle size, reducibility properties and metal dispersion play significant roles in the optimization of industrial catalysts formulations, as these parameters directly affect the transfer of reactants and products in the catalyst. Reducible metal oxides have been widely used as support materials. Among them, TiO2 is known for its high stability, high ultraviolet absorption, and semiconductor properties which allow its use in various applications in catalysis and photocatalysis [5]. Furthermore, the existence of various crystalline phases of TiO2 contributes to catalytic performance in heterogeneous catalysis through morphologic and electronic changes. TiO2 is an efficient support for noble metal catalysts including Pd, Ru and Rh in CO and CO2 methanation [6,7]. Particularly, TiO2-supported RuO2 nanoparticles have shown excellent methanation capability [8–10]. The activity and selectivity of Ru catalysts to CH4 have been claimed to be largely dependent on the dispersion, the concentration and the particle size of the metal phase. Previous studies have demonstrated that both activity and particularly the selectivity of Ru catalysts strongly depends on Ru particle size, achieving 100% of selectivity in CO2-rich reformate gases down to very low CO concentrations [11]. Panagiotopoulou et. al [12] used supported ruthenium catalysts from 0.5 to 5.0 wt% for the selective methanation of CO in the presence of excess CO2. Conversion of CO2 was completely suppressed until conversion of CO reached its maximum value. Increasing metal loading resulted in a significant shift of the CO conversion curves towards lower temperatures with a lower participation of the Reverse Water Gas Shift reaction (RWGS, Eq. 4). (4) CO2 + H2↔ CO + H2O ΔHº= 41 Kj/mol Optimal results were obtained with 5 w/w% Ru on TiO2 catalyst with a mean crystallite size of 13.6 nm against 1.3 nm for 0.5 w/w% Ru. High Ru loading was able to convert CO completely and selectively at temperatures around 230 °C. Takenaka et. al [13] found an opposite trend. They proposed Ni/ZrO2 and Ru/TiO2 as promising catalysts based on a screening experiment and concluded that the larger Ni and the smaller Ru were the responsible of the high catalytic activity. Table 1 shows comparative conditions to provide a panoramic overview with some works that relate the Ru content with the temperature to achieve highest CO conversion and selectivity towards methane. Metal-support interactions (MSI) can modify the catalytic properties of the metal phase and therefore, the nature of the support plays a crucial role in the reaction pathway. Different studies on the crystal phase effect of TiO2 on the structure and performance of Ru nanoparticles in CO2 hydrogenation have been reported. For instance, Debeckera et.al [14] demonstrated the strong impact of the support crystal structure on Ru dispersion and on methanation activity. Rutile TiO2 was identified as promising support as a result of the strong interaction that it can develop with RuO2, as both has the same crystalline structure [10]. However, the use of rutile TiO2 is limited by its low specific surface area. The impact of the structure–activity relationships in Ru based catalysts has given rise to various preparation methods for well-dispersed and/or uniformly-sized nanoparticles of Ru and RuO2 for many catalytic applications in hydrogenation reactions [10–17]. Balaraju et al. [18] have shown the superior catalytic performances of Ru/TiO2 catalysts prepared by a deposition– precipitation method compared with those prepared by a conventional impregnation one, which was attributed to the presence of well-dispersed nano-sized Ru particles- Also, Sassoye et al. [19] have reported the synthesis of 2 nm RuO2 nanoparticles and the preparation of Ru/TiO2 catalysts after reduction under H2. Such catalysts demonstrated superior catalytic performance in CO2 methanation. Because of their well-known tendency of exhibiting higher selectivity and activity in selective CO methanation, in this work we used a set of Ru/TiO2 supported catalysts with widely varying TiO2 surface areas with different crystalline structures. We verify whether higher activity can be explained by the formation of more active Ru species or whether it is simply governed by dispersion (or both). Commercial TiO2 supports are explored in an attempt to separate the crystalline structural eﬀect from thermal stability against sintering. Diﬀerent approaches where the metal crystallite size was modified in a very controlled way, namely, different Ru loadings (2%, 5%, 10% and 20%.wt), different calcination temperatures (300ºC, 400ºC, 450ºC and 600ºC) or different thermal treatment (synthetic air and/or hydrogen) are studied. The relationships between CO hydrogenation activity and physicochemical properties of the dispersed metal phase are discussed. 2 Experimental 2.1 Catalysts Ru/TiO2 catalysts were prepared using commercially TiO2 supports: TiO2-P25 (Aeroxide P25, Evonik, 80:20 anatase: rutile), TiO2-G5 (anatase G5 from Millenium calcined at 450ºC), TiO2-DT51 (anatase DT51 from Millenium), TiO2-(R+A) (80:20 TiO2-DT51:TiO2 rutile from Johnson Matthey physical mixture). The adequate amount of Ruthenium (III) nitrosyl nitrate solution (Johnson Matthey) was diluted in water and further added to 1 g of commercial TiO2 supports to form a suspension. At the beginning the Ru loading was fixed at 5.0 w/w%. The resulting slurry was kept under agitation for 15 min and afterwards the solvent was removed at reduced pressure in a rotavapor. Prior to any thermal treatment the resulting solid was dried at 130 °C for 30 min. To activate the catalysts thermal treatments under either synthetic air or hydrogen was performed at 450ºC for 2 h at 10 °C.min−1 heating ramp. Physicochemical characteristics of TiO2 support and after Ru addition are shown in Table 2. 2.2 Characterization techniques X-Ray fluorescence (XRF) spectrometry was carried out in an X Panalytical AXIOS PW4400 equipped with a Rh tube as excitation source for determining the catalyst chemical compositions. A X`Pert Pro PANalytical. Diffraction instrument was utilized for recording the X-ray diffraction (XRD) patterns using Cu Kα radiation (40 mA, 45 kV) in [20º,80°] 2ϴ-range and a position-sensitive detector (0.05° step size and 80 s step time). Raman spectra of catalysts were recorded in a dispersive Horiba Jobin Yvon LabRam HR800 microscope with a He–Ne green laser (532.14 nm) working at 5 mW, and with a 600 g mm−1 grating. The microscope used a 50 × objective and a confocal pinhole of 1000 µm. The Raman spectrometer was calibrated using a silicon wafer. For in-situ Raman spectroscopy, a Linkam CCR100 cell was coupled to the Raman equipment. The microscope used a 20x objective and a confocal pinhole of 1000 µm. The catalysts were previously pretreated at 300 °C using 10 mL. min−1 H2 pure for 30 min and then the catalysts were studied under different methanation reaction atmospheres. TEM analysis was performed in a Philips CM 200 equipment working at 200 kV with EDS analysis and CCD camera. The textural properties were analyzed by N2 adsorption-desorption isotherms at liquid nitrogen temperature. The experiments were carried out on a Micrometrics ASAP 2010 instruments. The system was previously degassed during 2 h at 250 °C in vacuum. Pore size distribution was calculated using the Barrett, Joyner and Halenda (BJH) method on the desorption branch. Temperature-programmed reduction (TPR) experiments were carried out in a conventional quartz reactor connected to a TCD detector. The reactive gas stream (5% H2 in Ar) was flowed at 50 mL/min over 50 mg of sample, and the temperature raised at 10 °C/min from room temperature to 700 °C. A CO2-acetone trap was used to condense the gaseous products evolved, mostly water. Quantitative analyses were done by integration of the reduction signal and comparison with hydrogen consumption of a CuO reference sample. To obtain the reducibility percentage, the loading of RuO2 was taken from XRF results and a theoretical molar ratio RuO2:H2 1:2 was considered. For H2-chemisorption a Micromeritics Autochem II equipment was used. The catalysts were heated in 5% H2 in Ar atmosphere until 300 °C (45 min). Then the temperature was decreased to 75 °C. At this temperature H2-pulses were carried out. For the quantification a 2/1 molar ratio of H2-chemisorbed vs total amount of Ru atoms was considered (H/Ru). 2.3 Catalytic activity Catalytic activity tests were performed in a Microactivity PID Eng & Tech instrument. The catalyst (150 mg, 100 < ϕ < 200 µm) was diluted in the adequate amount of silicon carbide sieved to a similar particle size and placed between quartz wool forming a 5 mm fixed bed in a 9 mm internal diameter tubular stainless-steel reactor (Autoclave Engineers). Before reaction the samples were activated in-situ at 300 °C for 2 h in 60 mL/min of pure H2 flow, purged with N2, and then conditioned at 140 °C for 1 h within the reaction mixture. A 200 mL.min−1 total flow reactant mixture consisting of 1% CO, 15% CO2, 50% H2, 15% H2O and N2 as balance simulating the outlet of reformer-WGS fuel processors was always used. The WHSV was fixed at 80,000 mL.g−1.h−1. The methanation flow was selected simulating CO-rich reformate gases from WGS units (H2 excess, CO2 presence and 1% CO concentration) and the activity for SCO methanation was studied from 140 ºC to 300 ºC in order to avoid RWGS reaction and to decrease the CO2 methanation. For the catalytic study, the reactant and products were analyzed by on-line gas chromatography (GC) using a two channel Varian µGC 4900 instrument equipped with a thermal conductivity detector (TCD) and a Vaisala Carbocap GMT220 detector for CO2. CO and CO2 conversions (XCO, XCO2), and selectivity to CO methanation (S) were defined as (Eqs. 5 to 7). (5) X CO % = F COin − F COout F COin * 100 (6) X CO 2 % = F CO 2 in − F CO 2 out F CO 2 in * 100 (7) S CO CO 2 % = X CO * F COin F CH 4 out Being F CO , F CO 2 and F CH 4 the flows in mL/min of CO, CO2 and methane respectively, the subscripts in or out correspond to the inlet or the outlet flow. In all cases, the methane selectivity, defined as Eq. 8, was higher than 95% and only traces of ethane and ethylene were detected. The carbon balance resulted to be better than 97%. (8) S tw CH 4 % = C CH 4 , out / υ CH 4 ∑ i C i , out / υ i * 100 C i , out is the product i concentration in the outlet and ν i is the carbon numbers according to its chemical formula. In all cases the time on stream was at least 30 min, so as to ensure that the steady state was always reached. The results showed an acceptable correlation and reproducibility. The error on each data point was below to 5%. 3 Results and discussion 3.1 Screening of different supports XRD patterns show two intense diffractions corresponding to the (101) and (200) planes of TiO2 anatase at 25.3° and 48.1° ( Fig. 1). For Ru/TiO2-(R+A) and TiO2-P25 diffractions lines at 27.5°, 36°, and 55° corresponding to the (110), (101), and (211) planes of TiO2 rutile are also observed. On ruthenium samples, the (110) and (200) diffractions of the RuO2 rutile phase at ≈ 28°, and ≈ 35° appear. It is worth noting that for all ruthenium samples but for the one supported on TiO2-P25, diffraction lines for both TiO2 and RuO2 rutile phases appear at 27.5 and 28.1º, respectively, indicating the existence of separated phases. However, Ru-supported TiO2-P25 catalyst shows the diffraction line for the TiO2 rutile slightly shifted, appearing at 27.4º and the one for RuO2 rutile appear as a shoulder of the main TiO2 diffraction line at smaller diffraction angles that in pure RuO2 rutile phases. This suggests the formation of a TiO2-RuO2 solid solution in this catalyst. Spinodal transformation of Ti-rich and Ru-rich solid solutions is expected for compositions of ~10 mol% either Ru or Ti containing solid solutions [20]. Upon H2-reduction at 300ºC only the Ru/TiO2-P25 catalyst present an appreciable catalytic activity being ~60% the conversion at 210ºC. Table 3 reports the catalytic activity at this temperature in comparison with the others TiO2 samples. The selectivity is almost 100% at temperatures below 190ºC, with CO conversions lower than 20%, decreasing on increasing temperature. Tauster et al. [21] proposed the concept of strong metal-support interaction (SMSI) in 1978 to describe the drastic changes in the chemisorption properties of Group 8–10 noble metals supported on TiO2 that affects the catalytic behavior in different reactions. The occurrence of an SMSI phenomenon has a direct relationship with the preparation methods of catalysts and Ru loading. An electronic effect, rather than a geometric effect, is probably the origin of this SMSI phenomenon [22]. The performance of TiO2-P25 support on the activity for the selective CO methanation on Ru catalysts has already been highlighted [23]. Although some authors reported better specific activities for the rutile phase [24] the activity of TiO2-P25 support cannot be associated to the presence of the rutile phase but to the support microstructure simultaneously with a SMSI effect. The Ru/TiO2 (R+A) catalyst, containing a similar amount of rutile phase but consisting in a physical mixture of anatase and rutile, present very poor performances. TiO2-P25 materials may be described as a layered-like structure formed by epitaxially grown rutile phased on top of anatase crystals favoring the anatase–rutile contact [25]. This microstructure allows, upon Ru impregnation, the isovalent substitution of Ti cations by Ru ones in the rutile phase forming TiO2-RuO2 solid solutions [26,27]. Using in-situ Raman spectroscopy we have demonstrated that RuO2 growths epitaxially on the TiO2 rutile phase resulting in structured RuO2/RuxTi1−xO2/TiO2 (110) catalyst precursor. H2-reduction of the precursor results in metal Ru nanoparticles with Ti3+ sites in their periphery because of hydrogen spìllover [26]. To determine the transformation of the metal precursor effect on physicochemical properties of TiO2 samples and on activity, thermal decomposition of Ru precursor has been carried out either in synthetic air flow or pure hydrogen (60 mL.min-1 total flow) at 450 ºC for 2 h. For air-decomposed precursor an H2-reduction step at 300 ºC was further performed. H2-TPR profiles of Ru/TiO2-P25 pretreated in synthetic air and/or hydrogen are presented in Fig. 2. Both patterns are very different since one sample is already reduced (hydrogen flow) meanwhile other is oxidized (synthetic air sample). These differences reinforce the existence of changes in the ruthenium particle during the treatment procedure probably in terms of size, accessibility, and/or support interaction. Only single peak of H2 consumption is observed at 76 ºC for H2 treated sample ascribed to the reduction of small portion (9%) of RuO2 that has been re-oxidized under atmosphere conditions. By contrast 89% of reducibility of RuO2 species is obtained for air synthetic treated sample ( Table 4). In this case the first reduction process is observed at 89 ºC. This reduction peak with low intensity at much higher temperature suggests higher RuO2 crystallite size and/or lower proportion of smaller metal Ru0 particles in synthetic air treated sample. Additionally, two reduction peaks at higher temperatures (150 ºC and 186 ºC) are also observed for air synthetic treated sample. Both processes are ascribed to the reduction of RuO2 species interacting in a different way with the support [21]. There are three reduction peaks normally described in the literature for Ru/TiO2: one at ≈ 105 ºC due to the well dispersed amorphous RuO2, other between ≈ 125 °C - 190 °C ascribed to well-dispersed crystalline RuO2, and the other at ≈ 223 °C, due to bulk RuO2 reduction [22]. The estimated crystallites sizes of Ru obtained from applying Scherrer equation on the (101) XRD family planes at 44.01° 2θ results to be 3.8 nm. However, after direct treatment with pure H2, nor Ru peaks could be detected by XRD, pointing to the low crystalline domain size of the Ru nanoparticles produced, under the detection limit of the XRD technique. Differences on SBET, pore volume and pore diameter of these two catalysts respect to one calcined in static air (Table 4) are noticed, which is probably due to different ruthenium phase size. Fig. 3 presents TEM micrographs and particle size distributions obtained for both thermal decomposition procedures on TiO2-P25-based catalyst. The Ru average particle size (Table 4) upon high temperature H2-reduction is much smaller than the one observed after calcination in synthetic air and further reduction at 300ºC. The decrease in the reduction temperature in H2 sample compared to the synthetic air one agrees with the lower crystallite size of RuO2 determined from XRD and confirms changes in the ruthenium particle size of the catalysts during the activation procedure. The formation of the RuxTi1−xO2 solid solution and nanoparticle tendency to nucleate on oxygen surface vacancies will justify the smaller particle size of the H2-decomposed precursor material. Fig. 4 plots the activity and selectivity of Ru/TiO2-P25 catalysts submitted to the two studied precursor decomposition procedures. The air-decomposed precursor result in a more active catalyst that arrives to ~100% CO conversion at 240ºC while the H2-decomposed sample although present activity at much lower temperatures than the air-decomposed one only arrives to CO conversion of 80%. On the contrary, the air-decomposed sample is less active for the hydrogenation of CO2. At 260 ºC, CO2 conversions are 28% and 49% for the air- and H2-decomposed samples, respectively. Therefore, the selectivity is much higher for the air-decomposed material supporting the influence of particle size on the activity and selectivity of Ru catalysts, as early claimed [28–30], although Takenaka et. al. [13] reported higher catalytic activity for small Ru particles sizes. This apparent contradiction may be understood by analyzing the metal dispersion using H2 chemisorption and the SMSI phenomenon. Ru dispersion for the air-decomposed and H2-decomposed precursors are 61% and 26%, respectively. In general CO methanation has been proposed to occur by hydrogenation of carbon formed by its dissociative adsorption [31], while other authors proposed H-assisted dissociation of CO as the key process in the methanation reaction [32]. CO hydrogenation should involve formation of HCO species that is further hydrogenated to hydroxymethylene that dissociates into CH and OH prior to form methane. It is remarkable in this mechanism the role of the adsorbed OH species that reduce the activation barrier to form the initial formyl species. The positive effect of water has been recently highlighted for Ru/Al2O3 catalysts by IR in conditions relevant to the Fischer-Tropsch synthesis [33]. This later mechanism is consistent with the previous observation of the kinetic relevance for the reaction of linearly CO adsorbed on Ru sites [34]. On Ru/Al2O3 it has been observed that linearly adsorbed CO species bonded to metal Ru sites are the active species in CO methanation whereas formate species remains on the support as spectators blocking oxygen vacancies and eliminating surface hydroxyls from the support [9]. H-assisted CO activation at high coverages during CO hydrogenation on Ru catalysts is favored on terraces sites of Ru [35], but at low CO coverages direct dissociation in low-coordination sites occur, adsorbed O species resulting from CO dissociation are hydrogenated to adsorbed OH species that intervene in the H-assisted activation of linearly adsorbed CO on Ru terraces [33]. Assuming this model for CO activation the role of support surface hydroxyls seems to be determinant for the activity ad selectivity of Ru/TiO2-P25 catalysts. All these features directly change the SMSI effect. Early works on the hydroxylation degree of TiO2 surfaces [36] pointed out that water desorbs from these surfaces at low temperatures, but a significant concentration of hydroxyls remains even at high temperature. The estimated coverage of hydroxyl groups on TiO2 decreases from 4,9 OH·nm−2 for samples outgassed at ~200ºC to ~0,5 OH·nm−2 for samples outgassed at ~450ºC, but in the presence of water at high temperatures significant surface rehydroxylation takes place [37]. Therefore, by analyzing the Ru/TiO2-P25 calcination temperature the effect of the hydroxylation degree of the support on the activity and selectivity of the catalysts is studied. 3.2 Calcination temperature Ru/TiO2-P25 was thermally treated at different temperatures (300, 400, 450 and 600 ºC) in a synthetic air flow. It must be considered that the support calcination temperature should be higher than 300 ºC for achieving a complete decomposition of Ruthenium (III) nitrosyl nitrate according to thermal decomposition data (not shown). The calcination temperature hardly affects the composition of the RuO2-TiO2 solid solution ( Fig. 5). The (110) diffraction line of the TiO2 rutile phase slightly shifts upon Ru impregnation but its position does not change with the calcination temperature. However, Ru addition favors anatase to rutile phase transformation that, although almost completed at 600 ºC, start to be significative at 400ºC, much lower than the normally reported one (≈ 800 ºC) for TiO2-P25 [26]. Raman spectra of the calcined samples clearly show an intensity increase of the TiO2 rutile absorptions from 400 ºC ( Fig. 6). TPR study evidences that whatever the calcination temperature almost complete Ru reduction is achieved upon H2-reduction at 300ºC (>90% reducibility) but for the highest temperature used, reduction degree is only ~70%. ( Fig. 7). The activity and selectivity of Ru/TiO2-P25 catalysts calcined at different temperatures are shown in Fig. 8. Whatever the support calcination temperature complete CO conversion is achieved at ~240 ºC but Ru catalyst calcined at 600 ºC reaches 100% CO conversion at ~300 ºC. It is noteworthy that at temperatures higher than ~240 ºC the CO conversion slightly decreases (97–98% CO conversions), which indicates the reverse water gas shift reaction starts to play a role [38]. Besides this, the main differences in the CO conversion curves may be ascribed to differences in mass transport because of thermal treatment affecting the textural properties. Upon calcination at 600 ºC the support crystallite size considerably increases, and the surface area is drastically reduced ( Table 5). However, chemisorption analyses show that all samples have a similar Ru dispersion, with Ru particle sizes between 1.3 and 1.6 nm. However, despite the similarities in Ru particle size, the selectivity strongly depends on the thermal treatment of the support. This behavior cannot be explained based on the active phase particle size statistically identical but on the support properties. In order to clarify this, an in situ Raman Study under different methanation reaction atmospheres at 220ºC was carried out over the Ru/TiO2-P25 catalyst first calcined at 400ºC and then reduced at 300 ºC in H2 ( Fig. 9). The spectrum under a CO2:H2:N2 atmosphere presents bands at 404, 526, 647 and 743 cm−1 that indicates the coexistence of the rutile and anatase phases of TiO2 as well as the presence of surface Ti3+-OH groups characterized by the broad band at 743 cm−1 [26]. Although CO2 methanation activity at 220 ºC is quite low and might explain the absence of bands associated to adsorbed species, on increasing the reaction temperature this support spectrum is not altered (not shown). On the contrary, if the methanation of only CO is considered, the Raman spectrum is dominated by bands at 1595, 1504, 1356 and broad signals at 1119 and 743 cm−1 [26]. The bands at 1119 and 1504 cm−1 may be ascribed to single and double C-O bonds, respectively, and the bands at 1595 and 1356 associated to the G and D bands of graphite, respectively, clearly accounts for CO dissociation on the metal surface. The relatively higher intensity of the D band with respect to the G one points a low graphitization of surface carbon as evidenced by the presence of C-H stretching modes at 2,660; 2,900 and 3,170 cm−1 ascribed to HxCO, CH3CO and/or CHx- and -CH2 = CH2 species, respectively. The presence of these species clearly points to a H-assisted CO dissociation mechanism. A similar Raman spectrum is observed during the hydrogenation of CO and CO2 mixtures but the G bands are now absent and the G:D intensity ratio is higher than for the methanation of CO alone. This clearly indicates that the presence of CO2 in the reaction mixture enhances the reactivity of the adsorbed CHx species influenced by the support effect. By adding water to the COx mixture, the main difference in the Raman spectrum besides the lower intensity of the carbon bands with respect to the TiO2 ones is the broader character of the D and G bands as well as the presence of a weak absorption at 1119 cm−1 indicating that the presence of water favors the reactivity of the adsorbed carbonaceous species. This is related to OH surface groups. The role of OH surface groups on the activation of CO has been demonstrated by Gunasooriya et al. [39], in their DFT study OH groups adsorbed on the metal surface protonates adsorbed CO resulting in HCO that is easily hydrogenated to hydroxyl methylene that dissociates with a reduced activation barrier into adsorbed CH groups. The role of support hydroxyl groups in transferring or accepting protons to adsorbed molecules o metal active phases has been previously described [9,33,40]. The main differences between catalysts on modifying the support calcination temperature are the percentage of rutile phase as evidenced by the Raman spectra and the hydroxylation degree. TiO2 surface react with CO2 leading to the formation of bicarbonate species that are further hydrogenated to adsorbed formate species by hydrogen spillover. It has been shown that monodentate formate species adsorbed on TiO2-P25 samples rapidly decomposes, while the bidentate species coordinated to both anatase and rutile phase particles are only slowly decomposed [41]. The decomposition pattern of these formate species takes place on rutile (110) surfaces at ~300ºC following a complex decomposition pattern [42]. While hydroxyls group remains on the anatase surface as temperatures as high as 450ºC [43] on rutile surfaces desorption of water molecules from recombination of the surface hydroxyl groups occurs at ~250ºC [44,45]. On the other hand, if CO remained in the syngas, methanation of CO2 is retarded. Nawdali et. al [46] demonstrated that the CO species are directly adsorbed on Ru sites and then the hydrogenation to CH4 occurs in the temperature range of 170–205ºC. In the presence of adsorbed CO on the surface, hydrogen is adsorbed on other sites aside from those involved in the absence of CO. Then CO is dissociated, leading to active and inactive carbon species, where the former is stepwise methanated to CHx species and finally to CH4. Inui et. al [47] prepared Ru-Ni-La2O3 catalyst for CO and CO2 methanation and found that CO2 methanation was completely retarded until CO has been converted to methane. This behavior could not be observed using fewer active catalysts, i.e., both CO and CO2 were converted into methane at higher temperatures. In our case the selectivity for CO methanation (SCO) against CO2 methanation remained at 100% until 20% of CO conversion is achieved with Ru/TiO2-P25. Although it is showing the appearance of the consequence of the XCO2 apparition (decay of the SCO) at higher XCO. Small differences at low reaction temperatures are observed with the solids calcined at temperatures lower than 400ºC. However, when higher calcination temperatures are used the selectivity decreases and the CO2 conversion starts at 220ºC. Increasing the reaction temperature, the formation of CO2 is favoured. Fig. 8 also shows the selectivity to CH4 (SCH4) vs CO conversion (XCO) with the temperature of calcination. The selectivity decreases from 97% to ≈ 95% reaching a minimum at XCO close to 10%. After that the selectivity increases until 100% simultaneously with the CO2 methanation. This CO2 activity is faster for the catalysts calcined at 600°C than the others. Similar trends were observed for Panagiotopoulou et.al with Ru/Al2O3 catalysts [12,23]. The minimum SCH4 was observed just when the CO2 methanation starts. After that, both the SCH4 and XCO2 increased. These reinforced the observation that the SCH4 is more favoured by the CO2 methanation than CO methanation. It has been observed that 100% of SCH4 is reached when XCO is completed since the CO2 methanation starts and therefore the selectivity to CH4 increases. In our case the thermal effect seems to be very important to control the metal particle size and the anatase: rutile TiO2 particles growth. They affect the metal dispersion and therefore the activity in methanation reaction. Kwak et al. [48] suggested that the reaction mechanism is different on small particles that are atomically dispersed and the larger Ru ones. Single Ru atoms, or interfacial Ru, favor CO formation, while Ru clusters, which are able to supply large amounts of atomic hydrogen to this process, favor the formation of CH4. The CO2 conversion is promoted at low reaction temperatures for the catalysts calcined above 450ºC and 600ºC. This observation is coherent with the results obtained from the physicochemical characterization. As higher the calcination temperature, higher the sintering phenomena, higher crystallite size of the active phase, lower dispersion and lower reducibility of active phase. This also indicates that the unbeneficial effect of a high calcination temperature is exerted through the size changes observed for the active phase and through a change on reducibility of the RuO2 phase. The active species in the methanation reaction are the reduced states of Ru over TiO2 obtained after an in situ thermal treatment under H2 at 300ºC. In fact, the adsorption and dissociation of CO on centers of Ru0 determines the catalytic behavior since the reduction of the RuO2-TiO2 generates active Ru0-Ti3+ centers [26]. Additionally, the size of the RuO2 phase at different calcination temperatures indicates unambiguously that the nature of the support dictates the behaviour of the RuO2 particles, and this is correlated with the catalytic performance. As said before, the methanation is thought to be a structure-sensitive reaction, since different physical states of active species have been reported to have different intrinsic activities. The importance of size and distribution of the active nanoparticles has been proven in the case of ammonia synthesis with Ru particles, and CO2 methanation with Rh/Ru particles under mild conditions [49–51]. The sintering behaviour is a factor influencing the catalytic activity. Subsequently, the diffusion of RuO2 nanoparticles leads to two different phenomena in terms of sintering: isotropic growth of RuO2 crystals on the anatase or epitaxial growth of the RuO2 layer on rutile. Not excessive sinter and the stabilization must occur through RuO2 and TiO2 epitaxial interactions. RuO2 is thus spread on the TiO2 rutile surface, with anatase particles acting as diluent and preventing the TiO2 rutile–RuO2–TiO2 rutile stacking. Lower stabilization of the metal particles and higher sintering appear as the anatase TiO2 phase decreases as consequence of the transition to rutile with the calcination temperature. TiO2 anatase particles promote the Ru migration to rutile and imped the excessive sintering of TiO2 rutile particles [52]. In our case CH4 is mainly produced throughout the hydrogenation of CO2 that is favoured at higher calcination temperature with the consequence of increasing the metal phase size. This result is coherent with similar studies [53,54]. DRIFTs experiments with CO and CO2 mixture on Rh catalyst [55] showed that the adsorption/dissociation of CO2 is carried out on metal centers to produce Rh-CO and Rh-(CO)2 species. Rh-(CO)2 are instable and dissociate until CO[adsorbed] and O[adsorbed]. In turn, the CO[adsorbed] is dissociated on metal centers until O[adsorbed] and C[adsorbed]. Therefore, the number of Ru-C and Ru-O sites should increase after CO2 dissociation more than after CO dissociation. Therefore, the Ru-C centres are necessary to form CH4. According to the results, the calcination temperature determines the active phase size and its distribution, as well as the rutile and anatase concentrations and their size. All of them influence the catalytic behaviour. The characterization and activity results demonstrate that the calcination at 400ºC in synthetic air is an appropriate thermal treatment since the physicochemical properties of the solids are well controlled. Moreover, the transition to rutile phase is not so high ant growth of the metal particle by the stabilising effect of the anatase is improved. Concerning to the activity behaviour, the CO2 methanation is low at 400ºC and the selectivity to CO methanation is higher at higher conversions of CO respect to other temperature (i.e 450ºC). 3.3 Ru loading The metal loading also seems to be another important parameter that determines the metal particle size / dispersion and therefore the selectivity of the catalysts. However, there is no a general agreement in the literature about the ideal metal loading for the high CO methanation. In the following section the results of the metal loading study are shown. These were carried out on Ru/TiO2-P25 samples thermally treated in synthetic air at 400ºC. Concentration of Ru of 2, 5, 10 and 20 wt% were studied. XRF measurements on reduced samples at 300ºC revealed that the real Ru contents on Ru/TiO2 powder catalysts are very close to the nominal values ( Table 6). It also shows the textural properties of the solids. The changes are related to the interaction between the metal phase and the anatase: rutile phases with the Ru concentration. At much higher Ru loading (20 wt%) the structure collapses and the textural properties decrease. Similar observations were pointed out by Ismail et. al [56] with similar catalysts containing 10 wt% of Ru. In this case an excessive growth of the metal phase was observed simultaneously with decreasing in textural properties. In our case the XRD results confirm the sintering of the metal particles at higher concentration of Ru. With 2 wt% of Ru the no observation of RuO2 peaks agrees with its low amount and/or lower particles size. However, with 20 wt% of Ru the crystallite size of RuO2 is 24 nm with respect to 14.8 obtained with 5 wt%. On the other hand, at higher Ru loading lower sintering of TiO2 anatase and TiO2 rutile phases is observed. The changes observed in the textural properties suggest that the transformation to rutile phase is favored at higher metal concentration. This could be promoted by the Ru concentration simultaneously with a thermal effect. To confirm this observation in-situ XRD at different temperatures were done. Fig. 10 shows in-situ XRD in synthetic air from 100 °C to 900 °C for 5, 10 and 20 wt% Ru/TiO2-P25 samples. For sake of comparison, the bare support is also shown. In all cases the diffractions peaks of TiO2 anatase and TiO2 rutile phases are observed simultaneously with RuO2 peaks. At higher calcination temperatures the intensity of rutile peaks increases whilst the anatase peaks decreases. This indicates the structural modification of the support with the temperature. The bare support TiO2-P25 requires higher temperatures to induce the transformation anatase→ rutile. After the addition of Ru, this transformation is shifted at lower temperatures. Higher Ru loading induces higher transformation to rutile at much lower temperatures. At 400ºC the selected calcination temperature, the anatase concentration is very similar for both 5 wt% and 10 wt% of Ru (74% of vs 70% respectively). Despite this small difference the anatase concentration effect on the RuO2 size and dispersion is seems to be important since anatase phase is necessary to stabilize the metal particles by controlling the excessive metal growth. The sintering of RuO2 particles increases for 10 wt% of Ru with respect to 5 wt%. (22 nm vs 14.8, respectively). Therefore, with 10 wt% of Ru higher Ru particle size and higher crystallinity of the active phase are obtained. Fig. 11 shows the metal loading effect on the SCO methanation with Ru/TiO2 catalysts. Higher concentration of Ru species promotes the CO2 conversion at temperatures above 200ºC increasing with the reaction temperature until 300ºC. To favor the selective CO methanation in Ru catalysts. Fujita et. al [57] studied the competitive methanation in a mixed 10 vol% CO and 10 vol% CO2 in balance H2 with Ru/SiO2 catalyst. They observed that CO2 methanation rate at 200ºC is 4.6 times faster than the CO methanation rate. Over et. al [58] pointed out that changing the CO/CO2 ratio in the gas feed to higher values than 2:1 will deteriorate the overall activity due to blocking the surface by CO molecules. These facts have strongly indicated that when more highly active catalysts are used the preferential methanation of CO could be achieved prior to CO2 methanation at lower temperature range, and also that the ratio CO/CO2 must be carefully adjusted. Fig. 11 also shows the selectivity data vs XCO (%). It is clear that the most selective catalysts to CO methanation is 10 wt% Ru/TiO2-P25. Despite the sintering of the metal particles the activity and selectivity are promoted. Again, we observe that the selectivity SCO increases with the ruthenium particle size of Ru. This result unequivocally shows that the metal-support interaction is affected by the metal content and the physicochemical characteristics of the support. This interaction changes with the size and location of the ruthenium particles. The methanation reaction is sensitive to Ru size if CO dissociation is rate-limited [59,60]. Hu et al. [61] measured an increase in CO2 conversion with increases the Ru loading on TiO2 support until ca. 3% before declining, while the selectivity for CO and CH4 remained unchanged. Similarly, Kwak et al. [48] found that the TOF for CH4 increased with Ru loading (0.1–5%) on Al2O3. However, an opposite trend was observed for the TOF and selectivity of CO. Lange et al. [62] also found that increasing the loading of Ru on a ZrO2 support, from 1% to 3%, increases the CO2 conversion from 93.9 to ca. 97%. Verykios and col. [12,22] described that the TOF values increase with the increase in the particle size in methanation reaction. Rosseti et al. [63] demonstrated that the selective methanation of CO is sensitive to the particle size and concentration of Ru. There is a concentration of the ruthenium in which the number of active sites is optimum. Beyond this concentration, the number of active sites decreases, and the agglomeration of the metal particles occurs. Therefore, the location and size of the ruthenium particles determine the catalytic behavior for methanation reaction. Ru particles of 9 nm have been identified as the most actives ones for the CO dissociation probably by the existence of the so-called B5 sites [64]. These sites are composed by five consecutive ruthenium atoms, three of them are located in the same layer and the other two are arranged in the superior layer, forming a monoatomic step in a terrace of Ru. In our case, results of XRD for 10 wt% of Ru with the temperature in H2 atmosphere at 300 °C demonstrated that the crystal size of Ru0 particles is 8.7 nm exposing the (101) plane at 2θ = 43.97°. This crystal size is close to the reported ideal value for particles of Ru [65] and it was also verified by TEM microscopy. This explains the higher selectivity observed with 10 wt% of Ru at higher temperatures. This catalyst favours the selectivity of the methanation, decreasing the occurrence of the CO2 methanation and RWGS reaction, saving the excessive consumption of H2. In addition, for industrial applications, the lifetime of the catalysts load is of vital importance. Depending of the operational conditions, sometimes a large excess of catalysts load is economically interesting, because the price of the catalyst if lower than the costs derived from the process stop. This is even more evident for operational systems where start-stop cycles are mandatory (for instance, for portable devices, where PEMFC and structured reactors can be used). Thus, despite the higher price of the catalysts, the use of a high amount of Ru could be sustainable and economically justifiable. 4 Conclusions This study remarks the importance of support surface hydroxyls seems for both the activity and selectivity of Ru/TiO2 catalysts for CO activation. Adsorbed O species resulting from CO dissociation are hydrogenated to adsorbed OH species that intervene in the H-assisted activation of adsorbed CO on Ru catalysts increasing the activity. The changes in the activity and selectivity of the CO methanation reaction can also be related with the observed changes in the ruthenium particle size, as evidenced by TPR, XRD and TEM results, that modify the metal-support interaction. The results demonstrated that the crystalline phase of the support as well as the atmosphere of the treatment, the calcination temperature and the Ru loading determine the dispersion and size of the metal phase. All of them modify the structural and textural characteristics of the final solid as a result of anatase → rutile transformation and RuO2 + TiO2 solid solution formation. The catalytic behavior is explained by the formation of more active Ru species on TiO2 support, resulting in active and selective catalysts where the suppression of the RWGS reaction was observed. In this case 10 wt% Ru/TiO2-P25 thermally treated at 400 °C with synthetic air favored the CO selectivity, decreasing the occurrence of the CO2 methanation and RWGS reaction, saving the excessive consumption of H2. Thus, despite the higher price of the catalysts, the use of a high amount of Ru could be sustainable and economically justifiable. Here the increasing in RuO2 crystallite size favors the catalytic behavior but after a previous reduction protocol. At much higher calcination temperature and Ru loading, higher the sintering phenomena, higher crystallite size of the active phase, lower dispersion, lower reducibility of active phase and lower activity and selectivity. CRediT authorship contribution statement L. M. Martínez T: Methodology, Investigation, Formal analysis, Writing – review & editing. A. Muñoz: Methodology, Investigation. A. Pérez: Investigation, Formal analysis. O. H. Laguna: Methodology, Investigation, Formal analysis. L. F. Bobadilla: Methodology, Investigation, Formal analysis. M. A. Centeno: Supervision, Visualization, Writing – review & editing. J. A. Odriozola: Project administration. Funding acquisition. Declaration of Competing Interest The authors declare that they have no known competing financial interests or personal relationships that could have appeared to influence the work reported in this paper. Acknowledgements Financial support for this work has been obtained from the Spanish Ministry of Economy and Competitiveness (Spain) (Project RTI2018–096294-B-C-33) co-financed by FEDER funds from the European Union. References [1] M. Tao Z. Xin X. Meng Z. Bian Y. Lv Fuel 188 2017 267 276 M. Tao, Z. Xin, X. Meng, Z. Bian, Y. Lv, Fuel, 188 (2017) 267–276. [2] X. Su J. Xu B. Liang H. Duan B. Hou Y. Huang J. Ener. Chem. 25 2016 553 565 X. Su, J. Xu, B. Liang, H. Duan, B. Hou, Y. Huang, J. Ener. Chem., 25 (2016) 553–565. [3] S. Ronsch J. Scheneider S. Matthischke M. Schluter M. Gotz J. Lefebre P. Prabhakaran S. Bajohr Fuel 166 2016 273 296 S. Ronsch, J. Scheneider, S. Matthischke, M. Schluter, M. Gotz, J. Lefebre, P. Prabhakaran, S. Bajohr, Fuel, 166 (2016) 273–296. [4] V. Puga Top. Catal. 59 2016 1268 1278 V. Puga, Top. Catal., 59 (2016) 1268–1278. [5] M. Abdel-Mageed D. Widmann S.E. Olesen Ib Chorkendorﬀ R.J. Behm ACS Catal 8 2018 5399 5414 M. Abdel-Mageed, D. Widmann, S.E. Olesen, Ib. Chorkendorﬀ, R.J. Behm. ACS Catal., 8 (2018) 5399–5414. [6] M. Abdel-Mageed S. Eckle R. Behm J. Am. Chem. Soc. 137 2015 8672 8675 M. Abdel-Mageed, S. Eckle, R. Behm, J. Am. Chem. Soc., 137 (2015) 8672−8675. [7] M. Abdel-Mageed D. Widmann S.E. Olesen I. Chorkendorff J. Biskupek R.J. Behm R. ACS Catal. 5 2015 6753 6763 M. Abdel-Mageed, D. Widmann, S.E. Olesen, I. Chorkendorff, J. Biskupek, R.J. Behm, R. ACS Catal., 5 (2015) 6753−6763. [8] F. Solymosi A. Erdohelyi J. Mol. Catal. 8 1980 471 474 F. Solymosi, A. Erdohelyi, J. Mol. Catal., 8 (1980) 471–474 [9] L.F. Bobadilla A. Muñoz-Murillo O.H. Laguna M.A. Centeno J.A. Odriozola Chem. Eng. J. 357 2019 248 257 L.F. Bobadilla, A. Muñoz-Murillo, O.H. Laguna, M.A. Centeno, J.A. Odriozola, Chem. Eng. J., 357 (2019) 248–257. [10] O.H. Laguna A. Muñoz-Murillo L.F. Bobadilla L.M. Martínez T M. Montes M.A. Centeno J.A. Odriozola Catal Today 383 2022 216 225 O.H. Laguna, A. Muñoz-Murillo, L.F. Bobadilla, L.M. Martínez T, M. Montes, M.A. Centeno, J.A. Odriozola. Catal Today 383 (2022) 216–225. [11] M. Abdel-Mageed S. Eckle H. Anfang R.J. Behm J. Catal. 298 2013 148 160 M. Abdel-Mageed, S. Eckle, H. Anfang, R.J. Behm, J. Catal., 298 (2013) 148–160. [12] P. Panagiotopoulou D.I. Kondarides X.E. Verykios Appl. Catal. B 88 2009 470 478 P. Panagiotopoulou, D.I. Kondarides, X.E. Verykios, Appl. Catal. B, 88 (2009) 470–478. [13] T. Takenaka K. Shimizu K. Otsuka Int. J. Hydrogen Energ 29 2004 1065 1073 T. Takenaka, K. Shimizu, K. Otsuka, Int. J. Hydrogen Energ., 29 (2004) 1065–1073. [14] K.D. Debeckera F. Devreda V. Duboisc C. Sanchez C. Sassoye Appl. Catal. B: Environmental 220 2018 615 625 K.D. Debeckera, F. Devreda, V. Duboisc, C. Sanchez, C. Sassoye, Appl. Catal. B: Environmental, 220 (2018) 615–625. [15] T. Abe M. Tanizawa K. Watanabe A. Taguchi Energy Environ. Sci. 2 2009 315 321 T. Abe, M. Tanizawa, K. Watanabe, A. Taguchi, Energy Environ. Sci., 2 (2009) 315–321. [16] S. Cisneros S. Chen T. Diemant J. Bansmann A.M. Abdel-Mageed M. Goepel S.E. Olesen E.S. Welter M. Parlinska-Wojtan R. Gläser I. Chorkendorff R.J. Behm Appl. Catal. A: General 282 2021 119483 S. Cisneros, S. Chen, T. Diemant, J. Bansmann, A.M. Abdel-Mageed, M. Goepel, S.E. Olesen, E.S. Welter, M. Parlinska-Wojtan, R. Gläser, I. Chorkendorff, R.J. Behm, Appl. Catal. A: General, 282 (2021) 119483. [17] X. Li Y. Han Y. Huang J. Lin X. Pan Z. Zhao Y. Zhou H. Wang X. Yang A. Wang L. Li B. Qiao X. Wang Appl. Catal. B: Environmental 298 2021 120597 X. Li, Y. Han, Y. Huang, J. Lin, X. Pan, Z. Zhao, Y. Zhou, H. Wang, X. Yang, A. Wang, L. Li, B. Qiao, X. Wang, Appl. Catal. B: Environmental 298 (2021) 120597. [18] M. Balaraju V. Rekha B.L.A. Prabhavathi Devi R.B.N. Prasad P.S. Sai Prasad N. Lingaiah Appl. Catal. A: General 384 2010 107 114 M. Balaraju, V. Rekha, B.L. A. Prabhavathi Devi, R.B. N. Prasad, P.S. Sai Prasad, N. Lingaiah, Appl. Catal. A: General, 384 (2010) 107–114. [19] C. Sassoye G. Muller D.P. Debecker A. Karelovic S. Cassaignon C. Pizarro P. Ruiz C.C. Sanchez Green Chem. 13 2011 3230 3237 C. Sassoye, G. Muller, D.P. Debecker, A. Karelovic, S. Cassaignon, C. Pizarro, P. Ruiz, C.C. Sanchez, Green Chem., 13 (2011) 3230–3237. [20] K.T. Jacob R. Subramanian J. Phase Equilib. Diffus. 29 2008 136 140 K.T. Jacob, R. Subramanian, J. Phase Equilib. Diffus., 29 (2008) 136–140. [21] S.J. Tauster S.C. Fung R.L. Garten J. Am. Chem. Soc. 100 1978 170 175 S.J. Tauster, S.C. Fung and R.L. Garten, J. Am. Chem. Soc., 100 (1978) 170–175 [22] D. Li N. Ichikuni S. Shimazu T. Uematsu Appl. Catal. A 1180 1–2 1999 227-2 D. Li, N. Ichikuni, S. Shimazu, T. Uematsu, Appl. Catal. A 1180(1–2) (1999) 227–2 [23] P. Panagiotopoulou D.I. Kondarides X.E. Verykios Appl. Catal. A: General 344 2008 45 54 P. Panagiotopoulou, D.I. Kondarides, X.E. Verykios, Appl. Catal. A: General, 344 (2008) 45–54. [24] H.Y. Lin Y.W. Chen Thermoch. Acta 421 2004 51 58 H.Y. Lin, Y.W. Chen, Thermoch. Acta, 421 (2004) 51–58. [25] R.I. Bickley T. Gonzalez-Carreno J.S. Lees L. Palmisano R.J.D. Tilley J. Sol State Chem. 92 1991 178 190 R.I. Bickley, T. Gonzalez-Carreno, J.S. Lees, L. Palmisano, R.J. D. Tilley, J. Sol. State Chem., 92 (1991) 178–190. [26] L.M. Martínez T A. Muñoz M.A. Centeno J.A. Odriozola J Raman Spectrosc. 47 2016 189 197 L.M. Martínez T, A. Muñoz, M.A. Centeno, J.A. Odriozola J. Raman Spectrosc., 47 (2016) 189–197. [27] K.C. Sanchez G. Patriarche O. Ersen S. Moldovan A. Wisnet C. Sassoye D.P. Debecker Catal. Sci. Technol. 6 2016 8117 8128 K.C. Sanchez, G. Patriarche, O. Ersen, S. Moldovan, A. Wisnet, C. Sassoye, D.P. Debecker, Catal. Sci. Technol., 6 (2016) 8117–8128. [28] C. Fukuhara K. Hayakawa Y. Suzuki W. Kawasaki R. Watanabe Appl. Catal. A: General 532 2017 12 18 C. Fukuhara, K. Hayakawa, Y. Suzuki, W. Kawasaki, R. Watanabe, Appl. Catal. A: General, 532 (2017) 12–18. [29] Z. Liu B. Chu X. Zhai Y. Jin Y. Chieng Fuel 95 2012 599 605 Z. Liu, B. Chu, X. Zhai, Y. Jin. Y., Chieng, Fuel, 95 (2012) 599–605. [30] Y. Men G. Kolb R. Zapf V. Hessel H. Löwe Catal. Today 125 2007 81 87 Y. Men, G. Kolb, R. Zapf, V. Hessel, H. Löwe, Catal. Today, 125 (2007) 81–87. [31] Y. Kobori S. Naito T. Onishi K. Tamaru J. Chem. Soc. Chem. Commun 92–93 1981 92 93 Y. Kobori, S. Naito, T. Onishi, K. Tamaru, J. Chem. Soc. Chem. Commun., 92–93 (1981) 92–93. [32] B.T. Loveless C. Buda M. Neurock E. Iglesia J. Am. Chem. Soc. 135 2013 6107 6121 B.T. Loveless, C. Buda, M. Neurock, E. Iglesia, J. Am. Chem. Soc., 135 (2013) 6107–6121. [33] E. Jiménez-Barrera P. Bazin C. López-Cartes F. Romero-Sarria M. Daturi J.A. Odriozola Appl. Catal. B 237 2018 986 995 E. Jiménez-Barrera, P. Bazin, C. López-Cartes, F. Romero-Sarria, M. Daturi, J.A. Odriozola, Appl. Catal. B, 237 (2018) 986–995. [34] W. Wasylenko H. Frei Phys. Chem. Chem. Phys. 9 2007 5497 5502 W. Wasylenko, H. Frei, Phys. Chem. Chem. Phys., 9 (2007) 5497–5502. [35] B.T. Loveless C. Buda M. Neurock E. Iglesia J. Am. Chem. Soc. 135 2013 6107 6121 B.T. Loveless, C. Buda, M. Neurock, E. Iglesia, J. Am. Chem. Soc., 135 (2013) 6107–6121. [36] G. Munuera F. Moreno J.A. Prieto Z. Phys. Chem. 78 1972 113 117 G. Munuera, F. Moreno, J.A. Prieto, Z. Phys. Chem., 78 (1972) 113–117. [37] H.P. Boehm Adv. Catal. 16 1966 179 274 H.P. Boehm, Adv. Catal., 16 (1966) 179–274. [38] A. Muñoz-Murillo L.M. Martínez T M.I. Domínguez J.A. Odriozola M.A. Centeno Appl. Catal. B: Environ 236 2018 420 427 A. Muñoz-Murillo, L.M. Martínez T, M.I. Domínguez, J.A. Odriozola, M.A. Centeno, Appl. Catal. B: Environ., 236 (2018) 420- 427. [39] G.T.K.K. Gunasooriya A.P. van Bavel H.P.C.E. Kuipers M. Saeys ACS Catal. 6 2016 3660 3664 G.T.K.K. Gunasooriya, A.P. van Bavel, H.P.C.E. Kuipers, M. Saeys, ACS Catal., 6 (2016) 3660–3664 [40] S. Navarro-Jaén J.C. Navarro L.F. Bobadilla M.A. Centeno O.H. Laguna J.A. Odriozola Appl. Surf. Sci. 483 2019 750 761 S. Navarro-Jaén, J.C. Navarro, L.F. Bobadilla, M.A. Centeno, O.H. Laguna, J.A. Odriozola, Appl. Surf. Sci., 483 (2019) 750–761. [41] L. Osterlund Solid State Phen. 162 2010 203 219 L. Osterlund, Solid State Phen., 162 (2010) 203–219. [42] M.A. Henderson J. Phys. Chem. B 101 1997 221 229 M.A. Henderson, J. Phys. Chem. B, 101 (1997) 221–229. [43] H.P. Boehm Adv. Catal. 16 1966 179 274 H.P. Boehm, Adv. Catal., 16 (1966) 179–274. [44] M.A. Henderson Surf. Sci 319 1994 315 328 M.A. Henderson, Surf. Sci., 319 (1994) 315–328. [45] F. Solymosi A. Erdohelyi T. Bansagi J. Chem. Soc., Faraday Trans. 77 1981 2645 2657 F. Solymosi, A. Erdohelyi, T. Bansagi, J. Chem. Soc., Faraday Trans., 77 (1981) 2645–2657. [46] M. Nawdali H. Ahlafi G.M. Pajonk D. Bianchi J. Mol. Catal. A: General 162 2000 247 256 M. Nawdali, H. Ahlafi, G.M. Pajonk, D. Bianchi, J. Mol. Catal. A: General, 162 (2000) 247–256. [47] T. Inui M. Funabiki Y. Takegami Ind. Eng. Chem., Prod. Res. Dev. 19 1980 385 388 T. Inui, M. Funabiki, Y. Takegami, Ind. Eng. Chem., Prod. Res. Dev., 19 (1980) 385–388. [48] J.H. Kwak L. Kovarik J. Szanyi ACS Catal. 3 11 2013 2449 2455 J.H. Kwak, L. Kovarik, J. Szanyi, ACS Catal., 3 (11) (2013)2449−2455. [49] C. Fernández C. Sassoye D.P. Debecker C.C. Sanchez P. Ruiz C. Fernandez C. Sassoye D.P. Debecker C.C. Sanchez P. Ruiz Appl. Catal. A: General 474 2014 194 202 C. Fernández, C. Sassoye, D.P. Debecker, C.C. Sanchez, P.Ruiz, C. Fernandez, C. Sassoye, D.P. Debecker, C.C.Sanchez, P. Ruiz, Appl. Catal. A: General, 474 (2014) 194–202. [50] C. Fernández C. Sassoye N. Flores N. Escalona E.M. Gaigneaux C. Sanchez P. Ruiz Appl. Catal. A: General 502 2015 48 56 C. Fernández, C. Sassoye, N. Flores, N. Escalona, E.M.Gaigneaux, C. Sanchez, P. Ruiz, Appl. Catal. A: General, 502 (2015) 48–56. [51] A. Karelovic P. Ruiz Appl. Catal. B: Environmental 113–114 2012 237 249 A. Karelovic, P. Ruiz, Appl. Catal. B: Environmental, 113–114 (2012) 237–249. [52] Kim C. Sanchez G. Patriarche O. Ersen S. Moldovan A. Wisnet C. Sassoye D.P. Debecker Catal. Sci. Technol. 6 2016 8117 8128 Kim, C. Sanchez, G. Patriarche, O. Ersen, S. Moldovan, A. Wisnet, C. Sassoye, D.P. Debecker, Catal. Sci. Technol., 6 (2016) 8117–8128. [53] A. Beuls C. Swalus M. Jacquemin G. Heyen A. Karelovic P. Ruiz Appl. Catal. B: Environ 113–114 2012 2 10 A. Beuls, C. Swalus, M. Jacquemin, G. Heyen, A. Karelovic, P. Ruiz, Appl. Catal. B: Environ., 113–114 (2012) 2–10. [54] M. Jacquemin A. Beuls P. Ruiz Catal. Today 157 2010 462 466 M. Jacquemin, A. Beuls, P. Ruiz, Catal. Today, 157 (2010) 462–466. [55] J.H. Kwak L. Kovarik J. Szanyi ACS Catal. 3 11 2013 2449 2455 J.H. Kwak, L. Kovarik, J. Szanyi, ACS Catal., 3 (11) (2013)2449−2455. [56] A. Ismail L. Robben D.W. Bahnemann Chem. Phys. Chem 12 2011 982 991 A. Ismail, L. Robben, D.W. Bahnemann, Chem. Phys. Chem., 12 (2011) 982–991 [57] S.H. Fujita N. Takezawa Chem. Eng. J. 68 1997 63 68 S.H. Fujita, N. Takezawa, Chem. Eng. J., 68 (1997) 63–68. [58] M. Over Progr. Surf. Sci 72 2003 3 17 M. Over, Progr. Surf. Sci., 72 (2003) 3–17. [59] S. Dahl E. Tornqvist I. Chorkendorff J. Catal. 192 2000 381 390 S. Dahl, E. Tornqvist, I. Chorkendorff, J. Catal., 192 (2000) 381–390. [60] L. Forni D. Molinari I. Rossetti N. Pernicone Appl. Catal. A: General 185 1999 269 275 L. Forni, D. Molinari, I. Rossetti, N. Pernicone, Appl. Catal. A: General, 185 (1999) 269–275. [61] J. Hu K.P. Brooks J.D. Holladay D.T. Howe T.M. Simon Catal. Today 125 1–2 2007 103 110 J. Hu, K.P. Brooks, J.D. Holladay, D.T. Howe, T.M. Simon, Catal. Today, 125 (1–2), (2007) 103–110. [62] F. Lange U. Armbruster A. Martin Energ. Technol. 3 1 2015 55 62 F. Lange, U. Armbruster, A. Martin, Energ. Technol., 3 (1) (2015) 55–62. [63] I. Rosseti L. Forni Appl. Catal. A: General 282 2005 315 320 I. Rosseti, L. Forni, Appl. Catal. A: General, 282 (2005) 315–320. [64] J.M. González Carballo J. Yang A. Holmen S. García-Rodríguez S. Rojas M. Ojeda J.L. García-Fierro J. Catal. 284 2011 102 108 J.M. González Carballo, J. Yang, A. Holmen, S. García-Rodríguez, S. Rojas, M. Ojeda, J.L. García-Fierro, J. Catal., 284 (2011) 102–108 [65] E. Truszkiewicz K. Zegadło D. Wojda B. Mierzwa L. Kępiński Top Catal. 60 2017 1299 1305 E. Truszkiewicz, K. Zegadło, D. Wojda, B. Mierzwa, L. Kępiński. Top Catal., 60 (2017) 1299–1305.",
      "scopus-id": "85130844936",
      "coredata": {
        "eid": "1-s2.0-S0926860X22002010",
        "dc:description": "The aim of this work was to clarify the effect of the support on CO selective methanation with Ru/TiO2 catalysts. TPR, XRD and TEM measurements confirmed that the changes in the activity and selectivity should be ascribed to anatase:rutile ratio, RuO2 +TiO2 solid solution formation, as well as the metal content and the thermal treatment used. All these characteristics result in active and selective catalysts in which the suppression of the reverse water gas shift reaction was observed. The catalytic performance must be explained by both the formation of more active Ru species as a result of support influence and the higher Ru dispersion. The study allows to conclude that for CO activation the role of support surface hydroxyls seems to be determinant for both the activity and selectivity of Ru/TiO2 catalysts.",
        "openArchiveArticle": "false",
        "prism:coverDate": "2022-07-05",
        "openaccessUserLicense": null,
        "prism:aggregationType": "Journal",
        "prism:url": "https://api.elsevier.com/content/article/pii/S0926860X22002010",
        "dc:creator": [
          {
            "@_fa": "true",
            "$": "Martínez T, L.M."
          },
          {
            "@_fa": "true",
            "$": "Muñoz, A."
          },
          {
            "@_fa": "true",
            "$": "Pérez, A."
          },
          {
            "@_fa": "true",
            "$": "Laguna, O.H."
          },
          {
            "@_fa": "true",
            "$": "Bobadilla, L.F."
          },
          {
            "@_fa": "true",
            "$": "Centeno, M.A."
          },
          {
            "@_fa": "true",
            "$": "Odriozola, J.A."
          }
        ],
        "link": [
          {
            "@_fa": "true",
            "@rel": "self",
            "@href": "https://api.elsevier.com/content/article/pii/S0926860X22002010"
          },
          {
            "@_fa": "true",
            "@rel": "scidir",
            "@href": "https://www.sciencedirect.com/science/article/pii/S0926860X22002010"
          }
        ],
        "dc:format": "application/json",
        "openaccessType": null,
        "pii": "S0926-860X(22)00201-0",
        "prism:volume": "641",
        "articleNumber": "118678",
        "prism:publisher": "Elsevier B.V.",
        "dc:title": "The effect of support surface hydroxyls on selective CO methanation with Ru based catalysts",
        "prism:copyright": "© 2022 Elsevier B.V. All rights reserved.",
        "openaccess": "0",
        "prism:issn": "0926860X",
        "dcterms:subject": [
          {
            "@_fa": "true",
            "$": "Ru/TiO2 catalysts"
          },
          {
            "@_fa": "true",
            "$": "TiO2 rutile"
          },
          {
            "@_fa": "true",
            "$": "TiO2 anatase"
          },
          {
            "@_fa": "true",
            "$": "RuO2 rutile"
          },
          {
            "@_fa": "true",
            "$": "CO methanation"
          },
          {
            "@_fa": "true",
            "$": "CO2 methanation"
          },
          {
            "@_fa": "true",
            "$": "Support surface hydroxyls"
          }
        ],
        "openaccessArticle": "false",
        "prism:publicationName": "Applied Catalysis A: General",
        "openaccessSponsorType": null,
        "prism:pageRange": "118678",
        "pubType": "fla",
        "prism:coverDisplayDate": "5 July 2022",
        "prism:doi": "10.1016/j.apcata.2022.118678",
        "prism:startingPage": "118678",
        "dc:identifier": "doi:10.1016/j.apcata.2022.118678",
        "openaccessSponsorName": null
      },
      "objects": {
        "object": [
          {
            "@category": "standard",
            "@height": "314",
            "@width": "376",
            "@_fa": "true",
            "$": "https://api.elsevier.com/content/object/eid/1-s2.0-S0926860X22002010-gr6.jpg?httpAccept=%2A%2F%2A",
            "@multimediatype": "JPEG image file",
            "@type": "IMAGE-DOWNSAMPLED",
            "@size": "29344",
            "@ref": "gr6",
            "@mimetype": "image/jpeg"
          },
          {
            "@category": "standard",
            "@height": "538",
            "@width": "376",
            "@_fa": "true",
            "$": "https://api.elsevier.com/content/object/eid/1-s2.0-S0926860X22002010-gr7.jpg?httpAccept=%2A%2F%2A",
            "@multimediatype": "JPEG image file",
            "@type": "IMAGE-DOWNSAMPLED",
            "@size": "37166",
            "@ref": "gr7",
            "@mimetype": "image/jpeg"
          },
          {
            "@category": "standard",
            "@height": "565",
            "@width": "678",
            "@_fa": "true",
            "$": "https://api.elsevier.com/content/object/eid/1-s2.0-S0926860X22002010-gr8.jpg?httpAccept=%2A%2F%2A",
            "@multimediatype": "JPEG image file",
            "@type": "IMAGE-DOWNSAMPLED",
            "@size": "47405",
            "@ref": "gr8",
            "@mimetype": "image/jpeg"
          },
          {
            "@category": "standard",
            "@height": "350",
            "@width": "376",
            "@_fa": "true",
            "$": "https://api.elsevier.com/content/object/eid/1-s2.0-S0926860X22002010-gr9.jpg?httpAccept=%2A%2F%2A",
            "@multimediatype": "JPEG image file",
            "@type": "IMAGE-DOWNSAMPLED",
            "@size": "28124",
            "@ref": "gr9",
            "@mimetype": "image/jpeg"
          },
          {
            "@category": "standard",
            "@height": "325",
            "@width": "376",
            "@_fa": "true",
            "$": "https://api.elsevier.com/content/object/eid/1-s2.0-S0926860X22002010-gr2.jpg?httpAccept=%2A%2F%2A",
            "@multimediatype": "JPEG image file",
            "@type": "IMAGE-DOWNSAMPLED",
            "@size": "16646",
            "@ref": "gr2",
            "@mimetype": "image/jpeg"
          },
          {
            "@category": "standard",
            "@height": "245",
            "@width": "245",
            "@_fa": "true",
            "$": "https://api.elsevier.com/content/object/eid/1-s2.0-S0926860X22002010-ga1.jpg?httpAccept=%2A%2F%2A",
            "@multimediatype": "JPEG image file",
            "@type": "IMAGE-DOWNSAMPLED",
            "@size": "30424",
            "@ref": "ga1",
            "@mimetype": "image/jpeg"
          },
          {
            "@category": "standard",
            "@height": "273",
            "@width": "791",
            "@_fa": "true",
            "$": "https://api.elsevier.com/content/object/eid/1-s2.0-S0926860X22002010-gr3.jpg?httpAccept=%2A%2F%2A",
            "@multimediatype": "JPEG image file",
            "@type": "IMAGE-DOWNSAMPLED",
            "@size": "59340",
            "@ref": "gr3",
            "@mimetype": "image/jpeg"
          },
          {
            "@category": "standard",
            "@height": "261",
            "@width": "678",
            "@_fa": "true",
            "$": "https://api.elsevier.com/content/object/eid/1-s2.0-S0926860X22002010-gr4.jpg?httpAccept=%2A%2F%2A",
            "@multimediatype": "JPEG image file",
            "@type": "IMAGE-DOWNSAMPLED",
            "@size": "27473",
            "@ref": "gr4",
            "@mimetype": "image/jpeg"
          },
          {
            "@category": "standard",
            "@height": "585",
            "@width": "678",
            "@_fa": "true",
            "$": "https://api.elsevier.com/content/object/eid/1-s2.0-S0926860X22002010-gr5.jpg?httpAccept=%2A%2F%2A",
            "@multimediatype": "JPEG image file",
            "@type": "IMAGE-DOWNSAMPLED",
            "@size": "54612",
            "@ref": "gr5",
            "@mimetype": "image/jpeg"
          },
          {
            "@category": "standard",
            "@height": "255",
            "@width": "678",
            "@_fa": "true",
            "$": "https://api.elsevier.com/content/object/eid/1-s2.0-S0926860X22002010-gr11.jpg?httpAccept=%2A%2F%2A",
            "@multimediatype": "JPEG image file",
            "@type": "IMAGE-DOWNSAMPLED",
            "@size": "27866",
            "@ref": "gr11",
            "@mimetype": "image/jpeg"
          },
          {
            "@category": "standard",
            "@height": "434",
            "@width": "565",
            "@_fa": "true",
            "$": "https://api.elsevier.com/content/object/eid/1-s2.0-S0926860X22002010-gr1.jpg?httpAccept=%2A%2F%2A",
            "@multimediatype": "JPEG image file",
            "@type": "IMAGE-DOWNSAMPLED",
            "@size": "87253",
            "@ref": "gr1",
            "@mimetype": "image/jpeg"
          },
          {
            "@category": "standard",
            "@height": "501",
            "@width": "678",
            "@_fa": "true",
            "$": "https://api.elsevier.com/content/object/eid/1-s2.0-S0926860X22002010-gr10.jpg?httpAccept=%2A%2F%2A",
            "@multimediatype": "JPEG image file",
            "@type": "IMAGE-DOWNSAMPLED",
            "@size": "65545",
            "@ref": "gr10",
            "@mimetype": "image/jpeg"
          },
          {
            "@category": "thumbnail",
            "@height": "164",
            "@width": "196",
            "@_fa": "true",
            "$": "https://api.elsevier.com/content/object/eid/1-s2.0-S0926860X22002010-gr6.sml?httpAccept=%2A%2F%2A",
            "@multimediatype": "GIF image file",
            "@type": "IMAGE-THUMBNAIL",
            "@size": "9797",
            "@ref": "gr6",
            "@mimetype": "image/gif"
          },
          {
            "@category": "thumbnail",
            "@height": "163",
            "@width": "114",
            "@_fa": "true",
            "$": "https://api.elsevier.com/content/object/eid/1-s2.0-S0926860X22002010-gr7.sml?httpAccept=%2A%2F%2A",
            "@multimediatype": "GIF image file",
            "@type": "IMAGE-THUMBNAIL",
            "@size": "5123",
            "@ref": "gr7",
            "@mimetype": "image/gif"
          },
          {
            "@category": "thumbnail",
            "@height": "163",
            "@width": "196",
            "@_fa": "true",
            "$": "https://api.elsevier.com/content/object/eid/1-s2.0-S0926860X22002010-gr8.sml?httpAccept=%2A%2F%2A",
            "@multimediatype": "GIF image file",
            "@type": "IMAGE-THUMBNAIL",
            "@size": "6033",
            "@ref": "gr8",
            "@mimetype": "image/gif"
          },
          {
            "@category": "thumbnail",
            "@height": "164",
            "@width": "176",
            "@_fa": "true",
            "$": "https://api.elsevier.com/content/object/eid/1-s2.0-S0926860X22002010-gr9.sml?httpAccept=%2A%2F%2A",
            "@multimediatype": "GIF image file",
            "@type": "IMAGE-THUMBNAIL",
            "@size": "7119",
            "@ref": "gr9",
            "@mimetype": "image/gif"
          },
          {
            "@category": "thumbnail",
            "@height": "164",
            "@width": "190",
            "@_fa": "true",
            "$": "https://api.elsevier.com/content/object/eid/1-s2.0-S0926860X22002010-gr2.sml?httpAccept=%2A%2F%2A",
            "@multimediatype": "GIF image file",
            "@type": "IMAGE-THUMBNAIL",
            "@size": "4985",
            "@ref": "gr2",
            "@mimetype": "image/gif"
          },
          {
            "@category": "thumbnail",
            "@height": "164",
            "@width": "164",
            "@_fa": "true",
            "$": "https://api.elsevier.com/content/object/eid/1-s2.0-S0926860X22002010-ga1.sml?httpAccept=%2A%2F%2A",
            "@multimediatype": "GIF image file",
            "@type": "IMAGE-THUMBNAIL",
            "@size": "22030",
            "@ref": "ga1",
            "@mimetype": "image/gif"
          },
          {
            "@category": "thumbnail",
            "@height": "76",
            "@width": "219",
            "@_fa": "true",
            "$": "https://api.elsevier.com/content/object/eid/1-s2.0-S0926860X22002010-gr3.sml?httpAccept=%2A%2F%2A",
            "@multimediatype": "GIF image file",
            "@type": "IMAGE-THUMBNAIL",
            "@size": "10423",
            "@ref": "gr3",
            "@mimetype": "image/gif"
          },
          {
            "@category": "thumbnail",
            "@height": "84",
            "@width": "219",
            "@_fa": "true",
            "$": "https://api.elsevier.com/content/object/eid/1-s2.0-S0926860X22002010-gr4.sml?httpAccept=%2A%2F%2A",
            "@multimediatype": "GIF image file",
            "@type": "IMAGE-THUMBNAIL",
            "@size": "3883",
            "@ref": "gr4",
            "@mimetype": "image/gif"
          },
          {
            "@category": "thumbnail",
            "@height": "164",
            "@width": "190",
            "@_fa": "true",
            "$": "https://api.elsevier.com/content/object/eid/1-s2.0-S0926860X22002010-gr5.sml?httpAccept=%2A%2F%2A",
            "@multimediatype": "GIF image file",
            "@type": "IMAGE-THUMBNAIL",
            "@size": "7495",
            "@ref": "gr5",
            "@mimetype": "image/gif"
          },
          {
            "@category": "thumbnail",
            "@height": "82",
            "@width": "219",
            "@_fa": "true",
            "$": "https://api.elsevier.com/content/object/eid/1-s2.0-S0926860X22002010-gr11.sml?httpAccept=%2A%2F%2A",
            "@multimediatype": "GIF image file",
            "@type": "IMAGE-THUMBNAIL",
            "@size": "4272",
            "@ref": "gr11",
            "@mimetype": "image/gif"
          },
          {
            "@category": "thumbnail",
            "@height": "163",
            "@width": "213",
            "@_fa": "true",
            "$": "https://api.elsevier.com/content/object/eid/1-s2.0-S0926860X22002010-gr1.sml?httpAccept=%2A%2F%2A",
            "@multimediatype": "GIF image file",
            "@type": "IMAGE-THUMBNAIL",
            "@size": "14993",
            "@ref": "gr1",
            "@mimetype": "image/gif"
          },
          {
            "@category": "thumbnail",
            "@height": "162",
            "@width": "219",
            "@_fa": "true",
            "$": "https://api.elsevier.com/content/object/eid/1-s2.0-S0926860X22002010-gr10.sml?httpAccept=%2A%2F%2A",
            "@multimediatype": "GIF image file",
            "@type": "IMAGE-THUMBNAIL",
            "@size": "14590",
            "@ref": "gr10",
            "@mimetype": "image/gif"
          },
          {
            "@category": "high",
            "@height": "1390",
            "@width": "1663",
            "@_fa": "true",
            "$": "https://api.elsevier.com/content/object/eid/1-s2.0-S0926860X22002010-gr6_lrg.jpg?httpAccept=%2A%2F%2A",
            "@multimediatype": "JPEG image file",
            "@type": "IMAGE-HIGH-RES",
            "@size": "179917",
            "@ref": "gr6",
            "@mimetype": "image/jpeg"
          },
          {
            "@category": "high",
            "@height": "2379",
            "@width": "1663",
            "@_fa": "true",
            "$": "https://api.elsevier.com/content/object/eid/1-s2.0-S0926860X22002010-gr7_lrg.jpg?httpAccept=%2A%2F%2A",
            "@multimediatype": "JPEG image file",
            "@type": "IMAGE-HIGH-RES",
            "@size": "188229",
            "@ref": "gr7",
            "@mimetype": "image/jpeg"
          },
          {
            "@category": "high",
            "@height": "2497",
            "@width": "2994",
            "@_fa": "true",
            "$": "https://api.elsevier.com/content/object/eid/1-s2.0-S0926860X22002010-gr8_lrg.jpg?httpAccept=%2A%2F%2A",
            "@multimediatype": "JPEG image file",
            "@type": "IMAGE-HIGH-RES",
            "@size": "288379",
            "@ref": "gr8",
            "@mimetype": "image/jpeg"
          },
          {
            "@category": "high",
            "@height": "1548",
            "@width": "1663",
            "@_fa": "true",
            "$": "https://api.elsevier.com/content/object/eid/1-s2.0-S0926860X22002010-gr9_lrg.jpg?httpAccept=%2A%2F%2A",
            "@multimediatype": "JPEG image file",
            "@type": "IMAGE-HIGH-RES",
            "@size": "159859",
            "@ref": "gr9",
            "@mimetype": "image/jpeg"
          },
          {
            "@category": "high",
            "@height": "1437",
            "@width": "1663",
            "@_fa": "true",
            "$": "https://api.elsevier.com/content/object/eid/1-s2.0-S0926860X22002010-gr2_lrg.jpg?httpAccept=%2A%2F%2A",
            "@multimediatype": "JPEG image file",
            "@type": "IMAGE-HIGH-RES",
            "@size": "96030",
            "@ref": "gr2",
            "@mimetype": "image/jpeg"
          },
          {
            "@category": "high",
            "@height": "1085",
            "@width": "1085",
            "@_fa": "true",
            "$": "https://api.elsevier.com/content/object/eid/1-s2.0-S0926860X22002010-ga1_lrg.jpg?httpAccept=%2A%2F%2A",
            "@multimediatype": "JPEG image file",
            "@type": "IMAGE-HIGH-RES",
            "@size": "279724",
            "@ref": "ga1",
            "@mimetype": "image/jpeg"
          },
          {
            "@category": "high",
            "@height": "1205",
            "@width": "3493",
            "@_fa": "true",
            "$": "https://api.elsevier.com/content/object/eid/1-s2.0-S0926860X22002010-gr3_lrg.jpg?httpAccept=%2A%2F%2A",
            "@multimediatype": "JPEG image file",
            "@type": "IMAGE-HIGH-RES",
            "@size": "310615",
            "@ref": "gr3",
            "@mimetype": "image/jpeg"
          },
          {
            "@category": "high",
            "@height": "1154",
            "@width": "2994",
            "@_fa": "true",
            "$": "https://api.elsevier.com/content/object/eid/1-s2.0-S0926860X22002010-gr4_lrg.jpg?httpAccept=%2A%2F%2A",
            "@multimediatype": "JPEG image file",
            "@type": "IMAGE-HIGH-RES",
            "@size": "150044",
            "@ref": "gr4",
            "@mimetype": "image/jpeg"
          },
          {
            "@category": "high",
            "@height": "2584",
            "@width": "2994",
            "@_fa": "true",
            "$": "https://api.elsevier.com/content/object/eid/1-s2.0-S0926860X22002010-gr5_lrg.jpg?httpAccept=%2A%2F%2A",
            "@multimediatype": "JPEG image file",
            "@type": "IMAGE-HIGH-RES",
            "@size": "380707",
            "@ref": "gr5",
            "@mimetype": "image/jpeg"
          },
          {
            "@category": "high",
            "@height": "1125",
            "@width": "2994",
            "@_fa": "true",
            "$": "https://api.elsevier.com/content/object/eid/1-s2.0-S0926860X22002010-gr11_lrg.jpg?httpAccept=%2A%2F%2A",
            "@multimediatype": "JPEG image file",
            "@type": "IMAGE-HIGH-RES",
            "@size": "152688",
            "@ref": "gr11",
            "@mimetype": "image/jpeg"
          },
          {
            "@category": "high",
            "@height": "1915",
            "@width": "2495",
            "@_fa": "true",
            "$": "https://api.elsevier.com/content/object/eid/1-s2.0-S0926860X22002010-gr1_lrg.jpg?httpAccept=%2A%2F%2A",
            "@multimediatype": "JPEG image file",
            "@type": "IMAGE-HIGH-RES",
            "@size": "499553",
            "@ref": "gr1",
            "@mimetype": "image/jpeg"
          },
          {
            "@category": "high",
            "@height": "2211",
            "@width": "2994",
            "@_fa": "true",
            "$": "https://api.elsevier.com/content/object/eid/1-s2.0-S0926860X22002010-gr10_lrg.jpg?httpAccept=%2A%2F%2A",
            "@multimediatype": "JPEG image file",
            "@type": "IMAGE-HIGH-RES",
            "@size": "320981",
            "@ref": "gr10",
            "@mimetype": "image/jpeg"
          },
          {
            "@category": "thumbnail",
            "@_fa": "true",
            "$": "https://api.elsevier.com/content/object/eid/1-s2.0-S0926860X22002010-si0001.svg?httpAccept=%2A%2F%2A",
            "@multimediatype": "Scalable Vector Graphics file",
            "@type": "ALTIMG",
            "@size": "3570",
            "@ref": "si0001",
            "@mimetype": "image/svg+xml"
          },
          {
            "@category": "thumbnail",
            "@_fa": "true",
            "$": "https://api.elsevier.com/content/object/eid/1-s2.0-S0926860X22002010-si0002.svg?httpAccept=%2A%2F%2A",
            "@multimediatype": "Scalable Vector Graphics file",
            "@type": "ALTIMG",
            "@size": "4117",
            "@ref": "si0002",
            "@mimetype": "image/svg+xml"
          },
          {
            "@category": "thumbnail",
            "@_fa": "true",
            "$": "https://api.elsevier.com/content/object/eid/1-s2.0-S0926860X22002010-si0003.svg?httpAccept=%2A%2F%2A",
            "@multimediatype": "Scalable Vector Graphics file",
            "@type": "ALTIMG",
            "@size": "3861",
            "@ref": "si0003",
            "@mimetype": "image/svg+xml"
          },
          {
            "@category": "thumbnail",
            "@_fa": "true",
            "$": "https://api.elsevier.com/content/object/eid/1-s2.0-S0926860X22002010-si0004.svg?httpAccept=%2A%2F%2A",
            "@multimediatype": "Scalable Vector Graphics file",
            "@type": "ALTIMG",
            "@size": "1288",
            "@ref": "si0004",
            "@mimetype": "image/svg+xml"
          },
          {
            "@category": "thumbnail",
            "@_fa": "true",
            "$": "https://api.elsevier.com/content/object/eid/1-s2.0-S0926860X22002010-si0005.svg?httpAccept=%2A%2F%2A",
            "@multimediatype": "Scalable Vector Graphics file",
            "@type": "ALTIMG",
            "@size": "2034",
            "@ref": "si0005",
            "@mimetype": "image/svg+xml"
          },
          {
            "@category": "thumbnail",
            "@_fa": "true",
            "$": "https://api.elsevier.com/content/object/eid/1-s2.0-S0926860X22002010-si0006.svg?httpAccept=%2A%2F%2A",
            "@multimediatype": "Scalable Vector Graphics file",
            "@type": "ALTIMG",
            "@size": "4275",
            "@ref": "si0006",
            "@mimetype": "image/svg+xml"
          },
          {
            "@category": "thumbnail",
            "@_fa": "true",
            "$": "https://api.elsevier.com/content/object/eid/1-s2.0-S0926860X22002010-si0007.svg?httpAccept=%2A%2F%2A",
            "@multimediatype": "Scalable Vector Graphics file",
            "@type": "ALTIMG",
            "@size": "1308",
            "@ref": "si0007",
            "@mimetype": "image/svg+xml"
          },
          {
            "@category": "thumbnail",
            "@_fa": "true",
            "$": "https://api.elsevier.com/content/object/eid/1-s2.0-S0926860X22002010-si0008.svg?httpAccept=%2A%2F%2A",
            "@multimediatype": "Scalable Vector Graphics file",
            "@type": "ALTIMG",
            "@size": "1029",
            "@ref": "si0008",
            "@mimetype": "image/svg+xml"
          },
          {
            "@category": "standard",
            "@_fa": "true",
            "$": "https://api.elsevier.com/content/object/eid/1-s2.0-S0926860X22002010-am.pdf?httpAccept=%2A%2F%2A",
            "@multimediatype": "Acrobat PDF file",
            "@type": "AAM-PDF",
            "@size": "45302988",
            "@ref": "am",
            "@mimetype": "application/pdf"
          }
        ]
      },
      "link": {
        "@rel": "abstract",
        "@href": "https://api.elsevier.com/content/abstract/scopus_id/85130844936"
      }
    }
  }
}