{
  "metadata": {
    "title": "Selective hydrogenation of furfural over Pt based and Pd based bimetallic catalysts supported on modified multiwalled carbon nanotubes (MWNT)",
    "authors": "; ; ",
    "journal": "Applied Catalysis A: General",
    "date": "2018-01-25",
    "doi": "10.1016/j.apcata.2017.10.003",
    "abstract": "",
    "uri": "https://api.elsevier.com/content/article/pii/S0926860X1730491X",
    "pii": "S0926860X1730491X"
  },
  "fulltext": {
    "full-text-retrieval-response": {
      "scopus-eid": "2-s2.0-85032573581",
      "originalText": "serial JL 271346 291210 291744 291809 31 Applied Catalysis A: General APPLIEDCATALYSISAGENERAL 2017-10-08 2017-10-08 2017-11-01 2017-11-01 2020-04-20T11:59:37 1-s2.0-S0926860X1730491X S0926-860X(17)30491-X S0926860X1730491X 10.1016/j.apcata.2017.10.003 S300 S300.3 FULL-TEXT 1-s2.0-S0926860X17X00197 2024-01-01T12:31:47.592716Z 0 0 20180125 2018 2017-10-08T15:14:02.445474Z absattachment articleinfo articletitlenorm authfirstinitialnorm authfirstsurnamenorm cid cids contenttype copyright crossmark dateloaded dateloadedtxt datesearch datesort dateupdated dco docsubtype doctype doi eid ewtransactionid hubeid indexeddate issn issnnorm itemstage itemtransactionid itemweight openaccess openarchive pg pgfirst pglast pii piinorm pubdatestart pubdatetxt pubyr sortorder srctitle srctitlenorm srctype ssids alllist content subj subheadings suppl tomb volfirst volissue volumelist webpdf webpdfpagecount yearnav figure table e-component body mmlmath acknowledge affil appendices articletitle auth authfirstini authfull authkeywords authlast grantnumber grantsponsor highlightsabst primabst pubtype ref specialabst 0926-860X 0926860X true 550 550 C Volume 550 2 1 10 1 10 20180125 25 January 2018 2018-01-25 2018 article fla © 2017 Published by Elsevier B.V. SELECTIVEHYDROGENATIONFURFURALOVERPTBASEDPDBASEDBIMETALLICCATALYSTSSUPPORTEDMODIFIEDMULTIWALLEDCARBONNANOTUBESMWNT LIU L 1 Introduction 2 Experimental 2.1 Chemicals 2.2 Catalysts preparation 2.3 Catalysts characterization 2.4 Catalytic tests 3 Results and discussion 3.1 Catalytic performance over Pt-based and Pd-based catalysts 3.2 Influence of reaction temperature 3.3 Influence of reaction time 3.4 Influence of support 3.5 Texture/structure properties of catalyst 3.6 Morphologies of catalyst 3.7 Recyclability of catalysts 3.8 Selective hydrogenation over Pt based and Pd based bimetallic catalysts 4 Conclusions Acknowledgement Appendix A Supplementary data References HUBER 2006 4044 4098 G HUBER 2005 1446 1450 G PETRUS 2006 861 867 L INGRAM 2008 614 625 L CZERNIK 2004 590 598 S SITTHISA 2011 784 791 S SITTHISA 2011 17 27 S RESASCO 2009 1082 1089 D CHEN 2015 23 29 B KARINEN 2011 1002 1016 R WANG 2014 11284 11291 C KIJENSKI 2002 171 182 J STRASSBERGER 2010 142 146 Z PANAGIOTOPOULOU 2014 17 24 P CORMA 2007 2411 2502 A XU 2011 996 999 C LI 2004 2741 2746 H VAIDYA 2003 3881 3885 P QU 2015 105 109 P BHOGESWARARAO 2015 65 77 S EKOU 2012 148 155 T BERTERO 2009 32 41 N ZGOLICZ 2011 208 217 P YAN 2014 663 676 K NAKAGAWA 2014 2718 2726 Y LIU 2016 14721 14731 L LIU 2015 66704 66710 L GUO 2010 314 326 Z HE 2015 401 411 C GALLEZOT 1998 81 126 P AUDEMAR 2015 1885 1891 M LIBERKOVA 2002 221 230 K AMMARI 2005 1 9 F RODRIGUEZ 2011 56 64 J BAKER 2012 14208 14216 L AN 2013 122 128 K FIGUEIREDO 2007 4110 4115 J KUNDU 2008 16869 16878 S ZGOLICZ 2012 37 54 P SUH 1993 427 435 D TASIS 2006 1105 1136 D COQ 1998 175 183 B MIERCZYNSKI 2016 281 294 P ZHANG 2008 2738 2743 J ZENG 2001 235 247 H MIERCZYNSKI 2016 675 691 P SHEKAR 2003 45 59 S CROY 2008 207 216 J DOMOK 2010 33 42 M GRAAT 1996 36 40 P MA 2010 24 32 T HU 2012 208 217 Y LIU 2014 51 59 B DELBECQ 1995 217 236 F SAUTET 1991 245 260 P VOROTNIKOV 2012 2496 2504 V LIUX2018X1 LIUX2018X1X10 LIUX2018X1XL LIUX2018X1X10XL 2019-11-01T00:00:00.000Z http://creativecommons.org/licenses/by-nc-nd/4.0/ © 2017 Published by Elsevier B.V. 2019-03-02T05:51:49.193Z http://vtw.elsevier.com/data/voc/AddOnTypes/50.7/nlp S0926860X1730491X 973 Program of China 2013CB228104 We gratefully acknowledge the financial supports from 973 Program of China (no. 2013CB228104 ). Appendix A item S0926-860X(17)30491-X S0926860X1730491X 1-s2.0-S0926860X1730491X 10.1016/j.apcata.2017.10.003 271346 2024-01-01T12:31:47.592716Z 2018-01-25 1-s2.0-S0926860X1730491X-main.pdf https://s3-eu-west-1.amazonaws.com/prod-ucs-content-store-eu-west/content/pii:S0926860X1730491X/MAIN/application/pdf/80c666128bdf89130f590eb28f318e80/main.pdf main.pdf pdf true 1072004 MAIN 10 1-s2.0-S0926860X1730491X-main_1.png https://s3-eu-west-1.amazonaws.com/prod-ucs-content-store-eu-west/content/pii:S0926860X1730491X/PREVIEW/image/png/7fa9171ebe15196bc166363fbbded647/main_1.png main_1.png png 56134 849 656 IMAGE-WEB-PDF 1 1-s2.0-S0926860X1730491X-fx1.jpg https://s3-eu-west-1.amazonaws.com/prod-ucs-content-store-eu-west/content/pii:S0926860X1730491X/fx1/DOWNSAMPLED/image/jpeg/1207d202f0d9248d1884e7a1e90ccea7/fx1.jpg fx1 true fx1.jpg jpg 46744 193 500 IMAGE-DOWNSAMPLED 1-s2.0-S0926860X1730491X-gr1.jpg https://s3-eu-west-1.amazonaws.com/prod-ucs-content-store-eu-west/content/pii:S0926860X1730491X/gr1/DOWNSAMPLED/image/jpeg/178e68c044ef80ded899b4f6a3c03d01/gr1.jpg gr1 gr1.jpg jpg 17625 254 357 IMAGE-DOWNSAMPLED 1-s2.0-S0926860X1730491X-gr2.jpg https://s3-eu-west-1.amazonaws.com/prod-ucs-content-store-eu-west/content/pii:S0926860X1730491X/gr2/DOWNSAMPLED/image/jpeg/68b69c6e641e8e4043479da645504225/gr2.jpg gr2 gr2.jpg jpg 104603 712 565 IMAGE-DOWNSAMPLED 1-s2.0-S0926860X1730491X-gr3.jpg https://s3-eu-west-1.amazonaws.com/prod-ucs-content-store-eu-west/content/pii:S0926860X1730491X/gr3/DOWNSAMPLED/image/jpeg/90c3b446b20e9853f2fce8f3888543a0/gr3.jpg gr3 gr3.jpg jpg 70125 459 716 IMAGE-DOWNSAMPLED 1-s2.0-S0926860X1730491X-gr4.jpg https://s3-eu-west-1.amazonaws.com/prod-ucs-content-store-eu-west/content/pii:S0926860X1730491X/gr4/DOWNSAMPLED/image/jpeg/90b8ce689647a998e4b141c771b78709/gr4.jpg gr4 gr4.jpg jpg 25493 276 364 IMAGE-DOWNSAMPLED 1-s2.0-S0926860X1730491X-gr5.jpg https://s3-eu-west-1.amazonaws.com/prod-ucs-content-store-eu-west/content/pii:S0926860X1730491X/gr5/DOWNSAMPLED/image/jpeg/f40550de50e05d85937ffe2c18f16991/gr5.jpg gr5 gr5.jpg jpg 24457 204 499 IMAGE-DOWNSAMPLED 1-s2.0-S0926860X1730491X-gr6.jpg https://s3-eu-west-1.amazonaws.com/prod-ucs-content-store-eu-west/content/pii:S0926860X1730491X/gr6/DOWNSAMPLED/image/jpeg/726d5bff60f8b6efeb26ad02a4b408f1/gr6.jpg gr6 gr6.jpg jpg 92935 569 666 IMAGE-DOWNSAMPLED 1-s2.0-S0926860X1730491X-gr7.jpg https://s3-eu-west-1.amazonaws.com/prod-ucs-content-store-eu-west/content/pii:S0926860X1730491X/gr7/DOWNSAMPLED/image/jpeg/e6ec8accb81b8f8b49f2baa9ec537d0b/gr7.jpg gr7 gr7.jpg jpg 89903 663 733 IMAGE-DOWNSAMPLED 1-s2.0-S0926860X1730491X-gr8.jpg https://s3-eu-west-1.amazonaws.com/prod-ucs-content-store-eu-west/content/pii:S0926860X1730491X/gr8/DOWNSAMPLED/image/jpeg/bd45857234f49fb5f5e25ecc09e215d8/gr8.jpg gr8 gr8.jpg jpg 151246 583 715 IMAGE-DOWNSAMPLED 1-s2.0-S0926860X1730491X-gr9.jpg https://s3-eu-west-1.amazonaws.com/prod-ucs-content-store-eu-west/content/pii:S0926860X1730491X/gr9/DOWNSAMPLED/image/jpeg/c2c3288720768650f85395312b43a4b8/gr9.jpg gr9 gr9.jpg jpg 103322 523 619 IMAGE-DOWNSAMPLED 1-s2.0-S0926860X1730491X-fx1.sml https://s3-eu-west-1.amazonaws.com/prod-ucs-content-store-eu-west/content/pii:S0926860X1730491X/fx1/THUMBNAIL/image/gif/b9ff80b492166d05fb5a1ac219a316cc/fx1.sml fx1 true fx1.sml sml 13280 85 219 IMAGE-THUMBNAIL 1-s2.0-S0926860X1730491X-gr1.sml https://s3-eu-west-1.amazonaws.com/prod-ucs-content-store-eu-west/content/pii:S0926860X1730491X/gr1/THUMBNAIL/image/gif/f6b36fb9ccefcab70a960c7da08d2c3d/gr1.sml gr1 gr1.sml sml 5000 156 219 IMAGE-THUMBNAIL 1-s2.0-S0926860X1730491X-gr2.sml https://s3-eu-west-1.amazonaws.com/prod-ucs-content-store-eu-west/content/pii:S0926860X1730491X/gr2/THUMBNAIL/image/gif/3590fd47aea2c0dfd5b22bb55dd007c6/gr2.sml gr2 gr2.sml sml 9367 164 130 IMAGE-THUMBNAIL 1-s2.0-S0926860X1730491X-gr3.sml https://s3-eu-west-1.amazonaws.com/prod-ucs-content-store-eu-west/content/pii:S0926860X1730491X/gr3/THUMBNAIL/image/gif/09f7f316f88bf5a3fd75fb0bca29e8d8/gr3.sml gr3 gr3.sml sml 6031 140 219 IMAGE-THUMBNAIL 1-s2.0-S0926860X1730491X-gr4.sml https://s3-eu-west-1.amazonaws.com/prod-ucs-content-store-eu-west/content/pii:S0926860X1730491X/gr4/THUMBNAIL/image/gif/f61c8f78788d0961b19e06f7a3708f6c/gr4.sml gr4 gr4.sml sml 6458 164 216 IMAGE-THUMBNAIL 1-s2.0-S0926860X1730491X-gr5.sml https://s3-eu-west-1.amazonaws.com/prod-ucs-content-store-eu-west/content/pii:S0926860X1730491X/gr5/THUMBNAIL/image/gif/bfa175aaf4377ad0cbbe2f258f2a0dda/gr5.sml gr5 gr5.sml sml 3969 90 219 IMAGE-THUMBNAIL 1-s2.0-S0926860X1730491X-gr6.sml https://s3-eu-west-1.amazonaws.com/prod-ucs-content-store-eu-west/content/pii:S0926860X1730491X/gr6/THUMBNAIL/image/gif/4e01339fa0d552bab4c6b60d86a61e39/gr6.sml gr6 gr6.sml sml 11127 164 192 IMAGE-THUMBNAIL 1-s2.0-S0926860X1730491X-gr7.sml https://s3-eu-west-1.amazonaws.com/prod-ucs-content-store-eu-west/content/pii:S0926860X1730491X/gr7/THUMBNAIL/image/gif/a6bd619296b1fc09f23f787ef07cb0c1/gr7.sml gr7 gr7.sml sml 8375 164 181 IMAGE-THUMBNAIL 1-s2.0-S0926860X1730491X-gr8.sml https://s3-eu-west-1.amazonaws.com/prod-ucs-content-store-eu-west/content/pii:S0926860X1730491X/gr8/THUMBNAIL/image/gif/b10ea4c3c0729596fa8a2b7eab6440fe/gr8.sml gr8 gr8.sml sml 21462 164 201 IMAGE-THUMBNAIL 1-s2.0-S0926860X1730491X-gr9.sml https://s3-eu-west-1.amazonaws.com/prod-ucs-content-store-eu-west/content/pii:S0926860X1730491X/gr9/THUMBNAIL/image/gif/1c00122b67644be1b53d97c2fe16cff0/gr9.sml gr9 gr9.sml sml 11376 164 194 IMAGE-THUMBNAIL 1-s2.0-S0926860X1730491X-fx1_lrg.jpg https://s3-eu-west-1.amazonaws.com/prod-ucs-content-store-eu-west/content/pii:S0926860X1730491X/fx1/HIGHRES/image/jpeg/e951cdfa2aa2c21e8515e6b127c42f59/fx1_lrg.jpg fx1 true fx1_lrg.jpg jpg 394792 856 2213 IMAGE-HIGH-RES 1-s2.0-S0926860X1730491X-gr1_lrg.jpg https://s3-eu-west-1.amazonaws.com/prod-ucs-content-store-eu-west/content/pii:S0926860X1730491X/gr1/HIGHRES/image/jpeg/ad07f21d67dc6de1def55aa76f24ef92/gr1_lrg.jpg gr1 gr1_lrg.jpg jpg 135233 1124 1582 IMAGE-HIGH-RES 1-s2.0-S0926860X1730491X-gr2_lrg.jpg https://s3-eu-west-1.amazonaws.com/prod-ucs-content-store-eu-west/content/pii:S0926860X1730491X/gr2/HIGHRES/image/jpeg/9046a6392b6e1dfc580f14cf37bc722c/gr2_lrg.jpg gr2 gr2_lrg.jpg jpg 733773 3154 2502 IMAGE-HIGH-RES 1-s2.0-S0926860X1730491X-gr3_lrg.jpg https://s3-eu-west-1.amazonaws.com/prod-ucs-content-store-eu-west/content/pii:S0926860X1730491X/gr3/HIGHRES/image/jpeg/0c616b2a307cf3510863f2d777442dc2/gr3_lrg.jpg gr3 gr3_lrg.jpg jpg 504920 2031 3169 IMAGE-HIGH-RES 1-s2.0-S0926860X1730491X-gr4_lrg.jpg https://s3-eu-west-1.amazonaws.com/prod-ucs-content-store-eu-west/content/pii:S0926860X1730491X/gr4/HIGHRES/image/jpeg/732bba073a32dfb05bcae3192cc16d0b/gr4_lrg.jpg gr4 gr4_lrg.jpg jpg 165943 1224 1613 IMAGE-HIGH-RES 1-s2.0-S0926860X1730491X-gr5_lrg.jpg https://s3-eu-west-1.amazonaws.com/prod-ucs-content-store-eu-west/content/pii:S0926860X1730491X/gr5/HIGHRES/image/jpeg/208624940d9e35ffacbbf97e9401e62f/gr5_lrg.jpg gr5 gr5_lrg.jpg jpg 187729 906 2212 IMAGE-HIGH-RES 1-s2.0-S0926860X1730491X-gr6_lrg.jpg https://s3-eu-west-1.amazonaws.com/prod-ucs-content-store-eu-west/content/pii:S0926860X1730491X/gr6/HIGHRES/image/jpeg/8f48e76047ea619bfbc1dc02ffb8e432/gr6_lrg.jpg gr6 gr6_lrg.jpg jpg 895204 2519 2948 IMAGE-HIGH-RES 1-s2.0-S0926860X1730491X-gr7_lrg.jpg https://s3-eu-west-1.amazonaws.com/prod-ucs-content-store-eu-west/content/pii:S0926860X1730491X/gr7/HIGHRES/image/jpeg/a500c75bb3ee0490eaf85e9a41b48fcd/gr7_lrg.jpg gr7 gr7_lrg.jpg jpg 1228106 2935 3247 IMAGE-HIGH-RES 1-s2.0-S0926860X1730491X-gr8_lrg.jpg https://s3-eu-west-1.amazonaws.com/prod-ucs-content-store-eu-west/content/pii:S0926860X1730491X/gr8/HIGHRES/image/jpeg/79a2e1875cda6a45b8b93ae94190b0f2/gr8_lrg.jpg gr8 gr8_lrg.jpg jpg 1837579 2581 3167 IMAGE-HIGH-RES 1-s2.0-S0926860X1730491X-gr9_lrg.jpg https://s3-eu-west-1.amazonaws.com/prod-ucs-content-store-eu-west/content/pii:S0926860X1730491X/gr9/HIGHRES/image/jpeg/e88c7be7ad573548c82553d4654e74f8/gr9_lrg.jpg gr9 gr9_lrg.jpg jpg 1592679 2318 2743 IMAGE-HIGH-RES 1-s2.0-S0926860X1730491X-mmc1.doc https://s3-eu-west-1.amazonaws.com/prod-ucs-content-store-eu-west/content/pii:S0926860X1730491X/mmc1/MAIN/application/msword/e40cf467e16f6a2ca5cea8668ec53478/mmc1.doc mmc1 mmc1.doc doc 22540288 APPLICATION 1-s2.0-S0926860X1730491X-si1.gif https://s3-eu-west-1.amazonaws.com/prod-ucs-content-store-eu-west/content/pii:S0926860X1730491X/STRIPIN/image/gif/b6fab2a6931bacb2a62d9d577a9c74c0/si1.gif si1 si1.gif gif 5441 66 501 ALTIMG 1-s2.0-S0926860X1730491X-si2.gif https://s3-eu-west-1.amazonaws.com/prod-ucs-content-store-eu-west/content/pii:S0926860X1730491X/STRIPIN/image/gif/7f8989e8745a7b2229263e94f109db91/si2.gif si2 si2.gif gif 5248 66 428 ALTIMG APCATA 16434 S0926-860X(17)30491-X 10.1016/j.apcata.2017.10.003 Fig. 1 Scheme of reaction routes of furfural hydrogenation. Main compounds: furfural (FFR); furfuryl alcohol (FFA); tetrahydrofurfuryl alcohol (THFA); 2-methylfuran; 2-methyltetrahydrofuran; 2-furaldehyde diethyl acetal (FDA). Fig. 1 Fig. 2 Effect of temperature on the furfural hydrogenation over different catalysts: (a) Pt/MWNT, (b) Pt–Fe/MWNT, (c) Pt–Ni/MWNT, (d) Pd/MWNT, (e) Pd–Fe/MWNT, (f) Pd–Ni/MWNT. Conditions 0.5mL furfural in the solvent of ethanol, reaction time 5h, hydrogen pressure 30bar Fig. 2 Fig. 3 The catalytic performance of different catalysts: (a) Pt/MWNT, (b) Pt–Fe/MWNT, (c) Pt–Ni/MWNT, (d) Pd/MWNT, (e) Pd–Fe/MWNT, (f) Pd–Ni/MWNT. Conditions 0.5mL furfural in the solvent of ethanol, reaction temperature 100°C, hydrogen pressure 30bar Fig. 3 Fig. 4 NH3-TPD profiles for MWNT, AC, γ-Al2O3, TiO2, ZrO2 and MgO, and TPD profiles without the adsorption of NH3 for MWNT and AC. Fig. 4 Fig. 5 TPR profiles of reduced catalysts: (a) Pt/MWNT, Pt–Fe/MWNT, Pt–Ni/MWNT; (b) Pd/MWNT, Pd–Fe/MWNT, Pd–Ni/MWNT. Fig. 5 Fig. 6 XPS spectra of Pt/MWNT, Pt–Fe/MWNT, Pd/MWNT, Pd–Ni/MWNT. Fig. 6 Fig. 7 TEM images of catalysts: (a) Pt/MWNT, (b) Pt–Fe/MWNT, (c) Pt–Ni/MWNT, (d) Pd/MWNT, (e) Pd–Fe/MWNT, (f) Pd–Ni/MWNT. Fig. 7 Fig. 8 (a) HR-TEM images of Pt/MWNT, (b) HR-TEM images of Pt–Fe/MWNT, (c) EDS surface scanning profiles of Pt–Fe/MWNT confirmed by HR-TEM, (d) Elemental mapping on the HR-TEM image of Pt–Fe/MWNT. Fig. 8 Fig. 9 Catalyst recyclability studies over (a) Pt/MWNT, (b) Pd/MWNT, (c) Pt–Fe/MWNT, (d) Pd–Ni/MWNT. Conditions 0.5mL furfural in the solvent of ethanol, reaction temperature 100°C, reaction time 1h, hydrogen pressure 30bar Fig. 9 Table 1 Furfural hydrogenation over Pt-based and Pd-based bimetallic catalysts. Conditions 0.5mL furfural in the solvent of ethanol, reaction temperature 100°C, reaction time 5h, hydrogen pressure 30bar Table 1 Catalyst Composition (wt%) a SBET Particle size Conversion (%) Selectivity (%) Pt or Pd Fe or Ni (m2/g) b (nm) c FFA THFA FDA Others d MWNT – – 127 – 24.1 – – 98.7 1.3 Pt/MWNT 0.47 – 119 2.6 64.5 37.6 10.7 45.9 5.8 Pt–Cr/MWNT – – – – 85.4 69.4 2.0 26.3 2.3 Pt–Mn/MWNT – – – – 85.9 75.7 2.0 21.3 1.0 Pt–Fe/MWNT 0.54 0.15 120 2.0 95.2 91.8 2.0 5.2 1.0 Pt–Co/MWNT – – – – 86.7 80.3 2.0 14.5 3.2 Pt–Ni/MWNT 0.49 0.15 121 2.4 95.9 84.1 12.1 2.7 1.1 Pd/MWNT 0.52 – 119 2.4 84.6 13.2 60.5 14.0 12.3 Pd–Cr/MWNT – – – – 87.2 9.5 64.1 11.8 14.6 Pd–Mn/MWNT – – – – 87.8 21.1 63.0 10.4 5.5 Pd–Fe/MWNT 0.52 0.26 119 2.3 88.7 26.1 54.6 8.7 10.6 Pd–Co/MWNT – – – – 86.8 12.0 70.2 11.9 5.9 Pd–Ni/MWNT 0.50 0.27 119 2.2 92.7 2.1 78.2 8.9 10.8 a Measured by ICP-OES. b Evaluated from N2 adsorption-desorption isotherms. c Measured from TEM. d Determined by the characterization of GC–MS, the main byproducts include 2-methylfuran; 2-methyltetrahydrofuran; 2-furaldehyde diethyl acetal; furan,2-(2-furanylmethyl)-5-methyl; 2-methoxymethyl-tetrahydrofuran; 1,1-diethoxy-hexane (shown in Fig. S3). Table 2 Influence of support on furfural conversion. Conditions 0.5mL furfural in the solvent of ethanol, reaction temperature 100°C, reaction time 5h, hydrogen pressure 30bar Table 2 Catalyst Conversion (%) Selectivity (%) FFA THFA FDA Others Pt–Fe/MWNT 95.2 91.8 2.0 5.2 1.0 Pt–Ni/MWNT 95.9 84.1 12.1 2.7 1.1 Pt–Fe/AC 52.9 28.6 35.2 20.7 15.5 Pt–Fe/H-AC 35.3 33.4 38.7 17.6 10.3 Pt–Ni/AC 48.8 55.1 10.3 17.4 17.2 Pt–Ni/H-AC 32.7 60.7 9.9 14.9 14.5 Pt–Fe/MgO 44.1 32.9 25.2 22.2 19.7 Pt–Ni/MgO 43.5 28.6 30.7 22.5 18.2 Pt–Fe/γ-Al2O3 57.5 63.1 23.8 9.8 3.3 Pt–Ni/γ-Al2O3 61.2 55.6 30.7 11.0 2.7 Pt–Fe/TiO2 49.2 70.5 6.3 19.7 3.5 Pt–Ni/TiO2 48.6 68.2 7.9 20.1 3.8 Pt–Fe/ZrO2 47.8 65.7 9.2 19.9 5.2 Pt–Ni/ZrO2 49.2 58.7 14.7 21.5 5.1 Pd–Ni/MWNT 92.7 2.1 78.2 8.9 10.8 Pd–Ni/AC 55.4 25.1 42.2 18.9 13.8 Pd–Ni/H-AC 41.5 13.4 56.8 17.3 12.5 Pd–Ni/MgO 46.7 30.5 24.1 26.8 18.6 Pd–Ni/γ-Al2O3 53.8 34.4 45.7 9.3 10.6 Pd–Ni/TiO2 44.3 28.3 27.8 26.7 17.2 Pd–Ni/ZrO2 43.9 30.2 26.9 24.0 18.9 Table 3 Surface elemental composition and reducibility of catalysts by XPS and H2-TPR analysis. Table 3 Catalyst Surface composition (at%) H2 consumption (μmol/gcat) Binding energy values (eV) Pt4f7/2 or Pd3d5/2 Pt4f or Pd3d Fe2p or Ni2p C1s O1s Pt/MWNT 0.03 – 96.84 3.13 15.98 71.49 Pt–Fe/MWNT 0.04 0.03 96.98 2.95 24.72 71.25 Pt–Ni/MWNT – – – – 21.71 – Pd/MWNT 0.06 – 96.78 3.16 27.73 335.71 Pd–Fe/MWNT – – – – 31.48 – Pd–Ni/MWNT 0.06 0.07 95.89 3.98 33.48 335.68 Feature Article Selective hydrogenation of furfural over Pt based and Pd based bimetallic catalysts supported on modified multiwalled carbon nanotubes (MWNT) Lujie Liu Hui Lou Min Chen ⁎ Institute of Catalysis, Zhejiang University, Hangzhou 310028, PR China Institute of Catalysis Zhejiang University Hangzhou 310028 PR China ⁎ Corresponding author. Graphical abstract Nano-Pt and Nano-Pd particles were introduced to modified multiwalled carbon nanotubes via co-impregnation method for hydrogenation of furfural in liquid phase using ethanol as a solvent. Different transition metal (Cr, Mn, Fe, Co, Ni) was used as promoters using Pt/MWNT and Pd/MWNT catalysts and various supports were also compared to further investigate the hydrogenation process of furfural. Among the catalysts investigated, Pt–Fe/MWNT (Pt: 0.5wt%) showed highest conversion and selectivity to furfuryl alcohol (yield of 87.4%), while Pd–Ni/MWNT (Pd: 0.5wt%) catalysts exhibited the best catalytic performance (83.3% yield of tetrahydrofurfuryl alcohol) under the optimized conditions of 30bar hydrogen and 5h, at 100 and 130°C, respectively. Synergistic effect of bimetallic catalysts has been utilized to improve catalytic activity and stability. The extremely active for the selective hydrogenation of furfural over Pt–Fe/MWNT and Pd–Ni/MWNT catalyst might be attributed to active crystal planes exposed over Pt and Pd promoted by Fe and Ni. Catalysts have shown stable activity and selectivity after 5 cycles using Pt–Fe/MWNT and Pd–Ni/MWNT catalysts. Moreover, we suggest that acid sites of conventional supports might have an impact on furfural conversion. Keywords Furfural hydrogenation Bimetallic catalyst Transition metal Multiwalled carbon nanotubes 1 Introduction In recent decades, researchers have sought to develop new technologies for the production of bio-fuels and other chemical materials, because of the depletion of fossil energy and increasing pollution [1–3]. Bio-oil is a promising bio-fuel and can be obtained from biomass fast pyrolysis. However, bio-oil produced through this process contains a variety of oxygenic functional groups, including ketone, aldehyde, carboxy and some other groups [4,5]. Among the complex oxygenated compounds in bio-oil, furfural (FFR) particularly requires to be stabilized due to the main disadvantage of its high reactivity [6,7]. Research efforts have been made in developing environmentally friendly catalysts for FFR hydrogenation to improve bio-oil heating value and stabilize the bio-oil [8]. In previous studies, various solvents have been investigated in FFR hydrogenation. The high yield of target products furfuryl alcohol (FFA) and tetrahydrofurfuryl alcohol (THFA) could be obtained in strong polar solvents [9]. Although ethanol as a solvent increases the chances of formation of byproducts, it has the obvious advantages of high activity and solubility. Ethanol as a solvent enables FFR to be transformed to FFA, THFA and deep hydrogenation products such as 2-methylfuran and 2-methyltetrahydrofuran. The main byproduct in this process is 2-furaldehyde diethyl acetal (FDA) which would be easily produced in ethanol solvent (shown in Fig. 1 ). In chemical industry, both FFA and THFA have potential use for chemicals manufacturing, e.g. synthetic fiber and green solvent [10–14]. Various heterogeneous catalysts have been proved to be efficient in the hydrogenation of FFR to FFA/THFA either in gas phase or in liquid phase (Tables S1 and S2). FFA has wide industrial application in preparation of THFA, resins, synthetic fibers and chemical intermediate for the production of perfume and vitamin [15–18]. Conventional FFA manufacture hydrogenates FFR over copper chromite catalyst (CuCr2O4·CuO; Cu–Cr) at approximately 180°C and 70–100bar pressure using batch reactors [19]. One major disadvantage of this method is the requirement of high hydrogen pressure (70–100bar). Furthermore, toxicity of these catalysts due to the presence of chromium is another drawback. Noble metal catalysts exhibit higher activity of catalyzing hydrogenation. Platinum is known as effective catalyst in FFR hydrogenation, and especially facilitates in the partial hydrogenation reactions of FFR to FFA by CO hydrogenation [20]. Bhogeswararao and Srinivas [21] proposed that Pt (10wt%) supported over γ-Al2O3, under 25°C and 60bar pressure of hydrogen, obtained 65.6wt% conversion of FFR with 99.7wt% selectivity towards FFA. As reported by Wang et al. [11], the hydrogenation performance of Pt/MWNT for FFA production has been investigated. The 5.0wt% Pt catalyst showed the best performance. The FFA yield could reach 75.0% under 150°C and 20bar pressure for 5h. Additionally, in order to make catalysts more cost-efficient, promoters are often used in catalyst preparation, e.g. Pt/Ti–Al2O3, Pt–Sn/γ-Al2O3, Pt–Co/C [22–24]. As far as we are concerned, research on the utilization of Pt based bimetallic catalysts with a low loading (0.5wt%) of Pt for FFA synthesis is scarce. THFA is usually regarded as a green solvent and has wide application in preparation of 1, 5-pentanediols, printing inks, agricultural applications and electronics cleaners [21,25]. Latest research interests concentrate on the direct hydrogenation of FFR to THFA. With respect to this, Nakagawa et al. [26] indicated that the Pd–Ir alloy (Pd: 2wt%, Pd/Ir=1) supported on SiO2 presented the best catalytical activity. Though in this process, conversion of FFR over 99% with 94% selectivity of THFA was achieved, disadvantages of relatively low reaction temperature (2°C) and high hydrogen pressure (80bar) hinder its further application. Recently, Chen et al. [9] showed their study on one-step hydrogenation to produce THFA using Ni–Pd alloy on TiO2–ZrO2 support. Bimetallic catalyst (Ni: 5wt%, Ni/Pd=5, mole ratio) exhibited the best catalytic hydrogenation result. The yield of THFA could reach 93.4% at 130°C and 50bar hydrogen pressure for 8h. As reported by Bhogeswararao et al. [21], the 5wt% Pd/Al2O3, under 25°C and 60bar pressure of hydrogen, acquired 79.5wt% conversion of FFR with 100wt% selectivity towards THFA. In our very recent study, given the unique structure and properties of MWNT, modified MWNT was utilized for supporting Cu–Ni alloy in liquid-phase of FFR hydrogenation. The Cu–Ni/MWNT provided superior performance with 90.3% yield of THFA under optimized condition at 130°C, 40bar pressure for 10h [27]. Here, we report the application of low amount loading (0.5wt%) of Pd supported on MWNT using transition metal as promoters to enhance the catalytic activity for direct hydrogenation of FFR to THFA in liquid phase. Additionally, based on our previous research, oxygenated functional groups such as carbonyl/carboxyl groups, and ester groups, are beneficial for metal dispersed on the surface of carbon materials (activated carbon and MWNT) [27,28]. Various promoters enhance the catalytic performance with added metal oxide e.g. Fe (Ш) [20], Sn [24], Co [29], Ni [30]. In this work, transition metal (Cr, Mn, Fe, Co, Ni) was investigated as promoters using Pt–M/MWNT and Pd–M/MWNT (M represents transition metal) catalysts in ethanol as a solvent for furfural hydrogenation. The same role of iron and nickel playing in bimetallic catalysts and the different hydrogenation result over Pt–Fe/MWNT and Pd–Ni/MWNT catalysts were investigated emphatically. Moreover, reaction temperature and reaction time were fully discussed, and supports (MWNT, activated carbon, modified activated carbon, MgO, γ-Al2O3, TiO2, and ZrO2) were also compared to further investigate the process of FFA or THFA formation. 2 Experimental 2.1 Chemicals Ethanol (purity>99.7%), HNO3 (68% purity), H2PtCl4·6H2O (>99.0%), H2PdCl4·6H2O (>99.0%), Cr(NO3)3·9H2O (>99.0%), Mn(NO3)2 (50.0%), Fe(NO3)3·9H2O (>98.5%), Co(NO3)2·6H2O (>98.5%), Ni(NO3)2·6H2O (>98.0%) were provided by Sinopharm Co. Ltd. Furfural (99%), ZrO2 (99.99%, 50nm, 78m2/g), TiO2 (99.8%, 40nm, 90m2/g), γ-Al2O3 (99.9%, 20nm, 104m2/g), MgO (>99.0%, 50nm, 54m2/g), and activated carbon (AC) (>99.5%, 8–16mesh, 779m2/g) were bought from Aladdin Chemistry Co. Ltd. Multiwalled carbon nanotubes (>95%) were provided by DK Nano Technology Corporation. The MWNT support was obtained from mixing raw MWNT (98m2/g) with HNO3 at 120°C for 4h by agitating magnetically. In this process, oxygenated functional groups can be formed on the surface of MWNT, and samples were purified with water until a final pH of 7.0 for the filtrate and dried at 100°C overnight. To investigate the acidic functionalization of the carbonaceous material, raw activated carbon was also used as a support. The modified AC was denoted as H-AC which was obtained from the same nitric acid treatment. 2.2 Catalysts preparation Supported bimetallic Pt-based and Pd-based catalysts were prepared by co-impregnation method, and the mass fraction of the loaded palladium or platinum was 0.5wt% (Pt–M=1:1, Pd–M=1:1, molar ratio, M represents transition metal Cr, Mn, Fe, Co, Ni). The modified MWNT was mixed with H2PtCl6 or H2PdCl4 and transition metal precursors in an aqueous solution, and followed by ultrasonic oscillation for about 10min. Then, the samples were impregnated for 24h, dried at 100°C overnight, and reduced at 400°C for 4h by H2. 2.3 Catalysts characterization Specific surface area (SBET) was acquired based on adsorption data by TriStar II 3020 instrument. In prior to analysis, all reduced catalysts were degassed at 120°C. X-ray diffraction (XRD) was obtained in the range of 20–80° on a Rigaku D/max-IIIB diffractometer with CuKa radiation at 40kV. The metal particle size on the surface of MWNT was observed by transmission electron microscopy: HT7700 microscope and around 100–150 particles were examined to make curves of particle size distribution. Pt, Pd and Fe were confirmed by high resolution transmission electron microscopy (HR-TEM, JEM-2100F). The sample was mixed with ethanol, sonicated, dripped on a copper-grid, and dried in the air. The reducibility of the catalysts was acquired by temperature programmed reduction (TPR) technique with GC-1690 instrument. In TPR measurement, a quartz tube was loaded with 100mg of catalyst. Sample was pretreated in 30mL/minN2 at 220°C for 30min and then cooled to −150°C. A gas mixture of 5% H2/Ar (30mL/min) was used for catalysts reduction at a heating rate of 10°C/min to 650°C. The total amount of hydrogen consumption was followed by a TCD detector to determine the reduction capacity of the catalyst. The H2 consumption per gram of samples was calibrated with a standard CuO powder (shown in Fig. S1). The acid sites of various supports were qualitatively measured by temperature programmed desorption (TPD) of ammonia. In each experiment, 150mg of support was heated at 500°C under Ar flow for 2h. Then, it was saturated by a mixture of NH3 in Ar (30mL/min) at 50°C. The excess of ammonia was flushed out with Ar flow for 30min. Ammonia desorption was carried out at a heating rate of 10°C/min to 700°C. For activated carbon and modified MWNT supports, in order to eliminate the influence of surface functional groups decomposing, TPD measurement without the adsorption of NH3 was also carried out in the same condition. X-ray photoelectron spectra (XPS) of the catalysts were carried out on a pH I5000c spectrometer using Al Kα radiation source (hν=1486.6eV) at 12.5kV, and the energy (BE) values were calibrated by the peak of C 1s line at 284.6eV. 2.4 Catalytic tests The selective hydrogenation of furfural in liquid phase was carried out in a 50mL stainless steel reactor. For each test, 0.5mL of furfural was hydrogenated over 0.1g of catalyst and 5.0mL of solvent (ethanol). In order to minimize the limitations by mass transfer steps, the effect of stirring speed on FFR conversion was studied. The results present that FFR conversion remains unchanged when the stirring speed is above 500rpm, suggesting a kinetics-controlled regime (see Fig. S2). Therefore, the stirring speed was set at 500rpm in this study. Before the reaction, the reactor was purified with hydrogen several times to replace the air in the setup and filled with 30bar H2. Hydrogenation process of furfural was under the conditions of certain temperature in desired time. Till the temperature decreased to 25°C, the liquid products were separated with catalysts and known by qualitative analysis of a FID gas chromatograph using HP-5 capillary column and GC–MS (HP 6890, 5973 MSD). Accurate calculation of conversion and selectivity was in consistent with previous method [27,28] and defined as following, with errors in reported conversion and selectivity of ±4.5%. (1) C o n v e r s i o n ( % ) = m o l ( F F R , i n ) − m o l ( F F R , o u t ) m o l ( F F R , i n ) × 100 % (2) S e l e c t i v i t y ( % ) = m o l ( p r o d u c t ) m o l ( F F R , i n ) × C on . × 100 % 3 Results and discussion 3.1 Catalytic performance over Pt-based and Pd-based catalysts Gallezot and Richard [31] suggested that the catalytic performance in α,β-unsaturated aldehydes hydrogenation can be enhanced over Pt-based catalyst when adding a second metal as the promoter. In this research, an alloy of Pt or Pd and promoter was simply formed by co-impregnation method. Some transition metals were investigated as promoters, and the hydrogenation result is presented in Table 1 . A FFR conversion of 24.1% is obtained in the presence of MWNT and no production of FFA or THFA was observed. The low conversion of FFR is attributed to the acetalization between FFR and ethanol, which also has been observed using SBA-15 for blank experiment for FFR hydrogenation [32]. Numerous typical byproduct of FDA would occur over monometallic Pt and Pd catalyst. All of the promoters (Cr, Mn, Fe, Co, Ni) screened show positive effect on FFR hydrogenation at 100°C, 30bar hydrogen for 5h, and especially introducing Fe and Ni improves FFR conversion and FFA or THFA selectivity, respectively. Consequently, bimetallic catalysts Pt–Fe/MWNT, Pt–Ni/MWNT, Pd–Fe/MWNT and Pd–Ni/MWNT would be fully investigated. Furthermore, it should be noted that Pt-based catalysts are selective to FFA formation (CO hydrogenated product), while THFA is likely to be produced through CC and CO hydrogenation of FFR over Pd-based catalysts. The high conversion and selectivity driven by promoters could be considered from two aspects: one is the catalytic active sites interacting with promoters [33,34], the other may be attributed to the electron contributions from the promoters to Pt and Pd because of the alloy [35], which would be interpreted by the following experiments. 3.2 Influence of reaction temperature According to earlier studies, researchers have proved that it was prone to produce n-butanol, 2-methylfuran furan in high temperature [14,21]. Hence, temperature in the range of 25–130°C has been fully investigated as shown in Fig. 2 . Bimetallic Pt-based and Pd-based catalysts exhibit higher catalytic activity compared to monometallic catalysts at 5h under 30bar hydrogen. With respect to Pt-based catalysts, monometallic Pt/MWNT shows relatively poor catalytic activity and selectivity, producing a higher level of 2-furaldehyde diethyl acetal (FDA, from acetal reaction of furfural with ethanol) from 25°C to 130°C (Figs. 2, S3c). The Pt–Fe/MWNT and Pt–Ni/MWNT catalysts demonstrate a similar trend to each other for the conversion of FFR with reaction temperature. As reaction temperature rises from 25 to 100°C, the significant increase to over 95% in FFR conversion has been acquired. When temperature keeps on increasing to 130°C, FFR conversion is without significant trend changes. As seen in Fig. 2, the FFR conversion varies in order: Pt–Ni/MWNT (95.9%)>Pt–Fe/MWNT (95.2%)>Pt/MWNT (64.5%) at 100°C. Pt–Fe/MWNT possessed the highest selectivity (91.8%) towards FFA. However, selectivity of FFA decreases to 76.2%, as temperature increases to 130°C. In the case of Pd-based catalysts, Pd/MWNT has better hydrogenation activity compared to Pt/MWNT. It can be explained that both Pd/MWNT and Pt/MWNT are in high dispersion, and with the same actual metal content (0.47wt%), Pd/MWNT possesses more active molecules. As reaction temperature rises from 25 to 130°C, FFR conversion and selectivity of THFA increase significantly. FFR conversion varies in order: Pd–Ni/MWNT (96.7%)>Pd–Fe/MWNT (90.4%)>Pd/MWNT (85.1%), while THFA selectivity would gradually descend in order: Pd–Ni/MWNT (86.1%)>Pd/MWNT (75.1%)>Pd–Fe/MWNT (68.7%) at 130°C. It is worth noting that adding Fe and Ni to Pt-based and Pd-based catalysts as the promoters makes a difference. Metallic nickel is beneficial for both CC and CO hydrogenation, while metallic iron facilitates CO hydrogenation. 3.3 Influence of reaction time Fig. 3 presents the process of reaction as a function of time over Pt-based and Pd-based catalysts at 100°C and 30bar hydrogen. For Pt-based catalysts, selectivity towards FFA has been taken into account in contrast to the formation of THFA over Pd-based catalysts. Similar trend for conversion of FFR has been observed over Pt- and Pd-based catalysts. Most of furfural molecules have been converted in less than an hour over Pt-based bimetallic and Pd-based catalysts. Pt–Fe/MWNT, Pt–Ni/MWNT, and Pd–Ni/MWNT catalysts are highly active hydrogenation catalysts. After the reaction runs for 1h, over 85.5% conversion of FFR is achieved over these catalysts with the hydrogenation products FFA (67.9%, over Pt–Fe/MWNT), FFA (65.2%, over Pt–Ni/MWNT), and THFA (75.5%, over Pd–Ni/MWNT). FFR conversion increases slightly with reaction time prolonged to 10h, and it decreases in order: Pd–Ni/MWNT (97.3%)>Pt–Ni/MWNT (96.5%)>Pt–Fe/MWNT (96.3%)>Pd–Fe/MWNT (93.3%)>Pd/MWNT (92.3%)>Pt/MWNT (76.3%). However, formation of FFA and THFA varies as reaction time prolonged using different catalysts. For Pt–Fe/MWNT and Pt–Ni/MWNT catalysts, selectivity of FFA decreases from 91.8% and 84.1% to 76.2% and 72.8%, respectively after relatively long reaction time (10h). On the contrary, selectivity of THFA increases to 67.5% and 85.2% over Pd–Fe/MWNT and Pd–Ni/MWNT catalysts, respectively after 10h reaction time. 3.4 Influence of support Alloyed Pt–Fe, Pt–Ni and Pd–Ni were introduced on MWNT, AC, H-AC, MgO, γ-Al2O3, TiO2, and ZrO2 support for the catalytic hydrogenation of FFR at 100°C and 30bar H2 for 5h in presence of an ethanol solvent (summarized in Table 2 ). MWNT support gives the most excellent catalytic activity compared to other supports. Byproducts FDA could be formed in large quantity over AC, H-AC, MgO, γ-Al2O3, TiO2, and ZrO2 supports. Although there has a difference about the conversion of FFR over bimetallic Pt-Fe, Pt-Ni and Pd-Ni catalysts with various supports, metallic iron facilitates CO hydrogenation as we suggested. It should also be noted that the conversion of FFR is even lower using H-AC as a support than metal supported over AC, which is in accordance with our group early research [28]. Oxygenates functional groups have been increased significantly on the surface of activated carbon after modification at the cost of collapsion of parts of activated carbon pores, especially the micropores (seen in Table S3). These pores might offer more contact points with active compounds, which is supposed to improve the catalytic performance. Moreover, it is interesting to be found that the byproducts (FDA and others) selectivity decreases while the desired products selectivity increases after activated carbon support with acid treatment. It shows the acid sites of AC have an impact on furfural selective conversion. As mentioned by Robert Baker and An et al. [36,37], the reaction pathway would be greatly affected by the synergic effects from Pt surface and support acid sites. Accordingly, the acid sites of different supports were measured by NH3-TPD in Fig. 4 . For metal oxide supports, γ-Al2O3 support presents three NH3 desorption peaks in the temperature range of 50–700°C. The first peak (100–300°C) should be assigned to weak acid sites. The second peak (300–500°C) and the third peak (500–700°C) correspond to moderate and strong acid sites, respectively. While ZrO2 and TiO2 support demonstrate a wide peak of 100–500°C, indicating the presence of some amount of weak and moderate acid sites. These acid sites are not obvious over MgO support because of its strong basicity. The selectivity of byproducts (FDA and others) over selected metal oxide supports roughly shows the following sequence: MgO>ZrO2 >TiO2 >γ-Al2O3. The trend is opposite to the order of support acid sites. It seems that the byproducts (FDA and others) are more favorable to occur over support with low amount of acid sites within the metal oxide supports screened. For AC and modified MWNT support, it has been identified that activated carbon and modified MWNT support will release CO2, CO and water due to surface functional groups decomposing at different temperatures in the TPD experiment [38,39]. The stronger acid groups on the surface of nitric acid treatment MWNT lead to CO2-desorption at low temperatures (between 200 and 500°C) and the weaker acid sites (lactone, phenol, and carbonyl groups) lead to CO-desorption at higher temperatures (over 500°C) [40,41]. Fig. 4 shows most of the strong acid ones (carboxylic and anhydride groups) on modified MWNT have been removed before NH3-TPD test by pretreatment at 500°C, due to the relatively flat curve of NH3-TPD profile of MWNT at 200–500°C. The peak (about 570°C for TPD profile of MWNT and 590°C for NH3-TPD profile of MWNT) might be the decomposition of a small amount of impurities in MWNT. The CO-desorption has also been observed over both AC and MWNT support at 500–700°C. On the one hand, the obvious superiority observed over modified MWNT for catalyzing FFR hydrogenation should be explained by the unique structure of MWNT [42], resulting in high effective surface area and dispersion in the liquid medium compared to the other metal oxide supports. On the other hand, the acid sites enhanced by nitric acid treatment in the modified MWNT could activate the furfuryl-oxy intermediate formation and furfuryl-oxy intermediate might provide a vital role in the formation of FFA and THFA as an active adsorbate. 3.5 Texture/structure properties of catalyst The SBET of MWNT increased to 127m2/g with pretreatment by nitric acid (Table 1). It should be attributed to the removal of some metallic impurities and amorphous carbon on the MWNT surface using nitric acid treatment [20]. The BET surface area decreased slightly after Pt/Pd and transition metal introduced to the treated MWNT. The XRD patterns of Pt and Pd catalysts with transition metal (Cr, Mn, Fe, Co, Ni) added are shown in Fig. S4. Characteristic diffraction peak (0 0 2) of a graphite-like tube-wall of the MWNT is situated at 26.5° [43]. No obvious diffraction peaks of cubic structure of metallic Pt or Pd appeared. It can be due to the low Pt and Pd contents (0.5wt%), and also the small particle size and high dispersion of Pt and Pd. H2-TPR has been carried out to observe the difference of adding a second metal to prepared catalysts in the reducibility and interaction between active species and MWNT support. As reported by Mierczynski et al. [44], the MWNT could not be reduced from 25°C to 900°C. As shown in Fig. 5 , there was a wide peak of all the catalysts at 400–650°C, corresponding to the carbon nanotubes gasification process to form CH4. Methane formation generally occurs in the temperature range of 390–800°C [45–47]. From TPR profiles of Pt-based catalysts, it can be seen that the Pt/MWNT catalyst presents two reduction peaks situated at 122 and 208°C, respectively (Fig. 5a). The first peak could be due to the weak interaction between PtO and MWNT support, the second is probably related to PtO with high dispersion and a strong interaction between PtO and MWNT. While reduction peaks occur at higher temperature of Pt–Fe/MWNT and Pt–Ni/MWNT, which could be due to the alloying of Pt–Fe and Pt–Ni metal (confirmed by HR-TEM). The total H2 consumption values of Pt-based catalysts decrease in the order: Pt–Fe/MWNT (24.72μmol/g)>Pt–Ni/MWNT (21.71μmol/g)>Pt/MWNT (15.98μmol/g) (Table 3 ). As found in literature, some reports pointed out that bulk PdO could be reduced by hydrogen at around 25°C, and the formed β-PdH would exhibit a negative peak at about 60–100°C concerned with the β-PdH decomposition [21,48]. However, this result was not observed within the temperature range. Pd-based catalysts have lower hydrogen uptake values and larger H2 consumption values than Pt-based catalysts. The total H2 consumption values of Pd-based catalysts decrease in the order: Pd–Ni/MWNT (33.48μmol/g)>Pd–Fe/MWNT (31.48μmol/g)>Pd/MWNT (27.73μmol/g). It is interesting that different behavior of both Pt- and Pd-based catalysts in H2-TPR measurement is in accord with the particle size of metal which was counted from TEM image (Table 1 and Fig. 7 ). The smaller metal size has the larger hydrogen consumption. In terms of the H2 consumption value of Pd-based catalysts being higher than the Pt-based catalysts, this should be due to the more absolute moles of Pd-based catalysts since the metal loading has little difference. Another possible reason is that the strength of the interaction of PdO with MWNT and PtO with MWNT support exits difference. XPS spectra of Pt and Pd supported on MWNT indicate that the noble metals were both in zero and +2 valence state (Fig. 6 ). Though these reduced catalysts were stored in quartz tube with Ar, it was still unable for all the samples to avoid contact with the air in XPS measurement. As a result, this XPS data cannot reflect the actual state of the catalyst in reaction process, but to some extent, it provides circumstantial evidence for redox properties of the supported metal and the oxidized/deactivated species formation [21]. Surface composition of samples suggests that metal loading amount on MWNT surface is very low (Table 3), which is in agreement with ICP results. As proposed by Croy and Domok et al. [49,50], the binding energy (BE) values of photoelectrons were deeply influenced by the size of the metal particles. In general, higher binding energy would be found on the smaller metal particle. Compared to 5wt% loading amount of Pt supported on MWNT in literature (Pt 4f7/2, 71.24eV) [30], BE values of 0.5wt% Pt/MWNT are higher, which can be ascribed to the smaller particle size (2.0–2.6nm) of Pt nano particles. As shown in Fig. 6a, BE values of platinum for Pt–Fe/MWNT are lower than Pt/MWNT catalyst. It should be assigned to the electrons transferring from iron to platinum because of the Pt–Fe alloy. Due to the low metal loading amount, XPS spectrum of iron is not obvious (Fig. 6b). The Fe 2p spectrum of Pt–Fe/MWNT indicates that almost all of the iron is in the oxidation state, which is confirmed by the peak at 708.20eV. The 2p3/2 binding energy of alloying iron is higher than that corresponding to metallic iron (706.8eV) [51,52], which might be attributed to the electron donating by alloy iron or the electron transfer from iron to MWNT support. For Pd supported on MWNT (Fig. 6c), same BE values variation have been observed. BE values of palladium for Pd–Ni/MWNT are lower than Pd/MWNT catalyst, which is attributed to the electrons transferring from nickel to palladium owing to the Pd–Ni alloy. From the Ni 2p spectra of Pd–Ni/MWNT (Fig. 6d), the main peak situated at around 854.91eV corresponds to nickel oxide species. 3.6 Morphologies of catalyst Structure of monometallic and bimetallic catalysts was observed by TEM technique and pictures are presented in Fig. 7, and particle sizes of the catalysts are listed in Table 1. As shown in the pictures, a large proportion of metallic particles are in uniform dispersion on the MWNT external surface. With respect to Pt-based catalysts, averaged particle size of Pt crystallites decreases from 2.6 to 2.0 and 2.4nm, when Fe and Ni were used as promoters, respectively. In the case of Pd-based catalysts, averaged crystallite size decreases from 2.4 to 2.3 and 2.2nm when Fe and Ni were used. This result indicated that the noble metal particles were indeed with high dispersion on the nanoscale. Because of the low loading amount of metal on MWNT, detailed information about the alloy of noble metals and promoters could not be acquired by XRD technique. Therefore, Pt/MWNT, Pd/MWNT, Pt–Fe/MWNT and Pd–Ni/MWNT were characterized by HR-TEM. The HR-TEM image of the Pt/MWNT shows the face-centered cubic (100), while Pt–Fe/MWNT shows the dominant formation of the face-centered cubic (111) lattice image (Fig. 8 a, b). The lattice spacing is observed to be 0.203nm for Pt (111) of Pt–Fe/MWNT (Fig. 8b), while this value is slightly smaller than that of the (111) plane of Pt (0.225 nm) due to the contraction of the lattice upon substitution of a Pt atom with a Fe atom. Hu et al. [53] observed this phenomenon when Ni was doped with Pt to form the Pt–Ni alloy. Same result is also obtained from Pd/MWNT and Pd–Ni/MWNT (shown in Fig. S5). The compositions of Pt–Fe/MWNT catalyst were estimated by EDS as shown in Fig. 8c. The EDS result for the Pt-Ni catalysts reveals the presence of C, Pt, and Fe, and the background signal of some amount of Cu and Si, suggesting that the nano catalysts supported on the MWNT are Pt–Fe nano particles. The atomic ratio (Table S4) between Pt and Fe of the prepared catalyst is close to that of the XPS elemental composition in Table 3. As evidenced by the elemental mapping, Pt and Fe are remarkably uniform and well dispersed on the MWNT surface (Fig. 8d). All of the nano particles are considered to be spherical with a mean particle diameter of approximately 2.0 nm, as evaluated by TEM analysis (Fig. 7b). 3.7 Recyclability of catalysts The recyclability of Pt–Fe/MWNT and Pd–Ni/MWNT in hydrogenation of FFR was investigated at 100°C, 30bar hydrogen and 1h reaction time. Results were in comparison with Pt/MWNT and Pd/MWNT. Bimetallic catalysts show stable activity and selectivity even after 5 cycles (Fig. 9 c, left panel for Pt–Fe/MWNT; Fig. 9d, right panel for Pd–Ni/MWNT). However, there is an evident loss both in catalytic activity and FFA/THFA selectivity for monometallic Pt/MWNT and Pd/MWNT catalysts (Fig. 9a and b). Hence, this result indicates that the catalysts become more recyclable and the loss of active species could be reduced after promoters were introduced to form an alloy. 3.8 Selective hydrogenation over Pt based and Pd based bimetallic catalysts Based on the experimental data acquired, Pt-Fe/MWNT catalyst is selective for hydrogenation of CO to form FFA while Pd-Ni/MWNT catalyst is beneficial for both CC and CO group forming THFA. As proposed in previous literature, furfural can be adsorbed and activated through either η1-(O)-aldehyde or η2-(CO)-aldehyde mode of coordination [54]. Delbecq et al. further suggested that the adsorption of CC and CO of unsaturated aldehydes varies on different face of Pt and Pd [55]. Here, following main factors were taken into account to explain the different result of furfural hydrogenation over Pt-Fe/MWNT and Pd-Ni/MWNT. Firstly, the Pt bulk has a slightly lower Fermi level and larger d-band width than Pd, which leads to strengthening interactions between molecule and Pt surface, especially the stronger four electron repulsive interactions whose dominant role favors CO hydrogenation over Pt between p-electrons of furan ring and Pt d-electrons [55,56]. Thus, high yield of THFA could be obtained over Pd due to the closer interaction with furan ring p-electrons. Secondly, Pt (111) plane prefers adsorption of the molecule through η1(CO) coordination, while adsorption on Pt (100) occurs through both η2(CC) and η1(CO) modes, and Pd (111) would behave like the Pt (100) [21,55]. When using transition metal (Fe, Ni) as promoters, more active crystal planes Pt (111) (Fig. 8a, b) and Pd (111) (Fig. S5a, b) might be exposed, and hence, FFA or THFA is formed selectively over bimetallic catalysts. This difference in product selectivity over Pt based and Pd based catalysts is also attributed to the differences in the binding energies and orientation of adsorption of FFR on catalyst surfaces [54,57]. 4 Conclusions In summary, we demonstrated a series of MWNT supported low loading amount of Pt-based and Pd-based bimetallic catalysts with a highly uniform size prepared by a simple co-impregnation method. The bimetallic synergistic effect in Pt–Fe/MWNT and Pd–Ni/MWNT catalysts was used to enhance the catalytic activity for furfural hydrogenation in liquid phase. Additionally various effects including support, promoter and reaction conditions mainly about temperature and reaction time were fully investigated. Catalysts have shown stable activity and selectivity after 5 cycles using Pt–Fe/MWNT and Pd–Ni/MWNT catalysts. This work may also provide some references for the upgrading of other components in bio-oil. Acknowledgement We gratefully acknowledge the financial supports from 973 Program of China (no. 2013CB228104). Appendix A Supplementary data Supplementary data associated with this article can be found, in the online version, at https://doi.org/10.1016/j.apcata.2017.10.003. Appendix A Supplementary data The following is Supplementary data to this article: References [1] G.W. Huber S. Iborra A. Corma Chem. Rev. 106 2006 4044 4098 [2] G.W. Huber J.N. Chheda C.J. Barrett J.A. Dumesic Science 308 2005 1446 1450 [3] L. Petrus M.A. Noordermeer Green. Chem. 8 2006 861 867 [4] L. Ingram D. Mohan M. Bricka P. Steele D. Strobel D. Crocker B. Mitchell J. Mohammad K. Cantrell C.U. Pittman Energy Fuel 22 2008 614 625 [5] S. Czernik A.V. Bridgwater Energy Fuel 18 2004 590 598 [6] S. Sitthisa D.E. Resasco Catal. Lett. 141 2011 784 791 [7] S. Sitthisa T. Pham T. Prasomsri T. Sooknoi R.G. Mallinson D.E. Resasco J. Catal. 280 2011 17 27 [8] D.E. Resasco S. Crossley Aiche J. 55 2009 1082 1089 [9] B.F. Chen F.B. Li Z.J. Huang G.Q. Yuan Appl. Catal. A Gen. 500 2015 23 29 [10] R. Karinen K. Vilonen M. Niemela ChemSusChem 4 2011 1002 1016 [11] C. Wang Z. Guo Y.H. Yang J. Chang A. Borgna Ind. Eng. Chem. Res. 53 2014 11284 11291 [12] J. Kijenski P. Winiarek T. Paryjczak A. Lewicki A. Mikolajska Appl. Catal. A Gen. 233 2002 171 182 [13] Z. Strassberger M. Mooijman E. Ruijter A.H. Alberts C. de Graaff R.V.A. Orru G. Rothenberg Appl. Organomet. Chem. 24 2010 142 146 [14] P. Panagiotopoulou D.G. Vlachos Appl. Catal. A Gen. 480 2014 17 24 [15] A. Corma S. Iborra A. Velty Chem. Rev. 107 2007 2411 2502 [16] C. Xu L. Zheng D. Deng J. Liu S. Liu Catal. Commun. 12 2011 996 999 [17] H. Li S. Zhang H. Luo Mater. Lett. 58 2004 2741 2746 [18] P.D. Vaidya V.V. Mahajani Ind. Eng. Chem. Res. 42 2003 3881 3885 [19] A. Homer, C. Ralph, US Patent 2, 094, 975, 1937. [20] P.F. Qu J.G. Chen Y.H. Song Z.T. Liu Z.W. Liu Y. Li J. Lu J.Q. Jiang Catal. Commun. 68 2015 105 109 [21] S. Bhogeswararao D. Srinivas J. Catal. 327 2015 65 77 [22] T. Ekou A. Flura L. Ekou C. Especel S. Royer J. Mol. Catal. A Chem. 353–354 2012 148 155 [23] N.M. Bertero A.F. Trasarti B. Moraweck A. Borgna A.J. Marchi Appl. Catal. A Gen. 358 2009 32 41 [24] P.D. Zgolicz V.I. Rodríguez I.M.J. Vilella S.R. Miguel O.A. Scelza Appl. Catal. A Gen. 392 2011 208 217 [25] K. Yan G.S. Wu T. Lafleur C. Jarvis Renew. Sustain. Energy Rev. 38 2014 663 676 [26] Y. Nakagawa K. Takada M. Tamura K. Tomishige ACS Catal. 4 2014 2718 2726 [27] L.J. Liu H. Lou M. Chen Int. J. Hydrogen Energy 41 2016 14721 14731 [28] L.J. Liu H.M. Guo B. Xue H. Lou M. Chen RSC Adv. 5 2015 66704 66710 [29] Z. Guo Y.T. Chen L.S. Li X.M. Wang G.L. Haller Y.H. Yang J. Catal. 276 2010 314 326 [30] C. He J.W. Zheng K. Wang H.Q. Lin J.Y. Wang Y.H. Yang Appl. Catal. B Environ. 162 2015 401 411 [31] P. Gallezot D. Richard Catal. Rev. 40 1998 81 126 [32] M. Audemar C. Ciotonea K.D. Vigier S. Royer A. Ungureanu B. Dragoi E. Dumitriu F. Jerome ChemSusChem 8 2015 1885 1891 [33] K. Liberkova R. Touroude J. Mol. Catal. A Chem. 180 2002 221 230 [34] F. Ammari C. Milone R. Touroude J. Catal. 235 2005 1 9 [35] J.A. Rodríguez I.R. Ramos A.G. Ruiz A. Arcoya Appl. Catal. A Gen. 401 2011 56 64 [36] L.R. Baker G. Kennedy M.V. Spronsen A. Hervier X. Cai L.W. Wang G.A. Somorjai J. Am. Chem. Soc. 134 2012 14208 14216 [37] K. An N. Musselwhite G. Kennedy V.V. Pushkarev L.R. Baker G.A. Somorjai J. Colloid Interface Sci. 392 2013 122 128 [38] J.L. Figueiredo M.F.R. Pereira M.M.A. Freitas J.J.M. Orfao Ind. Eng. Chem. Res. 46 2007 4110 4115 [39] S. Kundu Y.M. Wang W. Xia M. Muhler J. Phys. Chem. C 112 2008 16869 16878 [40] P.D. Zgolicz J.P. Stassi M.J. Yanez O.A. Scelza S.R. Miguel J. Catal. 290 2012 37 54 [41] D.J. Suh T.J. Park S.K. Ihm Carbon 31 1993 427 435 [42] D. Tasis N. Tagmatarchis A. Bianco M. Prato Chem. Rev. 106 2006 1105 1136 [43] B. Coq J.M. Planeix V. Brotons Appl. Catal. A Gen. 173 1998 175 183 [44] P. Mierczynski K. Vasilev A. Mierczynska W. Maniukiewicz M.I. Szynkowska T.P. Maniecki Appl. Catal. B Environ. 185 2016 281 294 [45] J. Zhang J.O. Müller W.Q. Zheng D. Wang D.S. Su R. Schlögl Nano Lett. 8 2008 2738 2743 [46] H.S. Zeng K. Inazu K. Aika Appl. Catal. A Gen. 219 2001 235 247 [47] P. Mierczynski R. Ciesielski A. Kedziora M. Nowosielska J. Kubicki W. Maniukiewicz A. Czylkowska T.P. Maniecki Kinet. Mech. Catal. 117 2016 675 691 [48] S.C. Shekar J.K. Murthy P.K. Rao K.S.R. Rao J. Mol. Catal. A Chem. 191 2003 45 59 [49] J.R. Croy S. Mostafa L. Hickman H. Heinrich B.R. Cuenya Appl. Catal. A Gen. 350 2008 207 216 [50] M. Domok A. Oszko K. Baan I. Sarusi A. Erdohelyi Appl. Catal. A Gen. 383 2010 33 42 [51] P.C.J. Graat M.A.J. Somers Appl. Surf. Sci. 100–101 1996 36 40 [52] T. Ma Q. Fu Y. Cui Z. Zhang Z. Wang D. Tan X. Bao Chin. J. Catal. 31 2010 24 32 [53] Y.J. Hu P. Wu Y.J. Yin H. Zhang C.X. Cai Appl. Catal. B. Environ. 111–112 2012 208 217 [54] B. Liu L. Cheng L. Curtiss J. Greeley Surf. Sci. 622 2014 51 59 [55] F. Delbecq P. Sautet J. Catal. 152 1995 217 236 [56] P. Sautet J.F. Paul Catal. Lett. 9 1991 245 260 [57] V. Vorotnikov G. Mpourmpakis D.G. Vlachos ACS Catal. 2 2012 2496 2504",
      "scopus-id": "85032573581",
      "coredata": {
        "eid": "1-s2.0-S0926860X1730491X",
        "dc:description": "Nano-Pt and Nano-Pd particles were introduced to modified multiwalled carbon nanotubes via co-impregnation method for hydrogenation of furfural in liquid phase using ethanol as a solvent. Different transition metal (Cr, Mn, Fe, Co, Ni) was used as promoters using Pt/MWNT and Pd/MWNT catalysts and various supports were also compared to further investigate the hydrogenation process of furfural. Among the catalysts investigated, Pt–Fe/MWNT (Pt: 0.5wt%) showed highest conversion and selectivity to furfuryl alcohol (yield of 87.4%), while Pd–Ni/MWNT (Pd: 0.5wt%) catalysts exhibited the best catalytic performance (83.3% yield of tetrahydrofurfuryl alcohol) under the optimized conditions of 30bar hydrogen and 5h, at 100 and 130°C, respectively. Synergistic effect of bimetallic catalysts has been utilized to improve catalytic activity and stability. The extremely active for the selective hydrogenation of furfural over Pt–Fe/MWNT and Pd–Ni/MWNT catalyst might be attributed to active crystal planes exposed over Pt and Pd promoted by Fe and Ni. Catalysts have shown stable activity and selectivity after 5 cycles using Pt–Fe/MWNT and Pd–Ni/MWNT catalysts. Moreover, we suggest that acid sites of conventional supports might have an impact on furfural conversion.",
        "openArchiveArticle": "false",
        "prism:coverDate": "2018-01-25",
        "openaccessUserLicense": null,
        "prism:aggregationType": "Journal",
        "prism:url": "https://api.elsevier.com/content/article/pii/S0926860X1730491X",
        "dc:creator": [
          {
            "@_fa": "true",
            "$": "Liu, Lujie"
          },
          {
            "@_fa": "true",
            "$": "Lou, Hui"
          },
          {
            "@_fa": "true",
            "$": "Chen, Min"
          }
        ],
        "link": [
          {
            "@_fa": "true",
            "@rel": "self",
            "@href": "https://api.elsevier.com/content/article/pii/S0926860X1730491X"
          },
          {
            "@_fa": "true",
            "@rel": "scidir",
            "@href": "https://www.sciencedirect.com/science/article/pii/S0926860X1730491X"
          }
        ],
        "dc:format": "application/json",
        "openaccessType": null,
        "pii": "S0926-860X(17)30491-X",
        "prism:volume": "550",
        "prism:publisher": "Published by Elsevier B.V.",
        "dc:title": "Selective hydrogenation of furfural over Pt based and Pd based bimetallic catalysts supported on modified multiwalled carbon nanotubes (MWNT)",
        "prism:copyright": "© 2017 Published by Elsevier B.V.",
        "openaccess": "0",
        "prism:issn": "0926860X",
        "dcterms:subject": [
          {
            "@_fa": "true",
            "$": "Furfural hydrogenation"
          },
          {
            "@_fa": "true",
            "$": "Bimetallic catalyst"
          },
          {
            "@_fa": "true",
            "$": "Transition metal"
          },
          {
            "@_fa": "true",
            "$": "Multiwalled carbon nanotubes"
          }
        ],
        "openaccessArticle": "false",
        "prism:publicationName": "Applied Catalysis A: General",
        "openaccessSponsorType": null,
        "prism:pageRange": "1-10",
        "prism:endingPage": "10",
        "pubType": "fla",
        "prism:coverDisplayDate": "25 January 2018",
        "prism:doi": "10.1016/j.apcata.2017.10.003",
        "prism:startingPage": "1",
        "dc:identifier": "doi:10.1016/j.apcata.2017.10.003",
        "openaccessSponsorName": null
      },
      "objects": {
        "object": [
          {
            "@category": "standard",
            "@height": "193",
            "@width": "500",
            "@_fa": "true",
            "$": "https://api.elsevier.com/content/object/eid/1-s2.0-S0926860X1730491X-fx1.jpg?httpAccept=%2A%2F%2A",
            "@multimediatype": "JPEG image file",
            "@type": "IMAGE-DOWNSAMPLED",
            "@size": "46744",
            "@ref": "fx1",
            "@mimetype": "image/jpeg"
          },
          {
            "@category": "standard",
            "@height": "254",
            "@width": "357",
            "@_fa": "true",
            "$": "https://api.elsevier.com/content/object/eid/1-s2.0-S0926860X1730491X-gr1.jpg?httpAccept=%2A%2F%2A",
            "@multimediatype": "JPEG image file",
            "@type": "IMAGE-DOWNSAMPLED",
            "@size": "17625",
            "@ref": "gr1",
            "@mimetype": "image/jpeg"
          },
          {
            "@category": "standard",
            "@height": "712",
            "@width": "565",
            "@_fa": "true",
            "$": "https://api.elsevier.com/content/object/eid/1-s2.0-S0926860X1730491X-gr2.jpg?httpAccept=%2A%2F%2A",
            "@multimediatype": "JPEG image file",
            "@type": "IMAGE-DOWNSAMPLED",
            "@size": "104603",
            "@ref": "gr2",
            "@mimetype": "image/jpeg"
          },
          {
            "@category": "standard",
            "@height": "459",
            "@width": "716",
            "@_fa": "true",
            "$": "https://api.elsevier.com/content/object/eid/1-s2.0-S0926860X1730491X-gr3.jpg?httpAccept=%2A%2F%2A",
            "@multimediatype": "JPEG image file",
            "@type": "IMAGE-DOWNSAMPLED",
            "@size": "70125",
            "@ref": "gr3",
            "@mimetype": "image/jpeg"
          },
          {
            "@category": "standard",
            "@height": "276",
            "@width": "364",
            "@_fa": "true",
            "$": "https://api.elsevier.com/content/object/eid/1-s2.0-S0926860X1730491X-gr4.jpg?httpAccept=%2A%2F%2A",
            "@multimediatype": "JPEG image file",
            "@type": "IMAGE-DOWNSAMPLED",
            "@size": "25493",
            "@ref": "gr4",
            "@mimetype": "image/jpeg"
          },
          {
            "@category": "standard",
            "@height": "204",
            "@width": "499",
            "@_fa": "true",
            "$": "https://api.elsevier.com/content/object/eid/1-s2.0-S0926860X1730491X-gr5.jpg?httpAccept=%2A%2F%2A",
            "@multimediatype": "JPEG image file",
            "@type": "IMAGE-DOWNSAMPLED",
            "@size": "24457",
            "@ref": "gr5",
            "@mimetype": "image/jpeg"
          },
          {
            "@category": "standard",
            "@height": "569",
            "@width": "666",
            "@_fa": "true",
            "$": "https://api.elsevier.com/content/object/eid/1-s2.0-S0926860X1730491X-gr6.jpg?httpAccept=%2A%2F%2A",
            "@multimediatype": "JPEG image file",
            "@type": "IMAGE-DOWNSAMPLED",
            "@size": "92935",
            "@ref": "gr6",
            "@mimetype": "image/jpeg"
          },
          {
            "@category": "standard",
            "@height": "663",
            "@width": "733",
            "@_fa": "true",
            "$": "https://api.elsevier.com/content/object/eid/1-s2.0-S0926860X1730491X-gr7.jpg?httpAccept=%2A%2F%2A",
            "@multimediatype": "JPEG image file",
            "@type": "IMAGE-DOWNSAMPLED",
            "@size": "89903",
            "@ref": "gr7",
            "@mimetype": "image/jpeg"
          },
          {
            "@category": "standard",
            "@height": "583",
            "@width": "715",
            "@_fa": "true",
            "$": "https://api.elsevier.com/content/object/eid/1-s2.0-S0926860X1730491X-gr8.jpg?httpAccept=%2A%2F%2A",
            "@multimediatype": "JPEG image file",
            "@type": "IMAGE-DOWNSAMPLED",
            "@size": "151246",
            "@ref": "gr8",
            "@mimetype": "image/jpeg"
          },
          {
            "@category": "standard",
            "@height": "523",
            "@width": "619",
            "@_fa": "true",
            "$": "https://api.elsevier.com/content/object/eid/1-s2.0-S0926860X1730491X-gr9.jpg?httpAccept=%2A%2F%2A",
            "@multimediatype": "JPEG image file",
            "@type": "IMAGE-DOWNSAMPLED",
            "@size": "103322",
            "@ref": "gr9",
            "@mimetype": "image/jpeg"
          },
          {
            "@category": "thumbnail",
            "@height": "85",
            "@width": "219",
            "@_fa": "true",
            "$": "https://api.elsevier.com/content/object/eid/1-s2.0-S0926860X1730491X-fx1.sml?httpAccept=%2A%2F%2A",
            "@multimediatype": "GIF image file",
            "@type": "IMAGE-THUMBNAIL",
            "@size": "13280",
            "@ref": "fx1",
            "@mimetype": "image/gif"
          },
          {
            "@category": "thumbnail",
            "@height": "156",
            "@width": "219",
            "@_fa": "true",
            "$": "https://api.elsevier.com/content/object/eid/1-s2.0-S0926860X1730491X-gr1.sml?httpAccept=%2A%2F%2A",
            "@multimediatype": "GIF image file",
            "@type": "IMAGE-THUMBNAIL",
            "@size": "5000",
            "@ref": "gr1",
            "@mimetype": "image/gif"
          },
          {
            "@category": "thumbnail",
            "@height": "164",
            "@width": "130",
            "@_fa": "true",
            "$": "https://api.elsevier.com/content/object/eid/1-s2.0-S0926860X1730491X-gr2.sml?httpAccept=%2A%2F%2A",
            "@multimediatype": "GIF image file",
            "@type": "IMAGE-THUMBNAIL",
            "@size": "9367",
            "@ref": "gr2",
            "@mimetype": "image/gif"
          },
          {
            "@category": "thumbnail",
            "@height": "140",
            "@width": "219",
            "@_fa": "true",
            "$": "https://api.elsevier.com/content/object/eid/1-s2.0-S0926860X1730491X-gr3.sml?httpAccept=%2A%2F%2A",
            "@multimediatype": "GIF image file",
            "@type": "IMAGE-THUMBNAIL",
            "@size": "6031",
            "@ref": "gr3",
            "@mimetype": "image/gif"
          },
          {
            "@category": "thumbnail",
            "@height": "164",
            "@width": "216",
            "@_fa": "true",
            "$": "https://api.elsevier.com/content/object/eid/1-s2.0-S0926860X1730491X-gr4.sml?httpAccept=%2A%2F%2A",
            "@multimediatype": "GIF image file",
            "@type": "IMAGE-THUMBNAIL",
            "@size": "6458",
            "@ref": "gr4",
            "@mimetype": "image/gif"
          },
          {
            "@category": "thumbnail",
            "@height": "90",
            "@width": "219",
            "@_fa": "true",
            "$": "https://api.elsevier.com/content/object/eid/1-s2.0-S0926860X1730491X-gr5.sml?httpAccept=%2A%2F%2A",
            "@multimediatype": "GIF image file",
            "@type": "IMAGE-THUMBNAIL",
            "@size": "3969",
            "@ref": "gr5",
            "@mimetype": "image/gif"
          },
          {
            "@category": "thumbnail",
            "@height": "164",
            "@width": "192",
            "@_fa": "true",
            "$": "https://api.elsevier.com/content/object/eid/1-s2.0-S0926860X1730491X-gr6.sml?httpAccept=%2A%2F%2A",
            "@multimediatype": "GIF image file",
            "@type": "IMAGE-THUMBNAIL",
            "@size": "11127",
            "@ref": "gr6",
            "@mimetype": "image/gif"
          },
          {
            "@category": "thumbnail",
            "@height": "164",
            "@width": "181",
            "@_fa": "true",
            "$": "https://api.elsevier.com/content/object/eid/1-s2.0-S0926860X1730491X-gr7.sml?httpAccept=%2A%2F%2A",
            "@multimediatype": "GIF image file",
            "@type": "IMAGE-THUMBNAIL",
            "@size": "8375",
            "@ref": "gr7",
            "@mimetype": "image/gif"
          },
          {
            "@category": "thumbnail",
            "@height": "164",
            "@width": "201",
            "@_fa": "true",
            "$": "https://api.elsevier.com/content/object/eid/1-s2.0-S0926860X1730491X-gr8.sml?httpAccept=%2A%2F%2A",
            "@multimediatype": "GIF image file",
            "@type": "IMAGE-THUMBNAIL",
            "@size": "21462",
            "@ref": "gr8",
            "@mimetype": "image/gif"
          },
          {
            "@category": "thumbnail",
            "@height": "164",
            "@width": "194",
            "@_fa": "true",
            "$": "https://api.elsevier.com/content/object/eid/1-s2.0-S0926860X1730491X-gr9.sml?httpAccept=%2A%2F%2A",
            "@multimediatype": "GIF image file",
            "@type": "IMAGE-THUMBNAIL",
            "@size": "11376",
            "@ref": "gr9",
            "@mimetype": "image/gif"
          },
          {
            "@category": "high",
            "@height": "856",
            "@width": "2213",
            "@_fa": "true",
            "$": "https://api.elsevier.com/content/object/eid/1-s2.0-S0926860X1730491X-fx1_lrg.jpg?httpAccept=%2A%2F%2A",
            "@multimediatype": "JPEG image file",
            "@type": "IMAGE-HIGH-RES",
            "@size": "394792",
            "@ref": "fx1",
            "@mimetype": "image/jpeg"
          },
          {
            "@category": "high",
            "@height": "1124",
            "@width": "1582",
            "@_fa": "true",
            "$": "https://api.elsevier.com/content/object/eid/1-s2.0-S0926860X1730491X-gr1_lrg.jpg?httpAccept=%2A%2F%2A",
            "@multimediatype": "JPEG image file",
            "@type": "IMAGE-HIGH-RES",
            "@size": "135233",
            "@ref": "gr1",
            "@mimetype": "image/jpeg"
          },
          {
            "@category": "high",
            "@height": "3154",
            "@width": "2502",
            "@_fa": "true",
            "$": "https://api.elsevier.com/content/object/eid/1-s2.0-S0926860X1730491X-gr2_lrg.jpg?httpAccept=%2A%2F%2A",
            "@multimediatype": "JPEG image file",
            "@type": "IMAGE-HIGH-RES",
            "@size": "733773",
            "@ref": "gr2",
            "@mimetype": "image/jpeg"
          },
          {
            "@category": "high",
            "@height": "2031",
            "@width": "3169",
            "@_fa": "true",
            "$": "https://api.elsevier.com/content/object/eid/1-s2.0-S0926860X1730491X-gr3_lrg.jpg?httpAccept=%2A%2F%2A",
            "@multimediatype": "JPEG image file",
            "@type": "IMAGE-HIGH-RES",
            "@size": "504920",
            "@ref": "gr3",
            "@mimetype": "image/jpeg"
          },
          {
            "@category": "high",
            "@height": "1224",
            "@width": "1613",
            "@_fa": "true",
            "$": "https://api.elsevier.com/content/object/eid/1-s2.0-S0926860X1730491X-gr4_lrg.jpg?httpAccept=%2A%2F%2A",
            "@multimediatype": "JPEG image file",
            "@type": "IMAGE-HIGH-RES",
            "@size": "165943",
            "@ref": "gr4",
            "@mimetype": "image/jpeg"
          },
          {
            "@category": "high",
            "@height": "906",
            "@width": "2212",
            "@_fa": "true",
            "$": "https://api.elsevier.com/content/object/eid/1-s2.0-S0926860X1730491X-gr5_lrg.jpg?httpAccept=%2A%2F%2A",
            "@multimediatype": "JPEG image file",
            "@type": "IMAGE-HIGH-RES",
            "@size": "187729",
            "@ref": "gr5",
            "@mimetype": "image/jpeg"
          },
          {
            "@category": "high",
            "@height": "2519",
            "@width": "2948",
            "@_fa": "true",
            "$": "https://api.elsevier.com/content/object/eid/1-s2.0-S0926860X1730491X-gr6_lrg.jpg?httpAccept=%2A%2F%2A",
            "@multimediatype": "JPEG image file",
            "@type": "IMAGE-HIGH-RES",
            "@size": "895204",
            "@ref": "gr6",
            "@mimetype": "image/jpeg"
          },
          {
            "@category": "high",
            "@height": "2935",
            "@width": "3247",
            "@_fa": "true",
            "$": "https://api.elsevier.com/content/object/eid/1-s2.0-S0926860X1730491X-gr7_lrg.jpg?httpAccept=%2A%2F%2A",
            "@multimediatype": "JPEG image file",
            "@type": "IMAGE-HIGH-RES",
            "@size": "1228106",
            "@ref": "gr7",
            "@mimetype": "image/jpeg"
          },
          {
            "@category": "high",
            "@height": "2581",
            "@width": "3167",
            "@_fa": "true",
            "$": "https://api.elsevier.com/content/object/eid/1-s2.0-S0926860X1730491X-gr8_lrg.jpg?httpAccept=%2A%2F%2A",
            "@multimediatype": "JPEG image file",
            "@type": "IMAGE-HIGH-RES",
            "@size": "1837579",
            "@ref": "gr8",
            "@mimetype": "image/jpeg"
          },
          {
            "@category": "high",
            "@height": "2318",
            "@width": "2743",
            "@_fa": "true",
            "$": "https://api.elsevier.com/content/object/eid/1-s2.0-S0926860X1730491X-gr9_lrg.jpg?httpAccept=%2A%2F%2A",
            "@multimediatype": "JPEG image file",
            "@type": "IMAGE-HIGH-RES",
            "@size": "1592679",
            "@ref": "gr9",
            "@mimetype": "image/jpeg"
          },
          {
            "@category": "standard",
            "@_fa": "true",
            "$": "https://api.elsevier.com/content/object/eid/1-s2.0-S0926860X1730491X-mmc1.doc?httpAccept=%2A%2F%2A",
            "@multimediatype": "Microsoft Word file",
            "@type": "APPLICATION",
            "@size": "22540288",
            "@ref": "mmc1",
            "@mimetype": "application/word"
          },
          {
            "@category": "thumbnail",
            "@height": "66",
            "@width": "501",
            "@_fa": "true",
            "$": "https://api.elsevier.com/content/object/eid/1-s2.0-S0926860X1730491X-si1.gif?httpAccept=%2A%2F%2A",
            "@multimediatype": "GIF image file",
            "@type": "ALTIMG",
            "@size": "5441",
            "@ref": "si1",
            "@mimetype": "image/gif"
          },
          {
            "@category": "thumbnail",
            "@height": "66",
            "@width": "428",
            "@_fa": "true",
            "$": "https://api.elsevier.com/content/object/eid/1-s2.0-S0926860X1730491X-si2.gif?httpAccept=%2A%2F%2A",
            "@multimediatype": "GIF image file",
            "@type": "ALTIMG",
            "@size": "5248",
            "@ref": "si2",
            "@mimetype": "image/gif"
          }
        ]
      },
      "link": {
        "@rel": "abstract",
        "@href": "https://api.elsevier.com/content/abstract/scopus_id/85032573581"
      }
    }
  }
}