{
  "metadata": {
    "title": "Effect of chemical composition of Sr<ce:inf loc=post><ce:italic>x</ce:italic></ce:inf>Ca<ce:inf loc=post>1<ce:hsp sp=0.25></ce:hsp>−<ce:hsp sp=0.25></ce:hsp><ce:italic>x</ce:italic></ce:inf>Fe<ce:inf loc=post>2</ce:inf>O<ce:inf loc=post>4</ce:inf> (0.0<ce:hsp sp=0.25></ce:hsp>≤<ce:hsp sp=0.25></ce:hsp><ce:italic>x</ce:italic><ce:hsp sp=0.25></ce:hsp>≤<ce:hsp sp=0.25></ce:hsp>1.0) catalyst and alkali towards efficient and selective epoxidation of styrene",
    "authors": "; ; ",
    "journal": "Applied Catalysis A: General",
    "date": "2014-05-20",
    "doi": "10.1016/j.apcata.2014.03.040",
    "abstract": "",
    "uri": "https://api.elsevier.com/content/article/pii/S0926860X14001938",
    "pii": "S0926860X14001938"
  },
  "fulltext": {
    "full-text-retrieval-response": {
      "scopus-eid": "2-s2.0-84898773708",
      "originalText": "serial JL 271346 291210 291744 291809 31 Applied Catalysis A: General APPLIEDCATALYSISAGENERAL 2014-04-06 2014-04-06 2014-05-10T01:08:23 1-s2.0-S0926860X14001938 S0926-860X(14)00193-8 S0926860X14001938 10.1016/j.apcata.2014.03.040 S300 S300.1 FULL-TEXT 1-s2.0-S0926860X14X00074 2024-01-01T12:29:14.622205Z 0 0 20140520 2014 2014-04-06T00:00:00Z articleinfo crossmark dco dateupdated tomb dateloaded datesearch indexeddate volumelist yearnav absattachment articletitlenorm authfirstinitialnorm authfirstsurnamenorm cid cids contenttype copyright dateloadedtxt docsubtype doctype doi eid ewtransactionid hubeid issn issnnorm itemstage itemtransactionid itemweight openaccess openarchive pg pgfirst pglast pii piinorm pubdatestart pubdatetxt pubyr sectiontitle sortorder srctitle srctitlenorm srctype subheadings suppl volfirst volissue webpdf webpdfpagecount figure body affil articletitle auth authfirstini authfull authkeywords authlast highlightsabst primabst ref specialabst alllist content subj ssids 0926-860X 0926860X true 478 478 C Volume 478 18 129 137 129 137 20140520 20 May 2014 2014-05-20 2014 Articles article fla Copyright © 2014 Elsevier B.V. All rights reserved. EFFECTCHEMICALCOMPOSITIONSRXCA1XFE2O400X10CATALYSTALKALITOWARDSEFFICIENTSELECTIVEEPOXIDATIONSTYRENE PAWAR R 1 Introduction 2 Experimental 2.1 Synthesis of catalyst by citrate gel combustion method 2.2 Characterization of catalysts 2.3 Catalytic activities of strontium substituted calcium ferrites 2.3.1 Selective epoxidation of styrene 2.4 Results and discussion 2.4.1 Characterization of strontium substituted calcium ferrites 2.4.1.1 Thermo gravimetric analysis 2.4.1.2 FTIR study of strontium substituted calcium ferrites 2.4.1.3 X-ray diffraction analysis of strontium substituted calcium ferrites 2.4.1.4 Electron dispersive spectra and morphology of strontium substituted calcium ferrites 2.4.1.5 Specific surface area (BET) analysis 2.4.2 Catalytic activity of catalysts 2.4.2.1 Effect of chemical composition of catalysts 2.4.2.2 Role of NaOH 2.4.2.3 Effect of solvent on epoxidation 2.4.2.4 Optimization of other reaction conditions 2.4.2.4.1 Effect of time 2.4.2.4.2 Effect of temperature on epoxidation 2.4.2.4.3 Effect of catalyst amount on epoxidation 2.4.2.4.4 Effect of substrate/H2O2 molar ratio 3 Conclusions References LICHT 1999 1039 1042 S SHARMA 1997 2486 2491 V SANKARANARAYANAN 2002 7 9 V MA 2003 39 47 N PARDESHI 2010 609 615 S PARDESHI 2011 35 43 S BARATI 2009 171 178 M 1990 FERRITESSCIENCETECHNOLOGY HOSHINI 1970 Y INTERNATIONALCONFERENCEFERRITE MENDONCA 2002 175 182 M COSTA 2003 525 529 R SELIM 1999 173 181 M 2006 AZIRIDINEEPOXIDESINORGANICSYNTHESIS YANG 2000 221 226 Q KUMAR 1995 163 166 S LAHA 2001 64 70 S ZHANG 1996 9164 9171 W GRIEKEN 2000 49 54 V YANG 2000 194 195 Q FU 1999 351 359 J MANDELLI 2001 209 213 D SIENEL 1999 G ULLMANNSENCYCLOPEDIAORGANICCHEMICALS SHELDON 1993 R TOPICSINCURRENTCHEMISTRYHOMOGENEOUSHETEROGENEOUSCATALYTICOXIDATIONSPEROXIDE GRIGOROPOULOU 2003 1 7 G DEVOS 2003 457 473 D DEVOS 2001 1 87 D SREEKUMAR 2001 11 18 K BERTHET 1992 919 924 P XIA 2005 1603 1662 Q BHATTACHARJEE 2006 103 110 S SAMANTARAY 2005 578 581 S LIANG 2004 665 669 J RODE 2003 365 369 C YU 1992 3245 3249 Z SHREEKUMAR 2000 327 334 K ZHAN 2007 12103 12110 W YIN 2005 40 48 D PAWARX2014X129 PAWARX2014X129X137 PAWARX2014X129XR PAWARX2014X129X137XR item S0926-860X(14)00193-8 S0926860X14001938 1-s2.0-S0926860X14001938 10.1016/j.apcata.2014.03.040 271346 2024-01-01T12:29:14.622205Z 2014-05-20 1-s2.0-S0926860X14001938-main.pdf https://s3.amazonaws.com/prod-ucs-content-store-us-east/content/pii:S0926860X14001938/MAIN/application/pdf/f777fe38a56296f1f5eaf04f9b6b3ea7/main.pdf https://s3-eu-west-1.amazonaws.com/prod-ucs-content-store-eu-west/content/pii:S0926860X14001938/MAIN/application/pdf/f777fe38a56296f1f5eaf04f9b6b3ea7/main.pdf main.pdf pdf true 2679377 MAIN 9 1-s2.0-S0926860X14001938-main_1.png https://s3.amazonaws.com/prod-ucs-content-store-us-east/content/pii:S0926860X14001938/PREVIEW/image/png/ea12eb48771ecbe5aabf4207838fe92f/main_1.png https://s3-eu-west-1.amazonaws.com/prod-ucs-content-store-eu-west/content/pii:S0926860X14001938/PREVIEW/image/png/ea12eb48771ecbe5aabf4207838fe92f/main_1.png main_1.png png 58208 849 656 IMAGE-WEB-PDF 1 1-s2.0-S0926860X14001938-gr9_lrg.jpg https://s3.amazonaws.com/prod-ucs-content-store-us-east/content/pii:S0926860X14001938/gr9/HIGHRES/image/jpeg/630d2f752bcab8a1845e58c84f8204aa/gr9_lrg.jpg https://s3-eu-west-1.amazonaws.com/prod-ucs-content-store-eu-west/content/pii:S0926860X14001938/gr9/HIGHRES/image/jpeg/630d2f752bcab8a1845e58c84f8204aa/gr9_lrg.jpg gr9 gr9_lrg.jpg jpg 441995 1501 1742 IMAGE-HIGH-RES 1-s2.0-S0926860X14001938-gr8_lrg.jpg https://s3.amazonaws.com/prod-ucs-content-store-us-east/content/pii:S0926860X14001938/gr8/HIGHRES/image/jpeg/ad5b6c3588de26e118ee51a97265e470/gr8_lrg.jpg https://s3-eu-west-1.amazonaws.com/prod-ucs-content-store-eu-west/content/pii:S0926860X14001938/gr8/HIGHRES/image/jpeg/ad5b6c3588de26e118ee51a97265e470/gr8_lrg.jpg gr8 gr8_lrg.jpg jpg 408120 1484 1742 IMAGE-HIGH-RES 1-s2.0-S0926860X14001938-gr7_lrg.jpg https://s3.amazonaws.com/prod-ucs-content-store-us-east/content/pii:S0926860X14001938/gr7/HIGHRES/image/jpeg/01b3a4b93443aa2bf76c41bcfc289c23/gr7_lrg.jpg https://s3-eu-west-1.amazonaws.com/prod-ucs-content-store-eu-west/content/pii:S0926860X14001938/gr7/HIGHRES/image/jpeg/01b3a4b93443aa2bf76c41bcfc289c23/gr7_lrg.jpg gr7 gr7_lrg.jpg jpg 397208 1425 1742 IMAGE-HIGH-RES 1-s2.0-S0926860X14001938-gr6_lrg.jpg https://s3.amazonaws.com/prod-ucs-content-store-us-east/content/pii:S0926860X14001938/gr6/HIGHRES/image/jpeg/78a3067aae968c7e15863c5678948ec7/gr6_lrg.jpg https://s3-eu-west-1.amazonaws.com/prod-ucs-content-store-eu-west/content/pii:S0926860X14001938/gr6/HIGHRES/image/jpeg/78a3067aae968c7e15863c5678948ec7/gr6_lrg.jpg gr6 gr6_lrg.jpg jpg 394068 1361 1749 IMAGE-HIGH-RES 1-s2.0-S0926860X14001938-gr5_lrg.jpg https://s3.amazonaws.com/prod-ucs-content-store-us-east/content/pii:S0926860X14001938/gr5/HIGHRES/image/jpeg/93655a947636270305dde0eca78ac83b/gr5_lrg.jpg https://s3-eu-west-1.amazonaws.com/prod-ucs-content-store-eu-west/content/pii:S0926860X14001938/gr5/HIGHRES/image/jpeg/93655a947636270305dde0eca78ac83b/gr5_lrg.jpg gr5 gr5_lrg.jpg jpg 397861 1479 1742 IMAGE-HIGH-RES 1-s2.0-S0926860X14001938-gr4_lrg.jpg https://s3.amazonaws.com/prod-ucs-content-store-us-east/content/pii:S0926860X14001938/gr4/HIGHRES/image/jpeg/133ff3380fe8fee829bddf3bf791397c/gr4_lrg.jpg https://s3-eu-west-1.amazonaws.com/prod-ucs-content-store-eu-west/content/pii:S0926860X14001938/gr4/HIGHRES/image/jpeg/133ff3380fe8fee829bddf3bf791397c/gr4_lrg.jpg gr4 gr4_lrg.jpg jpg 459812 1794 1500 IMAGE-HIGH-RES 1-s2.0-S0926860X14001938-gr3_lrg.jpg https://s3.amazonaws.com/prod-ucs-content-store-us-east/content/pii:S0926860X14001938/gr3/HIGHRES/image/jpeg/4f36f5f4f00a7d84c391ca181bf82418/gr3_lrg.jpg https://s3-eu-west-1.amazonaws.com/prod-ucs-content-store-eu-west/content/pii:S0926860X14001938/gr3/HIGHRES/image/jpeg/4f36f5f4f00a7d84c391ca181bf82418/gr3_lrg.jpg gr3 gr3_lrg.jpg jpg 355593 1406 1727 IMAGE-HIGH-RES 1-s2.0-S0926860X14001938-gr2_lrg.jpg https://s3.amazonaws.com/prod-ucs-content-store-us-east/content/pii:S0926860X14001938/gr2/HIGHRES/image/jpeg/7cc685e34b3920f298ae7a19c05f3728/gr2_lrg.jpg https://s3-eu-west-1.amazonaws.com/prod-ucs-content-store-eu-west/content/pii:S0926860X14001938/gr2/HIGHRES/image/jpeg/7cc685e34b3920f298ae7a19c05f3728/gr2_lrg.jpg gr2 gr2_lrg.jpg jpg 210806 1393 1742 IMAGE-HIGH-RES 1-s2.0-S0926860X14001938-gr11_lrg.jpg https://s3.amazonaws.com/prod-ucs-content-store-us-east/content/pii:S0926860X14001938/gr11/HIGHRES/image/jpeg/3af08cf01444e9ad83337e1fb9d95b63/gr11_lrg.jpg https://s3-eu-west-1.amazonaws.com/prod-ucs-content-store-eu-west/content/pii:S0926860X14001938/gr11/HIGHRES/image/jpeg/3af08cf01444e9ad83337e1fb9d95b63/gr11_lrg.jpg gr11 gr11_lrg.jpg jpg 416296 1483 1749 IMAGE-HIGH-RES 1-s2.0-S0926860X14001938-gr10_lrg.jpg https://s3.amazonaws.com/prod-ucs-content-store-us-east/content/pii:S0926860X14001938/gr10/HIGHRES/image/jpeg/7351b487c6c49d2b1332cec8353d9093/gr10_lrg.jpg https://s3-eu-west-1.amazonaws.com/prod-ucs-content-store-eu-west/content/pii:S0926860X14001938/gr10/HIGHRES/image/jpeg/7351b487c6c49d2b1332cec8353d9093/gr10_lrg.jpg gr10 gr10_lrg.jpg jpg 335951 1373 1749 IMAGE-HIGH-RES 1-s2.0-S0926860X14001938-gr1_lrg.jpg https://s3.amazonaws.com/prod-ucs-content-store-us-east/content/pii:S0926860X14001938/gr1/HIGHRES/image/jpeg/ccd1b61b4482d28c1a8df3db804f2c36/gr1_lrg.jpg https://s3-eu-west-1.amazonaws.com/prod-ucs-content-store-eu-west/content/pii:S0926860X14001938/gr1/HIGHRES/image/jpeg/ccd1b61b4482d28c1a8df3db804f2c36/gr1_lrg.jpg gr1 gr1_lrg.jpg jpg 768145 2946 2910 IMAGE-HIGH-RES 1-s2.0-S0926860X14001938-fx1_lrg.jpg https://s3.amazonaws.com/prod-ucs-content-store-us-east/content/pii:S0926860X14001938/fx1/HIGHRES/image/jpeg/3b2cfa093973248738e1839b1bc82949/fx1_lrg.jpg https://s3-eu-west-1.amazonaws.com/prod-ucs-content-store-eu-west/content/pii:S0926860X14001938/fx1/HIGHRES/image/jpeg/3b2cfa093973248738e1839b1bc82949/fx1_lrg.jpg fx1 true fx1_lrg.jpg jpg 85956 420 2213 IMAGE-HIGH-RES 1-s2.0-S0926860X14001938-gr9.jpg https://s3.amazonaws.com/prod-ucs-content-store-us-east/content/pii:S0926860X14001938/gr9/DOWNSAMPLED/image/jpeg/9e8c85226063a19943eef7850e1a9945/gr9.jpg https://s3-eu-west-1.amazonaws.com/prod-ucs-content-store-eu-west/content/pii:S0926860X14001938/gr9/DOWNSAMPLED/image/jpeg/9e8c85226063a19943eef7850e1a9945/gr9.jpg gr9 gr9.jpg jpg 34489 339 393 IMAGE-DOWNSAMPLED 1-s2.0-S0926860X14001938-gr8.jpg https://s3.amazonaws.com/prod-ucs-content-store-us-east/content/pii:S0926860X14001938/gr8/DOWNSAMPLED/image/jpeg/4642176382a143eba919eb400d6c75e0/gr8.jpg https://s3-eu-west-1.amazonaws.com/prod-ucs-content-store-eu-west/content/pii:S0926860X14001938/gr8/DOWNSAMPLED/image/jpeg/4642176382a143eba919eb400d6c75e0/gr8.jpg gr8 gr8.jpg jpg 32802 335 393 IMAGE-DOWNSAMPLED 1-s2.0-S0926860X14001938-gr7.jpg https://s3.amazonaws.com/prod-ucs-content-store-us-east/content/pii:S0926860X14001938/gr7/DOWNSAMPLED/image/jpeg/fa9081cf695bb2efb2f5517c2ea82688/gr7.jpg https://s3-eu-west-1.amazonaws.com/prod-ucs-content-store-eu-west/content/pii:S0926860X14001938/gr7/DOWNSAMPLED/image/jpeg/fa9081cf695bb2efb2f5517c2ea82688/gr7.jpg gr7 gr7.jpg jpg 33354 321 393 IMAGE-DOWNSAMPLED 1-s2.0-S0926860X14001938-gr6.jpg https://s3.amazonaws.com/prod-ucs-content-store-us-east/content/pii:S0926860X14001938/gr6/DOWNSAMPLED/image/jpeg/18cd7d034a22486715a4b144c084fcd9/gr6.jpg https://s3-eu-west-1.amazonaws.com/prod-ucs-content-store-eu-west/content/pii:S0926860X14001938/gr6/DOWNSAMPLED/image/jpeg/18cd7d034a22486715a4b144c084fcd9/gr6.jpg gr6 gr6.jpg jpg 31004 307 395 IMAGE-DOWNSAMPLED 1-s2.0-S0926860X14001938-gr5.jpg https://s3.amazonaws.com/prod-ucs-content-store-us-east/content/pii:S0926860X14001938/gr5/DOWNSAMPLED/image/jpeg/78c4555223e86372331b0b547ebee72b/gr5.jpg https://s3-eu-west-1.amazonaws.com/prod-ucs-content-store-eu-west/content/pii:S0926860X14001938/gr5/DOWNSAMPLED/image/jpeg/78c4555223e86372331b0b547ebee72b/gr5.jpg gr5 gr5.jpg jpg 33864 334 393 IMAGE-DOWNSAMPLED 1-s2.0-S0926860X14001938-gr4.jpg https://s3.amazonaws.com/prod-ucs-content-store-us-east/content/pii:S0926860X14001938/gr4/DOWNSAMPLED/image/jpeg/da6cedec4401d4fc6db1aa85415d7edd/gr4.jpg https://s3-eu-west-1.amazonaws.com/prod-ucs-content-store-eu-west/content/pii:S0926860X14001938/gr4/DOWNSAMPLED/image/jpeg/da6cedec4401d4fc6db1aa85415d7edd/gr4.jpg gr4 gr4.jpg jpg 93063 676 565 IMAGE-DOWNSAMPLED 1-s2.0-S0926860X14001938-gr3.jpg https://s3.amazonaws.com/prod-ucs-content-store-us-east/content/pii:S0926860X14001938/gr3/DOWNSAMPLED/image/jpeg/04dc737ad52d97415202c9ba5599d0d4/gr3.jpg https://s3-eu-west-1.amazonaws.com/prod-ucs-content-store-eu-west/content/pii:S0926860X14001938/gr3/DOWNSAMPLED/image/jpeg/04dc737ad52d97415202c9ba5599d0d4/gr3.jpg gr3 gr3.jpg jpg 37576 318 390 IMAGE-DOWNSAMPLED 1-s2.0-S0926860X14001938-gr2.jpg https://s3.amazonaws.com/prod-ucs-content-store-us-east/content/pii:S0926860X14001938/gr2/DOWNSAMPLED/image/jpeg/9fdd83774ba26cf7c2e64f13ed4f5873/gr2.jpg https://s3-eu-west-1.amazonaws.com/prod-ucs-content-store-eu-west/content/pii:S0926860X14001938/gr2/DOWNSAMPLED/image/jpeg/9fdd83774ba26cf7c2e64f13ed4f5873/gr2.jpg gr2 gr2.jpg jpg 26146 314 393 IMAGE-DOWNSAMPLED 1-s2.0-S0926860X14001938-gr11.jpg https://s3.amazonaws.com/prod-ucs-content-store-us-east/content/pii:S0926860X14001938/gr11/DOWNSAMPLED/image/jpeg/573c9ae097611f96ad7ede951737c78f/gr11.jpg https://s3-eu-west-1.amazonaws.com/prod-ucs-content-store-eu-west/content/pii:S0926860X14001938/gr11/DOWNSAMPLED/image/jpeg/573c9ae097611f96ad7ede951737c78f/gr11.jpg gr11 gr11.jpg jpg 35992 335 395 IMAGE-DOWNSAMPLED 1-s2.0-S0926860X14001938-gr10.jpg https://s3.amazonaws.com/prod-ucs-content-store-us-east/content/pii:S0926860X14001938/gr10/DOWNSAMPLED/image/jpeg/b1051a2cb76bc4091fa0589c51b602a3/gr10.jpg https://s3-eu-west-1.amazonaws.com/prod-ucs-content-store-eu-west/content/pii:S0926860X14001938/gr10/DOWNSAMPLED/image/jpeg/b1051a2cb76bc4091fa0589c51b602a3/gr10.jpg gr10 gr10.jpg jpg 29044 310 395 IMAGE-DOWNSAMPLED 1-s2.0-S0926860X14001938-gr1.jpg https://s3.amazonaws.com/prod-ucs-content-store-us-east/content/pii:S0926860X14001938/gr1/DOWNSAMPLED/image/jpeg/1af6e6b0dc159c474d5c1328cdfe3125/gr1.jpg https://s3-eu-west-1.amazonaws.com/prod-ucs-content-store-eu-west/content/pii:S0926860X14001938/gr1/DOWNSAMPLED/image/jpeg/1af6e6b0dc159c474d5c1328cdfe3125/gr1.jpg gr1 gr1.jpg jpg 109551 665 657 IMAGE-DOWNSAMPLED 1-s2.0-S0926860X14001938-fx1.jpg https://s3.amazonaws.com/prod-ucs-content-store-us-east/content/pii:S0926860X14001938/fx1/DOWNSAMPLED/image/jpeg/e5df5cd1c5776c453211e840f832244e/fx1.jpg https://s3-eu-west-1.amazonaws.com/prod-ucs-content-store-eu-west/content/pii:S0926860X14001938/fx1/DOWNSAMPLED/image/jpeg/e5df5cd1c5776c453211e840f832244e/fx1.jpg fx1 true fx1.jpg jpg 11364 95 500 IMAGE-DOWNSAMPLED 1-s2.0-S0926860X14001938-gr9.sml https://s3.amazonaws.com/prod-ucs-content-store-us-east/content/pii:S0926860X14001938/gr9/THUMBNAIL/image/gif/f902c6c8b121bfcd7bfdafbeb47e1465/gr9.sml https://s3-eu-west-1.amazonaws.com/prod-ucs-content-store-eu-west/content/pii:S0926860X14001938/gr9/THUMBNAIL/image/gif/f902c6c8b121bfcd7bfdafbeb47e1465/gr9.sml gr9 gr9.sml sml 7522 164 190 IMAGE-THUMBNAIL 1-s2.0-S0926860X14001938-gr8.sml https://s3.amazonaws.com/prod-ucs-content-store-us-east/content/pii:S0926860X14001938/gr8/THUMBNAIL/image/gif/3307146c3bb7558aa276f88b4850cea6/gr8.sml https://s3-eu-west-1.amazonaws.com/prod-ucs-content-store-eu-west/content/pii:S0926860X14001938/gr8/THUMBNAIL/image/gif/3307146c3bb7558aa276f88b4850cea6/gr8.sml gr8 gr8.sml sml 7165 164 192 IMAGE-THUMBNAIL 1-s2.0-S0926860X14001938-gr7.sml https://s3.amazonaws.com/prod-ucs-content-store-us-east/content/pii:S0926860X14001938/gr7/THUMBNAIL/image/gif/6ec7e62e8e540672d45ead58b8f27ce3/gr7.sml https://s3-eu-west-1.amazonaws.com/prod-ucs-content-store-eu-west/content/pii:S0926860X14001938/gr7/THUMBNAIL/image/gif/6ec7e62e8e540672d45ead58b8f27ce3/gr7.sml gr7 gr7.sml sml 7510 164 200 IMAGE-THUMBNAIL 1-s2.0-S0926860X14001938-gr6.sml https://s3.amazonaws.com/prod-ucs-content-store-us-east/content/pii:S0926860X14001938/gr6/THUMBNAIL/image/gif/5226e946332095bd641f599e17c29e64/gr6.sml https://s3-eu-west-1.amazonaws.com/prod-ucs-content-store-eu-west/content/pii:S0926860X14001938/gr6/THUMBNAIL/image/gif/5226e946332095bd641f599e17c29e64/gr6.sml gr6 gr6.sml sml 7866 164 211 IMAGE-THUMBNAIL 1-s2.0-S0926860X14001938-gr5.sml https://s3.amazonaws.com/prod-ucs-content-store-us-east/content/pii:S0926860X14001938/gr5/THUMBNAIL/image/gif/a7dd4283b80b45e43279da2e5abe96cb/gr5.sml https://s3-eu-west-1.amazonaws.com/prod-ucs-content-store-eu-west/content/pii:S0926860X14001938/gr5/THUMBNAIL/image/gif/a7dd4283b80b45e43279da2e5abe96cb/gr5.sml gr5 gr5.sml sml 7667 164 193 IMAGE-THUMBNAIL 1-s2.0-S0926860X14001938-gr4.sml https://s3.amazonaws.com/prod-ucs-content-store-us-east/content/pii:S0926860X14001938/gr4/THUMBNAIL/image/gif/44e9484ced08cd6b6f19d72b29361ef2/gr4.sml https://s3-eu-west-1.amazonaws.com/prod-ucs-content-store-eu-west/content/pii:S0926860X14001938/gr4/THUMBNAIL/image/gif/44e9484ced08cd6b6f19d72b29361ef2/gr4.sml gr4 gr4.sml sml 11244 164 137 IMAGE-THUMBNAIL 1-s2.0-S0926860X14001938-gr3.sml https://s3.amazonaws.com/prod-ucs-content-store-us-east/content/pii:S0926860X14001938/gr3/THUMBNAIL/image/gif/74ae4c75ad6d0cddae9affd5d4309b29/gr3.sml https://s3-eu-west-1.amazonaws.com/prod-ucs-content-store-eu-west/content/pii:S0926860X14001938/gr3/THUMBNAIL/image/gif/74ae4c75ad6d0cddae9affd5d4309b29/gr3.sml gr3 gr3.sml sml 6721 164 201 IMAGE-THUMBNAIL 1-s2.0-S0926860X14001938-gr2.sml https://s3.amazonaws.com/prod-ucs-content-store-us-east/content/pii:S0926860X14001938/gr2/THUMBNAIL/image/gif/f94567f36f985863a98fdbd1195fc873/gr2.sml https://s3-eu-west-1.amazonaws.com/prod-ucs-content-store-eu-west/content/pii:S0926860X14001938/gr2/THUMBNAIL/image/gif/f94567f36f985863a98fdbd1195fc873/gr2.sml gr2 gr2.sml sml 4471 164 205 IMAGE-THUMBNAIL 1-s2.0-S0926860X14001938-gr11.sml https://s3.amazonaws.com/prod-ucs-content-store-us-east/content/pii:S0926860X14001938/gr11/THUMBNAIL/image/gif/d1fe462acfc5d5962cb2118713ffa6c5/gr11.sml https://s3-eu-west-1.amazonaws.com/prod-ucs-content-store-eu-west/content/pii:S0926860X14001938/gr11/THUMBNAIL/image/gif/d1fe462acfc5d5962cb2118713ffa6c5/gr11.sml gr11 gr11.sml sml 7779 164 193 IMAGE-THUMBNAIL 1-s2.0-S0926860X14001938-gr10.sml https://s3.amazonaws.com/prod-ucs-content-store-us-east/content/pii:S0926860X14001938/gr10/THUMBNAIL/image/gif/92d621422770b615b0dc913973df4ab3/gr10.sml https://s3-eu-west-1.amazonaws.com/prod-ucs-content-store-eu-west/content/pii:S0926860X14001938/gr10/THUMBNAIL/image/gif/92d621422770b615b0dc913973df4ab3/gr10.sml gr10 gr10.sml sml 7050 164 209 IMAGE-THUMBNAIL 1-s2.0-S0926860X14001938-gr1.sml https://s3.amazonaws.com/prod-ucs-content-store-us-east/content/pii:S0926860X14001938/gr1/THUMBNAIL/image/gif/43fd5655991cba6c5971e1d4a22c4710/gr1.sml https://s3-eu-west-1.amazonaws.com/prod-ucs-content-store-eu-west/content/pii:S0926860X14001938/gr1/THUMBNAIL/image/gif/43fd5655991cba6c5971e1d4a22c4710/gr1.sml gr1 gr1.sml sml 5974 164 162 IMAGE-THUMBNAIL 1-s2.0-S0926860X14001938-fx1.sml https://s3.amazonaws.com/prod-ucs-content-store-us-east/content/pii:S0926860X14001938/fx1/THUMBNAIL/image/gif/b73f6a468af9ee729d50717ebd90b0f4/fx1.sml https://s3-eu-west-1.amazonaws.com/prod-ucs-content-store-eu-west/content/pii:S0926860X14001938/fx1/THUMBNAIL/image/gif/b73f6a468af9ee729d50717ebd90b0f4/fx1.sml fx1 true fx1.sml sml 2284 42 219 IMAGE-THUMBNAIL APCATA 14771 S0926-860X(14)00193-8 10.1016/j.apcata.2014.03.040 Elsevier B.V. Fig. 1 TG curves of precursors of CaFe2O4 (a), Sr0.2Ca0.8Fe2O4 (b), Sr0.4Ca0.6 Fe2O4 (c), Sr0.6Ca0.4 Fe2O4 (d), Sr0.8Ca0.2 Fe2O4 (e) and SrFe2O4 (f) prepared by citrate gel combustion method. Fig. 2 Infrared spectra of CaFe2O4 (a), Sr0.2Ca0.8Fe2O4 (b), Sr0.4Ca0.6Fe2O4 (c), Sr0.6Ca0.4Fe2O4 (d), Sr0.8Ca0.2Fe2O4 (e) and SrFe2O4 (f) calcined at 700°C prepared by citate gel method. Fig. 3 X-ray diffraction pattern of CaFe2O4 (a), Sr0.2Ca0.8Fe2O4 (b), Sr0.4Ca0.6Fe2O4 (c), Sr0.6Ca0.4Fe2O4 (d), Sr0.8Ca0.2Fe2O4 (e) and SrFe2O4 (f) calcined at 700°C prepared by citate gel method. Fig. 4 Scanning electron microscope images of CaFe2O4(a), Sr0.2Ca0.8Fe2O4 (b), Sr0.4Ca0.6Fe2O4 (c), Sr0.6Ca0.4Fe2O4 (d), Sr0.8Ca0.2Fe2O4 (e) and SrFe2O4(f) calcined at 700°C. Fig. 5 Effect of chemical composition on the epoxidation of styrene; reaction conditions: styrene—50mmol; oxidant—30% H2O2(25mmol); catalyst—50mg; solvent—acetonitrile+methanol; NaOH (1M)—2mL; reaction time—12h; temperature—50°C. Fig. 6 Effect of concentration of NaOH on the epoxidation of styrene; reaction conditions: catalyst—50mg of Sr0.2Ca0.8Fe2O4; reaction time—12h; solvent—acetonitrile+methanol; and temperature—50°C. Fig. 7 Effect of solvent on the epoxidation of styrene; reaction conditions: styrene—50mmol; oxidant—30% H2O2 (25mmol); catalyst—50mg of Sr0.2Ca0.8Fe2O4; reaction time—12h; temperature—50°C; NaOH (1M)—2mL. Fig. 8 Effect of time on the epoxidation of styrene; reaction conditions: styrene—50mmol; oxidant—30% H2O2 (25mmol); catalyst—50mg of Sr0.2Ca0.8Fe2O4; solvent—acetonitrile+methanol; NaOH (1M)—2mL; and temperature—50°C. Fig. 9 Effect of temperature on the epoxidation of styrene; reaction conditions:styrene—50mmol; oxidant—30% H2O2 (25mmol); catalyst—50mg of Sr0.2Ca0.8Fe2O4; solvent—acetonitrile+methanol; NaOH (1M)—2mL; and reaction time—12h. Fig. 10 Effect of catalyst amount on the epoxidation of styrene; reaction conditions: styrene—50mmol; oxidant—30% H2O2 (25mmol); reaction time—12h; solvent—acetonitrile+ethanol; NaOH (1M)—2mL; and temperature—50°C. Fig. 11 Effect of styrene/H2O2 on the epoxidation of styrene; reaction conditions: catalyst—50mg of Sr0.2Ca0.8Fe2O4; reaction time—12h; solvent—acetonitrile+methanol; NaOH (1M)—2mL and temperature—50°C. Effect of chemical composition of Sr x Ca1− x Fe2O4 (0.0≤ x ≤1.0) catalyst and alkali towards efficient and selective epoxidation of styrene Ravindra Y. Pawar a Parag V. Adhyapak b Satish K. Pardeshi a ⁎ a Department of Chemistry, University of Pune, Ganeshkhind, Pune 411007, Maharashtra, India Department of Chemistry, University of Pune Ganeshkhind Pune Maharashtra 411007 India b Centre For Materials For Electronics Technology (C-MET), Pune 411008, India Centre For Materials For Electronics Technology (C-MET) Pune 411008 India ⁎ Corresponding author. Tel.: +91 020 25601394x514/+91 20 25601395; fax: +91 020 25691728. Graphical abstract Spinel type strontium substituted calcium (SSC) ferrite Sr x Ca1− x Fe2O4 (0.0≤ x ≤1.0) catalyst synthesized by citrate-gel combustion method are well characterized by various techniques such as TG–DTG, FT-IR, X-ray diffraction, SEM, EDS and BET. The crystallization temperature of the spinel particle prepared by citrate gel is 600°C, which is lower in comparison to ferrite prepared by other methods. Among this series of catalysts, Sr0.2Ca0.8Fe2O4 which has highest surface area shows the best catalytic efficiency. GCMS analysis revealed that, during the course of reaction the insertion of oxygen takes place selectively than the oxidative cleavage of CC bonds; to give epoxide as major product, while addition of NaOH suppresses further isomerization of the styrene epoxide, thereby increasing the selectivity remarkably to give epoxide as major product. The catalyst containing both Sr2+ and Ca2+ ions are more active than pure SrFe2O4 and CaFe2O4. The synergistic effect of Sr2+, Ca2+ ions and greater site preference energy of Sr2+ than Fe3+ favour the selective epoxidation of styrene in presence of 30% H2O2 as oxidant. The optimization and the effect of various reaction conditions on the conversion of styrene and product distribution were also studied. Keywords Strontium substituted calcium ferrite Styrene epoxidation Ring opening prevention Synergistic effect Site preference energy 1 Introduction Mixed metallic oxides are designated as an important class of compounds and among them ferrites are the most prominent by virtue of their high electrical resistivity, thermodynamic stability, electro-catalytic activity and resistance to corrosion. Ferrites are better magnetic materials than pure metals because of their high resistivity, lower cost, easy manufacture and superior magnetization properties. Alkaline earth metal ferrites have attracted considerable attention owing to their potential application in high capacity batteries [1], wastewater cleaning [2], low magnetization ferro fluids [3] and as oxidizing agents[4–6]. Spinel ferrites are of great fundamental and technological importance due to their structural, electronic, magnetic and catalytic properties [7–10]. The physico-chemical properties of the ferrites are strongly dependent on the sites and the nature of the catalyst [11,12], which are closely related to the method of preparation. Epoxidation of styrene is a commercially important reaction for the production of styrene oxide, an important organic intermediate, as versatile and useful chiral building blocks in organic synthesis [13]. Earlier studies reported for the epoxidation of styrene were based on the use of titanium silicate-1(TS-1) [14–17], Ti–SiO2 [14,18,19], Ti loaded Mobil Composition of Matter No. 41 (Ti–MCM-41) [17], and titanium and B co-substituted silicate-2 (TBS-2) and TS-1 [20] catalysts, using different oxidizing agents, such as tertiary butyl hydrogen peroxide (TBHP) [18], aqueous H2O2 [14,15,19,20], and urea–H2O2 adduct [16]. For all the above catalysts, the use of aqueous H2O2 resulted in a very poor selectivity for styrene oxide. High-styrene oxide selectivity (≥80%) could be obtained using urea–H2O2 adduct [16] and TBHP [18] as the oxidizing agents but only at a low-styrene conversion (18% and 10%, respectively). It is, therefore, of great practical interest to find such a catalyst which is much better for the epoxidation of styrene. Recently, Mandelli et al. [21] have observed good catalytic activity and selectivity for γ-alumina in the epoxidation of limonene, cyclohexene and 1-octene by using anhydrous H2O2. However, they observed catalyst deactivation after a certain reaction period (5h), due to accumulation of the reaction water. Olefin epoxidation is a key transformation in organic synthesis both on a laboratory and on industrial scale, due to the interest in epoxides for the production of chemicals and fine chemicals [22]. The use of hydrogen peroxide for selective epoxidation is highly desirable because it is cheap, the active oxygen content is high, and it is clean, since the only by-product formed is water [23]. Many catalytic systems based on different metals have been reported for the epoxidation of a wide range of alkenes using hydrogen peroxide [24–26]. The alkaline earth metal ferrites like CaFe2O4 and SrFe2O4 were also used in selective oxidation of styrene but the selectivity of epoxide was very less while benzaldehyde was the major product in acetone and water as the reaction solvent, respectively [5,6]. The present work is undertaken to explore the possibility of combining the advantages of using hydrogen peroxide, a heterogeneous catalyst strontium substituted calcium (SSC) ferrite and solvents from renewable sources (acetonitrile and methanol), with tailored properties, to extend the range of applicability of these catalytic systems to the epoxidation of a more challenging substrate styrene. We report for the first time, the use of a simple, inexpensive and reusable mixed metal oxide, SSC ferrite, Sr x Ca1− x Fe2O4 (x =0.0, 0.2, 0.4, 0.6, 0.8 and 1.0), for the selective epoxidation of styrene in presence of 30% H2O2 and NaOH solution in suitable solvent system with very good selectivity and yield of styrene epoxide. 2 Experimental 2.1 Synthesis of catalyst by citrate gel combustion method Analytical grade calcium nitrate [Ca(NO3)2·4H2O], strontium nitrate [Sr(NO3)2], iron nitrate [Fe(NO3)3·9H2O] and citric acid [C6H8O7·H2O] (Specialized Pvt. Ltd., Mumbai, India) were used to prepare the strontium substituted calcium ferrites with different compositions Sr x Ca1− x Fe2O4, where 0.0≤ x ≤1.0. The specified volume of metal nitrate solutions was also slowly added to citric acid solution to form the sol. The molar ratio of metal nitrates to citric acid was 1:1. During this procedure, the sol was continuously stirred by a magnetic agitator. Then, the sol was poured in to a dish and heated at 80°C on a hot plate and stirred continuously to transform into a zero gel. At appropriate temperature ignition started and the dried gel burnt in a self-propagating combustion manner until all the gel was burnt out completely to form a fluffy loose powder. The entire combustion process was done in a few minutes. Finally, the as-burnt powders were calcined in the muffle furnace from 600 to 800°C for 2h with a heating rate of 10°C/min to obtain the single phase ferrite [5,7]. 2.2 Characterization of catalysts The thermal decomposition of the precursor studied by thermo gravimetric analysis (TG) is performed on a Shimadzu TG/DTA-60H system with ramp rate of 10°C per minute in flowing air. The stretching vibration frequencies of the precursor and the catalyst are studied by FTIR (Fourier transform infrared) spectroscopy on a Shimadzu FTIR-8400 spectrophotometer using the KBr pellet method. The phases of the synthesized catalysts were characterized by X-ray diffraction (XRD) using a D-8 Advance Bruker Axs, X-ray powder diffractometer equipped with a position sensitive detector, scanning angle ranging from 10° to 900° at a scan rate 1°min−1. The mean crystallite size was estimated by high intensity broadening technique using the Scherrer equation [27]. The morphology of the particles was examined by scanning electron microscopy (SEM) using a JEOL-2011 microscope. Chemical analysis of strontium ferrite was carried out by X-ray fluorescence method. Surface area of the material was determined by using Brunauer, Emmett and Teller (BET) method using Thermo Fisher surface area analyzer Model—SURFER. 2.3 Catalytic activities of strontium substituted calcium ferrites 2.3.1 Selective epoxidation of styrene The selective epoxidation of styrene was carried out in a three neck round bottom flask (100mL) equipped with X-crossed Teflon coated magnetic stirrer and a reflux condenser, and two dropping funnel. In typical batch experiment, 5.2g (50mmol) of styrene [99+%, Aldrich], 6.105g (150mmol) acetonitrile and 100mg of Sr x Ca1− x Fe2O4 (0.0≤ x ≤1.0) catalysts were charged to the reactor. The mixture was heated to 343K; while stirring, a solution of 2.5mL (25mmol) of hydrogen peroxide (30% aq. Merck) was added followed by the addition of 6.41g (200mmol) methanol dropwise to the above mixture over a period of 45min. Aqueous 1N sodium hydroxide was also added simultaneously to maintain the pH between 7.5 and 8.0. After 6h of reaction, the liquid product was cooled down to room temperature and the catalyst was separated by filtration. The product was diluted with 25mL of water and extracted with three 20mL portions of dichloromethane after which the extraction liquid was dried by adding anhydrous sodium sulphate to it. The extracted solution was concentrated and analyzed by QP 5050 Shimadzu gas chromatography and mass spectroscopy (GCMS) equipped with a XE-60 capillary column (30m×0.25×0.3m) and a flame ionization detector. The injector and column temperature were 280 and 140°C, respectively. 3-Nitrotoluene (99+%, Aldrich) was used as an internal standard. 2.4 Results and discussion 2.4.1 Characterization of strontium substituted calcium ferrites 2.4.1.1 Thermo gravimetric analysis Fig. 1(a–f) shows that the thermal analysis of the as prepared samples was done to know the possible changes occurring when they were subjected to heat treatment and to determine the exact calcination temperature of ferrites. From TG studies it is seen that the data for the ferrites synthesized by citrate gel combustion method are featureless in the temperature range of from 30 to 350°C, except for the water loss between 100°C and 110°C. Near 350°C, a sudden weight loss indicates the decarboxylation of the complexes. Above 600°C no distinct weight loss was observed indicating the crystallization of ferrite. 2.4.1.2 FTIR study of strontium substituted calcium ferrites Fig. 2a and f shows FTIR spectrum of CaFe2O4 and SrFe2O4 powder while Fig. 2b–e shows the FTIR spectrum of Sr x Ca1− x Fe2O4 oxide (where x =0.2, 0.4, 0.6 and 0.8) calcined at 700°C temperature. Significant peaks are found in the range of 418–611cm−1 in all spectra. The band appearing around 600–605cm−1 is attributed to stretching vibration of tetrahedral groups Ca2+ O2−, while the band appearing around 552–557cm−1 (υ 1), is attributed to stretching vibration of tetrahedral groups Sr2+ O2−, and that around 440–457cm−1 (υ 2), is attributed to the octahedral group complex Fe3+ O2−. The two weak absorption bands found in the tetrahedral region (552–605cm−1) indicate the presence of divalent metal ions on the tetrahedral site only. The substitution of calcium ion from the CaFe2O4 by strontium ion takes place at tetrahedral site only, which is confirmed by shifting the Sr2+ O stretching band towards the higher wave number from 446cm−1, 550cm−1, 552cm−1, 565cm−1 and 567cm−1 for sample b–f, respectively, as shown in Fig. 2 while the Ca2+ O stretching band shifted towards the lower wave number. The spectrum also reveals that the carboxylates of the precursor transform into metal carbonate with the characteristic stretching location at 1465–1494cm−1. 2.4.1.3 X-ray diffraction analysis of strontium substituted calcium ferrites The X-ray diffraction studies of the samples treated at 700°C temperature for 2h have been carried out using Cu Kα radiation. Fig. 3 shows the XRD patterns of Sr x Ca1− x Fe2O4, where (0.0≤ x ≤1.0). A pattern (a) is the spinel type CaFe2O4 oxide where all the d spacing values are in good agreement with the standard data (JCPDS card no. 46-0100), while a pattern (f) is the XRD pattern of spinel type SrFe2O4 oxide where all the d spacing values are in good agreement with the standard data [28]. Patterns (b)–(e) are the XRD patterns of Sr x Ca1− x Fe2O4 (0.0≤ x ≤1.0) As the concentration of strontium ion in Sr x Ca1− x Fe2O4 increases from (0.0≤ x ≤1.0) the highest intensity peak is shifted towards its left from 2θ angle 33.5, 33.1, 33.0, 32.9, 32.8 and 32.7, respectively (Fig. 3) indicating a higher interplanar distance and consequently, an increase of the cell volume. The crystallite size of all the samples (a–f) was calculated using Scherer's law from the XRD peak at 33.5–32.7, respectively which is in the range of 49–85nm. The X-ray pattern of the substituted spinel type ferrites are monophasic and show the same pattern as that of the calcium ferrite, although a high intensity line shifts to lower 2θ value when the strontium doping increases are observed. 2.4.1.4 Electron dispersive spectra and morphology of strontium substituted calcium ferrites The electron dispersive X-ray spectra of strontium substituted calcium ferrite, Sr x Ca1− x Fe2O4 was prepared by citrate gel combustion method, where x =0.2, 0.4, 0.6 and 0.8 calcined at 700°C; the diffraction peaks of strontium, calcium, iron and oxygen with no other evident diffraction peaks were observed, suggesting that no impurities were introduced into the resultant samples. The percentage composition of the elements like strontium, calcium, iron and oxygen in the respective catalysts is in good agreement with the calculated values. The magnified SEM images of calcium ferrite, strontium ferrite and strontium substituted calcium ferrite with different chemical composition calcined at 700°C temperature are shown in Fig. 4(a–f). Fig. 4(a) shows the joint network structure of CaFe2O4. As the concentration of strontium increases in Sr x Ca1− x Fe2O4 (where x =0.2, 0.4, 0.6 and 0.8) the morphology of the material changes from one form to another as shown in Fig. 4(b–e). The catalyst with x =0.2 shows fine flakes like morphology while x =0.4 shows the needle shape morphology. The catalysts with x =0.6 and 0.8 show the agglomerization which results in the surface area of catalyst. In strontium ferrite (SrFe2O4 Fig. 4(f)) it forms a complex solid with rough morphology [6]. It may be due to increase in the concentration of strontium. 2.4.1.5 Specific surface area (BET) analysis The BET surface area for the various samples of strontium substituted calcium ferrite (Sr x Ca1− x Fe2O4) catalysts calcined at 700°C was also carried out. Among all the prepared catalysts the surface area of Sr x Ca1− x Fe2O4 catalysts, where x =0.2 and 0.4, is 175.19m2/g. The surface areas of the other catalysts of composition i.e., x =0.0, 0.6, 0.8 and 1.0 are below 25m2/g even though they are prepared by the same method. It may be due to the agglomerization of oxides during the heat treatment as also shown in SEM analysis (Fig. 4). 2.4.2 Catalytic activity of catalysts In our previous work the parent calcium and strontium ferrite were found to be effective towards the selective oxidation of styrene to benzaldehyde as major product while styrene epoxide was observed as minor product [5,6]. Epoxidation of styrene is considered to be a commercially important reaction for the production of styrene oxide, an important organic intermediate. With the intention to enhance the activity of catalyst towards the epoxidation of styrene, the strontium substituted calcium ferrite catalysts were prepared by citrate gel method with different chemical composition (Sr x Ca1− x Fe2O4 where x =0.2, 0.4, 0.6 and 0.8). The catalytic efficiency of Sr x Ca1− x Fe2O4 is checked towards the epoxidation of styrene over the surface under optimized conditions. The optimization of reaction conditions is discussed below. 2.4.2.1 Effect of chemical composition of catalysts The catalytic activity of oxides depends on the ability of the ions to be oxidized and reduced. Gao et al., [4] and Pardeshi et al., [5,6] have reported the selective oxidation of styrene to benzaldehyde over alkaline earth metal ferrites, where phenylacetaldehyde and epoxides are minor products in presence of hydrogen peroxide as the oxidizing agent. The use of pure CaFe2O4 or SrFe2O4 catalyst with aqueous hydrogen peroxide often results in extensive hydrolysis of epoxide to give benzaldehyde and phenyl acetaldehyde as desirable products. In the present study our efforts have been for the synthesis of hydrophobic catalyst to prevent the further hydrolysis of epoxide. Since epoxides are key building blocks in organic synthesis [29], as well as commercially important intermediates used in the synthesis of chiral pharmaceuticals, pesticides, epoxy paints, agrochemicals, perfume materials and sweeteners [30,31], it is a need to develop a suitable catalyst. Traditionally, epoxides are produced by the chlorohydrin process and the Halcon process [32]; however, a lot of by-products resulting from both processes are environmentally undesirable. Thus, the pursuit of environmentally-benign methods with clean and cheap oxidant has been a challenge in chemical industries and academic fields. So we synthesized the catalyst with different composition of Ca2+ and Sr2+ ions to improve the selectivity of epoxide instead of benzaldehyde. The catalytic efficiency of strontium substituted calcium ferrites is checked, under similar reaction conditions, towards the selective epoxidation of styrene; the results are shown in Fig. 5 . Among the various catalysts, CaFe2O4 shows least reactivity towards the epoxidation of styrene with 48mol% styrene conversion and 24.4mol% selectivity and 11.7% yield of styrene epoxide whereas the selectivity of benzaldehyde is 62.3mol%. Changing the composition of CaFe2O4 by substituting calcium with strontium, the catalytic efficiency towards the epoxidation of styrene becomes better. In comparison to all the catalysts Sr0.2Ca0.8Fe2O4 shows the best catalytic performance with 49.6% styrene conversion with 95.8% selectivity and 47.5% yield of styrene epoxide. As the concentration of strontium increases from 0.4 to 0.8 the styrene conversion increases up to 57.6% but the selectivity and yield of epoxide decreases to 37.2% and 21.43%, respectively. When the same reaction is carried out in presence of SrFe2O4, under similar reaction conditions, it shows least activity towards the epoxidation of styrene with 52.8% conversion and 26.4% selectivity of epoxide whereas the selectivity of benzaldehyde moves up to 64.7mol%. The efficiency of the catalyst can be improved by substituting the divalent strontium metal ion with different concentration at the tetrahedral site of the calcium ferrite catalyst. As the concentration of x increases, the acidity of the system increases with corresponding reduction in basicity [33]. Due to the higher ionic size of Sr2+ ions than Ca2+ ions, Sr2+ ions preferably move from Td to Oh site of the spinel .As the concentration of ‘x’ increases, Sr2+ ions isomorphically remove Fe3+ ion from the Oh to Td sites due to greater site preference energy of Sr2+ ions than Fe3+ ions. This means that the substitution of Fe3+ ions by Sr2+ ions at the Oh sites creates stronger acid sites than those due to Fe3+ ions. The influence of Sr2+ and Ca2+, indicates that the composition of the substituted ferrite is a decisive factor for its catalytic activity suggesting that there is a synergistic effect between the metal ions in Sr–Ca and Sr–Fe on the active surface of the ferrite. From Fig. 5 it is clear that the composition containing both Sr2+ and Ca2+ are more active than pure CaFe2O4 and SrFe2O4. When Sr2+ and Ca2+ are in intimate contact in the Sr x Ca1− x Fe2O4 system, the different reaction steps may sequentially occur over each metal, resulting in an enhanced activity compared to the parent ferrites. The remaining Fe3+ ions on the octahedral site react with H2O2 molecule to form iron peroxo species (Fe4+ O• radical) which react with styrene molecule to form Pi-bonded transient species on rearrangement to give metalloepoxy species [6]. The best activity of catalyst Sr0.2Ca0.8Fe2O4 of the series towards the selective epoxidation of styrene may be due to the insertion of structural defects in the catalyst [34]. Also the ionic radius of Ca2+ (1.14Å) is less than that of Sr2+ ion (1.32Å), therefore cell volume should be slightly affected. It is observed that, in the styrene epoxidation reaction, the Ca2+/Sr2+ratio is crucial in determination of total activity towards the reaction and selectivity for the products. Among all the substituted materials, Sr0.2Ca0.8Fe2O4 where the Ca2+/Sr2+ratio is highest has the best rate for epoxidation of styrene. Thus to summarize, simultaneous participation of both metals i.e., Ca2+ and Sr2+ favours the epoxidation of styrene reaction with better conversion of styrene and percent yield of styrene epoxide. 2.4.2.2 Role of NaOH In this study, we observed that in presence of NaOH both conversion and styrene oxide selectivity was higher than that in case of CaFe2O4 and SrFe2O4 alone. Pardeshi et al. have reported the selective oxidation of styrene over CaFe2O4 [5] and SrFe2O4 [6], where benzaldehyde was found to be a major product while the epoxides formed only up to 10mol% in presence of 30% H2O2 as oxidizing agent. In this paper the same reaction is carried out over Sr x Ca1− x Fe2O4 catalysts in the presence and absence of NaOH. From the observations it is clear that NaOH plays an important role in styrene epoxidation reaction. The results are shown in Fig. 6 . When the reaction is carried out in the absence of NaOH conversion of styrene takes place up to 53.2mol% with 70.3mol% selectivity and 37.4% yield of epoxide, respectively. The same reaction when carried out in presence of 1mL NaOH (1M) the styrene conversion is slightly decreased to 51.3mol%, while the selectivity and yield of styrene epoxide is increased up to 89.1mol% and 45.71%. When the same reaction is carried out in presence of 2mL NaOH (1M) the styrene conversion is reduced to 49.6mol% but the selectivity and yield of epoxide increased up to 95.8mol% and 47.5%, while in presence of 3mL NaOH (1M) the styrene conversion as well as selectivity of epoxide decrease to 46.5mol% and 92.6mol%, respectively, with 43.1% yield. From the observation it is clear that as the concentration of NaOH increases the styrene conversion gradually decreases while the selectivity of styrene epoxide increases up to 2mL NaOH. The enhancement of epoxide selectivity in presence of NaOH is due to the suppression of hydrogen bonding with the Lewis acid centres on the surface of catalyst and hence the isomerization of styrene epoxide to phenylacetaldehyde is eliminated [33]. While for 3mL NaOH the styrene conversion decreases along with the selectivity of epoxide which may be due to excess concentration of NaOH, the hydroxyl ions compete with the styrene molecules and block most of the active sites on the surface of catalyst. 2.4.2.3 Effect of solvent on epoxidation The nature of the solvent plays a very important role for heterogeneous catalysis in the liquid phase; the solvent can influence the rate of reaction by the solvation of reactants and intermediates in solution. The role of solvents is examined towards the selective epoxidation of styrene under the optimized conditions of time, temperature, catalytic amount etc.; the results are shown in Fig. 7 . When the reaction is carried out in the presence of polar and protic solvents like methanol, ethanol and water, the catalyst shows a poor performance with 26.9mol%, 24.7mol% and 18.6mol% styrene conversion, respectively. The molecules of these solvents can affect the rate by competing with reactant molecules for active sites on the surface of a heterogeneous catalyst [35]. But when the same reaction is carried out in aprotic solvents like acetonitrile the styrene conversion increased up to 41.7mol% along with 82.1mol% selectivity and 34.2% yield of styrene epoxide. Acetonitrile along with methanol in a proportion of 2:3 serves just as a solvent system in the epoxidation of styrene; the conversion of styrene increased to 49.6mol% with 95.8mol% selectivity and 47.5% yield of styrene epoxide. Secondly reaction in the presence of acetonitrile with methanol can decrease the rate of ring opening reaction of styrene oxide with benzaldehyde and results in an increase in the selectivity of styrene oxide [36]. The use of polar solvents favours the oxidation of double bond, hence the mixture of CH3OH and CH3CN is found to be a better solvent. 2.4.2.4 Optimization of other reaction conditions 2.4.2.4.1 Effect of time The styrene conversion and product selectivity is plotted as a function of reaction time, at 50°C, in CH3CN and CH3OH as reaction medium in the presence of 2mL NaOH (1M) over 0.05g of Sr0.2Ca0.8Fe2O4 catalyst. Under these reaction conditions, the reaction was carried out by varying the time from 3h to 15h. The results are shown in Fig. 8 . It is found that the percentage conversion of styrene increases from 23.7mol% to 49.6mol% with increase in the reaction time from 3 to 12h, respectively and then marginal increment upto 50.8mol% with further rise in reaction time to 15h. The selectivity of epoxide also increases from 70.6mol% to 95.8mol% with increase in the percent yield from 16.3 to 47.5 for the reaction time from 3 to 12h, respectively, while the selectivity and percent yield of epoxide slightly decrease to 88.6mol% and 45%, respectively. The result indicates that as the reaction is run for a long time the selectivity of byproducts starts to increase. This may be due to the complete exhaustion of H2O2 in the reaction mixture as the reaction was run for long duration. The concentration of H2O2 reduced continuously with the reaction going on, and less amount of H2O2 was not favourable for further oxidation of styrene, therefore, more byproducts are formed and hence the selectivity of epoxide decreases. Moreover, undesirable products were also found to be formed when the reaction was allowed to run for a long time. From the results it can be concluded that at 12h the selectivity of styrene epoxide is better with respect to styrene conversion. 2.4.2.4.2 Effect of temperature on epoxidation The effect of temperature on the epoxidation of styrene is examined under the optimized conditions of time, substrate/H2O2 molar ratio, solvent, 2mL NaOH (1M), catalytic amount etc.; the results are shown in Fig. 9 , respectively. Epoxidation of styrene is carried out by varying the temperature from 30°C to 70°C with the interval of 10°C. At 30°C only 33.4mol% of styrene conversion was observed with 57.2mol% selectivity and 19.1% yield of styrene epoxide. To see the effect of temperature the same reaction was carried out at 40°C; the styrene conversion increases to 38.1mol% with 71.4mol% selectivity and 27.2% yield of epoxide. As the rise in temperature is in favour, the same reaction was carried out at 50°C; the styrene conversion was increased to 49.6mol% with 95.8mol% selectivity and 47.5% yield of epoxide. When the same reaction was carried out at 60°C and 70°C, the marginal increment in the styrene conversion was found up to 51.8mol% and 53.9mol% with reduction in selectivity of epoxide to 88.1mol% and 78.9mol%, respectively. This is because at higher temperature the rate of nucleophilic attraction is also enhanced which finally leads to enhancement in the selectivity of side products like benzaldehyde and phenylacetaldehyde. From these observations 50°C is the optimized temperature for the better conversion of styrene to styrene epoxide. Up to the optimized temperature the rate of reaction was increased while, at high temperature it shows an adverse effect on the adsorption of substrate and reagent molecule on the surface of catalyst. 2.4.2.4.3 Effect of catalyst amount on epoxidation In order to check the effect of the amount of catalyst during the selective epoxidation of styrene, the reaction was carried out over Sr0.2Ca0.8Fe2O4 catalyst in a mixture of acetonitrile and methanol as solvent in the presence of 2mL NaOH (1M) with 25, 50, and 75mg of catalyst for 12h and 50°C. The percentage conversion and percentage selectivity is shown in Fig. 10 . The effect of amount of catalyst was studied keeping all other parameters (reaction time, temperature, mole ratio of substrate: H2O2) constant. It can be seen (Fig. 10) that % conversion of styrene is 39.7mol% with 92.5mol% selectivity and 36.7% yield of styrene epoxide over 25mg of catalyst. For 50mg of catalyst the styrene conversion increases to 49.6mol% while the selectivity and % yield of epoxide increases to 95.8mol% and 47.5%, respectively. Further increase in catalytic amount up to 75mg catalyst shows lower styrene conversion of 37.1mol% with 83.7mol% selectivity and 31.1% yield of styrene epoxide, respectively. At catalyst loadings of 25mg and 50mg, the increase in the styrene conversion with the catalyst loading is due to the increase of styrene epoxidation rate. However, at the higher catalyst loadings, the H2O2 decomposition rate during the epoxidation is much higher than that at lower loading. At 75mg sufficient H2O2 is not available for the epoxidation, which ultimately leads to a lower styrene conversion at the higher catalyst loadings. 2.4.2.4.4 Effect of substrate/H2O2 molar ratio The styrene conversion is observed up to 23.0mol% in the presence of catalyst without using any oxidant. This clearly indicates the possibility of the reaction occurring due to the participation of lattice oxygen of catalyst. However, the reaction does not give the selective product. The selectivity of epoxide is only 30.0mol% with 6.9% yield. In the absence of catalyst and in the presence of 30% H2O2 the reaction proceeds up to 24.0mol%, but here also the reaction proceeds randomly and gives 32.0mol% of epoxide with 7.2% yield. Hence there is a need to optimize the styrene/H2O2 molar ratio to carry out the reaction selectively keeping all the remaining parameters like temperature, time, etc. constant. The reaction was subsequently carried out in the presence of different styrene/H2O2 molar ratios such as 1:0.25, 1:0.5, 1:1, 1:2 and 1:3, for which 0.05g of catalyst was taken in 10mL of solvent at 50°C. The results are shown in Fig. 11 . From the results it is observed that the conversion of styrene is comparatively less when the styrene/H2O2 molar ratio is 1:0.25 (about 27.3mol%). This may be due to significantly reduced •OH radicals as less amount of H2O2 competes with excess styrene for coordination. As the concentration of H2O2 increases (1:0.5) there is increase in the styrene conversion as well as increase in the selectivity of styrene epoxide. The percentage conversion of styrene is 49.6% and the selectivity and yield for epoxide is 95.8mol% and 47.5%, respectively. At this molar ratio of 1:0.5, H2O2 may freely coordinate to metal and decompose to form •OH radical. When the same reaction was carried out at styrene/H2O2 molar ratio 1:1, 1:2 and 1:3 in presence of 0.05g catalyst the styrene conversion increases as 53.2mol%, 57.2mol% and 63.7mol% while the selectivity of epoxide decreases to 81.3mol%, 67.5mol% and 33.5mol%, respectively. As the concentration of H2O2 increases the selectivity of styrene oxide decreases firstly due to the later nucleophilic attract on the styrene oxide and secondly due to the excess of water content in hydrogen peroxide that inhibits the coordination of oxidants with the active sites of catalyst [37]. 3 Conclusions Sr x Ca1− x Fe2O4 (0.0≤ x ≤1.0) catalyst was successfully synthesized by citrate gel method. Thermal analysis of strontium calcium iron citrate precursor gives the information about the temperature at which the formation of strontium ferrite takes place. The phase analysis by XRD, metal oxygen stretching frequencies by FTIR, morphology and elemental composition by SEM and EDS, and elemental analysis by chemical method confirms the formation of single phase Sr x Ca − x Fe2O4 (0.0≤ x ≤1.0). The surface areas determined by BET method, for Sr0.2Ca0.8Fe2O4 and Sr0.4Ca0.6Fe2O4 are found comparatively more than that of the other catalysts prepared by the same method. As the concentration of ‘x’ increases, Sr2+ ions isomorphically remove Fe3+ ion from the Oh to Td sites due to greater site preference energy of Sr2+ ions than Fe3+ ions, which means that the substitution of Fe3+ ions by Sr2+ ions in the Oh sites creates stronger acid sites than those due to Fe3+ ions. Sr0.2Ca0.8Fe2O4 among all is found to be an efficient catalyst for selective oxidation of styrene to styrene epoxide in the mixture of acetonitrile and methanol (3:2) as a solvent in the presence of 30% H2O2 as oxidizing agent, suggesting a synergistic effect between the metal ion in the form of Sr–Ca and Sr–Fe on the active surface of ferrite. Among all the substituted materials, Sr0.2Ca0.8Fe2O4 where the Ca2+/Sr2+ratio, is highest has the best rate for epoxidation of styrene. The conversion of styrene up to 49.6mol% along with the selectivity and percent yield of styrene epoxide are 95.8mol% and 47.5, respectively. Temperature 50°C, time 12h, styrene/H2O2 molar ratio as 1:0.5, catalyst amount 0.05g favour the selective epoxidation of styrene. Solvents have marked influence on the product distribution in selective epoxidation of styrene; mixture of acetonitrile and methanol seems to be the best solvent. The enhancement in epoxide selectivity in presence of NaOH is due to suppression of hydrogen bonding between the acid centres of catalyst and oxygen from epoxide which prevent ring opening and hence the isomerization of styrene epoxide to phenyl acetaldehyde is eliminated. References [1] S. Licht B. Wang S. Ghosh Science 285 1999 1039 1042 [2] V.K. Sharma J.O. Smith F.J. Millero Environ. Sci. Technol. 31 1997 2486 2491 [3] V.K. Sankaranarayanan O. Prakash R.P. Pant M. Islam J. Magn. Magn. Mater. 252 2002 7 9 [4] N. Ma Y. Yue W. Hua Z. Gao Appl. Catal., A: Gen. 251 2003 39 47 [5] S.K. Pardeshi R.Y. Pawar J. Mater. Res. Bull. 45 2010 609 615 [6] S.K. Pardeshi R.Y. Pawar J. Mol. Catal. A: Chem. 334 2011 35 43 [7] M.R. Barati J. Sol-Gel Sci. Technol. 52 2009 171 178 [8] B. Vishvanathan V.R.K. Murthy Ferrites: Its Science and Technology 1990 Narosa Delhi [9] Y. Hoshini S. Iida M. Sugimoo International Conference on Ferrite Japan 1970 [10] M.H. Mendonca M. Godinho M.A. Catarino F.M. Costa Solid State Sci. 4 2002 175 182 [11] R.C.C. Costa F. Lelis L.C.A. Oliveira J.D. Fabris J.D. Ardisson R.R.A. Rios C.L. Silva R.M. Lago Catal. Commun. 4 2003 525 529 [12] M.S. Selim G. Turkey M.A. Shouman G.A. El-Shobaky Solid State Ionics: Diffusion React. 120 1999 173 181 [13] A.K. Yudin Aziridine and Epoxides in Organic Synthesis 2006 Wiley-VCH Weinheim [14] Q. Yang C. Li J.L. Wang P. Ying Q. Xin W. Shi Stud. Surf. Sci. Catal. 130 2000 221 226 [15] S.B. Kumar S.P. Mirajkar G.C.G. Pais P. Kumar R. Kumar J. Catal. 156 1995 163 166 [16] S.C. Laha R. Kumar J. Catal. 204 2001 64 70 [17] W. Zhang M. Froba J. Wang P. Tanev J. Wong T. Pinnavaia J. Am. Chem. Soc. 118 1996 9164 9171 [18] V.R. Grieken J.L. Sotelo C. Martos J.L.G. Fierro M. Lopez-Granados R. Mariscal Catal. Today 61 2000 49 54 [19] Q. Yang S. Wang J. Lu G. Xiong Z. Feng X. Xin C. Li Appl. Catal. 507 2000 194 195 [20] J. Fu D. Yin D. Yin Q. Li L. Zhang Y. Zhang Microporous Mesoporous Mater. 29 1999 351 359 [21] D. Mandelli C.A. van Vliet R.A. Sheldon U. Schuchardt Appl. Catal. 219 2001 209 213 [22] G. Sienel R. Rieth K.T. Rowbottom Ullmann's Encyclopedia of Organic Chemicals 1999 Wiley-VCH Weinheim [23] R.A. Sheldon Topics in Current Chemistry: Homogeneous and Heterogeneous Catalytic Oxidations with Peroxide 1993 Springer-Verlag Berlin [24] G. Grigoropoulou J.H. Clark J.A. Elings Green Chem. 5 2003 1 7 [25] D.E. De Vos B.F. Sels P.A. Jacobs Adv. Synth. Catal. 345 2003 457 473 [26] D.E. De Vos B.F. Sels P.A. Jacobs Adv. Catal. 46 2001 1 87 [27] K. Sreekumar T. Mathew B.M. Devassy R. Rajagopal R. Vertivel B.S. Rao Appl. Catal., A: Gen. 205 2001 11 18 [28] P. Berthet J. Berthon G. Herger A. Revcolevschi Mat. Res. Bull. 27 1992 919 924 [29] Q.-H. Xia H.Q. Ge C.P. Ye Z.M. Liu K.X. Su Chem. Rev. 105 2005 1603 1662 [30] S. Bhattacharjee J.A. Anderson J. Mol. Catal. A: Chem. 249 2006 103 110 [31] S.K. Samantaray K. Parida Catal. Commun. 6 2005 578 581 [32] J. Liang Q. Zhang H. Wu G. Meng Q. Tang Y. Wang Catal. Commun. 5 2004 665 669 [33] C.V. Rode U.N. Nehete M.K. Dongare Catal. Commun. 4 2003 365 369 [34] Z. Yu L. Gao S. Yuan Y. Wu J. Chem. Soc. Faraday Trans. 88 1992 3245 3249 [35] K. Shreekumar T.M. Jyothi T. Mathew M.B. Talawar S. Sugunan B.S. Rao J. Mol. Catal. A: Chem. 159 2000 327 334 [36] W.C. Zhan Y.L. Guo Y.Q. Wang X.H. Liu Y. Guo Y.S. Wang Z.G. Zhang G.Z. Lu J. Phys. Chem. B 111 2007 12103 12110 [37] D. Yin L. Qin J. Liu C. Li Y. Jin J. Mol. Catal. A: Chem. 240 2005 40 48",
      "scopus-id": "84898773708",
      "coredata": {
        "eid": "1-s2.0-S0926860X14001938",
        "dc:description": "Spinel type strontium substituted calcium (SSC) ferrite Sr x Ca1− x Fe2O4 (0.0≤ x ≤1.0) catalyst synthesized by citrate-gel combustion method are well characterized by various techniques such as TG–DTG, FT-IR, X-ray diffraction, SEM, EDS and BET. The crystallization temperature of the spinel particle prepared by citrate gel is 600°C, which is lower in comparison to ferrite prepared by other methods. Among this series of catalysts, Sr0.2Ca0.8Fe2O4 which has highest surface area shows the best catalytic efficiency. GCMS analysis revealed that, during the course of reaction the insertion of oxygen takes place selectively than the oxidative cleavage of CC bonds; to give epoxide as major product, while addition of NaOH suppresses further isomerization of the styrene epoxide, thereby increasing the selectivity remarkably to give epoxide as major product. The catalyst containing both Sr2+ and Ca2+ ions are more active than pure SrFe2O4 and CaFe2O4. The synergistic effect of Sr2+, Ca2+ ions and greater site preference energy of Sr2+ than Fe3+ favour the selective epoxidation of styrene in presence of 30% H2O2 as oxidant. The optimization and the effect of various reaction conditions on the conversion of styrene and product distribution were also studied.",
        "openArchiveArticle": "false",
        "prism:coverDate": "2014-05-20",
        "openaccessUserLicense": null,
        "prism:aggregationType": "Journal",
        "prism:url": "https://api.elsevier.com/content/article/pii/S0926860X14001938",
        "dc:creator": [
          {
            "@_fa": "true",
            "$": "Pawar, Ravindra Y."
          },
          {
            "@_fa": "true",
            "$": "Adhyapak, Parag V."
          },
          {
            "@_fa": "true",
            "$": "Pardeshi, Satish K."
          }
        ],
        "link": [
          {
            "@_fa": "true",
            "@rel": "self",
            "@href": "https://api.elsevier.com/content/article/pii/S0926860X14001938"
          },
          {
            "@_fa": "true",
            "@rel": "scidir",
            "@href": "https://www.sciencedirect.com/science/article/pii/S0926860X14001938"
          }
        ],
        "dc:format": "application/json",
        "openaccessType": null,
        "pii": "S0926-860X(14)00193-8",
        "prism:volume": "478",
        "prism:publisher": "Elsevier B.V.",
        "dc:title": "Effect of chemical composition of Sr x Ca1− x Fe2O4 (0.0≤ x ≤1.0) catalyst and alkali towards efficient and selective epoxidation of styrene",
        "prism:copyright": "Copyright © 2014 Elsevier B.V. All rights reserved.",
        "openaccess": "0",
        "prism:issn": "0926860X",
        "dcterms:subject": [
          {
            "@_fa": "true",
            "$": "Strontium substituted calcium ferrite"
          },
          {
            "@_fa": "true",
            "$": "Styrene epoxidation"
          },
          {
            "@_fa": "true",
            "$": "Ring opening prevention"
          },
          {
            "@_fa": "true",
            "$": "Synergistic effect"
          },
          {
            "@_fa": "true",
            "$": "Site preference energy"
          }
        ],
        "openaccessArticle": "false",
        "prism:publicationName": "Applied Catalysis A: General",
        "openaccessSponsorType": null,
        "prism:pageRange": "129-137",
        "prism:endingPage": "137",
        "pubType": "fla",
        "prism:coverDisplayDate": "20 May 2014",
        "prism:doi": "10.1016/j.apcata.2014.03.040",
        "prism:startingPage": "129",
        "dc:identifier": "doi:10.1016/j.apcata.2014.03.040",
        "openaccessSponsorName": null
      },
      "objects": {
        "object": [
          {
            "@category": "high",
            "@height": "1501",
            "@width": "1742",
            "@_fa": "true",
            "$": "https://api.elsevier.com/content/object/eid/1-s2.0-S0926860X14001938-gr9_lrg.jpg?httpAccept=%2A%2F%2A",
            "@multimediatype": "JPEG image file",
            "@type": "IMAGE-HIGH-RES",
            "@size": "441995",
            "@ref": "gr9",
            "@mimetype": "image/jpeg"
          },
          {
            "@category": "high",
            "@height": "1484",
            "@width": "1742",
            "@_fa": "true",
            "$": "https://api.elsevier.com/content/object/eid/1-s2.0-S0926860X14001938-gr8_lrg.jpg?httpAccept=%2A%2F%2A",
            "@multimediatype": "JPEG image file",
            "@type": "IMAGE-HIGH-RES",
            "@size": "408120",
            "@ref": "gr8",
            "@mimetype": "image/jpeg"
          },
          {
            "@category": "high",
            "@height": "1425",
            "@width": "1742",
            "@_fa": "true",
            "$": "https://api.elsevier.com/content/object/eid/1-s2.0-S0926860X14001938-gr7_lrg.jpg?httpAccept=%2A%2F%2A",
            "@multimediatype": "JPEG image file",
            "@type": "IMAGE-HIGH-RES",
            "@size": "397208",
            "@ref": "gr7",
            "@mimetype": "image/jpeg"
          },
          {
            "@category": "high",
            "@height": "1361",
            "@width": "1749",
            "@_fa": "true",
            "$": "https://api.elsevier.com/content/object/eid/1-s2.0-S0926860X14001938-gr6_lrg.jpg?httpAccept=%2A%2F%2A",
            "@multimediatype": "JPEG image file",
            "@type": "IMAGE-HIGH-RES",
            "@size": "394068",
            "@ref": "gr6",
            "@mimetype": "image/jpeg"
          },
          {
            "@category": "high",
            "@height": "1479",
            "@width": "1742",
            "@_fa": "true",
            "$": "https://api.elsevier.com/content/object/eid/1-s2.0-S0926860X14001938-gr5_lrg.jpg?httpAccept=%2A%2F%2A",
            "@multimediatype": "JPEG image file",
            "@type": "IMAGE-HIGH-RES",
            "@size": "397861",
            "@ref": "gr5",
            "@mimetype": "image/jpeg"
          },
          {
            "@category": "high",
            "@height": "1794",
            "@width": "1500",
            "@_fa": "true",
            "$": "https://api.elsevier.com/content/object/eid/1-s2.0-S0926860X14001938-gr4_lrg.jpg?httpAccept=%2A%2F%2A",
            "@multimediatype": "JPEG image file",
            "@type": "IMAGE-HIGH-RES",
            "@size": "459812",
            "@ref": "gr4",
            "@mimetype": "image/jpeg"
          },
          {
            "@category": "high",
            "@height": "1406",
            "@width": "1727",
            "@_fa": "true",
            "$": "https://api.elsevier.com/content/object/eid/1-s2.0-S0926860X14001938-gr3_lrg.jpg?httpAccept=%2A%2F%2A",
            "@multimediatype": "JPEG image file",
            "@type": "IMAGE-HIGH-RES",
            "@size": "355593",
            "@ref": "gr3",
            "@mimetype": "image/jpeg"
          },
          {
            "@category": "high",
            "@height": "1393",
            "@width": "1742",
            "@_fa": "true",
            "$": "https://api.elsevier.com/content/object/eid/1-s2.0-S0926860X14001938-gr2_lrg.jpg?httpAccept=%2A%2F%2A",
            "@multimediatype": "JPEG image file",
            "@type": "IMAGE-HIGH-RES",
            "@size": "210806",
            "@ref": "gr2",
            "@mimetype": "image/jpeg"
          },
          {
            "@category": "high",
            "@height": "1483",
            "@width": "1749",
            "@_fa": "true",
            "$": "https://api.elsevier.com/content/object/eid/1-s2.0-S0926860X14001938-gr11_lrg.jpg?httpAccept=%2A%2F%2A",
            "@multimediatype": "JPEG image file",
            "@type": "IMAGE-HIGH-RES",
            "@size": "416296",
            "@ref": "gr11",
            "@mimetype": "image/jpeg"
          },
          {
            "@category": "high",
            "@height": "1373",
            "@width": "1749",
            "@_fa": "true",
            "$": "https://api.elsevier.com/content/object/eid/1-s2.0-S0926860X14001938-gr10_lrg.jpg?httpAccept=%2A%2F%2A",
            "@multimediatype": "JPEG image file",
            "@type": "IMAGE-HIGH-RES",
            "@size": "335951",
            "@ref": "gr10",
            "@mimetype": "image/jpeg"
          },
          {
            "@category": "high",
            "@height": "2946",
            "@width": "2910",
            "@_fa": "true",
            "$": "https://api.elsevier.com/content/object/eid/1-s2.0-S0926860X14001938-gr1_lrg.jpg?httpAccept=%2A%2F%2A",
            "@multimediatype": "JPEG image file",
            "@type": "IMAGE-HIGH-RES",
            "@size": "768145",
            "@ref": "gr1",
            "@mimetype": "image/jpeg"
          },
          {
            "@category": "high",
            "@height": "420",
            "@width": "2213",
            "@_fa": "true",
            "$": "https://api.elsevier.com/content/object/eid/1-s2.0-S0926860X14001938-fx1_lrg.jpg?httpAccept=%2A%2F%2A",
            "@multimediatype": "JPEG image file",
            "@type": "IMAGE-HIGH-RES",
            "@size": "85956",
            "@ref": "fx1",
            "@mimetype": "image/jpeg"
          },
          {
            "@category": "standard",
            "@height": "339",
            "@width": "393",
            "@_fa": "true",
            "$": "https://api.elsevier.com/content/object/eid/1-s2.0-S0926860X14001938-gr9.jpg?httpAccept=%2A%2F%2A",
            "@multimediatype": "JPEG image file",
            "@type": "IMAGE-DOWNSAMPLED",
            "@size": "34489",
            "@ref": "gr9",
            "@mimetype": "image/jpeg"
          },
          {
            "@category": "standard",
            "@height": "335",
            "@width": "393",
            "@_fa": "true",
            "$": "https://api.elsevier.com/content/object/eid/1-s2.0-S0926860X14001938-gr8.jpg?httpAccept=%2A%2F%2A",
            "@multimediatype": "JPEG image file",
            "@type": "IMAGE-DOWNSAMPLED",
            "@size": "32802",
            "@ref": "gr8",
            "@mimetype": "image/jpeg"
          },
          {
            "@category": "standard",
            "@height": "321",
            "@width": "393",
            "@_fa": "true",
            "$": "https://api.elsevier.com/content/object/eid/1-s2.0-S0926860X14001938-gr7.jpg?httpAccept=%2A%2F%2A",
            "@multimediatype": "JPEG image file",
            "@type": "IMAGE-DOWNSAMPLED",
            "@size": "33354",
            "@ref": "gr7",
            "@mimetype": "image/jpeg"
          },
          {
            "@category": "standard",
            "@height": "307",
            "@width": "395",
            "@_fa": "true",
            "$": "https://api.elsevier.com/content/object/eid/1-s2.0-S0926860X14001938-gr6.jpg?httpAccept=%2A%2F%2A",
            "@multimediatype": "JPEG image file",
            "@type": "IMAGE-DOWNSAMPLED",
            "@size": "31004",
            "@ref": "gr6",
            "@mimetype": "image/jpeg"
          },
          {
            "@category": "standard",
            "@height": "334",
            "@width": "393",
            "@_fa": "true",
            "$": "https://api.elsevier.com/content/object/eid/1-s2.0-S0926860X14001938-gr5.jpg?httpAccept=%2A%2F%2A",
            "@multimediatype": "JPEG image file",
            "@type": "IMAGE-DOWNSAMPLED",
            "@size": "33864",
            "@ref": "gr5",
            "@mimetype": "image/jpeg"
          },
          {
            "@category": "standard",
            "@height": "676",
            "@width": "565",
            "@_fa": "true",
            "$": "https://api.elsevier.com/content/object/eid/1-s2.0-S0926860X14001938-gr4.jpg?httpAccept=%2A%2F%2A",
            "@multimediatype": "JPEG image file",
            "@type": "IMAGE-DOWNSAMPLED",
            "@size": "93063",
            "@ref": "gr4",
            "@mimetype": "image/jpeg"
          },
          {
            "@category": "standard",
            "@height": "318",
            "@width": "390",
            "@_fa": "true",
            "$": "https://api.elsevier.com/content/object/eid/1-s2.0-S0926860X14001938-gr3.jpg?httpAccept=%2A%2F%2A",
            "@multimediatype": "JPEG image file",
            "@type": "IMAGE-DOWNSAMPLED",
            "@size": "37576",
            "@ref": "gr3",
            "@mimetype": "image/jpeg"
          },
          {
            "@category": "standard",
            "@height": "314",
            "@width": "393",
            "@_fa": "true",
            "$": "https://api.elsevier.com/content/object/eid/1-s2.0-S0926860X14001938-gr2.jpg?httpAccept=%2A%2F%2A",
            "@multimediatype": "JPEG image file",
            "@type": "IMAGE-DOWNSAMPLED",
            "@size": "26146",
            "@ref": "gr2",
            "@mimetype": "image/jpeg"
          },
          {
            "@category": "standard",
            "@height": "335",
            "@width": "395",
            "@_fa": "true",
            "$": "https://api.elsevier.com/content/object/eid/1-s2.0-S0926860X14001938-gr11.jpg?httpAccept=%2A%2F%2A",
            "@multimediatype": "JPEG image file",
            "@type": "IMAGE-DOWNSAMPLED",
            "@size": "35992",
            "@ref": "gr11",
            "@mimetype": "image/jpeg"
          },
          {
            "@category": "standard",
            "@height": "310",
            "@width": "395",
            "@_fa": "true",
            "$": "https://api.elsevier.com/content/object/eid/1-s2.0-S0926860X14001938-gr10.jpg?httpAccept=%2A%2F%2A",
            "@multimediatype": "JPEG image file",
            "@type": "IMAGE-DOWNSAMPLED",
            "@size": "29044",
            "@ref": "gr10",
            "@mimetype": "image/jpeg"
          },
          {
            "@category": "standard",
            "@height": "665",
            "@width": "657",
            "@_fa": "true",
            "$": "https://api.elsevier.com/content/object/eid/1-s2.0-S0926860X14001938-gr1.jpg?httpAccept=%2A%2F%2A",
            "@multimediatype": "JPEG image file",
            "@type": "IMAGE-DOWNSAMPLED",
            "@size": "109551",
            "@ref": "gr1",
            "@mimetype": "image/jpeg"
          },
          {
            "@category": "standard",
            "@height": "95",
            "@width": "500",
            "@_fa": "true",
            "$": "https://api.elsevier.com/content/object/eid/1-s2.0-S0926860X14001938-fx1.jpg?httpAccept=%2A%2F%2A",
            "@multimediatype": "JPEG image file",
            "@type": "IMAGE-DOWNSAMPLED",
            "@size": "11364",
            "@ref": "fx1",
            "@mimetype": "image/jpeg"
          },
          {
            "@category": "thumbnail",
            "@height": "164",
            "@width": "190",
            "@_fa": "true",
            "$": "https://api.elsevier.com/content/object/eid/1-s2.0-S0926860X14001938-gr9.sml?httpAccept=%2A%2F%2A",
            "@multimediatype": "GIF image file",
            "@type": "IMAGE-THUMBNAIL",
            "@size": "7522",
            "@ref": "gr9",
            "@mimetype": "image/gif"
          },
          {
            "@category": "thumbnail",
            "@height": "164",
            "@width": "192",
            "@_fa": "true",
            "$": "https://api.elsevier.com/content/object/eid/1-s2.0-S0926860X14001938-gr8.sml?httpAccept=%2A%2F%2A",
            "@multimediatype": "GIF image file",
            "@type": "IMAGE-THUMBNAIL",
            "@size": "7165",
            "@ref": "gr8",
            "@mimetype": "image/gif"
          },
          {
            "@category": "thumbnail",
            "@height": "164",
            "@width": "200",
            "@_fa": "true",
            "$": "https://api.elsevier.com/content/object/eid/1-s2.0-S0926860X14001938-gr7.sml?httpAccept=%2A%2F%2A",
            "@multimediatype": "GIF image file",
            "@type": "IMAGE-THUMBNAIL",
            "@size": "7510",
            "@ref": "gr7",
            "@mimetype": "image/gif"
          },
          {
            "@category": "thumbnail",
            "@height": "164",
            "@width": "211",
            "@_fa": "true",
            "$": "https://api.elsevier.com/content/object/eid/1-s2.0-S0926860X14001938-gr6.sml?httpAccept=%2A%2F%2A",
            "@multimediatype": "GIF image file",
            "@type": "IMAGE-THUMBNAIL",
            "@size": "7866",
            "@ref": "gr6",
            "@mimetype": "image/gif"
          },
          {
            "@category": "thumbnail",
            "@height": "164",
            "@width": "193",
            "@_fa": "true",
            "$": "https://api.elsevier.com/content/object/eid/1-s2.0-S0926860X14001938-gr5.sml?httpAccept=%2A%2F%2A",
            "@multimediatype": "GIF image file",
            "@type": "IMAGE-THUMBNAIL",
            "@size": "7667",
            "@ref": "gr5",
            "@mimetype": "image/gif"
          },
          {
            "@category": "thumbnail",
            "@height": "164",
            "@width": "137",
            "@_fa": "true",
            "$": "https://api.elsevier.com/content/object/eid/1-s2.0-S0926860X14001938-gr4.sml?httpAccept=%2A%2F%2A",
            "@multimediatype": "GIF image file",
            "@type": "IMAGE-THUMBNAIL",
            "@size": "11244",
            "@ref": "gr4",
            "@mimetype": "image/gif"
          },
          {
            "@category": "thumbnail",
            "@height": "164",
            "@width": "201",
            "@_fa": "true",
            "$": "https://api.elsevier.com/content/object/eid/1-s2.0-S0926860X14001938-gr3.sml?httpAccept=%2A%2F%2A",
            "@multimediatype": "GIF image file",
            "@type": "IMAGE-THUMBNAIL",
            "@size": "6721",
            "@ref": "gr3",
            "@mimetype": "image/gif"
          },
          {
            "@category": "thumbnail",
            "@height": "164",
            "@width": "205",
            "@_fa": "true",
            "$": "https://api.elsevier.com/content/object/eid/1-s2.0-S0926860X14001938-gr2.sml?httpAccept=%2A%2F%2A",
            "@multimediatype": "GIF image file",
            "@type": "IMAGE-THUMBNAIL",
            "@size": "4471",
            "@ref": "gr2",
            "@mimetype": "image/gif"
          },
          {
            "@category": "thumbnail",
            "@height": "164",
            "@width": "193",
            "@_fa": "true",
            "$": "https://api.elsevier.com/content/object/eid/1-s2.0-S0926860X14001938-gr11.sml?httpAccept=%2A%2F%2A",
            "@multimediatype": "GIF image file",
            "@type": "IMAGE-THUMBNAIL",
            "@size": "7779",
            "@ref": "gr11",
            "@mimetype": "image/gif"
          },
          {
            "@category": "thumbnail",
            "@height": "164",
            "@width": "209",
            "@_fa": "true",
            "$": "https://api.elsevier.com/content/object/eid/1-s2.0-S0926860X14001938-gr10.sml?httpAccept=%2A%2F%2A",
            "@multimediatype": "GIF image file",
            "@type": "IMAGE-THUMBNAIL",
            "@size": "7050",
            "@ref": "gr10",
            "@mimetype": "image/gif"
          },
          {
            "@category": "thumbnail",
            "@height": "164",
            "@width": "162",
            "@_fa": "true",
            "$": "https://api.elsevier.com/content/object/eid/1-s2.0-S0926860X14001938-gr1.sml?httpAccept=%2A%2F%2A",
            "@multimediatype": "GIF image file",
            "@type": "IMAGE-THUMBNAIL",
            "@size": "5974",
            "@ref": "gr1",
            "@mimetype": "image/gif"
          },
          {
            "@category": "thumbnail",
            "@height": "42",
            "@width": "219",
            "@_fa": "true",
            "$": "https://api.elsevier.com/content/object/eid/1-s2.0-S0926860X14001938-fx1.sml?httpAccept=%2A%2F%2A",
            "@multimediatype": "GIF image file",
            "@type": "IMAGE-THUMBNAIL",
            "@size": "2284",
            "@ref": "fx1",
            "@mimetype": "image/gif"
          }
        ]
      },
      "link": {
        "@rel": "abstract",
        "@href": "https://api.elsevier.com/content/abstract/scopus_id/84898773708"
      }
    }
  }
}