{
  "metadata": {
    "title": "Hydrodesulfurization of dibenzothiophene over NiW/(SnAlPO<ce:inf loc=post>4</ce:inf>-5+Al<ce:inf loc=post>2</ce:inf>O<ce:inf loc=post>3</ce:inf>) catalyst, the tuning effect of SnAlPO<ce:inf loc=post>4</ce:inf>-5 to the desulfurization reaction pathway",
    "authors": "; ; ",
    "journal": "Applied Catalysis A: General",
    "date": "2018-08-05",
    "doi": "10.1016/j.apcata.2018.07.008",
    "abstract": "",
    "uri": "https://api.elsevier.com/content/article/pii/S0926860X18303314",
    "pii": "S0926860X18303314"
  },
  "fulltext": {
    "full-text-retrieval-response": {
      "scopus-eid": "2-s2.0-85049487238",
      "originalText": "serial JL 271346 291210 291744 291809 31 Applied Catalysis A: General APPLIEDCATALYSISAGENERAL 2018-07-04 2018-07-04 2018-07-07 2018-07-07 2020-01-24T12:54:44 1-s2.0-S0926860X18303314 S0926-860X(18)30331-4 S0926860X18303314 10.1016/j.apcata.2018.07.008 S300 S300.2 FULL-TEXT 1-s2.0-S0926860X18X0012X 2024-01-01T12:33:10.553292Z 0 0 20180805 2018 2018-07-04T16:51:41.001385Z absattachment articleinfo articletitlenorm authfirstinitialnorm authfirstsurnamenorm cid cids contenttype copyright crossmark dateloaded dateloadedtxt datesearch datesort dateupdated dco docsubtype doctype doi eid ewtransactionid hubeid indexeddate issn issnnorm itemstage itemtransactionid itemweight openaccess openarchive pg pgfirst pglast pii piinorm pubdatestart pubdatetxt pubyr sortorder srctitle srctitlenorm srctype ssids alllist content subj subheadings suppl tomb volfirst volissue volumelist webpdf webpdfpagecount yearnav figure table body mmlmath acknowledge affil articletitle auth authfirstini authfull authkeywords authlast grantnumber grantsponsor grantsponsorid highlightsabst orcid primabst ref specialabst 0926-860X 0926860X true 563 563 C Volume 563 16 137 145 137 145 20180805 5 August 2018 2018-08-05 2018 article fla © 2018 Elsevier B.V. All rights reserved. HYDRODESULFURIZATIONDIBENZOTHIOPHENEOVERNIWSNALPO45AL2O3CATALYSTTUNINGEFFECTSNALPO45DESULFURIZATIONREACTIONPATHWAY SUN H 1 Introduction 2 Experiment 2.1 Synthesis of molecular sieves 2.2 Preparation of support and catalyst 2.3 Characterization 2.4 Catalytic activity evaluation 3 Results and discussion 3.1 Characterization of molecular sieves 3.2 Characterization of catalysts 3.3 Catalytic activity evaluation 4 Conclusions Acknowledgements References SONG 2003 207 238 C CASTILLOVILLALON 2014 127 136 P MEY 2004 436 447 D LI 2006 2445 2449 H WU 2014 303 317 H HEDOIRE 2003 433 441 C CHEN 2013 47 62 W HAN 2017 58 66 W WANG 2008 153 164 H EGOROVAMARINA 2004 417 427 P HUAMINWANG 2009 31 43 R LICEA 2016 84 96 Y BATAILLE 2001 191 205 F CHEN 2016 79 88 N NAWAZ 2009 1925 1930 Z KOMATSU 2006 426 434 T HARRIS 2016 141 154 J FLAVELL 2001 620 627 W ZHAO 2008 2343 2346 Y WAGHMODE 2004 192 205 S KARTHIK 2004 15 25 M EMEIS 1993 347 354 C CONCEPCIH 1995 56 64 P AKOLEKAF 1996 4617 4621 D SHEA 1993 3143 3149 W SANCHEZSANCHEZ 2009 6833 6841 M FAN 2006 348 357 W KARTHIK 2004 15 25 M MAEKAWA 2007 238 246 H JANG 2013 240 248 H FANG 2012 670 676 H CORMA 1994 569 574 J ZHANG 2016 117 124 H HARTMANN 1999 635 663 M DING 2009 17 23 L LI 2011 75 82 H PAWELEC 1996 307 322 B FAN 2011 27 35 Y BENDEZU 2000 47 60 S QIU 2010 3412 3416 L PAWELEC 2001 295 307 B ZUO 2004 751 760 D XU 2017 839 850 J PIMERZIN 2015 396 407 A VRADMAN 2001 47 54 L NIKULSHIN 2015 374 384 P DAAGE 1994 414 427 M BESENBACHER 2008 86 96 F ZENG 2005 59 67 S BREYSSE 2003 115 120 M SUNX2018X137 SUNX2018X137X145 SUNX2018X137XH SUNX2018X137X145XH 2020-07-07T00:00:00.000Z 2020-07-07T00:00:00.000Z http://creativecommons.org/licenses/by-nc-nd/4.0/ © 2018 Elsevier B.V. All rights reserved. 2019-03-30T17:30:23.516Z http://vtw.elsevier.com/data/voc/AddOnTypes/50.7/nlp S0926860X18303314 National Natural Science Foundation of China U1462202 21776304 National Natural Science Foundation of China http://data.elsevier.com/vocabulary/SciValFunders/501100001809 http://sws.geonames.org/1814991/ National Key R&D Program of China 2017YFB0306602 PetroChina PetroChina Company Limited http://data.elsevier.com/vocabulary/SciValFunders/501100004226 http://sws.geonames.org/1814991/ We acknowledge the funding of this project by the National Key R&D Program of China ( 2017YFB0306602 ), National Natural Science Foundation of China ( U1462202 , 21776304 ) and PetroChina . item S0926-860X(18)30331-4 S0926860X18303314 1-s2.0-S0926860X18303314 10.1016/j.apcata.2018.07.008 271346 2024-01-01T12:33:10.553292Z 2018-08-05 1-s2.0-S0926860X18303314-main.pdf https://s3-eu-west-1.amazonaws.com/prod-ucs-content-store-eu-west/content/pii:S0926860X18303314/MAIN/application/pdf/221ac746385c73440c0da955ca2f017f/main.pdf main.pdf pdf true 3287722 MAIN 9 1-s2.0-S0926860X18303314-main_1.png https://s3-eu-west-1.amazonaws.com/prod-ucs-content-store-eu-west/content/pii:S0926860X18303314/PREVIEW/image/png/a6df2def66740cd7ca6d05627fe2eccf/main_1.png main_1.png png 54665 849 656 IMAGE-WEB-PDF 1 1-s2.0-S0926860X18303314-ga1.jpg https://s3-eu-west-1.amazonaws.com/prod-ucs-content-store-eu-west/content/pii:S0926860X18303314/ga1/DOWNSAMPLED/image/jpeg/a755a45befa23b3c4ea9975c344a9b09/ga1.jpg ga1 true ga1.jpg jpg 32432 200 484 IMAGE-DOWNSAMPLED 1-s2.0-S0926860X18303314-gr1.jpg https://s3-eu-west-1.amazonaws.com/prod-ucs-content-store-eu-west/content/pii:S0926860X18303314/gr1/DOWNSAMPLED/image/jpeg/9a0f8f327a306d36e0845d8a1ea95de8/gr1.jpg gr1 gr1.jpg jpg 20446 261 339 IMAGE-DOWNSAMPLED 1-s2.0-S0926860X18303314-gr10.jpg https://s3-eu-west-1.amazonaws.com/prod-ucs-content-store-eu-west/content/pii:S0926860X18303314/gr10/DOWNSAMPLED/image/jpeg/1034c45af1eb0e2fee565b6d8d406bde/gr10.jpg gr10 gr10.jpg jpg 51097 268 715 IMAGE-DOWNSAMPLED 1-s2.0-S0926860X18303314-gr11.jpg https://s3-eu-west-1.amazonaws.com/prod-ucs-content-store-eu-west/content/pii:S0926860X18303314/gr11/DOWNSAMPLED/image/jpeg/0a5de8965261160b5b22fd586e1466a3/gr11.jpg gr11 gr11.jpg jpg 20621 209 470 IMAGE-DOWNSAMPLED 1-s2.0-S0926860X18303314-gr2.jpg https://s3-eu-west-1.amazonaws.com/prod-ucs-content-store-eu-west/content/pii:S0926860X18303314/gr2/DOWNSAMPLED/image/jpeg/c9bdc2debc80bc928841d95e2ed14694/gr2.jpg gr2 gr2.jpg jpg 28535 297 376 IMAGE-DOWNSAMPLED 1-s2.0-S0926860X18303314-gr3.jpg https://s3-eu-west-1.amazonaws.com/prod-ucs-content-store-eu-west/content/pii:S0926860X18303314/gr3/DOWNSAMPLED/image/jpeg/7b1010f37cc37b16dae175a146ced011/gr3.jpg gr3 gr3.jpg jpg 19839 262 339 IMAGE-DOWNSAMPLED 1-s2.0-S0926860X18303314-gr4.jpg https://s3-eu-west-1.amazonaws.com/prod-ucs-content-store-eu-west/content/pii:S0926860X18303314/gr4/DOWNSAMPLED/image/jpeg/b1d30f9a9f39267de6c37f4ea581fd1d/gr4.jpg gr4 gr4.jpg jpg 21690 270 339 IMAGE-DOWNSAMPLED 1-s2.0-S0926860X18303314-gr5.jpg https://s3-eu-west-1.amazonaws.com/prod-ucs-content-store-eu-west/content/pii:S0926860X18303314/gr5/DOWNSAMPLED/image/jpeg/f9394c2a5ffda759db8cb9c03ea56175/gr5.jpg gr5 gr5.jpg jpg 31977 259 339 IMAGE-DOWNSAMPLED 1-s2.0-S0926860X18303314-gr6.jpg https://s3-eu-west-1.amazonaws.com/prod-ucs-content-store-eu-west/content/pii:S0926860X18303314/gr6/DOWNSAMPLED/image/jpeg/594a1444a27a46a61eec56f2534af14e/gr6.jpg gr6 gr6.jpg jpg 119644 546 715 IMAGE-DOWNSAMPLED 1-s2.0-S0926860X18303314-gr7.jpg https://s3-eu-west-1.amazonaws.com/prod-ucs-content-store-eu-west/content/pii:S0926860X18303314/gr7/DOWNSAMPLED/image/jpeg/2a2e352d8a54c41da6450fc9797da9f9/gr7.jpg gr7 gr7.jpg jpg 28393 261 339 IMAGE-DOWNSAMPLED 1-s2.0-S0926860X18303314-gr8.jpg https://s3-eu-west-1.amazonaws.com/prod-ucs-content-store-eu-west/content/pii:S0926860X18303314/gr8/DOWNSAMPLED/image/jpeg/24c36f75a5930fa3c6e6aaf36b61391f/gr8.jpg gr8 gr8.jpg jpg 71072 269 715 IMAGE-DOWNSAMPLED 1-s2.0-S0926860X18303314-gr9.jpg https://s3-eu-west-1.amazonaws.com/prod-ucs-content-store-eu-west/content/pii:S0926860X18303314/gr9/DOWNSAMPLED/image/jpeg/31d8470f9001c3d70772fec4f299086a/gr9.jpg gr9 gr9.jpg jpg 85225 377 565 IMAGE-DOWNSAMPLED 1-s2.0-S0926860X18303314-ga1.sml https://s3-eu-west-1.amazonaws.com/prod-ucs-content-store-eu-west/content/pii:S0926860X18303314/ga1/THUMBNAIL/image/gif/16d849536f7d7fd44d5e550a7e340de5/ga1.sml ga1 true ga1.sml sml 11131 90 219 IMAGE-THUMBNAIL 1-s2.0-S0926860X18303314-gr1.sml https://s3-eu-west-1.amazonaws.com/prod-ucs-content-store-eu-west/content/pii:S0926860X18303314/gr1/THUMBNAIL/image/gif/67372de0273fbd62daee130a1a324152/gr1.sml gr1 gr1.sml sml 7073 164 213 IMAGE-THUMBNAIL 1-s2.0-S0926860X18303314-gr10.sml https://s3-eu-west-1.amazonaws.com/prod-ucs-content-store-eu-west/content/pii:S0926860X18303314/gr10/THUMBNAIL/image/gif/eb8065035848700621ac891a03e2777e/gr10.sml gr10 gr10.sml sml 7259 82 219 IMAGE-THUMBNAIL 1-s2.0-S0926860X18303314-gr11.sml https://s3-eu-west-1.amazonaws.com/prod-ucs-content-store-eu-west/content/pii:S0926860X18303314/gr11/THUMBNAIL/image/gif/d042c89258fbf2037f7135f46761ad57/gr11.sml gr11 gr11.sml sml 4355 97 219 IMAGE-THUMBNAIL 1-s2.0-S0926860X18303314-gr2.sml https://s3-eu-west-1.amazonaws.com/prod-ucs-content-store-eu-west/content/pii:S0926860X18303314/gr2/THUMBNAIL/image/gif/43f7767bef505e9b03e74978f83b24f4/gr2.sml gr2 gr2.sml sml 7914 164 207 IMAGE-THUMBNAIL 1-s2.0-S0926860X18303314-gr3.sml https://s3-eu-west-1.amazonaws.com/prod-ucs-content-store-eu-west/content/pii:S0926860X18303314/gr3/THUMBNAIL/image/gif/e5d46d28add2f5aba7d01460d727dc5c/gr3.sml gr3 gr3.sml sml 7077 164 212 IMAGE-THUMBNAIL 1-s2.0-S0926860X18303314-gr4.sml https://s3-eu-west-1.amazonaws.com/prod-ucs-content-store-eu-west/content/pii:S0926860X18303314/gr4/THUMBNAIL/image/gif/2076f05d4543ace283d5cbbeacda5539/gr4.sml gr4 gr4.sml sml 6791 164 206 IMAGE-THUMBNAIL 1-s2.0-S0926860X18303314-gr5.sml https://s3-eu-west-1.amazonaws.com/prod-ucs-content-store-eu-west/content/pii:S0926860X18303314/gr5/THUMBNAIL/image/gif/79e2a57e24ff8472aba93793c596bb1a/gr5.sml gr5 gr5.sml sml 11887 164 215 IMAGE-THUMBNAIL 1-s2.0-S0926860X18303314-gr6.sml https://s3-eu-west-1.amazonaws.com/prod-ucs-content-store-eu-west/content/pii:S0926860X18303314/gr6/THUMBNAIL/image/gif/1d979edb666563bada0765b3fb113611/gr6.sml gr6 gr6.sml sml 14592 164 214 IMAGE-THUMBNAIL 1-s2.0-S0926860X18303314-gr7.sml https://s3-eu-west-1.amazonaws.com/prod-ucs-content-store-eu-west/content/pii:S0926860X18303314/gr7/THUMBNAIL/image/gif/bfd453c9715d2121b6994a03d24711e1/gr7.sml gr7 gr7.sml sml 10178 164 213 IMAGE-THUMBNAIL 1-s2.0-S0926860X18303314-gr8.sml https://s3-eu-west-1.amazonaws.com/prod-ucs-content-store-eu-west/content/pii:S0926860X18303314/gr8/THUMBNAIL/image/gif/90582e98d96ebec13c42601c5d4c2fd9/gr8.sml gr8 gr8.sml sml 8898 82 219 IMAGE-THUMBNAIL 1-s2.0-S0926860X18303314-gr9.sml https://s3-eu-west-1.amazonaws.com/prod-ucs-content-store-eu-west/content/pii:S0926860X18303314/gr9/THUMBNAIL/image/gif/7ea49f431280f5712d8d963e2a3dd0c0/gr9.sml gr9 gr9.sml sml 16148 146 219 IMAGE-THUMBNAIL 1-s2.0-S0926860X18303314-ga1_lrg.jpg https://s3-eu-west-1.amazonaws.com/prod-ucs-content-store-eu-west/content/pii:S0926860X18303314/ga1/HIGHRES/image/jpeg/8ed7bb6851077800a0ff640a4ff13b6a/ga1_lrg.jpg ga1 true ga1_lrg.jpg jpg 353728 886 2146 IMAGE-HIGH-RES 1-s2.0-S0926860X18303314-gr1_lrg.jpg https://s3-eu-west-1.amazonaws.com/prod-ucs-content-store-eu-west/content/pii:S0926860X18303314/gr1/HIGHRES/image/jpeg/d201ca9600d76cc5d08b61e959418424/gr1_lrg.jpg gr1 gr1_lrg.jpg jpg 160534 1155 1500 IMAGE-HIGH-RES 1-s2.0-S0926860X18303314-gr10_lrg.jpg https://s3-eu-west-1.amazonaws.com/prod-ucs-content-store-eu-west/content/pii:S0926860X18303314/gr10/HIGHRES/image/jpeg/a018adc63327baf8b231693c587ece89/gr10_lrg.jpg gr10 gr10_lrg.jpg jpg 460589 1185 3167 IMAGE-HIGH-RES 1-s2.0-S0926860X18303314-gr11_lrg.jpg https://s3-eu-west-1.amazonaws.com/prod-ucs-content-store-eu-west/content/pii:S0926860X18303314/gr11/HIGHRES/image/jpeg/7797b8333042e35ce731639627dc8fad/gr11_lrg.jpg gr11 gr11_lrg.jpg jpg 154484 925 2083 IMAGE-HIGH-RES 1-s2.0-S0926860X18303314-gr2_lrg.jpg https://s3-eu-west-1.amazonaws.com/prod-ucs-content-store-eu-west/content/pii:S0926860X18303314/gr2/HIGHRES/image/jpeg/bd376a6b662ce259c1f28ed3f6e8b8a7/gr2_lrg.jpg gr2 gr2_lrg.jpg jpg 229726 1318 1667 IMAGE-HIGH-RES 1-s2.0-S0926860X18303314-gr3_lrg.jpg https://s3-eu-west-1.amazonaws.com/prod-ucs-content-store-eu-west/content/pii:S0926860X18303314/gr3/HIGHRES/image/jpeg/3c3a385db37d0f5397a58abc10532f62/gr3_lrg.jpg gr3 gr3_lrg.jpg jpg 161286 1161 1500 IMAGE-HIGH-RES 1-s2.0-S0926860X18303314-gr4_lrg.jpg https://s3-eu-west-1.amazonaws.com/prod-ucs-content-store-eu-west/content/pii:S0926860X18303314/gr4/HIGHRES/image/jpeg/d910aaff3986e9564ebd15662c25a6f0/gr4_lrg.jpg gr4 gr4_lrg.jpg jpg 163879 1194 1500 IMAGE-HIGH-RES 1-s2.0-S0926860X18303314-gr5_lrg.jpg https://s3-eu-west-1.amazonaws.com/prod-ucs-content-store-eu-west/content/pii:S0926860X18303314/gr5/HIGHRES/image/jpeg/fe6264e6ec5db8e7e5025ca57aedb932/gr5_lrg.jpg gr5 gr5_lrg.jpg jpg 291414 1145 1500 IMAGE-HIGH-RES 1-s2.0-S0926860X18303314-gr6_lrg.jpg https://s3-eu-west-1.amazonaws.com/prod-ucs-content-store-eu-west/content/pii:S0926860X18303314/gr6/HIGHRES/image/jpeg/91687a309548bbc357c78de980e2284e/gr6_lrg.jpg gr6 gr6_lrg.jpg jpg 888437 2420 3167 IMAGE-HIGH-RES 1-s2.0-S0926860X18303314-gr7_lrg.jpg https://s3-eu-west-1.amazonaws.com/prod-ucs-content-store-eu-west/content/pii:S0926860X18303314/gr7/HIGHRES/image/jpeg/6af8eec6ae90ee105bbe2a01f3843c58/gr7_lrg.jpg gr7 gr7_lrg.jpg jpg 230736 1155 1500 IMAGE-HIGH-RES 1-s2.0-S0926860X18303314-gr8_lrg.jpg https://s3-eu-west-1.amazonaws.com/prod-ucs-content-store-eu-west/content/pii:S0926860X18303314/gr8/HIGHRES/image/jpeg/cc6669d72958874325116359c8c8b269/gr8_lrg.jpg gr8 gr8_lrg.jpg jpg 574881 1191 3167 IMAGE-HIGH-RES 1-s2.0-S0926860X18303314-gr9_lrg.jpg https://s3-eu-west-1.amazonaws.com/prod-ucs-content-store-eu-west/content/pii:S0926860X18303314/gr9/HIGHRES/image/jpeg/41e98d7bc422d1ef322b20ff65d5149a/gr9_lrg.jpg gr9 gr9_lrg.jpg jpg 1545866 1667 2500 IMAGE-HIGH-RES 1-s2.0-S0926860X18303314-si1.gif https://s3-eu-west-1.amazonaws.com/prod-ucs-content-store-eu-west/content/pii:S0926860X18303314/STRIPIN/image/gif/329e923e3995c55e8f8c13762ffab121/si1.gif si1 si1.gif gif 147 31 27 ALTIMG 1-s2.0-S0926860X18303314-si2.gif https://s3-eu-west-1.amazonaws.com/prod-ucs-content-store-eu-west/content/pii:S0926860X18303314/STRIPIN/image/gif/da3339d895e861ca055dfdf88c25db98/si2.gif si2 si2.gif gif 173 31 31 ALTIMG 1-s2.0-S0926860X18303314-si3.gif https://s3-eu-west-1.amazonaws.com/prod-ucs-content-store-eu-west/content/pii:S0926860X18303314/STRIPIN/image/gif/ffbd111d85e2f304d4995714b69a0ad1/si3.gif si3 si3.gif gif 532 80 95 ALTIMG 1-s2.0-S0926860X18303314-si4.gif https://s3-eu-west-1.amazonaws.com/prod-ucs-content-store-eu-west/content/pii:S0926860X18303314/STRIPIN/image/gif/55ce7be75b5669123f59f6354d88df5a/si4.gif si4 si4.gif gif 577 80 102 ALTIMG 1-s2.0-S0926860X18303314-si5.gif https://s3-eu-west-1.amazonaws.com/prod-ucs-content-store-eu-west/content/pii:S0926860X18303314/STRIPIN/image/gif/9009fb0f3b0eb54417528deeb475489c/si5.gif si5 si5.gif gif 899 84 157 ALTIMG APCATA 16734 S0926-860X(18)30331-4 10.1016/j.apcata.2018.07.008 Elsevier B.V. Fig. 1 Powder XRD patterns of the calcined samples. Fig. 1 Fig. 2 31P and 27Al MAS-NMR spectra of the calcined samples. Fig. 2 Fig. 3 The NH3-TPD curves of the samples. Fig. 3 Fig. 4 Effects of the samples on IR spectra of adsorbed pyridine at 150 °C. Fig. 4 Fig. 5 The powder XRD patterns of the NiW catalysts: (*) the peaks of AFI topology and (#) peaks of γ-Al2O3. Fig. 5 Fig. 6 XPS Ni2p spectra of sulfurized catalysts. Fig. 6 Fig. 7 XPS S2p spectra of different sulfurized catalysts. Fig. 7 Fig. 8 XPS W4f spectra of oxidation and sulfurized catalysts: (a) Oxidation and (b) sulfurized. Fig. 8 Fig. 9 Transmission electron micrographs of (a) NiW/(AlPO4-5+Al2O3), (b) NiW/(Sn0.06AlPO4-5 +Al2O3), (c) NiW/(Sn0.12AlPO4-5+Al2O3) and (d) NiW/(SnO2/AlPO4-5 +Al2O3). Fig. 9 Fig. 10 Distribution of slab lengths (a) and stacking number (b) of WS2 particles of the four sulfide catalysts. Fig. 10 Fig. 11 The reaction network for the HDS of DBT. Fig. 11 Table 1 Composition and Textural properties of the four molecular sieves. Table 1 Samples AlPO4-5 Sn0.06AlPO4-5 Sn0.12AlPO4-5 SnO2/AlPO4-5 Sn a – 0.5 1.0 1.0 Al a 52.5 51.3 49.9 52.0 P a 47.5 48.2 49.1 47.0 Sn/Al a ×10−2 – 1.0 2.0 2.0 Sn b – 0.8 1.3 1.5 Al b 52.2 51.9 51.4 51.5 P b 47.8 47.3 47.3 47.0 Sn/Al b ×10−2 – 1.5 2.6 2.9 SBET (m2/g) 267 251 219 230 SEXT (m2/g) 56 33 27 19 Vtotal (cm3/g) 0.260 0.181 0.171 0.201 Vmicro (cm3/g) 0.104 0.107 0.094 0.103 Vmeso (cm3/g) 0.156 0.074 0.077 0.099 Crystallinity c (%) 100 98 89 95 a Results obtained from XRF, mol%. b Results obtained from XPS, mol%. c Results obtained from XRD, %. Table 2 Brønsted acid (B), Lewis acid (L) and Total acid of four molecular sieves. Table 2 Molecular sieves Weak acid sites(μmol/g) Medium and strong acid sites(μmol/g) Total acid amount (μmol/g) L B L B AlPO4-5 51 0 0 0 51 Sn0.06AlPO4-5 100 9 10 0 119 Sn0.12AlPO4-5 131 14 17 0 162 SnO2/AlPO4-5 63 4 4 0 67 Table 3 Composition and textural properties of four NiW catalysts. Table 3 Catalysts Textural properties Metal content in the catalysts(wt%) SBET(m2/g) VTotal(cm3/g) NiO WO3 Support a NiW/(AlPO4-5+Al2O3) 152 0.181 4.0 27.0 69.0 NiW/(Sn0.06AlPO4-5+Al2O3) 148 0.172 4.0 27.0 69.0 NiW/(Sn0.12AlPO4-5+Al2O3) 149 0.170 4.0 27.0 69.0 NiW/(SnO2/AlPO4-5 +Al2O3) 147 0.175 4.0 27.0 69.0 a Alumina: molecular sieve = 7:3. Table 4 The acid type of the four catalysts. Table 4 Catalysts Weak acid sites(μmol/g) Medium and strong acid sites(μmol/g) Total acid amount (μmol/g) L B L B NiW/(AlPO4-5+Al2O3) 49 15 30 0 94 NiW/(Sn0.06AlPO4-5+Al2O3) 67 17 38 0 122 NiW/(Sn0.12AlPO4-5+Al2O3) 71 19 44 1 135 NiW/(SnO2/AlPO4-5+Al2O3) 53 16 35 0 104 Table 5 Surface species distribution of oxide and sulfided catalysts. Table 5 Catalysts NiW/(AlPO4-5+Al2O3) NiW/(Sn0.06AlPO4-5 +Al2O3) NiW/(Sn0.12AlPO4-5+Al2O3) NiW/(SnO2/AlPO4-5 +Al2O3) Oxide state Ni2p3/2 856.1 856.1 856.2 856.3 Ni2p1/2 873.7 873.9 873.6 874.0 Surface species distribution W/P + Al 0.068 0.071 0.088 0.082 Ni/P + Al 0.032 0.034 0.041 0.043 W/Ni 2.17 2.08 2.17 1.90 Sulfide state Surface species distribution W/Al + P 0.074 0.063 0.069 0.078 Ni/Al + P 0.047 0.038 0.040 0.042 W/Ni 1.58 1.64 1.60 1.86 S/Ni + W 1.34 1.45 1.49 1.44 Wsulfidation a (%) 36.5 37.2 38.5 25.4 L ¯ b (nm) 2.93 2.96 3.28 3.00 N ¯ b 1.80 2.41 2.48 1.71 fW b 0.32 0.37 0.47 0.35 a Wsulfidation a(%): the atomic ratio of W4+/(W4++W5++W6+). b Obtained from TEM. Table 6 Results of DBT HDS on four NiW catalysts and the path selectivity of HYD and DDS. Table 6 HDS rate of DBT(%) NiW/(AlPO4-5+Al2O3) NiW/(Sn0.06AlPO4-5+Al2O3) NiW/(Sn0.12AlPO4-5+Al2O3) NiW/(SnO2/AlPO4-5 +Al2O3) 260 °C 22.4 26.0 44.1 24.8 280 °C 49.6 71.9 82.2 60.7 300 °C 83.8 96.1 98.2 93.7 BP a 40.5 45.3 46.7 41.3 THDBT+HHDBT a 4.9 4.4 4.1 2.9 CHB a 49.7 47.6 46.6 53.5 BCH a 4.9 2.7 2.6 2.3 HYD/DDS a 1.47 1.21 1.14 1.42 a Determined at approximately 50% of total HDS rate by changing the LHSV at 280 °C. Hydrodesulfurization of dibenzothiophene over NiW/(SnAlPO4-5+Al2O3) catalyst, the tuning effect of SnAlPO4-5 to the desulfurization reaction pathway Houxiang Sun Qian Wang Xinyue Zhang Qianqian Yu Lei Li Yandan Wang Baojian Shen ⁎ The Key Laboratory of Catalysis of CNPC, College of Chemical Engineering, China University of Petroleum, Beijing, 102249, China The Key Laboratory of Catalysis of CNPC College of Chemical Engineering China University of Petroleum Beijing 102249 China ⁎ Corresponding author. Graphical abstract SnAlPO4-5 molecular sieves were hydrothermally synthesized using SnCl2·2H2O as the tin source, and were verified that divalent tin was incorporated into the framework by isomorphous substitution of trivalent aluminum, and increasing the numbers of Brønsted and Lewis acid sites relative to those in AlPO4-5. The molecular sieves were used to fabricate hybrid supports with alumina and then were loaded with active metals to obtain NiW catalysts. The hydrodesulfurization (HDS) of dibenzothiophene (DBT) were evaluated for the catalytic activity of the catalysts. Because of the higher number of weak acid sites, much greater average number of slab layers and higher dispersion of WS2, the HDS rate of DBT at 280 °C is improved from 49.6% for the NiW/(AlPO4-5+Al2O3) catalyst to 82.2% for the NiW/(Sn0.12AlPO4-5+Al2O3) catalyst. Moreover, the highly active NiW/(Sn0.12AlPO4-5+Al2O3) catalyst obviously increases the product of the direct desulfurization route in the DBT HDS, which is beneficial for reducing hydrogen consumption in the industrial applications. Keywords AlPO4-5 Tin Isomorphous substitution Acidic sites Hydrodesulfurization Supports 1 Introduction Hydrodesulfurization (HDS) is an important process for the industrial production of clean fuels [1]. Industrial HDS catalysts are prepared from cobalt or tungsten and nickel or molybdenum in alumina. To meet the demand for clean fuel, an intense research effort is currently devoted to the design of novel HDS catalysts for both the support and active phase of the catalysts [2,3]. Regarding the supports, many zeolites have been studied as substitutes of pure alumina support in HDS catalysts [4–6]. The presence of acid sites in the support is beneficial for the catalytic activity of the HDS catalyst [7]. Mey et al. [3] reported that the catalytic performance of the HDS catalyst is related to the acidity of the support. Han et al. [8] proved that Brønsted acid sites of the support further enhanced the HDS performance and helped the catalysts to exhibit a certain isomerization activity. It is well-known that the DBT of HDS have two main pathways [9–11]: namely, the hydrogenation (HYD) route, and the direct desulfurization (DDS) route. Licea et al. [12] proved that an increasing proportion of tungsten favored the hydrogenation of DBT HDS in unsupported Ni(Co)-Mo-W sulfide catalysts. Bataille et al. [13] reviewed CoMo and Mo catalysts supported on zeolite. The activity of Mo/zeolite and production of DDS were higher than those of Mo/Al2O3. This results clearly shows that the support plays an important role in the effect of HDS pathway. As we all known, tin and silicon are both group IV A elements and have similar properties. Many articles have reported that the PtSn catalysts supported on molecular sieves exhibited high catalytic activity [14,15]. Komatsu et al. [16] reviewed that the Pt-Sn catalyst supported on H-SAPO-11 has high selectivity in the dehydroisomerization of butane. The addition of tin in Pt catalysts based on molecular sieves has a positive effect on the hydrogenation reaction. Tin also has been incorporated in different molecular sieves [17,18] and used in different catalytic reactions. Most of the reports in the literature are on the investigations of SnPt catalysts and tin-molecular sieves. However, the direct proof of the existence of tin used in the HDS reaction has not been provided in the literature. The application of molecular sieves containing tin in the HDS reaction has also been rarely reported. Zhao et al. [19] proved that the catalysts of NiW loaded AlPO4-5 and ETS-10 have a positive synergistic effect in the HDA and HDS of Daqing FCC diesel feedstock. However, the acidity and reactivity of AlPO4-5 with alternating AlO4 and PO4 tetrahedral are still restricted by the neutral framework, leading to an inadequate number of active sites [20]. In this work, to improve the catalytic activity of HDS catalysts, SnAlPO4-5 molecular sieves were prepared with a conventional hydrothermal synthesis, and used to manufacture the hybrid support of NiW catalysts with alumina. The NiW catalysts were widely characterized and evaluated in the HDS of DBT. The NiW catalysts supported on hybrid SnAlPO4-5-alumina exhibit a notable HDS activity. 2 Experiment 2.1 Synthesis of molecular sieves SnAlPO4-5 molecular sieve was hydrothermally synthesized using deionized water, pseudo–boehmite (Al2O3, 69.5%, Aluminum Corporation of China Limited), phosphoric acid (H3PO4, 85.0%, Tianjin Guangfu Fing Chemical Research Institute), two hydrated stannous chloride (SnCl2·2H2O, 99.0%, Tianjin Guangfu Fing Chemical Research Institute) and triethylamine (Et3N, 99.0%, Tianjin Guangfu Fing Chemical Research Institute) as a structure directing agent from a gel with following chemical composition: ySnO: (1-y/2)Al2O3: 1.06P2O5: 1.47Et3N: 45H2O (y = 0.06 and 0.12). The hybrid gel was typically crystallized at 180 °C for 24 h. The as-synthesized solids were filtered, washed with deionized water, and further dried at 120 °C. Then, samples were calcined at 350 °C for 2 h and 550 °C for 6 h under an air atmosphere before being characterized, and were denoted as Sn0.06AlPO4-5 and Sn0.12AlPO4-5, respectively. The SnO2/AlPO4-5 molecular sieve was prepared from SnCl2·2H2O and AlPO4-5 by the incipient-wetness impregnation. The tin content was equivalent to that of tin in the Sn0.12AlPO4-5 determined by the XRF. After the impregnation, the sample was calcined at 550 °C for 4 h. 2.2 Preparation of support and catalyst The hybrid supports (AlPO4-5+Al2O3, Sn0.06AlPO4-5+Al2O3, Sn0.12AlPO4-5+Al2O3 and SnO2/AlPO4-5+Al2O3) were prepared by mi xing AlPO4-5 or other molecular sieves (30 wt%) with Al2O3 (70 wt%), followed by extruding, drying, calcining at 550 °C for 4 h. The four catalysts with the same loading content of WO3 (27.0 wt%) and NiO (4.0 wt%) were prepared by incipient wetness impregnation with an aqueous solution of the appropriate amount of ammonium metatungstate pentahydrate ((NH4)6H2W12O40·40H2O, 85.0%, Tianjin Guangfu Fing Chemical Research Institute) and nickel nitrate hexahydrate (Ni(NO3)2·6H2O, 98.0%, Tianjin Guangfu Fing Chemical Research Institute), dried naturally, then dried at 120 °C for 8 h and calcined 480 °C for 4 h. The catalysts were denoted as NiW/(AlPO4-5+Al2O3), NiW/(Sn0.06AlPO4-5+Al2O3), NiW/(Sn0.12AlPO4-5+Al2O3), and NiW/(SnO2/AlPO4-5+Al2O3), respectively. 2.3 Characterization The X-ray diffraction (XRD) pattern was obtained using a PANalytical X’Pert Powder X-ray diffractometer with Cu Kα radiation at 40 mA and 40 kV. The samples were scanned with the step size of 0.013° and at the rate of 30 s for per step. The nitrogen physisorption measurements were determined using a Micromeritics TriStar 3020 apparatus. Prior to the measurement, the samples were degassed under vacuum (P<10−2 kPa) at 350 °C for 8 h. The t-plot methods and Brunauer-Emmet-Teller (BET) were used to measure the pore volume and the specific surface area, respectively. The contents of bulk elements of the molecular sieves was measured by X-ray fluorescence (XRF) with an AxiosmAX spectrometer. For analysis, the sample powder (2 g) was pressed into a self-supporting disk (8.04 cm2) at 30 MPa for 30 s. The surface compositions of the molecular sieves, the oxidation state and sulfide catalysts were investigated by X-ray photoelectron spectroscopy (XPS) with a Thermo Fisher K-Alpha spectrometer using Al Kα radiation (hv = 1486.6 eV). For the oxidation state and sulfide catalysts investigations, signals for the Ni2p, W4f, P2p, Al2p, S2p and Sn3d bands were recorded. The 27Al and 31P MAS NMR spectra were obtained on a Bruker-400 NMR spectrometer at 104 and 161.9 MHz, respectively. Acidity of the samples were determined by ammonia temperature desorption (NH3-TPD) using a Micromeritics Autochem 2920 instrument. For analysis, the sample (0.2000 g) was outgassed under a He flow with the heating rate (15 °C min−1) up to 600 °C and then maintained for 30 min. After cooling down to below 100 °C, an NH3 flow was passed over the sample, and then, the temperature was increased to 100 °C and maintained for 30 min to desorb the physically adsorbed NH3. The chemically adsorbed NH3 was detected by increasing the temperature from 100 °C to 600 °C at the heating rate (10 °C min−1). The NH3 desorption profile was measured using a thermal conductivity detector. The transmission electron microscopy (TEM) micrographs of the sulfide phase were determined on an FEI F20 microscope at 200 kV. At least 50 micrographs of each catalyst were obtained. The stacking number and the slab length were obtained by measuring at least 300 slabs per catalyst. FT-IR spectra of pyridine were obtained using a Thermo Fisher Nicolet IS10 spectrometer with the spectral resolution of 4 cm−1. After the molecular sieve were compressed into a self-supported wafer, the wafer was set in a quartz cell. The cell was connected to a vacuum system. The wafer was heated and degassed in a pressure-tight cell at 400 °C for 2 h to remove any water in the material. Then, the wafer was cooled down to room temperature and treated with pyridine vapor for 15 min so that adsorption saturation occurred. The FT-IR spectra of the wafer were acquired at room temperature after the desorption of pyridine [21] at 150 °C for 2 h and at 300 °C for 2 h under the dynamic vacuum. The amount of Brønsted and Lewis acids were calculated according to [22]: Cpy-B  = 1.88ABR 2/m and Cpy-L  = 1.42ALR 2/m Where Cpy-B and Cpy-L are the Brønsted acid and Lewis acid amounts (mmol/g), respectively. AB and AL are the absorbance area of Brønsted and Lewis acids (cm−1), respectively. m is the amount of the wafer (mg), and R is the radius of the wafer (cm). 2.4 Catalytic activity evaluation The catalytic performance was tested in a continuous-flow fixed bed micro-reactor with the internal diameter of 10.0 mm. For the catalytic test, the oxide catalyst (1.00 g, 40–60 mesh) was placed into the constant temperature zone of the reactor and was then activated by sulfidation with a decane (98%, Tianjin Guangfu Fing Chemical Research Institute) solution containing 10 vt% CS2 (98%, Tianjin Guangfu Fing Chemical Research Institute) at 320 °C and hydrogen pressure (4.0 MPa) for 4 h. The synthetic feed was charged into the reactor containing 1000 μg/g S (DBT, 98%, Tianjin Guangfu Fing Chemical Research Institute). The catalytic reaction was controlled at 260∼320 °C, pressure 4.0 MPa, H2/oil ratio of 300 (v/v) and a feed WHSV of 8.76 h−1. During each run, the products were periodically sampled and analyzed by the ultraviolet florescence method using an RPP-2000 SN spectroscopymeter. The HDS rate was defined as follows: RDBT = (1 − CS/CS0)×100% where RDBT is the total HDS rate of DBT, respectively. CS is the total sulfur content of the corresponding product and CS0 is the total sulfur content of the corresponding feed. 3 Results and discussion 3.1 Characterization of molecular sieves Fig. 1 shows the XRD patterns of the SnAlPO4-5 molecular sieves. It can be clearly seen that all the samples have the AFI structure [23] with a high crystallinity (Table 1 ). No pattern of tin oxides phases is presented, which may be due to the low loading of tin oxide, its high distribution or the tin present in the framework. Another possibility is that the presence of amorphous (non-crystalline) phases may be responsible for the absence of the diffraction patterns of crystalline tin oxides. The surface areas of AlPO4-5, Sn0.06AlPO4-5, Sn0.12AlPO4-5 and SnO2/AlPO4-5 are 267, 251, 219 and 230 m2/g (Table 1), respectively. The AlPO4-5 exhibits the highest pore volume and surface area. Compared to that of AlPO4-5, it can be seen that the pore volume and specific surface area in the SnAlPO4-5 decrease with the increased amount of tin. For SnO2/AlPO4-5, the pore volume and specific area are slightly reduced. The molar content of Al is higher than that of P for the four samples (Table 1), which is mostly likely due to the presence of some extra framework aluminum during the molecular sieve formation. Compared with pure AlPO4-5, SnAlPO4-5 has a lower Al molar content because tin replaces Al in the framework. The tin content of SnAlPO4-5 increases with the increase of tin content in the gel. The surfaces of Sn/Al atomic ratios in the SnAlPO4-5 and SnO2/AlPO4-5 are greater than that of the bulk, suggesting Sn surface enrichment. The 27Al MAS NMR spectra of four molecular sieves (Fig. 2 ) are dominated by the peak 35.2 ppm, which is attributed to Al(4 P) [24]. The 31P spectra of AlPO4-5, SnAlPO4-5 and SnO2/AlPO4-5 show a sharp peak at approximately -32 ppm, which is denoted as P(4Al) and is associated with the tetrahedral phosphorous linked to four –OAl groups [25]. Moreover, a low intense wide band (approximately -17.1 ppm) with low intensity appeared near the P (4Al) signal in SnAlPO4-5. The intensity of this signal slightly increases with the tin content increase in SnAlPO4-5, which is likely due to the existence of P(4-nAl, nSn) (n = 1–4) [26]. A similar type of observation is also made for the incorporation of other divalent metal ions incorporation into the AFI framework [27,28]. This result implies that the synthesis of SnAlPO4-5 likely proceeded via the isomorphous substitution of Sn2+ for Al3+. The NH3-TPD profiles of four samples are presented in Fig. 3 . The NH3-TPD patterns of AlPO4-5 and SnO2/AlPO4-5 only show a desorption peak at approximately 159 °C. SnAlPO4-5 molecular sieves show two desorption peaks at approximately 161 and 271 °C. The peak at approximately 271 °C may be related to the divalent tin incorporated into the framework. Similar type of observations were also reported for CoAlPO4-5 [28], ZnAlPO4-5 and MgAlPO4-5 [29]. Additionally, the acidity of SnAlPO4-5 increases obviously with the increase in tin content. The acidity of SnAlPO4-5 was higher than those of SnO2/AlPO4-5 and AlPO4-5. The FT-IR spectra of the pyridine adsorption region of four samples are displayed in Fig. 4 and Table 2 . Here, the peak at 1544 cm−1 is assigned to the pyridine adsorbed on the Brønsted acid sites [30], the absorption peaks at approximately 1448 and 1456 cm−1 are assigned to the Lewis acid sites [31] and the peak appearing at approximately 1491 cm−1 is attributed to pyridine chemisorption on both Brønsted and Lewis acid sites [32]. The pure AlPO4-5 has absent the Brønsted acid sites and only has a few Lewis acid sites (Table 2). With the increase tin in the tin content in SnAlPO4-5, the number of weak Lewis acid sites increased obviously, and the number of weak Brønsted acid sites increased slightly, similar to the effect of the isomorphous substitution of trivalent aluminum by a divalent metal in the framework of AlPO4-5 [33,34]. 3.2 Characterization of catalysts Fig. 5 shows the XRD profiles of the four oxide catalysts. The peaks with the γ-Al2O3 and AFI structures appear in all catalysts, and their intensities are virtually identical. The absence of additional peaks of any NiO and WO3 species suggests that nickel and tungsten species are evenly distributed [35]. This suggests that W and Ni oxide species are either completely amorphous or that their crystallites are too small to yield XRD signals. The four catalysts have the same content of active metal oxides (27 wt% WO3 and 4.0 wt% NiO). The hybrid supports contain the same amounts of Al2O3 (70 wt%) and of molecular sieve (30 wt%). Textural data of four NiW catalysts (Table 3 ) show that the pore volume and specific surface area are similar as well. This result indicates that the difference of the pore volume and specific surface area in the catalysts can be neglected for the catalytic activity in the HDS reaction. For the four catalysts, the acidity mainly arises from the hybrid support (alumina and molecular sieves). The four catalysts contain the same active metals and alumina, and only the molecular sieves with the content of 30 wt% are different in four hybrid supports, so that the difference in the acidities of the catalysts are mainly due to the corresponding molecular sieves. During the presulfuration process, the active metals (Ni and W) change from the oxide state into the sulfide state. The Py-IR results for the acid-type distribution of the four catalysts are presented in Table 4 . The amount of acid increases in the following order: NiW/(AlPO4-5+Al2O3) <NiW/(SnO2/AlPO4-5+Al2O3) <NiW/(Sn0.06AlPO4-5+Al2O3) <NiW/ (Sn0.12AlPO4-5+Al2O3), which is consistent with the order of the total acidity of the corresponding molecular sieves in hybrid supports. The total acidity of the catalyst NiW/(AlPO4-5+Al2O3) is greater than that of AlPO4-5 because of the greater number of acid sites in Al2O3 than that in AlPO4-5 [36]. Although the total acidities of catalyst NiW/(Sn0.06AlPO4-5+Al2O3) and NiW/(SnO2/AlPO4-5+Al2O3) (Table 2) are greater than that of AlPO4-5, they are still lower than that of alumina. The total acidity of Sn0.12AlPO4-5 is much greater than that of alumina. Therefore, with the exception of the catalyst NiW/(SnAlPO4-5+Al2O3), the total acidity of the catalyst was increased compared to those corresponding molecular sieves. Compared to the catalyst NiW/(AlPO4-5+Al2O3), the total acidity of catalyst NiW/(SnO2/AlPO4-5+Al2O3) is increased slightly. The total acidity, and the amounts of weak Brønsted and Lewis acid sites are increased obviously by the introduction of SnAlPO4-5 in the catalysts, especially for the catalyst NiW/(Sn0.12AlPO4-5+Al2O3), which is beneficial for the HDS reaction. To further investigate the distribution of active metals on the surface of the catalysts and the extent of sulfidation extent, the freshly obtained sulfide catalysts and oxide catalysts were analyzed by XPS. In the Ni2p XPS of the oxide catalysts, the two main peaks (Table 5 ) are attributed to the spin-splitting Ni 2p3/2 (approximately 856.2 eV) and 2p1/2 (approximately 873.8 eV). Fig. 6 shows the Ni2p XPS spectra of the sulfide catalysts. The peaks are associated with Ni-S (approximately 852.4 eV), Ni-W-S (approximately 854.0 eV), Ni2+ (approximately 856.5 eV) and the shakeup of Ni2+ (approximately 862.5 eV) [37]. The Ni2p peak at 852.4∼854.0 eV, together with the presence of the S2p peaks at 161.9 and 163.0 eV, are attributed to nickel sulfides. The Ni2p signal clearly shows that the existence of oxidation state Ni2+ species in the four catalysts after sulfidation [38]. Moreover, there are some electronic of Ni atoms transfer to adjacent WS2 (Ni-W-S phase). In the NiW catalysts, the existence of Ni sulfides with the Ni-W-S phases is the most active phase compared to WS2 and NiS, which has been proved in the literature [39]. The Ni species can improve the formation of tungsten sulfide in the NiW catalysts. The catalysts NiW/(SnAlPO4-5+Al2O3), especially NiW/(Sn0.12AlPO4-5+Al2O3), have more Ni-W-S species than other catalysts, indicating a higher catalytic activity. The S2p spectra (Fig. 7 ) of sulfide catalysts exhibited only one doublet peaks at approximately 161.9 and 163.0 eV, which can be attributed to S2+ 2p3/2 and 2p1/2, respectively [35,40]. No other signal around the binding energy of 169.0 eV is identified, suggesting that no oxidation of the catalysts occurred, and no sulfate species are presented during the transfer of the sulfide catalysts and the XPS measurement process. The binding energies of the W4f spectra in oxidized catalysts (Fig. 8 a) are found at approximately 37.9 and 35.7 eV, and are assigned to the signals of W4f5/2 and W4f7/2, respectively [35]. After sulfidation of catalysts (Fig. 8b), the binding energies of W4f7/2 and W4f5/2 for W6+ (WO3) are approximately 35.7 and 37.9 eV, respectively, those for W5+ (WOS) are approximately 32.8 and 34.8 eV, and those for W4+ (WS2) are approximately 32.4 and 34.4 eV [39,41]. The W4+ species is the main catalytically active sites in the NiW catalysts. The sulfidation degree (Wsulfidation) of the W species is defined as the ratio of WS2 (W4+) to the sum of WS2 (W4+), WOS (W5+), and WO3 (W6+) [42], and it can be approximately predicted by the atomic ratio of W4+/(W4++W5++W6+). The Wsulfidation (Table 5) decreases in the following order: NiW/(Sn0.12AlPO4-5+Al2O3) (38.5%)> NiW/(Sn0.06AlPO4-5+Al2O3) (37.2%)> NiW/(AlPO4-5+Al2O3) (36.5%)> NiW/(SnO2/AlPO4-5+Al2O3) (25.4%). It can be seen that the catalysts NiW/(SnAlPO4-5+Al2O3) and especially the NiW/(Sn0.12AlPO4-5+Al2O3) appear to be sulfide more easily because of the addition of SnAlPO4-5, indicating a greater content of the sulfide active phase and higher catalytic activity. Table 5 shows the surface species distributions. It can be clearly seen from the data that the surface concentrations of Ni and W relative to P + Al in the catalysts are all lower than the theoretical ratios of Ni/P + Al and W/P + Al (these theoretical ratios are equivalent to 0.048 and 0.104, respectively), suggesting that the Ni and W species are non-uniformly dispersed on the surface of support. For the oxide catalysts, the catalysts NiW/(Sn0.12AlPO4-5+Al2O3) and NiW/(SnO2/AlPO4-5+Al2O3) have higher Ni/P + Al and W/P + Al than do the other catalysts, indicating that a greater content of Ni and W is present on the surface of the Sn0.12AlPO4-5+Al2O3 and SnO2/AlPO4-5+Al2O3 supports. The use of the support Sn0.12AlPO4-5+Al2O3 leads to a higher W/Ni ratio. The surface ratios of W/Ni in the sulfurized catalysts are lower than that of the corresponding oxide catalyst. It has been proved that the W species are mainly distributed in the vacancies on the surface of the alumina and molecular sieve, while the Ni species are evenly distributed throughout the entire support [35]. During sulfidation, the surface W/Ni and W/P + Al molar ratios decreased on the catalysts with the exception of NiW/(AlPO4-5+Al2O3), and W/Ni and W/P + Al molar ratios show that the decrease in the W species amount is greater than that for the Ni species amount. During sulfidation, Ni and W species gradually changed from oxide state to sulfide state, and were rearranged [35], which caused a decrease in the apparent coverage of the supports by W because the formation of WS2 slabs by a significant lateral agglomeration of the W phase. Compared to the NiW/(AlPO4-5+Al2O3) and NiW/(SnO2/AlPO4-5+Al2O3) catalysts, the NiW/(SnAlPO4-5+Al2O3) catalysts have lower atomic ratios of W/P + Al, and Ni/P + Al despite the same metal content, suggesting that the higher dispersion of W and Ni provide more Ni–W–S active sites. Furthermore, the dispersion of Ni is restricted by that of W at a certain extent beyond which the NiSx phases would occur and be segregation [43]. Significantly, the W species are considered as the secondary support of Ni species in the NiW catalysts, so that the dispersion of Ni can be improved by the higher dispersion of W species. The sulfide active phase of the catalysts can be estimated by the ratio of S/Ni + W. The S/Ni + W (Table 5) increases in the following order: NiW/(AlPO4-5+Al2O3) (1.34)< NiW/(SnO2/AlPO4-5+Al2O3) (1.44)< NiW/(Sn0.06AlPO4-5+Al2O3) (1.45)< NiW/(Sn0.12AlPO4-5+Al2O3) (1.49), corresponding to WS2 phase formation. The results demonstrate that the NiW catalysts supported on the hybrid SnAlPO4-5-alumina contribute to the weakest tungstate-support interaction and are vulcanized more easily, indicating the easier formation of the active Ni–W–S phases. Therefore, it can be presumed that the catalysts containing SnAlPO4-5 show a higher activity in the HDS reaction. Fig. 9 shows representative TEM micrographs of the four sulfide catalysts. The TEM micrographs reveal the existence of typical WS2 slab-like structure. In the model of Ni-W-S phase, NiS is present in the alumina lattice or is located at the edges in five-fold coordinated sites at the edge planes of WS2 and is considered to be a source of promoter atoms [35]. Because of their limited presence and the good dispersion, NiS crystals are too small or less than 4 nm to be directly detected in the sulfide catalysts by TEM. According to the reports in the literature [44,45], the average slab length ( L ¯ ), number of layers ( N ¯ ) and WS2 dispersion (fw ) are calculated as follows: (1) L ¯ = ∑ i = 1 n x i L i ∑ i = 1 n x i (2) N ¯ = ∑ i = 1 n x i N i ∑ i = 1 n x i (3) f W = ∑ i = 1 t 6 n i - 6 ∑ i = 1 t 3 n i 2 - 3 n i + 1 where Ni and Li are layer number and the length of WS2 slabs in each stack, respectively, xi is the number of WS2 slabs possessing with number of layers Ni or length Li , t is the number of slabs and ni is the number of W atoms along one edge of a WS2 slab calculated using its length (L = 3.2(2ni -1)Å). The results of calculation (Table 5) show that the WS2 dispersion (f W) over the four catalysts is as follows: NiW/(Sn0.12AlPO4-5+Al2O3)> NiW/(Sn0.06AlPO4-5+Al2O3)> NiW/(SnO2/AlPO4-5+Al2O3)> NiW/(Sn0.12AlPO4-5+Al2O3). Among the four catalyst, the highest WS2 dispersion over the NiW/(Sn0.12AlPO4-5+Al2O3) catalyst can efficiently improve the Ni atom occupation on the edge sites of WS2 slabs and is beneficial for the formation of the Ni-W-S phase [46]. The distribution of the stacking number and the slab lengths of WS2 particles are shown in Fig. 10 . Compared to the NiW/(AlPO4-5+Al2O3) catalyst, both the NiW/(Sn0.06AlPO4-5+Al2O3) and NiW/(Sn0.12AlPO4-5+Al2O3) catalysts display wider distributions of the numbers of layers and the slab length. The average stacking number and the average length of the NiW catalysts supported on hybrid AlPO4-5-alumina are 1.80 and 2.93 nm, respectively. The average stacking number and the average length of the NiW catalysts supported on hybrid Sn0.12AlPO4-5-alumina are 2.48 and 3.28 nm, respectively. The average stacking numbers and the average length of NiW/(SnO2/AlPO4-5+Al2O3) are 1.71 and 3.00 nm, respectively. For the NiW/(Sn0.12AlPO4-5+Al2O3) catalyst, the distributions of stacking number and slab lengths of WS2 broaden (Fig.10). The Sn of the catalysts is contributed by the SnAlPO4-5, and the P/Al ratios of molecular sieves are almost constant. Therefore, the use of different support components (the presence and content of tin in molecular sieves) does not only lead to a difference in the crystalline phases of WS2, but also influences the degree of sulfidation. Therefore, the physicochemical properties and catalytic activity of the catalysts supported on hybrid SnAlPO4-5-alumina are likely different from that of the catalyst containing AlPO4-5 or SnO2/AlPO4-5. The average stacking number of the WS2 phase (Table 5) can be measured by the TEM, which were found to vary from 1.71 to 2.48, and the average dimensions of the WS2 crystallites varied from 2.93 to 3.28 nm. The statistical results for the NiW/(Sn0.12AlPO4-5+Al2O3) catalysts show that the WS2 slabs have an average stacking layer number of 2.48, an average length of 3.28 nm, and a dispersion of 0.47, indicating that the dispersion of the W species can be obviously improved by addition of Sn0.12AlPO4-5 in the catalyst. 3.3 Catalytic activity evaluation The results of DBT HDS over four NiW catalysts at 260 °C, 280 °C and 300 °C are presented in Table 6 . It is found that all NiW catalysts show higher HDS rate of DBT than that of the NiW/Al2O3 catalyst (the HDS rate of DBT is 21.6%, 45.7% and 71.9% at 260 °C, 280 °C and 300 °C, respectively, under the same reaction conditions), which is consistent with the results of our previous research [19]. The DBT HDS rate over five catalysts is as follows: NiW/(Sn0.12AlPO4-5+Al2O3)> NiW/(Sn0.06AlPO4-5+Al2O3) > NiW/(SnO2/AlPO4-5+Al2O3)> NiW/(AlPO4-5+ Al2O3)> NiW/Al2O3. The NiW catalyst supported on hybrid AlPO4-5-alumina shows the lowest activity, with a DBT HDS rate of only 22.4% at 260 °C, 49.6% at 280 °C and 83.8% at 300 °C. The NiW catalyst supported on hybrid Sn0.12AlPO4-5-alumina shows the highest activity, giving DBT HDS rate 44.1% at 260 °C, 82.2% at 280 °C and 98.2% at 300 °C. The NiW/(SnO2/AlPO4-5+Al2O3) catalyst shows a slightly increase. Generally, the catalysts supported on hybrid SnAlPO4-5-alumina have higher catalytic activity than those of other catalysts supported on hybrid AlPO4-5-alumina or SnO2/AlPO4-5-alumina. The products of DBT HDS were detected by GC–MS in order to analyze the abilities of hydrogenation and hydrogenolysis over the NiW catalysts with different hybrid molecular sieve-alumina. The mechanism of DBT in the HDS reaction can go through two parallel pathways [47] as shown in Fig. 11 . The product of DDS is biphenyl (BP), and the products of HDY are tetrahydrodibenzothiophene (THDBT), hexahydro-dibenzothiophene (HHDBT), cyclohexylbenzene (CHB) and bicyclohexyl (BCH). The selectivity of the pathway (HYD/DDS ratio) could be calculated by the yields ratio (1-BP)/BP. The results for the path selectivity of HYD and DDS at 280 °C are shown in Table 6. The HYD/DDS ratios of DBT in four catalysts are as follows: NiW/(AlPO4-5+Al2O3)> NiW/(SnO2/AlPO4-5+Al2O3)> NiW/(Sn0.06AlPO4-5+Al2O3) > NiW/(Sn0.12AlPO4-5+Al2O3), indicating that the DDS pathway increased more in the DBT HDS with the addition of SnAlPO4-5. For the NiW/(SnAlPO4-5+Al2O3) catalyst, the relative amount of BP is larger than that of CHB because BP increases to a greater extents than CHB with SnAlPO4-5 does. Finally, the comparison of the calculated HYD/DDS ratio calculated indicates that the presence of SnAlPO4-5 slightly improves the DDS route of the HDS reaction compared to that of the catalyst supported on hybrid AlPO4-5-alumina. The above assessment results of DBT have certified that the NiW/(SnAlPO4-5+Al2O3) catalyst has a higher performance than the other catalysts do. The differences between the four catalysts are mainly due to the differences between the molecular sieves in the hybrid support. The addition of SnAlPO4-5 in the NiW catalyst improves the acidity (Table 4) and the tunes size and structure of WS2 (Fig. 10 and Table 5) are important factors to determine the catalytic activity of HDS catalysts because the edge of the WS2 slabs is considered to contain the active sites for hydrogenation [35]. The greater number of edge sites of WS2 slabs can provide greater HDS activity. According to the literature results [48,49], it is proposed that the edge sites are DDS-oriented, and the brim sites (the top and bottom layers of the multilayers) in the Ni-W-S and W-S phases are both HYD-oriented and DDS-oriented. Compared to NiW/(AlPO4-5+Al2O3) catalyst, NiW/(SnAlPO4-5+Al2O3) catalysts, especially NiW/(Sn0.12AlPO4-5+Al2O3), have more multi-layers and edge sites of WS2 (Table 5 and Fig. 10b), which caused that the product of DDS increased more than the products of HYD in the HDS of DBT. For the same metal content, the NiW/(SnAlPO4-5+Al2O3) catalyst provides more active metal sulfide sites. Apparently, Sn0.12AlPO4-5 is more favorable for HDS than others molecular sieves in the NiW catalysts. The presence of SnAlPO4-5 in the hybrid support tunes the WS2 structures and sizes and the catalytic activity of the NiW catalysts. It has been recognized that the presence of acid sites enhances the activity of the sulfide phase and that Brønsted acids are beneficial for the HDS reaction or act as structural promoters by increasing the electronic deficiency of the metal active phase [6,50], and the improved electronic deficiency can increase the HDS ability of the catalysts containing zeolite-alumina [51]. Furthermore, the Brønsted acidity of NiW catalysts has a marked influence the dispersion of tungsten sulfide and the adsorption of the aromatic molecules. Therefore, the NiW/(Sn0.12AlPO4-5+Al2O3) catalyst with more acid sites, especially weak Brønsted acid sites, has higher activity for the DBT HDS than that of other catalysts. This new finding has an important practical implications for the development of HDS catalysts. 4 Conclusions Highly crystallized SnAlPO4-5 molecular sieves with SnCl2·2H2O as the tin source are successfully synthesized via the hydrothermal synthesis method. Tin is enriched on the crystal surface of SnAlPO4-5. Most importantly, divalent tin is incorporated by isomorphous substitution for Al3+ in the framework of SnAlPO4-5, which caused more Brønsted and Lewis acid sites than those of pure AlPO4-5. The application of SnAlPO4-5 molecular sieves as components of supports in NiW catalysts improves the sulfidation of the catalysts. The stacking number distribution and the slab length of WS2 in the catalyst of NiW/(SnAlPO4-5+Al2O3) become wider than that of AlPO4-5. The average numbers of the slab layers and average slabs length of the NiW catalysts supported on hybrid Sn0.12AlPO4-5-alumina increase from 1.80 to 2.48 and from 2.93 nm to 3.28 nm, respectively. Compared to NiW/(AlPO4-5+Al2O3), the NiW/(Sn0.12AlPO4-5+Al2O3) catalyst exhibits a higher DBT HDS rate, which is increased from 49.6% to 82.2% at 280 °C. The addition of SnAlPO4-5 in the support of NiW catalysts improved the acidity, WS2 dispersion and structure of the active metal phase. The considerably enhanced catalytic performance is mainly due to the increased amount of the acid and the tuning of WS2 structures and distribution. Furthermore, the DBT reacts preferentially through the HYD route on the NiW/(AlPO4-5+Al2O3) catalyst. However, the product of DDS route increase on the NiW/(SnAlPO4-5+Al2O3) catalyst, which could reduce the hydrogen consumption in the potential industrial application. Acknowledgements We acknowledge the funding of this project by the National Key R&D Program of China (2017YFB0306602), National Natural Science Foundation of China (U1462202, 21776304) and PetroChina. References [1] C. Song X. Ma Catal. BAppl. Catal. B Environ. 41 2003 207 238 [2] P. Castillo-Villalon J. Ramirez J.A. Vargas-Luciano J. Catal. 320 2014 127 136 [3] D. Mey S. Brunet C. Canaff F. Maugé C. Bouchy F. Diehl J. Catal. 227 2004 436 447 [4] H. Li B. Shen W. Zhang Y. Zhao X. Wang Z. Zhang S. Shen Fuel 85 2006 2445 2449 [5] H. Wu A. Duan Z. Zhao T. Li R. Prins X. Zhou J. Catal. 317 2014 303 317 [6] C.E. Hédoire C. Louis A. Davidson M. Breysse F. Maugé M. Vrinat J. Catal. 220 2003 433 441 [7] W. Chen F. Maugé J. Van Gestel H. Nie D. Li X. Long J. Catal. 304 2013 47 62 [8] W. Han H. Nie X. Long M. Li Q. Yang D. Li Catal. Today 292 2017 58 66 [9] H. Wang R. Prins J. Catal. 258 2008 153 164 [10] P.R. Egorova Marina J. Catal. 225 2004 417 427 [11] R.P. Huamin Wang J. Catal. 264 2009 31 43 [12] Y. Licea R. Grau-Crespo L. Palacio A. Faro Catal. Today 292 2016 84 96 [13] F. Bataille J.L. Lemberton G. Pérot P. Leyrit T. Cseri N. Marchal S. Kasztelan Appl. Catal. A Gen. 220 2001 191 205 [14] N. Chen Y. Ren E.W. Qian J. Catal. 334 2016 79 88 [15] Z. Nawaz X. Tang Q. Zhang D. Wang W. Fei Catal. Commun. 10 2009 1925 1930 [16] T. Komatsu H. Ikenaga J. Catal. 241 2006 426 434 [17] J.W. Harris M.J. Cordon J.R. Di Iorio J.C. Vega-Vila F.H. Ribeiro R. Gounder J. Catal. 335 2016 141 154 [18] W.R. Flavell D.G. Nicholson M.H. Nilsen K. Ståhl J. Mater. Chem. 11 2001 620 627 [19] Y. Zhao B. Shen W. Zhang R. Tian Z. Zhang J. Gao Fuel 87 2008 2343 2346 [20] S.B. Waghmode S.K. Saha Y. Kubota Y. Sugi J. Catal. 228 2004 192 205 [21] M. Karthik A. Vinu A.K. Tripathi N.M. Gupta M. Palanichamy V. Murugesan Microporous Mesoporous Mater. 70 2004 15 25 [22] C.A. Emeis J. Catal. 141 1993 347 354 [23] P. Concepcih J.M.L. Nieto A. Mifsud Zeolites 16 1995 56 64 [24] D.B. Akolekaf R. Ryoo J. Chem. Soc. Faraday Trans. 92 1996 4617 4621 [25] W.L. Shea R.B. Borade A. Clearfield J. Chem. Soc. Faraday Trans. 89 1993 3143 3149 [26] M. Sánchez-Sánchez R.V. Grieken D.P. Serrano J.A. Melero J. Mater. Chem. 19 2009 6833 6841 [27] W. Fan B. Fan M. Song T. Chen R. Li T. Dou T. Tatsumi B.M. Weckhuysen Microporous Mesoporous Mater. 94 2006 348 357 [28] M. Karthik A. Vinu A.K. Tripathi N.M. Gupta M. Palanichamy V. Murugesan Microporous Mesoporous Mater. 70 2004 15 25 [29] H. Maekawa S.K. Saha S.A.R. Mulla S.B. Waghmode K. Komura Y. Kubota Y. Sugi J. Mol. Catal. A Chem. 263 2007 238 246 [30] H. Jang H. Min S. Bong G. Seo J. Catal. 299 2013 240 248 [31] H.A.O. Fang Z. Jun L.I.U. Pingle Y.O.U. Kuiyi W.E.I. Chao L.U.O. He Chin. J. Catal. 33 2012 670 676 [32] J.P.A. Corma V. Fornes M.T. Navarro J. Catal. 148 1994 569 574 [33] H. Zhang A. Chokkalingam P.V. Subramaniam S. Joseph S. Takeuchi M.D. Wei A.M. Al-Enizi H. Jang J. Kim G. Seo K. Komura Y. Sugi A. Vinu J. Mol. Catal. A Chem. 412 2016 117 124 [34] M. Hartmann L. Kevan Chem. Rev. 99 1999 635 663 [35] L. Ding Y. Zheng H. Yang R. Parviz Appl. Catal. A Gen. 353 2009 17 23 [36] B. Shen, H. Li, S. Shen. Catal. Letters 106 (1–2), 2006, 55-60. [37] H. Li M. Li Y. Chu F. Liu H. Nie Appl. Catal. A Gen. 403 2011 75 82 [38] B. Pawelec L. Daza J. Fierro J. Anderson Appl. Catal. A Gen. 145 1996 307 322 [39] Y. Fan H. Xiao G. Shi H. Liu Y. Qian T. Wang G. Gong X. Bao J. Catal. 279 2011 27 35 [40] S. Bendezú R. Cid J.L.G. Fierro A.L. Agudo Appl. Catal. A Gen. 197 2000 47 60 [41] L. Qiu G. Xu Appl. Surf. Sci. 256 2010 3412 3416 [42] B. Pawelec R. Mariscal J.L.G. Fierro A. Greenwood P.T. Vasudevan Appl. Catal. A Gen. 206 2001 295 307 [43] D. Zuo M. Vrinat H. Nie F. Maugé Y. Shi M. Lacroix D. Li Catal. Today 93–95 2004 751 760 [44] J. Xu T. Huang Y. Fan Appl. Catal. B Environ. 203 2017 839 850 [45] A.A. Pimerzin P.A. Nikulshin A.V. Mozhaev A.A. Pimerzin A.I. Lyashenko Appl. Catal. B Environ. 168-169 2015 396 407 [46] L. Vradman M.V. Landau Catal. Lett. 77 2001 47 54 [47] P.A. Nikulshin P.P. Minaev A.V. Mozhaev K.I. Maslakov M.S. Kulikova A.A. Pimerzin Appl. Catal. B Environ. 176-177 2015 374 384 [48] M. Daage R.R. Chianelli J. Catal. 149 1994 414 427 [49] F. Besenbacher M. Brorson B.S. Clausen S. Helveg B. Hinnemann J. Kibsgaard J.V. Lauritsen P.G. Moses J.K. Nørskov H. Topsøe Catal. Today 130 2008 86 96 [50] S. Zeng J. Blanchard M. Breysse Y. Shi X. Su H. Nie D. Li Appl. Catal. A Gen. 294 2005 59 67 [51] M. Breysse C.E. Hédoire C. Louis G. Pérot Stud. Surf. Sci. Catal. 145 2003 115 120",
      "scopus-id": "85049487238",
      "coredata": {
        "eid": "1-s2.0-S0926860X18303314",
        "dc:description": "SnAlPO4-5 molecular sieves were hydrothermally synthesized using SnCl2·2H2O as the tin source, and were verified that divalent tin was incorporated into the framework by isomorphous substitution of trivalent aluminum, and increasing the numbers of Brønsted and Lewis acid sites relative to those in AlPO4-5. The molecular sieves were used to fabricate hybrid supports with alumina and then were loaded with active metals to obtain NiW catalysts. The hydrodesulfurization (HDS) of dibenzothiophene (DBT) were evaluated for the catalytic activity of the catalysts. Because of the higher number of weak acid sites, much greater average number of slab layers and higher dispersion of WS2, the HDS rate of DBT at 280 °C is improved from 49.6% for the NiW/(AlPO4-5+Al2O3) catalyst to 82.2% for the NiW/(Sn0.12AlPO4-5+Al2O3) catalyst. Moreover, the highly active NiW/(Sn0.12AlPO4-5+Al2O3) catalyst obviously increases the product of the direct desulfurization route in the DBT HDS, which is beneficial for reducing hydrogen consumption in the industrial applications.",
        "openArchiveArticle": "false",
        "prism:coverDate": "2018-08-05",
        "openaccessUserLicense": null,
        "prism:aggregationType": "Journal",
        "prism:url": "https://api.elsevier.com/content/article/pii/S0926860X18303314",
        "dc:creator": [
          {
            "@_fa": "true",
            "$": "Sun, Houxiang"
          },
          {
            "@_fa": "true",
            "$": "Wang, Qian"
          },
          {
            "@_fa": "true",
            "$": "Zhang, Xinyue"
          },
          {
            "@_fa": "true",
            "$": "Yu, Qianqian"
          },
          {
            "@_fa": "true",
            "$": "Li, Lei"
          },
          {
            "@_fa": "true",
            "$": "Wang, Yandan"
          },
          {
            "@_fa": "true",
            "$": "Shen, Baojian"
          }
        ],
        "link": [
          {
            "@_fa": "true",
            "@rel": "self",
            "@href": "https://api.elsevier.com/content/article/pii/S0926860X18303314"
          },
          {
            "@_fa": "true",
            "@rel": "scidir",
            "@href": "https://www.sciencedirect.com/science/article/pii/S0926860X18303314"
          }
        ],
        "dc:format": "application/json",
        "openaccessType": null,
        "pii": "S0926-860X(18)30331-4",
        "prism:volume": "563",
        "prism:publisher": "Elsevier B.V.",
        "dc:title": "Hydrodesulfurization of dibenzothiophene over NiW/(SnAlPO4-5+Al2O3) catalyst, the tuning effect of SnAlPO4-5 to the desulfurization reaction pathway",
        "prism:copyright": "© 2018 Elsevier B.V. All rights reserved.",
        "openaccess": "0",
        "prism:issn": "0926860X",
        "dcterms:subject": [
          {
            "@_fa": "true",
            "$": "AlPO4-5"
          },
          {
            "@_fa": "true",
            "$": "Tin"
          },
          {
            "@_fa": "true",
            "$": "Isomorphous substitution"
          },
          {
            "@_fa": "true",
            "$": "Acidic sites"
          },
          {
            "@_fa": "true",
            "$": "Hydrodesulfurization"
          },
          {
            "@_fa": "true",
            "$": "Supports"
          }
        ],
        "openaccessArticle": "false",
        "prism:publicationName": "Applied Catalysis A: General",
        "openaccessSponsorType": null,
        "prism:pageRange": "137-145",
        "prism:endingPage": "145",
        "pubType": "fla",
        "prism:coverDisplayDate": "5 August 2018",
        "prism:doi": "10.1016/j.apcata.2018.07.008",
        "prism:startingPage": "137",
        "dc:identifier": "doi:10.1016/j.apcata.2018.07.008",
        "openaccessSponsorName": null
      },
      "objects": {
        "object": [
          {
            "@category": "standard",
            "@height": "200",
            "@width": "484",
            "@_fa": "true",
            "$": "https://api.elsevier.com/content/object/eid/1-s2.0-S0926860X18303314-ga1.jpg?httpAccept=%2A%2F%2A",
            "@multimediatype": "JPEG image file",
            "@type": "IMAGE-DOWNSAMPLED",
            "@size": "32432",
            "@ref": "ga1",
            "@mimetype": "image/jpeg"
          },
          {
            "@category": "standard",
            "@height": "261",
            "@width": "339",
            "@_fa": "true",
            "$": "https://api.elsevier.com/content/object/eid/1-s2.0-S0926860X18303314-gr1.jpg?httpAccept=%2A%2F%2A",
            "@multimediatype": "JPEG image file",
            "@type": "IMAGE-DOWNSAMPLED",
            "@size": "20446",
            "@ref": "gr1",
            "@mimetype": "image/jpeg"
          },
          {
            "@category": "standard",
            "@height": "268",
            "@width": "715",
            "@_fa": "true",
            "$": "https://api.elsevier.com/content/object/eid/1-s2.0-S0926860X18303314-gr10.jpg?httpAccept=%2A%2F%2A",
            "@multimediatype": "JPEG image file",
            "@type": "IMAGE-DOWNSAMPLED",
            "@size": "51097",
            "@ref": "gr10",
            "@mimetype": "image/jpeg"
          },
          {
            "@category": "standard",
            "@height": "209",
            "@width": "470",
            "@_fa": "true",
            "$": "https://api.elsevier.com/content/object/eid/1-s2.0-S0926860X18303314-gr11.jpg?httpAccept=%2A%2F%2A",
            "@multimediatype": "JPEG image file",
            "@type": "IMAGE-DOWNSAMPLED",
            "@size": "20621",
            "@ref": "gr11",
            "@mimetype": "image/jpeg"
          },
          {
            "@category": "standard",
            "@height": "297",
            "@width": "376",
            "@_fa": "true",
            "$": "https://api.elsevier.com/content/object/eid/1-s2.0-S0926860X18303314-gr2.jpg?httpAccept=%2A%2F%2A",
            "@multimediatype": "JPEG image file",
            "@type": "IMAGE-DOWNSAMPLED",
            "@size": "28535",
            "@ref": "gr2",
            "@mimetype": "image/jpeg"
          },
          {
            "@category": "standard",
            "@height": "262",
            "@width": "339",
            "@_fa": "true",
            "$": "https://api.elsevier.com/content/object/eid/1-s2.0-S0926860X18303314-gr3.jpg?httpAccept=%2A%2F%2A",
            "@multimediatype": "JPEG image file",
            "@type": "IMAGE-DOWNSAMPLED",
            "@size": "19839",
            "@ref": "gr3",
            "@mimetype": "image/jpeg"
          },
          {
            "@category": "standard",
            "@height": "270",
            "@width": "339",
            "@_fa": "true",
            "$": "https://api.elsevier.com/content/object/eid/1-s2.0-S0926860X18303314-gr4.jpg?httpAccept=%2A%2F%2A",
            "@multimediatype": "JPEG image file",
            "@type": "IMAGE-DOWNSAMPLED",
            "@size": "21690",
            "@ref": "gr4",
            "@mimetype": "image/jpeg"
          },
          {
            "@category": "standard",
            "@height": "259",
            "@width": "339",
            "@_fa": "true",
            "$": "https://api.elsevier.com/content/object/eid/1-s2.0-S0926860X18303314-gr5.jpg?httpAccept=%2A%2F%2A",
            "@multimediatype": "JPEG image file",
            "@type": "IMAGE-DOWNSAMPLED",
            "@size": "31977",
            "@ref": "gr5",
            "@mimetype": "image/jpeg"
          },
          {
            "@category": "standard",
            "@height": "546",
            "@width": "715",
            "@_fa": "true",
            "$": "https://api.elsevier.com/content/object/eid/1-s2.0-S0926860X18303314-gr6.jpg?httpAccept=%2A%2F%2A",
            "@multimediatype": "JPEG image file",
            "@type": "IMAGE-DOWNSAMPLED",
            "@size": "119644",
            "@ref": "gr6",
            "@mimetype": "image/jpeg"
          },
          {
            "@category": "standard",
            "@height": "261",
            "@width": "339",
            "@_fa": "true",
            "$": "https://api.elsevier.com/content/object/eid/1-s2.0-S0926860X18303314-gr7.jpg?httpAccept=%2A%2F%2A",
            "@multimediatype": "JPEG image file",
            "@type": "IMAGE-DOWNSAMPLED",
            "@size": "28393",
            "@ref": "gr7",
            "@mimetype": "image/jpeg"
          },
          {
            "@category": "standard",
            "@height": "269",
            "@width": "715",
            "@_fa": "true",
            "$": "https://api.elsevier.com/content/object/eid/1-s2.0-S0926860X18303314-gr8.jpg?httpAccept=%2A%2F%2A",
            "@multimediatype": "JPEG image file",
            "@type": "IMAGE-DOWNSAMPLED",
            "@size": "71072",
            "@ref": "gr8",
            "@mimetype": "image/jpeg"
          },
          {
            "@category": "standard",
            "@height": "377",
            "@width": "565",
            "@_fa": "true",
            "$": "https://api.elsevier.com/content/object/eid/1-s2.0-S0926860X18303314-gr9.jpg?httpAccept=%2A%2F%2A",
            "@multimediatype": "JPEG image file",
            "@type": "IMAGE-DOWNSAMPLED",
            "@size": "85225",
            "@ref": "gr9",
            "@mimetype": "image/jpeg"
          },
          {
            "@category": "thumbnail",
            "@height": "90",
            "@width": "219",
            "@_fa": "true",
            "$": "https://api.elsevier.com/content/object/eid/1-s2.0-S0926860X18303314-ga1.sml?httpAccept=%2A%2F%2A",
            "@multimediatype": "GIF image file",
            "@type": "IMAGE-THUMBNAIL",
            "@size": "11131",
            "@ref": "ga1",
            "@mimetype": "image/gif"
          },
          {
            "@category": "thumbnail",
            "@height": "164",
            "@width": "213",
            "@_fa": "true",
            "$": "https://api.elsevier.com/content/object/eid/1-s2.0-S0926860X18303314-gr1.sml?httpAccept=%2A%2F%2A",
            "@multimediatype": "GIF image file",
            "@type": "IMAGE-THUMBNAIL",
            "@size": "7073",
            "@ref": "gr1",
            "@mimetype": "image/gif"
          },
          {
            "@category": "thumbnail",
            "@height": "82",
            "@width": "219",
            "@_fa": "true",
            "$": "https://api.elsevier.com/content/object/eid/1-s2.0-S0926860X18303314-gr10.sml?httpAccept=%2A%2F%2A",
            "@multimediatype": "GIF image file",
            "@type": "IMAGE-THUMBNAIL",
            "@size": "7259",
            "@ref": "gr10",
            "@mimetype": "image/gif"
          },
          {
            "@category": "thumbnail",
            "@height": "97",
            "@width": "219",
            "@_fa": "true",
            "$": "https://api.elsevier.com/content/object/eid/1-s2.0-S0926860X18303314-gr11.sml?httpAccept=%2A%2F%2A",
            "@multimediatype": "GIF image file",
            "@type": "IMAGE-THUMBNAIL",
            "@size": "4355",
            "@ref": "gr11",
            "@mimetype": "image/gif"
          },
          {
            "@category": "thumbnail",
            "@height": "164",
            "@width": "207",
            "@_fa": "true",
            "$": "https://api.elsevier.com/content/object/eid/1-s2.0-S0926860X18303314-gr2.sml?httpAccept=%2A%2F%2A",
            "@multimediatype": "GIF image file",
            "@type": "IMAGE-THUMBNAIL",
            "@size": "7914",
            "@ref": "gr2",
            "@mimetype": "image/gif"
          },
          {
            "@category": "thumbnail",
            "@height": "164",
            "@width": "212",
            "@_fa": "true",
            "$": "https://api.elsevier.com/content/object/eid/1-s2.0-S0926860X18303314-gr3.sml?httpAccept=%2A%2F%2A",
            "@multimediatype": "GIF image file",
            "@type": "IMAGE-THUMBNAIL",
            "@size": "7077",
            "@ref": "gr3",
            "@mimetype": "image/gif"
          },
          {
            "@category": "thumbnail",
            "@height": "164",
            "@width": "206",
            "@_fa": "true",
            "$": "https://api.elsevier.com/content/object/eid/1-s2.0-S0926860X18303314-gr4.sml?httpAccept=%2A%2F%2A",
            "@multimediatype": "GIF image file",
            "@type": "IMAGE-THUMBNAIL",
            "@size": "6791",
            "@ref": "gr4",
            "@mimetype": "image/gif"
          },
          {
            "@category": "thumbnail",
            "@height": "164",
            "@width": "215",
            "@_fa": "true",
            "$": "https://api.elsevier.com/content/object/eid/1-s2.0-S0926860X18303314-gr5.sml?httpAccept=%2A%2F%2A",
            "@multimediatype": "GIF image file",
            "@type": "IMAGE-THUMBNAIL",
            "@size": "11887",
            "@ref": "gr5",
            "@mimetype": "image/gif"
          },
          {
            "@category": "thumbnail",
            "@height": "164",
            "@width": "214",
            "@_fa": "true",
            "$": "https://api.elsevier.com/content/object/eid/1-s2.0-S0926860X18303314-gr6.sml?httpAccept=%2A%2F%2A",
            "@multimediatype": "GIF image file",
            "@type": "IMAGE-THUMBNAIL",
            "@size": "14592",
            "@ref": "gr6",
            "@mimetype": "image/gif"
          },
          {
            "@category": "thumbnail",
            "@height": "164",
            "@width": "213",
            "@_fa": "true",
            "$": "https://api.elsevier.com/content/object/eid/1-s2.0-S0926860X18303314-gr7.sml?httpAccept=%2A%2F%2A",
            "@multimediatype": "GIF image file",
            "@type": "IMAGE-THUMBNAIL",
            "@size": "10178",
            "@ref": "gr7",
            "@mimetype": "image/gif"
          },
          {
            "@category": "thumbnail",
            "@height": "82",
            "@width": "219",
            "@_fa": "true",
            "$": "https://api.elsevier.com/content/object/eid/1-s2.0-S0926860X18303314-gr8.sml?httpAccept=%2A%2F%2A",
            "@multimediatype": "GIF image file",
            "@type": "IMAGE-THUMBNAIL",
            "@size": "8898",
            "@ref": "gr8",
            "@mimetype": "image/gif"
          },
          {
            "@category": "thumbnail",
            "@height": "146",
            "@width": "219",
            "@_fa": "true",
            "$": "https://api.elsevier.com/content/object/eid/1-s2.0-S0926860X18303314-gr9.sml?httpAccept=%2A%2F%2A",
            "@multimediatype": "GIF image file",
            "@type": "IMAGE-THUMBNAIL",
            "@size": "16148",
            "@ref": "gr9",
            "@mimetype": "image/gif"
          },
          {
            "@category": "high",
            "@height": "886",
            "@width": "2146",
            "@_fa": "true",
            "$": "https://api.elsevier.com/content/object/eid/1-s2.0-S0926860X18303314-ga1_lrg.jpg?httpAccept=%2A%2F%2A",
            "@multimediatype": "JPEG image file",
            "@type": "IMAGE-HIGH-RES",
            "@size": "353728",
            "@ref": "ga1",
            "@mimetype": "image/jpeg"
          },
          {
            "@category": "high",
            "@height": "1155",
            "@width": "1500",
            "@_fa": "true",
            "$": "https://api.elsevier.com/content/object/eid/1-s2.0-S0926860X18303314-gr1_lrg.jpg?httpAccept=%2A%2F%2A",
            "@multimediatype": "JPEG image file",
            "@type": "IMAGE-HIGH-RES",
            "@size": "160534",
            "@ref": "gr1",
            "@mimetype": "image/jpeg"
          },
          {
            "@category": "high",
            "@height": "1185",
            "@width": "3167",
            "@_fa": "true",
            "$": "https://api.elsevier.com/content/object/eid/1-s2.0-S0926860X18303314-gr10_lrg.jpg?httpAccept=%2A%2F%2A",
            "@multimediatype": "JPEG image file",
            "@type": "IMAGE-HIGH-RES",
            "@size": "460589",
            "@ref": "gr10",
            "@mimetype": "image/jpeg"
          },
          {
            "@category": "high",
            "@height": "925",
            "@width": "2083",
            "@_fa": "true",
            "$": "https://api.elsevier.com/content/object/eid/1-s2.0-S0926860X18303314-gr11_lrg.jpg?httpAccept=%2A%2F%2A",
            "@multimediatype": "JPEG image file",
            "@type": "IMAGE-HIGH-RES",
            "@size": "154484",
            "@ref": "gr11",
            "@mimetype": "image/jpeg"
          },
          {
            "@category": "high",
            "@height": "1318",
            "@width": "1667",
            "@_fa": "true",
            "$": "https://api.elsevier.com/content/object/eid/1-s2.0-S0926860X18303314-gr2_lrg.jpg?httpAccept=%2A%2F%2A",
            "@multimediatype": "JPEG image file",
            "@type": "IMAGE-HIGH-RES",
            "@size": "229726",
            "@ref": "gr2",
            "@mimetype": "image/jpeg"
          },
          {
            "@category": "high",
            "@height": "1161",
            "@width": "1500",
            "@_fa": "true",
            "$": "https://api.elsevier.com/content/object/eid/1-s2.0-S0926860X18303314-gr3_lrg.jpg?httpAccept=%2A%2F%2A",
            "@multimediatype": "JPEG image file",
            "@type": "IMAGE-HIGH-RES",
            "@size": "161286",
            "@ref": "gr3",
            "@mimetype": "image/jpeg"
          },
          {
            "@category": "high",
            "@height": "1194",
            "@width": "1500",
            "@_fa": "true",
            "$": "https://api.elsevier.com/content/object/eid/1-s2.0-S0926860X18303314-gr4_lrg.jpg?httpAccept=%2A%2F%2A",
            "@multimediatype": "JPEG image file",
            "@type": "IMAGE-HIGH-RES",
            "@size": "163879",
            "@ref": "gr4",
            "@mimetype": "image/jpeg"
          },
          {
            "@category": "high",
            "@height": "1145",
            "@width": "1500",
            "@_fa": "true",
            "$": "https://api.elsevier.com/content/object/eid/1-s2.0-S0926860X18303314-gr5_lrg.jpg?httpAccept=%2A%2F%2A",
            "@multimediatype": "JPEG image file",
            "@type": "IMAGE-HIGH-RES",
            "@size": "291414",
            "@ref": "gr5",
            "@mimetype": "image/jpeg"
          },
          {
            "@category": "high",
            "@height": "2420",
            "@width": "3167",
            "@_fa": "true",
            "$": "https://api.elsevier.com/content/object/eid/1-s2.0-S0926860X18303314-gr6_lrg.jpg?httpAccept=%2A%2F%2A",
            "@multimediatype": "JPEG image file",
            "@type": "IMAGE-HIGH-RES",
            "@size": "888437",
            "@ref": "gr6",
            "@mimetype": "image/jpeg"
          },
          {
            "@category": "high",
            "@height": "1155",
            "@width": "1500",
            "@_fa": "true",
            "$": "https://api.elsevier.com/content/object/eid/1-s2.0-S0926860X18303314-gr7_lrg.jpg?httpAccept=%2A%2F%2A",
            "@multimediatype": "JPEG image file",
            "@type": "IMAGE-HIGH-RES",
            "@size": "230736",
            "@ref": "gr7",
            "@mimetype": "image/jpeg"
          },
          {
            "@category": "high",
            "@height": "1191",
            "@width": "3167",
            "@_fa": "true",
            "$": "https://api.elsevier.com/content/object/eid/1-s2.0-S0926860X18303314-gr8_lrg.jpg?httpAccept=%2A%2F%2A",
            "@multimediatype": "JPEG image file",
            "@type": "IMAGE-HIGH-RES",
            "@size": "574881",
            "@ref": "gr8",
            "@mimetype": "image/jpeg"
          },
          {
            "@category": "high",
            "@height": "1667",
            "@width": "2500",
            "@_fa": "true",
            "$": "https://api.elsevier.com/content/object/eid/1-s2.0-S0926860X18303314-gr9_lrg.jpg?httpAccept=%2A%2F%2A",
            "@multimediatype": "JPEG image file",
            "@type": "IMAGE-HIGH-RES",
            "@size": "1545866",
            "@ref": "gr9",
            "@mimetype": "image/jpeg"
          },
          {
            "@category": "thumbnail",
            "@height": "31",
            "@width": "27",
            "@_fa": "true",
            "$": "https://api.elsevier.com/content/object/eid/1-s2.0-S0926860X18303314-si1.gif?httpAccept=%2A%2F%2A",
            "@multimediatype": "GIF image file",
            "@type": "ALTIMG",
            "@size": "147",
            "@ref": "si1",
            "@mimetype": "image/gif"
          },
          {
            "@category": "thumbnail",
            "@height": "31",
            "@width": "31",
            "@_fa": "true",
            "$": "https://api.elsevier.com/content/object/eid/1-s2.0-S0926860X18303314-si2.gif?httpAccept=%2A%2F%2A",
            "@multimediatype": "GIF image file",
            "@type": "ALTIMG",
            "@size": "173",
            "@ref": "si2",
            "@mimetype": "image/gif"
          },
          {
            "@category": "thumbnail",
            "@height": "80",
            "@width": "95",
            "@_fa": "true",
            "$": "https://api.elsevier.com/content/object/eid/1-s2.0-S0926860X18303314-si3.gif?httpAccept=%2A%2F%2A",
            "@multimediatype": "GIF image file",
            "@type": "ALTIMG",
            "@size": "532",
            "@ref": "si3",
            "@mimetype": "image/gif"
          },
          {
            "@category": "thumbnail",
            "@height": "80",
            "@width": "102",
            "@_fa": "true",
            "$": "https://api.elsevier.com/content/object/eid/1-s2.0-S0926860X18303314-si4.gif?httpAccept=%2A%2F%2A",
            "@multimediatype": "GIF image file",
            "@type": "ALTIMG",
            "@size": "577",
            "@ref": "si4",
            "@mimetype": "image/gif"
          },
          {
            "@category": "thumbnail",
            "@height": "84",
            "@width": "157",
            "@_fa": "true",
            "$": "https://api.elsevier.com/content/object/eid/1-s2.0-S0926860X18303314-si5.gif?httpAccept=%2A%2F%2A",
            "@multimediatype": "GIF image file",
            "@type": "ALTIMG",
            "@size": "899",
            "@ref": "si5",
            "@mimetype": "image/gif"
          }
        ]
      },
      "link": {
        "@rel": "abstract",
        "@href": "https://api.elsevier.com/content/abstract/scopus_id/85049487238"
      }
    }
  }
}