{
  "metadata": {
    "title": "Elucidating Keggin site-specific activity of NH<ce:inf loc=post>4</ce:inf>PM catalysts associated with dolomite-added H-MMT in gas-phase glycerol valorisation reactions",
    "authors": "; ; ",
    "journal": "Applied Catalysis A: General",
    "date": "2026-01-05",
    "doi": "10.1016/j.apcata.2025.120595",
    "abstract": "",
    "uri": "https://api.elsevier.com/content/article/pii/S0926860X25004971",
    "pii": "S0926860X25004971"
  },
  "fulltext": {
    "full-text-retrieval-response": {
      "originalText": "serial JL 271346 291210 291744 291809 31 Applied Catalysis A: General APPLIEDCATALYSISAGENERAL 2025-09-22 2025-09-22 2025-10-10 2025-10-10 2025-10-10T19:26:00 1-s2.0-S0926860X25004971 S0926-860X(25)00497-1 S0926860X25004971 10.1016/j.apcata.2025.120595 S250 S250.1 FULL-TEXT 1-s2.0-S0926860X25X0017X 2025-10-10T22:18:44.287202Z 0 0 20260105 2026 2025-09-22T15:47:21.708843Z absattachment articleinfo articlenumber articletitlenorm authfirstinitialnorm authfirstsurnamenorm cid cids contenttype copyright crossmark dateloaded dateloadedtxt datesearch datesort dateupdated dco docsubtype doctype doi eid ewtransactionid hubeid indexeddate issn issnnorm itemstage itemtransactionid itemweight openaccess openarchive pg pgfirst pii piinorm pubdatestart pubdatetxt pubyr sortorder srctitle srctitlenorm srctype ssids alllist content subj subheadings suppl tomb volfirst volissue volumelist webpdf webpdfpagecount yearnav figure e-component body mmlmath acknowledge affil appendices articletitle auth authfirstini authfull authkeywords authlast grantnumber grantsponsor grantsponsorid highlightsabst primabst ref specialabst 0926-860X 0926860X false 709 709 C Volume 709 11 120595 120595 120595 20260105 5 January 2026 2026-01-05 2026 article fla © 2025 Elsevier B.V. All rights are reserved, including those for text and data mining, AI training, and similar technologies. ELUCIDATINGKEGGINSITESPECIFICACTIVITYNH4PMCATALYSTSASSOCIATEDDOLOMITEADDEDHMMTINGASPHASEGLYCEROLVALORISATIONREACTIONS ROY T 1 Introduction 2 Experimental 2.1 Materials and chemicals 2.2 Catalyst preparation 2.2.1 Preparation of (NH4)4PMo11VO40 salt 2.2.2 Preparation of (VO)x(NH4)(3–3x)PMo12O40 salts 2.2.3 Acidification of MMT and dolomite incorporation in acidified-MMT 2.3 Gas-phase glycerol conversion reactions 3 Results and discussion 3.1 Structure analysis by powder-XRD, ATR-FTIR and Raman spectroscopy 3.2 Surface property analysis by BET-BJH 3.3 Morphology analysis by FESEM-EDAX 3.4 Chemical properties analysis by XPS, O2-TPD and NH3-TPD 3.5 Catalytic performance 3.6 Kinetic study 3.7 Effect of dolomite incorporation in acid catalysts on coking reduction and catalyst regeneration 3.8 Structure-activity relationship and mechanism 4 Conclusion CRediT authorship contribution statement Acknowledgements Appendix A Supplementary material References VELUTURLA 2018 305 314 S MOKLIS 2023 2979 M DELEPLANQUE 2010 351 358 J SUN 2016 75 92 D SHEN 2014 168 177 L AHMAD 2021 216 227 M KOSTYNIUK 2020 125430 A DOSSANTOS 2019 366 377 M JAMPAIAH 2019 209 221 D CHOI 2012 2460 2468 Y POPA 2015 355 375 A TUNGATAROVA 2015 276 286 S ZHOU 2015 431 440 L KATRYNIOK 2013 1819 1834 B LIU 2012 1162 1180 L ALHANASH 2010 11 18 A HAIDER 2012 206 213 M LIU 2014 8667 8674 R LI 2016 2785 2791 X THANASILP 2015 113 124 S CORONEL 2019 302 310 N BALULA 2013 103 110 S DASILVA 2021 2094 2106 M GIEBELER 2006 309 318 L DROCHNER 2005 74 83 A ENDRES 2007 237 243 S JEKEWITZ 2012 25 28 T KUNERT 2004 53 61 J LI 2023 119355 C KURNIAWAN 2025 1994 2005 A FERNANDES 2022 111536 A BOKADE 2011 263 271 V HUANG 2019 116 124 G YU 2017 1087 1100 W GUISNET 2009 69 83 M POSSATO 2013 102 112 L LI 2025 2339 2352 D JIANG 2018 10736 10753 X KURNIAWAN 2024 123766 A SAMUDRALA 2018 7484 S FU 2022 144 153 J OU 2023 126994 Z DERMECHE 2009 3896 3900 L TAHAR 2015 569 575 A ZATTA 2013 236 244 L KIELLAND 1937 1675 1678 J KELCH 2019 28816 28827 S VILANCULO 2021 24072 24085 C DASILVA 2022 11796 11806 M SULTAN 2004 141 152 M ALEKAR 2001 169 176 N MOTAWIE 2014 331 338 A CHAHARDAHMASOUMI 2022 57248 57260 S RAMEZANIPOURPENCHAH 2021 55754 55770 H JIANG 2017 9187436 W AMBROZ 2018 1800173 F BUKKA 2024 9578 9587 V WEI 2019 1951 1958 Y ZHENG 2010 1202 1211 Z KOLEY 2024 12110 12127 P LIU 2019 178 186 L WANG 2021 119873 Y CHAI 2007 1130 1136 S LIU 2015 1 12 L SUPRUN 2009 71 78 W ERFLE 2011 102 109 S ZHOU 2017 219 231 C TALEBIANKIAKALAIEH 2016 300 312 A TALEBIANKIAKALAIEH 2015 315 324 A KIM 2015 85 99 T ZNAIGUIA 2014 97 103 R ANDRUSHKEVICH 1993 213 259 T WU 2020 481 523 S KAMPE 2007 3577 3589 P LIU 2010 1238 1240 Y GLINSKI 2011 293 299 M SANCHEZ 2014 3090 3098 G MANE 2022 6751 6781 R HAIDER 2015 1028 1032 M CORMA 2008 163 171 A ROYX2026X120595 ROYX2026X120595XT 2027-10-10T00:00:00.000Z 2027-10-10T00:00:00.000Z http://creativecommons.org/licenses/by-nc-nd/4.0/ © 2025 Elsevier B.V. All rights are reserved, including those for text and data mining, AI training, and similar technologies. 2025-09-22T06:31:45.979Z http://vtw.elsevier.com/data/voc/AddOnTypes/50.7/aggregated-refined Qing Yang Institute for Industrial Minerals KYY-HX-20220336 KYY-HX-20170557 National Natural Science Foundation of China 22072136 W2433034 42572045 NSFC National Natural Science Foundation of China http://data.elsevier.com/vocabulary/SciValFunders/501100001809 http://sws.geonames.org/1814991/ The authors wish to acknowledge the financial support from the National Natural Science Foundation of China (42572045; W2433034; 22072136), and the projects from Qing Yang Institute for Industrial Minerals (KYY-HX-20220336; KYY-HX-20170557). https://doi.org/10.15223/policy-017 https://doi.org/10.15223/policy-037 https://doi.org/10.15223/policy-012 https://doi.org/10.15223/policy-029 https://doi.org/10.15223/policy-004 item S0926-860X(25)00497-1 S0926860X25004971 1-s2.0-S0926860X25004971 10.1016/j.apcata.2025.120595 271346 2025-10-10T22:04:48.060596Z 2026-01-05 1-s2.0-S0926860X25004971-main.pdf https://s3-eu-west-1.amazonaws.com/prod-ucs-content-store-eu-west/content/pii:S0926860X25004971/MAIN/application/pdf/4d89b848b908a6e5c0b5527051437c60/main.pdf main.pdf pdf true 10718375 MAIN 17 1-s2.0-S0926860X25004971-main_1.png https://s3-eu-west-1.amazonaws.com/prod-ucs-content-store-eu-west/content/pii:S0926860X25004971/PREVIEW/image/png/758bdc723ca9052fee6eb9dfe861a901/main_1.png main_1.png png 57668 928 656 IMAGE-WEB-PDF 1 1-s2.0-S0926860X25004971-ga1.jpg https://s3-eu-west-1.amazonaws.com/prod-ucs-content-store-eu-west/content/pii:S0926860X25004971/ga1/DOWNSAMPLED/image/jpeg/f42919f1028910c53e93ad129e10f7f9/ga1.jpg ga1 true ga1.jpg jpg 22929 200 358 IMAGE-DOWNSAMPLED 1-s2.0-S0926860X25004971-ga1.sml https://s3-eu-west-1.amazonaws.com/prod-ucs-content-store-eu-west/content/pii:S0926860X25004971/ga1/THUMBNAIL/image/gif/5f30e24d49cc79b58eb02d9e08d47d83/ga1.sml ga1 true ga1.sml sml 9775 122 219 IMAGE-THUMBNAIL 1-s2.0-S0926860X25004971-gr2.jpg https://s3-eu-west-1.amazonaws.com/prod-ucs-content-store-eu-west/content/pii:S0926860X25004971/gr2/DOWNSAMPLED/image/jpeg/cce95476dffca07ac2870d23aa8a1049/gr2.jpg gr2 gr2.jpg jpg 80205 490 678 IMAGE-DOWNSAMPLED 1-s2.0-S0926860X25004971-gr2.sml https://s3-eu-west-1.amazonaws.com/prod-ucs-content-store-eu-west/content/pii:S0926860X25004971/gr2/THUMBNAIL/image/gif/3e183f894e9fd7987421697a42b592f6/gr2.sml gr2 gr2.sml sml 10497 158 219 IMAGE-THUMBNAIL 1-s2.0-S0926860X25004971-gr11.jpg https://s3-eu-west-1.amazonaws.com/prod-ucs-content-store-eu-west/content/pii:S0926860X25004971/gr11/DOWNSAMPLED/image/jpeg/a3e27d8428c08e234195f57f1e56f3ee/gr11.jpg gr11 gr11.jpg jpg 108066 505 678 IMAGE-DOWNSAMPLED 1-s2.0-S0926860X25004971-gr11.sml https://s3-eu-west-1.amazonaws.com/prod-ucs-content-store-eu-west/content/pii:S0926860X25004971/gr11/THUMBNAIL/image/gif/f9c70b8da86fa0994f93902626803799/gr11.sml gr11 gr11.sml sml 15917 163 219 IMAGE-THUMBNAIL 1-s2.0-S0926860X25004971-gr1.jpg https://s3-eu-west-1.amazonaws.com/prod-ucs-content-store-eu-west/content/pii:S0926860X25004971/gr1/DOWNSAMPLED/image/jpeg/11aa1eae1a67ebd215e90cbfbebcbcab/gr1.jpg gr1 gr1.jpg jpg 70915 566 678 IMAGE-DOWNSAMPLED 1-s2.0-S0926860X25004971-gr1.sml https://s3-eu-west-1.amazonaws.com/prod-ucs-content-store-eu-west/content/pii:S0926860X25004971/gr1/THUMBNAIL/image/gif/444078d877ee2bb5be035eaf366ebe7b/gr1.sml gr1 gr1.sml sml 8576 164 196 IMAGE-THUMBNAIL 1-s2.0-S0926860X25004971-gr10.jpg https://s3-eu-west-1.amazonaws.com/prod-ucs-content-store-eu-west/content/pii:S0926860X25004971/gr10/DOWNSAMPLED/image/jpeg/214b9fe392068195d92de53726f33fb8/gr10.jpg gr10 gr10.jpg jpg 55366 520 678 IMAGE-DOWNSAMPLED 1-s2.0-S0926860X25004971-gr10.sml https://s3-eu-west-1.amazonaws.com/prod-ucs-content-store-eu-west/content/pii:S0926860X25004971/gr10/THUMBNAIL/image/gif/c7a51099b6be45fbc57a4323ce65135b/gr10.sml gr10 gr10.sml sml 7362 163 213 IMAGE-THUMBNAIL 1-s2.0-S0926860X25004971-gr4.jpg https://s3-eu-west-1.amazonaws.com/prod-ucs-content-store-eu-west/content/pii:S0926860X25004971/gr4/DOWNSAMPLED/image/jpeg/bff0a79008523beecb8fa699120382f5/gr4.jpg gr4 gr4.jpg jpg 49888 279 678 IMAGE-DOWNSAMPLED 1-s2.0-S0926860X25004971-gr4.sml https://s3-eu-west-1.amazonaws.com/prod-ucs-content-store-eu-west/content/pii:S0926860X25004971/gr4/THUMBNAIL/image/gif/918639e3ce87b25792ff1342330715e9/gr4.sml gr4 gr4.sml sml 7558 90 219 IMAGE-THUMBNAIL 1-s2.0-S0926860X25004971-gr3.jpg https://s3-eu-west-1.amazonaws.com/prod-ucs-content-store-eu-west/content/pii:S0926860X25004971/gr3/DOWNSAMPLED/image/jpeg/573a41ff0e847ca4660db0d7cadaacd0/gr3.jpg gr3 gr3.jpg jpg 34399 294 376 IMAGE-DOWNSAMPLED 1-s2.0-S0926860X25004971-gr3.sml https://s3-eu-west-1.amazonaws.com/prod-ucs-content-store-eu-west/content/pii:S0926860X25004971/gr3/THUMBNAIL/image/gif/cabb1aad3338e1210137494a6f89b5fe/gr3.sml gr3 gr3.sml sml 13205 164 210 IMAGE-THUMBNAIL 1-s2.0-S0926860X25004971-gr12.jpg https://s3-eu-west-1.amazonaws.com/prod-ucs-content-store-eu-west/content/pii:S0926860X25004971/gr12/DOWNSAMPLED/image/jpeg/b70f12a26fe97baacb90cb6eb0b70829/gr12.jpg gr12 gr12.jpg jpg 52037 489 678 IMAGE-DOWNSAMPLED 1-s2.0-S0926860X25004971-gr12.sml https://s3-eu-west-1.amazonaws.com/prod-ucs-content-store-eu-west/content/pii:S0926860X25004971/gr12/THUMBNAIL/image/gif/c2201fe316078a701585894a43353dce/gr12.sml gr12 gr12.sml sml 6064 158 219 IMAGE-THUMBNAIL 1-s2.0-S0926860X25004971-gr9.jpg https://s3-eu-west-1.amazonaws.com/prod-ucs-content-store-eu-west/content/pii:S0926860X25004971/gr9/DOWNSAMPLED/image/jpeg/774b62529699347c310fb195eb5588da/gr9.jpg gr9 gr9.jpg jpg 84881 491 678 IMAGE-DOWNSAMPLED 1-s2.0-S0926860X25004971-gr9.sml https://s3-eu-west-1.amazonaws.com/prod-ucs-content-store-eu-west/content/pii:S0926860X25004971/gr9/THUMBNAIL/image/gif/79c5953d9e12c10049e8341178847454/gr9.sml gr9 gr9.sml sml 13067 159 219 IMAGE-THUMBNAIL 1-s2.0-S0926860X25004971-gr6.jpg https://s3-eu-west-1.amazonaws.com/prod-ucs-content-store-eu-west/content/pii:S0926860X25004971/gr6/DOWNSAMPLED/image/jpeg/a769f891f292d3e352c8be24a689e46e/gr6.jpg gr6 gr6.jpg jpg 89721 352 678 IMAGE-DOWNSAMPLED 1-s2.0-S0926860X25004971-gr6.sml https://s3-eu-west-1.amazonaws.com/prod-ucs-content-store-eu-west/content/pii:S0926860X25004971/gr6/THUMBNAIL/image/gif/e41e53ca76a207ff7c94e4ac8974b660/gr6.sml gr6 gr6.sml sml 18737 114 219 IMAGE-THUMBNAIL 1-s2.0-S0926860X25004971-gr5.jpg https://s3-eu-west-1.amazonaws.com/prod-ucs-content-store-eu-west/content/pii:S0926860X25004971/gr5/DOWNSAMPLED/image/jpeg/86a60275e66b35742c78a530083e7d5b/gr5.jpg gr5 gr5.jpg jpg 50948 270 678 IMAGE-DOWNSAMPLED 1-s2.0-S0926860X25004971-gr5.sml https://s3-eu-west-1.amazonaws.com/prod-ucs-content-store-eu-west/content/pii:S0926860X25004971/gr5/THUMBNAIL/image/gif/71936b69f6d868026a4c2f84d512f150/gr5.sml gr5 gr5.sml sml 7974 87 219 IMAGE-THUMBNAIL 1-s2.0-S0926860X25004971-gr8.jpg https://s3-eu-west-1.amazonaws.com/prod-ucs-content-store-eu-west/content/pii:S0926860X25004971/gr8/DOWNSAMPLED/image/jpeg/8f024e3dae3d3d0f782f6b840461e0f5/gr8.jpg gr8 gr8.jpg jpg 35816 314 508 IMAGE-DOWNSAMPLED 1-s2.0-S0926860X25004971-gr8.sml https://s3-eu-west-1.amazonaws.com/prod-ucs-content-store-eu-west/content/pii:S0926860X25004971/gr8/THUMBNAIL/image/gif/a4b17ac4c22b36aaa09f18e1189d1fce/gr8.sml gr8 gr8.sml sml 8995 135 219 IMAGE-THUMBNAIL 1-s2.0-S0926860X25004971-gr7.jpg https://s3-eu-west-1.amazonaws.com/prod-ucs-content-store-eu-west/content/pii:S0926860X25004971/gr7/DOWNSAMPLED/image/jpeg/6ed7c24d4c40d241e88f211cb16da879/gr7.jpg gr7 gr7.jpg jpg 78569 462 791 IMAGE-DOWNSAMPLED 1-s2.0-S0926860X25004971-gr7.sml https://s3-eu-west-1.amazonaws.com/prod-ucs-content-store-eu-west/content/pii:S0926860X25004971/gr7/THUMBNAIL/image/gif/a8f7ddbe2bbb8e262d4818dc5a6a6349/gr7.sml gr7 gr7.sml sml 9233 128 219 IMAGE-THUMBNAIL 1-s2.0-S0926860X25004971-ga1_lrg.jpg https://s3-eu-west-1.amazonaws.com/prod-ucs-content-store-eu-west/content/pii:S0926860X25004971/HIGHRES/image/jpeg/e948d2cd0a0becd315b433e7d6044902/ga1_lrg.jpg ga1 true ga1_lrg.jpg jpg 183573 886 1586 IMAGE-HIGH-RES 1-s2.0-S0926860X25004971-gr2_lrg.jpg https://s3-eu-west-1.amazonaws.com/prod-ucs-content-store-eu-west/content/pii:S0926860X25004971/HIGHRES/image/jpeg/937656a6fd9946150fb8f6c1c531beb9/gr2_lrg.jpg gr2 gr2_lrg.jpg jpg 390473 2163 2994 IMAGE-HIGH-RES 1-s2.0-S0926860X25004971-gr11_lrg.jpg https://s3-eu-west-1.amazonaws.com/prod-ucs-content-store-eu-west/content/pii:S0926860X25004971/HIGHRES/image/jpeg/602f05378ec17faa8ee9030052ee9b52/gr11_lrg.jpg gr11 gr11_lrg.jpg jpg 524755 2232 2994 IMAGE-HIGH-RES 1-s2.0-S0926860X25004971-gr1_lrg.jpg https://s3-eu-west-1.amazonaws.com/prod-ucs-content-store-eu-west/content/pii:S0926860X25004971/HIGHRES/image/jpeg/b1fbcb2c9d1824e651756a04c4b02743/gr1_lrg.jpg gr1 gr1_lrg.jpg jpg 329069 2498 2994 IMAGE-HIGH-RES 1-s2.0-S0926860X25004971-gr10_lrg.jpg https://s3-eu-west-1.amazonaws.com/prod-ucs-content-store-eu-west/content/pii:S0926860X25004971/HIGHRES/image/jpeg/c47cad84137e7add042e63803c71d62a/gr10_lrg.jpg gr10 gr10_lrg.jpg jpg 260295 2298 2994 IMAGE-HIGH-RES 1-s2.0-S0926860X25004971-gr4_lrg.jpg https://s3-eu-west-1.amazonaws.com/prod-ucs-content-store-eu-west/content/pii:S0926860X25004971/HIGHRES/image/jpeg/cfc4a69f317e63ea4af78371e69f6ad7/gr4_lrg.jpg gr4 gr4_lrg.jpg jpg 275516 1233 2994 IMAGE-HIGH-RES 1-s2.0-S0926860X25004971-gr3_lrg.jpg https://s3-eu-west-1.amazonaws.com/prod-ucs-content-store-eu-west/content/pii:S0926860X25004971/HIGHRES/image/jpeg/2eec1407cbca7d6cf8b9d2603b662274/gr3_lrg.jpg gr3 gr3_lrg.jpg jpg 248348 1300 1665 IMAGE-HIGH-RES 1-s2.0-S0926860X25004971-gr12_lrg.jpg https://s3-eu-west-1.amazonaws.com/prod-ucs-content-store-eu-west/content/pii:S0926860X25004971/HIGHRES/image/jpeg/09e0e123b8a82f2a6eb1c4898fc6be11/gr12_lrg.jpg gr12 gr12_lrg.jpg jpg 229267 2159 2994 IMAGE-HIGH-RES 1-s2.0-S0926860X25004971-gr9_lrg.jpg https://s3-eu-west-1.amazonaws.com/prod-ucs-content-store-eu-west/content/pii:S0926860X25004971/HIGHRES/image/jpeg/4c869bc59649c59d9b43df85460d5275/gr9_lrg.jpg gr9 gr9_lrg.jpg jpg 386981 2167 2994 IMAGE-HIGH-RES 1-s2.0-S0926860X25004971-gr6_lrg.jpg https://s3-eu-west-1.amazonaws.com/prod-ucs-content-store-eu-west/content/pii:S0926860X25004971/HIGHRES/image/jpeg/8dcf80556e60730adf017dd8c370710a/gr6_lrg.jpg gr6 gr6_lrg.jpg jpg 487302 1555 2994 IMAGE-HIGH-RES 1-s2.0-S0926860X25004971-gr5_lrg.jpg https://s3-eu-west-1.amazonaws.com/prod-ucs-content-store-eu-west/content/pii:S0926860X25004971/HIGHRES/image/jpeg/5fcad3ab6f9d393a6b58b47355f6f2cd/gr5_lrg.jpg gr5 gr5_lrg.jpg jpg 273075 1191 2994 IMAGE-HIGH-RES 1-s2.0-S0926860X25004971-gr8_lrg.jpg https://s3-eu-west-1.amazonaws.com/prod-ucs-content-store-eu-west/content/pii:S0926860X25004971/HIGHRES/image/jpeg/acfb044d9382f063407845e3624a68c8/gr8_lrg.jpg gr8 gr8_lrg.jpg jpg 199694 1387 2245 IMAGE-HIGH-RES 1-s2.0-S0926860X25004971-gr7_lrg.jpg https://s3-eu-west-1.amazonaws.com/prod-ucs-content-store-eu-west/content/pii:S0926860X25004971/HIGHRES/image/jpeg/d05ea02676bd0498b5b7b05be869d2d8/gr7_lrg.jpg gr7 gr7_lrg.jpg jpg 368390 2038 3493 IMAGE-HIGH-RES 1-s2.0-S0926860X25004971-mmc1.docx https://s3-eu-west-1.amazonaws.com/prod-ucs-content-store-eu-west/content/pii:S0926860X25004971/mmc1/MAIN/application/vnd.openxmlformats-officedocument.wordprocessingml.document/baf042dd885b0904975c98f9efc33f2c/mmc1.docx mmc1 mmc1.docx docx 6767366 APPLICATION 1-s2.0-S0926860X25004971-si0001.svg https://s3-eu-west-1.amazonaws.com/prod-ucs-content-store-eu-west/content/pii:S0926860X25004971/image/svg+xml/b78ecf30c80913694a0f1bf2f11be142/si0001.svg si0001 si0001.svg svg 4745 ALTIMG 1-s2.0-S0926860X25004971-si0002.svg https://s3-eu-west-1.amazonaws.com/prod-ucs-content-store-eu-west/content/pii:S0926860X25004971/image/svg+xml/8677f6b5e6114b4862a4b020c084386c/si0002.svg si0002 si0002.svg svg 5308 ALTIMG 1-s2.0-S0926860X25004971-si0003.svg https://s3-eu-west-1.amazonaws.com/prod-ucs-content-store-eu-west/content/pii:S0926860X25004971/image/svg+xml/3fb52ee36d79a690946c217485c1ccbb/si0003.svg si0003 si0003.svg svg 1912 ALTIMG 1-s2.0-S0926860X25004971-si0004.svg https://s3-eu-west-1.amazonaws.com/prod-ucs-content-store-eu-west/content/pii:S0926860X25004971/image/svg+xml/70e6f28495863247ef949fd4099d2012/si0004.svg si0004 si0004.svg svg 2455 ALTIMG 1-s2.0-S0926860X25004971-si0005.svg https://s3-eu-west-1.amazonaws.com/prod-ucs-content-store-eu-west/content/pii:S0926860X25004971/image/svg+xml/778902d3e4e161c4d308f99a6c588634/si0005.svg si0005 si0005.svg svg 2791 ALTIMG 1-s2.0-S0926860X25004971-si0006.svg https://s3-eu-west-1.amazonaws.com/prod-ucs-content-store-eu-west/content/pii:S0926860X25004971/image/svg+xml/b288632d795e11f8065b0fe6b951d6a6/si0006.svg si0006 si0006.svg svg 3849 ALTIMG 1-s2.0-S0926860X25004971-si0007.svg https://s3-eu-west-1.amazonaws.com/prod-ucs-content-store-eu-west/content/pii:S0926860X25004971/image/svg+xml/6a605925d8d60e189e43d861d2ca473b/si0007.svg si0007 si0007.svg svg 952 ALTIMG 1-s2.0-S0926860X25004971-si0008.svg https://s3-eu-west-1.amazonaws.com/prod-ucs-content-store-eu-west/content/pii:S0926860X25004971/image/svg+xml/6a605925d8d60e189e43d861d2ca473b/si0008.svg si0008 si0008.svg svg 952 ALTIMG APCATA 120595 120595 S0926-860X(25)00497-1 10.1016/j.apcata.2025.120595 Elsevier B.V. Fig. 1 Powder XRD of A) phosphomolybdic acid before and after proton exchange by ammonium ions, and doping of vanadium at different Keggin positions (such as primary and secondary); B) Expanded XRD (2θ= 50°-70°) of undoped and doped ammonium phosphomolybdate salts; C) XRD of undoped and VO species doped (at secondary Keggin position) ammonium phosphomolybdate salts; D) Expanded XRD (2θ= 26°-27°) of undoped and VO species doped (at secondary kegging position) ammonium phosphomolybdate salts. Fig. 1 Fig. 2 FTIR spectra of (a) PMA, (b) NH4PM, (c) NH4PMV, (d) (VO) 0.1-NH4PM, (e) (VO) 0.2-NH4PM and (f) (VO) 0.3-NH4PM respectively, [inset(blue): The FTIR spectra of NH4PM, NH4PMV, and (VO) 0.2-NH4PM were compared in the wavenumber region of 700–1100 cm⁻¹ ; inset (orange): Shifting of N-H bond in the FTIR spectra (region: 1350–1500 cm−1) of the redox catalysts (i.e. vanadium doped ammonium phosphomolybdates) due to V or VOx-species doping at the primary and secondary Keggin positions, respectively]. Fig. 2 Fig. 3 Raman spectra of pristine phosphomolybdic acid (PMA), ammonium phosphomolybdate (NH4PM) and vanadium-doped ammonium phosphomolybdate salts (i.e. NH4PMV and (VO)x-NH4PM). Fig. 3 Fig. 4 BET adsorption isotherms of redox catalysts: PMA, NH4PM, (VO)0.2-NH4PM, NH4PMV (A); and their corresponding pore size distribution (PSD) curves determined from the desorption branch of the isotherm by the BJH method (B); Inset in B shows the BET surface area (SBET) of the samples obtained from the linear fit in the P/P0 range of 0.05–0.2 and the total pore volume (V) from the adsorbed amount at P/P0 = 0.99. Fig. 4 Fig. 5 BET adsorption isotherms of acid catalysts: Na-MMT, H-MMT, 15 Dol/H-MMT (A); and their corresponding pore size distribution (PSD) curves determined from the desorption branch of the isotherm by the BJH method (B); Inset in B shows the BET surface area (SBET) of the samples obtained from the linear fit in the P/P0 range of 0.05–0.2 and the total pore volume (V) from the adsorbed amount at P/P0 = 0.99. Fig. 5 Fig. 6 SEM images (5 K resolution) of PMA (A), NH4PM (B), NH4PMV (C), (VO) 0.1-NH4PM (D), (VO) 0.2-NH4PM (E), (VO) 0.3-NH4PM (F), respectively [inset: images at 60k resolution; elemental mapping of V in corresponding materials]. Fig. 6 Fig. 7 XPS analysis, Mo 3d XPS spectra of the following: PMA (E), NH4PM (F), NH4PMV (G), and (VO)0.2-NH4PM (H);P 2p spectra of followings: PMA (A), NH4PM (B), NH4PMV (C), and (VO)0.2-NH4PM (D); O 1 s spectra of the following: PMA (I), NH4PM (J), NH4PMV (K), (VO)0.2-NH4PM (L), indicating the presence of different types of oxygen such as lattice oxygens (OMo +6-O and OMo +5-O), physisorbed hydroxyl oxygen (OO-H), OChem (chemisorbed oxygen species) and oxygen vacancy or surface defect (Od). Fig. 7 Fig. 8 O2-TPD spectra of the active redox catalysts: NH4PMV and (VO)0.2-NH4PM (A), and NH3-TPD spectra of the employed acid catalysts: Na-MMT, H-MMT and 15 Dol/H-MMT (B). Fig. 8 Fig. 9 Catalytic activity of undoped and V-doped NH4PM catalysts in gas-phase glycerol conversion to acrylic acid and allyl alcohol: (A) comparative study of product selectivity of NH4PM, NH4PMV, and (VO)x-NH4PM catalysts (Reaction Cond.- catalyst loading- 0.2 g H-MMT + 0.2 g NH4PM or (VO)x-NH4PM or NH4PMV, 40–60 mesh; 21 ml/min air flow rate, 20 wt% glycerol feed at 0.1 ml/min, 310℃, 2 h. Optimization of different loading ratio of acid catalyst (H-MMT) is to redox catalyst i.e. NH4PMV (B) and (VO)0.2-NH4PM (C) in distinct sequential double bed catalytic systems (Reaction Cond.- total amount of catalyst loading (i.e. acid cat. + redox cat.) - 0.4 g, 40–60 mesh; 21 ml/min air flow rate, 20 wt% glycerol feed at 0.1 ml/min, 310℃, 2 h), respectively. (D) Comparative study of single Bed (SB) and sequential double bed (DB) for the following catalytic systems: HMMT+NH4PMV, and HMMT+ (VO)0.2-NH4PM. To prepare the single bed (SB), the optimum amount of acid catalyst and redox catalyst (obtained from the above study) was physically mixed with quartz and then placed in the middle of the reactor tube and packed by the quartz wool from both sides (Reaction Cond.- total amount of Catalyst loading: 0.4 g, 40–60 mesh; 21 ml/min air flow rate, 20 wt% glycerol feed at 0.1 ml/min, 310℃, 2 h). Fig. 9 Fig. 10 Kinetic studies: (A) First-order kinetic plot, (B) corresponding Arrhenius plots and (C) Eyring-Polanyi’s plots of two distinct catalytic systems, such as HMMT+NH4PMV- DB and HMMT+ (VO)0.2-NH4PM- DB. Fig. 10 Fig. 11 Impact of dolomite addition in acid catalyst: (A) Time on stream study of glycerol conversion to acrolein using the following acid catalysts: NaMMT, HMMT and 15 Dol/HMMT catalysts ((reaction condition: temperature- 310 °C, catalyst loading- 0.2 g, carrier gas - air at 21 ml/min, and feed flow rate = 0.1 ml/min); (B) Time on stream study of glycerol conversion to acrylic acid and allyl alcohol using with and without dolomite added acid catalysts associated with corresponding redox catalyst (i.e. NH4PMV and (VO)0.2-NH4PM), [here A, Dol A, B and Dol B indicate the following catalytic systems: HMMT+NH4PMV- DB, 15 Dol/HMMT+NH4PMV- DB, HMMT+ (VO)0.2-NH4PM- DB and 15 Dol/HMMT+ (VO)0.2-NH4PM- DB, respectively], reaction condition: temperature- 310 °C, total catalyst loading- 0.4 g, carrier gas - air at 21 ml/min, and feed flow rate = 0.1 ml/min; (C) TGA profile of used HMMT catalyst and used y-Dol/ HMMT catalysts (y i.e. amount of dolomite added with HMMT = 5, 10, 15, 20) (D) TGA profile of used 15 wt% dolomite added HMMT catalysts employed at different reaction temperatures and the TGA of regenerated 15 Dol/HMMT catalyst. Fig. 11 Fig. 12 Plausible mechanistic pathway for transformation of glycerol to acrylic acid and allyl alcohol over HMMT+NH4PMV- DB and HMMT+ (VO)0.2-NH4PM- DB catalytic system, respectively. Fig. 12 Elucidating Keggin site-specific activity of NH4PM catalysts associated with dolomite-added H-MMT in gas-phase glycerol valorisation reactions Tania Roy Writing – review & editing Writing – original draft Visualization Validation Methodology Investigation Formal analysis Data curation Conceptualization a Jin Wang Visualization Validation Formal analysis a Rongzhen Mu Visualization Validation a Alfin Kurniawan Visualization Validation Funding acquisition a Xiaolan Chen Visualization Methodology a Chenglan Liu Visualization Validation a Guoya Wang Visualization Validation a Chun Hui Zhou Supervision Investigation Funding acquisition a b c ⁎ a Research Group for Advanced Materials & Sustainable Catalysis (AMSC), State Key Laboratory of Green Chemical Synthesis and Conversion, College of Chemical Engineering, Zhejiang University of Technology, Hangzhou 310032, China Research Group for Advanced Materials & Sustainable Catalysis (AMSC), State Key Laboratory of Green Chemical Synthesis and Conversion College of Chemical Engineering Zhejiang University of Technology Hangzhou 310032 China Research Group for Advanced Materials & Sustainable Catalysis (AMSC), State Key Laboratory of Green Chemistry Synthesis Technology, College of Chemical Engineering, Zhejiang University of Technology, Hangzhou 310032, China b Anhui International Exchange and Cooperation Base, Qing Yang Institute for Industrial Minerals, Youhua, Qingyang, Anhui 242804, China Anhui International Exchange and Cooperation Base Qing Yang Institute for Industrial Minerals Youhua Qingyang Anhui 242804 China Anhui International Exchange and Cooperation Base, Qing Yang Institute for Industrial Minerals, Youhua, Qingyang, Anhui 242804, China c Engineering Research Centre of Non-metallic Minerals of Zhejiang Province, Hangzhou 310032, China Engineering Research Centre of Non-metallic Minerals of Zhejiang Province Hangzhou 310032 China Engineering Research Centre of Non-metallic Minerals of Zhejiang Province, Hangzhou 310032, China ⁎ Corresponding author at: Research Group for Advanced Materials & Sustainable Catalysis (AMSC), State Key Laboratory of Green Chemistry Synthesis Technology, College of Chemical Engineering, Zhejiang University of Technology, Hangzhou 310032, China. Research Group for Advanced Materials & Sustainable Catalysis (AMSC), State Key Laboratory of Green Chemistry Synthesis Technology, College of Chemical Engineering, Zhejiang University of Technology Hangzhou 310032 China Transforming glycerol into value-added chemicals like acrylic acid and allyl alcohol enhances biorefinery sustainability. We report a one-pot gas-phase process using a dual-bed catalytic system: acidified montmorillonite (H-MMT, upper bed) and vanadium-doped ammonium phosphomolybdate (V-doped NH4PM, lower bed). The combination of H-MMT and primary V-doped NH4PM (NH4PMV) catalyst favoured the oxydehydration reaction and was susceptible to the selective conversion of glycerol to acrylic acid (Sel.- 63 %). On the other hand, H-MMT and secondary VOx-doped NH4PM ((VO)x-NH4PM) catalysts preferred the selective production of allyl alcohol via deoxydehydration reaction. Maximum allyl alcohol selectivity of 61 % was achieved by 1:2 wt. ratio of HMMT and (VO)0.2-NH4PM dual bed catalytic system. O2-TPD and XPS analyses revealed that V doping at the primary Keggin site of NH4PM increased surface oxygen defects and enhanced Mo6 + /Mo5+ charge transfer, promoting acrolein oxidation to acrylic acid. In contrast, secondary V-doped catalysts had fewer oxygen vacancies and were less effective for oxidation but showed high efficiency in hydrogen transfer from formic acid, methanol, or water, favoring allyl alcohol formation. Additionally, the following thermo-kinetic factors were evaluated for the best-performing catalysts, providing insights into the factors contributing to their high catalytic activity. Furthermore, incorporating 15 wt% dolomite into H-MMT reduced coke formation from 34.1 % to 2.54 % post-regeneration and extended catalyst life to 8 h of TOS while maintaining > 40 % product selectivity, offering a practical strategy for coking resistance. Graphical Abstract Keywords V-doping Keggin sites Glycerol Acrylic acid Allyl alcohol Dolomite Data Availability Data will be made available on request. 1 Introduction The rapid growth of the biodiesel industry has led to surplus crude glycerol production, exceeding 50 billion litres in 2021 [1]. This oversupply depresses its market value and poses environmental challenges, underscoring the need for efficient catalytic routes to convert glycerol into value-added chemicals for a sustainable biodiesel economy. Owing to its unique tri-hydroxyl structure, glycerol undergoes diverse chemical transformations, including dehydration, esterification, etherification, oxidation, acetalization, reforming, carbonylation, and hydrogenolysis, leading to more than 1500 products spanning food, pharmaceutical, polymer, and specialty chemical sectors [2]. Among these, acrylic acid (AA) and allyl alcohol (ALA) are particularly attractive as bulk chemicals produced through gas-phase oxydehydration and deoxydehydration of glycerol, respectively [3,4]. Acrylic acid serves as a key monomer in superabsorbent polymers, coatings, and adhesives, while allyl alcohol finds applications in flame retardants, plasticizers, and specialty resins. Intriguingly, both reactions typically occur under similar conditions-high temperatures above 280 °C in the presence of oxygen or air using solid acid catalysts [5–7]. However, achieving high selectivity toward AA or ALA remains challenging due to multiple competitive pathways leading to undesired byproducts such as acrolein, acetol, acetone, acetaldehyde, glycols, and propanediols [6]. Moreover, under high-temperature oxidative environments, condensation and polymerization reactions yield coke precursors, which rapidly deposit on catalyst surfaces, blocking active sites and causing severe deactivation [8,9]. Thus, designing bifunctional catalytic systems capable of maintaining long-term stability while promoting selective partial oxidation or deoxygenation of glycerol remains a key research priority. Keggin-type heteropoly compounds (HPCs) have attracted significant attention owing to their unique combination of Brønsted acidity, redox properties, and thermal stability [10–13]. Structurally, HPCs consist of a central heteroatom (e.g., P or Si) surrounded by twelve polyatoms (e.g., Mo, W, Si, etc.) in a highly symmetric Keggin anion framework. The Brønsted acidity originates from protons associated with the Keggin anions, while redox properties stem from the variable oxidation states of polyatoms, enabling acid-redox bifunctionality within a single material. The physicochemical properties of HPCs can be precisely tuned by substituting protons or polyatoms with other cations or transition metals at either the primary structure (into the Keggin framework) or secondary structure (counter-cation positions) [14–18]. For instance, Li and Zhang [19] reported that H0.5Cs2.5PW12O40 (CsPW) exhibited strong acidity but limited oxidation potential, whereas H0.5Cs2.5PMo12O40 (CsPMo) showed the opposite trend. By combining these phases in Cs(VO)0.2(PMo)x(PW)1-x solid solutions, leading to optimized surface acidity for glycerol dehydration to acrolein, and favourable oxidation potential for the partial oxidation of acrolein to AA. Further, it was also noticed that incorporation of VOx at the secondary Keggin structure improved the synergic interaction between the cations like Cs+, VO2+ and the polyions (PMo12O40 3− and PW12O40 3−), resulting in high selectivity of AA (60 %) and high stability. Similarly, Thanasilp et al. [20] demonstrated that vanadium doping at the secondary structure of SiW/HZSM-5 catalysts significantly improved AA selectivity, whereas Ce- and Co-modified analogs promoted complete oxidation, forming COx byproducts despite high glycerol conversions. These studies highlight that V-doping at the secondary Keggin structure governs the delicacy between acidity and redox functionality, which further directs the product distributions. Moreover, literature reports suggest that V incorporation at the primary Keggin structure favors selective oxidation reactions, including the oxidation of benzylic alcohol and terpene alcohols [21–23]. However, no systematic investigation has addressed the site-specific role of metal doping at both primary and secondary Keggin positions in tailoring catalytic behavior for glycerol valorization. Vogel and co-workers [24–28] further emphasized that Mo–V–W mixed oxides exhibit high AA selectivity through the formation of MoO3–Mo5O14-type crystalline phases, while V2O5-type oxides dominate total oxidation above 400 °C. Interestingly, our recent work revealed that Mo–V–O catalysts also facilitate ALA formation via glycerol deoxydehydration. The presence of MoVOx active species along with weak-strong acidity promoted the glycerol conversion towrads allyl alcohol selectivity [29,30]. Also, Fernandes et al. [31] demonstrated that combining low Brønsted acidity with redox-active V⁵⁺ centres favours partial deoxygenation, suppressing over-oxidation to COx. These findings underscore the dual reactivity of Mo–V–O systems in glycerol valorization, warranting further studies to disentangle active site contributions under controlled reaction environments. In gas-phase glycerol conversion, acid catalysts play a pivotal role in dehydration steps, while redox catalysts mediate subsequent oxidation or deoxygenation reactions. Among acid catalysts, montmorillonite (MMT), a naturally occurring layered aluminosilicate, stands out due to its low cost, high surface area, tunable acidity, and environmental benignity [32,33]. For instance, WOx/MMT catalysts achieved 90 % glycerol conversion with 82 % acrolein selectivity at 320 °C [34]. Nevertheless, like other solid acids, MMT suffers from coke deposition on strong Brønsted sites, restricting mass transfer and accelerating deactivation [35,36]. Acid treatment strategies enhance MMT surface area, porosity, and acidity, improving catalytic performance while mitigating coke formation [37–39]. Samudrala et al. [40] reported that sulfuric acid treatment improved pore structure (micropores and narrow mesopores changed to wide mesopores) and increased MMT surface area (188–206 m2/g), which eventually protected from pore blocking owing to carbon deposits, and extended the catalyst’s life. Similar enhancements were noted by Yu et al. [34] and Fu et al. [41], establishing acid-activated MMT (H-MMT) as a promising dehydration catalyst for glycerol conversion. To further suppress coke deposition, recent studies explored adding basic or redox-active oxides to acid catalysts. Ou et al. [42] showed that incorporating CaO or MgO into Ni/CeO2 catalysts reduced coking by activating CO2 and generating reactive oxygen species. However, excessive basicity favored other side product formation. In this context, dolomite (CaMg(CO3)2) offers a balanced approach, providing mild Lewis acidity without introducing strong basic sites, potentially optimizing Brønsted/Lewis ratios while limiting side reactions. Despite extensive studies on glycerol valorization, key knowledge gaps remain: (i) the site-specific influence of metal doping at primary versus secondary Keggin positions on acidity–redox synergy and product selectivity is not well understood; (ii) the dual functionality of Mo–V–O catalysts in driving both oxydehydration to AA and deoxydehydration to ALA under similar conditions lacks mechanistic clarity; and (iii) effective strategies to suppress coke deposition while preserving high activity and selectivity, particularly using low-cost supports like MMT, are still underexplored. Addressing these gaps forms the core novelty of this work. In this study, we selected V-doped ammonium phosphomolybdate as a model of Mo-V-O redox catalyst to investigate the effect of V doping at two distinct Keggin positions (primary and secondary) on their physicochemical property and catalytic performance for gas-phase valorization of glycerol to acrylic acid and allyl alcohol under air atmosphere (see Figure. S1 in supporting information). To explore the activity of these two types of catalysts, specifically in redox reaction, we embedded them individually in separate beds, each paired with an additional bed of acid catalyst positioned above (see Figure. S2 in supporting information). The loading of acid catalyst and redox catalyst in separated beds is based on our speculation that this arrangement minimizes the occurrence of unwanted reactions like oxidation of glycerol and its intermediates. Moreover, this setup allows for individual modification of the acid catalyst and redox catalyst, providing a clearer understanding of the individual as well as synergistic effects between acid–redox catalysts on product selectivity toward AA and ALA. Additionally, the role of dolomite-modified H-MMT in mitigating coke deposition was also studied. Through systematic characterization and catalytic testing, this study provides new insights into designing site-engineered heteropoly catalysts coupled with tailored acid supports for efficient and selective gas-phase glycerol valorization. 2 Experimental 2.1 Materials and chemicals Pristine sodium montmorillonite (Na-MMT) and natural dolomite (ND) were obtained from the Qing Yang Institute for Industrial Minerals (QYIM), Anhui Province, China. The required chemicals like glycerol (C3H8O3, 99 %), vanadium oxide (V2O5, ≥ 98 %) and vanadium oxytrichloride (VOCl3, 99 %) were purchased from MilliporeSigma (Previously known as Sigma-Aldrich or Merck, USA); phosphomolybdic acid hydrate (H3PMo12O40.xH2O, ACS reagent), molybdenum(VI) oxide (MoO3, ACS reagent), ammonium hydroxide (28–30 % NH3 solution, ACS reagent) and phosphoric acid (≥85 wt% of H3PO4 in H2O, ACS reagent) were procured from Aladdin® (China). All clay materials were purified through sequential steps, including centrifugation, washing, drying, and sieving into a fine powder. However, the chemicals were used directly without further purification. Deionized water was utilized for the preparation of all aqueous solutions. 2.2 Catalyst preparation 2.2.1 Preparation of (NH4)4PMo11VO40 salt (NH4)4PMo11VO40 was prepared by synthesizing H4PMo11VO40 acid followed by precipitation to ammonium salt. Based on the reported procedure, 110 mmol of molybdenum oxide (15.8 g) and 4.9 mmol of vanadium oxide (0.9 g) were dissolved in 350 ml DI water contained in 500 ml R.B. and heated to boiling at 100 °C. Then 1.2 mmol of phosphoric acid (1.2 g) was added dropwise into the above metal oxide solution under vigorous stirring, and subsequently refluxed for 6 h. A clear orange-coloured solution was obtained after cooling to room temperature. Finally, H4PMo11VO40 acid was obtained by evaporating the water, recrystallizing, and drying at 100°C for 5 h. Next, to prepare the (NH4)4PMo11VO40 salt, a measured quantity of H4PMo11VO40 acid was dissolved in 30 ml of deionized (DI) water. A stoichiometric amount of ammonium hydroxide was then added dropwise to the solution, resulting in the formation of a yellow precipitate of (NH4)4PMo11VO40. The precipitate was subsequently heated to evaporate the remaining water and dried at 100°C for 5 h. The dried solid was ground and sieved to a particle size of 20 mesh and designated as NH4PMV. 2.2.2 Preparation of (VO)x(NH4)(3–3x)PMo12O40 salts The vanadium-substituted (secondary) ammonium phosphomolybdate salts were prepared by following the typical precipitation method. Firstly, a certain amount of phosphomolybdic acid hydrate was dissolved in 30 ml of distilled water at room temperature under vigorous stirring. Then the stoichiometric volumes of vanadium oxytrichloride and ammonium hydroxide were subsequently added to the above solution. Upon the addition of ammonium hydroxide, an orangish-yellow precipitate began to form immediately. The mixture was stirred for 30 min, aftermath the temperature was raised to 80°C to evaporate the water, resulting in a slurry. The semi-solid slurry was then placed in an air oven at 100°C for 8 h to ensure complete drying. Finally, the dried sample was pressed, crushed, and sieved to the particle size of 20 mesh for catalytic applications. The (VO)x(NH4)(3–3x)PMo12O40 salts were labelled based on the VO doping level, e.g., (VO)0.1-NH4PM, (VO)0.15-NH4PM, (VO)0.2-NH4PM, (VO)0.25-NH4PM, and (VO)0.3-NH4PM, corresponding to VO doping values of 0.1, 0.15, 0.2, 0.25, and 0.3, respectively. 2.2.3 Acidification of MMT and dolomite incorporation in acidified-MMT The pristine montmorillonite (Na-MMT) was acid-activated via wet impregnation method using aqueous phosphoric acid (85 % aq. H3PO4) solution. To prepare 5 wt% suspension, first a stipulated amount of Na-MMT was dispersed into 1 M H3PO4 solution which was, kept in 250 ml round bottom flux equipped with a condenser. The acidification process was accomplished at 80 °C under constant stirring over 6 h. After cooling to ambient temperature, the suspension was centrifuged at 4000 rpm for 10 min and subsequently washed several times with distilled water and 75 % aqueous ethanol. The collected solid was then dried at 100 °C in an air oven for 24 h and finally, ground to a fine powder through sieves 30–40 mesh. The acid-activated MMT is designated as H-MMT throughout the article. In order to study the influence of dolomite along with H-MMT on coking resistance, 5, 10, 15 and 20 wt% of dolomite was incorporated into H-MMT via simple mechanical mixing. A definite amount of dolomite was physically agitated with H-MMT in pastel-mortar using acetone as a solvent medium. After 1 h of agitation, the mixture was kept in the air oven at 80 °C for 30 min and then crushed into a fine powder (30–40 mesh). According to the weight percentage of dolomite (5, 10, 15 and 20 wt%) into H-MMT, the resultant solids were termed as 5-Dol/H-MMT, 10-Dol/H-MMT, 15-Dol/H-MMT and 20-Dol/H-MMT respectively. 2.3 Gas-phase glycerol conversion reactions Figure S2 clearly illustrates the design of the operating reactor used for gas-phase glycerol conversion reactions, along with the projection of the catalyst beds (supporting information). As shown in Figure S2, the glycerol conversion reactions were conducted in a continuous downflow fixed-bed quartz reactor (length of 52 cm) with an inner diameter of 1 cm under atmospheric pressure. At the isothermal zone of the reactor (10 cm in the middle), two catalysts were sequentially loaded in two separate beds and those were secured from each other as well as both ends by quartz wool. The upper bed contained the acid catalyst (H-MMT or y-Dol/H-MMT) for the dehydration reaction and the lower bed contained a redox catalyst (NH4PMV or (VO)x-NH4PM) for the redox reaction (oxidation or hydrogenation). Each catalyst bed was made of 0.2 g of catalyst (20–40 mesh) mixed with quartz sand (40–60 mesh) with 1:1 wt ratio. Before starting the catalytic experiment, the constructed catalyst beds were preheated at 300 °C for 1 h in an inert atmosphere (N2) with a flow rate of 21 ml.min−1; subsequently, 20 wt% aqueous glycerol solution (w/w) was fed into the vaporiser (at 180 °C) with a flow rate of 1 ml/min using a Kontron Instruments 422 HPLC syringe pump. The vaporised feed was then flown through the reactor using airflow (flow rate- 21 ml/min). The condensable organic products were collected hourly in a cold trap directly connected to the outlet of the reactor, and further analysed by GC-FID (Shimadzu GC-2014) assembled with an AT-FFAP capillary column of length 30 m (internal diameter- 0.32 mm and film thickness- 0.25 µm) and a flame ionization detector (see the full description of GC analysis and testing conditions in supporting information). However, gaseous products could not be analyzed due to the lack of equipment facilities. The gaseous products, minor liquid organic products and the carbonaceous depositions on the catalysts were collectively categorized as ‘Other’ for maintaining mass balance (details are given in supporting information). The glycerol conversion (X) and the product selectivity (S) were calculated using the following Eq. (1) & (2), respectively (1) X = Moles of glycerol reacted Moles of glycerol fed into the reactor × 100 % (2) S = Moles of glycerol converted to a specific product Moles of glycerol reacted × 100 % 3 Results and discussion 3.1 Structure analysis by powder-XRD, ATR-FTIR and Raman spectroscopy Doping of metal cations at different positions in PMA Keggin impacts the corresponding symmetry and molecular arrangement, which can be monetarized by XRD analysis. Fig. 1A represents the powder XRD pattern of phosphomolybdic acid (PMA), ammonium phosphomolybdate (NH4PM), primary vanadium-doped ammonium phosphomolybdate (NH4PMV) and secondary vanadium species (VO) doped ammonium phosphomolybdate ((VO)x-NH4PM, x = 0.2). The most significant diffraction peaks of PMA were found to be in the region of (5−10)°, (18−40)°, and (45−65)°. The noticeable differences in the XRD pattern were observed when the protons of PMA were exchanged with ammonium ions; this corroborated well with the literature [43,44]. The characteristic peaks at 2θ (°) = 10.83, 15.21, 18.57, 21.6, 24.1, 26.59, 30.60, 36.14, 39.3 designate the respective (110), (200), (211), (220), (310), (222), (400), (322), (510) planes of Pn3m cubic lattice of ammonium phosphomolybdate hydrate, confirmed by the reference of JCPDS database (file no.- 09–0412). Fig. 1B shows that both vanadium (V) doping at the primary Keggin and VO-species doping at the secondary Keggin position in PMA, improved crystallinity, preserving the characteristic peaks found between 2θ= 5° to 40°. This implies the primary heteropolyion-Keggin structure was intact even after both kinds of aforementioned modification. In the case of NH4PMV, two new peaks at 2θ (°) = 60.35 and 66.10 appeared (pointed by * in Fig. 1B) because the replacement of Mo by V in the primary Keggin position disrupted the symmetry of the entity to a small extent, but the overall Keggin structure was unaffected. However, in the case of (VO)x-NH4PM (x = 0.1, 0.2, and 0.3), no such additional peaks were observed, suggesting no new phase was generated. Additionally, vanadium species (VO) doping at secondary Keggin sites of PMA did not affect the primary structure; only the doping amount had a little effect on crystallinity (as shown in Fig. 1C). Moreover, with increasing VO doping levels (0.1–0.3), the highest intensity peak corresponding to the (222) plane shifted toward a lower diffraction angle (Fig. 1D), confirming the effective incorporation of VO species at the secondary Keggin position in ammonium phosphomolybdate. The XRD of the montmorillonite (Na-MMT), acid-treated montmorillonite (H-MMT) and dolomite-incorporated acidified-montmorillonite (dol-HMMT) are displayed in Figure S3A (supporting information). The pristine montmorillonite showed diffraction peaks at 2θ (°) = 7.04, 19.80, 34.61, 36.02, 61.91, which correspond to the (001), (020), (110), (006) and (060) planes of montmorillonite, respectively [34,45]; whereas, some additional peaks were also observed at 2θ (°) = 22, 28.58, which can be assigned for feldspars, a non-clay impurity phase. The basal spacing (d001) value of Na-MMT and H-MMT was calculated to be 1.25 nm and 1.46 nm, respectively; such expansion of ca. 0.21 nm is consistent with the literature and could be ascribed to cationic exchange between hydrated Na+ ion and proton in MMT interlayers [39,46,47]. In dolomite-incorporated H-MMT, the diffraction peaks associated with dolomite appeared at 2θ (°) = 30.97, 41.16, 50.5 and 51.1 corresponding to the (104), (11−3), (018) and (11−6) crystalline planes, respectively, confirmed by the JCPDS file no. #79–1342. An impurity phase of aragonite (2θ = 26.3°) was present in small amounts in dolomite, confirmed by the JCPDS file no. #71–2396. The FT-IR spectra of phosphomolybdic acid, undoped and vanadium-doped ammonium phosphomolybdate salts are shown in Fig. 2. The fingerprint region present in FTIR spectra of Keggin phosphomolybdate anion is observed in 500–1200 cm−1. In the Keggin-type framework, there are four different types of oxygen atoms: the O atom common to PO4 tetrahedron and a trimetallic group is referred as Oa; the O atom connecting two trimetallic groups is referred as Ob, the O atom connecting two MoO6 octahedral inside a trimetallic group is referred as Oc and the terminal O atom is denoted as Od. The major characteristic absorption bands present in infrared spectra of PMA are shown as the reference of dashed lines at 1063, 960, 885, and 778 cm−1 corresponding to the asymmetric stretching vibration of P-Oa bond of the central PO4 tetrahedron, asymmetric vibrations of Mo-Ob-Mo and Mo-Oc-Mo, and asymmetric stretching vibration of Mo-Od, respectively [43,48]. The above-mentioned all characteristic peaks were also observed in NH4PM, NH4PMV and (VO)x-NH4PM salts, indicating that the primary Keggin structure was preserved even after proton exchange with ammonium ions and vanadium (or vanadium species) doping either at the primary or secondary positions in Keggin ion. However, minute changes can be noticed when fingerprint regions of NH4PM, NH4PMV, and (VO)0.1-NH4PM are closely compared. As seen in the blue inset in Fig. 2, the bands present in the fingerprint region of NH4PMV and (VO)0.2-NH4PM are slightly shifted towards the lower wavenumber as the reference of NH4PM, suggesting both V and (VO)x doping caused weakening of Mo-O-Mo bond linkages. Furthermore, small shoulder peaks, obtained in infrared spectra of NH4PMV, can be seen at 1080 cm−1 and 996 cm−1 in P-Oa and Mo-Ob-Mo band regions, implying the replacement of one Mo atom by V led to a decrease in the symmetry of the Keggin framework and adding more absorption peaks [49–51]. When protons of PMA were replaced by ammonium ions, an obvious absorption band was obtained at 1410 cm−1 because of N-H stretching vibration [43]. In infrared spectra of (VO)x-NH4PM, no additional peak was observed, but the characteristic N-H band was shifted towards the lower frequency with incorporating more (VO)x species in heteropoly ion, as can be observed in Fig. 2: orange inset. So, corroborating XRD and FTIR results, it can be concluded that (VO)x was successfully doped at the secondary Keggin position in ammonium phosphomolybdate salt without causing any disturbance in the original Keggin framework. Figure S3B shows the FTIR spectra of Na-MMT, H-MMT, and dolomite-incorporated (5–20 wt%) HMMT catalysts (supporting information). The characteristic FTIR peaks present in pristine montmorillonite (Na-MMT) are found at 471 cm−1, 522 cm−1, 845 cm−1 917 cm−1, 1037 cm−1 and 3636 cm−1 corresponds to Si-O-Si bending vibration, Al-O-Si bending vibration, Al-Fe-OH bending vibration, Al-Al-OH bending vibration, Si-O tensile plane vibration and symmetric stretching of O-H attached to octahedral Al in MMT layers, respectively [52,53]. All the aforementioned bands can be well observed in both H-MMT and dolomite-incorporated HMMT catalysts, except Al-Al-OH bending frequency (at 917 cm−1), which could be caused by active leaching of Al from MMT layers during acid treatment. Moreover, the bands at 1636 cm−1 and 3434 cm−1 manifest O-H bending and stretching vibrations of interlayer H2O molecules, respectively, become weaker and are shifted to the lower frequency in HMMT and Dol/H-MMT because of cationic exchange of MMT interlayers [54]. In addition, the quartz impurity peak, which corresponds to Si-O symmetric stretching is obtained at 786 cm−1, becomes weaker in H-MMT and Dol/H-MMT, indicating quartz wasn’t completely removed even after acid treatment [55]. Another peak at 1490 cm−1 is observed in Na-MMT due to the presence of calcite impurity, but it has disappeared in H-MMT, implying acid treatment caused the removal of mineral impurities from montmorillonite. However, increased dolomite content in H-MMT (Dol/H-MMT) shows an intense peak at 1458 cm−1, which is obvious due to enhanced carbonate species. Raman spectroscopy was used to analyze the effect of vanadium substitution on the structure of the phosphomolybdic acid ammonium salt catalysts, and the resulting spectra are presented in Fig. 3. The Raman spectra of the standard PMA sample exhibit the characteristic bands at 997, 906, 608 and 251 cm−1 which are assigned to symmetric stretching modes of Mo-Od, Mo-Ob-Mo, Mo-Oc-Mo and Mo-Oa respectively, confirming the typical Keggin structure. When NH4 + ions substitute the exchangeable H⁺ ions from PMA, notable differences are observed in the Raman spectra of NH4PM, particularly in the regions between 200 and 400 cm−1 (e.g., a shoulder peak at 258 cm−1 and a new band at 344 cm−1) and between 800 and 1000 cm−1 (e.g., a shoulder peak at 958 cm−1). These changes are attributed to geometric modifications in the secondary Keggin structure. However, the characteristic Keggin bands remain largely the same, with only slight shifts to lower wavenumbers. This suggests that tuning the secondary structure does not significantly affect the primary Keggin structure in the phosphomolybdic acid ammonium salt. However, when one V replaced one Mo in the primary Keggin structure of ammonium phosphomolybdate (NH4PMV), the intensities of characteristic Raman bands significantly decreased due to the loss of symmetry in Keggin structure. Compared to NH4PM, no new peaks were observed, only the slight shift in the band frequencies towards the lower wavenumber region was noticed, implying effective doping of V at the primary Keggin site in phosphomolybdic acid ammonium salt. Conversely, in the case of (VO)x-NH4PM (x = 0.1, 0.2 and 0.3) synthesis, if (VO)x doping is increased, then a lower dosage of ammonium ion will be required to maintain charge balance, generating more lack of symmetry into the system. Probably, for that reason, the typical band intensities in Raman spectra of (VO)x-NH4PM samples were decreased with increasing the (VO)x doping amount at the secondary Keggin structure. Furthermore, no significant shift in characteristic peaks corresponding to the primary Keggin structure was observed, except for the shoulder peak at 958 cm−1, which was attributed to NH4 + substitution. This peak was slightly shifted to the lower frequency region with the increment in (VO)x doping amount from 0.1 to 0.3, suggesting accurate poisoning of VO species at the secondary Keggin site of ammonium phosphomolybdate. 3.2 Surface property analysis by BET-BJH In Fig. 4A, the N2-sorption of pure PMA displayed a type-IV isotherm with an abrupt increase in the low-pressure region (P/P0- 0.0–0.1) and another sudden jump to hysteresis loop at the medium-pressure region (0.4–0.5), suggesting the characteristic mesoporous structure of PMA. On the contrary, the NH4PM, (VO)0.2-NH4PM and NH4PMV exhibited typical type V isotherm, confirming the presence of mesopores within a specific pore width range [56]. Corresponding BJH pore-size distribution curves of the above-mentioned samples are represented in Fig. 4B. The average pore diameter of PMA was obtained to be 3.5 nm which increased to 30.7 nm after ammonium substitution. In addition, V-doping in the Keggin structure of NH4PM caused effective shrinkage of the average pore diameter to the range of 15–16 nm. Surface area (SBET) of PMA, NH4PM, NH4PMV and (VO)0.2-NH4PM were found to be 23.05, 15.34, 2.78 and 5.99 m2/g, respectively. Both ammonium substitution and V-doping attributed to lowering surface area and pore volume, which is in good agreement with FESEM observation; on the other hand, compared to PMA, the pore diameter of V-doped NH4PM catalysts was found to be larger, therefore, the diffusion of reactants and intermediates would occur smoothly through the pores, and this would facilitate to their high catalytic activity. The N2-sorption isotherm curves of acid catalysts namely pristine MMT (Na-MMT), acid-activated MMT (H-MMT) and 15 Dol/H-MMT are represented in Fig. 5A. All of those catalysts depict characteristic type IV isotherms, suggesting the presence of mesopores on their surface. The Fig. 5B represents the BHJ pore size distribution of acid catalysts, revealing that above catalysts had wide mesopores, particularly in the range of 5–25 nm along with narrow mesopores at ⁓ 3.4–3.8 nm. Acidification of pristine MMT had a great impact on surface textural properties. As can be seen in the inset of Fig. 5B, the specific surface area (SBET) of Na-MMT (31.03 m2/g) was improved significantly after phosphoric acid treatment, and reaching upto 129.41 m2/g. However, dolomite incorporation (15 wt%) in acidified MMT reduced the SBET to 59.94 m2/g. Although this value was lower than that of H-MMT, it remained sufficiently high to ensure good catalytic activity in the glycerol dehydration reaction. 3.3 Morphology analysis by FESEM-EDAX The FESEM images of phosphomolybdic acid, unsubstituted and substituted ammonium phosphomolybdate are shown in Fig. 6. Compared to the PMA (Fig. 6A), the surface of NH4PM (Fig. 6B) isn’t found much different, however, the surface structure of V-doped ammonium phosphomolybdate catalysts is found to be completely different. FESEM image of NH4PMV and (VO)x-NH4PM catalysts (Figs. 6C and 6D) demonstrate that vanadium substitution at primary Keggin or secondary Keggin of NH4PM caused uniformed and spherical-shaped morphology, and this is also supported by the XRD data which implies that the crystallinity of catalysts was improved by the V-incorporation into NH4PM Keggin. Additionally, an interesting fact is noted in Fig. 6C that the NH4PMV particles are larger in size (av. particle size 1.15 μm) and have a dimple on their surface (clearly marked by red circles in Fig. 6C), conversely, the (VO)x-NH4PM particles are found to be smaller in size (VO0.1-NH4PM- 0.82μm, VO0.2-NH4PM- 0.85μm, VO0.3-NH4PM- 0.91μm) and have no dimple; however, the surface roughness seems to be increased with increasing VOx doping in secondary Keggin structure of ammonium phosphomolybdate. Corroborating the FESEM results with BET findings, it is evident that NH4PMV exhibits a lower surface area than VOx-NH4PM due to its larger particle size, a trend consistent with previous reports [57]. Table S1 shows the V/P atomic ratio of the following compounds such as NH4PMV, (VO)0.1-NH4PM, (VO)0.2-NH4PM and (VO)0.3-NH4PM are 1.03, 0.094, 0.205 and 0.289, respectively, which are in good agreement with the theoretical values (see supporting information). Additionally, the vanadium content in NH4PMV and (VO)x-NH4PM has been shown by elemental mapping (represented in the inset of respective FESEM images, see Figs. 6C, 6D, 6E and 6F), which depicts the incremental V content with increasing V or VOx doping in the NH4PM Keggin. Furthermore, no additional element was found in the appreciated amount, which confirmed the single-phase formation of each catalyst, and justified the outcomes of XRD and FTIR analysis. Figure S4 displays the morphology of pristine MMT, acidified MMT, and yDol/H-MMT catalysts (supporting information). The H-MMT particles were found to be less agglomerated and had rougher surfaces with some fragmented edge structures, resulting in a higher surface area and greater porosity compared to the pristine MMT. This is in good agreement with the previous report, published by our group [39]. As shown in Figure S4, with the increase of dolomite incorporation to H-MMT, particle size became larger, leading to a reduction in surface area, as can be seen in BET-BJH study (Fig. 5B). In addition, Figure S5 shows that higher dolomite content caused heterogeneity in the distribution of dolomite particles on the H-MMT surface (supporting information). 3.4 Chemical properties analysis by XPS, O2-TPD and NH3-TPD XPS analysis was conducted to examine the chemical state and surface composition of the catalyst samples. Wide XPS spectra of PMA, NH4PM, NH4PMV and (VO)0.2-NH4PM are shown in Figure S5 (see supporting information). As for Mo 3d XPS spectra of PMA ( Fig. 7A), the peaks at 233.4 and 236.6 eV, corresponding to Mo 3d5/2 and 3d3/2 respectively, indicate the presence of Mo+6 [58]. In the case of NH4PM, the above peaks for Mo+6 were found a little bit at lower binding energies such as 233 eV and 236.1 eV, respectively (see Fig. 7B). Interestingly, in NH4PMV, we found the peaks at 232.5 eV and 235.6 eV correspond to Mo+6, along with two more peaks at 232 eV and 234.9 eV for Mo+5 (Fig. 7C). However, in (VO)0.2-NH4PM, peaks corresponding to Mo+6 were observed at 232.7 eV and 235.9 eV (Fig. 7D), which were at lower binding energy region compared to NH4PM. These results suggest that V-doping at primary Keggin of NH4PM caused significant charge transfer from Mo+6 to Mo+5, but doping of VO species in secondary Keggin structure was incapable of such charge transfer. This phenomenon could better impact on selective conversion of glycerol to acrylic acid and ally alcohol. Another interesting observation is that modifications at the secondary Keggin site, whether through NH4 + substitution or VOx doping, have minimal impact on the P 2p binding energy, in contrast to modifications at the primary Keggin site. As shown in Figs. 7E, 7F, and 7H, the P 2p binding energies in PMA, NH4PM, and (VO)0.2-NH4PM remain relatively consistent at approximately 131.7 eV. However, in the case of NH4PMV, the P 2p binding energy increases significantly to 134.1 eV (Fig. 7G). This result supports the selective V-doping at a distinct site in the Keggin structure and justifies the findings from the XRD and FTIR analyses. In addition, the quantitative analysis for different types of oxygen present on the surface of the prepared V-doped ammonium phosphomolybdates was also carried out using XPS analysis. Fig. 7 (I to L) represents the deconvoluted O 1 s spectra of pure PMA, NH4PM, NH4PMV and NH4(VO)0.2 PM, providing information about the quantity of different surface oxygens. As can be seen in Fig. 7I, the O 1 s spectra of pure PMA (H3PMo12O40.xH2O) can be deconvoluted into two peaks at 528.6 and 529.7 eV, assigned to lattice oxygen (OMo(VI)-O) and physisorbed hydroxyl oxygen (O-H), respectively, and this is consistent with the results of the literature [59,60]. In the case of NH4PM (see Fig. 7J), the peaks regarding lattice oxygen and chemically adsorbed hydroxyl oxygen (Ochem; -OH and H2O attached at the surface defect sites) were found at higher binding energies c.a. 530.6 eV and 531.5 eV, compared to PMA, indicating ammonium substitution decreases electronic charge density around O2-, which consequently decreases bond polarity and increases bond energy. The O 1 s XPS spectra of NH4PMV and (VO)0.2-NH4PM are shown in Figs. 7K and 7L, respectively. For NH4PMV, three peaks were observed at 529.8 eV for oxygen bonded with Mo+5 (OMo +5 -O), 530.3 eV for oxygen bonded to Mo+6 (OMo +6 -O) and 532 eV for surface defect (Od) or oxygen vacancy. In contrast, (VO)0.2-NH4PM displayed only two peaks at 530.4 eV for OMo +6 -O and at 532.4 eV for Od. Comparing the O 1 s spectra of V-doped ammonium phosphomolybdates with PMA and NH4PM, it can be ascertained that vanadium doping into the NH4PM Keggin either at the primary position or at the secondary position generates surface defects. Another key observation was that the aspect ratio of oxygen vacancy in NH4PMV was 32 %, while it was found around 20.5 % in (VO)0.2-NH4PM . Therefore, it can be expected that NH4PMV could provide more oxidative sites and facilitate oxidative reactions. Furthermore, temperature-programmed desorption of oxygen (O2-TPD) was carried out to substantiate the XPS results. Fig. 8A represents the O2-TPD profiles of NH4PMV and (VO)0.2-NH4PM. Both profiles exhibit small peaks between 50 to 350 °C, which can be attributed to physisorbed oxygen (Ophy). However, since the catalysts samples were thoroughly dried prior to analysis, these low-temperature peaks can be neglected. The TPD profile of NH4PMV shows an intense peak between 350 °C to 550 °C, corresponds to chemisorbed oxygen species (Ochem) in the catalyst lattice structure, containing two overlapping peaks at 491 °C and 458 °C, respectively. A sharp peak at 609.5 °C implies the presence of shallow lattice oxygen (Oshallow) in NH4PMV [60]. In contrast, those aforementioned peaks correspond to Ochem and Oshallow were appeared at higher temperatures than those of NH4PMV, positioned at 534.3 °C and 693 °C, respectively. This suggests that the oxygen species contained in NH4PMV can be readily released from the catalyst surface as compared to (VO)0.2-NH4PM, which may lead to better activity in oxidation reaction [61,62]. The desorption of reactive oxygen species over the catalyst surface mostly occurs below 600℃. According to the quantitative O2-TPD results, the total desorbed oxygen of NH4PMV and (VO)0.2-NH4PM was obtained to be 885 μmol/g and 95 μmol/g, respectively. The order of Ochem in those catalysts is as follows: NH4PMV (745 μmol/g) > (VO)0.2-NH4PM (82 μmol/g). So, corroborating with the results of XPS and O2-TPD, it can be expected that vanadium doping at the primary Keggin site of ammonium phosphomolybdate leads to more surface defects, which in consequence generate more oxygen vacancies and facilitate oxidative reactions. NH3-TPD of Na-MMT, H-MMT and 15 Dol/H-MMT has been carried out to understand the effect of acidification and dolomite incorporation on the amount and strength of acidity in the montmorillonite catalysts. As can be seen in Fig. 8B, the strength of acidity can be classified into three types: weak acidity belongs to the temperature range of 50°C-200°C, medium acidity exhibited between 200°C-500°C and strong acidity found at temperature ≥ 500 °C. The order of total acid strength of the aforementioned acid catalysts is as follows: H-MMT (2.891 mmol/g) > Na-MMT (1.373 mmol/g) > 15 Dol/H-MMT (1.103 mmol/g). Fig. 8B reveals that acid activation by H3PO4 and dolomite incorporation in acidified montmorillonite extensively impact all kinds of acidities in montmorillonite. The pristine Na-MMT showed acid strengths of 0.032 (weak), 0.273 (medium), and 1.068 mmol/g (strong), while H-MMT exhibited higher values of 0.136 (weak), 1.21 (medium), and 1.545 mmol/g (strong). Therefore, it is ascertained that acid treatment by 1 M phosphoric acid can significantly enhance all types of acidity in montmorillonite. In addition, 15 wt% dolomite incorporation into H-MMT further tunes the strengths of the acid sites in the following manner: weak acidity-0.079 mmol/g, medium acidity- 0.696 mmol/g and strong acidity- 0.365 mmol/g. The comparative analysis suggests that dolomite incorporation significantly modifies the acid site distribution in H-MMT catalyst. Most notably, it converts strong acid sites into medium-strength acid sites. This transformation has been proven beneficial particularly for suppressing side reactions during the glycerol dehydration step. Previous studies by Chai et al. [63] and Jiang et al. [38] demonstrated that strong acid sites promote unwanted pathways including cyclization, condensation, and polymerization of glycerol and its intermediates - primary contributors to coke formation. By strategically reducing strong acid sites while maintaining medium-strength acidity, the 15 Dol/H-MMT catalyst could achieve improved selectivity in glycerol conversion to acrolein by minimizing these side reactions. 3.5 Catalytic performance Owing to easy abundance and affordable price, phosphomolybdic acid (PMA) among the heteropolyacids is extensively used as the acid catalyst in various glycerol value additions. However, there are very few reports available showing PMA as a redox catalyst [19,60]. In this study, vanadium-doped ammonium salts of phosphomolybdic acid were investigated as redox catalysts for the gas-phase conversion of glycerol to acrylic acid (AA) and allyl alcohol (ALY), in combination with acidified montmorillonite (H-MMT) serving as the acid catalyst in a dual-bed catalytic system. The preliminary studies were carried out at different temperatures (280–320 °C) for 5 h, using a sequential dual catalyst HMMT: NH4PM (1:1) in a single reactor. A maximum glycerol conversion of 62 % was achieved at 310°C within 2 h, yielding major products namely acrolein (35.5 % selectivity), acrylic acid (5.2 % selectivity), acetic acid (7.6 % selectivity) and allyl alcohol (15.2 % selectivity). Acetaldehyde, methanol, acetone, ethylene glycol, propanoic acid, 1,2-PDO, 1,3-PDO and formic acid were found as minor products. Coke, gaseous products, and minor by-products, collectively termed 'Others,' accounted for 21.5 % of the total selectivity. HMMT: NH4PM system appears to be catalytically active and highly selective for the conversion of glycerol to acrolein and allyl alcohol, but exhibits lower selectivity toward acrylic acid. Although extensive research has examined vanadium doping to enhance the selectivity of both acrylic acid and allyl alcohol, the specific factors distinguishing the two reactions remain unclear. Fig. 9A represents the impact of distinctive V-doping at primary and secondary Keggin of NH4PM on the selectivity of acrylic acid and allyl alcohol derived from glycerol via gas-phase reaction. These reactions were performed on sequential dual-bed system of H-MMT and NH4PMV or (VO)x-NH4PM (1:1 wt./wt.). Other reaction conditions such as temperature (310 °C), time (2 h), air flow rate (21 ml/min), glycerol concentration (20 wt% aq. Sol.), glycerol feed (0.1 ml/min) and total catalyst loading- 0.4 g were unchanged. The results reveal that small amount of (VO)x-doping at the secondary Keggin site of NH4PM is favourable for enhancing catalytic activity, especially for deoxydehydration reaction. Glycerol conversion increased from 62 % to ⁓92 % when 0.1 amount of (VO)3+ was doped into the secondary structure of NH4PM, and it further increased to > 96 % with increasing the doping amount of (VO)3+ from 0.1 to 0.3. In addition, the (VO)x doping in secondary NH4PM Keggin led to the straight drop in acrolein selectivity from 35.5 % to 8.2 %, however, the selectivity of allyl alcohol was seen to be improved up to a certain amount of (VO)x doping. The highest allyl alcohol selectivity of 52 % was achieved by (VO)0.2-NH4PM catalyst; meanwhile, the selectivity of acetic acid and acrylic acid were obtained to be 3.8 % and 4.6 %, respectively. Further, it was also noticed that, with the introduction of more (VO)3+ species (>0.2) into the secondary Keggin structure of NH4PM (particularly in case of (VO)0.25-NH4PM and (VO)0.3-NH4PM catalysts), the selectivity of minor products like formic acid, acetaldehyde and gaseous products increased, which as an evident can be seen in Fig. 9A. The selectivity of ‘Other’ compounds increased up to 47 % in the case of (VO)0.3-NH4PM. This probably happened because the introduction of VOx species in NH4PM Keggin led to higher oxidation ability of the redox catalysts, which in consequence enhanced the formation of more over-oxidised products (acids, aldehyde, COx). Furthermore, 0.2 of (VO)x-doping to the secondary structure of NH4PM Keggin was considered as the optimum doping amount to promote glycerol conversion to allyl alcohol under the aforementioned reaction conditions and (VO)0.2-NH4PM was chosen for further optimization reactions. In contrast, the V-substitution in primary Keggin position of NH4PM showed extraordinary catalytic activity (Gly Con. - 94.3 %) in glycerol conversion towards acrylic acid selectivity (63 %), while, the selectivity of corresponding acrolein, acetic acid and Others were found to be 8.7 %, 2.3 % and 26 %, respectively. So, in comparison between two doping positions in NH4PM Keggin, V-doping at the primary Keggin position indulges more oxidation properties compared to the doping at secondary Keggin sites. Specifically, (VO)0.2-NH4PM and NH4PMV emerged as the potential redox catalysts for the selective glycerol conversion yielding allyl alcohol and acrylic acid, respectively. This study demonstrates that engineering in Keggin sites of NH4PM enables altering the reaction routes for selective glycerol conversion reactions. Experiments ascertaining the impact of acid catalyst: redox catalyst ratio on two catalytic systems such as HMMT: NH4PMV and HMMT: (VO)0.2-NH4PM were performed, and outcomes are shown in Fig. 9B and C. These experiments were carried out under the following reaction conditions: temperature- 310 °C, 0.1 ml/min feed of 20 wt% glycerol, air flow rate- 20 ml/min and total catalyst loading- 0.4 g. The results were noted after 2 h of reaction. The optimum ratios of acid and redox catalysts in corresponding systems like HMMT: NH4PMV and HMMT: (VO)0.2-NH4PM were obtained to be 1:1 and 1:2, respectively. Beyond the optimum catalyst ratio, increasing the amount of redox catalyst (NH4PMV and (VO)0.2-NH4PM) led to a decline in the selectivity of acrylic acid and allyl alcohol in their respective cases; in other words, the selectivity toward ‘Other’ (primarily contains COx) increased. This trend can be attributed to the excessive oxidative sites generated by the surplus redox catalyst, which promote the overoxidation of reactive species, including glycerol, intermediates (3-HPA, acetol, etc.) and products, and ultimately favour the formation of COx. For instance, Liu et al. reported a similar trend as mentioned above and suggested that the higher amount of Mo3VOx (redox cat.) contributes to more carbon monoxide formation due to deep oxidation of reacting species [64]. Furthermore, based on catalytic performances, we ascribed the advantages of using a one-pot sequential dual bed (DB) catalyst system over a mixed phase single bed (SB) catalyst system in gas-phase selective glycerol conversion. To prepare the mixed-phase SB catalyst system, the acid catalyst and the redox catalyst were taken according to their optimum weight ratio and physically mixed using a mortar pestle. For example, the mixed-phase NH4PMV/HMMT catalyst was prepared by physically mixing HMMT and NH4PMV in 1:1 wt ratio; whereas, HMMT and (VO)0.2-NH4PM were mixed in 1:2 wt ratio to prepare its corresponding mixed-phase (VO)0.2-NH4PM/HMMT catalyst. Experiments were carried out at the same reaction conditions as used for the dual bed system, i.e., temperature- 310 °C, time- 2 h, 20 wt% glycerol fed with the rate of 0.1 ml/min, air flow- 21 ml/min, catalyst loading- 0.4 g. Fig. 9D depicts the comparative catalytic performance of glycerol to acrylic acid and ally alcohol over two types of catalytic systems: (i) dual-bed configurations such as HMMT + NH4PMV and HMMT + (VO)0.2-NH4PM, and (ii) single-bed configurations namely NH4PMV/HMMT and (VO)0.2-NH4PM/HMMT). The dual-bed (DB) system combining HMMT and NH4PMV achieved 94.3 % glycerol conversion, representing an 8.3 % increase over the single-bed (SB) system (86 %). In terms of product distribution (Table S2 in supporting information), the DB system exhibited significantly higher acrylic acid selectivity (63 % vs 25.7 %), and lower 'Others' product selectivity (26 % vs 49 %) compared to the SB system. Similarly, the HMMT and (VO)0.2-NH4PM combination exhibited the same trends as the HMMT and NH4PMV system, like better catalytic performance over the dual-bed system (higher glycerol conversion, enhanced allyl alcohol selectivity and reduced ‘Others’ byproducts selectivity) compared to the single-bed system. This enhanced performance likely occurred because in the dual catalytic system, acid and redox catalysts were physically separated, so, glycerol and the intermediate 3-HPA couldn’t get access to direct contact with the redox catalyst. Consequently, the chance of unwanted reactions like overoxidation of reactive species, and oxidation of glycerol and intermediates (primarily 3-HPA) became lower as compared to single-phase (or mixed-phase) catalytic systems. As a result, the dual catalytic system exhibits exceptional efficiency in facilitating selective glycerol conversion to either acrylic acid or allyl alcohol via gas phase dehydration-oxidation or dehydration-Hydrogen transfer, respectively in corresponding cases, ensuring optimal yields and reducing selectivity of byproducts. 3.6 Kinetic study In dual bed catalytic systems, glycerol conversion and product (acrylic acid or allyl alcohol) selectivity immensely depend upon the weight ratio of the acid and redox catalyst used to prepare the catalyst bed. For the kinetic study, the optimum weight ratio of constituent catalysts was consciously loaded in two distinct catalytic systems such as HMMT + NH4PMV- DB (HMMT: NH4PMV- 1:1) and HMMT + (VO)0.2-NH4PM- DB (HMMT: (VO)0.2-NH4PM- 1:2). The other reaction conditions were as follows: temperatures- 290, 295, 300, 305 and 310 °C (optimum temperature.), total catalyst loading-0.4 g, 20 wt% glycerol fed with the rate of 0.1 ml/min, air flow- 21 ml/min, time- 2 h. The product mixture was collected every 30 min intervals and analysed by GC-FID. The kinetic study was performed to know the order of the reactions and their corresponding activation energies. The first-order kinetic plots regarding glycerol conversion to acrylic acid and allyl alcohol over HMMT + NH4PMV- DB and HMMT + (VO)0.2-NH4PM- DB catalysts, respectively have been shown in Fig. 10A. The linear fits of the corresponding kinetic plots (-ln(1-xgly) vs time) have regression values in the range of 0.97 – 0.99, suggesting that the overall reaction order of glycerol conversion exhibits one over both the above-mentioned catalytic systems, which is consistent with the results reported by Thanasilp et al. [20] for the SiW/HZSM-5 catalyst. The calculated rate constants of glycerol conversion to acrylic acid and allyl alcohol were 0.025 min−1 and 0.032 min−1 over HMMT + NH4PMV- DB and HMMT + (VO)0.2-NH4PM- DB catalyst system, respectively. The activation energy can be determined by using the Arrhenius equation as follows: (3) lnk = ln A − E a RT Where k is the rate constant, A is the Arrhenius constant, R is the ideal gas constant (8.314 J/mol/K), T is the temperature in Kelvin, and Ea is the activation energy. The slope of the plot lnk vs 1/T indicates the value of Ea/R. The Arrhenius plots regarding glycerol to acrylic acid over HMMT + NH4PMV- DB catalyst and glycerol to allyl alcohol over HMMT + (VO)0.2-NH4PM- DB, are represented in Fig. 10B and the corresponding activation energies are calculated to be 162.63 kJ/mol and 155.1 kJ/mol, respectively. So compared to HMMT + NH4PMV- DB catalytic system, the lower activation energy of HMMT + (VO)0.2-NH4PM- DB catalytic system could be the most valid reason for better activity in respect of glycerol conversion. Additionally, some important parameters such as enthalpy of activation, entropy of activation and Gibb’s free energy of activation were evaluated for in-depth study. According to the Eyring-Polanyi equation: (4) k = k b T h × e ( − Δ G # RT ) Substituting ΔG# in above Eq. 4, [as ΔG# = ΔH# - TΔS#] (5) k = k b T h × e ( − Δ H # + T Δ S # RT ) (6) ln k T = ln k b h + Δ S # R − Δ H # RT Here, ΔH# and ΔS# are enthalpy of activation and entropy of activation, respectively. h is Planck constant (6.626 × 10−34 J.s), kb is Boltzmann constant (1.38 × 10−38 J.K−1). The values of ΔH# and ΔS# can be calculated from the slope and intercept of the linear regression plot of ln(k/T) Vs 1/T (named as Eyring-Polanyi’s plot), respectively. Subsequently, Gibb’s free energy (ΔG#) is calculated by the following equation: ΔG# = ΔH# - TΔS#. Eyring-Polanyi’s plots of two corresponding catalytic systems are represented in Fig. 10C. In the case of glycerol conversion to acrylic acid over HMMT + NH4PMV- DB catalytic system, the enthalpy of activation and the entropy of activation were obtained to be 150.3 kJ/mol and 229.67 J/mol/K, respectively; while for glycerol conversion to allyl alcohol using HMMT + (VO)0.2-NH4PM- DB catalyst, ΔH# and ΔS# were 157.89 kJ/mol and 244.59 J/mol/K, respectively. In both cases, we observed ΔH# and ΔS# are positive, suggesting that the aforementioned reactions are endothermic, and during the reaction, randomness increases because of the increasing number of product molecules. Furthermore, Gibb’s free energies were calculated to be 16.4 kJ/mol and 15.29 kJ/mol for glycerol conversion over HMMT + NH4PMV- DB and HMMT + (VO)0.2-NH4PM- DB catalytic system, respectively. The positive values of Gibb’s free energy imply that both reactions (glycerol dehydration-oxidation and dehydration-hydrogenation) are thermodynamically non-spontaneous. 3.7 Effect of dolomite incorporation in acid catalysts on coking reduction and catalyst regeneration According to the design of our catalytic system, the glycerol dehydration takes place at the upper bed which contains the acid catalysts i.e. H-MMT. Numerous studies in the literature indicate that Brønsted acid sites are the active centre for catalysing glycerol dehydration; however, such sites are also believed to contribute to catalyst deactivation by coking [65,66]. The process of coke formation is significantly influenced by the acidity and pore structure of the catalyst. So, in this study, we added a small amount of dolomite with H-MMT, assuming that dolomite incorporation in the acid catalyst could increase the alkalinity in the H-MMT catalyst, which in consequence might improve the catalyst's life by reducing coke formation. First, we explored the impact of the amount of dolomite addition in H-MMT catalyst for glycerol conversion to acrolein (reaction condition: temperature- 310 °C, catalyst loading- 0.2 g, carrier gas - air at 21 ml/min, and feed flow rate = 0.1 ml/min, time- 2 h). Figure S7A (supporting information) displays that the highest acrolein selectivity and around 97 % glycerol conversion were achieved by 15-Dol/H-MMT compared to other catalysts. In addition, a Time-On-Stream (TOS) study was carried out for gas-phase glycerol conversion to acrolein using Na-MMT, H-MMT and 15 Dol/H-MMT catalysts ( Fig. 11A), which demonstrated that 15 wt% dolomite addition improved acrolein selectivity and glycerol conversion up to 63 % and 88 %, respectively after 5 h of TOS. This result was far better than Na-MMT (Acr Sel.–15 % and Gly Con.- 54 % after 5 h) and H-MMT (Acr Sel.–23 % and Gly Con.- 56 % after 5 h). So, in the case of 15 Dol/H-MMT, acrolein selectivity was likely enhanced due to the transformation of strong acidic sites to moderate-strength acidic sites. This is evidenced in the NH3-TPD profile of 15-Dol/H-MMT, where the major acidic sites exhibited moderate-strength acidity. Zhou et al. previously reported a similar kind of trend for gas-phase glycerol conversion to acrolein using acid-activated sepiolite catalyst [67]. However, acrolein selectivity decreased with the 20-Dol/H-MMT catalyst. This is likely because the excess dolomite increased Lewis acidity, promoting the formation of byproducts like acetol, methanol, and other compounds. Consequently, 15-Dol/H-MMT was identified as the optimized acid catalyst and was selected for further studies. Thereafter, the optimized 15-Dol/H-MMT catalyst was integrated into two double-bed systems: one with NH4PMV for acrylic acid production (process A), and another with (VO)0.2-NH4PM for allyl alcohol (ALA) production (process B). Fig. 11B shows the time-on-stream (TOS) results for these processes, comparing the performance of these new systems to the original dolomite-free catalysts. In this study, we have observed that dolomite incorporation significantly increases the catalyst’s life for both cases. By using 15-Dol/H-MMT + NH4PMV- DB catalyst system, acrylic acid selectivity was improved upto 42 % after 5 h of TOS, which was only 14 % in the case of H-MMT + NH4PMV- DB. Also, glycerol conversion was found to decline by 83 %, 75 % and 69 % after 3, 4 and 5 h, respectively, in the former case; while, in the latter case, glycerol conversion sharply fell from 94.3 % (2 h) to 73 % (3 h), 54 % (4 h) and after 5 h of TOS, it was found to be 41 % which is much lower compared to 15-Dol/H-MMT + NH4PMV- DB catalyst system. The same trend was observed in process B i.e. glycerol conversion to allyl alcohol. 15-Dol/H-MMT + (VO)0.2-NH4PM- DB catalyst system showed better sustainability, like higher allyl alcohol selectivity (37 %) and higher glycerol conversion (71 %) after 5 h of TOS. In comparison, H-MMT + (VO)0.2-NH4PM- DB catalytic system exhibited poor endurance, after 5 h of TOS, acquiring only 18 % of allyl alcohol selectivity and 43 % of glycerol conversion. The addition of the optimal amount of dolomite (15 wt%) modifies the strength and distribution of surface acidity in H-MMT, as confirmed by NH₃-TPD. This property, combined with a high surface area and wide mesopores (evidenced by BET-BJH), synergistically enhances catalytic endurance. This is consistent with literature reports, which indicate that these combined properties suppress coke formation and promote the catalytic dehydration of glycerol to acrolein [68–71]. Moreover, the dolomite-modified H-MMT catalyst actively promotes the subsequent conversion of the intermediate acrolein, either through partial oxidation to acrylic acid or hydrogenation to allyl alcohol. So, considering the above facts, we can say that dolomite has good potential to reduce coking on solid catalysts and improve catalytic durability during gas-phase reactions. To acquire strong evidence supporting the potential of dolomite for coking resistance, we further analyzed the amount of coke deposition that occurred after the reaction on the catalyst surface, using thermogravimetric analysis. For clear depiction, we compared the TGA of used acid catalysts (employed in the formation of acrolein from glycerol; reaction conditions- Cat. loading- 0.2 g, 20 wt% glycerol, 21 ml/min air flow, 0.1 ml/min glycerol fed, T- 310 °C, time-5 h) such as H-MMT and different amounts of dolomite-incorporated H-MMT catalysts i.e. y-Dol/H-MMT (y = 5, 10, 15 and 20) as can be shown Fig. 11C. The weight loss of the samples occurred between 25 °C to 200 °C is considered a loss of physisorbed and chemisorbed water. Then, the major weight loss between 200 °C to 700 °C is referred to as the decomposition of carbonaceous species, including coke and carbonates of dolomite. However, the contribution of carbonates in the second mass loss can be ruled out for H-MMT. The weight loss of the fresh y-Dol/HMMT catalysts in the region 200 °C to 700 °C is attributed to the decomposition of their inherent carbonate species. So, the difference in weight loss between fresh and used catalysts particularly at 200 °C to 700 °C region indicates the coking rate (Table S3 in supporting information). The used H-MMT catalyst exhibited a significant weight loss of 38.5 %. The addition of dolomite substantially reduced this weight loss, with the 15 wt% dolomite catalyst (15-Dol/H-MMT) showing the minimum loss of 12.6 %. In contrast, the 20 wt% dolomite catalyst (20-Dol/H-MMT) showed a slightly higher weight loss of 16.4 %, which is attributed to the greater quantity of carbonate species present in the higher dolomite content. In order to further explore the coking resistance of 15-Dol/H-MMT catalyst at different reaction temperatures, it was employed for glycerol conversion to acrolein (Reaction conditions: catalyst loading- 0.2 g, 20 wt% glycerol, 21 ml/min air flow, 0.1 ml/min glycerol fed, time- 5 h) at 280, 290, 300, 310 and 320 °C reaction temperatures, and after the reaction, it was characterized by TGA. Fig. 11D shows the TGA profiles of used 15 Dol/H-MMT catalysts treated at the above-mentioned temperatures. It was observed that carbonaceous species decomposition was reduced from 22.9 % to 10 % with increasing reaction temperature from 280 °C to 320 °C. Nevertheless, 15 Dol/H-MMT is efficient in reducing coke deposition on the acid catalyst at 310 °C which is generally used for all the reactions. So, we can conclude that in the sequential dual-bed catalytic system (with acid and redox catalysts in separate beds), adding dolomite to H-MMT efficiently prolongs the overall catalyst life. The regeneration procedure consisted of two steps: (1) halting the glycerol feed while maintaining the air flow, and (2) holding the system at 310°C for one hour with an air flow rate of 21 ml/min. During the pause mode, the carbonaceous deposits on the catalyst surface were getting oxidised and were removed by the continuous air flow. The TGA profile of regenerated 15 Dol/HMMT catalyst revealed that this catalyst had only 2.38 % coke content after regeneration (Fig. 11D), indicating the effectiveness and easiness of the adopting regeneration process. After a 1 h pause, the glycerol fed was started and continued for 5 more hours (up to 10 h TOS). Fig. 11A shows that acrolein selectivity increased in all three acid catalysts after regeneration: from 15 % to 33 % for Na-MMT, from 23 % to 67 % for H-MMT, and from 63 % to 71 % for 15 Dol/H-MMT, between 5 h and 6 h of TOS. Then again, the catalyst activity declined due to further coke formation. After 10 h of TOS, 15 Dol/H-MMT showed the best result (Acr Sel.- 42 %, Gly Conv.- 68 %) compared to Na-MMT (Acr Sel.- 11 %, Gly Conv.- 39 %) and H-MMT (Acr Sel.- 17 %, Gly Conv.- 42 %). Following the same procedure, the double bed catalyst systems (H-MMT + NH4PMV- DB, 15-Dol/H-MMT + NH4PMV- DB, H-MMT + (VO)0.2-NH4PM- DB and 15-Dol/H-MMT + (VO)0.2-NH4PM- DB) were regenerated; however, after regeneration these reactions were continued for 8 h of TOS, because of sharp deterioration in catalytic activity after 7 h of TOS, as can be seen in Fig. 11B. Interesting fact is noticed that when acid catalysts (both H-MMT and 15 Dol/H-MMT) was employed singly, they showed appreciating acrolein selectivity after 8 h of TOS. However, when those acid catalysts were assembled with redox catalysts (NH4PMV and (VO)0.2-NH4PM) in dual-bed catalytic systems, they weren’t competent well to perform after 7 h of TOS, (as can be seen in Fig. 11A and B). This occurred because the redox catalysts (NH4PMV and (VO)0.2-NH4PM) experienced sintering, which may have led to the degradation of active sites due to prolonged exposure to the high temperature. As evidence, Figure S8 clearly shows sintered particles of the V-doped NH4PM catalyst exposed for 8 h of time-on-stream (TOS) in the gas-phase glycerol conversion reaction. Notably, regenerated dolomite added systems such as 15-Dol/H-MMT + NH4PMV- DB and 15-Dol/H-MMT + (VO)0.2-NH4PM- DB exhibited better performances (> 50 % of Gly Conv., and >40 % of product selectivity) compared to H-MMT + NH4PMV- DB (Gly Conv.- 30 %, Acrylic acid Sel.- 14 %) and H-MMT + (VO)0.2-NH4PM- DB (Gly Conv.- 27 %, Allyl alcohol Sel.- 8 %) at 8 h of TOS. So, it can be considered that dolomite would be a cost effective and easy solution to mitigate coking problem in solid acid catalysed gas-phase glycerol conversion reactions. Table S4 provides a detailed comparison of glycerol conversion to acrylic acid and allyl alcohol over different molybdenum- and vanadium-based catalysts. The dual-bed system comprising dolomite-modified H-MMT and Mo–V–O catalysts in this study shows superior performance, ranking competitively against other complex catalyst systems. 3.8 Structure-activity relationship and mechanism By critically analyzing the outcomes of characterizations, namely XPS, O2-TPD, NH3-TPD, and catalytic activity study, we have proposed a plausible reaction mechanism for glycerol conversion to acrylic acid and/or allyl alcohol, as shown in Fig. 12. The glycerol conversion to acrylic acid over HMMT + NH4PMV- DB catalytic system follows the Mars-van Krevelen pathway, where the type of acidity and oxygen vacancy in the catalyst play the most crucial role in the acrylic acid selectivity. On the other hand, the gas phase catalytic conversion of glycerol to allyl alcohol over HMMT + (VO)0.2-NH4PM- DB catalytic system followed dehydration and H-transfer mechanism, subsequently. The dehydration of glycerol to acrolein is the common primary step for both catalytic reactions. Correlation of NH3-TPD and time-on-stream data (as shown in Fig. 11A) reveals how acid strength influences acrolein selectivity. Pristine Na-MMT, featuring only weak and strong acid sites, showed low acrolein selectivity. In contrast, H-MMT, containing all three acid site types in greater quantity, improved acrolein selectivity. Incorporating dolomite into H-MMT (particularly in 15-Dol/H-MMT) converted strong acid sites to medium-strength sites, resulting in the highest acrolein yield. This confirms that medium-strength acid sites are more favorable for acrolein formation than strong acid sites. This trend aligns with the findings of Koley et al. [60], who reported that catalysts with weak and moderate acid sites (e.g., MIL88B-600PMA) outperformed those containing strong acid sites in glycerol dehydration to acrolein. Aftermath, in next step i.e. conversion of acrolein to acrylic acid or allyl alcohol, depends on the chemical nature of the redox catalyst used in the dual-bed catalytic system. Corroborating the results of XPS and O2-TPD, it was found that NH4PMV has higher oxygen vacancy compared to (VO)0.2-NH4PM, so it can provide higher lattice oxygen during the reaction and catalyse the transformation of acrolein to acrylic acid [6]. On the other hand, (VO)0.2-NH4PM was active for acrolein conversion to allyl alcohol without using an external source of hydrogen. In the former case, V doping at the primary Keggin structure of (NH4)4PMo11VO40 possesses energy transfer from Mo+6 to Mo+5. This is synergized with oxygen vacancies and facilitates the selective conversion of CO over CC in acrolein [72]. The detailed mechanism regarding the chemo-selective oxidation of acrolein to acrylic acid can be elaborated by the Mars−van Krevelen model [73]. The oxygen vacancy generated in the NH4PMV catalyst can be readily refilled by the molecular oxygen present in the carrier gas (i.e. air) used for the reaction. This molecular oxygen then interacts with the acrolein, which is previously adsorbed on Mo+6 sites and partially oxidises the acrolein to acrylic acid. A similar kind of mechanism has been delivered by Kampe et al. [74] for the selective conversion of acrolein to acrylic acid on V-Mo-W mixed oxide catalyst. For the (VO)0.2-NH4PM catalyst, the key step is the hydrogenation of acrolein to allyl alcohol, likely via hydrogen transfer from glycerol or OH-bearing intermediates [75,76]. This project investigated the specific hydrogen donor to better elucidate the reaction mechanism. In this regard, we performed the gas-phase reaction using various reactant feeds, including aqueous solution of acrolein with and without alcohol based-compounds (found in our reaction such as methanol, 1,2 propanediol) as hydrogen donor. Formic acid (HCOOH) has been reported as a reliable H-donor for allyl alcohol formation via hydrogenation by many researchers [77], so its impact on hydrogen transfer was also explored in our study. As represented in Figure S7B, the TOS selectivity for allyl alcohol depicted different trend depending on reactant feed, indicating the influence of different donor molecules in the reaction. Pure aqueous solution of acrolein showed 29 % allyl alcohol selectivity, indicating water molecules might act as hydrogen donor in the hydrogenation of acrolein. Further, at 1 h of TOS, allyl alcohol selectivity increased from 29 % to 57 % and to 78 % with the addition of methanol and formic acid to aqueous solution of acrolein, respectively; however, 1,2 PDO addition decreased the allyl alcohol selectivity to 8 %. This suggests that both methanol and formic acid are eligible candidates as hydrogen donors but the probability of 1,2 PDO as a hydrogen donor cannot be considered in our reaction. In addition, the probable pathway of acetic acid formation is also shown in Fig. 12. The Lewis acidic sites in the acid catalyst are responsible for the dehydration of the terminal hydroxy group of glycerol, leading to the formation of acetol which subsequently go through dehydrogenation and decarbonylation at the redox sites in both NH4PMV and (VO)0.2-NH4PM catalysts and form acetaldehyde as a minor product. Further, oxidation of acetaldehyde produces acetic acid [64]. Meanwhile, reduction of acetol results in another byproduct formation i.e. 1,2 propanediol at the redox site [78]. Other byproducts like methanol and ethylene glycol are produced via C-C bond cleavage of glycerol on the redox catalyst [79]. In this catalytic process, the intermediates such as 3-HPA and acetol, both are highly reactive, leading to secondary reactions such as condensation and oligomerization. These reactions can produce higher molecular weight oxygenates (coke) on the surface, potentially blocking active sites. Additionally, 3-HPA and acetol are considered primary sources of COx formation, although acrolein, other hydrocarbon intermediates, and even the final products like acrylic acid, allyl alcohol and acetic acid can also be oxidized to COx. Corma et al. demonstrated that acetol has the highest contribution to coke formation compared to reactant-fed [80]. 4 Conclusion In conclusion, we demonstrated that doping vanadium (V) or vanadium species (VOx) at distinct sites (primary and secondary) of the NH4PM Keggin structure selectively directs the conversion of acrolein to either acrylic acid or allyl alcohol, which is the most crucial step in our study. When H-MMT (an acid catalyst) and primary V-doped NH4PM (i.e. NH4PMV as redox catalyst) were packed in a sequential-separated dual bed system and employed in gas-phase glycerol valorization (Conditions- Tot. Cat. loading- 0.4 g, H-MMT: NH4PMV= 1:1, 20 wt% glycerol, 21 ml/min air flow, 0.1 ml/min glycerol fed, Temp.- 310 °C, Time- 2 h), the system achieved around 63 % selectivity toward acrylic acid. In contrast, a system with H-MMT and secondary V-doped NH4PM ((VO)0.2-NH4PM) attributed 61 % allyl alcohol selectivity under almost analogous conditions (Cond.- Tot. Cat. loading- 0.4 g, H-MMT: (VO)0.2-NH4PM= 1:2, 20 wt% glycerol, 21 ml/min air flow, 0.1 ml/min glycerol fed, Temp.–310°C, Time- 2 h). Both the pathways share the same initial step i.e. acrolein formation via dehydration of glycerol at the active Bronsted-acid site of the H-MMT, while the ultimate product selectivity (acrylic acid or allyl alcohol) is determined exclusively by the chemical property of the redox catalysts (NH4PMV and (VO)0.2-NH4PM). Oxygen vacancy and energy transfer from Mo+6 to Mo+5 were found as crucial factors belonging to the redox catalysts for their divergent behaviour, as evidenced by XPS. O2-TPD analysis showed (VO)0.2 doping at the secondary Keggin site of NH4PM caused an oxygen vacancy (Ov) of 82 μmol/g. By comparison, the Ov found in NH4PMV was 745 μmol/g, almost nine times higher than (VO)0.2-NH4PM. This trend was also supported by XPS, revealing that primary V doping at Keggin can cause more oxygen vacancy rather than secondary doping. The higher Ov density in NH4PMV explains its superior oxidative capability for converting acrolein to acrylic acid. Besides, the higher valent Mo active sites in (VO)0.2-NH4PM can actively participate in H-transfer from formic acid, methanol and water to acrolein, yielding allyl alcohol. So overall, this study could pave the way for designing new Mo-V-O catalysts for selective glycerol conversion reactions. Furthermore, adding 15 wt% dolomite to H-MMT optimized its surface acidity, suppressing coking by 31.72 % and enhancing selectivity for acrylic acid and allyl alcohol to over 40 % after 5 h TOS. In summary, this work represents insights into how the same component doping at different Keggin sites in a heteropolyacid can influence the reactions, and also proves that dolomite has the potential to prevent coking and prolong the catalyst life. CRediT authorship contribution statement Guoya Wang: Visualization, Validation. Chenglan Liu: Visualization, Validation. Rongzhen Mu: Visualization, Validation. Alfin Kurniawan: Visualization, Validation, Funding acquisition. Tania Roy: Writing – review & editing, Writing – original draft, Visualization, Validation, Methodology, Investigation, Formal analysis, Data curation, Conceptualization. Jin Wang: Visualization, Validation, Formal analysis. Xiaolan Chen: Visualization, Methodology. ZHOU Chun HUI: Supervision, Investigation, Funding acquisition. Declaration of Competing Interest The authors declare that they have no known competing financial interests or personal relationships that could have appeared to influence the work reported in this paper. Acknowledgements The authors wish to acknowledge the financial support from the National Natural Science Foundation of China (42572045; W2433034; 22072136), and the projects from Qing Yang Institute for Industrial Minerals (KYY-HX-20220336; KYY-HX-20170557). Appendix A Supporting information Supplementary data associated with this article can be found in the online version at doi:10.1016/j.apcata.2025.120595. Appendix A Supplementary material Supplementary material References [1] S. Veluturla N. Archna D. Subba Rao N. Hezil I.S. Indraja S. Spoorthi Catalytic valorization of raw glycerol derived from biodiesel: a review Biofuels 9 3 2018 305 314 Veluturla, S., Archna, N., Subba Rao, D., Hezil, N., Indraja, I.S., Spoorthi, S., 2018. Catalytic valorization of raw glycerol derived from biodiesel: a review. Biofuels, 9(3), pp.305-314. [2] M.H. Moklis S. Cheng J.S. Cross Current and future trends for crude glycerol upgrading to high value-added products Sustain 15 4 2023 2979 Moklis, M.H., Cheng, S., Cross, J.S., 2023. Current and Future Trends for Crude Glycerol Upgrading to High Value-Added Products. Sustain., 15(4), pp.2979. [3] J. Deleplanque J.L. Dubois J.F. Devaux W. Ueda Production of acrolein and acrylic acid through dehydration and oxydehydration of glycerol with mixed oxide catalysts Catal. Today 157 1-4 2010 351 358 Deleplanque, J., Dubois, J.L., Devaux, J.F., Ueda, W., 2010. Production of acrolein and acrylic acid through dehydration and oxydehydration of glycerol with mixed oxide catalysts. Catal. Today, 157(1-4), pp.351-358. [4] D. Sun Y. Yamada S. Sato W. Ueda Glycerol hydrogenolysis into useful C3 chemicals Appl. Catal. B Environ. Energy 193 2016 75 92 Sun, D., Yamada, Y., Sato, S. Ueda, W., 2016. Glycerol hydrogenolysis into useful C3 chemicals. Appl. Catal. B: Environ. Energy, 193, pp.75-92. [5] L. Shen H. Yin A. Wang X. Lu C. Zhang Gas phase oxydehydration of glycerol to acrylic acid over Mo/V and W/V oxide catalysts Chem. Eng. J. 244 2014 168 177 Shen, L., Yin, H., Wang, A., Lu, X. and Zhang, C., 2014. Gas phase oxydehydration of glycerol to acrylic acid over Mo/V and W/V oxide catalysts. Chem. Engin. J., 244, pp.168-177. [6] M.Y. Ahmad N.I. Basir A.Z. Abdullah A review on one-pot synthesis of acrylic acid from glycerol on bi-functional catalysts J. Ind. Eng. Chem. 93 2021 216 227 Ahmad, M.Y., Basir, N.I., Abdullah, A.Z., 2021. A review on one-pot synthesis of acrylic acid from glycerol on bi-functional catalysts. J. Indus. Engin. Chem., 93, pp.216-227. [7] A. Kostyniuk D. Bajec P. Djinović B. Likozar Allyl alcohol production by gas phase conversion reactions of glycerol over bifunctional hierarchical zeolite-supported bi-and tri-metallic catalysts Chem. Eng. J. 397 2020 125430 Kostyniuk, A., Bajec, D., Djinović, P., Likozar, B., 2020. Allyl alcohol production by gas phase conversion reactions of glycerol over bifunctional hierarchical zeolite-supported bi-and tri-metallic catalysts. Chem. Engin. J., 397, pp.125430. [8] M.B. dos Santos H.M. Andrade A.J. Mascarenhas Oxidative dehydration of glycerol over alternative H, Fe-MCM-22 catalysts: sustainable production of acrylic acid Micro Mesopor. Mater. 278 2019 366 377 dos Santos, M.B., Andrade, H.M., Mascarenhas, A.J., 2019. Oxidative dehydration of glycerol over alternative H, Fe-MCM-22 catalysts: Sustainable production of acrylic acid. Micropor. Mesopor. Mater., 278, pp.366-377. [9] D. Jampaiah V.K. Velisoju D. Devaiah M. Singh E.L. Mayes V.E. Coyle B.M. Reddy V. Bansal S.K. Bhargava Flower-like Mn3O4/CeO2 microspheres as an efficient catalyst for diesel soot and CO oxidation: synergistic effects for enhanced catalytic performance Appl. Surf. Sci. 473 2019 209 221 Jampaiah, D., Velisoju, V.K., Devaiah, D., Singh, M., Mayes, E.L., Coyle, V.E., Reddy, B.M., Bansal, V., Bhargava, S.K., 2019. Flower-like Mn3O4/CeO2 microspheres as an efficient catalyst for diesel soot and CO oxidation: Synergistic effects for enhanced catalytic performance. Appl. Surf. Sci., 473, pp.209-221. [10] Y. Choi D.S. Park H.J. Yun J. Baek D. Yun J. Yi Mesoporous siliconiobium phosphate as a pure Brønsted acid catalyst with excellent performance for the dehydration of glycerol to acrolein ChemSusChem 5 12 2012 2460 2468 Choi, Y., Park, D.S., Yun, H.J., Baek, J., Yun, D., Yi, J., 2012. Mesoporous Siliconiobium phosphate as a pure Brønsted acid catalyst with excellent performance for the dehydration of glycerol to acrolein. ChemSusChem, 5(12), pp.2460-2468. [11] A. Popa V. Sasca O. Verdes I. Holclajtner-Antunović Adsorption–desorption and catalytic properties of SBA-15 supported cesium salts of 12-molybdophosphoric acid for the dehydration of ethanol React. Kinet. Mech. Catal. 115 2015 355 375 Popa, A., Sasca, V., Verdes, O., Holclajtner-Antunović, I., 2015. Adsorption–desorption and catalytic properties of SBA-15 supported cesium salts of 12-molybdophosphoric acid for the dehydration of ethanol. Reaction Kinetics, Mech. Catal., 115, pp.355-375. [12] S.A. Tungatarova D.B. Abdukhalykov T.S. Baizhumanova L.V. Komashko V.P. Grigorieva I.S. Chanysheva Oxidation of alkanes into olefins on the polyoxide catalysts Catal. Today 256 2015 276 286 Tungatarova, S.A., Abdukhalykov, D.B., Baizhumanova, T.S., Komashko, L.V., Grigorieva, V.P., Chanysheva, I.S., 2015. Oxidation of alkanes into olefins on the polyoxide catalysts. Catal. Today, 256, pp.276-286. [13] L. Zhou L. Wang S. Zhang R. Yan Y. Diao Effect of vanadyl species in Keggin-type heteropoly catalysts in selective oxidation of methacrolein to methacrylic acid J. Catal. 329 2015 431 440 Zhou, L., Wang, L., Zhang, S., Yan, R., Diao, Y., 2015. Effect of vanadyl species in Keggin-type heteropoly catalysts in selective oxidation of methacrolein to methacrylic acid. J. Catal., 329, pp.431-440. [14] B. Katryniok S. Paul F. Dumeignil Recent developments in the field of catalytic dehydration of glycerol to acrolein ACS Catal. 3 8 2013 1819 1834 Katryniok, B., Paul, S., Dumeignil, F., 2013. Recent developments in the field of catalytic dehydration of glycerol to acrolein. ACS Catal., 3(8), pp.1819-1834. [15] L. Liu X.P. Ye J.J. Bozell A comparative review of petroleum-based and bio-based acrolein production ChemSusChem 5 7 2012 1162 1180 Liu, L., Ye, X.P., Bozell, J.J., 2012. A comparative review of petroleum-based and bio-based acrolein production. ChemSusChem, 5(7), pp.1162-1180. [16] A. Alhanash E.F. Kozhevnikova I.V. Kozhevnikov Gas-phase dehydration of glycerol to acrolein catalysed by caesium heteropoly salt Appl. Catal. A Gen. 378 1 2010 11 18 Alhanash, A., Kozhevnikova, E.F., Kozhevnikov, I.V., 2010. Gas-phase dehydration of glycerol to acrolein catalysed by caesium heteropoly salt. Appl. Catal. A: Gen., 378(1), pp.11-18. [17] M.H. Haider N.F. Dummer D. Zhang P. Miedziak T.E. Davies S.H. Taylor D.J. Willock D.W. Knight D. Chadwick G.J. Hutchings Rubidium-and caesium-doped silicotungstic acid catalysts supported on alumina for the catalytic dehydration of glycerol to acrolein J. Catal. 286 2012 206 213 Haider, M.H., Dummer, N.F., Zhang, D., Miedziak, P., Davies, T.E., Taylor, S.H., Willock, D.J., Knight, D.W., Chadwick, D., Hutchings, G.J., 2012. Rubidium-and caesium-doped silicotungstic acid catalysts supported on alumina for the catalytic dehydration of glycerol to acrolein. J. Catal., 286, pp.206-213. [18] R. Liu T. Wang D. Cai Y. Jin Highly efficient production of acrylic acid by sequential dehydration and oxidation of glycerol Ind. Eng. Chem. Res. 53 21 2014 8667 8674 Liu, R., Wang, T., Cai, D., Jin, Y., 2014. Highly efficient production of acrylic acid by sequential dehydration and oxidation of glycerol. Indus. Engin. Chem. Res., 53(21), pp.8667-8674. [19] X. Li Y. Zhang Oxidative dehydration of glycerol to acrylic acid over vanadium-substituted cesium salts of Keggin-type heteropolyacids ACS Catal. 6 5 2016 2785 2791 Li, X., Zhang, Y., 2016. Oxidative dehydration of glycerol to acrylic acid over vanadium-substituted cesium salts of Keggin-type heteropolyacids. ACS Catal., 6(5), pp.2785-2791. [20] S. Thanasilp J.W. Schwank V. Meeyoo S. Pengpanich M. Hunsom One-pot oxydehydration of glycerol to value-added compounds over metal-doped SiW/HZSM-5 catalysts: effect of metal type and loading Chem. Eng. J. 275 2015 113 124 Thanasilp, S., Schwank, J.W., Meeyoo, V., Pengpanich, S., Hunsom, M., 2015. One-pot oxydehydration of glycerol to value-added compounds over metal-doped SiW/HZSM-5 catalysts: Effect of metal type and loading. Chem. Engin. J., 275, pp.113-124. [21] N.C. Coronel M.J. da Silva S.O. Ferreira R.C. da Silva R. Natalino K5PW11NiO39-catalyzed oxidation of benzyl alcohol with hydrogen peroxide Chem. Sel. 4 1 2019 302 310 Coronel, N.C., da Silva, M.J., Ferreira, S.O., da Silva, R.C., Natalino, R., 2019. K5PW11NiO39-catalyzed oxidation of benzyl alcohol with hydrogen peroxide. Chem. Select, 4(1), pp.302-310. [22] S.S. Balula I.C.M.S. Santos L. Cunha-Silva A.P. Carvalho J. Pires C. Freire J.A.S. Cavaleiro B. Castro A.M.V. Cavaleiro H. Gaspar M. Andrade CENTRO DE QUÍMICA e BIOQUÍA–2013 Catal. Today 203 2013 103 110 Balula, S.S., Santos, I.C.M.S., Cunha-Silva, L., Carvalho, A.P., Pires, J., Freire, C., Cavaleiro, J.A.S., Castro, B., Cavaleiro, A.M.V., Gaspar, H., Andrade, M., 2013. CENTRO DE QUÍMICA E BIOQUÍA–2013. Catal. Today, 203, pp.103-110. [23] M.J. da Silva P.H. da Silva Andrade V.F.C. Sampaio Transition metal-substituted potassium silicotungstate salts as catalysts for oxidation of terpene alcohols with hydrogen peroxide Catal. Lett. 151 2021 2094 2106 da Silva, M.J., da Silva Andrade, P.H., Sampaio, V.F.C., 2021. Transition metal-substituted potassium silicotungstate salts as catalysts for oxidation of terpene alcohols with hydrogen peroxide. Catalysis Letters, 151, pp.2094-2106. [24] L. Giebeler P. Kampe A. Wirth A.H. Adams J. Kunert H. Fuess H. Vogel Structural changes of vanadium–molybdenum–tungsten mixed oxide catalysts during the selective oxidation of acrolein to acrylic acid J. Mol. Catal. A Chem. 259 1-2 2006 309 318 Giebeler, L., Kampe, P., Wirth, A., Adams, A.H., Kunert, J., Fuess, H., Vogel, H., 2006. Structural changes of vanadium–molybdenum–tungsten mixed oxide catalysts during the selective oxidation of acrolein to acrylic acid. J. Mol. Catal. A: Chem., 259(1-2), pp.309-318. [25] A. Drochner P. Kampe J. Kunert J. Ott H. Vogel Steady state isotopic transient kinetic analysis of the acrolein oxidation on Mo–V–W-mixed oxide catalysts Appl. Catal. MICA Gen. 289 1 2005 74 83 Drochner, A., Kampe, P., Kunert, J., Ott, J., Vogel, H., 2005. Steady State Isotopic Transient Kinetic Analysis of the acrolein oxidation on Mo–V–W-mixed oxide catalysts. Appl. Catal. MICA: Gen., 289(1), pp.74-83. [26] S. Endres P. Kampe J. Kunert A. Drochner H. Vogel The influence of tungsten on structure and activity of Mo–V–W-mixed oxide catalysts for acrolein oxidation Appl. Catal. A Gen. 325 2 2007 237 243 Endres, S., Kampe, P., Kunert, J., Drochner, A., Vogel, H., 2007. The influence of tungsten on structure and activity of Mo–V–W-mixed oxide catalysts for acrolein oxidation. Appl. Catal. A: Gen., 325(2), pp.237-243. [27] T. Jekewitz N. Blickhan S. Endres A. Drochner H. Vogel The influence of water on the selective oxidation of acrolein to acrylic acid on Mo/V/W-mixed oxides Catal. Commun. 20 2012 25 28 Jekewitz, T., Blickhan, N., Endres, S., Drochner, A., Vogel, H., 2012. The influence of water on the selective oxidation of acrolein to acrylic acid on Mo/V/W-mixed oxides. Catal. Commun., 20, pp.25-28. [28] J. Kunert A. Drochner J. Ott H. Vogel H. Fueß Synthesis of Mo/V mixed oxide catalysts via crystallisation and spray drying—a novel approach for controlled preparation of acrolein to acrylic acid catalysts Appl. Catal. A Gen. 269 1-2 2004 53 61 Kunert, J., Drochner, A., Ott, J., Vogel, H., Fueß, H., 2004. Synthesis of Mo/V mixed oxide catalysts via crystallisation and spray drying—a novel approach for controlled preparation of acrolein to acrylic acid catalysts. Appl. Catal. A: Gen., 269(1-2), pp.53-61. [29] C.C. Li S.T. Yin Z.Z. Wang C.L. Liu C.H. Zhou Contribution of ca and v to enhancing coking-resistance and stability of MoV/CaO-intercalated montmorillonite catalyst in deoxydehydration of glycerol Appl. Catal. A Gen. 665 2023 119355 Li, C.C., Yin, S.T., Wang, Z.Z., Liu, C.L. and Zhou, C.H., 2023. Contribution of Ca and V to enhancing coking-resistance and stability of MoV/CaO-intercalated montmorillonite catalyst in deoxydehydration of glycerol. Appl. Catal. A: Gen., 665, pp.119355. [30] A. Kurniawan J.Q. Zhong Z.Z. Wang C.H. Zhou Catalytic glycerol conversion over bifunctional Montmorillonite-Supported mo− v oxide catalysts: insights into the Dehydration-Hydrogen transfer reaction pathway toward allyl alcohol Ind. Eng. Chem. Res. 64 2025 1994 2005 Kurniawan, A., Zhong, J.Q., Wang, Z.Z., Zhou, C.H., 2025. Catalytic Glycerol Conversion over Bifunctional Montmorillonite-Supported Mo− V Oxide Catalysts: Insights into the Dehydration-Hydrogen Transfer Reaction Pathway Toward Allyl Alcohol. Ind. Eng. Chem. Res., 64, pp.1994–2005. [31] A. Fernandes M.F. Ribeiro J.P. Lourenço Conversion of glycerol over vanadium supported beta zeolite: role of acidity and alkali cations Micro Mesopor. Mater. 329 2022 111536 Fernandes, A., Ribeiro, M.F., Lourenço, J.P., 2022. Conversion of glycerol over vanadium supported beta zeolite: Role of acidity and alkali cations. Micropor. Mesopor. Mater., 329, pp.111536. [32] V.V. Bokade G.D. Yadav Heteropolyacid supported on montmorillonite catalyst for dehydration of dilute bio-ethanol Appl. Clay Sci. 53 2 2011 263 271 Bokade, V.V., Yadav, G.D., 2011. Heteropolyacid supported on montmorillonite catalyst for dehydration of dilute bio-ethanol. Appl.Clay Sci., 53(2), pp.263-271. [33] G.Q. Huang Y.H. Song C. Liu J.M. Yang J. Lu Z.T. Liu Z.W. Liu Acid activated montmorillonite for gas-phase catalytic dehydration of monoethanolamine Appl. Clay Sci. 168 2019 116 124 Huang, G.Q., Song, Y.H., Liu, C., Yang, J.M., Lu, J., Liu, Z.T., Liu, Z.W., 2019. Acid activated montmorillonite for gas-phase catalytic dehydration of monoethanolamine. Appl. Clay Sci., 168, pp.116-124. [34] W. Yu P. Wang C. Zhou H. Zhao D. Tong H. Zhang H. Yang S. Ji H. Wang Acid-activated and WOx-loaded montmorillonite catalysts and their catalytic behaviors in glycerol dehydration Chin. J. Catal. 38 6 2017 1087 1100 Yu, W., Wang, P., Zhou, C., Zhao, H., Tong, D., Zhang, H., Yang, H., Ji, S., Wang, H., 2017. Acid-activated and WOx-loaded montmorillonite catalysts and their catalytic behaviors in glycerol dehydration. Chin. J. Catal., 38(6), pp.1087-1100. [35] M. Guisnet L. Costa F.R. Ribeiro Prevention of zeolite deactivation by coking J. Mol. Catal. A Chem. 305 1-2 2009 69 83 Guisnet, M., Costa, L., Ribeiro, F.R., 2009. Prevention of zeolite deactivation by coking. J. Mol. Catal. A: Chem., 305(1-2), pp.69-83. [36] L.G. Possato R.N. Diniz T. Garetto S.H. Pulcinelli C.V. Santilli L. Martins A comparative study of glycerol dehydration catalyzed by micro/mesoporous MFI zeolites J. Catal. 300 2013 102 112 Possato, L.G., Diniz, R.N., Garetto, T., Pulcinelli, S.H., Santilli, C.V., Martins, L., 2013. A comparative study of glycerol dehydration catalyzed by micro/mesoporous MFI zeolites. J. Catal., 300, pp.102-112. [37] D.J. Li A. Kurniawan T. Roy J. Wang C.L. Liu Z.Z. Wang R.Z. Mu C.H. Zhou Enhanced coking-resistance of Ca-and Mg-incorporated Mo/V montmorillonite-supported catalysts during gas-phase glycerol conversion to allyl alcohol Catal. Sci. Technol. 15 7 2025 2339 2352 Li, D.J., Kurniawan, A., Roy, T., Wang, J., Liu, C.L., Wang, Z.Z., Mu, R.Z. and Zhou, C.H., 2025. Enhanced coking-resistance of Ca-and Mg-incorporated Mo/V montmorillonite-supported catalysts during gas-phase glycerol conversion to allyl alcohol. Catal. Sci. Technol., 15(7), pp.2339-2352. [38] X.C. Jiang C.H. Zhou R. Tesser M. Di Serio D.S. Tong J.R. Zhang Coking of catalysts in catalytic glycerol dehydration to acrolein Ind. Eng. Chem. Res. 57 32 2018 10736 10753 Jiang, X.C., Zhou, C.H., Tesser, R., Di Serio, M., Tong, D.S., Zhang, J.R., 2018. Coking of catalysts in catalytic glycerol dehydration to acrolein. Indus. Engin. Chem. Res., 57(32), pp.10736-10753. [39] A. Kurniawan S.T. Yin K.J. Li X.L. Chen W.J. Huang P.Y. Zhao J.H. Liu C.H. Zhou Elucidating metal composition–coking relationships and coke formation pathways during gas-phase oxydehydration of glycerol over clay mineral-supported Mo-V-O catalysts Appl. Catal. B Environ. Energy 347 2024 123766 (pp) Kurniawan, A., Yin, S.T., Li, K.J., Chen, X.L., Huang, W.J., Zhao, P.Y., Liu, J.H. and Zhou, C.H., 2024. Elucidating metal composition–coking relationships and coke formation pathways during gas-phase oxydehydration of glycerol over clay mineral-supported Mo-V-O catalysts. Appl. Catal. B: Environ. Energy, 347, pp.123766. [40] S.P. Samudrala S. Kandasamy S. Bhattacharya Turning biodiesel waste glycerol into 1,3-propanediol: catalytic performance of sulphuric acid-activated montmorillonite supported platinum catalysts in glycerol hydrogenolysis Sci. Rep. 8 1 2018 7484 Samudrala, S.P., Kandasamy, S., Bhattacharya, S., 2018. Turning biodiesel waste glycerol into 1,3-propanediol: catalytic performance of sulphuric acid-activated montmorillonite supported platinum catalysts in glycerol hydrogenolysis. Sci. Rep., 8(1), pp.7484. [41] J. Fu S. Liu W. Zheng R. Huang C. Wang A. Lawal K. Alexopoulos S. Liu Y. Wang K. Yu J.A. Boscoboinik Modulating the dynamics of Brønsted acid sites on PtWO x inverse catalyst Nat. Catal. 5 2 2022 144 153 Fu, J., Liu, S., Zheng, W., Huang, R., Wang, C., Lawal, A., Alexopoulos, K., Liu, S., Wang, Y., Yu, K. and Boscoboinik, J.A., 2022. Modulating the dynamics of Brønsted acid sites on PtWO x inverse catalyst. Nat. Catal., 5(2), pp.144-153. [42] Z. Ou J. Ran H. Qiu X. Huang C. Qin Uncovering the effect of surface basicity on the carbon deposition of Ni/CeO2 catalyst modified by oxides in DRM Fuel 335 2023 126994 Ou, Z., Ran, J., Qiu, H., Huang, X., Qin, C., 2023. Uncovering the effect of surface basicity on the carbon deposition of Ni/CeO2 catalyst modified by oxides in DRM. Fuel, 335, pp.126994. [43] L. Dermeche R. Thouvenot S. Hocine C. Rabia Preparation and characterization of mixed ammonium salts of keggin phosphomolybdate Inorg. Chim. Acta 362 11 2009 3896 3900 Dermeche, L., Thouvenot, R., Hocine, S., Rabia, C.J.I.C.A., 2009. Preparation and characterization of mixed ammonium salts of Keggin phosphomolybdate. Inorg. Chimica Acta, 362(11), pp.3896-3900. [44] A. Tahar S. Benadji T. Mazari L. Dermeche C. Marchal-Roch C. Rabia Preparation, characterization and reactivity of keggin type phosphomolybdates, H3−2 xNixPMo12O40 and (NH 4)3−2 xNixPMo12O40, for Adipic Acid Synthesis Catal. Lett. 145 2015 569 575 Tahar, A., Benadji, S., Mazari, T., Dermeche, L., Marchal-Roch, C., Rabia, C., 2015. Preparation, Characterization and Reactivity of Keggin Type Phosphomolybdates, H3−2 xNixPMo12O40 and (NH 4)3−2 xNixPMo12O40, for Adipic Acid Synthesis. Catal. Lett., 145, pp.569-575. [45] L. Zatta L.P. Ramos F. Wypych Acid-activated montmorillonites as heterogeneous catalysts for the esterification of lauric acid acid with methanol Appl. Clay Sci. 80 2013 236 244 Zatta, L., Ramos, L.P., Wypych, F., 2013. Acid-activated montmorillonites as heterogeneous catalysts for the esterification of lauric acid acid with methanol. Appl. Clay Sci., 80, pp.236-244. [46] J. Kielland Individual activity coefficients of ions in aqueous solutions J. A. C. S. 59 9 1937 1675 1678 Kielland, J., 1937. Individual activity coefficients of ions in aqueous solutions. J.A.C.S., 59(9), pp.1675-1678. [47] S.E. Kelch E. Ferrage B. Lanson L. Charlet L. Aristilde Water trapping dynamics in carbohydrate-populated smectite interlayer nanopores J. Phys. Chem. C. 123 47 2019 28816 28827 Kelch, S.E., Ferrage, E., Lanson, B., Charlet, L., Aristilde, L., 2019. Water trapping dynamics in carbohydrate-populated smectite interlayer nanopores. J. Phys. Chem. C, 123(47), pp.28816-28827. [48] C.B. Vilanculo M.J. da Silva A.A. Rodrigues S.O. Ferreira R.C. da Silva Vanadium-doped sodium phosphomolybdate salts as catalysts in the terpene alcohols oxidation with hydrogen peroxide RSC Adv. 11 39 2021 24072 24085 Vilanculo, C.B., da Silva, M.J., Rodrigues, A.A., Ferreira, S.O., da Silva, R.C., 2021. Vanadium-doped sodium phosphomolybdate salts as catalysts in the terpene alcohols oxidation with hydrogen peroxide. RSC advan., 11(39), pp.24072-24085. [49] M.J. da Silva J.A.V. Torres C.B. Vilanculo Vanadium-doped phosphomolybdic acids as catalysts for geraniol oxidation with hydrogen peroxide RSC Adv. 12 19 2022 11796 11806 da Silva, M.J., Torres, J.A.V., Vilanculo, C.B., 2022. Vanadium-doped phosphomolybdic acids as catalysts for geraniol oxidation with hydrogen peroxide. RSC advan., 12(19), pp.11796-11806. [50] M. Sultan S. Paul M. Fournier D. Vanhove Evaluation and design of heteropolycompound catalysts for the selective oxidation of isobutane into methacrylic acid Appl. Catal. A Gen. 259 2 2004 141 152 Sultan, M., Paul, S., Fournier, M., Vanhove, D., 2004. Evaluation and design of heteropolycompound catalysts for the selective oxidation of isobutane into methacrylic acid. Appl. Catal. A: Gen., 259(2), pp.141-152. [51] N.A. Alekar S.B. Halligudi R. Rajani S. Gopinathan C. Gopinathan Molybdovanadophosphoric acid catalyzed oxidation of hydrocarbons by H2O2 to oxygenates React. Kinet. Catal. Lett. 72 2001 169 176 Alekar, N.A., Halligudi, S.B., Rajani, R., Gopinathan, S., Gopinathan, C., 2001. Molybdovanadophosphoric acid catalyzed oxidation of hydrocarbons by H2O2 to oxygenates. Reac. Kinet. Catal. Lett., 72, pp.169-176. [52] A.M. Motawie M.M. Madany A.Z. El-Dakrory H.M. Osman E.A. Ismail M.M. Badr D.A. El-Komy D.E. Abulyazied Physico-chemical characteristics of nano-organo bentonite prepared using different organo-modifiers Egypt. J. Pet. 23 3 2014 331 338 Motawie, A.M., Madany, M.M., El-Dakrory, A.Z., Osman, H.M., Ismail, E.A., Badr, M.M., El-Komy, D.A., Abulyazied, D.E., 2014. Physico-chemical characteristics of nano-organo bentonite prepared using different organo-modifiers. Egypt. J. Petrol. 23(3), pp.331-338. [53] S. Chahardahmasoumi S.A.H. Jalali M.N. Sarvi Tetracycline removal enhancement with Fe-saturated nanoporous montmorillonite in a tripartite adsorption/desorption/photo-Fenton degradation process Environ. Sci. Pollut. Res. 29 38 2022 57248 57260 Chahardahmasoumi, S., Jalali, S.A.H., Sarvi, M.N., 2022. Tetracycline removal enhancement with Fe-saturated nanoporous montmorillonite in a tripartite adsorption/desorption/photo-Fenton degradation process. Environ. Sci. Pollut. Res., 29(38), pp.57248-57260. [54] H. Ramezanipour Penchah A. Ghaemi H. Godarziani Eco-friendly CO2 adsorbent by impregnation of diethanolamine in nanoclay montmorillonite Environ. Sci. Pollut. Res. 28 39 2021 55754 55770 Ramezanipour Penchah, H., Ghaemi, A., Godarziani, H., 2021. Eco-friendly CO2 adsorbent by impregnation of diethanolamine in nanoclay montmorillonite. Environ. Sci. Pollut. Res., 28(39), pp.55754-55770. [55] W.L. Jiang H.F. Xu Treatment and recycling of the process water in iron ore flotation of yuanjiacun iron mine J. Chem. 2017 1 2017 9187436 (pp.) Jiang, W.L., Xu, H.F., 2017. Treatment and recycling of the process water in iron ore flotation of Yuanjiacun iron mine. J. Chem., 2017(1), pp.9187436. [56] F. Ambroz T.J. Macdonald V. Martis I.P. Parkin Evaluation of the BET theory for the characterization of meso and microporous MOFs Small Methods 2 11 2018 1800173 (pp.) Ambroz, F., Macdonald, T.J., Martis, V., Parkin, I.P., 2018. Evaluation of the BET Theory for the Characterization of Meso and Microporous MOFs. Small Methods, 2(11), pp.1800173. [57] V.R. Bukka P. Sarin Effects of particle size reduction on the pore structure and accessibility in natural porous materials Energy Fuel 38 11 2024 9578 9587 Bukka, V.R., Sarin, P., 2024. Effects of particle size reduction on the pore structure and accessibility in natural porous materials. Energy Fuel., 38(11), pp.9578-9587. [58] Y. Wei B. Han Z. Dong W. Feng Phosphomolybdic acid-modified highly organized TiO2 nanotube arrays with rapid photochromic performance J. Mater. Sci. Technol. 35 9 2019 1951 1958 Wei, Y., Han, B., Dong, Z., Feng, W., 2019. Phosphomolybdic acid-modified highly organized TiO2 nanotube arrays with rapid photochromic performance. J. Mater. Sci. Technol., 35(9), pp.1951-1958. [59] Z. Zheng J. Teo X. Chen H. Liu Y. Yuan E.R. Waclawik Z. Zhong H. Zhu Correlation of the catalytic activity for oxidation taking place on various TiO2 surfaces with surface OH groups and surface oxygen vacancies Chem. A Eur. J. 16 4 2010 1202 1211 Zheng, Z., Teo, J., Chen, X., Liu, H., Yuan, Y., Waclawik, E.R., Zhong, Z., Zhu, H., 2010. Correlation of the catalytic activity for oxidation taking place on various TiO2 surfaces with surface OH groups and surface oxygen vacancies. Chem.-A Europ. J., 16(4), pp.1202-1211. [60] P. Koley S. Chandra Shit T. Yoshida H. Ariga-Miwa T. Uruga T. Hosseinnejad S. Periasamy W. Kim D.D. Mandaliya R.D. Gudi Y. Iwasawa Unraveling high chemoselectivity in oxidative dehydration of glycerol into acrylic acid over a bifunctional metal–organic framework–polyoxometalate composite catalyst ACS Catal. 14 16 2024 12110 12127 Koley, P., Chandra Shit, S., Yoshida, T., Ariga-Miwa, H., Uruga, T., Hosseinnejad, T., Periasamy, S., Kim, W., Mandaliya, D.D., Gudi, R.D., Iwasawa, Y., 2024. Unraveling High Chemoselectivity in Oxidative Dehydration of Glycerol into Acrylic Acid over a Bifunctional Metal–Organic Framework–Polyoxometalate Composite Catalyst. ACS Catal., 14(16), pp.12110-12127. [61] L. Liu J. Li H. Zhang L. Li P. Zhou X. Meng M. Guo J. Jia T. Sun In situ fabrication of highly active γ-MnO2/SmMnO3 catalyst for deep catalytic oxidation of gaseous benzene, ethylbenzene, toluene, and o-xylene J. Hazard. Mater. 362 2019 178 186 Liu, L., Li, J., Zhang, H., Li, L., Zhou, P., Meng, X., Guo, M., Jia, J., Sun, T., 2019. In situ fabrication of highly active γ-MnO2/SmMnO3 catalyst for deep catalytic oxidation of gaseous benzene, ethylbenzene, toluene, and o-xylene. J. Hazard. Mater., 362, pp.178-186. [62] Y. Wang J. Wu G. Wang D. Yang T. Ishihara L. Guo Oxygen vacancy engineering in fe doped akhtenskite-type MnO2 for low-temperature toluene oxidation Appl. Catal. B Environ. 285 2021 119873 Wang, Y., Wu, J., Wang, G., Yang, D., Ishihara, T., Guo, L., 2021. Oxygen vacancy engineering in Fe doped akhtenskite-type MnO2 for low-temperature toluene oxidation. Appl. Catal. B: Environ., 285, pp.119873. [63] S.H. Chai H.P. Wang Y. Liang B.Q. Xu Sustainable production of acrolein: investigation of solid acid-base catalysts for gas-phase dehydration of glycerol Green. Chem. 9 10 2007 1130 1136 Chai, S.H., Wang, H.P., Liang, Y., Xu, B.Q., 2007. Sustainable production of acrolein: investigation of solid acid-base catalysts for gas-phase dehydration of glycerol. Green Chem., 9(10), pp.1130-1136. [64] L. Liu B. Wang Y. Du Z. Zhong A. Borgna Bifunctional Mo3VOx/H4SiW12O40/Al2O3 catalysts for one-step conversion of glycerol to acrylic acid: catalyst structural evolution and reaction pathways Appl. Catal. B Environ. 174 2015 1 12 Liu, L., Wang, B., Du, Y., Zhong, Z., Borgna, A., 2015. Bifunctional Mo3VOx/H4SiW12O40/Al2O3 catalysts for one-step conversion of glycerol to acrylic acid: Catalyst structural evolution and reaction pathways. Appl. Catal. B: Environ., 174, pp.1-12. [65] W. Suprun M. Lutecki T. Haber H. Papp Acidic catalysts for the dehydration of glycerol: activity and deactivation J. Mol. Catal. A Chem. 309 1-2 2009 71 78 Suprun, W., Lutecki, M., Haber, T., Papp, H., 2009. Acidic catalysts for the dehydration of glycerol: Activity and deactivation. J. Mol. Catal. A: Chem., 309(1-2), pp.71-78. [66] S. Erfle U. Armbruster U. Bentrup A. Martin A. Brückner Impact of redox properties on dehydration of glycerol to acrolein over heteropolyacids assessed by operando-EPR spectroscopy Appl. Catal. A Gen. 391 1-2 2011 102 109 Erfle, S., Armbruster, U., Bentrup, U., Martin, A., Brückner, A., 2011. Impact of redox properties on dehydration of glycerol to acrolein over heteropolyacids assessed by operando-EPR spectroscopy. Applied Catalysis A: General, 391(1-2), pp.102-109. [67] C.H. Zhou G.L. Li X.Y. Zhuang P.P. Wang D.S. Tong H.M. Yang C.X. Lin L. Li H. Zhang S.F. Ji W.H. Yu Roles of texture and acidity of acid-activated sepiolite catalysts in gas-phase catalytic dehydration of glycerol to acrolein Mol. Catal. 434 2017 219 231 Zhou, C.H., Li, G.L., Zhuang, X.Y., Wang, P.P., Tong, D.S., Yang, H.M., Lin, C.X., Li, L., Zhang, H., Ji, S.F., Yu, W.H., 2017. Roles of texture and acidity of acid-activated sepiolite catalysts in gas-phase catalytic dehydration of glycerol to acrolein. Mol. Catal., 434, pp.219-231. [68] A. Talebian-Kiakalaieh N.A.S. Amin Z.Y. Zakaria Gas phase selective conversion of glycerol to acrolein over supported silicotungstic acid catalyst J. Ind. Eng. Chem. 34 2016 300 312 Talebian-Kiakalaieh, A., Amin, N.A.S., Zakaria, Z.Y., 2016. Gas phase selective conversion of glycerol to acrolein over supported silicotungstic acid catalyst. J. Indus. Engin. Chem., 34, pp.300-312. [69] A. Talebian-Kiakalaieh N.A.S. Amin Supported silicotungstic acid on zirconia catalyst for gas phase dehydration of glycerol to acrolein Catal. Today 256 2015 315 324 Talebian-Kiakalaieh, A., Amin, N.A.S., 2015. Supported silicotungstic acid on zirconia catalyst for gas phase dehydration of glycerol to acrolein. Catal. Today, 256, pp.315-324. [70] T.Y. Kim J. Baek C.K. Song Y.S. Yun D.S. Park W. Kim J.W. Han J. Yi Gas-phase dehydration of vicinal diols to epoxides: dehydrative epoxidation over a cs/SiO2 catalyst J. Catal. 323 2015 85 99 Kim, T.Y., Baek, J., Song, C.K., Yun, Y.S., Park, D.S., Kim, W., Han, J.W., Yi, J., 2015. Gas-phase dehydration of vicinal diols to epoxides: Dehydrative epoxidation over a Cs/SiO2 catalyst. J.Catal., 323, pp.85-99. [71] R. Znaiguia L. Brandhorst N. Christin V.B. Baca P. Rey J.M.M. Millet S. Loridant Toward longer life catalysts for dehydration of glycerol to acrolein Micro Mesopor. Mater. 196 2014 97 103 Znaiguia, R., Brandhorst, L., Christin, N., Baca, V.B., Rey, P., Millet, J.M.M., Loridant, S., 2014. Toward longer life catalysts for dehydration of glycerol to acrolein. Micropor. Mesopor. Mater., 196, pp.97-103. [72] T.V. Andrushkevich Heterogeneous catalytic oxidation of acrolein to acrylic acid: mechanism and catalysts Catal. Rev. Sci. Eng. 35 2 1993 213 259 Andrushkevich, T.V., 1993. Heterogeneous catalytic oxidation of acrolein to acrylic acid: mechanism and catalysts. Catal. Rev. Sci. Engin., 35(2), pp.213-259. [73] S.T. Wu Q.M. She R. Tesser M.D. Serio C.H. Zhou Catalytic glycerol dehydration-oxidation to acrylic acid Catal. Rev. 62 4 2020 481 523 Wu, S.T., She, Q.M., Tesser, R., Serio, M.D., Zhou, C.H., 2020. Catalytic glycerol dehydration-oxidation to acrylic acid. Catal. Rev., 62(4), pp.481-523. [74] P. Kampe L. Giebeler D. Samuelis J. Kunert A. Drochner F. Haaß A.H. Adams J. Ott S. Endres G. Schimanke T. Buhrmester Heterogeneously catalysed partial oxidation of acrolein to acrylic acid—structure, function and dynamics of the V–Mo–W mixed oxides Phys. Chem. Chem. Phys. 9 27 2007 3577 3589 Kampe, P., Giebeler, L., Samuelis, D., Kunert, J., Drochner, A., Haaß, F., Adams, A.H., Ott, J., Endres, S., Schimanke, G., Buhrmester, T., 2007. Heterogeneously catalysed partial oxidation of acrolein to acrylic acid—structure, function and dynamics of the V–Mo–W mixed oxides. Phys. Chem. Chem. Phys., 9(27), pp.3577-3589. [75] Y. Liu H. Tüysüz C.J. Jia M. Schwickardi R. Rinaldi A.H. Lu W. Schmidt F. Schüth From glycerol to allyl alcohol: iron oxide catalyzed dehydration and consecutive hydrogen transfer Chem. Commun. 46 8 2010 1238 1240 Liu, Y., Tüysüz, H., Jia, C.J., Schwickardi, M., Rinaldi, R., Lu, A.H., Schmidt, W., Schüth, F., 2010. From glycerol to allyl alcohol: iron oxide catalyzed dehydration and consecutive hydrogen transfer. Chem. Commun., 46(8), pp.1238-1240. [76] M. Gliński U. Ulkowska Reactivity of alcohols in chemoselective transfer hydrogenation of acrolein over magnesium oxide as the catalyst Catal. Lett. 141 2011 293 299 Gliński, M., Ulkowska, U., 2011. Reactivity of alcohols in chemoselective transfer hydrogenation of acrolein over magnesium oxide as the catalyst. Catal. Lett., 141, pp.293-299. [77] G. Sánchez J. Friggieri A.A. Adesina B.Z. Dlugogorski E.M. Kennedy M. Stockenhuber Catalytic conversion of glycerol to allyl alcohol; effect of a sacrificial reductant on the product yield Catal. Sci. Technol. 4 9 2014 3090 3098 Sánchez, G., Friggieri, J., Adesina, A.A., Dlugogorski, B.Z., Kennedy, E.M. and Stockenhuber, M., 2014. Catalytic conversion of glycerol to allyl alcohol; effect of a sacrificial reductant on the product yield. Catal. Sci. Technol., 4(9), pp.3090-3098. [78] R. Mane Y. Jeon C. Rode A review on non-noble metal catalysts for glycerol hydrodeoxygenation to 1, 2-propanediol with and without external hydrogen Green. Chem. 24 18 2022 6751 6781 Mane, R., Jeon, Y., Rode, C., 2022. A review on non-noble metal catalysts for glycerol hydrodeoxygenation to 1, 2-propanediol with and without external hydrogen. Green Chemis., 24(18), pp.6751-6781. [79] M.H. Haider N.F. Dummer D.W. Knight R.L. Jenkins M. Howard J. Moulijn S.H. Taylor G.J. Hutchings Efficient Green methanol synthesis from glycerol Nat. Chem. 7 12 2015 1028 1032 Haider, M.H., Dummer, N.F., Knight, D.W., Jenkins, R.L., Howard, M., Moulijn, J., Taylor, S.H., Hutchings, G.J., 2015. Efficient green methanol synthesis from glycerol. Nat. Chem., 7(12), pp.1028-1032. [80] A. Corma G.W. Huber L. Sauvanaud P. O'Connor Biomass to chemicals: catalytic conversion of glycerol/water mixtures into acrolein, reaction network J. Catal. 257 1 2008 163 171 Corma, A., Huber, G.W., Sauvanaud, L., O′Connor, P., 2008. Biomass to chemicals: catalytic conversion of glycerol/water mixtures into acrolein, reaction network. J. Catal., 257(1), pp.163-171.",
      "coredata": {
        "eid": "1-s2.0-S0926860X25004971",
        "dc:description": "Transforming glycerol into value-added chemicals like acrylic acid and allyl alcohol enhances biorefinery sustainability. We report a one-pot gas-phase process using a dual-bed catalytic system: acidified montmorillonite (H-MMT, upper bed) and vanadium-doped ammonium phosphomolybdate (V-doped NH4PM, lower bed). The combination of H-MMT and primary V-doped NH4PM (NH4PMV) catalyst favoured the oxydehydration reaction and was susceptible to the selective conversion of glycerol to acrylic acid (Sel.- 63 %). On the other hand, H-MMT and secondary VOx-doped NH4PM ((VO)x-NH4PM) catalysts preferred the selective production of allyl alcohol via deoxydehydration reaction. Maximum allyl alcohol selectivity of 61 % was achieved by 1:2 wt. ratio of HMMT and (VO)0.2-NH4PM dual bed catalytic system. O2-TPD and XPS analyses revealed that V doping at the primary Keggin site of NH4PM increased surface oxygen defects and enhanced Mo6 + /Mo5+ charge transfer, promoting acrolein oxidation to acrylic acid. In contrast, secondary V-doped catalysts had fewer oxygen vacancies and were less effective for oxidation but showed high efficiency in hydrogen transfer from formic acid, methanol, or water, favoring allyl alcohol formation. Additionally, the following thermo-kinetic factors were evaluated for the best-performing catalysts, providing insights into the factors contributing to their high catalytic activity. Furthermore, incorporating 15 wt% dolomite into H-MMT reduced coke formation from 34.1 % to 2.54 % post-regeneration and extended catalyst life to 8 h of TOS while maintaining > 40 % product selectivity, offering a practical strategy for coking resistance.",
        "openArchiveArticle": "false",
        "prism:coverDate": "2026-01-05",
        "openaccessUserLicense": null,
        "prism:aggregationType": "Journal",
        "prism:url": "https://api.elsevier.com/content/article/pii/S0926860X25004971",
        "dc:creator": [
          {
            "@_fa": "true",
            "$": "Roy, Tania"
          },
          {
            "@_fa": "true",
            "$": "Wang, Jin"
          },
          {
            "@_fa": "true",
            "$": "Mu, Rongzhen"
          },
          {
            "@_fa": "true",
            "$": "Kurniawan, Alfin"
          },
          {
            "@_fa": "true",
            "$": "Chen, Xiaolan"
          },
          {
            "@_fa": "true",
            "$": "Liu, Chenglan"
          },
          {
            "@_fa": "true",
            "$": "Wang, Guoya"
          },
          {
            "@_fa": "true",
            "$": "Zhou, Chun Hui"
          }
        ],
        "link": [
          {
            "@_fa": "true",
            "@rel": "self",
            "@href": "https://api.elsevier.com/content/article/pii/S0926860X25004971"
          },
          {
            "@_fa": "true",
            "@rel": "scidir",
            "@href": "https://www.sciencedirect.com/science/article/pii/S0926860X25004971"
          }
        ],
        "dc:format": "application/json",
        "openaccessType": null,
        "pii": "S0926-860X(25)00497-1",
        "prism:volume": "709",
        "articleNumber": "120595",
        "prism:publisher": "Elsevier B.V. All rights are reserved, including those for text and data mining, AI training, and similar technologies.",
        "dc:title": "Elucidating Keggin site-specific activity of NH4PM catalysts associated with dolomite-added H-MMT in gas-phase glycerol valorisation reactions",
        "prism:copyright": "© 2025 Elsevier B.V. All rights are reserved, including those for text and data mining, AI training, and similar technologies.",
        "openaccess": "0",
        "prism:issn": "0926860X",
        "dcterms:subject": [
          {
            "@_fa": "true",
            "$": "V-doping"
          },
          {
            "@_fa": "true",
            "$": "Keggin sites"
          },
          {
            "@_fa": "true",
            "$": "Glycerol"
          },
          {
            "@_fa": "true",
            "$": "Acrylic acid"
          },
          {
            "@_fa": "true",
            "$": "Allyl alcohol"
          },
          {
            "@_fa": "true",
            "$": "Dolomite"
          }
        ],
        "openaccessArticle": "false",
        "prism:publicationName": "Applied Catalysis A: General",
        "openaccessSponsorType": null,
        "prism:pageRange": "120595",
        "pubType": "fla",
        "prism:coverDisplayDate": "5 January 2026",
        "prism:doi": "10.1016/j.apcata.2025.120595",
        "prism:startingPage": "120595",
        "dc:identifier": "doi:10.1016/j.apcata.2025.120595",
        "openaccessSponsorName": null
      },
      "objects": {
        "object": [
          {
            "@category": "standard",
            "@height": "200",
            "@width": "358",
            "@_fa": "true",
            "$": "https://api.elsevier.com/content/object/eid/1-s2.0-S0926860X25004971-ga1.jpg?httpAccept=%2A%2F%2A",
            "@multimediatype": "JPEG image file",
            "@type": "IMAGE-DOWNSAMPLED",
            "@size": "22929",
            "@ref": "ga1",
            "@mimetype": "image/jpeg"
          },
          {
            "@category": "thumbnail",
            "@height": "122",
            "@width": "219",
            "@_fa": "true",
            "$": "https://api.elsevier.com/content/object/eid/1-s2.0-S0926860X25004971-ga1.sml?httpAccept=%2A%2F%2A",
            "@multimediatype": "GIF image file",
            "@type": "IMAGE-THUMBNAIL",
            "@size": "9775",
            "@ref": "ga1",
            "@mimetype": "image/gif"
          },
          {
            "@category": "standard",
            "@height": "490",
            "@width": "678",
            "@_fa": "true",
            "$": "https://api.elsevier.com/content/object/eid/1-s2.0-S0926860X25004971-gr2.jpg?httpAccept=%2A%2F%2A",
            "@multimediatype": "JPEG image file",
            "@type": "IMAGE-DOWNSAMPLED",
            "@size": "80205",
            "@ref": "gr2",
            "@mimetype": "image/jpeg"
          },
          {
            "@category": "thumbnail",
            "@height": "158",
            "@width": "219",
            "@_fa": "true",
            "$": "https://api.elsevier.com/content/object/eid/1-s2.0-S0926860X25004971-gr2.sml?httpAccept=%2A%2F%2A",
            "@multimediatype": "GIF image file",
            "@type": "IMAGE-THUMBNAIL",
            "@size": "10497",
            "@ref": "gr2",
            "@mimetype": "image/gif"
          },
          {
            "@category": "standard",
            "@height": "505",
            "@width": "678",
            "@_fa": "true",
            "$": "https://api.elsevier.com/content/object/eid/1-s2.0-S0926860X25004971-gr11.jpg?httpAccept=%2A%2F%2A",
            "@multimediatype": "JPEG image file",
            "@type": "IMAGE-DOWNSAMPLED",
            "@size": "108066",
            "@ref": "gr11",
            "@mimetype": "image/jpeg"
          },
          {
            "@category": "thumbnail",
            "@height": "163",
            "@width": "219",
            "@_fa": "true",
            "$": "https://api.elsevier.com/content/object/eid/1-s2.0-S0926860X25004971-gr11.sml?httpAccept=%2A%2F%2A",
            "@multimediatype": "GIF image file",
            "@type": "IMAGE-THUMBNAIL",
            "@size": "15917",
            "@ref": "gr11",
            "@mimetype": "image/gif"
          },
          {
            "@category": "standard",
            "@height": "566",
            "@width": "678",
            "@_fa": "true",
            "$": "https://api.elsevier.com/content/object/eid/1-s2.0-S0926860X25004971-gr1.jpg?httpAccept=%2A%2F%2A",
            "@multimediatype": "JPEG image file",
            "@type": "IMAGE-DOWNSAMPLED",
            "@size": "70915",
            "@ref": "gr1",
            "@mimetype": "image/jpeg"
          },
          {
            "@category": "thumbnail",
            "@height": "164",
            "@width": "196",
            "@_fa": "true",
            "$": "https://api.elsevier.com/content/object/eid/1-s2.0-S0926860X25004971-gr1.sml?httpAccept=%2A%2F%2A",
            "@multimediatype": "GIF image file",
            "@type": "IMAGE-THUMBNAIL",
            "@size": "8576",
            "@ref": "gr1",
            "@mimetype": "image/gif"
          },
          {
            "@category": "standard",
            "@height": "520",
            "@width": "678",
            "@_fa": "true",
            "$": "https://api.elsevier.com/content/object/eid/1-s2.0-S0926860X25004971-gr10.jpg?httpAccept=%2A%2F%2A",
            "@multimediatype": "JPEG image file",
            "@type": "IMAGE-DOWNSAMPLED",
            "@size": "55366",
            "@ref": "gr10",
            "@mimetype": "image/jpeg"
          },
          {
            "@category": "thumbnail",
            "@height": "163",
            "@width": "213",
            "@_fa": "true",
            "$": "https://api.elsevier.com/content/object/eid/1-s2.0-S0926860X25004971-gr10.sml?httpAccept=%2A%2F%2A",
            "@multimediatype": "GIF image file",
            "@type": "IMAGE-THUMBNAIL",
            "@size": "7362",
            "@ref": "gr10",
            "@mimetype": "image/gif"
          },
          {
            "@category": "standard",
            "@height": "279",
            "@width": "678",
            "@_fa": "true",
            "$": "https://api.elsevier.com/content/object/eid/1-s2.0-S0926860X25004971-gr4.jpg?httpAccept=%2A%2F%2A",
            "@multimediatype": "JPEG image file",
            "@type": "IMAGE-DOWNSAMPLED",
            "@size": "49888",
            "@ref": "gr4",
            "@mimetype": "image/jpeg"
          },
          {
            "@category": "thumbnail",
            "@height": "90",
            "@width": "219",
            "@_fa": "true",
            "$": "https://api.elsevier.com/content/object/eid/1-s2.0-S0926860X25004971-gr4.sml?httpAccept=%2A%2F%2A",
            "@multimediatype": "GIF image file",
            "@type": "IMAGE-THUMBNAIL",
            "@size": "7558",
            "@ref": "gr4",
            "@mimetype": "image/gif"
          },
          {
            "@category": "standard",
            "@height": "294",
            "@width": "376",
            "@_fa": "true",
            "$": "https://api.elsevier.com/content/object/eid/1-s2.0-S0926860X25004971-gr3.jpg?httpAccept=%2A%2F%2A",
            "@multimediatype": "JPEG image file",
            "@type": "IMAGE-DOWNSAMPLED",
            "@size": "34399",
            "@ref": "gr3",
            "@mimetype": "image/jpeg"
          },
          {
            "@category": "thumbnail",
            "@height": "164",
            "@width": "210",
            "@_fa": "true",
            "$": "https://api.elsevier.com/content/object/eid/1-s2.0-S0926860X25004971-gr3.sml?httpAccept=%2A%2F%2A",
            "@multimediatype": "GIF image file",
            "@type": "IMAGE-THUMBNAIL",
            "@size": "13205",
            "@ref": "gr3",
            "@mimetype": "image/gif"
          },
          {
            "@category": "standard",
            "@height": "489",
            "@width": "678",
            "@_fa": "true",
            "$": "https://api.elsevier.com/content/object/eid/1-s2.0-S0926860X25004971-gr12.jpg?httpAccept=%2A%2F%2A",
            "@multimediatype": "JPEG image file",
            "@type": "IMAGE-DOWNSAMPLED",
            "@size": "52037",
            "@ref": "gr12",
            "@mimetype": "image/jpeg"
          },
          {
            "@category": "thumbnail",
            "@height": "158",
            "@width": "219",
            "@_fa": "true",
            "$": "https://api.elsevier.com/content/object/eid/1-s2.0-S0926860X25004971-gr12.sml?httpAccept=%2A%2F%2A",
            "@multimediatype": "GIF image file",
            "@type": "IMAGE-THUMBNAIL",
            "@size": "6064",
            "@ref": "gr12",
            "@mimetype": "image/gif"
          },
          {
            "@category": "standard",
            "@height": "491",
            "@width": "678",
            "@_fa": "true",
            "$": "https://api.elsevier.com/content/object/eid/1-s2.0-S0926860X25004971-gr9.jpg?httpAccept=%2A%2F%2A",
            "@multimediatype": "JPEG image file",
            "@type": "IMAGE-DOWNSAMPLED",
            "@size": "84881",
            "@ref": "gr9",
            "@mimetype": "image/jpeg"
          },
          {
            "@category": "thumbnail",
            "@height": "159",
            "@width": "219",
            "@_fa": "true",
            "$": "https://api.elsevier.com/content/object/eid/1-s2.0-S0926860X25004971-gr9.sml?httpAccept=%2A%2F%2A",
            "@multimediatype": "GIF image file",
            "@type": "IMAGE-THUMBNAIL",
            "@size": "13067",
            "@ref": "gr9",
            "@mimetype": "image/gif"
          },
          {
            "@category": "standard",
            "@height": "352",
            "@width": "678",
            "@_fa": "true",
            "$": "https://api.elsevier.com/content/object/eid/1-s2.0-S0926860X25004971-gr6.jpg?httpAccept=%2A%2F%2A",
            "@multimediatype": "JPEG image file",
            "@type": "IMAGE-DOWNSAMPLED",
            "@size": "89721",
            "@ref": "gr6",
            "@mimetype": "image/jpeg"
          },
          {
            "@category": "thumbnail",
            "@height": "114",
            "@width": "219",
            "@_fa": "true",
            "$": "https://api.elsevier.com/content/object/eid/1-s2.0-S0926860X25004971-gr6.sml?httpAccept=%2A%2F%2A",
            "@multimediatype": "GIF image file",
            "@type": "IMAGE-THUMBNAIL",
            "@size": "18737",
            "@ref": "gr6",
            "@mimetype": "image/gif"
          },
          {
            "@category": "standard",
            "@height": "270",
            "@width": "678",
            "@_fa": "true",
            "$": "https://api.elsevier.com/content/object/eid/1-s2.0-S0926860X25004971-gr5.jpg?httpAccept=%2A%2F%2A",
            "@multimediatype": "JPEG image file",
            "@type": "IMAGE-DOWNSAMPLED",
            "@size": "50948",
            "@ref": "gr5",
            "@mimetype": "image/jpeg"
          },
          {
            "@category": "thumbnail",
            "@height": "87",
            "@width": "219",
            "@_fa": "true",
            "$": "https://api.elsevier.com/content/object/eid/1-s2.0-S0926860X25004971-gr5.sml?httpAccept=%2A%2F%2A",
            "@multimediatype": "GIF image file",
            "@type": "IMAGE-THUMBNAIL",
            "@size": "7974",
            "@ref": "gr5",
            "@mimetype": "image/gif"
          },
          {
            "@category": "standard",
            "@height": "314",
            "@width": "508",
            "@_fa": "true",
            "$": "https://api.elsevier.com/content/object/eid/1-s2.0-S0926860X25004971-gr8.jpg?httpAccept=%2A%2F%2A",
            "@multimediatype": "JPEG image file",
            "@type": "IMAGE-DOWNSAMPLED",
            "@size": "35816",
            "@ref": "gr8",
            "@mimetype": "image/jpeg"
          },
          {
            "@category": "thumbnail",
            "@height": "135",
            "@width": "219",
            "@_fa": "true",
            "$": "https://api.elsevier.com/content/object/eid/1-s2.0-S0926860X25004971-gr8.sml?httpAccept=%2A%2F%2A",
            "@multimediatype": "GIF image file",
            "@type": "IMAGE-THUMBNAIL",
            "@size": "8995",
            "@ref": "gr8",
            "@mimetype": "image/gif"
          },
          {
            "@category": "standard",
            "@height": "462",
            "@width": "791",
            "@_fa": "true",
            "$": "https://api.elsevier.com/content/object/eid/1-s2.0-S0926860X25004971-gr7.jpg?httpAccept=%2A%2F%2A",
            "@multimediatype": "JPEG image file",
            "@type": "IMAGE-DOWNSAMPLED",
            "@size": "78569",
            "@ref": "gr7",
            "@mimetype": "image/jpeg"
          },
          {
            "@category": "thumbnail",
            "@height": "128",
            "@width": "219",
            "@_fa": "true",
            "$": "https://api.elsevier.com/content/object/eid/1-s2.0-S0926860X25004971-gr7.sml?httpAccept=%2A%2F%2A",
            "@multimediatype": "GIF image file",
            "@type": "IMAGE-THUMBNAIL",
            "@size": "9233",
            "@ref": "gr7",
            "@mimetype": "image/gif"
          },
          {
            "@category": "high",
            "@height": "886",
            "@width": "1586",
            "@_fa": "true",
            "$": "https://api.elsevier.com/content/object/eid/1-s2.0-S0926860X25004971-ga1_lrg.jpg?httpAccept=%2A%2F%2A",
            "@multimediatype": "JPEG image file",
            "@type": "IMAGE-HIGH-RES",
            "@size": "183573",
            "@ref": "ga1",
            "@mimetype": "image/jpeg"
          },
          {
            "@category": "high",
            "@height": "2163",
            "@width": "2994",
            "@_fa": "true",
            "$": "https://api.elsevier.com/content/object/eid/1-s2.0-S0926860X25004971-gr2_lrg.jpg?httpAccept=%2A%2F%2A",
            "@multimediatype": "JPEG image file",
            "@type": "IMAGE-HIGH-RES",
            "@size": "390473",
            "@ref": "gr2",
            "@mimetype": "image/jpeg"
          },
          {
            "@category": "high",
            "@height": "2232",
            "@width": "2994",
            "@_fa": "true",
            "$": "https://api.elsevier.com/content/object/eid/1-s2.0-S0926860X25004971-gr11_lrg.jpg?httpAccept=%2A%2F%2A",
            "@multimediatype": "JPEG image file",
            "@type": "IMAGE-HIGH-RES",
            "@size": "524755",
            "@ref": "gr11",
            "@mimetype": "image/jpeg"
          },
          {
            "@category": "high",
            "@height": "2498",
            "@width": "2994",
            "@_fa": "true",
            "$": "https://api.elsevier.com/content/object/eid/1-s2.0-S0926860X25004971-gr1_lrg.jpg?httpAccept=%2A%2F%2A",
            "@multimediatype": "JPEG image file",
            "@type": "IMAGE-HIGH-RES",
            "@size": "329069",
            "@ref": "gr1",
            "@mimetype": "image/jpeg"
          },
          {
            "@category": "high",
            "@height": "2298",
            "@width": "2994",
            "@_fa": "true",
            "$": "https://api.elsevier.com/content/object/eid/1-s2.0-S0926860X25004971-gr10_lrg.jpg?httpAccept=%2A%2F%2A",
            "@multimediatype": "JPEG image file",
            "@type": "IMAGE-HIGH-RES",
            "@size": "260295",
            "@ref": "gr10",
            "@mimetype": "image/jpeg"
          },
          {
            "@category": "high",
            "@height": "1233",
            "@width": "2994",
            "@_fa": "true",
            "$": "https://api.elsevier.com/content/object/eid/1-s2.0-S0926860X25004971-gr4_lrg.jpg?httpAccept=%2A%2F%2A",
            "@multimediatype": "JPEG image file",
            "@type": "IMAGE-HIGH-RES",
            "@size": "275516",
            "@ref": "gr4",
            "@mimetype": "image/jpeg"
          },
          {
            "@category": "high",
            "@height": "1300",
            "@width": "1665",
            "@_fa": "true",
            "$": "https://api.elsevier.com/content/object/eid/1-s2.0-S0926860X25004971-gr3_lrg.jpg?httpAccept=%2A%2F%2A",
            "@multimediatype": "JPEG image file",
            "@type": "IMAGE-HIGH-RES",
            "@size": "248348",
            "@ref": "gr3",
            "@mimetype": "image/jpeg"
          },
          {
            "@category": "high",
            "@height": "2159",
            "@width": "2994",
            "@_fa": "true",
            "$": "https://api.elsevier.com/content/object/eid/1-s2.0-S0926860X25004971-gr12_lrg.jpg?httpAccept=%2A%2F%2A",
            "@multimediatype": "JPEG image file",
            "@type": "IMAGE-HIGH-RES",
            "@size": "229267",
            "@ref": "gr12",
            "@mimetype": "image/jpeg"
          },
          {
            "@category": "high",
            "@height": "2167",
            "@width": "2994",
            "@_fa": "true",
            "$": "https://api.elsevier.com/content/object/eid/1-s2.0-S0926860X25004971-gr9_lrg.jpg?httpAccept=%2A%2F%2A",
            "@multimediatype": "JPEG image file",
            "@type": "IMAGE-HIGH-RES",
            "@size": "386981",
            "@ref": "gr9",
            "@mimetype": "image/jpeg"
          },
          {
            "@category": "high",
            "@height": "1555",
            "@width": "2994",
            "@_fa": "true",
            "$": "https://api.elsevier.com/content/object/eid/1-s2.0-S0926860X25004971-gr6_lrg.jpg?httpAccept=%2A%2F%2A",
            "@multimediatype": "JPEG image file",
            "@type": "IMAGE-HIGH-RES",
            "@size": "487302",
            "@ref": "gr6",
            "@mimetype": "image/jpeg"
          },
          {
            "@category": "high",
            "@height": "1191",
            "@width": "2994",
            "@_fa": "true",
            "$": "https://api.elsevier.com/content/object/eid/1-s2.0-S0926860X25004971-gr5_lrg.jpg?httpAccept=%2A%2F%2A",
            "@multimediatype": "JPEG image file",
            "@type": "IMAGE-HIGH-RES",
            "@size": "273075",
            "@ref": "gr5",
            "@mimetype": "image/jpeg"
          },
          {
            "@category": "high",
            "@height": "1387",
            "@width": "2245",
            "@_fa": "true",
            "$": "https://api.elsevier.com/content/object/eid/1-s2.0-S0926860X25004971-gr8_lrg.jpg?httpAccept=%2A%2F%2A",
            "@multimediatype": "JPEG image file",
            "@type": "IMAGE-HIGH-RES",
            "@size": "199694",
            "@ref": "gr8",
            "@mimetype": "image/jpeg"
          },
          {
            "@category": "high",
            "@height": "2038",
            "@width": "3493",
            "@_fa": "true",
            "$": "https://api.elsevier.com/content/object/eid/1-s2.0-S0926860X25004971-gr7_lrg.jpg?httpAccept=%2A%2F%2A",
            "@multimediatype": "JPEG image file",
            "@type": "IMAGE-HIGH-RES",
            "@size": "368390",
            "@ref": "gr7",
            "@mimetype": "image/jpeg"
          },
          {
            "@category": "standard",
            "@_fa": "true",
            "$": "https://api.elsevier.com/content/object/eid/1-s2.0-S0926860X25004971-mmc1.docx?httpAccept=%2A%2F%2A",
            "@multimediatype": "Microsoft Word file",
            "@type": "APPLICATION",
            "@size": "6767366",
            "@ref": "mmc1",
            "@mimetype": "application/word"
          },
          {
            "@category": "thumbnail",
            "@_fa": "true",
            "$": "https://api.elsevier.com/content/object/eid/1-s2.0-S0926860X25004971-si0001.svg?httpAccept=%2A%2F%2A",
            "@multimediatype": "Scalable Vector Graphics file",
            "@type": "ALTIMG",
            "@size": "4745",
            "@ref": "si0001",
            "@mimetype": "image/svg+xml"
          },
          {
            "@category": "thumbnail",
            "@_fa": "true",
            "$": "https://api.elsevier.com/content/object/eid/1-s2.0-S0926860X25004971-si0002.svg?httpAccept=%2A%2F%2A",
            "@multimediatype": "Scalable Vector Graphics file",
            "@type": "ALTIMG",
            "@size": "5308",
            "@ref": "si0002",
            "@mimetype": "image/svg+xml"
          },
          {
            "@category": "thumbnail",
            "@_fa": "true",
            "$": "https://api.elsevier.com/content/object/eid/1-s2.0-S0926860X25004971-si0003.svg?httpAccept=%2A%2F%2A",
            "@multimediatype": "Scalable Vector Graphics file",
            "@type": "ALTIMG",
            "@size": "1912",
            "@ref": "si0003",
            "@mimetype": "image/svg+xml"
          },
          {
            "@category": "thumbnail",
            "@_fa": "true",
            "$": "https://api.elsevier.com/content/object/eid/1-s2.0-S0926860X25004971-si0004.svg?httpAccept=%2A%2F%2A",
            "@multimediatype": "Scalable Vector Graphics file",
            "@type": "ALTIMG",
            "@size": "2455",
            "@ref": "si0004",
            "@mimetype": "image/svg+xml"
          },
          {
            "@category": "thumbnail",
            "@_fa": "true",
            "$": "https://api.elsevier.com/content/object/eid/1-s2.0-S0926860X25004971-si0005.svg?httpAccept=%2A%2F%2A",
            "@multimediatype": "Scalable Vector Graphics file",
            "@type": "ALTIMG",
            "@size": "2791",
            "@ref": "si0005",
            "@mimetype": "image/svg+xml"
          },
          {
            "@category": "thumbnail",
            "@_fa": "true",
            "$": "https://api.elsevier.com/content/object/eid/1-s2.0-S0926860X25004971-si0006.svg?httpAccept=%2A%2F%2A",
            "@multimediatype": "Scalable Vector Graphics file",
            "@type": "ALTIMG",
            "@size": "3849",
            "@ref": "si0006",
            "@mimetype": "image/svg+xml"
          },
          {
            "@category": "thumbnail",
            "@_fa": "true",
            "$": "https://api.elsevier.com/content/object/eid/1-s2.0-S0926860X25004971-si0007.svg?httpAccept=%2A%2F%2A",
            "@multimediatype": "Scalable Vector Graphics file",
            "@type": "ALTIMG",
            "@size": "952",
            "@ref": "si0007",
            "@mimetype": "image/svg+xml"
          },
          {
            "@category": "thumbnail",
            "@_fa": "true",
            "$": "https://api.elsevier.com/content/object/eid/1-s2.0-S0926860X25004971-si0008.svg?httpAccept=%2A%2F%2A",
            "@multimediatype": "Scalable Vector Graphics file",
            "@type": "ALTIMG",
            "@size": "952",
            "@ref": "si0008",
            "@mimetype": "image/svg+xml"
          }
        ]
      }
    }
  }
}