{
  "metadata": {
    "title": "Solvent-free phosphorus modification of Pt/Al<ce:inf loc=post>2</ce:inf>O<ce:inf loc=post>3</ce:inf> catalysts to improve dispersion and dehydrogenation activity",
    "authors": "; ; ",
    "journal": "Applied Catalysis A: General",
    "date": "2025-04-25",
    "doi": "10.1016/j.apcata.2025.120199",
    "abstract": "",
    "uri": "https://api.elsevier.com/content/article/pii/S0926860X25001000",
    "pii": "S0926860X25001000"
  },
  "fulltext": {
    "full-text-retrieval-response": {
      "scopus-eid": "2-s2.0-85219493226",
      "originalText": "serial JL 271346 291210 291744 291809 31 90 Applied Catalysis A: General APPLIEDCATALYSISAGENERAL 2025-03-03 2025-03-03 2025-03-06 2025-03-06 2025-03-13T12:53:01 1-s2.0-S0926860X25001000 S0926-860X(25)00100-0 S0926860X25001000 10.1016/j.apcata.2025.120199 S300 S300.1 FULL-TEXT 1-s2.0-S0926860X25X00041 2025-03-13T13:06:21.81897Z 0 0 20250425 2025 2025-03-03T16:26:49.791968Z absattachment articleinfo articlenumber articletitlenorm authfirstinitialnorm authfirstsurnamenorm cid cids contenttype copyright crossmark dateloaded dateloadedtxt datesearch datesort dateupdated dco docsubtype doctype doi eid ewtransactionid fundingbodyid hubeid indexeddate issn issnnorm itemstage itemtransactionid itemweight oauserlicense openaccess openarchive pg pgfirst pii piinorm pubdatestart pubdatetxt pubyr sortorder sponsoredaccesstype srctitle srctitlenorm srctype ssids alllist content oa subj subheadings suppl tomb volfirst volissue volumelist webpdf webpdfpagecount yearnav figure table e-component body mmlmath acknowledge affil appendices articletitle auth authfirstini authfull authkeywords authlast grantnumber grantsponsor grantsponsorid orcid otherkwds primabst ref specialabst 0926-860X 0926860X UNLIMITED DEALHYB23 true 696 696 C Volume 696 13 120199 120199 120199 20250425 25 April 2025 2025-04-25 2025 article fla © 2025 The Author(s). Published by Elsevier B.V. SOLVENTFREEPHOSPHORUSMODIFICATIONPTAL2O3CATALYSTSIMPROVEDISPERSIONDEHYDROGENATIONACTIVITY ELLERT A 1 Introduction 2 Experimental 2.1 Materials 2.2 Catalyst preparation 2.3 ICP-OES 2.4 N2 physisorption 2.5 Electron microscopy 2.6 CO pulse chemisorption 2.7 X-ray diffraction 2.8 XPS 2.9 Solid state 31P NMR 2.10 Catalytic testing 3 Results 4 Discussion 5 Conclusion CRediT authorship contribution statement Acknowledgment Appendix A Supplementary material References CHANDLER 1998 267 282 B AUER 2020 6669 6678 F NAGATAKE 2016 54 60 S OH 2022 121061 J LEE 2020 204 212 J LEE 2019 8 19 J YU 2012 5780 5817 W ZHANG 2020 1171 1181 X ALCONADA 2023 K DUNLEAVY 2006 110 J ARGYLE 2015 145 269 M AUER 2019 3537 3547 F DAO 2024 1284 1293 Q ELLERT 2024 115607 A GUAN 2009 1 3 Q PENG 2015 15951 15955 C LIU 2017 133 142 D PRINS 2012 1413 1436 R LIU 2017 6366 6378 D RUDE 2022 1541 1553 T SOLYMOSI 2021 34797 34806 T ISAACS 1982 43 52 B CHU 1978 281 298 Y ROTHSCHILD 1986 588 593 W MOULDER 1992 J PHYSICALELECTRONICSDIVISION HANDBOOKXRAYPHOTOELECTRONSPECTROSCOPYAREFERENCEBOOKSTANDARDSPECTRAFORIDENTIFICATIONINTERPRETATIONXPSDATA SCHON 1972 377 387 G SCHNEIDER 1981 997 1005 W JACKSON 1993 191 206 S KINOSHITA 1974 109 117 K SCHWEIZER 1978 2326 2327 A LINDBLAD 1994 187 208 T ROTOLE 1998 60 66 J FLUCK 1974 603 607 E KOU 2021 13496 13509 J NISHITANI 1978 321 327 R BAKER 1996 1591 1605 S ELROD 1987 197 201 U BREDIG 1927 41 71 G LATYPOV 2015 6976 6987 S HUHN 2021 11278 11292 A DECANIO 1991 498 511 E KIRKPATRICK 1995 9 21 R JOHNSON 2002 1104 1111 B ELLERTX2025X120199 ELLERTX2025X120199XA Full 2025-03-03T07:44:44Z ElsevierWaived DEAL agreement: Core Hybrid journals http://creativecommons.org/licenses/by/4.0/ DEAL_DG none 2027-03-06T00:00:00.000Z http://creativecommons.org/licenses/by-nc-nd/4.0/ This is an open access article under the CC BY license. © 2025 The Author(s). Published by Elsevier B.V. 2025-03-08T07:08:54.769Z http://vtw.elsevier.com/data/voc/AddOnTypes/50.7/aggregated-refined Research Council of Norway 431791331 \\u2013 SFB 1452 295864 Research Council of Norway http://data.elsevier.com/vocabulary/SciValFunders/501100005416 http://sws.geonames.org/3144096 Umicore AG und Co KG http://data.elsevier.com/vocabulary/SciValFunders/501100019931 http://sws.geonames.org/2921044 German Research Foundation 471263729 German Research Foundation http://data.elsevier.com/vocabulary/SciValFunders/501100001659 http://sws.geonames.org/2921044 FH acknowledges a fellowship within the Walter-Benjamin-program of the Deutsche Forschungsgemeinschaft (DFG, German Research Foundation, project number 471263729). The Research Council of Norway is acknowledged for the support to the Norwegian Micro- and Nano-Fabrication Facility, NorFab, project number 295864. DW gratefully acknowledges financial support from the Deutsche Forschungsgemeinschaft (DFG, German Research Foundation) \\u2013 Project-ID 431791331 \\u2013 SFB 1452 (CLINT). Umicore Denmark ApS is acknowledged for funding of this research. Data are accessible on the online repository Zenodo under the following DOI: 10.5281/zenodo.14938838 FH acknowledges a fellowship within the Walter-Benjamin-program of the Deutsche Forschungsgemeinschaft (DFG, German Research Foundation, project number 471263729). The Research Council of Norway is acknowledged for the support to the Norwegian Micro- and Nano-Fabrication Facility, NorFab, project number 295864. DW gratefully acknowledges financial support from the Deutsche Forschungsgemeinschaft (DFG, German Research Foundation) \\u2013 Project-ID 431791331 \\u2013 SFB 1452 (CLINT). Umicore Denmark ApS is acknowledged for funding of this research. item S0926-860X(25)00100-0 S0926860X25001000 1-s2.0-S0926860X25001000 10.1016/j.apcata.2025.120199 271346 2025-03-13T13:06:21.81897Z 2025-04-25 UNLIMITED DEALHYB23 1-s2.0-S0926860X25001000-main.pdf https://s3-eu-west-1.amazonaws.com/prod-ucs-content-store-eu-west/content/pii:S0926860X25001000/MAIN/application/pdf/35a8d11748fd622d4243078a8cb94117/main.pdf main.pdf pdf true 6134230 MAIN 11 1-s2.0-S0926860X25001000-main_1.png https://s3-eu-west-1.amazonaws.com/prod-ucs-content-store-eu-west/content/pii:S0926860X25001000/PREVIEW/image/png/5c52a5f691b16fec84711a909ef0f201/main_1.png main_1.png png 59392 849 656 IMAGE-WEB-PDF 1 1-s2.0-S0926860X25001000-gr3.jpg https://s3-eu-west-1.amazonaws.com/prod-ucs-content-store-eu-west/content/pii:S0926860X25001000/gr3/DOWNSAMPLED/image/jpeg/c05fd0a3f0b2d75b3e498891f51dabe7/gr3.jpg gr3 gr3.jpg jpg 34766 320 678 IMAGE-DOWNSAMPLED 1-s2.0-S0926860X25001000-gr4.jpg https://s3-eu-west-1.amazonaws.com/prod-ucs-content-store-eu-west/content/pii:S0926860X25001000/gr4/DOWNSAMPLED/image/jpeg/0509c0c3814d3fd063bb4d499c02cb93/gr4.jpg gr4 gr4.jpg jpg 104709 670 678 IMAGE-DOWNSAMPLED 1-s2.0-S0926860X25001000-gr1.jpg https://s3-eu-west-1.amazonaws.com/prod-ucs-content-store-eu-west/content/pii:S0926860X25001000/gr1/DOWNSAMPLED/image/jpeg/b6509898b252397d599297e05093fec3/gr1.jpg gr1 gr1.jpg jpg 32542 271 678 IMAGE-DOWNSAMPLED 1-s2.0-S0926860X25001000-gr2.jpg https://s3-eu-west-1.amazonaws.com/prod-ucs-content-store-eu-west/content/pii:S0926860X25001000/gr2/DOWNSAMPLED/image/jpeg/61b543bfa72fa66c8c419d44b10ac989/gr2.jpg gr2 gr2.jpg jpg 18567 310 376 IMAGE-DOWNSAMPLED 1-s2.0-S0926860X25001000-ga1.jpg https://s3-eu-west-1.amazonaws.com/prod-ucs-content-store-eu-west/content/pii:S0926860X25001000/ga1/DOWNSAMPLED/image/jpeg/0e3f0ccb555f44ca5f8dd4f0048dda8a/ga1.jpg ga1 true ga1.jpg jpg 20485 185 500 IMAGE-DOWNSAMPLED 1-s2.0-S0926860X25001000-gr7.jpg https://s3-eu-west-1.amazonaws.com/prod-ucs-content-store-eu-west/content/pii:S0926860X25001000/gr7/DOWNSAMPLED/image/jpeg/b5c6737d5f6b7db26ad22eea7bd7eb19/gr7.jpg gr7 gr7.jpg jpg 55392 505 376 IMAGE-DOWNSAMPLED 1-s2.0-S0926860X25001000-gr5.jpg https://s3-eu-west-1.amazonaws.com/prod-ucs-content-store-eu-west/content/pii:S0926860X25001000/gr5/DOWNSAMPLED/image/jpeg/16b8195076c5750375238cc4ab3c8a2e/gr5.jpg gr5 gr5.jpg jpg 62914 338 678 IMAGE-DOWNSAMPLED 1-s2.0-S0926860X25001000-gr6.jpg https://s3-eu-west-1.amazonaws.com/prod-ucs-content-store-eu-west/content/pii:S0926860X25001000/gr6/DOWNSAMPLED/image/jpeg/80dc9d56383120549a7900c5a275e082/gr6.jpg gr6 gr6.jpg jpg 67067 336 678 IMAGE-DOWNSAMPLED 1-s2.0-S0926860X25001000-sc1.jpg https://s3-eu-west-1.amazonaws.com/prod-ucs-content-store-eu-west/content/pii:S0926860X25001000/sc1/DOWNSAMPLED/image/jpeg/25281b131115c86698392bc6703817d7/sc1.jpg sc1 sc1.jpg jpg 13105 82 715 IMAGE-DOWNSAMPLED 1-s2.0-S0926860X25001000-gr3.sml https://s3-eu-west-1.amazonaws.com/prod-ucs-content-store-eu-west/content/pii:S0926860X25001000/gr3/THUMBNAIL/image/gif/02d8adbf26be4eb43ec1e2f237de63bf/gr3.sml gr3 gr3.sml sml 5188 103 219 IMAGE-THUMBNAIL 1-s2.0-S0926860X25001000-gr4.sml https://s3-eu-west-1.amazonaws.com/prod-ucs-content-store-eu-west/content/pii:S0926860X25001000/gr4/THUMBNAIL/image/gif/f3bef27bda2f813f0e2fd1f57ed21282/gr4.sml gr4 gr4.sml sml 13956 164 166 IMAGE-THUMBNAIL 1-s2.0-S0926860X25001000-gr1.sml https://s3-eu-west-1.amazonaws.com/prod-ucs-content-store-eu-west/content/pii:S0926860X25001000/gr1/THUMBNAIL/image/gif/3169e74816e3aa1cd1465288f5b1ef76/gr1.sml gr1 gr1.sml sml 4750 88 219 IMAGE-THUMBNAIL 1-s2.0-S0926860X25001000-gr2.sml https://s3-eu-west-1.amazonaws.com/prod-ucs-content-store-eu-west/content/pii:S0926860X25001000/gr2/THUMBNAIL/image/gif/9ac5a51d878c6dde36a8967459ced86e/gr2.sml gr2 gr2.sml sml 5844 163 198 IMAGE-THUMBNAIL 1-s2.0-S0926860X25001000-ga1.sml https://s3-eu-west-1.amazonaws.com/prod-ucs-content-store-eu-west/content/pii:S0926860X25001000/ga1/THUMBNAIL/image/gif/57443cd67d47b1dbe044315b23e2c673/ga1.sml ga1 true ga1.sml sml 6322 81 219 IMAGE-THUMBNAIL 1-s2.0-S0926860X25001000-gr7.sml https://s3-eu-west-1.amazonaws.com/prod-ucs-content-store-eu-west/content/pii:S0926860X25001000/gr7/THUMBNAIL/image/gif/d0eb6669c1cffa0cb561f48cb6daf974/gr7.sml gr7 gr7.sml sml 7683 164 122 IMAGE-THUMBNAIL 1-s2.0-S0926860X25001000-gr5.sml https://s3-eu-west-1.amazonaws.com/prod-ucs-content-store-eu-west/content/pii:S0926860X25001000/gr5/THUMBNAIL/image/gif/f5bb2577367b7e591095723f4eef51b2/gr5.sml gr5 gr5.sml sml 8902 109 219 IMAGE-THUMBNAIL 1-s2.0-S0926860X25001000-gr6.sml https://s3-eu-west-1.amazonaws.com/prod-ucs-content-store-eu-west/content/pii:S0926860X25001000/gr6/THUMBNAIL/image/gif/2aceefca2c00cc20c73bf76c78883dd3/gr6.sml gr6 gr6.sml sml 9398 108 219 IMAGE-THUMBNAIL 1-s2.0-S0926860X25001000-sc1.sml https://s3-eu-west-1.amazonaws.com/prod-ucs-content-store-eu-west/content/pii:S0926860X25001000/sc1/THUMBNAIL/image/gif/55cb8565ee57f9a110a318946c5ffc2e/sc1.sml sc1 sc1.sml sml 1696 25 219 IMAGE-THUMBNAIL 1-s2.0-S0926860X25001000-gr3_lrg.jpg https://s3-eu-west-1.amazonaws.com/prod-ucs-content-store-eu-west/content/pii:S0926860X25001000/HIGHRES/image/jpeg/43abb17765182cbea46949f0a0986b8f/gr3_lrg.jpg gr3 gr3_lrg.jpg jpg 194278 1413 2994 IMAGE-HIGH-RES 1-s2.0-S0926860X25001000-gr4_lrg.jpg https://s3-eu-west-1.amazonaws.com/prod-ucs-content-store-eu-west/content/pii:S0926860X25001000/HIGHRES/image/jpeg/507b15f734fbbb3a2e140512f60c0bca/gr4_lrg.jpg gr4 gr4_lrg.jpg jpg 621987 2960 2994 IMAGE-HIGH-RES 1-s2.0-S0926860X25001000-gr1_lrg.jpg https://s3-eu-west-1.amazonaws.com/prod-ucs-content-store-eu-west/content/pii:S0926860X25001000/HIGHRES/image/jpeg/978de0061666fba3e54bc4f1cd90e0fd/gr1_lrg.jpg gr1 gr1_lrg.jpg jpg 177677 1198 2994 IMAGE-HIGH-RES 1-s2.0-S0926860X25001000-gr2_lrg.jpg https://s3-eu-west-1.amazonaws.com/prod-ucs-content-store-eu-west/content/pii:S0926860X25001000/HIGHRES/image/jpeg/b5b90796502560355ab0928c69643634/gr2_lrg.jpg gr2 gr2_lrg.jpg jpg 96207 1373 1663 IMAGE-HIGH-RES 1-s2.0-S0926860X25001000-ga1_lrg.jpg https://s3-eu-west-1.amazonaws.com/prod-ucs-content-store-eu-west/content/pii:S0926860X25001000/HIGHRES/image/jpeg/25de637940b18516409818b891ffc395/ga1_lrg.jpg ga1 true ga1_lrg.jpg jpg 142543 821 2213 IMAGE-HIGH-RES 1-s2.0-S0926860X25001000-gr7_lrg.jpg https://s3-eu-west-1.amazonaws.com/prod-ucs-content-store-eu-west/content/pii:S0926860X25001000/HIGHRES/image/jpeg/cbc139321ddc0b259cd1a026966289d2/gr7_lrg.jpg gr7 gr7_lrg.jpg jpg 326508 2235 1663 IMAGE-HIGH-RES 1-s2.0-S0926860X25001000-gr5_lrg.jpg https://s3-eu-west-1.amazonaws.com/prod-ucs-content-store-eu-west/content/pii:S0926860X25001000/HIGHRES/image/jpeg/bdf527bb1ef146529abbd58c53a6d1ac/gr5_lrg.jpg gr5 gr5_lrg.jpg jpg 347649 1491 2994 IMAGE-HIGH-RES 1-s2.0-S0926860X25001000-gr6_lrg.jpg https://s3-eu-west-1.amazonaws.com/prod-ucs-content-store-eu-west/content/pii:S0926860X25001000/HIGHRES/image/jpeg/43989581f752e62874bb6e2ad489208f/gr6_lrg.jpg gr6 gr6_lrg.jpg jpg 373157 1483 2994 IMAGE-HIGH-RES 1-s2.0-S0926860X25001000-sc1_lrg.jpg https://s3-eu-west-1.amazonaws.com/prod-ucs-content-store-eu-west/content/pii:S0926860X25001000/HIGHRES/image/jpeg/40ecdbd86d09d7fd7b9e7bc142cfbfe1/sc1_lrg.jpg sc1 sc1_lrg.jpg jpg 75297 364 3161 IMAGE-HIGH-RES 1-s2.0-S0926860X25001000-mmc1.docx https://s3-eu-west-1.amazonaws.com/prod-ucs-content-store-eu-west/content/pii:S0926860X25001000/mmc1/MAIN/application/vnd.openxmlformats-officedocument.wordprocessingml.document/f128e71e008900304b841c0a07df03db/mmc1.docx mmc1 mmc1.docx docx 2614231 APPLICATION 1-s2.0-S0926860X25001000-si0001.svg https://s3-eu-west-1.amazonaws.com/prod-ucs-content-store-eu-west/content/pii:S0926860X25001000/image/svg+xml/3c99179f5de5d911e4f086040fc67218/si0001.svg si0001 si0001.svg svg 2808 ALTIMG 1-s2.0-S0926860X25001000-si0002.svg https://s3-eu-west-1.amazonaws.com/prod-ucs-content-store-eu-west/content/pii:S0926860X25001000/image/svg+xml/b49bacd439bb4d0d4b177f46551995e0/si0002.svg si0002 si0002.svg svg 3537 ALTIMG APCATA 120199 120199 S0926-860X(25)00100-0 10.1016/j.apcata.2025.120199 The Authors Fig. 1 Integral Pt-based H2 yields after 6 h of semi-batch dehydrogenation of perhydro benzyltoluene. Reaction conditions: 250 °C, 1 atm., molar H12-BT:Pt ratio = 2000. Catalysts with 3 wt% Pt. a: catalysts P-modified at 300 °C (catalyst series 2). Ptred-P300/Al2O3 = catalyst 2-b* . b: catalysts P-modified at 600 °C (catalyst series 3). Pt-H3PO3/Al2O3 red. 600 °C = catalyst impregnated with H3PO3 and reduced at 600 °C. Unmodified Pt catalysts 1-a (red. 440 °C) and 1-b (red 600 °C). Error determined from repeated dehydrogenation experiments with different catalyst batches. Fig. 1 Fig. 2 Methyl fluorene (MF) content in dependency of degree of dehydrogenation (DoDh) for unmodified Pt catalysts (catalysts 1-a and 1-b, reduced at 440 or 600 °C, respectively) and P-modified catalysts. Pt-P600/Al2O3: P-modification at 600 °C (catalyst 3-b). Pt-H3PO3/Al2O3: wet impregnation with H3PO3 with subsequent reduction at 600 °C. Reaction conditions: 250 °C, 1 atm, 15 g H12-BT, molar H12-BT:Pt ratio = 2000. Catalysts with 3 wt% Pt. Liquid samples analyzed via GC-FID. Error determined from repeated dehydrogenation experiments with different catalyst batches. Fig. 2 Fig. 3 Dehydrogenation results from P-modified catalysts (300 °C, N2) including post-treatment (catalyst series 4). Reaction conditions: 250 °C, 1 atm., molar H12-BT:Pt ratio = 2000. Catalysts with 3 wt% Pt. a: Integral Pt-based H2 yields after 6 h of semi-batch dehydrogenation of perhydro benzyltoluene. b: Methyl fluorene (MF) content in dependency of degree of dehydrogenation (DoDh). Liquid samples analyzed via GC-FID. Error determined from repeated dehydrogenation experiments with different catalyst batches. Fig. 3 Fig. 4 a: STEM-EDX spectrum images of Pt catalyst P-modified at 600 °C (catalyst 3-b). b: Particle size distributions from HAADF-STEM-images of unmodified Pt catalyst reduced at 440 °C (catalyst 1-a) and 600 °C (catalyst 1-b). b: Particle size distributions from HAADF-STEM-images of catalysts from P-modification at 300 °C (catalyst 2-b) and 600 °C (catalyst 3-b). dVA = volume-area-mean particle size. Analysis of 150–200 particles per sample. Fig. 4 Fig. 5 XPS spectra of unmodified Pt catalyst (1-a) and after P-modification at 300 °C (2-b*, 2-b) and 600 °C (3-b). a: Pt4d line. b: P2p line. Vertical dashed and dotted lines are a guide for the eyes, indicating the position and shift of peak maxima. Fig. 5 Fig. 6 XPS spectra of unmodified Pt catalyst (1-a) and after P-modification at 300 °C (2-b) with post-treatment (4-b, 4-c) and P-modification at 600 °C (3-b). a: Pt4d line. b: P2p line. Vertical dashed and dotted lines are a guide for the eyes, indicating the position and shift of peak maxima. Fig. 6 Fig. 7 Solid state 31P CP MAS NMR spectra of P-modified Al2O3 support and Pt catalysts. a: Al2O3 support after different modification methods, temperatures and atmospheres. b: Pt catalysts after different modification methods, temperatures and atmospheres. H3PO3-impregnation and treatment in N2 (orange lines). H3PO3-impregnation and treatment in H2 (blue lines). P-modification by decomposition of NaH2PO2 (PH3) in N2 flow (green lines). Dashed line at 3 ppm (peak maximum of dried H3PO3/Al2O3). Fig. 7 Scheme 1 Reaction scheme of dehydrogenation of perhydro benzyltoluene (H12-BT) via intermediate formation of H6-BT. Further deep dehydrogenation to undesired side product methyl fluorene (MF) from benzyltoluene (H0-BT). Scheme 1 Table 1 Synthesis conditions and composition of investigated catalysts. Catalysts were prepared at given temperature (T) in given gas flow (starting material: calcined Ptcalc/Al2O3, 500 mln min−1 N2 or 10 % H2/N2) for 2 h. 2-b* with reduced Pt/Al2O3 (440 °C, H2/N2, 2 h) as starting material. Table 1 No. Description T / °C Gas Initial molar P:Pt ratio Molar P:Pt ratio (ICP-OES) Pt / wt% (ICP-OES) P / wt% (ICP-OES) 1-a Pt/Al2O3 red. 400 °C 440 H2/N2 - - 3.0 - 1-b Pt/Al2O3 red. 600 °C 600 H2/N2 - - 3.1 - 2-a Pt-P300/Al2O3 300 N2 1.2 0.5 3.1 0.2 2-b Pt-P300/Al2O3 300 N2 2.4 0.9 3.1 0.5 2-b* Ptred-P300/Al2O3 300 N2 2.4 1.1 3.2 0.5 2-c Pt-P300/Al2O3 300 N2 3.4 1.3 3.0 0.6 2-d Pt-P300/Al2O3 300 N2 4.9 1.6 3.0 0.8 3-a Pt-P600/Al2O3 600 N2 1.2 0.6 3.2 0.3 3-b Pt-P600/Al2O3 600 N2 2.4 0.8 3.0 0.4 600 N2 2.4 0.8 3.4 0.5 3-c Pt-P600/Al2O3 600 N2 2.9 1.3 3.0 0.6 3-d Pt-P600/Al2O3 600 N2 3.2 1.5 3.2 0.8 3-e Pt-P600/Al2O3 600 N2 3.4 2.3 3.1 1.1 3-f Pt-P600/Al2O3 600 N2 4.9 2.6 3.1 1.3 3-g Pt-P600/Al2O3 600 N2 9.8 3.8 3.1 1.9 3-h Pt-P600/Al2O3 600 N2 19.5 4.7 3.1 2.3 Table 2 Overview of different post-treatment methods after P-modification at 300 °C in N2 (500 mln min−1) with initial molar P:Pt ratio of 2.4, no removal of NaH2PO2 from furnace before post-treatment. Gas flowrate in post-treatment: 500 mln min−1. Duration of post-treatment: 2 h. Table 2 No. Description Post-treatment Molar P:Pt ratio (ICP-OES) Pt wt% (ICP-OES) P wt% (ICP-OES) 4-a Pt-P 300-red400 10 % H2/N2, 400 °C 1.6 3.3 0.8 4-b Pt-P 300-red600 10 % H2/N2, 600 °C 1.8 3.1 0.9 4-c Pt-P 300–600 N2, 600 °C 1.9 3.4 1.0 Table 3 Amount of adsorbed CO per platinum and particle sizes derived from CO pulse chemisorption measurements of unmodified and phosphorus-modified 3 wt% Pt catalysts. The dispersion and particle size of Pt was calculated from assuming a stoichiometric factor of 1. Table 3 No. Description Molar P:Pt ratio Adsorbed CO / mmol molPt −1 Calculated particle size (CO) / nm Particle size (STEM) / nm 1-a Pt red. 440 °C - 572 2.0 1.1 1-b Pt red. 600 °C - 126 8.8 5.8 2-b Pt-P300/Al2O3 0.9 312 3.6 0.9 3-b Pt-P600/Al2O3 0.8 459 ± 68 2.5 ± 0.5 0.9 3-d Pt-P600/Al2O3 1.5 498 2.3 - 3-e Pt-P600/Al2O3 2.3 492 2.3 - 3-f Pt-P600/Al2O3 2.6 543 2.1 - 3-g Pt-P600/Al2O3 3.8 193 5.9 - 3-h Pt-P600/Al2O3 4.6 156 7.2 - Pt-H3PO3/Al2O3 red. 600 °C 1.8 429 2.7 0.914 Solvent-free phosphorus modification of Pt/Al2O3 catalysts to improve dispersion and dehydrogenation activity Abelina Ellert Writing – original draft Visualization Methodology Investigation Conceptualization a Fei Ding Investigation b Andreas Hutzler Writing – review & editing Project administration Investigation c Felix Herold Writing – review & editing Investigation d Luca Piccirilli Investigation e Ronning Magnus Rønning Writing – review & editing Funding acquisition d Ton V.W. Janssens Writing – review & editing Supervision Project administration e Dorothea Wisser Writing – review & editing Supervision Funding acquisition b Schuhle Patrick Schühle Writing – review & editing Supervision Project administration Methodology Conceptualization a ⁎ a Institute of Chemical Reaction Engineering, Friedrich-Alexander-Universität Erlangen-Nürnberg, Egerlandstr. 3, Erlangen 91058, Germany Institute of Chemical Reaction Engineering, Friedrich-Alexander-Universität Erlangen-Nürnberg Egerlandstr. 3 Erlangen 91058 Germany Institute of Chemical Reaction Engineering, Friedrich-Alexander-Universität Erlangen-Nürnberg, Egerlandstr. 3, 91058 Erlangen, Germany b Erlangen Center for Interface Research and Catalysis (ECRC), Friedrich-Alexander-Universität Erlangen-Nürnberg, Egerlandstr. 3, Erlangen 91058, Germany Erlangen Center for Interface Research and Catalysis (ECRC), Friedrich-Alexander-Universität Erlangen-Nürnberg Egerlandstr. 3 Erlangen 91058 Germany Erlangen Center for Interface Research and Catalysis (ECRC), Friedrich-Alexander-Universität Erlangen-Nürnberg, Egerlandstr. 3, 91058 Erlangen, Germany c Helmholtz Institute Erlangen-Nürnberg for Renewable Energy (IET-2), Cauerstr. 1, Erlangen 91058, Germany Helmholtz Institute Erlangen-Nürnberg for Renewable Energy (IET-2) Cauerstr. 1 Erlangen 91058 Germany Helmholtz Institute Erlangen-Nürnberg for Renewable Energy (IET-2), Cauerstr. 1, 91058 Erlangen, Germany d Department of Chemical Engineering, Norwegian University of Science and Technology (NTNU), Trondheim 7491, Norway Department of Chemical Engineering, Norwegian University of Science and Technology (NTNU) Trondheim 7491 Norway Department of Chemical Engineering, Norwegian University of Science and Technology (NTNU), 7491 Trondheim, Norway e Umicore Denmark Aps, Kogle Alle 1, Hørsholm 2970, Denmark Umicore Denmark Aps Kogle Alle 1 Hørsholm 2970 Denmark Umicore Denmark Aps, Kogle Alle 1, 2970Hørsholm, Denmark ⁎ Correspondence to: Egerlandstrasse 3, Erlangen 91058, Germany. Egerlandstrasse 3 Erlangen 91058 Germany This study introduces a solvent-free gas-phase method for modifying Al₂O₃-supported platinum (3 wt%) catalysts with phosphorus (P) to enhance Pt dispersion and dehydrogenation activity. The process involves decomposing NaH₂PO₂ at 600 °C, releasing PH₃, interacting with Pt on the catalyst surface. P-modified catalysts showed up to a 24 % increase in activity for perhydro-benzyltoluene dehydrogenation within a P:Pt ratio of 0.6–2.6. Additionally, they exhibited high resistance to sintering, maintaining Pt particle sizes of ∼0.9 nm even at 600 °C. Characterization using CO chemisorption, STEM NMR, and XPS revealed that PH₃ deposits phosphorus on the catalyst, which then oxidizes via support lattice oxygen. At 600 °C, this oxidized phosphorus migrates to the support/metal interface, stabilizing Pt nanoparticles and preventing sintering. However, when the P:Pt ratio exceeds 2.6, excess phosphorus remains on the surface, deactivating active sites. This study highlights the role of POₓ species in stabilizing Pt nanoparticles and optimizing catalyst performance. Graphical Abstract Abbreviations LOHC liquid organic hydrogen carrier H12-BT perhydro benzyltoluene DoDh degree of dehydrogenation MF methylfluorene Keywords Heterogeneous catalysis Doping Phosphorus Dehydrogenation Benzyltoluene Data availability Data are accessible on the online repository Zenodo under the following DOI: 10.5281/zenodo.14938838. It is mentioned in the manuscript. 1 Introduction In the future H2 economy, efficient catalysts for hydrogenation and dehydrogenation reactions will play a key role within the context of chemical hydrogen storage. Herein, platinum (Pt) nanoparticles that are supported on porous materials such as Al2O3, are one of the most used and powerful heterogeneous (de-)hydrogenation catalysts [1–4]. In those catalysts, achieving a high dispersion of small metal nanoparticles that is also stable under reaction conditions is especially challenging for high metal loadings (> 1 wt%) [5,6], but at the same time crucial for a high platinum surface area und therefore high catalytic activity. Metal as well as non-metal promotors are frequently added to further enhance the catalyst performance with regard to selectivity, stability and activity [7–11]. Doping of supported Pt catalysts with sulfur (S) or phosphorus (P) has been shown to enhance catalyst activity, e.g., in the dehydrogenation of perhydro dibenzyltoluene (H18-DBT), a relevant reaction in the context of hydrogen storage in liquid organic hydrogen carriers (LOHC). In these studies, S-modification of Pt/Al2O3 leads to a selective blockage of low coordinated Pt sites. 12 The simultaneous alteration of the electronic environment of Pt by S enables a facilitated desorption of the dehydrogenated product, which in turn improves both activity and selectivity of the catalyst [12,13]. Moreover, P-modification of Pt/Al2O3 catalysts by wet impregnation with H3PO3 investigated in a previous study results in enhanced H2 yields (increase by 18 % compared to the P-free counterpart) in the dehydrogenation of perhydro benzyltoluene (H12-BT). The high dehydrogenation activity of Pt-H3PO3/Al2O3 is also indicated by a higher content of the undesired side product methyl fluorene (MF) in the liquid phase, which is formed upon further deep dehydrogenation of the desired product benzyltoluene H0-BT ( Scheme 1). These Pt-H3PO3/Al2O3 catalysts further exhibit reduced Pt particle sizes below 1 nm with dispersion stabilized against sintering up to reduction temperatures of 900 °C. Thereby, Pt is conserved in its reduced Pt0 state, while oxidized P-species are present on the surface, even after H2 treatment and no formation of metal phosphide phases is observed [14]. Promoters such as S or P can be deposited on the catalyst surface e.g. by impregnation with a respective precursor. Successful P-doping of a Pt catalyst via impregnation with aqueous H3PO3 was shown in a previous study [14], however, further insights are necessary in order to elucidate the mechanism of phosphorus binding, and to understand the formed phosphorus species as well as its effect on the active metal. In the present study we aimed for an easy to implement gas phase P-modification approach with the aim of obtaining highly temperature stable and active dehydrogenation catalysts. Herein, the treatment of a Pt catalyst with a gaseous P precursor would allow for minimal chemical and structural changes by the omission of a solvent and stirrer. In the synthesis of transition metal phosphide catalysts, sodium hypophosphite (NaH2PO2) is a commonly used phosphorus precursor that does not require the use of a solvent [15–18]. Starting at 300 °C, NaH2PO2 decomposes to sodium phosphates and phosphites coupled with the release of gaseous PH3 [19]. This approach benefits from using a safe solid precursor and avoids the direct use of highly toxic PH3. When both the precursor and the respective catalytic material are placed in a gas-tight furnace, P-modification can then be initiated by increasing the temperature. In this study, we demonstrate that gas phase P-modification of Pt/Al2O3 is a suitable solvent-free approach to easily achieve P-modified Pt catalysts with increased dispersion and activity. Phosphorus content as well as modification temperature are varied to identify optimum synthesis conditions for the preparation of highly active dehydrogenation catalysts. Catalyst properties such as particle size distribution and electronic properties are evaluated. Solid state 31P NMR spectroscopy further elucidates the nature of phosphorus species in the catalysts and identifies distinctive features that can be found in highly active Pt-P/Al2O3 catalysts from different synthesis routes. 2 Experimental 2.1 Materials γ-Al2O3 support material, with a surface area of 145 m2 g−1 (average pore size 14.4 nm, total pore volume 0.512 cm3 g−1), was calcined at 500 °C (10 K min−1) for 4 h in air flow before use. H2[PtCl6]∙6 H2O (38–40 % Pt, 99.9 %) was purchased from abcr GmbH and NaH2PO2 (≥ 99 %) from Merck KGaA. 2.2 Catalyst preparation For the preparation of Pt/Al2O3, Al2O3 was impregnated overnight (16 h) at room temperature with an aqueous solution of H2[PtCl6]∙6 H2O. After solvent evaporation at 80 °C and 150 mbar, the material was calcined for 2 h at 400 °C (10 °C min−1) in air and then reduced for 2 h at 440 or 600 °C in 10 % H2/N2 (500 mln min−1, heating in N2 at 10 K min−1) in a tubular furnace (Carbolite Gero GmbH & Co. KG). To obtain a P-modified catalyst Pt-P/Al2O3, the calcined Pt/Al2O3 was placed in a crucible in a tubular furnace (tube diameter 40 mm) downstream of a crucible containing NaH2PO2 (Fig. S1). The phosphorus modification was conducted in N2 (500 mln min−1, heating in N2 at 10 K min−1) at 300 or 600 °C for 2 h, with different initial molar P:Pt ratios. For example, an initial molar P:Pt ratio of approximately 2.4 corresponds to 250 mg NaH2PO2∙H2O and 1 g Pt/Al2O3 (3 wt% Pt). 2.3 ICP-OES Inductively coupled plasma optical emission spectroscopy (ICP-OES) was applied to determine phosphorus and platinum contents of the catalysts. 100 mg of each sample were digested using microwave heating (10 mL HNO3:HCl, v:v = 4:6, 200 °C) and diluted to 100 mL using deionized water. Emission spectra of the solutions were recorded on a Ciros CCD by SPECTRO Analytical Instruments GmbH. 2.4 N2 physisorption For the determination of textural properties (specific surface area and pore volume), N2 physisorption was conducted at −196 °C on a Quadrasorb SI by Quantachrome Instruments. To remove any residues from the surface before measurement the samples were degassed and dried for 12 h at 250 °C in vacuum (0.01 mbar). The BET method in a relative pressure range of 0.05–0.2 was applied to determine the specific surface area and the total pore volume was determined at p/p0 = 0.99. 2.5 Electron microscopy To determine particle size distributions, high-angle annular dark field scanning transmission electron microscopy (HAADF-STEM) combined with energy dispersive X-ray spectroscopy (EDXS) was conducted on a Talos F200i by Thermo Fisher Scientific. The projected areas of 150–200 particles were evaluated. The volume-averaged particle size d VA was calculated as d VA = ∑n i d i 3/∑n i d i 2, with n i the number of particles with diameter d i . 2.6 CO pulse chemisorption The CO adsorption behavior of the catalysts was investigated by CO pulse chemisorption experiments on an Autochem II 2920 by Micromeritics. The catalyst samples were pretreated in He (5 °C min−1, 50 mln min−1, 60 min at 250 °C for Pt-PH3/Al2O3) or in 10 % H2/Ar (5 °C min−1, 50 mln min−1, 60 min at 440 °C or 600 °C for Pt/Al2O3, 700 °C for Pt-H3PO3/Al2O3). Pulse chemisorption was conducted at 40 °C and with 10 % CO/He. The difference of dosed and not-adsorbed CO volume assuming ideal gas was used to calculate the adsorbed amount of CO. The dispersion and particle size of Pt was calculated assuming a stoichiometric factor of 1. 2.7 X-ray diffraction For the determination of the morphology of the catalysts, X-ray diffraction (XRD) patterns were measured on a Pananalytical X-Pert Pro-MD by Philips equipped with a Cu-Kα source (wavelength λ of 1.5406 Å). Recording was conducted in a range of 2θ from 10 ° to 90 ° with a scan speed of 0.02 ° s−1. 2.8 XPS To investigate electronic properties and oxidation states of platinum and phosphorus, X-ray photoelectron spectroscopy (XPS) was conducted on a Kratos Analytical Axis Ultra DLD spectrometer with monochromatic Al Kα irradiation (1486.6 eV) and operating the anode at 10 kV with an aperture of 700 x 300 μm. The pass energy for survey scans was 160 eV and 20 eV for high-resolution spectra. C1s contribution of adventitious carbon at 284.8 eV was used to calibrate the energy axis. 2.9 Solid state 31P NMR Solid state 31P NMR spectra were acquired on a 500 MHz (11.7 T) DD2 Agilent wide-bore NMR spectrometer. Samples were packed into 1.6 mm zirconia rotors. 31P cross-polarization (CP) spectra were recorded at a MAS rate of 15 kHz. After a π/2 pulse of 2.5 μs on 1H, the RF of 1H was ramped from 58 to 80 kHz while the RF on 31P was kept constant at 76 kHz during a contact time of 4 ms (Hartmann-Hahn match). 100 kHz spinal-64 decoupling was applied on 1H during acquisition. Recycle delays were set to 3 s, 5000–10000 scans were recorded. DSS was used as indirect reference. 2.10 Catalytic testing For the evaluation of catalytic activity, semi-batch dehydrogenation experiments were conducted in a glass set-up consisting of a three-necked 100 mL flask, a two-neck attachment with a metallic hollow cylinder for catalyst storage, and a reflux condenser (schematic illustration of the set-up in Fig. S2). The experiments were performed using 15 g perhydro benzyltoluene (H12-BT, degree of hydrogenation 97.37 % or 100 %, obtained from hydrogenation of benzyltoluene [20], benzyltoluene by Eastman Chemical Company) and a molar H12-BT:Pt ratio of 2000. This corresponds to approximately 251 mg catalyst at 3 wt% Pt loading. The set-up was flushed with Ar while heating to the reaction temperature (250 °C, 1 atm). At 250 °C, the Ar flow was stopped, and the catalyst was dropped into the hot liquid. Liquid samples taken over the course of the reaction (six hours) were analyzed via refractive index measurements (DR6100-T by Krüss Optronic GmbH, calibrated with GC) and GC-FID (Shimadzu 2010 Plus; column Rxi-17Sil MS 30 m, 0,25 mm ID, 0.25 µm by Restek). To evaluate the performance of the catalyst, the platinum-based hydrogen yield and productivity were calculated using the degree of dehydrogenation (DoDh). The DoDh is defined as the ratio between the amount of released hydrogen and the amount of hydrogen that is potentially released at complete dehydrogenation, which corresponds to six H2 molecules per molecule perhydro benzyltoluene. The H2 yield YH2 in gH2 gPt −1 and productivity P in gH2 gPt −1 min−1 were determined from the DoDh (obtained from GC-FID) via Eq. 1 and Eq. 2. (1) Y H 2 = ∆ DoDh ∙ n H 12 − BT ∙ 12 m Pt (2) P = ( DoD h i − DoD h i − 1 ) ∙ n H 12 − BT ∙ 12 m Pt ∙ ( t i − t i − 1 ) Herein, ∆DoDh corresponds to the difference in degree of dehydrogenation before and after semi-batch dehydrogenation, n H12-BT to the molar amount of perhydro benzyltoluene and m Pt to the amount of platinum in gram. The number 12 reflects the number of moles of hydrogen that would be released by complete dehydrogenation per mole of H12-BT. The index i (or i-1, respectively) signifies the DoDh in the sample taken at time i (t i ). Detailed information on the evaluation of GC-FID data for the evaluation of side product formation is given in the supporting information. 3 Results Pt/Al2O3 catalysts with 3 wt% Pt content were P-modified in a tubular furnace by the decomposition of NaH2PO2 at different modification temperatures (300–600 °C). A modification temperature of 300 °C was selected as a minimum temperature necessary for the decomposition of NaH2PO2 to form gaseous PH3. [19] 600 °C was selected to compare with Pt catalysts that were obtained from wet impregnation with H3PO3 and subsequently reduced at 600 °C in our previous study [14]. Furthermore, unmodified Pt catalysts after 440 °C (standard for these catalysts [21,22]) and 600 °C (high temperature) reduction were considered for comparison. For the gas phase P-modification method, the final P content in the catalyst was tuned by the relative amount of precursor (NaH2PO2) to unmodified calcined Pt/Al2O3 catalyst (referred to as initial molar P:Pt ratio). Table 1 lists the catalysts investigated in this study, the applied synthesis conditions and resulting Pt and P contents. Only 12–50 % of the phosphorus from the precursor are found in the final catalyst. Differences between P-modification at 300 and 600 °C become evident at high initial molar P:Pt ratios (> 3). Approximately 70 % higher amounts of phosphorus were deposited on the catalyst at the higher modification temperature (600 °C). Usually, P-modification was performed without previous catalyst reduction. However, the P-modification method was also applied to a pre-reduced Pt/Al2O3 catalyst (catalyst 2-b*), which resulted in a similar composition as for the calcined Pt/Al2O3. P-modification of the pure Al2O3 support material was attempted with 250 mg NaH2PO2∙H2O and 1 g Al2O3, but only very low amounts of phosphorus (< 0.02 wt%) were deposited at both 300 and 600 °C (Table S1). The catalytic performance of these materials was investigated in semi-batch dehydrogenation of perhydro benzyltoluene (H12-BT). In a first set of experiments, we compared the influence of P content on the performance of catalyst series 2 (Pt-P300/Al2O3, P-modification at 300 °C) and catalyst series 3 (Pt-P600/Al2O3, P-modification at 600 °C). Ptred-P300/Al2O3 refers to catalyst 2-b* , which corresponds to P-modification at 300 °C of catalyst 1-a (reduced Pt/Al2O3). The integral Pt-based H2 yields after 6 h of reaction are displayed in Fig. 1. With catalyst series 2 (P-modification at 300 °C, Fig. 1a), integral H2 yields after 6 h of reaction ranged from 52 to 61 gH2 gPt −1 for all catalysts with molar P:Pt ratios from 0.5 to 1.6. The catalysts synthesized with an additional reduction step (catalyst 2-b*, open diamond) showed similar catalytic activity with respect to P-modified catalysts without reduction. Compared to the P-free Pt/Al2O3 catalyst reduced at 440 °C (open circle, 68 gH2 gPt −1 min−1), lower H2 yields were achieved. This is also reflected in the lower Pt-based hydrogen productivities over the whole range of DoDh (see Fig. S4 a). On the other hand, catalysts from P-modification at 600 °C (Fig. 1b, series 3) showed final H2 yields improved by up to 24 % (84 gH2 gPt −1 min−1) compared to the unmodified catalyst 1-a (Pt/Al2O3 reduced at 440 °C) and by even 83 % when compared to the P-free catalyst 1-b, that was also reduced at 600 °C. This performance boost by P-modification is observed over a broad range of molar P:Pt ratio between 0.6 and 2.6, resulting in overall higher Pt-based H2 productivities (Fig. S4 b). However, for P:Pt ratios beyond 3.8, the final H2 yield and productivity drop. The significant activity boost observed in the range of P:Pt = 0.6–2.6 even exceeds the performance of a Pt-catalyst that was modified by wet impregnation with H3PO3 (P:Pt = 1.8, red triangle), as described in our previous study [14]. The selectivity in the dehydrogenation of perhydro benzyltoluene was assessed by monitoring the content of methyl fluorene (MF) in the liquid phase. MF is formed upon cyclization and further release of H2 (Scheme 1) of benzyltoluene (H0-BT), which is the first step to the formation of higher aromatics and coke. These processes lead to a loss of the LOHC and catalyst deactivation. Therefore, MF is a good indicator for the formation of undesired side products [20]. Fig. 2 compares the MF formation for the P-free Pt catalysts with a gas phase (600 °C, catalyst 3-b) and liquid phase (H3PO3, red. 600 °C) P-modified catalyst. MF levels increased with increasing degree of dehydrogenation (DoDh), as it is formed in a consecutive reaction step from H0-BT. Both P-modified catalysts showed slightly increased MF levels compared to the P-free Pt/Al2O3 catalysts, pointing to a very high dehydrogenation activity that also promotes the further dehydrogenation beyond the desired product H0-BT. The formation of MF over P-promoted catalysts produced by the gas-phase (PH3) and liquid-phase (H3PO3) procedures are similar, and furthermore, there were no significant differences in MF formation within catalyst series 3 for P:Pt ratios between 0.6 and 2.6. Only at the highest molar P:Pt ratios of 3.8 and 4.7 (P loadings of 1.9 and 2.3 wt%, respectively), lower MF concentrations were observed along with a strongly reduced dehydrogenation activity (Fig. S5 b). P-modification at 300 °C resulted in MF formation curves that are comparable to the unmodified Pt catalysts, independent of the P content (Fig. S5 a). Because P-modification at 300 °C did not increase dehydrogenation activity of the catalysts, while P-modification at 600 °C results in a clearly higher activity, heating the catalyst to 600 °C leads to changes in the catalyst that seem critical to obtain the promoting effect of P. These changes may also be affected by the reducing properties of the gas atmosphere. To understand the impact of the temperature and gas atmosphere better, different post-treatment methods involving different temperatures using N2 or 10 % H2/N2 were investigated for an initial molar P:Pt ratio of 2.4 ( Table 2). Generally, with the Pt/Al2O3 materials being in the furnace with the P-precursor for twice as long (4 h instead of 2 h) compared to catalyst series 2 and 3, approximately twice as high final P contents were achieved at similar initial molar P:Pt ratios. The dehydrogenation results of these catalysts are compared to a P-free Pt catalyst reduced at 440 °C (1-a) and a 600 °C P-modified catalyst (P:Pt = 0.8, 3-b) in Fig. 3. A post-reduction in H2 at 400 °C (4-a) did not improve catalyst activity, instead, showing similar or lower H2 yield and productivity as catalyst series 2 (P-modification at 300 °C, see Fig. S6). Improved H₂ yields were achieved with post-treatments at 600 °C, reaching similar values to those of catalyst 3-b, regardless of the gas composition (H₂/N₂ or N₂, catalysts 4-b and 4-c, respectively) used in the post-treatment step or the final phosphorus (P) content. Interestingly, the formation of MF was on a similar level to that of catalyst 3-b (Fig. 3b). This means that a treatment step at 600 °C is crucial to achieve an activity boost in dehydrogenation. Since the observed high dehydrogenation activities despite reduction at 600 °C hint to an improved sinter stability of the active phase, STEM images of selected catalysts were recorded to investigate particle size distribution on the catalyst surface. With an increase in reduction temperature of the unmodified Pt catalysts [14] from 440 (catalyst 1-a) to 600 °C (catalyst 1-b), an increase of the average particle size from 1.1 to 5.8 nm can be observed along with a broadening of particle size distribution ( Fig. 4b). This increase in particle size corresponds to the well-known sintering of supported Pt nanoparticles on alumina at elevated temperatures [23,24]. In contrast, the sintering behavior of the P-promoted catalysts is different. Catalyst 2-b (Fig. S7), that was P-modified at 300 °C, exhibits smaller mean particle sizes (0.9 nm) than the unmodified counterparts. After P-modification at 600 °C (catalyst 3-b) similarly small particle sizes with an even narrower particle size distribution are obtained (Fig. 4a, c). A concentration of P around Pt could not be identified with certainty on the EDX spectrum images due to the high dispersion and small size of the Pt nanoparticles as well as the low P content. To identify potential interactions between Pt and P, the samples were further investigated with CO pulse chemisorption and XPS. The electronic environments of both elements can be probed by these techniques, which might further elucidate reasons for different catalytic activities despite similar particle sizes for catalysts that were P-modified at 300 and 600 °C. All particle sizes evaluated from CO pulse chemisorption ( Table 3) seem to be larger than the particle sizes obtained by STEM, which hints to a limited accessibility of Pt centers for CO adsorption. For the P-free catalysts 1-a and 1-b, the CO adsorption capacity was reduced by 78 % upon an increase in reduction temperature from 440 to 600 °C. P-modification at 300 °C resulted in an adsorption capacity of 312 mmolCO molPt −1 (catalyst 2-b), which was increased to 459 mmolCO molPt −1 upon increase of modification temperature to 600 °C at a similar P:Pt ratio (catalyst 3-b). A Pt-H3PO3/Al2O3 catalyst obtained from wet impregnation with H3PO3 and reduced at 600 °C showed similar CO chemisorption results as catalyst 3-b from gas phase P-modification at 600 °C. All catalysts that were P-modified at 600 °C and showed high dehydrogenation activity (catalyst 3-b to 3-f) gave similar CO adsorption capacities of approximately 500 ± 30 mmolCO molPt −1 regardless of their P content. On the other hand, the two less active catalysts with the highest molar P:Pt ratios of 3.8 and 4.6 (3-g and 3-h) showed drastically reduced CO adsorption capacities of 193 and 156 mmolCO molPt −1. Accordingly, the H2 productivity per available amount of Pt is highest for catalysts P-modified at 600 °C in the optimum P:Pt range (Fig. S8). Investigations of the different catalysts with XPS did not show any major differences in Al2p and O1s lines (Fig. S9, Fig. S10). The unmodified Pt catalyst (1-a) exhibits a Pt4d line located at 314.8 eV ( Fig. 5a), which is indicative of Pt0 [25–27]. The Pt4d line is observed at the same binding energy for the Pt-catalyst that was P-modified at 600 °C (catalyst 3-b) and the Pt catalyst that was reduced prior to P-modification (catalyst 2-b*). However, slightly higher binding energies (315.2 eV) are observed after P-modification at 300 °C only (catalyst 2-b). This hints to the presence of additional oxidized Pt2+ species [28] which forms upon calcination at 400 °C of H2[PtCl6] [29,30] and was not fully reduced to Pt0 during the P-modification procedure at 300 °C. The P2p line after P-modification at 300 °C (catalysts 2-b and 2-b*) is located at 133.8 eV and shifts to 134.4 eV after P-modification at 600 °C (Fig. 5b). These values indicate the presence of oxidized phosphorus species like phosphates or phosphites (POx) [31–33]. However, some oxidized species such as P2O5 or phosphoric acid can be excluded, as their binding energies are expected above 135 eV [33–35]. Furthermore, platinum phosphide PtP2 is excluded as it should appear at binding energies below 130 eV [25,36,37]. After P-modification at 300 °C and subsequent post-treatment at 600 °C in H2/N2 or in N2 (catalysts 4-b and 4-c, respectively), these catalysts show the presence of Pt0 at a binding energy of 314.8 eV, just like catalyst 3-b that was directly P-modified at 600 °C ( Fig. 6a). Similarly, the P2p line is also located at the same binding energy as catalyst 3-b (134.4 eV) indicating an electron-poor POx species, which distinguishes these catalysts from catalyst 2-b that was P-modified at only 300 °C (Fig. 6b). There is no hint for the presence of a phosphide phase after post-treatment at 600 °C. To get further insights into the crystal structure of the catalysts, XRD measurements were performed (Fig. S11). The diffraction patterns of P-modified catalysts did not show any reflections indicative of phosphides or phosphates. The Pt reflection [38] at 81 ° 2θ is visible only for the unmodified Pt/Al2O3 reduced at 600 °C due to formation of sufficiently large crystallites upon sintering. Solid state 31P Cross Polarization (CP) NMR spectra under Magic Angle Spinning (MAS) were recorded to identify the P species present on the catalyst surface after different modification methods and temperatures. To establish the trends of P-modification and possible influences of the support, we first investigated the signals after P-modification of bare Al2O3 ( Fig. 7a, Table S2). After impregnation with H3PO3 for 16 h and solvent removal at 80 °C, a peak with a maximum at 3 ppm is observed, which we assigned to H3PO3 [39]. The resonance was relatively narrow as compared to spectra of samples with high temperature treatment. Narrow resonances in solid-state NMR spectra of amorphous samples usually indicate species with a stronger mobility. It is therefore likely that remaining (or re-adsorbed) water on the alumina surface induces a certain mobility of a probably non-covalently bound P species. A broader shoulder around −1 ppm is observed, too, which may indicate surface-bound species. Upon treatment in N2 or H2/N2 flow, the 31P resonances generally become broader and shift to lower chemical shifts with increasing temperature. Upon treatment at 600 °C in N2, the center of this very broad resonance shifts to −7 ppm, but several narrower resonances around −4, −7 and −10 ppm indicate the formation of defined P species. In the sample treated at 600 °C in H2/N2, additionally a narrower resonance at 3 ppm occurs, which again may stem from mobile H3PO3 on the surface (possibly induced by water re-adsorption). Since gas phase P-modification of Al2O3 with PH3 (by the decomposition of NaH2PO2) resulted in almost negligible adsorption of P onto the support, the signal to noise ratio of these spectra is extremely low. However, even in these spectra (P300/Al2O3 and P600/Al2O3) with weak signal, the narrow resonance of H3PO3 is visible after treatment at 300 °C and a broader, upfield resonance upon increase in temperature to 600 °C is visible. We then investigated P-modified Pt/Al2O3 materials by solid-state 31P CP MAS NMR spectroscopy (Fig. 7b, Table S2). The presence of Pt on Al2O3 resulted in the deposition of significantly higher amounts of P compared to the bare support, as shown earlier (Table 1). This indicates the preferred and strong interaction of the gaseous P precursor (PH3) with Pt. Likewise, the 31P CP MAS NMR spectra of these samples (green lines in Fig. 7b) show strong 31P resonances. As a general trend, in all samples, the presence of Pt on the alumina leads to a broader distribution of chemical shifts, and overall lower chemical shift values for otherwise comparable conditions. P species on alumina supports have been investigated in a previous study that combined solid-state NMR spectroscopy and Density Functional Theory calculations for similar systems of γ-Al2O3 impregnated with phosphate from aqueous solution. Based on this, broad resonances were attributed to a distribution of phosphate species which are either adsorbed on the surface or covalently bound to Al2O3 with up to three Al-O-P bonds [40]. Resonances at low chemical shifts down to −20 ppm were correlated with the formation of bi- or polyphosphates on the alumina surface. Note that in the present study, the oxidation state of P surface species is less well defined. Phosphates (oxidation state of P: V), but also less oxidized species may be present on the surface, as indicated by XPS (Fig. 5 and Fig. 6). The very low 31P chemical shifts in samples impregnated with H3PO3 indicate that mostly polyphosphates and covalently bound phosphates seem to be present. The presence of Pt and non-reducing gas flow (N2) induces the lowest chemical shifts, which we correlate to high P oxidation states and the formation of polymeric species. The formation of an AlPO4 phase is known to lead to a resonance at −32 ppm, which is not the case here [41]. In contrast, gas phase P-modification of Pt/Al2O3 with PH3 leads to resonances centered around −10 ppm, indicating the absence of polymeric species and probably, higher overall electron density of P. Additionally, some samples exhibit a weak, very narrow resonance at 0.8 ppm, which cannot be unambiguously assigned. A likely attribution would be a hydrated, mobile P species such as H3PO3 or H3PO4, which form upon re-equilibration of the samples with water from the atmosphere. Overall, the 31P MAS NMR hint to the presence of both surface-bound and mobile oxidized P species (POx), which interact with the Pt on the catalyst surface. 4 Discussion The presented characterization results allow us to follow the P-modification process of the Pt/Al2O3-catalyst. First, NaH2PO2 decomposes to PH3 in a furnace, already at temperatures of 300 °C. The formed PH3 interacts via the gas-phase with the catalyst material. ICP-OES results of our materials that have undergone this PH3 treatment (gas phase P-modification) show that P was hardly deposited on pure Al2O3. Only the presence of Pt promoted the significant deposition of phosphorus species on the catalyst surface, indicating that initial interaction of the catalyst with gaseous PH3 proceeds via the Pt surface. XPS investigations of the P2p line revealed the presence of oxidized P species such as phosphates or phosphites on all prepared catalysts, demonstrating that after interaction of PH3 with Pt, the P precursor gets oxidized (loses electron density). For catalysts with a high P-loading the formation of oxidic phosphate phases was also observed in XRD. As the treatment is performed under reductive atmosphere, we suggest oxygen from the Al2O3-support or possibly also PtO to be responsible for the oxidation of P-species, presumably at the interphase between Pt-nanoparticle and Al2O3-support. However, following stoichiometric relations, the amount of O-atoms that stem from PtO are not enough to fully oxidize the P-species available, why further oxygen sources, such as oxygen from the support material must contribute to POx formation. Consequently, after the first contact of PH3 with Pt, the P-species moves to the support, where it gets oxidized. Treatment of the catalyst at higher temperatures of 600 °C, either under N2 or H2/N2 enable this movement, while temperatures of 400 °C or below are not sufficient, as concluded from the post-treatment experiments in Table 2 and Fig. 3. Note, that XPS and XRD measurement do not hint to the formation of a phosphide phase, which is quite remarkable when considering that the oxidation state of –III in the applied P precursor (PH3) is similar to what one would expect for a phosphide. In our studies, we prepared the P-modification at two temperatures: 300 °C and 600 °C. The P2p lines of all catalysts that were P-modified at only 300 °C exhibited a lower binding energy (133.8 eV), compared to catalysts from P-modification at 600 °C, where the P2p line was located at higher binding energy (134.4 eV), i.e., lower electron density at phosphorus. Following this observation, the intermediate oxidation state of the P-species is higher in the 600 °C treated catalysts. The final amount of phosphorus deposited on the catalyst can be easily tuned instead by adjusting the initial P:Pt ratio (relative precursor amount) in the furnace. However, also the treatment temperature has an influence on the P deposition. If the P-treatment proceeds at 600 °C instead of 300 °C the ICP-OES investigations reveal a higher amount of P deposited on the catalysts. In accordance, CO pulse chemisorption measurements show, that also the active metal surface area, available for CO binding is higher, if the catalysts are treated at 600 °C. Most probably P-species block a higher share of Pt atoms after treatment at 300 °C only, while the 600 °C seem to increase their mobility to move from the Pt particle to the support interface. In that way, Pt surface centers are liberated and able to bind more CO. This facilitated movement of P-species and Pt-liberation also allows the adsorption of further PH3 during the modification process, explaining the higher final P-content in the 600 °C treated catalysts. However, upon an increase in P content beyond the optimum range (max. P:Pt 2.6), due to their high abundance around the Pt particles, the POx species cannot be transported away (even at 600 °C) and additionally cover active Pt sites, blocking the catalyst. Platinum is partially oxidized in the Pt/Al2O3 starting material, as the examination of the Pt4d line in XPS reveals. Platinum is reduced to Pt0 after treating the catalyst with PH3 at 600 °C, even without an additional reduction step in H2/N2. This indicates that the reducing power of PH3 is high enough at elevated temperatures of 600 °C for a full reduction of Pt2+ to Pt0. At 300 °C in contrast, only PH3 treatment at 300 °C was not sufficient to fully reduce the Pt2+, making an additional treatment in H2/N2 before or afterwards necessary to reach Pt0 on the surface. Our STEM investigations show that these reduced Pt forms nanoparticles with small intermediate sizes after P-modification at both temperature stages. Surprisingly no sintering is observed even after treatment at 600 °C. Our results even show that Pt particle sizes were slightly reduced below 1 nm after PH3 treatment (compared to the starting material). This finding demonstrates, that the POx species present at the interphase between Pt and Al2O3 introduce a sinter-stabilizing effect to the material. Results from solid state 31P CP MAS NMR provide a deeper insight into the state of the P species, after their transfer to the support surface. To specifically investigate the interaction between oxidized P-species and Al2O3, first without the presence of Pt, the support was impregnated with H3PO3. When the treatment temperature of these impregnated samples was increased from 300 to 600 °C, an upfield shift of the peaks was observed in 31P CP MAS NMR. This is tentatively attributed to the deposition and possibly covalent binding of more oxidized P species on the support and condensation of PO4 tetrahedra at higher temperatures [42,43]. For the PH3-modified Pt/Al2O3 catalysts, a similar trend of an upfield shift upon temperature increase was observed. At the same time, resonances at −20 ppm were absent in the PH3-treated sample, which indicates less interaction of POx-species to form polyphosphates and hints towards a better dispersion of P species in these samples. The high temperature treatment at 600 °C favors the oxidation and the covalent binding of P species to the support, which is reflected in the results from 31P CP MAS NMR as well as XPS (reduction of electron density at P). Overall, the 31P MAS NMR hint to the presence of both surface-bound and mobile oxidized P species (POx), which interact with the Pt on the catalyst surface. These POx species at the interphase between support and Pt nanoparticle enable the confinement of the latter and avoid the nanoparticle sintering even at high temperatures. The P-modified Pt-catalysts of this study were tested in the dehydrogenation of perhydro benzyltoluene. Compared to the P-free Pt/Al2O3 catalyst, a higher catalytic activity was observed after PH3-treatment at a temperature of 600 °C. One reason for the higher activity after PH3-treatment at 600 °C compared to the P-free material surely lies in the smaller intermediate particle size, determined by STEM. However, despite similarly small particle sizes after P-modification at 300 and 600 °C, no activity boost in dehydrogenation was observed for the 300 °C method, which indicates that only the presence of small nanoparticles after PH3 modification is not sufficient for high dehydrogenation activity. Also, the dehydrogenation boost was not observed for catalysts that were P-modified at 300 °C, regardless of a reduction step included before P-modification, ruling out that insufficient reduction of Pt would be a possible cause for the low dehydrogenation activity. In contrast, this loss in electron density (oxidation) of phosphorus upon 600 °C treatment is a common denominator for the highly active Pt-P/Al2O3 dehydrogenation catalysts, as seen in the XPS studies. This can be explained by the higher share of oxidized P-species in these catalysts, coming from a more pronounced interaction with the support material. Hence, more P is transported to the support interphase, instead of blocking Pt atoms for the dehydrogenation reaction. This approach to explain the activity boost by P-modification after 600 °C treatment is supported, when comparing our results from CO pulse chemisorption and STEM. Despite their smaller particle size that was observed in microscopy, the CO adsorption capacity was lower for all P-modified catalysts compared to an unmodified Pt catalyst (reduced at 440 °C). When the Pt particle size is calculated from these CO adsorption data, an opposite trend compared to STEM determined particle size is observed. To solve this contradiction we suggest that P species on the catalyst are in close interaction with platinum, influencing the accessibility of some Pt sites for CO. However, under reaction conditions the P-blocking of the active centers in the 600°C-treated catalyst does not appear to be so pronounced, as a higher activity compared to the P-free catalyst is observed for P:Pt < 2.6. Only if even more P is deposited on the catalyst (P:Pt ratios of 3.8 and 4.6) a simultaneous drop in CO capacity and dehydration activity can be detected. Also catalysts that were P-modified at 300 °C show low activity in dehydrogenation and low CO capacity in chemisorption experiments. Therefore, we assume an increased blockage of Pt sites by P species, when the catalyst was not heated to > 300 °C during or after P-modification of if the capacity of the neighboring Al2O3 sites to bind more POx species is fully utilized and does not allow for further removal of P-species for the Pt surface. 5 Conclusion In this study, we presented a solvent-free phosphorus-modification method for Al2O3 supported Pt catalysts to obtain highly active dehydrogenation catalysts. 3 wt% Pt/Al2O3 catalysts were modified with phosphorus by decomposition of the precursor NaH2PO2 to PH3 in a furnace. The high catalytic activity in dehydrogenation of perhydro benzyltoluene was boosted by up to 24 % with respect to a non-modified Pt/Al2O3 catalyst and was further reflected in the increased formation of methyl fluorene. The highest activities were measured over a range of P:Pt from 0.6 to 2.6. We could further prove narrow particle size distributions and small average particle sizes (0.9 nm) for the gas phase P-modified Pt catalysts despite synthesis temperatures as high as 600 °C. By applying XPS, 31 P CP MAS NMR, STEM, CO pulse chemisorption and XRD, the stepwise mechanism of P-modification and the relationship between the treatment conditions and catalytic activity could be revealed. The mechanism of P-modification of the Pt/Al2O3 catalyst involves the interaction of PH3 (formed from NaH2PO2) with the Pt surface, promoting phosphorus deposition. Phosphorus species are oxidized in the next step, likely using oxygen from the Al2O3 support or oxidized Pt species (e.g. PtO). At higher treatment temperatures (600 °C), the P species migrate from Pt surface to the support/metal interphase, liberating the Pt surface again for further PH3-adsorption. This migration process also prevents Pt particle sintering, with the POx species acting as stabilizers, indicated by the close interaction between POx-species and Pt that was observed in XPS and solid state 31P NMR studies. However, when the P-amount in the neighborly Al2O3 of the Pt-particle exceeds the capacity of the support (P:Pt > 2.6) further removal of P-species from the Pt surface is hampered, what results in a poisoning of the active centers. A too low treatment temperature of 300 °C also restricts the mobility of the P-species, leading to a blocking of the active centers in similar way. CRediT authorship contribution statement Wisser Dorothea: Writing – review & editing, Supervision, Funding acquisition. Schühle Patrick: Writing – review & editing, Supervision, Project administration, Methodology, Conceptualization. Janssens Ton V. W.: Writing – review & editing, Supervision, Project administration. Piccirilli Luca: Investigation. Rønning Magnus: Writing – review & editing, Funding acquisition. Hutzler Andreas: Writing – review & editing, Project administration, Investigation. Herold Felix: Writing – review & editing, Investigation. Ellert Abelina: Writing – original draft, Visualization, Methodology, Investigation, Conceptualization. Ding Fei: Investigation. Declaration of Competing Interest The authors declare the following financial interests/personal relationships which may be considered as potential competing interests: Abelina Ellert reports financial support was provided by Friedrich-Alexander University Erlangen-Nuremberg. Fei Ding reports financial support was provided by Friedrich-Alexander University Erlangen-Nuremberg. If there are other authors, they declare that they have no known competing financial interests or personal relationships that could have appeared to influence the work reported in this paper. Acknowledgment FH acknowledges a fellowship within the Walter-Benjamin-program of the Deutsche Forschungsgemeinschaft (DFG, German Research Foundation, project number 471263729). The Research Council of Norway is acknowledged for the support to the Norwegian Micro- and Nano-Fabrication Facility, NorFab, project number 295864. DW gratefully acknowledges financial support from the Deutsche Forschungsgemeinschaft (DFG, German Research Foundation) – Project-ID 431791331 – SFB 1452 (CLINT). Umicore Denmark ApS is acknowledged for funding of this research. Supporting information Data are accessible on the online repository Zenodo under the following DOI: 10.5281/zenodo.14938838 Appendix A Supporting information Supplementary data associated with this article can be found in the online version at doi:10.1016/j.apcata.2025.120199. Appendix A Supplementary material Supplementary material References [1] B.D. Chandler L.I. Rubinstein L.H. Pignolet Alkane dehydrogenation with silica supported platinum and platinum–gold catalysts derived from phosphine ligated precursors J. Mol. Catal. A Chem. 133 3 1998 267 282 B.D. Chandler, L.I. Rubinstein, L.H. Pignolet. Alkane dehydrogenation with silica supported platinum and platinum–gold catalysts derived from phosphine ligated precursors. Journal of Molecular Catalysis A: Chemical 1998, 133 (3), 267–282. [2] F. Auer A. Hupfer A. Bösmann N. Szesni P. Wasserscheidpeter Influence of the nanoparticle size on hydrogen release and side product formation in liquid organic hydrogen carrier systems with supported platinum catalysts Catal. Sci. Technol. 10 19 2020 6669 6678 F. Auer, A. Hupfer, A. Bösmann, N. Szesni, P. Wasserscheidpeter. Influence of the nanoparticle size on hydrogen release and side product formation in liquid organic hydrogen carrier systems with supported platinum catalysts. Catal. Sci. Technol. 2020, 10 (19), 6669–6678. [3] S. Nagatake T. Higo S. Ogo Y. Sugiura R. Watanabe C. Fukuhara Y. Sekine Dehydrogenation of methylcyclohexane over Pt/TiO2 catalyst Catal. Lett. 146 1 2016 54 60 S. Nagatake, T. Higo, S. Ogo, Y. Sugiura, R. Watanabe, C. Fukuhara, Y. Sekine. Dehydrogenation of Methylcyclohexane over Pt/TiO2 Catalyst. Catal Lett 2016, 146 (1), 54–60. [4] J. Oh Y. Jo T.W. Kim H.B. Bathula S. Yang J.H. Baik Y.-W. Suh Highly efficient and robust Pt ensembles on mesoporous alumina for reversible H2 charge and release of commercial benzyltoluene molecules Appl. Catal. B Environ. 305 2022 121061 J. Oh, Y. Jo, T.W. Kim, H.B. Bathula, S. Yang, J.H. Baik, Y.-W. Suh. Highly efficient and robust Pt ensembles on mesoporous alumina for reversible H2 charge and release of commercial benzyltoluene molecules. Applied Catalysis B: Environmental 2022, 305, 121061. [5] J. Lee E.J. Jang D.G. Oh J. Szanyi J.H. Kwak Morphology and size of Pt on Al2O3: the role of specific metal-support interactions between Pt and Al2O3 J. Catal. 385 2020 204 212 J. Lee, E.J. Jang, D.G. Oh, J. Szanyi, J.H. Kwak. Morphology and size of Pt on Al2O3: The role of specific metal-support interactions between Pt and Al2O3. Journal of Catalysis 2020, 385, 204–212. [6] J. Lee E.J. Jang J.H. Kwak Effect of number and properties of specific sites on alumina surfaces for Pt-Al2O3 catalysts Appl. Catal. A Gen. 569 2019 8 19 J. Lee, E.J. Jang, J.H. Kwak. Effect of number and properties of specific sites on alumina surfaces for Pt-Al2O3 catalysts. Applied Catalysis A: General 2019, 569, 8–19. [7] W. Yu M.D. Porosoff J.G. Chen Review of Pt-based bimetallic catalysis: from model surfaces to supported catalysts Chem. Rev. 112 11 2012 5780 5817 W. Yu, M.D. Porosoff, J.G. Chen. Review of Pt-Based Bimetallic Catalysis: From Model Surfaces to Supported Catalysts. Chem. Rev. 2012, 112 (11), 5780–5817. [8] X. Zhang N. He L. Lin Q. Zhu G. Wang H. Guo Study of the carbon cycle of a hydrogen supply system over a supported Pt catalyst: methylcyclohexane–toluene–hydrogen cycle Catal. Sci. Technol. 10 4 2020 1171 1181 X. Zhang, N. He, L. Lin, Q. Zhu, G. Wang, H. Guo. Study of the carbon cycle of a hydrogen supply system over a supported Pt catalyst: methylcyclohexane–toluene–hydrogen cycle. Catal. Sci. Technol. 2020, 10 (4), 1171–1181. [9] K. Alconada V.L. Barrio Evaluation of bimetallic Pt–Co and Pt–Ni catalysts in LOHC dehydrogenation Int. J. Hydrog. Energy 2023 K. Alconada, V.L. Barrio. Evaluation of bimetallic Pt–Co and Pt–Ni catalysts in LOHC dehydrogenation. International Journal of Hydrogen Energy 2023. [10] John K. Dunleavy Sulfur as a catalyst poison Platin. Met. Rev. 50 2 2006 110 110 John K. Dunleavy. Sulfur as a catalyst poison. Platinum Met. Rev. 2006, 50 (2), 110–110. [11] M. Argyle C. Bartholomew Heterogeneous Catalyst Deactivation and Regeneration: A Review Catalysts 5 1 2015 145 269 M. Argyle, C. Bartholomew. Heterogeneous Catalyst Deactivation and Regeneration: A Review. Catalysts 2015, 5 (1), 145–269. [12] F. Auer D. Blaumeiser T. Bauer A. Bösmann N. Szesni J. Libuda P. Wasserscheid Boosting the activity of hydrogen release from liquid organic hydrogen carrier systems by sulfur-additives to Pt on alumina catalysts Catal. Sci. Technol. 9 13 2019 3537 3547 F. Auer, D. Blaumeiser, T. Bauer, A. Bösmann, N. Szesni, J. Libuda, P. Wasserscheid. Boosting the activity of hydrogen release from liquid organic hydrogen carrier systems by sulfur-additives to Pt on alumina catalysts. Catal. Sci. Technol. 2019, 9 (13), 3537–3547. [13] Q.N. Dao E. On S. Ramadhani K. Lee H. Sohn S.H. Choi S.Y. Lee H. Jeong Y. Kim Catalytic insights into perhydro-benzyltoluene dehydrogenation: probing surface characteristics revealed by DRIFTS study Int. J. Hydrog. Energy 56 2024 1284 1293 Q.N. Dao, E. On, S. Ramadhani, K. Lee, H. Sohn, S.H. Choi, S.Y. Lee, H. Jeong, Y. Kim. Catalytic insights into perhydro-benzyltoluene dehydrogenation: Probing surface characteristics revealed by DRIFTS study. International Journal of Hydrogen Energy 2024, 56, 1284–1293. [14] A. Ellert F. Herold M. Rønning A. Hutzler L. Piccirilli T.V.W. Janssens P.N.R. Vennestrøm P. Wasserscheid P. Schühle Phosphorus-modification of Pt/Al 2 O 3 catalysts improves dispersion and cycloalkane dehydrogenation activity J. Catal. 436 2024 115607 A. Ellert, F. Herold, M. Rønning, A. Hutzler, L. Piccirilli, T.V. W. Janssens, P.N. R. Vennestrøm, P. Wasserscheid, P. Schühle. Phosphorus-modification of Pt/Al2O3 catalysts improves dispersion and cycloalkane dehydrogenation activity. Journal of Catalysis 2024, 436, 115607. [15] Q. Guan W. Li M. Zhang K. Tao Alternative synthesis of bulk and supported nickel phosphide from the thermal decomposition of hypophosphites J. Catal. 263 1 2009 1 3 Q. Guan, W. Li, M. Zhang, K. Tao. Alternative synthesis of bulk and supported nickel phosphide from the thermal decomposition of hypophosphites. Journal of Catalysis 2009, 263 (1), 1–3. [16] C.-Y. Peng L. Kang S. Cao Y. Chen Z.-S. Lin W.-F. Fu Nanostructured Ni2P as a robust catalyst for the hydrolytic dehydrogenation of ammonia–borane Angew. Chem. 127 52 2015 15951 15955 C.-Y. Peng, L. Kang, S. Cao, Y. Chen, Z.-S. Lin, W.-F. Fu. Nanostructured Ni2P as a Robust Catalyst for the Hydrolytic Dehydrogenation of Ammonia–Borane. Angewandte Chemie 2015, 127 (52), 15951–15955. [17] D. Liu A. Wang C. Liu R. Prins Ni2P/Al2O3 hydrodesulfurization catalysts prepared by separating the nickel compound and hypophosphite Catal. Today 292 2017 133 142 D. Liu, A. Wang, C. Liu, R. Prins. Ni2P/Al2O3 hydrodesulfurization catalysts prepared by separating the nickel compound and hypophosphite. Catalysis Today 2017, 292, 133–142. [18] R. Prins M.E. Bussell Metal phosphides: preparation, characterization and catalytic reactivity Catal. Lett. 142 12 2012 1413 1436 R. Prins, M.E. Bussell. Metal Phosphides: Preparation, Characterization and Catalytic Reactivity. Catal Lett 2012, 142 (12), 1413–1436. [19] D. Liu X. Li L. Wei T. Zhang A. Wang C. Liu R. Prins Disproportionation of hypophosphite and phosphite Dalton Trans. 46 19 2017 6366 6378 D. Liu, X. Li, L. Wei, T. Zhang, A. Wang, C. Liu, R. Prins. Disproportionation of hypophosphite and phosphite. Dalton Trans. 2017, 46 (19), 6366–6378. [20] T. Rüde S. Dürr P. Preuster M. Wolf P. Wasserscheid Benzyltoluene/perhydro benzyltoluene – pushing the performance limits of pure hydrocarbon liquid organic hydrogen carrier (LOHC) systems Sustain. Energy Fuels 6 6 2022 1541 1553 T. Rüde, S. Dürr, P. Preuster, M. Wolf, P. Wasserscheid. Benzyltoluene/perhydro benzyltoluene – pushing the performance limits of pure hydrocarbon liquid organic hydrogen carrier (LOHC) systems. Sustainable Energy Fuels 2022, 6 (6), 1541–1553. [21] T. Solymosi F. Auer S. Dürr P. Preuster P. Wasserscheid Catalytically activated stainless steel plates for the dehydrogenation of perhydro dibenzyltoluene Int. J. Hydrog. Energy 46 70 2021 34797 34806 T. Solymosi, F. Auer, S. Dürr, P. Preuster, P. Wasserscheid. Catalytically activated stainless steel plates for the dehydrogenation of perhydro dibenzyltoluene. International Journal of Hydrogen Energy 2021, 46 (70), 34797–34806. [22] B. Isaacs The effect of drying temperature on the temperature-programmed reduction profile of a platinum/rhenium/alumina catalyst J. Catal. 77 1 1982 43 52 B. Isaacs. The effect of drying temperature on the temperature-programmed reduction profile of a platinum/rhenium/alumina catalyst. Journal of Catalysis 1982, 77 (1), 43–52. [23] Y. Chu On the sintering of platinum on alumina model catalyst J. Catal. 55 3 1978 281 298 Y. Chu. On the sintering of platinum on alumina model catalyst. Journal of Catalysis 1978, 55 (3), 281–298. [24] W.G. Rothschild H.C. Yao H.K. Plummer Surface interaction in the platinum-.gamma.-alumina system. V. Effects of atmosphere and fractal topology on the sintering of platinum Langmuir 2 5 1986 588 593 W.G. Rothschild, H.C. Yao, H.K. Plummer. Surface interaction in the platinum-.gamma.-alumina system. V. Effects of atmosphere and fractal topology on the sintering of platinum. Langmuir 1986, 2 (5), 588–593. [25] J.F. Moulder Handbook of X-ray photoelectron spectroscopy: a reference book of standard spectra for identification and interpretation of XPS data Physical Electronics Division 1992 Perkin-Elmer Corporation J.F. Moulder. Handbook of X-Ray Photoelectron Spectroscopy: A Reference Book of Standard Spectra for Identification and Interpretation of XPS Data; Physical Electronics Division, Perkin-Elmer Corporation, 1992. [26] G. Schön High resolution Auger electron spectroscopy of metallic copper J. Electron Spectrosc. Relat. Phenom. 1 4 1972 377 387 G. Schön. High resolution Auger electron spectroscopy of metallic copper. Journal of Electron Spectroscopy and Related Phenomena 1972, 1 (4), 377–387. [27] W.-D. Schneider C. Laubschat Actinide—noble-metal systems: an X-ray-photoelectron-spectroscopy study of thorium-platinum, uranium-platinum, and uranium-gold intermetallics Phys. Rev. B 23 3 1981 997 1005 W.-D. Schneider, C. Laubschat. Actinide—noble-metal systems: An X-ray-photoelectron-spectroscopy study of thorium-platinum, uranium-platinum, and uranium-gold intermetallics. Phys. Rev. B 1981, 23 (3), 997–1005. [28] S.D. Jackson J. Willis G.D. Mclellan G. Webb M.B.T. Keegan R.B. Moyes S. Simpson P.B. Wells R. Whyman Supported metal catalysts: preparation, characterization, and function J. Catal. 139 1 1993 191 206 S.D. Jackson, J. Willis, G.D. Mclellan, G. Webb, M.B. T. Keegan, R.B. Moyes, S. Simpson, P.B. Wells, R. Whyman. Supported Metal Catalysts: Preparation, Characterization, and Function. Journal of Catalysis 1993, 139 (1), 191–206. [29] K. Kinoshita K. Routsis J.A.S. Bett The thermal decomposition of platinum(II) and (IV) complexes Thermochim. Acta 10 1 1974 109 117 K. Kinoshita, K. Routsis, J.A. S. Bett. The thermal decomposition of platinum(II) and (IV) complexes. Thermochimica Acta 1974, 10 (1), 109–117. [30] A.E. Schweizer G.T. Kerr Thermal decomposition of hexachloroplatinic acid Inorg. Chem. 17 8 1978 2326 2327 A.E. Schweizer, G.T. Kerr. Thermal decomposition of hexachloroplatinic acid. Inorg. Chem. 1978, 17 (8), 2326–2327. [31] T. Lindblad B. Rebenstorf Z.-G. Yan S.L.T. Andersson Characterization of vanadia supported on amorphous AlPO 4 and its properties for oxidative dehydrogenation of propane Appl. Catal. A Gen. 112 2 1994 187 208 T. Lindblad, B. Rebenstorf, Z.-G. Yan, S.L. T. Andersson. Characterization of vanadia supported on amorphous AlPO4 and its properties for oxidative dehydrogenation of propane. Applied Catalysis A: General 1994, 112 (2), 187–208. [32] J.A. Rotole P.M.A. Sherwood Aluminum Phosphate by XPS Surf. Sci. Spectra 5 1 1998 60 66 J.A. Rotole, P.M. A. Sherwood. Aluminum Phosphate by XPS. Surface Science Spectra 1998, 5 (1), 60–66. [33] E. Fluck D. Weber Anwendung der Röntgen-Photoelektronenspektroskopie in der Phosphorchemie, II: P 2p -Bindungsenergien in Phosphor(III)-Verbindungen, Phosphoniumsalzen und Sauerstoffsäuren des Phosphors / P 2p Binding Energies in Phosphorus(III) Compounds, Phosphonium Salts and Oxyacids of Phosphorus Z. F. üR. Naturforsch. B 29 9–10 1974 603 607 E. Fluck, D. Weber. Anwendung der Röntgen-Photoelektronenspektroskopie in der Phosphorchemie, II: P2p -Bindungsenergien in Phosphor(III)-Verbindungen, Phosphoniumsalzen und Sauerstoffsäuren des Phosphors / P2p Binding Energies in Phosphorus(III) Compounds, Phosphonium Salts and Oxyacids of Phosphorus. Zeitschrift für Naturforschung B 1974, 29 (9–10), 603–607. [34] J. Kou J. Zhu Chen J. Gao X. Zhang J. Zhu A. Ghosh W. Liu A.J. Kropf D. Zemlyanov R. Ma X. Guo A.K. Datye G. Zhang L. Guo J.T. Miller Structural and catalytic properties of isolated Pt 2+ sites in platinum phosphide (PtP 2 ) ACS Catal. 11 21 2021 13496 13509 J. Kou, J. Zhu Chen, J. Gao, X. Zhang, J. Zhu, A. Ghosh, W. Liu, A.J. Kropf, D. Zemlyanov, R. Ma, X. Guo, A.K. Datye, G. Zhang, L. Guo, J.T. Miller. Structural and Catalytic Properties of Isolated Pt2+ Sites in Platinum Phosphide (PtP2). ACS Catal. 2021, 11 (21), 13496–13509. [35] R. Nishitani H. Iwasaki Y. Mizokawa S. Nakamura An XPS analysis of thermally grown oxide film on GaP Jpn. J. Appl. Phys. 17 2 1978 321 327 R. Nishitani, H. Iwasaki, Y. Mizokawa, S. Nakamura. An XPS Analysis of Thermally Grown Oxide Film on GaP. Jpn. J. Appl. Phys. 1978, 17 (2), 321–327. [36] S.H. Baker S.C. Bayliss S.J. Gurman N. Elgun E.A. Davis A structural and optical study of sputtered InP films as a function of preparation temperature J. Phys. Condens. Matter 8 10 1996 1591 1605 S.H. Baker, S.C. Bayliss, S.J. Gurman, N. Elgun, E.A. Davis. A structural and optical study of sputtered InP films as a function of preparation temperature. J. Phys.: Condens. Matter 1996, 8 (10), 1591–1605. [37] U. Elrod M.Ch Lux-Steiner M. Obergfell E. Bucher L. Schlapbach Surface chemistry of Zn 3 P 3 single crystals studied by XPS Appl. Phys. B 43 3 1987 197 201 U. Elrod, M.Ch Lux-Steiner, M. Obergfell, E. Bucher, L. Schlapbach. Surface chemistry of Zn3P3 single crystals studied by XPS. Appl. Phys. B 1987, 43 (3), 197–201. [38] G. Bredig R. Allolio Röntgenuntersuchungen an katalytisch wirkenden Metallen Z. F. üR. Phys. Chem. 126U 1 1927 41 71 G. Bredig, R. Allolio. Röntgenuntersuchungen an katalytisch wirkenden Metallen. Zeitschrift für Physikalische Chemie 1927, 126U (1), 41–71. [39] S.K. Latypov F.M. Polyancev D.G. Yakhvarov O.G. Sinyashin Quantum chemical calculations of 31 P NMR chemical shifts: scopes and limitations Phys. Chem. Chem. Phys. 17 10 2015 6976 6987 S.K. Latypov, F.M. Polyancev, D.G. Yakhvarov, O.G. Sinyashin. Quantum chemical calculations of 31P NMR chemical shifts: scopes and limitations. Phys. Chem. Chem. Phys. 2015, 17 (10), 6976–6987. [40] A. Hühn D. Wisser M. Corral Valero T. Roy M. Rivallan L. Catita A. Lesage C. Michel P. Raybaud Structural characterization of phosphate species adsorbed on γ-alumina by combining DNP surface enhanced NMR spectroscopy and DFT calculations ACS Catal. 11 17 2021 11278 11292 A. Hühn, D. Wisser, M. Corral Valero, T. Roy, M. Rivallan, L. Catita, A. Lesage, C. Michel, P. Raybaud. Structural Characterization of Phosphate Species Adsorbed on γ-Alumina by Combining DNP Surface Enhanced NMR Spectroscopy and DFT Calculations. ACS Catal. 2021, 11 (17), 11278–11292. [41] E.C. Decanio J.C. Edwards T.R. Scalzo D.A. Storm J.W. Bruno FT-IR and solid-state NMR investigation of phosphorus promoted hydrotreating catalyst precursors J. Catal. 132 2 1991 498 511 E.C. Decanio, J.C. Edwards, T.R. Scalzo, D.A. Storm, J. W. Bruno. FT-IR and solid-state NMR investigation of phosphorus promoted hydrotreating catalyst precursors. Journal of Catalysis 1991, 132 (2), 498–511. [42] R.J. Kirkpatrick R.K. Brow Nuclear magnetic resonance investigation of the structures of phosphate and phosphate-containing glasses: a review Solid State Nucl. Magn. Reson. 5 1 1995 9 21 R.J. Kirkpatrick, R.K. Brow. Nuclear magnetic resonance investigation of the structures of phosphate and phosphate-containing glasses: a review. Solid State Nuclear Magnetic Resonance 1995, 5 (1), 9–21. [43] B.B. Johnson A.V. Ivanov O.N. Antzutkin W. Forsling 31 P nuclear magnetic resonance study of the adsorption of phosphate and phenyl phosphates on γ-Al 2 O 3 Langmuir 18 4 2002 1104 1111 B.B. Johnson, A.V. Ivanov, O.N. Antzutkin, W. Forsling. 31 P Nuclear Magnetic Resonance Study of the Adsorption of Phosphate and Phenyl Phosphates on γ-Al 2 O 3. Langmuir 2002, 18 (4), 1104–1111.",
      "scopus-id": "85219493226",
      "coredata": {
        "eid": "1-s2.0-S0926860X25001000",
        "dc:description": "This study introduces a solvent-free gas-phase method for modifying Al₂O₃-supported platinum (3 wt%) catalysts with phosphorus (P) to enhance Pt dispersion and dehydrogenation activity. The process involves decomposing NaH₂PO₂ at 600 °C, releasing PH₃, interacting with Pt on the catalyst surface. P-modified catalysts showed up to a 24 % increase in activity for perhydro-benzyltoluene dehydrogenation within a P:Pt ratio of 0.6–2.6. Additionally, they exhibited high resistance to sintering, maintaining Pt particle sizes of ∼0.9 nm even at 600 °C. Characterization using CO chemisorption, STEM NMR, and XPS revealed that PH₃ deposits phosphorus on the catalyst, which then oxidizes via support lattice oxygen. At 600 °C, this oxidized phosphorus migrates to the support/metal interface, stabilizing Pt nanoparticles and preventing sintering. However, when the P:Pt ratio exceeds 2.6, excess phosphorus remains on the surface, deactivating active sites. This study highlights the role of POₓ species in stabilizing Pt nanoparticles and optimizing catalyst performance.",
        "openArchiveArticle": "false",
        "prism:coverDate": "2025-04-25",
        "openaccessUserLicense": "http://creativecommons.org/licenses/by/4.0/",
        "prism:aggregationType": "Journal",
        "prism:url": "https://api.elsevier.com/content/article/pii/S0926860X25001000",
        "dc:creator": [
          {
            "@_fa": "true",
            "$": "Ellert, Abelina"
          },
          {
            "@_fa": "true",
            "$": "Ding, Fei"
          },
          {
            "@_fa": "true",
            "$": "Hutzler, Andreas"
          },
          {
            "@_fa": "true",
            "$": "Herold, Felix"
          },
          {
            "@_fa": "true",
            "$": "Piccirilli, Luca"
          },
          {
            "@_fa": "true",
            "$": "Rønning, Magnus"
          },
          {
            "@_fa": "true",
            "$": "Janssens, Ton V.W."
          },
          {
            "@_fa": "true",
            "$": "Wisser, Dorothea"
          },
          {
            "@_fa": "true",
            "$": "Schühle, Patrick"
          }
        ],
        "link": [
          {
            "@_fa": "true",
            "@rel": "self",
            "@href": "https://api.elsevier.com/content/article/pii/S0926860X25001000"
          },
          {
            "@_fa": "true",
            "@rel": "scidir",
            "@href": "https://www.sciencedirect.com/science/article/pii/S0926860X25001000"
          }
        ],
        "dc:format": "application/json",
        "openaccessType": "Full",
        "pii": "S0926-860X(25)00100-0",
        "prism:volume": "696",
        "articleNumber": "120199",
        "prism:publisher": "The Author(s). Published by Elsevier B.V.",
        "dc:title": "Solvent-free phosphorus modification of Pt/Al2O3 catalysts to improve dispersion and dehydrogenation activity",
        "prism:copyright": "© 2025 The Author(s). Published by Elsevier B.V.",
        "openaccess": "1",
        "prism:issn": "0926860X",
        "dcterms:subject": [
          {
            "@_fa": "true",
            "$": "Heterogeneous catalysis"
          },
          {
            "@_fa": "true",
            "$": "Doping"
          },
          {
            "@_fa": "true",
            "$": "Phosphorus"
          },
          {
            "@_fa": "true",
            "$": "Dehydrogenation"
          },
          {
            "@_fa": "true",
            "$": "Benzyltoluene"
          }
        ],
        "openaccessArticle": "true",
        "prism:publicationName": "Applied Catalysis A: General",
        "openaccessSponsorType": "ElsevierWaived",
        "prism:pageRange": "120199",
        "pubType": "fla",
        "prism:coverDisplayDate": "25 April 2025",
        "prism:doi": "10.1016/j.apcata.2025.120199",
        "prism:startingPage": "120199",
        "dc:identifier": "doi:10.1016/j.apcata.2025.120199",
        "openaccessSponsorName": "DEAL agreement: Core Hybrid journals"
      },
      "objects": {
        "object": [
          {
            "@category": "standard",
            "@height": "320",
            "@width": "678",
            "@_fa": "true",
            "$": "https://api.elsevier.com/content/object/eid/1-s2.0-S0926860X25001000-gr3.jpg?httpAccept=%2A%2F%2A",
            "@multimediatype": "JPEG image file",
            "@type": "IMAGE-DOWNSAMPLED",
            "@size": "34766",
            "@ref": "gr3",
            "@mimetype": "image/jpeg"
          },
          {
            "@category": "standard",
            "@height": "670",
            "@width": "678",
            "@_fa": "true",
            "$": "https://api.elsevier.com/content/object/eid/1-s2.0-S0926860X25001000-gr4.jpg?httpAccept=%2A%2F%2A",
            "@multimediatype": "JPEG image file",
            "@type": "IMAGE-DOWNSAMPLED",
            "@size": "104709",
            "@ref": "gr4",
            "@mimetype": "image/jpeg"
          },
          {
            "@category": "standard",
            "@height": "271",
            "@width": "678",
            "@_fa": "true",
            "$": "https://api.elsevier.com/content/object/eid/1-s2.0-S0926860X25001000-gr1.jpg?httpAccept=%2A%2F%2A",
            "@multimediatype": "JPEG image file",
            "@type": "IMAGE-DOWNSAMPLED",
            "@size": "32542",
            "@ref": "gr1",
            "@mimetype": "image/jpeg"
          },
          {
            "@category": "standard",
            "@height": "310",
            "@width": "376",
            "@_fa": "true",
            "$": "https://api.elsevier.com/content/object/eid/1-s2.0-S0926860X25001000-gr2.jpg?httpAccept=%2A%2F%2A",
            "@multimediatype": "JPEG image file",
            "@type": "IMAGE-DOWNSAMPLED",
            "@size": "18567",
            "@ref": "gr2",
            "@mimetype": "image/jpeg"
          },
          {
            "@category": "standard",
            "@height": "185",
            "@width": "500",
            "@_fa": "true",
            "$": "https://api.elsevier.com/content/object/eid/1-s2.0-S0926860X25001000-ga1.jpg?httpAccept=%2A%2F%2A",
            "@multimediatype": "JPEG image file",
            "@type": "IMAGE-DOWNSAMPLED",
            "@size": "20485",
            "@ref": "ga1",
            "@mimetype": "image/jpeg"
          },
          {
            "@category": "standard",
            "@height": "505",
            "@width": "376",
            "@_fa": "true",
            "$": "https://api.elsevier.com/content/object/eid/1-s2.0-S0926860X25001000-gr7.jpg?httpAccept=%2A%2F%2A",
            "@multimediatype": "JPEG image file",
            "@type": "IMAGE-DOWNSAMPLED",
            "@size": "55392",
            "@ref": "gr7",
            "@mimetype": "image/jpeg"
          },
          {
            "@category": "standard",
            "@height": "338",
            "@width": "678",
            "@_fa": "true",
            "$": "https://api.elsevier.com/content/object/eid/1-s2.0-S0926860X25001000-gr5.jpg?httpAccept=%2A%2F%2A",
            "@multimediatype": "JPEG image file",
            "@type": "IMAGE-DOWNSAMPLED",
            "@size": "62914",
            "@ref": "gr5",
            "@mimetype": "image/jpeg"
          },
          {
            "@category": "standard",
            "@height": "336",
            "@width": "678",
            "@_fa": "true",
            "$": "https://api.elsevier.com/content/object/eid/1-s2.0-S0926860X25001000-gr6.jpg?httpAccept=%2A%2F%2A",
            "@multimediatype": "JPEG image file",
            "@type": "IMAGE-DOWNSAMPLED",
            "@size": "67067",
            "@ref": "gr6",
            "@mimetype": "image/jpeg"
          },
          {
            "@category": "standard",
            "@height": "82",
            "@width": "715",
            "@_fa": "true",
            "$": "https://api.elsevier.com/content/object/eid/1-s2.0-S0926860X25001000-sc1.jpg?httpAccept=%2A%2F%2A",
            "@multimediatype": "JPEG image file",
            "@type": "IMAGE-DOWNSAMPLED",
            "@size": "13105",
            "@ref": "sc1",
            "@mimetype": "image/jpeg"
          },
          {
            "@category": "thumbnail",
            "@height": "103",
            "@width": "219",
            "@_fa": "true",
            "$": "https://api.elsevier.com/content/object/eid/1-s2.0-S0926860X25001000-gr3.sml?httpAccept=%2A%2F%2A",
            "@multimediatype": "GIF image file",
            "@type": "IMAGE-THUMBNAIL",
            "@size": "5188",
            "@ref": "gr3",
            "@mimetype": "image/gif"
          },
          {
            "@category": "thumbnail",
            "@height": "164",
            "@width": "166",
            "@_fa": "true",
            "$": "https://api.elsevier.com/content/object/eid/1-s2.0-S0926860X25001000-gr4.sml?httpAccept=%2A%2F%2A",
            "@multimediatype": "GIF image file",
            "@type": "IMAGE-THUMBNAIL",
            "@size": "13956",
            "@ref": "gr4",
            "@mimetype": "image/gif"
          },
          {
            "@category": "thumbnail",
            "@height": "88",
            "@width": "219",
            "@_fa": "true",
            "$": "https://api.elsevier.com/content/object/eid/1-s2.0-S0926860X25001000-gr1.sml?httpAccept=%2A%2F%2A",
            "@multimediatype": "GIF image file",
            "@type": "IMAGE-THUMBNAIL",
            "@size": "4750",
            "@ref": "gr1",
            "@mimetype": "image/gif"
          },
          {
            "@category": "thumbnail",
            "@height": "163",
            "@width": "198",
            "@_fa": "true",
            "$": "https://api.elsevier.com/content/object/eid/1-s2.0-S0926860X25001000-gr2.sml?httpAccept=%2A%2F%2A",
            "@multimediatype": "GIF image file",
            "@type": "IMAGE-THUMBNAIL",
            "@size": "5844",
            "@ref": "gr2",
            "@mimetype": "image/gif"
          },
          {
            "@category": "thumbnail",
            "@height": "81",
            "@width": "219",
            "@_fa": "true",
            "$": "https://api.elsevier.com/content/object/eid/1-s2.0-S0926860X25001000-ga1.sml?httpAccept=%2A%2F%2A",
            "@multimediatype": "GIF image file",
            "@type": "IMAGE-THUMBNAIL",
            "@size": "6322",
            "@ref": "ga1",
            "@mimetype": "image/gif"
          },
          {
            "@category": "thumbnail",
            "@height": "164",
            "@width": "122",
            "@_fa": "true",
            "$": "https://api.elsevier.com/content/object/eid/1-s2.0-S0926860X25001000-gr7.sml?httpAccept=%2A%2F%2A",
            "@multimediatype": "GIF image file",
            "@type": "IMAGE-THUMBNAIL",
            "@size": "7683",
            "@ref": "gr7",
            "@mimetype": "image/gif"
          },
          {
            "@category": "thumbnail",
            "@height": "109",
            "@width": "219",
            "@_fa": "true",
            "$": "https://api.elsevier.com/content/object/eid/1-s2.0-S0926860X25001000-gr5.sml?httpAccept=%2A%2F%2A",
            "@multimediatype": "GIF image file",
            "@type": "IMAGE-THUMBNAIL",
            "@size": "8902",
            "@ref": "gr5",
            "@mimetype": "image/gif"
          },
          {
            "@category": "thumbnail",
            "@height": "108",
            "@width": "219",
            "@_fa": "true",
            "$": "https://api.elsevier.com/content/object/eid/1-s2.0-S0926860X25001000-gr6.sml?httpAccept=%2A%2F%2A",
            "@multimediatype": "GIF image file",
            "@type": "IMAGE-THUMBNAIL",
            "@size": "9398",
            "@ref": "gr6",
            "@mimetype": "image/gif"
          },
          {
            "@category": "thumbnail",
            "@height": "25",
            "@width": "219",
            "@_fa": "true",
            "$": "https://api.elsevier.com/content/object/eid/1-s2.0-S0926860X25001000-sc1.sml?httpAccept=%2A%2F%2A",
            "@multimediatype": "GIF image file",
            "@type": "IMAGE-THUMBNAIL",
            "@size": "1696",
            "@ref": "sc1",
            "@mimetype": "image/gif"
          },
          {
            "@category": "high",
            "@height": "1413",
            "@width": "2994",
            "@_fa": "true",
            "$": "https://api.elsevier.com/content/object/eid/1-s2.0-S0926860X25001000-gr3_lrg.jpg?httpAccept=%2A%2F%2A",
            "@multimediatype": "JPEG image file",
            "@type": "IMAGE-HIGH-RES",
            "@size": "194278",
            "@ref": "gr3",
            "@mimetype": "image/jpeg"
          },
          {
            "@category": "high",
            "@height": "2960",
            "@width": "2994",
            "@_fa": "true",
            "$": "https://api.elsevier.com/content/object/eid/1-s2.0-S0926860X25001000-gr4_lrg.jpg?httpAccept=%2A%2F%2A",
            "@multimediatype": "JPEG image file",
            "@type": "IMAGE-HIGH-RES",
            "@size": "621987",
            "@ref": "gr4",
            "@mimetype": "image/jpeg"
          },
          {
            "@category": "high",
            "@height": "1198",
            "@width": "2994",
            "@_fa": "true",
            "$": "https://api.elsevier.com/content/object/eid/1-s2.0-S0926860X25001000-gr1_lrg.jpg?httpAccept=%2A%2F%2A",
            "@multimediatype": "JPEG image file",
            "@type": "IMAGE-HIGH-RES",
            "@size": "177677",
            "@ref": "gr1",
            "@mimetype": "image/jpeg"
          },
          {
            "@category": "high",
            "@height": "1373",
            "@width": "1663",
            "@_fa": "true",
            "$": "https://api.elsevier.com/content/object/eid/1-s2.0-S0926860X25001000-gr2_lrg.jpg?httpAccept=%2A%2F%2A",
            "@multimediatype": "JPEG image file",
            "@type": "IMAGE-HIGH-RES",
            "@size": "96207",
            "@ref": "gr2",
            "@mimetype": "image/jpeg"
          },
          {
            "@category": "high",
            "@height": "821",
            "@width": "2213",
            "@_fa": "true",
            "$": "https://api.elsevier.com/content/object/eid/1-s2.0-S0926860X25001000-ga1_lrg.jpg?httpAccept=%2A%2F%2A",
            "@multimediatype": "JPEG image file",
            "@type": "IMAGE-HIGH-RES",
            "@size": "142543",
            "@ref": "ga1",
            "@mimetype": "image/jpeg"
          },
          {
            "@category": "high",
            "@height": "2235",
            "@width": "1663",
            "@_fa": "true",
            "$": "https://api.elsevier.com/content/object/eid/1-s2.0-S0926860X25001000-gr7_lrg.jpg?httpAccept=%2A%2F%2A",
            "@multimediatype": "JPEG image file",
            "@type": "IMAGE-HIGH-RES",
            "@size": "326508",
            "@ref": "gr7",
            "@mimetype": "image/jpeg"
          },
          {
            "@category": "high",
            "@height": "1491",
            "@width": "2994",
            "@_fa": "true",
            "$": "https://api.elsevier.com/content/object/eid/1-s2.0-S0926860X25001000-gr5_lrg.jpg?httpAccept=%2A%2F%2A",
            "@multimediatype": "JPEG image file",
            "@type": "IMAGE-HIGH-RES",
            "@size": "347649",
            "@ref": "gr5",
            "@mimetype": "image/jpeg"
          },
          {
            "@category": "high",
            "@height": "1483",
            "@width": "2994",
            "@_fa": "true",
            "$": "https://api.elsevier.com/content/object/eid/1-s2.0-S0926860X25001000-gr6_lrg.jpg?httpAccept=%2A%2F%2A",
            "@multimediatype": "JPEG image file",
            "@type": "IMAGE-HIGH-RES",
            "@size": "373157",
            "@ref": "gr6",
            "@mimetype": "image/jpeg"
          },
          {
            "@category": "high",
            "@height": "364",
            "@width": "3161",
            "@_fa": "true",
            "$": "https://api.elsevier.com/content/object/eid/1-s2.0-S0926860X25001000-sc1_lrg.jpg?httpAccept=%2A%2F%2A",
            "@multimediatype": "JPEG image file",
            "@type": "IMAGE-HIGH-RES",
            "@size": "75297",
            "@ref": "sc1",
            "@mimetype": "image/jpeg"
          },
          {
            "@category": "standard",
            "@_fa": "true",
            "$": "https://api.elsevier.com/content/object/eid/1-s2.0-S0926860X25001000-mmc1.docx?httpAccept=%2A%2F%2A",
            "@multimediatype": "Microsoft Word file",
            "@type": "APPLICATION",
            "@size": "2614231",
            "@ref": "mmc1",
            "@mimetype": "application/word"
          },
          {
            "@category": "thumbnail",
            "@_fa": "true",
            "$": "https://api.elsevier.com/content/object/eid/1-s2.0-S0926860X25001000-si0001.svg?httpAccept=%2A%2F%2A",
            "@multimediatype": "Scalable Vector Graphics file",
            "@type": "ALTIMG",
            "@size": "2808",
            "@ref": "si0001",
            "@mimetype": "image/svg+xml"
          },
          {
            "@category": "thumbnail",
            "@_fa": "true",
            "$": "https://api.elsevier.com/content/object/eid/1-s2.0-S0926860X25001000-si0002.svg?httpAccept=%2A%2F%2A",
            "@multimediatype": "Scalable Vector Graphics file",
            "@type": "ALTIMG",
            "@size": "3537",
            "@ref": "si0002",
            "@mimetype": "image/svg+xml"
          }
        ]
      },
      "link": {
        "@rel": "abstract",
        "@href": "https://api.elsevier.com/content/abstract/scopus_id/85219493226"
      }
    }
  }
}