{
  "metadata": {
    "title": "Rapid transfer hydrogenation of acetophenone using ruthenium catalysts bearing commercially available and readily accessible nitrogen and phosphorous donor ligands",
    "authors": "; ; ",
    "journal": "Applied Catalysis A: General",
    "date": "2019-01-25",
    "doi": "10.1016/j.apcata.2018.11.031",
    "abstract": "",
    "uri": "https://api.elsevier.com/content/article/pii/S0926860X18305866",
    "pii": "S0926860X18305866"
  },
  "fulltext": {
    "full-text-retrieval-response": {
      "scopus-eid": "2-s2.0-85058052442",
      "originalText": "serial JL 271346 291210 291744 291809 31 Applied Catalysis A: General APPLIEDCATALYSISAGENERAL 2018-11-30 2018-11-30 2018-12-11 2018-12-11 2019-08-19T12:53:02 1-s2.0-S0926860X18305866 S0926-860X(18)30586-6 S0926860X18305866 10.1016/j.apcata.2018.11.031 S300 S300.3 FULL-TEXT 1-s2.0-S0926860X18X00192 2024-01-01T12:33:10.553292Z 0 0 20190125 2019 2018-11-30T16:14:32.58082Z absattachment articleinfo articletitlenorm authfirstinitialnorm authfirstsurnamenorm cid cids contenttype copyright crossmark dateloaded dateloadedtxt datesearch datesort dateupdated dco docsubtype doctype doi eid ewtransactionid hubeid indexeddate issn issnnorm itemstage itemtransactionid itemweight openaccess openarchive pg pgfirst pglast pii piinorm pubdatestart pubdatetxt pubyr sectiontitle sortorder srctitle srctitlenorm srctype ssids alllist content subj subheadings suppl tomb volfirst volissue volumelist webpdf webpdfpagecount yearnav figure table e-component body mmlmath acknowledge affil appendices articletitle auth authfirstini authfull authkeywords authlast footnotes highlightsabst nomenclature orcid primabst ref specialabst 0926-860X 0926860X true 570 570 C Volume 570 40 367 375 367 375 20190125 25 January 2019 2019-01-25 2019 Regular Papers article fla © 2018 Elsevier B.V. All rights reserved. RAPIDTRANSFERHYDROGENATIONACETOPHENONEUSINGRUTHENIUMCATALYSTSBEARINGCOMMERCIALLYAVAILABLEREADILYACCESSIBLENITROGENPHOSPHOROUSDONORLIGANDS BRADEN D Nomenclature 1 Introduction 2 Experimental 2.1 General considerations 2.2 Synthesis of complexes 2.2.1 Complex [Ru(4)(PPh3)2Cl][Cl] (9) 2.2.2 Complex [Ru(1)PPh3(Cl)2] (10) 2.3 General procedure for transfer hydrogenation of acetophenone 2.4 Kinetic modelling 3 Results and discussion 3.1 Transfer hydrogenation catalyst screening 3.2 Synthesis of complexes 3.3 Reaction kinetics of highly active transfer hydrogenation catalysts 3.4 Comparison to other ruthenium TH systems 4 Conclusions Declarations of interest Acknowledgements Appendix A Supplementary data References IKARIYA 2007 1300 1308 T AGER 2012 3340 3380 D ITO 2014 3133 3146 J WANG 2015 6621 6686 D GLADIALI 2008 135 157 S REDUCTIONCARBONYLCOMPOUNDSBYHYDROGENTRANSFERMODERNREDUCTIONMETHODS CLAPHAM 2004 2201 2237 S SAMEC 2006 237 248 J BARATTA 2005 6214 6219 W BARATTA 2006 4611 4620 W CARIOU 2010 9039 9045 R SMALL 1998 7143 7144 B ABBEL 2005 1870 1882 R ZHAO 2013 4744 4788 B HSU 2014 4242 4245 S LUNDGREN 2007 4732 4735 R BECKETT 1991 229 232 M SMALL 2015 2599 2611 B LI 2011 495 500 Y PRAETORIUS 2010 554 561 J OEZDEMIR 2007 205 209 I ZENG 2008 2898 2901 F ZENG 2009 1855 1862 F YE 2011 4737 4741 W DU 2013 3083 3090 W CHAI 2015 5278 5284 H SASSON 1971 2167 2170 Y CHOWDHURY 1991 1063 1064 R ARANYOS 1999 351 352 A TOUBIANA 2012 1644 1653 J POLSHETTIWAR 2009 1313 1316 V OUALI 2009 504 509 A JIA 2009 8301 8307 W ABDURRASHID 2002 15104 15118 K ABDURRASHID 2018 K KANATACHEMICALTECHNOLOGIESINCMETHODFORPREPARINGAMETALCATALYST MISHRA 2005 352 356 D MISHRA 2007 2231 2244 D HADZOVIC 2007 5987 5999 A RAUTENSTRAUCH 2003 4954 4967 V BARATTA 2007 7479 7486 W WISMAN 2006 423 429 R WETTERGREN 2009 5709 5718 J SUN 2004 909 914 X THOUMAZET 2003 1580 1581 C ZHANG 2013 5299 5304 S GUNANATHAN 2014 12024 12087 C YOUNUS 2015 283 330 H BRAUNSTEIN 1999 589 594 P BRAUNSTEIN 2000 2676 2683 P JIANG 1997 6565 6568 Y JIANG 1997 215 218 Y PROKOPCHUK 2011 10603 10608 D KENNY 1999 1615 1617 J EVERAERE 2001 275 291 K EVERAERE 2003 67 77 K CRABTREE 2015 127 150 R BRADENX2019X367 BRADENX2019X367X375 BRADENX2019X367XD BRADENX2019X367X375XD 2020-12-11T00:00:00.000Z 2020-12-11T00:00:00.000Z http://creativecommons.org/licenses/by-nc-nd/4.0/ © 2018 Elsevier B.V. All rights reserved. 2019-04-02T16:35:02.553Z http://vtw.elsevier.com/data/voc/AddOnTypes/50.7/nlp item S0926-860X(18)30586-6 S0926860X18305866 1-s2.0-S0926860X18305866 10.1016/j.apcata.2018.11.031 271346 2024-01-01T12:33:10.553292Z 2019-01-25 1-s2.0-S0926860X18305866-main.pdf https://s3.amazonaws.com/prod-ucs-content-store-us-east/content/pii:S0926860X18305866/MAIN/application/pdf/8029b7a8e46adf35c8c1d76ea3e195d5/main.pdf main.pdf pdf true 2311472 MAIN 9 1-s2.0-S0926860X18305866-main_1.png https://s3.amazonaws.com/prod-ucs-content-store-us-east/content/pii:S0926860X18305866/PREVIEW/image/png/65b7fe9efc714f691b3e680f0ea131d6/main_1.png main_1.png png 52718 849 656 IMAGE-WEB-PDF 1 1-s2.0-S0926860X18305866-ga1.sml https://s3.amazonaws.com/prod-ucs-content-store-us-east/content/pii:S0926860X18305866/ga1/THUMBNAIL/image/gif/0e5dc4ca5ce608548ac29ece5e7df5f2/ga1.sml ga1 true ga1.sml sml 6868 103 219 IMAGE-THUMBNAIL 1-s2.0-S0926860X18305866-gr1.sml https://s3.amazonaws.com/prod-ucs-content-store-us-east/content/pii:S0926860X18305866/gr1/THUMBNAIL/image/gif/0de6daeee15f3c0606e92831b93d972f/gr1.sml gr1 gr1.sml sml 4142 129 219 IMAGE-THUMBNAIL 1-s2.0-S0926860X18305866-gr2.sml https://s3.amazonaws.com/prod-ucs-content-store-us-east/content/pii:S0926860X18305866/gr2/THUMBNAIL/image/gif/9ad5f53dfe3e85ca1c2382e491f5d90b/gr2.sml gr2 gr2.sml sml 4117 126 219 IMAGE-THUMBNAIL 1-s2.0-S0926860X18305866-gr3.sml https://s3.amazonaws.com/prod-ucs-content-store-us-east/content/pii:S0926860X18305866/gr3/THUMBNAIL/image/gif/078a9fe1a8eba8c38e290e1b0a846a73/gr3.sml gr3 gr3.sml sml 8541 163 169 IMAGE-THUMBNAIL 1-s2.0-S0926860X18305866-gr4.sml https://s3.amazonaws.com/prod-ucs-content-store-us-east/content/pii:S0926860X18305866/gr4/THUMBNAIL/image/gif/4213c0afd462ea78ac045f60e50b6103/gr4.sml gr4 gr4.sml sml 5334 135 219 IMAGE-THUMBNAIL 1-s2.0-S0926860X18305866-gr5.sml https://s3.amazonaws.com/prod-ucs-content-store-us-east/content/pii:S0926860X18305866/gr5/THUMBNAIL/image/gif/282afbc77592de4b3aa6a8047e24a650/gr5.sml gr5 gr5.sml sml 4742 134 219 IMAGE-THUMBNAIL 1-s2.0-S0926860X18305866-sc1.sml https://s3.amazonaws.com/prod-ucs-content-store-us-east/content/pii:S0926860X18305866/sc1/THUMBNAIL/image/gif/8b9e866c7a7c59226dc416b0fbabd90a/sc1.sml sc1 sc1.sml sml 2065 31 219 IMAGE-THUMBNAIL 1-s2.0-S0926860X18305866-sc2.sml https://s3.amazonaws.com/prod-ucs-content-store-us-east/content/pii:S0926860X18305866/sc2/THUMBNAIL/image/gif/2e4c143068fe964d8602dc4d9d174977/sc2.sml sc2 sc2.sml sml 2308 36 219 IMAGE-THUMBNAIL 1-s2.0-S0926860X18305866-sc3.sml https://s3.amazonaws.com/prod-ucs-content-store-us-east/content/pii:S0926860X18305866/sc3/THUMBNAIL/image/gif/e5ceb23af0a4b7d7aca09697cf061944/sc3.sml sc3 sc3.sml sml 4667 90 219 IMAGE-THUMBNAIL 1-s2.0-S0926860X18305866-sc4.sml https://s3.amazonaws.com/prod-ucs-content-store-us-east/content/pii:S0926860X18305866/sc4/THUMBNAIL/image/gif/3bcc081f023ff89b7a4995d21767a582/sc4.sml sc4 sc4.sml sml 2156 35 219 IMAGE-THUMBNAIL 1-s2.0-S0926860X18305866-sc5.sml https://s3.amazonaws.com/prod-ucs-content-store-us-east/content/pii:S0926860X18305866/sc5/THUMBNAIL/image/gif/0f23f35a12d041eb5ecc882d813f774e/sc5.sml sc5 sc5.sml sml 2806 55 219 IMAGE-THUMBNAIL 1-s2.0-S0926860X18305866-sc6.sml https://s3.amazonaws.com/prod-ucs-content-store-us-east/content/pii:S0926860X18305866/sc6/THUMBNAIL/image/gif/bbeb2d762acd55261e0730733d71d291/sc6.sml sc6 sc6.sml sml 6457 151 219 IMAGE-THUMBNAIL 1-s2.0-S0926860X18305866-sc7.sml https://s3.amazonaws.com/prod-ucs-content-store-us-east/content/pii:S0926860X18305866/sc7/THUMBNAIL/image/gif/cde481851fa1d17b888f461e9b51e561/sc7.sml sc7 sc7.sml sml 3190 54 219 IMAGE-THUMBNAIL 1-s2.0-S0926860X18305866-ga1.jpg https://s3.amazonaws.com/prod-ucs-content-store-us-east/content/pii:S0926860X18305866/ga1/DOWNSAMPLED/image/jpeg/2f5da93b39c14ab9bf4ebc8de5ae8d88/ga1.jpg ga1 true ga1.jpg jpg 24148 200 426 IMAGE-DOWNSAMPLED 1-s2.0-S0926860X18305866-gr1.jpg https://s3.amazonaws.com/prod-ucs-content-store-us-east/content/pii:S0926860X18305866/gr1/DOWNSAMPLED/image/jpeg/efd77b2ed0affb2e914abc8cde25ed34/gr1.jpg gr1 gr1.jpg jpg 13826 222 376 IMAGE-DOWNSAMPLED 1-s2.0-S0926860X18305866-gr2.jpg https://s3.amazonaws.com/prod-ucs-content-store-us-east/content/pii:S0926860X18305866/gr2/DOWNSAMPLED/image/jpeg/a84f158a0c8f66b6300495abdd2da977/gr2.jpg gr2 gr2.jpg jpg 13331 217 376 IMAGE-DOWNSAMPLED 1-s2.0-S0926860X18305866-gr3.jpg https://s3.amazonaws.com/prod-ucs-content-store-us-east/content/pii:S0926860X18305866/gr3/DOWNSAMPLED/image/jpeg/be7c4148c41755685a14cb2f0b771ac5/gr3.jpg gr3 gr3.jpg jpg 21850 291 301 IMAGE-DOWNSAMPLED 1-s2.0-S0926860X18305866-gr4.jpg https://s3.amazonaws.com/prod-ucs-content-store-us-east/content/pii:S0926860X18305866/gr4/DOWNSAMPLED/image/jpeg/9dcee8a5321b5777a163366d18942fa2/gr4.jpg gr4 gr4.jpg jpg 39192 407 659 IMAGE-DOWNSAMPLED 1-s2.0-S0926860X18305866-gr5.jpg https://s3.amazonaws.com/prod-ucs-content-store-us-east/content/pii:S0926860X18305866/gr5/DOWNSAMPLED/image/jpeg/5bd5654e6cf477a82addacb697e76893/gr5.jpg gr5 gr5.jpg jpg 11680 208 339 IMAGE-DOWNSAMPLED 1-s2.0-S0926860X18305866-sc1.jpg https://s3.amazonaws.com/prod-ucs-content-store-us-east/content/pii:S0926860X18305866/sc1/DOWNSAMPLED/image/jpeg/d4d23737e4ca19911751f728e0c26a95/sc1.jpg sc1 sc1.jpg jpg 5084 54 376 IMAGE-DOWNSAMPLED 1-s2.0-S0926860X18305866-sc2.jpg https://s3.amazonaws.com/prod-ucs-content-store-us-east/content/pii:S0926860X18305866/sc2/DOWNSAMPLED/image/jpeg/3ed198ce32f61b8473814bf01842d169/sc2.jpg sc2 sc2.jpg jpg 10929 93 565 IMAGE-DOWNSAMPLED 1-s2.0-S0926860X18305866-sc3.jpg https://s3.amazonaws.com/prod-ucs-content-store-us-east/content/pii:S0926860X18305866/sc3/DOWNSAMPLED/image/jpeg/a69746f60502cbb54c20cc2dffc24f0f/sc3.jpg sc3 sc3.jpg jpg 10865 124 301 IMAGE-DOWNSAMPLED 1-s2.0-S0926860X18305866-sc4.jpg https://s3.amazonaws.com/prod-ucs-content-store-us-east/content/pii:S0926860X18305866/sc4/DOWNSAMPLED/image/jpeg/35a93d22e9dc360fc437149e51c0ce5c/sc4.jpg sc4 sc4.jpg jpg 9945 98 602 IMAGE-DOWNSAMPLED 1-s2.0-S0926860X18305866-sc5.jpg https://s3.amazonaws.com/prod-ucs-content-store-us-east/content/pii:S0926860X18305866/sc5/DOWNSAMPLED/image/jpeg/85aa2c2b58f21a9bc5c69929f6866a4e/sc5.jpg sc5 sc5.jpg jpg 15283 141 565 IMAGE-DOWNSAMPLED 1-s2.0-S0926860X18305866-sc6.jpg https://s3.amazonaws.com/prod-ucs-content-store-us-east/content/pii:S0926860X18305866/sc6/DOWNSAMPLED/image/jpeg/c8dfda595b1f8722c7bf093c2440637c/sc6.jpg sc6 sc6.jpg jpg 28431 324 470 IMAGE-DOWNSAMPLED 1-s2.0-S0926860X18305866-sc7.jpg https://s3.amazonaws.com/prod-ucs-content-store-us-east/content/pii:S0926860X18305866/sc7/DOWNSAMPLED/image/jpeg/0f6947471b0a2daf79597260afc76489/sc7.jpg sc7 sc7.jpg jpg 16479 140 565 IMAGE-DOWNSAMPLED 1-s2.0-S0926860X18305866-ga1_lrg.jpg https://s3.amazonaws.com/prod-ucs-content-store-us-east/content/pii:S0926860X18305866/ga1/HIGHRES/image/jpeg/d80869f0505c895df5b47278737a5015/ga1_lrg.jpg ga1 true ga1_lrg.jpg jpg 167762 886 1885 IMAGE-HIGH-RES 1-s2.0-S0926860X18305866-gr1_lrg.jpg https://s3.amazonaws.com/prod-ucs-content-store-us-east/content/pii:S0926860X18305866/gr1/HIGHRES/image/jpeg/c37f51b26213d0eb711478b90b71e93c/gr1_lrg.jpg gr1 gr1_lrg.jpg jpg 92409 984 1667 IMAGE-HIGH-RES 1-s2.0-S0926860X18305866-gr2_lrg.jpg https://s3.amazonaws.com/prod-ucs-content-store-us-east/content/pii:S0926860X18305866/gr2/HIGHRES/image/jpeg/84108c44a7297d82cc38d5ee16d80434/gr2_lrg.jpg gr2 gr2_lrg.jpg jpg 89675 962 1667 IMAGE-HIGH-RES 1-s2.0-S0926860X18305866-gr3_lrg.jpg https://s3.amazonaws.com/prod-ucs-content-store-us-east/content/pii:S0926860X18305866/gr3/HIGHRES/image/jpeg/614de291363a5821aeba891d8d20dbf7/gr3_lrg.jpg gr3 gr3_lrg.jpg jpg 181047 1289 1333 IMAGE-HIGH-RES 1-s2.0-S0926860X18305866-gr4_lrg.jpg https://s3.amazonaws.com/prod-ucs-content-store-us-east/content/pii:S0926860X18305866/gr4/HIGHRES/image/jpeg/17c5cc96b8bcc5ed12aca8aefcc90654/gr4_lrg.jpg gr4 gr4_lrg.jpg jpg 272828 1801 2917 IMAGE-HIGH-RES 1-s2.0-S0926860X18305866-gr5_lrg.jpg https://s3.amazonaws.com/prod-ucs-content-store-us-east/content/pii:S0926860X18305866/gr5/HIGHRES/image/jpeg/0de634390e4af874893bd55f57d88d0d/gr5_lrg.jpg gr5 gr5_lrg.jpg jpg 78345 920 1500 IMAGE-HIGH-RES 1-s2.0-S0926860X18305866-sc1_lrg.jpg https://s3.amazonaws.com/prod-ucs-content-store-us-east/content/pii:S0926860X18305866/sc1/HIGHRES/image/jpeg/a597766b527b05177edaa2144baf089c/sc1_lrg.jpg sc1 sc1_lrg.jpg jpg 34187 239 1667 IMAGE-HIGH-RES 1-s2.0-S0926860X18305866-sc2_lrg.jpg https://s3.amazonaws.com/prod-ucs-content-store-us-east/content/pii:S0926860X18305866/sc2/HIGHRES/image/jpeg/511a1e9b9a0b020bfe2f7fcb93328907/sc2_lrg.jpg sc2 sc2_lrg.jpg jpg 76961 411 2500 IMAGE-HIGH-RES 1-s2.0-S0926860X18305866-sc3_lrg.jpg https://s3.amazonaws.com/prod-ucs-content-store-us-east/content/pii:S0926860X18305866/sc3/HIGHRES/image/jpeg/177ccb60600cc1abd636ffbd342a0296/sc3_lrg.jpg sc3 sc3_lrg.jpg jpg 70234 549 1333 IMAGE-HIGH-RES 1-s2.0-S0926860X18305866-sc4_lrg.jpg https://s3.amazonaws.com/prod-ucs-content-store-us-east/content/pii:S0926860X18305866/sc4/HIGHRES/image/jpeg/001ba9d673cdd34c190d6ea03c018e47/sc4_lrg.jpg sc4 sc4_lrg.jpg jpg 69657 432 2667 IMAGE-HIGH-RES 1-s2.0-S0926860X18305866-sc5_lrg.jpg https://s3.amazonaws.com/prod-ucs-content-store-us-east/content/pii:S0926860X18305866/sc5/HIGHRES/image/jpeg/acf0cb3e9e40865d05c3689b790581ed/sc5_lrg.jpg sc5 sc5_lrg.jpg jpg 107724 623 2500 IMAGE-HIGH-RES 1-s2.0-S0926860X18305866-sc6_lrg.jpg https://s3.amazonaws.com/prod-ucs-content-store-us-east/content/pii:S0926860X18305866/sc6/HIGHRES/image/jpeg/3de5d4b3487a871d71a4c496ea63176e/sc6_lrg.jpg sc6 sc6_lrg.jpg jpg 215405 1434 2083 IMAGE-HIGH-RES 1-s2.0-S0926860X18305866-sc7_lrg.jpg https://s3.amazonaws.com/prod-ucs-content-store-us-east/content/pii:S0926860X18305866/sc7/HIGHRES/image/jpeg/bbf416c695bf1538bb6bb372d67e497e/sc7_lrg.jpg sc7 sc7_lrg.jpg jpg 119045 619 2500 IMAGE-HIGH-RES 1-s2.0-S0926860X18305866-mmc1.pdf https://s3.amazonaws.com/prod-ucs-content-store-us-east/content/pii:S0926860X18305866/mmc1/MAIN/application/pdf/32b78a12afb654dd71b8cecd4bbfd6eb/mmc1.pdf mmc1 mmc1.pdf pdf false 2175145 APPLICATION 1-s2.0-S0926860X18305866-si1.gif https://s3.amazonaws.com/prod-ucs-content-store-us-east/content/pii:S0926860X18305866/STRIPIN/image/gif/49a4112af805e1566387bf54d288c016/si1.gif si1 si1.gif gif 199 37 41 ALTIMG 1-s2.0-S0926860X18305866-si10.gif https://s3.amazonaws.com/prod-ucs-content-store-us-east/content/pii:S0926860X18305866/STRIPIN/image/gif/3c8f9fbb11a10f857c6f5885715798eb/si10.gif si10 si10.gif gif 364 30 91 ALTIMG 1-s2.0-S0926860X18305866-si11.gif https://s3.amazonaws.com/prod-ucs-content-store-us-east/content/pii:S0926860X18305866/STRIPIN/image/gif/536254265bf85e680a3272b89d1751c8/si11.gif si11 si11.gif gif 272 30 62 ALTIMG 1-s2.0-S0926860X18305866-si12.gif https://s3.amazonaws.com/prod-ucs-content-store-us-east/content/pii:S0926860X18305866/STRIPIN/image/gif/ece05dbe583d9e89155d59e13cb964c3/si12.gif si12 si12.gif gif 172 31 47 ALTIMG 1-s2.0-S0926860X18305866-si13.gif https://s3.amazonaws.com/prod-ucs-content-store-us-east/content/pii:S0926860X18305866/STRIPIN/image/gif/9d9cc9b3c06f3c812dee96b04082641b/si13.gif si13 si13.gif gif 1530 33 483 ALTIMG 1-s2.0-S0926860X18305866-si14.gif https://s3.amazonaws.com/prod-ucs-content-store-us-east/content/pii:S0926860X18305866/STRIPIN/image/gif/72a1fa8cd98f57d5d0316e3b2600fb84/si14.gif si14 si14.gif gif 1334 52 275 ALTIMG 1-s2.0-S0926860X18305866-si15.gif https://s3.amazonaws.com/prod-ucs-content-store-us-east/content/pii:S0926860X18305866/STRIPIN/image/gif/83d16c7b3a39f918ba30a3a9aeb00a97/si15.gif si15 si15.gif gif 1607 55 354 ALTIMG 1-s2.0-S0926860X18305866-si16.gif https://s3.amazonaws.com/prod-ucs-content-store-us-east/content/pii:S0926860X18305866/STRIPIN/image/gif/a362e1f97d36cdd9e9451625951a36d6/si16.gif si16 si16.gif gif 527 42 145 ALTIMG 1-s2.0-S0926860X18305866-si2.gif https://s3.amazonaws.com/prod-ucs-content-store-us-east/content/pii:S0926860X18305866/STRIPIN/image/gif/97fcda318bc36da6b611715fbffb9984/si2.gif si2 si2.gif gif 206 37 43 ALTIMG 1-s2.0-S0926860X18305866-si3.gif https://s3.amazonaws.com/prod-ucs-content-store-us-east/content/pii:S0926860X18305866/STRIPIN/image/gif/e0cfe9e4ea7dea03531cd55a7711abf8/si3.gif si3 si3.gif gif 508 31 137 ALTIMG 1-s2.0-S0926860X18305866-si4.gif https://s3.amazonaws.com/prod-ucs-content-store-us-east/content/pii:S0926860X18305866/STRIPIN/image/gif/2fa2d725896122ad7f13d996cf8870f9/si4.gif si4 si4.gif gif 291 27 69 ALTIMG 1-s2.0-S0926860X18305866-si5.gif https://s3.amazonaws.com/prod-ucs-content-store-us-east/content/pii:S0926860X18305866/STRIPIN/image/gif/d70489f36516da6ac8689fa875fc46a0/si5.gif si5 si5.gif gif 440 31 109 ALTIMG 1-s2.0-S0926860X18305866-si6.gif https://s3.amazonaws.com/prod-ucs-content-store-us-east/content/pii:S0926860X18305866/STRIPIN/image/gif/87b0a30ca60eab85236c3d80b61d575a/si6.gif si6 si6.gif gif 410 31 101 ALTIMG 1-s2.0-S0926860X18305866-si7.gif https://s3.amazonaws.com/prod-ucs-content-store-us-east/content/pii:S0926860X18305866/STRIPIN/image/gif/549a8d1490fe149e2dd5961d521db88d/si7.gif si7 si7.gif gif 241 37 48 ALTIMG 1-s2.0-S0926860X18305866-si8.gif https://s3.amazonaws.com/prod-ucs-content-store-us-east/content/pii:S0926860X18305866/STRIPIN/image/gif/dc6cbd3568cebaff67e569aca69fdba3/si8.gif si8 si8.gif gif 183 33 36 ALTIMG 1-s2.0-S0926860X18305866-si9.gif https://s3.amazonaws.com/prod-ucs-content-store-us-east/content/pii:S0926860X18305866/STRIPIN/image/gif/7977dcf6c75113d2519b2ded2c4700c7/si9.gif si9 si9.gif gif 166 31 32 ALTIMG 1-s2.0-S0926860X18305866-am.pdf https://s3-eu-west-1.amazonaws.com/prod-ucs-content-store-eu-west/content/egi:10LDM7P55JG/MAIN/application/pdf/37606ece7961f539d8444012abea1bc8/am.pdf https://s3.amazonaws.com/prod-ucs-content-store-us-east/content/egi:10LDM7P55JG/MAIN/application/pdf/37606ece7961f539d8444012abea1bc8/am.pdf am am.pdf pdf false 1025921 AAM-PDF APCATA 16900 S0926-860X(18)30586-6 10.1016/j.apcata.2018.11.031 Elsevier B.V. Scheme 1 Reduction of acetophenone via the catalysed hydrogen transfer from isopropanol. Scheme 1 Scheme 2 Structures of NPN and NNN precursor ligands used in this study for the preparation of Ru-based hydrogen transfer catalysts. Scheme 2 Scheme 3 Structures of Ru pre-catalysts known to effect ketone and imine hydrogenation. Scheme 3 Scheme 4 Novel procedure for the preparation of complex (8). Scheme 4 Scheme 5 Synthesis of complexes (9) and (10). Scheme 5 Scheme 6 Structures of well-defined ruthenium TH catalysts referred to in Table 3. Scheme 6 Scheme 7 Structures of NPN ligands used to form in situ ruthenium TH catalysts, as referred to in Table 3. Scheme 7 Fig. 1 Reaction profiles for the transfer hydrogenation of acetophenone using Ru complexes formed in situ from ligands (1–4), including [RuCl2(PPh3)3] for reference. General conditions: [Ru complex] = 5.0 × 10−4 M, [KO t Bu] = 1.0 × 10-2 M, [acetophenone] = 0.10 M; [iPrOH] = 12.9 M; temperature 329 K; N2 atmosphere. Ligand (1), (●); ligand (2), (▲); ligand (3), (■); ligand (4), (○); no ligand, (□). Fig. 1 Fig. 2 Reaction profiles for the transfer hydrogenation of acetophenone using Ru complexes synthesized using complexes (5–8), including [RuCl2(PPh3)3] for comparison. General conditions: [Ru complex] = 5.0 × 10−4 M, [KO t Bu] = 1.0 × 10-2 M, [acetophenone] = 0.10 M; [iPrOH] = 12.9 M; temperature 329 K; N2 atmosphere. Complex (5), (▲); complex (6), (■); complex (7), (□); complex (8), (●); [RuCl2(PPh3)3], (○). Fig. 2 Fig. 3 A view of one of the crystallographically independent complex molecules of [Ru(1)(PPh3)Cl2], (10), showing the atom numbering scheme; H atoms are omitted for clarity. Fig. 3 Fig. 4 Reaction profiles for the yield of 1-phenylethanol resulting from the transfer hydrogenation of acetophenone at 329 K in a nitrogen atmosphere using complex (9) (Fig. 4A); complex (5) (Fig. 4B); and complex (10) (Fig. 4C). Initial concentrations: [Ru complex] = 4.6 × 10−4 M, [KO t Bu] = 1.0 × 10-2 M, [acetophenone] = 1.1 M, [iPrOH] = 11.3 M, [acetone] = [1-phenylethanol] = 0 (△). Product inhibition experiments: additional to initial concentrations [acetone] = 0.2 M (⬜); [1-phenylethanol] = 0.2 M (◇). Fig. 4 Fig. 5 Experimental data for the yield of 1-phenylethanol resulting from the transfer hydrogenation of acetophenone at 329 K in a nitrogen atmosphere using complex (9) (○); complex (5) (⬜); and complex (10) (◇). Predicted reaction profiles are given as solid lines. Initial concentrations: [Ru complex] = 4.6 × 10−4 M, [KO t Bu] = 1.0 × 10-2 M, [acetophenone] = 1.1 M, [iPrOH] = 11.3 M, [acetone] = [1-phenylethanol] = 0 (△). Fig. 5 Table 1 Selected bond lengths [Å] and angles [°] for [Ru(1)(PPh3)Cl2], (10). Table 1 Bond length Bond Angle Ru1-N1 2.118(2) Cl1-Ru1-Cl2 91.59(3) Ru1-N2 2.185(3) P1-Ru1-P2 100.85(3) Ru1-Cl1 2.4917(7) N1-Ru1-N2 87.07(11) Ru1-Cl2 2.4549(7) P1-Ru1-N2 91.16(8) Ru1-P1 2.2399(8) P1-Ru1-N1 93.90(7) Ru1-P2 2.3181(8) P2-Ru1-Cl1 89.88(3) Cl1-Ru1-N1 83.96(7) Cl1-Ru1-N2 78.06(7) Table 2 Transfer hydrogenation kinetic coefficients estimated from kinetic model and model-determined equilibrium constants for experiments with no product addition (benchmark). Table 2 Complex (10) k f 1 0.93 +/− 0.28 k f 2 37 +/− 19 k f 2 / k f 1 40 Complex (5) k f 1 5.1 +/− 1.5 k f 2 36 +/− 22 k f 2 / k f 1 7.0 Complex (9) k f 1 4200 +/− 2300 k f 2 140,000 +/− 90,000 k f 2 / k f 1 33 Table 3 A comparison of selected ruthenium pre-catalysts for the TH of acetophenone. Table 3 Catalyst Ru:B:S T (°C) Time Conv. (%) TOF (hr−1) Ref 1 (11) 1:10,000:20 × 106 90 15 hr 90 1.2 × 106 [43] 2 (12) 1:400:20,000 82 5 min 98 1.1 × 106 * [8] 3 (13) 1:20:2,000 82 10 s 98 705,600 [21] 4 (9) 1:20:1,000 82 30-40s 95 85,500-114,000 [23] 5 (9) 1:20:2,300 56 1 min15 min 5574 76,5006,860 This work 6 (5) 1:20:2,300 56 1 min15 min 5.620.9 7,7201,920 This work 7 (10) 1:20:2,300 56 1 min15 min 2.56.8 3,540642 This work 8 (14) 1:24:1,000 82 30 s15 min 58.588 70,2003,520 [47] 9 (15) 1:24:200 82 30 min1 hr 9598 380196 [48] 10 (16) + [RuCl2(C6H6)]2 1:15:100 23 24 hr 96.0 4 [49] 11 (17) + [RuCl2(C6H6)]2 1:15:100 80 12 min 72 360 [50] 12 (18) + [RuCl2(C6H6)]2 1:15:100 80 1 hr 92 92 [50] 13 (19) + [RuCl2(C6H6)]2 1:15:100 80 48 94 2 [50] *TOF calculated at 50% conversion. Rapid transfer hydrogenation of acetophenone using ruthenium catalysts bearing commercially available and readily accessible nitrogen and phosphorous donor ligands Drew J. Braden a Renan Cariou b John W. Shabaker a Russell A. Taylor b ⁎ 1 a BP Products North America, 150 W. Warrenville Rd., Naperville, IL, 60563 USA BP Products North America 150 W. Warrenville Rd Naperville IL 60563 USA b BP Chemicals, Saltend, Hull, HU12 8DS, United Kingdom BP Chemicals Saltend Hull HU12 8DS United Kingdom ⁎ Corresponding author. 1 Current address: Department of Chemistry, Durham University, South Road, Durham, DH1 3LE, United Kingdom. Graphical abstract The screening, synthesis and testing of Ru complexes generated from commercially available ligands or ligands that can be synthesised in one step, is described. The catalysts were tested for activity in the transfer hydrogenation of acetophenone by isopropanol, a probe reaction for hydrogen transfer processes between oxygenated species, often found in applications such as biomass upgrading and fine and specialty chemical synthesis. Ligand screening was conducted by in situ catalyst generation and examined NPN and NNN pincer type ligands bearing NH or CN functional groups. The most active transfer hydrogenation catalysts were found to be those bearing NH functionality, either as amino groups or as benzimidazole groups. Well-defined catalyst precursors were subsequently synthesised, including the novel complex [Ru(1)PPh3(Cl)2] (where (1) = bis(3-aminopropyl)phenylphosphine), the first reported Ru complex for this NPN ligand. Established (PN)2 and PP/NN ketone hydrogenation catalysts were also screened for transfer hydrogen capability, of which [Ru(PhPN)2Cl2] (where PhPN = 2-(diphenylphosphino)ethylamine) was the most active. Subsequently, [Ru(1)PPh3(Cl)2], [Ru(PhPN)2Cl2] and [Ru(4)(PPh3)2Cl][Cl] (where (4) = 2,6-bis(2-benzimidazolyl)pyridine) were investigated more closely to compare rate constants (determined by reaction profile regression analysis) as a more accurate measure of catalyst activity over commonly reported turn over frequencies (TOF). The effect of the reaction products on the catalyst activity was evaluated using feed spiking experiments. Catalyst deactivation was shown to be prevalent and subsequently incorporated into a simple kinetic model which enabled more accurate reaction profile fitting and provided rate constants for both the transfer hydrogenation step and deactivation reaction. Keywords Transfer hydrogenation Ruthenium Homogeneous catalysis Pincer ligands Reaction kinetics Nomenclature [ 1 - P h e n y l e t h a n o l ] Concentration of 1-phenylethanol, mol L−1 [ A c e t o n e ] Concentration of acetone, mol L−1 [ A c e t o p h e n o n e ] Concentration of acetophenone, mol L−1 [ I s o p r o p a n o l ] Concentration of isopropanol, mol L−1 K e q 1 Overall equilibrium constant for transfer hydrogenation k f Forward rate constant for transfer hydrogenation, L mol−1 min−1 k r Reverse rate constant for transfer hydrogenation, L mol−1 min−1 k f 1 Forward rate constant for transfer hydrogenation, L mol−1 min−1 k f 2 Rate constant for catalyst deactivation, L mol−1 min−1 R 1 - P h E t O H Overall rate of 1-phenylethanol production, mol L−1 min−1 R d e a c t . Rate of catalyst deactivation, mol L−1 min−1 1 Introduction Selective hydrogenation of carbonyl groups (CO) is a broad field with applications across many industries, especially the fine, specialty, and renewable chemicals industries. Transfer hydrogenation (TH) of ketones to alcohols by homogeneous Ru complexes in isopropanol is a synthetically practical and important probe reaction for such reduction processes in both academic and industrial laboratories [1–4]. Scheme 1 shows the reduction of acetophenone to 1-phenylethanol by isopropanol. Using isopropanol (iPrOH) as the reducing equivalent avoids the time consuming and waste-producing work-up procedures associated with sodium borohydride reductions, and the hazards and costs of high pressure equipment needed for hydrogenation using molecular hydrogen [5]. Consequently, transfer hydrogenation can be considered a practical, green and safe reduction method. A variety of mechanisms for Ru-based transfer hydrogenation have been proposed that include both inner sphere and outer sphere (ligand assisted) mechanisms [6,7]. By changing the ligand architecture, remarkable improvements to the activity of Ru based transfer hydrogenation catalysts have been made. Of particular note, some of the CNN ruthenium complexes reported by the Baratta group give TOFs on the order of millions (hr−1) [8]. However, construction of Baratta’s ligand scaffold is a multistep synthesis [9] (as is commonly the case for highly active transfer hydrogenation complexes) and that is not always practical from an industrial perspective. Therefore the development of easily synthesised Ru complexes with very high TOF for transfer hydrogenation is still an important goal. Moreover, the greatest focus of research in transfer hydrogenation catalysis to date has been in the area of asymmetric transfer hydrogenation, while somewhat neglecting the common non-chiral analogue. Herein we report our initial efforts to develop Ru-based transfer hydrogenation catalysts of synthetic utility to the industrial research community. The present work describes the screening, synthesis and testing of Ru complexes for the transfer hydrogenation of acetophenone using isopropanol as both reducing agent and solvent. The synthesis and characterisation of a novel NPN complex is described. To differentiate the activity of the Ru complexes better than standard initial rate approximations (TOF), a kinetic model was developed and used to calculate the reaction rate constants. 2 Experimental 2.1 General considerations All experiments were conducted under N2 using Schlenk line and other inert atmosphere techniques. All ligands, complexes, solid reagents and NMR solvents were stored in a N2 filled glovebox. Acetophenone was stirred over CaH2 overnight, distilled under reduced pressure and stored under N2 in a foil wrapped ampoule in a refrigerator. Toluene, triethylamine and isopropanol were dried over CaH2 overnight, distilled and subsequently stored under N2 in an ampoule containing 4 Å molecular sieves. NMR solvents were used as received. The following compounds were purchased from commercial sources and used as received and without characterisation: bis(3-aminopropyl)phenylphosphine (Alfa Aesar); 2,6-bis(2-benzimidazolyl)pyridine, [RuCl2(PPh3)3], acetophenone, CaH2 (Sigma Aldrich); [Ru(iPrPN)2Cl2], [Ru(PhPN)2Cl2] and [Ru(tBuPN)2Cl2] (Strem); 2,3-dimethyl-2,3-butanediamine dihydrochloride (TCI Europe). The following compounds were prepared according to literature procedures: N,N-bis(1H-benzimidazol-2-ylmethyl)-N-amine [10], 2,6-bis-[1-(2-methylphenylimino)ethylpyridine [11], and [RuClH(PPh3)3•toluene] [12]. NMR spectra were recorded using a Bruker 300 MHz spectrometer. The 1H NMR and 13C NMR chemical shifts were referenced to the residual protio impurity and 13C signal of the deuterated solvent respectively. Elemental analyses were carried out on an Exeter Analytical CE440 elemental analyser. Gas chromatography (GC) analysis was conducted on an Agilent 7890 A instrument equipped with an Agilent 19091J-413 column (HP-5 5% Phenyl Methyl Siloxane 300 m x 320 μm x 0.25 μm) using the following method: injection volume: 1.0 μL, He carrier gas, Split Ratio: 25:1, Flow rate: 50 mL/min, FID detector temperature: 250 °C; Temperature program: starting temperature; 50 °C (hold for 6 min.), ramp 5 °C/min to 100 °C, ramp 10 °C/min to 240 °C. Elution time: 1-phenylethanol 14.82 min, acetophenone 14.95 min. X-ray data were recorded on an Oxford Diffraction Gemini A Ultra diffractometer at 150 K using Mo K λ radiation (λ = 0.71073 Å), and were corrected for absorption based on multiple and symmetry-equivalent reflections. The structure was solved and refined with programs of the SHELX family. Selected crystal data: C30H36Cl2N2P2Ru·2CH2Cl2, M r = 828.4, triclinic, space group P 1 ¯ , a = 12.4741(3), b = 17.2350(4), c = 17.4983(4) Å, α = 86.500(2), β = 73.931(2), γ = 81.568(2)°, V = 3575.04(14) Å3, Z = 4; 33,330 reflections measured, 14,936 unique (R int = 0.0275), 817 refined parameters, 15 restraints to assist refinement of disordered solvent molecules, R (F, F 2 > 2σ) = 0.0367, R w(F 2, all data) = 0.0881, goodness of fit (F 2) = 1.039, final difference map features between +0.94 and −1.38 e Å−3. 2.2 Synthesis of complexes 2.2.1 Complex [Ru(4)(PPh3)2Cl][Cl] (9) A Schlenk flask was loaded with [Ru(PPh3)3(Cl)2] (1.2156 g, 1.268 mmol) and 2,6-bis(2-benzimidazolyl)pyridine (4) (0.4088 g, 1.313 mmol), to which was added 25 ml of anhydrous toluene. The mixture was stirred in an oil bath at 110 °C, for two hours, during which time a red-brown precipitate had formed. The suspension was then stirred for 16 h at room temperature, after which time the solid was isolated via canula filtration and washed with 100 ml of anhydrous diethyl ether 3 times. The solid was dried under vacuum for 72 h. Isolated mass 1.07 g, 84% yield. NMR data - 1H NMR (d4-methanol, δ): 8.53 (m, 2 H), 7.60 (t, J = 8.0 Hz, 1 H), 7.40 (m, 8 H), 7.13 (m, 18H, PPh3), 6.88 (t, J = 7.7 Hz, 12H, PPh3), NH signals not observed due to rapid H/D exchange with CD3OD. 13C{1H} NMR (d4-methanol, δ): 152.7, 152.1, 144.1 and 135.7 (quaternary C), 134.4 (t, o-C of PPh3), 133.3 (aromatic CH), 132.4 (t, i-C of PPh3),130.4 (s, p-C of PPh3), 128.8 (t, m-C of PPh3), 126.8, 124.5, 122.9, 122.1 and 113.6 (aromatic CH). 31P{1H} NMR (d4-methanol, δ): 22.1 (s). Elemental analysis calculated (%) for C55H43Cl2N5P2Ru: C 65.54, H 4.30, N 6.95; found: C 65.40, H 4.42, N 7.03. Product is soluble in methanol, poorly soluble in ethanol, but insoluble in acetone, acetonitrile and dichloromethane. A d4-MeOH NMR sample exposed to air was observed to form crystals after 3 h. However, no decomposition signals were observed in the NMR spectrum. A sample of the solid exposed to air for 2 h and returned to the glove box was analysed by NMR; new unassigned signals appeared in both the 1H and 31P NMR spectra. 2.2.2 Complex [Ru(1)PPh3(Cl)2] (10) A Schlenk flask was loaded with [Ru(PPh3)3(Cl)2] (2.0270 g, 2.114 mmol) and bis(3-aminopropyl)phenylphosphine (1) (0.4816 g, 2.147 mmol), to which was added 17 ml of anhydrous toluene to generate a yellow suspension. The mixture was stirred in an oil bath at 110 °C, for two hours. The yellow suspension was then stirred for 16 h at room temperature, after which time the solid was isolated via canula filtration and washed with 100 ml of anhydrous diethyl ether 3 times. The solid was dried under vacuum for 72 h. Isolated mass 1.20 g, 86% yield. NMR data - 1H NMR (CDCl3, δ): 7.71 (m with appearance of t, 6 H) 7.43 (m with appearnce of t, 2 H), 7.14-6.94 (m, 10 H), 6.88 (m with appearance of t, 2 H) 4.25, (br, 2H, NH), 3.39 (br, 2H, NH and CH), 3.08 (br, 1H, CH), 2.23-1.81 (m, 10H, 9CH and NH), 0.68 (br, 1H, CH). 13C{1H} NMR (CDCl3, δ): 138.7 (d, i-C of PPh), 137.0 (d, i-C of PPh3), 134.0 (d, o-C of PPh3), 131.2 (d, o-C of PPh), 128.4 (s, p-C of PPh3), 128.2 (s, p-C of PPh), 127.7 (d, m-C of PPh), 127.5 (d, m-C of PPh3), 42.3, 40.5, 33.3 (d, 1 J PC = 26.9 Hz), 27.9 (d, 1 J PC = 27.8 Hz), 26.1, 25.4. 31P{1H} NMR (CDCl3, δ): 48.8 (d, 2 J PP = 34 Hz), 32.65 (d, 2 J PP = 34 Hz). Elemental analysis calculated (%) for C30H36Cl2N2P2Ru: C 53.93, H 5.51, N 4.25; found: C 53.72, H 5.51, N 4.52 Product is soluble in dichloromethane and chloroform, but insoluble in methanol, ethanol, isopropanol and acetonitrile. The product is air sensitive in solution, turning green on exposure to air. A sample of the solid exposed to air for 2 h and returned to the glove box was analysed by NMR; no new unassigned signals were observed in either the 1H or 31P NMR spectra. Single crystals of [Ru(1)PPh3(Cl)2] were grown by layering hexane onto a DCM solution of the complex to enable slow diffusion of the solvents. 2.3 General procedure for transfer hydrogenation of acetophenone In a glovebox, a Schlenk flask was loaded with the ruthenium complex and ligand (as necessary) and an additional Schlenk flask was loaded with KOtBu. Separate stock solutions of acetophenone and KOtBu in isopropanol were prepared. The acetophenone solution was added to the flasks containing the ruthenium complexes and allowed to stir for 10 min before being immersed in an oil bath set to 65 °C (the temperature of the reaction solution was measured to be 56 °C, the boiling point of acetone). This reaction temperature was chosen rather than the standard 82 °C (boiling point of isopropanol) to reduce the loss of acetone which would affect the equilibrium position. After 10 min, the reaction was initiated by addition of the KOtBu solution. The reaction progress was monitored by taking 0.3 ml samples via syringe, aerating the sample in the syringe 3 times to prevent any further reaction, and analysing the mixture by gas chromatography. Control experiments were undertaken to confirm that aeration of the samples did quench catalytic activity. 2.4 Kinetic modelling A general kinetic model for the transfer hydrogenation of acetophenone with isopropanol was developed using Athena Visual Work Bench (Version 14.2). The model used as inputs the initial concentrations of ruthenium complex, acetophenone, isopropanol, 1-phenylethanol, and acetone. Material balances for a batch reactor where solved using the built-in differential equation solver. The built-in nonlinear parameter estimation and statistical analysis package was used initially to estimate values for rate constants of the forward reaction of a reversible transfer hydrogenation step, k f 1 , and the rate constant for an irreversible catalyst deactivation step, k f 2 . The values of k f 1 and k f 2 were subsequently used in the differential equation solver of Matlab to predict the reaction profile for each catalyst run. The concentrations of acetophenone and 1-phenylethanol were used as model responses to be compared with experimental data. 3 Results and discussion From the outset, we aimed to develop catalysts that utilise commercially available ligands or ones easily prepared in one step from cheap reagents. For ruthenium mediated hydrogenation and transfer hydrogenation of unsaturated hydrocarbons with CO and CN groups, a metal bound NH bond within the ligand framework has proved to be a hugely successful strategy for developing effective catalysts [13] (though it should be noted that highly effective ruthenium transfer hydrogenation catalysts lacking a metal bound NH bond have been reported such as those by Plietker [14] and Stradiotto [15]). Therefore ligands bearing NH bonds or readily reducible imine groups were targets for this work. We identified compounds (1), (2) and (3), shown in Scheme 2 , as potential ligands for effective transfer hydrogenation. To the best of our knowledge, these ligands have not been utilised in ruthenium mediated transfer hydrogenation chemistry. Furthermore no ruthenium complexes of ligand (1) have been reported. Compounds (1) and (2) are commercially available, while compound (3) can be easily prepared from o-phenylenediamine and iminodiacetic acid in one step [10]. Reports on the coordination chemistry of (1) are very limited [16] and it has not been reported as a ligand in catalysis. Compound (2) has been extensively utilised as a ligand in iron oligomerisation catalysis [11,17]. Benzimidazole ligands can form highly effective ruthenium hydrogenation catalysts [18,19], and transfer hydrogenation catalysts [20–25] therefore bis-((2-benzimidazole)methyl)-amine (3) was chosen for transfer hydrogenation screening. Compound (3) has been utilised as a ligand in butadiene oligomerisation catalysis [10]. Furthermore, there is a single report of the related compound 2,6-bis(2-benzimidazole)-pyridine (4), which is commercially available, to form a ruthenium phosphine complex which is a highly efficient transfer hydrogenation catalyst [23]. Therefore compound (4) was included in this study for comparison purposes. 3.1 Transfer hydrogenation catalyst screening The potential for the compounds (1-4) to form transfer hydrogenation catalysts was explored by in-situ catalyst formation with [RuCl2(PPh3)3] for the transfer hydrogenation of acetophenone to 1-phenylethanol using isopropyl alcohol as the hydrogen donor. The reactions were benchmarked against [RuCl2(PPh3)3], a known transfer hydrogenation catalyst [26–28]. However, a more recent report indicates that under TH conditions, [RuCl2(PPh3)3] is actually a precursor for ruthenium nanoparticles that are the active TH species [29]. Upon activation of the TH catalysts via the addition of KOtBu, samples were collected over time and analysed for 1-phenylethanol production. Fig. 1 shows the observed 1-phenylethanol yields from acetophenone TH at 329 K using Ru catalysts formed from ligands (1-4) and [RuCl2(PPh3)3] for reference. Compounds (1), (3) and (4) resulted in active catalysts with comparable 1-phenylethanol yields at later residence times, all of which were greater than [RuCl2(PPh3)3], the Ru pre-catalyst. However, significant differences in initial turn-over-frequency (TOF) (trend (4) > (3) > (1)) were measured. Compound (2) resulted in a catalyst that is less active than the Ru pre-catalyst, [RuCl2(PPh3)3]. Additionally, as alkali bases are known to effect transfer hydrogenation in the absence of additional metals, [30,31] a ruthenium free benchmark was also conducted in order to ascertain the contribution of KOtBu towards the observed reactivity. KOtBu was observed to contribute a low level of activity (less than 1% 1-phenylethanol yield after 2 h) under the conditions employed (Figure S1). Therefore the contribution from the base was considered insignificant for the remainder of the studies. For comparison, additional well defined Ru complexes (Scheme 3 ) were tested under the same screening conditions. Complexes (5-7) are commercially available and are pre-catalysts for the hydrogenation of ketones (and imines) [32]. To the best of our knowledge, complexes (5-7) have not been reported as transfer hydrogenation catalysts. Complex (8) has been shown to be a pre-catalyst for the hydrogenation of acetophenone, during which studies it was noted to effect “slow” transfer hydrogenation of ketones in 2-propanol, though no further details were reported in the paper [33]. Complex (8) was synthesised by a new procedure: reacting the hydrochloride salt of the diamine NH2CMe2CMe2NH2 (tmen) with [Ru(H)(Cl)(PPh3)3] in tetrahydrofuran (THF) in the presence of 20 equivalents of triethylamine (Scheme 4 ) (see Supplementary Information for further details). A similar procedure has been reported in the patent literature for the synthesis of PN hydrogenation catalysts [34]. Fig. 2 shows the measured yields of 1-phenylethanol from acetophenone via TH at 329 K using Ru pre-catalysts (5-8) and [RuCl2(PPh3)3] for reference. Complex (5), where R = Ph, was significantly more active for the TH of acetophenone than the other pre-catalysts evaluated. Complexes (6) and (7), where R = i-Pr and R = t-Bu respectively, showed comparable activity with (6) being moderately more active. Complex (8) resulted in a catalyst with an activity similar to [RuCl2(PPh3)3]. The high transfer hydrogenation activity of catalysts derived from ligands (1), (3) and (4) in the presence of [RuCl2(PPh3)3] and also from pre-catalyst (5) encouraged us to study these materials further for the transfer hydrogenation of acetophenone. As such, attempts to synthesise well defined complexes derived from ligands (1), (3) and (4) were made so comparison of their reactivity could be made with complex (5). 3.2 Synthesis of complexes Complex [Ru(4)(PPh3)2Cl][Cl], (9), and novel complex [Ru(1)(PPh3)Cl2], (10), were successfully isolated by refluxing equimolar amounts of the ligand and [RuCl2(PPh3)3] in toluene, however, under analogous conditions no discernible products could be isolated from the reaction of (2) and [RuCl2(PPh3)3] (Scheme 5 ). Complex [Ru(4)(PPh3)2Cl][Cl], (9), has been previously synthesised by refluxing (4) with [RuCl2(PPh3)3] in methanol [23,35]. However, no 31P or 13C NMR data have been reported. Furthermore, we have found the reported 1H NMR data [36] for (9) to be erroneous due to ligand displacement by the NMR solvent used, (CD3)2SO (see Supplementary Information, Figure S5). Therefore complex (9) and novel complex (10) were both characterised by elemental analyses, 1H, 13C and 31P NMR spectroscopy. Complex (10) was also characterised in the solid state by X-ray crystallography. The solid state structure of complex (9) has been previously reported [35]. Fig. 3 shows a view of one of the crystallographically independent molecules of complex (10) while Table 1 gives a summary of the key crystallographic data. The asymmetric unit consists of two chemically identical but crystallographically independent ruthenium-centred complexes and four molecules of dichloromethane. The tridentate ligand has a fac arrangement in the distorted octahedral Ru coordination. The two chloro ligands are mutually cis, and the triphenylphosphine ligand lies trans to one N atom and cis to the other donor atoms (N and P) of the tridentate ligand. Complex (9) exhibits a singlet in the 31P{1H} NMR spectrum (Figure S8) as expected for a trans bis-phosphine complex. The 31P{1H} NMR spectrum of complex (10) (Figure S3) exhibits two doublets with 2 J PP = 34 Hz indicative of a cis bis-phosphine complex. 1H and 13C{1 H} NMR spectra for complexes (9) and (10) (Figures S2, S4, S6 and S7) match the proposed structures and will therefore not be discussed further. 3.3 Reaction kinetics of highly active transfer hydrogenation catalysts The catalytic activity of new homogeneous catalysts is very often reported in the form of turnover frequency (TOF), usually with the units molprod. mol−1 cat.hr−1. This value is commonly determined from a single experimental data point derived after a set, elapsed period of time in the catalytic test. However this routine method of catalyst evaluation is not appropriate for equilibrium controlled reactions and/or highly active catalysts (see supplementary information for a fuller discussion). To make more accurate activity evaluations of complexes (5), (9) and (10) using our batch reactions, additional studies were undertaken to conduct regression analysis of reaction profiles (with limited data points) to give an estimate of the reaction rate constants. Conditions similar to those employed for the screening runs described above were used, however, due to the high TOF observed during screening, reactions were run using lower catalyst concentrations relative to the substrate and aliquots of the reaction mixture were initially taken at very short time intervals. To rule out the possibility of any of the complexes being active for transfer hydrogenation in the absence of base, samples were also taken prior to the addition of KOtBu. It should be noted that the concentration of base has been observed to affect the observed rate of reaction in Ru mediated TH reactions, particularly where low ratios of base to Ru (B/Ru) are employed. [28,37,38] This is exemplified by Baratta’s study which showed that increasing the B/Ru ratio resulted in increasing reaction rates up to B/Ru = 10 [39]. Additionally, in order to investigate possible inhibition effects of the products, separate reactions were run with acetone or 1-phenylethanol added to the initial reaction mixture. Fig. 4 shows experimental results for the yield of 1-phenylethanol from complexes (9) (Fig. 4 A), (5) (Fig. 4 B), and (10) (Fig. 4 C) using three different initial feed mixtures – 1) no acetone or 1-phenylethanol added (△), 2) acetone added (⬜), or 3) 1-phenylethanol added (◇). It should be noted that Fig. 4 shows the yield of 1-phenylethanol derived from acetophenone transfer hydrogenation only. From a visual inspection it can be seen that none of the reaction profiles exhibited product inhibition from either acetone or 1-phenylethanol though previous studies have reported product inhibition for other Ru-based TH systems. [40,41] It is also noted that the maximum yield of 1-phenylethanol (derived from acetophenone) does not change significantly by addition of either acetone or 1-phenylethanol for complexes (9) and (5), suggesting that the equilibrium position is not significantly affected by product spiking, under the conditions employed. A similar study into Rh catalysed TH of acetophenone showed limited impact on acetophenone conversion at similarly low acetone spiking levels [42]. The effect of base concentration on reaction rate has not been studied here however, prior to the addition of base no product was detected in any of the experiments, showing base to be essential to form catalytically active species from complexes (5), (9) and (10). Further we should highlight that no induction period was observed in any of the experiments conducted. As such catalyst generation was considered instantaneous upon addition of base and therefore the concentration of base was not considered in the kinetic modelling. Rate expressions describing the production rate of 1-phenylethanol via the transfer hydrogenation of acetophenone (Eq. (1)) in the absence of reactant and product inhibition typically have the form shown in Eq. (2), where kf is the forward rate constant, kr is the reverse rate constant, and [X] is the concentration of species X in solution. (1) Acetophenone+Isopropanol ⇌ 1-Phenylethanol + Acetone (2) R 1 - P h E t O H = k f [ A c e t o p h e n o n e ] [ I P A ] - k r [ P h e n y l e t h a n o l ] [ A c e t o n e ] The equilibrium constant for the reaction is defined by Eq. (3). (3) K e q = k f k r = [ P h e n y l e t h a n o l ] e q [ A c e t o n e ] e q [ A c e t o p h e n o n e ] e q [ I P A ] e q In order to determine intrinsic rate constants, the experimental data was fitted to Eq. (2) in Athena Visual Work Bench (Version 14.2) to derive values of kf (forward rate constant) and kr (reverse rate constant). The values of kf and kr were subsequently used in the differential equation solver of Matlab to predict the reaction profile for each catalyst run. However, the predicted reaction profiles were not able to satisfactorily replicate the experimental data. It was also noted that the catalyst formed from complex (10) does not achieve high yields of 1-phenylethanol over the reaction time tested and appears to have a decreasing catalyst activity compared to the initial rate. An additional experiment utilising complex (9) at very low loading (complex:substrate:solvent = 1:10,000:1,300,000) showed that equilibrium conversion was not obtained despite very high initial reaction rates (Fig. S11). These observations indicated to us that catalyst deactivation is significant and should be accounted for in the kinetic model. Accordingly, parallel processes were modelled; a reversible transfer hydrogenation reaction with a concurrent irreversible deactivation reaction. To reduce the number of parameters to be determined through the regression analysis Eq. (4) was used instead of Eq. (2), and the value of the equilibrium constant, K e q 1 , derived as 0.48 from this work (under the given reaction conditions from Eq. (3)). Accordingly, expressions for the formation of 1-phenylethanol ( R 1 - P h E t O H ) and catalyst deactivation ( R d e a c t . ) are given in Eq. (4) and Eq. (5), respectively. A deactivation step which is second order in catalyst concentration was found to provide the best fit for the experimental data (Fig. S12). (4) R 1 - P h E t O H = k f 1 [ R u ] A c e t o p h e n o n e I P A - 1 K e q 1 1 - P h e n y l e t h a n o l [ A c e t o n e ] (5) R d e a c t . = k f 2 R u 2 The experimental data was fitted to Eq. (4) and Eq. (5) in Athena Visual Work Bench (Version 14.2) to derive values of k f 1 and k f 2 which were subsequently used in the differential equation solver of Matlab to predict reaction profiles. The experimental data and predicted reaction profiles for complexes (5), (9) and (10) are shown in Fig. 5 . Calculated values of k f 1 and k f 2 are given in Table 2 . Given that product inhibition is not apparent from the reaction profiles shown in Fig. 4 and the large values of error for kinetic constants in Table 2, values of k f 1 and k f 2 were not determined for the inhibition experiments. As can be seen in Fig. 4, for equimolar amounts of catalyst precursor used, complex (9) resulted in the most active catalyst followed by complex (5), with complex (10) the least active catalyst. Examination of the calculated rate constants in Table 2 reveals that the observed trends in catalyst activity from Fig. 4 are captured by the simple kinetic model. The value of k f 1 for the catalyst generated from complex (9) is nearly one thousand times greater than the catalyst generated from complex (5) and over four thousand times greater than the catalyst generated from complex (10). Interestingly the deactivation rate constant, k f 2 , is determined to be larger than the rate constant of the forward TH reaction, k f 1 . Furthermore k f 2 / k f 1 indicates that the complex (5) is relatively more resistant to deactivation than either complex (9) or (10). 3.4 Comparison to other ruthenium TH systems As mentioned above, remarkable improvements to the activity of Ru based transfer hydrogenation catalysts have been made. Table 3 compares the results of selected TH catalysts (Schemes 6 and 7 ) for the TH of acetophenone together with results from this study for complexes (5), (9) and (10). To be able to make comparisons with other complexes, data for complexes (5), (9) and (10) has been evaluated as TOF values. Le Floch’s phosphole/pyridine complex (11) [43] and Barrata’s CNN based complex (12) [8] form two of the most active ruthenium catalysts for the transfer hydrogenation of acetophenone when activated with base (Table 3, entry 1 and 2). Both catalysts exhibit TOF greater than 1 × 106 hr−1. Complex (13), bearing a pyridine/benzimidazole/triazole NNN ligand, also reportedly achieves very high TOF for the TH of acetophenone (705,600 h−1, Table 3 entry 3) though this value is derived from a sample taken 10 s after initiation [21]. While these values are very high, none of these ligands are commercially available and cannot be made in a single step which represents a barrier to commercial application. Complex (9), bearing the commercially available NNN ligand 2,6-bis(2-benzimidazole)-pyridine, has been shown to be a highly effective transfer hydrogenation catalyst (Table 3, entry 4). However the single literature report gives an unclear estimation for when the product sample was taken (30–40 s), leading to a TOF range of 85,500-114,000 h−1. In our hands, under similar conditions (although at a lower temperature), complex (9) gave a TOF of 76,500 h−1. Thus the TOF values of complex (9) are very similar to the best TOF value (75,000 h−1) for PP,NN ruthenium complexes bearing commercially available ligands reported by Baratta (where PP is 1,3-bis(diphenylphosphino)propane and NN is 2-aminomethylpyridine or ethylenediamine) [44]. The commercially available complex (5) is shown here to be a competent TH catalyst which has hitherto not been reported (Table 3, entry 6). Despite the wide application of ruthenium pincer complexes in catalysis [45,46], NPN ruthenium complexes for TH are remarkably scarce. To the best of our knowledge only two well defined NPN ruthenium complexes have been reported for TH catalysis, complexes (14) [47] and (15) [48] (Scheme 6). Zhang has reported the use of NPN ligands (16 - 19) to form TH catalysts with [RuCl2(C6H6)]2 in situ, however only very modest TON and TOF were reported (Table 3, entries 10–13). [49,50] On the other hand, complex (14) gave high TOF for the TH of acetophenone, 70,200 h−1 after 1 min (Table 3, entry 8), while complex (15) gave very sluggish performance (TOF = 380 h−1, Table 3, entry 9). Braunstein reported that addition of PPh3 to the catalytic tests run with complex (15) resulted in even lower TOF [48], indicating that the poor performance of (15) compared to (14) may be due to differences in the NPN ligands and not due to the absence of PPh3 in the coordination sphere of the metal. As the novel NPN complex (10) reported in this work contains NH groups [13], we had hoped that the performance for TH of acetophenone would be comparable if not better than complex (14) which contains oxazoline groups. Under similar conditions (albeit lower temperature), complex (10) gave TOF values of 3,500 h−1 (after 1 min) whereas complex (14) has a reported TOF value of 70,200 h−1 (after 30 s). The moderate activity of (10) is substantially better than the TOF values reported for complex (15) (380 h−1, Table 3, entry 9) or the in-situ generated catalysts reported by Zhang (less than 400 h−1, Table 3 entries 10–13). To date complex (10) is the first well defined NPN ruthenium complex, bearing NH functionality, which is active for the TH of acetophenone. Therefore this report opens a new avenue for ligand design and catalyst development for the hydrogenation and transfer hydrogenation of ketones and other polar unsaturated functional groups (e.g. aldehydes, imines, and esters). While ligand (16) also bears NH groups and is very similar to the NPN ligand (1) in complex (10), ligand (16) was screened in-situ, at room temperature, with low substrate loading and only sampled after 24 h [49], therefore the potential for NHx-P-NHx ligands to effect productive TH catalysis was missed. While different mechanisms of TH exist for the conversion of carbonyl compounds [6,7], it is beyond the scope of the work here to speculate on the active mechanisms for complexes (5), (9) and (10). As discussed above, our experiments and data suggest that catalyst deactivation is a prevelant problem for all three catalysts, despite distinctly different ligand types. Catalyst deactivation is often not considered when determining intrinsic reaction parameters. Ligand backbone deprotonation and subsequent decomposition has been observed for some ruthenium amino phosphine complexes [12,51], while ligand displacement has been observed in other ruthenium TH systems [52–54], though many other deactivation mechanisms may also be at play [55]. The exact mechanism of deactivation for complexes (5), (9) and (10) is not yet known. However, observation that a higher order (squared dependence) on ruthenium concentration for the rate of deactivation indicates nanoparticle formation may be operative [29]. Work is now underway to explore further the TH, and hydrogenation, capacity of the NPN ligand framework and to determine the mechanisms of catalysis and deactivation. Further reports on industrially relevant TH and hydrogenation catalysts will be reported in the future. 4 Conclusions In conclusion, we have reported on the use of commercially available and readily accessible NNN and NPN pincer ligands to form ruthenium catalysts for the TH of acetophenone. In situ screening of ligands bis(3-aminopropyl)phenylphosphine (1), 2,6-bis-[1-(2-methylphenylimino)ethylpyridine (2), bis-((2-benzimidazole)methyl)-amine (3) and 2,6-bis(2-benzimidazolyl)pyridine (4) with [RuCl2(PPh3)2] afforded more active catalysts over [RuCl2(PPh3)2] alone when an NH functional group was present in the ligand. Commercially available ester and ketone hydrogenation catalysts [Ru(PhPN)2Cl2] (5), [Ru(iPrPN)2Cl2] (6) and [Ru(tBuPN)2Cl2] (7) were also screened for the TH of acetophenone along with [Ru(tmen)(PPh3)2(H)(Cl)] (8). Surprisingly, complex (5) displayed substantial TH activity, which has not been reported for this complex previously. To be able to compare the activity of complex (5) with the most promising ligands from in situ screening, well defined complexes of ligands (1) and (4) were synthesised. Attempts to isolate a well-defined complex of ligand (3) were unsuccessful. The novel complex [Ru(1)(PPh3)Cl2], (10), is the first reported ruthenium complex of ligand (1), and while complex [Ru(4)(PPh3)2Cl][Cl], (9), has been previously reported, no 13C or 31P NMR data had been published. Furthermore, this work has shown the reported 1H NMR data to be erroneous. To be able to compare the TH activity of catalysts (5), (9) and (10) more accurately than simple TOF values, TH reaction profiles were used to estimate rate constants by regression analysis (with limited data points). In the absence of base, catalysts (5), (9) and (10) showed no catalytic activity while reaction spiking experiments revealed no significant product inhibition (by acetone or 1-phenylethanol). Attempts to predict the reaction profiles using a simple reversible TH reaction model failed to give satisfactory results. After catalyst deactivation was found to be prevalent experimentally for complexes (9) and (10) a two step kinetic model involving reversible TH and irreversible, second order catalyst deactivation was able to fit the observed reaction profiles. Kinetic parameters derived from this model show that while complex complex (9) is substantially more active than for TH than complexes (5) or (10), it is complex (5) that is least prone to deactivation. Declarations of interest None. Acknowledgements Professor Bill Clegg and Dr Ross Harrington (Department of Chemistry, Newcastle University, UK) are gratefully acknowledged for conducting the crystal structure determination. The authors would like to thank Professor Glenn Sunley (BP p.l.c., Hull, UK) for valuable discussions and the entire analytical team at the Hull Research and Technology Centre (BP Chemicals, Hull, UK). BP Chemicals is thanked for supporting the publication of this work. Appendix A Supplementary data Supplementary data associated with this article can be found, in the online version, at https://doi.org/10.1016/j.apcata.2018.11.031. Appendix A Supplementary data The following is Supplementary data to this article: References [1] T. Ikariya A.J. Blacker Acc. Chem. Res. 40 2007 1300 1308 [2] D.J. Ager A.H.M. de Vries J.G. de Vries Chem. Soc. Rev. 41 2012 3340 3380 [3] J.-i. Ito H. Nishiyama Tetrahedron Lett. 55 2014 3133 3146 [4] D. Wang D. Astruc Chem. Rev. 115 2015 6621 6686 [5] S. Gladiali R. Taras Reduction of Carbonyl Compounds by Hydrogen Transfer, Modern Reduction Methods 2008 Wiley-VCH Verlag GmbH & Co. KGaA 135 157 [6] S.E. Clapham A. Hadzovic R.H. Morris Coord. Chem. Rev. 248 2004 2201 2237 [7] J.S.M. Samec J.-E. Backvall P.G. Andersson P. Brandt Chem. Soc. Rev. 35 2006 237 248 [8] W. Baratta G. Chelucci S. Gladiali K. Siega M. Toniutti M. Zanette E. Zangrando P. Rigo Angew. Chem., Int. Ed. 44 2005 6214 6219 [9] W. Baratta M. Bosco G. Chelucci A. Del Zotto K. Siega M. Toniutti E. Zangrando P. Rigo Organometallics 25 2006 4611 4620 [10] R. Cariou J.J. Chirinos V.C. Gibson G. Jacobsen A.K. Tomov G.J.P. Britovsek A.J.P. White Dalton Trans. 39 2010 9039 9045 [11] B.L. Small M. Brookhart J. Am. Chem. Soc. 120 1998 7143 7144 [12] R. Abbel K. Abdur-Rashid M. Faatz A. Hadzovic A.J. Lough R.H. Morris J. Am. Chem. Soc. 127 2005 1870 1882 [13] B. Zhao Z. Han K. Ding Angew. Chem., Int. Ed. 52 2013 4744 4788 [14] S.F. Hsu B. Plietker Chem. Eur. J. 20 2014 4242 4245 [15] R.J. Lundgren M.A. Rankin R. McDonald G. Schatte M. Stradiotto Angew. Chem., Int. Ed. 46 2007 4732 4735 [16] M.A. Beckett D.P. Cassidy A.J. Duffin Inorg. Chim. Acta 189 1991 229 232 [17] B.L. Small Acc. Chem. Res. 48 2015 2599 2611 [18] Y. Li Y. Zhou Q. Shi K. Ding R. Noyori C.A. Sandoval Adv. Synth. Catal. 353 2011 495 500 [19] J.M. Praetorius R. Wang C.M. Crudden Organometallics 29 2010 554 561 [20] I. Oezdemir N. Sahin B. Cetinkaya Monatsh. Chem. 138 2007 205 209 [21] F. Zeng Z. Yu Organometallics 27 2008 2898 2901 [22] F. Zeng Z. Yu Organometallics 28 2009 1855 1862 [23] W. Ye M. Zhao W. Du Q. Jiang K. Wu P. Wu Z. Yu Chem. - Eur. J. 17 2011 4737 4741 [24] W. Du P. Wu Q. Wang Z. Yu Organometallics 32 2013 3083 3090 [25] H. Chai T. Liu Q. Wang Z. Yu Organometallics 34 2015 5278 5284 [26] Y. Sasson J. Blum Tetrahedron Lett. 12 1971 2167 2170 [27] R.L. Chowdhury J.-E. Backvall J. Chem. Soc. Chem. Commun. 1991 1063 1064 [28] A. Aranyos G. Csjernyik K.J. Szabo J.-E. Backvall Chem. Commun. 1999 351 352 [29] J. Toubiana Y. Sasson Catal. Sci. Technol. 2 2012 1644 1653 [30] V. Polshettiwar R.S. Varma Green Chem. 11 2009 1313 1316 [31] A. Ouali J.P. Majoral A.M. Caminade M. Taillefer ChemCatChem 1 2009 504 509 [32] W. Jia X. Chen R. Guo C. Sui-Seng D. Amoroso A. Lough K. Abdur-Rashid Dalton Trans. 2009 8301 8307 [33] K. Abdur-Rashid S.E. Clapham A. Hadzovic J.N. Harvey A.J. Lough R.H. Morris J. Am. Chem. Soc. 124 2002 15104 15118 [34] K. Abdur-Rashid D. Amoroso X. Chen R. Guo S. Lu C.-W. Tsang Kanata Chemical Technologies Inc., Method for Preparing a Metal Catalyst WO2010043027 2018 [35] D. Mishra S. Naskar S. Chattopadhyay M. Maji P. Sengupta R. Dinda S. Ghosh T.W. Mak Transition Met. Chem. 30 2005 352 356 [36] D. Mishra A. Barbieri C. Sabatini M.G.B. Drew H.M. Figgie W.S. Sheldrick S.K. Chattopadhyay Inorg. Chim. Acta 360 2007 2231 2244 [37] A. Hadzovic D. Song C.M. MacLaughlin R.H. Morris Organometallics 26 2007 5987 5999 [38] V. Rautenstrauch X. Hoang-Cong R. Churlaud K. Abdur-Rashid R.H. Morris Chem.- Eur. J. 9 2003 4954 4967 [39] W. Baratta K. Siega P. Rigo Chem. - Eur. J. 13 2007 7479 7486 [40] R.V. Wisman J.G. de Vries B.-J. Deelman H.J. Heeres Org. Process Res. Dev. 10 2006 423 429 [41] J. Wettergren E. Buitrago P. Ryberg H. Adolfsson Chem. - Eur. J. 15 2009 5709 5718 [42] X. Sun G. Manos J. Blacker J. Martin A. Gavriilidis Org. Process Res. Dev. 8 2004 909 914 [43] C. Thoumazet M. Melaimi L. Ricard F. Mathey P. Le Floch Organometallics 22 2003 1580 1581 [44] S. Zhang S. Baldino W. Baratta Organometallics 32 2013 5299 5304 [45] C. Gunanathan D. Milstein Chem. Rev. 114 2014 12024 12087 [46] H.A. Younus W. Su N. Ahmad S. Chen F. Verpoort Adv. Synth. Catal. 357 2015 283 330 [47] P. Braunstein M.D. Fryzuk F. Naud S.J. Rettig J. Chem. Soc., Dalton Trans. 1999 589 594 [48] P. Braunstein F. Naud A. Pfaltz S.J. Rettig Organometallics 19 2000 2676 2683 [49] Y. Jiang Q. Jiang G. Zhu X. Zhang Tetrahedron Lett. 38 1997 6565 6568 [50] Y. Jiang Q. Jiang G. Zhu X. Zhang Tetrahedron Lett. 38 1997 215 218 [51] D.E. Prokopchuk A.J. Lough R.H. Morris Dalton Trans. 40 2011 10603 10608 [52] J.A. Kenny M.J. Palmer A.R.C. Smith T. Walsgrove M. Wills Synlett 1999 1999 1615 1617 [53] K. Everaere A. Mortreux M. Bulliard J. Brussee A. van der Gen G. Nowogrocki J.-F. Carpentier Eur. J. Org. Chem. 2001 2001 275 291 [54] K. Everaere A. Mortreux J.-F. Carpentier Adv. Synth. Catal. 345 2003 67 77 [55] R.H. Crabtree Chem. Rev. 115 2015 127 150",
      "scopus-id": "85058052442",
      "coredata": {
        "eid": "1-s2.0-S0926860X18305866",
        "dc:description": "The screening, synthesis and testing of Ru complexes generated from commercially available ligands or ligands that can be synthesised in one step, is described. The catalysts were tested for activity in the transfer hydrogenation of acetophenone by isopropanol, a probe reaction for hydrogen transfer processes between oxygenated species, often found in applications such as biomass upgrading and fine and specialty chemical synthesis. Ligand screening was conducted by in situ catalyst generation and examined NPN and NNN pincer type ligands bearing NH or CN functional groups. The most active transfer hydrogenation catalysts were found to be those bearing NH functionality, either as amino groups or as benzimidazole groups. Well-defined catalyst precursors were subsequently synthesised, including the novel complex [Ru(1)PPh3(Cl)2] (where (1) = bis(3-aminopropyl)phenylphosphine), the first reported Ru complex for this NPN ligand. Established (PN)2 and PP/NN ketone hydrogenation catalysts were also screened for transfer hydrogen capability, of which [Ru(PhPN)2Cl2] (where PhPN = 2-(diphenylphosphino)ethylamine) was the most active. Subsequently, [Ru(1)PPh3(Cl)2], [Ru(PhPN)2Cl2] and [Ru(4)(PPh3)2Cl][Cl] (where (4) = 2,6-bis(2-benzimidazolyl)pyridine) were investigated more closely to compare rate constants (determined by reaction profile regression analysis) as a more accurate measure of catalyst activity over commonly reported turn over frequencies (TOF). The effect of the reaction products on the catalyst activity was evaluated using feed spiking experiments. Catalyst deactivation was shown to be prevalent and subsequently incorporated into a simple kinetic model which enabled more accurate reaction profile fitting and provided rate constants for both the transfer hydrogenation step and deactivation reaction.",
        "openArchiveArticle": "false",
        "prism:coverDate": "2019-01-25",
        "openaccessUserLicense": null,
        "prism:aggregationType": "Journal",
        "prism:url": "https://api.elsevier.com/content/article/pii/S0926860X18305866",
        "dc:creator": [
          {
            "@_fa": "true",
            "$": "Braden, Drew J."
          },
          {
            "@_fa": "true",
            "$": "Cariou, Renan"
          },
          {
            "@_fa": "true",
            "$": "Shabaker, John W."
          },
          {
            "@_fa": "true",
            "$": "Taylor, Russell A."
          }
        ],
        "link": [
          {
            "@_fa": "true",
            "@rel": "self",
            "@href": "https://api.elsevier.com/content/article/pii/S0926860X18305866"
          },
          {
            "@_fa": "true",
            "@rel": "scidir",
            "@href": "https://www.sciencedirect.com/science/article/pii/S0926860X18305866"
          }
        ],
        "dc:format": "application/json",
        "openaccessType": null,
        "pii": "S0926-860X(18)30586-6",
        "prism:volume": "570",
        "prism:publisher": "Elsevier B.V.",
        "dc:title": "Rapid transfer hydrogenation of acetophenone using ruthenium catalysts bearing commercially available and readily accessible nitrogen and phosphorous donor ligands",
        "prism:copyright": "© 2018 Elsevier B.V. All rights reserved.",
        "openaccess": "0",
        "prism:issn": "0926860X",
        "dcterms:subject": [
          {
            "@_fa": "true",
            "$": "Transfer hydrogenation"
          },
          {
            "@_fa": "true",
            "$": "Ruthenium"
          },
          {
            "@_fa": "true",
            "$": "Homogeneous catalysis"
          },
          {
            "@_fa": "true",
            "$": "Pincer ligands"
          },
          {
            "@_fa": "true",
            "$": "Reaction kinetics"
          }
        ],
        "openaccessArticle": "false",
        "prism:publicationName": "Applied Catalysis A: General",
        "openaccessSponsorType": null,
        "prism:pageRange": "367-375",
        "prism:endingPage": "375",
        "pubType": "fla",
        "prism:coverDisplayDate": "25 January 2019",
        "prism:doi": "10.1016/j.apcata.2018.11.031",
        "prism:startingPage": "367",
        "dc:identifier": "doi:10.1016/j.apcata.2018.11.031",
        "openaccessSponsorName": null
      },
      "objects": {
        "object": [
          {
            "@category": "thumbnail",
            "@height": "103",
            "@width": "219",
            "@_fa": "true",
            "$": "https://api.elsevier.com/content/object/eid/1-s2.0-S0926860X18305866-ga1.sml?httpAccept=%2A%2F%2A",
            "@multimediatype": "GIF image file",
            "@type": "IMAGE-THUMBNAIL",
            "@size": "6868",
            "@ref": "ga1",
            "@mimetype": "image/gif"
          },
          {
            "@category": "thumbnail",
            "@height": "129",
            "@width": "219",
            "@_fa": "true",
            "$": "https://api.elsevier.com/content/object/eid/1-s2.0-S0926860X18305866-gr1.sml?httpAccept=%2A%2F%2A",
            "@multimediatype": "GIF image file",
            "@type": "IMAGE-THUMBNAIL",
            "@size": "4142",
            "@ref": "gr1",
            "@mimetype": "image/gif"
          },
          {
            "@category": "thumbnail",
            "@height": "126",
            "@width": "219",
            "@_fa": "true",
            "$": "https://api.elsevier.com/content/object/eid/1-s2.0-S0926860X18305866-gr2.sml?httpAccept=%2A%2F%2A",
            "@multimediatype": "GIF image file",
            "@type": "IMAGE-THUMBNAIL",
            "@size": "4117",
            "@ref": "gr2",
            "@mimetype": "image/gif"
          },
          {
            "@category": "thumbnail",
            "@height": "163",
            "@width": "169",
            "@_fa": "true",
            "$": "https://api.elsevier.com/content/object/eid/1-s2.0-S0926860X18305866-gr3.sml?httpAccept=%2A%2F%2A",
            "@multimediatype": "GIF image file",
            "@type": "IMAGE-THUMBNAIL",
            "@size": "8541",
            "@ref": "gr3",
            "@mimetype": "image/gif"
          },
          {
            "@category": "thumbnail",
            "@height": "135",
            "@width": "219",
            "@_fa": "true",
            "$": "https://api.elsevier.com/content/object/eid/1-s2.0-S0926860X18305866-gr4.sml?httpAccept=%2A%2F%2A",
            "@multimediatype": "GIF image file",
            "@type": "IMAGE-THUMBNAIL",
            "@size": "5334",
            "@ref": "gr4",
            "@mimetype": "image/gif"
          },
          {
            "@category": "thumbnail",
            "@height": "134",
            "@width": "219",
            "@_fa": "true",
            "$": "https://api.elsevier.com/content/object/eid/1-s2.0-S0926860X18305866-gr5.sml?httpAccept=%2A%2F%2A",
            "@multimediatype": "GIF image file",
            "@type": "IMAGE-THUMBNAIL",
            "@size": "4742",
            "@ref": "gr5",
            "@mimetype": "image/gif"
          },
          {
            "@category": "thumbnail",
            "@height": "31",
            "@width": "219",
            "@_fa": "true",
            "$": "https://api.elsevier.com/content/object/eid/1-s2.0-S0926860X18305866-sc1.sml?httpAccept=%2A%2F%2A",
            "@multimediatype": "GIF image file",
            "@type": "IMAGE-THUMBNAIL",
            "@size": "2065",
            "@ref": "sc1",
            "@mimetype": "image/gif"
          },
          {
            "@category": "thumbnail",
            "@height": "36",
            "@width": "219",
            "@_fa": "true",
            "$": "https://api.elsevier.com/content/object/eid/1-s2.0-S0926860X18305866-sc2.sml?httpAccept=%2A%2F%2A",
            "@multimediatype": "GIF image file",
            "@type": "IMAGE-THUMBNAIL",
            "@size": "2308",
            "@ref": "sc2",
            "@mimetype": "image/gif"
          },
          {
            "@category": "thumbnail",
            "@height": "90",
            "@width": "219",
            "@_fa": "true",
            "$": "https://api.elsevier.com/content/object/eid/1-s2.0-S0926860X18305866-sc3.sml?httpAccept=%2A%2F%2A",
            "@multimediatype": "GIF image file",
            "@type": "IMAGE-THUMBNAIL",
            "@size": "4667",
            "@ref": "sc3",
            "@mimetype": "image/gif"
          },
          {
            "@category": "thumbnail",
            "@height": "35",
            "@width": "219",
            "@_fa": "true",
            "$": "https://api.elsevier.com/content/object/eid/1-s2.0-S0926860X18305866-sc4.sml?httpAccept=%2A%2F%2A",
            "@multimediatype": "GIF image file",
            "@type": "IMAGE-THUMBNAIL",
            "@size": "2156",
            "@ref": "sc4",
            "@mimetype": "image/gif"
          },
          {
            "@category": "thumbnail",
            "@height": "55",
            "@width": "219",
            "@_fa": "true",
            "$": "https://api.elsevier.com/content/object/eid/1-s2.0-S0926860X18305866-sc5.sml?httpAccept=%2A%2F%2A",
            "@multimediatype": "GIF image file",
            "@type": "IMAGE-THUMBNAIL",
            "@size": "2806",
            "@ref": "sc5",
            "@mimetype": "image/gif"
          },
          {
            "@category": "thumbnail",
            "@height": "151",
            "@width": "219",
            "@_fa": "true",
            "$": "https://api.elsevier.com/content/object/eid/1-s2.0-S0926860X18305866-sc6.sml?httpAccept=%2A%2F%2A",
            "@multimediatype": "GIF image file",
            "@type": "IMAGE-THUMBNAIL",
            "@size": "6457",
            "@ref": "sc6",
            "@mimetype": "image/gif"
          },
          {
            "@category": "thumbnail",
            "@height": "54",
            "@width": "219",
            "@_fa": "true",
            "$": "https://api.elsevier.com/content/object/eid/1-s2.0-S0926860X18305866-sc7.sml?httpAccept=%2A%2F%2A",
            "@multimediatype": "GIF image file",
            "@type": "IMAGE-THUMBNAIL",
            "@size": "3190",
            "@ref": "sc7",
            "@mimetype": "image/gif"
          },
          {
            "@category": "standard",
            "@height": "200",
            "@width": "426",
            "@_fa": "true",
            "$": "https://api.elsevier.com/content/object/eid/1-s2.0-S0926860X18305866-ga1.jpg?httpAccept=%2A%2F%2A",
            "@multimediatype": "JPEG image file",
            "@type": "IMAGE-DOWNSAMPLED",
            "@size": "24148",
            "@ref": "ga1",
            "@mimetype": "image/jpeg"
          },
          {
            "@category": "standard",
            "@height": "222",
            "@width": "376",
            "@_fa": "true",
            "$": "https://api.elsevier.com/content/object/eid/1-s2.0-S0926860X18305866-gr1.jpg?httpAccept=%2A%2F%2A",
            "@multimediatype": "JPEG image file",
            "@type": "IMAGE-DOWNSAMPLED",
            "@size": "13826",
            "@ref": "gr1",
            "@mimetype": "image/jpeg"
          },
          {
            "@category": "standard",
            "@height": "217",
            "@width": "376",
            "@_fa": "true",
            "$": "https://api.elsevier.com/content/object/eid/1-s2.0-S0926860X18305866-gr2.jpg?httpAccept=%2A%2F%2A",
            "@multimediatype": "JPEG image file",
            "@type": "IMAGE-DOWNSAMPLED",
            "@size": "13331",
            "@ref": "gr2",
            "@mimetype": "image/jpeg"
          },
          {
            "@category": "standard",
            "@height": "291",
            "@width": "301",
            "@_fa": "true",
            "$": "https://api.elsevier.com/content/object/eid/1-s2.0-S0926860X18305866-gr3.jpg?httpAccept=%2A%2F%2A",
            "@multimediatype": "JPEG image file",
            "@type": "IMAGE-DOWNSAMPLED",
            "@size": "21850",
            "@ref": "gr3",
            "@mimetype": "image/jpeg"
          },
          {
            "@category": "standard",
            "@height": "407",
            "@width": "659",
            "@_fa": "true",
            "$": "https://api.elsevier.com/content/object/eid/1-s2.0-S0926860X18305866-gr4.jpg?httpAccept=%2A%2F%2A",
            "@multimediatype": "JPEG image file",
            "@type": "IMAGE-DOWNSAMPLED",
            "@size": "39192",
            "@ref": "gr4",
            "@mimetype": "image/jpeg"
          },
          {
            "@category": "standard",
            "@height": "208",
            "@width": "339",
            "@_fa": "true",
            "$": "https://api.elsevier.com/content/object/eid/1-s2.0-S0926860X18305866-gr5.jpg?httpAccept=%2A%2F%2A",
            "@multimediatype": "JPEG image file",
            "@type": "IMAGE-DOWNSAMPLED",
            "@size": "11680",
            "@ref": "gr5",
            "@mimetype": "image/jpeg"
          },
          {
            "@category": "standard",
            "@height": "54",
            "@width": "376",
            "@_fa": "true",
            "$": "https://api.elsevier.com/content/object/eid/1-s2.0-S0926860X18305866-sc1.jpg?httpAccept=%2A%2F%2A",
            "@multimediatype": "JPEG image file",
            "@type": "IMAGE-DOWNSAMPLED",
            "@size": "5084",
            "@ref": "sc1",
            "@mimetype": "image/jpeg"
          },
          {
            "@category": "standard",
            "@height": "93",
            "@width": "565",
            "@_fa": "true",
            "$": "https://api.elsevier.com/content/object/eid/1-s2.0-S0926860X18305866-sc2.jpg?httpAccept=%2A%2F%2A",
            "@multimediatype": "JPEG image file",
            "@type": "IMAGE-DOWNSAMPLED",
            "@size": "10929",
            "@ref": "sc2",
            "@mimetype": "image/jpeg"
          },
          {
            "@category": "standard",
            "@height": "124",
            "@width": "301",
            "@_fa": "true",
            "$": "https://api.elsevier.com/content/object/eid/1-s2.0-S0926860X18305866-sc3.jpg?httpAccept=%2A%2F%2A",
            "@multimediatype": "JPEG image file",
            "@type": "IMAGE-DOWNSAMPLED",
            "@size": "10865",
            "@ref": "sc3",
            "@mimetype": "image/jpeg"
          },
          {
            "@category": "standard",
            "@height": "98",
            "@width": "602",
            "@_fa": "true",
            "$": "https://api.elsevier.com/content/object/eid/1-s2.0-S0926860X18305866-sc4.jpg?httpAccept=%2A%2F%2A",
            "@multimediatype": "JPEG image file",
            "@type": "IMAGE-DOWNSAMPLED",
            "@size": "9945",
            "@ref": "sc4",
            "@mimetype": "image/jpeg"
          },
          {
            "@category": "standard",
            "@height": "141",
            "@width": "565",
            "@_fa": "true",
            "$": "https://api.elsevier.com/content/object/eid/1-s2.0-S0926860X18305866-sc5.jpg?httpAccept=%2A%2F%2A",
            "@multimediatype": "JPEG image file",
            "@type": "IMAGE-DOWNSAMPLED",
            "@size": "15283",
            "@ref": "sc5",
            "@mimetype": "image/jpeg"
          },
          {
            "@category": "standard",
            "@height": "324",
            "@width": "470",
            "@_fa": "true",
            "$": "https://api.elsevier.com/content/object/eid/1-s2.0-S0926860X18305866-sc6.jpg?httpAccept=%2A%2F%2A",
            "@multimediatype": "JPEG image file",
            "@type": "IMAGE-DOWNSAMPLED",
            "@size": "28431",
            "@ref": "sc6",
            "@mimetype": "image/jpeg"
          },
          {
            "@category": "standard",
            "@height": "140",
            "@width": "565",
            "@_fa": "true",
            "$": "https://api.elsevier.com/content/object/eid/1-s2.0-S0926860X18305866-sc7.jpg?httpAccept=%2A%2F%2A",
            "@multimediatype": "JPEG image file",
            "@type": "IMAGE-DOWNSAMPLED",
            "@size": "16479",
            "@ref": "sc7",
            "@mimetype": "image/jpeg"
          },
          {
            "@category": "high",
            "@height": "886",
            "@width": "1885",
            "@_fa": "true",
            "$": "https://api.elsevier.com/content/object/eid/1-s2.0-S0926860X18305866-ga1_lrg.jpg?httpAccept=%2A%2F%2A",
            "@multimediatype": "JPEG image file",
            "@type": "IMAGE-HIGH-RES",
            "@size": "167762",
            "@ref": "ga1",
            "@mimetype": "image/jpeg"
          },
          {
            "@category": "high",
            "@height": "984",
            "@width": "1667",
            "@_fa": "true",
            "$": "https://api.elsevier.com/content/object/eid/1-s2.0-S0926860X18305866-gr1_lrg.jpg?httpAccept=%2A%2F%2A",
            "@multimediatype": "JPEG image file",
            "@type": "IMAGE-HIGH-RES",
            "@size": "92409",
            "@ref": "gr1",
            "@mimetype": "image/jpeg"
          },
          {
            "@category": "high",
            "@height": "962",
            "@width": "1667",
            "@_fa": "true",
            "$": "https://api.elsevier.com/content/object/eid/1-s2.0-S0926860X18305866-gr2_lrg.jpg?httpAccept=%2A%2F%2A",
            "@multimediatype": "JPEG image file",
            "@type": "IMAGE-HIGH-RES",
            "@size": "89675",
            "@ref": "gr2",
            "@mimetype": "image/jpeg"
          },
          {
            "@category": "high",
            "@height": "1289",
            "@width": "1333",
            "@_fa": "true",
            "$": "https://api.elsevier.com/content/object/eid/1-s2.0-S0926860X18305866-gr3_lrg.jpg?httpAccept=%2A%2F%2A",
            "@multimediatype": "JPEG image file",
            "@type": "IMAGE-HIGH-RES",
            "@size": "181047",
            "@ref": "gr3",
            "@mimetype": "image/jpeg"
          },
          {
            "@category": "high",
            "@height": "1801",
            "@width": "2917",
            "@_fa": "true",
            "$": "https://api.elsevier.com/content/object/eid/1-s2.0-S0926860X18305866-gr4_lrg.jpg?httpAccept=%2A%2F%2A",
            "@multimediatype": "JPEG image file",
            "@type": "IMAGE-HIGH-RES",
            "@size": "272828",
            "@ref": "gr4",
            "@mimetype": "image/jpeg"
          },
          {
            "@category": "high",
            "@height": "920",
            "@width": "1500",
            "@_fa": "true",
            "$": "https://api.elsevier.com/content/object/eid/1-s2.0-S0926860X18305866-gr5_lrg.jpg?httpAccept=%2A%2F%2A",
            "@multimediatype": "JPEG image file",
            "@type": "IMAGE-HIGH-RES",
            "@size": "78345",
            "@ref": "gr5",
            "@mimetype": "image/jpeg"
          },
          {
            "@category": "high",
            "@height": "239",
            "@width": "1667",
            "@_fa": "true",
            "$": "https://api.elsevier.com/content/object/eid/1-s2.0-S0926860X18305866-sc1_lrg.jpg?httpAccept=%2A%2F%2A",
            "@multimediatype": "JPEG image file",
            "@type": "IMAGE-HIGH-RES",
            "@size": "34187",
            "@ref": "sc1",
            "@mimetype": "image/jpeg"
          },
          {
            "@category": "high",
            "@height": "411",
            "@width": "2500",
            "@_fa": "true",
            "$": "https://api.elsevier.com/content/object/eid/1-s2.0-S0926860X18305866-sc2_lrg.jpg?httpAccept=%2A%2F%2A",
            "@multimediatype": "JPEG image file",
            "@type": "IMAGE-HIGH-RES",
            "@size": "76961",
            "@ref": "sc2",
            "@mimetype": "image/jpeg"
          },
          {
            "@category": "high",
            "@height": "549",
            "@width": "1333",
            "@_fa": "true",
            "$": "https://api.elsevier.com/content/object/eid/1-s2.0-S0926860X18305866-sc3_lrg.jpg?httpAccept=%2A%2F%2A",
            "@multimediatype": "JPEG image file",
            "@type": "IMAGE-HIGH-RES",
            "@size": "70234",
            "@ref": "sc3",
            "@mimetype": "image/jpeg"
          },
          {
            "@category": "high",
            "@height": "432",
            "@width": "2667",
            "@_fa": "true",
            "$": "https://api.elsevier.com/content/object/eid/1-s2.0-S0926860X18305866-sc4_lrg.jpg?httpAccept=%2A%2F%2A",
            "@multimediatype": "JPEG image file",
            "@type": "IMAGE-HIGH-RES",
            "@size": "69657",
            "@ref": "sc4",
            "@mimetype": "image/jpeg"
          },
          {
            "@category": "high",
            "@height": "623",
            "@width": "2500",
            "@_fa": "true",
            "$": "https://api.elsevier.com/content/object/eid/1-s2.0-S0926860X18305866-sc5_lrg.jpg?httpAccept=%2A%2F%2A",
            "@multimediatype": "JPEG image file",
            "@type": "IMAGE-HIGH-RES",
            "@size": "107724",
            "@ref": "sc5",
            "@mimetype": "image/jpeg"
          },
          {
            "@category": "high",
            "@height": "1434",
            "@width": "2083",
            "@_fa": "true",
            "$": "https://api.elsevier.com/content/object/eid/1-s2.0-S0926860X18305866-sc6_lrg.jpg?httpAccept=%2A%2F%2A",
            "@multimediatype": "JPEG image file",
            "@type": "IMAGE-HIGH-RES",
            "@size": "215405",
            "@ref": "sc6",
            "@mimetype": "image/jpeg"
          },
          {
            "@category": "high",
            "@height": "619",
            "@width": "2500",
            "@_fa": "true",
            "$": "https://api.elsevier.com/content/object/eid/1-s2.0-S0926860X18305866-sc7_lrg.jpg?httpAccept=%2A%2F%2A",
            "@multimediatype": "JPEG image file",
            "@type": "IMAGE-HIGH-RES",
            "@size": "119045",
            "@ref": "sc7",
            "@mimetype": "image/jpeg"
          },
          {
            "@category": "standard",
            "@_fa": "true",
            "$": "https://api.elsevier.com/content/object/eid/1-s2.0-S0926860X18305866-mmc1.pdf?httpAccept=%2A%2F%2A",
            "@multimediatype": "Acrobat PDF file",
            "@type": "APPLICATION",
            "@size": "2175145",
            "@ref": "mmc1",
            "@mimetype": "application/pdf"
          },
          {
            "@category": "thumbnail",
            "@height": "37",
            "@width": "41",
            "@_fa": "true",
            "$": "https://api.elsevier.com/content/object/eid/1-s2.0-S0926860X18305866-si1.gif?httpAccept=%2A%2F%2A",
            "@multimediatype": "GIF image file",
            "@type": "ALTIMG",
            "@size": "199",
            "@ref": "si1",
            "@mimetype": "image/gif"
          },
          {
            "@category": "thumbnail",
            "@height": "30",
            "@width": "91",
            "@_fa": "true",
            "$": "https://api.elsevier.com/content/object/eid/1-s2.0-S0926860X18305866-si10.gif?httpAccept=%2A%2F%2A",
            "@multimediatype": "GIF image file",
            "@type": "ALTIMG",
            "@size": "364",
            "@ref": "si10",
            "@mimetype": "image/gif"
          },
          {
            "@category": "thumbnail",
            "@height": "30",
            "@width": "62",
            "@_fa": "true",
            "$": "https://api.elsevier.com/content/object/eid/1-s2.0-S0926860X18305866-si11.gif?httpAccept=%2A%2F%2A",
            "@multimediatype": "GIF image file",
            "@type": "ALTIMG",
            "@size": "272",
            "@ref": "si11",
            "@mimetype": "image/gif"
          },
          {
            "@category": "thumbnail",
            "@height": "31",
            "@width": "47",
            "@_fa": "true",
            "$": "https://api.elsevier.com/content/object/eid/1-s2.0-S0926860X18305866-si12.gif?httpAccept=%2A%2F%2A",
            "@multimediatype": "GIF image file",
            "@type": "ALTIMG",
            "@size": "172",
            "@ref": "si12",
            "@mimetype": "image/gif"
          },
          {
            "@category": "thumbnail",
            "@height": "33",
            "@width": "483",
            "@_fa": "true",
            "$": "https://api.elsevier.com/content/object/eid/1-s2.0-S0926860X18305866-si13.gif?httpAccept=%2A%2F%2A",
            "@multimediatype": "GIF image file",
            "@type": "ALTIMG",
            "@size": "1530",
            "@ref": "si13",
            "@mimetype": "image/gif"
          },
          {
            "@category": "thumbnail",
            "@height": "52",
            "@width": "275",
            "@_fa": "true",
            "$": "https://api.elsevier.com/content/object/eid/1-s2.0-S0926860X18305866-si14.gif?httpAccept=%2A%2F%2A",
            "@multimediatype": "GIF image file",
            "@type": "ALTIMG",
            "@size": "1334",
            "@ref": "si14",
            "@mimetype": "image/gif"
          },
          {
            "@category": "thumbnail",
            "@height": "55",
            "@width": "354",
            "@_fa": "true",
            "$": "https://api.elsevier.com/content/object/eid/1-s2.0-S0926860X18305866-si15.gif?httpAccept=%2A%2F%2A",
            "@multimediatype": "GIF image file",
            "@type": "ALTIMG",
            "@size": "1607",
            "@ref": "si15",
            "@mimetype": "image/gif"
          },
          {
            "@category": "thumbnail",
            "@height": "42",
            "@width": "145",
            "@_fa": "true",
            "$": "https://api.elsevier.com/content/object/eid/1-s2.0-S0926860X18305866-si16.gif?httpAccept=%2A%2F%2A",
            "@multimediatype": "GIF image file",
            "@type": "ALTIMG",
            "@size": "527",
            "@ref": "si16",
            "@mimetype": "image/gif"
          },
          {
            "@category": "thumbnail",
            "@height": "37",
            "@width": "43",
            "@_fa": "true",
            "$": "https://api.elsevier.com/content/object/eid/1-s2.0-S0926860X18305866-si2.gif?httpAccept=%2A%2F%2A",
            "@multimediatype": "GIF image file",
            "@type": "ALTIMG",
            "@size": "206",
            "@ref": "si2",
            "@mimetype": "image/gif"
          },
          {
            "@category": "thumbnail",
            "@height": "31",
            "@width": "137",
            "@_fa": "true",
            "$": "https://api.elsevier.com/content/object/eid/1-s2.0-S0926860X18305866-si3.gif?httpAccept=%2A%2F%2A",
            "@multimediatype": "GIF image file",
            "@type": "ALTIMG",
            "@size": "508",
            "@ref": "si3",
            "@mimetype": "image/gif"
          },
          {
            "@category": "thumbnail",
            "@height": "27",
            "@width": "69",
            "@_fa": "true",
            "$": "https://api.elsevier.com/content/object/eid/1-s2.0-S0926860X18305866-si4.gif?httpAccept=%2A%2F%2A",
            "@multimediatype": "GIF image file",
            "@type": "ALTIMG",
            "@size": "291",
            "@ref": "si4",
            "@mimetype": "image/gif"
          },
          {
            "@category": "thumbnail",
            "@height": "31",
            "@width": "109",
            "@_fa": "true",
            "$": "https://api.elsevier.com/content/object/eid/1-s2.0-S0926860X18305866-si5.gif?httpAccept=%2A%2F%2A",
            "@multimediatype": "GIF image file",
            "@type": "ALTIMG",
            "@size": "440",
            "@ref": "si5",
            "@mimetype": "image/gif"
          },
          {
            "@category": "thumbnail",
            "@height": "31",
            "@width": "101",
            "@_fa": "true",
            "$": "https://api.elsevier.com/content/object/eid/1-s2.0-S0926860X18305866-si6.gif?httpAccept=%2A%2F%2A",
            "@multimediatype": "GIF image file",
            "@type": "ALTIMG",
            "@size": "410",
            "@ref": "si6",
            "@mimetype": "image/gif"
          },
          {
            "@category": "thumbnail",
            "@height": "37",
            "@width": "48",
            "@_fa": "true",
            "$": "https://api.elsevier.com/content/object/eid/1-s2.0-S0926860X18305866-si7.gif?httpAccept=%2A%2F%2A",
            "@multimediatype": "GIF image file",
            "@type": "ALTIMG",
            "@size": "241",
            "@ref": "si7",
            "@mimetype": "image/gif"
          },
          {
            "@category": "thumbnail",
            "@height": "33",
            "@width": "36",
            "@_fa": "true",
            "$": "https://api.elsevier.com/content/object/eid/1-s2.0-S0926860X18305866-si8.gif?httpAccept=%2A%2F%2A",
            "@multimediatype": "GIF image file",
            "@type": "ALTIMG",
            "@size": "183",
            "@ref": "si8",
            "@mimetype": "image/gif"
          },
          {
            "@category": "thumbnail",
            "@height": "31",
            "@width": "32",
            "@_fa": "true",
            "$": "https://api.elsevier.com/content/object/eid/1-s2.0-S0926860X18305866-si9.gif?httpAccept=%2A%2F%2A",
            "@multimediatype": "GIF image file",
            "@type": "ALTIMG",
            "@size": "166",
            "@ref": "si9",
            "@mimetype": "image/gif"
          },
          {
            "@category": "standard",
            "@_fa": "true",
            "$": "https://api.elsevier.com/content/object/eid/1-s2.0-S0926860X18305866-am.pdf?httpAccept=%2A%2F%2A",
            "@multimediatype": "Acrobat PDF file",
            "@type": "AAM-PDF",
            "@size": "1025921",
            "@ref": "am",
            "@mimetype": "application/pdf"
          }
        ]
      },
      "link": {
        "@rel": "abstract",
        "@href": "https://api.elsevier.com/content/abstract/scopus_id/85058052442"
      }
    }
  }
}