{
  "metadata": {
    "title": "Nitrogen-doped graphdiyne for effective metal deposition and heterogeneous Suzuki-Miyaura coupling catalysis",
    "authors": "; ; ",
    "journal": "Applied Catalysis A: General",
    "date": "2021-08-05",
    "doi": "10.1016/j.apcata.2021.118244",
    "abstract": "",
    "uri": "https://api.elsevier.com/content/article/pii/S0926860X21002581",
    "pii": "S0926860X21002581"
  },
  "fulltext": {
    "full-text-retrieval-response": {
      "scopus-eid": "2-s2.0-85107624728",
      "originalText": "serial JL 271346 291210 291744 291809 31 Applied Catalysis A: General APPLIEDCATALYSISAGENERAL 2021-06-09 2021-06-09 2021-06-10 2021-06-10 2022-01-27T16:52:28 1-s2.0-S0926860X21002581 S0926-860X(21)00258-1 S0926860X21002581 10.1016/j.apcata.2021.118244 S300 S300.1 FULL-TEXT 1-s2.0-S0926860X21X00130 2024-01-01T12:34:28.416125Z 0 0 20210805 2021 2021-06-09T08:09:40.661484Z absattachment articleinfo articlenumber articletitlenorm authfirstinitialnorm authfirstsurnamenorm cid cids contenttype copyright crossmark dateloaded dateloadedtxt datesearch datesort dateupdated dco docsubtype doctype doi eid ewtransactionid hubeid indexeddate issn issnnorm itemstage itemtransactionid itemweight openaccess openarchive pg pgfirst pii piinorm pubdatestart pubdatetxt pubyr sortorder srctitle srctitlenorm srctype ssids alllist content subj subheadings suppl tomb volfirst volissue volumelist webpdf webpdfpagecount yearnav figure table e-component body acknowledge affil appendices articletitle auth authfirstini authfull authkeywords authlast grantnumber grantsponsor highlightsabst primabst ref specialabst 0926-860X 0926860X true 623 623 C Volume 623 9 118244 118244 118244 20210805 5 August 2021 2021-08-05 2021 article fla © 2021 Elsevier B.V. All rights reserved. NITROGENDOPEDGRAPHDIYNEFOREFFECTIVEMETALDEPOSITIONHETEROGENEOUSSUZUKIMIYAURACOUPLINGCATALYSIS SHEN H 1 Introduction 2 Experimental section 2.1 Materials 2.2 Instruments for preparation and characterization 2.3 DFT calculations 2.4 Synthesis 2.4.1 Synthesis of precursors 2.4.2 Synthesis of NGDY 2.4.3 Fabrication of nano hybrids 2.5 Catalytic tests 3 Results and discussion 3.1 Synthesis and structural characterizations 3.2 Catalytic performance in the Suzuki-Miyaura reaction 3.3 DFT calculations 4 Conclusions CRediT authorship contribution statement Acknowledgements Appendix B Supplementary data References LI 2010 3256 3258 G LI 2014 2572 2586 Y JIA 2017 2470 2478 Z HUANG 2018 7744 7803 C GAO 2019 908 936 X ZUO 2019 1803762 Z XUE 2018 1460 Y LI 2020 2004115 J HE 2017 1172 J ZHAO 2018 924 931 Y LIU 2014 11336 11343 R YU 2018 1707564 H ZHAO 2019 7240 7244 Y SHANG 2018 144 154 H KAN 2018 53 58 X PAN 2019 2740 2744 Q ZHU 2011 3333 3338 X GILLILAND 2018 168 175 S GUO 2010 3959 3968 S MOUSSA 2012 145 154 S SIAMAKI 2011 1 11 A KUMAR 2015 7343 7351 R YANG 2016 19564 19572 Y GERBER 2020 1250 1349 I YANG 2018 20 26 Y ZHAO 2020 M OLIVEIRA 2020 1385 1394 R WANG 2019 1 9 L SHEN 2019 2563 2570 H QI 2015 5260 5263 H BELETSKAYA 2019 137 173 I HARIPRASAD 2012 1179 1186 E KEYHANIYAN 2018 19433 19441 M YAN 2020 6222 6230 X BOBB 2018 4852 4862 J YANG 2019 90 99 Y KANDATHIL 2020 384 403 V KRESSE 1996 15 50 G KRESSE 1996 11169 G PERDEW 1996 3865 3868 J MONKHORST 1976 5188 5192 H NORSKOV 2004 17886 17892 J PETROSYAN 2016 1442 1449 A NIE 2016 607 613 R RU 2019 e5198 Y SAHOO 2019 4678 4692 M SU 2021 119980 Y LI 2021 120034 W CHENG 2015 23207 23212 N YU 2019 402 413 H RYOU 2017 140 149 Y IBRAHIM 2020 194 203 A MOHAMMADINEZHAD 2017 5625 5641 A ZHAO 2020 M YANG 2018 25396 25403 Y YAN 2019 4977 Q FLECKENSTEIN 2010 694 711 C HARTWIG 2008 314 322 J XUE 2010 1692 1705 L SHENX2021X118244 SHENX2021X118244XH 2023-06-10T00:00:00.000Z 2023-06-10T00:00:00.000Z http://creativecommons.org/licenses/by-nc-nd/4.0/ © 2021 Elsevier B.V. All rights reserved. 2021-06-15T23:05:55.232Z http://vtw.elsevier.com/data/voc/AddOnTypes/50.7/aggregated-refined National key research and development project of China 2016YFA0200104 2018YFA0703501 NKRDPC National Key Research and Development Program of China http://data.elsevier.com/vocabulary/SciValFunders/501100012166 http://sws.geonames.org/1814991/ NSFC-DFG joint fund 21661132006 National Nature Science Foundation of China 21672222 21790050 21790051 22021002 NSFC National Natural Science Foundation of China http://data.elsevier.com/vocabulary/SciValFunders/501100001809 http://sws.geonames.org/1814991/ Chinese Academy of Science QYZDY-SSW-SLH015 CAS Chinese Academy of Sciences http://data.elsevier.com/vocabulary/SciValFunders/501100002367 http://sws.geonames.org/1814991/ This work was supported by the National key research and development project of China ( 2018YFA0703501 , 2016YFA0200104 ), the National Nature Science Foundation of China ( 22021002 , 21672222 , 21790050 , 21790051 ), NSFC-DFG joint fund ( 21661132006 ), the key program of the Chinese Academy of Science ( QYZDY-SSW-SLH015 ). 0 https://doi.org/10.15223/policy-017 https://doi.org/10.15223/policy-037 https://doi.org/10.15223/policy-012 https://doi.org/10.15223/policy-029 https://doi.org/10.15223/policy-004 item S0926-860X(21)00258-1 S0926860X21002581 1-s2.0-S0926860X21002581 10.1016/j.apcata.2021.118244 271346 2024-01-01T12:34:28.416125Z 2021-08-05 1-s2.0-S0926860X21002581-main.pdf https://s3-eu-west-1.amazonaws.com/prod-ucs-content-store-eu-west/content/pii:S0926860X21002581/MAIN/application/pdf/c9d780396b8697abfd4d3c709e8b1397/main.pdf main.pdf pdf true 8612328 MAIN 10 1-s2.0-S0926860X21002581-main_1.png https://s3-eu-west-1.amazonaws.com/prod-ucs-content-store-eu-west/content/pii:S0926860X21002581/PREVIEW/image/png/3d21f2b0b3c42ea01125e121e4133d4f/main_1.png main_1.png png 60059 849 656 IMAGE-WEB-PDF 1 1-s2.0-S0926860X21002581-fx11.jpg https://s3-eu-west-1.amazonaws.com/prod-ucs-content-store-eu-west/content/pii:S0926860X21002581/fx11/DOWNSAMPLED/image/jpeg/37d2cd0f13047951029ca0f0a5cee835/fx11.jpg fx11 fx11.jpg jpg 1361 40 64 IMAGE-DOWNSAMPLED 1-s2.0-S0926860X21002581-fx10.jpg https://s3-eu-west-1.amazonaws.com/prod-ucs-content-store-eu-west/content/pii:S0926860X21002581/fx10/DOWNSAMPLED/image/jpeg/b6640b68f79e258d93c4f3b2900c1302/fx10.jpg fx10 fx10.jpg jpg 1365 45 72 IMAGE-DOWNSAMPLED 1-s2.0-S0926860X21002581-gr6.jpg https://s3-eu-west-1.amazonaws.com/prod-ucs-content-store-eu-west/content/pii:S0926860X21002581/gr6/DOWNSAMPLED/image/jpeg/941be611776507185339d93311323eee/gr6.jpg gr6 gr6.jpg jpg 75270 531 602 IMAGE-DOWNSAMPLED 1-s2.0-S0926860X21002581-fx14.jpg https://s3-eu-west-1.amazonaws.com/prod-ucs-content-store-eu-west/content/pii:S0926860X21002581/fx14/DOWNSAMPLED/image/jpeg/b3bbf4ab71c1e03f3762aec6b85fa469/fx14.jpg fx14 fx14.jpg jpg 1222 44 63 IMAGE-DOWNSAMPLED 1-s2.0-S0926860X21002581-gr4.jpg https://s3-eu-west-1.amazonaws.com/prod-ucs-content-store-eu-west/content/pii:S0926860X21002581/gr4/DOWNSAMPLED/image/jpeg/3af7fbb1c5af3fe807fae9308fa33dc5/gr4.jpg gr4 gr4.jpg jpg 25074 228 602 IMAGE-DOWNSAMPLED 1-s2.0-S0926860X21002581-fx13.jpg https://s3-eu-west-1.amazonaws.com/prod-ucs-content-store-eu-west/content/pii:S0926860X21002581/fx13/DOWNSAMPLED/image/jpeg/a9cbaed32f6194345b6e088860ecebff/fx13.jpg fx13 fx13.jpg jpg 3751 76 183 IMAGE-DOWNSAMPLED 1-s2.0-S0926860X21002581-gr5.jpg https://s3-eu-west-1.amazonaws.com/prod-ucs-content-store-eu-west/content/pii:S0926860X21002581/gr5/DOWNSAMPLED/image/jpeg/23df8c02dcd31e35cd8544f8e168003c/gr5.jpg gr5 gr5.jpg jpg 23084 243 339 IMAGE-DOWNSAMPLED 1-s2.0-S0926860X21002581-fx12.jpg https://s3-eu-west-1.amazonaws.com/prod-ucs-content-store-eu-west/content/pii:S0926860X21002581/fx12/DOWNSAMPLED/image/jpeg/0d74ad0e0076ae7950c6e7eb74a6b9a8/fx12.jpg fx12 fx12.jpg jpg 1473 50 55 IMAGE-DOWNSAMPLED 1-s2.0-S0926860X21002581-ga1.jpg https://s3-eu-west-1.amazonaws.com/prod-ucs-content-store-eu-west/content/pii:S0926860X21002581/ga1/DOWNSAMPLED/image/jpeg/73c6f69c7d0fadfe77436f1810476043/ga1.jpg ga1 true ga1.jpg jpg 27600 200 298 IMAGE-DOWNSAMPLED 1-s2.0-S0926860X21002581-fx1.jpg https://s3-eu-west-1.amazonaws.com/prod-ucs-content-store-eu-west/content/pii:S0926860X21002581/fx1/DOWNSAMPLED/image/jpeg/f658ea55ab4fb8f9c1a797d2897fae2c/fx1.jpg fx1 fx1.jpg jpg 981 34 43 IMAGE-DOWNSAMPLED 1-s2.0-S0926860X21002581-fx2.jpg https://s3-eu-west-1.amazonaws.com/prod-ucs-content-store-eu-west/content/pii:S0926860X21002581/fx2/DOWNSAMPLED/image/jpeg/de17ed2c9c6e01afdd623460e6167c71/fx2.jpg fx2 fx2.jpg jpg 2605 40 120 IMAGE-DOWNSAMPLED 1-s2.0-S0926860X21002581-gr2.jpg https://s3-eu-west-1.amazonaws.com/prod-ucs-content-store-eu-west/content/pii:S0926860X21002581/gr2/DOWNSAMPLED/image/jpeg/ddcc1ea56e57887fa723421576aec074/gr2.jpg gr2 gr2.jpg jpg 249574 867 753 IMAGE-DOWNSAMPLED 1-s2.0-S0926860X21002581-fx9.jpg https://s3-eu-west-1.amazonaws.com/prod-ucs-content-store-eu-west/content/pii:S0926860X21002581/fx9/DOWNSAMPLED/image/jpeg/4ec5464b14a325c56a4da4c6dd2c16fa/fx9.jpg fx9 fx9.jpg jpg 1446 33 75 IMAGE-DOWNSAMPLED 1-s2.0-S0926860X21002581-gr3.jpg https://s3-eu-west-1.amazonaws.com/prod-ucs-content-store-eu-west/content/pii:S0926860X21002581/gr3/DOWNSAMPLED/image/jpeg/8587fa9ad168792ac8d6e224c14f7eeb/gr3.jpg gr3 gr3.jpg jpg 146569 602 753 IMAGE-DOWNSAMPLED 1-s2.0-S0926860X21002581-fx7.jpg https://s3-eu-west-1.amazonaws.com/prod-ucs-content-store-eu-west/content/pii:S0926860X21002581/fx7/DOWNSAMPLED/image/jpeg/38e902acbecb4e9cc022cbfffd3e889e/fx7.jpg fx7 fx7.jpg jpg 1427 31 92 IMAGE-DOWNSAMPLED 1-s2.0-S0926860X21002581-gr1.jpg https://s3-eu-west-1.amazonaws.com/prod-ucs-content-store-eu-west/content/pii:S0926860X21002581/gr1/DOWNSAMPLED/image/jpeg/c3e6ffe46ef5d396bbd1e0576e107811/gr1.jpg gr1 gr1.jpg jpg 105018 449 678 IMAGE-DOWNSAMPLED 1-s2.0-S0926860X21002581-fx8.jpg https://s3-eu-west-1.amazonaws.com/prod-ucs-content-store-eu-west/content/pii:S0926860X21002581/fx8/DOWNSAMPLED/image/jpeg/fda5abdccc318027c3a9ed82badd472d/fx8.jpg fx8 fx8.jpg jpg 1493 30 94 IMAGE-DOWNSAMPLED 1-s2.0-S0926860X21002581-fx5.jpg https://s3-eu-west-1.amazonaws.com/prod-ucs-content-store-eu-west/content/pii:S0926860X21002581/fx5/DOWNSAMPLED/image/jpeg/df7dc2d69f182644667c282e7ef15d38/fx5.jpg fx5 fx5.jpg jpg 998 34 47 IMAGE-DOWNSAMPLED 1-s2.0-S0926860X21002581-fx6.jpg https://s3-eu-west-1.amazonaws.com/prod-ucs-content-store-eu-west/content/pii:S0926860X21002581/fx6/DOWNSAMPLED/image/jpeg/f73da46e9fb016ca5192bfc2fc318f52/fx6.jpg fx6 fx6.jpg jpg 998 33 47 IMAGE-DOWNSAMPLED 1-s2.0-S0926860X21002581-sc1.jpg https://s3-eu-west-1.amazonaws.com/prod-ucs-content-store-eu-west/content/pii:S0926860X21002581/sc1/DOWNSAMPLED/image/jpeg/ddd8ac3a97ac0a15593abdd22ff3c52b/sc1.jpg sc1 sc1.jpg jpg 35718 298 567 IMAGE-DOWNSAMPLED 1-s2.0-S0926860X21002581-fx3.jpg https://s3-eu-west-1.amazonaws.com/prod-ucs-content-store-eu-west/content/pii:S0926860X21002581/fx3/DOWNSAMPLED/image/jpeg/6a2c69eca46f89dd367fd77d1e82f483/fx3.jpg fx3 fx3.jpg jpg 1058 37 53 IMAGE-DOWNSAMPLED 1-s2.0-S0926860X21002581-fx4.jpg https://s3-eu-west-1.amazonaws.com/prod-ucs-content-store-eu-west/content/pii:S0926860X21002581/fx4/DOWNSAMPLED/image/jpeg/b8351ea5aa80b1d14fcf0acfaccaa059/fx4.jpg fx4 fx4.jpg jpg 2393 73 106 IMAGE-DOWNSAMPLED 1-s2.0-S0926860X21002581-fx11.sml https://s3-eu-west-1.amazonaws.com/prod-ucs-content-store-eu-west/content/pii:S0926860X21002581/fx11/THUMBNAIL/image/gif/afb37dbb7b5212636b8f161fc580c36d/fx11.sml fx11 fx11.sml sml 5254 137 219 IMAGE-THUMBNAIL 1-s2.0-S0926860X21002581-fx10.sml https://s3-eu-west-1.amazonaws.com/prod-ucs-content-store-eu-west/content/pii:S0926860X21002581/fx10/THUMBNAIL/image/gif/c523249993a98e6bbeb6abc06018d40a/fx10.sml fx10 fx10.sml sml 4387 137 219 IMAGE-THUMBNAIL 1-s2.0-S0926860X21002581-gr6.sml https://s3-eu-west-1.amazonaws.com/prod-ucs-content-store-eu-west/content/pii:S0926860X21002581/gr6/THUMBNAIL/image/gif/da12e875607468e5721a69db8aede9b7/gr6.sml gr6 gr6.sml sml 9902 164 186 IMAGE-THUMBNAIL 1-s2.0-S0926860X21002581-fx14.sml https://s3-eu-west-1.amazonaws.com/prod-ucs-content-store-eu-west/content/pii:S0926860X21002581/fx14/THUMBNAIL/image/gif/724fdcba5e5405dd45f46e45a3d8e87b/fx14.sml fx14 fx14.sml sml 4256 153 219 IMAGE-THUMBNAIL 1-s2.0-S0926860X21002581-gr4.sml https://s3-eu-west-1.amazonaws.com/prod-ucs-content-store-eu-west/content/pii:S0926860X21002581/gr4/THUMBNAIL/image/gif/5390efff647568b18368008af1e7ea77/gr4.sml gr4 gr4.sml sml 4349 83 219 IMAGE-THUMBNAIL 1-s2.0-S0926860X21002581-fx13.sml https://s3-eu-west-1.amazonaws.com/prod-ucs-content-store-eu-west/content/pii:S0926860X21002581/fx13/THUMBNAIL/image/gif/93a485e2e7fadbf2cb4536150d8ba7da/fx13.sml fx13 fx13.sml sml 3153 91 219 IMAGE-THUMBNAIL 1-s2.0-S0926860X21002581-gr5.sml https://s3-eu-west-1.amazonaws.com/prod-ucs-content-store-eu-west/content/pii:S0926860X21002581/gr5/THUMBNAIL/image/gif/cc7e41d2fa8aee88b8a6f9895204b938/gr5.sml gr5 gr5.sml sml 8282 157 219 IMAGE-THUMBNAIL 1-s2.0-S0926860X21002581-fx12.sml https://s3-eu-west-1.amazonaws.com/prod-ucs-content-store-eu-west/content/pii:S0926860X21002581/fx12/THUMBNAIL/image/gif/a7a1a8f0f9171066ccd0d719416017b6/fx12.sml fx12 fx12.sml sml 4837 164 179 IMAGE-THUMBNAIL 1-s2.0-S0926860X21002581-ga1.sml https://s3-eu-west-1.amazonaws.com/prod-ucs-content-store-eu-west/content/pii:S0926860X21002581/ga1/THUMBNAIL/image/gif/d2484e2e4f1f9d2bfaf52558e9bb4acd/ga1.sml ga1 true ga1.sml sml 18167 147 219 IMAGE-THUMBNAIL 1-s2.0-S0926860X21002581-fx1.sml https://s3-eu-west-1.amazonaws.com/prod-ucs-content-store-eu-west/content/pii:S0926860X21002581/fx1/THUMBNAIL/image/gif/7bda2151b3b774283ee6291b7f13a063/fx1.sml fx1 fx1.sml sml 4212 154 192 IMAGE-THUMBNAIL 1-s2.0-S0926860X21002581-fx2.sml https://s3-eu-west-1.amazonaws.com/prod-ucs-content-store-eu-west/content/pii:S0926860X21002581/fx2/THUMBNAIL/image/gif/013faa05e97b78a6ab5dfbb21d92d821/fx2.sml fx2 fx2.sml sml 4085 74 219 IMAGE-THUMBNAIL 1-s2.0-S0926860X21002581-gr2.sml https://s3-eu-west-1.amazonaws.com/prod-ucs-content-store-eu-west/content/pii:S0926860X21002581/gr2/THUMBNAIL/image/gif/68de282bff6505f04ac9c9b884ee4998/gr2.sml gr2 gr2.sml sml 16829 163 142 IMAGE-THUMBNAIL 1-s2.0-S0926860X21002581-fx9.sml https://s3-eu-west-1.amazonaws.com/prod-ucs-content-store-eu-west/content/pii:S0926860X21002581/fx9/THUMBNAIL/image/gif/deec99763e93fdecb61af50000bc0ad9/fx9.sml fx9 fx9.sml sml 4152 96 219 IMAGE-THUMBNAIL 1-s2.0-S0926860X21002581-gr3.sml https://s3-eu-west-1.amazonaws.com/prod-ucs-content-store-eu-west/content/pii:S0926860X21002581/gr3/THUMBNAIL/image/gif/6e60583d94d87a7a55c2dd2fb9d1c027/gr3.sml gr3 gr3.sml sml 16257 164 205 IMAGE-THUMBNAIL 1-s2.0-S0926860X21002581-fx7.sml https://s3-eu-west-1.amazonaws.com/prod-ucs-content-store-eu-west/content/pii:S0926860X21002581/fx7/THUMBNAIL/image/gif/7e2171f0b2ef68b3984c555e920cf2f4/fx7.sml fx7 fx7.sml sml 3263 74 219 IMAGE-THUMBNAIL 1-s2.0-S0926860X21002581-gr1.sml https://s3-eu-west-1.amazonaws.com/prod-ucs-content-store-eu-west/content/pii:S0926860X21002581/gr1/THUMBNAIL/image/gif/a9d9de3c2e9d93e5f07a56a5caf05b2e/gr1.sml gr1 gr1.sml sml 14352 145 219 IMAGE-THUMBNAIL 1-s2.0-S0926860X21002581-fx8.sml https://s3-eu-west-1.amazonaws.com/prod-ucs-content-store-eu-west/content/pii:S0926860X21002581/fx8/THUMBNAIL/image/gif/a04afa156e03f805c077d969cdaf04e7/fx8.sml fx8 fx8.sml sml 3155 69 219 IMAGE-THUMBNAIL 1-s2.0-S0926860X21002581-fx5.sml https://s3-eu-west-1.amazonaws.com/prod-ucs-content-store-eu-west/content/pii:S0926860X21002581/fx5/THUMBNAIL/image/gif/5ad8cce887c82ed8e1d6fe4679d5e074/fx5.sml fx5 fx5.sml sml 4452 153 212 IMAGE-THUMBNAIL 1-s2.0-S0926860X21002581-fx6.sml https://s3-eu-west-1.amazonaws.com/prod-ucs-content-store-eu-west/content/pii:S0926860X21002581/fx6/THUMBNAIL/image/gif/9c9d72f4aa753262fe0a488c9963d497/fx6.sml fx6 fx6.sml sml 6490 150 212 IMAGE-THUMBNAIL 1-s2.0-S0926860X21002581-sc1.sml https://s3-eu-west-1.amazonaws.com/prod-ucs-content-store-eu-west/content/pii:S0926860X21002581/sc1/THUMBNAIL/image/gif/80774a6d8cc95a2437f0ae421de77e05/sc1.sml sc1 sc1.sml sml 7759 115 219 IMAGE-THUMBNAIL 1-s2.0-S0926860X21002581-fx3.sml https://s3-eu-west-1.amazonaws.com/prod-ucs-content-store-eu-west/content/pii:S0926860X21002581/fx3/THUMBNAIL/image/gif/643421014816bc3d72252214e4886e63/fx3.sml fx3 fx3.sml sml 5052 154 219 IMAGE-THUMBNAIL 1-s2.0-S0926860X21002581-fx4.sml https://s3-eu-west-1.amazonaws.com/prod-ucs-content-store-eu-west/content/pii:S0926860X21002581/fx4/THUMBNAIL/image/gif/305babdfe33c43da7dc3f1b75717a4f2/fx4.sml fx4 fx4.sml sml 4134 151 219 IMAGE-THUMBNAIL 1-s2.0-S0926860X21002581-fx11_lrg.jpg https://s3-eu-west-1.amazonaws.com/prod-ucs-content-store-eu-west/content/pii:S0926860X21002581/fx11/HIGHRES/image/jpeg/ef735a1309dd21f6c6de68ea59675d12/fx11_lrg.jpg fx11 fx11_lrg.jpg jpg 8786 178 284 IMAGE-HIGH-RES 1-s2.0-S0926860X21002581-fx10_lrg.jpg https://s3-eu-west-1.amazonaws.com/prod-ucs-content-store-eu-west/content/pii:S0926860X21002581/fx10/HIGHRES/image/jpeg/edb193b4c5ff3486ef514faf4604ef8a/fx10_lrg.jpg fx10 fx10_lrg.jpg jpg 8284 200 320 IMAGE-HIGH-RES 1-s2.0-S0926860X21002581-gr6_lrg.jpg https://s3-eu-west-1.amazonaws.com/prod-ucs-content-store-eu-west/content/pii:S0926860X21002581/gr6/HIGHRES/image/jpeg/4fa8063a3d2b93b39f3d84b225e3882a/gr6_lrg.jpg gr6 gr6_lrg.jpg jpg 552932 2353 2667 IMAGE-HIGH-RES 1-s2.0-S0926860X21002581-fx14_lrg.jpg https://s3-eu-west-1.amazonaws.com/prod-ucs-content-store-eu-west/content/pii:S0926860X21002581/fx14/HIGHRES/image/jpeg/1e9c911031a77865a75c760635ce0cc0/fx14_lrg.jpg fx14 fx14_lrg.jpg jpg 7592 198 283 IMAGE-HIGH-RES 1-s2.0-S0926860X21002581-gr4_lrg.jpg https://s3-eu-west-1.amazonaws.com/prod-ucs-content-store-eu-west/content/pii:S0926860X21002581/gr4/HIGHRES/image/jpeg/22472880f87d41ac48dba96ca0887f42/gr4_lrg.jpg gr4 gr4_lrg.jpg jpg 203921 1011 2667 IMAGE-HIGH-RES 1-s2.0-S0926860X21002581-fx13_lrg.jpg https://s3-eu-west-1.amazonaws.com/prod-ucs-content-store-eu-west/content/pii:S0926860X21002581/fx13/HIGHRES/image/jpeg/1fef2195d447efd1cffb90e0edc358c6/fx13_lrg.jpg fx13 fx13_lrg.jpg jpg 25782 337 811 IMAGE-HIGH-RES 1-s2.0-S0926860X21002581-gr5_lrg.jpg https://s3-eu-west-1.amazonaws.com/prod-ucs-content-store-eu-west/content/pii:S0926860X21002581/gr5/HIGHRES/image/jpeg/e862e28e677ac513f251b58630ac7a46/gr5_lrg.jpg gr5 gr5_lrg.jpg jpg 162203 1074 1500 IMAGE-HIGH-RES 1-s2.0-S0926860X21002581-fx12_lrg.jpg https://s3-eu-west-1.amazonaws.com/prod-ucs-content-store-eu-west/content/pii:S0926860X21002581/fx12/HIGHRES/image/jpeg/286d1a6652567457212256732d0bdce8/fx12_lrg.jpg fx12 fx12_lrg.jpg jpg 9070 223 244 IMAGE-HIGH-RES 1-s2.0-S0926860X21002581-ga1_lrg.jpg https://s3-eu-west-1.amazonaws.com/prod-ucs-content-store-eu-west/content/pii:S0926860X21002581/ga1/HIGHRES/image/jpeg/23d5972ee0a80c75d36d51047e35d260/ga1_lrg.jpg ga1 true ga1_lrg.jpg jpg 206613 886 1319 IMAGE-HIGH-RES 1-s2.0-S0926860X21002581-fx1_lrg.jpg https://s3-eu-west-1.amazonaws.com/prod-ucs-content-store-eu-west/content/pii:S0926860X21002581/fx1/HIGHRES/image/jpeg/d5b7c848140836405932841403270365/fx1_lrg.jpg fx1 fx1_lrg.jpg jpg 5218 154 192 IMAGE-HIGH-RES 1-s2.0-S0926860X21002581-fx2_lrg.jpg https://s3-eu-west-1.amazonaws.com/prod-ucs-content-store-eu-west/content/pii:S0926860X21002581/fx2/HIGHRES/image/jpeg/91b0c549585338fcd352e5c5017dc52e/fx2_lrg.jpg fx2 fx2_lrg.jpg jpg 18037 179 532 IMAGE-HIGH-RES 1-s2.0-S0926860X21002581-gr2_lrg.jpg https://s3-eu-west-1.amazonaws.com/prod-ucs-content-store-eu-west/content/pii:S0926860X21002581/gr2/HIGHRES/image/jpeg/9f7bda60c220120be8d524328949afa9/gr2_lrg.jpg gr2 gr2_lrg.jpg jpg 2672091 3837 3333 IMAGE-HIGH-RES 1-s2.0-S0926860X21002581-fx9_lrg.jpg https://s3-eu-west-1.amazonaws.com/prod-ucs-content-store-eu-west/content/pii:S0926860X21002581/fx9/HIGHRES/image/jpeg/7d0527de451ed0e4c08b8c91d44da23a/fx9_lrg.jpg fx9 fx9_lrg.jpg jpg 9137 147 335 IMAGE-HIGH-RES 1-s2.0-S0926860X21002581-gr3_lrg.jpg https://s3-eu-west-1.amazonaws.com/prod-ucs-content-store-eu-west/content/pii:S0926860X21002581/gr3/HIGHRES/image/jpeg/38ad6a77b7bb1ad4c67bda9321469418/gr3_lrg.jpg gr3 gr3_lrg.jpg jpg 1338942 2666 3333 IMAGE-HIGH-RES 1-s2.0-S0926860X21002581-fx7_lrg.jpg https://s3-eu-west-1.amazonaws.com/prod-ucs-content-store-eu-west/content/pii:S0926860X21002581/fx7/HIGHRES/image/jpeg/43234257e3bc2a3c6b8bf0c75cead222/fx7_lrg.jpg fx7 fx7_lrg.jpg jpg 8294 138 409 IMAGE-HIGH-RES 1-s2.0-S0926860X21002581-gr1_lrg.jpg https://s3-eu-west-1.amazonaws.com/prod-ucs-content-store-eu-west/content/pii:S0926860X21002581/gr1/HIGHRES/image/jpeg/ac65bc04d9a8786743d1d776dca73df4/gr1_lrg.jpg gr1 gr1_lrg.jpg jpg 811879 1985 3000 IMAGE-HIGH-RES 1-s2.0-S0926860X21002581-fx8_lrg.jpg https://s3-eu-west-1.amazonaws.com/prod-ucs-content-store-eu-west/content/pii:S0926860X21002581/fx8/HIGHRES/image/jpeg/99f88d5421e85205ce5236f061e7b8fe/fx8_lrg.jpg fx8 fx8_lrg.jpg jpg 8413 132 416 IMAGE-HIGH-RES 1-s2.0-S0926860X21002581-fx5_lrg.jpg https://s3-eu-west-1.amazonaws.com/prod-ucs-content-store-eu-west/content/pii:S0926860X21002581/fx5/HIGHRES/image/jpeg/dff23f3a8bf790f12f872cb8c4e4dc67/fx5_lrg.jpg fx5 fx5_lrg.jpg jpg 5919 153 212 IMAGE-HIGH-RES 1-s2.0-S0926860X21002581-fx6_lrg.jpg https://s3-eu-west-1.amazonaws.com/prod-ucs-content-store-eu-west/content/pii:S0926860X21002581/fx6/HIGHRES/image/jpeg/2f4a885de7964a82753169f463e37d05/fx6_lrg.jpg fx6 fx6_lrg.jpg jpg 5714 150 212 IMAGE-HIGH-RES 1-s2.0-S0926860X21002581-sc1_lrg.jpg https://s3-eu-west-1.amazonaws.com/prod-ucs-content-store-eu-west/content/pii:S0926860X21002581/sc1/HIGHRES/image/jpeg/00cd4572b262aba92613f26d417b79cd/sc1_lrg.jpg sc1 sc1_lrg.jpg jpg 317977 1317 2510 IMAGE-HIGH-RES 1-s2.0-S0926860X21002581-fx3_lrg.jpg https://s3-eu-west-1.amazonaws.com/prod-ucs-content-store-eu-west/content/pii:S0926860X21002581/fx3/HIGHRES/image/jpeg/5af52a8d8d566009f983e90238839b8b/fx3_lrg.jpg fx3 fx3_lrg.jpg jpg 6458 167 238 IMAGE-HIGH-RES 1-s2.0-S0926860X21002581-fx4_lrg.jpg https://s3-eu-west-1.amazonaws.com/prod-ucs-content-store-eu-west/content/pii:S0926860X21002581/fx4/HIGHRES/image/jpeg/fba2379141228539bbc3a433192a1289/fx4_lrg.jpg fx4 fx4_lrg.jpg jpg 15650 325 470 IMAGE-HIGH-RES 1-s2.0-S0926860X21002581-mmc1.docx https://s3-eu-west-1.amazonaws.com/prod-ucs-content-store-eu-west/content/pii:S0926860X21002581/mmc1/MAIN/application/vnd.openxmlformats-officedocument.wordprocessingml.document/978a2ff2b8b106e16d9eb08a8eae77dd/mmc1.docx mmc1 mmc1.docx docx 1896707 APPLICATION 1-s2.0-S0926860X21002581-am.pdf https://s3-eu-west-1.amazonaws.com/prod-ucs-content-store-eu-west/content/egi:10SSX9C4ZC9/MAIN/application/pdf/8d00b4202bd50678c41a89d4ae2034bd/am.pdf am am.pdf pdf false 1135415 AAM-PDF APCATA 118244 118244 S0926-860X(21)00258-1 10.1016/j.apcata.2021.118244 Elsevier B.V. Scheme 1 Illustrations of the synthesis of NGDY through bottom-up pathway: a) experimental apparatus; b) synthetic route; c) the photo of NGDY growing on Cu plate. Scheme 1 Fig. 1 Design principle for the N-doped graphdiyne applied for the support of metal nanoparticles. Fig. 1 Fig. 2 a) SEM, b) TEM, c) HRTEM images of NGDY. TEM images of d) Pd-, g) Pt-, j) Cu-, m) Ni-NGDY. Size distribution of e) Pd-, h) Pt-, k) Cu-, n) Ni-NGDY. HRTEM images of f) Pd-, i) Pt-, l) Cu-, o) Ni-NGDY. Fig. 2 Fig. 3 High-resolution XPS spectra of a) Pd, b) Pt, c) Cu, d) Ni NPs on NGDY and GDY, respectively. High-resolution XPS spectra of e) C 1s and f) N 1s of NGDY before and after Pd deposition process. g) Raman spectra of precursors, GDY, NGDY, and Pd-NGDY. Pd K-edge EXAFS spectra h) and XANES profiles i) for Pd-NGDY, Pd-GDY, and Pd foil. Fig. 3 Fig. 4 N2 adsorption and desorption isotherms of a) NGDY and b) Pd-NGDY. Fig. 4 Fig. 5 Progress of Suzuki-Miyaura reactions under the catalyzing of different catalysts. Conditions: 0.5 mmol iodobenzene, 0.75 mmol phenylboronic acid, 1 mmol K2CO3, Ethanol/Water (7:4), 80 ℃; 10 mg Pd-NGDY, reused Pd-NGDY, and Pd-C catalysts. Inset: TOF number of reactions using different catalysts. Fig. 5 Fig. 6 a) Calculated band structure and density of states of NGDY. b) Charge difference density of Pd-NGDY. Red and green represent charge depletion and accumulation respectively. c) Free energy profile of the Pd-NGDY catalyzed Suzuki-Miyaura coupling reaction of iodobenzene and phenylboronic acid. Fig. 6 Table 1 Substrate scope and yield of Pd-NGDY catalyzed Suzuki-Miyaura reaction. Table 1 Entry Boronic acid Entry Boronic ester Substrate Yield (%) Substrate Yield (%) 1 99 10a 70 2 97 11a 67 3 trace 12a 80 4 95 Boronic acid 5 97 6 96 7 94 Boronic ester 8 97 9 90 Reaction conditions: 0.5mmol aryl halides, 1.5 equivalent boronic agent and 2 equivalent K2CO3 using Pd-NGDY catalyst in 11 ml EtOH-H2O (v/v = 7:4), 80 ℃, 2 h. a Reaction conditions: toluene/ethanol = 3:1, 5 h. Table 2 Comparison of catalysts for Suzuki-Miyaura reactions (bromobenzene and phenylboronic acid as reactants) in literature. Table 2 Catalyst Solvent Base Temp Time Yield NHC-Pd@GO [37] EtOH-H2O (1:1) K2CO3 R. T 1 h 96 % Pd/(RGO-PPD) [52] EtOH-H2O (1:1) K2CO3 R. T 0.5 h 100 % IL-RGO/Pd2.5Cu2.5 [45] EtOH-H2O (4:1) K2CO3 80 ℃ 1 h 94 % Fe3O4@Boehmite-NH2-Co‖ [53] H2O KOH 80 ℃ 35 min 95 % Pd-PVA [32] EtOH K2CO3 80 ℃ 2.5 h 100 % Pd-NGDY (this work) EtOH-H2O (7:4) K2CO3 80 ℃ 1.5 h 97 % Pd-GDY (this work) EtOH-H2O (7:4) K2CO3 80 ℃ 3 h 95 % Nitrogen-doped graphdiyne for effective metal deposition and heterogeneous Suzuki-Miyaura coupling catalysis Han Shen a b Jingyi He a b Feng He a b Yurui Xue a Yongjun Li a b * Yuliang Li a b a Beijing National Laboratory for Molecular Sciences (BNLMS), CAS Key Laboratory of Organic Solids, Institute of Chemistry, CAS Research/Education Center for Excellence in Molecular Sciences, Chinese Academy of Sciences, Beijing, 100190, PR China Beijing National Laboratory for Molecular Sciences (BNLMS) CAS Key Laboratory of Organic Solids Institute of Chemistry CAS Research/Education Center for Excellence in Molecular Sciences Chinese Academy of Sciences Beijing 100190 PR China Beijing National Laboratory for Molecular Sciences (BNLMS), CAS Key Laboratory of Organic Solids, Institute of Chemistry, CAS Research/Education Center for Excellence in Molecular Sciences, Chinese Academy of Sciences, Beijing 100190, P. R. China b University of Chinese Academy of Sciences, Beijing, 100049, PR China University of Chinese Academy of Sciences Beijing 100049 PR China University of Chinese Academy of Sciences, Beijing 100049, PR China ⁎ Corresponding author at: Beijing National Laboratory for Molecular Sciences (BNLMS), CAS Key Laboratory of Organic Solids, Institute of Chemistry, CAS Research/Education Center for Excellence in Molecular Sciences, Chinese Academy of Sciences, Beijing, 100190, PR China. Beijing National Laboratory for Molecular Sciences (BNLMS) CAS Key Laboratory of Organic Solids Institute of Chemistry CAS Research/Education Center for Excellence in Molecular Sciences Chinese Academy of Sciences Beijing 100190 PR China Graphical abstract For heterogeneous catalysts with nitrogen doped carbon materials as supporting substrates, accurate nitrogen (N) species and content is an important factor for promoting the catalytic activity. In this paper, N-doped graphdiyne (NGDY) was prepared from tetraethynylpyrazine (TEP) by bottom-up synthesis method as the support of metal nanoparticles. Specific pyridine nitrogen atoms are introduced in the N-doped carbon material. This unique structure makes it a promising material to support ultrafine metal particles or clusters. Microwave-assisted anchoring of Pd, Pt, Cu, Ni nanoparticles on NGDY generated novel hybrid composites, in which Pd-NGDY has high versatility for Suzuki-Miyaura reaction. DFT calculations revealed a charge transfer from NGDY to Pd NPs, and the free energy distribution showed a downward trend for Suzuki-Miyaura coupling reactions. Keywords Nitrogen doping Graphdiyne Pd nanoparticle Suzuki-Miyaura reaction Heterogenous catalyst 1 Introduction Graphdiyne (GDY) [1], a novel material combining sp and sp2 hybridized carbon in a conjugated structure, is attracting more attention of academic field as a member of carbon allotropes for its unique chemical and electron structure [2–5], and extraordinary performance in many fields, such as electrochemical catalysis [6,7] and batteries [8,9]. For further improving the electron distribution of carbon materials and adsorption capability of metal nanoparticles (NPs) toward reactants, nitrogen-doping is a common employed method. Reported nitrogen doped GDY (NGDY) has been used in electrochemistry [10–14] (however applications in other fields are relatively rare), in which the specific N atom has a significant impact on the performance of catalysis. Traditional pathway to prepare NGDY is the pyrolysis of nitrogen sources [11,12] that involve high thermal energy consumption and various N sites production. Considering the bottom-up synthesis of GDY, the synthesis of NGDY from suitable N-containing monomer is a unique and attractive way to obtain certain nitrogen species and content. Some works have been reported to prepare such NGDY [15,16], but little has been done in the preparation of NGDY with alternative hole topology, as well as the catalytic activity and charge transfer between NGDY and metal nanoparticles (NPs). Microwave irradiation is an effective protocol for metal ion nucleation and NPs anchoring [17,18]. Metal NPs generate in diverse sizes and valence states under different irradiation conditions [17,19]. In addition, microwave irradiation is a facile way to help the formation of holes in 2D substrates (such as graphene) for anchoring metal catalysts [20–23]. Graphene-based supports with vacancy defect sites also play important roles in enhancing charge transfer between metal catalysts and supports to promote catalysis performance [24–28]. Therefore, it is economical and convenient to deposite NPs on our NGDY with natural pore structure by microwave deposition. Large π conjugated network makes GDY a promising substrate for anchoring metal NPs to prepare composite heterogeneous catalysts [29,30], so does NGDY. In comparison, homogeneous catalysts usually show super high efficiency because of its good molecular dispersion, but this advantage also brings difficulties to the separation and recovery of catalysts [31]. As for heterogeneous catalysts, although their efficiency is relatively low, they have attracted extensive attention due to the advantages of recovery and recycling [32,33]. Heterogeneous catalysts with metal NPs immobilized on the surface of supporting materials are commonly used in various organic reactions [34]. Good supporting materials can effectively prevent the aggregation of active metal NPs and improve the activity of the catalysts [31]. Therefore, it is an important issue to choose proper supporting materials. A large number of materials have been used as supporting materials, such as polymer [32], MOFs [35], graphene [21,36], graphene derivate [20,37], etc. In this paper, sp2-N-graphdiyne (NGDY) was successfully applied as the substrate for loading different metal nanoparticles (Pd, Pt, Cu and Ni), and a variety of hybrid materials were prepared (Fig. 1 ). In addition, the typical Suzuki-Miyaura reaction was used as a model reaction to investigate the effect of substrate on the performance of NPs based heterogeneous catalyst. Pd-NGDY was introduced into Suzuki-Miyaura reaction as a highly active catalyst, and NGDY served as a stabilizer for metal nanoparticles as well as electron reservoir through donor-acceptor charge transfer. The natural pore structure, the N atoms and diyne groups in the substrate will benefit the binding of metal nanoparticles and enhance the charge transfer ability. The prepared Pd-NGDY complex showed high heterogeneous catalytic activity (TOF number of 1287 h−1 for iodobenzene) in Suzuki-Miyaura reaction, which was higher than commercial Pd-C counterpart and the pristine GDY based heterogeneous catalysts. 2 Experimental section 2.1 Materials Most of the chemical reagents were analytically pure and purchased commercially from local supplier, and used directly without further handling unless otherwise stated. All reactions are performed under argon stream. 2.2 Instruments for preparation and characterization NPs deposition was carried out in a Biotage initiator microwave machine with temperature and reaction time as the dominating setting parameters. SEM images were taken with a Hitachi Model S-4800 field emission scanning electron microscope. The NGDY film on Cu plates was directly used for SEM observation. TEM and HRTEM images accompanied by EDS were captured with a JEM-2100 F transmission electron microscope with an accelerating voltage 200 kV. The TEM sample was prepared by dispersing NGDY films or Pd-NGDY powders in ethanol and transferred on the surface of Cu grids. Raman spectra were recorded with a Renishaw-2000 Raman spectrometer of resolution of 2 cm−1 by using of the 514.5 nm line of an Argon ion laser as the excitation source. X-ray photoelectron spectroscopy (XPS) was conducted with the Thermo Scientific ESCA Lab 250Xi using 200 W monochromat Al Kα radiation. X-ray powder diffraction pattern (XRD) were performed with a Japan Rikagu D/max-2500 rotation anode X-ray diffractometer equipped with graphite-monochromatized Cu Al Kα radiation in a 2θ range from 10 to 80° at a speed of 2° per minute at room temperature. NMR spectra were recorded with a Bruker AVANCE Ⅲ (400 MHz) spectrometer. The GC–MS samples were analyzed by Agilent 5977B. The acquired EXAFS data were processed according to the standard procedures using the ATHENA module implemented in the IFEFFIT software packages. The k3-weighted EXAFS spectra were obtained by subtracting the post-edge background from the overall absorption and then normalizing with respect to the edge-jump step. Subsequently, k3-weighted χ(k) data of Ru K-edge were Fourier transformed to real (R) space using a hanning windows (dk = 1.0 Å−1) to separate the EXAFS contributions from different coordination shells. To obtain the quantitative structural parameters around central atoms, least-squares curve parameter fitting was performed using the ARTEMIS module of IFEFFIT software packages. 2.3 DFT calculations All density functional theory (DFT) calculations were performed with Vienna ab-initio simulation package (VASP) in order to investigate the periodic structures [38,39]. Geometry optimization of all the intermediates involved in reactions was carried out with the Perdew-Burke-Ernzerbof (PBE) form of generalized gradient approximation functional (GGA) for exchange correlation functional [40]. During the configuration optimization and energy calculations, the plane wave cutoffs energy of 400 eV and the 3 × 3×1 Monkhorst − Pack k-points grids were set, respectively [41]. To describe the vdw interaction, the dispersion corrections DFT-D3 was employed. Besides, the spin polarization was considered throughout the calculations. According to the method developed by Nørskovet al., the Gibbs free energy change (ΔGads) of H atom involved in reactions is obtained by using the free energy of 1/2H2 (g) [42]. To construct the model of Pd nanocluster supported on N doped GDY for catalyzing the Suzuki reaction, a 2 × 2 supercell of NGDY and a four atoms nanocluster of Pd were chosen. 2.4 Synthesis 2.4.1 Synthesis of precursors Precursors were synthesized according to the reported routes [1,43]. As shown in Scheme 1 , tetrachloropyrazine was synthesized through chlorination of 2,5-dioxopiperazine by phosphorus pentachloride in phosphorus oxychloride at 60 °C. Tetra[(trimethylsilyl)ethynyl] pyrazine (TEP-TMS) was synthesized through Negishi reaction where tetrachloropyrazine reacted with [(triethylsilyl)ethynyl] zinc chloride catalyzed by Pd(PPh3)4 in newly distilled THF under 80 °C for 2 days. Crude products were purified through column chromatography and characterized through mass spectrum (MS) and nuclear magnetic resonance spectrum (NMR). 2.4.2 Synthesis of NGDY Tetra-butyl ammonium fluoride (TBAF, 1 M, THF solution) was used to get rid of the protecting groups to obtain monomer. Monomer was dissolved in methanol and added dropwise into the reaction mixture containing pyridine and copper plates under argon protection. The mixture was heated to 50 °C for 2 days. The NGDY film was exfoliated from Cu plates in (NH4)2S2O8 aqueous solution and cleaned by deionized water and ethanol. After drying under vacuum at 45 °C overnight, the product was obtained as dark brown films and grounded into powder for use. 2.4.3 Fabrication of nano hybrids We took microwave irradiated deposition method to fabricate Pd-, Pt-, Cu-, Ni-NGDY and Pd-GDY. Take the Pd-NGDY as an example. Firstly, 70 mg as-prepared NGDY powder was dispersed into 60 mL ethylene glycol through strong ultrasonication. Then, 10 mg (0.034 mmol) Na2PdCl4 dissolved in 4 mL ethylene glycol was added into the quasi-homogeneous colloid with vigorous stirring. The mixture was stored in several 2−5 ml quartz tubes and saturated with Ar. The reduction reaction was carried out in a microwave organic synthesis equipment with the temperature and time parameters set as 160 °C, 2 min. The resulting product was collected by centrifugation and cleaned by ethanol and deionized water repeatedly. At last, it was dried under vacuum overnight. Other nano hybrids were prepared using the same method except for transition metal NPs that hydrazine hydrate was involved as the reductant. H2PtCl6·6H2O, CuSO4·5H2O, NiCl2·6H2O were the precursor chemicals for Pt-, Cu-, Ni-NGDY, respectively. Specifically, the mixture of NGDY and H2PtCl6·6H2O in ethylene glycol was neutralized by addition of NaOAc before used in the microwave deposition. 2.5 Catalytic tests The general procedure for catalyzing the Suzuki- Miyaura reactions is described as follow. 0.5 mmol aryl halides, 0.75 mmol phenylboronic, and 1 mmol K2CO3 were dissolved in 10 ml solvent with continuous stirring. 10 mg catalyst was added into the mixture and the temperature was raised to required temperature. The progress was monitored and the conversion and yields (20 μL periodically) were analyzed by GC–MS. Less volatile compounds were purified through column chromatography and characterized by 1H NMR and 13C NMR. Recycled Pd-NGDY was collected through centrifugation and cleaned thoroughly by water and ethanol, and dried for next cycle. 3 Results and discussion 3.1 Synthesis and structural characterizations The nitrogen atoms in the basic pyrazine unit provide a large number of lone pair electrons, which can coordinate with metal atoms, showing the potential application prospects as support materials. Scheme 1 illustrates the bottom-up synthesis of NGDY. In general, the synthesis route of NGDY is similar to that of graphdiyne [7]. After removing the protecting group, the monomer was dissolved in methanol, dropped into the mixture of pyridine and copper plate, and NGDY was grown in situ on copper surface. NGDY was exfoliated from the copper plate and cleaned thoroughly with HCl (aq), deionized water, and ethanol. Anchoring of metal nanoparticles (Pd, Pt, Ni, and Cu) was conducted in a microwave reactor with a mixture of NGDY and metal salts (detailed information see Experimental Section). Metal ions grew into nanoparticles under microwave irradiation. The accurate mass loadings were determined by inductively coupled plasma mass spectrometry (ICP-MS) to be 1.07 %, 20.51 %, 1.91 %, 9.12 %, and 1.9 % for Pd-, Pt-, Cu-, Ni-NGDY and Pd-GDY, respectively. The typical SEM and TEM images with different magnifications were shown in Fig. 2 , from which the morphology and microstructure of the pristine NGDY, Pd-, Pt-, Cu-, Ni-NGDY can be easily observed. It can be seen that the pristine NGDY is a large-area smooth, transparent and flexible film (Fig. 2a–c). In addition to the amorphous morphology, some fringe pattern with average distance of 0.36 nm was observed, which was consistent with that of the carbon (002) surface. After the metal deposition, TEM images of the nano hydrides revealed a large number of grain-like ultrafine metal nanoparticles (NPs) anchored on the surface of NGDY (Fig. 2d, g, j, and m). The statistical measurement of NPs distribution (Fig. 2e, h, k, and n) showed that the average size of transition metal NPs was larger than that of noble metal NPs due to the addition of reductant in the process of transition metal nucleation. HRTEM images (Fig. 2f, i, l, o) clearly showed lattice fringes of 0.223 nm and 0.192 nm corresponding to Pd (111) and (200), 0.228 nm and 0.197 nm to Pt (111) and (200), 0.279 nm and 0.236 nm to Cu (110) and (111), and 0.201 nm to Ni (111). The TEM images of Pd-GDY were shown in Fig. S1. The average diameter of Pd NPs on GDY was larger than that on NGDY, and the dispersion uniformity was poor, which showed that N-doping was beneficial to the dispersion and stability of NPs. In order to understand the chemical composition and valence states of NGDY-hybrids, X-ray photoelectron spectroscopy (XPS) measurements were carried out and the spectra were shown in Fig. 3 a–f. The representative XPS survey scan spectrum (Fig. S2) reveals the existence of C, N and O elements in pristine NGDY. Fig. 3a–d showed the high-resolution (HR) XPS spectra of Pd 3d, Pt 3d, Cu 2p and Ni 2p on NGDY, respectively, all of which have zero metal valence and oxidized valence. The binding energy values of the metal NPs were recorded and listed in Table S1. Based on area ratio, the metallic Pd(0) content in Pd-NGDY (81 %) was higher than that in Pd-GDY (75 %), implying that N centers might stabilize better zero valent metals [44]. Compared with the data reported in literature [45,46], the binding energy values of Pd 3d of Pd NPs on NGDY and GDY both shifted obviously toward lower energy region (Fig. 3a and Table S1), indicating the strong electron donating effect of both support materials. In addition, the binding energy value of Pd°3d5/2 of Pd-NGDY is even lower than that of Pd-GDY, while PdⅡ3d5/2 of Pd-NGDY is higher than that of Pd-GDY, which is also an evidence for the above hypothesis. The same happens for Pt-NGDY and Pt-GDY (Fig. 3b and Table S1) [29,47,48]. As for other transition metals, although the ratio of zero/oxidized states are influenced by introduction of reducing agent, a higher content of zero valent state was observed in NGDY hybrids. Compared with Ni 2p of Ni NPs on GDY, Ni 2p of Ni NPs on NGDY showed similar shift toward lower binding energy (Fig. 3d) [49]. Exceptionally, opposite shift of Cu 2p of Cu NPs on NGDY was observed as compared with that on GDY (Fig. 3e) [50]. All the XPS results indicate that NGDY might be an excellent stabilizer for zero valent metals and showed strong charge transfer with metal NPs. In addition, taking the Pd-NGDY as an example, the changes of C and N XPS signals before and after metal NPs loading were studied to investigate the influence of N doping and the interaction between metal NPs and the substrate. Compared with GDY, C=N peaks (Fig. S3) were observed in NGDY except for typical C 1s peaks. The high-resolution C 1s peaks of NGDY and Pd-NGDY were compared in Fig. 3e, in which ignorable change of five main peaks of C1s after loading Pd-NPs was observed. For N 1s HR-XPS (Fig. 3f), there are three peaks corresponding to protonated pyrrolic-N (400.1 eV), pyrazine-N (399.2 eV), and pyridinic-N (398.4 eV) on pyrazine ring [44]. Protonated pyrrolic-N and pyrazine-N (area ratio 1:1) might come from complexation of pyrazine-N with impure molecules. After loading Pd NPs, the proportion of protonated pyrrolic-N and pyridinic-N increased simultaneously, which also indicated that N atoms were involved in metal coordination. There results indicated that N atoms played important roles in modifying the surface electron density and promoting the nucleation of metal ions. The X-ray diffraction (XRD) diagram of Pd-NGDY was shown in Fig. S4, in which the typical peak value (2 θ = 23°) of the two-dimensional material was clearly observed. However, no obvious palladium signal was observed because of its low loading and high dispersion. Raman spectra in Fig. 3g showed further characterization. Compared with the precursor, these two-dimensional materials showed widened peaks or bands. The Raman shifts of NGDY and GDY in D and G bands are different, but there is little difference in the vibration band of dialkynyl group, indicating that nitrogen doping in NGDY induced more electron changes and defects. Metal nanoparticles anchored hybrid materials, such as Pd-NGDY, showed typical D-band, G-band and dialkynyl vibration modes at 1349 cm−1, 1540 cm−1, and 2172 cm−1. Pd NPs loading enhanced D/G ratio and slightly shifted D and G bands to lower wave number as compared with GDY and NGDY. K-edge XANES profiles and Fourier transformed EXAFS spectra provide coordination information between metal NPs (taking Pd as an example) and substrate (Fig. 3h, I). Pd foil was set as the standard (EXAFS fitting parameters are showed in Table S6). Compared with Pd-GDY, the XANES profile of Pd-NGDY (Fig. 3h) was less similar to that of Pd foil, and more similar to that of Pd-N [51], which meant higher Pd2+/Pd° ratio and less Pd atoms aggregation in Pd-NGDY (in line with XPS results), that is, N doping is beneficial to NPs dispersion. The Fourier transformed EXAFS spectra (Fig. 3i) provided Pd-Pd and Pd-N bonding details for Pd-NGDY and Pd-GDY. In Pd-NGDY, Pd-N and Pd-Pd bond distances were 0.203 and 0.275 nm, respectively, and the coordination numbers (CN) for Pd-N and Pd-Pd were 1.6 and 3.4, respectively. However, Pd-GDY showed a slightly shorter Pd-Pd bond distance (0.275 nm), and the coordination number was fitted as 6.6. At the same time, Pd-NGDY showed a different Pd-N peak profile at ∼ 0.15 nm as compared with Pd-GDY and Pd foil, which also indicated the different coordination environment in Pd-NGDY, thus influence of the charge transfer between metal NPs and NGDY could be expected. Brunauer-Emmet-Teller (BET) analysis was performed to determine the specific surface area of NGDY and Pd-NGDY. As shown in Fig. 4 , N2 adsorption and desorption isotherms indicated type IV curves for both NGDY and Pd-NGDY, and the BET surface area were 535 m2 g−1 and 152 m2 g−1, respectively, which were at high level for carbon materials [37], implying high porosity of NGDY. Anchoring of Pd NPs on NGDY caused large decrease of N2 adsorption of the material. The BET surface area of GDY was determined to be 666 m2 g−1 (Fig. S5), a bit larger than NGDY. 3.2 Catalytic performance in the Suzuki-Miyaura reaction Among all the prepared nanohybrid materials, Pd-NGDY was selected as the catalyst to investigate its activity in Suzuki-Miyaura reaction, and Pd-C was used as the control catalyst. Pd-GDY, an analogue with Pd NPs anchored on all carbon material GDY, was also involved in order to understand the role of substrate materials in catalysis. In order to obtain the best catalyst conditions, various solvents (Table S3), bases (Table S4) and temperatures (Table S5) were considered in the coupling reaction between bromobenzene and phenyl boric acid. Ethanol / water (7:4), K2CO3, and 80 ℃ were optimized as the best solvents, base and temperature for this reaction, without the need of phase transfer agents. Only one biphenyl product was observed in all reactions. The lines chart in Fig. 5 comprehensively showed the catalytic activity of different catalysts, and the conversion rate changes with time (taking the coupling of iodobenzene and phenylboronic acid as the model reaction). The catalytic performance of Pd-NGDY is better than that of Pd-C and Pd-GDY. With the catalysis of Pd-NGDY, the conversion reached 75 % in 30 min, then over 90 % in 1 h, with the TOF number of 1287 h−1, and the substrate/catalyst ratio was 497. In contrast, the coupling reaction efficiency of commercial Pd-C and Pd-GDY catalyst was relatively low. The conversion rate was only about 2/3 after 1 h, and the TOF value is about 700 h−1 for Pd-C. N-doping and chemical functional groups of supporting materials could promote the adsorption and activation for reactants [44], therefore Pd-NGDY showed superior catalytic performance than commercial Pd-C catalyst. At the same time, there were more borate coupling by-products at the end of the reaction catalyzed by Pd-GDY, which indicated that the N-doping of graphdiyne was beneficial to heterocoupling to a certain extent and inhibited homocoupling. Then, more than ten experiments of catalyst recovery were carried out. Fig. 5 also showed the progress of the 12th cycle of the coupling reaction, and Fig. S6 provided the high-resolution TEM image of Pd-NGDY after the 12th cycle. The catalytic activity of Pd NPs on NGDY was almost unchanged after 12th recycle, and there was no obvious aggregation of Pd NPs, indicating that Pd-NGDY was quite stable and recyclable. Infrared spectroscopy (IR) study was carried out to understand the interactions between catalysts and reactants. Results were shown in Fig. S7 with IR spectra of dissociative reactant and adsorbed reactant on different Pd catalysts. p-Bromo benzaldehyde was employed as the reactant, and the vibration of aldehyde group served as the featuring signal. In general, 10 mg Pd catalyst was mixed with 100 μL ethanol containing 10 mg p-bromo benzaldehyde. Solvent volatilized at room temperature overnight before IR measurement. Compared with dissociative p-bromo benzaldehyde (1690 cm−1), adsorbed reactant shifted the vibration wave number to 1692 cm−1, 1695 cm−1, 1697 cm−1, 1698 cm−1, and 1699 cm−1 in GDY, Pd-NGDY, NGDY, Pd-C, Pd-GDY, respectively. The spectroscopic shifts indicate the electron density variation of the adsorbed reactants, suggesting that Pd catalysts interact with reactants via charge transfer process. The IR vibration shift of reactant adsorbed on NGDY is much larger than that on GDY, which means stronger adsorption of reactant on NGDY. However, the smallest shift was observed for Pd-NGDY in the Pd series, which was related to the easier evolution for organic molecules and higher catalytic activity than other catalysts [23]. Although Pd-C was inferior to other Pd hybrids in catalytic performance, the IR vibration wave number of reactant adsorbed on it shifted more than that on Pd-NGDY, yet less than that on Pd-GDY, from which could be inferred that the activity of catalysts was determined not only by adsorption factor. In other words, N-doping resulted in electron density variation of NGDY and GDY, and further influenced the absorption of reactant, the Pd NPs binding, eventually the catalyst activity. To evaluate the universality of Pd-NGDY catalyst, aryl halides containing donor or acceptor groups at different positions were investigated in Suzuki-Miyaura coupling reaction under the optimized reaction conditions. A series of coupling reactions catalyzed by Pd-NGDY are listed in Table 1 . In all cases, except for the coupling reaction with chlorobenzene (entry 3, due to the weak reactivity of C-Cl), the coupling reaction catalyzed by Pd-NGDY shows extraordinary catalytic performance. The effects of electronic and steric effects on the yields and reaction rates were also studied. Compared with the electron donating substitutes, the electron withdrawing groups accelerated Suzuki-Miyaura reaction. The conversion rate of para-formyl substituted bromobenzene is the highest compared with ortho and meta substituted configurations (entry 4–7). A wide range of reactants, including 2-bromonaphthalene and 1,3-dibromobenzene, showed high yields (entry 8,9). Furthermore, the coupling reactions of conjugated groups substituted aryl halides and boronic compounds (entry 10–12) were also well catalyzed. Small molecule samples were analyzed by GCMS, and large molecule product samples were characterized by NMR (Supplementary information). Various catalysts for Suzuki-Miyaura reaction in literature were collected and compared in Table 2 , from which we can see that the Pd-NGDY exhibited comparable performance with other reported catalysts considering the active Pd content. The heterogeneity of Suzuki reactions catalyzed by Pd-NGDY was verified by hot filtration test. Under the optimum conditions, Pd-NGDY was used to catalyze the coupling reaction of bromobenzene and phenylboronic acid. During the half time of the reaction, Pd-NGDY catalyst was separated from the reaction mixture by rapid hot filtration to prevent the re-deposition of leached Pd species (if any), and the filtrate was reheated to the specified temperature to continue the reaction. GCMS was used to monitor the reaction process. The results showed that after the removal of Pd-NGDY catalyst, the content of bromobenzene did not decrease, indicating that the real active catalyst is Pd nanoparticles on the surface of NGDY, rather than Pd species leached from Pd-NGDY. Namely, the reaction rate did not correlate with Pd amount in solution. In addition, TEM image of cycled Pd-NGDY catalyst showed negligible change in size and amount for Pd NPs (Fig. S6). The heterogeneous properties of Suzuki reactions catalyzed by Pd NPs have also been shown in literature [54]. 3.3 DFT calculations Composite catalysts with metal species anchored on GDY based materials have been used in various catalytic processes. Previous theoretical study reveals the structure of metal atoms located in the triangular corner of the pore of GDY [32]. Similar structure of Pd-NGDY is used as the model for DFT calculation in this work, and iodobenzene is used as the reaction substrate. As reported previously [55], the metal NPs anchored on graphene with abundant defect sites showed enhanced charge transfer ability through lower the activation energy for different steps in Suzuki reaction. [23]. Considering the difficulty to precisely determine the atom number in each nanoparticle, tetrahedral clusters containing four Pd atoms, with high stability [23] and lower calculation workload, were used as an ideal model instead of nanoparticles in order to facilitate the calculation. Further calculations for more abundant information will be carried out in future efforts. Geometry optimization (both atomic coordinates and cell parameters) and band structure calculations of NGDY were carried out using the VASP package with the PBE exchange-correlation functional within a generalized gradient approximation and the projector augmented-wave potential. The band gap of NGDY was calculated to be 0.50 eV. The high symmetric points locate at Г = (0, 0, 0), S = (0, 1/2, 0), Y = (-1/2, 1/2, 0), and the DOS of NGDY is zero at Fermi level (Fig. 6 a). The electron distribution of Pd-NGDY is calculated and the charge transfer between Pd and NGDY is studied. Fig. 6b shows the red and green blocks that represent the electron poor and rich regions, respectively. It can be seen that the red block is mainly concentrated on the Pd nanoparticles anchored on the substrate, while the green block is mainly concentrated on the carbon and nitrogen atoms in NGDY, which means the charge transfer from NGDY to Pd nanoparticles, which is consistent with the experimental results [56]. The effective charge transfer (donation and acceptation) between metal species and supporting materials is beneficial for catalytic activity [55]. The free energy profile of Suzuki-Miyaura coupling reaction of iodobenzene catalyzed by Pd-NGDY is shown in Fig. 6c. Pd clusters absorbed on NGDY surface (E1) was set as zero. Iodobenzene molecules adsorbed on the surfaces of NGDY and Pd NPs to form state E2, and then C–I bond broke (E2 to E3). With the departure of halide group (E3), phenyl borate substituted halogen to form E4 state. The phenyl on borate migrated to Pd cluster (E5) and reached the transmetalation state (E6). Finally, before desorption, elimination produced the final product. The results showed that the energy of E2-E3 and E5-E6 keep upward, while the free energy tends to decrease, which is conducive to the coupling reaction. The reductive elimination process (from E5 to E7) needed to overcome an energy barrier of 0.76 eV that was bigger than the oxidative-addition step (E2 to E3, 0.45 eV), so it was considered as the rate-determining step. This was different from the classical cross-coupling reactions (between aryl halides and aryl boronic acids) that governed by the oxidative-addition step involved the halide-C bond breaking [57–59], which would resulted from the strong charge transfer from the substrates to Pd clusters [55]. In view of distinctive chemical and electronic structure, NGDY acted as a binding material for Pd NPs as well as electron reservoir to effectively reduce the activation energy of cross-coupling reaction. 4 Conclusions In summary, we proposed a method to synthesize N-doped graphdiyne (NGDY) from tetraethynylpyrazine from bottom to top, which can generate specific pyridine nitrogen atoms in N-doped carbon materials. Considering N-doping and abundant alkynyl groups, this unique structure is a promising material for anchoring ultrafine metal nanoparticles (NPs) or clusters such as Pd, Pt, Cu, Ni. The natural pore structure will further help the binding of metal nanoparticles without purposeful producing of vacancy defect sites in commercial carbon materials. The introduction of nitrogen into the graphdiyne framework makes the metal NPs disperse without aggregation, and enhances the charge transfer between NGDY and metal nanoparticles. As an effective heterogeneous catalyst, Pd-NGDY complex has been applied in Suzuki-Miyaura reaction with high performance, with the TOF value as high as 1287 h−1, which was better than commercial Pd-C catalyst. Our research showed that heteroatom doping was an effective way to adjust the electronic density of loaded metal nanoparticles through charge transfer, which had potential application in heterogeneous catalysis. More attention will be supposed to focus on metal-support complex modulating as well as catalytic mechanism in further work. CRediT authorship contribution statement Han Shen: Methodology, Investigation, Writing- Original draft preparation. Jingyi He: Data curation. Feng He: Calculation, Validation. Yurui Xue: Investigation. Yongjun Li: Conceptualization, Writing- Reviewing and Editing. Yuliang Li: Supervision. Declaration of Competing Interest The authors report no declarations of interest. Acknowledgements This work was supported by the National key research and development project of China (2018YFA0703501, 2016YFA0200104), the National Nature Science Foundation of China (22021002, 21672222, 21790050, 21790051), NSFC-DFG joint fund (21661132006), the key program of the Chinese Academy of Science (QYZDY-SSW-SLH015). Appendix A Supplementary data Supplementary material related to this article can be found, in the online version, at doi:https://doi.org/10.1016/j.apcata.2021.118244. Appendix B Supplementary data The following is Supplementary data to this article: References [1] G. Li Y. Li H. Liu Y. Guo Y. Li D. Zhu Chem. Commun. 46 2010 3256 3258 Table S1XXXXXG. Li, Y. Li, H. Liu, Y. Guo, Y. Li, D. Zhu, Architecture of graphdiyne nanoscale films, Chem. Commun., 46 (2010) 3256-3258. [2] Y. Li L. Xu H. Liu Y. Li Chem. Soc. Rev. 43 2014 2572 2586 Y. Li, L. Xu, H. Liu, Y. Li, Graphdiyne and graphyne: from theoretical predictions to practical construction, Chem. Soc. Rev., 43 (2014) 2572-2586. [3] Z. Jia Y. Li Z. Zuo H. Liu C. Huang Y. Li Acc. Chem. Res. 50 2017 2470 2478 Z. Jia, Y. Li, Z. Zuo, H. Liu, C. Huang, Y. Li, Synthesis and Properties of 2D Carbon——Graphdiyne, Acc. Chem. Res., 50 (2017) 2470-2478. [4] C. Huang Y. Li N. Wang Y. Xue Z. Zuo H. Liu Y. Li Chem. Rev. 118 2018 7744 7803 C. Huang, Y. Li, N. Wang, Y. Xue, Z. Zuo, H. Liu, Y. Li, Progress in Research into 2D Graphdiyne-Based Materials, Chem. Rev., 118 (2018) 7744-7803. [5] X. Gao H. Liu D. Wang J. Zhang Chem. Soc. Rev. 48 2019 908 936 X. Gao, H. Liu, D. Wang, J. Zhang, Graphdiyne: synthesis, properties, and applications, Chem. Soc. Rev., 48 (2019) 908-936. [6] Z. Zuo D. Wang J. Zhang F. Lu Y. Li Adv. Mater. 31 2019 1803762 Z. Zuo, D. Wang, J. Zhang, F. Lu, Y. Li, Synthesis and Applications of Graphdiyne-Based Metal-Free Catalysts, Adv. Mater., 31 (2019) 1803762. [7] Y. Xue B. Huang Y. Yi Y. Guo Z. Zuo Y. Li Z. Jia H. Liu Y. Li Nat. Commun. 9 2018 1460 Y. Xue, B. Huang, Y. Yi, Y. Guo, Z. Zuo, Y. Li, Z. Jia, H. Liu, Y. Li, Anchoring zero valence single atoms of nickel and iron on graphdiyne for hydrogen evolution, Nat. Commun., 9 (2018) 1460. [8] J. Li Y. Chen J. Guo F. Wang H. Liu Y. Li Adv. Funct. Mater. 30 2020 2004115 J. Li, Y. Chen, J. Guo, F. Wang, H. Liu, Y. Li, Graphdiyne Oxide-Based High-Performance Rechargeable Aqueous Zn––MnO2 Battery, Adv. Funct. Mater., 30 (2020) 2004115. [9] J. He N. Wang Z. Cui H. Du L. Fu C. Huang Z. Yang X. Shen Y. Yi Z. Tu Y. Li Nat. Commun. 8 2017 1172 J. He, N. Wang, Z. Cui, H. Du, L. Fu, C. Huang, Z. Yang, X. Shen, Y. Yi, Z. Tu, Y. Li, Hydrogen substituted graphdiyne as carbon-rich flexible electrode for lithium and sodium ion batteries, Nat. Commun., 8 (2017) 1172. [10] Y. Zhao J. Wan H. Yao L. Zhang K. Lin L. Wang N. Yang D. Liu L. Song J. Zhu L. Gu L. Liu H. Zhao Y. Li D. Wang Nat. Chem. 10 2018 924 931 Y. Zhao, J. Wan, H. Yao, L. Zhang, K. Lin, L. Wang, N. Yang, D. Liu, L. Song, J. Zhu, L. Gu, L. Liu, H. Zhao, Y. Li, D. Wang, Few-layer graphdiyne doped with sp-hybridized nitrogen atoms at acetylenic sites for oxygen reduction electrocatalysis, Nat. Chem., 10 (2018) 924-931. [11] R. Liu H. Liu Y. Li Y. Yi X. Shang S. Zhang X. Yu S. Zhang H. Cao G. Zhang Nanoscale 6 2014 11336 11343 R. Liu, H. Liu, Y. Li, Y. Yi, X. Shang, S. Zhang, X. Yu, S. Zhang, H. Cao, G. Zhang, Nitrogen-doped graphdiyne as a metal-free catalyst for high-performance oxygen reduction reactions, Nanoscale, 6 (2014) 11336-11343. [12] H. Yu Y. Xue L. Hui C. Zhang Y. Zhao Z. Li Y. Li Adv. Funct. Mater. 28 2018 1707564 H. Yu, Y. Xue, L. Hui, C. Zhang, Y. Zhao, Z. Li, Y. Li, Controlled Growth of MoS2 Nanosheets on 2D N-Doped Graphdiyne Nanolayers for Highly Associated Effects on Water Reduction, Adv. Funct. Mater., 28 (2018) 1707564. [13] Y. Zhao N. Yang H. Yao D. Liu L. Song J. Zhu S. Li L. Gu K. Lin D. Wang J. Am. Chem. Soc. 141 2019 7240 7244 Y. Zhao, N. Yang, H. Yao, D. Liu, L. Song, J. Zhu, S. Li, L. Gu, K. Lin, D. Wang, Stereodefined Codoping of sp-N and S Atoms in Few-Layer Graphdiyne for Oxygen Evolution Reaction, J. Am. Chem. Soc., 141 (2019) 7240-7244. [14] H. Shang Z. Zuo H. Zheng K. Li Z. Tu Y. Yi H. Liu Y. Li Y. Li Nano Energy 44 2018 144 154 H. Shang, Z. Zuo, H. Zheng, K. Li, Z. Tu, Y. Yi, H. Liu, Y. Li, Y. Li, N-doped graphdiyne for high-performance electrochemical electrodes, Nano Energy, 44 (2018) 144-154. [15] X. Kan Y. Ban C. Wu Q. Pan H. Liu J. Song Z. Zuo Z. Li Y. Zhao ACS Appl. Mater. Interfaces 10 2018 53 58 4X. Kan, Y. Ban, C. Wu, Q. Pan, H. Liu, J. Song, Z. Zuo, Z. Li, Y. Zhao, Interfacial Synthesis of Conjugated Two-Dimensional N-Graphdiyne, ACS Appl. Mater. Interfaces, 10 (2018) 53-58. [16] Q. Pan H. Liu Y. Zhao S. Chen B. Xue X. Kan X. Huang J. Liu Z. Li ACS Appl. Mater. Interfaces 11 2019 2740 2744 Q. Pan, H. Liu, Y. Zhao, S. Chen, B. Xue, X. Kan, X. Huang, J. Liu, Z. Li, Preparation of N-Graphdiyne Nanosheets at Liquid/Liquid Interface for Photocatalytic NADH Regeneration, ACS Appl. Mater. Interfaces, 11 (2019) 2740-2744. [17] X. Zhu Y. Zhu S. Murali M.D. Stoller R.S. Ruoff ACS Nano 5 2011 3333 3338 X. Zhu, Y. Zhu, S. Murali, M.D. Stoller, R.S. Ruoff, Nanostructured Reduced Graphene Oxide/Fe2O3 Composite As a High-Performance Anode Material for Lithium Ion Batteries, ACS Nano, 5 (2011) 3333-3338. [18] S.E. Gilliland III J.M.M. Tengco Y. Yang J.R. Regalbuto C.E. Castano B.F. Gupton Appl. Catal. A-Gen. 550 2018 168 175 S.E. Gilliland, III, J.M.M. Tengco, Y. Yang, J.R. Regalbuto, C.E. Castano, B.F. Gupton, Electrostatic adsorption-microwave synthesis of palladium nanoparticles on graphene for improved cross-coupling activity, Applied Catalysis a-General, 550 (2018) 168-175. [19] S. Guo D. Wen Y. Zhai S. Dong E. Wang ACS Nano 4 2010 3959 3968 S. Guo, D. Wen, Y. Zhai, S. Dong, E. Wang, Platinum Nanoparticle Ensemble-on-Graphene Hybrid Nanosheet: One-Pot, Rapid Synthesis, and Used as New Electrode Material for Electrochemical Sensing, ACS Nano, 4 (2010) 3959-3968. [20] S. Moussa A.R. Siamaki B.F. Gupton M.S. El-Shall ACS Catal. 2 2012 145 154 S. Moussa, A.R. Siamaki, B.F. Gupton, M.S. El-Shall, Pd-Partially Reduced Graphene Oxide Catalysts (Pd/PRGO): Laser Synthesis of Pd Nanoparticles Supported on PRGO Nanosheets for Carbon––Carbon Cross Coupling Reactions, ACS Catal., 2 (2012) 145-154. [21] A.R. Siamaki A.E.R.S. Khder V. Abdelsayed M.S. El-Shall B.F. Gupton J. Catal. 279 2011 1 11 A.R. Siamaki, A.E.R.S. Khder, V. Abdelsayed, M.S. El-Shall, B.F. Gupton, Microwave-assisted synthesis of palladium nanoparticles supported on graphene: A highly active and recyclable catalyst for carbon––carbon cross-coupling reactions, J. Catal., 279 (2011) 1-11. [22] R. Kumar J.-H. Oh H.-J. Kim J.-H. Jung C.-H. Jung W.G. Hong H.-J. Kim J.-Y. Park I.-K. Oh ACS Nano 9 2015 7343 7351 R. Kumar, J.-H. Oh, H.-J. Kim, J.-H. Jung, C.-H. Jung, W.G. Hong, H.-J. Kim, J.-Y. Park, I.-K. Oh, Nanohole-Structured and Palladium-Embedded 3D Porous Graphene for Ultrahigh Hydrogen Storage and CO Oxidation Multifunctionalities, ACS Nano, 9 (2015) 7343-7351. [23] Y. Yang C.E. Castano B.F. Gupton A.C. Reber S.N. Khanna Nanoscale 8 2016 19564 19572 Y. Yang, C.E. Castano, B.F. Gupton, A.C. Reber, S.N. Khanna, A fundamental analysis of enhanced cross-coupling catalytic activity for palladium clusters on graphene supports, Nanoscale, 8 (2016) 19564-19572. [24] I.C. Gerber P. Serp Chem. Rev. 120 2020 1250 1349 I.C. Gerber, P. Serp, A Theory/Experience Description of Support Effects in Carbon-Supported Catalysts, Chem. Rev., 120 (2020) 1250-1349. [25] Y. Yang A.C. Reber S.E. Gilliland III C.E. Castano B.F. Gupton S.N. Khanna J. Catal. 360 2018 20 26 Y. Yang, A.C. Reber, S.E. Gilliland, III, C.E. Castano, B.F. Gupton, S.N. Khanna, More than just a support: Graphene as a solid-state ligand for palladium-catalyzed cross-coupling reactions, J. Catal., 360 (2018) 20-26. [26] M. Zhao Y. Wu J.-P. Cao Appl. Organomet. Chem. 34 2020 M. Zhao, Y. Wu, J.-P. Cao, Carbon-Based Material-Supported Palladium Nanocatalysts in Coupling Reactions: Discussion on their Stability and Heterogeneity, Appl. Organomet. Chem., 34 (2020). [27] R.L. Oliveira J. Kerstien R. Schomaecker A. Thomas Catal. Sci. Technol. 10 2020 1385 1394 R.L. Oliveira, J. Kerstien, R. Schomaecker, A. Thomas, Pd nanoparticles confined in mesoporous N-doped carbon silica supports: a synergistic effect between catalyst and support, Catal. Sci. Technol., 10 (2020) 1385-1394. [28] L. Wang S. Ma Z. Jiao D. Yuan Appl. Surf. Sci. 465 2019 1 9 L. Wang, S. Ma, Z. Jiao, D. Yuan, Capability of defective graphene-supported Co-4 nanoparticle toward ammonia dehydrogenation, Appl. Surf. Sci., 465 (2019) 1-9. [29] H. Shen Y. Li Z. Shi ACS Appl. Mater. Interfaces 11 2019 2563 2570 H. Shen, Y. Li, Z. Shi, A Novel Graphdiyne-Based Catalyst for Effective Hydrogenation Reaction, ACS Appl. Mater. Interfaces, 11 (2019) 2563-2570. [30] H. Qi P. Yu Y. Wang G. Han H. Liu Y. Yi Y. Li L. Mao J. Am. Chem. Soc. 137 2015 5260 5263 H. Qi, P. Yu, Y. Wang, G. Han, H. Liu, Y. Yi, Y. Li, L. Mao, Graphdiyne Oxides as Excellent Substrate for Electroless Deposition of Pd Clusters with High Catalytic Activity, J. Am. Chem. Soc., 137 (2015) 5260-5263. [31] I.P. Beletskaya F. Alonso V. Tyurin Coord. Chem. Rev. 385 2019 137 173 I.P. Beletskaya, F. Alonso, V. Tyurin, The Suzuki-Miyaura reaction after the Nobel prize, Coord. Chem. Rev., 385 (2019) 137-173. [32] E. Hariprasad T.P. Radhakrishnan ACS Catal. 2 2012 1179 1186 E. Hariprasad, T.P. Radhakrishnan, Palladium Nanoparticle-Embedded Polymer Thin Film “Dip Catalyst” for Suzuki––Miyaura Reaction, ACS Catal., 2 (2012) 1179-1186. [33] M. Keyhaniyan A. Shiri H. Eshghi A. Khojastehnezhad New J. Chem. 42 2018 19433 19441 M. Keyhaniyan, A. Shiri, H. Eshghi, A. Khojastehnezhad, Synthesis, characterization and first application of covalently immobilized nickel-porphyrin on graphene oxide for Suzuki cross-coupling reaction, New J. Chem., 42 (2018) 19433-19441. [34] X. Yan Y. Luo W. Liu L. Liang Y. Gan Z. Chen Z. Xu H. Wan D. Tang H. Shi J. Hu Phys. Chem. Chem. Phys. 22 2020 6222 6230 X. Yan, Y. Luo, W. Liu, L. Liang, Y. Gan, Z. Chen, Z. Xu, H. Wan, D. Tang, H. Shi, J. Hu, Strategy used to synthesize high activity and low Pd catalyst for Suzuki coupling reaction: an experimental and theoretical investigation, Phys. Chem. Chem. Phys., 22 (2020) 6222-6230. [35] J.A. Bobb A.A. Ibrahim M.S. El-Shall ACS Appl. Nano Mater. 1 2018 4852 4862 J.A. Bobb, A.A. Ibrahim, M.S. El-Shall, Laser Synthesis of Carbonaceous TiO2 from Metal––Organic Frameworks: Optimum Support for Pd Nanoparticles for C–C Cross-Coupling Reactions, ACS Applied Nano Materials, 1 (2018) 4852-4862. [36] Y. Yang S.E. Gilliland III S. Ghobadi M. Burkholder S.E. Smith B.F. Gupton C.E. Castano React. Chem. Eng. 4 2019 90 99 Y. Yang, S.E. Gilliland, III, S. Ghobadi, M. Burkholder, S.E. Smith, B.F. Gupton, C.E. Castano, Three dimensional composites of graphene as supports in Pd-catalyzed synthetic applications, React. Chem. Eng., 4 (2019) 90-99. [37] V. Kandathil B. Kulkarni A. Siddiqa M. Kempasiddaiah B.S. Sasidhar S.A. Patil S.A. Patil Catal. Lett. 150 2020 384 403 V. Kandathil, B. Kulkarni, A. Siddiqa, M. Kempasiddaiah, B.S. Sasidhar, S.A. Patil, S.A. Patil, Immobilized N-Heterocyclic Carbene-Palladium(II) Complex on Graphene Oxide as Efficient and Recyclable Catalyst for Suzuki––Miyaura Cross-Coupling and Reduction of Nitroarenes, Catal. Lett., 150 (2020) 384-403. [38] G. Kresse J. Furthmüller Comp. Mater. Sci. 6 1996 15 50 G. Kresse, J. Furthmüüller, Efficiency of ab-initio total energy calculations for metals and semiconductors using a plane-wave basis set, Comp. Mater. Sci., 6 (1996) 15-50. [39] G. Kresse J. Furthmüller Phys. Rev. B 54 1996 11169 G. Kresse, J. Furthmüüller, Efficient Iterative Schemes for Ab Initio Total-Energy Calculations Using a Plane-Wave Basis Set, Phys. Rev. B, 54 (1996) 11169. [40] J.P. Perdew K. Burke M. Ernzerhof Phys. Rev. Lett. 77 1996 3865 3868 J.P. Perdew, K. Burke, M. Ernzerhof, Generalized Gradient Approximation Made Simple, Phys. Rev. Lett., 77 (1996) 3865-3868. [41] H.J. Monkhorst J.D. Pack Phys. Rev. B 13 1976 5188 5192 H.J. Monkhorst, J.D. Pack, Special points for Brillouin-zone integrations, Phys. Rev. B, 13 (1976) 5188-5192. [42] J.K. Nørskov J. Rossmeisl A. Logadottir L. Lindqvist J.R. Kitchin T. Bligaard H. Jónsson J. Phys. Chem. B 108 2004 17886 17892 J.K. Nøørskov, J. Rossmeisl, A. Logadottir, L. Lindqvist, J.R. Kitchin, T. Bligaard, H. Jóónsson, Origin of the Overpotential for Oxygen Reduction at a Fuel-Cell Cathode, J. Phys. Chem. B, 108 (2004) 17886-17892. [43] A. Petrosyan P. Ehlers A.-E. Surkus T.V. Ghochikyan A.S. Saghyan S. Lochbrunner P. Langer Org. Biomol. Chem. 14 2016 1442 1449 A. Petrosyan, P. Ehlers, A.-E. Surkus, T.V. Ghochikyan, A.S. Saghyan, S. Lochbrunner, P. Langer, Straightforward synthesis of tetraalkynylpyrazines and their photophysical properties, Org. Biomol. Chem., 14 (2016) 1442-1449. [44] R. Nie M. Miao W. Du J. Shi Y. Liu Z. Hou Appl. Catal. B 180 2016 607 613 R. Nie, M. Miao, W. Du, J. Shi, Y. Liu, Z. Hou, Selective hydrogenation of CC bond over N-doped reduced graphene oxides supported Pd catalyst, Appl. Catal. B, 180 (2016) 607-613. [45] Y. Ru Y. Huang Y. Wang L. Dai Appl. Organomet. Chem. 33 2019 e5198 Y. Ru, Y. Huang, Y. Wang, L. Dai, Pd-Cu alloy nanoparticle supported on amine-terminated ionic liquid functional 3D graphene and its application on Suzuki cross-coupling reactionPd-Cu alloy nanoparticle supported on amine-terminated ionic liquid functional 3D graphene and its application on Suzuki cross-coupling reaction, Appl. Organomet. Chem., 33 (2019) e5198. [46] M. Sahoo S. Mansingh S. Subudhi P. Mohapatra K. Parida Catal. Sci. Technol. 9 2019 4678 4692 M. Sahoo, S. Mansingh, S. Subudhi, P. Mohapatra, K. Parida, A plasmonic AuPd bimetallic nanoalloy decorated over a GO/LDH hybrid nanocomposite via a green synthesis route for robust Suzuki coupling reactions: a paradigm shift towards a sustainable future, Catal. Sci. Technol., 9 (2019) 4678-4692. [47] Y. Su K. Fu Y. Zheng N. Ji C. Song D. Ma X. Lu R. Han Q. Liu Appl. Catal. B 288 2021 119980 Y. Su, K. Fu, Y. Zheng, N. Ji, C. Song, D. Ma, X. Lu, R. Han, Q. Liu, Catalytic oxidation of dichloromethane over Pt-Co/HZSM-5 catalyst: Synergistic effect of single-atom Pt, Co3O4, and HZSM-5, Appl. Catal. B, 288 (2021) 119980. [48] W. Li X.-s. Chu F. Wang Y.-y. Dang X.-y. Liu X.-c. Wang C.-y. Wang Appl. Catal. B 288 2021 120034 W. Li, X.-s. Chu, F. Wang, Y.-y. Dang, X.-y. Liu, X.-c. Wang, C.-y. Wang, Enhanced cocatalyst-support interaction and promoted electron transfer of 3D porous g-C3N4/GO-M (Au, Pd, Pt) composite catalysts for hydrogen evolution, Appl. Catal. B, 288 (2021) 120034.[48]W.LiChu, F. Wang, Y.-y, X.-s.. Dang, X.-y. Liu, X.-c. Wang, C.-y. Wang, Enhanced cocatalyst-support interaction and promoted electron transfer of 3D porous g-C3N4/GO-M (Au, Pd, Pt) composite catalysts for hydrogen evolution, Appl. Catal. B [49] N. Cheng Q. Liu A.M. Asiri W. Xing X. Sun J. Mater. Chem. A 3 2015 23207 23212 2882021120034N. Cheng, Q. Liu, A.M. Asiri, W. Xing, X. Sun, A Fe-doped Ni3S2 particle film as a high-efficiency robust oxygen evolution electrode with very high current density, J. Mater. Chem. A, 3 (2015) 23207-23212. [50] H. Yu W. Tang K. Li H. Yin S. Zhao S. Zhou Chem. Eng. Sci. 196 2019 402 413 H. Yu, W. Tang, K. Li, H. Yin, S. Zhao, S. Zhou, Design of Cu-based intermetallic nanocrystals for enhancing hydrogenation selectivity, Chem. Eng. Sci., 196 (2019) 402-413. [51] Y. Ryou J. Lee S.J. Cho H. Lee C.H. Kim D.H. Kim Appl. Catal. B: Environ. 212 2017 140 149 Y. Ryou, J. Lee, S.J. Cho, H. Lee, C.H. Kim, D.H. Kim, Activation of Pd/SSZ-13 catalyst by hydrothermal aging treatment in passive NO adsorption performance at low temperature for cold start application, Applied Catalysis B: Environmental, 212 (2017) 140-149. [52] A.A. Ibrahim A. Lin M.S. Adly M.S. El-Shall J. Catal. 385 2020 194 203 A.A. Ibrahim, A. Lin, M.S. Adly, M.S. El-Shall, Enhancement of the catalytic activity of Pd nanoparticles in Suzuki coupling by partial functionalization of the reduced graphene oxide support with p-phenylenediamine and benzidine, J. Catal., 385 (2020) 194-203. [53] A. Mohammadinezhad B. Akhlaghinia Green Chem. 19 2017 5625 5641 A. Mohammadinezhad, B. Akhlaghinia, Fe3O4@Boehmite-NH2-CoII NPs: an inexpensive and highly efficient heterogeneous magnetic nanocatalyst for the Suzuki–Miyaura and Heck––Mizoroki cross-coupling reactions, Green Chem., 19 (2017) 5625-5641. [54] M. Zhao Y. Wu Appl. Organomet. Chem. 34 2020 M. Zhao, Y. Wu, Carbon‐Based Material‐‐Supported Palladium Nanocatalysts in Coupling Reactions: Discussion on their Stability and Heterogeneity, Applied Organometallic Chemistry, 34 (2020). [55] Y. Yang A.C. Reber S.E. Gilliland C.E. Castano B.F. Gupton S.N. Khanna J. Phys. Chem. C 122 2018 25396 25403 Carbon‐Based Material‐Supported Palladium Nanocatalysts in Coupling Reactions: Discussion on their Stability and HeterogeneityApplied Organometallic Chemistry342020Y. Yang, A.C. Reber, S.E. Gilliland, C.E. Castano, B.F. Gupton, S.N. Khanna, Donor/Acceptor Concepts for Developing Efficient Suzuki Cross-Coupling Catalysts Using Graphene-Supported Ni, Cu, Fe, Pd, and Bimetallic Pd/Ni Clusters, J. PhysDonor/Acceptor Concepts for Developing Efficient Suzuki Cross-Coupling Catalysts Using Graphene-Supported Ni, Cu, Fe, Pd, and Bimetallic Pd/Ni Clusters, J. Phys. Chem. C, 122 (2018) 25396-25403. [56] Q.-Q. Yan D.-X. Wu S.-Q. Chu Z.-Q. Chen Y. Lin M.-X. Chen J. Zhang X.-J. Wu H.-W. Liang Nat. Commun. 10 2019 4977 Q.-Q. Yan, D.-X. Wu, S.-Q. Chu, Z.-Q. Chen, Y. Lin, M.-X. Chen, J. Zhang, X.-J. Wu, H.-W. Liang, Reversing the charge transfer between platinum and sulfur-doped carbon support for electrocatalytic hydrogen evolution, Nat. Commun., 10 (2019) 4977. [57] C.A. Fleckenstein H. Plenio Chem. Soc. Rev. 39 2010 694 711 C.A. Fleckenstein, H. Plenio, Sterically demanding trialkylphosphines for palladium-catalyzed cross coupling reactions——alternatives to PtBu3, Chem. Soc. Rev., 39 (2010) 694-711. [58] J.F. Hartwig Nature 455 2008 314 322 Carbon––heteroatom bond formation catalysed by organometallic complexesJ.F. Hartwig, Carbon–heteroatom bond formation catalysed by organometallic complexes, Nature, 455 (2008) 314-322. [59] L. Xue Z. Lin Chem. Soc. Rev. 39 2010 1692 1705 Theoretical aspects of palladium-catalysed carbonL. Xue, Z. Lin, Theoretical aspects of palladium-catalysed carbon––carbon cross-coupling reactions, Chem. Soc. Rev., 39 (2010) 1692-1705.",
      "scopus-id": "85107624728",
      "coredata": {
        "eid": "1-s2.0-S0926860X21002581",
        "dc:description": "For heterogeneous catalysts with nitrogen doped carbon materials as supporting substrates, accurate nitrogen (N) species and content is an important factor for promoting the catalytic activity. In this paper, N-doped graphdiyne (NGDY) was prepared from tetraethynylpyrazine (TEP) by bottom-up synthesis method as the support of metal nanoparticles. Specific pyridine nitrogen atoms are introduced in the N-doped carbon material. This unique structure makes it a promising material to support ultrafine metal particles or clusters. Microwave-assisted anchoring of Pd, Pt, Cu, Ni nanoparticles on NGDY generated novel hybrid composites, in which Pd-NGDY has high versatility for Suzuki-Miyaura reaction. DFT calculations revealed a charge transfer from NGDY to Pd NPs, and the free energy distribution showed a downward trend for Suzuki-Miyaura coupling reactions.",
        "openArchiveArticle": "false",
        "prism:coverDate": "2021-08-05",
        "openaccessUserLicense": null,
        "prism:aggregationType": "Journal",
        "prism:url": "https://api.elsevier.com/content/article/pii/S0926860X21002581",
        "dc:creator": [
          {
            "@_fa": "true",
            "$": "Shen, Han"
          },
          {
            "@_fa": "true",
            "$": "He, Jingyi"
          },
          {
            "@_fa": "true",
            "$": "He, Feng"
          },
          {
            "@_fa": "true",
            "$": "Xue, Yurui"
          },
          {
            "@_fa": "true",
            "$": "Li, Yongjun"
          },
          {
            "@_fa": "true",
            "$": "Li, Yuliang"
          }
        ],
        "link": [
          {
            "@_fa": "true",
            "@rel": "self",
            "@href": "https://api.elsevier.com/content/article/pii/S0926860X21002581"
          },
          {
            "@_fa": "true",
            "@rel": "scidir",
            "@href": "https://www.sciencedirect.com/science/article/pii/S0926860X21002581"
          }
        ],
        "dc:format": "application/json",
        "openaccessType": null,
        "pii": "S0926-860X(21)00258-1",
        "prism:volume": "623",
        "articleNumber": "118244",
        "prism:publisher": "Elsevier B.V.",
        "dc:title": "Nitrogen-doped graphdiyne for effective metal deposition and heterogeneous Suzuki-Miyaura coupling catalysis",
        "prism:copyright": "© 2021 Elsevier B.V. All rights reserved.",
        "openaccess": "0",
        "prism:issn": "0926860X",
        "dcterms:subject": [
          {
            "@_fa": "true",
            "$": "Nitrogen doping"
          },
          {
            "@_fa": "true",
            "$": "Graphdiyne"
          },
          {
            "@_fa": "true",
            "$": "Pd nanoparticle"
          },
          {
            "@_fa": "true",
            "$": "Suzuki-Miyaura reaction"
          },
          {
            "@_fa": "true",
            "$": "Heterogenous catalyst"
          }
        ],
        "openaccessArticle": "false",
        "prism:publicationName": "Applied Catalysis A: General",
        "openaccessSponsorType": null,
        "prism:pageRange": "118244",
        "pubType": "fla",
        "prism:coverDisplayDate": "5 August 2021",
        "prism:doi": "10.1016/j.apcata.2021.118244",
        "prism:startingPage": "118244",
        "dc:identifier": "doi:10.1016/j.apcata.2021.118244",
        "openaccessSponsorName": null
      },
      "objects": {
        "object": [
          {
            "@category": "standard",
            "@height": "40",
            "@width": "64",
            "@_fa": "true",
            "$": "https://api.elsevier.com/content/object/eid/1-s2.0-S0926860X21002581-fx11.jpg?httpAccept=%2A%2F%2A",
            "@multimediatype": "JPEG image file",
            "@type": "IMAGE-DOWNSAMPLED",
            "@size": "1361",
            "@ref": "fx11",
            "@mimetype": "image/jpeg"
          },
          {
            "@category": "standard",
            "@height": "45",
            "@width": "72",
            "@_fa": "true",
            "$": "https://api.elsevier.com/content/object/eid/1-s2.0-S0926860X21002581-fx10.jpg?httpAccept=%2A%2F%2A",
            "@multimediatype": "JPEG image file",
            "@type": "IMAGE-DOWNSAMPLED",
            "@size": "1365",
            "@ref": "fx10",
            "@mimetype": "image/jpeg"
          },
          {
            "@category": "standard",
            "@height": "531",
            "@width": "602",
            "@_fa": "true",
            "$": "https://api.elsevier.com/content/object/eid/1-s2.0-S0926860X21002581-gr6.jpg?httpAccept=%2A%2F%2A",
            "@multimediatype": "JPEG image file",
            "@type": "IMAGE-DOWNSAMPLED",
            "@size": "75270",
            "@ref": "gr6",
            "@mimetype": "image/jpeg"
          },
          {
            "@category": "standard",
            "@height": "44",
            "@width": "63",
            "@_fa": "true",
            "$": "https://api.elsevier.com/content/object/eid/1-s2.0-S0926860X21002581-fx14.jpg?httpAccept=%2A%2F%2A",
            "@multimediatype": "JPEG image file",
            "@type": "IMAGE-DOWNSAMPLED",
            "@size": "1222",
            "@ref": "fx14",
            "@mimetype": "image/jpeg"
          },
          {
            "@category": "standard",
            "@height": "228",
            "@width": "602",
            "@_fa": "true",
            "$": "https://api.elsevier.com/content/object/eid/1-s2.0-S0926860X21002581-gr4.jpg?httpAccept=%2A%2F%2A",
            "@multimediatype": "JPEG image file",
            "@type": "IMAGE-DOWNSAMPLED",
            "@size": "25074",
            "@ref": "gr4",
            "@mimetype": "image/jpeg"
          },
          {
            "@category": "standard",
            "@height": "76",
            "@width": "183",
            "@_fa": "true",
            "$": "https://api.elsevier.com/content/object/eid/1-s2.0-S0926860X21002581-fx13.jpg?httpAccept=%2A%2F%2A",
            "@multimediatype": "JPEG image file",
            "@type": "IMAGE-DOWNSAMPLED",
            "@size": "3751",
            "@ref": "fx13",
            "@mimetype": "image/jpeg"
          },
          {
            "@category": "standard",
            "@height": "243",
            "@width": "339",
            "@_fa": "true",
            "$": "https://api.elsevier.com/content/object/eid/1-s2.0-S0926860X21002581-gr5.jpg?httpAccept=%2A%2F%2A",
            "@multimediatype": "JPEG image file",
            "@type": "IMAGE-DOWNSAMPLED",
            "@size": "23084",
            "@ref": "gr5",
            "@mimetype": "image/jpeg"
          },
          {
            "@category": "standard",
            "@height": "50",
            "@width": "55",
            "@_fa": "true",
            "$": "https://api.elsevier.com/content/object/eid/1-s2.0-S0926860X21002581-fx12.jpg?httpAccept=%2A%2F%2A",
            "@multimediatype": "JPEG image file",
            "@type": "IMAGE-DOWNSAMPLED",
            "@size": "1473",
            "@ref": "fx12",
            "@mimetype": "image/jpeg"
          },
          {
            "@category": "standard",
            "@height": "200",
            "@width": "298",
            "@_fa": "true",
            "$": "https://api.elsevier.com/content/object/eid/1-s2.0-S0926860X21002581-ga1.jpg?httpAccept=%2A%2F%2A",
            "@multimediatype": "JPEG image file",
            "@type": "IMAGE-DOWNSAMPLED",
            "@size": "27600",
            "@ref": "ga1",
            "@mimetype": "image/jpeg"
          },
          {
            "@category": "standard",
            "@height": "34",
            "@width": "43",
            "@_fa": "true",
            "$": "https://api.elsevier.com/content/object/eid/1-s2.0-S0926860X21002581-fx1.jpg?httpAccept=%2A%2F%2A",
            "@multimediatype": "JPEG image file",
            "@type": "IMAGE-DOWNSAMPLED",
            "@size": "981",
            "@ref": "fx1",
            "@mimetype": "image/jpeg"
          },
          {
            "@category": "standard",
            "@height": "40",
            "@width": "120",
            "@_fa": "true",
            "$": "https://api.elsevier.com/content/object/eid/1-s2.0-S0926860X21002581-fx2.jpg?httpAccept=%2A%2F%2A",
            "@multimediatype": "JPEG image file",
            "@type": "IMAGE-DOWNSAMPLED",
            "@size": "2605",
            "@ref": "fx2",
            "@mimetype": "image/jpeg"
          },
          {
            "@category": "standard",
            "@height": "867",
            "@width": "753",
            "@_fa": "true",
            "$": "https://api.elsevier.com/content/object/eid/1-s2.0-S0926860X21002581-gr2.jpg?httpAccept=%2A%2F%2A",
            "@multimediatype": "JPEG image file",
            "@type": "IMAGE-DOWNSAMPLED",
            "@size": "249574",
            "@ref": "gr2",
            "@mimetype": "image/jpeg"
          },
          {
            "@category": "standard",
            "@height": "33",
            "@width": "75",
            "@_fa": "true",
            "$": "https://api.elsevier.com/content/object/eid/1-s2.0-S0926860X21002581-fx9.jpg?httpAccept=%2A%2F%2A",
            "@multimediatype": "JPEG image file",
            "@type": "IMAGE-DOWNSAMPLED",
            "@size": "1446",
            "@ref": "fx9",
            "@mimetype": "image/jpeg"
          },
          {
            "@category": "standard",
            "@height": "602",
            "@width": "753",
            "@_fa": "true",
            "$": "https://api.elsevier.com/content/object/eid/1-s2.0-S0926860X21002581-gr3.jpg?httpAccept=%2A%2F%2A",
            "@multimediatype": "JPEG image file",
            "@type": "IMAGE-DOWNSAMPLED",
            "@size": "146569",
            "@ref": "gr3",
            "@mimetype": "image/jpeg"
          },
          {
            "@category": "standard",
            "@height": "31",
            "@width": "92",
            "@_fa": "true",
            "$": "https://api.elsevier.com/content/object/eid/1-s2.0-S0926860X21002581-fx7.jpg?httpAccept=%2A%2F%2A",
            "@multimediatype": "JPEG image file",
            "@type": "IMAGE-DOWNSAMPLED",
            "@size": "1427",
            "@ref": "fx7",
            "@mimetype": "image/jpeg"
          },
          {
            "@category": "standard",
            "@height": "449",
            "@width": "678",
            "@_fa": "true",
            "$": "https://api.elsevier.com/content/object/eid/1-s2.0-S0926860X21002581-gr1.jpg?httpAccept=%2A%2F%2A",
            "@multimediatype": "JPEG image file",
            "@type": "IMAGE-DOWNSAMPLED",
            "@size": "105018",
            "@ref": "gr1",
            "@mimetype": "image/jpeg"
          },
          {
            "@category": "standard",
            "@height": "30",
            "@width": "94",
            "@_fa": "true",
            "$": "https://api.elsevier.com/content/object/eid/1-s2.0-S0926860X21002581-fx8.jpg?httpAccept=%2A%2F%2A",
            "@multimediatype": "JPEG image file",
            "@type": "IMAGE-DOWNSAMPLED",
            "@size": "1493",
            "@ref": "fx8",
            "@mimetype": "image/jpeg"
          },
          {
            "@category": "standard",
            "@height": "34",
            "@width": "47",
            "@_fa": "true",
            "$": "https://api.elsevier.com/content/object/eid/1-s2.0-S0926860X21002581-fx5.jpg?httpAccept=%2A%2F%2A",
            "@multimediatype": "JPEG image file",
            "@type": "IMAGE-DOWNSAMPLED",
            "@size": "998",
            "@ref": "fx5",
            "@mimetype": "image/jpeg"
          },
          {
            "@category": "standard",
            "@height": "33",
            "@width": "47",
            "@_fa": "true",
            "$": "https://api.elsevier.com/content/object/eid/1-s2.0-S0926860X21002581-fx6.jpg?httpAccept=%2A%2F%2A",
            "@multimediatype": "JPEG image file",
            "@type": "IMAGE-DOWNSAMPLED",
            "@size": "998",
            "@ref": "fx6",
            "@mimetype": "image/jpeg"
          },
          {
            "@category": "standard",
            "@height": "298",
            "@width": "567",
            "@_fa": "true",
            "$": "https://api.elsevier.com/content/object/eid/1-s2.0-S0926860X21002581-sc1.jpg?httpAccept=%2A%2F%2A",
            "@multimediatype": "JPEG image file",
            "@type": "IMAGE-DOWNSAMPLED",
            "@size": "35718",
            "@ref": "sc1",
            "@mimetype": "image/jpeg"
          },
          {
            "@category": "standard",
            "@height": "37",
            "@width": "53",
            "@_fa": "true",
            "$": "https://api.elsevier.com/content/object/eid/1-s2.0-S0926860X21002581-fx3.jpg?httpAccept=%2A%2F%2A",
            "@multimediatype": "JPEG image file",
            "@type": "IMAGE-DOWNSAMPLED",
            "@size": "1058",
            "@ref": "fx3",
            "@mimetype": "image/jpeg"
          },
          {
            "@category": "standard",
            "@height": "73",
            "@width": "106",
            "@_fa": "true",
            "$": "https://api.elsevier.com/content/object/eid/1-s2.0-S0926860X21002581-fx4.jpg?httpAccept=%2A%2F%2A",
            "@multimediatype": "JPEG image file",
            "@type": "IMAGE-DOWNSAMPLED",
            "@size": "2393",
            "@ref": "fx4",
            "@mimetype": "image/jpeg"
          },
          {
            "@category": "thumbnail",
            "@height": "137",
            "@width": "219",
            "@_fa": "true",
            "$": "https://api.elsevier.com/content/object/eid/1-s2.0-S0926860X21002581-fx11.sml?httpAccept=%2A%2F%2A",
            "@multimediatype": "GIF image file",
            "@type": "IMAGE-THUMBNAIL",
            "@size": "5254",
            "@ref": "fx11",
            "@mimetype": "image/gif"
          },
          {
            "@category": "thumbnail",
            "@height": "137",
            "@width": "219",
            "@_fa": "true",
            "$": "https://api.elsevier.com/content/object/eid/1-s2.0-S0926860X21002581-fx10.sml?httpAccept=%2A%2F%2A",
            "@multimediatype": "GIF image file",
            "@type": "IMAGE-THUMBNAIL",
            "@size": "4387",
            "@ref": "fx10",
            "@mimetype": "image/gif"
          },
          {
            "@category": "thumbnail",
            "@height": "164",
            "@width": "186",
            "@_fa": "true",
            "$": "https://api.elsevier.com/content/object/eid/1-s2.0-S0926860X21002581-gr6.sml?httpAccept=%2A%2F%2A",
            "@multimediatype": "GIF image file",
            "@type": "IMAGE-THUMBNAIL",
            "@size": "9902",
            "@ref": "gr6",
            "@mimetype": "image/gif"
          },
          {
            "@category": "thumbnail",
            "@height": "153",
            "@width": "219",
            "@_fa": "true",
            "$": "https://api.elsevier.com/content/object/eid/1-s2.0-S0926860X21002581-fx14.sml?httpAccept=%2A%2F%2A",
            "@multimediatype": "GIF image file",
            "@type": "IMAGE-THUMBNAIL",
            "@size": "4256",
            "@ref": "fx14",
            "@mimetype": "image/gif"
          },
          {
            "@category": "thumbnail",
            "@height": "83",
            "@width": "219",
            "@_fa": "true",
            "$": "https://api.elsevier.com/content/object/eid/1-s2.0-S0926860X21002581-gr4.sml?httpAccept=%2A%2F%2A",
            "@multimediatype": "GIF image file",
            "@type": "IMAGE-THUMBNAIL",
            "@size": "4349",
            "@ref": "gr4",
            "@mimetype": "image/gif"
          },
          {
            "@category": "thumbnail",
            "@height": "91",
            "@width": "219",
            "@_fa": "true",
            "$": "https://api.elsevier.com/content/object/eid/1-s2.0-S0926860X21002581-fx13.sml?httpAccept=%2A%2F%2A",
            "@multimediatype": "GIF image file",
            "@type": "IMAGE-THUMBNAIL",
            "@size": "3153",
            "@ref": "fx13",
            "@mimetype": "image/gif"
          },
          {
            "@category": "thumbnail",
            "@height": "157",
            "@width": "219",
            "@_fa": "true",
            "$": "https://api.elsevier.com/content/object/eid/1-s2.0-S0926860X21002581-gr5.sml?httpAccept=%2A%2F%2A",
            "@multimediatype": "GIF image file",
            "@type": "IMAGE-THUMBNAIL",
            "@size": "8282",
            "@ref": "gr5",
            "@mimetype": "image/gif"
          },
          {
            "@category": "thumbnail",
            "@height": "164",
            "@width": "179",
            "@_fa": "true",
            "$": "https://api.elsevier.com/content/object/eid/1-s2.0-S0926860X21002581-fx12.sml?httpAccept=%2A%2F%2A",
            "@multimediatype": "GIF image file",
            "@type": "IMAGE-THUMBNAIL",
            "@size": "4837",
            "@ref": "fx12",
            "@mimetype": "image/gif"
          },
          {
            "@category": "thumbnail",
            "@height": "147",
            "@width": "219",
            "@_fa": "true",
            "$": "https://api.elsevier.com/content/object/eid/1-s2.0-S0926860X21002581-ga1.sml?httpAccept=%2A%2F%2A",
            "@multimediatype": "GIF image file",
            "@type": "IMAGE-THUMBNAIL",
            "@size": "18167",
            "@ref": "ga1",
            "@mimetype": "image/gif"
          },
          {
            "@category": "thumbnail",
            "@height": "154",
            "@width": "192",
            "@_fa": "true",
            "$": "https://api.elsevier.com/content/object/eid/1-s2.0-S0926860X21002581-fx1.sml?httpAccept=%2A%2F%2A",
            "@multimediatype": "GIF image file",
            "@type": "IMAGE-THUMBNAIL",
            "@size": "4212",
            "@ref": "fx1",
            "@mimetype": "image/gif"
          },
          {
            "@category": "thumbnail",
            "@height": "74",
            "@width": "219",
            "@_fa": "true",
            "$": "https://api.elsevier.com/content/object/eid/1-s2.0-S0926860X21002581-fx2.sml?httpAccept=%2A%2F%2A",
            "@multimediatype": "GIF image file",
            "@type": "IMAGE-THUMBNAIL",
            "@size": "4085",
            "@ref": "fx2",
            "@mimetype": "image/gif"
          },
          {
            "@category": "thumbnail",
            "@height": "163",
            "@width": "142",
            "@_fa": "true",
            "$": "https://api.elsevier.com/content/object/eid/1-s2.0-S0926860X21002581-gr2.sml?httpAccept=%2A%2F%2A",
            "@multimediatype": "GIF image file",
            "@type": "IMAGE-THUMBNAIL",
            "@size": "16829",
            "@ref": "gr2",
            "@mimetype": "image/gif"
          },
          {
            "@category": "thumbnail",
            "@height": "96",
            "@width": "219",
            "@_fa": "true",
            "$": "https://api.elsevier.com/content/object/eid/1-s2.0-S0926860X21002581-fx9.sml?httpAccept=%2A%2F%2A",
            "@multimediatype": "GIF image file",
            "@type": "IMAGE-THUMBNAIL",
            "@size": "4152",
            "@ref": "fx9",
            "@mimetype": "image/gif"
          },
          {
            "@category": "thumbnail",
            "@height": "164",
            "@width": "205",
            "@_fa": "true",
            "$": "https://api.elsevier.com/content/object/eid/1-s2.0-S0926860X21002581-gr3.sml?httpAccept=%2A%2F%2A",
            "@multimediatype": "GIF image file",
            "@type": "IMAGE-THUMBNAIL",
            "@size": "16257",
            "@ref": "gr3",
            "@mimetype": "image/gif"
          },
          {
            "@category": "thumbnail",
            "@height": "74",
            "@width": "219",
            "@_fa": "true",
            "$": "https://api.elsevier.com/content/object/eid/1-s2.0-S0926860X21002581-fx7.sml?httpAccept=%2A%2F%2A",
            "@multimediatype": "GIF image file",
            "@type": "IMAGE-THUMBNAIL",
            "@size": "3263",
            "@ref": "fx7",
            "@mimetype": "image/gif"
          },
          {
            "@category": "thumbnail",
            "@height": "145",
            "@width": "219",
            "@_fa": "true",
            "$": "https://api.elsevier.com/content/object/eid/1-s2.0-S0926860X21002581-gr1.sml?httpAccept=%2A%2F%2A",
            "@multimediatype": "GIF image file",
            "@type": "IMAGE-THUMBNAIL",
            "@size": "14352",
            "@ref": "gr1",
            "@mimetype": "image/gif"
          },
          {
            "@category": "thumbnail",
            "@height": "69",
            "@width": "219",
            "@_fa": "true",
            "$": "https://api.elsevier.com/content/object/eid/1-s2.0-S0926860X21002581-fx8.sml?httpAccept=%2A%2F%2A",
            "@multimediatype": "GIF image file",
            "@type": "IMAGE-THUMBNAIL",
            "@size": "3155",
            "@ref": "fx8",
            "@mimetype": "image/gif"
          },
          {
            "@category": "thumbnail",
            "@height": "153",
            "@width": "212",
            "@_fa": "true",
            "$": "https://api.elsevier.com/content/object/eid/1-s2.0-S0926860X21002581-fx5.sml?httpAccept=%2A%2F%2A",
            "@multimediatype": "GIF image file",
            "@type": "IMAGE-THUMBNAIL",
            "@size": "4452",
            "@ref": "fx5",
            "@mimetype": "image/gif"
          },
          {
            "@category": "thumbnail",
            "@height": "150",
            "@width": "212",
            "@_fa": "true",
            "$": "https://api.elsevier.com/content/object/eid/1-s2.0-S0926860X21002581-fx6.sml?httpAccept=%2A%2F%2A",
            "@multimediatype": "GIF image file",
            "@type": "IMAGE-THUMBNAIL",
            "@size": "6490",
            "@ref": "fx6",
            "@mimetype": "image/gif"
          },
          {
            "@category": "thumbnail",
            "@height": "115",
            "@width": "219",
            "@_fa": "true",
            "$": "https://api.elsevier.com/content/object/eid/1-s2.0-S0926860X21002581-sc1.sml?httpAccept=%2A%2F%2A",
            "@multimediatype": "GIF image file",
            "@type": "IMAGE-THUMBNAIL",
            "@size": "7759",
            "@ref": "sc1",
            "@mimetype": "image/gif"
          },
          {
            "@category": "thumbnail",
            "@height": "154",
            "@width": "219",
            "@_fa": "true",
            "$": "https://api.elsevier.com/content/object/eid/1-s2.0-S0926860X21002581-fx3.sml?httpAccept=%2A%2F%2A",
            "@multimediatype": "GIF image file",
            "@type": "IMAGE-THUMBNAIL",
            "@size": "5052",
            "@ref": "fx3",
            "@mimetype": "image/gif"
          },
          {
            "@category": "thumbnail",
            "@height": "151",
            "@width": "219",
            "@_fa": "true",
            "$": "https://api.elsevier.com/content/object/eid/1-s2.0-S0926860X21002581-fx4.sml?httpAccept=%2A%2F%2A",
            "@multimediatype": "GIF image file",
            "@type": "IMAGE-THUMBNAIL",
            "@size": "4134",
            "@ref": "fx4",
            "@mimetype": "image/gif"
          },
          {
            "@category": "high",
            "@height": "178",
            "@width": "284",
            "@_fa": "true",
            "$": "https://api.elsevier.com/content/object/eid/1-s2.0-S0926860X21002581-fx11_lrg.jpg?httpAccept=%2A%2F%2A",
            "@multimediatype": "JPEG image file",
            "@type": "IMAGE-HIGH-RES",
            "@size": "8786",
            "@ref": "fx11",
            "@mimetype": "image/jpeg"
          },
          {
            "@category": "high",
            "@height": "200",
            "@width": "320",
            "@_fa": "true",
            "$": "https://api.elsevier.com/content/object/eid/1-s2.0-S0926860X21002581-fx10_lrg.jpg?httpAccept=%2A%2F%2A",
            "@multimediatype": "JPEG image file",
            "@type": "IMAGE-HIGH-RES",
            "@size": "8284",
            "@ref": "fx10",
            "@mimetype": "image/jpeg"
          },
          {
            "@category": "high",
            "@height": "2353",
            "@width": "2667",
            "@_fa": "true",
            "$": "https://api.elsevier.com/content/object/eid/1-s2.0-S0926860X21002581-gr6_lrg.jpg?httpAccept=%2A%2F%2A",
            "@multimediatype": "JPEG image file",
            "@type": "IMAGE-HIGH-RES",
            "@size": "552932",
            "@ref": "gr6",
            "@mimetype": "image/jpeg"
          },
          {
            "@category": "high",
            "@height": "198",
            "@width": "283",
            "@_fa": "true",
            "$": "https://api.elsevier.com/content/object/eid/1-s2.0-S0926860X21002581-fx14_lrg.jpg?httpAccept=%2A%2F%2A",
            "@multimediatype": "JPEG image file",
            "@type": "IMAGE-HIGH-RES",
            "@size": "7592",
            "@ref": "fx14",
            "@mimetype": "image/jpeg"
          },
          {
            "@category": "high",
            "@height": "1011",
            "@width": "2667",
            "@_fa": "true",
            "$": "https://api.elsevier.com/content/object/eid/1-s2.0-S0926860X21002581-gr4_lrg.jpg?httpAccept=%2A%2F%2A",
            "@multimediatype": "JPEG image file",
            "@type": "IMAGE-HIGH-RES",
            "@size": "203921",
            "@ref": "gr4",
            "@mimetype": "image/jpeg"
          },
          {
            "@category": "high",
            "@height": "337",
            "@width": "811",
            "@_fa": "true",
            "$": "https://api.elsevier.com/content/object/eid/1-s2.0-S0926860X21002581-fx13_lrg.jpg?httpAccept=%2A%2F%2A",
            "@multimediatype": "JPEG image file",
            "@type": "IMAGE-HIGH-RES",
            "@size": "25782",
            "@ref": "fx13",
            "@mimetype": "image/jpeg"
          },
          {
            "@category": "high",
            "@height": "1074",
            "@width": "1500",
            "@_fa": "true",
            "$": "https://api.elsevier.com/content/object/eid/1-s2.0-S0926860X21002581-gr5_lrg.jpg?httpAccept=%2A%2F%2A",
            "@multimediatype": "JPEG image file",
            "@type": "IMAGE-HIGH-RES",
            "@size": "162203",
            "@ref": "gr5",
            "@mimetype": "image/jpeg"
          },
          {
            "@category": "high",
            "@height": "223",
            "@width": "244",
            "@_fa": "true",
            "$": "https://api.elsevier.com/content/object/eid/1-s2.0-S0926860X21002581-fx12_lrg.jpg?httpAccept=%2A%2F%2A",
            "@multimediatype": "JPEG image file",
            "@type": "IMAGE-HIGH-RES",
            "@size": "9070",
            "@ref": "fx12",
            "@mimetype": "image/jpeg"
          },
          {
            "@category": "high",
            "@height": "886",
            "@width": "1319",
            "@_fa": "true",
            "$": "https://api.elsevier.com/content/object/eid/1-s2.0-S0926860X21002581-ga1_lrg.jpg?httpAccept=%2A%2F%2A",
            "@multimediatype": "JPEG image file",
            "@type": "IMAGE-HIGH-RES",
            "@size": "206613",
            "@ref": "ga1",
            "@mimetype": "image/jpeg"
          },
          {
            "@category": "high",
            "@height": "154",
            "@width": "192",
            "@_fa": "true",
            "$": "https://api.elsevier.com/content/object/eid/1-s2.0-S0926860X21002581-fx1_lrg.jpg?httpAccept=%2A%2F%2A",
            "@multimediatype": "JPEG image file",
            "@type": "IMAGE-HIGH-RES",
            "@size": "5218",
            "@ref": "fx1",
            "@mimetype": "image/jpeg"
          },
          {
            "@category": "high",
            "@height": "179",
            "@width": "532",
            "@_fa": "true",
            "$": "https://api.elsevier.com/content/object/eid/1-s2.0-S0926860X21002581-fx2_lrg.jpg?httpAccept=%2A%2F%2A",
            "@multimediatype": "JPEG image file",
            "@type": "IMAGE-HIGH-RES",
            "@size": "18037",
            "@ref": "fx2",
            "@mimetype": "image/jpeg"
          },
          {
            "@category": "high",
            "@height": "3837",
            "@width": "3333",
            "@_fa": "true",
            "$": "https://api.elsevier.com/content/object/eid/1-s2.0-S0926860X21002581-gr2_lrg.jpg?httpAccept=%2A%2F%2A",
            "@multimediatype": "JPEG image file",
            "@type": "IMAGE-HIGH-RES",
            "@size": "2672091",
            "@ref": "gr2",
            "@mimetype": "image/jpeg"
          },
          {
            "@category": "high",
            "@height": "147",
            "@width": "335",
            "@_fa": "true",
            "$": "https://api.elsevier.com/content/object/eid/1-s2.0-S0926860X21002581-fx9_lrg.jpg?httpAccept=%2A%2F%2A",
            "@multimediatype": "JPEG image file",
            "@type": "IMAGE-HIGH-RES",
            "@size": "9137",
            "@ref": "fx9",
            "@mimetype": "image/jpeg"
          },
          {
            "@category": "high",
            "@height": "2666",
            "@width": "3333",
            "@_fa": "true",
            "$": "https://api.elsevier.com/content/object/eid/1-s2.0-S0926860X21002581-gr3_lrg.jpg?httpAccept=%2A%2F%2A",
            "@multimediatype": "JPEG image file",
            "@type": "IMAGE-HIGH-RES",
            "@size": "1338942",
            "@ref": "gr3",
            "@mimetype": "image/jpeg"
          },
          {
            "@category": "high",
            "@height": "138",
            "@width": "409",
            "@_fa": "true",
            "$": "https://api.elsevier.com/content/object/eid/1-s2.0-S0926860X21002581-fx7_lrg.jpg?httpAccept=%2A%2F%2A",
            "@multimediatype": "JPEG image file",
            "@type": "IMAGE-HIGH-RES",
            "@size": "8294",
            "@ref": "fx7",
            "@mimetype": "image/jpeg"
          },
          {
            "@category": "high",
            "@height": "1985",
            "@width": "3000",
            "@_fa": "true",
            "$": "https://api.elsevier.com/content/object/eid/1-s2.0-S0926860X21002581-gr1_lrg.jpg?httpAccept=%2A%2F%2A",
            "@multimediatype": "JPEG image file",
            "@type": "IMAGE-HIGH-RES",
            "@size": "811879",
            "@ref": "gr1",
            "@mimetype": "image/jpeg"
          },
          {
            "@category": "high",
            "@height": "132",
            "@width": "416",
            "@_fa": "true",
            "$": "https://api.elsevier.com/content/object/eid/1-s2.0-S0926860X21002581-fx8_lrg.jpg?httpAccept=%2A%2F%2A",
            "@multimediatype": "JPEG image file",
            "@type": "IMAGE-HIGH-RES",
            "@size": "8413",
            "@ref": "fx8",
            "@mimetype": "image/jpeg"
          },
          {
            "@category": "high",
            "@height": "153",
            "@width": "212",
            "@_fa": "true",
            "$": "https://api.elsevier.com/content/object/eid/1-s2.0-S0926860X21002581-fx5_lrg.jpg?httpAccept=%2A%2F%2A",
            "@multimediatype": "JPEG image file",
            "@type": "IMAGE-HIGH-RES",
            "@size": "5919",
            "@ref": "fx5",
            "@mimetype": "image/jpeg"
          },
          {
            "@category": "high",
            "@height": "150",
            "@width": "212",
            "@_fa": "true",
            "$": "https://api.elsevier.com/content/object/eid/1-s2.0-S0926860X21002581-fx6_lrg.jpg?httpAccept=%2A%2F%2A",
            "@multimediatype": "JPEG image file",
            "@type": "IMAGE-HIGH-RES",
            "@size": "5714",
            "@ref": "fx6",
            "@mimetype": "image/jpeg"
          },
          {
            "@category": "high",
            "@height": "1317",
            "@width": "2510",
            "@_fa": "true",
            "$": "https://api.elsevier.com/content/object/eid/1-s2.0-S0926860X21002581-sc1_lrg.jpg?httpAccept=%2A%2F%2A",
            "@multimediatype": "JPEG image file",
            "@type": "IMAGE-HIGH-RES",
            "@size": "317977",
            "@ref": "sc1",
            "@mimetype": "image/jpeg"
          },
          {
            "@category": "high",
            "@height": "167",
            "@width": "238",
            "@_fa": "true",
            "$": "https://api.elsevier.com/content/object/eid/1-s2.0-S0926860X21002581-fx3_lrg.jpg?httpAccept=%2A%2F%2A",
            "@multimediatype": "JPEG image file",
            "@type": "IMAGE-HIGH-RES",
            "@size": "6458",
            "@ref": "fx3",
            "@mimetype": "image/jpeg"
          },
          {
            "@category": "high",
            "@height": "325",
            "@width": "470",
            "@_fa": "true",
            "$": "https://api.elsevier.com/content/object/eid/1-s2.0-S0926860X21002581-fx4_lrg.jpg?httpAccept=%2A%2F%2A",
            "@multimediatype": "JPEG image file",
            "@type": "IMAGE-HIGH-RES",
            "@size": "15650",
            "@ref": "fx4",
            "@mimetype": "image/jpeg"
          },
          {
            "@category": "standard",
            "@_fa": "true",
            "$": "https://api.elsevier.com/content/object/eid/1-s2.0-S0926860X21002581-mmc1.docx?httpAccept=%2A%2F%2A",
            "@multimediatype": "Microsoft Word file",
            "@type": "APPLICATION",
            "@size": "1896707",
            "@ref": "mmc1",
            "@mimetype": "application/word"
          },
          {
            "@category": "standard",
            "@_fa": "true",
            "$": "https://api.elsevier.com/content/object/eid/1-s2.0-S0926860X21002581-am.pdf?httpAccept=%2A%2F%2A",
            "@multimediatype": "Acrobat PDF file",
            "@type": "AAM-PDF",
            "@size": "1135415",
            "@ref": "am",
            "@mimetype": "application/pdf"
          }
        ]
      },
      "link": {
        "@rel": "abstract",
        "@href": "https://api.elsevier.com/content/abstract/scopus_id/85107624728"
      }
    }
  }
}