{
  "metadata": {
    "title": "Catalytic co-conversion of glycerol and oleic acid to bio-aromatics: Catalyst deactivation studies for a technical H-ZSM-5/Al<ce:inf loc=post>2</ce:inf>O<ce:inf loc=post>3</ce:inf> catalyst",
    "authors": "; ; ",
    "journal": "Applied Catalysis A: General",
    "date": "2022-02-25",
    "doi": "10.1016/j.apcata.2022.118486",
    "abstract": "",
    "uri": "https://api.elsevier.com/content/article/pii/S0926860X22000096",
    "pii": "S0926860X22000096"
  },
  "fulltext": {
    "full-text-retrieval-response": {
      "scopus-eid": "2-s2.0-85123117256",
      "originalText": "serial JL 271346 291210 291744 291809 31 90 Applied Catalysis A: General APPLIEDCATALYSISAGENERAL 2022-01-20 2022-01-20 2022-01-20 2022-01-20 2022-02-07T13:06:26 1-s2.0-S0926860X22000096 S0926-860X(22)00009-6 S0926860X22000096 10.1016/j.apcata.2022.118486 S300 S300.1 FULL-TEXT 1-s2.0-S0926860X22X00033 2024-01-01T12:34:28.416125Z 0 0 20220225 2022 2022-01-20T12:56:19.383419Z absattachment articleinfo articlenumber articletitlenorm authfirstinitialnorm authfirstsurnamenorm cid cids contenttype copyright crossmark dateloaded dateloadedtxt datesearch datesort dateupdated dco docsubtype doctype doi eid ewtransactionid fundingbodyid hubeid indexeddate issn issnnorm itemstage itemtransactionid itemweight oauserlicense openaccess openarchive pg pgfirst pii piinorm pubdatestart pubdatetxt pubyr sortorder sponsoredaccesstype srctitle srctitlenorm srctype ssids alllist content oa subj subheadings suppl tomb volfirst volissue volumelist webpdf webpdfpagecount yearnav figure table e-component body mmlmath acknowledge affil appendices articletitle auth authfirstini authfull authkeywords authlast grantnumber grantsponsor grantsponsorid highlightsabst primabst ref specialabst 0926-860X 0926860X UNLIMITED VSNU2020 true 632 632 C Volume 632 4 118486 118486 118486 20220225 25 February 2022 2022-02-25 2022 article fla © 2022 The Author(s). Published by Elsevier B.V. CATALYTICCOCONVERSIONGLYCEROLOLEICACIDBIOAROMATICSCATALYSTDEACTIVATIONSTUDIESFORATECHNICALHZSM5AL2O3CATALYST HE S 1 Introduction 2 Experimental section 2.1 Materials 2.2 Catalytic co-conversion of glycerol/oleic acid 2.3 Product analysis 2.4 Reaction-regeneration cycles 2.5 Catalyst characterization 3 Results and discussions 3.1 Fresh catalyst performance 3.2 Five reaction-regeneration cycles 3.3 Changes in catalyst characteristics upon reaction-regeneration cycle(s) 3.3.1 Coke formation 3.3.2 Irreversible changes in catalyst characteristics upon reaction-regeneration cycle(s) 3.4 Catalytic co-feeding versus performance of the individual feeds 4 Conclusions CRediT authorship contribution statement Acknowledgments Appendix A Supplementary material References YAN 2021 45 62 K LOK 2019 1 11 C REZAEI 2014 490 511 P BALASUNDRAM 2020 V ZHANG 2011 2297 2307 H LIU 2014 7594 7623 C MONTEIRO 2018 109 122 M KHODADADI 2020 M ATABANI 2013 211 245 A BIELANSKY 2011 2305 2311 P HE 2018 45 55 S NISHU 2020 CHENG 2012 1387 1390 Y WANG 2020 26929 26937 F CHEN 2020 W FAN 2020 L ZHENG 2020 1833 1847 Y USLAMIN 2019 8547 8554 E WANG 2019 759 767 J GENUINO 2019 3802 3806 H ZHANG 2019 4389 4394 Z QI 2018 178 185 P CHANG 2018 545 554 G ZHANG 2018 147 153 B LEE 2016 81 88 H ZHOU 2014 45 53 G ZHANG 2013 5769 5774 H HE 2022 S HE 2022 1 13 S HE 2021 1128 1141 S LUNAMURILLO 2021 291 304 B LANGE 2021 186 192 J HE 2021 1 14 S BRUNAUER 1938 309 319 S BARRETT 1951 373 380 E CORMA 2007 307 327 A HE 2022 134620 S SHIN 2017 658 665 M PAN 2019 739 752 D ERREKATXO 2017 955 965 A HE 2021 1 12 S WANG 2019 4348 C ONO 1992 179 226 Y CYCHOSZ 2017 389 414 K TREACY 2007 278 279 M COLLECTIONSIMULATEDXRDPOWDERPATTERNSFORZEOLITES ALDUGHAITHER 2014 15303 15316 A ZAKI 2001 261 274 M HOFF 2016 20103 20113 T SUZUKI 1989 1818 1823 K YU 2011 22320 22327 Z HEX2022X118486 HEX2022X118486XS Full 2022-01-11T12:14:43Z FundingBody Dutch University VSNU 2020 http://creativecommons.org/licenses/by/4.0/ 2024-01-20T00:00:00.000Z 2024-01-20T00:00:00.000Z http://creativecommons.org/licenses/by-nc-nd/4.0/ This is an open access article under the CC BY license. © 2022 The Author(s). Published by Elsevier B.V. 0 item S0926-860X(22)00009-6 S0926860X22000096 1-s2.0-S0926860X22000096 10.1016/j.apcata.2022.118486 271346 2024-01-01T12:34:28.416125Z 2022-02-25 UNLIMITED VSNU2020 1-s2.0-S0926860X22000096-main.pdf https://s3-eu-west-1.amazonaws.com/prod-ucs-content-store-eu-west/content/pii:S0926860X22000096/MAIN/application/pdf/1100aa72acefad077a3c6d1a902345a3/main.pdf main.pdf pdf true 7510904 MAIN 10 1-s2.0-S0926860X22000096-main_1.png https://s3-eu-west-1.amazonaws.com/prod-ucs-content-store-eu-west/content/pii:S0926860X22000096/PREVIEW/image/png/1e1f03546ce27289637d0078789b383f/main_1.png main_1.png png 59188 849 656 IMAGE-WEB-PDF 1 1-s2.0-S0926860X22000096-gr2.jpg https://s3-eu-west-1.amazonaws.com/prod-ucs-content-store-eu-west/content/pii:S0926860X22000096/gr2/DOWNSAMPLED/image/jpeg/0880c69101413fca1910e45afffe458c/gr2.jpg gr2 gr2.jpg jpg 94989 429 659 IMAGE-DOWNSAMPLED 1-s2.0-S0926860X22000096-ga1.jpg https://s3-eu-west-1.amazonaws.com/prod-ucs-content-store-eu-west/content/pii:S0926860X22000096/ga1/DOWNSAMPLED/image/jpeg/c04b074efa433b0f3c1f0c7ec01bba66/ga1.jpg ga1 true ga1.jpg jpg 17717 200 480 IMAGE-DOWNSAMPLED 1-s2.0-S0926860X22000096-gr3.jpg https://s3-eu-west-1.amazonaws.com/prod-ucs-content-store-eu-west/content/pii:S0926860X22000096/gr3/DOWNSAMPLED/image/jpeg/5000160bb4eda8a1c2990a983204263f/gr3.jpg gr3 gr3.jpg jpg 14663 230 282 IMAGE-DOWNSAMPLED 1-s2.0-S0926860X22000096-gr4.jpg https://s3-eu-west-1.amazonaws.com/prod-ucs-content-store-eu-west/content/pii:S0926860X22000096/gr4/DOWNSAMPLED/image/jpeg/37d8c7f2ed00dce12959e90024c014ce/gr4.jpg gr4 gr4.jpg jpg 178811 722 659 IMAGE-DOWNSAMPLED 1-s2.0-S0926860X22000096-gr5.jpg https://s3-eu-west-1.amazonaws.com/prod-ucs-content-store-eu-west/content/pii:S0926860X22000096/gr5/DOWNSAMPLED/image/jpeg/9a4adef3eab7d760cc78cb3c968240ce/gr5.jpg gr5 gr5.jpg jpg 49956 537 376 IMAGE-DOWNSAMPLED 1-s2.0-S0926860X22000096-gr6.jpg https://s3-eu-west-1.amazonaws.com/prod-ucs-content-store-eu-west/content/pii:S0926860X22000096/gr6/DOWNSAMPLED/image/jpeg/e9c8c5461cc573c6a88f893cd969fc85/gr6.jpg gr6 gr6.jpg jpg 36645 272 376 IMAGE-DOWNSAMPLED 1-s2.0-S0926860X22000096-gr7.jpg https://s3-eu-west-1.amazonaws.com/prod-ucs-content-store-eu-west/content/pii:S0926860X22000096/gr7/DOWNSAMPLED/image/jpeg/1f993994c792e61e09b335b4968ec98f/gr7.jpg gr7 gr7.jpg jpg 18100 184 282 IMAGE-DOWNSAMPLED 1-s2.0-S0926860X22000096-gr8.jpg https://s3-eu-west-1.amazonaws.com/prod-ucs-content-store-eu-west/content/pii:S0926860X22000096/gr8/DOWNSAMPLED/image/jpeg/8fc17238393053b1da826061ae60c865/gr8.jpg gr8 gr8.jpg jpg 37737 355 376 IMAGE-DOWNSAMPLED 1-s2.0-S0926860X22000096-gr1.jpg https://s3-eu-west-1.amazonaws.com/prod-ucs-content-store-eu-west/content/pii:S0926860X22000096/gr1/DOWNSAMPLED/image/jpeg/93a4bdffaf45dccc4ba9ff48bea3741c/gr1.jpg gr1 gr1.jpg jpg 82042 448 659 IMAGE-DOWNSAMPLED 1-s2.0-S0926860X22000096-gr2.sml https://s3-eu-west-1.amazonaws.com/prod-ucs-content-store-eu-west/content/pii:S0926860X22000096/gr2/THUMBNAIL/image/gif/5be44b454d2a26023632bf33a65f5be3/gr2.sml gr2 gr2.sml sml 12731 143 219 IMAGE-THUMBNAIL 1-s2.0-S0926860X22000096-ga1.sml https://s3-eu-west-1.amazonaws.com/prod-ucs-content-store-eu-west/content/pii:S0926860X22000096/ga1/THUMBNAIL/image/gif/94a23cfecfded43cd5d3a00c36dd9b35/ga1.sml ga1 true ga1.sml sml 6921 91 219 IMAGE-THUMBNAIL 1-s2.0-S0926860X22000096-gr3.sml https://s3-eu-west-1.amazonaws.com/prod-ucs-content-store-eu-west/content/pii:S0926860X22000096/gr3/THUMBNAIL/image/gif/e04dcf7df73d8970913ec31a1fc29a2c/gr3.sml gr3 gr3.sml sml 7307 164 201 IMAGE-THUMBNAIL 1-s2.0-S0926860X22000096-gr4.sml https://s3-eu-west-1.amazonaws.com/prod-ucs-content-store-eu-west/content/pii:S0926860X22000096/gr4/THUMBNAIL/image/gif/fedf6a6a8a66d9ed839b30ce7bbcc114/gr4.sml gr4 gr4.sml sml 19007 163 149 IMAGE-THUMBNAIL 1-s2.0-S0926860X22000096-gr5.sml https://s3-eu-west-1.amazonaws.com/prod-ucs-content-store-eu-west/content/pii:S0926860X22000096/gr5/THUMBNAIL/image/gif/371ea417ffea69cd4b0db45c5b4e256c/gr5.sml gr5 gr5.sml sml 6916 163 114 IMAGE-THUMBNAIL 1-s2.0-S0926860X22000096-gr6.sml https://s3-eu-west-1.amazonaws.com/prod-ucs-content-store-eu-west/content/pii:S0926860X22000096/gr6/THUMBNAIL/image/gif/6a59bcb6e0127550911a2d0a8df01abc/gr6.sml gr6 gr6.sml sml 12141 158 219 IMAGE-THUMBNAIL 1-s2.0-S0926860X22000096-gr7.sml https://s3-eu-west-1.amazonaws.com/prod-ucs-content-store-eu-west/content/pii:S0926860X22000096/gr7/THUMBNAIL/image/gif/8f93f391bd7f1e70a030b30bf5ff5efa/gr7.sml gr7 gr7.sml sml 9809 143 219 IMAGE-THUMBNAIL 1-s2.0-S0926860X22000096-gr8.sml https://s3-eu-west-1.amazonaws.com/prod-ucs-content-store-eu-west/content/pii:S0926860X22000096/gr8/THUMBNAIL/image/gif/8c63a5ff9df3170870eca03814b42da3/gr8.sml gr8 gr8.sml sml 9630 164 174 IMAGE-THUMBNAIL 1-s2.0-S0926860X22000096-gr1.sml https://s3-eu-west-1.amazonaws.com/prod-ucs-content-store-eu-west/content/pii:S0926860X22000096/gr1/THUMBNAIL/image/gif/3762d9e68ca84af396c7764fbfa1bf09/gr1.sml gr1 gr1.sml sml 12694 149 219 IMAGE-THUMBNAIL 1-s2.0-S0926860X22000096-gr2_lrg.jpg https://s3-eu-west-1.amazonaws.com/prod-ucs-content-store-eu-west/content/pii:S0926860X22000096/gr2/HIGHRES/image/jpeg/b385b820915856b588778ac5e026ccc4/gr2_lrg.jpg gr2 gr2_lrg.jpg jpg 619211 1896 2911 IMAGE-HIGH-RES 1-s2.0-S0926860X22000096-ga1_lrg.jpg https://s3-eu-west-1.amazonaws.com/prod-ucs-content-store-eu-west/content/pii:S0926860X22000096/ga1/HIGHRES/image/jpeg/bb8c391f13be27311383e20593cd99ab/ga1_lrg.jpg ga1 true ga1_lrg.jpg jpg 127992 886 2124 IMAGE-HIGH-RES 1-s2.0-S0926860X22000096-gr3_lrg.jpg https://s3-eu-west-1.amazonaws.com/prod-ucs-content-store-eu-west/content/pii:S0926860X22000096/gr3/HIGHRES/image/jpeg/4a7ee1a7e0e444856dfc08ed240e48a0/gr3_lrg.jpg gr3 gr3_lrg.jpg jpg 83366 1015 1247 IMAGE-HIGH-RES 1-s2.0-S0926860X22000096-gr4_lrg.jpg https://s3-eu-west-1.amazonaws.com/prod-ucs-content-store-eu-west/content/pii:S0926860X22000096/gr4/HIGHRES/image/jpeg/5de7497904fb940b9b54292abf6af7ec/gr4_lrg.jpg gr4 gr4_lrg.jpg jpg 1014182 3188 2911 IMAGE-HIGH-RES 1-s2.0-S0926860X22000096-gr5_lrg.jpg https://s3-eu-west-1.amazonaws.com/prod-ucs-content-store-eu-west/content/pii:S0926860X22000096/gr5/HIGHRES/image/jpeg/ebcfab83c63b47557195469ebac0fddb/gr5_lrg.jpg gr5 gr5_lrg.jpg jpg 320143 2377 1663 IMAGE-HIGH-RES 1-s2.0-S0926860X22000096-gr6_lrg.jpg https://s3-eu-west-1.amazonaws.com/prod-ucs-content-store-eu-west/content/pii:S0926860X22000096/gr6/HIGHRES/image/jpeg/4e4ac844b5f65345bb0190d48e5ebf52/gr6_lrg.jpg gr6 gr6_lrg.jpg jpg 209717 1201 1663 IMAGE-HIGH-RES 1-s2.0-S0926860X22000096-gr7_lrg.jpg https://s3-eu-west-1.amazonaws.com/prod-ucs-content-store-eu-west/content/pii:S0926860X22000096/gr7/HIGHRES/image/jpeg/f30511b75041b31b25d483eaca0a4b3b/gr7_lrg.jpg gr7 gr7_lrg.jpg jpg 106018 815 1247 IMAGE-HIGH-RES 1-s2.0-S0926860X22000096-gr8_lrg.jpg https://s3-eu-west-1.amazonaws.com/prod-ucs-content-store-eu-west/content/pii:S0926860X22000096/gr8/HIGHRES/image/jpeg/ea9f9ebbd5a76f87ecc80535f2939f9b/gr8_lrg.jpg gr8 gr8_lrg.jpg jpg 227322 1569 1663 IMAGE-HIGH-RES 1-s2.0-S0926860X22000096-gr1_lrg.jpg https://s3-eu-west-1.amazonaws.com/prod-ucs-content-store-eu-west/content/pii:S0926860X22000096/gr1/HIGHRES/image/jpeg/21ad12768dbfbb9e2cf8fcd63868131d/gr1_lrg.jpg gr1 gr1_lrg.jpg jpg 453938 1979 2911 IMAGE-HIGH-RES 1-s2.0-S0926860X22000096-mmc1.docx https://s3-eu-west-1.amazonaws.com/prod-ucs-content-store-eu-west/content/pii:S0926860X22000096/mmc1/MAIN/application/vnd.openxmlformats-officedocument.wordprocessingml.document/4c194c5fe68e021a64539a32d61a593a/mmc1.docx mmc1 mmc1.docx docx 9958058 APPLICATION 1-s2.0-S0926860X22000096-si0001.svg https://s3-eu-west-1.amazonaws.com/prod-ucs-content-store-eu-west/content/pii:S0926860X22000096/STRIPIN/image/svg+xml/3f4476f4f1e2c0bcc14e75af3d363b22/si0001.svg si0001 si0001.svg svg 5008 ALTIMG 1-s2.0-S0926860X22000096-si0002.svg https://s3-eu-west-1.amazonaws.com/prod-ucs-content-store-eu-west/content/pii:S0926860X22000096/STRIPIN/image/svg+xml/a89de050c28734cc0933bd74fdce2f28/si0002.svg si0002 si0002.svg svg 5349 ALTIMG 1-s2.0-S0926860X22000096-si0003.svg https://s3-eu-west-1.amazonaws.com/prod-ucs-content-store-eu-west/content/pii:S0926860X22000096/STRIPIN/image/svg+xml/053fb7bef7cf9988925bc26bf05d3982/si0003.svg si0003 si0003.svg svg 7213 ALTIMG 1-s2.0-S0926860X22000096-si0004.svg https://s3-eu-west-1.amazonaws.com/prod-ucs-content-store-eu-west/content/pii:S0926860X22000096/STRIPIN/image/svg+xml/500f68076a480acbe85df5026a5df929/si0004.svg si0004 si0004.svg svg 5734 ALTIMG 1-s2.0-S0926860X22000096-si0005.svg https://s3-eu-west-1.amazonaws.com/prod-ucs-content-store-eu-west/content/pii:S0926860X22000096/STRIPIN/image/svg+xml/daec1ee5f8a292431a2860e5a58e4181/si0005.svg si0005 si0005.svg svg 7261 ALTIMG 1-s2.0-S0926860X22000096-si0006.svg https://s3-eu-west-1.amazonaws.com/prod-ucs-content-store-eu-west/content/pii:S0926860X22000096/STRIPIN/image/svg+xml/48d138fbf9c171ac4d2225c5f9437e51/si0006.svg si0006 si0006.svg svg 4113 ALTIMG 1-s2.0-S0926860X22000096-am.pdf am am.pdf pdf 2013172 AAM-PDF https://s3-eu-west-1.amazonaws.com/prod-ucs-content-store-eu-west/content/egi:10L0JJCP80F/MAIN/application/pdf/2258f656c4f823cc315ff5bb92f95b5a/am.pdf APCATA 118486 118486 S0926-860X(22)00009-6 10.1016/j.apcata.2022.118486 The Authors Fig. 1 Carbon yields of aromatics and gas products versus TOS over fresh H-ZSM-5/Al2O3 catalyst. Reaction conditions: catalyst particle size of 1.2–1.8 mm, catalyst loading of 10 g, catalyst bed temperature of 550 °C, atmospheric pressure, N2 flow of 50 ml min-1, WHSV of co- feeds of 1 h-1, and glycerol/oleic acid weight ratio of 45:55. Fig. 1 Fig. 2 Carbon yields of aromatics and selectivity of the individual BTX components versus TOS over fresh and regenerated H-ZSM-5/Al2O3 catalysts. Reaction conditions: catalyst particle size of 1.2–1.8 mm, catalyst loading of 10 g, catalyst bed temperature of 550 °C, atmospheric pressure, N2 flow of 50 ml min-1, WHSV of co-feeds of 1 h-1, and a glycerol/oleic acid weight ratio of 45:55. Fig. 2 Fig. 3 TG-DTG curves of used H-ZSM-5/Al2O3 catalysts. Fig. 3 Fig. 4 Elemental (Al, Si, and C) maps by TEM-EDX of the used and regenerated H-ZSM-5/Al2O3 catalysts. (The white circle is a hole in the carbon-coated copper grid used for TEM and EDX analyses.). Fig. 4 Fig. 5 XRD patterns of fresh, used, and regenerated H-ZSM-5/Al2O3 catalysts. Fig. 5 Fig. 6 N2 adsorption-desorption isotherms (A), BJH mesopore size distribution (B), and NLDFT micropore size distribution (C) of fresh, used, and regenerated H-ZSM-5/Al2O3 catalysts. Fig. 6 Fig. 7 NH3-TPD profiles of fresh, used, and regenerated H-ZSM-5/Al2O3 catalysts. Fig. 7 Fig. 8 27Al and 29Si MAS ssNMR spectra of fresh, used, and regenerated H-ZSM-5/Al2O3 catalysts. Fig. 8 Table 1 Performance of the fresh and regenerated H-ZSM-5/Al2O3 catalysts. Table 1 Entry Feed Catalyst Peak carbon yield of BTX(C. %) Predicted peak carbon yield of BTX(C. %) a Total BTX productivity(mg g-1 catalyst) Predicted total BTX productivity(mg g-1 catalyst) Catalyst life-time(h) 1 G b Fresh 19.5 (at TOS of 2.0 h) – 426 – 8.5 2 O c Fresh 22.0 (at TOS of 1.5 h) – 739 – 6.5 3 G/O d Fresh 26.7 (at TOS of 1.5 h) 21.3 834 645 11 4 G b Regenerated-1 20.5 (at TOS of 2.0 h) – 580 – 11 5 O c Regenerated-1 25.3 (at TOS of 2.5 h) – 1280 – 11 6 G/O d Regenerated-1 18.9 (at TOS of 3.5 h) 23.9 1260 (for TOS of 12 h) 967 > 12 h 7 G b Regenerated-2 22.5 (at TOS of 2.5 h) – 569 – 9.5 8 O c Regenerated-2 21.8 (at TOS of 1.5 h) – 1925 (for TOS of 12 h) – > 12 h 9 G/O d Regenerated-2 22.8 (at TOS of 3.0 h) 22.0 1488 (for TOS of 12 h) 1315 > 12 h 10 G b Regenerated-3 20.0 (at TOS of 3.5 h) – 439 – 9.5 11 O c Regenerated-3 21.7 (at TOS of 1.5 h) – 1820 (for TOS of 12 h) – > 12 h 12 G/O d Regenerated-3 19.8 (at TOS of 5.0 h) 21.2 1328 (for TOS of 12 h) 1199 > 12 h 13 G b Regenerated-4 19.0 (at TOS of 2.0 h) – 311 – 7 14 O c Regenerated-4 17.8 (at TOS of 2.0 h) – 1630 (for TOS of 12 h) – > 12 h 15 G/O d Regenerated-4 22.1 (at TOS of 5.5 h) 18.2 1505 (for TOS of 12 h) 1037 > 12 h a The predicted data are calculated according to feed composition and the performance data for the individual feeds. The results for experiments with glycerol alone (entries 1, 4, 7, 10, 13) and oleic acid alone (entries 2, 5, 8, 11, 14) are extracted from Refs. [29,30]. See the SI for a calculation example for the predicted peak carbon yield of BTX and the predicted total BTX productivity in Entry 3.) b G: Glycerol, Ref [29]; c O: Oleic acid, Ref [30]; d G/O: Glycerol/Oleic acid (45/55 wt%), this work; Table 2 Characterization of the fresh, used, and regenerated catalysts. Table 2 Entry Feed Catalyst SBET a (m2 g-1) Vpore a (cm3 g-1) NLDFT Vmicropore b (cm3 g-1) Relative crystallinity c (%) Acidity d (μmol pyridine g-1 sample) Acidity e (μmol NH3 g-1 sample) Carbon content f (wt%) Coke content g (wt%) TM of DTG g (°C) Brønsted acid (B) Lewis acid (L) B+L B/L 1 – Fresh 288 0.27 0.27 100 469 215 684 2.2 1051 – – – 2 G h Used-1 27 0.05 0.05 – – – – – 177 19.2 20.5 554 3 O i Used-1 9 0.03 0.02 – – – – – 394 20.7 22.3 538 4 G/O j Used-1 11 0.03 0.04 – – – – – 207 21.5 22.9 553 5 G h Regenerated-1 268 0.28 0.25 98 164 183 347 0.9 635 – – – 6 O i Regenerated-1 265 0.29 0.26 100 266 184 449 1.4 823 – – – 7 G/O j Regenerated-1 262 0.29 0.25 93 235 260 495 0.9 658 – – – 8 G h Used-5 65 0.06 0.06 – – – – – 115 14.9 16.0 587 9 O i Used-7 110 0.09 0.09 – – – – – 166 19.2 20.4 569 10 G/O j Used-5 96 0.1 0.08 – – – – – 163 15.7 16.8 578 11 G h Regenerated-5 232 0.22 0.22 60 45 84 130 0.5 304 – – – 12 O i Regenerated-7 235 0.28 0.26 69 62 134 196 0.5 376 – – – 13 G/O j Regenerated-5 240 0.27 0.22 62 46 76 122 0.6 321 – – – a N2 adsorption-desorption at 77 K, b Ar adsorption-desorption at 87 K, c XRD, d Pyridine-IR, e NH3-TPD, f CHN elemental analysis, g TG-DTG (TM is the temperature reaching a maximum weight loss rate). h G: Glycerol, Ref [29]; i O: Oleic acid, Ref [30]; j G/O: Glycerol/Oleic acid (45/55 wt%), this work. The results for experiments with glycerol alone (entries 1, 4, 7, 10, 13) and oleic acid alone (entries 2, 5, 8, 11, 14) are extracted from Refs. [29,30]. Catalytic co-conversion of glycerol and oleic acid to bio-aromatics: Catalyst deactivation studies for a technical H-ZSM-5/Al2O3 catalyst Songbo He Conceptualization Supervision Validation Writing – review & editing a Frederike Gerda Hiltje Klein Investigation Writing – original draft a Thomas Sjouke Kramer Investigation Writing – original draft a Anshu Chandel Investigation Writing – original draft a Zhuorigebatu Tegudeer Investigation Writing – original draft a André Heeres Conceptualization Supervision Validation Writing – review & editing b Hero Jan Heeres Conceptualization Funding acquisition Supervision Validation Writing – review & editing a ⁎ a Green Chemical Reaction Engineering, Engineering and Technology Institute Groningen, University of Groningen, Nijenborgh 4, 9747 AG Groningen, The Netherlands Green Chemical Reaction Engineering, Engineering and Technology Institute Groningen, University of Groningen Nijenborgh 4 Groningen 9747 AG The Netherlands Green Chemical Reaction Engineering, Engineering and Technology Institute Groningen, University of Groningen, Nijenborgh 4, 9747 AG Groningen, The Netherlands b Hanze University of Applied Sciences, Zernikeplein 11, 9747 AS Groningen, The Netherlands Hanze University of Applied Sciences Zernikeplein 11 Groningen 9747 AS The Netherlands Hanze University of Applied Sciences, Zernikeplein 11, 9747 AS Groningen, The Netherlands ⁎ Corresponding author. The catalytic co-conversion of glycerol and oleic acid (45/55 wt%) to bio-based aromatics (benzene, toluene, and xylenes, bio-BTX) over a technical H-ZSM-5/Al2O3 catalyst in a fixed-bed reactor was investigated with special attention to catalyst deactivation phenomena. The spent catalysts after a time on stream (TOS) of 12 h were regenerated by an ex-situ oxidative treatment to remove coke and reused for another run. In total, 5 reaction-regeneration cycles were performed. The performance and characteristics of the fresh and regenerated catalysts were determined to identify and quantify the effects of co-feeding on catalyst stability and regenerability. The performance of the catalyst changes upon the number of reaction-regeneration cycles. Despite a negative effect on the peak BTX yield, a remarkable improvement in catalyst stability was found, leading to higher BTX productivity (1260–1505 gBTX gcat -1 for the regenerated catalysts during a TOS of 12 h vs. 834 gBTX gcat -1 for the fresh one during a life-time of 11 h). Detailed catalyst characterization studies show irreversible changes in the catalyst structure after reaction-regeneration cycle(s), such as textural property, crystal structure, framework, and acidity, which impact catalyst performance. Graphical Abstract ga1 Keywords Glycerol Oleic acid Bio-aromatics Irreversible deactivation H-ZSM-5/Al2O3 1 Introduction The catalytic conversion of biomass to bio-based aromatics (benzene, toluene, and xylenes, abbreviated as bio-BTX) is an attractive field of research and aims to valorize waste streams and green up the aromatics industry. The effects of the type of biomass (including lignocellulosic biomass and the model compounds), processing options (e.g., gasification, pyrolysis, and hydrolysis), reactor types (e.g., fluidized bed and fixed bed), and type of catalysts (e.g., metal oxides and zeolites) on the yields of BTX have been reported [1]. So far, all processes are at a low technology readiness level (TRL, e.g., of 2–5) with only a few reports on pilot and demo plants [2]. Among them, the catalytic conversion of biomass over H-ZSM-5-based catalyst via either an in-situ or ex-situ mode shows good potential for scale-up, though relatively low bio-BTX yield (e.g., < 30 C.% on a carbon basis) and rapid catalyst deactivation (e.g., life-time of a few hours) [3,4], are still major challenges [5]. The catalytic conversion of biomass to BTX using pyrolysis approach is generally performed at moderate temperatures (e.g., 400–600 °C) in the absence of O2, under which conditions the biomass is converted by several reactions such as deoxygenation (-H2O, -CO2, and -CO), cracking, and condensation to the desired BTX [6]. Examples of biomass feeds showing high potential for the production of bio-based aromatics are crude glycerol (mainly co-produced in biodiesel industry with an estimated global amount in 2020 of ca. 41.9 billion liters [7]), non-edible vegetable oils (including waste cooking oil with an annual production of ca. 16.5 million tons [8]) and others [9–11]. Typically zeolites and particularly H-ZSM-5 are used as catalysts, attributed to the presence of acidic sites (Lewis and Brønsted acidity) and small pores leading to shape selectivity [12]. Modification of H-ZSM-5 with metals has shown to be an effective method to increase the BTX yields (e.g., a 40% yield increase over Ga/ZSM-5 compared to pristine H-ZSM-5 [13]). In addition, it has been shown that the use of co-feeds with high C/Heff numbers [14–27] is an attractive option to increase BTX yields. We have recently reported a synergistic effect on catalyst performance for the conversion of glycerol and various co-feeds (including fatty acids, alcohols, and alkanes) over an H-ZSM-5/Al2O3 (60/40 wt%) catalyst such as an increased peak BTX carbon yield, prolonged catalyst life-time, higher total BTX productivity, and the improved catalyst regenerability [28]. For instance, for glycerol only, a peak BTX yield of 19.5 C.% and a total BTX productivity of 426 mgBTX g-1 catalyst during a life-time of 8.5 h was observed. [29]. Catalyst performance was improved when using oleic acid as the feed, giving a peak BTX yield of 22.8 C.% and a total BTX productivity of 739 mgBTX g-1 catalyst during a life-time of 6.5 h [30]. Remarkably, upon co-feeding glycerol and oleic acid (45/55 wt%), catalyst performance was substantially better than for the individual feeds, and a peak BTX yield of 26.7 C.% and a total BTX productivity of 834 mgBTX g-1 catalyst during catalyst life-time (11 h) was obtained [28]. As such, it is of interest to perform a comprehensive study on the co-feeding of glycerol and oleic acid (45/55 wt%) over a technical H-ZSM-5/Al2O3 catalyst to elucidate the effect of co-feeding on catalyst stability and regenerability, and in particular on the changes of catalyst characteristics after multiple reaction-regeneration cycles. For this purpose, 5 reaction-regeneration cycles were performed and the used and regenerated catalysts were characterized by a variety of analytical techniques. The performance data and the deactivation characteristics are compared with those for the individual feeds (glycerol [29] and oleic acid [30]) using identical experimental and characterization protocols. Such detailed studies have not been reported in the literature. Typically, the reported co-feeding studies with biomass involve studies at mg-g scale in batch set-ups or using analytical instruments (e.g., a pyroprobe) and mass balance data are absent [14–17,19–23,25,26]. Only a few studies have been reported at a slightly larger scale in continuous fixed-bed [18] and fluidized-bed [27] reactors. However, here typically only short time on stream experiments (TOS, e.g., of 3 h [18]) were reported without monitoring catalyst deactivation [31]. Besides, catalyst regeneration/reuse and catalyst performance data after regeneration have not been reported yet. These catalyst performance data and particularly those related to deactivation phenomena are of pivotal importance for the design of reactor and regeneration systems for the catalytic conversion of glycerol and other biomass feeds to BTX in (future) biorefineries [32]. 2 Experimental section 2.1 Materials A granular H-ZSM-5/Al2O3 catalyst (60/40 wt%, ɸ 1.2–1.8 mm, prepared from H-ZSM-5 with a SiO2/Al2O3 molar ratio of 28 and boehmite) was supplied by Yangzhou Baisheng Catalyst Co., Ltd., PR China. The as-received catalyst was calcined at 600 °C (with a ramp of 1 °C min-1) for 8 h in a muffle furnace (LT 9/11/P330, Nabertherm GmbH). This calcined catalyst is denoted as the Fresh catalyst and it was stored in a vacuum desiccator (Bel-Art™ F42400–2141, BEL-ART - SP Scienceware & HB Instruments), which was filled with silica gel (Product No. 11418580, Fisher Scientific Nederlands). Glycerol (> 99.5% purity, s.g. 1.26) was supplied by Boom BV, The Netherlands (product no. 76050770.5000). Oleic acid (> 95% purity) was supplied by Fischer Scientific Netherlands (product no. O/0200/17). n-Nonane, ethanol, and tetrahydrofuran (THF), all of analytical grade, were supplied by Sigma-Aldrich. The gases (e.g., N2, 99.999% purity) and liquid N2 and Ar were supplied by Linde. 2.2 Catalytic co-conversion of glycerol/oleic acid The catalytic co-conversion of glycerol and oleic acid (45/55 wt%) was performed in a continuous fixed-bed reactor (Fig. S1), which has been designed and optimized for catalytic conversion of glycerol [29]. The as-received glycerol (4.5 g h-1) and oleic acid (5.5 g h-1) were fed separately to the unit using syringe pumps (NE-1010, Prosense B.V.) in combination with 100-ml gastight syringes (Hamilton, part no. 86020). The preheaters were filled with quartz wool (VWR international, Part No. BEHRB00027716) and maintained at 300 (for glycerol) and 350 °C (for oleic acid). N2 gas (25 ml min-1 each) was used as the carrier gas to transfer both the glycerol and oleic acid to a filter/mixer and subsequently to the catalytic reactor, which was loaded with 10 g of fresh catalyst and maintained at 550 °C. The reaction was performed at atmospheric pressure for a TOS of 12 h. After leaving the reactor, the vapors were sent to a 3-stage condensation-separation system and the liquid product was collected for a period of 30 min. After 30 min, the collected liquid was removed, during which the vapors exiting the reactor were sent to a second 3-stage condensation-separation system. This sequence was repeated every 30 min 2.3 Product analysis The liquid products after reaction were biphasic (organic and water layer, Fig. S2) and were mixed with a stock solution consisting of ca. 2 x 104 ppm of n-nonane in ethanol/THF (10/90 vol%) to obtain a homogeneous sample. A GC-MS (6890/5973, Hewlett-Packard) and a dedicated GC-FID (5890, Hewlett-Packard) equipped with the same Rtx-1701 column (30 m × 0.25 mm × 0.25 µm, Restek) were used to qualify and quantify the components in the samples. For the latter, the relative response factors of the individual aromatics to n-nonane were applied. The C, H, and O amounts in the samples were analyzed using an elemental analyzer (EuroEA3000, Eurovector). The content of H2O in the samples was determined using a Karl-Fischer titration with a potentiometric titrator (702 SM Titrino, Metrohm). The gaseous products were collected in 5-L FlexFoil Plus sample bags (supplied by SKC Ltd., part no. 207104) and analyzed using a dedicated GC-TCD (5890, Hewlett-Packard) equipped with a CP-PoraBOND Q column (50 m × 0.53 mm × 10 µm, Varian) and an HP-Molsieve column (30 m x 0.53 mm x 50 µm, Agilent). Before and after analyses, the GC-TCD was calibrated with a standard gas mixture (supplied by Westfalen AG, product no. G322243). The product yield and the individual BTX selectivity (both on a carbon basis), and the total BTX productivity were calculated using Eqs. (1) – (3). The catalyst life-time is defined as the TOS when the carbon yield of BTX is < 1 C.% [28,33]. The predicted performance data (peak carbon yield of BTX and total BTX productivity) for the catalytic co-conversion of glycerol and oleic acid (45/55 wt%) are based on the carbon fractions of the individual feeds (glycerol of 30% and oleic acid of 70%) and catalyst performance for the individual feeds (extracted from Refs. [29,30]) using Eq. (4). The turnover number (TON) was calculated using Eq. (5) [29,33]. (1) Yield ( C . % ) = mol of carbon in the individual product mol of carbon in the co - feed × 100 (2) BTX selectivity ( % ) = mol of individual BTX component mol of total BTX product × 100 (3) Total BTX productivity ( mg BTX g catalyst − 1 ) = gram of BTX produced gram of catalyst loaded in the reactor (4) Predicted performance data = 0.3 × experimental performance data for glycerol + 0.7 × experimental performance data for oleic acid (5) TON ( mol BTX mol acid site − 1 ) = total BTX production at a specific TOS Brønsted acid sites according to Pyridine IR analysis 2.4 Reaction-regeneration cycles After the reaction, the reactor was cooled to room temperature under an N2 flow (50 ml min-1) and the used catalyst (denoted as Used-i catalyst, in which i represents the number of reaction-regeneration cycles) was unloaded from the reactor followed by an ex-situ oxidative regeneration in a muffle furnace (same as for catalyst calcination). The used catalyst was placed in a Haldenwanger porcelain crucible (90-ml, supplied by Fisher Scientific Nederlands, product no. 10493081) and was heated to 680 °C (1 °C min-1) under air. The regeneration lasted for 12 h and the regenerated catalyst was denoted as the Regenerated-i catalyst. The regenerated catalyst was placed in the reactor and reused using the same protocol as for the fresh catalyst (vide supra). In total, 5 cycles of reaction-regeneration were performed. 2.5 Catalyst characterization All the fresh, used, and regenerated catalysts were ground into homogeneous powdery samples (< 40 µm) using an agate mortar and pestle (IDL GmbH & Co. KG) before characterization. The same protocols used for the characterizations of the used and regenerated catalysts for catalytic conversion of glycerol [29] and oleic acid [30] were applied (vide infra). Physisorption experiments with N2 (at 77 K) and Ar (at 87 K) were performed on an ASAP 2420 (Micromeritics). The sample was degassed at 450 °C for 4 h before the analysis. The Brunauer-Emmett-Teller (BET) method [34] was applied to calculate the specific surface area (SBET). The total pore volume (Vpore) was estimated by a single point N2 desorption at P/P0 of 0.98. The Barrett-Joyner-Halenda (BJH) method [35] was applied to calculate the mesopore size distribution (meso-PSD) and mesopore volume (Vmesopore) from the N2 isotherms. Non-Localized Density Functional Theory (NLDFT [36]) was applied to calculate the micropore size distribution (micro-PSD) and micropore volume (Vmicropore) from the Ar isotherms. Powder X-ray diffraction (XRD) analysis was conducted on a D8 Advance Powder Diffractometer (Bruker, Germany), which was operated at 40 kV and 40 mA and with Cu Kα radiation (λ = 1.5418 Å). XRD spectra were recorded using an LYNXEYE detector (1D mode). The relative crystallinity of the catalyst was calculated according to an ASTM D5758–01 method (Eq. (6)), in which the height (H) of the diffraction peak at 2θ of 24.37° for the sample was compared with that for the Fresh catalyst. (6) Relative crystallinity ( % ) = H catalyst H fresh catalyst × 100 Transmission electron microscopy (TEM) images were taken on a Tecnai T20 Transmission Electron Microscope (FEI) equipped with a Gatan 626 cryo-stage working at 200 keV. Energy Dispersive X-ray (EDX) analysis was carried out using an X-Max T80 SDD EDX Detector (Oxford). The sample was dispersed in ethanol under ultrasonication followed by deposition on a carbon-coated copper grid. Magic angle spinning solid-state nuclear magnetic resonance (MAS ssNMR) analysis was performed on an AV-I 750 MHz spectrometer (Bruker) with a magnetic field of 17.6 Tesla and a MAS rate of 54.74 kHz. The sample in the rotor was scanned 1024 times. The chemical shifts of Al(NO3)3 and tetramethylsilane (TMS) were used as the reference for 27Al and 29Si MAS ssNMR spectra, respectively. Temperature-programmed desorption of ammonia (NH3-TPD) was performed on an AutoChem II (Micromeritic). The sample was pretreated at 550 °C under He (50 ml min-1) for 1 h followed by cooling to 100 °C to adsorb NH3 by flowing NH3/He (1.0 vol%, 50 ml min-1) for 1 h and purging by flowing He (50 ml min-1) for 1 h. A calibrated TCD was used to detect the desorbed NH3. Pyridine-IR analysis was performed on a Nicolet 6700 FTIR Spectrometer. The pressed sample pellets (ca. 50 mg, φ 10 mm) were loaded into a tailor-made cell and pretreated under vacuum (< 10-3 bar) at 400 °C for 4 h followed by the adsorption of a saturated pyridine vapor at 25 °C. After the evacuation at 160 °C for 30 min, the Pyridine-IR spectrum was recorded. Thermogravimetric analysis (TGA) was conducted on a TGA 4000 (PerkinElmer). The sample was loaded into a ceramic crucible, which was heated from 50 °C to 800 °C (10 °C min-1) under synthetic air (50 ml min-1). As a reference, the empty crucible was also measured using the same protocol. Elemental analyses were carried out on a EuroEA3000 Elemental Analyzer (Eurovector). Sulfanilamide (supplied by Elemental Microanalysis Ltd.) was used as the reference. The analyses were performed in duplicate and the average data are reported. Oxygen content is by difference. 3 Results and discussions 3.1 Fresh catalyst performance The catalytic co-conversion of glycerol/oleic acid (45/55 wt%) was performed in a fixed-bed reactor at 550 °C, H-ZSM-5/Al2O3 (60/40 wt%), a catalyst loading of 10 g, and a WHSV of the co-feeds of 1 h-1 [29,30]. At a short TOS (e.g., of 1.5 h), the major liquid products detectable by GC-MS are aromatics such as BTX and polycyclic aromatic hydrocarbons (Fig. S3). At a prolonged TOS (e.g., 12 h), the major liquid products are oxygenates (e.g., acetaldehyde and hydroxyacetone), alkanes/alkenes (e.g., octadecane and dodecene), and unconverted co-feeds (Fig. S4). These changes in product distribution upon prolonged TOS indicate that the H-ZSM-5/Al2O3 catalyst becomes inactive with TOS for aromatics formation, mainly due to coke formation on the catalyst surface (vide infra). To monitor catalyst deactivation, the carbon yields of the major aromatics and gas products versus TOS are shown in Fig. 1. The yields of BTX (Fig. 1-a) and the other major aromatics (Fig. 1-b) increase with TOS in the initial stage of the reaction, which is likely related to the start-up of the reactor. The aromatics yield reaches a maximum value of 31.2 C.% (BTX yield of 26.7 C.%) at a TOS of 2 h and afterward gradually decreases, e.g., to a value below 1.4 C.% at a TOS of 11 h. Similarly, the carbon yields of C1 - C3 products show volcano-shape curves (e.g., a peak propane yield of 5.9 C.% at TOS of 3 h, Fig. 1-d). However, the yields of CO and CO2 are rather stable after a TOS of 2 h (ca. 3.1 C.% and 1.4 C.%, Fig. 1-c). These results indicate that after a long TOS, the H-ZSM-5/Al2O3 catalyst is considerably deactivated for aromatization and cracking while deactivation levels for decarbonylation and decarboxylation (forming CO and CO2) are by far less prominent. Due to catalyst deactivation, the cumulative aromatics yield after 11 h of TOS is rather low (ca. 12.8 C.%, Fig. S5-B) (Fig. 1 and Table 1, Entry 3). Besides the targeted aromatics, carbon also ends up in CO (yield of ca. 4.5 C.%), CO2 (yield of ca. 1.8 C.%), gaseous C1-C3 hydrocarbons (yield of ca. 22.8 C.%), and other organic products in the liquid phase (yield of ca. 54.8 C.%) (Fig. S5-B). Besides, the total BTX productivity of ca. 834 mg g-1 catalyst (Table 1, Entry 3) is also rather low considering performance metrics established for sustainable catalysts in (bio-)refineries (e.g., > 1 kgproduct g-1 catalyst) [32]. As such, catalyst regeneration and recycle are inevitable to meet these catalyst performance criteria. For this purpose, the used H-ZSM-5/Al2O3 catalyst was regenerated by an oxidative treatment, followed by recycling to the reactor to assess the potential for catalyst regenerability. In total, 5 reaction-regeneration cycles were performed and the results are shown in Table 1. 3.2 Five reaction-regeneration cycles A standard ex-situ oxidative protocol (heating to 680 °C at a ramp rate of 1 °C min-1 under air followed by oxidation at 680 °C for 12 h and cooling to room temperature at a ramp rate of −1 °C min-1 in an oven) was used to regenerate the catalyst after TOS [29,30]. After the ex-situ oxidative treatment, the regenerated catalyst was evaluated for glycerol-oleic acid co-feeding by following the same protocol as used for testing the fresh catalyst. Similar to the Fresh catalyst, the regenerated catalysts show volcano-shaped BTX carbon yield curves ( Fig. 2-top). Of interest is the slightly lower peak BTX yield (of 18.9 C.%, Fig. 2-top and Table 1, Entry 6) or the Regenerated-1 catalyst, indicating some changes in the catalyst structure after one cycle of reaction-regeneration. However, it is remarkable to observe that the Regenerated-1 catalyst has a significantly improved catalyst stability compared to Fresh catalyst (Fig. 2-top), showing a catalyst life-time exceeding 12 h (Fig. 2-top, Table 1, Entry 6). As a result, the Regenerated-1 catalyst shows a by far higher total BTX productivity of > 1260 mg g-1 catalyst (Table 1, Entry 6) compared to Fresh catalyst. Besides, the regenerated catalysts after 2–4 times of regeneration do not show a further reduction in peak BTX yield (19.8–22.8 C.%, Fig. 2-top, Table 1, Entries 9, 12, and 15) compared to Regenerated-1 catalyst. The total BTX productivity for a TOS of 12 h of the regenerated catalysts after 2–4 times of regeneration (1328–1505 mg g-1 catalyst, Table 1, Entries 9, 12, and 15) are also comparable to that of Regenerated-1 catalyst. These results suggest that beyond 1–2 reaction-regeneration cycles, the H-ZSM-5/Al2O3 catalyst reaches a steady-state regarding catalyst performance, indicating a good potential for multiple catalyst regeneration cycles beyond 5. The selectivity of the individual BTX components over Regenerated-1 catalyst differs from that over the fresh catalyst, in particular in the initial stage of the reaction (TOS of 0–5 h, Fig. 2-bottom). The selectivity of m,p-xylene is increased at the expense of benzene. These selectivity changes are most likely associated with changes in the catalyst structure (e.g., acidity) upon regeneration (vide infra). Of interest is the observation that the selectivity of the individual BTX components for regenerated catalyst after 2–4 times of regeneration are comparable with those over Regenerated-1 catalyst, confirming a steady-state in catalyst performance for the regenerated catalysts after multiple reaction-regeneration cycles. To determine the changes in catalyst structure after regeneration and to obtain catalyst structure-performance relations, the used and regenerated catalysts after the 1st and 5th reaction-regeneration were characterized in detail. 3.3 Changes in catalyst characteristics upon reaction-regeneration cycle(s) 3.3.1 Coke formation Visual inspection of the catalyst after a continuous run for a TOS of 12 h, showed that the catalyst color changed from off-white to black, most likely due to coking [37,38]. This was confirmed by TGA and elemental analyses of the spent catalyst. After the 1st reaction, about 22.9 wt% of coke (by TGA, Fig. 3-top-a, Table 2, Entry 4) or 21.5 wt% of carbon (by elemental analysis, Table 2, Entry 4) was present on Used-1 catalyst. This high amount of coke was also reported for experiments with either glycerol [11,33,39,40] or oleic acid [30]. Of interest is the observation that the coke yield (ca. 3.3 C.% on a carbon basis, Fig. S5-B) is considerably lower than for the conversion of glycerol alone (6.2 C.%, Fig. S15-B) and oleic acid (4.2 C.%, Fig. S16-B). Thus, the co-conversion of glycerol and oleic acid leads to a considerable lowering of the coke yield. TEM-EDX imaging was used to determine the location of the coke on the catalyst. It appears that the coke is non-uniformly distributed in Used-1 catalyst ( Figs. 4-a and S6). This is likely due to the presence of larger amounts of coke in the mesoporous Al2O3 binder structure than in the microporous H-ZSM-5 component [29]. The DTG curve of the Used-1 catalyst (Fig. 3-bottom-a) shows that a relatively high temperature (ca. 553 °C, Table 2) is required to obtain a maximum weight loss rate (TM) for coke combustion, indicating that the coke may be classified as hard. This hard coke likely consists of poly-condensed aromatics and dienes, which are formed at elevated temperatures and long reaction times [41]. This high TM value is comparable to that for the spent catalyst after the conversion of pure glycerol (ca. 554 °C, Table 2) [29] but considerably higher than that for the spent catalyst after the conversion of pure oleic acid (ca. 538 °C, Table 2) [30]. This indicates that the coke on the used catalyst is harder after the conversion of glycerol-containing feed than after the conversion of solely oleic acid. XRD pattern of the Used-1 catalyst shows two diffraction peaks (∇) at 2θ = 23.2 and 45.3 for Used-1 catalyst ( Fig. 5-b), corresponding to a graphitic coke structure [38]. This graphitic coke was also observed on the spent H-ZSM-5/Al2O3 catalysts after the conversion of either pure glycerol [29,42] or oleic acid [30]. According to the TG and DTG curves, the coke on the Used-1 catalyst needs a high temperature, e.g., > 700 °C for complete removal by an oxidation treatment. The regeneration temperature of 680 °C in combination with the extended regeneration time (12 h) used in this study [29,30,33] allows removal of the majority of the coke (ca. 95%), with ca. 1.1 wt% of carbon on Regenerated-1 catalyst remaining (TEM-EDX analysis, Figs. 4-c and S7). Similarly, the coke formed on the Used-5 catalyst is also not uniformly distributed with more coke on the outer layer of the catalyst (Figs. 4-b and S8). Compared to Used-1 catalyst, Used-5 catalyst has less coke deposition, as is evident from TGA (16.8 wt%, Fig. 3-top-a) and elemental analysis (carbon content of 15.7 wt%, Table 1, Entry 10). However, the TM for the coke on Used-5 catalyst (578 °C, Fig. 3-bottom-b) is considerably higher than that of the Used-1 catalyst (553 °C, Fig. 3-bottom-a). This indicates that the coke becomes harder with more reaction-regeneration cycles, likely due to successive reactions (e.g., dehydrogenation) of the remaining coke after each regeneration step. Coke affects the textural properties of the catalysts [43]. For instance, the micropore volume is reduced by 85% (Used-1 versus Fresh, Table 2, Entries 4 and 10) and the acidity [44] is also reduced by 80% for Used-1 (Table 2, Entries 4 and 10). These reductions in catalyst characteristics result in the loss of the catalyst activity for the BTX production after a few hours’ continuous run (Fig. 2). Coke formation though may be considered as reversible catalyst deactivation, as the oxidative regeneration protocols appear to be rather effective to remove the coke, showing very small amount of coke residue (ca. 0.9–1.1 wt% of carbon, Fig. 4-c and -d) on the Regenerated-1 and Regenerated-5 catalysts. 3.3.2 Irreversible changes in catalyst characteristics upon reaction-regeneration cycle(s) The catalyst performance of the regenerated catalysts, particularly the first regeneration cycle, (e.g., peak carbon yield of BTX and catalyst life-time, Table 1), is different from that of the fresh one, indicating irreversible changes in the catalyst structure [11,30,33]. To determine these changes, the regenerated catalysts after 1 and 5 times of regeneration were characterized and the characteristics of the regenerated catalysts were compared with those of the fresh catalyst. The Regenerated-1 and Regenerated-5 catalysts show similar N2 adsorption-desorption isotherms (a combined Type-I and -IV isotherms [45]), BJH mesopore size distributions (in a range of 3–10 nm, related to the mesopores of the Al2O3 binder [29]), and NLDFT micropore size distributions (centered at ca. 0.52 nm, related to the micropores of the H-ZSM-5 zeolite [29,33]), compared to the Fresh catalyst ( Fig. 6-c and -e vs. -a). Nevertheless, important textural properties such as the specific surface area (ca. 7–9%) and the NLDFT micropore volume (17–19%), are reduced for the Regenerated-1 and Regenerated-5 catalysts when compared with the Fresh catalyst (Table 2, Entries 7 and 13). The XRD patterns of the Regenerated-1 and Regenerated-5 catalysts show two relevant peaks (♥) at 2θ = ca. 7.9° and 8.9°, corresponding to the [011] and [200] planes of the H-ZSM-5 zeolite [46]). These are also present in the Fresh catalyst (Fig. 5-c and -e vs. -a). The diffraction peaks (∇) at 2θ = 23.2 and 45.3 from crystalline coke are not present in the two regenerated catalysts, indicating that the oxidative treatment leads to the removal of most of the graphite-like coke. Nevertheless, the relative crystallinity for the Regenerated catalysts is considerably lower than the fresh catalyst (ca. 7% lower for Regenerated-1% and 38% for Regenerated-5 catalysts (Table 2, Entries 7 and 13). These data also imply that successive reaction-regeneration cycles lead to further reductions in crystallinity. The NH3-TPD profiles of the Regenerated-1 and Regenerated-5 catalysts show a broad acid distribution (100–550 °C, Fig. -c and -e). The low-temperature peak (centered at ca. 205 °C) reflects the weak acid sites, whereas the high-temperature peak (a shoulder at ca. 370–380 °C) is indicative of the presence of strong acid sites of the catalysts [47]. Compared to the Fresh catalyst ( Fig. 7-a), the regenerated catalyst, in particular the Regenerated-5 catalyst, shows a considerably reduced number of strong acid sites. This is in good accordance with the pyridine-IR spectra of the catalysts (Fig. S10-bottom), showing a significant reduction in the intensity of the peak at ca. 1545 cm−1, which corresponds to the protonated pyridine on the Brønsted acid sites [48]. As such, the total catalyst acidity (according to NH3-TPD) is decreased with ca. 37% for Regenerated-1% and 69% for the Regenerated-5 catalyst (Table 2, Entries 7 and 13). The decrease in the Brønsted acid sites is by far more pronounced compared to the reduction in Lewis acid sites (e.g., 90% vs. 65% on the Regenerated-5 catalyst, Table 2, Entry 13), leading to a lower molar ratio of the Brønsted acidity/Lewis acidity upon prolonged reaction-regeneration cycles (Table 2, Entries 7 and 13). Compared to the Fresh catalyst, the decrease in Brønsted acidity on the Regenerated-1 catalyst leads to a lower peak BTX yield (18.9 C.% vs. 26.7 C.%, Table 1, Entry 6 vs. 3). However, the turnover number (TON) of the Regenerated-1 catalyst is considerably higher than that of the Fresh one (57.2 vs. 19.4 moltotal BTX molacid site -1). This increase in TON for the regenerated catalyst has been reported before [11,29], and is likely related to the excess of acidic sites on the catalyst at the start of the reaction, which are not all necessary for aromatics formation [11,29,38]. Whereas Brønsted acidic sites are involved in aromatization of intermediates, it is very likely that Lewis acid sites participate heavily in the first steps of the reaction network, namely the deoxygenation of glycerol to C1 (e.g., formaldehyde), C2 (e.g., acetaldehyde), and C3 (e.g., acrolein) oxygenates [33], and deoxygenation of oleic acid to alkenes [30]. This hypothesis is supported by the observed product distribution at longer TOS, where BTX is absent but glycerol conversion is still significant. Thus, Brønsted acid sites are most likely not accessible anymore for catalysis whereas considerable amounts of Lewis acid sites are present [30,33]. These remaining Lewis acid sites are thus responsible for the first step conversion and the formation of the deoxygenated products. Long-time exposure of the zeolitic catalyst at harsh reaction conditions (e.g., a relatively high temperature in combination with steam) during the reaction-regeneration cycle(s) is expected to lead to dealumination of the H-ZSM-5 framework [49,50]. This is indeed confirmed by the 29Si MAS ssNMR data ( Fig. 8-B) for the regenerated catalysts, showing a decrease in the intensity of the weak shoulder peak at δ = ca. − 106 ppm (assigned to the Si(3Si, 1Al) species in the H-ZSM-5 framework [51]). This is evident for the Regenerated-1 (Fig. 8-B-c) and particularly for the Regenerated-5 (Fig. 8-B-d) catalyst when the height of the Si(4Si, 0Al) resonance (at δ = ca. −113 ppm) is plotted at the same level. Thus, we can conclude that the catalyst structure changes during reaction-regeneration cycles. Some of these changes e.g., reduction in micropores and Brønsted acidity are expected to have a negative effect on the peak BTX carbon yield. Indeed, this is observed experimentally and implies that these properties are, essential for the catalytic conversion of glycerol to aromatics [33,38]. However, and remarkably, these changes in catalyst characteristics seem beneficial when considering coke formation. The coke rate seems to be reduced (e.g., a carbon content of 21.5 wt% on the Used-1 catalyst vs. 15.7 wt% on the Used-5 catalyst after TOS of 12 h, Table 2, Entry 4 vs. 10), which is likely related to a reduction in strong acid sites, that are known to be involved in coking processes. Besides, these changes in catalyst characteristics (in particular the reduction in acidity) may also inhibit side reactions (e.g., dealkylation of the produced aromatics), leading to a lower benzene selectivity and a higher m,p-xylene selectivity for the 1st reaction vs. the 5th reaction (Fig. 2-bottom). This is likely related to a reduced and deactivated ‘induction zone’ at the exit of the catalyst bed, in which a further conversion of the products formed in the ‘conversion zone’ leads to changes in the product selectivity [37]. Based on these results, we can conclude that changes in relevant catalyst properties (acidity, crystallinity dealumination) do occur upon regeneration/reuse but do not lead to deterioration of catalyst performance (Fig. 2 and Table 1) [30]. 3.4 Catalytic co-feeding versus performance of the individual feeds It is of interest to compare catalyst performance (Table 1) and irreversible changes in the catalyst structure (Table 2) for the co-feeding experiments with glycerol/oleic acid (45/55 wt%, this work) and the experiments for the individual feeds (glycerol [29] and oleic acid [30]). The catalyst performance data are compiled in Table 1. Here, the predicted values for the co-feeding experiments are calculated using the co-feed ratio and performance data for the individual feeds. Of high interest is the observation that important catalyst performance metrics when using fresh catalysts, such as the peak BTX yield and the total BTX productivity, are considerably higher for the co-feeding experiment than for experiments with the individual feed (Table 1, Entry 3 vs. 1 and 2). Of interest is also the observation that the experimental peak BTX yield and the total BTX productivity for the co-feeding experiments are higher than predicted based on the performance of the individual feeds. As such, these results imply the presence of a synergistic effect [15–17,19–26] between glycerol and oleic acid on catalyst performance. In addition, also catalyst stability is improved for the co-feeding experiments compared with those with individual feeds. For instance, the catalyst life-time is significantly prolonged (from 8.5 for glycerol alone and 6.5 h for oleic acid alone) to 11 h for the co-feeding experiments using a fresh catalyst (Table 1, Entry 3 vs. 1 and 2). Catalyst life-times for the co-feeding experiments using the regenerated catalysts were all longer than 12 h. The exact values could not be determined due to constraints regarding safety in our laboratory, not allowing experiments at TOS beyond 12 h. As such, it is clear that the BTX productivities during a TOS of 12 h over the regenerated catalysts for the catalytic co-feeding experiments are higher than the predicted values (Table 1, Entries 6, 9, 12, and 15), indicating that the regenerability of the catalyst is even improved upon co-feeding. The catalyst characterization data are shown in Table 2. In general, the specific surface area, pore volume (total pore volume and micropore volume), relative crystallinity, acidity (total acidity, Brønsted acidity, and Lewis acidity), and coke (content and TM of DTG) for the regenerated catalysts after 1 and 5 cycles for co-feeding experiments (Table 2, Entries 7 and 13) are in the range for experiments with individual feeds (glycerol: Table 2, Entries 5 and 11 and oleic acid: Table 2, Entries 6 and 12). These results stress that there are no additional irreversible changes in catalyst characteristics upon co-feeding. 4 Conclusions Catalyst performance and catalyst deactivation characteristics for the co-feeding of glycerol and oleic acid to BTX have been determined. Clear changes in catalyst characteristics are observed after 1 and 5 reaction-regeneration cycles, including a decrease in the specific surface area (7–9%), the NLDFT micropore volume (17–19%), relative crystallinity (7–38%), total acidity (37–69%), and dealumination of the H-ZSM-5 framework. These irreversible changes in catalyst characteristics have a negative effect on the peak BTX carbon yield (26.7 C.% vs. 18.9–22.8 C.%) though a very positive effect on prolonging the catalyst life-time (> 12 h vs. 11 h) leading to a considerably higher total BTX productivity (1260–1505 mgBTX g-1 catalyst during a TOS of 12 h) of the regenerated catalysts, compared with those of the fresh one (834 mgBTX g-1 catalyst during a life-time of 11 h). The catalyst recycling results indicate that catalyst regeneration and reuse appear possible, though the number of reaction-regeneration cycles used in this study is still limited to 5. In this respect, future testing with a large number of recycles, e.g., using an FCC-type unit with continuous reaction and catalyst regeneration will be required and these studies are in progress. CRediT authorship contribution statement Frederike Gerda Hiltje Klein, Thomas Sjouke Kramer, Anshu Chandel, and Zhuorigebatu Tegudeer: Investigation, Writing – original draft. Songbo He and André Heeres: Conceptualization, Supervision, Validation, Writing – review & editing. H.J. Heeres: Conceptualization, Funding acquisition, Supervision, Validation, Writing – review & editing. Declaration of Competing Interest The authors declare that they have no known competing financial interests or personal relationships that could have appeared to influence the work reported in this paper. Acknowledgments The Nederlandse Organisatie voor Wetenschappelijk Onderzoek (NWO) is acknowledged for financial support (NWO-LIFT programme, Grant No. 731.016.401). We are also very grateful for BIOBTX B.V. for the collaboration and valuable discusions. Dr. K.S.S. Gupta from the NMR Facility at Leiden University, Dr. M.C.A. Stuart from the Electron Microscopy Facility at the University of Groningen, and J. van Dijken from the Zernike Institute for Advanced Materials of the University of Groningen are acknowledged for their assistance and interpretation of MAS ssNMR, HR-TEM-EDX, and TG-DTG analyses, respectively. Appendix A Supporting information Supplementary data associated with this article can be found in the online version at doi:10.1016/j.apcata.2022.118486. Appendix A Supplementary material Supplementary material . References [1] K. Yan H. Li Energy Fuels 35 2021 45 62 10.1021/acs.energyfuels.0c03174 K. Yan, H. Li, State of the art and perspectives in catalytic conversion mechanism of biomass to bio-aromatics, Energy Fuels 35 (2021) 45–62. https://doi.org/10.1021/acs.energyfuels.0c03174. [2] C.M. Lok J. Van Doorn G.A. Almansa Renew. Sustain. Energy Rev. 113 2019 1 11 10.1016/j.rser.2019.109248 (Article number 109248) C.M. Lok, J. Van Doorn, G.A. Almansa, Promoted ZSM-5 catalysts for the production of bio-aromatics, a review, Renew. Sust. Energ. Rev. 113 (2019) Article number 109248, 1–11. https://doi.org/10.1016/j.rser.2019.109248. [3] P.S. Rezaei H. Shafaghat W. Daud Appl. Catal. A 469 2014 490 511 10.1016/j.apcata.2013.09.036 P.S. Rezaei, H. Shafaghat, W. Daud, Production of green aromatics and olefins by catalytic cracking of oxygenate compounds derived from biomass pyrolysis: A review, Appl. Catal., A 469 (2014) 490–511. https://doi.org/10.1016/j.apcata.2013.09.036. [4] V. Balasundram N. Ibrahim R.M. Kasmani R. Isha M.K. Abd Hamid H. Hasbullah Biomass Convers. Biorefin. 2020 10.1007/s13399-020-00909-5 V. Balasundram, N. Ibrahim, R.M. Kasmani, R. Isha, M.K. Abd Hamid, H. Hasbullah, Catalytic upgrading of biomass-derived pyrolysis vapour over metal-modified HZSM-5 into BTX: a comprehensive review, Biomass Convers. Biorefin. (2020). https://doi.org/10.1007/s13399–020-00909–5. [5] H.Y. Zhang Y.T. Cheng T.P. Vispute R. Xiao G.W. Huber Energy Environ. Sci. 4 2011 2297 2307 10.1039/c1ee01230d H.Y. Zhang, Y.T. Cheng, T.P. Vispute, R. Xiao, G.W. Huber, Catalytic conversion of biomass-derived feedstocks into olefins and aromatics with ZSM-5: the hydrogen to carbon effective ratio, Energy Environ. Sci. 4 (2011) 2297–2307. https://doi.org/10.1039/c1ee01230d. [6] C.J. Liu H.M. Wang A.M. Karim J.M. Sun Y. Wang Chem. Soc. Rev. 43 2014 7594 7623 10.1039/c3cs60414d C.J. Liu, H.M. Wang, A.M. Karim, J.M. Sun, Y. Wang, Catalytic fast pyrolysis of lignocellulosic biomass, Chem. Soc. Rev. 43 (2014) 7594–7623. https://doi.org/10.1039/c3cs60414d. [7] M.R. Monteiro C.L. Kugelmeier R.S. Pinheiro M.O. Batalha A.D. Cesar Renew. Sustain. Energy Rev. 88 2018 109 122 10.1016/j.rser.2018.02.019 M.R. Monteiro, C.L. Kugelmeier, R.S. Pinheiro, M.O. Batalha, A.D. Cesar, Glycerol from biodiesel production: Technological paths for sustainability, Renew. Sust. Energ. Rev. 88 (2018) 109–122. https://doi.org/10.1016/j.rser.2018.02.019. [8] M.R. Khodadadi I. Malpartida C.W. Tsang C.S.K. Lin C. Len Mol. Catal. 494 2020 10.1016/j.mcat.2020.111128 M.R. Khodadadi, I. Malpartida, C.W. Tsang, C.S.K. Lin, C. Len, Recent advances on the catalytic conversion of waste cooking oil, Mol. Catal. 494 (2020). https://doi.org/10.1016/j.mcat.2020.111128. [9] A.E. Atabani A.S. Silitonga H.C. Ong T.M.I. Mahlia H.H. Masjuki I.A. Badruddin H. Fayaz Renew. Sustain. Energy Rev. 18 2013 211 245 10.1016/j.rser.2012.10.013 A.E. Atabani, A.S. Silitonga, H.C. Ong, T.M.I. Mahlia, H.H. Masjuki, I.A. Badruddin, H. Fayaz, Non-edible vegetable oils: A critical evaluation of oil extraction, fatty acid compositions, biodiesel production, characteristics, engine performance and emissions production, Renew. Sust. Energ. Rev. 18 (2013) 211–245. https://doi.org/10.1016/j.rser.2012.10.013. [10] P. Bielansky A. Weinert C. Schonberger A. Reichhold Fuel Process. Technol. 92 2011 2305 2311 10.1016/j.fuproc.2011.07.021 P. Bielansky, A. Weinert, C. Schonberger, A. Reichhold, Catalytic conversion of vegetable oils in a continuous FCC pilot plant, Fuel Process. Technol. 92 (2011) 2305–2311. https://doi.org/10.1016/j.fuproc.2011.07.021. [11] S. He I. Muizebelt A. Heeres N.J. Schenk R. Blees H.J. Heeres Appl. Catal. B 235 2018 45 55 10.1016/j.apcatb.2018.04.047 S. He, I. Muizebelt, A. Heeres, N.J. Schenk, R. Blees, H.J. Heeres, Catalytic pyrolysis of crude glycerol over shaped ZSM-5/bentonite catalysts for bio-BTX synthesis, Appl. Catal., B 235 (2018) 45–55. https://doi.org/10.1016/j.apcatb.2018.04.047. [12] Nishu R.H. Liu M.M. Rahman M. Sarker M.Y. Chai C. Li J.M. Cai Fuel Process. Technol. 199 2020 10.1016/j.fuproc.2019.106301 Nishu, R.H. Liu, M.M. Rahman, M. Sarker, M.Y. Chai, C. Li, J.M. Cai, A review on the catalytic pyrolysis of biomass for the bio-oil production with ZSM-5: Focus on structure, Fuel Process. Technol. 199 (2020). https://doi.org/10.1016/j.fuproc.2019.106301. [13] Y.T. Cheng J. Jae J. Shi W. Fan G.W. Huber Angew. Chem. Int. Ed. 51 2012 1387 1390 10.1002/anie.201107390 Y.T. Cheng, J. Jae, J. Shi, W. Fan, G.W. Huber, Production of renewable aromatic compounds by catalytic fast pyrolysis of lignocellulosic biomass with bifunctional Ga/ZSM-5 catalysts, Angew. Chem., Int. Ed. 51 (2012) 1387–1390. https://doi.org/10.1002/anie.201107390. [14] F. Wang Y.W. Zheng Q.L. Zhai F. Long C. Liu Y.B. Huang Z.F. Zheng J.C. Jiang Int. J. Hydrog. Energy 45 2020 26929 26937 10.1016/j.ijhydene.2020.05.235 F. Wang, Y.W. Zheng, Q.L. Zhai, F. Long, C. Liu, Y.B. Huang, Z.F. Zheng, J.C. Jiang, Catalytic co-pyrolysis of Yunnan pine and hydrogen donor over desilicated ZSM-5 for light aromatics, Int. J. Hydrogen Energy 45 (2020) 26929–26937. https://doi.org/10.1016/j.ijhydene.2020.05.235. [15] W.J. Chen J.F. Lu C.S. Zhang Y.Y. Xie Y.H. Wang J. Wang R.Q. Zhang J. Anal. Appl. Pyrolysis 147 2020 10.1016/j.jaap.2020.104800 W.J. Chen, J.F. Lu, C.S. Zhang, Y.Y. Xie, Y.H. Wang, J. Wang, R.Q. Zhang, Aromatic hydrocarbons production and synergistic effect of plastics and biomass via one-pot catalytic co-hydropyrolysis on HZSM-5, J. Anal. Appl. Pyrolysis 147 (2020). https://doi.org/10.1016/j.jaap.2020.104800. [16] L.L. Fan R. Ruan J. Li L.L. Ma C.G. Wang W.G. Zhou Appl. Energy 263 2020 10.1016/j.apenergy.2020.114629 L.L. Fan, R. Ruan, J. Li, L.L. Ma, C.G. Wang, W.G. Zhou, Aromatics production from fast co-pyrolysis of lignin and waste cooking oil catalyzed by HZSM-5 zeolite, Appl. Energy 263 (2020). https://doi.org/10.1016/j.apenergy.2020.114629. [17] Y.W. Zheng J.D. Wang C. Liu X. Lin Y. Lu W.B. Li Z.F. Zheng J. Energy Inst. 93 2020 1833 1847 10.1016/j.joei.2020.03.014 Y.W. Zheng, J.D. Wang, C. Liu, X. Lin, Y. Lu, W.B. Li, Z.F. Zheng, Enhancing the aromatic hydrocarbon yield from the catalytic copyrolysis of xylan and LDPE with a dual-catalytic-stage combined CaO/HZSM-5 catalyst, J. Energy Inst. 93 (2020) 1833–1847. https://doi.org/10.1016/j.joei.2020.03.014. [18] E.A. Uslamin N. Kosinov G.A. Filonenko B. Mezari E. Pidko E.J.M. Hensen ACS Catal. 9 2019 8547 8554 10.1021/acscatal.9b02259 E.A. Uslamin, N. Kosinov, G.A. Filonenko, B. Mezari, E. Pidko, E.J.M. Hensen, Co-Aromatization of Furan and Methanol over ZSM-5-A Pathway to Bio-Aromatics, ACS Catal. 9 (2019) 8547–8554. https://doi.org/10.1021/acscatal.9b02259. [19] J. Wang J.C. Jiang Z.P. Zhong K. Wang X.B. Wang B. Zhang R. Ruan M. Li A.J. Ragauskas Energy Convers. Manag. 196 2019 759 767 10.1016/j.enconman.2019.06.009 J. Wang, J.C. Jiang, Z.P. Zhong, K. Wang, X.B. Wang, B. Zhang, R. Ruan, M. Li, A.J. Ragauskas, Catalytic fast co-pyrolysis of bamboo sawdust and waste plastics for enhanced aromatic hydrocarbons production using synthesized CeO2/gamma-Al2O3 and HZSM-5, Energy Convers. Manage. 196 (2019) 759–767. https://doi.org/10.1016/j.enconman.2019.06.009. [20] H.C. Genuino I. Muizebelt A. Heeres N.J. Schenk J.G.M. Winkelman H.J. Heeres Green Chem. 21 2019 3802 3806 10.1039/c9gc01485c H.C. Genuino, I. Muizebelt, A. Heeres, N.J. Schenk, J.G.M. Winkelman, H.J. Heeres, An improved catalytic pyrolysis concept for renewable aromatics from biomass involving a recycling strategy for co-produced polycyclic aromatic hydrocarbons, Green Chem. 21 (2019) 3802–3806. https://doi.org/10.1039/c9gc01485c. [21] Z.H. Zhang F. Zhou H. Cheng H. Chen J. Li K. Qiao K.Q. Chen X.Y. Lu P.K. Ouyang J. Fu Energy Fuels 33 2019 4389 4394 10.1021/acs.energyfuels.9b00779 Z.H. Zhang, F. Zhou, H. Cheng, H. Chen, J. Li, K. Qiao, K.Q. Chen, X.Y. Lu, P.K. Ouyang, J. Fu, Optimizing the aromatic yield via catalytic fast co-pyrolysis of rice straw and waste oil over HZSM-5 catalysts, Energy Fuels 33 (2019) 4389–4394. https://doi.org/10.1021/acs.energyfuels.9b00779. [22] P.Y. Qi G.Z. Chang H.C. Wang X.L. Zhang Q.J. Guo J. Anal. Appl. Pyrolysis 136 2018 178 185 10.1016/j.jaap.2018.10.007 P.Y. Qi, G.Z. Chang, H.C. Wang, X.L. Zhang, Q.J. Guo, Production of aromatic hydrocarbons by catalytic co-pyrolysis of microalgae and polypropylene using HZSM-5, J. Anal. Appl. Pyrolysis 136 (2018) 178–185. https://doi.org/10.1016/j.jaap.2018.10.007. [23] G.Z. Chang P. Miao H.C. Wang L.Y. Wang X.D. Hu Q.J. Guo Energy Convers. Manag. 173 2018 545 554 10.1016/j.enconman.2018.08.003 G.Z. Chang, P. Miao, H.C. Wang, L.Y. Wang, X.D. Hu, Q.J. Guo, A synergistic effect during the co-pyrolysis of Nannochloropsis sp and palm kernel shell for aromatic hydrocarbon production, Energy Convers. Manage. 173 (2018) 545–554. https://doi.org/10.1016/j.enconman.2018.08.003. [24] B. Zhang Z.P. Zhong J. Zhang R. Ruan J. Anal. Appl. Pyrolysis 133 2018 147 153 10.1016/j.jaap.2018.04.009 B. Zhang, Z.P. Zhong, J. Zhang, R. Ruan, Catalytic fast co-pyrolysis of biomass and fusel alcohol to enhance aromatic hydrocarbon production over ZSM-5 catalyst in a fluidized bed reactor, J. Anal. Appl. Pyrolysis 133 (2018) 147–153. https://doi.org/10.1016/j.jaap.2018.04.009. [25] H.W. Lee Y.M. Kim J. Jae J.K. Jeon S.C. Jung S.C. Kim Y.K. Park Energy Convers. Manag. 129 2016 81 88 10.1016/j.enconman.2016.10.001 H.W. Lee, Y.M. Kim, J. Jae, J.K. Jeon, S.C. Jung, S.C. Kim, Y.K. Park, Production of aromatic hydrocarbons via catalytic co-pyrolysis of torrefied cellulose and polypropylene, Energy Convers. Manage. 129 (2016) 81–88. https://doi.org/10.1016/j.enconman.2016.10.001. [26] G.Q. Zhou J. Li Y.Q. Yu X.Y. Li Y.J. Wang W. Wang S. Komarneni Appl. Catal. A 487 2014 45 53 10.1016/j.apcata.2014.09.009 G.Q. Zhou, J. Li, Y.Q. Yu, X.Y. Li, Y.J. Wang, W. Wang, S. Komarneni, Optimizing the distribution of aromatic products from catalytic fast pyrolysis of cellulose by ZSM-5 modification with boron and co-feeding of low-density polyethylene, Appl. Catal., A 487 (2014) 45–53. https://doi.org/10.1016/j.apcata.2014.09.009. [27] H.Y. Zhang J. Zheng R. Xiao D.K. Shen B.S. Jin G.M. Xiao R. Chen RSC Adv. 3 2013 5769 5774 10.1039/c3ra40694f H.Y. Zhang, J. Zheng, R. Xiao, D.K. Shen, B.S. Jin, G.M. Xiao, R. Chen, Co-catalytic pyrolysis of biomass and waste triglyceride seed oil in a novel fluidized bed reactor to produce olefins and aromatics integrated with self-heating and catalyst regeneration processes, RSC Adv. 3 (2013) 5769–5774. https://doi.org/10.1039/c3ra40694f. [28] S. He T.S. Kramer D.S. Santosa A. Heeres H.J. Heeres Green Chem. 2022 10.1039/D1GC03531B In press S. He, T.S. Kramer, D.S. Santosa, A. Heeres, H.J. Heeres, Catalytic conversion of glycerol with co-feeds (fatty acids, alcohols, and alkanes) to bio-based aromatics: remarkable and unprecedented synergetic effects on catalyst performance, Green Chemistry, accepted (2022). https://doi.org/10.1039/D1GC03531B. [29] S. He T.S. Kramer F.G.H. Klein A. Chandel Z. Tegudeer A. Heeres C. Liu E. Pidko H.J. Heeres Appl. Catal. A 629 2022 1 13 10.1016/j.apcata.2021.118393 (Article number 118393) S. He, T.S. Kramer, F.G.H. Klein, A. Chandel, Z. Tegudeer, A. Heeres, C. Liu, E. Pidko, H.J. Heeres, Improved catalyst formulations for the conversion of glycerol to bio-based aromatics, Appl. Catal., A 629 (2022) Article number 118393, 1–13. https://doi.org/10.1016/j.apcata.2021.118393. [30] S. He F.G.H. Klein T.S. Kramer A. Chandel Z. Tegudeer A. Heeres H.J. Heeres ACS Sustain. Chem. Eng. 9 2021 1128 1141 10.1021/acssuschemeng.0c06181 S. He, F.G.H. Klein, T.S. Kramer, A. Chandel, Z. Tegudeer, A. Heeres, H.J. Heeres, Catalytic conversion of free fatty acids to bio-based aromatics: A model investigation using oleic acid and an H-ZSM-5/Al2O3 catalyst, ACS Sustainable Chem. Eng. 9 (2021) 1128–1141. https://doi.org/10.1021/acssuschemeng.0c06181. [31] B. Luna-Murillo M. Pala A.L. Paioni M. Baldus F. Ronsse W. Prins P.C.A. Bruijnincx B.M. Weckhuysen ACS Sustain. Chem. Eng. 9 2021 291 304 10.1021/acssuschemeng.0c07153 B. Luna-Murillo, M. Pala, A.L. Paioni, M. Baldus, F. Ronsse, W. Prins, P.C.A. Bruijnincx, B.M. Weckhuysen, Catalytic fast pyrolysis of biomass: Catalyst characterization reveals the feed-dependent deactivation of a technical ZSM-5-based catalyst, ACS Sustainable Chem. Eng. 9 (2021) 291–304. https://doi.org/10.1021/acssuschemeng.0c07153. [32] J.-P. Lange Nat. Catal. 4 2021 186 192 10.1038/s41929-021-00585-2 J.-P. Lange, Performance metrics for sustainable catalysis in industry, Nat. Catal. 4 (2021) 186–192. https://doi.org/10.1038/s41929–021-00585–2. [33] S. He K. Zuur D.S. Santosa A. Heeres C. Liu E. Pidko H.J. Heeres Appl. Catal. B 281 2021 1 14 10.1016/j.apcatb.2020.119467 (Article number 119467) S. He, K. Zuur, D.S. Santosa, A. Heeres, C. Liu, E. Pidko, H.J. Heeres, Catalytic conversion of glycerol over an unmodified H-ZSM-5 zeolite to bio-based aromatics, Appl. Catal., B 281 (2021) Article number 119467, 1–14. https://doi.org/10.1016/j.apcatb.2020.119467. [34] S. Brunauer P.H. Emmett E. Teller J. Am. Chem. Soc. 60 1938 309 319 10.1021/ja01269a023 S. Brunauer, P.H. Emmett, E. Teller, Adsorption of gases in multimolecular layers, J. Am. Chem. Soc. 60 (1938) 309–319. https://doi.org/10.1021/ja01269a023. [35] E.P. Barrett L.G. Joyner P.P. Halenda J. Am. Chem. Soc. 73 1951 373 380 10.1021/ja01145a126 E.P. Barrett, L.G. Joyner, P.P. Halenda, The determination of pore volume and area distributions in porous substances. 1. Computations from nitrogen isotherms, J. Am. Chem. Soc. 73 (1951) 373–380. https://doi.org/10.1021/ja01145a126. [36] Micromeretics, Model # 251, Ar@87-Zeolites, H-form, NLDFT, Micromeretics, USA, (2017). [37] A. Corma G.W. Huber L. Sauvanaud P. O’Connor J. Catal. 247 2007 307 327 10.1016/j.jcat.2007.01.023 A. Corma, G.W. Huber, L. Sauvanaud, P. O'Connor, Processing biomass-derived oxygenates in the oil refinery: Catalytic cracking (FCC) reaction pathways and role of catalyst, J. Catal. 247 (2007) 307–327. https://doi.org/10.1016/j.jcat.2007.01.023. [38] S. He H.R. Goldhoorn Z. Tegudeer A. Chandel A. Heeres M.C.A. Stuart H.J. Heeres Chem. Eng. J. 2022 134620 10.1016/j.cej.2022.134620 In press S. He, H.R. Goldhoorn, Z. Tegudeer, A. Chandel, A. Heeres, M.C.A. Stuart, H.J. Heeres, A time- and space-resolved catalyst deactivation study on the conversion of glycerol to aromatics using H-ZSM-5, Chemical Engineering Journal, Accepted (2022). [39] M. Shin T. Kim Y.W. Suh Top. Catal. 60 2017 658 665 10.1007/s11244-017-0773-5 M. Shin, T. Kim, Y.W. Suh, Effect of glycerol on coke characteristics in the aromatization of aqueous glycerol solution, Top. Catal. 60 (2017) 658–665. https://doi.org/10.1007/s11244–017-0773–5. [40] D.H. Pan S.Q. Xu Y.A. Miao N.N. Xu H.Z. Wang X.H. Song L.J. Gao G.M. Xiao Catal. Sci. Technol. 9 2019 739 752 10.1039/c8cy02217h D.H. Pan, S.Q. Xu, Y.A. Miao, N.N. Xu, H.Z. Wang, X.H. Song, L.J. Gao, G.M. Xiao, A highly active and stable Zn@C/HZSM-5 catalyst using Zn@C derived from ZIF-8 as a template for conversion of glycerol to aromatics, Catal. Sci. Technol. 9 (2019) 739–752. https://doi.org/10.1039/c8cy02217h. [41] A. Errekatxo A. Ibarra A. Gutierrez J. Bilbao J.M. Arandes P. Castano Chem. Eng. J. 307 2017 955 965 10.1016/j.cej.2016.08.100 A. Errekatxo, A. Ibarra, A. Gutierrez, J. Bilbao, J.M. Arandes, P. Castano, Catalytic deactivation pathways during the cracking of glycerol and glycerol/VGO blends under FCC unit conditions, Chem. Eng. J. 307 (2017) 955–965. https://doi.org/10.1016/j.cej.2016.08.100. [42] S. He H.R. Goldhoorn Z. Tegudeer A. Chandel A. Heeres C. Liu E. Pidko H.J. Heeres Fuel Process. Technol. 221 2021 1 12 10.1016/j.fuproc.2021.106944 (Article number 106944) S. He, H.R. Goldhoorn, Z. Tegudeer, A. Chandel, A. Heeres, C. Liu, E. Pidko, H.J. Heeres, Catalytic conversion of glycerol to bio-based aromatics using H-ZSM-5 in combination with various binders, Fuel Process. Technol. 221 (2021) Article number 106944, 1–12. https://doi.org/10.1016/j.fuproc.2021.106944. [43] C. Wang L. Zhang X. Huang Y. Zhu G. Li Q. Gu J. Chen L. Ma X. Li Q. He J. Xu Q. Sun C. Song M. Peng J. Sun D. Ma Nat. Commun. 10 2019 4348 10.1038/s41467-019-12285-4 C. Wang, L. Zhang, X. Huang, Y. Zhu, G. Li, Q. Gu, J. Chen, L. Ma, X. Li, Q. He, J. Xu, Q. Sun, C. Song, M. Peng, J. Sun, D. Ma, Maximizing sinusoidal channels of HZSM-5 for high shape-selectivity to p-xylene, Nat. Commun. 10 (2019) 4348. https://doi.org/10.1038/s41467–019-12285–4. [44] Y. Ono Catal. Rev. Sci. Eng. 34 1992 179 226 10.1080/01614949208020306 Y. Ono, Transformation of lower alkanes into aromatic-hydrocarbons over zsm-5 zeolites, Catal. Rev.: Sci. Eng. 34 (1992) 179–226. https://doi.org/10.1080/01614949208020306. [45] K.A. Cychosz R. Guillet-Nicolas J. García-Martínez M. Thommes Chem. Soc. Rev. 46 2017 389 414 10.1039/C6CS00391E K.A. Cychosz, R. Guillet-Nicolas, J. García-Martínez, M. Thommes, Recent advances in the textural characterization of hierarchically structured nanoporous materials, Chem. Soc. Rev. 46 (2017) 389–414. https://doi.org/10.1039/C6CS00391E. [46] M.M.J. Treacy J.B. Higgins Collection of simulated xrd powder patterns for zeolites Fifth ed. 2007 Elsevier Science B.V. Amsterdam 278 279 10.1016/B978-044453067-7/50604-3 M.M.J. Treacy, J.B. Higgins, MFI - ZSM-5, Calcined, Collection of simulated xrd powder patterns for zeolites (Fifth edition), Elsevier Science B.V., Amsterdam, 2007, pp. 278–279. https://doi.org/10.1016/B978–044453067-7/50604–3. [47] A.S. Al-Dughaither H. de Lasa Ind. Eng. Chem. Res. 53 2014 15303 15316 10.1021/ie4039532 A.S. Al-Dughaither, H. de Lasa, HZSM-5 zeolites with different SiO2/Al2O3 ratios. Characterization and NH3 desorption kinetics, Ind. Eng. Chem. Res. 53 (2014) 15303–15316. https://doi.org/10.1021/ie4039532. [48] M.I. Zaki M.A. Hasan F.A. Al-Sagheer L. Pasupulety Colloids Surf. A 190 2001 261 274 10.1016/s0927-7757(01)00690-2 M.I. Zaki, M.A. Hasan, F.A. Al-Sagheer, L. Pasupulety, In situ FTIR spectra of pyridine adsorbed on SiO2-Al2O3, TiO2, ZrO2 and CeO2: general considerations for the identification of acid sites on surfaces of finely divided metal oxides, Colloids Surf., A 190 (2001) 261–274. https://doi.org/10.1016/s0927–7757(01)00690–2. [49] T.C. Hoff R. Thilakaratne D.W. Gardner R.C. Brown J.-P. Tessonnier J. Phys. Chem. C 120 2016 20103 20113 10.1021/acs.jpcc.6b04671 T.C. Hoff, R. Thilakaratne, D.W. Gardner, R.C. Brown, J.-P. Tessonnier, Thermal stability of aluminum-rich ZSM-5 zeolites and consequences on aromatization reactions, J. Phys. Chem. C 120 (2016) 20103–20113. https://doi.org/10.1021/acs.jpcc.6b04671. [50] K. Suzuki T. Sano Y. Kiyozumi H. Hagiwara S. Shin H. Takaya Nippon Kagaku Kaishi 1989 1818 1823 10.1246/nikkashi.1989.1818 K. Suzuki, T. Sano, Y. Kiyozumi, H. Hagiwara, S. Shin, H. Takaya, Dealumination of zsm-5 zeolites by steaming, Nippon Kagaku Kaishi (1989) 1818–1823. https://doi.org/10.1246/nikkashi.1989.1818. [51] Z.W. Yu S.H. Li Q. Wang A.M. Zheng X. Jun L. Chen F. Deng J. Phys. Chem. C 115 2011 22320 22327 10.1021/jp203923z Z.W. Yu, S.H. Li, Q. Wang, A.M. Zheng, X. Jun, L. Chen, F. Deng, Brønsted/Lewis acid synergy in H-ZSM-5 and H-MOR zeolites studied by 1H and 27Al DQ-MAS solid-state NMR spectroscopy, J. Phys. Chem. C 115 (2011) 22320–22327. https://doi.org/10.1021/jp203923z.",
      "scopus-id": "85123117256",
      "coredata": {
        "eid": "1-s2.0-S0926860X22000096",
        "dc:description": "The catalytic co-conversion of glycerol and oleic acid (45/55 wt%) to bio-based aromatics (benzene, toluene, and xylenes, bio-BTX) over a technical H-ZSM-5/Al2O3 catalyst in a fixed-bed reactor was investigated with special attention to catalyst deactivation phenomena. The spent catalysts after a time on stream (TOS) of 12 h were regenerated by an ex-situ oxidative treatment to remove coke and reused for another run. In total, 5 reaction-regeneration cycles were performed. The performance and characteristics of the fresh and regenerated catalysts were determined to identify and quantify the effects of co-feeding on catalyst stability and regenerability. The performance of the catalyst changes upon the number of reaction-regeneration cycles. Despite a negative effect on the peak BTX yield, a remarkable improvement in catalyst stability was found, leading to higher BTX productivity (1260–1505 gBTX gcat -1 for the regenerated catalysts during a TOS of 12 h vs. 834 gBTX gcat -1 for the fresh one during a life-time of 11 h). Detailed catalyst characterization studies show irreversible changes in the catalyst structure after reaction-regeneration cycle(s), such as textural property, crystal structure, framework, and acidity, which impact catalyst performance.",
        "openArchiveArticle": "false",
        "prism:coverDate": "2022-02-25",
        "openaccessUserLicense": "http://creativecommons.org/licenses/by/4.0/",
        "prism:aggregationType": "Journal",
        "prism:url": "https://api.elsevier.com/content/article/pii/S0926860X22000096",
        "dc:creator": [
          {
            "@_fa": "true",
            "$": "He, Songbo"
          },
          {
            "@_fa": "true",
            "$": "Klein, Frederike Gerda Hiltje"
          },
          {
            "@_fa": "true",
            "$": "Kramer, Thomas Sjouke"
          },
          {
            "@_fa": "true",
            "$": "Chandel, Anshu"
          },
          {
            "@_fa": "true",
            "$": "Tegudeer, Zhuorigebatu"
          },
          {
            "@_fa": "true",
            "$": "Heeres, André"
          },
          {
            "@_fa": "true",
            "$": "Heeres, Hero Jan"
          }
        ],
        "link": [
          {
            "@_fa": "true",
            "@rel": "self",
            "@href": "https://api.elsevier.com/content/article/pii/S0926860X22000096"
          },
          {
            "@_fa": "true",
            "@rel": "scidir",
            "@href": "https://www.sciencedirect.com/science/article/pii/S0926860X22000096"
          }
        ],
        "dc:format": "application/json",
        "openaccessType": "Full",
        "pii": "S0926-860X(22)00009-6",
        "prism:volume": "632",
        "articleNumber": "118486",
        "prism:publisher": "The Author(s). Published by Elsevier B.V.",
        "dc:title": "Catalytic co-conversion of glycerol and oleic acid to bio-aromatics: Catalyst deactivation studies for a technical H-ZSM-5/Al2O3 catalyst",
        "prism:copyright": "© 2022 The Author(s). Published by Elsevier B.V.",
        "openaccess": "1",
        "prism:issn": "0926860X",
        "dcterms:subject": [
          {
            "@_fa": "true",
            "$": "Glycerol"
          },
          {
            "@_fa": "true",
            "$": "Oleic acid"
          },
          {
            "@_fa": "true",
            "$": "Bio-aromatics"
          },
          {
            "@_fa": "true",
            "$": "Irreversible deactivation"
          },
          {
            "@_fa": "true",
            "$": "H-ZSM-5/Al2O3"
          }
        ],
        "openaccessArticle": "true",
        "prism:publicationName": "Applied Catalysis A: General",
        "openaccessSponsorType": "FundingBody",
        "prism:pageRange": "118486",
        "pubType": "fla",
        "prism:coverDisplayDate": "25 February 2022",
        "prism:doi": "10.1016/j.apcata.2022.118486",
        "prism:startingPage": "118486",
        "dc:identifier": "doi:10.1016/j.apcata.2022.118486",
        "openaccessSponsorName": "Dutch University VSNU 2020"
      },
      "objects": {
        "object": [
          {
            "@category": "standard",
            "@height": "429",
            "@width": "659",
            "@_fa": "true",
            "$": "https://api.elsevier.com/content/object/eid/1-s2.0-S0926860X22000096-gr2.jpg?httpAccept=%2A%2F%2A",
            "@multimediatype": "JPEG image file",
            "@type": "IMAGE-DOWNSAMPLED",
            "@size": "94989",
            "@ref": "gr2",
            "@mimetype": "image/jpeg"
          },
          {
            "@category": "standard",
            "@height": "200",
            "@width": "480",
            "@_fa": "true",
            "$": "https://api.elsevier.com/content/object/eid/1-s2.0-S0926860X22000096-ga1.jpg?httpAccept=%2A%2F%2A",
            "@multimediatype": "JPEG image file",
            "@type": "IMAGE-DOWNSAMPLED",
            "@size": "17717",
            "@ref": "ga1",
            "@mimetype": "image/jpeg"
          },
          {
            "@category": "standard",
            "@height": "230",
            "@width": "282",
            "@_fa": "true",
            "$": "https://api.elsevier.com/content/object/eid/1-s2.0-S0926860X22000096-gr3.jpg?httpAccept=%2A%2F%2A",
            "@multimediatype": "JPEG image file",
            "@type": "IMAGE-DOWNSAMPLED",
            "@size": "14663",
            "@ref": "gr3",
            "@mimetype": "image/jpeg"
          },
          {
            "@category": "standard",
            "@height": "722",
            "@width": "659",
            "@_fa": "true",
            "$": "https://api.elsevier.com/content/object/eid/1-s2.0-S0926860X22000096-gr4.jpg?httpAccept=%2A%2F%2A",
            "@multimediatype": "JPEG image file",
            "@type": "IMAGE-DOWNSAMPLED",
            "@size": "178811",
            "@ref": "gr4",
            "@mimetype": "image/jpeg"
          },
          {
            "@category": "standard",
            "@height": "537",
            "@width": "376",
            "@_fa": "true",
            "$": "https://api.elsevier.com/content/object/eid/1-s2.0-S0926860X22000096-gr5.jpg?httpAccept=%2A%2F%2A",
            "@multimediatype": "JPEG image file",
            "@type": "IMAGE-DOWNSAMPLED",
            "@size": "49956",
            "@ref": "gr5",
            "@mimetype": "image/jpeg"
          },
          {
            "@category": "standard",
            "@height": "272",
            "@width": "376",
            "@_fa": "true",
            "$": "https://api.elsevier.com/content/object/eid/1-s2.0-S0926860X22000096-gr6.jpg?httpAccept=%2A%2F%2A",
            "@multimediatype": "JPEG image file",
            "@type": "IMAGE-DOWNSAMPLED",
            "@size": "36645",
            "@ref": "gr6",
            "@mimetype": "image/jpeg"
          },
          {
            "@category": "standard",
            "@height": "184",
            "@width": "282",
            "@_fa": "true",
            "$": "https://api.elsevier.com/content/object/eid/1-s2.0-S0926860X22000096-gr7.jpg?httpAccept=%2A%2F%2A",
            "@multimediatype": "JPEG image file",
            "@type": "IMAGE-DOWNSAMPLED",
            "@size": "18100",
            "@ref": "gr7",
            "@mimetype": "image/jpeg"
          },
          {
            "@category": "standard",
            "@height": "355",
            "@width": "376",
            "@_fa": "true",
            "$": "https://api.elsevier.com/content/object/eid/1-s2.0-S0926860X22000096-gr8.jpg?httpAccept=%2A%2F%2A",
            "@multimediatype": "JPEG image file",
            "@type": "IMAGE-DOWNSAMPLED",
            "@size": "37737",
            "@ref": "gr8",
            "@mimetype": "image/jpeg"
          },
          {
            "@category": "standard",
            "@height": "448",
            "@width": "659",
            "@_fa": "true",
            "$": "https://api.elsevier.com/content/object/eid/1-s2.0-S0926860X22000096-gr1.jpg?httpAccept=%2A%2F%2A",
            "@multimediatype": "JPEG image file",
            "@type": "IMAGE-DOWNSAMPLED",
            "@size": "82042",
            "@ref": "gr1",
            "@mimetype": "image/jpeg"
          },
          {
            "@category": "thumbnail",
            "@height": "143",
            "@width": "219",
            "@_fa": "true",
            "$": "https://api.elsevier.com/content/object/eid/1-s2.0-S0926860X22000096-gr2.sml?httpAccept=%2A%2F%2A",
            "@multimediatype": "GIF image file",
            "@type": "IMAGE-THUMBNAIL",
            "@size": "12731",
            "@ref": "gr2",
            "@mimetype": "image/gif"
          },
          {
            "@category": "thumbnail",
            "@height": "91",
            "@width": "219",
            "@_fa": "true",
            "$": "https://api.elsevier.com/content/object/eid/1-s2.0-S0926860X22000096-ga1.sml?httpAccept=%2A%2F%2A",
            "@multimediatype": "GIF image file",
            "@type": "IMAGE-THUMBNAIL",
            "@size": "6921",
            "@ref": "ga1",
            "@mimetype": "image/gif"
          },
          {
            "@category": "thumbnail",
            "@height": "164",
            "@width": "201",
            "@_fa": "true",
            "$": "https://api.elsevier.com/content/object/eid/1-s2.0-S0926860X22000096-gr3.sml?httpAccept=%2A%2F%2A",
            "@multimediatype": "GIF image file",
            "@type": "IMAGE-THUMBNAIL",
            "@size": "7307",
            "@ref": "gr3",
            "@mimetype": "image/gif"
          },
          {
            "@category": "thumbnail",
            "@height": "163",
            "@width": "149",
            "@_fa": "true",
            "$": "https://api.elsevier.com/content/object/eid/1-s2.0-S0926860X22000096-gr4.sml?httpAccept=%2A%2F%2A",
            "@multimediatype": "GIF image file",
            "@type": "IMAGE-THUMBNAIL",
            "@size": "19007",
            "@ref": "gr4",
            "@mimetype": "image/gif"
          },
          {
            "@category": "thumbnail",
            "@height": "163",
            "@width": "114",
            "@_fa": "true",
            "$": "https://api.elsevier.com/content/object/eid/1-s2.0-S0926860X22000096-gr5.sml?httpAccept=%2A%2F%2A",
            "@multimediatype": "GIF image file",
            "@type": "IMAGE-THUMBNAIL",
            "@size": "6916",
            "@ref": "gr5",
            "@mimetype": "image/gif"
          },
          {
            "@category": "thumbnail",
            "@height": "158",
            "@width": "219",
            "@_fa": "true",
            "$": "https://api.elsevier.com/content/object/eid/1-s2.0-S0926860X22000096-gr6.sml?httpAccept=%2A%2F%2A",
            "@multimediatype": "GIF image file",
            "@type": "IMAGE-THUMBNAIL",
            "@size": "12141",
            "@ref": "gr6",
            "@mimetype": "image/gif"
          },
          {
            "@category": "thumbnail",
            "@height": "143",
            "@width": "219",
            "@_fa": "true",
            "$": "https://api.elsevier.com/content/object/eid/1-s2.0-S0926860X22000096-gr7.sml?httpAccept=%2A%2F%2A",
            "@multimediatype": "GIF image file",
            "@type": "IMAGE-THUMBNAIL",
            "@size": "9809",
            "@ref": "gr7",
            "@mimetype": "image/gif"
          },
          {
            "@category": "thumbnail",
            "@height": "164",
            "@width": "174",
            "@_fa": "true",
            "$": "https://api.elsevier.com/content/object/eid/1-s2.0-S0926860X22000096-gr8.sml?httpAccept=%2A%2F%2A",
            "@multimediatype": "GIF image file",
            "@type": "IMAGE-THUMBNAIL",
            "@size": "9630",
            "@ref": "gr8",
            "@mimetype": "image/gif"
          },
          {
            "@category": "thumbnail",
            "@height": "149",
            "@width": "219",
            "@_fa": "true",
            "$": "https://api.elsevier.com/content/object/eid/1-s2.0-S0926860X22000096-gr1.sml?httpAccept=%2A%2F%2A",
            "@multimediatype": "GIF image file",
            "@type": "IMAGE-THUMBNAIL",
            "@size": "12694",
            "@ref": "gr1",
            "@mimetype": "image/gif"
          },
          {
            "@category": "high",
            "@height": "1896",
            "@width": "2911",
            "@_fa": "true",
            "$": "https://api.elsevier.com/content/object/eid/1-s2.0-S0926860X22000096-gr2_lrg.jpg?httpAccept=%2A%2F%2A",
            "@multimediatype": "JPEG image file",
            "@type": "IMAGE-HIGH-RES",
            "@size": "619211",
            "@ref": "gr2",
            "@mimetype": "image/jpeg"
          },
          {
            "@category": "high",
            "@height": "886",
            "@width": "2124",
            "@_fa": "true",
            "$": "https://api.elsevier.com/content/object/eid/1-s2.0-S0926860X22000096-ga1_lrg.jpg?httpAccept=%2A%2F%2A",
            "@multimediatype": "JPEG image file",
            "@type": "IMAGE-HIGH-RES",
            "@size": "127992",
            "@ref": "ga1",
            "@mimetype": "image/jpeg"
          },
          {
            "@category": "high",
            "@height": "1015",
            "@width": "1247",
            "@_fa": "true",
            "$": "https://api.elsevier.com/content/object/eid/1-s2.0-S0926860X22000096-gr3_lrg.jpg?httpAccept=%2A%2F%2A",
            "@multimediatype": "JPEG image file",
            "@type": "IMAGE-HIGH-RES",
            "@size": "83366",
            "@ref": "gr3",
            "@mimetype": "image/jpeg"
          },
          {
            "@category": "high",
            "@height": "3188",
            "@width": "2911",
            "@_fa": "true",
            "$": "https://api.elsevier.com/content/object/eid/1-s2.0-S0926860X22000096-gr4_lrg.jpg?httpAccept=%2A%2F%2A",
            "@multimediatype": "JPEG image file",
            "@type": "IMAGE-HIGH-RES",
            "@size": "1014182",
            "@ref": "gr4",
            "@mimetype": "image/jpeg"
          },
          {
            "@category": "high",
            "@height": "2377",
            "@width": "1663",
            "@_fa": "true",
            "$": "https://api.elsevier.com/content/object/eid/1-s2.0-S0926860X22000096-gr5_lrg.jpg?httpAccept=%2A%2F%2A",
            "@multimediatype": "JPEG image file",
            "@type": "IMAGE-HIGH-RES",
            "@size": "320143",
            "@ref": "gr5",
            "@mimetype": "image/jpeg"
          },
          {
            "@category": "high",
            "@height": "1201",
            "@width": "1663",
            "@_fa": "true",
            "$": "https://api.elsevier.com/content/object/eid/1-s2.0-S0926860X22000096-gr6_lrg.jpg?httpAccept=%2A%2F%2A",
            "@multimediatype": "JPEG image file",
            "@type": "IMAGE-HIGH-RES",
            "@size": "209717",
            "@ref": "gr6",
            "@mimetype": "image/jpeg"
          },
          {
            "@category": "high",
            "@height": "815",
            "@width": "1247",
            "@_fa": "true",
            "$": "https://api.elsevier.com/content/object/eid/1-s2.0-S0926860X22000096-gr7_lrg.jpg?httpAccept=%2A%2F%2A",
            "@multimediatype": "JPEG image file",
            "@type": "IMAGE-HIGH-RES",
            "@size": "106018",
            "@ref": "gr7",
            "@mimetype": "image/jpeg"
          },
          {
            "@category": "high",
            "@height": "1569",
            "@width": "1663",
            "@_fa": "true",
            "$": "https://api.elsevier.com/content/object/eid/1-s2.0-S0926860X22000096-gr8_lrg.jpg?httpAccept=%2A%2F%2A",
            "@multimediatype": "JPEG image file",
            "@type": "IMAGE-HIGH-RES",
            "@size": "227322",
            "@ref": "gr8",
            "@mimetype": "image/jpeg"
          },
          {
            "@category": "high",
            "@height": "1979",
            "@width": "2911",
            "@_fa": "true",
            "$": "https://api.elsevier.com/content/object/eid/1-s2.0-S0926860X22000096-gr1_lrg.jpg?httpAccept=%2A%2F%2A",
            "@multimediatype": "JPEG image file",
            "@type": "IMAGE-HIGH-RES",
            "@size": "453938",
            "@ref": "gr1",
            "@mimetype": "image/jpeg"
          },
          {
            "@category": "standard",
            "@_fa": "true",
            "$": "https://api.elsevier.com/content/object/eid/1-s2.0-S0926860X22000096-mmc1.docx?httpAccept=%2A%2F%2A",
            "@multimediatype": "Microsoft Word file",
            "@type": "APPLICATION",
            "@size": "9958058",
            "@ref": "mmc1",
            "@mimetype": "application/word"
          },
          {
            "@category": "thumbnail",
            "@_fa": "true",
            "$": "https://api.elsevier.com/content/object/eid/1-s2.0-S0926860X22000096-si0001.svg?httpAccept=%2A%2F%2A",
            "@multimediatype": "Scalable Vector Graphics file",
            "@type": "ALTIMG",
            "@size": "5008",
            "@ref": "si0001",
            "@mimetype": "image/svg+xml"
          },
          {
            "@category": "thumbnail",
            "@_fa": "true",
            "$": "https://api.elsevier.com/content/object/eid/1-s2.0-S0926860X22000096-si0002.svg?httpAccept=%2A%2F%2A",
            "@multimediatype": "Scalable Vector Graphics file",
            "@type": "ALTIMG",
            "@size": "5349",
            "@ref": "si0002",
            "@mimetype": "image/svg+xml"
          },
          {
            "@category": "thumbnail",
            "@_fa": "true",
            "$": "https://api.elsevier.com/content/object/eid/1-s2.0-S0926860X22000096-si0003.svg?httpAccept=%2A%2F%2A",
            "@multimediatype": "Scalable Vector Graphics file",
            "@type": "ALTIMG",
            "@size": "7213",
            "@ref": "si0003",
            "@mimetype": "image/svg+xml"
          },
          {
            "@category": "thumbnail",
            "@_fa": "true",
            "$": "https://api.elsevier.com/content/object/eid/1-s2.0-S0926860X22000096-si0004.svg?httpAccept=%2A%2F%2A",
            "@multimediatype": "Scalable Vector Graphics file",
            "@type": "ALTIMG",
            "@size": "5734",
            "@ref": "si0004",
            "@mimetype": "image/svg+xml"
          },
          {
            "@category": "thumbnail",
            "@_fa": "true",
            "$": "https://api.elsevier.com/content/object/eid/1-s2.0-S0926860X22000096-si0005.svg?httpAccept=%2A%2F%2A",
            "@multimediatype": "Scalable Vector Graphics file",
            "@type": "ALTIMG",
            "@size": "7261",
            "@ref": "si0005",
            "@mimetype": "image/svg+xml"
          },
          {
            "@category": "thumbnail",
            "@_fa": "true",
            "$": "https://api.elsevier.com/content/object/eid/1-s2.0-S0926860X22000096-si0006.svg?httpAccept=%2A%2F%2A",
            "@multimediatype": "Scalable Vector Graphics file",
            "@type": "ALTIMG",
            "@size": "4113",
            "@ref": "si0006",
            "@mimetype": "image/svg+xml"
          },
          {
            "@category": "standard",
            "@_fa": "true",
            "$": "https://api.elsevier.com/content/object/eid/1-s2.0-S0926860X22000096-am.pdf?httpAccept=%2A%2F%2A",
            "@multimediatype": "Acrobat PDF file",
            "@type": "AAM-PDF",
            "@size": "2013172",
            "@ref": "am",
            "@mimetype": "application/pdf"
          }
        ]
      },
      "link": {
        "@rel": "abstract",
        "@href": "https://api.elsevier.com/content/abstract/scopus_id/85123117256"
      }
    }
  }
}