{
  "metadata": {
    "title": "Controlling hydrocarbon oligomerization in phosphorus-modified CHA zeolite for a long-lived methanol-to-olefin catalyst",
    "authors": "; ; ",
    "journal": "Applied Catalysis A: General",
    "date": "2021-06-25",
    "doi": "10.1016/j.apcata.2021.118176",
    "abstract": "",
    "uri": "https://api.elsevier.com/content/article/pii/S0926860X21001903",
    "pii": "S0926860X21001903"
  },
  "fulltext": {
    "full-text-retrieval-response": {
      "scopus-eid": "2-s2.0-85105005080",
      "originalText": "serial JL 271346 291210 291744 291809 31 Applied Catalysis A: General APPLIEDCATALYSISAGENERAL 2021-04-29 2021-04-29 2021-05-02 2021-05-02 2021-05-13T20:52:17 1-s2.0-S0926860X21001903 S0926-860X(21)00190-3 S0926860X21001903 10.1016/j.apcata.2021.118176 S300 S300.1 FULL-TEXT 1-s2.0-S0926860X21X00105 2024-01-01T12:34:28.416125Z 0 0 20210625 2021 2021-04-29T01:57:36.634789Z absattachment articleinfo articlenumber articletitlenorm authfirstinitialnorm authfirstsurnamenorm cid cids contenttype copyright crossmark dateloaded dateloadedtxt datesearch datesort dateupdated dco docsubtype doctype doi eid ewtransactionid hubeid indexeddate issn issnnorm itemstage itemtransactionid itemweight openaccess openarchive pg pgfirst pii piinorm pubdatestart pubdatetxt pubyr sortorder srctitle srctitlenorm srctype ssids alllist content subj subheadings suppl tomb volfirst volissue volumelist webpdf webpdfpagecount yearnav figure table body mmlmath acknowledge affil articletitle auth authfirstini authfull authkeywords authlast grantnumber grantsponsor highlightsabst orcid primabst ref specialabst 0926-860X 0926860X true 620 620 C Volume 620 8 118176 118176 118176 20210625 25 June 2021 2021-06-25 2021 article fla © 2021 Elsevier B.V. All rights reserved. CONTROLLINGHYDROCARBONOLIGOMERIZATIONINPHOSPHORUSMODIFIEDCHAZEOLITEFORALONGLIVEDMETHANOLTOOLEFINCATALYST TSUNOJI N 1 Introduction 2 Experimental 2.1 Preparation of the zeolite catalysts 2.2 Characterization 2.3 MTO reaction 3 Results and discussion 4 Conclusion CRediT author statement Acknowledgments References ZHU 2007 5409 5415 Q OLSBYE 2012 5810 5831 U TIAN 2015 1922 1938 P YOSHIOKA 2015 4268 4275 M NISHITOBA 2018 3914 3922 T DUSSELIER 2018 5265 5329 M GOETZE 2017 4033 4046 J YARULINA 2018 398 411 I ZHANG 2018 2750 2758 Q KANG 2018 412 419 J GALLEGO 2018 14631 14635 E PENG 2018 16867 16875 Q ZHANG 2018 10950 10963 W WANG 2020 965 980 C XIAO 2019 12415 12418 D XIAO 2018 8184 8193 D XIAO 2017 8309 8314 D YOKOI 2009 9884 9887 T BHAWE 2012 2490 2495 Y KUMITA 2011 234 243 Y DUSSELIER 2015 6078 6085 M XU 2013 11564 11568 S FERRI 2019 11542 11551 P LI 2015 661 665 J CHEN 2014 3268 3277 J LI 2012 836 839 J YANG 2013 8214 8222 G LI 2013 14670 14680 Z SUN 2014 6502 6505 Q ZHU 2008 153 161 Q CHEN 2014 36 40 J BLASCO 2006 267 277 T ZHAO 2007 29 37 G LIU 2009 1506 1509 J XUE 2007 20 28 N VANDERBIJ 2015 7406 7428 H HUANG 2016 2357 2363 H SONG 2017 105 115 Y MARUO 2014 302 304 T SONODA 2015 857 865 T KAKIUCHI 2016 122 124 Y YAMASAKI 2016 129 139 Y PRIYA 2017 355 361 S KAKIUCHI 2019 204 213 Y ZHAO 2020 109908 P KUBOTA 2020 H TSUCHIYA 2020 110540 K ONISHI 2020 M PAUL 2018 5684 5739 G TSUNOJIX2021X118176 TSUNOJIX2021X118176XN 2023-05-02T00:00:00.000Z 2023-05-02T00:00:00.000Z http://creativecommons.org/licenses/by-nc-nd/4.0/ © 2021 Elsevier B.V. All rights reserved. 2021-04-28T00:44:39.677Z http://vtw.elsevier.com/data/voc/AddOnTypes/50.7/eoas KAKEN Japan Society for the Promotion of Science http://data.elsevier.com/vocabulary/SciValFunders/501100001691 http://sws.geonames.org/1861060 https://doi.org/10.15223/policy-017 https://doi.org/10.15223/policy-037 https://doi.org/10.15223/policy-012 https://doi.org/10.15223/policy-029 https://doi.org/10.15223/policy-004 item S0926-860X(21)00190-3 S0926860X21001903 1-s2.0-S0926860X21001903 10.1016/j.apcata.2021.118176 271346 2024-01-01T12:34:28.416125Z 2021-06-25 1-s2.0-S0926860X21001903-main.pdf https://s3-eu-west-1.amazonaws.com/prod-ucs-content-store-eu-west/content/pii:S0926860X21001903/MAIN/application/pdf/430430db599d2f66b3967978e494aeb7/main.pdf main.pdf pdf true 3578106 MAIN 7 1-s2.0-S0926860X21001903-main_1.png https://s3-eu-west-1.amazonaws.com/prod-ucs-content-store-eu-west/content/pii:S0926860X21001903/PREVIEW/image/png/03ecf9184f0fd0cb5d60635fbaa85b1f/main_1.png main_1.png png 58759 849 656 IMAGE-WEB-PDF 1 1-s2.0-S0926860X21001903-gr6.jpg https://s3-eu-west-1.amazonaws.com/prod-ucs-content-store-eu-west/content/pii:S0926860X21001903/gr6/DOWNSAMPLED/image/jpeg/bda9a9be28221c73684e690e9c1f5a4e/gr6.jpg gr6 gr6.jpg jpg 18860 212 340 IMAGE-DOWNSAMPLED 1-s2.0-S0926860X21001903-gr5.jpg https://s3-eu-west-1.amazonaws.com/prod-ucs-content-store-eu-west/content/pii:S0926860X21001903/gr5/DOWNSAMPLED/image/jpeg/8d482f88688cb2a83bc6fce20f20ff99/gr5.jpg gr5 gr5.jpg jpg 64063 273 679 IMAGE-DOWNSAMPLED 1-s2.0-S0926860X21001903-gr8.jpg https://s3-eu-west-1.amazonaws.com/prod-ucs-content-store-eu-west/content/pii:S0926860X21001903/gr8/DOWNSAMPLED/image/jpeg/44b36ef29a1359a5e9640b351c9c55a2/gr8.jpg gr8 gr8.jpg jpg 38151 383 340 IMAGE-DOWNSAMPLED 1-s2.0-S0926860X21001903-gr7.jpg https://s3-eu-west-1.amazonaws.com/prod-ucs-content-store-eu-west/content/pii:S0926860X21001903/gr7/DOWNSAMPLED/image/jpeg/032807ba96dbc9344dde98174742d5b2/gr7.jpg gr7 gr7.jpg jpg 35337 345 340 IMAGE-DOWNSAMPLED 1-s2.0-S0926860X21001903-gr9.jpg https://s3-eu-west-1.amazonaws.com/prod-ucs-content-store-eu-west/content/pii:S0926860X21001903/gr9/DOWNSAMPLED/image/jpeg/e07647c2330c27ab342466b4e2468e83/gr9.jpg gr9 gr9.jpg jpg 32723 308 340 IMAGE-DOWNSAMPLED 1-s2.0-S0926860X21001903-gr2.jpg https://s3-eu-west-1.amazonaws.com/prod-ucs-content-store-eu-west/content/pii:S0926860X21001903/gr2/DOWNSAMPLED/image/jpeg/85aaa3ec91439ebf5430d279d4acdebb/gr2.jpg gr2 gr2.jpg jpg 46272 434 340 IMAGE-DOWNSAMPLED 1-s2.0-S0926860X21001903-ga1.jpg https://s3-eu-west-1.amazonaws.com/prod-ucs-content-store-eu-west/content/pii:S0926860X21001903/ga1/DOWNSAMPLED/image/jpeg/552629138e63275aac9076c778f92654/ga1.jpg ga1 true ga1.jpg jpg 22632 200 394 IMAGE-DOWNSAMPLED 1-s2.0-S0926860X21001903-gr1.jpg https://s3-eu-west-1.amazonaws.com/prod-ucs-content-store-eu-west/content/pii:S0926860X21001903/gr1/DOWNSAMPLED/image/jpeg/d20317defcd6082fe2a432ba18f26390/gr1.jpg gr1 gr1.jpg jpg 21372 270 340 IMAGE-DOWNSAMPLED 1-s2.0-S0926860X21001903-gr4.jpg https://s3-eu-west-1.amazonaws.com/prod-ucs-content-store-eu-west/content/pii:S0926860X21001903/gr4/DOWNSAMPLED/image/jpeg/cf4c5000667470a990ec8b5e59e81da3/gr4.jpg gr4 gr4.jpg jpg 29666 168 679 IMAGE-DOWNSAMPLED 1-s2.0-S0926860X21001903-gr3.jpg https://s3-eu-west-1.amazonaws.com/prod-ucs-content-store-eu-west/content/pii:S0926860X21001903/gr3/DOWNSAMPLED/image/jpeg/694a66ab76ddf6ead5cd1b460243afce/gr3.jpg gr3 gr3.jpg jpg 19334 210 340 IMAGE-DOWNSAMPLED 1-s2.0-S0926860X21001903-gr6.sml https://s3-eu-west-1.amazonaws.com/prod-ucs-content-store-eu-west/content/pii:S0926860X21001903/gr6/THUMBNAIL/image/gif/0a0b90033c1f38b8338eeb75ffd2ea7e/gr6.sml gr6 gr6.sml sml 6877 137 219 IMAGE-THUMBNAIL 1-s2.0-S0926860X21001903-gr5.sml https://s3-eu-west-1.amazonaws.com/prod-ucs-content-store-eu-west/content/pii:S0926860X21001903/gr5/THUMBNAIL/image/gif/15b12f4cbdd57040b41b737e5daa9f50/gr5.sml gr5 gr5.sml sml 6986 88 219 IMAGE-THUMBNAIL 1-s2.0-S0926860X21001903-gr8.sml https://s3-eu-west-1.amazonaws.com/prod-ucs-content-store-eu-west/content/pii:S0926860X21001903/gr8/THUMBNAIL/image/gif/1e847607e56d480f3f26520a0918affe/gr8.sml gr8 gr8.sml sml 7579 163 145 IMAGE-THUMBNAIL 1-s2.0-S0926860X21001903-gr7.sml https://s3-eu-west-1.amazonaws.com/prod-ucs-content-store-eu-west/content/pii:S0926860X21001903/gr7/THUMBNAIL/image/gif/6226ead207953558acecf89310b90dc4/gr7.sml gr7 gr7.sml sml 8235 163 161 IMAGE-THUMBNAIL 1-s2.0-S0926860X21001903-gr9.sml https://s3-eu-west-1.amazonaws.com/prod-ucs-content-store-eu-west/content/pii:S0926860X21001903/gr9/THUMBNAIL/image/gif/a4cb84ff0bb45f0dbae8adfb4310ceea/gr9.sml gr9 gr9.sml sml 9522 164 181 IMAGE-THUMBNAIL 1-s2.0-S0926860X21001903-gr2.sml https://s3-eu-west-1.amazonaws.com/prod-ucs-content-store-eu-west/content/pii:S0926860X21001903/gr2/THUMBNAIL/image/gif/e3781af572541a610bf928c2371e98b9/gr2.sml gr2 gr2.sml sml 8785 163 128 IMAGE-THUMBNAIL 1-s2.0-S0926860X21001903-ga1.sml https://s3-eu-west-1.amazonaws.com/prod-ucs-content-store-eu-west/content/pii:S0926860X21001903/ga1/THUMBNAIL/image/gif/566b708b535393f476254b36b10f97eb/ga1.sml ga1 true ga1.sml sml 9411 111 219 IMAGE-THUMBNAIL 1-s2.0-S0926860X21001903-gr1.sml https://s3-eu-west-1.amazonaws.com/prod-ucs-content-store-eu-west/content/pii:S0926860X21001903/gr1/THUMBNAIL/image/gif/05fdbfed0c3cbae28492d57b338c489f/gr1.sml gr1 gr1.sml sml 7700 164 207 IMAGE-THUMBNAIL 1-s2.0-S0926860X21001903-gr4.sml https://s3-eu-west-1.amazonaws.com/prod-ucs-content-store-eu-west/content/pii:S0926860X21001903/gr4/THUMBNAIL/image/gif/b236901324fcc7951bd340edff13045e/gr4.sml gr4 gr4.sml sml 3863 54 219 IMAGE-THUMBNAIL 1-s2.0-S0926860X21001903-gr3.sml https://s3-eu-west-1.amazonaws.com/prod-ucs-content-store-eu-west/content/pii:S0926860X21001903/gr3/THUMBNAIL/image/gif/20a312284d58c4e6f8e836043104c9a6/gr3.sml gr3 gr3.sml sml 7369 135 219 IMAGE-THUMBNAIL 1-s2.0-S0926860X21001903-gr6_lrg.jpg https://s3-eu-west-1.amazonaws.com/prod-ucs-content-store-eu-west/content/pii:S0926860X21001903/gr6/HIGHRES/image/jpeg/4f58b4afaff3ecef6a80c256d9b3a0a4/gr6_lrg.jpg gr6 gr6_lrg.jpg jpg 142849 942 1508 IMAGE-HIGH-RES 1-s2.0-S0926860X21001903-gr5_lrg.jpg https://s3-eu-west-1.amazonaws.com/prod-ucs-content-store-eu-west/content/pii:S0926860X21001903/gr5/HIGHRES/image/jpeg/39553ae3ad41536f7a9c4a95d95bd9e2/gr5_lrg.jpg gr5 gr5_lrg.jpg jpg 420318 1208 3008 IMAGE-HIGH-RES 1-s2.0-S0926860X21001903-gr8_lrg.jpg https://s3-eu-west-1.amazonaws.com/prod-ucs-content-store-eu-west/content/pii:S0926860X21001903/gr8/HIGHRES/image/jpeg/9deb90a0554b680b37d0af3c04d4f405/gr8_lrg.jpg gr8 gr8_lrg.jpg jpg 281505 1698 1508 IMAGE-HIGH-RES 1-s2.0-S0926860X21001903-gr7_lrg.jpg https://s3-eu-west-1.amazonaws.com/prod-ucs-content-store-eu-west/content/pii:S0926860X21001903/gr7/HIGHRES/image/jpeg/69ed98605863a58330163f324ff4dbde/gr7_lrg.jpg gr7 gr7_lrg.jpg jpg 273775 1529 1508 IMAGE-HIGH-RES 1-s2.0-S0926860X21001903-gr9_lrg.jpg https://s3-eu-west-1.amazonaws.com/prod-ucs-content-store-eu-west/content/pii:S0926860X21001903/gr9/HIGHRES/image/jpeg/ab45a50cdbae2d5fac2381f317f443ee/gr9_lrg.jpg gr9 gr9_lrg.jpg jpg 248307 1368 1508 IMAGE-HIGH-RES 1-s2.0-S0926860X21001903-gr2_lrg.jpg https://s3-eu-west-1.amazonaws.com/prod-ucs-content-store-eu-west/content/pii:S0926860X21001903/gr2/HIGHRES/image/jpeg/f8edf49e4aa5be7c5df87a1c15f183df/gr2_lrg.jpg gr2 gr2_lrg.jpg jpg 379856 1926 1508 IMAGE-HIGH-RES 1-s2.0-S0926860X21001903-ga1_lrg.jpg https://s3-eu-west-1.amazonaws.com/prod-ucs-content-store-eu-west/content/pii:S0926860X21001903/ga1/HIGHRES/image/jpeg/73e5c9b970cf54268ffd8ab5bdde6b12/ga1_lrg.jpg ga1 true ga1_lrg.jpg jpg 151117 886 1744 IMAGE-HIGH-RES 1-s2.0-S0926860X21001903-gr1_lrg.jpg https://s3-eu-west-1.amazonaws.com/prod-ucs-content-store-eu-west/content/pii:S0926860X21001903/gr1/HIGHRES/image/jpeg/0440707f77efbf9817076ed6bd37ba60/gr1_lrg.jpg gr1 gr1_lrg.jpg jpg 158542 1196 1508 IMAGE-HIGH-RES 1-s2.0-S0926860X21001903-gr4_lrg.jpg https://s3-eu-west-1.amazonaws.com/prod-ucs-content-store-eu-west/content/pii:S0926860X21001903/gr4/HIGHRES/image/jpeg/550613d584c54858166f4eab4b306d01/gr4_lrg.jpg gr4 gr4_lrg.jpg jpg 241658 743 3008 IMAGE-HIGH-RES 1-s2.0-S0926860X21001903-gr3_lrg.jpg https://s3-eu-west-1.amazonaws.com/prod-ucs-content-store-eu-west/content/pii:S0926860X21001903/gr3/HIGHRES/image/jpeg/9aee4ccba940179c3fa699727305c33c/gr3_lrg.jpg gr3 gr3_lrg.jpg jpg 150726 931 1508 IMAGE-HIGH-RES 1-s2.0-S0926860X21001903-si1.svg https://s3-eu-west-1.amazonaws.com/prod-ucs-content-store-eu-west/content/pii:S0926860X21001903/STRIPIN/image/svg+xml/20cb7c92802e93fd4113a9aad1314ff0/si1.svg si1 si1.svg svg 72255 ALTIMG 1-s2.0-S0926860X21001903-si2.svg https://s3-eu-west-1.amazonaws.com/prod-ucs-content-store-eu-west/content/pii:S0926860X21001903/STRIPIN/image/svg+xml/c88cba44f931976d9521f57a1069f480/si2.svg si2 si2.svg svg 86437 ALTIMG 1-s2.0-S0926860X21001903-am.pdf am am.pdf pdf 1281781 AAM-PDF https://s3-eu-west-1.amazonaws.com/prod-ucs-content-store-eu-west/content/egi:10RK7S5PDF3/MAIN/application/pdf/a2adc4340782b4f3d5f817fe5f17bbcb/am.pdf APCATA 118176 118176 S0926-860X(21)00190-3 10.1016/j.apcata.2021.118176 Elsevier B.V. Fig. 1 13C cross polarization (CP) magic angle spinning (MAS) NMR spectra of the as-synthesized CHA zeolites. Fig. 1 Fig. 2 (a, left) Powder X-ray diffraction (PXRD) patterns, (a, right) scanning electron microscope (SEM) images, (b) 31P MAS NMR spectra, and (c) N2 adsorption isotherms of the CHA zeolite catalysts containing different degrees of phosphorus modification (H-form). Fig. 2 Fig. 3 (a) 27Al and (b) 29Si MAS NMR spectra of the CHA zeolite catalysts containing different degrees of phosphorus modification (H-form). Fig. 3 Fig. 4 NH3-temperature programmed desorption (TPD) curves of the CHA zeolite catalysts containing different degrees of phosphorus modification (H-form). Fig. 4 Fig. 5 Changes in the methanol conversion and the product selectivities as a function of time-on-stream over the CHA zeolite catalysts containing different degrees of phosphorus modification. Reaction conditions: P(MeOH), 5 kPa; W/F =34 g h mol−1; reaction temp., 623 K. ○: Conversion, ◼: ethene, ◇: propene, ▲: butene, ◆: C1–C4 paraffin, △: over C5. Fig. 5 Fig. 6 13C CP MAS NMR spectra of the CHA zeolite catalysts after 1 h of MTO reaction. The black triangles in the 13C NMR spectra indicate the spinning side bands. Fig. 6 Fig. 7 (a) XRD patterns and (b) 27Al MAS NMR spectra of the CHA zeolite catalysts after the methanol-to-olefin (MTO) reaction. (c) 31P MAS NMR spectra of the CHA zeolite catalysts before and after the MTO reaction. Fig. 7 Fig. 8 (a) Thermogravimetric differential thermal analysis (TG-DTA) curves and (b) 13C CP MAS NMR spectra of the CHA zeolite catalysts after the MTO reaction. The black triangles in the 13C NMR spectra indicate the spinning side bands. Fig. 8 Fig. 9 1H MAS NMR spectra of the CHA zeolite catalysts after the MTO reaction and the relationship between the relative area ratios of the peak at 1.2 ppm and the P/Al ratio. The bottom lines indicate the deconvoluted and corresponding fitting curves of each spectrum. Fig. 9 Table 1 Characteristics of the phosphorus-modified CHA zeolite catalysts containing different degrees of phosphorus modification. Table 1 Catalyst Si/Al a P/Al a Micropore volume b [cm3 g−1] External surface area b [m2 g−1] CHA 12.3 – 0.35 12 P-CHA(0.19) 12.5 0.19 0.32 8.3 P-CHA(0.44) 9.9 0.44 0.28 7.7 a Determined using inductively coupled plasma optical emission spectroscopy (ICP-OES). b Determined using the t-plot method. Controlling hydrocarbon oligomerization in phosphorus-modified CHA zeolite for a long-lived methanol-to-olefin catalyst Nao Tsunoji a * Ryota Osuga b Masumi Yasumoto a Toshiyuki Yokoi b * a Graduate School of Advanced Science and Engineering, Hiroshima University, Kagamiyama 1-4-1, Higashi, Hiroshima, 739-8527, Japan Graduate School of Advanced Science and Engineering Hiroshima University Kagamiyama 1-4-1 Higashi Hiroshima 739-8527 Japan Graduate School of Advanced Science and Engineering, Hiroshima University, Kagamiyama 1-4-1, Higashi-Hiroshima 739-8527, Japan b Institute for Innovative Research, Tokyo Institute of Technology, 4259 Nagatsuta, Midori-ku, Yokohama, 226-8503, Japan Institute for Innovative Research Tokyo Institute of Technology 4259 Nagatsuta Midori-ku Yokohama 226-8503 Japan Institute for Innovative Research, Tokyo Institute of Technology, 4259 Nagatsuta, Midori-ku, Yokohama 226-8503, Japan ⁎ Corresponding authors. Graphical abstract The catalytic performance of phosphorus-modified CHA zeolites, synthesized by direct phosphorus modification using tetraethylphosphonium as a phosphorus-modifying agent (P-MA), was investigated for the methanol-to-olefin (MTO) reaction. Comparative catalytic testing in the MTO reaction revealed that the phosphorus modification effectively prolonged the catalyst lifetime while hardly affecting the ethene and propene selectivities. The initial ethene and propene selectivities over CHA zeolite with P/Al ratio of 0.44 were 28.7 and 37.5 C %, respectively, and the catalytic life time improved from 4 to 7 h compared with the catalyst without phosphorus modification. The relative amount of non-aromatic hydrocarbons retained in the zeolite catalysts with respect to those of the aromatic ones increased with increasing degree of phosphorus modification. This demonstrates that the suppression of excess oligomerization of the hydrocarbon species results in a prolonged lifetime in the phosphorus-modified catalyst. Keywords CHA zeolite Hydrothermal conversion of zeolite Phosphorus modification Phosphorus modifying agent Interzeolite conversion Methanol to olefin reaction 1 Introduction Solid acid catalysts exhibiting molecular sieving abilities, such as porous aluminosilicate zeolite and silicoaluminophosphate (SAPO) materials, are important industrial materials that selectively produce desired products owing to the intrinsic acidity of the crystalline porous framework. The use of molecular sieve catalysts in the methanol-to-olefin (MTO) reaction is the most successful process for the production of olefins from non-petroleum-derived carbon sources, such as coal and natural gas [1–6]. Recently, the rapidly increasing demand for light olefins (such as ethene and propene) and the diminishing crude oil reserves have triggered increased academic and industrial attention towards the MTO reaction [7–17]. Among the various structural categories, small-pore zeolites and related zeotypes with eight-member ring pores (8MR) and large cavities, such as CHA, AEI, and LEV (the three characters refer to the framework type code) [18], are known to be highly selective catalysts for the production of ethene and propene through the MTO reaction [1,13,19–27]. SAPO-34, a silicoaluminophosphate counterpart of CHA zeolite, has been commercially used in a MTO plant since 2010 [3]. However, because of the rapid deactivation of these materials through coke deposition, a fluidized bed reactor with a reaction-regeneration cycle is applied in the industrial MTO process [3]. Thus, the catalyst lifetime has to be extended as this will improve the process profitability. Based on this, strategies to make the long-lived small-pore MTO catalysts (such as controlling the pore structure, composition, crystal morphology, and acid properties) have attracted significant research attention [1,5–7,12,22,26,28–32]. In this study, we attempt to prolong the catalyst lifetime for the MTO reaction by modifying the aluminosilicate CHA zeolite with phosphorus. The modification of zeolites by phosphoric acid is a promising way to enhance the catalytic durability in a variety of hydrocarbon transformations, including the MTO reaction [33–39]. The introduced phosphorus oxide interacts with the framework aluminum, thus suppressing the excessive acidity of the zeolite. Mild acidity prevents excess oligomerization causing coke deposition and structural collapse by the release of framework aluminum (de-alumination) under the hydrothermal reaction conditions [37]. However, although the modification of large-pore 10MR (such as MFI) zeolites with phosphorus and its effectiveness on the MTO reaction have been extensively investigated [33–35,37,34–39], conventional post-modification (impregnation) is not possible for small-pore zeolites because of diffusion limitations in the narrow pores. Thus, we synthesized a phosphorus-modified CHA zeolite by direct-phosphorus modification using alkylphosphonium as a phosphorus-modifying agent (P-MA). Sano and Tsunoji et al. investigated zeolite synthesis using FAU zeolite as the starting material (e.g., interzeolite conversion and zeolite hydrothermal conversion) in the presence of tetramethyl or tetraethylphosphonium hydroxides and successfully synthesized phosphorus-modified small-pore zeolites [40–47]. In this method, P-MA is incorporated into the zeolite structure while interacting with the framework during the hydrothermal synthesis. This is similar to the template role played by alkylammonium when acting as an organic structure-directing agent (OSDA). Subsequently, the calcination treatment induces the decomposition and oxidation of P-MA, leading to the formation of phosphoric oxides or acids that interact with the zeolite framework [42,43]. This modification can be applied to different types of zeolite frameworks if appropriate co-existing alkylammonium molecules are selected. To date, the direct phosphorus modification of small-pore zeolites with different framework structures, including AFX, AEI, CHA, and LEV, has been performed [43,45,48,49]. In addition, the high resistance against structural collapse (de-alumination) of the phosphorus-modified samples prepared using the direct method resulted in remarkably higher thermal/hydrothermal stability than that of the unmodified counterpart, and excellent catalytic durability in the selective reduction of NOx with NH3 (NH3-SCR) [43,45,48,49]. However, the catalytic properties of phosphorus-modified small-pore zeolites have hardly been investigated in the transformation of hydrocarbons and alcohols, despite the importance of these reactions in the chemical industry. Kakiuchi et al. [45] reported the high thermal stability of phosphorus-modified CHA zeolites in the transformation of ethanol to olefin, but where there were no differences between the product selectivity or catalyst lifetime of the modified and unmodified samples. Therefore, in this study, we prepared CHA zeolite catalysts containing different degrees of phosphorus modification and tested their catalytic performance in the MTO reaction. The zeolite samples before and after the MTO reaction were carefully characterized using a combinational analysis method to determine the influence of phosphorus modification on the catalyst lifetime. 2 Experimental 2.1 Preparation of the zeolite catalysts The CHA zeolites were hydrothermally synthesized according to a previously reported method [43,45] using trimethyladamanthylammonium hydroxide (TMAdaOH, 25 wt.%, Tokyo Chemical Ind. Co. Ltd., Japan) and tetraethylphosphonium hydroxide (TEPOH) as the OSDA and P-MA, respectively. TEPOH was prepared by treating tetraethylphosphonium bromide (TEPBr, > 98 %, Tokyo Chemical Ind. Co., Japan) with a hydroxide anion exchange resin (DIAION SA10AOH, Mitsubishi Chemical Co., Japan). Dealuminated FAU zeolite (Si/Al = 16), obtained by the treatment of commercial FAU zeolite (HSZ360HUA, Si/Al = 6.8, Tosoh Co., Japan) with sulfuric acid, was used as the silica/alumina source. Sodium hydroxide (> 99 %, NaOH, Kojundo Chemical Laboratory) was used as the alkaline source. TMAdaOH, TEPOH, NaOH, distilled water, and dealuminated FAU zeolite were mixed to obtain a synthesis gel with a composition of 1:0.0625:0.3∼0.03:0∼0.27:0.1:7.5 of Si/Al/TMAdaOH/TEPOH/NaOH/H2O. The resultant gel was transferred to a 100-cm3 Teflon-lined stainless steel autoclave (stirring-type hydrothermal synthesis reactor, R-100, Hiro Company, Japan) and heated to 150 °C for 7 days at 10 rpm. The obtained solid product was separated by centrifugation and washed thoroughly with deionized water until the pH of the supernatant was close to neutral. The solid was dried overnight at 70 °C yielding the as-synthesized sample. To remove the OSDA from within the sample (and to decompose the P-MA), the as-made zeolites were calcined in air at 600 °C for 10 h (heating rate of 1 °C min−1). Subsequently, the Na+ ions in the calcined zeolites were removed by performing three ion-exchange operations with an aqueous solution of ammonium nitrite (1.5 mol L−1) at 60 °C for 2 h. The obtained NH4 form of the zeolite was calcined at 450 °C for 6 h, yielding the H-form of the zeolite catalysts (CHA, P−CHA(0.19), and P−CHA(0.44)). The degree of phosphorus modification was controlled by the amounts of TMAdaOH and TEPOH in the synthesis gel. The TMAdaOH/Si and TEPOH/Si ratios were set as 0.3 and 0 for CHA, 0.05 and 0.25 for P−CHA(0.19), and 0.03 and 0.27 for P−CHA(0.44). 2.2 Characterization The X-ray diffraction (XRD) measurements were performed on a powder X-ray diffractometer (Bruker, PHASER) using graphite-monochromatized Cu Kα radiation at 30 kV and a tube current of 10 mA. Elemental analysis (Si/Al and P/Al ratio) was performed by inductively coupled plasma optical emission spectroscopy (ICP-OES, Seiko SPS7000). The crystal morphology of the sample was observed using a Hitachi S-4800 scanning electron microscope (SEM). Magic angle spinning (MAS) NMR spectra were collected on an NMR spectrometer (Varian 600PS). The resonance frequencies for 1H, 13C, 27Al, 29Si, and 31P NMR experiments were 600, 151, 156, 119, and 243 MHz, respectively. A zirconia rotor with a 3.2 mm diameter at a rotation speed of 15 kHz was used for the 1H, 27Al, and 31P NMR studies, whereas a 6 mm diameter zirconia rotor at a speed of 7 kHz was used for the 13C and 29Si NMR studies. The chemical shifts for the 1H, 13C, 27Al, 29Si, and 31P MAS NMR spectra were referenced using adamantane, hexamethylbenzene, AlK(SO4)2 12H2O, 3-(trimethylsilyl)propionic-2,2,3,3-d4 acid, and ammonium dihydrogen phosphate, respectively. Prior to the 27Al NMR measurements, the samples were moisture-equilibrated using a saturated solution of ammonium chloride for 24 h. Nitrogen adsorption isotherms were obtained using a volumetric apparatus provided by Bel Japan (BELSORPmini) at a measurement temperature of −196 °C. The zeolite sample was heated at 400 °C for 10 h under N2 flow before conducting the measurements. The distribution of acidity in the zeolite samples was determined at 100–700 °C by measuring the NH3 temperature-programmed desorption (NH3-TPD) curves with a catalyst analyzer (Belcat II, MicrotracBEL, Japan). Helium was used as the carrier gas for the measurements. The samples (∼50 mg) were preheated at 450 °C under a flow of helium (50 mL min−1) and ammonia (NH3/He = 1:99, v/v) was adsorbed at 100 °C. After removing the excess adsorbed ammonia by flushing with helium at 100 °C for 30 min, the samples were heated at a rate of 10 °C min−1. 2.3 MTO reaction The MTO reaction was conducted over the protonated zeolite catalysts at 350 °C in a flow microreactor. Zeolite pellets (100 mg, 50/80 mesh) were loaded into a quartz tubular with a 6 mm inner diameter without a binder. The length of catalyst layer set ca. 16 mm. Helium was used as the carrier gas, and the methanol pressure was set at 5 kPa. The weight to flow (W/F) ratio for methanol was set at 34 g-cat h mol−1. The catalyst was treated under flowing helium at 500 °C for 2 h before the reaction. The MTO reaction products (ethene, propene, butene, paraffins (C1 − C4), over-C5 hydrocarbons, and dimethyl ether (DME)) were analyzed using an on-line gas chromatograph (GC-2014, Shimadzu) equipped with an HPPLOT/Q capillary column and an FID detector. The methanol conversion and product selectivities were calculated based on the carbon number. The selectivities of the products were based on the carbon numbers from the effluent of the reactor. The conversion of methanol and selectivity of the products was calculated by the formula below. C o n v e r s i o n o f r e a c t a n t s = 100 - C - a t o m s o f M e t h a n o l ( o u t p u t ) C - a t o m s o f M e t h a n o l ( i n p u t ) x 100 P r o d u c t d i s t r i b u t i o n = C - a t o m s o f t h e p r o d u c t ( C - a t o m s o f M e t h a n o l ( i n p u t ) - C - a t o m s o f M e t h a n o l ( o u t p u t ) x 100 3 Results and discussion The degree of phosphorus modification was adjusted by varying the amounts of P-MA and TMAda, a typical OSDA for CHA zeolites, in the synthesis gel [43,45]. We used FAU zeolite with a Si/Al ratio of 16 as the silica/alumina source and hydrothermally converted it into the CHA zeolite. As shown in the 13C cross-polarization MAS NMR spectra (Fig. 1 ) of the as-synthesized samples, the existence of both P-MA and OSDA is confirmed by the resonance attributed to the tetraethylphosphonium and TMAda cations [43,45]. The relative peak intensity of the tetraethylphosphonium cation increases with an increase in the amount of P-MA in the synthesis gel, while that of the TMAda cation hardly changes. To fabricate the H-form of the zeolite catalysts, the as-synthesized samples were calcined at 600 °C for 10 h and then protonated by ammonium nitrate treatment. The obtained phosphorus-free zeolite catalyst is denoted as CHA and the phosphorus-modified samples are denoted as P−CHA(x), where x indicates the P/Al ratio. Table 1 lists the structural characteristics of the catalysts. We successfully obtained samples with different P/Al ratios (P/Al = 0, 0.19, and 0.44) without significant changes in the Si/Al ratio (approximately 10). The high crystallinity of the materials was confirmed by the strong peak intensities of the powder XRD (PXRD) patterns (Fig. 2 a, left). The peak positions of the samples are consistent with those of the CHA crystal [18] and there were no peaks attributed to the unconverted, starting FAU zeolite nor the impurity phase. Scanning electron microscopy (Fig. 2a, right) reveals that the morphologies of all the CHA samples are similar, where cubic particles with diameters of approximately 0.5–1 μm are observed. The 31P MAS NMR spectra of P−CHA(0.19) and P−CHA(0.44) exhibit resonances from 0 to -40 ppm, and peaks corresponding to tetraethylphosphonium (typically at ∼ 40 ppm) are not observed (Fig. 2b). This confirms successful phosphorus modification via the decomposition of P-MA to phosphorus oxide species, which interact with aluminum in the zeolite framework [43,45,46]. The N2 adsorption isotherms of all the samples exhibit type-I behavior, suggesting that the samples comprise only micropores (Fig. 2c). The relatively high micropore volumes, listed in Table 1, also confirm the high purity of the microporous materials. The microporous volume gradually decreased with an increase in the P/Al ratio of the samples. However, the micropore volume was relatively high even after phosphorus modification, inhibiting excess pore blocking by the phosphorus species and indicating homogeneous phosphorus distribution, similar to previous reports [43,45]. Owing to the similarity in the morphologies of the particles, the external surface areas of the samples were almost identical (approximately 10 m2 g−1). The 27Al MAS NMR spectra (Fig. 3 a) exhibit a dominant peak at 59 ppm corresponding to the aluminum atom tetrahedrally coordinated to four − OSi bonds [5,31], indicating that almost all the aluminum is present in the zeolite framework [5,31]. In contrast, the resonances at approximately 0 and -9 ppm can be assigned to octahedrally coordinated aluminum. The former and latter are due to extra-framework aluminum interacting with water and phosphoric oxide, respectively [34]. In the 29Si MAS NMR spectra (Fig. 3b), three resonances attributed to Q4(2Al) (Si(OAl)2(OSi)2), Q4(1Al) Si(OAl)(OSi)3, and Q4(0Al) Si(OSi)4 are present at -101, -105, and -111 ppm, respectively [5,31]. The relative peak areas of the Q4(2Al), Q4(1Al), and Q4(0Al) structures are 3%, 23 %, and 74 % for CHA, 5%, 21 %, and 74 % for P−CHA(0.19), and 4%, 20 %, and 76 % for P−CHA(0.44), respectively. These similarities in the 29Si chemical states indirectly suggest that the aluminum distribution is similar in all the samples [5]. To investigate the influence of the phosphorus modification on the acidic properties of the zeolite, NH3-TPD was conducted (Fig. 4 ). The unmodified catalyst (CHA) exhibited desorption peaks at different temperatures. The peaks at approximately 540 and 220 °C arise from NH3 desorbed from the weak and strong acid sites, respectively [1,31]. Asymmetric desorption behavior in weak acid site of the P−CHA(0.44) is probably due to the physically adsorbed NH3 on the phosphorus introduced. With an increase in the degree of phosphorus modification, the intensity of the high-temperature peak decreases and that of the middle-temperature peak, at approximately 350 °C, increases. The amounts of strong acid sites determined by the TPD profiles were 0.60, 0.48, and 0.47 mmol g−1 for CHA, P−CHA(0.19), and P−CHA(0.44), respectively, whereas that of middle-temperature peaks 0.04, 0.07, and 0.11 mmol g−1 for CHA, P−CHA(0.19), and P−CHA(0.44), respectively. The change in the acidic properties of the materials after phosphorus introduction is consistent with that observed in a previous study, wherein phosphorus-modified MFI and other zeolites were reported [34,38,45]. This characteristic of the zeolites clearly indicates that the phosphorus species introduced via P-MA interacted with the aluminum in the zeolite framework and reduced the strength of the acid sites. Although there are no liner correlation between the P/Al ratio and the degree of decrease in the strong acid site, this is probably due to the difference in the connecting environment between the phosphorus species introduced. Fig. 5 compares the catalytic performances of the zeolite catalysts containing different degrees of phosphorus modification in the MTO reaction. In the initial stage of the reaction until 1 h of time on stream, the significant change in product selectivity were observed. Especially, the selectivities to ethene and propene were increased, while those to C1–C4 paraffins were decreased from the initial point to 1 h of time on stream. However, in the case of the P−CHA(0.44), the differences in the selectivity between the initial and 1 h of time on stream tend to be smaller than these of other catalysts. In the hydrocarbon pool mechanism in MTO reaction, intermediate aromatics or cyclic alkenes considered to be stored in the zeolite cage after induction period [2]. To gain insight into the intermediate species retained in the zeolites, 13C CP MAS NMR measurement was performed in the catalysts after 1 h of reaction (Fig. 6 ). All catalysts exhibited the resonances at 128 and 30 ppm, assigned to the hydrocarbon pool species in the MTO reaction (methylbenzene etc.), whereas the presence proportions of each carbon species were different among the catalysts. CHA additionally gave sharp resonances at 16 and 59 ppm attributed to dimethyl ether, which is an intermediate in an early stage of the MTO reaction. Therefore, the hydrocarbon pool species and/or initial oligomerization pathway to form hydrocarbon pool species was varied among the samples, which consider to affect the initial product selectivity. For longer reaction time than 1 h, the change in the selectivity was moderated and the relatively high selectivity of ethene and propene were observed in all samples. The ethene and propene selectivities after 1 h of time-on-stream were 23.0 and 38.5 C % for CHA, 23.9 and 39.6 C % for P−CHA(0.19), and 28.7 and 37.5 C % for P−CHA(0.44). Although the propene product selectivities varied according to the time-on-stream, the maximum values barely differed between the reactions performed using the phosphorus-modified and unmodified catalysts. The sum of selectivities of ethene and propene (around 60–80 C %) in the catalysts in this study were comparable to that of SAPO-34 [12,28,29], a silicoaluminophosphate counterpart of CHA zeolite. The selectivities towards other products were relatively low (approximately 5–15 C % at the end of the reaction). These results indicate that it is not the phosphorus modification that is a major factor in light olefin selectivity, but the topology of the CHA zeolite. This result is not contradicted by previous results, which indicate that pore structure is the dominant factor for determining the product selectivity in the MTO reaction [6,22]. In contrast, the catalyst lifetimes were strongly dependent on the P/Al ratio of the catalysts. Although all the catalysts became deactivated after a specific time-on-stream, a conversion of less than 50 % was observed after 4, 5, and 7 h for CHA, P−CHA (0.19), and P−CHA (0.44), respectively. This clearly indicates the suppression of catalyst deactivation by phosphorus modification. In contrast to the small effect of phosphorus modification on the ethene and propene selectivity, CHA and P−CHA(0.19) exhibited relatively high selectivities towards C1–C4 paraffins (19.3 and 16.5 C % for 1 h) compared to that of the long-lived P−CHA(0.44) (11.1 C % for 1 h). In addition, when the propene and butene selectivities in relatively long time on stream was compared between the samples, P−CHA(0.44) tend to exhibit lower selectivities of these products. Considering that such differences is observed in the deactivation period with lower conversion of methanol, the high propene and butene selectivity in CHA and P−CHA(0.19) is likely derived from the differences in the hydrocarbon species near the end of the reaction, implying the change in the acid property among the samples. Deactivation of the MTO catalyst is often connected to paraffin production, which requires hydrogen formed from the dehydrogenation of unsaturated hydrocarbons [22,31]. Thus, the differences in deactivation among the catalysts are likely due to the oligomerization behavior of the hydrocarbons. In contrast, deactivation arising from the structural collapse of the zeolite framework is negligible. As shown in the XRD patterns and 27Al MAS NMR spectra (Fig. 7 a, b), the crystal structure of the CHA zeolite and the tetrahedral coordination of the framework aluminum were preserved in all the samples, even after the MTO reaction. The broad resonance and diffraction peaks are probably due to the deposited coke and the corresponding distortion of the zeolite framework. Although the corresponding 31P MAS NMR spectra (Fig. 7c) retain the peaks ascribed to the phosphorus species that interact with the aluminum in the zeolite framework, they also contain resonances shifted to high-magnetic fields. This indicates that some of the phosphorus was incorporated into the zeolite framework and/or was condensed each other to form polyphosphate species. A similar phenomenon was observed in the phosphorus-modified zeolite after thermal and hydrothermal treatment [46,49]. To investigate the hydrocarbon species retained in the catalyst after the MTO reaction, thermogravimetric differential thermal analysis (TG-DTA) was performed. The weight loss, together with an exothermic reaction, was observed between 400 and 600 °C, confirming the combustion of the deposited coke species on the catalysts. The amount of coke at the end of the reaction, determined from the TG curves (Fig. 8 a, left), were 18.5 wt% for CHA, 20.0 wt% for P−CHA(0.19), and 19.2 wt% for P−CHA(0.44). Similar amounts of coke suggest that the maximum coke capacity among the catalysts was similar, which is not contradicted by the similar particle sizes of the samples. In contrast, the DTA curves of the phosphorus-modified samples tend to exhibit exothermic peaks at lower temperatures, implying the presence of more combustible species with different structural distributions. The chemical state of these hydrocarbons was directly observed by 13C CP MAS NMR spectroscopy (Fig. 8b). The resonances at 23 ppm and 38 ppm can be assigned to the non-aromatic (methyl and branched) carbons [14,15,17]. In contrast, the peaks between 130 and 150 ppm are attributed to aromatic carbons [12,23,27]. Unlike the aromatic carbon signals, the methyl carbon signal tends to increase with an increase in the degree of phosphorus modification of the catalyst. This revealed a decrease in the aromaticity of the hydrocarbon species when applying the phosphorus-modified catalyst, which can be explained by the suppression of oligomerization (polymerization) between the methyl-aromatic species (such as methyl benzene). Since polymerization of the aromatic ring involves hydrogen production, this hypothesis does not contradict the catalytic results, yielding higher amounts of paraffins in the un-modified sample. To gain quantitative insight into the structural distribution of the hydrocarbons, 1H MAS NMR measurements were conducted. Several resonances attributed to the protons of the hydrocarbons and hydroxy groups were observed. The signal at 1.2 ppm corresponds to the hydrogen atoms bound to the methyl and methylene carbon, while that at approximately 2–3.5 ppm is assigned to the proton in the methyl or branched carbons bound to the aromatic groups [12]. In addition, the peak at approximately 7.5 ppm is attributed to the hydrogen atoms of the aromatic rings [12]. In contrast, the resonances at approximately 5 and 10 ppm can be assigned to the proton atoms of the adsorbed water, zeolite acid sites and silanol groups with hydrogen-bonding, respectively [50]. To evaluate the degree of oligomerization of the hydrocarbons, the relative amount of non-aromatic proton was estimated based on the area of the peaks at 1.2 and 2–3.5 ppm and it plotted against the P/Al ratio of the sample (Fig. 9 ). The value increased with an increase in the P/Al ratio, confirming the inhibition of oligomerization and formation of polymerized aromatics. The formation of polycyclic aromatics from intermediate hydrocarbons caused the deactivation from coking, which was reported in a previous paper [12]. Considering that there were hardly any differences in the physicochemical properties of the samples, except for the loading level of phosphorus, we concluded that the phosphorus modification inhibited excess oligomerization and prolonged the lifetime of the catalyst employed in the MTO reaction. The modulation in the acidity by the phosphorus modification likely affect the hydrocarbon oligomeriztion in MTO reaction. However, the direct changing the reaction space of hydrocarbon by the phosphorus introduction should not be ignored because the modification also induced the decrease of micropore volume as shown in the result of N2 adsorption. 4 Conclusion Phosphorus-modified CHA zeolites with different P/Al ratios were synthesized and their catalytic performances in the MTO reaction were evaluated. The evaluation probed the effectiveness of modifying small-pore (CHA) zeolites with phosphorus in enhancing the catalytic lifetime of the MTO reaction. The characteristics of the zeolite catalysts before and after the reaction revealed that the the phosphorus modification tuned the oligomerization behavior of the hydrocarbons in the zeolite pore system to inhibit coke deposition. Since direct-phosphorus modification can be extended to various zeolite frameworks, it can contribute to diversifying durable and selective MTO catalysts. Reducing the amount of framework aluminum [22,31] and crystal size [9,11,28,29] are well-known methods for improving the catalytic durability in MTO reactions. However, the present phosphorus modification can be regarded as an additional tool for further improvement of the catalytic ability of the MTO reaction when it can be combined with different synthetic strategies. In addition, initial product selectivity and 13C NMR measurement suggest that the intermediate state of hydrocarbon during the MTO reaction was also affected from the phosphorus modification. Thus, considering the many mechanistic studies previously performed [2,32], this new type of phosphorus-modified catalyst would be an interesting addition to the scientific research field of MTO catalysis. CRediT author statement Nao Tsunoji: Conceptualization, Methodology, Writing- Original draft preparation, Writing- Reviewing and Editing, Ryota Osuga: Catalytic test and characterization of material, Writing - Original draft preparation, Writing- Reviewing and Editing, Masumi Yasumoto: Synthesis and characterization of material, Toshiyuki Yokoi: Conceptualization, Methodology, Writing- Original draft preparation, Writing- Reviewing and Editing. Declaration of Competing Interest The authors declare that they have no known competing financial interests or personal relationships that could have appeared to influence the work reported in this paper. Acknowledgments This research was partially supported by JSPS KAKENHI (Grant Numbers 18KK0136 and 20K15090) and the Core-to-Core Program. References [1] Q. Zhu J.N. Kondo T. Tatsumi S. Inagaki R. Ohnuma Y. Kubota Y. Shimodaira H. Kobayashi K. Domen J. Phys. Chem. C 111 2007 5409 5415 Q. Zhu, J.N. Kondo, T. Tatsumi, S. Inagaki, R. Ohnuma, Y. Kubota, Y. Shimodaira, H. Kobayashi, K. Domen, J. Phys. Chem. C, 111 (2007) 5409-5415. [2] U. Olsbye S. Svelle M. Bjørgen P. Beato T.V. Janssens F. Joensen S. Bordiga K.P. Lillerud Angew. Chem. Int. Ed. 51 2012 5810 5831 U. Olsbye, S. Svelle, M. Bjørgen, P. Beato, T.V. Janssens, F. Joensen, S. Bordiga, K.P. Lillerud, Angew. Chem. Int. Ed., 51 (2012) 5810-5831. [3] P. Tian Y. Wei M. Ye Z. Liu ACS Catal. 5 2015 1922 1938 P. Tian, Y. Wei, M. Ye, Z. Liu, ACS Catal., 5 (2015) 1922-1938. [4] M. Yoshioka T. Yokoi T. Tatsumi ACS Catal. 5 2015 4268 4275 M. Yoshioka, T. Yokoi, T. Tatsumi, ACS Catal., 5 (2015) 4268-4275. [5] T. Nishitoba N. Yoshida J.N. Kondo T. Yokoi Ind. Eng. Chem. Res. 57 2018 3914 3922 T. Nishitoba, N. Yoshida, J.N. Kondo, T. Yokoi, Ind. Eng. Chem. Res., 57 (2018) 3914–3922. [6] M. Dusselier M.E. Davis Chem. Rev. 118 2018 5265 5329 M. Dusselier, M.E. Davis, Chem. Rev., 118 (2018) 5265-5329. [7] J. Goetze F. Meirer I. Yarulina J. Gascon F. Kapteijn J. Ruiz-Martínez B.M. Weckhuysen ACS Catal. 7 2017 4033 4046 J. Goetze, F. Meirer, I. Yarulina, J. Gascon, F. Kapteijn, J. Ruiz-Martínez, B.M. Weckhuysen, ACS Catal., 7 (2017) 4033-4046. [8] I. Yarulina A.D. Chowdhury F. Meirer B.M. Weckhuysen J. Gascon Nat. Catal. 1 2018 398 411 I. Yarulina, A.D. Chowdhury, F. Meirer, B.M. Weckhuysen, J. Gascon, Nature Catalysis, 1 (2018) 398-411. [9] Q. Zhang G.R. Chen Y.Y. Wang M.Y. Chen G.Q. Guo J. Shi J. Luo J.H. Yu Chem. Mater. 30 2018 2750 2758 Q. Zhang, G.R. Chen, Y.Y. Wang, M.Y. Chen, G.Q. Guo, J. Shi, J. Luo, J.H. Yu, Chem. Mater., 30 (2018) 2750-2758. [10] J.H. Kang R. Walter D. Xie T. Davis C.Y. Chen M.E. Davis S.I. Zones ChemPhysChem 19 2018 412 419 J.H. Kang, R. Walter, D. Xie, T. Davis, C.Y. Chen, M.E. Davis, S.I. Zones, ChemPhysChem, 19 (2018) 412-419. [11] E.M. Gallego C. Li C. Paris N. Martín J. Martínez‐Triguero M. Boronat M. Moliner A. Corma Chem. Eur. J. 24 2018 14631 14635 E.M. Gallego, C. Li, C. Paris, N. Martín, J. Martínez‐Triguero, M. Boronat, M. Moliner, A. Corma, Chem. Eur. J., 24 (2018) 14631-14635. [12] Q. Peng G. Wang Z. Wang R. Jiang D. Wang J. Chen J. Huang ACS Sustain. Chem. Eng. 6 2018 16867 16875 Q. Peng, G. Wang, Z. Wang, R. Jiang, D. Wang, J. Chen, J. Huang, ACS Sustain. Chem. Eng., 6 (2018) 16867-16875. [13] W. Zhang J. Chen S. Xu Y. Chu Y. Wei Y. Zhi J. Huang A. Zheng X. Wu X. Meng ACS Catal. 8 2018 10950 10963 W. Zhang, J. Chen, S. Xu, Y. Chu, Y. Wei, Y. Zhi, J. Huang, A. Zheng, X. Wu, X. Meng, ACS Catal., 8 (2018) 10950-10963. [14] C. Wang J. Xu F. Deng ChemCatChem 12 2020 965 980 C. Wang, J. Xu, F. Deng, ChemCatChem, 12 (2020) 965-980. [15] D. Xiao X. Han X. Bao G. Hou F. Blanc RSC Adv. 9 2019 12415 12418 D. Xiao, X. Han, X. Bao, G. Hou, F. Blanc, RSC Advances, 9 (2019) 12415-12418. [16] D. Xiao S. Xu N.J. Brownbill S. Paul L.-H. Chen S. Pawsey F. Aussenac B.-L. Su X. Han X. Bao Chem. Sci. 9 2018 8184 8193 D. Xiao, S. Xu, N.J. Brownbill, S. Paul, L.-H. Chen, S. Pawsey, F. Aussenac, B.-L. Su, X. Han, X. Bao, Chem. Sci., 9 (2018) 8184-8193. [17] D. Xiao S. Xu X. Han X. Bao Z. Liu F. Blanc Chem. Sci. 8 2017 8309 8314 D. Xiao, S. Xu, X. Han, X. Bao, Z. Liu, F. Blanc, Chem. Sci., 8 (2017) 8309-8314. [18] International Zeolite Association: Structure Commission. Database of Zeolite Structures, http://www.iza-structure.org/. [19] T. Yokoi M. Yoshioka H. Imai T. Tatsumi Angew. Chem. Int. Ed. 48 2009 9884 9887 T. Yokoi, M. Yoshioka, H. Imai, T. Tatsumi, Angew. Chem. Int. Ed., 48 (2009) 9884-9887. [20] Y. Bhawe M. Moliner-Marin J.D. Lunn Y. Liu A. Malek M. Davis ACS Catal. 2 2012 2490 2495 Y. Bhawe, M. Moliner-Marin, J.D. Lunn, Y. Liu, A. Malek, M. Davis, ACS Catal., 2 (2012) 2490-2495. [21] Y. Kumita J. Gascon E. Stavitski J.A. Moulijn F. Kapteijn Appl. Catal. A-Gen. 391 2011 234 243 Y. Kumita, J. Gascon, E. Stavitski, J.A. Moulijn, F. Kapteijn, Appl. Catal. A-Gen., 391 (2011) 234-243. [22] M. Dusselier M.A. Deimund J.E. Schmidt M.E. Davis ACS Catal. 5 2015 6078 6085 M. Dusselier, M.A. Deimund, J.E. Schmidt, M.E. Davis, ACS Catal., 5 (2015) 6078-6085. [23] S. Xu A. Zheng Y. Wei J. Chen J. Li Y. Chu M. Zhang Q. Wang Y. Zhou J. Wang Angew. Chem. Int. Ed. 52 2013 11564 11568 S. Xu, A. Zheng, Y. Wei, J. Chen, J. Li, Y. Chu, M. Zhang, Q. Wang, Y. Zhou, J. Wang, Angew. Chem. Int. Ed., 52 (2013) 11564-11568. [24] P. Ferri C. Li C. Paris A. Vidal-Moya M. Moliner M. Boronat A. Corma ACS Catal. 9 2019 11542 11551 P. Ferri, C. Li, C. Paris, A. Vidal-Moya, M. Moliner, M. Boronat, A. Corma, ACS Catal., 9 (2019) 11542-11551. [25] J. Li Y. Wei J. Chen S. Xu P. Tian X. Yang B. Li J. Wang Z. Liu ACS Catal. 5 2015 661 665 J. Li, Y. Wei, J. Chen, S. Xu, P. Tian, X. Yang, B. Li, J. Wang, Z. Liu, ACS Catal., 5 (2015) 661-665. [26] J. Chen J. Li C. Yuan S. Xu Y. Wei Q. Wang Y. Zhou J. Wang M. Zhang Y. He Catal. Sci. Technol. 4 2014 3268 3277 J. Chen, J. Li, C. Yuan, S. Xu, Y. Wei, Q. Wang, Y. Zhou, J. Wang, M. Zhang, Y. He, Catalysis Science & Technology, 4 (2014) 3268-3277. [27] J. Li Y. Wei J. Chen P. Tian X. Su S. Xu Y. Qi Q. Wang Y. Zhou Y. He J. Am. Chem. Soc. 134 2012 836 839 J. Li, Y. Wei, J. Chen, P. Tian, X. Su, S. Xu, Y. Qi, Q. Wang, Y. Zhou, Y. He, J. Am. Chem. Soc., 134 (2012) 836-839. [28] G.J. Yang Y.X. Wei S.T. Xu J.R. Chen J.Z. Li Z.M. Li J.H. Yu R.R. Xu J. Phys. Chem. C 117 2013 8214 8222 G.J. Yang, Y.X. Wei, S.T. Xu, J.R. Chen, J.Z. Li, Z.M. Li, J.H. Yu, R.R. Xu, J. Phys. Chem. C, 117 (2013) 8214-8222. [29] Z.B. Li J. Martinez-Triguero P. Concepcion J.H. Yu A. Corma PCCP 15 2013 14670 14680 Z.B. Li, J. Martinez-Triguero, P. Concepcion, J.H. Yu, A. Corma, PCCP, 15 (2013) 14670-14680. [30] Q.M. Sun N. Wang D.Y. Xi M. Yang J.H. Yu Chem. Commun. 50 2014 6502 6505 Q.M. Sun, N. Wang, D.Y. Xi, M. Yang, J.H. Yu, Chem. Commun., 50 (2014) 6502-6505. [31] Q. Zhu J.N. Kondo R. Ohnuma Y. Kubota M. Yamaguchi T. Tatsumi Microporous Mesoporous Mater. 112 2008 153 161 Q. Zhu, J.N. Kondo, R. Ohnuma, Y. Kubota, M. Yamaguchi, T. Tatsumi, Microporous Mesoporous Mater., 112 (2008) 153-161. [32] J.R. Chen J.Z. Li Y.X. Wei C.Y. Yuan B. Li S.T. Xu Y. Zhou J.B. Wang M.Z. Zhang Z.M. Liu Catal. Commun. 46 2014 36 40 J.R. Chen, J.Z. Li, Y.X. Wei, C.Y. Yuan, B. Li, S.T. Xu, Y. Zhou, J.B. Wang, M.Z. Zhang, Z.M. Liu, Catal. Commun., 46 (2014) 36-40. [33] T. Blasco A. Corma J. Martinez-Triguero J. Catal. 237 2006 267 277 T. Blasco, A. Corma, J. Martinez-Triguero, J. Catal., 237 (2006) 267-277. [34] G. Zhao J. Teng Z. Xie W. Jin W. Yang Q. Chen Y. Tang J. Catal. 248 2007 29 37 G. Zhao, J. Teng, Z. Xie, W. Jin, W. Yang, Q. Chen, Y. Tang, J. Catal., 248 (2007) 29-37. [35] J. Liu C. Zhang Z. Shen W. Hua Y. Tang W. Shen Y. Yue H. Xu Catal. Commun. 10 2009 1506 1509 J. Liu, C. Zhang, Z. Shen, W. Hua, Y. Tang, W. Shen, Y. Yue, H. Xu, Catal. Commun., 10 (2009) 1506-1509. [36] N. Xue X. Chen L. Nie X. Guo W. Ding Y. Chen M. Gu Z. Xie J. Catal. 248 2007 20 28 N. Xue, X. Chen, L. Nie, X. Guo, W. Ding, Y. Chen, M. Gu, Z. Xie, J. Catal., 248 (2007) 20-28. [37] H.E. van der Bij B.M. Weckhuysen Chem. Soc. Rev. 44 2015 7406 7428 H.E. van der Bij, B.M. Weckhuysen, Chem. Soc. Rev., 44 (2015) 7406-7428. [38] H.W. Huang X.J. Meng C. Chen M.X. Zhang Z. Meng C.Y. Li Q.K. Cui Catal. Lett. 146 2016 2357 2363 H.W. Huang, X.J. Meng, C. Chen, M.X. Zhang, Z. Meng, C.Y. Li, Q.K. Cui, Catal. Lett., 146 (2016) 2357-2363. [39] Y. Song L.L. Zhang G.D. Li Y.S. Shang X.M. Zhao T. Ma L.M. Zhang Y.L. Zhai Y.J. Gong J. Xu F. Deng Fuel Process. Technol. 168 2017 105 115 Y. Song, L.L. Zhang, G.D. Li, Y.S. Shang, X.M. Zhao, T. Ma, L.M. Zhang, Y.L. Zhai, Y.J. Gong, J. Xu, F. Deng, Fuel Process. Technol., 168 (2017) 105-115. [40] T. Maruo N. Yamanaka N. Tsunoji M. Sadakane T. Sano Chem. Lett. 43 2014 302 304 T. Maruo, N. Yamanaka, N. Tsunoji, M. Sadakane, T. Sano, Chem. Lett., 43 (2014) 302-304. [41] T. Sonoda T. Maruo Y. Yamasaki N. Tsunoji Y. Takamitsu M. Sadakane T. Sano J. Mater. Chem. A 3 2015 857 865 T. Sonoda, T. Maruo, Y. Yamasaki, N. Tsunoji, Y. Takamitsu, M. Sadakane, T. Sano, J. Mater. Chem. A, 3 (2015) 857-865. [42] Y. Kakiuchi Y. Yamasaki N. Tsunoji Y. Takamitsu M. Sadakane T. Sano Chem. Lett. 45 2016 122 124 Y. Kakiuchi, Y. Yamasaki, N. Tsunoji, Y. Takamitsu, M. Sadakane, T. Sano, Chem. Lett., 45 (2016) 122-124. [43] Y. Yamasaki N. Tsunoji Y. Takamitsu M. Sadakane T. Sano Microporous Mesoporous Mater. 223 2016 129 139 Y. Yamasaki, N. Tsunoji, Y. Takamitsu, M. Sadakane, T. Sano, Microporous Mesoporous Mater., 223 (2016) 129-139. [44] S.V. Priya T. Ohnishi Y. Shimada Y. Kubota T. Masuda Y. Nakasaka M. Matsukata K. Itabashi T. Okubo T. Sano Bull. Chem. Soc. Jpn. 91 2017 355 361 S.V. Priya, T. Ohnishi, Y. Shimada, Y. Kubota, T. Masuda, Y. Nakasaka, M. Matsukata, K. Itabashi, T. Okubo, T. Sano, Bull. Chem. Soc. Jpn., 91 (2017) 355-361. [45] Y. Kakiuchi T. Tanigawa N. Tsunoji Y. Takamitsu M. Sadakane T. Sano Appl. Catal. A Gen. 575 2019 204 213 Y. Kakiuchi, T. Tanigawa, N. Tsunoji, Y. Takamitsu, M. Sadakane, T. Sano, Appl. Catal. A Gen., 575 (2019) 204-213. [46] P. Zhao B. Boekfa T. Nishitoba N. Tsunoji T. Sano T. Yokoi M. Ogura M. Ehara Microporous Mesoporous Mater. 294 2020 109908 P. Zhao, B. Boekfa, T. Nishitoba, N. Tsunoji, T. Sano, T. Yokoi, M. Ogura, M. Ehara, Microporous Mesoporous Mater., 294 (2020) 109908. [47] H. Kubota C. Liu T. Amada K. Kon T. Toyao Z. Maeno K. Ueda A. Satsuma N. Tsunoji T. Sano Catal. Today 2020 10.1016/j.cattod.2020.1007.1084 H. Kubota, C. Liu, T. Amada, K. Kon, T. Toyao, Z. Maeno, K. Ueda, A. Satsuma, N. Tsunoji, T. Sano, Catal. Today, (2020) DOI: 10.1016/j.cattod.2020.1007.1084. [48] K. Tsuchiya N. Tsunoji Y. Sasaki M. Uemura M. Onishi M. Sadakane T. Sano Microporous Mesoporous Mater. 309 2020 110540 K. Tsuchiya, N. Tsunoji, Y. Sasaki, M. Uemura, M. Onishi, M. Sadakane, T. Sano, Microporous Mesoporous Mater., 309 (2020) 110540. [49] M. Onishi N. Tsunoji M. Sadakane T. Sano Bull. Chem. Soc. Jpn. 2020 10.1246/bcsj.20200224 M. Onishi, N. Tsunoji, M. Sadakane, T. Sano, Bull. Chem. Soc. Jpn., (2020) DOI: 10.1246/bcsj.20200224. [50] G. Paul C. Bisio I. Braschi M. Cossi G. Gatti E. Gianotti L. Marchese Chem. Soc. Rev. 47 2018 5684 5739 G. Paul, C. Bisio, I. Braschi, M. Cossi, G. Gatti, E. Gianotti, L. Marchese, Chem. Soc. Rev., 47 (2018) 5684-5739.",
      "scopus-id": "85105005080",
      "coredata": {
        "eid": "1-s2.0-S0926860X21001903",
        "dc:description": "The catalytic performance of phosphorus-modified CHA zeolites, synthesized by direct phosphorus modification using tetraethylphosphonium as a phosphorus-modifying agent (P-MA), was investigated for the methanol-to-olefin (MTO) reaction. Comparative catalytic testing in the MTO reaction revealed that the phosphorus modification effectively prolonged the catalyst lifetime while hardly affecting the ethene and propene selectivities. The initial ethene and propene selectivities over CHA zeolite with P/Al ratio of 0.44 were 28.7 and 37.5 C %, respectively, and the catalytic life time improved from 4 to 7 h compared with the catalyst without phosphorus modification. The relative amount of non-aromatic hydrocarbons retained in the zeolite catalysts with respect to those of the aromatic ones increased with increasing degree of phosphorus modification. This demonstrates that the suppression of excess oligomerization of the hydrocarbon species results in a prolonged lifetime in the phosphorus-modified catalyst.",
        "openArchiveArticle": "false",
        "prism:coverDate": "2021-06-25",
        "openaccessUserLicense": null,
        "prism:aggregationType": "Journal",
        "prism:url": "https://api.elsevier.com/content/article/pii/S0926860X21001903",
        "dc:creator": [
          {
            "@_fa": "true",
            "$": "Tsunoji, Nao"
          },
          {
            "@_fa": "true",
            "$": "Osuga, Ryota"
          },
          {
            "@_fa": "true",
            "$": "Yasumoto, Masumi"
          },
          {
            "@_fa": "true",
            "$": "Yokoi, Toshiyuki"
          }
        ],
        "link": [
          {
            "@_fa": "true",
            "@rel": "self",
            "@href": "https://api.elsevier.com/content/article/pii/S0926860X21001903"
          },
          {
            "@_fa": "true",
            "@rel": "scidir",
            "@href": "https://www.sciencedirect.com/science/article/pii/S0926860X21001903"
          }
        ],
        "dc:format": "application/json",
        "openaccessType": null,
        "pii": "S0926-860X(21)00190-3",
        "prism:volume": "620",
        "articleNumber": "118176",
        "prism:publisher": "Elsevier B.V.",
        "dc:title": "Controlling hydrocarbon oligomerization in phosphorus-modified CHA zeolite for a long-lived methanol-to-olefin catalyst",
        "prism:copyright": "© 2021 Elsevier B.V. All rights reserved.",
        "openaccess": "0",
        "prism:issn": "0926860X",
        "dcterms:subject": [
          {
            "@_fa": "true",
            "$": "CHA zeolite"
          },
          {
            "@_fa": "true",
            "$": "Hydrothermal conversion of zeolite"
          },
          {
            "@_fa": "true",
            "$": "Phosphorus modification"
          },
          {
            "@_fa": "true",
            "$": "Phosphorus modifying agent"
          },
          {
            "@_fa": "true",
            "$": "Interzeolite conversion"
          },
          {
            "@_fa": "true",
            "$": "Methanol to olefin reaction"
          }
        ],
        "openaccessArticle": "false",
        "prism:publicationName": "Applied Catalysis A: General",
        "openaccessSponsorType": null,
        "prism:pageRange": "118176",
        "pubType": "fla",
        "prism:coverDisplayDate": "25 June 2021",
        "prism:doi": "10.1016/j.apcata.2021.118176",
        "prism:startingPage": "118176",
        "dc:identifier": "doi:10.1016/j.apcata.2021.118176",
        "openaccessSponsorName": null
      },
      "objects": {
        "object": [
          {
            "@category": "standard",
            "@height": "212",
            "@width": "340",
            "@_fa": "true",
            "$": "https://api.elsevier.com/content/object/eid/1-s2.0-S0926860X21001903-gr6.jpg?httpAccept=%2A%2F%2A",
            "@multimediatype": "JPEG image file",
            "@type": "IMAGE-DOWNSAMPLED",
            "@size": "18860",
            "@ref": "gr6",
            "@mimetype": "image/jpeg"
          },
          {
            "@category": "standard",
            "@height": "273",
            "@width": "679",
            "@_fa": "true",
            "$": "https://api.elsevier.com/content/object/eid/1-s2.0-S0926860X21001903-gr5.jpg?httpAccept=%2A%2F%2A",
            "@multimediatype": "JPEG image file",
            "@type": "IMAGE-DOWNSAMPLED",
            "@size": "64063",
            "@ref": "gr5",
            "@mimetype": "image/jpeg"
          },
          {
            "@category": "standard",
            "@height": "383",
            "@width": "340",
            "@_fa": "true",
            "$": "https://api.elsevier.com/content/object/eid/1-s2.0-S0926860X21001903-gr8.jpg?httpAccept=%2A%2F%2A",
            "@multimediatype": "JPEG image file",
            "@type": "IMAGE-DOWNSAMPLED",
            "@size": "38151",
            "@ref": "gr8",
            "@mimetype": "image/jpeg"
          },
          {
            "@category": "standard",
            "@height": "345",
            "@width": "340",
            "@_fa": "true",
            "$": "https://api.elsevier.com/content/object/eid/1-s2.0-S0926860X21001903-gr7.jpg?httpAccept=%2A%2F%2A",
            "@multimediatype": "JPEG image file",
            "@type": "IMAGE-DOWNSAMPLED",
            "@size": "35337",
            "@ref": "gr7",
            "@mimetype": "image/jpeg"
          },
          {
            "@category": "standard",
            "@height": "308",
            "@width": "340",
            "@_fa": "true",
            "$": "https://api.elsevier.com/content/object/eid/1-s2.0-S0926860X21001903-gr9.jpg?httpAccept=%2A%2F%2A",
            "@multimediatype": "JPEG image file",
            "@type": "IMAGE-DOWNSAMPLED",
            "@size": "32723",
            "@ref": "gr9",
            "@mimetype": "image/jpeg"
          },
          {
            "@category": "standard",
            "@height": "434",
            "@width": "340",
            "@_fa": "true",
            "$": "https://api.elsevier.com/content/object/eid/1-s2.0-S0926860X21001903-gr2.jpg?httpAccept=%2A%2F%2A",
            "@multimediatype": "JPEG image file",
            "@type": "IMAGE-DOWNSAMPLED",
            "@size": "46272",
            "@ref": "gr2",
            "@mimetype": "image/jpeg"
          },
          {
            "@category": "standard",
            "@height": "200",
            "@width": "394",
            "@_fa": "true",
            "$": "https://api.elsevier.com/content/object/eid/1-s2.0-S0926860X21001903-ga1.jpg?httpAccept=%2A%2F%2A",
            "@multimediatype": "JPEG image file",
            "@type": "IMAGE-DOWNSAMPLED",
            "@size": "22632",
            "@ref": "ga1",
            "@mimetype": "image/jpeg"
          },
          {
            "@category": "standard",
            "@height": "270",
            "@width": "340",
            "@_fa": "true",
            "$": "https://api.elsevier.com/content/object/eid/1-s2.0-S0926860X21001903-gr1.jpg?httpAccept=%2A%2F%2A",
            "@multimediatype": "JPEG image file",
            "@type": "IMAGE-DOWNSAMPLED",
            "@size": "21372",
            "@ref": "gr1",
            "@mimetype": "image/jpeg"
          },
          {
            "@category": "standard",
            "@height": "168",
            "@width": "679",
            "@_fa": "true",
            "$": "https://api.elsevier.com/content/object/eid/1-s2.0-S0926860X21001903-gr4.jpg?httpAccept=%2A%2F%2A",
            "@multimediatype": "JPEG image file",
            "@type": "IMAGE-DOWNSAMPLED",
            "@size": "29666",
            "@ref": "gr4",
            "@mimetype": "image/jpeg"
          },
          {
            "@category": "standard",
            "@height": "210",
            "@width": "340",
            "@_fa": "true",
            "$": "https://api.elsevier.com/content/object/eid/1-s2.0-S0926860X21001903-gr3.jpg?httpAccept=%2A%2F%2A",
            "@multimediatype": "JPEG image file",
            "@type": "IMAGE-DOWNSAMPLED",
            "@size": "19334",
            "@ref": "gr3",
            "@mimetype": "image/jpeg"
          },
          {
            "@category": "thumbnail",
            "@height": "137",
            "@width": "219",
            "@_fa": "true",
            "$": "https://api.elsevier.com/content/object/eid/1-s2.0-S0926860X21001903-gr6.sml?httpAccept=%2A%2F%2A",
            "@multimediatype": "GIF image file",
            "@type": "IMAGE-THUMBNAIL",
            "@size": "6877",
            "@ref": "gr6",
            "@mimetype": "image/gif"
          },
          {
            "@category": "thumbnail",
            "@height": "88",
            "@width": "219",
            "@_fa": "true",
            "$": "https://api.elsevier.com/content/object/eid/1-s2.0-S0926860X21001903-gr5.sml?httpAccept=%2A%2F%2A",
            "@multimediatype": "GIF image file",
            "@type": "IMAGE-THUMBNAIL",
            "@size": "6986",
            "@ref": "gr5",
            "@mimetype": "image/gif"
          },
          {
            "@category": "thumbnail",
            "@height": "163",
            "@width": "145",
            "@_fa": "true",
            "$": "https://api.elsevier.com/content/object/eid/1-s2.0-S0926860X21001903-gr8.sml?httpAccept=%2A%2F%2A",
            "@multimediatype": "GIF image file",
            "@type": "IMAGE-THUMBNAIL",
            "@size": "7579",
            "@ref": "gr8",
            "@mimetype": "image/gif"
          },
          {
            "@category": "thumbnail",
            "@height": "163",
            "@width": "161",
            "@_fa": "true",
            "$": "https://api.elsevier.com/content/object/eid/1-s2.0-S0926860X21001903-gr7.sml?httpAccept=%2A%2F%2A",
            "@multimediatype": "GIF image file",
            "@type": "IMAGE-THUMBNAIL",
            "@size": "8235",
            "@ref": "gr7",
            "@mimetype": "image/gif"
          },
          {
            "@category": "thumbnail",
            "@height": "164",
            "@width": "181",
            "@_fa": "true",
            "$": "https://api.elsevier.com/content/object/eid/1-s2.0-S0926860X21001903-gr9.sml?httpAccept=%2A%2F%2A",
            "@multimediatype": "GIF image file",
            "@type": "IMAGE-THUMBNAIL",
            "@size": "9522",
            "@ref": "gr9",
            "@mimetype": "image/gif"
          },
          {
            "@category": "thumbnail",
            "@height": "163",
            "@width": "128",
            "@_fa": "true",
            "$": "https://api.elsevier.com/content/object/eid/1-s2.0-S0926860X21001903-gr2.sml?httpAccept=%2A%2F%2A",
            "@multimediatype": "GIF image file",
            "@type": "IMAGE-THUMBNAIL",
            "@size": "8785",
            "@ref": "gr2",
            "@mimetype": "image/gif"
          },
          {
            "@category": "thumbnail",
            "@height": "111",
            "@width": "219",
            "@_fa": "true",
            "$": "https://api.elsevier.com/content/object/eid/1-s2.0-S0926860X21001903-ga1.sml?httpAccept=%2A%2F%2A",
            "@multimediatype": "GIF image file",
            "@type": "IMAGE-THUMBNAIL",
            "@size": "9411",
            "@ref": "ga1",
            "@mimetype": "image/gif"
          },
          {
            "@category": "thumbnail",
            "@height": "164",
            "@width": "207",
            "@_fa": "true",
            "$": "https://api.elsevier.com/content/object/eid/1-s2.0-S0926860X21001903-gr1.sml?httpAccept=%2A%2F%2A",
            "@multimediatype": "GIF image file",
            "@type": "IMAGE-THUMBNAIL",
            "@size": "7700",
            "@ref": "gr1",
            "@mimetype": "image/gif"
          },
          {
            "@category": "thumbnail",
            "@height": "54",
            "@width": "219",
            "@_fa": "true",
            "$": "https://api.elsevier.com/content/object/eid/1-s2.0-S0926860X21001903-gr4.sml?httpAccept=%2A%2F%2A",
            "@multimediatype": "GIF image file",
            "@type": "IMAGE-THUMBNAIL",
            "@size": "3863",
            "@ref": "gr4",
            "@mimetype": "image/gif"
          },
          {
            "@category": "thumbnail",
            "@height": "135",
            "@width": "219",
            "@_fa": "true",
            "$": "https://api.elsevier.com/content/object/eid/1-s2.0-S0926860X21001903-gr3.sml?httpAccept=%2A%2F%2A",
            "@multimediatype": "GIF image file",
            "@type": "IMAGE-THUMBNAIL",
            "@size": "7369",
            "@ref": "gr3",
            "@mimetype": "image/gif"
          },
          {
            "@category": "high",
            "@height": "942",
            "@width": "1508",
            "@_fa": "true",
            "$": "https://api.elsevier.com/content/object/eid/1-s2.0-S0926860X21001903-gr6_lrg.jpg?httpAccept=%2A%2F%2A",
            "@multimediatype": "JPEG image file",
            "@type": "IMAGE-HIGH-RES",
            "@size": "142849",
            "@ref": "gr6",
            "@mimetype": "image/jpeg"
          },
          {
            "@category": "high",
            "@height": "1208",
            "@width": "3008",
            "@_fa": "true",
            "$": "https://api.elsevier.com/content/object/eid/1-s2.0-S0926860X21001903-gr5_lrg.jpg?httpAccept=%2A%2F%2A",
            "@multimediatype": "JPEG image file",
            "@type": "IMAGE-HIGH-RES",
            "@size": "420318",
            "@ref": "gr5",
            "@mimetype": "image/jpeg"
          },
          {
            "@category": "high",
            "@height": "1698",
            "@width": "1508",
            "@_fa": "true",
            "$": "https://api.elsevier.com/content/object/eid/1-s2.0-S0926860X21001903-gr8_lrg.jpg?httpAccept=%2A%2F%2A",
            "@multimediatype": "JPEG image file",
            "@type": "IMAGE-HIGH-RES",
            "@size": "281505",
            "@ref": "gr8",
            "@mimetype": "image/jpeg"
          },
          {
            "@category": "high",
            "@height": "1529",
            "@width": "1508",
            "@_fa": "true",
            "$": "https://api.elsevier.com/content/object/eid/1-s2.0-S0926860X21001903-gr7_lrg.jpg?httpAccept=%2A%2F%2A",
            "@multimediatype": "JPEG image file",
            "@type": "IMAGE-HIGH-RES",
            "@size": "273775",
            "@ref": "gr7",
            "@mimetype": "image/jpeg"
          },
          {
            "@category": "high",
            "@height": "1368",
            "@width": "1508",
            "@_fa": "true",
            "$": "https://api.elsevier.com/content/object/eid/1-s2.0-S0926860X21001903-gr9_lrg.jpg?httpAccept=%2A%2F%2A",
            "@multimediatype": "JPEG image file",
            "@type": "IMAGE-HIGH-RES",
            "@size": "248307",
            "@ref": "gr9",
            "@mimetype": "image/jpeg"
          },
          {
            "@category": "high",
            "@height": "1926",
            "@width": "1508",
            "@_fa": "true",
            "$": "https://api.elsevier.com/content/object/eid/1-s2.0-S0926860X21001903-gr2_lrg.jpg?httpAccept=%2A%2F%2A",
            "@multimediatype": "JPEG image file",
            "@type": "IMAGE-HIGH-RES",
            "@size": "379856",
            "@ref": "gr2",
            "@mimetype": "image/jpeg"
          },
          {
            "@category": "high",
            "@height": "886",
            "@width": "1744",
            "@_fa": "true",
            "$": "https://api.elsevier.com/content/object/eid/1-s2.0-S0926860X21001903-ga1_lrg.jpg?httpAccept=%2A%2F%2A",
            "@multimediatype": "JPEG image file",
            "@type": "IMAGE-HIGH-RES",
            "@size": "151117",
            "@ref": "ga1",
            "@mimetype": "image/jpeg"
          },
          {
            "@category": "high",
            "@height": "1196",
            "@width": "1508",
            "@_fa": "true",
            "$": "https://api.elsevier.com/content/object/eid/1-s2.0-S0926860X21001903-gr1_lrg.jpg?httpAccept=%2A%2F%2A",
            "@multimediatype": "JPEG image file",
            "@type": "IMAGE-HIGH-RES",
            "@size": "158542",
            "@ref": "gr1",
            "@mimetype": "image/jpeg"
          },
          {
            "@category": "high",
            "@height": "743",
            "@width": "3008",
            "@_fa": "true",
            "$": "https://api.elsevier.com/content/object/eid/1-s2.0-S0926860X21001903-gr4_lrg.jpg?httpAccept=%2A%2F%2A",
            "@multimediatype": "JPEG image file",
            "@type": "IMAGE-HIGH-RES",
            "@size": "241658",
            "@ref": "gr4",
            "@mimetype": "image/jpeg"
          },
          {
            "@category": "high",
            "@height": "931",
            "@width": "1508",
            "@_fa": "true",
            "$": "https://api.elsevier.com/content/object/eid/1-s2.0-S0926860X21001903-gr3_lrg.jpg?httpAccept=%2A%2F%2A",
            "@multimediatype": "JPEG image file",
            "@type": "IMAGE-HIGH-RES",
            "@size": "150726",
            "@ref": "gr3",
            "@mimetype": "image/jpeg"
          },
          {
            "@category": "thumbnail",
            "@_fa": "true",
            "$": "https://api.elsevier.com/content/object/eid/1-s2.0-S0926860X21001903-si1.svg?httpAccept=%2A%2F%2A",
            "@multimediatype": "Scalable Vector Graphics file",
            "@type": "ALTIMG",
            "@size": "72255",
            "@ref": "si1",
            "@mimetype": "image/svg+xml"
          },
          {
            "@category": "thumbnail",
            "@_fa": "true",
            "$": "https://api.elsevier.com/content/object/eid/1-s2.0-S0926860X21001903-si2.svg?httpAccept=%2A%2F%2A",
            "@multimediatype": "Scalable Vector Graphics file",
            "@type": "ALTIMG",
            "@size": "86437",
            "@ref": "si2",
            "@mimetype": "image/svg+xml"
          },
          {
            "@category": "standard",
            "@_fa": "true",
            "$": "https://api.elsevier.com/content/object/eid/1-s2.0-S0926860X21001903-am.pdf?httpAccept=%2A%2F%2A",
            "@multimediatype": "Acrobat PDF file",
            "@type": "AAM-PDF",
            "@size": "1281781",
            "@ref": "am",
            "@mimetype": "application/pdf"
          }
        ]
      },
      "link": {
        "@rel": "abstract",
        "@href": "https://api.elsevier.com/content/abstract/scopus_id/85105005080"
      }
    }
  }
}