{
  "metadata": {
    "title": "Effect of promoter Ce on silver-molybdenum-phosphate catalysts for selective oxidation of propane to acrolein",
    "authors": "; ; ",
    "journal": "Journal of Molecular Catalysis A: Chemical",
    "date": "2003-06-02",
    "doi": "10.1016/S1381-1169(03)00047-5",
    "abstract": "",
    "uri": "https://api.elsevier.com/content/article/pii/S1381116903000475",
    "pii": "S1381116903000475"
  },
  "fulltext": {
    "full-text-retrieval-response": {
      "scopus-eid": "2-s2.0-0038518330",
      "originalText": "serial JL 271358 291210 291744 291790 291809 31 Journal of Molecular Catalysis A: Chemical JOURNALMOLECULARCATALYSISACHEMICAL 2003-02-21 2003-02-21 2010-04-18T22:33:40 1-s2.0-S1381116903000475 S1381-1169(03)00047-5 S1381116903000475 10.1016/S1381-1169(03)00047-5 S300 S300.1 FULL-TEXT 1-s2.0-S1381116900X01690 2020-02-22T08:52:01.765088Z 0 0 20030602 2003 2003-02-21T00:00:00Z articleinfo crossmark dco dateupdated tomb dateloaded datesearch indexeddate issuelist volumelist yearnav absattachment articletitlenorm authfirstinitialnorm authfirstsurnamenorm cid cids contenttype copyright dateloadedtxt docsubtype doctype doi eid ewtransactionid hubeid issfirst issn issnnorm itemstage itemtransactionid itemweight openaccess openarchive pg pgfirst pglast pii piinorm pubdatestart pubdatetxt pubyr sortorder srctitle srctitlenorm srctype subheadings volfirst volissue webpdf webpdfpagecount figure table body acknowledge affil articletitle auth authfirstini authfull authkeywords authlast primabst ref specialabst alllist content subj ssids 1381-1169 13811169 200 200 1 2 1 2 Volume 200, Issues 1–2 32 291 300 291 300 20030602 2 June 2003 2003-06-02 2003 converted-article fla Copyright © 2003 Elsevier Science B.V. All rights reserved. EFFECTPROMOTERCESILVERMOLYBDENUMPHOSPHATECATALYSTSFORSELECTIVEOXIDATIONPROPANEACROLEIN ZHANG X 1 Introduction 2 Experimental 2.1 Catalyst preparation 2.2 Catalytic testing 2.3 Characterization 3 Results 3.1 Catalytic performance 3.1.1 Propane oxidation 3.1.2 Propene oxidation 3.2 Characterization 3.2.1 BET surface area and XRD characterization 3.2.2 TPR characterization 3.2.3 EPR characterization 3.2.4 XPS characterization 3.2.5 C3H8-TPD and C3H6-TPD characterization 4 Discussion 5 Conclusions Acknowledgements References CAVANI 1992 115 F LIN 2000 1 M BETTAHAR 1996 1 M KIM 1991 175 Y KIM 1990 491 Y KIM 1992 673 Y BARENS 1997 85 M TENG 1998 33 Y UEDA 2000 135 W LI 1999 357 W MICHAELS 1996 135 J LAACHIR 1991 1601 A NORMAND 1988 2561 F CHENG 1999 803 H WANG 1998 21 Z PARMALIANA 1997 347 A ARENA 1996 19995 F LAACHIR 1991 1601 A WANG 2000 219 W ABELLO 1998 185 M SANCIER 1971 270 K SANCIER 1971 270 K SORIA 1995 1669 J BARRAULT 1997 375 J COURTINE 1997 177 P CHEN 1999 85 H CERVASINI 1991 190 A GRABOWSKI 1995 129 R ZHANGX2003X291 ZHANGX2003X291X300 ZHANGX2003X291XX ZHANGX2003X291X300XX 2020-02-17T08:51:53.515Z http://vtw.elsevier.com/data/voc/AddOnTypes/50.7/nlp S1381116903000475 Ministry of Science and Technology G1999022408 MICYT Ministerio de Ciencia y TecnologÃ­a http://data.elsevier.com/vocabulary/SciValFunders/501100006280 http://sws.geonames.org/2510769/ This work is supported by the Ministry of Science and Technology (G1999022408). item S1381-1169(03)00047-5 S1381116903000475 1-s2.0-S1381116903000475 10.1016/S1381-1169(03)00047-5 271358 2010-10-04T20:42:28.831814-04:00 2003-06-02 1-s2.0-S1381116903000475-main.pdf https://s3.amazonaws.com/prod-ucs-content-store-us-east/content/pii:S1381116903000475/MAIN/application/pdf/7ff6cfffdd65703f42564794894be789/main.pdf https://s3-eu-west-1.amazonaws.com/prod-ucs-content-store-eu-west/content/pii:S1381116903000475/MAIN/application/pdf/7ff6cfffdd65703f42564794894be789/main.pdf main.pdf pdf true 194011 MAIN 10 1-s2.0-S1381116903000475-main_1.png https://s3.amazonaws.com/prod-ucs-content-store-us-east/content/pii:S1381116903000475/PREVIEW/image/png/2e6e42092b5a9c3a1c4c2ce2419fd000/main_1.png https://s3-eu-west-1.amazonaws.com/prod-ucs-content-store-eu-west/content/pii:S1381116903000475/PREVIEW/image/png/2e6e42092b5a9c3a1c4c2ce2419fd000/main_1.png main_1.png png 62425 849 656 IMAGE-WEB-PDF 1 1-s2.0-S1381116903000475-si1.gif https://s3.amazonaws.com/prod-ucs-content-store-us-east/content/pii:S1381116903000475/STRIPIN/image/gif/9a76c724bd4c09cce0b3f1ea82c1725f/si1.gif https://s3-eu-west-1.amazonaws.com/prod-ucs-content-store-eu-west/content/pii:S1381116903000475/STRIPIN/image/gif/9a76c724bd4c09cce0b3f1ea82c1725f/si1.gif si1 si1.gif gif 493 21 95 ALTIMG 1-s2.0-S1381116903000475-fx1.sml https://s3.amazonaws.com/prod-ucs-content-store-us-east/content/pii:S1381116903000475/fx1/THUMBNAIL/image/gif/a09219c39f98f95beb6b383bdde0178c/fx1.sml https://s3-eu-west-1.amazonaws.com/prod-ucs-content-store-eu-west/content/pii:S1381116903000475/fx1/THUMBNAIL/image/gif/a09219c39f98f95beb6b383bdde0178c/fx1.sml fx1 true fx1.sml sml 1496 53 125 IMAGE-THUMBNAIL 1-s2.0-S1381116903000475-fx1.jpg https://s3.amazonaws.com/prod-ucs-content-store-us-east/content/pii:S1381116903000475/fx1/DOWNSAMPLED/image/jpeg/be8fb861cb65aad87e46ded81ea8e40d/fx1.jpg https://s3-eu-west-1.amazonaws.com/prod-ucs-content-store-eu-west/content/pii:S1381116903000475/fx1/DOWNSAMPLED/image/jpeg/be8fb861cb65aad87e46ded81ea8e40d/fx1.jpg fx1 true fx1.jpg jpg 6577 95 226 IMAGE-DOWNSAMPLED 1-s2.0-S1381116903000475-gr1.sml https://s3.amazonaws.com/prod-ucs-content-store-us-east/content/pii:S1381116903000475/gr1/THUMBNAIL/image/gif/d9c0ace479cbe9ffe7a0d4bf389cd676/gr1.sml https://s3-eu-west-1.amazonaws.com/prod-ucs-content-store-eu-west/content/pii:S1381116903000475/gr1/THUMBNAIL/image/gif/d9c0ace479cbe9ffe7a0d4bf389cd676/gr1.sml gr1 gr1.sml sml 1794 86 125 IMAGE-THUMBNAIL 1-s2.0-S1381116903000475-gr1.gif https://s3.amazonaws.com/prod-ucs-content-store-us-east/content/pii:S1381116903000475/gr1/DOWNSAMPLED/image/gif/9a57a700362bceef76dbe9ac91a6fc47/gr1.gif https://s3-eu-west-1.amazonaws.com/prod-ucs-content-store-eu-west/content/pii:S1381116903000475/gr1/DOWNSAMPLED/image/gif/9a57a700362bceef76dbe9ac91a6fc47/gr1.gif gr1 gr1.gif gif 8842 281 407 IMAGE-DOWNSAMPLED 1-s2.0-S1381116903000475-gr2.sml https://s3.amazonaws.com/prod-ucs-content-store-us-east/content/pii:S1381116903000475/gr2/THUMBNAIL/image/gif/549950554c7daeb0389e109aefb49bbb/gr2.sml https://s3-eu-west-1.amazonaws.com/prod-ucs-content-store-eu-west/content/pii:S1381116903000475/gr2/THUMBNAIL/image/gif/549950554c7daeb0389e109aefb49bbb/gr2.sml gr2 gr2.sml sml 1716 80 125 IMAGE-THUMBNAIL 1-s2.0-S1381116903000475-gr2.gif https://s3.amazonaws.com/prod-ucs-content-store-us-east/content/pii:S1381116903000475/gr2/DOWNSAMPLED/image/gif/86dd71ce57a8aa7f0f4da5bf86e9e345/gr2.gif https://s3-eu-west-1.amazonaws.com/prod-ucs-content-store-eu-west/content/pii:S1381116903000475/gr2/DOWNSAMPLED/image/gif/86dd71ce57a8aa7f0f4da5bf86e9e345/gr2.gif gr2 gr2.gif gif 9124 269 418 IMAGE-DOWNSAMPLED 1-s2.0-S1381116903000475-gr3.sml https://s3.amazonaws.com/prod-ucs-content-store-us-east/content/pii:S1381116903000475/gr3/THUMBNAIL/image/gif/1467c288a7897133aeabff8bc5a434f1/gr3.sml https://s3-eu-west-1.amazonaws.com/prod-ucs-content-store-eu-west/content/pii:S1381116903000475/gr3/THUMBNAIL/image/gif/1467c288a7897133aeabff8bc5a434f1/gr3.sml gr3 gr3.sml sml 2130 93 115 IMAGE-THUMBNAIL 1-s2.0-S1381116903000475-gr3.gif https://s3.amazonaws.com/prod-ucs-content-store-us-east/content/pii:S1381116903000475/gr3/DOWNSAMPLED/image/gif/e2638e77bb3471dcdd90fc1ff81e3817/gr3.gif https://s3-eu-west-1.amazonaws.com/prod-ucs-content-store-eu-west/content/pii:S1381116903000475/gr3/DOWNSAMPLED/image/gif/e2638e77bb3471dcdd90fc1ff81e3817/gr3.gif gr3 gr3.gif gif 10167 265 327 IMAGE-DOWNSAMPLED 1-s2.0-S1381116903000475-gr4.sml https://s3.amazonaws.com/prod-ucs-content-store-us-east/content/pii:S1381116903000475/gr4/THUMBNAIL/image/gif/90b250bdd33e5914aefe72b65da4b448/gr4.sml https://s3-eu-west-1.amazonaws.com/prod-ucs-content-store-eu-west/content/pii:S1381116903000475/gr4/THUMBNAIL/image/gif/90b250bdd33e5914aefe72b65da4b448/gr4.sml gr4 gr4.sml sml 1460 92 125 IMAGE-THUMBNAIL 1-s2.0-S1381116903000475-gr4.gif https://s3.amazonaws.com/prod-ucs-content-store-us-east/content/pii:S1381116903000475/gr4/DOWNSAMPLED/image/gif/3623578402fec1baed745177b90aa2d5/gr4.gif https://s3-eu-west-1.amazonaws.com/prod-ucs-content-store-eu-west/content/pii:S1381116903000475/gr4/DOWNSAMPLED/image/gif/3623578402fec1baed745177b90aa2d5/gr4.gif gr4 gr4.gif gif 5075 241 327 IMAGE-DOWNSAMPLED 1-s2.0-S1381116903000475-gr5.sml https://s3.amazonaws.com/prod-ucs-content-store-us-east/content/pii:S1381116903000475/gr5/THUMBNAIL/image/gif/7b24a904f27a96758f4c0226c3d655bc/gr5.sml https://s3-eu-west-1.amazonaws.com/prod-ucs-content-store-eu-west/content/pii:S1381116903000475/gr5/THUMBNAIL/image/gif/7b24a904f27a96758f4c0226c3d655bc/gr5.sml gr5 gr5.sml sml 494 94 41 IMAGE-THUMBNAIL 1-s2.0-S1381116903000475-gr5.gif https://s3.amazonaws.com/prod-ucs-content-store-us-east/content/pii:S1381116903000475/gr5/DOWNSAMPLED/image/gif/6f2592e47b9acfaa9f93ea31491d81b5/gr5.gif https://s3-eu-west-1.amazonaws.com/prod-ucs-content-store-eu-west/content/pii:S1381116903000475/gr5/DOWNSAMPLED/image/gif/6f2592e47b9acfaa9f93ea31491d81b5/gr5.gif gr5 gr5.gif gif 8113 724 317 IMAGE-DOWNSAMPLED 1-s2.0-S1381116903000475-gr6.sml https://s3.amazonaws.com/prod-ucs-content-store-us-east/content/pii:S1381116903000475/gr6/THUMBNAIL/image/gif/c8352a2c88381adfd613df5f51b2e67c/gr6.sml https://s3-eu-west-1.amazonaws.com/prod-ucs-content-store-eu-west/content/pii:S1381116903000475/gr6/THUMBNAIL/image/gif/c8352a2c88381adfd613df5f51b2e67c/gr6.sml gr6 gr6.sml sml 1954 79 125 IMAGE-THUMBNAIL 1-s2.0-S1381116903000475-gr6.gif https://s3.amazonaws.com/prod-ucs-content-store-us-east/content/pii:S1381116903000475/gr6/DOWNSAMPLED/image/gif/08237dce023d14234d33f1b0ef25451a/gr6.gif https://s3-eu-west-1.amazonaws.com/prod-ucs-content-store-eu-west/content/pii:S1381116903000475/gr6/DOWNSAMPLED/image/gif/08237dce023d14234d33f1b0ef25451a/gr6.gif gr6 gr6.gif gif 10821 254 404 IMAGE-DOWNSAMPLED 1-s2.0-S1381116903000475-gr7.sml https://s3.amazonaws.com/prod-ucs-content-store-us-east/content/pii:S1381116903000475/gr7/THUMBNAIL/image/gif/2799fca17e562631782d619115bf1d2f/gr7.sml https://s3-eu-west-1.amazonaws.com/prod-ucs-content-store-eu-west/content/pii:S1381116903000475/gr7/THUMBNAIL/image/gif/2799fca17e562631782d619115bf1d2f/gr7.sml gr7 gr7.sml sml 1572 78 125 IMAGE-THUMBNAIL 1-s2.0-S1381116903000475-gr7.gif https://s3.amazonaws.com/prod-ucs-content-store-us-east/content/pii:S1381116903000475/gr7/DOWNSAMPLED/image/gif/8d5f310b5c8da5ddf0986981ef7c516e/gr7.gif https://s3-eu-west-1.amazonaws.com/prod-ucs-content-store-eu-west/content/pii:S1381116903000475/gr7/DOWNSAMPLED/image/gif/8d5f310b5c8da5ddf0986981ef7c516e/gr7.gif gr7 gr7.gif gif 8690 252 402 IMAGE-DOWNSAMPLED 1-s2.0-S1381116903000475-gr8.sml https://s3.amazonaws.com/prod-ucs-content-store-us-east/content/pii:S1381116903000475/gr8/THUMBNAIL/image/gif/6d6e5f0d437a97213f0b0414fe31fd4b/gr8.sml https://s3-eu-west-1.amazonaws.com/prod-ucs-content-store-eu-west/content/pii:S1381116903000475/gr8/THUMBNAIL/image/gif/6d6e5f0d437a97213f0b0414fe31fd4b/gr8.sml gr8 gr8.sml sml 1644 83 125 IMAGE-THUMBNAIL 1-s2.0-S1381116903000475-gr8.gif https://s3.amazonaws.com/prod-ucs-content-store-us-east/content/pii:S1381116903000475/gr8/DOWNSAMPLED/image/gif/44a3da81a25300776ff6f48ea6f9fa29/gr8.gif https://s3-eu-west-1.amazonaws.com/prod-ucs-content-store-eu-west/content/pii:S1381116903000475/gr8/DOWNSAMPLED/image/gif/44a3da81a25300776ff6f48ea6f9fa29/gr8.gif gr8 gr8.gif gif 6092 215 322 IMAGE-DOWNSAMPLED 1-s2.0-S1381116903000475-gr9.sml https://s3.amazonaws.com/prod-ucs-content-store-us-east/content/pii:S1381116903000475/gr9/THUMBNAIL/image/gif/b7e2a8e725da7d631f19896c1bb8d704/gr9.sml https://s3-eu-west-1.amazonaws.com/prod-ucs-content-store-eu-west/content/pii:S1381116903000475/gr9/THUMBNAIL/image/gif/b7e2a8e725da7d631f19896c1bb8d704/gr9.sml gr9 gr9.sml sml 1561 83 125 IMAGE-THUMBNAIL 1-s2.0-S1381116903000475-gr9.gif https://s3.amazonaws.com/prod-ucs-content-store-us-east/content/pii:S1381116903000475/gr9/DOWNSAMPLED/image/gif/b31aec6324762b4070f1bf5a0c2dcdd8/gr9.gif https://s3-eu-west-1.amazonaws.com/prod-ucs-content-store-eu-west/content/pii:S1381116903000475/gr9/DOWNSAMPLED/image/gif/b31aec6324762b4070f1bf5a0c2dcdd8/gr9.gif gr9 gr9.gif gif 5668 214 322 IMAGE-DOWNSAMPLED MOLCAA 3981 S1381-1169(03)00047-5 10.1016/S1381-1169(03)00047-5 Elsevier Science B.V. Fig. 1 Effect of reaction temperature on the catalytic performance in selective oxidation of propane to acrolein over Ce0.1Ag0.3Mo0.5P0.3O y catalyst. ACR: acrolein; C2: C2H6, C2H4 and acetaldehyde; CO x : CO2 and CO. Fig. 2 Effect of space velocity on the catalytic performance in selective oxidation of propane to acrolein over Ce0.1Ag0.3Mo0.5P0.3O y catalyst. ACR: acrolein; C2: C2H6, C2H4 and acetaldehyde; CO x : CO2 and CO. Fig. 3 XRD pattern of catalysts: (1) Ag0.3Mo0.5P0.3O x ; (2) Ce0.1Ag0.3Mo0.5P0.3O y ; (3) Ce0.3Ag0.3Mo0.5P0.3O y ; (4) Ce0.5Ag0.3Mo0.5P0.3O y . Fig. 4 H2-TPR profiles of catalysts: (1) Ag0.3Mo0.5P0.3O x ; (2) Ce0.1Ag0.3Mo0.5P0.3O y ; (3) Ce0.3Ag0.3Mo0.5P0.3O y ; (4) Ce0.5Ag0.3Mo0.5P0.3O y ; (5) MoO3; (6) CeO2. Fig. 5 (A) EPR spectra of catalysts: (1) Ag0.3Mo0.5P0.3O x ; (2) Ce0.1Ag0.3Mo0.5P0.3O y ; (3) Ce0.3Ag0.3Mo0.5P0.3O y ; (4) Ce0.5Ag0.3Mo0.5P0.3O y . (B) EPR spectra of Ce0.1Ag0.3Mo0.5P0.3O y catalyst treated under different conditions: (1) used catalysts; (2) fresh catalysts; (3) the catalysts treated with O2 flow at 773K for 15min and then cooled to room temperature in N2 flow. Fig. 6 XPS spectra of catalysts: (1) Ag0.3Mo0.5P0.3O x ; (2) Ce0.1Ag0.3Mo0.5P0.3O y ; (3) Ce0.3Ag0.3Mo0.5P0.3O y ; (4) Ce0.5Ag0.3Mo0.5P0.3O y . Fig. 7 TPD profiles of catalysts: (1) Ag0.3Mo0.5P0.3O x ; (2) Ce0.1Ag0.3Mo0.5P0.3O x ; (3) Ce0.5Ag0.3Mo0.5P0.3O x . Fig. 8 Relationship of the Mo5+ concentration with the catalytic performance. Fig. 9 Relationship of the H2 consumption with the catalytic performance. Table 1 Catalytic performance of these catalysts for selective oxidation of propane to acrolein Catalysts Conversion of C3H8 (%) Selectivity (%) Yield (%) C3H6 ACR PA + AT C2 CO x ACR Ag0.3Mo0.5P0.3O x 10.9 67.9 5.6 4.8 2.8 18.5 0.6 Cu0.1Ag0.3Mo0.5P0.3O x 11.6 24.9 Tr 8.8 27.7 38.6 – Zn0.1Ag0.3Mo0.5P0.3O x 10.2 45.2 6.0 8.0 5.3 35.5 0.6 Mn0.1Ag0.3Mo0.5P0.3O x 5.3 45.3 – – 7.6 47.1 – W0.1Ag0.3Mo0.5P0.3O x 12.6 37.2 – – 25.3 37.5 – Pr0.1Ag0.3Mo0.5P0.3O x 12.8 66.9 3.9 – 4.3 24.9 0.5 Nd0.1Ag0.3Mo0.5P0.3O x 8.8 38.2 – – 21.5 40.3 – Ce0.05Ag0.3Mo0.5P0.3O x 13.2 43.2 7.0 2.0 20.4 27.4 0.9 Ce0.1Ag0.3Mo0.5P0.3O x 15.3 25.7 28.7 2.0 17.5 26.0 4.4 Ce0.3Ag0.3Mo0.5P0.3O x 18.5 26.3 20.6 8.8 1.0 42.6 3.8 Ce0.5Ag0.3Mo0.5P0.3O x 22.0 23.7 14.7 8.0 2.3 50.4 3.2 Reaction conditions: 773K, C3H8/O2/N2=3/1/4, 2400ml/(gcath), atmospheric pressure. ACR: acrolein; PA+AT: propionaldehyde and acetone; C2: C2H6, C2H4 and acetaldehyde; CO x : CO and CO2. Table 2 Catalytic performances of these catalysts in selective oxidation of propene to acrolein Catalysts Conversion of C3H8 (%) Selectivity (%) Yield (%) ACR PA AT C2 CO x ACR Ag0.3Mo0.5P0.3O x 16.6 24.9 5.6 5.6 31.4 32.5 4.1 Ce0.05Ag0.3Mo0.5P0.3O x 21.0 26.8 7.8 2.9 32.5 30.0 5.6 Ce0.1Ag0.3Mo0.5P0.3O x 34.3 34.8 1.8 1.8 6.2 55.2 11.9 Ce0.3Ag0.3Mo0.5P0.3O x 36.5 31.6 5.3 1.6 7.4 54.1 11.5 Ce0.5Ag0.3Mo0.5P0.3O x 36.1 15.1 2.7 1.5 18.5 62.2 5.4 Reaction conditions: 773K, C3H6/O2/N2=3/1/4, 2400ml/(gcath), atmospheric pressure. ACR: acrolein; PA: propionaldehyde; AT: acetone; C2: C2H6, C2H4, and acetaldehyde; CO x : CO and CO2. Table 3 Physicochemical properties of (Ce n )Ag0.3Mo0.5P0.3O y catalysts Catalysts BET area (g/m2) Surface composition by XPS Relative concentration of Mo5+ by EPR (a.u.) Ag/Mo Ce/Mo P/Mo Ag0.3Mo0.5P0.3O x 10.6 0.36 – 0.33 21.9 Ce0.1Ag0.3Mo0.5P0.3O x 15.7 0.42 0.33 0.34 38.4 Ce0.3Ag0.3Mo0.5P0.3O x 16.3 0.44 0.45 0.36 46.2 Ce0.5Ag0.3Mo0.5P0.3O x 18.8 0.50 0.55 0.36 55.4 Effect of promoter Ce on silver-molybdenum-phosphate catalysts for selective oxidation of propane to acrolein Xin Zhang a ∗ Hui-lin Wan b Wei-zheng Weng b Xiao-dong Yi b a State Key Laboratory of C1 Chemistry and Technology, Department of Chemistry, Tsinghua University, Beijing 100084, PR China b State Key Laboratory of Physical Chemistry for Solid Surfaces, Department of Chemistry, Xiamen University, Xiamen 361005, PR China * Corresponding author. Tel.: +86-10-6772592; fax: +86-10-62792122. Graphic A series of Me n Ag0.3Mo0.5P0.3O y (Me=Cu, Zn, Mn, W, Ce, Pr, Nd) and Ag0.3Mo0.5P0.3O x catalysts were prepared. The addition of Ce to Ag0.3Mo0.5P0.3O x catalysts improved the catalytic performance in selective oxidation of propane to acrolein, and Ce0.1Ag0.3Mo0.5P0.3O x catalysts showed the highest acrolein selectivity (28.7%) and yield (4.4%). The physicochemical properties of Ag0.3Mo0.5P0.3O x and Ce n Ag0.3Mo0.5P0.3O x (n=0.1–0.5) catalysts have been comparatively characterized by BET, XRD, H2-TPR, XPS, EPR and C3H8(C3H6)-TPD. Significant differences in physicochemical properties between Ag0.3Mo0.5P0.3O x and Ce doped Ag0.3Mo0.5P0.3O x catalysts have been observed, which is due to the formation of the redox cycle (Ce3++Mo6+⇔Ce4++Mo5+) in the Ce n Ag0.3Mo0.5P0.3O y catalyst. Such effect modified the reducibility, the concentration of Mo5+, the activation of propane and the transformation of possible intermediate propene to acroelin, which in return greatly influenced the catalytic performance of Ce doped Ag0.3Mo0.5P0.3O x catalysts in selective oxidation of propane to acroelin. The proper addition of Ce to Ag0.3Mo0.5P0.3O x catalyst improved the acrolein selectivity and yield. Keywords Propane Selective oxidation Acrolein Redox cycle 1 Introduction The selective oxidation of light alkane to oxygenate is attractive because it is potential utilization of cheap row materials [1–3]. A great deal of research has already been done so far to achieve selective oxidation of propane to acrolein and/or acrylic acid by using multi-component oxide catalysts, which are based on vanadium and/or molybdenum [1–3]. The redox properties of catalysts always play important roles in activity and selectivity in selective oxidation of propane, because the selective oxidation of propane usually processes via Mars van Krevelen mechanism. It is well known that promoters could modify the redox properties of the catalysts, which in return determine the activity and selectivity in selective oxidation of propane. The best catalyst for selective oxidation of propane to acrolein obtained up to now are BiMoVO multi-compound catalysts with the Keggin structure developed by Moro-oka and coworkers [3–6]. They observed that the molybdenum component was necessary for good activity and selectivity to acrolein. The vanadium component improved propane conversion and the addition of Ag to BiMoVO significantly enhanced acrolein selectivity [3–6]; 65% acrolein selectivity with 13% propane conversion was obtained on the optimized Ag0.01Bi0.85Mo0.54V0.45O4 catalysts [4]. Baerns et al. [7] reported that acrolein selectivity amounted to 34 and 20% (yield of 3.2 and 2.7%) when Ag0.01Bi0.85Mo0.54V0.45O4/Ca7Bi5Mo12O x and Ag0.01Bi0.85Mo0.54V0.45O4/Mg7Bi5Mo12O x catalysts were used, respectively. However, almost no acrolein was formed on Ag0.01Bi0.85Mo0.54V0.45O4/Me x O y (Me x O y =Al2O3, TiO2, SiO2) catalysts. The difference in catalytic performance could be due to oxygen species involved in selective oxidation of propane to acrolein, influencing the reaction mechanism. Teng and Kobayashi [8] observed that the addition of K+ to the Fe/SiO2 catalysts appreciably enhanced propane conversion along with high acrolein selectivity. Adjacency of Fe and K on the silica surface seemed to be important for the high oxygenate yield. The most effective catalysts for propane oxidation to acrylic acid are Mo-V-Te-Nb-O catalysts reported by Ushikubo et al. [10], Lin [2] and Lin and Linsen [9,11,12]. The substitution of Sb for Te in the Mo-V-Te-Nb-O catalyst decreased propane conversion and acrylic acid selectivity but its overall performance is quite good [2]. Takahashi et al. [13] found that the addition of K to Mo-V-Sb-Nb-O improved propane conversion. Li et al. [14] reported that the H3PMo12O40(Py) catalyst reduced by pyridine showed higher catalytic performance in propane oxidation to acrylic acid than the unreduced H3PMo12O40 catalyst. The H3PMo12O40(Py) catalyst is assumed to the highly restrain orthorhombic secondary structure against reoxidation, and Lewis acid site was generated with the formation of the primary oxygen-deficient Keggin structure. VPO is another promising catalyst for selective oxidation of propane to arylic acid. A lot of works have been done about the effect of promoters on the catalytic performance and properties of VPO. Deng and coworkers [18,19] reported that the addition of Zr to the VPO catalyst could significantly enhanced acrylic acid selectivity. Cheng et al. [20] reported that 0.01wt.% Ce doped VPO showed 18.8% yield acrylic acid, which is the highest acrylic acid yield reported on VPO catalysts so far. Wang et al. [21] investigated the influence of promoters (Co, Bi, Mo, Te, Nd, B) on the VPO catalyst. They observed that the addition of such promoters could not improve acrylic acid selectivity. In order to develop effective catalysts for selective oxidation of propane, systematic studies on the effects of promoters should be done. In the present work, Ag0.3Mo0.5P0.3O x and Me doped Ag0.3Mo0.5P0.3O x (Me=Cu, Zn, W, Mn, Ce, Pr, Nd) catalysts were prepared. The performance of these catalysts in selective oxidation of propane to acrolein has been tested. The results show that the promoter Ce obviously enhanced propane conversion and acrolein selectivity. In order to clarify the role of promoter Ce, physicochemical properties of the Ce-doped and undoped catalysts such as the structure, the redox properties, the Mo6+/Mo5+ ratio, and the interaction between propane and the catalysts have been comparatively characterized by BET, XRD, TPR, XPS, EPR and TPD technology, etc. and the transformation of possible intermediate propene to acrolein has been also investigated. 2 Experimental 2.1 Catalyst preparation Ag0.3Mo0.5P0.3O x (Ag/Mo/P=0.3/0.5/0.3, mol ratio) catalyst and Me n Ag0.3Mo0.5P0.3O x (Me/Ag/Mo/P=n/0.3/0.5/0.3, mol ratio, Me=Cu, Zn, W, Mn, Ce, Pr, Nd) catalysts were, respectively, prepared by the method of grinding (NH4)H2PO4, MoO3, Ag2O and MeO x powder (such as CeO2, ZnO, CuO, etc.) with certain amount of deionized water. The samples were dried overnight in air at 383K. After drying, the samples were calcinated at 623K for 5h and then at 823K for 12h. 2.2 Catalytic testing The catalytic test was carried out at atmospheric pressure in a continuous flow system with a fixed bed quartz tubular reactor (i.d.=6mm). To minimize possible homogeneous reactions, the space of the reactor up and down the catalyst bed (0.5g, 60–80mesh) was filled with quartz wool. The exit gas were heated to 393K to prevent products condensation. The feedstock and products were analyzed with two on-line gas chromatographs with three columns, TDX-601 column and Al2O3 column impregnated with squalane (102-GC, TCD) for the separation of C3H8, C3H6, C2H4, C2H6, CO, CO2, and GDX-103 column (103-GC FID) for the separation of acrolein, acetone and propanal, etc. 2.3 Characterization The BET surface area of catalysts was measured by a ST-03 adsorptionmeter. The phase structures of the catalysts were identified by Rigaku Rotflex D/Max-C powder X-ray diffractometer (XRD) with Cu Kα (λ=0.15046nm). Both the temperature-programmed reduction (TPR) experiments and the temperature-programmed desorption experiments (TPD) were carried out using a temperature-programmed reaction-mass spectrometer (Omnistar GSD 3000) instrument. In the TPR experiments, the sample (ca. 100mg) was exposed to a 20ml/min 5% H2/N2 flow, and heated at rate of 10K/min. For the TPD experiments, the sample was pretreated in 20ml/min propane (propene) flow for 30min at room temperature (RT), and then He flow was switched to purge the gas phase propane (propene). The desorption was performed from RT to 923K at a heating rate of 10K/min. The X-ray photoelectron spectroscopy (XPS) measurements were performed by VG ESCLAB MK-II spectrometer wit Al Kα (1486.6eV, 10.1kV). The spectra were referenced with respect to C 1s line at 284.7eV. The measurement error is ±0.2eV. The electronic paramagnetic resonance (EPR) spectra were obtained by a Brucker 200D-SCR spectrometer at RT. The klystron frequency was 9.6GHz and magnetic field modulation was 100KHz. 3 Results 3.1 Catalytic performance 3.1.1 Propane oxidation The performance of the catalysts in selective oxidation of propane to acrolein is shown in Table 1 . The blank reactor did not show activity in oxidation of propane, indicating that the homogeneous reaction could not make significant contribution to the heterogeneous oxidation of propane under our experiment conditions. Ag0.3Mo0.5P0.3O x catalyst showed 5.6% acrolein selectivity and 67.9% propene selectivity with 10.9% propane conversion. The addition of promoter such as Cu, Zn, W, Mn, Ce, Pr, Nd to Ag0.3Mo0.5P0.3O x catalysts changed catalytic activity and products distribution in selective oxidation of propane. In all the investigated catalysts, Ce doped Ag0.3Mo0.5P0.3O x catalysts showed higher propane conversion and higher acrolein selectivity. In the case of Ce doped Ag0.3Mo0.5P0.3O x catalysts, propane conversion and products distribution depended on the Ce-content. With the Ce-content increasing, propane conversion increased; acrolein selectivity firstly increased and simultaneously propene selectivity decreased and CO x selectivity increased. The maximal 4.4% acrolein yield with 28.7% acroelin selectivity was obtained on Ce0.1Ag0.3Mo0.5P0.3O y . The reaction temperature had great influence on propane conversion and products distribution of the Ce0.1Ag0.3Mo0.5P0.3O y catalyst in selective oxidation of propane to acrolein (Fig. 1 ). When the reaction temperature was elevated, propane conversion increased. The maximal acrolein selectivity and yield were observed with the rising of reaction temperature, while propene selectivity monotonically decreased. Deep oxidation products CO x became favorable at the high temperatures. The effect of space velocity on the catalytic performance of Ce0.1Ag0.3Mo0.5P0.3O y catalyst in selective oxidation of propane was also investigated. As can be seen in Fig. 2 , propane conversion and products distribution varied as a function of space velocity. With the increase in space velocity, propane conversion decreased, while propene selectivity monotonously increased and acroelin selectivity gave maximal value at the space velocity of 2400ml/(gcath). In addition, the decrease of CO x selectivity was observed with increasing space velocity. These Ce n Ag0.3Mo0.5P0.3O y catalysts showed good performance for acrolein formation in selective oxidation of propane. This work thus focuses on these catalysts. 3.1.2 Propene oxidation It is well known that the primary products of a given reaction can be discriminated from high-order products by extrapolating products selectivity to zero conversion. Primary products have non-zero intercepts, while secondary and high-order products have zero intercepts [15]. In the case of selective oxidation of propane over Ce n Ag0.3Mo0.5P0.3O y catalysts (Fig. 2), it is clear that the dominant primary products was propene because propene selectivity gradually increased with the decrease in propane conversion. Table 2 shows that the results of propene oxidation over Ag0.3Mo0.5P0.3O x and Ce n Ag0.3Mo0.5P0.3O y catalysts. Acrolein and CO x were main products in propene oxidation. The addition of Ce enhanced propene conversion and acrolein yield. Compared with Ag0.3Mo0.5P0.3O x catalyst, acrolein selectivity was higher on Ce n Ag0.3Mo0.5P0.3O y catalysts when the Ce/Mo ratio was varied from 0.05 to 0.3; however, it became lower as the Ce/Mo ratio increased to 0.5. In the case of Ce n Ag0.3Mo0.5P0.3O x catalysts, the maximal acrolein selectivity and yield were observed on Ce0.1Ag0.3Mo0.5P0.3O x catalyst, and acrolein selectivity and yield monotonously decreased when the Ce/Mo ratio increased. An increase in CO x selectivity was observed with the Ce-content. It can be noted that propene conversion almost kept constant as the Ce/Mo ratio increased from 0.1 to 0.5, which might be due to the total consumption of O2 taking place. By combining the propane oxidation and propene oxidation data, propene was primary product that was then oxidized to acrolein over these catalysts in selective oxidation of propane. The proper addition of Ce in the catalysts enhanced the conversion of propene to acrolein, but the oxidation of propene to deep oxidation products CO x was favorable on the catalysts with Ce/Mo=0.5. 3.2 Characterization 3.2.1 BET surface area and XRD characterization The BET surface area of these catalysts is shown in Table 3 . Ag0.3Mo0.5P0.3O x had the lowest surface area of 10.6m2/g. The surface area of Ce n Ag0.3Mo0.5P0.3O y catalysts was higher than that of Ag0.3Mo0.5P0.3O x , and slightly increased with increasing Ce-content. The XRD patterns of Ce n Ag0.3Mo0.5P0.3O y and Ag0.3Mo0.5P0.3O x catalysts are shown in Fig. 3 . MoO3 and AgMoO2PO4 were main phases in Ag0.3Mo0.5P0.3O x catalysts. In the case of Ce n Ag0.3Mo0.5P0.3O y catalysts, new phases CeMoO6 and CeO2 were found. In addition, it can be noted that the peak intensities of CeMoO6 and CeO2 increased with increasing Ce-content, indicating that the amount of CeMoO6 and CeO2 increased. 3.2.2 TPR characterization The TPR profiles of Ce n Ag0.3Mo0.5P0.3O y catalysts, Ag0.3Mo0.5P0.3O x catalyst, pure MoO3 and pure CeO2 are presented in Fig. 4 . The TPR profile of pure MoO3 showed two reduction peaks at 926 and 1042K, corresponding to the step-wise reduction of Mo6+⇒Mo4+ and Mo4+⇒Mo0, respectively [22,23]. CeO2 showed two reduction peaks at ca. 811 and 1035K with respect to the reduction of Ce4+⇒Ce3+⇒Ce0 [24]. Ce n Ag0.3Mo0.5P0.3O y catalysts and Ag0.3Mo0.5P0.3O x catalysts exhibited the low temperature reduce peak (<500K) and the high temperature reduce peaks (>700K). The low temperature reduction peak near 420K may be due to the reduction of Ag+⇒Ag0 [25]. The high temperature reduction peaks could be assigned to the contributions of the reduction of Mo- and Ce-oxides. The reduction peaks (>700K) shifted to the lower temperature when Ce was added to Ag0.3Mo0.5P0.3O y catalysts, and they monotonically shifted toward the lower temperature with increasing Ce-content. In order to estimate the H2 consumption, the area of TPR profile was integrated. The H2 consumption increased in the sequence Ag0.3Mo0.5P0.3O y <Ce0.1Ag0.3Mo0.5P0.3O y <Ce0.3Ag0.3Mo0.5P0.3O y <Ce0.5Ag0.3Mo0.5P0.3O y catalyst. The results reveal that the reducibility of (Ce n )Ag0.3Mo0.5P0.3O y catalysts improved with increasing Ce-content. 3.2.3 EPR characterization The EPR spectroscopy was used to investigate the presence and change of Mo5+ and Ce3+ in these catalysts (Fig. 5 ). The spectra of the catalysts exhibited signals with g 1=1.94 and g 2=1.89 attributed to Mo5+ [26,27]. No hyperfine structure due to Mo5+ (S=1/2, I=5/2) was observed, indicating that Mo5+ was not sufficiently apart from one another and the Mo5+ strong interaction had eliminated the hyperfine structure. The EPR signal at g 3=1.98 due to Ce3+ was also found in Ce n Ag0.3Mo0.5P0.3O y catalysts [28,29]. The formulate [I i (ΔH pp) i 2]/[I(ΔH pp)2]standardsample could be used to roughly estimate relative concentration of Mo5+ in the catalysts, in which Ii is intensity of peaks and ΔH pp the line width at peak to peak maximum [32–35]. The results are shown in Table 3. The relative concentration of Mo5+ increased following the order of Ag0.3Mo0.5P0.3O y <Ce0.1Ag0.3Mo0.5P0.3O y <Ce0.3Ag0.3Mo0.5P0.3O y <Ce0.5Ag0.3Mo0.5P0.3O y catalyst. Fig. 5B gives the EPR spectra of Ce0.1Ag0.3Mo0.5P0.3O y treated under different conditions. Compared with the fresh catalyst, the EPR spectrum of the used catalyst showed broad and strong peak. After the catalyst was treated in O2 flow at 773K for 15min and then sealed in a glass tube, the intensity of Mo5+ remarkably reduced. The results suggest that Mo5+/Mo6+ and Ce3+/Ce4+ were involved in the activation of molecular oxygen and oxidation of propane. 3.2.4 XPS characterization In this study, oxidation state and relative surface concentration of composition have been investigated by using XPS. The XPS spectra of pure MoO3 are used to identify the possible change of the state of Mo. The binding energy (BE) of Mo 3d5/2 on MoO3 is 233.5eV. The BE of Mo 3d5/2 on Ag0.3Mo0.5P0.3O x was about 233.1eV (Fig. 6 ). Ce n Ag0.3Mo0.5P0.3O y catalysts showed the lower BE of Mo 3d5/2 than Ag0.3Mo0.5P0.3O x catalyst. The BE of Mo 3d5/2 on Ce n Ag0.3Mo0.5P0.3O y decreased from 232.8 to 232.5eV with increasing Ce-content, suggesting that the electronic density around Mo nucleus increased, in other words, the coordinatively unsaturated Mo increased on the surface. In addition, shoulder peaks near 234.5eV were observed, which may be assigned to Mo 5+ 3d 3/2 . Fig. 6 also gives Ce 3d XPS spectra on Ce n Ag0.3Mo0.5P0.3O y catalysts. The peaks near 915.6 and 910.5eV were assigned to Ce4+ [16,17]. The peak at 885.0eV was due to Ce3+ [16,17]. With increasing Ce-content, the BE of Ce slightly fluctuated. The value corresponding to relative surface concentration is presented in Table 3. Surface concentration was heavily dependent on the Ce-content in the catalysts. In the case of Ce n Ag0.3Mo0.5P0.3O y catalysts, we note an increase in Ag and Ce concentrations, respectively, with increasing Ce-content. In addition in, the ratio of Ag/Mo on Ce n Ag0.3Mo0.5P0.3O y catalysts was higher than that on Ag0.3Mo0.5P0.3O x . 3.2.5 C3H8-TPD and C3H6-TPD characterization In order to investigate the interaction between C3H8(C3H6) and the catalysts, the temperature-programmed desorption (TPD) experiments were carried out. The TPD profiles are shown in Fig. 7 . C3H8-TPD profiles showed one desorption peak on both Ce doped Ag0.3Mo0.5P0.3O y and undoped Ag0.3Mo0.5P0.3O x catalyst, indicating that there was one kind of active sites for C3H8 adsorption on these catalysts. Compared with Ag0.3Mo0.5P0.3O x , the desorption peak shifted toward the higher temperature on Ce doped Ag0.3Mo0.5P0.3O x catalysts. The results suggest that the addition of Ce enhanced the interaction between C3H8 and the catalysts. In the case of C3H6 desorption, one peak due to C3H6 desorption was observed on both Ce doped Ag0.3Mo0.5P0.3O x and Ag0.3Mo0.5P0.3O x catalysts. The desorption peak temperature shifted to higher temperature with the increase in the Ce-content, indicating that the promoter Ce enhanced C3H6 adsorption. 4 Discussion The addition of promoter Ce in the catalysts modified the physicochemical properties, which in turn influenced the catalytic performance in selective oxidation of propane to acroelin. The significant difference in physicochemical properties among the catalysts has been observed. The promoter Ce improved the reducibility, increased the relative concentration of Mo5+, modified the surface composition, and enhanced the C3H8(C3H6) adsorption on the catalysts. Ce n Ag0.3Mo0.5P0.3O y catalysts had higher catalytic performance in selective oxidation of propane to acrolein than Ag0.3Mo0.5P0.3O x catalyst. Ce0.1Ag0.3Mo0.5P0.3O y showed the highest 4.4% acrolein yield with 28.7% acroelin selectivity. In addition, the proper addition of Ce could enhance the transformation of possible intermediate propene to acrolein. The variation of such properties of Ce n Ag0.3Mo0.5P0.3O y catalysts could be due to the interaction between Mo and Ce in Ce n Ag0.3Mo0.5P0.3O y catalysts. Both Mo5+ and Ce3+ were detected on Ce n Ag0.3Mo0.5P0.3O y catalysts. The redox potential of Mo6+/Mo5+ and Ce4+/Ce3+ is about 0.3eV, and −1.61eV, respectively. Both Ce and Mo are able to activate/store oxygen and transform/release oxygen species. Hence, the redox cycle (Ce3++Mo6+⇔Ce4++Mo5+) can exist, improving the transfer of electron and oxygen species. With the increase in the Ce-content, the relative concentration of Mo5+ gradually increased, the lattice oxygen deficient sites around the coordinatively unsaturated Mo ion enhanced [14]. The more the lattice oxygen deficient sites, the easier the diffusion of oxygen [30,31]. Thus, the reducibility of the catalysts improved with the increase in the Ce-content. In order to elucidate such changes to be responsible for the catalytic performance of Ce doped Ag0.3Mo0.5P0.3O x catalysts, several methods have been employed. The catalytic performance has been identified in terms of specific activity (specific activity=mol propane converted (m2 s−1)) and specific yield (specific selectivity=mol acrolein obtained (m2 s−1)). The relationships of Ce-content with the reducibility and the concentration of Mo5+ and catalytic performance are presented in Figs. 8 and 9 , respectively. A clear correlation was observed between the catalytic performance and physicochemical properties. With the increase in Ce/Mo ratio in these catalysts, the Mo5+ concentration gradually increased. The specific activity monotonously increased with the Mo5+ concentration; the acrolein specific yield showed a volcano shape curve and gave the maximal value on the Ce0.1Ag0.3Mo0.5P0.3O y catalysts (Fig. 8). Likewise, an increase in H2 consumption was observed with increasing Ce-content, and specific activity increased and the maximal acrolein specific yield was achieved on the Ce0.1Ag0.3Mo0.5P0.3O y catalysts (Fig. 9). In selective oxidation of propane to acrolein on Ce n Ag0.3Mo0.5P0.3O y catalysts, the oxygen deficient site around coordinatively unsaturated Mo5+ reacted with molecular oxygen to form lattice oxygen species that are active species for propane activation; simultaneously, the coordinatively unsaturated Mo5+ was oxidized to Mo6+ (Mars van Krevelen redox mechanism) [3]. The enhancement of reducibility is in favor of this process. Therefore, the more the concentration of Mo5+ and the stronger reducibility are, the higher the specific activity. On the other hand, propene was the intermediate for the formation of acrolein in selective oxidation of peopane. The transformation of propene to acrolein will be mostly determined by the interaction of propene with the catalyst surface. As can be seen in Sections 3.2.5 and 3.1.2, the proper addition of Ce to the catalysts resulted in the enhancement of propene adsorption and transformation of propene to acroelin. Therefore, high acroelin selectivity and yield were obtained on Ce0.1Ag0.3Mo0.5P0.3O y catalyst. However, owing to much stronger interaction between propene and the Ce0.5Ag0.3Mo0.5P0.3O y catalyst, and the higher reducibility, intermediate propene could easily suffer deep oxidation to CO x . Consequently, acrolein selectivity and yield was decreased on the Ce0.5Ag0.3Mo0.5P0.3O y catalyst in selective oxidation of propane. 5 Conclusions In conclusion, the addition of promoter Ce to Ag0.3Mo0.5P0.3O x modified the physicochemical properties such as the reducibility, the concentration of Mo5+, surface composition, the propane adsorption as well as the transformation of intermediate propene to acrolein, which in turn determined the catalytic performance of these catalysts in selective oxidation of propane to acrolein. The maximal acrolein selectivity and yield were obtained on the Ce0.1Ag0.3Mo0.5P0.3O y catalyst. The formation of redox cycle (Ce3++Mo6+⇔Ce4++Mo5+) in Ce n Ag0.3Mo0.5P0.3O y catalysts accounts for the change of physicochemical properties and performance of these catalysts. Acknowledgements This work is supported by the Ministry of Science and Technology (G1999022408). References [1] F. Cavani F. Trifiro Appl. Catal. A. 88 1992 115 [2] M.M. Lin Appl. Catal. A. 207 2000 1 [3] M.M. Bettahar G. Constentin L. Savary Appl. Catal. A. 145 1996 1 [4] Y.C. Kim W. Ueda Y. Moro-oka Appl. Catal. A. 70 1991 175 [5] Y.C. Kim W. Ueda Y. Moro-oka Stud. Surf. Sci. Catal. 50 1990 491 [6] Y.C. Kim W. Ueda Y. Moro-oka Catal. Today 13 1992 673 [7] M. Barens O.V. Buyevskaya M. Kubik Catal. Today 33 1997 85 [8] Y. Teng T. Kobayashi Catal. Lett. 55 1998 33 [9] W. Ueda K. Oshihara Appl. Catal. A. 200 2000 135 [10] T. Ushikubo, H. Nakamura, Y. Koyasu, US Patent 5,380,933 (1995). [11] M.M. Lin, M. Linsen, EP Patent 962,253A2 (1999). [12] T. Ushikubo, Y. Koyasu, H. Nakamura, JP Patent 98,045,664 (1998). [13] M. Takahashi, S. To, S. Hirose, JP Patent 98,120,617 (1998). [14] W. Li K. Oshihara W. Ueda Appl. Catal. A. 182 1999 357 [15] J.N. Michaels D.L. Stern R.K. Grasselli Catal. Lett. 42 1996 135 [16] A. Laachir V. Perrichon A. Badri J. Chem. Soc., Faraday Trans. 87 10 1991 1601 [17] F.L. Normand L. Hilaire K. Kili J. Phys. Chem. 92 1988 2561 [18] Y. Han, H. Wang, H. Cheng, J. Chem. Soc., Chem. Commun. (1999) 521. [19] Y. Han, H. Wang, H. Cheng, R. Lin, J. Deng, New J. Chem. (1998) 1175. [20] H. Cheng Y. Han H. Wang Petrochem. Tech. 28 1999 803 [21] Z. Wang W. Wei G. Liu Acta Petrol. Sinica. 14 1998 21 [22] A. Parmaliana F. Arena F. Frusteri Stud. Surf. Sci. Catal. 110 1997 347 [23] F. Arena A. Parmaliana J. Phys. Chem. 100 1996 19995 [24] A. Laachir V. Perrichon A. Badri J. Chem. Soc., Faraday. Trans. 87 10 1991 1601 [25] W. Wang H.B. Zhang G.D. Lin Appl. Catal. B. 24 2000 219 [26] M.C. Abello M.F. Gomez L.E. Cadus Catal. Lett. 53 1998 185 [27] K.M. Sancier T. Dozono H. Wise J. Catal. 123 1971 270 [28] K.M. Sancier T. Dozono H. Wise J. Catal. 23 1 1971 270 [29] J. Soria A. Martinez-Arias J.C. Conesa J. Chem. Soc., Trans. Faraday 9 11 1995 1669 [30] J. Barrault C. Batiot L. Magaud Stud. Surf. Sci. Catal. 110 1997 375 [31] P. Courtine E. Bordes Stud. Surf. Sci. Catal. 110 1997 177 [32] H.B. Chen D.W. Liao L.J. Yu Appl. Surf. Sci. 147 1–4 1999 85 [33] L.B. Feng, H.Q. Wang, in: Y.G. Yin (Ed.), Characterization of Heterogeneous Catalysts, Chemical Engineering Press, Beijing, 1988, p. 487. [34] A. Cervasini A. Auroux J. Catal. 131 1991 190 [35] R. Grabowski B. Grzybowska K. Samson Appl. Catal. A 125 1995 129",
      "scopus-id": "0038518330",
      "coredata": {
        "eid": "1-s2.0-S1381116903000475",
        "dc:description": "A series of Me n Ag0.3Mo0.5P0.3O y (Me=Cu, Zn, Mn, W, Ce, Pr, Nd) and Ag0.3Mo0.5P0.3O x catalysts were prepared. The addition of Ce to Ag0.3Mo0.5P0.3O x catalysts improved the catalytic performance in selective oxidation of propane to acrolein, and Ce0.1Ag0.3Mo0.5P0.3O x catalysts showed the highest acrolein selectivity (28.7%) and yield (4.4%). The physicochemical properties of Ag0.3Mo0.5P0.3O x and Ce n Ag0.3Mo0.5P0.3O x (n=0.1–0.5) catalysts have been comparatively characterized by BET, XRD, H2-TPR, XPS, EPR and C3H8(C3H6)-TPD. Significant differences in physicochemical properties between Ag0.3Mo0.5P0.3O x and Ce doped Ag0.3Mo0.5P0.3O x catalysts have been observed, which is due to the formation of the redox cycle (Ce3++Mo6+⇔Ce4++Mo5+) in the Ce n Ag0.3Mo0.5P0.3O y catalyst. Such effect modified the reducibility, the concentration of Mo5+, the activation of propane and the transformation of possible intermediate propene to acroelin, which in return greatly influenced the catalytic performance of Ce doped Ag0.3Mo0.5P0.3O x catalysts in selective oxidation of propane to acroelin. The proper addition of Ce to Ag0.3Mo0.5P0.3O x catalyst improved the acrolein selectivity and yield.",
        "openArchiveArticle": "false",
        "prism:coverDate": "2003-06-02",
        "openaccessUserLicense": null,
        "prism:aggregationType": "Journal",
        "prism:url": "https://api.elsevier.com/content/article/pii/S1381116903000475",
        "dc:creator": [
          {
            "@_fa": "true",
            "$": "Zhang, Xin"
          },
          {
            "@_fa": "true",
            "$": "Wan, Hui-lin"
          },
          {
            "@_fa": "true",
            "$": "Weng, Wei-zheng"
          },
          {
            "@_fa": "true",
            "$": "Yi, Xiao-dong"
          }
        ],
        "link": [
          {
            "@_fa": "true",
            "@rel": "self",
            "@href": "https://api.elsevier.com/content/article/pii/S1381116903000475"
          },
          {
            "@_fa": "true",
            "@rel": "scidir",
            "@href": "https://www.sciencedirect.com/science/article/pii/S1381116903000475"
          }
        ],
        "dc:format": "application/json",
        "openaccessType": null,
        "pii": "S1381-1169(03)00047-5",
        "prism:volume": "200",
        "prism:publisher": "Elsevier Science B.V.",
        "dc:title": "Effect of promoter Ce on silver-molybdenum-phosphate catalysts for selective oxidation of propane to acrolein",
        "prism:copyright": "Copyright © 2003 Elsevier Science B.V. All rights reserved.",
        "openaccess": "0",
        "prism:issn": "13811169",
        "prism:issueIdentifier": "1-2",
        "dcterms:subject": [
          {
            "@_fa": "true",
            "$": "Propane"
          },
          {
            "@_fa": "true",
            "$": "Selective oxidation"
          },
          {
            "@_fa": "true",
            "$": "Acrolein"
          },
          {
            "@_fa": "true",
            "$": "Redox cycle"
          }
        ],
        "openaccessArticle": "false",
        "prism:publicationName": "Journal of Molecular Catalysis A: Chemical",
        "prism:number": "1-2",
        "openaccessSponsorType": null,
        "prism:pageRange": "291-300",
        "prism:endingPage": "300",
        "pubType": "fla",
        "prism:coverDisplayDate": "2 June 2003",
        "prism:doi": "10.1016/S1381-1169(03)00047-5",
        "prism:startingPage": "291",
        "dc:identifier": "doi:10.1016/S1381-1169(03)00047-5",
        "openaccessSponsorName": null
      },
      "objects": {
        "object": [
          {
            "@category": "thumbnail",
            "@height": "21",
            "@width": "95",
            "@_fa": "true",
            "$": "https://api.elsevier.com/content/object/eid/1-s2.0-S1381116903000475-si1.gif?httpAccept=%2A%2F%2A",
            "@multimediatype": "GIF image file",
            "@type": "ALTIMG",
            "@size": "493",
            "@ref": "si1",
            "@mimetype": "image/gif"
          },
          {
            "@category": "thumbnail",
            "@height": "53",
            "@width": "125",
            "@_fa": "true",
            "$": "https://api.elsevier.com/content/object/eid/1-s2.0-S1381116903000475-fx1.sml?httpAccept=%2A%2F%2A",
            "@multimediatype": "GIF image file",
            "@type": "IMAGE-THUMBNAIL",
            "@size": "1496",
            "@ref": "fx1",
            "@mimetype": "image/gif"
          },
          {
            "@category": "standard",
            "@height": "95",
            "@width": "226",
            "@_fa": "true",
            "$": "https://api.elsevier.com/content/object/eid/1-s2.0-S1381116903000475-fx1.jpg?httpAccept=%2A%2F%2A",
            "@multimediatype": "JPEG image file",
            "@type": "IMAGE-DOWNSAMPLED",
            "@size": "6577",
            "@ref": "fx1",
            "@mimetype": "image/jpeg"
          },
          {
            "@category": "thumbnail",
            "@height": "86",
            "@width": "125",
            "@_fa": "true",
            "$": "https://api.elsevier.com/content/object/eid/1-s2.0-S1381116903000475-gr1.sml?httpAccept=%2A%2F%2A",
            "@multimediatype": "GIF image file",
            "@type": "IMAGE-THUMBNAIL",
            "@size": "1794",
            "@ref": "gr1",
            "@mimetype": "image/gif"
          },
          {
            "@category": "standard",
            "@height": "281",
            "@width": "407",
            "@_fa": "true",
            "$": "https://api.elsevier.com/content/object/eid/1-s2.0-S1381116903000475-gr1.gif?httpAccept=%2A%2F%2A",
            "@multimediatype": "GIF image file",
            "@type": "IMAGE-DOWNSAMPLED",
            "@size": "8842",
            "@ref": "gr1",
            "@mimetype": "image/gif"
          },
          {
            "@category": "thumbnail",
            "@height": "80",
            "@width": "125",
            "@_fa": "true",
            "$": "https://api.elsevier.com/content/object/eid/1-s2.0-S1381116903000475-gr2.sml?httpAccept=%2A%2F%2A",
            "@multimediatype": "GIF image file",
            "@type": "IMAGE-THUMBNAIL",
            "@size": "1716",
            "@ref": "gr2",
            "@mimetype": "image/gif"
          },
          {
            "@category": "standard",
            "@height": "269",
            "@width": "418",
            "@_fa": "true",
            "$": "https://api.elsevier.com/content/object/eid/1-s2.0-S1381116903000475-gr2.gif?httpAccept=%2A%2F%2A",
            "@multimediatype": "GIF image file",
            "@type": "IMAGE-DOWNSAMPLED",
            "@size": "9124",
            "@ref": "gr2",
            "@mimetype": "image/gif"
          },
          {
            "@category": "thumbnail",
            "@height": "93",
            "@width": "115",
            "@_fa": "true",
            "$": "https://api.elsevier.com/content/object/eid/1-s2.0-S1381116903000475-gr3.sml?httpAccept=%2A%2F%2A",
            "@multimediatype": "GIF image file",
            "@type": "IMAGE-THUMBNAIL",
            "@size": "2130",
            "@ref": "gr3",
            "@mimetype": "image/gif"
          },
          {
            "@category": "standard",
            "@height": "265",
            "@width": "327",
            "@_fa": "true",
            "$": "https://api.elsevier.com/content/object/eid/1-s2.0-S1381116903000475-gr3.gif?httpAccept=%2A%2F%2A",
            "@multimediatype": "GIF image file",
            "@type": "IMAGE-DOWNSAMPLED",
            "@size": "10167",
            "@ref": "gr3",
            "@mimetype": "image/gif"
          },
          {
            "@category": "thumbnail",
            "@height": "92",
            "@width": "125",
            "@_fa": "true",
            "$": "https://api.elsevier.com/content/object/eid/1-s2.0-S1381116903000475-gr4.sml?httpAccept=%2A%2F%2A",
            "@multimediatype": "GIF image file",
            "@type": "IMAGE-THUMBNAIL",
            "@size": "1460",
            "@ref": "gr4",
            "@mimetype": "image/gif"
          },
          {
            "@category": "standard",
            "@height": "241",
            "@width": "327",
            "@_fa": "true",
            "$": "https://api.elsevier.com/content/object/eid/1-s2.0-S1381116903000475-gr4.gif?httpAccept=%2A%2F%2A",
            "@multimediatype": "GIF image file",
            "@type": "IMAGE-DOWNSAMPLED",
            "@size": "5075",
            "@ref": "gr4",
            "@mimetype": "image/gif"
          },
          {
            "@category": "thumbnail",
            "@height": "94",
            "@width": "41",
            "@_fa": "true",
            "$": "https://api.elsevier.com/content/object/eid/1-s2.0-S1381116903000475-gr5.sml?httpAccept=%2A%2F%2A",
            "@multimediatype": "GIF image file",
            "@type": "IMAGE-THUMBNAIL",
            "@size": "494",
            "@ref": "gr5",
            "@mimetype": "image/gif"
          },
          {
            "@category": "standard",
            "@height": "724",
            "@width": "317",
            "@_fa": "true",
            "$": "https://api.elsevier.com/content/object/eid/1-s2.0-S1381116903000475-gr5.gif?httpAccept=%2A%2F%2A",
            "@multimediatype": "GIF image file",
            "@type": "IMAGE-DOWNSAMPLED",
            "@size": "8113",
            "@ref": "gr5",
            "@mimetype": "image/gif"
          },
          {
            "@category": "thumbnail",
            "@height": "79",
            "@width": "125",
            "@_fa": "true",
            "$": "https://api.elsevier.com/content/object/eid/1-s2.0-S1381116903000475-gr6.sml?httpAccept=%2A%2F%2A",
            "@multimediatype": "GIF image file",
            "@type": "IMAGE-THUMBNAIL",
            "@size": "1954",
            "@ref": "gr6",
            "@mimetype": "image/gif"
          },
          {
            "@category": "standard",
            "@height": "254",
            "@width": "404",
            "@_fa": "true",
            "$": "https://api.elsevier.com/content/object/eid/1-s2.0-S1381116903000475-gr6.gif?httpAccept=%2A%2F%2A",
            "@multimediatype": "GIF image file",
            "@type": "IMAGE-DOWNSAMPLED",
            "@size": "10821",
            "@ref": "gr6",
            "@mimetype": "image/gif"
          },
          {
            "@category": "thumbnail",
            "@height": "78",
            "@width": "125",
            "@_fa": "true",
            "$": "https://api.elsevier.com/content/object/eid/1-s2.0-S1381116903000475-gr7.sml?httpAccept=%2A%2F%2A",
            "@multimediatype": "GIF image file",
            "@type": "IMAGE-THUMBNAIL",
            "@size": "1572",
            "@ref": "gr7",
            "@mimetype": "image/gif"
          },
          {
            "@category": "standard",
            "@height": "252",
            "@width": "402",
            "@_fa": "true",
            "$": "https://api.elsevier.com/content/object/eid/1-s2.0-S1381116903000475-gr7.gif?httpAccept=%2A%2F%2A",
            "@multimediatype": "GIF image file",
            "@type": "IMAGE-DOWNSAMPLED",
            "@size": "8690",
            "@ref": "gr7",
            "@mimetype": "image/gif"
          },
          {
            "@category": "thumbnail",
            "@height": "83",
            "@width": "125",
            "@_fa": "true",
            "$": "https://api.elsevier.com/content/object/eid/1-s2.0-S1381116903000475-gr8.sml?httpAccept=%2A%2F%2A",
            "@multimediatype": "GIF image file",
            "@type": "IMAGE-THUMBNAIL",
            "@size": "1644",
            "@ref": "gr8",
            "@mimetype": "image/gif"
          },
          {
            "@category": "standard",
            "@height": "215",
            "@width": "322",
            "@_fa": "true",
            "$": "https://api.elsevier.com/content/object/eid/1-s2.0-S1381116903000475-gr8.gif?httpAccept=%2A%2F%2A",
            "@multimediatype": "GIF image file",
            "@type": "IMAGE-DOWNSAMPLED",
            "@size": "6092",
            "@ref": "gr8",
            "@mimetype": "image/gif"
          },
          {
            "@category": "thumbnail",
            "@height": "83",
            "@width": "125",
            "@_fa": "true",
            "$": "https://api.elsevier.com/content/object/eid/1-s2.0-S1381116903000475-gr9.sml?httpAccept=%2A%2F%2A",
            "@multimediatype": "GIF image file",
            "@type": "IMAGE-THUMBNAIL",
            "@size": "1561",
            "@ref": "gr9",
            "@mimetype": "image/gif"
          },
          {
            "@category": "standard",
            "@height": "214",
            "@width": "322",
            "@_fa": "true",
            "$": "https://api.elsevier.com/content/object/eid/1-s2.0-S1381116903000475-gr9.gif?httpAccept=%2A%2F%2A",
            "@multimediatype": "GIF image file",
            "@type": "IMAGE-DOWNSAMPLED",
            "@size": "5668",
            "@ref": "gr9",
            "@mimetype": "image/gif"
          }
        ]
      },
      "link": {
        "@rel": "abstract",
        "@href": "https://api.elsevier.com/content/abstract/scopus_id/0038518330"
      }
    }
  }
}