{
  "metadata": {
    "title": "Asymmetric hydrogenation of aromatic ketones with MeO-PEG-supported BIPHEP/DPEN ruthenium catalysts",
    "authors": "; ; ",
    "journal": "Journal of Molecular Catalysis A: Chemical",
    "date": "2007-06-01",
    "doi": "10.1016/j.molcata.2007.01.042",
    "abstract": "",
    "uri": "https://api.elsevier.com/content/article/pii/S1381116907000751",
    "pii": "S1381116907000751"
  },
  "fulltext": {
    "full-text-retrieval-response": {
      "scopus-eid": "2-s2.0-34247179138",
      "originalText": "serial JL 271358 291210 291744 291790 291809 31 Journal of Molecular Catalysis A: Chemical JOURNALMOLECULARCATALYSISACHEMICAL 2007-01-26 2007-01-26 2010-03-27T18:10:43 1-s2.0-S1381116907000751 S1381-1169(07)00075-1 S1381116907000751 10.1016/j.molcata.2007.01.042 S300 S300.1 FULL-TEXT 1-s2.0-S1381116907X02528 2015-05-15T05:56:33.323092-04:00 0 0 20070601 2007 2007-01-26T00:00:00Z articleinfo crossmark dco dateupdated tomb dateloaded datesearch indexeddate issuelist volumelist yearnav absattachment articletitlenorm authfirstinitialnorm authfirstsurnamenorm cid cids contenttype copyright dateloadedtxt docsubtype doctype doi eid ewtransactionid hubeid issfirst issn issnnorm itemstage itemtransactionid itemweight openaccess openarchive pg pgfirst pglast pii piinorm pubdatestart pubdatetxt pubyr sortorder srctitle srctitlenorm srctype subheadings volfirst volissue webpdf webpdfpagecount figure table body mmlmath acknowledge affil articletitle auth authfirstini authfull authkeywords authlast primabst ref specialabst alllist content subj ssids 1381-1169 13811169 270 270 1 2 1 2 Volume 270, Issues 1–2 11 83 88 83 88 20070601 1 June 2007 2007-06-01 2007 article fla Copyright © 2007 Elsevier B.V. All rights reserved. ASYMMETRICHYDROGENATIONAROMATICKETONESMEOPEGSUPPORTEDBIPHEPDPENRUTHENIUMCATALYSTS CHAI L 1 Introduction 2 Experimental 2.1 General experimental procedures 2.2 General procedure for preparation of supported diphosphine-Ru-diamine catalysts (S, SS)-5 2.3 Typical procedure for asymmetric hydrogenation of ketones 2.4 Catalyst recycle 3 Results and discussion 4 Conclusion Acknowledgements References NOYORI 1994 R ASYMMETRICCATALYSISINORGANICSYNTHESIS PINI 1995 155 176 D CHIRALREACTIONSINHETEROGENEOUSCATALYSIS SHUTTLEWORTH 1997 1217 S ERMERT 1998 44 84 P SOLIDSUPPORTEDCOMBINATORIALPARALLELSYNTHESISSMALLMOLECULARWEIGHTCOMPOUNDLIBRARIES ZUMBRUNN 1998 235 243 C SOLIDSUPPORTEDCOMBINATORIALPARALLELSYNTHESISSMALLMOLECULARWEIGHTCOMPOUNDLIBRARIES FAN 2002 3385 Q BENAGLIA 2003 3401 M NOYORI 1999 1493 R NOYORI 2001 227 R NOYORI 2001 40 R OHKUMA 2001 369 T TERHALLE 2000 680 R YU 2000 1681 H DENG 2003 21 G LI 2003 4559 X LIANG 2005 7694 Y HU 2003 11490 A HU 2005 12486 A DENG 2006 118 G SCHMID 1988 897 R SCHMID 1991 370 R SCHMID 1996 131 R ZHANG 2000 6223 Z QIU 2006 5955 L STEINER 2004 2307 I CHAI 2006 2395 L PIKUL 1998 387 S CAO 1999 2127 P OHKUMA 1998 13529 T OHKUMA 2000 1749 T FAN 2001 1241 Q OHKUMA 1995 2675 T CHAIX2007X83 CHAIX2007X83X88 CHAIX2007X83XL CHAIX2007X83X88XL item S1381-1169(07)00075-1 S1381116907000751 1-s2.0-S1381116907000751 10.1016/j.molcata.2007.01.042 271358 2010-09-17T22:43:11.281294-04:00 2007-06-01 1-s2.0-S1381116907000751-main.pdf https://s3.amazonaws.com/prod-ucs-content-store-us-east/content/pii:S1381116907000751/MAIN/application/pdf/1f7de76933fa3b5d3e7266652555b0cb/main.pdf https://s3-eu-west-1.amazonaws.com/prod-ucs-content-store-eu-west/content/pii:S1381116907000751/MAIN/application/pdf/1f7de76933fa3b5d3e7266652555b0cb/main.pdf main.pdf pdf true 236523 MAIN 6 1-s2.0-S1381116907000751-main_1.png https://s3-eu-west-1.amazonaws.com/prod-ucs-content-store-eu-west/content/pii:S1381116907000751/PREVIEW/image/png/6d24adab72abfc9b4fd06281dea769a6/main_1.png https://s3.amazonaws.com/prod-ucs-content-store-us-east/content/pii:S1381116907000751/PREVIEW/image/png/6d24adab72abfc9b4fd06281dea769a6/main_1.png main_1.png png 72290 849 656 IMAGE-WEB-PDF 1 1-s2.0-S1381116907000751-si4.gif https://s3.amazonaws.com/prod-ucs-content-store-us-east/content/pii:S1381116907000751/STRIPIN/image/gif/5ac553d6c398b08f13082baf64a0882f/si2.gif https://s3-eu-west-1.amazonaws.com/prod-ucs-content-store-eu-west/content/pii:S1381116907000751/STRIPIN/image/gif/5ac553d6c398b08f13082baf64a0882f/si2.gif si4 si4.gif gif 257 19 33 ALTIMG 1-s2.0-S1381116907000751-si3.gif https://s3.amazonaws.com/prod-ucs-content-store-us-east/content/pii:S1381116907000751/STRIPIN/image/gif/a12df581be49437896c5c0650350338a/si3.gif https://s3-eu-west-1.amazonaws.com/prod-ucs-content-store-eu-west/content/pii:S1381116907000751/STRIPIN/image/gif/a12df581be49437896c5c0650350338a/si3.gif si3 si3.gif gif 242 19 32 ALTIMG 1-s2.0-S1381116907000751-si2.gif https://s3.amazonaws.com/prod-ucs-content-store-us-east/content/pii:S1381116907000751/STRIPIN/image/gif/5ac553d6c398b08f13082baf64a0882f/si2.gif https://s3-eu-west-1.amazonaws.com/prod-ucs-content-store-eu-west/content/pii:S1381116907000751/STRIPIN/image/gif/5ac553d6c398b08f13082baf64a0882f/si2.gif si2 si2.gif gif 257 19 33 ALTIMG 1-s2.0-S1381116907000751-si1.gif https://s3.amazonaws.com/prod-ucs-content-store-us-east/content/pii:S1381116907000751/STRIPIN/image/gif/a12df581be49437896c5c0650350338a/si3.gif https://s3-eu-west-1.amazonaws.com/prod-ucs-content-store-eu-west/content/pii:S1381116907000751/STRIPIN/image/gif/a12df581be49437896c5c0650350338a/si3.gif si1 si1.gif gif 242 19 32 ALTIMG 1-s2.0-S1381116907000751-fx10.gif https://s3.amazonaws.com/prod-ucs-content-store-us-east/content/pii:S1381116907000751/fx10/DOWNSAMPLED/image/gif/608329bba32d024b616dc29ab6464504/fx10.gif https://s3-eu-west-1.amazonaws.com/prod-ucs-content-store-eu-west/content/pii:S1381116907000751/fx10/DOWNSAMPLED/image/gif/608329bba32d024b616dc29ab6464504/fx10.gif fx10 fx10.gif gif 497 54 67 IMAGE-DOWNSAMPLED 1-s2.0-S1381116907000751-fx10.sml https://s3.amazonaws.com/prod-ucs-content-store-us-east/content/pii:S1381116907000751/fx10/THUMBNAIL/image/gif/da84d0548a9e10c0d3bcfeaa73bb00bb/fx10.sml https://s3-eu-west-1.amazonaws.com/prod-ucs-content-store-eu-west/content/pii:S1381116907000751/fx10/THUMBNAIL/image/gif/da84d0548a9e10c0d3bcfeaa73bb00bb/fx10.sml fx10 fx10.sml sml 946 93 115 IMAGE-THUMBNAIL 1-s2.0-S1381116907000751-fx11.gif https://s3.amazonaws.com/prod-ucs-content-store-us-east/content/pii:S1381116907000751/fx11/DOWNSAMPLED/image/gif/6f4a92443f575e69650ba2991fbd7b2b/fx11.gif https://s3-eu-west-1.amazonaws.com/prod-ucs-content-store-eu-west/content/pii:S1381116907000751/fx11/DOWNSAMPLED/image/gif/6f4a92443f575e69650ba2991fbd7b2b/fx11.gif fx11 fx11.gif gif 451 50 51 IMAGE-DOWNSAMPLED 1-s2.0-S1381116907000751-fx11.sml https://s3.amazonaws.com/prod-ucs-content-store-us-east/content/pii:S1381116907000751/fx11/THUMBNAIL/image/gif/d8dde245d6e529689a65ced04fe91314/fx11.sml https://s3-eu-west-1.amazonaws.com/prod-ucs-content-store-eu-west/content/pii:S1381116907000751/fx11/THUMBNAIL/image/gif/d8dde245d6e529689a65ced04fe91314/fx11.sml fx11 fx11.sml sml 908 93 94 IMAGE-THUMBNAIL 1-s2.0-S1381116907000751-fx12.gif https://s3.amazonaws.com/prod-ucs-content-store-us-east/content/pii:S1381116907000751/fx12/DOWNSAMPLED/image/gif/0e7ca0972f22f803c6a6de37c33cf959/fx12.gif https://s3-eu-west-1.amazonaws.com/prod-ucs-content-store-eu-west/content/pii:S1381116907000751/fx12/DOWNSAMPLED/image/gif/0e7ca0972f22f803c6a6de37c33cf959/fx12.gif fx12 fx12.gif gif 454 35 57 IMAGE-DOWNSAMPLED 1-s2.0-S1381116907000751-fx12.sml https://s3.amazonaws.com/prod-ucs-content-store-us-east/content/pii:S1381116907000751/fx12/THUMBNAIL/image/gif/7552cf982be5b16e51e5c52a91181a1b/fx12.sml https://s3-eu-west-1.amazonaws.com/prod-ucs-content-store-eu-west/content/pii:S1381116907000751/fx12/THUMBNAIL/image/gif/7552cf982be5b16e51e5c52a91181a1b/fx12.sml fx12 fx12.sml sml 1102 77 125 IMAGE-THUMBNAIL 1-s2.0-S1381116907000751-fx13.gif https://s3.amazonaws.com/prod-ucs-content-store-us-east/content/pii:S1381116907000751/fx13/DOWNSAMPLED/image/gif/16cf7d730f9bf9c500d185617f955a21/fx13.gif https://s3-eu-west-1.amazonaws.com/prod-ucs-content-store-eu-west/content/pii:S1381116907000751/fx13/DOWNSAMPLED/image/gif/16cf7d730f9bf9c500d185617f955a21/fx13.gif fx13 fx13.gif gif 577 58 55 IMAGE-DOWNSAMPLED 1-s2.0-S1381116907000751-fx13.sml https://s3.amazonaws.com/prod-ucs-content-store-us-east/content/pii:S1381116907000751/fx13/THUMBNAIL/image/gif/62d274e8e6321e7a8047ef5c72857f82/fx13.sml https://s3-eu-west-1.amazonaws.com/prod-ucs-content-store-eu-west/content/pii:S1381116907000751/fx13/THUMBNAIL/image/gif/62d274e8e6321e7a8047ef5c72857f82/fx13.sml fx13 fx13.sml sml 1026 93 89 IMAGE-THUMBNAIL 1-s2.0-S1381116907000751-fx14.gif https://s3.amazonaws.com/prod-ucs-content-store-us-east/content/pii:S1381116907000751/fx14/DOWNSAMPLED/image/gif/ded354a532b3c68d28ab17970031be2b/fx14.gif https://s3-eu-west-1.amazonaws.com/prod-ucs-content-store-eu-west/content/pii:S1381116907000751/fx14/DOWNSAMPLED/image/gif/ded354a532b3c68d28ab17970031be2b/fx14.gif fx14 fx14.gif gif 4128 91 489 IMAGE-DOWNSAMPLED 1-s2.0-S1381116907000751-fx14.sml https://s3.amazonaws.com/prod-ucs-content-store-us-east/content/pii:S1381116907000751/fx14/THUMBNAIL/image/gif/9a75e291ec3e6f032d4bfc92f1eb0eb0/fx14.sml https://s3-eu-west-1.amazonaws.com/prod-ucs-content-store-eu-west/content/pii:S1381116907000751/fx14/THUMBNAIL/image/gif/9a75e291ec3e6f032d4bfc92f1eb0eb0/fx14.sml fx14 fx14.sml sml 555 23 125 IMAGE-THUMBNAIL 1-s2.0-S1381116907000751-fx2.gif https://s3.amazonaws.com/prod-ucs-content-store-us-east/content/pii:S1381116907000751/fx2/DOWNSAMPLED/image/gif/74cbc2d334989a0665e1fa2e97d1caa8/fx2.gif https://s3-eu-west-1.amazonaws.com/prod-ucs-content-store-eu-west/content/pii:S1381116907000751/fx2/DOWNSAMPLED/image/gif/74cbc2d334989a0665e1fa2e97d1caa8/fx2.gif fx2 fx2.gif gif 3330 59 495 IMAGE-DOWNSAMPLED 1-s2.0-S1381116907000751-fx2.sml https://s3.amazonaws.com/prod-ucs-content-store-us-east/content/pii:S1381116907000751/fx2/THUMBNAIL/image/gif/d2bb04a8073f99685f120c2fd36b25c2/fx2.sml https://s3-eu-west-1.amazonaws.com/prod-ucs-content-store-eu-west/content/pii:S1381116907000751/fx2/THUMBNAIL/image/gif/d2bb04a8073f99685f120c2fd36b25c2/fx2.sml fx2 fx2.sml sml 471 15 125 IMAGE-THUMBNAIL 1-s2.0-S1381116907000751-fx3.gif https://s3.amazonaws.com/prod-ucs-content-store-us-east/content/pii:S1381116907000751/fx3/DOWNSAMPLED/image/gif/dfa9644a5490871ea60c4daf381badb6/fx3.gif https://s3-eu-west-1.amazonaws.com/prod-ucs-content-store-eu-west/content/pii:S1381116907000751/fx3/DOWNSAMPLED/image/gif/dfa9644a5490871ea60c4daf381badb6/fx3.gif fx3 fx3.gif gif 460 51 54 IMAGE-DOWNSAMPLED 1-s2.0-S1381116907000751-fx3.sml https://s3.amazonaws.com/prod-ucs-content-store-us-east/content/pii:S1381116907000751/fx3/THUMBNAIL/image/gif/49bbe12e768a5a2fe598a7f84d5e19e6/fx3.sml https://s3-eu-west-1.amazonaws.com/prod-ucs-content-store-eu-west/content/pii:S1381116907000751/fx3/THUMBNAIL/image/gif/49bbe12e768a5a2fe598a7f84d5e19e6/fx3.sml fx3 fx3.sml sml 923 94 100 IMAGE-THUMBNAIL 1-s2.0-S1381116907000751-fx4.gif https://s3.amazonaws.com/prod-ucs-content-store-us-east/content/pii:S1381116907000751/fx4/DOWNSAMPLED/image/gif/a446d7888669a97da7257821861992cb/fx4.gif https://s3-eu-west-1.amazonaws.com/prod-ucs-content-store-eu-west/content/pii:S1381116907000751/fx4/DOWNSAMPLED/image/gif/a446d7888669a97da7257821861992cb/fx4.gif fx4 fx4.gif gif 488 51 54 IMAGE-DOWNSAMPLED 1-s2.0-S1381116907000751-fx4.sml https://s3.amazonaws.com/prod-ucs-content-store-us-east/content/pii:S1381116907000751/fx4/THUMBNAIL/image/gif/fb41f2f03365aa0c258ad53811a50e0c/fx4.sml https://s3-eu-west-1.amazonaws.com/prod-ucs-content-store-eu-west/content/pii:S1381116907000751/fx4/THUMBNAIL/image/gif/fb41f2f03365aa0c258ad53811a50e0c/fx4.sml fx4 fx4.sml sml 984 94 100 IMAGE-THUMBNAIL 1-s2.0-S1381116907000751-fx5.gif https://s3.amazonaws.com/prod-ucs-content-store-us-east/content/pii:S1381116907000751/fx5/DOWNSAMPLED/image/gif/c3f2fc95981e59219f028f4f7978941f/fx5.gif https://s3-eu-west-1.amazonaws.com/prod-ucs-content-store-eu-west/content/pii:S1381116907000751/fx5/DOWNSAMPLED/image/gif/c3f2fc95981e59219f028f4f7978941f/fx5.gif fx5 fx5.gif gif 489 49 66 IMAGE-DOWNSAMPLED 1-s2.0-S1381116907000751-fx5.sml https://s3.amazonaws.com/prod-ucs-content-store-us-east/content/pii:S1381116907000751/fx5/THUMBNAIL/image/gif/2b0f9f17662ff5a832eb04f9c2029f24/fx5.sml https://s3-eu-west-1.amazonaws.com/prod-ucs-content-store-eu-west/content/pii:S1381116907000751/fx5/THUMBNAIL/image/gif/2b0f9f17662ff5a832eb04f9c2029f24/fx5.sml fx5 fx5.sml sml 971 93 125 IMAGE-THUMBNAIL 1-s2.0-S1381116907000751-fx6.gif https://s3.amazonaws.com/prod-ucs-content-store-us-east/content/pii:S1381116907000751/fx6/DOWNSAMPLED/image/gif/ed7415a120ab4ae18d26929fbe2e580b/fx6.gif https://s3-eu-west-1.amazonaws.com/prod-ucs-content-store-eu-west/content/pii:S1381116907000751/fx6/DOWNSAMPLED/image/gif/ed7415a120ab4ae18d26929fbe2e580b/fx6.gif fx6 fx6.gif gif 492 49 66 IMAGE-DOWNSAMPLED 1-s2.0-S1381116907000751-fx6.sml https://s3.amazonaws.com/prod-ucs-content-store-us-east/content/pii:S1381116907000751/fx6/THUMBNAIL/image/gif/f2c83d916b0f450e06eaf622bd2f1f1f/fx6.sml https://s3-eu-west-1.amazonaws.com/prod-ucs-content-store-eu-west/content/pii:S1381116907000751/fx6/THUMBNAIL/image/gif/f2c83d916b0f450e06eaf622bd2f1f1f/fx6.sml fx6 fx6.sml sml 982 93 125 IMAGE-THUMBNAIL 1-s2.0-S1381116907000751-fx7.gif https://s3.amazonaws.com/prod-ucs-content-store-us-east/content/pii:S1381116907000751/fx7/DOWNSAMPLED/image/gif/e5502fc922280f8fb1e1be71a4984f73/fx7.gif https://s3-eu-west-1.amazonaws.com/prod-ucs-content-store-eu-west/content/pii:S1381116907000751/fx7/DOWNSAMPLED/image/gif/e5502fc922280f8fb1e1be71a4984f73/fx7.gif fx7 fx7.gif gif 555 49 78 IMAGE-DOWNSAMPLED 1-s2.0-S1381116907000751-fx7.sml https://s3.amazonaws.com/prod-ucs-content-store-us-east/content/pii:S1381116907000751/fx7/THUMBNAIL/image/gif/4445d2bddf60139387a05881352f2cdc/fx7.sml https://s3-eu-west-1.amazonaws.com/prod-ucs-content-store-eu-west/content/pii:S1381116907000751/fx7/THUMBNAIL/image/gif/4445d2bddf60139387a05881352f2cdc/fx7.sml fx7 fx7.sml sml 969 78 125 IMAGE-THUMBNAIL 1-s2.0-S1381116907000751-fx8.gif https://s3.amazonaws.com/prod-ucs-content-store-us-east/content/pii:S1381116907000751/fx8/DOWNSAMPLED/image/gif/c0657b15fcb9eaeb2298c709d080524f/fx8.gif https://s3-eu-west-1.amazonaws.com/prod-ucs-content-store-eu-west/content/pii:S1381116907000751/fx8/DOWNSAMPLED/image/gif/c0657b15fcb9eaeb2298c709d080524f/fx8.gif fx8 fx8.gif gif 507 50 69 IMAGE-DOWNSAMPLED 1-s2.0-S1381116907000751-fx8.sml https://s3.amazonaws.com/prod-ucs-content-store-us-east/content/pii:S1381116907000751/fx8/THUMBNAIL/image/gif/ca333c9443908132b48dbdac57708247/fx8.sml https://s3-eu-west-1.amazonaws.com/prod-ucs-content-store-eu-west/content/pii:S1381116907000751/fx8/THUMBNAIL/image/gif/ca333c9443908132b48dbdac57708247/fx8.sml fx8 fx8.sml sml 1009 90 125 IMAGE-THUMBNAIL 1-s2.0-S1381116907000751-fx9.gif https://s3.amazonaws.com/prod-ucs-content-store-us-east/content/pii:S1381116907000751/fx9/DOWNSAMPLED/image/gif/16de44431eb19e12a265bd936912008b/fx9.gif https://s3-eu-west-1.amazonaws.com/prod-ucs-content-store-eu-west/content/pii:S1381116907000751/fx9/DOWNSAMPLED/image/gif/16de44431eb19e12a265bd936912008b/fx9.gif fx9 fx9.gif gif 478 50 64 IMAGE-DOWNSAMPLED 1-s2.0-S1381116907000751-fx9.sml https://s3.amazonaws.com/prod-ucs-content-store-us-east/content/pii:S1381116907000751/fx9/THUMBNAIL/image/gif/4b9fe6f42e4d7ff144f46e744f33c586/fx9.sml https://s3-eu-west-1.amazonaws.com/prod-ucs-content-store-eu-west/content/pii:S1381116907000751/fx9/THUMBNAIL/image/gif/4b9fe6f42e4d7ff144f46e744f33c586/fx9.sml fx9 fx9.sml sml 987 94 120 IMAGE-THUMBNAIL 1-s2.0-S1381116907000751-sc1.jpg https://s3.amazonaws.com/prod-ucs-content-store-us-east/content/pii:S1381116907000751/sc1/DOWNSAMPLED/image/jpeg/b90e1b98aa53792cae704d889fb3e919/sc1.jpg https://s3-eu-west-1.amazonaws.com/prod-ucs-content-store-eu-west/content/pii:S1381116907000751/sc1/DOWNSAMPLED/image/jpeg/b90e1b98aa53792cae704d889fb3e919/sc1.jpg sc1 sc1.jpg jpg 28705 269 635 IMAGE-DOWNSAMPLED 1-s2.0-S1381116907000751-sc1.sml https://s3.amazonaws.com/prod-ucs-content-store-us-east/content/pii:S1381116907000751/sc1/THUMBNAIL/image/gif/be29e492f4aa4541630c989c7f01dea8/sc1.sml https://s3-eu-west-1.amazonaws.com/prod-ucs-content-store-eu-west/content/pii:S1381116907000751/sc1/THUMBNAIL/image/gif/be29e492f4aa4541630c989c7f01dea8/sc1.sml sc1 sc1.sml sml 1014 53 125 IMAGE-THUMBNAIL 1-s2.0-S1381116907000751-fx1.gif https://s3.amazonaws.com/prod-ucs-content-store-us-east/content/pii:S1381116907000751/fx1/DOWNSAMPLED/image/gif/cfdbd295004bedc11cb72bd63a5f7f00/fx1.gif https://s3-eu-west-1.amazonaws.com/prod-ucs-content-store-eu-west/content/pii:S1381116907000751/fx1/DOWNSAMPLED/image/gif/cfdbd295004bedc11cb72bd63a5f7f00/fx1.gif fx1 true fx1.gif gif 5147 183 243 IMAGE-DOWNSAMPLED 1-s2.0-S1381116907000751-fx1.sml https://s3.amazonaws.com/prod-ucs-content-store-us-east/content/pii:S1381116907000751/fx1/THUMBNAIL/image/gif/2687c40bb5e91c4098a114a9e0e36b6d/fx1.sml https://s3-eu-west-1.amazonaws.com/prod-ucs-content-store-eu-west/content/pii:S1381116907000751/fx1/THUMBNAIL/image/gif/2687c40bb5e91c4098a114a9e0e36b6d/fx1.sml fx1 true fx1.sml sml 1953 94 124 IMAGE-THUMBNAIL MOLCAA 6572 S1381-1169(07)00075-1 10.1016/j.molcata.2007.01.042 Elsevier B.V. Scheme 1 Table 1 Asymmetric hydrogenation of aryl ketones using the in situ prepared MeO-PEG supported [RuCl2{(S)-BIPHEP}{(S,S)-DPEN}] catalyst 5 Entry Ketones Ligand Yield (%) a ee (%) b 1 (S)-3/(S,S)-4 >99 83.6 2 (S)-1/(S,S)-4 >99 81.2 3 (S)-BINAP/(S,S)-4 >99 82.3 4 (S)-3/(S,S)-4 >99 84.2 5 (S)-1/(S,S)-4 >99 82.1 6 (S)-BINAP/(S,S)-4 >99 95 c 7 (S)-3/(S,S)-4 >99 82.6 8 (S)-3/(S,S)-4 >99 85.7 9 (S)-3/(S,S)-4 >99 83.4 10 (S)-3/(S,S)-4 >99 62.4 11 (S)-3/(S,S)-4 >99 68.1 12 (S)-3/(S,S)-4 >99 96.5 13 (S)-1/(S,S)-4 >99 97.2 14 (S)-BINAP/(S,S)-4 >99 95.3 15 (S)-3/(S,S)-4 >99 54.5 16 (S)-3/(S,S)-4 >99 72.6 17 (S)-3/(S,S)-4 >99 95.9 18 (S)-1/(S,S)-4 >99 95.1 19 (S)-BINAP/(S,S)-4 >99 97 c Unless otherwise stated, the reaction was carried out at 25°C using 0.4mmol of aryl ketone in 20mL of 2-propanol; aryl ketone:ligand:Ru:diamine: t-C4H9OK=1000:1.1:1:1:20 (mol ratio); H2 pressure: 20atm; reaction time: 12h. a Determined by GC or 1H NMR. b Determined by chiral GC analysis. The absolute configuration of the product was determined by comparison of GC retention time or optical rotation sign with literature data and all were (R). c See ref. [32]. Table 2 Hydrogenation of 1-acetonaphthone using the in situ prepared MeO-PEG supported BIPHEP-Ru-DPEN catalyst 5 Entry Ligand Conversion (%) a ee (%) b Configuration c 1 (S)-1/(S,S)-4 >99 95.1 R 2 (S)-3/(S,S)-4 >99 95.9 R 3 (R)-1/(S,S)-4 >99 16.2 S 4 (R)-3/(S,S)-4 >99 10.3 S 5 (S)-3/(±)-4 >99 75.9 R All reactions were carried out at 25°C using 0.4mmol of aryl ketone in aryl ketone:ligand:Ru:diamine: t-C4H9OK=1000:1.1:1:1:20 (mol ratio); 20mL of 2-propanol; H2 pressure: 20atm; reaction time: 12h. a Determined by GC analysis or 1H NMR. b Determined by chiral GC analysis. c The product absolute configuration was determined by comparison of GC retention time or optical rotation sign with literature data. Table 3 Asymmetric hydrogenation of 1′-acetonaphthone by [RuCl2{(S)-3}{(S,S)-4}]: recycling of the catalyst Reusing run Time (h) Yield (%) a ee (%) b 1 12 99 95.9 2 12 99 94.5 3 12 99 94.2 4 12 98 92.1 5 24 95 89.1 6 24 43 73.1 All reactions were carried out at 25°C using 0.4mmol of aryl ketone in aryl ketone:ligand:Ru:diamine:t-C4H9OK=1000:1.1:1:1:20 (mol ratio); 20mL of 2-propanol; H2 pressure: 20atm; reaction time: 12h. a Isolate yield. b Determined by chiral GC analysis. The product configuration was determined by comparison of GC retention time or optical rotation sign with literature data and was (R). Asymmetric hydrogenation of aromatic ketones with MeO-PEG-supported BIPHEP/DPEN ruthenium catalysts Li-Ting Chai Wei-Wei Wang Quan-Rui Wang ⁎ Feng-Gang Tao Department of Chemistry, Fudan University, Shanghai 200433, PR China ⁎ Corresponding author. Tel.: +86 21 65648139; fax: +86 21 65641740. A soluble polymer (MeO-PEG) supported biphenylbisphosphine (BIPHEP)-Ru/chiral diamine (1,2-diphenylethylenediamine) complex, in which the polymer is attached to the two phenyl rings of BIPHEP ligand, has been prepared, and shown to be highly active with good enantioselectivity for the catalyzed asymmetric hydrogenation of unfunctionalized aromatic ketones. The derived chiral ruthenium complex 5 proved to be stable in air allowing facile catalyst recycling. Especially for 4′-tert-butyl-acetophenone and 1-acetonaphthone, excellent ee values up to 96.5% and 95.9% have been obtained which are comparable to or even higher than the enantioselectivity achieved with 2,2′-bis(diphenylphosphino)-1,1′-binaphthyl-Ru-DPEN catalyst under similar conditions. Graphical abstract The soluble MeO-PEG-supported BIPHEP-Ru/chiral diamine (DPEN) complex 5 was prepared, and employed as catalyst for asymmetric hydrogenation of various aromatic ketones, providing comparable or even higher enantioselectivity than that achieved with BINAP-Ru-DPEN catalyst under similar conditions. The catalyst showed good recoverability, and could be used for five consecutive runs without a significant drop in enantioselectivity. Keywords MeO-PEG Supported catalyst Asymmetric hydrogenation Aryl ketones 1 Introduction Asymmetric hydrogenation reactions catalyzed by homogeneous chiral transition-metal complexes provide a fundamental tool for the preparation of optically active organic compounds [1]. Polymer supported catalysts have inherent operational and economical advantages: facilitating the separation from reaction mixtures, easy recovery and reuse of the expensive but always toxic chiral compounds. As a consequence, numerous polymer supported (pre)catalysts have been developed during the past decades [2–7]. In recent years, RuCl2(phosphine)2(1,2-diamine) complexes, coupled with an alkaline base in 2-propanol, which were introduced by Noyori and coworkers [8–10], have been exploited as effective catalysts for asymmetric hydrogenation of simple ketones. Their high efficiency has prompted Noyori and coworkers’ [11] and other groups [12–19] to explore their immobilization on polymers or other solids. Taking the frequently employed 2,2′-bis(diphenylphosphino)-1,1′-binaphthyl (BINAP) and the optically active 1,2-diphenylethylenediamine (DPEN] as examples, the attachment has been attempted either through the naphthyl rings of the coordinated BINAP ligand or the phenyl rings of DPEN moiety. Biphenylbisphosphine ligands such as (6,6′-dimethoxy-biphenyl-2,2′-diyl)bis(diphenylphosphine) (MeO-BIPHEP) [20–24] recently aroused great interest. They have demonstrated excellent results in the field of ruthenium-mediated asymmetric hydrogenation, especially for aromatic ketones. However, to the best of our awareness, immobilization of these ligands has not been well addressed [19,25]. Most recently, we have developed a soluble polymer (MeO-PEG) supported chiral BIPHEP-RuBr2 catalyst, which offered high activity in comparison with the parent homogeneous catalyst while retaining high stereoselectivity [26]. This approach combines the advantages of homogeneous and heterogeneous catalysis. In order to establish more generality and versatility of this methodology, we aimed to develop other polymer-supported catalysts with better recovery performance and high enantioselectivity. Herein, we wish to report the preparation of a soluble polymer (MeO-PEG) supported BIPHEP-Ru/chiral diamine (DPEN) complex (MeO-PEG BIPHEP-Ru-DPEN) and its use as a catalyst for the asymmetric hydrogenation of a number of aromatic ketones. It was found that the catalyst furnished high activity, good stereoselectivity and exceptional stability for reuse. 2 Experimental 2.1 General experimental procedures The 1H NMR spectra were acquired in CDCl3 as solvent on a JEOL 400MHz spectrometer. The 31P NMR spectra were acquired in D2O as solvent at 203MHz on a Bruker spectrometer. The chemical shifts (δ) of 1H NMR resonances are expressed in ppm (parts per million) relative to TMS. The chemical shifts (δ) of 31P NMR resonances are reported in ppm relative to the external standard of 85% H3PO4. Spin–spin coupling constants (J) were measured directly from the spectra and were given in Hz. The reactions were monitored by thin layer chromatography coated with silica gel. Enantiomeric excesses were determined on chiral GC with a Supelco β-Dex 120 (60m×0.25mm) column. All solvents were purified and dried by standard procedures and kept over a suitable drying agent prior to use. [RuCl2(benzene)]2 was purchased from Aldrich and used as received. The ketone substrates were obtained from Lancaster or previously synthesized and purified by washing with aqueous NaOH solution (0.1M) and distillation or recrystallization prior to use. The MeO-PEG-immobilized ligand 3 was prepared as previously described [26]. (S,S)-DPEN 4 was prepared according to the literature strategy [27]. The loading amounts of the MeO-BIPHEP on the polymer were revealed to be 0.21mmol/g by elemental analysis. 2.2 General procedure for preparation of supported diphosphine-Ru-diamine catalysts (S, SS)-5 The polymer supported ligand 3 (4.4μmol) and [RuCl2(benzene)]2 (2μmol) were dissolved in anhydrous and degassed DMF (1mL) under argon. The mixture was heated to 100°C for 10–20min. After cooling to room temperature, the chiral diamine 4 (4μmol) was added and the resultant mixture was heated to 80°C and stirred for 2h. The solvent was removed under high vacuum to provide the catalyst (S,SS)-5, which was used for hydrogenations without further purification. 2.3 Typical procedure for asymmetric hydrogenation of ketones Standard procedure at Substrate/Complex=1000: An autoclave containing a steel liner was charged with the Ru complex (S, SS)-5 (20mg, 4μmol), i-PrOH (20mL), ketone (4mmol) and t-BuOK in t-BuOH (1M, 0.08mL, 0.08mmol) in air. The reaction was pressurized to 20atm with H2. After stirring at room temperature for 12h, the remaining H2 was carefully released. After removal of the most solvent under vacuum, the mixture was cooled to 0°C and cold Et2O (20mL) was added. The mixture was passed through a short silica gel column and the filtrate was concentrated. The residual product was used directly for NMR and chiral GC analysis. The stereochemistry of products was assigned by comparing the GC retention time or optical rotation signs with literature data [Supelco β-Dex 120 (60m×0.25mm) column; carrier gas: nitrogen, 3atm; injection temperature: 220°C; detection temperature: 250°C]. (R)-1-Phenylethanol [18]: column temperature: 100–140°C, 1°C/min, hold for 30min; 35.7min (R), 36.2min (S); >99% conversion, 83.6% ee. 1H NMR (400MHz, CDCl3, δ): 7.38–7.33 (m, 4H), 7.27 (t, J =6.8Hz, 1H), 4.91–4.87 (m, 1H), 1.88 (br, 1H), 1.51 (d, J =6.4Hz, 3H). (R)-1-(2′-Methylphenyl)ethanol [28]: column temperature: 120–160°C, 1°C/min, hold for 40min; 52.6min (R), 54.9min (S); >99% conversion, 84.2% ee. 1H NMR (400MHz, CDCl3, δ): 7.51 (d, J =6.4Hz, 1H), 7.17–7.13 (m, 3H), 5.14–5.10 (m, 1H), 2.34 (s, 3H), 1.86 (br, 1H), 1.46 (d, J =6.4Hz, 3H). (R)-1-(3′-Methylphenyl)ethanol [29]: [ α ] D 25 +28.6° (neat), (lit. [ α ] D 24 +39.7° (neat), pure R). Column temperature: 110–160°C, 1°C/min, hold for 40min; 55.5min (R), 57.0min (S); >99% conversion, 82.6% ee. 1H NMR (400MHz, CDCl3, δ): 7.26–7.08 (m, 4H), 4.88–4.83 (m, 1H), 2.36 (s, 3H), 1.83 (br, 1H), 1.48 (d, J =6.4Hz, 3H). (R)-1-(4′-Methylphenyl)ethanol [18]: column temperature: 110–150°C, 1°C/min, hold for 40min; 64.5min (R), 65.5min (S); >99% conversion, 85.7% ee. 1H NMR (400MHz, CDCl3, δ): 7.27 (d, J =7.8Hz, 2 H), 7.18 (d, J =7.8Hz, 2H), 4.89–4.84 (m, 1H), 2.37 (s, 3H), 2.0 (br, 1H), 1.49 (d, J =6.4Hz, 3H). (R)-1-(4′-Methoxyphenyl)ethanol [18]: column temperature: 150–180°C, 1°C/min, hold for 40min; 60.2min (R), 61.1min (S); >99% conversion, 83.4% ee. 1H NMR (400MHz, CDCl3, δ): 7.28 (d, J =8.3Hz, 2H), 6.87 (d, J =8.7Hz, 2H), 4.85–4.80 (m, 1H), 3.80 (s, 3H), 2.2 (br, 1H), 1.46 (d, J =6.9Hz, 3H). (R)-1-(4′-Chlorophenyl)ethanol [18]: column temperature: 150–180°C, 1°C/min, hold for 40min; 47.7min (R), 48.7min (S); >99% conversion, 62.4% ee. 1H NMR (400MHz, CDCl3, δ): 7.34–7.30 (m, 4H), 4.91–4.86 (m, 1H), 1.82 (br, 1H), 1.47 (d, J =6.4Hz, 3H). (R)-1-(4′-Fluorophenyl)ethanol [28]: column temperature: 150–180°C, 1°C/min, hold for 40min; 28.9min (R), 29.4min (S); >99% conversion, 68.1% ee. 1H NMR (400MHz, CDCl3, δ): 7.35–7.32 (m, 2H), 7.05–7.00 (m, 2H), 4.91–4.86 (m, 1H), 1.97 (br, 1H), 1.47 (d, J =6.4Hz, 3H). (R)-1-(4′-tert-Butylphenyl)ethanol [18]: column temperature: 130–170°C, 1°C/min, hold for 40min; 68.2min (R), 69.1min (S); >99% conversion, 96.5% ee. 1H NMR (400MHz, CDCl3, δ): 7.38 (d, J =8.7, 2H), 7.32 (d, J =8.7, 2H), 4.91–4.87 (m, 1H), 1.76 (br, 1H), 1.51 (d, J =6.4Hz, 3H), 1.33 (s, 9H). (R)-1-(3-Pyridyl)ethanol: column temperature [30]: [ α ] D 25 +28.7° (c 0.90, EtOH), (lit. [ α ] D 24 −56.3° (c 1.00, EtOH), 99.6% ee, S). 120–150°C, 1°C/min, hold for 60min; 68.7min (R), 70.9min (S); >99% conversion, 54.5% ee. 1H NMR (400MHz, CDCl3, δ): 8.51–8.42 (m, 2H), 7.75–7.73 (m, 1H), 7.29–7.27 (m, 1H), 4.95–4.91 (m, 1H), 3.33 (br, 1H), 1.50 (d, J =6.4Hz, 3H). (R)-1-(Thiophen-2-yl)ethanol: column temperature [28]: 130–160°C, 1°C/min, hold for 10min and then 160–180°C, 2°C/min; 39.7min (R), 40.6min (S); >99% conversion, 72.6% ee. 1H NMR (400MHz, CDCl3, δ): 7.27–7.24 (m, 1H), 6.99–6.93 (m, 2H), 5.17–5.12 (m, 1H), 1.90 (br, 1H), 1.61 (d, J =6.4Hz, 3H). (R)-1-(1-Naphthyl)ethanol [18]: column temperature: 180–200°C, 1°C/min, hold for 40min and then 200–220°C, 2°C/min, hold for 30min; 75.6min (S), 76.3min (R); >99% conversion, 95.9% ee. 1H NMR (400MHz, CDCl3, δ): 8.12 (d, J =8.2Hz, 1H), 7.89 (d, J =7.8Hz, 1H), 7.79 (d, J =8.2Hz, 1H), 7.68 (d, J =6.9Hz, 1H), 7.56–7.47 (m, 3H), 5.69–5.64 (m, 1H), 2.09 (br, 1H), 1.67 (d, J =6.4Hz, 3H). 2.4 Catalyst recycle An autoclave containing a steel liner was charged with the Ru complex (S, SS)-5 (20mg, 4μmol), i-PrOH (20mL), 1-acetonaphthone (0.68g, 4mmol) and t-BuOK in t-BuOH (1M, 0.08mL, 0.08mmol) in air. The reaction mixture was degassed with 10atm H2 five times and finally the autoclave was pressurized to 20atm with H2. After stirring at room temperature for 12h, the remaining H2 was carefully released. After removal of the most solvent under vacuum, the mixture was cooled to 0°C and cold Et2O (20mL) was added. The precipitated polymeric catalyst was collected by filtration for re-use in the next run. The filtrate was washed with water and brine and dried with anhydrous Na2SO4. After removal of the solvent the residuals were analyzed by NMR and chiral GC to determine the conversion rate and the enantiomeric excesses of the chiral alcohol product. To start a new run, dry i-PrOH (20mL), acetonaphthone (0.68g, 4mmol) and t-BuOK in t-BuOH (1M, 0.08mL, 0.08mmol) were sequentially added to the catalyst-containing autoclave. The reaction was repeated under 20atm H2 as above. The third run was performed in the same manner as the second one. 3 Results and discussion Our strategy commenced with the preparation of enantiomerically pure MeO-BIPHEP (S)-1, which was achieved using a well-documented procedure [20,21]. Demethylation of 1 with BBr3 gave rise to HO-BIPHEP (S)-2 in high yield [23]. The soluble polymer-supported BIPHEP ligand (S)-3 was synthesized by condensation of HO-BIPHEP (S)-2 with MeO-PEG-OMs (Mw∼2100) according to our recently reported method [26] (Scheme 1 ). MeO-PEG was the choice of polymer support due to the following advantages: MeO-PEG is not only commercially available, inexpensive and nontoxic but also it has a broad solubility profile in common organic solvents (soluble in methanol, THF, dichloromethane, toluene, DMF, acetonitrile and water, yet insoluble in diethyl ether, tert-butyl methyl ether, cold 2-propanol and cold ethanol) [31]. The supported ligand (S)-3 showed a predominant 31P NMR signal at −14.05ppm which was very close to the corresponding parent MeO-BIPHEP (−14.00). (S,S)-1,2-diphenylethylenediamine [(S,S)-DPEN] 4 was chosen as the diamine ligand. The ruthenium catalysts were prepared according to Noyori and Ohkuma's protocol [32]. Thus, for example, the MeO-PEG supported Ru-BIPHEP pre-catalyst was prepared by reacting the MeO-PEG supported BIPHEP ligand (S)-3 with [RuCl2(benzene)]2 at 100°C in DMF for 10min, followed by treatment with one equivalent of (S,S)-1,2-diphenylethylenediamine 4 [(S,S)-DPEN] at 80°C for additional 2h. The resulting supported Ru complexes were investigated on the catalytic asymmetric reductions without further treatment. 2-Propanol was chosen as solvent, for the polymer-bound Ru complex 5 was highly soluble in warm 2-propanol, but insoluble in cold 2-propanol. The reduction was carried out in 20mL dry 2-propanol at 25°C for 12h in a molar ratio of aryl ketone:ligand:Ru:diamine:t-C4H9OK=1000:1.1:1:1:20 with an initial H2 pressure of 20atm. Under this standard condition, the MeO-PEG supported [RuCl2{(S)-BIPHEP}{(S,S)-DPEN}] catalyst 5 exhibited very good enantioselectivity for the hydrogenation of a range of aryl ketones. The experimental results are summarized in Table 1 . For instance, hydrogenation of 1-acetonaphthone and acetophenone catalyzed by MeO-PEG supported catalyst 5 gave 95.9% and 84.3% ee, respectively, which are comparable to the enantioselectivity reported by Noyori et al. under similar conditions using chiral BINAP-Ru-DPEN catalysts [10] (Table 1, entries 1 versus 3; entries 17 versus 19) and higher than that of the heterogeneous poly(BINAP)-Ru catalyst reported by Pu and co-workers [13] and also comparable to that of homogeneous dendritic BINAP-Ru-DPEN catalysts reported by Fan and coworkers [14]. Interestingly, hydrogenation of 4′-tert-butyl-acetophenone catalyzed by MeO-PEG supported catalyst 5 provided excellent enantioselectivity up to 96.5% ee, which is even higher than that of the homogeneous BINAP-Ru-DPEN catalyst under comparable conditions (Table 1, entries 12 versus 14) and nanoparticles supported BINAP-Ru-DPEN catalysts, which was recently reported by Lin and coworkers [17]. The enantioselective reduction of heteroaryl methyl ketones, such as 3-acetylpyridine and 2-acetylthiophene, was carried out under similar conditions. The reduction was found to proceed with a high conversion (>99%) and good enantioselectivity (Table 1, entries 14 and 15), providing the optically active (R)-1-(heteroaryl)ethanol. Compared to the parent homogeneous catalyst, the MeO-PEG supported BIPHEP-Ru-DPEN complex offered similar or even higher enantioselectivity (Table 1, entries 1 versus 2, entries 4 versus 5, entries 12 versus 13, entries 17 versus 18). This indicated that the attachment of the active catalyst to the soluble polymer MeO-PEG had no or little influence or even was more profitable to the asymmetric hydrogenation of simple aryl ketones. We also found that the polymer supported ligand 3 was so stable that it could be stored for months while maintaining high activity and enantioselectivity. As such, the work-up of the catalyst could be done in the air conditions, which facilitated the recovery extremely. We also found that the match of the steric environment of the chiral diamine with that of the MeO-PEG supported chiral BIPHEP ligand plays a pivotal role for achieving high enantioselectivity, which is consistent with Noyori and Ohkuma's observation [10]. Using hydrogenation of 1-acetonaphthone as a standard reaction, we found that matching combination of MeO-PEG supported RuCl2[(S)-BIPHEP] (3) and (S,S)-DPEN (4) resulted in 95.9% ee, while the mismatching combination of MeO-PEG supported RuCl2[(R)-BIPHEP] (3) and (S,S)-DPEN (4) gave only 10.3% ee (Table 2 , entries 2 versus 4). It is worth noting that the combination of MeO-PEG supported RuCl2[(S)-BIPHEP] (3) with racemic DPEN offered as high as 75.9% ee (Table 2, entry 5). The mismatching polymer supported catalyst gave even lower enantioselectivity than the corresponding mismatching monomeric MeO-BIPHEP-Ru-DPEN catalyst. This may be attributed to the restrictions of the polymer matrix (Table 2, entries 3 versus 4). An important feature of the design of soluble polymer supported catalyst is the easy and reliable separation and reuse of the expensive chiral catalyst. In this study, the catalyst was facilely separated under the air condition in the light of high stability of the supported catalyst. Upon the completion of the reaction, most solvent and volatiles were removed. Then, cold ether was added to the mixture and the catalyst was quantitatively precipitated and recovered via filtration. The filtrate was colorless and ICP analysis indicated that the content of metal Ru was less than 1ppm. The recovered catalyst was reused for at least five cycles with essentially similar activity, and the enantioselectivity dropped due to the influence of moisture in the reaction mixture and air condition (as shown in Table 3 ). At the sixth run, the activity and enantioselectivity dropped sharply, maybe due to the decomposition of the catalyst. 4 Conclusion In summary, we presented in this paper a MeO-PEG supported BIPHEP-Ru-DPEN catalyst system [(S,SS)-5]. The catalyst is easy to prepare and exceptionally practical to use. The reduction of a series of simple aryl ketones have been successfully performed at a 0.1% mol catalyst dosage with high enantioselectivity up to 96.5% ee. For the asymmetric hydrogenation of 4′-tert-butyl-acetophenone, even higher ee than that obtained with the unattached homogeneous BINAP-Ru-DPEN catalyst has been achieved under similar conditions. The catalyst showed high air stability and could be recovered easily and the recycled catalysts were shown to maintain their efficiency in several consecutive runs. The use of these recoverable MeO-PEG supported-BIPHEP ligands in other transformations is in progress. Acknowledgements We are grateful to the Municipal Government of Shanghai (grant no. 03DZ19209) and Shanghai Hua-Yi Group for financial support. References [1] R. Noyori Asymmetric Catalysis in Organic Synthesis 1994 John Wiley & Sons New York [2] D. Pini A. Petri A. Mastantuono P. Salvadori G. Jannes V. Dubois Chiral Reactions in Heterogeneous Catalysis 1995 Plenum New York 155 176 [3] S.J. Shuttleworth S.M. Allin P.K. Sharma Synthesis 1997 1217 [4] P. Ermert D. Obrecht J.M. Villalgordo Solid-Supported Combinatorial and Parallel Synthesis of Small-Molecular-Weight Compound Libraries 1998 Elsevier Oxford 44 84 [5] C. Zumbrunn T. Masquelin D. Obrecht D. Obrecht J.M. Villalgordo Solid-Supported Combinatorial and Parallel Synthesis of Small-Molecular-Weight Compound Libraries 1998 Elsevier Oxford 235 243 [6] Q.-H. Fan Y.-M. Li A.S.C. Chan Chem. Rev. 102 2002 3385 [7] M. Benaglia A. Puglisi F. Cozzi Chem. Rev. 103 2003 3401 [8] R. Noyori T. Ohkuma Pure Appl. Chem. 71 1999 1493 [9] R. Noyori M. Koizumi D. Ishii T. Ohkuma Pure Appl. Chem. 73 2001 227 [10] R. Noyori T. Ohkuma Angew. Chem. Int. Ed. 40 2001 40 [11] T. Ohkuma H. Takeno Y. Honda R. Noyori Adv. Synth. Catal. 343 2001 369 [12] R. ter Halle E. Schulz M. Spagnol M. Lemaire Synlett 2000 680 [13] H.-B. Yu Q.-S. Hu L. Pu Tetrahedron Lett. 41 2000 1681 [14] G.-J. Deng Q.-H. Fan X.-M. Chen G.-H. Liu J. Mol. Catal. A Chem. 193 2003 21 [15] X.-G. Li W.-P. Chen W. Hems F. King J.-L. Xiao Org. Lett. 5 2003 4559 [16] Y.-X. Liang Q. Jing X. Li L. Shi K.-L. Ding J. Am. Chem. Soc. 127 2005 7694 [17] A.-G. Hu H.L. Ngo W.-B. Lin J. Am. Chem. Soc. 125 2003 11490 [18] A.-G. Hu G.T. Yee W.-B. Lin J. Am. Chem. Soc. 127 2005 12486 [19] G.-J. Deng G.-R. Li L.-Y. Zhu H.-F. Zhou Y.-M. He Q.-H. Fan Z.-G. Shuai J. Mol. Catal. A Chem. 244 2006 118 [20] R. Schmid M. Cereghetti B. Heiser P. Schönholzer H.J. Hansen Helv. Chim. Acta 71 1988 897 [21] R. Schmid J. Foricher M. Cereghetti P. Schönholzer Helv. Chim. Acta 74 1991 370 [22] R. Schmid E.A. Broger M. Cereghetti Y. Crameri J. Foricher M. Lalonde R.K. Müller M. Scalone G. Schoettel U. Zutter Pure Appl. Chem. 68 1996 131 [23] Z.-G. Zhang H. Qian J. Longmire X.-M. Zhang J. Org. Chem. 65 2000 6223 [24] L.-Q. Qiu F.-Y. Kwong J. Wu W.-H. Lam S.-S. Chan W.-Y. Yu Y.-M. Li R.-W. Guo Z.-Y. Zhou A.S.C. Chan J. Am. Chem. Soc. 128 2006 5955 [25] I. Steiner R. Aufdenblatten A. Togni H.-U. Blaserb B. Puginb Tetrahedron: Asymm. 15 2004 2307 [26] L.-T. Chai H.-S. Chen Z.-M. Li Q.-R. Wang F.-G. Tao Synlett 2006 2395 [27] S. Pikul E.J. Corey Org. Synth. Col. 9 1998 387 [28] P. Cao X.-M. Zhang J. Org. Chem. 64 1999 2127 [29] T. Ohkuma M. Koizumi H. Doucet T. Pham M. Kozawa K. Murata E. Katayama T. Yokozawa T. Ikariya R. Noyori J. Am. Chem. Soc. 120 1998 13529 [30] T. Ohkuma M. Koizumi M. Yoshida R. Noyori Org. Lett. 2 2000 1749 [31] Q.-H. Fan G.-J. Deng C.-C. Lin A.S.C. Chan Tetrahedron: Asymm. 12 2001 1241 [32] T. Ohkuma H. Ooka S. Hashiguchi T. Ikariya R. Noyori J. Am. Chem. Soc. 117 1995 2675",
      "scopus-id": "34247179138",
      "coredata": {
        "eid": "1-s2.0-S1381116907000751",
        "dc:description": "A soluble polymer (MeO-PEG) supported biphenylbisphosphine (BIPHEP)-Ru/chiral diamine (1,2-diphenylethylenediamine) complex, in which the polymer is attached to the two phenyl rings of BIPHEP ligand, has been prepared, and shown to be highly active with good enantioselectivity for the catalyzed asymmetric hydrogenation of unfunctionalized aromatic ketones. The derived chiral ruthenium complex 5 proved to be stable in air allowing facile catalyst recycling. Especially for 4′-tert-butyl-acetophenone and 1-acetonaphthone, excellent ee values up to 96.5% and 95.9% have been obtained which are comparable to or even higher than the enantioselectivity achieved with 2,2′-bis(diphenylphosphino)-1,1′-binaphthyl-Ru-DPEN catalyst under similar conditions.",
        "openArchiveArticle": "false",
        "prism:coverDate": "2007-06-01",
        "openaccessUserLicense": null,
        "prism:aggregationType": "Journal",
        "prism:url": "https://api.elsevier.com/content/article/pii/S1381116907000751",
        "dc:creator": [
          {
            "@_fa": "true",
            "$": "Chai, Li-Ting"
          },
          {
            "@_fa": "true",
            "$": "Wang, Wei-Wei"
          },
          {
            "@_fa": "true",
            "$": "Wang, Quan-Rui"
          },
          {
            "@_fa": "true",
            "$": "Tao, Feng-Gang"
          }
        ],
        "link": [
          {
            "@_fa": "true",
            "@rel": "self",
            "@href": "https://api.elsevier.com/content/article/pii/S1381116907000751"
          },
          {
            "@_fa": "true",
            "@rel": "scidir",
            "@href": "https://www.sciencedirect.com/science/article/pii/S1381116907000751"
          }
        ],
        "dc:format": "application/json",
        "openaccessType": null,
        "pii": "S1381-1169(07)00075-1",
        "prism:volume": "270",
        "prism:publisher": "Elsevier B.V.",
        "dc:title": "Asymmetric hydrogenation of aromatic ketones with MeO-PEG-supported BIPHEP/DPEN ruthenium catalysts",
        "prism:copyright": "Copyright © 2007 Elsevier B.V. All rights reserved.",
        "openaccess": "0",
        "prism:issn": "13811169",
        "prism:issueIdentifier": "1-2",
        "dcterms:subject": [
          {
            "@_fa": "true",
            "$": "MeO-PEG"
          },
          {
            "@_fa": "true",
            "$": "Supported catalyst"
          },
          {
            "@_fa": "true",
            "$": "Asymmetric hydrogenation"
          },
          {
            "@_fa": "true",
            "$": "Aryl ketones"
          }
        ],
        "openaccessArticle": "false",
        "prism:publicationName": "Journal of Molecular Catalysis A: Chemical",
        "prism:number": "1-2",
        "openaccessSponsorType": null,
        "prism:pageRange": "83-88",
        "prism:endingPage": "88",
        "pubType": "fla",
        "prism:coverDisplayDate": "1 June 2007",
        "prism:doi": "10.1016/j.molcata.2007.01.042",
        "prism:startingPage": "83",
        "dc:identifier": "doi:10.1016/j.molcata.2007.01.042",
        "openaccessSponsorName": null
      },
      "objects": {
        "object": [
          {
            "@category": "thumbnail",
            "@height": "19",
            "@width": "33",
            "@_fa": "true",
            "$": "https://api.elsevier.com/content/object/eid/1-s2.0-S1381116907000751-si4.gif?httpAccept=%2A%2F%2A",
            "@multimediatype": "GIF image file",
            "@type": "ALTIMG",
            "@size": "257",
            "@ref": "si4",
            "@mimetype": "image/gif"
          },
          {
            "@category": "thumbnail",
            "@height": "19",
            "@width": "32",
            "@_fa": "true",
            "$": "https://api.elsevier.com/content/object/eid/1-s2.0-S1381116907000751-si3.gif?httpAccept=%2A%2F%2A",
            "@multimediatype": "GIF image file",
            "@type": "ALTIMG",
            "@size": "242",
            "@ref": "si3",
            "@mimetype": "image/gif"
          },
          {
            "@category": "thumbnail",
            "@height": "19",
            "@width": "33",
            "@_fa": "true",
            "$": "https://api.elsevier.com/content/object/eid/1-s2.0-S1381116907000751-si2.gif?httpAccept=%2A%2F%2A",
            "@multimediatype": "GIF image file",
            "@type": "ALTIMG",
            "@size": "257",
            "@ref": "si2",
            "@mimetype": "image/gif"
          },
          {
            "@category": "thumbnail",
            "@height": "19",
            "@width": "32",
            "@_fa": "true",
            "$": "https://api.elsevier.com/content/object/eid/1-s2.0-S1381116907000751-si1.gif?httpAccept=%2A%2F%2A",
            "@multimediatype": "GIF image file",
            "@type": "ALTIMG",
            "@size": "242",
            "@ref": "si1",
            "@mimetype": "image/gif"
          },
          {
            "@category": "standard",
            "@height": "54",
            "@width": "67",
            "@_fa": "true",
            "$": "https://api.elsevier.com/content/object/eid/1-s2.0-S1381116907000751-fx10.gif?httpAccept=%2A%2F%2A",
            "@multimediatype": "GIF image file",
            "@type": "IMAGE-DOWNSAMPLED",
            "@size": "497",
            "@ref": "fx10",
            "@mimetype": "image/gif"
          },
          {
            "@category": "thumbnail",
            "@height": "93",
            "@width": "115",
            "@_fa": "true",
            "$": "https://api.elsevier.com/content/object/eid/1-s2.0-S1381116907000751-fx10.sml?httpAccept=%2A%2F%2A",
            "@multimediatype": "GIF image file",
            "@type": "IMAGE-THUMBNAIL",
            "@size": "946",
            "@ref": "fx10",
            "@mimetype": "image/gif"
          },
          {
            "@category": "standard",
            "@height": "50",
            "@width": "51",
            "@_fa": "true",
            "$": "https://api.elsevier.com/content/object/eid/1-s2.0-S1381116907000751-fx11.gif?httpAccept=%2A%2F%2A",
            "@multimediatype": "GIF image file",
            "@type": "IMAGE-DOWNSAMPLED",
            "@size": "451",
            "@ref": "fx11",
            "@mimetype": "image/gif"
          },
          {
            "@category": "thumbnail",
            "@height": "93",
            "@width": "94",
            "@_fa": "true",
            "$": "https://api.elsevier.com/content/object/eid/1-s2.0-S1381116907000751-fx11.sml?httpAccept=%2A%2F%2A",
            "@multimediatype": "GIF image file",
            "@type": "IMAGE-THUMBNAIL",
            "@size": "908",
            "@ref": "fx11",
            "@mimetype": "image/gif"
          },
          {
            "@category": "standard",
            "@height": "35",
            "@width": "57",
            "@_fa": "true",
            "$": "https://api.elsevier.com/content/object/eid/1-s2.0-S1381116907000751-fx12.gif?httpAccept=%2A%2F%2A",
            "@multimediatype": "GIF image file",
            "@type": "IMAGE-DOWNSAMPLED",
            "@size": "454",
            "@ref": "fx12",
            "@mimetype": "image/gif"
          },
          {
            "@category": "thumbnail",
            "@height": "77",
            "@width": "125",
            "@_fa": "true",
            "$": "https://api.elsevier.com/content/object/eid/1-s2.0-S1381116907000751-fx12.sml?httpAccept=%2A%2F%2A",
            "@multimediatype": "GIF image file",
            "@type": "IMAGE-THUMBNAIL",
            "@size": "1102",
            "@ref": "fx12",
            "@mimetype": "image/gif"
          },
          {
            "@category": "standard",
            "@height": "58",
            "@width": "55",
            "@_fa": "true",
            "$": "https://api.elsevier.com/content/object/eid/1-s2.0-S1381116907000751-fx13.gif?httpAccept=%2A%2F%2A",
            "@multimediatype": "GIF image file",
            "@type": "IMAGE-DOWNSAMPLED",
            "@size": "577",
            "@ref": "fx13",
            "@mimetype": "image/gif"
          },
          {
            "@category": "thumbnail",
            "@height": "93",
            "@width": "89",
            "@_fa": "true",
            "$": "https://api.elsevier.com/content/object/eid/1-s2.0-S1381116907000751-fx13.sml?httpAccept=%2A%2F%2A",
            "@multimediatype": "GIF image file",
            "@type": "IMAGE-THUMBNAIL",
            "@size": "1026",
            "@ref": "fx13",
            "@mimetype": "image/gif"
          },
          {
            "@category": "standard",
            "@height": "91",
            "@width": "489",
            "@_fa": "true",
            "$": "https://api.elsevier.com/content/object/eid/1-s2.0-S1381116907000751-fx14.gif?httpAccept=%2A%2F%2A",
            "@multimediatype": "GIF image file",
            "@type": "IMAGE-DOWNSAMPLED",
            "@size": "4128",
            "@ref": "fx14",
            "@mimetype": "image/gif"
          },
          {
            "@category": "thumbnail",
            "@height": "23",
            "@width": "125",
            "@_fa": "true",
            "$": "https://api.elsevier.com/content/object/eid/1-s2.0-S1381116907000751-fx14.sml?httpAccept=%2A%2F%2A",
            "@multimediatype": "GIF image file",
            "@type": "IMAGE-THUMBNAIL",
            "@size": "555",
            "@ref": "fx14",
            "@mimetype": "image/gif"
          },
          {
            "@category": "standard",
            "@height": "59",
            "@width": "495",
            "@_fa": "true",
            "$": "https://api.elsevier.com/content/object/eid/1-s2.0-S1381116907000751-fx2.gif?httpAccept=%2A%2F%2A",
            "@multimediatype": "GIF image file",
            "@type": "IMAGE-DOWNSAMPLED",
            "@size": "3330",
            "@ref": "fx2",
            "@mimetype": "image/gif"
          },
          {
            "@category": "thumbnail",
            "@height": "15",
            "@width": "125",
            "@_fa": "true",
            "$": "https://api.elsevier.com/content/object/eid/1-s2.0-S1381116907000751-fx2.sml?httpAccept=%2A%2F%2A",
            "@multimediatype": "GIF image file",
            "@type": "IMAGE-THUMBNAIL",
            "@size": "471",
            "@ref": "fx2",
            "@mimetype": "image/gif"
          },
          {
            "@category": "standard",
            "@height": "51",
            "@width": "54",
            "@_fa": "true",
            "$": "https://api.elsevier.com/content/object/eid/1-s2.0-S1381116907000751-fx3.gif?httpAccept=%2A%2F%2A",
            "@multimediatype": "GIF image file",
            "@type": "IMAGE-DOWNSAMPLED",
            "@size": "460",
            "@ref": "fx3",
            "@mimetype": "image/gif"
          },
          {
            "@category": "thumbnail",
            "@height": "94",
            "@width": "100",
            "@_fa": "true",
            "$": "https://api.elsevier.com/content/object/eid/1-s2.0-S1381116907000751-fx3.sml?httpAccept=%2A%2F%2A",
            "@multimediatype": "GIF image file",
            "@type": "IMAGE-THUMBNAIL",
            "@size": "923",
            "@ref": "fx3",
            "@mimetype": "image/gif"
          },
          {
            "@category": "standard",
            "@height": "51",
            "@width": "54",
            "@_fa": "true",
            "$": "https://api.elsevier.com/content/object/eid/1-s2.0-S1381116907000751-fx4.gif?httpAccept=%2A%2F%2A",
            "@multimediatype": "GIF image file",
            "@type": "IMAGE-DOWNSAMPLED",
            "@size": "488",
            "@ref": "fx4",
            "@mimetype": "image/gif"
          },
          {
            "@category": "thumbnail",
            "@height": "94",
            "@width": "100",
            "@_fa": "true",
            "$": "https://api.elsevier.com/content/object/eid/1-s2.0-S1381116907000751-fx4.sml?httpAccept=%2A%2F%2A",
            "@multimediatype": "GIF image file",
            "@type": "IMAGE-THUMBNAIL",
            "@size": "984",
            "@ref": "fx4",
            "@mimetype": "image/gif"
          },
          {
            "@category": "standard",
            "@height": "49",
            "@width": "66",
            "@_fa": "true",
            "$": "https://api.elsevier.com/content/object/eid/1-s2.0-S1381116907000751-fx5.gif?httpAccept=%2A%2F%2A",
            "@multimediatype": "GIF image file",
            "@type": "IMAGE-DOWNSAMPLED",
            "@size": "489",
            "@ref": "fx5",
            "@mimetype": "image/gif"
          },
          {
            "@category": "thumbnail",
            "@height": "93",
            "@width": "125",
            "@_fa": "true",
            "$": "https://api.elsevier.com/content/object/eid/1-s2.0-S1381116907000751-fx5.sml?httpAccept=%2A%2F%2A",
            "@multimediatype": "GIF image file",
            "@type": "IMAGE-THUMBNAIL",
            "@size": "971",
            "@ref": "fx5",
            "@mimetype": "image/gif"
          },
          {
            "@category": "standard",
            "@height": "49",
            "@width": "66",
            "@_fa": "true",
            "$": "https://api.elsevier.com/content/object/eid/1-s2.0-S1381116907000751-fx6.gif?httpAccept=%2A%2F%2A",
            "@multimediatype": "GIF image file",
            "@type": "IMAGE-DOWNSAMPLED",
            "@size": "492",
            "@ref": "fx6",
            "@mimetype": "image/gif"
          },
          {
            "@category": "thumbnail",
            "@height": "93",
            "@width": "125",
            "@_fa": "true",
            "$": "https://api.elsevier.com/content/object/eid/1-s2.0-S1381116907000751-fx6.sml?httpAccept=%2A%2F%2A",
            "@multimediatype": "GIF image file",
            "@type": "IMAGE-THUMBNAIL",
            "@size": "982",
            "@ref": "fx6",
            "@mimetype": "image/gif"
          },
          {
            "@category": "standard",
            "@height": "49",
            "@width": "78",
            "@_fa": "true",
            "$": "https://api.elsevier.com/content/object/eid/1-s2.0-S1381116907000751-fx7.gif?httpAccept=%2A%2F%2A",
            "@multimediatype": "GIF image file",
            "@type": "IMAGE-DOWNSAMPLED",
            "@size": "555",
            "@ref": "fx7",
            "@mimetype": "image/gif"
          },
          {
            "@category": "thumbnail",
            "@height": "78",
            "@width": "125",
            "@_fa": "true",
            "$": "https://api.elsevier.com/content/object/eid/1-s2.0-S1381116907000751-fx7.sml?httpAccept=%2A%2F%2A",
            "@multimediatype": "GIF image file",
            "@type": "IMAGE-THUMBNAIL",
            "@size": "969",
            "@ref": "fx7",
            "@mimetype": "image/gif"
          },
          {
            "@category": "standard",
            "@height": "50",
            "@width": "69",
            "@_fa": "true",
            "$": "https://api.elsevier.com/content/object/eid/1-s2.0-S1381116907000751-fx8.gif?httpAccept=%2A%2F%2A",
            "@multimediatype": "GIF image file",
            "@type": "IMAGE-DOWNSAMPLED",
            "@size": "507",
            "@ref": "fx8",
            "@mimetype": "image/gif"
          },
          {
            "@category": "thumbnail",
            "@height": "90",
            "@width": "125",
            "@_fa": "true",
            "$": "https://api.elsevier.com/content/object/eid/1-s2.0-S1381116907000751-fx8.sml?httpAccept=%2A%2F%2A",
            "@multimediatype": "GIF image file",
            "@type": "IMAGE-THUMBNAIL",
            "@size": "1009",
            "@ref": "fx8",
            "@mimetype": "image/gif"
          },
          {
            "@category": "standard",
            "@height": "50",
            "@width": "64",
            "@_fa": "true",
            "$": "https://api.elsevier.com/content/object/eid/1-s2.0-S1381116907000751-fx9.gif?httpAccept=%2A%2F%2A",
            "@multimediatype": "GIF image file",
            "@type": "IMAGE-DOWNSAMPLED",
            "@size": "478",
            "@ref": "fx9",
            "@mimetype": "image/gif"
          },
          {
            "@category": "thumbnail",
            "@height": "94",
            "@width": "120",
            "@_fa": "true",
            "$": "https://api.elsevier.com/content/object/eid/1-s2.0-S1381116907000751-fx9.sml?httpAccept=%2A%2F%2A",
            "@multimediatype": "GIF image file",
            "@type": "IMAGE-THUMBNAIL",
            "@size": "987",
            "@ref": "fx9",
            "@mimetype": "image/gif"
          },
          {
            "@category": "standard",
            "@height": "269",
            "@width": "635",
            "@_fa": "true",
            "$": "https://api.elsevier.com/content/object/eid/1-s2.0-S1381116907000751-sc1.jpg?httpAccept=%2A%2F%2A",
            "@multimediatype": "JPEG image file",
            "@type": "IMAGE-DOWNSAMPLED",
            "@size": "28705",
            "@ref": "sc1",
            "@mimetype": "image/jpeg"
          },
          {
            "@category": "thumbnail",
            "@height": "53",
            "@width": "125",
            "@_fa": "true",
            "$": "https://api.elsevier.com/content/object/eid/1-s2.0-S1381116907000751-sc1.sml?httpAccept=%2A%2F%2A",
            "@multimediatype": "GIF image file",
            "@type": "IMAGE-THUMBNAIL",
            "@size": "1014",
            "@ref": "sc1",
            "@mimetype": "image/gif"
          },
          {
            "@category": "standard",
            "@height": "183",
            "@width": "243",
            "@_fa": "true",
            "$": "https://api.elsevier.com/content/object/eid/1-s2.0-S1381116907000751-fx1.gif?httpAccept=%2A%2F%2A",
            "@multimediatype": "GIF image file",
            "@type": "IMAGE-DOWNSAMPLED",
            "@size": "5147",
            "@ref": "fx1",
            "@mimetype": "image/gif"
          },
          {
            "@category": "thumbnail",
            "@height": "94",
            "@width": "124",
            "@_fa": "true",
            "$": "https://api.elsevier.com/content/object/eid/1-s2.0-S1381116907000751-fx1.sml?httpAccept=%2A%2F%2A",
            "@multimediatype": "GIF image file",
            "@type": "IMAGE-THUMBNAIL",
            "@size": "1953",
            "@ref": "fx1",
            "@mimetype": "image/gif"
          }
        ]
      },
      "link": {
        "@rel": "abstract",
        "@href": "https://api.elsevier.com/content/abstract/scopus_id/34247179138"
      }
    }
  }
}