{
  "metadata": {
    "title": "Mechanistic insights in the activation of oxygen on oxide catalysts for the oxidative dehydrogenation of ethane from pulse experiments and contact potential difference measurements",
    "authors": "; ; ",
    "journal": "Journal of Molecular Catalysis A: Chemical",
    "date": "2000-09-08",
    "doi": "10.1016/S1381-1169(00)00066-2",
    "abstract": "",
    "uri": "https://api.elsevier.com/content/article/pii/S1381116900000662",
    "pii": "S1381116900000662"
  },
  "fulltext": {
    "full-text-retrieval-response": {
      "scopus-eid": "2-s2.0-0034622703",
      "originalText": "serial JL 271358 291210 291744 291790 291809 31 Journal of Molecular Catalysis A: Chemical JOURNALMOLECULARCATALYSISACHEMICAL 2000-07-18 2000-07-18 2010-11-05T21:50:31 1-s2.0-S1381116900000662 S1381-1169(00)00066-2 S1381116900000662 10.1016/S1381-1169(00)00066-2 S300 S300.2 FULL-TEXT 1-s2.0-S1381116900X01215 2015-05-15T05:55:31.049811-04:00 0 0 20000908 2000 2000-07-18T00:00:00Z articleinfo crossmark dco dateupdated tomb dateloaded datesearch indexeddate issuelist volumelist yearnav articletitlenorm authfirstinitialnorm authfirstsurnamenorm cid cids contenttype copyright dateloadedtxt docsubtype doctype doi eid ewtransactionid hubeid issfirst issn issnnorm itemstage itemtransactionid itemweight openaccess openarchive pg pgfirst pglast pii piinorm pubdatestart pubdatetxt pubyr sortorder srctitle srctitlenorm srctype subheadings volfirst volissue webpdf webpdfpagecount figure table body acknowledge affil articletitle auth authfirstini authfull authkeywords authlast dedication footnotes primabst ref alllist content subj ssids 1381-1169 13811169 158 158 1 1 Volume 158, Issue 1 22 199 208 199 208 20000908 8 September 2000 2000-09-08 2000 converted-article fla Copyright © 2000 Elsevier Science B.V. All rights reserved. MECHANISTICINSIGHTSINACTIVATIONOXYGENOXIDECATALYSTSFOROXIDATIVEDEHYDROGENATIONETHANEPULSEEXPERIMENTSCONTACTPOTENTIALDIFFERENCEMEASUREMENTS KONDRATENKO E 1 Introduction 2 Experimental and methods 2.1 Catalysts 2.2 Catalytic testing 2.3 CPD measurements 2.4 TAP measurements 2.5 TAP data treatment and fitting 2.6 Model 1: Langmuir-type adsorption 2.7 Model 2: One-stage reversible dissociative adsorption 2.8 Model 3: Two-stage reversible dissociative adsorption 3 Results and discussion 3.1 Catalytic performance 3.2 CPD 3.3 TAP responses fitting and relationship between catalyst composition and oxygen activation 3.4 ODE and oxygen interaction 4 Conclusions 5 Notation Acknowledgements References BORESKOV 1982 40 G CATALYSISSCIENCETECHNOLOGY CATALYTICACTIVATIONDIOXYGEN KUNG 1994 1 H BELANSKY 1996 A OXYGENINCATALYSIS IWAMOTO 1980 3079 M BORCHERT 1997 315 H GAYKO 1998 441 G HUTCHINGS 1989 2507 G ANSHITS 1994 337 A STUDIESINSURFACESCIENCECATALYSIS MORALES 1989 255 E SWAAN 1992 629 H JI 1996 1203 L BUYEVSKAYA 1998 139 O NOWOTNY 1982 358 L BARBAUX 1979 Y GLEAVES 1997 55 J ROTHAEMEL 1996 1556 M KONDRATENKO 1999 217 E CHERRAK 1992 3241 A EKSTROM 1988 5226 A ANSHITS 1989 399 A BUYEVSKAYA 1998 139 O DGMKCONFERENCESELECTIVEOXIDATIONSINPERTOCHEMISTRYHAMBURG KONDRATENKOX2000X199 KONDRATENKOX2000X199X208 KONDRATENKOX2000X199XE KONDRATENKOX2000X199X208XE item S1381-1169(00)00066-2 S1381116900000662 1-s2.0-S1381116900000662 10.1016/S1381-1169(00)00066-2 271358 2010-11-30T03:52:16.403912-05:00 2000-09-08 1-s2.0-S1381116900000662-main.pdf https://s3.amazonaws.com/prod-ucs-content-store-us-east/content/pii:S1381116900000662/MAIN/application/pdf/caf5f28269c81c038d76f2400ddc32b6/main.pdf https://s3-eu-west-1.amazonaws.com/prod-ucs-content-store-eu-west/content/pii:S1381116900000662/MAIN/application/pdf/caf5f28269c81c038d76f2400ddc32b6/main.pdf main.pdf pdf true 196399 MAIN 10 1-s2.0-S1381116900000662-main_1.png https://s3-eu-west-1.amazonaws.com/prod-ucs-content-store-eu-west/content/pii:S1381116900000662/PREVIEW/image/png/8a93d24bd075f91cc7e1cf434a2a6450/main_1.png https://s3.amazonaws.com/prod-ucs-content-store-us-east/content/pii:S1381116900000662/PREVIEW/image/png/8a93d24bd075f91cc7e1cf434a2a6450/main_1.png main_1.png png 60806 849 656 IMAGE-WEB-PDF 1 1-s2.0-S1381116900000662-si9.gif https://s3.amazonaws.com/prod-ucs-content-store-us-east/content/pii:S1381116900000662/STRIPIN/image/gif/261ab06f7c0f56e550e05c94d8b9df43/si9.gif https://s3-eu-west-1.amazonaws.com/prod-ucs-content-store-eu-west/content/pii:S1381116900000662/STRIPIN/image/gif/261ab06f7c0f56e550e05c94d8b9df43/si9.gif si9 si9.gif gif 727 38 118 ALTIMG 1-s2.0-S1381116900000662-si8.gif https://s3.amazonaws.com/prod-ucs-content-store-us-east/content/pii:S1381116900000662/STRIPIN/image/gif/43759aee17cca94268dcb810efc622e1/si8.gif https://s3-eu-west-1.amazonaws.com/prod-ucs-content-store-eu-west/content/pii:S1381116900000662/STRIPIN/image/gif/43759aee17cca94268dcb810efc622e1/si8.gif si8 si8.gif gif 1257 35 258 ALTIMG 1-s2.0-S1381116900000662-si7.gif https://s3.amazonaws.com/prod-ucs-content-store-us-east/content/pii:S1381116900000662/STRIPIN/image/gif/239ecefd1c70dc27fc62e999130db297/si7.gif https://s3-eu-west-1.amazonaws.com/prod-ucs-content-store-eu-west/content/pii:S1381116900000662/STRIPIN/image/gif/239ecefd1c70dc27fc62e999130db297/si7.gif si7 si7.gif gif 1921 38 394 ALTIMG 1-s2.0-S1381116900000662-si6.gif https://s3.amazonaws.com/prod-ucs-content-store-us-east/content/pii:S1381116900000662/STRIPIN/image/gif/227c29f43eb3cbf6a1aa22f1dd104af5/si6.gif https://s3-eu-west-1.amazonaws.com/prod-ucs-content-store-eu-west/content/pii:S1381116900000662/STRIPIN/image/gif/227c29f43eb3cbf6a1aa22f1dd104af5/si6.gif si6 si6.gif gif 673 38 108 ALTIMG 1-s2.0-S1381116900000662-si5.gif https://s3.amazonaws.com/prod-ucs-content-store-us-east/content/pii:S1381116900000662/STRIPIN/image/gif/84c81cceac9ab938add04d358c2f4b0d/si5.gif https://s3-eu-west-1.amazonaws.com/prod-ucs-content-store-eu-west/content/pii:S1381116900000662/STRIPIN/image/gif/84c81cceac9ab938add04d358c2f4b0d/si5.gif si5 si5.gif gif 663 18 189 ALTIMG 1-s2.0-S1381116900000662-si4.gif https://s3.amazonaws.com/prod-ucs-content-store-us-east/content/pii:S1381116900000662/STRIPIN/image/gif/9d14a95be3cee3081b9f237b28febf56/si4.gif https://s3-eu-west-1.amazonaws.com/prod-ucs-content-store-eu-west/content/pii:S1381116900000662/STRIPIN/image/gif/9d14a95be3cee3081b9f237b28febf56/si4.gif si4 si4.gif gif 676 20 181 ALTIMG 1-s2.0-S1381116900000662-si3.gif https://s3.amazonaws.com/prod-ucs-content-store-us-east/content/pii:S1381116900000662/STRIPIN/image/gif/f2f59ced167a70573081b9a23eafacb4/si3.gif https://s3-eu-west-1.amazonaws.com/prod-ucs-content-store-eu-west/content/pii:S1381116900000662/STRIPIN/image/gif/f2f59ced167a70573081b9a23eafacb4/si3.gif si3 si3.gif gif 631 14 183 ALTIMG 1-s2.0-S1381116900000662-si2.gif https://s3.amazonaws.com/prod-ucs-content-store-us-east/content/pii:S1381116900000662/STRIPIN/image/gif/5e31b8c2da9a6f8f6426afc05159d8d2/si2.gif https://s3-eu-west-1.amazonaws.com/prod-ucs-content-store-eu-west/content/pii:S1381116900000662/STRIPIN/image/gif/5e31b8c2da9a6f8f6426afc05159d8d2/si2.gif si2 si2.gif gif 557 16 167 ALTIMG 1-s2.0-S1381116900000662-si18.gif https://s3.amazonaws.com/prod-ucs-content-store-us-east/content/pii:S1381116900000662/STRIPIN/image/gif/e6926786c629e74973dee9cd8884ed6e/si18.gif https://s3-eu-west-1.amazonaws.com/prod-ucs-content-store-eu-west/content/pii:S1381116900000662/STRIPIN/image/gif/e6926786c629e74973dee9cd8884ed6e/si18.gif si18 si18.gif gif 2033 15 565 ALTIMG 1-s2.0-S1381116900000662-si17.gif https://s3.amazonaws.com/prod-ucs-content-store-us-east/content/pii:S1381116900000662/STRIPIN/image/gif/81609a2a28a52409b33a91671bd34467/si17.gif https://s3-eu-west-1.amazonaws.com/prod-ucs-content-store-eu-west/content/pii:S1381116900000662/STRIPIN/image/gif/81609a2a28a52409b33a91671bd34467/si17.gif si17 si17.gif gif 1445 40 270 ALTIMG 1-s2.0-S1381116900000662-si16.gif https://s3.amazonaws.com/prod-ucs-content-store-us-east/content/pii:S1381116900000662/STRIPIN/image/gif/1087ca5f26824335f44a25913013607c/si16.gif https://s3-eu-west-1.amazonaws.com/prod-ucs-content-store-eu-west/content/pii:S1381116900000662/STRIPIN/image/gif/1087ca5f26824335f44a25913013607c/si16.gif si16 si16.gif gif 1598 35 337 ALTIMG 1-s2.0-S1381116900000662-si15.gif https://s3.amazonaws.com/prod-ucs-content-store-us-east/content/pii:S1381116900000662/STRIPIN/image/gif/c71e27b6f229e0ca26fbf35bfdb98021/si15.gif https://s3-eu-west-1.amazonaws.com/prod-ucs-content-store-eu-west/content/pii:S1381116900000662/STRIPIN/image/gif/c71e27b6f229e0ca26fbf35bfdb98021/si15.gif si15 si15.gif gif 2370 36 594 ALTIMG 1-s2.0-S1381116900000662-si14.gif https://s3.amazonaws.com/prod-ucs-content-store-us-east/content/pii:S1381116900000662/STRIPIN/image/gif/519053c324ae5f54ba04a0e53e41f5f6/si14.gif https://s3-eu-west-1.amazonaws.com/prod-ucs-content-store-eu-west/content/pii:S1381116900000662/STRIPIN/image/gif/519053c324ae5f54ba04a0e53e41f5f6/si14.gif si14 si14.gif gif 2038 38 437 ALTIMG 1-s2.0-S1381116900000662-si13.gif https://s3.amazonaws.com/prod-ucs-content-store-us-east/content/pii:S1381116900000662/STRIPIN/image/gif/276cc340e0f433f0982b590c86351c39/si13.gif https://s3-eu-west-1.amazonaws.com/prod-ucs-content-store-eu-west/content/pii:S1381116900000662/STRIPIN/image/gif/276cc340e0f433f0982b590c86351c39/si13.gif si13 si13.gif gif 757 38 132 ALTIMG 1-s2.0-S1381116900000662-si12.gif https://s3.amazonaws.com/prod-ucs-content-store-us-east/content/pii:S1381116900000662/STRIPIN/image/gif/227c29f43eb3cbf6a1aa22f1dd104af5/si6.gif https://s3-eu-west-1.amazonaws.com/prod-ucs-content-store-eu-west/content/pii:S1381116900000662/STRIPIN/image/gif/227c29f43eb3cbf6a1aa22f1dd104af5/si6.gif si12 si12.gif gif 673 38 108 ALTIMG 1-s2.0-S1381116900000662-si11.gif https://s3.amazonaws.com/prod-ucs-content-store-us-east/content/pii:S1381116900000662/STRIPIN/image/gif/cf08082ac1a6f64aa8a85bb7c38d56d5/si11.gif https://s3-eu-west-1.amazonaws.com/prod-ucs-content-store-eu-west/content/pii:S1381116900000662/STRIPIN/image/gif/cf08082ac1a6f64aa8a85bb7c38d56d5/si11.gif si11 si11.gif gif 1479 35 298 ALTIMG 1-s2.0-S1381116900000662-si10.gif https://s3.amazonaws.com/prod-ucs-content-store-us-east/content/pii:S1381116900000662/STRIPIN/image/gif/1cfc9cedf27a789072eb2e2e46af1d46/si10.gif https://s3-eu-west-1.amazonaws.com/prod-ucs-content-store-eu-west/content/pii:S1381116900000662/STRIPIN/image/gif/1cfc9cedf27a789072eb2e2e46af1d46/si10.gif si10 si10.gif gif 1923 38 391 ALTIMG 1-s2.0-S1381116900000662-si1.gif https://s3.amazonaws.com/prod-ucs-content-store-us-east/content/pii:S1381116900000662/STRIPIN/image/gif/9edfb4b83f27c5db125be3429a434d13/si1.gif https://s3-eu-west-1.amazonaws.com/prod-ucs-content-store-eu-west/content/pii:S1381116900000662/STRIPIN/image/gif/9edfb4b83f27c5db125be3429a434d13/si1.gif si1 si1.gif gif 878 34 174 ALTIMG 1-s2.0-S1381116900000662-gr1.gif https://s3.amazonaws.com/prod-ucs-content-store-us-east/content/pii:S1381116900000662/gr1/DOWNSAMPLED/image/gif/fbcaac23cc99bb6a8a668df328c17b55/gr1.gif https://s3-eu-west-1.amazonaws.com/prod-ucs-content-store-eu-west/content/pii:S1381116900000662/gr1/DOWNSAMPLED/image/gif/fbcaac23cc99bb6a8a668df328c17b55/gr1.gif gr1 gr1.gif gif 4527 230 226 IMAGE-DOWNSAMPLED 1-s2.0-S1381116900000662-gr1.sml https://s3.amazonaws.com/prod-ucs-content-store-us-east/content/pii:S1381116900000662/gr1/THUMBNAIL/image/gif/527fa0977a917e22deef83cb4a7b45a2/gr1.sml https://s3-eu-west-1.amazonaws.com/prod-ucs-content-store-eu-west/content/pii:S1381116900000662/gr1/THUMBNAIL/image/gif/527fa0977a917e22deef83cb4a7b45a2/gr1.sml gr1 gr1.sml sml 2821 164 161 IMAGE-THUMBNAIL 1-s2.0-S1381116900000662-gr1_lrg.gif https://s3.amazonaws.com/prod-ucs-content-store-us-east/content/pii:S1381116900000662/gr1/HIGHRES/image/gif/bbc1a9b079c59682350bd74169122f73/gr1_lrg.gif https://s3-eu-west-1.amazonaws.com/prod-ucs-content-store-eu-west/content/pii:S1381116900000662/gr1/HIGHRES/image/gif/bbc1a9b079c59682350bd74169122f73/gr1_lrg.gif gr1 gr1_lrg.gif gif 44294 2441 2397 IMAGE-HIGH-RES 1-s2.0-S1381116900000662-gr2.gif https://s3.amazonaws.com/prod-ucs-content-store-us-east/content/pii:S1381116900000662/gr2/DOWNSAMPLED/image/gif/131125afe862dccf5416a256f0098b00/gr2.gif https://s3-eu-west-1.amazonaws.com/prod-ucs-content-store-eu-west/content/pii:S1381116900000662/gr2/DOWNSAMPLED/image/gif/131125afe862dccf5416a256f0098b00/gr2.gif gr2 gr2.gif gif 5823 254 259 IMAGE-DOWNSAMPLED 1-s2.0-S1381116900000662-gr2.sml https://s3.amazonaws.com/prod-ucs-content-store-us-east/content/pii:S1381116900000662/gr2/THUMBNAIL/image/gif/9ae5c68122f0720cb2f813e92ee0fcd5/gr2.sml https://s3-eu-west-1.amazonaws.com/prod-ucs-content-store-eu-west/content/pii:S1381116900000662/gr2/THUMBNAIL/image/gif/9ae5c68122f0720cb2f813e92ee0fcd5/gr2.sml gr2 gr2.sml sml 3246 164 167 IMAGE-THUMBNAIL 1-s2.0-S1381116900000662-gr2_lrg.gif https://s3.amazonaws.com/prod-ucs-content-store-us-east/content/pii:S1381116900000662/gr2/HIGHRES/image/gif/1242bb713a0ed5f21a8321beb52a30c6/gr2_lrg.gif https://s3-eu-west-1.amazonaws.com/prod-ucs-content-store-eu-west/content/pii:S1381116900000662/gr2/HIGHRES/image/gif/1242bb713a0ed5f21a8321beb52a30c6/gr2_lrg.gif gr2 gr2_lrg.gif gif 59267 2701 2751 IMAGE-HIGH-RES 1-s2.0-S1381116900000662-gr3.gif https://s3.amazonaws.com/prod-ucs-content-store-us-east/content/pii:S1381116900000662/gr3/DOWNSAMPLED/image/gif/2372b65ff82940b001cd189c4369eafb/gr3.gif https://s3-eu-west-1.amazonaws.com/prod-ucs-content-store-eu-west/content/pii:S1381116900000662/gr3/DOWNSAMPLED/image/gif/2372b65ff82940b001cd189c4369eafb/gr3.gif gr3 gr3.gif gif 6753 227 240 IMAGE-DOWNSAMPLED 1-s2.0-S1381116900000662-gr3.sml https://s3.amazonaws.com/prod-ucs-content-store-us-east/content/pii:S1381116900000662/gr3/THUMBNAIL/image/gif/9a44eb74ebf0fea61d191887d7934e11/gr3.sml https://s3-eu-west-1.amazonaws.com/prod-ucs-content-store-eu-west/content/pii:S1381116900000662/gr3/THUMBNAIL/image/gif/9a44eb74ebf0fea61d191887d7934e11/gr3.sml gr3 gr3.sml sml 4098 163 173 IMAGE-THUMBNAIL 1-s2.0-S1381116900000662-gr3_lrg.gif https://s3.amazonaws.com/prod-ucs-content-store-us-east/content/pii:S1381116900000662/gr3/HIGHRES/image/gif/21b2100d7b594c776a1cab58e0a96b2b/gr3_lrg.gif https://s3-eu-west-1.amazonaws.com/prod-ucs-content-store-eu-west/content/pii:S1381116900000662/gr3/HIGHRES/image/gif/21b2100d7b594c776a1cab58e0a96b2b/gr3_lrg.gif gr3 gr3_lrg.gif gif 71784 2409 2549 IMAGE-HIGH-RES 1-s2.0-S1381116900000662-gr4.gif https://s3.amazonaws.com/prod-ucs-content-store-us-east/content/pii:S1381116900000662/gr4/DOWNSAMPLED/image/gif/ddac5a4a89d7341cfc23bab061453545/gr4.gif https://s3-eu-west-1.amazonaws.com/prod-ucs-content-store-eu-west/content/pii:S1381116900000662/gr4/DOWNSAMPLED/image/gif/ddac5a4a89d7341cfc23bab061453545/gr4.gif gr4 gr4.gif gif 6942 255 277 IMAGE-DOWNSAMPLED 1-s2.0-S1381116900000662-gr4.sml https://s3.amazonaws.com/prod-ucs-content-store-us-east/content/pii:S1381116900000662/gr4/THUMBNAIL/image/gif/afa8b15b65fdef39c5c3dfaf6abe0c43/gr4.sml https://s3-eu-west-1.amazonaws.com/prod-ucs-content-store-eu-west/content/pii:S1381116900000662/gr4/THUMBNAIL/image/gif/afa8b15b65fdef39c5c3dfaf6abe0c43/gr4.sml gr4 gr4.sml sml 3726 164 178 IMAGE-THUMBNAIL 1-s2.0-S1381116900000662-gr4_lrg.gif https://s3.amazonaws.com/prod-ucs-content-store-us-east/content/pii:S1381116900000662/gr4/HIGHRES/image/gif/3631cf4f04f9b68adde67fc512af9b00/gr4_lrg.gif https://s3-eu-west-1.amazonaws.com/prod-ucs-content-store-eu-west/content/pii:S1381116900000662/gr4/HIGHRES/image/gif/3631cf4f04f9b68adde67fc512af9b00/gr4_lrg.gif gr4 gr4_lrg.gif gif 74103 2706 2941 IMAGE-HIGH-RES 1-s2.0-S1381116900000662-gr5.gif https://s3.amazonaws.com/prod-ucs-content-store-us-east/content/pii:S1381116900000662/gr5/DOWNSAMPLED/image/gif/3a228dcba6c7feb0048d181cd676f19d/gr5.gif https://s3-eu-west-1.amazonaws.com/prod-ucs-content-store-eu-west/content/pii:S1381116900000662/gr5/DOWNSAMPLED/image/gif/3a228dcba6c7feb0048d181cd676f19d/gr5.gif gr5 gr5.gif gif 8459 232 287 IMAGE-DOWNSAMPLED 1-s2.0-S1381116900000662-gr5.sml https://s3.amazonaws.com/prod-ucs-content-store-us-east/content/pii:S1381116900000662/gr5/THUMBNAIL/image/gif/9bbeee6be15e4af12fd3860793bdcbf3/gr5.sml https://s3-eu-west-1.amazonaws.com/prod-ucs-content-store-eu-west/content/pii:S1381116900000662/gr5/THUMBNAIL/image/gif/9bbeee6be15e4af12fd3860793bdcbf3/gr5.sml gr5 gr5.sml sml 5009 164 203 IMAGE-THUMBNAIL 1-s2.0-S1381116900000662-gr5_lrg.gif https://s3.amazonaws.com/prod-ucs-content-store-us-east/content/pii:S1381116900000662/gr5/HIGHRES/image/gif/d0631b185ec4e1d385a192f54e56c243/gr5_lrg.gif https://s3-eu-west-1.amazonaws.com/prod-ucs-content-store-eu-west/content/pii:S1381116900000662/gr5/HIGHRES/image/gif/d0631b185ec4e1d385a192f54e56c243/gr5_lrg.gif gr5 gr5_lrg.gif gif 92986 2461 3051 IMAGE-HIGH-RES 1-s2.0-S1381116900000662-gr6.gif https://s3.amazonaws.com/prod-ucs-content-store-us-east/content/pii:S1381116900000662/gr6/DOWNSAMPLED/image/gif/f98828e58c1fb3a9566e1010afbc007d/gr6.gif https://s3-eu-west-1.amazonaws.com/prod-ucs-content-store-eu-west/content/pii:S1381116900000662/gr6/DOWNSAMPLED/image/gif/f98828e58c1fb3a9566e1010afbc007d/gr6.gif gr6 gr6.gif gif 5135 247 238 IMAGE-DOWNSAMPLED 1-s2.0-S1381116900000662-gr6.sml https://s3.amazonaws.com/prod-ucs-content-store-us-east/content/pii:S1381116900000662/gr6/THUMBNAIL/image/gif/4c48ab0ae3a01884a3fdb2c075837f74/gr6.sml https://s3-eu-west-1.amazonaws.com/prod-ucs-content-store-eu-west/content/pii:S1381116900000662/gr6/THUMBNAIL/image/gif/4c48ab0ae3a01884a3fdb2c075837f74/gr6.sml gr6 gr6.sml sml 2867 164 158 IMAGE-THUMBNAIL 1-s2.0-S1381116900000662-gr6_lrg.gif https://s3.amazonaws.com/prod-ucs-content-store-us-east/content/pii:S1381116900000662/gr6/HIGHRES/image/gif/36a72a37a73613ea03342587cbf2bd87/gr6_lrg.gif https://s3-eu-west-1.amazonaws.com/prod-ucs-content-store-eu-west/content/pii:S1381116900000662/gr6/HIGHRES/image/gif/36a72a37a73613ea03342587cbf2bd87/gr6_lrg.gif gr6 gr6_lrg.gif gif 54962 2631 2531 IMAGE-HIGH-RES 1-s2.0-S1381116900000662-gr7.gif https://s3.amazonaws.com/prod-ucs-content-store-us-east/content/pii:S1381116900000662/gr7/DOWNSAMPLED/image/gif/4f34b2af8980277cd83ed175206cc1ed/gr7.gif https://s3-eu-west-1.amazonaws.com/prod-ucs-content-store-eu-west/content/pii:S1381116900000662/gr7/DOWNSAMPLED/image/gif/4f34b2af8980277cd83ed175206cc1ed/gr7.gif gr7 gr7.gif gif 4493 232 238 IMAGE-DOWNSAMPLED 1-s2.0-S1381116900000662-gr7.sml https://s3.amazonaws.com/prod-ucs-content-store-us-east/content/pii:S1381116900000662/gr7/THUMBNAIL/image/gif/916d185f99bf87efca6a72c205a115e9/gr7.sml https://s3-eu-west-1.amazonaws.com/prod-ucs-content-store-eu-west/content/pii:S1381116900000662/gr7/THUMBNAIL/image/gif/916d185f99bf87efca6a72c205a115e9/gr7.sml gr7 gr7.sml sml 2737 164 168 IMAGE-THUMBNAIL 1-s2.0-S1381116900000662-gr7_lrg.gif https://s3.amazonaws.com/prod-ucs-content-store-us-east/content/pii:S1381116900000662/gr7/HIGHRES/image/gif/6e4d612379115d18cf0e4e29f2ef2ead/gr7_lrg.gif https://s3-eu-west-1.amazonaws.com/prod-ucs-content-store-eu-west/content/pii:S1381116900000662/gr7/HIGHRES/image/gif/6e4d612379115d18cf0e4e29f2ef2ead/gr7_lrg.gif gr7 gr7_lrg.gif gif 53751 2465 2529 IMAGE-HIGH-RES MOLCAA 2594 S1381-1169(00)00066-2 10.1016/S1381-1169(00)00066-2 Elsevier Science B.V. Fig. 1 Dependence of ethylene selectivity in ODE over the different catalysts vs. oxygen partial pressure: (○) Na0,0001CaO x ; (□) Na0,009CaO x ; (•) Na0,012CaO x ; (■) Na0,064CaO x , (◊) SmCa5O x . Fig. 2 CPD as a function of time (t) for Na0,009CaO x at different temperatures after changes in oxygen partial pressure. Fig. 3 CPD as a function of time (t) for Sm2O3 at 673 K after changes in oxygen partial pressure. Fig. 4 Comparison among kinetic Models 1–3 for oxygen adsorption by the experimental response of oxygen over Na0,00001CaO x at 873 K. Fig. 5 Comparison between simulated (Model 3) and experimental (circles) responses of oxygen over Na0,00001CaO x at different temperatures. Fig. 6 Selectivity of ethylene formation over Na2O/CaO catalysts in ODE versus steady-state ratio of Θ O/Θ O2 as simulated for different oxygen partial pressures in the absence of ethane. Fig. 7 Selectivity of ethylene formation over SmCa5O x in ODE vs. steady-state ratio of Θ O/Θ O2 as simulated for different oxygen partial pressures in the absence of ethane. Table 1 Selectivity of formation of products in the oxidative dehydrogenation of ethane over different catalysts Reaction condition: p(C2H6)=30 kPa, p(O2)=6 kPa, total flow=60 ml/min. Catalyst τ (g·s ml−1) X (%) C2H4 CO CO2 CH4 C3C4 Na0,00001CaO x 0.024 11.4 51.9 21.5 18.7 1.4 6.5 Na0,009CaO x 0.150 7.5 72.4 5.9 18.9 0.9 1.9 Na0,012CaO x 0.06 6.7 68.0 5.8 23.9 0.7 1.6 Na0,064CaO x 0.2 13.4 78.1 3.2 13.2 0.8 4.7 Sm2O3 0.025 17 61.4 11.3 16.7 1.1 9.5 SmCa5O x 0.02 10.7 64.5 11.8 17.0 2.2 4.5 Table 2 Transient kinetic parameters for the elementary steps of oxygen interaction with different catalysts assuming Model 3 k ads eff k des k dis eff k ass k 0 eff E a (kJ/mol) k 0 E a (kJ/mol) k 0 eff E a (kJ/mol) k 0 E a (kJ/mol) Na0,00001CaO x 9.1×108 89 6.6×107 116 1.5×1017 249 2.3×1021 420 Na0,009CaO x 5.9×108 94.5 5.8×103 31.6 1.6×105 61 9.2×1015 311 Na0,012CaO x 2.1×107 70 6.5×108 106 3.9×107 94 1.9×1016 292 Na0,064CaO x 8.6×106 80 1.6×105 67 8×106 88 6.5×1013 253 Sm2O3 9.4×107 102 5.7×1024 388 1×1025 384 5.8×1019 379 SmCa5O x 2.9×1021 312 1.77×1021 314 5.6×1021 322 1.3×1021 303 Mechanistic insights in the activation of oxygen on oxide catalysts for the oxidative dehydrogenation of ethane from pulse experiments and contact potential difference measurements Dedicated to Professor Dr. Manfred Meisel on the occasion of his 60th birthday E.V. Kondratenko 1 * O. Buyevskaya M. Baerns Institute for Applied Chemistry Berlin-Adlershof, Richard-Willstätter-Str. 12, D-12484 Berlin, Germany * Corresponding author. Tel.: +49-30-63924448; fax: +49-30-63924454 1 Permanent address: Institute of Chemistry and Chemical Technology, K. Marx Str. 42, 660049 Krasnoyarsk, Russia. The oxidative dehydrogenation of ethane (ODE) was studied over Na2O/CaO, Sm2O3/CaO and Sm2O3 catalysts at 923 K using different oxygen partial pressures. The type of interaction of oxygen with these catalysts was derived from measurements of contact potential difference (CPD) between a gold electrode and the catalysts and pulse experiments in the Temporal Analysis of Product (TAP) reactor. Modelling of TAP oxygen responses in the temperature range from 673 to 873 K showed that a reversible dissociative adsorption via a molecular precursor provides a good description of the measured transient responses for all catalysts. Supplementary CPD results confirmed the transformation of adsorbed molecular oxygen species to atomic ones. Rate constants and activation energies of the elementary reaction steps of oxygen adsorption, desorption, dissociation and association were estimated from the TAP oxygen responses. The dependence of ethylene selectivity both on doping and oxygen partial pressure was explained by the ratio of Θ O/Θ O2. This ratio is strongly affected by the constants of adsorption of oxygen and dissociation of molecular adsorbed oxygen. Keywords Temporal of products (TAP) reactor Contact potential difference Modelling of oxygen adsorption Oxidative dehydrogenation of ethane Mixed oxide catalysts 1 Introduction The interaction of gas-phase oxygen with oxide catalysts is an important step in the partial oxidation of hydrocarbons [1–3]. The reaction pathways are significantly influenced by the type of surface oxygen species formed via this interaction, which are involved in both reactant activation and secondary reactions. In most cases, the selective transformation of light paraffins to olefins and oxygenates does not occur with a reasonable selectivity since the desired products being intermediates in the overall process can be easily oxidised to CO x . Indication that hydrocarbon oxidation is strongly related to the state of oxygen species results from earlier work of Iwamoto and Lunsford [4]. They reported that multi-atomic oxygen species promote CC bond cleavage, but monoatomic oxygen species do not promote this reaction. The present authors [5,6] drew a similar conclusion from measurements of total conductivity and contact potential difference (CPD) between a gold electrode and doped rare-earth oxides. The replacement of oxygen by nitrous oxide, as an oxidant, enhances also the selectivity of desired reaction products [7,8]. The increase of selectivity was explained by formation of only atomic oxygen species from N2O. Thus, the regulation of oxygen activation may be one of the possibilities to control the selective oxidation. For the oxidative dehydrogenation of ethane (ODE), mixed oxide systems consisting of rare-earth, alkali-earth and alkali oxides are known as catalysts [9–12]; high ethylene yields and selectivities in particular at T>550°C were achieved. Morales and Lunsford [9] reported an ethylene selectivity of 74.8% (X C2H6 =39.3%) at 873 K using Li (3 wt.%)/MgO catalyst. A similar ethylene selectivity of 86.4% (X C2H6 =38%) was achieved by Swaan et al. [10] on Li/Na/MgO at 898 K. Lithium-doped lanthanum–calcium oxide (Li:La:Ca=1:1:2.5) was described as an effective catalyst resulting in C2H4 yields of 48.2% (S=89.2%) at 893 K and GHSV=1000 h−1 [11]. Ethylene yields of up to 34–45% (S=66–73%) were obtained on REO-based catalysts (e.g. Na–P–Sm–O, Sm–Sr–O) under non-isothermal conditions (T max=1083–1138 K) at contact times in the order of 30 to 40 ms [12]. There is, however, only limited information regarding the key factors determining the catalytic activity and selectivity [9,12]. The aim of the present work is the elucidation of the oxygen interaction with Na2O/CaO, Sm2O3/CaO and Sm2O3 catalysts using Temporal Analysis of Product (TAP) reactor and measurements of CPDs to further illustrate the dependence of catalyst selectivity on the type of surface oxygen. Kinetics and mechanistic insights obtained were used deriving a better understanding of the factors determining the selectivity in the ODE. 2 Experimental and methods 2.1 Catalysts Na2O/CaO catalysts were prepared from CaCO3 (Alfa) and NaHCO3 (Merck). CaCO3 was calcinated at 1273 K for 10 h to decompose the carbonate. After calcination, the calcium oxide was impregnated with an aqueous solution of NaHCO3 followed by drying at 400 K for 2 h and calcination at 1273 K for 2 h. After calcination, the actual sodium concentration was determined by inductively coupled plasma optical emission spectroscopy (ICP-OES). Catalysts of the following stoichiometry were prepared: Na0,00001CaO x , Na0,009CaO x , Na0,012CaO x and Na0,064CaO x . The BET surface areas of the catalysts amounted to 6.3 m2/g for Na0,00001CaO x , 2.3 m2/g for Na0,009CaO x , 2.9 m2/g for Na0,012CaO x and 2 m2/g for Na0,064CaO x . Sm2O3 (Merck) was calcinated at 973 K for 4 h before TAP experiments; S BET of the calcined product amounted to 5.6 m2/g. For preparation of a SmCa5O x catalyst, a samarium nitrate solution was added to a suspension of Ca(OH)2 in water. The mixture was stirred and heated to evaporate the water; the catalyst precursor was calcined at 700°C in a flow of air for 2 h; S BET of the calcined catalyst amounted to 1.6 m2/g. 2.2 Catalytic testing The catalytic tests were performed in a fixed-bed reactor made of quartz. The feed gas consisted of 3–15 vol.% of oxygen and 30 vol.% of ethane in nitrogen. The total flow rate was fixed at 60 cm3/min; the reaction temperature amounted to 923 K. For comparison of selectivities at similar degrees of hydrocarbons conversion, the tests were performed at different contact times varying the amount of catalyst from 0.01 to 0.2 g. The feed gas and reaction products were analyzed on-line using a gas chromatograph (HP-5890) equipped with Poraplot Q and Molsiev 5 columns. 2.3 CPD measurements The CPD between the samples and a reference gold electrode was measured by applying the vibrating condenser method. Details of the apparatus have been reported elsewhere [6]. A catalyst disk with a diameter of 7 mm and a thickness of c. 0.4–0.5 mm was placed on the measuring electrode in a vacuum chamber connected to a gas-supply system controlling the partial pressure of oxygen. The interaction of oxygen with the catalyst sample was studied in the temperature range from 623 to 723 K applying oxygen partial pressure between 2.5×10−4 and 5×10−3 Pa. The character of the interaction in the metal oxide/oxygen system is essentially affected by the ionic transport in the oxide lattice. Depending on the sorption mechanism, two cases may be distinguished [13]. (1) The surface charge generated by chemisorption of oxygen is located at the surface as long as ionic transport in the lattice is quenched and sorption is limited to the adsorbed layer. For this case, increasing oxygen partial pressure results to an increase of CPD with time and then CPD reaches a constant value that corresponds to the chemisorption equilibrium. Information on the charge of surface oxygen species for a metal oxide/oxygen system might be derived according to Nowotny [13] and Barbaux et al. [14] from Eq. (1): (1) CPD= kT ae lnp O 2 +const In this equation, a is the number of electrons transferred from the solid to the adsorbed oxygen species, i.e., changes in CPD caused by variations in oxygen partial pressure at constant temperature are directly related to the charge of surface oxygen species as it is shown below (2) a=1 O 2+e⇄O 2 − (3) a=2 O 2+2e⇄2O − (4) a=2 O 2+2e⇄O 2 2− (5) a=4 O 2+4e⇄2O 2− (2) If ionic transport into the lattice takes place, the surface charge generated by oxygen adsorption decreases as a result of its migration in deeper layers of the oxide lattice. The charge decrease may be considered to be due either to an outward transport of anion vacancies (in the case of anion deficient oxides) or to diffusion of interstitial cations (in the case of oxides with Frenkel defects) or an inward transport of cation vacancies (in the case of cation deficient oxides). CPD increases initially with oxygen partial pressure increase and then decreases with time because of surface charge migration into the lattice. 2.4 TAP measurements The TAP-2 reactor system has been described in detail elsewhere [15]. The catalyst (100 mg for Na2O/CaO, 200 mg for Sm2O3 and SmCa5O x ; d p=250–355 μm) was packed between two layers of quartz of the same particle size in the reactor. Before each experiment the catalyst was treated in a flow of O2 (30 ml/min) at 873 K for c. 1 h. Then, the reactor was evacuated at 873 K to 10−4 Pa for 20 min. After the vacuum treatment, the temperature of the catalyst was set to the desired value between 673 and −873 K) and a mixture of O2/Ne=1:1 was pulsed over the catalysts. 2.5 TAP data treatment and fitting The rate equations are solved by the so-called method of lines. The differential equations are first transformed into coupled ordinary differential equations by a spatial approximation and then integrated by a numerical ordinary differential equation (ODE) solver. The kinetic parameters can be estimated by a non-linear regression analysis. More detail information on the subject was reported earlier [16,17]. The program used allowed a simple implementation of different models. Three models of oxygen interaction with catalyst surfaces described below were used in the present study. 2.6 Model 1: Langmuir-type adsorption Assuming the Langmuir model for oxygen adsorption with the rate constants k ads and k des, (6) O 2+z ⇄ k des k ads zO 2 the mass balance for the gas-phase and surface oxygen in the reactor can be written as (7) ∂C O 2 ∂t =D eff ∂ 2C O 2 ∂x2 −C tot (k ads C O 2 (1−Θ O 2 )−k des Θ O 2 ) (8) ∂Θ O 2 ∂t =k ads C O 2 (1−Θ O 2 )−k des Θ O 2 where 1=Θ O2 +Θ z , Θ O2 =C zO2 /C tot, Θ z =C z /C tot and D eff is the effective Knudsen diffusion coefficient. 2.7 Model 2: One-stage reversible dissociative adsorption For dissociative adsorption of gas-phase oxygen simultaneous oxygen adsorption and dissociation was assumed (Eq. (9)). (9) O 2+2z ⇄ k des k ads 2zO For this model, the mass balance changes to (10) ∂C O 2 ∂t =D eff ∂ 2C O 2 ∂x2 −C tot 2(k ads C O 2 (1−Θ O )2−k des Θ O 2) (11) ∂Θ O ∂t =2C tot (k ads C O 2 (1−Θ O )2−k des Θ O 2) where 1=Θ O+Θ z , Θ z =C z /C tot, Θ O=C zO/C tot and D eff is the effective Knudsen diffusion coefficient. 2.8 Model 3: Two-stage reversible dissociative adsorption The reversible molecular adsorption occurs as the first step; the molecular precursor undergoes further dissociation with the participation of one more catalyst centre of the same nature. Model and mass balance can be written as follows: (12) O 2+z ⇄ k des k ads zO 2 (13) zO 2+z ⇄ k ass k dis 2zO (14) ∂C O 2 ∂t =D eff ∂ 2C O 2 ∂x2 −C tot (k ads C O 2 (1−Θ O −Θ O 2 )−k des Θ O 2 ) (15) ∂Θ O 2 ∂t =k ads C O 2 (1−Θ O 2 −Θ O )−k des Θ O 2 −C tot (k dis Θ O 2 (1−Θ O 2 −Θ O )−k ass Θ O 2) (16) ∂Θ O ∂t =2C tot (k dis Θ O 2 (1−Θ O 2 −Θ O )−k ass Θ O 2) where 1=Θ O+Θ O2 +Θ z, Θ O2 =C zO2 /C tot, Θ z =C z /C tot, Θ O=C zO/C tot and D eff is the effective Knudsen diffusion coefficient. 3 Results and discussion 3.1 Catalytic performance The catalytic results obtained on all the catalysts in the ODE are listed in Table 1 . The contact times were varied to achieve similar degrees of ethane conversion. The main reaction product on all the catalysts was ethylene. Besides the formation of the undesired by-products CO and CO2, small amounts of methane and C3C4 hydrocarbons were formed. The selectivity towards ethylene were in the range between 53% and 78% depending on the type of catalyst. On a Na0,00001CaO x catalyst containing sodium on the impurity level and thus approximating the pure CaO, an ethylene selectivity of 53.7% was obtained. With increasing sodium content C2H4 selectivity increased up to 78%. An improvement of selectivity was also achieved by doping of CaO with samaria. For all catalysts studied, the selectivity of ethylene formation was affected by the ethane-to-oxygen ratio. Some of the dependencies are shown in Fig. 1 . An increase in oxygen partial pressure results in increasing formation of total oxidation products. Although the participation of oxygen in the secondary gas-phase reactions cannot be completely ruled out the extension of surface oxidation on rising oxygen partial pressure is of high by probable. The latter can be due to increased formation of adsorbed oxygen species of non-selectively nature or/and to enhanced local concentration of these adsorbed species. 3.2 CPD CPD measurements between an gold electrode and the catalysts were performed, to understand the differences between the catalysts for oxygen activation. The variations of CPD on changing oxygen partial pressure at different temperatures are shown in Fig. 2 for the Na0,009CaO x catalyst. According to the theory of CPD (see above), its increase with increasing oxygen partial pressure is due to the formation of negatively charged oxygen species and their stabilisation on the catalyst surface. Applying Eq. (1) from which the information on the charge of surface oxygen species can be derived, the a values for the Na0,009CaO x catalyst were estimated and amounted to 0.9±0.1, 1.7±0.2 and 1.7±0.1 at 623, 673 and 723 K, respectively. The increasing values from 1 to approximately 2 can be interpreted by the transformation of adsorbed molecular oxygen O2 − formed at low to O−/O2 2− with increasing temperature. These data agree well with our earlier results on Na0,012CaO x , and Na0,064CaO x catalysts [18]. We have also found a transformation of molecular oxygen species to atomic oxygen species with increasing temperature. For Sm2O3, a successive enhancement of oxygen partial pressure at 673 and 723 K leads to a stepwise decrease of CPD as shown in Fig. 3 . The decrease in CPD can be interpreted in terms of an ionic transport in the oxide lattice («CPD measurements»). After decreasing the oxygen partial pressure, CPD increases and reaches its initial value (Fig. 3). This means that a negative charge diffuses from the bulk to the surface followed by oxygen desorption. The assumption of oxygen incorporation into the deep oxide layers can be supported by the data of Cherrak et al. [19] who found that O2− was the main oxygen species on Sm2O3 at temperatures higher that 360°C. It can be assumed that the temperature of our CPD measurements is high enough to enable the oxygen incorporation into deeper oxide layers. A high mobility of lattice oxygen in Sm2O3 agrees well with the results of Ekstrom and Lapszewicz [20] on oxygen isotopic exchange. They found that 100% of the lattice oxygen exchanged with gas-phase oxygen at high temperature. Thus, the results of CPD studies show that an increase in temperature accelerates the transformation of molecular adsorbed oxygen into atomic oxygen species, the latter being incorporated into oxide lattice. The incorporation seems to take place between 673 and 723 K in the case of Sm2O3 while Na2O/CaO requires higher temperatures to accomplish this step. 3.3 TAP responses fitting and relationship between catalyst composition and oxygen activation To further elucidate the peculiarities of oxygen interaction with these catalysts, the modelling of TAP oxygen responses over different catalysts in the temperature range from 673 to 873 K was performed. The results of numerical fitting of the experimental data for oxygen adsorption are described. In Fig. 4 , the experimental response of oxygen over Na0.00001CaO x at 873 K is compared with the simulated responses obtained for the above mentioned models. Models 1 and 2 failed obviously to describe the transient behaviour. The best fitting of the experimental data was obtained by Model 3. This is valid for all the catalysts studied. It is necessary to note that a correlation between the three parameters (C tot, k ads, k dis) was found, therefore, only the effective rate constants, which contain the total concentration of active sites (k ads eff=C tot k ads and k diss eff=C tot k diss), were determined. A reference temperature was introduced to fit the experimental responses at different temperatures according to Eq. (17). (17) kTi =kT ref exp − Ea R 1 Ti − 1 T ref A good description of the transient data is obtained at each temperature (Fig. 5) . This is valid for all the catalysts studied. Kinetic parameters obtained for different catalysts using Model 3 are summarised in Table 2 . By analysing the kinetic data obtained, we can conclude that the ratio of k ads/k dis decreases in the following order: Na 0.00001 CaO x>Na 0.009 CaO x>Na 0.012 CaO x>Na 0.063 CaO x>SmCa 5 O x>Sm 2 O 3 The rate constants of association of atomic adsorbed oxygen were very low and have similar values for all Na2O/CaO catalysts and Sm2O3 (Table 2). However, the rate constant of association of atomic oxygen on SmCa5O x is to four to five orders of magnitude higher compared to all the catalysts studied (Table 2). One of the possible explanations of this later result might be the formation of peroxide ions in this case. The ratio of k ads/k dis can indicate the ability of the catalyst for converting molecular adsorbed oxygen species to atomic adsorbed oxygen species. The results of TAP modelling are in agreement with those of CPD. From CPD results, it follows that for Sm2O3, O2− are the main oxygen species at temperatures higher than 533 K [19] and these species can be incorporated into deeper oxide layers at temperatures higher as 673 K. For CaO-based catalysts, the formation of atomic species is possible only at temperatures higher as 673 K. Besides, we have earlier found that the incorporation of sodium cations into a CaO sublattice increases the anion conductivity and the amount of irreversibly adsorbed oxygen [18]. These effects were interpreted by formation of additional anion vacancies, which can catalyse the transformation of molecular adsorbed oxygen into atomic species. Thus, from fitting the experimental oxygen responses, it is possible to conclude that the mechanism of oxygen interaction with the catalysts studied changes due to the incorporation both sodium and samarium cations into the calcium oxide lattice. 3.4 ODE and oxygen interaction The catalysts studied showed marked difference in selectivity for the formation of ethylene in the selective dehydrogenation of ethane. To explain the dependence of the catalytic performances both on oxygen partial pressure and the catalyst composition, the mechanistic results on oxygen activation are discussed. First, the analysis concerns Na2O/CaO catalysts. As the catalytic results show, Na0.00001CaO x has the lowest C2-selectivity among all CaO-based catalysts and the ratio of k ads/k dis for oxygen activation is the highest for this catalyst. This means that Na0.00001CaO x catalyst has the lowest ability to convert molecular adsorbed oxygen into atomic species. Earlier, from CPD and total conductivity measurements, we have concluded [18] that adsorbed oxygen species do not migrate into the oxide bulk, but stay and accumulate on the oxide surface. Using the kinetic parameters from the transient experiments, the surface coverages with molecular and atomic adsorbed oxygen species under steady-state oxygen conditions in the absence of ethane were simulated for different oxygen partial pressures. These data are then discussed to explain the catalytic performances of the catalysts in the ODE. Fig. 6 presents the selectivity of C2 products formation over all Na2O/CaO catalysts at different oxygen partial pressures vs. the ratio of Θ O/Θ O2 estimated at the same oxygen partial pressures as in the catalytic runs. From these results, it follows that the selectivity obtained grows with increasing the ratio of Θ O/Θ O2 . (Fig. 6). This means that a high selectivity of ethylene can be achieved by reducing the concentration of adsorbed molecular oxygen. An incorporation of samarium oxide into the CaO lattice affects the catalytic performances of CaO. At low oxygen pressure, SmCa5O x has the lowest CO x selectivity among the catalysts studied except of Na0.064CaO x . With increasing oxygen partial pressure the selectivity of CO x products growths very strongly. Promoting effect of samarium oxide on CaO is possible due to decreasing the ratio of k ads/k dis for oxygen activation. For this catalyst, in spite of the low ratio of k ads/k dis the ratio of Θ O/Θ O2 is very low as compared to Na2O/CaO catalysts. This is due to a high value of k ass. Under reaction conditions, the ratio of Θ O/Θ O2 will increase because of the reaction of atomic species with ethane or their diffusion into deep catalyst layers. The dependence of CO x selectivity on oxygen partial pressure is well described, as in the case of Na2O/CaO catalysts, by the reduced concentration of adsorbed molecular oxygen with decreasing oxygen partial pressure (Fig. 7) . The increase of CO x selectivity with increasing concentration of adsorbed molecular oxygen species can be due to the fact that the poly-atomic oxygen species promote especially CC bond cleavage [4]. This reaction is probably the initial step of C2 products combustion. The positive effect of the transformation of molecular oxygen in atomic oxygen surface species on selectivity was previously also found in our works for the OCM reaction [5,6,18,21]. Thus, the addition both of alkali dopant and samarium oxide into the CaO lattice influences the process of oxygen activation due to decreasing the ratio of k ads/k dis, which, in turn, results in reducing the coverage of the surface with molecular oxygen species and, hence, in high selectivity for C2 products formation. For Sm2O3, the highest selectivity of formation of C3C4 hydrocarbons among the catalyst studied is typical (Table 1). Earlier [22], we have established that Sm2O3 is able to ignite C2H6–O2 mixture at low temperature (450°C), with further reactions occurring most preferably in the gas phase. In this study, we had to reduce the amount of the catalysts to 10–20 mg to avoid ignition. In spite of reducing catalyst amount, we assume that the ignition of the mixture may influence our catalytic data. Work on elucidating this effect is in progress. 4 Conclusions Adsorption of gaseous oxygen studied by CPD measurements showed that the transformation of adsorbed molecular oxygen into atomic oxygen species above 673 K takes place, the type of this transformation depends on the catalyst composition. The results of CPD measurements were supported by modelling oxygen transient responses carried out in the TAP-2 reactor. From different models used for fitting the experimental data, a good fitting was only achieved when assuming the two-stage reversible dissociative adsorption via a molecular precursor. The kinetic constants simulated could be fitted with the Arrhenius law. It was found that the ratio of k ads/k dis determines the coverage of a catalyst surface with atomic vs. molecular oxygen and thus places a decisive role for the catalyst selectivity. A correlation between the ratio of Θ O/Θ O2 and selective oxidation of ethane was found. A decrease in the concentration of adsorbed molecular oxygen due to an increase of the rate of its dissociation improves the catalytic performances of Na2O/CaO catalysts with increasing sodium concentration and by doping of CaO with Sm2O3. 5 Notation C O2 gas-phase oxygen concentration (mol·m−3 of gas phase) C z concentration of free active catalyst centres (mol·m−3 of catalyst) C zO2 concentration of molecular adsorbed oxygen species (mol·m−3 of catalyst) C zO concentration of atomic adsorbed oxygen species (mol·m−3 of catalyst) C tot total concentration of adsorption sites (mol·m−3 of catalyst) D eff effective Knudsen diffusion coefficient (m2·s−1) d p catalyst particle size (μm) E a activation energy (kJ/mol) k ads adsorption rate constant (m3·mol−1·s−1) k des desorption rate constant (s−1) k diss dissociation rate constant (m3·mol−1·s−1) — Model 3 k ass association rate constant (m3·mol−1·s−1) — Model 3 k o pre-exponential factor (s−1 and m3·mol−1·s−1 for reaction of first and second order, respectively) Θ O2 fractional coverage of molecular adsorbed oxygen (dimensionless) Θ O fractional coverage of atomic adsorbed oxygen (dimensionless) Θ z fractional coverage of free adsorption sites (dimensionless) t time (s) T temperature (K) x reactor coordinate (m) Acknowledgements E.V. Kondratenko thanks Alexander von Humboldt Foundation for a postdoctoral fellowship to work at the Institut für Angewandte Chemie Berlin-Adlershof e.V. The work was supported by the German Federal Ministry for Education and Research (Contract No. 03C30120) and by the State of Berlin as well as by Fond der Chemischen Industrie. References [1] G.K. Boreskov Catalytic activation of dioxygen J. Andersen M. Boudart Catalysis: Science and Technology 1982 Springer Berlin 40 [2] H.H. Kung Adv. Catal. 40 1994 1 [3] A. Belansky J. Haber Oxygen in Catalysis 1996 Marcel Dekker New York [4] M. Iwamoto J.-H. Lunsford J. Phys. Chem. 84 1980 3079 [5] H. Borchert M. Baerns J. Catal. 168 1997 315 [6] G. Gayko D. Wolf E.V. Kondratenko M. Baerns J. Catal. 178 1998 441 [7] G.J. Hutchings M.S. Scurrel J.R. Woodhous J. Chem. Soc.-Chem. Commun. 85 1989 2507 [8] A.G. Anshits V.G. Roguleva E.V. Kondratenko V. Cortes Corberan S. Vic Belon Studies in Surface Science and Catalysis Vol. 82 1994 Elsevier Amsterdam 337 [9] E. Morales J.H. Lunsford J. Catal. 118 1989 255 [10] H. Swaan A. Toebes K. Seshan J.G. Van Ommen J.R.H. Ross Catal. Today 13 1992 629 [11] L. Ji J. Liu Chem. Commun. 1996 1203 [12] O. Buyevskaya M. Baerns DGMK-Tagungsber. 9803 1998 139 [13] L. Nowotny J. Mater. Sci. Monogr. 15 1982 358 [14] Y. Barbaux J.P. Bonnelle J.P. Beaufils J. Chem. Res. M 556 1979 [15] J.T. Gleaves G.S. Yablonskii P. Phanawadee Y. Schuurman Appl. Catal. 160 1997 55 [16] M. Rothaemel M. Baerns Ind. Eng. Chem. Res. 35 1996 1556 [17] M. Soick, D. Wolf, M. Baerns, Chem. Eng. Sci., submitted. [18] E.V. Kondratenko M. Baerns D. Wolf Catal. Lett. 58 N4 1999 217 [19] A. Cherrak R. Hubaut Y. Barbaux J. Chem. Soc. Faraday Trans. 88 1992 3241 [20] A. Ekstrom J.A. Lapszewicz J. Am. Chem. Soc. 110 1988 5226 [21] A.G. Anshits N.P. Kirik V.G. Roguleva A.N. Shigapov G.E. Selyutin Catal. Today 4 1989 399 [22] O. Buyevskaya M. Baerns DGMK-Conference on “Selective Oxidations in Pertochemistry, Hamburg” 1998 139",
      "scopus-id": "0034622703",
      "coredata": {
        "eid": "1-s2.0-S1381116900000662",
        "dc:description": "The oxidative dehydrogenation of ethane (ODE) was studied over Na2O/CaO, Sm2O3/CaO and Sm2O3 catalysts at 923 K using different oxygen partial pressures. The type of interaction of oxygen with these catalysts was derived from measurements of contact potential difference (CPD) between a gold electrode and the catalysts and pulse experiments in the Temporal Analysis of Product (TAP) reactor. Modelling of TAP oxygen responses in the temperature range from 673 to 873 K showed that a reversible dissociative adsorption via a molecular precursor provides a good description of the measured transient responses for all catalysts. Supplementary CPD results confirmed the transformation of adsorbed molecular oxygen species to atomic ones. Rate constants and activation energies of the elementary reaction steps of oxygen adsorption, desorption, dissociation and association were estimated from the TAP oxygen responses. The dependence of ethylene selectivity both on doping and oxygen partial pressure was explained by the ratio of Θ O/Θ O2. This ratio is strongly affected by the constants of adsorption of oxygen and dissociation of molecular adsorbed oxygen.",
        "openArchiveArticle": "false",
        "prism:coverDate": "2000-09-08",
        "openaccessUserLicense": null,
        "prism:aggregationType": "Journal",
        "prism:url": "https://api.elsevier.com/content/article/pii/S1381116900000662",
        "dc:creator": [
          {
            "@_fa": "true",
            "$": "Kondratenko, E.V."
          },
          {
            "@_fa": "true",
            "$": "Buyevskaya, O."
          },
          {
            "@_fa": "true",
            "$": "Baerns, M."
          }
        ],
        "link": [
          {
            "@_fa": "true",
            "@rel": "self",
            "@href": "https://api.elsevier.com/content/article/pii/S1381116900000662"
          },
          {
            "@_fa": "true",
            "@rel": "scidir",
            "@href": "https://www.sciencedirect.com/science/article/pii/S1381116900000662"
          }
        ],
        "dc:format": "application/json",
        "openaccessType": null,
        "pii": "S1381-1169(00)00066-2",
        "prism:volume": "158",
        "prism:publisher": "Elsevier Science B.V.",
        "dc:title": "Mechanistic insights in the activation of oxygen on oxide catalysts for the oxidative dehydrogenation of ethane from pulse experiments and contact potential difference measurements",
        "prism:copyright": "Copyright © 2000 Elsevier Science B.V. All rights reserved.",
        "openaccess": "0",
        "prism:issn": "13811169",
        "prism:issueIdentifier": "1",
        "dcterms:subject": [
          {
            "@_fa": "true",
            "$": "Temporal of products (TAP) reactor"
          },
          {
            "@_fa": "true",
            "$": "Contact potential difference"
          },
          {
            "@_fa": "true",
            "$": "Modelling of oxygen adsorption"
          },
          {
            "@_fa": "true",
            "$": "Oxidative dehydrogenation of ethane"
          },
          {
            "@_fa": "true",
            "$": "Mixed oxide catalysts"
          }
        ],
        "openaccessArticle": "false",
        "prism:publicationName": "Journal of Molecular Catalysis A: Chemical",
        "prism:number": "1",
        "openaccessSponsorType": null,
        "prism:pageRange": "199-208",
        "prism:endingPage": "208",
        "pubType": "fla",
        "prism:coverDisplayDate": "8 September 2000",
        "prism:doi": "10.1016/S1381-1169(00)00066-2",
        "prism:startingPage": "199",
        "dc:identifier": "doi:10.1016/S1381-1169(00)00066-2",
        "openaccessSponsorName": null
      },
      "objects": {
        "object": [
          {
            "@category": "thumbnail",
            "@height": "38",
            "@width": "118",
            "@_fa": "true",
            "$": "https://api.elsevier.com/content/object/eid/1-s2.0-S1381116900000662-si9.gif?httpAccept=%2A%2F%2A",
            "@multimediatype": "GIF image file",
            "@type": "ALTIMG",
            "@size": "727",
            "@ref": "si9",
            "@mimetype": "image/gif"
          },
          {
            "@category": "thumbnail",
            "@height": "35",
            "@width": "258",
            "@_fa": "true",
            "$": "https://api.elsevier.com/content/object/eid/1-s2.0-S1381116900000662-si8.gif?httpAccept=%2A%2F%2A",
            "@multimediatype": "GIF image file",
            "@type": "ALTIMG",
            "@size": "1257",
            "@ref": "si8",
            "@mimetype": "image/gif"
          },
          {
            "@category": "thumbnail",
            "@height": "38",
            "@width": "394",
            "@_fa": "true",
            "$": "https://api.elsevier.com/content/object/eid/1-s2.0-S1381116900000662-si7.gif?httpAccept=%2A%2F%2A",
            "@multimediatype": "GIF image file",
            "@type": "ALTIMG",
            "@size": "1921",
            "@ref": "si7",
            "@mimetype": "image/gif"
          },
          {
            "@category": "thumbnail",
            "@height": "38",
            "@width": "108",
            "@_fa": "true",
            "$": "https://api.elsevier.com/content/object/eid/1-s2.0-S1381116900000662-si6.gif?httpAccept=%2A%2F%2A",
            "@multimediatype": "GIF image file",
            "@type": "ALTIMG",
            "@size": "673",
            "@ref": "si6",
            "@mimetype": "image/gif"
          },
          {
            "@category": "thumbnail",
            "@height": "18",
            "@width": "189",
            "@_fa": "true",
            "$": "https://api.elsevier.com/content/object/eid/1-s2.0-S1381116900000662-si5.gif?httpAccept=%2A%2F%2A",
            "@multimediatype": "GIF image file",
            "@type": "ALTIMG",
            "@size": "663",
            "@ref": "si5",
            "@mimetype": "image/gif"
          },
          {
            "@category": "thumbnail",
            "@height": "20",
            "@width": "181",
            "@_fa": "true",
            "$": "https://api.elsevier.com/content/object/eid/1-s2.0-S1381116900000662-si4.gif?httpAccept=%2A%2F%2A",
            "@multimediatype": "GIF image file",
            "@type": "ALTIMG",
            "@size": "676",
            "@ref": "si4",
            "@mimetype": "image/gif"
          },
          {
            "@category": "thumbnail",
            "@height": "14",
            "@width": "183",
            "@_fa": "true",
            "$": "https://api.elsevier.com/content/object/eid/1-s2.0-S1381116900000662-si3.gif?httpAccept=%2A%2F%2A",
            "@multimediatype": "GIF image file",
            "@type": "ALTIMG",
            "@size": "631",
            "@ref": "si3",
            "@mimetype": "image/gif"
          },
          {
            "@category": "thumbnail",
            "@height": "16",
            "@width": "167",
            "@_fa": "true",
            "$": "https://api.elsevier.com/content/object/eid/1-s2.0-S1381116900000662-si2.gif?httpAccept=%2A%2F%2A",
            "@multimediatype": "GIF image file",
            "@type": "ALTIMG",
            "@size": "557",
            "@ref": "si2",
            "@mimetype": "image/gif"
          },
          {
            "@category": "thumbnail",
            "@height": "15",
            "@width": "565",
            "@_fa": "true",
            "$": "https://api.elsevier.com/content/object/eid/1-s2.0-S1381116900000662-si18.gif?httpAccept=%2A%2F%2A",
            "@multimediatype": "GIF image file",
            "@type": "ALTIMG",
            "@size": "2033",
            "@ref": "si18",
            "@mimetype": "image/gif"
          },
          {
            "@category": "thumbnail",
            "@height": "40",
            "@width": "270",
            "@_fa": "true",
            "$": "https://api.elsevier.com/content/object/eid/1-s2.0-S1381116900000662-si17.gif?httpAccept=%2A%2F%2A",
            "@multimediatype": "GIF image file",
            "@type": "ALTIMG",
            "@size": "1445",
            "@ref": "si17",
            "@mimetype": "image/gif"
          },
          {
            "@category": "thumbnail",
            "@height": "35",
            "@width": "337",
            "@_fa": "true",
            "$": "https://api.elsevier.com/content/object/eid/1-s2.0-S1381116900000662-si16.gif?httpAccept=%2A%2F%2A",
            "@multimediatype": "GIF image file",
            "@type": "ALTIMG",
            "@size": "1598",
            "@ref": "si16",
            "@mimetype": "image/gif"
          },
          {
            "@category": "thumbnail",
            "@height": "36",
            "@width": "594",
            "@_fa": "true",
            "$": "https://api.elsevier.com/content/object/eid/1-s2.0-S1381116900000662-si15.gif?httpAccept=%2A%2F%2A",
            "@multimediatype": "GIF image file",
            "@type": "ALTIMG",
            "@size": "2370",
            "@ref": "si15",
            "@mimetype": "image/gif"
          },
          {
            "@category": "thumbnail",
            "@height": "38",
            "@width": "437",
            "@_fa": "true",
            "$": "https://api.elsevier.com/content/object/eid/1-s2.0-S1381116900000662-si14.gif?httpAccept=%2A%2F%2A",
            "@multimediatype": "GIF image file",
            "@type": "ALTIMG",
            "@size": "2038",
            "@ref": "si14",
            "@mimetype": "image/gif"
          },
          {
            "@category": "thumbnail",
            "@height": "38",
            "@width": "132",
            "@_fa": "true",
            "$": "https://api.elsevier.com/content/object/eid/1-s2.0-S1381116900000662-si13.gif?httpAccept=%2A%2F%2A",
            "@multimediatype": "GIF image file",
            "@type": "ALTIMG",
            "@size": "757",
            "@ref": "si13",
            "@mimetype": "image/gif"
          },
          {
            "@category": "thumbnail",
            "@height": "38",
            "@width": "108",
            "@_fa": "true",
            "$": "https://api.elsevier.com/content/object/eid/1-s2.0-S1381116900000662-si12.gif?httpAccept=%2A%2F%2A",
            "@multimediatype": "GIF image file",
            "@type": "ALTIMG",
            "@size": "673",
            "@ref": "si12",
            "@mimetype": "image/gif"
          },
          {
            "@category": "thumbnail",
            "@height": "35",
            "@width": "298",
            "@_fa": "true",
            "$": "https://api.elsevier.com/content/object/eid/1-s2.0-S1381116900000662-si11.gif?httpAccept=%2A%2F%2A",
            "@multimediatype": "GIF image file",
            "@type": "ALTIMG",
            "@size": "1479",
            "@ref": "si11",
            "@mimetype": "image/gif"
          },
          {
            "@category": "thumbnail",
            "@height": "38",
            "@width": "391",
            "@_fa": "true",
            "$": "https://api.elsevier.com/content/object/eid/1-s2.0-S1381116900000662-si10.gif?httpAccept=%2A%2F%2A",
            "@multimediatype": "GIF image file",
            "@type": "ALTIMG",
            "@size": "1923",
            "@ref": "si10",
            "@mimetype": "image/gif"
          },
          {
            "@category": "thumbnail",
            "@height": "34",
            "@width": "174",
            "@_fa": "true",
            "$": "https://api.elsevier.com/content/object/eid/1-s2.0-S1381116900000662-si1.gif?httpAccept=%2A%2F%2A",
            "@multimediatype": "GIF image file",
            "@type": "ALTIMG",
            "@size": "878",
            "@ref": "si1",
            "@mimetype": "image/gif"
          },
          {
            "@category": "standard",
            "@height": "230",
            "@width": "226",
            "@_fa": "true",
            "$": "https://api.elsevier.com/content/object/eid/1-s2.0-S1381116900000662-gr1.gif?httpAccept=%2A%2F%2A",
            "@multimediatype": "GIF image file",
            "@type": "IMAGE-DOWNSAMPLED",
            "@size": "4527",
            "@ref": "gr1",
            "@mimetype": "image/gif"
          },
          {
            "@category": "thumbnail",
            "@height": "164",
            "@width": "161",
            "@_fa": "true",
            "$": "https://api.elsevier.com/content/object/eid/1-s2.0-S1381116900000662-gr1.sml?httpAccept=%2A%2F%2A",
            "@multimediatype": "GIF image file",
            "@type": "IMAGE-THUMBNAIL",
            "@size": "2821",
            "@ref": "gr1",
            "@mimetype": "image/gif"
          },
          {
            "@category": "high",
            "@height": "2441",
            "@width": "2397",
            "@_fa": "true",
            "$": "https://api.elsevier.com/content/object/eid/1-s2.0-S1381116900000662-gr1_lrg.gif?httpAccept=%2A%2F%2A",
            "@multimediatype": "GIF image file",
            "@type": "IMAGE-HIGH-RES",
            "@size": "44294",
            "@ref": "gr1",
            "@mimetype": "image/gif"
          },
          {
            "@category": "standard",
            "@height": "254",
            "@width": "259",
            "@_fa": "true",
            "$": "https://api.elsevier.com/content/object/eid/1-s2.0-S1381116900000662-gr2.gif?httpAccept=%2A%2F%2A",
            "@multimediatype": "GIF image file",
            "@type": "IMAGE-DOWNSAMPLED",
            "@size": "5823",
            "@ref": "gr2",
            "@mimetype": "image/gif"
          },
          {
            "@category": "thumbnail",
            "@height": "164",
            "@width": "167",
            "@_fa": "true",
            "$": "https://api.elsevier.com/content/object/eid/1-s2.0-S1381116900000662-gr2.sml?httpAccept=%2A%2F%2A",
            "@multimediatype": "GIF image file",
            "@type": "IMAGE-THUMBNAIL",
            "@size": "3246",
            "@ref": "gr2",
            "@mimetype": "image/gif"
          },
          {
            "@category": "high",
            "@height": "2701",
            "@width": "2751",
            "@_fa": "true",
            "$": "https://api.elsevier.com/content/object/eid/1-s2.0-S1381116900000662-gr2_lrg.gif?httpAccept=%2A%2F%2A",
            "@multimediatype": "GIF image file",
            "@type": "IMAGE-HIGH-RES",
            "@size": "59267",
            "@ref": "gr2",
            "@mimetype": "image/gif"
          },
          {
            "@category": "standard",
            "@height": "227",
            "@width": "240",
            "@_fa": "true",
            "$": "https://api.elsevier.com/content/object/eid/1-s2.0-S1381116900000662-gr3.gif?httpAccept=%2A%2F%2A",
            "@multimediatype": "GIF image file",
            "@type": "IMAGE-DOWNSAMPLED",
            "@size": "6753",
            "@ref": "gr3",
            "@mimetype": "image/gif"
          },
          {
            "@category": "thumbnail",
            "@height": "163",
            "@width": "173",
            "@_fa": "true",
            "$": "https://api.elsevier.com/content/object/eid/1-s2.0-S1381116900000662-gr3.sml?httpAccept=%2A%2F%2A",
            "@multimediatype": "GIF image file",
            "@type": "IMAGE-THUMBNAIL",
            "@size": "4098",
            "@ref": "gr3",
            "@mimetype": "image/gif"
          },
          {
            "@category": "high",
            "@height": "2409",
            "@width": "2549",
            "@_fa": "true",
            "$": "https://api.elsevier.com/content/object/eid/1-s2.0-S1381116900000662-gr3_lrg.gif?httpAccept=%2A%2F%2A",
            "@multimediatype": "GIF image file",
            "@type": "IMAGE-HIGH-RES",
            "@size": "71784",
            "@ref": "gr3",
            "@mimetype": "image/gif"
          },
          {
            "@category": "standard",
            "@height": "255",
            "@width": "277",
            "@_fa": "true",
            "$": "https://api.elsevier.com/content/object/eid/1-s2.0-S1381116900000662-gr4.gif?httpAccept=%2A%2F%2A",
            "@multimediatype": "GIF image file",
            "@type": "IMAGE-DOWNSAMPLED",
            "@size": "6942",
            "@ref": "gr4",
            "@mimetype": "image/gif"
          },
          {
            "@category": "thumbnail",
            "@height": "164",
            "@width": "178",
            "@_fa": "true",
            "$": "https://api.elsevier.com/content/object/eid/1-s2.0-S1381116900000662-gr4.sml?httpAccept=%2A%2F%2A",
            "@multimediatype": "GIF image file",
            "@type": "IMAGE-THUMBNAIL",
            "@size": "3726",
            "@ref": "gr4",
            "@mimetype": "image/gif"
          },
          {
            "@category": "high",
            "@height": "2706",
            "@width": "2941",
            "@_fa": "true",
            "$": "https://api.elsevier.com/content/object/eid/1-s2.0-S1381116900000662-gr4_lrg.gif?httpAccept=%2A%2F%2A",
            "@multimediatype": "GIF image file",
            "@type": "IMAGE-HIGH-RES",
            "@size": "74103",
            "@ref": "gr4",
            "@mimetype": "image/gif"
          },
          {
            "@category": "standard",
            "@height": "232",
            "@width": "287",
            "@_fa": "true",
            "$": "https://api.elsevier.com/content/object/eid/1-s2.0-S1381116900000662-gr5.gif?httpAccept=%2A%2F%2A",
            "@multimediatype": "GIF image file",
            "@type": "IMAGE-DOWNSAMPLED",
            "@size": "8459",
            "@ref": "gr5",
            "@mimetype": "image/gif"
          },
          {
            "@category": "thumbnail",
            "@height": "164",
            "@width": "203",
            "@_fa": "true",
            "$": "https://api.elsevier.com/content/object/eid/1-s2.0-S1381116900000662-gr5.sml?httpAccept=%2A%2F%2A",
            "@multimediatype": "GIF image file",
            "@type": "IMAGE-THUMBNAIL",
            "@size": "5009",
            "@ref": "gr5",
            "@mimetype": "image/gif"
          },
          {
            "@category": "high",
            "@height": "2461",
            "@width": "3051",
            "@_fa": "true",
            "$": "https://api.elsevier.com/content/object/eid/1-s2.0-S1381116900000662-gr5_lrg.gif?httpAccept=%2A%2F%2A",
            "@multimediatype": "GIF image file",
            "@type": "IMAGE-HIGH-RES",
            "@size": "92986",
            "@ref": "gr5",
            "@mimetype": "image/gif"
          },
          {
            "@category": "standard",
            "@height": "247",
            "@width": "238",
            "@_fa": "true",
            "$": "https://api.elsevier.com/content/object/eid/1-s2.0-S1381116900000662-gr6.gif?httpAccept=%2A%2F%2A",
            "@multimediatype": "GIF image file",
            "@type": "IMAGE-DOWNSAMPLED",
            "@size": "5135",
            "@ref": "gr6",
            "@mimetype": "image/gif"
          },
          {
            "@category": "thumbnail",
            "@height": "164",
            "@width": "158",
            "@_fa": "true",
            "$": "https://api.elsevier.com/content/object/eid/1-s2.0-S1381116900000662-gr6.sml?httpAccept=%2A%2F%2A",
            "@multimediatype": "GIF image file",
            "@type": "IMAGE-THUMBNAIL",
            "@size": "2867",
            "@ref": "gr6",
            "@mimetype": "image/gif"
          },
          {
            "@category": "high",
            "@height": "2631",
            "@width": "2531",
            "@_fa": "true",
            "$": "https://api.elsevier.com/content/object/eid/1-s2.0-S1381116900000662-gr6_lrg.gif?httpAccept=%2A%2F%2A",
            "@multimediatype": "GIF image file",
            "@type": "IMAGE-HIGH-RES",
            "@size": "54962",
            "@ref": "gr6",
            "@mimetype": "image/gif"
          },
          {
            "@category": "standard",
            "@height": "232",
            "@width": "238",
            "@_fa": "true",
            "$": "https://api.elsevier.com/content/object/eid/1-s2.0-S1381116900000662-gr7.gif?httpAccept=%2A%2F%2A",
            "@multimediatype": "GIF image file",
            "@type": "IMAGE-DOWNSAMPLED",
            "@size": "4493",
            "@ref": "gr7",
            "@mimetype": "image/gif"
          },
          {
            "@category": "thumbnail",
            "@height": "164",
            "@width": "168",
            "@_fa": "true",
            "$": "https://api.elsevier.com/content/object/eid/1-s2.0-S1381116900000662-gr7.sml?httpAccept=%2A%2F%2A",
            "@multimediatype": "GIF image file",
            "@type": "IMAGE-THUMBNAIL",
            "@size": "2737",
            "@ref": "gr7",
            "@mimetype": "image/gif"
          },
          {
            "@category": "high",
            "@height": "2465",
            "@width": "2529",
            "@_fa": "true",
            "$": "https://api.elsevier.com/content/object/eid/1-s2.0-S1381116900000662-gr7_lrg.gif?httpAccept=%2A%2F%2A",
            "@multimediatype": "GIF image file",
            "@type": "IMAGE-HIGH-RES",
            "@size": "53751",
            "@ref": "gr7",
            "@mimetype": "image/gif"
          }
        ]
      },
      "link": {
        "@rel": "abstract",
        "@href": "https://api.elsevier.com/content/abstract/scopus_id/0034622703"
      }
    }
  }
}