{
  "metadata": {
    "title": "Synthesis of titanium–triazine based MCM-41 hybrid materials as catalyst for the asymmetric epoxidation of cinammyl alcohol",
    "authors": "; ; ",
    "journal": "Journal of Molecular Catalysis A: Chemical",
    "date": "2009-09-01",
    "doi": "10.1016/j.molcata.2009.05.023",
    "abstract": "",
    "uri": "https://api.elsevier.com/content/article/pii/S1381116909002714",
    "pii": "S1381116909002714"
  },
  "fulltext": {
    "full-text-retrieval-response": {
      "scopus-eid": "2-s2.0-67849118609",
      "originalText": "serial JL 271358 291210 291744 291790 291809 31 Journal of Molecular Catalysis A: Chemical JOURNALMOLECULARCATALYSISACHEMICAL 2009-06-08 2009-06-08 2010-04-16T17:45:36 1-s2.0-S1381116909002714 S1381-1169(09)00271-4 S1381116909002714 10.1016/j.molcata.2009.05.023 S300 S300.1 FULL-TEXT 1-s2.0-S1381116909X00129 2015-05-15T05:56:33.307883-04:00 0 0 20090901 2009 2009-06-08T00:00:00Z articleinfo crossmark dco dateupdated tomb dateloaded datesearch indexeddate issuelist volumelist yearnav absattachment articletitlenorm authfirstinitialnorm authfirstsurnamenorm cid cids contenttype copyright dateloadedtxt docsubtype doctype doi eid ewtransactionid hubeid issfirst issn issnnorm itemstage itemtransactionid itemweight openaccess openarchive pg pgfirst pglast pii piinorm pubdatestart pubdatetxt pubyr sortorder srctitle srctitlenorm srctype subheadings volfirst volissue webpdf webpdfpagecount figure table body acknowledge affil articletitle auth authfirstini authfull authkeywords authlast primabst ref specialabst alllist content subj ssids 1381-1169 13811169 310 310 1 2 1 2 Volume 310, Issues 1–2 13 83 92 83 92 20090901 1 September 2009 2009-09-01 2009 article fla Copyright © 2009 Elsevier B.V. All rights reserved. SYNTHESISTITANIUMTRIAZINEBASEDMCM41HYBRIDMATERIALSCATALYSTFORASYMMETRICEPOXIDATIONCINAMMYLALCOHOL BALLESTEROS R 1 Introduction 2 Experimental procedure 2.1 General remarks 2.2 Reagents and materials 2.3 Synthesis of MCM-41 mesoporous silica 2.4 Preparation of titanium modified MCM-41-supported catalyst 2.4.1 Preparation of Ti-CyPTS-HMDS-MCM-41 and TiMent-CyPTS-HMDS-MCM-41 2.4.2 Reaction of Ti-CyPTS-HMDS-MCM-41 and L-(+)-DET 2.5 Catalytic test 2.6 Characterization 3 Results and discussion 3.1 Synthesis and characterization of heterogeneous catalysts 3.2 Preparation of Ti(L-DET)-CyPTS-HMDS-MCM-41 3.3 The UV–vis/DRS spectra 3.4 Catalytic cinnamyl alcohol epoxidation 4 Conclusions Acknowledgements References YOON 2003 1691 T CARON 2006 2943 S FARINA 2006 2734 V XIA 2005 1603 Q EUISONG 2006 2927 C END 2004 241 N KURESHY 2005 3562 R SOUNDIRESSANE 2007 132 T HUANG 2006 216 L AOKI 2004 1771 K YANG 2007 1086 H GARCIA 2008 2964 R ADIMA 2000 411 A EUISONG 2005 143 C CHOUDARY 1990 1186 B KLUNDUIK 1999 5 M MEUNIER 1999 38 D FU 2004 159 Z PEREZ 2007 227 Y XIANG 2002 41 S BALLESTEROS 2008 452 R PEREZ 2003 220 Y LANDAU 1999 149 M MORANTEZARCERO 2004 61 S RAMON 2006 6 D KUZNIARSKABIERNACKA 2007 82 I BIGI 2002 716 F PARKER 2002 516 B BRUTCHEY 2005 238 R JARUPATRAKORN 2002 8380 J LAMPMAN 2001 P INTRODUCTIONSPECTROSCOPY LEE 2001 77 B MACQUARRIE 1999 539 D BOIS 2003 221 L FINN 1991 113 M FRIC 2008 1452 H NOGAI 2008 540 S CHIKER 2003 318 F GIANOTTI 2003 204 E BOUTH 1999 7201 A CORMA 1996 225 A JOHNSON 1999 1167 B BALLESTEROSX2009X83 BALLESTEROSX2009X83X92 BALLESTEROSX2009X83XR BALLESTEROSX2009X83X92XR item S1381-1169(09)00271-4 S1381116909002714 1-s2.0-S1381116909002714 10.1016/j.molcata.2009.05.023 271358 2010-09-21T22:47:17.508724-04:00 2009-09-01 1-s2.0-S1381116909002714-main.pdf https://s3.amazonaws.com/prod-ucs-content-store-us-east/content/pii:S1381116909002714/MAIN/application/pdf/0c6f2eb0106bef25907a28a5fc6333da/main.pdf https://s3-eu-west-1.amazonaws.com/prod-ucs-content-store-eu-west/content/pii:S1381116909002714/MAIN/application/pdf/0c6f2eb0106bef25907a28a5fc6333da/main.pdf main.pdf pdf true 1339456 MAIN 10 1-s2.0-S1381116909002714-main_1.png https://s3-eu-west-1.amazonaws.com/prod-ucs-content-store-eu-west/content/pii:S1381116909002714/PREVIEW/image/png/4479ea2a8ed152a8ec66fbb408e9a2ea/main_1.png https://s3.amazonaws.com/prod-ucs-content-store-us-east/content/pii:S1381116909002714/PREVIEW/image/png/4479ea2a8ed152a8ec66fbb408e9a2ea/main_1.png main_1.png png 90291 849 656 IMAGE-WEB-PDF 1 1-s2.0-S1381116909002714-sc1.jpg https://s3.amazonaws.com/prod-ucs-content-store-us-east/content/pii:S1381116909002714/sc1/DOWNSAMPLED/image/jpeg/6f326b2bd9f7456238090ddd00dba2a2/sc1.jpg https://s3-eu-west-1.amazonaws.com/prod-ucs-content-store-eu-west/content/pii:S1381116909002714/sc1/DOWNSAMPLED/image/jpeg/6f326b2bd9f7456238090ddd00dba2a2/sc1.jpg sc1 sc1.jpg jpg 31616 357 636 IMAGE-DOWNSAMPLED 1-s2.0-S1381116909002714-sc1.sml https://s3.amazonaws.com/prod-ucs-content-store-us-east/content/pii:S1381116909002714/sc1/THUMBNAIL/image/gif/7add8714e656614f26424c49ae99545e/sc1.sml https://s3-eu-west-1.amazonaws.com/prod-ucs-content-store-eu-west/content/pii:S1381116909002714/sc1/THUMBNAIL/image/gif/7add8714e656614f26424c49ae99545e/sc1.sml sc1 sc1.sml sml 2782 123 219 IMAGE-THUMBNAIL 1-s2.0-S1381116909002714-gr1.jpg https://s3.amazonaws.com/prod-ucs-content-store-us-east/content/pii:S1381116909002714/gr1/DOWNSAMPLED/image/jpeg/589f6987162808175f9fe7bc10eaa982/gr1.jpg https://s3-eu-west-1.amazonaws.com/prod-ucs-content-store-eu-west/content/pii:S1381116909002714/gr1/DOWNSAMPLED/image/jpeg/589f6987162808175f9fe7bc10eaa982/gr1.jpg gr1 gr1.jpg jpg 9283 215 320 IMAGE-DOWNSAMPLED 1-s2.0-S1381116909002714-gr1.sml https://s3.amazonaws.com/prod-ucs-content-store-us-east/content/pii:S1381116909002714/gr1/THUMBNAIL/image/gif/f966b66b9e0c21a940f1c4e678666be7/gr1.sml https://s3-eu-west-1.amazonaws.com/prod-ucs-content-store-eu-west/content/pii:S1381116909002714/gr1/THUMBNAIL/image/gif/f966b66b9e0c21a940f1c4e678666be7/gr1.sml gr1 gr1.sml sml 2102 147 219 IMAGE-THUMBNAIL 1-s2.0-S1381116909002714-gr2.jpg https://s3.amazonaws.com/prod-ucs-content-store-us-east/content/pii:S1381116909002714/gr2/DOWNSAMPLED/image/jpeg/9088a8a1338e53a785758e2d6783997c/gr2.jpg https://s3-eu-west-1.amazonaws.com/prod-ucs-content-store-eu-west/content/pii:S1381116909002714/gr2/DOWNSAMPLED/image/jpeg/9088a8a1338e53a785758e2d6783997c/gr2.jpg gr2 gr2.jpg jpg 33075 534 368 IMAGE-DOWNSAMPLED 1-s2.0-S1381116909002714-gr2.sml https://s3.amazonaws.com/prod-ucs-content-store-us-east/content/pii:S1381116909002714/gr2/THUMBNAIL/image/gif/d386a9f016a168f2043d5cb5cd04e127/gr2.sml https://s3-eu-west-1.amazonaws.com/prod-ucs-content-store-eu-west/content/pii:S1381116909002714/gr2/THUMBNAIL/image/gif/d386a9f016a168f2043d5cb5cd04e127/gr2.sml gr2 gr2.sml sml 2401 164 113 IMAGE-THUMBNAIL 1-s2.0-S1381116909002714-gr3.jpg https://s3.amazonaws.com/prod-ucs-content-store-us-east/content/pii:S1381116909002714/gr3/DOWNSAMPLED/image/jpeg/f89131083af53c80f6e9dd46ac727c01/gr3.jpg https://s3-eu-west-1.amazonaws.com/prod-ucs-content-store-eu-west/content/pii:S1381116909002714/gr3/DOWNSAMPLED/image/jpeg/f89131083af53c80f6e9dd46ac727c01/gr3.jpg gr3 gr3.jpg jpg 118121 456 606 IMAGE-DOWNSAMPLED 1-s2.0-S1381116909002714-gr3.sml https://s3.amazonaws.com/prod-ucs-content-store-us-east/content/pii:S1381116909002714/gr3/THUMBNAIL/image/gif/e99bda2a04af255901e6d1455b6ca563/gr3.sml https://s3-eu-west-1.amazonaws.com/prod-ucs-content-store-eu-west/content/pii:S1381116909002714/gr3/THUMBNAIL/image/gif/e99bda2a04af255901e6d1455b6ca563/gr3.sml gr3 gr3.sml sml 11530 164 218 IMAGE-THUMBNAIL 1-s2.0-S1381116909002714-gr4.jpg https://s3.amazonaws.com/prod-ucs-content-store-us-east/content/pii:S1381116909002714/gr4/DOWNSAMPLED/image/jpeg/d4e642b325a3bc54d885153c5f276c7c/gr4.jpg https://s3-eu-west-1.amazonaws.com/prod-ucs-content-store-eu-west/content/pii:S1381116909002714/gr4/DOWNSAMPLED/image/jpeg/d4e642b325a3bc54d885153c5f276c7c/gr4.jpg gr4 gr4.jpg jpg 26192 272 381 IMAGE-DOWNSAMPLED 1-s2.0-S1381116909002714-gr4.sml https://s3.amazonaws.com/prod-ucs-content-store-us-east/content/pii:S1381116909002714/gr4/THUMBNAIL/image/gif/13a1eb80f085fca16dc87e05a4e3c8d1/gr4.sml https://s3-eu-west-1.amazonaws.com/prod-ucs-content-store-eu-west/content/pii:S1381116909002714/gr4/THUMBNAIL/image/gif/13a1eb80f085fca16dc87e05a4e3c8d1/gr4.sml gr4 gr4.sml sml 5941 156 219 IMAGE-THUMBNAIL 1-s2.0-S1381116909002714-gr5.jpg https://s3.amazonaws.com/prod-ucs-content-store-us-east/content/pii:S1381116909002714/gr5/DOWNSAMPLED/image/jpeg/a82f166ad9f68375715e529d6b76e9ff/gr5.jpg https://s3-eu-west-1.amazonaws.com/prod-ucs-content-store-eu-west/content/pii:S1381116909002714/gr5/DOWNSAMPLED/image/jpeg/a82f166ad9f68375715e529d6b76e9ff/gr5.jpg gr5 gr5.jpg jpg 11627 229 321 IMAGE-DOWNSAMPLED 1-s2.0-S1381116909002714-gr5.sml https://s3.amazonaws.com/prod-ucs-content-store-us-east/content/pii:S1381116909002714/gr5/THUMBNAIL/image/gif/eb50a0b41eca4b78dc3d11d163c486d4/gr5.sml https://s3-eu-west-1.amazonaws.com/prod-ucs-content-store-eu-west/content/pii:S1381116909002714/gr5/THUMBNAIL/image/gif/eb50a0b41eca4b78dc3d11d163c486d4/gr5.sml gr5 gr5.sml sml 2647 156 219 IMAGE-THUMBNAIL 1-s2.0-S1381116909002714-gr6.jpg https://s3.amazonaws.com/prod-ucs-content-store-us-east/content/pii:S1381116909002714/gr6/DOWNSAMPLED/image/jpeg/d9a7bc11c30084db52c242e0c1ca3ba0/gr6.jpg https://s3-eu-west-1.amazonaws.com/prod-ucs-content-store-eu-west/content/pii:S1381116909002714/gr6/DOWNSAMPLED/image/jpeg/d9a7bc11c30084db52c242e0c1ca3ba0/gr6.jpg gr6 gr6.jpg jpg 14290 357 322 IMAGE-DOWNSAMPLED 1-s2.0-S1381116909002714-gr6.sml https://s3.amazonaws.com/prod-ucs-content-store-us-east/content/pii:S1381116909002714/gr6/THUMBNAIL/image/gif/5e316d514f3d172ddddb16186c863bfd/gr6.sml https://s3-eu-west-1.amazonaws.com/prod-ucs-content-store-eu-west/content/pii:S1381116909002714/gr6/THUMBNAIL/image/gif/5e316d514f3d172ddddb16186c863bfd/gr6.sml gr6 gr6.sml sml 2166 164 148 IMAGE-THUMBNAIL 1-s2.0-S1381116909002714-gr7.jpg https://s3.amazonaws.com/prod-ucs-content-store-us-east/content/pii:S1381116909002714/gr7/DOWNSAMPLED/image/jpeg/5c59e62bb8989e40fd9cc266d27eceec/gr7.jpg https://s3-eu-west-1.amazonaws.com/prod-ucs-content-store-eu-west/content/pii:S1381116909002714/gr7/DOWNSAMPLED/image/jpeg/5c59e62bb8989e40fd9cc266d27eceec/gr7.jpg gr7 gr7.jpg jpg 21002 234 382 IMAGE-DOWNSAMPLED 1-s2.0-S1381116909002714-gr7.sml https://s3.amazonaws.com/prod-ucs-content-store-us-east/content/pii:S1381116909002714/gr7/THUMBNAIL/image/gif/8b822fefec871042dcb1c3f80049a318/gr7.sml https://s3-eu-west-1.amazonaws.com/prod-ucs-content-store-eu-west/content/pii:S1381116909002714/gr7/THUMBNAIL/image/gif/8b822fefec871042dcb1c3f80049a318/gr7.sml gr7 gr7.sml sml 4332 134 219 IMAGE-THUMBNAIL 1-s2.0-S1381116909002714-gr8.jpg https://s3.amazonaws.com/prod-ucs-content-store-us-east/content/pii:S1381116909002714/gr8/DOWNSAMPLED/image/jpeg/4a272f92b729892fba3f55ee6eba987d/gr8.jpg https://s3-eu-west-1.amazonaws.com/prod-ucs-content-store-eu-west/content/pii:S1381116909002714/gr8/DOWNSAMPLED/image/jpeg/4a272f92b729892fba3f55ee6eba987d/gr8.jpg gr8 gr8.jpg jpg 10454 271 378 IMAGE-DOWNSAMPLED 1-s2.0-S1381116909002714-gr8.sml https://s3.amazonaws.com/prod-ucs-content-store-us-east/content/pii:S1381116909002714/gr8/THUMBNAIL/image/gif/e83a7a47b0228bb53158f11d22cf7586/gr8.sml https://s3-eu-west-1.amazonaws.com/prod-ucs-content-store-eu-west/content/pii:S1381116909002714/gr8/THUMBNAIL/image/gif/e83a7a47b0228bb53158f11d22cf7586/gr8.sml gr8 gr8.sml sml 2138 157 219 IMAGE-THUMBNAIL 1-s2.0-S1381116909002714-gr9.jpg https://s3.amazonaws.com/prod-ucs-content-store-us-east/content/pii:S1381116909002714/gr9/DOWNSAMPLED/image/jpeg/9867463d2aea4885940f4229f99477d9/gr9.jpg https://s3-eu-west-1.amazonaws.com/prod-ucs-content-store-eu-west/content/pii:S1381116909002714/gr9/DOWNSAMPLED/image/jpeg/9867463d2aea4885940f4229f99477d9/gr9.jpg gr9 gr9.jpg jpg 15957 283 371 IMAGE-DOWNSAMPLED 1-s2.0-S1381116909002714-gr9.sml https://s3.amazonaws.com/prod-ucs-content-store-us-east/content/pii:S1381116909002714/gr9/THUMBNAIL/image/gif/a4eb5c980ef3127c2197e494ac037a6c/gr9.sml https://s3-eu-west-1.amazonaws.com/prod-ucs-content-store-eu-west/content/pii:S1381116909002714/gr9/THUMBNAIL/image/gif/a4eb5c980ef3127c2197e494ac037a6c/gr9.sml gr9 gr9.sml sml 2821 164 215 IMAGE-THUMBNAIL 1-s2.0-S1381116909002714-gr10.jpg https://s3.amazonaws.com/prod-ucs-content-store-us-east/content/pii:S1381116909002714/gr10/DOWNSAMPLED/image/jpeg/b50d11dfb537b7079bcb4a9e2d4a6d4e/gr10.jpg https://s3-eu-west-1.amazonaws.com/prod-ucs-content-store-eu-west/content/pii:S1381116909002714/gr10/DOWNSAMPLED/image/jpeg/b50d11dfb537b7079bcb4a9e2d4a6d4e/gr10.jpg gr10 gr10.jpg jpg 19211 253 379 IMAGE-DOWNSAMPLED 1-s2.0-S1381116909002714-gr10.sml https://s3.amazonaws.com/prod-ucs-content-store-us-east/content/pii:S1381116909002714/gr10/THUMBNAIL/image/gif/ce40d3146a9f4ce0c7b3ba42c6b73796/gr10.sml https://s3-eu-west-1.amazonaws.com/prod-ucs-content-store-eu-west/content/pii:S1381116909002714/gr10/THUMBNAIL/image/gif/ce40d3146a9f4ce0c7b3ba42c6b73796/gr10.sml gr10 gr10.sml sml 4281 146 219 IMAGE-THUMBNAIL 1-s2.0-S1381116909002714-gr11.jpg https://s3.amazonaws.com/prod-ucs-content-store-us-east/content/pii:S1381116909002714/gr11/DOWNSAMPLED/image/jpeg/1146652899b08271668a6de4ea630ec3/gr11.jpg https://s3-eu-west-1.amazonaws.com/prod-ucs-content-store-eu-west/content/pii:S1381116909002714/gr11/DOWNSAMPLED/image/jpeg/1146652899b08271668a6de4ea630ec3/gr11.jpg gr11 gr11.jpg jpg 16283 280 382 IMAGE-DOWNSAMPLED 1-s2.0-S1381116909002714-gr11.sml https://s3.amazonaws.com/prod-ucs-content-store-us-east/content/pii:S1381116909002714/gr11/THUMBNAIL/image/gif/b90d83e191e86c4171e4d5c99b684ea7/gr11.sml https://s3-eu-west-1.amazonaws.com/prod-ucs-content-store-eu-west/content/pii:S1381116909002714/gr11/THUMBNAIL/image/gif/b90d83e191e86c4171e4d5c99b684ea7/gr11.sml gr11 gr11.sml sml 2836 160 219 IMAGE-THUMBNAIL 1-s2.0-S1381116909002714-gr12.jpg https://s3.amazonaws.com/prod-ucs-content-store-us-east/content/pii:S1381116909002714/gr12/DOWNSAMPLED/image/jpeg/802fe6aabf3c02f2dc8fecc84042d7ec/gr12.jpg https://s3-eu-west-1.amazonaws.com/prod-ucs-content-store-eu-west/content/pii:S1381116909002714/gr12/DOWNSAMPLED/image/jpeg/802fe6aabf3c02f2dc8fecc84042d7ec/gr12.jpg gr12 gr12.jpg jpg 33807 423 548 IMAGE-DOWNSAMPLED 1-s2.0-S1381116909002714-gr12.sml https://s3.amazonaws.com/prod-ucs-content-store-us-east/content/pii:S1381116909002714/gr12/THUMBNAIL/image/gif/55c90ea5108796156597fc7de1243ac0/gr12.sml https://s3-eu-west-1.amazonaws.com/prod-ucs-content-store-eu-west/content/pii:S1381116909002714/gr12/THUMBNAIL/image/gif/55c90ea5108796156597fc7de1243ac0/gr12.sml gr12 gr12.sml sml 3899 164 212 IMAGE-THUMBNAIL 1-s2.0-S1381116909002714-fx3.jpg https://s3.amazonaws.com/prod-ucs-content-store-us-east/content/pii:S1381116909002714/fx3/DOWNSAMPLED/image/jpeg/b216fb11fff186bb317c1cf07f2dabfe/fx3.jpg https://s3-eu-west-1.amazonaws.com/prod-ucs-content-store-eu-west/content/pii:S1381116909002714/fx3/DOWNSAMPLED/image/jpeg/b216fb11fff186bb317c1cf07f2dabfe/fx3.jpg fx3 fx3.jpg jpg 9351 72 458 IMAGE-DOWNSAMPLED 1-s2.0-S1381116909002714-fx3.sml https://s3.amazonaws.com/prod-ucs-content-store-us-east/content/pii:S1381116909002714/fx3/THUMBNAIL/image/gif/4eaa2e6098ef78b603385a49c2239e1f/fx3.sml https://s3-eu-west-1.amazonaws.com/prod-ucs-content-store-eu-west/content/pii:S1381116909002714/fx3/THUMBNAIL/image/gif/4eaa2e6098ef78b603385a49c2239e1f/fx3.sml fx3 fx3.sml sml 1315 35 219 IMAGE-THUMBNAIL 1-s2.0-S1381116909002714-fx2.gif https://s3.amazonaws.com/prod-ucs-content-store-us-east/content/pii:S1381116909002714/fx2/DOWNSAMPLED/image/gif/ac8fe72825ede549c3a06abe29a5f468/fx2.gif https://s3-eu-west-1.amazonaws.com/prod-ucs-content-store-eu-west/content/pii:S1381116909002714/fx2/DOWNSAMPLED/image/gif/ac8fe72825ede549c3a06abe29a5f468/fx2.gif fx2 fx2.gif gif 5376 268 364 IMAGE-DOWNSAMPLED 1-s2.0-S1381116909002714-fx2.sml https://s3.amazonaws.com/prod-ucs-content-store-us-east/content/pii:S1381116909002714/fx2/THUMBNAIL/image/gif/2b8ac81124d30b1a1ad8a5b8c39954c0/fx2.sml https://s3-eu-west-1.amazonaws.com/prod-ucs-content-store-eu-west/content/pii:S1381116909002714/fx2/THUMBNAIL/image/gif/2b8ac81124d30b1a1ad8a5b8c39954c0/fx2.sml fx2 fx2.sml sml 2821 161 219 IMAGE-THUMBNAIL 1-s2.0-S1381116909002714-fx1.jpg https://s3.amazonaws.com/prod-ucs-content-store-us-east/content/pii:S1381116909002714/fx1/DOWNSAMPLED/image/jpeg/4c4ade7ac9374e9b54af03d994a496df/fx1.jpg https://s3-eu-west-1.amazonaws.com/prod-ucs-content-store-eu-west/content/pii:S1381116909002714/fx1/DOWNSAMPLED/image/jpeg/4c4ade7ac9374e9b54af03d994a496df/fx1.jpg fx1 true fx1.jpg jpg 25645 179 233 IMAGE-DOWNSAMPLED 1-s2.0-S1381116909002714-fx1.sml https://s3.amazonaws.com/prod-ucs-content-store-us-east/content/pii:S1381116909002714/fx1/THUMBNAIL/image/gif/e4b10aed8ebb9f2814396a9514f68dc2/fx1.sml https://s3-eu-west-1.amazonaws.com/prod-ucs-content-store-eu-west/content/pii:S1381116909002714/fx1/THUMBNAIL/image/gif/e4b10aed8ebb9f2814396a9514f68dc2/fx1.sml fx1 true fx1.sml sml 4440 164 213 IMAGE-THUMBNAIL MOLCAA 7561 S1381-1169(09)00271-4 10.1016/j.molcata.2009.05.023 Elsevier B.V. Scheme 1 Fig. 1 Powder X-ray diffraction patterns of (a) MCM-41, (b) Ti-CyPTS-HMDS-MCM-41 and (c) TiMent-CyPTS-MTMS-MCM-41. Fig. 2 Nitrogen adsorption–desorption isotherms profiles and pore size distribution of (●) MCM-41, (■) Ti-CyPTS-HMDS-MCM-41 and (◀) TiMent-CyPTS-HMDS-MCM-41. Fig. 3 TEM image of (a) Ti-CyPTS-HMDS-MCM-41, (b) TiMent-CyPTS-HMDS-MCM-41 and (c) Ti(l-DET)-CyPTS-HMDS-MCM-41. The staff rule represented 20nm, for (a), (b) and 50nm for (c), respectively. Fig. 4 FT-IR spectra of (a) MCM-41, (b) Ti-CyPTS-HMDS-MCM-41 and (c) TiMent-CyPTS-MTMS-MCM-41. Fig. 5 29Si MAS NMR results of (a) MCM-41, (b) Ti-CyPTS-HMDS-MCM-41 and (c) TiMent-CyPTS-HMDS-MCM-41. Fig. 6 13C NMR of (a) TiMent-CyPTS-HMDS-MCM-41 and (b) Ti-CyPTS-HMDS-MCM-41. Fig. 7 Thermogravimetric curves for (a) Ti-CyPTS-HMDS-MCM-41 and (b) TiMent-CyPTS-HMDS-MCM-41. Fig. 8 13C NMR of Ti-CyPTS-HMDS-MCM-41 after reaction with l-DET. Fig. 9 FT-IR spectra of (a) Ti-CyPTS-HMDS-MCM-41 and (b) Ti-CyPTS-HMDS-MCM-41+ l-(+)-DET in the CO-stretching region. Fig. 10 Thermogravimetric curve for Ti-CyPTS-HMDS-MCM-41 after reaction with l-DET. Fig. 11 Solid state diffuse reflectance UV–vis spectra of (a) Ti-CyPTS-HMDS-MCM-41, (b) Ti(l-DET)-CyPTS-HMDS-MCM-41 and (c) TiMent-CyPTS-HMDS-MCM-41. Fig. 12 Proposed structure for titanium complex immobilized onto the silylated MCM-41surface. Table 1 Ligand and titanium loading of MCM-41 functionalized material. Catalyst %C a %N a CyPTS/mmolg−1 Ti b /mmolg−1 Ti-CyPTS-HMDS-MCM-41 14.94 3.37 0.80 0.79 TiMent-CyPTS-HMDS-MCM-41 26.70 3.33 0.80 0.70 Molar surface loading of CyPTS=mmolg−1 N/3. a From elemental analysis. b From ICP-AES. Table 2 Textural properties of the mesoporous MCM-41 materials. Catalyst S bet (m2 g−1) Pore volume (cm3g−1) Pore diameter (Å) d 100 (Å) a 0 (Å) Wall thickness (Å) MCM-41 993 0.71 28.5 35.5 41.0 12.5 Ti-CyPTS-HMDS-MCM-41 508 0.28 18.5 34.4 39.8 21.3 TiMent-CyPTS-HMDS-MCM-41 246 0.12 14.1 33.6 38.7 24.6 Table 3 Asymmetric epoxidation of cinnamyl alcohol with Ti-CyPTS-HMDS-MCM-41 and TiMent-CyPTS-HMDS-MCM-41. . Catalyst Chiral auxiliar Molar ratio Ti/ButOOH/substrate/chiral auxiliar Reaction time (h) ee (%) Configuration Yield (%) 1. [{Ti(OiPr)2(OMent)}2] – 1/40/20/0 12 17 2R,3R 60 2. [{Ti(OiPr)3}3 C3N3O3] l-DET 1/40/20/1.35 12 78.4 2S,3S 58 3. Ti-CyPTS-HMDS-MCM-41 l-DET 1/40/20/1.35 12 70.6 2S,3S 9 4. Ti-CyPTS-HMDS-MCM-41 l-DET 1/40/20/1.35 36 76 2S,3S 10 5. Ti-CyPTS-HMDS-MCM-41 l-DET 1/40/20/1.35 48 65 2S,3S 21 6. Ti-CyPTS-HMDS-MCM-41 l-DET 1/40/20/1.35 60 68 2S,3S 50 7. Ti-CyPTS-HMDS-MCM-41 l-DET 1/20/10/1.35 12 81 2S,3S 24 8. TiMent-CyPTS-HMDS-MCM-41 – 1/40/20/0 12 3 2S,3S 59 9. Ti-CyPTS-HMDS-MCM-41 1R,2S,5R-(−)-menthol 1/40/20/1.35 36 6.2 2S,3S 19 10. First recycle experiment Ti-CyPTS-HMDS-MCM-41 l-DET 1/40/20/1.35 36 77 2S,3S 14 Synthesis of titanium–triazine based MCM-41 hybrid materials as catalyst for the asymmetric epoxidation of cinammyl alcohol Ruth Ballesteros Mariano Fajardo Isabel Sierra ⁎ Isabel del Hierro ⁎ Departamento de Química Inorgánica y Analítica, E.S.C.E.T., Universidad Rey Juan Carlos, C/Tulipan S/N, 28933, Móstoles, Madrid, Spain ⁎ Corresponding author. Tel.: +34 914887022; fax: +34 914888143. Graphical abstract A molecular precursor approach involving tethering procedures was used to produce site isolated titanium-supported asymmetric epoxidation catalysts. This was done by first modifying the support in one step with a mixture of silanes: the synthesized triazine propyl triethoxysilane as functional linker and hexamethyldisilizane as capped agent, to increase the hydrophobicity of the support and mask the remaining silanol groups. In addition, [Ti(OPri)4] and [{Ti(OPri)3(OMent)}2] (MentO=1R,2S,5R-(−)-menthoxo) complexes were heterogenized by reaction with the modified MCM-41. Finally, after [Ti(OPri)4] immobilization on to the organomodified support the reaction with the chiral auxiliar (+)-diethyl-l-tartrate was accomplished. The different systems were tested in the asymmetric epoxidation of cinnamyl alcohol in order to evaluate their catalytic activity and enantioselectivity. A molecular precursor approach involving tethering procedures was used to produce site isolated titanium-supported asymmetric epoxidation catalysts. This was done by first modifying the support in one step with a mixture of silanes: the synthesized triazine propyl triethoxysilane as functional linker and hexamethyldisilizane as capped agent, to increase the hydrophobicity of the support and mask the remaining silanol groups. In addition, [Ti(OPri)4] and [{Ti(OPri)3(OMent)}2] (MentO=1R,2S,5R-(−)-menthoxo) complexes were heterogenized by reaction with the modified MCM-41. Finally, after [Ti(OPri)4] immobilization on to the organomodified support the reaction with the chiral auxiliary (+)-diethyl-l-tartrate was accomplished. All the materials were characterized by elemental analysis, X-ray diffraction, nitrogen adsorption techniques, FT-IR, ICP-MS, DR-UV–vis, 29Si and 13C MAS NMR and TGA. The different systems were tested in the asymmetric epoxidation of cinnamyl alcohol in order to evaluate their catalytic activity and enantioselectivity. Keywords Mesoporous Titanium Asymmetric epoxidation 1 Introduction Over the last decades, numerous catalytic reactions allowing the formation of enantiomerically pure compounds have been discovered. A family of homogeneous organometallic catalysts using, surprisingly, a small number of ligands, named “privileged structures” [1] show applicability over a wide range of different enantioselective reactions, even on an industrial scale [2]. However, the contribution of asymmetric catalysis to the overall production of chiral chemicals is still low, basically due to the difficulty of recovering the relatively expensive chiral catalyst from the bulk of the reaction. In order to overcome this problem, a great deal of work has been developed to prepare effective heterogeneous catalyst [3,4]. By far, the most widely studied systems are those prepared by immobilization of homogeneous chiral catalyst onto solid supports; by covalent bonding, adsorption, encapsulation, entrapment [5–7], etc. and lately, by sol–gel hydrolysis condensation of silylated chiral ligands or silylated chiral complexes [8,9]. The support must be thermally, chemically, and mechanically stable during the reaction process and its structure must make possible the good dispersion of the active sites, which must be also easily accessible. Organic–inorganic hybrid materials meet these criteria by exploiting the physical robustness of porous inorganic materials and the chemical functionality of organic materials. Among them, mesoporous type materials grow in importance as a result of their regular structures and tuneable pore diameters. In addition, increased activity and selectivity can also be observed upon immobilization in a confined space, due to the confinement effect originated from the weak interactions between catalyst/substrate and pore surfaces. Therefore, the enantioselectivity can be improved by careful tuning the confinement effect based on the molecular designing of the pore/surface and the immobilized catalysts according to the requirements of chiral reactions [10]. Sharpless asymmetric epoxidation of allylic alcohols has become a highlight classic in asymmetric catalysis. In this process, well understood by now, the chiral ligand plays a critical role in the enantioselectivity. The catalytically active species is titanium dimer, containing two dialkyl tartrate ligands and both the oxidant and the allylic alcohol coordinated. Nevertheless, there are few reports on the assemblies of chiral titanium complexes over solid supports in order to achieve the heterogenization of these catalyst components. Nearly two decades ago, Choudary et al. [11] carried out the immobilization of a heterogeneous chiral titanium catalyst on an inorganic support, a combination of dialkyl tartrate and titanium-pillared montmorillonite resulted in excellent ee in the epoxidation reaction of several allylic alcohols ranging from 90% to 98%. Johnson and co-workers [12] published a variety of Ti (IV) complexes, as molecular models of heterogeneous silica based systems, in which the titanium was coordinated to only one or two siloxides of a partially silylated silsesquioxane backbone in order to modify the degree of steric congestion around the titanium (IV) active site. These new complexes were performed in their chiral version by reaction with BINOL but they resulted inactive epoxidation catalysts. Basset and co-workers [13] reported silica-supported tantalum catalysts for the enantioselective epoxidation of allylic alcohols in the presence of chiral tartrate derivatives with comparable results to that obtained in the homogeneous Sharpless reaction, however, the tantalum precursors were not easy to prepare. Some years later, Fu et al. [14] reported the grafting of titanium tartrate complexes onto HMS by reaction of TiL4 (L=OPri, Cl) and d-tartaric acid with the surface OH groups. Recently, our group has reported the grafting of [{Ti(OPrï)3(OMent)}2] and [Ti(OMent)4] to prepared SBA-15 based catalyst rendering medium yields and low ee. Interestingly, the chiral induction obtained was the contrary to those of the analogous homogeneous systems and similar to that prompted by the silsesquioxane complex modelling the heterogeneous systems [15]. A different strategy was followed by Li and co-workers, who grafted a chiral tartaric acid onto the surface of silica and in the mesoporous of MCM-41 providing and effective heterogeneous catalyst for asymmetric epoxidation of allylic alcohols by further reaction with Ti(OPri)4 [16]. The main objective in this study is to obtain well-defined organotitanium compounds tethered onto capped MCM-41 capable of acting as active catalyst in the Sharpless epoxidation process, in the presence of a chiral auxiliar or, in a parallel way, the synthesis of well-defined tethered organotitanium compounds in which the chiral moiety is kept bonded to titanium. 2 Experimental procedure 2.1 General remarks All reactions were performed using standard Schlenk tube techniques under an atmosphere of dry nitrogen or argon. 2.2 Reagents and materials Sulphuric acid 98% (M =98.08, d =1.840gmL−1) was purchased from Panreac. Sodium silicate SiO2·NaOH (M =242.23, d =1.390gmL−1), cetyltrimethylammonium bromide (CTAB) (M =364.46), hexamethyldisilazane (HMDS) and 1R,2S,5R-(−)-menthol were purchased from Sigma–Aldrich and used as supplied. Titanium tetraisopropoxide Ti(OPri)4 (0.955gmL−1, 97%) was purchased from Sigma–Aldrich distilled and stored under an argon atmosphere prior to use. Cinnamyl alcohol, (+)-diethyl-l-tartrate (l-DET) and tertbutylhydroperoxide (TBHP) (5–6M decane) were purchased from Sigma–Aldrich and stored in presence of molecular sieves. Organic solvents (toluene and dichloromethane) were purchased from SDS, distilled and dried before use according to conventional literature methods. Triazine propyl triethoxysilane ligand (CyPTS) and the modified MCM-41 (CyPTS-HMDS-MCM-41) were prepared by previously reported procedure [17]. Synthesis and characterization of [{Ti(OiPr)3(OMent)}2] was also reported by our group [18]. 2.3 Synthesis of MCM-41 mesoporous silica A hexagonal (plane group p6mm) material (MCM-41) was prepared according to the method of Landau et al. [19] using hydrothermal crystallization. A sodium silicate solution (65.45g, 14% NaOH; 27% SiO2) was mixed with 4.20g of 98% sulphuric acid and 140mL of water. The mixture was stirred for 30min at room temperature. Cetyltrimethylammonium bromide (58.66g) dissolved in 176mL of water was added. The resulting gel was mixed with 70mL of water (stirred at room temperature for 30min). The gel was transferred to a Teflon-coated autoclave and heated at 121°C for 144h. A solid was produced, separated by suction filtration and dried at 100°C for 8h. The surfactant was removed by calcination in air at 530°C for 6h. 2.4 Preparation of titanium modified MCM-41-supported catalyst 2.4.1 Preparation of Ti-CyPTS-HMDS-MCM-41 and TiMent-CyPTS-HMDS-MCM-41 The titanium containing mesoporous materials were prepared by reaction of Ti(OPri)4 or [{Ti(OPri)3(OMent)}2] with the chemically modified MCM-41 silica (CyPTS-HMDS-MCM-41). In a typical experiment [{Ti(OiPr)3(OMent)}2] or Ti(OPri)4 (4mmol) was added to 4g of the organomodified silica suspended in dry toluene and stirred for 24h in order to obtain TiMent-CyPTS-HMDS-MCM-41 and Ti-CyPTS-HMDS-MCM-41 catalysts, respectively. The solid was filtered off, washed repeatedly with toluene and dried under vacuum in order to remove the volatiles. Ti-CyPTS-HMDS-MCM-41: 13C CP/MAS NMR δ =−6 (≡Si–O–Si( C H3)3), 9 (O–CH2–CH2– C H2–Si), 18 (Si(OCH2 C H3)), 21.5 (O–CH2– C H2–CH2–Si), 25 (Ti–O–CH( C H3)2), 40.5 (O– C H2–CH2–CH2–Si), 58 (Si(O C H2CH3)), 68 (Ti–O– C H(CH3)2), 150 (N– C –OH ( C 3N3)). TiMent-CyPTS-HMDS-MCM-41: 13C CP/MAS NMR δ =−2.5 (≡Si–O–Si( C H3)3), 11 (O–CH2–CH2– C H2–Si), 17 (Si(OCH2 C H3)), 21.5 (O–CH2– C H2–CH2–Si), 21.5 (Ti–O–CH( C H3)2), 40.5 (O– C H2–CH2–CH2–Si), 58 (Si(O C H2CH3)), 68 (Ti–O– C H(CH3)2), 146 (N– C –OH ( C 3N3)). Ti-menthoxo unit C1 84 C2 53.3 C3 21.5 (C9 +C7 +C3) C4 32.5 (C4 +C5) C5 32.5 (C4 +C5) C6 46.1 C7 21.5 (C9 +C7 +C3) C8 28 C9 21.5 (C9 +C7 +C3) C10 14 2.4.2 Reaction of Ti-CyPTS-HMDS-MCM-41 and L-(+)-DET In a typical experiment, (+)-diethyl-l-tartrate (0.22mL, 1.35mmol) was added to 1g of Ti-CyPTS-HMDS-MCM-41 previously suspended in dichloromethane. The mixture was stirring at room temperature during 24h. 13C CP/MAS NMR δ =−0.10 (Si–O–Si( C H3)3), 9 (O–CH2–CH2– C H2–Si), 18 (Si(OCH2 C H3)), 18 (CO–O–CH2 C H3)), 23 (O–CH2– C H2–CH2–Si), 23 (Ti–O–CH( C H3)2), 43 (O– C H2–CH2–CH2–Si), 59 (Si(O C H2CH3)), 59 (CO–O– C H2CH3)), 68 (Ti–O– C H(CH3)2), 85 (Ti–O– C –CO2CH2CH3), 149 (N– C –OH ( C 3N3)), 170.8 ( C O–O–CH2CH3). 2.5 Catalytic test A flame dried 250mL two-necked flask was fitted with a dropping funnel, flushed with nitrogen and charged with 1g of activated, powdered 4Å molecular sieves, 0.25g of the tested catalyst and 50mL of dry CH2Cl2. The mixture was cooled to −20°C and t-ButOOH in decane was added. The mixture was allowed to stir at −20°C for 1h and then treated with freshly distilled (E)-3-phenyl-2-propenol (cinnamyl alcohol) in CH2Cl2 (0.1M), added drop wise over 1h. The resulting mixture was stirred 12h to −20°C. The solid was recovered from the solution by filtration and washed several times with CH2Cl2. The volatiles were removed under vacuum to get yellow oil. lH NMR (400MHz, CDCl3, 25°C): δ =2.15 (brs, 1 H, –OH), 3.22–3.25 (m, 1 H, –CH–CH2), 3.81 (dd, 1 H, –CH2), 3.94 (d, 1 H, Ph–CH), 4.06 (dd, 1 H, –CH2), 7.2–7.4 (m, 5 H, C6H5). The yields and enantiomeric excess values of the so obtained epoxy alcohols were determined by HPLC with a chiralpak AD-H column from VWR International Eurolab [20]. In order to reuse the catalyst the solid was then washed with dichloromethane, in order to remove any organic species remaining adsorbed, dried and tested again under similar experimental conditions. 2.6 Characterization X-ray diffraction (XRD) patterns of the silicas were obtained on a Phillips Diffractometer model PW3040/00 X’Pert MPD/MRD at 45kV and 40mA, using Cu Kα radiation (λ =1.5418Å). N2 gas adsorption–desorption isotherms were obtained using a Micromeritics TriStar 3000 analyzer, and pore size distributions were calculated using the Barret–Joyner–Halenda (BJH) model on the adsorption branch. Infrared spectra were recorded on a Nicolet-550 FT-IR spectrophotometer in the region 4000–400cm−1) as KBr disks. 1H NMR spectra were recorded on Varian FT-300 and Varian FT-400 spectrometers and chemical shifts were measured relative to residual 1H and 13C resonances in the deuterated solvents Proton-decoupled 29Si MAS NMR spectra were recorded on a Varian-Infinity Plus 400MHz Spectrometer operating at 79.44MHz proton frequency (4μs 90° pulse, 1024 transients, spinning speed of 5MHz). Cross Polarization 13C CP/MAS NMR spectra were recorded on a Varian-Infinity Plus 400MHz Spectrometer operating at 100.52MHz proton frequency (4μs 90° pulse, 4000 transients, spinning speed of 6MHz, contact time 3ms, pulse delay 1.5s). Elemental analysis (%C and %N) was performed by the Investigation Service of the Universidad de Alcalá de Henares de Madrid (Spain) using a CHNS analyser LECO-932 model. The thermal stabilities of the modified mesoporous silicas were studied using a Setsys 18 A (Setaram) thermogravimetric analyzer. The DR UV–vis spectroscopic measurements were carried out on a Varian Cary-500 spectrophotometer equipped with an integrating sphere and PTFE (Polytetrafluoroethylene) as reference, with d =1g/cm3 and thickness of 6mm. The titanium content was determined by ICP-atomic emission spectroscopy (ICP-AES) using a Varian Vista AX model. The samples (0.1g) were dissolved in aqueous hydrofluoric and sulphuric acid. After dissolution, the sample was heated to evaporated water and hydrofluoric acid and the sample was transferred into 250mL calibrated flask and diluted with water. An absorption standard solution of Ti (1000μg/mL in water) was used for the calibration of the equipment. HPLC analyses were performed on a Varian chromatographic system containing a 210/215 ProStar pump, a manual injection valve Rheodyne model 7752i equipped with a 20μl sample loop, a 320 ProStar UV-vis detector and a personal computer-based data acquisition system Star Chromatography Workstation version 5. The chromatographic separations were performed, using a chiralpak AD [amylase tris(3,5-dimethylphenylcarbamate) coated on silicagel, 250mm×4.6mm i.i.; 10μm particle diameter] column (Chiral technologies Europe, Illkirch, France) at ambient temperature. 3 Results and discussion 3.1 Synthesis and characterization of heterogeneous catalysts One of the challenges that offer the widespread used titanium alkoxo complexes is the difference between the structures in solid state and in solution, where mixtures of monomers, dimers and so on, may coexist due to association equilibrium. Such structural richness ensures flexibility and efficiency of this type of titanium catalysts but make difficult to transfer the information relative to the solid state structure of the catalyst to the solution where the majority of reactions takes place [21]. Here, we report the preparation of new heterogeneous catalysts by reaction of titanium alkoxo derivatives with the previously functionalized MCM-41 support with a mixture of silanes. Firstly, the triazine based ligand which acts as a polydentate alcohol providing a rigid framework for the metal centre and might serve to control the oligomeric nature of metal alkoxides [22]. Secondly, the disilazane reagent HN(SiMe3)2 (HMDS), which allows the conversion of the remaining hydroxyls on to the silica surface into trimethylsilyl groups (Me3Si–O–Si) increasing the hydrophobic character of the materials and avoiding the presence of the acid OH groups, incompatible with the catalytic reaction under study. In addition, the presence of two hydroxyl units in the triazine ligand brings up the possibility of coordination of at least two metal centres by attached ligand and may control the titanium loading on to the support [23]. To prepare the grafted titanium complexes, titanium tetraisopropoxide, Ti(OPri)4 or [{Ti(OPri)3(OMent)}2] (MentO=1R,2S,5R-(−)-menthoxo) were dissolved in toluene and added to a suspension of the functionalized mesoporous silica (Scheme 1 ). The reaction was maintained 24h under stirring; the solids were recovered by filtration and washed intensively with toluene. In this way, Ti-CyPTS-HMDS-MCM-41 and TiMent-CyPTS-HMDS-MCM-41 were obtained (Scheme 1). From elemental analysis the CyPTS ligand loading was found to be 0.80mmolg−1 for CyPTS-HMDS-MCM-41 on the basis of nitrogen content measurements (Table 1 ). The amount of capped ligand was estimated according to the carbon content and loading of CyPTS ligand, to be 2.72mmolg−1of HMDS. The amount of titanium determined by ICP-AES was 0.79 and 0.70mmolg−1 for Ti-CyPTS-HMDS-MCM-41 and TiMent-CyPTS-HMDS-MCM-41, respectively. Taking into account the ligand loading, the Ti/CyPTS ratio suggested the formation of complexes with 1:1 stoichoimetry. The observed titanium loading values for the grafted samples were comparable with other materials previously prepared by Tilley et al. by using [(OBut)2Ti{μ-O2Si(OSi(OBut)3]2})2] [24], [Ti{OSi(OBut)3}4], [(OPri)Ti{OSi(OBut)3}3] and [(OBut)3Ti{OSi(OBut)3}] [25] as precursors and by our own group by using [{Ti(OPri)3(OMent)}2] and [Ti(OMent)4] titanium alkoxo complexes bearing menthoxo units. To gain insight into the chemistry of the grafting process, solution 1H NMR spectroscopy was used to monitor the grafting chemistry of [{Ti(OPri)3(OMent)}2] onto the silica surface. The reaction of CyPTS-HMDS-MCM-41 with a solution of a large excess of [{Ti(OPri)3(OMent)}2] should result in the elimination of isopropanol or menthol. The elimination products were indeed identified to be both PriOH and MentOH with an integral ratio 3.5:1 after 48h reaction in toluene at 100°C. This result was in agreement with the formation of titanium complexes bearing preferently a chiral moiety. The mesostructures of complex immobilized materials were confirmed by X-ray diffraction and nitrogen adsorption–desorption techniques. Unmodified MCM-41 display a well-resolved pattern at low 2θ values with a very sharp (100) diffraction peak at 2.49 and three additional high order peaks (110), (200) and (220) with lower intensities indicating the well-developed mesopore structure, d-spacing value for this XRD peak was 35.48Å and a 0 was equal to 40.97Å. As can be seen in Fig. 1 a well-resolved pattern, with a significant peak, was obtained for the rest of samples indicating a good mesoscopic order. Compared to parent MCM-41 the titanium tethered triazine propyl samples show a decrease in the d-spacing and a significant attenuation of the XRD peak intensities. This latter is not interpreted as a loss of crystallinity. Instead, it is likely that there is a reduction in the X-ray scattering contrast between the silica framework and the metal–organic moieties which are located inside the channels of the host. The textural properties such as specific surface area (S BET, m2 g−1) and pore volume (cm3 g−1) of the support were followed throughout the different modification processes. For the parent MCM-41 system and functionalized materials the isotherms are type IV according to the IUPAC classification and have an H1 hysteresis loop that is representative of mesoporous cylindrical or rod-like pores (Fig. 2 ). The volume adsorbed for all isotherms increased sharply at a relative pressure (P/P 0) of 0.4, which represents capillary condensation of nitrogen within the uniform mesoporous structure. The inflection position shifted slightly to lower relative pressures and the volume of nitrogen adsorbed decrease upon silylation and titanium incorporation, which is indicative of a reduction in the pore size. The physical parameters of the nitrogen isotherms, such S BET, pore volume and BJH average pore diameter, for mesoporous silicas are shown in Table 2 . The MCM-41 material posses high S BET (993m2/g) and a BJH pore diameter of 28.5Å, these values are typical of surfactant-assembled mesostructures. The wall thickness for MCM-41 (12.47Å) was calculated as (2d 100/√3-BJH pore diameter). After silylation and titanium incorporation a decrease in the S BET, pore volume and average BJH pore diameter were observed, changes that can be interpreted as being due to the presence of organotitanium molecules anchored to the channels partially blocking the adsorption of nitrogen molecules. The average pore diameter clearly decreases after the incorporation of titanium isopropoxo species by reaction with the organofunctionalized mesoporous silica. In this way the sample TiMent-CyPTS-HMDS-MCM-41 with the more sterically demanding groups exhibits a higher decrease in the surface area and pore volume, as well as, an increase in the wall thickness. The narrow pore size distribution found for Ti-CyPTS-HMDS-MCM-41 and TiMent-CyPTS-HMDS-MCM-41 (centred at 15.7 and 9.2Å) provides evidence for its uniform framework mesoporosity and confirms the reduction of the pore sizes after the modification process. From the TEM micrographs (as shown in Fig. 3 ), we could find that the ordered pore structure was still preserved after modification treatment processes FT-IR spectra of pure MCM-41, Ti-CyPTS-HMDS-MCM-41 and TiMent-CyPTS-HMDS-MCM-41 between 4000 and 400cm−1 are reported in Fig. 4 . The main features of the MCM-41 spectra include a large broad band between 3400 and 3200cm−1, which is attributed to O–H stretching of the surface silanol groups and the remaining adsorbed water molecules. The siloxane (–Si–O–Si–) band appears as a broad strong peak centred at 1100cm−1. The band due to Si–O bond stretching of the silanol groups was observed at 960cm−1. The adsorption band at 1630cm−1 is due to deformation vibrations of adsorbed water molecules [26]. The Ti containing materials show characteristic bands for aliphatic C–H stretching vibrations due to Me3Si–O–Si, silane–triazine ligand, menthoxo and isopropoxo groups around 2900cm−1. Other prominent features of the IR spectra, for the samples with the triazine ligand, are the bands observed at 1475 and 1720cm−1 assigned to the aromatic ring and CN stretching vibration, respectively. The bands typical of menthoxo groups appear at 2964cm−1 (ν as(CH3)), 2923cm−1 (ν as(CH2)), 2883cm−1 (ν s(CH3)), 2851cm−1 (ν s(CH2)), 1420 and 1405cm−1 (δ a(CH2), δ a(CH3)), and 1366cm−1 δ s(CH3), the two last bands are characteristics of isopropyl groups. The absorption peak at 657 and 532cm−1 are assigned to Ti–O–C bonds. The 29Si MAS-NMR spectra in the solid state for parent MCM-41 and functionalized silicas confirm the covalent bond formed between the silylating agents CyPTS and HMDS and the silanol groups dispersed on the surface (see Fig. 5 ). Unmodified silica (Fig. 4a) shows two main peaks at −110 and −98ppm assigned to Q4 framework silica sites ((SiO)4 Si) and Q3 silanol sites ((SiO)3 SiOH), respectively. A weak resonance is also present at about −92ppm corresponding to the Q2 species ((SiO)2 Si(OH)2). Q4 is clearly the dominant peak in both spectra because it is the most abundant site. The spectra of the functionalized silica show a marked decrease in the intensity of the Q3 signal, which verified the tethering of the functional groups to Si–OH. T2 (RSi(OSi)2(OR’)) and T3 (RSi(OSi)3) organosilane species at −55 and −67ppm, respectively, present in the CyPTS functionalized materials are indicative of a high degree of condensation of the triethoxysilanes with the silica surface. In addition, the choice of HMDS as protecting group allows an easy determination of the trimethylsilyl groups by 29Si NMR; the new peak of the silylating agent, an M site ((Me3 SiO–), is seen at 12ppm. Titanium containing materials have been also characterized with 13C CP-MAS NMR (Fig. 6 ). For Ti-CyPTS-HMDS-MCM-41 the signals from the three carbon atoms present in the alkyl chain of the bound linker appears at 10, 21 and 40.5ppm for Si– C H2–, CH2– C H2–CH2– and – C H2–O, respectively. The aromatic carbons C 3N3 of triazine ring appears at 145ppm and two signals at 25 and 68ppm are attributed to methyl ( C H3)2–CH–O and methyne (CH3)2– C H–O groups of the isopropoxo ligands attached to titanium. In addition two additional signals at 18 and 58ppm attributed to the unreacted ethoxo groups attached to Si in the triazine silane ligand are observed. Finally, at −6ppm appears a signal due to the trimethylsilyl carbon atoms ( C H3)3Si–O–Si of the silylating agent. The analysis of 13C CP-MAS NMR spectra of TiMent-CyPTS-HMDS-MCM-41 reveals, as expected, the presence of the capped agent, triazine silane ligand and isopropoxo ligands bonded to the metal centre, besides a new pattern of signals attributed to the menthoxo unit is observed (see Section 2). As characteristic signals it is worthy to mention the signals of the isopropoxo ligand at 21 and 68ppm for methyl ( C H3)2–CH–O and methyne (CH3)2– C H–O groups, respectively, the signal corresponding to the aromatic carbons C 3N3 of triazine at 145ppm, the trimethylsilyl carbon atoms ( C H3)3Si–O–Si of the silylating agent at −2.5ppm and the C1 of the menthoxo unit at 84ppm. The TGA curves of the modified material Ti-CyPTS-HMDS-MCM-41 and TiMent-CyPTS-HMDS-MCM-41 are given in Fig. 7 . The curves show a small loss in mass when heated until 150°C, which is interpreted as the loss of physically adsorbed water. For Ti-CyPTS-HMDS-MCM-41 the degradation process occurs in two steps. In the first step, between 185 and 350°C, the weight loss is due to the break down of pendant triazine propyl groups–titanium alkoxo complexes tethered on the silica surface. Between 425 and 600°C the weight loss is attributed to the break down of silylating agent. The TGA curve of TiMent-CyPTS-HMDS-MCM-41 shows that an additional degradation process occurs between 100 and 200°C, probably due to the break down of the bulky menthoxo ligands in comparison with the former sample. The break down of the titanium isopropoxo moieties tethered on silica surface and the silylating agents take place, as expected, between 200–350 and 350–600°C, respectively. The thermal stability of these samples is also in agreement with previous results given in the literature for other functionalized mesoporous silicas [27]. 3.2 Preparation of Ti(L-DET)-CyPTS-HMDS-MCM-41 To gain insight into the chemistry of the epoxidation process, the solid obtained by reaction of Ti-CyPTS-HMDS-MCM-41 and the chiral tartrate, l-DET, was fully characterized. Important features related to the reaction of the l-DET with the metallic complex immobilized upon MCM-41 can be obtained from 13C MAS NMR in the solid state as shown in Fig. 8 . The carbon atom of the carbonyl group in the tartrate ligand appears dishielded at 171ppm, besides the carbon atom attached to the hydroxyl group appears at 85ppm. IR spectra confirmed the modification of the system Ti-CyPTS-HMDS-MCM-41 by reaction with l-(+)-DET. The Ti tartrate-grafted samples exhibited a carbonyl band of tartrate at 1741cm−1 in their spectra (see Fig. 9b), with a very small shifts of their carbonyl bands in comparison with free-(l-DET). The titanium samples did not exhibit the typical carbonyl bands at 1680cm−1 assigned to ester groups bound to titanium through the carbonyl oxygen in the Sharpless system [28]. The TGA curve of this solid shows three peaks for weight loss. The first weight loss (endothermic) below 100°C corresponds to the loss of physisorbed water molecule. For the neat complex Ti-CyPTS-HMDS-MCM-41 there is one weight loss in the range of 185–350°C, which is shifted to 100–250°C in the case of Ti(l-DET)-CyPTS-HMDS-MCM-41 (Fig. 10 ), indicating that the presence of the chiral auxiliar decreases the stability of the solid. The additional third weight loss would correspond to the removal of the titanium isopropoxo moieties tethered on silica surface and the silylating agents. 3.3 The UV–vis/DRS spectra The diffuse reflectance UV–vis spectra (DRUV–vis) of the samples (see Fig. 11 ) were essential for a proper understanding of the nature of the metal species, especially supporting and complementing previous characterization data of these materials. The DRUV–vis spectrum of Ti-CyPTS-HMDS-MCM-41 (taken under ambient air conditions) exhibits a strong absorption at λmax=210nm for the oxygen to Ti (IV) charge transfer band (LMCT). Absorption maxima in the range of 210–240nm are attributed to a LMCT for true four-coordinate Ti (IV). Furthermore, a well-defined absorption peak is observed at 280nm, indicative of the presence of titanium species with higher coordination environments. It seems to be that the chelating triazine ligands may provide a penta-coordinated environment; furthermore, the ligands attached to flexible alkyl chains are near enough to allow some degree of oligomerization between metallic units given the higher tendency of this metal to saturate its binding sphere. Therefore, it is probable that in some of the titanium complexes on the silica surface the central core consists of an inter-linked titanium isopropoxo moiety as observed frequently for these types of derivatives [29]. Similarly, the DRUV–vis spectrum of TiMent-CyPTS-HMDS-MCM-41, although presents broad signals, contains absorption bands at 209, 240 and 275nm, indicating the existence of both titanium tetrahedrically coordinated titanium and titanium centres with higher coordination environment provided, as mentioned above, by both the chelating triazine ligand and by certain degree of oligomerization with neighbouring units. The introduction of l-DET acting as a di-coordinated ligand, changes the spectra showing the appearance of a new band typical of tartrate ligand at 237nm and the band at 272nm previously observed assigned to hexa-coordinated titanium [30]. The Sharpless mechanism usually accepted requires a coordination sphere in which the four d electrons of titanium are involved in sigma bonds with a tartrate group chelating the metal through two sigma bonded oxygen atoms an allyl alkoxy group and a sigma/pi coordinated tertbutyl peroxo group. In our system, in principle, the tartrate ligand should bond the metal through two sigma bonded oxygen atoms so the activity and selectivity of the reactions may result from a monomeric titanium complex. Nevertheless, the presence of dinuclear species suggested on basis on their DR-UVA–vis spectra (see Fig. 12 ), similar to those evidenced by other authors must not be discarded [31]. 3.4 Catalytic cinnamyl alcohol epoxidation The chiral catalyst obtained in situ by adding the chiral auxiliary (+)-diethyl-l-tartrate to Ti-CyPTS-HMDS-MCM-41 was tested in the enantioselective epoxidation of cinnamyl alcohol. In addition, TiMent-CyPTS-HMDS-MCM-41 (MentO=1R,2S,5R-(−)-menthoxo)) was tested, as well. The results presented in Table 3 show that the enantioselectivity of Ti-CyPTS-HMDS-MCM-41 (entry 2) plus l-(+)-ethyl tartrate, as asymmetry inductor, is slightly lower but still comparable to that obtain with the homogeneous system (entry 3), obtaining as expected the (2S,3S)-epoxide as the major enantiomer. The conversion increases with time (entries 2–6) and is depending on titanium amount. As can be seen when the titanium/substrate ratio increased from 1/20 to 1/10 (entries 2 and 7) the conversion increase significantly, although the obtained values are still low in comparison with the counterpart catalyst in solution. Previously, Li et al. [15] have justified this result as a consequence of the low diffusion of the substrate and the product in the mesopores of MCM-41. On the contrary, TiMent-CyPTS-HMDS-MCM-41 (entry 8), whose asymmetry is based on the menthoxo unit bonded directly to titanium centre, show better yield but poor enantiomeric excess. If menthol is tested as chiral auxiliar and added in situ to Ti-CyPTS-HMDS-MCM-41 (entry 9) the enantioselectivity is nearly doubled, but still far away from those of the tartrate system. The major enantiomer is the (2S,3S)-epoxide, however, the experimental results show that the (2R,3R)-epoxide is obtained as the preferred enantiomer when using [{Ti(OiPr)2(OMent)}2] as homogeneous catalyst (entry 1). This change in asymmetry induction originated by the same chiral ligand upon immobilization in the mesoporous of MCM-41 has been previously observed by our group [14]. Inverted enantioselectivity has been observed in our system after immobilization. It is proposed that the confinement in chiral synthesis is essentially a consequence of substrate's interaction with both the pore wall and the chiral directing groups [32,33]. The stabilities of the modified materials were studied by recycling the recovered solids. Before reuse, the solid was separated by filtration from the reaction solution, thoroughly washed with dichloromethane and dried at room temperature. The catalysts were found to be active still after been recovered with similar catalytic activity and enantioselectivity to those obtained in the first run (entry 10). In order to determine whether the active species leached into solution during a typical run, control filtrate experiments were performed. Two samples of the titanium-supported precursor Ti-CyPTS-HMDS-MCM-41 was stirred in dichloromethane at −20°C during 2h in the presence of, ButOOH, cinnamyl alcohol and l-DET in 1/20/10/1.35 molar ratio. One of the mixtures was then filtered off and the filtrated was stirred 12 additional hours under similar experimental conditions, after the appropriate work up the filtrate shows a 5% yield and 58% ee, meanwhile the second sample stirred 12 additional hours shows 25% and 81% ee, respectively; indicating that leaching of catalytically active titanium species into solution is negligible. 4 Conclusions The process that immobilize metallic complexes via covalent linkage between the ligand and the support, using a multistep grafting approach, seems to be a good method to obtain well-defined titanium species, catalytically active in the asymmetric epoxidation of cinammyl alcohol. The heterogenization of titanium complexes caused remarkable changes as the reactivity was concerned. The reaction time was greatly increased upon immobilization what strongly suggests that the reaction took place in the pores where the presence of chiral auxiliar, oxidant and substrate is regulated by the pore size. In fact, due to the confinement effect the asymmetry induction originated by the 1R,2S,5R-(−)-menthoxo ligand was the opposite to that originated by the homogeneous system. Finally, conversion and enantioselectivity remains constant after use from fresh to first recycle over Ti-CyPTS-HMDS-MCM-41. We are currently investigating new catalytic properties of these heterogeneous systems and modification of the ligands and support in our laboratory in order to improve the efficiency of the epoxidation process. Acknowledgements We gratefully acknowledge financial support from the CAM (project S-0505/PPQ-0328) and from MICINN (project CTQ2008-05892/BQU). References [1] T.P. Yoon E.N. Jacobsen Science 299 2003 1691 [2] (a) S. Caron R.W. Dugger S.G. Ruggeri J.A. Ragan D.H. Brown Ripin Chem. Rev. 106 2006 2943 (b) V. Farina J.T. Reeves C.H. Senanayake J.J. Song Chem. Rev. 106 2006 2734 [3] (a) Q.-H. Xia H.-Q. Ge C.-P. Ye Z.-M. Liu D.-X. Su Chem. Rev. 105 2005 1603 (b) Choong Eui Song Dong Hyun Kim Doo Seoung Choi Eur. J. Inorg. Chem. 2006 2927 [4] N. End K.-U. Schöning Top. Curr. Chem. 242 2004 241 [5] (a) R.I. Kureshy I. Ahmad N.H. Khan S.H.R. Abdi K. Pathak R.V. Jasra Tetrahedron: Asymmetry 16 2005 3562 (b) T. Soundiressane S. Selvakumar S. Ménage O. Hamelin M. Fontecave Anand P. Singh J. Mol. Catal. A: Chem. 270 2007 132 (c) Lu-Ning Huang Xin-Ping Hui Peng-Fei Xu J. Mol. Catal. A: Chem. 258 2006 216 [6] K. Aoki T. Shimada T. Hayashi Tetrahedron: Asymmetry 15 2004 1771 [7] H. Yang J. Li J. Yang Z. Liu Q. Yang C. Li Chem. Commun. 2007 1086 [8] R.A. García R. Van Grieken J. Iglesias V. Morales D. Gordillo Chem. Mater. 20 2008 2964 [9] A. Adima J. Moreau M. Wong Chi Man Chirality 12 2000 411 [10] Choong Eui Song Annu. Rep. Prog. Chem., Sect. C 101 2005 143 [11] B.M. Choudary V.L.K. Valli A. Durga Prasad J. Chem. Soc., Chem. Commun. 1990 1186 [12] M.C. Klunduik T. Maschmeyer J.M. Thomas B.F.G. Johnson Chem. Eur. J. 5 1999 5 [13] D. Meunier A. Piechaczyk A. Mallmann J.M. Basset Angew. Chem. Int. Ed. 23 1999 38 [14] Z.-H. Fu D.-L. Yin W. Zhao A.-X. Lv D.-H. Yin Y.-Z. Xu L.-X. Zhang J. Mol. Catal. A: Chem. 208 2004 159 [15] Y. Pérez D. Pérez Quintanilla M. Fajardo I. Sierra I. del Hierro J. Mol. Catal. A: Chem. 271 2007 227 [16] S. Xiang Y. Zhang Q. Xin C. Li Angew. Chem. Int. Ed. 5 2002 41 [17] R. Ballesteros Y. Pérez M. Fajardo I. Sierra I. del Hierro Micropor. Mesopor. Mater. 116 2008 452 [18] Y. Pérez I. del Hierro M. Fajardo A. Otero J. Organomet. Chem. 679 2003 220 [19] M.V. Landau S.P. Varkey M. Herskowitz O. Regev S. Pevzner T. Sen Z. Luz Micropor. Mesopor. Mater. 33 1999 149 [20] S. Morante-Zarcero Y. Pérez I. del Hierro M. Fajardo I. Sierra J. Chromatogr. A 1046 2004 61 [21] D.J. Ramón M. Yus Chem. Rev. 106 2006 6 [22] (a) I. Kuzniarska-Biernacka A.R. Silva A.P. Carvalho J. Pires C. Freire J. Mol. Catal. A: Chem. 278 2007 82 (b) F. Bigi L. Moroni R. Maggi G. Sartori Chem. Commun. 2002 716 [23] B. Parker D.Y. Son Inorg. Chem. Commun. 5 2002 516 [24] R.L. Brutchey B.V. Mork D.J. Sirbuly P. Yang T.D. Tilley J. Mol. Catal. A: Chem. 1 2005 238 [25] J. Jarupatrakorn D.T. Tilley J. Am. Chem. Soc. 124 2002 8380 [26] (a) E. Pretsch, T. Clero, J. Seibl, W. Simon, Tablas para la elucidación estructural de compuestos orgánicos por métodos espectroscópicos, Alhambra, Madrid, 1991. (b) P.G. Lampman G. Kriz Introduction to Spectroscopy 2001 Harcourt College Publishers USA [27] (a) B. Lee Y. Kim H. Lee J. Yi Micropor. Mesopor. Mater. 50 2001 77 (b) D.J. Macquarrie D.B. Jackson J.E.G. Mdoe H.J. Clark New J. Chem. 23 1999 539 (c) L. Bois A. Bonhommé A. Ribes B. Pais G. Raffin F. Tessier Colloids Surf. A: Physicochem. Eng. Aspects 221 2003 221 [28] M.G. Finn K. Barry Sharpless J. Am. Chem. Soc. 113 1991 113 [29] (a) H. Fric M. Puchberger U. Schubert Eur. J. Inorg. Chem. 2008 1452 (b) S.D. Nogai O. Schuster J. Bruce H.G. Raubenheimer New J. Chem. 32 2008 540 [30] (a) F. Chiker F. Launay J.P. Nogier J.L. Bonardet Green Chem. 5 2003 318 (b) E. Gianotti A. Frache S. Coluccia J.M. Thomas T. Maschmeyer L. Marchese J. Mol. Catal A: Chem. 483 2003 204 [31] A.O. Bouth G.L. rice S.L. Scott J. Am. Chem. Soc. 121 1999 7201 [32] A. Corma A. Fuerte M. Iglesias F. Sanchez J. Mol. Catal. A: Chem. 107 1996 225 [33] B.F.G. Johnson S.A. Raynor D.S. Shephard T. Mashmeyer J.M. Thomas G. Sankar S. Bromley R. Oldroyd L. Gladden M.D. Mantle Chem. Commun. 1999 1167",
      "scopus-id": "67849118609",
      "coredata": {
        "eid": "1-s2.0-S1381116909002714",
        "dc:description": "A molecular precursor approach involving tethering procedures was used to produce site isolated titanium-supported asymmetric epoxidation catalysts. This was done by first modifying the support in one step with a mixture of silanes: the synthesized triazine propyl triethoxysilane as functional linker and hexamethyldisilizane as capped agent, to increase the hydrophobicity of the support and mask the remaining silanol groups. In addition, [Ti(OPri)4] and [{Ti(OPri)3(OMent)}2] (MentO=1R,2S,5R-(−)-menthoxo) complexes were heterogenized by reaction with the modified MCM-41. Finally, after [Ti(OPri)4] immobilization on to the organomodified support the reaction with the chiral auxiliary (+)-diethyl-l-tartrate was accomplished. All the materials were characterized by elemental analysis, X-ray diffraction, nitrogen adsorption techniques, FT-IR, ICP-MS, DR-UV–vis, 29Si and 13C MAS NMR and TGA. The different systems were tested in the asymmetric epoxidation of cinnamyl alcohol in order to evaluate their catalytic activity and enantioselectivity.",
        "openArchiveArticle": "false",
        "prism:coverDate": "2009-09-01",
        "openaccessUserLicense": null,
        "prism:aggregationType": "Journal",
        "prism:url": "https://api.elsevier.com/content/article/pii/S1381116909002714",
        "dc:creator": [
          {
            "@_fa": "true",
            "$": "Ballesteros, Ruth"
          },
          {
            "@_fa": "true",
            "$": "Fajardo, Mariano"
          },
          {
            "@_fa": "true",
            "$": "Sierra, Isabel"
          },
          {
            "@_fa": "true",
            "$": "del Hierro, Isabel"
          }
        ],
        "link": [
          {
            "@_fa": "true",
            "@rel": "self",
            "@href": "https://api.elsevier.com/content/article/pii/S1381116909002714"
          },
          {
            "@_fa": "true",
            "@rel": "scidir",
            "@href": "https://www.sciencedirect.com/science/article/pii/S1381116909002714"
          }
        ],
        "dc:format": "application/json",
        "openaccessType": null,
        "pii": "S1381-1169(09)00271-4",
        "prism:volume": "310",
        "prism:publisher": "Elsevier B.V.",
        "dc:title": "Synthesis of titanium–triazine based MCM-41 hybrid materials as catalyst for the asymmetric epoxidation of cinammyl alcohol",
        "prism:copyright": "Copyright © 2009 Elsevier B.V. All rights reserved.",
        "openaccess": "0",
        "prism:issn": "13811169",
        "prism:issueIdentifier": "1-2",
        "dcterms:subject": [
          {
            "@_fa": "true",
            "$": "Mesoporous"
          },
          {
            "@_fa": "true",
            "$": "Titanium"
          },
          {
            "@_fa": "true",
            "$": "Asymmetric epoxidation"
          }
        ],
        "openaccessArticle": "false",
        "prism:publicationName": "Journal of Molecular Catalysis A: Chemical",
        "prism:number": "1-2",
        "openaccessSponsorType": null,
        "prism:pageRange": "83-92",
        "prism:endingPage": "92",
        "pubType": "fla",
        "prism:coverDisplayDate": "1 September 2009",
        "prism:doi": "10.1016/j.molcata.2009.05.023",
        "prism:startingPage": "83",
        "dc:identifier": "doi:10.1016/j.molcata.2009.05.023",
        "openaccessSponsorName": null
      },
      "objects": {
        "object": [
          {
            "@category": "standard",
            "@height": "357",
            "@width": "636",
            "@_fa": "true",
            "$": "https://api.elsevier.com/content/object/eid/1-s2.0-S1381116909002714-sc1.jpg?httpAccept=%2A%2F%2A",
            "@multimediatype": "JPEG image file",
            "@type": "IMAGE-DOWNSAMPLED",
            "@size": "31616",
            "@ref": "sc1",
            "@mimetype": "image/jpeg"
          },
          {
            "@category": "thumbnail",
            "@height": "123",
            "@width": "219",
            "@_fa": "true",
            "$": "https://api.elsevier.com/content/object/eid/1-s2.0-S1381116909002714-sc1.sml?httpAccept=%2A%2F%2A",
            "@multimediatype": "GIF image file",
            "@type": "IMAGE-THUMBNAIL",
            "@size": "2782",
            "@ref": "sc1",
            "@mimetype": "image/gif"
          },
          {
            "@category": "standard",
            "@height": "215",
            "@width": "320",
            "@_fa": "true",
            "$": "https://api.elsevier.com/content/object/eid/1-s2.0-S1381116909002714-gr1.jpg?httpAccept=%2A%2F%2A",
            "@multimediatype": "JPEG image file",
            "@type": "IMAGE-DOWNSAMPLED",
            "@size": "9283",
            "@ref": "gr1",
            "@mimetype": "image/jpeg"
          },
          {
            "@category": "thumbnail",
            "@height": "147",
            "@width": "219",
            "@_fa": "true",
            "$": "https://api.elsevier.com/content/object/eid/1-s2.0-S1381116909002714-gr1.sml?httpAccept=%2A%2F%2A",
            "@multimediatype": "GIF image file",
            "@type": "IMAGE-THUMBNAIL",
            "@size": "2102",
            "@ref": "gr1",
            "@mimetype": "image/gif"
          },
          {
            "@category": "standard",
            "@height": "534",
            "@width": "368",
            "@_fa": "true",
            "$": "https://api.elsevier.com/content/object/eid/1-s2.0-S1381116909002714-gr2.jpg?httpAccept=%2A%2F%2A",
            "@multimediatype": "JPEG image file",
            "@type": "IMAGE-DOWNSAMPLED",
            "@size": "33075",
            "@ref": "gr2",
            "@mimetype": "image/jpeg"
          },
          {
            "@category": "thumbnail",
            "@height": "164",
            "@width": "113",
            "@_fa": "true",
            "$": "https://api.elsevier.com/content/object/eid/1-s2.0-S1381116909002714-gr2.sml?httpAccept=%2A%2F%2A",
            "@multimediatype": "GIF image file",
            "@type": "IMAGE-THUMBNAIL",
            "@size": "2401",
            "@ref": "gr2",
            "@mimetype": "image/gif"
          },
          {
            "@category": "standard",
            "@height": "456",
            "@width": "606",
            "@_fa": "true",
            "$": "https://api.elsevier.com/content/object/eid/1-s2.0-S1381116909002714-gr3.jpg?httpAccept=%2A%2F%2A",
            "@multimediatype": "JPEG image file",
            "@type": "IMAGE-DOWNSAMPLED",
            "@size": "118121",
            "@ref": "gr3",
            "@mimetype": "image/jpeg"
          },
          {
            "@category": "thumbnail",
            "@height": "164",
            "@width": "218",
            "@_fa": "true",
            "$": "https://api.elsevier.com/content/object/eid/1-s2.0-S1381116909002714-gr3.sml?httpAccept=%2A%2F%2A",
            "@multimediatype": "GIF image file",
            "@type": "IMAGE-THUMBNAIL",
            "@size": "11530",
            "@ref": "gr3",
            "@mimetype": "image/gif"
          },
          {
            "@category": "standard",
            "@height": "272",
            "@width": "381",
            "@_fa": "true",
            "$": "https://api.elsevier.com/content/object/eid/1-s2.0-S1381116909002714-gr4.jpg?httpAccept=%2A%2F%2A",
            "@multimediatype": "JPEG image file",
            "@type": "IMAGE-DOWNSAMPLED",
            "@size": "26192",
            "@ref": "gr4",
            "@mimetype": "image/jpeg"
          },
          {
            "@category": "thumbnail",
            "@height": "156",
            "@width": "219",
            "@_fa": "true",
            "$": "https://api.elsevier.com/content/object/eid/1-s2.0-S1381116909002714-gr4.sml?httpAccept=%2A%2F%2A",
            "@multimediatype": "GIF image file",
            "@type": "IMAGE-THUMBNAIL",
            "@size": "5941",
            "@ref": "gr4",
            "@mimetype": "image/gif"
          },
          {
            "@category": "standard",
            "@height": "229",
            "@width": "321",
            "@_fa": "true",
            "$": "https://api.elsevier.com/content/object/eid/1-s2.0-S1381116909002714-gr5.jpg?httpAccept=%2A%2F%2A",
            "@multimediatype": "JPEG image file",
            "@type": "IMAGE-DOWNSAMPLED",
            "@size": "11627",
            "@ref": "gr5",
            "@mimetype": "image/jpeg"
          },
          {
            "@category": "thumbnail",
            "@height": "156",
            "@width": "219",
            "@_fa": "true",
            "$": "https://api.elsevier.com/content/object/eid/1-s2.0-S1381116909002714-gr5.sml?httpAccept=%2A%2F%2A",
            "@multimediatype": "GIF image file",
            "@type": "IMAGE-THUMBNAIL",
            "@size": "2647",
            "@ref": "gr5",
            "@mimetype": "image/gif"
          },
          {
            "@category": "standard",
            "@height": "357",
            "@width": "322",
            "@_fa": "true",
            "$": "https://api.elsevier.com/content/object/eid/1-s2.0-S1381116909002714-gr6.jpg?httpAccept=%2A%2F%2A",
            "@multimediatype": "JPEG image file",
            "@type": "IMAGE-DOWNSAMPLED",
            "@size": "14290",
            "@ref": "gr6",
            "@mimetype": "image/jpeg"
          },
          {
            "@category": "thumbnail",
            "@height": "164",
            "@width": "148",
            "@_fa": "true",
            "$": "https://api.elsevier.com/content/object/eid/1-s2.0-S1381116909002714-gr6.sml?httpAccept=%2A%2F%2A",
            "@multimediatype": "GIF image file",
            "@type": "IMAGE-THUMBNAIL",
            "@size": "2166",
            "@ref": "gr6",
            "@mimetype": "image/gif"
          },
          {
            "@category": "standard",
            "@height": "234",
            "@width": "382",
            "@_fa": "true",
            "$": "https://api.elsevier.com/content/object/eid/1-s2.0-S1381116909002714-gr7.jpg?httpAccept=%2A%2F%2A",
            "@multimediatype": "JPEG image file",
            "@type": "IMAGE-DOWNSAMPLED",
            "@size": "21002",
            "@ref": "gr7",
            "@mimetype": "image/jpeg"
          },
          {
            "@category": "thumbnail",
            "@height": "134",
            "@width": "219",
            "@_fa": "true",
            "$": "https://api.elsevier.com/content/object/eid/1-s2.0-S1381116909002714-gr7.sml?httpAccept=%2A%2F%2A",
            "@multimediatype": "GIF image file",
            "@type": "IMAGE-THUMBNAIL",
            "@size": "4332",
            "@ref": "gr7",
            "@mimetype": "image/gif"
          },
          {
            "@category": "standard",
            "@height": "271",
            "@width": "378",
            "@_fa": "true",
            "$": "https://api.elsevier.com/content/object/eid/1-s2.0-S1381116909002714-gr8.jpg?httpAccept=%2A%2F%2A",
            "@multimediatype": "JPEG image file",
            "@type": "IMAGE-DOWNSAMPLED",
            "@size": "10454",
            "@ref": "gr8",
            "@mimetype": "image/jpeg"
          },
          {
            "@category": "thumbnail",
            "@height": "157",
            "@width": "219",
            "@_fa": "true",
            "$": "https://api.elsevier.com/content/object/eid/1-s2.0-S1381116909002714-gr8.sml?httpAccept=%2A%2F%2A",
            "@multimediatype": "GIF image file",
            "@type": "IMAGE-THUMBNAIL",
            "@size": "2138",
            "@ref": "gr8",
            "@mimetype": "image/gif"
          },
          {
            "@category": "standard",
            "@height": "283",
            "@width": "371",
            "@_fa": "true",
            "$": "https://api.elsevier.com/content/object/eid/1-s2.0-S1381116909002714-gr9.jpg?httpAccept=%2A%2F%2A",
            "@multimediatype": "JPEG image file",
            "@type": "IMAGE-DOWNSAMPLED",
            "@size": "15957",
            "@ref": "gr9",
            "@mimetype": "image/jpeg"
          },
          {
            "@category": "thumbnail",
            "@height": "164",
            "@width": "215",
            "@_fa": "true",
            "$": "https://api.elsevier.com/content/object/eid/1-s2.0-S1381116909002714-gr9.sml?httpAccept=%2A%2F%2A",
            "@multimediatype": "GIF image file",
            "@type": "IMAGE-THUMBNAIL",
            "@size": "2821",
            "@ref": "gr9",
            "@mimetype": "image/gif"
          },
          {
            "@category": "standard",
            "@height": "253",
            "@width": "379",
            "@_fa": "true",
            "$": "https://api.elsevier.com/content/object/eid/1-s2.0-S1381116909002714-gr10.jpg?httpAccept=%2A%2F%2A",
            "@multimediatype": "JPEG image file",
            "@type": "IMAGE-DOWNSAMPLED",
            "@size": "19211",
            "@ref": "gr10",
            "@mimetype": "image/jpeg"
          },
          {
            "@category": "thumbnail",
            "@height": "146",
            "@width": "219",
            "@_fa": "true",
            "$": "https://api.elsevier.com/content/object/eid/1-s2.0-S1381116909002714-gr10.sml?httpAccept=%2A%2F%2A",
            "@multimediatype": "GIF image file",
            "@type": "IMAGE-THUMBNAIL",
            "@size": "4281",
            "@ref": "gr10",
            "@mimetype": "image/gif"
          },
          {
            "@category": "standard",
            "@height": "280",
            "@width": "382",
            "@_fa": "true",
            "$": "https://api.elsevier.com/content/object/eid/1-s2.0-S1381116909002714-gr11.jpg?httpAccept=%2A%2F%2A",
            "@multimediatype": "JPEG image file",
            "@type": "IMAGE-DOWNSAMPLED",
            "@size": "16283",
            "@ref": "gr11",
            "@mimetype": "image/jpeg"
          },
          {
            "@category": "thumbnail",
            "@height": "160",
            "@width": "219",
            "@_fa": "true",
            "$": "https://api.elsevier.com/content/object/eid/1-s2.0-S1381116909002714-gr11.sml?httpAccept=%2A%2F%2A",
            "@multimediatype": "GIF image file",
            "@type": "IMAGE-THUMBNAIL",
            "@size": "2836",
            "@ref": "gr11",
            "@mimetype": "image/gif"
          },
          {
            "@category": "standard",
            "@height": "423",
            "@width": "548",
            "@_fa": "true",
            "$": "https://api.elsevier.com/content/object/eid/1-s2.0-S1381116909002714-gr12.jpg?httpAccept=%2A%2F%2A",
            "@multimediatype": "JPEG image file",
            "@type": "IMAGE-DOWNSAMPLED",
            "@size": "33807",
            "@ref": "gr12",
            "@mimetype": "image/jpeg"
          },
          {
            "@category": "thumbnail",
            "@height": "164",
            "@width": "212",
            "@_fa": "true",
            "$": "https://api.elsevier.com/content/object/eid/1-s2.0-S1381116909002714-gr12.sml?httpAccept=%2A%2F%2A",
            "@multimediatype": "GIF image file",
            "@type": "IMAGE-THUMBNAIL",
            "@size": "3899",
            "@ref": "gr12",
            "@mimetype": "image/gif"
          },
          {
            "@category": "standard",
            "@height": "72",
            "@width": "458",
            "@_fa": "true",
            "$": "https://api.elsevier.com/content/object/eid/1-s2.0-S1381116909002714-fx3.jpg?httpAccept=%2A%2F%2A",
            "@multimediatype": "JPEG image file",
            "@type": "IMAGE-DOWNSAMPLED",
            "@size": "9351",
            "@ref": "fx3",
            "@mimetype": "image/jpeg"
          },
          {
            "@category": "thumbnail",
            "@height": "35",
            "@width": "219",
            "@_fa": "true",
            "$": "https://api.elsevier.com/content/object/eid/1-s2.0-S1381116909002714-fx3.sml?httpAccept=%2A%2F%2A",
            "@multimediatype": "GIF image file",
            "@type": "IMAGE-THUMBNAIL",
            "@size": "1315",
            "@ref": "fx3",
            "@mimetype": "image/gif"
          },
          {
            "@category": "standard",
            "@height": "268",
            "@width": "364",
            "@_fa": "true",
            "$": "https://api.elsevier.com/content/object/eid/1-s2.0-S1381116909002714-fx2.gif?httpAccept=%2A%2F%2A",
            "@multimediatype": "GIF image file",
            "@type": "IMAGE-DOWNSAMPLED",
            "@size": "5376",
            "@ref": "fx2",
            "@mimetype": "image/gif"
          },
          {
            "@category": "thumbnail",
            "@height": "161",
            "@width": "219",
            "@_fa": "true",
            "$": "https://api.elsevier.com/content/object/eid/1-s2.0-S1381116909002714-fx2.sml?httpAccept=%2A%2F%2A",
            "@multimediatype": "GIF image file",
            "@type": "IMAGE-THUMBNAIL",
            "@size": "2821",
            "@ref": "fx2",
            "@mimetype": "image/gif"
          },
          {
            "@category": "standard",
            "@height": "179",
            "@width": "233",
            "@_fa": "true",
            "$": "https://api.elsevier.com/content/object/eid/1-s2.0-S1381116909002714-fx1.jpg?httpAccept=%2A%2F%2A",
            "@multimediatype": "JPEG image file",
            "@type": "IMAGE-DOWNSAMPLED",
            "@size": "25645",
            "@ref": "fx1",
            "@mimetype": "image/jpeg"
          },
          {
            "@category": "thumbnail",
            "@height": "164",
            "@width": "213",
            "@_fa": "true",
            "$": "https://api.elsevier.com/content/object/eid/1-s2.0-S1381116909002714-fx1.sml?httpAccept=%2A%2F%2A",
            "@multimediatype": "GIF image file",
            "@type": "IMAGE-THUMBNAIL",
            "@size": "4440",
            "@ref": "fx1",
            "@mimetype": "image/gif"
          }
        ]
      },
      "link": {
        "@rel": "abstract",
        "@href": "https://api.elsevier.com/content/abstract/scopus_id/67849118609"
      }
    }
  }
}