{
  "metadata": {
    "title": "Silver supported on hierarchically porous SiO<ce:inf loc=post>2</ce:inf> and Co<ce:inf loc=post>3</ce:inf>O<ce:inf loc=post>4</ce:inf> monoliths: Efficient heterogeneous catalyst for oxidation of cyclohexene",
    "authors": "; ; ",
    "journal": "Journal of Molecular Catalysis A: Chemical",
    "date": "2016-01-31",
    "doi": "10.1016/j.molcata.2015.10.015",
    "abstract": "",
    "uri": "https://api.elsevier.com/content/article/pii/S1381116915301205",
    "pii": "S1381116915301205"
  },
  "fulltext": {
    "full-text-retrieval-response": {
      "scopus-eid": "2-s2.0-84945266256",
      "originalText": "serial JL 271358 291210 291744 291790 291809 31 Journal of Molecular Catalysis A: Chemical JOURNALMOLECULARCATALYSISACHEMICAL 2015-10-23 2015-10-23 2015-11-14 2015-11-14 2015-12-17T13:13:37 1-s2.0-S1381116915301205 S1381-1169(15)30120-5 S1381116915301205 10.1016/j.molcata.2015.10.015 S300 S300.1 FULL-TEXT 1-s2.0-S1381116915X00136 2016-09-03T12:57:22.661225-04:00 0 0 20160101 20160131 2016 2015-10-23T04:42:59.318671Z absattachment articleinfo articletitlenorm authfirstinitialnorm authfirstsurnamenorm cid cids contenttype copyright crossmark dateloaded dateloadedtxt datesearch datesort dateupdated dco docsubtype doctype doi eid ewtransactionid hubeid indexeddate issn issnnorm itemstage itemtransactionid itemweight openaccess openarchive pg pgfirst pglast pii piinorm pubdateend pubdatestart pubdatetxt pubyr sectiontitle sortorder srctitle srctitlenorm srctype ssids alllist content subj subheadings suppl tomb volfirst volissue volumelist webpdf webpdfpagecount yearnav figure table body acknowledge affil articletitle auth authfirstini authfull authkeywords authlast highlightsabst primabst ref specialabst 1381-1169 13811169 true 411 411 C Volume 411 10 61 71 61 71 201601 January 2016 2016-01-01 2016-01-31 2016 Regular Papers article fla Copyright © 2015 Elsevier B.V. All rights reserved. SILVERSUPPORTEDHIERARCHICALLYPOROUSSIO2CO3O4MONOLITHSEFFICIENTHETEROGENEOUSCATALYSTFOROXIDATIONCYCLOHEXENE HAKAT Y 1 Introduction 2 Experimental 2.1 Materials 2.2 Synthesis of SiO2 monoliths 2.3 Synthesis of Co3O4 monolith replica 2.4 Synthesis of Ag supported on the SiO2 and Co3O4 catalysts 2.5 Catalyst characterization 2.6 Catalytic tests 2.7 Catalyst recycle studies 2.8 Leaching studies 3 Results and discussion 3.1 Scanning electron microscopic studies 3.2 Textural characterization 3.3 X-ray diffraction studies 3.4 X-ray photoelectron spectroscopy 3.5 Catalytic activity 3.6 Catalyst recycle studies 3.7 Leaching studies 4 Discussion 5 Conclusions Conflicts of interest Acknowledgements References ASTRUC 2008 D NANOPARTICLESCATALYSIS KNOZINGER 2008 555 571 H HANDBOOKHETEROGENEOUSCATALYSIS DINGERDISSEN 2008 37 56 U HANDBOOKHETEROGENEOUSCATALYSIS RAGAUSKAS 2006 484 489 A CHHEDA 2007 7164 7183 J CORMA 2007 2411 2502 A BOZELL 2009 539 554 J GALLEZOT 2012 1538 1558 P JAHNISCH 2004 406 446 K HARTMAN 2011 7502 7519 R BARALDI 2012 149 167 P WATTS 2012 181 193 P ESCRIBA 2013 101 115 M WIRTH 2013 T MICROREACTORSINORGANICCHEMISTRYCATALYSIS NAKANISHI 1997 67 112 K NAKANISHI 2012 241 267 K HIERARCHICALLYSTRUCTUREDPOROUSMATERIALSNANOSCIENCECATALYSISSEPARATIONOPTICENERGYLIFESCIENCE YUAN 2006 663 677 Z STEIN 2008 649 666 A COLOMBO 2010 5425 5455 P PARLETT 2013 3876 3893 C NUMATA 2010 66 72 M SACHSE 2012 62 67 A DROZDZ 2013 163 170 A SZYMANSKA 2013 75 82 K HAKAT 2015 98 112 Y KORENIUK 2015 203 208 A SAYLER 2014 141 150 F GRANO 2013 154 157 A HAKAT 2014 286 295 Y UMBARKAR 2009 150 158 S SOHN 2013 59 67 Y BAEK 2012 1242 1246 J SERAFIN 1998 157 168 J ALEXANDERNIJHUIS 2006 3447 3459 T CARTER 1988 80 92 E SUN 2010 12088 12098 H ALI 2014 pp23 M HAKATX2016X61 HAKATX2016X61X71 HAKATX2016X61XY HAKATX2016X61X71XY UnderEmbargo 2017-11-14T00:00:00Z http://creativecommons.org/licenses/by-nc-nd/4.0/ item S1381-1169(15)30120-5 S1381116915301205 1-s2.0-S1381116915301205 10.1016/j.molcata.2015.10.015 271358 2015-12-17T10:28:02.21332-05:00 2016-01-01 2016-01-31 1-s2.0-S1381116915301205-main.pdf https://s3-eu-west-1.amazonaws.com/prod-ucs-content-store-eu-west/content/pii:S1381116915301205/MAIN/application/pdf/c1f95ca9f470b7ee27703b120c4737df/main.pdf https://s3.amazonaws.com/prod-ucs-content-store-us-east/content/pii:S1381116915301205/MAIN/application/pdf/c1f95ca9f470b7ee27703b120c4737df/main.pdf main.pdf pdf true 3467328 MAIN 11 1-s2.0-S1381116915301205-main_1.png https://s3-eu-west-1.amazonaws.com/prod-ucs-content-store-eu-west/content/pii:S1381116915301205/PREVIEW/image/png/9d909e9a0e7512dd26cea02c4980c15a/main_1.png https://s3.amazonaws.com/prod-ucs-content-store-us-east/content/pii:S1381116915301205/PREVIEW/image/png/9d909e9a0e7512dd26cea02c4980c15a/main_1.png main_1.png png 58211 849 656 IMAGE-WEB-PDF 1 1-s2.0-S1381116915301205-fx1.sml https://s3-eu-west-1.amazonaws.com/prod-ucs-content-store-eu-west/content/pii:S1381116915301205/fx1/THUMBNAIL/image/gif/32ca10994262dd61eb25019b5c06240d/fx1.sml https://s3.amazonaws.com/prod-ucs-content-store-us-east/content/pii:S1381116915301205/fx1/THUMBNAIL/image/gif/32ca10994262dd61eb25019b5c06240d/fx1.sml fx1 true fx1.sml sml 4699 88 219 IMAGE-THUMBNAIL 1-s2.0-S1381116915301205-gr1.sml https://s3-eu-west-1.amazonaws.com/prod-ucs-content-store-eu-west/content/pii:S1381116915301205/gr1/THUMBNAIL/image/gif/90c7104b8c8f53e5f17196e5d3082b5a/gr1.sml https://s3.amazonaws.com/prod-ucs-content-store-us-east/content/pii:S1381116915301205/gr1/THUMBNAIL/image/gif/90c7104b8c8f53e5f17196e5d3082b5a/gr1.sml gr1 gr1.sml sml 36860 164 203 IMAGE-THUMBNAIL 1-s2.0-S1381116915301205-gr10.sml https://s3-eu-west-1.amazonaws.com/prod-ucs-content-store-eu-west/content/pii:S1381116915301205/gr10/THUMBNAIL/image/gif/291d05151b87b39c87817b9110b60467/gr10.sml https://s3.amazonaws.com/prod-ucs-content-store-us-east/content/pii:S1381116915301205/gr10/THUMBNAIL/image/gif/291d05151b87b39c87817b9110b60467/gr10.sml gr10 gr10.sml sml 18316 134 219 IMAGE-THUMBNAIL 1-s2.0-S1381116915301205-gr2.sml https://s3-eu-west-1.amazonaws.com/prod-ucs-content-store-eu-west/content/pii:S1381116915301205/gr2/THUMBNAIL/image/gif/977581af78008ebe0953ad4bfba4d9e7/gr2.sml https://s3.amazonaws.com/prod-ucs-content-store-us-east/content/pii:S1381116915301205/gr2/THUMBNAIL/image/gif/977581af78008ebe0953ad4bfba4d9e7/gr2.sml gr2 gr2.sml sml 26280 163 203 IMAGE-THUMBNAIL 1-s2.0-S1381116915301205-gr3.sml https://s3-eu-west-1.amazonaws.com/prod-ucs-content-store-eu-west/content/pii:S1381116915301205/gr3/THUMBNAIL/image/gif/d96d75e553526079a7b07909dec85883/gr3.sml https://s3.amazonaws.com/prod-ucs-content-store-us-east/content/pii:S1381116915301205/gr3/THUMBNAIL/image/gif/d96d75e553526079a7b07909dec85883/gr3.sml gr3 gr3.sml sml 14648 151 219 IMAGE-THUMBNAIL 1-s2.0-S1381116915301205-gr4.sml https://s3-eu-west-1.amazonaws.com/prod-ucs-content-store-eu-west/content/pii:S1381116915301205/gr4/THUMBNAIL/image/gif/95d5043eab92190a881cd2be2cc9e270/gr4.sml https://s3.amazonaws.com/prod-ucs-content-store-us-east/content/pii:S1381116915301205/gr4/THUMBNAIL/image/gif/95d5043eab92190a881cd2be2cc9e270/gr4.sml gr4 gr4.sml sml 18821 164 193 IMAGE-THUMBNAIL 1-s2.0-S1381116915301205-gr5.sml https://s3-eu-west-1.amazonaws.com/prod-ucs-content-store-eu-west/content/pii:S1381116915301205/gr5/THUMBNAIL/image/gif/bd9c597d6c9df4b1bbd0a2307e38716c/gr5.sml https://s3.amazonaws.com/prod-ucs-content-store-us-east/content/pii:S1381116915301205/gr5/THUMBNAIL/image/gif/bd9c597d6c9df4b1bbd0a2307e38716c/gr5.sml gr5 gr5.sml sml 14507 164 204 IMAGE-THUMBNAIL 1-s2.0-S1381116915301205-gr6.sml https://s3-eu-west-1.amazonaws.com/prod-ucs-content-store-eu-west/content/pii:S1381116915301205/gr6/THUMBNAIL/image/gif/ac7fff69ea0f915938c18ac31cdc44e2/gr6.sml https://s3.amazonaws.com/prod-ucs-content-store-us-east/content/pii:S1381116915301205/gr6/THUMBNAIL/image/gif/ac7fff69ea0f915938c18ac31cdc44e2/gr6.sml gr6 gr6.sml sml 14879 164 210 IMAGE-THUMBNAIL 1-s2.0-S1381116915301205-gr7.sml https://s3-eu-west-1.amazonaws.com/prod-ucs-content-store-eu-west/content/pii:S1381116915301205/gr7/THUMBNAIL/image/gif/8171e243714a170080b1ae2364786e1f/gr7.sml https://s3.amazonaws.com/prod-ucs-content-store-us-east/content/pii:S1381116915301205/gr7/THUMBNAIL/image/gif/8171e243714a170080b1ae2364786e1f/gr7.sml gr7 gr7.sml sml 12335 61 219 IMAGE-THUMBNAIL 1-s2.0-S1381116915301205-gr8.sml https://s3-eu-west-1.amazonaws.com/prod-ucs-content-store-eu-west/content/pii:S1381116915301205/gr8/THUMBNAIL/image/gif/2a0786f877f9465d47551c9b5b97faa9/gr8.sml https://s3.amazonaws.com/prod-ucs-content-store-us-east/content/pii:S1381116915301205/gr8/THUMBNAIL/image/gif/2a0786f877f9465d47551c9b5b97faa9/gr8.sml gr8 gr8.sml sml 12340 65 219 IMAGE-THUMBNAIL 1-s2.0-S1381116915301205-gr9.sml https://s3-eu-west-1.amazonaws.com/prod-ucs-content-store-eu-west/content/pii:S1381116915301205/gr9/THUMBNAIL/image/gif/b238b679ead96deecb81eeeee410323a/gr9.sml https://s3.amazonaws.com/prod-ucs-content-store-us-east/content/pii:S1381116915301205/gr9/THUMBNAIL/image/gif/b238b679ead96deecb81eeeee410323a/gr9.sml gr9 gr9.sml sml 21071 164 133 IMAGE-THUMBNAIL 1-s2.0-S1381116915301205-gr11.sml https://s3-eu-west-1.amazonaws.com/prod-ucs-content-store-eu-west/content/pii:S1381116915301205/gr11/THUMBNAIL/image/gif/f5aef9485286b59009a8d0bb78f8e7b9/gr11.sml https://s3.amazonaws.com/prod-ucs-content-store-us-east/content/pii:S1381116915301205/gr11/THUMBNAIL/image/gif/f5aef9485286b59009a8d0bb78f8e7b9/gr11.sml gr11 gr11.sml sml 3461 59 219 IMAGE-THUMBNAIL 1-s2.0-S1381116915301205-gr12.sml https://s3-eu-west-1.amazonaws.com/prod-ucs-content-store-eu-west/content/pii:S1381116915301205/gr12/THUMBNAIL/image/gif/074889ffdef6ac7877d86679a59879f5/gr12.sml https://s3.amazonaws.com/prod-ucs-content-store-us-east/content/pii:S1381116915301205/gr12/THUMBNAIL/image/gif/074889ffdef6ac7877d86679a59879f5/gr12.sml gr12 gr12.sml sml 3050 48 219 IMAGE-THUMBNAIL 1-s2.0-S1381116915301205-sc1.sml https://s3-eu-west-1.amazonaws.com/prod-ucs-content-store-eu-west/content/pii:S1381116915301205/sc1/THUMBNAIL/image/gif/fc406f17b23d6437dcc695f2435eb1e6/sc1.sml https://s3.amazonaws.com/prod-ucs-content-store-us-east/content/pii:S1381116915301205/sc1/THUMBNAIL/image/gif/fc406f17b23d6437dcc695f2435eb1e6/sc1.sml sc1 sc1.sml sml 4099 88 219 IMAGE-THUMBNAIL 1-s2.0-S1381116915301205-gr11.gif https://s3-eu-west-1.amazonaws.com/prod-ucs-content-store-eu-west/content/pii:S1381116915301205/gr11/DOWNSAMPLED/image/gif/8a665f588d60a83e34b4c87abdca2eb4/gr11.gif https://s3.amazonaws.com/prod-ucs-content-store-us-east/content/pii:S1381116915301205/gr11/DOWNSAMPLED/image/gif/8a665f588d60a83e34b4c87abdca2eb4/gr11.gif gr11 gr11.gif gif 10719 152 565 IMAGE-DOWNSAMPLED 1-s2.0-S1381116915301205-gr12.gif https://s3-eu-west-1.amazonaws.com/prod-ucs-content-store-eu-west/content/pii:S1381116915301205/gr12/DOWNSAMPLED/image/gif/42651fa939e5f477d2ae182fc756b099/gr12.gif https://s3.amazonaws.com/prod-ucs-content-store-us-east/content/pii:S1381116915301205/gr12/DOWNSAMPLED/image/gif/42651fa939e5f477d2ae182fc756b099/gr12.gif gr12 gr12.gif gif 9127 124 565 IMAGE-DOWNSAMPLED 1-s2.0-S1381116915301205-sc1.gif https://s3-eu-west-1.amazonaws.com/prod-ucs-content-store-eu-west/content/pii:S1381116915301205/sc1/DOWNSAMPLED/image/gif/8e84d851e1393d9d891f4730fedb64ca/sc1.gif https://s3.amazonaws.com/prod-ucs-content-store-us-east/content/pii:S1381116915301205/sc1/DOWNSAMPLED/image/gif/8e84d851e1393d9d891f4730fedb64ca/sc1.gif sc1 sc1.gif gif 11935 212 527 IMAGE-DOWNSAMPLED 1-s2.0-S1381116915301205-fx1.jpg https://s3-eu-west-1.amazonaws.com/prod-ucs-content-store-eu-west/content/pii:S1381116915301205/fx1/DOWNSAMPLED/image/jpeg/cac8036d7a4e45344459735381ac41d7/fx1.jpg https://s3.amazonaws.com/prod-ucs-content-store-us-east/content/pii:S1381116915301205/fx1/DOWNSAMPLED/image/jpeg/cac8036d7a4e45344459735381ac41d7/fx1.jpg fx1 true fx1.jpg jpg 15889 200 500 IMAGE-DOWNSAMPLED 1-s2.0-S1381116915301205-gr1.jpg https://s3-eu-west-1.amazonaws.com/prod-ucs-content-store-eu-west/content/pii:S1381116915301205/gr1/DOWNSAMPLED/image/jpeg/dd5a010dc954f451ced8f5d206bc0570/gr1.jpg https://s3.amazonaws.com/prod-ucs-content-store-us-east/content/pii:S1381116915301205/gr1/DOWNSAMPLED/image/jpeg/dd5a010dc954f451ced8f5d206bc0570/gr1.jpg gr1 gr1.jpg jpg 109290 457 565 IMAGE-DOWNSAMPLED 1-s2.0-S1381116915301205-gr10.jpg https://s3-eu-west-1.amazonaws.com/prod-ucs-content-store-eu-west/content/pii:S1381116915301205/gr10/DOWNSAMPLED/image/jpeg/ba74251d61a73b2c7586512aa0041c15/gr10.jpg https://s3.amazonaws.com/prod-ucs-content-store-us-east/content/pii:S1381116915301205/gr10/DOWNSAMPLED/image/jpeg/ba74251d61a73b2c7586512aa0041c15/gr10.jpg gr10 gr10.jpg jpg 98232 462 753 IMAGE-DOWNSAMPLED 1-s2.0-S1381116915301205-gr2.jpg https://s3-eu-west-1.amazonaws.com/prod-ucs-content-store-eu-west/content/pii:S1381116915301205/gr2/DOWNSAMPLED/image/jpeg/32746e468e03e0b437a97b13aa21401c/gr2.jpg https://s3.amazonaws.com/prod-ucs-content-store-us-east/content/pii:S1381116915301205/gr2/DOWNSAMPLED/image/jpeg/32746e468e03e0b437a97b13aa21401c/gr2.jpg gr2 gr2.jpg jpg 103872 531 659 IMAGE-DOWNSAMPLED 1-s2.0-S1381116915301205-gr3.jpg https://s3-eu-west-1.amazonaws.com/prod-ucs-content-store-eu-west/content/pii:S1381116915301205/gr3/DOWNSAMPLED/image/jpeg/e162775571e032fe180e2f6f021226ba/gr3.jpg https://s3.amazonaws.com/prod-ucs-content-store-us-east/content/pii:S1381116915301205/gr3/DOWNSAMPLED/image/jpeg/e162775571e032fe180e2f6f021226ba/gr3.jpg gr3 gr3.jpg jpg 54059 468 678 IMAGE-DOWNSAMPLED 1-s2.0-S1381116915301205-gr4.jpg https://s3-eu-west-1.amazonaws.com/prod-ucs-content-store-eu-west/content/pii:S1381116915301205/gr4/DOWNSAMPLED/image/jpeg/710e46706e2d8723d39925bbba817baf/gr4.jpg https://s3.amazonaws.com/prod-ucs-content-store-us-east/content/pii:S1381116915301205/gr4/DOWNSAMPLED/image/jpeg/710e46706e2d8723d39925bbba817baf/gr4.jpg gr4 gr4.jpg jpg 79152 560 659 IMAGE-DOWNSAMPLED 1-s2.0-S1381116915301205-gr5.jpg https://s3-eu-west-1.amazonaws.com/prod-ucs-content-store-eu-west/content/pii:S1381116915301205/gr5/DOWNSAMPLED/image/jpeg/b3392157b1a53593a945fdb789b9ecf9/gr5.jpg https://s3.amazonaws.com/prod-ucs-content-store-us-east/content/pii:S1381116915301205/gr5/DOWNSAMPLED/image/jpeg/b3392157b1a53593a945fdb789b9ecf9/gr5.jpg gr5 gr5.jpg jpg 77967 606 753 IMAGE-DOWNSAMPLED 1-s2.0-S1381116915301205-gr6.jpg https://s3-eu-west-1.amazonaws.com/prod-ucs-content-store-eu-west/content/pii:S1381116915301205/gr6/DOWNSAMPLED/image/jpeg/8f7ef428cfb535010e053f80c8c31fe5/gr6.jpg https://s3.amazonaws.com/prod-ucs-content-store-us-east/content/pii:S1381116915301205/gr6/DOWNSAMPLED/image/jpeg/8f7ef428cfb535010e053f80c8c31fe5/gr6.jpg gr6 gr6.jpg jpg 69486 589 753 IMAGE-DOWNSAMPLED 1-s2.0-S1381116915301205-gr7.jpg https://s3-eu-west-1.amazonaws.com/prod-ucs-content-store-eu-west/content/pii:S1381116915301205/gr7/DOWNSAMPLED/image/jpeg/a4ab14292e4351c7497f5b3e76b19099/gr7.jpg https://s3.amazonaws.com/prod-ucs-content-store-us-east/content/pii:S1381116915301205/gr7/DOWNSAMPLED/image/jpeg/a4ab14292e4351c7497f5b3e76b19099/gr7.jpg gr7 gr7.jpg jpg 55861 210 753 IMAGE-DOWNSAMPLED 1-s2.0-S1381116915301205-gr8.jpg https://s3-eu-west-1.amazonaws.com/prod-ucs-content-store-eu-west/content/pii:S1381116915301205/gr8/DOWNSAMPLED/image/jpeg/2179b2d60fb1f73904a854bb4539faf4/gr8.jpg https://s3.amazonaws.com/prod-ucs-content-store-us-east/content/pii:S1381116915301205/gr8/DOWNSAMPLED/image/jpeg/2179b2d60fb1f73904a854bb4539faf4/gr8.jpg gr8 gr8.jpg jpg 61283 223 753 IMAGE-DOWNSAMPLED 1-s2.0-S1381116915301205-gr9.jpg https://s3-eu-west-1.amazonaws.com/prod-ucs-content-store-eu-west/content/pii:S1381116915301205/gr9/DOWNSAMPLED/image/jpeg/73ddbde6d03c892a8186db91c462d652/gr9.jpg https://s3.amazonaws.com/prod-ucs-content-store-us-east/content/pii:S1381116915301205/gr9/DOWNSAMPLED/image/jpeg/73ddbde6d03c892a8186db91c462d652/gr9.jpg gr9 gr9.jpg jpg 147058 696 565 IMAGE-DOWNSAMPLED 1-s2.0-S1381116915301205-gr11_lrg.gif https://s3-eu-west-1.amazonaws.com/prod-ucs-content-store-eu-west/content/pii:S1381116915301205/gr11/HIGHRES/image/gif/d0518028f166e49e2d3976ff003643fe/gr11_lrg.gif https://s3.amazonaws.com/prod-ucs-content-store-us-east/content/pii:S1381116915301205/gr11/HIGHRES/image/gif/d0518028f166e49e2d3976ff003643fe/gr11_lrg.gif gr11 gr11_lrg.gif gif 51910 1347 5000 IMAGE-HIGH-RES 1-s2.0-S1381116915301205-gr12_lrg.gif https://s3-eu-west-1.amazonaws.com/prod-ucs-content-store-eu-west/content/pii:S1381116915301205/gr12/HIGHRES/image/gif/c4203292699232778b0d0e208887629b/gr12_lrg.gif https://s3.amazonaws.com/prod-ucs-content-store-us-east/content/pii:S1381116915301205/gr12/HIGHRES/image/gif/c4203292699232778b0d0e208887629b/gr12_lrg.gif gr12 gr12_lrg.gif gif 43712 1097 5000 IMAGE-HIGH-RES 1-s2.0-S1381116915301205-sc1_lrg.gif https://s3-eu-west-1.amazonaws.com/prod-ucs-content-store-eu-west/content/pii:S1381116915301205/sc1/HIGHRES/image/gif/020ab81a1a2a44cd521d3c95d6dd4cd6/sc1_lrg.gif https://s3.amazonaws.com/prod-ucs-content-store-us-east/content/pii:S1381116915301205/sc1/HIGHRES/image/gif/020ab81a1a2a44cd521d3c95d6dd4cd6/sc1_lrg.gif sc1 sc1_lrg.gif gif 60645 1876 4667 IMAGE-HIGH-RES 1-s2.0-S1381116915301205-fx1_lrg.jpg https://s3-eu-west-1.amazonaws.com/prod-ucs-content-store-eu-west/content/pii:S1381116915301205/fx1/HIGHRES/image/jpeg/4a182cbe2cde7ccd4d2a25643a55d1af/fx1_lrg.jpg https://s3.amazonaws.com/prod-ucs-content-store-us-east/content/pii:S1381116915301205/fx1/HIGHRES/image/jpeg/4a182cbe2cde7ccd4d2a25643a55d1af/fx1_lrg.jpg fx1 true fx1_lrg.jpg jpg 118381 886 2213 IMAGE-HIGH-RES 1-s2.0-S1381116915301205-gr1_lrg.jpg https://s3-eu-west-1.amazonaws.com/prod-ucs-content-store-eu-west/content/pii:S1381116915301205/gr1/HIGHRES/image/jpeg/92a3f620ce8b85aede3831c1d5c9e38a/gr1_lrg.jpg https://s3.amazonaws.com/prod-ucs-content-store-us-east/content/pii:S1381116915301205/gr1/HIGHRES/image/jpeg/92a3f620ce8b85aede3831c1d5c9e38a/gr1_lrg.jpg gr1 gr1_lrg.jpg jpg 717867 2021 2500 IMAGE-HIGH-RES 1-s2.0-S1381116915301205-gr10_lrg.jpg https://s3-eu-west-1.amazonaws.com/prod-ucs-content-store-eu-west/content/pii:S1381116915301205/gr10/HIGHRES/image/jpeg/0b90ceeaf3207ab9b4167bf13e15f2cf/gr10_lrg.jpg https://s3.amazonaws.com/prod-ucs-content-store-us-east/content/pii:S1381116915301205/gr10/HIGHRES/image/jpeg/0b90ceeaf3207ab9b4167bf13e15f2cf/gr10_lrg.jpg gr10 gr10_lrg.jpg jpg 993505 2045 3333 IMAGE-HIGH-RES 1-s2.0-S1381116915301205-gr2_lrg.jpg https://s3-eu-west-1.amazonaws.com/prod-ucs-content-store-eu-west/content/pii:S1381116915301205/gr2/HIGHRES/image/jpeg/ba5014ee3c857fffde835e9ce0b40f4c/gr2_lrg.jpg https://s3.amazonaws.com/prod-ucs-content-store-us-east/content/pii:S1381116915301205/gr2/HIGHRES/image/jpeg/ba5014ee3c857fffde835e9ce0b40f4c/gr2_lrg.jpg gr2 gr2_lrg.jpg jpg 777448 2349 2917 IMAGE-HIGH-RES 1-s2.0-S1381116915301205-gr3_lrg.jpg https://s3-eu-west-1.amazonaws.com/prod-ucs-content-store-eu-west/content/pii:S1381116915301205/gr3/HIGHRES/image/jpeg/1908e5489d99c1f5b87e2fbc07a0b051/gr3_lrg.jpg https://s3.amazonaws.com/prod-ucs-content-store-us-east/content/pii:S1381116915301205/gr3/HIGHRES/image/jpeg/1908e5489d99c1f5b87e2fbc07a0b051/gr3_lrg.jpg gr3 gr3_lrg.jpg jpg 329914 2072 3000 IMAGE-HIGH-RES 1-s2.0-S1381116915301205-gr4_lrg.jpg https://s3-eu-west-1.amazonaws.com/prod-ucs-content-store-eu-west/content/pii:S1381116915301205/gr4/HIGHRES/image/jpeg/3e0ffb8a10db1ffb70ee8ed472d4814c/gr4_lrg.jpg https://s3.amazonaws.com/prod-ucs-content-store-us-east/content/pii:S1381116915301205/gr4/HIGHRES/image/jpeg/3e0ffb8a10db1ffb70ee8ed472d4814c/gr4_lrg.jpg gr4 gr4_lrg.jpg jpg 479724 2479 2917 IMAGE-HIGH-RES 1-s2.0-S1381116915301205-gr5_lrg.jpg https://s3-eu-west-1.amazonaws.com/prod-ucs-content-store-eu-west/content/pii:S1381116915301205/gr5/HIGHRES/image/jpeg/da73ea87aee5c2ace87a32f8dae9482b/gr5_lrg.jpg https://s3.amazonaws.com/prod-ucs-content-store-us-east/content/pii:S1381116915301205/gr5/HIGHRES/image/jpeg/da73ea87aee5c2ace87a32f8dae9482b/gr5_lrg.jpg gr5 gr5_lrg.jpg jpg 620686 2682 3333 IMAGE-HIGH-RES 1-s2.0-S1381116915301205-gr6_lrg.jpg https://s3-eu-west-1.amazonaws.com/prod-ucs-content-store-eu-west/content/pii:S1381116915301205/gr6/HIGHRES/image/jpeg/3677fadaca2ca5ecd31e64af8362534b/gr6_lrg.jpg https://s3.amazonaws.com/prod-ucs-content-store-us-east/content/pii:S1381116915301205/gr6/HIGHRES/image/jpeg/3677fadaca2ca5ecd31e64af8362534b/gr6_lrg.jpg gr6 gr6_lrg.jpg jpg 472366 2605 3333 IMAGE-HIGH-RES 1-s2.0-S1381116915301205-gr7_lrg.jpg https://s3-eu-west-1.amazonaws.com/prod-ucs-content-store-eu-west/content/pii:S1381116915301205/gr7/HIGHRES/image/jpeg/e37202f21970ebe3ac50948f581650ba/gr7_lrg.jpg https://s3.amazonaws.com/prod-ucs-content-store-us-east/content/pii:S1381116915301205/gr7/HIGHRES/image/jpeg/e37202f21970ebe3ac50948f581650ba/gr7_lrg.jpg gr7 gr7_lrg.jpg jpg 408655 931 3333 IMAGE-HIGH-RES 1-s2.0-S1381116915301205-gr8_lrg.jpg https://s3-eu-west-1.amazonaws.com/prod-ucs-content-store-eu-west/content/pii:S1381116915301205/gr8/HIGHRES/image/jpeg/4d908835703a8de7454d22d16c6878d2/gr8_lrg.jpg https://s3.amazonaws.com/prod-ucs-content-store-us-east/content/pii:S1381116915301205/gr8/HIGHRES/image/jpeg/4d908835703a8de7454d22d16c6878d2/gr8_lrg.jpg gr8 gr8_lrg.jpg jpg 475291 989 3333 IMAGE-HIGH-RES 1-s2.0-S1381116915301205-gr9_lrg.jpg https://s3-eu-west-1.amazonaws.com/prod-ucs-content-store-eu-west/content/pii:S1381116915301205/gr9/HIGHRES/image/jpeg/d4b6a83fd1f6f02baef63f0beb561795/gr9_lrg.jpg https://s3.amazonaws.com/prod-ucs-content-store-us-east/content/pii:S1381116915301205/gr9/HIGHRES/image/jpeg/d4b6a83fd1f6f02baef63f0beb561795/gr9_lrg.jpg gr9 gr9_lrg.jpg jpg 1127962 3078 2500 IMAGE-HIGH-RES MOLCAA 9658 S1381-1169(15)30120-5 10.1016/j.molcata.2015.10.015 Elsevier B.V. Scheme 1 Oxidation of cyclohexene in presence of supported Ag catalysts. Fig. 1 SEM images of (a) SiO2-P and (b) Co3O4-P using secondary electron imaging; (c) Ag/SiO2-P and (d) Ag/Co3O4-P using back-scatter detection mode. Fig. 2 (a) SEM image and (b) particle size distribution of Ag/SiO2-P; (c) SEM image and (d) particle size distribution of Ag/Co3O4-P. (Images were recorded using back-scatter detection mode.). Fig. 3 Nitrogen physisorption isotherms of (a) SiO2-M (b) Ag/SiO2-M (c) Co3O4-M (d) Ag/Co3O4-M. Fig. 4 XRD patterns of (a) SiO2-M (b) Ag/SiO2-M (c) Co3O4-M (d) Ag/Co3O4-M. Fig. 5 High resolution XPS scans of Ag/SiO2-P acquired using Al Kα line excitation (a) Ag, (b) Si, (c) O. Fig. 6 High resolution XPS scans of Ag/Co3O4-P acquired using Al Kα line excitation. (a) Ag, (b) Co, (c) O. Fig. 7 (A) Comparison of activity of different catalysts for cyclohexene oxidation# and (B) TOF values. #Reaction conditions: cyclohexene- 1mmol, H2O2- 2mmol, catalyst- 0.02g, acetonitrile-6g, temperature—80°C, time—24h. Fig. 8 (A) Cyclohexene oxidation using TBHP as oxidant* and (B) TOF values of the reactions. *Reaction conditions: cyclohexene—1mmol, TBHP—2mmol, catalyst—0.02g, acetonitrile—6g, temperature—80°C, time—24h. Fig. 9 (A) Effect of temperature on cyclohexene oxidation* and (B) TOF values of the reactions. *Reaction conditions: cyclohexene—2.4mmol, TBHP—4.8mmol, catalyst—0.02g, acetonitrile—6g, temperature—80°C, time—24h. Fig. 10 (A) Cyclohexene oxidation using Ag/SiO2-P and Ag/Co3O4-P with varying amounts# and (B) Corresponding TOF values of the reactions. #Reaction conditions: cyclohexene—2.4mmol, H2O2—4.8mmol, acetonitrile—6g, temperature—80°C, time—24h. Fig. 11 Illustrative mechanism for the conversion of cyclohexene to cyclohexene oxide. Fig. 12 Illustrative mechanism for the conversion of cyclohexene to cyclohexenone. Table 1 Textural properties derived from nitrogen physisorption and XRD. Sample BET surface area (m2/g) Mesopore volume (cm3/g) Total pore volume (cm3/g) BJH pore size (nm) Crystallite size (nm) SiO2 647 0.47 1.25 3.5 – Ag/SiO2 472 0.17 0.31 2.4 33 Co3O4 148 0.13 0.25 2–20 15 Ag/Co3O4 73 0.05 0.11 8–24 15–32 Table 2 The recycle studies of Ag/SiO2-P catalyst.$ Recycle Cyclohexene conversion (%) Selectivity (%) Cyclohexene oxide Cyclohexenone 1 63 67 33 2 61 68 32 3 60 67 33 $Reaction conditions: cyclohexene—2.4mmol, H2O2—4.8mmol, catalyst—0.02g, acetonitrile—6g, temperature—80°C, time—24h. Silver supported on hierarchically porous SiO2 and Co3O4 monoliths: Efficient heterogeneous catalyst for oxidation of cyclohexene Yasemin Hakat Trupti V. Kotbagi Martin G. Bakker ⁎ Department of Chemistry, The University of Alabama, Tuscaloosa, AL 35487-0336, USA Department of Chemistry The University of Alabama Tuscaloosa AL 35487-0336 USA ⁎ Corresponding author. Fax: +1 205 348 9104. Graphical abstract This study describes silver (Ag) nanoparticles supported on hierarchically porous SiO2 and Co3O4 monoliths and the use of these materials as heterogeneous catalysts for the oxidation of cyclohexene. Structural characterization of these materials was carried out by various techniques including scanning electron microscopy (SEM), N2 adsorption, X-ray diffraction (XRD), and X-ray photoelectron spectroscopy (XPS). Characterization results revealed that Ag nanoparticles were incorporated into hierarchically porous SiO2 and Co3O4 without significantly affecting the structures of the supports. The oxidation of cyclohexene was investigated for hierarchically porous Ag/SiO2 and Ag/Co3O4 monoliths and powdered forms of the catalysts using H2O2 as oxidant. Detailed parameters including the effect of temperature, oxidant, catalyst loading, and substrate to oxidant ratio were thoroughly studied. The catalyst was found to be stable and could be reused several times without affecting its catalytic activity under the optimized reaction conditions. Keywords Silver catalyst Cyclohexene oxide Hierarchically porous Oxidation Recyclable 1 Introduction There has been great interest during the past decade in improving heterogeneous catalysts by controlling the surface chemistry, crystal structure and shape, size, and by selection of suitable supports. In many cases enhanced catalytic activity can be obtained from nanomaterials due to their large surface area to volume ratio [1]. The catalytic activity of nanoparticles can be optimized with the use of supports that also make separation of the catalyst from the products much simpler as well as allowing for continuous production [2,3]. Metal containing metal oxide supports are used as catalysts in all fields of heterogeneous catalysis, including oil refining, fine chemical synthesis, pharmaceutical industry, and in production of pesticides, plant protection agents, epoxy paints, and rubber promoters [4]. Finding new catalysts remains highly desirable, particularly to address the increasing demand for sustainable and environmentally benign chemical feedstocks and processes [5–9]. Oxidation is one such important process that leads to a number of critical intermediates. Although homogeneous catalysts have higher activity in oxidation reactions, homogeneous catalytic systems have significant drawbacks in catalyst recovery and product separation. Therefore, heterogeneous catalyst systems with high activity, stability and reusability are of interest. In particular, the development of more active and selective heterogeneous catalysts for the epoxidation of olefins is an attractive topic. In general, epoxides can be prepared by the oxidation of the corresponding alkenes using an oxidant in the presence of metal and metal oxide catalysts. The use of heterogeneous catalysts is complemented by the use of continuous processes, particularly in the use of microreactors [10–15], which allow effective reaction optimization and production of small quantities of product. In such systems high accessible surface area is desirable in giving higher throughput. A particularly effective approach is hierarchically porous materials in which networks of mesopores (diameter 2–50nm) are connected by macropores (micrometer diameters) [16–22]. Such materials have recently been explored for use as monolithic microreactors in which a monolithic piece of the hierarchically porous material serves as the reactor [23–27]. For use in a continuous process the catalyst needs reasonable activity to enable a sufficient level of conversion to occur in a time scale compatible with a continuous process. To the best of our knowledge there has been no report of a monolithic microreactor for carrying out an epoxidation as a continuous process. This paper reports the first steps in developing such a catalyst. The aims of the present study are to (1) synthesize Ag supported on hierarchically porous monoliths of SiO2 and Co3O4, and to optimize the Ag material for cyclohexene oxidation, (2) investigate the catalytic performance of the prepared catalysts in the selective epoxidation of cyclohexene, in solution phase, and (3) determine the impact of using a whole monolith as catalyst compared to using the powdered form of the catalysts. 2 Experimental 2.1 Materials All chemicals used were commercially available and used as received. Tetraethylorthosilicate (TEOS, 96%), polyethylene glycol 35000 (PEG 35000g/mol), cobalt nitrate hexahydrate [Co(NO3)2.6H2O], potassium hydroxide (KOH), 30% nitric acid (HNO3), ammonium hydroxide (NH4OH), methanol, silver nitrate (AgNO3), hydrazine hydrate (N2H4·H2O), hydrogen peroxide (H2O2, 30% v/v), tert-butyl hydroperoxide (TBHP, 98%), acetonitrile and dichloromethane (DCM, 98%) were obtained from Sigma-Aldrich, St Louis, MO, USA. Octadecyltrimethylammonium bromide (C18TAB) was obtained from Genscript, USA. The assay of all the chemicals was >99% unless stated otherwise. 2.2 Synthesis of SiO2 monoliths The SiO2 monoliths were synthesized according to the procedure described by Sayler et al. [28]. In a typical synthesis, Tetraethylorthosilicate, 30% HNO3, deionized (DI) water, polyethylene glycol, and octadecyltrimethylammonium bromide were mixed in a 250mL beaker at a molar ratio of 1:0.26: 14.5:5.5×10−4:0.14, respectively. The resulting sol was transferred to molds and allowed to gel at 40°C for 24h, followed by treatment of the gel with 1M NH4OH at 90°C for 12h to increase the stability of the monoliths. The resulting monoliths were rinsed with DI water, three times with acetone and dried for 3 days at 40°C. Finally, the monoliths were calcined in air at 550°C for 5h with a heating rate of 1°C/min. 2.3 Synthesis of Co3O4 monolith replica The fully reproducible nanocrystalline Co3O4 replicas exhibiting hierarchically mesoporous structures were synthesized by a nanocasting method using the SiO2 monoliths as templates as reported earlier [28]. The SiO2 monoliths were impregnated with 4.5M solution of Co(NO3)2·6H2O by incipient wetness. The infiltrated SiO2 templates were heated at 150°C for 8h under nitrogen (N2) flow. This was followed by heating the monoliths at 250°C for 4h to convert the infiltrated Co(NO3)2·6H2O to Co3O4. The infiltration, heating, and decomposition processes were repeated three times to ensure the optimum filling of mesopores of the SiO2 templates. The SiO2 was subsequently etched using 4M KOH solution, followed by rinsing with methanol and DI water to ensure complete removal of residual hydroxide. 2.4 Synthesis of Ag supported on the SiO2 and Co3O4 catalysts Synthesis of Ag nanoparticles supported on the SiO2 and Co3O4 monoliths was performed by infiltrating 0.1M AgNO3 into SiO2 and Co3O4 monoliths, separately under vacuum at room temperature (RT). The impregnated monoliths were dried at 40°C for 8h. Finally, the reduction of the AgNO3 salt to metallic Ag was performed overnight under N2H4·H2O vapors at 35°C in a closed container containing the monoliths and a beaker of N2H4·H2O. The resultant catalysts are named as Ag/SiO2 and Ag/Co3O4. The properties of these new catalysts were compared with the Ag supported on monolithic SiO2 and Co3O4 catalysts reported in our previous work in which the reduction of the AgNO3 salt to metallic Ag was performed under ethylene glycol vapors at 160°C [26]. These catalysts will be denoted as Ag/SiO2-EG and Ag/Co3O4-EG. Powdered forms of the catalysts were prepared by grinding the monolithic form into powder. For the hydrazine reduced catalysts the suffixes ‘-M’ and ‘-P’ are used to denote the monolithic and powdered forms of the catalysts respectively. The monolithic forms of the hydrazine reduced Ag catalysts were used for gas sorption analysis and XRD, and the powdered forms for XPS and SEM analysis. 2.5 Catalyst characterization Scanning electron microscope (SEM) images of all the samples were taken on a JOEL 7000 FE-SEM (Tokyo, Japan) with diode based back-scatter electron detector equipped with an Oxford Energy Dispersive Spectroscopy (EDS) detector for elemental analysis. The amount of Ag loading on the respective supports was determined using the EDS accessory on the SEM JEOL 7000. ImageJ (version: 1.48v; National Institutes of Health: Bethesda, MD, USA, 1997) was used to carry out the determination of the particle sizes from the SEM images. The Nitrogen (N2) physisorption measurements were carried out on a Quantachrome Nova 2200e (Boynton Beach, FL) pore size analyzer at −197°C with He mode to determine the surface area and void volume of the monoliths, respectively. Isotherms were analyzed with Quantachrome NovaWin software version 11.1. Powder X-ray diffraction (XRD) patterns of the monoliths were obtained on a Bruker D8 Discover (Madison, WI) with GADDS (General Area Detector Diffraction System) (wavelength Co Kα, 1.79Å) and a Hi-Star area detector. The X-ray photoelectron spectroscopy (XPS) spectra were recorded using a Kratos Axis Ultra spectrometer employing unmonochromated Al Kα radiation (1486.6eV) operated at 15kV, 20mA under a pressure below 10−9 Pa to evaluate the compositions of each component in Ag/SiO2 and Ag/Co3O4 with analyzer pass energy of 20eV for elemental scans. Spectra were analyzed by first subtracting a Shirley background and then obtaining accurate peak positions by fitting the peaks using a mixed Gaussian/Lorentzian line shape. The loading of Ag on the monolithic supports was determined by leaching the silver from the monoliths overnight with aqua regia (concentrated nitric and hydrochloric acids in a 1:3 ratio) and determining the concentration of the Ag ions in the resultant solutions by Atomic Adsorption Spectrometry (Perkin Elmer AAnalyst 400). 2.6 Catalytic tests The liquid phase oxidation of cyclohexene was carried out in a 25mL two-necked round bottom flask charged with 1mmol of cyclohexene, 2mmol of oxidant, 6mL of acetonitrile, 0.02g of catalyst and a magnetic stir bar. The flask was fitted with a reflux condenser and immersed in a thermostatic oil bath at 80°C. The reaction assembly was placed on a magnetic stirrer and the reaction mixture was stirred vigorously for 24h. The samples were filtered and analyzed on a Varian GC model CP-3800 equipped with flame ionization detector (FID) and EC-5 column (length 30m×ID 0.25mm×film thickness 0.25μm). Product identification was carried out by injecting authentic samples into the GC and matching the retention times with those of the products formed in the reaction. The catalytic activity was compared to that of previously reported Ag/SiO2-EG and Ag/Co3O4-EG catalysts. The activity of the catalysts was compared using the respective monolithic and powdered forms of the catalysts. 2.7 Catalyst recycle studies The recycle studies were performed using Ag/SiO2-P as catalyst and H2O2 as oxidant. The recycle reactions were performed using the conditions described in Section 2.5. After 24h the reaction mixture was cooled and filtered. The residual catalyst was washed with acetonitrile followed by DCM and dried at 30°C for 4h. The flask was charged with fresh reaction feed for the consecutive runs and the final reaction mixtures were analyzed using GC. Three cycles were performed on the same catalyst to ensure the reusability of the catalyst. 2.8 Leaching studies After the catalytic reaction, the reaction mixture was cooled to RT and filtered. Quantitative analysis of the filtrate was performed to determine the Ag ion concentration using a Perkin Elmer AAnalyst 400 atomic absorption spectrophotometer. 3 Results and discussion 3.1 Scanning electron microscopic studies SEM images of all the samples are shown in Fig. 1 . The hierarchically porous nature of SiO2 can be clearly seen from the SEM images in Fig. 1a. Well-defined macropore networks are generated by SiO2 ligaments, where the ligaments are formed by agglomeration of smaller (mesoporous) particles. The SiO2 incorporates mesopores formed by the addition of the surfactant, C18TAB, during the synthesis. The particles are mesoporous having pores in the range 3–12nm (vide infra) and form 0.2–26μm macropores in both SiO2 and Co3O4. The SEM image of the macropores of the Co3O4 replica is shown in Fig. 1b. Less than 1wt% residual SiO2 was detected in the final Co3O4 replica as determined by EDS analysis, indicating good removal of the SiO2. The final Co3O4 monolith is a positive replica of the macropores from the parent SiO2, indicating the uniform infiltration of cobalt precursor through the interconnected walls of the SiO2. In Fig. 1c and d, the SEM images show the presence of Ag nanoparticles supported on the SiO2 and Co3O4 supports. Elements with higher atomic number back-scatter much more strongly than those with lower atomic number. Therefore, the bright particles can be identified as Ag nanoparticles. The Ag loadings on the SiO2 and Co3O4 estimated from EDS were consistent with loading of 3.8 and 3.0wt%, respectively determined by AAS. Fig. 2 gives the size distributions of the Ag nanoparticles determined by SEM for Ag/SiO2-P (Fig. 2a and b) and Ag/Co3O4-P (Fig. 2c and d). Using these particle size distributions the Ag surface area for Ag/SiO2-P was calculated to be 3.9×1015 nm2 and that for Ag/Co3O4-P was calculated to be 2.9×1015 nm2. In our previous work the Ag surface areas for Ag/SiO2 and Ag/Co3O4 were found to be 2.2×1015 nm2 and 1.7×1015 nm2, respectively [26]. Comparison shows that the use of hydrazine hydrate gives smaller particles, larger surface areas, and fewer agglomerates. 3.2 Textural characterization The N2 physisorption technique was used to measure the surface area and pore size to determine the textural properties of the materials. The extent of physisorption is shown in Fig. 3 and the textural properties are summarized in Table 1 . The shape of the isotherm depends on the porous texture and composition of the meso- and macropores in the catalysts. Typical Type IV hysteresis loops were observed for all the materials. In Fig. 3a, the SiO2 isotherm shows two regions of increased capillary condensation. The first in the lower relative pressure range due to the surfactant templated mesopores and the second is associated with the textural mesopores produced by particle agglomeration. The pore size of SiO2 from surfactant templated mesopores was measured to be around 3.5nm using the Barrett–Joyner–Halenda (BJH) method. The BET surface area of SiO2 was found to be 647m2/g. The surfactant templated mesopore volume and the total mesopore volume of SiO2 were determined to be 0.47cm3/g and 1.25cm3/g, respectively. In Fig. 3c, the isotherm for Co3O4 shows a gradual increase in adsorption over the whole pressure range, indicating a broad mesopore size distribution. The surface area of Co3O4 replica was lower than that of the parent SiO2. This might be attributed to the higher density of the Co3O4 (6.11g/cm3) compared to that of SiO2 (2.2g/cm3). The Co3O4 replica showed a surface area of 148m2/g, and mesopore volume and total pore volume were found to be 0.13cm3/g and 0.25cm3/g, respectively. The BJH pore size of Co3O4 was found to be in the range of 2–20nm. The broader range is consistent with the disordered nature of the mesopores of the SiO2 template. Nanocasting produces a negative replica of the SiO2 template in the mesopore range and so the variable wall thickness in the silica transforms into a variable mesopore diameter. Fig. 3b and d show the isotherms after incorporation of Ag nanoparticles onto the SiO2 and Co3O4 support. The monoliths show N2 uptake in the relative pressure range of 0.6–1 P/P0. The loss of N2 uptake in the range 0.35–0.45 P/P0 indicates that loading of Ag nanoparticles occurs in the mesopores and blocks the mesopores, which in turn prevents N2 uptake. It may also lead to some disruption of the SiO2 structure as the Ag nanoparticles exceed the diameter of the mesopores, similar to what has been observed with nickel oxide [29]. As observed previously Co3O4 had a lower surface area and pore volume than the parent SiO2, and addition of Ag nanoparticles decreased this further [26,30]. 3.3 X-ray diffraction studies Fig. 4 shows the XRD patterns of SiO2-M, Co3O4-M, Ag/SiO2-M and Ag/Co3O4-M composites. The amorphous nature of the SiO2 was observed from the XRD pattern as a broad diffraction peak at 2θ=25–30°, consistent with reported literature [31]. XRD analysis also confirmed the formation of pure, nanocrystalline Co3O4, with characteristic peaks corresponding to Co3O4 observed at 20°, 35°, 44°, 65°, 70°, and 86° respectively, for the (111), (220), (400), (440), (500), and (533) reflections of Co3O4. The XRD analysis of Ag/SiO2-M showed that even upon incorporation of Ag nanoparticles onto the SiO2 support, the SiO2 support retained its amorphous nature with a band centered at ∼25°. 45°, 53°, 60°C, 78°, and 93° from Ag/SiO2-M match the (200), (202), (220), (311), and (333) reflections of metallic Ag nanoparticles, and could be observed from both Ag/SiO2-M and also Ag/Co3O4-M. No peaks corresponding to the oxides of Ag were observed in either case. The crystallite size of Ag on both the supports was calculated using the Debye–Scherrer formula and given in Table 1. The crystallite sizes from Debye–Scherrer analysis are compatible with the Ag particle size determined from the SEM images. 3.4 X-ray photoelectron spectroscopy XPS analyses of each component in Ag/SiO2-P and Ag/Co3O4-P were carried out and the results are shown in Figs. 5 and 6 , respectively. The carbon C 1s peak at 284.6eV was used as a reference for the binding energy. In Fig. 5, it can be seen that the normal component of Ag/SiO2-P appeared as peaks of Si 2p, Ag 3d and O 1s. In Fig. 5a, the peaks with binding energies of 368.88 and 374.6eV prove the existence of metallic Ag corresponding to the Ag 3d5/2 and Ag 3d3/2 states of Ag, consistent with the values reported in the literature [32]. In Fig. 5b, the peak corresponding to O 1s with binding energy of 531.8eV corresponds to elemental ‘O’ in SiO2. Additionally, the peak for Si corresponding to Si 2p was seen at 102.8eV. XPS analysis was carried out on Ag/Co3O4-P and is shown in Fig. 6. High resolution scans indicated that the sample was composed of Ag, Co, and O. Fig. 6a shows binding energies of 367.90 and 373.8eV assigned to Ag 3d5/2 and Ag 3d3/2 showing the presence of metallic Ag. Two peaks located at binding energy values of about 779.8eV and 794.9eV are seen in Fig. 6b, were consistent with the values reported in the literature for Co 2p1/2 and Co 2p3/2 respectively [33]. From Fig. 6c, the broad peak at binding energy of 529.8eV was due to O 1s. Based on the XPS data, the studied samples were consistent with the compositions of the Ag/SiO2 and Ag/Co3O4 composites. 3.5 Catalytic activity The Ag/SiO2-EG and Ag/Co3O4-EG monoliths have been reported as promising heterogeneous catalysts for the hydrogenation of dyes under batch and flow conditions, respectively [26,30]. Supported Ag catalysts have been known as effective heterogeneous catalysts for the epoxidation of ethylene and propene [34,35]. Owing to the reported literature, the present work describes detailed parametric study for the oxidation of cyclohexene using Ag/SiO2 and Ag/Co3O4 catalysts as shown in Scheme 1 . The reactions were performed for 24h in order to attain maximum cyclohexene conversion. All the control reactions were carried out using H2O2 as an oxidant. The catalytic activities of monolithic and powdered Ag/SiO2 and Ag/Co3O4 were initially compared for the oxidation of cyclohexene with the activities of monolithic and powdered Ag/SiO2-EG and Ag/Co3O4-EG and the results are shown in Fig. 7 . The catalytic reactions were performed in triplicate to ensure the reproducibility of the results presented. The results clearly showed that Ag/SiO2 and Ag/Co3O4 have better catalytic activity for cyclohexene oxidation compared to that of the Ag/SiO2-EG and Ag/Co3O4-EG catalysts. Generally the powdered catalysts showed better conversion of cyclohexene than the monolithic form. The hierarchically porous nature of the monolithic catalysts is expected to give enhanced mass transport into the interior of the catalysts. However, the observation that the powdered catalysts give higher activity than the monolithic form indicates that stirring is likely insufficient to force the solution very effectively into the monoliths, with the result that there is effectively less accessible Ag surface area that for the powdered catalysts. It is not surprising that mass transport in the stirred solution should be faster than mass transport through the macropores in the monolith where mass tranport will be close to diffusion limited unless solution is forced through the macropores. Irrespective of the form and support of the catalysts, in all the cases only two oxidation products, cyclohexene oxide and cyclohexenone, were observed. Cyclohexene conversion of 21% and 16% was obtained in presence of Ag/SiO2-EG-M and Ag/Co3O4-EG-M as catalysts with 53% and 51% selectivity for cyclohexene oxide, respectively. The conversion of cyclohexene was observed to increase considerably when Ag/SiO2-EG-P and Ag/Co3O4-EG-P were used as catalysts with maximum selectivity of 58% and 59% for cyclohexene oxide, respectively. The remaining product was cyclohexenone. However, an appreciable increase in the conversion of cyclohexene was observed when Ag/SiO2 and Ag/Co3O4 catalysts were used. High cyclohexene conversions of 63% and 60% were achieved when Ag/SiO2-P and Ag/Co3O4-P were used and 67% and 64% selectivity for cyclohexene oxide, respectively. Turnover frequencies (TOFs) of 9h−1 and 11h−1 for Ag/SiO2-P and Ag/ Co3O4-P were found. A considerable drop in activity with 44% and 38% cyclohexene conversion was observed with 48% and 59% selectivity for cyclohexene oxide, respectively, when Ag/SiO2-M and Ag/Co3O4-M were used as catalysts. To confirm that the reaction seen is truly catalyzed by Ag, the cyclohexene oxidation was performed using pristine SiO2-P and Co3O4-P catalysts under the same operating conditions as that of Ag-based catalysts described above. Very low cyclohexene conversions of around 9% and 12% were obtained in these cases, respectively. In both the cases cyclohexene oxide was formed with selectivity >95% proving the non-catalytic nature of the SiO2 and Co3O4 supports themselves. These observations were in agreement with the results obtained from cyclohexene oxidation using H2O2 as an oxidant but in absence of catalyst to evaluate the extent of auto-oxidation. Only 7% conversion of cyclohexene was attained with 100% selectivity for cyclohexene oxide. This clearly establishes that Ag based catalysts play a significant role in the high conversion of the substrate with formation of the two different products. Control experiments were performed in order to obtain better insight into the parameters affecting the catalytic activity of Ag/SiO2 and Ag/Co3O4 catalysts. The effect of oxidant was studied by carrying out the oxidation using TBHP as an oxidant. The results are shown in Fig. 8 . Little difference was seen in the extent of conversion or the selectivity when the oxidant was changed from H2O2 to TBHP with no effect on the selectivity pattern of the products as seen when H2O2 was used as oxidant showing that there is no favorable or adverse effect of the oxidizing agent on the activity of the hierarchically porous Ag/SiO2 and Ag/Co3O4 catalysts. The effect of reaction temperature was studied in the temperature window of 40–80°C using the Ag/SiO2-P and Ag/Co3O4-P catalysts and the results can be seen in Fig. 9 . It was seen that cyclohexene conversion and selectivity of cyclohexene oxide drastically decreased with decreasing reaction temperature from 80°C to 40°C. Along with the decrease in conversion of cyclohexene, a decrease in the selectivity of cyclohexene oxide was observed. At 40°C, cyclohexene conversion of 39% and 35% was observed with 52% and 47% selectivity for cyclohexene oxide using Ag/SiO2-P and Ag/Co3O4-P catalysts, respectively. The cyclohexene conversion and cyclohexene oxide selectivity gradually increased at 60°C and reached optimum values at 80°C clearly suggesting that the substrate conversion and selectivity of cyclohexene oxide is thermally favored. The effect of catalyst amount was further evaluated by maintaining the reaction temperature at 80°C using Ag/SiO2-P and Ag/Co3O4-P catalysts. The catalyst amount was increased in the range of 0.04g–0.32g and the observations are presented in Fig. 10 . Interestingly, the cyclohexene conversion increased from 63% to 79% for Ag/SiO2-P and 60% to 70% for Ag/Co3O4-P, respectively, when the amount of catalyst was increased from 0.04g to 0.32g. Not much change in the conversion was observed with catalyst amount in the range of 0.04g to 0.32g. However, in all the cases a significant increase in the selectivity for cyclohexene oxide was observed with increase in the amount of catalyst. This shows that the amount of catalyst can be optimized to obtain the desired product. The substrate to oxidant ratio was another important parameter affecting the cyclohexene conversion and the selectivities of the products. By fixing all the parameters such as substrate amount, catalyst (Ag/SiO2-P), catalyst amount, temperature and solvent; the effect of amount of H2O2 was studied over a range of substrate to oxidant mole ratios. An equimolar ratio of cyclohexene to H2O2 led to only 23% conversion of cyclohexene with very high selectivity of 73% for cyclohexene oxide. Cyclohexene conversion increased up to 71% at a cyclohexene: H2O2 molar ratio of 1:4 but with a decreased (66%) selectivity for cyclohexene oxide. 3.6 Catalyst recycle studies Based on the experimental observations, the powdered Ag/SiO2-P has shown the most promising catalytic activity giving a high conversion of cyclohexene and high cyclohexene oxide selectivity under the optimized reaction conditions; therefore it was selected as the standard catalyst for recycle studies keeping the other reaction parameters constant. The results are given in Table 2 . The catalytic activity of Ag/SiO2-P was consistent throughout the three recycle runs with a negligible reduction in the conversion and cyclohexene oxide selectivity which might be due to the handling losses of the catalyst during filtration and washing, thus indicating high stability and the efficiency of the catalyst even after three cycles without a significant loss in the activity. 3.7 Leaching studies Leaching studies were conducted to determine if the active phase of the catalyst leaches into the organic phase during the reaction to complement the results from the recycle studies of the catalyst. After the catalytic reactions using Ag/SiO2-P and Ag/Co3O4-P catalysts, the solid catalysts and the final reaction mixture were separated by filtration. The respective filtrates showed ∼0.8 and 0.6% presence of Ag, respectively, from AAS analyses, indicating limited Ag leaching. 4 Discussion The present study showed the role of Ag based catalysts in formation of two different products- cyclohexene oxide and cyclohexenone. A small part of the cyclohexene oxide product is produced by a homogeneous reaction, however the bulk of the products are formed by a pathway that includes Ag. These products might be forming via two different mechanistic pathways which are illustrated in Figs. 11 and 12 . For cyclohexene oxide formation over Ag using O2 as oxidant it is reported that oxygen adatoms (O(ad)) form, and that these O(ad) atoms are weakly bound, favoring formation of the epoxide [36]. These observations suggest the conversion of cyclohexene to its respective oxide as shown in Fig. 11, with the cleavage of H2O2 followed by the loss of surface hydrogen to give water and an oxygen adatom (O(ad)) which then adds to the double bond to give cyclohexene oxide. The conversion of cyclohexene to cyclohexenone might occur through a free radical mechanism as outlined in Fig. 12, in which hydrogen abstraction from the cyclohexene occurs at the thermodynamically more stable a position [37]. Free radical addition to give the hydroperoxide, followed by an intramolecular rearrangement gives the cyclohexenone. This route is analogous to that proposed by formation of acrolein in the epoxidation of propylene [35] and is consistent with the activation of the CH bond in the presence of Ag or Au based-catalysts to form ketones [38]. The comparative studies of the catalytic activities of Ag/SiO2 and Ag/Co3O4 synthesized by the two different routes show a clear difference in extent of conversion and selectivity. The catalysts synthesized using hydrazine hydrate reduction lead to higher conversion efficiency and somewhat higher selectivity for cyclohexane oxide. This is likely to be a result simply of the smaller average particle size of metal and higher surface area for the hydrazine hydrate reduced catalysts. This reduction is carried out at a relatively low temperature (35 °C vs. 165 °C typical for the ethylene glycol), which would decrease the extent of sintering and grain growth. This is born out in the size distributions for the Ag nanoparticles that give significantly smaller particles using hydrazine hydrate with a larger surface area. The lower activity seen for the ethylene glycol reduced catalysts is therefore consistent with the lower surface area of the catalyst. Only a small difference was seen between the results from Ag/SiO2 and Ag/Co3O4. The TOF’s observed for Ag/Co3O4 were a little higher than those observed for Ag/SiO2, despite the fact that the Ag surface area calculated from SEM was somewhat higher on SiO2 compared with Co3O4. This would suggest that the Co3O4 the support may play some role in the catalysis. 5 Conclusions Silver nanoparticles supported on hierarchically porous SiO2 and Co3O4 monoliths were found to be active as heterogeneous catalysts for oxidation of cyclohexene to cyclohexene oxide accompanied by formation of cyclohexenone as a minor product. Other possible products were not observed. The extent of reaction was found to follow the silver surface area, with higher silver surface area giving higher activity. A small increase in TOF was observed when Co3O4 was the support compared to SiO2 suggesting that there may be a minor impact of the support. The extent of reaction and the selectivity also appeared to be relatively independent of the nature of the oxidant, with hydrogen peroxide and t-butyl peroxide giving similar conversions. Although the activity of the catalyst found in this study is not yet high enough to be practical for a continuous process, the observation that activity is related to higher surface area suggests that if the average silver nanoparticle size can be significantly reduced the increased activity may be sufficient to allow for a continuous process. Conflicts of interest None. Acknowledgements The authors acknowledge the Central Analytical Facility (CAF) at the University of Alabama for support and technical assistance. A seed grant from the CAF The University of Alabama is acknowledged, the required cost match for which was provided by the Bakker Research Gift fund. TVK acknowledges the Research Simulation program for support. References [1] D. Astruc Nanoparticles and Catalysis 2008 Wiley-VCH Weinheim pp. 640 [2] K. Foger, J.R. Anderson, M. Boudart, (Eds.), Catalysis, 1984, Spring, Berlin, Vol. 6, 227–303. [3] H. Knozinger E. Taglauer Handbook of Heterogeneous Catalysis G. Ertl H. Knozinger F. Schuth J. Weitkamp 2008 Wiley-VCH Darmstadt 555 571 [4] U. Dingerdissen A. Martin D. Herein H.J. Wernicke Handbook of Heterogeneous Catalysis G. Ertl H. Knozinger F. Schuth J. Weitkamp 2008 Wiley-VCH Weinheim 37 56 [5] A.J. Ragauskas C.K. Williams B.H. Davison G. Britovsek J. Cairney C.A. Eckert J. Frederick J. William J.P. Hallett D.J. Leak C.L. Liotta J.R. Mielenz R. Murphy R. Templer T. Tschaplinski Science 301 2006 484 489 [6] J.N. Chheda G.W. Huber J.A. Dumesic Angew. Chem. Int. Ed. 46 2007 7164 7183 [7] A. Corma S. Iborra A. Velty Chem. Rev. 107 2007 2411 2502 [8] J.J. Bozell G.R. Petersen Green Chem. 12 2009 539 554 [9] P. Gallezot Chem. Soc. Rev. 41 2012 1538 1558 [10] K. Jahnisch V. Hessel H. Löwe M. Baerns Angew. Chem. Int. Ed. 43 2004 406 446 [11] R.L. Hartman J.P. McMullen K.F. Jensen Angew. Chem. Int. Ed. 50 2011 7502 7519 [12] P.T. Baraldi V. Hessel Green Process Synth. 1 2012 149 167 [13] P. Watts C. Wiles J. Chem. Res. 36 2012 181 193 [14] M. Escriba A.O. Ibhadon Recent Patents Catal. 2 2013 101 115 [15] T. Wirth Microreactors in Organic Chemistry and Catalysis 2013 Wiley-VCH Verlag New York pp. 478 [16] K. Nakanishi J. Porous Mat. 4 1997 67 112 [17] K. Nakanishi Hierarchically Structured Porous Materials: From Nanoscience to Catalysis, Separation, Optic, Energy, and Life Science S. Bao-Lian C. Sanchez Y. Xiao-Yu 2012 Wiley-VCH Verlag New York 241 267 [18] Z.-Y. Yuan B.-L. Su J. Mater. Chem. 16 2006 663 677 [19] A. Stein F. Li N.R. Denny Chem. Mater. 20 2008 649 666 [20] P. Colombo C. Vakifahmetoglu S. Costacurta J. Mater. Sci. 45 2010 5425 5455 [21] C.M.A. Parlett K. Wilson A.F. Lee Chem. Soc. Rev. 42 2013 3876 3893 [22] M. Numata R. Takahashi I. Yamada K. Nakanishi S. Sato Appl. Catal. A 383 2010 66 72 [23] A. Sachse V. Hulea A. Finiels B. Coq F. Fajula A. Galarneau J. Catal. 287 2012 62 67 [24] A. Drozdz A. Chroboka S. Baj K. Szymanska J. Mrowiec-Białon A.B. Jarzebski Appl. Catal. A 467 2013 163 170 [25] K. Szymanska W. Pudło J. Mrowiec-Białon A. Czardybon J. Kocurek A.B. Jarzebski Microporous Mesoporous Mater. 170 2013 75 82 [26] Y. Hakat T.V. Kotbagi M.G. Bakker Processes 3 2015 98 112 [27] A. Koreniuk K. Maresz K. Odrozek A.B. Jarzebski J. Mrowiec-Białon Appl. Catal. A 489 2015 203 208 [28] F.M. Sayler A.J. Grano J.-H. Smått M. Lindén M.G. Bakker Microporous Mesoporous Mater. 184 2014 141 150 [29] A.J. Grano F.M. Sayler J.-H. Smatt M.G. Bakker Mater. Lett. 111 2013 154 157 [30] Y. Hakat T.V. Kotbagi M.G. Bakker Curr. Catal. 3 2014 286 295 [31] S.B. Umbarkar T.V. Kotbagi A.V. Biradar R. Pasricha J. Chanale M.K. Dongare A.-S. Mamede C. Lancelot E. Payen J. Mol. Catal. A 310 2009 150 158 [32] Y. Sohn J. Mol. Catal. A 379 2013 59 67 [33] J.H. Baek J.Y. Park A.R. Hwang Y.C. Kang B. Kor Chem. Soc. 33 2012 1242 1246 [34] J.G. Serafin A.C. Liu S.R. Seyedmonir J. Mol. Catal. A 131 1998 157 168 [35] T. Alexander Nijhuis Michiel Makkee A. Jacob Moulijn B.M. Weckhuysen Ind. Eng. Chem. Res. 45 2006 3447 3459 [36] E.A. Carter W.A. Goddard III J. Catal. 112 1988 80 92 [37] H. Sun C.K. Law J. Phys. Chem. A 114 2010 12088 12098 [38] M.E. Ali M.M. Rahman S.M. Sarkar S.B.A. Hamid J. Nanomater. 2014 pp23 Article ID 192038",
      "scopus-id": "84945266256",
      "coredata": {
        "eid": "1-s2.0-S1381116915301205",
        "dc:description": "This study describes silver (Ag) nanoparticles supported on hierarchically porous SiO2 and Co3O4 monoliths and the use of these materials as heterogeneous catalysts for the oxidation of cyclohexene. Structural characterization of these materials was carried out by various techniques including scanning electron microscopy (SEM), N2 adsorption, X-ray diffraction (XRD), and X-ray photoelectron spectroscopy (XPS). Characterization results revealed that Ag nanoparticles were incorporated into hierarchically porous SiO2 and Co3O4 without significantly affecting the structures of the supports. The oxidation of cyclohexene was investigated for hierarchically porous Ag/SiO2 and Ag/Co3O4 monoliths and powdered forms of the catalysts using H2O2 as oxidant. Detailed parameters including the effect of temperature, oxidant, catalyst loading, and substrate to oxidant ratio were thoroughly studied. The catalyst was found to be stable and could be reused several times without affecting its catalytic activity under the optimized reaction conditions.",
        "openArchiveArticle": "false",
        "prism:coverDate": "2016-01-31",
        "openaccessUserLicense": null,
        "prism:aggregationType": "Journal",
        "prism:url": "https://api.elsevier.com/content/article/pii/S1381116915301205",
        "dc:creator": [
          {
            "@_fa": "true",
            "$": "Hakat, Yasemin"
          },
          {
            "@_fa": "true",
            "$": "Kotbagi, Trupti V."
          },
          {
            "@_fa": "true",
            "$": "Bakker, Martin G."
          }
        ],
        "link": [
          {
            "@_fa": "true",
            "@rel": "self",
            "@href": "https://api.elsevier.com/content/article/pii/S1381116915301205"
          },
          {
            "@_fa": "true",
            "@rel": "scidir",
            "@href": "https://www.sciencedirect.com/science/article/pii/S1381116915301205"
          }
        ],
        "dc:format": "application/json",
        "openaccessType": null,
        "pii": "S1381-1169(15)30120-5",
        "prism:volume": "411",
        "prism:publisher": "Elsevier B.V.",
        "dc:title": "Silver supported on hierarchically porous SiO2 and Co3O4 monoliths: Efficient heterogeneous catalyst for oxidation of cyclohexene",
        "prism:copyright": "Copyright © 2015 Elsevier B.V. All rights reserved.",
        "openaccess": "0",
        "prism:issn": "13811169",
        "dcterms:subject": [
          {
            "@_fa": "true",
            "$": "Silver catalyst"
          },
          {
            "@_fa": "true",
            "$": "Cyclohexene oxide"
          },
          {
            "@_fa": "true",
            "$": "Hierarchically porous"
          },
          {
            "@_fa": "true",
            "$": "Oxidation"
          },
          {
            "@_fa": "true",
            "$": "Recyclable"
          }
        ],
        "openaccessArticle": "false",
        "prism:publicationName": "Journal of Molecular Catalysis A: Chemical",
        "openaccessSponsorType": null,
        "prism:pageRange": "61-71",
        "prism:endingPage": "71",
        "pubType": "fla",
        "prism:coverDisplayDate": "January 2016",
        "prism:doi": "10.1016/j.molcata.2015.10.015",
        "prism:startingPage": "61",
        "dc:identifier": "doi:10.1016/j.molcata.2015.10.015",
        "openaccessSponsorName": null
      },
      "objects": {
        "object": [
          {
            "@category": "thumbnail",
            "@height": "88",
            "@width": "219",
            "@_fa": "true",
            "$": "https://api.elsevier.com/content/object/eid/1-s2.0-S1381116915301205-fx1.sml?httpAccept=%2A%2F%2A",
            "@multimediatype": "GIF image file",
            "@type": "IMAGE-THUMBNAIL",
            "@size": "4699",
            "@ref": "fx1",
            "@mimetype": "image/gif"
          },
          {
            "@category": "thumbnail",
            "@height": "164",
            "@width": "203",
            "@_fa": "true",
            "$": "https://api.elsevier.com/content/object/eid/1-s2.0-S1381116915301205-gr1.sml?httpAccept=%2A%2F%2A",
            "@multimediatype": "GIF image file",
            "@type": "IMAGE-THUMBNAIL",
            "@size": "36860",
            "@ref": "gr1",
            "@mimetype": "image/gif"
          },
          {
            "@category": "thumbnail",
            "@height": "134",
            "@width": "219",
            "@_fa": "true",
            "$": "https://api.elsevier.com/content/object/eid/1-s2.0-S1381116915301205-gr10.sml?httpAccept=%2A%2F%2A",
            "@multimediatype": "GIF image file",
            "@type": "IMAGE-THUMBNAIL",
            "@size": "18316",
            "@ref": "gr10",
            "@mimetype": "image/gif"
          },
          {
            "@category": "thumbnail",
            "@height": "163",
            "@width": "203",
            "@_fa": "true",
            "$": "https://api.elsevier.com/content/object/eid/1-s2.0-S1381116915301205-gr2.sml?httpAccept=%2A%2F%2A",
            "@multimediatype": "GIF image file",
            "@type": "IMAGE-THUMBNAIL",
            "@size": "26280",
            "@ref": "gr2",
            "@mimetype": "image/gif"
          },
          {
            "@category": "thumbnail",
            "@height": "151",
            "@width": "219",
            "@_fa": "true",
            "$": "https://api.elsevier.com/content/object/eid/1-s2.0-S1381116915301205-gr3.sml?httpAccept=%2A%2F%2A",
            "@multimediatype": "GIF image file",
            "@type": "IMAGE-THUMBNAIL",
            "@size": "14648",
            "@ref": "gr3",
            "@mimetype": "image/gif"
          },
          {
            "@category": "thumbnail",
            "@height": "164",
            "@width": "193",
            "@_fa": "true",
            "$": "https://api.elsevier.com/content/object/eid/1-s2.0-S1381116915301205-gr4.sml?httpAccept=%2A%2F%2A",
            "@multimediatype": "GIF image file",
            "@type": "IMAGE-THUMBNAIL",
            "@size": "18821",
            "@ref": "gr4",
            "@mimetype": "image/gif"
          },
          {
            "@category": "thumbnail",
            "@height": "164",
            "@width": "204",
            "@_fa": "true",
            "$": "https://api.elsevier.com/content/object/eid/1-s2.0-S1381116915301205-gr5.sml?httpAccept=%2A%2F%2A",
            "@multimediatype": "GIF image file",
            "@type": "IMAGE-THUMBNAIL",
            "@size": "14507",
            "@ref": "gr5",
            "@mimetype": "image/gif"
          },
          {
            "@category": "thumbnail",
            "@height": "164",
            "@width": "210",
            "@_fa": "true",
            "$": "https://api.elsevier.com/content/object/eid/1-s2.0-S1381116915301205-gr6.sml?httpAccept=%2A%2F%2A",
            "@multimediatype": "GIF image file",
            "@type": "IMAGE-THUMBNAIL",
            "@size": "14879",
            "@ref": "gr6",
            "@mimetype": "image/gif"
          },
          {
            "@category": "thumbnail",
            "@height": "61",
            "@width": "219",
            "@_fa": "true",
            "$": "https://api.elsevier.com/content/object/eid/1-s2.0-S1381116915301205-gr7.sml?httpAccept=%2A%2F%2A",
            "@multimediatype": "GIF image file",
            "@type": "IMAGE-THUMBNAIL",
            "@size": "12335",
            "@ref": "gr7",
            "@mimetype": "image/gif"
          },
          {
            "@category": "thumbnail",
            "@height": "65",
            "@width": "219",
            "@_fa": "true",
            "$": "https://api.elsevier.com/content/object/eid/1-s2.0-S1381116915301205-gr8.sml?httpAccept=%2A%2F%2A",
            "@multimediatype": "GIF image file",
            "@type": "IMAGE-THUMBNAIL",
            "@size": "12340",
            "@ref": "gr8",
            "@mimetype": "image/gif"
          },
          {
            "@category": "thumbnail",
            "@height": "164",
            "@width": "133",
            "@_fa": "true",
            "$": "https://api.elsevier.com/content/object/eid/1-s2.0-S1381116915301205-gr9.sml?httpAccept=%2A%2F%2A",
            "@multimediatype": "GIF image file",
            "@type": "IMAGE-THUMBNAIL",
            "@size": "21071",
            "@ref": "gr9",
            "@mimetype": "image/gif"
          },
          {
            "@category": "thumbnail",
            "@height": "59",
            "@width": "219",
            "@_fa": "true",
            "$": "https://api.elsevier.com/content/object/eid/1-s2.0-S1381116915301205-gr11.sml?httpAccept=%2A%2F%2A",
            "@multimediatype": "GIF image file",
            "@type": "IMAGE-THUMBNAIL",
            "@size": "3461",
            "@ref": "gr11",
            "@mimetype": "image/gif"
          },
          {
            "@category": "thumbnail",
            "@height": "48",
            "@width": "219",
            "@_fa": "true",
            "$": "https://api.elsevier.com/content/object/eid/1-s2.0-S1381116915301205-gr12.sml?httpAccept=%2A%2F%2A",
            "@multimediatype": "GIF image file",
            "@type": "IMAGE-THUMBNAIL",
            "@size": "3050",
            "@ref": "gr12",
            "@mimetype": "image/gif"
          },
          {
            "@category": "thumbnail",
            "@height": "88",
            "@width": "219",
            "@_fa": "true",
            "$": "https://api.elsevier.com/content/object/eid/1-s2.0-S1381116915301205-sc1.sml?httpAccept=%2A%2F%2A",
            "@multimediatype": "GIF image file",
            "@type": "IMAGE-THUMBNAIL",
            "@size": "4099",
            "@ref": "sc1",
            "@mimetype": "image/gif"
          },
          {
            "@category": "standard",
            "@height": "152",
            "@width": "565",
            "@_fa": "true",
            "$": "https://api.elsevier.com/content/object/eid/1-s2.0-S1381116915301205-gr11.gif?httpAccept=%2A%2F%2A",
            "@multimediatype": "GIF image file",
            "@type": "IMAGE-DOWNSAMPLED",
            "@size": "10719",
            "@ref": "gr11",
            "@mimetype": "image/gif"
          },
          {
            "@category": "standard",
            "@height": "124",
            "@width": "565",
            "@_fa": "true",
            "$": "https://api.elsevier.com/content/object/eid/1-s2.0-S1381116915301205-gr12.gif?httpAccept=%2A%2F%2A",
            "@multimediatype": "GIF image file",
            "@type": "IMAGE-DOWNSAMPLED",
            "@size": "9127",
            "@ref": "gr12",
            "@mimetype": "image/gif"
          },
          {
            "@category": "standard",
            "@height": "212",
            "@width": "527",
            "@_fa": "true",
            "$": "https://api.elsevier.com/content/object/eid/1-s2.0-S1381116915301205-sc1.gif?httpAccept=%2A%2F%2A",
            "@multimediatype": "GIF image file",
            "@type": "IMAGE-DOWNSAMPLED",
            "@size": "11935",
            "@ref": "sc1",
            "@mimetype": "image/gif"
          },
          {
            "@category": "standard",
            "@height": "200",
            "@width": "500",
            "@_fa": "true",
            "$": "https://api.elsevier.com/content/object/eid/1-s2.0-S1381116915301205-fx1.jpg?httpAccept=%2A%2F%2A",
            "@multimediatype": "JPEG image file",
            "@type": "IMAGE-DOWNSAMPLED",
            "@size": "15889",
            "@ref": "fx1",
            "@mimetype": "image/jpeg"
          },
          {
            "@category": "standard",
            "@height": "457",
            "@width": "565",
            "@_fa": "true",
            "$": "https://api.elsevier.com/content/object/eid/1-s2.0-S1381116915301205-gr1.jpg?httpAccept=%2A%2F%2A",
            "@multimediatype": "JPEG image file",
            "@type": "IMAGE-DOWNSAMPLED",
            "@size": "109290",
            "@ref": "gr1",
            "@mimetype": "image/jpeg"
          },
          {
            "@category": "standard",
            "@height": "462",
            "@width": "753",
            "@_fa": "true",
            "$": "https://api.elsevier.com/content/object/eid/1-s2.0-S1381116915301205-gr10.jpg?httpAccept=%2A%2F%2A",
            "@multimediatype": "JPEG image file",
            "@type": "IMAGE-DOWNSAMPLED",
            "@size": "98232",
            "@ref": "gr10",
            "@mimetype": "image/jpeg"
          },
          {
            "@category": "standard",
            "@height": "531",
            "@width": "659",
            "@_fa": "true",
            "$": "https://api.elsevier.com/content/object/eid/1-s2.0-S1381116915301205-gr2.jpg?httpAccept=%2A%2F%2A",
            "@multimediatype": "JPEG image file",
            "@type": "IMAGE-DOWNSAMPLED",
            "@size": "103872",
            "@ref": "gr2",
            "@mimetype": "image/jpeg"
          },
          {
            "@category": "standard",
            "@height": "468",
            "@width": "678",
            "@_fa": "true",
            "$": "https://api.elsevier.com/content/object/eid/1-s2.0-S1381116915301205-gr3.jpg?httpAccept=%2A%2F%2A",
            "@multimediatype": "JPEG image file",
            "@type": "IMAGE-DOWNSAMPLED",
            "@size": "54059",
            "@ref": "gr3",
            "@mimetype": "image/jpeg"
          },
          {
            "@category": "standard",
            "@height": "560",
            "@width": "659",
            "@_fa": "true",
            "$": "https://api.elsevier.com/content/object/eid/1-s2.0-S1381116915301205-gr4.jpg?httpAccept=%2A%2F%2A",
            "@multimediatype": "JPEG image file",
            "@type": "IMAGE-DOWNSAMPLED",
            "@size": "79152",
            "@ref": "gr4",
            "@mimetype": "image/jpeg"
          },
          {
            "@category": "standard",
            "@height": "606",
            "@width": "753",
            "@_fa": "true",
            "$": "https://api.elsevier.com/content/object/eid/1-s2.0-S1381116915301205-gr5.jpg?httpAccept=%2A%2F%2A",
            "@multimediatype": "JPEG image file",
            "@type": "IMAGE-DOWNSAMPLED",
            "@size": "77967",
            "@ref": "gr5",
            "@mimetype": "image/jpeg"
          },
          {
            "@category": "standard",
            "@height": "589",
            "@width": "753",
            "@_fa": "true",
            "$": "https://api.elsevier.com/content/object/eid/1-s2.0-S1381116915301205-gr6.jpg?httpAccept=%2A%2F%2A",
            "@multimediatype": "JPEG image file",
            "@type": "IMAGE-DOWNSAMPLED",
            "@size": "69486",
            "@ref": "gr6",
            "@mimetype": "image/jpeg"
          },
          {
            "@category": "standard",
            "@height": "210",
            "@width": "753",
            "@_fa": "true",
            "$": "https://api.elsevier.com/content/object/eid/1-s2.0-S1381116915301205-gr7.jpg?httpAccept=%2A%2F%2A",
            "@multimediatype": "JPEG image file",
            "@type": "IMAGE-DOWNSAMPLED",
            "@size": "55861",
            "@ref": "gr7",
            "@mimetype": "image/jpeg"
          },
          {
            "@category": "standard",
            "@height": "223",
            "@width": "753",
            "@_fa": "true",
            "$": "https://api.elsevier.com/content/object/eid/1-s2.0-S1381116915301205-gr8.jpg?httpAccept=%2A%2F%2A",
            "@multimediatype": "JPEG image file",
            "@type": "IMAGE-DOWNSAMPLED",
            "@size": "61283",
            "@ref": "gr8",
            "@mimetype": "image/jpeg"
          },
          {
            "@category": "standard",
            "@height": "696",
            "@width": "565",
            "@_fa": "true",
            "$": "https://api.elsevier.com/content/object/eid/1-s2.0-S1381116915301205-gr9.jpg?httpAccept=%2A%2F%2A",
            "@multimediatype": "JPEG image file",
            "@type": "IMAGE-DOWNSAMPLED",
            "@size": "147058",
            "@ref": "gr9",
            "@mimetype": "image/jpeg"
          },
          {
            "@category": "high",
            "@height": "1347",
            "@width": "5000",
            "@_fa": "true",
            "$": "https://api.elsevier.com/content/object/eid/1-s2.0-S1381116915301205-gr11_lrg.gif?httpAccept=%2A%2F%2A",
            "@multimediatype": "GIF image file",
            "@type": "IMAGE-HIGH-RES",
            "@size": "51910",
            "@ref": "gr11",
            "@mimetype": "image/gif"
          },
          {
            "@category": "high",
            "@height": "1097",
            "@width": "5000",
            "@_fa": "true",
            "$": "https://api.elsevier.com/content/object/eid/1-s2.0-S1381116915301205-gr12_lrg.gif?httpAccept=%2A%2F%2A",
            "@multimediatype": "GIF image file",
            "@type": "IMAGE-HIGH-RES",
            "@size": "43712",
            "@ref": "gr12",
            "@mimetype": "image/gif"
          },
          {
            "@category": "high",
            "@height": "1876",
            "@width": "4667",
            "@_fa": "true",
            "$": "https://api.elsevier.com/content/object/eid/1-s2.0-S1381116915301205-sc1_lrg.gif?httpAccept=%2A%2F%2A",
            "@multimediatype": "GIF image file",
            "@type": "IMAGE-HIGH-RES",
            "@size": "60645",
            "@ref": "sc1",
            "@mimetype": "image/gif"
          },
          {
            "@category": "high",
            "@height": "886",
            "@width": "2213",
            "@_fa": "true",
            "$": "https://api.elsevier.com/content/object/eid/1-s2.0-S1381116915301205-fx1_lrg.jpg?httpAccept=%2A%2F%2A",
            "@multimediatype": "JPEG image file",
            "@type": "IMAGE-HIGH-RES",
            "@size": "118381",
            "@ref": "fx1",
            "@mimetype": "image/jpeg"
          },
          {
            "@category": "high",
            "@height": "2021",
            "@width": "2500",
            "@_fa": "true",
            "$": "https://api.elsevier.com/content/object/eid/1-s2.0-S1381116915301205-gr1_lrg.jpg?httpAccept=%2A%2F%2A",
            "@multimediatype": "JPEG image file",
            "@type": "IMAGE-HIGH-RES",
            "@size": "717867",
            "@ref": "gr1",
            "@mimetype": "image/jpeg"
          },
          {
            "@category": "high",
            "@height": "2045",
            "@width": "3333",
            "@_fa": "true",
            "$": "https://api.elsevier.com/content/object/eid/1-s2.0-S1381116915301205-gr10_lrg.jpg?httpAccept=%2A%2F%2A",
            "@multimediatype": "JPEG image file",
            "@type": "IMAGE-HIGH-RES",
            "@size": "993505",
            "@ref": "gr10",
            "@mimetype": "image/jpeg"
          },
          {
            "@category": "high",
            "@height": "2349",
            "@width": "2917",
            "@_fa": "true",
            "$": "https://api.elsevier.com/content/object/eid/1-s2.0-S1381116915301205-gr2_lrg.jpg?httpAccept=%2A%2F%2A",
            "@multimediatype": "JPEG image file",
            "@type": "IMAGE-HIGH-RES",
            "@size": "777448",
            "@ref": "gr2",
            "@mimetype": "image/jpeg"
          },
          {
            "@category": "high",
            "@height": "2072",
            "@width": "3000",
            "@_fa": "true",
            "$": "https://api.elsevier.com/content/object/eid/1-s2.0-S1381116915301205-gr3_lrg.jpg?httpAccept=%2A%2F%2A",
            "@multimediatype": "JPEG image file",
            "@type": "IMAGE-HIGH-RES",
            "@size": "329914",
            "@ref": "gr3",
            "@mimetype": "image/jpeg"
          },
          {
            "@category": "high",
            "@height": "2479",
            "@width": "2917",
            "@_fa": "true",
            "$": "https://api.elsevier.com/content/object/eid/1-s2.0-S1381116915301205-gr4_lrg.jpg?httpAccept=%2A%2F%2A",
            "@multimediatype": "JPEG image file",
            "@type": "IMAGE-HIGH-RES",
            "@size": "479724",
            "@ref": "gr4",
            "@mimetype": "image/jpeg"
          },
          {
            "@category": "high",
            "@height": "2682",
            "@width": "3333",
            "@_fa": "true",
            "$": "https://api.elsevier.com/content/object/eid/1-s2.0-S1381116915301205-gr5_lrg.jpg?httpAccept=%2A%2F%2A",
            "@multimediatype": "JPEG image file",
            "@type": "IMAGE-HIGH-RES",
            "@size": "620686",
            "@ref": "gr5",
            "@mimetype": "image/jpeg"
          },
          {
            "@category": "high",
            "@height": "2605",
            "@width": "3333",
            "@_fa": "true",
            "$": "https://api.elsevier.com/content/object/eid/1-s2.0-S1381116915301205-gr6_lrg.jpg?httpAccept=%2A%2F%2A",
            "@multimediatype": "JPEG image file",
            "@type": "IMAGE-HIGH-RES",
            "@size": "472366",
            "@ref": "gr6",
            "@mimetype": "image/jpeg"
          },
          {
            "@category": "high",
            "@height": "931",
            "@width": "3333",
            "@_fa": "true",
            "$": "https://api.elsevier.com/content/object/eid/1-s2.0-S1381116915301205-gr7_lrg.jpg?httpAccept=%2A%2F%2A",
            "@multimediatype": "JPEG image file",
            "@type": "IMAGE-HIGH-RES",
            "@size": "408655",
            "@ref": "gr7",
            "@mimetype": "image/jpeg"
          },
          {
            "@category": "high",
            "@height": "989",
            "@width": "3333",
            "@_fa": "true",
            "$": "https://api.elsevier.com/content/object/eid/1-s2.0-S1381116915301205-gr8_lrg.jpg?httpAccept=%2A%2F%2A",
            "@multimediatype": "JPEG image file",
            "@type": "IMAGE-HIGH-RES",
            "@size": "475291",
            "@ref": "gr8",
            "@mimetype": "image/jpeg"
          },
          {
            "@category": "high",
            "@height": "3078",
            "@width": "2500",
            "@_fa": "true",
            "$": "https://api.elsevier.com/content/object/eid/1-s2.0-S1381116915301205-gr9_lrg.jpg?httpAccept=%2A%2F%2A",
            "@multimediatype": "JPEG image file",
            "@type": "IMAGE-HIGH-RES",
            "@size": "1127962",
            "@ref": "gr9",
            "@mimetype": "image/jpeg"
          }
        ]
      },
      "link": {
        "@rel": "abstract",
        "@href": "https://api.elsevier.com/content/abstract/scopus_id/84945266256"
      }
    }
  }
}