{
  "metadata": {
    "title": "Effect of acid treatment on the surface of multiwalled carbon nanotubes prepared from Fe–Co supported on CaCO<ce:inf loc=post>3</ce:inf>: Correlation with Fischer–Tropsch catalyst activity",
    "authors": "; ; ",
    "journal": "Journal of Molecular Catalysis A: Chemical",
    "date": "2011-02-01",
    "doi": "10.1016/j.molcata.2010.11.033",
    "abstract": "",
    "uri": "https://api.elsevier.com/content/article/pii/S1381116910005017",
    "pii": "S1381116910005017"
  },
  "fulltext": {
    "full-text-retrieval-response": {
      "scopus-eid": "2-s2.0-78751641835",
      "originalText": "serial JL 271358 291210 291744 291790 291809 31 Journal of Molecular Catalysis A: Chemical JOURNALMOLECULARCATALYSISACHEMICAL 2010-12-09 2010-12-09 2011-01-17T22:26:11 1-s2.0-S1381116910005017 S1381-1169(10)00501-7 S1381116910005017 10.1016/j.molcata.2010.11.033 S300 S300.1 FULL-TEXT 1-s2.0-S1381116910X00188 2015-05-15T05:56:33.607047-04:00 0 0 20110201 2011 2010-12-09T00:00:00Z articleinfo crossmark dco dateupdated tomb dateloaded datesearch indexeddate issuelist volumelist yearnav absattachment articletitlenorm authfirstinitialnorm authfirstsurnamenorm cid cids contenttype copyright dateloadedtxt docsubtype doctype doi eid ewtransactionid hubeid issfirst issn issnnorm itemstage itemtransactionid itemweight openaccess openarchive pg pgfirst pglast pii piinorm pubdatestart pubdatetxt pubyr sectiontitle sortorder srctitle srctitlenorm srctype subheadings volfirst volissue webpdf webpdfpagecount figure table e-component body acknowledge affil appendices articletitle auth authfirstini authfull authkeywords authlast otherkwds primabst ref specialabst alllist content subj ssids 1381-1169 13811169 335 335 1 2 1 2 Volume 335, Issues 1–2 28 189 198 189 198 20110201 1 February 2011 2011-02-01 2011 Regular papers article fla Copyright © 2010 Elsevier B.V. All rights reserved. EFFECTACIDTREATMENTSURFACEMULTIWALLEDCARBONNANOTUBESPREPAREDFECOSUPPORTEDCACO3CORRELATIONFISCHERTROPSCHCATALYSTACTIVITY MOTCHELAHO M 1 Introduction 2 Experimental 2.1 Catalyst preparation 2.2 Carbon nanotube synthesis 2.3 Carbon nanotube purification/functionalisation 2.4 Characterisation techniques 2.5 Fischer–Tropsch experiments 3 Results and discussion 3.1 Electron microscopy 3.2 Zeta potential measurements 3.3 Surface area and pore volume measurements 3.4 Thermogravimetric analysis (TGA) 3.5 Raman spectroscopy 3.6 FTIR analysis 3.7 Fischer–Tropsch data 4 Conclusions Acknowledgements Appendix A Supplementary data References TOEBES 2004 307 M ZHOU 2007 785 J DEJONG 2000 481 K TOEBES 2002 33 M IIJIMA 1991 56 S DAI 2002 1035 H DRESSELHAUS 1996 M SCIENCEFULLERENESCARBONNANOTUBES THESS 1996 483 A EBBESEN 1992 220 T JOURNET 1997 756 C BOWER 2000 2767 C FAN 1999 512 S SU 2000 321 M REN 1998 1105 Z LI 2008 074712 Z MAGREZ 2005 10087 A COUTEAU 2003 E PORRO 2007 16 S KATHYAYINI 2004 129 H SEO 2003 120 J MHLANGA 2009 67 S KUMAR 2010 3739 M MHLANGA 2008 1489 S VAIRAVAPANDIAN 2008 119 D ROSCA 2005 3124 I ROS 2002 1151 T BOEHM 2002 145 H ESUMI 1996 279 K SERP 2003 337 P CHEN 2003 755 W BOEHM 1966 179 H RODRIGUEZREINOSO 1998 159 F PRADOBURGUETE 1989 98 C BOEHM 1994 759 H SUN 2002 1096 Y BAHOME 2005 60 M GRAHAM 2009 39 U VANSTEEN 2002 327 E LI 2003 1057 Y IDAKIEV 2005 149 V DRY 1996 319 M DUVENHAGE 1997 43 D ABBASLOU 2009 33 R MORENOCASTILLA 1995 4386 C LEOFANTI 1998 207 G HARUTYUNYAN 2002 8671 A KIRIKOVA 2008 298 M KASTNER 1994 53 J WANG 2004 326 F HOU 2008 2003 P PARK 2006 141 T JORIO 2003 139 A OKPALUGO 2005 2951 T KUNDU 2008 16869 S PREST 1982 W ANONYMOUSCOLLOIDSSURFACESINREPROGRAPHICTECHNOLOGYACSSYMPOSIUMSERIES SHAFFER 1998 1603 M ZIELKE 1996 983 U KEYSER 2007 M STUDIESSURFACESCIENCECATALYSIS MOTCHELAHOX2011X189 MOTCHELAHOX2011X189X198 MOTCHELAHOX2011X189XM MOTCHELAHOX2011X189X198XM item S1381-1169(10)00501-7 S1381116910005017 1-s2.0-S1381116910005017 10.1016/j.molcata.2010.11.033 271358 2011-01-18T14:02:14.394127-05:00 2011-02-01 1-s2.0-S1381116910005017-main.pdf https://s3.amazonaws.com/prod-ucs-content-store-us-east/content/pii:S1381116910005017/MAIN/application/pdf/137f24999f1936e1268055cbf424690e/main.pdf https://s3-eu-west-1.amazonaws.com/prod-ucs-content-store-eu-west/content/pii:S1381116910005017/MAIN/application/pdf/137f24999f1936e1268055cbf424690e/main.pdf main.pdf pdf true 1084524 MAIN 10 1-s2.0-S1381116910005017-main_1.png https://s3-eu-west-1.amazonaws.com/prod-ucs-content-store-eu-west/content/pii:S1381116910005017/PREVIEW/image/png/83294c224bf1c5a47838ad20a5719a5a/main_1.png https://s3.amazonaws.com/prod-ucs-content-store-us-east/content/pii:S1381116910005017/PREVIEW/image/png/83294c224bf1c5a47838ad20a5719a5a/main_1.png main_1.png png 57675 849 656 IMAGE-WEB-PDF 1 1-s2.0-S1381116910005017-gr1.jpg https://s3.amazonaws.com/prod-ucs-content-store-us-east/content/pii:S1381116910005017/gr1/DOWNSAMPLED/image/jpeg/d18c182fe73a1c95bd1098683429f712/gr1.jpg https://s3-eu-west-1.amazonaws.com/prod-ucs-content-store-eu-west/content/pii:S1381116910005017/gr1/DOWNSAMPLED/image/jpeg/d18c182fe73a1c95bd1098683429f712/gr1.jpg gr1 gr1.jpg jpg 55272 319 647 IMAGE-DOWNSAMPLED 1-s2.0-S1381116910005017-gr1.sml https://s3.amazonaws.com/prod-ucs-content-store-us-east/content/pii:S1381116910005017/gr1/THUMBNAIL/image/gif/db27d51b93b29149bb59766c3bd592b6/gr1.sml https://s3-eu-west-1.amazonaws.com/prod-ucs-content-store-eu-west/content/pii:S1381116910005017/gr1/THUMBNAIL/image/gif/db27d51b93b29149bb59766c3bd592b6/gr1.sml gr1 gr1.sml sml 6834 108 219 IMAGE-THUMBNAIL 1-s2.0-S1381116910005017-gr1_lrg.jpg https://s3.amazonaws.com/prod-ucs-content-store-us-east/content/pii:S1381116910005017/gr1/HIGHRES/image/jpeg/7708d66fea5250196416113066711993/gr1_lrg.jpg https://s3-eu-west-1.amazonaws.com/prod-ucs-content-store-eu-west/content/pii:S1381116910005017/gr1/HIGHRES/image/jpeg/7708d66fea5250196416113066711993/gr1_lrg.jpg gr1 gr1_lrg.jpg jpg 712754 1413 2866 IMAGE-HIGH-RES 1-s2.0-S1381116910005017-gr10.jpg https://s3.amazonaws.com/prod-ucs-content-store-us-east/content/pii:S1381116910005017/gr10/DOWNSAMPLED/image/jpeg/9c55a56c71043aaf749dc841237db850/gr10.jpg https://s3-eu-west-1.amazonaws.com/prod-ucs-content-store-eu-west/content/pii:S1381116910005017/gr10/DOWNSAMPLED/image/jpeg/9c55a56c71043aaf749dc841237db850/gr10.jpg gr10 gr10.jpg jpg 48145 503 711 IMAGE-DOWNSAMPLED 1-s2.0-S1381116910005017-gr10.sml https://s3.amazonaws.com/prod-ucs-content-store-us-east/content/pii:S1381116910005017/gr10/THUMBNAIL/image/gif/eb2fd0ea27466f32352a3de87182140a/gr10.sml https://s3-eu-west-1.amazonaws.com/prod-ucs-content-store-eu-west/content/pii:S1381116910005017/gr10/THUMBNAIL/image/gif/eb2fd0ea27466f32352a3de87182140a/gr10.sml gr10 gr10.sml sml 4534 155 219 IMAGE-THUMBNAIL 1-s2.0-S1381116910005017-gr10_lrg.jpg https://s3.amazonaws.com/prod-ucs-content-store-us-east/content/pii:S1381116910005017/gr10/HIGHRES/image/jpeg/9d3fe3daa381dc3f1ebc2bc31b863ce2/gr10_lrg.jpg https://s3-eu-west-1.amazonaws.com/prod-ucs-content-store-eu-west/content/pii:S1381116910005017/gr10/HIGHRES/image/jpeg/9d3fe3daa381dc3f1ebc2bc31b863ce2/gr10_lrg.jpg gr10 gr10_lrg.jpg jpg 407068 2227 3148 IMAGE-HIGH-RES 1-s2.0-S1381116910005017-gr11.jpg https://s3.amazonaws.com/prod-ucs-content-store-us-east/content/pii:S1381116910005017/gr11/DOWNSAMPLED/image/jpeg/e7f1391a398b286ea2f16f7bbd4aaf11/gr11.jpg https://s3-eu-west-1.amazonaws.com/prod-ucs-content-store-eu-west/content/pii:S1381116910005017/gr11/DOWNSAMPLED/image/jpeg/e7f1391a398b286ea2f16f7bbd4aaf11/gr11.jpg gr11 gr11.jpg jpg 25368 296 355 IMAGE-DOWNSAMPLED 1-s2.0-S1381116910005017-gr11.sml https://s3.amazonaws.com/prod-ucs-content-store-us-east/content/pii:S1381116910005017/gr11/THUMBNAIL/image/gif/26a59a25465319bb036a4987d363f6a6/gr11.sml https://s3-eu-west-1.amazonaws.com/prod-ucs-content-store-eu-west/content/pii:S1381116910005017/gr11/THUMBNAIL/image/gif/26a59a25465319bb036a4987d363f6a6/gr11.sml gr11 gr11.sml sml 5474 164 197 IMAGE-THUMBNAIL 1-s2.0-S1381116910005017-gr11_lrg.jpg https://s3.amazonaws.com/prod-ucs-content-store-us-east/content/pii:S1381116910005017/gr11/HIGHRES/image/jpeg/43042a89d749e2d85994c4f656bf565d/gr11_lrg.jpg https://s3-eu-west-1.amazonaws.com/prod-ucs-content-store-eu-west/content/pii:S1381116910005017/gr11/HIGHRES/image/jpeg/43042a89d749e2d85994c4f656bf565d/gr11_lrg.jpg gr11 gr11_lrg.jpg jpg 229778 1309 1571 IMAGE-HIGH-RES 1-s2.0-S1381116910005017-gr12.jpg https://s3.amazonaws.com/prod-ucs-content-store-us-east/content/pii:S1381116910005017/gr12/DOWNSAMPLED/image/jpeg/2eadf16d567cd9aeadddda0b8df0eebc/gr12.jpg https://s3-eu-west-1.amazonaws.com/prod-ucs-content-store-eu-west/content/pii:S1381116910005017/gr12/DOWNSAMPLED/image/jpeg/2eadf16d567cd9aeadddda0b8df0eebc/gr12.jpg gr12 gr12.jpg jpg 29917 291 383 IMAGE-DOWNSAMPLED 1-s2.0-S1381116910005017-gr12.sml https://s3.amazonaws.com/prod-ucs-content-store-us-east/content/pii:S1381116910005017/gr12/THUMBNAIL/image/gif/127ba1b5b3c0f06b2ad51c6f8932bd98/gr12.sml https://s3-eu-west-1.amazonaws.com/prod-ucs-content-store-eu-west/content/pii:S1381116910005017/gr12/THUMBNAIL/image/gif/127ba1b5b3c0f06b2ad51c6f8932bd98/gr12.sml gr12 gr12.sml sml 5901 164 215 IMAGE-THUMBNAIL 1-s2.0-S1381116910005017-gr12_lrg.jpg https://s3.amazonaws.com/prod-ucs-content-store-us-east/content/pii:S1381116910005017/gr12/HIGHRES/image/jpeg/b9f3a765b28ae99942bc5af51e865ffe/gr12_lrg.jpg https://s3-eu-west-1.amazonaws.com/prod-ucs-content-store-eu-west/content/pii:S1381116910005017/gr12/HIGHRES/image/jpeg/b9f3a765b28ae99942bc5af51e865ffe/gr12_lrg.jpg gr12 gr12_lrg.jpg jpg 248957 1293 1699 IMAGE-HIGH-RES 1-s2.0-S1381116910005017-gr2.jpg https://s3.amazonaws.com/prod-ucs-content-store-us-east/content/pii:S1381116910005017/gr2/DOWNSAMPLED/image/jpeg/3eccc688653cb00a926ff3eadae0eb4c/gr2.jpg https://s3-eu-west-1.amazonaws.com/prod-ucs-content-store-eu-west/content/pii:S1381116910005017/gr2/DOWNSAMPLED/image/jpeg/3eccc688653cb00a926ff3eadae0eb4c/gr2.jpg gr2 gr2.jpg jpg 38588 291 701 IMAGE-DOWNSAMPLED 1-s2.0-S1381116910005017-gr2.sml https://s3.amazonaws.com/prod-ucs-content-store-us-east/content/pii:S1381116910005017/gr2/THUMBNAIL/image/gif/cfe74c6bbeebccc7e878ecd95baf5082/gr2.sml https://s3-eu-west-1.amazonaws.com/prod-ucs-content-store-eu-west/content/pii:S1381116910005017/gr2/THUMBNAIL/image/gif/cfe74c6bbeebccc7e878ecd95baf5082/gr2.sml gr2 gr2.sml sml 4242 91 219 IMAGE-THUMBNAIL 1-s2.0-S1381116910005017-gr2_lrg.jpg https://s3.amazonaws.com/prod-ucs-content-store-us-east/content/pii:S1381116910005017/gr2/HIGHRES/image/jpeg/c6737f717348e78debc0dd8a044965f0/gr2_lrg.jpg https://s3-eu-west-1.amazonaws.com/prod-ucs-content-store-eu-west/content/pii:S1381116910005017/gr2/HIGHRES/image/jpeg/c6737f717348e78debc0dd8a044965f0/gr2_lrg.jpg gr2 gr2_lrg.jpg jpg 390368 1289 3103 IMAGE-HIGH-RES 1-s2.0-S1381116910005017-gr3.jpg https://s3.amazonaws.com/prod-ucs-content-store-us-east/content/pii:S1381116910005017/gr3/DOWNSAMPLED/image/jpeg/2a081eef45c81574e12d097440ee2107/gr3.jpg https://s3-eu-west-1.amazonaws.com/prod-ucs-content-store-eu-west/content/pii:S1381116910005017/gr3/DOWNSAMPLED/image/jpeg/2a081eef45c81574e12d097440ee2107/gr3.jpg gr3 gr3.jpg jpg 113478 649 652 IMAGE-DOWNSAMPLED 1-s2.0-S1381116910005017-gr3.sml https://s3.amazonaws.com/prod-ucs-content-store-us-east/content/pii:S1381116910005017/gr3/THUMBNAIL/image/gif/3d9fe32ae3e44a95fa0c348ba17b99be/gr3.sml https://s3-eu-west-1.amazonaws.com/prod-ucs-content-store-eu-west/content/pii:S1381116910005017/gr3/THUMBNAIL/image/gif/3d9fe32ae3e44a95fa0c348ba17b99be/gr3.sml gr3 gr3.sml sml 8558 163 164 IMAGE-THUMBNAIL 1-s2.0-S1381116910005017-gr3_lrg.jpg https://s3.amazonaws.com/prod-ucs-content-store-us-east/content/pii:S1381116910005017/gr3/HIGHRES/image/jpeg/cb88a056e2990e97e8eaccd87c193508/gr3_lrg.jpg https://s3-eu-west-1.amazonaws.com/prod-ucs-content-store-eu-west/content/pii:S1381116910005017/gr3/HIGHRES/image/jpeg/cb88a056e2990e97e8eaccd87c193508/gr3_lrg.jpg gr3 gr3_lrg.jpg jpg 1452484 2876 2888 IMAGE-HIGH-RES 1-s2.0-S1381116910005017-gr4.jpg https://s3.amazonaws.com/prod-ucs-content-store-us-east/content/pii:S1381116910005017/gr4/DOWNSAMPLED/image/jpeg/646bb3e2e99804e35c96e385f1a80a2c/gr4.jpg https://s3-eu-west-1.amazonaws.com/prod-ucs-content-store-eu-west/content/pii:S1381116910005017/gr4/DOWNSAMPLED/image/jpeg/646bb3e2e99804e35c96e385f1a80a2c/gr4.jpg gr4 gr4.jpg jpg 20404 255 365 IMAGE-DOWNSAMPLED 1-s2.0-S1381116910005017-gr4.sml https://s3.amazonaws.com/prod-ucs-content-store-us-east/content/pii:S1381116910005017/gr4/THUMBNAIL/image/gif/8bcc7173098fe4c2c92355dd19ed1afc/gr4.sml https://s3-eu-west-1.amazonaws.com/prod-ucs-content-store-eu-west/content/pii:S1381116910005017/gr4/THUMBNAIL/image/gif/8bcc7173098fe4c2c92355dd19ed1afc/gr4.sml gr4 gr4.sml sml 4687 153 219 IMAGE-THUMBNAIL 1-s2.0-S1381116910005017-gr4_lrg.jpg https://s3.amazonaws.com/prod-ucs-content-store-us-east/content/pii:S1381116910005017/gr4/HIGHRES/image/jpeg/d9cf95ba5505271c3f3c624780b5b149/gr4_lrg.jpg https://s3-eu-west-1.amazonaws.com/prod-ucs-content-store-eu-west/content/pii:S1381116910005017/gr4/HIGHRES/image/jpeg/d9cf95ba5505271c3f3c624780b5b149/gr4_lrg.jpg gr4 gr4_lrg.jpg jpg 174866 1130 1616 IMAGE-HIGH-RES 1-s2.0-S1381116910005017-gr5.jpg https://s3.amazonaws.com/prod-ucs-content-store-us-east/content/pii:S1381116910005017/gr5/DOWNSAMPLED/image/jpeg/bdfa0a565d73fd8c10400ffdfe4d83b3/gr5.jpg https://s3-eu-west-1.amazonaws.com/prod-ucs-content-store-eu-west/content/pii:S1381116910005017/gr5/DOWNSAMPLED/image/jpeg/bdfa0a565d73fd8c10400ffdfe4d83b3/gr5.jpg gr5 gr5.jpg jpg 21291 262 377 IMAGE-DOWNSAMPLED 1-s2.0-S1381116910005017-gr5.sml https://s3.amazonaws.com/prod-ucs-content-store-us-east/content/pii:S1381116910005017/gr5/THUMBNAIL/image/gif/220fa487d2358ef2e8d913ff9c731717/gr5.sml https://s3-eu-west-1.amazonaws.com/prod-ucs-content-store-eu-west/content/pii:S1381116910005017/gr5/THUMBNAIL/image/gif/220fa487d2358ef2e8d913ff9c731717/gr5.sml gr5 gr5.sml sml 4997 152 219 IMAGE-THUMBNAIL 1-s2.0-S1381116910005017-gr5_lrg.jpg https://s3.amazonaws.com/prod-ucs-content-store-us-east/content/pii:S1381116910005017/gr5/HIGHRES/image/jpeg/cb971e4df7b26ba24058e6749ace9a26/gr5_lrg.jpg https://s3-eu-west-1.amazonaws.com/prod-ucs-content-store-eu-west/content/pii:S1381116910005017/gr5/HIGHRES/image/jpeg/cb971e4df7b26ba24058e6749ace9a26/gr5_lrg.jpg gr5 gr5_lrg.jpg jpg 182236 1162 1669 IMAGE-HIGH-RES 1-s2.0-S1381116910005017-gr6.jpg https://s3.amazonaws.com/prod-ucs-content-store-us-east/content/pii:S1381116910005017/gr6/DOWNSAMPLED/image/jpeg/46c9f884a8fa3992d155ed4da9e0ce5f/gr6.jpg https://s3-eu-west-1.amazonaws.com/prod-ucs-content-store-eu-west/content/pii:S1381116910005017/gr6/DOWNSAMPLED/image/jpeg/46c9f884a8fa3992d155ed4da9e0ce5f/gr6.jpg gr6 gr6.jpg jpg 34329 267 684 IMAGE-DOWNSAMPLED 1-s2.0-S1381116910005017-gr6.sml https://s3.amazonaws.com/prod-ucs-content-store-us-east/content/pii:S1381116910005017/gr6/THUMBNAIL/image/gif/ae2855e316e442c8ff84c0b6a20a9193/gr6.sml https://s3-eu-west-1.amazonaws.com/prod-ucs-content-store-eu-west/content/pii:S1381116910005017/gr6/THUMBNAIL/image/gif/ae2855e316e442c8ff84c0b6a20a9193/gr6.sml gr6 gr6.sml sml 3741 85 219 IMAGE-THUMBNAIL 1-s2.0-S1381116910005017-gr6_lrg.jpg https://s3.amazonaws.com/prod-ucs-content-store-us-east/content/pii:S1381116910005017/gr6/HIGHRES/image/jpeg/c5d6cd0a744c377cedf8ce8fec24694f/gr6_lrg.jpg https://s3-eu-west-1.amazonaws.com/prod-ucs-content-store-eu-west/content/pii:S1381116910005017/gr6/HIGHRES/image/jpeg/c5d6cd0a744c377cedf8ce8fec24694f/gr6_lrg.jpg gr6 gr6_lrg.jpg jpg 313743 1181 3027 IMAGE-HIGH-RES 1-s2.0-S1381116910005017-gr7.jpg https://s3.amazonaws.com/prod-ucs-content-store-us-east/content/pii:S1381116910005017/gr7/DOWNSAMPLED/image/jpeg/6d02baa7a3988c96fa91e346c604cf19/gr7.jpg https://s3-eu-west-1.amazonaws.com/prod-ucs-content-store-eu-west/content/pii:S1381116910005017/gr7/DOWNSAMPLED/image/jpeg/6d02baa7a3988c96fa91e346c604cf19/gr7.jpg gr7 gr7.jpg jpg 35515 261 667 IMAGE-DOWNSAMPLED 1-s2.0-S1381116910005017-gr7.sml https://s3.amazonaws.com/prod-ucs-content-store-us-east/content/pii:S1381116910005017/gr7/THUMBNAIL/image/gif/ab7a06d1f59ea641b1bed8da10ffc901/gr7.sml https://s3-eu-west-1.amazonaws.com/prod-ucs-content-store-eu-west/content/pii:S1381116910005017/gr7/THUMBNAIL/image/gif/ab7a06d1f59ea641b1bed8da10ffc901/gr7.sml gr7 gr7.sml sml 3931 86 219 IMAGE-THUMBNAIL 1-s2.0-S1381116910005017-gr7_lrg.jpg https://s3.amazonaws.com/prod-ucs-content-store-us-east/content/pii:S1381116910005017/gr7/HIGHRES/image/jpeg/f4b1609d99c25ec791c87455d56144eb/gr7_lrg.jpg https://s3-eu-west-1.amazonaws.com/prod-ucs-content-store-eu-west/content/pii:S1381116910005017/gr7/HIGHRES/image/jpeg/f4b1609d99c25ec791c87455d56144eb/gr7_lrg.jpg gr7 gr7_lrg.jpg jpg 324547 1155 2952 IMAGE-HIGH-RES 1-s2.0-S1381116910005017-gr8.jpg https://s3.amazonaws.com/prod-ucs-content-store-us-east/content/pii:S1381116910005017/gr8/DOWNSAMPLED/image/jpeg/c2a45f768e74d6c79e4ed05b582a6f4b/gr8.jpg https://s3-eu-west-1.amazonaws.com/prod-ucs-content-store-eu-west/content/pii:S1381116910005017/gr8/DOWNSAMPLED/image/jpeg/c2a45f768e74d6c79e4ed05b582a6f4b/gr8.jpg gr8 gr8.jpg jpg 41735 259 689 IMAGE-DOWNSAMPLED 1-s2.0-S1381116910005017-gr8.sml https://s3.amazonaws.com/prod-ucs-content-store-us-east/content/pii:S1381116910005017/gr8/THUMBNAIL/image/gif/813d3d7cf4d0f9ffe5acff50241c2073/gr8.sml https://s3-eu-west-1.amazonaws.com/prod-ucs-content-store-eu-west/content/pii:S1381116910005017/gr8/THUMBNAIL/image/gif/813d3d7cf4d0f9ffe5acff50241c2073/gr8.sml gr8 gr8.sml sml 3802 82 219 IMAGE-THUMBNAIL 1-s2.0-S1381116910005017-gr8_lrg.jpg https://s3.amazonaws.com/prod-ucs-content-store-us-east/content/pii:S1381116910005017/gr8/HIGHRES/image/jpeg/c92f0e3213db75e31fb084d7fc58f7fe/gr8_lrg.jpg https://s3-eu-west-1.amazonaws.com/prod-ucs-content-store-eu-west/content/pii:S1381116910005017/gr8/HIGHRES/image/jpeg/c92f0e3213db75e31fb084d7fc58f7fe/gr8_lrg.jpg gr8 gr8_lrg.jpg jpg 365119 1146 3050 IMAGE-HIGH-RES 1-s2.0-S1381116910005017-gr9.jpg https://s3.amazonaws.com/prod-ucs-content-store-us-east/content/pii:S1381116910005017/gr9/DOWNSAMPLED/image/jpeg/fdd0f4eb4c68d9241a5dc8abecac4ee5/gr9.jpg https://s3-eu-west-1.amazonaws.com/prod-ucs-content-store-eu-west/content/pii:S1381116910005017/gr9/DOWNSAMPLED/image/jpeg/fdd0f4eb4c68d9241a5dc8abecac4ee5/gr9.jpg gr9 gr9.jpg jpg 13945 303 374 IMAGE-DOWNSAMPLED 1-s2.0-S1381116910005017-gr9.sml https://s3.amazonaws.com/prod-ucs-content-store-us-east/content/pii:S1381116910005017/gr9/THUMBNAIL/image/gif/7f23ae8567fd888f79841858481ea50b/gr9.sml https://s3-eu-west-1.amazonaws.com/prod-ucs-content-store-eu-west/content/pii:S1381116910005017/gr9/THUMBNAIL/image/gif/7f23ae8567fd888f79841858481ea50b/gr9.sml gr9 gr9.sml sml 3062 164 202 IMAGE-THUMBNAIL 1-s2.0-S1381116910005017-gr9_lrg.jpg https://s3.amazonaws.com/prod-ucs-content-store-us-east/content/pii:S1381116910005017/gr9/HIGHRES/image/jpeg/b64d1e89b6285343d8237793c3330267/gr9_lrg.jpg https://s3-eu-west-1.amazonaws.com/prod-ucs-content-store-eu-west/content/pii:S1381116910005017/gr9/HIGHRES/image/jpeg/b64d1e89b6285343d8237793c3330267/gr9_lrg.jpg gr9 gr9_lrg.jpg jpg 110426 1346 1659 IMAGE-HIGH-RES 1-s2.0-S1381116910005017-mmc1.doc https://s3.amazonaws.com/prod-ucs-content-store-us-east/content/pii:S1381116910005017/mmc1/MAIN/application/msword/03c37b25b89a3f37c995ebadeb8875f5/mmc1.doc https://s3-eu-west-1.amazonaws.com/prod-ucs-content-store-eu-west/content/pii:S1381116910005017/mmc1/MAIN/application/msword/03c37b25b89a3f37c995ebadeb8875f5/mmc1.doc mmc1 mmc1.doc doc 635392 APPLICATION 1-s2.0-S1381116910005017-fx1.jpg https://s3.amazonaws.com/prod-ucs-content-store-us-east/content/pii:S1381116910005017/fx1/DOWNSAMPLED/image/jpeg/e4171e1cfc7de4050ff1cbe0761bdd2f/fx1.jpg https://s3-eu-west-1.amazonaws.com/prod-ucs-content-store-eu-west/content/pii:S1381116910005017/fx1/DOWNSAMPLED/image/jpeg/e4171e1cfc7de4050ff1cbe0761bdd2f/fx1.jpg fx1 true fx1.jpg jpg 22917 200 500 IMAGE-DOWNSAMPLED 1-s2.0-S1381116910005017-fx1.sml https://s3.amazonaws.com/prod-ucs-content-store-us-east/content/pii:S1381116910005017/fx1/THUMBNAIL/image/gif/499e73de928280de2ba0598255571662/fx1.sml https://s3-eu-west-1.amazonaws.com/prod-ucs-content-store-eu-west/content/pii:S1381116910005017/fx1/THUMBNAIL/image/gif/499e73de928280de2ba0598255571662/fx1.sml fx1 true fx1.sml sml 4381 88 219 IMAGE-THUMBNAIL 1-s2.0-S1381116910005017-fx1_lrg.jpg https://s3.amazonaws.com/prod-ucs-content-store-us-east/content/pii:S1381116910005017/fx1/HIGHRES/image/jpeg/d18bf79d868715a1d5678b56ae2dc18b/fx1_lrg.jpg https://s3-eu-west-1.amazonaws.com/prod-ucs-content-store-eu-west/content/pii:S1381116910005017/fx1/HIGHRES/image/jpeg/d18bf79d868715a1d5678b56ae2dc18b/fx1_lrg.jpg fx1 fx1_lrg.jpg jpg 209853 886 2213 IMAGE-HIGH-RES MOLCAA 8009 S1381-1169(10)00501-7 10.1016/j.molcata.2010.11.033 Elsevier B.V. Fig. 1 TEM images of (a) as-grown CNTs and (b) as-grown CNTs showing some encapsulated metal particles indicated by arrow. Fig. 2 Diameter size distribution before and after acid treatments. (a) Comparison of inner diameters and (b) comparison of outer diameters. Fig. 3 Effect of acid treatment on the texture and morphologies of CCVD synthesised CNTs: (a) CNTs-30R2, (b) CNT-30R6, (c) CNT-55R2, and (d) CNT-55R6. Fig. 4 Zeta potential measurements of as-grown and acid treated CNTs as a function of pH. Fig. 5 TGA and DTG profiles of as-grown CNTs under air atmosphere. Fig. 6 (a) TGA and (b) DTG profiles of as-grown CNTs as well as purified CNTs in 30% HNO3 under air atmosphere. Fig. 7 (a) TGA and (b) DTG profiles of as-grown CNTs as well as purified CNTs in 55% HNO3 under air atmosphere. Fig. 8 (a) TGA and (b) DTG profiles of as-grown and acid treated CNTs under N2 atmosphere. Fig. 9 Evolution of oxygen containing CO2 versus reflux time. Fig. 10 Raman spectra of CNTs: (a) as-grown CNTs, (b) CNT-55R2, (c) CNT-30R6, and (d) CNT-55R6. Fig. 11 FTIR spectra of untreated (CNT-as grown) and oxidised carbon nanotubes. Fig. 12 CO conversion with time on stream. Table 1 Point of zero charge (PZC) obtained from zeta potential measurements. Sample PZC As grown CNTs a 4.9 CNT-30R2 2.9 CNT-30R6 2.7 CNT-55R2 2.5 CNT-55R6 <0 a PZC=5.0 [39]. Table 2 Surface area and pore volume of as-grown and acid-treated CNTs. Sample ID Degassed under N2 at 150°C a Degassed under N2 at 250°C a BET surface area (m2/g) b Pore volume (cm3/g) BET surface area (m2/g) b Pore volume (cm3/g) CNT-as grown 80 0.27 77 0.27 CNT-30R2 105 0.34 103 0.35 CNT-30R6 112 0.35 114 0.34 CNT-55R2 108 0.35 – – CNT-55R6 100 0.33 – – a 4h. b ±5% experimental error. Table 3 Weight loss of CNTs due to the formation of CO/CO2 on heating in N2. Sample ID 150–400°C 100–900°C %CO2 %(CO2 +CO) CNT as-grown 0.95 8.36 CNT-30R2 1.81 11.04 CNT-30R6 2.75 15.14 CNT-55R2 3.52 19.95 CNT-55R6 4.27 18.78 Table 4 Raman data for as-grown and acid-treated CNTs. Sample ID Peak position (cm−1) I D/I G D-band G-band CNT as-grown 1345 1599 2.88 CNT-30R6 1354 1598 2.83 CNT-55R2 1353 1583 2.41 CNT-55R6 1354 1583 3.79 Error bar±2cm−1. Table 5 Activity and selectivity of iron catalyst supported on differently functionalized CNTs in Fischer–Tropsch synthesis. Catalyst %CO conversion FT activity (μmol/mingCat) Hydrocarbons selectivity (mol%) C1 C2 C3 C4 C5+ 10% Fe/CNT-as grown 20 71 48 15 13 7.7 17 10% Fe/CNT-30R2 29 153 30 15 19 13 24 10% Fe/CNT-30R6 35 179 31 8.0 7.3 3.6 50 10% Fe/CNT-55R2 44 214 29 8.4 6.0 2.6 54 10% Fe/CNT-55R6 59 322 19 8.3 9.2 5.4 58 Conditions: 8bar, 275°C, CO:H2 =1:2, and GHSV=2400h−1. Effect of acid treatment on the surface of multiwalled carbon nanotubes prepared from Fe–Co supported on CaCO3: Correlation with Fischer–Tropsch catalyst activity Myriam A.M. Motchelaho a b Haifeng Xiong b c Mahluli Moyo a b Linda L. Jewell a ⁎ Neil J. Coville b c ⁎⁎ a School of Chemical and Metallurgical Engineering, University of the Witwatersrand, Johannesburg 2050, South Africa b Molecular Sciences Institute, School of Chemistry, University of the Witwatersrand, Johannesburg 2050, South Africa c DST/NRF Centre of Excellence in Strong Materials, University of the Witwatersrand, Johannesburg 2050, South Africa ⁎ Corresponding author. Tel.: +27 11 717 7507. ⁎⁎ Corresponding author. Tel.: +27 11 717 6738; fax: +27 11 717 6749. Graphical abstract There is a correlaton between the harshness of the acid treament of carbon nanotubes and catalyst activity when these materials are used as supports for 10% Fe in the Fischer–Tropsch synthesis. Research highlights Carbon nanotubes were acid refluxed with two different HNO3 concentrations and times. As the severity of acid treatment of carbon nanotubes increases: ▶ the surface morphology becomes rougher and the material becomes less crystalline. ▶ The amount of surface oxygen groups increases and the thermal stability decreases. ▶ The activity of 10% Fe/CNT for Fischer–Tropsch synthesis increases significantly. ▶ The methane selectivity decreases and the C5+ selectivity increases. Carbon nanotubes (CNTs) were obtained through the catalytic decomposition of C2H2 at 700°C over Fe–Co supported on CaCO3 and confirmed by TEM to be composed of multiwalled carbon nanotubes. The CNTs were refluxed in 30% and 55% HNO3 for 2 and 6h in order to remove impurities and introduce oxygen surface groups. This rendered the CNTs less hydrophobic. The morphology, microstructure, surface area, pore volume and surface chemical properties of the acid treated CNTs were analysed by TEM, N2 physisorption, TGA, FTIR, Raman spectroscopy and zeta potential measurements. The surface roughness, together with the degree of surface functionalization correlated with the harshness (time and concentration) of the acid treatment. Fischer–Tropsch synthesis studies (275°C, 8bar) were performed on all the Fe loaded (10%)/CNT catalysts and activity studies revealed that the more severe the acid treatment the higher the activity of the catalysts. Abbreviations CNT carbon nanotubes MWCNT multiwalled carbon nanotubes SWCNT sinlge walled carbon nanotubes Keywords Iron–cobalt catalyst CaCO3 support Fischer–Tropsch activity Multiwalled carbon nanotubes 1 Introduction Carbon materials with various morphologies are widely used as adsorbents, as catalysts and/or catalyst supports and for structural reinforcement of polymers. The carbons often have relatively high surface areas, high thermal stability and show chemical inertness. Their surface chemistry, especially the presence of oxygen functionalities determines the application of the material [1,2]. Historically activated carbons and carbon blacks are the most commonly used forms of carbon used in industry. More recently the use of carbon nanotubes, fullerenes and related materials in high-tech applications has attracted growing interest [3,4]. Carbon nanotubes, popularised by studies by Iijima [5], represent one of the best examples of nanostructures derived from bottom-up chemical synthesis approaches [6]. Both single walled carbon nanotubes (SWCNTs) and multiwalled carbon nanotubes (MWCNTs) have a simple chemical composition and atomic bonding configuration but exhibit an extreme diversity and richness among nanomaterials in terms of structure and structure–property relations [7]. The synthesis, purification, properties, manipulation and more recently, the chemistry of nanotubes are all subjects of intensive investigations. There are three common methods used to make CNTs: laser ablation [8], electric arc discharge [9,10] and chemical vapour deposition [11–14]. Catalytic chemical vapour deposition (CCVD) has proven to be an excellent method for large-scale production of high quality MWCNTs at relatively low cost [15–17]. By employing specific catalyst and carbon sources it is possible to control the structural characteristics of CNTs when CCVD is used [18]. The CCVD synthesis method consists of decomposing a carbon-containing gas over a supported catalyst. In order to improve the yield and quality of CNT production, various metal catalysts, supports and carbon sources have been investigated [19,20]. The most widely used metals are Fe, Co and Ni as well as the alloys of these nanoparticles [21,22]. Conventional supports such as SiO2, Al2O3, and zeolite have been successfully used in the synthesis of CNTs but purification of the product has proven to be difficult. A detailed study by Magrez et al. [16] showed that CaCO3 is an excellent support for CNT synthesis because of the good match between the carbonate decomposition temperature and the nanotube growth. Residual CaO support can be easily be removed by a one step acid treatment [23,15]. Earlier studies [19,23] revealed that the order of catalyst activity in the CVD synthesis was Fe–Co/CaCO3 ≫Co/CaCO3 >Fe/CaCO3. The Fe–Co bimetallic system supported on CaCO3 was therefore used in this present study. Regardless of the method used to make CNTs, there is always a significant amount of impurity present in the final product (graphitic debris, catalyst particles and fullerenes) [24]. These impurities often influence the desired properties of the CNTs. It is therefore important to both evaluate and reduce or completely eliminate impurities in the as-grown CNTs. Although there are many suggested methods for CNT purification, oxidation with concentrated HNO3 or HNO3–H2SO4 is the most widely used [1,25–29]. However no purification method that fulfils all the requirements for technical processing is currently available [30]. The nature of the impurities depends on the synthesis method, reaction time, type of catalyst, catalyst support and carbon source employed. One of the applications of CNTs that has received much attention in the literature recently is their use as a catalyst support. When CNTs are used as a catalyst support, the hydrophobic and inert nature of the as-grown CNTs can be unfavourable. It is therefore important to be able to modify their surface chemistry, for example, by the introduction of oxygen-containing surface groups. Upon oxidation, the hydrophobic CNTs become more hydrophilic so that wetting properties are enhanced and the CNT surface becomes more reactive [26,31,32]. Most importantly the dispersion of an active metal phase during catalyst preparation increases with an increasing amount of surface oxygen [26,33]. The presence of carboxyl groups on a CNT surface gives rise to cation-exchange properties [34] which can act as anchor sites for the metal particles. A critical survey of methods most frequently used for the determination of surface-oxygen groups and the use of nitric acid treatment to oxidize carbon surfaces has been given by Boehm [27]. Aqueous solutions of HNO3 contain nitronium ions, NO2 +, which are able to attack aromatic compounds and this is assumed to be the first step in the introduction of oxygen-containing surface groups [1]. Although the precise nature of carbon–oxygen structures is not well established, results from many studies demonstrate that several types of surface oxygen-groups can be identified using FTIR spectroscopy, TGA in an inert environment and Boehm mass titration [26,31,32]. The chemical modification of carbon nanotubes represents an emerging research area for nanotube-based materials [35]. In contrast to activated carbons and carbon blacks, the surface oxidation of the relatively new carbon nanotubes and nanofibres has been much less studied [26]. In a study focussed on the use of an Fe/CNT catalyst in Fischer–Tropsch synthesis we observed that this catalyst proved to be easy to use and a stable catalyst with good activity [36]. Scanning transmission electron microscopy (STEM) studies revealed that the surface was heavily pitted and was populated with Fe and, unexpectedly, Ca2+ ions [37]. This led us to propose the concept of “docking stations” to explain the remarkable stability of the catalyst [37,38]. These “docking stations” prevent or mitigate sintering which in turn suppresses deactivation. To further explore the origin of the surface roughness of the CNTs produced using CaCO3 as a support, we herein report on a comprehensive investigation of the CNT surface after using a range of acid treatments, unlike previous studies which use relatively severe acid treatments. In particular we have established that a correlation exists between surface roughness induced during acid treatment and the stability and activity of the Fe/CNT catalysts, and that this effect is related to CNT surface roughness. 2 Experimental 2.1 Catalyst preparation A 10% Fe–Co/CaCO3 catalyst with 5wt% Fe and 5wt% Co metal loading was synthesized by the wet impregnation technique [36,38]. In this technique, Fe(NO3)3·9H2O, Co(NO3)2·6H2O and CaCO3 (Sigma–Aldrich) were used to prepare the catalyst. Calculated amounts of the Fe and Co nitrates were mixed and dissolved in distilled water to make a 0.3M Fe–Co (50:50, w/w) precursor solution. This solution was added dropwise to the CaCO3 support and the mixture was left for 30min while stirring. The metal–support mixture was then filtered and the product was first left to stand in air for 2h at room temperature and then dried in a static air oven at 120°C for 12h. The product was then removed from the oven and left to cool to room temperature. It was ground and screened through a 150μm sieve. The catalyst powder obtained was then calcined at 400°C for 16h in a static air oven in order to decompose the nitrates. 2.2 Carbon nanotube synthesis Multiwalled carbon nanotubes were produced by the catalytic decomposition of acetylene (Afrox South Africa) over the 10% Fe–Co/CaCO3 catalyst prepared as described above. Nitrogen (Afrox South Africa) was used as a carrier gas and as a diluent. Previous studies in our research group have focussed on the optimization procedure and effect of various parameters on the synthesis of carbon nanotubes [21]. The optimum conditions were used here for the synthesis of CNTs (see supplementary information for further details). In the synthesis of multiwalled carbon nanotubes (MWCNTs), approximately 1g of the catalyst was spread uniformly in a quartz boat (120mm×15mm), which was inserted in the centre of a tubular fixed-bed quartz reactor (length: 510mm, ID: 19mm). The reactor, mounted horizontally in an electrical tube furnace, was then heated from room temperature to 700°C at 10°C/min while N2 flowed over the catalyst at 40ml/min. When the temperature reached 700°C, the N2 flowrate was changed to 240ml/min and acetylene was introduced at a flowrate of 90ml/min. The reaction was allowed to take place for 60min, thereafter, the C2H2 flow was stopped and the furnace was left to cool down to room temperature under N2 (40ml/min). The boat was then removed from the reactor and approximately 3.5g of black soot was collected. 2.3 Carbon nanotube purification/functionalisation As-prepared CNTs were refluxed at 120°C in 30% HNO3 and 55% HNO3 for 2 and 6h respectively (about 2g of raw material in 200ml of acid). At the end of the acid treatment, each mixture was diluted with distilled water followed by filtering and washing with distilled water until the pH of the filtrate was ∼7. The resulting product was dried in an oven at 120°C overnight. The four purified materials were named: CNT-30R2 (i.e. CNT refluxed in 30% HNO3 for 2h), CNT-30R6, CNT-55R2 and CNT-55R6. 2.4 Characterisation techniques The morphology and structures of the as-prepared and acid-treated CNTs were characterized by TEM. Sample specimens for TEM studies were prepared by ultrasonic dispersion of the sample in methanol. The suspensions were dropped onto a SPI-carbon coated copper grid. TEM investigations were carried out using a FEI Tecnai Spirit G2 transmission electron microscope operating at 120kV. Energy dispersive X-ray (EDX) spectroscopy coupled with TEM was used to confirm the elemental composition of the sample. The inner and outer diameter distributions of the CNTs were obtained by using Image J software. About 120 CNT diameters were measured per sample. The zeta potential measurement was used to quantify the electrical potential of the solid particle [39]. Zeta potentials of the as-grown and acid treated CNTs were measured using a Malvern Zetasizer nano-series instrument. CNTs were dispersed in deionised water at room temperature and the pH of the suspension was adjusted from 2.0 to 12.0 by adding 0.1M hydrochloric acid (HCl) or 0.1M sodium hydroxide solution (NaOH) solution to the glass beaker containing the CNTs. By measuring the zeta potential as a function of pH, the point of zero charge (the pH value at which the zeta potential is zero, and the CNTs surface is electrically neutral) was determined. The surface area and pore volume of the as-grown as well as the acid-treated CNTs were determined by N2 physisorption using a Micromeritics TRISTAR 3000 analyzer. A sample of approximately 300mg was degassed at 150°C and 250°C for 4h under a flow of N2, and then the surface area and pore volume were determined by the Brunauer–Emmett–Teller (BET) method as described by Idakiev et al. [40]. The TGA analysis was done on a PerkinElmer STA 4000 analyzer. About 5–10mg of sample was placed in a ceramic pan and placed in the instrument's furnace. The temperature of the sample was increased from room temperature to 900°C at 10°C/min under either an oxidative atmosphere (air, 20ml/min) or an inert atmosphere (N2, 20ml/min). The TGA profile obtained gave information on the sample composition, thermal stability under a specific atmosphere and purity. The derivative curve (DTG) was used to identify the decomposition temperature maxima. The extent to which oxygen was introduced during the purification step was also assessed using thermogravimetric analysis of the CNTs in an inert atmosphere [3]. Raman spectroscopy (Jobin-Yvon T64000 micro-Raman spectrometer) was employed to evaluate the quality of the CNTs. The presence of oxygen-containing surface groups on the CNTs was established by recording FTIR spectra on a Bruker TENSOR 27 FTIR spectrometer in the 400–4000cm−1 wavenumber range, at a spectral resolution of 4cm−1 using 64 scans per spectrum. 2.5 Fischer–Tropsch experiments All the catalysts used in the Fischer–Tropsch runs were prepared by the deposition precipitation (DPU) method using urea as the precipitating agent [36,38]. A predetermined amount of Fe(NO3)3·9H2O (Sigma–Aldrich) was used to prepare a 10% Fe/CNT sample. The resultant catalysts were dried (120°C overnight) and calcined (heating in nitrogen at 250°C for 150min) to decompose the salts. The catalysts were characterised using BET surface area, H2 chemisorption, TPR and TEM procedures. The Fischer–Tropsch synthesis was performed in a fixed-bed micro reactor [41,42]. Gas cylinders containing H2/CO/N2 mixtures (60% H2, 30% CO and 10% N2; purity: 99.99%) were used to supply the reactant gas stream to the catalyst. Nitrogen was used as an internal standard in order to ensure an accurate mass balance. Catalyst (0.5g) was added to the reactor and reduced in situ at 350°C for 20h under a stream of pure hydrogen (2bar pressure, 20ml/min). After reduction the temperature was decreased to 275°C, the pressure was increased gradually to 8bar and a flow of syngas was passed over the catalyst bed with a similar flowrate (GHSV=2400h−1). All gas lines after the reactor were kept at 150°C and the hot trap placed immediately after the reactor was held at 150°C in order to collect wax. A second trap kept at ambient temperature was used to collect the oil and water mixture. The flow of gases was controlled using a metering valve and measured with a bubble meter. The gaseous product stream was analysed online using two gas chromatographs. An offline GC was used to analyse the oil and wax. Data analysis used in our study was performed by standard procedures as described elsewhere [36,42,43]. 3 Results and discussion 3.1 Electron microscopy Among the numerous known techniques employed to synthesise CNTs, CCVD is the most reproducible, cheapest and easily scalable method [16,17]. This method was therefore used in this study to synthesise CNTs. The majority of the tubes had outer diameters ranging from 20 to 35nm and inner diameters ranging from 8 to 18nm (Figs. 1 and 2 ). After acid treatment using the harshest oxidizing condition (sample CNT-55R6), the CNT inner diameter hardly changed but the outer diameter decreased relative to the non acid treated sample. This reduction in diameter is due to the interaction of acid with the outermost graphene layers (Fig. 2). The decreased outer diameter is also attributed to wall damage during acid treatment and this is confirmed by TEM micrographs (Fig. 3 ). TEM images of the as-grown CNTs (Fig. 1b and Figure S2) reveal encapsulated metal particles which were shown by EDX analysis to be Fe and Co (Figure S1a-supporting information). After acid treatment, the residual catalyst was removed (Figure S1b-supporting information) due to the dissolution of the metal catalysts by nitric acid. However removal of all the Fe and Co catalyst that was observed within the tubes was not possible. The TEM images also revealed that the roughness increased with nitric acid concentration and time of reaction. The tubes became thinner and the surface rougher (Fig. 3a–d and Figure S3). 3.2 Zeta potential measurements The determination of the zeta potential of the CNTs can be used to study the presence of oxygen surface groups. The presence of acidic groups causes the carbon surface to be more hydrophilic, increasing the negative surface charge density and decreasing the pH of the point of zero charge (PZC) [34,44]. Fig. 4 shows the plots of zeta potential of the as-grown and oxidised CNTs as a function of pH. The PZC for the as-grown CNT occurs at pH 4.9. That is at pH<4.9, the surface of the CNTs is positively charged and at pH>4.9, the surface is negatively charged. This result is in good agreement with results obtained by Li et al. [39] (see footnote to Table 1 ). After acid treatment, the PZC shifts to lower pH values due to the introduction of surface oxygen groups (Table 1). CNT-30R2, CNT-30R6 and CNT-55R2 all have values very close to a pHpzc around 2.6 with CNT-55R6 having the lowest PZC. These results suggest that acidic functional groups are formed on the carbon nanotubes surface and their concentration increases with treatment time and acid strength. 3.3 Surface area and pore volume measurements Nitrogen adsorption represents the most widely used technique to determine a materials’ surface area and to characterize its porous structure [45]. The surface area and pore volume of the as-grown and acid-treated CNTs are given in Table 2 . Prior to the surface area and pore volume analysis, the effect of degassing temperature was investigated and it was demonstrated that whether the sample is degassed at 150°C or at 250°C for 4h the surface area and pore volume values are the same within experimental error (Table 2). The surface area and pore volume increased with the initial acid treatment due to the removal of the low surface area residual CaO and possibly opening of the ends of the tubes, but did not change significantly on further treatment. 3.4 Thermogravimetric analysis (TGA) Thermogravimetric analysis (TGA), coupled with a derivative curve of the weight loss (DTG), is often used to investigate the thermal stability as well as the composition and purity of carbons. It is an effective way to quantitatively evaluate CNTs, in particular, the content of residual metal. It is easy to obtain the residual metal content using this technique by simply oxidising the CNT samples in air. The carbon material is converted to CO/CO2 and the metal catalyst is converted to an oxide [46]. Fig. 5 shows the TGA and DTG profiles of the as-grown CNTs. The residual catalyst and CaO makes up ∼17% of the mass so that 83% of the sample is due to carbonaceous materials. There is no significant weight loss before 500°C in the as-grown CNTs, thus ruling out the presence of a significant amount of amorphous carbon. In the product, the greatest rate of carbon decomposition occurs at 642°C with a small peak in the derivative curve at 729°C as seen from Fig. 5. This is a typical decomposition profile for multiwalled carbon nanotubes (MWCNTs) [46], and confirms that the carbon nanotubes were multiwalled. The small proportion of CNTs oxidising at the higher temperature could be those CNTs not in proximity to residual catalyst or due to the presence of some highly graphitised carbon. After refluxing in nitric acid, the impurity content decreased to less that 1%, with values dependent on the treatment time and acid strength. Figs. 6 and 7 show an increase in sample mass at 500°C due to the oxidation of residual Fe–Co metal; the derivative peak breadth showed an increase upon oxidation due to an increase in the number of defects. When the as-grown CNTs were refluxed in 30% HNO3 for 2h and 6h, the thermal stability of the CNTs improved slightly (Fig. 6) and the temperature at which the rate of CNT decomposition is a maximum increased from 642°C to 685°C and 690°C, respectively. This increase in thermal stability is attributed to the removal of catalyst which is known to aid the oxidation of carbon. On the other hand, when the as-grown CNTs were refluxed in 55% HNO3 for 2 and 6h, the thermal stability maxima of the CNTs decreased slightly with the decomposition temperature dropping to 633 and 639°C for the 2h and 6h treatments, respectively (Fig. 7), although the purity of the CNTs was improved. The drop in temperature can be attributed to the damage of the outer structure as confirmed by TEM and Raman spectroscopy. These observations suggest that acid concentration and not temperature has the more significant effect on achieving wall defects on CNTs. In summary, the position of the decomposition peak maximum is affected by the amount of residual catalyst in the sample, the defect content on the surface of the CNTs and the amount of amorphous carbon present. TGA profiles of the as-grown as well as the acid-treated CNTs were also recorded under a N2 atmosphere in order to determine the oxygen surface group content on the CNTs. The weight loss occurring from 150°C to 400°C corresponds to the evolution of gaseous CO2 [47] while the total weight loss from 100°C to 900°C was correlated with the weight loss due to the formation of both CO and CO2 [3] (Fig. 8 ). The derivative curve for the acid treated samples is shown in Fig. 8b. The weight loss below 100°C is due to H2O loss, between 150 and 400°C CO2 is evolved from acid (COOH) groups and the weight loss at temperature >400°C could be due to the loss of oxygen atoms tightly bonded to the surface of the CNTs or other non-graphitic carbonaceous species. Table 3 shows the % CO2 and CO formed during the experiment which corresponds to the weight loss of CNTs in a N2 atmosphere. The weight loss is plotted against the reflux time in Fig. 9 , showing an increase in the amount of CO2 evolved with increasing reflux time and acid concentration. A similar trend was observed by de Jong and Geus when working with carbon nanofibers [3]. 3.5 Raman spectroscopy Raman spectral analysis was used to determine the long range structure of the CNTs [48,49]. A major drawback of Raman spectroscopy is that it cannot provide direct information on the nature of metal impurities, and it is not very effective in studying CNT samples with a low content of amorphous carbon [50,51]. However, Raman spectra for as-grown as well as acid-treated CNTs show two characteristic peaks in all samples, one at ∼1350cm−1 corresponding to the disorder-induced band (D band) and the other at ∼1590cm−1 corresponding to the tangential mode (G band) (Fig. 10 ). The D mode indicates the disorder features of the CNTs whereas the G mode is associated with the ordered graphite in the CNTs [52]. The area ratio of the D band to the G band (I D/I G) was used to estimate the amount of disorder or defects present in the walls of the CNTs. The (I D/I G) ratio was found to increase with increasing reflux time/acid strength indicating that the longer the reflux time, the more defects are added to the CNTs. These results are in good agreement with the TEM observations. Table 4 shows the position of the D and G band as well as the ratio of areas for the as-grown and acid treated CNTs. From the results, it is observed that there is an upfield shift of the D-band for the acid-treated CNTs with respect to the as-grown CNTs. Similar observations were obtained by Okpalugo et al. and correlated with the inter-tubular coupling resulting from Van der Waals repulsions [53]. 3.6 FTIR analysis FTIR spectroscopy is a very useful and direct technique for the study of the nature of oxygen surface groups. However there are well-known experimental difficulties involved in obtaining IR spectra of carbon materials [33]. FTIR can only be used for highly oxidised carbon surfaces; otherwise the intensity of the absorption bands is very poor [54]. The FTIR data are presented in Fig. 11 . When comparing the FTIR spectra, peaks appear at 1737cm−1, 1364cm−1 and 1217cm−1 for the acid-treated CNTs relative to the as-grown CNTs. This clearly shows that acid treatment has introduced some functional groups onto the surface of the CNTs. The amount of these functional groups present on the surface depends on the reflux time and/or the acid strength. The peak appearing at ∼1737cm−1 can be ascribed to the CO stretching vibration of carboxyl or carbonyl groups [55–57] while that at 1364cm−1 is associated with NO2 stretching vibrations [58,59] and the peak at 1217cm−1 corresponds to C–O stretching and O–H bending vibrations [55–57]. It can be concluded that FTIR analysis also provides evidence for the existence of defects in the walls of the CNTs. This result is in good agreement with the Raman analysis. 3.7 Fischer–Tropsch data A series of 10% Fe/CNT catalysts was made using a deposition precipitation procedure with urea. The five catalysts (Fe/CNT-55R6, Fe/CNT-55R2, Fe/CNT-30R6, Fe/CNT-30R2, and Fe/CNT-as grown) were calcined and reduced using standard procedures (see Section 2). All FT reactions were performed under a set of standard conditions (275°C, 8bar, H2:CO=2, and GHSV=2400h−1). Fig. 12 shows a plot of the catalytic activity in terms of the percentage conversion of CO, as a function of time on stream. (See Figures S4 and S5 and Tables S1 and S2 for characterisation data for these catalysts.) The conversion for all the catalysts was initially low and increased significantly before levelling off within 10h on stream; afterward the catalyst remained relatively stable for the entire experiment (15–120h). A comparison of the FTS data obtained from the 10% catalysts prepared on differently functionalised CNTs (Table 5 ) reveals that the %CO conversions, FT activity and hydrocarbons selectivity are all dependent on the support acid pre-treatment. Thus, the 10% Fe/CNT-as grown catalyst not only has the poorest FT performance but the highest methane selectivity and lowest C5+ product selectivity of the tested catalysts. The FT activity data presented in Table 5 is given per g of catalyst, rather than as a turnover frequency. Attempts to use H2 chemisorption to determine the surface area of the active metal were unsuccessful, presumably because the particles are too small [37], as reflected by TEM. Consequently the turnover frequency could not be calculated. It was observed that the FT activity increased with increasing amount of oxygen functional groups on the support, i.e. the FT activity followed the order Fe/CNT-55R6>Fe/CNT-55R2>Fe/CNT-30R6>Fe/CNT-30R2>Fe/CNT-as grown. From the zeta potential measurements, it can be seen that CNT-55R6 has the highest concentration of negative charge and should lead to the best Fe dispersion; this is also the catalyst with the highest activity. The better dispersion of the metal particles on the surface of CNT-55R6 is due to the availability of the extra anchoring sites for the Fe particles, leading to the smaller Fe particles [37] and the better performance during FTS. This study thus reveals that CNTs that are functionalised using vigorous acid treatments generate stable carbon materials that can be used as supports in catalytic reactions. The role of the acid treatment is to create roughened carbon surfaces that facilitate metal binding to the surface through COOH (and possibly OH) groups. The study thus confirms the earlier proposals relating to the role of ‘docking stations’ generated by acid treatment of CNTs [37]. 4 Conclusions Carbon nanotubes were successfully synthesized using the CCVD method. The as-grown CNTs were purified by refluxing the obtained product in nitric acid. Purification not only removes the impurities, but also introduces oxygenated surface groups onto the CNTs. The presence of those groups altered the surface chemistry of CNTs. The different oxygen functional groups on the CNT surfaces were qualitatively identified by FTIR spectroscopy. Their presence was also detected by Raman spectroscopy where the amount of disorder was related to the presence of surface defects introduced by nitric acid treatment. Zeta potential measurements show that the PZC decreased with treatment time/acid strength indicating an increase in surface acid groups with time. Thermogravimetric analysis revealed that the CNTs produced were multiwalled as indicated by the oxidation temperature profiles typical of MWCNTs. The amount of CO2/CO desorbed from the surface of CNTs was a function of CNTs treatment time/acid strength. Refluxing CNTs in HNO3 is suitable for the creation of surface functional groups. In summary, acid treatment of CNTs produced from Fe–Co on CaCO3 can readily generate roughened CNT surfaces and these carbons can be used as stable supports for Fischer–Tropsch catalysts as shown here and in other studies [37]. The activity of the FT catalysts correlates with the degree of acid functionalisation of the support, indicating that the surface groups introduced during the acid treatment are linked to the active sites. Acknowledgements The authors wish to thank the Andrew W. Mellon Foundation, the National Research Foundation of South Africa and the University of the Witwatersrand for research funds. Appendix A Supplementary data Supplementary data associated with this article can be found, in the online version, at doi:10.1016/j.molcata.2010.11.033. Appendix A Supplementary data References [1] M.L. Toebes J.M.P. van Heeswijk J.H. Bitter A. Jos van Dillen K.P. de Jong Carbon 42 2004 307 [2] J.H. Zhou Z.J. Sui J. Zhu P. Li D. Chen Y.C. Dai W.K. Yuan Carbon 45 2007 785 [3] K.P. De Jong J.W. Geus Catal. Rev. Sci. Eng. 42 2000 481 [4] M.L. Toebes J.H. Bitter A.J. van Dillen K.P. de Jong Catal. Today 76 2002 33 [5] S. Iijima Nature 354 1991 56 [6] H. Dai Acc. Chem. Res. 35 2002 1035 [7] M.S. Dresselhaus G. Dresselhaus P.C. Eklund D.E.H. Jones Science of Fullerenes and Carbon Nanotubes 1996 Academic Press San Diego pp. 1–985 [8] A. Thess R. Lee P. Nikolaev H. Dai P. Petit J. Robert C.H. Xu Y.H. Lee S.G. Kim A.G. Rinzler D.T. Colbert G.E. Scuseria D. Tomanek J.E. Fischer R.E. Smalley Science 273 1996 483 [9] T.W. Ebbesen P.M. Ajayan Nature 358 1992 220 [10] C. Journet W.K. Maser P. Bernier A. Loiseau M.L. delaChapelle S. Lefrant P. Deniard R. Lee J.E. Fischer Nature 388 1997 756 [11] C. Bower O. Zhou W. Zhu D.J. Werder S. Jin Appl. Phys. Lett. 77 2000 2767 [12] S.S. Fan M.G. Chapline N.R. Franklin T.W. Tombler A.M. Cassell H.J. Dai Science 283 1999 512 [13] M. Su B. Zheng J. Liu Chem. Phys. Lett. 322 2000 321 [14] Z.F. Ren Z.P. Huang J.W. Xu J.H. Wang P. Bush M.P. Siegal P.N. Provencio Science 282 1998 1105 [15] Z. Li E. Dervishi Y. Xu X. Ma V. Saini A.S. Biris R. Little A.R. Biris D. Lupu J. Chem. Phys. 129 2008 074712 [16] A. Magrez J.W. Seo C. Miko K. Hernadi L. Forro J. Phys. Chem. B 109 2005 10087 [17] E. Couteau K. Hernadi J.W. Seo L. Thiên-Nga C. Mikó R. Gaál L. Forró Chem. Phys. Lett. 378 9 2003 [18] S. Porro S. Musso M. Giorcelli A. Chiodoni A. Tagliaferro Phys. E: Low-dimen. Syst. Nanostruct. 37 2007 16 [19] H. Kathyayini N. Nagaraju A. Fonseca J.B. Nagy J. Mol. Catal. A: Chem. 223 2004 129 [20] J.A. Seo E. Couteau P. Umek K. Hernadi P. Marcoux B. Lukic L. Forro New J. Phys. 5 2003 120 [21] S.D. Mhlanga K.C. Mondal R. Carter M.J. Witcomb N.J. Coville S. Afr. J. Chem. 62 2009 67 [22] M. Kumar Y. Ando J. Nanosci. Nanotechnol. 10 2010 3739 [23] S.D. Mhlanga N.J. Coville Diamond Relat. Mater. 17 2008 1489 [24] D. Vairavapandian P. Vichchulada M.D. Lay Anal. Chim. Acta 626 2008 119 [25] I.D. Rosca F. Watari M. Uo T. Akasaka Carbon 43 2005 3124 [26] T.G. Ros A.J. Van Dillen J.W. Geus D.C. Koningsberger Chem. Eur. J. 8 2002 1151 [27] H.P. Boehm Carbon 40 2002 145 [28] K. Esumi M. Ishigami A. Nakajima K. Sawada H. Honda Carbon 34 1996 279 [29] P. Serp M. Corrias P. Kalck Appl. Catal. A: Gen. 253 2003 337 [30] W. Chen J. Li L. Liu Z. Jia Y. Yu Z. Zhang J. Appl. Electrochem. 33 2003 755 [31] H.P. Boehm Adv. Catal. Relat. Subjects 16 1966 179 [32] F. Rodríguez-Reinoso Carbon 36 1998 159 [33] C. Prado-Burguete A. Linares-Solano F. Rodriguez-Reinoso C. de Lecea J. Catal. 115 1989 98 [34] H.P. Boehm Carbon 32 1994 759 [35] Y.P. Sun K. Fu Y. Lin W. Huang Acc. Chem. Res. 35 2002 1096 [36] M.C. Bahome L.L. Jewell D. Hildebrandt D. Glasser N.J. Coville Appl. Catal. A: Gen. 287 2005 60 [37] U.M. Graham A. Dozier R.A. Khatri M.C. Bahome L.L. Jewell S.D. Mhlanga N.J. Coville B.H. Davis Catal. Lett. 129 2009 39 [38] E. van Steen F.F. Prinsloo Catal. Today 71 2002 327 [39] Y.H. Li S. Wang Z. Luan J. Ding C. Xu D. Wu Carbon 41 2003 1057 [40] V. Idakiev Z.Y. Yuan T. Tabakova B.L. Su Appl. Catal. A: Gen. 281 2005 149 [41] M.E. Dry Appl. Catal. A: Gen. 138 1996 319 [42] D.J. Duvenhage N.J. Coville Appl. Catal. A: Gen. 153 1997 43 [43] R.M.M. Abbaslou A. Tavasoli A.K. Dalai Appl. Catal. A: Gen. 355 2009 33 [44] C. Moreno-Castilla M.A. Ferro-Garcia J.P. Joly I. Bautista-Toledo F. Carrasco-Marin J. Rivera-Utrilla Langmuir 11 1995 4386 [45] G. Leofanti M. Padovan G. Tozzola B. Venturelli Catal. Today 41 1998 207 [46] A.R. Harutyunyan B.K. Pradhan J. Chang G. Chen P.C. Eklund J. Phys. Chem. B 106 2002 8671 [47] M.N. Kirikova A.S. Ivanov S.V. Savilov V.V. Lunin Russ. Chem. Bull. 57 2008 298 [48] J. Kastner T. Pichler H. Kuzmany S. Curran W. Blau D.N. Weldon M. Delamesiere S. Draper H. Zandbergen Chem. Phys. Lett. 221 1994 53 [49] F.X. Wang X.P. Gao Z.W. Lu S.H. Ye J.Q. Qu F. Wu H.T. Yuan D.Y. Song J. Alloys Compd. 370 2004 326 [50] P.X. Hou C. Liu H.M. Cheng Carbon 46 2008 2003 [51] T.J. Park S. Banerjee T. Hemraj-Benny S.S. Wong J. Mater. Chem. 16 2006 141 [52] A. Jorio M.A. Pimenta A.G. Souza Filho R. Saito G. Dresselhaus M.S. Dresselhaus New J. Phys. 5 2003 139 [53] T.I.T. Okpalugo P. Papakonstantinou H. Murphy J. Mclaughlin N.M.D. Brown Carbon 43 2005 2951 [54] S. Kundu Y. Wang W. Xia M. Muhler J. Phys. Chem. C 112 2008 16869 [55] W.M. Prest R.A. Mosher Anonymous Colloids and Surfaces in Reprographic Technology ACS Symposium Series 1982 [56] P. Painter, M. Starsinic, M. Coleman, IV, In: J.R. Ferraro, L.L. Basile (Eds.), Fourier Transform Infrared Spectra Vol. 4: Applications to Chemical Systems (Fourier Transform Infrared Spectroscopy) Academic Press, Orlando, 1985, p. 169. [57] M.S.P. Shaffer X. Fan A.H. Windle Carbon 36 1998 1603 [58] U. Zielke K.J. Hüttinger W.P. Hoffman Carbon 34 1996 983 [59] M.M. Keyser F.F. Prinsloo B.H. Davis M.L. Occelli Studies on Surface Science Catalysis, 2007 Elsevier p. 45",
      "scopus-id": "78751641835",
      "coredata": {
        "eid": "1-s2.0-S1381116910005017",
        "dc:description": "Carbon nanotubes (CNTs) were obtained through the catalytic decomposition of C2H2 at 700°C over Fe–Co supported on CaCO3 and confirmed by TEM to be composed of multiwalled carbon nanotubes. The CNTs were refluxed in 30% and 55% HNO3 for 2 and 6h in order to remove impurities and introduce oxygen surface groups. This rendered the CNTs less hydrophobic. The morphology, microstructure, surface area, pore volume and surface chemical properties of the acid treated CNTs were analysed by TEM, N2 physisorption, TGA, FTIR, Raman spectroscopy and zeta potential measurements. The surface roughness, together with the degree of surface functionalization correlated with the harshness (time and concentration) of the acid treatment. Fischer–Tropsch synthesis studies (275°C, 8bar) were performed on all the Fe loaded (10%)/CNT catalysts and activity studies revealed that the more severe the acid treatment the higher the activity of the catalysts.",
        "openArchiveArticle": "false",
        "prism:coverDate": "2011-02-01",
        "openaccessUserLicense": null,
        "prism:aggregationType": "Journal",
        "prism:url": "https://api.elsevier.com/content/article/pii/S1381116910005017",
        "dc:creator": [
          {
            "@_fa": "true",
            "$": "Motchelaho, Myriam A.M."
          },
          {
            "@_fa": "true",
            "$": "Xiong, Haifeng"
          },
          {
            "@_fa": "true",
            "$": "Moyo, Mahluli"
          },
          {
            "@_fa": "true",
            "$": "Jewell, Linda L."
          },
          {
            "@_fa": "true",
            "$": "Coville, Neil J."
          }
        ],
        "link": [
          {
            "@_fa": "true",
            "@rel": "self",
            "@href": "https://api.elsevier.com/content/article/pii/S1381116910005017"
          },
          {
            "@_fa": "true",
            "@rel": "scidir",
            "@href": "https://www.sciencedirect.com/science/article/pii/S1381116910005017"
          }
        ],
        "dc:format": "application/json",
        "openaccessType": null,
        "pii": "S1381-1169(10)00501-7",
        "prism:volume": "335",
        "prism:publisher": "Elsevier B.V.",
        "dc:title": "Effect of acid treatment on the surface of multiwalled carbon nanotubes prepared from Fe–Co supported on CaCO3: Correlation with Fischer–Tropsch catalyst activity",
        "prism:copyright": "Copyright © 2010 Elsevier B.V. All rights reserved.",
        "openaccess": "0",
        "prism:issn": "13811169",
        "prism:issueIdentifier": "1-2",
        "dcterms:subject": [
          {
            "@_fa": "true",
            "$": "Iron–cobalt catalyst"
          },
          {
            "@_fa": "true",
            "$": "CaCO3 support"
          },
          {
            "@_fa": "true",
            "$": "Fischer–Tropsch activity"
          },
          {
            "@_fa": "true",
            "$": "Multiwalled carbon nanotubes"
          }
        ],
        "openaccessArticle": "false",
        "prism:publicationName": "Journal of Molecular Catalysis A: Chemical",
        "prism:number": "1-2",
        "openaccessSponsorType": null,
        "prism:pageRange": "189-198",
        "prism:endingPage": "198",
        "pubType": "fla",
        "prism:coverDisplayDate": "1 February 2011",
        "prism:doi": "10.1016/j.molcata.2010.11.033",
        "prism:startingPage": "189",
        "dc:identifier": "doi:10.1016/j.molcata.2010.11.033",
        "openaccessSponsorName": null
      },
      "objects": {
        "object": [
          {
            "@category": "standard",
            "@height": "319",
            "@width": "647",
            "@_fa": "true",
            "$": "https://api.elsevier.com/content/object/eid/1-s2.0-S1381116910005017-gr1.jpg?httpAccept=%2A%2F%2A",
            "@multimediatype": "JPEG image file",
            "@type": "IMAGE-DOWNSAMPLED",
            "@size": "55272",
            "@ref": "gr1",
            "@mimetype": "image/jpeg"
          },
          {
            "@category": "thumbnail",
            "@height": "108",
            "@width": "219",
            "@_fa": "true",
            "$": "https://api.elsevier.com/content/object/eid/1-s2.0-S1381116910005017-gr1.sml?httpAccept=%2A%2F%2A",
            "@multimediatype": "GIF image file",
            "@type": "IMAGE-THUMBNAIL",
            "@size": "6834",
            "@ref": "gr1",
            "@mimetype": "image/gif"
          },
          {
            "@category": "high",
            "@height": "1413",
            "@width": "2866",
            "@_fa": "true",
            "$": "https://api.elsevier.com/content/object/eid/1-s2.0-S1381116910005017-gr1_lrg.jpg?httpAccept=%2A%2F%2A",
            "@multimediatype": "JPEG image file",
            "@type": "IMAGE-HIGH-RES",
            "@size": "712754",
            "@ref": "gr1",
            "@mimetype": "image/jpeg"
          },
          {
            "@category": "standard",
            "@height": "503",
            "@width": "711",
            "@_fa": "true",
            "$": "https://api.elsevier.com/content/object/eid/1-s2.0-S1381116910005017-gr10.jpg?httpAccept=%2A%2F%2A",
            "@multimediatype": "JPEG image file",
            "@type": "IMAGE-DOWNSAMPLED",
            "@size": "48145",
            "@ref": "gr10",
            "@mimetype": "image/jpeg"
          },
          {
            "@category": "thumbnail",
            "@height": "155",
            "@width": "219",
            "@_fa": "true",
            "$": "https://api.elsevier.com/content/object/eid/1-s2.0-S1381116910005017-gr10.sml?httpAccept=%2A%2F%2A",
            "@multimediatype": "GIF image file",
            "@type": "IMAGE-THUMBNAIL",
            "@size": "4534",
            "@ref": "gr10",
            "@mimetype": "image/gif"
          },
          {
            "@category": "high",
            "@height": "2227",
            "@width": "3148",
            "@_fa": "true",
            "$": "https://api.elsevier.com/content/object/eid/1-s2.0-S1381116910005017-gr10_lrg.jpg?httpAccept=%2A%2F%2A",
            "@multimediatype": "JPEG image file",
            "@type": "IMAGE-HIGH-RES",
            "@size": "407068",
            "@ref": "gr10",
            "@mimetype": "image/jpeg"
          },
          {
            "@category": "standard",
            "@height": "296",
            "@width": "355",
            "@_fa": "true",
            "$": "https://api.elsevier.com/content/object/eid/1-s2.0-S1381116910005017-gr11.jpg?httpAccept=%2A%2F%2A",
            "@multimediatype": "JPEG image file",
            "@type": "IMAGE-DOWNSAMPLED",
            "@size": "25368",
            "@ref": "gr11",
            "@mimetype": "image/jpeg"
          },
          {
            "@category": "thumbnail",
            "@height": "164",
            "@width": "197",
            "@_fa": "true",
            "$": "https://api.elsevier.com/content/object/eid/1-s2.0-S1381116910005017-gr11.sml?httpAccept=%2A%2F%2A",
            "@multimediatype": "GIF image file",
            "@type": "IMAGE-THUMBNAIL",
            "@size": "5474",
            "@ref": "gr11",
            "@mimetype": "image/gif"
          },
          {
            "@category": "high",
            "@height": "1309",
            "@width": "1571",
            "@_fa": "true",
            "$": "https://api.elsevier.com/content/object/eid/1-s2.0-S1381116910005017-gr11_lrg.jpg?httpAccept=%2A%2F%2A",
            "@multimediatype": "JPEG image file",
            "@type": "IMAGE-HIGH-RES",
            "@size": "229778",
            "@ref": "gr11",
            "@mimetype": "image/jpeg"
          },
          {
            "@category": "standard",
            "@height": "291",
            "@width": "383",
            "@_fa": "true",
            "$": "https://api.elsevier.com/content/object/eid/1-s2.0-S1381116910005017-gr12.jpg?httpAccept=%2A%2F%2A",
            "@multimediatype": "JPEG image file",
            "@type": "IMAGE-DOWNSAMPLED",
            "@size": "29917",
            "@ref": "gr12",
            "@mimetype": "image/jpeg"
          },
          {
            "@category": "thumbnail",
            "@height": "164",
            "@width": "215",
            "@_fa": "true",
            "$": "https://api.elsevier.com/content/object/eid/1-s2.0-S1381116910005017-gr12.sml?httpAccept=%2A%2F%2A",
            "@multimediatype": "GIF image file",
            "@type": "IMAGE-THUMBNAIL",
            "@size": "5901",
            "@ref": "gr12",
            "@mimetype": "image/gif"
          },
          {
            "@category": "high",
            "@height": "1293",
            "@width": "1699",
            "@_fa": "true",
            "$": "https://api.elsevier.com/content/object/eid/1-s2.0-S1381116910005017-gr12_lrg.jpg?httpAccept=%2A%2F%2A",
            "@multimediatype": "JPEG image file",
            "@type": "IMAGE-HIGH-RES",
            "@size": "248957",
            "@ref": "gr12",
            "@mimetype": "image/jpeg"
          },
          {
            "@category": "standard",
            "@height": "291",
            "@width": "701",
            "@_fa": "true",
            "$": "https://api.elsevier.com/content/object/eid/1-s2.0-S1381116910005017-gr2.jpg?httpAccept=%2A%2F%2A",
            "@multimediatype": "JPEG image file",
            "@type": "IMAGE-DOWNSAMPLED",
            "@size": "38588",
            "@ref": "gr2",
            "@mimetype": "image/jpeg"
          },
          {
            "@category": "thumbnail",
            "@height": "91",
            "@width": "219",
            "@_fa": "true",
            "$": "https://api.elsevier.com/content/object/eid/1-s2.0-S1381116910005017-gr2.sml?httpAccept=%2A%2F%2A",
            "@multimediatype": "GIF image file",
            "@type": "IMAGE-THUMBNAIL",
            "@size": "4242",
            "@ref": "gr2",
            "@mimetype": "image/gif"
          },
          {
            "@category": "high",
            "@height": "1289",
            "@width": "3103",
            "@_fa": "true",
            "$": "https://api.elsevier.com/content/object/eid/1-s2.0-S1381116910005017-gr2_lrg.jpg?httpAccept=%2A%2F%2A",
            "@multimediatype": "JPEG image file",
            "@type": "IMAGE-HIGH-RES",
            "@size": "390368",
            "@ref": "gr2",
            "@mimetype": "image/jpeg"
          },
          {
            "@category": "standard",
            "@height": "649",
            "@width": "652",
            "@_fa": "true",
            "$": "https://api.elsevier.com/content/object/eid/1-s2.0-S1381116910005017-gr3.jpg?httpAccept=%2A%2F%2A",
            "@multimediatype": "JPEG image file",
            "@type": "IMAGE-DOWNSAMPLED",
            "@size": "113478",
            "@ref": "gr3",
            "@mimetype": "image/jpeg"
          },
          {
            "@category": "thumbnail",
            "@height": "163",
            "@width": "164",
            "@_fa": "true",
            "$": "https://api.elsevier.com/content/object/eid/1-s2.0-S1381116910005017-gr3.sml?httpAccept=%2A%2F%2A",
            "@multimediatype": "GIF image file",
            "@type": "IMAGE-THUMBNAIL",
            "@size": "8558",
            "@ref": "gr3",
            "@mimetype": "image/gif"
          },
          {
            "@category": "high",
            "@height": "2876",
            "@width": "2888",
            "@_fa": "true",
            "$": "https://api.elsevier.com/content/object/eid/1-s2.0-S1381116910005017-gr3_lrg.jpg?httpAccept=%2A%2F%2A",
            "@multimediatype": "JPEG image file",
            "@type": "IMAGE-HIGH-RES",
            "@size": "1452484",
            "@ref": "gr3",
            "@mimetype": "image/jpeg"
          },
          {
            "@category": "standard",
            "@height": "255",
            "@width": "365",
            "@_fa": "true",
            "$": "https://api.elsevier.com/content/object/eid/1-s2.0-S1381116910005017-gr4.jpg?httpAccept=%2A%2F%2A",
            "@multimediatype": "JPEG image file",
            "@type": "IMAGE-DOWNSAMPLED",
            "@size": "20404",
            "@ref": "gr4",
            "@mimetype": "image/jpeg"
          },
          {
            "@category": "thumbnail",
            "@height": "153",
            "@width": "219",
            "@_fa": "true",
            "$": "https://api.elsevier.com/content/object/eid/1-s2.0-S1381116910005017-gr4.sml?httpAccept=%2A%2F%2A",
            "@multimediatype": "GIF image file",
            "@type": "IMAGE-THUMBNAIL",
            "@size": "4687",
            "@ref": "gr4",
            "@mimetype": "image/gif"
          },
          {
            "@category": "high",
            "@height": "1130",
            "@width": "1616",
            "@_fa": "true",
            "$": "https://api.elsevier.com/content/object/eid/1-s2.0-S1381116910005017-gr4_lrg.jpg?httpAccept=%2A%2F%2A",
            "@multimediatype": "JPEG image file",
            "@type": "IMAGE-HIGH-RES",
            "@size": "174866",
            "@ref": "gr4",
            "@mimetype": "image/jpeg"
          },
          {
            "@category": "standard",
            "@height": "262",
            "@width": "377",
            "@_fa": "true",
            "$": "https://api.elsevier.com/content/object/eid/1-s2.0-S1381116910005017-gr5.jpg?httpAccept=%2A%2F%2A",
            "@multimediatype": "JPEG image file",
            "@type": "IMAGE-DOWNSAMPLED",
            "@size": "21291",
            "@ref": "gr5",
            "@mimetype": "image/jpeg"
          },
          {
            "@category": "thumbnail",
            "@height": "152",
            "@width": "219",
            "@_fa": "true",
            "$": "https://api.elsevier.com/content/object/eid/1-s2.0-S1381116910005017-gr5.sml?httpAccept=%2A%2F%2A",
            "@multimediatype": "GIF image file",
            "@type": "IMAGE-THUMBNAIL",
            "@size": "4997",
            "@ref": "gr5",
            "@mimetype": "image/gif"
          },
          {
            "@category": "high",
            "@height": "1162",
            "@width": "1669",
            "@_fa": "true",
            "$": "https://api.elsevier.com/content/object/eid/1-s2.0-S1381116910005017-gr5_lrg.jpg?httpAccept=%2A%2F%2A",
            "@multimediatype": "JPEG image file",
            "@type": "IMAGE-HIGH-RES",
            "@size": "182236",
            "@ref": "gr5",
            "@mimetype": "image/jpeg"
          },
          {
            "@category": "standard",
            "@height": "267",
            "@width": "684",
            "@_fa": "true",
            "$": "https://api.elsevier.com/content/object/eid/1-s2.0-S1381116910005017-gr6.jpg?httpAccept=%2A%2F%2A",
            "@multimediatype": "JPEG image file",
            "@type": "IMAGE-DOWNSAMPLED",
            "@size": "34329",
            "@ref": "gr6",
            "@mimetype": "image/jpeg"
          },
          {
            "@category": "thumbnail",
            "@height": "85",
            "@width": "219",
            "@_fa": "true",
            "$": "https://api.elsevier.com/content/object/eid/1-s2.0-S1381116910005017-gr6.sml?httpAccept=%2A%2F%2A",
            "@multimediatype": "GIF image file",
            "@type": "IMAGE-THUMBNAIL",
            "@size": "3741",
            "@ref": "gr6",
            "@mimetype": "image/gif"
          },
          {
            "@category": "high",
            "@height": "1181",
            "@width": "3027",
            "@_fa": "true",
            "$": "https://api.elsevier.com/content/object/eid/1-s2.0-S1381116910005017-gr6_lrg.jpg?httpAccept=%2A%2F%2A",
            "@multimediatype": "JPEG image file",
            "@type": "IMAGE-HIGH-RES",
            "@size": "313743",
            "@ref": "gr6",
            "@mimetype": "image/jpeg"
          },
          {
            "@category": "standard",
            "@height": "261",
            "@width": "667",
            "@_fa": "true",
            "$": "https://api.elsevier.com/content/object/eid/1-s2.0-S1381116910005017-gr7.jpg?httpAccept=%2A%2F%2A",
            "@multimediatype": "JPEG image file",
            "@type": "IMAGE-DOWNSAMPLED",
            "@size": "35515",
            "@ref": "gr7",
            "@mimetype": "image/jpeg"
          },
          {
            "@category": "thumbnail",
            "@height": "86",
            "@width": "219",
            "@_fa": "true",
            "$": "https://api.elsevier.com/content/object/eid/1-s2.0-S1381116910005017-gr7.sml?httpAccept=%2A%2F%2A",
            "@multimediatype": "GIF image file",
            "@type": "IMAGE-THUMBNAIL",
            "@size": "3931",
            "@ref": "gr7",
            "@mimetype": "image/gif"
          },
          {
            "@category": "high",
            "@height": "1155",
            "@width": "2952",
            "@_fa": "true",
            "$": "https://api.elsevier.com/content/object/eid/1-s2.0-S1381116910005017-gr7_lrg.jpg?httpAccept=%2A%2F%2A",
            "@multimediatype": "JPEG image file",
            "@type": "IMAGE-HIGH-RES",
            "@size": "324547",
            "@ref": "gr7",
            "@mimetype": "image/jpeg"
          },
          {
            "@category": "standard",
            "@height": "259",
            "@width": "689",
            "@_fa": "true",
            "$": "https://api.elsevier.com/content/object/eid/1-s2.0-S1381116910005017-gr8.jpg?httpAccept=%2A%2F%2A",
            "@multimediatype": "JPEG image file",
            "@type": "IMAGE-DOWNSAMPLED",
            "@size": "41735",
            "@ref": "gr8",
            "@mimetype": "image/jpeg"
          },
          {
            "@category": "thumbnail",
            "@height": "82",
            "@width": "219",
            "@_fa": "true",
            "$": "https://api.elsevier.com/content/object/eid/1-s2.0-S1381116910005017-gr8.sml?httpAccept=%2A%2F%2A",
            "@multimediatype": "GIF image file",
            "@type": "IMAGE-THUMBNAIL",
            "@size": "3802",
            "@ref": "gr8",
            "@mimetype": "image/gif"
          },
          {
            "@category": "high",
            "@height": "1146",
            "@width": "3050",
            "@_fa": "true",
            "$": "https://api.elsevier.com/content/object/eid/1-s2.0-S1381116910005017-gr8_lrg.jpg?httpAccept=%2A%2F%2A",
            "@multimediatype": "JPEG image file",
            "@type": "IMAGE-HIGH-RES",
            "@size": "365119",
            "@ref": "gr8",
            "@mimetype": "image/jpeg"
          },
          {
            "@category": "standard",
            "@height": "303",
            "@width": "374",
            "@_fa": "true",
            "$": "https://api.elsevier.com/content/object/eid/1-s2.0-S1381116910005017-gr9.jpg?httpAccept=%2A%2F%2A",
            "@multimediatype": "JPEG image file",
            "@type": "IMAGE-DOWNSAMPLED",
            "@size": "13945",
            "@ref": "gr9",
            "@mimetype": "image/jpeg"
          },
          {
            "@category": "thumbnail",
            "@height": "164",
            "@width": "202",
            "@_fa": "true",
            "$": "https://api.elsevier.com/content/object/eid/1-s2.0-S1381116910005017-gr9.sml?httpAccept=%2A%2F%2A",
            "@multimediatype": "GIF image file",
            "@type": "IMAGE-THUMBNAIL",
            "@size": "3062",
            "@ref": "gr9",
            "@mimetype": "image/gif"
          },
          {
            "@category": "high",
            "@height": "1346",
            "@width": "1659",
            "@_fa": "true",
            "$": "https://api.elsevier.com/content/object/eid/1-s2.0-S1381116910005017-gr9_lrg.jpg?httpAccept=%2A%2F%2A",
            "@multimediatype": "JPEG image file",
            "@type": "IMAGE-HIGH-RES",
            "@size": "110426",
            "@ref": "gr9",
            "@mimetype": "image/jpeg"
          },
          {
            "@category": "standard",
            "@_fa": "true",
            "$": "https://api.elsevier.com/content/object/eid/1-s2.0-S1381116910005017-mmc1.doc?httpAccept=%2A%2F%2A",
            "@multimediatype": "Microsoft Word file",
            "@type": "APPLICATION",
            "@size": "635392",
            "@ref": "mmc1",
            "@mimetype": "application/word"
          },
          {
            "@category": "standard",
            "@height": "200",
            "@width": "500",
            "@_fa": "true",
            "$": "https://api.elsevier.com/content/object/eid/1-s2.0-S1381116910005017-fx1.jpg?httpAccept=%2A%2F%2A",
            "@multimediatype": "JPEG image file",
            "@type": "IMAGE-DOWNSAMPLED",
            "@size": "22917",
            "@ref": "fx1",
            "@mimetype": "image/jpeg"
          },
          {
            "@category": "thumbnail",
            "@height": "88",
            "@width": "219",
            "@_fa": "true",
            "$": "https://api.elsevier.com/content/object/eid/1-s2.0-S1381116910005017-fx1.sml?httpAccept=%2A%2F%2A",
            "@multimediatype": "GIF image file",
            "@type": "IMAGE-THUMBNAIL",
            "@size": "4381",
            "@ref": "fx1",
            "@mimetype": "image/gif"
          },
          {
            "@category": "high",
            "@height": "886",
            "@width": "2213",
            "@_fa": "true",
            "$": "https://api.elsevier.com/content/object/eid/1-s2.0-S1381116910005017-fx1_lrg.jpg?httpAccept=%2A%2F%2A",
            "@multimediatype": "JPEG image file",
            "@type": "IMAGE-HIGH-RES",
            "@size": "209853",
            "@ref": "fx1",
            "@mimetype": "image/jpeg"
          }
        ]
      },
      "link": {
        "@rel": "abstract",
        "@href": "https://api.elsevier.com/content/abstract/scopus_id/78751641835"
      }
    }
  }
}