{
  "metadata": {
    "title": "New Mn(II) and Cu(II) chiral C<ce:inf loc=post>2</ce:inf>-multidentate complexes immobilised in zeolites (USY, MCM41): Reusable catalysts for selective oxidation reactions",
    "authors": "; ; ",
    "journal": "Journal of Molecular Catalysis A: Chemical",
    "date": "2003-03-03",
    "doi": "10.1016/S1381-1169(02)00514-9",
    "abstract": "",
    "uri": "https://api.elsevier.com/content/article/pii/S1381116902005149",
    "pii": "S1381116902005149"
  },
  "fulltext": {
    "full-text-retrieval-response": {
      "scopus-eid": "2-s2.0-0037416396",
      "originalText": "serial JL 271358 291210 291744 291790 291809 31 Journal of Molecular Catalysis A: Chemical JOURNALMOLECULARCATALYSISACHEMICAL 2002-10-23 2002-10-23 2010-04-18T22:33:40 1-s2.0-S1381116902005149 S1381-1169(02)00514-9 S1381116902005149 10.1016/S1381-1169(02)00514-9 S300 S300.1 FULL-TEXT 1-s2.0-S1381116900X0163X 2015-05-15T05:56:33.301439-04:00 0 0 20030303 2003 2002-10-23T00:00:00Z articleinfo crossmark dco dateupdated tomb dateloaded datesearch indexeddate issuelist volumelist yearnav absattachment articletitlenorm authfirstinitialnorm authfirstsurnamenorm cid cids contenttype copyright dateloadedtxt docsubtype doctype doi eid ewtransactionid hubeid issfirst issn issnnorm itemstage itemtransactionid itemweight openaccess openarchive pg pgfirst pglast pii piinorm pubdatestart pubdatetxt pubyr sortorder srctitle srctitlenorm srctype subheadings volfirst volissue webpdf webpdfpagecount figure table body acknowledge affil articletitle auth authfirstini authfull authkeywords authlast footnotes primabst ref specialabst alllist content subj ssids 1381-1169 13811169 194 194 1 2 1 2 Volume 194, Issues 1–2 15 137 152 137 152 20030303 3 March 2003 2003-03-03 2003 converted-article fla Copyright © 2002 Elsevier Science B.V. All rights reserved. NEWMNIICUIICHIRALC2MULTIDENTATECOMPLEXESIMMOBILISEDINZEOLITESUSYMCM41 ALCON M 1 Introduction 2 Experimental 2.1 Synthesis of ligands 2.2 Synthesis of complexes 2.2.1 Synthesis of manganese complexes 2.2.1.1 [Mn(N,N′-bis[(S)-prolyl-N-(2-aminoethyl-3-aminopropyl)triethoxysilyl]ethylenediamine)Cl]PF6 2.2.1.2 [Mn(N,N′-bis[(S)-benzylprolyl]-N-(2-aminoethyl-3-aminopropyl)triethoxysilyl]ethylenediamine)Cl(H2O)]PF6 2.2.2 Synthesis of copper complexes 2.2.2.1 [Cu(N,N′-bis[(S)-prolyl-N-(2-aminoethyl-3-aminopropyl)triethoxysilyl]ethylenediamine)]ClO4 2.2.2.2 [Cu(acetonitrile)(N,N′-bis[(S)-benzylprolyl]-N-(2-aminoethyl-3-aminopropyl)triethoxysilyl]ethylenediamine)]ClO4 2.3 Heterogenisation of M(II) complexes 2.3.1 Anchoring on USY and MCM-41-zeolite 2.3.2 Encapsulated complexes on Y zeolite 2.4 Reactivity: oxidation of sulfides and alkenes catalysed by Mn(II)-complexes 3 Results and discussion 3.1 Synthesis of complexes 3.2 Heterogenisation of complexes 3.2.1 By anchoring 3.2.2 By encapsulating 4 Reactivity 4.1 Oxidation of alkyl phenyl sulfides 4.2 Oxidation of nerol 5 Conclusions Acknowledgements References KATSUKI 1980 5974 T GAO 1987 5765 Y HANSON 1991 437 R JACOBSEN 1991 2296 E BONCHIO 1999 6258 M MINUTOLO 1996 2293 F JANSEN 1997 3481 K CORMA 1996 225 A KNOPSGERRITS 1997 57 P PIAGGIO 2000 2008 P KRESGE 1992 710 C BECK 1992 10834 J BOLM 1998 21 C CANALI 2000 2055 L RYAN 1960 3601 J SPEIER 1971 3120 J ALCON 2000 284 M ALCON 2002 134 M ALCON 2000 116 M ALCON 2001 263 M CORMA 1995 11 A CORMA 1996 239 A MIRANDA 1998 225 E BUIST 1995 7 P KANNAN 1997 7635 P HULEA 1996 355 V CORMA 1996 153 A ALVARO 1995 L7 M ALCONX2003X137 ALCONX2003X137X152 ALCONX2003X137XM ALCONX2003X137X152XM item S1381-1169(02)00514-9 S1381116902005149 1-s2.0-S1381116902005149 10.1016/S1381-1169(02)00514-9 271358 2010-10-04T20:39:16.542811-04:00 2003-03-03 1-s2.0-S1381116902005149-main.pdf https://s3.amazonaws.com/prod-ucs-content-store-us-east/content/pii:S1381116902005149/MAIN/application/pdf/b4a3bfb5a78af78d2524077a31f81bbe/main.pdf https://s3-eu-west-1.amazonaws.com/prod-ucs-content-store-eu-west/content/pii:S1381116902005149/MAIN/application/pdf/b4a3bfb5a78af78d2524077a31f81bbe/main.pdf main.pdf pdf true 242497 MAIN 16 1-s2.0-S1381116902005149-main_1.png https://s3.amazonaws.com/prod-ucs-content-store-us-east/content/pii:S1381116902005149/PREVIEW/image/png/d57c8ca9881da32031231b5321b30f4b/main_1.png https://s3-eu-west-1.amazonaws.com/prod-ucs-content-store-eu-west/content/pii:S1381116902005149/PREVIEW/image/png/d57c8ca9881da32031231b5321b30f4b/main_1.png main_1.png png 61574 849 656 IMAGE-WEB-PDF 1 1-s2.0-S1381116902005149-si9.gif https://s3.amazonaws.com/prod-ucs-content-store-us-east/content/pii:S1381116902005149/STRIPIN/image/gif/30a6913e1cd16c33450125f5f316712b/si10.gif https://s3-eu-west-1.amazonaws.com/prod-ucs-content-store-eu-west/content/pii:S1381116902005149/STRIPIN/image/gif/30a6913e1cd16c33450125f5f316712b/si10.gif si9 si9.gif gif 149 14 20 ALTIMG 1-s2.0-S1381116902005149-si8.gif https://s3.amazonaws.com/prod-ucs-content-store-us-east/content/pii:S1381116902005149/STRIPIN/image/gif/8f962bdd93ab57fd70260a5a877cd6dd/si8.gif https://s3-eu-west-1.amazonaws.com/prod-ucs-content-store-eu-west/content/pii:S1381116902005149/STRIPIN/image/gif/8f962bdd93ab57fd70260a5a877cd6dd/si8.gif si8 si8.gif gif 496 17 94 ALTIMG 1-s2.0-S1381116902005149-si7.gif https://s3.amazonaws.com/prod-ucs-content-store-us-east/content/pii:S1381116902005149/STRIPIN/image/gif/53e022c530947f88849626e89a5758a8/si7.gif https://s3-eu-west-1.amazonaws.com/prod-ucs-content-store-eu-west/content/pii:S1381116902005149/STRIPIN/image/gif/53e022c530947f88849626e89a5758a8/si7.gif si7 si7.gif gif 507 17 94 ALTIMG 1-s2.0-S1381116902005149-si6.gif https://s3.amazonaws.com/prod-ucs-content-store-us-east/content/pii:S1381116902005149/STRIPIN/image/gif/79c00b95aaf96e0acd8d55fb3adac386/si6.gif https://s3-eu-west-1.amazonaws.com/prod-ucs-content-store-eu-west/content/pii:S1381116902005149/STRIPIN/image/gif/79c00b95aaf96e0acd8d55fb3adac386/si6.gif si6 si6.gif gif 511 17 94 ALTIMG 1-s2.0-S1381116902005149-si5.gif https://s3.amazonaws.com/prod-ucs-content-store-us-east/content/pii:S1381116902005149/STRIPIN/image/gif/79c00b95aaf96e0acd8d55fb3adac386/si6.gif https://s3-eu-west-1.amazonaws.com/prod-ucs-content-store-eu-west/content/pii:S1381116902005149/STRIPIN/image/gif/79c00b95aaf96e0acd8d55fb3adac386/si6.gif si5 si5.gif gif 511 17 94 ALTIMG 1-s2.0-S1381116902005149-si4.gif https://s3.amazonaws.com/prod-ucs-content-store-us-east/content/pii:S1381116902005149/STRIPIN/image/gif/30a6913e1cd16c33450125f5f316712b/si10.gif https://s3-eu-west-1.amazonaws.com/prod-ucs-content-store-eu-west/content/pii:S1381116902005149/STRIPIN/image/gif/30a6913e1cd16c33450125f5f316712b/si10.gif si4 si4.gif gif 149 14 20 ALTIMG 1-s2.0-S1381116902005149-si3.gif https://s3.amazonaws.com/prod-ucs-content-store-us-east/content/pii:S1381116902005149/STRIPIN/image/gif/30a6913e1cd16c33450125f5f316712b/si10.gif https://s3-eu-west-1.amazonaws.com/prod-ucs-content-store-eu-west/content/pii:S1381116902005149/STRIPIN/image/gif/30a6913e1cd16c33450125f5f316712b/si10.gif si3 si3.gif gif 149 14 20 ALTIMG 1-s2.0-S1381116902005149-si2.gif https://s3.amazonaws.com/prod-ucs-content-store-us-east/content/pii:S1381116902005149/STRIPIN/image/gif/30a6913e1cd16c33450125f5f316712b/si10.gif https://s3-eu-west-1.amazonaws.com/prod-ucs-content-store-eu-west/content/pii:S1381116902005149/STRIPIN/image/gif/30a6913e1cd16c33450125f5f316712b/si10.gif si2 si2.gif gif 149 14 20 ALTIMG 1-s2.0-S1381116902005149-si11.gif https://s3.amazonaws.com/prod-ucs-content-store-us-east/content/pii:S1381116902005149/STRIPIN/image/gif/30a6913e1cd16c33450125f5f316712b/si10.gif https://s3-eu-west-1.amazonaws.com/prod-ucs-content-store-eu-west/content/pii:S1381116902005149/STRIPIN/image/gif/30a6913e1cd16c33450125f5f316712b/si10.gif si11 si11.gif gif 149 14 20 ALTIMG 1-s2.0-S1381116902005149-si10.gif https://s3.amazonaws.com/prod-ucs-content-store-us-east/content/pii:S1381116902005149/STRIPIN/image/gif/30a6913e1cd16c33450125f5f316712b/si10.gif https://s3-eu-west-1.amazonaws.com/prod-ucs-content-store-eu-west/content/pii:S1381116902005149/STRIPIN/image/gif/30a6913e1cd16c33450125f5f316712b/si10.gif si10 si10.gif gif 149 14 20 ALTIMG 1-s2.0-S1381116902005149-si1.gif https://s3.amazonaws.com/prod-ucs-content-store-us-east/content/pii:S1381116902005149/STRIPIN/image/gif/30a6913e1cd16c33450125f5f316712b/si10.gif https://s3-eu-west-1.amazonaws.com/prod-ucs-content-store-eu-west/content/pii:S1381116902005149/STRIPIN/image/gif/30a6913e1cd16c33450125f5f316712b/si10.gif si1 si1.gif gif 149 14 20 ALTIMG 1-s2.0-S1381116902005149-fx1.sml https://s3.amazonaws.com/prod-ucs-content-store-us-east/content/pii:S1381116902005149/fx1/THUMBNAIL/image/gif/2e0d8858ae1e75ff26909bc0de21c572/fx1.sml https://s3-eu-west-1.amazonaws.com/prod-ucs-content-store-eu-west/content/pii:S1381116902005149/fx1/THUMBNAIL/image/gif/2e0d8858ae1e75ff26909bc0de21c572/fx1.sml fx1 true fx1.sml sml 1937 93 91 IMAGE-THUMBNAIL 1-s2.0-S1381116902005149-fx1.gif https://s3.amazonaws.com/prod-ucs-content-store-us-east/content/pii:S1381116902005149/fx1/DOWNSAMPLED/image/gif/f68a83d5f7c5876196a77cde9620f165/fx1.gif https://s3-eu-west-1.amazonaws.com/prod-ucs-content-store-eu-west/content/pii:S1381116902005149/fx1/DOWNSAMPLED/image/gif/f68a83d5f7c5876196a77cde9620f165/fx1.gif fx1 true fx1.gif gif 7230 246 240 IMAGE-DOWNSAMPLED 1-s2.0-S1381116902005149-sc1.sml https://s3.amazonaws.com/prod-ucs-content-store-us-east/content/pii:S1381116902005149/sc1/THUMBNAIL/image/gif/46f969d84822dde5f2282b590363b349/sc1.sml https://s3-eu-west-1.amazonaws.com/prod-ucs-content-store-eu-west/content/pii:S1381116902005149/sc1/THUMBNAIL/image/gif/46f969d84822dde5f2282b590363b349/sc1.sml sc1 sc1.sml sml 1164 93 95 IMAGE-THUMBNAIL 1-s2.0-S1381116902005149-sc1.gif https://s3.amazonaws.com/prod-ucs-content-store-us-east/content/pii:S1381116902005149/sc1/DOWNSAMPLED/image/gif/609ae9aa0990d62d986541f855870293/sc1.gif https://s3-eu-west-1.amazonaws.com/prod-ucs-content-store-eu-west/content/pii:S1381116902005149/sc1/DOWNSAMPLED/image/gif/609ae9aa0990d62d986541f855870293/sc1.gif sc1 sc1.gif gif 9748 406 416 IMAGE-DOWNSAMPLED 1-s2.0-S1381116902005149-gr1.sml https://s3.amazonaws.com/prod-ucs-content-store-us-east/content/pii:S1381116902005149/gr1/THUMBNAIL/image/gif/5bf426df96b03896f8e19cd3caf62497/gr1.sml https://s3-eu-west-1.amazonaws.com/prod-ucs-content-store-eu-west/content/pii:S1381116902005149/gr1/THUMBNAIL/image/gif/5bf426df96b03896f8e19cd3caf62497/gr1.sml gr1 gr1.sml sml 1529 88 125 IMAGE-THUMBNAIL 1-s2.0-S1381116902005149-gr1.gif https://s3.amazonaws.com/prod-ucs-content-store-us-east/content/pii:S1381116902005149/gr1/DOWNSAMPLED/image/gif/a06cf0947be01704be3554612340c9bb/gr1.gif https://s3-eu-west-1.amazonaws.com/prod-ucs-content-store-eu-west/content/pii:S1381116902005149/gr1/DOWNSAMPLED/image/gif/a06cf0947be01704be3554612340c9bb/gr1.gif gr1 gr1.gif gif 16574 463 657 IMAGE-DOWNSAMPLED 1-s2.0-S1381116902005149-sc2.sml https://s3.amazonaws.com/prod-ucs-content-store-us-east/content/pii:S1381116902005149/sc2/THUMBNAIL/image/gif/b21d0b40165dfd601bec2af94063cc82/sc2.sml https://s3-eu-west-1.amazonaws.com/prod-ucs-content-store-eu-west/content/pii:S1381116902005149/sc2/THUMBNAIL/image/gif/b21d0b40165dfd601bec2af94063cc82/sc2.sml sc2 sc2.sml sml 1852 82 125 IMAGE-THUMBNAIL 1-s2.0-S1381116902005149-sc2.gif https://s3.amazonaws.com/prod-ucs-content-store-us-east/content/pii:S1381116902005149/sc2/DOWNSAMPLED/image/gif/599320ca4fd9493e2a1b6aa3f3d8db7a/sc2.gif https://s3-eu-west-1.amazonaws.com/prod-ucs-content-store-eu-west/content/pii:S1381116902005149/sc2/DOWNSAMPLED/image/gif/599320ca4fd9493e2a1b6aa3f3d8db7a/sc2.gif sc2 sc2.gif gif 23158 445 678 IMAGE-DOWNSAMPLED 1-s2.0-S1381116902005149-gr2.sml https://s3.amazonaws.com/prod-ucs-content-store-us-east/content/pii:S1381116902005149/gr2/THUMBNAIL/image/gif/6fe997ad6e3fb8065b32ab6c48da5226/gr2.sml https://s3-eu-west-1.amazonaws.com/prod-ucs-content-store-eu-west/content/pii:S1381116902005149/gr2/THUMBNAIL/image/gif/6fe997ad6e3fb8065b32ab6c48da5226/gr2.sml gr2 gr2.sml sml 1375 82 125 IMAGE-THUMBNAIL 1-s2.0-S1381116902005149-gr2.gif https://s3.amazonaws.com/prod-ucs-content-store-us-east/content/pii:S1381116902005149/gr2/DOWNSAMPLED/image/gif/3c074125555eb3b4d8a90928f1df76c9/gr2.gif https://s3-eu-west-1.amazonaws.com/prod-ucs-content-store-eu-west/content/pii:S1381116902005149/gr2/DOWNSAMPLED/image/gif/3c074125555eb3b4d8a90928f1df76c9/gr2.gif gr2 gr2.gif gif 9136 335 509 IMAGE-DOWNSAMPLED 1-s2.0-S1381116902005149-gr3.sml https://s3.amazonaws.com/prod-ucs-content-store-us-east/content/pii:S1381116902005149/gr3/THUMBNAIL/image/gif/d81bdb669c88c4cd4834aa540ff3f5f8/gr3.sml https://s3-eu-west-1.amazonaws.com/prod-ucs-content-store-eu-west/content/pii:S1381116902005149/gr3/THUMBNAIL/image/gif/d81bdb669c88c4cd4834aa540ff3f5f8/gr3.sml gr3 gr3.sml sml 1481 90 125 IMAGE-THUMBNAIL 1-s2.0-S1381116902005149-gr3.gif https://s3.amazonaws.com/prod-ucs-content-store-us-east/content/pii:S1381116902005149/gr3/DOWNSAMPLED/image/gif/38a85fbe52af865b0e509ff3ed97020b/gr3.gif https://s3-eu-west-1.amazonaws.com/prod-ucs-content-store-eu-west/content/pii:S1381116902005149/gr3/DOWNSAMPLED/image/gif/38a85fbe52af865b0e509ff3ed97020b/gr3.gif gr3 gr3.gif gif 8937 335 466 IMAGE-DOWNSAMPLED 1-s2.0-S1381116902005149-gr4.sml https://s3.amazonaws.com/prod-ucs-content-store-us-east/content/pii:S1381116902005149/gr4/THUMBNAIL/image/gif/36448db7db69936196991cdaa6ae5ade/gr4.sml https://s3-eu-west-1.amazonaws.com/prod-ucs-content-store-eu-west/content/pii:S1381116902005149/gr4/THUMBNAIL/image/gif/36448db7db69936196991cdaa6ae5ade/gr4.sml gr4 gr4.sml sml 1285 89 125 IMAGE-THUMBNAIL 1-s2.0-S1381116902005149-gr4.gif https://s3.amazonaws.com/prod-ucs-content-store-us-east/content/pii:S1381116902005149/gr4/DOWNSAMPLED/image/gif/3132ec44661bac00309a3dc107c0fdb5/gr4.gif https://s3-eu-west-1.amazonaws.com/prod-ucs-content-store-eu-west/content/pii:S1381116902005149/gr4/DOWNSAMPLED/image/gif/3132ec44661bac00309a3dc107c0fdb5/gr4.gif gr4 gr4.gif gif 7315 318 446 IMAGE-DOWNSAMPLED 1-s2.0-S1381116902005149-gr5.sml https://s3.amazonaws.com/prod-ucs-content-store-us-east/content/pii:S1381116902005149/gr5/THUMBNAIL/image/gif/5aadfa0e214749a11f4103c51e29664e/gr5.sml https://s3-eu-west-1.amazonaws.com/prod-ucs-content-store-eu-west/content/pii:S1381116902005149/gr5/THUMBNAIL/image/gif/5aadfa0e214749a11f4103c51e29664e/gr5.sml gr5 gr5.sml sml 1501 94 120 IMAGE-THUMBNAIL 1-s2.0-S1381116902005149-gr5.gif https://s3.amazonaws.com/prod-ucs-content-store-us-east/content/pii:S1381116902005149/gr5/DOWNSAMPLED/image/gif/f8c47fb3c974c067812ca50279a3e2b4/gr5.gif https://s3-eu-west-1.amazonaws.com/prod-ucs-content-store-eu-west/content/pii:S1381116902005149/gr5/DOWNSAMPLED/image/gif/f8c47fb3c974c067812ca50279a3e2b4/gr5.gif gr5 gr5.gif gif 9730 368 471 IMAGE-DOWNSAMPLED 1-s2.0-S1381116902005149-gr6.sml https://s3.amazonaws.com/prod-ucs-content-store-us-east/content/pii:S1381116902005149/gr6/THUMBNAIL/image/gif/ac472ce30ee43cc548de4d2d516f6c50/gr6.sml https://s3-eu-west-1.amazonaws.com/prod-ucs-content-store-eu-west/content/pii:S1381116902005149/gr6/THUMBNAIL/image/gif/ac472ce30ee43cc548de4d2d516f6c50/gr6.sml gr6 gr6.sml sml 1479 92 125 IMAGE-THUMBNAIL 1-s2.0-S1381116902005149-gr6.gif https://s3.amazonaws.com/prod-ucs-content-store-us-east/content/pii:S1381116902005149/gr6/DOWNSAMPLED/image/gif/c23e0354bb3bf2e70bd134d29cb90537/gr6.gif https://s3-eu-west-1.amazonaws.com/prod-ucs-content-store-eu-west/content/pii:S1381116902005149/gr6/DOWNSAMPLED/image/gif/c23e0354bb3bf2e70bd134d29cb90537/gr6.gif gr6 gr6.gif gif 8910 344 466 IMAGE-DOWNSAMPLED 1-s2.0-S1381116902005149-gr7.sml https://s3.amazonaws.com/prod-ucs-content-store-us-east/content/pii:S1381116902005149/gr7/THUMBNAIL/image/gif/94e298d9c2a5a4c375b42599385ba1a3/gr7.sml https://s3-eu-west-1.amazonaws.com/prod-ucs-content-store-eu-west/content/pii:S1381116902005149/gr7/THUMBNAIL/image/gif/94e298d9c2a5a4c375b42599385ba1a3/gr7.sml gr7 gr7.sml sml 1150 88 125 IMAGE-THUMBNAIL 1-s2.0-S1381116902005149-gr7.gif https://s3.amazonaws.com/prod-ucs-content-store-us-east/content/pii:S1381116902005149/gr7/DOWNSAMPLED/image/gif/ffe4c1765676cd59f2b50d98f6b47667/gr7.gif https://s3-eu-west-1.amazonaws.com/prod-ucs-content-store-eu-west/content/pii:S1381116902005149/gr7/DOWNSAMPLED/image/gif/ffe4c1765676cd59f2b50d98f6b47667/gr7.gif gr7 gr7.gif gif 7044 350 496 IMAGE-DOWNSAMPLED 1-s2.0-S1381116902005149-gr8.sml https://s3.amazonaws.com/prod-ucs-content-store-us-east/content/pii:S1381116902005149/gr8/THUMBNAIL/image/gif/cf134780decaf460e2fe7c7e191088ce/gr8.sml https://s3-eu-west-1.amazonaws.com/prod-ucs-content-store-eu-west/content/pii:S1381116902005149/gr8/THUMBNAIL/image/gif/cf134780decaf460e2fe7c7e191088ce/gr8.sml gr8 gr8.sml sml 1275 90 125 IMAGE-THUMBNAIL 1-s2.0-S1381116902005149-gr8.gif https://s3.amazonaws.com/prod-ucs-content-store-us-east/content/pii:S1381116902005149/gr8/DOWNSAMPLED/image/gif/7c0433505f772b63f9ce05eb26af5759/gr8.gif https://s3-eu-west-1.amazonaws.com/prod-ucs-content-store-eu-west/content/pii:S1381116902005149/gr8/DOWNSAMPLED/image/gif/7c0433505f772b63f9ce05eb26af5759/gr8.gif gr8 gr8.gif gif 7635 336 468 IMAGE-DOWNSAMPLED 1-s2.0-S1381116902005149-gr9.sml https://s3.amazonaws.com/prod-ucs-content-store-us-east/content/pii:S1381116902005149/gr9/THUMBNAIL/image/gif/c49bdef42b2ed3127a85d79d560e7420/gr9.sml https://s3-eu-west-1.amazonaws.com/prod-ucs-content-store-eu-west/content/pii:S1381116902005149/gr9/THUMBNAIL/image/gif/c49bdef42b2ed3127a85d79d560e7420/gr9.sml gr9 gr9.sml sml 1114 89 125 IMAGE-THUMBNAIL 1-s2.0-S1381116902005149-gr9.gif https://s3.amazonaws.com/prod-ucs-content-store-us-east/content/pii:S1381116902005149/gr9/DOWNSAMPLED/image/gif/755afa137cc9dcb6b0bce6221cf5e35f/gr9.gif https://s3-eu-west-1.amazonaws.com/prod-ucs-content-store-eu-west/content/pii:S1381116902005149/gr9/DOWNSAMPLED/image/gif/755afa137cc9dcb6b0bce6221cf5e35f/gr9.gif gr9 gr9.gif gif 6240 336 471 IMAGE-DOWNSAMPLED 1-s2.0-S1381116902005149-gr10.sml https://s3.amazonaws.com/prod-ucs-content-store-us-east/content/pii:S1381116902005149/gr10/THUMBNAIL/image/gif/2a2e1d69441a77531a6e6f6e69f2f869/gr10.sml https://s3-eu-west-1.amazonaws.com/prod-ucs-content-store-eu-west/content/pii:S1381116902005149/gr10/THUMBNAIL/image/gif/2a2e1d69441a77531a6e6f6e69f2f869/gr10.sml gr10 gr10.sml sml 1360 91 125 IMAGE-THUMBNAIL 1-s2.0-S1381116902005149-gr10.gif https://s3.amazonaws.com/prod-ucs-content-store-us-east/content/pii:S1381116902005149/gr10/DOWNSAMPLED/image/gif/cc0c21bab07c0153a9e0309325362fc4/gr10.gif https://s3-eu-west-1.amazonaws.com/prod-ucs-content-store-eu-west/content/pii:S1381116902005149/gr10/DOWNSAMPLED/image/gif/cc0c21bab07c0153a9e0309325362fc4/gr10.gif gr10 gr10.gif gif 8579 346 474 IMAGE-DOWNSAMPLED MOLCAA 3801 S1381-1169(02)00514-9 10.1016/S1381-1169(02)00514-9 Elsevier Science B.V. Scheme 1 Synthesis of ligands. Fig. 1 Structure of new complexes. Scheme 2 Preparation of heterogenised complexes: (a) anchored by covalent bond; (b) encapsulated in the supercages of zeolite Y. Fig. 2 UV-Vis diffuse reflectance spectra of Mn1a, MnY1a, MCM-Mn1b and USY-Mn1b. Fig. 3 Kinetic profile of oxidation of methyl phenyl sulfide with Mn-catalysts (T=273K). Fig. 4 Kinetic profile of oxidation of methyl phenyl sulfide with Cu-catalysts (T=273K). Fig. 5 Kinetic profile of oxidation of methyl phenyl sulfide with Mn-catalysts (T=293K), using IOPh as oxidant (conversion >80 was achieved after 24h in all cases). Fig. 6 Kinetic profile of oxidation of (2-ethylbutyl) phenyl sulfide with Mn-catalysts (T=293K). Fig. 7 Selectivity to (2-ethylbutyl) phenyl sulfoxide for the oxidation reactions carried out with Mn-catalysts (homogeneous and heterogenised). Fig. 8 Recycling experiments of catalyst MCM-Mn1b: oxidation of (2-ethylbutyl) phenyl sulfide. Fig. 9 Selectivity to (2-ethylbutyl) phenyl sulfoxide for the cycles of oxidation reactions carried out with MCM-Mn1b. Fig. 10 Kinetic profile of oxidation of nerol with Mn-catalysts. Table 1 Oxidation of alkyl phenyl sulfides catalysed by Mn(C2-symmetry ligands) complexes in homogeneous and heterogenised–homogeneous conditions Substrate Catalyst T (°C) Conversion % (t) Selectivity SO (%) a TOF b ee (%) c Methyl phenyl sulfide Mn1a 0 76 (2h) 67 163 23.2 MnY1a 0 76 (3h) 31 73 18.8 USY-Mn1b 0 92 (1h) 57 311 14.2 MCM-Mn1b 0 78 (1h) 29 274 10.8 Mn2a 0 75 (2h) 65 141 16.1 MnY2a 0 73 (3h) 26 30 10.8 MCM-Mn2b 0 81 (1h) 68 295 15.3 (2-Ethylbutyl) phenyl sulfide Mn1a Room temperature 100 (2h) 69 74 5 MnY1a Room temperature 95 (1.5h) 95 213 8.0 USY-Mn1b Room temperature 100 (20min) 93 586 5.0 MCM-Mn1b Room temperature 85 (60min) 90 505 10.0 Mn2a Room temperature 78 (2 h) 73 58 5.2 MnY2a Room temperature 100 (3.5h) 86 93 12.0 MCM-Mn2b Room temperature 100 (3h) 92 155 13.3 a Amount of sulfoxide/amount of sulfide consumed. b TOF: mmol substrate/mmol catalyst min. c ee determined by GC–MS and 1 H -NMR. Table 2 Oxidation of methyl phenyl sulfide catalysed by Mn(C2-symmetry ligands) complexes in homogeneous and heterogenised–homogeneous conditions using IOPh as oxidant a Substrate Catalyst Conversion % (t) b Selectivity SO (%) c TOF d ee (%) e Methyl phenyl sulfide Mn1a 88 (4h) 96.6 123 26.7 MCM-Mn1b 45 (6h) 100 30 20.0 Mn2a 78 (4h) 100 113 39.7 MCM-Mn2b 30 (6h) 97.7 13 31.8 a Reaction performed at room temperature. b Conversion >80 was achieved after 24h in all cases. c Amount of sulfoxide/amount of sulfide consumed. d TOF: mmol substrate/mmol catalyst min. e ee determined by GC–MS and 1 H -NMR. Table 3 Oxidation of alkylsulfides catalysed by Cu(C2-symmetry ligands) complexes in homogeneous and heterogenised–homogeneous conditions Substrate Catalysis T (°C) Conversion % (t) Selectivity SO (%) a TOF b ee (%) c Methyl phenyl sulfide Cu1a 0 86 (3h) 51 103 18.5 USY-Cu1b 0 83 (60min) 57 250 22.5 MCM-Cu1b 0 67 (30min) 25 225 21.6 (2-Ethylbutyl) phenyl sulfide Cu1a Room temperature 100 (7h) 78 22 4 USY-Cu1b Room temperature 90 (60min) 92 209 24 MCM-Cu1b Room temperature 100 (20min) 93 500 28 a Amount of sulfoxide/amount of sulfide consumed. b TOF: mmol substrate/mmol catalyst min. c ee determined by GC–MS and 1 H -NMR. Table 4 Oxidation of nerol catalysed by Mn(C2-symmetry ligands) complexes in homogeneous and heterogenised–homogeneous conditions Catalyst T (°C) Conversion % (t) a Selectivity to epoxide 2, 3 (%) b TOF c ee (%) d Mn1a Room temperature 55 (2h) 56 59 2.4 Mn1a 0 52 (8h) 68 13 3.3 MnY1a 0 45 (8h) 73 11 4.1 USY-Mn1b 0 52 (8h) 60 17 3.0 MCM-Mn1b 0 100 (6h) 46 50 4.2 a Conversion total was achieved after 24h. b Amount of epoxide/amount of alkene consumed. c TOF: mmol substrate/mmol catalyst min. d ee determined by GC–MS and 1 H -NMR. New Mn(II) and Cu(II) chiral C2-multidentate complexes immobilised in zeolites (USY, MCM41) Reusable catalysts for selective oxidation reactions M.J Alcón a A Corma b M Iglesias a ∗ F Sánchez c 1 a Inst. de Ciencia de Materiales de Madrid, CSIC, Cantoblanco, 28049 Madrid, Spain b Inst. de Tecnologı́a Quı́mica, UPV-CSIC, Avda de los Naranjos, 46022 Valencia, Spain c Inst. de Quı́mica Orgánica, CSIC, Juan de la Cierva 3, 28006 Madrid, Spain * Corresponding author. Tel.: +34-913-349-032; fax: +34-913-720-623. 1 Co-corresponding author. Heterogenisation of the manganese(II) and copper(II) complexes bearing a triethoxysilyl group on zeolites (modified ultrastable Y zeolite (USY), MCM-41) through covalent bonding to support and the preparation of the respective Mn-complex encapsulated into the supercages of large pore sized Y zeolite are reported. Life time of heterogenised catalysts has been examined. Heterogenisation of the manganese(II) and copper(II) complexes bearing a triethoxysilyl group on zeolites (modified ultrastable Y zeolite (USY), MCM-41) through covalent bonding to support and the preparation of the respective Mn-complex encapsulated into the supercages of large pore sized Y zeolite are reported. The chemical environment of the metal in these materials does not change after heterogenisation as we confirm by FT-IR, diffuse reflectance and thermogravimetric (TG) analysis. All catalysts, homogeneous and heterogenised, are active and selective in the oxidation of alkyl phenyl sulfides and nerol at low temperatures using sodium hypochlorite or IOPh as terminal oxidant. The catalytic activity of the anchored USY and MCM41 complexes is higher than the corresponding homogeneous or encapsulated ones, yielding sulfoxides and epoxyalcohols with excellent yields and selectivity and moderate enantioselectivity. Life time of heterogenised catalysts has been examined by repeated use of the complexes leading similar rates and yields of sulfoxide or epoxide, whilst no appreciable loss of metal has been observed over several runs. Keywords Manganese Copper Heterogenised Encapsulated Sulfide Oxidation Epoxidation 1 Introduction The use of chiral catalysts has become a powerful methodology in modern synthetic organic chemistry [1]. As far as oxygen-transfer catalysis is concerned, the Sharpless–Katsuki epoxidation of allylic alcohols constituted an authentic breakthrough in this field [2,3]. More recently, Jacobsen and co-workers expanded the scope of the catalytic asymmetric epoxidation to some families of unfunctionalised alkenes with high stereocontrol by using chiral (salen) Mn complexes [4]. The recent results of Bonchio et al. [5] shows the state-of-the-art for sulfoxidation catalysts (based on Ti, Zr). In the last decade, much effort has been paid to immobilise these homogeneous catalysts onto solid supports because such heterogenisation of homogeneous catalysts may combine the ease of product separation with the selectivity founded with homogeneous complexes [6]. For manganese three approaches have been adopted: (i) supporting Mn epoxidation catalysts on polymers [7] or zeolites [8]; (ii) ion exchange of manganese complexes into the intra-crystalline space of zeolites, e.g. zeolite Y [9] or mesoporous materials [10]; and (iii) encapsulation of manganese complexes within zeolites by synthesis using “ship-in-a-bottle” methodology [11,12]. Zeolites are crystalline aluminosilicates whose internal voids are formed by cavities and channels of strictly regular dimensions and of different sizes and shapes. In particular, the pore structure of Y zeolite consists of almost spherical 13Å cavities interconnected tetrahedrally through smaller apertures of 7.4Å diameter. The metal complex can be easily accommodated inside the supercages of Y zeolite. Also, there is now considerable interest in the application of the new generation of mesoporous siliceous and non-siliceous oxides as catalyst support materials. MCM-41 is one member of this family [13]. The inner surfaces of MCM-41 are covered with nucleophilic silanols, which enable the immobilisation of transition metals catalysts by directing grafting with transition metal complexes. The use as chiral catalysts of Mn(II)-complexes heterogenised on or embedded within zeolite opens a new methodology that allows a wide variety of reaction conditions while diminishes the deactivating process owing to Mn dimerisation. Furthermore, on top of the enantioselectivity the overall process would benefit of the shape-selectivity characteristic of the zeolite catalysis. Although the heterogenisation strategy has been well stabilised in oxidation processes [14] in the present contribution, we report our results on the synthesis and characterisation of a series of Mn(II) and Cu(II)-complexes with multidentate C2-symmetry ligands derived from l-proline and the heterogenisation of such complexes by anchoring (on ultrastable Y zeolite (USY) and MCM-41 zeolites) or encapsulating into the supercages of large pore sized USY zeolite. The oxidation properties of all synthesised complexes are studied making special attention on the role of the support on the activity and selectivity of catalysts. Thus, the heterogenised complex gives higher catalytic activity for oxidation reactions than its solution counterpart and showed no significant loss of catalytic activity when recycled. 2 Experimental The silylating agent N-(2-aminoethyl-3-aminopropyl)triethoxysilane was obtained as described in the literature [15]. C, H and N analyses were carried out by the Analytical Department of the Institute of Materials Science (CSIC) with a Perkin-Elmer 240C apparatus. Metal contents were analysed by atomic absorption using a Unicam Philips SP9 apparatus. IR spectra were recorded with a Nicolet XR60 spectrophotometer (range 4000–200cm−1) as KBr pellets. Gas chromatography (GC) analysis was performed using a Hewlett-Packard 5890 II with a flame ionisation detector in a cross-linked methylsilicone column. The inorganic support for anchoring were a modified USY and a mesoporous MCM-41. USY zeolite was prepared by steam calcination at 1023K of an 80% ammonium-exchanged NaY (SK40 Union Carbide), followed by treatment with a 1N citric acid solution at 333K for 30min to remove extra-framework species. After this, the zeolite was thoroughly washed and dried at 403K for 6h. The final zeolite had a well-developed supermicropore–mesopore system (pore diameter 12–30Å besides the typical ca. 12Å micropores). The controlled dealumination promotes destruction of some sodalite units, which allowed direct communication between α-cages generating cavities wider than 12Å. The formation of supermicropores and large mesopores has been detected by N2 adsorption–desorption. The main characteristics of the resultant zeolite are: unit cell size, 24.40Å; bulk SiO2/Al2O3, 4.2; crystallinity, >95%. A detailed synthesis procedure for purely siliceous MCM-41 has been described [14]. MnY zeolite was prepared starting from NaY by ion exchange using a 5mM aqueous solution of Mn(CH3COO)2 and 1–10 solid-to-liquid weight ratio. The resulting MnY zeolite containing 1.6 Mn2+ ions per unit cell (which corresponds to an average of 1 Mn2+ every five supercages) was filtered, washed with deionised water and air-dried at 100°C for 48h. The inorganic supports were dried at 415K under 0.01Torr for 2h, before the heterogenisation process. This treatment is sufficient to achieve complete thermodesorption of physically absorbed water molecules from the surface. 2.1 Synthesis of ligands The ligands N,N′-bis[(S)-prolyl]ethylenediamine (1a), N,N′-bis[(S)-prolyl]-N-(2-aminoethyl-3-aminopropyl)triethoxysilylethylenediamine (1b), N,N′-bis[(S)-N-benzylprolyl]ethylenediamine (2a), N,N′-bis[(S)-benzylprolyl]-N-(2-aminoethyl-3-aminopropyl)triethoxysilylethylenediamine (2b) were synthesised recently in our laboratory [16] see Scheme 1 . 2.2 Synthesis of complexes 2.2.1 Synthesis of manganese complexes General method: To a solution of ligand 1–2a,b (1mmol) in ethanol (30cm3) was added MnCl2·4H2O (198mg, 1mmol) and NH4PF6 (162mg, 1mmol) and the mixture was refluxed for 3h. The precipitated white product was filtered and the filtrate was concentrated by rotary evaporation to give more of the white solid. The combined solids were washed with small portions of ethanol and then dried in vacuo. 2.2.1.1 [Mn(N,N′-bis[(S)-prolyl-N-(2-aminoethyl-3-aminopropyl)triethoxysilyl]ethylenediamine)Cl]PF6 [Mn(1b)Cl]PF6: Yield: 55%. mp>230°C. C17H34ClF6MnN4O5PSi (638): calc. (with Si(OCH2CH3)3 as Si(OCH2CH3)(OH)2): C 32.0; H 5.4; N 8.8; Mn 8.6. found C 31.7; H 5.1; N 8.6; Mn 8.9%. IR (KBr, cm−1): ν=3410 (NH); 1680, 1630 (CO); 1560 (NCO); 1120 (CSi); 850 (PF). UV-Vis (10−3 M, DMF): λ nm (log ϵ)=285.5 (2.4). TG analysis: 0.584mg weight loss (12.4% of 4.68mg complex; expected weight loss 12.7%) at 93–108°C (EtOH+2H2O). 2.2.1.2 [Mn(N,N′-bis[(S)-benzylprolyl]-N-(2-aminoethyl-3-aminopropyl)triethoxysilyl]ethylenediamine)Cl(H2O)]PF6 [Mn(2b)Cl(H2O)]PF6: Yield: 55%. mp>203°C (d). Λ M (10−3 M, Ω−1 cm2 mol−1, CH3CN)=143–145 C35H56ClF6MnN4O6PSi (892): calc.: C 47.1; H 6.3; N 6.3; Mn 6.1. found C 47.5; H 6.0; N 6.0; Mn 6.4%. UV-Vis (10−3 M, DMF): λ nm (log ϵ)=285.7 (2.7). IR (KBr, cm−1): ν=3542 (OH); 3392 (NH); 1636 (CO), 1611 (NCO); 1071 (CSi); 836 (PF). MS+(m/z): 915 ([MnCl(2b)(CH3CN)]PF6; 729 ([MnCl(2b)]+. TG analysis: 0.520mg weight loss (11.8% of 4.42mg complex; expected weight loss 11.4%) at 95–118°C. 2.2.2 Synthesis of copper complexes General: to a solution of [Cu(CH3CN)4]ClO4 (1mmol) in dry acetonitrile (20ml) was added a solution of the corresponding ligand 1–2a,b (1mmol); the mixture was stirred for 3h at room temperature and the crystalline precipitate filtered. The filtrate was evaporated under reduced pressure to a volume of 5ml and a careful addition of diethyl ether caused the precipitation of a microcrystalline blue solid, which was collected by filtration, washed and dried in vacuo (10−3 mm Hg/8h) to give the desired complex. 2.2.2.1 [Cu(N,N′-bis[(S)-prolyl-N-(2-aminoethyl-3-aminopropyl)triethoxysilyl]ethylenediamine)]ClO4 [Cu(1b)]ClO4·2H2O: Yield: 66%. mp=225–230°C. Λ M (10−3 M, Ω−1 cm2 mol−1, CH3CN)=154–168. C15H34ClCuN4O11Si (574): calc. (with Si(OCH2CH3)3 as Si(OH)3): C 31.4; H 6.0; N 9.8; Cu 11.1. found C 31.1; H 5.8; N 10.0; Cu 11.4%. UV-Vis (10−3 M, DMF): λ nm (log ϵ)=637.5 (w); 290.0 (3.5). IR (KBr,cm−1): ν=3460, 3300 (NH); 1680 (CO), 1620; 1590 (NCO); 1100 (CSi); 1080 (ClO). TG analysis: 0.820mg weight loss (18.98% of 4.32mg complex; expected weight loss 19.5%) at 95–113°C (5H2O). 2.2.2.2 [Cu(acetonitrile)(N,N′-bis[(S)-benzylprolyl]-N-(2-aminoethyl-3-aminopropyl)triethoxysilyl]ethylenediamine)]ClO4 [Cu(2b)(CH3CN)]ClO4: Yield: 56%. mp>250°C. Λ M (10−3 M, Ω−1 cm2 mol−1, CH3CN)=122–125. C37H57ClCuN5O9Si (843): calc.: C 52.7; H 6.8; N 8.3; Cu 7.5. found C 52.3 H 6.8; N 8.0; Cu 7.4%. UV-Vis (10−3 M, DMF): λ nm (log ϵ)=355.5 (2.43); 288.50 (3.5). IR (KBr, cm−1): ν=3772, 3542 (OH); 3300 (NH); 1670 (CO), 1621; 1592 (NCO); 1100 (CSi); 1090 (ClO). MS+(m/z): 742 [Cu(2b)(CH3CN)]+, 700 [Cu(2b)]+. TG analysis: 0.660mg weight loss (14.8% of 4.60mg complex; expected weight loss 14.8%) at 102–126°C. The manganese and copper complexes for homogeneous catalysis, used as reference, were obtained as we have previously described [17]. 2.3 Heterogenisation of M(II) complexes 2.3.1 Anchoring on USY and MCM-41-zeolite The zeolite-M(II)-complexes were prepared as we have previously described [18,19]. Thus, a solution of the silyl-complex, (0.5mmol) in ethanol (Mn-complexes) or acetonitrile (Cu-complexes; 2ml) was added to a well-stirred toluene suspension (40ml) of the inorganic support (modified USY-zeolite or MCM-41 dried at 140°C/0.1mm/Hg for 3–4h, 1g) and the mixture was stirred at room temperature for 24h. The solid was then filtered and Soxhlet extracted with acetonitrile-ethyl ether, EtOH-ethyl ether (1:2) for 7–24h to remove the remaining non-supported complex from heterogenised catalyst. The resulting white solid was dried in vacuo and analysed. USY Mn 1b : Elemental analysis indicated 0.41 mass% Mn. IR (KBr, cm−1): ν=3400 (NH); 1670, 1620 (CO); 1233 (vs, support); 1120 (CSi); 1083 (vs, support); 848 (PF). UV-Vis (solid; nm): 305. MCM-Mn 1b : Elemental analysis indicated 0.43 mass% Mn. IR (KBr, cm−1): ν=3400 (NH); 1670, 1620 (CO); 1233 (vs, support); 1120 (CSi); 1083 (vs, support); 848 (PF). UV-Vis (solid; nm): 299. MCM-Mn 2b : Elemental analysis indicated 0.39 mass% Mn. IR (KBr, cm−1): ν=3380–3300 (OH, NH); 1670, 1659 (CO); 1237 (vs, support); 1100–1083 (CSi, support); 840 (PF). UV-Vis (solid; nm): 300. USY-Cu 1b : Elemental analysis indicated 0.86 mass% Cu. IR (KBr, cm−1): ν=3440–3300 (N-H); 1670, 1600 (CO); 1236 (vs, support); 1100–1083 (CSi, support); 1000 (ClO). UV-Vis (solid; nm): 598 (w), 300. MCM-Cu 1b : Elemental analysis indicated 0.92 mass% Cu. IR (KBr, cm−1): ν=3440–3300 (NH); 1670, 1600 (CO); 1236 (vs, support); 1100–1083 (CSi, support); 1000 (ClO). UV-Vis (solid; nm): 602 (w), 299. MCM-Cu 2b : Elemental analysis indicated 0.82 mass% Cu. IR (KBr, cm−1): ν=3440–3300 (O-H, N-H); 1670, 1600 (CO); 1236 (vs, support); 1100–1083 (CSi, support, ClO). UV-Vis (solid; nm): 356, 310. 2.3.2 Encapsulated complexes on Y zeolite Complexation of the ligands with MnY was made as follows: thus, thermally dehydrated MnY zeolite (1g) was poured into a CH2Cl2 solution containing the ligand (1mmol). The resulting suspension was magnetically stirred at reflux temperature for 12h, filtered and washed exhaustively with CH2Cl2. Finally, the white MnY zeolites samples were Soxhlet extracted with CH2Cl2 to reduce the presence of unreacted and surface species from the zeolite particles. Residual uncomplexed MnY can contribute to the catalysis of the oxidation in a non-enantioselective manner. This would diminish the overall enantioselectivity of the system. In order to minimise these undesirable sites, the Mn(II)-zeolites were stirred with aqueous solutions of NaNO3 (0.1M) to re-exchange uncomplexed manganese ions. MnY 1a : Elemental analysis indicated 1.82 mass% Mn. IR (KBr, cm−1): ν=3410, 3250 (NH); 1650, 1620 (CO); 1234 (vs, support); 1083 (vs, support). MnY 2a : Elemental analysis indicated 1.36 mass% Mn. IR (KBr, cm−1): ν=3420, 3300 (NH); 1670 (CO); 1233 (vs, support); 1083 (vs, support). 2.4 Reactivity: oxidation of sulfides and alkenes catalysed by Mn(II)-complexes Oxidation reactions were carried out in a 15ml flask equipped with a magnetic stirrer. The flask was charged with: (i) 3ml of a solution or suspension of the catalyst (0.01mmol) in CH2Cl2; (ii) a solution of the substrate (olefin or sulfide, 1mmol) in CH2Cl2; (iii) 4-methylmorpholine N-oxide monohydrate (0.1mmol). The mixture was allowed to desired temperature. Subsequently the oxidant [aqueous NaOCl (pH=11.3, 1.9mmol), H2O2 (30%; 2.5mmol) or solid IOPh (2mmol)] was added and the reaction mixture was stirred. Chemical yields and the enantiomeric excesses of methyl phenyl sulfide and nerol were measured by GC with a chiral glass capillary column (mixture of methylsilicone (OV-1701) and methylsilicone-heptakis-[2,3-dipentyl-6-(t-butyldimethylsilyl)]-β-cyclodextrin as stationary phase) [20]. The ee for (2-ethylbutyl) phenyl sulfide was determined by 1 H -NMR using (-)-MPPA ((R)-(-)-α-methoxyphenylacetic acid) as chiral agent [21]. 3 Results and discussion 3.1 Synthesis of complexes The structures of complexes, characterised analytical and spectroscopically, demonstrate the considerable flexibility in the conformations that multidentate ligands can adopt (Fig. 1 ). The coordinating solvents have been verified by the appropriate losses in their thermogravimetric (TG) analyses. 3.2 Heterogenisation of complexes In the era of green chemistry, the heterogenisation of homogeneous catalysts is a field of continuing interest: indeed, although some of these organometallic complexes exhibit remarkable catalytic properties (activities and selectivity), they are unsuitable to separate intact, from the reaction medium making difficult their reuse and contaminating the reaction products. Thus, the heterogenisation is always a toxicological and environmental challenge; moreover it has an economical significance unless the activity of the homogeneous catalysts was exceptionally high. We have considered two strategies for heterogenisation, which preserve as much as possible the coordination sphere of the metal. This is achieved (described in the undermentioned sections). 3.2.1 By anchoring By anchoring the homogeneous catalyst to an inorganic support (USY or MCM-41 zeolite) via covalent bonds between the solid (silanol groups SiOH) and one ligand that have appropriate groups (Si(OEt)3) at a position remote to the metal center (Scheme 2a ). Preparations of these materials were carried out, by controlled hydrolysis of SiOEt bonds and reaction with the free silanol (SiOH) on the surface of an USY or MCM-41 zeolite. IR and UV-Vis spectroscopy confirmed the fact that the resulting catalytic material is very stable and the species are covalently bonded to the surface showing only minor frequency shifts from those of the corresponding “neat” complex. The elemental analysis of C, H, N and M also confirm the M/ligand (1:1) stoichiometry. It is unlikely that the nature of the complex is substantially altered under the relatively mild conditions of the anchoring reaction [22]. TG analysis shows that the total weight loss is associated with the metal complex content corresponding to composition of the organic ligands. The loading of metal is always ca. ∼1–2% (±0.1%) measured by atomic absorption of metal of the digested samples These values have been used for calculating the ratio catalyst/substrate in the reaction tests. 3.2.2 By encapsulating By encapsulating or encaging the catalyst in the voids of a porous inorganic solid (Y zeolite; Scheme 2b). The objective, clearly, is to improve the stability of the metal complex under the reaction conditions by preventing the catalytic species from dimerizing or aggregation, and to tune the selectivity of the reaction using the walls of the pores of the solid via steric constraints. In this approach, the metal is introduced in the pores of a solid via cation exchange. The ligands, 1a–2a, are then introduced under the conditions indicated in the experimental section for complex formation. According to the “flexible-ligand” strategy for the encapsulation of metal complexes inside the cavities of zeolite hosts, the free ligands are flexible enough to diffuse through the ring windows into the cavities of zeolite Y, where the metal cations are located. There, complexation occurs and the resulting complexes are too bulky and rigid to be able to leave the cavities again. Uncomplexed ligands and complexes formed at the external surface of the zeolite crystallites have to be removed as far as possible. Identity of the complex has been established by spectroscopic methods and IR and UV reflectance spectra of encapsulated complexes are coincident with that recorded for homogeneous complexes. The complex formed is like a “ship-in-bottle”, confined in the supercages of the zeolite: this explains the greater stability of these catalysts as compared with the same complexes in solution. No metal leaching is observed, as long as the complex is exclusively inside the pores. IR spectroscopy provides information on the integrity of the anchored and encapsulated complexes, as well as the crystallinity of the host zeolite. The IR bands of all heterogenised complexes are weak due to their low concentration in the zeolite. Metal complexes encapsulated in the zeolite cages did not show any significant shift in NH or CO stretching modes. We did not notice any appreciable changes in the frequencies of Mn- or Cu-complexes after incorporation into zeolite matrix. The diffuse reflectance spectra of M (C2-ligand) complexes are almost identical before and after heterogenisation process (Fig. 2 ), indicating that the complexes maintain their geometry and their electronic surrounding even after heterogenisation without significant distortion. 4 Reactivity The new materials were tested in the oxidation of organic substrates, using methyl phenyl sulfide, (2-ethylbutyl) phenyl sulfide and nerol as model substrates. Aqueous sodium hypochlorite (NaOCl), 30% hydrogen peroxide (30% H2O2) and iodosylbenzene (PhIO) were employed as primary oxidants, always in excess with respect to the substrate. Reactions were carried out at 0°C in the case of methyl phenyl sulfide and nerol, and at room temperature with (2-ethylbutyl) phenyl sulfide. Higher reaction temperatures lead to a dramatic decrease in the selectivity to sulfoxide or epoxide as well as a significant loss of the asymmetric induction. If solid IOPh was employed as oxidant, reactions were performed at room temperature. The pH of the aqueous solution of NaOCl was adjusted at 11.3. The outcome of the reactions was followed by GC and results are summarised in Tables 1–4 , Figs. 3–10 . The experimental conditions were established by varying the nature of the oxidant. First, hydrogen peroxide (H2O2) was examined as oxidant in acetonitrile and little formation of sulfoxide was detected at ambient temperature in spite of excess amount of oxidant used whilst NaOCl yield high conversions at low temperature. The 4-methylmorpholine N-oxide monohydrate is used to stabilise the Mn(V)O complex formed in the oxidation cycle. A series of blank experiments revealed that each component is essential for an effective catalytic reaction and the system is relatively unaffected by changing the order of mixing. All heterogenised catalysts appeared to be stable under experimental conditions (as the catalysts recovered by filtration of the reaction mixture and washing with CH2Cl2 were found to be reactive for further catalytic runs), but undergo some degradation over extensive use for 48h as evidenced by some 5–10% loss of metal content. 4.1 Oxidation of alkyl phenyl sulfides The selective oxidation of sulfides to sulfoxides has been a challenge for many years, partly due to the importance of sulfoxides as intermediates and auxiliaries in organic synthesis [23]. In recent years selective oxidation of sulfides to sulfoxides has been carried out with a large number of heterogeneous and supported reagents [24]. Here, we report our results with soluble and heterogenised Mn and Cu complexes (Tables 1–3). The results given in Figs. 3 and 4 show that for the case of methyl phenyl sulfide the activity is higher for the USY-M1b catalyst than for the MCM-M1b, MnY1a and homogenous. Moreover, the selectivity shows that the sulfoxide is a primary and unstable product, while the corresponding sulfone appears as a secondary and stable product. USY-M1b is more selective towards the formation of sulfoxide than MCM-M1b and MnY1a. The reactions showed a high chemoselectivity for larger (2-ethylbutyl) phenyl sulfide (Fig. 7). Indeed, in most of the cases sulfoxides were obtained as the main or sole products as detected by GC, TLC and 1 H -NMR analysis. Furthermore, products of the oxidation of the (2-ethylbutyl) phenyl sulfide were not detected at 0°C. The lower selectivity found for methyl phenyl sulfide corresponds with the much higher extent of the reaction with this substrate. As can be concluded from Table 1, methyl phenyl sulfide and (2-ethylbutyl) phenyl sulfide have shown a quite similar behaviour when the same catalyst was used in their oxidative transformations, suggesting that despite the differences in their structures, they have quite the same reactivity. The copper complexes show less activity (Fig. 4) and similar selectivity that manganese ones. This may be due to the fact that the formation of Cu-oxo species (catalytically active intermediate) is kinetically less favoured in this case. The lower reaction rates obtained for the oxidation of methyl phenyl sulfide with the encapsulated catalysts (Table 1, Fig. 3), compared to the homogeneous counterpart, could have been anticipated in view of the restrictions imposed on the diffusion substrate and products through the micropores of the solid, when the reaction is run at low temperatures, meanwhile, at room temperature, the turnover rates for the oxidation of methyl phenyl sulfide and (2-ethylbutyl) phenyl sulfide with the heterogeneous catalyst were found to be higher than those for the homogeneously catalysed reactions (Fig. 6), this fact is a consequence of the lower importance of diffusion at higher temperatures. In all these experiments moderate enantiomeric excesses were obtained, as shown by GC analysis of the reaction mixture using a chiral column or 1 H -NMR of the purified sulfoxide. Since the highest enantiomeric excesses reported in the literature were observed using PhIO, sulfoxidation of methyl phenyl sulfide with this mild oxidant was also carried out (Table 2, Fig. 5). Although the activity of the catalysts decreases (conversion >80 was achieved after 24h in all cases), in the presence of PhIO, in this case an increase of the enantioselectivity was observed. This increase is partly important when Mn2a and MCM-Mn2b were used as catalysts. When the reactions were carried out using H2O2 as oxidating agent the oxidation activity is lower and 10% of sulfoxide was obtained after 24h. For homogeneously catalysed reactions, the termination of catalytic cycle may occur because of two factors, due to the formation of MnOMn species, which has poor catalytic activity, or due to the oxidative degradation of metal complexes. This was confirmed by taking the IR spectra of the solid after catalytic reaction. The IR spectra of these solids are very different from that of the IR spectra of the parent compounds. To improve the stability of the metal complex under the reaction conditions we have heterogenised the complexes by preventing the catalytic species from dimerizing or aggregation, and to tune the selectivity of the reaction using the walls of the pores of the solid via steric effects. The most important advantage of heterogeneous catalysis over its homogeneous counterpart are a high increasing of the complex stability in the reaction media and the possibility of reusing the catalyst after reaction by simple filtration (Fig. 8). The catalyst could be reused at least four times without neither loss of selectivity (Fig. 9) nor activity with catalyst loading as low as 1mol%. While the oxidation of sulfide continued in presence of the catalyst, there was no further significant conversion when the catalyst was removed from the reaction system. This conclusion was independently confirmed by the absence of manganese in the filtrate (atomic absorption spectroscopy). On the other hand, all Mn and Cu catalyst, specially the heterogeneous one, with an excess of oxidant and/or long times of reaction yields, as sole product, the corresponding sulfone with excellent yield. 4.2 Oxidation of nerol The soluble and heterogenised Mn-complexes were tested for the epoxidation of (Z)-3,7-dimethyl-2,6-octadien-1-ol (nerol) used as model, with NaOCl as oxygen source at 0°C in CH2Cl2 solutions. The results are summarised in Table 4. Even though for test reactions we have only used 1% of molar ratio catalysts/substrate the conversion of allylic alcohol is generally high. The reactions showed a high chemoselectivity. Indeed, in most of the cases at 0°C (conversion=20%) epoxides were obtained as the main or sole products as detected by GC analysis. The results of the competitive epoxidation of nerol summarised in Table 4 indicate the preferential epoxidation of 2, 3 position. This is suggestive of the fact that the linear olefin is sterically more approachable to the active sites due to the coordination of OH to Mn center and prevent the 6, 7 position accessing the active sites at an effective rate. Chlorinated products, arising from chlorine addition to the CC double bond were detected by GC–MS under the reaction conditions. Products arising from the nucleophilic aperture of the epoxide ring commonly observed for other non-enantioselective zeolite-catalysed epoxidations were absent [25]. The time-course plots of the epoxidation of nerol are shown in Fig. 10. The results obtained for heterogenised catalysts are generally comparable with the corresponding soluble manganese complexes which show a similar pattern indicating that both reactions take place through the same mechanism, without any significant change in the reaction pathway. The lifetimes of the zeolite catalysts were examined by their repeated use in the epoxidation of nerol. The amount of metal ion was determined for each run. Approximately >95% of the metal was still retained on the zeolite anchored complex (90% for encapsulated) after five runs. The yield of epoxide decreased only slightly and notable change in selectivity has not been observed. The high activity and selectivity and the significantly easier workout indicate that this type of catalysts is a truly heterogeneous counterpart of homogeneous transition metal complex catalysts for epoxidation of allylic alcohols. 5 Conclusions Manganese and copper complex cations, [MnLCl]+, [CuL]+, have been incorporated into molecular sieves. Heterogenisation of M(II)-complexes, with C2-symmetry ligands, on USY-zeolite (containing supermicropores and a large quantity of silanol groups) and MCM-41 increases the activity of the homogeneous catalysts for different substrates. Mn(II)-complexes can be, also, immobilised in the intra-crystalline voids of Y zeolite. The resulting host/guest compounds are active catalysts for the oxidation of sulfides to sulfoxides and sulfones with very low catalyst/substrate ratio. The heterogenised complexes are significantly more stables than the corresponding homogeneous complexes over prolonged reaction times, and therefore better catalysts than homogeneous ones. For all reactions tested, and for all heterogenised catalysts (encapsulated and anchored), a high selectivity in competitive reactions is observed for bulky substrates, which is correlated to molecular sieving effects (reactants size, selectivity effect), and a better regioselectivity is obtained (the 2 position favoured over the 6, 7 position in the oxidation of nerol). For encapsulated complexes these good selectivities are associated with lower activities (when operating at low temperature) due to diffusion limitations, not found at higher temperatures. To summarise, zeolite-heterogenised complexes show interesting catalytic properties in oxidation reactions and these properties are related to the changes in the microenvironment of the ligand metal complex, caused by the support. The balance between the heterogeneous and homogeneous character can explain the success of our catalysts. These catalysts can be recovered and reused at least four times retaining most of their catalytic activity. All the enantioselective enzymatic systems in nature have in common the incorporation of the active sites into a confined space defined by the tertiary protein structure. Our chiral heterogenised catalysts mimic this strategy: the rigid, inorganic framework of the zeolite determines the reaction cavity surrounding the active catalyst. Acknowledgements The authors acknowledge the valuable help of Mr. J.A. Esteban-Perales for his assistance in the preparation of ligands and the financial support from the Dirección General de Investigación Cientı́fica y Técnica of Spain (Project MAT2000-1768-C02-02). References [1] (a) R. Noyori, Asymmetric Catalysis in Organic Synthesis, Wiley, New York, 1994, Chapter 2, p. 16 (b) H. Takaya, T. Onta, R. Noyori, in: I. Ojima (Ed.), Catalytic Asymmetric Synthesis, VCH, New York, 1993 (Chapter 1) (c) J. Halpern, in: J.D. Morrison (Ed.), Asymmetric Synthesis, vol. 5, Academic Press, New York, 1985 (d) E.N. Jacobsen, A. Pfaltz, H. Yamamoto, (Eds.), Comprehensive Asymmetric Catalysis, Springer, Berlin, 1999 (e) J.D. Morrison, Asymmetric Synthesis, Academic Press, New York, 1983. [2] (a) T Katsuki K.B Sharpless J. Am. Chem. Soc. 102 1980 5974 (b) Y Gao R.M Hanson J.M Klunder S.Y Ko H Masamune K.B Sharpless J. Am. Chem. Soc. 109 1987 5765 [3] R.M Hanson Chem. Rev. 91 1991 437 [4] E.N Jacobsen W Zhang J. Org. Chem. 56 1991 2296 [5] M Bonchio G Licini G Modena O Bortolini S Moro W.A Nugent J. Am. Chem. Soc. 121 1999 6258 [6] D.E. Vos, I.F.K. Vankelecom, P.A. Jacobs (Eds.), Chiral Catalyst Inmobilization and Recycling, Wiley, Weinheim, 2000. [7] (a) F Minutolo D Pini A Petri P Salvadori Tetrahedr. Asymm. 7 1996 2293 (b) K.B Jansen J Laquiere J Dehaen R.F Parton J.F J Wankelecom P.A Jacobs Tetrahedr. Asymm. 8 1997 3481 [8] A Corma A Fuerte M Iglesias F Sánchez J. Mol. Catal. A: Chem. 107 1996 225 [9] (a) P.P Knops-Gerrits D.E De Vos P.A Jacobs J. Mol. Catal. A 117 1997 57 (b) P Piaggio P McHorn D Murphy D Bethell P.C Bullman Page F.E Hangcock C Sly O.J Kerton G.J Hutchings J. Chem. Soc. Perkin Trans. 2 2000 2008 [10] P. Sutra, D. Brunel, Chem. Commun. (1996) 2485. [11] S.B. Ogunwumi, T. Bein, Chem. Commun. (1997) 901. [12] M.J. Sabater, A. Corma, A. Domenech, V. Fornés, H. Garcı́a, Chem. Commun. (1997) 1285. [13] (a) C.T Kresge M.E Leonowicz W.J Roth J.C Vartuli J.S Beck Nature 359 1992 710 (b) J.S Beck W.J Roth M.E Leonowicz C.T Kresge K.D Schmitt C.T.-W Chu K.H Olson E Sheppard S.B McCullen J.B Higgins J.L Schlenk J. Am. Chem. Soc. 114 1992 10834 [14] (a) P. Salvadori, D. Pini, A. Petri, Synlett, 1999, p. 1181 (b) C Bolm G Arne Eur. J. Org. Chem. 1 1998 21 (c) L Canali E Cowan H Deleuze C.L Gibson D Sherrington J. Chem. Soc. Perkin Trans. 1 2000 2055 (d) D.E. Vos, I.F.K. Vankelecom, P.A. Jacobs (Eds.), Chiral Catalyst Inmobilization and Recycling, Wiley, Weinheim, 2000 (Chapter 10). [15] (a) J.W Ryan G.K Menzie J.L Speier J. Am. Chem. Soc. 82 1960 3601 (b) J.L Speier C.A Roth J.W Ryan J. Org. Chem. 36 1971 3120 [16] (a) M.J Alcón M Iglesias F Sánchez J. Organomet. Chem. 601 2000 284 (b) M.J Alcón A Corma M Iglesias F Sánchez J. Organomet. Chem. 655 2002 134 [17] (a) M.J Alcón E Gutierrez M Iglesias M.A Monge F Sánchez Inorg. Chim. Acta 306 2000 116 (b) M.J Alcón A Corma M Iglesias F Sánchez J. Mol. Cat. A Chem. 178 2001 263 [18] A Corma A Carmona M Iglesias A San José F Sánchez J. Organomet. Chem. 492 1995 11 [19] A Corma A Carmona M Iglesias F Sánchez Inorg. Chim. Acta 244 1996 239 [20] E Miranda F Sánchez J Sanz M.I Jimenez I Martinez-Castro J. High Resol. Chromatogr. 21 1998 225 [21] P Buist H Marecak Tetrahedr. Asymm. 6 1995 7 [22] L.L. Murrell, in: J.J. Burton, R.L. Garten (Eds.), Advanced Materials in Catalysis, Academic Press, New York, 1977 (Chapter 8). [23] J. Drabowski, P. Kilbasin, M. Mikolajczyk, Synthesis of Sulfoxides, Wiley, New York, 1994. [24] (a) P Kannan R Sevvel S Rajagopal K Pitchumani Tetrahedron 53 1997 7635 (b) M. Hirano, S. Yakabe, S. Itoh, J.H. Clark, Synthesis, 1997, p. 1161 (c) V Hulea P Moreau F Di Renzo J. Mol. Catal. A 111 1996 355 (d) A Corma M Iglesias F Sánchez Catal. Lett. 39 1996 153 [25] M Alvaro A Corma H Garcı́a S Valencia Appl. Catal. A 128 1995 L7",
      "scopus-id": "0037416396",
      "coredata": {
        "eid": "1-s2.0-S1381116902005149",
        "dc:description": "Heterogenisation of the manganese(II) and copper(II) complexes bearing a triethoxysilyl group on zeolites (modified ultrastable Y zeolite (USY), MCM-41) through covalent bonding to support and the preparation of the respective Mn-complex encapsulated into the supercages of large pore sized Y zeolite are reported. The chemical environment of the metal in these materials does not change after heterogenisation as we confirm by FT-IR, diffuse reflectance and thermogravimetric (TG) analysis. All catalysts, homogeneous and heterogenised, are active and selective in the oxidation of alkyl phenyl sulfides and nerol at low temperatures using sodium hypochlorite or IOPh as terminal oxidant. The catalytic activity of the anchored USY and MCM41 complexes is higher than the corresponding homogeneous or encapsulated ones, yielding sulfoxides and epoxyalcohols with excellent yields and selectivity and moderate enantioselectivity. Life time of heterogenised catalysts has been examined by repeated use of the complexes leading similar rates and yields of sulfoxide or epoxide, whilst no appreciable loss of metal has been observed over several runs.",
        "openArchiveArticle": "false",
        "prism:coverDate": "2003-03-03",
        "openaccessUserLicense": null,
        "prism:aggregationType": "Journal",
        "prism:url": "https://api.elsevier.com/content/article/pii/S1381116902005149",
        "dc:creator": [
          {
            "@_fa": "true",
            "$": "Alcón, M.J"
          },
          {
            "@_fa": "true",
            "$": "Corma, A"
          },
          {
            "@_fa": "true",
            "$": "Iglesias, M"
          },
          {
            "@_fa": "true",
            "$": "Sánchez, F"
          }
        ],
        "link": [
          {
            "@_fa": "true",
            "@rel": "self",
            "@href": "https://api.elsevier.com/content/article/pii/S1381116902005149"
          },
          {
            "@_fa": "true",
            "@rel": "scidir",
            "@href": "https://www.sciencedirect.com/science/article/pii/S1381116902005149"
          }
        ],
        "dc:format": "application/json",
        "openaccessType": null,
        "pii": "S1381-1169(02)00514-9",
        "prism:volume": "194",
        "prism:publisher": "Elsevier Science B.V.",
        "dc:title": "New Mn(II) and Cu(II) chiral C2-multidentate complexes immobilised in zeolites (USY, MCM41) Reusable catalysts for selective oxidation reactions",
        "prism:copyright": "Copyright © 2002 Elsevier Science B.V. All rights reserved.",
        "openaccess": "0",
        "prism:issn": "13811169",
        "prism:issueIdentifier": "1-2",
        "dcterms:subject": [
          {
            "@_fa": "true",
            "$": "Manganese"
          },
          {
            "@_fa": "true",
            "$": "Copper"
          },
          {
            "@_fa": "true",
            "$": "Heterogenised"
          },
          {
            "@_fa": "true",
            "$": "Encapsulated"
          },
          {
            "@_fa": "true",
            "$": "Sulfide"
          },
          {
            "@_fa": "true",
            "$": "Oxidation"
          },
          {
            "@_fa": "true",
            "$": "Epoxidation"
          }
        ],
        "openaccessArticle": "false",
        "prism:publicationName": "Journal of Molecular Catalysis A: Chemical",
        "prism:number": "1-2",
        "openaccessSponsorType": null,
        "prism:pageRange": "137-152",
        "prism:endingPage": "152",
        "pubType": "fla",
        "prism:coverDisplayDate": "3 March 2003",
        "prism:doi": "10.1016/S1381-1169(02)00514-9",
        "prism:startingPage": "137",
        "dc:identifier": "doi:10.1016/S1381-1169(02)00514-9",
        "openaccessSponsorName": null
      },
      "objects": {
        "object": [
          {
            "@category": "thumbnail",
            "@height": "14",
            "@width": "20",
            "@_fa": "true",
            "$": "https://api.elsevier.com/content/object/eid/1-s2.0-S1381116902005149-si9.gif?httpAccept=%2A%2F%2A",
            "@multimediatype": "GIF image file",
            "@type": "ALTIMG",
            "@size": "149",
            "@ref": "si9",
            "@mimetype": "image/gif"
          },
          {
            "@category": "thumbnail",
            "@height": "17",
            "@width": "94",
            "@_fa": "true",
            "$": "https://api.elsevier.com/content/object/eid/1-s2.0-S1381116902005149-si8.gif?httpAccept=%2A%2F%2A",
            "@multimediatype": "GIF image file",
            "@type": "ALTIMG",
            "@size": "496",
            "@ref": "si8",
            "@mimetype": "image/gif"
          },
          {
            "@category": "thumbnail",
            "@height": "17",
            "@width": "94",
            "@_fa": "true",
            "$": "https://api.elsevier.com/content/object/eid/1-s2.0-S1381116902005149-si7.gif?httpAccept=%2A%2F%2A",
            "@multimediatype": "GIF image file",
            "@type": "ALTIMG",
            "@size": "507",
            "@ref": "si7",
            "@mimetype": "image/gif"
          },
          {
            "@category": "thumbnail",
            "@height": "17",
            "@width": "94",
            "@_fa": "true",
            "$": "https://api.elsevier.com/content/object/eid/1-s2.0-S1381116902005149-si6.gif?httpAccept=%2A%2F%2A",
            "@multimediatype": "GIF image file",
            "@type": "ALTIMG",
            "@size": "511",
            "@ref": "si6",
            "@mimetype": "image/gif"
          },
          {
            "@category": "thumbnail",
            "@height": "17",
            "@width": "94",
            "@_fa": "true",
            "$": "https://api.elsevier.com/content/object/eid/1-s2.0-S1381116902005149-si5.gif?httpAccept=%2A%2F%2A",
            "@multimediatype": "GIF image file",
            "@type": "ALTIMG",
            "@size": "511",
            "@ref": "si5",
            "@mimetype": "image/gif"
          },
          {
            "@category": "thumbnail",
            "@height": "14",
            "@width": "20",
            "@_fa": "true",
            "$": "https://api.elsevier.com/content/object/eid/1-s2.0-S1381116902005149-si4.gif?httpAccept=%2A%2F%2A",
            "@multimediatype": "GIF image file",
            "@type": "ALTIMG",
            "@size": "149",
            "@ref": "si4",
            "@mimetype": "image/gif"
          },
          {
            "@category": "thumbnail",
            "@height": "14",
            "@width": "20",
            "@_fa": "true",
            "$": "https://api.elsevier.com/content/object/eid/1-s2.0-S1381116902005149-si3.gif?httpAccept=%2A%2F%2A",
            "@multimediatype": "GIF image file",
            "@type": "ALTIMG",
            "@size": "149",
            "@ref": "si3",
            "@mimetype": "image/gif"
          },
          {
            "@category": "thumbnail",
            "@height": "14",
            "@width": "20",
            "@_fa": "true",
            "$": "https://api.elsevier.com/content/object/eid/1-s2.0-S1381116902005149-si2.gif?httpAccept=%2A%2F%2A",
            "@multimediatype": "GIF image file",
            "@type": "ALTIMG",
            "@size": "149",
            "@ref": "si2",
            "@mimetype": "image/gif"
          },
          {
            "@category": "thumbnail",
            "@height": "14",
            "@width": "20",
            "@_fa": "true",
            "$": "https://api.elsevier.com/content/object/eid/1-s2.0-S1381116902005149-si11.gif?httpAccept=%2A%2F%2A",
            "@multimediatype": "GIF image file",
            "@type": "ALTIMG",
            "@size": "149",
            "@ref": "si11",
            "@mimetype": "image/gif"
          },
          {
            "@category": "thumbnail",
            "@height": "14",
            "@width": "20",
            "@_fa": "true",
            "$": "https://api.elsevier.com/content/object/eid/1-s2.0-S1381116902005149-si10.gif?httpAccept=%2A%2F%2A",
            "@multimediatype": "GIF image file",
            "@type": "ALTIMG",
            "@size": "149",
            "@ref": "si10",
            "@mimetype": "image/gif"
          },
          {
            "@category": "thumbnail",
            "@height": "14",
            "@width": "20",
            "@_fa": "true",
            "$": "https://api.elsevier.com/content/object/eid/1-s2.0-S1381116902005149-si1.gif?httpAccept=%2A%2F%2A",
            "@multimediatype": "GIF image file",
            "@type": "ALTIMG",
            "@size": "149",
            "@ref": "si1",
            "@mimetype": "image/gif"
          },
          {
            "@category": "thumbnail",
            "@height": "93",
            "@width": "91",
            "@_fa": "true",
            "$": "https://api.elsevier.com/content/object/eid/1-s2.0-S1381116902005149-fx1.sml?httpAccept=%2A%2F%2A",
            "@multimediatype": "GIF image file",
            "@type": "IMAGE-THUMBNAIL",
            "@size": "1937",
            "@ref": "fx1",
            "@mimetype": "image/gif"
          },
          {
            "@category": "standard",
            "@height": "246",
            "@width": "240",
            "@_fa": "true",
            "$": "https://api.elsevier.com/content/object/eid/1-s2.0-S1381116902005149-fx1.gif?httpAccept=%2A%2F%2A",
            "@multimediatype": "GIF image file",
            "@type": "IMAGE-DOWNSAMPLED",
            "@size": "7230",
            "@ref": "fx1",
            "@mimetype": "image/gif"
          },
          {
            "@category": "thumbnail",
            "@height": "93",
            "@width": "95",
            "@_fa": "true",
            "$": "https://api.elsevier.com/content/object/eid/1-s2.0-S1381116902005149-sc1.sml?httpAccept=%2A%2F%2A",
            "@multimediatype": "GIF image file",
            "@type": "IMAGE-THUMBNAIL",
            "@size": "1164",
            "@ref": "sc1",
            "@mimetype": "image/gif"
          },
          {
            "@category": "standard",
            "@height": "406",
            "@width": "416",
            "@_fa": "true",
            "$": "https://api.elsevier.com/content/object/eid/1-s2.0-S1381116902005149-sc1.gif?httpAccept=%2A%2F%2A",
            "@multimediatype": "GIF image file",
            "@type": "IMAGE-DOWNSAMPLED",
            "@size": "9748",
            "@ref": "sc1",
            "@mimetype": "image/gif"
          },
          {
            "@category": "thumbnail",
            "@height": "88",
            "@width": "125",
            "@_fa": "true",
            "$": "https://api.elsevier.com/content/object/eid/1-s2.0-S1381116902005149-gr1.sml?httpAccept=%2A%2F%2A",
            "@multimediatype": "GIF image file",
            "@type": "IMAGE-THUMBNAIL",
            "@size": "1529",
            "@ref": "gr1",
            "@mimetype": "image/gif"
          },
          {
            "@category": "standard",
            "@height": "463",
            "@width": "657",
            "@_fa": "true",
            "$": "https://api.elsevier.com/content/object/eid/1-s2.0-S1381116902005149-gr1.gif?httpAccept=%2A%2F%2A",
            "@multimediatype": "GIF image file",
            "@type": "IMAGE-DOWNSAMPLED",
            "@size": "16574",
            "@ref": "gr1",
            "@mimetype": "image/gif"
          },
          {
            "@category": "thumbnail",
            "@height": "82",
            "@width": "125",
            "@_fa": "true",
            "$": "https://api.elsevier.com/content/object/eid/1-s2.0-S1381116902005149-sc2.sml?httpAccept=%2A%2F%2A",
            "@multimediatype": "GIF image file",
            "@type": "IMAGE-THUMBNAIL",
            "@size": "1852",
            "@ref": "sc2",
            "@mimetype": "image/gif"
          },
          {
            "@category": "standard",
            "@height": "445",
            "@width": "678",
            "@_fa": "true",
            "$": "https://api.elsevier.com/content/object/eid/1-s2.0-S1381116902005149-sc2.gif?httpAccept=%2A%2F%2A",
            "@multimediatype": "GIF image file",
            "@type": "IMAGE-DOWNSAMPLED",
            "@size": "23158",
            "@ref": "sc2",
            "@mimetype": "image/gif"
          },
          {
            "@category": "thumbnail",
            "@height": "82",
            "@width": "125",
            "@_fa": "true",
            "$": "https://api.elsevier.com/content/object/eid/1-s2.0-S1381116902005149-gr2.sml?httpAccept=%2A%2F%2A",
            "@multimediatype": "GIF image file",
            "@type": "IMAGE-THUMBNAIL",
            "@size": "1375",
            "@ref": "gr2",
            "@mimetype": "image/gif"
          },
          {
            "@category": "standard",
            "@height": "335",
            "@width": "509",
            "@_fa": "true",
            "$": "https://api.elsevier.com/content/object/eid/1-s2.0-S1381116902005149-gr2.gif?httpAccept=%2A%2F%2A",
            "@multimediatype": "GIF image file",
            "@type": "IMAGE-DOWNSAMPLED",
            "@size": "9136",
            "@ref": "gr2",
            "@mimetype": "image/gif"
          },
          {
            "@category": "thumbnail",
            "@height": "90",
            "@width": "125",
            "@_fa": "true",
            "$": "https://api.elsevier.com/content/object/eid/1-s2.0-S1381116902005149-gr3.sml?httpAccept=%2A%2F%2A",
            "@multimediatype": "GIF image file",
            "@type": "IMAGE-THUMBNAIL",
            "@size": "1481",
            "@ref": "gr3",
            "@mimetype": "image/gif"
          },
          {
            "@category": "standard",
            "@height": "335",
            "@width": "466",
            "@_fa": "true",
            "$": "https://api.elsevier.com/content/object/eid/1-s2.0-S1381116902005149-gr3.gif?httpAccept=%2A%2F%2A",
            "@multimediatype": "GIF image file",
            "@type": "IMAGE-DOWNSAMPLED",
            "@size": "8937",
            "@ref": "gr3",
            "@mimetype": "image/gif"
          },
          {
            "@category": "thumbnail",
            "@height": "89",
            "@width": "125",
            "@_fa": "true",
            "$": "https://api.elsevier.com/content/object/eid/1-s2.0-S1381116902005149-gr4.sml?httpAccept=%2A%2F%2A",
            "@multimediatype": "GIF image file",
            "@type": "IMAGE-THUMBNAIL",
            "@size": "1285",
            "@ref": "gr4",
            "@mimetype": "image/gif"
          },
          {
            "@category": "standard",
            "@height": "318",
            "@width": "446",
            "@_fa": "true",
            "$": "https://api.elsevier.com/content/object/eid/1-s2.0-S1381116902005149-gr4.gif?httpAccept=%2A%2F%2A",
            "@multimediatype": "GIF image file",
            "@type": "IMAGE-DOWNSAMPLED",
            "@size": "7315",
            "@ref": "gr4",
            "@mimetype": "image/gif"
          },
          {
            "@category": "thumbnail",
            "@height": "94",
            "@width": "120",
            "@_fa": "true",
            "$": "https://api.elsevier.com/content/object/eid/1-s2.0-S1381116902005149-gr5.sml?httpAccept=%2A%2F%2A",
            "@multimediatype": "GIF image file",
            "@type": "IMAGE-THUMBNAIL",
            "@size": "1501",
            "@ref": "gr5",
            "@mimetype": "image/gif"
          },
          {
            "@category": "standard",
            "@height": "368",
            "@width": "471",
            "@_fa": "true",
            "$": "https://api.elsevier.com/content/object/eid/1-s2.0-S1381116902005149-gr5.gif?httpAccept=%2A%2F%2A",
            "@multimediatype": "GIF image file",
            "@type": "IMAGE-DOWNSAMPLED",
            "@size": "9730",
            "@ref": "gr5",
            "@mimetype": "image/gif"
          },
          {
            "@category": "thumbnail",
            "@height": "92",
            "@width": "125",
            "@_fa": "true",
            "$": "https://api.elsevier.com/content/object/eid/1-s2.0-S1381116902005149-gr6.sml?httpAccept=%2A%2F%2A",
            "@multimediatype": "GIF image file",
            "@type": "IMAGE-THUMBNAIL",
            "@size": "1479",
            "@ref": "gr6",
            "@mimetype": "image/gif"
          },
          {
            "@category": "standard",
            "@height": "344",
            "@width": "466",
            "@_fa": "true",
            "$": "https://api.elsevier.com/content/object/eid/1-s2.0-S1381116902005149-gr6.gif?httpAccept=%2A%2F%2A",
            "@multimediatype": "GIF image file",
            "@type": "IMAGE-DOWNSAMPLED",
            "@size": "8910",
            "@ref": "gr6",
            "@mimetype": "image/gif"
          },
          {
            "@category": "thumbnail",
            "@height": "88",
            "@width": "125",
            "@_fa": "true",
            "$": "https://api.elsevier.com/content/object/eid/1-s2.0-S1381116902005149-gr7.sml?httpAccept=%2A%2F%2A",
            "@multimediatype": "GIF image file",
            "@type": "IMAGE-THUMBNAIL",
            "@size": "1150",
            "@ref": "gr7",
            "@mimetype": "image/gif"
          },
          {
            "@category": "standard",
            "@height": "350",
            "@width": "496",
            "@_fa": "true",
            "$": "https://api.elsevier.com/content/object/eid/1-s2.0-S1381116902005149-gr7.gif?httpAccept=%2A%2F%2A",
            "@multimediatype": "GIF image file",
            "@type": "IMAGE-DOWNSAMPLED",
            "@size": "7044",
            "@ref": "gr7",
            "@mimetype": "image/gif"
          },
          {
            "@category": "thumbnail",
            "@height": "90",
            "@width": "125",
            "@_fa": "true",
            "$": "https://api.elsevier.com/content/object/eid/1-s2.0-S1381116902005149-gr8.sml?httpAccept=%2A%2F%2A",
            "@multimediatype": "GIF image file",
            "@type": "IMAGE-THUMBNAIL",
            "@size": "1275",
            "@ref": "gr8",
            "@mimetype": "image/gif"
          },
          {
            "@category": "standard",
            "@height": "336",
            "@width": "468",
            "@_fa": "true",
            "$": "https://api.elsevier.com/content/object/eid/1-s2.0-S1381116902005149-gr8.gif?httpAccept=%2A%2F%2A",
            "@multimediatype": "GIF image file",
            "@type": "IMAGE-DOWNSAMPLED",
            "@size": "7635",
            "@ref": "gr8",
            "@mimetype": "image/gif"
          },
          {
            "@category": "thumbnail",
            "@height": "89",
            "@width": "125",
            "@_fa": "true",
            "$": "https://api.elsevier.com/content/object/eid/1-s2.0-S1381116902005149-gr9.sml?httpAccept=%2A%2F%2A",
            "@multimediatype": "GIF image file",
            "@type": "IMAGE-THUMBNAIL",
            "@size": "1114",
            "@ref": "gr9",
            "@mimetype": "image/gif"
          },
          {
            "@category": "standard",
            "@height": "336",
            "@width": "471",
            "@_fa": "true",
            "$": "https://api.elsevier.com/content/object/eid/1-s2.0-S1381116902005149-gr9.gif?httpAccept=%2A%2F%2A",
            "@multimediatype": "GIF image file",
            "@type": "IMAGE-DOWNSAMPLED",
            "@size": "6240",
            "@ref": "gr9",
            "@mimetype": "image/gif"
          },
          {
            "@category": "thumbnail",
            "@height": "91",
            "@width": "125",
            "@_fa": "true",
            "$": "https://api.elsevier.com/content/object/eid/1-s2.0-S1381116902005149-gr10.sml?httpAccept=%2A%2F%2A",
            "@multimediatype": "GIF image file",
            "@type": "IMAGE-THUMBNAIL",
            "@size": "1360",
            "@ref": "gr10",
            "@mimetype": "image/gif"
          },
          {
            "@category": "standard",
            "@height": "346",
            "@width": "474",
            "@_fa": "true",
            "$": "https://api.elsevier.com/content/object/eid/1-s2.0-S1381116902005149-gr10.gif?httpAccept=%2A%2F%2A",
            "@multimediatype": "GIF image file",
            "@type": "IMAGE-DOWNSAMPLED",
            "@size": "8579",
            "@ref": "gr10",
            "@mimetype": "image/gif"
          }
        ]
      },
      "link": {
        "@rel": "abstract",
        "@href": "https://api.elsevier.com/content/abstract/scopus_id/0037416396"
      }
    }
  }
}