{
  "metadata": {
    "title": "Nieuwland catalysts: investigation of structure in the solid state and in solution and performance in the dimerization of acetylene",
    "authors": "; ; ",
    "journal": "Journal of Molecular Catalysis A: Chemical",
    "date": "2001-10-23",
    "doi": "10.1016/S1381-1169(01)00232-1",
    "abstract": "",
    "uri": "https://api.elsevier.com/content/article/pii/S1381116901002321",
    "pii": "S1381116901002321"
  },
  "fulltext": {
    "full-text-retrieval-response": {
      "scopus-eid": "2-s2.0-0035940628",
      "originalText": "serial JL 271358 291210 291744 291790 291809 31 Journal of Molecular Catalysis A: Chemical JOURNALMOLECULARCATALYSISACHEMICAL 2001-09-30 2001-09-30 2010-04-18T18:49:19 1-s2.0-S1381116901002321 S1381-1169(01)00232-1 S1381116901002321 10.1016/S1381-1169(01)00232-1 S300 S300.1 FULL-TEXT 1-s2.0-S1381116900X01410 2015-05-15T05:56:33.301439-04:00 0 0 20011023 2001 2001-09-30T00:00:00Z articleinfo crossmark dco dateupdated tomb dateloaded datesearch indexeddate issuelist volumelist yearnav articletitlenorm authfirstinitialnorm authfirstsurnamenorm cid cids contenttype copyright dateloadedtxt docsubtype doctype doi eid ewtransactionid hubeid issfirst issn issnnorm itemstage itemtransactionid itemweight openaccess openarchive pg pgfirst pglast pii piinorm pubdatestart pubdatetxt pubyr sortorder srctitle srctitlenorm srctype subheadings volfirst volissue webpdf webpdfpagecount figure table body affil articletitle auth authfirstini authfull authkeywords authlast footnotes primabst ref alllist content subj ssids 1381-1169 13811169 175 175 1 2 1 2 Volume 175, Issues 1–2 9 73 81 73 81 20011023 23 October 2001 2001-10-23 2001 converted-article fla Copyright © 2001 Elsevier Science B.V. All rights reserved. NIEUWLANDCATALYSTSINVESTIGATIONSTRUCTUREINSOLIDSTATEINSOLUTIONPERFORMANCEINDIMERIZATIONACETYLENE NISHIWAKI K 1 Introduction 2 Results and discussion 2.1 Performance of the Nieuwland catalyst 2.2 Structure of the Nieuwland catalyst 2.3 Reaction of acetylene with the Nieuwland catalyst 3 Conclusion 4 Experimental 4.1 Catalytic dimerization of acetylene 4.2 Analysis of the cu salts recovered from the catalyst solution 4.3 Isolation of crystals and crystal structure determination 4.4 Determination of the solubility of Cu salts References NIEUWLAND 1931 4197 J KLEBANSKI 1936 383 A VESTIN 1953 398 R CAROTHERS 1932 4066 W VESTIN 1954 533 R BRINK 1949 158 C BAGLIO 1970 803 J BRINK 1954 176 C AXTELL 1973 S4555 D VONNAST 1957 287 R NISHIWAKIX2001X73 NISHIWAKIX2001X73X81 NISHIWAKIX2001X73XK NISHIWAKIX2001X73X81XK item S1381-1169(01)00232-1 S1381116901002321 1-s2.0-S1381116901002321 10.1016/S1381-1169(01)00232-1 271358 2010-10-03T05:04:39.496517-04:00 2001-10-23 1-s2.0-S1381116901002321-main.pdf https://s3.amazonaws.com/prod-ucs-content-store-us-east/content/pii:S1381116901002321/MAIN/application/pdf/50ae2b8f1c7ad6e49fd590ece9c6bee2/main.pdf https://s3-eu-west-1.amazonaws.com/prod-ucs-content-store-eu-west/content/pii:S1381116901002321/MAIN/application/pdf/50ae2b8f1c7ad6e49fd590ece9c6bee2/main.pdf main.pdf pdf true 351770 MAIN 9 1-s2.0-S1381116901002321-main_1.png https://s3.amazonaws.com/prod-ucs-content-store-us-east/content/pii:S1381116901002321/PREVIEW/image/png/42d72edaf8f22ea9d3f3629a5c8b0bbd/main_1.png https://s3-eu-west-1.amazonaws.com/prod-ucs-content-store-eu-west/content/pii:S1381116901002321/PREVIEW/image/png/42d72edaf8f22ea9d3f3629a5c8b0bbd/main_1.png main_1.png png 61787 849 656 IMAGE-WEB-PDF 1 1-s2.0-S1381116901002321-si9.gif https://s3.amazonaws.com/prod-ucs-content-store-us-east/content/pii:S1381116901002321/STRIPIN/image/gif/d37fa8017da63811aed1cf78554ddb62/si2.gif https://s3-eu-west-1.amazonaws.com/prod-ucs-content-store-eu-west/content/pii:S1381116901002321/STRIPIN/image/gif/d37fa8017da63811aed1cf78554ddb62/si2.gif si9 si9.gif gif 475 18 89 ALTIMG 1-s2.0-S1381116901002321-si8.gif https://s3.amazonaws.com/prod-ucs-content-store-us-east/content/pii:S1381116901002321/STRIPIN/image/gif/f706f1cad5f47e78b600685b445b200b/si8.gif https://s3-eu-west-1.amazonaws.com/prod-ucs-content-store-eu-west/content/pii:S1381116901002321/STRIPIN/image/gif/f706f1cad5f47e78b600685b445b200b/si8.gif si8 si8.gif gif 538 18 98 ALTIMG 1-s2.0-S1381116901002321-si7.gif https://s3.amazonaws.com/prod-ucs-content-store-us-east/content/pii:S1381116901002321/STRIPIN/image/gif/6a22500b5ea8f72a21dbd72d5070327f/si7.gif https://s3-eu-west-1.amazonaws.com/prod-ucs-content-store-eu-west/content/pii:S1381116901002321/STRIPIN/image/gif/6a22500b5ea8f72a21dbd72d5070327f/si7.gif si7 si7.gif gif 551 18 105 ALTIMG 1-s2.0-S1381116901002321-si6.gif https://s3.amazonaws.com/prod-ucs-content-store-us-east/content/pii:S1381116901002321/STRIPIN/image/gif/f420a13a818d6d4865b0e7452b2012bc/si6.gif https://s3-eu-west-1.amazonaws.com/prod-ucs-content-store-eu-west/content/pii:S1381116901002321/STRIPIN/image/gif/f420a13a818d6d4865b0e7452b2012bc/si6.gif si6 si6.gif gif 1427 17 388 ALTIMG 1-s2.0-S1381116901002321-si5.gif https://s3.amazonaws.com/prod-ucs-content-store-us-east/content/pii:S1381116901002321/STRIPIN/image/gif/eb61e33f39e3345bbeb617d0b0d65055/si5.gif https://s3-eu-west-1.amazonaws.com/prod-ucs-content-store-eu-west/content/pii:S1381116901002321/STRIPIN/image/gif/eb61e33f39e3345bbeb617d0b0d65055/si5.gif si5 si5.gif gif 470 18 89 ALTIMG 1-s2.0-S1381116901002321-si4.gif https://s3.amazonaws.com/prod-ucs-content-store-us-east/content/pii:S1381116901002321/STRIPIN/image/gif/42f2e771ee4a15eca2c66e657192d00a/si4.gif https://s3-eu-west-1.amazonaws.com/prod-ucs-content-store-eu-west/content/pii:S1381116901002321/STRIPIN/image/gif/42f2e771ee4a15eca2c66e657192d00a/si4.gif si4 si4.gif gif 4421 41 852 ALTIMG 1-s2.0-S1381116901002321-si3.gif https://s3.amazonaws.com/prod-ucs-content-store-us-east/content/pii:S1381116901002321/STRIPIN/image/gif/6be0b7541a529d4d4f130e9aabe644f6/si3.gif https://s3-eu-west-1.amazonaws.com/prod-ucs-content-store-eu-west/content/pii:S1381116901002321/STRIPIN/image/gif/6be0b7541a529d4d4f130e9aabe644f6/si3.gif si3 si3.gif gif 6387 41 941 ALTIMG 1-s2.0-S1381116901002321-si21.gif https://s3.amazonaws.com/prod-ucs-content-store-us-east/content/pii:S1381116901002321/STRIPIN/image/gif/fbcb6409782f6fa277e5a94cfe04a30d/si13.gif https://s3-eu-west-1.amazonaws.com/prod-ucs-content-store-eu-west/content/pii:S1381116901002321/STRIPIN/image/gif/fbcb6409782f6fa277e5a94cfe04a30d/si13.gif si21 si21.gif gif 631 19 113 ALTIMG 1-s2.0-S1381116901002321-si20.gif https://s3.amazonaws.com/prod-ucs-content-store-us-east/content/pii:S1381116901002321/STRIPIN/image/gif/96df897717d95c5c2958ec974cc3a09e/si20.gif https://s3-eu-west-1.amazonaws.com/prod-ucs-content-store-eu-west/content/pii:S1381116901002321/STRIPIN/image/gif/96df897717d95c5c2958ec974cc3a09e/si20.gif si20 si20.gif gif 743 18 173 ALTIMG 1-s2.0-S1381116901002321-si2.gif https://s3.amazonaws.com/prod-ucs-content-store-us-east/content/pii:S1381116901002321/STRIPIN/image/gif/d37fa8017da63811aed1cf78554ddb62/si2.gif https://s3-eu-west-1.amazonaws.com/prod-ucs-content-store-eu-west/content/pii:S1381116901002321/STRIPIN/image/gif/d37fa8017da63811aed1cf78554ddb62/si2.gif si2 si2.gif gif 475 18 89 ALTIMG 1-s2.0-S1381116901002321-si19.gif https://s3.amazonaws.com/prod-ucs-content-store-us-east/content/pii:S1381116901002321/STRIPIN/image/gif/2b88585332a59a99b10acc3155a88204/si19.gif https://s3-eu-west-1.amazonaws.com/prod-ucs-content-store-eu-west/content/pii:S1381116901002321/STRIPIN/image/gif/2b88585332a59a99b10acc3155a88204/si19.gif si19 si19.gif gif 560 17 103 ALTIMG 1-s2.0-S1381116901002321-si18.gif https://s3.amazonaws.com/prod-ucs-content-store-us-east/content/pii:S1381116901002321/STRIPIN/image/gif/aa4ccbc41650d53e472688ea3467e0c6/si18.gif https://s3-eu-west-1.amazonaws.com/prod-ucs-content-store-eu-west/content/pii:S1381116901002321/STRIPIN/image/gif/aa4ccbc41650d53e472688ea3467e0c6/si18.gif si18 si18.gif gif 651 18 150 ALTIMG 1-s2.0-S1381116901002321-si17.gif https://s3.amazonaws.com/prod-ucs-content-store-us-east/content/pii:S1381116901002321/STRIPIN/image/gif/6f9ae7b2ca00709cc33f1dedb2a072e9/si17.gif https://s3-eu-west-1.amazonaws.com/prod-ucs-content-store-eu-west/content/pii:S1381116901002321/STRIPIN/image/gif/6f9ae7b2ca00709cc33f1dedb2a072e9/si17.gif si17 si17.gif gif 613 22 111 ALTIMG 1-s2.0-S1381116901002321-si16.gif https://s3.amazonaws.com/prod-ucs-content-store-us-east/content/pii:S1381116901002321/STRIPIN/image/gif/10df7e51ae1d73ab863b0da15c249e23/si16.gif https://s3-eu-west-1.amazonaws.com/prod-ucs-content-store-eu-west/content/pii:S1381116901002321/STRIPIN/image/gif/10df7e51ae1d73ab863b0da15c249e23/si16.gif si16 si16.gif gif 523 19 103 ALTIMG 1-s2.0-S1381116901002321-si15.gif https://s3.amazonaws.com/prod-ucs-content-store-us-east/content/pii:S1381116901002321/STRIPIN/image/gif/c9280df4245467bdf0e9b3df0b8d8202/si15.gif https://s3-eu-west-1.amazonaws.com/prod-ucs-content-store-eu-west/content/pii:S1381116901002321/STRIPIN/image/gif/c9280df4245467bdf0e9b3df0b8d8202/si15.gif si15 si15.gif gif 618 19 113 ALTIMG 1-s2.0-S1381116901002321-si14.gif https://s3.amazonaws.com/prod-ucs-content-store-us-east/content/pii:S1381116901002321/STRIPIN/image/gif/ceaea6a96f3c177487e7521ff8f3a279/si14.gif https://s3-eu-west-1.amazonaws.com/prod-ucs-content-store-eu-west/content/pii:S1381116901002321/STRIPIN/image/gif/ceaea6a96f3c177487e7521ff8f3a279/si14.gif si14 si14.gif gif 582 19 113 ALTIMG 1-s2.0-S1381116901002321-si13.gif https://s3.amazonaws.com/prod-ucs-content-store-us-east/content/pii:S1381116901002321/STRIPIN/image/gif/fbcb6409782f6fa277e5a94cfe04a30d/si13.gif https://s3-eu-west-1.amazonaws.com/prod-ucs-content-store-eu-west/content/pii:S1381116901002321/STRIPIN/image/gif/fbcb6409782f6fa277e5a94cfe04a30d/si13.gif si13 si13.gif gif 631 19 113 ALTIMG 1-s2.0-S1381116901002321-si12.gif https://s3.amazonaws.com/prod-ucs-content-store-us-east/content/pii:S1381116901002321/STRIPIN/image/gif/bcd3c31fef82e9d30c3a7e22ba04dd9e/si12.gif https://s3-eu-west-1.amazonaws.com/prod-ucs-content-store-eu-west/content/pii:S1381116901002321/STRIPIN/image/gif/bcd3c31fef82e9d30c3a7e22ba04dd9e/si12.gif si12 si12.gif gif 457 18 82 ALTIMG 1-s2.0-S1381116901002321-si11.gif https://s3.amazonaws.com/prod-ucs-content-store-us-east/content/pii:S1381116901002321/STRIPIN/image/gif/b5f0bbcbd3fc20a45f3f16bc38f894c6/si11.gif https://s3-eu-west-1.amazonaws.com/prod-ucs-content-store-eu-west/content/pii:S1381116901002321/STRIPIN/image/gif/b5f0bbcbd3fc20a45f3f16bc38f894c6/si11.gif si11 si11.gif gif 490 18 89 ALTIMG 1-s2.0-S1381116901002321-si10.gif https://s3.amazonaws.com/prod-ucs-content-store-us-east/content/pii:S1381116901002321/STRIPIN/image/gif/db04832911c56035bcbe3fa570054b87/si10.gif https://s3-eu-west-1.amazonaws.com/prod-ucs-content-store-eu-west/content/pii:S1381116901002321/STRIPIN/image/gif/db04832911c56035bcbe3fa570054b87/si10.gif si10 si10.gif gif 468 18 82 ALTIMG 1-s2.0-S1381116901002321-si1.gif https://s3.amazonaws.com/prod-ucs-content-store-us-east/content/pii:S1381116901002321/STRIPIN/image/gif/219214cf7c343b560e4c1007bc19bc51/si1.gif https://s3-eu-west-1.amazonaws.com/prod-ucs-content-store-eu-west/content/pii:S1381116901002321/STRIPIN/image/gif/219214cf7c343b560e4c1007bc19bc51/si1.gif si1 si1.gif gif 743 17 185 ALTIMG 1-s2.0-S1381116901002321-fx1.sml https://s3.amazonaws.com/prod-ucs-content-store-us-east/content/pii:S1381116901002321/fx1/THUMBNAIL/image/gif/d913dcabe12a596cd92ffd907683bf57/fx1.sml https://s3-eu-west-1.amazonaws.com/prod-ucs-content-store-eu-west/content/pii:S1381116901002321/fx1/THUMBNAIL/image/gif/d913dcabe12a596cd92ffd907683bf57/fx1.sml fx1 fx1.sml sml 561 30 125 IMAGE-THUMBNAIL 1-s2.0-S1381116901002321-fx1.gif https://s3.amazonaws.com/prod-ucs-content-store-us-east/content/pii:S1381116901002321/fx1/DOWNSAMPLED/image/gif/1010d756e75e5eb5ea5be44e017545c8/fx1.gif https://s3-eu-west-1.amazonaws.com/prod-ucs-content-store-eu-west/content/pii:S1381116901002321/fx1/DOWNSAMPLED/image/gif/1010d756e75e5eb5ea5be44e017545c8/fx1.gif fx1 fx1.gif gif 3116 107 453 IMAGE-DOWNSAMPLED 1-s2.0-S1381116901002321-gr1.sml https://s3.amazonaws.com/prod-ucs-content-store-us-east/content/pii:S1381116901002321/gr1/THUMBNAIL/image/gif/9b0220c8e4e962b5de34122581bcf47a/gr1.sml https://s3-eu-west-1.amazonaws.com/prod-ucs-content-store-eu-west/content/pii:S1381116901002321/gr1/THUMBNAIL/image/gif/9b0220c8e4e962b5de34122581bcf47a/gr1.sml gr1 gr1.sml sml 1456 93 115 IMAGE-THUMBNAIL 1-s2.0-S1381116901002321-gr1.gif https://s3.amazonaws.com/prod-ucs-content-store-us-east/content/pii:S1381116901002321/gr1/DOWNSAMPLED/image/gif/770511f4971f78539ab41b839250a45a/gr1.gif https://s3-eu-west-1.amazonaws.com/prod-ucs-content-store-eu-west/content/pii:S1381116901002321/gr1/DOWNSAMPLED/image/gif/770511f4971f78539ab41b839250a45a/gr1.gif gr1 gr1.gif gif 6317 275 339 IMAGE-DOWNSAMPLED 1-s2.0-S1381116901002321-gr2.sml https://s3.amazonaws.com/prod-ucs-content-store-us-east/content/pii:S1381116901002321/gr2/THUMBNAIL/image/gif/cebe5aef5f2df24f0fa98a60415832b4/gr2.sml https://s3-eu-west-1.amazonaws.com/prod-ucs-content-store-eu-west/content/pii:S1381116901002321/gr2/THUMBNAIL/image/gif/cebe5aef5f2df24f0fa98a60415832b4/gr2.sml gr2 gr2.sml sml 2120 93 74 IMAGE-THUMBNAIL 1-s2.0-S1381116901002321-gr2.jpg https://s3.amazonaws.com/prod-ucs-content-store-us-east/content/pii:S1381116901002321/gr2/DOWNSAMPLED/image/jpeg/0d205a77807e1121a6c9322914a6f901/gr2.jpg https://s3-eu-west-1.amazonaws.com/prod-ucs-content-store-eu-west/content/pii:S1381116901002321/gr2/DOWNSAMPLED/image/jpeg/0d205a77807e1121a6c9322914a6f901/gr2.jpg gr2 gr2.jpg jpg 146030 664 526 IMAGE-DOWNSAMPLED 1-s2.0-S1381116901002321-sc1.sml https://s3.amazonaws.com/prod-ucs-content-store-us-east/content/pii:S1381116901002321/sc1/THUMBNAIL/image/gif/d7bd0c877ad19d95bd581fde51c91387/sc1.sml https://s3-eu-west-1.amazonaws.com/prod-ucs-content-store-eu-west/content/pii:S1381116901002321/sc1/THUMBNAIL/image/gif/d7bd0c877ad19d95bd581fde51c91387/sc1.sml sc1 sc1.sml sml 1023 36 125 IMAGE-THUMBNAIL 1-s2.0-S1381116901002321-sc1.gif https://s3.amazonaws.com/prod-ucs-content-store-us-east/content/pii:S1381116901002321/sc1/DOWNSAMPLED/image/gif/04dcc1c4e958fa16c25afee1d7410393/sc1.gif https://s3-eu-west-1.amazonaws.com/prod-ucs-content-store-eu-west/content/pii:S1381116901002321/sc1/DOWNSAMPLED/image/gif/04dcc1c4e958fa16c25afee1d7410393/sc1.gif sc1 sc1.gif gif 2071 64 224 IMAGE-DOWNSAMPLED 1-s2.0-S1381116901002321-gr3.sml https://s3.amazonaws.com/prod-ucs-content-store-us-east/content/pii:S1381116901002321/gr3/THUMBNAIL/image/gif/8873c57e80c22b1c16cc8ac2e439ce15/gr3.sml https://s3-eu-west-1.amazonaws.com/prod-ucs-content-store-eu-west/content/pii:S1381116901002321/gr3/THUMBNAIL/image/gif/8873c57e80c22b1c16cc8ac2e439ce15/gr3.sml gr3 gr3.sml sml 1400 93 102 IMAGE-THUMBNAIL 1-s2.0-S1381116901002321-gr3.gif https://s3.amazonaws.com/prod-ucs-content-store-us-east/content/pii:S1381116901002321/gr3/DOWNSAMPLED/image/gif/243d3da5142c21affb45ef95f4344d7e/gr3.gif https://s3-eu-west-1.amazonaws.com/prod-ucs-content-store-eu-west/content/pii:S1381116901002321/gr3/DOWNSAMPLED/image/gif/243d3da5142c21affb45ef95f4344d7e/gr3.gif gr3 gr3.gif gif 4939 241 264 IMAGE-DOWNSAMPLED 1-s2.0-S1381116901002321-gr4.sml https://s3.amazonaws.com/prod-ucs-content-store-us-east/content/pii:S1381116901002321/gr4/THUMBNAIL/image/gif/647de09305112a4596e2bdc14eb602d9/gr4.sml https://s3-eu-west-1.amazonaws.com/prod-ucs-content-store-eu-west/content/pii:S1381116901002321/gr4/THUMBNAIL/image/gif/647de09305112a4596e2bdc14eb602d9/gr4.sml gr4 gr4.sml sml 1341 93 65 IMAGE-THUMBNAIL 1-s2.0-S1381116901002321-gr4.gif https://s3.amazonaws.com/prod-ucs-content-store-us-east/content/pii:S1381116901002321/gr4/DOWNSAMPLED/image/gif/df0ef4e60e1a0b49f2f07dfb5819498c/gr4.gif https://s3-eu-west-1.amazonaws.com/prod-ucs-content-store-eu-west/content/pii:S1381116901002321/gr4/DOWNSAMPLED/image/gif/df0ef4e60e1a0b49f2f07dfb5819498c/gr4.gif gr4 gr4.gif gif 13942 498 347 IMAGE-DOWNSAMPLED 1-s2.0-S1381116901002321-sc2.sml https://s3.amazonaws.com/prod-ucs-content-store-us-east/content/pii:S1381116901002321/sc2/THUMBNAIL/image/gif/922d7f3781ffa11db704c6bb935f74c6/sc2.sml https://s3-eu-west-1.amazonaws.com/prod-ucs-content-store-eu-west/content/pii:S1381116901002321/sc2/THUMBNAIL/image/gif/922d7f3781ffa11db704c6bb935f74c6/sc2.sml sc2 sc2.sml sml 974 45 125 IMAGE-THUMBNAIL 1-s2.0-S1381116901002321-sc2.gif https://s3.amazonaws.com/prod-ucs-content-store-us-east/content/pii:S1381116901002321/sc2/DOWNSAMPLED/image/gif/9781fd86feb45c4ff86d947f116f6523/sc2.gif https://s3-eu-west-1.amazonaws.com/prod-ucs-content-store-eu-west/content/pii:S1381116901002321/sc2/DOWNSAMPLED/image/gif/9781fd86feb45c4ff86d947f116f6523/sc2.gif sc2 sc2.gif gif 4373 122 339 IMAGE-DOWNSAMPLED 1-s2.0-S1381116901002321-sc3.sml https://s3.amazonaws.com/prod-ucs-content-store-us-east/content/pii:S1381116901002321/sc3/THUMBNAIL/image/gif/e316cb94d7b146c8896bab3b4137e13a/sc3.sml https://s3-eu-west-1.amazonaws.com/prod-ucs-content-store-eu-west/content/pii:S1381116901002321/sc3/THUMBNAIL/image/gif/e316cb94d7b146c8896bab3b4137e13a/sc3.sml sc3 sc3.sml sml 932 94 110 IMAGE-THUMBNAIL 1-s2.0-S1381116901002321-sc3.gif https://s3.amazonaws.com/prod-ucs-content-store-us-east/content/pii:S1381116901002321/sc3/DOWNSAMPLED/image/gif/c66127e04d0afe1564224d556766b0e5/sc3.gif https://s3-eu-west-1.amazonaws.com/prod-ucs-content-store-eu-west/content/pii:S1381116901002321/sc3/DOWNSAMPLED/image/gif/c66127e04d0afe1564224d556766b0e5/sc3.gif sc3 sc3.gif gif 2849 223 262 IMAGE-DOWNSAMPLED MOLCAA 3238 S1381-1169(01)00232-1 10.1016/S1381-1169(01)00232-1 Elsevier Science B.V. Fig. 1 Relationship between observed rate of the conversion of dimerization of acetylene catalyzed by CuCl–KCl and the flow rate of acetylene. Fig. 2 Photographs of crystals: (i) a mixture of (A) and (B); (ii) (A) obtained with a microscope. Maximum size (mm) of three crystals ([2], [1], and [0]) in (ii) are shown at a corner of the photograph. Scheme 1 Fig. 3 DSC trace of a catalyst solution. Temperature change of; (a) catalyst solution; (b) bath in which the catalyst solution was immersed; and (c) difference of curves (a) and (b). Fig. 4 Plotting of solid separation from the aqueous solutions containing CuCl and KCl in various ratios and concentrations. The upper area of each curve corresponds to the Cu and K concentrations higher than the limit of the solubility of K n CuCl n+1 (1<n<1.5) in water: (i) without acetylene; (ii) with acetylene. [Cu]=6.7 M ; [K]/[Cu]=1.0 (a), 1.1 (b), 1.2 (c), 1.3 (d), 1.4 (e), 1.5 (f). Scheme 2 Scheme 3 Table 1 Results of dimerization of acetylene catalyzed by the Nieuwland type catalysts (CuCl and MCl) a Run Catalyst (M) Composition of gas in output (%) Reactivity (%) b Selectivity (%) c CuCl MCl d Vinylacetylene Acetaldehyde 1,2-Divinyl-acetylene 1-Ethynyl-1,3-butadiene Acetylene (recovered) 1 6.7 6.4 (KCl) 6.09 0.28 0.19 0.03 93.38 12.3 92.8 2 6.7 6.4 (NH4Cl) 4.90 0.32 0.20 0.06 94.51 10.3 89.9 3 6.7 6.4 (LiCl) 1.48 ND e ND e ND e ND e 1.6 92.7 4 6.7 6.4 (NaCl) 4.49 ND e ND e ND e ND e 4.8 93.6 5 6.7 6.4 (CsCl) 0 0 0 0 100.00 0.0 0.0 6 5.5 6.1 (KCl) 5.67 0.25 0.25 0.05 93.78 11.8 90.8 7 6.7 6.4 (KCl) 8.75 0.38 0.38 0.13 90.36 17.7 90.2 8 6.7 7.4 (KCl) 5.61 0.24 0.24 0.16 93.75 11.9 88.6 9 8.0 7.6 (KCl) 8.83 0.39 0.39 0.14 90.78 17.7 90.6 a The reaction was carried out at 75°C in 240ml aqueous solution (300ml vessel) for runs 1–5 and at 75°C in 6.55l aqueous solution (7l vessel) for runs 6–9. b Reactivity(%)= 100×(2×[vinylacetylene]+[acetaldehyde]+3×[1,2-divinylacetylene]+3×[1-ethynyl-1,3-butadiene]) (2×[vinylacetylene]+[acetaldehyde]+3×[1,2-divinylacetylene]+3×[1-ethynyl-1,3-butadiene]+[acetylene]) , where [A] denotes the concentration of A in the gaseous output. c Selectivity(%)= 100×2×[vinylacetylene] (2×[vinylacetylene]+[acetaldehyde]+3×[1,2-divinylacetylene]+3×[1-ethynyl-1,3-butadiene]) . d MCl is shown in parentheses. e Not determined. Nieuwland catalysts: investigation of structure in the solid state and in solution and performance in the dimerization of acetylene Ken-ichiro Nishiwaki 1 a Mineto Kobayashi a Takao Takeuchi a Kazumasa Matuoto a Kohtaro Osakada b * a Denki-Kagaku Kogyo Co. Ltd., Ohmi-machi Nishikubiki-gun, Niigata 949-0393, Japan b Research Laboratory of Resources Utilization, Tokyo Institute of Technology, 4259 Nagatsuta, Midori-ku, Yokohama 226-8503, Japan * Corresponding author. Tel./fax: +81-45-924-5224 1 Co-corresponding author. Catalysis by Cu salts (M n CuCl n+1;M=K+,NH4 +) in concentrated aqueous solutions (approximately 5–8M) is investigated using a flow reaction system at 75°C. Selective dimerization of acetylene gives vinylacetylene as a major product and much smaller amounts of 1,2-divinylacetylene, acetaldehyde, 1-ethynyl-1,3-butadiene, and uncharacterized black tarry products. Cooling the catalyst solution to room temperature causes the growth of a mixture of tetrahedral and needle-like colorless crystals. Observation of the crystals by microscopy and their crystallography, and analyses of the Cu compounds reveal that they are CuCl and K2CuCl3, respectively. Plots of the graphs of the solubility of the Cu salts in water as a function of temperature and composition of the salt show the dominant presence of KCuCl2 in the solution. A mechanism of the reaction is proposed based on the performance of the catalyst and its structure. Keywords Catalysis Copper Acetylene Dimerization 1 Introduction A Nieuwland catalyst, which is composed of CuCl and KCl or NH4Cl, has long been the representative catalyst for acetylene dimerization on an industrial scale [1–6]. Catalysis by a Nieuwland system has several unique characteristics. It enables selective dimerization of acetylene to give vinylacetylene, and the further reaction of acetylene with the product is effectively prohibited, resulting in the formation of the dimer of acetylene rather than that of benzene or a linear acetylene trimer. Vinylacetylene is easily turned into chloroprene which is an important starting material for the synthetic rubber. The catalytic reaction is carried out in aqueous solutions containing high concentrations of the Cu+ and K+ (or NH4 +). The reaction needs to be carried out under the proper pH range to inhibit formation of explosive copper acetylide and without exposure of the products to oxygen to prevent ignition of divinylacetylene formed as a by-product. This aqueous reaction seems to be environmentally more favorable than a number of synthetic organic reactions including transition metal complexes promoted dimerization of monosubstituted acetylenes in organic solvents. The mechanism of the reaction is probably distinct from that of the previously studied homogeneous catalytic reactions which have mostly been carried out in dilute solutions of organic solvents. In spite of the long history and exclusively high performance of the Nieuwland catalyst, only a few detailed studies on the catalyst structure and performance have appeared in the literature. Crystallographic studies of solid products recovered from aqueous solutions of NH4Cl and CuCl revealed several structures of chlorocuprates, Cu m Cl n −(n−m) [7,8]. Further elucidation of relationship between the catalyst performance and solution structure of the catalyst seems to be of importance to comprehend the mechanism of the unique catalytic reaction. In this paper, we report the structure of the Nieuwland catalyst in the solid state and in solution, and its catalytic activity which varies depending on the conditions. 2 Results and discussion 2.1 Performance of the Nieuwland catalyst Passing acetylene into an aqueous solution of a Nieuwland catalyst composed of a mixture of CuCl and KCl using a flow reaction system produces vinylacetylene in high selectivity (approximately 90%) together with smaller amounts of 1,2-divinylacetylene, acetaldehyde, 1-ethynyl-1,3-butadiene, and uncharacterized black tarry products probably containing acetylene oligomers or polymers (Eq. (1)). (1) A typical example is shown in the following. An aqueous solution (240ml) of a mixture of CuCl (6.7M) and KCl (6.4M) at 75°C converts acetylene (12.3% conversion) into a mixture of vinylacetylene (92.8% selectivity) and smaller amounts of acetaldehyde, 1,2-divinylacetylene, 1-ethynyl-1,3-butadiene and tarry acetylene oligomers. Vinyl chloride less than 0.1% was also formed. These results as well as those of the reactions using LiCl, NaCl, CsCl and NH4Cl, instead of KCl are summarized in Table 1 . The catalyst prepared from CuCl and NH4Cl exhibits a level of catalytic activity similar to or slightly lower than the CuCl–KCl catalyst, whereas LiCl, NaCl, and CsCl promote the reaction to a much lesser extent than KCl or NH4Cl. Since the catalysts prepared from CuCl and these three alkaline metal chlorides are partially soluble in water at the temperature used (36–44% of the original salts undissolved), the low level of catalytic activity is primarily due to the low concentration of the catalyst. Table 1 also lists the results of the reactions catalyzed by the CuCl–KCl catalyst with different Cu concentrations and K/Cu ratios of the catalyst. The rate of conversion of acetylene, as well as the molar ratio of vinylacetylene to converted acetylene, is influenced by Cu concentration to a negligible extent (runs 6 and 8, and 7 and 9), whereas the Cu-to-K ratio has a considerable effect on the results (runs 7 and 8). The reactions with Cu/K=0.95 convert acetylene into products more efficiently than those with Cu/K=1.10, while the selectivity for vinylacetylene among the products is similar. These reactions were carried out with the acetylene flow rate which are large enough to exclude influence of diffusion rate of acetylene on the observed reaction rate and selectivity as described below. Fig. 1 shows the relationship of the uptake of acetylene with the flow rate of the substrate. The reaction rate is influenced by the flow rate of acetylene; low acetylene flow rates up to 1.2lmin−1 cause a linear increase in the amount of vinylacetylene formed, indicating that the reaction rate is governed by diffusion of acetylene in the solution. At an acetylene flow rate above 1.2lmin−1, the reaction rates become almost constant and no relationship is observed between the flow rate and the yield of the product. The reaction rates in Table 1 were determined at a flow rate of acetylene higher than 1.4lmin−1 in order to minimize the effect of diffusion on the observed reaction rate. 2.2 Structure of the Nieuwland catalyst Cooling the catalyst solution to room temperature causes the separation of Cu-containing crystals. Microscope observation of the crystals revealed that they have two shapes, tetrahedral crystals (A) and needle-like crystals (B). The former crystals are obtained from the solution of a mixture of CuCl (6.7M) and KCl (6.4M), whereas the solution with higher CuCl (8.3M) and KCl (7.9M) content produced a mixture of both crystals. Fig. 2 shows photographs of crystals (A) and a mixture of (A) and (B). The exterior of crystals (A) resembles CuCl in photographs presented by Vestin [9]. Further characterization by X-ray diffraction (XRD) and metal analyses confirmed the structure. Crystals (A) are identified as CuCl by comparison of their wide angle XRD patterns (2θ=28.4°, 47.4° and 56.2°, Cu Kα, JCPDS 06-0344) with standard data. The position and relative intensity of diffraction of crystal (A) are quite similar to those of standard data. Analytical results showing the absence of K (0.1%) and the content of Cu (59.2, 63.5% calculated as CuCl) also suggest the formula given above. The needle-like crystals were obtained as a major product from the crystallization of the catalyst solution with higher K and/or Cu concentrations. Upon cooling, most of the solutions gave colorless needle-like crystals (B) at first and a crystalline colorless mass (A) later, indicating faster crystal growth of (B) than (A). X-ray crystallography was used to determine the structure of single crystals of (B). The compound is composed of a linearly arranged CuCl3 2− units and K+ ions. Scheme 1 depicts the arrangement of CuCl3 2− units. Each Cu center has two non-bridging Cl ligands and is bridged to two adjacent Cu atoms with Cl ions; the molecule contains a linear arrangement of alternating Cu and Cl atoms. The lengths of the two bridging Cu–Cl bonds differ significantly from each other. The crystallographic data and bond parameters are similar to the previously reported K2CuCl3 [10], although the results obtained with a diffractometer seem to provide more accurate bond parameters; Cu–Cl1 2.320(3), Cu–Cl2 2.365(10), Cu–Cl2′ 2.48(1), Cu–Cl3 2.336(3), Cl1–Cu–Cl2 105.4(3), Cl1–Cu–Cl2′ 108.4(3), Cl1–Cu–Cl3 110.7(1), Cl2–Cu–Cl2′ 117.8(1), Cl2–Cu–Cl3 106.0(3), Cl2′–Cu–Cl3 108.4(3). Crystalline solids recovered from the solutions are composed of tetrahedral crystals of CuCl (A) and needle-like crystals of K2CuCl3 (B) exclusively and contain only negligible amounts of other Cu compounds such as KCuCl2, probably because of their much higher solubility in water than CuCl and K2CuCl3. The structure of the catalyst in solution is more closely related to the chemical properties of K n CuCl n+1 than the solid state structure. Chlorocuprates [CuCl m+1] m− initially reported many years ago [10–14] were recently isolated as salts with organic cations and studied in solution with organic solvents [15]. The behavior of K n CuCl n+1 in aqueous solutions with high concentration has not been investigated in detail. The saturated concentration of K n CuCl n+1 can be regarded as a convenient probe to investigate the composition and structure of the complex salt because the value of n of K n CuCl n+1 influences the solubility of the Cu compound significantly. To obtain clear insight into the composition of the Cu compounds in solution, systematic measurement of solubility was examined by monitoring the saturation concentration. The saturation concentration of K n CuCl n+1can be estimated by direct observation of the temperature at which separation of the Cu salt as a solid begins to occur upon cooling the unsaturated solution, but it is obtained more accurately by recording the temperature change of a gradually cooled solution. Fig. 3 shows the change in temperature of water and of the catalyst solution upon cooling, and the latter shows a clear wrinkle corresponding to the exothermic separation of the Cu salt from the aqueous solution. Fig. 4 (i) shows a plot of the relationship between saturation temperature of a Cu salt solution and Cu concentration. Four to six aqueous solutions of K n CuCl n+1 with a constant n value give rise to a V-shaped curve in the plots in the range 1.0<n<1.5. The results are contrasted with the relationship of temperature and solubility of a single compound, which exhibits a monotonous rise (or fall) in the plots of saturated concentration vs. temperature. The curves in Fig. 4(i) can be rationalized by assuming the presence of the following equilibria among the Cu compounds (Scheme 2 ). The aqueous solution contains mainly three Cu compounds; CuCl, KCuCl2 and K2CuCl3. The compound CuCl is practically insoluble in water, and its concentration in aqueous solution is extremely low. The double cuprate, K2CuCl3, also seems to show a limited solubility in water although it is much more soluble than CuCl. Preferential separation of crystalline solids of CuCl and K2CuCl3 from the aqueous catalyst solution indicates a much lower solubility of the compounds than KCuCl2. Thus, KCuCl2 is mostly dissolved in water even at high concentrations of the Cu and K compounds (>3M). It is not separated as a solid from the solution directly, but is in equilibrium with much less soluble KCl and K2CuCl3 which are separated preferentially from the catalyst solution. At present, it is not feasible to conclude the size of the cuprate dissolved at such high concentrations since conventional methods of determining the molecular weight of a solute could not be applied for these reactions. We presume the presence of several species including mononuclear and oligonuclear cuprates. Scheme 3 depicts a general sketch of the solubility curve of the catalyst in aqueous solution. The main solute in the solution is KCuCl2, which is more soluble than CuCl and K2CuCl3. A solution at a higher Cu concentration than the minimum point in the curve contains a significant amount of K2CuCl3 is because the crystals obtained by cooling the solution contain mainly needle-like K2CuCl3 (B). On the other hand, a solid recovered from a solution with a lower Cu concentration than the minimum point in the curve contains a much smaller amount of (B) and contains tetrahedral crystals of CuCl (A) and/or a crystalline mass with a composition similar to that of CuCl. These results suggest that the content of K2CuCl3 in the solutions with a constant K/Cu ratio increases with increase in the Cu concentration as suggested in Scheme 3. This is consistent with the observation that on increase in Cu concentration equilibria (ii) and (iii) in Scheme 2 shift to the right when the initial K/Cu ratio is fixed. At KCl/CuCl ratio of 1.0 and 1.1, the curves in Fig. 4 exhibit minimum points at [Cu]=7.4 M and 5.9M, respectively. Since the dimerization of acetylene catalyzed by the Nieuwland system is carried out at 75°C at 5–8M Cu concentration and a K/Cu ratio of 0.95–1.10, the catalyst is dissolved completely under the reaction conditions. Increasing the K/Cu ratio up to 1.5 causes a significant shift of the curve to the right for the following reason. The addition of KCl leads to an increase in the amount of KCuCl2 and a consequent decrease in the amount of CuCl in the solution, resulting in the dissolution of solid CuCl in the system. On the other hand, increasing [K+] in the solution leads to the separation of K2CuCl3 from the solution. Thus, curves in Fig. 4(i) and their shift caused by the change in K/Cu ratio are directly related to the equilibria of Cu compounds in Scheme 2. 2.3 Reaction of acetylene with the Nieuwland catalyst Passing acetylene through an aqueous solution of K n CuCl n+1 at 75°C causes its pH to change approximately from 4.0 to 0.5. Acidification of the solution upon the addition of acetylene suggests the evolution of HCl caused by the exchange of the Cl ligand bonded to Cu with acetylide according to the following equation. Previous reports on the reaction of acetylene with Cu salts discussed the change in the composition of Cu compounds in solution [4,7,8] and ascribed the change in the chemical properties of the solution to the simple π-coordination of acetylene to the Cu center rather than copper acetylide formation. The general preparation of copper acetylide requires basic conditions to complete the reaction [16]. However, it is reasonable to postulate that copper acetylide formation proceeds smoothly in concentrated solutions. The solubility of the Cu compounds in the presence of acetylene was examined and is summarized in Fig. 4(ii). The V-shaped curves are similar to those in Fig. 4(i), although the solubility of the Cu compounds in the presence of acetylene is higher than those in the absence of acetylene. The curves are shifted to the left by increasing the K/Cu ratio from 1.0 to 1.5, similar to those in Fig. 4(i). All these results suggest the following situation for the Cu-containing species in these solutions. The Cu complexes with chloro and acetylide with the mixed cuprate formula, K n CuCl n+1−x (CCH) x , are also involved in equilibria among neutral Cu(I) salts (n=0) and single and double cuprates (n=1 and 2, respectively), similarly to K n CuCl n+1. These three components show a tendency for solubility in water similar to the homoleptic chloro-compounds of Cu(I) (neutral (n=0)<doublecuprate (n=2)<monocuprate (n=1)). On the other hand, the curves in Fig. 4(ii) are at lower Cu concentrations than those in Fig. 4(i), suggesting that copper acetylide Cu(CCH) or partially acetylide substituted chlorocopper, Cu y Cl z (CCH) y−z , exhibits a higher solubility in water than CuCl. Acetylide-containing cuprates K n CuCl n+1−x (CCH) x are also more soluble in water than K n CuCl n+1 because the temperature of saturation of the acetylide-containing Cu compounds is lower than that of the chlorocopper derivatives. 3 Conclusion Although the Nieuwland catalyst is classic and has kept its form for several decades, a detailed study has not been applied except for crystallographic studies of the solid from catalyst solutions and several technical modifications. This study has revealed details of the Nieuwland catalyst structure and its reaction from various aspects. The dissolved species in the solution of a mixture of KCl and CuCl was determined as KCuCl2 while the other possible species in the solution, KCl and K2CuCl3, exhibit too low solubility to give the aqueous solution at the high concentration. Comparison of the solubility of the salts in the presence of acetylene with that of the above mixture under the conditions of the catalytic dimerization of acetylene, giving vinylacetylene selectively, indicated that the plausible active species of the catalyst is the cuprate with chloro and/or acetylide ligands. Selective dimerization of acetylene is a unique characteristic of the catalysis. Moreover, catalytic reactions of organic substrates in aqueous solutions will increase their importance since they are free from the issue of organic solvent waste or recovery, particularly for industrial applications. 4 Experimental 4.1 Catalytic dimerization of acetylene A typical procedure for the dimerization of acetylene is as follows. Under a nitrogen stream, a mixture of KCl and CuCl was dissolved in water at 70°C. The solution (218ml) was transferred to a reaction vessel equipped with an acetylene inlet, product outlet, thermometer, and water jacket. After the addition of triethylene glycol dibutyl ether (22ml) for trapping by-products, the solution was maintained at 75°C by circulating hot water in the water jacket. Acetylene (1.5lmin−1) was passed through the solution for 15min at the indicated temperature. After the reaction, the gas sampled at the outlet was analyzed by gas chromatography. 4.2 Analysis of the cu salts recovered from the catalyst solution The solid obtained by cooling the catalyst solution ([CuCl]=6.7 M , [KCl]=6.4 M ) was analyzed by XRD and elemental analyses. The XRD (Cu Kα radiation) of the powder sample on the adhesive tape exhibited three major peaks at 2θ=28.4°, 47.4° and 56.2°, which agree with the standard data for CuCl (JCPDS 06-0344). Metals contained in the solid were determined after HNO3 acidolysis to be Cu (59.2%) and K (<0.1%). The crystals grown from the cooled catalyst solution were tetrahedral as observed with a micrograph. All the data indicate that the solid recovered from the solution is CuCl. 4.3 Isolation of crystals and crystal structure determination Crystals of CuCl (A) and K2CuCl3 (B) were obtained from the acetylene-saturated aqueous solutions containing the catalyst as follows. Nitrogen was passed into the solutions with [Cu]=6.7 M , [K]=6.4 M and [Cu]=8.3 M , [K]=7.9 M at 75°C until the organic products and acetylene were removed. Gradual cooling of the solutions gave crystals (A) and (B), respectively. Crystals suitable for crystallography were obtained by cutting a large needle-like crystal (approximately 5mm length or longer) to a suitable size for measurement (<1mm). Crystals were mounted in glass capillary tubes under argon. The unit cell parameters were obtained by a least-squares refinement of the 2θ values of 20 reflections with 20°≤2θ≤22°. Intensities were measured on a Rigaku AFC-5R automated four-cycle diffractometer using graphite monochromated Mo Kα radiation (λ=0.71069 A ̊ ) and the ω−2θ method. An empirical absorption correction (ψ scan method) was applied to the collected data. Calculations were carried out using the program package teXsan on a VAX-II computer. Atomic scattering factors were taken from literature [17]. A full-matrix least-squares refinement was used for non-hydrogen atoms with anisotropic thermal parameters. X-ray data: orthorhombic, Pna21 (No. 33), a=11.994(8) A ̊ , b=12.590(7) A ̊ , c=4.146(3) A ̊ , V=626.1(6) A ̊ 3 , Z=4, D calc =2.632 gcm −3 , F(000)=472, μ(MoK)=5.951 mm −1 for monochromated Mo Kα radiation (λ=0.71069 A ̊ ). R(R w)=0.052 (0.086) for 1316 reflections with I>3σ(I) among 1646 unique reflections (R int=0.042). 4.4 Determination of the solubility of Cu salts A hot aqueous solution of K n CuCl n+1 was gradually cooled with gentle stirring. Plots of temperature show a single wrinkle due to a temperature rise caused by the onset of crystallization of the Cu salt. The temperature is similar to the temperature at which one can observe the onset of crystal growth, but it is more accurately determined than that. The temperature and concentration of the initially charged CuCl and the initial ratio of CuCl and KCl are plotted in Fig. 4. References [1] J.A. Nieuwland J. Am. Chem. Soc. 53 1931 4197 [2] W.H. Carothers, J. Am. Chem. Soc. 53 (1931) 4203. [3] A.L. Klebanski Rub. Chem. Tech. 9 1936 383 [4] R. Vestin C. Löfman Acta Chemi. Scand. 7 1953 398 [5] J.A. Nieuwland, R.R. Vogt, The chemistry of acetylene, Am. Chem. Soc. Monograph No. 99, Reinhold, New York, 1945. [6] W.H. Carothers J. Am. Chem. Soc. 54 1932 4066 [7] B.M. Mykahlichko, M.G. Mys’kiv, P. Yu Zavalii, M.D. Mazus, S.I. Osechkin, Koord. Khim. 17 (1991) 827; Chem. Abstr. 116 (1992) 31886m. [8] M.G. Mys’kiv, B.M. Mykhalitchko, Zh. Strukt. Khim. 35 (1994) 120; Chem. Abstr. 122 (1995) 265535x. [9] R. Vestin Acta Chemi. Scandi. 8 1954 533 [10] C. Brink C.H. MacGillavry Acta Crystallogr. 2 1949 158 [11] J.A. Baglio P.A. Vaughan J. Inorg. Nucl. Chem. 32 1970 803 [12] C. Brink N.F. Binnendijk J. van de Linde Acta Crystallogr. 7 1954 176 [13] Gmelins Handbuch der Anorganischen Chemie, Gmelin Institut, System 60, Teil B, Lieferung, Verlag Chemie, Weinheim, 1958, p. 317. [14] Gmelins Handbuch der Anorganischen Chemie, Gmelin Institut, System 60, Teil B, Lieferung 3, Verlag Chemie, Weinheim, 1965, p. 1092, 1411. [15] D.D. Axtell B.W. Good W.W. Porterfield J.T. Yoke J. Am. Chem. Soc. 95 1973 S4555 [16] R. von Nast W. Pfab Z. Anorg. Allg. Chem. 292 1957 287 [17] International Tables for X-ray Crystallography, Vol. IV, Kynoch, Birmingham, 1974.",
      "scopus-id": "0035940628",
      "coredata": {
        "eid": "1-s2.0-S1381116901002321",
        "dc:description": "Catalysis by Cu salts (M n CuCl n+1;M=K+,NH4 +) in concentrated aqueous solutions (approximately 5–8M) is investigated using a flow reaction system at 75°C. Selective dimerization of acetylene gives vinylacetylene as a major product and much smaller amounts of 1,2-divinylacetylene, acetaldehyde, 1-ethynyl-1,3-butadiene, and uncharacterized black tarry products. Cooling the catalyst solution to room temperature causes the growth of a mixture of tetrahedral and needle-like colorless crystals. Observation of the crystals by microscopy and their crystallography, and analyses of the Cu compounds reveal that they are CuCl and K2CuCl3, respectively. Plots of the graphs of the solubility of the Cu salts in water as a function of temperature and composition of the salt show the dominant presence of KCuCl2 in the solution. A mechanism of the reaction is proposed based on the performance of the catalyst and its structure.",
        "openArchiveArticle": "false",
        "prism:coverDate": "2001-10-23",
        "openaccessUserLicense": null,
        "prism:aggregationType": "Journal",
        "prism:url": "https://api.elsevier.com/content/article/pii/S1381116901002321",
        "dc:creator": [
          {
            "@_fa": "true",
            "$": "Nishiwaki, Ken-ichiro"
          },
          {
            "@_fa": "true",
            "$": "Kobayashi, Mineto"
          },
          {
            "@_fa": "true",
            "$": "Takeuchi, Takao"
          },
          {
            "@_fa": "true",
            "$": "Matuoto, Kazumasa"
          },
          {
            "@_fa": "true",
            "$": "Osakada, Kohtaro"
          }
        ],
        "link": [
          {
            "@_fa": "true",
            "@rel": "self",
            "@href": "https://api.elsevier.com/content/article/pii/S1381116901002321"
          },
          {
            "@_fa": "true",
            "@rel": "scidir",
            "@href": "https://www.sciencedirect.com/science/article/pii/S1381116901002321"
          }
        ],
        "dc:format": "application/json",
        "openaccessType": null,
        "pii": "S1381-1169(01)00232-1",
        "prism:volume": "175",
        "prism:publisher": "Elsevier Science B.V.",
        "dc:title": "Nieuwland catalysts: investigation of structure in the solid state and in solution and performance in the dimerization of acetylene",
        "prism:copyright": "Copyright © 2001 Elsevier Science B.V. All rights reserved.",
        "openaccess": "0",
        "prism:issn": "13811169",
        "prism:issueIdentifier": "1-2",
        "dcterms:subject": [
          {
            "@_fa": "true",
            "$": "Catalysis"
          },
          {
            "@_fa": "true",
            "$": "Copper"
          },
          {
            "@_fa": "true",
            "$": "Acetylene"
          },
          {
            "@_fa": "true",
            "$": "Dimerization"
          }
        ],
        "openaccessArticle": "false",
        "prism:publicationName": "Journal of Molecular Catalysis A: Chemical",
        "prism:number": "1-2",
        "openaccessSponsorType": null,
        "prism:pageRange": "73-81",
        "prism:endingPage": "81",
        "pubType": "fla",
        "prism:coverDisplayDate": "23 October 2001",
        "prism:doi": "10.1016/S1381-1169(01)00232-1",
        "prism:startingPage": "73",
        "dc:identifier": "doi:10.1016/S1381-1169(01)00232-1",
        "openaccessSponsorName": null
      },
      "objects": {
        "object": [
          {
            "@category": "thumbnail",
            "@height": "18",
            "@width": "89",
            "@_fa": "true",
            "$": "https://api.elsevier.com/content/object/eid/1-s2.0-S1381116901002321-si9.gif?httpAccept=%2A%2F%2A",
            "@multimediatype": "GIF image file",
            "@type": "ALTIMG",
            "@size": "475",
            "@ref": "si9",
            "@mimetype": "image/gif"
          },
          {
            "@category": "thumbnail",
            "@height": "18",
            "@width": "98",
            "@_fa": "true",
            "$": "https://api.elsevier.com/content/object/eid/1-s2.0-S1381116901002321-si8.gif?httpAccept=%2A%2F%2A",
            "@multimediatype": "GIF image file",
            "@type": "ALTIMG",
            "@size": "538",
            "@ref": "si8",
            "@mimetype": "image/gif"
          },
          {
            "@category": "thumbnail",
            "@height": "18",
            "@width": "105",
            "@_fa": "true",
            "$": "https://api.elsevier.com/content/object/eid/1-s2.0-S1381116901002321-si7.gif?httpAccept=%2A%2F%2A",
            "@multimediatype": "GIF image file",
            "@type": "ALTIMG",
            "@size": "551",
            "@ref": "si7",
            "@mimetype": "image/gif"
          },
          {
            "@category": "thumbnail",
            "@height": "17",
            "@width": "388",
            "@_fa": "true",
            "$": "https://api.elsevier.com/content/object/eid/1-s2.0-S1381116901002321-si6.gif?httpAccept=%2A%2F%2A",
            "@multimediatype": "GIF image file",
            "@type": "ALTIMG",
            "@size": "1427",
            "@ref": "si6",
            "@mimetype": "image/gif"
          },
          {
            "@category": "thumbnail",
            "@height": "18",
            "@width": "89",
            "@_fa": "true",
            "$": "https://api.elsevier.com/content/object/eid/1-s2.0-S1381116901002321-si5.gif?httpAccept=%2A%2F%2A",
            "@multimediatype": "GIF image file",
            "@type": "ALTIMG",
            "@size": "470",
            "@ref": "si5",
            "@mimetype": "image/gif"
          },
          {
            "@category": "thumbnail",
            "@height": "41",
            "@width": "852",
            "@_fa": "true",
            "$": "https://api.elsevier.com/content/object/eid/1-s2.0-S1381116901002321-si4.gif?httpAccept=%2A%2F%2A",
            "@multimediatype": "GIF image file",
            "@type": "ALTIMG",
            "@size": "4421",
            "@ref": "si4",
            "@mimetype": "image/gif"
          },
          {
            "@category": "thumbnail",
            "@height": "41",
            "@width": "941",
            "@_fa": "true",
            "$": "https://api.elsevier.com/content/object/eid/1-s2.0-S1381116901002321-si3.gif?httpAccept=%2A%2F%2A",
            "@multimediatype": "GIF image file",
            "@type": "ALTIMG",
            "@size": "6387",
            "@ref": "si3",
            "@mimetype": "image/gif"
          },
          {
            "@category": "thumbnail",
            "@height": "19",
            "@width": "113",
            "@_fa": "true",
            "$": "https://api.elsevier.com/content/object/eid/1-s2.0-S1381116901002321-si21.gif?httpAccept=%2A%2F%2A",
            "@multimediatype": "GIF image file",
            "@type": "ALTIMG",
            "@size": "631",
            "@ref": "si21",
            "@mimetype": "image/gif"
          },
          {
            "@category": "thumbnail",
            "@height": "18",
            "@width": "173",
            "@_fa": "true",
            "$": "https://api.elsevier.com/content/object/eid/1-s2.0-S1381116901002321-si20.gif?httpAccept=%2A%2F%2A",
            "@multimediatype": "GIF image file",
            "@type": "ALTIMG",
            "@size": "743",
            "@ref": "si20",
            "@mimetype": "image/gif"
          },
          {
            "@category": "thumbnail",
            "@height": "18",
            "@width": "89",
            "@_fa": "true",
            "$": "https://api.elsevier.com/content/object/eid/1-s2.0-S1381116901002321-si2.gif?httpAccept=%2A%2F%2A",
            "@multimediatype": "GIF image file",
            "@type": "ALTIMG",
            "@size": "475",
            "@ref": "si2",
            "@mimetype": "image/gif"
          },
          {
            "@category": "thumbnail",
            "@height": "17",
            "@width": "103",
            "@_fa": "true",
            "$": "https://api.elsevier.com/content/object/eid/1-s2.0-S1381116901002321-si19.gif?httpAccept=%2A%2F%2A",
            "@multimediatype": "GIF image file",
            "@type": "ALTIMG",
            "@size": "560",
            "@ref": "si19",
            "@mimetype": "image/gif"
          },
          {
            "@category": "thumbnail",
            "@height": "18",
            "@width": "150",
            "@_fa": "true",
            "$": "https://api.elsevier.com/content/object/eid/1-s2.0-S1381116901002321-si18.gif?httpAccept=%2A%2F%2A",
            "@multimediatype": "GIF image file",
            "@type": "ALTIMG",
            "@size": "651",
            "@ref": "si18",
            "@mimetype": "image/gif"
          },
          {
            "@category": "thumbnail",
            "@height": "22",
            "@width": "111",
            "@_fa": "true",
            "$": "https://api.elsevier.com/content/object/eid/1-s2.0-S1381116901002321-si17.gif?httpAccept=%2A%2F%2A",
            "@multimediatype": "GIF image file",
            "@type": "ALTIMG",
            "@size": "613",
            "@ref": "si17",
            "@mimetype": "image/gif"
          },
          {
            "@category": "thumbnail",
            "@height": "19",
            "@width": "103",
            "@_fa": "true",
            "$": "https://api.elsevier.com/content/object/eid/1-s2.0-S1381116901002321-si16.gif?httpAccept=%2A%2F%2A",
            "@multimediatype": "GIF image file",
            "@type": "ALTIMG",
            "@size": "523",
            "@ref": "si16",
            "@mimetype": "image/gif"
          },
          {
            "@category": "thumbnail",
            "@height": "19",
            "@width": "113",
            "@_fa": "true",
            "$": "https://api.elsevier.com/content/object/eid/1-s2.0-S1381116901002321-si15.gif?httpAccept=%2A%2F%2A",
            "@multimediatype": "GIF image file",
            "@type": "ALTIMG",
            "@size": "618",
            "@ref": "si15",
            "@mimetype": "image/gif"
          },
          {
            "@category": "thumbnail",
            "@height": "19",
            "@width": "113",
            "@_fa": "true",
            "$": "https://api.elsevier.com/content/object/eid/1-s2.0-S1381116901002321-si14.gif?httpAccept=%2A%2F%2A",
            "@multimediatype": "GIF image file",
            "@type": "ALTIMG",
            "@size": "582",
            "@ref": "si14",
            "@mimetype": "image/gif"
          },
          {
            "@category": "thumbnail",
            "@height": "19",
            "@width": "113",
            "@_fa": "true",
            "$": "https://api.elsevier.com/content/object/eid/1-s2.0-S1381116901002321-si13.gif?httpAccept=%2A%2F%2A",
            "@multimediatype": "GIF image file",
            "@type": "ALTIMG",
            "@size": "631",
            "@ref": "si13",
            "@mimetype": "image/gif"
          },
          {
            "@category": "thumbnail",
            "@height": "18",
            "@width": "82",
            "@_fa": "true",
            "$": "https://api.elsevier.com/content/object/eid/1-s2.0-S1381116901002321-si12.gif?httpAccept=%2A%2F%2A",
            "@multimediatype": "GIF image file",
            "@type": "ALTIMG",
            "@size": "457",
            "@ref": "si12",
            "@mimetype": "image/gif"
          },
          {
            "@category": "thumbnail",
            "@height": "18",
            "@width": "89",
            "@_fa": "true",
            "$": "https://api.elsevier.com/content/object/eid/1-s2.0-S1381116901002321-si11.gif?httpAccept=%2A%2F%2A",
            "@multimediatype": "GIF image file",
            "@type": "ALTIMG",
            "@size": "490",
            "@ref": "si11",
            "@mimetype": "image/gif"
          },
          {
            "@category": "thumbnail",
            "@height": "18",
            "@width": "82",
            "@_fa": "true",
            "$": "https://api.elsevier.com/content/object/eid/1-s2.0-S1381116901002321-si10.gif?httpAccept=%2A%2F%2A",
            "@multimediatype": "GIF image file",
            "@type": "ALTIMG",
            "@size": "468",
            "@ref": "si10",
            "@mimetype": "image/gif"
          },
          {
            "@category": "thumbnail",
            "@height": "17",
            "@width": "185",
            "@_fa": "true",
            "$": "https://api.elsevier.com/content/object/eid/1-s2.0-S1381116901002321-si1.gif?httpAccept=%2A%2F%2A",
            "@multimediatype": "GIF image file",
            "@type": "ALTIMG",
            "@size": "743",
            "@ref": "si1",
            "@mimetype": "image/gif"
          },
          {
            "@category": "thumbnail",
            "@height": "30",
            "@width": "125",
            "@_fa": "true",
            "$": "https://api.elsevier.com/content/object/eid/1-s2.0-S1381116901002321-fx1.sml?httpAccept=%2A%2F%2A",
            "@multimediatype": "GIF image file",
            "@type": "IMAGE-THUMBNAIL",
            "@size": "561",
            "@ref": "fx1",
            "@mimetype": "image/gif"
          },
          {
            "@category": "standard",
            "@height": "107",
            "@width": "453",
            "@_fa": "true",
            "$": "https://api.elsevier.com/content/object/eid/1-s2.0-S1381116901002321-fx1.gif?httpAccept=%2A%2F%2A",
            "@multimediatype": "GIF image file",
            "@type": "IMAGE-DOWNSAMPLED",
            "@size": "3116",
            "@ref": "fx1",
            "@mimetype": "image/gif"
          },
          {
            "@category": "thumbnail",
            "@height": "93",
            "@width": "115",
            "@_fa": "true",
            "$": "https://api.elsevier.com/content/object/eid/1-s2.0-S1381116901002321-gr1.sml?httpAccept=%2A%2F%2A",
            "@multimediatype": "GIF image file",
            "@type": "IMAGE-THUMBNAIL",
            "@size": "1456",
            "@ref": "gr1",
            "@mimetype": "image/gif"
          },
          {
            "@category": "standard",
            "@height": "275",
            "@width": "339",
            "@_fa": "true",
            "$": "https://api.elsevier.com/content/object/eid/1-s2.0-S1381116901002321-gr1.gif?httpAccept=%2A%2F%2A",
            "@multimediatype": "GIF image file",
            "@type": "IMAGE-DOWNSAMPLED",
            "@size": "6317",
            "@ref": "gr1",
            "@mimetype": "image/gif"
          },
          {
            "@category": "thumbnail",
            "@height": "93",
            "@width": "74",
            "@_fa": "true",
            "$": "https://api.elsevier.com/content/object/eid/1-s2.0-S1381116901002321-gr2.sml?httpAccept=%2A%2F%2A",
            "@multimediatype": "GIF image file",
            "@type": "IMAGE-THUMBNAIL",
            "@size": "2120",
            "@ref": "gr2",
            "@mimetype": "image/gif"
          },
          {
            "@category": "standard",
            "@height": "664",
            "@width": "526",
            "@_fa": "true",
            "$": "https://api.elsevier.com/content/object/eid/1-s2.0-S1381116901002321-gr2.jpg?httpAccept=%2A%2F%2A",
            "@multimediatype": "JPEG image file",
            "@type": "IMAGE-DOWNSAMPLED",
            "@size": "146030",
            "@ref": "gr2",
            "@mimetype": "image/jpeg"
          },
          {
            "@category": "thumbnail",
            "@height": "36",
            "@width": "125",
            "@_fa": "true",
            "$": "https://api.elsevier.com/content/object/eid/1-s2.0-S1381116901002321-sc1.sml?httpAccept=%2A%2F%2A",
            "@multimediatype": "GIF image file",
            "@type": "IMAGE-THUMBNAIL",
            "@size": "1023",
            "@ref": "sc1",
            "@mimetype": "image/gif"
          },
          {
            "@category": "standard",
            "@height": "64",
            "@width": "224",
            "@_fa": "true",
            "$": "https://api.elsevier.com/content/object/eid/1-s2.0-S1381116901002321-sc1.gif?httpAccept=%2A%2F%2A",
            "@multimediatype": "GIF image file",
            "@type": "IMAGE-DOWNSAMPLED",
            "@size": "2071",
            "@ref": "sc1",
            "@mimetype": "image/gif"
          },
          {
            "@category": "thumbnail",
            "@height": "93",
            "@width": "102",
            "@_fa": "true",
            "$": "https://api.elsevier.com/content/object/eid/1-s2.0-S1381116901002321-gr3.sml?httpAccept=%2A%2F%2A",
            "@multimediatype": "GIF image file",
            "@type": "IMAGE-THUMBNAIL",
            "@size": "1400",
            "@ref": "gr3",
            "@mimetype": "image/gif"
          },
          {
            "@category": "standard",
            "@height": "241",
            "@width": "264",
            "@_fa": "true",
            "$": "https://api.elsevier.com/content/object/eid/1-s2.0-S1381116901002321-gr3.gif?httpAccept=%2A%2F%2A",
            "@multimediatype": "GIF image file",
            "@type": "IMAGE-DOWNSAMPLED",
            "@size": "4939",
            "@ref": "gr3",
            "@mimetype": "image/gif"
          },
          {
            "@category": "thumbnail",
            "@height": "93",
            "@width": "65",
            "@_fa": "true",
            "$": "https://api.elsevier.com/content/object/eid/1-s2.0-S1381116901002321-gr4.sml?httpAccept=%2A%2F%2A",
            "@multimediatype": "GIF image file",
            "@type": "IMAGE-THUMBNAIL",
            "@size": "1341",
            "@ref": "gr4",
            "@mimetype": "image/gif"
          },
          {
            "@category": "standard",
            "@height": "498",
            "@width": "347",
            "@_fa": "true",
            "$": "https://api.elsevier.com/content/object/eid/1-s2.0-S1381116901002321-gr4.gif?httpAccept=%2A%2F%2A",
            "@multimediatype": "GIF image file",
            "@type": "IMAGE-DOWNSAMPLED",
            "@size": "13942",
            "@ref": "gr4",
            "@mimetype": "image/gif"
          },
          {
            "@category": "thumbnail",
            "@height": "45",
            "@width": "125",
            "@_fa": "true",
            "$": "https://api.elsevier.com/content/object/eid/1-s2.0-S1381116901002321-sc2.sml?httpAccept=%2A%2F%2A",
            "@multimediatype": "GIF image file",
            "@type": "IMAGE-THUMBNAIL",
            "@size": "974",
            "@ref": "sc2",
            "@mimetype": "image/gif"
          },
          {
            "@category": "standard",
            "@height": "122",
            "@width": "339",
            "@_fa": "true",
            "$": "https://api.elsevier.com/content/object/eid/1-s2.0-S1381116901002321-sc2.gif?httpAccept=%2A%2F%2A",
            "@multimediatype": "GIF image file",
            "@type": "IMAGE-DOWNSAMPLED",
            "@size": "4373",
            "@ref": "sc2",
            "@mimetype": "image/gif"
          },
          {
            "@category": "thumbnail",
            "@height": "94",
            "@width": "110",
            "@_fa": "true",
            "$": "https://api.elsevier.com/content/object/eid/1-s2.0-S1381116901002321-sc3.sml?httpAccept=%2A%2F%2A",
            "@multimediatype": "GIF image file",
            "@type": "IMAGE-THUMBNAIL",
            "@size": "932",
            "@ref": "sc3",
            "@mimetype": "image/gif"
          },
          {
            "@category": "standard",
            "@height": "223",
            "@width": "262",
            "@_fa": "true",
            "$": "https://api.elsevier.com/content/object/eid/1-s2.0-S1381116901002321-sc3.gif?httpAccept=%2A%2F%2A",
            "@multimediatype": "GIF image file",
            "@type": "IMAGE-DOWNSAMPLED",
            "@size": "2849",
            "@ref": "sc3",
            "@mimetype": "image/gif"
          }
        ]
      },
      "link": {
        "@rel": "abstract",
        "@href": "https://api.elsevier.com/content/abstract/scopus_id/0035940628"
      }
    }
  }
}