{
  "metadata": {
    "title": "Phosphotungestovanadate immobilized on PVA as an efficient and reusable nano catalyst for oxidative desulphurization of gasoline",
    "authors": "; ; ",
    "journal": "Journal of Molecular Catalysis A: Chemical",
    "date": "2015-12-15",
    "doi": "10.1016/j.molcata.2015.09.010",
    "abstract": "",
    "uri": "https://api.elsevier.com/content/article/pii/S1381116915300868",
    "pii": "S1381116915300868"
  },
  "fulltext": {
    "full-text-retrieval-response": {
      "scopus-eid": "2-s2.0-84943160113",
      "originalText": "serial JL 271358 291210 291744 291790 291809 31 Journal of Molecular Catalysis A: Chemical JOURNALMOLECULARCATALYSISACHEMICAL 2015-09-16 2015-09-16 2015-09-30 2015-09-30 2015-11-05T10:00:36 1-s2.0-S1381116915300868 S1381-1169(15)30086-8 S1381116915300868 10.1016/j.molcata.2015.09.010 S300 S300.1 FULL-TEXT 1-s2.0-S1381116915X00124 2016-09-03T13:31:27.519153-04:00 0 0 20151215 2015 2015-09-16T05:35:45.198325Z absattachment articleinfo articletitlenorm authfirstinitialnorm authfirstsurnamenorm cid cids contenttype copyright crossmark dateloaded dateloadedtxt datesearch datesort dateupdated dco docsubtype doctype doi eid ewtransactionid hubeid indexeddate issn issnnorm itemstage itemtransactionid itemweight openaccess openarchive pg pgfirst pglast pii piinorm pubdatestart pubdatetxt pubyr sectiontitle sortorder srctitle srctitlenorm srctype ssids alllist content subj subheadings suppl tomb volfirst volissue volumelist webpdf webpdfpagecount yearnav figure table body mmlmath affil articletitle auth authfirstini authfull authkeywords authlast highlightsabst primabst ref specialabst 1381-1169 13811169 true 410 410 C Volume 410 17 121 132 121 132 20151215 15 December 2015 2015-12-15 2015 Regular Papers article fla Copyright © 2015 Elsevier B.V. All rights reserved. PHOSPHOTUNGESTOVANADATEIMMOBILIZEDPVAEFFICIENTREUSABLENANOCATALYSTFOROXIDATIVEDESULPHURIZATIONGASOLINE REZVANI M 1 Introduction 2 Experimental 2.1 Materials 2.2 Preparation of catalysts 2.2.1 Synthesis of tetrabutylammonium divanadodecatungstophosphate ((n-C4H9)4N)4H[PW10V2O40] 2.2.2 Preparation of nanocatalyst by immobilization of PWV on PVA 2.3 Catalytic test 2.3.1 Oxidative desulphurization of model compound (simulated gasoline) 2.3.2 Oxidative desulphurization (ODS) of gasoline 2.4 Characterization methods 3 Results and discussion 3.1 Characterization of synthesized catalysts 3.2 Desulphurization process 3.3 Effect of the catalyst structure 3.4 Effect of catalyst dosage 3.5 Influence of quaternary ammonium on catalytic activity 3.6 Effect of temperature on the oxidative desulphurization of gasoline or simulated gasoline 3.7 Effect of different oxidative system on the oxidative desulphurization 3.8 General desulphurization process 3.9 Kinetics of BT oxidation 3.10 Recycling of the catalyst 4 Conclusion References HISKIA 2001 62 A POPE 2001 M POLYOXOMETALATECHEMISTRYTOPOLOGYVIASELFASSEMBLYAPPLICATIONS GOUZERH 2006 9 P LONG 2010 1736 D YAMASE 2002 T NANOSTRUCTURESCIENCETECHNOLOGY KOZHEVNIKOV 1998 171 I SYMES 2013 403 M LONG 2004 13880 D MIRAS 2008 8420 H ITO 2012 362 T RHULE 1998 327 J KOZHEVNIKOV 2002 I CATALYSISBYPOLYOXOMETALATES MOFFAT 2001 J METALOXYGENCLUSTERSSURFACECATALYTICPROPERTIESHETEROPOLYOXOMETALATES IZUMI 1993 C ZEOLITEKODANSHA MOFFAT 2001 25 J METALOXYGENCLUSTERTHESURFACECATALYTICPROPERTIESHETEROPOLYOXOMETALATES MA 2012 116 F CUI 2013 6687 Z BI 2011 242 B BU 2004 192 X ROWSELL 2006 1304 J BALZANI 2000 3348 V BALZANI 2009 1542 V LIANG 2004 5776 K LUO 2014 20 G SHOJAEI 2014 1 A REZVANI 2015 83 M REZVANI 2012 36 M SHOJAEI 2013 129 A ZONGXUAN 2011 707 J TRAKARNPRUK 2009 411 W IMTIAZ 2013 1839 A NOMIYA 2000 55 K KARANDIKAR 2004 69 P CHUNXIA 2014 93 T GUIRGUIS 2012 57 O XINBO 2014 210 D DUNAN 1995 681 D HASAN 2012 216 Z REZVANIX2015X121 REZVANIX2015X121X132 REZVANIX2015X121XM REZVANIX2015X121X132XM UnderEmbargo 2017-09-30T00:00:00Z http://creativecommons.org/licenses/by-nc-nd/4.0/ item S1381-1169(15)30086-8 S1381116915300868 1-s2.0-S1381116915300868 10.1016/j.molcata.2015.09.010 271358 2015-11-05T13:41:00.475047-05:00 2015-12-15 1-s2.0-S1381116915300868-main.pdf https://s3-eu-west-1.amazonaws.com/prod-ucs-content-store-eu-west/content/pii:S1381116915300868/MAIN/application/pdf/c481d740aef914858f8fb17cdb6e7aeb/main.pdf https://s3.amazonaws.com/prod-ucs-content-store-us-east/content/pii:S1381116915300868/MAIN/application/pdf/c481d740aef914858f8fb17cdb6e7aeb/main.pdf main.pdf pdf true 3333394 MAIN 12 1-s2.0-S1381116915300868-main_1.png https://s3-eu-west-1.amazonaws.com/prod-ucs-content-store-eu-west/content/pii:S1381116915300868/PREVIEW/image/png/f1fc092f4674c097a4ef29e957d39ce8/main_1.png https://s3.amazonaws.com/prod-ucs-content-store-us-east/content/pii:S1381116915300868/PREVIEW/image/png/f1fc092f4674c097a4ef29e957d39ce8/main_1.png main_1.png png 61267 849 656 IMAGE-WEB-PDF 1 1-s2.0-S1381116915300868-fx1.sml https://s3-eu-west-1.amazonaws.com/prod-ucs-content-store-eu-west/content/pii:S1381116915300868/fx1/THUMBNAIL/image/gif/4d18510bcd12e1cba35aa211958db9f3/fx1.sml https://s3.amazonaws.com/prod-ucs-content-store-us-east/content/pii:S1381116915300868/fx1/THUMBNAIL/image/gif/4d18510bcd12e1cba35aa211958db9f3/fx1.sml fx1 true fx1.sml sml 9428 88 219 IMAGE-THUMBNAIL 1-s2.0-S1381116915300868-gr1.sml https://s3-eu-west-1.amazonaws.com/prod-ucs-content-store-eu-west/content/pii:S1381116915300868/gr1/THUMBNAIL/image/gif/133cb1e5bc869640d0154616f43c6170/gr1.sml https://s3.amazonaws.com/prod-ucs-content-store-us-east/content/pii:S1381116915300868/gr1/THUMBNAIL/image/gif/133cb1e5bc869640d0154616f43c6170/gr1.sml gr1 gr1.sml sml 15212 142 219 IMAGE-THUMBNAIL 1-s2.0-S1381116915300868-gr10.sml https://s3-eu-west-1.amazonaws.com/prod-ucs-content-store-eu-west/content/pii:S1381116915300868/gr10/THUMBNAIL/image/gif/611302ec7fac78d895d604b80600944c/gr10.sml https://s3.amazonaws.com/prod-ucs-content-store-us-east/content/pii:S1381116915300868/gr10/THUMBNAIL/image/gif/611302ec7fac78d895d604b80600944c/gr10.sml gr10 gr10.sml sml 12580 155 219 IMAGE-THUMBNAIL 1-s2.0-S1381116915300868-gr11.sml https://s3-eu-west-1.amazonaws.com/prod-ucs-content-store-eu-west/content/pii:S1381116915300868/gr11/THUMBNAIL/image/gif/636e966841ac3fc1308a4ae91446e12d/gr11.sml https://s3.amazonaws.com/prod-ucs-content-store-us-east/content/pii:S1381116915300868/gr11/THUMBNAIL/image/gif/636e966841ac3fc1308a4ae91446e12d/gr11.sml gr11 gr11.sml sml 7490 152 219 IMAGE-THUMBNAIL 1-s2.0-S1381116915300868-gr12.sml https://s3-eu-west-1.amazonaws.com/prod-ucs-content-store-eu-west/content/pii:S1381116915300868/gr12/THUMBNAIL/image/gif/fc7fbbcd488c34807b7187ee5fe51a86/gr12.sml https://s3.amazonaws.com/prod-ucs-content-store-us-east/content/pii:S1381116915300868/gr12/THUMBNAIL/image/gif/fc7fbbcd488c34807b7187ee5fe51a86/gr12.sml gr12 gr12.sml sml 15602 126 219 IMAGE-THUMBNAIL 1-s2.0-S1381116915300868-gr13.sml https://s3-eu-west-1.amazonaws.com/prod-ucs-content-store-eu-west/content/pii:S1381116915300868/gr13/THUMBNAIL/image/gif/00c707486e920c5dd795c90193b21a21/gr13.sml https://s3.amazonaws.com/prod-ucs-content-store-us-east/content/pii:S1381116915300868/gr13/THUMBNAIL/image/gif/00c707486e920c5dd795c90193b21a21/gr13.sml gr13 gr13.sml sml 15894 125 219 IMAGE-THUMBNAIL 1-s2.0-S1381116915300868-gr2.sml https://s3-eu-west-1.amazonaws.com/prod-ucs-content-store-eu-west/content/pii:S1381116915300868/gr2/THUMBNAIL/image/gif/6871aed36f5d7db4ca3485fa19a3d0fd/gr2.sml https://s3.amazonaws.com/prod-ucs-content-store-us-east/content/pii:S1381116915300868/gr2/THUMBNAIL/image/gif/6871aed36f5d7db4ca3485fa19a3d0fd/gr2.sml gr2 gr2.sml sml 13639 123 219 IMAGE-THUMBNAIL 1-s2.0-S1381116915300868-gr3.sml https://s3-eu-west-1.amazonaws.com/prod-ucs-content-store-eu-west/content/pii:S1381116915300868/gr3/THUMBNAIL/image/gif/83a7616e61ea98c95a8f57268b8b7179/gr3.sml https://s3.amazonaws.com/prod-ucs-content-store-us-east/content/pii:S1381116915300868/gr3/THUMBNAIL/image/gif/83a7616e61ea98c95a8f57268b8b7179/gr3.sml gr3 gr3.sml sml 33148 164 193 IMAGE-THUMBNAIL 1-s2.0-S1381116915300868-gr4.sml https://s3-eu-west-1.amazonaws.com/prod-ucs-content-store-eu-west/content/pii:S1381116915300868/gr4/THUMBNAIL/image/gif/6742348f58ba7fc8bf1120848c0dddab/gr4.sml https://s3.amazonaws.com/prod-ucs-content-store-us-east/content/pii:S1381116915300868/gr4/THUMBNAIL/image/gif/6742348f58ba7fc8bf1120848c0dddab/gr4.sml gr4 gr4.sml sml 14281 164 147 IMAGE-THUMBNAIL 1-s2.0-S1381116915300868-gr5.sml https://s3-eu-west-1.amazonaws.com/prod-ucs-content-store-eu-west/content/pii:S1381116915300868/gr5/THUMBNAIL/image/gif/aaf4c15cb9784d52ea56c71bb482b4a2/gr5.sml https://s3.amazonaws.com/prod-ucs-content-store-us-east/content/pii:S1381116915300868/gr5/THUMBNAIL/image/gif/aaf4c15cb9784d52ea56c71bb482b4a2/gr5.sml gr5 gr5.sml sml 15774 164 174 IMAGE-THUMBNAIL 1-s2.0-S1381116915300868-gr6.sml https://s3-eu-west-1.amazonaws.com/prod-ucs-content-store-eu-west/content/pii:S1381116915300868/gr6/THUMBNAIL/image/gif/26d8b156f7c1bb76540b2e016b32b7e7/gr6.sml https://s3.amazonaws.com/prod-ucs-content-store-us-east/content/pii:S1381116915300868/gr6/THUMBNAIL/image/gif/26d8b156f7c1bb76540b2e016b32b7e7/gr6.sml gr6 gr6.sml sml 16284 159 219 IMAGE-THUMBNAIL 1-s2.0-S1381116915300868-gr7.sml https://s3-eu-west-1.amazonaws.com/prod-ucs-content-store-eu-west/content/pii:S1381116915300868/gr7/THUMBNAIL/image/gif/f8d54e3940c68403b17ffe067a25a57c/gr7.sml https://s3.amazonaws.com/prod-ucs-content-store-us-east/content/pii:S1381116915300868/gr7/THUMBNAIL/image/gif/f8d54e3940c68403b17ffe067a25a57c/gr7.sml gr7 gr7.sml sml 15754 164 213 IMAGE-THUMBNAIL 1-s2.0-S1381116915300868-gr8.sml https://s3-eu-west-1.amazonaws.com/prod-ucs-content-store-eu-west/content/pii:S1381116915300868/gr8/THUMBNAIL/image/gif/c84bb92d1fe68ef54a0e42107d118726/gr8.sml https://s3.amazonaws.com/prod-ucs-content-store-us-east/content/pii:S1381116915300868/gr8/THUMBNAIL/image/gif/c84bb92d1fe68ef54a0e42107d118726/gr8.sml gr8 gr8.sml sml 13869 154 219 IMAGE-THUMBNAIL 1-s2.0-S1381116915300868-gr9.sml https://s3-eu-west-1.amazonaws.com/prod-ucs-content-store-eu-west/content/pii:S1381116915300868/gr9/THUMBNAIL/image/gif/836aef8d8c03e2801efd10513ba33001/gr9.sml https://s3.amazonaws.com/prod-ucs-content-store-us-east/content/pii:S1381116915300868/gr9/THUMBNAIL/image/gif/836aef8d8c03e2801efd10513ba33001/gr9.sml gr9 gr9.sml sml 17758 160 219 IMAGE-THUMBNAIL 1-s2.0-S1381116915300868-sc1.sml https://s3-eu-west-1.amazonaws.com/prod-ucs-content-store-eu-west/content/pii:S1381116915300868/sc1/THUMBNAIL/image/gif/1f33b170e1017eba1b765cdcdfff1456/sc1.sml https://s3.amazonaws.com/prod-ucs-content-store-us-east/content/pii:S1381116915300868/sc1/THUMBNAIL/image/gif/1f33b170e1017eba1b765cdcdfff1456/sc1.sml sc1 sc1.sml sml 11934 164 116 IMAGE-THUMBNAIL 1-s2.0-S1381116915300868-fx1.jpg https://s3-eu-west-1.amazonaws.com/prod-ucs-content-store-eu-west/content/pii:S1381116915300868/fx1/DOWNSAMPLED/image/jpeg/306c2f93f085883bac254419b4c62987/fx1.jpg https://s3.amazonaws.com/prod-ucs-content-store-us-east/content/pii:S1381116915300868/fx1/DOWNSAMPLED/image/jpeg/306c2f93f085883bac254419b4c62987/fx1.jpg fx1 true fx1.jpg jpg 27559 200 500 IMAGE-DOWNSAMPLED 1-s2.0-S1381116915300868-gr1.jpg https://s3-eu-west-1.amazonaws.com/prod-ucs-content-store-eu-west/content/pii:S1381116915300868/gr1/DOWNSAMPLED/image/jpeg/bf68d2564f52473926d25cd5cac185a0/gr1.jpg https://s3.amazonaws.com/prod-ucs-content-store-us-east/content/pii:S1381116915300868/gr1/DOWNSAMPLED/image/jpeg/bf68d2564f52473926d25cd5cac185a0/gr1.jpg gr1 gr1.jpg jpg 58066 365 565 IMAGE-DOWNSAMPLED 1-s2.0-S1381116915300868-gr10.jpg https://s3-eu-west-1.amazonaws.com/prod-ucs-content-store-eu-west/content/pii:S1381116915300868/gr10/DOWNSAMPLED/image/jpeg/52f9f5ca49073f5f93458563e85d5e60/gr10.jpg https://s3.amazonaws.com/prod-ucs-content-store-us-east/content/pii:S1381116915300868/gr10/DOWNSAMPLED/image/jpeg/52f9f5ca49073f5f93458563e85d5e60/gr10.jpg gr10 gr10.jpg jpg 52115 399 565 IMAGE-DOWNSAMPLED 1-s2.0-S1381116915300868-gr11.jpg https://s3-eu-west-1.amazonaws.com/prod-ucs-content-store-eu-west/content/pii:S1381116915300868/gr11/DOWNSAMPLED/image/jpeg/60fee9495104c3158c91c7919cb31fff/gr11.jpg https://s3.amazonaws.com/prod-ucs-content-store-us-east/content/pii:S1381116915300868/gr11/DOWNSAMPLED/image/jpeg/60fee9495104c3158c91c7919cb31fff/gr11.jpg gr11 gr11.jpg jpg 28038 393 565 IMAGE-DOWNSAMPLED 1-s2.0-S1381116915300868-gr12.jpg https://s3-eu-west-1.amazonaws.com/prod-ucs-content-store-eu-west/content/pii:S1381116915300868/gr12/DOWNSAMPLED/image/jpeg/783ec1945e4a873b1410f59aa6dbb5ea/gr12.jpg https://s3.amazonaws.com/prod-ucs-content-store-us-east/content/pii:S1381116915300868/gr12/DOWNSAMPLED/image/jpeg/783ec1945e4a873b1410f59aa6dbb5ea/gr12.jpg gr12 gr12.jpg jpg 74091 390 677 IMAGE-DOWNSAMPLED 1-s2.0-S1381116915300868-gr13.jpg https://s3-eu-west-1.amazonaws.com/prod-ucs-content-store-eu-west/content/pii:S1381116915300868/gr13/DOWNSAMPLED/image/jpeg/b9e799b0d3eba54dc2e87ea0312a67ca/gr13.jpg https://s3.amazonaws.com/prod-ucs-content-store-us-east/content/pii:S1381116915300868/gr13/DOWNSAMPLED/image/jpeg/b9e799b0d3eba54dc2e87ea0312a67ca/gr13.jpg gr13 gr13.jpg jpg 74734 387 678 IMAGE-DOWNSAMPLED 1-s2.0-S1381116915300868-gr2.jpg https://s3-eu-west-1.amazonaws.com/prod-ucs-content-store-eu-west/content/pii:S1381116915300868/gr2/DOWNSAMPLED/image/jpeg/88c476f79b956ceb62b5dec862269de1/gr2.jpg https://s3.amazonaws.com/prod-ucs-content-store-us-east/content/pii:S1381116915300868/gr2/DOWNSAMPLED/image/jpeg/88c476f79b956ceb62b5dec862269de1/gr2.jpg gr2 gr2.jpg jpg 49779 316 564 IMAGE-DOWNSAMPLED 1-s2.0-S1381116915300868-gr3.jpg https://s3-eu-west-1.amazonaws.com/prod-ucs-content-store-eu-west/content/pii:S1381116915300868/gr3/DOWNSAMPLED/image/jpeg/0b8d5211eb16a3437bb265a773f80abb/gr3.jpg https://s3.amazonaws.com/prod-ucs-content-store-us-east/content/pii:S1381116915300868/gr3/DOWNSAMPLED/image/jpeg/0b8d5211eb16a3437bb265a773f80abb/gr3.jpg gr3 gr3.jpg jpg 115841 480 565 IMAGE-DOWNSAMPLED 1-s2.0-S1381116915300868-gr4.jpg https://s3-eu-west-1.amazonaws.com/prod-ucs-content-store-eu-west/content/pii:S1381116915300868/gr4/DOWNSAMPLED/image/jpeg/f7a65aca6c797ead50f61d6051598242/gr4.jpg https://s3.amazonaws.com/prod-ucs-content-store-us-east/content/pii:S1381116915300868/gr4/DOWNSAMPLED/image/jpeg/f7a65aca6c797ead50f61d6051598242/gr4.jpg gr4 gr4.jpg jpg 73752 630 564 IMAGE-DOWNSAMPLED 1-s2.0-S1381116915300868-gr5.jpg https://s3-eu-west-1.amazonaws.com/prod-ucs-content-store-eu-west/content/pii:S1381116915300868/gr5/DOWNSAMPLED/image/jpeg/d2f5af27d11e0871fc128b0a4e8f1e57/gr5.jpg https://s3.amazonaws.com/prod-ucs-content-store-us-east/content/pii:S1381116915300868/gr5/DOWNSAMPLED/image/jpeg/d2f5af27d11e0871fc128b0a4e8f1e57/gr5.jpg gr5 gr5.jpg jpg 42291 363 386 IMAGE-DOWNSAMPLED 1-s2.0-S1381116915300868-gr6.jpg https://s3-eu-west-1.amazonaws.com/prod-ucs-content-store-eu-west/content/pii:S1381116915300868/gr6/DOWNSAMPLED/image/jpeg/30cde74391bc59b15ef5c653b5bb4edd/gr6.jpg https://s3.amazonaws.com/prod-ucs-content-store-us-east/content/pii:S1381116915300868/gr6/DOWNSAMPLED/image/jpeg/30cde74391bc59b15ef5c653b5bb4edd/gr6.jpg gr6 gr6.jpg jpg 67955 411 565 IMAGE-DOWNSAMPLED 1-s2.0-S1381116915300868-gr7.jpg https://s3-eu-west-1.amazonaws.com/prod-ucs-content-store-eu-west/content/pii:S1381116915300868/gr7/DOWNSAMPLED/image/jpeg/20a8f85eb3afa57099ba92181b273918/gr7.jpg https://s3.amazonaws.com/prod-ucs-content-store-us-east/content/pii:S1381116915300868/gr7/DOWNSAMPLED/image/jpeg/20a8f85eb3afa57099ba92181b273918/gr7.jpg gr7 gr7.jpg jpg 69725 434 565 IMAGE-DOWNSAMPLED 1-s2.0-S1381116915300868-gr8.jpg https://s3-eu-west-1.amazonaws.com/prod-ucs-content-store-eu-west/content/pii:S1381116915300868/gr8/DOWNSAMPLED/image/jpeg/71c4d45d79bf5cc68e246f367bb21815/gr8.jpg https://s3.amazonaws.com/prod-ucs-content-store-us-east/content/pii:S1381116915300868/gr8/DOWNSAMPLED/image/jpeg/71c4d45d79bf5cc68e246f367bb21815/gr8.jpg gr8 gr8.jpg jpg 58401 398 566 IMAGE-DOWNSAMPLED 1-s2.0-S1381116915300868-gr9.jpg https://s3-eu-west-1.amazonaws.com/prod-ucs-content-store-eu-west/content/pii:S1381116915300868/gr9/DOWNSAMPLED/image/jpeg/d8890ecac266799deb04f0609c77117d/gr9.jpg https://s3.amazonaws.com/prod-ucs-content-store-us-east/content/pii:S1381116915300868/gr9/DOWNSAMPLED/image/jpeg/d8890ecac266799deb04f0609c77117d/gr9.jpg gr9 gr9.jpg jpg 83956 495 678 IMAGE-DOWNSAMPLED 1-s2.0-S1381116915300868-sc1.jpg https://s3-eu-west-1.amazonaws.com/prod-ucs-content-store-eu-west/content/pii:S1381116915300868/sc1/DOWNSAMPLED/image/jpeg/282a3ff00aa30e9f3ee44cdf477408df/sc1.jpg https://s3.amazonaws.com/prod-ucs-content-store-us-east/content/pii:S1381116915300868/sc1/DOWNSAMPLED/image/jpeg/282a3ff00aa30e9f3ee44cdf477408df/sc1.jpg sc1 sc1.jpg jpg 58654 530 376 IMAGE-DOWNSAMPLED 1-s2.0-S1381116915300868-fx1_lrg.jpg https://s3-eu-west-1.amazonaws.com/prod-ucs-content-store-eu-west/content/pii:S1381116915300868/fx1/HIGHRES/image/jpeg/138833c145dbebe6842b5b917b2d1a29/fx1_lrg.jpg https://s3.amazonaws.com/prod-ucs-content-store-us-east/content/pii:S1381116915300868/fx1/HIGHRES/image/jpeg/138833c145dbebe6842b5b917b2d1a29/fx1_lrg.jpg fx1 true fx1_lrg.jpg jpg 223519 886 2213 IMAGE-HIGH-RES 1-s2.0-S1381116915300868-gr1_lrg.jpg https://s3-eu-west-1.amazonaws.com/prod-ucs-content-store-eu-west/content/pii:S1381116915300868/gr1/HIGHRES/image/jpeg/6109395e14098941e80a32f53c7770f5/gr1_lrg.jpg https://s3.amazonaws.com/prod-ucs-content-store-us-east/content/pii:S1381116915300868/gr1/HIGHRES/image/jpeg/6109395e14098941e80a32f53c7770f5/gr1_lrg.jpg gr1 gr1_lrg.jpg jpg 401865 1616 2500 IMAGE-HIGH-RES 1-s2.0-S1381116915300868-gr10_lrg.jpg https://s3-eu-west-1.amazonaws.com/prod-ucs-content-store-eu-west/content/pii:S1381116915300868/gr10/HIGHRES/image/jpeg/ba61cc68dbf5ba165b7beea1fe70eb7a/gr10_lrg.jpg https://s3.amazonaws.com/prod-ucs-content-store-us-east/content/pii:S1381116915300868/gr10/HIGHRES/image/jpeg/ba61cc68dbf5ba165b7beea1fe70eb7a/gr10_lrg.jpg gr10 gr10_lrg.jpg jpg 279602 1766 2500 IMAGE-HIGH-RES 1-s2.0-S1381116915300868-gr11_lrg.jpg https://s3-eu-west-1.amazonaws.com/prod-ucs-content-store-eu-west/content/pii:S1381116915300868/gr11/HIGHRES/image/jpeg/1a74b67567c52f8f0c337fe851992eff/gr11_lrg.jpg https://s3.amazonaws.com/prod-ucs-content-store-us-east/content/pii:S1381116915300868/gr11/HIGHRES/image/jpeg/1a74b67567c52f8f0c337fe851992eff/gr11_lrg.jpg gr11 gr11_lrg.jpg jpg 156717 1739 2500 IMAGE-HIGH-RES 1-s2.0-S1381116915300868-gr12_lrg.jpg https://s3-eu-west-1.amazonaws.com/prod-ucs-content-store-eu-west/content/pii:S1381116915300868/gr12/HIGHRES/image/jpeg/2757f6580acf2d31eb8c5e4976008948/gr12_lrg.jpg https://s3.amazonaws.com/prod-ucs-content-store-us-east/content/pii:S1381116915300868/gr12/HIGHRES/image/jpeg/2757f6580acf2d31eb8c5e4976008948/gr12_lrg.jpg gr12 gr12_lrg.jpg jpg 510487 1726 2998 IMAGE-HIGH-RES 1-s2.0-S1381116915300868-gr13_lrg.jpg https://s3-eu-west-1.amazonaws.com/prod-ucs-content-store-eu-west/content/pii:S1381116915300868/gr13/HIGHRES/image/jpeg/f8d92212045bd30be9faff2a32624a14/gr13_lrg.jpg https://s3.amazonaws.com/prod-ucs-content-store-us-east/content/pii:S1381116915300868/gr13/HIGHRES/image/jpeg/f8d92212045bd30be9faff2a32624a14/gr13_lrg.jpg gr13 gr13_lrg.jpg jpg 529961 1711 3000 IMAGE-HIGH-RES 1-s2.0-S1381116915300868-gr2_lrg.jpg https://s3-eu-west-1.amazonaws.com/prod-ucs-content-store-eu-west/content/pii:S1381116915300868/gr2/HIGHRES/image/jpeg/3d6805a7e92aae3b9bb73c219231d528/gr2_lrg.jpg https://s3.amazonaws.com/prod-ucs-content-store-us-east/content/pii:S1381116915300868/gr2/HIGHRES/image/jpeg/3d6805a7e92aae3b9bb73c219231d528/gr2_lrg.jpg gr2 gr2_lrg.jpg jpg 332759 1402 2499 IMAGE-HIGH-RES 1-s2.0-S1381116915300868-gr3_lrg.jpg https://s3-eu-west-1.amazonaws.com/prod-ucs-content-store-eu-west/content/pii:S1381116915300868/gr3/HIGHRES/image/jpeg/48d06627f007246a728b7cc261d7412a/gr3_lrg.jpg https://s3.amazonaws.com/prod-ucs-content-store-us-east/content/pii:S1381116915300868/gr3/HIGHRES/image/jpeg/48d06627f007246a728b7cc261d7412a/gr3_lrg.jpg gr3 gr3_lrg.jpg jpg 1039117 2126 2500 IMAGE-HIGH-RES 1-s2.0-S1381116915300868-gr4_lrg.jpg https://s3-eu-west-1.amazonaws.com/prod-ucs-content-store-eu-west/content/pii:S1381116915300868/gr4/HIGHRES/image/jpeg/37f842d5788618c04d01c44305725009/gr4_lrg.jpg https://s3.amazonaws.com/prod-ucs-content-store-us-east/content/pii:S1381116915300868/gr4/HIGHRES/image/jpeg/37f842d5788618c04d01c44305725009/gr4_lrg.jpg gr4 gr4_lrg.jpg jpg 533713 2786 2496 IMAGE-HIGH-RES 1-s2.0-S1381116915300868-gr5_lrg.jpg https://s3-eu-west-1.amazonaws.com/prod-ucs-content-store-eu-west/content/pii:S1381116915300868/gr5/HIGHRES/image/jpeg/47ef38a427035a414f72845d969b5732/gr5_lrg.jpg https://s3.amazonaws.com/prod-ucs-content-store-us-east/content/pii:S1381116915300868/gr5/HIGHRES/image/jpeg/47ef38a427035a414f72845d969b5732/gr5_lrg.jpg gr5 gr5_lrg.jpg jpg 208825 1608 1708 IMAGE-HIGH-RES 1-s2.0-S1381116915300868-gr6_lrg.jpg https://s3-eu-west-1.amazonaws.com/prod-ucs-content-store-eu-west/content/pii:S1381116915300868/gr6/HIGHRES/image/jpeg/0c51f27839b92e1c228b77d8b41db51f/gr6_lrg.jpg https://s3.amazonaws.com/prod-ucs-content-store-us-east/content/pii:S1381116915300868/gr6/HIGHRES/image/jpeg/0c51f27839b92e1c228b77d8b41db51f/gr6_lrg.jpg gr6 gr6_lrg.jpg jpg 418325 1818 2500 IMAGE-HIGH-RES 1-s2.0-S1381116915300868-gr7_lrg.jpg https://s3-eu-west-1.amazonaws.com/prod-ucs-content-store-eu-west/content/pii:S1381116915300868/gr7/HIGHRES/image/jpeg/e6f45a7101de751eb5bc7d6745123b6b/gr7_lrg.jpg https://s3.amazonaws.com/prod-ucs-content-store-us-east/content/pii:S1381116915300868/gr7/HIGHRES/image/jpeg/e6f45a7101de751eb5bc7d6745123b6b/gr7_lrg.jpg gr7 gr7_lrg.jpg jpg 413708 1922 2500 IMAGE-HIGH-RES 1-s2.0-S1381116915300868-gr8_lrg.jpg https://s3-eu-west-1.amazonaws.com/prod-ucs-content-store-eu-west/content/pii:S1381116915300868/gr8/HIGHRES/image/jpeg/6139ae819a01debecfb3f2603850f74a/gr8_lrg.jpg https://s3.amazonaws.com/prod-ucs-content-store-us-east/content/pii:S1381116915300868/gr8/HIGHRES/image/jpeg/6139ae819a01debecfb3f2603850f74a/gr8_lrg.jpg gr8 gr8_lrg.jpg jpg 336540 1765 2507 IMAGE-HIGH-RES 1-s2.0-S1381116915300868-gr9_lrg.jpg https://s3-eu-west-1.amazonaws.com/prod-ucs-content-store-eu-west/content/pii:S1381116915300868/gr9/HIGHRES/image/jpeg/07313f33b8d4fec614fdb66c583be5bd/gr9_lrg.jpg https://s3.amazonaws.com/prod-ucs-content-store-us-east/content/pii:S1381116915300868/gr9/HIGHRES/image/jpeg/07313f33b8d4fec614fdb66c583be5bd/gr9_lrg.jpg gr9 gr9_lrg.jpg jpg 642272 2192 3000 IMAGE-HIGH-RES 1-s2.0-S1381116915300868-sc1_lrg.jpg https://s3-eu-west-1.amazonaws.com/prod-ucs-content-store-eu-west/content/pii:S1381116915300868/sc1/HIGHRES/image/jpeg/5c92510350d2bbb65a8b031eefb796bd/sc1_lrg.jpg https://s3.amazonaws.com/prod-ucs-content-store-us-east/content/pii:S1381116915300868/sc1/HIGHRES/image/jpeg/5c92510350d2bbb65a8b031eefb796bd/sc1_lrg.jpg sc1 sc1_lrg.jpg jpg 428135 2351 1667 IMAGE-HIGH-RES 1-s2.0-S1381116915300868-si1.gif https://s3-eu-west-1.amazonaws.com/prod-ucs-content-store-eu-west/content/pii:S1381116915300868/STRIPIN/image/gif/9d2d923924cfd1b92f8ae3d1b25aa7a2/si1.gif https://s3.amazonaws.com/prod-ucs-content-store-us-east/content/pii:S1381116915300868/STRIPIN/image/gif/9d2d923924cfd1b92f8ae3d1b25aa7a2/si1.gif si1 si1.gif gif 1032 39 230 ALTIMG 1-s2.0-S1381116915300868-si2.gif https://s3-eu-west-1.amazonaws.com/prod-ucs-content-store-eu-west/content/pii:S1381116915300868/STRIPIN/image/gif/1d66deb730250532e75dc027df7587be/si2.gif https://s3.amazonaws.com/prod-ucs-content-store-us-east/content/pii:S1381116915300868/STRIPIN/image/gif/1d66deb730250532e75dc027df7587be/si2.gif si2 si2.gif gif 342 34 79 ALTIMG 1-s2.0-S1381116915300868-si3.gif https://s3-eu-west-1.amazonaws.com/prod-ucs-content-store-eu-west/content/pii:S1381116915300868/STRIPIN/image/gif/142ebd542025de1404a9b58648135623/si3.gif https://s3.amazonaws.com/prod-ucs-content-store-us-east/content/pii:S1381116915300868/STRIPIN/image/gif/142ebd542025de1404a9b58648135623/si3.gif si3 si3.gif gif 342 18 65 ALTIMG MOLCAA 9626 S1381-1169(15)30086-8 10.1016/j.molcata.2015.09.010 Elsevier B.V. Fig. 1 FT-IR spectra of PWV (a), PVA (b) PWV–PVA (c). Fig. 2 UV–vis spectra of PWV–PVA (a), PWV (b) and PVA (c). Fig. 3 SEM images of PWV–PVA. The images of (a): PVA film (3μm), (b): PWV (1μm), (c): PWV/PVA (1μm) and (d): PWV/PVA (300nm). Fig. 4 XRD of PWV (a), PVA (b) and PWV–PVA (c). Fig. 5 31P NMR spectrum of PWV (a) and PWV/PVA (b) dissolved in DMSO. Fig. 6 Effect of different catalyst on oxidative desulphurization of BT. 1-None, 2-H4SiW12O403-H3PW12O40 4-K5PV2W10O40 5-(N(But)4)4HPMo10V2O40 6-(N(tBu)4)4HPV2W10O40 7-(N(tBu)4)4HPV2W10O40/PVA. Fig. 7 Effect of catalyst dosage on oxidative desulphurization of BT. Fig. 8 Effect of different temperature on oxidative desulphurization of BT. Fig. 9 Probable mechanism for the formation of peroxo-metal species and using H2O2 as the oxidant for oxidation of BT, DBT and RSR. Fig. 10 Plots of C/C0 for the oxidation of BT with the PWV/PVA catalyst. (1): 25°C, (2): 30°C, (3): 35°C and (4): 40°C. Fig. 11 Arrhenius plot for the oxidation of BT with the PWV/PVA catalyst. Fig. 12 Comparison of XRD pattern of free PWV/PVA (a) after first run reuse (b) after 2 run reuse (c) after 3 rune reuse (d). Fig. 13 Comparison of IR spectrum of free PWV/PVA (a) after first run reuse (b) after 2 run reuse (c) after 3 rune reuse (d). Scheme 1 Chart of synthesis of nanocomposite. Table 1 Effect of different catalysts in the ODS of gasoline, Thiophene and BT. Entry Catalyst Conversion (%) Ref. Thiophene BT Actual gasoline 1 (N(tBu)4)5PV2W10O40/PVA 98 98 97 In this work 2 (N(tBu)4)5PV2W10O40 92 91 91 [30] 3 (N(But)4)5PMo10V2O40 89 88 88 [30] 4 H5PV2W10O40 84 83 83 [30] 5 (NH4)5PV2W10O40 83 82 81 [30] 6 K5PV2W10O40 82 81 80 [25] 7 H3PW12O40 80 80 78 [26] 8 H4SiW12O40 79 80 77 [26] Conditions for desulphurization: 50mL of model gasoline (500ppmS) or 50mL of gasoline, 0.1g catalyst, 6mL acetic acid/H2O2, 10mL extraction solvent, time 2h and temperature 35°C. Table 2 Oxidative desulphurization of gasoline by PWV–PVA. Entry Properties of gasoline Unit Method Before ODS After ODS a 1 Total sulphur by X-ray Wt.% ASTM D 4294 0.424 0.014 2 Mercaptans ppm ASTM D 3227 82 4 3 Density by hydrometer @ 15°C g/mL ASTM D 1298 0.7968 0.7965 4 Salt (ptb) ASTM D 3230 18 16 5 Water content by distillation vol.% ASTM D 4006 Nil. Nil. IBP °C 47.3 46.8 FBP 208.8 208.5 10 69.6 68.7 6 Distillation 50 Vol% ASTM D 86 117.7 117.2 90 189.2 188.1 95 206.3 205.8 a Condition for desulphurization: 50mL of gasoline, 0.1g nano catalyst, 3mL oxidant, 10mL of extraction solvent, time=2h, and temperature=35°C. Table 3 FT-IR related to Kegging PWV and PWV–PVA. Compound ν (cm−1) (WkOc c-W) ν (cm−1) (W–Ob b-W) ν (cm−1) (W–Od d) ν (cm−1) (P–Oa a) PV2W10O40-PVA 803.32 888.46 961.70 1095.07 PV2W10O40 803.53 889.22 960.61 1095.67 aOa: oxygen bonded with phosphorus atom. bOb: octahedral corner-sharing oxygen. cOc: octahedral edge-sharing oxygen. Table 4 Effect of different catalysts in the ODS of gasoline a . Entry Catalyst % Remove of total sulphur % Remove of mercaptans With H2O2 Without H2O2 With H2O2 Without H2O2 1 (N(tBu)4)4HPV2W10O40/PVA 97 45 95 40 2 (N(tBu)4)4HPV2W10O40 91 40 89 36 3 (N(tBu)4)4HPMo10V2O40 88 38 88 35 4 H5PV2W10O40 83 37 82 32 5 (NH4)4HPV2W10O40 81 41 80 31 6 K5PV2W10O40 80 34 79 30 7 H3PW12O40 78 33 77 30 8 H4SiW12O40 77 16 77 28 9 None 22 – 20 – a Condition for desulphurization: 50mL of gasoline, 0.1g catalyst, 6mL oxidant, 10mL of extraction solvent, time=2h, and temperature=35°C. Table 5 Effect of catalyst dosage in the ODS of gasoline and simulated gasoline a . Entry Amount of catalyst (g) Conversion (%) Thiophene Benzothiophene Actual gasoline 1 0 (none) 24 23 23 2 0.02 39 38 37 3 0.04 48 47 46 4 0.06 69 68 68 5 0.08 89 88 88 6 0.1 98 98 97 7 0.11 98 97 97 8 0.12 98 97 97 a Condition for desulphurization: 50mL of gasoline, 6mL oxidant, 10mL of extraction solvent, time=2h, and temperaturen=35°C, catalyst=PWV–PVA. Table 6 Effect of different temperatures in the ODS of gasoline and simulated gasoline a . Entry Temperature (°C) Conversion (%) Thiophene Benzothiophene Actual gasoline 1 25 75 71 71 2 30 89 86 88 3 35 98 98 97 4 40 98 98 97 a Condition for desulphurization: 50mL of gasoline, 0.1g catalyst, 6mL oxidant, 10mL of extraction solvent, time=2h. Table 7 Effect of different oxidation system in the ODS of gasoline and simulated gasoline a . Entry Oxidant Acid % Remove of mercaptans % Remove of total sulphur 1 H2O2 Acetic acid 95 97 2 H2O2 Oxalic acid 89 97 3 H2O2 Benzoic acid 87 92 4 H2O2 H2SO4 85 91 5 H2O2 H2CO3 84 79 6 H2O2 – 78 78 7 KMnO4 Formic acid 86 85 8 KMnO4 Oxalic acid 75 74 9 KMnO4 H2SO4 74 73 10 KMnO4 – 73 74 11 K2Cr2O5 Formic acid 84 76 12 K2Cr2O5 Oxalic acid 76 74 13 K2Cr2O5 H2SO4 73 74 14 K2Cr2O5 – 74 73 a Condition for desulphurization: 50mL of gasoline, 0.1g PWV–PVA, 6mL oxidant, 10mL of extraction solvent, time=2h, and temperature=35°C. Table 8 Pseudo-first-order rate constants and correlation factors of the BT. Temperature (°C) BT orrelation factor R2 Rate constant k (min−1) 25 8.0×10−3 0.91 30 1.3×10−2 0.94 35 2.5×10−2 0.91 40 2.6×10−2 0.92 Table 9 Reuse of the catalyst on the ODS of thiophene a . Entry Isolated yield (%) 1 97 2 96 3 95 a Conditions for desulphurization: 50mL of model gasoline (500 ppm S), 0.1g catalyst, 6mL acetic acid/H2O2, 10mL extraction solvent, time 2h and temperature 35°C. Phosphotungestovanadate immobilized on PVA as an efficient and reusable nano catalyst for oxidative desulphurization of gasoline Mohammad Ali Rezvani ⁎ Mina Oveisi Mokhtar Ali Nia Asli Department of Chemistry, Faculty of Science, University of Zanjan, 451561319 Zanjan, Iran Department of Chemistry Faculty of Science University of Zanjan Zanjan 451561319 Iran ⁎ Corresponding author. Fax: +98 241 5152617. Graphical abstract In this manuscript, phosphotungestovanadate (N(tBu)4) 4HPW10V2O40 (PWV) as a Keggin-type polyoxometalate was synthesized and immobilized on poly vinyl alcohol (PVA) via sol–gel method. The materials characterized by FT-IR, XRD, UV–vis, SEM and 31P NMR spectroscopy. Catalytic activity of synthesized nanocomposite was tested on oxidative desulphurization of actual gasoline and results are compared with that of model sulphur compounds. This Keggin-type supported catalyst was shown to be able to have oxidative desulphurization of model sulphur compounds and actual gasoline with high yield. The addition of acetic acid enhanced the conversion. The advantages of this method lie in its mild condition, low cost, large scale, simplicity and environmentally friendly route. Keywords Synthesis Nanocomposite Immobilization Oxidative desulphurization Gasoline 1 Introduction Polyoxometalates (POMs) as metal–oxygen anionic cluster can undergo to a reversible reduction without changing its structure [1]. They have numerous applications in a multitude of areas ranging from catalysis to pharmacology and remain of continuous interest, especially in the areas of design and synthesis of functional nanomaterials [2–5]. In addition, POM as an electron shuttle is known to resist oxidation and to catalyze redox reactions [6]. Several researchers indicate that the polyoxoanion acts as a molecular acceptor by interactions with the nitrogen and oxygen atoms of the organic donor [7–11]. Two main types of POMs are known, based on their chemical composition: isopoly and heteropoly anions. Heteropoly anion (HPA), especially the Keggin-type, as strong acids and multielectron oxidants have attracted much attention [12,13]. Their acid strength is mostly higher than many conventional solid acids [14]. Further catalytically important subclasses of the Keggin compounds are the mixed-addenda vanadium (V) substituted HPAs with the general formula H3+n PM12–n V n O40 (M=Mo and W; n =1 to 6). The major limitations of HPAs are low surface areas and solubility in polar media which makes difficult the recycling and reuse of them. So, many attempts have been performed to immobilize POM on various high surface area solid materials. The immobilized HPA catalysts are important since they can easily be recovered from reaction mixtures and reused. Therefore, researchers have focused on immobilizing HPAs onto different acidic or neutral materials such as SiO2, TiO2, zeolites, acidic ion-exchange resins, clays, active carbons, polymers and polyaniline–graphene composite [12–18]. The architecture and topology of entangled POM-based coordination polymers have been of particular interest due to their potential applications ranging from catalysis and adsorption [19–23]. A major source of pollution is sulphur containing fuel oils which damage the environment in some different ways. Besides produces the precursors of the acid rain (SO x ), their combustion in automobile engines also irreversibly poisons noble metal catalysts of the exhaust systems [24], an effective process that been done in this field is oxidative desulphurization that operates at mild reaction conditions. In continuation of our group researches on the syntheses and application of polyoxometalate in organic reactions [25–28], we hereby report the applicability of PWV/PVA for efficient desulphurization of gasoline to preparation of ultra-clean fuels. The catalytic performance of heterogeneous catalysts was tested on oxidation desulphurization (ODS) of gasoline and model sulphur compounds that exist in gasoline such as benzothiophene (BT) and thiophene (T), with acetic acid/hydrogen peroxide as the oxidizing reagent. Various oxidants have been used in ODS, such as NO2, O3, H2O2 and solid oxidizing agents [29]. Among these oxidants, H2O2 is mostly chosen as an oxidant, as only water is produced as a byproduct. Peracids produced in situ from organic acids catalysts and H2O2 are reported to be very effective for rapid oxidation of sulphur compounds in fuel oils under mild conditions [29]. This quaternary ammonium Keggin type tungstovanadophosphate PWV, which has lipophilic cation can better act as phase transfer agent and better transfer the peroxometal anion into organic phase. A literature review showed that desulphurization of gasoline using the immobilized phosphotungestovanadate (N(tBu)4)4HPW10V2O40 (PWV) onto poly vinyl alcohol (PVA) was not studied [29–31]. In this manuscript, PWV as a Keggin-type polyoxometalate was synthesized and immobilized onto PVA. The synthesized nanocomposite (PWV/PVA) used as a catalyst for oxidative desulphurization of thiophenes (Th), benzothiophenes (BT) and actual gasoline. The chemical characterization of this compound nanocomposite was accomplished by X-ray diffraction (XRD), Fourier Transform infrared spectra (FT-IR), Scanning Electron Microscopy (SEM), 31P NMR and UV–vis techniques. 2 Experimental 2.1 Materials All solvents and reagents which are used in synthesized procedure are available commercially and were used as received, unless otherwise indicated. Model compounds and chemicals, including thiophene (Th) and benzothiophene (BT) and solvent (n-heptane) for experiments and analysis and hydrogen peroxide (30vol.%) were obtained from Aldrich Chemical Company. The products characterized by analytical instrument FT-IR, UV–vis, XRD and SEM. Several heteropolyoxometalate catalysts were prepared according to the literature procedure [25,26]. Typical actual gasoline (density 0.7968g/mL at 15°C, total sulphur content 0.424wt.%) was used. 2.2 Preparation of catalysts 2.2.1 Synthesis of tetrabutylammonium divanadodecatungstophosphate ((n-C4H9)4N)4H[PW10V2O40] The tetrabutylammonium (TBA) salts TBA4HPW10V2O40 was synthesized according to published literature procedures [30]. In summary, sodium metavanadate (NaVO3, 6.1g, 50mmol) was dissolved in 50mL of boiling water and mixed with a 50mL aqueous solution of di-sodium hydrogen phosphate (Na2HPO4, 1.77g, 12.5mmol). After the resulting solution was cooled to room temperature, concentrated sulphuric acid (5mL, 85mmol) was added to give a red solution. Then, 50mL aqueous solution of sodium tungstate dehydrate (Na2WO4 2H2O, 41.25g, 150mmol) was added to the red solution with vigorous stirring. By addition of solid potassium carbonate, the pH is adjusted between 6 and 7. By addition of solid potassium chloride (2.2g, 40mmol) an orange potassium salt (2.5g, 45mmol) is precipitated and recrystallized in water. The remaining solid was dissolved in 55mL of warm distilled water and aqueous solution of tetrabutylammonium bromide (Bu4NBr) (1.8 mmol) was added drop-wise, with vigorous stirring. The solid formed was filtered off, recrystallized with acetonitrile and ether, and air dried (Scheme 1 ). The resultant (((n-C4H9)4N) 4H[PW10V2O40]) solid is designated as TBA-PVW. 2.2.2 Preparation of nanocatalyst by immobilization of PWV on PVA Preparation of [(n-C4H9)4N)] 4HPW10V2O40-PVA via sol–gel method under oil-bath condition is as follows: In 25mL of boiling distilled water, 0.1g PVA was dissolved and the temperature was fixed at 65°C. Then 0.1g of PWV was added to this solution with stirring, resulting in a yellow solution and the mixture was vigorously stirred for 2h at 65°C. After the reaction continuing for 2h at 65°C, the color of precipitate not changed. After this time yellow gelatinous solution was observed. This jelly was placed in a drying oven at 50°C for 2h (Scheme 1). 2.3 Catalytic test 2.3.1 Oxidative desulphurization of model compound (simulated gasoline) The experiments of oxidative desulphurization were performed in a round bottom flask equipped with stirrer. For oxidative desulphurization of simulated gasoline, BT and thiophene was selected as model sulphur compound. To make a stock solution with a sulphur content of 500ppm, BT or thiophene was dissolved in n- heptane. In the typical run, the water bath was first heated and stabilized to a certain temperature (25–40°C). Into the flask, 6mL acetic acid/H2O2 (peracetic acid, acetic acid/hydrogen peroxide mole ratio of 1/2) was added and mixed with 50mL of the model sulphur compound (Th or BT). To initiate the reaction, 0.1g of the PWV–PVA as a nano catalyst was added to the flask. The flask was immersed in a heating bath (25–40°C) and stirred at 500rpm for 2h. The biphasic mixture was separated by decantation. The BT content in both phases was determined. Product identification was achieved by using GC–MS (Varian cp-1200 quadrupole MS), HP5890 Series II with 5972 Series MS detector. The results indicated a perfect match of the mass spectrum of the product with the standard benzothiophene sulfone. Also the total sulphur concentration of the simulated gasoline before and after reaction was determined using a Tanaka Scientific RX-360 SH X-ray fluorescence spectrometer (ASTM D-4294 method). Results are showed in Table 1 . Conversion of BT was calculated to evaluate the catalytic activity of PWV–PVA by using Eq. (1): (1) % C o n v e r s i o n = [ C o − C t C o ] × 100 % in which Co is initial concentration of BT, and Ct is final concentration of BT. 2.3.2 Oxidative desulphurization (ODS) of gasoline For ODS of actual gasoline, 50mL of gasoline fuel was added to two-necked round flask. The temperature of solution fixed at 65°C. Then 0.1g of PWV–PVA added to the solution and strongly stirred by a magnetic stirrer. Through 2h, a mixture of acetic acid: H2O2 in ratio 1:2 was added drop wise in it while it was stirring vigorously. After the oxidation was finished, the mixture was cooled down to room temperature and the oxidized sulfur in the gasoline fuel was extracted with acetonitrile at room temperature. The acetonitrile/gasoline ratio used was 1/5 by volume. The oil phase was separated and weighed to calculate recovery percentage of actual gasoline (for three times reaction: %97, %96 and %94). The total sulphur and mercaptan sulphur content in actual gasoline before and after reaction were determined using X-ray fluorescence ASTM D-4294 and D-3227 standard test method. This standard test method (ASTM D-4294) provides precise and rapid measurement of total sulphur in petroleum and petroleum products with a minimum of sample preparation. A typical analysis time is 1 to 5min per sample. Results are showed in Table 2 . 2.4 Characterization methods Fourier transform infrared (FT-IR) spectra were recorded by Thermo-Nicolet-is 10 in the range of 400–4000cm−1. UV–vis spectra were studied with a double beam termo-heylos spectrophotometry in the range of 200–500nm. X-ray diffraction (XRD) patterns was accomplished by D8 advance Brucker and radiation Cu kα (λ =1.54nm) in the range of 0–60° (2θ). Scanning electron microscope (SEM) images were obtained on a LEO 1455 VP with an accelerating voltage of 10.00kV. 31P NMR spectra were recorded by Bruker Ultra-shield spectrometer. 3 Results and discussion 3.1 Characterization of synthesized catalysts FT-IR spectra of free PWV, PVA, and PWV–PVA support are studied for structural characterization purposes (Fig. 1 ). The strong peaks at 2934cm−1, 2872cm−1 (Fig. 1) were mainly attributed to alkyl groups(CH stretching vibration). The broad band in the 3500–3700cm−1 regions can be attributed to the symmetrical stretching vibration modes of the adsorbed water molecules and band in 3404cm−1 is due to OH. The structure of Keggin type heteropolyanion consists of a PO4 tetrahedron that surrounded by four W3O9 groups formed by the edge sharing octahedron. This structure gives rise to different types of oxygen atoms, being responsible for the fingerprint FT-IR bands of the heteropolyanion between 750 and 1100cm−1 (Fig. 1). The four distinct bands belonging to the Keggin structure were centred at 1095, 961, 888, and 803cm−1 [33]. Earlier reports assigned these peaks that appeared at about 778–785 and 850–890cm−1 to WOW. The peaks around 950–998cm−1 and 1070–1090cm−1 were associated with MO and PO bonds, respectively, and explicitly indicate the neat structure of Keggin-type heteropolyanion. The band at 1095cm−1 was assigned to the symmetric stretching vibration of PO4 tetrahedron, by comparison the peaks of PWV with PWV/PVA, clarified the maximum displacement (red shift) is related to (WO d ) of PWV–PVA because it has more interaction with PVA (Table 3 ). However, a slight shift is evidenced as a result of PWV interaction with functional groups of the support. In the FT-IR spectrum of PWV–PVA, the peaks slightly overlapped with PVA and the intensity of the peak was lower [32]. Fig. 2 shows the UV–vis spectra of pure PVA, PWV and PWV–PVA as comparative data to confirm the changes on pure PWV after introducing PVA. The UV–vis spectra of PVA (a), PWV (b) and PWV–PVA (c) (Fig. 2), showed strong absorption peak at 241nm which assigned to oxygen-to-tungsten charge-transfer transition of PWV, 245nm for PWV–PVA and 270nm for PVA which indicated PWV–PVA blue shift towards PVA and red shift towards PWV. Excitation of the oxygen to metal charge transfer band of PWV in near UV light region results in the charge transfer from an O −2 to W +6, forming the O −1 and W +5. The surface morphology of PWV–PVA nanocomposite was investigated by SEM. A typical SEM picture of the as prepared PWV–PVA catalyst is shown in Fig. 3 . From Fig. 3(a), the blank PVA film is observed to be relatively flat surface and Fig. 3(b) shows polyoxometalate consist of very small agglomerated nanoparticle. This picture (Fig. 3c,d) shows non regular morphology. Nanocomposite Keggin-type polyoxometalate modified PVA is created and the estimated particle sizes are achieved nano-scale. The powder nanostructures were investigated by X-ray diffraction (XRD) measurement [34]. The patterns were collected in the scanning range 6°≤2θ ≤60° are shown in Fig. 4 . The pattern, observed for pure PVA, shows several distinct crystalline sharp peaks at 2θ =20.654, 23.520 and 25.19° [35]. The XRD patterns of PWV–PVA shows the pure PVA with less intensity and some peaks are no longer detectable since they are of small intensity in the XRD pattern of PWV–PVA. The peaks for pure PWV at 6–10, 16–23 and 25–30° indicated kegging type of polyoxometalate [36]. By comparison of PWV and PWV–PVA, the peaks of PWV are still observed after the loading although the intensity of the diffraction peak becomes broader and weaker than pure PWV. In addition, the most peaks for PWV–PVA attributed to the crystal of PWV are observed this indicates the highly dispersed PWV on the surfaces of PVA support, when PWV is bound to the PVA surface, PWV–PVA, all of signals corresponding to PWV and the final pattern matched to PWV, which is most likely due to PWV forming on the PVA surface and thus the majority of the observed signals are due to the crystal phases of PWV, which is in good agreement with the results of SEM. Scherer equation, was used to calculate the nano crystallite size by XRD radiation of wavelength from measuring full width at half maximum of peaks in radian located at any 2θ in the pattern. The mean crystal size obtained was around 22.5nm. Nuclear magnetic resonance (NMR) of the different active nuclei constituting POM is considered to be a very powerful method to clear their molecular structures both in solution and in the solid state. The 31P NMR spectrum of PWV and PWV–PVA in DMSO at ∼25°C was a clear single line spectrum at −14.797ppm due to the internal phosphorus atom, thereby confirming the compound's purity, as shown in Fig. 5 . The signal exhibited a shift from the signals of PWV, suggesting the insertion of PWV and PWV–PVA. 3.2 Desulphurization process According to data from the results of Table 2, total sulphur content (Entry 1) and content of mercaptans (Entry 2) were much lower, while other properties of gasoline showed in Table 2 remained unaffected. From the results obtained in this research, it was demonstrated that the nanocomposite PWV–PVA, can catalyze the oxidative desulphurization reaction in 2h and can reduce total sulphur content (wt.%) of actual gasoline from 0.424wt.% to 0.014wt.% and also, reduce content of mercaptans from 82ppm to 4ppm. 3.3 Effect of the catalyst structure Tables 1 and 4 and Fig. 6 shows the results of oxidative desulphurization of thiophene, BT and actual gasoline with acetic acid/H2O2 as the oxidant using different catalysts. The amount of each catalyst was constant throughout the series. Blank experiment was performed in the absence of catalyst. Under these conditions, % conversion was very low (22% in 2h) at 35°C (Table 4 , entry 9). The results show that the catalytic activity of PWV–PVA nanocomposite has presented much higher than other unsupported POMs. The vanadium-substituted Keggin type polyoxometalate catalyst was very active systems for the ODS of gasoline. The PWV with a phase transfer or emulsion catalyst comprising a quaternary ammonium salt-based polyoxometalate, it is shown very active system for ODS. This quaternary ammonium Keggin type which has lipophilic cation can better act as phase transfer agent and better transfer the peroxometal anion into organic phase. That is, the oxidation reactivity of the catalysts depends on the type of countercation: ((C4H9)4N)+ >NH4 + >K+. PWV is more effective than (N(tBu)4) 4HPMo10V2O40 in oxidative desulphurization of model sulphur compounds (BT). It may be different in tungsten and molybdenum reduction potentials. The results in Tables 1 and 4 shows that oxidative desulphurization of gasoline ability decreases generally in the order: V->W->Mo-containing heteropolyanions, which means that vanadium-containing heteropoly compounds are the strongest oxidants. 3.4 Effect of catalyst dosage Another factor that should be concerned is the catalyst dosage. It was found from the results of Table 5 and Fig. 7 that the catalyst dosage does have a marked influence on the process efficiency. Under otherwise identical conditions, without catalyst, 24% of the thiophene, 23% of the benzothiophene and 23% of actual gasoline is removed from the n-heptane phase in 120min by oxidation; % conversion of actual gasoline in the presence of PWV–PVA were found to be 68%, 88% and 97%, corresponding to catalyst amount of 0.06, 0.08 and 0.1g respectively. Desulphurization efficiency increased rapidly with the increase of catalyst dosage. The results are summarized in Table 5. 3.5 Influence of quaternary ammonium on catalytic activity Countercation with quaternary ammonium salts with lipophilic cation can act as phase transfer agent and can transfer the peroxometal anion into organic phase. An amphiphilic catalyst with a proper quaternary ammonium cation can form metastable emulsion droplets in gasoline with an aqueous H2O2 solution, demonstrating high oxidative activity, and can be separated after reaction through centrifugation. For example, [N(C4H9)4] + is a proper quaternary ammonium cation (Tables 1 and 4). We tested other cations and found that [N(C4H9)4]+ forms metastable emulsion droplets more readily than NH4 + and K+ in gasoline. Hydrogen peroxide cannot dissolve in oil phase of actual gasoline. Therefore, oil is unable to absolutely access to acetic acid: H2O2 as oxidant in the ODS process, which reduces ODS speed, and leads to an improper ODS and raises the amount of oxidant (acetic acid: H2O2). Phase transfer catalyst can improve the poor contact between gasoline (oil phase) and an acetic acid: H2O2 (liquid phase). This type of polyoxometalate as a catalyst can expedite the reaction between two reactants in two mutually exclusively soluble solvents (solid–liquid two-phase system or liquid–liquid two-phase system). During the ODS, the actual reactants are transferred from one phase to another by this type of polyoxometalate. Consequently, the reaction can be conducted at high rate. 3.6 Effect of temperature on the oxidative desulphurization of gasoline or simulated gasoline Influence of reaction temperature on the ODS of simulated gasoline and actual gasoline was investigated under the same conditions by PWV–PVA as a catalyst and acetic acid/H2O2 as oxidant. The results are shown in Table 6 and Fig. 8 . Four temperatures were tested (25°, 30°, 35° and 40°C). The results show that yields of products are a function of temperature. The conversion of sulphur in model compound and in actual gasoline increased with temperature and time. The conversion of sulphur in simulated fuel at 35°C is higher than that at 30°C. 97% Conversion of sulphur was obtained at 35°C in 120min. 3.7 Effect of different oxidative system on the oxidative desulphurization Effect of oxidative system on the oxidative desulphurization of gasoline was studied (Table 7 ). Hydrogen peroxide, KMnO4 and K2Cr2O5 were selected as oxidizing agents which were used in the presence of organic or inorganic acids such as; acetic acid, oxalic acid, benzoic acid, H2SO4 and H2CO3 to acidify the system. The results in Table 6 showed that in inorganic acids, H2SO4 and H2CO3, oxidation reactivity is lower than organic acids. In actual gasoline, H2SO4 and H2CO3 cannot dissolve; percent sulphur removal of gasoline in inorganic acid/H2O2 was lower than organic acid/H2O2 system. 3.8 General desulphurization process A model gasoline was made by adding Thiophene and BT into n-heptane solvent, with a total sulphur concentration of 500mg/L. The organic sulphur compounds were mixed with acetic acid/H2O2 and PWV–PVA then the oxidation reaction takes place at 35°C under atmospheric pressure. This is followed by a liquid extraction (acetonitrile) to obtain gasoline with low sulphur. In the ODS process, many oxidizing agents have been reported and H2O2 is the main one. Hydrogen peroxide is one of the most attractive oxidants, mainly because it is environmentally clean and easily handled. It should be noted that during the ODS process, the H2O2 was used in the presence of acetic acid (CH3COOH) as oxidants because acetic acid as an organic acid, reacts with H2O2 to in situ produce peracid (CH3COOOH), which can efficiency convert organic sulphur to sulfones without forming a substantial amount of residual product [25,26]. Hydrogen peroxide in short-chain carboxylic acids (formic acid or acetic acid) is considered as the common oxidative desulphurization system for the gasoline. The mechanism of sulfide oxidation to sulfoxides using H2O2-organic acid is not studied sufficiently; however, the potential mechanism is a heterolytic electrophyl interaction where H+X− is a polar solvent. Based on this mechanism, hydrogen peroxide fist reacts with organic acid (acetic acid) quickly and generates peroxide acid, and then the acid reacts with nonpolar sulphur compounds and generates relative sulfone or sulfoxide. The role of the metal atoms in (N(tBu) 4)4HPM10V2O40, M =V or Mo, is to form peroxo-metal species which are able to activate the H2O2 and peracid molecules. During the oxidative desulphurization process, the H2O2 can efficiency convert organic sulphur to sulfones without forming a substantial amount of residual product. PWV accepted the active oxygen from the oxidant H2O2 to form new oxoperoxo species mediate. The cation with carbon chain transferred oxoperoxo species to the substrates (Th or BT) and made the oxidation reaction accomplish completely. In summary, as it is observed in abstract graphic and Fig. 9 , firstly, the phosphotungstic compounds with Keggin structure will convert to polyoxoperoxo complexes [37]. The catalyst was reacted with H2O2 to form polyoxoperoxo specie, and then sulphur-containing compounds were oxidized to the corresponding sulfones with polyoxoperoxo. 3.9 Kinetics of BT oxidation Nanocatalyst PWV/PVA as potential catalyst in the oxidative desulfurization of BT from model fuel and gasoline was studied. The kinetics of oxidation of BT was studied under the condition of different temperature ranging 25, 30, 35 and 40°C. It is noteworthy, with increasing reaction temperature from 25 to 35°C removal of BT from 70% to 98% in 2h. The following rate equation is applied to model BT oxidation reaction. Rate equations can be applied to describe the relationship between C and t: (2) I n C C 0 = − k t here C 0, C, and k explain the initial concentration of BT, the concentration of BT at certain time (t), and the rate constant, respectively [38] . The plot of C/C 0 versus time was shown in Fig. 10 . The rate constant increases with an increase in the reaction temperature for BT in Table 8 and experimental data were fitted to a pseudo-first-order rate equation Eq. (2). The reaction temperature dependence of reaction rates can be expressed with the Arrhenius equation (Eq. (3)), where A is the pre-exponential factor, is the activation energy, and R is the universal gas constant. It is common knowledge that chemical reactions occur rapidly at higher temperatures [38]. The Arrhenius plot is shown in Fig. 11 and the calculated Ea values for the oxidation of BT are 92kJ/mol. (3) k = A e − E a R T 3.10 Recycling of the catalyst At the end of the ODS of the model sulphur compounds and gasoline, the PWV–PVA was filtered and washed with dichloromethane. In order to determine whether the PWV–PVA would succumb to poisoning and lose its catalytic activity during the reaction, the reusability of the PWV–PVA was investigated. For this purpose, we carried out the desulphurization reaction of gasoline and model compounds in the presence of fresh and recovered PWV–PVA. The PWV–PVA recovered after the reactions were characterized, in order to check the PWV–PVA stability. Figs. 12 and 13 illustrate XRD pattern and IR spectra of PWV–PVA after three catalytic cycles, respectively. Even after three runs for the reaction, the catalytic activity of PWV–PVA was almost the same as that of freshly used catalyst. The results are summarized in Table 9 . 4 Conclusion A mixed-addenda vanadium (V) substituted Keggin type POM-based inorganic–organic compound was presented. The preparation condition was simple and mild. The inorganic–organic material presented here is unique in several aspects; this simple synthesis route demonstrates that the use of PVA molecule as organic electron donor reacting chemically with polyoxometalate anion (electron acceptor) can give rise to amorphous nanomaterials, which exhibit high catalytic activity. SEM images indicate that the surface is uniform, non-smooth and nanoparticles were made. FT-IR spectra and XRD patterns proved the formation of desired heteropolyacids Keggin structure onto PVA. The PWV–PVA nanoparticle was very active catalyst system for desulphurization of the models compound, while unmodified PWV showed much lower activity. This PWV/PVA/H2O2 system provides an efficient, convenient and practical method for oxidative desulphurization of gasoline and the advantages of this method are nontoxic, mild condition and environmentally friendly. References [1] A. Hiskia A. Mylonas E. Papaconstantinou Chem. Soc. Rev. 30 2001 62 [2] M. Pope A. Müller Polyoxometalate Chemistry from Topology via Self-Assembly to Applications 1st ed. 2001 Springer Dordrecht The Netherlands [3] P. Gouzerh M. Che L’Actualité Chim 298 2006 9 [4] D.L. Long R. Tsunashima L. Cronin Angew. Chem. Int. Ed. 49 2010 1736 [5] T. Yamase M.T. Pope Nanostructure Science and Technology 2002 Kluwer Academic/Plenum Publishers New York, NY, USA [6] I.V. Kozhevnikov Chem. Rev. 98 1998 171 [7] M.D. Symes L. Cronin Nat. Chem. 5 2013 403 [8] D.L. Long H. Abbas P. Kögerler L. Cronin J. Am. Chem. Soc. 126 2004 13880 [9] H.N. Miras J. Yan D.-L. Long L. Cronin Angew. Chem. Int. Ed. 47 2008 8420 [10] T. Ito N. Fujimoto S. Uchida J. Iijima H. Naruke N. Mizuno Crystals 2 2012 362 [11] J.T. Rhule C.L. Hill D.A. Judd R.F. Schinazi Chem. Rev. 98 1998 327 [12] I.V. Kozhevnikov Catalysis by Polyoxometalates Vol. 2 2002 Wiley Chichester, England [13] J.B. Moffat Metal—Oxygen Clusters. The Surface and Catalytic Properties of Heteropoly Oxometalates 2001 Kluwer New York [14] C. Izumi Y. Urabe M. Onaka Zeolite, Kodansha 1993 Tokyo/VCH New York Chapter 3 [15] J.B. Moffat Metal–Oxygen Cluster—The Surface and Catalytic Properties of Heteropoly Oxometalates 2001 Kluwer New York 25 [16] F.Y. Ma T. Shi J. Gao L. Chen W. Guo Y.H. Guo S.T. Wang Colloids Surf. A Physicochem. Eng. Asp. 401 2012 116 [17] Z. Cui C.X. Guo C.M. Li J. Mater. Chem. A. 1 2013 6687 [18] B. Bi L. Xu B. Xu X. Liu Appl. Clay Sci. 54 2011 242 [19] X.-H. Bu M.-L. Tong H.-C. Chang S. Kitagawa S.R. Batten Angew. Chem.Int. Ed. 43 2004 192 [20] J.L.C. Rowsell O.M. Yaghi J. Am. Chem. Soc. 128 2006 1304 [21] V. Balzani A. Credi F.M. Raymo J.F. Stoddart Angew. Chem. Int. Ed. 39 2000 3348 [22] V. Balzani A. Credi M. Venturi Chem. Soc. Rev. 38 2009 1542 [23] K. Liang H. Zheng Y. Song M.F. Lappert Y. Li X. Xin Z. Huang J. Chen S. Lu Angew. Chem Int. 43 2004 5776 [24] G. Luo L. Kang M. Zhu B. Dai Fuel Process. Technol. 118 2014 20 [25] A.F. Shojaei M.A. Rezvani M.H. Loghmani Fuel Process. Technol. 118 2014 1 [26] M.A. Rezvani F. Mohammadi Zonoz Ind. Eng. Chem. 22 2015 83 [27] M.A. Rezvani A.F. Shojaie M.H. Loghmani Catal. Commun. 25 2012 36 [28] A.F. Shojaei M.A. Rezvani F. Mohamadi Zonoz J. Serb. Chem. Soc. 78 2013 129 [29] J. Zongxuan L. Hongyinga Z. Yongna L. Can Chin. J. Catal. 32 2011 707 [30] W. Trakarnpruk K. Rujiraworawut Fuel Process. Technol. 90 2009 411 [31] A. Imtiaz A. Waqas I. Muhammad Chin. J. Catal. 34 2013 1839 [32] K. Nomiya Y. Nemoto T. Hasegawa S. Matsuoka J. Mol. Catal. A: Chem. 152 2000 55 [33] P. Karandikar K.C. Dhanya S. Deshpande Catal. Commun. 5 2004 69 [34] T. Chunxia B. Weifeng J. Solid State Chem. 219 2014 93 [35] O.W. Guirguis T.H.M. Moselhey Nat. Sci. 4 2012 57 [36] D. Xinbo W. Danjun L. Kebin Z. Yanzhong H. Huaiming X. Ganglin Mater. Res. Bull. 57 2014 210 [37] D.C. Dunan R.C. Chambers E. Hecht C.L. Hill J. Am. Chem. Soc. 117 1995 681 [38] Z. Hasan J. Jeon S.H. Jhung J. Hazard. Mater. 205 2012 216",
      "scopus-id": "84943160113",
      "coredata": {
        "eid": "1-s2.0-S1381116915300868",
        "dc:description": "In this manuscript, phosphotungestovanadate (N(tBu)4) 4HPW10V2O40 (PWV) as a Keggin-type polyoxometalate was synthesized and immobilized on poly vinyl alcohol (PVA) via sol–gel method. The materials characterized by FT-IR, XRD, UV–vis, SEM and 31P NMR spectroscopy. Catalytic activity of synthesized nanocomposite was tested on oxidative desulphurization of actual gasoline and results are compared with that of model sulphur compounds. This Keggin-type supported catalyst was shown to be able to have oxidative desulphurization of model sulphur compounds and actual gasoline with high yield. The addition of acetic acid enhanced the conversion. The advantages of this method lie in its mild condition, low cost, large scale, simplicity and environmentally friendly route.",
        "openArchiveArticle": "false",
        "prism:coverDate": "2015-12-15",
        "openaccessUserLicense": null,
        "prism:aggregationType": "Journal",
        "prism:url": "https://api.elsevier.com/content/article/pii/S1381116915300868",
        "dc:creator": [
          {
            "@_fa": "true",
            "$": "Rezvani, Mohammad Ali"
          },
          {
            "@_fa": "true",
            "$": "Oveisi, Mina"
          },
          {
            "@_fa": "true",
            "$": "Nia Asli, Mokhtar Ali"
          }
        ],
        "link": [
          {
            "@_fa": "true",
            "@rel": "self",
            "@href": "https://api.elsevier.com/content/article/pii/S1381116915300868"
          },
          {
            "@_fa": "true",
            "@rel": "scidir",
            "@href": "https://www.sciencedirect.com/science/article/pii/S1381116915300868"
          }
        ],
        "dc:format": "application/json",
        "openaccessType": null,
        "pii": "S1381-1169(15)30086-8",
        "prism:volume": "410",
        "prism:publisher": "Elsevier B.V.",
        "dc:title": "Phosphotungestovanadate immobilized on PVA as an efficient and reusable nano catalyst for oxidative desulphurization of gasoline",
        "prism:copyright": "Copyright © 2015 Elsevier B.V. All rights reserved.",
        "openaccess": "0",
        "prism:issn": "13811169",
        "dcterms:subject": [
          {
            "@_fa": "true",
            "$": "Synthesis"
          },
          {
            "@_fa": "true",
            "$": "Nanocomposite"
          },
          {
            "@_fa": "true",
            "$": "Immobilization"
          },
          {
            "@_fa": "true",
            "$": "Oxidative desulphurization"
          },
          {
            "@_fa": "true",
            "$": "Gasoline"
          }
        ],
        "openaccessArticle": "false",
        "prism:publicationName": "Journal of Molecular Catalysis A: Chemical",
        "openaccessSponsorType": null,
        "prism:pageRange": "121-132",
        "prism:endingPage": "132",
        "pubType": "fla",
        "prism:coverDisplayDate": "15 December 2015",
        "prism:doi": "10.1016/j.molcata.2015.09.010",
        "prism:startingPage": "121",
        "dc:identifier": "doi:10.1016/j.molcata.2015.09.010",
        "openaccessSponsorName": null
      },
      "objects": {
        "object": [
          {
            "@category": "thumbnail",
            "@height": "88",
            "@width": "219",
            "@_fa": "true",
            "$": "https://api.elsevier.com/content/object/eid/1-s2.0-S1381116915300868-fx1.sml?httpAccept=%2A%2F%2A",
            "@multimediatype": "GIF image file",
            "@type": "IMAGE-THUMBNAIL",
            "@size": "9428",
            "@ref": "fx1",
            "@mimetype": "image/gif"
          },
          {
            "@category": "thumbnail",
            "@height": "142",
            "@width": "219",
            "@_fa": "true",
            "$": "https://api.elsevier.com/content/object/eid/1-s2.0-S1381116915300868-gr1.sml?httpAccept=%2A%2F%2A",
            "@multimediatype": "GIF image file",
            "@type": "IMAGE-THUMBNAIL",
            "@size": "15212",
            "@ref": "gr1",
            "@mimetype": "image/gif"
          },
          {
            "@category": "thumbnail",
            "@height": "155",
            "@width": "219",
            "@_fa": "true",
            "$": "https://api.elsevier.com/content/object/eid/1-s2.0-S1381116915300868-gr10.sml?httpAccept=%2A%2F%2A",
            "@multimediatype": "GIF image file",
            "@type": "IMAGE-THUMBNAIL",
            "@size": "12580",
            "@ref": "gr10",
            "@mimetype": "image/gif"
          },
          {
            "@category": "thumbnail",
            "@height": "152",
            "@width": "219",
            "@_fa": "true",
            "$": "https://api.elsevier.com/content/object/eid/1-s2.0-S1381116915300868-gr11.sml?httpAccept=%2A%2F%2A",
            "@multimediatype": "GIF image file",
            "@type": "IMAGE-THUMBNAIL",
            "@size": "7490",
            "@ref": "gr11",
            "@mimetype": "image/gif"
          },
          {
            "@category": "thumbnail",
            "@height": "126",
            "@width": "219",
            "@_fa": "true",
            "$": "https://api.elsevier.com/content/object/eid/1-s2.0-S1381116915300868-gr12.sml?httpAccept=%2A%2F%2A",
            "@multimediatype": "GIF image file",
            "@type": "IMAGE-THUMBNAIL",
            "@size": "15602",
            "@ref": "gr12",
            "@mimetype": "image/gif"
          },
          {
            "@category": "thumbnail",
            "@height": "125",
            "@width": "219",
            "@_fa": "true",
            "$": "https://api.elsevier.com/content/object/eid/1-s2.0-S1381116915300868-gr13.sml?httpAccept=%2A%2F%2A",
            "@multimediatype": "GIF image file",
            "@type": "IMAGE-THUMBNAIL",
            "@size": "15894",
            "@ref": "gr13",
            "@mimetype": "image/gif"
          },
          {
            "@category": "thumbnail",
            "@height": "123",
            "@width": "219",
            "@_fa": "true",
            "$": "https://api.elsevier.com/content/object/eid/1-s2.0-S1381116915300868-gr2.sml?httpAccept=%2A%2F%2A",
            "@multimediatype": "GIF image file",
            "@type": "IMAGE-THUMBNAIL",
            "@size": "13639",
            "@ref": "gr2",
            "@mimetype": "image/gif"
          },
          {
            "@category": "thumbnail",
            "@height": "164",
            "@width": "193",
            "@_fa": "true",
            "$": "https://api.elsevier.com/content/object/eid/1-s2.0-S1381116915300868-gr3.sml?httpAccept=%2A%2F%2A",
            "@multimediatype": "GIF image file",
            "@type": "IMAGE-THUMBNAIL",
            "@size": "33148",
            "@ref": "gr3",
            "@mimetype": "image/gif"
          },
          {
            "@category": "thumbnail",
            "@height": "164",
            "@width": "147",
            "@_fa": "true",
            "$": "https://api.elsevier.com/content/object/eid/1-s2.0-S1381116915300868-gr4.sml?httpAccept=%2A%2F%2A",
            "@multimediatype": "GIF image file",
            "@type": "IMAGE-THUMBNAIL",
            "@size": "14281",
            "@ref": "gr4",
            "@mimetype": "image/gif"
          },
          {
            "@category": "thumbnail",
            "@height": "164",
            "@width": "174",
            "@_fa": "true",
            "$": "https://api.elsevier.com/content/object/eid/1-s2.0-S1381116915300868-gr5.sml?httpAccept=%2A%2F%2A",
            "@multimediatype": "GIF image file",
            "@type": "IMAGE-THUMBNAIL",
            "@size": "15774",
            "@ref": "gr5",
            "@mimetype": "image/gif"
          },
          {
            "@category": "thumbnail",
            "@height": "159",
            "@width": "219",
            "@_fa": "true",
            "$": "https://api.elsevier.com/content/object/eid/1-s2.0-S1381116915300868-gr6.sml?httpAccept=%2A%2F%2A",
            "@multimediatype": "GIF image file",
            "@type": "IMAGE-THUMBNAIL",
            "@size": "16284",
            "@ref": "gr6",
            "@mimetype": "image/gif"
          },
          {
            "@category": "thumbnail",
            "@height": "164",
            "@width": "213",
            "@_fa": "true",
            "$": "https://api.elsevier.com/content/object/eid/1-s2.0-S1381116915300868-gr7.sml?httpAccept=%2A%2F%2A",
            "@multimediatype": "GIF image file",
            "@type": "IMAGE-THUMBNAIL",
            "@size": "15754",
            "@ref": "gr7",
            "@mimetype": "image/gif"
          },
          {
            "@category": "thumbnail",
            "@height": "154",
            "@width": "219",
            "@_fa": "true",
            "$": "https://api.elsevier.com/content/object/eid/1-s2.0-S1381116915300868-gr8.sml?httpAccept=%2A%2F%2A",
            "@multimediatype": "GIF image file",
            "@type": "IMAGE-THUMBNAIL",
            "@size": "13869",
            "@ref": "gr8",
            "@mimetype": "image/gif"
          },
          {
            "@category": "thumbnail",
            "@height": "160",
            "@width": "219",
            "@_fa": "true",
            "$": "https://api.elsevier.com/content/object/eid/1-s2.0-S1381116915300868-gr9.sml?httpAccept=%2A%2F%2A",
            "@multimediatype": "GIF image file",
            "@type": "IMAGE-THUMBNAIL",
            "@size": "17758",
            "@ref": "gr9",
            "@mimetype": "image/gif"
          },
          {
            "@category": "thumbnail",
            "@height": "164",
            "@width": "116",
            "@_fa": "true",
            "$": "https://api.elsevier.com/content/object/eid/1-s2.0-S1381116915300868-sc1.sml?httpAccept=%2A%2F%2A",
            "@multimediatype": "GIF image file",
            "@type": "IMAGE-THUMBNAIL",
            "@size": "11934",
            "@ref": "sc1",
            "@mimetype": "image/gif"
          },
          {
            "@category": "standard",
            "@height": "200",
            "@width": "500",
            "@_fa": "true",
            "$": "https://api.elsevier.com/content/object/eid/1-s2.0-S1381116915300868-fx1.jpg?httpAccept=%2A%2F%2A",
            "@multimediatype": "JPEG image file",
            "@type": "IMAGE-DOWNSAMPLED",
            "@size": "27559",
            "@ref": "fx1",
            "@mimetype": "image/jpeg"
          },
          {
            "@category": "standard",
            "@height": "365",
            "@width": "565",
            "@_fa": "true",
            "$": "https://api.elsevier.com/content/object/eid/1-s2.0-S1381116915300868-gr1.jpg?httpAccept=%2A%2F%2A",
            "@multimediatype": "JPEG image file",
            "@type": "IMAGE-DOWNSAMPLED",
            "@size": "58066",
            "@ref": "gr1",
            "@mimetype": "image/jpeg"
          },
          {
            "@category": "standard",
            "@height": "399",
            "@width": "565",
            "@_fa": "true",
            "$": "https://api.elsevier.com/content/object/eid/1-s2.0-S1381116915300868-gr10.jpg?httpAccept=%2A%2F%2A",
            "@multimediatype": "JPEG image file",
            "@type": "IMAGE-DOWNSAMPLED",
            "@size": "52115",
            "@ref": "gr10",
            "@mimetype": "image/jpeg"
          },
          {
            "@category": "standard",
            "@height": "393",
            "@width": "565",
            "@_fa": "true",
            "$": "https://api.elsevier.com/content/object/eid/1-s2.0-S1381116915300868-gr11.jpg?httpAccept=%2A%2F%2A",
            "@multimediatype": "JPEG image file",
            "@type": "IMAGE-DOWNSAMPLED",
            "@size": "28038",
            "@ref": "gr11",
            "@mimetype": "image/jpeg"
          },
          {
            "@category": "standard",
            "@height": "390",
            "@width": "677",
            "@_fa": "true",
            "$": "https://api.elsevier.com/content/object/eid/1-s2.0-S1381116915300868-gr12.jpg?httpAccept=%2A%2F%2A",
            "@multimediatype": "JPEG image file",
            "@type": "IMAGE-DOWNSAMPLED",
            "@size": "74091",
            "@ref": "gr12",
            "@mimetype": "image/jpeg"
          },
          {
            "@category": "standard",
            "@height": "387",
            "@width": "678",
            "@_fa": "true",
            "$": "https://api.elsevier.com/content/object/eid/1-s2.0-S1381116915300868-gr13.jpg?httpAccept=%2A%2F%2A",
            "@multimediatype": "JPEG image file",
            "@type": "IMAGE-DOWNSAMPLED",
            "@size": "74734",
            "@ref": "gr13",
            "@mimetype": "image/jpeg"
          },
          {
            "@category": "standard",
            "@height": "316",
            "@width": "564",
            "@_fa": "true",
            "$": "https://api.elsevier.com/content/object/eid/1-s2.0-S1381116915300868-gr2.jpg?httpAccept=%2A%2F%2A",
            "@multimediatype": "JPEG image file",
            "@type": "IMAGE-DOWNSAMPLED",
            "@size": "49779",
            "@ref": "gr2",
            "@mimetype": "image/jpeg"
          },
          {
            "@category": "standard",
            "@height": "480",
            "@width": "565",
            "@_fa": "true",
            "$": "https://api.elsevier.com/content/object/eid/1-s2.0-S1381116915300868-gr3.jpg?httpAccept=%2A%2F%2A",
            "@multimediatype": "JPEG image file",
            "@type": "IMAGE-DOWNSAMPLED",
            "@size": "115841",
            "@ref": "gr3",
            "@mimetype": "image/jpeg"
          },
          {
            "@category": "standard",
            "@height": "630",
            "@width": "564",
            "@_fa": "true",
            "$": "https://api.elsevier.com/content/object/eid/1-s2.0-S1381116915300868-gr4.jpg?httpAccept=%2A%2F%2A",
            "@multimediatype": "JPEG image file",
            "@type": "IMAGE-DOWNSAMPLED",
            "@size": "73752",
            "@ref": "gr4",
            "@mimetype": "image/jpeg"
          },
          {
            "@category": "standard",
            "@height": "363",
            "@width": "386",
            "@_fa": "true",
            "$": "https://api.elsevier.com/content/object/eid/1-s2.0-S1381116915300868-gr5.jpg?httpAccept=%2A%2F%2A",
            "@multimediatype": "JPEG image file",
            "@type": "IMAGE-DOWNSAMPLED",
            "@size": "42291",
            "@ref": "gr5",
            "@mimetype": "image/jpeg"
          },
          {
            "@category": "standard",
            "@height": "411",
            "@width": "565",
            "@_fa": "true",
            "$": "https://api.elsevier.com/content/object/eid/1-s2.0-S1381116915300868-gr6.jpg?httpAccept=%2A%2F%2A",
            "@multimediatype": "JPEG image file",
            "@type": "IMAGE-DOWNSAMPLED",
            "@size": "67955",
            "@ref": "gr6",
            "@mimetype": "image/jpeg"
          },
          {
            "@category": "standard",
            "@height": "434",
            "@width": "565",
            "@_fa": "true",
            "$": "https://api.elsevier.com/content/object/eid/1-s2.0-S1381116915300868-gr7.jpg?httpAccept=%2A%2F%2A",
            "@multimediatype": "JPEG image file",
            "@type": "IMAGE-DOWNSAMPLED",
            "@size": "69725",
            "@ref": "gr7",
            "@mimetype": "image/jpeg"
          },
          {
            "@category": "standard",
            "@height": "398",
            "@width": "566",
            "@_fa": "true",
            "$": "https://api.elsevier.com/content/object/eid/1-s2.0-S1381116915300868-gr8.jpg?httpAccept=%2A%2F%2A",
            "@multimediatype": "JPEG image file",
            "@type": "IMAGE-DOWNSAMPLED",
            "@size": "58401",
            "@ref": "gr8",
            "@mimetype": "image/jpeg"
          },
          {
            "@category": "standard",
            "@height": "495",
            "@width": "678",
            "@_fa": "true",
            "$": "https://api.elsevier.com/content/object/eid/1-s2.0-S1381116915300868-gr9.jpg?httpAccept=%2A%2F%2A",
            "@multimediatype": "JPEG image file",
            "@type": "IMAGE-DOWNSAMPLED",
            "@size": "83956",
            "@ref": "gr9",
            "@mimetype": "image/jpeg"
          },
          {
            "@category": "standard",
            "@height": "530",
            "@width": "376",
            "@_fa": "true",
            "$": "https://api.elsevier.com/content/object/eid/1-s2.0-S1381116915300868-sc1.jpg?httpAccept=%2A%2F%2A",
            "@multimediatype": "JPEG image file",
            "@type": "IMAGE-DOWNSAMPLED",
            "@size": "58654",
            "@ref": "sc1",
            "@mimetype": "image/jpeg"
          },
          {
            "@category": "high",
            "@height": "886",
            "@width": "2213",
            "@_fa": "true",
            "$": "https://api.elsevier.com/content/object/eid/1-s2.0-S1381116915300868-fx1_lrg.jpg?httpAccept=%2A%2F%2A",
            "@multimediatype": "JPEG image file",
            "@type": "IMAGE-HIGH-RES",
            "@size": "223519",
            "@ref": "fx1",
            "@mimetype": "image/jpeg"
          },
          {
            "@category": "high",
            "@height": "1616",
            "@width": "2500",
            "@_fa": "true",
            "$": "https://api.elsevier.com/content/object/eid/1-s2.0-S1381116915300868-gr1_lrg.jpg?httpAccept=%2A%2F%2A",
            "@multimediatype": "JPEG image file",
            "@type": "IMAGE-HIGH-RES",
            "@size": "401865",
            "@ref": "gr1",
            "@mimetype": "image/jpeg"
          },
          {
            "@category": "high",
            "@height": "1766",
            "@width": "2500",
            "@_fa": "true",
            "$": "https://api.elsevier.com/content/object/eid/1-s2.0-S1381116915300868-gr10_lrg.jpg?httpAccept=%2A%2F%2A",
            "@multimediatype": "JPEG image file",
            "@type": "IMAGE-HIGH-RES",
            "@size": "279602",
            "@ref": "gr10",
            "@mimetype": "image/jpeg"
          },
          {
            "@category": "high",
            "@height": "1739",
            "@width": "2500",
            "@_fa": "true",
            "$": "https://api.elsevier.com/content/object/eid/1-s2.0-S1381116915300868-gr11_lrg.jpg?httpAccept=%2A%2F%2A",
            "@multimediatype": "JPEG image file",
            "@type": "IMAGE-HIGH-RES",
            "@size": "156717",
            "@ref": "gr11",
            "@mimetype": "image/jpeg"
          },
          {
            "@category": "high",
            "@height": "1726",
            "@width": "2998",
            "@_fa": "true",
            "$": "https://api.elsevier.com/content/object/eid/1-s2.0-S1381116915300868-gr12_lrg.jpg?httpAccept=%2A%2F%2A",
            "@multimediatype": "JPEG image file",
            "@type": "IMAGE-HIGH-RES",
            "@size": "510487",
            "@ref": "gr12",
            "@mimetype": "image/jpeg"
          },
          {
            "@category": "high",
            "@height": "1711",
            "@width": "3000",
            "@_fa": "true",
            "$": "https://api.elsevier.com/content/object/eid/1-s2.0-S1381116915300868-gr13_lrg.jpg?httpAccept=%2A%2F%2A",
            "@multimediatype": "JPEG image file",
            "@type": "IMAGE-HIGH-RES",
            "@size": "529961",
            "@ref": "gr13",
            "@mimetype": "image/jpeg"
          },
          {
            "@category": "high",
            "@height": "1402",
            "@width": "2499",
            "@_fa": "true",
            "$": "https://api.elsevier.com/content/object/eid/1-s2.0-S1381116915300868-gr2_lrg.jpg?httpAccept=%2A%2F%2A",
            "@multimediatype": "JPEG image file",
            "@type": "IMAGE-HIGH-RES",
            "@size": "332759",
            "@ref": "gr2",
            "@mimetype": "image/jpeg"
          },
          {
            "@category": "high",
            "@height": "2126",
            "@width": "2500",
            "@_fa": "true",
            "$": "https://api.elsevier.com/content/object/eid/1-s2.0-S1381116915300868-gr3_lrg.jpg?httpAccept=%2A%2F%2A",
            "@multimediatype": "JPEG image file",
            "@type": "IMAGE-HIGH-RES",
            "@size": "1039117",
            "@ref": "gr3",
            "@mimetype": "image/jpeg"
          },
          {
            "@category": "high",
            "@height": "2786",
            "@width": "2496",
            "@_fa": "true",
            "$": "https://api.elsevier.com/content/object/eid/1-s2.0-S1381116915300868-gr4_lrg.jpg?httpAccept=%2A%2F%2A",
            "@multimediatype": "JPEG image file",
            "@type": "IMAGE-HIGH-RES",
            "@size": "533713",
            "@ref": "gr4",
            "@mimetype": "image/jpeg"
          },
          {
            "@category": "high",
            "@height": "1608",
            "@width": "1708",
            "@_fa": "true",
            "$": "https://api.elsevier.com/content/object/eid/1-s2.0-S1381116915300868-gr5_lrg.jpg?httpAccept=%2A%2F%2A",
            "@multimediatype": "JPEG image file",
            "@type": "IMAGE-HIGH-RES",
            "@size": "208825",
            "@ref": "gr5",
            "@mimetype": "image/jpeg"
          },
          {
            "@category": "high",
            "@height": "1818",
            "@width": "2500",
            "@_fa": "true",
            "$": "https://api.elsevier.com/content/object/eid/1-s2.0-S1381116915300868-gr6_lrg.jpg?httpAccept=%2A%2F%2A",
            "@multimediatype": "JPEG image file",
            "@type": "IMAGE-HIGH-RES",
            "@size": "418325",
            "@ref": "gr6",
            "@mimetype": "image/jpeg"
          },
          {
            "@category": "high",
            "@height": "1922",
            "@width": "2500",
            "@_fa": "true",
            "$": "https://api.elsevier.com/content/object/eid/1-s2.0-S1381116915300868-gr7_lrg.jpg?httpAccept=%2A%2F%2A",
            "@multimediatype": "JPEG image file",
            "@type": "IMAGE-HIGH-RES",
            "@size": "413708",
            "@ref": "gr7",
            "@mimetype": "image/jpeg"
          },
          {
            "@category": "high",
            "@height": "1765",
            "@width": "2507",
            "@_fa": "true",
            "$": "https://api.elsevier.com/content/object/eid/1-s2.0-S1381116915300868-gr8_lrg.jpg?httpAccept=%2A%2F%2A",
            "@multimediatype": "JPEG image file",
            "@type": "IMAGE-HIGH-RES",
            "@size": "336540",
            "@ref": "gr8",
            "@mimetype": "image/jpeg"
          },
          {
            "@category": "high",
            "@height": "2192",
            "@width": "3000",
            "@_fa": "true",
            "$": "https://api.elsevier.com/content/object/eid/1-s2.0-S1381116915300868-gr9_lrg.jpg?httpAccept=%2A%2F%2A",
            "@multimediatype": "JPEG image file",
            "@type": "IMAGE-HIGH-RES",
            "@size": "642272",
            "@ref": "gr9",
            "@mimetype": "image/jpeg"
          },
          {
            "@category": "high",
            "@height": "2351",
            "@width": "1667",
            "@_fa": "true",
            "$": "https://api.elsevier.com/content/object/eid/1-s2.0-S1381116915300868-sc1_lrg.jpg?httpAccept=%2A%2F%2A",
            "@multimediatype": "JPEG image file",
            "@type": "IMAGE-HIGH-RES",
            "@size": "428135",
            "@ref": "sc1",
            "@mimetype": "image/jpeg"
          },
          {
            "@category": "thumbnail",
            "@height": "39",
            "@width": "230",
            "@_fa": "true",
            "$": "https://api.elsevier.com/content/object/eid/1-s2.0-S1381116915300868-si1.gif?httpAccept=%2A%2F%2A",
            "@multimediatype": "GIF image file",
            "@type": "ALTIMG",
            "@size": "1032",
            "@ref": "si1",
            "@mimetype": "image/gif"
          },
          {
            "@category": "thumbnail",
            "@height": "34",
            "@width": "79",
            "@_fa": "true",
            "$": "https://api.elsevier.com/content/object/eid/1-s2.0-S1381116915300868-si2.gif?httpAccept=%2A%2F%2A",
            "@multimediatype": "GIF image file",
            "@type": "ALTIMG",
            "@size": "342",
            "@ref": "si2",
            "@mimetype": "image/gif"
          },
          {
            "@category": "thumbnail",
            "@height": "18",
            "@width": "65",
            "@_fa": "true",
            "$": "https://api.elsevier.com/content/object/eid/1-s2.0-S1381116915300868-si3.gif?httpAccept=%2A%2F%2A",
            "@multimediatype": "GIF image file",
            "@type": "ALTIMG",
            "@size": "342",
            "@ref": "si3",
            "@mimetype": "image/gif"
          }
        ]
      },
      "link": {
        "@rel": "abstract",
        "@href": "https://api.elsevier.com/content/abstract/scopus_id/84943160113"
      }
    }
  }
}