{
  "metadata": {
    "title": "Effects of oxide supports on ethylene epoxidation activity over Ag-based catalysts",
    "authors": "; ; ",
    "journal": "Journal of Molecular Catalysis A: Chemical",
    "date": "2012-06-30",
    "doi": "10.1016/j.molcata.2012.02.011",
    "abstract": "",
    "uri": "https://api.elsevier.com/content/article/pii/S1381116912000726",
    "pii": "S1381116912000726"
  },
  "fulltext": {
    "full-text-retrieval-response": {
      "scopus-eid": "2-s2.0-84860300945",
      "originalText": "serial JL 271358 291210 291744 291790 291809 31 Journal of Molecular Catalysis A: Chemical JOURNALMOLECULARCATALYSISACHEMICAL 2012-02-25 2012-02-25 2022-05-11T18:58:23 1-s2.0-S1381116912000726 S1381-1169(12)00072-6 S1381116912000726 10.1016/j.molcata.2012.02.011 S300 S300.2 FULL-TEXT 1-s2.0-S1381116912X00049 2022-05-11T21:51:52.193891Z 0 0 20120601 20120630 2012 2012-02-25T00:00:00Z absattachment articleinfo articletitlenorm authfirstinitialnorm authfirstsurnamenorm cid cids contenttype copyright crossmark dateloaded dateloadedtxt datesearch datesort dateupdated dco docsubtype doctype doi eid ewtransactionid hubeid indexeddate issn issnnorm itemstage itemtransactionid itemweight openaccess openarchive pg pgfirst pglast pii piinorm pubdateend pubdatestart pubdatetxt pubyr sectiontitle sortorder srctitle srctitlenorm srctype ssids alllist content subj subheadings suppl tomb volfirst volissue volumelist webpdf webpdfpagecount yearnav figure table body mmlmath acknowledge affil articletitle auth authfirstini authfull authkeywords authlast grantsponsor primabst ref specialabst 1381-1169 13811169 false 358 358 C Volume 358 9 58 66 58 66 201206 June 2012 2012-06-01 2012-06-30 2012 Regular Papers article fla Copyright © 2012 Elsevier B.V. All rights reserved. EFFECTSOXIDESUPPORTSETHYLENEEPOXIDATIONACTIVITYOVERAGBASEDCATALYSTS CHONGTERDTOONSKUL A 1 Introduction 2 Experimental 2.1 Materials 2.2 Catalyst preparation procedures 2.3 Catalyst characterization techniques 2.4 Activity testing experiments 3 Results and discussion 3.1 Catalyst characterization results 3.1.1 Specific surface area results 3.1.2 Metal dispersion results 3.1.3 Surface morphology 3.1.4 XRD results 3.1.5 TPD profiles of oxygen 3.1.6 TPD profiles of ethylene 3.1.7 XPS results 3.2 Ethylene epoxidation activity results 4 Conclusions Acknowledgments References JANKOWIAK 2005 379 386 J KIM 2003 153 162 Y LACSON 2003 J CHEMICALECONOMICSHANDBOOK ETHYLENEOXIDE ERTL 1997 G HANDBOOKHETEROGENEOUSCATALYSIS YONG 1991 31 39 Y MATAR 1989 S CATALYSISINPETROCHEMICALPROCESSES ROJLUECHAI 2007 57 64 S HARRIOTT 1971 56 64 P BECK 1992 1 11 J FOTOPOULOS 2007 148 156 A PUANGPETCH 2008 70 79 T AYAME 2003 59 70 A HOFLUND 1996 517 521 G LINIC 2003 4034 4035 S SERAFIN 1998 157 168 J HASSANI 2009 948 952 S CHRISTOPHER 2010 78 83 P PUANGPETCH 2009 97 106 T PUANGPETCH 2010 6531 6540 T PUANGPETCH 2010 12428 12442 T PUANGPETCH 2011 2256 2261 T CULLITY 1978 B ELEMENTSXRAYDIFFRACTION JACKSON 1991 A HANDBOOKCRYSTALLOGRAPHY MOULDER 1995 J SMITH 1960 J XRAYPOWDERDATAFILE OZBEK 2011 150 153 M SANTEN 1987 265 321 R LU 2005 85 95 J ZEMICHEAEL 2002 93 F GAO 2010 173 178 Z CHONGTERDTOONSKULX2012X58 CHONGTERDTOONSKULX2012X58X66 CHONGTERDTOONSKULX2012X58XA CHONGTERDTOONSKULX2012X58X66XA 0 item S1381-1169(12)00072-6 S1381116912000726 1-s2.0-S1381116912000726 10.1016/j.molcata.2012.02.011 271358 2022-05-11T21:51:52.193891Z 2012-06-01 2012-06-30 1-s2.0-S1381116912000726-main.pdf https://s3-eu-west-1.amazonaws.com/prod-ucs-content-store-eu-west/content/pii:S1381116912000726/MAIN/application/pdf/a38723e70402566cf28db71885642bb9/main.pdf main.pdf pdf true 1948056 MAIN 9 1-s2.0-S1381116912000726-main_1.png https://s3-eu-west-1.amazonaws.com/prod-ucs-content-store-eu-west/content/pii:S1381116912000726/PREVIEW/image/png/0b2f4f49adfe83a61e8191d3913ede3f/main_1.png main_1.png png 65340 849 656 IMAGE-WEB-PDF 1 1-s2.0-S1381116912000726-fx1.jpg https://s3-eu-west-1.amazonaws.com/prod-ucs-content-store-eu-west/content/pii:S1381116912000726/fx1/DOWNSAMPLED/image/jpeg/a92b61046e28e97bb129facd18012ac8/fx1.jpg fx1 true fx1.jpg jpg 9099 200 341 IMAGE-DOWNSAMPLED 1-s2.0-S1381116912000726-gr1.jpg https://s3-eu-west-1.amazonaws.com/prod-ucs-content-store-eu-west/content/pii:S1381116912000726/gr1/DOWNSAMPLED/image/jpeg/9c46d8976d5fe974f5c79eafe168dee5/gr1.jpg gr1 gr1.jpg jpg 132270 579 526 IMAGE-DOWNSAMPLED 1-s2.0-S1381116912000726-gr10.jpg https://s3-eu-west-1.amazonaws.com/prod-ucs-content-store-eu-west/content/pii:S1381116912000726/gr10/HIGHRES/image/jpeg/3e67eddccf6e8e866b60bbe5f5f125f5/gr10.jpg gr10 gr10.jpg jpg 17245 224 369 IMAGE-DOWNSAMPLED 1-s2.0-S1381116912000726-gr2.jpg https://s3-eu-west-1.amazonaws.com/prod-ucs-content-store-eu-west/content/pii:S1381116912000726/gr2/DOWNSAMPLED/image/jpeg/4651531a237492c027e63226c7180700/gr2.jpg gr2 gr2.jpg jpg 63080 535 504 IMAGE-DOWNSAMPLED 1-s2.0-S1381116912000726-gr3.jpg https://s3-eu-west-1.amazonaws.com/prod-ucs-content-store-eu-west/content/pii:S1381116912000726/gr3/THUMBNAIL/image/jpeg/d3d256c79121d74d8d550512714bccb3/gr3.jpg gr3 gr3.jpg jpg 79378 692 323 IMAGE-DOWNSAMPLED 1-s2.0-S1381116912000726-gr4.jpg https://s3-eu-west-1.amazonaws.com/prod-ucs-content-store-eu-west/content/pii:S1381116912000726/gr4/DOWNSAMPLED/image/jpeg/21685c766c59e926bc4ac2159926608a/gr4.jpg gr4 gr4.jpg jpg 23415 246 384 IMAGE-DOWNSAMPLED 1-s2.0-S1381116912000726-gr5.jpg https://s3-eu-west-1.amazonaws.com/prod-ucs-content-store-eu-west/content/pii:S1381116912000726/gr5/DOWNSAMPLED/image/jpeg/4f42c18709e6d6d6127787ce645a92ad/gr5.jpg gr5 gr5.jpg jpg 20740 244 383 IMAGE-DOWNSAMPLED 1-s2.0-S1381116912000726-gr6.jpg https://s3-eu-west-1.amazonaws.com/prod-ucs-content-store-eu-west/content/pii:S1381116912000726/gr6/DOWNSAMPLED/image/jpeg/630026f5af24f1edd24c854895f5d30e/gr6.jpg gr6 gr6.jpg jpg 18721 273 386 IMAGE-DOWNSAMPLED 1-s2.0-S1381116912000726-gr7.jpg https://s3-eu-west-1.amazonaws.com/prod-ucs-content-store-eu-west/content/pii:S1381116912000726/gr7/DOWNSAMPLED/image/jpeg/9cedd8804375dc7d14c0750d6c597fe7/gr7.jpg gr7 gr7.jpg jpg 19021 274 392 IMAGE-DOWNSAMPLED 1-s2.0-S1381116912000726-gr8.jpg https://s3-eu-west-1.amazonaws.com/prod-ucs-content-store-eu-west/content/pii:S1381116912000726/gr8/HEAD-ONLY/image/jpeg/e1d79c5ef89e8678feb06c5619b66247/gr8.jpg gr8 gr8.jpg jpg 59786 419 707 IMAGE-DOWNSAMPLED 1-s2.0-S1381116912000726-gr9.jpg https://s3-eu-west-1.amazonaws.com/prod-ucs-content-store-eu-west/content/pii:S1381116912000726/gr9/DOWNSAMPLED/image/jpeg/dd2182437b32034e15af64620c13d4c7/gr9.jpg gr9 gr9.jpg jpg 19157 451 380 IMAGE-DOWNSAMPLED 1-s2.0-S1381116912000726-fx1.sml https://s3-eu-west-1.amazonaws.com/prod-ucs-content-store-eu-west/content/pii:S1381116912000726/fx1/THUMBNAIL/image/gif/b1db0451de859749d2758c5c16d01f06/fx1.sml fx1 true fx1.sml sml 3094 128 219 IMAGE-THUMBNAIL 1-s2.0-S1381116912000726-gr1.sml https://s3-eu-west-1.amazonaws.com/prod-ucs-content-store-eu-west/content/pii:S1381116912000726/gr1/THUMBNAIL/image/gif/51ecf7fa0f15945c24e62d4cee34812b/gr1.sml gr1 gr1.sml sml 18393 164 149 IMAGE-THUMBNAIL 1-s2.0-S1381116912000726-gr10.sml https://s3-eu-west-1.amazonaws.com/prod-ucs-content-store-eu-west/content/pii:S1381116912000726/gr10/THUMBNAIL/image/gif/f5205259992f6f5fab6d085247a9abe2/gr10.sml gr10 gr10.sml sml 4730 133 219 IMAGE-THUMBNAIL 1-s2.0-S1381116912000726-gr2.sml https://s3-eu-west-1.amazonaws.com/prod-ucs-content-store-eu-west/content/pii:S1381116912000726/gr2/THUMBNAIL/image/gif/22fe5b8020db259e0c2f53618d4bbd28/gr2.sml gr2 gr2.sml sml 12746 163 154 IMAGE-THUMBNAIL 1-s2.0-S1381116912000726-gr3.sml https://s3-eu-west-1.amazonaws.com/prod-ucs-content-store-eu-west/content/pii:S1381116912000726/gr3/THUMBNAIL/image/gif/770aa6d7c1db9473564ba146ca7833f6/gr3.sml gr3 gr3.sml sml 8412 163 76 IMAGE-THUMBNAIL 1-s2.0-S1381116912000726-gr4.sml https://s3-eu-west-1.amazonaws.com/prod-ucs-content-store-eu-west/content/pii:S1381116912000726/gr4/THUMBNAIL/image/gif/39819e6759ac8d473d0ed6dd571770f1/gr4.sml gr4 gr4.sml sml 6715 140 219 IMAGE-THUMBNAIL 1-s2.0-S1381116912000726-gr5.sml https://s3-eu-west-1.amazonaws.com/prod-ucs-content-store-eu-west/content/pii:S1381116912000726/gr5/THUMBNAIL/image/gif/5d4448a96df3d3091c18130611509ab7/gr5.sml gr5 gr5.sml sml 6401 139 219 IMAGE-THUMBNAIL 1-s2.0-S1381116912000726-gr6.sml https://s3-eu-west-1.amazonaws.com/prod-ucs-content-store-eu-west/content/pii:S1381116912000726/gr6/MAIN/image/gif/c12c1b1d5cd64202709d0cb1d55de636/gr6.sml gr6 gr6.sml sml 5315 155 219 IMAGE-THUMBNAIL 1-s2.0-S1381116912000726-gr7.sml https://s3-eu-west-1.amazonaws.com/prod-ucs-content-store-eu-west/content/pii:S1381116912000726/gr7/THUMBNAIL/image/gif/83e9707fe7f016823b9d0a5daee70be0/gr7.sml gr7 gr7.sml sml 5109 153 219 IMAGE-THUMBNAIL 1-s2.0-S1381116912000726-gr8.sml https://s3-eu-west-1.amazonaws.com/prod-ucs-content-store-eu-west/content/pii:S1381116912000726/gr8/THUMBNAIL/image/gif/d8c9a73491d727f1562a0d1f3845361e/gr8.sml gr8 gr8.sml sml 6028 130 219 IMAGE-THUMBNAIL 1-s2.0-S1381116912000726-gr9.sml https://s3-eu-west-1.amazonaws.com/prod-ucs-content-store-eu-west/content/pii:S1381116912000726/gr9/THUMBNAIL/image/gif/9eae93cd357959510cc65c00b2eaaf35/gr9.sml gr9 gr9.sml sml 2658 164 138 IMAGE-THUMBNAIL 1-s2.0-S1381116912000726-fx1_lrg.jpg https://s3-eu-west-1.amazonaws.com/prod-ucs-content-store-eu-west/content/pii:S1381116912000726/THUMBNAIL/image/jpeg/d1735f809c05066a756a3e5bdfe2f885/fx1_lrg.jpg fx1 true fx1_lrg.jpg jpg 58944 886 1510 IMAGE-HIGH-RES 1-s2.0-S1381116912000726-gr1_lrg.jpg https://s3-eu-west-1.amazonaws.com/prod-ucs-content-store-eu-west/content/pii:S1381116912000726/HIGHRES/image/jpeg/d1800037c3d984ba5d07bddd070b4e26/gr1_lrg.jpg gr1 gr1_lrg.jpg jpg 1761400 2564 2331 IMAGE-HIGH-RES 1-s2.0-S1381116912000726-gr10_lrg.jpg https://s3-eu-west-1.amazonaws.com/prod-ucs-content-store-eu-west/content/pii:S1381116912000726/DOWNSAMPLED/image/jpeg/2441de7fc39a4935e44cc043890c2ad8/gr10_lrg.jpg gr10 gr10_lrg.jpg jpg 114413 991 1636 IMAGE-HIGH-RES 1-s2.0-S1381116912000726-gr2_lrg.jpg https://s3-eu-west-1.amazonaws.com/prod-ucs-content-store-eu-west/content/pii:S1381116912000726/HIGHRES/image/jpeg/7d2e946f6b977c7bbe116f739247c342/gr2_lrg.jpg gr2 gr2_lrg.jpg jpg 993790 2367 2231 IMAGE-HIGH-RES 1-s2.0-S1381116912000726-gr3_lrg.jpg https://s3-eu-west-1.amazonaws.com/prod-ucs-content-store-eu-west/content/pii:S1381116912000726/HIGHRES/image/jpeg/7aad910144b2146d477ac638856c3afb/gr3_lrg.jpg gr3 gr3_lrg.jpg jpg 939617 3067 1432 IMAGE-HIGH-RES 1-s2.0-S1381116912000726-gr4_lrg.jpg https://s3-eu-west-1.amazonaws.com/prod-ucs-content-store-eu-west/content/pii:S1381116912000726/HIGHRES/image/jpeg/906d631ed42589ac3ebff9f4d591eccc/gr4_lrg.jpg gr4 gr4_lrg.jpg jpg 199749 1088 1700 IMAGE-HIGH-RES 1-s2.0-S1381116912000726-gr5_lrg.jpg https://s3-eu-west-1.amazonaws.com/prod-ucs-content-store-eu-west/content/pii:S1381116912000726/HIGHRES/image/jpeg/37a8eeec8802c290cb36f8718248129d/gr5_lrg.jpg gr5 gr5_lrg.jpg jpg 193785 1080 1696 IMAGE-HIGH-RES 1-s2.0-S1381116912000726-gr6_lrg.jpg https://s3-eu-west-1.amazonaws.com/prod-ucs-content-store-eu-west/content/pii:S1381116912000726/HIGHRES/image/jpeg/e9a35b27c0892c27fea8479c96405c42/gr6_lrg.jpg gr6 gr6_lrg.jpg jpg 141414 1206 1708 IMAGE-HIGH-RES 1-s2.0-S1381116912000726-gr7_lrg.jpg https://s3-eu-west-1.amazonaws.com/prod-ucs-content-store-eu-west/content/pii:S1381116912000726/HIGHRES/image/jpeg/527c5084967c0c84de2001dca5e342fd/gr7_lrg.jpg gr7 gr7_lrg.jpg jpg 151009 1213 1737 IMAGE-HIGH-RES 1-s2.0-S1381116912000726-gr8_lrg.jpg https://s3-eu-west-1.amazonaws.com/prod-ucs-content-store-eu-west/content/pii:S1381116912000726/HIGHRES/image/jpeg/15aa4e95adc197e39b558560e16a5b73/gr8_lrg.jpg gr8 gr8_lrg.jpg jpg 483080 1856 3132 IMAGE-HIGH-RES 1-s2.0-S1381116912000726-gr9_lrg.jpg https://s3-eu-west-1.amazonaws.com/prod-ucs-content-store-eu-west/content/pii:S1381116912000726/HIGHRES/image/jpeg/931df083a015e330db75dec18c629582/gr9_lrg.jpg gr9 gr9_lrg.jpg jpg 126770 1995 1682 IMAGE-HIGH-RES 1-s2.0-S1381116912000726-si1.gif https://s3-eu-west-1.amazonaws.com/prod-ucs-content-store-eu-west/content/pii:S1381116912000726/STRIPIN/image/gif/48d0d368d0ca3ed1276227af918593ae/si1.gif si1 si1.gif gif 452 33 89 ALTIMG MOLCAA 8373 S1381-1169(12)00072-6 10.1016/j.molcata.2012.02.011 Elsevier B.V. Fig. 1 SEM images of SrTiO3 catalysts without Ag loading (a) and with Ag loadings of 12.38wt% (b), 13.41wt% (c), 14.85wt% (d), 17.16wt% (e), and 19.74wt% (f). Fig. 2 TEM images of 17.16wt% Ag/SrTiO3 catalyst: (a) bright-field image, (b) z-contrast image, (c) SAD pattern, and (d) Ag (110) plane. Fig. 3 TEM images of (a) 13.16wt% Ag/Al2O3 C, and (b) 14.86wt% Ag/α-Al2O3. Fig. 4 XRD patterns of Ag/SrTiO3 catalysts with various Ag loadings. Fig. 5 XRD patterns of Ag catalysts on different supports at their optimum Ag loadings. Fig. 6 TPD profiles of O2 of studied Ag-loaded catalysts on different supports at their optimum Ag loadings. Fig. 7 TPD profiles of C2H4 of studied Ag-loaded catalysts on different supports. Fig. 8 Deconvoluted Ag 3d XPS peaks of 17.16wt% Ag/SrTiO3 catalyst: (a) before the reaction and (b) after the reaction. Fig. 9 EO yield (a) and EO selectivity (b) as a function of Ag loading on SrTiO3 and TiO2 supports. Fig. 10 EO selectivity and EO yield as a function of time on stream for 17.16wt% Ag/SrTiO3 catalyst. Table 1 Characteristics of Ag catalysts on different supports at optimum Ag loadings. Support Ag loading (wt%) Specific surface area (m2/g) Ag dispersion a (%) Ag specific surface area a Ag particle size b (nm) Ag crystallite size c (nm) m2/gsample m2/gmetal α-Al2O3 14.86 0.03 (0.1) d 0.03 0.02 0.15 43.6±0.4 49.8 Al2O3 C 13.16 89.8 (98.3) d 0.06 0.04 0.31 27.7±0.5 30.6 Al2O3,Acid 14.90 108.5 (123.0) d 0.08 0.06 0.37 25.1±0.5 27.9 SiO2 90 14.71 58.8 (86.9) d 0.19 0.14 0.90 42.1±0.4 41.5 SrTiO3 17.16 3.0 (4.4) d 0.03 0.03 0.16 58.6±0.4 52.1 TiO2 14.67 28.6 (36.7) d – – – 44.4±0.5 43.2 a From H2 chemisorption analysis. b From TEM analysis. c From XRD analysis. d Specific surface area of support without Ag loading. Table 2 Ethylene epoxidation activity of selected Ag-loaded catalysts at different reaction temperatures (6% O2 and 6% C2H4 balanced with He, a space velocity of 6000h−1, a pressure of 24.7psia). Support Optimum Ag loading (wt%) Reaction temperature (K) C2H4 conversion (%) EO selectivity (%) EO yield (%) α-Al2O3 14.86 498 1.7 98.1 1.7 523 2.7 87.5 2.3 548 3.6 77.4 2.8 563 4.6 38.5 1.8 Al2O3 C 13.16 498 0.8 96.5 0.8 523 1.4 89.9 1.2 548 3.9 86.7 3.4 563 4.9 27.0 1.3 Al2O3,Acid 14.90 498 2.1 99.2 2.1 523 3.3 96.4 3.2 548 4.0 64.9 2.6 563 4.5 48.2 2.2 573 5.1 19.2 1.0 SiO2 90 14.71 498 1.9 84.3 1.6 523 3.6 82.1 3.0 548 4.4 86.4 3.8 563 5.0 17.3 0.9 SrTiO3 17.16 498 0.9 97.4 0.9 523 2.3 97.7 2.2 548 4.6 99.0 4.5 563 4.8 51.1 2.5 TiO2 14.67 498 1.0 76.8 0.8 523 1.3 72.9 0.9 548 2.5 69.7 1.8 563 3.0 10.2 0.3 Table 3 TPD results of O2 and C2H4 of studied Ag-loaded catalysts on different supports at their optimum Ag loadings (temperature range of 500–800K for O2 and 400–800K for C2H4). Support Optimum Ag loading(wt%) O2 uptake(μmolg−1) C2H4 uptake(μmolg−1) α-Al2O3 14.86 6 0 Al2O3 C 13.16 236 185 Al2O3,Acid 14.90 1929 2317 SiO2 90 14.71 147 103 SrTiO3 17.16 6381 7534 TiO2 14.67 407 – Table 4 Coke formation on spent Ag-loaded catalysts after the ethylene epoxidation reaction (6% O2 and 6% C2H4 balanced with He, a space velocity of 6000h−1, a pressure of 24.7psia). Support Optimum Ag loading (wt%) Optimum reaction temperature from Table 2 (K) Coke formation (%) α-Al2O3 14.86 548 4.3 Al2O3 C 13.16 548 2.3 Al2O3,Acid 14.90 523 1.7 SiO2 90 14.71 548 10.9 SrTiO3 17.16 548 6.8 TiO2 14.67 548 6.7 Effects of oxide supports on ethylene epoxidation activity over Ag-based catalysts Atiporn Chongterdtoonskul a Johannes W. Schwank c Sumaeth Chavadej a b ⁎ a The Petroleum and Petrochemical College, Chulalongkorn University, Soi Chula 12, Phyathai Road, Pathumwan, Bangkok 10330, Thailand b Center of Excellence on Petrochemical and Materials Technology, Chulalongkorn University, Bangkok 10330, Thailand c Department of Chemical Engineering, University of Michigan, Ann Arbor, MI 48109, USA ⁎ Corresponding author at: The Petroleum and Petrochemical College, Chulalongkorn University, Soi Chula 12, Phyathai Road, Pathumwan, Bangkok 10330, Thailand. Tel.: +66 2 218 4139; fax: +66 2 218 4139. Graphical abstract EO selectivity as a function of Ag loading on SrTiO3 and TiO2 supports (6% O2 and 6% C2H4 balanced with He, a space velocity of 6000h−1, a pressure of 24.7psia, a temperature of 548K). Highlights ► The effects of various oxide supports for Ag catalysts on EO selectivity and yield were studied. ► Ag/SrTiO3 was an effective catalyst for ethylene epoxidation (high EO selectivity and yield). ► The 17.16wt% Ag/SrTiO3 gave the highest EO yield of 4.5% with the selectivity 99%. ► It produced no CO2 at the reaction temperature below 548K. ► The superior performance may be related to its higher oxygen and ethylene adsorption ability. In this study, Ag-based catalysts with different loadings on various oxide supports, including low-surface-area α-Al2O3, Al2O3 C, Al2O3,Acid, SiO2 90, TiO2 and SrTiO3 synthesized by a sol–gel process, were investigated for ethylene epoxidation over a range of reaction temperatures. The specific surface area, crystallinity, surface morphology, oxidation state, metal crystallite size, and oxygen and ethylene adsorption characteristics of all prepared catalysts were characterized and correlated to the ethylene epoxidation activity. Compared with conventional Ag catalysts supported on low-surface-area α-Al2O3, the 17.16wt% Ag/SrTiO3 catalyst exhibited much better catalytic activity for the ethylene epoxidation reaction, providing both the highest EO yield of 4.5% and EO selectivity up to 99%. The results indicate that high oxygen and ethylene uptakes, together with the large size of Ag particles, play an important role in achieving the best catalytic activity of the Ag/SrTiO3 catalyst towards ethylene epoxidation reaction. Keywords Ethylene epoxidation SrTiO3 Sol–gel α-Alumina Ag 1 Introduction The epoxidation of ethylene to ethylene oxide (EO) over Ag catalysts is an important industrial process since EO is one of the highest volume petrochemicals, accounting for approximately 40–50% of the total value of organic chemicals with 86% of the global capacity utilization [1,2]. Moreover, the world consumption of EO in 2009 was 19million metric tons per year, making it the most utilized epoxide species [3]. It is mainly used to produce ethylene glycol (EG) and surface-active agents. Several dozen important fine chemical intermediates are derivatives of EO. In addition, it is extensively used in other various applications, such as washing/dying, electronics, pharmaceuticals, pesticides, textiles, papermaking, and automobile parts. The most widely used process for EO production is the direct catalytic oxidation of ethylene with air or oxygen over Ag-based catalysts [4]. According to the high selectivity towards ethylene epoxidation, as well as their inertness for the isomerization of EO to acetaldehyde, the industrial catalyst supports of α-Al2O3, especially low surface area α-Al2O3 (specific surface area<1m2/g), with high Ag loadings are widely used [5]. However, these catalysts possess relatively low yields of EO as a result of poorly dispersed Ag particles on these commercial Al2O3 supports [6]. Therefore, there is a motivation to develop new catalysts with alternative supports to offer higher catalytic performance of ethylene epoxidation. In industrial practice, a typical per pass ethylene conversions is 20–30% with 79–80% selectivity. The reaction temperature is usually controlled in the range of 493–548K, with pressures in the range of 1–3MPa (10–30atm.) [4]. There were a number of studies about the effect of supports on epoxidation of ethylene. Rojluechai et al. [7,8] reported in a catalytic activity study of Au, Ag, and Au–Ag catalysts on Al2O3, TiO2, and CeO2 that the support played an important role in the ethylene epoxidation reaction. The best performance for ethylene epoxidation was found to occur over Ag catalysts supported on Al2O3 with the optimum Ag loading of 13.18wt%, while on Ag catalysts supported on TiO2 or CeO2 only total oxidation was observed. Apart from Al2O3, Ag catalysts supported on relatively high surface area SiO2 (specific surface area up to ca. 350m2/g) were also reported to be active for EO production, giving in some cases EO selectivity similar to that obtained with low surface area α-Al2O3 [9]. Beck et al. [10] developed mesoporous silicates to reduce the mass diffusion limitations and to provide the acidic properties of the microporous zeolitic aluminosilicates, which directly affected the catalytic activity. The very high surface area and narrow pore size distributions of these supports allowed uniform dispersion of metal active sites even at high metal loadings, without inducing any negative effects on catalytic reaction rates due to diffusion limitations. Fotopoulos and Triantafyllidis [11] compared the ethylene epoxidation activity of Ag catalysts supported on non-porous SiO2, microporous silicalite zeolite, and MCM-41 and HMS mesoporous silicates to conventional low surface area α-Al2O3. They found that the Ag catalysts supported on MCM-41 and HMS mesoporous silicates were active in ethylene epoxidation reaction, exhibiting EO selectivity similar to or slightly lower than those of the Ag catalysts supported on non-porous SiO2 and conventional low surface area α-Al2O3 at a relatively low temperature (∼503K). Among the two types of mesoporous silicates, the HMS with wormhole-like structure was a more appropriate support for moderate Ag loadings (up to ca. 20wt%). The main benefit of using HMS and MCM-41 mesoporous materials is their ability to support very high Ag loadings (ca. 40wt%) without increasing Ag crystallite size to more than ca. 20nm. As a consequence, the highly loaded mesoporous-based catalysts showed very high ethylene conversion (up to 65%) at a relatively low temperature (∼493K), with acceptable EO selectivity (∼30–35%). So far, there have been some attempts to develop new mesoporous supports with uniform porous structures to improve the activity towards specific reactions. Particularly, Puangpetch et al. [12] successfully synthesized mesoporous-assembled SrTiO3 nanocrystals via a sol–gel process with the aid of a structure-directing surfactant. These mesoporous-assembled structures with a high pore uniformity of SrTiO3 proved to be active for photocatalytic water splitting. One of the objectives of this work was to explore the use of this mesoporous-structured SrTiO3 as the support for Ag, as it was hypothesized to facilitate the formation of uniform nanosized Ag particles at high Ag loadings which can, in turn, facilitate the epoxidation reaction. Furthermore, some researchers tried to modify conventional supports [13,14] or to study some specific process parameters to enhance the EO selectivity [15]. Serafin [16] reviewed the silver-catalyzed epoxidation of ethylene from both a surface-science as well as industrial perspective, and discussed the roles of promoters and moderators. Hassani et al. [17] compared different impregnation techniques on α-Al2O3 support to make catalysts with high Ag contents and dispersion using silver nitrate and silver oxide together with oxalic and lactic acids. They claimed that the catalysts prepared by their method provided much higher Ag dispersion than commercial catalysts. Moreover, Christopher and Linic [18] concluded that the selectivity for ethylene oxide was governed by the nature of the Ag surface facets, the abundance of unselective under-coordinated surface sites, and the operating conditions. They showed experimentally that the reaction selectivity could be manipulated by controlling the shape and size of Ag particles. The Ag nanocubes exhibited higher selectivity than either Ag nanowires or nanospheres. For a given shape, larger particles offered a higher EO selectivity. From all of the previous studies, it can be concluded that the nature of the support and Ag particle size significantly affect the ethylene epoxidation activity and selectivity. In this work, the effects of various oxide supports for Ag catalysts on EO selectivity and yield were investigated. The catalytic performance was correlated with the physical properties of the prepared catalysts, including specific surface area, crystallinity, Ag particle size, surface morphology, oxidation state, and oxygen and ethylene adsorption characteristics. The Ag catalyst supported on α-Al2O3 was used as a benchmark catalyst for catalytic activity in comparisons with Ag catalysts on various oxide supports under atmospheric pressure, leading to low conversions of both ethylene and oxygen as compared to most industrial reactors operated at a very high pressure with recycling to yield much higher conversions, as mentioned before. However, both EO selectivity and yield could be used to compare the catalytic activities of all synthesized Ag catalysts on different oxide supports. 2 Experimental 2.1 Materials Aluminium oxide C (Al2O3, 85–115m2/g) and hydrophilic fumed silica 90 (SiO2, 75–105m2/g) were obtained from Degussa AG. α-Al2O3 (0.109m2/g) was supplied by Fluka. Al2O3,Acid was supplied by Aldrich. Silver nitrate (AgNO3) was supplied by S.R. Lab. Tetraisopropyl orthotitanate (TIPT, Ti(OCH(CH3)2)4), strontium nitrate (Sr(NO3)2), and laurylamine (LA, CH3(CH2)11NH2) were purchased from Merck. Acetylacetone (ACA, CH3COCH2COCH3) was obtained from S.D. Fine-Chemical. Analytical grade Hydrochloric acid (HCl) and ethanol (C2H5OH) were purchased from Labscan. All chemicals were used without further purification. 2.2 Catalyst preparation procedures In this work, all supported Ag catalysts were prepared by the incipient wetness impregnation. Various aluminium oxides (Al2O3 C, α-Al2O3, and Al2O3,Acid) were impregnated with an aqueous silver nitrate solution to achieve nominal Ag loadings of 10, 13.5, 15, and 20wt%. After the impregnation step, the catalysts were dried at 383K overnight, followed by calcination in air at 773K for 5h. Apart from the synthesis of Ag catalysts on various Al2O3 materials, Ag catalysts on SiO2 90 and mesoporous-assembled SrTiO3 were also prepared to achieve various nominal Ag loadings by the same procedure. The mesoporous-assembled SrTiO3 support was synthesized by a sol–gel process with the aid of a structure-directing surfactant [12,19–22]. Firstly, the TIPT and ACA with a molar ratio of 1:1 were mixed together. The mixed TIPT/ACA solution was gently shaken until homogeneous mixing was achieved. A required amount of Sr(NO3)2, based on the Sr-to-Ti molar ratio of 1:1, was dissolved in 24ml of distilled water in a separate beaker. Next, 36ml of ethanol was mixed with the as-prepared Sr(NO3)2 solution. After that, 1.112g of the LA and 0.5ml of HCl were added to obtain the Sr(NO3)2/LA/HCl solution. The Sr(NO3)2/LA/HCl solution was poured into the TIPT/ACA solution. The final mixture was continuously stirred at room temperature until a homogeneous transparent sol was obtained. Then, the sol-containing solution was placed in an oven at 353K for 4d for complete gelation. Afterwards, the gel was dried at 353K for 4d to eliminate the solvents. Finally, the dried gel was calcined at 773K to produce the desired mesoporous-assembled SrTiO3 support. The synthesized SrTiO3 support was then impregnated to obtain various Ag loadings by the incipient wetness impregnation procedure explained above. In addition, a nanocrystalline mesoporous TiO2 support was synthesized via a sol–gel process with surfactant-assisted template in a TIPT/LAHC modified with ACA system similar to the mesoporous-assembled SrTiO3 support [21], followed by impregnating step to obtain various Ag loadings. The prepared Ag loaded TiO2 catalysts were also tested for their catalytic activity towards the ethylene epoxidation in order to compare with the other studied catalysts. 2.3 Catalyst characterization techniques All synthesized catalyst samples were characterized to determine the specific surface area via N2 adsorption at 77K by using a surface area analyzer (Quantachrome, SAA-1MP). Prior to the analysis, each catalyst sample was outgassed at 473K for 8h. The actual contents of Ag loaded on the catalyst samples were analyzed by an atomic adsorption spectrophotometer (AAS, Varian, Spectr AA-300). The crystalline structures of the catalysts were examined by an X-ray diffractometer (XRD, Rigaku, RINT 2200 HV) equipped with a Ni filter and a Cu Kα radiation source (λ =1.542Å) operating at 40kV and 30mA. The catalyst samples were scanned in the range of 2θ from 5° to 90° in a continuous mode with the scanning rate of 5°min−1. The Ag crystallite size (D) was calculated from X-ray line broadening of the Ag crystalline peak using the Debye–Scherrer equation [23,24] with the full line width at half maximum of intensity and the 2θ value, as follows: D = 0.9 λ B cos θ where λ is the X-ray wavelength (1.542Å for Cu source), B is the line broadening, and θ is the Bragg angle. The dispersion and surface area of the Ag particles were determined using a H2 chemisorption apparatus (Micromeritics, ASAP 2020). The catalyst samples were reduced at 873K in 5% H2 in N2 atmosphere before the analysis. The surface morphology of some selected catalysts was observed by a field emission scanning electron microscope (FE-SEM, JEOL 5200-2AE). The samples were coated with Pt to improve their conductivity before the examination. The catalyst morphology was also observed by transmission electron microscopy (TEM, JEOL 3011 at 300kV and JEOL 2010 at 200 kV). The specimens for the TEM analysis were prepared by ultrasonically dispersing powders of the catalysts in ethanol and then placing drops of the suspension onto a Cu grid coated with a carbon film. The existence of Ag particles on different supports was verified by using an energy dispersive X-ray spectroscope (EDS) attached to the TEM. The Ag particle sizes were determined from statistical analysis of the diameters of particles visible in the TEM images. The oxidation state of the supported Ag particles was analyzed by an X-ray photoelectron spectroscope (XPS, Shimadzu, Kratos). A monochromatic Al Kα source was used as the X-ray source. The relative surface charging of the samples was corrected by referencing all the energies to the C1s level as an internal standard at 285eV [25]. Coke formation on the spent catalysts was analyzed by a thermogravimetric-differential thermal analyzer (TG-DTA, PerkinElmer, Pyris Diamond). Temperature-programmed desorption (TPD) experiments were carried out using a TPD analyzer (Quantachrome, Chembet 3000). The instrument was connected to a thermal conductivity detector (TCD). High-purity He was used as the carrier gas with a flow rate of 20cm3/min. The catalyst powders were placed into a quartz tube reactor, which was heated by a furnace. For the TPD experiments of both oxygen and ethylene, the catalysts were initially heated at 473K for 30min under high-purity He atmosphere in order to remove moisture and impurities from their surface. Then, oxygen (4.99% O2 in He) or pure ethylene (99.99% C2H4) was allowed to adsorb onto the catalyst surface at 473K for 2 h. After that, the catalyst samples were cooled to room temperature in a stream of high-purity He. The catalyst samples were then heated from room temperature to 1173K with a heating rate of 10K/min, and the desorbed gas was swept by high-purity He. The concentration profile of either oxygen or ethylene present in the effluent stream was measured by the TCD. 2.4 Activity testing experiments The epoxidation reaction of ethylene was conducted in a packed-bed 8-mm ID tubular reactor, which was operated at 24.7psia. 30mg catalyst powder was placed inside a quartz tube reactor and secured by two layers of glass wool. The reactor was placed in the furnace equipped with a temperature controller. The catalyst was pretreated with oxygen at 473K for 2h. The feed gas was a mixture of 40% ethylene in He, pure oxygen (HP grade), and pure helium (HP grade). Feed gas compositions of 6% ethylene and 6% oxygen with helium balance were achieved by using mass flow controllers. The space velocity through the reactor was maintained at 6000h−1, and the reaction temperature was varied from 473 to 573K. The compositions of the feed and product gases were analyzed by using an on-line gas chromatograph (Perkin Elmer, ARNEL) equipped with a 60/80 CARBOXEN 1 packed column (capable of separating carbon dioxide, ethylene, and oxygen) and a Rt-U PLOT capillary column (capable of separating EO, ethane, and propane). It should be noted that the formation of acetaldehyde was not quantified. It appeared only in trace amounts since under the studied conditions acetaldehyde underwent further oxidation to carbon dioxide and water [7]. The catalytic activity of each studied catalyst was evaluated at 6h in which the system reached steady state condition. The experimental data with less than 5% error were averaged to assess the catalytic performance. Moreover, for the best Ag/SrTiO3 catalyst, the system was operated up to 48h to observe the long-term stability of the catalyst. 3 Results and discussion 3.1 Catalyst characterization results 3.1.1 Specific surface area results Table 1 shows the specific surface areas of the catalysts prepared with different oxide supports at their optimum Ag loadings (based on the catalytic activity results in terms of EO selectivity and yield). Among the studied catalysts, the α-Al2O3-supported catalyst possessed the lowest specific surface area, followed by the SrTiO3-supported catalyst, while the Al2O3,Acid-supported catalyst had the highest specific surface area. For each of the supports, the specific surface area decreased slightly with increasing Ag loading (data not shown here), implying that this catalyst preparation technique can provide well-dispersed Ag particles on the support surface [8]. 3.1.2 Metal dispersion results The dispersion, specific surface area, particle size and crystallite size of Ag particles on different oxide supports are also shown in Table 1. It can be seen that the Ag dispersion is directly proportional to the Ag specific surface area. In comparisons among the studied catalysts, the 14.71wt% Ag/SiO2 90 had the highest Ag dispersion while the lowest Ag dispersion was observed for the Ag/α-Al2O3 and Ag/SrTiO3 catalysts. 3.1.3 Surface morphology As will be shown later, the Ag/SrTiO3 catalysts exhibited the highest catalytic activity in terms of EO selectivity and yield. Therefore, the present work focused to investigate the surface morphology of the Ag/SrTiO3 catalysts. Fig. 1 displays the SEM images of the Ag/SrTiO3 catalysts with different Ag loadings. The Ag loading altered the textural properties of the Ag/SrTiO3 catalysts. The surface topology of the Ag/SrTiO3 catalysts changed as the Ag loading was increased, and large aggregates of Ag particles were formed at about 17wt% Ag or higher. The TEM/EDS technique was used to verify the existence of Ag nanoparticles on the studied SrTiO3 support. The TEM images of the 17.16wt% Ag/SrTiO3 catalyst are shown in Fig. 2a and b, while Fig. 2c reveals the selected area diffraction (SAD) pattern of this catalyst, which confirms the single crystalline structure of the Ag/SrTiO3 catalyst. The Ag (110) plane can also be clearly seen in Fig. 2d, indicating the highly crystalline structure of Ag nanoparticles. Fig. 3a and b exemplifies the TEM images of the 13.16wt% Ag/Al2O3 C and the 14.86wt% Ag/α-Al2O3, indicating the inhomogeneous dispersion of Ag nanoparticles throughout the two different Al2O3 supports (Al2O3 C and α-Al2O3). The average sizes of Ag nanoparticles in all the studied catalysts are summarized in Table 1. For any given support, the sizes of Ag particle and crystalline suggest that this catalyst preparation technique can provide single crystals of Ag deposition on all studied supports. Among the studied supports, the largest average Ag particle size (59nm) was found on the SrTiO3 support, while the smallest average Ag particle size (25nm) was found on the Al2O3,Acid support. The Ag particle size of Ag/SrTiO3 catalysts increased from 47nm (12.38wt% Ag), to 48nm (13.41wt% Ag), and 50nm (14.85wt% Ag), 59nm (17.16wt% Ag) and 66nm (19.74wt% Ag). The results are consistent with large aggregates of Ag particles at 17wt% Ag or higher as shown in the SEM images. 3.1.4 XRD results The XRD patterns of the Ag/SrTiO3 catalysts with various Ag loadings shown in Fig. 4 are not much different from that of the pristine support; all of them have highly crystalline structure. The dominant peaks of metallic silver at 2θ of about 28°, 38°, and 44° correspond to (110), (111), and (200) planes, while an extremely small Ag2O peak was observed at 2θ of 35° [26], indicating that the Ag loaded on the SrTiO3 support was mostly in the metallic form. To compare the crystallite size of all studied catalysts, the most dominant metallic silver peak at 2θ of 38° was used in the calculation. Fig. 5 compares the crystalline structures of the studied Ag catalysts loaded on different supports at their optimum loadings. The Ag/α-Al2O3, Ag/Al2O3,Acid, and Ag/SiO2 90 catalysts exhibited more X-ray amorphous support structures as compared to the Ag/SrTiO3 catalyst, which showed a highly crystalline support structure. The XRD results also showed that the Ag/SrTiO3 catalyst had the largest Ag crystallite size while the smallest Ag crystallite size was found in the Ag/Al2O3,Acid catalyst (Table 1), which agree well with the particle sizes observed from the TEM images. The XRD and TEM results verify the single crystalline structure of Ag particles in all prepared catalysts, as aforementioned in the SAD pattern result. 3.1.5 TPD profiles of oxygen Fig. 6 compares the oxygen TPD profile of the 17.16wt% Ag/SrTiO3 catalyst with the TPD profiles of the Ag catalysts on the other supports. The TPD peak at around 600–700K obtained on the Ag/Al2O3,Acid catalyst indicates that the Al2O3,Acid support can provide significant oxygen storage, leading to a better catalytic performance towards ethylene epoxidation as compared to all Al2O3 and SiO2 supported catalysts [7]. There were several broad but extremely small oxygen desorption peaks observed for the Ag/Al2O3 C and Ag/SiO2 90 catalysts, suggesting the low oxygen adsorption capacities of these supports. For the Ag/SrTiO3 catalyst, a much larger oxygen desorption peak was observed at around 620–800K as compared to that of the Ag/Al2O3,Acid catalyst. The extremely large desorption peak at 800–1000K of the Ag/SrTiO3 catalyst results from the decomposition of SrTiO3. The TPD results reveal that the Ag/SrTiO3 catalyst provides a very high oxygen adsorption capacity (Table 3) but the high desorption temperature indicates a stronger bonding energy between oxygen molecules with the SrTiO3 surface as compared to the other Ag catalysts with different supports. 3.1.6 TPD profiles of ethylene As shown in Fig. 7 , the Ag/Al2O3,Acid exhibits a much higher desorption peak of ethylene at 450K, compared to the other catalysts except the Ag/SrTiO3 catalyst. The O2 and C2H4 uptakes of all studied catalysts are summarized in Table 3. The Ag/SrTiO3 catalyst possessed a larger ethylene desorption peak in the temperature range of 600–800K with a small one at 400–450K. Again, the extremely large desorption peak of the Ag/SrTiO3 catalyst at 800–1000K attributes to the decomposition of the SrTiO3 support. Furthermore, the ethylene interaction with the Ag/Al2O3 C and Ag/SiO2 90 catalysts can also be clearly observed by several broad and small peaks, indicating the formation of various compounds at different temperatures. Surprisingly, the Ag/α-Al2O3 catalyst showed the absence of any ethylene desorption peak. Among all of the investigated catalysts, Ag/SrTiO3 exhibited not only the highest O2 uptake but also the maximum C2H4 uptake. 3.1.7 XPS results The deconvoluted Ag 3d XPS peaks of the 17.16wt% Ag/SrTiO3 catalyst before and after the reaction are shown in Fig. 8 . The XPS results confirm the presence of both metallic silver (Ag) and silver oxide (Ag2O) on the catalyst surface both before and after the ethylene epoxidation reaction. The metallic Ag peaks can be clearly seen at the binding energies of 373.5eV for Ag 3d3/2 and 367.5eV for Ag 3d5/2. On the other hand, the small Ag2O peaks were observed at the binding energies of 371.5eV for Ag2O 3d3/2 and 366.5eV for Ag2O 3d5/2 [25]. Prior to the reaction, the ratio of Ag to Ag2O was about 11.5, and it decreased to 4.5 after the reaction. This indicates that some metallic Ag was oxidized to form Ag2O during the reaction. 3.2 Ethylene epoxidation activity results The effect of reaction temperature on the ethylene epoxidation activity and selectivity over the Ag catalysts on different supports (α-Al2O3, Al2O3 C, Al2O3,Acid, SiO2 90, SrTiO3 and TiO2) at their optimum Ag loadings is summarized in Table 2 . Table 2 shows that the C2H4 conversion increases as the reaction temperature increases from 498 to 563K. In contrast, the EO selectivity decreased with increasing reaction temperature from 498 to 563K, except for the Ag/SrTiO3 catalyst, where the selectivity still remained very high. For any given studied catalysts, the EO yield increased up to a certain temperature. After that, the yield considerably decreased with further increasing reaction temperature. This is because a higher temperature simply promotes complete oxidation, as confirmed experimentally by the increase in CO2 [7,27]. Among the studied catalysts, the 17.16wt% Ag/SrTiO3 was found to be the best catalyst, providing both the highest EO yield of 4.5% with the maximum EO selectivity up to 99%. Interestingly, this catalyst produced no CO2 at reaction temperatures below 548K. These results can be well related to the TPD results of O2 and C2H4 of this catalyst (Figs. 6 and 7), which showed the high adsorption capabilities of O2 and C2H4 (Table 3 ). The high desorption temperatures of both oxygen and ethylene on the surface of the Ag/SrTiO3 catalyst favor the epoxidation reaction over the complete oxidation at low temperatures (less than 548K) [28]. The Ag/SrTiO3 catalyst also had the largest Ag particle size with low Ag dispersion. It was found that the larger the Ag particle size, the lower the opportunity of secondary reactions including complete oxidation, leading to increasing EO yield [29,30]. However, when the Ag particle size further increased by increasing Ag loading to greater than 17.16wt%, a significant decrease in the catalytic activity was observed. These results imply that Ag particle sizes that are too high or too low are detrimental for the epoxidation reaction performance. The Ag/Al2O3,Acid catalyst gave a comparable EO yield to the Ag/SrTiO3 catalyst, but with a relatively high EO selectivity at the reaction temperature below 523K, probably resulting from an appropriate acidic property that might help suppress the formation of CO2 [31]. This catalyst possessed the smallest Ag particle size and moderate Ag dispersion with the relatively high O2 and C2H4 uptakes (Table 3). These results indicate that the ethylene epoxidation reaction depends not only on the reaction temperature, Ag loading, and specific surface area, but also on the Ag particle size, Ag dispersion on the supports and finally the bonding energy of both O2 and C2H4 with the surface of catalyst support. The optimum conditions for ethylene epoxidation were found to correspond to large Ag particle sizes of about 50nm, low specific surface area, low Ag dispersion, appropriate amount of Ag loading and the strong bonding of both O2 and C2H4 with the SrTiO3 support, as evidenced from the best activity results of the 17.16wt% Ag/SrTiO3 catalyst. It can also be concluded that moderate Ag particle sizes favor the high yield of EO and that the Ag dispersion clearly affects the EO selectivity [17]. For instance, the Ag/SiO2 90 catalyst with high Ag dispersion gave low EO selectivity because the relatively small Ag particles dispersed on the support easily interacted with the reactants and formed CO2 through secondary reactions. Fig. 9 compares the catalytic performance of the Ag/TiO2 catalyst (which represented a TiO2 support prepared by a sol–gel process) with the Ag/SrTiO3 catalyst (which was found to be the best catalyst, as aforementioned). The Ag/SrTiO3 catalysts with various Ag loadings were found to exhibit a much better catalytic activity towards the ethylene epoxidation reaction, providing both the enhancement of EO yield up to 4.5% and EO selectivity up to 99% at the Ag loading of 17.16wt%. This result implies that the nature of the support plays the dominant role in making a catalyst more selective. The EO yield and EO selectivity dropped at a very high Ag loading greater than 15wt% for the Ag/TiO2 catalyst. Again, it should be remarked that the Sr atoms that are incorporated in the SrTiO3 support clearly affect in the superior performance of Ag/SrTiO3 catalyst. After the reaction experiments, the spent 17.16wt% Ag/SrTiO3 catalyst was also characterized by XRD, TEM, XPS, and TG-DTA. The XRD patterns of this catalyst before and after the reaction were almost the same, indicating no significant change in the crystalline structure. The average Ag particle sizes obtained from the TEM images slightly increased from 58.64nm for the fresh catalyst to 61.73nm for the spent catalyst, implying a very small extent of sintering of the catalyst during the epoxidation reaction. As previously mentioned for the XPS results (Fig. 8), a significant amount of the metallic silver phase was changed to Ag2O phase after the reaction. In addition, the coke formation on all the spent catalysts from the TG-DTA analysis is comparatively shown in Table 4 . The Ag/SrTiO3 catalyst had coke formation of 6.84%, similar to the Ag/α-Al2O3 and Ag/TiO2 catalysts but lower than the Ag/SiO2 90 catalyst. These results imply that the higher Ag dispersion of the Ag/SiO2 90 catalyst (Table 1) can lead to more coke formation. The stability in terms of EO yield and EO selectivity as a function of time on stream of the 17.16wt% Ag/SrTiO3 catalyst (the optimum catalyst) was also investigated, as shown in Fig. 10 . It should be noted that the catalytic performance of all investigated catalysts was compared at 6h of time on stream. The EO selectivity slightly dropped from 99% at 6h to 84% after 32h of experiment and remained almost stable at this level. The coke formation is believed to cause the reduction of both EO selectivity and yield. The yield of EO also depicted the same trend, decreasing from 4.5% to 3.3% after 32h. It can be concluded that this catalyst not only producing the maximum EO yield and EO selectivity but also providing a long-term stability of the catalytic performance. A slight increase of the oxygen ratio in feed may be needed to reduce the coke formation and the use of a larger amount of catalyst is recommended to obtain a high ethylene conversion as found in the industrial process. 4 Conclusions In this study, Ag supported on SrTiO3 was proved to be an effective catalyst for epoxidation of ethylene, giving unusually high selectivities and yields of ethylene oxide, compared to Ag catalysts supported on other oxide supports (Al2O3,Acid, Al2O3 C, α-Al2O3, SiO2 90 and TiO2). The most promising catalyst for EO production was found to be the 17.16wt% Ag/SrTiO3, which provided the highest EO yield of 4.5% with the EO selectivity up to 99% at the reaction temperature of 548K. Moreover, the Ag/SrTiO3 catalyst produced no CO2 at the reaction temperature below 548K. The performance of the Ag/SrTiO3 catalyst may be related to its high oxygen and ethylene adsorption ability (high uptakes of both ethylene and oxygen) as well as moderate size of Ag particles compared to the other catalysts investigated. Moreover, Sr atoms that are incorporated in the SrTiO3 support play an important role in making this catalyst more selective in EO formation. The effects of Sr atoms that are incorporated in the SrTiO3 support on the catalytic performance and mechanism will be described in details in our next manuscript. Acknowledgments This work was supported by The Royal Golden Jubilee Ph.D. Program (RGJ-Industry) awarded by Thailand Research Fund with the in-kind support from PTT Global Chemical Public Co. Ltd.; the Sustainable Petroleum and Petrochemicals Research Unit, Center of Excellence on Petrochemical and Materials Technology, Chulalongkorn University (Thailand); and the Transportation Energy Center, Department of Chemical Engineering, University of Michigan (USA). References [1] J.T. Jankowiak M.A. Barteau J. Catal. 236 2005 379 386 [2] Y.Ch. Kim N.C. Park J.S. Shin S.R. Lee Y.J. Lee D.J. Moon Catal. Today 87 2003 153 162 [3] J. Lacson Ethylene oxide Chemical Economics Handbook 2003 SRI International Menlo Park, CA [4] G. Ertl H. Knozinger J. Weitkamp Handbook of Heterogeneous Catalysis 1997 VCH Weinheim [5] Y.S. Yong E.M. Kennedy N.W. Cant Appl. Catal. 76 1991 31 39 [6] S. Matar M.J. Mirbach H.A. Tayim Catalysis in Petrochemical Processes 1989 Kluwer Academic Publishers The Netherlands 85 [7] S. Rojluechai, Ph.D. Dissertation, The Petroleum and Petrochemical College, Chalongkorn University, Bangkok, Thailand, 2006. [8] S. Rojluechai S. Chavadej J.W. Schwank V. Meeyoo Catal. Commun. 8 2007 57 64 [9] P. Harriott J. Catal. 21 1971 56 64 [10] J.S. Beck J.C. Vartuli W.J. Roth M.E. Leonowicz C.T. Kresge K.D. Schmitt C.T.W. Chu D.H. Olson E.W. Sheppard S.B. McCullen J.B. Higgins J.L. Schlenker J. Am. Chem. Soc. 114 1992 1 11 [11] A.P. Fotopoulos K.S. Triantafyllidis Catal. Today 127 2007 148 156 [12] T. Puangpetch T. Sreethawong S. Yoshikawa S. Chavadej J. Mol. Catal. A: Chem. 287 2008 70 79 [13] A. Ayame Y. Uchida H. Ono M. Miyamoto T. Sato H. Hayasaka Appl. Catal. A: Gen. 244 2003 59 70 [14] G.B. Hoflund D.M. Minahan Nucl. Instrum. Methods B 118 1996 517 521 [15] S. Linic M.A. Barteau J. Am. Chem. Soc. 125 2003 4034 4035 [16] J.G. Serafin J. Mol. Catal. A: Chem. 131 1998 157 168 [17] S.S. Hassani M.R. Ghasemi M. Rashidzadeh Z. Sobat Cryst. Res. Technol. 44 2009 948 952 [18] P. Christopher S. Linic ChemCatChem 2 2010 78 83 [19] T. Puangpetch T. Sreethawong S. Yoshikawa S. Chavadej J. Mol. Catal. A: Chem. 312 2009 97 106 [20] T. Puangpetch T. Sreethawong S. Chavadej Int. J. Hydrogen Energy 35 2010 6531 6540 [21] T. Puangpetch P. Sommakettarin S. Chavadej T. Sreethawong Int. J. Hydrogen Energy 35 2010 12428 12442 [22] T. Puangpetch S. Chavadej T. Sreethawong Energy Convers. Manage. 52 2011 2256 2261 [23] B.D. Cullity Elements of X-ray Diffraction 1978 Addison-Wesley Pub. Co. MA [24] A.G. Jackson Handbook of Crystallography 1991 Springer-Verlag New York [25] J.F. Moulder W.F. Stickle P.E. Sobol K.D. Bomben Handbook of X-ray photoelectron spectroscopy: a reference book of standard spectra for identification and interpretation of XPS data Phys. Electron. 1995 [26] J.V. Smith X-Ray Powder Data File 1960 American Society for Testing Materials PA [27] M.O. Ozbek I. Onal R.A. Santen ChemCatChem 3 2011 150 153 [28] R.A. Santen H.P.C.E. Kuipers Adv. Catal. 35 1987 265 321 [29] J. Lu J.J. Bravo A. Takahashi M. Haruta S.T. Oyama J. Catal. 232 2005 85 95 [30] F. Zemicheael A. Palermo M. Tikhov R. Lambert Catal. Lett. 80 2002 93 [31] Z. Gao Y. Shi J. Nat. Gas Chem. 19 2010 173 178",
      "scopus-id": "84860300945",
      "coredata": {
        "eid": "1-s2.0-S1381116912000726",
        "dc:description": "In this study, Ag-based catalysts with different loadings on various oxide supports, including low-surface-area α-Al2O3, Al2O3 C, Al2O3,Acid, SiO2 90, TiO2 and SrTiO3 synthesized by a sol–gel process, were investigated for ethylene epoxidation over a range of reaction temperatures. The specific surface area, crystallinity, surface morphology, oxidation state, metal crystallite size, and oxygen and ethylene adsorption characteristics of all prepared catalysts were characterized and correlated to the ethylene epoxidation activity. Compared with conventional Ag catalysts supported on low-surface-area α-Al2O3, the 17.16wt% Ag/SrTiO3 catalyst exhibited much better catalytic activity for the ethylene epoxidation reaction, providing both the highest EO yield of 4.5% and EO selectivity up to 99%. The results indicate that high oxygen and ethylene uptakes, together with the large size of Ag particles, play an important role in achieving the best catalytic activity of the Ag/SrTiO3 catalyst towards ethylene epoxidation reaction.",
        "openArchiveArticle": "false",
        "prism:coverDate": "2012-06-30",
        "openaccessUserLicense": null,
        "prism:aggregationType": "Journal",
        "prism:url": "https://api.elsevier.com/content/article/pii/S1381116912000726",
        "dc:creator": [
          {
            "@_fa": "true",
            "$": "Chongterdtoonskul, Atiporn"
          },
          {
            "@_fa": "true",
            "$": "Schwank, Johannes W."
          },
          {
            "@_fa": "true",
            "$": "Chavadej, Sumaeth"
          }
        ],
        "link": [
          {
            "@_fa": "true",
            "@rel": "self",
            "@href": "https://api.elsevier.com/content/article/pii/S1381116912000726"
          },
          {
            "@_fa": "true",
            "@rel": "scidir",
            "@href": "https://www.sciencedirect.com/science/article/pii/S1381116912000726"
          }
        ],
        "dc:format": "application/json",
        "openaccessType": null,
        "pii": "S1381-1169(12)00072-6",
        "prism:volume": "358",
        "prism:publisher": "Elsevier B.V.",
        "dc:title": "Effects of oxide supports on ethylene epoxidation activity over Ag-based catalysts",
        "prism:copyright": "Copyright © 2012 Elsevier B.V. All rights reserved.",
        "openaccess": "0",
        "prism:issn": "13811169",
        "dcterms:subject": [
          {
            "@_fa": "true",
            "$": "Ethylene epoxidation"
          },
          {
            "@_fa": "true",
            "$": "SrTiO3"
          },
          {
            "@_fa": "true",
            "$": "Sol–gel"
          },
          {
            "@_fa": "true",
            "$": "α-Alumina"
          },
          {
            "@_fa": "true",
            "$": "Ag"
          }
        ],
        "openaccessArticle": "false",
        "prism:publicationName": "Journal of Molecular Catalysis A: Chemical",
        "openaccessSponsorType": null,
        "prism:pageRange": "58-66",
        "prism:endingPage": "66",
        "pubType": "fla",
        "prism:coverDisplayDate": "June 2012",
        "prism:doi": "10.1016/j.molcata.2012.02.011",
        "prism:startingPage": "58",
        "dc:identifier": "doi:10.1016/j.molcata.2012.02.011",
        "openaccessSponsorName": null
      },
      "objects": {
        "object": [
          {
            "@category": "standard",
            "@height": "200",
            "@width": "341",
            "@_fa": "true",
            "$": "https://api.elsevier.com/content/object/eid/1-s2.0-S1381116912000726-fx1.jpg?httpAccept=%2A%2F%2A",
            "@multimediatype": "JPEG image file",
            "@type": "IMAGE-DOWNSAMPLED",
            "@size": "9099",
            "@ref": "fx1",
            "@mimetype": "image/jpeg"
          },
          {
            "@category": "standard",
            "@height": "579",
            "@width": "526",
            "@_fa": "true",
            "$": "https://api.elsevier.com/content/object/eid/1-s2.0-S1381116912000726-gr1.jpg?httpAccept=%2A%2F%2A",
            "@multimediatype": "JPEG image file",
            "@type": "IMAGE-DOWNSAMPLED",
            "@size": "132270",
            "@ref": "gr1",
            "@mimetype": "image/jpeg"
          },
          {
            "@category": "standard",
            "@height": "224",
            "@width": "369",
            "@_fa": "true",
            "$": "https://api.elsevier.com/content/object/eid/1-s2.0-S1381116912000726-gr10.jpg?httpAccept=%2A%2F%2A",
            "@multimediatype": "JPEG image file",
            "@type": "IMAGE-DOWNSAMPLED",
            "@size": "17245",
            "@ref": "gr10",
            "@mimetype": "image/jpeg"
          },
          {
            "@category": "standard",
            "@height": "535",
            "@width": "504",
            "@_fa": "true",
            "$": "https://api.elsevier.com/content/object/eid/1-s2.0-S1381116912000726-gr2.jpg?httpAccept=%2A%2F%2A",
            "@multimediatype": "JPEG image file",
            "@type": "IMAGE-DOWNSAMPLED",
            "@size": "63080",
            "@ref": "gr2",
            "@mimetype": "image/jpeg"
          },
          {
            "@category": "standard",
            "@height": "692",
            "@width": "323",
            "@_fa": "true",
            "$": "https://api.elsevier.com/content/object/eid/1-s2.0-S1381116912000726-gr3.jpg?httpAccept=%2A%2F%2A",
            "@multimediatype": "JPEG image file",
            "@type": "IMAGE-DOWNSAMPLED",
            "@size": "79378",
            "@ref": "gr3",
            "@mimetype": "image/jpeg"
          },
          {
            "@category": "standard",
            "@height": "246",
            "@width": "384",
            "@_fa": "true",
            "$": "https://api.elsevier.com/content/object/eid/1-s2.0-S1381116912000726-gr4.jpg?httpAccept=%2A%2F%2A",
            "@multimediatype": "JPEG image file",
            "@type": "IMAGE-DOWNSAMPLED",
            "@size": "23415",
            "@ref": "gr4",
            "@mimetype": "image/jpeg"
          },
          {
            "@category": "standard",
            "@height": "244",
            "@width": "383",
            "@_fa": "true",
            "$": "https://api.elsevier.com/content/object/eid/1-s2.0-S1381116912000726-gr5.jpg?httpAccept=%2A%2F%2A",
            "@multimediatype": "JPEG image file",
            "@type": "IMAGE-DOWNSAMPLED",
            "@size": "20740",
            "@ref": "gr5",
            "@mimetype": "image/jpeg"
          },
          {
            "@category": "standard",
            "@height": "273",
            "@width": "386",
            "@_fa": "true",
            "$": "https://api.elsevier.com/content/object/eid/1-s2.0-S1381116912000726-gr6.jpg?httpAccept=%2A%2F%2A",
            "@multimediatype": "JPEG image file",
            "@type": "IMAGE-DOWNSAMPLED",
            "@size": "18721",
            "@ref": "gr6",
            "@mimetype": "image/jpeg"
          },
          {
            "@category": "standard",
            "@height": "274",
            "@width": "392",
            "@_fa": "true",
            "$": "https://api.elsevier.com/content/object/eid/1-s2.0-S1381116912000726-gr7.jpg?httpAccept=%2A%2F%2A",
            "@multimediatype": "JPEG image file",
            "@type": "IMAGE-DOWNSAMPLED",
            "@size": "19021",
            "@ref": "gr7",
            "@mimetype": "image/jpeg"
          },
          {
            "@category": "standard",
            "@height": "419",
            "@width": "707",
            "@_fa": "true",
            "$": "https://api.elsevier.com/content/object/eid/1-s2.0-S1381116912000726-gr8.jpg?httpAccept=%2A%2F%2A",
            "@multimediatype": "JPEG image file",
            "@type": "IMAGE-DOWNSAMPLED",
            "@size": "59786",
            "@ref": "gr8",
            "@mimetype": "image/jpeg"
          },
          {
            "@category": "standard",
            "@height": "451",
            "@width": "380",
            "@_fa": "true",
            "$": "https://api.elsevier.com/content/object/eid/1-s2.0-S1381116912000726-gr9.jpg?httpAccept=%2A%2F%2A",
            "@multimediatype": "JPEG image file",
            "@type": "IMAGE-DOWNSAMPLED",
            "@size": "19157",
            "@ref": "gr9",
            "@mimetype": "image/jpeg"
          },
          {
            "@category": "thumbnail",
            "@height": "128",
            "@width": "219",
            "@_fa": "true",
            "$": "https://api.elsevier.com/content/object/eid/1-s2.0-S1381116912000726-fx1.sml?httpAccept=%2A%2F%2A",
            "@multimediatype": "GIF image file",
            "@type": "IMAGE-THUMBNAIL",
            "@size": "3094",
            "@ref": "fx1",
            "@mimetype": "image/gif"
          },
          {
            "@category": "thumbnail",
            "@height": "164",
            "@width": "149",
            "@_fa": "true",
            "$": "https://api.elsevier.com/content/object/eid/1-s2.0-S1381116912000726-gr1.sml?httpAccept=%2A%2F%2A",
            "@multimediatype": "GIF image file",
            "@type": "IMAGE-THUMBNAIL",
            "@size": "18393",
            "@ref": "gr1",
            "@mimetype": "image/gif"
          },
          {
            "@category": "thumbnail",
            "@height": "133",
            "@width": "219",
            "@_fa": "true",
            "$": "https://api.elsevier.com/content/object/eid/1-s2.0-S1381116912000726-gr10.sml?httpAccept=%2A%2F%2A",
            "@multimediatype": "GIF image file",
            "@type": "IMAGE-THUMBNAIL",
            "@size": "4730",
            "@ref": "gr10",
            "@mimetype": "image/gif"
          },
          {
            "@category": "thumbnail",
            "@height": "163",
            "@width": "154",
            "@_fa": "true",
            "$": "https://api.elsevier.com/content/object/eid/1-s2.0-S1381116912000726-gr2.sml?httpAccept=%2A%2F%2A",
            "@multimediatype": "GIF image file",
            "@type": "IMAGE-THUMBNAIL",
            "@size": "12746",
            "@ref": "gr2",
            "@mimetype": "image/gif"
          },
          {
            "@category": "thumbnail",
            "@height": "163",
            "@width": "76",
            "@_fa": "true",
            "$": "https://api.elsevier.com/content/object/eid/1-s2.0-S1381116912000726-gr3.sml?httpAccept=%2A%2F%2A",
            "@multimediatype": "GIF image file",
            "@type": "IMAGE-THUMBNAIL",
            "@size": "8412",
            "@ref": "gr3",
            "@mimetype": "image/gif"
          },
          {
            "@category": "thumbnail",
            "@height": "140",
            "@width": "219",
            "@_fa": "true",
            "$": "https://api.elsevier.com/content/object/eid/1-s2.0-S1381116912000726-gr4.sml?httpAccept=%2A%2F%2A",
            "@multimediatype": "GIF image file",
            "@type": "IMAGE-THUMBNAIL",
            "@size": "6715",
            "@ref": "gr4",
            "@mimetype": "image/gif"
          },
          {
            "@category": "thumbnail",
            "@height": "139",
            "@width": "219",
            "@_fa": "true",
            "$": "https://api.elsevier.com/content/object/eid/1-s2.0-S1381116912000726-gr5.sml?httpAccept=%2A%2F%2A",
            "@multimediatype": "GIF image file",
            "@type": "IMAGE-THUMBNAIL",
            "@size": "6401",
            "@ref": "gr5",
            "@mimetype": "image/gif"
          },
          {
            "@category": "thumbnail",
            "@height": "155",
            "@width": "219",
            "@_fa": "true",
            "$": "https://api.elsevier.com/content/object/eid/1-s2.0-S1381116912000726-gr6.sml?httpAccept=%2A%2F%2A",
            "@multimediatype": "GIF image file",
            "@type": "IMAGE-THUMBNAIL",
            "@size": "5315",
            "@ref": "gr6",
            "@mimetype": "image/gif"
          },
          {
            "@category": "thumbnail",
            "@height": "153",
            "@width": "219",
            "@_fa": "true",
            "$": "https://api.elsevier.com/content/object/eid/1-s2.0-S1381116912000726-gr7.sml?httpAccept=%2A%2F%2A",
            "@multimediatype": "GIF image file",
            "@type": "IMAGE-THUMBNAIL",
            "@size": "5109",
            "@ref": "gr7",
            "@mimetype": "image/gif"
          },
          {
            "@category": "thumbnail",
            "@height": "130",
            "@width": "219",
            "@_fa": "true",
            "$": "https://api.elsevier.com/content/object/eid/1-s2.0-S1381116912000726-gr8.sml?httpAccept=%2A%2F%2A",
            "@multimediatype": "GIF image file",
            "@type": "IMAGE-THUMBNAIL",
            "@size": "6028",
            "@ref": "gr8",
            "@mimetype": "image/gif"
          },
          {
            "@category": "thumbnail",
            "@height": "164",
            "@width": "138",
            "@_fa": "true",
            "$": "https://api.elsevier.com/content/object/eid/1-s2.0-S1381116912000726-gr9.sml?httpAccept=%2A%2F%2A",
            "@multimediatype": "GIF image file",
            "@type": "IMAGE-THUMBNAIL",
            "@size": "2658",
            "@ref": "gr9",
            "@mimetype": "image/gif"
          },
          {
            "@category": "high",
            "@height": "886",
            "@width": "1510",
            "@_fa": "true",
            "$": "https://api.elsevier.com/content/object/eid/1-s2.0-S1381116912000726-fx1_lrg.jpg?httpAccept=%2A%2F%2A",
            "@multimediatype": "JPEG image file",
            "@type": "IMAGE-HIGH-RES",
            "@size": "58944",
            "@ref": "fx1",
            "@mimetype": "image/jpeg"
          },
          {
            "@category": "high",
            "@height": "2564",
            "@width": "2331",
            "@_fa": "true",
            "$": "https://api.elsevier.com/content/object/eid/1-s2.0-S1381116912000726-gr1_lrg.jpg?httpAccept=%2A%2F%2A",
            "@multimediatype": "JPEG image file",
            "@type": "IMAGE-HIGH-RES",
            "@size": "1761400",
            "@ref": "gr1",
            "@mimetype": "image/jpeg"
          },
          {
            "@category": "high",
            "@height": "991",
            "@width": "1636",
            "@_fa": "true",
            "$": "https://api.elsevier.com/content/object/eid/1-s2.0-S1381116912000726-gr10_lrg.jpg?httpAccept=%2A%2F%2A",
            "@multimediatype": "JPEG image file",
            "@type": "IMAGE-HIGH-RES",
            "@size": "114413",
            "@ref": "gr10",
            "@mimetype": "image/jpeg"
          },
          {
            "@category": "high",
            "@height": "2367",
            "@width": "2231",
            "@_fa": "true",
            "$": "https://api.elsevier.com/content/object/eid/1-s2.0-S1381116912000726-gr2_lrg.jpg?httpAccept=%2A%2F%2A",
            "@multimediatype": "JPEG image file",
            "@type": "IMAGE-HIGH-RES",
            "@size": "993790",
            "@ref": "gr2",
            "@mimetype": "image/jpeg"
          },
          {
            "@category": "high",
            "@height": "3067",
            "@width": "1432",
            "@_fa": "true",
            "$": "https://api.elsevier.com/content/object/eid/1-s2.0-S1381116912000726-gr3_lrg.jpg?httpAccept=%2A%2F%2A",
            "@multimediatype": "JPEG image file",
            "@type": "IMAGE-HIGH-RES",
            "@size": "939617",
            "@ref": "gr3",
            "@mimetype": "image/jpeg"
          },
          {
            "@category": "high",
            "@height": "1088",
            "@width": "1700",
            "@_fa": "true",
            "$": "https://api.elsevier.com/content/object/eid/1-s2.0-S1381116912000726-gr4_lrg.jpg?httpAccept=%2A%2F%2A",
            "@multimediatype": "JPEG image file",
            "@type": "IMAGE-HIGH-RES",
            "@size": "199749",
            "@ref": "gr4",
            "@mimetype": "image/jpeg"
          },
          {
            "@category": "high",
            "@height": "1080",
            "@width": "1696",
            "@_fa": "true",
            "$": "https://api.elsevier.com/content/object/eid/1-s2.0-S1381116912000726-gr5_lrg.jpg?httpAccept=%2A%2F%2A",
            "@multimediatype": "JPEG image file",
            "@type": "IMAGE-HIGH-RES",
            "@size": "193785",
            "@ref": "gr5",
            "@mimetype": "image/jpeg"
          },
          {
            "@category": "high",
            "@height": "1206",
            "@width": "1708",
            "@_fa": "true",
            "$": "https://api.elsevier.com/content/object/eid/1-s2.0-S1381116912000726-gr6_lrg.jpg?httpAccept=%2A%2F%2A",
            "@multimediatype": "JPEG image file",
            "@type": "IMAGE-HIGH-RES",
            "@size": "141414",
            "@ref": "gr6",
            "@mimetype": "image/jpeg"
          },
          {
            "@category": "high",
            "@height": "1213",
            "@width": "1737",
            "@_fa": "true",
            "$": "https://api.elsevier.com/content/object/eid/1-s2.0-S1381116912000726-gr7_lrg.jpg?httpAccept=%2A%2F%2A",
            "@multimediatype": "JPEG image file",
            "@type": "IMAGE-HIGH-RES",
            "@size": "151009",
            "@ref": "gr7",
            "@mimetype": "image/jpeg"
          },
          {
            "@category": "high",
            "@height": "1856",
            "@width": "3132",
            "@_fa": "true",
            "$": "https://api.elsevier.com/content/object/eid/1-s2.0-S1381116912000726-gr8_lrg.jpg?httpAccept=%2A%2F%2A",
            "@multimediatype": "JPEG image file",
            "@type": "IMAGE-HIGH-RES",
            "@size": "483080",
            "@ref": "gr8",
            "@mimetype": "image/jpeg"
          },
          {
            "@category": "high",
            "@height": "1995",
            "@width": "1682",
            "@_fa": "true",
            "$": "https://api.elsevier.com/content/object/eid/1-s2.0-S1381116912000726-gr9_lrg.jpg?httpAccept=%2A%2F%2A",
            "@multimediatype": "JPEG image file",
            "@type": "IMAGE-HIGH-RES",
            "@size": "126770",
            "@ref": "gr9",
            "@mimetype": "image/jpeg"
          },
          {
            "@category": "thumbnail",
            "@height": "33",
            "@width": "89",
            "@_fa": "true",
            "$": "https://api.elsevier.com/content/object/eid/1-s2.0-S1381116912000726-si1.gif?httpAccept=%2A%2F%2A",
            "@multimediatype": "GIF image file",
            "@type": "ALTIMG",
            "@size": "452",
            "@ref": "si1",
            "@mimetype": "image/gif"
          }
        ]
      },
      "link": {
        "@rel": "abstract",
        "@href": "https://api.elsevier.com/content/abstract/scopus_id/84860300945"
      }
    }
  }
}