{
  "metadata": {
    "title": "Studies on the reaction pathways for the selective oxidation of propane to acrolein over MoPO/SiO<ce:inf loc=post>2</ce:inf> catalyst by IR spectroscopy",
    "authors": "; ; ",
    "journal": "Journal of Molecular Catalysis A: Chemical",
    "date": "2007-11-16",
    "doi": "10.1016/j.molcata.2007.07.049",
    "abstract": "",
    "uri": "https://api.elsevier.com/content/article/pii/S1381116907004761",
    "pii": "S1381116907004761"
  },
  "fulltext": {
    "full-text-retrieval-response": {
      "scopus-eid": "2-s2.0-35348915331",
      "originalText": "serial JL 271358 291210 291744 291790 291809 31 Journal of Molecular Catalysis A: Chemical JOURNALMOLECULARCATALYSISACHEMICAL 2007-08-06 2007-08-06 2010-03-27T18:10:43 1-s2.0-S1381116907004761 S1381-1169(07)00476-1 S1381116907004761 10.1016/j.molcata.2007.07.049 S300 S300.1 FULL-TEXT 1-s2.0-S1381116907X02590 2015-05-15T05:56:33.307883-04:00 0 0 20071116 2007 2007-08-06T00:00:00Z articleinfo crossmark dco dateupdated tomb dateloaded datesearch indexeddate issuelist volumelist yearnav absattachment articletitlenorm authfirstinitialnorm authfirstsurnamenorm cid cids contenttype copyright dateloadedtxt docsubtype doctype doi eid ewtransactionid hubeid issfirst issn issnnorm itemstage itemtransactionid itemweight openaccess openarchive pg pgfirst pglast pii piinorm pubdatestart pubdatetxt pubyr sectiontitle sortorder srctitle srctitlenorm srctype subheadings volfirst volissue webpdf webpdfpagecount figure table e-component body mmlmath acknowledge affil appendices articletitle auth authfirstini authfull authkeywords authlast primabst ref specialabst alllist content subj ssids 1381-1169 13811169 277 277 1 2 1 2 Volume 277, Issues 1–2 28 202 209 202 209 20071116 16 November 2007 2007-11-16 2007 Regular papers article fla Copyright © 2007 Elsevier B.V. All rights reserved. STUDIESREACTIONPATHWAYSFORSELECTIVEOXIDATIONPROPANEACROLEINOVERMOPOSIO2CATALYSTBYIRSPECTROSCOPY YI X 1 Introduction 2 Experimental 2.1 Catalyst preparation 2.2 Catalytic tests 2.3 Catalyst characterization 3 Results and discussion 3.1 Propane oxidation 3.2 IR spectra arising from acetone, isopropanol and 2-Br-propane adsorptions 3.2.1 Acetone adsorption 3.2.2 Isopropanol and 2-Br-propane adsorption 3.3 IR spectra arising from acrolein, allyl alcohol and propene adsorptions 3.3.1 Acrolein adsorption 3.3.2 Allyl alcohol adsorption 3.3.3 Propene adsorption 3.4 IR spectra arising from propanal and 1-propanol adsorptions 3.4.1 Propanal adsorption 3.4.2 1-Propanol adsorption 3.5 IR spectra arising from propane adsorption 4 Conclusions Acknowledgements Appendix A Supplementary data References BATIOT 1996 179 C LIN 2001 1 M ZHU 2007 382 Y DIMITRATOS 2006 184 N HIBST 2006 234 H KIM 1990 491 Y CONNER 1991 1224 W KADDOURI 1999 271 A LUO 2001 222 L LIN 2000 223 M FINOCCHIO 1996 1587 E BUSCA 1999 453 G FINOCCHIO 1995 204 E CENTI 1996 5149 G HASAN 2002 12747 M GUERREROPEREZ 2006 360 M YI 2003 769 X YI 2004 667 X ZAKI 2001 4025 M RESINI 2005 105 C CENTI 1988 55 G MICHALAKOS 1993 226 P ANDRUSHKEVICH 1991 1023 T HUBAUT 1989 170 R KOLYAGIN 2006 122 Y CONCEPCION 2004 45 P FINOCCHIO 1994 3347 E WORDEN 1962 1121 E GEORGE 1968 145 W CHEN 2001 646 K FU 2005 3989 G FU 2005 6416 G FU 2006 133 G YIX2007X202 YIX2007X202X209 YIX2007X202XX YIX2007X202X209XX item S1381-1169(07)00476-1 S1381116907004761 1-s2.0-S1381116907004761 10.1016/j.molcata.2007.07.049 271358 2010-09-17T22:46:08.967614-04:00 2007-11-16 1-s2.0-S1381116907004761-main.pdf https://s3.amazonaws.com/prod-ucs-content-store-us-east/content/pii:S1381116907004761/MAIN/application/pdf/59e48952c973fbdf4ddf93ae781c603b/main.pdf https://s3-eu-west-1.amazonaws.com/prod-ucs-content-store-eu-west/content/pii:S1381116907004761/MAIN/application/pdf/59e48952c973fbdf4ddf93ae781c603b/main.pdf main.pdf pdf true 259092 MAIN 8 1-s2.0-S1381116907004761-main_1.png https://s3.amazonaws.com/prod-ucs-content-store-us-east/content/pii:S1381116907004761/PREVIEW/image/png/1c240efab470e6f0ceea09d2c385a04e/main_1.png https://s3-eu-west-1.amazonaws.com/prod-ucs-content-store-eu-west/content/pii:S1381116907004761/PREVIEW/image/png/1c240efab470e6f0ceea09d2c385a04e/main_1.png main_1.png png 73218 849 656 IMAGE-WEB-PDF 1 1-s2.0-S1381116907004761-si4.gif https://s3.amazonaws.com/prod-ucs-content-store-us-east/content/pii:S1381116907004761/STRIPIN/image/gif/63f1df302d420df0005c80fb1599c345/si4.gif https://s3-eu-west-1.amazonaws.com/prod-ucs-content-store-eu-west/content/pii:S1381116907004761/STRIPIN/image/gif/63f1df302d420df0005c80fb1599c345/si4.gif si4 si4.gif gif 222 15 37 ALTIMG 1-s2.0-S1381116907004761-si3.gif https://s3.amazonaws.com/prod-ucs-content-store-us-east/content/pii:S1381116907004761/STRIPIN/image/gif/fcb4dd3b8279289102c8418c7d8e4466/si3.gif https://s3-eu-west-1.amazonaws.com/prod-ucs-content-store-eu-west/content/pii:S1381116907004761/STRIPIN/image/gif/fcb4dd3b8279289102c8418c7d8e4466/si3.gif si3 si3.gif gif 273 17 51 ALTIMG 1-s2.0-S1381116907004761-si2.gif https://s3.amazonaws.com/prod-ucs-content-store-us-east/content/pii:S1381116907004761/STRIPIN/image/gif/52473c85dfa3746f2fdd7d960e4c453f/si2.gif https://s3-eu-west-1.amazonaws.com/prod-ucs-content-store-eu-west/content/pii:S1381116907004761/STRIPIN/image/gif/52473c85dfa3746f2fdd7d960e4c453f/si2.gif si2 si2.gif gif 222 15 39 ALTIMG 1-s2.0-S1381116907004761-si1.gif https://s3.amazonaws.com/prod-ucs-content-store-us-east/content/pii:S1381116907004761/STRIPIN/image/gif/14d5ee629f3de9ee212cb9ff5f549c45/si1.gif https://s3-eu-west-1.amazonaws.com/prod-ucs-content-store-eu-west/content/pii:S1381116907004761/STRIPIN/image/gif/14d5ee629f3de9ee212cb9ff5f549c45/si1.gif si1 si1.gif gif 253 15 45 ALTIMG 1-s2.0-S1381116907004761-mmc1.doc https://s3.amazonaws.com/prod-ucs-content-store-us-east/content/pii:S1381116907004761/mmc1/MAIN/application/msword/2ff34a30608516c33934414c4548acc5/mmc1.doc https://s3-eu-west-1.amazonaws.com/prod-ucs-content-store-eu-west/content/pii:S1381116907004761/mmc1/MAIN/application/msword/2ff34a30608516c33934414c4548acc5/mmc1.doc mmc1 mmc1.doc doc 336384 APPLICATION 1-s2.0-S1381116907004761-gr1.gif https://s3.amazonaws.com/prod-ucs-content-store-us-east/content/pii:S1381116907004761/gr1/DOWNSAMPLED/image/gif/29c95e4d0e279ec429e1ed416fa0eaf6/gr1.gif https://s3-eu-west-1.amazonaws.com/prod-ucs-content-store-eu-west/content/pii:S1381116907004761/gr1/DOWNSAMPLED/image/gif/29c95e4d0e279ec429e1ed416fa0eaf6/gr1.gif gr1 gr1.gif gif 7539 256 357 IMAGE-DOWNSAMPLED 1-s2.0-S1381116907004761-gr1.sml https://s3.amazonaws.com/prod-ucs-content-store-us-east/content/pii:S1381116907004761/gr1/THUMBNAIL/image/gif/9d49bc7c4790ca55f3b53a4bf7b2c5ab/gr1.sml https://s3-eu-west-1.amazonaws.com/prod-ucs-content-store-eu-west/content/pii:S1381116907004761/gr1/THUMBNAIL/image/gif/9d49bc7c4790ca55f3b53a4bf7b2c5ab/gr1.sml gr1 gr1.sml sml 1656 90 125 IMAGE-THUMBNAIL 1-s2.0-S1381116907004761-gr2.gif https://s3.amazonaws.com/prod-ucs-content-store-us-east/content/pii:S1381116907004761/gr2/DOWNSAMPLED/image/gif/9b8e01870f6d9e779cf7d3b8f10a5886/gr2.gif https://s3-eu-west-1.amazonaws.com/prod-ucs-content-store-eu-west/content/pii:S1381116907004761/gr2/DOWNSAMPLED/image/gif/9b8e01870f6d9e779cf7d3b8f10a5886/gr2.gif gr2 gr2.gif gif 8434 256 357 IMAGE-DOWNSAMPLED 1-s2.0-S1381116907004761-gr2.sml https://s3.amazonaws.com/prod-ucs-content-store-us-east/content/pii:S1381116907004761/gr2/THUMBNAIL/image/gif/08c85fc20a9cdc4df000741aa1e4b155/gr2.sml https://s3-eu-west-1.amazonaws.com/prod-ucs-content-store-eu-west/content/pii:S1381116907004761/gr2/THUMBNAIL/image/gif/08c85fc20a9cdc4df000741aa1e4b155/gr2.sml gr2 gr2.sml sml 1908 90 125 IMAGE-THUMBNAIL 1-s2.0-S1381116907004761-gr3.gif https://s3.amazonaws.com/prod-ucs-content-store-us-east/content/pii:S1381116907004761/gr3/DOWNSAMPLED/image/gif/f04eeea0d6329e6239439d0f2203754d/gr3.gif https://s3-eu-west-1.amazonaws.com/prod-ucs-content-store-eu-west/content/pii:S1381116907004761/gr3/DOWNSAMPLED/image/gif/f04eeea0d6329e6239439d0f2203754d/gr3.gif gr3 gr3.gif gif 8958 257 357 IMAGE-DOWNSAMPLED 1-s2.0-S1381116907004761-gr3.sml https://s3.amazonaws.com/prod-ucs-content-store-us-east/content/pii:S1381116907004761/gr3/THUMBNAIL/image/gif/728012631525c5de01e6335dac7d9433/gr3.sml https://s3-eu-west-1.amazonaws.com/prod-ucs-content-store-eu-west/content/pii:S1381116907004761/gr3/THUMBNAIL/image/gif/728012631525c5de01e6335dac7d9433/gr3.sml gr3 gr3.sml sml 1993 90 125 IMAGE-THUMBNAIL 1-s2.0-S1381116907004761-gr4.gif https://s3.amazonaws.com/prod-ucs-content-store-us-east/content/pii:S1381116907004761/gr4/DOWNSAMPLED/image/gif/003286399cdc087daff62416d33c2b1b/gr4.gif https://s3-eu-west-1.amazonaws.com/prod-ucs-content-store-eu-west/content/pii:S1381116907004761/gr4/DOWNSAMPLED/image/gif/003286399cdc087daff62416d33c2b1b/gr4.gif gr4 gr4.gif gif 7513 255 357 IMAGE-DOWNSAMPLED 1-s2.0-S1381116907004761-gr4.sml https://s3.amazonaws.com/prod-ucs-content-store-us-east/content/pii:S1381116907004761/gr4/THUMBNAIL/image/gif/4c3d138b8cee268d95b8a8321784ab28/gr4.sml https://s3-eu-west-1.amazonaws.com/prod-ucs-content-store-eu-west/content/pii:S1381116907004761/gr4/THUMBNAIL/image/gif/4c3d138b8cee268d95b8a8321784ab28/gr4.sml gr4 gr4.sml sml 1644 89 125 IMAGE-THUMBNAIL 1-s2.0-S1381116907004761-gr5.gif https://s3.amazonaws.com/prod-ucs-content-store-us-east/content/pii:S1381116907004761/gr5/DOWNSAMPLED/image/gif/370ee8c08698c37b91e4301b0867a3bb/gr5.gif https://s3-eu-west-1.amazonaws.com/prod-ucs-content-store-eu-west/content/pii:S1381116907004761/gr5/DOWNSAMPLED/image/gif/370ee8c08698c37b91e4301b0867a3bb/gr5.gif gr5 gr5.gif gif 8520 253 357 IMAGE-DOWNSAMPLED 1-s2.0-S1381116907004761-gr5.sml https://s3.amazonaws.com/prod-ucs-content-store-us-east/content/pii:S1381116907004761/gr5/THUMBNAIL/image/gif/6865edb27839a744f0e3023b5c438689/gr5.sml https://s3-eu-west-1.amazonaws.com/prod-ucs-content-store-eu-west/content/pii:S1381116907004761/gr5/THUMBNAIL/image/gif/6865edb27839a744f0e3023b5c438689/gr5.sml gr5 gr5.sml sml 1880 89 125 IMAGE-THUMBNAIL 1-s2.0-S1381116907004761-gr6.gif https://s3.amazonaws.com/prod-ucs-content-store-us-east/content/pii:S1381116907004761/gr6/DOWNSAMPLED/image/gif/ac25f7648f5181badbcdaf63a6e6bf6c/gr6.gif https://s3-eu-west-1.amazonaws.com/prod-ucs-content-store-eu-west/content/pii:S1381116907004761/gr6/DOWNSAMPLED/image/gif/ac25f7648f5181badbcdaf63a6e6bf6c/gr6.gif gr6 gr6.gif gif 8173 255 357 IMAGE-DOWNSAMPLED 1-s2.0-S1381116907004761-gr6.sml https://s3.amazonaws.com/prod-ucs-content-store-us-east/content/pii:S1381116907004761/gr6/THUMBNAIL/image/gif/4ec603623c7640198934d63c65397608/gr6.sml https://s3-eu-west-1.amazonaws.com/prod-ucs-content-store-eu-west/content/pii:S1381116907004761/gr6/THUMBNAIL/image/gif/4ec603623c7640198934d63c65397608/gr6.sml gr6 gr6.sml sml 1828 89 125 IMAGE-THUMBNAIL 1-s2.0-S1381116907004761-gr7.gif https://s3.amazonaws.com/prod-ucs-content-store-us-east/content/pii:S1381116907004761/gr7/DOWNSAMPLED/image/gif/a04a194f8624a0218afd6a1fe4fe7daa/gr7.gif https://s3-eu-west-1.amazonaws.com/prod-ucs-content-store-eu-west/content/pii:S1381116907004761/gr7/DOWNSAMPLED/image/gif/a04a194f8624a0218afd6a1fe4fe7daa/gr7.gif gr7 gr7.gif gif 7537 256 357 IMAGE-DOWNSAMPLED 1-s2.0-S1381116907004761-gr7.sml https://s3.amazonaws.com/prod-ucs-content-store-us-east/content/pii:S1381116907004761/gr7/THUMBNAIL/image/gif/c607e53229de25649383c48ad79bc192/gr7.sml https://s3-eu-west-1.amazonaws.com/prod-ucs-content-store-eu-west/content/pii:S1381116907004761/gr7/THUMBNAIL/image/gif/c607e53229de25649383c48ad79bc192/gr7.sml gr7 gr7.sml sml 1677 90 125 IMAGE-THUMBNAIL 1-s2.0-S1381116907004761-gr8.gif https://s3.amazonaws.com/prod-ucs-content-store-us-east/content/pii:S1381116907004761/gr8/DOWNSAMPLED/image/gif/ddb3c0999635cd461de774b12c477c10/gr8.gif https://s3-eu-west-1.amazonaws.com/prod-ucs-content-store-eu-west/content/pii:S1381116907004761/gr8/DOWNSAMPLED/image/gif/ddb3c0999635cd461de774b12c477c10/gr8.gif gr8 gr8.gif gif 8387 256 357 IMAGE-DOWNSAMPLED 1-s2.0-S1381116907004761-gr8.sml https://s3.amazonaws.com/prod-ucs-content-store-us-east/content/pii:S1381116907004761/gr8/THUMBNAIL/image/gif/1dc0dccb1898010c24012ca82e7339b2/gr8.sml https://s3-eu-west-1.amazonaws.com/prod-ucs-content-store-eu-west/content/pii:S1381116907004761/gr8/THUMBNAIL/image/gif/1dc0dccb1898010c24012ca82e7339b2/gr8.sml gr8 gr8.sml sml 1872 90 125 IMAGE-THUMBNAIL 1-s2.0-S1381116907004761-gr9.gif https://s3.amazonaws.com/prod-ucs-content-store-us-east/content/pii:S1381116907004761/gr9/DOWNSAMPLED/image/gif/b52f909c884044cafe2978d7e11a7650/gr9.gif https://s3-eu-west-1.amazonaws.com/prod-ucs-content-store-eu-west/content/pii:S1381116907004761/gr9/DOWNSAMPLED/image/gif/b52f909c884044cafe2978d7e11a7650/gr9.gif gr9 gr9.gif gif 8735 256 357 IMAGE-DOWNSAMPLED 1-s2.0-S1381116907004761-gr9.sml https://s3.amazonaws.com/prod-ucs-content-store-us-east/content/pii:S1381116907004761/gr9/THUMBNAIL/image/gif/86843349c648fbdcd4eb0cbfa0e4a0f5/gr9.sml https://s3-eu-west-1.amazonaws.com/prod-ucs-content-store-eu-west/content/pii:S1381116907004761/gr9/THUMBNAIL/image/gif/86843349c648fbdcd4eb0cbfa0e4a0f5/gr9.sml gr9 gr9.sml sml 1956 90 125 IMAGE-THUMBNAIL 1-s2.0-S1381116907004761-gr10.gif https://s3.amazonaws.com/prod-ucs-content-store-us-east/content/pii:S1381116907004761/gr10/DOWNSAMPLED/image/gif/1e703a42b8b90de3ab4e96a5cc7622cc/gr10.gif https://s3-eu-west-1.amazonaws.com/prod-ucs-content-store-eu-west/content/pii:S1381116907004761/gr10/DOWNSAMPLED/image/gif/1e703a42b8b90de3ab4e96a5cc7622cc/gr10.gif gr10 gr10.gif gif 6446 265 357 IMAGE-DOWNSAMPLED 1-s2.0-S1381116907004761-gr10.sml https://s3.amazonaws.com/prod-ucs-content-store-us-east/content/pii:S1381116907004761/gr10/THUMBNAIL/image/gif/dfed2e82f8d741f5f5ab629e6e5012df/gr10.sml https://s3-eu-west-1.amazonaws.com/prod-ucs-content-store-eu-west/content/pii:S1381116907004761/gr10/THUMBNAIL/image/gif/dfed2e82f8d741f5f5ab629e6e5012df/gr10.sml gr10 gr10.sml sml 1464 93 125 IMAGE-THUMBNAIL 1-s2.0-S1381116907004761-sc1.gif https://s3.amazonaws.com/prod-ucs-content-store-us-east/content/pii:S1381116907004761/sc1/DOWNSAMPLED/image/gif/1e89079083c4e47f62a1ebafe99b5d91/sc1.gif https://s3-eu-west-1.amazonaws.com/prod-ucs-content-store-eu-west/content/pii:S1381116907004761/sc1/DOWNSAMPLED/image/gif/1e89079083c4e47f62a1ebafe99b5d91/sc1.gif sc1 sc1.gif gif 3348 227 188 IMAGE-DOWNSAMPLED 1-s2.0-S1381116907004761-sc1.sml https://s3.amazonaws.com/prod-ucs-content-store-us-east/content/pii:S1381116907004761/sc1/THUMBNAIL/image/gif/7832a3375cfbb8a07b8176753b60ab0e/sc1.sml https://s3-eu-west-1.amazonaws.com/prod-ucs-content-store-eu-west/content/pii:S1381116907004761/sc1/THUMBNAIL/image/gif/7832a3375cfbb8a07b8176753b60ab0e/sc1.sml sc1 sc1.sml sml 1007 93 77 IMAGE-THUMBNAIL 1-s2.0-S1381116907004761-fx1.gif https://s3.amazonaws.com/prod-ucs-content-store-us-east/content/pii:S1381116907004761/fx1/DOWNSAMPLED/image/gif/1e89079083c4e47f62a1ebafe99b5d91/fx1.gif https://s3-eu-west-1.amazonaws.com/prod-ucs-content-store-eu-west/content/pii:S1381116907004761/fx1/DOWNSAMPLED/image/gif/1e89079083c4e47f62a1ebafe99b5d91/fx1.gif fx1 true fx1.gif gif 3348 227 188 IMAGE-DOWNSAMPLED 1-s2.0-S1381116907004761-fx1.sml https://s3.amazonaws.com/prod-ucs-content-store-us-east/content/pii:S1381116907004761/fx1/THUMBNAIL/image/gif/7832a3375cfbb8a07b8176753b60ab0e/fx1.sml https://s3-eu-west-1.amazonaws.com/prod-ucs-content-store-eu-west/content/pii:S1381116907004761/fx1/THUMBNAIL/image/gif/7832a3375cfbb8a07b8176753b60ab0e/fx1.sml fx1 true fx1.sml sml 1007 93 77 IMAGE-THUMBNAIL MOLCAA 6882 S1381-1169(07)00476-1 10.1016/j.molcata.2007.07.049 Elsevier B.V. Fig. 1 IR spectra of adsorbed species arising from interaction of MoPO/SiO2 catalyst with (a) gaseous acetone at 323K for 10min, followed by evacuation and heating under vacuum to (b) 323K, (c) 373K, (d) 423K and (e) 473K. Fig. 2 IR spectra of adsorbed species arising from interaction of MoPO/SiO2 catalyst with (a) gaseous isopropanol at 323K for 10min, followed by evacuation and heating under vacuum to (b) 323K, (c) 373K, (d) 423K and (e) 473K. Fig. 3 IR spectra arising from interaction of MoPO/SiO2 catalyst with isopropanol at 323K for 10min, followed by evacuation at (a) 323K and heating under 5% O2/He atmosphere to (b) 423K, (c) 473K, (d) 573K, (e) 673K and (f) 773K. Fig. 4 IR spectra of adsorbed species arising from interaction of MoPO/SiO2 catalyst with (a) gaseous acrolein at 323K for 10min, followed by evacuation and heating under vacuum to (b) 323K, (c) 373K, (d) 423K and (e) 473K. Fig. 5 IR spectra of adsorbed species arising from interaction of MoPO/SiO2 catalyst with (a) gaseous allyl alcohol at 323K for 10min, followed by evacuation and heating under vacuum to (b) 323K, (c) 373K, (d) 423K and (e) 473K. Fig. 6 IR spectra arising from interaction of MoPO/SiO2 catalyst with allyl alcohol at 323K for 10min, followed by evacuation at (a) 323K and heating under 5% O2/He atmosphere to (b) 373K, (c) 423K, (d) 573K, (e) 673K and (f) 773K. Fig. 7 IR spectra of adsorbed species arising from interaction of propene with MoPO/SiO2 catalyst at 373K for 30min, followed by evacuation at (a) 373K and heating under vacuum to (b) 423K and (c) 473K. Fig. 8 IR spectra of adsorbed species arising from interaction of MoPO/SiO2 catalyst with (a) gaseous propanal at 323K for 10min, followed by evacuation and heating under vacuum to (b) 323K, (c) 373K, (d) 423K, (e) 473K and (f) 523K. Fig. 9 IR spectra of adsorbed species arising from interaction of MoPO/SiO2 catalyst with (a) gaseous 1-propanol at 323K for 10min, followed by evacuation and heating under vacuum to (b) 323K, (c) 373K, (d) 423K, (e) 473K and (f) 523K. Fig. 10 IR spectra arising from interaction of MoPO/SiO2 catalyst with propane/O2 at (a) 473K for 4h, followed by evacuation at (b) 473K. Scheme 1 Reaction network for propane selective oxidation to acrolein over MoPO/SiO2 catalyst. Table 1 Propane selective oxidation over MoPO/SiO2 catalyst Temperature (K) C3H8 conversion (%) Selectivity (%) C3H6 ACR PAL ACE Others CO x 673 5.8 77.2 10.3 – 6.1 – 6.4 723 11.7 50.4 14.7 0.5 4.1 4.4 25.9 773 30.2 30.3 19.8 0.8 6.2 10.8 32.1 823 36.8 22.6 8.5 – – 14.5 54.4 Reaction conditions: C3H8/O2/N2 =2/1/4, 6000mlg-cat.−1 h−1; cat., 0.2g; ACR, acrolein; PAL, propanal; ACE, acetone; CO x , CO+CO2; others, C2H4 +CH4 +acetaldehyde+methanol+formaldehyde. Table 2 Isopropanol oxidation over MoPO/SiO2 catalyst Temperature (K) 2-Propanol conversion (%) Selectivity (%) C3H6 ACR ACE PAL Others CO x 523 100 47.5 – 39.5 – 7.9 5.1 623 100 55.2 5.3 18.4 – 5.8 15.3 673 100 49.9 9.4 12.5 1.5 7.9 18.8 723 100 40.1 17.9 9.1 1.2 8.5 23.2 773 100 36.1 18.7 6.8 1.0 7.2 30.2 Reaction conditions: isopropanol/O2/N2 =2/1/4, 6000mlg-cat.−1 h−1; cat., 0.2g; ACR, acrolein; PAL, propanal; ACE, acetone; CO x , CO+CO2; others, C2H4 +CH4 +acetaldehyde+methanol+formaldehyde. Studies on the reaction pathways for the selective oxidation of propane to acrolein over MoPO/SiO2 catalyst by IR spectroscopy X.D. Yi ⁎ X.B. Zhang W.Z. Weng H.L. Wan ⁎ State Key Laboratory for Physical Chemistry of the Solid Surfaces, Department of Chemistry, College of Chemistry and Chemical Engineering, Xiamen University, Xiamen 361005, PR China ⁎ Corresponding authors. Graphical abstract The reaction networks for propane selective oxidation to acrolein were proposed by using the IR spectroscopy studies the adsorbed species and gaseous species formed by adsorption of the reactant, possible intermediates or their probe molecules as well as the reaction products on the MoPO/SiO2 catalyst and the transformation of these species at elevated temperature under vacuum and under O2/He atmosphere. To understand possible reaction pathway for propane selective oxidation to acrolein over the MoPO/SiO2 catalyst, the surface species formed by adsorption of the reactant (propane), possible intermediates or their probe molecules (propene, isopropanol, 1-propanol, 2-Br-propane, allyl alcohol) as well as the reaction products (acrolein, acetone and propanal) on the catalyst and the transformation of these species at elevated temperature under vacuum or under O2/He atmosphere were studied by IR spectroscopy. When a gas mixture of propane/oxygen was introduced to the catalyst at 473K for 4h, the band of adsorbed acetone with a shoulder assigned to adsorbed acrolein was observed. Using 2-Br-propane or isopropanol as the probe molecule, characteristic IR bands associated with isopropoxy species were detected over MoPO/SiO2 catalyst at 323K. Upon heating to 423K, the band of adsorbed acetone and adsorbed acrolein was also observed. The overall spectrum actually seems closely similar to that described above, arising from the adsorption of propane at the same temperature. On the other hand, if 1-Br-propane or n-propanol was used as the probe molecule, the formation of propanal was detected via n-propoxy. It was found that when propene was adsorbed on the catalyst at 373K, besides the σ-allyl species, isopropoxy was also detected by the IR spectra. Upon heating to 423K, two new bands ascribable to the acrolein and adsorbed acetone were observed. Based on these results and density functional calculations, the reaction network for selective oxidation of propane to acrolein over this catalyst was proposed. The propane activation is initiated by the H abstraction from the methylene group, leading to the formation of isopropyl species, which rebounds to the surface to form the isopropoxy species. The isopropoxy species can either undergo α-H elimination to form byproduct acetone or undergo β-H elimination to form the propylene. Propylene can undergo α-H abstraction to form a π-allyl, which is then followed by O insertion to form a σ-allyl, and is eventually dehydrogenated to acrolein. Keywords Selective oxidation of propane MoPO/SiO2 catalyst Reaction pathways IR 1 Introduction The partial oxidation of light alkanes has attracted much attention because it represents a route to obtain more valuable organic compounds such as alcohols, aldehydes, ketones and acids from low cost saturated hydrocarbons [1,2]. The main challenge for partial oxidation is that light alkanes are usually less reactive than the desired products, and further oxidized to total oxidation products, CO x , is thermodynamically favored. The selective oxidation of propane to acrolein was studied over various catalyst systems, but only a few showed good catalytic performances [3–5]. Current research on propane selective oxidation to acrolein concerns mainly fundamental aspects. In particular, a debate still exists on the reaction mechanism. The partial oxidation products such as propene, acrolein, acetone, propanal, acrylic acid, propionic acid and acetic acid as well as carbon oxides and water were observed when propane oxidation is carried out over different catalysts using flow reactors. Based on these results, significantly different reaction networks have been proposed in the literatures over Ag-Bi-Mo-V-O [6], Bi-Ba-Te-O [7], Te-P/NiMoO [8] and Mo-V-Te-Nb-O catalyst [9,10]. Broadly speaking, three major reaction routes are possible starting from propane. In the first route, propane is oxidized to isopropanol, which can dehydrate to propene or further oxidize to acetone. In the second route, propane forms propene by oxidative dehydrogenation that is oxidized to allyl alcohol and acrolein. In the third route, propane is oxidized to 1-propanol, which dehydrates to propene or is oxidized to propanal. This reaction network may be further complicated by transformations between intermediates of different routes. In situ spectroscopy investigations of surface species can provide important insights into the reaction intermediates for the reaction pathways. However, it is unlikely that surface intermediates can be identified by FTIR studies using only propane. The general approach has been to perform FTIR studies for the adsorption of compounds expected to be related to surface species, such as propene, isopropanol and 1-propanol, etc. Several groups have performed in situ IR studies to investigate propane oxidation [11–16]. Busca and co-workers [11–13] investigated the mechanism of propane total oxidation on spinel-type catalysts Mn3O4, Co3O4 and MgCr2O4 by IR spectroscopy. A surface reaction network in propane total oxidation was proposed in which isopropoxy species was the major intermediate. Centi et al. [14] studied the adsorption and transformation of propane and possible intermediates on VSbO catalyst in relation to the mechanism of acrylonitrile synthesis from propane. The acrylate species was observed in the spectra of propane adsorption. Their results suggested that the main route of propane conversion is through the formation of propene as intermediate, although a side reaction of acrylate formation via propionate intermediate is also possible. Zaki and co-workers [15] also studied the propane, isopropanol, acetone and acetic acid over ZrO2, TiO2 and CeO2 catalysts by IR spectroscopy. Their analysis indicated that the initial catalytic interaction is the oxidative dehydrogenation of propane into propene, rather than the oxidative addition into isopropanol. However, few details are known about the involved adspecies and their conversion dynamics on the catalyst surface for the selective oxidation of propane to acrolein or acrylic acid. Recently, we have showed that MoPO/SiO2 catalyst was active and selective in the propane selective oxidation to acrolein with the 30.2% selectivity of acrolein at the propane conversion of 19.8% [17,18]. The major products of the propane oxidation over this catalyst are propene, acrolein and carbon oxides, but small amounts of acetone, propanal, acetaldehyde, methanol and cracking hydrocarbon products are also produced. To understand possible reaction pathways for propane selective oxidation to acrolein over the MoPO/SiO2 catalyst, the surface species formed by adsorption of the reactant (propane), possible intermediates or their probe molecules (propene, isopropanol, 1-propanol, 2-Br-propane, allyl alcohol) as well as the reaction products (acrolein, acetone and propanal) on the catalyst and the transformation of these species at elevated temperature under vacuum or under O2/He atmosphere were studied by IR spectroscopy, respectively. 2 Experimental 2.1 Catalyst preparation The catalysts were prepared by impregnation of silica (294m2/g) with a solution containing the desired quantities of ammonium heptamolybdate and NH4H2PO4. Impregnated samples were dried overnight at 393K and calcined in air at 653K for 4h followed by at 823K for a further 6h. The sample is denoted as MoPO/SiO2 (Mo:P:Si=3.5:5:100, molar ratio). The surface area of the catalyst as measured by BET methods was 207m2/g. 2.2 Catalytic tests The experiments of propane and isopropanol oxidations were carried out at atmospheric pressure in a continuous flow system with a fixed-bed quartz tubular reactor operated over a wide range of temperatures. The temperature was measured with a coaxial thermocouple. To minimize possible homogeneous reactions, the space of the reactor up and down the catalyst bed was filled with quartz wool. The exit gases were heated to 393K to prevent product condensation. The reactant and products were analyzed by two on-line gas chromatographs operating three columns: a TDX-601 column and Al2O3 column impregnated with squalane for the separation of C3H8, C3H6, C2H4, CH4, CO and CO2; a GDX-103 column for the separation of acetaldehyde, acrolein, acetone and propanal. 2.3 Catalyst characterization The IR spectra were recorded in transmission mode with a Perkin-Elmer Spectrum 2000 FTIR spectrometer using an in situ IR cells (BaF2 windows) connected to an evacuation-gas manipulation apparatus. The catalyst power was pressed into self-supporting discs that were calcined in O2 at 773K for 1h, followed by evacuation at the same temperature for 10min and cooled under vacuum to certain temperature to record the background spectra of the cell and the catalyst wafer. The selective molecule (10–5Torr, depending on the vapor pressure of the liquid reactants at RT) was then introduced into the cell at 323K and the gas/solid interface was maintained for 10min to 4h. The IR spectra of adsorbed species and gaseous species were recorded under vacuum or under 5% O2/He atmosphere at elevated temperature, respectively, after the gas phase components in the IR cell were removed by evacuation. The spectrum of the adsorbed species was referenced to the background spectrum of the pretreated catalyst recorded under vacuum at the same temperature before the admission of adsorbates. In the case of propane, due to its inertness, a slightly different protocol was used. A gas mixture of propane/oxygen was contacted with the catalyst at 323, 373, 423, 473 and 523K, respectively, then recording the spectrum for each temperature. 3 Results and discussion 3.1 Propane oxidation The results of propane oxidation over catalyst are showed in Table 1 . The major products of the propane oxidation over MoPO/SiO2 catalyst are propene, acrolein and carbon oxides (CO and CO2), but small amounts of acetone, propanal, acetaldehyde, methanol and cracking hydrocarbon products (methane and ethylene) were also produced at higher temperature. As the temperature was increased, the selectivity to propene decreases, while the selectivity to acrolein shows a maximum at 773K. This implies that propene undergoes consecutive oxidation, mainly to acrolein. At 773K, the conversion of propane was 30.2%, while the selectivities to propene and acrolein are 30.3 and 19.8%, respectively. 3.2 IR spectra arising from acetone, isopropanol and 2-Br-propane adsorptions Since all the intermediates or their probe molecules for propane selective oxidation to acrolein will convert to oxygenated compounds at last over the catalysts, for reading purposes, the experiments concerning the adsorption of oxygenated compounds will be discussed first. For FTIR studies using MoPO/SiO2 catalyst, only bands above 1300cm−1 are observable due to strong adsorption by the catalyst in the region below 1300cm−1. 3.2.1 Acetone adsorption The spectra of acetone adsorbed at 323K show evidence that acetone adsorbs at 323K without reaction (Fig. 1b). The sharp and very intense band at 1703cm−1 can be assigned to νCO of acetone coordinated to Lewis-acid sites of catalyst surface. Other bands are observed at 1422 and 1373cm−1 (CH3 bendings) [19]. These bands decrease in intensity with increasing temperature up to 473K. 3.2.2 Isopropanol and 2-Br-propane adsorption The adsorption of isopropanol on MoPO/SiO2 catalyst at 323K is characterized by IR bands at 2983, 2943 and 2885cm−1 (νCH), 1469 and 1461cm−1 ( δ as , C H 3 ), 1389 and 1378cm−1 ( δ s , C H 3 ) and 1343cm−1 (δCH) (Fig. 2a). These bands can be assigned to the isopropoxy species [11,20]. It is interesting to see that the IR bands shown in Fig. 2a are very similar to those arising from the adsorption of 2-Br-propane over the same catalyst at same temperature. Since the strength of CBr bond in 2-Br-propane is weak than that of CH bond in the methylene group of propane, the isopropyl species should be more easily formed from 2-Br-propane than from propane. Therefore, we can use 2-Br-propane as a probe molecule to investigate the conversion of isopropyl species on the catalyst. This observation suggested that isopropoxy species is readily formed by adsorption of 2-Br-propane on the catalyst at 323K. A rational explanation to the observation is that the carbon–oxygen interaction is stronger than the carbon–metal interaction. Therefore, the isopropyl species interacts most probably with a lattice oxygen atom than with a surface metal cation [21,22]. As the samples were heated to 423K under vacuum, the band of adsorbed acetone (1688cm−1, νCO) with a shoulder of adsorbed acrolein (1668cm−1, νCO) was observed. This assignment is based on the comparison of the spectra c in Fig. 2 with the IR spectra arising from acetone and acrolein adsorption over the catalyst under the comparable conditions (Figs. 1 and 4). In order to obtain the information of gaseous species, the IR spectra of the sample containing the pre-adsorbed isopropoxy species heated under 5% O2/He atmosphere were also recorded. When the sample containing the pre-adsorbed isopropoxy species was heated under 5% O2/He atmosphere from 323 to 473K (Fig. 3c), the IR bands of the adsorbed acetone (1690cm−1), gaseous acetone (1738 and 1722cm−1, νCO) and propene (1667 and 1637cm−1, νCC) were detected. After heating to 573K, the broad bands at 1733 and 1713cm−1 (νCO), due to gaseous acrolein, are also observed. These observations indicated that acetone, propene and acrolein are the main products of the oxidative conversion of surface isopropoxy species. This is in agreement with the results of the catalytic oxidation of isopropanol using a fixed bed reactor (Table 2 ). Conversion of the isopropanol starts to be observable at 423K and approaches to be total at 523K. At this temperature, the main products are propene and acetone. As the temperature is increased to 623K, acrolein is formed and the selectivity to acrolein increases, while the selectivity to propene decreases with increasing temperature. Additionally, small amounts of propanal are also observed at higher temperature and may result from the oxidation of propene. These results showed that adsorption of isopropanol readily give rise to isopropoxy species, which can either convert to propene by β-hydrogen elimination or to acetone by dehydrogenation. The former can further convert to acrolein through allylic process. 3.3 IR spectra arising from acrolein, allyl alcohol and propene adsorptions 3.3.1 Acrolein adsorption The spectra of the adsorbed species of acrolein over MoPO/SiO2 catalyst and followed by evacuation at higher temperature are shown in Fig. 4 . The most intense band assigned to CO stretching is observed at 1673cm−1. Other bands are observed at 1633cm−1 (CC stretching), 1428cm−1 (CH2 scissoring) and 1365cm−1 (CH deformation) [23]. With increasing temperature, the bands associated with acrolein coordinated to Lewis-acid sites progressively decrease and disappear after evacuation at 523K. 3.3.2 Allyl alcohol adsorption Allyl alcohol in contact with MoPO/SiO2 catalyst at 323K (Fig. 5 ) gives rise to a spectrum with the frequency of the bands modified with respect to those of gaseous allyl alcohol. The bands at 3091, 3024, 2992, 2946 and 2892cm−1 are assigned to ν(CH) stretching; the band at 1649cm−1 is assigned to ν(CC) stretching; a stronger and very sharp band at 1426cm−1 is due to the scissoring of the CH2 group, while bands at 1460, 1346 and 1380cm−1 are assigned to the scissoring of the CH2 O group and CH2 wagging. The absence of the adsorption band related to the OH stretching (3663cm−1) and the value of the ν(CC) frequency shifted down with respect to the gaseous allyl alcohol (1654cm−1, νCC) indicate that these bands are due to allyl alcoholate [11]. As the temperature increases under vacuum, a progressive increase in the intensity of the band at 1671cm−1 is observed up to 423K which indicates that acrolein, not present initially, forms progressively with a parallel decrease in the relative intensity of the bands of allyl alcoholate. The IR spectra of the sample containing the pre-adsorbed allyl alcoholate species heated under 5% O2/He atmosphere from 323 to 773K are shown in Fig. 6 . With increasing temperature, the bands associated with allyl alcoholate progressively decrease, while the bands of gaseous acrolein (1733 and 1713cm−1, νCO) increase in relative intensity up to 473K, and then decrease at higher temperatures. However, additional band at 1763cm−1 indicates the formation of gaseous propanal. Since propanal is not observed starting from acrolein adsorption, it is reasonable to consider that propanal may result from allyl alcoholate isomerization, the direct isomerization of the allyl alcoholate to propanal by-passing the acrolein formation (allyl alcoholate→enolate→propanal) [24]. These results showed that the adsorption of allyl alcohol readily gives rise to allyl alcoholate species at 323K, which further converted to acrolein and small amounts of propanal at higher temperatures. 3.3.3 Propene adsorption The IR spectra recorded after propene was introduced to the catalyst at 373K and followed by evacuation are showed in Fig. 7a [18]. Compared to the spectra shown in Fig. 2b, the bands at 2983, 2943, 2885, 1461, 1389, 1378 and 1346cm−1 can be assigned to isopropoxy species. However, additional bands at 1863cm−1 ( 2 w C H 2 − ), 1649cm−1 (νCC) and 1426cm−1 ( δ C H 2 ) can be assigned to allyl alcoholate species, since the similar IR bands are observed after adsorption of allyl alcohol on the catalyst (Fig. 6b). This is further confirmed by the bands observed in the νCH region above 3000cm−1. The other bands of allyl alcoholate species are overlap with those of isopropoxy species. As the temperature was increased to 423K under vacuum, the intensity of the bands of isopropoxy species and allyl alcoholate species decreases considerably, while two new bands ascribable to the acrolein (1671cm−1, νCO) and adsorbed acetone (1688cm−1, νCO) were observed. These results showed that two major routes may be involved in the oxidation of propene: The first one involves breaking of the CH bond of the methyl group with subsequent oxygen insertion to give allyl alcoholate, which then convert to acrolein; the second route is associated with the electrophilic attack of the Brønsted acid sites on the catalyst at the propene double bond, giving rise to isopropoxy species, which is then oxidized to acetone. A likely intermediate in the first route is the formation of π-allyl species, either anionic or radical, as proposed for the selective oxidation of propene to acrolein. Anionic allyl species have been identified on ZnO and ZrO2, which are not active allylic oxidation catalysts [25]. When propene was adsorbed over MoVTeNbO catalyst, the band at 1493cm−1 due to π-allylic compound was observed [26]. While on uranyl antimonite catalyst, only acrolein was found upon propene adsorption, but neither the π-allyl intermediate nor allyl alcoholate was detected spectroscopically [27]. This is probably because π-allyl species was oxidized so rapidly to allyl alcoholate species that it cannot be observed. This also implies that the rate-determining step of propene oxidation is the first hydrogen abstraction from the methyl group. 3.4 IR spectra arising from propanal and 1-propanol adsorptions 3.4.1 Propanal adsorption The adsorption of propanal on the catalyst at 323K and followed by evacuation at increasing temperature is shown in Fig. 8 . The bands at 1710, 1670 and 1635cm−1 are assigned to νCO of propanal coordinated with different Lewis-acid sites of catalyst surface. Other bands are observed at 1463cm−1 (methyl asymmetric deformation), 1413cm−1 (CH2 deformation), 1386cm−1 (CH deformation) and 1336cm−1 (CH2 scissoring) [28]. Increasing the temperature up to 473K leads to a decrease in the intensity of the bands of propanal coordinated to Lewis-acid sites and an increase in the intensity of the broad band centered at 1592cm−1. The band at 1592cm−1 cannot be assigned to carboxylate species, because it occurs at much higher frequency than ν(CO2 −) frequency of carboxylate species on MoPO/SiO2 catalyst. In fact, enolate anions have been found to be responsible for bands in the region 1640–1540cm−1 [29]. Therefore, it is suggested that propanal enolate anion is formed by proton extraction on the cation–anion couple sites, responsible for the band at 1592cm−1 (CCO stretching). Further heating at 523K under vacuum leads to appearance of the broad bands near 1560 and 1532cm−1. However, the spectrum does not correspond either to that of formate species or that to propionate species only and perhaps due to a mixture of formate species, acetic species and propionate species. 3.4.2 1-Propanol adsorption The adsorption of 1-propanol on the catalyst at 323K and followed by evacuation at increasing temperature is shown in Fig. 9 . 1-Propanol adsorption at 323K gives rise to propoxy species characterized by bands at 1463, 1442, 1399, 1386 and 1349cm−1 (CH3 and CH2 deformations) [11]. With heat treatment the spectra are due to adsorbed propanal (1626cm−1), enolate anion (1592cm−1), and a mixture of formate species, acetic species and propionate species (1560 and 1532cm−1) were observed, in agreement with the spectra observed for the adsorption and evacuation of propanal at comparable temperatures. 3.5 IR spectra arising from propane adsorption No surface species was detected when a gas mixture of propane/oxygen was introduced to the catalyst until the temperature of the sample was raised to 473K (Fig. 10 ). After the gas mixture of C3H8/O2 was introduced to the catalyst at 473K for 4h, the IR spectra of the adsorbed acetone (1688cm−1, νCO), gas phase acetone (1738 and 1722cm−1, νCO) and propene (1667 and 1637cm−1, νCC) were detected (Fig. 10a). When the gas phase components were removed by evacuation, the overall spectrum actually seems closely similar to those described above, arising from the adsorption of isopropanol and 2-Br-propane at the same temperature. The band of adsorbed acetone (1688cm−1, νCO) with a shoulder at 1668 (νCO)cm−1 assigned to adsorbed acrolein was observed (Fig. 10b). The formation of acrolein and acetone during the propane adsorption suggests that propane is activated by abstracting a hydrogen atom from methylene group. This is followed by bonding of the lattice oxygen near by over the catalyst with the secondary carbon of isopropyl species leading to the formation of an isopropoxy species. This is agreement with the work by Iglesia and co-workers [30]. The study of kinetic isotopic effects for the oxidative dehydrogenation of propane to propene on MoO x /ZrO2 catalyst showed that the methylene CH bond activation is the rate-determining step for propane dehydrogenation reaction. This is also agreement with the work by Busca et al. [12]. They studied the interaction of light hydrocarbons (methane, ethane, propane, propene, n-butane, isobutene, 1-butene, benzene ad toluene) over the MgCr2O4 by IR spectroscopy [12]. It has been concluded that every hydrocarbon reacts at its weakest CH bond giving rise to the corresponding alkoxide species. The earlier intermediates (alkoxides, carbonyl compounds) are detectable only with the most reactive hydrocarbons (propane, n-butane, isobutene, propene, 1-butene and toluene) while with the least reactive hydrocarbons (methane and benzene), only the final intermediates are detectable (carbonates, carboxylates). In our case, the results showed that propene reacts at its allylic position giving rise to allyl alcoholate, while propane likely reacts at C(2) giving rise to isopropoxy species on MoPO/SiO2 catalyst. The formation of isopropoxy species cannot be detected under the experimental conditions of propane adsorption over MoPO/SiO2 catalyst (Fig. 10a), since the IR spectra shown in Fig. 2 clearly indicated that the conversion of isopropoxy species to acetone over the catalyst took place at 423K. Furthermore, Our group have systematically investigated the CH bond initial activation of light alkanes (C1 and C3) on the cluster models of high valence transition metal oxides (V3O6Cl3, Cr3O9, Mo3O9 and W3O9) [31–33]. We have explored eight possible activation pathways. H abstraction is a 1e process, which is referred as a radical mechanism, involving alkyl radical formation. The reactivity of different MO x was found to be correlated with the HOMO x−1 bond strength. We have considered H abstraction both by terminal oxygen and bridge oxygen. We have also considered H abstraction via anti mode and syn mode. We found that anti H abstraction by terminal oxygen is the most favorable pathway and H abstraction from the methylene group is more feasible than that from the methyl group. All in all, the calculated CH bond activation barriers are in good agreement with the experimental values. Moreover, our calculations found that the most favorable pathway on Mo3O9 is for methyl to recombine with a nearby oxo. We calculated this rebound step to be a fast process with a small barrier of 8.6kcal/mol such that H abstraction followed by a fast oxygen atom insertion leads to the formation of stable hydroxyl and alkoxy species [31]. The same is true when propane is concerned, which leads to the formation of isopropoxy species after H abstraction from the methylene group. Thus, the density functional theory calculations are also in good agreement with the IR experimental results. 4 Conclusions In conclusion, the adsorbed species and gaseous species formed by adsorption of the reactant, possible intermediates or their probe molecules as well as the reaction products on the MoPO/SiO2 catalyst and the transformation of these species at elevated temperature under vacuum and under O2/He atmosphere were studied by IR spectroscopy. The results suggest that isopropoxy species is likely the intermediate of propane selective oxidation to acrolein over MoPO/SiO2 catalyst. Isopropoxy specie is converted to propene by β-hydrogen elimination or to acetone by oxidative dehydrogenation. The former can be further oxidized to acrolein through allylic process or to acetone through oxyhydration process. A more detailed reaction network is shown in Scheme 1 . Acknowledgements This project is supported by the Ministry of Science and Technology of China (2005CB221408), the National Natural Science Foundation of China (20433030, 20021002 and 20423002) and Key Scientific Project of Fujian Province, China (2005HZ01-3). Appendix A Supplementary data Supplementary data associated with this article can be found, in the online version at: doi:10.1016/j.molcata.2007.07.049. Appendix A Supplementary data References [1] C. Batiot B.K. Hodnett Appl. Catal. A: Gen. 137 1996 179 [2] M.M. Lin Appl. Catal. A: Gen. 207 2001 1 [3] Y.H. Zhu W.M. Lu H. Li H.L. Wan J. Catal. 246 2007 382 [4] N. Dimitratos J.C. Vedrine J. Mol. Catal. A: Chem. 255 2006 184 [5] H. Hibst F. Rosowski G. Cox Catal. Today 117 2006 234 [6] Y.C. Kim W. Ueda Y. Morooka Stud. Surf. Sci. Catal. 55 1990 491 [7] W.C. Conner S. Soled A. Signorelli Stud. Surf. Sci. Catal. 7 1991 1224 [8] A. Kaddouri C. Mazzocchia E. Tempesti Appl. Catal. A: Gen. 180 1999 271 [9] L. Luo J.A. Labinger M.E. Davis J. Catal. 200 2001 222 [10] M.H. Lin T.B. Desai F.W. Kaiser P.D. Klugherz Catal. Today 61 2000 223 [11] E. Finocchio G. Busca V. Lorenzelli V.S. Escribano J. Chem. Soc., Faraday Trans. 92 1996 1587 [12] G. Busca E. Finocchio V. Lorenzelli G. Ramis M. Baldi Catal. Today 49 1999 453 [13] E. Finocchio G. Busca V. Lorenzelli R.J. Willey J. Catal. 151 1995 204 [14] G. Centi F. Marchi S. Perathoner J. Chem. Soc., Faraday Trans. 92 1996 5149 [15] M.A. Hasan M.I. Zaki L. Pasupulety J. Phys. Chem. B 106 2002 12747 [16] M.O. Guerrero-Perez M.C. Herrera I. Malpartida M.A. Larrubia L.J. Alemany Catal. Today 118 2006 360 [17] X.D. Yi W.Z. Weng C.J. Huang Y.M. He W. Guo H.L. Wan Chin. J. Catal. 24 2003 769 [18] X.D. Yi W.Z. Weng C.J. Huang Y.M. He W. Guo H.L. Wan Stud. Surf. Sci. Catal. 147 2004 667 [19] M.I. Zaki M.A. Hasan L. Pasupulety Langmuir 17 2001 4025 [20] C. Resini T. Montanari G. Busca J.M. Jehgn I.E. Wachs Catal. Today 99 2005 105 [21] G. Centi F. Trifiro J.R. Ebner V.M. Franchetti Chem. Rev. 88 1988 55 [22] P.M. Michalakos M.C. Kung J. Jahan H. Kung J. Catal. 140 1993 226 [23] T.V. Andrushkevich G.Y. Popova Russ. Chem. Rev. 60 1991 1023 [24] R. Hubaut J.P. Bonnelle M.J. Daage Mol. Catal. 55 1989 170 [25] Yu.G. Kolyagin V.V. Ordomsky Y.Z. Khimyak A.I. Rebrov F. Fajula I.I. Ivanova J. Catal. 238 2006 122 [26] P. Concepcion P. Botella J.M. Nieto Appl. Catal. A: Gen. 278 2004 45 [27] E. Finocchio G. Busca V. Lorenzelli J. Chem. Soc., Faraday Trans. 90 1994 3347 [28] E.F. Worden Spectrochim. Acta 18 1962 1121 [29] W.O. George V.G. Mansell Spectrochim. Acta 24 1968 145 [30] K.D. Chen E. Iglesia A.T. Bell J. Phys. Chem. B 105 2001 646 [31] G. Fu X. Xu X. Lu H.L. Wan J. Am. Chem. Soc. 127 2005 3989 [32] G. Fu X. Xu X. Lu H.L. Wan J. Phys. Chem. B 109 2005 6416 [33] G. Fu X. Xu H.L. Wan Catal. Today 117 2006 133",
      "scopus-id": "35348915331",
      "coredata": {
        "eid": "1-s2.0-S1381116907004761",
        "dc:description": "To understand possible reaction pathway for propane selective oxidation to acrolein over the MoPO/SiO2 catalyst, the surface species formed by adsorption of the reactant (propane), possible intermediates or their probe molecules (propene, isopropanol, 1-propanol, 2-Br-propane, allyl alcohol) as well as the reaction products (acrolein, acetone and propanal) on the catalyst and the transformation of these species at elevated temperature under vacuum or under O2/He atmosphere were studied by IR spectroscopy. When a gas mixture of propane/oxygen was introduced to the catalyst at 473K for 4h, the band of adsorbed acetone with a shoulder assigned to adsorbed acrolein was observed. Using 2-Br-propane or isopropanol as the probe molecule, characteristic IR bands associated with isopropoxy species were detected over MoPO/SiO2 catalyst at 323K. Upon heating to 423K, the band of adsorbed acetone and adsorbed acrolein was also observed. The overall spectrum actually seems closely similar to that described above, arising from the adsorption of propane at the same temperature. On the other hand, if 1-Br-propane or n-propanol was used as the probe molecule, the formation of propanal was detected via n-propoxy. It was found that when propene was adsorbed on the catalyst at 373K, besides the σ-allyl species, isopropoxy was also detected by the IR spectra. Upon heating to 423K, two new bands ascribable to the acrolein and adsorbed acetone were observed. Based on these results and density functional calculations, the reaction network for selective oxidation of propane to acrolein over this catalyst was proposed. The propane activation is initiated by the H abstraction from the methylene group, leading to the formation of isopropyl species, which rebounds to the surface to form the isopropoxy species. The isopropoxy species can either undergo α-H elimination to form byproduct acetone or undergo β-H elimination to form the propylene. Propylene can undergo α-H abstraction to form a π-allyl, which is then followed by O insertion to form a σ-allyl, and is eventually dehydrogenated to acrolein.",
        "openArchiveArticle": "false",
        "prism:coverDate": "2007-11-16",
        "openaccessUserLicense": null,
        "prism:aggregationType": "Journal",
        "prism:url": "https://api.elsevier.com/content/article/pii/S1381116907004761",
        "dc:creator": [
          {
            "@_fa": "true",
            "$": "Yi, X.D."
          },
          {
            "@_fa": "true",
            "$": "Zhang, X.B."
          },
          {
            "@_fa": "true",
            "$": "Weng, W.Z."
          },
          {
            "@_fa": "true",
            "$": "Wan, H.L."
          }
        ],
        "link": [
          {
            "@_fa": "true",
            "@rel": "self",
            "@href": "https://api.elsevier.com/content/article/pii/S1381116907004761"
          },
          {
            "@_fa": "true",
            "@rel": "scidir",
            "@href": "https://www.sciencedirect.com/science/article/pii/S1381116907004761"
          }
        ],
        "dc:format": "application/json",
        "openaccessType": null,
        "pii": "S1381-1169(07)00476-1",
        "prism:volume": "277",
        "prism:publisher": "Elsevier B.V.",
        "dc:title": "Studies on the reaction pathways for the selective oxidation of propane to acrolein over MoPO/SiO2 catalyst by IR spectroscopy",
        "prism:copyright": "Copyright © 2007 Elsevier B.V. All rights reserved.",
        "openaccess": "0",
        "prism:issn": "13811169",
        "prism:issueIdentifier": "1-2",
        "dcterms:subject": [
          {
            "@_fa": "true",
            "$": "Selective oxidation of propane"
          },
          {
            "@_fa": "true",
            "$": "MoPO/SiO2 catalyst"
          },
          {
            "@_fa": "true",
            "$": "Reaction pathways"
          },
          {
            "@_fa": "true",
            "$": "IR"
          }
        ],
        "openaccessArticle": "false",
        "prism:publicationName": "Journal of Molecular Catalysis A: Chemical",
        "prism:number": "1-2",
        "openaccessSponsorType": null,
        "prism:pageRange": "202-209",
        "prism:endingPage": "209",
        "pubType": "fla",
        "prism:coverDisplayDate": "16 November 2007",
        "prism:doi": "10.1016/j.molcata.2007.07.049",
        "prism:startingPage": "202",
        "dc:identifier": "doi:10.1016/j.molcata.2007.07.049",
        "openaccessSponsorName": null
      },
      "objects": {
        "object": [
          {
            "@category": "thumbnail",
            "@height": "15",
            "@width": "37",
            "@_fa": "true",
            "$": "https://api.elsevier.com/content/object/eid/1-s2.0-S1381116907004761-si4.gif?httpAccept=%2A%2F%2A",
            "@multimediatype": "GIF image file",
            "@type": "ALTIMG",
            "@size": "222",
            "@ref": "si4",
            "@mimetype": "image/gif"
          },
          {
            "@category": "thumbnail",
            "@height": "17",
            "@width": "51",
            "@_fa": "true",
            "$": "https://api.elsevier.com/content/object/eid/1-s2.0-S1381116907004761-si3.gif?httpAccept=%2A%2F%2A",
            "@multimediatype": "GIF image file",
            "@type": "ALTIMG",
            "@size": "273",
            "@ref": "si3",
            "@mimetype": "image/gif"
          },
          {
            "@category": "thumbnail",
            "@height": "15",
            "@width": "39",
            "@_fa": "true",
            "$": "https://api.elsevier.com/content/object/eid/1-s2.0-S1381116907004761-si2.gif?httpAccept=%2A%2F%2A",
            "@multimediatype": "GIF image file",
            "@type": "ALTIMG",
            "@size": "222",
            "@ref": "si2",
            "@mimetype": "image/gif"
          },
          {
            "@category": "thumbnail",
            "@height": "15",
            "@width": "45",
            "@_fa": "true",
            "$": "https://api.elsevier.com/content/object/eid/1-s2.0-S1381116907004761-si1.gif?httpAccept=%2A%2F%2A",
            "@multimediatype": "GIF image file",
            "@type": "ALTIMG",
            "@size": "253",
            "@ref": "si1",
            "@mimetype": "image/gif"
          },
          {
            "@category": "standard",
            "@_fa": "true",
            "$": "https://api.elsevier.com/content/object/eid/1-s2.0-S1381116907004761-mmc1.doc?httpAccept=%2A%2F%2A",
            "@multimediatype": "Microsoft Word file",
            "@type": "APPLICATION",
            "@size": "336384",
            "@ref": "mmc1",
            "@mimetype": "application/word"
          },
          {
            "@category": "standard",
            "@height": "256",
            "@width": "357",
            "@_fa": "true",
            "$": "https://api.elsevier.com/content/object/eid/1-s2.0-S1381116907004761-gr1.gif?httpAccept=%2A%2F%2A",
            "@multimediatype": "GIF image file",
            "@type": "IMAGE-DOWNSAMPLED",
            "@size": "7539",
            "@ref": "gr1",
            "@mimetype": "image/gif"
          },
          {
            "@category": "thumbnail",
            "@height": "90",
            "@width": "125",
            "@_fa": "true",
            "$": "https://api.elsevier.com/content/object/eid/1-s2.0-S1381116907004761-gr1.sml?httpAccept=%2A%2F%2A",
            "@multimediatype": "GIF image file",
            "@type": "IMAGE-THUMBNAIL",
            "@size": "1656",
            "@ref": "gr1",
            "@mimetype": "image/gif"
          },
          {
            "@category": "standard",
            "@height": "256",
            "@width": "357",
            "@_fa": "true",
            "$": "https://api.elsevier.com/content/object/eid/1-s2.0-S1381116907004761-gr2.gif?httpAccept=%2A%2F%2A",
            "@multimediatype": "GIF image file",
            "@type": "IMAGE-DOWNSAMPLED",
            "@size": "8434",
            "@ref": "gr2",
            "@mimetype": "image/gif"
          },
          {
            "@category": "thumbnail",
            "@height": "90",
            "@width": "125",
            "@_fa": "true",
            "$": "https://api.elsevier.com/content/object/eid/1-s2.0-S1381116907004761-gr2.sml?httpAccept=%2A%2F%2A",
            "@multimediatype": "GIF image file",
            "@type": "IMAGE-THUMBNAIL",
            "@size": "1908",
            "@ref": "gr2",
            "@mimetype": "image/gif"
          },
          {
            "@category": "standard",
            "@height": "257",
            "@width": "357",
            "@_fa": "true",
            "$": "https://api.elsevier.com/content/object/eid/1-s2.0-S1381116907004761-gr3.gif?httpAccept=%2A%2F%2A",
            "@multimediatype": "GIF image file",
            "@type": "IMAGE-DOWNSAMPLED",
            "@size": "8958",
            "@ref": "gr3",
            "@mimetype": "image/gif"
          },
          {
            "@category": "thumbnail",
            "@height": "90",
            "@width": "125",
            "@_fa": "true",
            "$": "https://api.elsevier.com/content/object/eid/1-s2.0-S1381116907004761-gr3.sml?httpAccept=%2A%2F%2A",
            "@multimediatype": "GIF image file",
            "@type": "IMAGE-THUMBNAIL",
            "@size": "1993",
            "@ref": "gr3",
            "@mimetype": "image/gif"
          },
          {
            "@category": "standard",
            "@height": "255",
            "@width": "357",
            "@_fa": "true",
            "$": "https://api.elsevier.com/content/object/eid/1-s2.0-S1381116907004761-gr4.gif?httpAccept=%2A%2F%2A",
            "@multimediatype": "GIF image file",
            "@type": "IMAGE-DOWNSAMPLED",
            "@size": "7513",
            "@ref": "gr4",
            "@mimetype": "image/gif"
          },
          {
            "@category": "thumbnail",
            "@height": "89",
            "@width": "125",
            "@_fa": "true",
            "$": "https://api.elsevier.com/content/object/eid/1-s2.0-S1381116907004761-gr4.sml?httpAccept=%2A%2F%2A",
            "@multimediatype": "GIF image file",
            "@type": "IMAGE-THUMBNAIL",
            "@size": "1644",
            "@ref": "gr4",
            "@mimetype": "image/gif"
          },
          {
            "@category": "standard",
            "@height": "253",
            "@width": "357",
            "@_fa": "true",
            "$": "https://api.elsevier.com/content/object/eid/1-s2.0-S1381116907004761-gr5.gif?httpAccept=%2A%2F%2A",
            "@multimediatype": "GIF image file",
            "@type": "IMAGE-DOWNSAMPLED",
            "@size": "8520",
            "@ref": "gr5",
            "@mimetype": "image/gif"
          },
          {
            "@category": "thumbnail",
            "@height": "89",
            "@width": "125",
            "@_fa": "true",
            "$": "https://api.elsevier.com/content/object/eid/1-s2.0-S1381116907004761-gr5.sml?httpAccept=%2A%2F%2A",
            "@multimediatype": "GIF image file",
            "@type": "IMAGE-THUMBNAIL",
            "@size": "1880",
            "@ref": "gr5",
            "@mimetype": "image/gif"
          },
          {
            "@category": "standard",
            "@height": "255",
            "@width": "357",
            "@_fa": "true",
            "$": "https://api.elsevier.com/content/object/eid/1-s2.0-S1381116907004761-gr6.gif?httpAccept=%2A%2F%2A",
            "@multimediatype": "GIF image file",
            "@type": "IMAGE-DOWNSAMPLED",
            "@size": "8173",
            "@ref": "gr6",
            "@mimetype": "image/gif"
          },
          {
            "@category": "thumbnail",
            "@height": "89",
            "@width": "125",
            "@_fa": "true",
            "$": "https://api.elsevier.com/content/object/eid/1-s2.0-S1381116907004761-gr6.sml?httpAccept=%2A%2F%2A",
            "@multimediatype": "GIF image file",
            "@type": "IMAGE-THUMBNAIL",
            "@size": "1828",
            "@ref": "gr6",
            "@mimetype": "image/gif"
          },
          {
            "@category": "standard",
            "@height": "256",
            "@width": "357",
            "@_fa": "true",
            "$": "https://api.elsevier.com/content/object/eid/1-s2.0-S1381116907004761-gr7.gif?httpAccept=%2A%2F%2A",
            "@multimediatype": "GIF image file",
            "@type": "IMAGE-DOWNSAMPLED",
            "@size": "7537",
            "@ref": "gr7",
            "@mimetype": "image/gif"
          },
          {
            "@category": "thumbnail",
            "@height": "90",
            "@width": "125",
            "@_fa": "true",
            "$": "https://api.elsevier.com/content/object/eid/1-s2.0-S1381116907004761-gr7.sml?httpAccept=%2A%2F%2A",
            "@multimediatype": "GIF image file",
            "@type": "IMAGE-THUMBNAIL",
            "@size": "1677",
            "@ref": "gr7",
            "@mimetype": "image/gif"
          },
          {
            "@category": "standard",
            "@height": "256",
            "@width": "357",
            "@_fa": "true",
            "$": "https://api.elsevier.com/content/object/eid/1-s2.0-S1381116907004761-gr8.gif?httpAccept=%2A%2F%2A",
            "@multimediatype": "GIF image file",
            "@type": "IMAGE-DOWNSAMPLED",
            "@size": "8387",
            "@ref": "gr8",
            "@mimetype": "image/gif"
          },
          {
            "@category": "thumbnail",
            "@height": "90",
            "@width": "125",
            "@_fa": "true",
            "$": "https://api.elsevier.com/content/object/eid/1-s2.0-S1381116907004761-gr8.sml?httpAccept=%2A%2F%2A",
            "@multimediatype": "GIF image file",
            "@type": "IMAGE-THUMBNAIL",
            "@size": "1872",
            "@ref": "gr8",
            "@mimetype": "image/gif"
          },
          {
            "@category": "standard",
            "@height": "256",
            "@width": "357",
            "@_fa": "true",
            "$": "https://api.elsevier.com/content/object/eid/1-s2.0-S1381116907004761-gr9.gif?httpAccept=%2A%2F%2A",
            "@multimediatype": "GIF image file",
            "@type": "IMAGE-DOWNSAMPLED",
            "@size": "8735",
            "@ref": "gr9",
            "@mimetype": "image/gif"
          },
          {
            "@category": "thumbnail",
            "@height": "90",
            "@width": "125",
            "@_fa": "true",
            "$": "https://api.elsevier.com/content/object/eid/1-s2.0-S1381116907004761-gr9.sml?httpAccept=%2A%2F%2A",
            "@multimediatype": "GIF image file",
            "@type": "IMAGE-THUMBNAIL",
            "@size": "1956",
            "@ref": "gr9",
            "@mimetype": "image/gif"
          },
          {
            "@category": "standard",
            "@height": "265",
            "@width": "357",
            "@_fa": "true",
            "$": "https://api.elsevier.com/content/object/eid/1-s2.0-S1381116907004761-gr10.gif?httpAccept=%2A%2F%2A",
            "@multimediatype": "GIF image file",
            "@type": "IMAGE-DOWNSAMPLED",
            "@size": "6446",
            "@ref": "gr10",
            "@mimetype": "image/gif"
          },
          {
            "@category": "thumbnail",
            "@height": "93",
            "@width": "125",
            "@_fa": "true",
            "$": "https://api.elsevier.com/content/object/eid/1-s2.0-S1381116907004761-gr10.sml?httpAccept=%2A%2F%2A",
            "@multimediatype": "GIF image file",
            "@type": "IMAGE-THUMBNAIL",
            "@size": "1464",
            "@ref": "gr10",
            "@mimetype": "image/gif"
          },
          {
            "@category": "standard",
            "@height": "227",
            "@width": "188",
            "@_fa": "true",
            "$": "https://api.elsevier.com/content/object/eid/1-s2.0-S1381116907004761-sc1.gif?httpAccept=%2A%2F%2A",
            "@multimediatype": "GIF image file",
            "@type": "IMAGE-DOWNSAMPLED",
            "@size": "3348",
            "@ref": "sc1",
            "@mimetype": "image/gif"
          },
          {
            "@category": "thumbnail",
            "@height": "93",
            "@width": "77",
            "@_fa": "true",
            "$": "https://api.elsevier.com/content/object/eid/1-s2.0-S1381116907004761-sc1.sml?httpAccept=%2A%2F%2A",
            "@multimediatype": "GIF image file",
            "@type": "IMAGE-THUMBNAIL",
            "@size": "1007",
            "@ref": "sc1",
            "@mimetype": "image/gif"
          },
          {
            "@category": "standard",
            "@height": "227",
            "@width": "188",
            "@_fa": "true",
            "$": "https://api.elsevier.com/content/object/eid/1-s2.0-S1381116907004761-fx1.gif?httpAccept=%2A%2F%2A",
            "@multimediatype": "GIF image file",
            "@type": "IMAGE-DOWNSAMPLED",
            "@size": "3348",
            "@ref": "fx1",
            "@mimetype": "image/gif"
          },
          {
            "@category": "thumbnail",
            "@height": "93",
            "@width": "77",
            "@_fa": "true",
            "$": "https://api.elsevier.com/content/object/eid/1-s2.0-S1381116907004761-fx1.sml?httpAccept=%2A%2F%2A",
            "@multimediatype": "GIF image file",
            "@type": "IMAGE-THUMBNAIL",
            "@size": "1007",
            "@ref": "fx1",
            "@mimetype": "image/gif"
          }
        ]
      },
      "link": {
        "@rel": "abstract",
        "@href": "https://api.elsevier.com/content/abstract/scopus_id/35348915331"
      }
    }
  }
}