{
  "metadata": {
    "title": "Supported modified zirconocene catalyst for ethylene polymerization",
    "authors": "; ; ",
    "journal": "Journal of Molecular Catalysis A: Chemical",
    "date": "2006-10-02",
    "doi": "10.1016/j.molcata.2006.05.055",
    "abstract": "",
    "uri": "https://api.elsevier.com/content/article/pii/S1381116906008715",
    "pii": "S1381116906008715"
  },
  "fulltext": {
    "full-text-retrieval-response": {
      "scopus-eid": "2-s2.0-33748670077",
      "originalText": "serial JL 271358 291210 291744 291790 291809 31 Journal of Molecular Catalysis A: Chemical JOURNALMOLECULARCATALYSISACHEMICAL 2006-07-05 2006-07-05 2010-03-29T20:21:43 1-s2.0-S1381116906008715 S1381-1169(06)00871-5 S1381116906008715 10.1016/j.molcata.2006.05.055 S300 S300.1 FULL-TEXT 1-s2.0-S1381116906X0239X 2015-05-15T05:56:33.323092-04:00 0 0 20061002 2006 2006-07-05T00:00:00Z articleinfo crossmark dco dateupdated tomb dateloaded datesearch indexeddate issuelist volumelist yearnav absattachment articletitlenorm authfirstinitialnorm authfirstsurnamenorm cid cids contenttype copyright dateloadedtxt docsubtype doctype doi eid ewtransactionid hubeid issfirst issn issnnorm itemstage itemtransactionid itemweight openaccess openarchive pg pgfirst pglast pii piinorm pubdatestart pubdatetxt pubyr sortorder srctitle srctitlenorm srctype subheadings volfirst volissue webpdf webpdfpagecount figure table body acknowledge affil articletitle auth authfirstini authfull authkeywords authlast primabst ref specialabst alllist content subj ssids 1381-1169 13811169 258 258 1 2 1 2 Volume 258, Issues 1–2 34 236 245 236 245 20061002 2 October 2006 2006-10-02 2006 article fla Copyright © 2006 Elsevier B.V. All rights reserved. SUPPORTEDMODIFIEDZIRCONOCENECATALYSTFORETHYLENEPOLYMERIZATION CARRION P 1 Introduction 2 Experimental 2.1 Materials 2.1.1 Synthesis and characterization of [Zr{η5-C5H4(CH2)3OSiMe3}(η5-C5H5)Me2] (3) 2.2 Catalyst preparation 2.3 Characterization 2.4 Polymerization tests 3 Results and discussion 4 Conclusions Acknowledgements References KAMINSKY 1998 W ALT 2000 1205 H BRINTZINGER 1995 1143 H MIYAKE 1995 3074 S SEVERN 2005 4073 J RIBEIRO 1997 1224 M DOSSANTOS 1999 199 J DOSSANTOS 1999 751 J GUIMARAES 2003 353 R ALONSOMORENO 2005 2924 C ALONSO 2004 285 C SAMUEL 1973 6263 E MORROW 1990 161 B HAAG 2001 275 M HOFFMAN 1987 181 P ZHURAVIEV 1993 71 L MORROW 1976 1998 B CORKER 1996 966 J INAKI 2002 9098 Y BLUMEL 1995 2112 J DUBOIS 1993 1191 L CHIEN 1999 23 J DOSSANTOS 2000 541 J DEFFIEUX 2000 1887 A PEDEUTOUR 1999 1215 J COEVOET 1998 1451 D MOROZ 1998 121 B CARRIONX2006X236 CARRIONX2006X236X245 CARRIONX2006X236XP CARRIONX2006X236X245XP item S1381-1169(06)00871-5 S1381116906008715 1-s2.0-S1381116906008715 10.1016/j.molcata.2006.05.055 271358 2010-10-08T06:21:32.078746-04:00 2006-10-02 1-s2.0-S1381116906008715-main.pdf https://s3.amazonaws.com/prod-ucs-content-store-us-east/content/pii:S1381116906008715/MAIN/application/pdf/21984316cba237505e63f00b0d1216e5/main.pdf https://s3-eu-west-1.amazonaws.com/prod-ucs-content-store-eu-west/content/pii:S1381116906008715/MAIN/application/pdf/21984316cba237505e63f00b0d1216e5/main.pdf main.pdf pdf true 829956 MAIN 10 1-s2.0-S1381116906008715-main_1.png https://s3.amazonaws.com/prod-ucs-content-store-us-east/content/pii:S1381116906008715/PREVIEW/image/png/d09e7af169f5e4ecda327f436d9ab61d/main_1.png https://s3-eu-west-1.amazonaws.com/prod-ucs-content-store-eu-west/content/pii:S1381116906008715/PREVIEW/image/png/d09e7af169f5e4ecda327f436d9ab61d/main_1.png main_1.png png 72139 849 656 IMAGE-WEB-PDF 1 1-s2.0-S1381116906008715-gr1.gif https://s3.amazonaws.com/prod-ucs-content-store-us-east/content/pii:S1381116906008715/gr1/DOWNSAMPLED/image/gif/ec663f1a001de5475117bc322c60dc42/gr1.gif https://s3-eu-west-1.amazonaws.com/prod-ucs-content-store-eu-west/content/pii:S1381116906008715/gr1/DOWNSAMPLED/image/gif/ec663f1a001de5475117bc322c60dc42/gr1.gif gr1 gr1.gif gif 17801 479 647 IMAGE-DOWNSAMPLED 1-s2.0-S1381116906008715-gr1.sml https://s3.amazonaws.com/prod-ucs-content-store-us-east/content/pii:S1381116906008715/gr1/THUMBNAIL/image/gif/3b3c97ce5bb6da7818a3de100e718001/gr1.sml https://s3-eu-west-1.amazonaws.com/prod-ucs-content-store-eu-west/content/pii:S1381116906008715/gr1/THUMBNAIL/image/gif/3b3c97ce5bb6da7818a3de100e718001/gr1.sml gr1 gr1.sml sml 1547 93 125 IMAGE-THUMBNAIL 1-s2.0-S1381116906008715-gr10.jpg https://s3.amazonaws.com/prod-ucs-content-store-us-east/content/pii:S1381116906008715/gr10/DOWNSAMPLED/image/jpeg/8690884523bb4adb633bc25d2c109433/gr10.jpg https://s3-eu-west-1.amazonaws.com/prod-ucs-content-store-eu-west/content/pii:S1381116906008715/gr10/DOWNSAMPLED/image/jpeg/8690884523bb4adb633bc25d2c109433/gr10.jpg gr10 gr10.jpg jpg 160844 487 678 IMAGE-DOWNSAMPLED 1-s2.0-S1381116906008715-gr10.sml https://s3.amazonaws.com/prod-ucs-content-store-us-east/content/pii:S1381116906008715/gr10/THUMBNAIL/image/gif/df292dcf70ac318a03627169c2e8a0bb/gr10.sml https://s3-eu-west-1.amazonaws.com/prod-ucs-content-store-eu-west/content/pii:S1381116906008715/gr10/THUMBNAIL/image/gif/df292dcf70ac318a03627169c2e8a0bb/gr10.sml gr10 gr10.sml sml 4906 90 125 IMAGE-THUMBNAIL 1-s2.0-S1381116906008715-gr2.jpg https://s3.amazonaws.com/prod-ucs-content-store-us-east/content/pii:S1381116906008715/gr2/DOWNSAMPLED/image/jpeg/430537e30c5af7f0cf4d0e00bb80affb/gr2.jpg https://s3-eu-west-1.amazonaws.com/prod-ucs-content-store-eu-west/content/pii:S1381116906008715/gr2/DOWNSAMPLED/image/jpeg/430537e30c5af7f0cf4d0e00bb80affb/gr2.jpg gr2 gr2.jpg jpg 44267 425 650 IMAGE-DOWNSAMPLED 1-s2.0-S1381116906008715-gr2.sml https://s3.amazonaws.com/prod-ucs-content-store-us-east/content/pii:S1381116906008715/gr2/THUMBNAIL/image/gif/8dc20bc0a5e038dbc8c937907a277277/gr2.sml https://s3-eu-west-1.amazonaws.com/prod-ucs-content-store-eu-west/content/pii:S1381116906008715/gr2/THUMBNAIL/image/gif/8dc20bc0a5e038dbc8c937907a277277/gr2.sml gr2 gr2.sml sml 1503 82 125 IMAGE-THUMBNAIL 1-s2.0-S1381116906008715-gr3.jpg https://s3.amazonaws.com/prod-ucs-content-store-us-east/content/pii:S1381116906008715/gr3/DOWNSAMPLED/image/jpeg/9e9394e64042201b0621626e9f0b8abe/gr3.jpg https://s3-eu-west-1.amazonaws.com/prod-ucs-content-store-eu-west/content/pii:S1381116906008715/gr3/DOWNSAMPLED/image/jpeg/9e9394e64042201b0621626e9f0b8abe/gr3.jpg gr3 gr3.jpg jpg 17219 248 380 IMAGE-DOWNSAMPLED 1-s2.0-S1381116906008715-gr3.sml https://s3.amazonaws.com/prod-ucs-content-store-us-east/content/pii:S1381116906008715/gr3/THUMBNAIL/image/gif/2f682603bc6225ce4eb5c9b6e0c61d4d/gr3.sml https://s3-eu-west-1.amazonaws.com/prod-ucs-content-store-eu-west/content/pii:S1381116906008715/gr3/THUMBNAIL/image/gif/2f682603bc6225ce4eb5c9b6e0c61d4d/gr3.sml gr3 gr3.sml sml 1416 82 125 IMAGE-THUMBNAIL 1-s2.0-S1381116906008715-gr4.jpg https://s3.amazonaws.com/prod-ucs-content-store-us-east/content/pii:S1381116906008715/gr4/DOWNSAMPLED/image/jpeg/c2d0829502f8296538ce8f54a7d4dd0b/gr4.jpg https://s3-eu-west-1.amazonaws.com/prod-ucs-content-store-eu-west/content/pii:S1381116906008715/gr4/DOWNSAMPLED/image/jpeg/c2d0829502f8296538ce8f54a7d4dd0b/gr4.jpg gr4 gr4.jpg jpg 70674 424 655 IMAGE-DOWNSAMPLED 1-s2.0-S1381116906008715-gr4.sml https://s3.amazonaws.com/prod-ucs-content-store-us-east/content/pii:S1381116906008715/gr4/THUMBNAIL/image/gif/d86724002708fcd455c7a9f6fbe179c7/gr4.sml https://s3-eu-west-1.amazonaws.com/prod-ucs-content-store-eu-west/content/pii:S1381116906008715/gr4/THUMBNAIL/image/gif/d86724002708fcd455c7a9f6fbe179c7/gr4.sml gr4 gr4.sml sml 1380 81 125 IMAGE-THUMBNAIL 1-s2.0-S1381116906008715-gr5.jpg https://s3.amazonaws.com/prod-ucs-content-store-us-east/content/pii:S1381116906008715/gr5/DOWNSAMPLED/image/jpeg/a913592eb1c6edcaa7716ba65c63cdc7/gr5.jpg https://s3-eu-west-1.amazonaws.com/prod-ucs-content-store-eu-west/content/pii:S1381116906008715/gr5/DOWNSAMPLED/image/jpeg/a913592eb1c6edcaa7716ba65c63cdc7/gr5.jpg gr5 gr5.jpg jpg 78958 436 659 IMAGE-DOWNSAMPLED 1-s2.0-S1381116906008715-gr5.sml https://s3.amazonaws.com/prod-ucs-content-store-us-east/content/pii:S1381116906008715/gr5/THUMBNAIL/image/gif/37c65b5f974ffbc5a8b8ae3ff3ec544f/gr5.sml https://s3-eu-west-1.amazonaws.com/prod-ucs-content-store-eu-west/content/pii:S1381116906008715/gr5/THUMBNAIL/image/gif/37c65b5f974ffbc5a8b8ae3ff3ec544f/gr5.sml gr5 gr5.sml sml 1849 83 125 IMAGE-THUMBNAIL 1-s2.0-S1381116906008715-gr6.jpg https://s3.amazonaws.com/prod-ucs-content-store-us-east/content/pii:S1381116906008715/gr6/DOWNSAMPLED/image/jpeg/c503f46ee078b3759920a873e3b2ae9c/gr6.jpg https://s3-eu-west-1.amazonaws.com/prod-ucs-content-store-eu-west/content/pii:S1381116906008715/gr6/DOWNSAMPLED/image/jpeg/c503f46ee078b3759920a873e3b2ae9c/gr6.jpg gr6 gr6.jpg jpg 61543 447 644 IMAGE-DOWNSAMPLED 1-s2.0-S1381116906008715-gr6.sml https://s3.amazonaws.com/prod-ucs-content-store-us-east/content/pii:S1381116906008715/gr6/THUMBNAIL/image/gif/1af901ac7a911bd50410b734e2c2bc19/gr6.sml https://s3-eu-west-1.amazonaws.com/prod-ucs-content-store-eu-west/content/pii:S1381116906008715/gr6/THUMBNAIL/image/gif/1af901ac7a911bd50410b734e2c2bc19/gr6.sml gr6 gr6.sml sml 1776 87 125 IMAGE-THUMBNAIL 1-s2.0-S1381116906008715-gr7.jpg https://s3.amazonaws.com/prod-ucs-content-store-us-east/content/pii:S1381116906008715/gr7/DOWNSAMPLED/image/jpeg/6b80a3149ffecfcea0b21a1560e2cb57/gr7.jpg https://s3-eu-west-1.amazonaws.com/prod-ucs-content-store-eu-west/content/pii:S1381116906008715/gr7/DOWNSAMPLED/image/jpeg/6b80a3149ffecfcea0b21a1560e2cb57/gr7.jpg gr7 gr7.jpg jpg 52233 388 638 IMAGE-DOWNSAMPLED 1-s2.0-S1381116906008715-gr7.sml https://s3.amazonaws.com/prod-ucs-content-store-us-east/content/pii:S1381116906008715/gr7/THUMBNAIL/image/gif/ec738f89f9c26d43ead1f4707170d1c0/gr7.sml https://s3-eu-west-1.amazonaws.com/prod-ucs-content-store-eu-west/content/pii:S1381116906008715/gr7/THUMBNAIL/image/gif/ec738f89f9c26d43ead1f4707170d1c0/gr7.sml gr7 gr7.sml sml 1989 76 125 IMAGE-THUMBNAIL 1-s2.0-S1381116906008715-gr8.jpg https://s3.amazonaws.com/prod-ucs-content-store-us-east/content/pii:S1381116906008715/gr8/DOWNSAMPLED/image/jpeg/a98ed175a0f61a11eb61d0f121c864bf/gr8.jpg https://s3-eu-west-1.amazonaws.com/prod-ucs-content-store-eu-west/content/pii:S1381116906008715/gr8/DOWNSAMPLED/image/jpeg/a98ed175a0f61a11eb61d0f121c864bf/gr8.jpg gr8 gr8.jpg jpg 35216 457 655 IMAGE-DOWNSAMPLED 1-s2.0-S1381116906008715-gr8.sml https://s3.amazonaws.com/prod-ucs-content-store-us-east/content/pii:S1381116906008715/gr8/THUMBNAIL/image/gif/873b3889a0e74b2d9f86d7fb6c4b42cb/gr8.sml https://s3-eu-west-1.amazonaws.com/prod-ucs-content-store-eu-west/content/pii:S1381116906008715/gr8/THUMBNAIL/image/gif/873b3889a0e74b2d9f86d7fb6c4b42cb/gr8.sml gr8 gr8.sml sml 1209 87 125 IMAGE-THUMBNAIL 1-s2.0-S1381116906008715-gr9.jpg https://s3.amazonaws.com/prod-ucs-content-store-us-east/content/pii:S1381116906008715/gr9/DOWNSAMPLED/image/jpeg/9f138819385410c3b9bf77686e8f35ab/gr9.jpg https://s3-eu-west-1.amazonaws.com/prod-ucs-content-store-eu-west/content/pii:S1381116906008715/gr9/DOWNSAMPLED/image/jpeg/9f138819385410c3b9bf77686e8f35ab/gr9.jpg gr9 gr9.jpg jpg 27482 270 356 IMAGE-DOWNSAMPLED 1-s2.0-S1381116906008715-gr9.sml https://s3.amazonaws.com/prod-ucs-content-store-us-east/content/pii:S1381116906008715/gr9/THUMBNAIL/image/gif/75fbe9e1e7c641390e44989182722179/gr9.sml https://s3-eu-west-1.amazonaws.com/prod-ucs-content-store-eu-west/content/pii:S1381116906008715/gr9/THUMBNAIL/image/gif/75fbe9e1e7c641390e44989182722179/gr9.sml gr9 gr9.sml sml 1954 93 123 IMAGE-THUMBNAIL 1-s2.0-S1381116906008715-sc1.jpg https://s3.amazonaws.com/prod-ucs-content-store-us-east/content/pii:S1381116906008715/sc1/DOWNSAMPLED/image/jpeg/317f2fac7651e506d1acf3f7f9f25793/sc1.jpg https://s3-eu-west-1.amazonaws.com/prod-ucs-content-store-eu-west/content/pii:S1381116906008715/sc1/DOWNSAMPLED/image/jpeg/317f2fac7651e506d1acf3f7f9f25793/sc1.jpg sc1 sc1.jpg jpg 9263 105 368 IMAGE-DOWNSAMPLED 1-s2.0-S1381116906008715-sc1.sml https://s3.amazonaws.com/prod-ucs-content-store-us-east/content/pii:S1381116906008715/sc1/THUMBNAIL/image/gif/f005edebfbaa5b1e04c02cd2a7faa608/sc1.sml https://s3-eu-west-1.amazonaws.com/prod-ucs-content-store-eu-west/content/pii:S1381116906008715/sc1/THUMBNAIL/image/gif/f005edebfbaa5b1e04c02cd2a7faa608/sc1.sml sc1 sc1.sml sml 832 36 125 IMAGE-THUMBNAIL 1-s2.0-S1381116906008715-sc2.jpg https://s3.amazonaws.com/prod-ucs-content-store-us-east/content/pii:S1381116906008715/sc2/DOWNSAMPLED/image/jpeg/3b6664263f072d1f4d0fd7207ea7f234/sc2.jpg https://s3-eu-west-1.amazonaws.com/prod-ucs-content-store-eu-west/content/pii:S1381116906008715/sc2/DOWNSAMPLED/image/jpeg/3b6664263f072d1f4d0fd7207ea7f234/sc2.jpg sc2 sc2.jpg jpg 56234 611 377 IMAGE-DOWNSAMPLED 1-s2.0-S1381116906008715-sc2.sml https://s3.amazonaws.com/prod-ucs-content-store-us-east/content/pii:S1381116906008715/sc2/THUMBNAIL/image/gif/d38a02ae8548253396d6fa1e9113f5b7/sc2.sml https://s3-eu-west-1.amazonaws.com/prod-ucs-content-store-eu-west/content/pii:S1381116906008715/sc2/THUMBNAIL/image/gif/d38a02ae8548253396d6fa1e9113f5b7/sc2.sml sc2 sc2.sml sml 1130 92 57 IMAGE-THUMBNAIL 1-s2.0-S1381116906008715-fx1.jpg https://s3.amazonaws.com/prod-ucs-content-store-us-east/content/pii:S1381116906008715/fx1/DOWNSAMPLED/image/jpeg/a34eee9299045c88fa435ae0141a5b14/fx1.jpg https://s3-eu-west-1.amazonaws.com/prod-ucs-content-store-eu-west/content/pii:S1381116906008715/fx1/DOWNSAMPLED/image/jpeg/a34eee9299045c88fa435ae0141a5b14/fx1.jpg fx1 true fx1.jpg jpg 17671 181 300 IMAGE-DOWNSAMPLED 1-s2.0-S1381116906008715-fx1.sml https://s3.amazonaws.com/prod-ucs-content-store-us-east/content/pii:S1381116906008715/fx1/THUMBNAIL/image/gif/34d4223b12473a75077d8393ef98a18a/fx1.sml https://s3-eu-west-1.amazonaws.com/prod-ucs-content-store-eu-west/content/pii:S1381116906008715/fx1/THUMBNAIL/image/gif/34d4223b12473a75077d8393ef98a18a/fx1.sml fx1 true fx1.sml sml 1433 75 125 IMAGE-THUMBNAIL MOLCAA 6070 S1381-1169(06)00871-5 10.1016/j.molcata.2006.05.055 Elsevier B.V. Fig. 1 (a) SiO2(773). (b) After grafting of 1. (c) After addition of MAO. (d) After contact with C2H4. Fig. 2 (a) SiO2(773). (b) After grafting of 2. (c) After addition of MAO. (d) After contact with C2H4. Fig. 3 Adsorption isotherms (333K) of Zr incorporated onto SiO2(773) as a function of the theoretical expected loading, from solutions of 1 (a) and 2 (b) in toluene. Fig. 4 (a) FT-IR spectrum of 1.SiO2(773). (b) FT-IR spectrum of n PrOSiMe3·SiO2(773). Fig. 5 UV–vis spectra of: (a) SiO2(773); (b) complex 2; (c) 2.SiO2(773); (d) after the addition of MAO. Fig. 6 UV–vis spectra of: (a) SiO2(773); (b) complex 1; (c) 1.SiO2(773); (d) after the addition of MAO. Fig. 7 UV–vis solution spectra of: (a) complex 1; (b) complex 1 after MAO addition Al/Zr=10; (c) complex 3; (d) complex 1 after MAO addition Al/Zr=300; (e) complex 2; (f) complex 2 after MAO addition Al/Zr=70; (g) complex 4; (h) complex 2 after MAO addition Al/Zr=500. Fig. 8 FT-IR spectra of: (a) SiO2(473); (b) after modification with (MAO); (c) after addition of complex 1. Fig. 9 UV–vis spectra of: (a) MAO-modified SiO2(473); (b) complex 1 supported on SiO2(773); (c) complex 1 supported on SiO2(773) after reaction with MAO; (d) complex 1 supported on MAO-modified SiO2(473). Fig. 10 SEM images of: (a) 1.[SiO2(473)-MAO] (200×); (b) the polyethylene produced with 1.[SiO2(473)-MAO] (100×); (c) 1.SiO2(773) (200×); (d) the polyethylene produced with 1.SiO2(773) (100×). Scheme 1 Scheme 2 Table 1 Catalytic activities in ethylene polymerization for the different supported systems on unmodified and modified silicas Catalyst % Zr % Al Activity (kgPE/molZrh−1) 1.SiO2(773) 0.30 – 247 2.SiO2(773) 0.35 – 111 1.[SiO2(298)-MAO] 0.25 17.5 316 1.[SiO2(473)-MAO] 0.24 15.6 555 1.[SiO2(773)-MAO] 0.29 15.5 343 2.[SiO2(473)-MAO] 0.31 14.9 79 Polymerization conditions are as follows: P =1.5bar; 300mg of catalyst; [Al]/[Zr] approximately 200; T =343K; solvent=toluene (200mL); scavenger=TIBA (2mL); time=30min. Supported modified zirconocene catalyst for ethylene polymerization Pedro Carrión a Fernando Carrillo-Hermosilla a Carlos Alonso-Moreno a Antonio Otero a ⁎ Antonio Antiñolo a José Sancho b Elena Villaseñor a a Departamento de Química Inorgánica, Orgánica y Bioquímica, Facultad de Ciencias Químicas, Universidad de Castilla-La Mancha, Campus Universitario de Ciudad Real, 13071 Ciudad Real, Spain b Centro Tecnológico de Repsol-YPF, Carretera de Extremadura, Km. 18, 28931 Móstoles, Spain ⁎ Corresponding author. Tel.: +34 26295326; fax: +34 26295318. Graphical abstract The reactivity of the silyl ether-substituted zirconocene [Zr{η5-C5H4(CH2)3OSiMe3}(η5-C5H5)Cl2] towards different supports based on dehydroxylated silica was evaluated and comparative studies with respect to the unmodified analogue [Zr(η5-C5H5)2Cl2] were performed. The reactivity of the silyl ether-substituted zirconocene [Zr{η5-C5H4(CH2)3OSiMe3}(η5-C5H5)Cl2] (1) towards dehydroxylated silica was evaluated and comparative studies with respect to the unmodified analogue [Zr(η5-C5H5)2Cl2] (2) were performed. The different reactions were monitored by FT-IR spectroscopy. The resulting materials were activated with MAO and the catalytic systems were evaluated in ethylene polymerization. The catalysts were characterized by elemental analysis as well as by FT-IR and UV–vis spectroscopy. In addition to the classical reaction between ZrCl bonds and acidic silanol surface groups, grafting of complex 1 occurs to some extent by reaction between the silyl ether group and reactive siloxane bridges on the silica surface. In contrast, complex 2, as one would expect, only reacts through the ZrCl groups. Supporting zirconocene 1 on MAO-modified silica gives rise to a more efficient catalyst. The effects caused by these different grafting reactions, as well as the catalytic activities of the resulting materials, are presented and discussed. Keywords Zirconocene Supported Silica Ethylene Polymerization 1 Introduction The production of polyolefins is continuously growing as they are indispensable materials in society. Increasing research effort is being directed towards olefin polymerization catalysts in an attempt to develop and improve new catalytic systems suitable for industrial applications and capable of producing new polyolefinic materials. In comparison with Ziegler–Natta catalysts, zirconocene-based systems offer high activity and versatility [1–4]. However, these new polymerization catalysts are soluble systems. A solution polymerization process requires separation of the polymer and recovery and purification of the solvent. As most of the existing polymerization plants run slurry or gas-phase processes with heterogeneous Ziegler–Natta or chromium catalysts, the homogeneous catalysts must be heterogenized [5] on a support (in most cases silica) in order to apply these processes. In addition, the heterogenized catalysts avoid reactor fouling and produce polymer particles of a desired regular morphology. The main routes reported in the literature for zirconocene immobilization have been classified by Ribeiro et al. [6]. The first method involves direct impregnation of the zirconocene onto the support, either with or without prior modification of the support. This method has been extensively studied by dos Santos and co-workers [7–9] for different zirconocenes. Silica that had been dehydroxylated at higher temperatures led to lower catalyst loadings but, after reaction with MAO, afforded highly active catalyst systems. High grafting temperatures and long contact times led to higher metal contents but led to a reduction in the activity of the system. Lower activity was found when high grafting temperatures or long reaction times were used. In the first case, μ-oxo surface species of the type SiOZr(Cp)2Cl were proposed. These species are believed to form an active species with MAO, presumably by metathesis of the surface SiOM bond. Alkyl substitution of the cyclopentadienyl ligand did not have a significant effect on the metal loadings of the catalyst or the activity when compared to the corresponding homogeneous systems. Furthermore, the ethyl-bridged indenyl derivatives gave higher metal contents than the bulkier dimethylsilyl-bridged analogues. More active systems were obtained when the same zirconocenes were reacted with MAO-modified silica. One of the most promising methods for zirconocene heterogenization involves the reaction between a functional group of the zirconocene molecule and a reactive group on the carrier surface. Recently, we described the synthesis and characterization of a series of indenyl zirconocenes bearing pendant chains with silicon ether groups [10]. These supported complexes show similar or higher activities than their corresponding homogeneous catalysts and have low Al/Zr ratios. In this paper we describe spectroscopic studies on the reaction between a similar substituted zirconocene, [Zr{η5-C5H4(CH2)3OSiMe3}(η5-C5H5)Cl2] (1) and partially dehydroxylated silica. The reactivity is compared with that of the analogous unsubstituted complex, [Zr(η5-C5H5)2Cl2] (2), which we studied previously [11]. 2 Experimental 2.1 Materials Grace Davison XPO 2407 silica (200m2/g, according to data from supplier) was dehydroxylated under vacuum (10−2 mmHg) for 16h at the desired temperature [SiO2(T)], cooled and stored under dry nitrogen. [Zr(η5-C5H5)2Cl2] (2) (Strem), MeMgBr (Aldrich), ethylene (Alphagaz), AliBu3 (TIBA, Aldrich) and methylalumoxane (MAO, EURECENE 10, Crompton) were used without further purification. [Zr{η5-C5H4(CH2)3OSiMe3}(η5-C5H5)Cl2] (1) and [Zr(η5-C5H5)2Me2] (4) were prepared as described in the literature [12,13]. Toluene was distilled over sodium under a dry nitrogen atmosphere. 2.1.1 Synthesis and characterization of [Zr{η5-C5H4(CH2)3OSiMe3}(η5-C5H5)Me2] (3) MeMgBr (3M in THF) (0.53mL, 1.60mmol) was added to a solution of 1 (0.30g, 0.71mmol) in THF (50mL) at 195K. The reaction mixture was allowed to warm up to room temperature and stirred for 4h. The solvent was removed in vacuo and hexane (25mL) was added. After filtration, the solution was concentrated to 5mL and cooled to −20°C overnight to afford the title complex (0.15g, 45%). 1H NMR (ppm, C6D6): δ =−0.17 (s, 6H, ZrMe2), 0.07 (s, 9H, SiMe3), 1.89 (m, 2H, CpCH2CH 2CH2O), 2.62 (m, 2H, CpCH 2CH2CH2O), 3.64 (m, 2H, CpCH2CH2CH 2O), 5.59 (m, 2H, H3H4, C5 H 4(CH2)3OSiMe3), 5.81 (m, 2H, H2H5, C5 H 4(CH2)3OSiMe3), 5.88 (s, 5H, C5 H 5). 13C NMR (ppm, C6D6): δ =−0.47 (SiMe3), 26.42 (CpCH 2CH2CH2O), 30.15 (ZrMe2), 34.64 (CpCH2CH 2CH2O), 61.74 (CpCH2CH2CH 2O), 107.77 (C3C4, C 5H4(CH2)3OSiMe3), 110.23 (C 5H5), 110.61 (C1, C 5H4(CH2)3OSiMe3), 110.93 (C2C5, C 5H4(CH2)3OSiMe3). Anal. calcd. for ZrC18H30OSi: C, 56.93, H, 7.92; found: C, 56,80, H, 7.90. 2.2 Catalyst preparation The supported catalysts were prepared under an inert atmosphere using Schlenk techniques and a glove-box. A solution of the zirconocene in toluene (30mL) was added to partially dehydroxylated silica (1g) and the mixture was stirred at 333K for 16h. The slurries were filtered through fritted discs and washed 10 times with toluene (20mL). The resultant solids were dried under vacuum at 343K for 16h. In the case of MAO-modified silica, SiO2(298, 473, or 733) (1g) was treated with 5mL of the toluene MAO solution. The mixture was stirred at 333K for 1h and dried in vacuo. The resulting materials were impregnated with zirconocene toluene solutions, and the mixtures were stirred for 6h at 333K. The slurries were filtered through fritted discs and washed 10 times with toluene (20mL). The resultant solids were dried under vacuum at 343K for 16h. 2.3 Characterization Infrared spectra were recorded on a Nicolet Magna 550-FT spectrophotometer using an infrared cell equipped with CaF2 or KBr windows; this set-up allowed in situ studies. A total of 32 scans were typically accumulated for each spectrum (resolution 2cm−1). The samples consisted of ca. 20mg of silica pressed into a self-supported disc of 1cm diameter. The samples were dehydroxylated at the desired temperature for 16h. MAO-modified samples were treated with a 10% solution in toluene and dried in vacuo. Zirconocene grafting was performed using a 10−2 M solution of the zirconocene in toluene. The samples were warmed at 333K for 1h, washed with toluene and dried in vacuo at 343K until no further change was observed (sublimation of a slight excess complex was observed in some cases). For unmodified silica, MAO was also added. Finally, the samples were exposed to ca. 50Torr of ethylene for 10min and evacuated in vacuo. The FT-IR analyses were repeated on three different samples in order to ensure reproducibility. NMR analyses were performed in CDCl3 or toluene-d 8 using a Varian Unity 300 spectrometer. UV–vis analyses were performed using a Shimadzu UV-2501PC spectrophotometer. The soluble complexes were dissolved in dry toluene and placed in special cells under dry nitrogen (1.0cm path length). The solid samples were suspended in Nujol to form a slurry. The absorption spectra were recorded between 190 and 900nm and toluene or Nujol was used as a reference. The catalyst and polyethylene morphologies were identified by scanning electron microscopy (SEM) using a Philips XL 30 microscope. The solids were fixed on a carbon tape and then coated with gold by conventional sputtering techniques. Elemental analyses were determined at the Mikroanalytisches Labor Pascher (Remagen-Bandorf, Germany). 2.4 Polymerization tests Polymerizations were carried out in a 250mL glass reactor using toluene as a solvent. Catalysts (6×10−6 mol for the homogeneous reactions and 300mg for the heterogeneous ones) were treated with the appropriate quantity of a solution of MAO in toluene (10% Al) for 15min. In the case of MAO-modified silica, additional MAO was not added. Toluene, TIBA scavenger (2mL) and the activated catalyst (final volume ca. 100mL) were introduced, in this order, into the reactor and thermostated at the desired temperature. Nitrogen was removed and a continuous flow of ethylene (1.5bar) was introduced for 30min. The reaction was then quenched by the addition of acidified methanol. The polymer was collected, washed with methanol and dried under vacuum at room temperature for 24h. 3 Results and discussion The IR spectra corresponding to the reaction between a toluene solution of 1 and the surface of partially dehydroxylated silica after removal of the solvent (see Section 2) are shown in Fig. 1 . The spectrum of silica preheated at 773K in vacuo [SiO2(773K)] has a sharp band at 3747cm−1 (assigned to isolated OH groups [14]) with a small, broad shoulder at 3670cm−1, which can be attributed to silanols that are perturbed due to interparticle contacts [14] or to OH groups deeply retained within the pores [15] (Fig. 1a). The magnitude of the silanol number, which is independent of the origin and structural characteristics of amorphous silica, is considered to be ca. 1.8OHnm−2 for a silica dehydroxylated at 733K [16]. Bands at 1866cm−1 and 1640cm−1 are combinations and overtone bands, respectively, of SiO network bonds. After contact with the zirconocene solution and removal of the solvent (Fig. 1b), new bands can be seen in the 2900cm−1 and 1400cm−1 regions and these correspond to stretching and bending modes of organic ligands. The OH groups that were initially isolated are now partially perturbed, generating broad ν(OH) bands at lower frequencies due to an interaction with the Cp π-electron system through hydrogen bonding [17]. The total intensity of the band due to the hydroxyl groups was slightly different after the addition of an excess of zirconocene solution, a situation also observed by dos Santos et al. [7] in the reaction between partially dehydroxylated silica and CpnBu 2ZrCl2. Similar spectra were obtained with complex 2 (Fig. 2 ). The amount of zirconocene grafted onto silica from toluene solutions was determined by increasing the zirconium contents in the initial solutions. The resulting adsorption isotherms, at 333K, are shown in Fig. 3 . The curves show that the zirconium loading approaches a saturation limit, near to 1%, that is typical of chemisorption. The limit was very low, even when a large excess of zirconocene and long reaction times were used. Taking in account the aforementioned [OH] of about 1.8OHnm−2, one can expect a theoretical maximum loading of 5–6% of Zr on the assumption that one zirconocene molecule reacts with one silanol group. The weak basicity of the chloro ligands and the weak acidity of the SiOH groups could explain the difficulty in obtaining higher loadings. It is noteworthy that complex 1 allows us to obtain more grafted complex than the unsubstituted complex 2 for solutions with similar concentrations. It is well established that the surface hydroxyl density in silica decreases with thermal activation as result of an increase in the number of siloxane reactive bridges. These strained groups can activate covalent bonds [18] such as the SiO bond in silicon ethers (Scheme 1 ). Basset et al. proposed [19] the reaction between a supported zirconium hydride and vicinal SiOSi bridges on silica dehydroxylated at 723K. Yoshida et al. [20] proposed that the strained siloxane groups are, in fact, radical sites of the type SiO and Si present in silicas dehydroxylated above 673K. These sites are characterized by bands at 891 and 910cm−1 in their IR spectra. Similar weak bands at 908 and 897cm−1 were observed in the spectra of SiO2(773). After contact with zirconocenes, these bands are no longer present, indicating a reaction between 1 or 2 and these groups. A new band is observed at 900cm−1 and this can be tentatively assigned to ZrOSi bonds. In order to gain a deeper insight into the possible type of reaction between complex 1 and the surface of the dehydroxylated silica, we carried out the reaction with n PrOSiMe3 in an attempt to provide a simpler model for this zirconocene. The IR spectra corresponding to both grafted complex 1 and model n PrOSiMe3 are shown in Fig. 4 . We observed a similar spectrum to those described in the literature, where this silyl ether was proposed to reacts with the reactive siloxane bridge groups [21,22]; a decrease in the intensity of the signal due to the isolated silanol groups was not observed, although a broad neighbouring wide appeared when the compound was fixed, due to the perturbation of these silanol groups by the anchored silyl ether. If we compare the bands of this supported organosilane with those of the supported complex 1, a clear similarity can be observed. The similar bands could be due to the trimethylsilyl group (2960cm−1; the free organosilane compound shows a strong band at 2970cm−1) and alkyl chains of the two materials, although an additional band corresponding to the methyl group (1985cm−1) is observed in the spectrum of the silyl ether but is not present in the supported zirconocene spectrum. This similarity in the two spectra indicates that complex 1 may be able to react with the surface of the silica in a similar way to the organosilane, namely through the interaction with siloxane bridge groups. However, this possibility does not rule out the alternative interaction between the chloro ligands and the more acidic silanol groups in the reaction of complex 1 with the silica surface. In addition, elemental analysis of supported complex 1 reveals a Cl/Zr=1.2/1 ratio, which is slightly higher than one would find for a typical reaction with only silanol groups. These results, in conjunction with the literature precedents, seem to indicate that the reaction between 1 or 2 and the silica surface, at mild temperatures, can occur through the interaction with the acidic silanol groups but also, to some extent, with the reactive siloxane bridges (Scheme 2 ). Complex 2 only can follow such a pathway by using the ZrCl groups [11], while complex 1 also has the possibility of reacting through the silicon ether functional group with the bridge siloxane groups (Scheme 2). This possibility would allow us to obtain a higher level of fixed complex 1 in comparison with complex 2 under similar conditions. The behaviour of the catalyst systems after the addition of the MAO cocatalyst was also studied by FT-IR spectroscopy. The IR spectra of samples of 1.SiO2(773) and 2.SiO2(773) treated with MAO (approximately Al/Zr=100) are shown in Figs. 1c and 2c. After this treatment, the infrared band attributed to isolated silanol groups (at 3747cm−1) disappeared completely at room temperature, indicating that a reaction between some basic methyl groups of MAO (or TMA present in MAO) and acidic silanols had taken place. At the same time, new bands appeared in the ν(CH) region—one strong band at 2940cm−1 and three weak bands at 2898, 2856 and 2838cm−1. These bands are assigned to stretching vibrations of CH bonds of the methyl groups in MAO. In this way, the grafted MAO could activate the surface bonded zirconocenes of the neighbouring regions [23]. This situation could lead to the formation of the potentially active alkylcationic surface species. The activity of these supported zirconocenes, after activation with MAO, towards ethylene polymerization was confirmed by following the appearance of vibrations due to polyethylene in the regions 3000–2800cm−1 and 1500–1300cm−1 (Figs. 1d and 2d). Intense bands were observed at 2970, 2850 and 1380cm−1, which correspond, respectively, to the ν(CH) and δ(CH) vibrations of polyethylene. We carried out an analysis of the activation process by UV–vis spectroscopy. A UV–vis analysis of the supported catalyst 2 is represented in Fig. 5 . After grafting, a broad band can be seen at 250nm, corresponding to the SiO2 support, and two shoulders appear at 260 and 312nm, assigned to the supported complex 2 (Fig. 5c). There is a notable difference with the spectrum of free complex 2 in Nujol (Fig. 5b). After the addition of MAO (Al/Zr=100, Fig. 5d), an increase in the 250nm band was observed due to the presence of supported MAO and, in addition, a weak band appeared at 288nm. This bathochromic shift suggests the formation of the active monomethyl cations [24]. In contrast with these results (Fig. 6 ), supported complex 1 shows a similar spectrum to that of the free complex, i.e., slightly shifted to higher wavelengths, indicating some similarity between the structure of the free molecular complex and the grafted one (Scheme 2). A new spectrum was obtained after the addition of MAO and this had a broad band at 310nm, tentatively assigned to the active species on the basis of the spectrum of complex 1 activated by MAO in solution (Fig. 7 ). We also carried out UV–vis analyses of complexes 1 and 2 in solution. At low Al/Zr ratios (Fig. 7b and f) the spectra of solution samples show a maximum wavelength shifted to lower values than those of the original complexes (λ max =298nm for complex 1 and 302nm for complex 2), as proposed in other zirconocene systems [25–27]. These spectra can be attributed to the monomethyl chloride species by exchange of a chloro ligand with a methyl group of TMA or MAO. If we compare the bands obtained at low Al/Zr ratios with those of the spectra of dimethyl derivatives 3 and 4 (Fig. 7c and g, λ max =284nm for 3 and 293nm for 4), it can be observed that the spectra of the dimethyl species show bands shifted to lower wavelengths. The higher electronic densities associated with these dialkyl zirconocenes lead to a greater hypsochromic shift from the starting complex in comparison to the respective monomethyl derivatives. A shift to higher wavelengths was observed for higher aluminium contents, indicating a decrease in the electronic density around the metal centre due to the formation of active cation-like species (Fig. 7d and h, λ max =326nm for 1 and 308nm for 2). These bands are very similar to those found in the spectra of the supported species. It is noteworthy that complex 1 can be activated at lower Al/Zr ratios than complex 2 (Al/Zr=300 and 500, respectively). In order to determine the influence of the sequence of steps in the preparation of the catalyst, complex 1 was supported in previously modified MAO silicas. Silica was first dehydroxylated at different temperatures (298, 473, 773K) and then treated with a toluene MAO solution. For example, the IR spectrum of a sample of SiO2(473) treated with MAO is shown in Fig. 8b. After this treatment, the infrared band attributed to isolated silanol groups disappeared, indicating a reaction between the basic methyl groups of MAO and acidic silanols. At the same time, new bands appeared in the ν(CH) region which were assigned to stretching vibrations of the methyl groups in MAO. The impregnation with a toluene solution of complex 1 and further solvent elimination gives rise to the appearance in the spectrum (Fig. 8c) of new bands at 2953 and 2856cm−1, assigned to the supported complex. We postulate a possible bonding between the Lewis basic oxygen atom of the silyl ether and some aluminium centres in MAO. The activation process was followed by UV–vis spectroscopy. The spectra of the proposed active species are shown in Fig. 9 for the sample in which zirconocene 1 was first supported and then activated by MAO (Fig. 9b) along with that in which the complex was supported on MAO-modified silica (Fig. 9b and d). In both cases, a similar λ max band was observed (near 310nm) but the intensity of this band was higher in the MAO-modified supported samples, thus indicating a possible higher content in active species. Catalytic activities in ethylene polymerization were tested for the zirconocene supported on unmodified and modified silicas. The results are summarized in Table 1 . In accordance with the surface species described, the catalysts based on complex 1, which probably contains surface zirconocene molecules anchored by the functional ether group, in comparison to the free zirconocene generally have higher activities than those based on complex 2. In the latter case, the activation by MAO involves the breaking of strong ZrO(surface) bonds [11]. In addition, these activity results are very similar to those found in previous studies [7,8,28], even when the new grafted species were activated with a low Al/Zr ratio of 200. Better results were obtained when silica was previously modified by MAO, as expected from the UV–vis spectra (see above). It can be seen that the dehydroxylation temperature has a significant influence on the final activity of the catalyst. Silica dehydroxylated at room temperature probably contains enough physisorbed water to deactivate the majority of the MAO. On the other hand, high temperature dehydroxylation eliminates reactive surface groups, i.e., acidic silanols, which probably reduces the possibilities for adequate MAO fixation. Once again, complex 1 proved to be more active than complex 2. Furthermore, these supported catalysts produce polymers with good morphology. Scanning electron microscope (SEM) images of supported catalyst on unmodified and MAO-modified silica as well as the resulting polyethylene are shown in Fig. 10 . The catalyst images predominantly show round particles of around 50μm. Likewise, the polyethylene obtained using the MAO-modified silica catalysts grew as particles with a regular round shape (Fig. 10b), but shapeless aggregates were found for the samples prepared from directly supported zirconocene supported (Fig. 10d). This could be due to a better dispersion of the catalyst in the former samples. From a practical point of view, and considering both the results of catalytic activity and the polymer morphology, it seems that the procedure involving previous modification the silica with MAO and subsequent supporting of the complex is the more effective. 4 Conclusions The reaction of [Zr{η5-C5H4(CH2)3OSiMe3}(η5-C5H5)Cl2] (1) or [Zr(η5-C5H5)2Cl2] (2) and SiO2(773) at a mild temperature produces grafting of the zirconocene by reaction between the weakly acidic silanol groups and the reactive siloxane bridges on the surface and the ZrCl bonds. In addition, complex 1 was able to react with the surface of the silica by means of its silicon ether substituent, as proposed for similar organosilane compounds. This latter process gives rise to more active zirconocene surface species. A better catalyst was obtained when dehydroxylated silica was modified with MAO. In addition, this supported catalyst allows to produce polyethylene particles with a regular shape. Acknowledgements We gratefully acknowledge financial support from the Ministerio de Educación y Ciencia, Spain (Grant No. MAT2003-05345) and the Junta de Comunidades de Castilla-La Mancha (Grant No. PBI05-029). CA and PC acknowledge a fellowship from REPSOL-YPF-UCLM (contracts CTR-00-084 and CTR-01-165). References [1] W. Kaminsky J. Chem. Soc., Dalton Trans. 1413 1998 [2] H.G. Alt A. Koppl Chem. Rev. 100 2000 1205 [3] H.-H. Brintzinger D. Fisher R. Muelhaupt B. Rieger R. Waymouth Angew. Chem. Int. Ed. Engl. 34 1995 1143 [4] S. Miyake Y. Okumura S. Inazawa Macromolecules 28 1995 3074 [5] J.R. Severn J.C. Chadwick R. Duchateau N. Friederichs Chem. Rev. 105 2005 4073 [6] M.R. Ribeiro A.D. Deffieux M.F. Portela Ind. Eng. Chem. Res. 36 1997 1224 [7] J.H.Z. dos Santos C. Krug M.B. da Rosa F.C. Stedile J. Dupont M.deC. Forte J. Mol. Catal. A: Chem. 139 1999 199 [8] J.H.Z. dos Santos A. Larentis M.B. da Rosa C. Krug I.J.R. Baumvol J. Dupont F.C. Stedile M.deC. Forte Macromol. Chem. Phys. 200 1999 751 [9] R. Guimaraes F.C. Stedile J.H.Z. dos Santos J. Mol. Catal. A: Chem. 206 2003 353 [10] C. Alonso-Moreno A. Antiñolo F. Carrillo-Hermosilla P. Carrión I. López-Solera A. Otero S. Prashar J. Sancho Eur. J. Inorg. Chem. 2005 2924 [11] C. Alonso A. Antiñolo F. Carrillo-Hermosilla P. Carrión A. Otero J. Sancho E. Villaseñor J. Mol. Catal. A: Chem. 220 2004 285 [12] J. Sancho, G. Hidalgo, A. Muñoz-Escalona, M.F. Martínez-Núñez, C. Martín, P. Lafuente, B. Peña, Eur. Pat. Appl. 839836 (1998). [13] E. Samuel M.D. Rausch J. Am. Chem. Soc. 95 1973 6263 [14] B.A. Morrow Stud. Surf. Sci. Catal. 57 1990 161 [15] M.C. Haag C. Krug J. Dupont G. Barrera J.H.Z. dos Santos T. Uozumi T. Sano K. Soga J. Mol. Catal. A: Chem. 169 2001 275 [16] P. Hoffman E. Knoezinger Surf. Sci. 188 1987 181 [17] L.T. Zhuraviev Colloids Surf. A: Physicochem. Eng. Aspects 74 1993 71 [18] B.A. Morrow I.A. Cody J. Phys. Chem. 80 1976 1998 [19] J. Corker F. Lefebvre C. Lécuyer V. Dufaud F. Quignard A. Choplin J. Evans J.-M. Basset Science 271 1996 966 [20] Y. Inaki H. Yoshida T. Yoshida T. Hattori J. Phys. Chem. B 106 2002 9098 [21] J. Blümel J. Am. Chem. Soc. 117 1995 2112 [22] L.H. Dubois B.R. Zegarski J. Am. Chem. Soc. 115 1993 1191 [23] J.C.W. Chien Top. Catal. 7 1999 23 [24] J.H.Z. dos Santos H.F. Ban T. Teranishi T. Uozumi T. Sano K. Soga J. Mol. Catal. A: Chem. 158 2000 541 [25] A. Deffieux H. Cramail J.N. Pédeutour Polym. Prepr. 41 2000 1887 [26] J.N. Pédeutour D. Coevoet H. Cramail A. Deffieux Macromol. Chem. Phys. 200 1999 1215 [27] D. Coevoet H. Cramail A. Deffieux Macromol. Chem. Phys. 199 1998 1451 [28] B.L. Moroz N.V. Semikolenova A.V. Nosov V.A. Zakharov S. Nagy N.J. O’Reilly J. Mol. Catal. A: Chem. 130 1998 121",
      "scopus-id": "33748670077",
      "coredata": {
        "eid": "1-s2.0-S1381116906008715",
        "dc:description": "The reactivity of the silyl ether-substituted zirconocene [Zr{η5-C5H4(CH2)3OSiMe3}(η5-C5H5)Cl2] (1) towards dehydroxylated silica was evaluated and comparative studies with respect to the unmodified analogue [Zr(η5-C5H5)2Cl2] (2) were performed. The different reactions were monitored by FT-IR spectroscopy. The resulting materials were activated with MAO and the catalytic systems were evaluated in ethylene polymerization. The catalysts were characterized by elemental analysis as well as by FT-IR and UV–vis spectroscopy. In addition to the classical reaction between ZrCl bonds and acidic silanol surface groups, grafting of complex 1 occurs to some extent by reaction between the silyl ether group and reactive siloxane bridges on the silica surface. In contrast, complex 2, as one would expect, only reacts through the ZrCl groups. Supporting zirconocene 1 on MAO-modified silica gives rise to a more efficient catalyst. The effects caused by these different grafting reactions, as well as the catalytic activities of the resulting materials, are presented and discussed.",
        "openArchiveArticle": "false",
        "prism:coverDate": "2006-10-02",
        "openaccessUserLicense": null,
        "prism:aggregationType": "Journal",
        "prism:url": "https://api.elsevier.com/content/article/pii/S1381116906008715",
        "dc:creator": [
          {
            "@_fa": "true",
            "$": "Carrión, Pedro"
          },
          {
            "@_fa": "true",
            "$": "Carrillo-Hermosilla, Fernando"
          },
          {
            "@_fa": "true",
            "$": "Alonso-Moreno, Carlos"
          },
          {
            "@_fa": "true",
            "$": "Otero, Antonio"
          },
          {
            "@_fa": "true",
            "$": "Antiñolo, Antonio"
          },
          {
            "@_fa": "true",
            "$": "Sancho, José"
          },
          {
            "@_fa": "true",
            "$": "Villaseñor, Elena"
          }
        ],
        "link": [
          {
            "@_fa": "true",
            "@rel": "self",
            "@href": "https://api.elsevier.com/content/article/pii/S1381116906008715"
          },
          {
            "@_fa": "true",
            "@rel": "scidir",
            "@href": "https://www.sciencedirect.com/science/article/pii/S1381116906008715"
          }
        ],
        "dc:format": "application/json",
        "openaccessType": null,
        "pii": "S1381-1169(06)00871-5",
        "prism:volume": "258",
        "prism:publisher": "Elsevier B.V.",
        "dc:title": "Supported modified zirconocene catalyst for ethylene polymerization",
        "prism:copyright": "Copyright © 2006 Elsevier B.V. All rights reserved.",
        "openaccess": "0",
        "prism:issn": "13811169",
        "prism:issueIdentifier": "1-2",
        "dcterms:subject": [
          {
            "@_fa": "true",
            "$": "Zirconocene"
          },
          {
            "@_fa": "true",
            "$": "Supported"
          },
          {
            "@_fa": "true",
            "$": "Silica"
          },
          {
            "@_fa": "true",
            "$": "Ethylene"
          },
          {
            "@_fa": "true",
            "$": "Polymerization"
          }
        ],
        "openaccessArticle": "false",
        "prism:publicationName": "Journal of Molecular Catalysis A: Chemical",
        "prism:number": "1-2",
        "openaccessSponsorType": null,
        "prism:pageRange": "236-245",
        "prism:endingPage": "245",
        "pubType": "fla",
        "prism:coverDisplayDate": "2 October 2006",
        "prism:doi": "10.1016/j.molcata.2006.05.055",
        "prism:startingPage": "236",
        "dc:identifier": "doi:10.1016/j.molcata.2006.05.055",
        "openaccessSponsorName": null
      },
      "objects": {
        "object": [
          {
            "@category": "standard",
            "@height": "479",
            "@width": "647",
            "@_fa": "true",
            "$": "https://api.elsevier.com/content/object/eid/1-s2.0-S1381116906008715-gr1.gif?httpAccept=%2A%2F%2A",
            "@multimediatype": "GIF image file",
            "@type": "IMAGE-DOWNSAMPLED",
            "@size": "17801",
            "@ref": "gr1",
            "@mimetype": "image/gif"
          },
          {
            "@category": "thumbnail",
            "@height": "93",
            "@width": "125",
            "@_fa": "true",
            "$": "https://api.elsevier.com/content/object/eid/1-s2.0-S1381116906008715-gr1.sml?httpAccept=%2A%2F%2A",
            "@multimediatype": "GIF image file",
            "@type": "IMAGE-THUMBNAIL",
            "@size": "1547",
            "@ref": "gr1",
            "@mimetype": "image/gif"
          },
          {
            "@category": "standard",
            "@height": "487",
            "@width": "678",
            "@_fa": "true",
            "$": "https://api.elsevier.com/content/object/eid/1-s2.0-S1381116906008715-gr10.jpg?httpAccept=%2A%2F%2A",
            "@multimediatype": "JPEG image file",
            "@type": "IMAGE-DOWNSAMPLED",
            "@size": "160844",
            "@ref": "gr10",
            "@mimetype": "image/jpeg"
          },
          {
            "@category": "thumbnail",
            "@height": "90",
            "@width": "125",
            "@_fa": "true",
            "$": "https://api.elsevier.com/content/object/eid/1-s2.0-S1381116906008715-gr10.sml?httpAccept=%2A%2F%2A",
            "@multimediatype": "GIF image file",
            "@type": "IMAGE-THUMBNAIL",
            "@size": "4906",
            "@ref": "gr10",
            "@mimetype": "image/gif"
          },
          {
            "@category": "standard",
            "@height": "425",
            "@width": "650",
            "@_fa": "true",
            "$": "https://api.elsevier.com/content/object/eid/1-s2.0-S1381116906008715-gr2.jpg?httpAccept=%2A%2F%2A",
            "@multimediatype": "JPEG image file",
            "@type": "IMAGE-DOWNSAMPLED",
            "@size": "44267",
            "@ref": "gr2",
            "@mimetype": "image/jpeg"
          },
          {
            "@category": "thumbnail",
            "@height": "82",
            "@width": "125",
            "@_fa": "true",
            "$": "https://api.elsevier.com/content/object/eid/1-s2.0-S1381116906008715-gr2.sml?httpAccept=%2A%2F%2A",
            "@multimediatype": "GIF image file",
            "@type": "IMAGE-THUMBNAIL",
            "@size": "1503",
            "@ref": "gr2",
            "@mimetype": "image/gif"
          },
          {
            "@category": "standard",
            "@height": "248",
            "@width": "380",
            "@_fa": "true",
            "$": "https://api.elsevier.com/content/object/eid/1-s2.0-S1381116906008715-gr3.jpg?httpAccept=%2A%2F%2A",
            "@multimediatype": "JPEG image file",
            "@type": "IMAGE-DOWNSAMPLED",
            "@size": "17219",
            "@ref": "gr3",
            "@mimetype": "image/jpeg"
          },
          {
            "@category": "thumbnail",
            "@height": "82",
            "@width": "125",
            "@_fa": "true",
            "$": "https://api.elsevier.com/content/object/eid/1-s2.0-S1381116906008715-gr3.sml?httpAccept=%2A%2F%2A",
            "@multimediatype": "GIF image file",
            "@type": "IMAGE-THUMBNAIL",
            "@size": "1416",
            "@ref": "gr3",
            "@mimetype": "image/gif"
          },
          {
            "@category": "standard",
            "@height": "424",
            "@width": "655",
            "@_fa": "true",
            "$": "https://api.elsevier.com/content/object/eid/1-s2.0-S1381116906008715-gr4.jpg?httpAccept=%2A%2F%2A",
            "@multimediatype": "JPEG image file",
            "@type": "IMAGE-DOWNSAMPLED",
            "@size": "70674",
            "@ref": "gr4",
            "@mimetype": "image/jpeg"
          },
          {
            "@category": "thumbnail",
            "@height": "81",
            "@width": "125",
            "@_fa": "true",
            "$": "https://api.elsevier.com/content/object/eid/1-s2.0-S1381116906008715-gr4.sml?httpAccept=%2A%2F%2A",
            "@multimediatype": "GIF image file",
            "@type": "IMAGE-THUMBNAIL",
            "@size": "1380",
            "@ref": "gr4",
            "@mimetype": "image/gif"
          },
          {
            "@category": "standard",
            "@height": "436",
            "@width": "659",
            "@_fa": "true",
            "$": "https://api.elsevier.com/content/object/eid/1-s2.0-S1381116906008715-gr5.jpg?httpAccept=%2A%2F%2A",
            "@multimediatype": "JPEG image file",
            "@type": "IMAGE-DOWNSAMPLED",
            "@size": "78958",
            "@ref": "gr5",
            "@mimetype": "image/jpeg"
          },
          {
            "@category": "thumbnail",
            "@height": "83",
            "@width": "125",
            "@_fa": "true",
            "$": "https://api.elsevier.com/content/object/eid/1-s2.0-S1381116906008715-gr5.sml?httpAccept=%2A%2F%2A",
            "@multimediatype": "GIF image file",
            "@type": "IMAGE-THUMBNAIL",
            "@size": "1849",
            "@ref": "gr5",
            "@mimetype": "image/gif"
          },
          {
            "@category": "standard",
            "@height": "447",
            "@width": "644",
            "@_fa": "true",
            "$": "https://api.elsevier.com/content/object/eid/1-s2.0-S1381116906008715-gr6.jpg?httpAccept=%2A%2F%2A",
            "@multimediatype": "JPEG image file",
            "@type": "IMAGE-DOWNSAMPLED",
            "@size": "61543",
            "@ref": "gr6",
            "@mimetype": "image/jpeg"
          },
          {
            "@category": "thumbnail",
            "@height": "87",
            "@width": "125",
            "@_fa": "true",
            "$": "https://api.elsevier.com/content/object/eid/1-s2.0-S1381116906008715-gr6.sml?httpAccept=%2A%2F%2A",
            "@multimediatype": "GIF image file",
            "@type": "IMAGE-THUMBNAIL",
            "@size": "1776",
            "@ref": "gr6",
            "@mimetype": "image/gif"
          },
          {
            "@category": "standard",
            "@height": "388",
            "@width": "638",
            "@_fa": "true",
            "$": "https://api.elsevier.com/content/object/eid/1-s2.0-S1381116906008715-gr7.jpg?httpAccept=%2A%2F%2A",
            "@multimediatype": "JPEG image file",
            "@type": "IMAGE-DOWNSAMPLED",
            "@size": "52233",
            "@ref": "gr7",
            "@mimetype": "image/jpeg"
          },
          {
            "@category": "thumbnail",
            "@height": "76",
            "@width": "125",
            "@_fa": "true",
            "$": "https://api.elsevier.com/content/object/eid/1-s2.0-S1381116906008715-gr7.sml?httpAccept=%2A%2F%2A",
            "@multimediatype": "GIF image file",
            "@type": "IMAGE-THUMBNAIL",
            "@size": "1989",
            "@ref": "gr7",
            "@mimetype": "image/gif"
          },
          {
            "@category": "standard",
            "@height": "457",
            "@width": "655",
            "@_fa": "true",
            "$": "https://api.elsevier.com/content/object/eid/1-s2.0-S1381116906008715-gr8.jpg?httpAccept=%2A%2F%2A",
            "@multimediatype": "JPEG image file",
            "@type": "IMAGE-DOWNSAMPLED",
            "@size": "35216",
            "@ref": "gr8",
            "@mimetype": "image/jpeg"
          },
          {
            "@category": "thumbnail",
            "@height": "87",
            "@width": "125",
            "@_fa": "true",
            "$": "https://api.elsevier.com/content/object/eid/1-s2.0-S1381116906008715-gr8.sml?httpAccept=%2A%2F%2A",
            "@multimediatype": "GIF image file",
            "@type": "IMAGE-THUMBNAIL",
            "@size": "1209",
            "@ref": "gr8",
            "@mimetype": "image/gif"
          },
          {
            "@category": "standard",
            "@height": "270",
            "@width": "356",
            "@_fa": "true",
            "$": "https://api.elsevier.com/content/object/eid/1-s2.0-S1381116906008715-gr9.jpg?httpAccept=%2A%2F%2A",
            "@multimediatype": "JPEG image file",
            "@type": "IMAGE-DOWNSAMPLED",
            "@size": "27482",
            "@ref": "gr9",
            "@mimetype": "image/jpeg"
          },
          {
            "@category": "thumbnail",
            "@height": "93",
            "@width": "123",
            "@_fa": "true",
            "$": "https://api.elsevier.com/content/object/eid/1-s2.0-S1381116906008715-gr9.sml?httpAccept=%2A%2F%2A",
            "@multimediatype": "GIF image file",
            "@type": "IMAGE-THUMBNAIL",
            "@size": "1954",
            "@ref": "gr9",
            "@mimetype": "image/gif"
          },
          {
            "@category": "standard",
            "@height": "105",
            "@width": "368",
            "@_fa": "true",
            "$": "https://api.elsevier.com/content/object/eid/1-s2.0-S1381116906008715-sc1.jpg?httpAccept=%2A%2F%2A",
            "@multimediatype": "JPEG image file",
            "@type": "IMAGE-DOWNSAMPLED",
            "@size": "9263",
            "@ref": "sc1",
            "@mimetype": "image/jpeg"
          },
          {
            "@category": "thumbnail",
            "@height": "36",
            "@width": "125",
            "@_fa": "true",
            "$": "https://api.elsevier.com/content/object/eid/1-s2.0-S1381116906008715-sc1.sml?httpAccept=%2A%2F%2A",
            "@multimediatype": "GIF image file",
            "@type": "IMAGE-THUMBNAIL",
            "@size": "832",
            "@ref": "sc1",
            "@mimetype": "image/gif"
          },
          {
            "@category": "standard",
            "@height": "611",
            "@width": "377",
            "@_fa": "true",
            "$": "https://api.elsevier.com/content/object/eid/1-s2.0-S1381116906008715-sc2.jpg?httpAccept=%2A%2F%2A",
            "@multimediatype": "JPEG image file",
            "@type": "IMAGE-DOWNSAMPLED",
            "@size": "56234",
            "@ref": "sc2",
            "@mimetype": "image/jpeg"
          },
          {
            "@category": "thumbnail",
            "@height": "92",
            "@width": "57",
            "@_fa": "true",
            "$": "https://api.elsevier.com/content/object/eid/1-s2.0-S1381116906008715-sc2.sml?httpAccept=%2A%2F%2A",
            "@multimediatype": "GIF image file",
            "@type": "IMAGE-THUMBNAIL",
            "@size": "1130",
            "@ref": "sc2",
            "@mimetype": "image/gif"
          },
          {
            "@category": "standard",
            "@height": "181",
            "@width": "300",
            "@_fa": "true",
            "$": "https://api.elsevier.com/content/object/eid/1-s2.0-S1381116906008715-fx1.jpg?httpAccept=%2A%2F%2A",
            "@multimediatype": "JPEG image file",
            "@type": "IMAGE-DOWNSAMPLED",
            "@size": "17671",
            "@ref": "fx1",
            "@mimetype": "image/jpeg"
          },
          {
            "@category": "thumbnail",
            "@height": "75",
            "@width": "125",
            "@_fa": "true",
            "$": "https://api.elsevier.com/content/object/eid/1-s2.0-S1381116906008715-fx1.sml?httpAccept=%2A%2F%2A",
            "@multimediatype": "GIF image file",
            "@type": "IMAGE-THUMBNAIL",
            "@size": "1433",
            "@ref": "fx1",
            "@mimetype": "image/gif"
          }
        ]
      },
      "link": {
        "@rel": "abstract",
        "@href": "https://api.elsevier.com/content/abstract/scopus_id/33748670077"
      }
    }
  }
}