{
  "metadata": {
    "title": "Novel hydrodesulfurization catalysts derived from a supported rhodium carbonyl complex: -Effect of the support on the catalytic activity and the sulfur behavior",
    "authors": "; ; ",
    "journal": "Journal of Molecular Catalysis A: Chemical",
    "date": "2004-05-04",
    "doi": "10.1016/j.molcata.2003.10.046",
    "abstract": "",
    "uri": "https://api.elsevier.com/content/article/pii/S1381116903007684",
    "pii": "S1381116903007684"
  },
  "fulltext": {
    "full-text-retrieval-response": {
      "scopus-eid": "2-s2.0-1642411029",
      "originalText": "serial JL 271358 291210 291744 291790 291809 31 Journal of Molecular Catalysis A: Chemical JOURNALMOLECULARCATALYSISACHEMICAL 2004-01-13 2004-01-13 2010-03-28T13:36:59 1-s2.0-S1381116903007684 S1381-1169(03)00768-4 S1381116903007684 10.1016/j.molcata.2003.10.046 S300 S300.1 FULL-TEXT 1-s2.0-S1381116900X01847 2015-05-15T05:56:32.920819-04:00 0 0 20040504 2004 2004-01-13T00:00:00Z articleinfo crossmark dco dateupdated tomb dateloaded datesearch indexeddate issuelist volumelist yearnav absattachment articletitlenorm authfirstinitialnorm authfirstsurnamenorm cid cids contenttype copyright dateloadedtxt docsubtype doctype doi eid ewtransactionid hubeid issfirst issn issnnorm itemstage itemtransactionid itemweight openaccess openarchive pg pgfirst pglast pii piinorm pubdatestart pubdatetxt pubyr sortorder srctitle srctitlenorm srctype subheadings volfirst volissue webpdf webpdfpagecount figure table body acknowledge affil articletitle auth authfirstini authfull authkeywords authlast primabst ref specialabst alllist content subj ssids 1381-1169 13811169 213 213 2 2 Volume 213, Issue 2 10 207 215 207 215 20040504 4 May 2004 2004-05-04 2004 converted-article fla Copyright © 2003 Elsevier B.V. All rights reserved. NOVELHYDRODESULFURIZATIONCATALYSTSDERIVEDASUPPORTEDRHODIUMCARBONYLCOMPLEX LEE J 1 Introduction 2 Experimental 2.1 Materials 2.2 Preparation of the Rh6(CO)16-NEt3 based catalysts 2.3 Characterization of the prepared catalysts 2.4 Apparatus and experimental procedure 2.4.1 HDS activity 2.4.2 The [ 35 S]DBT HDS radioisotope tracer method 3 Results and discussion 3.1 Effect of the support on the DBT HDS activity 3.1.1 Activity of the presulfided 1 wt.% Rh catalysts 3.1.2 Influence of the catalyst pre-activation method on the HDS catalytic performances 3.1.3 Effect of the Rh loading on the DBT HDS activity 3.2 Study of the sulfur behavior on the 4Rh/SiO2 catalyst during the HDS working conditions using a 35 S tracer method 4 Conclusion Acknowledgements References PECORARO 1981 430 T LACROIX 1989 473 M VRINAT 1989 405 M RAJE 1997 297 A RAJE 1997 319 A SHABTAI 1987 143 J DELOSREYES 1991 645 J LU 1989 373 K ISHIHARA 1994 212 A LEDOUX 1986 275 M VISSERS 1984 813 J EIJSBOUTS 1991 217 S HARVEY 1986 253 T ZOTIN 1995 213 J BREYSSE 1997 143 M LIAW 1994 636 S NAVARRO 1996 23 R ISHIHARA 1996 211 221 A SEXTON 1997 167 B SOLYMOSI 1981 371 F ZHANG 1995 37 Z INOUE 1989 1 T HARRIS 1984 400 S VISSERS 1984 813 J SUGIOKA 1996 255 M KABE 1993 239 T QIAN 1994 907 W QIAN 1997 1821 W QIAN 1997 286 W HOUALLA 1978 1015 M ISHIHARA 1996 403 409 A TAUSTER 1978 170 S ISHIHARA 1999 345 A ISHIHARA 2003 59 A MANGNUS 1995 178 P LEEX2004X207 LEEX2004X207X215 LEEX2004X207XJ LEEX2004X207X215XJ item S1381-1169(03)00768-4 S1381116903007684 1-s2.0-S1381116903007684 10.1016/j.molcata.2003.10.046 271358 2010-10-15T16:13:46.059608-04:00 2004-05-04 1-s2.0-S1381116903007684-main.pdf https://s3.amazonaws.com/prod-ucs-content-store-us-east/content/pii:S1381116903007684/MAIN/application/pdf/a56ef41e32868be437c116f646f2e3fc/main.pdf https://s3-eu-west-1.amazonaws.com/prod-ucs-content-store-eu-west/content/pii:S1381116903007684/MAIN/application/pdf/a56ef41e32868be437c116f646f2e3fc/main.pdf main.pdf pdf true 250326 MAIN 9 1-s2.0-S1381116903007684-main_1.png https://s3.amazonaws.com/prod-ucs-content-store-us-east/content/pii:S1381116903007684/PREVIEW/image/png/a82719eb367daa237e1a0a34bd6bb388/main_1.png https://s3-eu-west-1.amazonaws.com/prod-ucs-content-store-eu-west/content/pii:S1381116903007684/PREVIEW/image/png/a82719eb367daa237e1a0a34bd6bb388/main_1.png main_1.png png 72235 849 656 IMAGE-WEB-PDF 1 1-s2.0-S1381116903007684-si9.gif https://s3.amazonaws.com/prod-ucs-content-store-us-east/content/pii:S1381116903007684/STRIPIN/image/gif/1c6e50b1166c8cbd57aa659e4d7836ae/si38.gif https://s3-eu-west-1.amazonaws.com/prod-ucs-content-store-eu-west/content/pii:S1381116903007684/STRIPIN/image/gif/1c6e50b1166c8cbd57aa659e4d7836ae/si38.gif si9 si9.gif gif 199 14 23 ALTIMG 1-s2.0-S1381116903007684-si8.gif https://s3.amazonaws.com/prod-ucs-content-store-us-east/content/pii:S1381116903007684/STRIPIN/image/gif/1c6e50b1166c8cbd57aa659e4d7836ae/si38.gif https://s3-eu-west-1.amazonaws.com/prod-ucs-content-store-eu-west/content/pii:S1381116903007684/STRIPIN/image/gif/1c6e50b1166c8cbd57aa659e4d7836ae/si38.gif si8 si8.gif gif 199 14 23 ALTIMG 1-s2.0-S1381116903007684-si7.gif https://s3.amazonaws.com/prod-ucs-content-store-us-east/content/pii:S1381116903007684/STRIPIN/image/gif/1c6e50b1166c8cbd57aa659e4d7836ae/si38.gif https://s3-eu-west-1.amazonaws.com/prod-ucs-content-store-eu-west/content/pii:S1381116903007684/STRIPIN/image/gif/1c6e50b1166c8cbd57aa659e4d7836ae/si38.gif si7 true si7.gif gif 199 14 23 ALTIMG 1-s2.0-S1381116903007684-si6.gif https://s3.amazonaws.com/prod-ucs-content-store-us-east/content/pii:S1381116903007684/STRIPIN/image/gif/5e6cd62e94fa4f3dc23f8ac2d2c34bef/si6.gif https://s3-eu-west-1.amazonaws.com/prod-ucs-content-store-eu-west/content/pii:S1381116903007684/STRIPIN/image/gif/5e6cd62e94fa4f3dc23f8ac2d2c34bef/si6.gif si6 si6.gif gif 513 19 94 ALTIMG 1-s2.0-S1381116903007684-si5.gif https://s3.amazonaws.com/prod-ucs-content-store-us-east/content/pii:S1381116903007684/STRIPIN/image/gif/1c6e50b1166c8cbd57aa659e4d7836ae/si38.gif https://s3-eu-west-1.amazonaws.com/prod-ucs-content-store-eu-west/content/pii:S1381116903007684/STRIPIN/image/gif/1c6e50b1166c8cbd57aa659e4d7836ae/si38.gif si5 si5.gif gif 199 14 23 ALTIMG 1-s2.0-S1381116903007684-si47.gif https://s3.amazonaws.com/prod-ucs-content-store-us-east/content/pii:S1381116903007684/STRIPIN/image/gif/1c6e50b1166c8cbd57aa659e4d7836ae/si38.gif https://s3-eu-west-1.amazonaws.com/prod-ucs-content-store-eu-west/content/pii:S1381116903007684/STRIPIN/image/gif/1c6e50b1166c8cbd57aa659e4d7836ae/si38.gif si47 si47.gif gif 199 14 23 ALTIMG 1-s2.0-S1381116903007684-si46.gif https://s3.amazonaws.com/prod-ucs-content-store-us-east/content/pii:S1381116903007684/STRIPIN/image/gif/1c6e50b1166c8cbd57aa659e4d7836ae/si38.gif https://s3-eu-west-1.amazonaws.com/prod-ucs-content-store-eu-west/content/pii:S1381116903007684/STRIPIN/image/gif/1c6e50b1166c8cbd57aa659e4d7836ae/si38.gif si46 si46.gif gif 199 14 23 ALTIMG 1-s2.0-S1381116903007684-si45.gif https://s3.amazonaws.com/prod-ucs-content-store-us-east/content/pii:S1381116903007684/STRIPIN/image/gif/1c6e50b1166c8cbd57aa659e4d7836ae/si38.gif https://s3-eu-west-1.amazonaws.com/prod-ucs-content-store-eu-west/content/pii:S1381116903007684/STRIPIN/image/gif/1c6e50b1166c8cbd57aa659e4d7836ae/si38.gif si45 si45.gif gif 199 14 23 ALTIMG 1-s2.0-S1381116903007684-si44.gif https://s3.amazonaws.com/prod-ucs-content-store-us-east/content/pii:S1381116903007684/STRIPIN/image/gif/1c6e50b1166c8cbd57aa659e4d7836ae/si38.gif https://s3-eu-west-1.amazonaws.com/prod-ucs-content-store-eu-west/content/pii:S1381116903007684/STRIPIN/image/gif/1c6e50b1166c8cbd57aa659e4d7836ae/si38.gif si44 si44.gif gif 199 14 23 ALTIMG 1-s2.0-S1381116903007684-si43.gif https://s3.amazonaws.com/prod-ucs-content-store-us-east/content/pii:S1381116903007684/STRIPIN/image/gif/78c3f99c8488f10def5a9a1103e68cae/si43.gif https://s3-eu-west-1.amazonaws.com/prod-ucs-content-store-eu-west/content/pii:S1381116903007684/STRIPIN/image/gif/78c3f99c8488f10def5a9a1103e68cae/si43.gif si43 si43.gif gif 205 14 23 ALTIMG 1-s2.0-S1381116903007684-si42.gif https://s3.amazonaws.com/prod-ucs-content-store-us-east/content/pii:S1381116903007684/STRIPIN/image/gif/78c3f99c8488f10def5a9a1103e68cae/si43.gif https://s3-eu-west-1.amazonaws.com/prod-ucs-content-store-eu-west/content/pii:S1381116903007684/STRIPIN/image/gif/78c3f99c8488f10def5a9a1103e68cae/si43.gif si42 si42.gif gif 205 14 23 ALTIMG 1-s2.0-S1381116903007684-si41.gif https://s3.amazonaws.com/prod-ucs-content-store-us-east/content/pii:S1381116903007684/STRIPIN/image/gif/1c6e50b1166c8cbd57aa659e4d7836ae/si38.gif https://s3-eu-west-1.amazonaws.com/prod-ucs-content-store-eu-west/content/pii:S1381116903007684/STRIPIN/image/gif/1c6e50b1166c8cbd57aa659e4d7836ae/si38.gif si41 si41.gif gif 199 14 23 ALTIMG 1-s2.0-S1381116903007684-si40.gif https://s3.amazonaws.com/prod-ucs-content-store-us-east/content/pii:S1381116903007684/STRIPIN/image/gif/78c3f99c8488f10def5a9a1103e68cae/si43.gif https://s3-eu-west-1.amazonaws.com/prod-ucs-content-store-eu-west/content/pii:S1381116903007684/STRIPIN/image/gif/78c3f99c8488f10def5a9a1103e68cae/si43.gif si40 si40.gif gif 205 14 23 ALTIMG 1-s2.0-S1381116903007684-si4.gif https://s3.amazonaws.com/prod-ucs-content-store-us-east/content/pii:S1381116903007684/STRIPIN/image/gif/1c6e50b1166c8cbd57aa659e4d7836ae/si38.gif https://s3-eu-west-1.amazonaws.com/prod-ucs-content-store-eu-west/content/pii:S1381116903007684/STRIPIN/image/gif/1c6e50b1166c8cbd57aa659e4d7836ae/si38.gif si4 si4.gif gif 199 14 23 ALTIMG 1-s2.0-S1381116903007684-si39.gif https://s3.amazonaws.com/prod-ucs-content-store-us-east/content/pii:S1381116903007684/STRIPIN/image/gif/78c3f99c8488f10def5a9a1103e68cae/si43.gif https://s3-eu-west-1.amazonaws.com/prod-ucs-content-store-eu-west/content/pii:S1381116903007684/STRIPIN/image/gif/78c3f99c8488f10def5a9a1103e68cae/si43.gif si39 si39.gif gif 205 14 23 ALTIMG 1-s2.0-S1381116903007684-si38.gif https://s3.amazonaws.com/prod-ucs-content-store-us-east/content/pii:S1381116903007684/STRIPIN/image/gif/1c6e50b1166c8cbd57aa659e4d7836ae/si38.gif https://s3-eu-west-1.amazonaws.com/prod-ucs-content-store-eu-west/content/pii:S1381116903007684/STRIPIN/image/gif/1c6e50b1166c8cbd57aa659e4d7836ae/si38.gif si38 si38.gif gif 199 14 23 ALTIMG 1-s2.0-S1381116903007684-si37.gif https://s3.amazonaws.com/prod-ucs-content-store-us-east/content/pii:S1381116903007684/STRIPIN/image/gif/78c3f99c8488f10def5a9a1103e68cae/si43.gif https://s3-eu-west-1.amazonaws.com/prod-ucs-content-store-eu-west/content/pii:S1381116903007684/STRIPIN/image/gif/78c3f99c8488f10def5a9a1103e68cae/si43.gif si37 si37.gif gif 205 14 23 ALTIMG 1-s2.0-S1381116903007684-si36.gif https://s3.amazonaws.com/prod-ucs-content-store-us-east/content/pii:S1381116903007684/STRIPIN/image/gif/1c6e50b1166c8cbd57aa659e4d7836ae/si38.gif https://s3-eu-west-1.amazonaws.com/prod-ucs-content-store-eu-west/content/pii:S1381116903007684/STRIPIN/image/gif/1c6e50b1166c8cbd57aa659e4d7836ae/si38.gif si36 si36.gif gif 199 14 23 ALTIMG 1-s2.0-S1381116903007684-si35.gif https://s3.amazonaws.com/prod-ucs-content-store-us-east/content/pii:S1381116903007684/STRIPIN/image/gif/1c6e50b1166c8cbd57aa659e4d7836ae/si38.gif https://s3-eu-west-1.amazonaws.com/prod-ucs-content-store-eu-west/content/pii:S1381116903007684/STRIPIN/image/gif/1c6e50b1166c8cbd57aa659e4d7836ae/si38.gif si35 si35.gif gif 199 14 23 ALTIMG 1-s2.0-S1381116903007684-si34.gif https://s3.amazonaws.com/prod-ucs-content-store-us-east/content/pii:S1381116903007684/STRIPIN/image/gif/1c6e50b1166c8cbd57aa659e4d7836ae/si38.gif https://s3-eu-west-1.amazonaws.com/prod-ucs-content-store-eu-west/content/pii:S1381116903007684/STRIPIN/image/gif/1c6e50b1166c8cbd57aa659e4d7836ae/si38.gif si34 si34.gif gif 199 14 23 ALTIMG 1-s2.0-S1381116903007684-si33.gif https://s3.amazonaws.com/prod-ucs-content-store-us-east/content/pii:S1381116903007684/STRIPIN/image/gif/1c6e50b1166c8cbd57aa659e4d7836ae/si38.gif https://s3-eu-west-1.amazonaws.com/prod-ucs-content-store-eu-west/content/pii:S1381116903007684/STRIPIN/image/gif/1c6e50b1166c8cbd57aa659e4d7836ae/si38.gif si33 si33.gif gif 199 14 23 ALTIMG 1-s2.0-S1381116903007684-si32.gif https://s3.amazonaws.com/prod-ucs-content-store-us-east/content/pii:S1381116903007684/STRIPIN/image/gif/1c6e50b1166c8cbd57aa659e4d7836ae/si38.gif https://s3-eu-west-1.amazonaws.com/prod-ucs-content-store-eu-west/content/pii:S1381116903007684/STRIPIN/image/gif/1c6e50b1166c8cbd57aa659e4d7836ae/si38.gif si32 si32.gif gif 199 14 23 ALTIMG 1-s2.0-S1381116903007684-si31.gif https://s3.amazonaws.com/prod-ucs-content-store-us-east/content/pii:S1381116903007684/STRIPIN/image/gif/1c6e50b1166c8cbd57aa659e4d7836ae/si38.gif https://s3-eu-west-1.amazonaws.com/prod-ucs-content-store-eu-west/content/pii:S1381116903007684/STRIPIN/image/gif/1c6e50b1166c8cbd57aa659e4d7836ae/si38.gif si31 si31.gif gif 199 14 23 ALTIMG 1-s2.0-S1381116903007684-si30.gif https://s3.amazonaws.com/prod-ucs-content-store-us-east/content/pii:S1381116903007684/STRIPIN/image/gif/1c6e50b1166c8cbd57aa659e4d7836ae/si38.gif https://s3-eu-west-1.amazonaws.com/prod-ucs-content-store-eu-west/content/pii:S1381116903007684/STRIPIN/image/gif/1c6e50b1166c8cbd57aa659e4d7836ae/si38.gif si30 si30.gif gif 199 14 23 ALTIMG 1-s2.0-S1381116903007684-si3.gif https://s3.amazonaws.com/prod-ucs-content-store-us-east/content/pii:S1381116903007684/STRIPIN/image/gif/97e23fb32de4e4a3030f3fa3763fe813/si3.gif https://s3-eu-west-1.amazonaws.com/prod-ucs-content-store-eu-west/content/pii:S1381116903007684/STRIPIN/image/gif/97e23fb32de4e4a3030f3fa3763fe813/si3.gif si3 si3.gif gif 333 19 58 ALTIMG 1-s2.0-S1381116903007684-si29.gif https://s3.amazonaws.com/prod-ucs-content-store-us-east/content/pii:S1381116903007684/STRIPIN/image/gif/1c6e50b1166c8cbd57aa659e4d7836ae/si38.gif https://s3-eu-west-1.amazonaws.com/prod-ucs-content-store-eu-west/content/pii:S1381116903007684/STRIPIN/image/gif/1c6e50b1166c8cbd57aa659e4d7836ae/si38.gif si29 si29.gif gif 199 14 23 ALTIMG 1-s2.0-S1381116903007684-si28.gif https://s3.amazonaws.com/prod-ucs-content-store-us-east/content/pii:S1381116903007684/STRIPIN/image/gif/1c6e50b1166c8cbd57aa659e4d7836ae/si38.gif https://s3-eu-west-1.amazonaws.com/prod-ucs-content-store-eu-west/content/pii:S1381116903007684/STRIPIN/image/gif/1c6e50b1166c8cbd57aa659e4d7836ae/si38.gif si28 si28.gif gif 199 14 23 ALTIMG 1-s2.0-S1381116903007684-si27.gif https://s3.amazonaws.com/prod-ucs-content-store-us-east/content/pii:S1381116903007684/STRIPIN/image/gif/78c3f99c8488f10def5a9a1103e68cae/si43.gif https://s3-eu-west-1.amazonaws.com/prod-ucs-content-store-eu-west/content/pii:S1381116903007684/STRIPIN/image/gif/78c3f99c8488f10def5a9a1103e68cae/si43.gif si27 si27.gif gif 205 14 23 ALTIMG 1-s2.0-S1381116903007684-si26.gif https://s3.amazonaws.com/prod-ucs-content-store-us-east/content/pii:S1381116903007684/STRIPIN/image/gif/1c6e50b1166c8cbd57aa659e4d7836ae/si38.gif https://s3-eu-west-1.amazonaws.com/prod-ucs-content-store-eu-west/content/pii:S1381116903007684/STRIPIN/image/gif/1c6e50b1166c8cbd57aa659e4d7836ae/si38.gif si26 si26.gif gif 199 14 23 ALTIMG 1-s2.0-S1381116903007684-si25.gif https://s3.amazonaws.com/prod-ucs-content-store-us-east/content/pii:S1381116903007684/STRIPIN/image/gif/1c6e50b1166c8cbd57aa659e4d7836ae/si38.gif https://s3-eu-west-1.amazonaws.com/prod-ucs-content-store-eu-west/content/pii:S1381116903007684/STRIPIN/image/gif/1c6e50b1166c8cbd57aa659e4d7836ae/si38.gif si25 si25.gif gif 199 14 23 ALTIMG 1-s2.0-S1381116903007684-si24.gif https://s3.amazonaws.com/prod-ucs-content-store-us-east/content/pii:S1381116903007684/STRIPIN/image/gif/76c6bfd7d09d9ccf970a38fa466fb09c/si24.gif https://s3-eu-west-1.amazonaws.com/prod-ucs-content-store-eu-west/content/pii:S1381116903007684/STRIPIN/image/gif/76c6bfd7d09d9ccf970a38fa466fb09c/si24.gif si24 si24.gif gif 206 14 27 ALTIMG 1-s2.0-S1381116903007684-si23.gif https://s3.amazonaws.com/prod-ucs-content-store-us-east/content/pii:S1381116903007684/STRIPIN/image/gif/604bcafe851badbf216f7097bc0f1110/si23.gif https://s3-eu-west-1.amazonaws.com/prod-ucs-content-store-eu-west/content/pii:S1381116903007684/STRIPIN/image/gif/604bcafe851badbf216f7097bc0f1110/si23.gif si23 si23.gif gif 897 17 211 ALTIMG 1-s2.0-S1381116903007684-si22.gif https://s3.amazonaws.com/prod-ucs-content-store-us-east/content/pii:S1381116903007684/STRIPIN/image/gif/fff23ccc3fd801bacca6084e2d38a10c/si22.gif https://s3-eu-west-1.amazonaws.com/prod-ucs-content-store-eu-west/content/pii:S1381116903007684/STRIPIN/image/gif/fff23ccc3fd801bacca6084e2d38a10c/si22.gif si22 si22.gif gif 1025 17 263 ALTIMG 1-s2.0-S1381116903007684-si21.gif https://s3.amazonaws.com/prod-ucs-content-store-us-east/content/pii:S1381116903007684/STRIPIN/image/gif/78c3f99c8488f10def5a9a1103e68cae/si43.gif https://s3-eu-west-1.amazonaws.com/prod-ucs-content-store-eu-west/content/pii:S1381116903007684/STRIPIN/image/gif/78c3f99c8488f10def5a9a1103e68cae/si43.gif si21 si21.gif gif 205 14 23 ALTIMG 1-s2.0-S1381116903007684-si20.gif https://s3.amazonaws.com/prod-ucs-content-store-us-east/content/pii:S1381116903007684/STRIPIN/image/gif/1c6e50b1166c8cbd57aa659e4d7836ae/si38.gif https://s3-eu-west-1.amazonaws.com/prod-ucs-content-store-eu-west/content/pii:S1381116903007684/STRIPIN/image/gif/1c6e50b1166c8cbd57aa659e4d7836ae/si38.gif si20 si20.gif gif 199 14 23 ALTIMG 1-s2.0-S1381116903007684-si2.gif https://s3.amazonaws.com/prod-ucs-content-store-us-east/content/pii:S1381116903007684/STRIPIN/image/gif/1c6e50b1166c8cbd57aa659e4d7836ae/si38.gif https://s3-eu-west-1.amazonaws.com/prod-ucs-content-store-eu-west/content/pii:S1381116903007684/STRIPIN/image/gif/1c6e50b1166c8cbd57aa659e4d7836ae/si38.gif si2 si2.gif gif 199 14 23 ALTIMG 1-s2.0-S1381116903007684-si19.gif https://s3.amazonaws.com/prod-ucs-content-store-us-east/content/pii:S1381116903007684/STRIPIN/image/gif/1c6e50b1166c8cbd57aa659e4d7836ae/si38.gif https://s3-eu-west-1.amazonaws.com/prod-ucs-content-store-eu-west/content/pii:S1381116903007684/STRIPIN/image/gif/1c6e50b1166c8cbd57aa659e4d7836ae/si38.gif si19 si19.gif gif 199 14 23 ALTIMG 1-s2.0-S1381116903007684-si18.gif https://s3.amazonaws.com/prod-ucs-content-store-us-east/content/pii:S1381116903007684/STRIPIN/image/gif/1c6e50b1166c8cbd57aa659e4d7836ae/si38.gif https://s3-eu-west-1.amazonaws.com/prod-ucs-content-store-eu-west/content/pii:S1381116903007684/STRIPIN/image/gif/1c6e50b1166c8cbd57aa659e4d7836ae/si38.gif si18 si18.gif gif 199 14 23 ALTIMG 1-s2.0-S1381116903007684-si17.gif https://s3.amazonaws.com/prod-ucs-content-store-us-east/content/pii:S1381116903007684/STRIPIN/image/gif/1c6e50b1166c8cbd57aa659e4d7836ae/si38.gif https://s3-eu-west-1.amazonaws.com/prod-ucs-content-store-eu-west/content/pii:S1381116903007684/STRIPIN/image/gif/1c6e50b1166c8cbd57aa659e4d7836ae/si38.gif si17 si17.gif gif 199 14 23 ALTIMG 1-s2.0-S1381116903007684-si16.gif https://s3.amazonaws.com/prod-ucs-content-store-us-east/content/pii:S1381116903007684/STRIPIN/image/gif/78c3f99c8488f10def5a9a1103e68cae/si43.gif https://s3-eu-west-1.amazonaws.com/prod-ucs-content-store-eu-west/content/pii:S1381116903007684/STRIPIN/image/gif/78c3f99c8488f10def5a9a1103e68cae/si43.gif si16 si16.gif gif 205 14 23 ALTIMG 1-s2.0-S1381116903007684-si15.gif https://s3.amazonaws.com/prod-ucs-content-store-us-east/content/pii:S1381116903007684/STRIPIN/image/gif/1c6e50b1166c8cbd57aa659e4d7836ae/si38.gif https://s3-eu-west-1.amazonaws.com/prod-ucs-content-store-eu-west/content/pii:S1381116903007684/STRIPIN/image/gif/1c6e50b1166c8cbd57aa659e4d7836ae/si38.gif si15 si15.gif gif 199 14 23 ALTIMG 1-s2.0-S1381116903007684-si14.gif https://s3.amazonaws.com/prod-ucs-content-store-us-east/content/pii:S1381116903007684/STRIPIN/image/gif/1c6e50b1166c8cbd57aa659e4d7836ae/si38.gif https://s3-eu-west-1.amazonaws.com/prod-ucs-content-store-eu-west/content/pii:S1381116903007684/STRIPIN/image/gif/1c6e50b1166c8cbd57aa659e4d7836ae/si38.gif si14 si14.gif gif 199 14 23 ALTIMG 1-s2.0-S1381116903007684-si13.gif https://s3.amazonaws.com/prod-ucs-content-store-us-east/content/pii:S1381116903007684/STRIPIN/image/gif/1c6e50b1166c8cbd57aa659e4d7836ae/si38.gif https://s3-eu-west-1.amazonaws.com/prod-ucs-content-store-eu-west/content/pii:S1381116903007684/STRIPIN/image/gif/1c6e50b1166c8cbd57aa659e4d7836ae/si38.gif si13 si13.gif gif 199 14 23 ALTIMG 1-s2.0-S1381116903007684-si12.gif https://s3.amazonaws.com/prod-ucs-content-store-us-east/content/pii:S1381116903007684/STRIPIN/image/gif/76c6bfd7d09d9ccf970a38fa466fb09c/si24.gif https://s3-eu-west-1.amazonaws.com/prod-ucs-content-store-eu-west/content/pii:S1381116903007684/STRIPIN/image/gif/76c6bfd7d09d9ccf970a38fa466fb09c/si24.gif si12 si12.gif gif 206 14 27 ALTIMG 1-s2.0-S1381116903007684-si11.gif https://s3.amazonaws.com/prod-ucs-content-store-us-east/content/pii:S1381116903007684/STRIPIN/image/gif/0a2db2e5acd3b048a9a4910b0bc2be73/si11.gif https://s3-eu-west-1.amazonaws.com/prod-ucs-content-store-eu-west/content/pii:S1381116903007684/STRIPIN/image/gif/0a2db2e5acd3b048a9a4910b0bc2be73/si11.gif si11 si11.gif gif 365 13 79 ALTIMG 1-s2.0-S1381116903007684-si10.gif https://s3.amazonaws.com/prod-ucs-content-store-us-east/content/pii:S1381116903007684/STRIPIN/image/gif/1c6e50b1166c8cbd57aa659e4d7836ae/si38.gif https://s3-eu-west-1.amazonaws.com/prod-ucs-content-store-eu-west/content/pii:S1381116903007684/STRIPIN/image/gif/1c6e50b1166c8cbd57aa659e4d7836ae/si38.gif si10 si10.gif gif 199 14 23 ALTIMG 1-s2.0-S1381116903007684-si1.gif https://s3.amazonaws.com/prod-ucs-content-store-us-east/content/pii:S1381116903007684/STRIPIN/image/gif/1c6e50b1166c8cbd57aa659e4d7836ae/si38.gif https://s3-eu-west-1.amazonaws.com/prod-ucs-content-store-eu-west/content/pii:S1381116903007684/STRIPIN/image/gif/1c6e50b1166c8cbd57aa659e4d7836ae/si38.gif si1 si1.gif gif 199 14 23 ALTIMG 1-s2.0-S1381116903007684-fx1.sml https://s3.amazonaws.com/prod-ucs-content-store-us-east/content/pii:S1381116903007684/fx1/THUMBNAIL/image/gif/4df9944ad2f9ed62547a95cad3486ab9/fx1.sml https://s3-eu-west-1.amazonaws.com/prod-ucs-content-store-eu-west/content/pii:S1381116903007684/fx1/THUMBNAIL/image/gif/4df9944ad2f9ed62547a95cad3486ab9/fx1.sml fx1 true fx1.sml sml 1667 86 125 IMAGE-THUMBNAIL 1-s2.0-S1381116903007684-fx1.gif https://s3.amazonaws.com/prod-ucs-content-store-us-east/content/pii:S1381116903007684/fx1/DOWNSAMPLED/image/gif/31a992d953820b8aa90a7d52886e4080/fx1.gif https://s3-eu-west-1.amazonaws.com/prod-ucs-content-store-eu-west/content/pii:S1381116903007684/fx1/DOWNSAMPLED/image/gif/31a992d953820b8aa90a7d52886e4080/fx1.gif fx1 true fx1.gif gif 4762 172 250 IMAGE-DOWNSAMPLED 1-s2.0-S1381116903007684-gr1.sml https://s3.amazonaws.com/prod-ucs-content-store-us-east/content/pii:S1381116903007684/gr1/THUMBNAIL/image/gif/fd1cb8cb9537f545a8dcb61ccfc3d145/gr1.sml https://s3-eu-west-1.amazonaws.com/prod-ucs-content-store-eu-west/content/pii:S1381116903007684/gr1/THUMBNAIL/image/gif/fd1cb8cb9537f545a8dcb61ccfc3d145/gr1.sml gr1 gr1.sml sml 3341 93 110 IMAGE-THUMBNAIL 1-s2.0-S1381116903007684-gr1.gif https://s3.amazonaws.com/prod-ucs-content-store-us-east/content/pii:S1381116903007684/gr1/DOWNSAMPLED/image/gif/a2436057e7ecfe19e1554877e826ca89/gr1.gif https://s3-eu-west-1.amazonaws.com/prod-ucs-content-store-eu-west/content/pii:S1381116903007684/gr1/DOWNSAMPLED/image/gif/a2436057e7ecfe19e1554877e826ca89/gr1.gif gr1 gr1.gif gif 4663 127 151 IMAGE-DOWNSAMPLED 1-s2.0-S1381116903007684-gr2.sml https://s3.amazonaws.com/prod-ucs-content-store-us-east/content/pii:S1381116903007684/gr2/THUMBNAIL/image/gif/dd24dd5a9cba1d945052b4c3ef0e1f54/gr2.sml https://s3-eu-west-1.amazonaws.com/prod-ucs-content-store-eu-west/content/pii:S1381116903007684/gr2/THUMBNAIL/image/gif/dd24dd5a9cba1d945052b4c3ef0e1f54/gr2.sml gr2 gr2.sml sml 3558 83 125 IMAGE-THUMBNAIL 1-s2.0-S1381116903007684-gr2.gif https://s3.amazonaws.com/prod-ucs-content-store-us-east/content/pii:S1381116903007684/gr2/DOWNSAMPLED/image/gif/8fe3c3431a53347e32f677f6c0e2f3c9/gr2.gif https://s3-eu-west-1.amazonaws.com/prod-ucs-content-store-eu-west/content/pii:S1381116903007684/gr2/DOWNSAMPLED/image/gif/8fe3c3431a53347e32f677f6c0e2f3c9/gr2.gif gr2 gr2.gif gif 5581 124 186 IMAGE-DOWNSAMPLED 1-s2.0-S1381116903007684-gr3.sml https://s3.amazonaws.com/prod-ucs-content-store-us-east/content/pii:S1381116903007684/gr3/THUMBNAIL/image/gif/d3f1cfbf883f4692d6be29914b3a5cfa/gr3.sml https://s3-eu-west-1.amazonaws.com/prod-ucs-content-store-eu-west/content/pii:S1381116903007684/gr3/THUMBNAIL/image/gif/d3f1cfbf883f4692d6be29914b3a5cfa/gr3.sml gr3 gr3.sml sml 2933 93 96 IMAGE-THUMBNAIL 1-s2.0-S1381116903007684-gr3.gif https://s3.amazonaws.com/prod-ucs-content-store-us-east/content/pii:S1381116903007684/gr3/DOWNSAMPLED/image/gif/c9beff89f974be7d8173ca3c69386df6/gr3.gif https://s3-eu-west-1.amazonaws.com/prod-ucs-content-store-eu-west/content/pii:S1381116903007684/gr3/DOWNSAMPLED/image/gif/c9beff89f974be7d8173ca3c69386df6/gr3.gif gr3 gr3.gif gif 4043 128 132 IMAGE-DOWNSAMPLED 1-s2.0-S1381116903007684-gr4.sml https://s3.amazonaws.com/prod-ucs-content-store-us-east/content/pii:S1381116903007684/gr4/THUMBNAIL/image/gif/258767ecdeb8a3c89f3cf8b1d1a7eb76/gr4.sml https://s3-eu-west-1.amazonaws.com/prod-ucs-content-store-eu-west/content/pii:S1381116903007684/gr4/THUMBNAIL/image/gif/258767ecdeb8a3c89f3cf8b1d1a7eb76/gr4.sml gr4 gr4.sml sml 3578 94 98 IMAGE-THUMBNAIL 1-s2.0-S1381116903007684-gr4.gif https://s3.amazonaws.com/prod-ucs-content-store-us-east/content/pii:S1381116903007684/gr4/DOWNSAMPLED/image/gif/663a8883cc0af0c14b37e0a47273c624/gr4.gif https://s3-eu-west-1.amazonaws.com/prod-ucs-content-store-eu-west/content/pii:S1381116903007684/gr4/DOWNSAMPLED/image/gif/663a8883cc0af0c14b37e0a47273c624/gr4.gif gr4 gr4.gif gif 5090 128 134 IMAGE-DOWNSAMPLED 1-s2.0-S1381116903007684-gr5.sml https://s3.amazonaws.com/prod-ucs-content-store-us-east/content/pii:S1381116903007684/gr5/THUMBNAIL/image/gif/1bd4a9ebc90075dd8784c470bd37ebe5/gr5.sml https://s3-eu-west-1.amazonaws.com/prod-ucs-content-store-eu-west/content/pii:S1381116903007684/gr5/THUMBNAIL/image/gif/1bd4a9ebc90075dd8784c470bd37ebe5/gr5.sml gr5 gr5.sml sml 2880 94 95 IMAGE-THUMBNAIL 1-s2.0-S1381116903007684-gr5.gif https://s3.amazonaws.com/prod-ucs-content-store-us-east/content/pii:S1381116903007684/gr5/DOWNSAMPLED/image/gif/713461a448af96c63a2dafefb3009661/gr5.gif https://s3-eu-west-1.amazonaws.com/prod-ucs-content-store-eu-west/content/pii:S1381116903007684/gr5/DOWNSAMPLED/image/gif/713461a448af96c63a2dafefb3009661/gr5.gif gr5 gr5.gif gif 3890 130 132 IMAGE-DOWNSAMPLED 1-s2.0-S1381116903007684-gr6.sml https://s3.amazonaws.com/prod-ucs-content-store-us-east/content/pii:S1381116903007684/gr6/THUMBNAIL/image/gif/feee94b075339a4c2af9af1fe3007495/gr6.sml https://s3-eu-west-1.amazonaws.com/prod-ucs-content-store-eu-west/content/pii:S1381116903007684/gr6/THUMBNAIL/image/gif/feee94b075339a4c2af9af1fe3007495/gr6.sml gr6 gr6.sml sml 3111 80 125 IMAGE-THUMBNAIL 1-s2.0-S1381116903007684-gr6.jpg https://s3.amazonaws.com/prod-ucs-content-store-us-east/content/pii:S1381116903007684/gr6/DOWNSAMPLED/image/jpeg/ff055af85e8c16457ced9d7d7577e8df/gr6.jpg https://s3-eu-west-1.amazonaws.com/prod-ucs-content-store-eu-west/content/pii:S1381116903007684/gr6/DOWNSAMPLED/image/jpeg/ff055af85e8c16457ced9d7d7577e8df/gr6.jpg gr6 gr6.jpg jpg 107705 467 734 IMAGE-DOWNSAMPLED 1-s2.0-S1381116903007684-gr7.sml https://s3.amazonaws.com/prod-ucs-content-store-us-east/content/pii:S1381116903007684/gr7/THUMBNAIL/image/gif/0fd43a9b60343f5a5d151519357ef0fb/gr7.sml https://s3-eu-west-1.amazonaws.com/prod-ucs-content-store-eu-west/content/pii:S1381116903007684/gr7/THUMBNAIL/image/gif/0fd43a9b60343f5a5d151519357ef0fb/gr7.sml gr7 gr7.sml sml 3578 94 109 IMAGE-THUMBNAIL 1-s2.0-S1381116903007684-gr7.jpg https://s3.amazonaws.com/prod-ucs-content-store-us-east/content/pii:S1381116903007684/gr7/DOWNSAMPLED/image/jpeg/8780dcd452443453e3611c25fb875584/gr7.jpg https://s3-eu-west-1.amazonaws.com/prod-ucs-content-store-eu-west/content/pii:S1381116903007684/gr7/DOWNSAMPLED/image/jpeg/8780dcd452443453e3611c25fb875584/gr7.jpg gr7 gr7.jpg jpg 25414 236 275 IMAGE-DOWNSAMPLED 1-s2.0-S1381116903007684-gr8.sml https://s3.amazonaws.com/prod-ucs-content-store-us-east/content/pii:S1381116903007684/gr8/THUMBNAIL/image/gif/acc50f364b1a6ab0acad091ca21dbebf/gr8.sml https://s3-eu-west-1.amazonaws.com/prod-ucs-content-store-eu-west/content/pii:S1381116903007684/gr8/THUMBNAIL/image/gif/acc50f364b1a6ab0acad091ca21dbebf/gr8.sml gr8 gr8.sml sml 1442 73 125 IMAGE-THUMBNAIL 1-s2.0-S1381116903007684-gr8.gif https://s3.amazonaws.com/prod-ucs-content-store-us-east/content/pii:S1381116903007684/gr8/DOWNSAMPLED/image/gif/d118bed57b3aec0056cac9f91d554c63/gr8.gif https://s3-eu-west-1.amazonaws.com/prod-ucs-content-store-eu-west/content/pii:S1381116903007684/gr8/DOWNSAMPLED/image/gif/d118bed57b3aec0056cac9f91d554c63/gr8.gif gr8 gr8.gif gif 11321 316 542 IMAGE-DOWNSAMPLED MOLCAA 4419 S1381-1169(03)00768-4 10.1016/j.molcata.2003.10.046 Elsevier B.V. Fig. 1 Products distribution for 1Rh/TiO2 presulfided at 400°C for 3h. Fig. 2 Effect of the support on the DBT conversion for 1wt.% Rh containing catalysts activated by pre-sulfidation. Fig. 3 Effect of pre-activation treatment on DBT HDS activity of the 1Rh/Al2O3 catalyst. Fig. 4 Effect of pre-activation treatment on DBT HDS activity of the 1Rh/TiO2, the 1Rh/SiO2 and the 1Rh/ SiO2-Al2O3 catalysts. Fig. 5 Effect of the Rh content on the DBT conversion at 300°C. Fig. 6 Transmission electron micrograph of Rh/SiO2 catalysts (reduced at 400°C for 3h). Fig. 7 Change in radioactivity of unreacted [ 35 S ]DBT and released [ 35 S ]H2S with reaction time (4Rh/SiO2 presulfided catalyst). Fig. 8 DBT HDS reaction mechanism over sulfided Rh/Al2O3 catalysts. Table 1 Description of the synthesized catalysts and their subsequent pre-activation treatments Support (m2 g−1) Pretreatment (3h) Rh content (wt.%) A12O3 (256) H2S (400), H2 (400) 1 TiO2 (73) H2S (400), H2 (400) 0.5, 1, 2 SiO2 (347) H2S (400), H2 (400) 1, 4 SiO2-A12O3 (560) H2S (400), H2 (400) 1 Table 2 DBT HDS activity over 1wt.% Rh catalysts Catalysts Conversion (%) BP yield (%) CHB yield (%) H/M a A b B c A b B c A b B c A12O3 57 48 53 45 2.9 0.9 0.12 TiO2 50 18 30 10 16.5 5.0 0.07 SiO2 56 26 40 19 13.5 4.0 0.29 SiO2-A12O3 65 26 36 14 26.0 6.6 Not determined a H/M: hydrogen/metal (reduction under H2 at 400°C for 3h and then evacuation at 400°C for 1h). b Catalysts prereduced at 400°C for 3h. c Catalysts presulfided at 400°C for 3h. Table 3 Kinetic parameters on supported Rh and Ru catalysts Catalysts Conversion (%) S OA ( mgg cat −1 ) k RE × 10−2 (min−1) a SOA/Stotal b (%) 4Rh/SiO2 c 29.0 19.3 2.6 104 4Rh/SiO2 d 58.0 15.2 6.0 82 4Rh-Cs/Al2O3 e 53.8 12.2 3.6 65 4Ru-Cs/Al2O3 e 125.8 7.3 3.7 29 a [ 35 S ]H2S release reaction rate constant. b Stotal is defined as the amount of total sulfur supposing that Rh and Ru are respectively fully sulfided in the Rh2S3 and the RuS2 forms. c Pre-sulfidation at 400°C. d Pre-reduction at 400°C. e Pre-sulfidation at 300°C. Table 4 Evaluation of sulfidation state on various catalysts using 35 S pulse tracer method Catalyst Sulfidation of metal sulfide S 0 , S OA ∗/S total Mo/Al2O3 MoS2 <75% in MoS2 Co-Mo/Al2O3 CoS MoS2 <60% in MoS2 Ni-Mo/Al2O3 NiS MoS2 <40% in MoS2 Pt-Pd/Al2O3 PtS0.25 PdS0.25 100% Ru Cs/Al2O3 a RuS2 30% Rh Cs/Al2O3 b Rh2S3 66% Rh/SiO2 c Rh2S3 82% Rh/SiO2 d Rh2S3 104% a After pre-sulfiding at 300°C (Ru 4wt.%). b After pre-sulfiding at 300°C (Rh 4wt%). c After pre-reduction at 400°C (Rh 4wt.%). d After pre-sulfiding at 400°C (Rh 4wt.%). Novel hydrodesulfurization catalysts derived from a supported rhodium carbonyl complex -Effect of the support on the catalytic activity and the sulfur behavior Jeayoung Lee Atsushi Ishihara ∗ Franck Dumeignil Eika W. Qian Toshiaki Kabe Department of Chemical Engineering, Tokyo University of Agriculture & Technology, Nakacho, Koganei, Tokyo 184-8588, Japan * Corresponding author. Tel.: +81-42-388-7228; fax: +81-42-388-7228. Catalysts derived from rhodium carbonyl supported on alumina, silica, titania and silica-alumina were synthesized. Whilst the prereduced 4Rh/SiO2 catalyst exhibited a number of labile sulfur (SOA) slightly lower than the presulfided one, the labile sulfur atoms created on the former exhibited a significantly greater mobility (k RE), which explains the observed higher HDS activity of the prereduced catalysts. The dibenzothiophene hydrodesulfurization (HDS) reactions were carried out over alumina, titania, silica and silica-alumina supported rhodium complex catalysts. First, a series of catalysts containing 1wt.% Rh was prepared and tested. Whilst in the case of the Rh/Al2O3 catalyst we did not observe any significant variation of the activity with the pretreatment, in the case of the titania, the silica and the silica-alumina supported catalysts, the pre-reduction treatment resulted in an activity twice as high as that obtained after the pre-sulfiding treatment. The use of the various supports slightly affected the overall HDS activity as well as the products selectivities. Whilst the Rh/Al2O3 catalyst exhibited the highest biphenyl (BP) selectivity, the Rh/SiO2-Al2O3 catalyst exhibited the highest dibenzothiophene conversion. The Rh supported on TiO2, SiO2 and SiO2-Al2O3 catalysts gave high cyclohexylbenzene (CHB) yields, indicating high hydrogenation abilities. Further, the effect of the Rh loading was studied on the titania and the silica supports. Unlike the other supports for which the activity stabilized for Rh loadings higher than 0.5–1.0wt.%, the DBT conversions of the SiO2-supported Rh catalysts increased up to 4wt.% Rh, exhibiting the highest HDS activity. To precisely elucidate the effect of the pre-activation method on the sulfidation state and on the HDS activity, the 4wt.% Rh/SiO2 catalyst was placed under HDS working conditions and [ 35 S ]DBT HDS tracer experiments were performed. We found that, whilst the amount of labile sulfur (SOA) present on the surface of the prereduced catalyst was slightly lower than that observed for the presulfided catalyst, the labile sulfur atoms created on the prereduced catalyst exhibited a significantly greater mobility (k RE). This increase in sulfur mobility induced by the reduction pretreatment facilitated the active sites regeneration during the reaction, which led to an enhancement of the HDS catalytic activity. Keywords Noble metal catalyst Hydrodesulfurization 35 S radioisotope tracer method Rhodium Titania Alumina Silica Silica-alumina Dibenzothiophene 1 Introduction The air pollution caused by the diesel exhaust fumes has dangerously increased in big city areas. Thus, much attention is now focused on the development of more efficient depollution processes aiming at cleaning light gas oils such as the deep hydrodesulfurization (HDS) process. In order to achieve a sufficient HDS level, it is not only essential to develop new hydrodesulfurization catalysts but also to elucidate the HDS reaction mechanism [1,2]. Among the large number of new catalytic formulations reported in the literature, the non-supported ruthenium sulfides were found to exhibit particularly remarkable properties in the dibenzothiophene HDS reaction [3–7]. Further, some research groups conducted the HDS reaction over ruthenium sulfide supported on various carriers such as alumina [8–11], carbon [12–14], zeolites [15–19], MgF2 [20] and amorphous silica-alumina [21]. All these efforts improved the HDS ability of the Ru sulfide catalysts. Especially, the alkali promoted Ru catalysts exhibited HDS activities comparable to those of the conventional Co-Mo catalysts [22]. On the other hand, the rhodium in the metallic state is known to be one of the most active catalysts for the hydrogenation of carbon monoxide. The hydrogenation of CO over supported Rh catalysts has been studied for many years to produce chemical feedstocks from synthesis gas. Some studies dealt with the CO2 hydrogenation over supported Rh catalysts for the synthesis of methane [23–25] or for the synthesis of methanol and acetic acid [26,27]. Recently, the performance of rhodium sulfide catalysts in HDS reaction was investigated. It was found that rhodium sulfide exhibits a relatively high activity compared to the sulfides of the other transition metal elements [3]. Indeed, Harris and Chianelli [28] found that for very low metal loadings, carbon-supported rhodium and iridium sulfides exhibited activities even higher than the ruthenium one, while similar results were also reported by Vissers et al. [29]. Moreover, Sugioka et al. showed that rhodium and platinum-palladium supported on an ultra-stable Y (USY) zeolite, and platinum supported on HZSM-5 and a mesoporous silicate exhibited a higher activity than a commercial Co-Mo/Al2O3 catalyst [30]. We also reported that an alumina supported rhodium carbonyl complex exhibited very interesting HDS catalytic properties for low Rh loadings, as the activity calculated per metal atom was much higher than that of a conventional Co-Mo/Al2O3 catalyst [31]. Further, using a radiotracer [ 35 S ]DBT HDS method it was shown that a larger number of active sites (labile sulfur atoms) was formed on the Rh catalysts than on the Ru catalysts, thus explaining the higher HDS activity of the former. Nevertheless, an increase in the Rh loading did not lead to a catalyst with the expected performance, as the high specific activity was not maintained for high Rh loadings. These results suggested that it is possible to further optimize highly active metal carbonyl-based catalysts performance by complexation of the precursor and subsequent modification of the support. Therefore, in the present research we decided to investigate the effect of the carrier on the DBT HDS activity of supported rhodium carbonyl complexes. Thus, the present paper deals with the influence of the carrier (alumina, titania, silica and silica-alumina) on the DBT HDS catalytic properties of a rhodium carbonyl supported complex. In the first part, we studied the effect of the support, the metal amount and the catalyst activation method on the DBT HDS activity. In the second part, the sulfur behavior on a catalyst that exhibited interesting properties (the silica supported catalyst) was interpreted by a radiotracer [ 35 S ]DBT HDS method described elsewhere [32–35]. The amount of labile sulfur atoms and the H2S release rate constant were determined on the catalyst activated by pre-sulfiding and by pre-reduction. 2 Experimental 2.1 Materials Commercially available triethyl amine (NEt3), ethyl alcohol and decalin (purity: ∼98%) (Kishida Chemicals) were used without further purification. Hexarhodium hexadecacarbonyl (Rh6(CO)16) was supplied from Aldrich Chem. Co. Ltd. The γ-alumina supplied by Nippon Ketjen Co. Ltd., was crushed and screened to obtain 0.84–1.19mm grains. SiO2-Al2O3 (JRC-SAL2), SiO2 (JRC-SIO4) and TiO2 (JRC-TIO1) were supplied by the Catalysis Society of Japan. Table 1 shows the BET surface areas of the supports together with the amount of impregnated rhodium. In order to remove the moisture and the adsorbed impurities, the supports were dried under vacuum at 350°C during 4h and stored under Ar atmosphere prior to use. Hydrogen (99.99%) and hydrogen sulfide in hydrogen (H2S: 5.0%) were obtained from Tohei Chemicals. All the scintillation solvents used for the radioactivity measurements were supplied by Packard Japan. 2.2 Preparation of the Rh6(CO)16-NEt3 based catalysts In order to prepare a catalyst containing 1wt.% Rh, 0.0086g of Rh6(CO)16 and NEt3 (Rh:N=2:1) were introduced into a 50ml reactor before being dissolved in ethyl alcohol (10ml). After stirring the mixture at 70°C for 1h, the system was cooled down to room temperature. Then, 0.495g of Al2O3 was added into the solution and stirred for 2h. Finally, the solvent was removed in vacuum. Various catalysts were prepared by modulation of the rhodium content as well as the use of various carriers, always keeping the Rh/N ratio equal to 2 (Table 1 gives an overview of the prepared catalysts). All the catalysts were called ‘XRh/Y’, X being the Rhwt.% and Y being the carrier (Al2O3, TiO2, SiO2 or SiO2-Al2O3). 2.3 Characterization of the prepared catalysts Powder X-ray diffraction (XRD) spectra were recorded on a Rigaku RINT 2000 apparatus using a Cu Kα radiation (λ=0.15405nm). The Debye–Scherrer equation was used to estimate the mean size of the Rh particles. Transmission electron microscopy (TEM) photographs were taken on a CM 300/STEM microscope working at an accelerating voltage of 250kV. The samples were crushed before being slurried with methanol and deposited on a copper grid, which was subsequently set in the microscope. The micrographs were recorded with a magnification of 175,000–255,000. EDX analysis was also carried out to confirm that the particles observed by TEM on the Rh/SiO2 catalyst consisted of Rh. Hydrogen adsorption was performed in a conventional glass vacuum system (static method). The vacuum was attained using an oil diffusion pump in line with a mechanical pump (primary vacuum). The pressure was measured by a manometer. Samples (2g) were prereduced in situ in a flow of hydrogen at 400°C for 3h in a manner similar to that used for the activity tests. The hydrogen uptakes were determined at 25±1°C on the reduced and evacuated samples. 2.4 Apparatus and experimental procedure 2.4.1 HDS activity The HDS experiments were carried out in a fixed-bed flow reactor (8 mm×i.d. 300mm). The catalysts were activated by pre-sulfiding with a mixture of 5vol.% H2S/H2 or by pre-reduction in 99.9% H2 for 3h at 300 or 400°C. After the catalyst pretreatment, the reactor was cooled down to room temperature and then pressurized with hydrogen. A decalin solution of DBT was then fed by using a high-pressure liquid pump (Kyowa Seimitsu KHD-16). The DBT HDS reactions were carried out under the following conditions: H2 flow rate: 12.5l·h−1; WHSV: 28h−1; reaction pressure: 5MPa; concentration of DBT in decalin: 1.0wt.%; catalyst weight: 0.5g. The liquid products were collected every 15min and analyzed by a gas chromatograph equipped with an FID detector (Shimadzu-17A, Shimadzu Co. Ltd.) and a capillary column (DB-1). 2.4.2 The [ 35 S]DBT HDS radioisotope tracer method We selected the reaction conditions as follows: catalyst weight: 1g; H2 flow rate: 25l·h−1; WHSV: 28h−1; pressure: 5MPa; concentration of DBT in decalin: 1.0wt.%; reaction temperature: 300°C. Before each experiment the catalyst was presulfided with a 5vol.% H2S in H2 or prereduced in 99.9% H2 at 400°C for 3h. The liquid product was collected from a gas/liquid separator. The produced H2S was absorbed by bubbling through a commercial basic scintillation solution (Carbosorb, Packard Co. Ltd.). Both liquid product and absorbed H2S solution samples were collected every 15min. The radioactivities of the unreacted [ 35 S ]DBT in the liquid phase and the produced [ 35 S ]H2S quantity were measured by a liquid scintillation counter (Beckman, LS-6500) [32]. A typical [ 35 S ]DBT HDS operation procedure is as given further: 1. A decalin solution of 1wt.% [ 32 S ]DBT is pumped into the reactor until the DBT conversion becomes constant (about 3h). 2. Then, the reactant solution is replaced by a 1wt.% [ 35 S ]DBT (9000dpm/g) solution. The [ 35 S ]DBT HDS reaction is performed until the amount of released [ 35 S ]H2S stabilizes at a constant value (about 2–4h). 3. The [ 35 S ]DBT solution is then replaced by decalin. The decalin flow is maintained during about 3h. 4. Finally, the [ 32 S ]DBT solution is re-introduced and the reaction is pursued for 4–5h. 3 Results and discussion 3.1 Effect of the support on the DBT HDS activity 3.1.1 Activity of the presulfided 1 wt.% Rh catalysts Fig. 1 shows the activity and the selectivity results of the DBT HDS reaction performed over the 1Rh/TiO2 catalyst preactivated by sulfiding (in a 5.0% H2S/H2 mixture at 400°C during 3h). The main products were cyclohexylbenzene (CHB) and biphenyl (BP), while some minor co-products such as tetrahydrodibenzothiophene (4-HDBT) and hexahydrodibenzothiophene (6-HDBT) were also formed. When the temperature increased, the DBT concentration decrease was accompanied with an increase in the yield of all the products. Similar experiments were performed over all the catalysts. Fig. 2 summarizes the conversions obtained for the presulfided 1wt.% Rh catalysts supported on alumina, silica, titania and silica-alumina. The Rh/Al2O3 catalyst exhibited the highest HDS activity, which was twice as high as that of the silica, the silica-alumina and the titania supported catalysts. For these experiments, the activity was measured from the lowest temperature (260°C) to the highest (320°C) by steps of 20°C. In the last stage of the reaction, the activity was measured again after decreasing the temperature to 260°C in order to check about a possible catalyst deactivation. Whilst in the case of the Al2O3 carrier the activity returned to its initial value, in the case of the other carriers surprisingly the revaluated activity was about twice as high as the initial one (see the Table inserted in Fig. 2). These results suggested that the active phase supported on silica, silica-alumina and titania was progressively modified under the HDS experimental conditions (high H2 pressure), resulting in better catalytic performance. 3.1.2 Influence of the catalyst pre-activation method on the HDS catalytic performances According to the results presented in Section 3.1.1, we decided to investigate the effect of the catalyst pretreatment on the DBT HDS activity. The activity of the prereduced catalysts was measured and then compared with the activity obtained after pre-sulfiding. Fig. 3 shows the influence of the pretreatment conditions on the activity of the 1wt.% Rh/Al2O3 catalyst. For this catalyst, the pretreatment modifications did not induce any significant variation in the HDS activity, as expected from the results presented in Fig. 2. On the other hand, as shown in Fig. 4 , the prereduced 1wt.% Rh catalysts supported on titania, silica and silica-alumina catalysts gave an activity about twice as high as that obtained after a conventional sulfiding pretreatment. In contrast, it has been previously shown that Ru/Al2O3 and Rh/Al2O3 catalysts exhibit a higher HDS activity after a pre-sulfiding pretreatment rather than after a pre-reduction treatment. Generally, the species active in HDS are formed upon sulfidation [3]. However, obviously in the case of the 1wt.% Rh catalysts supported on titania, silica and silica-alumina, the pre-reduction treatment gave better results than the pre-sulfidation treatment. As shown in Fig. 3, the Rh/Al2O3 catalyst prereduced at 400°C gave better catalytic results than the one prereduced at 300°C, whilst usually a high pretreatment temperature is not preferable because the possibility of sintering of the noble metals is increased. Table 2 presents detailed results for all the catalysts loaded with 1wt.% Rh and working at 300°C. In all the cases, the major products were found to be BP and CHB. The catalytic activities of the catalysts activated by pre-sulfiding decreased in the order Al 2 O 3>SiO 2-Al 2 O 3 ≧ SiO 2>TiO 2 . However, the activity of the prereduced catalysts decreased in the order SiO2- Al 2 O 3>Al 2 O 3 ≧ SiO 2>TiO 2 . In this case, the HDS activity was only moderately affected by the carriers. Nevertheless, among them the rhodium supported silica-alumina catalyst gave the highest DBT conversion and the highest CHB yield. That means that the rhodium species supported on SiO2-Al2O3 have a higher ability to hydrogenate the aromatic rings of DBT. Indeed, tetrahydrodibenzothiophene (4-HDBT) and hexahydrodibenzothiophene (6-HDBT), which are hydrogenated products, are easier to desulfurize than DBT (the rate of HDS of 4-HDBT or 6-HDBT has been reported to be four times as high as that of DBT [36]). The same observation have also already been reported for a Ru3(CO)12/SiO2-Al2O3 catalyst [37]. Then, to examine the relation between the particle size and the HDS activity, we measured the hydrogen adsorption of the 1wt.% rhodium supported alumina, titania and silica catalysts. As shown in Table 2, the H/M ratio was clearly influenced by the support. The H/M ratio obtained for 1Rh/TiO2 was low (0.07) and the mean particle size was found to be about 16nm. Particles of such size would be easily detectable by XRD. However, the XRD spectra did not exhibit any characteristic feature of well-ordered Rh crystallites. This kind of phenomenon on Rh/TiO2 catalysts can be explained by the SMSI (strong metal-support interactions) [38]. Neither 1Rh/Al2O3 nor 1Rh/SiO2 showed high dispersion. However, their HDS activities were higher than those of 8wt.% Ru3(CO)12 catalysts [37] supported on alumina (44%), titania (33%) and silica alumina (62%) with much higher metal loadings. From this result and the results shown in Table 2, we can deduce that the particle size difference cannot explain the differences of catalytic performance. Further, in the case of the supported ruthenium carbonyl systems, the BP yield decreased in the order Al2O3 (38%)>SiO2-Al2O3 (36%)>TiO2 (22%)>SiO2 (17%) [37]. In contrast, the BP yields for Rh-based catalysts decreased in the order Al2O3 (53%)>SiO2 (40%)>SiO2-Al2O3 (36%)>TiO2 (30%) when the catalysts were prereduced. 3.1.3 Effect of the Rh loading on the DBT HDS activity The effect of the Rh loading on the HDS activity was studied to improve the activity. The results are presented in Fig. 5 . For comparison, a few results previously reported for Rh/Al2O3 catalysts [31] are also shown in Fig. 5. The DBT conversion over the Rh/Al2O3 catalysts increased linearly up to 0.5–1wt.% and leveled off. The DBT conversion of the Rh/TiO2 catalysts increased up to about 1wt.% Rh, similarly to the Rh/Al2O3 catalysts. The DBT conversion of the Rh/SiO2 catalyst increased up to 4wt.% Rh, and 4wt.% Rh/SiO2 exhibited the highest HDS conversion. These results demonstrate the fact that not only the intrinsic activity of a metal but also the capacity of a support for metal loading is very important to obtain a high global conversion. The micrographs obtained for the Rh/SiO2 catalysts are shown in Fig. 6 . The Rh particles appeared as black dots (because of their higher electron density) of a few nanometers, while SiO2 was observed as a greyish background (confirmed by EDX analysis). For 1Rh/SiO2, a uniform distribution of the small Rh particles (< 3nm) was observed. The 4Rh/SiO2 catalyst exhibited larger Rh particles (< 8nm). It indicates that the Rh particle size was affected by the Rh concentration, in agreement with the findings previously reported for Rh/Al2O3 catalysts [31]. In the latter case, the size of the particles increased, and thus the DBT conversion leveled off for Rh>0.5wt.%. Although the DBT conversion of the Rh/SiO2 catalysts increased up to 4wt.% Rh, the intrinsic activity for one Rh atom might decrease. 3.2 Study of the sulfur behavior on the 4Rh/SiO2 catalyst during the HDS working conditions using a 35 S tracer method In the preceding discussion, we showed that compared to the classical sulfiding pretreatment, the reduction pretreatment resulted in the significant increase in the HDS activity of rhodium supported titania, silica and silica-alumina catalysts. The higher HDS performance on these prereduced Rh catalysts aroused interest in the sulfidation state of Rh during HDS working conditions. Thus, in order to elucidate precisely the observed activity difference between the reduction and the sulfiding pretreatments and to determine the Rh sulfidation state on the catalysts working under HDS conditions, a 35 S tracer method was used. [ 35 S ]DBT HDS was performed using the best catalyst (4Rh/SiO2) after pre-sulfiding or pre-reduction at 400°C for 3h. Fig. 7 shows the results obtained for the presulfided 4Rh/SiO2 catalyst. Initially, a decalin solution of 1wt.% [ 32 S ]DBT was pumped into the reactor until the DBT conversion became constant. This solution was then replaced by a 1wt.% [ 35 S ]DBT solution, which was continuously fed into the reactor until the amount of produced [ 35 S ]H2S became constant. Just after the [ 35 S ]DBT introduction, the radioactivity of the unreacted [ 35 S ]DBT in the liquid product increased drastically and a steady state was immediately reached, whilst it took about 75min to achieve a steady state in the radioactivity of the produced [ 35 S ]H2S. This result indicates that the sulfur taken from the DBT molecules is not directly released as hydrogen sulfide but is temporarily accommodated on the catalyst, which is consistent with the results obtained so far over Al2O3-supported molybdenum catalysts [32,33]. Next, after the [ 35 S ]H2S radioactivity reached the steady state, only decalin was fed into the reactor. The radioactivity due to [ 35 S ]DBT decreased immediately, whilst the [ 35 S ]H2S radioactivity decrease was somewhat slow. This progressive decrease suggests that at least a part of the sulfur previously accommodated on the catalyst surface can react with hydrogen during the decalin introduction stage since Rh sulfide is unstable under high H2 pressures. Therefore, some sulfur atoms are liberated as hydrogen sulfide through the reduction of the active phase. Then, after the [ 35 S ]H2S radioactivity was no more detected, the [ 32 S ]DBT solution was fed again into the reactor. The 35 S atoms remaining on the catalyst were exchanged with 32 S atoms taken from the [ 32 S ]DBT molecules. This resulted in further [ 35 S ]H2S liberation. After the last [ 32 S ]DBT solution introduction, the HDS activity exhibited a value twice as high as the initial one. This phenomenon, which was not observed on alumina-supported molybdenum catalysts [34], was consistent with the activity change presented in Fig. 2. This result indicates that whilst molybdenum sulfide is stable under a high hydrogen pressure, both Rh sulfide based catalysts and Ru sulfide based catalysts [36] are not. It is remarkable that in the case of the ruthenium sulfide catalysts, unlike in the case of the rhodium sulfide catalysts, the observed HDS activity decreases after the [ 32 S ]DBT solution reintroduction. That means that for the ruthenium sulfide based catalysts, the sites responsible for the DBT HDS are denatured by reduction under the experimental conditions, whilst in the case of the Rh based sulfide catalysts the activity can be enhanced over adequate carriers under specific experimental conditions. From the results of the [ 35 S ]DBT HDS experiments, we determined S0A, the total amount of labile sulfur, S0B, the amount of labile sulfur that can be removed by reduction under the experimental conditions, and S0C, the amount of labile sulfur, which is hardly influenced by reduction phenomena (see Fig. 7). The results are presented in Table 3 . We found that S0A was close to the sum of S0B and S0C. In Table 3 we present also k RE, the rate constant of [ 35 S ]H2S release which was determined by a method described elsewhere [32,33]. For comparison, the results previously obtained for Ru-Cs/Al2O3 [39] and Rh-Cs/Al2O3 catalysts [31] are also listed in Table 3. These parameters are very important to the characterization of the catalytic properties because S0A is likely to represent the number of active sites present on the catalysts whilst k RE is representative of the reactivity of one active site. The HDS activity of the prereduced 4Rh/SiO2 catalyst during the [ 35 S ]DBT HDS experiment was twice as high as that of the presulfided 4Rh/SiO2 catalyst, confirming the results of the activity experiments. If we compare the effect of the pre-sulfiding and the pre-reduction shown in Table 3 for the 4Rh/SiO2 catalyst, we can see that the former pretreatment led to a higher S0A of 19.3mg/g-cat (i.e. a Rh sulfiding percentage of 100% if we consider that sulfidation is complete when Rh2S3 is formed), whilst the latter gives a S0A of 15.2mg/g-cat (i.e. a Rh sulfiding percentage of 82%) on the working catalyst. In other words the presulfided catalyst exhibited more labile sulfur atoms than the prereduced one. Mangnus et al. [41] also investigated the sulfidation state of Rh/Al2O3 catalysts using TPR experiments, was found that Rh/Al2O3 catalysts could be easily sulfided into Rh2S3. Then, Rh2S3 could be further reduced under a H2S/H2 atmosphere poor in H2S via intermediate steps, i.e. the reduction of Rh2S3 into RhS0.89 followed by reduction into Rh0. On the other hand, our results of the tracer experiment indicated that the Rh2S3 species (presulfided Rh catalyst) are rather likely to be greatly preserved for long reaction times (at least 5h) even in the presence of an atmosphere with a low H2S/H2 ratio (calculated at about 4.3×10−4) at a relatively low temperature. However, the activity tests showed that the Rh2S3 reduction proceeded at high reaction temperature (320°C) and also during the decalin introduction step of the tracer experiments (i.e. when the H2S/H2 ratio is equal to 0). Further, this indicates also that the metallic Rh present on the prereduced catalysts was easily sulfided by the sulfur atoms of DBT or by the hydrogen sulfide produced by the DBT HDS. In the case of the sulfiding pretreatment, the active phase was progressively reduced to give the same state as the one obtained at the steady state for a catalyst pretreated by reduction. In other words, irrespective of the pretreatment the sulfidation of the active phase might produce a steady state determined by the H2S/H2 composition in the reactor. When we examine the k RE obtained for both pretreatments, we can see that the one measured after pre-reduction is more than twice as high as that induced by pre-sulfiding, with a value of 6.0×10−2 min−1 for the former and 2.6×10−2 min−1 for the latter (Table 3). This means that the higher activity obtained after pre-reduction is not due to an increase in the labile sulfur amount (potential active sites number increase), because this latter quantity rather exhibits the tendency to decrease under such a treatment. In fact, this result suggests that the increase in activity is rather due to a greater reaction turnover number over the formed catalytic sites, i.e. a higher H2S release rate constant. If now we compare the results of the present study with those conducted with other noble metal catalysts supported on alumina carrier and further improved by the addition of Cs (Rh-Cs and Ru-Cs catalysts), we can make the following points: • The Rh supported on silica catalyst is the most efficient among the catalysts presented in Table 3. Its activity is even a slightly higher than that of the Rh-Cs catalyst supported on alumina. • The Rh based catalysts superiority over the Ru based ones can be explained by the amount of labile sulfur atoms. Indeed, the amount of labile sulfur on the Rh based catalysts was at least 65% of the accommodated total sulfur (Stotal) while that of the Ru-Cs catalyst was only 29% of the accommodated total sulfur. Table 4 shows the sulfidation states observed over various catalysts. The results obtained during DBT HDS reactions in previous studies [40] were compared with the ones obtained for the Rh/SiO2 catalyst in the present study. The Mo present in a Ni-Mo and a Co-Mo catalyst was fully sulfided into MoS2 and 40–75% of the sulfur was labile. Similarly to the Ni-Mo system, the Ru of a Ru-Cs catalyst was fully sulfided (into RuS2) but the labile sulfur represented only 30% of the total sulfur. Though the sulfided state of the Pt-Pd catalyst was only PtS0.25-PdS0.25, the percentage of mobile sulfur reached 100%. In brief, in these catalytic systems, when the active metal is stoichiometrically fully sulfided (Co-Mo, Ni-Mo and Ru-Cs systems), the percentage of labile sulfur atoms is not so high, and when 100% of labile sulfur is reached (Pt-Pd system) the sulfidation percentage is low. In contrast, the Rh-based catalyst could be fully sulfided into Rh2S3 whilst exhibiting a satisfactory labile sulfur percentage (active sites) of about 66–100%. Further, whilst S0A and k RE observed on the presulfided Rh-Cs/Al2O3 catalyst were lower than those observed on the prereduced Rh/SiO2 catalyst (Table 3), the former exhibited a catalytic activity similar to that of the latter. This suggests that there are some catalytic sites on the presulfided Rh-Cs/Al2O3 catalyst that are not involved in the conventional sulfur accommodation process responsible for the activity. These particular sites could be of the same type as the ones present on a Pt-Pd catalytic system. Fig. 8 shows the DBT HDS mechanism proposed over the Rh sulfide catalyst. First, the sulfur of the presulfided Rh catalyst is reduced by the hydrogen of the gas phase to form coordinative unsaturated site (CUS) (Fig. 8A). The sulfur atoms taken from the DBT molecules in the reactant solution can then replenish the prereduced Rh catalyst. In this case the sulfur atom of a DBT molecule is adsorbed on the previously formed CUS (Fig. 8B) before desorption of the reaction product (Fig. 8C). A new CUS is then formed by H2S liberation through the mechanism proposed in Fig. 8D and E. The position of the newly formed CUS (in Fig. 8E) differs from that of the initial CUS (Fig. 8A). Such a mechanism assumes that all the sulfur present on the catalyst can be exchanged during the reaction. Therefore, for the presulfided Rh/SiO2 catalyst exhibiting a high S0 value, the prevailing species in the steady state is likely to be B or C with the additional presence of some CUS progressively created by reduction with the time on stream. On the other hand, since the prereduced Rh/SiO2 catalyst exhibits a lower S0 value than the one observed on the presulfided catalyst, the steady state is likely to be A or E where CUS is present. 4 Conclusion The DBT HDS properties of titania, silica, alumina and silica-alumina supported rhodium complex catalysts were studied. A first series of experiments in which the catalysts were loaded with 1wt.% Rh showed the superiority of the alumina supports over the other ones when the catalysts are pretreated by a conventional sulfiding procedure. Nevertheless, in this series of experiments, an unusual phenomenon was observed for the titania, silica and silica-alumina supports. Indeed, whilst in the case of the alumina support the used catalyst activity was almost the same as that of the fresh one, an increase in activity was observed for the catalysts prepared with all the other supports when the time on stream increased. For Ru supported catalysts, the inverse tendency was observed; i.e. the activity was decreased by a reduction treatment without DBT. Thus the experimental conditions greatly affected the activity because of the Rh-sulfide species reducibility under high H2 pressures. Irrespective of the pretreatment conditions, the HDS activity of the alumina supported catalyst did not significantly vary; however, the reduction pretreatment induced a drastic increase in the activity of the catalysts prepared with the other supports. The Rh/Al2O3 catalyst gave the highest BP selectivity and the Rh supported TiO2, SiO2 and SiO2-Al2O3 catalysts gave high CHB yields; the Rh/SiO2-Al2O3 catalyst showed the highest DBT conversion and the highest CHB yield. The rhodium catalyst supported on SiO2-Al2O3 showed a higher ability to hydrogenate the aromatic rings of DBT inducing good DBT HDS performance (4-HDBT and 6-HDBT, which are hydrogenation products, are easier to desulfurize into CHB than DBT into BP). The DBT conversions of the Rh/SiO2 catalysts increased up to a 4wt.% Rh loading and exhibited the highest HDS activity. The [ 35 S ]DBT HDS tracer experiments showed that, whilst the amount of labile sulfur atoms was lower on the working prereduced catalyst than on the presulfided one, the former exhibited a higher H2S release ability. As a result, a higher activity of the prereduced catalyst was attained. Acknowledgements The authors are grateful to Dr. K. Hirabayashi, Dr. T. Morita and Dr. H. Hagimoto for their kind help with the present research. The authors would also like to thank the Japan Society for the Promotion of Science (JSPS) for its financial contribution. References [1] T. Kabe, A. Ishihara, W. Qian, Hydrodesulfurization and Hydrodenitrogenation, Kodansha Scientific, Wiley-VCH, New York, Berlin, 1999. [2] H. Topsøe, B.S. Clausen, E.E. Massoth, Hydrotreating Catalysis, Springer, Berlin, 1996. [3] T.A. Pecoraro R.R. Chianelli J. Catal. 67 1981 430 [4] M. Lacroix N. Boutarfa C. Guillard M. Vrinat M. Breysse J. Catal. 120 1989 473 [5] M. Vrinat M. Lacroix M. Breysse L. Mosoni M. Roubin Catal. Lett. 3 1989 405 [6] A. Raje S.-J. Liaw B.H. Davis Appl. Catal. A 150 1997 297 [7] A. Raje S.-J. Liaw B.H. Davis Appl. Catal. A 150 1997 319 [8] J. Shabtai N.K. Nag F.E. Massoth J. Catal. 104 1987 143 [9] J.A. De Los Reyes M. Vrinat C. Geantet M. Breysse Catal. Today 10 1991 645 [10] K. Lu Y.J. Kuo B.J. Tatarchuk J. Catal. 116 1989 373 [11] A. Ishihara M. Nomura T. Kabe J. Catal. 150 1994 212 [12] M.J. Ledoux O. Michaux G. Agostini P. Panissod J. Catal. 102 1986 275 [13] J.P.R. Vissers C.K. Groot E.M. Van Oers V.H.J. de Beer R. Prins Bull. Soc. Chim. Belg. 93 1984 813 [14] S. Eijsbouts V.H.J. de Beer R. Prins J. Catal. 109 1991 217 [15] T.G. Harvey T.W. Matheson J. Catal. 101 1986 253 [16] J.L. Lamberton, M. Cattenot, V. Kougionas, M. Mhaouer, J.L. Portefaix, M. Breysse, G. Pjrot, in: G.F. Froment, B. Delmon, P. Grange (Eds.), Hydrotreatment and Hydrocracking Oil Fractions, Elsevier, Amsterdam, 1997, p. 529. [17] J.L. Zotin M. Cattenot J.L. Portefaix M. Breysse Bull. Soc. Chim. Belg. 104 1995 213 [18] M. Breysse M. Cattenot V. Kougionas J.C. Lavalley F. Mauge J.L. Portefaix J.L. Zotin J. Catal. 168 1997 143 [19] S.-J. Liaw R. Lin A. Raje B.H. Davis Am. Chem. Soc., Dir. Pet. Chem. 39 1994 636 [20] M. Wojciechowska, M. Pietrowski, S. Lomnicki, Chem. Commun. (1999) 463. [21] R. Navarro B. Pawelec J.L.G. Fierro P.T. Vasudevan Appl. Catal. A 148 1996 23 [22] A. Ishihara M. Nomura N. Takahama K. Hamaguchi T. Kabe Sekiyu Gakkaishi 39 3 1996 211 221 [23] B.A. Sexton G.A. Somorjai J. Catal. 46 1997 167 [24] F. Solymosi A. Erdohelyi T. Bansagi J. Catal. 68 1981 371 [25] Z. Zhang A. Kladi X.E. Verykios J. Catal. 156 1995 37 [26] T. Inoue T. Iizuka K. Tanabe Appl. Catal. 46 1989 1 [27] N. Ikehara, K. Hara, A. Satsuma, T. Hattori, Y. Murakami, Chem. Lett. 263 (1994). [28] S. Harris R.R. Chianelli J. Catal. 86 1984 400 [29] J.P.R. Vissers C.K. Groot E.M. Van Oers V.H.J. de Beer R. Prins Bull. Soc. Chim. Belg. 93 1984 813 [30] M. Sugioka F. Sado Y. Matsumoto N. Maesaki Catal. Today 29 1996 255 [31] J. Lee, A. Ishihara, F. Dumeignil, K. Miyazaki, Y. Oomori, E.W. Qian, T. Kabe, J. Mol. Catal. A Chem. 209 (2004) 155. [32] T. Kabe W. Qian S. Ogawa A. Ishihara J. Catal. 143 1993 239 [33] W. Qian A. Ishihara S. Ogawa T. Kabe J. Phys. Chem. 98 1994 907 [34] W. Qian Q. Zhang Y. Okoshi A. Ishihara T. Kabe J. Chem. Soc. Faraday Trans. 93 9 1997 1821 [35] W. Qian A. Ishihara G. Wang T. Tsuzuki M. Godo T. Kabe J. Catal. 170 1997 286 [36] M. Houalla N.K. Nag A.V. Sapre D.H. Broderick B.C. Gates AIChE J. 24 1978 1015 [37] A. Ishihara M. Nomura K. Shirouchi T. Kabe Sekiyu Gakkaishi 39 6 1996 403 409 [38] S.J. Tauster S.C. Fung R.L. Garten J. Am. Chem. Soc. 100 1 1978 170 [39] A. Ishihara H. Godo R. Kanamori W. Qian T. Kabe Appl. Catal. A 182 1999 345 [40] A. Ishihara J. Lee F. Dumeignil R. Higashi A. Wang E.W. Qian T. Kabe J. Catal. 217 2003 59 [41] P.J. Mangnus A. Riezebos A.D. van Langeveld J.A. Moulijn J. Catal. 151 1995 178",
      "scopus-id": "1642411029",
      "coredata": {
        "eid": "1-s2.0-S1381116903007684",
        "dc:description": "The dibenzothiophene hydrodesulfurization (HDS) reactions were carried out over alumina, titania, silica and silica-alumina supported rhodium complex catalysts. First, a series of catalysts containing 1wt.% Rh was prepared and tested. Whilst in the case of the Rh/Al2O3 catalyst we did not observe any significant variation of the activity with the pretreatment, in the case of the titania, the silica and the silica-alumina supported catalysts, the pre-reduction treatment resulted in an activity twice as high as that obtained after the pre-sulfiding treatment. The use of the various supports slightly affected the overall HDS activity as well as the products selectivities. Whilst the Rh/Al2O3 catalyst exhibited the highest biphenyl (BP) selectivity, the Rh/SiO2-Al2O3 catalyst exhibited the highest dibenzothiophene conversion. The Rh supported on TiO2, SiO2 and SiO2-Al2O3 catalysts gave high cyclohexylbenzene (CHB) yields, indicating high hydrogenation abilities. Further, the effect of the Rh loading was studied on the titania and the silica supports. Unlike the other supports for which the activity stabilized for Rh loadings higher than 0.5–1.0wt.%, the DBT conversions of the SiO2-supported Rh catalysts increased up to 4wt.% Rh, exhibiting the highest HDS activity. To precisely elucidate the effect of the pre-activation method on the sulfidation state and on the HDS activity, the 4wt.% Rh/SiO2 catalyst was placed under HDS working conditions and [ 35 S ]DBT HDS tracer experiments were performed. We found that, whilst the amount of labile sulfur (SOA) present on the surface of the prereduced catalyst was slightly lower than that observed for the presulfided catalyst, the labile sulfur atoms created on the prereduced catalyst exhibited a significantly greater mobility (k RE). This increase in sulfur mobility induced by the reduction pretreatment facilitated the active sites regeneration during the reaction, which led to an enhancement of the HDS catalytic activity.",
        "openArchiveArticle": "false",
        "prism:coverDate": "2004-05-04",
        "openaccessUserLicense": null,
        "prism:aggregationType": "Journal",
        "prism:url": "https://api.elsevier.com/content/article/pii/S1381116903007684",
        "dc:creator": [
          {
            "@_fa": "true",
            "$": "Lee, Jeayoung"
          },
          {
            "@_fa": "true",
            "$": "Ishihara, Atsushi"
          },
          {
            "@_fa": "true",
            "$": "Dumeignil, Franck"
          },
          {
            "@_fa": "true",
            "$": "Qian, Eika W."
          },
          {
            "@_fa": "true",
            "$": "Kabe, Toshiaki"
          }
        ],
        "link": [
          {
            "@_fa": "true",
            "@rel": "self",
            "@href": "https://api.elsevier.com/content/article/pii/S1381116903007684"
          },
          {
            "@_fa": "true",
            "@rel": "scidir",
            "@href": "https://www.sciencedirect.com/science/article/pii/S1381116903007684"
          }
        ],
        "dc:format": "application/json",
        "openaccessType": null,
        "pii": "S1381-1169(03)00768-4",
        "prism:volume": "213",
        "prism:publisher": "Elsevier B.V.",
        "dc:title": "Novel hydrodesulfurization catalysts derived from a supported rhodium carbonyl complex -Effect of the support on the catalytic activity and the sulfur behavior",
        "prism:copyright": "Copyright © 2003 Elsevier B.V. All rights reserved.",
        "openaccess": "0",
        "prism:issn": "13811169",
        "prism:issueIdentifier": "2",
        "dcterms:subject": [
          {
            "@_fa": "true",
            "$": "Noble metal catalyst"
          },
          {
            "@_fa": "true",
            "$": "Hydrodesulfurization"
          },
          {
            "@_fa": "true",
            "$": "35 S radioisotope tracer method"
          },
          {
            "@_fa": "true",
            "$": "Rhodium"
          },
          {
            "@_fa": "true",
            "$": "Titania"
          },
          {
            "@_fa": "true",
            "$": "Alumina"
          },
          {
            "@_fa": "true",
            "$": "Silica"
          },
          {
            "@_fa": "true",
            "$": "Silica-alumina"
          },
          {
            "@_fa": "true",
            "$": "Dibenzothiophene"
          }
        ],
        "openaccessArticle": "false",
        "prism:publicationName": "Journal of Molecular Catalysis A: Chemical",
        "prism:number": "2",
        "openaccessSponsorType": null,
        "prism:pageRange": "207-215",
        "prism:endingPage": "215",
        "pubType": "fla",
        "prism:coverDisplayDate": "4 May 2004",
        "prism:doi": "10.1016/j.molcata.2003.10.046",
        "prism:startingPage": "207",
        "dc:identifier": "doi:10.1016/j.molcata.2003.10.046",
        "openaccessSponsorName": null
      },
      "objects": {
        "object": [
          {
            "@category": "thumbnail",
            "@height": "14",
            "@width": "23",
            "@_fa": "true",
            "$": "https://api.elsevier.com/content/object/eid/1-s2.0-S1381116903007684-si9.gif?httpAccept=%2A%2F%2A",
            "@multimediatype": "GIF image file",
            "@type": "ALTIMG",
            "@size": "199",
            "@ref": "si9",
            "@mimetype": "image/gif"
          },
          {
            "@category": "thumbnail",
            "@height": "14",
            "@width": "23",
            "@_fa": "true",
            "$": "https://api.elsevier.com/content/object/eid/1-s2.0-S1381116903007684-si8.gif?httpAccept=%2A%2F%2A",
            "@multimediatype": "GIF image file",
            "@type": "ALTIMG",
            "@size": "199",
            "@ref": "si8",
            "@mimetype": "image/gif"
          },
          {
            "@category": "thumbnail",
            "@height": "14",
            "@width": "23",
            "@_fa": "true",
            "$": "https://api.elsevier.com/content/object/eid/1-s2.0-S1381116903007684-si7.gif?httpAccept=%2A%2F%2A",
            "@multimediatype": "GIF image file",
            "@type": "ALTIMG",
            "@size": "199",
            "@ref": "si7",
            "@mimetype": "image/gif"
          },
          {
            "@category": "thumbnail",
            "@height": "19",
            "@width": "94",
            "@_fa": "true",
            "$": "https://api.elsevier.com/content/object/eid/1-s2.0-S1381116903007684-si6.gif?httpAccept=%2A%2F%2A",
            "@multimediatype": "GIF image file",
            "@type": "ALTIMG",
            "@size": "513",
            "@ref": "si6",
            "@mimetype": "image/gif"
          },
          {
            "@category": "thumbnail",
            "@height": "14",
            "@width": "23",
            "@_fa": "true",
            "$": "https://api.elsevier.com/content/object/eid/1-s2.0-S1381116903007684-si5.gif?httpAccept=%2A%2F%2A",
            "@multimediatype": "GIF image file",
            "@type": "ALTIMG",
            "@size": "199",
            "@ref": "si5",
            "@mimetype": "image/gif"
          },
          {
            "@category": "thumbnail",
            "@height": "14",
            "@width": "23",
            "@_fa": "true",
            "$": "https://api.elsevier.com/content/object/eid/1-s2.0-S1381116903007684-si47.gif?httpAccept=%2A%2F%2A",
            "@multimediatype": "GIF image file",
            "@type": "ALTIMG",
            "@size": "199",
            "@ref": "si47",
            "@mimetype": "image/gif"
          },
          {
            "@category": "thumbnail",
            "@height": "14",
            "@width": "23",
            "@_fa": "true",
            "$": "https://api.elsevier.com/content/object/eid/1-s2.0-S1381116903007684-si46.gif?httpAccept=%2A%2F%2A",
            "@multimediatype": "GIF image file",
            "@type": "ALTIMG",
            "@size": "199",
            "@ref": "si46",
            "@mimetype": "image/gif"
          },
          {
            "@category": "thumbnail",
            "@height": "14",
            "@width": "23",
            "@_fa": "true",
            "$": "https://api.elsevier.com/content/object/eid/1-s2.0-S1381116903007684-si45.gif?httpAccept=%2A%2F%2A",
            "@multimediatype": "GIF image file",
            "@type": "ALTIMG",
            "@size": "199",
            "@ref": "si45",
            "@mimetype": "image/gif"
          },
          {
            "@category": "thumbnail",
            "@height": "14",
            "@width": "23",
            "@_fa": "true",
            "$": "https://api.elsevier.com/content/object/eid/1-s2.0-S1381116903007684-si44.gif?httpAccept=%2A%2F%2A",
            "@multimediatype": "GIF image file",
            "@type": "ALTIMG",
            "@size": "199",
            "@ref": "si44",
            "@mimetype": "image/gif"
          },
          {
            "@category": "thumbnail",
            "@height": "14",
            "@width": "23",
            "@_fa": "true",
            "$": "https://api.elsevier.com/content/object/eid/1-s2.0-S1381116903007684-si43.gif?httpAccept=%2A%2F%2A",
            "@multimediatype": "GIF image file",
            "@type": "ALTIMG",
            "@size": "205",
            "@ref": "si43",
            "@mimetype": "image/gif"
          },
          {
            "@category": "thumbnail",
            "@height": "14",
            "@width": "23",
            "@_fa": "true",
            "$": "https://api.elsevier.com/content/object/eid/1-s2.0-S1381116903007684-si42.gif?httpAccept=%2A%2F%2A",
            "@multimediatype": "GIF image file",
            "@type": "ALTIMG",
            "@size": "205",
            "@ref": "si42",
            "@mimetype": "image/gif"
          },
          {
            "@category": "thumbnail",
            "@height": "14",
            "@width": "23",
            "@_fa": "true",
            "$": "https://api.elsevier.com/content/object/eid/1-s2.0-S1381116903007684-si41.gif?httpAccept=%2A%2F%2A",
            "@multimediatype": "GIF image file",
            "@type": "ALTIMG",
            "@size": "199",
            "@ref": "si41",
            "@mimetype": "image/gif"
          },
          {
            "@category": "thumbnail",
            "@height": "14",
            "@width": "23",
            "@_fa": "true",
            "$": "https://api.elsevier.com/content/object/eid/1-s2.0-S1381116903007684-si40.gif?httpAccept=%2A%2F%2A",
            "@multimediatype": "GIF image file",
            "@type": "ALTIMG",
            "@size": "205",
            "@ref": "si40",
            "@mimetype": "image/gif"
          },
          {
            "@category": "thumbnail",
            "@height": "14",
            "@width": "23",
            "@_fa": "true",
            "$": "https://api.elsevier.com/content/object/eid/1-s2.0-S1381116903007684-si4.gif?httpAccept=%2A%2F%2A",
            "@multimediatype": "GIF image file",
            "@type": "ALTIMG",
            "@size": "199",
            "@ref": "si4",
            "@mimetype": "image/gif"
          },
          {
            "@category": "thumbnail",
            "@height": "14",
            "@width": "23",
            "@_fa": "true",
            "$": "https://api.elsevier.com/content/object/eid/1-s2.0-S1381116903007684-si39.gif?httpAccept=%2A%2F%2A",
            "@multimediatype": "GIF image file",
            "@type": "ALTIMG",
            "@size": "205",
            "@ref": "si39",
            "@mimetype": "image/gif"
          },
          {
            "@category": "thumbnail",
            "@height": "14",
            "@width": "23",
            "@_fa": "true",
            "$": "https://api.elsevier.com/content/object/eid/1-s2.0-S1381116903007684-si38.gif?httpAccept=%2A%2F%2A",
            "@multimediatype": "GIF image file",
            "@type": "ALTIMG",
            "@size": "199",
            "@ref": "si38",
            "@mimetype": "image/gif"
          },
          {
            "@category": "thumbnail",
            "@height": "14",
            "@width": "23",
            "@_fa": "true",
            "$": "https://api.elsevier.com/content/object/eid/1-s2.0-S1381116903007684-si37.gif?httpAccept=%2A%2F%2A",
            "@multimediatype": "GIF image file",
            "@type": "ALTIMG",
            "@size": "205",
            "@ref": "si37",
            "@mimetype": "image/gif"
          },
          {
            "@category": "thumbnail",
            "@height": "14",
            "@width": "23",
            "@_fa": "true",
            "$": "https://api.elsevier.com/content/object/eid/1-s2.0-S1381116903007684-si36.gif?httpAccept=%2A%2F%2A",
            "@multimediatype": "GIF image file",
            "@type": "ALTIMG",
            "@size": "199",
            "@ref": "si36",
            "@mimetype": "image/gif"
          },
          {
            "@category": "thumbnail",
            "@height": "14",
            "@width": "23",
            "@_fa": "true",
            "$": "https://api.elsevier.com/content/object/eid/1-s2.0-S1381116903007684-si35.gif?httpAccept=%2A%2F%2A",
            "@multimediatype": "GIF image file",
            "@type": "ALTIMG",
            "@size": "199",
            "@ref": "si35",
            "@mimetype": "image/gif"
          },
          {
            "@category": "thumbnail",
            "@height": "14",
            "@width": "23",
            "@_fa": "true",
            "$": "https://api.elsevier.com/content/object/eid/1-s2.0-S1381116903007684-si34.gif?httpAccept=%2A%2F%2A",
            "@multimediatype": "GIF image file",
            "@type": "ALTIMG",
            "@size": "199",
            "@ref": "si34",
            "@mimetype": "image/gif"
          },
          {
            "@category": "thumbnail",
            "@height": "14",
            "@width": "23",
            "@_fa": "true",
            "$": "https://api.elsevier.com/content/object/eid/1-s2.0-S1381116903007684-si33.gif?httpAccept=%2A%2F%2A",
            "@multimediatype": "GIF image file",
            "@type": "ALTIMG",
            "@size": "199",
            "@ref": "si33",
            "@mimetype": "image/gif"
          },
          {
            "@category": "thumbnail",
            "@height": "14",
            "@width": "23",
            "@_fa": "true",
            "$": "https://api.elsevier.com/content/object/eid/1-s2.0-S1381116903007684-si32.gif?httpAccept=%2A%2F%2A",
            "@multimediatype": "GIF image file",
            "@type": "ALTIMG",
            "@size": "199",
            "@ref": "si32",
            "@mimetype": "image/gif"
          },
          {
            "@category": "thumbnail",
            "@height": "14",
            "@width": "23",
            "@_fa": "true",
            "$": "https://api.elsevier.com/content/object/eid/1-s2.0-S1381116903007684-si31.gif?httpAccept=%2A%2F%2A",
            "@multimediatype": "GIF image file",
            "@type": "ALTIMG",
            "@size": "199",
            "@ref": "si31",
            "@mimetype": "image/gif"
          },
          {
            "@category": "thumbnail",
            "@height": "14",
            "@width": "23",
            "@_fa": "true",
            "$": "https://api.elsevier.com/content/object/eid/1-s2.0-S1381116903007684-si30.gif?httpAccept=%2A%2F%2A",
            "@multimediatype": "GIF image file",
            "@type": "ALTIMG",
            "@size": "199",
            "@ref": "si30",
            "@mimetype": "image/gif"
          },
          {
            "@category": "thumbnail",
            "@height": "19",
            "@width": "58",
            "@_fa": "true",
            "$": "https://api.elsevier.com/content/object/eid/1-s2.0-S1381116903007684-si3.gif?httpAccept=%2A%2F%2A",
            "@multimediatype": "GIF image file",
            "@type": "ALTIMG",
            "@size": "333",
            "@ref": "si3",
            "@mimetype": "image/gif"
          },
          {
            "@category": "thumbnail",
            "@height": "14",
            "@width": "23",
            "@_fa": "true",
            "$": "https://api.elsevier.com/content/object/eid/1-s2.0-S1381116903007684-si29.gif?httpAccept=%2A%2F%2A",
            "@multimediatype": "GIF image file",
            "@type": "ALTIMG",
            "@size": "199",
            "@ref": "si29",
            "@mimetype": "image/gif"
          },
          {
            "@category": "thumbnail",
            "@height": "14",
            "@width": "23",
            "@_fa": "true",
            "$": "https://api.elsevier.com/content/object/eid/1-s2.0-S1381116903007684-si28.gif?httpAccept=%2A%2F%2A",
            "@multimediatype": "GIF image file",
            "@type": "ALTIMG",
            "@size": "199",
            "@ref": "si28",
            "@mimetype": "image/gif"
          },
          {
            "@category": "thumbnail",
            "@height": "14",
            "@width": "23",
            "@_fa": "true",
            "$": "https://api.elsevier.com/content/object/eid/1-s2.0-S1381116903007684-si27.gif?httpAccept=%2A%2F%2A",
            "@multimediatype": "GIF image file",
            "@type": "ALTIMG",
            "@size": "205",
            "@ref": "si27",
            "@mimetype": "image/gif"
          },
          {
            "@category": "thumbnail",
            "@height": "14",
            "@width": "23",
            "@_fa": "true",
            "$": "https://api.elsevier.com/content/object/eid/1-s2.0-S1381116903007684-si26.gif?httpAccept=%2A%2F%2A",
            "@multimediatype": "GIF image file",
            "@type": "ALTIMG",
            "@size": "199",
            "@ref": "si26",
            "@mimetype": "image/gif"
          },
          {
            "@category": "thumbnail",
            "@height": "14",
            "@width": "23",
            "@_fa": "true",
            "$": "https://api.elsevier.com/content/object/eid/1-s2.0-S1381116903007684-si25.gif?httpAccept=%2A%2F%2A",
            "@multimediatype": "GIF image file",
            "@type": "ALTIMG",
            "@size": "199",
            "@ref": "si25",
            "@mimetype": "image/gif"
          },
          {
            "@category": "thumbnail",
            "@height": "14",
            "@width": "27",
            "@_fa": "true",
            "$": "https://api.elsevier.com/content/object/eid/1-s2.0-S1381116903007684-si24.gif?httpAccept=%2A%2F%2A",
            "@multimediatype": "GIF image file",
            "@type": "ALTIMG",
            "@size": "206",
            "@ref": "si24",
            "@mimetype": "image/gif"
          },
          {
            "@category": "thumbnail",
            "@height": "17",
            "@width": "211",
            "@_fa": "true",
            "$": "https://api.elsevier.com/content/object/eid/1-s2.0-S1381116903007684-si23.gif?httpAccept=%2A%2F%2A",
            "@multimediatype": "GIF image file",
            "@type": "ALTIMG",
            "@size": "897",
            "@ref": "si23",
            "@mimetype": "image/gif"
          },
          {
            "@category": "thumbnail",
            "@height": "17",
            "@width": "263",
            "@_fa": "true",
            "$": "https://api.elsevier.com/content/object/eid/1-s2.0-S1381116903007684-si22.gif?httpAccept=%2A%2F%2A",
            "@multimediatype": "GIF image file",
            "@type": "ALTIMG",
            "@size": "1025",
            "@ref": "si22",
            "@mimetype": "image/gif"
          },
          {
            "@category": "thumbnail",
            "@height": "14",
            "@width": "23",
            "@_fa": "true",
            "$": "https://api.elsevier.com/content/object/eid/1-s2.0-S1381116903007684-si21.gif?httpAccept=%2A%2F%2A",
            "@multimediatype": "GIF image file",
            "@type": "ALTIMG",
            "@size": "205",
            "@ref": "si21",
            "@mimetype": "image/gif"
          },
          {
            "@category": "thumbnail",
            "@height": "14",
            "@width": "23",
            "@_fa": "true",
            "$": "https://api.elsevier.com/content/object/eid/1-s2.0-S1381116903007684-si20.gif?httpAccept=%2A%2F%2A",
            "@multimediatype": "GIF image file",
            "@type": "ALTIMG",
            "@size": "199",
            "@ref": "si20",
            "@mimetype": "image/gif"
          },
          {
            "@category": "thumbnail",
            "@height": "14",
            "@width": "23",
            "@_fa": "true",
            "$": "https://api.elsevier.com/content/object/eid/1-s2.0-S1381116903007684-si2.gif?httpAccept=%2A%2F%2A",
            "@multimediatype": "GIF image file",
            "@type": "ALTIMG",
            "@size": "199",
            "@ref": "si2",
            "@mimetype": "image/gif"
          },
          {
            "@category": "thumbnail",
            "@height": "14",
            "@width": "23",
            "@_fa": "true",
            "$": "https://api.elsevier.com/content/object/eid/1-s2.0-S1381116903007684-si19.gif?httpAccept=%2A%2F%2A",
            "@multimediatype": "GIF image file",
            "@type": "ALTIMG",
            "@size": "199",
            "@ref": "si19",
            "@mimetype": "image/gif"
          },
          {
            "@category": "thumbnail",
            "@height": "14",
            "@width": "23",
            "@_fa": "true",
            "$": "https://api.elsevier.com/content/object/eid/1-s2.0-S1381116903007684-si18.gif?httpAccept=%2A%2F%2A",
            "@multimediatype": "GIF image file",
            "@type": "ALTIMG",
            "@size": "199",
            "@ref": "si18",
            "@mimetype": "image/gif"
          },
          {
            "@category": "thumbnail",
            "@height": "14",
            "@width": "23",
            "@_fa": "true",
            "$": "https://api.elsevier.com/content/object/eid/1-s2.0-S1381116903007684-si17.gif?httpAccept=%2A%2F%2A",
            "@multimediatype": "GIF image file",
            "@type": "ALTIMG",
            "@size": "199",
            "@ref": "si17",
            "@mimetype": "image/gif"
          },
          {
            "@category": "thumbnail",
            "@height": "14",
            "@width": "23",
            "@_fa": "true",
            "$": "https://api.elsevier.com/content/object/eid/1-s2.0-S1381116903007684-si16.gif?httpAccept=%2A%2F%2A",
            "@multimediatype": "GIF image file",
            "@type": "ALTIMG",
            "@size": "205",
            "@ref": "si16",
            "@mimetype": "image/gif"
          },
          {
            "@category": "thumbnail",
            "@height": "14",
            "@width": "23",
            "@_fa": "true",
            "$": "https://api.elsevier.com/content/object/eid/1-s2.0-S1381116903007684-si15.gif?httpAccept=%2A%2F%2A",
            "@multimediatype": "GIF image file",
            "@type": "ALTIMG",
            "@size": "199",
            "@ref": "si15",
            "@mimetype": "image/gif"
          },
          {
            "@category": "thumbnail",
            "@height": "14",
            "@width": "23",
            "@_fa": "true",
            "$": "https://api.elsevier.com/content/object/eid/1-s2.0-S1381116903007684-si14.gif?httpAccept=%2A%2F%2A",
            "@multimediatype": "GIF image file",
            "@type": "ALTIMG",
            "@size": "199",
            "@ref": "si14",
            "@mimetype": "image/gif"
          },
          {
            "@category": "thumbnail",
            "@height": "14",
            "@width": "23",
            "@_fa": "true",
            "$": "https://api.elsevier.com/content/object/eid/1-s2.0-S1381116903007684-si13.gif?httpAccept=%2A%2F%2A",
            "@multimediatype": "GIF image file",
            "@type": "ALTIMG",
            "@size": "199",
            "@ref": "si13",
            "@mimetype": "image/gif"
          },
          {
            "@category": "thumbnail",
            "@height": "14",
            "@width": "27",
            "@_fa": "true",
            "$": "https://api.elsevier.com/content/object/eid/1-s2.0-S1381116903007684-si12.gif?httpAccept=%2A%2F%2A",
            "@multimediatype": "GIF image file",
            "@type": "ALTIMG",
            "@size": "206",
            "@ref": "si12",
            "@mimetype": "image/gif"
          },
          {
            "@category": "thumbnail",
            "@height": "13",
            "@width": "79",
            "@_fa": "true",
            "$": "https://api.elsevier.com/content/object/eid/1-s2.0-S1381116903007684-si11.gif?httpAccept=%2A%2F%2A",
            "@multimediatype": "GIF image file",
            "@type": "ALTIMG",
            "@size": "365",
            "@ref": "si11",
            "@mimetype": "image/gif"
          },
          {
            "@category": "thumbnail",
            "@height": "14",
            "@width": "23",
            "@_fa": "true",
            "$": "https://api.elsevier.com/content/object/eid/1-s2.0-S1381116903007684-si10.gif?httpAccept=%2A%2F%2A",
            "@multimediatype": "GIF image file",
            "@type": "ALTIMG",
            "@size": "199",
            "@ref": "si10",
            "@mimetype": "image/gif"
          },
          {
            "@category": "thumbnail",
            "@height": "14",
            "@width": "23",
            "@_fa": "true",
            "$": "https://api.elsevier.com/content/object/eid/1-s2.0-S1381116903007684-si1.gif?httpAccept=%2A%2F%2A",
            "@multimediatype": "GIF image file",
            "@type": "ALTIMG",
            "@size": "199",
            "@ref": "si1",
            "@mimetype": "image/gif"
          },
          {
            "@category": "thumbnail",
            "@height": "86",
            "@width": "125",
            "@_fa": "true",
            "$": "https://api.elsevier.com/content/object/eid/1-s2.0-S1381116903007684-fx1.sml?httpAccept=%2A%2F%2A",
            "@multimediatype": "GIF image file",
            "@type": "IMAGE-THUMBNAIL",
            "@size": "1667",
            "@ref": "fx1",
            "@mimetype": "image/gif"
          },
          {
            "@category": "standard",
            "@height": "172",
            "@width": "250",
            "@_fa": "true",
            "$": "https://api.elsevier.com/content/object/eid/1-s2.0-S1381116903007684-fx1.gif?httpAccept=%2A%2F%2A",
            "@multimediatype": "GIF image file",
            "@type": "IMAGE-DOWNSAMPLED",
            "@size": "4762",
            "@ref": "fx1",
            "@mimetype": "image/gif"
          },
          {
            "@category": "thumbnail",
            "@height": "93",
            "@width": "110",
            "@_fa": "true",
            "$": "https://api.elsevier.com/content/object/eid/1-s2.0-S1381116903007684-gr1.sml?httpAccept=%2A%2F%2A",
            "@multimediatype": "GIF image file",
            "@type": "IMAGE-THUMBNAIL",
            "@size": "3341",
            "@ref": "gr1",
            "@mimetype": "image/gif"
          },
          {
            "@category": "standard",
            "@height": "127",
            "@width": "151",
            "@_fa": "true",
            "$": "https://api.elsevier.com/content/object/eid/1-s2.0-S1381116903007684-gr1.gif?httpAccept=%2A%2F%2A",
            "@multimediatype": "GIF image file",
            "@type": "IMAGE-DOWNSAMPLED",
            "@size": "4663",
            "@ref": "gr1",
            "@mimetype": "image/gif"
          },
          {
            "@category": "thumbnail",
            "@height": "83",
            "@width": "125",
            "@_fa": "true",
            "$": "https://api.elsevier.com/content/object/eid/1-s2.0-S1381116903007684-gr2.sml?httpAccept=%2A%2F%2A",
            "@multimediatype": "GIF image file",
            "@type": "IMAGE-THUMBNAIL",
            "@size": "3558",
            "@ref": "gr2",
            "@mimetype": "image/gif"
          },
          {
            "@category": "standard",
            "@height": "124",
            "@width": "186",
            "@_fa": "true",
            "$": "https://api.elsevier.com/content/object/eid/1-s2.0-S1381116903007684-gr2.gif?httpAccept=%2A%2F%2A",
            "@multimediatype": "GIF image file",
            "@type": "IMAGE-DOWNSAMPLED",
            "@size": "5581",
            "@ref": "gr2",
            "@mimetype": "image/gif"
          },
          {
            "@category": "thumbnail",
            "@height": "93",
            "@width": "96",
            "@_fa": "true",
            "$": "https://api.elsevier.com/content/object/eid/1-s2.0-S1381116903007684-gr3.sml?httpAccept=%2A%2F%2A",
            "@multimediatype": "GIF image file",
            "@type": "IMAGE-THUMBNAIL",
            "@size": "2933",
            "@ref": "gr3",
            "@mimetype": "image/gif"
          },
          {
            "@category": "standard",
            "@height": "128",
            "@width": "132",
            "@_fa": "true",
            "$": "https://api.elsevier.com/content/object/eid/1-s2.0-S1381116903007684-gr3.gif?httpAccept=%2A%2F%2A",
            "@multimediatype": "GIF image file",
            "@type": "IMAGE-DOWNSAMPLED",
            "@size": "4043",
            "@ref": "gr3",
            "@mimetype": "image/gif"
          },
          {
            "@category": "thumbnail",
            "@height": "94",
            "@width": "98",
            "@_fa": "true",
            "$": "https://api.elsevier.com/content/object/eid/1-s2.0-S1381116903007684-gr4.sml?httpAccept=%2A%2F%2A",
            "@multimediatype": "GIF image file",
            "@type": "IMAGE-THUMBNAIL",
            "@size": "3578",
            "@ref": "gr4",
            "@mimetype": "image/gif"
          },
          {
            "@category": "standard",
            "@height": "128",
            "@width": "134",
            "@_fa": "true",
            "$": "https://api.elsevier.com/content/object/eid/1-s2.0-S1381116903007684-gr4.gif?httpAccept=%2A%2F%2A",
            "@multimediatype": "GIF image file",
            "@type": "IMAGE-DOWNSAMPLED",
            "@size": "5090",
            "@ref": "gr4",
            "@mimetype": "image/gif"
          },
          {
            "@category": "thumbnail",
            "@height": "94",
            "@width": "95",
            "@_fa": "true",
            "$": "https://api.elsevier.com/content/object/eid/1-s2.0-S1381116903007684-gr5.sml?httpAccept=%2A%2F%2A",
            "@multimediatype": "GIF image file",
            "@type": "IMAGE-THUMBNAIL",
            "@size": "2880",
            "@ref": "gr5",
            "@mimetype": "image/gif"
          },
          {
            "@category": "standard",
            "@height": "130",
            "@width": "132",
            "@_fa": "true",
            "$": "https://api.elsevier.com/content/object/eid/1-s2.0-S1381116903007684-gr5.gif?httpAccept=%2A%2F%2A",
            "@multimediatype": "GIF image file",
            "@type": "IMAGE-DOWNSAMPLED",
            "@size": "3890",
            "@ref": "gr5",
            "@mimetype": "image/gif"
          },
          {
            "@category": "thumbnail",
            "@height": "80",
            "@width": "125",
            "@_fa": "true",
            "$": "https://api.elsevier.com/content/object/eid/1-s2.0-S1381116903007684-gr6.sml?httpAccept=%2A%2F%2A",
            "@multimediatype": "GIF image file",
            "@type": "IMAGE-THUMBNAIL",
            "@size": "3111",
            "@ref": "gr6",
            "@mimetype": "image/gif"
          },
          {
            "@category": "standard",
            "@height": "467",
            "@width": "734",
            "@_fa": "true",
            "$": "https://api.elsevier.com/content/object/eid/1-s2.0-S1381116903007684-gr6.jpg?httpAccept=%2A%2F%2A",
            "@multimediatype": "JPEG image file",
            "@type": "IMAGE-DOWNSAMPLED",
            "@size": "107705",
            "@ref": "gr6",
            "@mimetype": "image/jpeg"
          },
          {
            "@category": "thumbnail",
            "@height": "94",
            "@width": "109",
            "@_fa": "true",
            "$": "https://api.elsevier.com/content/object/eid/1-s2.0-S1381116903007684-gr7.sml?httpAccept=%2A%2F%2A",
            "@multimediatype": "GIF image file",
            "@type": "IMAGE-THUMBNAIL",
            "@size": "3578",
            "@ref": "gr7",
            "@mimetype": "image/gif"
          },
          {
            "@category": "standard",
            "@height": "236",
            "@width": "275",
            "@_fa": "true",
            "$": "https://api.elsevier.com/content/object/eid/1-s2.0-S1381116903007684-gr7.jpg?httpAccept=%2A%2F%2A",
            "@multimediatype": "JPEG image file",
            "@type": "IMAGE-DOWNSAMPLED",
            "@size": "25414",
            "@ref": "gr7",
            "@mimetype": "image/jpeg"
          },
          {
            "@category": "thumbnail",
            "@height": "73",
            "@width": "125",
            "@_fa": "true",
            "$": "https://api.elsevier.com/content/object/eid/1-s2.0-S1381116903007684-gr8.sml?httpAccept=%2A%2F%2A",
            "@multimediatype": "GIF image file",
            "@type": "IMAGE-THUMBNAIL",
            "@size": "1442",
            "@ref": "gr8",
            "@mimetype": "image/gif"
          },
          {
            "@category": "standard",
            "@height": "316",
            "@width": "542",
            "@_fa": "true",
            "$": "https://api.elsevier.com/content/object/eid/1-s2.0-S1381116903007684-gr8.gif?httpAccept=%2A%2F%2A",
            "@multimediatype": "GIF image file",
            "@type": "IMAGE-DOWNSAMPLED",
            "@size": "11321",
            "@ref": "gr8",
            "@mimetype": "image/gif"
          }
        ]
      },
      "link": {
        "@rel": "abstract",
        "@href": "https://api.elsevier.com/content/abstract/scopus_id/1642411029"
      }
    }
  }
}