{
  "metadata": {
    "title": "Comparison of palladium carbene and palladium phosphine catalysts for catalytic coupling reactions of aryl halides",
    "authors": "; ; ",
    "journal": "Journal of Molecular Catalysis A: Chemical",
    "date": "2004-06-01",
    "doi": "10.1016/j.molcata.2003.12.035",
    "abstract": "",
    "uri": "https://api.elsevier.com/content/article/pii/S1381116904000020",
    "pii": "S1381116904000020"
  },
  "fulltext": {
    "full-text-retrieval-response": {
      "scopus-eid": "2-s2.0-2442490921",
      "originalText": "serial JL 271358 291210 291744 291790 291809 31 Journal of Molecular Catalysis A: Chemical JOURNALMOLECULARCATALYSISACHEMICAL 2004-03-05 2004-03-05 2010-03-28T13:36:59 1-s2.0-S1381116904000020 S1381-1169(04)00002-0 S1381116904000020 10.1016/j.molcata.2003.12.035 S300 S300.2 FULL-TEXT 1-s2.0-S1381116900X01859 2015-05-15T05:56:32.920819-04:00 0 0 20040601 2004 2004-03-05T00:00:00Z articleinfo crossmark dco dateupdated tomb dateloaded datesearch indexeddate issuelist volumelist yearnav absattachment articletitlenorm authfirstinitialnorm authfirstsurnamenorm cid cids contenttype copyright dateloadedtxt docsubtype doctype doi eid ewtransactionid hubeid issfirst issn issnnorm itemstage itemtransactionid itemweight openaccess openarchive pg pgfirst pglast pii piinorm pubdatestart pubdatetxt pubyr sortorder srctitle srctitlenorm srctype subheadings volfirst volissue webpdf webpdfpagecount figure table body acknowledge affil articletitle auth authfirstini authfull authkeywords authlast primabst ref specialabst alllist content subj ssids 1381-1169 13811169 214 214 2 2 Volume 214, Issue 2 10 231 239 231 239 20040601 1 June 2004 2004-06-01 2004 converted-article fla Copyright © 2004 Elsevier B.V. All rights reserved. COMPARISONPALLADIUMCARBENEPALLADIUMPHOSPHINECATALYSTSFORCATALYTICCOUPLINGREACTIONSARYLHALIDES FRISCH A 1 Introduction 2 Results and discussion 2.1 Suzuki reactions of aryl halides 2.2 Kumada coupling of aryl chlorides 2.3 Catalytic amination of aryl halides 3 Conclusions 4 Experimental 4.1 Suzuki reaction of aryl halides and phenylboronic acid 4.1.1 Pd(II) source 4.1.2 Pd(0)(dvds) 4.2 Kumada reaction of aryl halides and arylmagnesium bromides 4.3 Buchwald–Hartwig amination of aryl halides Acknowledgements References MIYAURA 1995 2457 N WHITCOMBE 2001 7449 N BELLER 2001 575 M ZAPF 2002 101 A DEVRIES 2001 1086 J LOCH 2002 700 J FEUERSTEIN 2001 6667 M ZAPF 2000 1830 A LITTKE 2000 4020 A BEDFORD 2000 745 R BOHM 2000 1017 V FOX 2000 1360 J KAWATSURA 1999 1473 M WOLFE 1999 9550 J OHFF 1997 11687 M KOHLER 2001 105 K HERRMANN 2003 229 W HILLIER 2002 69 A MA 2003 3317 Y STAUFFER 2000 1423 S DAI 2001 2719 C ZIM 2003 2413 D LI 2002 3643 G SELVAKUMAR 2002 3901 K SELVAKUMAR 2002 3031 K JACKSTELL 2002 105 R GOA 1996 820 K BLASER 2000 1336 H YIN 2000 12051 J GRASA 2002 2866 G VICIU 2002 5470 M TAMAO 1972 4374 K HUANG 1999 9889 J RIERMEIER 1997 301 T VANLEEUWEN 2000 2741 P HOPPER 2003 2961 M KUWANO 2002 6479 R KATAOKA 2002 5553 N ALI 2001 2560 M ZHANG 2000 7606 X WOLFE 2000 1158 J WOLFE 1998 805 J MARCOUX 1997 1568 J URGAONKAR 2003 8416 S FRISCHX2004X231 FRISCHX2004X231X239 FRISCHX2004X231XA FRISCHX2004X231X239XA item S1381-1169(04)00002-0 S1381116904000020 1-s2.0-S1381116904000020 10.1016/j.molcata.2003.12.035 271358 2010-10-15T16:13:58.041901-04:00 2004-06-01 1-s2.0-S1381116904000020-main.pdf https://s3.amazonaws.com/prod-ucs-content-store-us-east/content/pii:S1381116904000020/MAIN/application/pdf/0d017ee4c2ae692b070dab62a0494f8c/main.pdf https://s3-eu-west-1.amazonaws.com/prod-ucs-content-store-eu-west/content/pii:S1381116904000020/MAIN/application/pdf/0d017ee4c2ae692b070dab62a0494f8c/main.pdf main.pdf pdf true 121882 MAIN 9 1-s2.0-S1381116904000020-main_1.png https://s3.amazonaws.com/prod-ucs-content-store-us-east/content/pii:S1381116904000020/PREVIEW/image/png/fc5f444bb31bf0ce9369005cf837c481/main_1.png https://s3-eu-west-1.amazonaws.com/prod-ucs-content-store-eu-west/content/pii:S1381116904000020/PREVIEW/image/png/fc5f444bb31bf0ce9369005cf837c481/main_1.png main_1.png png 69353 849 656 IMAGE-WEB-PDF 1 1-s2.0-S1381116904000020-fx1.sml https://s3.amazonaws.com/prod-ucs-content-store-us-east/content/pii:S1381116904000020/fx1/THUMBNAIL/image/gif/792295b5394911a8be5232b3b024db91/fx1.sml https://s3-eu-west-1.amazonaws.com/prod-ucs-content-store-eu-west/content/pii:S1381116904000020/fx1/THUMBNAIL/image/gif/792295b5394911a8be5232b3b024db91/fx1.sml fx1 true fx1.sml sml 708 35 125 IMAGE-THUMBNAIL 1-s2.0-S1381116904000020-fx1.gif https://s3.amazonaws.com/prod-ucs-content-store-us-east/content/pii:S1381116904000020/fx1/DOWNSAMPLED/image/gif/4c9a5b73bcf77248d1626b027656f9c9/fx1.gif https://s3-eu-west-1.amazonaws.com/prod-ucs-content-store-eu-west/content/pii:S1381116904000020/fx1/DOWNSAMPLED/image/gif/4c9a5b73bcf77248d1626b027656f9c9/fx1.gif fx1 true fx1.gif gif 3360 104 376 IMAGE-DOWNSAMPLED 1-s2.0-S1381116904000020-gr1.sml https://s3.amazonaws.com/prod-ucs-content-store-us-east/content/pii:S1381116904000020/gr1/THUMBNAIL/image/gif/17ffcc55d09cc29cad51468b5f7340ea/gr1.sml https://s3-eu-west-1.amazonaws.com/prod-ucs-content-store-eu-west/content/pii:S1381116904000020/gr1/THUMBNAIL/image/gif/17ffcc55d09cc29cad51468b5f7340ea/gr1.sml gr1 gr1.sml sml 2871 93 118 IMAGE-THUMBNAIL 1-s2.0-S1381116904000020-gr1.gif https://s3.amazonaws.com/prod-ucs-content-store-us-east/content/pii:S1381116904000020/gr1/DOWNSAMPLED/image/gif/ba74672233817e99d1a3ee0ea1eec659/gr1.gif https://s3-eu-west-1.amazonaws.com/prod-ucs-content-store-eu-west/content/pii:S1381116904000020/gr1/DOWNSAMPLED/image/gif/ba74672233817e99d1a3ee0ea1eec659/gr1.gif gr1 gr1.gif gif 11041 253 320 IMAGE-DOWNSAMPLED 1-s2.0-S1381116904000020-sc1.sml https://s3.amazonaws.com/prod-ucs-content-store-us-east/content/pii:S1381116904000020/sc1/THUMBNAIL/image/gif/043c398a672c00259bdf7bb1d4074ff8/sc1.sml https://s3-eu-west-1.amazonaws.com/prod-ucs-content-store-eu-west/content/pii:S1381116904000020/sc1/THUMBNAIL/image/gif/043c398a672c00259bdf7bb1d4074ff8/sc1.sml sc1 sc1.sml sml 1342 19 125 IMAGE-THUMBNAIL 1-s2.0-S1381116904000020-sc1.gif https://s3.amazonaws.com/prod-ucs-content-store-us-east/content/pii:S1381116904000020/sc1/DOWNSAMPLED/image/gif/761140f608c6000382826e77eec5f8c7/sc1.gif https://s3-eu-west-1.amazonaws.com/prod-ucs-content-store-eu-west/content/pii:S1381116904000020/sc1/DOWNSAMPLED/image/gif/761140f608c6000382826e77eec5f8c7/sc1.gif sc1 sc1.gif gif 2714 44 293 IMAGE-DOWNSAMPLED 1-s2.0-S1381116904000020-sc2.sml https://s3.amazonaws.com/prod-ucs-content-store-us-east/content/pii:S1381116904000020/sc2/THUMBNAIL/image/gif/5952943b0f1fc6ae0cbab4d26090cd66/sc2.sml https://s3-eu-west-1.amazonaws.com/prod-ucs-content-store-eu-west/content/pii:S1381116904000020/sc2/THUMBNAIL/image/gif/5952943b0f1fc6ae0cbab4d26090cd66/sc2.sml sc2 sc2.sml sml 1256 21 125 IMAGE-THUMBNAIL 1-s2.0-S1381116904000020-sc2.gif https://s3.amazonaws.com/prod-ucs-content-store-us-east/content/pii:S1381116904000020/sc2/DOWNSAMPLED/image/gif/7705f1565eec85bb546c0d0bb415c531/sc2.gif https://s3-eu-west-1.amazonaws.com/prod-ucs-content-store-eu-west/content/pii:S1381116904000020/sc2/DOWNSAMPLED/image/gif/7705f1565eec85bb546c0d0bb415c531/sc2.gif sc2 sc2.gif gif 1957 39 230 IMAGE-DOWNSAMPLED 1-s2.0-S1381116904000020-gr2.sml https://s3.amazonaws.com/prod-ucs-content-store-us-east/content/pii:S1381116904000020/gr2/THUMBNAIL/image/gif/589b84bf3204e334e482f6a416441d17/gr2.sml https://s3-eu-west-1.amazonaws.com/prod-ucs-content-store-eu-west/content/pii:S1381116904000020/gr2/THUMBNAIL/image/gif/589b84bf3204e334e482f6a416441d17/gr2.sml gr2 gr2.sml sml 3455 94 108 IMAGE-THUMBNAIL 1-s2.0-S1381116904000020-gr2.gif https://s3.amazonaws.com/prod-ucs-content-store-us-east/content/pii:S1381116904000020/gr2/DOWNSAMPLED/image/gif/03895d7fed6621d91f4b9bd52d69e516/gr2.gif https://s3-eu-west-1.amazonaws.com/prod-ucs-content-store-eu-west/content/pii:S1381116904000020/gr2/DOWNSAMPLED/image/gif/03895d7fed6621d91f4b9bd52d69e516/gr2.gif gr2 gr2.gif gif 12961 243 280 IMAGE-DOWNSAMPLED 1-s2.0-S1381116904000020-sc3.sml https://s3.amazonaws.com/prod-ucs-content-store-us-east/content/pii:S1381116904000020/sc3/THUMBNAIL/image/gif/33488e958e123023869fb088ce9b9729/sc3.sml https://s3-eu-west-1.amazonaws.com/prod-ucs-content-store-eu-west/content/pii:S1381116904000020/sc3/THUMBNAIL/image/gif/33488e958e123023869fb088ce9b9729/sc3.sml sc3 sc3.sml sml 1817 60 125 IMAGE-THUMBNAIL 1-s2.0-S1381116904000020-sc3.gif https://s3.amazonaws.com/prod-ucs-content-store-us-east/content/pii:S1381116904000020/sc3/DOWNSAMPLED/image/gif/9ee1e63fdc6a549620e39ff0105b8972/sc3.gif https://s3-eu-west-1.amazonaws.com/prod-ucs-content-store-eu-west/content/pii:S1381116904000020/sc3/DOWNSAMPLED/image/gif/9ee1e63fdc6a549620e39ff0105b8972/sc3.gif sc3 sc3.gif gif 5152 162 340 IMAGE-DOWNSAMPLED 1-s2.0-S1381116904000020-fx2.sml https://s3.amazonaws.com/prod-ucs-content-store-us-east/content/pii:S1381116904000020/fx2/THUMBNAIL/image/gif/00747947b00361535a356c1908311de2/fx2.sml https://s3-eu-west-1.amazonaws.com/prod-ucs-content-store-eu-west/content/pii:S1381116904000020/fx2/THUMBNAIL/image/gif/00747947b00361535a356c1908311de2/fx2.sml fx2 fx2.sml sml 1107 93 105 IMAGE-THUMBNAIL 1-s2.0-S1381116904000020-fx2.gif https://s3.amazonaws.com/prod-ucs-content-store-us-east/content/pii:S1381116904000020/fx2/DOWNSAMPLED/image/gif/aeb7f8a2578c257900f2682a2d760c3e/fx2.gif https://s3-eu-west-1.amazonaws.com/prod-ucs-content-store-eu-west/content/pii:S1381116904000020/fx2/DOWNSAMPLED/image/gif/aeb7f8a2578c257900f2682a2d760c3e/fx2.gif fx2 fx2.gif gif 3280 396 446 IMAGE-DOWNSAMPLED 1-s2.0-S1381116904000020-fx3.sml https://s3.amazonaws.com/prod-ucs-content-store-us-east/content/pii:S1381116904000020/fx3/THUMBNAIL/image/gif/1102f7c038d7c9e26cc156a29b6633e7/fx3.sml https://s3-eu-west-1.amazonaws.com/prod-ucs-content-store-eu-west/content/pii:S1381116904000020/fx3/THUMBNAIL/image/gif/1102f7c038d7c9e26cc156a29b6633e7/fx3.sml fx3 fx3.sml sml 962 73 125 IMAGE-THUMBNAIL 1-s2.0-S1381116904000020-fx3.gif https://s3.amazonaws.com/prod-ucs-content-store-us-east/content/pii:S1381116904000020/fx3/DOWNSAMPLED/image/gif/e86e0dd7e8b2652edea5c27e6eda632f/fx3.gif https://s3-eu-west-1.amazonaws.com/prod-ucs-content-store-eu-west/content/pii:S1381116904000020/fx3/DOWNSAMPLED/image/gif/e86e0dd7e8b2652edea5c27e6eda632f/fx3.gif fx3 fx3.gif gif 3063 338 576 IMAGE-DOWNSAMPLED 1-s2.0-S1381116904000020-fx4.sml https://s3.amazonaws.com/prod-ucs-content-store-us-east/content/pii:S1381116904000020/fx4/THUMBNAIL/image/gif/21cde8288b597b5c21d94429d77c91f8/fx4.sml https://s3-eu-west-1.amazonaws.com/prod-ucs-content-store-eu-west/content/pii:S1381116904000020/fx4/THUMBNAIL/image/gif/21cde8288b597b5c21d94429d77c91f8/fx4.sml fx4 fx4.sml sml 912 66 125 IMAGE-THUMBNAIL 1-s2.0-S1381116904000020-fx4.gif https://s3.amazonaws.com/prod-ucs-content-store-us-east/content/pii:S1381116904000020/fx4/DOWNSAMPLED/image/gif/412a739a46d5765b4011ba3e81a7f13a/fx4.gif https://s3-eu-west-1.amazonaws.com/prod-ucs-content-store-eu-west/content/pii:S1381116904000020/fx4/DOWNSAMPLED/image/gif/412a739a46d5765b4011ba3e81a7f13a/fx4.gif fx4 fx4.gif gif 650 44 84 IMAGE-DOWNSAMPLED 1-s2.0-S1381116904000020-fx5.sml https://s3.amazonaws.com/prod-ucs-content-store-us-east/content/pii:S1381116904000020/fx5/THUMBNAIL/image/gif/7b38bd78fb578b4402275b324e8f37e4/fx5.sml https://s3-eu-west-1.amazonaws.com/prod-ucs-content-store-eu-west/content/pii:S1381116904000020/fx5/THUMBNAIL/image/gif/7b38bd78fb578b4402275b324e8f37e4/fx5.sml fx5 fx5.sml sml 989 64 125 IMAGE-THUMBNAIL 1-s2.0-S1381116904000020-fx5.gif https://s3.amazonaws.com/prod-ucs-content-store-us-east/content/pii:S1381116904000020/fx5/DOWNSAMPLED/image/gif/0bf2afc0d15d6d97f4aec6b437ac1196/fx5.gif https://s3-eu-west-1.amazonaws.com/prod-ucs-content-store-eu-west/content/pii:S1381116904000020/fx5/DOWNSAMPLED/image/gif/0bf2afc0d15d6d97f4aec6b437ac1196/fx5.gif fx5 fx5.gif gif 707 45 87 IMAGE-DOWNSAMPLED 1-s2.0-S1381116904000020-sc4.sml https://s3.amazonaws.com/prod-ucs-content-store-us-east/content/pii:S1381116904000020/sc4/THUMBNAIL/image/gif/1fba226f215f3d04a5e527779039940d/sc4.sml https://s3-eu-west-1.amazonaws.com/prod-ucs-content-store-eu-west/content/pii:S1381116904000020/sc4/THUMBNAIL/image/gif/1fba226f215f3d04a5e527779039940d/sc4.sml sc4 sc4.sml sml 1367 28 125 IMAGE-THUMBNAIL 1-s2.0-S1381116904000020-sc4.gif https://s3.amazonaws.com/prod-ucs-content-store-us-east/content/pii:S1381116904000020/sc4/DOWNSAMPLED/image/gif/2e48cf3f64d8665d0e956d77b1622883/sc4.gif https://s3-eu-west-1.amazonaws.com/prod-ucs-content-store-eu-west/content/pii:S1381116904000020/sc4/DOWNSAMPLED/image/gif/2e48cf3f64d8665d0e956d77b1622883/sc4.gif sc4 sc4.gif gif 2943 68 302 IMAGE-DOWNSAMPLED 1-s2.0-S1381116904000020-sc5.sml https://s3.amazonaws.com/prod-ucs-content-store-us-east/content/pii:S1381116904000020/sc5/THUMBNAIL/image/gif/5453548ac926c6ed419576a779af8b71/sc5.sml https://s3-eu-west-1.amazonaws.com/prod-ucs-content-store-eu-west/content/pii:S1381116904000020/sc5/THUMBNAIL/image/gif/5453548ac926c6ed419576a779af8b71/sc5.sml sc5 sc5.sml sml 1348 23 125 IMAGE-THUMBNAIL 1-s2.0-S1381116904000020-sc5.gif https://s3.amazonaws.com/prod-ucs-content-store-us-east/content/pii:S1381116904000020/sc5/DOWNSAMPLED/image/gif/a9d32936c056f85de1b5b010d104b037/sc5.gif https://s3-eu-west-1.amazonaws.com/prod-ucs-content-store-eu-west/content/pii:S1381116904000020/sc5/DOWNSAMPLED/image/gif/a9d32936c056f85de1b5b010d104b037/sc5.gif sc5 sc5.gif gif 2107 41 225 IMAGE-DOWNSAMPLED 1-s2.0-S1381116904000020-fx6.sml https://s3.amazonaws.com/prod-ucs-content-store-us-east/content/pii:S1381116904000020/fx6/THUMBNAIL/image/gif/9db18130714e7232e62c6d52ed1b00a3/fx6.sml https://s3-eu-west-1.amazonaws.com/prod-ucs-content-store-eu-west/content/pii:S1381116904000020/fx6/THUMBNAIL/image/gif/9db18130714e7232e62c6d52ed1b00a3/fx6.sml fx6 fx6.sml sml 808 94 77 IMAGE-THUMBNAIL 1-s2.0-S1381116904000020-fx6.gif https://s3.amazonaws.com/prod-ucs-content-store-us-east/content/pii:S1381116904000020/fx6/DOWNSAMPLED/image/gif/f8675d07fad19ceb29ddf3c350921e05/fx6.gif https://s3-eu-west-1.amazonaws.com/prod-ucs-content-store-eu-west/content/pii:S1381116904000020/fx6/DOWNSAMPLED/image/gif/f8675d07fad19ceb29ddf3c350921e05/fx6.gif fx6 fx6.gif gif 4440 640 526 IMAGE-DOWNSAMPLED 1-s2.0-S1381116904000020-fx7.sml https://s3.amazonaws.com/prod-ucs-content-store-us-east/content/pii:S1381116904000020/fx7/THUMBNAIL/image/gif/475f48993692a9f84bc0ba6aedcf641f/fx7.sml https://s3-eu-west-1.amazonaws.com/prod-ucs-content-store-eu-west/content/pii:S1381116904000020/fx7/THUMBNAIL/image/gif/475f48993692a9f84bc0ba6aedcf641f/fx7.sml fx7 fx7.sml sml 588 93 47 IMAGE-THUMBNAIL 1-s2.0-S1381116904000020-fx7.gif https://s3.amazonaws.com/prod-ucs-content-store-us-east/content/pii:S1381116904000020/fx7/DOWNSAMPLED/image/gif/a8b04641ccf86a776b11da0a758f2a78/fx7.gif https://s3-eu-west-1.amazonaws.com/prod-ucs-content-store-eu-west/content/pii:S1381116904000020/fx7/DOWNSAMPLED/image/gif/a8b04641ccf86a776b11da0a758f2a78/fx7.gif fx7 fx7.gif gif 2416 524 266 IMAGE-DOWNSAMPLED MOLCAA 4475 S1381-1169(04)00002-0 10.1016/j.molcata.2003.12.035 Elsevier B.V. Fig. 1 Stable monocarbenepalladium(0) complexes. Scheme 1 Suzuki coupling of 4-bromoanisole and phenylboronic acid. Scheme 2 Suzuki coupling of 4-chlorotoluene and phenylboronic acid. Fig. 2 Screening of catalysts and substrates in the Suzuki coupling of aryl chlorides with phenylboronic acid. Reaction conditions: 2mmol chloroarene, 3mmol phenylboronic acid, 4mmol Cs2CO3, 6ml dioxane, 3mol% [Pd], 3mol% ligand, 80°C, 2h. Yields were determined by GC using diethyleneglycol di-n-butylether as internal standard. Scheme 3 Synthesis of biaryls via Kumada and Suzuki reactions. Scheme 4 Coupling of 4-chloro- and 4-bromoanisole with mesitylamine. Scheme 5 Coupling of 2-chlorotoluene with amines. Table 1 Suzuki coupling of 4-bromoanisole and phenylboronic acid Entry Catalyst Conversion (%) a Yield (%) a 1 IMesPd(dvds) (1) 92 65 2 IPrPd(dvds) (2) 90 71 3 IPrPd(dvds) (2)/NQ 28 11 4 [IMesPd(NQ)]2 (4) 81 76 5 [IPrPd(NQ)]2 (5) 77 63 6 [IPrPd(NQ)]2 (5)/dvds 40 2 7 Pd(OAc)2/IPrHCl 88 73 8 Pd(OAc)2/IMesHCl 80 70 9 Pd(OAc)2 62 54 10 Pd(dvds) b /IMesHCl 5 <1 11 Pd(dvds) b 8 <1 12 Pd(OAc)2/BuPAd2 100 99 13 Pd(OAc)2/o-biph-PCy2 99 85 14 Pd(OAc)2/PtBu3 100 99 Reaction conditions: 2mmol 4-bromoanisole, 3mmol phenylboronic acid, 4mmol Cs2CO3, 6ml dioxane, 3mol% [Pd], 3mol% ligand (precursor), 80°C, 2h. a Conversion and yield were determined by GC using an internal standard (diethyleneglycol di-n-butylether). b Solution of Pd(0) in dvds (ca. 8wt.% Pd). Table 2 Testing of different catalysts in the phenylation of aryl chlorides. Entry Substrate Catalyst Conversion (%) Yield (%) 1 IprPd(dvds) 77 67 2 IprPd(dvds)/NQ 35 18 3 IMesPd(dvds) 8 2 4 [IPrPd(NQ)]2 96 90 5 [IPrPd(NQ)]2/dvds 24 4 6 [IMesPd(NQ)]2 94 85 7 Pd(OAc)2/BuPAd2 12 5 8 Pd(OAc)2/o-biph-PCy2 78 15 9 Pd(OAc)2/PtBu3 15 <1 10 IprPd(dvds) 21 6 11 IMesPd(dvds) 3 1 12 [IPrPd(NQ)]2 100 97 13 [IMesPd(NQ)]2 36 31 14 Pd(OAc)2/BuPAd2 3 3 15 Pd(OAc)2/o-biph-PCy2 95 94 16 Pd(OAc)2/PtBu3 <1 0 17 IprPd(dvds) 29 16 18 IMesPd(dvds) 23 <1 19 [IPrPd(NQ)]2 80 72 20 [IMesPd(NQ)]2 22 9 21 Pd(OAc)2/BuPAd2 3 <1 22 Pd(OAc)2/o-biph-PCy2 76 67 23 Pd(OAc)2/PtBu3 4 0 24 IprPd(dvds) 58 42 25 IMesPd(dvds) 26 5 26 [IPrPd(NQ)]2 99 97 27 [IMesPd(NQ)]2 99 88 28 Pd(OAc)2 35 12 29 Pd(OAc)2/BuPAd2 99 94 30 Pd(OAc)2/o-biph-PCy2 99 93 31 Pd(OAc)2/PtBu3 83 66 Reaction conditions: 2.0mmol aryl halide, 2.4mmol phenylmagnesium bromide, 2mol% [Pd]; 4mol% ligand, 10ml dioxane, 80°C, 3h. Table 3 Coupling of 4-chloro- and 4-bromoanisole with mesitylamine Entry X [Pd] Ligand Solvent Conversion (%) Yield (%) 1 Br Pd(dba)2 PtBu3 Toluene 100 94 2 Br Pd(dba)2 PtBu3 Dioxane 100 91 3 Br Pd2(dba)3 o-biph-PCy2 Dioxane 100 82 4 Br Pd(dba)2 IMesHCl Dioxane 11 2 5 Br IMesPd(dvds) – Dioxane 4 1 6 Br [IMesPd(BQ)]2 – Dioxane 7 2 7 Br Pd(dba)2 IPrHCl Dioxane 100 89 8 Br IPrPd(dvds) – Dioxane 53 41 9 Cl Pd(dba)2 PtBu3 Toluene 65 64 10 Cl Pd(dba)2 PtBu3 Dioxane 100 93 11 Cl Pd2(dba)3 o-biph-PCy2 Dioxane 97 80 12 Cl Pd2(dba)3 IMesHCl Dioxane 4 0 13 Cl IMesPd(dvds) – Dioxane 6 0 14 Cl [IMesPd(BQ)]2 – Dioxane 10 5 15 Cl Pd2(dba)3 IPrHCl Dioxane 35 33 16 Cl IPrPd(dvds) – Dioxane 7 6 Reaction conditions: 1.0mmol aryl halide, 1.2mmol amine, 3mol% [Pd]; 3mol% ligand, 1.5 Eq. NaOtBu, 60°C, 18h. Table 4 Coupling of 2-chlorotoluene with different amines Entry Amine Pd Ligand Solvent Conversion (%) Yield (%) 1 Pd(dba)2 PtBu3 Dioxane 100 94 2 Pd2(dba)3 o-biph-PCy2 Dioxane 69 65 3 IMesPd(dvds) – Dioxane 7 1 4 [IMesPd(BQ)]2 – Dioxane 76 71 5 Pd2(dba)3 IPrHCl Dioxane 100 96 6 IPrPd(dvds) – Dioxane 6 2 7 Pd(dba)2 PtBu3 Toluene 85 83 8 Pd(dba)2 PtBu3 Dioxane 95 92 9 Pd2(dba)3 o-biph-PCy2 Dioxane 100 71 10 IMesPd(dvds) – Dioxane 3 0 11 [IMesPd(BQ)]2 – Dioxane 86 28 12 Pd2(dba)3 IPrHCl Dioxane 56 46 13 IPrPd(dvds) – Dioxane 30 23 14 CH3(CH2)3NH2 Pd(dba)2 PtBu3 Dioxane 100 94 15 Pd2(dba)3 o-biph-PCy2 Dioxane 93 86 16 IMesPd(dvds) – Dioxane 3 0 17 [IMesPd(BQ)]2 – Dioxane 7 5 18 Pd2(dba)3 IPrHCl Dioxane 10 6 19 IPrPd(dvds) – Dioxane 7 2 Reaction conditions: 1.0mmol aryl halide, 1.2mmol amine, 3mol% [Pd]; 3mol% ligand, 1.5 Eq. NaOtBu, 60°C, 18h. Comparison of palladium carbene and palladium phosphine catalysts for catalytic coupling reactions of aryl halides Anja C Frisch a Alexander Zapf a Oliver Briel b Bernd Kayser b Nadim Shaikh a Matthias Beller a ∗ a Leibniz-Institut für Organische Katalyse an der Universität Rostock e.V., Buchbinderstr. 5–6, 18055 Rostock, Germany b Umicore AG&Co. KG, Rodenbacher Chaussee 4, P.O. 1351, 63403 Hanau-Wolfgang, Germany * Corresponding author. Tel.: +49-381-46693-0; fax: +49-381-46693-24. A comparison of the catalytic performance of different monocarbenepalladium(0) complexes and various so-called in situ palladium phosphine and carbene catalysts in Suzuki, Kumada, and Buchwald–Hartwig amination reactions is presented. In general, phosphine-based catalysts appear to be more efficient for amination and Suzuki reactions of aryl chlorides. On the other hand, the carbene-based palladium catalysts work well in Kumada couplings of various aryl chlorides. Palladium-catalyzed CC and CN bond forming reactions of aryl halides continue to be a major focus in catalysis research for the fine chemical industry. Still there exists a significant need for the development of more active and productive palladium catalysts. Although an increasing number of new catalysts is reported, it is often difficult to compare them. Here, we present a more detailed comparison of the catalytic performance of different monocarbenepalladium(0) complexes and various so-called in situ palladium phosphine and carbene catalysts in Suzuki, Kumada, and Buchwald–Hartwig amination reactions. Depending on the type of coupling reaction good to excellent yields of the desired products are obtained in the presence of both carbene- and phosphine-based catalysts. In general, phosphine-based catalysts appear to be more efficient for amination and Suzuki reactions of aryl chlorides. On the other hand, the carbene-based palladium catalysts work well in Kumada couplings of various aryl chlorides. Keywords Aryl halides Carbene ligands Homogeneous catalysis Palladium Phosphine ligands 1 Introduction More than 80% of all current pharmaceuticals contain aromatic or heteroaromatic units as integral part of their structure [1]. It is estimated that a similar amount of agrochemicals possess aryl or heteroaryl groups. Therefore, the refinement of aryl halides is of major importance for the synthesis of organic building blocks and new active agents. Due to their generality especially palladium-catalyzed coupling reactions of arylX derivatives, such as the Suzuki [2–4], Heck [5,6], and Kumada reaction [7], as well as the Buchwald–Hartwig amination [8] offer opportunities for the synthesis of substituted arenes. Interestingly, applying these reactions an environmentally more friendly production of pharmaceuticals and agrochemicals is often possible due to the minimization of steps compared to classical organic syntheses. Advantageously, the starting materials are readily available and the palladium catalysts show a broad tolerance towards various functional groups. Despite these advantages until recently relatively few industrial applications have been realized [9–11]. This may be explained partly by the low catalyst efficiency in a number of interesting coupling reactions. Often comparably large amounts (>5mol%) of a certain palladium pre-catalyst have to be used in order to obtain optimal yields in these reactions. Hence, catalyst costs dominate raw material costs. Furthermore, it is more difficult in these cases to keep the palladium content below 1ppm in pharmaceutical and agrochemical end products. Although examples of highly productive palladium catalysts for coupling reactions are known [12–27], the development of new catalysts is an actual goal in organometallic chemistry and homogeneous catalysis. In addition to phosphine-based catalysts in the last 5 years heterogeneous catalysts [28] and especially palladium carbene complexes have evolved as new catalysts for Heck [29], Suzuki [30,31], and Sonogashira coupling reactions [32], and amination of aryl halides [31,33]. Critical for the catalyst activity in the above-mentioned coupling reactions is the easy formation of low-coordinated palladium(0) complexes under reaction conditions. At best a palladium(0) pre-catalyst should be used, which generates a defined low-coordinated 14e− or 16e− palladium complex at low temperature (<50°C). Thus, we [34] and others [35–39] have studied palladium-catalyzed coupling reactions of aryl halides in the presence of defined low-coordinated palladium phosphine complexes. These catalysts show often higher activity under milder conditions compared to so-called in situ palladium catalysts, which consist of mixtures of Pd(0) or Pd(II) compounds and strongly binding phosphine or carbene ligands. Examples of defined stable monocarbenepalladium(0) complexes (1–5) which have been developed recently by us are shown in Fig. 1 [40]. Here, as additional stabilizing ligand 1,1,3,3-tetramethyl-1,3-divinyldisiloxane (dvds), benzoquinone (BQ) or naphthoquinone (NQ) are used. These complexes have been demonstrated to be suitable catalysts for coupling reactions of aryldiazonium salts [40], aryl chlorides [41], and telomerization reactions [13,42]. In order to further explore the catalytic potential of this class of catalysts, we became interested in a comparison of these complexes with state-of-the-art in situ palladium phosphine and palladium carbene catalysts for different CC and CN coupling reactions. Despite the interest in palladium carbene and palladium phosphine catalysts so far no detailed comparison of these catalysts for different coupling processes has been described. Thus, in this paper we report on the use of defined monocarbenepalladium(0) complexes in Suzuki, Kumada, and Buchwald–Hartwig amination reactions of aryl halides. For the first time a direct comparison of the catalyst performance with different in situ palladium phosphine and carbene catalysts for these three important coupling reactions is shown. 2 Results and discussion 2.1 Suzuki reactions of aryl halides The cross-coupling reaction of aryl halides and arylboronic acids (Suzuki reaction) is the most versatile and important method for the synthesis of substituted biaryls. This class of compounds constitutes important building blocks for the synthesis of biologically active substances, e.g. pharmaceuticals, such as the sartan family of drugs for high blood pressure [43,44] and herbicides [45]. Additionally, biaryls have found application as chiral ligands for catalysis [46] and in material science, e.g. as liquid crystals [47]. Recently, Suzuki cross-coupling reactions of aryl chlorides catalyzed by different palladium/phosphine systems have been extensively studied in organic synthesis due to the economically attractive nature of the starting materials [48]. Notable advancements using carbenes as ligands for this reaction have been reported especially by Nolan and co-workers [31,49,50]. Although most of our catalytic studies focused on aryl chlorides as substrates (see below), we started our investigation with the coupling of 4-bromoanisole (a deactivated bromoarene) and phenylboronic acid (Scheme 1 ). Table 1 summarizes the results obtained in the presence of 1, 2, 4, and 5 and different in situ catalyst systems. The isolated Pd(0) carbene complexes 1, 2, 4, and 5 show results (Table 1, entries 1, 2, 4, 5) similar to those of the corresponding in situ Pd(OAc)2/ligand systems (Table 1, entries 7, 8; 63–76% yield). Due to the relatively easy oxidative addition step (in comparison to aryl chlorides) even without ligand, with simple Pd(OAc)2, 4-methoxybiphenyl is obtained in 54% yield (Table 1, entry 9). In contrast, in the presence of additional olefinic ligands (Table 1, entries 3, 6) or by using Pd(dvds) solution (Table 1, entries 10, 11) the catalyst activity breaks down, regardless of the presence of carbene ligand. This observation indicates a strong binding of the olefinic groups to the palladium center, thereby blocking the required free coordination sites. In addition, the olefin reduces the electron density on the Pd center by backdonation from the metal to the olefin, which decreases the activity for oxidative addition into the CBr bond. Interestingly, an increase in the catalyst productivity is observed upon changing from a carbene-based to a phosphine-based catalyst system. Thus, sterically hindered basic phosphine ligands, such as BuPAd2, o-biph-PCy2, and PtBu3 led to improved yields of 4-methoxybiphenyl (Table 1, entries 12–14; 81–99% yield). Next, the Suzuki reaction of 4-chlorotoluene and phenylboronic acid was studied in more detail (Scheme 2 ). In addition to the variation of catalysts, also solvents (toluene, dioxane), ligands (PCy3, PtBu3, IMes, IPr) and bases (K3PO4, K3PO4·H2O, KOtBu, Cs2CO3) have been changed and tested at different reaction temperatures (80–100°C) and reaction times (2–20h). This optimization study revealed that best results are obtained in the presence of Pd(II)/phosphine systems. Here, Pd(OAc)2/PtBu3 (0.1mol%) or Pd(OAc)2/BuPAd2 (0.1mol%) with K3PO4 as the base gave yields >90% of 4-methylbiphenyl at 100°C after 20h. Using 1,3-dimesitylimidazol-2-ylidene (IMes) as carbene ligand 4-methylbiphenyl was found in 51% yield (Cs2CO3, dioxane, 3mol% Pd(OAc)2/IMes, 80°C, 2h). Surprisingly, the reproducibility of the same reaction in the presence of IMesHCl was very low. Fig. 2 shows the results of the Suzuki reaction of 3-chloropyridine, 4-chlorotoluene, 4-chloroanisole, and 1-chloro-2-fluorobenzene with phenylboronic acid. Here, we compared different catalysts applying the conditions, which have been optimized for the Pd(OAc)2/IMes system. In general, three sets of catalyst systems (Fig. 2 from left to right: monocarbenepalladium(0) complexes, in situ Pd(II)/carbene, and in situ Pd(II)/phosphine) were tested under the same conditions. While the dvds-derived monocarbenepalladium(0) complexes exhibited only very low activity, the quinone-bridged palladium catalyst precursors gave moderate yields with non-activated and deactivated aryl chlorides and good yields with slightly activated 1-chloro-2-fluorobenzene. The results depicted in Fig. 2 clearly demonstrate the significantly higher productivity of the carbenepalladium(NQ) complexes compared to the carbenepalladium(dvds) complexes. As reference systems, phospine-based in situ systems (BuPAd2, o-biph-PCy2, PtBu3) were also tested. It is important to note that in general in Suzuki reactions the palladium phosphine catalyst systems can be applied at 1–2 orders of magnitude lower concentration compared to the palladium carbene catalysts (but generally with a phosphine/palladium ratio of 2:1). Thus, palladium/phosphine catalysts seem to be more suited for this reaction. 2.2 Kumada coupling of aryl chlorides A more direct route to biphenyls compared to the Suzuki reaction is the palladium-catalyzed coupling of aryl halides with aryl Grignard reagents (Kumada reaction) [7]. Here, the additional step for preparation of the “intermediate” boronic acid derivatives is not required (Scheme 3 ). However, the application of Grignard reagents instead of boronic acids results in some disadvantages: Grignard compounds are not stable to moisture and air, and cannot be stored for a long time. In addition, they tend to give side-reactions with a number of functional groups at room temperature or above. Furthermore, only a limited number of Grignard reagents is commercially available. Nevertheless, the advantage of short-cutting the synthesis of biaryls surpasses these disadvantages in many cases. Although the Kumada reaction has been developed as one of the first cross-coupling reactions in 1972 [51,52], significant progress in the coupling of aryl chlorides in the presence of palladium catalysts has only been achieved very recently by Nolan [53]. Here, sterically demanding carbene ligands were crucial for good conversion of electron neutral and electron rich chloroarenes. For comparison of different catalyst systems we tested four monocarbenepalladium(0) olefin complexes and three palladium(II) phosphine systems in the coupling of different aryl chlorides and 4-bromoanisole with phenylmagnesium bromide (Table 2 ). Among the carbene systems tested, highest yields were obtained with [IPrPd(NQ)]2 (72–97% yield). IMes instead of IPr resulted in slightly to significantly lower yields. Again, in most cases Pd(dvds) complexes showed low catalytic activity. Apparently the strong binding of the two vinyl groups to the Pd center blocks the catalyst and retards the oxidative addition reaction. Upon addition of NQ to IPrPd(dvds) the yield of coupling product is further decreased. Also in the inverse case of adding dvds to [IPrPd(NQ)]2 only low product yields (<10%) are observed. To our surprise, only carbene complexes gave satisfactory results in the coupling reaction of 1-chloro-2-fluorobenzene (Table 2, entries 1–9). Here, even the IPrPd(dvds) complex, which proved inactive in most of our studies, afforded the biaryl coupling product in good yields. Apart from the 2-(dicyclohexylphosphino)biphenyl/Pd(OAc)2 system, which showed good performance in the coupling reactions of 4-chlorotoluene and 4-chloroanisole, phosphine-based in situ catalyst systems exhibited far inferior activity under these conditions. When changing from chloroarenes to 4-bromoanisole all catalysts tested, except for the dvds-derived complexes, gave moderate to good results in the Kumada coupling with PhMgBr. 2.3 Catalytic amination of aryl halides Aromatic amines constitute important substructures in natural products as well as in industrially produced bulk and fine chemicals [54]. Interest in palladium-catalyzed CN coupling reactions has grown constantly during the last years [8,33,55–69]. Important contributions to the development of the methodology came especially from the groups of Buchwald and Hartwig (Buchwald–Hartwig amination) [57–67]. Nowadays, a large variety of primary and secondary amines can be used as substrates for the palladium-catalyzed coupling of different aryl halides in the presence of stoichiometric amounts of a strong base. As amination reactions are sensitive to electronic and steric changes in the substrates, we have chosen five different test reactions for the comparison of our catalyst systems. First, the coupling of 4-chloro- and 4-bromoanisole with mesitylamine was investigated in more detail (Scheme 4 ; Table 3 ). In case of 4-bromoanisole good yields (82–94%) of the corresponding aniline were obtained in toluene or dioxane in the presence of in situ catalysts consisting of Pd(dba)2 and carbene or phosphine ligands (Table 3, entries 1–3, 7). 1,3-Bis(2,6-diisopropylphenyl)imidazol-2-ylidene (IPr) gave much higher product yields compared to 1,3-dimesitylimidazol-2-ylidene (IMes) as carbene ligand (89% versus 2%). The isolated carbene Pd(dvds) complexes are much less active. Again the presence of dvds or BQ significantly retards the catalytic reaction. Even more pronounced are the effects for the coupling of 4-chloroanisole. For this reaction the best results (93%) are obtained in dioxane using Pd(dba)2 and tri-t-butylphosphine as catalyst system. At 60°C, which is a comparatively low reaction temperature for this transformation, the used carbene palladium complexes appear not reactive enough to allow efficient amination of deactivated aryl chlorides. Next, the amination of 2-chlorotoluene with mesitylamine, morpholine, and n-butylamine, respectively, was investigated (Scheme 5 ; Table 4 ). In general, palladium phosphine catalysts seem to be superior compared to the applied palladium carbene systems. Good to excellent product yields (65–94%) were obtained in the presence of PtBu3 or o-biph-PCy2 and Pd2(dba)3 or Pd(dba)2. Surprisingly, the catalyst performance of the Pd2(dba)3/IPrHCl system in the reaction of 2-chlorotoluene with the sterically more demanding mesitylamine turned out to be significantly different from that in the coupling with morpholine or n-butylamine. For the coupling of mesitylamine again IPr gave higher yields compared to IMes. Nevertheless, for this reaction IMes is a suitable ligand, too, if it is applied in form of the benzoquinonepalladium complex. If the analogous Pd(dvds) complex is used, almost no catalytic activity is observed. This shows once more the detrimental effect of dvds as co-ligand. For the coupling of 2-chlorotoluene with morpholine IMes- and IPr-based catalysts gave only moderate yields (23–46%). In the case of [IMesPd(BQ)]2 severe problems with reproducibility arised with exceedingly low selectivity for the amination product. Here, reductive dehalogenation leading to toluene becomes the major reaction pathway. In case of the coupling reaction of the primary amine n-butylamine the four tested carbenepalladium catalysts are not useful at all under our reaction conditions. However, in agreement with previous literature data palladium phosphine catalysts worked well. 3 Conclusions Palladium-catalyzed CC and CN bond forming reactions of aryl chlorides and bromides have been studied in the presence of different palladium complexes. Depending on the type of coupling reaction good to excellent yields of the desired products are obtained in the presence of both carbene- and phosphine-based catalysts. For the first time a more detailed comparison of monocarbenepalladium(0) complexes with in situ generated palladium carbene and palladium phosphine complexes has been done. In general, the presence of dvds significantly retards catalysis in all reactions of aryl chlorides (Suzuki, Kumada, and Buchwald–Hartwig amination). However, some activity of Pd(0)(dvds) complexes is seen in coupling reactions of 4-bromoanisole. Clearly, monocarbenepalladium(0) quinone complexes are superior compared to the corresponding dvds complexes. These complexes are the most general and best catalytic systems in our hand for the Kumada reaction of aryl chlorides. To our surprise the in situ palladium phosphine and carbene catalysts, which consist of mixtures of palladium and ligands, often gave better yields in Suzuki and amination reactions compared to the isolated monocarbenepalladium(0) complexes. Nevertheless, these catalysts might be useful in special cases. It is important to note that the above drawn conclusions are based on the here applied reaction conditions. Although we are convinced that they are generally true, there might be special reaction conditions in which a different order of reactivity will be observed. 4 Experimental Pd(dvds), carbene-Pd(dvds), and carbene-Pd(quinone) complexes are available at Umicore. They can be prepared according to published procedures. All coupling products have been identified by comparison of their GC/MS and NMR data with those of authentic samples. 4.1 Suzuki reaction of aryl halides and phenylboronic acid A 25ml Schlenk tube was charged under an argon atmosphere with the palladium catalyst (3mol%, 0.06mmol), Cs2CO3 (1.30g, 4mmol), and phenylboronic acid (0.37g, 3mmol). Then, dioxane (6ml) and aryl halide (2mmol) were added. The Schlenk tube was placed in a preheated oil bath (80°C). After 2h, the mixture was allowed to cool to r.t. and diluted with aqueous NaOH solution/diethylether (5/10ml). Diethyleneglycol di-n-butylether (0.22g) was added as internal standard for determining the product yields and conversions by GC. For reactions involving in situ systems a preformation of the active catalyst was necessary. 4.1.1 Pd(II) source Sequential addition of imidazolium salt, palladium source, base, and solvent; stir at 80°C for 1h, then add phenylboronic acid and aryl halide. 4.1.2 Pd(0)(dvds) Sequential addition of imidazolium salt, base, and solvent; stir at 80°C for 1h, then add Pd(0)(dvds), phenylboronic acid, and aryl halide. 4.2 Kumada reaction of aryl halides and arylmagnesium bromides A 25ml Schlenk tube was charged under an argon atmosphere with the palladium catalyst (2mol%, 0.04mmol), dioxane (10ml), and aryl halide (2mmol). It was placed in a preheated oil bath (80°C) and the reaction was started by dropwise addition (1min) of arylmagnesium bromide (2.4ml, 2.4mmol, 1.0M in THF) via syringe. After 3h, the mixture was allowed to cool to r.t. and hydrolyzed with diluted aqueous HCl (10ml, 1M). The internal standard diethyleneglycol di-n-butylether (0.22g) and diethylether (10ml) were added and the product yields and conversions were determined by quantitative GC analysis. 4.3 Buchwald–Hartwig amination of aryl halides A Schlenk flask was charged with the catalysts (0.03mmol, 3mol% Pd) and NaOtBu (1.5mmol) under an atmosphere of argon. Then, dioxane (2ml), aryl halide (1.0mmol), and amine (1.2mmol) were added. The reaction mixture was stirred at 60°C for 18h. It was cooled to r.t. and quenched with water (1ml). Diethyleneglycol di-n-butylether (100μl) was added as internal standard followed by diethylether (8ml). The organic layer was analyzed by GC. Acknowledgements We thank the Fonds der Chemischen Industrie (FCI) for general support of this work. Prof. Dr. M. Michalik, Dr. W. Baumann, Mrs. S. Buchholz, and Ms. K. Reincke (all IfOK) are thanked for excellent analytic support. References [1] T. Henkel, R.M. Brunne, H. Müller, F. Reichel, Angew. Chem. 111 (1999) 688; Angew. Chem. Int. Ed. 38 (1999) 643. [2] N Miyaura A Suzuki Chem. Rev. 95 1995 2457 [3] A. Suzuki, in: F. Diederich, P.J. Stang (Eds.), Metal-catalyzed Cross-coupling Reactions, Wiley-VCH, Weinheim, 1997, p. 49. [4] A. Suzuki, in: E.-i. Negishi (Ed.), Organopalladium Chemistry for Organic Synthesis, vol. 1, Wiley-Interscience, New York, 2002, p. 249. [5] E.-i. Negishi (Ed.), Organopalladium Chemistry for Organic Synthesis, vol. 1, Wiley-Interscience, New York, 2002, pp. 1123–1315. [6] N.J Whitcombe K.K Hii S.E Gibson Tetrahedron 57 2001 7449 [7] L. Anastasia, E.-i. Negishi, in: E.-i. Negishi (Ed.), Organopalladium Chemistry for Organic Synthesis, vol. 1, Wiley-Interscience, New York, 2002, p. 311. [8] J.F. Hartwig, in: E.-i. Negishi (Ed.), Organopalladium Chemistry for Organic Synthesis, vol. 1, Wiley-Interscience, New York, 2002, p. 1051. [9] M Beller A Zapf W Mägerlein Chem. Eng. Technol. 24 2001 575 [10] A Zapf M Beller Top. Catal. 19 2002 101 [11] J.G de Vries Can. J. Chem. 79 2001 1086 [12] R.B. Bedford, C.S.J. Cazin, S.L. Hazelwood (née Welch), Angew. Chem. 114 (2002) 4294; Angew. Chem. Int. Ed. 41 (2002) 4120. [13] R. Jackstell, M. Gómez Andreu, A. Frisch, K. Selvakumar, A. Zapf, H. Klein, A. Spannenberg, D. Röttger, O. Briel, R. Karch, M. Beller, Angew. Chem. 114 (2002) 1028; Angew. Chem. Int. Ed. 41 (2002) 986. [14] J.A Loch M Albrecht E Peris J Mata J.W Faller R.H Crabtree Organometallics 21 2002 700 [15] M Feuerstein H Doucet M Santelli Tetrahedron Lett. 42 2001 6667 [16] A. Zapf, A. Ehrentraut, M. Beller, Angew. Chem. 112 (2000) 4315; Angew. Chem. Int. Ed. 39 (2000) 4153. [17] A Zapf M Beller Chem. Eur. J. 6 2000 1830 [18] A.F Littke C Dai G.C Fu J. Am. Chem. Soc. 122 2000 4020 [19] R.B Bedford S.M Draper P.N Scully S.L Welch New J. Chem. 2 2000 745 [20] V.P.W Böhm W.A Herrmann Chem. Eur. J. 6 2000 1017 [21] J.M Fox X Huang A Chieffi S.L Buchwald J. Am. Chem. Soc. 122 2000 1360 [22] M Kawatsura J.F Hartwig J. Am. Chem. Soc. 121 1999 1473 [23] J.P. Wolfe, S.L. Buchwald, Angew. Chem. 111 (1999) 2570; Angew. Chem. Int. Ed. 38 (1999) 2413. [24] J.P Wolfe R.A Singer B.H Yang S.L Buchwald J. Am. Chem. Soc. 121 1999 9550 [25] M Ohff A Ohff M.E van der Boom D Milstein J. Am. Chem. Soc. 119 1997 11687 [26] W.A. Herrmann, M. Elison, J. Fischer, C. Köcher, G.R.J. Artus, Angew. Chem. 107 (1995) 2602; Angew. Chem. Int. Ed. Engl. 34 (1995) 2371. [27] A. Zapf, R. Jackstell, F. Rataboul, T. Riermeier, A. Monsees, C. Fuhrmann, N. Shaikh, U. Dingerdissen, M. Beller, Chem. Commun. (2004) 38. [28] K Köhler L Djakovitch Cat. Today 66 2001 105 [29] W.A Herrmann K Öfele D von Preysing S.K Schneider J. Organomet. Chem. 687 2003 229 [30] C.W.K. Gstöttmayr, V.P.W. Böhm, E. Herdtweck, M. Grosche, W.A. Herrmann, Angew. Chem. 114 (2002) 1421; Angew. Chem. Int. Ed. Engl. 34 (1995) 1348. [31] A.C Hillier G.A Grasa M.S Viciu H.M Lee C Yang S.P Nolan J. Organomet. Chem. 653 2002 69 [32] Y Ma C Song W Jiang Q Wu Y Wang X Liu M.B Andrus Org. Lett. 5 2003 3317 [33] S.R Stauffer S Lee J.P Stambuli S.I Hauck J.F Hartwig Org. Lett. 2 2000 1423 [34] M. Gómez Andreu, A. Zapf, M. Beller, Chem. Commun. (2000) 2475. [35] C Dai G.C Fu J. Am. Chem. Soc. 123 2001 2719 [36] P. Stambuli, R. Kuwano, J.F. Hartwig, Angew. Chem. 114 (2002) 4940; Angew. Chem. Int. Ed. 41 (2002) 4746. [37] D Zim S.L Buchwald Org. Lett. 5 2003 2413 [38] G.Y Li J. Org. Chem. 67 2002 3643 [39] A. Schnyder, A.F. Indolese, M. Studer, H.-U. Blaser, Angew. Chem. 114 (2002) 3820; Angew. Chem. Int. Ed. 41 (2002) 3668. [40] K Selvakumar A Zapf A Spannenberg M Beller Chem. Eur. J. 8 2002 3901 [41] K Selvakumar A Zapf M Beller Org. Lett. 4 2002 3031 [42] R Jackstell A Frisch M Beller D Röttger M Malaun B Bildstein J. Mol. Catal. 185 2002 105 [43] K.L Goa A.J Wagstaff Drugs 51 1996 820 [44] E. Mutschler, Arzneimittelwirkungen, 5th ed., Wissenschaftliche Verlagsgesellschaft GmbH, Stuttgart, 1986. [45] H.-U Blaser A.F Indolese A Schnyder Curr. Sci. 78 2000 1336 [46] J Yin S.L Buchwald J. Am. Chem. Soc. 122 2000 12051 [47] E. Poetsch, Kontakte (1988) 15. [48] A.F. Littke, G.C. Fu, Angew. Chem. 114 (2002) 4350; Angew. Chem. Int. Ed. 41 (2002) 4176. [49] G.A Grasa M.S Viciu J Huang C Zhang M.L Trudell S.P Nolan Organometallics 21 2002 2866 [50] M.S Viciu R.F Germaneau O Navarro-Fernandez E.D Stevens S.P Nolan Organometallics 21 2002 5470 [51] K Tamao K Sumitani M Kumada J. Am. Chem. Soc. 94 1972 4374 [52] R.J.P. Corriu, J.P. Masse, J. Chem. Soc. Chem. Commun. (1972) 144. [53] J Huang S.P Nolan J. Am. Chem. Soc. 121 1999 9889 [54] T.H Riermeier A Zapf M Beller Top. Catal. 4 1997 301 [55] M. Beller, Angew. Chem. 107 (1995) 1436; Angew. Chem. Int. Ed. Engl. 34 (1995) 1316. [56] P.W.N.M van Leeuwen P.C.J Kamer J.N.H Reek R Dierkes Chem. Rev. 100 2000 2741 [57] M.W Hopper M Utsunomiya J.F Hartwig J. Org. Chem. 68 2003 2961 [58] R Kuwano M Utsunomiya J.F Hartwig J. Org. Chem. 67 2002 6479 [59] N Kataoka Q Shelby J.P Stambuli J.F Hartwig J. Org. Chem. 67 2002 5553 [60] M.H Ali S.L Buchwald J. Org. Chem. 66 2001 2560 [61] X.-X Zhang J.P Sadighi T.W Mackewitz S.L Buchwald J. Am. Chem. Soc 122 2000 7606 [62] J.P Wolfe H Tomori J.P Sadighi J Yin S.L Buchwald J. Org. Chem. 65 2000 1158 [63] J.P Wolfe S Wagaw J.-F Marcoux S.L Buchwald Acc. Chem. Res. 31 1998 805 [64] J.F. Hartwig, Angew. Chem. 110 (1998) 2154; Angew. Chem. Int. Ed. 37 (1998) 2047. [65] J.-F Marcoux S Wagaw S.L Buchwald J. Org. Chem. 62 1997 1568 [66] J.F. Hartwig, Synlett (1997) 329. [67] A.S. Guram, R.A. Rennels, S.L. Buchwald, Angew. Chem. 107 (1995) 1456; Angew. Chem. Int. Ed. Engl. 34 (1995) 1348. [68] S Urgaonkar J.-H Xu J.G Verkade J. Org. Chem. 68 2003 8416 [69] L.R. Titcomb, S. Caddick, F.G.N. Cloke, D.J. Wilson, D. McKerrecher, Chem. Commun. (2001) 1388.",
      "scopus-id": "2442490921",
      "coredata": {
        "eid": "1-s2.0-S1381116904000020",
        "dc:description": "Palladium-catalyzed CC and CN bond forming reactions of aryl halides continue to be a major focus in catalysis research for the fine chemical industry. Still there exists a significant need for the development of more active and productive palladium catalysts. Although an increasing number of new catalysts is reported, it is often difficult to compare them. Here, we present a more detailed comparison of the catalytic performance of different monocarbenepalladium(0) complexes and various so-called in situ palladium phosphine and carbene catalysts in Suzuki, Kumada, and Buchwald–Hartwig amination reactions. Depending on the type of coupling reaction good to excellent yields of the desired products are obtained in the presence of both carbene- and phosphine-based catalysts. In general, phosphine-based catalysts appear to be more efficient for amination and Suzuki reactions of aryl chlorides. On the other hand, the carbene-based palladium catalysts work well in Kumada couplings of various aryl chlorides.",
        "openArchiveArticle": "false",
        "prism:coverDate": "2004-06-01",
        "openaccessUserLicense": null,
        "prism:aggregationType": "Journal",
        "prism:url": "https://api.elsevier.com/content/article/pii/S1381116904000020",
        "dc:creator": [
          {
            "@_fa": "true",
            "$": "Frisch, Anja C"
          },
          {
            "@_fa": "true",
            "$": "Zapf, Alexander"
          },
          {
            "@_fa": "true",
            "$": "Briel, Oliver"
          },
          {
            "@_fa": "true",
            "$": "Kayser, Bernd"
          },
          {
            "@_fa": "true",
            "$": "Shaikh, Nadim"
          },
          {
            "@_fa": "true",
            "$": "Beller, Matthias"
          }
        ],
        "link": [
          {
            "@_fa": "true",
            "@rel": "self",
            "@href": "https://api.elsevier.com/content/article/pii/S1381116904000020"
          },
          {
            "@_fa": "true",
            "@rel": "scidir",
            "@href": "https://www.sciencedirect.com/science/article/pii/S1381116904000020"
          }
        ],
        "dc:format": "application/json",
        "openaccessType": null,
        "pii": "S1381-1169(04)00002-0",
        "prism:volume": "214",
        "prism:publisher": "Elsevier B.V.",
        "dc:title": "Comparison of palladium carbene and palladium phosphine catalysts for catalytic coupling reactions of aryl halides",
        "prism:copyright": "Copyright © 2004 Elsevier B.V. All rights reserved.",
        "openaccess": "0",
        "prism:issn": "13811169",
        "prism:issueIdentifier": "2",
        "dcterms:subject": [
          {
            "@_fa": "true",
            "$": "Aryl halides"
          },
          {
            "@_fa": "true",
            "$": "Carbene ligands"
          },
          {
            "@_fa": "true",
            "$": "Homogeneous catalysis"
          },
          {
            "@_fa": "true",
            "$": "Palladium"
          },
          {
            "@_fa": "true",
            "$": "Phosphine ligands"
          }
        ],
        "openaccessArticle": "false",
        "prism:publicationName": "Journal of Molecular Catalysis A: Chemical",
        "prism:number": "2",
        "openaccessSponsorType": null,
        "prism:pageRange": "231-239",
        "prism:endingPage": "239",
        "pubType": "fla",
        "prism:coverDisplayDate": "1 June 2004",
        "prism:doi": "10.1016/j.molcata.2003.12.035",
        "prism:startingPage": "231",
        "dc:identifier": "doi:10.1016/j.molcata.2003.12.035",
        "openaccessSponsorName": null
      },
      "objects": {
        "object": [
          {
            "@category": "thumbnail",
            "@height": "35",
            "@width": "125",
            "@_fa": "true",
            "$": "https://api.elsevier.com/content/object/eid/1-s2.0-S1381116904000020-fx1.sml?httpAccept=%2A%2F%2A",
            "@multimediatype": "GIF image file",
            "@type": "IMAGE-THUMBNAIL",
            "@size": "708",
            "@ref": "fx1",
            "@mimetype": "image/gif"
          },
          {
            "@category": "standard",
            "@height": "104",
            "@width": "376",
            "@_fa": "true",
            "$": "https://api.elsevier.com/content/object/eid/1-s2.0-S1381116904000020-fx1.gif?httpAccept=%2A%2F%2A",
            "@multimediatype": "GIF image file",
            "@type": "IMAGE-DOWNSAMPLED",
            "@size": "3360",
            "@ref": "fx1",
            "@mimetype": "image/gif"
          },
          {
            "@category": "thumbnail",
            "@height": "93",
            "@width": "118",
            "@_fa": "true",
            "$": "https://api.elsevier.com/content/object/eid/1-s2.0-S1381116904000020-gr1.sml?httpAccept=%2A%2F%2A",
            "@multimediatype": "GIF image file",
            "@type": "IMAGE-THUMBNAIL",
            "@size": "2871",
            "@ref": "gr1",
            "@mimetype": "image/gif"
          },
          {
            "@category": "standard",
            "@height": "253",
            "@width": "320",
            "@_fa": "true",
            "$": "https://api.elsevier.com/content/object/eid/1-s2.0-S1381116904000020-gr1.gif?httpAccept=%2A%2F%2A",
            "@multimediatype": "GIF image file",
            "@type": "IMAGE-DOWNSAMPLED",
            "@size": "11041",
            "@ref": "gr1",
            "@mimetype": "image/gif"
          },
          {
            "@category": "thumbnail",
            "@height": "19",
            "@width": "125",
            "@_fa": "true",
            "$": "https://api.elsevier.com/content/object/eid/1-s2.0-S1381116904000020-sc1.sml?httpAccept=%2A%2F%2A",
            "@multimediatype": "GIF image file",
            "@type": "IMAGE-THUMBNAIL",
            "@size": "1342",
            "@ref": "sc1",
            "@mimetype": "image/gif"
          },
          {
            "@category": "standard",
            "@height": "44",
            "@width": "293",
            "@_fa": "true",
            "$": "https://api.elsevier.com/content/object/eid/1-s2.0-S1381116904000020-sc1.gif?httpAccept=%2A%2F%2A",
            "@multimediatype": "GIF image file",
            "@type": "IMAGE-DOWNSAMPLED",
            "@size": "2714",
            "@ref": "sc1",
            "@mimetype": "image/gif"
          },
          {
            "@category": "thumbnail",
            "@height": "21",
            "@width": "125",
            "@_fa": "true",
            "$": "https://api.elsevier.com/content/object/eid/1-s2.0-S1381116904000020-sc2.sml?httpAccept=%2A%2F%2A",
            "@multimediatype": "GIF image file",
            "@type": "IMAGE-THUMBNAIL",
            "@size": "1256",
            "@ref": "sc2",
            "@mimetype": "image/gif"
          },
          {
            "@category": "standard",
            "@height": "39",
            "@width": "230",
            "@_fa": "true",
            "$": "https://api.elsevier.com/content/object/eid/1-s2.0-S1381116904000020-sc2.gif?httpAccept=%2A%2F%2A",
            "@multimediatype": "GIF image file",
            "@type": "IMAGE-DOWNSAMPLED",
            "@size": "1957",
            "@ref": "sc2",
            "@mimetype": "image/gif"
          },
          {
            "@category": "thumbnail",
            "@height": "94",
            "@width": "108",
            "@_fa": "true",
            "$": "https://api.elsevier.com/content/object/eid/1-s2.0-S1381116904000020-gr2.sml?httpAccept=%2A%2F%2A",
            "@multimediatype": "GIF image file",
            "@type": "IMAGE-THUMBNAIL",
            "@size": "3455",
            "@ref": "gr2",
            "@mimetype": "image/gif"
          },
          {
            "@category": "standard",
            "@height": "243",
            "@width": "280",
            "@_fa": "true",
            "$": "https://api.elsevier.com/content/object/eid/1-s2.0-S1381116904000020-gr2.gif?httpAccept=%2A%2F%2A",
            "@multimediatype": "GIF image file",
            "@type": "IMAGE-DOWNSAMPLED",
            "@size": "12961",
            "@ref": "gr2",
            "@mimetype": "image/gif"
          },
          {
            "@category": "thumbnail",
            "@height": "60",
            "@width": "125",
            "@_fa": "true",
            "$": "https://api.elsevier.com/content/object/eid/1-s2.0-S1381116904000020-sc3.sml?httpAccept=%2A%2F%2A",
            "@multimediatype": "GIF image file",
            "@type": "IMAGE-THUMBNAIL",
            "@size": "1817",
            "@ref": "sc3",
            "@mimetype": "image/gif"
          },
          {
            "@category": "standard",
            "@height": "162",
            "@width": "340",
            "@_fa": "true",
            "$": "https://api.elsevier.com/content/object/eid/1-s2.0-S1381116904000020-sc3.gif?httpAccept=%2A%2F%2A",
            "@multimediatype": "GIF image file",
            "@type": "IMAGE-DOWNSAMPLED",
            "@size": "5152",
            "@ref": "sc3",
            "@mimetype": "image/gif"
          },
          {
            "@category": "thumbnail",
            "@height": "93",
            "@width": "105",
            "@_fa": "true",
            "$": "https://api.elsevier.com/content/object/eid/1-s2.0-S1381116904000020-fx2.sml?httpAccept=%2A%2F%2A",
            "@multimediatype": "GIF image file",
            "@type": "IMAGE-THUMBNAIL",
            "@size": "1107",
            "@ref": "fx2",
            "@mimetype": "image/gif"
          },
          {
            "@category": "standard",
            "@height": "396",
            "@width": "446",
            "@_fa": "true",
            "$": "https://api.elsevier.com/content/object/eid/1-s2.0-S1381116904000020-fx2.gif?httpAccept=%2A%2F%2A",
            "@multimediatype": "GIF image file",
            "@type": "IMAGE-DOWNSAMPLED",
            "@size": "3280",
            "@ref": "fx2",
            "@mimetype": "image/gif"
          },
          {
            "@category": "thumbnail",
            "@height": "73",
            "@width": "125",
            "@_fa": "true",
            "$": "https://api.elsevier.com/content/object/eid/1-s2.0-S1381116904000020-fx3.sml?httpAccept=%2A%2F%2A",
            "@multimediatype": "GIF image file",
            "@type": "IMAGE-THUMBNAIL",
            "@size": "962",
            "@ref": "fx3",
            "@mimetype": "image/gif"
          },
          {
            "@category": "standard",
            "@height": "338",
            "@width": "576",
            "@_fa": "true",
            "$": "https://api.elsevier.com/content/object/eid/1-s2.0-S1381116904000020-fx3.gif?httpAccept=%2A%2F%2A",
            "@multimediatype": "GIF image file",
            "@type": "IMAGE-DOWNSAMPLED",
            "@size": "3063",
            "@ref": "fx3",
            "@mimetype": "image/gif"
          },
          {
            "@category": "thumbnail",
            "@height": "66",
            "@width": "125",
            "@_fa": "true",
            "$": "https://api.elsevier.com/content/object/eid/1-s2.0-S1381116904000020-fx4.sml?httpAccept=%2A%2F%2A",
            "@multimediatype": "GIF image file",
            "@type": "IMAGE-THUMBNAIL",
            "@size": "912",
            "@ref": "fx4",
            "@mimetype": "image/gif"
          },
          {
            "@category": "standard",
            "@height": "44",
            "@width": "84",
            "@_fa": "true",
            "$": "https://api.elsevier.com/content/object/eid/1-s2.0-S1381116904000020-fx4.gif?httpAccept=%2A%2F%2A",
            "@multimediatype": "GIF image file",
            "@type": "IMAGE-DOWNSAMPLED",
            "@size": "650",
            "@ref": "fx4",
            "@mimetype": "image/gif"
          },
          {
            "@category": "thumbnail",
            "@height": "64",
            "@width": "125",
            "@_fa": "true",
            "$": "https://api.elsevier.com/content/object/eid/1-s2.0-S1381116904000020-fx5.sml?httpAccept=%2A%2F%2A",
            "@multimediatype": "GIF image file",
            "@type": "IMAGE-THUMBNAIL",
            "@size": "989",
            "@ref": "fx5",
            "@mimetype": "image/gif"
          },
          {
            "@category": "standard",
            "@height": "45",
            "@width": "87",
            "@_fa": "true",
            "$": "https://api.elsevier.com/content/object/eid/1-s2.0-S1381116904000020-fx5.gif?httpAccept=%2A%2F%2A",
            "@multimediatype": "GIF image file",
            "@type": "IMAGE-DOWNSAMPLED",
            "@size": "707",
            "@ref": "fx5",
            "@mimetype": "image/gif"
          },
          {
            "@category": "thumbnail",
            "@height": "28",
            "@width": "125",
            "@_fa": "true",
            "$": "https://api.elsevier.com/content/object/eid/1-s2.0-S1381116904000020-sc4.sml?httpAccept=%2A%2F%2A",
            "@multimediatype": "GIF image file",
            "@type": "IMAGE-THUMBNAIL",
            "@size": "1367",
            "@ref": "sc4",
            "@mimetype": "image/gif"
          },
          {
            "@category": "standard",
            "@height": "68",
            "@width": "302",
            "@_fa": "true",
            "$": "https://api.elsevier.com/content/object/eid/1-s2.0-S1381116904000020-sc4.gif?httpAccept=%2A%2F%2A",
            "@multimediatype": "GIF image file",
            "@type": "IMAGE-DOWNSAMPLED",
            "@size": "2943",
            "@ref": "sc4",
            "@mimetype": "image/gif"
          },
          {
            "@category": "thumbnail",
            "@height": "23",
            "@width": "125",
            "@_fa": "true",
            "$": "https://api.elsevier.com/content/object/eid/1-s2.0-S1381116904000020-sc5.sml?httpAccept=%2A%2F%2A",
            "@multimediatype": "GIF image file",
            "@type": "IMAGE-THUMBNAIL",
            "@size": "1348",
            "@ref": "sc5",
            "@mimetype": "image/gif"
          },
          {
            "@category": "standard",
            "@height": "41",
            "@width": "225",
            "@_fa": "true",
            "$": "https://api.elsevier.com/content/object/eid/1-s2.0-S1381116904000020-sc5.gif?httpAccept=%2A%2F%2A",
            "@multimediatype": "GIF image file",
            "@type": "IMAGE-DOWNSAMPLED",
            "@size": "2107",
            "@ref": "sc5",
            "@mimetype": "image/gif"
          },
          {
            "@category": "thumbnail",
            "@height": "94",
            "@width": "77",
            "@_fa": "true",
            "$": "https://api.elsevier.com/content/object/eid/1-s2.0-S1381116904000020-fx6.sml?httpAccept=%2A%2F%2A",
            "@multimediatype": "GIF image file",
            "@type": "IMAGE-THUMBNAIL",
            "@size": "808",
            "@ref": "fx6",
            "@mimetype": "image/gif"
          },
          {
            "@category": "standard",
            "@height": "640",
            "@width": "526",
            "@_fa": "true",
            "$": "https://api.elsevier.com/content/object/eid/1-s2.0-S1381116904000020-fx6.gif?httpAccept=%2A%2F%2A",
            "@multimediatype": "GIF image file",
            "@type": "IMAGE-DOWNSAMPLED",
            "@size": "4440",
            "@ref": "fx6",
            "@mimetype": "image/gif"
          },
          {
            "@category": "thumbnail",
            "@height": "93",
            "@width": "47",
            "@_fa": "true",
            "$": "https://api.elsevier.com/content/object/eid/1-s2.0-S1381116904000020-fx7.sml?httpAccept=%2A%2F%2A",
            "@multimediatype": "GIF image file",
            "@type": "IMAGE-THUMBNAIL",
            "@size": "588",
            "@ref": "fx7",
            "@mimetype": "image/gif"
          },
          {
            "@category": "standard",
            "@height": "524",
            "@width": "266",
            "@_fa": "true",
            "$": "https://api.elsevier.com/content/object/eid/1-s2.0-S1381116904000020-fx7.gif?httpAccept=%2A%2F%2A",
            "@multimediatype": "GIF image file",
            "@type": "IMAGE-DOWNSAMPLED",
            "@size": "2416",
            "@ref": "fx7",
            "@mimetype": "image/gif"
          }
        ]
      },
      "link": {
        "@rel": "abstract",
        "@href": "https://api.elsevier.com/content/abstract/scopus_id/2442490921"
      }
    }
  }
}