{
  "metadata": {
    "title": "Copper(II) chloride-catalyzed oxidative carbonylation of glycerol to glycerol carbonate",
    "authors": "; ; ",
    "journal": "Journal of Molecular Catalysis A: Chemical",
    "date": "2014-01-31",
    "doi": "10.1016/j.molcata.2013.10.006",
    "abstract": "",
    "uri": "https://api.elsevier.com/content/article/pii/S1381116913003786",
    "pii": "S1381116913003786"
  },
  "fulltext": {
    "full-text-retrieval-response": {
      "scopus-eid": "2-s2.0-84887081300",
      "originalText": "serial JL 271358 291210 291744 291790 291809 31 Journal of Molecular Catalysis A: Chemical JOURNALMOLECULARCATALYSISACHEMICAL 2013-10-19 2013-10-19 2013-11-24T12:45:58 1-s2.0-S1381116913003786 S1381-1169(13)00378-6 S1381116913003786 10.1016/j.molcata.2013.10.006 S300 S300.1 FULL-TEXT 1-s2.0-S1381116913X00123 2015-05-15T05:56:33.63776-04:00 0 0 20140101 20140131 2014 2013-10-19T00:00:00Z articleinfo crossmark dco dateupdated tomb dateloaded datesearch indexeddate volumelist yearnav absattachment articletitlenorm authfirstinitialnorm authfirstsurnamenorm cid cids contenttype copyright dateloadedtxt docsubtype doctype doi eid ewtransactionid hubeid issn issnnorm itemstage itemtransactionid itemweight openaccess openarchive pg pgfirst pglast pii piinorm pubdateend pubdatestart pubdatetxt pubyr sortorder srctitle srctitlenorm srctype subheadings suppl volfirst volissue webpdf webpdfpagecount figure table body acknowledge affil articletitle auth authfirstini authfull authkeywords authlast highlightsabst primabst ref specialabst alllist content subj ssids 1381-1169 13811169 true 381 381 C Volume 381 15 99 106 99 106 201401 January 2014 2014-01-01 2014-01-31 2014 article fla Copyright © 2013 Elsevier B.V. All rights reserved. COPPERIICHLORIDECATALYZEDOXIDATIVECARBONYLATIONGLYCEROLGLYCEROLCARBONATE CASIELLO M 1 Introduction 2 Experimental 2.1 Safety advice 2.2 Catalytic tests 2.3 Derivatization of the reaction products 2.4 Catalyst stability and scale-up 2.5 Carbonylation mechanism: reductive step 2.6 XPS characterization of the copper based pale green precipitate 3 Results and discussion 3.1 General 3.2 Catalyst stability and scale-up 3.3 Mechanistic insights 4 Conclusions Acknowledgements References JOHNSON 2007 338 348 D PAGLIARO 2007 4434 4440 M SEEMANN 2011 L 45THINTERNATIONALPETROLEUMCONFERENCE BEHR 2008 13 30 J KOVVALI 2002 2287 2295 S PLASMAN 2005 30 33 V ROUSSEAU 2009 8571 8581 J OCHOAGOMEZ 2009 315 324 J KIM 2007 75 78 S ROKICKI 2005 529 539 G GEORGE 2009 1 7 J ARESTA 2006 149 153 M WHITEOAK 2013 1228 1231 J CLIMENT 2010 140 149 M KOSSEV 2003 11 18 K HU 2010 188 193 J HU 2011 1767 1772 J CHUANG 2002 S LI 2004 542 546 F LIU 2011 616 621 D WU 2013 1 35 X GABRIELE 2012 6825 6839 B DELLEDONNE 2001 241 251 D GABRIELE 2009 7330 7332 B CALO 2005 5458 5466 V PEARSON 2011 3007 3013 D GABRIELE 2011 1778 1786 B DORO 2011 292 295 F GIANNOCCARO 2012 162 171 P TAM 1986 2977 2981 W GIANNOCCARO 2010 78 84 P DIAZ 2006 734 738 D QIAN 2002 4086 4092 F GABRIELE 2004 4741 4750 B GIANNOCCARO 1991 251 258 P ROMANO 1980 396 403 U MIZUNO 2010 99 102 T CANHOTA 2008 182 185 F ONDREJOVIC 1977 1047 1053 G BARTISH 1978 772 793 C ENCYCLOPEDIACHEMICALTECHNOLOGYVOL4 BIESINGER 2010 887 898 M WAGNER 2003 C NISTSTANDARDREFERENCEDATABASE20VERSION34 MOULDER 1992 J PERKINELMERCORPORATIONPHYSICALELECTRONICSDIVISION HANDBOOKXRAYPHOTOELECTRONSPECTROSCOPY BEAMSON 1992 G HIGHRESOLUTIONXPSORGANICPOLYMERS CASIELLOX2014X99 CASIELLOX2014X99X106 CASIELLOX2014X99XM CASIELLOX2014X99X106XM item S1381-1169(13)00378-6 S1381116913003786 1-s2.0-S1381116913003786 10.1016/j.molcata.2013.10.006 271358 2013-11-24T08:22:48.192678-05:00 2014-01-01 2014-01-31 1-s2.0-S1381116913003786-main.pdf https://s3.amazonaws.com/prod-ucs-content-store-us-east/content/pii:S1381116913003786/MAIN/application/pdf/7bb90d27c4f45a0fc62bb25c06757125/main.pdf https://s3-eu-west-1.amazonaws.com/prod-ucs-content-store-eu-west/content/pii:S1381116913003786/MAIN/application/pdf/7bb90d27c4f45a0fc62bb25c06757125/main.pdf main.pdf pdf true 1210390 MAIN 8 1-s2.0-S1381116913003786-main_1.png https://s3-eu-west-1.amazonaws.com/prod-ucs-content-store-eu-west/content/pii:S1381116913003786/PREVIEW/image/png/e250c22f3a626d516fd90de08864e0f2/main_1.png https://s3.amazonaws.com/prod-ucs-content-store-us-east/content/pii:S1381116913003786/PREVIEW/image/png/e250c22f3a626d516fd90de08864e0f2/main_1.png main_1.png png 54093 849 656 IMAGE-WEB-PDF 1 1-s2.0-S1381116913003786-gr4_lrg.jpg https://s3.amazonaws.com/prod-ucs-content-store-us-east/content/pii:S1381116913003786/gr4/HIGHRES/image/jpeg/2783620e349638529123b39ff39532b0/gr4_lrg.jpg https://s3-eu-west-1.amazonaws.com/prod-ucs-content-store-eu-west/content/pii:S1381116913003786/gr4/HIGHRES/image/jpeg/2783620e349638529123b39ff39532b0/gr4_lrg.jpg gr4 gr4_lrg.jpg jpg 210265 2120 2001 IMAGE-HIGH-RES 1-s2.0-S1381116913003786-gr3_lrg.jpg https://s3.amazonaws.com/prod-ucs-content-store-us-east/content/pii:S1381116913003786/gr3/HIGHRES/image/jpeg/926096bd469f4779a8e8bdc7aa69c93c/gr3_lrg.jpg https://s3-eu-west-1.amazonaws.com/prod-ucs-content-store-eu-west/content/pii:S1381116913003786/gr3/HIGHRES/image/jpeg/926096bd469f4779a8e8bdc7aa69c93c/gr3_lrg.jpg gr3 gr3_lrg.jpg jpg 105587 1296 1587 IMAGE-HIGH-RES 1-s2.0-S1381116913003786-gr2_lrg.jpg https://s3.amazonaws.com/prod-ucs-content-store-us-east/content/pii:S1381116913003786/gr2/HIGHRES/image/jpeg/2b46cbcdc3282fce9d0295f65e865880/gr2_lrg.jpg https://s3-eu-west-1.amazonaws.com/prod-ucs-content-store-eu-west/content/pii:S1381116913003786/gr2/HIGHRES/image/jpeg/2b46cbcdc3282fce9d0295f65e865880/gr2_lrg.jpg gr2 gr2_lrg.jpg jpg 74664 460 1734 IMAGE-HIGH-RES 1-s2.0-S1381116913003786-gr1_lrg.jpg https://s3.amazonaws.com/prod-ucs-content-store-us-east/content/pii:S1381116913003786/gr1/HIGHRES/image/jpeg/0c19a5802471e0ae745f569e1fbf3629/gr1_lrg.jpg https://s3-eu-west-1.amazonaws.com/prod-ucs-content-store-eu-west/content/pii:S1381116913003786/gr1/HIGHRES/image/jpeg/0c19a5802471e0ae745f569e1fbf3629/gr1_lrg.jpg gr1 gr1_lrg.jpg jpg 310524 2726 1327 IMAGE-HIGH-RES 1-s2.0-S1381116913003786-fx9_lrg.jpg https://s3.amazonaws.com/prod-ucs-content-store-us-east/content/pii:S1381116913003786/fx9/HIGHRES/image/jpeg/c7160ed4edbb23dab5954903db9d15f9/fx9_lrg.jpg https://s3-eu-west-1.amazonaws.com/prod-ucs-content-store-eu-west/content/pii:S1381116913003786/fx9/HIGHRES/image/jpeg/c7160ed4edbb23dab5954903db9d15f9/fx9_lrg.jpg fx9 fx9_lrg.jpg jpg 58529 886 1401 IMAGE-HIGH-RES 1-s2.0-S1381116913003786-fx8_lrg.jpg https://s3.amazonaws.com/prod-ucs-content-store-us-east/content/pii:S1381116913003786/fx8/HIGHRES/image/jpeg/178a800c1622c6332f4a913f86aa961d/fx8_lrg.jpg https://s3-eu-west-1.amazonaws.com/prod-ucs-content-store-eu-west/content/pii:S1381116913003786/fx8/HIGHRES/image/jpeg/178a800c1622c6332f4a913f86aa961d/fx8_lrg.jpg fx8 fx8_lrg.jpg jpg 92162 860 2213 IMAGE-HIGH-RES 1-s2.0-S1381116913003786-fx7_lrg.jpg https://s3.amazonaws.com/prod-ucs-content-store-us-east/content/pii:S1381116913003786/fx7/HIGHRES/image/jpeg/4771a4ef5c62659ae6194db1f3d464c7/fx7_lrg.jpg https://s3-eu-west-1.amazonaws.com/prod-ucs-content-store-eu-west/content/pii:S1381116913003786/fx7/HIGHRES/image/jpeg/4771a4ef5c62659ae6194db1f3d464c7/fx7_lrg.jpg fx7 fx7_lrg.jpg jpg 55721 886 1466 IMAGE-HIGH-RES 1-s2.0-S1381116913003786-fx6_lrg.jpg https://s3.amazonaws.com/prod-ucs-content-store-us-east/content/pii:S1381116913003786/fx6/HIGHRES/image/jpeg/86b04ab7b5c99e167a2c46f76fd841a7/fx6_lrg.jpg https://s3-eu-west-1.amazonaws.com/prod-ucs-content-store-eu-west/content/pii:S1381116913003786/fx6/HIGHRES/image/jpeg/86b04ab7b5c99e167a2c46f76fd841a7/fx6_lrg.jpg fx6 fx6_lrg.jpg jpg 84923 886 1978 IMAGE-HIGH-RES 1-s2.0-S1381116913003786-fx5_lrg.jpg https://s3.amazonaws.com/prod-ucs-content-store-us-east/content/pii:S1381116913003786/fx5/HIGHRES/image/jpeg/7cf42afa74dec7d3eec3cd26ec572043/fx5_lrg.jpg https://s3-eu-west-1.amazonaws.com/prod-ucs-content-store-eu-west/content/pii:S1381116913003786/fx5/HIGHRES/image/jpeg/7cf42afa74dec7d3eec3cd26ec572043/fx5_lrg.jpg fx5 fx5_lrg.jpg jpg 76257 886 1755 IMAGE-HIGH-RES 1-s2.0-S1381116913003786-fx4_lrg.jpg https://s3.amazonaws.com/prod-ucs-content-store-us-east/content/pii:S1381116913003786/fx4/HIGHRES/image/jpeg/c15f757f3d8bbe44542bee786932d20a/fx4_lrg.jpg https://s3-eu-west-1.amazonaws.com/prod-ucs-content-store-eu-west/content/pii:S1381116913003786/fx4/HIGHRES/image/jpeg/c15f757f3d8bbe44542bee786932d20a/fx4_lrg.jpg fx4 fx4_lrg.jpg jpg 56683 886 1223 IMAGE-HIGH-RES 1-s2.0-S1381116913003786-fx3_lrg.jpg https://s3.amazonaws.com/prod-ucs-content-store-us-east/content/pii:S1381116913003786/fx3/HIGHRES/image/jpeg/c5004a656fd02b63f0470acada58045a/fx3_lrg.jpg https://s3-eu-west-1.amazonaws.com/prod-ucs-content-store-eu-west/content/pii:S1381116913003786/fx3/HIGHRES/image/jpeg/c5004a656fd02b63f0470acada58045a/fx3_lrg.jpg fx3 fx3_lrg.jpg jpg 70682 886 1699 IMAGE-HIGH-RES 1-s2.0-S1381116913003786-fx2_lrg.jpg https://s3.amazonaws.com/prod-ucs-content-store-us-east/content/pii:S1381116913003786/fx2/HIGHRES/image/jpeg/8f6b029eed532a18a62ce5d513a88093/fx2_lrg.jpg https://s3-eu-west-1.amazonaws.com/prod-ucs-content-store-eu-west/content/pii:S1381116913003786/fx2/HIGHRES/image/jpeg/8f6b029eed532a18a62ce5d513a88093/fx2_lrg.jpg fx2 fx2_lrg.jpg jpg 33713 250 2213 IMAGE-HIGH-RES 1-s2.0-S1381116913003786-fx17_lrg.jpg https://s3.amazonaws.com/prod-ucs-content-store-us-east/content/pii:S1381116913003786/fx17/HIGHRES/image/jpeg/8345e134026bdc1957391bfe343684a8/fx17_lrg.jpg https://s3-eu-west-1.amazonaws.com/prod-ucs-content-store-eu-west/content/pii:S1381116913003786/fx17/HIGHRES/image/jpeg/8345e134026bdc1957391bfe343684a8/fx17_lrg.jpg fx17 fx17_lrg.jpg jpg 74773 463 2213 IMAGE-HIGH-RES 1-s2.0-S1381116913003786-fx16_lrg.jpg https://s3.amazonaws.com/prod-ucs-content-store-us-east/content/pii:S1381116913003786/fx16/HIGHRES/image/jpeg/9088a7211ef184d9747e0bc664512129/fx16_lrg.jpg https://s3-eu-west-1.amazonaws.com/prod-ucs-content-store-eu-west/content/pii:S1381116913003786/fx16/HIGHRES/image/jpeg/9088a7211ef184d9747e0bc664512129/fx16_lrg.jpg fx16 fx16_lrg.jpg jpg 75862 421 2213 IMAGE-HIGH-RES 1-s2.0-S1381116913003786-fx15_lrg.jpg https://s3.amazonaws.com/prod-ucs-content-store-us-east/content/pii:S1381116913003786/fx15/HIGHRES/image/jpeg/451e8c7bdebfce7ab374bf4545a0ee91/fx15_lrg.jpg https://s3-eu-west-1.amazonaws.com/prod-ucs-content-store-eu-west/content/pii:S1381116913003786/fx15/HIGHRES/image/jpeg/451e8c7bdebfce7ab374bf4545a0ee91/fx15_lrg.jpg fx15 fx15_lrg.jpg jpg 41701 189 2213 IMAGE-HIGH-RES 1-s2.0-S1381116913003786-fx14_lrg.jpg https://s3.amazonaws.com/prod-ucs-content-store-us-east/content/pii:S1381116913003786/fx14/HIGHRES/image/jpeg/6ede87196fc026beeb5fec868a641d98/fx14_lrg.jpg https://s3-eu-west-1.amazonaws.com/prod-ucs-content-store-eu-west/content/pii:S1381116913003786/fx14/HIGHRES/image/jpeg/6ede87196fc026beeb5fec868a641d98/fx14_lrg.jpg fx14 fx14_lrg.jpg jpg 34364 295 2213 IMAGE-HIGH-RES 1-s2.0-S1381116913003786-fx13_lrg.jpg https://s3.amazonaws.com/prod-ucs-content-store-us-east/content/pii:S1381116913003786/fx13/HIGHRES/image/jpeg/0cbd2fb7b0bccad790b689b58a8b819f/fx13_lrg.jpg https://s3-eu-west-1.amazonaws.com/prod-ucs-content-store-eu-west/content/pii:S1381116913003786/fx13/HIGHRES/image/jpeg/0cbd2fb7b0bccad790b689b58a8b819f/fx13_lrg.jpg fx13 fx13_lrg.jpg jpg 32124 235 2213 IMAGE-HIGH-RES 1-s2.0-S1381116913003786-fx12_lrg.jpg https://s3.amazonaws.com/prod-ucs-content-store-us-east/content/pii:S1381116913003786/fx12/HIGHRES/image/jpeg/6538e18aa3e31ef74980df4c88c41df7/fx12_lrg.jpg https://s3-eu-west-1.amazonaws.com/prod-ucs-content-store-eu-west/content/pii:S1381116913003786/fx12/HIGHRES/image/jpeg/6538e18aa3e31ef74980df4c88c41df7/fx12_lrg.jpg fx12 fx12_lrg.jpg jpg 28382 226 2213 IMAGE-HIGH-RES 1-s2.0-S1381116913003786-fx11_lrg.jpg https://s3.amazonaws.com/prod-ucs-content-store-us-east/content/pii:S1381116913003786/fx11/HIGHRES/image/jpeg/e309c71fed49a9c58e28b3a68d1328c0/fx11_lrg.jpg https://s3-eu-west-1.amazonaws.com/prod-ucs-content-store-eu-west/content/pii:S1381116913003786/fx11/HIGHRES/image/jpeg/e309c71fed49a9c58e28b3a68d1328c0/fx11_lrg.jpg fx11 fx11_lrg.jpg jpg 48097 301 2213 IMAGE-HIGH-RES 1-s2.0-S1381116913003786-fx10_lrg.jpg https://s3.amazonaws.com/prod-ucs-content-store-us-east/content/pii:S1381116913003786/fx10/HIGHRES/image/jpeg/c8c289bc4c2e4dc24741bcb602c1bdcd/fx10_lrg.jpg https://s3-eu-west-1.amazonaws.com/prod-ucs-content-store-eu-west/content/pii:S1381116913003786/fx10/HIGHRES/image/jpeg/c8c289bc4c2e4dc24741bcb602c1bdcd/fx10_lrg.jpg fx10 fx10_lrg.jpg jpg 34952 244 2213 IMAGE-HIGH-RES 1-s2.0-S1381116913003786-fx1_lrg.jpg https://s3.amazonaws.com/prod-ucs-content-store-us-east/content/pii:S1381116913003786/fx1/HIGHRES/image/jpeg/e7d86d2da87bdeb9722e27b9cef0d7da/fx1_lrg.jpg https://s3-eu-west-1.amazonaws.com/prod-ucs-content-store-eu-west/content/pii:S1381116913003786/fx1/HIGHRES/image/jpeg/e7d86d2da87bdeb9722e27b9cef0d7da/fx1_lrg.jpg fx1 true fx1_lrg.jpg jpg 68378 432 2213 IMAGE-HIGH-RES 1-s2.0-S1381116913003786-gr4.jpg https://s3.amazonaws.com/prod-ucs-content-store-us-east/content/pii:S1381116913003786/gr4/DOWNSAMPLED/image/jpeg/df677d199933fe5231619754a6b952ab/gr4.jpg https://s3-eu-west-1.amazonaws.com/prod-ucs-content-store-eu-west/content/pii:S1381116913003786/gr4/DOWNSAMPLED/image/jpeg/df677d199933fe5231619754a6b952ab/gr4.jpg gr4 gr4.jpg jpg 26412 479 452 IMAGE-DOWNSAMPLED 1-s2.0-S1381116913003786-gr3.jpg https://s3.amazonaws.com/prod-ucs-content-store-us-east/content/pii:S1381116913003786/gr3/DOWNSAMPLED/image/jpeg/5a410357792ae49e7413d2bbe56afd5b/gr3.jpg https://s3-eu-west-1.amazonaws.com/prod-ucs-content-store-eu-west/content/pii:S1381116913003786/gr3/DOWNSAMPLED/image/jpeg/5a410357792ae49e7413d2bbe56afd5b/gr3.jpg gr3 gr3.jpg jpg 14208 292 358 IMAGE-DOWNSAMPLED 1-s2.0-S1381116913003786-gr2.jpg https://s3.amazonaws.com/prod-ucs-content-store-us-east/content/pii:S1381116913003786/gr2/DOWNSAMPLED/image/jpeg/e7aad7a37c25f1ee73c5cf6f5cf5beed/gr2.jpg https://s3-eu-west-1.amazonaws.com/prod-ucs-content-store-eu-west/content/pii:S1381116913003786/gr2/DOWNSAMPLED/image/jpeg/e7aad7a37c25f1ee73c5cf6f5cf5beed/gr2.jpg gr2 gr2.jpg jpg 9429 104 391 IMAGE-DOWNSAMPLED 1-s2.0-S1381116913003786-gr1.jpg https://s3.amazonaws.com/prod-ucs-content-store-us-east/content/pii:S1381116913003786/gr1/DOWNSAMPLED/image/jpeg/6268d2f6e4bc89cb522f10ce81197256/gr1.jpg https://s3-eu-west-1.amazonaws.com/prod-ucs-content-store-eu-west/content/pii:S1381116913003786/gr1/DOWNSAMPLED/image/jpeg/6268d2f6e4bc89cb522f10ce81197256/gr1.jpg gr1 gr1.jpg jpg 43966 614 299 IMAGE-DOWNSAMPLED 1-s2.0-S1381116913003786-fx9.jpg https://s3.amazonaws.com/prod-ucs-content-store-us-east/content/pii:S1381116913003786/fx9/DOWNSAMPLED/image/jpeg/5714efdb399909322dc60aa540cf9d58/fx9.jpg https://s3-eu-west-1.amazonaws.com/prod-ucs-content-store-eu-west/content/pii:S1381116913003786/fx9/DOWNSAMPLED/image/jpeg/5714efdb399909322dc60aa540cf9d58/fx9.jpg fx9 fx9.jpg jpg 7778 200 316 IMAGE-DOWNSAMPLED 1-s2.0-S1381116913003786-fx8.jpg https://s3.amazonaws.com/prod-ucs-content-store-us-east/content/pii:S1381116913003786/fx8/DOWNSAMPLED/image/jpeg/d14aa69a1c8a87f7e12106769158e468/fx8.jpg https://s3-eu-west-1.amazonaws.com/prod-ucs-content-store-eu-west/content/pii:S1381116913003786/fx8/DOWNSAMPLED/image/jpeg/d14aa69a1c8a87f7e12106769158e468/fx8.jpg fx8 fx8.jpg jpg 12333 194 500 IMAGE-DOWNSAMPLED 1-s2.0-S1381116913003786-fx7.jpg https://s3.amazonaws.com/prod-ucs-content-store-us-east/content/pii:S1381116913003786/fx7/DOWNSAMPLED/image/jpeg/d413f321fb67abead84b545fd1d43e17/fx7.jpg https://s3-eu-west-1.amazonaws.com/prod-ucs-content-store-eu-west/content/pii:S1381116913003786/fx7/DOWNSAMPLED/image/jpeg/d413f321fb67abead84b545fd1d43e17/fx7.jpg fx7 fx7.jpg jpg 7545 200 331 IMAGE-DOWNSAMPLED 1-s2.0-S1381116913003786-fx6.jpg https://s3.amazonaws.com/prod-ucs-content-store-us-east/content/pii:S1381116913003786/fx6/DOWNSAMPLED/image/jpeg/6a0f54f823b32c9bd19d40f8c17d15be/fx6.jpg https://s3-eu-west-1.amazonaws.com/prod-ucs-content-store-eu-west/content/pii:S1381116913003786/fx6/DOWNSAMPLED/image/jpeg/6a0f54f823b32c9bd19d40f8c17d15be/fx6.jpg fx6 fx6.jpg jpg 11484 200 447 IMAGE-DOWNSAMPLED 1-s2.0-S1381116913003786-fx5.jpg https://s3.amazonaws.com/prod-ucs-content-store-us-east/content/pii:S1381116913003786/fx5/DOWNSAMPLED/image/jpeg/f0bd7ddcf5744d471a824bcf26b25260/fx5.jpg https://s3-eu-west-1.amazonaws.com/prod-ucs-content-store-eu-west/content/pii:S1381116913003786/fx5/DOWNSAMPLED/image/jpeg/f0bd7ddcf5744d471a824bcf26b25260/fx5.jpg fx5 fx5.jpg jpg 10440 200 396 IMAGE-DOWNSAMPLED 1-s2.0-S1381116913003786-fx4.jpg https://s3.amazonaws.com/prod-ucs-content-store-us-east/content/pii:S1381116913003786/fx4/DOWNSAMPLED/image/jpeg/7b066ae21b5e1bff880429306afec883/fx4.jpg https://s3-eu-west-1.amazonaws.com/prod-ucs-content-store-eu-west/content/pii:S1381116913003786/fx4/DOWNSAMPLED/image/jpeg/7b066ae21b5e1bff880429306afec883/fx4.jpg fx4 fx4.jpg jpg 7899 200 276 IMAGE-DOWNSAMPLED 1-s2.0-S1381116913003786-fx3.jpg https://s3.amazonaws.com/prod-ucs-content-store-us-east/content/pii:S1381116913003786/fx3/DOWNSAMPLED/image/jpeg/44d51e6654e402056b6bc94df0c620be/fx3.jpg https://s3-eu-west-1.amazonaws.com/prod-ucs-content-store-eu-west/content/pii:S1381116913003786/fx3/DOWNSAMPLED/image/jpeg/44d51e6654e402056b6bc94df0c620be/fx3.jpg fx3 fx3.jpg jpg 9310 200 383 IMAGE-DOWNSAMPLED 1-s2.0-S1381116913003786-fx2.jpg https://s3.amazonaws.com/prod-ucs-content-store-us-east/content/pii:S1381116913003786/fx2/DOWNSAMPLED/image/jpeg/5589667b09487bce2472cf4ba4a9b777/fx2.jpg https://s3-eu-west-1.amazonaws.com/prod-ucs-content-store-eu-west/content/pii:S1381116913003786/fx2/DOWNSAMPLED/image/jpeg/5589667b09487bce2472cf4ba4a9b777/fx2.jpg fx2 fx2.jpg jpg 4983 56 500 IMAGE-DOWNSAMPLED 1-s2.0-S1381116913003786-fx17.jpg https://s3.amazonaws.com/prod-ucs-content-store-us-east/content/pii:S1381116913003786/fx17/DOWNSAMPLED/image/jpeg/afaed983f234c5d581c9f3a7fca2912d/fx17.jpg https://s3-eu-west-1.amazonaws.com/prod-ucs-content-store-eu-west/content/pii:S1381116913003786/fx17/DOWNSAMPLED/image/jpeg/afaed983f234c5d581c9f3a7fca2912d/fx17.jpg fx17 fx17.jpg jpg 10935 105 500 IMAGE-DOWNSAMPLED 1-s2.0-S1381116913003786-fx16.jpg https://s3.amazonaws.com/prod-ucs-content-store-us-east/content/pii:S1381116913003786/fx16/DOWNSAMPLED/image/jpeg/0eb144f350b5ec5126e73cc1332e5eec/fx16.jpg https://s3-eu-west-1.amazonaws.com/prod-ucs-content-store-eu-west/content/pii:S1381116913003786/fx16/DOWNSAMPLED/image/jpeg/0eb144f350b5ec5126e73cc1332e5eec/fx16.jpg fx16 fx16.jpg jpg 10773 95 500 IMAGE-DOWNSAMPLED 1-s2.0-S1381116913003786-fx15.jpg https://s3.amazonaws.com/prod-ucs-content-store-us-east/content/pii:S1381116913003786/fx15/DOWNSAMPLED/image/jpeg/05c610680bb178a5e3923589f2794a4b/fx15.jpg https://s3-eu-west-1.amazonaws.com/prod-ucs-content-store-eu-west/content/pii:S1381116913003786/fx15/DOWNSAMPLED/image/jpeg/05c610680bb178a5e3923589f2794a4b/fx15.jpg fx15 fx15.jpg jpg 6173 43 500 IMAGE-DOWNSAMPLED 1-s2.0-S1381116913003786-fx14.jpg https://s3.amazonaws.com/prod-ucs-content-store-us-east/content/pii:S1381116913003786/fx14/DOWNSAMPLED/image/jpeg/72f293d3e2b5c80ed3c50fe2a3f81af8/fx14.jpg https://s3-eu-west-1.amazonaws.com/prod-ucs-content-store-eu-west/content/pii:S1381116913003786/fx14/DOWNSAMPLED/image/jpeg/72f293d3e2b5c80ed3c50fe2a3f81af8/fx14.jpg fx14 fx14.jpg jpg 4969 67 500 IMAGE-DOWNSAMPLED 1-s2.0-S1381116913003786-fx13.jpg https://s3.amazonaws.com/prod-ucs-content-store-us-east/content/pii:S1381116913003786/fx13/DOWNSAMPLED/image/jpeg/11ee09ac7cf100a53da0d2da9dfa3f1d/fx13.jpg https://s3-eu-west-1.amazonaws.com/prod-ucs-content-store-eu-west/content/pii:S1381116913003786/fx13/DOWNSAMPLED/image/jpeg/11ee09ac7cf100a53da0d2da9dfa3f1d/fx13.jpg fx13 fx13.jpg jpg 4917 53 500 IMAGE-DOWNSAMPLED 1-s2.0-S1381116913003786-fx12.jpg https://s3.amazonaws.com/prod-ucs-content-store-us-east/content/pii:S1381116913003786/fx12/DOWNSAMPLED/image/jpeg/21f719b06673399a754db13c12959716/fx12.jpg https://s3-eu-west-1.amazonaws.com/prod-ucs-content-store-eu-west/content/pii:S1381116913003786/fx12/DOWNSAMPLED/image/jpeg/21f719b06673399a754db13c12959716/fx12.jpg fx12 fx12.jpg jpg 4212 51 500 IMAGE-DOWNSAMPLED 1-s2.0-S1381116913003786-fx11.jpg https://s3.amazonaws.com/prod-ucs-content-store-us-east/content/pii:S1381116913003786/fx11/DOWNSAMPLED/image/jpeg/9e0b880ebb94e5fd0e78a7fec6a551f9/fx11.jpg https://s3-eu-west-1.amazonaws.com/prod-ucs-content-store-eu-west/content/pii:S1381116913003786/fx11/DOWNSAMPLED/image/jpeg/9e0b880ebb94e5fd0e78a7fec6a551f9/fx11.jpg fx11 fx11.jpg jpg 6448 68 500 IMAGE-DOWNSAMPLED 1-s2.0-S1381116913003786-fx10.jpg https://s3.amazonaws.com/prod-ucs-content-store-us-east/content/pii:S1381116913003786/fx10/DOWNSAMPLED/image/jpeg/56afd21f2340e27cf3775f0a943cf5a6/fx10.jpg https://s3-eu-west-1.amazonaws.com/prod-ucs-content-store-eu-west/content/pii:S1381116913003786/fx10/DOWNSAMPLED/image/jpeg/56afd21f2340e27cf3775f0a943cf5a6/fx10.jpg fx10 fx10.jpg jpg 5052 55 500 IMAGE-DOWNSAMPLED 1-s2.0-S1381116913003786-fx1.jpg https://s3.amazonaws.com/prod-ucs-content-store-us-east/content/pii:S1381116913003786/fx1/DOWNSAMPLED/image/jpeg/78f94ff4a28c5516a31d4bee981454c3/fx1.jpg https://s3-eu-west-1.amazonaws.com/prod-ucs-content-store-eu-west/content/pii:S1381116913003786/fx1/DOWNSAMPLED/image/jpeg/78f94ff4a28c5516a31d4bee981454c3/fx1.jpg fx1 true fx1.jpg jpg 10301 98 500 IMAGE-DOWNSAMPLED 1-s2.0-S1381116913003786-gr4.sml https://s3.amazonaws.com/prod-ucs-content-store-us-east/content/pii:S1381116913003786/gr4/THUMBNAIL/image/gif/67c3a6ed5d32013e0dadd8a9bebce8f8/gr4.sml https://s3-eu-west-1.amazonaws.com/prod-ucs-content-store-eu-west/content/pii:S1381116913003786/gr4/THUMBNAIL/image/gif/67c3a6ed5d32013e0dadd8a9bebce8f8/gr4.sml gr4 gr4.sml sml 2871 164 155 IMAGE-THUMBNAIL 1-s2.0-S1381116913003786-gr3.sml https://s3.amazonaws.com/prod-ucs-content-store-us-east/content/pii:S1381116913003786/gr3/THUMBNAIL/image/gif/0e56934f4b0769e34b30dae36b24011f/gr3.sml https://s3-eu-west-1.amazonaws.com/prod-ucs-content-store-eu-west/content/pii:S1381116913003786/gr3/THUMBNAIL/image/gif/0e56934f4b0769e34b30dae36b24011f/gr3.sml gr3 gr3.sml sml 3455 164 201 IMAGE-THUMBNAIL 1-s2.0-S1381116913003786-gr2.sml https://s3.amazonaws.com/prod-ucs-content-store-us-east/content/pii:S1381116913003786/gr2/THUMBNAIL/image/gif/7e5c2d7aa5492bb5f6079a79fe9a6aaf/gr2.sml https://s3-eu-west-1.amazonaws.com/prod-ucs-content-store-eu-west/content/pii:S1381116913003786/gr2/THUMBNAIL/image/gif/7e5c2d7aa5492bb5f6079a79fe9a6aaf/gr2.sml gr2 gr2.sml sml 2454 58 219 IMAGE-THUMBNAIL 1-s2.0-S1381116913003786-gr1.sml https://s3.amazonaws.com/prod-ucs-content-store-us-east/content/pii:S1381116913003786/gr1/THUMBNAIL/image/gif/756abd745db6ad31e083d5a9a5f3fbbc/gr1.sml https://s3-eu-west-1.amazonaws.com/prod-ucs-content-store-eu-west/content/pii:S1381116913003786/gr1/THUMBNAIL/image/gif/756abd745db6ad31e083d5a9a5f3fbbc/gr1.sml gr1 gr1.sml sml 2875 162 79 IMAGE-THUMBNAIL 1-s2.0-S1381116913003786-fx9.sml https://s3.amazonaws.com/prod-ucs-content-store-us-east/content/pii:S1381116913003786/fx9/THUMBNAIL/image/gif/b8417392cf3f9dd09dec6e6091512ebd/fx9.sml https://s3-eu-west-1.amazonaws.com/prod-ucs-content-store-eu-west/content/pii:S1381116913003786/fx9/THUMBNAIL/image/gif/b8417392cf3f9dd09dec6e6091512ebd/fx9.sml fx9 fx9.sml sml 3307 138 219 IMAGE-THUMBNAIL 1-s2.0-S1381116913003786-fx8.sml https://s3.amazonaws.com/prod-ucs-content-store-us-east/content/pii:S1381116913003786/fx8/THUMBNAIL/image/gif/616627405584fbfbbc6b9587a14f29d2/fx8.sml https://s3-eu-west-1.amazonaws.com/prod-ucs-content-store-eu-west/content/pii:S1381116913003786/fx8/THUMBNAIL/image/gif/616627405584fbfbbc6b9587a14f29d2/fx8.sml fx8 fx8.sml sml 2848 85 219 IMAGE-THUMBNAIL 1-s2.0-S1381116913003786-fx7.sml https://s3.amazonaws.com/prod-ucs-content-store-us-east/content/pii:S1381116913003786/fx7/THUMBNAIL/image/gif/3acd6d938e1a01404a881160fc5db279/fx7.sml https://s3-eu-west-1.amazonaws.com/prod-ucs-content-store-eu-west/content/pii:S1381116913003786/fx7/THUMBNAIL/image/gif/3acd6d938e1a01404a881160fc5db279/fx7.sml fx7 fx7.sml sml 3311 132 219 IMAGE-THUMBNAIL 1-s2.0-S1381116913003786-fx6.sml https://s3.amazonaws.com/prod-ucs-content-store-us-east/content/pii:S1381116913003786/fx6/THUMBNAIL/image/gif/5b7fe3889f234e56dd4d0f0222e8586d/fx6.sml https://s3-eu-west-1.amazonaws.com/prod-ucs-content-store-eu-west/content/pii:S1381116913003786/fx6/THUMBNAIL/image/gif/5b7fe3889f234e56dd4d0f0222e8586d/fx6.sml fx6 fx6.sml sml 2985 98 219 IMAGE-THUMBNAIL 1-s2.0-S1381116913003786-fx5.sml https://s3.amazonaws.com/prod-ucs-content-store-us-east/content/pii:S1381116913003786/fx5/THUMBNAIL/image/gif/9f5f5444fbea2745da7fc5b4d45800f0/fx5.sml https://s3-eu-west-1.amazonaws.com/prod-ucs-content-store-eu-west/content/pii:S1381116913003786/fx5/THUMBNAIL/image/gif/9f5f5444fbea2745da7fc5b4d45800f0/fx5.sml fx5 fx5.sml sml 3131 111 219 IMAGE-THUMBNAIL 1-s2.0-S1381116913003786-fx4.sml https://s3.amazonaws.com/prod-ucs-content-store-us-east/content/pii:S1381116913003786/fx4/THUMBNAIL/image/gif/7fa44267bb5317b2057f6fe99fd6fafe/fx4.sml https://s3-eu-west-1.amazonaws.com/prod-ucs-content-store-eu-west/content/pii:S1381116913003786/fx4/THUMBNAIL/image/gif/7fa44267bb5317b2057f6fe99fd6fafe/fx4.sml fx4 fx4.sml sml 3823 159 219 IMAGE-THUMBNAIL 1-s2.0-S1381116913003786-fx3.sml https://s3.amazonaws.com/prod-ucs-content-store-us-east/content/pii:S1381116913003786/fx3/THUMBNAIL/image/gif/747a48b9e135c6309f1e2afec661e5d6/fx3.sml https://s3-eu-west-1.amazonaws.com/prod-ucs-content-store-eu-west/content/pii:S1381116913003786/fx3/THUMBNAIL/image/gif/747a48b9e135c6309f1e2afec661e5d6/fx3.sml fx3 fx3.sml sml 3039 114 219 IMAGE-THUMBNAIL 1-s2.0-S1381116913003786-fx2.sml https://s3.amazonaws.com/prod-ucs-content-store-us-east/content/pii:S1381116913003786/fx2/THUMBNAIL/image/gif/10976f239bb71dd8ffb88e68393c3f4c/fx2.sml https://s3-eu-west-1.amazonaws.com/prod-ucs-content-store-eu-west/content/pii:S1381116913003786/fx2/THUMBNAIL/image/gif/10976f239bb71dd8ffb88e68393c3f4c/fx2.sml fx2 fx2.sml sml 1429 25 219 IMAGE-THUMBNAIL 1-s2.0-S1381116913003786-fx17.sml https://s3.amazonaws.com/prod-ucs-content-store-us-east/content/pii:S1381116913003786/fx17/THUMBNAIL/image/gif/fb8c645862c027cfdf381f92ef0f5ad5/fx17.sml https://s3-eu-west-1.amazonaws.com/prod-ucs-content-store-eu-west/content/pii:S1381116913003786/fx17/THUMBNAIL/image/gif/fb8c645862c027cfdf381f92ef0f5ad5/fx17.sml fx17 fx17.sml sml 2344 46 219 IMAGE-THUMBNAIL 1-s2.0-S1381116913003786-fx16.sml https://s3.amazonaws.com/prod-ucs-content-store-us-east/content/pii:S1381116913003786/fx16/THUMBNAIL/image/gif/392ac40af4a88e905119416255554243/fx16.sml https://s3-eu-west-1.amazonaws.com/prod-ucs-content-store-eu-west/content/pii:S1381116913003786/fx16/THUMBNAIL/image/gif/392ac40af4a88e905119416255554243/fx16.sml fx16 fx16.sml sml 2320 42 219 IMAGE-THUMBNAIL 1-s2.0-S1381116913003786-fx15.sml https://s3.amazonaws.com/prod-ucs-content-store-us-east/content/pii:S1381116913003786/fx15/THUMBNAIL/image/gif/d708511e2b369a1f7cc138be3d905d7b/fx15.sml https://s3-eu-west-1.amazonaws.com/prod-ucs-content-store-eu-west/content/pii:S1381116913003786/fx15/THUMBNAIL/image/gif/d708511e2b369a1f7cc138be3d905d7b/fx15.sml fx15 fx15.sml sml 1517 19 219 IMAGE-THUMBNAIL 1-s2.0-S1381116913003786-fx14.sml https://s3.amazonaws.com/prod-ucs-content-store-us-east/content/pii:S1381116913003786/fx14/THUMBNAIL/image/gif/a110c9e6fe0f32913bbc40b814973009/fx14.sml https://s3-eu-west-1.amazonaws.com/prod-ucs-content-store-eu-west/content/pii:S1381116913003786/fx14/THUMBNAIL/image/gif/a110c9e6fe0f32913bbc40b814973009/fx14.sml fx14 fx14.sml sml 1437 29 219 IMAGE-THUMBNAIL 1-s2.0-S1381116913003786-fx13.sml https://s3.amazonaws.com/prod-ucs-content-store-us-east/content/pii:S1381116913003786/fx13/THUMBNAIL/image/gif/73927ae51e08372aef19911de41e41c9/fx13.sml https://s3-eu-west-1.amazonaws.com/prod-ucs-content-store-eu-west/content/pii:S1381116913003786/fx13/THUMBNAIL/image/gif/73927ae51e08372aef19911de41e41c9/fx13.sml fx13 fx13.sml sml 1367 23 219 IMAGE-THUMBNAIL 1-s2.0-S1381116913003786-fx12.sml https://s3.amazonaws.com/prod-ucs-content-store-us-east/content/pii:S1381116913003786/fx12/THUMBNAIL/image/gif/e1ffc3c7e4638660cb95f284c085b2cc/fx12.sml https://s3-eu-west-1.amazonaws.com/prod-ucs-content-store-eu-west/content/pii:S1381116913003786/fx12/THUMBNAIL/image/gif/e1ffc3c7e4638660cb95f284c085b2cc/fx12.sml fx12 fx12.sml sml 1342 22 219 IMAGE-THUMBNAIL 1-s2.0-S1381116913003786-fx11.sml https://s3.amazonaws.com/prod-ucs-content-store-us-east/content/pii:S1381116913003786/fx11/THUMBNAIL/image/gif/25c8094aab6edc67947073329a5a6ba0/fx11.sml https://s3-eu-west-1.amazonaws.com/prod-ucs-content-store-eu-west/content/pii:S1381116913003786/fx11/THUMBNAIL/image/gif/25c8094aab6edc67947073329a5a6ba0/fx11.sml fx11 fx11.sml sml 1608 30 219 IMAGE-THUMBNAIL 1-s2.0-S1381116913003786-fx10.sml https://s3.amazonaws.com/prod-ucs-content-store-us-east/content/pii:S1381116913003786/fx10/THUMBNAIL/image/gif/7ff28a0cd984c19c2b0708896f4d3fa3/fx10.sml https://s3-eu-west-1.amazonaws.com/prod-ucs-content-store-eu-west/content/pii:S1381116913003786/fx10/THUMBNAIL/image/gif/7ff28a0cd984c19c2b0708896f4d3fa3/fx10.sml fx10 fx10.sml sml 1442 24 219 IMAGE-THUMBNAIL 1-s2.0-S1381116913003786-fx1.sml https://s3.amazonaws.com/prod-ucs-content-store-us-east/content/pii:S1381116913003786/fx1/THUMBNAIL/image/gif/78a9457e2b67ee4103aa651eeac69a0e/fx1.sml https://s3-eu-west-1.amazonaws.com/prod-ucs-content-store-eu-west/content/pii:S1381116913003786/fx1/THUMBNAIL/image/gif/78a9457e2b67ee4103aa651eeac69a0e/fx1.sml fx1 true fx1.sml sml 2265 43 219 IMAGE-THUMBNAIL MOLCAA 8898 S1381-1169(13)00378-6 10.1016/j.molcata.2013.10.006 Elsevier B.V. Fig. 1 High-resolution XPS spectra of Cu 2p, Cl 2p and K 2p core levels of the pale green solid. Fig. 2 Cu(II) complexes investigated. Fig. 3 Evaluation of the total turnover number of the catalyst. General reaction conditions: glycerol (70mmol), CuCl2 (0.7mmol, 1%), pyridine (0.35mmol, 0.5%), DMA (5mL), O2 (0.7MPa) and CO (3.3MPa), T =130°C. Selectivities for each run were higher than 92%. Fig. 4 The reaction mechanism. Table 1 XPS atomic percentages. Element XPS atomic percentage (%) Cu 17.0 O 10.3 Cl 26.3 K 17.0 C 29.4 Table 2 Optimization of the reaction conditions. a Entry Solvent Py/Cu T (°C) Time (h) Conv. b (%) Sel. b (%) 1 c DMA − 100 10 – – 2 ACN 0 100 4 – – 3 DMA 0 100 4 25 66 4 DMF 0 100 4 27 59 5 ACN 0.5 100 4 18 96 6 DMA 0.5 100 4 40 80 7 DMF 0.5 100 4 43 75 8 ACN 1.0 100 4 10 96 9 DMA 1.0 100 4 20 50 10 DMF 1.0 100 4 21 46 11 ACN 2.0 100 4 8 99 12 DMA 2.0 100 4 18 47 13 DMF 2.0 100 4 20 44 14 1-Butanol 0.5 100 4 20 40 15 1-Methyimidazole 0.5 100 4 – – 16 d DMA 0.5 100 4 15 90 17 DMA 0.5 100 6 63 86 18 DMA 0.5 100 8 82 91 19 DMA 0.5 100 10 94 95 20 DMA 0.5 130 4 93 91 21 e DMA 0.5 130 8 89 90 22 DMA 0.5 150 3 91 91 a General reaction conditions: glycerol (6mmol), CuCl2 (0.6mmol), pyridine (as reported) in 5mL of solvent, heated under stirring under a gaseous mixture of O2 (0.7MPa) and CO (3.3MPa). b Evaluated via GC–MS after silylation. Selectivities are referred to the moles of glycerol carbonate formed (see Section 2). c In the absence of CuCl2 (blank test). d Performed by adding 0.5mL of water to the reaction mixture. e Reaction carried out with a CO:O2 =15:1 molar ratio (see Sections 2.1 and 2.2). Table 3 Screening of copper catalyst sources. a Entry Cu catalyst Time (h) Conv. b (%) Sel. b (%) 1 CuCl2 4 93 91 2 CuBr2 4 51 89 3 CuI 4 69 94 4 CuSO4 4 75 95 5 Cu(OAc)2 4 10 40 6 Cu(OTf)2 4 72 60 7 Cu(ClO4)2 4 41 40 8 (Phtalocyanine)Cu(II) (7) 4 – – 9 (o-Phen)CuCl2 (8) 4 – – 10 (Bipy)CuCl2 (9) 4 – – 11 (Ph3PO)2CuCl2 (10) 3 92 94 a General reaction conditions: glycerol (6mmol), copper catalyst (0.6mmol), pyridine (0.3mmol), DMA (5mL), heated under stirring under a gaseous mixture of O2 (0.7MPa) and CO (3.3MPa). b Evaluated via GC–MS after silylation. Selectivities are referred to the moles of glycerol carbonate formed (see Section 2). Copper(II) chloride-catalyzed oxidative carbonylation of glycerol to glycerol carbonate Michele Casiello a Antonio Monopoli a ⁎ Pietro Cotugno a Antonella Milella a Maria Michela Dell’Anna c Francesco Ciminale a Angelo Nacci a b ⁎⁎ a Department of Chemistry, University of Bari Aldo Moro, Via Orabona, 4, 70126 Bari, Italy Department of Chemistry, University of Bari Aldo Moro Via Orabona, 4 Bari 70126 Italy b CNR – ICCOM, Department of Chemistry, University of Bari Aldo Moro, Via Orabona, 4, 70126 Bari, Italy CNR – ICCOM, Department of Chemistry, University of Bari Aldo Moro Via Orabona, 4 Bari 70126 Italy c DICATECh, Politecnico di Bari, via Orabona 4, 70125 Bari, Italy DICATECh, Politecnico di Bari via Orabona 4 Bari 70125 Italy ⁎ Corresponding author. Tel.: +39 060 5442499; fax: +39 080 5442129. ⁎⁎ Corresponding author at: CNR – ICCOM, Department of Chemistry, University of Bari Aldo Moro, Via Orabona, 4, 70126 Bari, Italy. Tel.: +39 060 5442499; fax: +39 080 5442129. Graphical abstract A systematic study on copper(II) as catalyst for the synthesis of glycerol carbonate via oxidative carbonylation is here reported for the first time. Copper(II) chloride has been found to efficiently promote the process under homogeneous conditions treating glycerol with CO:O2 (P tot =4MPa; P (O2) =0.7MPa), in DMA at 130°C and in the presence of pyridine as co-catalyst. Excellent conversions (>92%) and selectivities (>93%) are obtained in relatively short reaction times (3–4h) also with copper(II) complexes. The catalyst overall TON is evaluated and new experimental evidences are provided allowing significant advancements in the mechanism comprehension. Keywords Oxidative carbonylation Copper halides Glycerol carbonates Mechanistic study 1 Introduction An important goal of modern industry is the exploitation of secondary products coming from the industrial processes, mainly the ones destined to the disposal. A significant example is given by the large surplus of glycerol generated by bio-diesel industry, formerly considered a valuable by-product, but nowadays seen as a waste material. Many practical applications of glycerol as raw material in several fields like pharmaceutics, cosmetics, food industry, and explosives production [1], allow the valorization of this product and broaden the useful applications of biomass energy sources. A number of value-added products can be obtained by chemical conversion of glycerol (1) by means of catalytic reactions [2]. Acrolein, glycerol ether and 1,2-propane diol are amongst the most useful derivatives of glycerol, but its 5-membered cyclic carbonate has recently received particular attention [3]. Glycerol carbonate (2) is a polar, non-toxic and high-boiling liquid useful for industry as solvent, additive and chemical intermediate. It is used as non-volatile solvent for resins, plastics and paints [4], as component in coatings, detergents, lubricants and electrolyte of batteries [5], and due to the presence of two functional groups, it is also investigated as source of new polymeric materials [6]. The moisturizing properties and the low toxicity of 2 make this compound ideal for use in cosmetics, personal hygiene and medical applications [6]. In addition, it is a raw material for CO2 absorption, for the synthesis of glycidol, polyesters and polycarbonate, and is a reactive solvent in polyurethane coatings [7]. The main synthetic routes of access to glycerol carbonate include: (i) the transesterification of ethylene carbonate or DMC with glycerol [8–10], (ii) the direct carboxylation with CO2 [11,12], (iii) the reaction of glycidol with CO2 [13], (iv) the glycerolysis of urea [14], (v) the phosgenation of glycerol [15] and (vi) the reaction of epichlorohydrin with alkaline bicarbonates [16]. Recently, a promising and eco-friendly alternative has been proposed, that is the oxidative carbonylation of glycerol, which is accomplished with gaseous mixture of carbon monoxide and molecular oxygen, in the presence of palladium catalysts under both homogeneous and heterogeneous conditions (Eq. (1)) [17,18a]. (1) Oxidative carbonylation is a useful method for the synthesis of carbonylated products starting from mono- and bi-functional reagents [19]. With this strategy, methanol and ethanol are respectively converted into DMC and DEC [20], diols lead to cyclic carbonate [21–23], while amino-alcohols and diamines give rise to the corresponding cyclic carbamates and ureas [24–28]. With diols as starting materials, the main catalysts employed until now are based on Pd [21], Cu [22] and Co [29], but in a very few cases this methodology has been applied to glycerol, specifically in an old patent [30] and in a very recent study [17,18a], where efficient but expensive palladium catalysts are predominantly employed. In this context, finding suitable catalysts based on cheaper transition metals is mandatory and copper can be a valuable response to this problem. Copper salts are known to efficiently catalyze the synthesis of DMC in the Enichem process [31], and recently CuBr2 has been found to promote the sulphur-assisted carbonylation of glycerol under stoichiometric conditions [32]. To the best of our knowledge, no catalytic applications of this metal to the oxidative carbonylation of glycerol have been reported until now. Following our recent success on diols [22], we decided to extend these findings developing a copper-based catalytic systems for the synthesis of glycerol carbonate under homogeneous conditions. 2 Experimental Unless otherwise stated, all manipulations were carried out in air. Copper salts [CuCl2, CuBr2, CuI, Cu(ClO4)2·6H2O, Cu(OTf)2, CuSO4 and Cu(OAc)2] (by Aldrich or Fluka) were dried under vacuum overnight before their use. Glycerol (1,2,3-propanetriol), solvents (CH3CN, N,N-dimethylformamide DMA, N,N-dimethylacetamide DMF, 1-butanol, 1-metilimidazole), ligands (pyridine, triphenylphosphine oxide), external standard (4-methylanisole), dichloro(1,10-phenanthroline)copper(II) 8 and K2CO3 were Aldrich or Fluka products and were used as received. Copper complex 7 [(29H, 31H-phthalocyaninato(2-)-N29,N30,N31,N32)copper(II)] was purchased by INTATRADE GmbH, while dichloro(2,2′-bipyridyl)copper(II) 9 [33] and dichlorobis(triphenylphosphineoxide)copper(II) 10 [34] were prepared according to the literature. Reactions products were detected by GC–MS and identified by comparison of their IR and MS spectra with literature data. FT-IR spectra were recorded on a Perkin Elmer Spectrum BX spectrophotometer. GC–MS analyses were carried out with an Agilent GC 6850 (equipped with a capillary column: HP-5 MS, 30m) linked to an Agilent 5975C selective mass detector. XPS analyses were accomplished by a thermo Fisher theta probe spectrometer equipped with a monochromatic Al Kα X-ray source (1486.6eV) with a spot size of 300μm, corresponding to a power of 70W and at a take-off angle of 53° relative to the sample normal. Survey spectra (0–1300eV) were acquired at a pass energy of 200eV with a resolution of 1eV. High-resolution spectra for Cu 2p, Cl 2p, K 2p, C 1s and O 1s, were recorded at a pass energy of 100eV with a resolution of 0.05eV. Charge compensation was accomplished by an electron flood gun (1eV). Charge correction of the spectra was performed by taking the alkyl type carbon (CC, CH) component of the C1s spectrum as internal reference (binding energy, BE=284.5eV). Special care was devoted during the analyses to verify that no change in the shape of the Cu 2p spectrum was induced by exposure to the X-ray and the electron flood gun. Atomic percentages were calculated using the Scofield sensitivity factors set in the Thermo Avantage V4.87 software (Thermo Fisher Corporation) and a non-linear Shirley background subtraction algorithm. The high-resolution spectra were fitted with mixed Gaussian–Lorentzian peaks after a Shirley background subtraction. Special care was devoted to the cleaning of the equipment (glass vials, magnetic stirrer, etc.) carried out with aqua-regia to prevent metal contaminations. 2.1 Safety advice Although the oxidative carbonylation of methanol to DMC has been industrialized by ENIchem for 30 years under similar conditions [20,31] and even if in the last decade many studies on the oxidative carbonylation have been carried out within our proposed interval of pressures and without the occurrence of incidents [17,18,22], the high pressure experiments with CO/O2 mixtures are potentially explosive in the range 16.7–93.5% [35] and may represent a significant risk. As a consequence, experiments with compressed gases should only be carried out in conjunction with the use of suitable equipments and special care. In this work, autoclaves equipped with appropriate rupture discs (strength 10MPa) and mixtures of CO/O2 =5:1 ca. molar ratio (∼83%) very close to the upper limit of the above-mentioned range were used. In any case, a comparative carbonylation experiment has been performed at a CO:O2 =15:1 molar ratio, demonstrating that the catalyst works also under the safety conditions even if with longer reaction times. This result has been added in Table 2 (run 21) and the procedure described in Section 2.2. 2.2 Catalytic tests Catalytic tests were carried out in a 55.6mL stainless steel autoclave mounted in an electrical oven having a magnetic stirrer on its base. Catalyst, additives, solvent and reagents were introduced in a glass vial (∼20mL) and placed into the autoclave, in order to avoid any contact with metal walls. Under these conditions, the free volume for gaseous mixture is in the range 35–40mL. In a typical experiment the glass vial was charged with a DMA solution (5.0mL) of glycerol (6mmol), catalyst (CuCl2, 0.60mmol) and pyridine (0.30mmol), which appeared clean and green coloured. The vial was introduced into the autoclave, which was sealed, purged and charged with O2 (0.7MPa) and CO up to a total pressure of 4MPa. Under these conditions, also taking into account the head space of the autoclave and the stoichiometry of the carbonylation process [Eq. (2)], glycerol is the limiting reagent. The mixture was heated at 130°C and allowed to react for 4h. After this time, the reaction mixture was analyzed by IR and GC–MS for assessing conversions and selectivities as reported below. The IR spectrum of the reaction mixture showed the presence of a strong absorptions around 1800cm−1 assigned to 4-(hydroxymethyl)-1,3-dioxolan-2-one (2), a broad absorptions in the range 3600–3500cm−1 assigned to the hydroxyl groups of the carbonate and of the unreacted glycerol (1), a narrow signal at 2340cm−1 assigned to the CO2 formed during the reaction and 1640–1610cm−1, assigned to H2O, co-product of reaction. The carbonylation of glycerol under the other conditions discussed in the paper were carried out in the same way. The comparative experiment carried out under the safety conditions (CO:O2 =15:1 molar ratio), was performed on a DMA solution (3.0mL) of glycerol (2,6mmol), catalyst (CuCl2, 0.26mmol) and pyridine (0.13mmol). The vial was introduced into the autoclave, which was sealed, purged and charged with O2 (0.25MPa) and CO up to a total pressure of 4MPa. Under these conditions. The mixture was heated at 130°C and allowed to react for 8h. After this time, the reaction mixture was analyzed by IR and GC–MS for assessing conversions and selectivities as reported below. 2.3 Derivatization of the reaction products To obtain reproducible and resolved chromatographic peaks of 1 and 2 we decided to convert them into the corresponding silylated compounds. In a typical derivatization procedure [17], a weighed amount of the reaction mixture (150mg ca.) was treated into a 10mL centrifuge tube with excess amounts (1.00g ca.) of the silylating reagent hexamethyldisilazane:trimethylchlorosilane:pyridine in a 3:1:9 weight ratio. The tube was sealed, stirred for 5min and incubated at room temperature for 30min causing the precipitation of NH4Cl as a white solid. Then, 50mg of 4-methylanysole was added to the mixture as an external standard. After centrifugation at 2500rpm for 5min, the clear supernatant was analyzed by GC–MS to assess the conversions and selectivities reported in Tables 2 and 3, based on the peaks areas of the silylated derivatives of the unreacted glycerol 1 and the formed carbonate 2. Besides 1 and 2, the silylation procedure allowed the detection of the main by-products arising from side-reactions involving the solvent [Section 3.1, Eqs. (3)–(6)]. The mass spectra of all compounds detected by GC–MS, including the ones formed upon derivatization, are given below: Silylated glycerol (S-1): m/z (%) 307 (1, M+−1) 293 (3, M+−CH3,), 263 (2, M+−3Me), 218 (10, M+−6Me), 205 (44, M+−CH2OSiMe3), 191 (5, M+−CH2OSiMe3−Me), 175 (5, M+−CH2OSiMe3−2Me), 147 (66, M+−OSiMe3−SiMe3), 133 (17, M+−CH2OSiMe3−SiMe3), 117 (31, CHCH2OSiMe3 +), 103 (24, CH2OSiMe3 +), 101 (5, CHCH2OSiMe2 +), 89 (4, OSiMe3 +), 73 (100, SiMe3 +). Silylated glycerol carbonate (S-2): m/z (%) 189 (1, M+−1), 175 (1, M+−Me), 160 (1, M+−2Me), 145 (1, M+−3Me), 131 (48, M+−CH2CO), 116 (4, M+−SiMe3), 103 (26, CH2OSiMe3 +), 101 (100, CHCH2OSiMe2 +), 89 (3, OSiMe3 +), 73 (76, SiMe3 +). Silylated glycerol monoformate (S-3a): m/z (%) 243 (1, M+−Me), 191 (10, M+−CH2OC(O)H), 161 (55, M+−CH2OSiMe3), 147 (65, M+−OSiMe3−HCO), 133 (20, OCH2CH2OSiMe3 +), 117 (40, CH2CH2OSiMe3 +), 73 (100, SiMe3 +), 59 (25, MeCO2 +). Silylated glycerol monoacetate (S-3b): m/z (%) 263 (1, M+−Me), 205 (9, M+−CH2OC(O)Me), 175 (100, M+−CH2OSiMe3), 147 (69, M+−OSiMe3−MeCO), 133 (48, OCH2CH2OSiMe3 +), 117 (43, CH2CH2OSiMe3 +), 73 (97, SiMe3 +), 59(16, MeCO2 +), 43 (83, MeCO+). Tetramethyl urea (4): m/z (%) 116 (6, M+), 87 (1, M+−2Me), 72 (100, C(O)NMe2 +), 44 (23, Me2N+). Silylated 2,3-dihydroxypropyl dimethylcarbamate (S-5): m/z (%) 292 (2, M+−Me), 263 (1, M+−NMe2), 218 (2, M+−HOC(O)NMe2),204 (52, M+−CH2OSiMe3), 147 (27, CH2CHOCH2OSiMe3 +), 73 (51, SiMe3 +), 72 (100, C(O)NMe2 +). (2-oxo-1,3-dioxolan-4-yl)methyldimethylcarbamate (6): m/z (%) 189 (10, M+), 102(5, CH2OC(O)NMe2 +), 88(10, CH2OC(O)NMe2 +), 72 (100, C(O)NMe2 +), 58 (22, NCO2 +), 44 (43, NMe2 +). 2.4 Catalyst stability and scale-up The glass vial was charged with 70mmol of glycerol (4.600g), 5.0mL of DMA, 0.70mmol of CuCl2 (1mol%), and 0.35mmol of pyridine (0.5mol%). The vial was introduced into the autoclave, which was sealed and charged with O2 (0.7MPa) and CO up to a total pressure of 4.0MPa. The autoclave was heated at 130°C for 5h. After this time, the autoclave was cooled down to room temperature, evacuated from the residual gas and sampled for conversion and selectivity. Then, the mixture was recharged with a fresh mixture of CO/O2 and allowed to react at 130°C for other 5h. This procedure was repeated nine times until the conversion remained constant indicative of the fact that the carbonylation process was stopped. To verify if the incomplete conversion was due to the catalyst deactivation, the organic products were distilled out from the reaction mixture and the solid residue was tested for a new carbonylation experiment by adding fresh starting materials (glycerol, pyridine and DMA) under 4MPa of CO/O2. The carbonylation started again indicating that the catalyst is stable under the reaction conditions and that the apparent deactivation is due to the side-reaction of CO oxidation to CO2 promoted by Cu(II) and water (by-product of carbonylation) which becomes predominant during the course of reaction (see Section 3.3). 2.5 Carbonylation mechanism: reductive step A glass vial was charged with glycerol (280mg, 3.7mmol), an equimolar amount of CuCl2 (496mg, 3.7mmol), K2CO3 (780mg, 7.4mmol) in DMA (5mL). The vial was introduced into the autoclave, which was sealed, charged with 2.5MPa of CO and allowed to react at 100°C for 5h. After this time, the autoclave was cooled to room temperature and evacuated, and the reaction mixture was treated with the silylating reagent and analyzed by GC–MS. A conversion of 50% ca. was detected. The reaction was repeated with the double molar amount of CuCl2 (992mg, 7.4mmol) respect to glycerol (280mg, 3.7mmol) obtaining its complete conversion in carbonate according to the stoichiometry depicted in Eq. (7) (Section 3.3). A copper containing pale green precipitate was formed during the reactions that was separated by centrifugation and immediately kept under nitrogen atmosphere to avoid oxidation. Then, the solid was quickly fixed on a piece of UHV compatible carbon tape (Agar Scientific) and immediately transferred into the XPS load lock chamber pumped down to 10−8 mbar. In order to remove any trace of organic solvents the sample was left to dry overnight. 2.6 XPS characterization of the copper based pale green precipitate Analysis of the survey spectrum allowed for the qualitative atomic chemical composition of the sample. More specifically, signals attributed to Cu, Cl, K, C and O were identified. Atomic percentages were then obtained from the high-resolution spectra and results are reported in Table 1 . Fig. 1 collects the high resolution spectra of Cu 2p, Cl 2p and K 2p. All these spectra show the spin-orbit splitting of the 2p level thus resulting in doublet features. The shape of the Cu 2p spectrum is indicative of copper (I) compounds, with the Cu 2p3/2 signal comprised of a single component at 932.9eV, typical of CuCl [36–38]. This peak position was found to be the same of a standard CuCl sample analyzed for further validation. Since some oxygen percent was found in the solid, it must be said that the presence of a certain amount of copper(I) oxide cannot be ruled out, due to the very low binding energy separation between chloride and oxide copper (I) compounds [37,38]. Curve-fitting of the Cl 2p spectrum reveals the presence of two doublets. The components of the Cl 2p3/2, centred at 198.1eV and 198.8eV can be assigned to KCl and CuCl, respectively. Correspondingly, the K 2p3/2 peak is centred at 292.8eV matching with the presence of KCl [37,38]. In order to gain more insights into the possible presence of copper(I) oxide, based on the atomic percentages it has been tried to estimate the amount of oxygen bonded to copper. To this aim it is necessary first of all to subtract the percent of oxygen bonded to C to the overall percentage of oxygen. This amount has been determined from the curve-fitting of the C1s high resolution spectrum, which has been found to consist of three components at 284.5eV (CC/H), 286.2eV (COH/R) and 288.1eV (CO) [39], and it has been found to be 25.9%. Then the amount of oxygen bonded to copper as Cu2O is about 3.5%. 3 Results and discussion 3.1 General We recently reported that copper(II) salts catalyze the oxidative carbonylation of diols into the corresponding cyclic carbonates [22], and that catalytic efficiency (activity and stability) is affected by the nature of the solvent and the presence of bases and ligands. We also demonstrated the importance of the co-catalytic role of the base, which could act as a proton shuttle from the diol to the molecular oxygen, which in turn should act as a copper re-oxidant closing the catalytic cycle (see Section 3.3). The screening of bases showed the best activity for Na2CO3, which at the same time caused the catalyst deactivation for prolonged reaction times. In addition, we also found that DMF, as already reported [21], can play the role of base avoiding the need for Na2CO3 and similar inorganic bases, and therefore prolonging the catalyst lifetime. Extending the study to glycerol 1, we have found that copper(II) catalysts promote the oxidative carbonylation into its cyclic carbonate 2 according to the stoichiometry of Eq. (2), and that catalytic efficiency is also affected by the reaction times and the temperature conditions. (2) The optimization of the reaction conditions was started applying the protocol previously found for diols [22]: 6mmol of glycerol, 0.6mmol of CuCl2 dissolved in 5mL of solvent, at 100°C for 4h, under a CO/O2 mixture (4MPa, 5:1 ca. molar ratio, Table 2 , entries 1–4). Preliminarily, the blank reaction showed that the presence of copper is necessary to promote the process (Table 2, entry 1). In the absence of bases, acetonitrile (ACN) proved to be unsuccessful (Table 2, entry 2) [22], while other dipolar solvents like dimethylacetamide (DMA) and dimethylformamide (DMF) promoted the process, indicating that they can assume the role of proton acceptor (Table 2, entries 3 and 4). However, under these conditions conversions in carbonate were lower than 30%. To improve the catalyst activity, we evaluated the opportunity of using pyridine which should exert the double role of ligand and base (Table 2, entries 5–13). In fact, this additive had a beneficial effect on the catalytic activity even in acetonitrile, confirming its co-catalytic role, but the positive influence was observed only with a Py/Cu molar ratio of 1:2 (Table 2, entries 5–7), whereas with higher Py amounts conversions dropped again in all the tested solvents (Table 2, entries 8–13). This trend could be explained with the good coordinating ability of pyridine towards copper that would lead to a catalyst inhibition in the presence of excess amounts of the ligand. Interestingly, reactions carried out in acetonitrile occurred with selectivities in glycerol carbonate higher than 96% (Table 2, entries 5, 8, 11). On the contrary, reactions performed in DMF and DMA led in many cases to considerable amounts of by-products deriving mainly from side-reactions that involved the solvent (Table 2, entries 3, 4, 9, 10, 12, 13). In particular, the glycerolysis of DMF (or DMA) would account for the corresponding monoacylated glycerol derivatives 3a (or 3b) and dimethylamine (Eq. (3)). The latter, under the reaction conditions, might undergo an oxidative carbonylation affording tetramethylurea 4, 2,3-dihydroxypropyl dimethylcarbamate 5 and (2-oxo-1,3-dioxolan-4-yl)methyl dimethylcarbamate 6 (Eqs. (4)–(6)) (3) (4) (5) (6) To limit these undesired side-reactions, the screening was also extended to other different types of solvents. To this aim, we tested a protic polar solvent like 1-butanol and the dipolar 1-methylimidazole, both possessing good solvent properties for glycerol and being totally inert towards glycerolysis. Disappointing results were obtained in both cases: dibutyl carbonate was observed as the main reaction product in butanol (Table 2, entry 14), whereas a complete catalysis inhibition occurred in 1-methylimidazole, probably due to the good coordinating ability of this solvent towards copper (Table 2, entry 15). The detrimental effect of water on this process [22] was confirmed by the addition of 0.5mL of water to the initial reaction mixture (Table 2, entry 16, see Section 3.3). Importantly, under the tested conditions (T =100°C, t =4h), the catalytic activity proved to be low reaching 43% as maximum conversion value. In order to check whether the incomplete conversions observed in entries 1–16 (t =4h) were due to catalyst deactivation or to an insufficient reaction time, we prolonged the time of reaction to 6, 8 and 10h (Table 2, entries 17–19). In these experiments conversions and selectivities gradually increased reaching the maximum values of 94% and 95%, respectively (Table 2, entry 19), indicating that: (i) the low conversions of entries 1–16 were not due to catalyst deactivation, and (ii) side-reactions listed in Eqs. (3)–6) take place at the beginning of the process, when an induction period is required by copper to trigger catalysis. During this delay, probably due to the slow diffusion of carbon monoxide into the viscous solution, copper could act as a Lewis acid promoting the glycerolysis of the solvent [Eq. (3)]. These hypotheses were verified performing two appropriate experiments. In the first one, reaction was carried in DMA under inert atmosphere, which afforded to the formation of 3b and dimethylamine as the sole reaction products, confirming that glycerolysis [Eq. (3)] is the main side-reaction which in turn generates the other by-products [Eqs. (4)–(6)]. In a second experiment, the initial DMA solution of glycerol was preliminarily saturated with CO/O2 at 100°C for 1h before adding the catalyst. As expected, selectivity of carbonylation after 4h increased respect to the analogous reaction performed without pre-saturation (Table 2, entry 6) reaching the value of 90%. On these bases, being the oxidative carbonylation process controlled by the diffusion rate of the gases into the solution, better selectivities are expected adopting a more efficient stirring apparatus, preferably of mechanical type [17]. Differently to what found for diols [22], the temperature conditions proved to be crucial for the catalyst activity. Indeed, a remarkable shortening of the reaction times was observed by raising the temperature up to 150°C, accompanied by only a slight lowering of selectivity (91%, Table 2, entry 22). However, the optimal conditions in terms of conversion were found working at 130°C (Table 2, entry 20). This trend can be explained considering the two opposing effects exerted by the temperature increment: the lowering of viscosity that allows a better permeation of gaseous phase into the solution on one hand; the decreasing of the solubility of gaseous reactants into the liquid phase on the other [17]. The catalytic activity of other copper compounds was also investigated (Table 3 ). As far as copper halides are concerned, we found that catalytic performance decreased by passing from CuCl2 to CuBr2 and CuI (Table 3, entries 1–3). This latter salt was used on the base of our previous findings indicating that Cu(I) is also active in the oxidative carbonylation of diols through its preliminary oxidation in situ by molecular oxygen [22]. Copper(II) salts bearing anions other than halides, such as sulphate, acetate, triflate and perchlorate, were less efficient than CuCl2 (Table 3, entries 4–7). Finally, we tested the Cu(II) complexes 7–10 listed in Fig. 2 . Three of them, the (phthalocyanine)copper(II) 7, the o-phenanthroline copper(II) dichloride 8 and bipyridyl copper(II) dichloride 9, bearing chelating N-ligands, proved to be totally inactive (Table 3, entries 8–10), while the last one, the bis(triphenylphosphine oxide) copper(II) dichloride 10, displayed a comparable activity with that of CuCl2 (Table 3, entry 11). The total inertness of complexes 7–9 can be explained taking into account that the presence of the good coordinating N-ligands impedes the dissociation rendering the copper coordination sites not accessible to reactants. This is in line with the inhibitory effect exerted by the excess of monodentate N-ligand pyridine as mentioned above (Table 3, entries 8–13). A different behaviour is shown by complex 10, which can liberate easily the coordination sites because of the poor coordinating ability of triphenylphosphine oxide ligands (Table 3, entries 1 and 10). 3.2 Catalyst stability and scale-up To evaluate the catalyst stability, we decided to perform the scale-up of the carbonylation process by reacting a tenfold amount of glycerol with the lower catalyst loading of 1mol%. Reaction was monitored every 5h recharging the reactor with fresh CO/O2 until conversion remained constant over the time (see Section 2.4). Data reported in Fig. 3 shows that the CuCl2/pyridine/glycerol system (0.7mmol, 0.35mmol, 70mmol), in DMA exhibited an overall turnover number of 82 (expressed as mole of substrate reacted per mole of catalyst). Similarly to what found with diols [22], also the glycerol carbonylation reaches a maximum conversion (82%) after a 40h time reaction. Prolonging the reaction time, the oxidation of CO to CO2 promoted by Cu(II) and water (the by-product of the oxidative carbonylation) becomes the dominant process (Fig. 4 ). This is evidenced monitoring the narrow IR signal of CO2 at 2340cm−1 of the reaction mixture. To verify whether the incomplete conversion was due to this side-reaction or to the catalyst deactivation, the organic products were distilled out from the reaction mixture and the solid residue was tested for a new carbonylation experiment by adding fresh starting materials (glycerol, pyridine and DMA) under 4MPa of CO/O2. As hypothesized, the carbonylation started again indicating that the catalyst is stable under the reaction conditions and confirming that the apparent deactivation is due to the above mentioned side-reaction (see also Section 2.4). It is worth mentioning that, probably due to the presence of pyridine as ligand, CuCl2 did not experience the decomposition promoted by water observed in the case of diols, when an inactive pale green solid, with a minimal formula of CuCl0.7(OH)1.2, precipitated from the reaction mixture during the last cycles of carbonylation. 3.3 Mechanistic insights Based on our previous work on diols [22], we propose the reaction mechanism shown in Fig. 4 for the glycerol oxidative carbonylation. Concerning the catalyst, this process should proceed through a reduction of Cu(II) to Cu(0) [path (b)] followed by re-oxidation through path (c) and/or paths (d) and (e). However, we have already postulated the involvement of Cu(I) as an intermediate in the re-oxidation of Cu(0) [paths (d) and (e)], but then this hypothesis was not supported by experimental evidences. Therefore, to detect the intermediate species of copper, we carried out some reactions with stoichiometric amounts of CuCl2 and in the absence of O2 (see Section 2.5). Experiments carried out using potassium carbonate as the base allowed the formation of an insoluble green solid that was separated and analyzed by XPS technique resulting mainly composed by cuprous chloride (CuCl, see Section 2.6). These carbonylation tests also revealed that a complete conversion of glycerol into the corresponding carbonate 2 requires twice molar amount of CuCl2 respect to 1, whereas equimolar quantities of copper(II) salt stopped the carbonylation process at 50%. All these data account for the stoichiometry of the reductive step depicted in Eq. (7). (7) This confirms the mechanism of Fig. 4 indicating that one of the two equivalents of CuCl2 promotes the oxidative coupling between glycerol and CO [paths (a) and (b)], with the consequent reduction to Cu(0), while the second one reoxidises Cu(0) affording Cu(I) [path (d)]. Furthermore, as no detectable amounts of Cu(0) were observed by XPS analyses of the green solid in all the reductive experiments, these data also suggest that retro-dismutation step [path (d)] should be very fast. 4 Conclusions We have reported here the first systematic study on the use of copper(II) catalysts in the synthesis of glycerol carbonate via oxidative carbonylation. Excellent conversions (>92%) and selectivities (>93%) are achieved in relatively short reaction times (4h) using a catalyst system composed by CuCl2/pyridine in a 1/0.5 molar ratio in DMA as the solvent, at 130°C and 4MPa of CO:O2 (ca. 5:1 as molar ratio). By prolonging the reaction times, the catalyst dosage can be reduced until 1mol% reaching an overall TON value of 82 (Fig. 3) and without observing the catalyst inactivation. New experimental evidences are reported to support the postulated mechanism that involves copper(I) as intermediate species allowing significant advancements respect to the previous work in the comprehension of the catalytic cycle (Fig. 4). This methodology to valorize glycerol is not only an attractive way to carry out its oxidative carbonylation, but is very important from economic point of view, being a valuable alternative to the protocol promoted by the more efficient but much more expensive palladium catalysts [17,18]. Acknowledgements Partial financial support of this work by the Ministry of University and Scientific Research of Italy (MIUR), by University of Bari and by Politecnico of Bari (FRA funds) is gratefully acknowledged. We are grateful to Prof. Potenzo Giannoccaro for the valuable suggestions. References [1] D.T. Johnson K.A. Taconi Environ. Prog. 26 2007 338 348 [2] M. Pagliaro R. Ciriminna H. Kimura M. Rossi C. Della Pina Angew. Chem. Int. Ed. 46 2007 4434 4440 [3] L. Seemann A. Kaszony 45th International Petroleum Conference Bratislava, June 13th–14th 2011 [4] J. Behr K. Eilting J. Irawadi F. Leschinski Lindner Green Chem. 10 2008 13 30 [5] S. Kovvali K.K. Sirkar Ind. Eng. Chem. Res. 41 2002 2287 2295 [6] V. Plasman T. Caulier N. Boulos Plast. Addit. Compd. 7 2005 30 33 [7] J. Rousseau C. Rousseau B. Lynikaite A. Sakcus C. de Leon P. Rollin A. Tatibouet Tetrahedron 65 2009 8571 8581 [8] J.R. Ochoa-Gomez O. Gomez-Jimenez-Aberasturi B. Maestro-Madurga A. Pesquera-Rodriguez C. Ramirez-Lopez L. Lorenzo-Ibarreta J. Torrecilla-Soria M.C. Villaran-Velasco Appl. Catal. A: Gen. 366 2009 315 324 [9] S.C. Kim Y.H. Kim H. Lee D.Y. Yoon B.K. Song J. Mol. Catal. B Enzym. 49 2007 75 78 [10] G. Rokicki P. Rakoczy P. Parzuchowski M. Sobiecki Green Chem. 7 2005 529 539 [11] J. George Y. Patel S.M. Pillai P. Munshi J. Mol. Catal. A: Chem. 304 2009 1 7 [12] M. Aresta A. Dibenedetto F. Nocito C. Pastore J. Mol. Catal. A: Chem. 257 2006 149 153 [13] J. Whiteoak N. Kielland V. Laserna E.C. Escudero-Adán E. Martin A.W. Kleij J. Am. Chem. Soc. 135 2013 1228 1231 [14] M.J. Climent A. Corma P. De Frutos S. Iborra M. Noy A. Velty P. Concepcion J. Catal. 269 2010 140 149 [15] F. Strain, US Patent 2, 446, 145 (1948). [16] K. Kossev N. Koseva K. Troev React. Kinet. Catal. Lett. 79 2003 11 18 [17] J. Hu J. Li Y. Gu Z. Guan W. Mo Y. Ni T. Li G. Li Appl. Catal. A: Gen. 386 2010 188 193 [18] (a) J. Hu Y. Gu Z. Guan J. Li W. Mo T. Li G. Li ChemSusChem 4 2011 1767 1772 (b) S.S.C. Chuang Y. Chi B. Chen P. Toochinda PCT Int. Appl. 2002 WO 2002088050 A2 20021107 (c) F. Li C. Xia J. Catal. 227 2004 542 546 (d) D.-H. Liu J. He L.-B. Sun X.-Q. Liu Q. Zhong J. Taiwan Inst. Chem. Eng. 42 2011 616 621 [19] (a) X.-F. Wu H. Neumann M. Beller Chem. Rev. 113 2013 1 35 (b) B. Gabriele R. Mancuso G. Salerno Eur. J. Org. Chem. 35 2012 6825 6839 [20] D. Delledonne F. Rivetti U. Romano Appl. Catal. A: Gen. 221 2001 241 251 [21] (a) B. Gabriele R. Mancuso G. Salerno G. Ruffolo M. Costa A. Dibenedetto Tetrahedron Lett. 50 2009 7330 7332 (b) V. Calo A. Nacci A. Monopoli J. Organomet. Chem. 690 2005 5458 5466 (c) D.M. Pearson N.R. Conley R.M. Waymouth Adv. Synth. Catal. 353 2011 3007 3013 (d) B. Gabriele R. Mancuso G. Salerno L. Veltri M. Costa A. Dibenedetto ChemSusChem 4 2011 1778 1786 (e) F. Doro P. Winnertz W. Leitner A. Prokofieva T.E. Müller Green Chem. 13 2011 292 295 [22] P. Giannoccaro M. Casiello A. Milella A. Monopoli P. Cotugno A. Nacci J. Mol. Catal. A: Chem. 365 2012 162 171 [23] W. Tam J. Org. Chem. 51 1986 2977 2981 [24] P. Giannoccaro C. Ferragina M. Gargano E. Quaranta Appl. Catal. A: Gen. 375 2010 78 84 [25] D.J. Diaz K.G. Hylton L. McElwee-White J. Org. Chem. 71 2006 734 738 [26] F. Qian J.E. McCusker Y. Zhang A.D. Main M. Chlebowski M. Kokka L. McElwee-White J. Org. Chem. 67 2002 4086 4092 [27] B. Gabriele G. Salerno R. Mancuso M. Costa J. Org. Chem. 69 2004 4741 4750 [28] P. Giannoccaro C.F. Nobile P. Mastrorilli N. Ravasio J. Organomet. Chem. 419 1991 251 258 [29] D. Delledonne, F. Rivetti, U. Romano, EU, 1991, 463, 678, EniChem S.p.A. [30] US Patent n. 5 359 094 Oct 25 1994. [31] U. Romano R. Tesei M.M. Mauri P. Rebora Ind. Eng. Chem. Prod. Res. Dev. 19 1980 396 403 [32] T. Mizuno T. Nakai M. Mihara Heteroatom Chem. 21 2010 99 102 [33] F.P. Canhota G.C. Salomão N.M.F. Carvalho O.A. C. Antunes Catal. Commun. 9 2008 182 185 [34] G. Ondrejovič M. Melník D. Makáňová J. Gažo Chem. Monthly 108 1977 1047 1053 [35] C.M. Bartish G.M. Drissel Kirk-Othmer Encyclopedia of Chemical Technology Vol. 4 3rd ed. 1978 Wiley-Interscience New York 772 793 [36] M. Biesinger L.W.M. Lau A.R. Gerson R.St.C. Smart Appl. Surf. Sci. 257 2010 887 898 [37] C.D. Wagner A.V. Naumkin A. Kraut-Vass J.W. Allison C.J. Powell J.R. Rumble Jr. NIST Standard Reference Database 20, Version 3.4 2003 http://srdata.nist.gov/xps [38] J.F. Moulder W.F. Stickle P.E. Sobol K.D. Bomben Handbook of X-ray Photoelectron Spectroscopy J. Chastain Perkin-Elmer Corporation Physical Electronics Division 1992 Eden Praire USA [39] G. Beamson D. Briggs High Resolution XPS of Organic Polymers 1992 John Wiley and Sons Ltd. Chichester, England",
      "scopus-id": "84887081300",
      "coredata": {
        "eid": "1-s2.0-S1381116913003786",
        "dc:description": "A systematic study on copper(II) as catalyst for the synthesis of glycerol carbonate via oxidative carbonylation is here reported for the first time. Copper(II) chloride has been found to efficiently promote the process under homogeneous conditions treating glycerol with CO:O2 (P tot =4MPa; P (O2) =0.7MPa), in DMA at 130°C and in the presence of pyridine as co-catalyst. Excellent conversions (>92%) and selectivities (>93%) are obtained in relatively short reaction times (3–4h) also with copper(II) complexes. The catalyst overall TON is evaluated and new experimental evidences are provided allowing significant advancements in the mechanism comprehension.",
        "openArchiveArticle": "false",
        "prism:coverDate": "2014-01-31",
        "openaccessUserLicense": null,
        "prism:aggregationType": "Journal",
        "prism:url": "https://api.elsevier.com/content/article/pii/S1381116913003786",
        "dc:creator": [
          {
            "@_fa": "true",
            "$": "Casiello, Michele"
          },
          {
            "@_fa": "true",
            "$": "Monopoli, Antonio"
          },
          {
            "@_fa": "true",
            "$": "Cotugno, Pietro"
          },
          {
            "@_fa": "true",
            "$": "Milella, Antonella"
          },
          {
            "@_fa": "true",
            "$": "Dell’Anna, Maria Michela"
          },
          {
            "@_fa": "true",
            "$": "Ciminale, Francesco"
          },
          {
            "@_fa": "true",
            "$": "Nacci, Angelo"
          }
        ],
        "link": [
          {
            "@_fa": "true",
            "@rel": "self",
            "@href": "https://api.elsevier.com/content/article/pii/S1381116913003786"
          },
          {
            "@_fa": "true",
            "@rel": "scidir",
            "@href": "https://www.sciencedirect.com/science/article/pii/S1381116913003786"
          }
        ],
        "dc:format": "application/json",
        "openaccessType": null,
        "pii": "S1381-1169(13)00378-6",
        "prism:volume": "381",
        "prism:publisher": "Elsevier B.V.",
        "dc:title": "Copper(II) chloride-catalyzed oxidative carbonylation of glycerol to glycerol carbonate",
        "prism:copyright": "Copyright © 2013 Elsevier B.V. All rights reserved.",
        "openaccess": "0",
        "prism:issn": "13811169",
        "dcterms:subject": [
          {
            "@_fa": "true",
            "$": "Oxidative carbonylation"
          },
          {
            "@_fa": "true",
            "$": "Copper halides"
          },
          {
            "@_fa": "true",
            "$": "Glycerol carbonates"
          },
          {
            "@_fa": "true",
            "$": "Mechanistic study"
          }
        ],
        "openaccessArticle": "false",
        "prism:publicationName": "Journal of Molecular Catalysis A: Chemical",
        "openaccessSponsorType": null,
        "prism:pageRange": "99-106",
        "prism:endingPage": "106",
        "pubType": "fla",
        "prism:coverDisplayDate": "January 2014",
        "prism:doi": "10.1016/j.molcata.2013.10.006",
        "prism:startingPage": "99",
        "dc:identifier": "doi:10.1016/j.molcata.2013.10.006",
        "openaccessSponsorName": null
      },
      "objects": {
        "object": [
          {
            "@category": "high",
            "@height": "2120",
            "@width": "2001",
            "@_fa": "true",
            "$": "https://api.elsevier.com/content/object/eid/1-s2.0-S1381116913003786-gr4_lrg.jpg?httpAccept=%2A%2F%2A",
            "@multimediatype": "JPEG image file",
            "@type": "IMAGE-HIGH-RES",
            "@size": "210265",
            "@ref": "gr4",
            "@mimetype": "image/jpeg"
          },
          {
            "@category": "high",
            "@height": "1296",
            "@width": "1587",
            "@_fa": "true",
            "$": "https://api.elsevier.com/content/object/eid/1-s2.0-S1381116913003786-gr3_lrg.jpg?httpAccept=%2A%2F%2A",
            "@multimediatype": "JPEG image file",
            "@type": "IMAGE-HIGH-RES",
            "@size": "105587",
            "@ref": "gr3",
            "@mimetype": "image/jpeg"
          },
          {
            "@category": "high",
            "@height": "460",
            "@width": "1734",
            "@_fa": "true",
            "$": "https://api.elsevier.com/content/object/eid/1-s2.0-S1381116913003786-gr2_lrg.jpg?httpAccept=%2A%2F%2A",
            "@multimediatype": "JPEG image file",
            "@type": "IMAGE-HIGH-RES",
            "@size": "74664",
            "@ref": "gr2",
            "@mimetype": "image/jpeg"
          },
          {
            "@category": "high",
            "@height": "2726",
            "@width": "1327",
            "@_fa": "true",
            "$": "https://api.elsevier.com/content/object/eid/1-s2.0-S1381116913003786-gr1_lrg.jpg?httpAccept=%2A%2F%2A",
            "@multimediatype": "JPEG image file",
            "@type": "IMAGE-HIGH-RES",
            "@size": "310524",
            "@ref": "gr1",
            "@mimetype": "image/jpeg"
          },
          {
            "@category": "high",
            "@height": "886",
            "@width": "1401",
            "@_fa": "true",
            "$": "https://api.elsevier.com/content/object/eid/1-s2.0-S1381116913003786-fx9_lrg.jpg?httpAccept=%2A%2F%2A",
            "@multimediatype": "JPEG image file",
            "@type": "IMAGE-HIGH-RES",
            "@size": "58529",
            "@ref": "fx9",
            "@mimetype": "image/jpeg"
          },
          {
            "@category": "high",
            "@height": "860",
            "@width": "2213",
            "@_fa": "true",
            "$": "https://api.elsevier.com/content/object/eid/1-s2.0-S1381116913003786-fx8_lrg.jpg?httpAccept=%2A%2F%2A",
            "@multimediatype": "JPEG image file",
            "@type": "IMAGE-HIGH-RES",
            "@size": "92162",
            "@ref": "fx8",
            "@mimetype": "image/jpeg"
          },
          {
            "@category": "high",
            "@height": "886",
            "@width": "1466",
            "@_fa": "true",
            "$": "https://api.elsevier.com/content/object/eid/1-s2.0-S1381116913003786-fx7_lrg.jpg?httpAccept=%2A%2F%2A",
            "@multimediatype": "JPEG image file",
            "@type": "IMAGE-HIGH-RES",
            "@size": "55721",
            "@ref": "fx7",
            "@mimetype": "image/jpeg"
          },
          {
            "@category": "high",
            "@height": "886",
            "@width": "1978",
            "@_fa": "true",
            "$": "https://api.elsevier.com/content/object/eid/1-s2.0-S1381116913003786-fx6_lrg.jpg?httpAccept=%2A%2F%2A",
            "@multimediatype": "JPEG image file",
            "@type": "IMAGE-HIGH-RES",
            "@size": "84923",
            "@ref": "fx6",
            "@mimetype": "image/jpeg"
          },
          {
            "@category": "high",
            "@height": "886",
            "@width": "1755",
            "@_fa": "true",
            "$": "https://api.elsevier.com/content/object/eid/1-s2.0-S1381116913003786-fx5_lrg.jpg?httpAccept=%2A%2F%2A",
            "@multimediatype": "JPEG image file",
            "@type": "IMAGE-HIGH-RES",
            "@size": "76257",
            "@ref": "fx5",
            "@mimetype": "image/jpeg"
          },
          {
            "@category": "high",
            "@height": "886",
            "@width": "1223",
            "@_fa": "true",
            "$": "https://api.elsevier.com/content/object/eid/1-s2.0-S1381116913003786-fx4_lrg.jpg?httpAccept=%2A%2F%2A",
            "@multimediatype": "JPEG image file",
            "@type": "IMAGE-HIGH-RES",
            "@size": "56683",
            "@ref": "fx4",
            "@mimetype": "image/jpeg"
          },
          {
            "@category": "high",
            "@height": "886",
            "@width": "1699",
            "@_fa": "true",
            "$": "https://api.elsevier.com/content/object/eid/1-s2.0-S1381116913003786-fx3_lrg.jpg?httpAccept=%2A%2F%2A",
            "@multimediatype": "JPEG image file",
            "@type": "IMAGE-HIGH-RES",
            "@size": "70682",
            "@ref": "fx3",
            "@mimetype": "image/jpeg"
          },
          {
            "@category": "high",
            "@height": "250",
            "@width": "2213",
            "@_fa": "true",
            "$": "https://api.elsevier.com/content/object/eid/1-s2.0-S1381116913003786-fx2_lrg.jpg?httpAccept=%2A%2F%2A",
            "@multimediatype": "JPEG image file",
            "@type": "IMAGE-HIGH-RES",
            "@size": "33713",
            "@ref": "fx2",
            "@mimetype": "image/jpeg"
          },
          {
            "@category": "high",
            "@height": "463",
            "@width": "2213",
            "@_fa": "true",
            "$": "https://api.elsevier.com/content/object/eid/1-s2.0-S1381116913003786-fx17_lrg.jpg?httpAccept=%2A%2F%2A",
            "@multimediatype": "JPEG image file",
            "@type": "IMAGE-HIGH-RES",
            "@size": "74773",
            "@ref": "fx17",
            "@mimetype": "image/jpeg"
          },
          {
            "@category": "high",
            "@height": "421",
            "@width": "2213",
            "@_fa": "true",
            "$": "https://api.elsevier.com/content/object/eid/1-s2.0-S1381116913003786-fx16_lrg.jpg?httpAccept=%2A%2F%2A",
            "@multimediatype": "JPEG image file",
            "@type": "IMAGE-HIGH-RES",
            "@size": "75862",
            "@ref": "fx16",
            "@mimetype": "image/jpeg"
          },
          {
            "@category": "high",
            "@height": "189",
            "@width": "2213",
            "@_fa": "true",
            "$": "https://api.elsevier.com/content/object/eid/1-s2.0-S1381116913003786-fx15_lrg.jpg?httpAccept=%2A%2F%2A",
            "@multimediatype": "JPEG image file",
            "@type": "IMAGE-HIGH-RES",
            "@size": "41701",
            "@ref": "fx15",
            "@mimetype": "image/jpeg"
          },
          {
            "@category": "high",
            "@height": "295",
            "@width": "2213",
            "@_fa": "true",
            "$": "https://api.elsevier.com/content/object/eid/1-s2.0-S1381116913003786-fx14_lrg.jpg?httpAccept=%2A%2F%2A",
            "@multimediatype": "JPEG image file",
            "@type": "IMAGE-HIGH-RES",
            "@size": "34364",
            "@ref": "fx14",
            "@mimetype": "image/jpeg"
          },
          {
            "@category": "high",
            "@height": "235",
            "@width": "2213",
            "@_fa": "true",
            "$": "https://api.elsevier.com/content/object/eid/1-s2.0-S1381116913003786-fx13_lrg.jpg?httpAccept=%2A%2F%2A",
            "@multimediatype": "JPEG image file",
            "@type": "IMAGE-HIGH-RES",
            "@size": "32124",
            "@ref": "fx13",
            "@mimetype": "image/jpeg"
          },
          {
            "@category": "high",
            "@height": "226",
            "@width": "2213",
            "@_fa": "true",
            "$": "https://api.elsevier.com/content/object/eid/1-s2.0-S1381116913003786-fx12_lrg.jpg?httpAccept=%2A%2F%2A",
            "@multimediatype": "JPEG image file",
            "@type": "IMAGE-HIGH-RES",
            "@size": "28382",
            "@ref": "fx12",
            "@mimetype": "image/jpeg"
          },
          {
            "@category": "high",
            "@height": "301",
            "@width": "2213",
            "@_fa": "true",
            "$": "https://api.elsevier.com/content/object/eid/1-s2.0-S1381116913003786-fx11_lrg.jpg?httpAccept=%2A%2F%2A",
            "@multimediatype": "JPEG image file",
            "@type": "IMAGE-HIGH-RES",
            "@size": "48097",
            "@ref": "fx11",
            "@mimetype": "image/jpeg"
          },
          {
            "@category": "high",
            "@height": "244",
            "@width": "2213",
            "@_fa": "true",
            "$": "https://api.elsevier.com/content/object/eid/1-s2.0-S1381116913003786-fx10_lrg.jpg?httpAccept=%2A%2F%2A",
            "@multimediatype": "JPEG image file",
            "@type": "IMAGE-HIGH-RES",
            "@size": "34952",
            "@ref": "fx10",
            "@mimetype": "image/jpeg"
          },
          {
            "@category": "high",
            "@height": "432",
            "@width": "2213",
            "@_fa": "true",
            "$": "https://api.elsevier.com/content/object/eid/1-s2.0-S1381116913003786-fx1_lrg.jpg?httpAccept=%2A%2F%2A",
            "@multimediatype": "JPEG image file",
            "@type": "IMAGE-HIGH-RES",
            "@size": "68378",
            "@ref": "fx1",
            "@mimetype": "image/jpeg"
          },
          {
            "@category": "standard",
            "@height": "479",
            "@width": "452",
            "@_fa": "true",
            "$": "https://api.elsevier.com/content/object/eid/1-s2.0-S1381116913003786-gr4.jpg?httpAccept=%2A%2F%2A",
            "@multimediatype": "JPEG image file",
            "@type": "IMAGE-DOWNSAMPLED",
            "@size": "26412",
            "@ref": "gr4",
            "@mimetype": "image/jpeg"
          },
          {
            "@category": "standard",
            "@height": "292",
            "@width": "358",
            "@_fa": "true",
            "$": "https://api.elsevier.com/content/object/eid/1-s2.0-S1381116913003786-gr3.jpg?httpAccept=%2A%2F%2A",
            "@multimediatype": "JPEG image file",
            "@type": "IMAGE-DOWNSAMPLED",
            "@size": "14208",
            "@ref": "gr3",
            "@mimetype": "image/jpeg"
          },
          {
            "@category": "standard",
            "@height": "104",
            "@width": "391",
            "@_fa": "true",
            "$": "https://api.elsevier.com/content/object/eid/1-s2.0-S1381116913003786-gr2.jpg?httpAccept=%2A%2F%2A",
            "@multimediatype": "JPEG image file",
            "@type": "IMAGE-DOWNSAMPLED",
            "@size": "9429",
            "@ref": "gr2",
            "@mimetype": "image/jpeg"
          },
          {
            "@category": "standard",
            "@height": "614",
            "@width": "299",
            "@_fa": "true",
            "$": "https://api.elsevier.com/content/object/eid/1-s2.0-S1381116913003786-gr1.jpg?httpAccept=%2A%2F%2A",
            "@multimediatype": "JPEG image file",
            "@type": "IMAGE-DOWNSAMPLED",
            "@size": "43966",
            "@ref": "gr1",
            "@mimetype": "image/jpeg"
          },
          {
            "@category": "standard",
            "@height": "200",
            "@width": "316",
            "@_fa": "true",
            "$": "https://api.elsevier.com/content/object/eid/1-s2.0-S1381116913003786-fx9.jpg?httpAccept=%2A%2F%2A",
            "@multimediatype": "JPEG image file",
            "@type": "IMAGE-DOWNSAMPLED",
            "@size": "7778",
            "@ref": "fx9",
            "@mimetype": "image/jpeg"
          },
          {
            "@category": "standard",
            "@height": "194",
            "@width": "500",
            "@_fa": "true",
            "$": "https://api.elsevier.com/content/object/eid/1-s2.0-S1381116913003786-fx8.jpg?httpAccept=%2A%2F%2A",
            "@multimediatype": "JPEG image file",
            "@type": "IMAGE-DOWNSAMPLED",
            "@size": "12333",
            "@ref": "fx8",
            "@mimetype": "image/jpeg"
          },
          {
            "@category": "standard",
            "@height": "200",
            "@width": "331",
            "@_fa": "true",
            "$": "https://api.elsevier.com/content/object/eid/1-s2.0-S1381116913003786-fx7.jpg?httpAccept=%2A%2F%2A",
            "@multimediatype": "JPEG image file",
            "@type": "IMAGE-DOWNSAMPLED",
            "@size": "7545",
            "@ref": "fx7",
            "@mimetype": "image/jpeg"
          },
          {
            "@category": "standard",
            "@height": "200",
            "@width": "447",
            "@_fa": "true",
            "$": "https://api.elsevier.com/content/object/eid/1-s2.0-S1381116913003786-fx6.jpg?httpAccept=%2A%2F%2A",
            "@multimediatype": "JPEG image file",
            "@type": "IMAGE-DOWNSAMPLED",
            "@size": "11484",
            "@ref": "fx6",
            "@mimetype": "image/jpeg"
          },
          {
            "@category": "standard",
            "@height": "200",
            "@width": "396",
            "@_fa": "true",
            "$": "https://api.elsevier.com/content/object/eid/1-s2.0-S1381116913003786-fx5.jpg?httpAccept=%2A%2F%2A",
            "@multimediatype": "JPEG image file",
            "@type": "IMAGE-DOWNSAMPLED",
            "@size": "10440",
            "@ref": "fx5",
            "@mimetype": "image/jpeg"
          },
          {
            "@category": "standard",
            "@height": "200",
            "@width": "276",
            "@_fa": "true",
            "$": "https://api.elsevier.com/content/object/eid/1-s2.0-S1381116913003786-fx4.jpg?httpAccept=%2A%2F%2A",
            "@multimediatype": "JPEG image file",
            "@type": "IMAGE-DOWNSAMPLED",
            "@size": "7899",
            "@ref": "fx4",
            "@mimetype": "image/jpeg"
          },
          {
            "@category": "standard",
            "@height": "200",
            "@width": "383",
            "@_fa": "true",
            "$": "https://api.elsevier.com/content/object/eid/1-s2.0-S1381116913003786-fx3.jpg?httpAccept=%2A%2F%2A",
            "@multimediatype": "JPEG image file",
            "@type": "IMAGE-DOWNSAMPLED",
            "@size": "9310",
            "@ref": "fx3",
            "@mimetype": "image/jpeg"
          },
          {
            "@category": "standard",
            "@height": "56",
            "@width": "500",
            "@_fa": "true",
            "$": "https://api.elsevier.com/content/object/eid/1-s2.0-S1381116913003786-fx2.jpg?httpAccept=%2A%2F%2A",
            "@multimediatype": "JPEG image file",
            "@type": "IMAGE-DOWNSAMPLED",
            "@size": "4983",
            "@ref": "fx2",
            "@mimetype": "image/jpeg"
          },
          {
            "@category": "standard",
            "@height": "105",
            "@width": "500",
            "@_fa": "true",
            "$": "https://api.elsevier.com/content/object/eid/1-s2.0-S1381116913003786-fx17.jpg?httpAccept=%2A%2F%2A",
            "@multimediatype": "JPEG image file",
            "@type": "IMAGE-DOWNSAMPLED",
            "@size": "10935",
            "@ref": "fx17",
            "@mimetype": "image/jpeg"
          },
          {
            "@category": "standard",
            "@height": "95",
            "@width": "500",
            "@_fa": "true",
            "$": "https://api.elsevier.com/content/object/eid/1-s2.0-S1381116913003786-fx16.jpg?httpAccept=%2A%2F%2A",
            "@multimediatype": "JPEG image file",
            "@type": "IMAGE-DOWNSAMPLED",
            "@size": "10773",
            "@ref": "fx16",
            "@mimetype": "image/jpeg"
          },
          {
            "@category": "standard",
            "@height": "43",
            "@width": "500",
            "@_fa": "true",
            "$": "https://api.elsevier.com/content/object/eid/1-s2.0-S1381116913003786-fx15.jpg?httpAccept=%2A%2F%2A",
            "@multimediatype": "JPEG image file",
            "@type": "IMAGE-DOWNSAMPLED",
            "@size": "6173",
            "@ref": "fx15",
            "@mimetype": "image/jpeg"
          },
          {
            "@category": "standard",
            "@height": "67",
            "@width": "500",
            "@_fa": "true",
            "$": "https://api.elsevier.com/content/object/eid/1-s2.0-S1381116913003786-fx14.jpg?httpAccept=%2A%2F%2A",
            "@multimediatype": "JPEG image file",
            "@type": "IMAGE-DOWNSAMPLED",
            "@size": "4969",
            "@ref": "fx14",
            "@mimetype": "image/jpeg"
          },
          {
            "@category": "standard",
            "@height": "53",
            "@width": "500",
            "@_fa": "true",
            "$": "https://api.elsevier.com/content/object/eid/1-s2.0-S1381116913003786-fx13.jpg?httpAccept=%2A%2F%2A",
            "@multimediatype": "JPEG image file",
            "@type": "IMAGE-DOWNSAMPLED",
            "@size": "4917",
            "@ref": "fx13",
            "@mimetype": "image/jpeg"
          },
          {
            "@category": "standard",
            "@height": "51",
            "@width": "500",
            "@_fa": "true",
            "$": "https://api.elsevier.com/content/object/eid/1-s2.0-S1381116913003786-fx12.jpg?httpAccept=%2A%2F%2A",
            "@multimediatype": "JPEG image file",
            "@type": "IMAGE-DOWNSAMPLED",
            "@size": "4212",
            "@ref": "fx12",
            "@mimetype": "image/jpeg"
          },
          {
            "@category": "standard",
            "@height": "68",
            "@width": "500",
            "@_fa": "true",
            "$": "https://api.elsevier.com/content/object/eid/1-s2.0-S1381116913003786-fx11.jpg?httpAccept=%2A%2F%2A",
            "@multimediatype": "JPEG image file",
            "@type": "IMAGE-DOWNSAMPLED",
            "@size": "6448",
            "@ref": "fx11",
            "@mimetype": "image/jpeg"
          },
          {
            "@category": "standard",
            "@height": "55",
            "@width": "500",
            "@_fa": "true",
            "$": "https://api.elsevier.com/content/object/eid/1-s2.0-S1381116913003786-fx10.jpg?httpAccept=%2A%2F%2A",
            "@multimediatype": "JPEG image file",
            "@type": "IMAGE-DOWNSAMPLED",
            "@size": "5052",
            "@ref": "fx10",
            "@mimetype": "image/jpeg"
          },
          {
            "@category": "standard",
            "@height": "98",
            "@width": "500",
            "@_fa": "true",
            "$": "https://api.elsevier.com/content/object/eid/1-s2.0-S1381116913003786-fx1.jpg?httpAccept=%2A%2F%2A",
            "@multimediatype": "JPEG image file",
            "@type": "IMAGE-DOWNSAMPLED",
            "@size": "10301",
            "@ref": "fx1",
            "@mimetype": "image/jpeg"
          },
          {
            "@category": "thumbnail",
            "@height": "164",
            "@width": "155",
            "@_fa": "true",
            "$": "https://api.elsevier.com/content/object/eid/1-s2.0-S1381116913003786-gr4.sml?httpAccept=%2A%2F%2A",
            "@multimediatype": "GIF image file",
            "@type": "IMAGE-THUMBNAIL",
            "@size": "2871",
            "@ref": "gr4",
            "@mimetype": "image/gif"
          },
          {
            "@category": "thumbnail",
            "@height": "164",
            "@width": "201",
            "@_fa": "true",
            "$": "https://api.elsevier.com/content/object/eid/1-s2.0-S1381116913003786-gr3.sml?httpAccept=%2A%2F%2A",
            "@multimediatype": "GIF image file",
            "@type": "IMAGE-THUMBNAIL",
            "@size": "3455",
            "@ref": "gr3",
            "@mimetype": "image/gif"
          },
          {
            "@category": "thumbnail",
            "@height": "58",
            "@width": "219",
            "@_fa": "true",
            "$": "https://api.elsevier.com/content/object/eid/1-s2.0-S1381116913003786-gr2.sml?httpAccept=%2A%2F%2A",
            "@multimediatype": "GIF image file",
            "@type": "IMAGE-THUMBNAIL",
            "@size": "2454",
            "@ref": "gr2",
            "@mimetype": "image/gif"
          },
          {
            "@category": "thumbnail",
            "@height": "162",
            "@width": "79",
            "@_fa": "true",
            "$": "https://api.elsevier.com/content/object/eid/1-s2.0-S1381116913003786-gr1.sml?httpAccept=%2A%2F%2A",
            "@multimediatype": "GIF image file",
            "@type": "IMAGE-THUMBNAIL",
            "@size": "2875",
            "@ref": "gr1",
            "@mimetype": "image/gif"
          },
          {
            "@category": "thumbnail",
            "@height": "138",
            "@width": "219",
            "@_fa": "true",
            "$": "https://api.elsevier.com/content/object/eid/1-s2.0-S1381116913003786-fx9.sml?httpAccept=%2A%2F%2A",
            "@multimediatype": "GIF image file",
            "@type": "IMAGE-THUMBNAIL",
            "@size": "3307",
            "@ref": "fx9",
            "@mimetype": "image/gif"
          },
          {
            "@category": "thumbnail",
            "@height": "85",
            "@width": "219",
            "@_fa": "true",
            "$": "https://api.elsevier.com/content/object/eid/1-s2.0-S1381116913003786-fx8.sml?httpAccept=%2A%2F%2A",
            "@multimediatype": "GIF image file",
            "@type": "IMAGE-THUMBNAIL",
            "@size": "2848",
            "@ref": "fx8",
            "@mimetype": "image/gif"
          },
          {
            "@category": "thumbnail",
            "@height": "132",
            "@width": "219",
            "@_fa": "true",
            "$": "https://api.elsevier.com/content/object/eid/1-s2.0-S1381116913003786-fx7.sml?httpAccept=%2A%2F%2A",
            "@multimediatype": "GIF image file",
            "@type": "IMAGE-THUMBNAIL",
            "@size": "3311",
            "@ref": "fx7",
            "@mimetype": "image/gif"
          },
          {
            "@category": "thumbnail",
            "@height": "98",
            "@width": "219",
            "@_fa": "true",
            "$": "https://api.elsevier.com/content/object/eid/1-s2.0-S1381116913003786-fx6.sml?httpAccept=%2A%2F%2A",
            "@multimediatype": "GIF image file",
            "@type": "IMAGE-THUMBNAIL",
            "@size": "2985",
            "@ref": "fx6",
            "@mimetype": "image/gif"
          },
          {
            "@category": "thumbnail",
            "@height": "111",
            "@width": "219",
            "@_fa": "true",
            "$": "https://api.elsevier.com/content/object/eid/1-s2.0-S1381116913003786-fx5.sml?httpAccept=%2A%2F%2A",
            "@multimediatype": "GIF image file",
            "@type": "IMAGE-THUMBNAIL",
            "@size": "3131",
            "@ref": "fx5",
            "@mimetype": "image/gif"
          },
          {
            "@category": "thumbnail",
            "@height": "159",
            "@width": "219",
            "@_fa": "true",
            "$": "https://api.elsevier.com/content/object/eid/1-s2.0-S1381116913003786-fx4.sml?httpAccept=%2A%2F%2A",
            "@multimediatype": "GIF image file",
            "@type": "IMAGE-THUMBNAIL",
            "@size": "3823",
            "@ref": "fx4",
            "@mimetype": "image/gif"
          },
          {
            "@category": "thumbnail",
            "@height": "114",
            "@width": "219",
            "@_fa": "true",
            "$": "https://api.elsevier.com/content/object/eid/1-s2.0-S1381116913003786-fx3.sml?httpAccept=%2A%2F%2A",
            "@multimediatype": "GIF image file",
            "@type": "IMAGE-THUMBNAIL",
            "@size": "3039",
            "@ref": "fx3",
            "@mimetype": "image/gif"
          },
          {
            "@category": "thumbnail",
            "@height": "25",
            "@width": "219",
            "@_fa": "true",
            "$": "https://api.elsevier.com/content/object/eid/1-s2.0-S1381116913003786-fx2.sml?httpAccept=%2A%2F%2A",
            "@multimediatype": "GIF image file",
            "@type": "IMAGE-THUMBNAIL",
            "@size": "1429",
            "@ref": "fx2",
            "@mimetype": "image/gif"
          },
          {
            "@category": "thumbnail",
            "@height": "46",
            "@width": "219",
            "@_fa": "true",
            "$": "https://api.elsevier.com/content/object/eid/1-s2.0-S1381116913003786-fx17.sml?httpAccept=%2A%2F%2A",
            "@multimediatype": "GIF image file",
            "@type": "IMAGE-THUMBNAIL",
            "@size": "2344",
            "@ref": "fx17",
            "@mimetype": "image/gif"
          },
          {
            "@category": "thumbnail",
            "@height": "42",
            "@width": "219",
            "@_fa": "true",
            "$": "https://api.elsevier.com/content/object/eid/1-s2.0-S1381116913003786-fx16.sml?httpAccept=%2A%2F%2A",
            "@multimediatype": "GIF image file",
            "@type": "IMAGE-THUMBNAIL",
            "@size": "2320",
            "@ref": "fx16",
            "@mimetype": "image/gif"
          },
          {
            "@category": "thumbnail",
            "@height": "19",
            "@width": "219",
            "@_fa": "true",
            "$": "https://api.elsevier.com/content/object/eid/1-s2.0-S1381116913003786-fx15.sml?httpAccept=%2A%2F%2A",
            "@multimediatype": "GIF image file",
            "@type": "IMAGE-THUMBNAIL",
            "@size": "1517",
            "@ref": "fx15",
            "@mimetype": "image/gif"
          },
          {
            "@category": "thumbnail",
            "@height": "29",
            "@width": "219",
            "@_fa": "true",
            "$": "https://api.elsevier.com/content/object/eid/1-s2.0-S1381116913003786-fx14.sml?httpAccept=%2A%2F%2A",
            "@multimediatype": "GIF image file",
            "@type": "IMAGE-THUMBNAIL",
            "@size": "1437",
            "@ref": "fx14",
            "@mimetype": "image/gif"
          },
          {
            "@category": "thumbnail",
            "@height": "23",
            "@width": "219",
            "@_fa": "true",
            "$": "https://api.elsevier.com/content/object/eid/1-s2.0-S1381116913003786-fx13.sml?httpAccept=%2A%2F%2A",
            "@multimediatype": "GIF image file",
            "@type": "IMAGE-THUMBNAIL",
            "@size": "1367",
            "@ref": "fx13",
            "@mimetype": "image/gif"
          },
          {
            "@category": "thumbnail",
            "@height": "22",
            "@width": "219",
            "@_fa": "true",
            "$": "https://api.elsevier.com/content/object/eid/1-s2.0-S1381116913003786-fx12.sml?httpAccept=%2A%2F%2A",
            "@multimediatype": "GIF image file",
            "@type": "IMAGE-THUMBNAIL",
            "@size": "1342",
            "@ref": "fx12",
            "@mimetype": "image/gif"
          },
          {
            "@category": "thumbnail",
            "@height": "30",
            "@width": "219",
            "@_fa": "true",
            "$": "https://api.elsevier.com/content/object/eid/1-s2.0-S1381116913003786-fx11.sml?httpAccept=%2A%2F%2A",
            "@multimediatype": "GIF image file",
            "@type": "IMAGE-THUMBNAIL",
            "@size": "1608",
            "@ref": "fx11",
            "@mimetype": "image/gif"
          },
          {
            "@category": "thumbnail",
            "@height": "24",
            "@width": "219",
            "@_fa": "true",
            "$": "https://api.elsevier.com/content/object/eid/1-s2.0-S1381116913003786-fx10.sml?httpAccept=%2A%2F%2A",
            "@multimediatype": "GIF image file",
            "@type": "IMAGE-THUMBNAIL",
            "@size": "1442",
            "@ref": "fx10",
            "@mimetype": "image/gif"
          },
          {
            "@category": "thumbnail",
            "@height": "43",
            "@width": "219",
            "@_fa": "true",
            "$": "https://api.elsevier.com/content/object/eid/1-s2.0-S1381116913003786-fx1.sml?httpAccept=%2A%2F%2A",
            "@multimediatype": "GIF image file",
            "@type": "IMAGE-THUMBNAIL",
            "@size": "2265",
            "@ref": "fx1",
            "@mimetype": "image/gif"
          }
        ]
      },
      "link": {
        "@rel": "abstract",
        "@href": "https://api.elsevier.com/content/abstract/scopus_id/84887081300"
      }
    }
  }
}